2026-06-23 06:54:06,634 - optuna.study.study - INFO - Trial 19 finished with values: [0.028195100173620872, 0.006083428066186688, 0.016466342359943816] and parameters: {'n_layers': 1, 'embedding_dim': 96, 'lr': 0.0017924637075651337, 'lambda_val': 0.0009938480250443395, 'batch_size': 1976, 'optimizer': 'RMSprop'}.
2026-06-23 06:54:47,358 - experiment_functions - INFO - Early stopping at epoch 850. Best Metrics: (0.0005399890691720918, 0.00010894278135657445, 0.0002836216773976649)
2026-06-23 06:54:47,474 - optuna.study.study - INFO - Trial 20 finished with values: [0.0005399890691720918, 0.00010894278135657445, 0.0002836216773976649] and parameters: {'n_layers': 2, 'embedding_dim': 128, 'lr': 1.739856646005163e-05, 'lambda_val': 0.00015550933659358874, 'batch_size': 651, 'optimizer': 'Adam'}.
2026-06-23 06:55:23,179 - experiment_functions - INFO - Early stopping at epoch 800. Best Metrics: (0.0005483090235983184, 0.0001231527093596059, 0.0002980988681959475)
2026-06-23 06:55:23,500 - optuna.study.study - INFO - Trial 21 finished with values: [0.0005483090235983184, 0.0001231527093596059, 0.0002980988681959475] and parameters: {'n_layers': 1, 'embedding_dim': 96, 'lr': 5.8156593738198984e-05, 'lambda_val': 0.0007523973321775693, 'batch_size': 3318, 'optimizer': 'RMSprop'}.
2026-06-23 06:59:02,515 - optuna.study.study - INFO - Trial 22 finished with values: [0.030034003354969547, 0.006342364532019704, 0.017014462948475587] and parameters: {'n_layers': 2, 'embedding_dim': 256, 'lr': 0.00037748801596819556, 'lambda_val': 0.0001268815967640493, 'batch_size': 3090, 'optimizer': 'Adam'}.
2026-06-23 06:59:27,167 - experiment_functions - INFO - Early stopping at epoch 500. Best Metrics: (0.0005650654983522245, 0.00013262599469496023, 0.00029875070349936865)
2026-06-23 06:59:27,268 - optuna.study.study - INFO - Trial 23 finished with values: [0.0005650654983522245, 0.00013262599469496023, 0.00029875070349936865] and parameters: {'n_layers': 2, 'embedding_dim': 128, 'lr': 0.0003681355466910888, 'lambda_val': 6.789699211207431e-05, 'batch_size': 1781, 'optimizer': 'SGD'}.
2026-06-23 07:00:18,525 - experiment_functions - INFO - Early stopping at epoch 1100. Best Metrics: (0.031133074383244964, 0.0065965643551850455, 0.017984370705076948)
2026-06-23 07:00:18,623 - optuna.study.study - INFO - Trial 24 finished with values: [0.031133074383244964, 0.0065965643551850455, 0.017984370705076948] and parameters: {'n_layers': 1, 'embedding_dim': 128, 'lr': 0.0016017140638771422, 'lambda_val': 3.447042784972302e-05, 'batch_size': 3253, 'optimizer': 'Adam'}.
2026-06-23 07:00:41,678 - experiment_functions - INFO - Early stopping at epoch 500. Best Metrics: (0.0006322711314153885, 0.00014525704180876596, 0.00034721654909226045)
2026-06-23 07:00:41,784 - optuna.study.study - INFO - Trial 25 finished with values: [0.0006322711314153885, 0.00014525704180876596, 0.00034721654909226045] and parameters: {'n_layers': 4, 'embedding_dim': 32, 'lr': 0.002568897648085955, 'lambda_val': 6.691092523769437e-05, 'batch_size': 2491, 'optimizer': 'SGD'}.
2026-06-23 07:01:07,836 - experiment_functions - INFO - Early stopping at epoch 500. Best Metrics: (0.000569106185281639, 0.00011841606669192877, 0.00029587521592613106)
2026-06-23 07:01:07,964 - optuna.study.study - INFO - Trial 26 finished with values: [0.000569106185281639, 0.00011841606669192877, 0.00029587521592613106] and parameters: {'n_layers': 4, 'embedding_dim': 96, 'lr': 0.07701072537025917, 'lambda_val': 0.017542734749765216, 'batch_size': 1382, 'optimizer': 'SGD'}.
2026-06-23 07:04:00,099 - optuna.study.study - INFO - Trial 27 finished with values: [0.008382482202946816, 0.0019720222306429205, 0.004768477441582602] and parameters: {'n_layers': 1, 'embedding_dim': 128, 'lr': 0.08191065769636731, 'lambda_val': 0.010784380696272572, 'batch_size': 3245, 'optimizer': 'RMSprop'}.
2026-06-23 07:04:25,031 - experiment_functions - INFO - Early stopping at epoch 500. Best Metrics: (0.0006141055023183703, 0.0001373626373626374, 0.0003422373874251186)
2026-06-23 07:04:25,134 - optuna.study.study - INFO - Trial 28 finished with values: [0.0006141055023183703, 0.0001373626373626374, 0.0003422373874251186] and parameters: {'n_layers': 3, 'embedding_dim': 96, 'lr': 0.007840414247451329, 'lambda_val': 6.248411324083802e-05, 'batch_size': 3076, 'optimizer': 'SGD'}.
2026-06-23 07:04:55,803 - experiment_functions - INFO - Early stopping at epoch 500. Best Metrics: (0.0005790293192261618, 0.0001310471138057345, 0.0003374655804011029)
2026-06-23 07:04:55,934 - optuna.study.study - INFO - Trial 29 finished with values: [0.0005790293192261618, 0.0001310471138057345, 0.0003374655804011029] and parameters: {'n_layers': 3, 'embedding_dim': 256, 'lr': 0.0002803639013819468, 'lambda_val': 2.3368334804270076e-06, 'batch_size': 1116, 'optimizer': 'SGD'}.
2026-06-23 07:05:20,763 - experiment_functions - INFO - Early stopping at epoch 550. Best Metrics: (0.0004737562409158195, 0.00012473159024883163, 0.00026020384647536113)
2026-06-23 07:05:20,864 - optuna.study.study - INFO - Trial 30 finished with values: [0.0004737562409158195, 0.00012473159024883163, 0.00026020384647536113] and parameters: {'n_layers': 1, 'embedding_dim': 96, 'lr': 0.08481834433327279, 'lambda_val': 6.6226109146804075e-06, 'batch_size': 3449, 'optimizer': 'SGD'}.
2026-06-23 07:05:43,452 - experiment_functions - INFO - Early stopping at epoch 500. Best Metrics: (0.0007363971074470261, 0.0001389415182518631, 0.0003795620337896915)
2026-06-23 07:05:43,560 - optuna.study.study - INFO - Trial 31 finished with values: [0.0007363971074470261, 0.0001389415182518631, 0.0003795620337896915] and parameters: {'n_layers': 3, 'embedding_dim': 32, 'lr': 0.09178274997424292, 'lambda_val': 2.2232566319932877e-05, 'batch_size': 852, 'optimizer': 'SGD'}.
2026-06-23 07:06:09,795 - experiment_functions - INFO - Early stopping at epoch 500. Best Metrics: (0.0005270000004113391, 0.00012157382847038019, 0.00030006276509937445)
2026-06-23 07:06:10,160 - optuna.study.study - INFO - Trial 32 finished with values: [0.0005270000004113391, 0.00012157382847038019, 0.00030006276509937445] and parameters: {'n_layers': 4, 'embedding_dim': 96, 'lr': 9.581452991132787e-05, 'lambda_val': 0.015602165207309749, 'batch_size': 2497, 'optimizer': 'Adam'}.
2026-06-23 07:06:32,681 - experiment_functions - INFO - Early stopping at epoch 500. Best Metrics: (0.0005366806255055416, 0.00012473159024883163, 0.00027420619904946987)
2026-06-23 07:06:32,784 - optuna.study.study - INFO - Trial 33 finished with values: [0.0005366806255055416, 0.00012473159024883163, 0.00027420619904946987] and parameters: {'n_layers': 3, 'embedding_dim': 32, 'lr': 0.07457241329188555, 'lambda_val': 0.030765682113552635, 'batch_size': 1157, 'optimizer': 'SGD'}.
2026-06-23 07:07:19,914 - experiment_functions - INFO - Early stopping at epoch 1050. Best Metrics: (0.02761438793868036, 0.006009220664393079, 0.015907103974897942)
2026-06-23 07:07:20,021 - optuna.study.study - INFO - Trial 34 finished with values: [0.02761438793868036, 0.006009220664393079, 0.015907103974897942] and parameters: {'n_layers': 1, 'embedding_dim': 96, 'lr': 0.0017036472251956306, 'lambda_val': 0.005422944155279863, 'batch_size': 1794, 'optimizer': 'Adam'}.
2026-06-23 07:07:51,644 - experiment_functions - INFO - Early stopping at epoch 550. Best Metrics: (0.0062489006787877525, 0.0014209928003031452, 0.0035999217379810754)
2026-06-23 07:07:51,745 - optuna.study.study - INFO - Trial 35 finished with values: [0.0062489006787877525, 0.0014209928003031452, 0.0035999217379810754] and parameters: {'n_layers': 2, 'embedding_dim': 256, 'lr': 0.08428065983831527, 'lambda_val': 1.5553043024267715e-06, 'batch_size': 2813, 'optimizer': 'RMSprop'}.
2026-06-23 07:08:13,715 - experiment_functions - INFO - Early stopping at epoch 500. Best Metrics: (0.0005083048863014605, 0.00013420487558418593, 0.0002948842607330729)
2026-06-23 07:08:13,828 - optuna.study.study - INFO - Trial 36 finished with values: [0.0005083048863014605, 0.00013420487558418593, 0.0002948842607330729] and parameters: {'n_layers': 1, 'embedding_dim': 32, 'lr': 6.389072913939455e-05, 'lambda_val': 2.028396969177707e-06, 'batch_size': 3969, 'optimizer': 'SGD'}.
2026-06-23 07:08:41,713 - experiment_functions - INFO - Early stopping at epoch 550. Best Metrics: (0.012835859609139338, 0.002755147151698876, 0.007308626293050044)
2026-06-23 07:08:41,821 - optuna.study.study - INFO - Trial 37 finished with values: [0.012835859609139338, 0.002755147151698876, 0.007308626293050044] and parameters: {'n_layers': 3, 'embedding_dim': 96, 'lr': 0.0036414628910435656, 'lambda_val': 6.862745359820558e-05, 'batch_size': 1313, 'optimizer': 'RMSprop'}.
2026-06-23 07:09:08,622 - experiment_functions - INFO - Early stopping at epoch 550. Best Metrics: (0.0070768981515064045, 0.0015251989389920423, 0.0038726592076817937)
2026-06-23 07:09:08,725 - optuna.study.study - INFO - Trial 38 finished with values: [0.0070768981515064045, 0.0015251989389920423, 0.0038726592076817937] and parameters: {'n_layers': 2, 'embedding_dim': 96, 'lr': 0.056902708691282625, 'lambda_val': 1.033711147166284e-06, 'batch_size': 2863, 'optimizer': 'Adam'}.
2026-06-23 07:09:31,128 - experiment_functions - INFO - Early stopping at epoch 500. Best Metrics: (0.0004894578269198081, 0.00011683718580270305, 0.0002415872933601968)
2026-06-23 07:09:31,228 - optuna.study.study - INFO - Trial 39 finished with values: [0.0004894578269198081, 0.00011683718580270305, 0.0002415872933601968] and parameters: {'n_layers': 1, 'embedding_dim': 64, 'lr': 0.004902380772226109, 'lambda_val': 0.0030816421745504504, 'batch_size': 3258, 'optimizer': 'SGD'}.
2026-06-23 07:09:59,897 - experiment_functions - INFO - Early stopping at epoch 550. Best Metrics: (0.005975245858865067, 0.0013878363016294052, 0.0033268027282959316)
2026-06-23 07:10:00,006 - optuna.study.study - INFO - Trial 40 finished with values: [0.005975245858865067, 0.0013878363016294052, 0.0033268027282959316] and parameters: {'n_layers': 1, 'embedding_dim': 256, 'lr': 0.057503326001115414, 'lambda_val': 0.0009201977730380695, 'batch_size': 2065, 'optimizer': 'Adam'}.
2026-06-23 07:10:46,303 - experiment_functions - INFO - Early stopping at epoch 900. Best Metrics: (0.02121042271147602, 0.004458759631173424, 0.0120983775978705)
2026-06-23 07:10:46,408 - optuna.study.study - INFO - Trial 41 finished with values: [0.02121042271147602, 0.004458759631173424, 0.0120983775978705] and parameters: {'n_layers': 3, 'embedding_dim': 64, 'lr': 0.0008834137156031282, 'lambda_val': 4.782028134253512e-05, 'batch_size': 3426, 'optimizer': 'RMSprop'}.
2026-06-23 07:11:19,379 - experiment_functions - INFO - Early stopping at epoch 700. Best Metrics: (0.028739387424615553, 0.006127636731085008, 0.01634924135854387)
2026-06-23 07:11:19,559 - optuna.study.study - INFO - Trial 42 finished with values: [0.028739387424615553, 0.006127636731085008, 0.01634924135854387] and parameters: {'n_layers': 1, 'embedding_dim': 128, 'lr': 0.003808349234575029, 'lambda_val': 0.0027380357457200996, 'batch_size': 2469, 'optimizer': 'Adam'}.
2026-06-23 07:11:46,617 - experiment_functions - INFO - Early stopping at epoch 550. Best Metrics: (0.006054704072008841, 0.0012867879247189591, 0.0035226964226627256)
2026-06-23 07:11:46,723 - optuna.study.study - INFO - Trial 43 finished with values: [0.006054704072008841, 0.0012867879247189591, 0.0035226964226627256] and parameters: {'n_layers': 2, 'embedding_dim': 128, 'lr': 0.006681495984053604, 'lambda_val': 0.06837615802363052, 'batch_size': 886, 'optimizer': 'RMSprop'}.
2026-06-23 07:14:35,292 - optuna.study.study - INFO - Trial 44 finished with values: [0.011038673897812929, 0.002616205633447013, 0.00668346162882173] and parameters: {'n_layers': 1, 'embedding_dim': 96, 'lr': 0.0003527730481819595, 'lambda_val': 1.0328809642163819e-05, 'batch_size': 3300, 'optimizer': 'Adam'}.
2026-06-23 07:15:12,271 - experiment_functions - INFO - Early stopping at epoch 850. Best Metrics: (0.024549430822971667, 0.005342932929139827, 0.014320298687325064)
2026-06-23 07:15:12,373 - optuna.study.study - INFO - Trial 45 finished with values: [0.024549430822971667, 0.005342932929139827, 0.014320298687325064] and parameters: {'n_layers': 1, 'embedding_dim': 32, 'lr': 0.003007555350761917, 'lambda_val': 0.0010657666266185159, 'batch_size': 2100, 'optimizer': 'RMSprop'}.
2026-06-23 07:15:38,207 - experiment_functions - INFO - Early stopping at epoch 550. Best Metrics: (0.0005472081391396948, 0.00011683718580270308, 0.00027709770787244146)
2026-06-23 07:15:38,316 - optuna.study.study - INFO - Trial 46 finished with values: [0.0005472081391396948, 0.00011683718580270308, 0.00027709770787244146] and parameters: {'n_layers': 1, 'embedding_dim': 128, 'lr': 3.4333860439728803e-05, 'lambda_val': 0.0003421214333180639, 'batch_size': 820, 'optimizer': 'Adam'}.
2026-06-23 07:18:27,068 - optuna.study.study - INFO - Trial 47 finished with values: [0.012998317228383068, 0.002898825312618416, 0.0071948727722203195] and parameters: {'n_layers': 1, 'embedding_dim': 96, 'lr': 0.02606299813671231, 'lambda_val': 0.0010160497642274552, 'batch_size': 3495, 'optimizer': 'RMSprop'}.
2026-06-23 07:18:51,536 - experiment_functions - INFO - Early stopping at epoch 500. Best Metrics: (0.0006266649251186031, 0.00013262599469496025, 0.0003365791723899399)
2026-06-23 07:18:51,669 - optuna.study.study - INFO - Trial 48 finished with values: [0.0006266649251186031, 0.00013262599469496025, 0.0003365791723899399] and parameters: {'n_layers': 4, 'embedding_dim': 64, 'lr': 0.00018408408177944308, 'lambda_val': 0.006926710855298281, 'batch_size': 3143, 'optimizer': 'SGD'}.
2026-06-23 07:19:16,437 - experiment_functions - INFO - Early stopping at epoch 500. Best Metrics: (0.0005547648548846181, 0.00012473159024883163, 0.00030995137497288677)
2026-06-23 07:19:16,547 - optuna.study.study - INFO - Trial 49 finished with values: [0.0005547648548846181, 0.00012473159024883163, 0.00030995137497288677] and parameters: {'n_layers': 2, 'embedding_dim': 128, 'lr': 0.00018732041623787448, 'lambda_val': 1.916752335729469e-05, 'batch_size': 1258, 'optimizer': 'SGD'}.
2026-06-23 07:19:39,221 - experiment_functions - INFO - Early stopping at epoch 500. Best Metrics: (0.00043745238178968305, 9.157509157509159e-05, 0.0002453581846069225)
2026-06-23 07:19:39,326 - optuna.study.study - INFO - Trial 50 finished with values: [0.00043745238178968305, 9.157509157509159e-05, 0.0002453581846069225] and parameters: {'n_layers': 3, 'embedding_dim': 32, 'lr': 0.00031010998647899147, 'lambda_val': 6.248411324083802e-05, 'batch_size': 786, 'optimizer': 'SGD'}.
2026-06-23 07:20:01,743 - experiment_functions - INFO - Early stopping at epoch 500. Best Metrics: (0.0006236502883326172, 0.0001278893520272831, 0.0003451782128734342)
2026-06-23 07:20:01,856 - optuna.study.study - INFO - Trial 51 finished with values: [0.0006236502883326172, 0.0001278893520272831, 0.0003451782128734342] and parameters: {'n_layers': 3, 'embedding_dim': 32, 'lr': 0.057720714750520645, 'lambda_val': 5.486616122659325e-05, 'batch_size': 2782, 'optimizer': 'SGD'}.
2026-06-23 07:20:28,926 - experiment_functions - INFO - Early stopping at epoch 600. Best Metrics: (0.019055237540297823, 0.004071933813313124, 0.010333234038230601)
2026-06-23 07:20:29,075 - optuna.study.study - INFO - Trial 52 finished with values: [0.019055237540297823, 0.004071933813313124, 0.010333234038230601] and parameters: {'n_layers': 2, 'embedding_dim': 32, 'lr': 0.005823892895958369, 'lambda_val': 0.0006793861457506547, 'batch_size': 2405, 'optimizer': 'Adam'}.
2026-06-23 07:20:51,268 - experiment_functions - INFO - Early stopping at epoch 500. Best Metrics: (0.0005418650435562458, 0.00013736263736263736, 0.00032477419148321324)
2026-06-23 07:20:51,374 - optuna.study.study - INFO - Trial 53 finished with values: [0.0005418650435562458, 0.00013736263736263736, 0.00032477419148321324] and parameters: {'n_layers': 2, 'embedding_dim': 32, 'lr': 0.005823892895958369, 'lambda_val': 0.0006793861457506547, 'batch_size': 3285, 'optimizer': 'SGD'}.
2026-06-23 07:21:30,014 - experiment_functions - INFO - Early stopping at epoch 900. Best Metrics: (0.019432873217839784, 0.004346659088038399, 0.010535454769884527)
2026-06-23 07:21:30,119 - optuna.study.study - INFO - Trial 54 finished with values: [0.019432873217839784, 0.004346659088038399, 0.010535454769884527] and parameters: {'n_layers': 2, 'embedding_dim': 32, 'lr': 0.0009472628048121326, 'lambda_val': 0.019684317126267517, 'batch_size': 3610, 'optimizer': 'Adam'}.
2026-06-23 07:22:08,883 - experiment_functions - INFO - Early stopping at epoch 900. Best Metrics: (0.029702841029389963, 0.006359732221801188, 0.016842978721404316)
2026-06-23 07:22:08,987 - optuna.study.study - INFO - Trial 55 finished with values: [0.029702841029389963, 0.006359732221801188, 0.016842978721404316] and parameters: {'n_layers': 1, 'embedding_dim': 32, 'lr': 0.0024861194796259945, 'lambda_val': 0.0006793861457506547, 'batch_size': 3397, 'optimizer': 'Adam'}.
2026-06-23 07:23:04,026 - experiment_functions - INFO - Early stopping at epoch 1250. Best Metrics: (0.027337894986638613, 0.005947644309713276, 0.015336581794381406)
2026-06-23 07:23:04,174 - optuna.study.study - INFO - Trial 56 finished with values: [0.027337894986638613, 0.005947644309713276, 0.015336581794381406] and parameters: {'n_layers': 1, 'embedding_dim': 96, 'lr': 0.0008834137156031282, 'lambda_val': 0.007151036194229829, 'batch_size': 3129, 'optimizer': 'RMSprop'}.
2026-06-23 07:23:32,697 - experiment_functions - INFO - Early stopping at epoch 550. Best Metrics: (0.00594954738831672, 0.0013815207780725023, 0.0031726386108374594)
2026-06-23 07:23:32,796 - optuna.study.study - INFO - Trial 57 finished with values: [0.00594954738831672, 0.0013815207780725023, 0.0031726386108374594] and parameters: {'n_layers': 1, 'embedding_dim': 256, 'lr': 0.057503326001115414, 'lambda_val': 0.0009201977730380695, 'batch_size': 2065, 'optimizer': 'Adam'}.
2026-06-23 07:23:55,029 - experiment_functions - INFO - Early stopping at epoch 500. Best Metrics: (0.0005143158546566432, 0.00011999494758115448, 0.00029610303531287316)
2026-06-23 07:23:55,183 - optuna.study.study - INFO - Trial 58 finished with values: [0.0005143158546566432, 0.00011999494758115448, 0.00029610303531287316] and parameters: {'n_layers': 2, 'embedding_dim': 32, 'lr': 0.007403758276913583, 'lambda_val': 0.00019730135054936066, 'batch_size': 1798, 'optimizer': 'SGD'}.
2026-06-23 07:24:32,121 - experiment_functions - INFO - Early stopping at epoch 800. Best Metrics: (0.01689372796805164, 0.003670898067449792, 0.009315932542002107)
2026-06-23 07:24:32,248 - optuna.study.study - INFO - Trial 59 finished with values: [0.01689372796805164, 0.003670898067449792, 0.009315932542002107] and parameters: {'n_layers': 1, 'embedding_dim': 128, 'lr': 0.003007555350761917, 'lambda_val': 0.0010657666266185159, 'batch_size': 1781, 'optimizer': 'RMSprop'}.
2026-06-23 07:24:59,511 - experiment_functions - INFO - Early stopping at epoch 550. Best Metrics: (0.002777343765830198, 0.0006662877352532525, 0.0015834346006361984)
2026-06-23 07:24:59,622 - optuna.study.study - INFO - Trial 60 finished with values: [0.002777343765830198, 0.0006662877352532525, 0.0015834346006361984] and parameters: {'n_layers': 2, 'embedding_dim': 128, 'lr': 0.0017924637075651337, 'lambda_val': 0.06837615802363052, 'batch_size': 1976, 'optimizer': 'RMSprop'}.
2026-06-23 07:25:21,942 - experiment_functions - INFO - Early stopping at epoch 500. Best Metrics: (0.00039662785669695907, 9.315397246431729e-05, 0.00023156706417089954)
2026-06-23 07:25:22,047 - optuna.study.study - INFO - Trial 61 finished with values: [0.00039662785669695907, 9.315397246431729e-05, 0.00023156706417089954] and parameters: {'n_layers': 1, 'embedding_dim': 64, 'lr': 0.00021415696513036683, 'lambda_val': 4.5378872086779825e-06, 'batch_size': 3143, 'optimizer': 'SGD'}.
2026-06-23 07:28:22,830 - optuna.study.study - INFO - Trial 62 finished with values: [0.0026276357123641235, 0.0006978653530377669, 0.0016642738381145849] and parameters: {'n_layers': 2, 'embedding_dim': 128, 'lr': 0.00018732041623787448, 'lambda_val': 0.00019730135054936066, 'batch_size': 1819, 'optimizer': 'Adam'}.
2026-06-23 07:29:11,764 - experiment_functions - INFO - Early stopping at epoch 1150. Best Metrics: (0.008937407698480638, 0.0018993937097385376, 0.004765900895171997)
2026-06-23 07:29:11,870 - optuna.study.study - INFO - Trial 63 finished with values: [0.008937407698480638, 0.0018993937097385376, 0.004765900895171997] and parameters: {'n_layers': 3, 'embedding_dim': 32, 'lr': 0.0009472628048121326, 'lambda_val': 0.019684317126267517, 'batch_size': 668, 'optimizer': 'RMSprop'}.
2026-06-23 07:29:36,601 - experiment_functions - INFO - Early stopping at epoch 550. Best Metrics: (0.008614803872975975, 0.0020351774662119492, 0.0050805604339769555)
2026-06-23 07:29:36,712 - optuna.study.study - INFO - Trial 64 finished with values: [0.008614803872975975, 0.0020351774662119492, 0.0050805604339769555] and parameters: {'n_layers': 2, 'embedding_dim': 32, 'lr': 0.003127312974080546, 'lambda_val': 0.019684317126267517, 'batch_size': 786, 'optimizer': 'RMSprop'}.
2026-06-23 07:29:59,472 - experiment_functions - INFO - Early stopping at epoch 500. Best Metrics: (0.0004588667396273029, 0.00010894278135657447, 0.0002462501918724845)
2026-06-23 07:29:59,607 - optuna.study.study - INFO - Trial 65 finished with values: [0.0004588667396273029, 0.00010894278135657447, 0.0002462501918724845] and parameters: {'n_layers': 1, 'embedding_dim': 96, 'lr': 0.0017924637075651337, 'lambda_val': 0.0009938480250443395, 'batch_size': 1976, 'optimizer': 'SGD'}.
2026-06-23 07:30:30,698 - experiment_functions - INFO - Early stopping at epoch 700. Best Metrics: (0.025224549072349025, 0.00542977137804724, 0.014357095710616344)
