2026-06-21 02:34:45,979 - optuna.study.study - INFO - Trial 234 finished with values: [0.010988134579346909, 0.002739358342806618, 0.006639724757953599] and parameters: {'n_layers': 4, 'embedding_dim': 128, 'lr': 0.0006604859729474348, 'lambda_val': 0.0002951588035227461, 'batch_size': 1305, 'optimizer': 'Adam'}.
2026-06-21 02:35:15,194 - experiment_functions - INFO - Early stopping at epoch 500. Best Metrics: (0.000712482483918244, 0.00013578375647341166, 0.0003611398382095176)
2026-06-21 02:35:15,304 - optuna.study.study - INFO - Trial 235 finished with values: [0.000712482483918244, 0.00013578375647341166, 0.0003611398382095176] and parameters: {'n_layers': 4, 'embedding_dim': 256, 'lr': 0.0006101961971381852, 'lambda_val': 0.0017226178103252388, 'batch_size': 1653, 'optimizer': 'SGD'}.
2026-06-21 02:35:49,322 - experiment_functions - INFO - Early stopping at epoch 750. Best Metrics: (0.009594315687875157, 0.002469369710749021, 0.005740550914365208)
2026-06-21 02:35:49,476 - optuna.study.study - INFO - Trial 236 finished with values: [0.009594315687875157, 0.002469369710749021, 0.005740550914365208] and parameters: {'n_layers': 4, 'embedding_dim': 64, 'lr': 0.0031134216844272773, 'lambda_val': 5.82846385984691e-05, 'batch_size': 1653, 'optimizer': 'Adam'}.
2026-06-21 02:36:15,280 - experiment_functions - INFO - Early stopping at epoch 550. Best Metrics: (0.0059967032978876875, 0.0014730958696475937, 0.0035036642361906405)
2026-06-21 02:36:15,430 - optuna.study.study - INFO - Trial 237 finished with values: [0.0059967032978876875, 0.0014730958696475937, 0.0035036642361906405] and parameters: {'n_layers': 3, 'embedding_dim': 96, 'lr': 0.012827131107694184, 'lambda_val': 0.0014663279558597413, 'batch_size': 2119, 'optimizer': 'Adam'}.
2026-06-21 02:36:51,067 - experiment_functions - INFO - Early stopping at epoch 750. Best Metrics: (0.007851822400795619, 0.0019625489453075663, 0.004675692111729001)
2026-06-21 02:36:51,195 - optuna.study.study - INFO - Trial 238 finished with values: [0.007851822400795619, 0.0019625489453075663, 0.004675692111729001] and parameters: {'n_layers': 3, 'embedding_dim': 128, 'lr': 0.0035879353384560956, 'lambda_val': 0.0006777437218508278, 'batch_size': 777, 'optimizer': 'Adam'}.
2026-06-21 02:39:48,614 - optuna.study.study - INFO - Trial 239 finished with values: [0.01341559458934145, 0.003348806366047745, 0.008586359039145123] and parameters: {'n_layers': 4, 'embedding_dim': 96, 'lr': 0.0006101961971381852, 'lambda_val': 2.8861183398799558e-06, 'batch_size': 777, 'optimizer': 'RMSprop'}.
2026-06-21 02:40:26,418 - experiment_functions - INFO - Early stopping at epoch 850. Best Metrics: (0.00911446575506307, 0.0023225337880510293, 0.005518438031710549)
2026-06-21 02:40:26,569 - optuna.study.study - INFO - Trial 240 finished with values: [0.00911446575506307, 0.0023225337880510293, 0.005518438031710549] and parameters: {'n_layers': 3, 'embedding_dim': 64, 'lr': 0.0021794693743976113, 'lambda_val': 2.8861183398799558e-06, 'batch_size': 2520, 'optimizer': 'RMSprop'}.
2026-06-21 02:43:16,298 - optuna.study.study - INFO - Trial 241 finished with values: [0.011745899719704788, 0.0029525072628520904, 0.007354440655497721] and parameters: {'n_layers': 4, 'embedding_dim': 64, 'lr': 0.0006460981719089114, 'lambda_val': 3.9553958515555e-06, 'batch_size': 1257, 'optimizer': 'Adam'}.
2026-06-21 02:46:04,519 - optuna.study.study - INFO - Trial 242 finished with values: [0.009896268978811146, 0.002371479095617027, 0.0059610915218920755] and parameters: {'n_layers': 3, 'embedding_dim': 64, 'lr': 0.0006101961971381852, 'lambda_val': 2.0807360556667617e-05, 'batch_size': 2874, 'optimizer': 'RMSprop'}.
2026-06-21 02:48:08,401 - experiment_functions - INFO - Early stopping at epoch 2650. Best Metrics: (0.011965336511936344, 0.0028877731463938356, 0.007282007987653304)
2026-06-21 02:48:08,557 - optuna.study.study - INFO - Trial 243 finished with values: [0.011965336511936344, 0.0028877731463938356, 0.007282007987653304] and parameters: {'n_layers': 4, 'embedding_dim': 128, 'lr': 0.0004974729077493578, 'lambda_val': 0.0014663279558597413, 'batch_size': 1305, 'optimizer': 'RMSprop'}.
2026-06-21 02:51:09,023 - optuna.study.study - INFO - Trial 244 finished with values: [0.00843736808644081, 0.0021172792724516868, 0.00524287558160762] and parameters: {'n_layers': 3, 'embedding_dim': 128, 'lr': 0.0006101961971381852, 'lambda_val': 0.0017226178103252388, 'batch_size': 777, 'optimizer': 'Adam'}.
2026-06-21 02:51:43,289 - experiment_functions - INFO - Early stopping at epoch 750. Best Metrics: (0.010408891868800766, 0.0025372615889857272, 0.006336158286456131)
2026-06-21 02:51:43,601 - optuna.study.study - INFO - Trial 245 finished with values: [0.010408891868800766, 0.0025372615889857272, 0.006336158286456131] and parameters: {'n_layers': 4, 'embedding_dim': 64, 'lr': 0.0031134216844272773, 'lambda_val': 3.9553958515555e-06, 'batch_size': 1257, 'optimizer': 'Adam'}.
2026-06-21 02:54:24,989 - optuna.study.study - INFO - Trial 246 finished with values: [0.009255951373123206, 0.002259378552482001, 0.005902578593382782] and parameters: {'n_layers': 4, 'embedding_dim': 32, 'lr': 0.0006460981719089114, 'lambda_val': 5.82846385984691e-05, 'batch_size': 529, 'optimizer': 'Adam'}.
2026-06-21 02:55:03,556 - experiment_functions - INFO - Early stopping at epoch 900. Best Metrics: (0.010664033537508128, 0.0025956801818870787, 0.006471918815306539)
2026-06-21 02:55:04,834 - optuna.study.study - INFO - Trial 247 finished with values: [0.010664033537508128, 0.0025956801818870787, 0.006471918815306539] and parameters: {'n_layers': 4, 'embedding_dim': 32, 'lr': 0.0031134216844272773, 'lambda_val': 3.9553958515555e-06, 'batch_size': 1257, 'optimizer': 'RMSprop'}.
2026-06-21 02:55:36,126 - experiment_functions - INFO - Early stopping at epoch 650. Best Metrics: (0.009119061171364807, 0.0022577996715927753, 0.005359814036746019)
2026-06-21 02:55:36,226 - optuna.study.study - INFO - Trial 248 finished with values: [0.009119061171364807, 0.0022577996715927753, 0.005359814036746019] and parameters: {'n_layers': 4, 'embedding_dim': 96, 'lr': 0.0021794693743976113, 'lambda_val': 2.8861183398799558e-06, 'batch_size': 3029, 'optimizer': 'RMSprop'}.
2026-06-21 02:57:50,411 - experiment_functions - INFO - Early stopping at epoch 3250. Best Metrics: (0.004666529126966748, 0.0011446886446886447, 0.0028082169002033117)
2026-06-21 02:57:50,520 - optuna.study.study - INFO - Trial 249 finished with values: [0.004666529126966748, 0.0011446886446886447, 0.0028082169002033117] and parameters: {'n_layers': 1, 'embedding_dim': 128, 'lr': 0.0031134216844272773, 'lambda_val': 3.9553958515555e-06, 'batch_size': 1257, 'optimizer': 'Adam'}.
2026-06-21 02:58:16,848 - experiment_functions - INFO - Early stopping at epoch 550. Best Metrics: (0.005925578612365189, 0.0014936213212075283, 0.003496475819212911)
2026-06-21 02:58:16,953 - optuna.study.study - INFO - Trial 250 finished with values: [0.005925578612365189, 0.0014936213212075283, 0.003496475819212911] and parameters: {'n_layers': 3, 'embedding_dim': 96, 'lr': 0.01419329905650652, 'lambda_val': 5.82846385984691e-05, 'batch_size': 1203, 'optimizer': 'Adam'}.
2026-06-21 02:59:57,602 - experiment_functions - INFO - Early stopping at epoch 2150. Best Metrics: (0.013326427336766377, 0.0032824933687002652, 0.008251776397996352)
2026-06-21 02:59:57,706 - optuna.study.study - INFO - Trial 251 finished with values: [0.013326427336766377, 0.0032824933687002652, 0.008251776397996352] and parameters: {'n_layers': 4, 'embedding_dim': 128, 'lr': 0.0009034833913942367, 'lambda_val': 3.9553958515555e-06, 'batch_size': 777, 'optimizer': 'RMSprop'}.
2026-06-21 03:02:43,966 - experiment_functions - INFO - Early stopping at epoch 3850. Best Metrics: (0.0126353756553782, 0.00314828849311608, 0.007732579061284891)
2026-06-21 03:02:44,070 - optuna.study.study - INFO - Trial 252 finished with values: [0.0126353756553782, 0.00314828849311608, 0.007732579061284891] and parameters: {'n_layers': 3, 'embedding_dim': 96, 'lr': 0.0009639057160359956, 'lambda_val': 2.8861183398799558e-06, 'batch_size': 777, 'optimizer': 'RMSprop'}.
2026-06-21 03:03:18,475 - experiment_functions - INFO - Early stopping at epoch 750. Best Metrics: (0.008528230448953624, 0.002169382341796135, 0.005318263059667801)
2026-06-21 03:03:18,880 - optuna.study.study - INFO - Trial 253 finished with values: [0.008528230448953624, 0.002169382341796135, 0.005318263059667801] and parameters: {'n_layers': 3, 'embedding_dim': 96, 'lr': 0.002023117320023605, 'lambda_val': 0.0002326356470887962, 'batch_size': 2119, 'optimizer': 'RMSprop'}.
2026-06-21 03:05:56,604 - experiment_functions - INFO - Early stopping at epoch 3550. Best Metrics: (0.010966077694174564, 0.0026856763925729443, 0.006704346602069256)
2026-06-21 03:05:56,708 - optuna.study.study - INFO - Trial 254 finished with values: [0.010966077694174564, 0.0026856763925729443, 0.006704346602069256] and parameters: {'n_layers': 4, 'embedding_dim': 96, 'lr': 0.0006101961971381852, 'lambda_val': 0.0002951588035227461, 'batch_size': 1367, 'optimizer': 'Adam'}.
2026-06-21 03:08:39,102 - experiment_functions - INFO - Early stopping at epoch 3650. Best Metrics: (0.011098827191930916, 0.0027614626752557794, 0.006807213398531969)
2026-06-21 03:08:39,247 - optuna.study.study - INFO - Trial 255 finished with values: [0.011098827191930916, 0.0027614626752557794, 0.006807213398531969] and parameters: {'n_layers': 4, 'embedding_dim': 96, 'lr': 0.0006101961971381852, 'lambda_val': 5.82846385984691e-05, 'batch_size': 1203, 'optimizer': 'Adam'}.
2026-06-21 03:09:23,764 - experiment_functions - INFO - Early stopping at epoch 1000. Best Metrics: (0.011368394340768279, 0.0028277756726032594, 0.006822341139013362)
2026-06-21 03:09:23,876 - optuna.study.study - INFO - Trial 256 finished with values: [0.011368394340768279, 0.0028277756726032594, 0.006822341139013362] and parameters: {'n_layers': 4, 'embedding_dim': 64, 'lr': 0.0021794693743976113, 'lambda_val': 2.8861183398799558e-06, 'batch_size': 812, 'optimizer': 'RMSprop'}.
2026-06-21 03:11:24,412 - experiment_functions - INFO - Early stopping at epoch 2800. Best Metrics: (0.011409005627780642, 0.0027788303650372616, 0.006951812599461643)
2026-06-21 03:11:24,519 - optuna.study.study - INFO - Trial 257 finished with values: [0.011409005627780642, 0.0027788303650372616, 0.006951812599461643] and parameters: {'n_layers': 4, 'embedding_dim': 64, 'lr': 0.0004974729077493578, 'lambda_val': 3.9553958515555e-06, 'batch_size': 3588, 'optimizer': 'RMSprop'}.
2026-06-21 03:13:13,078 - experiment_functions - INFO - Early stopping at epoch 1950. Best Metrics: (0.011896338027630168, 0.0030140836175318935, 0.007119361334130096)
2026-06-21 03:13:13,205 - optuna.study.study - INFO - Trial 258 finished with values: [0.011896338027630168, 0.0030140836175318935, 0.007119361334130096] and parameters: {'n_layers': 4, 'embedding_dim': 256, 'lr': 0.0006101961971381852, 'lambda_val': 2.4259773382665532e-05, 'batch_size': 1203, 'optimizer': 'RMSprop'}.
2026-06-21 03:16:10,775 - optuna.study.study - INFO - Trial 259 finished with values: [0.007528933863939909, 0.0018757104964001517, 0.004710954506574281] and parameters: {'n_layers': 4, 'embedding_dim': 96, 'lr': 0.00027741340433659747, 'lambda_val': 5.82846385984691e-05, 'batch_size': 2119, 'optimizer': 'Adam'}.
2026-06-21 03:18:15,386 - experiment_functions - INFO - Early stopping at epoch 2850. Best Metrics: (0.010410084398165723, 0.0026193633952254643, 0.006357648390882146)
2026-06-21 03:18:15,493 - optuna.study.study - INFO - Trial 260 finished with values: [0.010410084398165723, 0.0026193633952254643, 0.006357648390882146] and parameters: {'n_layers': 3, 'embedding_dim': 96, 'lr': 0.0006604859729474348, 'lambda_val': 1.282312052161098e-05, 'batch_size': 2119, 'optimizer': 'RMSprop'}.
2026-06-21 03:21:11,903 - optuna.study.study - INFO - Trial 261 finished with values: [0.010468669933774419, 0.0025593659214348872, 0.0064577854349383065] and parameters: {'n_layers': 4, 'embedding_dim': 96, 'lr': 0.00043327912311372766, 'lambda_val': 3.9553958515555e-06, 'batch_size': 777, 'optimizer': 'RMSprop'}.
2026-06-21 03:23:02,287 - experiment_functions - INFO - Early stopping at epoch 2000. Best Metrics: (0.0122621845631071, 0.0030093469748642167, 0.007458257465870195)
2026-06-21 03:23:02,418 - optuna.study.study - INFO - Trial 262 finished with values: [0.0122621845631071, 0.0030093469748642167, 0.007458257465870195] and parameters: {'n_layers': 4, 'embedding_dim': 256, 'lr': 0.0006101961971381852, 'lambda_val': 2.4259773382665532e-05, 'batch_size': 1203, 'optimizer': 'RMSprop'}.
2026-06-21 03:24:23,508 - experiment_functions - INFO - Early stopping at epoch 1850. Best Metrics: (0.009023266198711891, 0.0023177971453833524, 0.005439135077541437)
2026-06-21 03:24:23,611 - optuna.study.study - INFO - Trial 263 finished with values: [0.009023266198711891, 0.0023177971453833524, 0.005439135077541437] and parameters: {'n_layers': 3, 'embedding_dim': 96, 'lr': 0.0006460981719089114, 'lambda_val': 5.82846385984691e-05, 'batch_size': 3401, 'optimizer': 'RMSprop'}.
2026-06-21 03:27:22,421 - optuna.study.study - INFO - Trial 264 finished with values: [0.012205143925330758, 0.0029256662877352535, 0.007246389191988886] and parameters: {'n_layers': 4, 'embedding_dim': 96, 'lr': 0.0006101961971381852, 'lambda_val': 3.9553958515555e-06, 'batch_size': 1257, 'optimizer': 'Adam'}.
2026-06-21 03:28:39,163 - experiment_functions - INFO - Early stopping at epoch 1450. Best Metrics: (0.007803965975187732, 0.0019672855879752436, 0.004828242729465817)
2026-06-21 03:28:39,329 - optuna.study.study - INFO - Trial 265 finished with values: [0.007803965975187732, 0.0019672855879752436, 0.004828242729465817] and parameters: {'n_layers': 3, 'embedding_dim': 256, 'lr': 0.0006460981719089114, 'lambda_val': 0.0011046690662927289, 'batch_size': 3025, 'optimizer': 'Adam'}.
2026-06-21 03:31:29,622 - optuna.study.study - INFO - Trial 266 finished with values: [0.010927107211148276, 0.002718832891246684, 0.0066180139812838995] and parameters: {'n_layers': 4, 'embedding_dim': 64, 'lr': 0.0004974729077493578, 'lambda_val': 3.9553958515555e-06, 'batch_size': 1976, 'optimizer': 'Adam'}.
2026-06-21 03:34:19,669 - optuna.study.study - INFO - Trial 267 finished with values: [0.009356082778972706, 0.0024362132120752814, 0.005624614259225955] and parameters: {'n_layers': 4, 'embedding_dim': 64, 'lr': 0.0004974729077493578, 'lambda_val': 0.0014663279558597413, 'batch_size': 3244, 'optimizer': 'Adam'}.
2026-06-21 03:34:47,441 - experiment_functions - INFO - Early stopping at epoch 550. Best Metrics: (0.005145762387742525, 0.0012236326891499306, 0.0029428821774731286)
2026-06-21 03:34:47,551 - optuna.study.study - INFO - Trial 268 finished with values: [0.005145762387742525, 0.0012236326891499306, 0.0029428821774731286] and parameters: {'n_layers': 4, 'embedding_dim': 128, 'lr': 0.05312172100180761, 'lambda_val': 3.9553958515555e-06, 'batch_size': 2743, 'optimizer': 'Adam'}.
2026-06-21 03:36:11,771 - experiment_functions - INFO - Early stopping at epoch 1950. Best Metrics: (0.011182847846146407, 0.002824617910824808, 0.006830586823761621)
2026-06-21 03:36:11,922 - optuna.study.study - INFO - Trial 269 finished with values: [0.011182847846146407, 0.002824617910824808, 0.006830586823761621] and parameters: {'n_layers': 4, 'embedding_dim': 64, 'lr': 0.0006604859729474348, 'lambda_val': 0.0014663279558597413, 'batch_size': 2187, 'optimizer': 'RMSprop'}.
2026-06-21 03:36:46,293 - experiment_functions - INFO - Early stopping at epoch 750. Best Metrics: (0.0095112089514971, 0.0024125299987368953, 0.005970249666777)
2026-06-21 03:36:46,726 - optuna.study.study - INFO - Trial 270 finished with values: [0.0095112089514971, 0.0024125299987368953, 0.005970249666777] and parameters: {'n_layers': 4, 'embedding_dim': 64, 'lr': 0.0031134216844272773, 'lambda_val': 3.9553958515555e-06, 'batch_size': 1257, 'optimizer': 'Adam'}.
2026-06-21 03:37:14,465 - experiment_functions - INFO - Early stopping at epoch 550. Best Metrics: (0.0068918925879672905, 0.0016894025514715171, 0.004046725259522264)
2026-06-21 03:37:14,570 - optuna.study.study - INFO - Trial 271 finished with values: [0.0068918925879672905, 0.0016894025514715171, 0.004046725259522264] and parameters: {'n_layers': 4, 'embedding_dim': 128, 'lr': 0.01331832499237249, 'lambda_val': 0.0002951588035227461, 'batch_size': 1305, 'optimizer': 'Adam'}.
2026-06-21 03:38:34,705 - experiment_functions - INFO - Early stopping at epoch 1750. Best Metrics: (0.01171731997339981, 0.002848301124163193, 0.007128238652890258)
2026-06-21 03:38:34,822 - optuna.study.study - INFO - Trial 272 finished with values: [0.01171731997339981, 0.002848301124163193, 0.007128238652890258] and parameters: {'n_layers': 4, 'embedding_dim': 96, 'lr': 0.0006101961971381852, 'lambda_val': 5.82846385984691e-05, 'batch_size': 3029, 'optimizer': 'RMSprop'}.
2026-06-21 03:39:28,503 - experiment_functions - INFO - Early stopping at epoch 1000. Best Metrics: (0.0066739041762911185, 0.00175097890615132, 0.0040002478773204075)
2026-06-21 03:39:28,611 - optuna.study.study - INFO - Trial 273 finished with values: [0.0066739041762911185, 0.00175097890615132, 0.0040002478773204075] and parameters: {'n_layers': 3, 'embedding_dim': 256, 'lr': 0.0006101961971381852, 'lambda_val': 0.006219345540758058, 'batch_size': 3029, 'optimizer': 'RMSprop'}.
2026-06-21 03:41:13,402 - experiment_functions - INFO - Early stopping at epoch 2200. Best Metrics: (0.012577763979663757, 0.0031340785651130477, 0.00796091775650514)
2026-06-21 03:41:13,509 - optuna.study.study - INFO - Trial 274 finished with values: [0.012577763979663757, 0.0031340785651130477, 0.00796091775650514] and parameters: {'n_layers': 4, 'embedding_dim': 128, 'lr': 0.0006101961971381852, 'lambda_val': 1.282312052161098e-05, 'batch_size': 1193, 'optimizer': 'RMSprop'}.
2026-06-21 03:42:54,002 - experiment_functions - INFO - Early stopping at epoch 1800. Best Metrics: (0.010962659599159619, 0.002873563218390805, 0.006605224991345175)
2026-06-21 03:42:54,360 - optuna.study.study - INFO - Trial 275 finished with values: [0.010962659599159619, 0.002873563218390805, 0.006605224991345175] and parameters: {'n_layers': 4, 'embedding_dim': 256, 'lr': 0.0006101961971381852, 'lambda_val': 0.0017226178103252388, 'batch_size': 777, 'optimizer': 'RMSprop'}.
2026-06-21 03:43:59,816 - experiment_functions - INFO - Early stopping at epoch 1400. Best Metrics: (0.011181788116606278, 0.0028135657446002275, 0.0066925638823504534)
2026-06-21 03:44:00,172 - optuna.study.study - INFO - Trial 276 finished with values: [0.011181788116606278, 0.0028135657446002275, 0.0066925638823504534] and parameters: {'n_layers': 4, 'embedding_dim': 96, 'lr': 0.0006604859729474348, 'lambda_val': 1.282312052161098e-05, 'batch_size': 2917, 'optimizer': 'RMSprop'}.
2026-06-21 03:45:10,393 - experiment_functions - INFO - Early stopping at epoch 1600. Best Metrics: (0.010630987924257847, 0.00263199444233927, 0.006505461989227732)
2026-06-21 03:45:10,524 - optuna.study.study - INFO - Trial 277 finished with values: [0.010630987924257847, 0.00263199444233927, 0.006505461989227732] and parameters: {'n_layers': 4, 'embedding_dim': 64, 'lr': 0.0006101961971381852, 'lambda_val': 0.0017226178103252388, 'batch_size': 2976, 'optimizer': 'RMSprop'}.
2026-06-21 03:48:08,691 - optuna.study.study - INFO - Trial 278 finished with values: [0.014285882725763312, 0.00338038398383226, 0.008623677315219817] and parameters: {'n_layers': 4, 'embedding_dim': 96, 'lr': 0.0006101961971381852, 'lambda_val': 2.0807360556667617e-05, 'batch_size': 1257, 'optimizer': 'RMSprop'}.
2026-06-21 03:51:06,544 - optuna.study.study - INFO - Trial 279 finished with values: [0.009077016449189897, 0.002270430718706581, 0.005581311864657862] and parameters: {'n_layers': 3, 'embedding_dim': 128, 'lr': 0.0006101961971381852, 'lambda_val': 0.0017226178103252388, 'batch_size': 1285, 'optimizer': 'Adam'}.
2026-06-21 03:53:45,644 - optuna.study.study - INFO - Trial 280 finished with values: [0.009354531849621827, 0.0022562207907035497, 0.005846171373490642] and parameters: {'n_layers': 3, 'embedding_dim': 32, 'lr': 0.0006460981719089114, 'lambda_val': 5.82846385984691e-05, 'batch_size': 1203, 'optimizer': 'RMSprop'}.
2026-06-21 03:56:34,039 - experiment_functions - INFO - Early stopping at epoch 3800. Best Metrics: (0.013105494564161328, 0.0032130226095743336, 0.008195648095803577)
2026-06-21 03:56:34,148 - optuna.study.study - INFO - Trial 281 finished with values: [0.013105494564161328, 0.0032130226095743336, 0.008195648095803577] and parameters: {'n_layers': 4, 'embedding_dim': 96, 'lr': 0.0006101961971381852, 'lambda_val': 0.0014252477857107954, 'batch_size': 777, 'optimizer': 'RMSprop'}.
2026-06-21 03:59:18,876 - optuna.study.study - INFO - Trial 282 finished with values: [0.009414591482485505, 0.0023383225969432864, 0.005915119719578081] and parameters: {'n_layers': 3, 'embedding_dim': 64, 'lr': 0.0006101961971381852, 'lambda_val': 3.9553958515555e-06, 'batch_size': 923, 'optimizer': 'RMSprop'}.
2026-06-21 04:00:53,903 - experiment_functions - INFO - Early stopping at epoch 2300. Best Metrics: (0.003695641876656746, 0.0008778577744094986, 0.0023085966075393977)
2026-06-21 04:00:54,006 - optuna.study.study - INFO - Trial 283 finished with values: [0.003695641876656746, 0.0008778577744094986, 0.0023085966075393977] and parameters: {'n_layers': 1, 'embedding_dim': 128, 'lr': 0.0006604859729474348, 'lambda_val': 0.004016827138935795, 'batch_size': 3029, 'optimizer': 'RMSprop'}.
2026-06-21 04:01:28,812 - experiment_functions - INFO - Early stopping at epoch 600. Best Metrics: (0.007398046649754182, 0.0018757104964001517, 0.004384429132454212)
