2026-06-20 05:10:54,548 - optuna.study.study - INFO - Trial 86 finished with values: [0.003957562117993648, 0.0009110142730832386, 0.0021494063817801864] and parameters: {'n_layers': 4, 'embedding_dim': 64, 'lr': 0.006678676571422479, 'lambda_val': 0.08414848274404776, 'batch_size': 2368, 'optimizer': 'Adam'}.
2026-06-20 05:11:35,236 - experiment_functions - INFO - Early stopping at epoch 900. Best Metrics: (0.002920172702548301, 0.0007010231148162182, 0.0016758570969212475)
2026-06-20 05:11:35,342 - optuna.study.study - INFO - Trial 87 finished with values: [0.002920172702548301, 0.0007010231148162182, 0.0016758570969212475] and parameters: {'n_layers': 3, 'embedding_dim': 64, 'lr': 0.014192902425899798, 'lambda_val': 0.08414848274404776, 'batch_size': 3075, 'optimizer': 'Adam'}.
2026-06-20 05:12:03,581 - experiment_functions - INFO - Early stopping at epoch 550. Best Metrics: (0.006649259588652539, 0.0015694076038903625, 0.003872501223142586)
2026-06-20 05:12:03,675 - optuna.study.study - INFO - Trial 88 finished with values: [0.006649259588652539, 0.0015694076038903625, 0.003872501223142586] and parameters: {'n_layers': 1, 'embedding_dim': 256, 'lr': 0.061381772770075456, 'lambda_val': 1.9616768085102623e-06, 'batch_size': 1174, 'optimizer': 'Adam'}.
2026-06-20 05:12:30,792 - experiment_functions - INFO - Early stopping at epoch 550. Best Metrics: (0.005810331033928667, 0.0012473159024883164, 0.0032579642377587037)
2026-06-20 05:12:30,880 - optuna.study.study - INFO - Trial 89 finished with values: [0.005810331033928667, 0.0012473159024883164, 0.0032579642377587037] and parameters: {'n_layers': 2, 'embedding_dim': 128, 'lr': 0.061381772770075456, 'lambda_val': 0.00012018704157732538, 'batch_size': 1174, 'optimizer': 'Adam'}.
2026-06-20 05:15:31,107 - optuna.study.study - INFO - Trial 90 finished with values: [0.0005179798987264366, 0.00014209928003031455, 0.00030698034211860595] and parameters: {'n_layers': 3, 'embedding_dim': 96, 'lr': 3.031064165450504e-05, 'lambda_val': 1.7016903226968311e-06, 'batch_size': 3914, 'optimizer': 'Adam'}.
2026-06-20 05:19:21,734 - optuna.study.study - INFO - Trial 91 finished with values: [0.022601271778829653, 0.004907161803713528, 0.013155502843250474] and parameters: {'n_layers': 3, 'embedding_dim': 256, 'lr': 0.00022027863565489018, 'lambda_val': 4.303236972228742e-06, 'batch_size': 1869, 'optimizer': 'Adam'}.
2026-06-20 05:19:44,364 - experiment_functions - INFO - Early stopping at epoch 500. Best Metrics: (0.0003495374401842531, 8.525956801818871e-05, 0.0002253583272813116)
2026-06-20 05:19:44,441 - optuna.study.study - INFO - Trial 92 finished with values: [0.0003495374401842531, 8.525956801818871e-05, 0.0002253583272813116] and parameters: {'n_layers': 1, 'embedding_dim': 96, 'lr': 0.024358686102743537, 'lambda_val': 0.000299333475182023, 'batch_size': 2683, 'optimizer': 'SGD'}.
2026-06-20 05:20:09,021 - experiment_functions - INFO - Early stopping at epoch 550. Best Metrics: (0.01175316339867843, 0.0026477832512315272, 0.00676555924823566)
2026-06-20 05:20:09,434 - optuna.study.study - INFO - Trial 93 finished with values: [0.01175316339867843, 0.0026477832512315272, 0.00676555924823566] and parameters: {'n_layers': 2, 'embedding_dim': 32, 'lr': 0.033323910818478145, 'lambda_val': 1.0112597680663849e-05, 'batch_size': 772, 'optimizer': 'Adam'}.
2026-06-20 05:22:59,781 - optuna.study.study - INFO - Trial 94 finished with values: [0.02788216834758262, 0.006056587091069849, 0.015932655579658582] and parameters: {'n_layers': 2, 'embedding_dim': 64, 'lr': 0.00041090885210817534, 'lambda_val': 1.0112597680663849e-05, 'batch_size': 3427, 'optimizer': 'RMSprop'}.
2026-06-20 05:23:29,153 - experiment_functions - INFO - Early stopping at epoch 600. Best Metrics: (0.019179438865851516, 0.00407351269420235, 0.010532788658551116)
2026-06-20 05:23:29,564 - optuna.study.study - INFO - Trial 95 finished with values: [0.019179438865851516, 0.00407351269420235, 0.010532788658551116] and parameters: {'n_layers': 2, 'embedding_dim': 128, 'lr': 0.004958786625127089, 'lambda_val': 0.0017653877117820588, 'batch_size': 3527, 'optimizer': 'Adam'}.
2026-06-20 05:23:56,159 - experiment_functions - INFO - Early stopping at epoch 500. Best Metrics: (0.000696253748412056, 0.0001499936844764431, 0.00034388289767917394)
2026-06-20 05:23:56,250 - optuna.study.study - INFO - Trial 96 finished with values: [0.000696253748412056, 0.0001499936844764431, 0.00034388289767917394] and parameters: {'n_layers': 4, 'embedding_dim': 128, 'lr': 0.00021874714734455622, 'lambda_val': 0.04006490821690157, 'batch_size': 3213, 'optimizer': 'SGD'}.
2026-06-20 05:24:19,993 - experiment_functions - INFO - Early stopping at epoch 500. Best Metrics: (0.0005144191615273107, 0.00011683718580270305, 0.0002773891028575703)
2026-06-20 05:24:20,072 - optuna.study.study - INFO - Trial 97 finished with values: [0.0005144191615273107, 0.00011683718580270305, 0.0002773891028575703] and parameters: {'n_layers': 4, 'embedding_dim': 64, 'lr': 1.208238366360822e-05, 'lambda_val': 0.00023244261764221092, 'batch_size': 3829, 'optimizer': 'SGD'}.
2026-06-20 05:24:42,996 - experiment_functions - INFO - Early stopping at epoch 500. Best Metrics: (0.0006611593927543583, 0.0001373626373626374, 0.0003754114673042042)
2026-06-20 05:24:43,093 - optuna.study.study - INFO - Trial 98 finished with values: [0.0006611593927543583, 0.0001373626373626374, 0.0003754114673042042] and parameters: {'n_layers': 2, 'embedding_dim': 64, 'lr': 0.004958786625127089, 'lambda_val': 0.0029983063298513035, 'batch_size': 3527, 'optimizer': 'SGD'}.
2026-06-20 05:25:10,395 - experiment_functions - INFO - Early stopping at epoch 550. Best Metrics: (0.0033008375859388205, 0.0007373373752684098, 0.0019453470470399419)
2026-06-20 05:25:10,483 - optuna.study.study - INFO - Trial 99 finished with values: [0.0033008375859388205, 0.0007373373752684098, 0.0019453470470399419] and parameters: {'n_layers': 4, 'embedding_dim': 64, 'lr': 0.08305721718816232, 'lambda_val': 1.6265345504793854e-05, 'batch_size': 3364, 'optimizer': 'RMSprop'}.
2026-06-20 05:26:14,780 - experiment_functions - INFO - Early stopping at epoch 1500. Best Metrics: (0.017836326677540846, 0.0038224706328154607, 0.010047697424265862)
2026-06-20 05:26:14,852 - optuna.study.study - INFO - Trial 100 finished with values: [0.017836326677540846, 0.0038224706328154607, 0.010047697424265862] and parameters: {'n_layers': 4, 'embedding_dim': 32, 'lr': 0.000904089143485971, 'lambda_val': 0.0022723744163998237, 'batch_size': 850, 'optimizer': 'RMSprop'}.
2026-06-20 05:28:55,335 - optuna.study.study - INFO - Trial 101 finished with values: [0.010929760306016936, 0.002548313755210307, 0.006517785060091058] and parameters: {'n_layers': 2, 'embedding_dim': 32, 'lr': 0.00025992455613315583, 'lambda_val': 0.00017182706294327683, 'batch_size': 2973, 'optimizer': 'Adam'}.
2026-06-20 05:29:23,948 - experiment_functions - INFO - Early stopping at epoch 600. Best Metrics: (0.015380910599482295, 0.0033203865100416828, 0.008890186395789848)
2026-06-20 05:29:24,030 - optuna.study.study - INFO - Trial 102 finished with values: [0.015380910599482295, 0.0033203865100416828, 0.008890186395789848] and parameters: {'n_layers': 3, 'embedding_dim': 64, 'lr': 0.0015608654005494732, 'lambda_val': 1.6265345504793854e-05, 'batch_size': 3986, 'optimizer': 'RMSprop'}.
2026-06-20 05:30:45,039 - experiment_functions - INFO - Early stopping at epoch 1900. Best Metrics: (0.03228258015332138, 0.006569723380068208, 0.01855267233100519)
2026-06-20 05:30:45,119 - optuna.study.study - INFO - Trial 103 finished with values: [0.03228258015332138, 0.006569723380068208, 0.01855267233100519] and parameters: {'n_layers': 1, 'embedding_dim': 64, 'lr': 0.001705082463001927, 'lambda_val': 1.0746091986357293e-06, 'batch_size': 3874, 'optimizer': 'Adam'}.
2026-06-20 05:33:24,014 - optuna.study.study - INFO - Trial 104 finished with values: [0.0011039508791157674, 0.0002557787040545662, 0.0006214692248118262] and parameters: {'n_layers': 2, 'embedding_dim': 32, 'lr': 0.0001399107632442444, 'lambda_val': 1.6265345504793854e-05, 'batch_size': 2121, 'optimizer': 'RMSprop'}.
2026-06-20 05:33:51,797 - experiment_functions - INFO - Early stopping at epoch 550. Best Metrics: (0.015203377021839786, 0.0033582796513830994, 0.008414359308798022)
2026-06-20 05:33:51,889 - optuna.study.study - INFO - Trial 105 finished with values: [0.015203377021839786, 0.0033582796513830994, 0.008414359308798022] and parameters: {'n_layers': 3, 'embedding_dim': 96, 'lr': 0.006590049461749219, 'lambda_val': 1.0746091986357293e-06, 'batch_size': 3646, 'optimizer': 'Adam'}.
2026-06-20 05:34:34,286 - experiment_functions - INFO - Early stopping at epoch 1000. Best Metrics: (0.02096183981308093, 0.00447928508273336, 0.012010745115947812)
2026-06-20 05:34:35,189 - optuna.study.study - INFO - Trial 106 finished with values: [0.02096183981308093, 0.00447928508273336, 0.012010745115947812] and parameters: {'n_layers': 1, 'embedding_dim': 32, 'lr': 0.006590049461749219, 'lambda_val': 1.7016903226968311e-06, 'batch_size': 772, 'optimizer': 'Adam'}.
2026-06-20 05:35:07,259 - experiment_functions - INFO - Early stopping at epoch 750. Best Metrics: (0.017217684567564943, 0.003543008715422509, 0.009660373770102405)
2026-06-20 05:35:07,336 - optuna.study.study - INFO - Trial 107 finished with values: [0.017217684567564943, 0.003543008715422509, 0.009660373770102405] and parameters: {'n_layers': 1, 'embedding_dim': 32, 'lr': 0.006590049461749219, 'lambda_val': 1.2363668223144638e-06, 'batch_size': 3646, 'optimizer': 'RMSprop'}.
2026-06-20 05:35:38,062 - experiment_functions - INFO - Early stopping at epoch 650. Best Metrics: (0.014815214576965111, 0.003321965390930908, 0.00799654662176159)
2026-06-20 05:35:38,155 - optuna.study.study - INFO - Trial 108 finished with values: [0.014815214576965111, 0.003321965390930908, 0.00799654662176159] and parameters: {'n_layers': 2, 'embedding_dim': 96, 'lr': 0.002668806132567397, 'lambda_val': 0.015665527252443415, 'batch_size': 2683, 'optimizer': 'Adam'}.
2026-06-20 05:36:09,341 - experiment_functions - INFO - Early stopping at epoch 600. Best Metrics: (0.022597637348478854, 0.004866110900593659, 0.013086218521635898)
2026-06-20 05:36:09,413 - optuna.study.study - INFO - Trial 109 finished with values: [0.022597637348478854, 0.004866110900593659, 0.013086218521635898] and parameters: {'n_layers': 1, 'embedding_dim': 256, 'lr': 0.00756179583697981, 'lambda_val': 1.9616768085102623e-06, 'batch_size': 2683, 'optimizer': 'Adam'}.
2026-06-20 05:36:42,702 - experiment_functions - INFO - Early stopping at epoch 750. Best Metrics: (0.028316588348002162, 0.006037640520399142, 0.01604750510452652)
2026-06-20 05:36:42,793 - optuna.study.study - INFO - Trial 110 finished with values: [0.028316588348002162, 0.006037640520399142, 0.01604750510452652] and parameters: {'n_layers': 1, 'embedding_dim': 32, 'lr': 0.002488784556108625, 'lambda_val': 0.0022723744163998237, 'batch_size': 3770, 'optimizer': 'RMSprop'}.
2026-06-20 05:37:13,325 - experiment_functions - INFO - Early stopping at epoch 600. Best Metrics: (0.0047997277588500845, 0.0010846911708980674, 0.002775140109137756)
2026-06-20 05:37:13,406 - optuna.study.study - INFO - Trial 111 finished with values: [0.0047997277588500845, 0.0010846911708980674, 0.002775140109137756] and parameters: {'n_layers': 4, 'embedding_dim': 96, 'lr': 0.002668806132567397, 'lambda_val': 0.015665527252443415, 'batch_size': 772, 'optimizer': 'Adam'}.
2026-06-20 05:39:03,512 - experiment_functions - INFO - Early stopping at epoch 2650. Best Metrics: (0.032136272942647745, 0.0067655046103321966, 0.01852962579050983)
2026-06-20 05:39:03,598 - optuna.study.study - INFO - Trial 112 finished with values: [0.032136272942647745, 0.0067655046103321966, 0.01852962579050983] and parameters: {'n_layers': 1, 'embedding_dim': 32, 'lr': 0.0012953028594055518, 'lambda_val': 3.64590979484011e-06, 'batch_size': 1493, 'optimizer': 'RMSprop'}.
2026-06-20 05:42:19,031 - optuna.study.study - INFO - Trial 113 finished with values: [0.022952505618379568, 0.005121889604648225, 0.013559567417861679] and parameters: {'n_layers': 3, 'embedding_dim': 128, 'lr': 0.00022027863565489018, 'lambda_val': 4.303236972228742e-06, 'batch_size': 3213, 'optimizer': 'Adam'}.
2026-06-20 05:42:43,091 - experiment_functions - INFO - Early stopping at epoch 550. Best Metrics: (0.004240389480353551, 0.0009236453201970443, 0.002370473196582088)
2026-06-20 05:42:43,186 - optuna.study.study - INFO - Trial 114 finished with values: [0.004240389480353551, 0.0009236453201970443, 0.002370473196582088] and parameters: {'n_layers': 2, 'embedding_dim': 32, 'lr': 0.06228508396915779, 'lambda_val': 1.0112597680663849e-05, 'batch_size': 1192, 'optimizer': 'RMSprop'}.
2026-06-20 05:44:12,201 - experiment_functions - INFO - Early stopping at epoch 2150. Best Metrics: (0.03262801393744707, 0.006656561828975623, 0.018726785817582265)
2026-06-20 05:44:12,287 - optuna.study.study - INFO - Trial 115 finished with values: [0.03262801393744707, 0.006656561828975623, 0.018726785817582265] and parameters: {'n_layers': 1, 'embedding_dim': 32, 'lr': 0.002099990505043131, 'lambda_val': 3.64590979484011e-06, 'batch_size': 2973, 'optimizer': 'Adam'}.
2026-06-20 05:47:03,480 - optuna.study.study - INFO - Trial 116 finished with values: [0.032151426280772104, 0.006876026272577998, 0.019000761033778162] and parameters: {'n_layers': 1, 'embedding_dim': 96, 'lr': 0.0006438418474980425, 'lambda_val': 5.8148367269156115e-06, 'batch_size': 3338, 'optimizer': 'RMSprop'}.
2026-06-20 05:47:33,200 - experiment_functions - INFO - Early stopping at epoch 650. Best Metrics: (0.026719411899783035, 0.005644499178981938, 0.01523153094621789)
2026-06-20 05:47:33,291 - optuna.study.study - INFO - Trial 117 finished with values: [0.026719411899783035, 0.005644499178981938, 0.01523153094621789] and parameters: {'n_layers': 1, 'embedding_dim': 96, 'lr': 0.006590049461749219, 'lambda_val': 1.0112597680663849e-05, 'batch_size': 3153, 'optimizer': 'Adam'}.
2026-06-20 05:50:16,847 - optuna.study.study - INFO - Trial 118 finished with values: [0.011032820098543169, 0.002519893899204244, 0.006491279335206752] and parameters: {'n_layers': 3, 'embedding_dim': 32, 'lr': 0.00021874714734455622, 'lambda_val': 1.0112597680663849e-05, 'batch_size': 1299, 'optimizer': 'RMSprop'}.
2026-06-20 05:50:42,264 - experiment_functions - INFO - Early stopping at epoch 550. Best Metrics: (0.010909616939301004, 0.002360426929392447, 0.006114174087885605)
2026-06-20 05:50:42,349 - optuna.study.study - INFO - Trial 119 finished with values: [0.010909616939301004, 0.002360426929392447, 0.006114174087885605] and parameters: {'n_layers': 4, 'embedding_dim': 32, 'lr': 0.002488784556108625, 'lambda_val': 0.002024957033624206, 'batch_size': 3770, 'optimizer': 'RMSprop'}.
2026-06-20 05:51:18,087 - experiment_functions - INFO - Early stopping at epoch 800. Best Metrics: (0.022040125807874636, 0.004712959454338765, 0.012316056883178475)
2026-06-20 05:51:18,426 - optuna.study.study - INFO - Trial 120 finished with values: [0.022040125807874636, 0.004712959454338765, 0.012316056883178475] and parameters: {'n_layers': 3, 'embedding_dim': 32, 'lr': 0.0015608654005494732, 'lambda_val': 1.6265345504793854e-05, 'batch_size': 2266, 'optimizer': 'Adam'}.
2026-06-20 05:51:45,444 - experiment_functions - INFO - Early stopping at epoch 600. Best Metrics: (0.021903438580618353, 0.004716117216117217, 0.012311750517838373)
2026-06-20 05:51:45,527 - optuna.study.study - INFO - Trial 121 finished with values: [0.021903438580618353, 0.004716117216117217, 0.012311750517838373] and parameters: {'n_layers': 1, 'embedding_dim': 32, 'lr': 0.004958786625127089, 'lambda_val': 3.64590979484011e-06, 'batch_size': 3527, 'optimizer': 'RMSprop'}.
2026-06-20 05:54:32,766 - optuna.study.study - INFO - Trial 122 finished with values: [0.0203751791832923, 0.0044919161298471654, 0.011410138314596235] and parameters: {'n_layers': 3, 'embedding_dim': 32, 'lr': 0.0002653271550803203, 'lambda_val': 1.0112597680663849e-05, 'batch_size': 2973, 'optimizer': 'RMSprop'}.
2026-06-20 05:55:02,622 - experiment_functions - INFO - Early stopping at epoch 650. Best Metrics: (0.027181455174681676, 0.005685550082101806, 0.015875422920819518)
2026-06-20 05:55:02,737 - optuna.study.study - INFO - Trial 123 finished with values: [0.027181455174681676, 0.005685550082101806, 0.015875422920819518] and parameters: {'n_layers': 1, 'embedding_dim': 96, 'lr': 0.006590049461749219, 'lambda_val': 3.64590979484011e-06, 'batch_size': 3646, 'optimizer': 'Adam'}.
2026-06-20 05:56:42,481 - experiment_functions - INFO - Early stopping at epoch 2400. Best Metrics: (0.03279892351298857, 0.006819186560565871, 0.018596704267436318)
2026-06-20 05:56:42,568 - optuna.study.study - INFO - Trial 124 finished with values: [0.03279892351298857, 0.006819186560565871, 0.018596704267436318] and parameters: {'n_layers': 1, 'embedding_dim': 32, 'lr': 0.0012953028594055518, 'lambda_val': 6.868274004831431e-05, 'batch_size': 3338, 'optimizer': 'RMSprop'}.
2026-06-20 05:57:06,992 - experiment_functions - INFO - Early stopping at epoch 550. Best Metrics: (0.005123172394993942, 0.001130478716685613, 0.0027489211114755476)
2026-06-20 05:57:07,097 - optuna.study.study - INFO - Trial 125 finished with values: [0.005123172394993942, 0.001130478716685613, 0.0027489211114755476] and parameters: {'n_layers': 3, 'embedding_dim': 32, 'lr': 0.002099990505043131, 'lambda_val': 0.024205880733871414, 'batch_size': 2313, 'optimizer': 'RMSprop'}.
2026-06-20 06:00:56,178 - optuna.study.study - INFO - Trial 126 finished with values: [0.024302383793841337, 0.0053634583806997605, 0.014101087501043703] and parameters: {'n_layers': 3, 'embedding_dim': 256, 'lr': 0.00022027863565489018, 'lambda_val': 4.303236972228742e-06, 'batch_size': 1869, 'optimizer': 'RMSprop'}.
2026-06-20 06:01:26,375 - experiment_functions - INFO - Early stopping at epoch 550. Best Metrics: (0.00839073545307621, 0.001823607427055703, 0.004682948560672106)
2026-06-20 06:01:26,467 - optuna.study.study - INFO - Trial 127 finished with values: [0.00839073545307621, 0.001823607427055703, 0.004682948560672106] and parameters: {'n_layers': 4, 'embedding_dim': 128, 'lr': 0.019230906139883923, 'lambda_val': 0.00012018704157732538, 'batch_size': 3213, 'optimizer': 'RMSprop'}.
2026-06-20 06:01:51,329 - experiment_functions - INFO - Early stopping at epoch 550. Best Metrics: (0.014906281845774352, 0.0032556523935834284, 0.0083371220444459)
2026-06-20 06:01:51,415 - optuna.study.study - INFO - Trial 128 finished with values: [0.014906281845774352, 0.0032556523935834284, 0.0083371220444459] and parameters: {'n_layers': 1, 'embedding_dim': 64, 'lr': 0.033323910818478145, 'lambda_val': 3.64590979484011e-06, 'batch_size': 3334, 'optimizer': 'Adam'}.
2026-06-20 06:02:15,962 - experiment_functions - INFO - Early stopping at epoch 550. Best Metrics: (0.0046009312749315644, 0.0010073260073260072, 0.0026560340375714458)
2026-06-20 06:02:16,265 - optuna.study.study - INFO - Trial 129 finished with values: [0.0046009312749315644, 0.0010073260073260072, 0.0026560340375714458] and parameters: {'n_layers': 2, 'embedding_dim': 32, 'lr': 0.061381772770075456, 'lambda_val': 1.9616768085102623e-06, 'batch_size': 1174, 'optimizer': 'RMSprop'}.
2026-06-20 06:05:28,752 - optuna.study.study - INFO - Trial 130 finished with values: [0.0318224595759355, 0.0066612984716432995, 0.018338934628547937] and parameters: {'n_layers': 1, 'embedding_dim': 256, 'lr': 0.0012953028594055518, 'lambda_val': 3.64590979484011e-06, 'batch_size': 757, 'optimizer': 'RMSprop'}.
2026-06-20 06:06:06,498 - experiment_functions - INFO - Early stopping at epoch 900. Best Metrics: (0.013777665557205939, 0.002927245168624479, 0.007813689473026427)
2026-06-20 06:06:06,571 - optuna.study.study - INFO - Trial 131 finished with values: [0.013777665557205939, 0.002927245168624479, 0.007813689473026427] and parameters: {'n_layers': 1, 'embedding_dim': 32, 'lr': 0.007001952181523415, 'lambda_val': 0.0009091531694926743, 'batch_size': 2793, 'optimizer': 'RMSprop'}.
2026-06-20 06:07:06,710 - experiment_functions - INFO - Early stopping at epoch 1400. Best Metrics: (0.013094153517695216, 0.002725148414803587, 0.007012450206431567)
2026-06-20 06:07:06,780 - optuna.study.study - INFO - Trial 132 finished with values: [0.013094153517695216, 0.002725148414803587, 0.007012450206431567] and parameters: {'n_layers': 2, 'embedding_dim': 64, 'lr': 0.007284909067173104, 'lambda_val': 1.6265345504793854e-05, 'batch_size': 2266, 'optimizer': 'RMSprop'}.
2026-06-20 06:09:47,446 - experiment_functions - INFO - Early stopping at epoch 3850. Best Metrics: (0.028124276473989462, 0.005852911456359732, 0.015655705375918778)
2026-06-20 06:09:47,577 - optuna.study.study - INFO - Trial 133 finished with values: [0.028124276473989462, 0.005852911456359732, 0.015655705375918778] and parameters: {'n_layers': 3, 'embedding_dim': 32, 'lr': 0.0006438418474980425, 'lambda_val': 1.0112597680663849e-05, 'batch_size': 2062, 'optimizer': 'RMSprop'}.
2026-06-20 06:12:34,816 - optuna.study.study - INFO - Trial 134 finished with values: [0.02509453613778163, 0.005443981306050272, 0.013968885888700672] and parameters: {'n_layers': 3, 'embedding_dim': 32, 'lr': 0.00041090885210817534, 'lambda_val': 0.00554832927684527, 'batch_size': 850, 'optimizer': 'RMSprop'}.
2026-06-20 06:13:37,776 - experiment_functions - INFO - Early stopping at epoch 1400. Best Metrics: (0.031260380488296775, 0.006517620310723759, 0.01799651913745137)
2026-06-20 06:13:37,872 - optuna.study.study - INFO - Trial 135 finished with values: [0.031260380488296775, 0.006517620310723759, 0.01799651913745137] and parameters: {'n_layers': 1, 'embedding_dim': 128, 'lr': 0.0012953028594055518, 'lambda_val': 0.00012018704157732538, 'batch_size': 3213, 'optimizer': 'RMSprop'}.
