2026-06-17 03:29:29,578 - optuna.study.study - INFO - Trial 243 finished with values: [0.024370287343860583, 0.005492926613616269, 0.014187996539416407] and parameters: {'n_layers': 3, 'embedding_dim': 256, 'lr': 0.00018562220957177872, 'lambda_val': 2.6858232738417883e-06, 'batch_size': 1265, 'optimizer': 'RMSprop'}.
2026-06-17 03:30:49,767 - experiment_functions - INFO - Early stopping at epoch 1700. Best Metrics: (0.02405637570897925, 0.005361879499810535, 0.014740294282249251)
2026-06-17 03:30:49,852 - optuna.study.study - INFO - Trial 244 finished with values: [0.02405637570897925, 0.005361879499810535, 0.014740294282249251] and parameters: {'n_layers': 4, 'embedding_dim': 32, 'lr': 0.0007178694642074494, 'lambda_val': 4.135303611597987e-06, 'batch_size': 1373, 'optimizer': 'Adam'}.
2026-06-17 03:34:15,526 - optuna.study.study - INFO - Trial 245 finished with values: [0.018164808100688573, 0.004120879120879121, 0.010734503990531568] and parameters: {'n_layers': 4, 'embedding_dim': 64, 'lr': 0.00018562220957177872, 'lambda_val': 2.6858232738417883e-06, 'batch_size': 1265, 'optimizer': 'RMSprop'}.
2026-06-17 03:37:27,998 - optuna.study.study - INFO - Trial 246 finished with values: [0.03683869874776684, 0.007993873942149805, 0.021801980637232682] and parameters: {'n_layers': 1, 'embedding_dim': 128, 'lr': 0.0006340132793158045, 'lambda_val': 2.970506579255523e-05, 'batch_size': 3321, 'optimizer': 'RMSprop'}.
2026-06-17 03:38:44,851 - experiment_functions - INFO - Early stopping at epoch 1650. Best Metrics: (0.023803120310689495, 0.00521978021978022, 0.013544810778024179)
2026-06-17 03:38:44,922 - optuna.study.study - INFO - Trial 247 finished with values: [0.023803120310689495, 0.00521978021978022, 0.013544810778024179] and parameters: {'n_layers': 3, 'embedding_dim': 32, 'lr': 0.0006340132793158045, 'lambda_val': 3.327121177308548e-05, 'batch_size': 3321, 'optimizer': 'Adam'}.
2026-06-17 03:39:31,225 - experiment_functions - INFO - Early stopping at epoch 850. Best Metrics: (0.025113795023404974, 0.005575028419856007, 0.014260186506473151)
2026-06-17 03:39:31,291 - optuna.study.study - INFO - Trial 248 finished with values: [0.025113795023404974, 0.005575028419856007, 0.014260186506473151] and parameters: {'n_layers': 2, 'embedding_dim': 128, 'lr': 0.0007178694642074494, 'lambda_val': 1.0697648887853802e-06, 'batch_size': 3992, 'optimizer': 'RMSprop'}.
2026-06-17 03:42:36,106 - optuna.study.study - INFO - Trial 249 finished with values: [0.01624393568042245, 0.0037103700896804347, 0.009048957329467087] and parameters: {'n_layers': 4, 'embedding_dim': 32, 'lr': 0.00019423405222093108, 'lambda_val': 0.007570847927224204, 'batch_size': 3920, 'optimizer': 'Adam'}.
2026-06-17 03:45:08,778 - experiment_functions - INFO - Early stopping at epoch 3350. Best Metrics: (0.03377337615139598, 0.0074807376531514464, 0.019459384323802887)
2026-06-17 03:45:08,854 - optuna.study.study - INFO - Trial 250 finished with values: [0.03377337615139598, 0.0074807376531514464, 0.019459384323802887] and parameters: {'n_layers': 1, 'embedding_dim': 64, 'lr': 0.0007178694642074494, 'lambda_val': 2.970506579255523e-05, 'batch_size': 2369, 'optimizer': 'RMSprop'}.
2026-06-17 03:46:36,497 - experiment_functions - INFO - Early stopping at epoch 1650. Best Metrics: (0.030813655804431548, 0.006552355690286725, 0.017519399269630212)
2026-06-17 03:46:36,586 - optuna.study.study - INFO - Trial 251 finished with values: [0.030813655804431548, 0.006552355690286725, 0.017519399269630212] and parameters: {'n_layers': 2, 'embedding_dim': 128, 'lr': 0.0006340132793158045, 'lambda_val': 2.970506579255523e-05, 'batch_size': 3321, 'optimizer': 'Adam'}.
2026-06-17 03:50:04,049 - optuna.study.study - INFO - Trial 252 finished with values: [0.014523654774987842, 0.0031119742326638877, 0.00826085189824061] and parameters: {'n_layers': 2, 'embedding_dim': 128, 'lr': 0.005395174614156066, 'lambda_val': 6.061770011101054e-06, 'batch_size': 2889, 'optimizer': 'RMSprop'}.
2026-06-17 03:51:55,723 - experiment_functions - INFO - Early stopping at epoch 2100. Best Metrics: (0.030342013542239046, 0.006711822660098523, 0.017812923191807477)
2026-06-17 03:51:55,792 - optuna.study.study - INFO - Trial 253 finished with values: [0.030342013542239046, 0.006711822660098523, 0.017812923191807477] and parameters: {'n_layers': 2, 'embedding_dim': 128, 'lr': 0.0006340132793158045, 'lambda_val': 1.0697648887853802e-06, 'batch_size': 1265, 'optimizer': 'Adam'}.
2026-06-17 03:52:25,166 - experiment_functions - INFO - Early stopping at epoch 600. Best Metrics: (0.02276003419676088, 0.005039787798408487, 0.012664787967221185)
2026-06-17 03:52:25,250 - optuna.study.study - INFO - Trial 254 finished with values: [0.02276003419676088, 0.005039787798408487, 0.012664787967221185] and parameters: {'n_layers': 1, 'embedding_dim': 32, 'lr': 0.009313279681060072, 'lambda_val': 2.970506579255523e-05, 'batch_size': 2369, 'optimizer': 'Adam'}.
2026-06-17 03:53:03,124 - experiment_functions - INFO - Early stopping at epoch 700. Best Metrics: (0.02363509241613547, 0.005192939244663383, 0.013618284154508942)
2026-06-17 03:53:03,226 - optuna.study.study - INFO - Trial 255 finished with values: [0.02363509241613547, 0.005192939244663383, 0.013618284154508942] and parameters: {'n_layers': 2, 'embedding_dim': 128, 'lr': 0.0017542874983550202, 'lambda_val': 4.546254137443526e-06, 'batch_size': 2369, 'optimizer': 'Adam'}.
2026-06-17 03:55:56,636 - experiment_functions - INFO - Early stopping at epoch 3350. Best Metrics: (0.012174293483682534, 0.0025735758494379183, 0.0068806080532503545)
2026-06-17 03:55:56,703 - optuna.study.study - INFO - Trial 256 finished with values: [0.012174293483682534, 0.0025735758494379183, 0.0068806080532503545] and parameters: {'n_layers': 2, 'embedding_dim': 128, 'lr': 0.0017542874983550202, 'lambda_val': 3.892192961216096e-05, 'batch_size': 3992, 'optimizer': 'RMSprop'}.
2026-06-17 03:56:21,835 - experiment_functions - INFO - Early stopping at epoch 500. Best Metrics: (0.0004976015209793151, 9.631173424276874e-05, 0.0002487558594040762)
2026-06-17 03:56:21,966 - optuna.study.study - INFO - Trial 257 finished with values: [0.0004976015209793151, 9.631173424276874e-05, 0.0002487558594040762] and parameters: {'n_layers': 2, 'embedding_dim': 64, 'lr': 0.0007178694642074494, 'lambda_val': 1.0697648887853802e-06, 'batch_size': 2691, 'optimizer': 'SGD'}.
2026-06-17 03:57:02,780 - experiment_functions - INFO - Early stopping at epoch 800. Best Metrics: (0.023866784904083737, 0.005207149172666414, 0.013124331286122677)
2026-06-17 03:57:02,838 - optuna.study.study - INFO - Trial 258 finished with values: [0.023866784904083737, 0.005207149172666414, 0.013124331286122677] and parameters: {'n_layers': 2, 'embedding_dim': 64, 'lr': 0.0017542874983550202, 'lambda_val': 4.546254137443526e-06, 'batch_size': 1588, 'optimizer': 'Adam'}.
2026-06-17 03:58:28,805 - experiment_functions - INFO - Early stopping at epoch 1800. Best Metrics: (0.0006378080916235037, 0.0001310471138057345, 0.00033432238411392195)
2026-06-17 03:58:28,873 - optuna.study.study - INFO - Trial 259 finished with values: [0.0006378080916235037, 0.0001310471138057345, 0.00033432238411392195] and parameters: {'n_layers': 3, 'embedding_dim': 64, 'lr': 2.1598324971775075e-05, 'lambda_val': 2.970506579255523e-05, 'batch_size': 2889, 'optimizer': 'Adam'}.
2026-06-17 04:00:24,516 - experiment_functions - INFO - Early stopping at epoch 2500. Best Metrics: (0.02648281012494413, 0.005622394846532778, 0.014872561258899606)
2026-06-17 04:00:24,598 - optuna.study.study - INFO - Trial 260 finished with values: [0.02648281012494413, 0.005622394846532778, 0.014872561258899606] and parameters: {'n_layers': 3, 'embedding_dim': 32, 'lr': 0.0005720154371948887, 'lambda_val': 1.0768752731630495e-05, 'batch_size': 2889, 'optimizer': 'Adam'}.
2026-06-17 04:01:02,993 - experiment_functions - INFO - Early stopping at epoch 600. Best Metrics: (0.014412620616577948, 0.0032035493242389794, 0.007959564956918293)
2026-06-17 04:01:03,099 - optuna.study.study - INFO - Trial 261 finished with values: [0.014412620616577948, 0.0032035493242389794, 0.007959564956918293] and parameters: {'n_layers': 4, 'embedding_dim': 128, 'lr': 0.0017542874983550202, 'lambda_val': 4.2954594420323106e-05, 'batch_size': 3992, 'optimizer': 'Adam'}.
2026-06-17 04:01:31,215 - experiment_functions - INFO - Early stopping at epoch 500. Best Metrics: (0.0005589184927139666, 0.00012157382847038019, 0.0003038474317004765)
2026-06-17 04:01:31,281 - optuna.study.study - INFO - Trial 262 finished with values: [0.0005589184927139666, 0.00012157382847038019, 0.0003038474317004765] and parameters: {'n_layers': 2, 'embedding_dim': 128, 'lr': 3.4619595069109726e-05, 'lambda_val': 4.3811015297219245e-05, 'batch_size': 3321, 'optimizer': 'Adam'}.
2026-06-17 04:04:34,561 - optuna.study.study - INFO - Trial 263 finished with values: [0.03565219658056635, 0.007845459138562586, 0.02075762047720406] and parameters: {'n_layers': 1, 'embedding_dim': 64, 'lr': 0.0007178694642074494, 'lambda_val': 2.970506579255523e-05, 'batch_size': 2889, 'optimizer': 'RMSprop'}.
2026-06-17 04:05:18,994 - experiment_functions - INFO - Early stopping at epoch 900. Best Metrics: (0.00048428563860443137, 0.00012788935202728306, 0.00029787838531669366)
2026-06-17 04:05:19,088 - optuna.study.study - INFO - Trial 264 finished with values: [0.00048428563860443137, 0.00012788935202728306, 0.00029787838531669366] and parameters: {'n_layers': 4, 'embedding_dim': 32, 'lr': 2.1178513647098602e-05, 'lambda_val': 0.00026117262367184973, 'batch_size': 2889, 'optimizer': 'Adam'}.
2026-06-17 04:07:40,362 - experiment_functions - INFO - Early stopping at epoch 2700. Best Metrics: (0.027737654895358534, 0.006042377163066818, 0.016011031943399562)
2026-06-17 04:07:40,425 - optuna.study.study - INFO - Trial 265 finished with values: [0.027737654895358534, 0.006042377163066818, 0.016011031943399562] and parameters: {'n_layers': 2, 'embedding_dim': 128, 'lr': 0.0006340132793158045, 'lambda_val': 6.67969903638883e-05, 'batch_size': 1385, 'optimizer': 'RMSprop'}.
2026-06-17 04:08:46,647 - experiment_functions - INFO - Early stopping at epoch 1400. Best Metrics: (0.029671689036628843, 0.006437097385373248, 0.017001604054065245)
2026-06-17 04:08:46,726 - optuna.study.study - INFO - Trial 266 finished with values: [0.029671689036628843, 0.006437097385373248, 0.017001604054065245] and parameters: {'n_layers': 2, 'embedding_dim': 64, 'lr': 0.0007178694642074494, 'lambda_val': 7.562632187350467e-06, 'batch_size': 2369, 'optimizer': 'Adam'}.
2026-06-17 04:10:15,345 - experiment_functions - INFO - Early stopping at epoch 1900. Best Metrics: (0.03528418549666328, 0.0075407351269420235, 0.020773683493656173)
2026-06-17 04:10:15,431 - optuna.study.study - INFO - Trial 267 finished with values: [0.03528418549666328, 0.0075407351269420235, 0.020773683493656173] and parameters: {'n_layers': 1, 'embedding_dim': 64, 'lr': 0.0017542874983550202, 'lambda_val': 4.546254137443526e-06, 'batch_size': 1265, 'optimizer': 'Adam'}.
2026-06-17 04:12:09,893 - experiment_functions - INFO - Early stopping at epoch 1600. Best Metrics: (0.016489355940944722, 0.0034688013136289003, 0.00913476905692805)
2026-06-17 04:12:09,967 - optuna.study.study - INFO - Trial 268 finished with values: [0.016489355940944722, 0.0034688013136289003, 0.00913476905692805] and parameters: {'n_layers': 3, 'embedding_dim': 256, 'lr': 0.0006340132793158045, 'lambda_val': 2.6858232738417883e-06, 'batch_size': 1265, 'optimizer': 'RMSprop'}.
2026-06-17 04:15:36,355 - optuna.study.study - INFO - Trial 269 finished with values: [0.030795332894831745, 0.0067544524441076155, 0.017578705484553148] and parameters: {'n_layers': 2, 'embedding_dim': 128, 'lr': 0.00031994810578956647, 'lambda_val': 1.0697648887853802e-06, 'batch_size': 1627, 'optimizer': 'RMSprop'}.
2026-06-17 04:18:47,877 - optuna.study.study - INFO - Trial 270 finished with values: [0.03648280384937835, 0.007990716180371353, 0.02088115205286] and parameters: {'n_layers': 1, 'embedding_dim': 128, 'lr': 0.0007178694642074494, 'lambda_val': 2.970506579255523e-05, 'batch_size': 2889, 'optimizer': 'Adam'}.
2026-06-17 04:19:44,390 - experiment_functions - INFO - Early stopping at epoch 1150. Best Metrics: (0.02333183134986656, 0.005783440697233801, 0.013516656632268097)
2026-06-17 04:19:44,471 - optuna.study.study - INFO - Trial 271 finished with values: [0.02333183134986656, 0.005783440697233801, 0.013516656632268097] and parameters: {'n_layers': 1, 'embedding_dim': 128, 'lr': 0.0006340132793158045, 'lambda_val': 0.03605288878211677, 'batch_size': 3543, 'optimizer': 'RMSprop'}.
2026-06-17 04:20:10,951 - experiment_functions - INFO - Early stopping at epoch 500. Best Metrics: (0.0005505199934441684, 0.00011841606669192877, 0.00029521934086670844)
2026-06-17 04:20:11,015 - optuna.study.study - INFO - Trial 272 finished with values: [0.0005505199934441684, 0.00011841606669192877, 0.00029521934086670844] and parameters: {'n_layers': 2, 'embedding_dim': 128, 'lr': 0.0006340132793158045, 'lambda_val': 2.970506579255523e-05, 'batch_size': 3321, 'optimizer': 'SGD'}.
2026-06-17 04:20:38,071 - experiment_functions - INFO - Early stopping at epoch 600. Best Metrics: (0.027762873015902505, 0.006096059113300492, 0.016269733795773053)
2026-06-17 04:20:38,140 - optuna.study.study - INFO - Trial 273 finished with values: [0.027762873015902505, 0.006096059113300492, 0.016269733795773053] and parameters: {'n_layers': 1, 'embedding_dim': 32, 'lr': 0.006977372592739754, 'lambda_val': 0.0016629548201790576, 'batch_size': 2889, 'optimizer': 'Adam'}.
2026-06-17 04:21:02,444 - experiment_functions - INFO - Early stopping at epoch 500. Best Metrics: (0.0005422064634743267, 0.00010262725779967159, 0.00027838473432594224)
2026-06-17 04:21:02,511 - optuna.study.study - INFO - Trial 274 finished with values: [0.0005422064634743267, 0.00010262725779967159, 0.00027838473432594224] and parameters: {'n_layers': 1, 'embedding_dim': 128, 'lr': 0.0007178694642074494, 'lambda_val': 1.3976665248992833e-06, 'batch_size': 2140, 'optimizer': 'SGD'}.
2026-06-17 04:23:39,029 - experiment_functions - INFO - Early stopping at epoch 3450. Best Metrics: (0.030665211433325835, 0.006729190349880005, 0.01773240493332112)
2026-06-17 04:23:39,186 - optuna.study.study - INFO - Trial 275 finished with values: [0.030665211433325835, 0.006729190349880005, 0.01773240493332112] and parameters: {'n_layers': 2, 'embedding_dim': 32, 'lr': 0.0006628139134621098, 'lambda_val': 1.0768752731630495e-05, 'batch_size': 2889, 'optimizer': 'Adam'}.
2026-06-17 04:24:37,176 - experiment_functions - INFO - Early stopping at epoch 1050. Best Metrics: (0.0258444919627334, 0.005755020841227738, 0.015025656508947034)
2026-06-17 04:24:37,251 - optuna.study.study - INFO - Trial 276 finished with values: [0.0258444919627334, 0.005755020841227738, 0.015025656508947034] and parameters: {'n_layers': 2, 'embedding_dim': 128, 'lr': 0.0006340132793158045, 'lambda_val': 2.970506579255523e-05, 'batch_size': 3992, 'optimizer': 'RMSprop'}.
2026-06-17 04:27:02,342 - experiment_functions - INFO - Early stopping at epoch 2700. Best Metrics: (0.03078127913526961, 0.006547619047619049, 0.017351596073402375)
2026-06-17 04:27:02,430 - optuna.study.study - INFO - Trial 277 finished with values: [0.03078127913526961, 0.006547619047619049, 0.017351596073402375] and parameters: {'n_layers': 2, 'embedding_dim': 128, 'lr': 0.0006340132793158045, 'lambda_val': 1.0697648887853802e-06, 'batch_size': 2140, 'optimizer': 'Adam'}.
2026-06-17 04:27:25,052 - experiment_functions - INFO - Early stopping at epoch 500. Best Metrics: (0.00042308623148166227, 0.00010736390046734875, 0.00023970082330298682)
2026-06-17 04:27:25,144 - optuna.study.study - INFO - Trial 278 finished with values: [0.00042308623148166227, 0.00010736390046734875, 0.00023970082330298682] and parameters: {'n_layers': 1, 'embedding_dim': 32, 'lr': 0.0007178694642074494, 'lambda_val': 2.970506579255523e-05, 'batch_size': 2889, 'optimizer': 'SGD'}.
2026-06-17 04:31:33,152 - optuna.study.study - INFO - Trial 279 finished with values: [0.02256534444833741, 0.0045077049387394225, 0.012633753174862651] and parameters: {'n_layers': 2, 'embedding_dim': 256, 'lr': 0.011485594305176742, 'lambda_val': 0.00010118171226999938, 'batch_size': 3052, 'optimizer': 'RMSprop'}.
2026-06-17 04:34:47,774 - optuna.study.study - INFO - Trial 280 finished with values: [0.03653326709673391, 0.007951244158140709, 0.02107685023833694] and parameters: {'n_layers': 1, 'embedding_dim': 128, 'lr': 0.0005484028641850405, 'lambda_val': 4.546254137443526e-06, 'batch_size': 3333, 'optimizer': 'RMSprop'}.
2026-06-17 04:35:34,555 - experiment_functions - INFO - Early stopping at epoch 700. Best Metrics: (0.024636325746218345, 0.005409245926487306, 0.013762890947401978)
2026-06-17 04:35:34,673 - optuna.study.study - INFO - Trial 281 finished with values: [0.024636325746218345, 0.005409245926487306, 0.013762890947401978] and parameters: {'n_layers': 2, 'embedding_dim': 256, 'lr': 0.0017542874983550202, 'lambda_val': 2.970506579255523e-05, 'batch_size': 2889, 'optimizer': 'Adam'}.
2026-06-17 04:36:13,267 - experiment_functions - INFO - Early stopping at epoch 700. Best Metrics: (0.026789472539535134, 0.005788177339901477, 0.015437213742881309)
2026-06-17 04:36:13,342 - optuna.study.study - INFO - Trial 282 finished with values: [0.026789472539535134, 0.005788177339901477, 0.015437213742881309] and parameters: {'n_layers': 2, 'embedding_dim': 128, 'lr': 0.0017542874983550202, 'lambda_val': 4.452669285059839e-06, 'batch_size': 3992, 'optimizer': 'Adam'}.
2026-06-17 04:37:14,749 - experiment_functions - INFO - Early stopping at epoch 1150. Best Metrics: (0.027105882344298775, 0.005955538714159403, 0.01577941956709689)
2026-06-17 04:37:14,823 - optuna.study.study - INFO - Trial 283 finished with values: [0.027105882344298775, 0.005955538714159403, 0.01577941956709689] and parameters: {'n_layers': 2, 'embedding_dim': 128, 'lr': 0.0006340132793158045, 'lambda_val': 4.546254137443526e-06, 'batch_size': 3321, 'optimizer': 'RMSprop'}.
2026-06-17 04:38:23,488 - experiment_functions - INFO - Early stopping at epoch 1300. Best Metrics: (0.028811202017323664, 0.006364468864468866, 0.016502838478765578)
2026-06-17 04:38:23,570 - optuna.study.study - INFO - Trial 284 finished with values: [0.028811202017323664, 0.006364468864468866, 0.016502838478765578] and parameters: {'n_layers': 2, 'embedding_dim': 96, 'lr': 0.0007178694642074494, 'lambda_val': 1.3976665248992833e-06, 'batch_size': 2369, 'optimizer': 'Adam'}.
2026-06-17 04:39:07,456 - experiment_functions - INFO - Early stopping at epoch 750. Best Metrics: (0.016195476502651424, 0.0036377415687760518, 0.009014586953289236)
2026-06-17 04:39:07,523 - optuna.study.study - INFO - Trial 285 finished with values: [0.016195476502651424, 0.0036377415687760518, 0.009014586953289236] and parameters: {'n_layers': 3, 'embedding_dim': 128, 'lr': 0.0008270706330290616, 'lambda_val': 0.007803500138718635, 'batch_size': 3321, 'optimizer': 'Adam'}.
2026-06-17 04:42:45,885 - experiment_functions - INFO - Early stopping at epoch 3650. Best Metrics: (0.0005305990903653095, 0.00013420487558418593, 0.0002986747787396377)
2026-06-17 04:42:45,973 - optuna.study.study - INFO - Trial 286 finished with values: [0.0005305990903653095, 0.00013420487558418593, 0.0002986747787396377] and parameters: {'n_layers': 4, 'embedding_dim': 128, 'lr': 2.6548744932242004e-05, 'lambda_val': 1.0697648887853802e-06, 'batch_size': 3321, 'optimizer': 'RMSprop'}.
2026-06-17 04:43:28,434 - experiment_functions - INFO - Early stopping at epoch 900. Best Metrics: (0.0327477789130697, 0.007185486926866238, 0.01877274244108799)
2026-06-17 04:43:28,511 - optuna.study.study - INFO - Trial 287 finished with values: [0.0327477789130697, 0.007185486926866238, 0.01877274244108799] and parameters: {'n_layers': 1, 'embedding_dim': 64, 'lr': 0.0017542874983550202, 'lambda_val': 6.191194298827482e-06, 'batch_size': 3992, 'optimizer': 'Adam'}.
2026-06-17 04:44:03,879 - experiment_functions - INFO - Early stopping at epoch 650. Best Metrics: (0.027050379524222262, 0.005865542503473538, 0.015784189372036312)
2026-06-17 04:44:03,962 - optuna.study.study - INFO - Trial 288 finished with values: [0.027050379524222262, 0.005865542503473538, 0.015784189372036312] and parameters: {'n_layers': 2, 'embedding_dim': 128, 'lr': 0.0019393087748017475, 'lambda_val': 1.3976665248992833e-06, 'batch_size': 3992, 'optimizer': 'Adam'}.
2026-06-17 04:44:50,816 - experiment_functions - INFO - Early stopping at epoch 950. Best Metrics: (0.023700762355511586, 0.005140836175318934, 0.01298687846045313)
2026-06-17 04:44:50,927 - optuna.study.study - INFO - Trial 289 finished with values: [0.023700762355511586, 0.005140836175318934, 0.01298687846045313] and parameters: {'n_layers': 2, 'embedding_dim': 64, 'lr': 0.0017542874983550202, 'lambda_val': 2.6858232738417883e-06, 'batch_size': 1265, 'optimizer': 'Adam'}.
2026-06-17 04:47:01,893 - experiment_functions - INFO - Early stopping at epoch 2800. Best Metrics: (0.029886392299178915, 0.006561828975622078, 0.01714774358958009)
2026-06-17 04:47:01,986 - optuna.study.study - INFO - Trial 290 finished with values: [0.029886392299178915, 0.006561828975622078, 0.01714774358958009] and parameters: {'n_layers': 2, 'embedding_dim': 32, 'lr': 0.0006628139134621098, 'lambda_val': 1.0768752731630495e-05, 'batch_size': 2889, 'optimizer': 'RMSprop'}.
2026-06-17 04:47:49,110 - experiment_functions - INFO - Early stopping at epoch 1000. Best Metrics: (0.011423613829672302, 0.002379373500063155, 0.006621537899299857)
