2026-06-19 00:03:53,090 - optuna.study.study - INFO - Trial 33 finished with values: [0.0007035493540654007, 0.0001294682329165088, 0.0003471250457957235] and parameters: {'n_layers': 1, 'embedding_dim': 128, 'lr': 2.7037183675152418e-05, 'lambda_val': 0.013641524826342248, 'batch_size': 2762, 'optimizer': 'SGD'}.
2026-06-19 00:05:14,272 - experiment_functions - INFO - Early stopping at epoch 1900. Best Metrics: (0.027719841014455127, 0.005785019578123027, 0.0156766275140096)
2026-06-19 00:05:14,368 - optuna.study.study - INFO - Trial 34 finished with values: [0.027719841014455127, 0.005785019578123027, 0.0156766275140096] and parameters: {'n_layers': 1, 'embedding_dim': 32, 'lr': 0.003327615910950817, 'lambda_val': 0.0008294227855036249, 'batch_size': 844, 'optimizer': 'Adam'}.
2026-06-19 00:07:58,583 - optuna.study.study - INFO - Trial 35 finished with values: [0.0006897106756258341, 0.00017051913603637742, 0.0004588455338344029] and parameters: {'n_layers': 2, 'embedding_dim': 32, 'lr': 8.75863633559598e-05, 'lambda_val': 1.620350543179136e-06, 'batch_size': 3511, 'optimizer': 'RMSprop'}.
2026-06-19 00:08:44,102 - experiment_functions - INFO - Early stopping at epoch 950. Best Metrics: (0.020323902638415152, 0.004264557281798661, 0.011113046574856197)
2026-06-19 00:08:44,185 - optuna.study.study - INFO - Trial 36 finished with values: [0.020323902638415152, 0.004264557281798661, 0.011113046574856197] and parameters: {'n_layers': 4, 'embedding_dim': 64, 'lr': 0.0012134658370028314, 'lambda_val': 0.0001180174950905876, 'batch_size': 1184, 'optimizer': 'Adam'}.
2026-06-19 00:09:54,894 - experiment_functions - INFO - Early stopping at epoch 1450. Best Metrics: (0.009184877845921303, 0.002199381078691424, 0.004978606338253389)
2026-06-19 00:09:54,991 - optuna.study.study - INFO - Trial 37 finished with values: [0.009184877845921303, 0.002199381078691424, 0.004978606338253389] and parameters: {'n_layers': 1, 'embedding_dim': 256, 'lr': 0.0018715145286522033, 'lambda_val': 0.05682316696015936, 'batch_size': 571, 'optimizer': 'Adam'}.
2026-06-19 00:11:21,540 - experiment_functions - INFO - Early stopping at epoch 1800. Best Metrics: (0.026673134671924052, 0.005702917771883289, 0.015152239337533308)
2026-06-19 00:11:21,631 - optuna.study.study - INFO - Trial 38 finished with values: [0.026673134671924052, 0.005702917771883289, 0.015152239337533308] and parameters: {'n_layers': 2, 'embedding_dim': 128, 'lr': 0.000870520171613823, 'lambda_val': 0.003077942483029095, 'batch_size': 739, 'optimizer': 'Adam'}.
2026-06-19 00:11:55,679 - experiment_functions - INFO - Early stopping at epoch 700. Best Metrics: (0.012765411821588819, 0.003021978021978022, 0.006947524610072712)
2026-06-19 00:11:55,827 - optuna.study.study - INFO - Trial 39 finished with values: [0.012765411821588819, 0.003021978021978022, 0.006947524610072712] and parameters: {'n_layers': 2, 'embedding_dim': 128, 'lr': 0.001605678255663719, 'lambda_val': 0.03975450381102954, 'batch_size': 3252, 'optimizer': 'Adam'}.
2026-06-19 00:12:39,549 - experiment_functions - INFO - Early stopping at epoch 900. Best Metrics: (0.024525812403116777, 0.005215043577112543, 0.013762777720437035)
2026-06-19 00:12:39,674 - optuna.study.study - INFO - Trial 40 finished with values: [0.024525812403116777, 0.005215043577112543, 0.013762777720437035] and parameters: {'n_layers': 2, 'embedding_dim': 128, 'lr': 0.0009110225934635639, 'lambda_val': 0.000485389202309046, 'batch_size': 3033, 'optimizer': 'RMSprop'}.
2026-06-19 00:13:06,371 - experiment_functions - INFO - Early stopping at epoch 550. Best Metrics: (0.00615105676657429, 0.0012994189718327652, 0.0033174429350973245)
2026-06-19 00:13:06,472 - optuna.study.study - INFO - Trial 41 finished with values: [0.00615105676657429, 0.0012994189718327652, 0.0033174429350973245] and parameters: {'n_layers': 4, 'embedding_dim': 64, 'lr': 0.04730092851845055, 'lambda_val': 4.9243503314799367e-05, 'batch_size': 1584, 'optimizer': 'RMSprop'}.
2026-06-19 00:15:50,886 - optuna.study.study - INFO - Trial 42 finished with values: [0.0007053052861197689, 0.00015630920803334596, 0.000379859144405401] and parameters: {'n_layers': 3, 'embedding_dim': 32, 'lr': 6.905259164224799e-05, 'lambda_val': 0.002790274324800791, 'batch_size': 3267, 'optimizer': 'Adam'}.
2026-06-19 00:16:13,451 - experiment_functions - INFO - Early stopping at epoch 500. Best Metrics: (0.0005475302154669793, 0.00012315270935960593, 0.0002848941918828274)
2026-06-19 00:16:13,530 - optuna.study.study - INFO - Trial 43 finished with values: [0.0005475302154669793, 0.00012315270935960593, 0.0002848941918828274] and parameters: {'n_layers': 2, 'embedding_dim': 32, 'lr': 0.0007108251429428244, 'lambda_val': 1.6545299790722365e-06, 'batch_size': 3943, 'optimizer': 'SGD'}.
2026-06-19 00:16:37,843 - experiment_functions - INFO - Early stopping at epoch 550. Best Metrics: (0.014347824015753366, 0.0032319691802450428, 0.008137438674260103)
2026-06-19 00:16:37,936 - optuna.study.study - INFO - Trial 44 finished with values: [0.014347824015753366, 0.0032319691802450428, 0.008137438674260103] and parameters: {'n_layers': 1, 'embedding_dim': 32, 'lr': 0.03737766331140489, 'lambda_val': 5.034815386429636e-06, 'batch_size': 2712, 'optimizer': 'Adam'}.
2026-06-19 00:17:05,368 - experiment_functions - INFO - Early stopping at epoch 550. Best Metrics: (0.0055516900734607685, 0.0013073133762788935, 0.0031910339904089916)
2026-06-19 00:17:05,528 - optuna.study.study - INFO - Trial 45 finished with values: [0.0055516900734607685, 0.0013073133762788935, 0.0031910339904089916] and parameters: {'n_layers': 3, 'embedding_dim': 96, 'lr': 0.0023153643048729558, 'lambda_val': 0.01509845004489135, 'batch_size': 2139, 'optimizer': 'RMSprop'}.
2026-06-19 00:17:49,040 - experiment_functions - INFO - Early stopping at epoch 800. Best Metrics: (0.019664086585181605, 0.0042156119742326635, 0.0111013936389932)
2026-06-19 00:17:49,123 - optuna.study.study - INFO - Trial 46 finished with values: [0.019664086585181605, 0.0042156119742326635, 0.0111013936389932] and parameters: {'n_layers': 4, 'embedding_dim': 128, 'lr': 0.0008568781075155826, 'lambda_val': 8.004253683939247e-06, 'batch_size': 3284, 'optimizer': 'Adam'}.
2026-06-19 00:18:13,891 - experiment_functions - INFO - Early stopping at epoch 550. Best Metrics: (0.013308522083922896, 0.0028593532903877735, 0.0070011667734864585)
2026-06-19 00:18:14,197 - optuna.study.study - INFO - Trial 47 finished with values: [0.013308522083922896, 0.0028593532903877735, 0.0070011667734864585] and parameters: {'n_layers': 2, 'embedding_dim': 32, 'lr': 0.01339497152493029, 'lambda_val': 0.002664675690305641, 'batch_size': 3161, 'optimizer': 'Adam'}.
2026-06-19 00:18:42,480 - experiment_functions - INFO - Early stopping at epoch 550. Best Metrics: (0.00807940516989418, 0.001845711759504863, 0.00474639378695483)
2026-06-19 00:18:42,558 - optuna.study.study - INFO - Trial 48 finished with values: [0.00807940516989418, 0.001845711759504863, 0.00474639378695483] and parameters: {'n_layers': 1, 'embedding_dim': 256, 'lr': 0.022537997280540817, 'lambda_val': 2.1506797112189853e-06, 'batch_size': 2145, 'optimizer': 'RMSprop'}.
2026-06-19 00:19:09,014 - experiment_functions - INFO - Early stopping at epoch 550. Best Metrics: (0.004930584038920659, 0.0010894278135657445, 0.0028486873837157674)
2026-06-19 00:19:09,109 - optuna.study.study - INFO - Trial 49 finished with values: [0.004930584038920659, 0.0010894278135657445, 0.0028486873837157674] and parameters: {'n_layers': 2, 'embedding_dim': 64, 'lr': 0.04662138468157106, 'lambda_val': 3.296773338266593e-05, 'batch_size': 1873, 'optimizer': 'RMSprop'}.
2026-06-19 00:22:06,387 - optuna.study.study - INFO - Trial 50 finished with values: [0.008246657189402493, 0.002002020967538209, 0.004712413185865151] and parameters: {'n_layers': 3, 'embedding_dim': 64, 'lr': 0.000255934009672208, 'lambda_val': 0.003077942483029095, 'batch_size': 695, 'optimizer': 'Adam'}.
2026-06-19 00:22:30,073 - experiment_functions - INFO - Early stopping at epoch 500. Best Metrics: (0.0004788189155187117, 0.00011683718580270304, 0.0002846141197196777)
2026-06-19 00:22:30,158 - optuna.study.study - INFO - Trial 51 finished with values: [0.0004788189155187117, 0.00011683718580270304, 0.0002846141197196777] and parameters: {'n_layers': 1, 'embedding_dim': 128, 'lr': 6.0791615509435556e-05, 'lambda_val': 2.2336851259886637e-06, 'batch_size': 2381, 'optimizer': 'SGD'}.
2026-06-19 00:22:59,053 - experiment_functions - INFO - Early stopping at epoch 550. Best Metrics: (0.005494949467683555, 0.0012567891878236708, 0.0031063597624231684)
2026-06-19 00:22:59,152 - optuna.study.study - INFO - Trial 52 finished with values: [0.005494949467683555, 0.0012567891878236708, 0.0031063597624231684] and parameters: {'n_layers': 4, 'embedding_dim': 96, 'lr': 0.004993717730990791, 'lambda_val': 0.02693650295479778, 'batch_size': 897, 'optimizer': 'Adam'}.
2026-06-19 00:25:57,696 - experiment_functions - INFO - Early stopping at epoch 3600. Best Metrics: (0.0005178630970509762, 0.0001278893520272831, 0.0002965555486562215)
2026-06-19 00:25:57,797 - optuna.study.study - INFO - Trial 53 finished with values: [0.0005178630970509762, 0.0001278893520272831, 0.0002965555486562215] and parameters: {'n_layers': 4, 'embedding_dim': 128, 'lr': 2.400690267276137e-05, 'lambda_val': 0.0017861244112865895, 'batch_size': 1262, 'optimizer': 'RMSprop'}.
2026-06-19 00:27:28,076 - experiment_functions - INFO - Early stopping at epoch 2200. Best Metrics: (0.0037544358906657018, 0.0008731211317418216, 0.002003680425824334)
2026-06-19 00:27:28,179 - optuna.study.study - INFO - Trial 54 finished with values: [0.0037544358906657018, 0.0008731211317418216, 0.002003680425824334] and parameters: {'n_layers': 1, 'embedding_dim': 32, 'lr': 0.03737766331140489, 'lambda_val': 0.08876884296492314, 'batch_size': 2712, 'optimizer': 'Adam'}.
2026-06-19 00:28:17,257 - experiment_functions - INFO - Early stopping at epoch 1150. Best Metrics: (0.0286349569553584, 0.006088164708854364, 0.01655441329217057)
2026-06-19 00:28:17,353 - optuna.study.study - INFO - Trial 55 finished with values: [0.0286349569553584, 0.006088164708854364, 0.01655441329217057] and parameters: {'n_layers': 1, 'embedding_dim': 32, 'lr': 0.003327615910950817, 'lambda_val': 4.824681967841972e-06, 'batch_size': 844, 'optimizer': 'Adam'}.
2026-06-19 00:29:05,348 - experiment_functions - INFO - Early stopping at epoch 950. Best Metrics: (0.016213970068989086, 0.003411961601616774, 0.009113965859444162)
2026-06-19 00:29:05,437 - optuna.study.study - INFO - Trial 56 finished with values: [0.016213970068989086, 0.003411961601616774, 0.009113965859444162] and parameters: {'n_layers': 3, 'embedding_dim': 128, 'lr': 0.0012134658370028314, 'lambda_val': 0.0001180174950905876, 'batch_size': 1184, 'optimizer': 'RMSprop'}.
2026-06-19 00:29:38,265 - experiment_functions - INFO - Early stopping at epoch 650. Best Metrics: (0.026344925650835693, 0.005533977516736137, 0.014865800077554241)
2026-06-19 00:29:38,368 - optuna.study.study - INFO - Trial 57 finished with values: [0.026344925650835693, 0.005533977516736137, 0.014865800077554241] and parameters: {'n_layers': 2, 'embedding_dim': 128, 'lr': 0.00265047718248758, 'lambda_val': 0.0007604153797437305, 'batch_size': 3712, 'optimizer': 'Adam'}.
2026-06-19 00:30:05,559 - experiment_functions - INFO - Early stopping at epoch 550. Best Metrics: (0.0065423530207277085, 0.001405203991410888, 0.0036593249516814444)
2026-06-19 00:30:05,655 - optuna.study.study - INFO - Trial 58 finished with values: [0.0065423530207277085, 0.001405203991410888, 0.0036593249516814444] and parameters: {'n_layers': 2, 'embedding_dim': 128, 'lr': 0.003641765311552576, 'lambda_val': 0.01293128846809428, 'batch_size': 2501, 'optimizer': 'RMSprop'}.
2026-06-19 00:30:30,133 - experiment_functions - INFO - Early stopping at epoch 550. Best Metrics: (0.012483983742663482, 0.002756726032588102, 0.006664768977447087)
2026-06-19 00:30:30,241 - optuna.study.study - INFO - Trial 59 finished with values: [0.012483983742663482, 0.002756726032588102, 0.006664768977447087] and parameters: {'n_layers': 1, 'embedding_dim': 32, 'lr': 0.022537997280540817, 'lambda_val': 0.008351113193864012, 'batch_size': 2145, 'optimizer': 'Adam'}.
2026-06-19 00:31:34,428 - experiment_functions - INFO - Early stopping at epoch 1050. Best Metrics: (0.018030524478493803, 0.004059302766199318, 0.010167224281014712)
2026-06-19 00:31:34,523 - optuna.study.study - INFO - Trial 60 finished with values: [0.018030524478493803, 0.004059302766199318, 0.010167224281014712] and parameters: {'n_layers': 3, 'embedding_dim': 256, 'lr': 0.00045541062412396616, 'lambda_val': 0.00790150266889716, 'batch_size': 2612, 'optimizer': 'Adam'}.
2026-06-19 00:31:57,563 - experiment_functions - INFO - Early stopping at epoch 500. Best Metrics: (0.0005480717759573544, 0.0001373626373626374, 0.00032700825653513515)
2026-06-19 00:31:57,666 - optuna.study.study - INFO - Trial 61 finished with values: [0.0005480717759573544, 0.0001373626373626374, 0.00032700825653513515] and parameters: {'n_layers': 2, 'embedding_dim': 32, 'lr': 3.880060779529079e-05, 'lambda_val': 1.7013643059238403e-06, 'batch_size': 3998, 'optimizer': 'SGD'}.
2026-06-19 00:32:42,447 - experiment_functions - INFO - Early stopping at epoch 950. Best Metrics: (0.023954146760012705, 0.005038208917519263, 0.013119563387887535)
2026-06-19 00:32:42,540 - optuna.study.study - INFO - Trial 62 finished with values: [0.023954146760012705, 0.005038208917519263, 0.013119563387887535] and parameters: {'n_layers': 3, 'embedding_dim': 64, 'lr': 0.0012134658370028314, 'lambda_val': 1.7013643059238403e-06, 'batch_size': 1184, 'optimizer': 'Adam'}.
2026-06-19 00:35:39,398 - experiment_functions - INFO - Early stopping at epoch 3900. Best Metrics: (0.03042789063669955, 0.0064402551471516994, 0.01747319185234071)
2026-06-19 00:35:39,560 - optuna.study.study - INFO - Trial 63 finished with values: [0.03042789063669955, 0.0064402551471516994, 0.01747319185234071] and parameters: {'n_layers': 1, 'embedding_dim': 128, 'lr': 0.000870520171613823, 'lambda_val': 0.003077942483029095, 'batch_size': 2155, 'optimizer': 'Adam'}.
2026-06-19 00:36:22,964 - experiment_functions - INFO - Early stopping at epoch 850. Best Metrics: (0.01183801939000304, 0.002505683971201212, 0.006846832691003802)
2026-06-19 00:36:23,051 - optuna.study.study - INFO - Trial 64 finished with values: [0.01183801939000304, 0.002505683971201212, 0.006846832691003802] and parameters: {'n_layers': 3, 'embedding_dim': 128, 'lr': 0.011795627831592177, 'lambda_val': 3.296773338266593e-05, 'batch_size': 1873, 'optimizer': 'RMSprop'}.
2026-06-19 00:36:51,817 - experiment_functions - INFO - Early stopping at epoch 550. Best Metrics: (0.012919952608194063, 0.0028309334343817106, 0.007523615874329932)
2026-06-19 00:36:51,909 - optuna.study.study - INFO - Trial 65 finished with values: [0.012919952608194063, 0.0028309334343817106, 0.007523615874329932] and parameters: {'n_layers': 3, 'embedding_dim': 128, 'lr': 0.0026777259297623827, 'lambda_val': 0.0020983857112305436, 'batch_size': 524, 'optimizer': 'RMSprop'}.
2026-06-19 00:37:16,804 - experiment_functions - INFO - Early stopping at epoch 550. Best Metrics: (0.010618352301452255, 0.0023335859542756095, 0.0057765713781838535)
2026-06-19 00:37:16,903 - optuna.study.study - INFO - Trial 66 finished with values: [0.010618352301452255, 0.0023335859542756095, 0.0057765713781838535] and parameters: {'n_layers': 2, 'embedding_dim': 32, 'lr': 0.01339497152493029, 'lambda_val': 1.356629670066784e-05, 'batch_size': 1820, 'optimizer': 'Adam'}.
2026-06-19 00:38:14,786 - experiment_functions - INFO - Early stopping at epoch 1100. Best Metrics: (0.012214927835659669, 0.002717254010357459, 0.006277646750947858)
2026-06-19 00:38:14,889 - optuna.study.study - INFO - Trial 67 finished with values: [0.012214927835659669, 0.002717254010357459, 0.006277646750947858] and parameters: {'n_layers': 4, 'embedding_dim': 128, 'lr': 0.000870520171613823, 'lambda_val': 0.003077942483029095, 'batch_size': 619, 'optimizer': 'Adam'}.
2026-06-19 00:38:46,354 - experiment_functions - INFO - Early stopping at epoch 700. Best Metrics: (0.005509120740649962, 0.0012757357584943791, 0.0032847427570166982)
2026-06-19 00:38:46,439 - optuna.study.study - INFO - Trial 68 finished with values: [0.005509120740649962, 0.0012757357584943791, 0.0032847427570166982] and parameters: {'n_layers': 1, 'embedding_dim': 96, 'lr': 0.0026777259297623827, 'lambda_val': 0.06967843853647833, 'batch_size': 3461, 'optimizer': 'RMSprop'}.
2026-06-19 00:39:08,462 - experiment_functions - INFO - Early stopping at epoch 500. Best Metrics: (0.0005085557603313497, 0.00012946823291650877, 0.00030239202699234517)
2026-06-19 00:39:08,553 - optuna.study.study - INFO - Trial 69 finished with values: [0.0005085557603313497, 0.00012946823291650877, 0.00030239202699234517] and parameters: {'n_layers': 1, 'embedding_dim': 32, 'lr': 2.9229308349362707e-05, 'lambda_val': 0.08876884296492314, 'batch_size': 955, 'optimizer': 'Adam'}.
2026-06-19 00:40:11,568 - experiment_functions - INFO - Early stopping at epoch 1250. Best Metrics: (0.004058090766931118, 0.0008968043450802073, 0.0022755783090646587)
2026-06-19 00:40:11,659 - optuna.study.study - INFO - Trial 70 finished with values: [0.004058090766931118, 0.0008968043450802073, 0.0022755783090646587] and parameters: {'n_layers': 4, 'embedding_dim': 96, 'lr': 0.0012134658370028314, 'lambda_val': 0.06967843853647833, 'batch_size': 1184, 'optimizer': 'Adam'}.
2026-06-19 00:41:00,451 - experiment_functions - INFO - Early stopping at epoch 750. Best Metrics: (0.015153519036901715, 0.0032082859669066563, 0.008254239830591438)
2026-06-19 00:41:00,535 - optuna.study.study - INFO - Trial 71 finished with values: [0.015153519036901715, 0.0032082859669066563, 0.008254239830591438] and parameters: {'n_layers': 4, 'embedding_dim': 256, 'lr': 0.0008568781075155826, 'lambda_val': 4.824681967841972e-06, 'batch_size': 3284, 'optimizer': 'RMSprop'}.
2026-06-19 00:41:47,231 - experiment_functions - INFO - Early stopping at epoch 1000. Best Metrics: (0.0006191341052290268, 0.00012473159024883163, 0.0003160603870625955)
2026-06-19 00:41:47,607 - optuna.study.study - INFO - Trial 72 finished with values: [0.0006191341052290268, 0.00012473159024883163, 0.0003160603870625955] and parameters: {'n_layers': 2, 'embedding_dim': 128, 'lr': 1.462500950404996e-05, 'lambda_val': 0.003077942483029095, 'batch_size': 739, 'optimizer': 'Adam'}.
2026-06-19 00:42:22,669 - experiment_functions - INFO - Early stopping at epoch 650. Best Metrics: (0.01567933535261717, 0.0034214348869521286, 0.008847588796363336)
2026-06-19 00:42:23,028 - optuna.study.study - INFO - Trial 73 finished with values: [0.01567933535261717, 0.0034214348869521286, 0.008847588796363336] and parameters: {'n_layers': 4, 'embedding_dim': 128, 'lr': 0.0008568781075155826, 'lambda_val': 8.004253683939247e-06, 'batch_size': 3284, 'optimizer': 'RMSprop'}.
2026-06-19 00:42:50,089 - experiment_functions - INFO - Early stopping at epoch 550. Best Metrics: (0.005341711604664884, 0.0012173171655930277, 0.0031499072209867605)
2026-06-19 00:42:50,177 - optuna.study.study - INFO - Trial 74 finished with values: [0.005341711604664884, 0.0012173171655930277, 0.0031499072209867605] and parameters: {'n_layers': 3, 'embedding_dim': 96, 'lr': 0.0026777259297623827, 'lambda_val': 0.06967843853647833, 'batch_size': 897, 'optimizer': 'RMSprop'}.
2026-06-19 00:43:17,409 - experiment_functions - INFO - Early stopping at epoch 550. Best Metrics: (0.006464386003995018, 0.0014320449665277252, 0.0035039307461732392)
2026-06-19 00:43:17,514 - optuna.study.study - INFO - Trial 75 finished with values: [0.006464386003995018, 0.0014320449665277252, 0.0035039307461732392] and parameters: {'n_layers': 3, 'embedding_dim': 96, 'lr': 0.01339497152493029, 'lambda_val': 0.002664675690305641, 'batch_size': 3161, 'optimizer': 'Adam'}.
2026-06-19 00:44:02,012 - experiment_functions - INFO - Early stopping at epoch 950. Best Metrics: (0.025324012875635536, 0.005420298092711887, 0.01439652826107322)
2026-06-19 00:44:02,398 - optuna.study.study - INFO - Trial 76 finished with values: [0.025324012875635536, 0.005420298092711887, 0.01439652826107322] and parameters: {'n_layers': 1, 'embedding_dim': 128, 'lr': 0.003327615910950817, 'lambda_val': 0.0008294227855036249, 'batch_size': 844, 'optimizer': 'Adam'}.
2026-06-19 00:44:29,223 - experiment_functions - INFO - Early stopping at epoch 550. Best Metrics: (0.009738269143382605, 0.0021441202475685236, 0.005654389063870512)
2026-06-19 00:44:29,288 - optuna.study.study - INFO - Trial 77 finished with values: [0.009738269143382605, 0.0021441202475685236, 0.005654389063870512] and parameters: {'n_layers': 2, 'embedding_dim': 128, 'lr': 0.02246269373758856, 'lambda_val': 0.00011238429460135182, 'batch_size': 1729, 'optimizer': 'RMSprop'}.
2026-06-19 00:45:05,563 - experiment_functions - INFO - Early stopping at epoch 550. Best Metrics: (0.007353124245834784, 0.0015204622963243654, 0.004077544962485292)
2026-06-19 00:45:05,637 - optuna.study.study - INFO - Trial 78 finished with values: [0.007353124245834784, 0.0015204622963243654, 0.004077544962485292] and parameters: {'n_layers': 4, 'embedding_dim': 256, 'lr': 0.04465234945162275, 'lambda_val': 1.599550872998235e-05, 'batch_size': 897, 'optimizer': 'Adam'}.
2026-06-19 00:45:30,449 - experiment_functions - INFO - Early stopping at epoch 500. Best Metrics: (0.0004985440630577651, 0.00010736390046734875, 0.00027734694980249586)
