2026-06-23 10:47:02,443 - optuna.study.study - INFO - Trial 213 finished with values: [0.0006096713833579932, 0.00015473032714412026, 0.0003337411494845645] and parameters: {'n_layers': 2, 'embedding_dim': 32, 'lr': 6.999310445448504e-05, 'lambda_val': 0.0006793861457506547, 'batch_size': 3253, 'optimizer': 'Adam'}.
2026-06-23 10:47:39,309 - experiment_functions - INFO - Early stopping at epoch 700. Best Metrics: (0.02875764477319371, 0.006075533661740559, 0.016309297663445698)
2026-06-23 10:47:39,414 - optuna.study.study - INFO - Trial 214 finished with values: [0.02875764477319371, 0.006075533661740559, 0.016309297663445698] and parameters: {'n_layers': 1, 'embedding_dim': 256, 'lr': 0.003808349234575029, 'lambda_val': 0.0003753252082293773, 'batch_size': 3129, 'optimizer': 'Adam'}.
2026-06-23 10:48:33,519 - experiment_functions - INFO - Early stopping at epoch 1150. Best Metrics: (0.03062327698398716, 0.006372363268914993, 0.017544388233583372)
2026-06-23 10:48:33,628 - optuna.study.study - INFO - Trial 215 finished with values: [0.03062327698398716, 0.006372363268914993, 0.017544388233583372] and parameters: {'n_layers': 2, 'embedding_dim': 96, 'lr': 0.0008834137156031282, 'lambda_val': 3.447042784972302e-05, 'batch_size': 2100, 'optimizer': 'Adam'}.
2026-06-23 10:49:05,464 - experiment_functions - INFO - Early stopping at epoch 600. Best Metrics: (0.02501156439627329, 0.00529714538335228, 0.013965610387273886)
2026-06-23 10:49:05,568 - optuna.study.study - INFO - Trial 216 finished with values: [0.02501156439627329, 0.00529714538335228, 0.013965610387273886] and parameters: {'n_layers': 1, 'embedding_dim': 256, 'lr': 0.008147334288365001, 'lambda_val': 0.0001268815967640493, 'batch_size': 3090, 'optimizer': 'Adam'}.
2026-06-23 10:52:07,045 - optuna.study.study - INFO - Trial 217 finished with values: [0.023498436268566947, 0.005180308197549577, 0.01319166771406007] and parameters: {'n_layers': 3, 'embedding_dim': 64, 'lr': 0.00037748801596819556, 'lambda_val': 0.0006793861457506547, 'batch_size': 3090, 'optimizer': 'Adam'}.
2026-06-23 10:53:13,468 - experiment_functions - INFO - Early stopping at epoch 1450. Best Metrics: (0.03215450520725673, 0.006564986737400531, 0.0177135923037618)
2026-06-23 10:53:13,579 - optuna.study.study - INFO - Trial 218 finished with values: [0.03215450520725673, 0.006564986737400531, 0.0177135923037618] and parameters: {'n_layers': 1, 'embedding_dim': 128, 'lr': 0.0017036472251956306, 'lambda_val': 2.585343072688519e-05, 'batch_size': 2693, 'optimizer': 'Adam'}.
2026-06-23 10:54:27,649 - experiment_functions - INFO - Early stopping at epoch 1350. Best Metrics: (0.0213687396496916, 0.004621384362763673, 0.011892227396319616)
2026-06-23 10:54:27,752 - optuna.study.study - INFO - Trial 219 finished with values: [0.0213687396496916, 0.004621384362763673, 0.011892227396319616] and parameters: {'n_layers': 4, 'embedding_dim': 128, 'lr': 0.0005393572995981927, 'lambda_val': 0.0010657666266185159, 'batch_size': 1102, 'optimizer': 'Adam'}.
2026-06-23 10:56:34,635 - experiment_functions - INFO - Early stopping at epoch 3000. Best Metrics: (0.03231811400691531, 0.006767083491221423, 0.017980034573039476)
2026-06-23 10:56:34,745 - optuna.study.study - INFO - Trial 220 finished with values: [0.03231811400691531, 0.006767083491221423, 0.017980034573039476] and parameters: {'n_layers': 1, 'embedding_dim': 32, 'lr': 0.0016017140638771422, 'lambda_val': 3.447042784972302e-05, 'batch_size': 3129, 'optimizer': 'Adam'}.
2026-06-23 10:59:18,276 - optuna.study.study - INFO - Trial 221 finished with values: [0.026832015978752607, 0.005789756220790704, 0.015411798047746433] and parameters: {'n_layers': 1, 'embedding_dim': 32, 'lr': 0.0008834137156031282, 'lambda_val': 3.447042784972302e-05, 'batch_size': 768, 'optimizer': 'RMSprop'}.
2026-06-23 11:02:05,061 - optuna.study.study - INFO - Trial 222 finished with values: [0.023287381263753175, 0.005151888341543514, 0.013486636436989606] and parameters: {'n_layers': 2, 'embedding_dim': 32, 'lr': 0.00037748801596819556, 'lambda_val': 0.0010657666266185159, 'batch_size': 2627, 'optimizer': 'Adam'}.
2026-06-23 11:02:55,754 - experiment_functions - INFO - Early stopping at epoch 1150. Best Metrics: (0.0287110994467706, 0.006222369584438551, 0.016187461938351126)
2026-06-23 11:02:55,856 - optuna.study.study - INFO - Trial 223 finished with values: [0.0287110994467706, 0.006222369584438551, 0.016187461938351126] and parameters: {'n_layers': 1, 'embedding_dim': 64, 'lr': 0.0016017140638771422, 'lambda_val': 0.001266355019768298, 'batch_size': 2100, 'optimizer': 'RMSprop'}.
2026-06-23 11:03:37,353 - experiment_functions - INFO - Early stopping at epoch 950. Best Metrics: (0.03013979590167347, 0.006474990526714665, 0.01743582443434851)
2026-06-23 11:03:37,473 - optuna.study.study - INFO - Trial 224 finished with values: [0.03013979590167347, 0.006474990526714665, 0.01743582443434851] and parameters: {'n_layers': 1, 'embedding_dim': 32, 'lr': 0.0024861194796259945, 'lambda_val': 0.0006793861457506547, 'batch_size': 3365, 'optimizer': 'Adam'}.
2026-06-23 11:04:14,962 - experiment_functions - INFO - Early stopping at epoch 750. Best Metrics: (0.025330146116089778, 0.005369773904256663, 0.014317037148899392)
2026-06-23 11:04:15,072 - optuna.study.study - INFO - Trial 225 finished with values: [0.025330146116089778, 0.005369773904256663, 0.014317037148899392] and parameters: {'n_layers': 2, 'embedding_dim': 128, 'lr': 0.0016017140638771422, 'lambda_val': 0.0006793861457506547, 'batch_size': 3253, 'optimizer': 'Adam'}.
2026-06-23 11:05:07,875 - experiment_functions - INFO - Early stopping at epoch 1150. Best Metrics: (0.020672743798932858, 0.004450865226727295, 0.011607096018208866)
2026-06-23 11:05:07,995 - optuna.study.study - INFO - Trial 226 finished with values: [0.020672743798932858, 0.004450865226727295, 0.011607096018208866] and parameters: {'n_layers': 1, 'embedding_dim': 128, 'lr': 0.003808349234575029, 'lambda_val': 5.8617508553429225e-05, 'batch_size': 632, 'optimizer': 'Adam'}.
2026-06-23 11:06:22,945 - experiment_functions - INFO - Early stopping at epoch 1700. Best Metrics: (0.025533204480886557, 0.005333459643804472, 0.014746190733961271)
2026-06-23 11:06:23,053 - optuna.study.study - INFO - Trial 227 finished with values: [0.025533204480886557, 0.005333459643804472, 0.014746190733961271] and parameters: {'n_layers': 1, 'embedding_dim': 96, 'lr': 0.0024861194796259945, 'lambda_val': 2.615836668667667e-06, 'batch_size': 881, 'optimizer': 'RMSprop'}.
2026-06-23 11:07:43,296 - experiment_functions - INFO - Early stopping at epoch 1750. Best Metrics: (0.03349140206235893, 0.0068412908930150325, 0.01914506754011462)
2026-06-23 11:07:43,403 - optuna.study.study - INFO - Trial 228 finished with values: [0.03349140206235893, 0.0068412908930150325, 0.01914506754011462] and parameters: {'n_layers': 1, 'embedding_dim': 128, 'lr': 0.0016017140638771422, 'lambda_val': 3.447042784972302e-05, 'batch_size': 3253, 'optimizer': 'Adam'}.
2026-06-23 11:08:37,077 - experiment_functions - INFO - Early stopping at epoch 1150. Best Metrics: (0.03221009360375505, 0.0067812934192244545, 0.018307514388348194)
2026-06-23 11:08:37,189 - optuna.study.study - INFO - Trial 229 finished with values: [0.03221009360375505, 0.0067812934192244545, 0.018307514388348194] and parameters: {'n_layers': 1, 'embedding_dim': 128, 'lr': 0.0016017140638771422, 'lambda_val': 3.447042784972302e-05, 'batch_size': 3426, 'optimizer': 'Adam'}.
2026-06-23 11:09:10,310 - experiment_functions - INFO - Early stopping at epoch 650. Best Metrics: (0.025435164659607604, 0.005478716685613238, 0.014369780462158208)
2026-06-23 11:09:10,441 - optuna.study.study - INFO - Trial 230 finished with values: [0.025435164659607604, 0.005478716685613238, 0.014369780462158208] and parameters: {'n_layers': 2, 'embedding_dim': 128, 'lr': 0.0024861194796259945, 'lambda_val': 0.0010657666266185159, 'batch_size': 3365, 'optimizer': 'Adam'}.
2026-06-23 11:10:06,976 - experiment_functions - INFO - Early stopping at epoch 1100. Best Metrics: (0.031756231904814705, 0.006664456233421751, 0.018226403078022358)
2026-06-23 11:10:07,079 - optuna.study.study - INFO - Trial 231 finished with values: [0.031756231904814705, 0.006664456233421751, 0.018226403078022358] and parameters: {'n_layers': 1, 'embedding_dim': 256, 'lr': 0.0014237233114405305, 'lambda_val': 0.0006793861457506547, 'batch_size': 3397, 'optimizer': 'Adam'}.
2026-06-23 11:10:43,352 - experiment_functions - INFO - Early stopping at epoch 650. Best Metrics: (0.018847185157704914, 0.004019830743968675, 0.010733869971253331)
2026-06-23 11:10:43,455 - optuna.study.study - INFO - Trial 232 finished with values: [0.018847185157704914, 0.004019830743968675, 0.010733869971253331] and parameters: {'n_layers': 4, 'embedding_dim': 128, 'lr': 0.0014983681509322957, 'lambda_val': 0.0001163500667887911, 'batch_size': 3253, 'optimizer': 'Adam'}.
2026-06-23 11:13:46,181 - optuna.study.study - INFO - Trial 233 finished with values: [0.02686433205191828, 0.0058497536945812815, 0.015407624456966673] and parameters: {'n_layers': 2, 'embedding_dim': 96, 'lr': 0.00036918389202660496, 'lambda_val': 0.0010657666266185159, 'batch_size': 3429, 'optimizer': 'Adam'}.
2026-06-23 11:14:10,960 - experiment_functions - INFO - Early stopping at epoch 500. Best Metrics: (0.00037394383360471765, 9.473285335354301e-05, 0.00019141657159580356)
2026-06-23 11:14:11,070 - optuna.study.study - INFO - Trial 234 finished with values: [0.00037394383360471765, 9.473285335354301e-05, 0.00019141657159580356] and parameters: {'n_layers': 2, 'embedding_dim': 128, 'lr': 0.0014983681509322957, 'lambda_val': 0.0006793861457506547, 'batch_size': 1794, 'optimizer': 'SGD'}.
2026-06-23 11:17:09,765 - optuna.study.study - INFO - Trial 235 finished with values: [0.03266082801311528, 0.006967601364153088, 0.018673528989637884] and parameters: {'n_layers': 1, 'embedding_dim': 128, 'lr': 0.0008906516956334841, 'lambda_val': 3.447042784972302e-05, 'batch_size': 1682, 'optimizer': 'Adam'}.
2026-06-23 11:17:37,930 - experiment_functions - INFO - Early stopping at epoch 600. Best Metrics: (0.019540918358383237, 0.004259820639130985, 0.01117486324606613)
2026-06-23 11:17:38,032 - optuna.study.study - INFO - Trial 236 finished with values: [0.019540918358383237, 0.004259820639130985, 0.01117486324606613] and parameters: {'n_layers': 1, 'embedding_dim': 96, 'lr': 0.0097470806472533, 'lambda_val': 5.8617508553429225e-05, 'batch_size': 1794, 'optimizer': 'Adam'}.
2026-06-23 11:20:19,240 - optuna.study.study - INFO - Trial 237 finished with values: [0.00924140948380682, 0.0023525325249463182, 0.005639427932259948] and parameters: {'n_layers': 1, 'embedding_dim': 32, 'lr': 0.00037748801596819556, 'lambda_val': 0.007151036194229829, 'batch_size': 3090, 'optimizer': 'RMSprop'}.
2026-06-23 11:23:59,156 - optuna.study.study - INFO - Trial 238 finished with values: [0.0280425865663197, 0.006064481495515978, 0.016166848338364334] and parameters: {'n_layers': 2, 'embedding_dim': 256, 'lr': 0.0003681355466910888, 'lambda_val': 7.448163029472309e-06, 'batch_size': 2494, 'optimizer': 'Adam'}.
2026-06-23 11:24:30,603 - experiment_functions - INFO - Early stopping at epoch 650. Best Metrics: (0.029354375204876923, 0.006178160919540231, 0.016790174539799647)
2026-06-23 11:24:30,706 - optuna.study.study - INFO - Trial 239 finished with values: [0.029354375204876923, 0.006178160919540231, 0.016790174539799647] and parameters: {'n_layers': 1, 'embedding_dim': 128, 'lr': 0.005823892895958369, 'lambda_val': 3.1001574898711143e-06, 'batch_size': 3397, 'optimizer': 'Adam'}.
2026-06-23 11:25:33,057 - experiment_functions - INFO - Early stopping at epoch 1350. Best Metrics: (0.032692407844689055, 0.006763925729442971, 0.01862840675251)
2026-06-23 11:25:33,208 - optuna.study.study - INFO - Trial 240 finished with values: [0.032692407844689055, 0.006763925729442971, 0.01862840675251] and parameters: {'n_layers': 1, 'embedding_dim': 128, 'lr': 0.0016017140638771422, 'lambda_val': 3.447042784972302e-05, 'batch_size': 3253, 'optimizer': 'Adam'}.
2026-06-23 11:26:23,145 - experiment_functions - INFO - Early stopping at epoch 1150. Best Metrics: (0.030494190462728155, 0.006606037640520401, 0.018010588759648775)
2026-06-23 11:26:23,252 - optuna.study.study - INFO - Trial 241 finished with values: [0.030494190462728155, 0.006606037640520401, 0.018010588759648775] and parameters: {'n_layers': 1, 'embedding_dim': 32, 'lr': 0.0014237233114405305, 'lambda_val': 0.0010657666266185159, 'batch_size': 2100, 'optimizer': 'RMSprop'}.
2026-06-23 11:29:37,814 - optuna.study.study - INFO - Trial 242 finished with values: [0.020739348695216406, 0.004307187065807756, 0.01141536300800897] and parameters: {'n_layers': 1, 'embedding_dim': 256, 'lr': 0.003808349234575029, 'lambda_val': 1.5553043024267715e-06, 'batch_size': 2813, 'optimizer': 'RMSprop'}.
2026-06-23 11:30:17,437 - experiment_functions - INFO - Early stopping at epoch 900. Best Metrics: (0.02717720631895438, 0.006028167235063788, 0.015869868652728686)
2026-06-23 11:30:17,888 - optuna.study.study - INFO - Trial 243 finished with values: [0.02717720631895438, 0.006028167235063788, 0.015869868652728686] and parameters: {'n_layers': 1, 'embedding_dim': 32, 'lr': 0.0014237233114405305, 'lambda_val': 0.007151036194229829, 'batch_size': 2693, 'optimizer': 'RMSprop'}.
2026-06-23 11:30:59,472 - experiment_functions - INFO - Early stopping at epoch 800. Best Metrics: (0.013715668014744036, 0.003059871163319439, 0.007769732195737053)
2026-06-23 11:30:59,578 - optuna.study.study - INFO - Trial 244 finished with values: [0.013715668014744036, 0.003059871163319439, 0.007769732195737053] and parameters: {'n_layers': 4, 'embedding_dim': 96, 'lr': 0.0008906516956334841, 'lambda_val': 0.0010657666266185159, 'batch_size': 1794, 'optimizer': 'RMSprop'}.
2026-06-23 11:32:49,519 - experiment_functions - INFO - Early stopping at epoch 2300. Best Metrics: (0.024127687536712447, 0.005192939244663383, 0.013323995075873686)
2026-06-23 11:32:49,622 - optuna.study.study - INFO - Trial 245 finished with values: [0.024127687536712447, 0.005192939244663383, 0.013323995075873686] and parameters: {'n_layers': 3, 'embedding_dim': 96, 'lr': 0.0005393572995981927, 'lambda_val': 0.0010657666266185159, 'batch_size': 782, 'optimizer': 'RMSprop'}.
2026-06-23 11:35:39,661 - experiment_functions - INFO - Early stopping at epoch 3800. Best Metrics: (0.03330952275231427, 0.007010231148162183, 0.01897528473343966)
2026-06-23 11:35:39,793 - optuna.study.study - INFO - Trial 246 finished with values: [0.03330952275231427, 0.007010231148162183, 0.01897528473343966] and parameters: {'n_layers': 1, 'embedding_dim': 128, 'lr': 0.0008873329418261425, 'lambda_val': 0.0001268815967640493, 'batch_size': 1760, 'optimizer': 'Adam'}.
2026-06-23 11:37:06,690 - experiment_functions - INFO - Early stopping at epoch 1900. Best Metrics: (0.0336973548130046, 0.007046545408614375, 0.01915457725645753)
2026-06-23 11:37:06,799 - optuna.study.study - INFO - Trial 247 finished with values: [0.0336973548130046, 0.007046545408614375, 0.01915457725645753] and parameters: {'n_layers': 1, 'embedding_dim': 128, 'lr': 0.0016017140638771422, 'lambda_val': 1.033711147166284e-06, 'batch_size': 1515, 'optimizer': 'Adam'}.
2026-06-23 11:40:20,746 - optuna.study.study - INFO - Trial 248 finished with values: [0.02365914175650457, 0.005346090690918277, 0.014346733726419928] and parameters: {'n_layers': 1, 'embedding_dim': 256, 'lr': 0.00037748801596819556, 'lambda_val': 0.0001268815967640493, 'batch_size': 2813, 'optimizer': 'RMSprop'}.
2026-06-23 11:40:45,651 - experiment_functions - INFO - Early stopping at epoch 550. Best Metrics: (0.008304836426475486, 0.0017983453328280915, 0.0046501516178804195)
2026-06-23 11:40:45,756 - optuna.study.study - INFO - Trial 249 finished with values: [0.008304836426475486, 0.0017983453328280915, 0.0046501516178804195] and parameters: {'n_layers': 2, 'embedding_dim': 32, 'lr': 0.012601617359604878, 'lambda_val': 0.0010657666266185159, 'batch_size': 3429, 'optimizer': 'RMSprop'}.
2026-06-23 11:41:28,288 - experiment_functions - INFO - Early stopping at epoch 900. Best Metrics: (0.031904765465318174, 0.006566565618289756, 0.018348666792731703)
2026-06-23 11:41:28,394 - optuna.study.study - INFO - Trial 250 finished with values: [0.031904765465318174, 0.006566565618289756, 0.018348666792731703] and parameters: {'n_layers': 1, 'embedding_dim': 128, 'lr': 0.0024861194796259945, 'lambda_val': 6.789699211207431e-05, 'batch_size': 3365, 'optimizer': 'Adam'}.
2026-06-23 11:44:25,232 - optuna.study.study - INFO - Trial 251 finished with values: [0.03521982853280005, 0.007452317797145384, 0.020064302557146734] and parameters: {'n_layers': 1, 'embedding_dim': 96, 'lr': 0.0008906516956334841, 'lambda_val': 5.8617508553429225e-05, 'batch_size': 3129, 'optimizer': 'Adam'}.
2026-06-23 11:47:23,993 - optuna.study.study - INFO - Trial 252 finished with values: [0.03503797549421386, 0.00724390551976759, 0.02006906278967532] and parameters: {'n_layers': 1, 'embedding_dim': 128, 'lr': 0.0008873329418261425, 'lambda_val': 0.0001268815967640493, 'batch_size': 1760, 'optimizer': 'Adam'}.
2026-06-23 11:48:02,446 - experiment_functions - INFO - Early stopping at epoch 850. Best Metrics: (0.027962169196991453, 0.006026588354174561, 0.01612711680612764)
2026-06-23 11:48:02,598 - optuna.study.study - INFO - Trial 253 finished with values: [0.027962169196991453, 0.006026588354174561, 0.01612711680612764] and parameters: {'n_layers': 1, 'embedding_dim': 64, 'lr': 0.0016017140638771422, 'lambda_val': 0.0004538280860403401, 'batch_size': 3397, 'optimizer': 'RMSprop'}.
2026-06-23 11:50:57,401 - optuna.study.study - INFO - Trial 254 finished with values: [0.03414139823378056, 0.007152330428192497, 0.01955654075555334] and parameters: {'n_layers': 1, 'embedding_dim': 96, 'lr': 0.0008834137156031282, 'lambda_val': 3.447042784972302e-05, 'batch_size': 1082, 'optimizer': 'RMSprop'}.
2026-06-23 11:51:20,891 - experiment_functions - INFO - Early stopping at epoch 500. Best Metrics: (0.00043227701290841973, 0.00010736390046734875, 0.00021402891395111117)
2026-06-23 11:51:20,996 - optuna.study.study - INFO - Trial 255 finished with values: [0.00043227701290841973, 0.00010736390046734875, 0.00021402891395111117] and parameters: {'n_layers': 1, 'embedding_dim': 128, 'lr': 0.0021199969334700537, 'lambda_val': 3.447042784972302e-05, 'batch_size': 1127, 'optimizer': 'SGD'}.
2026-06-23 11:52:02,981 - experiment_functions - INFO - Early stopping at epoch 750. Best Metrics: (0.01896375396048696, 0.004005620815965644, 0.010646037336834212)
2026-06-23 11:52:03,085 - optuna.study.study - INFO - Trial 256 finished with values: [0.01896375396048696, 0.004005620815965644, 0.010646037336834212] and parameters: {'n_layers': 4, 'embedding_dim': 128, 'lr': 0.0008906516956334841, 'lambda_val': 5.8617508553429225e-05, 'batch_size': 3253, 'optimizer': 'Adam'}.
2026-06-23 11:53:13,263 - experiment_functions - INFO - Early stopping at epoch 1550. Best Metrics: (0.029185378961773183, 0.006340785651130479, 0.017001669227843547)
2026-06-23 11:53:13,372 - optuna.study.study - INFO - Trial 257 finished with values: [0.029185378961773183, 0.006340785651130479, 0.017001669227843547] and parameters: {'n_layers': 1, 'embedding_dim': 128, 'lr': 0.0016017140638771422, 'lambda_val': 0.0027380357457200996, 'batch_size': 873, 'optimizer': 'Adam'}.
2026-06-23 11:56:06,779 - experiment_functions - INFO - Early stopping at epoch 3900. Best Metrics: (0.03440244712423949, 0.007236011115321461, 0.019450000368299893)
2026-06-23 11:56:06,925 - optuna.study.study - INFO - Trial 258 finished with values: [0.03440244712423949, 0.007236011115321461, 0.019450000368299893] and parameters: {'n_layers': 1, 'embedding_dim': 128, 'lr': 0.0008906516956334841, 'lambda_val': 0.0010657666266185159, 'batch_size': 1760, 'optimizer': 'RMSprop'}.
2026-06-23 11:59:06,455 - optuna.study.study - INFO - Trial 259 finished with values: [0.0327696500782915, 0.006910761652140963, 0.018915695151215363] and parameters: {'n_layers': 1, 'embedding_dim': 128, 'lr': 0.0016017140638771422, 'lambda_val': 5.147838876871674e-05, 'batch_size': 873, 'optimizer': 'Adam'}.
2026-06-23 12:00:29,968 - experiment_functions - INFO - Early stopping at epoch 1900. Best Metrics: (0.03157485874318551, 0.006781293419224455, 0.018230338022247536)
2026-06-23 12:00:30,115 - optuna.study.study - INFO - Trial 260 finished with values: [0.03157485874318551, 0.006781293419224455, 0.018230338022247536] and parameters: {'n_layers': 1, 'embedding_dim': 96, 'lr': 0.0008834137156031282, 'lambda_val': 0.0012833571829398344, 'batch_size': 1438, 'optimizer': 'RMSprop'}.
2026-06-23 12:03:20,663 - experiment_functions - INFO - Early stopping at epoch 3900. Best Metrics: (0.033143361717684484, 0.00709233295440192, 0.018995577886514504)
2026-06-23 12:03:20,774 - optuna.study.study - INFO - Trial 261 finished with values: [0.033143361717684484, 0.00709233295440192, 0.018995577886514504] and parameters: {'n_layers': 1, 'embedding_dim': 96, 'lr': 0.0008906516956334841, 'lambda_val': 0.0008930878936994017, 'batch_size': 1794, 'optimizer': 'RMSprop'}.
2026-06-23 12:04:12,184 - experiment_functions - INFO - Early stopping at epoch 1100. Best Metrics: (0.030760288380106034, 0.006348680055576607, 0.017456588723941544)
2026-06-23 12:04:12,336 - optuna.study.study - INFO - Trial 262 finished with values: [0.030760288380106034, 0.006348680055576607, 0.017456588723941544] and parameters: {'n_layers': 1, 'embedding_dim': 128, 'lr': 0.0016017140638771422, 'lambda_val': 3.447042784972302e-05, 'batch_size': 3426, 'optimizer': 'RMSprop'}.
2026-06-23 12:04:58,129 - experiment_functions - INFO - Early stopping at epoch 1000. Best Metrics: (0.030723210183335736, 0.0064039408866995075, 0.017428235261454872)
