2026-06-19 20:53:02,745 - root - INFO - **** Training e_yelp_full
2026-06-19 20:53:02,770 - root - INFO - --- Hardware Check ---
2026-06-19 20:53:02,770 - root - INFO - PyTorch version 2.6.0+cu124
2026-06-19 20:53:02,770 - root - INFO - Is CUDA available? True
2026-06-19 20:53:02,824 - root - INFO - GPU Device Name: NVIDIA GeForce RTX 3090
2026-06-19 20:53:06,451 - helper_functions - INFO - Users: 31668, Items: 38048
2026-06-19 20:53:06,452 - helper_functions - INFO - Edge index: torch.Size([2, 1561406])
2026-06-19 20:53:06,452 - root - INFO - **** Generating the graph:
2026-06-19 20:53:08,277 - helper_functions - INFO - Number of unique users: 31668
2026-06-19 20:53:08,295 - helper_functions - INFO - Number of unique items: 38048
2026-06-19 20:53:08,295 - helper_functions - INFO - Number of nodes: 69716
2026-06-19 20:53:08,318 - helper_functions - INFO - Number of edges: 1561406
2026-06-19 20:53:09,150 - root - INFO -   **** Training e_yelp_1c1dcs_rand3
2026-06-19 20:53:09,288 - root - INFO -   **** Getting 421521/1274132 random edges
2026-06-19 20:53:09,932 - optuna.storages._rdb.storage - INFO - A new study created in RDB with name: Study_e_yelp_1c1dcs_rand3
2026-06-19 20:53:37,401 - experiment_functions - INFO - Early stopping at epoch 500. Best Metrics: (0.0005413954964983661, 0.00012631047113805733, 0.0003050410512832343)
2026-06-19 20:53:37,507 - optuna.study.study - INFO - Trial 0 finished with values: [0.0005413954964983661, 0.00012631047113805733, 0.0003050410512832343] and parameters: {'n_layers': 2, 'embedding_dim': 96, 'lr': 0.00011459050556861053, 'lambda_val': 0.010682944162930358, 'batch_size': 1991, 'optimizer': 'SGD'}.
2026-06-19 20:54:01,564 - experiment_functions - INFO - Early stopping at epoch 500. Best Metrics: (0.0004470546246040771, 0.00011052166224580018, 0.0002388586455945254)
2026-06-19 20:54:02,018 - optuna.study.study - INFO - Trial 1 finished with values: [0.0004470546246040771, 0.00011052166224580018, 0.0002388586455945254] and parameters: {'n_layers': 2, 'embedding_dim': 96, 'lr': 0.0549363784989991, 'lambda_val': 0.00018822143731514276, 'batch_size': 997, 'optimizer': 'SGD'}.
2026-06-19 20:54:35,895 - experiment_functions - INFO - Early stopping at epoch 500. Best Metrics: (0.0006228031768544937, 0.00013578375647341163, 0.0003683837748150793)
2026-06-19 20:54:35,972 - optuna.study.study - INFO - Trial 2 finished with values: [0.0006228031768544937, 0.00013578375647341163, 0.0003683837748150793] and parameters: {'n_layers': 4, 'embedding_dim': 256, 'lr': 5.421967766192562e-05, 'lambda_val': 0.007087934326548755, 'batch_size': 718, 'optimizer': 'Adam'}.
2026-06-19 20:54:59,940 - experiment_functions - INFO - Early stopping at epoch 500. Best Metrics: (0.0005085770644539418, 0.00012946823291650877, 0.00026259214042316303)
2026-06-19 20:55:00,024 - optuna.study.study - INFO - Trial 3 finished with values: [0.0005085770644539418, 0.00012946823291650877, 0.00026259214042316303] and parameters: {'n_layers': 1, 'embedding_dim': 128, 'lr': 2.6327406624797266e-05, 'lambda_val': 8.834039210810069e-06, 'batch_size': 2556, 'optimizer': 'SGD'}.
2026-06-19 20:55:25,538 - experiment_functions - INFO - Early stopping at epoch 500. Best Metrics: (0.0003912835706552792, 9.631173424276872e-05, 0.0002251439084466694)
2026-06-19 20:55:25,864 - optuna.study.study - INFO - Trial 4 finished with values: [0.0003912835706552792, 9.631173424276872e-05, 0.0002251439084466694] and parameters: {'n_layers': 3, 'embedding_dim': 96, 'lr': 0.00019680892909867224, 'lambda_val': 0.0003658984946881448, 'batch_size': 1890, 'optimizer': 'SGD'}.
2026-06-19 20:55:49,676 - experiment_functions - INFO - Early stopping at epoch 500. Best Metrics: (0.0005840097080741964, 0.0001310471138057345, 0.0003125056161632408)
2026-06-19 20:55:50,062 - optuna.study.study - INFO - Trial 5 finished with values: [0.0005840097080741964, 0.0001310471138057345, 0.0003125056161632408] and parameters: {'n_layers': 1, 'embedding_dim': 128, 'lr': 0.00010811055123214613, 'lambda_val': 0.00019085919103594895, 'batch_size': 4063, 'optimizer': 'SGD'}.
2026-06-19 20:56:13,794 - experiment_functions - INFO - Early stopping at epoch 500. Best Metrics: (0.0005939030001923015, 0.00012946823291650877, 0.0003188939027230598)
2026-06-19 20:56:13,889 - optuna.study.study - INFO - Trial 6 finished with values: [0.0005939030001923015, 0.00012946823291650877, 0.0003188939027230598] and parameters: {'n_layers': 2, 'embedding_dim': 64, 'lr': 0.00018962241262693237, 'lambda_val': 0.000722160757065362, 'batch_size': 3973, 'optimizer': 'SGD'}.
2026-06-19 20:56:44,508 - experiment_functions - INFO - Early stopping at epoch 650. Best Metrics: (0.016952028550448747, 0.003678792471895921, 0.009405704382282503)
2026-06-19 20:56:44,614 - optuna.study.study - INFO - Trial 7 finished with values: [0.016952028550448747, 0.003678792471895921, 0.009405704382282503] and parameters: {'n_layers': 1, 'embedding_dim': 96, 'lr': 0.007729246782619305, 'lambda_val': 0.0006161413438795785, 'batch_size': 844, 'optimizer': 'Adam'}.
2026-06-19 20:57:56,282 - experiment_functions - INFO - Early stopping at epoch 1450. Best Metrics: (0.003159389760625673, 0.0006962864721485411, 0.001801346782192333)
2026-06-19 20:57:56,456 - optuna.study.study - INFO - Trial 8 finished with values: [0.003159389760625673, 0.0006962864721485411, 0.001801346782192333] and parameters: {'n_layers': 4, 'embedding_dim': 96, 'lr': 0.00945956189168787, 'lambda_val': 0.07105143291128169, 'batch_size': 1945, 'optimizer': 'Adam'}.
2026-06-19 20:58:42,629 - experiment_functions - INFO - Early stopping at epoch 900. Best Metrics: (0.013928225622072493, 0.0029682960717443475, 0.007818286253791789)
2026-06-19 20:58:42,722 - optuna.study.study - INFO - Trial 9 finished with values: [0.013928225622072493, 0.0029682960717443475, 0.007818286253791789] and parameters: {'n_layers': 1, 'embedding_dim': 96, 'lr': 0.008632706920549668, 'lambda_val': 1.2446467426024901e-06, 'batch_size': 2868, 'optimizer': 'RMSprop'}.
2026-06-19 20:59:20,610 - experiment_functions - INFO - Early stopping at epoch 900. Best Metrics: (0.0005216797011286753, 0.00012788935202728306, 0.0003079814512455162)
2026-06-19 20:59:20,734 - optuna.study.study - INFO - Trial 10 finished with values: [0.0005216797011286753, 0.00012788935202728306, 0.0003079814512455162] and parameters: {'n_layers': 1, 'embedding_dim': 32, 'lr': 0.06748636109741066, 'lambda_val': 2.8157935548338433e-05, 'batch_size': 3004, 'optimizer': 'SGD'}.
2026-06-19 20:59:45,941 - experiment_functions - INFO - Early stopping at epoch 500. Best Metrics: (0.0005680405217384848, 0.00011841606669192878, 0.0002830528892691158)
2026-06-19 20:59:46,319 - optuna.study.study - INFO - Trial 11 finished with values: [0.0005680405217384848, 0.00011841606669192878, 0.0002830528892691158] and parameters: {'n_layers': 2, 'embedding_dim': 128, 'lr': 0.00098816367287487, 'lambda_val': 1.8395073381560945e-06, 'batch_size': 2433, 'optimizer': 'SGD'}.
2026-06-19 21:00:09,994 - experiment_functions - INFO - Early stopping at epoch 500. Best Metrics: (0.0005699593185392765, 0.00012631047113805733, 0.00030363643513243614)
2026-06-19 21:00:10,251 - optuna.study.study - INFO - Trial 12 finished with values: [0.0005699593185392765, 0.00012631047113805733, 0.00030363643513243614] and parameters: {'n_layers': 1, 'embedding_dim': 128, 'lr': 1.0800716287221497e-05, 'lambda_val': 0.00013592781984966978, 'batch_size': 2116, 'optimizer': 'SGD'}.
2026-06-19 21:00:36,847 - experiment_functions - INFO - Early stopping at epoch 550. Best Metrics: (0.009057977211984753, 0.0020778072502210436, 0.005154451643785745)
2026-06-19 21:00:36,941 - optuna.study.study - INFO - Trial 13 finished with values: [0.009057977211984753, 0.0020778072502210436, 0.005154451643785745] and parameters: {'n_layers': 1, 'embedding_dim': 128, 'lr': 0.03802513876197062, 'lambda_val': 0.0003252544271512617, 'batch_size': 1186, 'optimizer': 'Adam'}.
2026-06-19 21:03:31,451 - optuna.study.study - INFO - Trial 14 finished with values: [0.006151393706621992, 0.001555197675887331, 0.0038896612823974774] and parameters: {'n_layers': 1, 'embedding_dim': 128, 'lr': 0.0006454805060704331, 'lambda_val': 2.3360853516346427e-06, 'batch_size': 720, 'optimizer': 'Adam'}.
2026-06-19 21:04:10,482 - experiment_functions - INFO - Early stopping at epoch 850. Best Metrics: (0.022476508778784248, 0.004894530756599722, 0.01268302613535121)
2026-06-19 21:04:10,608 - optuna.study.study - INFO - Trial 15 finished with values: [0.022476508778784248, 0.004894530756599722, 0.01268302613535121] and parameters: {'n_layers': 1, 'embedding_dim': 96, 'lr': 0.002485646663868356, 'lambda_val': 0.003946099672702113, 'batch_size': 1029, 'optimizer': 'RMSprop'}.
2026-06-19 21:07:02,284 - optuna.study.study - INFO - Trial 16 finished with values: [0.025163780949585622, 0.0053839838322596945, 0.014302647796896528] and parameters: {'n_layers': 3, 'embedding_dim': 32, 'lr': 0.0005537165984177899, 'lambda_val': 0.001032325420317978, 'batch_size': 1916, 'optimizer': 'RMSprop'}.
2026-06-19 21:07:30,729 - experiment_functions - INFO - Early stopping at epoch 500. Best Metrics: (0.0004647219562568596, 0.00011841606669192878, 0.00028283694863733336)
2026-06-19 21:07:30,826 - optuna.study.study - INFO - Trial 17 finished with values: [0.0004647219562568596, 0.00011841606669192878, 0.00028283694863733336] and parameters: {'n_layers': 2, 'embedding_dim': 256, 'lr': 0.0007133341655631742, 'lambda_val': 0.0087935623636618, 'batch_size': 3249, 'optimizer': 'SGD'}.
2026-06-19 21:10:28,467 - experiment_functions - INFO - Early stopping at epoch 3850. Best Metrics: (0.0006913403967997979, 0.0001515725653656688, 0.00035922890898735724)
2026-06-19 21:10:28,545 - optuna.study.study - INFO - Trial 18 finished with values: [0.0006913403967997979, 0.0001515725653656688, 0.00035922890898735724] and parameters: {'n_layers': 3, 'embedding_dim': 96, 'lr': 4.3671210145927585e-05, 'lambda_val': 1.6250517825264063e-06, 'batch_size': 3242, 'optimizer': 'RMSprop'}.
2026-06-19 21:12:27,254 - experiment_functions - INFO - Early stopping at epoch 2650. Best Metrics: (0.0037213330087312734, 0.0008431223948465328, 0.00207104280662154)
2026-06-19 21:12:27,340 - optuna.study.study - INFO - Trial 19 finished with values: [0.0037213330087312734, 0.0008431223948465328, 0.00207104280662154] and parameters: {'n_layers': 3, 'embedding_dim': 64, 'lr': 0.011555015885292643, 'lambda_val': 0.058261212247747766, 'batch_size': 2238, 'optimizer': 'Adam'}.
2026-06-19 21:12:49,872 - experiment_functions - INFO - Early stopping at epoch 500. Best Metrics: (0.0004163029986836246, 0.00010736390046734877, 0.0002774342745151293)
2026-06-19 21:12:49,964 - optuna.study.study - INFO - Trial 20 finished with values: [0.0004163029986836246, 0.00010736390046734877, 0.0002774342745151293] and parameters: {'n_layers': 1, 'embedding_dim': 32, 'lr': 0.0021789199982845944, 'lambda_val': 0.00554085155497608, 'batch_size': 3386, 'optimizer': 'SGD'}.
2026-06-19 21:15:10,577 - experiment_functions - INFO - Early stopping at epoch 3350. Best Metrics: (0.03306415916357681, 0.006823923203233549, 0.018785908486317903)
2026-06-19 21:15:10,664 - optuna.study.study - INFO - Trial 21 finished with values: [0.03306415916357681, 0.006823923203233549, 0.018785908486317903] and parameters: {'n_layers': 1, 'embedding_dim': 32, 'lr': 0.0020150870895911718, 'lambda_val': 4.388555938735431e-05, 'batch_size': 1780, 'optimizer': 'Adam'}.
2026-06-19 21:15:32,787 - experiment_functions - INFO - Early stopping at epoch 500. Best Metrics: (0.0005517283771146977, 0.00011367942402425163, 0.0002839180943900323)
2026-06-19 21:15:32,867 - optuna.study.study - INFO - Trial 22 finished with values: [0.0005517283771146977, 0.00011367942402425163, 0.0002839180943900323] and parameters: {'n_layers': 1, 'embedding_dim': 32, 'lr': 1.282187392173161e-05, 'lambda_val': 1.5421142459462738e-05, 'batch_size': 945, 'optimizer': 'Adam'}.
2026-06-19 21:19:02,538 - optuna.study.study - INFO - Trial 23 finished with values: [0.0007004557478550471, 0.0001878868258178603, 0.000415300836946546] and parameters: {'n_layers': 2, 'embedding_dim': 256, 'lr': 8.927314985164983e-05, 'lambda_val': 1.9968956567375666e-05, 'batch_size': 3395, 'optimizer': 'Adam'}.
2026-06-19 21:19:37,727 - experiment_functions - INFO - Early stopping at epoch 750. Best Metrics: (0.0005716788789461353, 0.00011367942402425162, 0.00029752699910607077)
2026-06-19 21:19:37,815 - optuna.study.study - INFO - Trial 24 finished with values: [0.0005716788789461353, 0.00011367942402425162, 0.00029752699910607077] and parameters: {'n_layers': 3, 'embedding_dim': 64, 'lr': 3.4124995738460795e-05, 'lambda_val': 1.260018338271757e-05, 'batch_size': 1620, 'optimizer': 'Adam'}.
2026-06-19 21:20:08,272 - experiment_functions - INFO - Early stopping at epoch 500. Best Metrics: (0.0005527185073781125, 0.0001121005431350259, 0.0003078843811273446)
2026-06-19 21:20:08,369 - optuna.study.study - INFO - Trial 25 finished with values: [0.0005527185073781125, 0.0001121005431350259, 0.0003078843811273446] and parameters: {'n_layers': 3, 'embedding_dim': 256, 'lr': 3.991621803591119e-05, 'lambda_val': 0.00013878638511426904, 'batch_size': 612, 'optimizer': 'SGD'}.
2026-06-19 21:21:37,892 - experiment_functions - INFO - Early stopping at epoch 2250. Best Metrics: (0.0006076500925256932, 0.00013578375647341166, 0.0003426451997071147)
2026-06-19 21:21:38,055 - optuna.study.study - INFO - Trial 26 finished with values: [0.0006076500925256932, 0.00013578375647341166, 0.0003426451997071147] and parameters: {'n_layers': 1, 'embedding_dim': 32, 'lr': 2.317197687122047e-05, 'lambda_val': 8.008729416776564e-06, 'batch_size': 1801, 'optimizer': 'RMSprop'}.
2026-06-19 21:22:11,690 - experiment_functions - INFO - Early stopping at epoch 500. Best Metrics: (0.005524684166661679, 0.001169950738916256, 0.003166053639159279)
2026-06-19 21:22:11,766 - optuna.study.study - INFO - Trial 27 finished with values: [0.005524684166661679, 0.001169950738916256, 0.003166053639159279] and parameters: {'n_layers': 4, 'embedding_dim': 256, 'lr': 0.07129791640371784, 'lambda_val': 7.335325629094018e-06, 'batch_size': 3024, 'optimizer': 'RMSprop'}.
2026-06-19 21:22:49,159 - experiment_functions - INFO - Early stopping at epoch 700. Best Metrics: (0.004518085584604084, 0.0010120626499936845, 0.0024363682546910794)
2026-06-19 21:22:49,247 - optuna.study.study - INFO - Trial 28 finished with values: [0.004518085584604084, 0.0010120626499936845, 0.0024363682546910794] and parameters: {'n_layers': 4, 'embedding_dim': 128, 'lr': 0.0011589998578488729, 'lambda_val': 0.03673719280846919, 'batch_size': 3641, 'optimizer': 'RMSprop'}.
2026-06-19 21:24:06,442 - experiment_functions - INFO - Early stopping at epoch 1600. Best Metrics: (0.01039703142735017, 0.0021630668182392324, 0.005758569154953667)
2026-06-19 21:24:06,528 - optuna.study.study - INFO - Trial 29 finished with values: [0.01039703142735017, 0.0021630668182392324, 0.005758569154953667] and parameters: {'n_layers': 3, 'embedding_dim': 96, 'lr': 0.005369917483033977, 'lambda_val': 1.2287271335574109e-05, 'batch_size': 3711, 'optimizer': 'RMSprop'}.
2026-06-19 21:27:20,945 - experiment_functions - INFO - Early stopping at epoch 3350. Best Metrics: (0.004134151171066991, 0.0008841732979664014, 0.0022069288713771197)
2026-06-19 21:27:21,311 - optuna.study.study - INFO - Trial 30 finished with values: [0.004134151171066991, 0.0008841732979664014, 0.0022069288713771197] and parameters: {'n_layers': 3, 'embedding_dim': 256, 'lr': 0.0703916641812219, 'lambda_val': 0.02455144220265296, 'batch_size': 2824, 'optimizer': 'Adam'}.
2026-06-19 21:27:44,913 - experiment_functions - INFO - Early stopping at epoch 500. Best Metrics: (0.000590395585244048, 0.00012631047113805733, 0.00028309968853993913)
2026-06-19 21:27:45,000 - optuna.study.study - INFO - Trial 31 finished with values: [0.000590395585244048, 0.00012631047113805733, 0.00028309968853993913] and parameters: {'n_layers': 2, 'embedding_dim': 64, 'lr': 1.0286967804956409e-05, 'lambda_val': 1.6450624662246513e-06, 'batch_size': 1518, 'optimizer': 'SGD'}.
2026-06-19 21:30:39,426 - optuna.study.study - INFO - Trial 32 finished with values: [0.008503479291659068, 0.0019609700644183403, 0.004706393502887424] and parameters: {'n_layers': 2, 'embedding_dim': 96, 'lr': 0.02088730245216097, 'lambda_val': 0.0025056273572935293, 'batch_size': 1101, 'optimizer': 'RMSprop'}.
2026-06-19 21:31:20,107 - experiment_functions - INFO - Early stopping at epoch 800. Best Metrics: (0.012368637495560044, 0.0029114563597322225, 0.007038271489327312)
2026-06-19 21:31:20,198 - optuna.study.study - INFO - Trial 33 finished with values: [0.012368637495560044, 0.0029114563597322225, 0.007038271489327312] and parameters: {'n_layers': 3, 'embedding_dim': 128, 'lr': 0.000502008079869897, 'lambda_val': 0.021705718960970212, 'batch_size': 3215, 'optimizer': 'RMSprop'}.
2026-06-19 21:31:55,934 - experiment_functions - INFO - Early stopping at epoch 850. Best Metrics: (0.0006705762683517762, 0.00015630920803334596, 0.0003345372623935143)
2026-06-19 21:31:56,015 - optuna.study.study - INFO - Trial 34 finished with values: [0.0006705762683517762, 0.00015630920803334596, 0.0003345372623935143] and parameters: {'n_layers': 1, 'embedding_dim': 32, 'lr': 2.6432422776528013e-05, 'lambda_val': 4.332711516457783e-05, 'batch_size': 2711, 'optimizer': 'Adam'}.
2026-06-19 21:32:28,460 - experiment_functions - INFO - Early stopping at epoch 600. Best Metrics: (0.011529780713729912, 0.0024251610458507007, 0.0064771626692012065)
2026-06-19 21:32:28,543 - optuna.study.study - INFO - Trial 35 finished with values: [0.011529780713729912, 0.0024251610458507007, 0.0064771626692012065] and parameters: {'n_layers': 4, 'embedding_dim': 128, 'lr': 0.019271744274364268, 'lambda_val': 1.1228763121949336e-05, 'batch_size': 1916, 'optimizer': 'RMSprop'}.
2026-06-19 21:35:30,327 - optuna.study.study - INFO - Trial 36 finished with values: [0.01692029372401126, 0.003928255652393584, 0.009830152871591107] and parameters: {'n_layers': 2, 'embedding_dim': 128, 'lr': 0.0002564042441924174, 'lambda_val': 0.00042087486522763635, 'batch_size': 2618, 'optimizer': 'Adam'}.
2026-06-19 21:39:34,648 - optuna.study.study - INFO - Trial 37 finished with values: [0.0005942502565534712, 0.00014209928003031455, 0.00034844862304368913] and parameters: {'n_layers': 4, 'embedding_dim': 256, 'lr': 3.416891191903703e-05, 'lambda_val': 3.9435940439521e-06, 'batch_size': 2432, 'optimizer': 'Adam'}.
2026-06-19 21:39:57,639 - experiment_functions - INFO - Early stopping at epoch 500. Best Metrics: (0.0005103433064692299, 0.00011683718580270305, 0.0002722856354462006)
2026-06-19 21:39:57,724 - optuna.study.study - INFO - Trial 38 finished with values: [0.0005103433064692299, 0.00011683718580270305, 0.0002722856354462006] and parameters: {'n_layers': 1, 'embedding_dim': 96, 'lr': 3.785143689590008e-05, 'lambda_val': 0.00014109190169475378, 'batch_size': 3055, 'optimizer': 'SGD'}.
2026-06-19 21:40:22,111 - experiment_functions - INFO - Early stopping at epoch 500. Best Metrics: (0.0005096510734143542, 0.00010894278135657447, 0.0003227324785523956)
2026-06-19 21:40:22,192 - optuna.study.study - INFO - Trial 39 finished with values: [0.0005096510734143542, 0.00010894278135657447, 0.0003227324785523956] and parameters: {'n_layers': 3, 'embedding_dim': 96, 'lr': 2.329309370131588e-05, 'lambda_val': 0.005169176848886771, 'batch_size': 592, 'optimizer': 'Adam'}.
2026-06-19 21:40:47,162 - experiment_functions - INFO - Early stopping at epoch 550. Best Metrics: (0.0074532044147860126, 0.001623089554124037, 0.004125290766938214)
2026-06-19 21:40:47,518 - optuna.study.study - INFO - Trial 40 finished with values: [0.0074532044147860126, 0.001623089554124037, 0.004125290766938214] and parameters: {'n_layers': 3, 'embedding_dim': 32, 'lr': 0.02436228665325216, 'lambda_val': 5.1001581943832046e-05, 'batch_size': 1422, 'optimizer': 'Adam'}.
2026-06-19 21:41:09,709 - experiment_functions - INFO - Early stopping at epoch 500. Best Metrics: (0.0004816635485957355, 0.00010104837691044589, 0.00025637418206248214)
2026-06-19 21:41:09,844 - optuna.study.study - INFO - Trial 41 finished with values: [0.0004816635485957355, 0.00010104837691044589, 0.00025637418206248214] and parameters: {'n_layers': 2, 'embedding_dim': 32, 'lr': 0.0001287210270668797, 'lambda_val': 1.8867811193651064e-05, 'batch_size': 3195, 'optimizer': 'SGD'}.
2026-06-19 21:41:42,118 - experiment_functions - INFO - Early stopping at epoch 750. Best Metrics: (0.00046579976023180056, 0.00012157382847038021, 0.00027601792721318924)
2026-06-19 21:41:42,223 - optuna.study.study - INFO - Trial 42 finished with values: [0.00046579976023180056, 0.00012157382847038021, 0.00027601792721318924] and parameters: {'n_layers': 1, 'embedding_dim': 64, 'lr': 4.998472136135107e-05, 'lambda_val': 0.0009299079135062595, 'batch_size': 2604, 'optimizer': 'Adam'}.
2026-06-19 21:42:07,356 - experiment_functions - INFO - Early stopping at epoch 550. Best Metrics: (0.0041200603239508115, 0.0010025893646583301, 0.0025408148791857313)
2026-06-19 21:42:07,434 - optuna.study.study - INFO - Trial 43 finished with values: [0.0041200603239508115, 0.0010025893646583301, 0.0025408148791857313] and parameters: {'n_layers': 1, 'embedding_dim': 128, 'lr': 0.05959377203926708, 'lambda_val': 0.00011471274504099714, 'batch_size': 1392, 'optimizer': 'RMSprop'}.
2026-06-19 21:44:50,589 - optuna.study.study - INFO - Trial 44 finished with values: [0.030381208179899998, 0.006440255147151699, 0.017717317734067674] and parameters: {'n_layers': 1, 'embedding_dim': 32, 'lr': 0.000778135007488856, 'lambda_val': 2.710386902101323e-06, 'batch_size': 3313, 'optimizer': 'Adam'}.
2026-06-19 21:45:12,990 - experiment_functions - INFO - Early stopping at epoch 500. Best Metrics: (0.0005116929863327051, 0.00014052039914108882, 0.00031942990718417206)
