2026-06-22 23:48:33,792 - optuna.study.study - INFO - Trial 283 finished with values: [0.02606597578496732, 0.005731337627889352, 0.015233156625981873] and parameters: {'n_layers': 1, 'embedding_dim': 256, 'lr': 0.0004235044324291316, 'lambda_val': 5.455116561469672e-06, 'batch_size': 2562, 'optimizer': 'RMSprop'}.
2026-06-22 23:49:28,682 - experiment_functions - INFO - Early stopping at epoch 1250. Best Metrics: (0.0006924661172770767, 0.00014525704180876596, 0.0003626586335450504)
2026-06-22 23:49:28,758 - optuna.study.study - INFO - Trial 284 finished with values: [0.0006924661172770767, 0.00014525704180876596, 0.0003626586335450504] and parameters: {'n_layers': 2, 'embedding_dim': 64, 'lr': 1.7456385376319913e-05, 'lambda_val': 2.1236856911076015e-06, 'batch_size': 3133, 'optimizer': 'RMSprop'}.
2026-06-22 23:50:05,339 - experiment_functions - INFO - Early stopping at epoch 750. Best Metrics: (0.012784533812324927, 0.0027125173676897816, 0.006945610098928284)
2026-06-22 23:50:05,430 - optuna.study.study - INFO - Trial 285 finished with values: [0.012784533812324927, 0.0027125173676897816, 0.006945610098928284] and parameters: {'n_layers': 4, 'embedding_dim': 64, 'lr': 0.001706237377982523, 'lambda_val': 5.455116561469672e-06, 'batch_size': 2857, 'optimizer': 'RMSprop'}.
2026-06-22 23:50:53,513 - experiment_functions - INFO - Early stopping at epoch 1000. Best Metrics: (0.00944875087127646, 0.0022688518378173555, 0.005269662406449858)
2026-06-22 23:50:53,597 - optuna.study.study - INFO - Trial 286 finished with values: [0.00944875087127646, 0.0022688518378173555, 0.005269662406449858] and parameters: {'n_layers': 4, 'embedding_dim': 64, 'lr': 0.0004235044324291316, 'lambda_val': 0.05507370745009071, 'batch_size': 3836, 'optimizer': 'RMSprop'}.
2026-06-22 23:53:41,799 - experiment_functions - INFO - Early stopping at epoch 3900. Best Metrics: (0.025798865887483875, 0.0055529240874068455, 0.014746863312584173)
2026-06-22 23:53:41,969 - optuna.study.study - INFO - Trial 287 finished with values: [0.025798865887483875, 0.0055529240874068455, 0.014746863312584173] and parameters: {'n_layers': 3, 'embedding_dim': 32, 'lr': 0.0004235044324291316, 'lambda_val': 1.314986245861158e-06, 'batch_size': 2562, 'optimizer': 'RMSprop'}.
2026-06-22 23:54:30,934 - experiment_functions - INFO - Early stopping at epoch 850. Best Metrics: (0.022017520020701686, 0.00470348616900341, 0.012556028020185855)
2026-06-22 23:54:31,069 - optuna.study.study - INFO - Trial 288 finished with values: [0.022017520020701686, 0.00470348616900341, 0.012556028020185855] and parameters: {'n_layers': 2, 'embedding_dim': 256, 'lr': 0.0009614297416450062, 'lambda_val': 0.0008491169466682814, 'batch_size': 2897, 'optimizer': 'RMSprop'}.
2026-06-22 23:55:05,497 - experiment_functions - INFO - Early stopping at epoch 650. Best Metrics: (0.016659791934838575, 0.003696160161677403, 0.009545426124719616)
2026-06-22 23:55:05,804 - optuna.study.study - INFO - Trial 289 finished with values: [0.016659791934838575, 0.003696160161677403, 0.009545426124719616] and parameters: {'n_layers': 4, 'embedding_dim': 96, 'lr': 0.001706237377982523, 'lambda_val': 5.8421827248860175e-05, 'batch_size': 2562, 'optimizer': 'Adam'}.
2026-06-22 23:57:59,320 - optuna.study.study - INFO - Trial 290 finished with values: [0.025025520082808915, 0.005338196286472149, 0.014648619788190301] and parameters: {'n_layers': 3, 'embedding_dim': 32, 'lr': 0.0004235044324291316, 'lambda_val': 0.0008491169466682814, 'batch_size': 2562, 'optimizer': 'Adam'}.
2026-06-23 00:00:47,180 - optuna.study.study - INFO - Trial 291 finished with values: [0.0007315894653674759, 0.0001610458507010231, 0.0003657687432362556] and parameters: {'n_layers': 1, 'embedding_dim': 96, 'lr': 0.0003610033899772668, 'lambda_val': 5.455116561469672e-06, 'batch_size': 558, 'optimizer': 'RMSprop'}.
2026-06-23 00:02:17,377 - experiment_functions - INFO - Early stopping at epoch 1850. Best Metrics: (0.024824094552809005, 0.005432929139825692, 0.014391160755310155)
2026-06-23 00:02:17,467 - optuna.study.study - INFO - Trial 292 finished with values: [0.024824094552809005, 0.005432929139825692, 0.014391160755310155] and parameters: {'n_layers': 3, 'embedding_dim': 96, 'lr': 0.00045681378220125877, 'lambda_val': 0.0008491169466682814, 'batch_size': 1291, 'optimizer': 'RMSprop'}.
2026-06-23 00:04:28,216 - experiment_functions - INFO - Early stopping at epoch 2700. Best Metrics: (0.0250618393331918, 0.005413982569154982, 0.014188386703893668)
2026-06-23 00:04:28,552 - optuna.study.study - INFO - Trial 293 finished with values: [0.0250618393331918, 0.005413982569154982, 0.014188386703893668] and parameters: {'n_layers': 3, 'embedding_dim': 96, 'lr': 0.0003204821029415995, 'lambda_val': 0.0008491169466682814, 'batch_size': 2507, 'optimizer': 'RMSprop'}.
2026-06-23 00:07:23,168 - optuna.study.study - INFO - Trial 294 finished with values: [0.024781237867192912, 0.005346090690918278, 0.014152063582746576] and parameters: {'n_layers': 4, 'embedding_dim': 32, 'lr': 0.0003610033899772668, 'lambda_val': 0.0008491169466682814, 'batch_size': 1291, 'optimizer': 'RMSprop'}.
2026-06-23 00:07:57,726 - experiment_functions - INFO - Early stopping at epoch 750. Best Metrics: (0.021454514374344504, 0.004621384362763674, 0.01205669488932697)
2026-06-23 00:07:57,871 - optuna.study.study - INFO - Trial 295 finished with values: [0.021454514374344504, 0.004621384362763674, 0.01205669488932697] and parameters: {'n_layers': 3, 'embedding_dim': 32, 'lr': 0.001706237377982523, 'lambda_val': 3.330662577836562e-06, 'batch_size': 2562, 'optimizer': 'Adam'}.
2026-06-23 00:10:40,528 - optuna.study.study - INFO - Trial 296 finished with values: [0.003450671539330152, 0.00082575470506505, 0.0021835478269156693] and parameters: {'n_layers': 1, 'embedding_dim': 64, 'lr': 0.0004235044324291316, 'lambda_val': 0.00020526375005845972, 'batch_size': 1052, 'optimizer': 'RMSprop'}.
2026-06-23 00:12:36,278 - experiment_functions - INFO - Early stopping at epoch 2400. Best Metrics: (0.02637992812022691, 0.005671340154098776, 0.01491698679824232)
2026-06-23 00:12:36,371 - optuna.study.study - INFO - Trial 297 finished with values: [0.02637992812022691, 0.005671340154098776, 0.01491698679824232] and parameters: {'n_layers': 3, 'embedding_dim': 96, 'lr': 0.0004235044324291316, 'lambda_val': 5.455116561469672e-06, 'batch_size': 2562, 'optimizer': 'RMSprop'}.
2026-06-23 00:15:43,885 - optuna.study.study - INFO - Trial 298 finished with values: [0.011228363480492819, 0.0023841101427308324, 0.006168826886702829] and parameters: {'n_layers': 3, 'embedding_dim': 96, 'lr': 0.021204565047652574, 'lambda_val': 0.0007347724173419768, 'batch_size': 2562, 'optimizer': 'RMSprop'}.
2026-06-23 00:16:08,531 - experiment_functions - INFO - Early stopping at epoch 550. Best Metrics: (0.0017933777449574753, 0.00045471769609700647, 0.0010754866683592569)
2026-06-23 00:16:08,669 - optuna.study.study - INFO - Trial 299 finished with values: [0.0017933777449574753, 0.00045471769609700647, 0.0010754866683592569] and parameters: {'n_layers': 2, 'embedding_dim': 32, 'lr': 0.08400470514860144, 'lambda_val': 0.0008491169466682814, 'batch_size': 1291, 'optimizer': 'RMSprop'}.
2026-06-23 00:16:08,684 - root - INFO - Selected Trial 251 based on Max ndcg: 0.0200
2026-06-23 00:16:08,684 - root - INFO - Associated Recall: 0.0345
2026-06-23 00:16:08,684 - experiment_functions - INFO - Training the best model ... for e_yelp_1c2dcs_rand2
2026-06-23 00:19:03,604 - root - INFO -   **** Training e_yelp_1c2dcs_rand3
2026-06-23 00:19:03,784 - root - INFO -   **** Getting 575241/1274132 random edges
2026-06-23 00:19:04,078 - optuna.storages._rdb.storage - INFO - A new study created in RDB with name: Study_e_yelp_1c2dcs_rand3
2026-06-23 00:19:30,163 - experiment_functions - INFO - Early stopping at epoch 500. Best Metrics: (0.0006316901130477464, 0.00011999494758115448, 0.00035936055203855926)
2026-06-23 00:19:30,260 - optuna.study.study - INFO - Trial 0 finished with values: [0.0006316901130477464, 0.00011999494758115448, 0.00035936055203855926] and parameters: {'n_layers': 2, 'embedding_dim': 128, 'lr': 0.0053379353694326176, 'lambda_val': 1.3792388557172205e-05, 'batch_size': 3138, 'optimizer': 'SGD'}.
2026-06-23 00:19:56,463 - experiment_functions - INFO - Early stopping at epoch 550. Best Metrics: (0.008203306229912277, 0.0017951875710496403, 0.004816005509729166)
2026-06-23 00:19:56,563 - optuna.study.study - INFO - Trial 1 finished with values: [0.008203306229912277, 0.0017951875710496403, 0.004816005509729166] and parameters: {'n_layers': 3, 'embedding_dim': 32, 'lr': 0.0057096641186942364, 'lambda_val': 1.1358678227612878e-06, 'batch_size': 3210, 'optimizer': 'RMSprop'}.
2026-06-23 00:20:52,297 - experiment_functions - INFO - Early stopping at epoch 1200. Best Metrics: (0.0004933401449305395, 0.00010736390046734875, 0.0002875008142458408)
2026-06-23 00:20:52,436 - optuna.study.study - INFO - Trial 2 finished with values: [0.0004933401449305395, 0.00010736390046734875, 0.0002875008142458408] and parameters: {'n_layers': 1, 'embedding_dim': 128, 'lr': 4.257620961888036e-05, 'lambda_val': 6.818170979216098e-06, 'batch_size': 3483, 'optimizer': 'Adam'}.
2026-06-23 00:21:18,918 - experiment_functions - INFO - Early stopping at epoch 550. Best Metrics: (0.007594091417746585, 0.0016009852216748769, 0.0041670451155316045)
2026-06-23 00:21:19,000 - optuna.study.study - INFO - Trial 3 finished with values: [0.007594091417746585, 0.0016009852216748769, 0.0041670451155316045] and parameters: {'n_layers': 3, 'embedding_dim': 32, 'lr': 0.010581481753294916, 'lambda_val': 0.0011039149250306858, 'batch_size': 2258, 'optimizer': 'RMSprop'}.
2026-06-23 00:21:43,616 - experiment_functions - INFO - Early stopping at epoch 500. Best Metrics: (0.0004321010355385727, 9.631173424276872e-05, 0.0002520821252777071)
2026-06-23 00:21:43,689 - optuna.study.study - INFO - Trial 4 finished with values: [0.0004321010355385727, 9.631173424276872e-05, 0.0002520821252777071] and parameters: {'n_layers': 2, 'embedding_dim': 64, 'lr': 7.441243779768322e-05, 'lambda_val': 0.008700062786143456, 'batch_size': 1174, 'optimizer': 'RMSprop'}.
2026-06-23 00:24:42,149 - optuna.study.study - INFO - Trial 5 finished with values: [0.009323367798977262, 0.0021441202475685236, 0.005283126887953728] and parameters: {'n_layers': 4, 'embedding_dim': 32, 'lr': 0.00012195475224101311, 'lambda_val': 3.7911109659764386e-05, 'batch_size': 3633, 'optimizer': 'Adam'}.
2026-06-23 00:25:19,822 - experiment_functions - INFO - Early stopping at epoch 850. Best Metrics: (0.0006829398948770116, 0.0001484148035872174, 0.0003157506583915952)
2026-06-23 00:25:19,894 - optuna.study.study - INFO - Trial 6 finished with values: [0.0006829398948770116, 0.0001484148035872174, 0.0003157506583915952] and parameters: {'n_layers': 2, 'embedding_dim': 32, 'lr': 0.09715020633665543, 'lambda_val': 0.005011233724380416, 'batch_size': 3933, 'optimizer': 'SGD'}.
2026-06-23 00:25:42,837 - experiment_functions - INFO - Early stopping at epoch 500. Best Metrics: (0.0007248495214015726, 0.00014841480358721736, 0.00037933909314733226)
2026-06-23 00:25:42,920 - optuna.study.study - INFO - Trial 7 finished with values: [0.0007248495214015726, 0.00014841480358721736, 0.00037933909314733226] and parameters: {'n_layers': 1, 'embedding_dim': 32, 'lr': 0.005478446871857882, 'lambda_val': 1.0611453381984435e-05, 'batch_size': 3024, 'optimizer': 'SGD'}.
2026-06-23 00:26:37,746 - experiment_functions - INFO - Early stopping at epoch 1100. Best Metrics: (0.0037709893516113136, 0.0008162814197296956, 0.002074702371994764)
2026-06-23 00:26:37,816 - optuna.study.study - INFO - Trial 8 finished with values: [0.0037709893516113136, 0.0008162814197296956, 0.002074702371994764] and parameters: {'n_layers': 3, 'embedding_dim': 96, 'lr': 0.0025441842430441314, 'lambda_val': 0.05428757178211284, 'batch_size': 3569, 'optimizer': 'RMSprop'}.
2026-06-23 00:27:00,883 - experiment_functions - INFO - Early stopping at epoch 500. Best Metrics: (0.0005478373023275646, 0.00011999494758115448, 0.00032458078537936185)
2026-06-23 00:27:00,974 - optuna.study.study - INFO - Trial 9 finished with values: [0.0005478373023275646, 0.00011999494758115448, 0.00032458078537936185] and parameters: {'n_layers': 1, 'embedding_dim': 64, 'lr': 0.025476922000667732, 'lambda_val': 1.3309158700614962e-05, 'batch_size': 2215, 'optimizer': 'SGD'}.
2026-06-23 00:27:26,745 - experiment_functions - INFO - Early stopping at epoch 550. Best Metrics: (0.0036181639479083757, 0.0007720727548313756, 0.0019173558089552222)
2026-06-23 00:27:26,829 - optuna.study.study - INFO - Trial 10 finished with values: [0.0036181639479083757, 0.0007720727548313756, 0.0019173558089552222] and parameters: {'n_layers': 3, 'embedding_dim': 32, 'lr': 0.016570911157069764, 'lambda_val': 0.00919381286512005, 'batch_size': 1095, 'optimizer': 'RMSprop'}.
2026-06-23 00:30:26,110 - optuna.study.study - INFO - Trial 11 finished with values: [0.000854873068681305, 0.0002052545155993432, 0.0004937999133282155] and parameters: {'n_layers': 3, 'embedding_dim': 64, 'lr': 8.370437176004755e-05, 'lambda_val': 0.0019547727872332703, 'batch_size': 1994, 'optimizer': 'RMSprop'}.
2026-06-23 00:30:51,706 - experiment_functions - INFO - Early stopping at epoch 500. Best Metrics: (0.0004744839714880528, 9.789061513199443e-05, 0.0002203934848215896)
2026-06-23 00:30:51,808 - optuna.study.study - INFO - Trial 12 finished with values: [0.0004744839714880528, 9.789061513199443e-05, 0.0002203934848215896] and parameters: {'n_layers': 4, 'embedding_dim': 64, 'lr': 0.0015203570907183321, 'lambda_val': 0.00011013472919939082, 'batch_size': 1899, 'optimizer': 'SGD'}.
2026-06-23 00:31:17,478 - experiment_functions - INFO - Early stopping at epoch 550. Best Metrics: (0.008631035757974562, 0.001945181255526083, 0.004773788987926517)
2026-06-23 00:31:17,779 - optuna.study.study - INFO - Trial 13 finished with values: [0.008631035757974562, 0.001945181255526083, 0.004773788987926517] and parameters: {'n_layers': 2, 'embedding_dim': 32, 'lr': 0.009034566631006623, 'lambda_val': 0.0016324316088680724, 'batch_size': 2074, 'optimizer': 'RMSprop'}.
2026-06-23 00:32:16,010 - experiment_functions - INFO - Early stopping at epoch 1200. Best Metrics: (0.003365742067838313, 0.000764178350385247, 0.00183596490546924)
2026-06-23 00:32:16,085 - optuna.study.study - INFO - Trial 14 finished with values: [0.003365742067838313, 0.000764178350385247, 0.00183596490546924] and parameters: {'n_layers': 4, 'embedding_dim': 64, 'lr': 0.0028713530079369377, 'lambda_val': 0.06545143277558642, 'batch_size': 3247, 'optimizer': 'RMSprop'}.
2026-06-23 00:32:46,804 - experiment_functions - INFO - Early stopping at epoch 600. Best Metrics: (0.009980108837401658, 0.002095174940002526, 0.0056361372853816335)
2026-06-23 00:32:46,953 - optuna.study.study - INFO - Trial 15 finished with values: [0.009980108837401658, 0.002095174940002526, 0.0056361372853816335] and parameters: {'n_layers': 4, 'embedding_dim': 64, 'lr': 0.0245548656422713, 'lambda_val': 3.611427784790995e-05, 'batch_size': 2381, 'optimizer': 'RMSprop'}.
2026-06-23 00:36:06,025 - experiment_functions - INFO - Early stopping at epoch 3000. Best Metrics: (0.006099342379784016, 0.0013199444233926991, 0.0033928605203980776)
2026-06-23 00:36:06,370 - optuna.study.study - INFO - Trial 16 finished with values: [0.006099342379784016, 0.0013199444233926991, 0.0033928605203980776] and parameters: {'n_layers': 4, 'embedding_dim': 256, 'lr': 0.09262371607129609, 'lambda_val': 0.001880532910656797, 'batch_size': 3954, 'optimizer': 'Adam'}.
2026-06-23 00:36:45,130 - experiment_functions - INFO - Early stopping at epoch 850. Best Metrics: (0.02038807341315232, 0.004580333459643805, 0.01156026272449214)
2026-06-23 00:36:45,716 - optuna.study.study - INFO - Trial 17 finished with values: [0.02038807341315232, 0.004580333459643805, 0.01156026272449214] and parameters: {'n_layers': 2, 'embedding_dim': 32, 'lr': 0.0013646646670668807, 'lambda_val': 0.018126568573406728, 'batch_size': 1807, 'optimizer': 'Adam'}.
2026-06-23 00:37:10,653 - experiment_functions - INFO - Early stopping at epoch 500. Best Metrics: (0.0003880834010496798, 9.315397246431729e-05, 0.0002176359080932964)
2026-06-23 00:37:10,976 - optuna.study.study - INFO - Trial 18 finished with values: [0.0003880834010496798, 9.315397246431729e-05, 0.0002176359080932964] and parameters: {'n_layers': 2, 'embedding_dim': 128, 'lr': 0.004715308453412428, 'lambda_val': 0.00048501471754354745, 'batch_size': 1356, 'optimizer': 'SGD'}.
2026-06-23 00:37:34,297 - experiment_functions - INFO - Early stopping at epoch 500. Best Metrics: (0.0005362133807113268, 0.0001215738284703802, 0.00029509183736998627)
2026-06-23 00:37:34,382 - optuna.study.study - INFO - Trial 19 finished with values: [0.0005362133807113268, 0.0001215738284703802, 0.00029509183736998627] and parameters: {'n_layers': 1, 'embedding_dim': 64, 'lr': 3.351750482351998e-05, 'lambda_val': 3.179053479055171e-05, 'batch_size': 2208, 'optimizer': 'Adam'}.
2026-06-23 00:38:27,945 - experiment_functions - INFO - Early stopping at epoch 1200. Best Metrics: (0.003162548439629097, 0.000696286472148541, 0.001726277534384699)
2026-06-23 00:38:28,019 - optuna.study.study - INFO - Trial 20 finished with values: [0.003162548439629097, 0.000696286472148541, 0.001726277534384699] and parameters: {'n_layers': 1, 'embedding_dim': 96, 'lr': 0.07688385953966488, 'lambda_val': 0.0577158001131748, 'batch_size': 2075, 'optimizer': 'RMSprop'}.
2026-06-23 00:38:55,227 - experiment_functions - INFO - Early stopping at epoch 550. Best Metrics: (0.005007400204275288, 0.0011131110269041304, 0.0027226248171530916)
2026-06-23 00:38:55,282 - optuna.study.study - INFO - Trial 21 finished with values: [0.005007400204275288, 0.0011131110269041304, 0.0027226248171530916] and parameters: {'n_layers': 2, 'embedding_dim': 96, 'lr': 0.02057538567791982, 'lambda_val': 0.006418108485289533, 'batch_size': 2291, 'optimizer': 'Adam'}.
2026-06-23 00:39:21,261 - experiment_functions - INFO - Early stopping at epoch 550. Best Metrics: (0.005486929920418733, 0.001165214096248579, 0.0030237270091742112)
2026-06-23 00:39:21,338 - optuna.study.study - INFO - Trial 22 finished with values: [0.005486929920418733, 0.001165214096248579, 0.0030237270091742112] and parameters: {'n_layers': 4, 'embedding_dim': 32, 'lr': 0.06045802308039737, 'lambda_val': 1.7009465225795167e-06, 'batch_size': 1485, 'optimizer': 'RMSprop'}.
2026-06-23 00:42:10,890 - optuna.study.study - INFO - Trial 23 finished with values: [0.028731403324753123, 0.006186055323986359, 0.016835451529084843] and parameters: {'n_layers': 1, 'embedding_dim': 32, 'lr': 0.0006886562164819431, 'lambda_val': 2.7464269407470928e-06, 'batch_size': 1895, 'optimizer': 'RMSprop'}.
2026-06-23 00:42:42,740 - experiment_functions - INFO - Early stopping at epoch 650. Best Metrics: (0.011570676249158664, 0.0025183150183150185, 0.005884745398171925)
2026-06-23 00:42:42,809 - optuna.study.study - INFO - Trial 24 finished with values: [0.011570676249158664, 0.0025183150183150185, 0.005884745398171925] and parameters: {'n_layers': 3, 'embedding_dim': 64, 'lr': 0.0025566338112489964, 'lambda_val': 0.0011345897854453913, 'batch_size': 1341, 'optimizer': 'Adam'}.
2026-06-23 00:43:06,138 - experiment_functions - INFO - Early stopping at epoch 500. Best Metrics: (0.0004979172246720187, 0.00011683718580270306, 0.00026988165450534817)
2026-06-23 00:43:06,202 - optuna.study.study - INFO - Trial 25 finished with values: [0.0004979172246720187, 0.00011683718580270306, 0.00026988165450534817] and parameters: {'n_layers': 2, 'embedding_dim': 32, 'lr': 0.00017661936206538753, 'lambda_val': 0.00046869570822458774, 'batch_size': 1901, 'optimizer': 'SGD'}.
2026-06-23 00:43:35,688 - experiment_functions - INFO - Early stopping at epoch 550. Best Metrics: (0.011327866935075205, 0.002581470253884047, 0.006587971159366647)
2026-06-23 00:43:36,092 - optuna.study.study - INFO - Trial 26 finished with values: [0.011327866935075205, 0.002581470253884047, 0.006587971159366647] and parameters: {'n_layers': 1, 'embedding_dim': 256, 'lr': 0.009429082007684183, 'lambda_val': 0.000970508371024214, 'batch_size': 1842, 'optimizer': 'RMSprop'}.
2026-06-23 00:44:02,245 - experiment_functions - INFO - Early stopping at epoch 500. Best Metrics: (0.0005770218524018812, 0.00012473159024883163, 0.0003188140839830428)
2026-06-23 00:44:02,325 - optuna.study.study - INFO - Trial 27 finished with values: [0.0005770218524018812, 0.00012473159024883163, 0.0003188140839830428] and parameters: {'n_layers': 2, 'embedding_dim': 128, 'lr': 0.0002959897397113644, 'lambda_val': 0.09541958894889924, 'batch_size': 832, 'optimizer': 'RMSprop'}.
2026-06-23 00:44:26,354 - experiment_functions - INFO - Early stopping at epoch 500. Best Metrics: (0.00044118121648477446, 0.00011052166224580018, 0.0002621326097397703)
2026-06-23 00:44:26,697 - optuna.study.study - INFO - Trial 28 finished with values: [0.00044118121648477446, 0.00011052166224580018, 0.0002621326097397703] and parameters: {'n_layers': 4, 'embedding_dim': 32, 'lr': 0.00038881188453575153, 'lambda_val': 7.75834395076499e-06, 'batch_size': 3191, 'optimizer': 'SGD'}.
2026-06-23 00:45:14,317 - experiment_functions - INFO - Early stopping at epoch 900. Best Metrics: (0.022954693354389454, 0.0049418971832764945, 0.012870627410129546)
2026-06-23 00:45:14,408 - optuna.study.study - INFO - Trial 29 finished with values: [0.022954693354389454, 0.0049418971832764945, 0.012870627410129546] and parameters: {'n_layers': 3, 'embedding_dim': 128, 'lr': 0.0008213174750905707, 'lambda_val': 1.1678222757114953e-05, 'batch_size': 2436, 'optimizer': 'Adam'}.
2026-06-23 00:45:37,430 - experiment_functions - INFO - Early stopping at epoch 500. Best Metrics: (0.0005284416403887911, 0.00012631047113805736, 0.00025050249929299643)
