2026-06-17 14:11:48,654 - optuna.study.study - INFO - Trial 196 finished with values: [0.003415990939848337, 0.0008683844890741443, 0.0021794749491671926] and parameters: {'n_layers': 4, 'embedding_dim': 64, 'lr': 0.0013364645200376287, 'lambda_val': 3.399802510238604e-06, 'batch_size': 934, 'optimizer': 'Adam'}.
2026-06-17 14:12:22,890 - experiment_functions - INFO - Early stopping at epoch 800. Best Metrics: (0.0005675610703768006, 0.00013578375647341163, 0.0003520595018552025)
2026-06-17 14:12:22,992 - optuna.study.study - INFO - Trial 197 finished with values: [0.0005675610703768006, 0.00013578375647341163, 0.0003520595018552025] and parameters: {'n_layers': 2, 'embedding_dim': 64, 'lr': 0.009567567424439887, 'lambda_val': 4.480990319634202e-06, 'batch_size': 2622, 'optimizer': 'SGD'}.
2026-06-17 14:12:54,491 - experiment_functions - INFO - Early stopping at epoch 550. Best Metrics: (0.0033426280289794467, 0.0008557534419603386, 0.0019917764038882694)
2026-06-17 14:12:55,192 - optuna.study.study - INFO - Trial 198 finished with values: [0.0033426280289794467, 0.0008557534419603386, 0.0019917764038882694] and parameters: {'n_layers': 4, 'embedding_dim': 256, 'lr': 0.003554385501940762, 'lambda_val': 0.00027668479073292746, 'batch_size': 2019, 'optimizer': 'RMSprop'}.
2026-06-17 14:14:14,028 - experiment_functions - INFO - Early stopping at epoch 1450. Best Metrics: (0.003613842556932443, 0.0009346974864216244, 0.0022802823625023105)
2026-06-17 14:14:14,098 - optuna.study.study - INFO - Trial 199 finished with values: [0.003613842556932443, 0.0009346974864216244, 0.0022802823625023105] and parameters: {'n_layers': 4, 'embedding_dim': 256, 'lr': 0.0005773267382294165, 'lambda_val': 1.8109663387347854e-06, 'batch_size': 3073, 'optimizer': 'RMSprop'}.
2026-06-17 14:15:06,194 - experiment_functions - INFO - Early stopping at epoch 1200. Best Metrics: (0.0033670820259079077, 0.0008289124668435015, 0.002120231192796923)
2026-06-17 14:15:06,283 - optuna.study.study - INFO - Trial 200 finished with values: [0.0033670820259079077, 0.0008289124668435015, 0.002120231192796923] and parameters: {'n_layers': 4, 'embedding_dim': 64, 'lr': 0.0013364645200376287, 'lambda_val': 9.680731525938664e-06, 'batch_size': 934, 'optimizer': 'Adam'}.
2026-06-17 14:16:56,585 - experiment_functions - INFO - Early stopping at epoch 2400. Best Metrics: (0.003528304057317057, 0.0008794366552987244, 0.0021739472843997605)
2026-06-17 14:16:56,720 - optuna.study.study - INFO - Trial 201 finished with values: [0.003528304057317057, 0.0008794366552987244, 0.0021739472843997605] and parameters: {'n_layers': 4, 'embedding_dim': 128, 'lr': 0.0005841453281578621, 'lambda_val': 1.170012968533328e-05, 'batch_size': 3853, 'optimizer': 'RMSprop'}.
2026-06-17 14:17:25,471 - experiment_functions - INFO - Early stopping at epoch 500. Best Metrics: (0.0017014309094741708, 0.00039629910319565495, 0.0011267260803872702)
2026-06-17 14:17:25,562 - optuna.study.study - INFO - Trial 202 finished with values: [0.0017014309094741708, 0.00039629910319565495, 0.0011267260803872702] and parameters: {'n_layers': 4, 'embedding_dim': 256, 'lr': 0.06749635703171698, 'lambda_val': 0.003623250527584803, 'batch_size': 934, 'optimizer': 'Adam'}.
2026-06-17 14:20:47,837 - experiment_functions - INFO - Early stopping at epoch 3800. Best Metrics: (0.0033978951631761316, 0.0008652267272956928, 0.0020737427167139798)
2026-06-17 14:20:47,909 - optuna.study.study - INFO - Trial 203 finished with values: [0.0033978951631761316, 0.0008652267272956928, 0.0020737427167139798] and parameters: {'n_layers': 4, 'embedding_dim': 256, 'lr': 0.0005841453281578621, 'lambda_val': 1.0310836199436669e-05, 'batch_size': 1467, 'optimizer': 'Adam'}.
2026-06-17 14:21:49,715 - experiment_functions - INFO - Early stopping at epoch 1400. Best Metrics: (0.0030470285280060514, 0.0007515473032714413, 0.0018897064502939904)
2026-06-17 14:21:49,803 - optuna.study.study - INFO - Trial 204 finished with values: [0.0030470285280060514, 0.0007515473032714413, 0.0018897064502939904] and parameters: {'n_layers': 2, 'embedding_dim': 128, 'lr': 0.0005841453281578621, 'lambda_val': 0.00012072062045747035, 'batch_size': 3853, 'optimizer': 'RMSprop'}.
2026-06-17 14:22:47,178 - experiment_functions - INFO - Early stopping at epoch 1200. Best Metrics: (0.0034670339060406744, 0.0008762788935202728, 0.002126132393664761)
2026-06-17 14:22:47,283 - optuna.study.study - INFO - Trial 205 finished with values: [0.0034670339060406744, 0.0008762788935202728, 0.002126132393664761] and parameters: {'n_layers': 4, 'embedding_dim': 128, 'lr': 0.0014337059824812508, 'lambda_val': 1.170012968533328e-05, 'batch_size': 3100, 'optimizer': 'Adam'}.
2026-06-17 14:25:31,531 - optuna.study.study - INFO - Trial 206 finished with values: [0.003542034964936396, 0.0007736516357206013, 0.002132324914484657] and parameters: {'n_layers': 1, 'embedding_dim': 96, 'lr': 0.0005841453281578621, 'lambda_val': 1.0310836199436669e-05, 'batch_size': 1677, 'optimizer': 'RMSprop'}.
2026-06-17 14:26:57,048 - experiment_functions - INFO - Early stopping at epoch 2050. Best Metrics: (0.0031361638022500502, 0.000702601995705444, 0.0019895065813290216)
2026-06-17 14:26:57,147 - optuna.study.study - INFO - Trial 207 finished with values: [0.0031361638022500502, 0.000702601995705444, 0.0019895065813290216] and parameters: {'n_layers': 4, 'embedding_dim': 32, 'lr': 0.0005841453281578621, 'lambda_val': 1.170012968533328e-05, 'batch_size': 2288, 'optimizer': 'Adam'}.
2026-06-17 14:29:47,955 - optuna.study.study - INFO - Trial 208 finished with values: [0.00368538385954185, 0.0009299608437539473, 0.0023848353807600104] and parameters: {'n_layers': 4, 'embedding_dim': 64, 'lr': 0.0005841453281578621, 'lambda_val': 1.170012968533328e-05, 'batch_size': 2288, 'optimizer': 'RMSprop'}.
2026-06-17 14:30:20,239 - experiment_functions - INFO - Early stopping at epoch 550. Best Metrics: (0.0031322758337885693, 0.0008131236579512443, 0.0019250782814473999)
2026-06-17 14:30:20,369 - optuna.study.study - INFO - Trial 209 finished with values: [0.0031322758337885693, 0.0008131236579512443, 0.0019250782814473999] and parameters: {'n_layers': 4, 'embedding_dim': 256, 'lr': 0.007009946948234177, 'lambda_val': 0.00027668479073292746, 'batch_size': 1677, 'optimizer': 'Adam'}.
2026-06-17 14:30:50,780 - experiment_functions - INFO - Early stopping at epoch 700. Best Metrics: (0.0030328760122003587, 0.0006773399014778325, 0.0017958279220966877)
2026-06-17 14:30:51,086 - optuna.study.study - INFO - Trial 210 finished with values: [0.0030328760122003587, 0.0006773399014778325, 0.0017958279220966877] and parameters: {'n_layers': 2, 'embedding_dim': 32, 'lr': 0.003554385501940762, 'lambda_val': 0.00027668479073292746, 'batch_size': 2019, 'optimizer': 'RMSprop'}.
2026-06-17 14:33:11,508 - experiment_functions - INFO - Early stopping at epoch 3150. Best Metrics: (0.003991558061824926, 0.000986800555766073, 0.0024434523209266932)
2026-06-17 14:33:11,592 - optuna.study.study - INFO - Trial 211 finished with values: [0.003991558061824926, 0.000986800555766073, 0.0024434523209266932] and parameters: {'n_layers': 4, 'embedding_dim': 96, 'lr': 0.0005841453281578621, 'lambda_val': 1.6217164995596051e-06, 'batch_size': 1467, 'optimizer': 'RMSprop'}.
2026-06-17 14:33:35,270 - experiment_functions - INFO - Early stopping at epoch 500. Best Metrics: (0.000524348119922591, 0.00011841606669192877, 0.0002692110949696188)
2026-06-17 14:33:35,372 - optuna.study.study - INFO - Trial 212 finished with values: [0.000524348119922591, 0.00011841606669192877, 0.0002692110949696188] and parameters: {'n_layers': 4, 'embedding_dim': 64, 'lr': 0.0009353759827353638, 'lambda_val': 1.0310836199436669e-05, 'batch_size': 1467, 'optimizer': 'SGD'}.
2026-06-17 14:36:00,655 - experiment_functions - INFO - Early stopping at epoch 2700. Best Metrics: (0.0035345373352299657, 0.0009252242010862699, 0.0022202767010517195)
2026-06-17 14:36:00,730 - optuna.study.study - INFO - Trial 213 finished with values: [0.0035345373352299657, 0.0009252242010862699, 0.0022202767010517195] and parameters: {'n_layers': 4, 'embedding_dim': 256, 'lr': 0.0014337059824812508, 'lambda_val': 1.365244949903036e-06, 'batch_size': 1677, 'optimizer': 'RMSprop'}.
2026-06-17 14:38:26,602 - experiment_functions - INFO - Early stopping at epoch 3350. Best Metrics: (0.003945569466651689, 0.000999431602879879, 0.002663528536083935)
2026-06-17 14:38:26,677 - optuna.study.study - INFO - Trial 214 finished with values: [0.003945569466651689, 0.000999431602879879, 0.002663528536083935] and parameters: {'n_layers': 4, 'embedding_dim': 96, 'lr': 0.0005773267382294165, 'lambda_val': 0.00027668479073292746, 'batch_size': 815, 'optimizer': 'RMSprop'}.
2026-06-17 14:41:00,457 - optuna.study.study - INFO - Trial 215 finished with values: [0.003835196070853052, 0.0008068081343943415, 0.0022604352792287142] and parameters: {'n_layers': 1, 'embedding_dim': 32, 'lr': 0.0005841453281578621, 'lambda_val': 1.9289997599017184e-06, 'batch_size': 1507, 'optimizer': 'RMSprop'}.
2026-06-17 14:42:55,272 - experiment_functions - INFO - Early stopping at epoch 2150. Best Metrics: (0.0032679055346491797, 0.0008668056081849187, 0.0019984455345174556)
2026-06-17 14:42:55,353 - optuna.study.study - INFO - Trial 216 finished with values: [0.0032679055346491797, 0.0008668056081849187, 0.0019984455345174556] and parameters: {'n_layers': 4, 'embedding_dim': 256, 'lr': 0.0005841453281578621, 'lambda_val': 1.0310836199436669e-05, 'batch_size': 1467, 'optimizer': 'Adam'}.
2026-06-17 14:44:24,910 - experiment_functions - INFO - Early stopping at epoch 2000. Best Metrics: (0.0033961542162243793, 0.0008510167992926615, 0.002176145995374761)
2026-06-17 14:44:24,996 - optuna.study.study - INFO - Trial 217 finished with values: [0.0033961542162243793, 0.0008510167992926615, 0.002176145995374761] and parameters: {'n_layers': 3, 'embedding_dim': 128, 'lr': 0.0005841453281578621, 'lambda_val': 1.170012968533328e-05, 'batch_size': 3100, 'optimizer': 'RMSprop'}.
2026-06-17 14:45:06,309 - experiment_functions - INFO - Early stopping at epoch 900. Best Metrics: (0.003923284333840002, 0.0009789061513199445, 0.002505167612982311)
2026-06-17 14:45:06,393 - optuna.study.study - INFO - Trial 218 finished with values: [0.003923284333840002, 0.0009789061513199445, 0.002505167612982311] and parameters: {'n_layers': 4, 'embedding_dim': 96, 'lr': 0.0017238025221562986, 'lambda_val': 0.00027668479073292746, 'batch_size': 815, 'optimizer': 'RMSprop'}.
2026-06-17 14:46:40,100 - experiment_functions - INFO - Early stopping at epoch 2200. Best Metrics: (0.0035736819575389535, 0.0008904888215233043, 0.0022835406330525203)
2026-06-17 14:46:40,182 - optuna.study.study - INFO - Trial 219 finished with values: [0.0035736819575389535, 0.0008904888215233043, 0.0022835406330525203] and parameters: {'n_layers': 4, 'embedding_dim': 64, 'lr': 0.0009353759827353638, 'lambda_val': 0.00027668479073292746, 'batch_size': 934, 'optimizer': 'Adam'}.
2026-06-17 14:47:23,594 - experiment_functions - INFO - Early stopping at epoch 950. Best Metrics: (0.0031866262336082934, 0.0008068081343943414, 0.001959323299558342)
2026-06-17 14:47:23,679 - optuna.study.study - INFO - Trial 220 finished with values: [0.0031866262336082934, 0.0008068081343943414, 0.001959323299558342] and parameters: {'n_layers': 4, 'embedding_dim': 96, 'lr': 0.0014337059824812508, 'lambda_val': 6.318727634085899e-05, 'batch_size': 4027, 'optimizer': 'RMSprop'}.
2026-06-17 14:49:37,832 - experiment_functions - INFO - Early stopping at epoch 3400. Best Metrics: (0.003185847382600103, 0.0006773399014778325, 0.0019031642172695044)
2026-06-17 14:49:37,910 - optuna.study.study - INFO - Trial 221 finished with values: [0.003185847382600103, 0.0006773399014778325, 0.0019031642172695044] and parameters: {'n_layers': 1, 'embedding_dim': 32, 'lr': 0.00035885552475151193, 'lambda_val': 0.00031694390828632265, 'batch_size': 4010, 'optimizer': 'RMSprop'}.
2026-06-17 14:51:53,616 - experiment_functions - INFO - Early stopping at epoch 2850. Best Metrics: (0.0034741024847048736, 0.0008557534419603386, 0.0022065412238485463)
2026-06-17 14:51:53,704 - optuna.study.study - INFO - Trial 222 finished with values: [0.0034741024847048736, 0.0008557534419603386, 0.0022065412238485463] and parameters: {'n_layers': 2, 'embedding_dim': 256, 'lr': 0.0007511154553369348, 'lambda_val': 1.1791971258066213e-06, 'batch_size': 2714, 'optimizer': 'RMSprop'}.
2026-06-17 14:54:56,097 - optuna.study.study - INFO - Trial 223 finished with values: [0.00343590992771122, 0.0008747000126310471, 0.002053839990675492] and parameters: {'n_layers': 4, 'embedding_dim': 128, 'lr': 0.0005841453281578621, 'lambda_val': 5.723560548835963e-06, 'batch_size': 2778, 'optimizer': 'Adam'}.
2026-06-17 14:55:22,464 - experiment_functions - INFO - Early stopping at epoch 550. Best Metrics: (0.0030870433890396454, 0.0008052292535051155, 0.0020497041404992328)
2026-06-17 14:55:22,541 - optuna.study.study - INFO - Trial 224 finished with values: [0.0030870433890396454, 0.0008052292535051155, 0.0020497041404992328] and parameters: {'n_layers': 3, 'embedding_dim': 128, 'lr': 0.005074479384082435, 'lambda_val': 0.00027668479073292746, 'batch_size': 893, 'optimizer': 'RMSprop'}.
2026-06-17 14:57:03,715 - experiment_functions - INFO - Early stopping at epoch 2250. Best Metrics: (0.0037080793277943793, 0.0009110142730832387, 0.0022427303150631167)
2026-06-17 14:57:03,822 - optuna.study.study - INFO - Trial 225 finished with values: [0.0037080793277943793, 0.0009110142730832387, 0.0022427303150631167] and parameters: {'n_layers': 3, 'embedding_dim': 128, 'lr': 0.0005841453281578621, 'lambda_val': 1.170012968533328e-05, 'batch_size': 3100, 'optimizer': 'RMSprop'}.
2026-06-17 14:57:37,986 - experiment_functions - INFO - Early stopping at epoch 600. Best Metrics: (0.0033260080989371043, 0.0008731211317418214, 0.0021419648951572752)
2026-06-17 14:57:38,131 - optuna.study.study - INFO - Trial 226 finished with values: [0.0033260080989371043, 0.0008731211317418214, 0.0021419648951572752] and parameters: {'n_layers': 4, 'embedding_dim': 256, 'lr': 0.003554385501940762, 'lambda_val': 1.2665690481896469e-05, 'batch_size': 2859, 'optimizer': 'RMSprop'}.
2026-06-17 14:59:30,262 - experiment_functions - INFO - Early stopping at epoch 2100. Best Metrics: (0.0038371050228218876, 0.0009457496526462045, 0.0023415154794661744)
2026-06-17 14:59:30,337 - optuna.study.study - INFO - Trial 227 finished with values: [0.0038371050228218876, 0.0009457496526462045, 0.0023415154794661744] and parameters: {'n_layers': 4, 'embedding_dim': 256, 'lr': 0.0005841453281578621, 'lambda_val': 1.170012968533328e-05, 'batch_size': 2288, 'optimizer': 'RMSprop'}.
2026-06-17 15:01:18,385 - experiment_functions - INFO - Early stopping at epoch 2350. Best Metrics: (0.0034385541372694457, 0.0008841732979664015, 0.0021399996862397036)
2026-06-17 15:01:18,467 - optuna.study.study - INFO - Trial 228 finished with values: [0.0034385541372694457, 0.0008841732979664015, 0.0021399996862397036] and parameters: {'n_layers': 4, 'embedding_dim': 128, 'lr': 0.0005841453281578621, 'lambda_val': 1.0310836199436669e-05, 'batch_size': 3853, 'optimizer': 'RMSprop'}.
2026-06-17 15:04:00,809 - optuna.study.study - INFO - Trial 229 finished with values: [0.003005412737903662, 0.0006599722116963497, 0.001829143747456239] and parameters: {'n_layers': 1, 'embedding_dim': 96, 'lr': 0.0005841453281578621, 'lambda_val': 1.127317474951793e-06, 'batch_size': 4010, 'optimizer': 'Adam'}.
2026-06-17 15:06:37,200 - experiment_functions - INFO - Early stopping at epoch 2950. Best Metrics: (0.0037400534557317953, 0.0009299608437539473, 0.0023350993266581356)
2026-06-17 15:06:37,286 - optuna.study.study - INFO - Trial 230 finished with values: [0.0037400534557317953, 0.0009299608437539473, 0.0023350993266581356] and parameters: {'n_layers': 4, 'embedding_dim': 256, 'lr': 0.0005086943405728801, 'lambda_val': 1.0310836199436669e-05, 'batch_size': 3141, 'optimizer': 'RMSprop'}.
2026-06-17 15:07:04,530 - experiment_functions - INFO - Early stopping at epoch 600. Best Metrics: (0.0028850680326112594, 0.0007815460401667298, 0.0018719186168110814)
2026-06-17 15:07:04,624 - optuna.study.study - INFO - Trial 231 finished with values: [0.0028850680326112594, 0.0007815460401667298, 0.0018719186168110814] and parameters: {'n_layers': 4, 'embedding_dim': 64, 'lr': 0.012769465737400438, 'lambda_val': 1.0310836199436669e-05, 'batch_size': 934, 'optimizer': 'RMSprop'}.
2026-06-17 15:07:35,959 - experiment_functions - INFO - Early stopping at epoch 550. Best Metrics: (0.003011942043036735, 0.0008352279904004042, 0.001936375739890372)
2026-06-17 15:07:36,081 - optuna.study.study - INFO - Trial 232 finished with values: [0.003011942043036735, 0.0008352279904004042, 0.001936375739890372] and parameters: {'n_layers': 4, 'embedding_dim': 256, 'lr': 0.013498745374989938, 'lambda_val': 1.170012968533328e-05, 'batch_size': 1507, 'optimizer': 'RMSprop'}.
2026-06-17 15:09:43,289 - experiment_functions - INFO - Early stopping at epoch 3150. Best Metrics: (0.0029208556619864053, 0.0006394467601364153, 0.0017095258413331565)
2026-06-17 15:09:43,367 - optuna.study.study - INFO - Trial 233 finished with values: [0.0029208556619864053, 0.0006394467601364153, 0.0017095258413331565] and parameters: {'n_layers': 1, 'embedding_dim': 96, 'lr': 0.0005841453281578621, 'lambda_val': 1.0310836199436669e-05, 'batch_size': 3806, 'optimizer': 'RMSprop'}.
2026-06-17 15:12:22,863 - optuna.study.study - INFO - Trial 234 finished with values: [0.0034590648546991855, 0.0008210180623973727, 0.002144112906628077] and parameters: {'n_layers': 4, 'embedding_dim': 32, 'lr': 0.0005841453281578621, 'lambda_val': 0.0007535542745376925, 'batch_size': 2288, 'optimizer': 'RMSprop'}.
2026-06-17 15:15:17,586 - experiment_functions - INFO - Early stopping at epoch 3300. Best Metrics: (0.0035880358192250023, 0.0009078565113047872, 0.0021655329343531564)
2026-06-17 15:15:17,673 - optuna.study.study - INFO - Trial 235 finished with values: [0.0035880358192250023, 0.0009078565113047872, 0.0021655329343531564] and parameters: {'n_layers': 4, 'embedding_dim': 256, 'lr': 0.0005773267382294165, 'lambda_val': 1.9289997599017184e-06, 'batch_size': 934, 'optimizer': 'Adam'}.
2026-06-17 15:18:19,730 - optuna.study.study - INFO - Trial 236 finished with values: [0.00354632397466046, 0.0008762788935202728, 0.00210097075084855] and parameters: {'n_layers': 4, 'embedding_dim': 128, 'lr': 0.0005841453281578621, 'lambda_val': 1.0310836199436669e-05, 'batch_size': 1507, 'optimizer': 'Adam'}.
2026-06-17 15:20:40,763 - experiment_functions - INFO - Early stopping at epoch 2650. Best Metrics: (0.003704026157944667, 0.0009741695086522674, 0.002321518032218991)
2026-06-17 15:20:40,849 - optuna.study.study - INFO - Trial 237 finished with values: [0.003704026157944667, 0.0009741695086522674, 0.002321518032218991] and parameters: {'n_layers': 4, 'embedding_dim': 256, 'lr': 0.0005841453281578621, 'lambda_val': 1.0239148319725045e-05, 'batch_size': 1507, 'optimizer': 'RMSprop'}.
2026-06-17 15:21:12,345 - experiment_functions - INFO - Early stopping at epoch 550. Best Metrics: (0.002793888843616954, 0.0007468106606037643, 0.0017665228106157867)
2026-06-17 15:21:12,427 - optuna.study.study - INFO - Trial 238 finished with values: [0.002793888843616954, 0.0007468106606037643, 0.0017665228106157867] and parameters: {'n_layers': 4, 'embedding_dim': 256, 'lr': 0.013498745374989938, 'lambda_val': 1.170012968533328e-05, 'batch_size': 3100, 'optimizer': 'RMSprop'}.
2026-06-17 15:21:34,186 - experiment_functions - INFO - Early stopping at epoch 500. Best Metrics: (0.0004361026806354494, 9.789061513199444e-05, 0.00024095604866099533)
2026-06-17 15:21:34,259 - optuna.study.study - INFO - Trial 239 finished with values: [0.0004361026806354494, 9.789061513199444e-05, 0.00024095604866099533] and parameters: {'n_layers': 2, 'embedding_dim': 32, 'lr': 0.00035885552475151193, 'lambda_val': 1.0310836199436669e-05, 'batch_size': 4010, 'optimizer': 'SGD'}.
2026-06-17 15:22:05,826 - experiment_functions - INFO - Early stopping at epoch 550. Best Metrics: (0.0028573206025988163, 0.0007910193255020842, 0.0018172148462878637)
2026-06-17 15:22:05,915 - optuna.study.study - INFO - Trial 240 finished with values: [0.0028573206025988163, 0.0007910193255020842, 0.0018172148462878637] and parameters: {'n_layers': 4, 'embedding_dim': 256, 'lr': 0.04774348330611182, 'lambda_val': 1.8109663387347854e-06, 'batch_size': 934, 'optimizer': 'Adam'}.
2026-06-17 15:24:50,962 - optuna.study.study - INFO - Trial 241 finished with values: [0.0025975270559597495, 0.0006347101174687382, 0.0016477867197170774] and parameters: {'n_layers': 2, 'embedding_dim': 96, 'lr': 0.0005773267382294165, 'lambda_val': 0.003623250527584803, 'batch_size': 934, 'optimizer': 'Adam'}.
2026-06-17 15:25:14,546 - experiment_functions - INFO - Early stopping at epoch 500. Best Metrics: (0.000601940748993187, 0.00014367816091954025, 0.0003488231463605729)
2026-06-17 15:25:14,625 - optuna.study.study - INFO - Trial 242 finished with values: [0.000601940748993187, 0.00014367816091954025, 0.0003488231463605729] and parameters: {'n_layers': 4, 'embedding_dim': 96, 'lr': 7.960725324251212e-05, 'lambda_val': 6.36485192314748e-05, 'batch_size': 934, 'optimizer': 'SGD'}.
2026-06-17 15:25:44,401 - experiment_functions - INFO - Early stopping at epoch 650. Best Metrics: (0.0016268105204465513, 0.00041682455475558933, 0.0010813570993874414)
