2026-06-21 18:36:27,020 - optuna.study.study - INFO - Trial 142 finished with values: [0.007467217461359659, 0.001953075659972212, 0.004629105643556622] and parameters: {'n_layers': 4, 'embedding_dim': 96, 'lr': 0.008463855437471605, 'lambda_val': 1.1896982541974421e-05, 'batch_size': 1816, 'optimizer': 'Adam'}.
2026-06-21 18:36:54,644 - experiment_functions - INFO - Early stopping at epoch 600. Best Metrics: (0.004691146090569271, 0.0011399520020209679, 0.0027550885205603094)
2026-06-21 18:36:54,752 - optuna.study.study - INFO - Trial 143 finished with values: [0.004691146090569271, 0.0011399520020209679, 0.0027550885205603094] and parameters: {'n_layers': 2, 'embedding_dim': 96, 'lr': 0.013692285994849401, 'lambda_val': 0.0006283288441439905, 'batch_size': 3261, 'optimizer': 'Adam'}.
2026-06-21 18:37:45,460 - experiment_functions - INFO - Early stopping at epoch 1200. Best Metrics: (0.004991759953928537, 0.001215738284703802, 0.003152051139877254)
2026-06-21 18:37:45,615 - optuna.study.study - INFO - Trial 144 finished with values: [0.004991759953928537, 0.001215738284703802, 0.003152051139877254] and parameters: {'n_layers': 1, 'embedding_dim': 96, 'lr': 0.0036608132255288727, 'lambda_val': 1.1896982541974421e-05, 'batch_size': 2786, 'optimizer': 'RMSprop'}.
2026-06-21 18:38:30,967 - experiment_functions - INFO - Early stopping at epoch 1050. Best Metrics: (0.006110382420656707, 0.0015346722243273967, 0.0038027531806318787)
2026-06-21 18:38:31,076 - optuna.study.study - INFO - Trial 145 finished with values: [0.006110382420656707, 0.0015346722243273967, 0.0038027531806318787] and parameters: {'n_layers': 2, 'embedding_dim': 32, 'lr': 0.0024374436987616007, 'lambda_val': 1.1896982541974421e-05, 'batch_size': 3442, 'optimizer': 'RMSprop'}.
2026-06-21 18:41:25,798 - optuna.study.study - INFO - Trial 146 finished with values: [0.000931824488177506, 0.0002273588480485032, 0.0005475159163350516] and parameters: {'n_layers': 4, 'embedding_dim': 64, 'lr': 8.667213487591359e-05, 'lambda_val': 1.544427077132802e-06, 'batch_size': 3116, 'optimizer': 'Adam'}.
2026-06-21 18:43:59,256 - experiment_functions - INFO - Early stopping at epoch 3650. Best Metrics: (0.004330320871076325, 0.0009552229379815587, 0.002565765493381389)
2026-06-21 18:43:59,372 - optuna.study.study - INFO - Trial 147 finished with values: [0.004330320871076325, 0.0009552229379815587, 0.002565765493381389] and parameters: {'n_layers': 1, 'embedding_dim': 96, 'lr': 0.0009312796651119834, 'lambda_val': 0.00012818615016027372, 'batch_size': 3744, 'optimizer': 'Adam'}.
2026-06-21 18:44:24,145 - experiment_functions - INFO - Early stopping at epoch 550. Best Metrics: (0.0038000864999442104, 0.0009852216748768474, 0.002281994887738164)
2026-06-21 18:44:24,247 - optuna.study.study - INFO - Trial 148 finished with values: [0.0038000864999442104, 0.0009852216748768474, 0.002281994887738164] and parameters: {'n_layers': 3, 'embedding_dim': 32, 'lr': 0.018991881603422755, 'lambda_val': 1.1896982541974421e-05, 'batch_size': 3442, 'optimizer': 'RMSprop'}.
2026-06-21 18:44:54,993 - experiment_functions - INFO - Early stopping at epoch 700. Best Metrics: (0.005462334282866237, 0.0014652014652014652, 0.0034273641534116406)
2026-06-21 18:44:55,125 - optuna.study.study - INFO - Trial 149 finished with values: [0.005462334282866237, 0.0014652014652014652, 0.0034273641534116406] and parameters: {'n_layers': 3, 'embedding_dim': 32, 'lr': 0.00264461364827089, 'lambda_val': 0.015147798513906546, 'batch_size': 3850, 'optimizer': 'Adam'}.
2026-06-21 18:45:32,611 - experiment_functions - INFO - Early stopping at epoch 850. Best Metrics: (0.0075723618144021305, 0.001973601111532146, 0.004904624370863694)
2026-06-21 18:45:32,718 - optuna.study.study - INFO - Trial 150 finished with values: [0.0075723618144021305, 0.001973601111532146, 0.004904624370863694] and parameters: {'n_layers': 3, 'embedding_dim': 32, 'lr': 0.0028956207651794296, 'lambda_val': 1.1896982541974421e-05, 'batch_size': 2987, 'optimizer': 'Adam'}.
2026-06-21 18:46:42,890 - experiment_functions - INFO - Early stopping at epoch 1650. Best Metrics: (0.007523882401295252, 0.0018757104964001517, 0.004608862562735779)
2026-06-21 18:46:43,001 - optuna.study.study - INFO - Trial 151 finished with values: [0.007523882401295252, 0.0018757104964001517, 0.004608862562735779] and parameters: {'n_layers': 2, 'embedding_dim': 32, 'lr': 0.0015158687633618723, 'lambda_val': 7.024518890460945e-05, 'batch_size': 2925, 'optimizer': 'RMSprop'}.
2026-06-21 18:47:11,688 - experiment_functions - INFO - Early stopping at epoch 650. Best Metrics: (0.004622026068695635, 0.0011367942402425164, 0.0028119284902498403)
2026-06-21 18:47:11,796 - optuna.study.study - INFO - Trial 152 finished with values: [0.004622026068695635, 0.0011367942402425164, 0.0028119284902498403] and parameters: {'n_layers': 2, 'embedding_dim': 32, 'lr': 0.008463855437471605, 'lambda_val': 0.0009730028095032008, 'batch_size': 2925, 'optimizer': 'Adam'}.
2026-06-21 18:47:41,065 - experiment_functions - INFO - Early stopping at epoch 600. Best Metrics: (0.003968571314200693, 0.001081533409119616, 0.0023275722157596467)
2026-06-21 18:47:41,173 - optuna.study.study - INFO - Trial 153 finished with values: [0.003968571314200693, 0.001081533409119616, 0.0023275722157596467] and parameters: {'n_layers': 4, 'embedding_dim': 96, 'lr': 0.0036608132255288727, 'lambda_val': 0.04628459041635656, 'batch_size': 2664, 'optimizer': 'Adam'}.
2026-06-21 18:48:19,628 - experiment_functions - INFO - Early stopping at epoch 650. Best Metrics: (0.004101331920467132, 0.0009504862953138816, 0.002505528338603792)
2026-06-21 18:48:19,774 - optuna.study.study - INFO - Trial 154 finished with values: [0.004101331920467132, 0.0009504862953138816, 0.002505528338603792] and parameters: {'n_layers': 4, 'embedding_dim': 256, 'lr': 0.07227554770696355, 'lambda_val': 1.544427077132802e-06, 'batch_size': 3044, 'optimizer': 'RMSprop'}.
2026-06-21 18:48:46,887 - experiment_functions - INFO - Early stopping at epoch 550. Best Metrics: (0.007425630796317994, 0.0017920298092711886, 0.004297135984000626)
2026-06-21 18:48:46,992 - optuna.study.study - INFO - Trial 155 finished with values: [0.007425630796317994, 0.0017920298092711886, 0.004297135984000626] and parameters: {'n_layers': 4, 'embedding_dim': 96, 'lr': 0.011765700859700308, 'lambda_val': 6.024114009426496e-06, 'batch_size': 2374, 'optimizer': 'Adam'}.
2026-06-21 18:49:14,251 - experiment_functions - INFO - Early stopping at epoch 550. Best Metrics: (0.007806562292949385, 0.0019072881141846659, 0.004596912156637834)
2026-06-21 18:49:14,355 - optuna.study.study - INFO - Trial 156 finished with values: [0.007806562292949385, 0.0019072881141846659, 0.004596912156637834] and parameters: {'n_layers': 4, 'embedding_dim': 96, 'lr': 0.0036608132255288727, 'lambda_val': 0.0005803217930206673, 'batch_size': 3744, 'optimizer': 'RMSprop'}.
2026-06-21 18:49:47,453 - experiment_functions - INFO - Early stopping at epoch 550. Best Metrics: (0.006144366172023406, 0.0015236200581028167, 0.0035558907663480552)
2026-06-21 18:49:47,560 - optuna.study.study - INFO - Trial 157 finished with values: [0.006144366172023406, 0.0015236200581028167, 0.0035558907663480552] and parameters: {'n_layers': 4, 'embedding_dim': 256, 'lr': 0.011765700859700308, 'lambda_val': 0.0002398706534506285, 'batch_size': 2374, 'optimizer': 'Adam'}.
2026-06-21 18:50:23,351 - experiment_functions - INFO - Early stopping at epoch 600. Best Metrics: (0.005864526791177628, 0.001544145509662751, 0.003391839231508282)
2026-06-21 18:50:23,640 - optuna.study.study - INFO - Trial 158 finished with values: [0.005864526791177628, 0.001544145509662751, 0.003391839231508282] and parameters: {'n_layers': 4, 'embedding_dim': 256, 'lr': 0.0015158687633618723, 'lambda_val': 0.010222958018797466, 'batch_size': 3122, 'optimizer': 'RMSprop'}.
2026-06-21 18:50:49,594 - experiment_functions - INFO - Early stopping at epoch 550. Best Metrics: (0.0035549573635203805, 0.0008399646330680814, 0.00206767396046256)
2026-06-21 18:50:49,697 - optuna.study.study - INFO - Trial 159 finished with values: [0.0035549573635203805, 0.0008399646330680814, 0.00206767396046256] and parameters: {'n_layers': 4, 'embedding_dim': 64, 'lr': 0.08247253047741798, 'lambda_val': 0.00040764482336836375, 'batch_size': 989, 'optimizer': 'Adam'}.
2026-06-21 18:51:22,606 - experiment_functions - INFO - Early stopping at epoch 650. Best Metrics: (0.008952582228922788, 0.002245168624478969, 0.005478869624452788)
2026-06-21 18:51:22,714 - optuna.study.study - INFO - Trial 160 finished with values: [0.008952582228922788, 0.002245168624478969, 0.005478869624452788] and parameters: {'n_layers': 4, 'embedding_dim': 128, 'lr': 0.00264461364827089, 'lambda_val': 0.0009730028095032008, 'batch_size': 2374, 'optimizer': 'Adam'}.
2026-06-21 18:51:57,478 - experiment_functions - INFO - Early stopping at epoch 800. Best Metrics: (0.0038927305112593865, 0.000909435392194013, 0.0023757855028480553)
2026-06-21 18:51:57,829 - optuna.study.study - INFO - Trial 161 finished with values: [0.0038927305112593865, 0.000909435392194013, 0.0023757855028480553] and parameters: {'n_layers': 1, 'embedding_dim': 96, 'lr': 0.008463855437471605, 'lambda_val': 1.1896982541974421e-05, 'batch_size': 2925, 'optimizer': 'Adam'}.
2026-06-21 18:52:41,609 - experiment_functions - INFO - Early stopping at epoch 1050. Best Metrics: (0.005779510777712144, 0.0014304660856384996, 0.003618735402008459)
2026-06-21 18:52:41,717 - optuna.study.study - INFO - Trial 162 finished with values: [0.005779510777712144, 0.0014304660856384996, 0.003618735402008459] and parameters: {'n_layers': 2, 'embedding_dim': 32, 'lr': 0.0024374436987616007, 'lambda_val': 1.1896982541974421e-05, 'batch_size': 2925, 'optimizer': 'Adam'}.
2026-06-21 18:53:09,902 - experiment_functions - INFO - Early stopping at epoch 600. Best Metrics: (0.007757517088067763, 0.0018962359479600859, 0.004636799420223487)
2026-06-21 18:53:10,009 - optuna.study.study - INFO - Trial 163 finished with values: [0.007757517088067763, 0.0018962359479600859, 0.004636799420223487] and parameters: {'n_layers': 4, 'embedding_dim': 64, 'lr': 0.008463855437471605, 'lambda_val': 7.635658041119374e-05, 'batch_size': 2908, 'optimizer': 'Adam'}.
2026-06-21 18:53:36,742 - experiment_functions - INFO - Early stopping at epoch 600. Best Metrics: (0.007091019042029476, 0.0017604521914866742, 0.004277178567612504)
2026-06-21 18:53:36,851 - optuna.study.study - INFO - Trial 164 finished with values: [0.007091019042029476, 0.0017604521914866742, 0.004277178567612504] and parameters: {'n_layers': 4, 'embedding_dim': 32, 'lr': 0.011765700859700308, 'lambda_val': 1.544427077132802e-06, 'batch_size': 2374, 'optimizer': 'Adam'}.
2026-06-21 18:54:08,207 - experiment_functions - INFO - Early stopping at epoch 650. Best Metrics: (0.007734681534331114, 0.0019767588733105973, 0.004650909870215131)
2026-06-21 18:54:08,309 - optuna.study.study - INFO - Trial 165 finished with values: [0.007734681534331114, 0.0019767588733105973, 0.004650909870215131] and parameters: {'n_layers': 4, 'embedding_dim': 96, 'lr': 0.0036608132255288727, 'lambda_val': 0.0005803217930206673, 'batch_size': 3122, 'optimizer': 'Adam'}.
2026-06-21 18:55:23,611 - experiment_functions - INFO - Early stopping at epoch 1850. Best Metrics: (0.007176225692976115, 0.001689402551471517, 0.004416597042067962)
2026-06-21 18:55:23,713 - optuna.study.study - INFO - Trial 166 finished with values: [0.007176225692976115, 0.001689402551471517, 0.004416597042067962] and parameters: {'n_layers': 2, 'embedding_dim': 32, 'lr': 0.0024374436987616007, 'lambda_val': 6.131403610536352e-05, 'batch_size': 899, 'optimizer': 'Adam'}.
2026-06-21 18:56:11,574 - experiment_functions - INFO - Early stopping at epoch 1150. Best Metrics: (0.0072693574955663585, 0.0017825565239358344, 0.004434589632925846)
2026-06-21 18:56:11,695 - optuna.study.study - INFO - Trial 167 finished with values: [0.0072693574955663585, 0.0017825565239358344, 0.004434589632925846] and parameters: {'n_layers': 2, 'embedding_dim': 32, 'lr': 0.0015158687633618723, 'lambda_val': 1.1896982541974421e-05, 'batch_size': 3442, 'optimizer': 'RMSprop'}.
2026-06-21 18:56:43,347 - experiment_functions - INFO - Early stopping at epoch 700. Best Metrics: (0.004437807378149169, 0.0010246936971074904, 0.002555577120073827)
2026-06-21 18:56:43,453 - optuna.study.study - INFO - Trial 168 finished with values: [0.004437807378149169, 0.0010246936971074904, 0.002555577120073827] and parameters: {'n_layers': 2, 'embedding_dim': 96, 'lr': 0.02178780574763968, 'lambda_val': 1.544427077132802e-06, 'batch_size': 3442, 'optimizer': 'Adam'}.
2026-06-21 18:57:05,619 - experiment_functions - INFO - Early stopping at epoch 500. Best Metrics: (0.00048530278089287576, 0.00011052166224580018, 0.00026240023453106865)
2026-06-21 18:57:05,719 - optuna.study.study - INFO - Trial 169 finished with values: [0.00048530278089287576, 0.00011052166224580018, 0.00026240023453106865] and parameters: {'n_layers': 2, 'embedding_dim': 32, 'lr': 2.0758695691708983e-05, 'lambda_val': 6.131403610536352e-05, 'batch_size': 899, 'optimizer': 'Adam'}.
2026-06-21 18:57:27,751 - experiment_functions - INFO - Early stopping at epoch 500. Best Metrics: (0.0004102144873572089, 9.157509157509159e-05, 0.0002245177771400138)
2026-06-21 18:57:27,852 - optuna.study.study - INFO - Trial 170 finished with values: [0.0004102144873572089, 9.157509157509159e-05, 0.0002245177771400138] and parameters: {'n_layers': 3, 'embedding_dim': 32, 'lr': 0.012808126858023893, 'lambda_val': 6.702534509469782e-06, 'batch_size': 2987, 'optimizer': 'SGD'}.
2026-06-21 18:58:12,960 - experiment_functions - INFO - Early stopping at epoch 1050. Best Metrics: (0.0040129098171087065, 0.0009662751042061388, 0.0024600170872284195)
2026-06-21 18:58:13,065 - optuna.study.study - INFO - Trial 171 finished with values: [0.0040129098171087065, 0.0009662751042061388, 0.0024600170872284195] and parameters: {'n_layers': 1, 'embedding_dim': 96, 'lr': 0.0036608132255288727, 'lambda_val': 0.0009730028095032008, 'batch_size': 3122, 'optimizer': 'Adam'}.
2026-06-21 18:58:43,282 - experiment_functions - INFO - Early stopping at epoch 700. Best Metrics: (0.006164786135825582, 0.0014967790829859796, 0.00373617118403399)
2026-06-21 18:58:43,392 - optuna.study.study - INFO - Trial 172 finished with values: [0.006164786135825582, 0.0014967790829859796, 0.00373617118403399] and parameters: {'n_layers': 2, 'embedding_dim': 32, 'lr': 0.0036608132255288727, 'lambda_val': 7.024518890460945e-05, 'batch_size': 3442, 'optimizer': 'RMSprop'}.
2026-06-21 18:59:19,561 - experiment_functions - INFO - Early stopping at epoch 800. Best Metrics: (0.006704580368557974, 0.0017083491221422254, 0.003989099106881221)
2026-06-21 18:59:19,666 - optuna.study.study - INFO - Trial 173 finished with values: [0.006704580368557974, 0.0017083491221422254, 0.003989099106881221] and parameters: {'n_layers': 2, 'embedding_dim': 96, 'lr': 0.0024374436987616007, 'lambda_val': 3.825060988924547e-06, 'batch_size': 3442, 'optimizer': 'RMSprop'}.
2026-06-21 19:00:28,444 - experiment_functions - INFO - Early stopping at epoch 1700. Best Metrics: (0.006773021238574397, 0.0016515094101301002, 0.0041703351064487065)
2026-06-21 19:00:28,556 - optuna.study.study - INFO - Trial 174 finished with values: [0.006773021238574397, 0.0016515094101301002, 0.0041703351064487065] and parameters: {'n_layers': 2, 'embedding_dim': 32, 'lr': 0.0015158687633618723, 'lambda_val': 1.544427077132802e-06, 'batch_size': 2925, 'optimizer': 'RMSprop'}.
2026-06-21 19:01:09,426 - experiment_functions - INFO - Early stopping at epoch 900. Best Metrics: (0.011857533234398084, 0.002949349501073639, 0.007279310810468016)
2026-06-21 19:01:09,533 - optuna.study.study - INFO - Trial 175 finished with values: [0.011857533234398084, 0.002949349501073639, 0.007279310810468016] and parameters: {'n_layers': 4, 'embedding_dim': 64, 'lr': 0.00168887528029852, 'lambda_val': 0.0004098288354602192, 'batch_size': 1157, 'optimizer': 'RMSprop'}.
2026-06-21 19:01:34,305 - experiment_functions - INFO - Early stopping at epoch 550. Best Metrics: (0.006113655832802694, 0.0015709864847795881, 0.003910756511588559)
2026-06-21 19:01:34,408 - optuna.study.study - INFO - Trial 176 finished with values: [0.006113655832802694, 0.0015709864847795881, 0.003910756511588559] and parameters: {'n_layers': 4, 'embedding_dim': 32, 'lr': 0.013692285994849401, 'lambda_val': 1.544427077132802e-06, 'batch_size': 2925, 'optimizer': 'Adam'}.
2026-06-21 19:02:11,986 - experiment_functions - INFO - Early stopping at epoch 800. Best Metrics: (0.0005698955772715385, 0.0001310471138057345, 0.00034205087239129987)
2026-06-21 19:02:12,090 - optuna.study.study - INFO - Trial 177 finished with values: [0.0005698955772715385, 0.0001310471138057345, 0.00034205087239129987] and parameters: {'n_layers': 4, 'embedding_dim': 96, 'lr': 1.2504916882645268e-05, 'lambda_val': 1.544427077132802e-06, 'batch_size': 3261, 'optimizer': 'Adam'}.
2026-06-21 19:02:37,343 - experiment_functions - INFO - Early stopping at epoch 550. Best Metrics: (0.006528772739850896, 0.0016262473159024883, 0.00389221428077546)
2026-06-21 19:02:37,445 - optuna.study.study - INFO - Trial 178 finished with values: [0.006528772739850896, 0.0016262473159024883, 0.00389221428077546] and parameters: {'n_layers': 4, 'embedding_dim': 32, 'lr': 0.012808126858023893, 'lambda_val': 0.0037735592659079425, 'batch_size': 2925, 'optimizer': 'Adam'}.
2026-06-21 19:03:15,353 - experiment_functions - INFO - Early stopping at epoch 900. Best Metrics: (0.005980468923894706, 0.0014146772767462423, 0.003543107221113552)
2026-06-21 19:03:15,449 - optuna.study.study - INFO - Trial 179 finished with values: [0.005980468923894706, 0.0014146772767462423, 0.003543107221113552] and parameters: {'n_layers': 2, 'embedding_dim': 32, 'lr': 0.00264461364827089, 'lambda_val': 5.3717440572670476e-05, 'batch_size': 3442, 'optimizer': 'Adam'}.
2026-06-21 19:03:45,787 - experiment_functions - INFO - Early stopping at epoch 650. Best Metrics: (0.0039576043472522825, 0.0010704812428950362, 0.0023555106355256238)
2026-06-21 19:03:45,903 - optuna.study.study - INFO - Trial 180 finished with values: [0.0039576043472522825, 0.0010704812428950362, 0.0023555106355256238] and parameters: {'n_layers': 3, 'embedding_dim': 96, 'lr': 0.0026843825331302053, 'lambda_val': 0.0564884097251275, 'batch_size': 3888, 'optimizer': 'Adam'}.
2026-06-21 19:04:18,026 - experiment_functions - INFO - Early stopping at epoch 700. Best Metrics: (0.009399997867871357, 0.0023746368573954782, 0.0057588699047010136)
2026-06-21 19:04:18,152 - optuna.study.study - INFO - Trial 181 finished with values: [0.009399997867871357, 0.0023746368573954782, 0.0057588699047010136] and parameters: {'n_layers': 4, 'embedding_dim': 64, 'lr': 0.00168887528029852, 'lambda_val': 0.0004098288354602192, 'batch_size': 3442, 'optimizer': 'RMSprop'}.
2026-06-21 19:04:44,900 - experiment_functions - INFO - Early stopping at epoch 550. Best Metrics: (0.004136235686474756, 0.0010183781735505874, 0.0023117547559845276)
2026-06-21 19:04:45,022 - optuna.study.study - INFO - Trial 182 finished with values: [0.004136235686474756, 0.0010183781735505874, 0.0023117547559845276] and parameters: {'n_layers': 4, 'embedding_dim': 96, 'lr': 0.018991881603422755, 'lambda_val': 0.00040764482336836375, 'batch_size': 2374, 'optimizer': 'RMSprop'}.
2026-06-21 19:07:37,013 - optuna.study.study - INFO - Trial 183 finished with values: [0.0014545098467874924, 0.00035209043829733484, 0.0008498911619562993] and parameters: {'n_layers': 3, 'embedding_dim': 96, 'lr': 0.00012638057057489063, 'lambda_val': 1.1896982541974421e-05, 'batch_size': 3442, 'optimizer': 'RMSprop'}.
2026-06-21 19:09:06,615 - experiment_functions - INFO - Early stopping at epoch 2200. Best Metrics: (0.006102500469404389, 0.0014920424403183027, 0.003701445084175453)
2026-06-21 19:09:06,725 - optuna.study.study - INFO - Trial 184 finished with values: [0.006102500469404389, 0.0014920424403183027, 0.003701445084175453] and parameters: {'n_layers': 2, 'embedding_dim': 32, 'lr': 0.0015158687633618723, 'lambda_val': 7.024518890460945e-05, 'batch_size': 2792, 'optimizer': 'Adam'}.
2026-06-21 19:10:15,704 - experiment_functions - INFO - Early stopping at epoch 1700. Best Metrics: (0.009514501481380746, 0.0022814828849311614, 0.0059430180520652414)
2026-06-21 19:10:15,813 - optuna.study.study - INFO - Trial 185 finished with values: [0.009514501481380746, 0.0022814828849311614, 0.0059430180520652414] and parameters: {'n_layers': 2, 'embedding_dim': 32, 'lr': 0.0024374436987616007, 'lambda_val': 6.131403610536352e-05, 'batch_size': 767, 'optimizer': 'RMSprop'}.
2026-06-21 19:10:55,730 - experiment_functions - INFO - Early stopping at epoch 950. Best Metrics: (0.005874701268877325, 0.0014194139194139196, 0.003513282006508508)
2026-06-21 19:10:55,841 - optuna.study.study - INFO - Trial 186 finished with values: [0.005874701268877325, 0.0014194139194139196, 0.003513282006508508] and parameters: {'n_layers': 2, 'embedding_dim': 32, 'lr': 0.002851991233439863, 'lambda_val': 1.544427077132802e-06, 'batch_size': 3261, 'optimizer': 'Adam'}.
2026-06-21 19:11:37,133 - experiment_functions - INFO - Early stopping at epoch 800. Best Metrics: (0.0042577362599501905, 0.0011020588606795504, 0.0025081594461368634)
2026-06-21 19:11:37,238 - optuna.study.study - INFO - Trial 187 finished with values: [0.0042577362599501905, 0.0011020588606795504, 0.0025081594461368634] and parameters: {'n_layers': 2, 'embedding_dim': 256, 'lr': 0.0020467235260162057, 'lambda_val': 0.015147798513906546, 'batch_size': 3850, 'optimizer': 'Adam'}.
2026-06-21 19:12:07,890 - experiment_functions - INFO - Early stopping at epoch 700. Best Metrics: (0.009057889930528515, 0.0021867500315776184, 0.005625360554368831)
