2026-06-17 15:25:44,490 - optuna.study.study - INFO - Trial 243 finished with values: [0.0016268105204465513, 0.00041682455475558933, 0.0010813570993874414] and parameters: {'n_layers': 2, 'embedding_dim': 128, 'lr': 0.07036665090799826, 'lambda_val': 1.170012968533328e-05, 'batch_size': 2603, 'optimizer': 'RMSprop'}.
2026-06-17 15:28:00,997 - experiment_functions - INFO - Early stopping at epoch 3300. Best Metrics: (0.0036842670507791697, 0.0008573323228495642, 0.0023320371881598067)
2026-06-17 15:28:01,087 - optuna.study.study - INFO - Trial 244 finished with values: [0.0036842670507791697, 0.0008573323228495642, 0.0023320371881598067] and parameters: {'n_layers': 2, 'embedding_dim': 96, 'lr': 0.0005841453281578621, 'lambda_val': 1.0310836199436669e-05, 'batch_size': 1677, 'optimizer': 'RMSprop'}.
2026-06-17 15:28:28,601 - experiment_functions - INFO - Early stopping at epoch 550. Best Metrics: (0.0029542925779897406, 0.0007420740179360869, 0.0019155796803972307)
2026-06-17 15:28:28,690 - optuna.study.study - INFO - Trial 245 finished with values: [0.0029542925779897406, 0.0007420740179360869, 0.0019155796803972307] and parameters: {'n_layers': 4, 'embedding_dim': 128, 'lr': 0.007557935735478784, 'lambda_val': 1.170012968533328e-05, 'batch_size': 3853, 'optimizer': 'Adam'}.
2026-06-17 15:29:29,690 - experiment_functions - INFO - Early stopping at epoch 1350. Best Metrics: (0.003465664708438785, 0.0008399646330680813, 0.0020953050986114107)
2026-06-17 15:29:30,162 - optuna.study.study - INFO - Trial 246 finished with values: [0.003465664708438785, 0.0008399646330680813, 0.0020953050986114107] and parameters: {'n_layers': 3, 'embedding_dim': 128, 'lr': 0.0008946860620636538, 'lambda_val': 0.0012369131591814012, 'batch_size': 2080, 'optimizer': 'Adam'}.
2026-06-17 15:32:33,904 - optuna.study.study - INFO - Trial 247 finished with values: [0.003426191130663744, 0.0009062776304155616, 0.002189323414374923] and parameters: {'n_layers': 4, 'embedding_dim': 128, 'lr': 0.0005841453281578621, 'lambda_val': 1.0310836199436669e-05, 'batch_size': 934, 'optimizer': 'Adam'}.
2026-06-17 15:33:55,031 - experiment_functions - INFO - Early stopping at epoch 1750. Best Metrics: (0.003179586710842095, 0.0008068081343943414, 0.0019885027540654954)
2026-06-17 15:33:55,132 - optuna.study.study - INFO - Trial 248 finished with values: [0.003179586710842095, 0.0008068081343943414, 0.0019885027540654954] and parameters: {'n_layers': 4, 'embedding_dim': 128, 'lr': 0.0005773267382294165, 'lambda_val': 0.00027668479073292746, 'batch_size': 3672, 'optimizer': 'Adam'}.
2026-06-17 15:36:14,228 - experiment_functions - INFO - Early stopping at epoch 2750. Best Metrics: (0.003617590797949581, 0.0008715422508525956, 0.002153225909229127)
2026-06-17 15:36:14,326 - optuna.study.study - INFO - Trial 249 finished with values: [0.003617590797949581, 0.0008715422508525956, 0.002153225909229127] and parameters: {'n_layers': 3, 'embedding_dim': 256, 'lr': 0.0008946860620636538, 'lambda_val': 0.00027668479073292746, 'batch_size': 815, 'optimizer': 'Adam'}.
2026-06-17 15:39:01,117 - optuna.study.study - INFO - Trial 250 finished with values: [0.0032682654164658286, 0.0008162814197296956, 0.0021070142959515575] and parameters: {'n_layers': 4, 'embedding_dim': 64, 'lr': 0.0003829793629700562, 'lambda_val': 1.170012968533328e-05, 'batch_size': 3100, 'optimizer': 'RMSprop'}.
2026-06-17 15:41:05,750 - experiment_functions - INFO - Early stopping at epoch 2350. Best Metrics: (0.003761832292273823, 0.0009457496526462045, 0.002270260362669277)
2026-06-17 15:41:05,940 - optuna.study.study - INFO - Trial 251 finished with values: [0.003761832292273823, 0.0009457496526462045, 0.002270260362669277] and parameters: {'n_layers': 4, 'embedding_dim': 256, 'lr': 0.0005841453281578621, 'lambda_val': 1.0310836199436669e-05, 'batch_size': 2288, 'optimizer': 'RMSprop'}.
2026-06-17 15:42:36,690 - experiment_functions - INFO - Early stopping at epoch 2150. Best Metrics: (0.0037418133504360787, 0.0009299608437539473, 0.0023366518113877924)
2026-06-17 15:42:36,838 - optuna.study.study - INFO - Trial 252 finished with values: [0.0037418133504360787, 0.0009299608437539473, 0.0023366518113877924] and parameters: {'n_layers': 4, 'embedding_dim': 64, 'lr': 0.0013364645200376287, 'lambda_val': 1.170012968533328e-05, 'batch_size': 815, 'optimizer': 'Adam'}.
2026-06-17 15:43:05,515 - experiment_functions - INFO - Early stopping at epoch 500. Best Metrics: (0.0018101251362085107, 0.0005036630036630036, 0.001292209841035173)
2026-06-17 15:43:05,615 - optuna.study.study - INFO - Trial 253 finished with values: [0.0018101251362085107, 0.0005036630036630036, 0.001292209841035173] and parameters: {'n_layers': 4, 'embedding_dim': 256, 'lr': 0.08972939759068102, 'lambda_val': 1.0239148319725045e-05, 'batch_size': 3853, 'optimizer': 'RMSprop'}.
2026-06-17 15:44:59,910 - experiment_functions - INFO - Early stopping at epoch 2500. Best Metrics: (0.0034659600246102493, 0.0009078565113047872, 0.0021360190421297024)
2026-06-17 15:45:00,703 - optuna.study.study - INFO - Trial 254 finished with values: [0.0034659600246102493, 0.0009078565113047872, 0.0021360190421297024] and parameters: {'n_layers': 4, 'embedding_dim': 128, 'lr': 0.0005773267382294165, 'lambda_val': 1.0310836199436669e-05, 'batch_size': 3100, 'optimizer': 'RMSprop'}.
2026-06-17 15:46:11,320 - experiment_functions - INFO - Early stopping at epoch 1300. Best Metrics: (0.003562842949349326, 0.0009094353921940129, 0.0022103418699019237)
2026-06-17 15:46:11,424 - optuna.study.study - INFO - Trial 255 finished with values: [0.003562842949349326, 0.0009094353921940129, 0.0022103418699019237] and parameters: {'n_layers': 4, 'embedding_dim': 256, 'lr': 0.0014337059824812508, 'lambda_val': 1.6217164995596051e-06, 'batch_size': 1467, 'optimizer': 'Adam'}.
2026-06-17 15:46:38,939 - experiment_functions - INFO - Early stopping at epoch 550. Best Metrics: (0.002588115057060426, 0.0006852343059239611, 0.0017246996626227493)
2026-06-17 15:46:39,041 - optuna.study.study - INFO - Trial 256 finished with values: [0.002588115057060426, 0.0006852343059239611, 0.0017246996626227493] and parameters: {'n_layers': 4, 'embedding_dim': 128, 'lr': 0.07154239709203877, 'lambda_val': 3.49009012002267e-06, 'batch_size': 3100, 'optimizer': 'Adam'}.
2026-06-17 15:48:07,630 - experiment_functions - INFO - Early stopping at epoch 1650. Best Metrics: (0.0028958449137147287, 0.0007752305166098271, 0.0018161601658017717)
2026-06-17 15:48:07,748 - optuna.study.study - INFO - Trial 257 finished with values: [0.0028958449137147287, 0.0007752305166098271, 0.0018161601658017717] and parameters: {'n_layers': 4, 'embedding_dim': 256, 'lr': 0.0005841453281578621, 'lambda_val': 0.0006866561700848996, 'batch_size': 1982, 'optimizer': 'Adam'}.
2026-06-17 15:50:28,554 - experiment_functions - INFO - Early stopping at epoch 2650. Best Metrics: (0.003324802449104815, 0.0008794366552987244, 0.0020604712155334985)
2026-06-17 15:50:28,656 - optuna.study.study - INFO - Trial 258 finished with values: [0.003324802449104815, 0.0008794366552987244, 0.0020604712155334985] and parameters: {'n_layers': 4, 'embedding_dim': 256, 'lr': 0.0005841453281578621, 'lambda_val': 3.399802510238604e-06, 'batch_size': 1507, 'optimizer': 'Adam'}.
2026-06-17 15:50:50,336 - experiment_functions - INFO - Early stopping at epoch 500. Best Metrics: (0.0005334557708318889, 0.0001042061386888973, 0.00027591454352015053)
2026-06-17 15:50:50,439 - optuna.study.study - INFO - Trial 259 finished with values: [0.0005334557708318889, 0.0001042061386888973, 0.00027591454352015053] and parameters: {'n_layers': 1, 'embedding_dim': 32, 'lr': 0.0005841453281578621, 'lambda_val': 0.06279004161529053, 'batch_size': 2415, 'optimizer': 'SGD'}.
2026-06-17 15:52:55,693 - experiment_functions - INFO - Early stopping at epoch 2750. Best Metrics: (0.0037660290244514285, 0.0009252242010862699, 0.002315847687124435)
2026-06-17 15:52:56,199 - optuna.study.study - INFO - Trial 260 finished with values: [0.0037660290244514285, 0.0009252242010862699, 0.002315847687124435] and parameters: {'n_layers': 4, 'embedding_dim': 128, 'lr': 0.0005841453281578621, 'lambda_val': 1.0310836199436669e-05, 'batch_size': 2807, 'optimizer': 'RMSprop'}.
2026-06-17 15:54:45,720 - experiment_functions - INFO - Early stopping at epoch 2750. Best Metrics: (0.0038167676077491062, 0.0008273335859542757, 0.0023542078775225144)
2026-06-17 15:54:45,858 - optuna.study.study - INFO - Trial 261 finished with values: [0.0038167676077491062, 0.0008273335859542757, 0.0023542078775225144] and parameters: {'n_layers': 3, 'embedding_dim': 32, 'lr': 0.0005841453281578621, 'lambda_val': 1.9289997599017184e-06, 'batch_size': 1507, 'optimizer': 'RMSprop'}.
2026-06-17 15:55:38,222 - experiment_functions - INFO - Early stopping at epoch 1150. Best Metrics: (0.003671612066666271, 0.0008952254641909814, 0.002262291318856859)
2026-06-17 15:55:38,329 - optuna.study.study - INFO - Trial 262 finished with values: [0.003671612066666271, 0.0008952254641909814, 0.002262291318856859] and parameters: {'n_layers': 3, 'embedding_dim': 128, 'lr': 0.0017238025221562986, 'lambda_val': 0.00027668479073292746, 'batch_size': 815, 'optimizer': 'Adam'}.
2026-06-17 15:56:32,416 - experiment_functions - INFO - Early stopping at epoch 1050. Best Metrics: (0.0033219975294989526, 0.0008573323228495643, 0.002040826358082076)
2026-06-17 15:56:33,223 - optuna.study.study - INFO - Trial 263 finished with values: [0.0033219975294989526, 0.0008573323228495643, 0.002040826358082076] and parameters: {'n_layers': 3, 'embedding_dim': 256, 'lr': 0.0008946860620636538, 'lambda_val': 0.00027668479073292746, 'batch_size': 2022, 'optimizer': 'RMSprop'}.
2026-06-17 15:56:59,824 - experiment_functions - INFO - Early stopping at epoch 500. Best Metrics: (0.0005544212303916166, 0.00010894278135657447, 0.00031696732424075325)
2026-06-17 15:57:00,680 - optuna.study.study - INFO - Trial 264 finished with values: [0.0005544212303916166, 0.00010894278135657447, 0.00031696732424075325] and parameters: {'n_layers': 3, 'embedding_dim': 256, 'lr': 0.0005841453281578621, 'lambda_val': 0.0003897707943249484, 'batch_size': 1507, 'optimizer': 'SGD'}.
2026-06-17 15:58:53,901 - experiment_functions - INFO - Early stopping at epoch 2700. Best Metrics: (0.0035457689066834977, 0.0008952254641909815, 0.0022869566891924467)
2026-06-17 15:58:54,000 - optuna.study.study - INFO - Trial 265 finished with values: [0.0035457689066834977, 0.0008952254641909815, 0.0022869566891924467] and parameters: {'n_layers': 4, 'embedding_dim': 64, 'lr': 0.0009353759827353638, 'lambda_val': 1.0310836199436669e-05, 'batch_size': 934, 'optimizer': 'Adam'}.
2026-06-17 16:00:33,695 - experiment_functions - INFO - Early stopping at epoch 2150. Best Metrics: (0.003110273071435264, 0.0008099658961727928, 0.0019308046520070507)
2026-06-17 16:00:33,815 - optuna.study.study - INFO - Trial 266 finished with values: [0.003110273071435264, 0.0008099658961727928, 0.0019308046520070507] and parameters: {'n_layers': 4, 'embedding_dim': 128, 'lr': 0.0005841453281578621, 'lambda_val': 1.9289997599017184e-06, 'batch_size': 3137, 'optimizer': 'Adam'}.
2026-06-17 16:02:58,004 - experiment_functions - INFO - Early stopping at epoch 3300. Best Metrics: (0.004363821511608241, 0.0010278514588859418, 0.002758107829998114)
2026-06-17 16:02:58,102 - optuna.study.study - INFO - Trial 267 finished with values: [0.004363821511608241, 0.0010278514588859418, 0.002758107829998114] and parameters: {'n_layers': 4, 'embedding_dim': 96, 'lr': 0.0005841453281578621, 'lambda_val': 1.6217164995596051e-06, 'batch_size': 815, 'optimizer': 'RMSprop'}.
2026-06-17 16:05:01,272 - experiment_functions - INFO - Early stopping at epoch 2950. Best Metrics: (0.003962108027139656, 0.0009378552482000759, 0.0025236266859154114)
2026-06-17 16:05:01,369 - optuna.study.study - INFO - Trial 268 finished with values: [0.003962108027139656, 0.0009378552482000759, 0.0025236266859154114] and parameters: {'n_layers': 4, 'embedding_dim': 64, 'lr': 0.0005841453281578621, 'lambda_val': 1.170012968533328e-05, 'batch_size': 1975, 'optimizer': 'RMSprop'}.
2026-06-17 16:06:04,439 - experiment_functions - INFO - Early stopping at epoch 1400. Best Metrics: (0.003268330224215171, 0.0007973348490589872, 0.002027768782925238)
2026-06-17 16:06:04,542 - optuna.study.study - INFO - Trial 269 finished with values: [0.003268330224215171, 0.0007973348490589872, 0.002027768782925238] and parameters: {'n_layers': 3, 'embedding_dim': 128, 'lr': 0.0005841453281578621, 'lambda_val': 1.170012968533328e-05, 'batch_size': 3853, 'optimizer': 'RMSprop'}.
2026-06-17 16:08:18,303 - experiment_functions - INFO - Early stopping at epoch 2550. Best Metrics: (0.0038090285551701094, 0.0009646962233169132, 0.002356037564813146)
2026-06-17 16:08:18,408 - optuna.study.study - INFO - Trial 270 finished with values: [0.0038090285551701094, 0.0009646962233169132, 0.002356037564813146] and parameters: {'n_layers': 4, 'embedding_dim': 256, 'lr': 0.0005841453281578621, 'lambda_val': 1.0239148319725045e-05, 'batch_size': 1507, 'optimizer': 'RMSprop'}.
2026-06-17 16:11:48,609 - optuna.study.study - INFO - Trial 271 finished with values: [0.003041888071492855, 0.0007483895414929899, 0.0019189783607117226] and parameters: {'n_layers': 4, 'embedding_dim': 256, 'lr': 0.0002360464535423922, 'lambda_val': 1.4998533893648508e-06, 'batch_size': 2778, 'optimizer': 'Adam'}.
2026-06-17 16:12:15,686 - experiment_functions - INFO - Early stopping at epoch 550. Best Metrics: (0.003107684950006026, 0.0008383857521788557, 0.00200434393688361)
2026-06-17 16:12:15,793 - optuna.study.study - INFO - Trial 272 finished with values: [0.003107684950006026, 0.0008383857521788557, 0.00200434393688361] and parameters: {'n_layers': 4, 'embedding_dim': 128, 'lr': 0.008364681699690686, 'lambda_val': 1.0310836199436669e-05, 'batch_size': 1467, 'optimizer': 'RMSprop'}.
2026-06-17 16:13:05,754 - experiment_functions - INFO - Early stopping at epoch 1050. Best Metrics: (0.004245489035407348, 0.001092585575344196, 0.0027586341599329612)
2026-06-17 16:13:05,852 - optuna.study.study - INFO - Trial 273 finished with values: [0.004245489035407348, 0.001092585575344196, 0.0027586341599329612] and parameters: {'n_layers': 4, 'embedding_dim': 128, 'lr': 0.0014337059824812508, 'lambda_val': 9.050147705306549e-05, 'batch_size': 548, 'optimizer': 'RMSprop'}.
2026-06-17 16:14:29,613 - experiment_functions - INFO - Early stopping at epoch 1950. Best Metrics: (0.002550734044292553, 0.0006047113805734495, 0.0015679158774743417)
2026-06-17 16:14:29,712 - optuna.study.study - INFO - Trial 274 finished with values: [0.002550734044292553, 0.0006047113805734495, 0.0015679158774743417] and parameters: {'n_layers': 1, 'embedding_dim': 128, 'lr': 0.0005841453281578621, 'lambda_val': 0.0013091287409923314, 'batch_size': 3100, 'optimizer': 'RMSprop'}.
2026-06-17 16:16:18,989 - experiment_functions - INFO - Early stopping at epoch 2550. Best Metrics: (0.0029326897365789363, 0.0007168119237084755, 0.001856590899405782)
2026-06-17 16:16:19,097 - optuna.study.study - INFO - Trial 275 finished with values: [0.0029326897365789363, 0.0007168119237084755, 0.001856590899405782] and parameters: {'n_layers': 2, 'embedding_dim': 128, 'lr': 0.0009353759827353638, 'lambda_val': 0.00027668479073292746, 'batch_size': 3100, 'optimizer': 'Adam'}.
2026-06-17 16:16:43,830 - experiment_functions - INFO - Early stopping at epoch 500. Best Metrics: (0.00048228726232461247, 0.00011210054313502591, 0.0002468083910182483)
2026-06-17 16:16:43,937 - optuna.study.study - INFO - Trial 276 finished with values: [0.00048228726232461247, 0.00011210054313502591, 0.0002468083910182483] and parameters: {'n_layers': 4, 'embedding_dim': 128, 'lr': 0.0005841453281578621, 'lambda_val': 1.0310836199436669e-05, 'batch_size': 3853, 'optimizer': 'SGD'}.
2026-06-17 16:19:38,638 - optuna.study.study - INFO - Trial 277 finished with values: [0.0033387484455512555, 0.0008289124668435014, 0.0022148091754139] and parameters: {'n_layers': 4, 'embedding_dim': 96, 'lr': 0.00048437037695095615, 'lambda_val': 0.00027668479073292746, 'batch_size': 934, 'optimizer': 'Adam'}.
2026-06-17 16:21:48,374 - experiment_functions - INFO - Early stopping at epoch 3150. Best Metrics: (0.002022077909072963, 0.0005526083112290009, 0.001317812422139225)
2026-06-17 16:21:48,477 - optuna.study.study - INFO - Trial 278 finished with values: [0.002022077909072963, 0.0005526083112290009, 0.001317812422139225] and parameters: {'n_layers': 2, 'embedding_dim': 96, 'lr': 0.00045127090579537114, 'lambda_val': 0.03771642923703431, 'batch_size': 1867, 'optimizer': 'RMSprop'}.
2026-06-17 16:25:20,010 - optuna.study.study - INFO - Trial 279 finished with values: [0.0034559673824689587, 0.00089206770241253, 0.0021760923754042608] and parameters: {'n_layers': 4, 'embedding_dim': 256, 'lr': 0.0005086943405728801, 'lambda_val': 0.00012072062045747035, 'batch_size': 1147, 'optimizer': 'Adam'}.
2026-06-17 16:27:29,922 - experiment_functions - INFO - Early stopping at epoch 2450. Best Metrics: (0.00329480534499728, 0.0008447012757357584, 0.0020239657433537162)
2026-06-17 16:27:30,025 - optuna.study.study - INFO - Trial 280 finished with values: [0.00329480534499728, 0.0008447012757357584, 0.0020239657433537162] and parameters: {'n_layers': 4, 'embedding_dim': 256, 'lr': 0.0005841453281578621, 'lambda_val': 1.9289997599017184e-06, 'batch_size': 2288, 'optimizer': 'Adam'}.
2026-06-17 16:29:45,521 - experiment_functions - INFO - Early stopping at epoch 3450. Best Metrics: (0.003202183570113495, 0.0007294429708222812, 0.0020227650565262404)
2026-06-17 16:29:45,632 - optuna.study.study - INFO - Trial 281 finished with values: [0.003202183570113495, 0.0007294429708222812, 0.0020227650565262404] and parameters: {'n_layers': 4, 'embedding_dim': 32, 'lr': 0.0005086943405728801, 'lambda_val': 0.00027668479073292746, 'batch_size': 1793, 'optimizer': 'Adam'}.
2026-06-17 16:31:13,753 - experiment_functions - INFO - Early stopping at epoch 1650. Best Metrics: (0.003457075428939898, 0.0009062776304155616, 0.0021190732131146483)
2026-06-17 16:31:13,857 - optuna.study.study - INFO - Trial 282 finished with values: [0.003457075428939898, 0.0009062776304155616, 0.0021190732131146483] and parameters: {'n_layers': 4, 'embedding_dim': 256, 'lr': 0.0005841453281578621, 'lambda_val': 0.00027668479073292746, 'batch_size': 1556, 'optimizer': 'RMSprop'}.
2026-06-17 16:32:47,253 - experiment_functions - INFO - Early stopping at epoch 1750. Best Metrics: (0.0036725792084469117, 0.0009441707717569787, 0.002404849289149438)
2026-06-17 16:32:47,359 - optuna.study.study - INFO - Trial 283 finished with values: [0.0036725792084469117, 0.0009441707717569787, 0.002404849289149438] and parameters: {'n_layers': 4, 'embedding_dim': 256, 'lr': 0.0007511154553369348, 'lambda_val': 0.00027668479073292746, 'batch_size': 815, 'optimizer': 'RMSprop'}.
2026-06-17 16:33:10,902 - experiment_functions - INFO - Early stopping at epoch 500. Best Metrics: (0.00046987345136326533, 0.00010894278135657447, 0.0002574218265316569)
2026-06-17 16:33:11,047 - optuna.study.study - INFO - Trial 284 finished with values: [0.00046987345136326533, 0.00010894278135657447, 0.0002574218265316569] and parameters: {'n_layers': 4, 'embedding_dim': 96, 'lr': 0.0005841453281578621, 'lambda_val': 0.00012072062045747035, 'batch_size': 893, 'optimizer': 'SGD'}.
2026-06-17 16:35:04,855 - experiment_functions - INFO - Early stopping at epoch 2850. Best Metrics: (0.0032476775180595788, 0.0007247063281546041, 0.0019670266592204896)
2026-06-17 16:35:04,954 - optuna.study.study - INFO - Trial 285 finished with values: [0.0032476775180595788, 0.0007247063281546041, 0.0019670266592204896] and parameters: {'n_layers': 1, 'embedding_dim': 96, 'lr': 0.0005841453281578621, 'lambda_val': 1.0310836199436669e-05, 'batch_size': 2034, 'optimizer': 'RMSprop'}.
2026-06-17 16:37:53,703 - optuna.study.study - INFO - Trial 286 finished with values: [0.003203066875651916, 0.0007215485663761526, 0.001962118485635472] and parameters: {'n_layers': 2, 'embedding_dim': 128, 'lr': 0.0005841453281578621, 'lambda_val': 1.0310836199436669e-05, 'batch_size': 1467, 'optimizer': 'Adam'}.
2026-06-17 16:39:54,397 - experiment_functions - INFO - Early stopping at epoch 2650. Best Metrics: (0.003730944087350528, 0.00093627636731085, 0.002269733134784727)
2026-06-17 16:39:54,542 - optuna.study.study - INFO - Trial 287 finished with values: [0.003730944087350528, 0.00093627636731085, 0.002269733134784727] and parameters: {'n_layers': 4, 'embedding_dim': 128, 'lr': 0.0005841453281578621, 'lambda_val': 1.170012968533328e-05, 'batch_size': 3853, 'optimizer': 'RMSprop'}.
2026-06-17 16:40:56,353 - experiment_functions - INFO - Early stopping at epoch 1450. Best Metrics: (0.003362121329811899, 0.0007941770872805355, 0.00215637980161292)
2026-06-17 16:40:56,454 - optuna.study.study - INFO - Trial 288 finished with values: [0.003362121329811899, 0.0007941770872805355, 0.00215637980161292] and parameters: {'n_layers': 4, 'embedding_dim': 64, 'lr': 0.0005841453281578621, 'lambda_val': 0.007878443217277245, 'batch_size': 934, 'optimizer': 'RMSprop'}.
2026-06-17 16:42:33,281 - experiment_functions - INFO - Early stopping at epoch 2400. Best Metrics: (0.003179864031293141, 0.0006852343059239611, 0.0019849314585805274)
2026-06-17 16:42:33,379 - optuna.study.study - INFO - Trial 289 finished with values: [0.003179864031293141, 0.0006852343059239611, 0.0019849314585805274] and parameters: {'n_layers': 1, 'embedding_dim': 96, 'lr': 0.0005841453281578621, 'lambda_val': 1.170012968533328e-05, 'batch_size': 3853, 'optimizer': 'RMSprop'}.
2026-06-17 16:42:57,172 - experiment_functions - INFO - Early stopping at epoch 500. Best Metrics: (0.000394194723606128, 0.00010736390046734874, 0.00022515093045207931)
