2026-06-18 16:48:15,372 - optuna.study.study - INFO - Trial 299 finished with values: [0.003126280726447793, 0.0007910193255020842, 0.0020218059726036367] and parameters: {'n_layers': 4, 'embedding_dim': 64, 'lr': 0.0016391721585660463, 'lambda_val': 6.474581689651504e-05, 'batch_size': 2549, 'optimizer': 'RMSprop'}.
2026-06-18 16:48:15,388 - root - INFO - Selected Trial 207 based on Max ndcg: 0.0029
2026-06-18 16:48:15,388 - root - INFO - Associated Recall: 0.0045
2026-06-18 16:48:15,388 - experiment_functions - INFO - Training the best model ... for e_yelp_1c1dcs_strict_rand5
2026-06-18 16:49:28,052 - experiment_functions - INFO - Early stopping at epoch 1800. Best Metrics: (0.003792140178005907, 0.0009473285335354301, 0.002545027225952497)
2026-06-18 16:49:31,722 - root - INFO -   ** Getting the trainable edges:
2026-06-18 16:49:31,761 - helper_functions - INFO -      Number of nodes: 2879
2026-06-18 16:49:31,761 - helper_functions - INFO -      Ratio: 0.04129611566928682
2026-06-18 16:49:31,761 - helper_functions - INFO -      Number of unique users: 1839
2026-06-18 16:49:31,761 - helper_functions - INFO -      Number of unique items: 1040
2026-06-18 16:49:31,761 - helper_functions - INFO -      Total dominant set edge: 519933
2026-06-18 16:49:31,761 - helper_functions - INFO -      Trainable edges: 415946.4
2026-06-18 16:49:31,881 - root - INFO -   **** Getting 519933 dominant set edges
2026-06-18 16:49:32,039 - optuna.storages._rdb.storage - INFO - A new study created in RDB with name: Study_e_yelp_1c1dcs
2026-06-18 16:52:14,445 - experiment_functions - INFO - Early stopping at epoch 3750. Best Metrics: (0.03374682853099556, 0.007278640899330556, 0.019792711965451338)
2026-06-18 16:52:14,551 - optuna.study.study - INFO - Trial 0 finished with values: [0.03374682853099556, 0.007278640899330556, 0.019792711965451338] and parameters: {'n_layers': 1, 'embedding_dim': 96, 'lr': 0.0007183006551542105, 'lambda_val': 0.00015514348570178205, 'batch_size': 991, 'optimizer': 'Adam'}.
2026-06-18 16:52:43,764 - experiment_functions - INFO - Early stopping at epoch 550. Best Metrics: (0.010112803136774104, 0.0020983327017809776, 0.005903916775446548)
2026-06-18 16:52:44,202 - optuna.study.study - INFO - Trial 1 finished with values: [0.010112803136774104, 0.0020983327017809776, 0.005903916775446548] and parameters: {'n_layers': 3, 'embedding_dim': 128, 'lr': 0.022552700000257754, 'lambda_val': 6.780133728833238e-06, 'batch_size': 3338, 'optimizer': 'RMSprop'}.
2026-06-18 16:53:12,704 - experiment_functions - INFO - Early stopping at epoch 550. Best Metrics: (0.0058746008346869565, 0.0014352027283061767, 0.0035403420416890916)
2026-06-18 16:53:12,814 - optuna.study.study - INFO - Trial 2 finished with values: [0.0058746008346869565, 0.0014352027283061767, 0.0035403420416890916] and parameters: {'n_layers': 1, 'embedding_dim': 256, 'lr': 0.020171082222098465, 'lambda_val': 4.4220733903903124e-05, 'batch_size': 1415, 'optimizer': 'RMSprop'}.
2026-06-18 16:53:36,008 - experiment_functions - INFO - Early stopping at epoch 500. Best Metrics: (0.0005447846649855092, 0.00012315270935960593, 0.00027560230844481717)
2026-06-18 16:53:36,141 - optuna.study.study - INFO - Trial 3 finished with values: [0.0005447846649855092, 0.00012315270935960593, 0.00027560230844481717] and parameters: {'n_layers': 4, 'embedding_dim': 32, 'lr': 9.641129638450865e-05, 'lambda_val': 0.015557889558616018, 'batch_size': 977, 'optimizer': 'Adam'}.
2026-06-18 16:56:26,823 - optuna.study.study - INFO - Trial 4 finished with values: [0.023730374536245925, 0.005240305671340154, 0.013629848846125977] and parameters: {'n_layers': 3, 'embedding_dim': 32, 'lr': 0.00022471387800597823, 'lambda_val': 1.1727812158033635e-06, 'batch_size': 3512, 'optimizer': 'RMSprop'}.
2026-06-18 16:56:56,139 - experiment_functions - INFO - Early stopping at epoch 550. Best Metrics: (0.012931583507729274, 0.002579891372994821, 0.006836441786021234)
2026-06-18 16:56:56,253 - optuna.study.study - INFO - Trial 5 finished with values: [0.012931583507729274, 0.002579891372994821, 0.006836441786021234] and parameters: {'n_layers': 3, 'embedding_dim': 128, 'lr': 0.016187821105918127, 'lambda_val': 0.001270364796526946, 'batch_size': 3335, 'optimizer': 'Adam'}.
2026-06-18 17:00:06,091 - optuna.study.study - INFO - Trial 6 finished with values: [0.0014075582945024016, 0.0003394593911835291, 0.0008252785053028444] and parameters: {'n_layers': 4, 'embedding_dim': 96, 'lr': 3.337881314216229e-05, 'lambda_val': 1.2639499678684216e-05, 'batch_size': 3082, 'optimizer': 'RMSprop'}.
2026-06-18 17:00:32,248 - experiment_functions - INFO - Early stopping at epoch 500. Best Metrics: (0.00045828514820952035, 0.00010262725779967159, 0.00024704186646619413)
2026-06-18 17:00:32,348 - optuna.study.study - INFO - Trial 7 finished with values: [0.00045828514820952035, 0.00010262725779967159, 0.00024704186646619413] and parameters: {'n_layers': 3, 'embedding_dim': 128, 'lr': 0.0513311568909891, 'lambda_val': 0.04920148807151191, 'batch_size': 2794, 'optimizer': 'SGD'}.
2026-06-18 17:00:54,745 - experiment_functions - INFO - Early stopping at epoch 500. Best Metrics: (0.00038681236755250557, 9.473285335354301e-05, 0.00022448494050505036)
2026-06-18 17:00:54,851 - optuna.study.study - INFO - Trial 8 finished with values: [0.00038681236755250557, 9.473285335354301e-05, 0.00022448494050505036] and parameters: {'n_layers': 2, 'embedding_dim': 32, 'lr': 0.01280471264191173, 'lambda_val': 0.0006602480726382988, 'batch_size': 808, 'optimizer': 'SGD'}.
2026-06-18 17:01:20,272 - experiment_functions - INFO - Early stopping at epoch 550. Best Metrics: (0.0006065697542832318, 0.0001405203991410888, 0.00031280691678361)
2026-06-18 17:01:20,378 - optuna.study.study - INFO - Trial 9 finished with values: [0.0006065697542832318, 0.0001405203991410888, 0.00031280691678361] and parameters: {'n_layers': 4, 'embedding_dim': 32, 'lr': 1.2750631294152688e-05, 'lambda_val': 3.4880590542162234e-06, 'batch_size': 756, 'optimizer': 'Adam'}.
2026-06-18 17:01:43,371 - experiment_functions - INFO - Early stopping at epoch 500. Best Metrics: (0.0006289043688245458, 0.00011367942402425163, 0.00030737873944231247)
2026-06-18 17:01:43,472 - optuna.study.study - INFO - Trial 10 finished with values: [0.0006289043688245458, 0.00011367942402425163, 0.00030737873944231247] and parameters: {'n_layers': 4, 'embedding_dim': 32, 'lr': 4.41669711863268e-05, 'lambda_val': 0.0185135195730247, 'batch_size': 1823, 'optimizer': 'RMSprop'}.
2026-06-18 17:04:45,870 - experiment_functions - INFO - Early stopping at epoch 2800. Best Metrics: (0.006904361376805725, 0.001555197675887331, 0.003924612289864223)
2026-06-18 17:04:45,979 - optuna.study.study - INFO - Trial 11 finished with values: [0.006904361376805725, 0.001555197675887331, 0.003924612289864223] and parameters: {'n_layers': 4, 'embedding_dim': 256, 'lr': 0.04270722550366511, 'lambda_val': 0.0028755286014556106, 'batch_size': 4012, 'optimizer': 'Adam'}.
2026-06-18 17:05:28,497 - experiment_functions - INFO - Early stopping at epoch 850. Best Metrics: (0.0005345157589402288, 0.00011841606669192877, 0.00028580705003223905)
2026-06-18 17:05:28,601 - optuna.study.study - INFO - Trial 12 finished with values: [0.0005345157589402288, 0.00011841606669192877, 0.00028580705003223905] and parameters: {'n_layers': 1, 'embedding_dim': 256, 'lr': 1.538180749165841e-05, 'lambda_val': 2.587783649774558e-06, 'batch_size': 2487, 'optimizer': 'Adam'}.
2026-06-18 17:05:54,727 - experiment_functions - INFO - Early stopping at epoch 500. Best Metrics: (0.0005270981240209838, 0.00012788935202728306, 0.0003025649326373024)
2026-06-18 17:05:54,830 - optuna.study.study - INFO - Trial 13 finished with values: [0.0005270981240209838, 0.00012788935202728306, 0.0003025649326373024] and parameters: {'n_layers': 3, 'embedding_dim': 128, 'lr': 0.013899697009761083, 'lambda_val': 0.00023601831244749667, 'batch_size': 2953, 'optimizer': 'SGD'}.
2026-06-18 17:08:51,997 - optuna.study.study - INFO - Trial 14 finished with values: [0.012587814257469385, 0.0029146141215106738, 0.007081537374797435] and parameters: {'n_layers': 2, 'embedding_dim': 96, 'lr': 0.07391712371968896, 'lambda_val': 0.0037406360162648877, 'batch_size': 3995, 'optimizer': 'RMSprop'}.
2026-06-18 17:09:18,812 - experiment_functions - INFO - Early stopping at epoch 550. Best Metrics: (0.012698079204841915, 0.002693570797019073, 0.00690699963294504)
2026-06-18 17:09:18,918 - optuna.study.study - INFO - Trial 15 finished with values: [0.012698079204841915, 0.002693570797019073, 0.00690699963294504] and parameters: {'n_layers': 2, 'embedding_dim': 96, 'lr': 0.004952675271626227, 'lambda_val': 0.0005943254859344516, 'batch_size': 694, 'optimizer': 'Adam'}.
2026-06-18 17:09:41,853 - experiment_functions - INFO - Early stopping at epoch 500. Best Metrics: (0.0006373394038907925, 0.0001215738284703802, 0.0003023513129980349)
2026-06-18 17:09:41,962 - optuna.study.study - INFO - Trial 16 finished with values: [0.0006373394038907925, 0.0001215738284703802, 0.0003023513129980349] and parameters: {'n_layers': 4, 'embedding_dim': 32, 'lr': 0.015193525619150647, 'lambda_val': 0.03135531657672052, 'batch_size': 2546, 'optimizer': 'SGD'}.
2026-06-18 17:10:11,138 - experiment_functions - INFO - Early stopping at epoch 600. Best Metrics: (0.021757371210483628, 0.004643488695212834, 0.012254174116254415)
2026-06-18 17:10:11,922 - optuna.study.study - INFO - Trial 17 finished with values: [0.021757371210483628, 0.004643488695212834, 0.012254174116254415] and parameters: {'n_layers': 3, 'embedding_dim': 64, 'lr': 0.0018430878476133415, 'lambda_val': 4.115717615485875e-05, 'batch_size': 4089, 'optimizer': 'Adam'}.
2026-06-18 17:13:11,838 - optuna.study.study - INFO - Trial 18 finished with values: [0.0014472852225911213, 0.00034419603385120635, 0.0008165460556339378] and parameters: {'n_layers': 4, 'embedding_dim': 64, 'lr': 4.979412372358047e-05, 'lambda_val': 0.012868237118156371, 'batch_size': 2449, 'optimizer': 'Adam'}.
2026-06-18 17:13:39,219 - experiment_functions - INFO - Early stopping at epoch 550. Best Metrics: (0.004239765230535526, 0.0010183781735505874, 0.0024879841056202247)
2026-06-18 17:13:39,322 - optuna.study.study - INFO - Trial 19 finished with values: [0.004239765230535526, 0.0010183781735505874, 0.0024879841056202247] and parameters: {'n_layers': 4, 'embedding_dim': 64, 'lr': 0.001748408694605714, 'lambda_val': 0.034086085848787036, 'batch_size': 1246, 'optimizer': 'RMSprop'}.
2026-06-18 17:14:05,478 - experiment_functions - INFO - Early stopping at epoch 500. Best Metrics: (0.0005203861981830979, 0.00012315270935960593, 0.0002870755482804879)
2026-06-18 17:14:05,589 - optuna.study.study - INFO - Trial 20 finished with values: [0.0005203861981830979, 0.00012315270935960593, 0.0002870755482804879] and parameters: {'n_layers': 1, 'embedding_dim': 256, 'lr': 1.620090394512011e-05, 'lambda_val': 0.00011172078886158998, 'batch_size': 3104, 'optimizer': 'SGD'}.
2026-06-18 17:14:32,225 - experiment_functions - INFO - Early stopping at epoch 500. Best Metrics: (0.0005904812511064141, 0.0001294682329165088, 0.00029317200583260183)
2026-06-18 17:14:32,332 - optuna.study.study - INFO - Trial 21 finished with values: [0.0005904812511064141, 0.0001294682329165088, 0.00029317200583260183] and parameters: {'n_layers': 3, 'embedding_dim': 128, 'lr': 0.009147760801835597, 'lambda_val': 2.008756178451829e-06, 'batch_size': 3766, 'optimizer': 'SGD'}.
2026-06-18 17:15:05,693 - experiment_functions - INFO - Early stopping at epoch 650. Best Metrics: (0.021940759738912196, 0.004589806744979159, 0.012267139433734463)
2026-06-18 17:15:05,849 - optuna.study.study - INFO - Trial 22 finished with values: [0.021940759738912196, 0.004589806744979159, 0.012267139433734463] and parameters: {'n_layers': 2, 'embedding_dim': 128, 'lr': 0.0010029417148474076, 'lambda_val': 8.320422535259038e-06, 'batch_size': 2220, 'optimizer': 'RMSprop'}.
2026-06-18 17:15:40,355 - experiment_functions - INFO - Early stopping at epoch 750. Best Metrics: (0.013273218868245184, 0.0031656561828975623, 0.0076808509011979656)
2026-06-18 17:15:40,671 - optuna.study.study - INFO - Trial 23 finished with values: [0.013273218868245184, 0.0031656561828975623, 0.0076808509011979656] and parameters: {'n_layers': 1, 'embedding_dim': 96, 'lr': 0.0022436517643766684, 'lambda_val': 0.03685603593910875, 'batch_size': 2254, 'optimizer': 'Adam'}.
2026-06-18 17:17:17,338 - experiment_functions - INFO - Early stopping at epoch 2200. Best Metrics: (0.0005197877278438262, 0.0001136794240242516, 0.0003101490634944778)
2026-06-18 17:17:17,449 - optuna.study.study - INFO - Trial 24 finished with values: [0.0005197877278438262, 0.0001136794240242516, 0.0003101490634944778] and parameters: {'n_layers': 1, 'embedding_dim': 128, 'lr': 2.198623809397748e-05, 'lambda_val': 0.00017608504321216492, 'batch_size': 2989, 'optimizer': 'Adam'}.
2026-06-18 17:17:45,395 - experiment_functions - INFO - Early stopping at epoch 550. Best Metrics: (0.014599024467939, 0.0030330301882026023, 0.007574212317152117)
2026-06-18 17:17:45,509 - optuna.study.study - INFO - Trial 25 finished with values: [0.014599024467939, 0.0030330301882026023, 0.007574212317152117] and parameters: {'n_layers': 4, 'embedding_dim': 64, 'lr': 0.0037057773549623568, 'lambda_val': 0.0004245043608704845, 'batch_size': 3855, 'optimizer': 'RMSprop'}.
2026-06-18 17:20:39,630 - optuna.study.study - INFO - Trial 26 finished with values: [0.020047737242320177, 0.004278767209801693, 0.011108110964588157] and parameters: {'n_layers': 4, 'embedding_dim': 32, 'lr': 0.00016119764668191694, 'lambda_val': 0.0006355062805216911, 'batch_size': 2797, 'optimizer': 'Adam'}.
2026-06-18 17:21:06,592 - experiment_functions - INFO - Early stopping at epoch 550. Best Metrics: (0.0006737523543919403, 0.0001389415182518631, 0.000345716698172456)
2026-06-18 17:21:06,709 - optuna.study.study - INFO - Trial 27 finished with values: [0.0006737523543919403, 0.0001389415182518631, 0.000345716698172456] and parameters: {'n_layers': 2, 'embedding_dim': 96, 'lr': 2.787654619944108e-05, 'lambda_val': 0.0005344075018015639, 'batch_size': 3435, 'optimizer': 'Adam'}.
2026-06-18 17:21:33,610 - experiment_functions - INFO - Early stopping at epoch 550. Best Metrics: (0.009469260565090476, 0.0019499178981937603, 0.005175515125490855)
2026-06-18 17:21:33,712 - optuna.study.study - INFO - Trial 28 finished with values: [0.009469260565090476, 0.0019499178981937603, 0.005175515125490855] and parameters: {'n_layers': 3, 'embedding_dim': 64, 'lr': 0.08125704619424941, 'lambda_val': 1.393387151638873e-06, 'batch_size': 716, 'optimizer': 'Adam'}.
2026-06-18 17:21:59,660 - experiment_functions - INFO - Early stopping at epoch 500. Best Metrics: (0.0005269000686217013, 0.0001310471138057345, 0.0003371112319938271)
2026-06-18 17:21:59,764 - optuna.study.study - INFO - Trial 29 finished with values: [0.0005269000686217013, 0.0001310471138057345, 0.0003371112319938271] and parameters: {'n_layers': 1, 'embedding_dim': 256, 'lr': 0.0009039635827446111, 'lambda_val': 0.0011145652143308934, 'batch_size': 3726, 'optimizer': 'SGD'}.
2026-06-18 17:22:36,375 - experiment_functions - INFO - Early stopping at epoch 800. Best Metrics: (0.0313420363094799, 0.006825502084122774, 0.018473087741130836)
2026-06-18 17:22:36,481 - optuna.study.study - INFO - Trial 30 finished with values: [0.0313420363094799, 0.006825502084122774, 0.018473087741130836] and parameters: {'n_layers': 1, 'embedding_dim': 64, 'lr': 0.0018466507240200577, 'lambda_val': 1.2929761938228365e-06, 'batch_size': 1453, 'optimizer': 'Adam'}.
2026-06-18 17:23:06,404 - experiment_functions - INFO - Early stopping at epoch 600. Best Metrics: (0.000597160959750956, 0.00011525830491347733, 0.0002890643826352774)
2026-06-18 17:23:06,530 - optuna.study.study - INFO - Trial 31 finished with values: [0.000597160959750956, 0.00011525830491347733, 0.0002890643826352774] and parameters: {'n_layers': 2, 'embedding_dim': 128, 'lr': 1.4822293429813704e-05, 'lambda_val': 0.025909287897342103, 'batch_size': 3950, 'optimizer': 'RMSprop'}.
2026-06-18 17:23:45,413 - experiment_functions - INFO - Early stopping at epoch 550. Best Metrics: (0.018548964845672204, 0.0039014146772767466, 0.010573196579500333)
2026-06-18 17:23:45,541 - optuna.study.study - INFO - Trial 32 finished with values: [0.018548964845672204, 0.0039014146772767466, 0.010573196579500333] and parameters: {'n_layers': 4, 'embedding_dim': 256, 'lr': 0.001993370802391186, 'lambda_val': 4.735122359256782e-06, 'batch_size': 3520, 'optimizer': 'Adam'}.
2026-06-18 17:24:12,726 - experiment_functions - INFO - Early stopping at epoch 550. Best Metrics: (0.02673145051322614, 0.005492926613616269, 0.015135111484455946)
2026-06-18 17:24:12,843 - optuna.study.study - INFO - Trial 33 finished with values: [0.02673145051322614, 0.005492926613616269, 0.015135111484455946] and parameters: {'n_layers': 1, 'embedding_dim': 128, 'lr': 0.0082956867501665, 'lambda_val': 0.00047613316859548355, 'batch_size': 2618, 'optimizer': 'Adam'}.
2026-06-18 17:25:41,796 - experiment_functions - INFO - Early stopping at epoch 2000. Best Metrics: (0.0005437852522871101, 0.00012473159024883163, 0.00029231407719109873)
2026-06-18 17:25:41,902 - optuna.study.study - INFO - Trial 34 finished with values: [0.0005437852522871101, 0.00012473159024883163, 0.00029231407719109873] and parameters: {'n_layers': 3, 'embedding_dim': 64, 'lr': 1.963396245502517e-05, 'lambda_val': 4.457431336738457e-06, 'batch_size': 753, 'optimizer': 'Adam'}.
2026-06-18 17:26:12,844 - experiment_functions - INFO - Early stopping at epoch 600. Best Metrics: (0.01799381787098816, 0.003648793735000632, 0.009411593587608524)
2026-06-18 17:26:12,964 - optuna.study.study - INFO - Trial 35 finished with values: [0.01799381787098816, 0.003648793735000632, 0.009411593587608524] and parameters: {'n_layers': 3, 'embedding_dim': 96, 'lr': 0.0012644916907555855, 'lambda_val': 6.707141133962441e-05, 'batch_size': 3012, 'optimizer': 'RMSprop'}.
2026-06-18 17:27:00,520 - experiment_functions - INFO - Early stopping at epoch 1050. Best Metrics: (0.02105578012981346, 0.00454875584185929, 0.011596922239321069)
2026-06-18 17:27:00,626 - optuna.study.study - INFO - Trial 36 finished with values: [0.02105578012981346, 0.00454875584185929, 0.011596922239321069] and parameters: {'n_layers': 4, 'embedding_dim': 32, 'lr': 0.0005737959663697227, 'lambda_val': 0.0004198890855768189, 'batch_size': 3501, 'optimizer': 'RMSprop'}.
2026-06-18 17:30:30,473 - optuna.study.study - INFO - Trial 37 finished with values: [0.022765780979072562, 0.005072944297082229, 0.012907641866463824] and parameters: {'n_layers': 4, 'embedding_dim': 128, 'lr': 0.0001674019248092106, 'lambda_val': 0.0008936724688910117, 'batch_size': 1703, 'optimizer': 'Adam'}.
2026-06-18 17:33:58,511 - optuna.study.study - INFO - Trial 38 finished with values: [0.007491104550543217, 0.0018804471390678288, 0.004458960327120381] and parameters: {'n_layers': 4, 'embedding_dim': 128, 'lr': 0.00013575594902465817, 'lambda_val': 0.0654960552346548, 'batch_size': 3355, 'optimizer': 'RMSprop'}.
2026-06-18 17:34:22,203 - experiment_functions - INFO - Early stopping at epoch 500. Best Metrics: (0.0006225457579887693, 0.0001310471138057345, 0.00034456553667037396)
2026-06-18 17:34:22,329 - optuna.study.study - INFO - Trial 39 finished with values: [0.0006225457579887693, 0.0001310471138057345, 0.00034456553667037396] and parameters: {'n_layers': 2, 'embedding_dim': 64, 'lr': 0.00011040723334956882, 'lambda_val': 0.04843015481671603, 'batch_size': 3197, 'optimizer': 'SGD'}.
2026-06-18 17:37:30,552 - optuna.study.study - INFO - Trial 40 finished with values: [0.019024971972844775, 0.004198244284451182, 0.010933681846775706] and parameters: {'n_layers': 3, 'embedding_dim': 96, 'lr': 0.00014901541551160864, 'lambda_val': 4.521426485432383e-06, 'batch_size': 649, 'optimizer': 'RMSprop'}.
2026-06-18 17:41:27,900 - optuna.study.study - INFO - Trial 41 finished with values: [0.014603344684102085, 0.0034151193633952257, 0.008315564916872176] and parameters: {'n_layers': 3, 'embedding_dim': 256, 'lr': 0.00010703962244113484, 'lambda_val': 0.006137825895515928, 'batch_size': 1000, 'optimizer': 'RMSprop'}.
2026-06-18 17:42:24,344 - experiment_functions - INFO - Early stopping at epoch 1100. Best Metrics: (0.0235746583578533, 0.0052513578375647345, 0.01330115727503559)
2026-06-18 17:42:24,489 - optuna.study.study - INFO - Trial 42 finished with values: [0.0235746583578533, 0.0052513578375647345, 0.01330115727503559] and parameters: {'n_layers': 1, 'embedding_dim': 256, 'lr': 0.0005592470013695373, 'lambda_val': 0.00988731074821415, 'batch_size': 2931, 'optimizer': 'Adam'}.
2026-06-18 17:44:24,046 - experiment_functions - INFO - Early stopping at epoch 2800. Best Metrics: (0.028668016342435515, 0.0061671087533156504, 0.016378292643507077)
2026-06-18 17:44:24,151 - optuna.study.study - INFO - Trial 43 finished with values: [0.028668016342435515, 0.0061671087533156504, 0.016378292643507077] and parameters: {'n_layers': 2, 'embedding_dim': 32, 'lr': 0.0004856174201898278, 'lambda_val': 0.004505589428166237, 'batch_size': 578, 'optimizer': 'Adam'}.
2026-06-18 17:48:04,516 - optuna.study.study - INFO - Trial 44 finished with values: [0.024093796760898817, 0.005262410003789315, 0.014219134877678292] and parameters: {'n_layers': 2, 'embedding_dim': 256, 'lr': 0.0001408506946893725, 'lambda_val': 9.959964188496882e-05, 'batch_size': 2521, 'optimizer': 'Adam'}.
2026-06-18 17:48:27,394 - experiment_functions - INFO - Early stopping at epoch 500. Best Metrics: (0.0005519729998764236, 0.00013578375647341163, 0.000301650262429856)
