2026-06-19 23:25:48,960 - optuna.study.study - INFO - Trial 139 finished with values: [0.011631536974940732, 0.0025341038272072756, 0.006332280129008774] and parameters: {'n_layers': 1, 'embedding_dim': 128, 'lr': 0.007729246782619305, 'lambda_val': 0.001032325420317978, 'batch_size': 3934, 'optimizer': 'RMSprop'}.
2026-06-19 23:26:14,711 - experiment_functions - INFO - Early stopping at epoch 550. Best Metrics: (0.011232272813456748, 0.00251042061386889, 0.006366869386730996)
2026-06-19 23:26:14,778 - optuna.study.study - INFO - Trial 140 finished with values: [0.011232272813456748, 0.00251042061386889, 0.006366869386730996] and parameters: {'n_layers': 1, 'embedding_dim': 128, 'lr': 0.03802513876197062, 'lambda_val': 0.0003252544271512617, 'batch_size': 3313, 'optimizer': 'Adam'}.
2026-06-19 23:26:40,309 - experiment_functions - INFO - Early stopping at epoch 500. Best Metrics: (0.0006659636209801839, 0.0001484148035872174, 0.0003578128495992235)
2026-06-19 23:26:40,385 - optuna.study.study - INFO - Trial 141 finished with values: [0.0006659636209801839, 0.0001484148035872174, 0.0003578128495992235] and parameters: {'n_layers': 3, 'embedding_dim': 128, 'lr': 5.141874187439846e-05, 'lambda_val': 0.001032325420317978, 'batch_size': 1916, 'optimizer': 'RMSprop'}.
2026-06-19 23:30:02,349 - optuna.study.study - INFO - Trial 142 finished with values: [0.016209951715398616, 0.00356827080965012, 0.009399430751732964] and parameters: {'n_layers': 4, 'embedding_dim': 128, 'lr': 0.00014111781740429823, 'lambda_val': 0.004140028155545859, 'batch_size': 3450, 'optimizer': 'Adam'}.
2026-06-19 23:30:30,663 - experiment_functions - INFO - Early stopping at epoch 550. Best Metrics: (0.008025472591988369, 0.0017525577870405459, 0.004401871032350906)
2026-06-19 23:30:30,749 - optuna.study.study - INFO - Trial 143 finished with values: [0.008025472591988369, 0.0017525577870405459, 0.004401871032350906] and parameters: {'n_layers': 4, 'embedding_dim': 96, 'lr': 0.00945956189168787, 'lambda_val': 3.9435940439521e-06, 'batch_size': 2432, 'optimizer': 'Adam'}.
2026-06-19 23:33:15,281 - optuna.study.study - INFO - Trial 144 finished with values: [0.03073951720464276, 0.0064639383604900855, 0.017625101121920148] and parameters: {'n_layers': 1, 'embedding_dim': 32, 'lr': 0.0020150870895911718, 'lambda_val': 4.332711516457783e-05, 'batch_size': 592, 'optimizer': 'Adam'}.
2026-06-19 23:33:39,722 - experiment_functions - INFO - Early stopping at epoch 550. Best Metrics: (0.007457664318430279, 0.0017809776430466086, 0.004625810742265079)
2026-06-19 23:33:39,812 - optuna.study.study - INFO - Trial 145 finished with values: [0.007457664318430279, 0.0017809776430466086, 0.004625810742265079] and parameters: {'n_layers': 1, 'embedding_dim': 64, 'lr': 0.06748636109741066, 'lambda_val': 2.710386902101323e-06, 'batch_size': 592, 'optimizer': 'Adam'}.
2026-06-19 23:36:25,199 - optuna.study.study - INFO - Trial 146 finished with values: [0.026118736846342108, 0.005690286724769483, 0.015155731275385886] and parameters: {'n_layers': 1, 'embedding_dim': 64, 'lr': 0.0005537165984177899, 'lambda_val': 2.710386902101323e-06, 'batch_size': 3313, 'optimizer': 'Adam'}.
2026-06-19 23:37:04,899 - experiment_functions - INFO - Early stopping at epoch 750. Best Metrics: (0.010460948900693764, 0.0021346469622331695, 0.005854351362787538)
2026-06-19 23:37:05,138 - optuna.study.study - INFO - Trial 147 finished with values: [0.010460948900693764, 0.0021346469622331695, 0.005854351362787538] and parameters: {'n_layers': 4, 'embedding_dim': 128, 'lr': 0.014253475142274949, 'lambda_val': 1.9968956567375666e-05, 'batch_size': 3395, 'optimizer': 'RMSprop'}.
2026-06-19 23:37:33,709 - experiment_functions - INFO - Early stopping at epoch 650. Best Metrics: (0.027139250644460475, 0.005661866868763421, 0.015430920480656465)
2026-06-19 23:37:33,806 - optuna.study.study - INFO - Trial 148 finished with values: [0.027139250644460475, 0.005661866868763421, 0.015430920480656465] and parameters: {'n_layers': 1, 'embedding_dim': 32, 'lr': 0.008256478006191592, 'lambda_val': 1.9968956567375666e-05, 'batch_size': 3395, 'optimizer': 'Adam'}.
2026-06-19 23:40:23,389 - optuna.study.study - INFO - Trial 149 finished with values: [0.027121987691683162, 0.005882910193255021, 0.015750678605214494] and parameters: {'n_layers': 1, 'embedding_dim': 96, 'lr': 0.0005537165984177899, 'lambda_val': 2.710386902101323e-06, 'batch_size': 3313, 'optimizer': 'Adam'}.
2026-06-19 23:41:50,458 - experiment_functions - INFO - Early stopping at epoch 2050. Best Metrics: (0.02197378607817672, 0.004632436528988254, 0.012004897323765047)
2026-06-19 23:41:50,530 - optuna.study.study - INFO - Trial 150 finished with values: [0.02197378607817672, 0.004632436528988254, 0.012004897323765047] and parameters: {'n_layers': 3, 'embedding_dim': 32, 'lr': 0.0005537165984177899, 'lambda_val': 0.001032325420317978, 'batch_size': 3313, 'optimizer': 'Adam'}.
2026-06-19 23:43:02,083 - experiment_functions - INFO - Early stopping at epoch 1200. Best Metrics: (0.02482600157764661, 0.00519767588733106, 0.014282351283195466)
2026-06-19 23:43:02,178 - optuna.study.study - INFO - Trial 151 finished with values: [0.02482600157764661, 0.00519767588733106, 0.014282351283195466] and parameters: {'n_layers': 3, 'embedding_dim': 256, 'lr': 0.0005537165984177899, 'lambda_val': 0.0004642800755324419, 'batch_size': 2297, 'optimizer': 'Adam'}.
2026-06-19 23:43:44,991 - experiment_functions - INFO - Early stopping at epoch 800. Best Metrics: (0.019400474866346204, 0.004149298976885184, 0.010937225451242793)
2026-06-19 23:43:45,082 - optuna.study.study - INFO - Trial 152 finished with values: [0.019400474866346204, 0.004149298976885184, 0.010937225451242793] and parameters: {'n_layers': 4, 'embedding_dim': 128, 'lr': 0.0006454805060704331, 'lambda_val': 2.3360853516346427e-06, 'batch_size': 3450, 'optimizer': 'RMSprop'}.
2026-06-19 23:46:59,826 - optuna.study.study - INFO - Trial 153 finished with values: [0.027041915340509513, 0.005781861816344575, 0.015673468965343773] and parameters: {'n_layers': 3, 'embedding_dim': 128, 'lr': 0.0005537165984177899, 'lambda_val': 2.710386902101323e-06, 'batch_size': 989, 'optimizer': 'Adam'}.
2026-06-19 23:49:53,673 - optuna.study.study - INFO - Trial 154 finished with values: [0.02700860888499989, 0.005917645572817986, 0.015825831398377607] and parameters: {'n_layers': 1, 'embedding_dim': 128, 'lr': 0.000502008079869897, 'lambda_val': 0.000491870809962855, 'batch_size': 3592, 'optimizer': 'Adam'}.
2026-06-19 23:50:33,946 - experiment_functions - INFO - Early stopping at epoch 950. Best Metrics: (0.02727312733805655, 0.005826070481242895, 0.01555778426818952)
2026-06-19 23:50:34,317 - optuna.study.study - INFO - Trial 155 finished with values: [0.02727312733805655, 0.005826070481242895, 0.01555778426818952] and parameters: {'n_layers': 1, 'embedding_dim': 32, 'lr': 0.0020150870895911718, 'lambda_val': 0.003946099672702113, 'batch_size': 1780, 'optimizer': 'RMSprop'}.
2026-06-19 23:51:00,927 - experiment_functions - INFO - Early stopping at epoch 600. Best Metrics: (0.020377034801235157, 0.004318239232032337, 0.011192519260517862)
2026-06-19 23:51:01,015 - optuna.study.study - INFO - Trial 156 finished with values: [0.020377034801235157, 0.004318239232032337, 0.011192519260517862] and parameters: {'n_layers': 2, 'embedding_dim': 32, 'lr': 0.008256478006191592, 'lambda_val': 1.9968956567375666e-05, 'batch_size': 3395, 'optimizer': 'Adam'}.
2026-06-19 23:53:40,931 - optuna.study.study - INFO - Trial 157 finished with values: [0.02241048788515557, 0.00494347606416572, 0.012977555617786008] and parameters: {'n_layers': 1, 'embedding_dim': 32, 'lr': 0.0005537165984177899, 'lambda_val': 2.710386902101323e-06, 'batch_size': 3313, 'optimizer': 'Adam'}.
2026-06-19 23:54:10,298 - experiment_functions - INFO - Early stopping at epoch 650. Best Metrics: (0.013502539895467446, 0.0029209296450675762, 0.0072786036585166585)
2026-06-19 23:54:10,393 - optuna.study.study - INFO - Trial 158 finished with values: [0.013502539895467446, 0.0029209296450675762, 0.0072786036585166585] and parameters: {'n_layers': 4, 'embedding_dim': 32, 'lr': 0.0020150870895911718, 'lambda_val': 0.0046994687366577305, 'batch_size': 4087, 'optimizer': 'Adam'}.
2026-06-19 23:56:54,228 - optuna.study.study - INFO - Trial 159 finished with values: [0.021579307298074942, 0.004862953138815208, 0.012508380135186134] and parameters: {'n_layers': 1, 'embedding_dim': 64, 'lr': 0.0005537165984177899, 'lambda_val': 0.00011471274504099714, 'batch_size': 2488, 'optimizer': 'Adam'}.
2026-06-19 23:57:22,774 - experiment_functions - INFO - Early stopping at epoch 650. Best Metrics: (0.02478240509332583, 0.005276619931792346, 0.014244579933026332)
2026-06-19 23:57:22,881 - optuna.study.study - INFO - Trial 160 finished with values: [0.02478240509332583, 0.005276619931792346, 0.014244579933026332] and parameters: {'n_layers': 1, 'embedding_dim': 32, 'lr': 0.007729246782619305, 'lambda_val': 3.839973473325218e-05, 'batch_size': 1780, 'optimizer': 'Adam'}.
2026-06-19 23:58:23,390 - experiment_functions - INFO - Early stopping at epoch 1400. Best Metrics: (0.0004600173280886333, 0.00010736390046734874, 0.0002711679456731345)
2026-06-19 23:58:23,461 - optuna.study.study - INFO - Trial 161 finished with values: [0.0004600173280886333, 0.00010736390046734874, 0.0002711679456731345] and parameters: {'n_layers': 1, 'embedding_dim': 128, 'lr': 1.2419628891515886e-05, 'lambda_val': 0.004140028155545859, 'batch_size': 1811, 'optimizer': 'Adam'}.
2026-06-19 23:58:45,695 - experiment_functions - INFO - Early stopping at epoch 500. Best Metrics: (0.0004969266863309427, 0.00011683718580270305, 0.00030067902179639)
2026-06-19 23:58:45,784 - optuna.study.study - INFO - Trial 162 finished with values: [0.0004969266863309427, 0.00011683718580270305, 0.00030067902179639] and parameters: {'n_layers': 1, 'embedding_dim': 64, 'lr': 0.0020150870895911718, 'lambda_val': 2.710386902101323e-06, 'batch_size': 3313, 'optimizer': 'SGD'}.
2026-06-20 00:00:35,745 - experiment_functions - INFO - Early stopping at epoch 2600. Best Metrics: (0.02537142469039501, 0.005442402425161047, 0.014387776894603332)
2026-06-20 00:00:35,851 - optuna.study.study - INFO - Trial 163 finished with values: [0.02537142469039501, 0.005442402425161047, 0.014387776894603332] and parameters: {'n_layers': 3, 'embedding_dim': 32, 'lr': 0.000502008079869897, 'lambda_val': 2.710386902101323e-06, 'batch_size': 3215, 'optimizer': 'RMSprop'}.
2026-06-20 00:01:01,872 - experiment_functions - INFO - Early stopping at epoch 600. Best Metrics: (0.015842510444663914, 0.0034135404825059996, 0.008542863219008616)
2026-06-20 00:01:01,955 - optuna.study.study - INFO - Trial 164 finished with values: [0.015842510444663914, 0.0034135404825059996, 0.008542863219008616] and parameters: {'n_layers': 1, 'embedding_dim': 32, 'lr': 0.02088730245216097, 'lambda_val': 4.126856178316888e-06, 'batch_size': 1780, 'optimizer': 'Adam'}.
2026-06-20 00:01:47,567 - experiment_functions - INFO - Early stopping at epoch 1000. Best Metrics: (0.029710434314371946, 0.006230263988884679, 0.016962908896699047)
2026-06-20 00:01:47,659 - optuna.study.study - INFO - Trial 165 finished with values: [0.029710434314371946, 0.006230263988884679, 0.016962908896699047] and parameters: {'n_layers': 1, 'embedding_dim': 128, 'lr': 0.0024514310990239744, 'lambda_val': 0.00042087486522763635, 'batch_size': 2115, 'optimizer': 'Adam'}.
2026-06-20 00:03:03,533 - experiment_functions - INFO - Early stopping at epoch 1800. Best Metrics: (0.029774046020980726, 0.006276051534672225, 0.017227243482887903)
2026-06-20 00:03:03,619 - optuna.study.study - INFO - Trial 166 finished with values: [0.029774046020980726, 0.006276051534672225, 0.017227243482887903] and parameters: {'n_layers': 1, 'embedding_dim': 32, 'lr': 0.0020150870895911718, 'lambda_val': 0.000491870809962855, 'batch_size': 2173, 'optimizer': 'Adam'}.
2026-06-20 00:03:53,769 - experiment_functions - INFO - Early stopping at epoch 1000. Best Metrics: (0.02389718120007742, 0.004935581659719591, 0.013305929050708867)
2026-06-20 00:03:53,856 - optuna.study.study - INFO - Trial 167 finished with values: [0.02389718120007742, 0.004935581659719591, 0.013305929050708867] and parameters: {'n_layers': 3, 'embedding_dim': 128, 'lr': 0.000778135007488856, 'lambda_val': 2.710386902101323e-06, 'batch_size': 3313, 'optimizer': 'Adam'}.
2026-06-20 00:06:36,608 - optuna.study.study - INFO - Trial 168 finished with values: [0.029754711720735086, 0.006347101174687382, 0.0171355542384112] and parameters: {'n_layers': 1, 'embedding_dim': 32, 'lr': 0.000778135007488856, 'lambda_val': 1.6250517825264063e-06, 'batch_size': 3313, 'optimizer': 'Adam'}.
2026-06-20 00:07:14,394 - experiment_functions - INFO - Early stopping at epoch 850. Best Metrics: (0.026973426873807334, 0.005905014525704181, 0.015560369733198841)
2026-06-20 00:07:14,489 - optuna.study.study - INFO - Trial 169 finished with values: [0.026973426873807334, 0.005905014525704181, 0.015560369733198841] and parameters: {'n_layers': 1, 'embedding_dim': 96, 'lr': 0.002485646663868356, 'lambda_val': 0.003946099672702113, 'batch_size': 1780, 'optimizer': 'Adam'}.
2026-06-20 00:08:59,918 - experiment_functions - INFO - Early stopping at epoch 2500. Best Metrics: (0.013905773120515481, 0.0030172413793103452, 0.008065568403088759)
2026-06-20 00:08:59,987 - optuna.study.study - INFO - Trial 170 finished with values: [0.013905773120515481, 0.0030172413793103452, 0.008065568403088759] and parameters: {'n_layers': 1, 'embedding_dim': 96, 'lr': 0.008632706920549668, 'lambda_val': 1.2446467426024901e-06, 'batch_size': 1916, 'optimizer': 'RMSprop'}.
2026-06-20 00:10:24,247 - experiment_functions - INFO - Early stopping at epoch 1900. Best Metrics: (0.03242793536101787, 0.006699191612984718, 0.01819986883616227)
2026-06-20 00:10:24,329 - optuna.study.study - INFO - Trial 171 finished with values: [0.03242793536101787, 0.006699191612984718, 0.01819986883616227] and parameters: {'n_layers': 1, 'embedding_dim': 128, 'lr': 0.0010742990196571252, 'lambda_val': 1.2446467426024901e-06, 'batch_size': 2868, 'optimizer': 'RMSprop'}.
2026-06-20 00:13:03,169 - experiment_functions - INFO - Early stopping at epoch 3550. Best Metrics: (0.0005564344276830996, 0.0001373626373626374, 0.0002968305557453202)
2026-06-20 00:13:03,262 - optuna.study.study - INFO - Trial 172 finished with values: [0.0005564344276830996, 0.0001373626373626374, 0.0002968305557453202] and parameters: {'n_layers': 2, 'embedding_dim': 128, 'lr': 8.38716028988171e-05, 'lambda_val': 2.710386902101323e-06, 'batch_size': 3313, 'optimizer': 'Adam'}.
2026-06-20 00:15:48,684 - optuna.study.study - INFO - Trial 173 finished with values: [0.004657968428422973, 0.0011494252873563218, 0.002793037138723337] and parameters: {'n_layers': 4, 'embedding_dim': 32, 'lr': 0.00011321270269222532, 'lambda_val': 3.9435940439521e-06, 'batch_size': 2432, 'optimizer': 'Adam'}.
2026-06-20 00:16:18,702 - experiment_functions - INFO - Early stopping at epoch 650. Best Metrics: (0.007357148459660606, 0.001488884678539851, 0.004055819539377627)
2026-06-20 00:16:18,792 - optuna.study.study - INFO - Trial 174 finished with values: [0.007357148459660606, 0.001488884678539851, 0.004055819539377627] and parameters: {'n_layers': 3, 'embedding_dim': 64, 'lr': 0.04142334898643579, 'lambda_val': 2.710386902101323e-06, 'batch_size': 1840, 'optimizer': 'Adam'}.
2026-06-20 00:19:08,946 - optuna.study.study - INFO - Trial 175 finished with values: [0.02958598838517297, 0.006426045219148667, 0.017089218272398878] and parameters: {'n_layers': 1, 'embedding_dim': 96, 'lr': 0.0005674841626425155, 'lambda_val': 0.000355022057333572, 'batch_size': 2929, 'optimizer': 'RMSprop'}.
2026-06-20 00:19:42,089 - experiment_functions - INFO - Early stopping at epoch 550. Best Metrics: (0.0031526297157280386, 0.0007183908045977011, 0.0018484788757764038)
2026-06-20 00:19:42,177 - optuna.study.study - INFO - Trial 176 finished with values: [0.0031526297157280386, 0.0007183908045977011, 0.0018484788757764038] and parameters: {'n_layers': 3, 'embedding_dim': 256, 'lr': 0.002485646663868356, 'lambda_val': 0.06262600159180341, 'batch_size': 1780, 'optimizer': 'RMSprop'}.
2026-06-20 00:22:19,916 - optuna.study.study - INFO - Trial 177 finished with values: [0.012703833167316447, 0.0029414550966275106, 0.007498599317827021] and parameters: {'n_layers': 1, 'embedding_dim': 32, 'lr': 0.000502008079869897, 'lambda_val': 0.0006161413438795785, 'batch_size': 1916, 'optimizer': 'RMSprop'}.
2026-06-20 00:22:44,143 - experiment_functions - INFO - Early stopping at epoch 550. Best Metrics: (0.020593485585162285, 0.00453454591385626, 0.012011623140565317)
2026-06-20 00:22:44,225 - optuna.study.study - INFO - Trial 178 finished with values: [0.020593485585162285, 0.00453454591385626, 0.012011623140565317] and parameters: {'n_layers': 1, 'embedding_dim': 32, 'lr': 0.02088730245216097, 'lambda_val': 2.710386902101323e-06, 'batch_size': 4087, 'optimizer': 'Adam'}.
2026-06-20 00:24:07,262 - experiment_functions - INFO - Early stopping at epoch 1800. Best Metrics: (0.011389042169621008, 0.002354111405835544, 0.005983306012704951)
2026-06-20 00:24:07,343 - optuna.study.study - INFO - Trial 179 finished with values: [0.011389042169621008, 0.002354111405835544, 0.005983306012704951] and parameters: {'n_layers': 3, 'embedding_dim': 96, 'lr': 0.0028479344086524603, 'lambda_val': 1.6250517825264063e-06, 'batch_size': 844, 'optimizer': 'Adam'}.
2026-06-20 00:26:46,221 - optuna.study.study - INFO - Trial 180 finished with values: [0.013634202290088463, 0.0030425034735379565, 0.008068852856177542] and parameters: {'n_layers': 1, 'embedding_dim': 32, 'lr': 0.0005537165984177899, 'lambda_val': 5.9707978234843765e-05, 'batch_size': 1916, 'optimizer': 'Adam'}.
2026-06-20 00:27:34,357 - experiment_functions - INFO - Early stopping at epoch 1000. Best Metrics: (0.005028220700258939, 0.0011225843122394845, 0.0026469313388836767)
2026-06-20 00:27:34,432 - optuna.study.study - INFO - Trial 181 finished with values: [0.005028220700258939, 0.0011225843122394845, 0.0026469313388836767] and parameters: {'n_layers': 1, 'embedding_dim': 256, 'lr': 0.002485646663868356, 'lambda_val': 0.04953946175938718, 'batch_size': 1029, 'optimizer': 'RMSprop'}.
2026-06-20 00:30:43,813 - optuna.study.study - INFO - Trial 182 finished with values: [0.018106501096667137, 0.0041429834533282806, 0.010891516497614535] and parameters: {'n_layers': 1, 'embedding_dim': 256, 'lr': 0.000502008079869897, 'lambda_val': 4.388555938735431e-05, 'batch_size': 1780, 'optimizer': 'Adam'}.
2026-06-20 00:33:26,965 - optuna.study.study - INFO - Trial 183 finished with values: [0.023664528823113606, 0.005194518125552609, 0.013935275340927995] and parameters: {'n_layers': 1, 'embedding_dim': 32, 'lr': 0.0005537165984177899, 'lambda_val': 0.0005281001501293369, 'batch_size': 3395, 'optimizer': 'Adam'}.
2026-06-20 00:34:53,653 - experiment_functions - INFO - Early stopping at epoch 2200. Best Metrics: (0.0004803334587484702, 0.00011999494758115447, 0.0002696876801601624)
2026-06-20 00:34:53,732 - optuna.study.study - INFO - Trial 184 finished with values: [0.0004803334587484702, 0.00011999494758115447, 0.0002696876801601624] and parameters: {'n_layers': 1, 'embedding_dim': 32, 'lr': 2.6613889497866033e-05, 'lambda_val': 6.875613238621071e-05, 'batch_size': 3313, 'optimizer': 'Adam'}.
2026-06-20 00:37:40,869 - optuna.study.study - INFO - Trial 185 finished with values: [0.025681692986294073, 0.005535556397625364, 0.014527901147557063] and parameters: {'n_layers': 3, 'embedding_dim': 32, 'lr': 0.000502008079869897, 'lambda_val': 0.00014132388410454993, 'batch_size': 1916, 'optimizer': 'RMSprop'}.
2026-06-20 00:38:03,732 - experiment_functions - INFO - Early stopping at epoch 500. Best Metrics: (0.0006361883963298893, 0.00013736263736263736, 0.0003522179561896246)
2026-06-20 00:38:03,823 - optuna.study.study - INFO - Trial 186 finished with values: [0.0006361883963298893, 0.00013736263736263736, 0.0003522179561896246] and parameters: {'n_layers': 1, 'embedding_dim': 128, 'lr': 0.007729246782619305, 'lambda_val': 1.9968956567375666e-05, 'batch_size': 3934, 'optimizer': 'SGD'}.
2026-06-20 00:38:32,261 - experiment_functions - INFO - Early stopping at epoch 650. Best Metrics: (0.026144869489028087, 0.0055402930402930406, 0.014909678186621011)
2026-06-20 00:38:32,351 - optuna.study.study - INFO - Trial 187 finished with values: [0.026144869489028087, 0.0055402930402930406, 0.014909678186621011] and parameters: {'n_layers': 1, 'embedding_dim': 32, 'lr': 0.00733558167545691, 'lambda_val': 2.710386902101323e-06, 'batch_size': 3313, 'optimizer': 'Adam'}.
2026-06-20 00:39:00,088 - experiment_functions - INFO - Early stopping at epoch 650. Best Metrics: (0.01171500735912638, 0.0025672603258810158, 0.006704915278026201)
2026-06-20 00:39:00,173 - optuna.study.study - INFO - Trial 188 finished with values: [0.01171500735912638, 0.0025672603258810158, 0.006704915278026201] and parameters: {'n_layers': 1, 'embedding_dim': 32, 'lr': 0.012720447815118746, 'lambda_val': 0.000491870809962855, 'batch_size': 1780, 'optimizer': 'RMSprop'}.
2026-06-20 00:39:44,910 - experiment_functions - INFO - Early stopping at epoch 1050. Best Metrics: (0.030594939095723132, 0.006380257673361122, 0.017530175178513116)
2026-06-20 00:39:45,002 - optuna.study.study - INFO - Trial 189 finished with values: [0.030594939095723132, 0.006380257673361122, 0.017530175178513116] and parameters: {'n_layers': 1, 'embedding_dim': 32, 'lr': 0.0020150870895911718, 'lambda_val': 4.332711516457783e-05, 'batch_size': 2713, 'optimizer': 'RMSprop'}.
2026-06-20 00:42:04,669 - experiment_functions - INFO - Early stopping at epoch 3400. Best Metrics: (0.03489745241582935, 0.007163382594417077, 0.02003033208915465)
