2026-06-18 07:37:27,225 - optuna.study.study - INFO - Trial 178 finished with values: [0.002589116715407495, 0.0006110269041303525, 0.0016818921840015318] and parameters: {'n_layers': 2, 'embedding_dim': 128, 'lr': 0.0353002893240081, 'lambda_val': 5.538422897317458e-06, 'batch_size': 655, 'optimizer': 'RMSprop'}.
2026-06-18 07:38:55,006 - experiment_functions - INFO - Early stopping at epoch 1650. Best Metrics: (0.003575957678546976, 0.0009110142730832387, 0.0021325672337075894)
2026-06-18 07:38:55,098 - optuna.study.study - INFO - Trial 179 finished with values: [0.003575957678546976, 0.0009110142730832387, 0.0021325672337075894] and parameters: {'n_layers': 4, 'embedding_dim': 256, 'lr': 0.0011084029372515364, 'lambda_val': 1.6639720416643942e-06, 'batch_size': 3565, 'optimizer': 'RMSprop'}.
2026-06-18 07:39:20,340 - experiment_functions - INFO - Early stopping at epoch 500. Best Metrics: (0.0005885809896095728, 0.00012946823291650877, 0.00030465954524516503)
2026-06-18 07:39:20,441 - optuna.study.study - INFO - Trial 180 finished with values: [0.0005885809896095728, 0.00012946823291650877, 0.00030465954524516503] and parameters: {'n_layers': 2, 'embedding_dim': 256, 'lr': 0.002685013617819528, 'lambda_val': 0.00014712489754445548, 'batch_size': 2756, 'optimizer': 'SGD'}.
2026-06-18 07:40:04,140 - experiment_functions - INFO - Early stopping at epoch 900. Best Metrics: (0.0032746340915294444, 0.000819439181508147, 0.002022379769067634)
2026-06-18 07:40:04,215 - optuna.study.study - INFO - Trial 181 finished with values: [0.0032746340915294444, 0.000819439181508147, 0.002022379769067634] and parameters: {'n_layers': 2, 'embedding_dim': 256, 'lr': 0.0015504147246821012, 'lambda_val': 0.00020122391761600542, 'batch_size': 2287, 'optimizer': 'RMSprop'}.
2026-06-18 07:41:26,139 - experiment_functions - INFO - Early stopping at epoch 1600. Best Metrics: (0.003478197936212344, 0.0008889099406340787, 0.0021309143775476613)
2026-06-18 07:41:26,223 - optuna.study.study - INFO - Trial 182 finished with values: [0.003478197936212344, 0.0008889099406340787, 0.0021309143775476613] and parameters: {'n_layers': 3, 'embedding_dim': 256, 'lr': 0.0011084029372515364, 'lambda_val': 1.6639720416643942e-06, 'batch_size': 2514, 'optimizer': 'RMSprop'}.
2026-06-18 07:41:49,303 - experiment_functions - INFO - Early stopping at epoch 500. Best Metrics: (0.0004723689605738807, 0.00011841606669192878, 0.0002818568109401642)
2026-06-18 07:41:49,387 - optuna.study.study - INFO - Trial 183 finished with values: [0.0004723689605738807, 0.00011841606669192878, 0.0002818568109401642] and parameters: {'n_layers': 4, 'embedding_dim': 64, 'lr': 0.0004894377864752034, 'lambda_val': 0.00029665726020447226, 'batch_size': 3869, 'optimizer': 'SGD'}.
2026-06-18 07:42:14,387 - experiment_functions - INFO - Early stopping at epoch 500. Best Metrics: (0.0004411442508465958, 0.00011052166224580018, 0.0002478106096221656)
2026-06-18 07:42:14,474 - optuna.study.study - INFO - Trial 184 finished with values: [0.0004411442508465958, 0.00011052166224580018, 0.0002478106096221656] and parameters: {'n_layers': 2, 'embedding_dim': 256, 'lr': 0.0009840483225184993, 'lambda_val': 0.00029665726020447226, 'batch_size': 696, 'optimizer': 'SGD'}.
2026-06-18 07:43:37,790 - experiment_functions - INFO - Early stopping at epoch 1800. Best Metrics: (0.0034975342642407955, 0.0008999621068586586, 0.002195789672776549)
2026-06-18 07:43:37,876 - optuna.study.study - INFO - Trial 185 finished with values: [0.0034975342642407955, 0.0008999621068586586, 0.002195789672776549] and parameters: {'n_layers': 4, 'embedding_dim': 128, 'lr': 0.00048363299473296685, 'lambda_val': 2.2848456976007116e-05, 'batch_size': 3869, 'optimizer': 'RMSprop'}.
2026-06-18 07:45:28,286 - experiment_functions - INFO - Early stopping at epoch 2600. Best Metrics: (0.003759736473887825, 0.000909435392194013, 0.0024759775073086945)
2026-06-18 07:45:28,388 - optuna.study.study - INFO - Trial 186 finished with values: [0.003759736473887825, 0.000909435392194013, 0.0024759775073086945] and parameters: {'n_layers': 2, 'embedding_dim': 128, 'lr': 0.0009840483225184993, 'lambda_val': 2.2848456976007116e-05, 'batch_size': 655, 'optimizer': 'RMSprop'}.
2026-06-18 07:46:33,589 - experiment_functions - INFO - Early stopping at epoch 1200. Best Metrics: (0.003226593646332127, 0.0008525956801818871, 0.00203856701691983)
2026-06-18 07:46:33,656 - optuna.study.study - INFO - Trial 187 finished with values: [0.003226593646332127, 0.0008525956801818871, 0.00203856701691983] and parameters: {'n_layers': 4, 'embedding_dim': 256, 'lr': 0.0008273605807562151, 'lambda_val': 0.0002692345705128242, 'batch_size': 2287, 'optimizer': 'Adam'}.
2026-06-18 07:47:43,931 - experiment_functions - INFO - Early stopping at epoch 1550. Best Metrics: (0.0023827445786124787, 0.0005494505494505495, 0.0014835574160828931)
2026-06-18 07:47:44,021 - optuna.study.study - INFO - Trial 188 finished with values: [0.0023827445786124787, 0.0005494505494505495, 0.0014835574160828931] and parameters: {'n_layers': 1, 'embedding_dim': 256, 'lr': 0.0008273605807562151, 'lambda_val': 0.004099856250982494, 'batch_size': 1498, 'optimizer': 'Adam'}.
2026-06-18 07:49:01,522 - experiment_functions - INFO - Early stopping at epoch 1900. Best Metrics: (0.0032131267131491285, 0.0007720727548313756, 0.002000054386277881)
2026-06-18 07:49:01,596 - optuna.study.study - INFO - Trial 189 finished with values: [0.0032131267131491285, 0.0007720727548313756, 0.002000054386277881] and parameters: {'n_layers': 2, 'embedding_dim': 64, 'lr': 0.0009840483225184993, 'lambda_val': 3.615242376833312e-06, 'batch_size': 2514, 'optimizer': 'RMSprop'}.
2026-06-18 07:51:40,131 - experiment_functions - INFO - Early stopping at epoch 3750. Best Metrics: (0.0038879114090330825, 0.0009662751042061388, 0.002483487560215226)
2026-06-18 07:51:40,217 - optuna.study.study - INFO - Trial 190 finished with values: [0.0038879114090330825, 0.0009662751042061388, 0.002483487560215226] and parameters: {'n_layers': 2, 'embedding_dim': 128, 'lr': 0.0009840483225184993, 'lambda_val': 1.4055284682631976e-05, 'batch_size': 655, 'optimizer': 'RMSprop'}.
2026-06-18 07:53:08,486 - experiment_functions - INFO - Early stopping at epoch 1750. Best Metrics: (0.0035972919867837856, 0.0008794366552987243, 0.0021814225931181997)
2026-06-18 07:53:08,576 - optuna.study.study - INFO - Trial 191 finished with values: [0.0035972919867837856, 0.0008794366552987243, 0.0021814225931181997] and parameters: {'n_layers': 3, 'embedding_dim': 256, 'lr': 0.0004894377864752034, 'lambda_val': 0.00029665726020447226, 'batch_size': 2159, 'optimizer': 'RMSprop'}.
2026-06-18 07:54:58,248 - experiment_functions - INFO - Early stopping at epoch 2400. Best Metrics: (0.0033744973282410795, 0.0008620689655172414, 0.0020410577989390328)
2026-06-18 07:54:58,337 - optuna.study.study - INFO - Trial 192 finished with values: [0.0033744973282410795, 0.0008620689655172414, 0.0020410577989390328] and parameters: {'n_layers': 4, 'embedding_dim': 128, 'lr': 0.0008273605807562151, 'lambda_val': 7.3372601056335455e-06, 'batch_size': 2287, 'optimizer': 'Adam'}.
2026-06-18 07:55:25,511 - experiment_functions - INFO - Early stopping at epoch 550. Best Metrics: (0.0026992122224678305, 0.0007183908045977011, 0.0017996498256274663)
2026-06-18 07:55:25,593 - optuna.study.study - INFO - Trial 193 finished with values: [0.0026992122224678305, 0.0007183908045977011, 0.0017996498256274663] and parameters: {'n_layers': 4, 'embedding_dim': 128, 'lr': 0.0019141832424539585, 'lambda_val': 0.003696601968741474, 'batch_size': 2942, 'optimizer': 'RMSprop'}.
2026-06-18 07:58:02,594 - optuna.study.study - INFO - Trial 194 finished with values: [0.001256682391059344, 0.0002794619173929519, 0.0006983293157901618] and parameters: {'n_layers': 3, 'embedding_dim': 32, 'lr': 0.00011455577696981535, 'lambda_val': 0.0006822884198672845, 'batch_size': 2287, 'optimizer': 'RMSprop'}.
2026-06-18 07:58:25,204 - experiment_functions - INFO - Early stopping at epoch 500. Best Metrics: (0.00038840051586108124, 9.157509157509159e-05, 0.00024089253247349134)
2026-06-18 07:58:25,330 - optuna.study.study - INFO - Trial 195 finished with values: [0.00038840051586108124, 9.157509157509159e-05, 0.00024089253247349134] and parameters: {'n_layers': 3, 'embedding_dim': 64, 'lr': 0.0037685849042605117, 'lambda_val': 1.8034594907965394e-06, 'batch_size': 2942, 'optimizer': 'SGD'}.
2026-06-18 07:58:47,286 - experiment_functions - INFO - Early stopping at epoch 500. Best Metrics: (0.0006821919413560455, 0.00014052039914108882, 0.0003598152404863859)
2026-06-18 07:58:47,359 - optuna.study.study - INFO - Trial 196 finished with values: [0.0006821919413560455, 0.00014052039914108882, 0.0003598152404863859] and parameters: {'n_layers': 2, 'embedding_dim': 64, 'lr': 0.0004894377864752034, 'lambda_val': 3.615242376833312e-06, 'batch_size': 3869, 'optimizer': 'SGD'}.
2026-06-18 07:59:48,934 - experiment_functions - INFO - Early stopping at epoch 1500. Best Metrics: (0.0032337167984706422, 0.0007689149930529242, 0.0020666161138431)
2026-06-18 07:59:49,022 - optuna.study.study - INFO - Trial 197 finished with values: [0.0032337167984706422, 0.0007689149930529242, 0.0020666161138431] and parameters: {'n_layers': 2, 'embedding_dim': 64, 'lr': 0.0009953418486928632, 'lambda_val': 0.0002692345705128242, 'batch_size': 2395, 'optimizer': 'RMSprop'}.
2026-06-18 08:00:13,356 - experiment_functions - INFO - Early stopping at epoch 550. Best Metrics: (0.0026000531225316087, 0.0006141846659088039, 0.0017132605192259418)
2026-06-18 08:00:13,447 - optuna.study.study - INFO - Trial 198 finished with values: [0.0026000531225316087, 0.0006141846659088039, 0.0017132605192259418] and parameters: {'n_layers': 2, 'embedding_dim': 64, 'lr': 0.003946985249188999, 'lambda_val': 0.002904451106658488, 'batch_size': 2395, 'optimizer': 'RMSprop'}.
2026-06-18 08:01:12,451 - experiment_functions - INFO - Early stopping at epoch 1300. Best Metrics: (0.0027940141392954, 0.0006757610205886069, 0.0018642351301369309)
2026-06-18 08:01:12,539 - optuna.study.study - INFO - Trial 199 finished with values: [0.0027940141392954, 0.0006757610205886069, 0.0018642351301369309] and parameters: {'n_layers': 1, 'embedding_dim': 256, 'lr': 0.0011084029372515364, 'lambda_val': 2.2848456976007116e-05, 'batch_size': 3565, 'optimizer': 'RMSprop'}.
2026-06-18 08:02:32,925 - experiment_functions - INFO - Early stopping at epoch 1700. Best Metrics: (0.0036868304201433553, 0.0009346974864216243, 0.0023219598687710145)
2026-06-18 08:02:32,997 - optuna.study.study - INFO - Trial 200 finished with values: [0.0036868304201433553, 0.0009346974864216243, 0.0023219598687710145] and parameters: {'n_layers': 4, 'embedding_dim': 128, 'lr': 0.0011084029372515364, 'lambda_val': 1.6639720416643942e-06, 'batch_size': 3565, 'optimizer': 'RMSprop'}.
2026-06-18 08:03:28,292 - experiment_functions - INFO - Early stopping at epoch 1250. Best Metrics: (0.002060567379280085, 0.0005605027156751295, 0.001364594646842138)
2026-06-18 08:03:28,424 - optuna.study.study - INFO - Trial 201 finished with values: [0.002060567379280085, 0.0005605027156751295, 0.001364594646842138] and parameters: {'n_layers': 2, 'embedding_dim': 128, 'lr': 0.0009840483225184993, 'lambda_val': 0.038001392007060666, 'batch_size': 655, 'optimizer': 'RMSprop'}.
2026-06-18 08:04:36,436 - experiment_functions - INFO - Early stopping at epoch 1650. Best Metrics: (0.004118941729167745, 0.0009836427939876216, 0.002674162792528084)
2026-06-18 08:04:36,522 - optuna.study.study - INFO - Trial 202 finished with values: [0.004118941729167745, 0.0009836427939876216, 0.002674162792528084] and parameters: {'n_layers': 3, 'embedding_dim': 32, 'lr': 0.0015135540286387189, 'lambda_val': 0.00021932042110835948, 'batch_size': 655, 'optimizer': 'RMSprop'}.
2026-06-18 08:05:16,430 - experiment_functions - INFO - Early stopping at epoch 700. Best Metrics: (0.0032067687335157777, 0.0008352279904004043, 0.001961692254529641)
2026-06-18 08:05:16,746 - optuna.study.study - INFO - Trial 203 finished with values: [0.0032067687335157777, 0.0008352279904004043, 0.001961692254529641] and parameters: {'n_layers': 4, 'embedding_dim': 256, 'lr': 0.0037685849042605117, 'lambda_val': 0.00029665726020447226, 'batch_size': 2159, 'optimizer': 'Adam'}.
2026-06-18 08:05:48,055 - experiment_functions - INFO - Early stopping at epoch 700. Best Metrics: (0.003633518082445665, 0.0008778577744094986, 0.0023207644248386876)
2026-06-18 08:05:48,148 - optuna.study.study - INFO - Trial 204 finished with values: [0.003633518082445665, 0.0008778577744094986, 0.0023207644248386876] and parameters: {'n_layers': 3, 'embedding_dim': 64, 'lr': 0.0037685849042605117, 'lambda_val': 0.00029665726020447226, 'batch_size': 655, 'optimizer': 'RMSprop'}.
2026-06-18 08:06:29,262 - experiment_functions - INFO - Early stopping at epoch 850. Best Metrics: (0.003425538411233274, 0.0008999621068586586, 0.002208595839742092)
2026-06-18 08:06:29,618 - optuna.study.study - INFO - Trial 205 finished with values: [0.003425538411233274, 0.0008999621068586586, 0.002208595839742092] and parameters: {'n_layers': 4, 'embedding_dim': 128, 'lr': 0.0019141832424539585, 'lambda_val': 1.5179554986144033e-05, 'batch_size': 2287, 'optimizer': 'RMSprop'}.
2026-06-18 08:06:55,257 - experiment_functions - INFO - Early stopping at epoch 500. Best Metrics: (0.0005437865271206503, 0.00011999494758115447, 0.0003103953820589896)
2026-06-18 08:06:55,371 - optuna.study.study - INFO - Trial 206 finished with values: [0.0005437865271206503, 0.00011999494758115447, 0.0003103953820589896] and parameters: {'n_layers': 4, 'embedding_dim': 128, 'lr': 0.00046996802016152644, 'lambda_val': 2.2848456976007116e-05, 'batch_size': 3080, 'optimizer': 'SGD'}.
2026-06-18 08:08:24,190 - experiment_functions - INFO - Early stopping at epoch 2100. Best Metrics: (0.0005586445471013018, 0.00014525704180876596, 0.0003105996674982677)
2026-06-18 08:08:24,282 - optuna.study.study - INFO - Trial 207 finished with values: [0.0005586445471013018, 0.00014525704180876596, 0.0003105996674982677] and parameters: {'n_layers': 3, 'embedding_dim': 64, 'lr': 2.3309209048881595e-05, 'lambda_val': 0.00029665726020447226, 'batch_size': 2514, 'optimizer': 'RMSprop'}.
2026-06-18 08:09:30,427 - experiment_functions - INFO - Early stopping at epoch 1550. Best Metrics: (0.003334211243220428, 0.0008399646330680814, 0.0022105548830839393)
2026-06-18 08:09:30,512 - optuna.study.study - INFO - Trial 208 finished with values: [0.003334211243220428, 0.0008399646330680814, 0.0022105548830839393] and parameters: {'n_layers': 3, 'embedding_dim': 64, 'lr': 0.0011084029372515364, 'lambda_val': 0.00016604057802743083, 'batch_size': 1892, 'optimizer': 'RMSprop'}.
2026-06-18 08:10:33,936 - experiment_functions - INFO - Early stopping at epoch 1500. Best Metrics: (0.0030420317231141746, 0.0007341796134899583, 0.0018284005065860951)
2026-06-18 08:10:34,019 - optuna.study.study - INFO - Trial 209 finished with values: [0.0030420317231141746, 0.0007341796134899583, 0.0018284005065860951] and parameters: {'n_layers': 2, 'embedding_dim': 64, 'lr': 0.0009840483225184993, 'lambda_val': 2.8201194811559927e-06, 'batch_size': 3565, 'optimizer': 'RMSprop'}.
2026-06-18 08:12:16,315 - experiment_functions - INFO - Early stopping at epoch 2350. Best Metrics: (0.0038636672240681654, 0.0009157509157509158, 0.0024852723142761326)
2026-06-18 08:12:16,398 - optuna.study.study - INFO - Trial 210 finished with values: [0.0038636672240681654, 0.0009157509157509158, 0.0024852723142761326] and parameters: {'n_layers': 2, 'embedding_dim': 128, 'lr': 0.0011084029372515364, 'lambda_val': 1.0560042497819773e-05, 'batch_size': 655, 'optimizer': 'RMSprop'}.
2026-06-18 08:13:39,991 - experiment_functions - INFO - Early stopping at epoch 1950. Best Metrics: (0.0027292239129106015, 0.0006710243779209297, 0.0017661325722291706)
2026-06-18 08:13:40,076 - optuna.study.study - INFO - Trial 211 finished with values: [0.0027292239129106015, 0.0006710243779209297, 0.0017661325722291706] and parameters: {'n_layers': 2, 'embedding_dim': 96, 'lr': 0.0011084029372515364, 'lambda_val': 5.6351144421947264e-05, 'batch_size': 2514, 'optimizer': 'Adam'}.
2026-06-18 08:15:33,604 - experiment_functions - INFO - Early stopping at epoch 2600. Best Metrics: (0.0037171037946050283, 0.0009094353921940128, 0.0024377446259761146)
2026-06-18 08:15:33,700 - optuna.study.study - INFO - Trial 212 finished with values: [0.0037171037946050283, 0.0009094353921940128, 0.0024377446259761146] and parameters: {'n_layers': 2, 'embedding_dim': 128, 'lr': 0.0009840483225184993, 'lambda_val': 1.4055284682631976e-05, 'batch_size': 655, 'optimizer': 'RMSprop'}.
2026-06-18 08:16:48,799 - experiment_functions - INFO - Early stopping at epoch 1650. Best Metrics: (0.003797773983149667, 0.0009473285335354301, 0.002363848946102109)
2026-06-18 08:16:48,864 - optuna.study.study - INFO - Trial 213 finished with values: [0.003797773983149667, 0.0009473285335354301, 0.002363848946102109] and parameters: {'n_layers': 3, 'embedding_dim': 128, 'lr': 0.0011084029372515364, 'lambda_val': 1.4055284682631976e-05, 'batch_size': 1892, 'optimizer': 'RMSprop'}.
2026-06-18 08:19:41,360 - experiment_functions - INFO - Early stopping at epoch 3750. Best Metrics: (0.0035138389105279747, 0.0009220664393078186, 0.002180137655947822)
2026-06-18 08:19:41,450 - optuna.study.study - INFO - Trial 214 finished with values: [0.0035138389105279747, 0.0009220664393078186, 0.002180137655947822] and parameters: {'n_layers': 4, 'embedding_dim': 128, 'lr': 0.00046996802016152644, 'lambda_val': 3.615242376833312e-06, 'batch_size': 3080, 'optimizer': 'RMSprop'}.
2026-06-18 08:20:08,427 - experiment_functions - INFO - Early stopping at epoch 600. Best Metrics: (0.003017234397001864, 0.0007120752810407982, 0.001859650796013191)
2026-06-18 08:20:08,518 - optuna.study.study - INFO - Trial 215 finished with values: [0.003017234397001864, 0.0007120752810407982, 0.001859650796013191] and parameters: {'n_layers': 4, 'embedding_dim': 32, 'lr': 0.0019141832424539585, 'lambda_val': 0.0045774991632739695, 'batch_size': 2942, 'optimizer': 'RMSprop'}.
2026-06-18 08:22:53,292 - experiment_functions - INFO - Early stopping at epoch 3950. Best Metrics: (0.0031445699515969994, 0.0007468106606037641, 0.0019736622862198826)
2026-06-18 08:22:53,381 - optuna.study.study - INFO - Trial 216 finished with values: [0.0031445699515969994, 0.0007468106606037641, 0.0019736622862198826] and parameters: {'n_layers': 3, 'embedding_dim': 64, 'lr': 0.00046996802016152644, 'lambda_val': 3.312997428241707e-05, 'batch_size': 2514, 'optimizer': 'Adam'}.
2026-06-18 08:24:41,856 - experiment_functions - INFO - Early stopping at epoch 2450. Best Metrics: (0.003051771090186843, 0.0007499684223822156, 0.0019207480287327704)
2026-06-18 08:24:41,943 - optuna.study.study - INFO - Trial 217 finished with values: [0.003051771090186843, 0.0007499684223822156, 0.0019207480287327704] and parameters: {'n_layers': 2, 'embedding_dim': 128, 'lr': 0.0009840483225184993, 'lambda_val': 0.0009339364864859292, 'batch_size': 845, 'optimizer': 'Adam'}.
2026-06-18 08:27:54,010 - optuna.study.study - INFO - Trial 218 finished with values: [0.003623213058590679, 0.0008620689655172414, 0.002264694175247069] and parameters: {'n_layers': 2, 'embedding_dim': 256, 'lr': 0.0004894377864752034, 'lambda_val': 1.4055284682631976e-05, 'batch_size': 895, 'optimizer': 'RMSprop'}.
2026-06-18 08:28:22,990 - experiment_functions - INFO - Early stopping at epoch 600. Best Metrics: (0.0028872135313232723, 0.0007704938739421498, 0.0018536391128680732)
2026-06-18 08:28:23,101 - optuna.study.study - INFO - Trial 219 finished with values: [0.0028872135313232723, 0.0007704938739421498, 0.0018536391128680732] and parameters: {'n_layers': 4, 'embedding_dim': 96, 'lr': 0.0037685849042605117, 'lambda_val': 0.00029665726020447226, 'batch_size': 2423, 'optimizer': 'RMSprop'}.
2026-06-18 08:31:11,595 - optuna.study.study - INFO - Trial 220 finished with values: [0.0036933955246045975, 0.0008447012757357586, 0.0023745458284615438] and parameters: {'n_layers': 3, 'embedding_dim': 64, 'lr': 0.00046996802016152644, 'lambda_val': 0.00029665726020447226, 'batch_size': 1806, 'optimizer': 'RMSprop'}.
2026-06-18 08:32:32,863 - experiment_functions - INFO - Early stopping at epoch 1950. Best Metrics: (0.004085516409249476, 0.0009946949602122018, 0.0027778053429704432)
2026-06-18 08:32:33,194 - optuna.study.study - INFO - Trial 221 finished with values: [0.004085516409249476, 0.0009946949602122018, 0.0027778053429704432] and parameters: {'n_layers': 4, 'embedding_dim': 32, 'lr': 0.001443380359422423, 'lambda_val': 2.6367594401190188e-05, 'batch_size': 655, 'optimizer': 'RMSprop'}.
2026-06-18 08:33:37,512 - experiment_functions - INFO - Early stopping at epoch 1150. Best Metrics: (0.003762235290742592, 0.0008952254641909815, 0.00221956737975583)
2026-06-18 08:33:37,627 - optuna.study.study - INFO - Trial 222 finished with values: [0.003762235290742592, 0.0008952254641909815, 0.00221956737975583] and parameters: {'n_layers': 4, 'embedding_dim': 256, 'lr': 0.0008273605807562151, 'lambda_val': 0.00020122391761600542, 'batch_size': 2287, 'optimizer': 'Adam'}.
2026-06-18 08:34:18,536 - experiment_functions - INFO - Early stopping at epoch 850. Best Metrics: (0.003455251200495702, 0.0008273335859542757, 0.0021511689524243453)
2026-06-18 08:34:18,875 - optuna.study.study - INFO - Trial 223 finished with values: [0.003455251200495702, 0.0008273335859542757, 0.0021511689524243453] and parameters: {'n_layers': 3, 'embedding_dim': 128, 'lr': 0.0037685849042605117, 'lambda_val': 1.4055284682631976e-05, 'batch_size': 1003, 'optimizer': 'Adam'}.
2026-06-18 08:36:22,558 - experiment_functions - INFO - Early stopping at epoch 2400. Best Metrics: (0.0032640562244328764, 0.0008683844890741443, 0.0020672661068611453)
