2026-06-22 01:09:48,100 - optuna.study.study - INFO - Trial 214 finished with values: [0.0006376854246021418, 0.00012631047113805733, 0.000354486730358812] and parameters: {'n_layers': 4, 'embedding_dim': 128, 'lr': 1.015292315920183e-05, 'lambda_val': 1.4463129473968207e-05, 'batch_size': 1658, 'optimizer': 'RMSprop'}.
2026-06-22 01:10:22,561 - experiment_functions - INFO - Early stopping at epoch 700. Best Metrics: (0.009734123345330959, 0.0024662119489705695, 0.005934906557864009)
2026-06-22 01:10:22,995 - optuna.study.study - INFO - Trial 215 finished with values: [0.009734123345330959, 0.0024662119489705695, 0.005934906557864009] and parameters: {'n_layers': 4, 'embedding_dim': 128, 'lr': 0.0016184592928403282, 'lambda_val': 1.637764938555515e-05, 'batch_size': 1925, 'optimizer': 'RMSprop'}.
2026-06-22 01:11:09,482 - experiment_functions - INFO - Early stopping at epoch 1000. Best Metrics: (0.010124032426983091, 0.0025088417329796643, 0.005986752700385948)
2026-06-22 01:11:09,555 - optuna.study.study - INFO - Trial 216 finished with values: [0.010124032426983091, 0.0025088417329796643, 0.005986752700385948] and parameters: {'n_layers': 3, 'embedding_dim': 128, 'lr': 0.0012526246054029107, 'lambda_val': 0.0003952312828567359, 'batch_size': 1429, 'optimizer': 'RMSprop'}.
2026-06-22 01:12:47,898 - experiment_functions - INFO - Early stopping at epoch 2400. Best Metrics: (0.011961619155265132, 0.0029351395730706077, 0.0071607370107449)
2026-06-22 01:12:47,972 - optuna.study.study - INFO - Trial 217 finished with values: [0.011961619155265132, 0.0029351395730706077, 0.0071607370107449] and parameters: {'n_layers': 4, 'embedding_dim': 32, 'lr': 0.000927601540662843, 'lambda_val': 1.1454689220118589e-06, 'batch_size': 2127, 'optimizer': 'RMSprop'}.
2026-06-22 01:15:07,121 - experiment_functions - INFO - Early stopping at epoch 3000. Best Metrics: (0.011424662949830012, 0.0027977769357079704, 0.006825739479143448)
2026-06-22 01:15:07,212 - optuna.study.study - INFO - Trial 218 finished with values: [0.011424662949830012, 0.0027977769357079704, 0.006825739479143448] and parameters: {'n_layers': 4, 'embedding_dim': 128, 'lr': 0.0008655839340917536, 'lambda_val': 0.0006522545928589743, 'batch_size': 576, 'optimizer': 'Adam'}.
2026-06-22 01:17:44,574 - optuna.study.study - INFO - Trial 219 finished with values: [0.007810628961803179, 0.0018441328786156373, 0.004783454578151294] and parameters: {'n_layers': 2, 'embedding_dim': 32, 'lr': 0.000927601540662843, 'lambda_val': 1.1454689220118589e-06, 'batch_size': 887, 'optimizer': 'RMSprop'}.
2026-06-22 01:18:24,992 - experiment_functions - INFO - Early stopping at epoch 950. Best Metrics: (0.009849562288631895, 0.0024456864974106356, 0.0058774863041606475)
2026-06-22 01:18:25,064 - optuna.study.study - INFO - Trial 220 finished with values: [0.009849562288631895, 0.0024456864974106356, 0.0058774863041606475] and parameters: {'n_layers': 4, 'embedding_dim': 32, 'lr': 0.0022550052450588096, 'lambda_val': 4.919667530385041e-05, 'batch_size': 1925, 'optimizer': 'RMSprop'}.
2026-06-22 01:18:49,115 - experiment_functions - INFO - Early stopping at epoch 550. Best Metrics: (0.002944736751406765, 0.0007357584943791841, 0.0018163291688101818)
2026-06-22 01:18:49,219 - optuna.study.study - INFO - Trial 221 finished with values: [0.002944736751406765, 0.0007357584943791841, 0.0018163291688101818] and parameters: {'n_layers': 4, 'embedding_dim': 32, 'lr': 0.021498556727925264, 'lambda_val': 0.0009695798239708334, 'batch_size': 1802, 'optimizer': 'RMSprop'}.
2026-06-22 01:19:45,845 - experiment_functions - INFO - Early stopping at epoch 1000. Best Metrics: (0.009966415382119202, 0.0025151572565365672, 0.005975831755562971)
2026-06-22 01:19:45,919 - optuna.study.study - INFO - Trial 222 finished with values: [0.009966415382119202, 0.0025151572565365672, 0.005975831755562971] and parameters: {'n_layers': 4, 'embedding_dim': 256, 'lr': 0.000927601540662843, 'lambda_val': 0.0005885182255384318, 'batch_size': 1169, 'optimizer': 'RMSprop'}.
2026-06-22 01:20:12,475 - experiment_functions - INFO - Early stopping at epoch 550. Best Metrics: (0.005599800389314236, 0.001428887204749274, 0.0032282761305025033)
2026-06-22 01:20:12,562 - optuna.study.study - INFO - Trial 223 finished with values: [0.005599800389314236, 0.001428887204749274, 0.0032282761305025033] and parameters: {'n_layers': 4, 'embedding_dim': 96, 'lr': 0.010330417614742037, 'lambda_val': 1.4463129473968207e-05, 'batch_size': 3404, 'optimizer': 'RMSprop'}.
2026-06-22 01:22:29,251 - experiment_functions - INFO - Early stopping at epoch 3350. Best Metrics: (0.012314904021008889, 0.003037766830870279, 0.007589250496531749)
2026-06-22 01:22:29,318 - optuna.study.study - INFO - Trial 224 finished with values: [0.012314904021008889, 0.003037766830870279, 0.007589250496531749] and parameters: {'n_layers': 4, 'embedding_dim': 32, 'lr': 0.0008655839340917536, 'lambda_val': 4.130883569433713e-05, 'batch_size': 1658, 'optimizer': 'RMSprop'}.
2026-06-22 01:25:08,139 - optuna.study.study - INFO - Trial 225 finished with values: [0.003790832021362863, 0.0009346974864216244, 0.002282775154136071] and parameters: {'n_layers': 3, 'embedding_dim': 32, 'lr': 0.00048272213080926245, 'lambda_val': 0.0051651330676565875, 'batch_size': 569, 'optimizer': 'Adam'}.
2026-06-22 01:26:12,817 - experiment_functions - INFO - Early stopping at epoch 1550. Best Metrics: (0.010677134151835578, 0.002674624226348364, 0.006665132531625255)
2026-06-22 01:26:12,888 - optuna.study.study - INFO - Trial 226 finished with values: [0.010677134151835578, 0.002674624226348364, 0.006665132531625255] and parameters: {'n_layers': 4, 'embedding_dim': 32, 'lr': 0.000927601540662843, 'lambda_val': 1.98886338816991e-06, 'batch_size': 3720, 'optimizer': 'RMSprop'}.
2026-06-22 01:28:48,344 - optuna.study.study - INFO - Trial 227 finished with values: [0.0012430504237546732, 0.0002557787040545662, 0.0007561134680666283] and parameters: {'n_layers': 2, 'embedding_dim': 32, 'lr': 0.00012147026747225786, 'lambda_val': 1.722399276566065e-05, 'batch_size': 3404, 'optimizer': 'RMSprop'}.
2026-06-22 01:30:04,806 - experiment_functions - INFO - Early stopping at epoch 1850. Best Metrics: (0.012774254536133156, 0.0031451307313376284, 0.007816587993765887)
2026-06-22 01:30:04,880 - optuna.study.study - INFO - Trial 228 finished with values: [0.012774254536133156, 0.0031451307313376284, 0.007816587993765887] and parameters: {'n_layers': 4, 'embedding_dim': 32, 'lr': 0.000927601540662843, 'lambda_val': 0.0009695798239708334, 'batch_size': 1802, 'optimizer': 'RMSprop'}.
2026-06-22 01:30:49,111 - experiment_functions - INFO - Early stopping at epoch 1000. Best Metrics: (0.010158010999551792, 0.0025625236832133385, 0.006069852617566638)
2026-06-22 01:30:49,195 - optuna.study.study - INFO - Trial 229 finished with values: [0.010158010999551792, 0.0025625236832133385, 0.006069852617566638] and parameters: {'n_layers': 4, 'embedding_dim': 64, 'lr': 0.000927601540662843, 'lambda_val': 0.00042920145544431403, 'batch_size': 3720, 'optimizer': 'RMSprop'}.
2026-06-22 01:31:33,413 - experiment_functions - INFO - Early stopping at epoch 1050. Best Metrics: (0.009011096888713313, 0.002305166098269547, 0.005426647492662013)
2026-06-22 01:31:33,489 - optuna.study.study - INFO - Trial 230 finished with values: [0.009011096888713313, 0.002305166098269547, 0.005426647492662013] and parameters: {'n_layers': 4, 'embedding_dim': 32, 'lr': 0.004480467424424265, 'lambda_val': 1.1454689220118589e-06, 'batch_size': 576, 'optimizer': 'RMSprop'}.
2026-06-22 01:32:23,084 - experiment_functions - INFO - Early stopping at epoch 1200. Best Metrics: (0.008907705232092635, 0.002120437034230138, 0.0055082618101119345)
2026-06-22 01:32:23,156 - optuna.study.study - INFO - Trial 231 finished with values: [0.008907705232092635, 0.002120437034230138, 0.0055082618101119345] and parameters: {'n_layers': 3, 'embedding_dim': 32, 'lr': 0.0018366951231135393, 'lambda_val': 0.0001313947543098742, 'batch_size': 2127, 'optimizer': 'Adam'}.
2026-06-22 01:33:40,921 - experiment_functions - INFO - Early stopping at epoch 1650. Best Metrics: (0.012988533635971035, 0.0031988126815713025, 0.00774571463234555)
2026-06-22 01:33:41,001 - optuna.study.study - INFO - Trial 232 finished with values: [0.012988533635971035, 0.0031988126815713025, 0.00774571463234555] and parameters: {'n_layers': 4, 'embedding_dim': 128, 'lr': 0.000927601540662843, 'lambda_val': 1.1454689220118589e-06, 'batch_size': 1169, 'optimizer': 'RMSprop'}.
2026-06-22 01:35:29,554 - experiment_functions - INFO - Early stopping at epoch 2650. Best Metrics: (0.012743044190248852, 0.0031309208033345965, 0.0076283489206219095)
2026-06-22 01:35:29,631 - optuna.study.study - INFO - Trial 233 finished with values: [0.012743044190248852, 0.0031309208033345965, 0.0076283489206219095] and parameters: {'n_layers': 4, 'embedding_dim': 32, 'lr': 0.000927601540662843, 'lambda_val': 1.1454689220118589e-06, 'batch_size': 1517, 'optimizer': 'RMSprop'}.
2026-06-22 01:38:14,605 - optuna.study.study - INFO - Trial 234 finished with values: [0.01208699510787141, 0.0029888215233042823, 0.007334563101672206] and parameters: {'n_layers': 4, 'embedding_dim': 32, 'lr': 0.0006084514258113753, 'lambda_val': 4.919667530385041e-05, 'batch_size': 2742, 'optimizer': 'RMSprop'}.
2026-06-22 01:39:11,402 - experiment_functions - INFO - Early stopping at epoch 1350. Best Metrics: (0.009991358984727217, 0.0024646330680813443, 0.006118230105631084)
2026-06-22 01:39:11,482 - optuna.study.study - INFO - Trial 235 finished with values: [0.009991358984727217, 0.0024646330680813443, 0.006118230105631084] and parameters: {'n_layers': 4, 'embedding_dim': 32, 'lr': 0.000927601540662843, 'lambda_val': 0.00042920145544431403, 'batch_size': 3720, 'optimizer': 'RMSprop'}.
2026-06-22 01:40:25,585 - experiment_functions - INFO - Early stopping at epoch 1750. Best Metrics: (0.011348666638861048, 0.0027677781988126814, 0.0067724838335714525)
2026-06-22 01:40:25,662 - optuna.study.study - INFO - Trial 236 finished with values: [0.011348666638861048, 0.0027677781988126814, 0.0067724838335714525] and parameters: {'n_layers': 3, 'embedding_dim': 32, 'lr': 0.0015833784127498205, 'lambda_val': 2.1806761428378598e-05, 'batch_size': 1389, 'optimizer': 'RMSprop'}.
2026-06-22 01:41:16,177 - experiment_functions - INFO - Early stopping at epoch 1150. Best Metrics: (0.010823009728194204, 0.0027914614121510675, 0.006518106197670424)
2026-06-22 01:41:16,254 - optuna.study.study - INFO - Trial 237 finished with values: [0.010823009728194204, 0.0027914614121510675, 0.006518106197670424] and parameters: {'n_layers': 4, 'embedding_dim': 32, 'lr': 0.0012526246054029107, 'lambda_val': 0.00652901288318178, 'batch_size': 835, 'optimizer': 'RMSprop'}.
2026-06-22 01:41:53,001 - experiment_functions - INFO - Early stopping at epoch 750. Best Metrics: (0.009144709552365309, 0.0023241126689402553, 0.005562668646354654)
2026-06-22 01:41:53,423 - optuna.study.study - INFO - Trial 238 finished with values: [0.009144709552365309, 0.0023241126689402553, 0.005562668646354654] and parameters: {'n_layers': 4, 'embedding_dim': 128, 'lr': 0.0011267070786255592, 'lambda_val': 0.0009695798239708334, 'batch_size': 3477, 'optimizer': 'RMSprop'}.
2026-06-22 01:42:18,453 - experiment_functions - INFO - Early stopping at epoch 500. Best Metrics: (0.0005414792467464191, 0.00011525830491347733, 0.0002804882141529137)
2026-06-22 01:42:18,557 - optuna.study.study - INFO - Trial 239 finished with values: [0.0005414792467464191, 0.00011525830491347733, 0.0002804882141529137] and parameters: {'n_layers': 4, 'embedding_dim': 128, 'lr': 0.00019999777599087655, 'lambda_val': 1.4463129473968207e-05, 'batch_size': 928, 'optimizer': 'SGD'}.
2026-06-22 01:43:22,725 - experiment_functions - INFO - Early stopping at epoch 1550. Best Metrics: (0.011970511602713781, 0.0029809271188581533, 0.0072796227150281004)
2026-06-22 01:43:22,797 - optuna.study.study - INFO - Trial 240 finished with values: [0.011970511602713781, 0.0029809271188581533, 0.0072796227150281004] and parameters: {'n_layers': 4, 'embedding_dim': 32, 'lr': 0.000927601540662843, 'lambda_val': 0.0011958935689814394, 'batch_size': 1931, 'optimizer': 'RMSprop'}.
2026-06-22 01:44:05,496 - experiment_functions - INFO - Early stopping at epoch 900. Best Metrics: (0.0006541809353981968, 0.0001199949475811545, 0.00031746092107369966)
2026-06-22 01:44:05,587 - optuna.study.study - INFO - Trial 241 finished with values: [0.0006541809353981968, 0.0001199949475811545, 0.00031746092107369966] and parameters: {'n_layers': 4, 'embedding_dim': 128, 'lr': 0.012285570203131627, 'lambda_val': 0.0008313022888502667, 'batch_size': 3404, 'optimizer': 'SGD'}.
2026-06-22 01:44:48,921 - experiment_functions - INFO - Early stopping at epoch 900. Best Metrics: (0.008761005941028396, 0.0022656940760389034, 0.005322806624954623)
2026-06-22 01:44:49,039 - optuna.study.study - INFO - Trial 242 finished with values: [0.008761005941028396, 0.0022656940760389034, 0.005322806624954623] and parameters: {'n_layers': 4, 'embedding_dim': 128, 'lr': 0.000927601540662843, 'lambda_val': 0.008048668420387728, 'batch_size': 835, 'optimizer': 'RMSprop'}.
2026-06-22 01:47:01,173 - experiment_functions - INFO - Early stopping at epoch 2950. Best Metrics: (0.015167976299194677, 0.0037024756852343066, 0.009442264246083793)
2026-06-22 01:47:01,259 - optuna.study.study - INFO - Trial 243 finished with values: [0.015167976299194677, 0.0037024756852343066, 0.009442264246083793] and parameters: {'n_layers': 4, 'embedding_dim': 96, 'lr': 0.0008655839340917536, 'lambda_val': 0.00014399990454015351, 'batch_size': 622, 'optimizer': 'RMSprop'}.
2026-06-22 01:47:45,475 - experiment_functions - INFO - Early stopping at epoch 1050. Best Metrics: (0.009329628364378516, 0.002314639383604901, 0.0057209801443853184)
2026-06-22 01:47:45,571 - optuna.study.study - INFO - Trial 244 finished with values: [0.009329628364378516, 0.002314639383604901, 0.0057209801443853184] and parameters: {'n_layers': 3, 'embedding_dim': 32, 'lr': 0.0013129918196144053, 'lambda_val': 0.0009695798239708334, 'batch_size': 2742, 'optimizer': 'RMSprop'}.
2026-06-22 01:49:36,425 - experiment_functions - INFO - Early stopping at epoch 2700. Best Metrics: (0.013495720471410715, 0.0032730200833649115, 0.008344610127794427)
2026-06-22 01:49:36,505 - optuna.study.study - INFO - Trial 245 finished with values: [0.013495720471410715, 0.0032730200833649115, 0.008344610127794427] and parameters: {'n_layers': 4, 'embedding_dim': 32, 'lr': 0.000927601540662843, 'lambda_val': 0.0009695798239708334, 'batch_size': 928, 'optimizer': 'RMSprop'}.
2026-06-22 01:50:08,604 - experiment_functions - INFO - Early stopping at epoch 550. Best Metrics: (0.005494339045172951, 0.0013152077807250223, 0.0030252849316687014)
2026-06-22 01:50:08,702 - optuna.study.study - INFO - Trial 246 finished with values: [0.005494339045172951, 0.0013152077807250223, 0.0030252849316687014] and parameters: {'n_layers': 4, 'embedding_dim': 256, 'lr': 0.0134117800775299, 'lambda_val': 4.919667530385041e-05, 'batch_size': 622, 'optimizer': 'RMSprop'}.
2026-06-22 01:51:27,050 - experiment_functions - INFO - Early stopping at epoch 1950. Best Metrics: (0.003906703522645364, 0.001087848932676519, 0.002504553282542608)
2026-06-22 01:51:27,133 - optuna.study.study - INFO - Trial 247 finished with values: [0.003906703522645364, 0.001087848932676519, 0.002504553282542608] and parameters: {'n_layers': 2, 'embedding_dim': 32, 'lr': 0.000927601540662843, 'lambda_val': 0.0714591669795956, 'batch_size': 1802, 'optimizer': 'RMSprop'}.
2026-06-22 01:52:19,147 - experiment_functions - INFO - Early stopping at epoch 1200. Best Metrics: (0.008308618877735065, 0.002020967538208918, 0.005034778920880375)
2026-06-22 01:52:19,227 - optuna.study.study - INFO - Trial 248 finished with values: [0.008308618877735065, 0.002020967538208918, 0.005034778920880375] and parameters: {'n_layers': 3, 'embedding_dim': 64, 'lr': 0.0012083421906459303, 'lambda_val': 1.1454689220118589e-06, 'batch_size': 3262, 'optimizer': 'Adam'}.
2026-06-22 01:52:41,040 - experiment_functions - INFO - Early stopping at epoch 500. Best Metrics: (0.0005621749938593188, 0.00012631047113805733, 0.00032680010190925504)
2026-06-22 01:52:41,132 - optuna.study.study - INFO - Trial 249 finished with values: [0.0005621749938593188, 0.00012631047113805733, 0.00032680010190925504] and parameters: {'n_layers': 3, 'embedding_dim': 32, 'lr': 0.0003717300238654293, 'lambda_val': 1.637764938555515e-05, 'batch_size': 2143, 'optimizer': 'SGD'}.
2026-06-22 01:54:12,827 - experiment_functions - INFO - Early stopping at epoch 1950. Best Metrics: (0.013794982693301946, 0.0033598585322723255, 0.008237946594601364)
2026-06-22 01:54:12,911 - optuna.study.study - INFO - Trial 250 finished with values: [0.013794982693301946, 0.0033598585322723255, 0.008237946594601364] and parameters: {'n_layers': 4, 'embedding_dim': 128, 'lr': 0.000927601540662843, 'lambda_val': 1.1454689220118589e-06, 'batch_size': 835, 'optimizer': 'RMSprop'}.
2026-06-22 01:55:28,655 - experiment_functions - INFO - Early stopping at epoch 1600. Best Metrics: (0.012539938333321095, 0.003094606542882405, 0.00741135366912563)
2026-06-22 01:55:28,739 - optuna.study.study - INFO - Trial 251 finished with values: [0.012539938333321095, 0.003094606542882405, 0.00741135366912563] and parameters: {'n_layers': 4, 'embedding_dim': 128, 'lr': 0.000927601540662843, 'lambda_val': 1.1454689220118589e-06, 'batch_size': 1169, 'optimizer': 'RMSprop'}.
2026-06-22 01:58:03,381 - optuna.study.study - INFO - Trial 252 finished with values: [0.004795861894787692, 0.001008904888215233, 0.002933095701760933] and parameters: {'n_layers': 1, 'embedding_dim': 32, 'lr': 0.0007483728360217162, 'lambda_val': 2.8743657747579593e-05, 'batch_size': 1429, 'optimizer': 'RMSprop'}.
2026-06-22 01:59:21,998 - experiment_functions - INFO - Early stopping at epoch 1900. Best Metrics: (0.012597602923442868, 0.003127763041556145, 0.007690812710826931)
2026-06-22 01:59:22,066 - optuna.study.study - INFO - Trial 253 finished with values: [0.012597602923442868, 0.003127763041556145, 0.007690812710826931] and parameters: {'n_layers': 4, 'embedding_dim': 32, 'lr': 0.000927601540662843, 'lambda_val': 1.1454689220118589e-06, 'batch_size': 2127, 'optimizer': 'RMSprop'}.
2026-06-22 02:02:06,315 - experiment_functions - INFO - Early stopping at epoch 3800. Best Metrics: (0.000507536422267074, 0.00013578375647341166, 0.0003205160909484168)
2026-06-22 02:02:06,405 - optuna.study.study - INFO - Trial 254 finished with values: [0.000507536422267074, 0.00013578375647341166, 0.0003205160909484168] and parameters: {'n_layers': 4, 'embedding_dim': 96, 'lr': 8.561146783057822e-05, 'lambda_val': 0.0007625737738675048, 'batch_size': 622, 'optimizer': 'RMSprop'}.
2026-06-22 02:03:12,575 - experiment_functions - INFO - Early stopping at epoch 1450. Best Metrics: (0.014310911550721691, 0.0034435392194012877, 0.008815389135442005)
2026-06-22 02:03:12,817 - optuna.study.study - INFO - Trial 255 finished with values: [0.014310911550721691, 0.0034435392194012877, 0.008815389135442005] and parameters: {'n_layers': 4, 'embedding_dim': 96, 'lr': 0.0012083421906459303, 'lambda_val': 1.4463129473968207e-05, 'batch_size': 622, 'optimizer': 'RMSprop'}.
2026-06-22 02:03:58,243 - experiment_functions - INFO - Early stopping at epoch 1100. Best Metrics: (0.005301884577687016, 0.0012299482127068335, 0.00328161455466429)
2026-06-22 02:03:58,335 - optuna.study.study - INFO - Trial 256 finished with values: [0.005301884577687016, 0.0012299482127068335, 0.00328161455466429] and parameters: {'n_layers': 1, 'embedding_dim': 64, 'lr': 0.0027542215402675064, 'lambda_val': 5.8186640478028525e-05, 'batch_size': 2085, 'optimizer': 'RMSprop'}.
2026-06-22 02:04:42,689 - experiment_functions - INFO - Early stopping at epoch 1000. Best Metrics: (0.010254831435154429, 0.0025593659214348872, 0.006218731526437235)
2026-06-22 02:04:42,774 - optuna.study.study - INFO - Trial 257 finished with values: [0.010254831435154429, 0.0025593659214348872, 0.006218731526437235] and parameters: {'n_layers': 4, 'embedding_dim': 64, 'lr': 0.000927601540662843, 'lambda_val': 0.00042920145544431403, 'batch_size': 3720, 'optimizer': 'RMSprop'}.
2026-06-22 02:05:10,277 - experiment_functions - INFO - Early stopping at epoch 550. Best Metrics: (0.005424100789653035, 0.0013846785398509537, 0.003276202901444079)
2026-06-22 02:05:10,411 - optuna.study.study - INFO - Trial 258 finished with values: [0.005424100789653035, 0.0013846785398509537, 0.003276202901444079] and parameters: {'n_layers': 4, 'embedding_dim': 128, 'lr': 0.019259114189388037, 'lambda_val': 1.1454689220118589e-06, 'batch_size': 928, 'optimizer': 'RMSprop'}.
2026-06-22 02:06:03,020 - experiment_functions - INFO - Early stopping at epoch 1100. Best Metrics: (0.011034991672757472, 0.002733042819249716, 0.006722103710105936)
2026-06-22 02:06:03,098 - optuna.study.study - INFO - Trial 259 finished with values: [0.011034991672757472, 0.002733042819249716, 0.006722103710105936] and parameters: {'n_layers': 4, 'embedding_dim': 128, 'lr': 0.000927601540662843, 'lambda_val': 1.1454689220118589e-06, 'batch_size': 2127, 'optimizer': 'RMSprop'}.
2026-06-22 02:06:25,007 - experiment_functions - INFO - Early stopping at epoch 500. Best Metrics: (0.0004001604284255677, 9.789061513199444e-05, 0.00021569760082283633)
2026-06-22 02:06:25,093 - optuna.study.study - INFO - Trial 260 finished with values: [0.0004001604284255677, 9.789061513199444e-05, 0.00021569760082283633] and parameters: {'n_layers': 4, 'embedding_dim': 32, 'lr': 0.0012526246054029107, 'lambda_val': 0.00652901288318178, 'batch_size': 928, 'optimizer': 'SGD'}.
2026-06-22 02:07:36,134 - experiment_functions - INFO - Early stopping at epoch 1500. Best Metrics: (0.01178010849736275, 0.0029888215233042823, 0.007095325665375203)
