2026-06-18 12:15:04,577 - optuna.study.study - INFO - Trial 68 finished with values: [0.0006690565361197513, 0.00014525704180876593, 0.00037184782681345436] and parameters: {'n_layers': 3, 'embedding_dim': 256, 'lr': 5.695189664311298e-05, 'lambda_val': 3.110588346589962e-05, 'batch_size': 1303, 'optimizer': 'SGD'}.
2026-06-18 12:15:36,350 - experiment_functions - INFO - Early stopping at epoch 750. Best Metrics: (0.002905969769810704, 0.0007041808765946697, 0.0018082888055750582)
2026-06-18 12:15:36,448 - optuna.study.study - INFO - Trial 69 finished with values: [0.002905969769810704, 0.0007041808765946697, 0.0018082888055750582] and parameters: {'n_layers': 4, 'embedding_dim': 32, 'lr': 0.003855829449851487, 'lambda_val': 2.9517437997373373e-06, 'batch_size': 2199, 'optimizer': 'Adam'}.
2026-06-18 12:16:49,949 - experiment_functions - INFO - Early stopping at epoch 1650. Best Metrics: (0.0005491125713981476, 0.0001373626373626374, 0.00032618131772624504)
2026-06-18 12:16:50,284 - optuna.study.study - INFO - Trial 70 finished with values: [0.0005491125713981476, 0.0001373626373626374, 0.00032618131772624504] and parameters: {'n_layers': 3, 'embedding_dim': 128, 'lr': 1.058459142524192e-05, 'lambda_val': 1.3344718493912024e-05, 'batch_size': 2839, 'optimizer': 'Adam'}.
2026-06-18 12:17:20,129 - experiment_functions - INFO - Early stopping at epoch 550. Best Metrics: (0.0024642632519838534, 0.0006647088543640269, 0.0016521649898480254)
2026-06-18 12:17:20,214 - optuna.study.study - INFO - Trial 71 finished with values: [0.0024642632519838534, 0.0006647088543640269, 0.0016521649898480254] and parameters: {'n_layers': 3, 'embedding_dim': 256, 'lr': 0.07625802966647915, 'lambda_val': 5.672639985302811e-06, 'batch_size': 3659, 'optimizer': 'Adam'}.
2026-06-18 12:18:00,863 - experiment_functions - INFO - Early stopping at epoch 950. Best Metrics: (0.002654892353934096, 0.0006426045219148666, 0.0017136000083926705)
2026-06-18 12:18:00,975 - optuna.study.study - INFO - Trial 72 finished with values: [0.002654892353934096, 0.0006426045219148666, 0.0017136000083926705] and parameters: {'n_layers': 1, 'embedding_dim': 128, 'lr': 0.0016391721585660463, 'lambda_val': 0.0015359029367627384, 'batch_size': 2199, 'optimizer': 'Adam'}.
2026-06-18 12:18:53,705 - experiment_functions - INFO - Early stopping at epoch 1300. Best Metrics: (0.004171805505883136, 0.0009157509157509158, 0.0024893781027197056)
2026-06-18 12:18:54,040 - optuna.study.study - INFO - Trial 73 finished with values: [0.004171805505883136, 0.0009157509157509158, 0.0024893781027197056] and parameters: {'n_layers': 3, 'embedding_dim': 32, 'lr': 0.001229746147020764, 'lambda_val': 2.7945521753203373e-05, 'batch_size': 1789, 'optimizer': 'RMSprop'}.
2026-06-18 12:22:12,853 - optuna.study.study - INFO - Trial 74 finished with values: [0.0012111164572608936, 0.00027314639383604905, 0.0007612883196188875] and parameters: {'n_layers': 3, 'embedding_dim': 256, 'lr': 0.0001578689726353281, 'lambda_val': 1.7089177370137862e-06, 'batch_size': 801, 'optimizer': 'Adam'}.
2026-06-18 12:24:50,545 - optuna.study.study - INFO - Trial 75 finished with values: [0.0011509592788572626, 0.0002889352027283062, 0.0007163163452805291] and parameters: {'n_layers': 4, 'embedding_dim': 32, 'lr': 0.0001408952344319084, 'lambda_val': 0.02642098205161091, 'batch_size': 3312, 'optimizer': 'RMSprop'}.
2026-06-18 12:25:24,702 - experiment_functions - INFO - Early stopping at epoch 600. Best Metrics: (0.0029645803980020875, 0.0008178603006189213, 0.0018534468435417871)
2026-06-18 12:25:24,787 - optuna.study.study - INFO - Trial 76 finished with values: [0.0029645803980020875, 0.0008178603006189213, 0.0018534468435417871] and parameters: {'n_layers': 4, 'embedding_dim': 256, 'lr': 0.01251000483486688, 'lambda_val': 5.672639985302811e-06, 'batch_size': 3023, 'optimizer': 'Adam'}.
2026-06-18 12:28:20,314 - optuna.study.study - INFO - Trial 77 finished with values: [0.001887067163996731, 0.00044050776809397495, 0.0011856540456332543] and parameters: {'n_layers': 1, 'embedding_dim': 256, 'lr': 0.0002937638720497697, 'lambda_val': 0.00255086578537524, 'batch_size': 1294, 'optimizer': 'Adam'}.
2026-06-18 12:29:22,701 - experiment_functions - INFO - Early stopping at epoch 1300. Best Metrics: (0.0027768839697907242, 0.0007704938739421499, 0.0018620905542109838)
2026-06-18 12:29:22,884 - optuna.study.study - INFO - Trial 78 finished with values: [0.0027768839697907242, 0.0007704938739421499, 0.0018620905542109838] and parameters: {'n_layers': 2, 'embedding_dim': 256, 'lr': 0.0020795989989061993, 'lambda_val': 5.672639985302811e-06, 'batch_size': 3659, 'optimizer': 'RMSprop'}.
2026-06-18 12:32:18,499 - optuna.study.study - INFO - Trial 79 finished with values: [0.0013367972846351495, 0.0002826196791714033, 0.0007752881243176255] and parameters: {'n_layers': 1, 'embedding_dim': 256, 'lr': 0.0001578689726353281, 'lambda_val': 0.004447109933745729, 'batch_size': 1842, 'optimizer': 'Adam'}.
2026-06-18 12:32:55,202 - experiment_functions - INFO - Early stopping at epoch 900. Best Metrics: (0.003576585781504688, 0.0007231274472653784, 0.0020790307916312293)
2026-06-18 12:32:55,527 - optuna.study.study - INFO - Trial 80 finished with values: [0.003576585781504688, 0.0007231274472653784, 0.0020790307916312293] and parameters: {'n_layers': 1, 'embedding_dim': 32, 'lr': 0.002487565347422212, 'lambda_val': 1.3344718493912024e-05, 'batch_size': 892, 'optimizer': 'Adam'}.
2026-06-18 12:34:20,470 - experiment_functions - INFO - Early stopping at epoch 1850. Best Metrics: (0.0033733072020502666, 0.0008731211317418214, 0.0021095860658702933)
2026-06-18 12:34:20,790 - optuna.study.study - INFO - Trial 81 finished with values: [0.0033733072020502666, 0.0008731211317418214, 0.0021095860658702933] and parameters: {'n_layers': 4, 'embedding_dim': 128, 'lr': 0.0010214376144180076, 'lambda_val': 1.455259422316608e-06, 'batch_size': 2863, 'optimizer': 'RMSprop'}.
2026-06-18 12:35:17,030 - experiment_functions - INFO - Early stopping at epoch 1250. Best Metrics: (0.0007023065833476391, 0.00015630920803334596, 0.0003730553959198751)
2026-06-18 12:35:17,125 - optuna.study.study - INFO - Trial 82 finished with values: [0.0007023065833476391, 0.00015630920803334596, 0.0003730553959198751] and parameters: {'n_layers': 3, 'embedding_dim': 128, 'lr': 1.5184401257502543e-05, 'lambda_val': 0.0008207976130822219, 'batch_size': 3364, 'optimizer': 'RMSprop'}.
2026-06-18 12:36:08,523 - experiment_functions - INFO - Early stopping at epoch 1100. Best Metrics: (0.0021536479274666094, 0.0006236579512441581, 0.0014018870682853438)
2026-06-18 12:36:08,629 - optuna.study.study - INFO - Trial 83 finished with values: [0.0021536479274666094, 0.0006236579512441581, 0.0014018870682853438] and parameters: {'n_layers': 4, 'embedding_dim': 128, 'lr': 0.0005796526912711289, 'lambda_val': 0.0630353277713049, 'batch_size': 3659, 'optimizer': 'RMSprop'}.
2026-06-18 12:36:34,662 - experiment_functions - INFO - Early stopping at epoch 550. Best Metrics: (0.0026658261290187914, 0.0007120752810407984, 0.0017577208054695304)
2026-06-18 12:36:35,000 - optuna.study.study - INFO - Trial 84 finished with values: [0.0026658261290187914, 0.0007120752810407984, 0.0017577208054695304] and parameters: {'n_layers': 3, 'embedding_dim': 128, 'lr': 0.05395674460341747, 'lambda_val': 1.609940959377078e-06, 'batch_size': 1380, 'optimizer': 'Adam'}.
2026-06-18 12:37:03,177 - experiment_functions - INFO - Early stopping at epoch 500. Best Metrics: (0.0007485844611147971, 0.00016262473159024882, 0.00039041266734841565)
2026-06-18 12:37:03,274 - optuna.study.study - INFO - Trial 85 finished with values: [0.0007485844611147971, 0.00016262473159024882, 0.00039041266734841565] and parameters: {'n_layers': 4, 'embedding_dim': 256, 'lr': 0.026361162255658658, 'lambda_val': 9.43829822749537e-06, 'batch_size': 3715, 'optimizer': 'SGD'}.
2026-06-18 12:37:26,817 - experiment_functions - INFO - Early stopping at epoch 500. Best Metrics: (0.0004816314358459491, 0.0001294682329165088, 0.00027533495439446696)
2026-06-18 12:37:27,136 - optuna.study.study - INFO - Trial 86 finished with values: [0.0004816314358459491, 0.0001294682329165088, 0.00027533495439446696] and parameters: {'n_layers': 4, 'embedding_dim': 96, 'lr': 0.01122024403638141, 'lambda_val': 1.1234571578444802e-06, 'batch_size': 3542, 'optimizer': 'SGD'}.
2026-06-18 12:37:56,635 - experiment_functions - INFO - Early stopping at epoch 500. Best Metrics: (0.0017419408680631595, 0.000479979790324618, 0.0012602769704928053)
2026-06-18 12:37:56,972 - optuna.study.study - INFO - Trial 87 finished with values: [0.0017419408680631595, 0.000479979790324618, 0.0012602769704928053] and parameters: {'n_layers': 4, 'embedding_dim': 256, 'lr': 0.07625802966647915, 'lambda_val': 0.0002242309033471428, 'batch_size': 3715, 'optimizer': 'RMSprop'}.
2026-06-18 12:38:23,033 - experiment_functions - INFO - Early stopping at epoch 600. Best Metrics: (0.0023582532066471935, 0.0005636604774535809, 0.0014506851679651459)
2026-06-18 12:38:23,140 - optuna.study.study - INFO - Trial 88 finished with values: [0.0023582532066471935, 0.0005636604774535809, 0.0014506851679651459] and parameters: {'n_layers': 1, 'embedding_dim': 96, 'lr': 0.015482238843201098, 'lambda_val': 1.985287273092694e-06, 'batch_size': 1836, 'optimizer': 'RMSprop'}.
2026-06-18 12:40:36,944 - experiment_functions - INFO - Early stopping at epoch 2700. Best Metrics: (0.0006656494260927304, 0.0001468359226979917, 0.00035933617174551964)
2026-06-18 12:40:37,266 - optuna.study.study - INFO - Trial 89 finished with values: [0.0006656494260927304, 0.0001468359226979917, 0.00035933617174551964] and parameters: {'n_layers': 3, 'embedding_dim': 256, 'lr': 1.058459142524192e-05, 'lambda_val': 1.609940959377078e-06, 'batch_size': 2839, 'optimizer': 'RMSprop'}.
2026-06-18 12:42:05,493 - experiment_functions - INFO - Early stopping at epoch 2050. Best Metrics: (0.002766454152118484, 0.0006315523556902869, 0.0017025218543281683)
2026-06-18 12:42:05,819 - optuna.study.study - INFO - Trial 90 finished with values: [0.002766454152118484, 0.0006315523556902869, 0.0017025218543281683] and parameters: {'n_layers': 1, 'embedding_dim': 128, 'lr': 0.0013472245469264425, 'lambda_val': 1.0687219886452036e-06, 'batch_size': 2877, 'optimizer': 'Adam'}.
2026-06-18 12:42:46,949 - experiment_functions - INFO - Early stopping at epoch 950. Best Metrics: (0.0026045245311838807, 0.0005826070481242895, 0.001669244080520244)
2026-06-18 12:42:47,033 - optuna.study.study - INFO - Trial 91 finished with values: [0.0026045245311838807, 0.0005826070481242895, 0.001669244080520244] and parameters: {'n_layers': 1, 'embedding_dim': 96, 'lr': 0.0020795989989061993, 'lambda_val': 1.3344718493912024e-05, 'batch_size': 2204, 'optimizer': 'Adam'}.
2026-06-18 12:45:38,082 - optuna.study.study - INFO - Trial 92 finished with values: [0.0009116453634678937, 0.00019893899204244034, 0.0005151001468419298] and parameters: {'n_layers': 3, 'embedding_dim': 96, 'lr': 7.99249422020523e-05, 'lambda_val': 4.779360250664825e-06, 'batch_size': 1303, 'optimizer': 'RMSprop'}.
2026-06-18 12:46:39,478 - experiment_functions - INFO - Early stopping at epoch 1500. Best Metrics: (0.0004859275026081543, 0.00011999494758115447, 0.00028093988588099553)
2026-06-18 12:46:39,800 - optuna.study.study - INFO - Trial 93 finished with values: [0.0004859275026081543, 0.00011999494758115447, 0.00028093988588099553] and parameters: {'n_layers': 4, 'embedding_dim': 32, 'lr': 0.07625802966647915, 'lambda_val': 1.7207190252326257e-06, 'batch_size': 2420, 'optimizer': 'SGD'}.
2026-06-18 12:47:14,244 - experiment_functions - INFO - Early stopping at epoch 800. Best Metrics: (0.003016309725731311, 0.0006962864721485412, 0.0018936595840008462)
2026-06-18 12:47:14,608 - optuna.study.study - INFO - Trial 94 finished with values: [0.003016309725731311, 0.0006962864721485412, 0.0018936595840008462] and parameters: {'n_layers': 1, 'embedding_dim': 96, 'lr': 0.0014625528771019128, 'lambda_val': 0.0015359029367627384, 'batch_size': 1836, 'optimizer': 'RMSprop'}.
2026-06-18 12:47:42,932 - experiment_functions - INFO - Early stopping at epoch 500. Best Metrics: (0.0005830382227108899, 0.00013262599469496023, 0.0002882870619031576)
2026-06-18 12:47:43,022 - optuna.study.study - INFO - Trial 95 finished with values: [0.0005830382227108899, 0.00013262599469496023, 0.0002882870619031576] and parameters: {'n_layers': 2, 'embedding_dim': 96, 'lr': 0.00014551582421006617, 'lambda_val': 0.0008918720236634279, 'batch_size': 2204, 'optimizer': 'SGD'}.
2026-06-18 12:48:11,283 - experiment_functions - INFO - Early stopping at epoch 500. Best Metrics: (0.0007265650814688466, 0.00014367816091954023, 0.00037054874365171156)
2026-06-18 12:48:11,393 - optuna.study.study - INFO - Trial 96 finished with values: [0.0007265650814688466, 0.00014367816091954023, 0.00037054874365171156] and parameters: {'n_layers': 4, 'embedding_dim': 256, 'lr': 0.003307811671556655, 'lambda_val': 0.016234849402188063, 'batch_size': 2731, 'optimizer': 'SGD'}.
2026-06-18 12:49:44,548 - experiment_functions - INFO - Early stopping at epoch 2050. Best Metrics: (0.0020065503638128186, 0.0006015536187949981, 0.0012651544074302851)
2026-06-18 12:49:44,646 - optuna.study.study - INFO - Trial 97 finished with values: [0.0020065503638128186, 0.0006015536187949981, 0.0012651544074302851] and parameters: {'n_layers': 1, 'embedding_dim': 256, 'lr': 0.045437787793070616, 'lambda_val': 0.0024400973698213446, 'batch_size': 1836, 'optimizer': 'Adam'}.
2026-06-18 12:50:07,111 - experiment_functions - INFO - Early stopping at epoch 500. Best Metrics: (0.0004341751684875795, 9.789061513199444e-05, 0.00021253899697263972)
2026-06-18 12:50:07,206 - optuna.study.study - INFO - Trial 98 finished with values: [0.0004341751684875795, 9.789061513199444e-05, 0.00021253899697263972] and parameters: {'n_layers': 2, 'embedding_dim': 96, 'lr': 0.003307811671556655, 'lambda_val': 1.0819711188161646e-06, 'batch_size': 2731, 'optimizer': 'SGD'}.
2026-06-18 12:50:33,885 - experiment_functions - INFO - Early stopping at epoch 500. Best Metrics: (0.0004875242997650103, 0.00010262725779967159, 0.0002681843159562736)
2026-06-18 12:50:34,222 - optuna.study.study - INFO - Trial 99 finished with values: [0.0004875242997650103, 0.00010262725779967159, 0.0002681843159562736] and parameters: {'n_layers': 3, 'embedding_dim': 256, 'lr': 0.0039744934290608215, 'lambda_val': 1.0687219886452036e-06, 'batch_size': 2877, 'optimizer': 'SGD'}.
2026-06-18 12:51:02,386 - experiment_functions - INFO - Early stopping at epoch 500. Best Metrics: (0.0005356485838220282, 0.00011683718580270304, 0.00028754541347544274)
2026-06-18 12:51:02,490 - optuna.study.study - INFO - Trial 100 finished with values: [0.0005356485838220282, 0.00011683718580270304, 0.00028754541347544274] and parameters: {'n_layers': 4, 'embedding_dim': 256, 'lr': 0.045437787793070616, 'lambda_val': 0.0002933809272418897, 'batch_size': 3979, 'optimizer': 'SGD'}.
2026-06-18 12:51:33,928 - experiment_functions - INFO - Early stopping at epoch 550. Best Metrics: (0.0020068520196616486, 0.0005841859290135152, 0.0013076709044428031)
2026-06-18 12:51:34,045 - optuna.study.study - INFO - Trial 101 finished with values: [0.0020068520196616486, 0.0005841859290135152, 0.0013076709044428031] and parameters: {'n_layers': 4, 'embedding_dim': 256, 'lr': 0.028896321326281296, 'lambda_val': 0.0015636957707602223, 'batch_size': 2731, 'optimizer': 'Adam'}.
2026-06-18 12:51:57,942 - experiment_functions - INFO - Early stopping at epoch 550. Best Metrics: (0.002424139755872313, 0.0005778704054566124, 0.0014639683723518592)
2026-06-18 12:51:58,035 - optuna.study.study - INFO - Trial 102 finished with values: [0.002424139755872313, 0.0005778704054566124, 0.0014639683723518592] and parameters: {'n_layers': 1, 'embedding_dim': 64, 'lr': 0.01251000483486688, 'lambda_val': 0.0015359029367627384, 'batch_size': 3023, 'optimizer': 'Adam'}.
2026-06-18 12:52:58,547 - experiment_functions - INFO - Early stopping at epoch 1050. Best Metrics: (0.003492039467753656, 0.000909435392194013, 0.002230533062588838)
2026-06-18 12:52:58,643 - optuna.study.study - INFO - Trial 103 finished with values: [0.003492039467753656, 0.000909435392194013, 0.002230533062588838] and parameters: {'n_layers': 4, 'embedding_dim': 256, 'lr': 0.002487565347422212, 'lambda_val': 5.672639985302811e-06, 'batch_size': 892, 'optimizer': 'RMSprop'}.
2026-06-18 12:53:50,551 - experiment_functions - INFO - Early stopping at epoch 950. Best Metrics: (0.00286009839649563, 0.0007847038019451813, 0.001783180431304494)
2026-06-18 12:53:50,865 - optuna.study.study - INFO - Trial 104 finished with values: [0.00286009839649563, 0.0007847038019451813, 0.001783180431304494] and parameters: {'n_layers': 4, 'embedding_dim': 256, 'lr': 0.0005796526912711289, 'lambda_val': 0.0015636957707602223, 'batch_size': 3659, 'optimizer': 'RMSprop'}.
2026-06-18 12:54:53,725 - experiment_functions - INFO - Early stopping at epoch 1300. Best Metrics: (0.003075132812875343, 0.0007799671592775042, 0.0019536861017819323)
2026-06-18 12:54:53,836 - optuna.study.study - INFO - Trial 105 finished with values: [0.003075132812875343, 0.0007799671592775042, 0.0019536861017819323] and parameters: {'n_layers': 2, 'embedding_dim': 256, 'lr': 0.0025439982760106436, 'lambda_val': 3.555884843874079e-05, 'batch_size': 801, 'optimizer': 'Adam'}.
2026-06-18 12:55:25,456 - experiment_functions - INFO - Early stopping at epoch 750. Best Metrics: (0.002960264261935188, 0.000702601995705444, 0.001820504641082506)
2026-06-18 12:55:25,570 - optuna.study.study - INFO - Trial 106 finished with values: [0.002960264261935188, 0.000702601995705444, 0.001820504641082506] and parameters: {'n_layers': 3, 'embedding_dim': 32, 'lr': 0.002487565347422212, 'lambda_val': 0.006312555433463844, 'batch_size': 1032, 'optimizer': 'Adam'}.
2026-06-18 12:55:57,202 - experiment_functions - INFO - Early stopping at epoch 750. Best Metrics: (0.002927920254473722, 0.0006868131868131869, 0.0018548416718182808)
2026-06-18 12:55:57,303 - optuna.study.study - INFO - Trial 107 finished with values: [0.002927920254473722, 0.0006868131868131869, 0.0018548416718182808] and parameters: {'n_layers': 4, 'embedding_dim': 32, 'lr': 0.003855829449851487, 'lambda_val': 5.944742253199812e-05, 'batch_size': 2199, 'optimizer': 'Adam'}.
2026-06-18 12:56:50,348 - experiment_functions - INFO - Early stopping at epoch 1250. Best Metrics: (0.0034174865125621333, 0.0007689149930529242, 0.0020921069805314926)
2026-06-18 12:56:50,454 - optuna.study.study - INFO - Trial 108 finished with values: [0.0034174865125621333, 0.0007689149930529242, 0.0020921069805314926] and parameters: {'n_layers': 2, 'embedding_dim': 96, 'lr': 0.0010554246980588387, 'lambda_val': 0.00022507006239543383, 'batch_size': 2284, 'optimizer': 'RMSprop'}.
2026-06-18 12:57:17,036 - experiment_functions - INFO - Early stopping at epoch 600. Best Metrics: (0.002958059961793394, 0.0007199696854869268, 0.0018833452925036333)
2026-06-18 12:57:17,142 - optuna.study.study - INFO - Trial 109 finished with values: [0.002958059961793394, 0.0007199696854869268, 0.0018833452925036333] and parameters: {'n_layers': 3, 'embedding_dim': 64, 'lr': 0.0035939494204294854, 'lambda_val': 6.182125492774287e-05, 'batch_size': 3533, 'optimizer': 'RMSprop'}.
2026-06-18 12:57:39,061 - experiment_functions - INFO - Early stopping at epoch 500. Best Metrics: (0.0007237987643226885, 0.00015630920803334596, 0.00038607461590272756)
2026-06-18 12:57:39,168 - optuna.study.study - INFO - Trial 110 finished with values: [0.0007237987643226885, 0.00015630920803334596, 0.00038607461590272756] and parameters: {'n_layers': 2, 'embedding_dim': 64, 'lr': 0.00047567874216326714, 'lambda_val': 1.455259422316608e-06, 'batch_size': 2404, 'optimizer': 'SGD'}.
2026-06-18 12:59:01,658 - experiment_functions - INFO - Early stopping at epoch 1800. Best Metrics: (0.0033152237648851573, 0.0008304913477327272, 0.00210669606792088)
2026-06-18 12:59:01,735 - optuna.study.study - INFO - Trial 111 finished with values: [0.0033152237648851573, 0.0008304913477327272, 0.00210669606792088] and parameters: {'n_layers': 4, 'embedding_dim': 128, 'lr': 0.00054735960254125, 'lambda_val': 9.43829822749537e-06, 'batch_size': 3005, 'optimizer': 'Adam'}.
2026-06-18 12:59:31,982 - experiment_functions - INFO - Early stopping at epoch 650. Best Metrics: (0.0028639407901649037, 0.0007499684223822156, 0.0017882133894454725)
2026-06-18 12:59:32,309 - optuna.study.study - INFO - Trial 112 finished with values: [0.0028639407901649037, 0.0007499684223822156, 0.0017882133894454725] and parameters: {'n_layers': 4, 'embedding_dim': 96, 'lr': 0.003855829449851487, 'lambda_val': 0.0077338006536645095, 'batch_size': 649, 'optimizer': 'Adam'}.
2026-06-18 13:00:01,517 - experiment_functions - INFO - Early stopping at epoch 700. Best Metrics: (0.003403799564697006, 0.0007026019957054441, 0.002037059322315605)
2026-06-18 13:00:01,621 - optuna.study.study - INFO - Trial 113 finished with values: [0.003403799564697006, 0.0007026019957054441, 0.002037059322315605] and parameters: {'n_layers': 1, 'embedding_dim': 32, 'lr': 0.003855829449851487, 'lambda_val': 2.9517437997373373e-06, 'batch_size': 1541, 'optimizer': 'Adam'}.
2026-06-18 13:00:31,893 - experiment_functions - INFO - Early stopping at epoch 700. Best Metrics: (0.0032841119861213366, 0.0007420740179360869, 0.001974576515723861)
2026-06-18 13:00:31,978 - optuna.study.study - INFO - Trial 114 finished with values: [0.0032841119861213366, 0.0007420740179360869, 0.001974576515723861] and parameters: {'n_layers': 4, 'embedding_dim': 32, 'lr': 0.003855829449851487, 'lambda_val': 1.3344718493912024e-05, 'batch_size': 892, 'optimizer': 'Adam'}.
2026-06-18 13:02:01,366 - experiment_functions - INFO - Early stopping at epoch 2050. Best Metrics: (0.002698871700158115, 0.0006868131868131869, 0.0017958394574376568)
