2026-06-19 08:21:32,564 - optuna.study.study - INFO - Trial 117 finished with values: [0.030005938631330213, 0.006201844132878617, 0.016811322871587868] and parameters: {'n_layers': 2, 'embedding_dim': 128, 'lr': 0.000670518483727842, 'lambda_val': 0.0001469242914477015, 'batch_size': 2427, 'optimizer': 'Adam'}.
2026-06-19 08:22:19,004 - experiment_functions - INFO - Early stopping at epoch 950. Best Metrics: (0.012319580141814264, 0.0025498926360995326, 0.006826224220832867)
2026-06-19 08:22:19,093 - optuna.study.study - INFO - Trial 118 finished with values: [0.012319580141814264, 0.0025498926360995326, 0.006826224220832867] and parameters: {'n_layers': 2, 'embedding_dim': 128, 'lr': 0.0045010260516877044, 'lambda_val': 4.652725797139409e-06, 'batch_size': 3835, 'optimizer': 'RMSprop'}.
2026-06-19 08:25:34,617 - optuna.study.study - INFO - Trial 119 finished with values: [0.0006630612413529197, 0.0001689402551471517, 0.00039766543653697986] and parameters: {'n_layers': 1, 'embedding_dim': 256, 'lr': 0.0001990361776208755, 'lambda_val': 1.3063371603281255e-06, 'batch_size': 1875, 'optimizer': 'Adam'}.
2026-06-19 08:26:54,118 - experiment_functions - INFO - Early stopping at epoch 1200. Best Metrics: (0.015125273938457657, 0.0031167108753315646, 0.008432307986512979)
2026-06-19 08:26:54,253 - optuna.study.study - INFO - Trial 120 finished with values: [0.015125273938457657, 0.0031167108753315646, 0.008432307986512979] and parameters: {'n_layers': 4, 'embedding_dim': 256, 'lr': 0.0008520784697548674, 'lambda_val': 2.013346843188833e-05, 'batch_size': 1839, 'optimizer': 'RMSprop'}.
2026-06-19 08:27:22,906 - experiment_functions - INFO - Early stopping at epoch 550. Best Metrics: (0.005060332458007344, 0.0011178476695718077, 0.00289836362590523)
2026-06-19 08:27:23,006 - optuna.study.study - INFO - Trial 121 finished with values: [0.005060332458007344, 0.0011178476695718077, 0.00289836362590523] and parameters: {'n_layers': 2, 'embedding_dim': 128, 'lr': 0.02808678637032688, 'lambda_val': 0.0082855773038374, 'batch_size': 1312, 'optimizer': 'Adam'}.
2026-06-19 08:27:49,920 - experiment_functions - INFO - Early stopping at epoch 550. Best Metrics: (0.004211579403870048, 0.0009078565113047873, 0.0024704961165589305)
2026-06-19 08:27:50,009 - optuna.study.study - INFO - Trial 122 finished with values: [0.004211579403870048, 0.0009078565113047873, 0.0024704961165589305] and parameters: {'n_layers': 2, 'embedding_dim': 64, 'lr': 0.049960469253932695, 'lambda_val': 9.873205377622859e-06, 'batch_size': 3852, 'optimizer': 'RMSprop'}.
2026-06-19 08:30:54,189 - optuna.study.study - INFO - Trial 123 finished with values: [0.00845349575790926, 0.0021093848680055574, 0.004830628621799745] and parameters: {'n_layers': 2, 'embedding_dim': 96, 'lr': 0.00020897019229325828, 'lambda_val': 0.00854510130589444, 'batch_size': 2334, 'optimizer': 'RMSprop'}.
2026-06-19 08:31:45,942 - experiment_functions - INFO - Early stopping at epoch 1100. Best Metrics: (0.020043252526289076, 0.0045882278640899336, 0.01114434204432612)
2026-06-19 08:31:46,025 - optuna.study.study - INFO - Trial 124 finished with values: [0.020043252526289076, 0.0045882278640899336, 0.01114434204432612] and parameters: {'n_layers': 2, 'embedding_dim': 64, 'lr': 0.0006611882465741183, 'lambda_val': 0.014193031414069697, 'batch_size': 3900, 'optimizer': 'Adam'}.
2026-06-19 08:34:45,427 - optuna.study.study - INFO - Trial 125 finished with values: [0.015788337922409093, 0.003519325502084123, 0.00910564700134554] and parameters: {'n_layers': 4, 'embedding_dim': 32, 'lr': 0.00020897019229325828, 'lambda_val': 1.1042104634029595e-06, 'batch_size': 2567, 'optimizer': 'RMSprop'}.
2026-06-19 08:35:14,952 - experiment_functions - INFO - Early stopping at epoch 600. Best Metrics: (0.026598504059497492, 0.005687128962991033, 0.015297157106495273)
2026-06-19 08:35:15,044 - optuna.study.study - INFO - Trial 126 finished with values: [0.026598504059497492, 0.005687128962991033, 0.015297157106495273] and parameters: {'n_layers': 1, 'embedding_dim': 96, 'lr': 0.007918659350141476, 'lambda_val': 0.0001469242914477015, 'batch_size': 3739, 'optimizer': 'Adam'}.
2026-06-19 08:35:53,005 - experiment_functions - INFO - Early stopping at epoch 800. Best Metrics: (0.014901548996051922, 0.0033267020335985857, 0.007917219064442484)
2026-06-19 08:35:53,092 - optuna.study.study - INFO - Trial 127 finished with values: [0.014901548996051922, 0.0033267020335985857, 0.007917219064442484] and parameters: {'n_layers': 4, 'embedding_dim': 32, 'lr': 0.0008520784697548674, 'lambda_val': 0.015452769230831364, 'batch_size': 2324, 'optimizer': 'Adam'}.
2026-06-19 08:38:00,387 - experiment_functions - INFO - Early stopping at epoch 2550. Best Metrics: (0.000635368303351409, 0.00013104711380573447, 0.00036317648624506417)
2026-06-19 08:38:00,479 - optuna.study.study - INFO - Trial 128 finished with values: [0.000635368303351409, 0.00013104711380573447, 0.00036317648624506417] and parameters: {'n_layers': 3, 'embedding_dim': 128, 'lr': 2.4666237477730928e-05, 'lambda_val': 0.0001228083366977069, 'batch_size': 3874, 'optimizer': 'RMSprop'}.
2026-06-19 08:39:12,975 - experiment_functions - INFO - Early stopping at epoch 1400. Best Metrics: (0.013220279651537941, 0.0027125173676897816, 0.007488337936313702)
2026-06-19 08:39:13,059 - optuna.study.study - INFO - Trial 129 finished with values: [0.013220279651537941, 0.0027125173676897816, 0.007488337936313702] and parameters: {'n_layers': 3, 'embedding_dim': 128, 'lr': 0.0045010260516877044, 'lambda_val': 4.652725797139409e-06, 'batch_size': 1875, 'optimizer': 'RMSprop'}.
2026-06-19 08:40:26,849 - experiment_functions - INFO - Early stopping at epoch 1300. Best Metrics: (0.027619478115815006, 0.005691865605658709, 0.015506987271806286)
2026-06-19 08:40:26,935 - optuna.study.study - INFO - Trial 130 finished with values: [0.027619478115815006, 0.005691865605658709, 0.015506987271806286] and parameters: {'n_layers': 2, 'embedding_dim': 256, 'lr': 0.0008520784697548674, 'lambda_val': 1.3063371603281255e-06, 'batch_size': 3743, 'optimizer': 'Adam'}.
2026-06-19 08:42:22,320 - experiment_functions - INFO - Early stopping at epoch 2350. Best Metrics: (0.004919779267050466, 0.001032588101553619, 0.0026189590574738127)
2026-06-19 08:42:22,410 - optuna.study.study - INFO - Trial 131 finished with values: [0.004919779267050466, 0.001032588101553619, 0.0026189590574738127] and parameters: {'n_layers': 4, 'embedding_dim': 96, 'lr': 0.027107934338862744, 'lambda_val': 0.007237229941740872, 'batch_size': 1935, 'optimizer': 'RMSprop'}.
2026-06-19 08:42:48,323 - experiment_functions - INFO - Early stopping at epoch 550. Best Metrics: (0.008354390945252381, 0.0019578123026398895, 0.004847711915909005)
2026-06-19 08:42:48,429 - optuna.study.study - INFO - Trial 132 finished with values: [0.008354390945252381, 0.0019578123026398895, 0.004847711915909005] and parameters: {'n_layers': 1, 'embedding_dim': 64, 'lr': 0.049960469253932695, 'lambda_val': 9.873205377622859e-06, 'batch_size': 1312, 'optimizer': 'Adam'}.
2026-06-19 08:43:22,300 - experiment_functions - INFO - Early stopping at epoch 700. Best Metrics: (0.023662447328299592, 0.005101364153088292, 0.013331209594528173)
2026-06-19 08:43:22,397 - optuna.study.study - INFO - Trial 133 finished with values: [0.023662447328299592, 0.005101364153088292, 0.013331209594528173] and parameters: {'n_layers': 2, 'embedding_dim': 64, 'lr': 0.0025726585227239724, 'lambda_val': 0.0003743444509143199, 'batch_size': 2567, 'optimizer': 'Adam'}.
2026-06-19 08:43:48,172 - experiment_functions - INFO - Early stopping at epoch 550. Best Metrics: (0.005029192824379735, 0.001048376910445876, 0.002751164201354608)
2026-06-19 08:43:48,267 - optuna.study.study - INFO - Trial 134 finished with values: [0.005029192824379735, 0.001048376910445876, 0.002751164201354608] and parameters: {'n_layers': 2, 'embedding_dim': 32, 'lr': 0.049960469253932695, 'lambda_val': 9.873205377622859e-06, 'batch_size': 2334, 'optimizer': 'RMSprop'}.
2026-06-19 08:44:17,589 - experiment_functions - INFO - Early stopping at epoch 600. Best Metrics: (0.006744417398894184, 0.0013941518251863081, 0.0037732523593981956)
2026-06-19 08:44:17,672 - optuna.study.study - INFO - Trial 135 finished with values: [0.006744417398894184, 0.0013941518251863081, 0.0037732523593981956] and parameters: {'n_layers': 3, 'embedding_dim': 64, 'lr': 0.049960469253932695, 'lambda_val': 9.873205377622859e-06, 'batch_size': 1312, 'optimizer': 'Adam'}.
2026-06-19 08:44:51,210 - experiment_functions - INFO - Early stopping at epoch 750. Best Metrics: (0.01450658036732009, 0.0033961727927245174, 0.007766402222138145)
2026-06-19 08:44:51,426 - optuna.study.study - INFO - Trial 136 finished with values: [0.01450658036732009, 0.0033961727927245174, 0.007766402222138145] and parameters: {'n_layers': 1, 'embedding_dim': 32, 'lr': 0.003713649922128856, 'lambda_val': 0.04233954773809469, 'batch_size': 1935, 'optimizer': 'Adam'}.
2026-06-19 08:45:25,131 - experiment_functions - INFO - Early stopping at epoch 700. Best Metrics: (0.02743583104349154, 0.005717127699886321, 0.01552428485986369)
2026-06-19 08:45:25,488 - optuna.study.study - INFO - Trial 137 finished with values: [0.02743583104349154, 0.005717127699886321, 0.01552428485986369] and parameters: {'n_layers': 2, 'embedding_dim': 64, 'lr': 0.0024228785073853285, 'lambda_val': 2.005340661981191e-05, 'batch_size': 3024, 'optimizer': 'Adam'}.
2026-06-19 08:46:30,658 - experiment_functions - INFO - Early stopping at epoch 1450. Best Metrics: (0.01186028975912288, 0.0024756852343059237, 0.006582518759169502)
2026-06-19 08:46:30,905 - optuna.study.study - INFO - Trial 138 finished with values: [0.01186028975912288, 0.0024756852343059237, 0.006582518759169502] and parameters: {'n_layers': 2, 'embedding_dim': 32, 'lr': 0.0080117144228637, 'lambda_val': 2.1305601218305877e-05, 'batch_size': 2695, 'optimizer': 'RMSprop'}.
2026-06-19 08:47:03,924 - experiment_functions - INFO - Early stopping at epoch 650. Best Metrics: (0.0005600681521414955, 0.00011841606669192877, 0.00028429199019033315)
2026-06-19 08:47:04,019 - optuna.study.study - INFO - Trial 139 finished with values: [0.0005600681521414955, 0.00011841606669192877, 0.00028429199019033315] and parameters: {'n_layers': 3, 'embedding_dim': 96, 'lr': 2.726509634030723e-05, 'lambda_val': 3.131845581451586e-06, 'batch_size': 2334, 'optimizer': 'RMSprop'}.
2026-06-19 08:48:55,099 - experiment_functions - INFO - Early stopping at epoch 1700. Best Metrics: (0.012562516047834964, 0.0029225085259568023, 0.007080591050911037)
2026-06-19 08:48:55,191 - optuna.study.study - INFO - Trial 140 finished with values: [0.012562516047834964, 0.0029225085259568023, 0.007080591050911037] and parameters: {'n_layers': 4, 'embedding_dim': 256, 'lr': 0.00020897019229325828, 'lambda_val': 0.014193031414069697, 'batch_size': 3127, 'optimizer': 'Adam'}.
2026-06-19 08:50:42,936 - experiment_functions - INFO - Early stopping at epoch 2300. Best Metrics: (0.000538701433408141, 0.00012473159024883163, 0.0002842231816160731)
2026-06-19 08:50:43,029 - optuna.study.study - INFO - Trial 141 finished with values: [0.000538701433408141, 0.00012473159024883163, 0.0002842231816160731] and parameters: {'n_layers': 2, 'embedding_dim': 128, 'lr': 0.00010866266252797181, 'lambda_val': 0.0005062204364332735, 'batch_size': 1742, 'optimizer': 'Adam'}.
2026-06-19 08:53:55,421 - optuna.study.study - INFO - Trial 142 finished with values: [0.02872395409199134, 0.005974485284830113, 0.016094875595059427] and parameters: {'n_layers': 2, 'embedding_dim': 128, 'lr': 0.000670518483727842, 'lambda_val': 1.5236318044232254e-06, 'batch_size': 1593, 'optimizer': 'RMSprop'}.
2026-06-19 08:54:32,523 - experiment_functions - INFO - Early stopping at epoch 700. Best Metrics: (0.011385236766051552, 0.0024267399267399264, 0.006207797443038092)
2026-06-19 08:54:32,613 - optuna.study.study - INFO - Trial 143 finished with values: [0.011385236766051552, 0.0024267399267399264, 0.006207797443038092] and parameters: {'n_layers': 3, 'embedding_dim': 128, 'lr': 0.0020290919563790725, 'lambda_val': 0.0003699491527784584, 'batch_size': 1913, 'optimizer': 'RMSprop'}.
2026-06-19 08:55:07,051 - experiment_functions - INFO - Early stopping at epoch 650. Best Metrics: (0.0056817965817879176, 0.001222053808260705, 0.003104198210313305)
2026-06-19 08:55:07,405 - optuna.study.study - INFO - Trial 144 finished with values: [0.0056817965817879176, 0.001222053808260705, 0.003104198210313305] and parameters: {'n_layers': 4, 'embedding_dim': 96, 'lr': 0.03025207384051862, 'lambda_val': 0.0004362815086226961, 'batch_size': 2758, 'optimizer': 'Adam'}.
2026-06-19 08:55:34,514 - experiment_functions - INFO - Early stopping at epoch 500. Best Metrics: (0.0005283135574795785, 0.00011367942402425162, 0.00030061513112062825)
2026-06-19 08:55:34,613 - optuna.study.study - INFO - Trial 145 finished with values: [0.0005283135574795785, 0.00011367942402425162, 0.00030061513112062825] and parameters: {'n_layers': 3, 'embedding_dim': 128, 'lr': 0.022558608253233445, 'lambda_val': 2.005340661981191e-05, 'batch_size': 2715, 'optimizer': 'SGD'}.
2026-06-19 08:56:04,889 - experiment_functions - INFO - Early stopping at epoch 650. Best Metrics: (0.02728098793234926, 0.005837122647467476, 0.016139484506036805)
2026-06-19 08:56:04,976 - optuna.study.study - INFO - Trial 146 finished with values: [0.02728098793234926, 0.005837122647467476, 0.016139484506036805] and parameters: {'n_layers': 1, 'embedding_dim': 32, 'lr': 0.007918659350141476, 'lambda_val': 2.005340661981191e-05, 'batch_size': 2567, 'optimizer': 'Adam'}.
2026-06-19 08:56:30,727 - experiment_functions - INFO - Early stopping at epoch 550. Best Metrics: (0.005511750857330927, 0.0011841606669192877, 0.0029923445704572657)
2026-06-19 08:56:30,825 - optuna.study.study - INFO - Trial 147 finished with values: [0.005511750857330927, 0.0011841606669192877, 0.0029923445704572657] and parameters: {'n_layers': 2, 'embedding_dim': 32, 'lr': 0.09397404733704716, 'lambda_val': 7.46585453630634e-05, 'batch_size': 3835, 'optimizer': 'Adam'}.
2026-06-19 08:57:08,330 - experiment_functions - INFO - Early stopping at epoch 800. Best Metrics: (0.012247725190411195, 0.0026367310850069475, 0.0068531651681072005)
2026-06-19 08:57:08,411 - optuna.study.study - INFO - Trial 148 finished with values: [0.012247725190411195, 0.0026367310850069475, 0.0068531651681072005] and parameters: {'n_layers': 1, 'embedding_dim': 96, 'lr': 0.012325607600042974, 'lambda_val': 1.3063371603281255e-06, 'batch_size': 2324, 'optimizer': 'RMSprop'}.
2026-06-19 08:57:39,633 - experiment_functions - INFO - Early stopping at epoch 600. Best Metrics: (0.01932609148540233, 0.004240874068460276, 0.010799314699384624)
2026-06-19 08:57:39,722 - optuna.study.study - INFO - Trial 149 finished with values: [0.01932609148540233, 0.004240874068460276, 0.010799314699384624] and parameters: {'n_layers': 3, 'embedding_dim': 96, 'lr': 0.002557149053399139, 'lambda_val': 1.3063371603281255e-06, 'batch_size': 3743, 'optimizer': 'Adam'}.
2026-06-19 09:00:42,729 - optuna.study.study - INFO - Trial 150 finished with values: [0.02794956757013658, 0.006053429329291398, 0.016655072552415672] and parameters: {'n_layers': 1, 'embedding_dim': 128, 'lr': 0.000670518483727842, 'lambda_val': 0.0001469242914477015, 'batch_size': 1875, 'optimizer': 'Adam'}.
2026-06-19 09:01:12,501 - experiment_functions - INFO - Early stopping at epoch 550. Best Metrics: (0.01032071435894743, 0.0023430592396109636, 0.005937377763216283)
2026-06-19 09:01:12,597 - optuna.study.study - INFO - Trial 151 finished with values: [0.01032071435894743, 0.0023430592396109636, 0.005937377763216283] and parameters: {'n_layers': 1, 'embedding_dim': 256, 'lr': 0.021415149870150467, 'lambda_val': 1.3063371603281255e-06, 'batch_size': 1022, 'optimizer': 'Adam'}.
2026-06-19 09:01:54,008 - experiment_functions - INFO - Early stopping at epoch 850. Best Metrics: (0.028887467926701542, 0.0061513199444233925, 0.01652523697602277)
2026-06-19 09:01:54,106 - optuna.study.study - INFO - Trial 152 finished with values: [0.028887467926701542, 0.0061513199444233925, 0.01652523697602277] and parameters: {'n_layers': 1, 'embedding_dim': 128, 'lr': 0.0025726585227239724, 'lambda_val': 0.0003743444509143199, 'batch_size': 2567, 'optimizer': 'Adam'}.
2026-06-19 09:02:26,593 - experiment_functions - INFO - Early stopping at epoch 550. Best Metrics: (0.014192046256921376, 0.0030346090690918275, 0.0075007777671097405)
2026-06-19 09:02:26,687 - optuna.study.study - INFO - Trial 153 finished with values: [0.014192046256921376, 0.0030346090690918275, 0.0075007777671097405] and parameters: {'n_layers': 2, 'embedding_dim': 256, 'lr': 0.007918659350141476, 'lambda_val': 2.005340661981191e-05, 'batch_size': 2567, 'optimizer': 'Adam'}.
2026-06-19 09:03:48,644 - experiment_functions - INFO - Early stopping at epoch 1800. Best Metrics: (0.022851592557035585, 0.004804534545913857, 0.012797245240773176)
2026-06-19 09:03:48,739 - optuna.study.study - INFO - Trial 154 finished with values: [0.022851592557035585, 0.004804534545913857, 0.012797245240773176] and parameters: {'n_layers': 4, 'embedding_dim': 32, 'lr': 0.000670518483727842, 'lambda_val': 8.203235509313863e-06, 'batch_size': 3050, 'optimizer': 'RMSprop'}.
2026-06-19 09:04:25,887 - experiment_functions - INFO - Early stopping at epoch 750. Best Metrics: (0.012767411564048228, 0.0028767209801692562, 0.006874994601570492)
2026-06-19 09:04:25,980 - optuna.study.study - INFO - Trial 155 finished with values: [0.012767411564048228, 0.0028767209801692562, 0.006874994601570492] and parameters: {'n_layers': 4, 'embedding_dim': 64, 'lr': 0.000837802552403052, 'lambda_val': 0.014193031414069697, 'batch_size': 3900, 'optimizer': 'Adam'}.
2026-06-19 09:05:45,546 - experiment_functions - INFO - Early stopping at epoch 1800. Best Metrics: (0.03135686472409381, 0.0064513073133762805, 0.017852678009555333)
2026-06-19 09:05:45,629 - optuna.study.study - INFO - Trial 156 finished with values: [0.03135686472409381, 0.0064513073133762805, 0.017852678009555333] and parameters: {'n_layers': 1, 'embedding_dim': 32, 'lr': 0.0020290919563790725, 'lambda_val': 0.0003743444509143199, 'batch_size': 2567, 'optimizer': 'Adam'}.
2026-06-19 09:07:47,452 - experiment_functions - INFO - Early stopping at epoch 2400. Best Metrics: (0.03304955754208984, 0.006868131868131868, 0.019092504777965855)
2026-06-19 09:07:47,540 - optuna.study.study - INFO - Trial 157 finished with values: [0.03304955754208984, 0.006868131868131868, 0.019092504777965855] and parameters: {'n_layers': 1, 'embedding_dim': 256, 'lr': 0.0008520784697548674, 'lambda_val': 1.3063371603281255e-06, 'batch_size': 3994, 'optimizer': 'RMSprop'}.
2026-06-19 09:08:14,314 - experiment_functions - INFO - Early stopping at epoch 550. Best Metrics: (0.01997201995463863, 0.00434981684981685, 0.011703505357597463)
2026-06-19 09:08:14,411 - optuna.study.study - INFO - Trial 158 finished with values: [0.01997201995463863, 0.00434981684981685, 0.011703505357597463] and parameters: {'n_layers': 2, 'embedding_dim': 64, 'lr': 0.006551893413620945, 'lambda_val': 1.0904990861281023e-05, 'batch_size': 3900, 'optimizer': 'Adam'}.
2026-06-19 09:09:09,099 - experiment_functions - INFO - Early stopping at epoch 1200. Best Metrics: (0.03133888301414034, 0.006492358216496148, 0.017905872595493557)
2026-06-19 09:09:09,193 - optuna.study.study - INFO - Trial 159 finished with values: [0.03133888301414034, 0.006492358216496148, 0.017905872595493557] and parameters: {'n_layers': 1, 'embedding_dim': 64, 'lr': 0.0020290919563790725, 'lambda_val': 0.0003743444509143199, 'batch_size': 2326, 'optimizer': 'Adam'}.
2026-06-19 09:11:48,513 - experiment_functions - INFO - Early stopping at epoch 3500. Best Metrics: (0.03091316703078384, 0.006416571933813313, 0.017608190017297572)
2026-06-19 09:11:48,604 - optuna.study.study - INFO - Trial 160 finished with values: [0.03091316703078384, 0.006416571933813313, 0.017608190017297572] and parameters: {'n_layers': 2, 'embedding_dim': 64, 'lr': 0.000670518483727842, 'lambda_val': 0.0001469242914477015, 'batch_size': 2427, 'optimizer': 'Adam'}.
2026-06-19 09:14:42,752 - optuna.study.study - INFO - Trial 161 finished with values: [0.016070102600919314, 0.003574586333207023, 0.00892781661437601] and parameters: {'n_layers': 4, 'embedding_dim': 32, 'lr': 0.00020897019229325828, 'lambda_val': 2.013346843188833e-05, 'batch_size': 1913, 'optimizer': 'Adam'}.
2026-06-19 09:15:26,764 - experiment_functions - INFO - Early stopping at epoch 900. Best Metrics: (0.014469888108115682, 0.003216180371352785, 0.008160956374421706)
2026-06-19 09:15:26,859 - optuna.study.study - INFO - Trial 162 finished with values: [0.014469888108115682, 0.003216180371352785, 0.008160956374421706] and parameters: {'n_layers': 4, 'embedding_dim': 64, 'lr': 0.0005561338684445448, 'lambda_val': 0.014193031414069697, 'batch_size': 3127, 'optimizer': 'Adam'}.
2026-06-19 09:16:06,089 - experiment_functions - INFO - Early stopping at epoch 850. Best Metrics: (0.023291558323857327, 0.0049024251610458505, 0.013146255776437146)
2026-06-19 09:16:07,003 - optuna.study.study - INFO - Trial 163 finished with values: [0.023291558323857327, 0.0049024251610458505, 0.013146255776437146] and parameters: {'n_layers': 3, 'embedding_dim': 32, 'lr': 0.0020290919563790725, 'lambda_val': 7.46585453630634e-05, 'batch_size': 1875, 'optimizer': 'Adam'}.
2026-06-19 09:16:54,096 - experiment_functions - INFO - Early stopping at epoch 850. Best Metrics: (0.019582356844643323, 0.004247189592017179, 0.011015989818205773)
2026-06-19 09:16:54,189 - optuna.study.study - INFO - Trial 164 finished with values: [0.019582356844643323, 0.004247189592017179, 0.011015989818205773] and parameters: {'n_layers': 4, 'embedding_dim': 128, 'lr': 0.0008520784697548674, 'lambda_val': 1.3063371603281255e-06, 'batch_size': 3743, 'optimizer': 'Adam'}.
