2026-06-17 17:32:06,815 - optuna.study.study - INFO - Trial 35 finished with values: [0.0005794640371928934, 0.00013420487558418593, 0.00034391185362983573] and parameters: {'n_layers': 4, 'embedding_dim': 64, 'lr': 0.0001990614858151068, 'lambda_val': 1.0818419997025342e-05, 'batch_size': 608, 'optimizer': 'SGD'}.
2026-06-17 17:32:50,447 - experiment_functions - INFO - Early stopping at epoch 1000. Best Metrics: (0.003128661731952182, 0.0007752305166098271, 0.002029220294967814)
2026-06-17 17:32:50,516 - optuna.study.study - INFO - Trial 36 finished with values: [0.003128661731952182, 0.0007752305166098271, 0.002029220294967814] and parameters: {'n_layers': 4, 'embedding_dim': 64, 'lr': 0.0012329536436234642, 'lambda_val': 0.0069523388896965115, 'batch_size': 927, 'optimizer': 'Adam'}.
2026-06-17 17:33:22,428 - experiment_functions - INFO - Early stopping at epoch 750. Best Metrics: (0.003107904797609593, 0.000663129973474801, 0.0018201080375726084)
2026-06-17 17:33:22,503 - optuna.study.study - INFO - Trial 37 finished with values: [0.003107904797609593, 0.000663129973474801, 0.0018201080375726084] and parameters: {'n_layers': 1, 'embedding_dim': 64, 'lr': 0.0032052069599508804, 'lambda_val': 4.337539728895895e-06, 'batch_size': 1849, 'optimizer': 'Adam'}.
2026-06-17 17:33:44,868 - experiment_functions - INFO - Early stopping at epoch 500. Best Metrics: (0.0005111153830681054, 0.00011210054313502589, 0.0002633707465336224)
2026-06-17 17:33:44,961 - optuna.study.study - INFO - Trial 38 finished with values: [0.0005111153830681054, 0.00011210054313502589, 0.0002633707465336224] and parameters: {'n_layers': 3, 'embedding_dim': 64, 'lr': 0.0005039886333543899, 'lambda_val': 0.04933230624093531, 'batch_size': 779, 'optimizer': 'SGD'}.
2026-06-17 17:34:07,143 - experiment_functions - INFO - Early stopping at epoch 500. Best Metrics: (0.0006735373267265266, 0.0001373626373626374, 0.0003682876647415365)
2026-06-17 17:34:07,236 - optuna.study.study - INFO - Trial 39 finished with values: [0.0006735373267265266, 0.0001373626373626374, 0.0003682876647415365] and parameters: {'n_layers': 2, 'embedding_dim': 64, 'lr': 0.0008244869685256396, 'lambda_val': 0.00040852653324075796, 'batch_size': 2820, 'optimizer': 'SGD'}.
2026-06-17 17:34:29,672 - experiment_functions - INFO - Early stopping at epoch 500. Best Metrics: (0.000621156168416436, 0.0001468359226979917, 0.0003832636918809622)
2026-06-17 17:34:29,759 - optuna.study.study - INFO - Trial 40 finished with values: [0.000621156168416436, 0.0001468359226979917, 0.0003832636918809622] and parameters: {'n_layers': 2, 'embedding_dim': 96, 'lr': 6.95807666677706e-05, 'lambda_val': 5.703242122988681e-05, 'batch_size': 900, 'optimizer': 'SGD'}.
2026-06-17 17:35:02,741 - experiment_functions - INFO - Early stopping at epoch 750. Best Metrics: (0.00181720643878937, 0.0005415561450044209, 0.0012065145044154184)
2026-06-17 17:35:03,327 - optuna.study.study - INFO - Trial 41 finished with values: [0.00181720643878937, 0.0005415561450044209, 0.0012065145044154184] and parameters: {'n_layers': 2, 'embedding_dim': 96, 'lr': 0.03448090174378339, 'lambda_val': 0.004040847512452706, 'batch_size': 2892, 'optimizer': 'Adam'}.
2026-06-17 17:37:51,912 - optuna.study.study - INFO - Trial 42 finished with values: [0.0031033473958192587, 0.0007041808765946697, 0.0018122006209390915] and parameters: {'n_layers': 3, 'embedding_dim': 96, 'lr': 0.000416242081306151, 'lambda_val': 4.4572768261600244e-05, 'batch_size': 806, 'optimizer': 'Adam'}.
2026-06-17 17:40:42,880 - optuna.study.study - INFO - Trial 43 finished with values: [0.001984299782520816, 0.0004120879120879121, 0.0012146584426242723] and parameters: {'n_layers': 2, 'embedding_dim': 128, 'lr': 0.00014353068129198662, 'lambda_val': 0.0006921314285407669, 'batch_size': 3106, 'optimizer': 'Adam'}.
2026-06-17 17:41:04,756 - experiment_functions - INFO - Early stopping at epoch 500. Best Metrics: (0.0005253100168465138, 0.00011367942402425163, 0.0002688051638251949)
2026-06-17 17:41:04,834 - optuna.study.study - INFO - Trial 44 finished with values: [0.0005253100168465138, 0.00011367942402425163, 0.0002688051638251949] and parameters: {'n_layers': 4, 'embedding_dim': 32, 'lr': 4.820601120685572e-05, 'lambda_val': 0.03382032461619694, 'batch_size': 2637, 'optimizer': 'SGD'}.
2026-06-17 17:41:26,335 - experiment_functions - INFO - Early stopping at epoch 500. Best Metrics: (0.000500281669015501, 0.00010894278135657447, 0.00025333836361390914)
2026-06-17 17:41:26,881 - optuna.study.study - INFO - Trial 45 finished with values: [0.000500281669015501, 0.00010894278135657447, 0.00025333836361390914] and parameters: {'n_layers': 3, 'embedding_dim': 32, 'lr': 4.9014911333357054e-05, 'lambda_val': 0.012000522786854326, 'batch_size': 2383, 'optimizer': 'SGD'}.
2026-06-17 17:44:13,352 - optuna.study.study - INFO - Trial 46 finished with values: [0.002089008172156044, 0.0005573449538966781, 0.0013220306642983371] and parameters: {'n_layers': 3, 'embedding_dim': 96, 'lr': 0.0003404162358956432, 'lambda_val': 0.0477781106481976, 'batch_size': 1184, 'optimizer': 'RMSprop'}.
2026-06-17 17:44:37,426 - experiment_functions - INFO - Early stopping at epoch 550. Best Metrics: (0.0019525858191362469, 0.0005005052418845521, 0.0012744095365570267)
2026-06-17 17:44:37,529 - optuna.study.study - INFO - Trial 47 finished with values: [0.0019525858191362469, 0.0005005052418845521, 0.0012744095365570267] and parameters: {'n_layers': 3, 'embedding_dim': 32, 'lr': 0.01562100019075772, 'lambda_val': 3.126492783663676e-05, 'batch_size': 4057, 'optimizer': 'RMSprop'}.
2026-06-17 17:45:54,985 - experiment_functions - INFO - Early stopping at epoch 1800. Best Metrics: (0.0006751922208061279, 0.0001468359226979917, 0.00038604620504524074)
2026-06-17 17:45:55,076 - optuna.study.study - INFO - Trial 48 finished with values: [0.0006751922208061279, 0.0001468359226979917, 0.00038604620504524074] and parameters: {'n_layers': 2, 'embedding_dim': 128, 'lr': 5.0457469374136816e-05, 'lambda_val': 0.0017082582931059825, 'batch_size': 1180, 'optimizer': 'Adam'}.
2026-06-17 17:46:25,667 - experiment_functions - INFO - Early stopping at epoch 650. Best Metrics: (0.003020963771338248, 0.0007594417077175699, 0.0019075134437003477)
2026-06-17 17:46:25,776 - optuna.study.study - INFO - Trial 49 finished with values: [0.003020963771338248, 0.0007594417077175699, 0.0019075134437003477] and parameters: {'n_layers': 4, 'embedding_dim': 96, 'lr': 0.004937154060813022, 'lambda_val': 0.00015820612384227593, 'batch_size': 2599, 'optimizer': 'Adam'}.
2026-06-17 17:49:20,518 - optuna.study.study - INFO - Trial 50 finished with values: [0.0025558701958260585, 0.0005683971201212581, 0.0015945880900024554] and parameters: {'n_layers': 3, 'embedding_dim': 128, 'lr': 0.00023857285366256402, 'lambda_val': 1.9125850260278604e-06, 'batch_size': 1077, 'optimizer': 'RMSprop'}.
2026-06-17 17:52:04,650 - optuna.study.study - INFO - Trial 51 finished with values: [0.00255449539860907, 0.0005652393583428066, 0.0016208914087739894] and parameters: {'n_layers': 2, 'embedding_dim': 96, 'lr': 0.000416242081306151, 'lambda_val': 0.00040852653324075796, 'batch_size': 806, 'optimizer': 'Adam'}.
2026-06-17 17:52:29,238 - experiment_functions - INFO - Early stopping at epoch 500. Best Metrics: (0.0005371410850969673, 0.00013262599469496023, 0.00031301799708862457)
2026-06-17 17:52:29,325 - optuna.study.study - INFO - Trial 52 finished with values: [0.0005371410850969673, 0.00013262599469496023, 0.00031301799708862457] and parameters: {'n_layers': 4, 'embedding_dim': 128, 'lr': 0.04068195973191426, 'lambda_val': 1.7552395954128497e-06, 'batch_size': 1713, 'optimizer': 'SGD'}.
2026-06-17 17:53:06,765 - experiment_functions - INFO - Early stopping at epoch 900. Best Metrics: (0.002713378333455979, 0.0006315523556902868, 0.0016695110270180222)
2026-06-17 17:53:06,840 - optuna.study.study - INFO - Trial 53 finished with values: [0.002713378333455979, 0.0006315523556902868, 0.0016695110270180222] and parameters: {'n_layers': 1, 'embedding_dim': 64, 'lr': 0.0032052069599508804, 'lambda_val': 4.337539728895895e-06, 'batch_size': 806, 'optimizer': 'Adam'}.
2026-06-17 17:53:29,207 - experiment_functions - INFO - Early stopping at epoch 500. Best Metrics: (0.0005232133260265222, 0.00011052166224580018, 0.0002446665119639874)
2026-06-17 17:53:29,293 - optuna.study.study - INFO - Trial 54 finished with values: [0.0005232133260265222, 0.00011052166224580018, 0.0002446665119639874] and parameters: {'n_layers': 1, 'embedding_dim': 96, 'lr': 4.117940967800089e-05, 'lambda_val': 0.005748886343949696, 'batch_size': 3730, 'optimizer': 'SGD'}.
2026-06-17 17:55:40,440 - experiment_functions - INFO - Early stopping at epoch 3200. Best Metrics: (0.0019442296479430215, 0.0005905014525704182, 0.0012863850773619271)
2026-06-17 17:55:40,528 - optuna.study.study - INFO - Trial 55 finished with values: [0.0019442296479430215, 0.0005905014525704182, 0.0012863850773619271] and parameters: {'n_layers': 3, 'embedding_dim': 64, 'lr': 0.0003404162358956432, 'lambda_val': 0.0477781106481976, 'batch_size': 3907, 'optimizer': 'RMSprop'}.
2026-06-17 17:56:10,669 - experiment_functions - INFO - Early stopping at epoch 550. Best Metrics: (0.0027525195445114383, 0.0007436528988253126, 0.0018175680502060694)
2026-06-17 17:56:10,753 - optuna.study.study - INFO - Trial 56 finished with values: [0.0027525195445114383, 0.0007436528988253126, 0.0018175680502060694] and parameters: {'n_layers': 3, 'embedding_dim': 256, 'lr': 0.01562100019075772, 'lambda_val': 3.943481674172961e-05, 'batch_size': 4057, 'optimizer': 'Adam'}.
2026-06-17 17:56:32,777 - experiment_functions - INFO - Early stopping at epoch 500. Best Metrics: (0.0004604759910422941, 8.368068712896301e-05, 0.00024372859183083943)
2026-06-17 17:56:32,872 - optuna.study.study - INFO - Trial 57 finished with values: [0.0004604759910422941, 8.368068712896301e-05, 0.00024372859183083943] and parameters: {'n_layers': 4, 'embedding_dim': 32, 'lr': 3.2584712192726544e-05, 'lambda_val': 0.09535907174643282, 'batch_size': 2077, 'optimizer': 'RMSprop'}.
2026-06-17 17:57:08,702 - experiment_functions - INFO - Early stopping at epoch 850. Best Metrics: (0.0014904403012410575, 0.0004326133636478465, 0.000931381648134062)
2026-06-17 17:57:08,783 - optuna.study.study - INFO - Trial 58 finished with values: [0.0014904403012410575, 0.0004326133636478465, 0.000931381648134062] and parameters: {'n_layers': 4, 'embedding_dim': 32, 'lr': 0.027019907715942967, 'lambda_val': 0.0009603984098533798, 'batch_size': 1751, 'optimizer': 'RMSprop'}.
2026-06-17 17:59:39,332 - experiment_functions - INFO - Early stopping at epoch 3800. Best Metrics: (0.0030495883332619183, 0.0006662877352532525, 0.0019240797814612013)
2026-06-17 17:59:39,434 - optuna.study.study - INFO - Trial 59 finished with values: [0.0030495883332619183, 0.0006662877352532525, 0.0019240797814612013] and parameters: {'n_layers': 3, 'embedding_dim': 32, 'lr': 0.000416242081306151, 'lambda_val': 1.3870977953506033e-05, 'batch_size': 806, 'optimizer': 'Adam'}.
2026-06-17 18:00:57,337 - experiment_functions - INFO - Early stopping at epoch 1850. Best Metrics: (0.00067311030446431, 0.0001405203991410888, 0.0003425082605343758)
2026-06-17 18:00:57,423 - optuna.study.study - INFO - Trial 60 finished with values: [0.00067311030446431, 0.0001405203991410888, 0.0003425082605343758] and parameters: {'n_layers': 4, 'embedding_dim': 64, 'lr': 2.8597012116905028e-05, 'lambda_val': 3.710871984224586e-06, 'batch_size': 1751, 'optimizer': 'RMSprop'}.
2026-06-17 18:03:47,025 - optuna.study.study - INFO - Trial 61 finished with values: [0.001676815825994457, 0.00036787924718959203, 0.0010107793261882718] and parameters: {'n_layers': 3, 'embedding_dim': 96, 'lr': 0.0001237947310985151, 'lambda_val': 0.00038344044885887376, 'batch_size': 3351, 'optimizer': 'RMSprop'}.
2026-06-17 18:04:24,755 - experiment_functions - INFO - Early stopping at epoch 900. Best Metrics: (0.0027891265158863318, 0.0006015536187949981, 0.0017091627398296684)
2026-06-17 18:04:24,823 - optuna.study.study - INFO - Trial 62 finished with values: [0.0027891265158863318, 0.0006015536187949981, 0.0017091627398296684] and parameters: {'n_layers': 3, 'embedding_dim': 32, 'lr': 0.0015933103817621604, 'lambda_val': 0.00015440813799502288, 'batch_size': 3820, 'optimizer': 'Adam'}.
2026-06-17 18:04:51,104 - experiment_functions - INFO - Early stopping at epoch 550. Best Metrics: (0.002552873253882179, 0.0006726032588101553, 0.0016776559820175932)
2026-06-17 18:04:51,647 - optuna.study.study - INFO - Trial 63 finished with values: [0.002552873253882179, 0.0006726032588101553, 0.0016776559820175932] and parameters: {'n_layers': 4, 'embedding_dim': 96, 'lr': 0.062357384270714994, 'lambda_val': 0.0002714717918892815, 'batch_size': 649, 'optimizer': 'Adam'}.
2026-06-17 18:07:35,660 - optuna.study.study - INFO - Trial 64 finished with values: [0.002087058899544294, 0.0004499810534293293, 0.0012627371810885859] and parameters: {'n_layers': 3, 'embedding_dim': 64, 'lr': 0.0001990614858151068, 'lambda_val': 4.4572768261600244e-05, 'batch_size': 1226, 'optimizer': 'Adam'}.
2026-06-17 18:07:59,471 - experiment_functions - INFO - Early stopping at epoch 550. Best Metrics: (0.0028240427078011494, 0.0006504989263609954, 0.0017456695085523565)
2026-06-17 18:07:59,554 - optuna.study.study - INFO - Trial 65 finished with values: [0.0028240427078011494, 0.0006504989263609954, 0.0017456695085523565] and parameters: {'n_layers': 3, 'embedding_dim': 32, 'lr': 0.01562100019075772, 'lambda_val': 2.3768863399722796e-06, 'batch_size': 819, 'optimizer': 'Adam'}.
2026-06-17 18:08:22,380 - experiment_functions - INFO - Early stopping at epoch 500. Best Metrics: (0.0005108846999743938, 0.00011683718580270305, 0.0003092010240272444)
2026-06-17 18:08:22,486 - optuna.study.study - INFO - Trial 66 finished with values: [0.0005108846999743938, 0.00011683718580270305, 0.0003092010240272444] and parameters: {'n_layers': 3, 'embedding_dim': 64, 'lr': 0.009940147183797932, 'lambda_val': 3.710871984224586e-06, 'batch_size': 3337, 'optimizer': 'SGD'}.
2026-06-17 18:08:45,264 - experiment_functions - INFO - Early stopping at epoch 500. Best Metrics: (0.0007037745755287275, 0.00015473032714412026, 0.000395853082641001)
2026-06-17 18:08:45,347 - optuna.study.study - INFO - Trial 67 finished with values: [0.0007037745755287275, 0.00015473032714412026, 0.000395853082641001] and parameters: {'n_layers': 4, 'embedding_dim': 64, 'lr': 0.0012702568149946026, 'lambda_val': 0.06357527495348947, 'batch_size': 1751, 'optimizer': 'SGD'}.
2026-06-17 18:11:29,739 - optuna.study.study - INFO - Trial 68 finished with values: [0.0009682572452171265, 0.0002163066818239232, 0.0005563680979294893] and parameters: {'n_layers': 2, 'embedding_dim': 64, 'lr': 9.266006673834506e-05, 'lambda_val': 3.545880423505173e-05, 'batch_size': 2820, 'optimizer': 'Adam'}.
2026-06-17 18:11:57,616 - experiment_functions - INFO - Early stopping at epoch 600. Best Metrics: (0.003196895374485675, 0.0008194391815081471, 0.0019842934444606977)
2026-06-17 18:11:57,697 - optuna.study.study - INFO - Trial 69 finished with values: [0.003196895374485675, 0.0008194391815081471, 0.0019842934444606977] and parameters: {'n_layers': 4, 'embedding_dim': 64, 'lr': 0.0036567747130372475, 'lambda_val': 9.638501122128868e-05, 'batch_size': 1751, 'optimizer': 'RMSprop'}.
2026-06-17 18:12:20,216 - experiment_functions - INFO - Early stopping at epoch 500. Best Metrics: (0.0006496250235994674, 0.00011841606669192877, 0.0003023863333237285)
2026-06-17 18:12:20,342 - optuna.study.study - INFO - Trial 70 finished with values: [0.0006496250235994674, 0.00011841606669192877, 0.0003023863333237285] and parameters: {'n_layers': 2, 'embedding_dim': 64, 'lr': 0.0005039886333543899, 'lambda_val': 0.04933230624093531, 'batch_size': 779, 'optimizer': 'SGD'}.
2026-06-17 18:13:40,046 - experiment_functions - INFO - Early stopping at epoch 1850. Best Metrics: (0.0018323658431510105, 0.0005510294303397753, 0.0011669620004238297)
2026-06-17 18:13:40,140 - optuna.study.study - INFO - Trial 71 finished with values: [0.0018323658431510105, 0.0005510294303397753, 0.0011669620004238297] and parameters: {'n_layers': 2, 'embedding_dim': 96, 'lr': 0.08592645422936683, 'lambda_val': 0.0032909918788100326, 'batch_size': 3166, 'optimizer': 'Adam'}.
2026-06-17 18:14:17,436 - experiment_functions - INFO - Early stopping at epoch 800. Best Metrics: (0.0025039794313899888, 0.0006931287103700897, 0.0015564534210399346)
2026-06-17 18:14:17,533 - optuna.study.study - INFO - Trial 72 finished with values: [0.0025039794313899888, 0.0006931287103700897, 0.0015564534210399346] and parameters: {'n_layers': 4, 'embedding_dim': 96, 'lr': 0.0012329536436234642, 'lambda_val': 0.0477781106481976, 'batch_size': 1184, 'optimizer': 'RMSprop'}.
2026-06-17 18:14:40,357 - experiment_functions - INFO - Early stopping at epoch 500. Best Metrics: (0.0004298533952997195, 0.0001026272577996716, 0.00021148942578960427)
2026-06-17 18:14:40,450 - optuna.study.study - INFO - Trial 73 finished with values: [0.0004298533952997195, 0.0001026272577996716, 0.00021148942578960427] and parameters: {'n_layers': 3, 'embedding_dim': 64, 'lr': 0.0005039886333543899, 'lambda_val': 0.0069523388896965115, 'batch_size': 779, 'optimizer': 'SGD'}.
2026-06-17 18:15:09,595 - experiment_functions - INFO - Early stopping at epoch 600. Best Metrics: (0.002881637767879178, 0.000708917519262347, 0.0017551169293453764)
2026-06-17 18:15:10,370 - optuna.study.study - INFO - Trial 74 finished with values: [0.002881637767879178, 0.000708917519262347, 0.0017551169293453764] and parameters: {'n_layers': 4, 'embedding_dim': 96, 'lr': 0.004937154060813022, 'lambda_val': 0.002699561195512288, 'batch_size': 3947, 'optimizer': 'Adam'}.
2026-06-17 18:15:57,803 - experiment_functions - INFO - Early stopping at epoch 1050. Best Metrics: (0.0005723510071071376, 0.00012631047113805733, 0.00032617315286824554)
2026-06-17 18:15:57,882 - optuna.study.study - INFO - Trial 75 finished with values: [0.0005723510071071376, 0.00012631047113805733, 0.00032617315286824554] and parameters: {'n_layers': 3, 'embedding_dim': 96, 'lr': 0.07054484866312165, 'lambda_val': 1.337425298324593e-06, 'batch_size': 2993, 'optimizer': 'SGD'}.
2026-06-17 18:16:24,358 - experiment_functions - INFO - Early stopping at epoch 550. Best Metrics: (0.0025980923753071913, 0.0006789187823670583, 0.0016511824375577096)
2026-06-17 18:16:24,469 - optuna.study.study - INFO - Trial 76 finished with values: [0.0025980923753071913, 0.0006789187823670583, 0.0016511824375577096] and parameters: {'n_layers': 4, 'embedding_dim': 96, 'lr': 0.029808523605573987, 'lambda_val': 5.703242122988681e-05, 'batch_size': 900, 'optimizer': 'RMSprop'}.
2026-06-17 18:19:15,280 - optuna.study.study - INFO - Trial 77 finished with values: [0.0007087761441993213, 0.00016736137425792601, 0.0004033936622746669] and parameters: {'n_layers': 3, 'embedding_dim': 96, 'lr': 2.8597012116905028e-05, 'lambda_val': 3.710871984224586e-06, 'batch_size': 2577, 'optimizer': 'RMSprop'}.
2026-06-17 18:19:40,180 - experiment_functions - INFO - Early stopping at epoch 550. Best Metrics: (0.0018427278467432334, 0.0004531388152077808, 0.001179509323543725)
2026-06-17 18:19:40,839 - optuna.study.study - INFO - Trial 78 finished with values: [0.0018427278467432334, 0.0004531388152077808, 0.001179509323543725] and parameters: {'n_layers': 1, 'embedding_dim': 96, 'lr': 0.06081491929533836, 'lambda_val': 0.0002714717918892815, 'batch_size': 649, 'optimizer': 'Adam'}.
2026-06-17 18:22:44,913 - experiment_functions - INFO - Early stopping at epoch 3650. Best Metrics: (0.0007287216524392031, 0.00015630920803334599, 0.0004013083443727077)
2026-06-17 18:22:44,997 - optuna.study.study - INFO - Trial 79 finished with values: [0.0007287216524392031, 0.00015630920803334599, 0.0004013083443727077] and parameters: {'n_layers': 3, 'embedding_dim': 256, 'lr': 2.8597012116905028e-05, 'lambda_val': 3.710871984224586e-06, 'batch_size': 2993, 'optimizer': 'RMSprop'}.
2026-06-17 18:24:13,649 - experiment_functions - INFO - Early stopping at epoch 1950. Best Metrics: (0.0020933064715666027, 0.0006283945939118353, 0.0013392284937776497)
2026-06-17 18:24:13,734 - optuna.study.study - INFO - Trial 80 finished with values: [0.0020933064715666027, 0.0006283945939118353, 0.0013392284937776497] and parameters: {'n_layers': 1, 'embedding_dim': 256, 'lr': 0.06081491929533836, 'lambda_val': 0.005763783793844714, 'batch_size': 1491, 'optimizer': 'Adam'}.
2026-06-17 18:24:40,869 - experiment_functions - INFO - Early stopping at epoch 600. Best Metrics: (0.0034481070373842634, 0.0008636478464064672, 0.0022906196826194187)
2026-06-17 18:24:40,962 - optuna.study.study - INFO - Trial 81 finished with values: [0.0034481070373842634, 0.0008636478464064672, 0.0022906196826194187] and parameters: {'n_layers': 3, 'embedding_dim': 64, 'lr': 0.0032052069599508804, 'lambda_val': 4.337539728895895e-06, 'batch_size': 1849, 'optimizer': 'RMSprop'}.
2026-06-17 18:25:30,044 - experiment_functions - INFO - Early stopping at epoch 1100. Best Metrics: (0.0020625377135019343, 0.000607869142351901, 0.0013213270997218763)
2026-06-17 18:25:30,131 - optuna.study.study - INFO - Trial 82 finished with values: [0.0020625377135019343, 0.000607869142351901, 0.0013213270997218763] and parameters: {'n_layers': 3, 'embedding_dim': 96, 'lr': 0.0012329536436234642, 'lambda_val': 0.0477781106481976, 'batch_size': 1184, 'optimizer': 'Adam'}.
2026-06-17 18:25:54,719 - experiment_functions - INFO - Early stopping at epoch 550. Best Metrics: (0.0028660041223709624, 0.000663129973474801, 0.001805586209028958)
