2026-06-18 02:17:05,707 - optuna.study.study - INFO - Trial 242 finished with values: [0.0033448368070388445, 0.0007878615637236328, 0.0020618099325561833] and parameters: {'n_layers': 4, 'embedding_dim': 64, 'lr': 0.0006990102643278918, 'lambda_val': 0.002750666158846801, 'batch_size': 1884, 'optimizer': 'Adam'}.
2026-06-18 02:17:29,056 - experiment_functions - INFO - Early stopping at epoch 500. Best Metrics: (0.0004201463961131226, 0.00010736390046734874, 0.00022590677784288952)
2026-06-18 02:17:29,198 - optuna.study.study - INFO - Trial 243 finished with values: [0.0004201463961131226, 0.00010736390046734874, 0.00022590677784288952] and parameters: {'n_layers': 4, 'embedding_dim': 64, 'lr': 0.0006674090882881629, 'lambda_val': 8.358821106502712e-06, 'batch_size': 3948, 'optimizer': 'SGD'}.
2026-06-18 02:17:53,206 - experiment_functions - INFO - Early stopping at epoch 550. Best Metrics: (0.002080025322208161, 0.0005036630036630037, 0.001301025190600994)
2026-06-18 02:17:53,306 - optuna.study.study - INFO - Trial 244 finished with values: [0.002080025322208161, 0.0005036630036630037, 0.001301025190600994] and parameters: {'n_layers': 1, 'embedding_dim': 64, 'lr': 0.006587566772500326, 'lambda_val': 0.002750666158846801, 'batch_size': 1884, 'optimizer': 'RMSprop'}.
2026-06-18 02:19:35,313 - experiment_functions - INFO - Early stopping at epoch 2200. Best Metrics: (0.0037733980766617263, 0.0009520651762031072, 0.0023318465504914027)
2026-06-18 02:19:35,421 - optuna.study.study - INFO - Trial 245 finished with values: [0.0037733980766617263, 0.0009520651762031072, 0.0023318465504914027] and parameters: {'n_layers': 4, 'embedding_dim': 128, 'lr': 0.0006197690834854795, 'lambda_val': 3.6404845826373614e-05, 'batch_size': 3625, 'optimizer': 'RMSprop'}.
2026-06-18 02:20:09,689 - experiment_functions - INFO - Early stopping at epoch 700. Best Metrics: (0.0030650291037287412, 0.0008115447770620184, 0.0019395713430358874)
2026-06-18 02:20:09,790 - optuna.study.study - INFO - Trial 246 finished with values: [0.0030650291037287412, 0.0008115447770620184, 0.0019395713430358874] and parameters: {'n_layers': 4, 'embedding_dim': 128, 'lr': 0.0016427257095284614, 'lambda_val': 0.00224479684416678, 'batch_size': 2091, 'optimizer': 'RMSprop'}.
2026-06-18 02:21:04,751 - experiment_functions - INFO - Early stopping at epoch 1000. Best Metrics: (0.00364037115595233, 0.0009410130099785272, 0.002218654614451184)
2026-06-18 02:21:04,901 - optuna.study.study - INFO - Trial 247 finished with values: [0.00364037115595233, 0.0009410130099785272, 0.002218654614451184] and parameters: {'n_layers': 4, 'embedding_dim': 256, 'lr': 0.0023699548585448013, 'lambda_val': 2.89276545135167e-05, 'batch_size': 600, 'optimizer': 'RMSprop'}.
2026-06-18 02:21:30,422 - experiment_functions - INFO - Early stopping at epoch 550. Best Metrics: (0.002770228072135802, 0.0007499684223822155, 0.0017904970878885968)
2026-06-18 02:21:30,521 - optuna.study.study - INFO - Trial 248 finished with values: [0.002770228072135802, 0.0007499684223822155, 0.0017904970878885968] and parameters: {'n_layers': 4, 'embedding_dim': 64, 'lr': 0.00868681294635202, 'lambda_val': 0.0015914958177189133, 'batch_size': 962, 'optimizer': 'RMSprop'}.
2026-06-18 02:23:17,518 - experiment_functions - INFO - Early stopping at epoch 2000. Best Metrics: (0.003928363630223766, 0.000997852721990653, 0.002388279804883105)
2026-06-18 02:23:17,638 - optuna.study.study - INFO - Trial 249 finished with values: [0.003928363630223766, 0.000997852721990653, 0.002388279804883105] and parameters: {'n_layers': 4, 'embedding_dim': 256, 'lr': 0.0006197690834854795, 'lambda_val': 5.2739557437778345e-06, 'batch_size': 1582, 'optimizer': 'RMSprop'}.
2026-06-18 02:24:15,512 - experiment_functions - INFO - Early stopping at epoch 1200. Best Metrics: (0.0037338355368907897, 0.0009394341290893015, 0.002316300727079953)
2026-06-18 02:24:15,613 - optuna.study.study - INFO - Trial 250 finished with values: [0.0037338355368907897, 0.0009394341290893015, 0.002316300727079953] and parameters: {'n_layers': 4, 'embedding_dim': 128, 'lr': 0.0016427257095284614, 'lambda_val': 7.431054110368361e-06, 'batch_size': 526, 'optimizer': 'Adam'}.
2026-06-18 02:27:05,534 - optuna.study.study - INFO - Trial 251 finished with values: [0.0035979301716451916, 0.0008636478464064671, 0.002378336354256916] and parameters: {'n_layers': 4, 'embedding_dim': 64, 'lr': 0.0006197690834854795, 'lambda_val': 6.88069903527936e-06, 'batch_size': 600, 'optimizer': 'Adam'}.
2026-06-18 02:27:42,595 - experiment_functions - INFO - Early stopping at epoch 650. Best Metrics: (0.003137412214838638, 0.000841543513957307, 0.0019958490760545143)
2026-06-18 02:27:42,706 - optuna.study.study - INFO - Trial 252 finished with values: [0.003137412214838638, 0.000841543513957307, 0.0019958490760545143] and parameters: {'n_layers': 4, 'embedding_dim': 256, 'lr': 0.0023699548585448013, 'lambda_val': 0.00042717388022605387, 'batch_size': 600, 'optimizer': 'RMSprop'}.
2026-06-18 02:30:30,919 - optuna.study.study - INFO - Trial 253 finished with values: [0.0011838183572311278, 0.00026209422761146894, 0.0007212877971206822] and parameters: {'n_layers': 4, 'embedding_dim': 64, 'lr': 0.00010564785296901061, 'lambda_val': 0.002750666158846801, 'batch_size': 1659, 'optimizer': 'RMSprop'}.
2026-06-18 02:33:33,036 - optuna.study.study - INFO - Trial 254 finished with values: [0.0026125862835170485, 0.0006015536187949981, 0.001710143963552159] and parameters: {'n_layers': 4, 'embedding_dim': 128, 'lr': 0.0001838227643148536, 'lambda_val': 6.404094044497605e-05, 'batch_size': 2162, 'optimizer': 'RMSprop'}.
2026-06-18 02:34:32,815 - experiment_functions - INFO - Early stopping at epoch 1400. Best Metrics: (0.0037474204526587057, 0.0009694328659845902, 0.002432032811788088)
2026-06-18 02:34:32,964 - optuna.study.study - INFO - Trial 255 finished with values: [0.0037474204526587057, 0.0009694328659845902, 0.002432032811788088] and parameters: {'n_layers': 3, 'embedding_dim': 64, 'lr': 0.0023699548585448013, 'lambda_val': 2.89276545135167e-05, 'batch_size': 600, 'optimizer': 'RMSprop'}.
2026-06-18 02:34:58,689 - experiment_functions - INFO - Early stopping at epoch 550. Best Metrics: (0.003300542250806217, 0.000797334849058987, 0.002023850766030162)
2026-06-18 02:34:58,838 - optuna.study.study - INFO - Trial 256 finished with values: [0.003300542250806217, 0.000797334849058987, 0.002023850766030162] and parameters: {'n_layers': 4, 'embedding_dim': 64, 'lr': 0.013731766769501837, 'lambda_val': 2.2322765995099733e-06, 'batch_size': 1659, 'optimizer': 'Adam'}.
2026-06-18 02:35:43,519 - experiment_functions - INFO - Early stopping at epoch 800. Best Metrics: (0.003653837698166916, 0.0009425918908677528, 0.002267915233469637)
2026-06-18 02:35:43,827 - optuna.study.study - INFO - Trial 257 finished with values: [0.003653837698166916, 0.0009425918908677528, 0.002267915233469637] and parameters: {'n_layers': 4, 'embedding_dim': 256, 'lr': 0.0023699548585448013, 'lambda_val': 2.89276545135167e-05, 'batch_size': 600, 'optimizer': 'RMSprop'}.
2026-06-18 02:36:11,071 - experiment_functions - INFO - Early stopping at epoch 600. Best Metrics: (0.0028848666286457212, 0.0007357584943791841, 0.0018252981016046417)
2026-06-18 02:36:11,273 - optuna.study.study - INFO - Trial 258 finished with values: [0.0028848666286457212, 0.0007357584943791841, 0.0018252981016046417] and parameters: {'n_layers': 3, 'embedding_dim': 64, 'lr': 0.006316160795744164, 'lambda_val': 2.2322765995099733e-06, 'batch_size': 2762, 'optimizer': 'RMSprop'}.
2026-06-18 02:37:42,401 - experiment_functions - INFO - Early stopping at epoch 2200. Best Metrics: (0.0029067689895466283, 0.0006899709485916384, 0.0018299258430566445)
2026-06-18 02:37:42,519 - optuna.study.study - INFO - Trial 259 finished with values: [0.0029067689895466283, 0.0006899709485916384, 0.0018299258430566445] and parameters: {'n_layers': 1, 'embedding_dim': 96, 'lr': 0.0009259265868741952, 'lambda_val': 1.3372662561958538e-06, 'batch_size': 3885, 'optimizer': 'RMSprop'}.
2026-06-18 02:39:49,733 - experiment_functions - INFO - Early stopping at epoch 2750. Best Metrics: (0.004264868572241625, 0.001048376910445876, 0.0025755918919199115)
2026-06-18 02:39:49,845 - optuna.study.study - INFO - Trial 260 finished with values: [0.004264868572241625, 0.001048376910445876, 0.0025755918919199115] and parameters: {'n_layers': 4, 'embedding_dim': 128, 'lr': 0.0009259265868741952, 'lambda_val': 3.576975505685731e-06, 'batch_size': 526, 'optimizer': 'RMSprop'}.
2026-06-18 02:42:10,213 - experiment_functions - INFO - Early stopping at epoch 3450. Best Metrics: (0.0035950556464729388, 0.0008304913477327271, 0.0022581210080112055)
2026-06-18 02:42:10,617 - optuna.study.study - INFO - Trial 261 finished with values: [0.0035950556464729388, 0.0008304913477327271, 0.0022581210080112055] and parameters: {'n_layers': 4, 'embedding_dim': 32, 'lr': 0.0006197690834854795, 'lambda_val': 0.00010356766745754055, 'batch_size': 2778, 'optimizer': 'RMSprop'}.
2026-06-18 02:42:40,951 - experiment_functions - INFO - Early stopping at epoch 550. Best Metrics: (0.0031116670952674014, 0.0007673361121636983, 0.0020134211084315936)
2026-06-18 02:42:41,052 - optuna.study.study - INFO - Trial 262 finished with values: [0.0031116670952674014, 0.0007673361121636983, 0.0020134211084315936] and parameters: {'n_layers': 3, 'embedding_dim': 256, 'lr': 0.002692587283514102, 'lambda_val': 7.431054110368361e-06, 'batch_size': 2891, 'optimizer': 'RMSprop'}.
2026-06-18 02:44:14,448 - experiment_functions - INFO - Early stopping at epoch 2200. Best Metrics: (0.003894868661669083, 0.0009425918908677529, 0.002465914272896958)
2026-06-18 02:44:14,546 - optuna.study.study - INFO - Trial 263 finished with values: [0.003894868661669083, 0.0009425918908677529, 0.002465914272896958] and parameters: {'n_layers': 4, 'embedding_dim': 64, 'lr': 0.0006990102643278918, 'lambda_val': 0.0012144921171399186, 'batch_size': 810, 'optimizer': 'RMSprop'}.
2026-06-18 02:45:52,433 - experiment_functions - INFO - Early stopping at epoch 2300. Best Metrics: (0.0037704623256498214, 0.0008636478464064671, 0.0023523955297366822)
2026-06-18 02:45:52,614 - optuna.study.study - INFO - Trial 264 finished with values: [0.0037704623256498214, 0.0008636478464064671, 0.0023523955297366822] and parameters: {'n_layers': 3, 'embedding_dim': 64, 'lr': 0.0006197690834854795, 'lambda_val': 3.6404845826373614e-05, 'batch_size': 2889, 'optimizer': 'RMSprop'}.
2026-06-18 02:46:36,724 - experiment_functions - INFO - Early stopping at epoch 1000. Best Metrics: (0.003340928163398587, 0.0008731211317418214, 0.0021143942611539716)
2026-06-18 02:46:37,110 - optuna.study.study - INFO - Trial 265 finished with values: [0.003340928163398587, 0.0008731211317418214, 0.0021143942611539716] and parameters: {'n_layers': 4, 'embedding_dim': 64, 'lr': 0.0016427257095284614, 'lambda_val': 5.457658984787656e-05, 'batch_size': 2892, 'optimizer': 'RMSprop'}.
2026-06-18 02:47:11,237 - experiment_functions - INFO - Early stopping at epoch 700. Best Metrics: (0.0033762593892050032, 0.0008747000126310472, 0.0021621908975035424)
2026-06-18 02:47:11,318 - optuna.study.study - INFO - Trial 266 finished with values: [0.0033762593892050032, 0.0008747000126310472, 0.0021621908975035424] and parameters: {'n_layers': 4, 'embedding_dim': 128, 'lr': 0.002692587283514102, 'lambda_val': 3.6404845826373614e-05, 'batch_size': 1625, 'optimizer': 'RMSprop'}.
2026-06-18 02:47:42,302 - experiment_functions - INFO - Early stopping at epoch 650. Best Metrics: (0.0030856641983763055, 0.0007610205886067955, 0.0019543771934010406)
2026-06-18 02:47:43,011 - optuna.study.study - INFO - Trial 267 finished with values: [0.0030856641983763055, 0.0007610205886067955, 0.0019543771934010406] and parameters: {'n_layers': 3, 'embedding_dim': 128, 'lr': 0.0023699548585448013, 'lambda_val': 2.89276545135167e-05, 'batch_size': 3532, 'optimizer': 'RMSprop'}.
2026-06-18 02:48:34,935 - experiment_functions - INFO - Early stopping at epoch 1100. Best Metrics: (0.003384963704989302, 0.00084785903751421, 0.002099035880758376)
2026-06-18 02:48:34,996 - optuna.study.study - INFO - Trial 268 finished with values: [0.003384963704989302, 0.00084785903751421, 0.002099035880758376] and parameters: {'n_layers': 4, 'embedding_dim': 128, 'lr': 0.0006197690834854795, 'lambda_val': 0.0012161946689456778, 'batch_size': 2889, 'optimizer': 'RMSprop'}.
2026-06-18 02:49:09,314 - experiment_functions - INFO - Early stopping at epoch 800. Best Metrics: (0.003264520713530032, 0.0007294429708222812, 0.0021481475314215556)
2026-06-18 02:49:10,320 - optuna.study.study - INFO - Trial 269 finished with values: [0.003264520713530032, 0.0007294429708222812, 0.0021481475314215556] and parameters: {'n_layers': 2, 'embedding_dim': 64, 'lr': 0.0016427257095284614, 'lambda_val': 0.0015914958177189133, 'batch_size': 1228, 'optimizer': 'RMSprop'}.
2026-06-18 02:49:43,334 - experiment_functions - INFO - Early stopping at epoch 700. Best Metrics: (0.0036829659275003507, 0.0008999621068586586, 0.002297083978963638)
2026-06-18 02:49:43,399 - optuna.study.study - INFO - Trial 270 finished with values: [0.0036829659275003507, 0.0008999621068586586, 0.002297083978963638] and parameters: {'n_layers': 3, 'embedding_dim': 128, 'lr': 0.0023699548585448013, 'lambda_val': 5.2739557437778345e-06, 'batch_size': 1582, 'optimizer': 'RMSprop'}.
2026-06-18 02:50:44,871 - experiment_functions - INFO - Early stopping at epoch 1200. Best Metrics: (0.003014199669970193, 0.0007799671592775041, 0.001957758621489794)
2026-06-18 02:50:45,219 - optuna.study.study - INFO - Trial 271 finished with values: [0.003014199669970193, 0.0007799671592775041, 0.001957758621489794] and parameters: {'n_layers': 3, 'embedding_dim': 256, 'lr': 0.0006197690834854795, 'lambda_val': 0.0012144921171399186, 'batch_size': 1625, 'optimizer': 'RMSprop'}.
2026-06-18 02:51:12,540 - experiment_functions - INFO - Early stopping at epoch 550. Best Metrics: (0.002225932163677478, 0.0006110269041303525, 0.0015116669092550394)
2026-06-18 02:51:12,611 - optuna.study.study - INFO - Trial 272 finished with values: [0.002225932163677478, 0.0006110269041303525, 0.0015116669092550394] and parameters: {'n_layers': 4, 'embedding_dim': 128, 'lr': 0.07463181959524243, 'lambda_val': 3.6404845826373614e-05, 'batch_size': 2889, 'optimizer': 'Adam'}.
2026-06-18 02:51:34,673 - experiment_functions - INFO - Early stopping at epoch 500. Best Metrics: (0.0006955225436396876, 0.00013420487558418593, 0.00037230082439884487)
2026-06-18 02:51:34,789 - optuna.study.study - INFO - Trial 273 finished with values: [0.0006955225436396876, 0.00013420487558418593, 0.00037230082439884487] and parameters: {'n_layers': 3, 'embedding_dim': 32, 'lr': 0.0006197690834854795, 'lambda_val': 0.0012161946689456778, 'batch_size': 810, 'optimizer': 'SGD'}.
2026-06-18 02:52:45,181 - experiment_functions - INFO - Early stopping at epoch 1700. Best Metrics: (0.003369463318868614, 0.0007625994694960213, 0.0020412766240106924)
2026-06-18 02:52:45,333 - optuna.study.study - INFO - Trial 274 finished with values: [0.003369463318868614, 0.0007625994694960213, 0.0020412766240106924] and parameters: {'n_layers': 2, 'embedding_dim': 64, 'lr': 0.0010386063162588332, 'lambda_val': 3.6404845826373614e-05, 'batch_size': 2889, 'optimizer': 'RMSprop'}.
2026-06-18 02:53:16,854 - experiment_functions - INFO - Early stopping at epoch 750. Best Metrics: (0.00283301668055905, 0.0006347101174687382, 0.001707107560005786)
2026-06-18 02:53:17,303 - optuna.study.study - INFO - Trial 275 finished with values: [0.00283301668055905, 0.0006347101174687382, 0.001707107560005786] and parameters: {'n_layers': 1, 'embedding_dim': 32, 'lr': 0.0025545187851628236, 'lambda_val': 5.808010120101344e-06, 'batch_size': 1228, 'optimizer': 'Adam'}.
2026-06-18 02:53:55,165 - experiment_functions - INFO - Early stopping at epoch 900. Best Metrics: (0.0036245444623296177, 0.0008289124668435014, 0.0023020873052853846)
2026-06-18 02:53:55,237 - optuna.study.study - INFO - Trial 276 finished with values: [0.0036245444623296177, 0.0008289124668435014, 0.0023020873052853846] and parameters: {'n_layers': 3, 'embedding_dim': 32, 'lr': 0.002692587283514102, 'lambda_val': 7.431054110368361e-06, 'batch_size': 1255, 'optimizer': 'RMSprop'}.
2026-06-18 02:54:18,892 - experiment_functions - INFO - Early stopping at epoch 500. Best Metrics: (0.0004374970911642605, 9.946949602122017e-05, 0.00023452796197313394)
2026-06-18 02:54:20,319 - optuna.study.study - INFO - Trial 277 finished with values: [0.0004374970911642605, 9.946949602122017e-05, 0.00023452796197313394] and parameters: {'n_layers': 3, 'embedding_dim': 128, 'lr': 0.0004549372452973367, 'lambda_val': 3.6404845826373614e-05, 'batch_size': 1008, 'optimizer': 'SGD'}.
2026-06-18 02:55:24,405 - experiment_functions - INFO - Early stopping at epoch 1500. Best Metrics: (0.003947488041355386, 0.000993116079322976, 0.002519578179851291)
2026-06-18 02:55:24,479 - optuna.study.study - INFO - Trial 278 finished with values: [0.003947488041355386, 0.000993116079322976, 0.002519578179851291] and parameters: {'n_layers': 4, 'embedding_dim': 64, 'lr': 0.0016427257095284614, 'lambda_val': 5.470239525476512e-06, 'batch_size': 962, 'optimizer': 'RMSprop'}.
2026-06-18 02:56:43,046 - experiment_functions - INFO - Early stopping at epoch 1950. Best Metrics: (0.003635114506281808, 0.0009331186055323988, 0.002356834901240752)
2026-06-18 02:56:43,127 - optuna.study.study - INFO - Trial 279 finished with values: [0.003635114506281808, 0.0009331186055323988, 0.002356834901240752] and parameters: {'n_layers': 3, 'embedding_dim': 32, 'lr': 0.002692587283514102, 'lambda_val': 6.88069903527936e-06, 'batch_size': 600, 'optimizer': 'RMSprop'}.
2026-06-18 02:59:00,955 - experiment_functions - INFO - Early stopping at epoch 3500. Best Metrics: (0.0037455723971992106, 0.0008004926108374384, 0.002270559681540454)
2026-06-18 02:59:01,028 - optuna.study.study - INFO - Trial 280 finished with values: [0.0037455723971992106, 0.0008004926108374384, 0.002270559681540454] and parameters: {'n_layers': 1, 'embedding_dim': 32, 'lr': 0.0006197690834854795, 'lambda_val': 3.6404845826373614e-05, 'batch_size': 1130, 'optimizer': 'RMSprop'}.
2026-06-18 03:00:26,502 - experiment_functions - INFO - Early stopping at epoch 1800. Best Metrics: (0.0020680534777105077, 0.0005905014525704181, 0.0013326252959553544)
2026-06-18 03:00:26,599 - optuna.study.study - INFO - Trial 281 finished with values: [0.0020680534777105077, 0.0005905014525704181, 0.0013326252959553544] and parameters: {'n_layers': 2, 'embedding_dim': 256, 'lr': 0.0006990102643278918, 'lambda_val': 0.038728283672750836, 'batch_size': 600, 'optimizer': 'RMSprop'}.
2026-06-18 03:01:24,149 - experiment_functions - INFO - Early stopping at epoch 1050. Best Metrics: (0.0034819782804961425, 0.0009441707717569786, 0.0022174418051798274)
2026-06-18 03:01:24,223 - optuna.study.study - INFO - Trial 282 finished with values: [0.0034819782804961425, 0.0009441707717569786, 0.0022174418051798274] and parameters: {'n_layers': 4, 'embedding_dim': 256, 'lr': 0.0023699548585448013, 'lambda_val': 2.2322765995099733e-06, 'batch_size': 600, 'optimizer': 'RMSprop'}.
2026-06-18 03:03:38,716 - experiment_functions - INFO - Early stopping at epoch 3250. Best Metrics: (0.003353314395710786, 0.0008115447770620184, 0.002199852834771774)
2026-06-18 03:03:38,789 - optuna.study.study - INFO - Trial 283 finished with values: [0.003353314395710786, 0.0008115447770620184, 0.002199852834771774] and parameters: {'n_layers': 3, 'embedding_dim': 64, 'lr': 0.0006197690834854795, 'lambda_val': 3.6404845826373614e-05, 'batch_size': 2748, 'optimizer': 'RMSprop'}.
2026-06-18 03:05:44,166 - experiment_functions - INFO - Early stopping at epoch 2750. Best Metrics: (0.003797493443978705, 0.0009568018188707844, 0.002357767128706788)
2026-06-18 03:05:44,234 - optuna.study.study - INFO - Trial 284 finished with values: [0.003797493443978705, 0.0009568018188707844, 0.002357767128706788] and parameters: {'n_layers': 4, 'embedding_dim': 128, 'lr': 0.0006197690834854795, 'lambda_val': 6.404094044497605e-05, 'batch_size': 2162, 'optimizer': 'RMSprop'}.
2026-06-18 03:07:42,319 - experiment_functions - INFO - Early stopping at epoch 2800. Best Metrics: (0.0036339527694627272, 0.00090311986863711, 0.0023518859795956014)
2026-06-18 03:07:42,392 - optuna.study.study - INFO - Trial 285 finished with values: [0.0036339527694627272, 0.00090311986863711, 0.0023518859795956014] and parameters: {'n_layers': 4, 'embedding_dim': 64, 'lr': 0.0006197690834854795, 'lambda_val': 3.6404845826373614e-05, 'batch_size': 1884, 'optimizer': 'RMSprop'}.
2026-06-18 03:08:11,908 - experiment_functions - INFO - Early stopping at epoch 600. Best Metrics: (0.0031594713170865632, 0.0008083870152835671, 0.0020309030614527987)
2026-06-18 03:08:11,985 - optuna.study.study - INFO - Trial 286 finished with values: [0.0031594713170865632, 0.0008083870152835671, 0.0020309030614527987] and parameters: {'n_layers': 4, 'embedding_dim': 128, 'lr': 0.002692587283514102, 'lambda_val': 3.6404845826373614e-05, 'batch_size': 2889, 'optimizer': 'RMSprop'}.
2026-06-18 03:10:37,633 - experiment_functions - INFO - Early stopping at epoch 3300. Best Metrics: (0.0038643947098001195, 0.0009568018188707843, 0.0024656667027435067)
2026-06-18 03:10:37,707 - optuna.study.study - INFO - Trial 287 finished with values: [0.0038643947098001195, 0.0009568018188707843, 0.0024656667027435067] and parameters: {'n_layers': 3, 'embedding_dim': 128, 'lr': 0.0006197690834854795, 'lambda_val': 3.6404845826373614e-05, 'batch_size': 1580, 'optimizer': 'RMSprop'}.
2026-06-18 03:11:37,281 - experiment_functions - INFO - Early stopping at epoch 1350. Best Metrics: (0.003258334837903301, 0.0007847038019451813, 0.002042522860290528)
