2026-06-21 15:20:59,923 - optuna.study.study - INFO - Trial 253 finished with values: [0.010828902703247795, 0.002671466464569913, 0.006562424434856811] and parameters: {'n_layers': 4, 'embedding_dim': 128, 'lr': 0.0006104134330921928, 'lambda_val': 2.5744682794480333e-06, 'batch_size': 1655, 'optimizer': 'Adam'}.
2026-06-21 15:21:24,476 - experiment_functions - INFO - Early stopping at epoch 550. Best Metrics: (0.007892728982807951, 0.001992547682202855, 0.00476042729137467)
2026-06-21 15:21:24,533 - optuna.study.study - INFO - Trial 254 finished with values: [0.007892728982807951, 0.001992547682202855, 0.00476042729137467] and parameters: {'n_layers': 4, 'embedding_dim': 32, 'lr': 0.004788707676977112, 'lambda_val': 0.00037941540794106203, 'batch_size': 2732, 'optimizer': 'RMSprop'}.
2026-06-21 15:24:03,989 - optuna.study.study - INFO - Trial 255 finished with values: [0.0058557120143947535, 0.0014352027283061767, 0.003714297222654328] and parameters: {'n_layers': 2, 'embedding_dim': 32, 'lr': 0.0008890810320593691, 'lambda_val': 0.004307956858866856, 'batch_size': 1014, 'optimizer': 'Adam'}.
2026-06-21 15:25:57,848 - experiment_functions - INFO - Early stopping at epoch 2500. Best Metrics: (0.011021267103969393, 0.0027740937223695848, 0.006492901883952855)
2026-06-21 15:25:57,917 - optuna.study.study - INFO - Trial 256 finished with values: [0.011021267103969393, 0.0027740937223695848, 0.006492901883952855] and parameters: {'n_layers': 4, 'embedding_dim': 96, 'lr': 0.0005405212661976008, 'lambda_val': 0.00034129251188470285, 'batch_size': 2399, 'optimizer': 'Adam'}.
2026-06-21 15:28:49,976 - optuna.study.study - INFO - Trial 257 finished with values: [0.011139813498746326, 0.002772514841480359, 0.006912546915499558] and parameters: {'n_layers': 4, 'embedding_dim': 64, 'lr': 0.0004419346142273276, 'lambda_val': 0.00036884249384628963, 'batch_size': 2399, 'optimizer': 'RMSprop'}.
2026-06-21 15:29:19,832 - experiment_functions - INFO - Early stopping at epoch 650. Best Metrics: (0.009077156616118296, 0.0022562207907035493, 0.0055484591399954)
2026-06-21 15:29:19,930 - optuna.study.study - INFO - Trial 258 finished with values: [0.009077156616118296, 0.0022562207907035493, 0.0055484591399954] and parameters: {'n_layers': 4, 'embedding_dim': 64, 'lr': 0.0044739262759054006, 'lambda_val': 0.0002534167291701876, 'batch_size': 1602, 'optimizer': 'Adam'}.
2026-06-21 15:30:40,281 - experiment_functions - INFO - Early stopping at epoch 1800. Best Metrics: (0.000619138364355608, 0.0001405203991410888, 0.0003558898887190515)
2026-06-21 15:30:40,369 - optuna.study.study - INFO - Trial 259 finished with values: [0.000619138364355608, 0.0001405203991410888, 0.0003558898887190515] and parameters: {'n_layers': 4, 'embedding_dim': 96, 'lr': 3.180773661842381e-05, 'lambda_val': 0.00037941540794106203, 'batch_size': 2464, 'optimizer': 'RMSprop'}.
2026-06-21 15:33:25,328 - optuna.study.study - INFO - Trial 260 finished with values: [0.014703337058167001, 0.0035272199065302517, 0.008985187910886558] and parameters: {'n_layers': 4, 'embedding_dim': 32, 'lr': 0.0008890810320593691, 'lambda_val': 2.5744682794480333e-06, 'batch_size': 1014, 'optimizer': 'RMSprop'}.
2026-06-21 15:37:05,302 - optuna.study.study - INFO - Trial 261 finished with values: [0.012312610191295715, 0.0030093469748642162, 0.007488354964769082] and parameters: {'n_layers': 4, 'embedding_dim': 256, 'lr': 0.0004419346142273276, 'lambda_val': 0.00036884249384628963, 'batch_size': 725, 'optimizer': 'RMSprop'}.
2026-06-21 15:37:36,174 - experiment_functions - INFO - Early stopping at epoch 550. Best Metrics: (0.005975504726950045, 0.0014620437034230137, 0.0032588544883381306)
2026-06-21 15:37:36,315 - optuna.study.study - INFO - Trial 262 finished with values: [0.005975504726950045, 0.0014620437034230137, 0.0032588544883381306] and parameters: {'n_layers': 3, 'embedding_dim': 256, 'lr': 0.004051056337067167, 'lambda_val': 0.001631679896094288, 'batch_size': 3241, 'optimizer': 'RMSprop'}.
2026-06-21 15:40:14,641 - optuna.study.study - INFO - Trial 263 finished with values: [0.004064674088994967, 0.0008447012757357584, 0.00242073331862627] and parameters: {'n_layers': 1, 'embedding_dim': 64, 'lr': 0.0006104134330921928, 'lambda_val': 2.854699329527242e-06, 'batch_size': 3322, 'optimizer': 'Adam'}.
2026-06-21 15:42:51,535 - optuna.study.study - INFO - Trial 264 finished with values: [0.005288353349249298, 0.0011715296198054818, 0.003084927111879307] and parameters: {'n_layers': 1, 'embedding_dim': 32, 'lr': 0.0008890810320593691, 'lambda_val': 2.5744682794480333e-06, 'batch_size': 2399, 'optimizer': 'RMSprop'}.
2026-06-21 15:43:56,470 - experiment_functions - INFO - Early stopping at epoch 1400. Best Metrics: (0.009520083249635658, 0.0023935834280661866, 0.005833370444743138)
2026-06-21 15:43:56,557 - optuna.study.study - INFO - Trial 265 finished with values: [0.009520083249635658, 0.0023935834280661866, 0.005833370444743138] and parameters: {'n_layers': 4, 'embedding_dim': 96, 'lr': 0.0008890810320593691, 'lambda_val': 2.854699329527242e-06, 'batch_size': 3322, 'optimizer': 'Adam'}.
2026-06-21 15:45:24,367 - experiment_functions - INFO - Early stopping at epoch 2100. Best Metrics: (0.012088538300816633, 0.00296355942907667, 0.0071944295415398134)
2026-06-21 15:45:24,456 - optuna.study.study - INFO - Trial 266 finished with values: [0.012088538300816633, 0.00296355942907667, 0.0071944295415398134] and parameters: {'n_layers': 4, 'embedding_dim': 32, 'lr': 0.0008890810320593691, 'lambda_val': 2.5744682794480333e-06, 'batch_size': 2732, 'optimizer': 'RMSprop'}.
2026-06-21 15:45:53,290 - experiment_functions - INFO - Early stopping at epoch 650. Best Metrics: (0.007996746021395097, 0.002043071870658078, 0.0048765751065149516)
2026-06-21 15:45:53,373 - optuna.study.study - INFO - Trial 267 finished with values: [0.007996746021395097, 0.002043071870658078, 0.0048765751065149516] and parameters: {'n_layers': 4, 'embedding_dim': 32, 'lr': 0.0044739262759054006, 'lambda_val': 1.9888087490246264e-06, 'batch_size': 3352, 'optimizer': 'Adam'}.
2026-06-21 15:48:29,884 - optuna.study.study - INFO - Trial 268 finished with values: [0.0034277562285794853, 0.000735758494379184, 0.002027923822688846] and parameters: {'n_layers': 1, 'embedding_dim': 32, 'lr': 0.0004801260196774361, 'lambda_val': 2.5744682794480333e-06, 'batch_size': 3322, 'optimizer': 'Adam'}.
2026-06-21 15:50:12,210 - experiment_functions - INFO - Early stopping at epoch 2300. Best Metrics: (0.0007381803994707157, 0.00016104585070102312, 0.00038780201579749127)
2026-06-21 15:50:12,296 - optuna.study.study - INFO - Trial 269 finished with values: [0.0007381803994707157, 0.00016104585070102312, 0.00038780201579749127] and parameters: {'n_layers': 4, 'embedding_dim': 96, 'lr': 5.860010859685217e-05, 'lambda_val': 6.059814023598347e-06, 'batch_size': 2062, 'optimizer': 'Adam'}.
2026-06-21 15:50:50,769 - experiment_functions - INFO - Early stopping at epoch 650. Best Metrics: (0.007934316923207077, 0.0019909688013136292, 0.004726789410923104)
2026-06-21 15:50:50,862 - optuna.study.study - INFO - Trial 270 finished with values: [0.007934316923207077, 0.0019909688013136292, 0.004726789410923104] and parameters: {'n_layers': 4, 'embedding_dim': 256, 'lr': 0.0044739262759054006, 'lambda_val': 2.7653115807127865e-05, 'batch_size': 1014, 'optimizer': 'Adam'}.
2026-06-21 15:52:03,281 - experiment_functions - INFO - Early stopping at epoch 1700. Best Metrics: (0.011031776335185763, 0.002723569533914361, 0.006754778804254082)
2026-06-21 15:52:03,365 - optuna.study.study - INFO - Trial 271 finished with values: [0.011031776335185763, 0.002723569533914361, 0.006754778804254082] and parameters: {'n_layers': 4, 'embedding_dim': 32, 'lr': 0.0008890810320593691, 'lambda_val': 0.00036884249384628963, 'batch_size': 3241, 'optimizer': 'RMSprop'}.
2026-06-21 15:53:29,179 - experiment_functions - INFO - Early stopping at epoch 2050. Best Metrics: (0.011343965486077018, 0.0028072502210433246, 0.006741895551916645)
2026-06-21 15:53:29,263 - optuna.study.study - INFO - Trial 272 finished with values: [0.011343965486077018, 0.0028072502210433246, 0.006741895551916645] and parameters: {'n_layers': 4, 'embedding_dim': 32, 'lr': 0.0008890810320593691, 'lambda_val': 1.9888087490246264e-06, 'batch_size': 2813, 'optimizer': 'RMSprop'}.
2026-06-21 15:54:16,759 - experiment_functions - INFO - Early stopping at epoch 1050. Best Metrics: (0.01063135729148242, 0.0026714664645699133, 0.00635559801264285)
2026-06-21 15:54:16,848 - optuna.study.study - INFO - Trial 273 finished with values: [0.01063135729148242, 0.0026714664645699133, 0.00635559801264285] and parameters: {'n_layers': 4, 'embedding_dim': 64, 'lr': 0.0008890810320593691, 'lambda_val': 2.5744682794480333e-06, 'batch_size': 3322, 'optimizer': 'RMSprop'}.
2026-06-21 15:57:02,478 - optuna.study.study - INFO - Trial 274 finished with values: [0.01014514901957538, 0.002407793356069218, 0.006175780378491875] and parameters: {'n_layers': 4, 'embedding_dim': 32, 'lr': 0.0003941995846468513, 'lambda_val': 0.0002491576543882324, 'batch_size': 2732, 'optimizer': 'RMSprop'}.
2026-06-21 15:59:42,390 - optuna.study.study - INFO - Trial 275 finished with values: [0.0029368163826062775, 0.0006662877352532525, 0.0017518096857520621] and parameters: {'n_layers': 2, 'embedding_dim': 32, 'lr': 0.00029840191316354815, 'lambda_val': 0.0002491576543882324, 'batch_size': 2732, 'optimizer': 'Adam'}.
2026-06-21 16:00:09,255 - experiment_functions - INFO - Early stopping at epoch 600. Best Metrics: (0.009731903886267667, 0.002447265378299861, 0.0060089690580426534)
2026-06-21 16:00:09,339 - optuna.study.study - INFO - Trial 276 finished with values: [0.009731903886267667, 0.002447265378299861, 0.0060089690580426534] and parameters: {'n_layers': 4, 'embedding_dim': 32, 'lr': 0.0033418420074577443, 'lambda_val': 5.165889563766286e-06, 'batch_size': 2281, 'optimizer': 'RMSprop'}.
2026-06-21 16:00:44,724 - experiment_functions - INFO - Early stopping at epoch 750. Best Metrics: (0.008321372361148865, 0.002115700391562461, 0.004969900219899236)
2026-06-21 16:00:44,818 - optuna.study.study - INFO - Trial 277 finished with values: [0.008321372361148865, 0.002115700391562461, 0.004969900219899236] and parameters: {'n_layers': 3, 'embedding_dim': 96, 'lr': 0.003566354885654931, 'lambda_val': 0.00016600687348122085, 'batch_size': 1006, 'optimizer': 'Adam'}.
2026-06-21 16:03:35,851 - optuna.study.study - INFO - Trial 278 finished with values: [0.010498764930909522, 0.002592522420108627, 0.006418704339027771] and parameters: {'n_layers': 4, 'embedding_dim': 64, 'lr': 0.0003941995846468513, 'lambda_val': 0.00037941540794106203, 'batch_size': 2732, 'optimizer': 'RMSprop'}.
2026-06-21 16:04:12,429 - experiment_functions - INFO - Early stopping at epoch 800. Best Metrics: (0.009803868891131813, 0.002459896425413667, 0.005989924635608016)
2026-06-21 16:04:12,694 - optuna.study.study - INFO - Trial 279 finished with values: [0.009803868891131813, 0.002459896425413667, 0.005989924635608016] and parameters: {'n_layers': 4, 'embedding_dim': 64, 'lr': 0.003566354885654931, 'lambda_val': 3.9887191135608415e-06, 'batch_size': 1014, 'optimizer': 'Adam'}.
2026-06-21 16:05:05,886 - experiment_functions - INFO - Early stopping at epoch 1150. Best Metrics: (0.009147354652682472, 0.0023714790956170266, 0.005549360672532501)
2026-06-21 16:05:05,990 - optuna.study.study - INFO - Trial 280 finished with values: [0.009147354652682472, 0.0023714790956170266, 0.005549360672532501] and parameters: {'n_layers': 4, 'embedding_dim': 96, 'lr': 0.0008890810320593691, 'lambda_val': 0.00034129251188470285, 'batch_size': 2399, 'optimizer': 'Adam'}.
2026-06-21 16:07:44,343 - optuna.study.study - INFO - Trial 281 finished with values: [0.004935950683336449, 0.001053113553113553, 0.0029999399528964207] and parameters: {'n_layers': 2, 'embedding_dim': 32, 'lr': 0.0006104134330921928, 'lambda_val': 5.165889563766286e-06, 'batch_size': 975, 'optimizer': 'Adam'}.
2026-06-21 16:08:53,462 - experiment_functions - INFO - Early stopping at epoch 1650. Best Metrics: (0.011031643600417475, 0.0027898825312618414, 0.006757476412253104)
2026-06-21 16:08:53,534 - optuna.study.study - INFO - Trial 282 finished with values: [0.011031643600417475, 0.0027898825312618414, 0.006757476412253104] and parameters: {'n_layers': 4, 'embedding_dim': 32, 'lr': 0.0008890810320593691, 'lambda_val': 6.059814023598347e-06, 'batch_size': 3322, 'optimizer': 'RMSprop'}.
2026-06-21 16:11:48,595 - optuna.study.study - INFO - Trial 283 finished with values: [0.008879122239508451, 0.002178855627131489, 0.0056259529534401515] and parameters: {'n_layers': 3, 'embedding_dim': 96, 'lr': 0.0003941995846468513, 'lambda_val': 1.00362290309107e-06, 'batch_size': 2732, 'optimizer': 'RMSprop'}.
2026-06-21 16:14:30,442 - optuna.study.study - INFO - Trial 284 finished with values: [0.008001355228933438, 0.0019720222306429205, 0.004941442189483077] and parameters: {'n_layers': 3, 'embedding_dim': 32, 'lr': 0.0004419346142273276, 'lambda_val': 0.00036884249384628963, 'batch_size': 3241, 'optimizer': 'RMSprop'}.
2026-06-21 16:17:23,362 - optuna.study.study - INFO - Trial 285 finished with values: [0.008271870209882003, 0.001907288114184666, 0.005131489040769225] and parameters: {'n_layers': 3, 'embedding_dim': 96, 'lr': 0.0004419346142273276, 'lambda_val': 2.5744682794480333e-06, 'batch_size': 1014, 'optimizer': 'RMSprop'}.
2026-06-21 16:20:00,680 - experiment_functions - INFO - Early stopping at epoch 3900. Best Metrics: (0.0005376780368870169, 0.00011525830491347732, 0.0002741629249147418)
2026-06-21 16:20:00,770 - optuna.study.study - INFO - Trial 286 finished with values: [0.0005376780368870169, 0.00011525830491347732, 0.0002741629249147418] and parameters: {'n_layers': 2, 'embedding_dim': 64, 'lr': 2.133002539941758e-05, 'lambda_val': 0.0006090838281601204, 'batch_size': 2732, 'optimizer': 'RMSprop'}.
2026-06-21 16:20:29,266 - experiment_functions - INFO - Early stopping at epoch 650. Best Metrics: (0.00771937995151085, 0.0019120247568523432, 0.004620773055432221)
2026-06-21 16:20:29,355 - optuna.study.study - INFO - Trial 287 finished with values: [0.00771937995151085, 0.0019120247568523432, 0.004620773055432221] and parameters: {'n_layers': 3, 'embedding_dim': 32, 'lr': 0.004051056337067167, 'lambda_val': 1.6213630924331792e-06, 'batch_size': 3386, 'optimizer': 'RMSprop'}.
2026-06-21 16:23:23,766 - experiment_functions - INFO - Early stopping at epoch 3900. Best Metrics: (0.012297341611078878, 0.002982505999747379, 0.007369228198035259)
2026-06-21 16:23:23,834 - optuna.study.study - INFO - Trial 288 finished with values: [0.012297341611078878, 0.002982505999747379, 0.007369228198035259] and parameters: {'n_layers': 4, 'embedding_dim': 96, 'lr': 0.0006104134330921928, 'lambda_val': 0.0002534167291701876, 'batch_size': 1602, 'optimizer': 'RMSprop'}.
2026-06-21 16:23:47,761 - experiment_functions - INFO - Early stopping at epoch 550. Best Metrics: (0.0037894933329377274, 0.000948907414424656, 0.002327007947697703)
2026-06-21 16:23:47,842 - optuna.study.study - INFO - Trial 289 finished with values: [0.0037894933329377274, 0.000948907414424656, 0.002327007947697703] and parameters: {'n_layers': 3, 'embedding_dim': 32, 'lr': 0.025832712573880205, 'lambda_val': 2.5744682794480333e-06, 'batch_size': 975, 'optimizer': 'RMSprop'}.
2026-06-21 16:24:21,959 - experiment_functions - INFO - Early stopping at epoch 750. Best Metrics: (0.007887002130293566, 0.0020304408235442715, 0.004696234405869281)
2026-06-21 16:24:22,064 - optuna.study.study - INFO - Trial 290 finished with values: [0.007887002130293566, 0.0020304408235442715, 0.004696234405869281] and parameters: {'n_layers': 4, 'embedding_dim': 64, 'lr': 0.0044739262759054006, 'lambda_val': 6.059814023598347e-06, 'batch_size': 1014, 'optimizer': 'RMSprop'}.
2026-06-21 16:24:51,895 - experiment_functions - INFO - Early stopping at epoch 650. Best Metrics: (0.008039512967163832, 0.002013073133762789, 0.004775314965352249)
2026-06-21 16:24:51,991 - optuna.study.study - INFO - Trial 291 finished with values: [0.008039512967163832, 0.002013073133762789, 0.004775314965352249] and parameters: {'n_layers': 4, 'embedding_dim': 64, 'lr': 0.0044739262759054006, 'lambda_val': 1.9888087490246264e-06, 'batch_size': 4067, 'optimizer': 'Adam'}.
2026-06-21 16:25:13,875 - experiment_functions - INFO - Early stopping at epoch 500. Best Metrics: (0.00043853048118383796, 0.00011052166224580017, 0.00023365202358258827)
2026-06-21 16:25:13,963 - optuna.study.study - INFO - Trial 292 finished with values: [0.00043853048118383796, 0.00011052166224580017, 0.00023365202358258827] and parameters: {'n_layers': 1, 'embedding_dim': 32, 'lr': 0.0008890810320593691, 'lambda_val': 0.0002491576543882324, 'batch_size': 1014, 'optimizer': 'SGD'}.
2026-06-21 16:27:54,565 - optuna.study.study - INFO - Trial 293 finished with values: [0.007585167051769966, 0.0017936086901604142, 0.004697692661071234] and parameters: {'n_layers': 3, 'embedding_dim': 32, 'lr': 0.0004419346142273276, 'lambda_val': 2.5744682794480333e-06, 'batch_size': 3241, 'optimizer': 'RMSprop'}.
2026-06-21 16:30:36,889 - optuna.study.study - INFO - Trial 294 finished with values: [0.0037610370844745156, 0.0008162814197296955, 0.002332777985841298] and parameters: {'n_layers': 1, 'embedding_dim': 96, 'lr': 0.0003941995846468513, 'lambda_val': 1.00362290309107e-06, 'batch_size': 3241, 'optimizer': 'RMSprop'}.
2026-06-21 16:31:06,827 - experiment_functions - INFO - Early stopping at epoch 650. Best Metrics: (0.007960993499665142, 0.002039914108879626, 0.0047964701780385)
2026-06-21 16:31:06,911 - optuna.study.study - INFO - Trial 295 finished with values: [0.007960993499665142, 0.002039914108879626, 0.0047964701780385] and parameters: {'n_layers': 4, 'embedding_dim': 64, 'lr': 0.0044739262759054006, 'lambda_val': 6.059814023598347e-06, 'batch_size': 2986, 'optimizer': 'Adam'}.
2026-06-21 16:32:04,366 - experiment_functions - INFO - Early stopping at epoch 1300. Best Metrics: (0.011682496870581266, 0.002881457622836933, 0.007087482145667141)
2026-06-21 16:32:04,452 - optuna.study.study - INFO - Trial 296 finished with values: [0.011682496870581266, 0.002881457622836933, 0.007087482145667141] and parameters: {'n_layers': 4, 'embedding_dim': 64, 'lr': 0.0008890810320593691, 'lambda_val': 2.5744682794480333e-06, 'batch_size': 2399, 'optimizer': 'RMSprop'}.
2026-06-21 16:33:33,859 - experiment_functions - INFO - Early stopping at epoch 2150. Best Metrics: (0.0110534512487395, 0.002721990653025136, 0.006668276161539356)
2026-06-21 16:33:33,954 - optuna.study.study - INFO - Trial 297 finished with values: [0.0110534512487395, 0.002721990653025136, 0.006668276161539356] and parameters: {'n_layers': 4, 'embedding_dim': 32, 'lr': 0.0006104134330921928, 'lambda_val': 0.015425279687820684, 'batch_size': 1014, 'optimizer': 'RMSprop'}.
2026-06-21 16:33:58,812 - experiment_functions - INFO - Early stopping at epoch 550. Best Metrics: (0.006908214807958907, 0.0018078186181634457, 0.004193250786702093)
2026-06-21 16:33:58,912 - optuna.study.study - INFO - Trial 298 finished with values: [0.006908214807958907, 0.0018078186181634457, 0.004193250786702093] and parameters: {'n_layers': 4, 'embedding_dim': 32, 'lr': 0.0044739262759054006, 'lambda_val': 0.0008149591260623693, 'batch_size': 2349, 'optimizer': 'RMSprop'}.
2026-06-21 16:35:35,568 - experiment_functions - INFO - Early stopping at epoch 2200. Best Metrics: (0.010250185264178209, 0.0025135783756473416, 0.006433908364182527)
2026-06-21 16:35:35,661 - optuna.study.study - INFO - Trial 299 finished with values: [0.010250185264178209, 0.0025135783756473416, 0.006433908364182527] and parameters: {'n_layers': 4, 'embedding_dim': 64, 'lr': 0.0006104134330921928, 'lambda_val': 0.0002534167291701876, 'batch_size': 2732, 'optimizer': 'Adam'}.
2026-06-21 16:35:35,676 - root - INFO - Selected Trial 260 based on Max ndcg: 0.0090
2026-06-21 16:35:35,676 - root - INFO - Associated Recall: 0.0147
2026-06-21 16:35:35,676 - experiment_functions - INFO - Training the best model ... for e_yelp_1c2dcs_strict_rand3
2026-06-21 16:38:22,774 - root - INFO -   **** Training e_yelp_1c2dcs_strict_rand4
2026-06-21 16:38:22,800 - root - INFO -   **** Getting 71258/1274132 random edges
2026-06-21 16:38:22,924 - optuna.storages._rdb.storage - INFO - A new study created in RDB with name: Study_e_yelp_1c2dcs_strict_rand4
2026-06-21 16:39:13,486 - experiment_functions - INFO - Early stopping at epoch 1200. Best Metrics: (0.00309020833868416, 0.0008273335859542757, 0.0018535944741537626)
2026-06-21 16:39:13,561 - optuna.study.study - INFO - Trial 0 finished with values: [0.00309020833868416, 0.0008273335859542757, 0.0018535944741537626] and parameters: {'n_layers': 1, 'embedding_dim': 96, 'lr': 0.01334350907803016, 'lambda_val': 0.0016573995447523374, 'batch_size': 1988, 'optimizer': 'RMSprop'}.
2026-06-21 16:42:03,921 - optuna.study.study - INFO - Trial 1 finished with values: [0.0006060740243150252, 0.0001389415182518631, 0.0003324695105319709] and parameters: {'n_layers': 3, 'embedding_dim': 96, 'lr': 4.0654363117883344e-05, 'lambda_val': 5.418925439529571e-05, 'batch_size': 2545, 'optimizer': 'Adam'}.
2026-06-21 16:42:53,615 - experiment_functions - INFO - Early stopping at epoch 1200. Best Metrics: (0.004042386947951093, 0.0009157509157509158, 0.0024307356067747444)
2026-06-21 16:42:53,758 - optuna.study.study - INFO - Trial 2 finished with values: [0.004042386947951093, 0.0009157509157509158, 0.0024307356067747444] and parameters: {'n_layers': 1, 'embedding_dim': 64, 'lr': 0.010134720654073184, 'lambda_val': 1.1574799883050662e-05, 'batch_size': 1789, 'optimizer': 'Adam'}.
2026-06-21 16:43:19,754 - experiment_functions - INFO - Early stopping at epoch 500. Best Metrics: (0.0005885127369314288, 0.0001278893520272831, 0.00030017331630213464)
