2026-06-18 21:56:44,628 - optuna.study.study - INFO - Trial 238 finished with values: [0.020313454817058464, 0.004125615763546798, 0.011009381901228568] and parameters: {'n_layers': 3, 'embedding_dim': 96, 'lr': 0.0010029417148474076, 'lambda_val': 5.316198242532503e-06, 'batch_size': 2689, 'optimizer': 'RMSprop'}.
2026-06-18 21:57:15,128 - experiment_functions - INFO - Early stopping at epoch 600. Best Metrics: (0.018410814703712034, 0.0038224706328154607, 0.010157978730435186)
2026-06-18 21:57:15,215 - optuna.study.study - INFO - Trial 239 finished with values: [0.018410814703712034, 0.0038224706328154607, 0.010157978730435186] and parameters: {'n_layers': 2, 'embedding_dim': 96, 'lr': 0.0022436517643766684, 'lambda_val': 0.0006571284844389283, 'batch_size': 991, 'optimizer': 'Adam'}.
2026-06-18 21:58:04,349 - experiment_functions - INFO - Early stopping at epoch 900. Best Metrics: (0.020487336179362357, 0.004379815586712138, 0.011300579293530288)
2026-06-18 21:58:04,626 - optuna.study.study - INFO - Trial 240 finished with values: [0.020487336179362357, 0.004379815586712138, 0.011300579293530288] and parameters: {'n_layers': 4, 'embedding_dim': 96, 'lr': 0.0005592470013695373, 'lambda_val': 0.0005069195879480929, 'batch_size': 991, 'optimizer': 'RMSprop'}.
2026-06-18 21:59:03,144 - experiment_functions - INFO - Early stopping at epoch 1100. Best Metrics: (0.02245462707517368, 0.004998736895288619, 0.012779039717723246)
2026-06-18 21:59:03,258 - optuna.study.study - INFO - Trial 241 finished with values: [0.02245462707517368, 0.004998736895288619, 0.012779039717723246] and parameters: {'n_layers': 4, 'embedding_dim': 96, 'lr': 0.00039950195617414347, 'lambda_val': 5.316198242532503e-06, 'batch_size': 2001, 'optimizer': 'Adam'}.
2026-06-18 22:02:31,091 - optuna.study.study - INFO - Trial 242 finished with values: [0.03331320524873601, 0.007033914361500568, 0.01934418138153903] and parameters: {'n_layers': 1, 'embedding_dim': 256, 'lr': 0.0005592470013695373, 'lambda_val': 4.521426485432383e-06, 'batch_size': 2931, 'optimizer': 'Adam'}.
2026-06-18 22:06:31,498 - optuna.study.study - INFO - Trial 243 finished with values: [0.02491923505136866, 0.005450296829607175, 0.014102819730633872] and parameters: {'n_layers': 3, 'embedding_dim': 256, 'lr': 0.0001408506946893725, 'lambda_val': 9.959964188496882e-05, 'batch_size': 2254, 'optimizer': 'Adam'}.
2026-06-18 22:07:56,755 - experiment_functions - INFO - Early stopping at epoch 1350. Best Metrics: (0.025779796448301192, 0.005625552608311229, 0.014816298115359738)
2026-06-18 22:07:56,864 - optuna.study.study - INFO - Trial 244 finished with values: [0.025779796448301192, 0.005625552608311229, 0.014816298115359738] and parameters: {'n_layers': 3, 'embedding_dim': 256, 'lr': 0.00039950195617414347, 'lambda_val': 0.00015514348570178205, 'batch_size': 991, 'optimizer': 'Adam'}.
2026-06-18 22:08:50,713 - experiment_functions - INFO - Early stopping at epoch 1150. Best Metrics: (0.02805074974227668, 0.005999747379057724, 0.016029234857121134)
2026-06-18 22:08:51,215 - optuna.study.study - INFO - Trial 245 finished with values: [0.02805074974227668, 0.005999747379057724, 0.016029234857121134] and parameters: {'n_layers': 2, 'embedding_dim': 96, 'lr': 0.0005592470013695373, 'lambda_val': 0.00015514348570178205, 'batch_size': 2521, 'optimizer': 'Adam'}.
2026-06-18 22:09:27,174 - experiment_functions - INFO - Early stopping at epoch 750. Best Metrics: (0.0251658185432352, 0.005369773904256663, 0.014408338084144554)
2026-06-18 22:09:27,562 - optuna.study.study - INFO - Trial 246 finished with values: [0.0251658185432352, 0.005369773904256663, 0.014408338084144554] and parameters: {'n_layers': 2, 'embedding_dim': 96, 'lr': 0.0007183006551542105, 'lambda_val': 4.521426485432383e-06, 'batch_size': 2931, 'optimizer': 'RMSprop'}.
2026-06-18 22:10:34,800 - experiment_functions - INFO - Early stopping at epoch 1350. Best Metrics: (0.028649723040963707, 0.006121321207528104, 0.016181532303651772)
2026-06-18 22:10:34,896 - optuna.study.study - INFO - Trial 247 finished with values: [0.028649723040963707, 0.006121321207528104, 0.016181532303651772] and parameters: {'n_layers': 2, 'embedding_dim': 128, 'lr': 0.0005592470013695373, 'lambda_val': 0.0005069195879480929, 'batch_size': 991, 'optimizer': 'Adam'}.
2026-06-18 22:11:42,973 - experiment_functions - INFO - Early stopping at epoch 1400. Best Metrics: (0.02642961452194255, 0.005748705317670835, 0.015253111274949476)
2026-06-18 22:11:43,057 - optuna.study.study - INFO - Trial 248 finished with values: [0.02642961452194255, 0.005748705317670835, 0.015253111274949476] and parameters: {'n_layers': 2, 'embedding_dim': 128, 'lr': 0.00039950195617414347, 'lambda_val': 4.03066693695427e-06, 'batch_size': 3911, 'optimizer': 'RMSprop'}.
2026-06-18 22:13:25,202 - experiment_functions - INFO - Early stopping at epoch 2350. Best Metrics: (0.0003935931551768886, 0.00010578501957812305, 0.00023686005618064638)
2026-06-18 22:13:25,279 - optuna.study.study - INFO - Trial 249 finished with values: [0.0003935931551768886, 0.00010578501957812305, 0.00023686005618064638] and parameters: {'n_layers': 1, 'embedding_dim': 128, 'lr': 3.602438039347391e-05, 'lambda_val': 0.00047613316859548355, 'batch_size': 2521, 'optimizer': 'Adam'}.
2026-06-18 22:14:28,828 - experiment_functions - INFO - Early stopping at epoch 1350. Best Metrics: (0.03196521714490281, 0.006798661109005937, 0.01833594882134074)
2026-06-18 22:14:29,469 - optuna.study.study - INFO - Trial 250 finished with values: [0.03196521714490281, 0.006798661109005937, 0.01833594882134074] and parameters: {'n_layers': 1, 'embedding_dim': 128, 'lr': 0.0007183006551542105, 'lambda_val': 0.00012665625175825525, 'batch_size': 2521, 'optimizer': 'RMSprop'}.
2026-06-18 22:15:08,971 - experiment_functions - INFO - Early stopping at epoch 850. Best Metrics: (0.028257973989779292, 0.005977643046608565, 0.01602449415341811)
2026-06-18 22:15:09,867 - optuna.study.study - INFO - Trial 251 finished with values: [0.028257973989779292, 0.005977643046608565, 0.01602449415341811] and parameters: {'n_layers': 2, 'embedding_dim': 64, 'lr': 0.0010029417148474076, 'lambda_val': 0.00015514348570178205, 'batch_size': 991, 'optimizer': 'Adam'}.
2026-06-18 22:16:20,902 - experiment_functions - INFO - Early stopping at epoch 1600. Best Metrics: (0.03263283988926863, 0.007007073386383732, 0.019061388526571802)
2026-06-18 22:16:20,986 - optuna.study.study - INFO - Trial 252 finished with values: [0.03263283988926863, 0.007007073386383732, 0.019061388526571802] and parameters: {'n_layers': 1, 'embedding_dim': 96, 'lr': 0.0005592470013695373, 'lambda_val': 0.00015514348570178205, 'batch_size': 2816, 'optimizer': 'RMSprop'}.
2026-06-18 22:16:57,120 - experiment_functions - INFO - Early stopping at epoch 750. Best Metrics: (0.02656730652637118, 0.005655551345206518, 0.015171752317679369)
2026-06-18 22:16:57,465 - optuna.study.study - INFO - Trial 253 finished with values: [0.02656730652637118, 0.005655551345206518, 0.015171752317679369] and parameters: {'n_layers': 2, 'embedding_dim': 96, 'lr': 0.0010029417148474076, 'lambda_val': 4.521426485432383e-06, 'batch_size': 2931, 'optimizer': 'Adam'}.
2026-06-18 22:17:22,726 - experiment_functions - INFO - Early stopping at epoch 500. Best Metrics: (0.00048696177467052657, 0.00010736390046734875, 0.0002772970434914925)
2026-06-18 22:17:22,817 - optuna.study.study - INFO - Trial 254 finished with values: [0.00048696177467052657, 0.00010736390046734875, 0.0002772970434914925] and parameters: {'n_layers': 1, 'embedding_dim': 96, 'lr': 0.0005592470013695373, 'lambda_val': 0.00015514348570178205, 'batch_size': 2931, 'optimizer': 'SGD'}.
2026-06-18 22:19:01,969 - experiment_functions - INFO - Early stopping at epoch 1950. Best Metrics: (0.032941748956012075, 0.006879184034356449, 0.018957385697246903)
2026-06-18 22:19:02,058 - optuna.study.study - INFO - Trial 255 finished with values: [0.032941748956012075, 0.006879184034356449, 0.018957385697246903] and parameters: {'n_layers': 1, 'embedding_dim': 256, 'lr': 0.0007183006551542105, 'lambda_val': 4.521426485432383e-06, 'batch_size': 2689, 'optimizer': 'Adam'}.
2026-06-18 22:21:55,525 - optuna.study.study - INFO - Trial 256 finished with values: [0.03348702512968708, 0.007144436023746369, 0.019398587234948955] and parameters: {'n_layers': 1, 'embedding_dim': 96, 'lr': 0.0005592470013695373, 'lambda_val': 4.521426485432383e-06, 'batch_size': 2220, 'optimizer': 'Adam'}.
2026-06-18 22:23:19,188 - experiment_functions - INFO - Early stopping at epoch 1800. Best Metrics: (0.03233986118281345, 0.006883920677024125, 0.019035702237414645)
2026-06-18 22:23:19,275 - optuna.study.study - INFO - Trial 257 finished with values: [0.03233986118281345, 0.006883920677024125, 0.019035702237414645] and parameters: {'n_layers': 1, 'embedding_dim': 128, 'lr': 0.0007183006551542105, 'lambda_val': 4.521426485432383e-06, 'batch_size': 2220, 'optimizer': 'Adam'}.
2026-06-18 22:24:41,034 - experiment_functions - INFO - Early stopping at epoch 1650. Best Metrics: (0.018741160131676395, 0.0042187697360111165, 0.01075109912027958)
2026-06-18 22:24:41,114 - optuna.study.study - INFO - Trial 258 finished with values: [0.018741160131676395, 0.0042187697360111165, 0.01075109912027958] and parameters: {'n_layers': 1, 'embedding_dim': 256, 'lr': 0.0005592470013695373, 'lambda_val': 0.021514139163322604, 'batch_size': 2931, 'optimizer': 'RMSprop'}.
2026-06-18 22:25:16,215 - experiment_functions - INFO - Early stopping at epoch 750. Best Metrics: (0.0248944766293086, 0.0052750410509031205, 0.014134600791252795)
2026-06-18 22:25:16,548 - optuna.study.study - INFO - Trial 259 finished with values: [0.0248944766293086, 0.0052750410509031205, 0.014134600791252795] and parameters: {'n_layers': 1, 'embedding_dim': 96, 'lr': 0.002003020991909066, 'lambda_val': 1.288405727605743e-06, 'batch_size': 2931, 'optimizer': 'RMSprop'}.
2026-06-18 22:26:05,447 - experiment_functions - INFO - Early stopping at epoch 950. Best Metrics: (0.027136345702069235, 0.00570607553366174, 0.015342737314805961)
2026-06-18 22:26:05,560 - optuna.study.study - INFO - Trial 260 finished with values: [0.027136345702069235, 0.00570607553366174, 0.015342737314805961] and parameters: {'n_layers': 1, 'embedding_dim': 256, 'lr': 0.0013066679519559202, 'lambda_val': 4.521426485432383e-06, 'batch_size': 2931, 'optimizer': 'RMSprop'}.
2026-06-18 22:27:16,602 - experiment_functions - INFO - Early stopping at epoch 1500. Best Metrics: (0.032079379623496225, 0.00681602879878742, 0.01853679806158693)
2026-06-18 22:27:16,686 - optuna.study.study - INFO - Trial 261 finished with values: [0.032079379623496225, 0.00681602879878742, 0.01853679806158693] and parameters: {'n_layers': 1, 'embedding_dim': 128, 'lr': 0.0007183006551542105, 'lambda_val': 0.00011928974808350449, 'batch_size': 2689, 'optimizer': 'Adam'}.
2026-06-18 22:27:50,738 - experiment_functions - INFO - Early stopping at epoch 700. Best Metrics: (0.01776796084650141, 0.003659845901225212, 0.009882002169493826)
2026-06-18 22:27:51,308 - optuna.study.study - INFO - Trial 262 finished with values: [0.01776796084650141, 0.003659845901225212, 0.009882002169493826] and parameters: {'n_layers': 4, 'embedding_dim': 64, 'lr': 0.0010029417148474076, 'lambda_val': 0.00015514348570178205, 'batch_size': 1630, 'optimizer': 'RMSprop'}.
2026-06-18 22:29:06,166 - experiment_functions - INFO - Early stopping at epoch 1500. Best Metrics: (0.03201783828196339, 0.0068902362005810285, 0.01890536843832327)
2026-06-18 22:29:06,479 - optuna.study.study - INFO - Trial 263 finished with values: [0.03201783828196339, 0.0068902362005810285, 0.01890536843832327] and parameters: {'n_layers': 1, 'embedding_dim': 256, 'lr': 0.0007183006551542105, 'lambda_val': 0.00015514348570178205, 'batch_size': 1490, 'optimizer': 'Adam'}.
2026-06-18 22:29:35,775 - experiment_functions - INFO - Early stopping at epoch 600. Best Metrics: (0.021223118006179324, 0.004562965769862323, 0.011734568342787438)
2026-06-18 22:29:36,149 - optuna.study.study - INFO - Trial 264 finished with values: [0.021223118006179324, 0.004562965769862323, 0.011734568342787438] and parameters: {'n_layers': 2, 'embedding_dim': 96, 'lr': 0.0010029417148474076, 'lambda_val': 0.00015514348570178205, 'batch_size': 3300, 'optimizer': 'RMSprop'}.
2026-06-18 22:30:04,161 - experiment_functions - INFO - Early stopping at epoch 550. Best Metrics: (0.021544861578201315, 0.00450454717696097, 0.012140616429515312)
2026-06-18 22:30:04,258 - optuna.study.study - INFO - Trial 265 finished with values: [0.021544861578201315, 0.00450454717696097, 0.012140616429515312] and parameters: {'n_layers': 3, 'embedding_dim': 96, 'lr': 0.003552899880081482, 'lambda_val': 0.00015514348570178205, 'batch_size': 3911, 'optimizer': 'Adam'}.
2026-06-18 22:32:46,350 - experiment_functions - INFO - Early stopping at epoch 3600. Best Metrics: (0.032609547843748345, 0.00713654161930024, 0.01912597589827155)
2026-06-18 22:32:46,436 - optuna.study.study - INFO - Trial 266 finished with values: [0.032609547843748345, 0.00713654161930024, 0.01912597589827155] and parameters: {'n_layers': 1, 'embedding_dim': 96, 'lr': 0.0007183006551542105, 'lambda_val': 0.00015514348570178205, 'batch_size': 578, 'optimizer': 'Adam'}.
2026-06-18 22:33:14,558 - experiment_functions - INFO - Early stopping at epoch 550. Best Metrics: (0.015679306015862437, 0.0031151319944423394, 0.008591534731900906)
2026-06-18 22:33:14,645 - optuna.study.study - INFO - Trial 267 finished with values: [0.015679306015862437, 0.0031151319944423394, 0.008591534731900906] and parameters: {'n_layers': 3, 'embedding_dim': 64, 'lr': 0.01738516817528386, 'lambda_val': 4.521426485432383e-06, 'batch_size': 2521, 'optimizer': 'Adam'}.
2026-06-18 22:36:36,754 - optuna.study.study - INFO - Trial 268 finished with values: [0.0011871079064532779, 0.0002889352027283062, 0.0007168924996202062] and parameters: {'n_layers': 3, 'embedding_dim': 128, 'lr': 3.986289108019109e-05, 'lambda_val': 1.1727812158033635e-06, 'batch_size': 2931, 'optimizer': 'RMSprop'}.
2026-06-18 22:37:11,927 - experiment_functions - INFO - Early stopping at epoch 700. Best Metrics: (0.031078272444863227, 0.006707086017430845, 0.01810716464008307)
2026-06-18 22:37:12,288 - optuna.study.study - INFO - Trial 269 finished with values: [0.031078272444863227, 0.006707086017430845, 0.01810716464008307] and parameters: {'n_layers': 1, 'embedding_dim': 128, 'lr': 0.002003020991909066, 'lambda_val': 0.00015514348570178205, 'batch_size': 2134, 'optimizer': 'Adam'}.
2026-06-18 22:37:52,795 - experiment_functions - INFO - Early stopping at epoch 800. Best Metrics: (0.023506204617954354, 0.005099785272199065, 0.013128575680277666)
2026-06-18 22:37:52,887 - optuna.study.study - INFO - Trial 270 finished with values: [0.023506204617954354, 0.005099785272199065, 0.013128575680277666] and parameters: {'n_layers': 3, 'embedding_dim': 96, 'lr': 0.0007183006551542105, 'lambda_val': 4.521426485432383e-06, 'batch_size': 2220, 'optimizer': 'Adam'}.
2026-06-18 22:41:14,303 - optuna.study.study - INFO - Trial 271 finished with values: [0.033001094850827264, 0.00700075786282683, 0.018914818082656656] and parameters: {'n_layers': 1, 'embedding_dim': 256, 'lr': 0.0005592470013695373, 'lambda_val': 0.00015514348570178205, 'batch_size': 2931, 'optimizer': 'Adam'}.
2026-06-18 22:42:08,920 - experiment_functions - INFO - Early stopping at epoch 1150. Best Metrics: (0.026010537956111173, 0.005660287987874195, 0.015110534700463902)
2026-06-18 22:42:09,308 - optuna.study.study - INFO - Trial 272 finished with values: [0.026010537956111173, 0.005660287987874195, 0.015110534700463902] and parameters: {'n_layers': 2, 'embedding_dim': 96, 'lr': 0.0005592470013695373, 'lambda_val': 1.288405727605743e-06, 'batch_size': 2689, 'optimizer': 'RMSprop'}.
2026-06-18 22:44:40,529 - experiment_functions - INFO - Early stopping at epoch 3350. Best Metrics: (0.03280131847052012, 0.007114437286851081, 0.019443887772876884)
2026-06-18 22:44:40,607 - optuna.study.study - INFO - Trial 273 finished with values: [0.03280131847052012, 0.007114437286851081, 0.019443887772876884] and parameters: {'n_layers': 1, 'embedding_dim': 128, 'lr': 0.0007183006551542105, 'lambda_val': 5.316198242532503e-06, 'batch_size': 991, 'optimizer': 'Adam'}.
2026-06-18 22:45:12,521 - experiment_functions - INFO - Early stopping at epoch 650. Best Metrics: (0.017579382883117712, 0.003642478211443729, 0.009768874940551444)
2026-06-18 22:45:12,609 - optuna.study.study - INFO - Trial 274 finished with values: [0.017579382883117712, 0.003642478211443729, 0.009768874940551444] and parameters: {'n_layers': 4, 'embedding_dim': 64, 'lr': 0.0018466507240200577, 'lambda_val': 1.2929761938228365e-06, 'batch_size': 1453, 'optimizer': 'Adam'}.
2026-06-18 22:46:56,357 - experiment_functions - INFO - Early stopping at epoch 2300. Best Metrics: (0.03220409452473274, 0.006836554250347355, 0.018571949891166804)
2026-06-18 22:46:57,024 - optuna.study.study - INFO - Trial 275 finished with values: [0.03220409452473274, 0.006836554250347355, 0.018571949891166804] and parameters: {'n_layers': 1, 'embedding_dim': 128, 'lr': 0.0006301870383827295, 'lambda_val': 4.521426485432383e-06, 'batch_size': 2521, 'optimizer': 'Adam'}.
2026-06-18 22:49:55,913 - optuna.study.study - INFO - Trial 276 finished with values: [0.031732548139327146, 0.006973916887709992, 0.01873956491631709] and parameters: {'n_layers': 1, 'embedding_dim': 96, 'lr': 0.00039950195617414347, 'lambda_val': 0.00015514348570178205, 'batch_size': 2521, 'optimizer': 'Adam'}.
2026-06-18 22:51:11,036 - experiment_functions - INFO - Early stopping at epoch 1650. Best Metrics: (0.01820186892939275, 0.0036566881394467605, 0.00969338298793604)
2026-06-18 22:51:11,502 - optuna.study.study - INFO - Trial 277 finished with values: [0.01820186892939275, 0.0036566881394467605, 0.00969338298793604] and parameters: {'n_layers': 2, 'embedding_dim': 96, 'lr': 0.002637197288438031, 'lambda_val': 1.4325187628126664e-06, 'batch_size': 991, 'optimizer': 'Adam'}.
2026-06-18 22:54:32,934 - optuna.study.study - INFO - Trial 278 finished with values: [0.021539061096071087, 0.004796640141467729, 0.013039596455958341] and parameters: {'n_layers': 1, 'embedding_dim': 256, 'lr': 0.00020724547354908913, 'lambda_val': 4.521426485432383e-06, 'batch_size': 2931, 'optimizer': 'Adam'}.
2026-06-18 22:56:32,007 - experiment_functions - INFO - Early stopping at epoch 2650. Best Metrics: (0.03262930682284608, 0.006939181508147027, 0.019102173815096248)
2026-06-18 22:56:32,089 - optuna.study.study - INFO - Trial 279 finished with values: [0.03262930682284608, 0.006939181508147027, 0.019102173815096248] and parameters: {'n_layers': 1, 'embedding_dim': 96, 'lr': 0.0007183006551542105, 'lambda_val': 4.521426485432383e-06, 'batch_size': 2689, 'optimizer': 'Adam'}.
2026-06-18 22:57:26,503 - experiment_functions - INFO - Early stopping at epoch 1100. Best Metrics: (0.024718207455514892, 0.005305039787798408, 0.014222973584667243)
2026-06-18 22:57:26,867 - optuna.study.study - INFO - Trial 280 finished with values: [0.024718207455514892, 0.005305039787798408, 0.014222973584667243] and parameters: {'n_layers': 3, 'embedding_dim': 96, 'lr': 0.00039950195617414347, 'lambda_val': 0.00015514348570178205, 'batch_size': 3012, 'optimizer': 'Adam'}.
2026-06-18 22:59:34,244 - experiment_functions - INFO - Early stopping at epoch 2650. Best Metrics: (0.0050911482948498695, 0.0013846785398509537, 0.0030660927770460667)
2026-06-18 22:59:34,329 - optuna.study.study - INFO - Trial 281 finished with values: [0.0050911482948498695, 0.0013846785398509537, 0.0030660927770460667] and parameters: {'n_layers': 1, 'embedding_dim': 256, 'lr': 0.0869234075707624, 'lambda_val': 3.736087412061225e-06, 'batch_size': 2931, 'optimizer': 'RMSprop'}.
2026-06-18 23:00:44,462 - experiment_functions - INFO - Early stopping at epoch 1550. Best Metrics: (0.03180939263650619, 0.006733926992547682, 0.018211861802665666)
2026-06-18 23:00:44,602 - optuna.study.study - INFO - Trial 282 finished with values: [0.03180939263650619, 0.006733926992547682, 0.018211861802665666] and parameters: {'n_layers': 1, 'embedding_dim': 64, 'lr': 0.0007183006551542105, 'lambda_val': 5.419601826927442e-05, 'batch_size': 2689, 'optimizer': 'Adam'}.
2026-06-18 23:01:17,558 - experiment_functions - INFO - Early stopping at epoch 700. Best Metrics: (0.0320583979791741, 0.0067134015409877484, 0.0184558784836327)
2026-06-18 23:01:17,653 - optuna.study.study - INFO - Trial 283 finished with values: [0.0320583979791741, 0.0067134015409877484, 0.0184558784836327] and parameters: {'n_layers': 1, 'embedding_dim': 96, 'lr': 0.002003020991909066, 'lambda_val': 0.00015514348570178205, 'batch_size': 2747, 'optimizer': 'Adam'}.
2026-06-18 23:03:26,151 - experiment_functions - INFO - Early stopping at epoch 2550. Best Metrics: (0.025734022550063216, 0.005606606037640521, 0.014555585826543952)
2026-06-18 23:03:26,231 - optuna.study.study - INFO - Trial 284 finished with values: [0.025734022550063216, 0.005606606037640521, 0.014555585826543952] and parameters: {'n_layers': 3, 'embedding_dim': 128, 'lr': 0.00022471387800597823, 'lambda_val': 1.1727812158033635e-06, 'batch_size': 2931, 'optimizer': 'RMSprop'}.
2026-06-18 23:06:27,766 - optuna.study.study - INFO - Trial 285 finished with values: [0.03196392826904791, 0.006880762915245673, 0.018484372143905806] and parameters: {'n_layers': 1, 'embedding_dim': 128, 'lr': 0.00039950195617414347, 'lambda_val': 6.176002812867053e-06, 'batch_size': 3012, 'optimizer': 'Adam'}.
2026-06-18 23:07:31,290 - experiment_functions - INFO - Early stopping at epoch 1350. Best Metrics: (0.026738784888196747, 0.005941328786156373, 0.01529522838426693)
