2026-06-17 09:51:07,255 - optuna.study.study - INFO - Trial 264 finished with values: [0.004017268199981679, 0.0015330933434381713, 0.0027902415060771252] and parameters: {'n_layers': 1, 'embedding_dim': 96, 'lr': 0.004595237871810009, 'lambda_val': 3.567347607875195e-06, 'batch_size': 3433, 'optimizer': 'Adam'}.
2026-06-17 09:51:29,943 - experiment_functions - INFO - Early stopping at epoch 500. Best Metrics: (0.0005653146014604227, 0.0001215738284703802, 0.0003169912248713483)
2026-06-17 09:51:30,034 - optuna.study.study - INFO - Trial 265 finished with values: [0.0005653146014604227, 0.0001215738284703802, 0.0003169912248713483] and parameters: {'n_layers': 1, 'embedding_dim': 128, 'lr': 0.004595237871810009, 'lambda_val': 3.567347607875195e-06, 'batch_size': 1161, 'optimizer': 'SGD'}.
2026-06-17 09:52:13,062 - experiment_functions - INFO - Early stopping at epoch 1000. Best Metrics: (0.0032998824430432684, 0.0013988884678539852, 0.0023637315456977196)
2026-06-17 09:52:13,141 - optuna.study.study - INFO - Trial 266 finished with values: [0.0032998824430432684, 0.0013988884678539852, 0.0023637315456977196] and parameters: {'n_layers': 1, 'embedding_dim': 96, 'lr': 0.0005503649596872748, 'lambda_val': 3.567347607875195e-06, 'batch_size': 3433, 'optimizer': 'Adam'}.
2026-06-17 09:53:20,287 - experiment_functions - INFO - Early stopping at epoch 1600. Best Metrics: (0.004078153391576901, 0.0015504610332196542, 0.00285245928143394)
2026-06-17 09:53:20,376 - optuna.study.study - INFO - Trial 267 finished with values: [0.004078153391576901, 0.0015504610332196542, 0.00285245928143394] and parameters: {'n_layers': 1, 'embedding_dim': 64, 'lr': 0.0004860515181398459, 'lambda_val': 6.872101199763191e-06, 'batch_size': 1599, 'optimizer': 'RMSprop'}.
2026-06-17 09:53:46,796 - experiment_functions - INFO - Early stopping at epoch 600. Best Metrics: (0.003879868804922277, 0.001455728179866111, 0.0026104288178483703)
2026-06-17 09:53:46,883 - optuna.study.study - INFO - Trial 268 finished with values: [0.003879868804922277, 0.001455728179866111, 0.0026104288178483703] and parameters: {'n_layers': 1, 'embedding_dim': 32, 'lr': 0.002231043752262738, 'lambda_val': 1.3052788411163826e-06, 'batch_size': 2685, 'optimizer': 'Adam'}.
2026-06-17 09:54:13,096 - experiment_functions - INFO - Early stopping at epoch 600. Best Metrics: (0.00411023031431323, 0.0015488821523304281, 0.0027532183226261176)
2026-06-17 09:54:13,183 - optuna.study.study - INFO - Trial 269 finished with values: [0.00411023031431323, 0.0015488821523304281, 0.0027532183226261176] and parameters: {'n_layers': 1, 'embedding_dim': 32, 'lr': 0.00412623996303754, 'lambda_val': 0.00023684038247191172, 'batch_size': 925, 'optimizer': 'Adam'}.
2026-06-17 09:54:37,786 - experiment_functions - INFO - Early stopping at epoch 550. Best Metrics: (0.0037412624655188322, 0.0014762536314260452, 0.0025214046245360926)
2026-06-17 09:54:38,105 - optuna.study.study - INFO - Trial 270 finished with values: [0.0037412624655188322, 0.0014762536314260452, 0.0025214046245360926] and parameters: {'n_layers': 1, 'embedding_dim': 64, 'lr': 0.007822927276622295, 'lambda_val': 1.7261189135715837e-05, 'batch_size': 2685, 'optimizer': 'Adam'}.
2026-06-17 09:56:45,073 - experiment_functions - INFO - Early stopping at epoch 3050. Best Metrics: (0.003975611879089599, 0.0012473159024883162, 0.002416554027872739)
2026-06-17 09:56:45,164 - optuna.study.study - INFO - Trial 271 finished with values: [0.003975611879089599, 0.0012473159024883162, 0.002416554027872739] and parameters: {'n_layers': 1, 'embedding_dim': 128, 'lr': 0.024484365885130848, 'lambda_val': 6.872101199763191e-06, 'batch_size': 1310, 'optimizer': 'RMSprop'}.
2026-06-17 09:57:11,367 - experiment_functions - INFO - Early stopping at epoch 550. Best Metrics: (0.0029287304695230373, 0.0010973222180118733, 0.0018868488434065263)
2026-06-17 09:57:11,458 - optuna.study.study - INFO - Trial 272 finished with values: [0.0029287304695230373, 0.0010973222180118733, 0.0018868488434065263] and parameters: {'n_layers': 4, 'embedding_dim': 96, 'lr': 0.007822927276622295, 'lambda_val': 3.567347607875195e-06, 'batch_size': 3433, 'optimizer': 'Adam'}.
2026-06-17 09:57:44,256 - experiment_functions - INFO - Early stopping at epoch 750. Best Metrics: (0.0030872998515827543, 0.0011415308829101935, 0.0020220708299895835)
2026-06-17 09:57:44,331 - optuna.study.study - INFO - Trial 273 finished with values: [0.0030872998515827543, 0.0011415308829101935, 0.0020220708299895835] and parameters: {'n_layers': 1, 'embedding_dim': 96, 'lr': 0.00754337798694091, 'lambda_val': 5.2927329941475195e-06, 'batch_size': 1800, 'optimizer': 'RMSprop'}.
2026-06-17 09:58:11,360 - experiment_functions - INFO - Early stopping at epoch 550. Best Metrics: (0.0034115184763353315, 0.0014541492989768852, 0.0025233096091210766)
2026-06-17 09:58:11,442 - optuna.study.study - INFO - Trial 274 finished with values: [0.0034115184763353315, 0.0014541492989768852, 0.0025233096091210766] and parameters: {'n_layers': 1, 'embedding_dim': 256, 'lr': 0.003877789258066795, 'lambda_val': 6.872101199763191e-06, 'batch_size': 2572, 'optimizer': 'Adam'}.
2026-06-17 09:58:36,446 - experiment_functions - INFO - Early stopping at epoch 550. Best Metrics: (0.0038382442074734635, 0.0014904635594290767, 0.0026113041442812302)
2026-06-17 09:58:36,536 - optuna.study.study - INFO - Trial 275 finished with values: [0.0038382442074734635, 0.0014904635594290767, 0.0026113041442812302] and parameters: {'n_layers': 1, 'embedding_dim': 96, 'lr': 0.007822927276622295, 'lambda_val': 6.872101199763191e-06, 'batch_size': 2433, 'optimizer': 'Adam'}.
2026-06-17 09:59:02,998 - experiment_functions - INFO - Early stopping at epoch 600. Best Metrics: (0.003707160465153967, 0.0014588859416445625, 0.002598702798452746)
2026-06-17 09:59:03,073 - optuna.study.study - INFO - Trial 276 finished with values: [0.003707160465153967, 0.0014588859416445625, 0.002598702798452746] and parameters: {'n_layers': 1, 'embedding_dim': 32, 'lr': 0.002231043752262738, 'lambda_val': 0.00016666322755616337, 'batch_size': 3312, 'optimizer': 'Adam'}.
2026-06-17 09:59:29,477 - experiment_functions - INFO - Early stopping at epoch 600. Best Metrics: (0.0036237665649653562, 0.0014636225843122394, 0.0024610552896286893)
2026-06-17 09:59:29,553 - optuna.study.study - INFO - Trial 277 finished with values: [0.0036237665649653562, 0.0014636225843122394, 0.0024610552896286893] and parameters: {'n_layers': 1, 'embedding_dim': 32, 'lr': 0.003877789258066795, 'lambda_val': 6.872101199763191e-06, 'batch_size': 1833, 'optimizer': 'Adam'}.
2026-06-17 09:59:54,237 - experiment_functions - INFO - Early stopping at epoch 550. Best Metrics: (0.0030606928187562055, 0.0013294177087280535, 0.0022797900024571494)
2026-06-17 09:59:54,322 - optuna.study.study - INFO - Trial 278 finished with values: [0.0030606928187562055, 0.0013294177087280535, 0.0022797900024571494] and parameters: {'n_layers': 1, 'embedding_dim': 64, 'lr': 0.002231043752262738, 'lambda_val': 6.872101199763191e-06, 'batch_size': 2433, 'optimizer': 'RMSprop'}.
2026-06-17 10:00:18,686 - experiment_functions - INFO - Early stopping at epoch 550. Best Metrics: (0.003635198857114235, 0.0014904635594290767, 0.0025430554642775728)
2026-06-17 10:00:18,756 - optuna.study.study - INFO - Trial 279 finished with values: [0.003635198857114235, 0.0014904635594290767, 0.0025430554642775728] and parameters: {'n_layers': 1, 'embedding_dim': 32, 'lr': 0.010203021680640975, 'lambda_val': 0.00016666322755616337, 'batch_size': 1833, 'optimizer': 'Adam'}.
2026-06-17 10:00:44,450 - experiment_functions - INFO - Early stopping at epoch 550. Best Metrics: (0.002103805864893723, 0.0008241758241758242, 0.0014477479024847448)
2026-06-17 10:00:44,514 - optuna.study.study - INFO - Trial 280 finished with values: [0.002103805864893723, 0.0008241758241758242, 0.0014477479024847448] and parameters: {'n_layers': 3, 'embedding_dim': 96, 'lr': 0.002231043752262738, 'lambda_val': 0.007305319964908254, 'batch_size': 3823, 'optimizer': 'RMSprop'}.
2026-06-17 10:01:14,174 - experiment_functions - INFO - Early stopping at epoch 650. Best Metrics: (0.002846472535312974, 0.0011162687886825818, 0.0019215361092250597)
2026-06-17 10:01:14,242 - optuna.study.study - INFO - Trial 281 finished with values: [0.002846472535312974, 0.0011162687886825818, 0.0019215361092250597] and parameters: {'n_layers': 3, 'embedding_dim': 96, 'lr': 0.0006172706266570344, 'lambda_val': 5.2927329941475195e-06, 'batch_size': 3823, 'optimizer': 'RMSprop'}.
2026-06-17 10:01:39,039 - experiment_functions - INFO - Early stopping at epoch 550. Best Metrics: (0.0033885255113979738, 0.0012094227611468991, 0.0022506399974372587)
2026-06-17 10:01:39,104 - optuna.study.study - INFO - Trial 282 finished with values: [0.0033885255113979738, 0.0012094227611468991, 0.0022506399974372587] and parameters: {'n_layers': 1, 'embedding_dim': 96, 'lr': 0.003877789258066795, 'lambda_val': 0.00016666322755616337, 'batch_size': 2336, 'optimizer': 'RMSprop'}.
2026-06-17 10:02:03,507 - experiment_functions - INFO - Early stopping at epoch 550. Best Metrics: (0.002148344161198384, 0.0009331186055323986, 0.001554503199479139)
2026-06-17 10:02:03,780 - optuna.study.study - INFO - Trial 283 finished with values: [0.002148344161198384, 0.0009331186055323986, 0.001554503199479139] and parameters: {'n_layers': 1, 'embedding_dim': 64, 'lr': 0.06472378686250438, 'lambda_val': 0.0008873717459598764, 'batch_size': 1576, 'optimizer': 'Adam'}.
2026-06-17 10:02:28,981 - experiment_functions - INFO - Early stopping at epoch 550. Best Metrics: (0.0030828362717022343, 0.0011731085006947072, 0.002113421412325627)
2026-06-17 10:02:29,035 - optuna.study.study - INFO - Trial 284 finished with values: [0.0030828362717022343, 0.0011731085006947072, 0.002113421412325627] and parameters: {'n_layers': 2, 'embedding_dim': 96, 'lr': 0.0015503903800134305, 'lambda_val': 3.567347607875195e-06, 'batch_size': 3433, 'optimizer': 'RMSprop'}.
2026-06-17 10:02:53,552 - experiment_functions - INFO - Early stopping at epoch 550. Best Metrics: (0.001915147546915518, 0.0008004926108374384, 0.0013257054997418808)
2026-06-17 10:02:53,630 - optuna.study.study - INFO - Trial 285 finished with values: [0.001915147546915518, 0.0008004926108374384, 0.0013257054997418808] and parameters: {'n_layers': 1, 'embedding_dim': 64, 'lr': 0.007822927276622295, 'lambda_val': 0.0050728033191010415, 'batch_size': 2521, 'optimizer': 'RMSprop'}.
2026-06-17 10:03:18,151 - experiment_functions - INFO - Early stopping at epoch 550. Best Metrics: (0.0032021117800686686, 0.0014304660856384998, 0.0023165029434978343)
2026-06-17 10:03:18,236 - optuna.study.study - INFO - Trial 286 finished with values: [0.0032021117800686686, 0.0014304660856384998, 0.0023165029434978343] and parameters: {'n_layers': 1, 'embedding_dim': 96, 'lr': 0.004595237871810009, 'lambda_val': 0.003740096552998565, 'batch_size': 1833, 'optimizer': 'Adam'}.
2026-06-17 10:03:43,339 - experiment_functions - INFO - Early stopping at epoch 550. Best Metrics: (0.00404817751973547, 0.001522041177213591, 0.002757031378569282)
2026-06-17 10:03:43,415 - optuna.study.study - INFO - Trial 287 finished with values: [0.00404817751973547, 0.001522041177213591, 0.002757031378569282] and parameters: {'n_layers': 1, 'embedding_dim': 96, 'lr': 0.007822927276622295, 'lambda_val': 3.567347607875195e-06, 'batch_size': 3410, 'optimizer': 'Adam'}.
2026-06-17 10:04:58,376 - experiment_functions - INFO - Early stopping at epoch 1650. Best Metrics: (0.00388431553545803, 0.0014130983958570164, 0.0025708366909591466)
2026-06-17 10:04:58,467 - optuna.study.study - INFO - Trial 288 finished with values: [0.00388431553545803, 0.0014130983958570164, 0.0025708366909591466] and parameters: {'n_layers': 1, 'embedding_dim': 256, 'lr': 0.010203021680640975, 'lambda_val': 1.7261189135715837e-05, 'batch_size': 3410, 'optimizer': 'RMSprop'}.
2026-06-17 10:05:37,324 - experiment_functions - INFO - Early stopping at epoch 900. Best Metrics: (0.0037400967286068676, 0.001177845143362385, 0.0022666533400203213)
2026-06-17 10:05:37,895 - optuna.study.study - INFO - Trial 289 finished with values: [0.0037400967286068676, 0.001177845143362385, 0.0022666533400203213] and parameters: {'n_layers': 2, 'embedding_dim': 64, 'lr': 0.03139797441942438, 'lambda_val': 1.5216807094072505e-05, 'batch_size': 2685, 'optimizer': 'RMSprop'}.
2026-06-17 10:06:23,512 - experiment_functions - INFO - Early stopping at epoch 1050. Best Metrics: (0.0038050023458028152, 0.0010957433371226477, 0.0022059599290809155)
2026-06-17 10:06:23,591 - optuna.study.study - INFO - Trial 290 finished with values: [0.0038050023458028152, 0.0010957433371226477, 0.0022059599290809155] and parameters: {'n_layers': 3, 'embedding_dim': 64, 'lr': 0.046129598836200957, 'lambda_val': 5.2927329941475195e-06, 'batch_size': 1310, 'optimizer': 'RMSprop'}.
2026-06-17 10:06:54,778 - experiment_functions - INFO - Early stopping at epoch 700. Best Metrics: (0.003918344341079983, 0.0015662498421119113, 0.002677865437944624)
2026-06-17 10:06:54,878 - optuna.study.study - INFO - Trial 291 finished with values: [0.003918344341079983, 0.0015662498421119113, 0.002677865437944624] and parameters: {'n_layers': 1, 'embedding_dim': 96, 'lr': 0.0019791454040792144, 'lambda_val': 3.737769038654263e-05, 'batch_size': 965, 'optimizer': 'Adam'}.
2026-06-17 10:07:18,052 - experiment_functions - INFO - Early stopping at epoch 500. Best Metrics: (0.00048138489930806536, 0.00011683718580270305, 0.0002562007670549211)
2026-06-17 10:07:18,121 - optuna.study.study - INFO - Trial 292 finished with values: [0.00048138489930806536, 0.00011683718580270305, 0.0002562007670549211] and parameters: {'n_layers': 3, 'embedding_dim': 64, 'lr': 0.024484365885130848, 'lambda_val': 6.872101199763191e-06, 'batch_size': 3266, 'optimizer': 'SGD'}.
2026-06-17 10:07:43,215 - experiment_functions - INFO - Early stopping at epoch 550. Best Metrics: (0.003535014214145667, 0.0014288872047492737, 0.0023849198888298262)
2026-06-17 10:07:43,304 - optuna.study.study - INFO - Trial 293 finished with values: [0.003535014214145667, 0.0014288872047492737, 0.0023849198888298262] and parameters: {'n_layers': 1, 'embedding_dim': 96, 'lr': 0.007822927276622295, 'lambda_val': 3.567347607875195e-06, 'batch_size': 3433, 'optimizer': 'Adam'}.
2026-06-17 10:08:06,202 - experiment_functions - INFO - Early stopping at epoch 500. Best Metrics: (0.0005701206774723085, 0.00013578375647341163, 0.000328577443557914)
2026-06-17 10:08:06,286 - optuna.study.study - INFO - Trial 294 finished with values: [0.0005701206774723085, 0.00013578375647341163, 0.000328577443557914] and parameters: {'n_layers': 4, 'embedding_dim': 32, 'lr': 0.007822927276622295, 'lambda_val': 3.567347607875195e-06, 'batch_size': 3410, 'optimizer': 'SGD'}.
2026-06-17 10:08:30,723 - experiment_functions - INFO - Early stopping at epoch 550. Best Metrics: (0.0025795528088725502, 0.0010799545282303904, 0.0018231016956450899)
2026-06-17 10:08:30,810 - optuna.study.study - INFO - Trial 295 finished with values: [0.0025795528088725502, 0.0010799545282303904, 0.0018231016956450899] and parameters: {'n_layers': 2, 'embedding_dim': 32, 'lr': 0.046129598836200957, 'lambda_val': 1.7261189135715837e-05, 'batch_size': 1310, 'optimizer': 'Adam'}.
2026-06-17 10:09:40,728 - experiment_functions - INFO - Early stopping at epoch 1700. Best Metrics: (0.0005902982085776909, 0.00012788935202728306, 0.00032909797457156433)
2026-06-17 10:09:40,799 - optuna.study.study - INFO - Trial 296 finished with values: [0.0005902982085776909, 0.00012788935202728306, 0.00032909797457156433] and parameters: {'n_layers': 1, 'embedding_dim': 32, 'lr': 1.6491066097124676e-05, 'lambda_val': 6.872101199763191e-06, 'batch_size': 3877, 'optimizer': 'Adam'}.
2026-06-17 10:10:13,574 - experiment_functions - INFO - Early stopping at epoch 750. Best Metrics: (0.0035463236994665564, 0.001359416445623342, 0.0024751474638953206)
2026-06-17 10:10:13,661 - optuna.study.study - INFO - Trial 297 finished with values: [0.0035463236994665564, 0.001359416445623342, 0.0024751474638953206] and parameters: {'n_layers': 1, 'embedding_dim': 32, 'lr': 0.001121895106789757, 'lambda_val': 1.5216807094072505e-05, 'batch_size': 3433, 'optimizer': 'Adam'}.
2026-06-17 10:10:42,348 - experiment_functions - INFO - Early stopping at epoch 650. Best Metrics: (0.003564947308440419, 0.0013846785398509537, 0.0024246834269009074)
2026-06-17 10:10:42,436 - optuna.study.study - INFO - Trial 298 finished with values: [0.003564947308440419, 0.0013846785398509537, 0.0024246834269009074] and parameters: {'n_layers': 1, 'embedding_dim': 64, 'lr': 0.001121895106789757, 'lambda_val': 5.2927329941475195e-06, 'batch_size': 1753, 'optimizer': 'RMSprop'}.
2026-06-17 10:11:23,163 - experiment_functions - INFO - Early stopping at epoch 950. Best Metrics: (0.002940602747603832, 0.0013088922571681193, 0.0021508009714772277)
2026-06-17 10:11:23,257 - optuna.study.study - INFO - Trial 299 finished with values: [0.002940602747603832, 0.0013088922571681193, 0.0021508009714772277] and parameters: {'n_layers': 1, 'embedding_dim': 64, 'lr': 0.0004860515181398459, 'lambda_val': 0.007692244890670793, 'batch_size': 3410, 'optimizer': 'Adam'}.
2026-06-17 10:11:23,273 - root - INFO - Selected Trial 218 based on Max ndcg: 0.0029
2026-06-17 10:11:23,273 - root - INFO - Associated Recall: 0.0042
2026-06-17 10:11:23,273 - experiment_functions - INFO - Training the best model ... for e_yelp_1c1dcs_strict
2026-06-17 10:11:47,743 - experiment_functions - INFO - Early stopping at epoch 550. Best Metrics: (0.004058912297900497, 0.0015694076038903625, 0.0027627395273753645)
2026-06-17 10:11:51,213 - root - INFO -   **** Training e_yelp_1c1dcs_strict_rand1
2026-06-17 10:11:51,225 - root - INFO -   **** Getting 34724/1274132 random edges
2026-06-17 10:11:51,326 - optuna.storages._rdb.storage - INFO - A new study created in RDB with name: Study_e_yelp_1c1dcs_strict_rand1
2026-06-17 10:13:25,097 - experiment_functions - INFO - Early stopping at epoch 2050. Best Metrics: (0.0034429046925693037, 0.0008510167992926614, 0.002118917058111437)
2026-06-17 10:13:25,146 - optuna.study.study - INFO - Trial 0 finished with values: [0.0034429046925693037, 0.0008510167992926614, 0.002118917058111437] and parameters: {'n_layers': 3, 'embedding_dim': 128, 'lr': 0.0008946860620636538, 'lambda_val': 1.170012968533328e-05, 'batch_size': 3100, 'optimizer': 'Adam'}.
2026-06-17 10:14:13,137 - experiment_functions - INFO - Early stopping at epoch 1150. Best Metrics: (0.0017562131205155875, 0.0005194518125552608, 0.0011806637181928726)
2026-06-17 10:14:13,197 - optuna.study.study - INFO - Trial 1 finished with values: [0.0017562131205155875, 0.0005194518125552608, 0.0011806637181928726] and parameters: {'n_layers': 1, 'embedding_dim': 32, 'lr': 0.01952107809190578, 'lambda_val': 0.039106784502058886, 'batch_size': 2622, 'optimizer': 'RMSprop'}.
2026-06-17 10:14:43,620 - experiment_functions - INFO - Early stopping at epoch 550. Best Metrics: (0.0024245441795309915, 0.0006047113805734496, 0.0016266695541204586)
2026-06-17 10:14:43,709 - optuna.study.study - INFO - Trial 2 finished with values: [0.0024245441795309915, 0.0006047113805734496, 0.0016266695541204586] and parameters: {'n_layers': 3, 'embedding_dim': 256, 'lr': 0.0048740799769871265, 'lambda_val': 0.007077349748530695, 'batch_size': 1615, 'optimizer': 'Adam'}.
2026-06-17 10:15:06,269 - experiment_functions - INFO - Early stopping at epoch 500. Best Metrics: (0.0005436276286623701, 0.00011367942402425163, 0.00029370710391751813)
2026-06-17 10:15:06,338 - optuna.study.study - INFO - Trial 3 finished with values: [0.0005436276286623701, 0.00011367942402425163, 0.00029370710391751813] and parameters: {'n_layers': 2, 'embedding_dim': 64, 'lr': 0.00014438619114700101, 'lambda_val': 0.00033647393306671894, 'batch_size': 3615, 'optimizer': 'SGD'}.
2026-06-17 10:15:30,787 - experiment_functions - INFO - Early stopping at epoch 500. Best Metrics: (0.000493142883743605, 0.00011210054313502589, 0.00026021328475434735)
2026-06-17 10:15:30,882 - optuna.study.study - INFO - Trial 4 finished with values: [0.000493142883743605, 0.00011210054313502589, 0.00026021328475434735] and parameters: {'n_layers': 4, 'embedding_dim': 96, 'lr': 1.1745179656792027e-05, 'lambda_val': 0.007055173815192509, 'batch_size': 3308, 'optimizer': 'SGD'}.
2026-06-17 10:16:04,920 - experiment_functions - INFO - Early stopping at epoch 700. Best Metrics: (0.0020589400252867774, 0.0006015536187949982, 0.0013461710401601152)
2026-06-17 10:16:05,004 - optuna.study.study - INFO - Trial 5 finished with values: [0.0020589400252867774, 0.0006015536187949982, 0.0013461710401601152] and parameters: {'n_layers': 1, 'embedding_dim': 256, 'lr': 0.013498745374989938, 'lambda_val': 0.07859991099891864, 'batch_size': 1507, 'optimizer': 'Adam'}.
2026-06-17 10:17:33,121 - experiment_functions - INFO - Early stopping at epoch 2100. Best Metrics: (0.001675582321908412, 0.0005273462170013896, 0.0011280499564974564)
2026-06-17 10:17:33,215 - optuna.study.study - INFO - Trial 6 finished with values: [0.001675582321908412, 0.0005273462170013896, 0.0011280499564974564] and parameters: {'n_layers': 2, 'embedding_dim': 64, 'lr': 0.07216055624234953, 'lambda_val': 0.0019501475113374148, 'batch_size': 2191, 'optimizer': 'RMSprop'}.
2026-06-17 10:18:01,828 - experiment_functions - INFO - Early stopping at epoch 500. Best Metrics: (0.0005080359851136265, 0.00012157382847038021, 0.0003297785556534722)
