2026-06-20 04:28:07,625 - optuna.study.study - INFO - Trial 39 finished with values: [0.005673200542814008, 0.0012315270935960591, 0.003238651398741966] and parameters: {'n_layers': 2, 'embedding_dim': 256, 'lr': 0.061381772770075456, 'lambda_val': 1.9616768085102623e-06, 'batch_size': 1174, 'optimizer': 'Adam'}.
2026-06-20 04:28:32,367 - experiment_functions - INFO - Early stopping at epoch 550. Best Metrics: (0.00868911681534258, 0.0020525451559934324, 0.0051182559972511475)
2026-06-20 04:28:32,459 - optuna.study.study - INFO - Trial 40 finished with values: [0.00868911681534258, 0.0020525451559934324, 0.0051182559972511475] and parameters: {'n_layers': 1, 'embedding_dim': 32, 'lr': 0.033323910818478145, 'lambda_val': 1.0746091986357293e-06, 'batch_size': 772, 'optimizer': 'Adam'}.
2026-06-20 04:29:13,311 - experiment_functions - INFO - Early stopping at epoch 900. Best Metrics: (0.01799527332841262, 0.003890362511052167, 0.00996859230392641)
2026-06-20 04:29:14,053 - optuna.study.study - INFO - Trial 41 finished with values: [0.01799527332841262, 0.003890362511052167, 0.00996859230392641] and parameters: {'n_layers': 3, 'embedding_dim': 32, 'lr': 0.0015608654005494732, 'lambda_val': 1.6265345504793854e-05, 'batch_size': 2121, 'optimizer': 'RMSprop'}.
2026-06-20 04:29:44,795 - experiment_functions - INFO - Early stopping at epoch 650. Best Metrics: (0.02775988999456354, 0.005755020841227738, 0.015874208891281633)
2026-06-20 04:29:44,893 - optuna.study.study - INFO - Trial 42 finished with values: [0.02775988999456354, 0.005755020841227738, 0.015874208891281633] and parameters: {'n_layers': 1, 'embedding_dim': 96, 'lr': 0.006590049461749219, 'lambda_val': 1.7016903226968311e-06, 'batch_size': 3646, 'optimizer': 'Adam'}.
2026-06-20 04:30:15,421 - experiment_functions - INFO - Early stopping at epoch 500. Best Metrics: (0.0005001807342215096, 0.00011052166224580017, 0.0002566980805799135)
2026-06-20 04:30:15,509 - optuna.study.study - INFO - Trial 43 finished with values: [0.0005001807342215096, 0.00011052166224580017, 0.0002566980805799135] and parameters: {'n_layers': 3, 'embedding_dim': 256, 'lr': 0.029270960401586436, 'lambda_val': 0.00018324814053230913, 'batch_size': 1816, 'optimizer': 'SGD'}.
2026-06-20 04:30:43,383 - experiment_functions - INFO - Early stopping at epoch 550. Best Metrics: (0.004474205556382319, 0.0009741695086522673, 0.0024591578408276584)
2026-06-20 04:30:43,474 - optuna.study.study - INFO - Trial 44 finished with values: [0.004474205556382319, 0.0009741695086522673, 0.0024591578408276584] and parameters: {'n_layers': 3, 'embedding_dim': 96, 'lr': 0.014192902425899798, 'lambda_val': 0.008286079853220295, 'batch_size': 2490, 'optimizer': 'Adam'}.
2026-06-20 04:33:40,422 - optuna.study.study - INFO - Trial 45 finished with values: [0.001210264314304366, 0.0003015662498421119, 0.0007281420722909614] and parameters: {'n_layers': 3, 'embedding_dim': 64, 'lr': 8.810194760824372e-05, 'lambda_val': 0.0009525816346805851, 'batch_size': 3389, 'optimizer': 'Adam'}.
2026-06-20 04:34:26,364 - experiment_functions - INFO - Early stopping at epoch 700. Best Metrics: (0.00045701670001145476, 0.00010894278135657447, 0.00025573920291556326)
2026-06-20 04:34:26,451 - optuna.study.study - INFO - Trial 46 finished with values: [0.00045701670001145476, 0.00010894278135657447, 0.00025573920291556326] and parameters: {'n_layers': 4, 'embedding_dim': 256, 'lr': 1.008532541457742e-05, 'lambda_val': 0.00040054368918868947, 'batch_size': 3807, 'optimizer': 'RMSprop'}.
2026-06-20 04:34:50,296 - experiment_functions - INFO - Early stopping at epoch 500. Best Metrics: (0.000533099422618399, 0.00010578501957812305, 0.0002743862681612982)
2026-06-20 04:34:51,380 - optuna.study.study - INFO - Trial 47 finished with values: [0.000533099422618399, 0.00010578501957812305, 0.0002743862681612982] and parameters: {'n_layers': 2, 'embedding_dim': 64, 'lr': 0.00019099021256510485, 'lambda_val': 0.00013742487937145302, 'batch_size': 2144, 'optimizer': 'SGD'}.
2026-06-20 04:37:43,524 - optuna.study.study - INFO - Trial 48 finished with values: [0.0007235138691783893, 0.00016736137425792601, 0.00043371402023231775] and parameters: {'n_layers': 1, 'embedding_dim': 96, 'lr': 0.00014857796555733694, 'lambda_val': 2.51169636955616e-06, 'batch_size': 4086, 'optimizer': 'Adam'}.
2026-06-20 04:38:20,207 - experiment_functions - INFO - Early stopping at epoch 700. Best Metrics: (0.006829202887714331, 0.001398888467853985, 0.003737009997275465)
2026-06-20 04:38:20,300 - optuna.study.study - INFO - Trial 49 finished with values: [0.006829202887714331, 0.001398888467853985, 0.003737009997275465] and parameters: {'n_layers': 4, 'embedding_dim': 96, 'lr': 0.024358686102743537, 'lambda_val': 0.00014701371585936312, 'batch_size': 4090, 'optimizer': 'Adam'}.
2026-06-20 04:38:57,503 - experiment_functions - INFO - Early stopping at epoch 600. Best Metrics: (0.0006346178874278629, 0.00014367816091954025, 0.0003589269379674195)
2026-06-20 04:38:57,597 - optuna.study.study - INFO - Trial 50 finished with values: [0.0006346178874278629, 0.00014367816091954025, 0.0003589269379674195] and parameters: {'n_layers': 3, 'embedding_dim': 256, 'lr': 1.3082510347966049e-05, 'lambda_val': 4.73766341587652e-06, 'batch_size': 2374, 'optimizer': 'RMSprop'}.
2026-06-20 04:39:30,927 - experiment_functions - INFO - Early stopping at epoch 500. Best Metrics: (0.0005408420877096898, 0.00012631047113805733, 0.0003037651601717758)
2026-06-20 04:39:31,459 - optuna.study.study - INFO - Trial 51 finished with values: [0.0005408420877096898, 0.00012631047113805733, 0.0003037651601717758] and parameters: {'n_layers': 4, 'embedding_dim': 256, 'lr': 0.007001952181523415, 'lambda_val': 0.004600138235913327, 'batch_size': 631, 'optimizer': 'SGD'}.
2026-06-20 04:39:58,140 - experiment_functions - INFO - Early stopping at epoch 550. Best Metrics: (0.015859126954359162, 0.003413540482506, 0.009649674764327458)
2026-06-20 04:39:58,234 - optuna.study.study - INFO - Trial 52 finished with values: [0.015859126954359162, 0.003413540482506, 0.009649674764327458] and parameters: {'n_layers': 2, 'embedding_dim': 64, 'lr': 0.007284909067173104, 'lambda_val': 1.0112597680663849e-05, 'batch_size': 547, 'optimizer': 'RMSprop'}.
2026-06-20 04:40:23,107 - experiment_functions - INFO - Early stopping at epoch 500. Best Metrics: (0.0005195986998273388, 0.00012315270935960593, 0.0003183819471696886)
2026-06-20 04:40:23,169 - optuna.study.study - INFO - Trial 53 finished with values: [0.0005195986998273388, 0.00012315270935960593, 0.0003183819471696886] and parameters: {'n_layers': 2, 'embedding_dim': 128, 'lr': 0.008804952478863077, 'lambda_val': 6.868274004831431e-05, 'batch_size': 3338, 'optimizer': 'SGD'}.
2026-06-20 04:40:52,499 - experiment_functions - INFO - Early stopping at epoch 650. Best Metrics: (0.008550308140558124, 0.0019830743968675003, 0.004802399327366816)
2026-06-20 04:40:52,549 - optuna.study.study - INFO - Trial 54 finished with values: [0.008550308140558124, 0.0019830743968675003, 0.004802399327366816] and parameters: {'n_layers': 4, 'embedding_dim': 32, 'lr': 0.002099990505043131, 'lambda_val': 0.024205880733871414, 'batch_size': 2313, 'optimizer': 'Adam'}.
2026-06-20 04:41:22,287 - experiment_functions - INFO - Early stopping at epoch 500. Best Metrics: (0.0007037145900881049, 0.00014209928003031453, 0.00034920817474482044)
2026-06-20 04:41:22,360 - optuna.study.study - INFO - Trial 55 finished with values: [0.0007037145900881049, 0.00014209928003031453, 0.00034920817474482044] and parameters: {'n_layers': 3, 'embedding_dim': 256, 'lr': 0.004958786625127089, 'lambda_val': 0.0066875037866738676, 'batch_size': 1192, 'optimizer': 'SGD'}.
2026-06-20 04:41:57,401 - experiment_functions - INFO - Early stopping at epoch 800. Best Metrics: (0.0005202848556986177, 0.00012631047113805733, 0.00027722535942750065)
2026-06-20 04:41:57,504 - optuna.study.study - INFO - Trial 56 finished with values: [0.0005202848556986177, 0.00012631047113805733, 0.00027722535942750065] and parameters: {'n_layers': 1, 'embedding_dim': 96, 'lr': 3.496139534750197e-05, 'lambda_val': 1.7016903226968311e-06, 'batch_size': 850, 'optimizer': 'Adam'}.
2026-06-20 04:42:39,310 - experiment_functions - INFO - Early stopping at epoch 950. Best Metrics: (0.017777456979866588, 0.003729316660351143, 0.010096702929493497)
2026-06-20 04:42:40,000 - optuna.study.study - INFO - Trial 57 finished with values: [0.017777456979866588, 0.003729316660351143, 0.010096702929493497] and parameters: {'n_layers': 3, 'embedding_dim': 32, 'lr': 0.0015608654005494732, 'lambda_val': 1.6265345504793854e-05, 'batch_size': 2266, 'optimizer': 'RMSprop'}.
2026-06-20 04:43:12,473 - experiment_functions - INFO - Early stopping at epoch 500. Best Metrics: (0.0005584988427979501, 0.0001278893520272831, 0.00033052675190104277)
2026-06-20 04:43:12,542 - optuna.study.study - INFO - Trial 58 finished with values: [0.0005584988427979501, 0.0001278893520272831, 0.00033052675190104277] and parameters: {'n_layers': 4, 'embedding_dim': 256, 'lr': 0.00014217907498133154, 'lambda_val': 0.004600138235913327, 'batch_size': 2368, 'optimizer': 'SGD'}.
2026-06-20 04:43:35,504 - experiment_functions - INFO - Early stopping at epoch 500. Best Metrics: (0.0005262407421962762, 0.00011052166224580018, 0.0002705170871099182)
2026-06-20 04:43:35,573 - optuna.study.study - INFO - Trial 59 finished with values: [0.0005262407421962762, 0.00011052166224580018, 0.0002705170871099182] and parameters: {'n_layers': 1, 'embedding_dim': 96, 'lr': 6.248675726120522e-05, 'lambda_val': 0.0001136338188781775, 'batch_size': 3927, 'optimizer': 'SGD'}.
2026-06-20 04:46:18,180 - optuna.study.study - INFO - Trial 60 finished with values: [0.02795436970204831, 0.0059302766199317925, 0.015897823985922255] and parameters: {'n_layers': 1, 'embedding_dim': 32, 'lr': 0.0006438418474980425, 'lambda_val': 3.64590979484011e-06, 'batch_size': 2973, 'optimizer': 'RMSprop'}.
2026-06-20 04:46:50,680 - experiment_functions - INFO - Early stopping at epoch 500. Best Metrics: (0.0006919504355425946, 0.00014525704180876593, 0.0003786525976048563)
2026-06-20 04:46:50,770 - optuna.study.study - INFO - Trial 61 finished with values: [0.0006919504355425946, 0.00014525704180876593, 0.0003786525976048563] and parameters: {'n_layers': 4, 'embedding_dim': 256, 'lr': 0.00198213638870542, 'lambda_val': 0.005733894259851225, 'batch_size': 3673, 'optimizer': 'SGD'}.
2026-06-20 04:47:18,713 - experiment_functions - INFO - Early stopping at epoch 600. Best Metrics: (0.02113917888951125, 0.0047887457370216, 0.012016947872468941)
2026-06-20 04:47:18,802 - optuna.study.study - INFO - Trial 62 finished with values: [0.02113917888951125, 0.0047887457370216, 0.012016947872468941] and parameters: {'n_layers': 1, 'embedding_dim': 96, 'lr': 0.006590049461749219, 'lambda_val': 0.010631670857151724, 'batch_size': 3646, 'optimizer': 'Adam'}.
2026-06-20 04:50:08,932 - optuna.study.study - INFO - Trial 63 finished with values: [0.002342187831202436, 0.0005920803334596438, 0.0014255150921571869] and parameters: {'n_layers': 1, 'embedding_dim': 128, 'lr': 0.00021874714734455622, 'lambda_val': 0.00014701371585936312, 'batch_size': 4090, 'optimizer': 'RMSprop'}.
2026-06-20 04:51:50,335 - experiment_functions - INFO - Early stopping at epoch 2400. Best Metrics: (0.03304433150660858, 0.006812871037008968, 0.018958297906711306)
2026-06-20 04:51:50,439 - optuna.study.study - INFO - Trial 64 finished with values: [0.03304433150660858, 0.006812871037008968, 0.018958297906711306] and parameters: {'n_layers': 1, 'embedding_dim': 32, 'lr': 0.001705082463001927, 'lambda_val': 1.0746091986357293e-06, 'batch_size': 2973, 'optimizer': 'Adam'}.
2026-06-20 04:53:16,141 - experiment_functions - INFO - Early stopping at epoch 1900. Best Metrics: (0.004633954853879111, 0.0009804850322091701, 0.0025591362572424774)
2026-06-20 04:53:16,207 - optuna.study.study - INFO - Trial 65 finished with values: [0.004633954853879111, 0.0009804850322091701, 0.0025591362572424774] and parameters: {'n_layers': 4, 'embedding_dim': 64, 'lr': 0.011366982784829003, 'lambda_val': 0.010631670857151724, 'batch_size': 3917, 'optimizer': 'RMSprop'}.
2026-06-20 04:53:59,910 - experiment_functions - INFO - Early stopping at epoch 1000. Best Metrics: (0.015818407329289373, 0.0032967032967032967, 0.008835441053001089)
2026-06-20 04:54:00,001 - optuna.study.study - INFO - Trial 66 finished with values: [0.015818407329289373, 0.0032967032967032967, 0.008835441053001089] and parameters: {'n_layers': 1, 'embedding_dim': 64, 'lr': 0.007781060326314749, 'lambda_val': 3.64590979484011e-06, 'batch_size': 2973, 'optimizer': 'RMSprop'}.
2026-06-20 04:54:31,334 - experiment_functions - INFO - Early stopping at epoch 700. Best Metrics: (0.01767202550005829, 0.003846153846153846, 0.00974057621507389)
2026-06-20 04:54:31,420 - optuna.study.study - INFO - Trial 67 finished with values: [0.01767202550005829, 0.003846153846153846, 0.00974057621507389] and parameters: {'n_layers': 1, 'embedding_dim': 64, 'lr': 0.006678676571422479, 'lambda_val': 0.0022723744163998237, 'batch_size': 850, 'optimizer': 'Adam'}.
2026-06-20 04:57:00,616 - experiment_functions - INFO - Early stopping at epoch 3500. Best Metrics: (0.027240231460418925, 0.005895541240368827, 0.01538380122840739)
2026-06-20 04:57:00,693 - optuna.study.study - INFO - Trial 68 finished with values: [0.027240231460418925, 0.005895541240368827, 0.01538380122840739] and parameters: {'n_layers': 3, 'embedding_dim': 32, 'lr': 0.0006438418474980425, 'lambda_val': 1.0112597680663849e-05, 'batch_size': 1299, 'optimizer': 'RMSprop'}.
2026-06-20 04:57:27,224 - experiment_functions - INFO - Early stopping at epoch 550. Best Metrics: (0.006169311473155897, 0.0013673108500694706, 0.003560374730672892)
2026-06-20 04:57:27,314 - optuna.study.study - INFO - Trial 69 finished with values: [0.006169311473155897, 0.0013673108500694706, 0.003560374730672892] and parameters: {'n_layers': 2, 'embedding_dim': 96, 'lr': 0.014192902425899798, 'lambda_val': 0.008286079853220295, 'batch_size': 2490, 'optimizer': 'Adam'}.
2026-06-20 04:57:52,660 - experiment_functions - INFO - Early stopping at epoch 550. Best Metrics: (0.004932181382831131, 0.001132057597574839, 0.0027167047078546732)
2026-06-20 04:57:52,750 - optuna.study.study - INFO - Trial 70 finished with values: [0.004932181382831131, 0.001132057597574839, 0.0027167047078546732] and parameters: {'n_layers': 2, 'embedding_dim': 64, 'lr': 0.08305721718816232, 'lambda_val': 0.00017182706294327683, 'batch_size': 3364, 'optimizer': 'Adam'}.
2026-06-20 04:58:19,823 - experiment_functions - INFO - Early stopping at epoch 500. Best Metrics: (0.0005383945879957418, 0.00011210054313502589, 0.0002773149792486762)
2026-06-20 04:58:19,900 - optuna.study.study - INFO - Trial 71 finished with values: [0.0005383945879957418, 0.00011210054313502589, 0.0002773149792486762] and parameters: {'n_layers': 4, 'embedding_dim': 128, 'lr': 1.9220259801613276e-05, 'lambda_val': 5.862695945021397e-05, 'batch_size': 3364, 'optimizer': 'SGD'}.
2026-06-20 04:59:11,873 - experiment_functions - INFO - Early stopping at epoch 1050. Best Metrics: (0.012913887240412019, 0.002800934697486421, 0.006833915433869588)
2026-06-20 04:59:11,968 - optuna.study.study - INFO - Trial 72 finished with values: [0.012913887240412019, 0.002800934697486421, 0.006833915433869588] and parameters: {'n_layers': 4, 'embedding_dim': 96, 'lr': 0.000904089143485971, 'lambda_val': 0.0022723744163998237, 'batch_size': 850, 'optimizer': 'RMSprop'}.
2026-06-20 05:01:57,640 - optuna.study.study - INFO - Trial 73 finished with values: [0.03418572856895947, 0.007005494505494504, 0.019557872633869176] and parameters: {'n_layers': 1, 'embedding_dim': 32, 'lr': 0.0012953028594055518, 'lambda_val': 3.64590979484011e-06, 'batch_size': 2973, 'optimizer': 'RMSprop'}.
2026-06-20 05:02:31,377 - experiment_functions - INFO - Early stopping at epoch 750. Best Metrics: (0.012652720280637048, 0.0027140962485790072, 0.007129047380995423)
2026-06-20 05:02:31,481 - optuna.study.study - INFO - Trial 74 finished with values: [0.012652720280637048, 0.0027140962485790072, 0.007129047380995423] and parameters: {'n_layers': 4, 'embedding_dim': 32, 'lr': 0.002488784556108625, 'lambda_val': 0.00012018704157732538, 'batch_size': 3770, 'optimizer': 'RMSprop'}.
2026-06-20 05:02:54,867 - experiment_functions - INFO - Early stopping at epoch 500. Best Metrics: (0.0005541805799169138, 0.00011999494758115447, 0.00030356815992599995)
2026-06-20 05:02:56,188 - optuna.study.study - INFO - Trial 75 finished with values: [0.0005541805799169138, 0.00011999494758115447, 0.00030356815992599995] and parameters: {'n_layers': 2, 'embedding_dim': 96, 'lr': 0.0006438418474980425, 'lambda_val': 8.155419992258185e-05, 'batch_size': 1371, 'optimizer': 'SGD'}.
2026-06-20 05:03:20,435 - experiment_functions - INFO - Early stopping at epoch 500. Best Metrics: (0.0005963351975098849, 0.00011210054313502589, 0.00032806844872758644)
2026-06-20 05:03:20,531 - optuna.study.study - INFO - Trial 76 finished with values: [0.0005963351975098849, 0.00011210054313502589, 0.00032806844872758644] and parameters: {'n_layers': 4, 'embedding_dim': 64, 'lr': 0.03592527199284198, 'lambda_val': 0.0011171827933879725, 'batch_size': 3724, 'optimizer': 'SGD'}.
2026-06-20 05:03:48,912 - experiment_functions - INFO - Early stopping at epoch 600. Best Metrics: (0.016423798951431, 0.0038319439181508153, 0.009141347886713821)
2026-06-20 05:03:48,987 - optuna.study.study - INFO - Trial 77 finished with values: [0.016423798951431, 0.0038319439181508153, 0.009141347886713821] and parameters: {'n_layers': 2, 'embedding_dim': 96, 'lr': 0.002668806132567397, 'lambda_val': 0.015665527252443415, 'batch_size': 3874, 'optimizer': 'Adam'}.
2026-06-20 05:04:31,625 - experiment_functions - INFO - Early stopping at epoch 900. Best Metrics: (0.01698462933294824, 0.003651951496779083, 0.009293579640093265)
2026-06-20 05:04:31,727 - optuna.study.study - INFO - Trial 78 finished with values: [0.01698462933294824, 0.003651951496779083, 0.009293579640093265] and parameters: {'n_layers': 4, 'embedding_dim': 64, 'lr': 0.0015188008453039274, 'lambda_val': 1.3920722257161993e-06, 'batch_size': 1231, 'optimizer': 'Adam'}.
2026-06-20 05:05:02,296 - experiment_functions - INFO - Early stopping at epoch 600. Best Metrics: (0.007618634961502802, 0.0017036124794745486, 0.004094468825317692)
2026-06-20 05:05:02,383 - optuna.study.study - INFO - Trial 79 finished with values: [0.007618634961502802, 0.0017036124794745486, 0.004094468825317692] and parameters: {'n_layers': 4, 'embedding_dim': 96, 'lr': 0.002668806132567397, 'lambda_val': 0.015665527252443415, 'batch_size': 3874, 'optimizer': 'Adam'}.
2026-06-20 05:05:28,678 - experiment_functions - INFO - Early stopping at epoch 600. Best Metrics: (0.01045872158495662, 0.002313060502715675, 0.006031845958327428)
2026-06-20 05:05:28,764 - optuna.study.study - INFO - Trial 80 finished with values: [0.01045872158495662, 0.002313060502715675, 0.006031845958327428] and parameters: {'n_layers': 1, 'embedding_dim': 32, 'lr': 0.014356041955590594, 'lambda_val': 2.51169636955616e-06, 'batch_size': 4086, 'optimizer': 'RMSprop'}.
2026-06-20 05:06:25,766 - experiment_functions - INFO - Early stopping at epoch 1350. Best Metrics: (0.004387691228242556, 0.0010294303397751674, 0.002410308851004982)
2026-06-20 05:06:25,878 - optuna.study.study - INFO - Trial 81 finished with values: [0.004387691228242556, 0.0010294303397751674, 0.002410308851004982] and parameters: {'n_layers': 3, 'embedding_dim': 32, 'lr': 0.000904089143485971, 'lambda_val': 0.08083131485978584, 'batch_size': 1192, 'optimizer': 'RMSprop'}.
2026-06-20 05:06:49,348 - experiment_functions - INFO - Early stopping at epoch 500. Best Metrics: (0.0004978899336645318, 0.00011999494758115447, 0.0003001017734085352)
2026-06-20 05:06:49,431 - optuna.study.study - INFO - Trial 82 finished with values: [0.0004978899336645318, 0.00011999494758115447, 0.0003001017734085352] and parameters: {'n_layers': 1, 'embedding_dim': 128, 'lr': 0.00041090885210817534, 'lambda_val': 0.04528396891807359, 'batch_size': 3770, 'optimizer': 'RMSprop'}.
2026-06-20 05:07:14,369 - experiment_functions - INFO - Early stopping at epoch 550. Best Metrics: (0.003991434250611007, 0.0008304913477327271, 0.002147239252146642)
2026-06-20 05:07:14,459 - optuna.study.study - INFO - Trial 83 finished with values: [0.003991434250611007, 0.0008304913477327271, 0.002147239252146642] and parameters: {'n_layers': 4, 'embedding_dim': 32, 'lr': 0.011366982784829003, 'lambda_val': 0.010631670857151724, 'batch_size': 941, 'optimizer': 'RMSprop'}.
2026-06-20 05:07:44,149 - experiment_functions - INFO - Early stopping at epoch 650. Best Metrics: (0.027372979216243674, 0.005767651888341543, 0.01582532895138966)
2026-06-20 05:07:44,232 - optuna.study.study - INFO - Trial 84 finished with values: [0.027372979216243674, 0.005767651888341543, 0.01582532895138966] and parameters: {'n_layers': 1, 'embedding_dim': 96, 'lr': 0.006590049461749219, 'lambda_val': 1.7016903226968311e-06, 'batch_size': 2683, 'optimizer': 'Adam'}.
2026-06-20 05:08:56,030 - experiment_functions - INFO - Early stopping at epoch 1650. Best Metrics: (0.025140366556169157, 0.005448717948717949, 0.014005918171206451)
2026-06-20 05:08:56,113 - optuna.study.study - INFO - Trial 85 finished with values: [0.025140366556169157, 0.005448717948717949, 0.014005918171206451] and parameters: {'n_layers': 2, 'embedding_dim': 64, 'lr': 0.0006438418474980425, 'lambda_val': 0.0066875037866738676, 'batch_size': 1163, 'optimizer': 'RMSprop'}.
2026-06-20 05:10:54,465 - experiment_functions - INFO - Early stopping at epoch 2650. Best Metrics: (0.003957562117993648, 0.0009110142730832386, 0.0021494063817801864)
