2026-06-22 15:49:35,741 - optuna.study.study - INFO - Trial 243 finished with values: [0.0005380209172682534, 0.00011683718580270305, 0.00029806469938557854] and parameters: {'n_layers': 1, 'embedding_dim': 96, 'lr': 0.001487817598059853, 'lambda_val': 0.00011379660469282507, 'batch_size': 2674, 'optimizer': 'SGD'}.
2026-06-22 15:51:30,862 - experiment_functions - INFO - Early stopping at epoch 2650. Best Metrics: (0.028249304902533436, 0.006099216875078944, 0.015761019014402085)
2026-06-22 15:51:30,963 - optuna.study.study - INFO - Trial 244 finished with values: [0.028249304902533436, 0.006099216875078944, 0.015761019014402085] and parameters: {'n_layers': 2, 'embedding_dim': 32, 'lr': 0.0006753032109319728, 'lambda_val': 3.90887208716658e-05, 'batch_size': 2235, 'optimizer': 'RMSprop'}.
2026-06-22 15:52:50,740 - experiment_functions - INFO - Early stopping at epoch 1550. Best Metrics: (0.031354629360784175, 0.0064844638120500194, 0.017847964895140327)
2026-06-22 15:52:50,860 - optuna.study.study - INFO - Trial 245 finished with values: [0.031354629360784175, 0.0064844638120500194, 0.017847964895140327] and parameters: {'n_layers': 1, 'embedding_dim': 256, 'lr': 0.0010694394042823291, 'lambda_val': 5.915966748772391e-06, 'batch_size': 3537, 'optimizer': 'RMSprop'}.
2026-06-22 15:53:56,245 - experiment_functions - INFO - Early stopping at epoch 1500. Best Metrics: (0.03099498564483102, 0.006479727169382342, 0.01762832362627449)
2026-06-22 15:53:56,347 - optuna.study.study - INFO - Trial 246 finished with values: [0.03099498564483102, 0.006479727169382342, 0.01762832362627449] and parameters: {'n_layers': 1, 'embedding_dim': 32, 'lr': 0.0018725355385280041, 'lambda_val': 1.3761340713703872e-05, 'batch_size': 2116, 'optimizer': 'RMSprop'}.
2026-06-22 15:56:42,480 - optuna.study.study - INFO - Trial 247 finished with values: [0.02292953834492068, 0.005072944297082228, 0.013617066309782504] and parameters: {'n_layers': 1, 'embedding_dim': 32, 'lr': 0.0005464989571285408, 'lambda_val': 1.3761340713703872e-05, 'batch_size': 2836, 'optimizer': 'Adam'}.
2026-06-22 15:59:28,698 - optuna.study.study - INFO - Trial 248 finished with values: [0.025765353221857263, 0.005685550082101806, 0.014835864368214683] and parameters: {'n_layers': 1, 'embedding_dim': 32, 'lr': 0.0005652244898304067, 'lambda_val': 1.3761340713703872e-05, 'batch_size': 2900, 'optimizer': 'RMSprop'}.
2026-06-22 16:01:08,657 - experiment_functions - INFO - Early stopping at epoch 2350. Best Metrics: (0.03197316807218947, 0.006653404067197171, 0.01803026156891274)
2026-06-22 16:01:08,757 - optuna.study.study - INFO - Trial 249 finished with values: [0.03197316807218947, 0.006653404067197171, 0.01803026156891274] and parameters: {'n_layers': 1, 'embedding_dim': 32, 'lr': 0.001487817598059853, 'lambda_val': 0.0001979130594640894, 'batch_size': 2900, 'optimizer': 'RMSprop'}.
2026-06-22 16:02:07,927 - experiment_functions - INFO - Early stopping at epoch 1150. Best Metrics: (0.031511009711052744, 0.006516041429834533, 0.01796516527666848)
2026-06-22 16:02:08,073 - optuna.study.study - INFO - Trial 250 finished with values: [0.031511009711052744, 0.006516041429834533, 0.01796516527666848] and parameters: {'n_layers': 1, 'embedding_dim': 256, 'lr': 0.0018725355385280041, 'lambda_val': 0.00016081976691657246, 'batch_size': 1891, 'optimizer': 'Adam'}.
2026-06-22 16:04:55,005 - optuna.study.study - INFO - Trial 251 finished with values: [0.03398653185349185, 0.007073386383731213, 0.0198000385648198] and parameters: {'n_layers': 1, 'embedding_dim': 32, 'lr': 0.0010694394042823291, 'lambda_val': 1.3761340713703872e-05, 'batch_size': 3537, 'optimizer': 'RMSprop'}.
2026-06-22 16:07:25,214 - experiment_functions - INFO - Early stopping at epoch 3650. Best Metrics: (0.0314310470224324, 0.006714980421876973, 0.017772578433576533)
2026-06-22 16:07:25,328 - optuna.study.study - INFO - Trial 252 finished with values: [0.0314310470224324, 0.006714980421876973, 0.017772578433576533] and parameters: {'n_layers': 1, 'embedding_dim': 32, 'lr': 0.0010694394042823291, 'lambda_val': 1.3761340713703872e-05, 'batch_size': 1022, 'optimizer': 'RMSprop'}.
2026-06-22 16:10:20,820 - optuna.study.study - INFO - Trial 253 finished with values: [0.03391678155324476, 0.007116016167740305, 0.0191490436681605] and parameters: {'n_layers': 1, 'embedding_dim': 96, 'lr': 0.0006753032109319728, 'lambda_val': 0.0007109535707376064, 'batch_size': 3110, 'optimizer': 'RMSprop'}.
2026-06-22 16:13:35,425 - optuna.study.study - INFO - Trial 254 finished with values: [0.01982961545744596, 0.004466654035619553, 0.011794844129151867] and parameters: {'n_layers': 1, 'embedding_dim': 256, 'lr': 0.00039195797305472064, 'lambda_val': 7.724967695086265e-05, 'batch_size': 2116, 'optimizer': 'RMSprop'}.
2026-06-22 16:14:22,934 - experiment_functions - INFO - Early stopping at epoch 1050. Best Metrics: (0.0005142398195406046, 0.0001405203991410888, 0.00028225116630582926)
2026-06-22 16:14:23,035 - optuna.study.study - INFO - Trial 255 finished with values: [0.0005142398195406046, 0.0001405203991410888, 0.00028225116630582926] and parameters: {'n_layers': 1, 'embedding_dim': 128, 'lr': 1.3529578796243103e-05, 'lambda_val': 5.915966748772391e-06, 'batch_size': 3537, 'optimizer': 'RMSprop'}.
2026-06-22 16:15:05,141 - experiment_functions - INFO - Early stopping at epoch 950. Best Metrics: (0.028512469369850947, 0.006217632941770872, 0.016373747584658142)
2026-06-22 16:15:05,238 - optuna.study.study - INFO - Trial 256 finished with values: [0.028512469369850947, 0.006217632941770872, 0.016373747584658142] and parameters: {'n_layers': 1, 'embedding_dim': 32, 'lr': 0.0018725355385280041, 'lambda_val': 1.3761340713703872e-05, 'batch_size': 2900, 'optimizer': 'RMSprop'}.
2026-06-22 16:16:48,018 - experiment_functions - INFO - Early stopping at epoch 2250. Best Metrics: (0.032972564533416356, 0.0067939244663382595, 0.018722634772285918)
2026-06-22 16:16:48,118 - optuna.study.study - INFO - Trial 257 finished with values: [0.032972564533416356, 0.0067939244663382595, 0.018722634772285918] and parameters: {'n_layers': 1, 'embedding_dim': 128, 'lr': 0.001247135325126933, 'lambda_val': 0.0005024742971774576, 'batch_size': 2836, 'optimizer': 'Adam'}.
2026-06-22 16:17:20,147 - experiment_functions - INFO - Early stopping at epoch 600. Best Metrics: (0.0005049363602838961, 0.00011999494758115448, 0.00032015456650737867)
2026-06-22 16:17:20,227 - optuna.study.study - INFO - Trial 258 finished with values: [0.0005049363602838961, 0.00011999494758115448, 0.00032015456650737867] and parameters: {'n_layers': 3, 'embedding_dim': 128, 'lr': 1.2063806981722842e-05, 'lambda_val': 0.0001979130594640894, 'batch_size': 2674, 'optimizer': 'Adam'}.
2026-06-22 16:18:45,639 - experiment_functions - INFO - Early stopping at epoch 2000. Best Metrics: (0.030472693488561485, 0.0065649867374005305, 0.01760023546276223)
2026-06-22 16:18:45,720 - optuna.study.study - INFO - Trial 259 finished with values: [0.030472693488561485, 0.0065649867374005305, 0.01760023546276223] and parameters: {'n_layers': 1, 'embedding_dim': 32, 'lr': 0.001487817598059853, 'lambda_val': 0.0001979130594640894, 'batch_size': 859, 'optimizer': 'RMSprop'}.
2026-06-22 16:19:21,484 - experiment_functions - INFO - Early stopping at epoch 800. Best Metrics: (0.03232574227900892, 0.006722874826323102, 0.01850888775313046)
2026-06-22 16:19:21,815 - optuna.study.study - INFO - Trial 260 finished with values: [0.03232574227900892, 0.006722874826323102, 0.01850888775313046] and parameters: {'n_layers': 1, 'embedding_dim': 32, 'lr': 0.003916255753855854, 'lambda_val': 3.90887208716658e-05, 'batch_size': 2235, 'optimizer': 'Adam'}.
2026-06-22 16:20:29,070 - experiment_functions - INFO - Early stopping at epoch 1550. Best Metrics: (0.03217457005437783, 0.0067212959454338765, 0.018452440811667133)
2026-06-22 16:20:29,151 - optuna.study.study - INFO - Trial 261 finished with values: [0.03217457005437783, 0.0067212959454338765, 0.018452440811667133] and parameters: {'n_layers': 1, 'embedding_dim': 32, 'lr': 0.0018725355385280041, 'lambda_val': 0.0004760939938747863, 'batch_size': 2900, 'optimizer': 'Adam'}.
2026-06-22 16:22:48,814 - experiment_functions - INFO - Early stopping at epoch 2900. Best Metrics: (0.030173223523132918, 0.006370784388025768, 0.01746114093943956)
2026-06-22 16:22:48,918 - optuna.study.study - INFO - Trial 262 finished with values: [0.030173223523132918, 0.006370784388025768, 0.01746114093943956] and parameters: {'n_layers': 2, 'embedding_dim': 128, 'lr': 0.0005652244898304067, 'lambda_val': 4.627893684414806e-05, 'batch_size': 2900, 'optimizer': 'Adam'}.
2026-06-22 16:25:47,240 - optuna.study.study - INFO - Trial 263 finished with values: [0.03237759849682633, 0.006912340533030189, 0.018505058323831813] and parameters: {'n_layers': 1, 'embedding_dim': 128, 'lr': 0.0006753032109319728, 'lambda_val': 0.00011379660469282507, 'batch_size': 2836, 'optimizer': 'RMSprop'}.
2026-06-22 16:26:39,530 - experiment_functions - INFO - Early stopping at epoch 1150. Best Metrics: (0.03095617318237582, 0.006579196665403562, 0.01763189702736611)
2026-06-22 16:26:39,632 - optuna.study.study - INFO - Trial 264 finished with values: [0.03095617318237582, 0.006579196665403562, 0.01763189702736611] and parameters: {'n_layers': 1, 'embedding_dim': 96, 'lr': 0.001487817598059853, 'lambda_val': 0.0007109535707376064, 'batch_size': 1785, 'optimizer': 'RMSprop'}.
2026-06-22 16:27:28,457 - experiment_functions - INFO - Early stopping at epoch 850. Best Metrics: (0.027008356890679888, 0.005679234558544904, 0.015141216128552789)
2026-06-22 16:27:28,538 - optuna.study.study - INFO - Trial 265 finished with values: [0.027008356890679888, 0.005679234558544904, 0.015141216128552789] and parameters: {'n_layers': 2, 'embedding_dim': 256, 'lr': 0.001247135325126933, 'lambda_val': 0.0001979130594640894, 'batch_size': 2668, 'optimizer': 'Adam'}.
2026-06-22 16:28:06,267 - experiment_functions - INFO - Early stopping at epoch 850. Best Metrics: (0.03041760025141078, 0.006509725906277631, 0.017812231551479266)
2026-06-22 16:28:06,366 - optuna.study.study - INFO - Trial 266 finished with values: [0.03041760025141078, 0.006509725906277631, 0.017812231551479266] and parameters: {'n_layers': 1, 'embedding_dim': 32, 'lr': 0.0018725355385280041, 'lambda_val': 1.3761340713703872e-05, 'batch_size': 3916, 'optimizer': 'RMSprop'}.
2026-06-22 16:29:08,990 - experiment_functions - INFO - Early stopping at epoch 1350. Best Metrics: (0.0328054296698885, 0.006831817607679676, 0.019061549988886355)
2026-06-22 16:29:09,103 - optuna.study.study - INFO - Trial 267 finished with values: [0.0328054296698885, 0.006831817607679676, 0.019061549988886355] and parameters: {'n_layers': 1, 'embedding_dim': 128, 'lr': 0.0015478748263020232, 'lambda_val': 0.0001979130594640894, 'batch_size': 2292, 'optimizer': 'Adam'}.
2026-06-22 16:30:00,990 - experiment_functions - INFO - Early stopping at epoch 1000. Best Metrics: (0.03151086878917636, 0.006620247568523431, 0.01843067817720198)
2026-06-22 16:30:01,090 - optuna.study.study - INFO - Trial 268 finished with values: [0.03151086878917636, 0.006620247568523431, 0.01843067817720198] and parameters: {'n_layers': 1, 'embedding_dim': 256, 'lr': 0.0018725355385280041, 'lambda_val': 1.3761340713703872e-05, 'batch_size': 2385, 'optimizer': 'Adam'}.
2026-06-22 16:30:33,854 - experiment_functions - INFO - Early stopping at epoch 700. Best Metrics: (0.02875754161657543, 0.0061828975622079075, 0.016320996548083257)
2026-06-22 16:30:34,001 - optuna.study.study - INFO - Trial 269 finished with values: [0.02875754161657543, 0.0061828975622079075, 0.016320996548083257] and parameters: {'n_layers': 1, 'embedding_dim': 96, 'lr': 0.003916255753855854, 'lambda_val': 0.00016605162440270577, 'batch_size': 4013, 'optimizer': 'Adam'}.
2026-06-22 16:31:20,887 - experiment_functions - INFO - Early stopping at epoch 1000. Best Metrics: (0.032102896276252596, 0.0067134015409877484, 0.018622367145636008)
2026-06-22 16:31:21,037 - optuna.study.study - INFO - Trial 270 finished with values: [0.032102896276252596, 0.0067134015409877484, 0.018622367145636008] and parameters: {'n_layers': 1, 'embedding_dim': 128, 'lr': 0.0018725355385280041, 'lambda_val': 0.0001979130594640894, 'batch_size': 2836, 'optimizer': 'Adam'}.
2026-06-22 16:32:29,199 - experiment_functions - INFO - Early stopping at epoch 1600. Best Metrics: (0.033630803315359045, 0.006951812555260832, 0.018796198920838763)
2026-06-22 16:32:29,287 - optuna.study.study - INFO - Trial 271 finished with values: [0.033630803315359045, 0.006951812555260832, 0.018796198920838763] and parameters: {'n_layers': 1, 'embedding_dim': 32, 'lr': 0.0018725355385280041, 'lambda_val': 3.90887208716658e-05, 'batch_size': 1785, 'optimizer': 'Adam'}.
2026-06-22 16:33:16,350 - experiment_functions - INFO - Early stopping at epoch 950. Best Metrics: (0.0005991431797515166, 0.00013578375647341163, 0.0003261986044462086)
2026-06-22 16:33:16,472 - optuna.study.study - INFO - Trial 272 finished with values: [0.0005991431797515166, 0.00013578375647341163, 0.0003261986044462086] and parameters: {'n_layers': 1, 'embedding_dim': 256, 'lr': 1.2654756648598253e-05, 'lambda_val': 1.3761340713703872e-05, 'batch_size': 2675, 'optimizer': 'RMSprop'}.
2026-06-22 16:34:14,870 - experiment_functions - INFO - Early stopping at epoch 1150. Best Metrics: (0.032401321791801774, 0.00675761020588607, 0.018205244268509016)
2026-06-22 16:34:14,969 - optuna.study.study - INFO - Trial 273 finished with values: [0.032401321791801774, 0.00675761020588607, 0.018205244268509016] and parameters: {'n_layers': 1, 'embedding_dim': 256, 'lr': 0.0010694394042823291, 'lambda_val': 5.915966748772391e-06, 'batch_size': 3110, 'optimizer': 'RMSprop'}.
2026-06-22 16:37:11,701 - optuna.study.study - INFO - Trial 274 finished with values: [0.0322210933448905, 0.006855500821018063, 0.018657914361339033] and parameters: {'n_layers': 1, 'embedding_dim': 96, 'lr': 0.0008860102741763749, 'lambda_val': 0.00011379660469282507, 'batch_size': 2674, 'optimizer': 'RMSprop'}.
2026-06-22 16:39:57,747 - optuna.study.study - INFO - Trial 275 finished with values: [0.03320001915096548, 0.006902867247694834, 0.018999175910109443] and parameters: {'n_layers': 1, 'embedding_dim': 32, 'lr': 0.0010694394042823291, 'lambda_val': 0.00016615513360913103, 'batch_size': 2116, 'optimizer': 'Adam'}.
2026-06-22 16:42:06,737 - experiment_functions - INFO - Early stopping at epoch 3050. Best Metrics: (0.028601612780872757, 0.006037640520399141, 0.01626613586690099)
2026-06-22 16:42:06,877 - optuna.study.study - INFO - Trial 276 finished with values: [0.028601612780872757, 0.006037640520399141, 0.01626613586690099] and parameters: {'n_layers': 2, 'embedding_dim': 32, 'lr': 0.0005464989571285408, 'lambda_val': 1.3761340713703872e-05, 'batch_size': 2900, 'optimizer': 'Adam'}.
2026-06-22 16:44:57,739 - optuna.study.study - INFO - Trial 277 finished with values: [0.03192486052253592, 0.006879184034356449, 0.01823773161568946] and parameters: {'n_layers': 1, 'embedding_dim': 64, 'lr': 0.0005652244898304067, 'lambda_val': 0.003148896044074657, 'batch_size': 2900, 'optimizer': 'RMSprop'}.
2026-06-22 16:48:16,362 - optuna.study.study - INFO - Trial 278 finished with values: [0.034181966408559444, 0.007138120500189466, 0.01947223087953934] and parameters: {'n_layers': 1, 'embedding_dim': 256, 'lr': 0.0006685078714927192, 'lambda_val': 7.724967695086265e-05, 'batch_size': 2502, 'optimizer': 'RMSprop'}.
2026-06-22 16:48:40,082 - experiment_functions - INFO - Early stopping at epoch 500. Best Metrics: (0.0005505472547589263, 0.00013262599469496023, 0.0002952483327063883)
2026-06-22 16:48:40,190 - optuna.study.study - INFO - Trial 279 finished with values: [0.0005505472547589263, 0.00013262599469496023, 0.0002952483327063883] and parameters: {'n_layers': 1, 'embedding_dim': 128, 'lr': 0.0005652244898304067, 'lambda_val': 0.0001979130594640894, 'batch_size': 2836, 'optimizer': 'SGD'}.
2026-06-22 16:49:19,862 - experiment_functions - INFO - Early stopping at epoch 900. Best Metrics: (0.029034982129761792, 0.00617816091954023, 0.016613424252776527)
2026-06-22 16:49:19,968 - optuna.study.study - INFO - Trial 280 finished with values: [0.029034982129761792, 0.00617816091954023, 0.016613424252776527] and parameters: {'n_layers': 1, 'embedding_dim': 32, 'lr': 0.0018725355385280041, 'lambda_val': 0.00016081976691657246, 'batch_size': 1891, 'optimizer': 'RMSprop'}.
2026-06-22 16:50:31,381 - experiment_functions - INFO - Early stopping at epoch 1600. Best Metrics: (0.031382624909223306, 0.0065602500947328545, 0.01798705842304043)
2026-06-22 16:50:31,481 - optuna.study.study - INFO - Trial 281 finished with values: [0.031382624909223306, 0.0065602500947328545, 0.01798705842304043] and parameters: {'n_layers': 1, 'embedding_dim': 96, 'lr': 0.0018725355385280041, 'lambda_val': 0.00016081976691657246, 'batch_size': 1891, 'optimizer': 'Adam'}.
2026-06-22 16:51:20,563 - experiment_functions - INFO - Early stopping at epoch 900. Best Metrics: (0.01322637840997896, 0.00278672476948339, 0.007351432557794051)
2026-06-22 16:51:20,665 - optuna.study.study - INFO - Trial 282 finished with values: [0.01322637840997896, 0.00278672476948339, 0.007351432557794051] and parameters: {'n_layers': 4, 'embedding_dim': 128, 'lr': 0.001247135325126933, 'lambda_val': 1.3761340713703872e-05, 'batch_size': 2993, 'optimizer': 'RMSprop'}.
2026-06-22 16:52:00,101 - experiment_functions - INFO - Early stopping at epoch 900. Best Metrics: (0.01058917568766223, 0.0022720095995958068, 0.005867200341322931)
2026-06-22 16:52:00,204 - optuna.study.study - INFO - Trial 283 finished with values: [0.01058917568766223, 0.0022720095995958068, 0.005867200341322931] and parameters: {'n_layers': 2, 'embedding_dim': 32, 'lr': 0.010582517136616284, 'lambda_val': 0.00015679042892799276, 'batch_size': 2836, 'optimizer': 'RMSprop'}.
2026-06-22 16:52:49,119 - experiment_functions - INFO - Early stopping at epoch 950. Best Metrics: (0.03114166635575827, 0.006522356953391436, 0.017861626408046172)
2026-06-22 16:52:49,230 - optuna.study.study - INFO - Trial 284 finished with values: [0.03114166635575827, 0.006522356953391436, 0.017861626408046172] and parameters: {'n_layers': 1, 'embedding_dim': 256, 'lr': 0.0010694394042823291, 'lambda_val': 0.0006718444827658295, 'batch_size': 3537, 'optimizer': 'RMSprop'}.
2026-06-22 16:55:51,779 - experiment_functions - INFO - Early stopping at epoch 3850. Best Metrics: (0.028815210051676813, 0.006214475179992422, 0.01640552874376194)
2026-06-22 16:55:51,851 - optuna.study.study - INFO - Trial 285 finished with values: [0.028815210051676813, 0.006214475179992422, 0.01640552874376194] and parameters: {'n_layers': 2, 'embedding_dim': 128, 'lr': 0.0005652244898304067, 'lambda_val': 0.00023620858897053303, 'batch_size': 1785, 'optimizer': 'Adam'}.
2026-06-22 16:59:09,172 - optuna.study.study - INFO - Trial 286 finished with values: [0.03571228520607573, 0.007381268157130226, 0.02046050107287794] and parameters: {'n_layers': 1, 'embedding_dim': 256, 'lr': 0.0006753032109319728, 'lambda_val': 0.00011379660469282507, 'batch_size': 2836, 'optimizer': 'RMSprop'}.
2026-06-22 17:00:01,150 - experiment_functions - INFO - Early stopping at epoch 1150. Best Metrics: (0.03095617318237582, 0.006579196665403562, 0.01763189702736611)
2026-06-22 17:00:01,233 - optuna.study.study - INFO - Trial 287 finished with values: [0.03095617318237582, 0.006579196665403562, 0.01763189702736611] and parameters: {'n_layers': 1, 'embedding_dim': 96, 'lr': 0.001487817598059853, 'lambda_val': 0.0007109535707376064, 'batch_size': 1785, 'optimizer': 'RMSprop'}.
2026-06-22 17:00:58,332 - experiment_functions - INFO - Early stopping at epoch 1250. Best Metrics: (0.02898552207449927, 0.006272893772893773, 0.016274876022934943)
2026-06-22 17:00:58,489 - optuna.study.study - INFO - Trial 288 finished with values: [0.02898552207449927, 0.006272893772893773, 0.016274876022934943] and parameters: {'n_layers': 1, 'embedding_dim': 128, 'lr': 0.0009993547791746632, 'lambda_val': 0.00287692779327254, 'batch_size': 2836, 'optimizer': 'RMSprop'}.
2026-06-22 17:02:37,400 - experiment_functions - INFO - Early stopping at epoch 2350. Best Metrics: (0.03131392495226977, 0.00654288240495137, 0.017548749916539985)
2026-06-22 17:02:37,481 - optuna.study.study - INFO - Trial 289 finished with values: [0.03131392495226977, 0.00654288240495137, 0.017548749916539985] and parameters: {'n_layers': 1, 'embedding_dim': 32, 'lr': 0.001487817598059853, 'lambda_val': 0.0001979130594640894, 'batch_size': 2836, 'optimizer': 'RMSprop'}.
2026-06-22 17:04:01,934 - experiment_functions - INFO - Early stopping at epoch 1950. Best Metrics: (0.01772438063210094, 0.0036835291145635974, 0.009785023105970967)
2026-06-22 17:04:02,077 - optuna.study.study - INFO - Trial 290 finished with values: [0.01772438063210094, 0.0036835291145635974, 0.009785023105970967] and parameters: {'n_layers': 1, 'embedding_dim': 96, 'lr': 0.003916255753855854, 'lambda_val': 0.0001979130594640894, 'batch_size': 2470, 'optimizer': 'RMSprop'}.
2026-06-22 17:05:03,729 - experiment_functions - INFO - Early stopping at epoch 1100. Best Metrics: (0.02818492960870662, 0.005947644309713276, 0.015887466561058116)
2026-06-22 17:05:03,829 - optuna.study.study - INFO - Trial 291 finished with values: [0.02818492960870662, 0.005947644309713276, 0.015887466561058116] and parameters: {'n_layers': 2, 'embedding_dim': 256, 'lr': 0.0005652244898304067, 'lambda_val': 0.0001979130594640894, 'batch_size': 3240, 'optimizer': 'RMSprop'}.
