2026-06-18 23:07:31,814 - optuna.study.study - INFO - Trial 286 finished with values: [0.026738784888196747, 0.005941328786156373, 0.01529522838426693] and parameters: {'n_layers': 2, 'embedding_dim': 96, 'lr': 0.0005592470013695373, 'lambda_val': 0.0005069195879480929, 'batch_size': 991, 'optimizer': 'Adam'}.
2026-06-18 23:08:22,130 - experiment_functions - INFO - Early stopping at epoch 1100. Best Metrics: (0.030711907532138528, 0.006677087280535556, 0.01807792747488207)
2026-06-18 23:08:22,219 - optuna.study.study - INFO - Trial 287 finished with values: [0.030711907532138528, 0.006677087280535556, 0.01807792747488207] and parameters: {'n_layers': 1, 'embedding_dim': 96, 'lr': 0.0007183006551542105, 'lambda_val': 4.521426485432383e-06, 'batch_size': 2689, 'optimizer': 'RMSprop'}.
2026-06-18 23:09:37,687 - experiment_functions - INFO - Early stopping at epoch 1400. Best Metrics: (0.023769130700243977, 0.00511241631931287, 0.013495097271998675)
2026-06-18 23:09:37,794 - optuna.study.study - INFO - Trial 288 finished with values: [0.023769130700243977, 0.00511241631931287, 0.013495097271998675] and parameters: {'n_layers': 3, 'embedding_dim': 128, 'lr': 0.00036537878836744313, 'lambda_val': 4.735122359256782e-06, 'batch_size': 3516, 'optimizer': 'Adam'}.
2026-06-18 23:12:26,677 - optuna.study.study - INFO - Trial 289 finished with values: [0.0314405382514307, 0.00680497663256284, 0.01816306742743566] and parameters: {'n_layers': 1, 'embedding_dim': 64, 'lr': 0.0010029417148474076, 'lambda_val': 0.00015514348570178205, 'batch_size': 578, 'optimizer': 'Adam'}.
2026-06-18 23:15:29,811 - optuna.study.study - INFO - Trial 290 finished with values: [0.03315110965530077, 0.007114437286851081, 0.01968457581317896] and parameters: {'n_layers': 1, 'embedding_dim': 128, 'lr': 0.0005592470013695373, 'lambda_val': 0.0005069195879480929, 'batch_size': 991, 'optimizer': 'Adam'}.
2026-06-18 23:16:30,321 - experiment_functions - INFO - Early stopping at epoch 1350. Best Metrics: (0.03123356961077209, 0.0066407730200833655, 0.01743358992762947)
2026-06-18 23:16:30,639 - optuna.study.study - INFO - Trial 291 finished with values: [0.03123356961077209, 0.0066407730200833655, 0.01743358992762947] and parameters: {'n_layers': 1, 'embedding_dim': 64, 'lr': 0.0007183006551542105, 'lambda_val': 0.0004145273091173728, 'batch_size': 2689, 'optimizer': 'Adam'}.
2026-06-18 23:16:57,124 - experiment_functions - INFO - Early stopping at epoch 550. Best Metrics: (0.026886262028807045, 0.005655551345206518, 0.01576664153208273)
2026-06-18 23:16:57,219 - optuna.study.study - INFO - Trial 292 finished with values: [0.026886262028807045, 0.005655551345206518, 0.01576664153208273] and parameters: {'n_layers': 1, 'embedding_dim': 32, 'lr': 0.0082956867501665, 'lambda_val': 0.0005943254859344516, 'batch_size': 3516, 'optimizer': 'Adam'}.
2026-06-18 23:17:27,981 - experiment_functions - INFO - Early stopping at epoch 700. Best Metrics: (0.0005097124972999538, 0.00011999494758115448, 0.0002786144301929464)
2026-06-18 23:17:28,070 - optuna.study.study - INFO - Trial 293 finished with values: [0.0005097124972999538, 0.00011999494758115448, 0.0002786144301929464] and parameters: {'n_layers': 1, 'embedding_dim': 64, 'lr': 6.44825869118874e-05, 'lambda_val': 0.00015514348570178205, 'batch_size': 991, 'optimizer': 'Adam'}.
2026-06-18 23:20:41,934 - optuna.study.study - INFO - Trial 294 finished with values: [0.029860958347457313, 0.0065807755462927876, 0.01748693303499263] and parameters: {'n_layers': 1, 'embedding_dim': 256, 'lr': 0.0002184611732352615, 'lambda_val': 0.0016333984694785568, 'batch_size': 3772, 'optimizer': 'RMSprop'}.
2026-06-18 23:21:40,386 - experiment_functions - INFO - Early stopping at epoch 1050. Best Metrics: (0.02176021194041281, 0.004724011620563345, 0.01204506320116306)
2026-06-18 23:21:40,526 - optuna.study.study - INFO - Trial 295 finished with values: [0.02176021194041281, 0.004724011620563345, 0.01204506320116306] and parameters: {'n_layers': 4, 'embedding_dim': 128, 'lr': 0.00039950195617414347, 'lambda_val': 1.1727812158033635e-06, 'batch_size': 2931, 'optimizer': 'RMSprop'}.
2026-06-18 23:23:02,084 - experiment_functions - INFO - Early stopping at epoch 1850. Best Metrics: (0.03345591254416672, 0.007065491979285084, 0.019261003077193226)
2026-06-18 23:23:02,198 - optuna.study.study - INFO - Trial 296 finished with values: [0.03345591254416672, 0.007065491979285084, 0.019261003077193226] and parameters: {'n_layers': 1, 'embedding_dim': 96, 'lr': 0.0007183006551542105, 'lambda_val': 4.521426485432383e-06, 'batch_size': 2689, 'optimizer': 'Adam'}.
2026-06-18 23:25:50,989 - optuna.study.study - INFO - Trial 297 finished with values: [0.030925009402040193, 0.0067939244663382595, 0.018190464279566814] and parameters: {'n_layers': 1, 'embedding_dim': 32, 'lr': 0.0005592470013695373, 'lambda_val': 6.908446782288116e-05, 'batch_size': 2521, 'optimizer': 'Adam'}.
2026-06-18 23:26:27,016 - experiment_functions - INFO - Early stopping at epoch 800. Best Metrics: (0.024961694613590907, 0.005413982569154984, 0.0144971237264968)
2026-06-18 23:26:27,452 - optuna.study.study - INFO - Trial 298 finished with values: [0.024961694613590907, 0.005413982569154984, 0.0144971237264968] and parameters: {'n_layers': 1, 'embedding_dim': 64, 'lr': 0.0018466507240200577, 'lambda_val': 1.2929761938228365e-06, 'batch_size': 1457, 'optimizer': 'RMSprop'}.
2026-06-18 23:27:02,564 - experiment_functions - INFO - Early stopping at epoch 750. Best Metrics: (0.029297259234890644, 0.006179739800429455, 0.01696767335177019)
2026-06-18 23:27:02,666 - optuna.study.study - INFO - Trial 299 finished with values: [0.029297259234890644, 0.006179739800429455, 0.01696767335177019] and parameters: {'n_layers': 1, 'embedding_dim': 96, 'lr': 0.0022436517643766684, 'lambda_val': 5.316198242532503e-06, 'batch_size': 991, 'optimizer': 'Adam'}.
2026-06-18 23:27:02,682 - root - INFO - Selected Trial 229 based on Max ndcg: 0.0198
2026-06-18 23:27:02,682 - root - INFO - Associated Recall: 0.0346
2026-06-18 23:27:02,682 - experiment_functions - INFO - Training the best model ... for e_yelp_1c1dcs
2026-06-18 23:29:32,292 - experiment_functions - INFO - Early stopping at epoch 3250. Best Metrics: (0.03311201089313766, 0.007087596311734242, 0.019456728705796258)
2026-06-18 23:29:37,430 - root - INFO -   **** Training e_yelp_1c1dcs_rand1
2026-06-18 23:29:37,629 - root - INFO -   **** Getting 421521/1274132 random edges
2026-06-18 23:29:38,937 - optuna.storages._rdb.storage - INFO - A new study created in RDB with name: Study_e_yelp_1c1dcs_rand1
2026-06-18 23:30:02,202 - experiment_functions - INFO - Early stopping at epoch 500. Best Metrics: (0.0003847439724786281, 9.473285335354301e-05, 0.0002047928581481309)
2026-06-18 23:30:02,289 - optuna.study.study - INFO - Trial 0 finished with values: [0.0003847439724786281, 9.473285335354301e-05, 0.0002047928581481309] and parameters: {'n_layers': 1, 'embedding_dim': 128, 'lr': 0.022959634202840487, 'lambda_val': 0.04161498719926696, 'batch_size': 1774, 'optimizer': 'SGD'}.
2026-06-18 23:33:05,580 - optuna.study.study - INFO - Trial 1 finished with values: [0.011183327059472977, 0.0024346343311860553, 0.006185317031558489] and parameters: {'n_layers': 2, 'embedding_dim': 128, 'lr': 0.03235246262650783, 'lambda_val': 0.000426873699562592, 'batch_size': 3565, 'optimizer': 'RMSprop'}.
2026-06-18 23:33:33,073 - experiment_functions - INFO - Early stopping at epoch 500. Best Metrics: (0.0005955846802118481, 0.00013420487558418593, 0.0003414189865337911)
2026-06-18 23:33:33,392 - optuna.study.study - INFO - Trial 2 finished with values: [0.0005955846802118481, 0.00013420487558418593, 0.0003414189865337911] and parameters: {'n_layers': 4, 'embedding_dim': 128, 'lr': 0.0001311283366585227, 'lambda_val': 0.02145855541741889, 'batch_size': 4089, 'optimizer': 'SGD'}.
2026-06-18 23:34:01,965 - experiment_functions - INFO - Early stopping at epoch 500. Best Metrics: (0.0005612637659212397, 0.0001231527093596059, 0.0002822525605377862)
2026-06-18 23:34:02,123 - optuna.study.study - INFO - Trial 3 finished with values: [0.0005612637659212397, 0.0001231527093596059, 0.0002822525605377862] and parameters: {'n_layers': 1, 'embedding_dim': 64, 'lr': 6.0791615509435556e-05, 'lambda_val': 2.2336851259886637e-06, 'batch_size': 2381, 'optimizer': 'SGD'}.
2026-06-18 23:35:45,830 - experiment_functions - INFO - Early stopping at epoch 1650. Best Metrics: (0.0004489178299942329, 0.00010578501957812305, 0.00025839932163249297)
2026-06-18 23:35:46,279 - optuna.study.study - INFO - Trial 4 finished with values: [0.0004489178299942329, 0.00010578501957812305, 0.00025839932163249297] and parameters: {'n_layers': 4, 'embedding_dim': 256, 'lr': 1.5237511127107434e-05, 'lambda_val': 1.7665218759719796e-05, 'batch_size': 2649, 'optimizer': 'RMSprop'}.
2026-06-18 23:36:09,297 - experiment_functions - INFO - Early stopping at epoch 500. Best Metrics: (0.000521223039380439, 0.00011841606669192877, 0.00027680794954491785)
2026-06-18 23:36:09,391 - optuna.study.study - INFO - Trial 5 finished with values: [0.000521223039380439, 0.00011841606669192877, 0.00027680794954491785] and parameters: {'n_layers': 2, 'embedding_dim': 32, 'lr': 0.0001662467794171188, 'lambda_val': 0.0026768960376434415, 'batch_size': 1914, 'optimizer': 'RMSprop'}.
2026-06-18 23:36:34,415 - experiment_functions - INFO - Early stopping at epoch 500. Best Metrics: (0.0006425512340639262, 0.00016104585070102312, 0.00040647859366744555)
2026-06-18 23:36:34,516 - optuna.study.study - INFO - Trial 6 finished with values: [0.0006425512340639262, 0.00016104585070102312, 0.00040647859366744555] and parameters: {'n_layers': 3, 'embedding_dim': 96, 'lr': 5.5471572364589736e-05, 'lambda_val': 1.6724277399145698e-05, 'batch_size': 2026, 'optimizer': 'SGD'}.
2026-06-18 23:39:23,386 - optuna.study.study - INFO - Trial 7 finished with values: [0.0017574063564531352, 0.00044366552987242647, 0.0011343221402628897] and parameters: {'n_layers': 2, 'embedding_dim': 64, 'lr': 0.00017008403125042568, 'lambda_val': 0.00011238429460135182, 'batch_size': 1729, 'optimizer': 'RMSprop'}.
2026-06-18 23:39:47,812 - experiment_functions - INFO - Early stopping at epoch 550. Best Metrics: (0.003052157493277674, 0.0008099658961727929, 0.0018937889446992416)
2026-06-18 23:39:47,953 - optuna.study.study - INFO - Trial 8 finished with values: [0.003052157493277674, 0.0008099658961727929, 0.0018937889446992416] and parameters: {'n_layers': 1, 'embedding_dim': 32, 'lr': 0.043196906423782155, 'lambda_val': 0.08876884296492314, 'batch_size': 955, 'optimizer': 'Adam'}.
2026-06-18 23:40:17,282 - experiment_functions - INFO - Early stopping at epoch 650. Best Metrics: (0.013350951212615531, 0.0029082985979537704, 0.007534111112657563)
2026-06-18 23:40:17,698 - optuna.study.study - INFO - Trial 9 finished with values: [0.013350951212615531, 0.0029082985979537704, 0.007534111112657563] and parameters: {'n_layers': 1, 'embedding_dim': 64, 'lr': 0.010267104601915706, 'lambda_val': 0.00010166126397387926, 'batch_size': 1529, 'optimizer': 'RMSprop'}.
2026-06-18 23:40:40,781 - experiment_functions - INFO - Early stopping at epoch 500. Best Metrics: (0.0005367176919444213, 0.00012946823291650877, 0.0002818821489372972)
2026-06-18 23:40:40,872 - optuna.study.study - INFO - Trial 10 finished with values: [0.0005367176919444213, 0.00012946823291650877, 0.0002818821489372972] and parameters: {'n_layers': 4, 'embedding_dim': 32, 'lr': 1.462500950404996e-05, 'lambda_val': 0.025666079393145726, 'batch_size': 3998, 'optimizer': 'SGD'}.
2026-06-18 23:41:07,179 - experiment_functions - INFO - Early stopping at epoch 550. Best Metrics: (0.0004624924748085019, 0.00011683718580270308, 0.0002643676958855279)
2026-06-18 23:41:07,295 - optuna.study.study - INFO - Trial 11 finished with values: [0.0004624924748085019, 0.00011683718580270308, 0.0002643676958855279] and parameters: {'n_layers': 3, 'embedding_dim': 64, 'lr': 4.848767240598227e-05, 'lambda_val': 1.0709524012151848e-05, 'batch_size': 3810, 'optimizer': 'Adam'}.
2026-06-18 23:41:34,385 - experiment_functions - INFO - Early stopping at epoch 600. Best Metrics: (0.00047093386379177973, 0.0001026272577996716, 0.00026420126426751264)
2026-06-18 23:41:34,476 - optuna.study.study - INFO - Trial 12 finished with values: [0.00047093386379177973, 0.0001026272577996716, 0.00026420126426751264] and parameters: {'n_layers': 1, 'embedding_dim': 64, 'lr': 0.00012100124087894171, 'lambda_val': 0.009130605523204964, 'batch_size': 566, 'optimizer': 'Adam'}.
2026-06-18 23:41:58,306 - experiment_functions - INFO - Early stopping at epoch 500. Best Metrics: (0.0004850767293909441, 0.0001026272577996716, 0.0002515520717839675)
2026-06-18 23:41:58,784 - optuna.study.study - INFO - Trial 13 finished with values: [0.0004850767293909441, 0.0001026272577996716, 0.0002515520717839675] and parameters: {'n_layers': 1, 'embedding_dim': 128, 'lr': 0.0006002290799538386, 'lambda_val': 3.2350219650826926e-05, 'batch_size': 913, 'optimizer': 'SGD'}.
2026-06-18 23:42:48,858 - experiment_functions - INFO - Early stopping at epoch 1150. Best Metrics: (0.00967960051941162, 0.002024125299987369, 0.0054026039192128965)
2026-06-18 23:42:49,265 - optuna.study.study - INFO - Trial 14 finished with values: [0.00967960051941162, 0.002024125299987369, 0.0054026039192128965] and parameters: {'n_layers': 3, 'embedding_dim': 32, 'lr': 0.004461668152834184, 'lambda_val': 1.7013643059238403e-06, 'batch_size': 716, 'optimizer': 'Adam'}.
2026-06-18 23:45:45,565 - optuna.study.study - INFO - Trial 15 finished with values: [0.02825179612822869, 0.006023430592396109, 0.016150774690652674] and parameters: {'n_layers': 2, 'embedding_dim': 64, 'lr': 0.00045541062412396616, 'lambda_val': 1.356629670066784e-05, 'batch_size': 2612, 'optimizer': 'RMSprop'}.
2026-06-18 23:46:13,890 - experiment_functions - INFO - Early stopping at epoch 550. Best Metrics: (0.005166513510160643, 0.0012062649993684477, 0.003045758751992988)
2026-06-18 23:46:13,981 - optuna.study.study - INFO - Trial 16 finished with values: [0.005166513510160643, 0.0012062649993684477, 0.003045758751992988] and parameters: {'n_layers': 3, 'embedding_dim': 96, 'lr': 0.0026777259297623827, 'lambda_val': 0.06967843853647833, 'batch_size': 897, 'optimizer': 'RMSprop'}.
2026-06-18 23:48:46,779 - experiment_functions - INFO - Early stopping at epoch 2900. Best Metrics: (0.007410616637665814, 0.0016720348616900342, 0.004010828920861969)
2026-06-18 23:48:46,866 - optuna.study.study - INFO - Trial 17 finished with values: [0.007410616637665814, 0.0016720348616900342, 0.004010828920861969] and parameters: {'n_layers': 4, 'embedding_dim': 128, 'lr': 0.0311226174645876, 'lambda_val': 0.0017861244112865895, 'batch_size': 1262, 'optimizer': 'RMSprop'}.
2026-06-18 23:49:18,987 - experiment_functions - INFO - Early stopping at epoch 650. Best Metrics: (0.0006798619139370814, 0.0001405203991410888, 0.0003266819699952073)
2026-06-18 23:49:19,079 - optuna.study.study - INFO - Trial 18 finished with values: [0.0006798619139370814, 0.0001405203991410888, 0.0003266819699952073] and parameters: {'n_layers': 3, 'embedding_dim': 96, 'lr': 2.400690267276137e-05, 'lambda_val': 5.1628598958852474e-05, 'batch_size': 1135, 'optimizer': 'Adam'}.
2026-06-18 23:49:45,358 - experiment_functions - INFO - Early stopping at epoch 550. Best Metrics: (0.005351628375600773, 0.001304155614500442, 0.0031657557847363997)
2026-06-18 23:49:45,459 - optuna.study.study - INFO - Trial 19 finished with values: [0.005351628375600773, 0.001304155614500442, 0.0031657557847363997] and parameters: {'n_layers': 3, 'embedding_dim': 64, 'lr': 0.004993717730990791, 'lambda_val': 0.02693650295479778, 'batch_size': 695, 'optimizer': 'Adam'}.
2026-06-18 23:50:20,623 - experiment_functions - INFO - Early stopping at epoch 550. Best Metrics: (0.009526550542688582, 0.002148856890236201, 0.005000333804481483)
2026-06-18 23:50:20,712 - optuna.study.study - INFO - Trial 20 finished with values: [0.009526550542688582, 0.002148856890236201, 0.005000333804481483] and parameters: {'n_layers': 3, 'embedding_dim': 256, 'lr': 0.003331201275908329, 'lambda_val': 0.00790150266889716, 'batch_size': 3383, 'optimizer': 'Adam'}.
2026-06-18 23:51:38,854 - experiment_functions - INFO - Early stopping at epoch 1900. Best Metrics: (0.0003742791098589158, 0.00010262725779967159, 0.0002146579004585347)
2026-06-18 23:51:38,958 - optuna.study.study - INFO - Trial 21 finished with values: [0.0003742791098589158, 0.00010262725779967159, 0.0002146579004585347] and parameters: {'n_layers': 1, 'embedding_dim': 64, 'lr': 6.455881010614287e-05, 'lambda_val': 8.727233968162733e-06, 'batch_size': 1182, 'optimizer': 'Adam'}.
2026-06-18 23:54:53,136 - optuna.study.study - INFO - Trial 22 finished with values: [0.010172557805823736, 0.0023541114058355443, 0.00594797468707013] and parameters: {'n_layers': 3, 'embedding_dim': 128, 'lr': 0.00014446581089320301, 'lambda_val': 2.116415642180955e-06, 'batch_size': 2670, 'optimizer': 'Adam'}.
2026-06-18 23:55:18,026 - experiment_functions - INFO - Early stopping at epoch 550. Best Metrics: (0.006740495439807876, 0.0016262473159024883, 0.0038225820657935357)
2026-06-18 23:55:18,146 - optuna.study.study - INFO - Trial 23 finished with values: [0.006740495439807876, 0.0016262473159024883, 0.0038225820657935357] and parameters: {'n_layers': 2, 'embedding_dim': 32, 'lr': 0.003641765311552576, 'lambda_val': 0.01293128846809428, 'batch_size': 2501, 'optimizer': 'RMSprop'}.
2026-06-18 23:55:50,847 - experiment_functions - INFO - Early stopping at epoch 500. Best Metrics: (0.0005507869109893752, 0.00011999494758115447, 0.00031729883048121465)
2026-06-18 23:55:50,939 - optuna.study.study - INFO - Trial 24 finished with values: [0.0005507869109893752, 0.00011999494758115447, 0.00031729883048121465] and parameters: {'n_layers': 4, 'embedding_dim': 256, 'lr': 0.03127470515006413, 'lambda_val': 0.0071286847241327535, 'batch_size': 2413, 'optimizer': 'SGD'}.
2026-06-18 23:57:25,883 - experiment_functions - INFO - Early stopping at epoch 1600. Best Metrics: (0.02483058797825865, 0.005372931666035114, 0.014236499184859322)
2026-06-18 23:57:25,971 - optuna.study.study - INFO - Trial 25 finished with values: [0.02483058797825865, 0.005372931666035114, 0.014236499184859322] and parameters: {'n_layers': 3, 'embedding_dim': 256, 'lr': 0.00041265687808833226, 'lambda_val': 4.824681967841972e-06, 'batch_size': 1707, 'optimizer': 'RMSprop'}.
2026-06-18 23:58:03,166 - experiment_functions - INFO - Early stopping at epoch 550. Best Metrics: (0.008139202989347573, 0.0017130857648099027, 0.004565625359592369)
2026-06-18 23:58:03,307 - optuna.study.study - INFO - Trial 26 finished with values: [0.008139202989347573, 0.0017130857648099027, 0.004565625359592369] and parameters: {'n_layers': 4, 'embedding_dim': 256, 'lr': 0.04465234945162275, 'lambda_val': 1.599550872998235e-05, 'batch_size': 4090, 'optimizer': 'Adam'}.
2026-06-19 00:01:19,912 - optuna.study.study - INFO - Trial 27 finished with values: [0.0005622922570298989, 0.00012946823291650877, 0.000299322326217424] and parameters: {'n_layers': 3, 'embedding_dim': 128, 'lr': 4.16405982737161e-05, 'lambda_val': 6.698342983758873e-06, 'batch_size': 3166, 'optimizer': 'RMSprop'}.
2026-06-19 00:01:43,927 - experiment_functions - INFO - Early stopping at epoch 500. Best Metrics: (0.00045253671908994543, 0.00010420613868889732, 0.00025799430777368636)
2026-06-19 00:01:43,992 - optuna.study.study - INFO - Trial 28 finished with values: [0.00045253671908994543, 0.00010420613868889732, 0.00025799430777368636] and parameters: {'n_layers': 2, 'embedding_dim': 64, 'lr': 0.000504615157221419, 'lambda_val': 0.0292727675046243, 'batch_size': 2889, 'optimizer': 'SGD'}.
2026-06-19 00:02:08,235 - experiment_functions - INFO - Early stopping at epoch 500. Best Metrics: (0.0005020911217569754, 0.00012946823291650877, 0.0002911155029895909)
2026-06-19 00:02:08,342 - optuna.study.study - INFO - Trial 29 finished with values: [0.0005020911217569754, 0.00012946823291650877, 0.0002911155029895909] and parameters: {'n_layers': 3, 'embedding_dim': 64, 'lr': 1.180764623015535e-05, 'lambda_val': 0.015489505723585125, 'batch_size': 3435, 'optimizer': 'RMSprop'}.
2026-06-19 00:02:34,750 - experiment_functions - INFO - Early stopping at epoch 500. Best Metrics: (0.0004726589595029071, 0.00010578501957812305, 0.0002503364485152439)
2026-06-19 00:02:34,855 - optuna.study.study - INFO - Trial 30 finished with values: [0.0004726589595029071, 0.00010578501957812305, 0.0002503364485152439] and parameters: {'n_layers': 1, 'embedding_dim': 256, 'lr': 0.00019134106383634543, 'lambda_val': 4.119375300959622e-05, 'batch_size': 1493, 'optimizer': 'SGD'}.
2026-06-19 00:03:02,712 - experiment_functions - INFO - Early stopping at epoch 550. Best Metrics: (0.010964761330733139, 0.002401477832512315, 0.005992278564561985)
2026-06-19 00:03:02,807 - optuna.study.study - INFO - Trial 31 finished with values: [0.010964761330733139, 0.002401477832512315, 0.005992278564561985] and parameters: {'n_layers': 3, 'embedding_dim': 96, 'lr': 0.00265047718248758, 'lambda_val': 0.0007604153797437305, 'batch_size': 3712, 'optimizer': 'RMSprop'}.
2026-06-19 00:03:29,430 - experiment_functions - INFO - Early stopping at epoch 550. Best Metrics: (0.009171761929586433, 0.0019830743968675003, 0.004763256933705952)
2026-06-19 00:03:29,530 - optuna.study.study - INFO - Trial 32 finished with values: [0.009171761929586433, 0.0019830743968675003, 0.004763256933705952] and parameters: {'n_layers': 2, 'embedding_dim': 96, 'lr': 0.006195805254365598, 'lambda_val': 0.006446182958325827, 'batch_size': 2155, 'optimizer': 'Adam'}.
2026-06-19 00:03:53,007 - experiment_functions - INFO - Early stopping at epoch 500. Best Metrics: (0.0007035493540654007, 0.0001294682329165088, 0.0003471250457957235)
