2026-06-22 22:05:09,939 - optuna.study.study - INFO - Trial 231 finished with values: [0.02484995826719789, 0.00533030188202602, 0.013894051154537752] and parameters: {'n_layers': 3, 'embedding_dim': 256, 'lr': 0.0004235044324291316, 'lambda_val': 5.455116561469672e-06, 'batch_size': 2562, 'optimizer': 'RMSprop'}.
2026-06-22 22:07:00,280 - experiment_functions - INFO - Early stopping at epoch 2550. Best Metrics: (0.026442241868910706, 0.0057297587470001255, 0.015146186161306842)
2026-06-22 22:07:00,643 - optuna.study.study - INFO - Trial 232 finished with values: [0.026442241868910706, 0.0057297587470001255, 0.015146186161306842] and parameters: {'n_layers': 3, 'embedding_dim': 32, 'lr': 0.0004235044324291316, 'lambda_val': 5.455116561469672e-06, 'batch_size': 2714, 'optimizer': 'RMSprop'}.
2026-06-22 22:09:54,809 - optuna.study.study - INFO - Trial 233 finished with values: [0.02691361623445348, 0.005805545029682961, 0.015566977668502523] and parameters: {'n_layers': 2, 'embedding_dim': 64, 'lr': 0.0004235044324291316, 'lambda_val': 0.0008491169466682814, 'batch_size': 1052, 'optimizer': 'RMSprop'}.
2026-06-22 22:13:11,629 - optuna.study.study - INFO - Trial 234 finished with values: [0.02080741553338946, 0.0046734874321081215, 0.011854646479453432] and parameters: {'n_layers': 4, 'embedding_dim': 96, 'lr': 0.0001854947590635186, 'lambda_val': 5.455116561469672e-06, 'batch_size': 2857, 'optimizer': 'RMSprop'}.
2026-06-22 22:13:59,465 - experiment_functions - INFO - Early stopping at epoch 1000. Best Metrics: (0.014609642041176246, 0.0033472274851585196, 0.00827424585585742)
2026-06-22 22:13:59,564 - optuna.study.study - INFO - Trial 235 finished with values: [0.014609642041176246, 0.0033472274851585196, 0.00827424585585742] and parameters: {'n_layers': 4, 'embedding_dim': 64, 'lr': 0.0004235044324291316, 'lambda_val': 0.008897050357742247, 'batch_size': 2562, 'optimizer': 'RMSprop'}.
2026-06-22 22:17:14,331 - optuna.study.study - INFO - Trial 236 finished with values: [0.010430262202559885, 0.002376215738284704, 0.0059477535745355685] and parameters: {'n_layers': 4, 'embedding_dim': 96, 'lr': 0.00010838229314562383, 'lambda_val': 4.027725355425206e-05, 'batch_size': 3133, 'optimizer': 'Adam'}.
2026-06-22 22:17:38,472 - experiment_functions - INFO - Early stopping at epoch 500. Best Metrics: (0.0005972187474484112, 0.00013420487558418593, 0.0003376012549569519)
2026-06-22 22:17:38,891 - optuna.study.study - INFO - Trial 237 finished with values: [0.0005972187474484112, 0.00013420487558418593, 0.0003376012549569519] and parameters: {'n_layers': 2, 'embedding_dim': 96, 'lr': 0.0004235044324291316, 'lambda_val': 0.00020526375005845972, 'batch_size': 1052, 'optimizer': 'SGD'}.
2026-06-22 22:19:37,712 - experiment_functions - INFO - Early stopping at epoch 2750. Best Metrics: (0.01576550494230335, 0.0032777567260325884, 0.0088576432969081)
2026-06-22 22:19:37,823 - optuna.study.study - INFO - Trial 238 finished with values: [0.01576550494230335, 0.0032777567260325884, 0.0088576432969081] and parameters: {'n_layers': 2, 'embedding_dim': 64, 'lr': 0.0019419457389098867, 'lambda_val': 5.455116561469672e-06, 'batch_size': 577, 'optimizer': 'RMSprop'}.
2026-06-22 22:23:57,128 - optuna.study.study - INFO - Trial 239 finished with values: [0.014637197843513122, 0.0032982821775925228, 0.008323226607857885] and parameters: {'n_layers': 4, 'embedding_dim': 256, 'lr': 0.0001854947590635186, 'lambda_val': 0.002013482105642368, 'batch_size': 558, 'optimizer': 'Adam'}.
2026-06-22 22:26:45,759 - optuna.study.study - INFO - Trial 240 finished with values: [0.027428941066990037, 0.005859226979916635, 0.015472340663014457] and parameters: {'n_layers': 2, 'embedding_dim': 32, 'lr': 0.0004235044324291316, 'lambda_val': 3.330662577836562e-06, 'batch_size': 3836, 'optimizer': 'Adam'}.
2026-06-22 22:28:08,930 - experiment_functions - INFO - Early stopping at epoch 1750. Best Metrics: (0.02239218462773054, 0.004798219022356954, 0.012911832942026732)
2026-06-22 22:28:09,033 - optuna.study.study - INFO - Trial 241 finished with values: [0.02239218462773054, 0.004798219022356954, 0.012911832942026732] and parameters: {'n_layers': 4, 'embedding_dim': 64, 'lr': 0.00045681378220125877, 'lambda_val': 5.8421827248860175e-05, 'batch_size': 3133, 'optimizer': 'RMSprop'}.
2026-06-22 22:28:35,986 - experiment_functions - INFO - Early stopping at epoch 600. Best Metrics: (0.0006013447476143016, 0.0001278893520272831, 0.00032100156585760026)
2026-06-22 22:28:36,103 - optuna.study.study - INFO - Trial 242 finished with values: [0.0006013447476143016, 0.0001278893520272831, 0.00032100156585760026] and parameters: {'n_layers': 1, 'embedding_dim': 64, 'lr': 0.0001196656195128372, 'lambda_val': 9.70067663508609e-05, 'batch_size': 3133, 'optimizer': 'Adam'}.
2026-06-22 22:29:18,840 - experiment_functions - INFO - Early stopping at epoch 900. Best Metrics: (0.018919765424860163, 0.0039661487937350005, 0.010590999475415586)
2026-06-22 22:29:18,946 - optuna.study.study - INFO - Trial 243 finished with values: [0.018919765424860163, 0.0039661487937350005, 0.010590999475415586] and parameters: {'n_layers': 2, 'embedding_dim': 96, 'lr': 0.0013675886061108719, 'lambda_val': 0.00012138056522106867, 'batch_size': 2746, 'optimizer': 'RMSprop'}.
2026-06-22 22:31:58,582 - optuna.study.study - INFO - Trial 244 finished with values: [0.0011892259853702293, 0.0002747252747252748, 0.0007387000837496313] and parameters: {'n_layers': 1, 'embedding_dim': 32, 'lr': 0.0004235044324291316, 'lambda_val': 5.455116561469672e-06, 'batch_size': 847, 'optimizer': 'RMSprop'}.
2026-06-22 22:32:23,559 - experiment_functions - INFO - Early stopping at epoch 500. Best Metrics: (0.0004396595211244225, 0.00010104837691044589, 0.00022841619454586366)
2026-06-22 22:32:23,658 - optuna.study.study - INFO - Trial 245 finished with values: [0.0004396595211244225, 0.00010104837691044589, 0.00022841619454586366] and parameters: {'n_layers': 4, 'embedding_dim': 64, 'lr': 0.0024838847566605407, 'lambda_val': 0.05512272268497714, 'batch_size': 3603, 'optimizer': 'SGD'}.
2026-06-22 22:32:50,975 - experiment_functions - INFO - Early stopping at epoch 550. Best Metrics: (0.00042110540562836967, 0.00010104837691044589, 0.0002367880283165243)
2026-06-22 22:32:51,076 - optuna.study.study - INFO - Trial 246 finished with values: [0.00042110540562836967, 0.00010104837691044589, 0.0002367880283165243] and parameters: {'n_layers': 4, 'embedding_dim': 64, 'lr': 1.1343614482136367e-05, 'lambda_val': 3.330662577836562e-06, 'batch_size': 3626, 'optimizer': 'Adam'}.
2026-06-22 22:34:25,510 - experiment_functions - INFO - Early stopping at epoch 1950. Best Metrics: (0.02332801215303736, 0.0050303145130731345, 0.013227490750576033)
2026-06-22 22:34:25,662 - optuna.study.study - INFO - Trial 247 finished with values: [0.02332801215303736, 0.0050303145130731345, 0.013227490750576033] and parameters: {'n_layers': 3, 'embedding_dim': 96, 'lr': 0.00045681378220125877, 'lambda_val': 0.0008491169466682814, 'batch_size': 3133, 'optimizer': 'RMSprop'}.
2026-06-22 22:37:21,522 - optuna.study.study - INFO - Trial 248 finished with values: [0.027443484633604243, 0.005901856763925729, 0.015550007028328722] and parameters: {'n_layers': 2, 'embedding_dim': 64, 'lr': 0.00045681378220125877, 'lambda_val': 0.0005262293458621268, 'batch_size': 3351, 'optimizer': 'RMSprop'}.
2026-06-22 22:38:16,349 - experiment_functions - INFO - Early stopping at epoch 1300. Best Metrics: (0.0005411364628622043, 0.00012946823291650877, 0.0003003658488745613)
2026-06-22 22:38:16,454 - optuna.study.study - INFO - Trial 249 finished with values: [0.0005411364628622043, 0.00012946823291650877, 0.0003003658488745613] and parameters: {'n_layers': 1, 'embedding_dim': 64, 'lr': 1.8034453387005575e-05, 'lambda_val': 3.330662577836562e-06, 'batch_size': 1052, 'optimizer': 'Adam'}.
2026-06-22 22:41:27,852 - optuna.study.study - INFO - Trial 250 finished with values: [0.029437972987525932, 0.006320260199570545, 0.016556861607593367] and parameters: {'n_layers': 2, 'embedding_dim': 128, 'lr': 0.0006129132477888526, 'lambda_val': 0.0008491169466682814, 'batch_size': 1126, 'optimizer': 'Adam'}.
2026-06-22 22:44:20,554 - optuna.study.study - INFO - Trial 251 finished with values: [0.034519107377282886, 0.007172855879752433, 0.02000876747508558] and parameters: {'n_layers': 1, 'embedding_dim': 64, 'lr': 0.001706237377982523, 'lambda_val': 0.0008491169466682814, 'batch_size': 577, 'optimizer': 'Adam'}.
2026-06-22 22:44:46,263 - experiment_functions - INFO - Early stopping at epoch 550. Best Metrics: (0.005327356529632421, 0.0012883668056081848, 0.0030938294439425925)
2026-06-22 22:44:46,364 - optuna.study.study - INFO - Trial 252 finished with values: [0.005327356529632421, 0.0012883668056081848, 0.0030938294439425925] and parameters: {'n_layers': 1, 'embedding_dim': 96, 'lr': 0.03749503523866188, 'lambda_val': 0.0008491169466682814, 'batch_size': 577, 'optimizer': 'RMSprop'}.
2026-06-22 22:45:17,481 - experiment_functions - INFO - Early stopping at epoch 650. Best Metrics: (0.013579685104385815, 0.002865668813944676, 0.007188924946589015)
2026-06-22 22:45:17,634 - optuna.study.study - INFO - Trial 253 finished with values: [0.013579685104385815, 0.002865668813944676, 0.007188924946589015] and parameters: {'n_layers': 3, 'embedding_dim': 64, 'lr': 0.001706237377982523, 'lambda_val': 1.314986245861158e-06, 'batch_size': 3681, 'optimizer': 'RMSprop'}.
2026-06-22 22:46:46,538 - experiment_functions - INFO - Early stopping at epoch 1850. Best Metrics: (0.022093927554467888, 0.004731906025009473, 0.012323419427730558)
2026-06-22 22:46:46,642 - optuna.study.study - INFO - Trial 254 finished with values: [0.022093927554467888, 0.004731906025009473, 0.012323419427730558] and parameters: {'n_layers': 4, 'embedding_dim': 64, 'lr': 0.00045681378220125877, 'lambda_val': 3.330662577836562e-06, 'batch_size': 3133, 'optimizer': 'Adam'}.
2026-06-22 22:49:41,005 - optuna.study.study - INFO - Trial 255 finished with values: [0.025344555623124234, 0.005488189970948592, 0.01445922769994569] and parameters: {'n_layers': 3, 'embedding_dim': 32, 'lr': 0.0004235044324291316, 'lambda_val': 0.0008491169466682814, 'batch_size': 2005, 'optimizer': 'RMSprop'}.
2026-06-22 22:52:15,383 - experiment_functions - INFO - Early stopping at epoch 3550. Best Metrics: (0.024622565616327557, 0.005380826070481243, 0.01401245414448337)
2026-06-22 22:52:15,743 - optuna.study.study - INFO - Trial 256 finished with values: [0.024622565616327557, 0.005380826070481243, 0.01401245414448337] and parameters: {'n_layers': 3, 'embedding_dim': 32, 'lr': 0.00045681378220125877, 'lambda_val': 0.0035581021233396883, 'batch_size': 1291, 'optimizer': 'RMSprop'}.
2026-06-22 22:53:28,185 - experiment_functions - INFO - Early stopping at epoch 1650. Best Metrics: (0.016639184953059386, 0.0036961601616774032, 0.009125737249497164)
2026-06-22 22:53:28,287 - optuna.study.study - INFO - Trial 257 finished with values: [0.016639184953059386, 0.0036961601616774032, 0.009125737249497164] and parameters: {'n_layers': 4, 'embedding_dim': 32, 'lr': 0.0004235044324291316, 'lambda_val': 0.015366869245751369, 'batch_size': 1052, 'optimizer': 'RMSprop'}.
2026-06-22 22:55:55,219 - experiment_functions - INFO - Early stopping at epoch 3400. Best Metrics: (0.023470643947000883, 0.005132941770872805, 0.01309845194367836)
2026-06-22 22:55:55,305 - optuna.study.study - INFO - Trial 258 finished with values: [0.023470643947000883, 0.005132941770872805, 0.01309845194367836] and parameters: {'n_layers': 3, 'embedding_dim': 32, 'lr': 0.00045681378220125877, 'lambda_val': 0.0005262293458621268, 'batch_size': 3603, 'optimizer': 'RMSprop'}.
2026-06-22 22:58:27,698 - experiment_functions - INFO - Early stopping at epoch 3500. Best Metrics: (0.023832562999256856, 0.005052418845522294, 0.013377403949182989)
2026-06-22 22:58:27,818 - optuna.study.study - INFO - Trial 259 finished with values: [0.023832562999256856, 0.005052418845522294, 0.013377403949182989] and parameters: {'n_layers': 4, 'embedding_dim': 32, 'lr': 0.0004235044324291316, 'lambda_val': 0.0008491169466682814, 'batch_size': 2562, 'optimizer': 'RMSprop'}.
2026-06-22 22:59:00,504 - experiment_functions - INFO - Early stopping at epoch 650. Best Metrics: (0.01809117852064196, 0.003918782367058229, 0.010318377930686563)
2026-06-22 22:59:00,597 - optuna.study.study - INFO - Trial 260 finished with values: [0.01809117852064196, 0.003918782367058229, 0.010318377930686563] and parameters: {'n_layers': 4, 'embedding_dim': 64, 'lr': 0.001706237377982523, 'lambda_val': 0.0007796055822838029, 'batch_size': 3937, 'optimizer': 'Adam'}.
2026-06-22 23:00:23,354 - experiment_functions - INFO - Early stopping at epoch 1900. Best Metrics: (0.025119454611351646, 0.00535240621447518, 0.014091816916365707)
2026-06-22 23:00:23,478 - optuna.study.study - INFO - Trial 261 finished with values: [0.025119454611351646, 0.00535240621447518, 0.014091816916365707] and parameters: {'n_layers': 3, 'embedding_dim': 32, 'lr': 0.0006129132477888526, 'lambda_val': 5.455116561469672e-06, 'batch_size': 3133, 'optimizer': 'RMSprop'}.
2026-06-22 23:03:37,188 - optuna.study.study - INFO - Trial 262 finished with values: [0.02913715599156801, 0.006304471390678287, 0.016673621387946033] and parameters: {'n_layers': 2, 'embedding_dim': 128, 'lr': 0.0005347670500185667, 'lambda_val': 0.0008491169466682814, 'batch_size': 1126, 'optimizer': 'Adam'}.
2026-06-22 23:05:36,345 - experiment_functions - INFO - Early stopping at epoch 2600. Best Metrics: (0.028402146699404402, 0.006157635467980296, 0.017040020511346822)
2026-06-22 23:05:36,446 - optuna.study.study - INFO - Trial 263 finished with values: [0.028402146699404402, 0.006157635467980296, 0.017040020511346822] and parameters: {'n_layers': 2, 'embedding_dim': 64, 'lr': 0.00045681378220125877, 'lambda_val': 0.0008491169466682814, 'batch_size': 3133, 'optimizer': 'RMSprop'}.
2026-06-22 23:06:00,506 - experiment_functions - INFO - Early stopping at epoch 500. Best Metrics: (0.00047767421223912204, 0.00011052166224580017, 0.00024812395447489056)
2026-06-22 23:06:00,661 - optuna.study.study - INFO - Trial 264 finished with values: [0.00047767421223912204, 0.00011052166224580017, 0.00024812395447489056] and parameters: {'n_layers': 2, 'embedding_dim': 64, 'lr': 0.00045681378220125877, 'lambda_val': 0.0008491169466682814, 'batch_size': 1989, 'optimizer': 'SGD'}.
2026-06-22 23:08:30,960 - experiment_functions - INFO - Early stopping at epoch 3100. Best Metrics: (0.026065264677118713, 0.005530819754957687, 0.014348822873603709)
2026-06-22 23:08:31,495 - optuna.study.study - INFO - Trial 265 finished with values: [0.026065264677118713, 0.005530819754957687, 0.014348822873603709] and parameters: {'n_layers': 4, 'embedding_dim': 64, 'lr': 0.00045681378220125877, 'lambda_val': 0.00020526375005845972, 'batch_size': 1052, 'optimizer': 'Adam'}.
2026-06-22 23:11:16,208 - optuna.study.study - INFO - Trial 266 finished with values: [0.020662647370358292, 0.0046845395983327025, 0.011978060297447593] and parameters: {'n_layers': 1, 'embedding_dim': 32, 'lr': 0.00045681378220125877, 'lambda_val': 0.0008491169466682814, 'batch_size': 3832, 'optimizer': 'RMSprop'}.
2026-06-22 23:13:55,495 - optuna.study.study - INFO - Trial 267 finished with values: [0.0029865741713561156, 0.0007452317797145383, 0.001854642496983754] and parameters: {'n_layers': 1, 'embedding_dim': 32, 'lr': 0.00045681378220125877, 'lambda_val': 5.455116561469672e-06, 'batch_size': 1126, 'optimizer': 'RMSprop'}.
2026-06-22 23:17:33,623 - optuna.study.study - INFO - Trial 268 finished with values: [0.028669693280652966, 0.006179739800429456, 0.016155110247466582] and parameters: {'n_layers': 2, 'embedding_dim': 256, 'lr': 0.0003610033899772668, 'lambda_val': 0.0006656875066949987, 'batch_size': 1126, 'optimizer': 'RMSprop'}.
2026-06-22 23:20:19,731 - optuna.study.study - INFO - Trial 269 finished with values: [0.031219920695475308, 0.00672761146899078, 0.017765972811465608] and parameters: {'n_layers': 1, 'embedding_dim': 32, 'lr': 0.0009614297416450062, 'lambda_val': 4.438924055955108e-06, 'batch_size': 1126, 'optimizer': 'RMSprop'}.
2026-06-22 23:23:15,548 - optuna.study.study - INFO - Trial 270 finished with values: [0.029124789343326733, 0.006348680055576607, 0.017296403244761796] and parameters: {'n_layers': 2, 'embedding_dim': 64, 'lr': 0.00045681378220125877, 'lambda_val': 3.330662577836562e-06, 'batch_size': 2272, 'optimizer': 'RMSprop'}.
2026-06-22 23:24:03,832 - experiment_functions - INFO - Early stopping at epoch 700. Best Metrics: (0.01782822634178194, 0.0039377289377289385, 0.009914008553483728)
2026-06-22 23:24:04,020 - optuna.study.study - INFO - Trial 271 finished with values: [0.01782822634178194, 0.0039377289377289385, 0.009914008553483728] and parameters: {'n_layers': 4, 'embedding_dim': 256, 'lr': 0.0008573376761049362, 'lambda_val': 0.0008491169466682814, 'batch_size': 2562, 'optimizer': 'Adam'}.
2026-06-22 23:26:26,896 - experiment_functions - INFO - Early stopping at epoch 3100. Best Metrics: (0.028587734730926045, 0.006121321207528105, 0.016055368727734356)
2026-06-22 23:26:26,987 - optuna.study.study - INFO - Trial 272 finished with values: [0.028587734730926045, 0.006121321207528105, 0.016055368727734356] and parameters: {'n_layers': 2, 'embedding_dim': 96, 'lr': 0.00045681378220125877, 'lambda_val': 5.455116561469672e-06, 'batch_size': 4023, 'optimizer': 'RMSprop'}.
2026-06-22 23:26:50,468 - experiment_functions - INFO - Early stopping at epoch 500. Best Metrics: (0.0004738221969472557, 0.00011052166224580018, 0.00024816056561367356)
2026-06-22 23:26:51,024 - optuna.study.study - INFO - Trial 273 finished with values: [0.0004738221969472557, 0.00011052166224580018, 0.00024816056561367356] and parameters: {'n_layers': 2, 'embedding_dim': 64, 'lr': 0.0024593680412654663, 'lambda_val': 0.008507655043799656, 'batch_size': 2857, 'optimizer': 'SGD'}.
2026-06-22 23:27:26,785 - experiment_functions - INFO - Early stopping at epoch 700. Best Metrics: (0.021240710827763146, 0.0044682329165087785, 0.011922410132486986)
2026-06-22 23:27:26,878 - optuna.study.study - INFO - Trial 274 finished with values: [0.021240710827763146, 0.0044682329165087785, 0.011922410132486986] and parameters: {'n_layers': 3, 'embedding_dim': 96, 'lr': 0.001708223431901108, 'lambda_val': 1.6065050233275445e-05, 'batch_size': 2404, 'optimizer': 'Adam'}.
2026-06-22 23:30:19,680 - experiment_functions - INFO - Early stopping at epoch 3450. Best Metrics: (0.02620060530987213, 0.005625552608311229, 0.015172783781192184)
2026-06-22 23:30:19,790 - optuna.study.study - INFO - Trial 275 finished with values: [0.02620060530987213, 0.005625552608311229, 0.015172783781192184] and parameters: {'n_layers': 3, 'embedding_dim': 128, 'lr': 0.0004235044324291316, 'lambda_val': 5.455116561469672e-06, 'batch_size': 558, 'optimizer': 'RMSprop'}.
2026-06-22 23:31:19,073 - experiment_functions - INFO - Early stopping at epoch 1300. Best Metrics: (0.013406209724280482, 0.0028719843375015794, 0.00761802590963775)
2026-06-22 23:31:19,221 - optuna.study.study - INFO - Trial 276 finished with values: [0.013406209724280482, 0.0028719843375015794, 0.00761802590963775] and parameters: {'n_layers': 2, 'embedding_dim': 64, 'lr': 0.0024593680412654663, 'lambda_val': 3.330662577836562e-06, 'batch_size': 1126, 'optimizer': 'RMSprop'}.
2026-06-22 23:32:34,590 - experiment_functions - INFO - Early stopping at epoch 1750. Best Metrics: (0.028323517978222464, 0.006225527346217002, 0.01649601190974978)
2026-06-22 23:32:34,698 - optuna.study.study - INFO - Trial 277 finished with values: [0.028323517978222464, 0.006225527346217002, 0.01649601190974978] and parameters: {'n_layers': 1, 'embedding_dim': 32, 'lr': 0.001706237377982523, 'lambda_val': 0.0008491169466682814, 'batch_size': 577, 'optimizer': 'RMSprop'}.
2026-06-22 23:33:38,415 - experiment_functions - INFO - Early stopping at epoch 1400. Best Metrics: (0.028066729162572412, 0.0060865858279651385, 0.015905752046231084)
2026-06-22 23:33:38,543 - optuna.study.study - INFO - Trial 278 finished with values: [0.028066729162572412, 0.0060865858279651385, 0.015905752046231084] and parameters: {'n_layers': 1, 'embedding_dim': 96, 'lr': 0.0009614297416450062, 'lambda_val': 0.0046163834117656215, 'batch_size': 2413, 'optimizer': 'RMSprop'}.
2026-06-22 23:36:05,513 - experiment_functions - INFO - Early stopping at epoch 3100. Best Metrics: (0.02442229805125447, 0.005284514336238475, 0.014077761197755126)
2026-06-22 23:36:05,621 - optuna.study.study - INFO - Trial 279 finished with values: [0.02442229805125447, 0.005284514336238475, 0.014077761197755126] and parameters: {'n_layers': 4, 'embedding_dim': 64, 'lr': 0.0004235044324291316, 'lambda_val': 1.314986245861158e-06, 'batch_size': 558, 'optimizer': 'RMSprop'}.
2026-06-22 23:38:58,518 - experiment_functions - INFO - Early stopping at epoch 3650. Best Metrics: (0.024177499296497835, 0.005211885815334091, 0.013659154155744353)
2026-06-22 23:38:58,611 - optuna.study.study - INFO - Trial 280 finished with values: [0.024177499296497835, 0.005211885815334091, 0.013659154155744353] and parameters: {'n_layers': 4, 'embedding_dim': 64, 'lr': 0.0004235044324291316, 'lambda_val': 0.0009845738939914046, 'batch_size': 1052, 'optimizer': 'Adam'}.
2026-06-22 23:42:11,141 - optuna.study.study - INFO - Trial 281 finished with values: [0.02648623768298054, 0.005770809650119996, 0.01520588725005174] and parameters: {'n_layers': 3, 'embedding_dim': 96, 'lr': 0.00045681378220125877, 'lambda_val': 0.0006656875066949987, 'batch_size': 558, 'optimizer': 'RMSprop'}.
2026-06-22 23:45:17,297 - optuna.study.study - INFO - Trial 282 finished with values: [0.02821094061191357, 0.006018693949728433, 0.016049311032013264] and parameters: {'n_layers': 2, 'embedding_dim': 96, 'lr': 0.00045681378220125877, 'lambda_val': 0.0008491169466682814, 'batch_size': 2891, 'optimizer': 'Adam'}.
