2026-06-22 11:23:10,666 - optuna.study.study - INFO - Trial 49 finished with values: [0.021048766543688473, 0.004474548440065681, 0.011710318836807466] and parameters: {'n_layers': 2, 'embedding_dim': 96, 'lr': 0.004316399830411133, 'lambda_val': 0.00011379660469282507, 'batch_size': 2550, 'optimizer': 'Adam'}.
2026-06-22 11:23:36,571 - experiment_functions - INFO - Early stopping at epoch 500. Best Metrics: (0.0005264811579604248, 0.00011367942402425162, 0.0002679422228786645)
2026-06-22 11:23:36,700 - optuna.study.study - INFO - Trial 50 finished with values: [0.0005264811579604248, 0.00011367942402425162, 0.0002679422228786645] and parameters: {'n_layers': 1, 'embedding_dim': 256, 'lr': 2.1019426934466156e-05, 'lambda_val': 0.05083032350615391, 'batch_size': 1950, 'optimizer': 'RMSprop'}.
2026-06-22 11:24:08,618 - experiment_functions - INFO - Early stopping at epoch 550. Best Metrics: (0.006248631997669585, 0.0013909940634078564, 0.003528966471239313)
2026-06-22 11:24:08,687 - optuna.study.study - INFO - Trial 51 finished with values: [0.006248631997669585, 0.0013909940634078564, 0.003528966471239313] and parameters: {'n_layers': 2, 'embedding_dim': 256, 'lr': 0.011398535339603428, 'lambda_val': 0.01010441170406253, 'batch_size': 1404, 'optimizer': 'Adam'}.
2026-06-22 11:26:20,212 - experiment_functions - INFO - Early stopping at epoch 2700. Best Metrics: (0.005131075992517016, 0.001059429076670456, 0.0027909713560964277)
2026-06-22 11:26:20,290 - optuna.study.study - INFO - Trial 52 finished with values: [0.005131075992517016, 0.001059429076670456, 0.0027909713560964277] and parameters: {'n_layers': 3, 'embedding_dim': 128, 'lr': 0.05270695589589436, 'lambda_val': 0.01010441170406253, 'batch_size': 3167, 'optimizer': 'RMSprop'}.
2026-06-22 11:26:43,557 - experiment_functions - INFO - Early stopping at epoch 500. Best Metrics: (0.0005879527361425432, 0.0001310471138057345, 0.00029962343920152183)
2026-06-22 11:26:43,643 - optuna.study.study - INFO - Trial 53 finished with values: [0.0005879527361425432, 0.0001310471138057345, 0.00029962343920152183] and parameters: {'n_layers': 1, 'embedding_dim': 128, 'lr': 0.00018380672173173005, 'lambda_val': 4.780089926877052e-06, 'batch_size': 2836, 'optimizer': 'SGD'}.
2026-06-22 11:27:07,072 - experiment_functions - INFO - Early stopping at epoch 500. Best Metrics: (0.0005616222815177696, 0.00012473159024883163, 0.0002955423141232453)
2026-06-22 11:27:07,155 - optuna.study.study - INFO - Trial 54 finished with values: [0.0005616222815177696, 0.00012473159024883163, 0.0002955423141232453] and parameters: {'n_layers': 1, 'embedding_dim': 128, 'lr': 0.00027595922398828136, 'lambda_val': 6.0509933989483335e-05, 'batch_size': 2900, 'optimizer': 'SGD'}.
2026-06-22 11:27:38,558 - experiment_functions - INFO - Early stopping at epoch 650. Best Metrics: (0.009384821225147517, 0.002052545155993432, 0.005286648012627148)
2026-06-22 11:27:38,657 - optuna.study.study - INFO - Trial 55 finished with values: [0.009384821225147517, 0.002052545155993432, 0.005286648012627148] and parameters: {'n_layers': 4, 'embedding_dim': 64, 'lr': 0.028670085288056313, 'lambda_val': 7.937877230100435e-06, 'batch_size': 2290, 'optimizer': 'RMSprop'}.
2026-06-22 11:28:09,146 - experiment_functions - INFO - Early stopping at epoch 550. Best Metrics: (0.005591790270103436, 0.0013152077807250223, 0.0033216789373858393)
2026-06-22 11:28:09,230 - optuna.study.study - INFO - Trial 56 finished with values: [0.005591790270103436, 0.0013152077807250223, 0.0033216789373858393] and parameters: {'n_layers': 4, 'embedding_dim': 128, 'lr': 0.003154552172712802, 'lambda_val': 0.01010441170406253, 'batch_size': 1357, 'optimizer': 'Adam'}.
2026-06-22 11:28:36,751 - experiment_functions - INFO - Early stopping at epoch 550. Best Metrics: (0.003577558185171605, 0.000775230516609827, 0.0019738588482630685)
2026-06-22 11:28:36,884 - optuna.study.study - INFO - Trial 57 finished with values: [0.003577558185171605, 0.000775230516609827, 0.0019738588482630685] and parameters: {'n_layers': 3, 'embedding_dim': 96, 'lr': 0.08253849269939219, 'lambda_val': 0.00011379660469282507, 'batch_size': 1887, 'optimizer': 'RMSprop'}.
2026-06-22 11:29:34,937 - experiment_functions - INFO - Early stopping at epoch 1350. Best Metrics: (0.003552345506691776, 0.0008162814197296956, 0.0019434878037370435)
2026-06-22 11:29:35,025 - optuna.study.study - INFO - Trial 58 finished with values: [0.003552345506691776, 0.0008162814197296956, 0.0019434878037370435] and parameters: {'n_layers': 2, 'embedding_dim': 64, 'lr': 0.02423791313291444, 'lambda_val': 0.03570221203084909, 'batch_size': 2290, 'optimizer': 'RMSprop'}.
2026-06-22 11:30:00,113 - experiment_functions - INFO - Early stopping at epoch 500. Best Metrics: (0.0005832417838368663, 0.00013420487558418596, 0.0003437225331231184)
2026-06-22 11:30:00,202 - optuna.study.study - INFO - Trial 59 finished with values: [0.0005832417838368663, 0.00013420487558418596, 0.0003437225331231184] and parameters: {'n_layers': 1, 'embedding_dim': 256, 'lr': 0.00018380672173173005, 'lambda_val': 0.00016615513360913103, 'batch_size': 823, 'optimizer': 'SGD'}.
2026-06-22 11:30:24,635 - experiment_functions - INFO - Early stopping at epoch 550. Best Metrics: (0.003241169557891163, 0.0007515473032714414, 0.0018187535813204377)
2026-06-22 11:30:24,710 - optuna.study.study - INFO - Trial 60 finished with values: [0.003241169557891163, 0.0007515473032714414, 0.0018187535813204377] and parameters: {'n_layers': 2, 'embedding_dim': 32, 'lr': 0.011398535339603428, 'lambda_val': 0.038774820121888605, 'batch_size': 2234, 'optimizer': 'Adam'}.
2026-06-22 11:30:58,524 - experiment_functions - INFO - Early stopping at epoch 500. Best Metrics: (0.00044414936802923834, 0.00010262725779967159, 0.00024054506725163058)
2026-06-22 11:30:58,620 - optuna.study.study - INFO - Trial 61 finished with values: [0.00044414936802923834, 0.00010262725779967159, 0.00024054506725163058] and parameters: {'n_layers': 4, 'embedding_dim': 256, 'lr': 0.0010694394042823291, 'lambda_val': 3.90887208716658e-05, 'batch_size': 1785, 'optimizer': 'SGD'}.
2026-06-22 11:31:55,346 - experiment_functions - INFO - Early stopping at epoch 850. Best Metrics: (0.011501994975492893, 0.0024693697107490216, 0.00629073703738935)
2026-06-22 11:31:55,424 - optuna.study.study - INFO - Trial 62 finished with values: [0.011501994975492893, 0.0024693697107490216, 0.00629073703738935] and parameters: {'n_layers': 4, 'embedding_dim': 256, 'lr': 0.0009993547791746632, 'lambda_val': 0.0002411343501283795, 'batch_size': 2030, 'optimizer': 'RMSprop'}.
2026-06-22 11:32:19,041 - experiment_functions - INFO - Early stopping at epoch 500. Best Metrics: (0.000365241408112669, 9.631173424276874e-05, 0.00022177545573968697)
2026-06-22 11:32:19,132 - optuna.study.study - INFO - Trial 63 finished with values: [0.000365241408112669, 9.631173424276874e-05, 0.00022177545573968697] and parameters: {'n_layers': 3, 'embedding_dim': 64, 'lr': 0.0785928281370131, 'lambda_val': 0.0012071186810298108, 'batch_size': 1501, 'optimizer': 'SGD'}.
2026-06-22 11:35:01,614 - optuna.study.study - INFO - Trial 64 finished with values: [0.02661051500834738, 0.005860805860805862, 0.015511902557013459] and parameters: {'n_layers': 1, 'embedding_dim': 32, 'lr': 0.0005652244898304067, 'lambda_val': 1.3761340713703872e-05, 'batch_size': 2900, 'optimizer': 'RMSprop'}.
2026-06-22 11:35:32,992 - experiment_functions - INFO - Early stopping at epoch 500. Best Metrics: (0.0006341263177696285, 0.00011210054313502591, 0.00034203409050696267)
2026-06-22 11:35:33,083 - optuna.study.study - INFO - Trial 65 finished with values: [0.0006341263177696285, 0.00011210054313502591, 0.00034203409050696267] and parameters: {'n_layers': 3, 'embedding_dim': 256, 'lr': 0.00018380672173173005, 'lambda_val': 0.03570221203084909, 'batch_size': 2836, 'optimizer': 'Adam'}.
2026-06-22 11:36:03,387 - experiment_functions - INFO - Early stopping at epoch 650. Best Metrics: (0.0244238890230697, 0.005196097006441835, 0.013806665705239803)
2026-06-22 11:36:03,468 - optuna.study.study - INFO - Trial 66 finished with values: [0.0244238890230697, 0.005196097006441835, 0.013806665705239803] and parameters: {'n_layers': 2, 'embedding_dim': 64, 'lr': 0.0030078366574997767, 'lambda_val': 0.00023620858897053303, 'batch_size': 2558, 'optimizer': 'Adam'}.
2026-06-22 11:36:29,161 - experiment_functions - INFO - Early stopping at epoch 500. Best Metrics: (0.0006637113983585378, 0.0001389415182518631, 0.0003686190191959184)
2026-06-22 11:36:29,247 - optuna.study.study - INFO - Trial 67 finished with values: [0.0006637113983585378, 0.0001389415182518631, 0.0003686190191959184] and parameters: {'n_layers': 1, 'embedding_dim': 256, 'lr': 0.0002943349509482643, 'lambda_val': 0.03570221203084909, 'batch_size': 2242, 'optimizer': 'RMSprop'}.
2026-06-22 11:36:52,161 - experiment_functions - INFO - Early stopping at epoch 500. Best Metrics: (0.0004990669884176629, 0.00010104837691044589, 0.0002666191879083456)
2026-06-22 11:36:52,251 - optuna.study.study - INFO - Trial 68 finished with values: [0.0004990669884176629, 0.00010104837691044589, 0.0002666191879083456] and parameters: {'n_layers': 2, 'embedding_dim': 64, 'lr': 0.0006753032109319728, 'lambda_val': 5.915966748772391e-06, 'batch_size': 2674, 'optimizer': 'SGD'}.
2026-06-22 11:37:19,714 - experiment_functions - INFO - Early stopping at epoch 550. Best Metrics: (0.0029989448263322963, 0.0006426045219148668, 0.0018519646976119476)
2026-06-22 11:37:19,793 - optuna.study.study - INFO - Trial 69 finished with values: [0.0029989448263322963, 0.0006426045219148668, 0.0018519646976119476] and parameters: {'n_layers': 3, 'embedding_dim': 96, 'lr': 0.029615604839337218, 'lambda_val': 0.025896814563439525, 'batch_size': 1950, 'optimizer': 'RMSprop'}.
2026-06-22 11:38:30,175 - experiment_functions - INFO - Early stopping at epoch 1300. Best Metrics: (0.003611828089127704, 0.0008810155361879501, 0.002205994927290011)
2026-06-22 11:38:30,257 - optuna.study.study - INFO - Trial 70 finished with values: [0.003611828089127704, 0.0008810155361879501, 0.002205994927290011] and parameters: {'n_layers': 2, 'embedding_dim': 256, 'lr': 0.0044144587991830535, 'lambda_val': 0.03570221203084909, 'batch_size': 2402, 'optimizer': 'RMSprop'}.
2026-06-22 11:38:57,103 - experiment_functions - INFO - Early stopping at epoch 550. Best Metrics: (0.0005169592187201251, 0.0001231527093596059, 0.0002818352314214191)
2026-06-22 11:38:57,204 - optuna.study.study - INFO - Trial 71 finished with values: [0.0005169592187201251, 0.0001231527093596059, 0.0002818352314214191] and parameters: {'n_layers': 4, 'embedding_dim': 64, 'lr': 2.1405932534392546e-05, 'lambda_val': 1.5980539146025577e-06, 'batch_size': 1465, 'optimizer': 'Adam'}.
2026-06-22 11:41:44,272 - optuna.study.study - INFO - Trial 72 finished with values: [0.028962024358353555, 0.0062792092964506765, 0.016910708358409136] and parameters: {'n_layers': 2, 'embedding_dim': 32, 'lr': 0.0005652244898304067, 'lambda_val': 1.3761340713703872e-05, 'batch_size': 862, 'optimizer': 'RMSprop'}.
2026-06-22 11:42:09,141 - experiment_functions - INFO - Early stopping at epoch 500. Best Metrics: (0.0005946533406226666, 0.00014367816091954025, 0.000320120298442964)
2026-06-22 11:42:09,218 - optuna.study.study - INFO - Trial 73 finished with values: [0.0005946533406226666, 0.00014367816091954025, 0.000320120298442964] and parameters: {'n_layers': 4, 'embedding_dim': 64, 'lr': 0.03830114470687615, 'lambda_val': 1.1815444740310357e-06, 'batch_size': 1364, 'optimizer': 'SGD'}.
2026-06-22 11:42:55,407 - experiment_functions - INFO - Early stopping at epoch 950. Best Metrics: (0.009716761157304953, 0.0020714917266641403, 0.005569231291675952)
2026-06-22 11:42:55,500 - optuna.study.study - INFO - Trial 74 finished with values: [0.009716761157304953, 0.0020714917266641403, 0.005569231291675952] and parameters: {'n_layers': 3, 'embedding_dim': 96, 'lr': 0.0030078366574997767, 'lambda_val': 3.154143842771189e-05, 'batch_size': 2558, 'optimizer': 'RMSprop'}.
2026-06-22 11:43:42,220 - experiment_functions - INFO - Early stopping at epoch 1000. Best Metrics: (0.021472265289930285, 0.0046245421245421255, 0.01153448213868193)
2026-06-22 11:43:42,299 - optuna.study.study - INFO - Trial 75 finished with values: [0.021472265289930285, 0.0046245421245421255, 0.01153448213868193] and parameters: {'n_layers': 2, 'embedding_dim': 96, 'lr': 0.0014581466250124255, 'lambda_val': 0.0015291691045797489, 'batch_size': 602, 'optimizer': 'Adam'}.
2026-06-22 11:44:24,494 - experiment_functions - INFO - Early stopping at epoch 900. Best Metrics: (0.017024043146556388, 0.0038729948212706837, 0.009317679069581454)
2026-06-22 11:44:24,579 - optuna.study.study - INFO - Trial 76 finished with values: [0.017024043146556388, 0.0038729948212706837, 0.009317679069581454] and parameters: {'n_layers': 3, 'embedding_dim': 64, 'lr': 0.0005464989571285408, 'lambda_val': 0.01010441170406253, 'batch_size': 2618, 'optimizer': 'RMSprop'}.
2026-06-22 11:46:49,725 - experiment_functions - INFO - Early stopping at epoch 3050. Best Metrics: (0.0006593466871759439, 0.0001610458507010231, 0.00036941405399166757)
2026-06-22 11:46:49,810 - optuna.study.study - INFO - Trial 77 finished with values: [0.0006593466871759439, 0.0001610458507010231, 0.00036941405399166757] and parameters: {'n_layers': 1, 'embedding_dim': 256, 'lr': 0.00013651672920024816, 'lambda_val': 3.113943166258193e-06, 'batch_size': 2511, 'optimizer': 'Adam'}.
2026-06-22 11:49:45,831 - optuna.study.study - INFO - Trial 78 finished with values: [0.023693755671517974, 0.005224516862447896, 0.01396339584473629] and parameters: {'n_layers': 1, 'embedding_dim': 128, 'lr': 0.00044111771543226783, 'lambda_val': 2.436573270088667e-06, 'batch_size': 3195, 'optimizer': 'Adam'}.
2026-06-22 11:50:13,752 - experiment_functions - INFO - Early stopping at epoch 600. Best Metrics: (0.02149465509296078, 0.004701907288114185, 0.012343987319045966)
2026-06-22 11:50:13,833 - optuna.study.study - INFO - Trial 79 finished with values: [0.02149465509296078, 0.004701907288114185, 0.012343987319045966] and parameters: {'n_layers': 2, 'embedding_dim': 64, 'lr': 0.003916255753855854, 'lambda_val': 1.5025857759055767e-06, 'batch_size': 2235, 'optimizer': 'Adam'}.
2026-06-22 11:50:39,310 - experiment_functions - INFO - Early stopping at epoch 500. Best Metrics: (0.0005095652383737809, 0.00011999494758115448, 0.00029347956775932764)
2026-06-22 11:50:39,412 - optuna.study.study - INFO - Trial 80 finished with values: [0.0005095652383737809, 0.00011999494758115448, 0.00029347956775932764] and parameters: {'n_layers': 1, 'embedding_dim': 256, 'lr': 0.0014581466250124255, 'lambda_val': 7.5466090941165204e-06, 'batch_size': 3315, 'optimizer': 'SGD'}.
2026-06-22 11:51:22,382 - experiment_functions - INFO - Early stopping at epoch 750. Best Metrics: (0.026316132696136346, 0.005587659466969812, 0.01500719703702416)
2026-06-22 11:51:22,471 - optuna.study.study - INFO - Trial 81 finished with values: [0.026316132696136346, 0.005587659466969812, 0.01500719703702416] and parameters: {'n_layers': 2, 'embedding_dim': 256, 'lr': 0.001487817598059853, 'lambda_val': 5.5504078777122543e-05, 'batch_size': 2550, 'optimizer': 'Adam'}.
2026-06-22 11:51:53,412 - experiment_functions - INFO - Early stopping at epoch 500. Best Metrics: (0.0005021550576211432, 0.00010104837691044589, 0.00023862849175809375)
2026-06-22 11:51:53,502 - optuna.study.study - INFO - Trial 82 finished with values: [0.0005021550576211432, 0.00010104837691044589, 0.00023862849175809375] and parameters: {'n_layers': 3, 'embedding_dim': 256, 'lr': 0.00022617967523292067, 'lambda_val': 9.728739357295898e-05, 'batch_size': 1080, 'optimizer': 'SGD'}.
2026-06-22 11:54:15,929 - experiment_functions - INFO - Early stopping at epoch 3200. Best Metrics: (0.010383812697513503, 0.002134646962233169, 0.005454776374065565)
2026-06-22 11:54:16,012 - optuna.study.study - INFO - Trial 83 finished with values: [0.010383812697513503, 0.002134646962233169, 0.005454776374065565] and parameters: {'n_layers': 2, 'embedding_dim': 96, 'lr': 0.004316399830411133, 'lambda_val': 0.00011379660469282507, 'batch_size': 862, 'optimizer': 'Adam'}.
2026-06-22 11:54:40,075 - experiment_functions - INFO - Early stopping at epoch 500. Best Metrics: (0.0005221416974610063, 0.00012631047113805733, 0.0003300196305183495)
2026-06-22 11:54:40,198 - optuna.study.study - INFO - Trial 84 finished with values: [0.0005221416974610063, 0.00012631047113805733, 0.0003300196305183495] and parameters: {'n_layers': 2, 'embedding_dim': 96, 'lr': 0.006109863200640325, 'lambda_val': 3.154143842771189e-05, 'batch_size': 3886, 'optimizer': 'SGD'}.
2026-06-22 11:55:33,594 - experiment_functions - INFO - Early stopping at epoch 1250. Best Metrics: (0.014659674806309399, 0.0031246052797776936, 0.008370897773767759)
2026-06-22 11:55:33,686 - optuna.study.study - INFO - Trial 85 finished with values: [0.014659674806309399, 0.0031246052797776936, 0.008370897773767759] and parameters: {'n_layers': 1, 'embedding_dim': 64, 'lr': 0.00819304475662435, 'lambda_val': 0.0003069591356068849, 'batch_size': 575, 'optimizer': 'RMSprop'}.
2026-06-22 11:56:08,650 - experiment_functions - INFO - Early stopping at epoch 800. Best Metrics: (0.012031142205181956, 0.0025056839712012126, 0.006794075583798133)
2026-06-22 11:56:08,742 - optuna.study.study - INFO - Trial 86 finished with values: [0.012031142205181956, 0.0025056839712012126, 0.006794075583798133] and parameters: {'n_layers': 1, 'embedding_dim': 64, 'lr': 0.012496828920097607, 'lambda_val': 7.724967695086265e-05, 'batch_size': 2900, 'optimizer': 'RMSprop'}.
2026-06-22 11:56:49,526 - experiment_functions - INFO - Early stopping at epoch 850. Best Metrics: (0.0004040171975818835, 9.789061513199444e-05, 0.00021727434127348633)
2026-06-22 11:56:49,592 - optuna.study.study - INFO - Trial 87 finished with values: [0.0004040171975818835, 9.789061513199444e-05, 0.00021727434127348633] and parameters: {'n_layers': 3, 'embedding_dim': 96, 'lr': 1.620991145410387e-05, 'lambda_val': 0.002300370848452134, 'batch_size': 958, 'optimizer': 'RMSprop'}.
2026-06-22 11:57:21,704 - experiment_functions - INFO - Early stopping at epoch 700. Best Metrics: (0.008728993330934253, 0.001779398762157383, 0.004710568204996071)
2026-06-22 11:57:21,849 - optuna.study.study - INFO - Trial 88 finished with values: [0.008728993330934253, 0.001779398762157383, 0.004710568204996071] and parameters: {'n_layers': 2, 'embedding_dim': 64, 'lr': 0.023133657480706095, 'lambda_val': 5.915966748772391e-06, 'batch_size': 2674, 'optimizer': 'Adam'}.
2026-06-22 12:00:11,169 - optuna.study.study - INFO - Trial 89 finished with values: [0.0008033510186088648, 0.0001799924213717317, 0.0004677627984304712] and parameters: {'n_layers': 1, 'embedding_dim': 128, 'lr': 0.00021227352786332772, 'lambda_val': 0.0019833934915702706, 'batch_size': 1499, 'optimizer': 'RMSprop'}.
2026-06-22 12:02:18,347 - experiment_functions - INFO - Early stopping at epoch 2600. Best Metrics: (0.017763042763173222, 0.0037593153972464315, 0.010081813674472983)
2026-06-22 12:02:18,422 - optuna.study.study - INFO - Trial 90 finished with values: [0.017763042763173222, 0.0037593153972464315, 0.010081813674472983] and parameters: {'n_layers': 1, 'embedding_dim': 256, 'lr': 0.008091829333064989, 'lambda_val': 5.915966748772391e-06, 'batch_size': 2674, 'optimizer': 'RMSprop'}.
2026-06-22 12:02:40,874 - experiment_functions - INFO - Early stopping at epoch 500. Best Metrics: (0.0006609088039977717, 0.00016262473159024885, 0.00037930243367979003)
2026-06-22 12:02:40,957 - optuna.study.study - INFO - Trial 91 finished with values: [0.0006609088039977717, 0.00016262473159024885, 0.00037930243367979003] and parameters: {'n_layers': 2, 'embedding_dim': 32, 'lr': 0.0037496935269389748, 'lambda_val': 0.0002411343501283795, 'batch_size': 3980, 'optimizer': 'SGD'}.
2026-06-22 12:03:23,812 - experiment_functions - INFO - Early stopping at epoch 750. Best Metrics: (0.02594163206222336, 0.0056129215611974235, 0.014989356658515187)
2026-06-22 12:03:23,885 - optuna.study.study - INFO - Trial 92 finished with values: [0.02594163206222336, 0.0056129215611974235, 0.014989356658515187] and parameters: {'n_layers': 2, 'embedding_dim': 256, 'lr': 0.001487817598059853, 'lambda_val': 0.00016643563527193303, 'batch_size': 2550, 'optimizer': 'Adam'}.
2026-06-22 12:04:16,479 - experiment_functions - INFO - Early stopping at epoch 1200. Best Metrics: (0.0036024382213819786, 0.00082575470506505, 0.001956847960194539)
2026-06-22 12:04:16,565 - optuna.study.study - INFO - Trial 93 finished with values: [0.0036024382213819786, 0.00082575470506505, 0.001956847960194539] and parameters: {'n_layers': 2, 'embedding_dim': 64, 'lr': 0.011398535339603428, 'lambda_val': 0.038774820121888605, 'batch_size': 2716, 'optimizer': 'Adam'}.
2026-06-22 12:05:13,781 - experiment_functions - INFO - Early stopping at epoch 1300. Best Metrics: (0.017462404930616526, 0.003693002399898952, 0.009777462061864623)
2026-06-22 12:05:13,861 - optuna.study.study - INFO - Trial 94 finished with values: [0.017462404930616526, 0.003693002399898952, 0.009777462061864623] and parameters: {'n_layers': 1, 'embedding_dim': 96, 'lr': 0.004316399830411133, 'lambda_val': 0.00011379660469282507, 'batch_size': 2116, 'optimizer': 'RMSprop'}.
2026-06-22 12:08:05,625 - optuna.study.study - INFO - Trial 95 finished with values: [0.02353957725234779, 0.005276619931792345, 0.013783919910845115] and parameters: {'n_layers': 1, 'embedding_dim': 96, 'lr': 0.0004673948260611741, 'lambda_val': 0.0007109535707376064, 'batch_size': 3039, 'optimizer': 'Adam'}.
2026-06-22 12:09:07,312 - experiment_functions - INFO - Early stopping at epoch 1400. Best Metrics: (0.0005390504663379123, 0.00014367816091954025, 0.0002968556516423786)
