2026-06-20 12:21:33,689 - optuna.study.study - INFO - Trial 123 finished with values: [0.011775186750529472, 0.002583049134773273, 0.006448275295341214] and parameters: {'n_layers': 2, 'embedding_dim': 128, 'lr': 0.006719843485367568, 'lambda_val': 5.090598517742677e-05, 'batch_size': 1783, 'optimizer': 'Adam'}.
2026-06-20 12:22:16,388 - experiment_functions - INFO - Early stopping at epoch 900. Best Metrics: (0.010438926614095827, 0.002096753820891752, 0.005609669024036155)
2026-06-20 12:22:16,699 - optuna.study.study - INFO - Trial 124 finished with values: [0.010438926614095827, 0.002096753820891752, 0.005609669024036155] and parameters: {'n_layers': 2, 'embedding_dim': 128, 'lr': 0.011820223547800823, 'lambda_val': 4.703980448589771e-06, 'batch_size': 1731, 'optimizer': 'Adam'}.
2026-06-20 12:25:16,192 - experiment_functions - INFO - Early stopping at epoch 2900. Best Metrics: (0.015591669780631388, 0.003569849690539346, 0.008555783186033691)
2026-06-20 12:25:16,262 - optuna.study.study - INFO - Trial 125 finished with values: [0.015591669780631388, 0.003569849690539346, 0.008555783186033691] and parameters: {'n_layers': 4, 'embedding_dim': 256, 'lr': 0.00018526976069552334, 'lambda_val': 0.011822413068431218, 'batch_size': 2012, 'optimizer': 'RMSprop'}.
2026-06-20 12:25:41,327 - experiment_functions - INFO - Early stopping at epoch 550. Best Metrics: (0.005623296761649618, 0.0011967917140330935, 0.003204358553724645)
2026-06-20 12:25:41,406 - optuna.study.study - INFO - Trial 126 finished with values: [0.005623296761649618, 0.0011967917140330935, 0.003204358553724645] and parameters: {'n_layers': 2, 'embedding_dim': 64, 'lr': 0.0792409029052576, 'lambda_val': 4.703980448589771e-06, 'batch_size': 1183, 'optimizer': 'Adam'}.
2026-06-20 12:26:46,213 - experiment_functions - INFO - Early stopping at epoch 1450. Best Metrics: (0.029750754642514792, 0.006414993052924088, 0.017112337781932448)
2026-06-20 12:26:46,320 - optuna.study.study - INFO - Trial 127 finished with values: [0.029750754642514792, 0.006414993052924088, 0.017112337781932448] and parameters: {'n_layers': 1, 'embedding_dim': 128, 'lr': 0.0015403750227822883, 'lambda_val': 0.002980377292701446, 'batch_size': 1287, 'optimizer': 'Adam'}.
2026-06-20 12:27:15,695 - experiment_functions - INFO - Early stopping at epoch 650. Best Metrics: (0.027318597440894342, 0.0058292282430213475, 0.015672067983391203)
2026-06-20 12:27:15,787 - optuna.study.study - INFO - Trial 128 finished with values: [0.027318597440894342, 0.0058292282430213475, 0.015672067983391203] and parameters: {'n_layers': 1, 'embedding_dim': 64, 'lr': 0.006719843485367568, 'lambda_val': 3.0549894793457165e-06, 'batch_size': 2449, 'optimizer': 'Adam'}.
2026-06-20 12:27:57,852 - experiment_functions - INFO - Early stopping at epoch 850. Best Metrics: (0.012830556992312295, 0.002704622963243653, 0.007040432141969322)
2026-06-20 12:27:57,924 - optuna.study.study - INFO - Trial 129 finished with values: [0.012830556992312295, 0.002704622963243653, 0.007040432141969322] and parameters: {'n_layers': 4, 'embedding_dim': 96, 'lr': 0.0009942243415015796, 'lambda_val': 0.0014313382121311877, 'batch_size': 1643, 'optimizer': 'RMSprop'}.
2026-06-20 12:28:22,502 - experiment_functions - INFO - Early stopping at epoch 500. Best Metrics: (0.0038897933461947416, 0.000764178350385247, 0.0021282746248914796)
2026-06-20 12:28:22,594 - optuna.study.study - INFO - Trial 130 finished with values: [0.0038897933461947416, 0.000764178350385247, 0.0021282746248914796] and parameters: {'n_layers': 2, 'embedding_dim': 128, 'lr': 0.0323373638515788, 'lambda_val': 0.0614554022089744, 'batch_size': 1183, 'optimizer': 'RMSprop'}.
2026-06-20 12:28:47,454 - experiment_functions - INFO - Early stopping at epoch 550. Best Metrics: (0.010102724926685751, 0.0021709612226853605, 0.005550330578511523)
2026-06-20 12:28:47,531 - optuna.study.study - INFO - Trial 131 finished with values: [0.010102724926685751, 0.0021709612226853605, 0.005550330578511523] and parameters: {'n_layers': 3, 'embedding_dim': 32, 'lr': 0.004124348483373258, 'lambda_val': 1.4891573500580198e-05, 'batch_size': 3714, 'optimizer': 'RMSprop'}.
2026-06-20 12:29:43,994 - experiment_functions - INFO - Early stopping at epoch 1200. Best Metrics: (0.025239129055814026, 0.0054360869016041435, 0.014339838366543053)
2026-06-20 12:29:44,087 - optuna.study.study - INFO - Trial 132 finished with values: [0.025239129055814026, 0.0054360869016041435, 0.014339838366543053] and parameters: {'n_layers': 2, 'embedding_dim': 128, 'lr': 0.0009942243415015796, 'lambda_val': 0.0025257501120737125, 'batch_size': 1271, 'optimizer': 'Adam'}.
2026-06-20 12:32:31,874 - optuna.study.study - INFO - Trial 133 finished with values: [0.023433891262902934, 0.005079259820639131, 0.013375764523957445] and parameters: {'n_layers': 3, 'embedding_dim': 32, 'lr': 0.0003197162451785445, 'lambda_val': 2.3871418678853867e-05, 'batch_size': 3025, 'optimizer': 'Adam'}.
2026-06-20 12:32:57,323 - experiment_functions - INFO - Early stopping at epoch 500. Best Metrics: (0.0004827593858998329, 0.00011999494758115448, 0.0002601832056089247)
2026-06-20 12:32:57,400 - optuna.study.study - INFO - Trial 134 finished with values: [0.0004827593858998329, 0.00011999494758115448, 0.0002601832056089247] and parameters: {'n_layers': 1, 'embedding_dim': 256, 'lr': 0.00023729211693529712, 'lambda_val': 0.025733691733705995, 'batch_size': 2088, 'optimizer': 'Adam'}.
2026-06-20 12:33:20,804 - experiment_functions - INFO - Early stopping at epoch 500. Best Metrics: (0.0004942298030248237, 0.00010104837691044589, 0.0002636881764327757)
2026-06-20 12:33:20,883 - optuna.study.study - INFO - Trial 135 finished with values: [0.0004942298030248237, 0.00010104837691044589, 0.0002636881764327757] and parameters: {'n_layers': 3, 'embedding_dim': 64, 'lr': 0.0011923995314400816, 'lambda_val': 2.085376662769769e-05, 'batch_size': 2177, 'optimizer': 'SGD'}.
2026-06-20 12:33:47,953 - experiment_functions - INFO - Early stopping at epoch 600. Best Metrics: (0.005363883035598113, 0.001266262473159025, 0.0028199382108566253)
2026-06-20 12:33:48,045 - optuna.study.study - INFO - Trial 136 finished with values: [0.005363883035598113, 0.001266262473159025, 0.0028199382108566253] and parameters: {'n_layers': 2, 'embedding_dim': 64, 'lr': 0.005214780908192409, 'lambda_val': 0.09128514885217996, 'batch_size': 3472, 'optimizer': 'Adam'}.
2026-06-20 12:34:32,120 - experiment_functions - INFO - Early stopping at epoch 950. Best Metrics: (0.027932890996206813, 0.005867121384362765, 0.016033567338506288)
2026-06-20 12:34:32,204 - optuna.study.study - INFO - Trial 137 finished with values: [0.027932890996206813, 0.005867121384362765, 0.016033567338506288] and parameters: {'n_layers': 2, 'embedding_dim': 96, 'lr': 0.0013536067835738764, 'lambda_val': 4.703980448589771e-06, 'batch_size': 1731, 'optimizer': 'Adam'}.
2026-06-20 12:35:09,770 - experiment_functions - INFO - Early stopping at epoch 800. Best Metrics: (0.008614376902674251, 0.002063597322218012, 0.004747059019574489)
2026-06-20 12:35:09,848 - optuna.study.study - INFO - Trial 138 finished with values: [0.008614376902674251, 0.002063597322218012, 0.004747059019574489] and parameters: {'n_layers': 4, 'embedding_dim': 64, 'lr': 0.0009798834021344095, 'lambda_val': 0.0496742676050425, 'batch_size': 2606, 'optimizer': 'Adam'}.
2026-06-20 12:36:15,293 - experiment_functions - INFO - Early stopping at epoch 1350. Best Metrics: (0.017478776327649628, 0.0036898446381205, 0.009662408272244488)
2026-06-20 12:36:15,397 - optuna.study.study - INFO - Trial 139 finished with values: [0.017478776327649628, 0.0036898446381205, 0.009662408272244488] and parameters: {'n_layers': 1, 'embedding_dim': 256, 'lr': 0.004124348483373258, 'lambda_val': 1.4891573500580198e-05, 'batch_size': 1271, 'optimizer': 'RMSprop'}.
2026-06-20 12:37:11,581 - experiment_functions - INFO - Early stopping at epoch 950. Best Metrics: (0.016137732293115117, 0.00344669698117974, 0.008825836092967615)
2026-06-20 12:37:11,665 - optuna.study.study - INFO - Trial 140 finished with values: [0.016137732293115117, 0.00344669698117974, 0.008825836092967615] and parameters: {'n_layers': 3, 'embedding_dim': 256, 'lr': 0.0009942243415015796, 'lambda_val': 1.4891573500580198e-05, 'batch_size': 2177, 'optimizer': 'RMSprop'}.
2026-06-20 12:37:38,162 - experiment_functions - INFO - Early stopping at epoch 550. Best Metrics: (0.008457896727587675, 0.0017572944297082227, 0.004691893018837054)
2026-06-20 12:37:38,258 - optuna.study.study - INFO - Trial 141 finished with values: [0.008457896727587675, 0.0017572944297082227, 0.004691893018837054] and parameters: {'n_layers': 2, 'embedding_dim': 96, 'lr': 0.0323373638515788, 'lambda_val': 5.090598517742677e-05, 'batch_size': 2364, 'optimizer': 'Adam'}.
2026-06-20 12:38:44,781 - experiment_functions - INFO - Early stopping at epoch 1450. Best Metrics: (0.011644028222366794, 0.002341480358721738, 0.006414455748000981)
2026-06-20 12:38:44,853 - optuna.study.study - INFO - Trial 142 finished with values: [0.011644028222366794, 0.002341480358721738, 0.006414455748000981] and parameters: {'n_layers': 4, 'embedding_dim': 64, 'lr': 0.011820223547800823, 'lambda_val': 1.4082392887906815e-06, 'batch_size': 2606, 'optimizer': 'RMSprop'}.
2026-06-20 12:39:11,904 - experiment_functions - INFO - Early stopping at epoch 600. Best Metrics: (0.016179367254965465, 0.003418277125173677, 0.00894566197025021)
2026-06-20 12:39:11,987 - optuna.study.study - INFO - Trial 143 finished with values: [0.016179367254965465, 0.003418277125173677, 0.00894566197025021] and parameters: {'n_layers': 3, 'embedding_dim': 32, 'lr': 0.005214780908192409, 'lambda_val': 6.722156885538233e-06, 'batch_size': 2266, 'optimizer': 'Adam'}.
2026-06-20 12:40:10,012 - experiment_functions - INFO - Early stopping at epoch 1200. Best Metrics: (0.003652412191574387, 0.0007989137299482127, 0.00189239476167527)
2026-06-20 12:40:10,102 - optuna.study.study - INFO - Trial 144 finished with values: [0.003652412191574387, 0.0007989137299482127, 0.00189239476167527] and parameters: {'n_layers': 4, 'embedding_dim': 96, 'lr': 0.0014257575686740206, 'lambda_val': 0.025733691733705995, 'batch_size': 782, 'optimizer': 'Adam'}.
2026-06-20 12:40:52,113 - experiment_functions - INFO - Early stopping at epoch 900. Best Metrics: (0.00843691571361374, 0.0017620310723758998, 0.004719561672958974)
2026-06-20 12:40:52,189 - optuna.study.study - INFO - Trial 145 finished with values: [0.00843691571361374, 0.0017620310723758998, 0.004719561672958974] and parameters: {'n_layers': 4, 'embedding_dim': 64, 'lr': 0.011820223547800823, 'lambda_val': 1.4891573500580198e-05, 'batch_size': 1731, 'optimizer': 'Adam'}.
2026-06-20 12:41:40,087 - experiment_functions - INFO - Early stopping at epoch 1100. Best Metrics: (0.012858633207147106, 0.002750410509031199, 0.007156469404587407)
2026-06-20 12:41:40,183 - optuna.study.study - INFO - Trial 146 finished with values: [0.012858633207147106, 0.002750410509031199, 0.007156469404587407] and parameters: {'n_layers': 1, 'embedding_dim': 96, 'lr': 0.011820223547800823, 'lambda_val': 5.090598517742677e-05, 'batch_size': 1320, 'optimizer': 'RMSprop'}.
2026-06-20 12:42:27,635 - experiment_functions - INFO - Early stopping at epoch 800. Best Metrics: (0.012629733454170768, 0.0028751420992800306, 0.006872877644704617)
2026-06-20 12:42:27,709 - optuna.study.study - INFO - Trial 147 finished with values: [0.012629733454170768, 0.0028751420992800306, 0.006872877644704617] and parameters: {'n_layers': 3, 'embedding_dim': 256, 'lr': 0.0009241097994190195, 'lambda_val': 0.012086938131077505, 'batch_size': 1380, 'optimizer': 'Adam'}.
2026-06-20 12:42:54,915 - experiment_functions - INFO - Early stopping at epoch 500. Best Metrics: (0.00048225702073056184, 0.00010420613868889733, 0.00026441227073868744)
2026-06-20 12:42:54,999 - optuna.study.study - INFO - Trial 148 finished with values: [0.00048225702073056184, 0.00010420613868889733, 0.00026441227073868744] and parameters: {'n_layers': 2, 'embedding_dim': 256, 'lr': 0.0003197162451785445, 'lambda_val': 0.005967642770254264, 'batch_size': 1320, 'optimizer': 'SGD'}.
2026-06-20 12:43:28,434 - experiment_functions - INFO - Early stopping at epoch 800. Best Metrics: (0.004543004561043136, 0.0010357458633320701, 0.002232328705841433)
2026-06-20 12:43:28,529 - optuna.study.study - INFO - Trial 149 finished with values: [0.004543004561043136, 0.0010357458633320701, 0.002232328705841433] and parameters: {'n_layers': 1, 'embedding_dim': 32, 'lr': 0.005214780908192409, 'lambda_val': 0.09128514885217996, 'batch_size': 1183, 'optimizer': 'Adam'}.
2026-06-20 12:44:11,280 - experiment_functions - INFO - Early stopping at epoch 900. Best Metrics: (0.01366944240361323, 0.0028956675508399646, 0.007835321254900302)
2026-06-20 12:44:11,358 - optuna.study.study - INFO - Trial 150 finished with values: [0.01366944240361323, 0.0028956675508399646, 0.007835321254900302] and parameters: {'n_layers': 2, 'embedding_dim': 128, 'lr': 0.012491701393910511, 'lambda_val': 4.703980448589771e-06, 'batch_size': 1731, 'optimizer': 'RMSprop'}.
2026-06-20 12:47:20,990 - optuna.study.study - INFO - Trial 151 finished with values: [0.01630368276694973, 0.003708791208791209, 0.009153501914906433] and parameters: {'n_layers': 4, 'embedding_dim': 96, 'lr': 0.00018526976069552334, 'lambda_val': 0.011822413068431218, 'batch_size': 2500, 'optimizer': 'Adam'}.
2026-06-20 12:49:48,336 - experiment_functions - INFO - Early stopping at epoch 3500. Best Metrics: (0.023046389810393374, 0.004984526967285589, 0.013184847593195725)
2026-06-20 12:49:48,417 - optuna.study.study - INFO - Trial 152 finished with values: [0.023046389810393374, 0.004984526967285589, 0.013184847593195725] and parameters: {'n_layers': 3, 'embedding_dim': 32, 'lr': 0.00046312276480803076, 'lambda_val': 0.0014313382121311877, 'batch_size': 3287, 'optimizer': 'Adam'}.
2026-06-20 12:52:45,384 - optuna.study.study - INFO - Trial 153 finished with values: [0.02787530190304069, 0.005879752431476569, 0.015976671872318954] and parameters: {'n_layers': 3, 'embedding_dim': 64, 'lr': 0.00040210644242369826, 'lambda_val': 1.4891573500580198e-05, 'batch_size': 2177, 'optimizer': 'Adam'}.
2026-06-20 12:53:09,326 - experiment_functions - INFO - Early stopping at epoch 500. Best Metrics: (0.0004723342916227347, 0.00011525830491347732, 0.0002836044134984582)
2026-06-20 12:53:09,404 - optuna.study.study - INFO - Trial 154 finished with values: [0.0004723342916227347, 0.00011525830491347732, 0.0002836044134984582] and parameters: {'n_layers': 4, 'embedding_dim': 64, 'lr': 0.0012029727538128135, 'lambda_val': 0.0004242504250406823, 'batch_size': 1854, 'optimizer': 'SGD'}.
2026-06-20 12:53:31,963 - experiment_functions - INFO - Early stopping at epoch 500. Best Metrics: (0.0005753122286565717, 0.00011525830491347733, 0.0003171662024141922)
2026-06-20 12:53:32,088 - optuna.study.study - INFO - Trial 155 finished with values: [0.0005753122286565717, 0.00011525830491347733, 0.0003171662024141922] and parameters: {'n_layers': 1, 'embedding_dim': 96, 'lr': 0.012491701393910511, 'lambda_val': 2.151196071407805e-06, 'batch_size': 1388, 'optimizer': 'SGD'}.
2026-06-20 12:54:23,794 - experiment_functions - INFO - Early stopping at epoch 800. Best Metrics: (0.016517533406075532, 0.0035224832638625744, 0.008906682197026295)
2026-06-20 12:54:23,878 - optuna.study.study - INFO - Trial 156 finished with values: [0.016517533406075532, 0.0035224832638625744, 0.008906682197026295] and parameters: {'n_layers': 4, 'embedding_dim': 256, 'lr': 0.0009798834021344095, 'lambda_val': 5.848323299602918e-05, 'batch_size': 1183, 'optimizer': 'Adam'}.
2026-06-20 12:55:04,891 - experiment_functions - INFO - Early stopping at epoch 950. Best Metrics: (0.02178226869527586, 0.0047619047619047615, 0.012183996623369397)
2026-06-20 12:55:05,226 - optuna.study.study - INFO - Trial 157 finished with values: [0.02178226869527586, 0.0047619047619047615, 0.012183996623369397] and parameters: {'n_layers': 2, 'embedding_dim': 32, 'lr': 0.0009241097994190195, 'lambda_val': 0.012086938131077505, 'batch_size': 3872, 'optimizer': 'Adam'}.
2026-06-20 12:57:39,367 - experiment_functions - INFO - Early stopping at epoch 3700. Best Metrics: (0.023391447407402413, 0.0050650498926361, 0.013200077413899742)
2026-06-20 12:57:39,452 - optuna.study.study - INFO - Trial 158 finished with values: [0.023391447407402413, 0.0050650498926361, 0.013200077413899742] and parameters: {'n_layers': 3, 'embedding_dim': 32, 'lr': 0.00040210644242369826, 'lambda_val': 0.0032201101504106306, 'batch_size': 2009, 'optimizer': 'Adam'}.
2026-06-20 12:58:20,116 - experiment_functions - INFO - Early stopping at epoch 800. Best Metrics: (0.022305382585813112, 0.0048692686623721115, 0.012600199959463213)
2026-06-20 12:58:20,218 - optuna.study.study - INFO - Trial 159 finished with values: [0.022305382585813112, 0.0048692686623721115, 0.012600199959463213] and parameters: {'n_layers': 3, 'embedding_dim': 128, 'lr': 0.0009942243415015796, 'lambda_val': 2.3871418678853867e-05, 'batch_size': 3025, 'optimizer': 'Adam'}.
2026-06-20 12:58:48,116 - experiment_functions - INFO - Early stopping at epoch 600. Best Metrics: (0.007258442283584445, 0.0015299355816597196, 0.0039763463050393084)
2026-06-20 12:58:48,270 - optuna.study.study - INFO - Trial 160 finished with values: [0.007258442283584445, 0.0015299355816597196, 0.0039763463050393084] and parameters: {'n_layers': 3, 'embedding_dim': 64, 'lr': 0.04416896741450844, 'lambda_val': 1.4891573500580198e-05, 'batch_size': 2734, 'optimizer': 'Adam'}.
2026-06-20 12:59:29,100 - experiment_functions - INFO - Early stopping at epoch 850. Best Metrics: (0.015810757493489345, 0.0035982695465454086, 0.009118288094228806)
2026-06-20 12:59:30,330 - optuna.study.study - INFO - Trial 161 finished with values: [0.015810757493489345, 0.0035982695465454086, 0.009118288094228806] and parameters: {'n_layers': 3, 'embedding_dim': 96, 'lr': 0.0009241097994190195, 'lambda_val': 0.012086938131077505, 'batch_size': 1643, 'optimizer': 'Adam'}.
2026-06-20 13:00:01,250 - experiment_functions - INFO - Early stopping at epoch 700. Best Metrics: (0.010873582530909372, 0.002245168624478969, 0.005908567453235921)
2026-06-20 13:00:01,421 - optuna.study.study - INFO - Trial 162 finished with values: [0.010873582530909372, 0.002245168624478969, 0.005908567453235921] and parameters: {'n_layers': 3, 'embedding_dim': 32, 'lr': 0.005214780908192409, 'lambda_val': 6.722156885538233e-06, 'batch_size': 2266, 'optimizer': 'RMSprop'}.
2026-06-20 13:02:51,197 - optuna.study.study - INFO - Trial 163 finished with values: [0.024421806994038873, 0.0052308323860048, 0.014027444985174295] and parameters: {'n_layers': 4, 'embedding_dim': 32, 'lr': 0.00046312276480803076, 'lambda_val': 1.636740944551486e-06, 'batch_size': 2012, 'optimizer': 'Adam'}.
2026-06-20 13:03:28,563 - experiment_functions - INFO - Early stopping at epoch 700. Best Metrics: (0.019584966373981643, 0.00417298219022357, 0.010936243558079569)
2026-06-20 13:03:28,646 - optuna.study.study - INFO - Trial 164 finished with values: [0.019584966373981643, 0.00417298219022357, 0.010936243558079569] and parameters: {'n_layers': 4, 'embedding_dim': 128, 'lr': 0.0012029727538128135, 'lambda_val': 0.0004242504250406823, 'batch_size': 3439, 'optimizer': 'Adam'}.
2026-06-20 13:03:52,860 - experiment_functions - INFO - Early stopping at epoch 500. Best Metrics: (0.00042379770999656096, 0.0001231527093596059, 0.00026231116394260525)
2026-06-20 13:03:52,961 - optuna.study.study - INFO - Trial 165 finished with values: [0.00042379770999656096, 0.0001231527093596059, 0.00026231116394260525] and parameters: {'n_layers': 2, 'embedding_dim': 128, 'lr': 0.0003197162451785445, 'lambda_val': 1.4891573500580198e-05, 'batch_size': 2177, 'optimizer': 'SGD'}.
2026-06-20 13:04:25,635 - experiment_functions - INFO - Early stopping at epoch 650. Best Metrics: (0.010767685969468454, 0.0023872679045092837, 0.006574799219639983)
2026-06-20 13:04:25,710 - optuna.study.study - INFO - Trial 166 finished with values: [0.010767685969468454, 0.0023872679045092837, 0.006574799219639983] and parameters: {'n_layers': 1, 'embedding_dim': 256, 'lr': 0.016420702974770683, 'lambda_val': 1.4891573500580198e-05, 'batch_size': 1271, 'optimizer': 'RMSprop'}.
2026-06-20 13:06:35,164 - experiment_functions - INFO - Early stopping at epoch 2900. Best Metrics: (0.033795528081165295, 0.006888657319691803, 0.01919682956139057)
2026-06-20 13:06:35,234 - optuna.study.study - INFO - Trial 167 finished with values: [0.033795528081165295, 0.006888657319691803, 0.01919682956139057] and parameters: {'n_layers': 1, 'embedding_dim': 128, 'lr': 0.0015403750227822883, 'lambda_val': 2.085376662769769e-05, 'batch_size': 2177, 'optimizer': 'Adam'}.
2026-06-20 13:06:57,948 - experiment_functions - INFO - Early stopping at epoch 500. Best Metrics: (0.0007412108760677368, 0.0001578880889225717, 0.00040207160055534275)
2026-06-20 13:06:58,033 - optuna.study.study - INFO - Trial 168 finished with values: [0.0007412108760677368, 0.0001578880889225717, 0.00040207160055534275] and parameters: {'n_layers': 3, 'embedding_dim': 32, 'lr': 0.0015403750227822883, 'lambda_val': 0.0029328011150185937, 'batch_size': 3025, 'optimizer': 'SGD'}.
2026-06-20 13:07:33,477 - experiment_functions - INFO - Early stopping at epoch 750. Best Metrics: (0.02284993054021757, 0.004880320828596691, 0.012638286945219788)
2026-06-20 13:07:33,534 - optuna.study.study - INFO - Trial 169 finished with values: [0.02284993054021757, 0.004880320828596691, 0.012638286945219788] and parameters: {'n_layers': 3, 'embedding_dim': 64, 'lr': 0.0015403750227822883, 'lambda_val': 2.085376662769769e-05, 'batch_size': 2009, 'optimizer': 'Adam'}.
