2026-06-23 02:04:03,324 - optuna.study.study - INFO - Trial 122 finished with values: [0.01091945476949937, 0.0022656940760389034, 0.005890306664249249] and parameters: {'n_layers': 4, 'embedding_dim': 96, 'lr': 0.006886874303334524, 'lambda_val': 1.105038231556551e-05, 'batch_size': 2436, 'optimizer': 'RMSprop'}.
2026-06-23 02:07:10,784 - experiment_functions - INFO - Early stopping at epoch 2850. Best Metrics: (0.024342894064556392, 0.005325565239358342, 0.014163947353856638)
2026-06-23 02:07:10,872 - optuna.study.study - INFO - Trial 123 finished with values: [0.024342894064556392, 0.005325565239358342, 0.014163947353856638] and parameters: {'n_layers': 4, 'embedding_dim': 256, 'lr': 0.000267777720544778, 'lambda_val': 0.0005196802788376184, 'batch_size': 922, 'optimizer': 'RMSprop'}.
2026-06-23 02:08:20,728 - experiment_functions - INFO - Early stopping at epoch 1650. Best Metrics: (0.02652611258307023, 0.005912908930150311, 0.015042224458438112)
2026-06-23 02:08:20,822 - optuna.study.study - INFO - Trial 124 finished with values: [0.02652611258307023, 0.005912908930150311, 0.015042224458438112] and parameters: {'n_layers': 1, 'embedding_dim': 32, 'lr': 0.0008639986019635256, 'lambda_val': 0.018126568573406728, 'batch_size': 2754, 'optimizer': 'Adam'}.
2026-06-23 02:09:39,802 - experiment_functions - INFO - Early stopping at epoch 1950. Best Metrics: (0.0006331931135531597, 0.0001373626373626374, 0.0003290304057427298)
2026-06-23 02:09:40,075 - optuna.study.study - INFO - Trial 125 finished with values: [0.0006331931135531597, 0.0001373626373626374, 0.0003290304057427298] and parameters: {'n_layers': 1, 'embedding_dim': 32, 'lr': 0.00012195475224101311, 'lambda_val': 3.7911109659764386e-05, 'batch_size': 3633, 'optimizer': 'Adam'}.
2026-06-23 02:10:22,912 - experiment_functions - INFO - Early stopping at epoch 950. Best Metrics: (0.011934423689038139, 0.00253252494631805, 0.00681123246453355)
2026-06-23 02:10:22,999 - optuna.study.study - INFO - Trial 126 finished with values: [0.011934423689038139, 0.00253252494631805, 0.00681123246453355] and parameters: {'n_layers': 2, 'embedding_dim': 64, 'lr': 0.0021019606239041683, 'lambda_val': 0.0010840808687380718, 'batch_size': 1270, 'optimizer': 'RMSprop'}.
2026-06-23 02:13:22,380 - optuna.study.study - INFO - Trial 127 finished with values: [0.010095966369667187, 0.002246747505368195, 0.0056702939033182985] and parameters: {'n_layers': 3, 'embedding_dim': 64, 'lr': 0.0688338651103124, 'lambda_val': 0.0010840808687380718, 'batch_size': 1249, 'optimizer': 'RMSprop'}.
2026-06-23 02:13:49,681 - experiment_functions - INFO - Early stopping at epoch 550. Best Metrics: (0.004999462530635237, 0.0011194265504610333, 0.0028329054102073687)
2026-06-23 02:13:49,775 - optuna.study.study - INFO - Trial 128 finished with values: [0.004999462530635237, 0.0011194265504610333, 0.0028329054102073687] and parameters: {'n_layers': 4, 'embedding_dim': 32, 'lr': 0.06045802308039737, 'lambda_val': 3.611427784790995e-05, 'batch_size': 2381, 'optimizer': 'RMSprop'}.
2026-06-23 02:14:40,360 - experiment_functions - INFO - Early stopping at epoch 1150. Best Metrics: (0.011312839749257399, 0.002398320070733864, 0.006376021792946665)
2026-06-23 02:14:40,741 - optuna.study.study - INFO - Trial 129 finished with values: [0.011312839749257399, 0.002398320070733864, 0.006376021792946665] and parameters: {'n_layers': 3, 'embedding_dim': 32, 'lr': 0.009429082007684183, 'lambda_val': 5.111407446790404e-06, 'batch_size': 1842, 'optimizer': 'RMSprop'}.
2026-06-23 02:18:49,388 - experiment_functions - INFO - Early stopping at epoch 3800. Best Metrics: (0.025741570340032306, 0.005598711633194392, 0.014690015530316756)
2026-06-23 02:18:49,467 - optuna.study.study - INFO - Trial 130 finished with values: [0.025741570340032306, 0.005598711633194392, 0.014690015530316756] and parameters: {'n_layers': 4, 'embedding_dim': 256, 'lr': 0.000267777720544778, 'lambda_val': 3.12735769757427e-06, 'batch_size': 1127, 'optimizer': 'RMSprop'}.
2026-06-23 02:19:21,443 - experiment_functions - INFO - Early stopping at epoch 650. Best Metrics: (0.010602847498557423, 0.002262536314260452, 0.005673090377643462)
2026-06-23 02:19:21,527 - optuna.study.study - INFO - Trial 131 finished with values: [0.010602847498557423, 0.002262536314260452, 0.005673090377643462] and parameters: {'n_layers': 4, 'embedding_dim': 64, 'lr': 0.0016936188017047076, 'lambda_val': 0.0010840808687380718, 'batch_size': 3305, 'optimizer': 'RMSprop'}.
2026-06-23 02:22:25,121 - optuna.study.study - INFO - Trial 132 finished with values: [0.022943214676546846, 0.005036630036630037, 0.01301189532536499] and parameters: {'n_layers': 3, 'embedding_dim': 64, 'lr': 0.000267777720544778, 'lambda_val': 1.1678222757114953e-05, 'batch_size': 2436, 'optimizer': 'Adam'}.
2026-06-23 02:23:01,581 - experiment_functions - INFO - Early stopping at epoch 800. Best Metrics: (0.021004901626730767, 0.004739800429455602, 0.011972844280067067)
2026-06-23 02:23:01,793 - optuna.study.study - INFO - Trial 133 finished with values: [0.021004901626730767, 0.004739800429455602, 0.011972844280067067] and parameters: {'n_layers': 2, 'embedding_dim': 32, 'lr': 0.0013646646670668807, 'lambda_val': 0.018126568573406728, 'batch_size': 2381, 'optimizer': 'Adam'}.
2026-06-23 02:26:19,854 - experiment_functions - INFO - Early stopping at epoch 3000. Best Metrics: (0.006061836255076381, 0.0013120500189465706, 0.003375955584593232)
2026-06-23 02:26:20,929 - optuna.study.study - INFO - Trial 134 finished with values: [0.006061836255076381, 0.0013120500189465706, 0.003375955584593232] and parameters: {'n_layers': 4, 'embedding_dim': 256, 'lr': 0.09262371607129609, 'lambda_val': 0.001880532910656797, 'batch_size': 3954, 'optimizer': 'Adam'}.
2026-06-23 02:26:46,824 - experiment_functions - INFO - Early stopping at epoch 550. Best Metrics: (0.003838332813160436, 0.0008020714917266641, 0.0020935825639092453)
2026-06-23 02:26:46,914 - optuna.study.study - INFO - Trial 135 finished with values: [0.003838332813160436, 0.0008020714917266641, 0.0020935825639092453] and parameters: {'n_layers': 4, 'embedding_dim': 32, 'lr': 0.08206372396592698, 'lambda_val': 1.1678222757114953e-05, 'batch_size': 2436, 'optimizer': 'RMSprop'}.
2026-06-23 02:28:39,910 - experiment_functions - INFO - Early stopping at epoch 2650. Best Metrics: (0.02794159324149696, 0.006140267778198812, 0.016251976928586615)
2026-06-23 02:28:39,997 - optuna.study.study - INFO - Trial 136 finished with values: [0.02794159324149696, 0.006140267778198812, 0.016251976928586615] and parameters: {'n_layers': 2, 'embedding_dim': 32, 'lr': 0.0006919442047023748, 'lambda_val': 0.0011345897854453913, 'batch_size': 1807, 'optimizer': 'RMSprop'}.
2026-06-23 02:29:06,863 - experiment_functions - INFO - Early stopping at epoch 550. Best Metrics: (0.010382314722990333, 0.002270430718706581, 0.005596364976449472)
2026-06-23 02:29:07,072 - optuna.study.study - INFO - Trial 137 finished with values: [0.010382314722990333, 0.002270430718706581, 0.005596364976449472] and parameters: {'n_layers': 3, 'embedding_dim': 64, 'lr': 0.0054915489808154486, 'lambda_val': 0.0010840808687380718, 'batch_size': 2436, 'optimizer': 'Adam'}.
2026-06-23 02:29:58,435 - experiment_functions - INFO - Early stopping at epoch 1200. Best Metrics: (0.03302333782354857, 0.006839712012125804, 0.018525460750248513)
2026-06-23 02:29:58,511 - optuna.study.study - INFO - Trial 138 finished with values: [0.03302333782354857, 0.006839712012125804, 0.018525460750248513] and parameters: {'n_layers': 1, 'embedding_dim': 32, 'lr': 0.0025566338112489964, 'lambda_val': 0.0011345897854453913, 'batch_size': 1341, 'optimizer': 'Adam'}.
2026-06-23 02:33:16,029 - optuna.study.study - INFO - Trial 139 finished with values: [0.013864211300387543, 0.0028925097890615133, 0.007716019873992785] and parameters: {'n_layers': 3, 'embedding_dim': 128, 'lr': 0.010581481753294916, 'lambda_val': 1.1358678227612878e-06, 'batch_size': 2436, 'optimizer': 'RMSprop'}.
2026-06-23 02:34:12,161 - experiment_functions - INFO - Early stopping at epoch 1200. Best Metrics: (0.008440665974530626, 0.0017620310723759, 0.004810445197292769)
2026-06-23 02:34:12,235 - optuna.study.study - INFO - Trial 140 finished with values: [0.008440665974530626, 0.0017620310723759, 0.004810445197292769] and parameters: {'n_layers': 4, 'embedding_dim': 64, 'lr': 0.004320177300857527, 'lambda_val': 3.12735769757427e-06, 'batch_size': 3305, 'optimizer': 'RMSprop'}.
2026-06-23 02:37:38,492 - optuna.study.study - INFO - Trial 141 finished with values: [0.011683333641955191, 0.0025309460654288243, 0.006305906414068145] and parameters: {'n_layers': 4, 'embedding_dim': 128, 'lr': 0.050940040347919505, 'lambda_val': 0.0005196802788376184, 'batch_size': 2579, 'optimizer': 'RMSprop'}.
2026-06-23 02:38:52,548 - experiment_functions - INFO - Early stopping at epoch 1850. Best Metrics: (0.0006245212882843838, 0.0001389415182518631, 0.00035535136197597145)
2026-06-23 02:38:53,578 - optuna.study.study - INFO - Trial 142 finished with values: [0.0006245212882843838, 0.0001389415182518631, 0.00035535136197597145] and parameters: {'n_layers': 1, 'embedding_dim': 32, 'lr': 3.933534848492858e-05, 'lambda_val': 0.00018208560704094476, 'batch_size': 1872, 'optimizer': 'RMSprop'}.
2026-06-23 02:39:38,136 - experiment_functions - INFO - Early stopping at epoch 850. Best Metrics: (0.020679798638758635, 0.0046403309334343825, 0.01185466029766777)
2026-06-23 02:39:39,060 - optuna.study.study - INFO - Trial 143 finished with values: [0.020679798638758635, 0.0046403309334343825, 0.01185466029766777] and parameters: {'n_layers': 3, 'embedding_dim': 128, 'lr': 0.0008213174750905707, 'lambda_val': 0.0017972759027936231, 'batch_size': 2436, 'optimizer': 'Adam'}.
2026-06-23 02:40:39,770 - experiment_functions - INFO - Early stopping at epoch 1200. Best Metrics: (0.013704403571035584, 0.002922508525956802, 0.007386870222740135)
2026-06-23 02:40:39,846 - optuna.study.study - INFO - Trial 144 finished with values: [0.013704403571035584, 0.002922508525956802, 0.007386870222740135] and parameters: {'n_layers': 4, 'embedding_dim': 96, 'lr': 0.0013029739660954116, 'lambda_val': 3.611427784790995e-05, 'batch_size': 922, 'optimizer': 'Adam'}.
2026-06-23 02:41:02,425 - experiment_functions - INFO - Early stopping at epoch 500. Best Metrics: (0.000622662404613409, 0.0001468359226979917, 0.0003823412164712754)
2026-06-23 02:41:02,507 - optuna.study.study - INFO - Trial 145 finished with values: [0.000622662404613409, 0.0001468359226979917, 0.0003823412164712754] and parameters: {'n_layers': 3, 'embedding_dim': 32, 'lr': 0.0025566338112489964, 'lambda_val': 0.0011345897854453913, 'batch_size': 1895, 'optimizer': 'SGD'}.
2026-06-23 02:41:43,241 - experiment_functions - INFO - Early stopping at epoch 600. Best Metrics: (0.008343415308314488, 0.0019072881141846657, 0.004654502461138124)
2026-06-23 02:41:43,617 - optuna.study.study - INFO - Trial 146 finished with values: [0.008343415308314488, 0.0019072881141846657, 0.004654502461138124] and parameters: {'n_layers': 4, 'embedding_dim': 256, 'lr': 0.0008639986019635256, 'lambda_val': 0.005404522144278895, 'batch_size': 2754, 'optimizer': 'RMSprop'}.
2026-06-23 02:42:22,237 - experiment_functions - INFO - Early stopping at epoch 850. Best Metrics: (0.015137358539399305, 0.0032540735126942028, 0.008632785499317354)
2026-06-23 02:42:22,323 - optuna.study.study - INFO - Trial 147 finished with values: [0.015137358539399305, 0.0032540735126942028, 0.008632785499317354] and parameters: {'n_layers': 4, 'embedding_dim': 32, 'lr': 0.0016936188017047076, 'lambda_val': 2.7464269407470928e-06, 'batch_size': 1895, 'optimizer': 'RMSprop'}.
2026-06-23 02:45:38,012 - optuna.study.study - INFO - Trial 148 finished with values: [0.027854293810610664, 0.006113426803081976, 0.016435881952573415] and parameters: {'n_layers': 1, 'embedding_dim': 256, 'lr': 0.0008213174750905707, 'lambda_val': 4.998160662190083e-05, 'batch_size': 827, 'optimizer': 'Adam'}.
2026-06-23 02:46:22,387 - experiment_functions - INFO - Early stopping at epoch 1000. Best Metrics: (0.010183705654897174, 0.002096753820891752, 0.00559346260304939)
2026-06-23 02:46:22,469 - optuna.study.study - INFO - Trial 149 finished with values: [0.010183705654897174, 0.002096753820891752, 0.00559346260304939] and parameters: {'n_layers': 3, 'embedding_dim': 32, 'lr': 0.010301320128047705, 'lambda_val': 1.1678222757114953e-05, 'batch_size': 2436, 'optimizer': 'RMSprop'}.
2026-06-23 02:47:04,309 - experiment_functions - INFO - Early stopping at epoch 900. Best Metrics: (0.02288496095455352, 0.00514241505620816, 0.013052838138606922)
2026-06-23 02:47:04,378 - optuna.study.study - INFO - Trial 150 finished with values: [0.02288496095455352, 0.00514241505620816, 0.013052838138606922] and parameters: {'n_layers': 1, 'embedding_dim': 96, 'lr': 0.0013029739660954116, 'lambda_val': 0.013891323661131265, 'batch_size': 2381, 'optimizer': 'RMSprop'}.
2026-06-23 02:47:43,951 - experiment_functions - INFO - Early stopping at epoch 750. Best Metrics: (0.021297692840368723, 0.004662435265883542, 0.012244384433302717)
2026-06-23 02:47:44,032 - optuna.study.study - INFO - Trial 151 finished with values: [0.021297692840368723, 0.004662435265883542, 0.012244384433302717] and parameters: {'n_layers': 1, 'embedding_dim': 256, 'lr': 0.004023997993481987, 'lambda_val': 4.998160662190083e-05, 'batch_size': 922, 'optimizer': 'Adam'}.
2026-06-23 02:48:10,083 - experiment_functions - INFO - Early stopping at epoch 550. Best Metrics: (0.008539912598970422, 0.0018946570670708603, 0.004577200463631801)
2026-06-23 02:48:10,169 - optuna.study.study - INFO - Trial 152 finished with values: [0.008539912598970422, 0.0018946570670708603, 0.004577200463631801] and parameters: {'n_layers': 3, 'embedding_dim': 32, 'lr': 0.010301320128047705, 'lambda_val': 0.0004109926940498661, 'batch_size': 1807, 'optimizer': 'Adam'}.
2026-06-23 02:49:13,130 - experiment_functions - INFO - Early stopping at epoch 1200. Best Metrics: (0.023846827789762066, 0.005107679676645194, 0.013022036712932774)
2026-06-23 02:49:13,209 - optuna.study.study - INFO - Trial 153 finished with values: [0.023846827789762066, 0.005107679676645194, 0.013022036712932774] and parameters: {'n_layers': 3, 'embedding_dim': 128, 'lr': 0.0006508111469618892, 'lambda_val': 1.1678222757114953e-05, 'batch_size': 2436, 'optimizer': 'Adam'}.
2026-06-23 02:50:42,462 - experiment_functions - INFO - Early stopping at epoch 1950. Best Metrics: (0.008628292397477137, 0.0017888720474927373, 0.004782175148781049)
2026-06-23 02:50:42,551 - optuna.study.study - INFO - Trial 154 finished with values: [0.008628292397477137, 0.0017888720474927373, 0.004782175148781049] and parameters: {'n_layers': 3, 'embedding_dim': 64, 'lr': 0.0054915489808154486, 'lambda_val': 1.1678222757114953e-05, 'batch_size': 1270, 'optimizer': 'Adam'}.
2026-06-23 02:51:05,768 - experiment_functions - INFO - Early stopping at epoch 500. Best Metrics: (0.0005427994574584443, 0.00012315270935960593, 0.0002934558811263306)
2026-06-23 02:51:05,865 - optuna.study.study - INFO - Trial 155 finished with values: [0.0005427994574584443, 0.00012315270935960593, 0.0002934558811263306] and parameters: {'n_layers': 3, 'embedding_dim': 32, 'lr': 0.006327976258634177, 'lambda_val': 5.111407446790404e-06, 'batch_size': 1842, 'optimizer': 'SGD'}.
2026-06-23 02:53:52,945 - optuna.study.study - INFO - Trial 156 finished with values: [0.02870539225604527, 0.006377099911582672, 0.01637139065935763] and parameters: {'n_layers': 1, 'embedding_dim': 32, 'lr': 0.0006886562164819431, 'lambda_val': 2.7464269407470928e-06, 'batch_size': 1895, 'optimizer': 'RMSprop'}.
2026-06-23 02:54:38,845 - experiment_functions - INFO - Early stopping at epoch 900. Best Metrics: (0.0005282061831265826, 0.00011683718580270305, 0.00029070253802730906)
2026-06-23 02:54:38,936 - optuna.study.study - INFO - Trial 157 finished with values: [0.0005282061831265826, 0.00011683718580270305, 0.00029070253802730906] and parameters: {'n_layers': 1, 'embedding_dim': 256, 'lr': 2.344465244941296e-05, 'lambda_val': 0.0014112253936305432, 'batch_size': 2381, 'optimizer': 'Adam'}.
2026-06-23 02:55:42,371 - experiment_functions - INFO - Early stopping at epoch 1350. Best Metrics: (0.02449053306560912, 0.005248200075786283, 0.013988457593864821)
2026-06-23 02:55:42,451 - optuna.study.study - INFO - Trial 158 finished with values: [0.02449053306560912, 0.005248200075786283, 0.013988457593864821] and parameters: {'n_layers': 3, 'embedding_dim': 64, 'lr': 0.0008213174750905707, 'lambda_val': 1.1976797619462708e-05, 'batch_size': 1341, 'optimizer': 'Adam'}.
2026-06-23 02:56:14,357 - experiment_functions - INFO - Early stopping at epoch 650. Best Metrics: (0.02539271250877238, 0.005409245926487306, 0.014325654250118846)
2026-06-23 02:56:14,465 - optuna.study.study - INFO - Trial 159 finished with values: [0.02539271250877238, 0.005409245926487306, 0.014325654250118846] and parameters: {'n_layers': 2, 'embedding_dim': 96, 'lr': 0.0025566338112489964, 'lambda_val': 1.1976797619462708e-05, 'batch_size': 3305, 'optimizer': 'Adam'}.
2026-06-23 02:56:46,178 - experiment_functions - INFO - Early stopping at epoch 500. Best Metrics: (0.007533287869276974, 0.0016073007452317798, 0.004182276301095843)
2026-06-23 02:56:46,261 - optuna.study.study - INFO - Trial 160 finished with values: [0.007533287869276974, 0.0016073007452317798, 0.004182276301095843] and parameters: {'n_layers': 3, 'embedding_dim': 256, 'lr': 0.0881922985069268, 'lambda_val': 4.998160662190083e-05, 'batch_size': 782, 'optimizer': 'RMSprop'}.
2026-06-23 02:57:15,053 - experiment_functions - INFO - Early stopping at epoch 650. Best Metrics: (0.013068642072462026, 0.0028483011241631933, 0.007686747677680118)
2026-06-23 02:57:15,189 - optuna.study.study - INFO - Trial 161 finished with values: [0.013068642072462026, 0.0028483011241631933, 0.007686747677680118] and parameters: {'n_layers': 1, 'embedding_dim': 32, 'lr': 0.009429082007684183, 'lambda_val': 0.0010840808687380718, 'batch_size': 922, 'optimizer': 'RMSprop'}.
2026-06-23 02:59:27,266 - experiment_functions - INFO - Early stopping at epoch 2650. Best Metrics: (0.03153383465895084, 0.00670550713654162, 0.01823215516678931)
2026-06-23 02:59:27,339 - optuna.study.study - INFO - Trial 162 finished with values: [0.03153383465895084, 0.00670550713654162, 0.01823215516678931] and parameters: {'n_layers': 1, 'embedding_dim': 256, 'lr': 0.001046404922421146, 'lambda_val': 0.0010840808687380718, 'batch_size': 1807, 'optimizer': 'Adam'}.
2026-06-23 03:02:10,115 - optuna.study.study - INFO - Trial 163 finished with values: [0.012331625818214736, 0.0028640899330554504, 0.007418162053749181] and parameters: {'n_layers': 2, 'embedding_dim': 32, 'lr': 0.000267777720544778, 'lambda_val': 0.0011345897854453913, 'batch_size': 1872, 'optimizer': 'RMSprop'}.
2026-06-23 03:02:52,577 - experiment_functions - INFO - Early stopping at epoch 950. Best Metrics: (0.012081235306957117, 0.0026398888467853987, 0.006620598835850927)
2026-06-23 03:02:52,669 - optuna.study.study - INFO - Trial 164 finished with values: [0.012081235306957117, 0.0026398888467853987, 0.006620598835850927] and parameters: {'n_layers': 2, 'embedding_dim': 64, 'lr': 0.0021019606239041683, 'lambda_val': 0.0010840808687380718, 'batch_size': 1270, 'optimizer': 'RMSprop'}.
2026-06-23 03:03:17,431 - experiment_functions - INFO - Early stopping at epoch 550. Best Metrics: (0.01171053257025684, 0.002663572060123784, 0.006817747859900119)
2026-06-23 03:03:17,508 - optuna.study.study - INFO - Trial 165 finished with values: [0.01171053257025684, 0.002663572060123784, 0.006817747859900119] and parameters: {'n_layers': 1, 'embedding_dim': 64, 'lr': 0.0151890311178209, 'lambda_val': 0.0010840808687380718, 'batch_size': 1270, 'optimizer': 'RMSprop'}.
2026-06-23 03:06:27,869 - optuna.study.study - INFO - Trial 166 finished with values: [0.009104826934934928, 0.0022104332449160036, 0.005746409388724127] and parameters: {'n_layers': 1, 'embedding_dim': 256, 'lr': 0.000267777720544778, 'lambda_val': 1.105038231556551e-05, 'batch_size': 3305, 'optimizer': 'RMSprop'}.
2026-06-23 03:09:26,562 - optuna.study.study - INFO - Trial 167 finished with values: [0.022538875802269886, 0.005012946823291651, 0.012891144611634858] and parameters: {'n_layers': 3, 'embedding_dim': 64, 'lr': 0.000267777720544778, 'lambda_val': 0.0011345897854453913, 'batch_size': 2261, 'optimizer': 'Adam'}.
2026-06-23 03:10:04,233 - experiment_functions - INFO - Early stopping at epoch 900. Best Metrics: (0.000589026020359163, 0.00014209928003031453, 0.0002997123838059434)
2026-06-23 03:10:04,312 - optuna.study.study - INFO - Trial 168 finished with values: [0.000589026020359163, 0.00014209928003031453, 0.0002997123838059434] and parameters: {'n_layers': 1, 'embedding_dim': 32, 'lr': 0.00012858775112717198, 'lambda_val': 0.0011345897854453913, 'batch_size': 1341, 'optimizer': 'Adam'}.
2026-06-23 03:10:35,008 - experiment_functions - INFO - Early stopping at epoch 650. Best Metrics: (0.011917629695927513, 0.0027646204370342306, 0.00636391891389721)
2026-06-23 03:10:35,089 - optuna.study.study - INFO - Trial 169 finished with values: [0.011917629695927513, 0.0027646204370342306, 0.00636391891389721] and parameters: {'n_layers': 3, 'embedding_dim': 64, 'lr': 0.0016936188017047076, 'lambda_val': 0.018126568573406728, 'batch_size': 2381, 'optimizer': 'Adam'}.
2026-06-23 03:11:26,063 - experiment_functions - INFO - Early stopping at epoch 950. Best Metrics: (0.006532664888307139, 0.0013278388278388277, 0.0033677480249910824)
2026-06-23 03:11:26,153 - optuna.study.study - INFO - Trial 170 finished with values: [0.006532664888307139, 0.0013278388278388277, 0.0033677480249910824] and parameters: {'n_layers': 4, 'embedding_dim': 128, 'lr': 0.0051590450548082934, 'lambda_val': 0.0016324316088680724, 'batch_size': 2436, 'optimizer': 'RMSprop'}.
