2026-06-20 09:48:18,456 - optuna.study.study - INFO - Trial 282 finished with values: [0.033198380796929605, 0.0069423392699254766, 0.0191160496528358] and parameters: {'n_layers': 1, 'embedding_dim': 32, 'lr': 0.0012953028594055518, 'lambda_val': 6.868274004831431e-05, 'batch_size': 2973, 'optimizer': 'Adam'}.
2026-06-20 09:49:42,115 - experiment_functions - INFO - Early stopping at epoch 1950. Best Metrics: (0.03312897402959464, 0.006910761652140963, 0.01876892751570101)
2026-06-20 09:49:42,199 - optuna.study.study - INFO - Trial 283 finished with values: [0.03312897402959464, 0.006910761652140963, 0.01876892751570101] and parameters: {'n_layers': 1, 'embedding_dim': 64, 'lr': 0.0012953028594055518, 'lambda_val': 1.0746091986357293e-06, 'batch_size': 2630, 'optimizer': 'Adam'}.
2026-06-20 09:52:30,468 - optuna.study.study - INFO - Trial 284 finished with values: [0.022975058588955672, 0.0051029430339775165, 0.013541272884126045] and parameters: {'n_layers': 1, 'embedding_dim': 96, 'lr': 0.0006438418474980425, 'lambda_val': 0.0021946854678568293, 'batch_size': 1121, 'optimizer': 'RMSprop'}.
2026-06-20 09:54:17,302 - experiment_functions - INFO - Early stopping at epoch 2550. Best Metrics: (0.03170226800380137, 0.006722874826323103, 0.017993507253484906)
2026-06-20 09:54:17,387 - optuna.study.study - INFO - Trial 285 finished with values: [0.03170226800380137, 0.006722874826323103, 0.017993507253484906] and parameters: {'n_layers': 1, 'embedding_dim': 64, 'lr': 0.0012953028594055518, 'lambda_val': 3.64590979484011e-06, 'batch_size': 757, 'optimizer': 'RMSprop'}.
2026-06-20 09:55:11,909 - experiment_functions - INFO - Early stopping at epoch 1100. Best Metrics: (0.031348027526873566, 0.006506568144499179, 0.017606225619701352)
2026-06-20 09:55:11,996 - optuna.study.study - INFO - Trial 286 finished with values: [0.031348027526873566, 0.006506568144499179, 0.017606225619701352] and parameters: {'n_layers': 1, 'embedding_dim': 256, 'lr': 0.0012953028594055518, 'lambda_val': 6.868274004831431e-05, 'batch_size': 3338, 'optimizer': 'RMSprop'}.
2026-06-20 09:56:39,052 - experiment_functions - INFO - Early stopping at epoch 2100. Best Metrics: (0.03198102626965635, 0.006639194139194139, 0.018197029833105755)
2026-06-20 09:56:39,138 - optuna.study.study - INFO - Trial 287 finished with values: [0.03198102626965635, 0.006639194139194139, 0.018197029833105755] and parameters: {'n_layers': 1, 'embedding_dim': 32, 'lr': 0.0015608654005494732, 'lambda_val': 6.868274004831431e-05, 'batch_size': 1134, 'optimizer': 'RMSprop'}.
2026-06-20 09:59:00,996 - experiment_functions - INFO - Early stopping at epoch 3450. Best Metrics: (0.033994170455498976, 0.0070828596690665655, 0.01933962550557181)
2026-06-20 09:59:01,083 - optuna.study.study - INFO - Trial 288 finished with values: [0.033994170455498976, 0.0070828596690665655, 0.01933962550557181] and parameters: {'n_layers': 1, 'embedding_dim': 32, 'lr': 0.0012953028594055518, 'lambda_val': 3.64590979484011e-06, 'batch_size': 2973, 'optimizer': 'RMSprop'}.
2026-06-20 10:01:45,233 - optuna.study.study - INFO - Trial 289 finished with values: [0.034990688032328174, 0.007142857142857143, 0.019896813003716055] and parameters: {'n_layers': 1, 'embedding_dim': 32, 'lr': 0.0012953028594055518, 'lambda_val': 3.64590979484011e-06, 'batch_size': 2973, 'optimizer': 'Adam'}.
2026-06-20 10:04:28,709 - optuna.study.study - INFO - Trial 290 finished with values: [0.033152644314504265, 0.00697075912593154, 0.018940880541774584] and parameters: {'n_layers': 1, 'embedding_dim': 32, 'lr': 0.0012953028594055518, 'lambda_val': 3.64590979484011e-06, 'batch_size': 757, 'optimizer': 'RMSprop'}.
2026-06-20 10:06:33,614 - experiment_functions - INFO - Early stopping at epoch 3050. Best Metrics: (0.03030804131750087, 0.006467096122268537, 0.017298649805985753)
2026-06-20 10:06:33,694 - optuna.study.study - INFO - Trial 291 finished with values: [0.03030804131750087, 0.006467096122268537, 0.017298649805985753] and parameters: {'n_layers': 1, 'embedding_dim': 32, 'lr': 0.0012953028594055518, 'lambda_val': 3.64590979484011e-06, 'batch_size': 757, 'optimizer': 'RMSprop'}.
2026-06-20 10:07:02,359 - experiment_functions - INFO - Early stopping at epoch 650. Best Metrics: (0.026896022822815845, 0.00581343943412909, 0.015462094897165012)
2026-06-20 10:07:02,448 - optuna.study.study - INFO - Trial 292 finished with values: [0.026896022822815845, 0.00581343943412909, 0.015462094897165012] and parameters: {'n_layers': 1, 'embedding_dim': 32, 'lr': 0.006818318104648942, 'lambda_val': 3.64590979484011e-06, 'batch_size': 2630, 'optimizer': 'Adam'}.
2026-06-20 10:07:50,049 - experiment_functions - INFO - Early stopping at epoch 1100. Best Metrics: (0.019231397689827637, 0.0041066691928760895, 0.01048248413558996)
2026-06-20 10:07:50,135 - optuna.study.study - INFO - Trial 293 finished with values: [0.019231397689827637, 0.0041066691928760895, 0.01048248413558996] and parameters: {'n_layers': 3, 'embedding_dim': 32, 'lr': 0.0012953028594055518, 'lambda_val': 1.0746091986357293e-06, 'batch_size': 2973, 'optimizer': 'RMSprop'}.
2026-06-20 10:10:09,837 - experiment_functions - INFO - Early stopping at epoch 3400. Best Metrics: (0.03404891616977737, 0.0070465454086143745, 0.01936577048486492)
2026-06-20 10:10:09,908 - optuna.study.study - INFO - Trial 294 finished with values: [0.03404891616977737, 0.0070465454086143745, 0.01936577048486492] and parameters: {'n_layers': 1, 'embedding_dim': 32, 'lr': 0.0015608654005494732, 'lambda_val': 1.1999345210285389e-05, 'batch_size': 2263, 'optimizer': 'RMSprop'}.
2026-06-20 10:10:57,605 - experiment_functions - INFO - Early stopping at epoch 1100. Best Metrics: (0.030606507293788332, 0.0064686750031577615, 0.017937065623738934)
2026-06-20 10:10:57,684 - optuna.study.study - INFO - Trial 295 finished with values: [0.030606507293788332, 0.0064686750031577615, 0.017937065623738934] and parameters: {'n_layers': 1, 'embedding_dim': 64, 'lr': 0.001705082463001927, 'lambda_val': 3.64590979484011e-06, 'batch_size': 3338, 'optimizer': 'RMSprop'}.
2026-06-20 10:13:17,152 - experiment_functions - INFO - Early stopping at epoch 3400. Best Metrics: (0.03354142372074147, 0.007013388909940635, 0.019473296807129073)
2026-06-20 10:13:17,237 - optuna.study.study - INFO - Trial 296 finished with values: [0.03354142372074147, 0.007013388909940635, 0.019473296807129073] and parameters: {'n_layers': 1, 'embedding_dim': 32, 'lr': 0.0012953028594055518, 'lambda_val': 5.8148367269156115e-06, 'batch_size': 2973, 'optimizer': 'RMSprop'}.
2026-06-20 10:14:01,688 - experiment_functions - INFO - Early stopping at epoch 900. Best Metrics: (0.008768915226548655, 0.002115700391562461, 0.004982920188437895)
2026-06-20 10:14:01,778 - optuna.study.study - INFO - Trial 297 finished with values: [0.008768915226548655, 0.002115700391562461, 0.004982920188437895] and parameters: {'n_layers': 4, 'embedding_dim': 96, 'lr': 0.0006438418474980425, 'lambda_val': 0.04250172874101542, 'batch_size': 3338, 'optimizer': 'Adam'}.
2026-06-20 10:14:23,592 - experiment_functions - INFO - Early stopping at epoch 500. Best Metrics: (0.0006163980764694926, 0.00013262599469496023, 0.0003378409646904899)
2026-06-20 10:14:23,675 - optuna.study.study - INFO - Trial 298 finished with values: [0.0006163980764694926, 0.00013262599469496023, 0.0003378409646904899] and parameters: {'n_layers': 1, 'embedding_dim': 32, 'lr': 0.0012953028594055518, 'lambda_val': 0.00010692078263239203, 'batch_size': 2973, 'optimizer': 'SGD'}.
2026-06-20 10:15:31,066 - experiment_functions - INFO - Early stopping at epoch 1600. Best Metrics: (0.02796266400601997, 0.006023430592396109, 0.015983826154722918)
2026-06-20 10:15:31,154 - optuna.study.study - INFO - Trial 299 finished with values: [0.02796266400601997, 0.006023430592396109, 0.015983826154722918] and parameters: {'n_layers': 2, 'embedding_dim': 32, 'lr': 0.0012953028594055518, 'lambda_val': 2.3601371886659016e-06, 'batch_size': 1493, 'optimizer': 'Adam'}.
2026-06-20 10:15:31,169 - root - INFO - Selected Trial 243 based on Max ndcg: 0.0202
2026-06-20 10:15:31,169 - root - INFO - Associated Recall: 0.0353
2026-06-20 10:15:31,169 - experiment_functions - INFO - Training the best model ... for e_yelp_1c1dcs_rand4
2026-06-20 10:18:00,417 - experiment_functions - INFO - Early stopping at epoch 3650. Best Metrics: (0.03371197075994684, 0.00687918403435645, 0.019058741938149902)
2026-06-20 10:18:04,270 - root - INFO -   **** Training e_yelp_1c1dcs_rand5
2026-06-20 10:18:04,413 - root - INFO -   **** Getting 421521/1274132 random edges
2026-06-20 10:18:04,662 - optuna.storages._rdb.storage - INFO - A new study created in RDB with name: Study_e_yelp_1c1dcs_rand5
2026-06-20 10:18:27,467 - experiment_functions - INFO - Early stopping at epoch 500. Best Metrics: (0.00056259286649803, 0.00013262599469496023, 0.00031395010408521225)
2026-06-20 10:18:27,545 - optuna.study.study - INFO - Trial 0 finished with values: [0.00056259286649803, 0.00013262599469496023, 0.00031395010408521225] and parameters: {'n_layers': 4, 'embedding_dim': 32, 'lr': 0.024364981804023047, 'lambda_val': 1.3511921295575975e-05, 'batch_size': 1241, 'optimizer': 'SGD'}.
2026-06-20 10:18:50,024 - experiment_functions - INFO - Early stopping at epoch 500. Best Metrics: (0.0005365211003226396, 0.0001278893520272831, 0.00030940106962778493)
2026-06-20 10:18:50,107 - optuna.study.study - INFO - Trial 1 finished with values: [0.0005365211003226396, 0.0001278893520272831, 0.00030940106962778493] and parameters: {'n_layers': 3, 'embedding_dim': 32, 'lr': 0.03396971133621618, 'lambda_val': 9.636851443713757e-05, 'batch_size': 3111, 'optimizer': 'SGD'}.
2026-06-20 10:19:12,445 - experiment_functions - INFO - Early stopping at epoch 500. Best Metrics: (0.0005765744201541187, 0.00012315270935960593, 0.00034276313258120507)
2026-06-20 10:19:12,534 - optuna.study.study - INFO - Trial 2 finished with values: [0.0005765744201541187, 0.00012315270935960593, 0.00034276313258120507] and parameters: {'n_layers': 2, 'embedding_dim': 32, 'lr': 0.00046312276480803076, 'lambda_val': 0.0032201101504106306, 'batch_size': 2009, 'optimizer': 'SGD'}.
2026-06-20 10:19:35,709 - experiment_functions - INFO - Early stopping at epoch 500. Best Metrics: (0.0005214011954669528, 0.0001042061386888973, 0.00025570151574329453)
2026-06-20 10:19:35,786 - optuna.study.study - INFO - Trial 3 finished with values: [0.0005214011954669528, 0.0001042061386888973, 0.00025570151574329453] and parameters: {'n_layers': 1, 'embedding_dim': 128, 'lr': 2.6278846985762103e-05, 'lambda_val': 0.04652194532914515, 'batch_size': 3097, 'optimizer': 'SGD'}.
2026-06-20 10:19:59,370 - experiment_functions - INFO - Early stopping at epoch 500. Best Metrics: (0.0005048924810989035, 0.00010894278135657448, 0.00025828446632423466)
2026-06-20 10:19:59,460 - optuna.study.study - INFO - Trial 4 finished with values: [0.0005048924810989035, 0.00010894278135657448, 0.00025828446632423466] and parameters: {'n_layers': 1, 'embedding_dim': 96, 'lr': 0.00033757454877391785, 'lambda_val': 0.0010933804953560246, 'batch_size': 519, 'optimizer': 'SGD'}.
2026-06-20 10:20:22,324 - experiment_functions - INFO - Early stopping at epoch 500. Best Metrics: (0.0005238939209972659, 0.0001310471138057345, 0.00025620826264110674)
2026-06-20 10:20:22,413 - optuna.study.study - INFO - Trial 5 finished with values: [0.0005238939209972659, 0.0001310471138057345, 0.00025620826264110674] and parameters: {'n_layers': 4, 'embedding_dim': 32, 'lr': 0.0001943300564391481, 'lambda_val': 0.0614554022089744, 'batch_size': 2606, 'optimizer': 'Adam'}.
2026-06-20 10:20:46,814 - experiment_functions - INFO - Early stopping at epoch 500. Best Metrics: (0.0004516375419740568, 0.00010894278135657447, 0.0002681275865887033)
2026-06-20 10:20:46,909 - optuna.study.study - INFO - Trial 6 finished with values: [0.0004516375419740568, 0.00010894278135657447, 0.0002681275865887033] and parameters: {'n_layers': 2, 'embedding_dim': 128, 'lr': 0.00016290183256400495, 'lambda_val': 0.0722432446993503, 'batch_size': 3562, 'optimizer': 'RMSprop'}.
2026-06-20 10:21:09,409 - experiment_functions - INFO - Early stopping at epoch 500. Best Metrics: (0.0005715171850511349, 0.0001278893520272831, 0.0002840237228189571)
2026-06-20 10:21:09,514 - optuna.study.study - INFO - Trial 7 finished with values: [0.0005715171850511349, 0.0001278893520272831, 0.0002840237228189571] and parameters: {'n_layers': 3, 'embedding_dim': 32, 'lr': 2.290796475273303e-05, 'lambda_val': 4.295765450686639e-05, 'batch_size': 1289, 'optimizer': 'SGD'}.
2026-06-20 10:21:50,511 - experiment_functions - INFO - Early stopping at epoch 950. Best Metrics: (0.0004875863572675907, 0.0001121005431350259, 0.00030136260733648834)
2026-06-20 10:21:50,590 - optuna.study.study - INFO - Trial 8 finished with values: [0.0004875863572675907, 0.0001121005431350259, 0.00030136260733648834] and parameters: {'n_layers': 4, 'embedding_dim': 32, 'lr': 1.1951616458597256e-05, 'lambda_val': 9.423738546175667e-06, 'batch_size': 2580, 'optimizer': 'Adam'}.
2026-06-20 10:22:12,256 - experiment_functions - INFO - Early stopping at epoch 500. Best Metrics: (0.000465411082456309, 0.00010104837691044589, 0.00024644664112225407)
2026-06-20 10:22:12,373 - optuna.study.study - INFO - Trial 9 finished with values: [0.000465411082456309, 0.00010104837691044589, 0.00024644664112225407] and parameters: {'n_layers': 1, 'embedding_dim': 32, 'lr': 2.9830220368712282e-05, 'lambda_val': 0.0038105608781912118, 'batch_size': 2054, 'optimizer': 'SGD'}.
2026-06-20 10:22:49,577 - experiment_functions - INFO - Early stopping at epoch 700. Best Metrics: (0.011263240562619715, 0.002376215738284704, 0.00607502681627151)
2026-06-20 10:22:49,656 - optuna.study.study - INFO - Trial 10 finished with values: [0.011263240562619715, 0.002376215738284704, 0.00607502681627151] and parameters: {'n_layers': 4, 'embedding_dim': 128, 'lr': 0.0015403750227822883, 'lambda_val': 0.002980377292701446, 'batch_size': 1183, 'optimizer': 'Adam'}.
2026-06-20 10:23:12,032 - experiment_functions - INFO - Early stopping at epoch 500. Best Metrics: (0.0006233204877617552, 0.00014367816091954025, 0.00034153414595957125)
2026-06-20 10:23:12,113 - optuna.study.study - INFO - Trial 11 finished with values: [0.0006233204877617552, 0.00014367816091954025, 0.00034153414595957125] and parameters: {'n_layers': 1, 'embedding_dim': 64, 'lr': 0.00017324498898808302, 'lambda_val': 0.058092339418789656, 'batch_size': 3305, 'optimizer': 'Adam'}.
2026-06-20 10:23:37,657 - experiment_functions - INFO - Early stopping at epoch 500. Best Metrics: (0.00046157680608993113, 9.631173424276875e-05, 0.00025608781470505874)
2026-06-20 10:23:37,742 - optuna.study.study - INFO - Trial 12 finished with values: [0.00046157680608993113, 9.631173424276875e-05, 0.00025608781470505874] and parameters: {'n_layers': 3, 'embedding_dim': 128, 'lr': 4.994573122339047e-05, 'lambda_val': 0.003328284305100738, 'batch_size': 2830, 'optimizer': 'RMSprop'}.
2026-06-20 10:24:01,985 - experiment_functions - INFO - Early stopping at epoch 500. Best Metrics: (0.0004304183279317079, 0.00010736390046734875, 0.00024993518240672537)
2026-06-20 10:24:02,050 - optuna.study.study - INFO - Trial 13 finished with values: [0.0004304183279317079, 0.00010736390046734875, 0.00024993518240672537] and parameters: {'n_layers': 2, 'embedding_dim': 128, 'lr': 0.0001688552567663827, 'lambda_val': 0.013419830134155368, 'batch_size': 1289, 'optimizer': 'RMSprop'}.
2026-06-20 10:24:29,772 - experiment_functions - INFO - Early stopping at epoch 600. Best Metrics: (0.004725919383068009, 0.0010641657193381333, 0.002382010076984029)
2026-06-20 10:24:29,853 - optuna.study.study - INFO - Trial 14 finished with values: [0.004725919383068009, 0.0010641657193381333, 0.002382010076984029] and parameters: {'n_layers': 1, 'embedding_dim': 128, 'lr': 0.004124348483373258, 'lambda_val': 0.04674347949511109, 'batch_size': 3034, 'optimizer': 'RMSprop'}.
2026-06-20 10:24:59,586 - experiment_functions - INFO - Early stopping at epoch 500. Best Metrics: (0.0005096846730435967, 0.00010894278135657447, 0.00029642552674322847)
2026-06-20 10:24:59,689 - optuna.study.study - INFO - Trial 15 finished with values: [0.0005096846730435967, 0.00010894278135657447, 0.00029642552674322847] and parameters: {'n_layers': 3, 'embedding_dim': 256, 'lr': 5.2730399319684895e-05, 'lambda_val': 0.012476747309767241, 'batch_size': 2533, 'optimizer': 'SGD'}.
2026-06-20 10:29:09,795 - optuna.study.study - INFO - Trial 16 finished with values: [0.021800921282230157, 0.004720853858784894, 0.012382724113200782] and parameters: {'n_layers': 4, 'embedding_dim': 256, 'lr': 0.00023729211693529712, 'lambda_val': 0.0014313382121311877, 'batch_size': 2012, 'optimizer': 'Adam'}.
2026-06-20 10:32:39,157 - optuna.study.study - INFO - Trial 17 finished with values: [0.02453669124991571, 0.005447139067828724, 0.014205426680565786] and parameters: {'n_layers': 2, 'embedding_dim': 256, 'lr': 0.0003197162451785445, 'lambda_val': 0.005967642770254264, 'batch_size': 1380, 'optimizer': 'RMSprop'}.
2026-06-20 10:33:03,271 - experiment_functions - INFO - Early stopping at epoch 500. Best Metrics: (0.0006220280598642723, 0.0001294682329165088, 0.00031516872926544735)
2026-06-20 10:33:03,354 - optuna.study.study - INFO - Trial 18 finished with values: [0.0006220280598642723, 0.0001294682329165088, 0.00031516872926544735] and parameters: {'n_layers': 4, 'embedding_dim': 64, 'lr': 0.0009946323362761903, 'lambda_val': 0.031175265113582363, 'batch_size': 2229, 'optimizer': 'SGD'}.
2026-06-20 10:33:27,814 - experiment_functions - INFO - Early stopping at epoch 500. Best Metrics: (0.0006065457331690772, 0.0001405203991410888, 0.00036902169429488046)
2026-06-20 10:33:28,806 - optuna.study.study - INFO - Trial 19 finished with values: [0.0006065457331690772, 0.0001405203991410888, 0.00036902169429488046] and parameters: {'n_layers': 2, 'embedding_dim': 128, 'lr': 1.2415190487436248e-05, 'lambda_val': 8.74606106546356e-05, 'batch_size': 2410, 'optimizer': 'RMSprop'}.
2026-06-20 10:35:24,453 - experiment_functions - INFO - Early stopping at epoch 2500. Best Metrics: (0.0006043584553341778, 0.0001499936844764431, 0.0003719496038070915)
2026-06-20 10:35:24,538 - optuna.study.study - INFO - Trial 20 finished with values: [0.0006043584553341778, 0.0001499936844764431, 0.0003719496038070915] and parameters: {'n_layers': 1, 'embedding_dim': 256, 'lr': 0.00013519640271470463, 'lambda_val': 3.0549894793457165e-06, 'batch_size': 1320, 'optimizer': 'RMSprop'}.
2026-06-20 10:36:04,550 - experiment_functions - INFO - Early stopping at epoch 850. Best Metrics: (0.014623674093962239, 0.0031356574460022738, 0.00827074403262509)
2026-06-20 10:36:04,928 - optuna.study.study - INFO - Trial 21 finished with values: [0.014623674093962239, 0.0031356574460022738, 0.00827074403262509] and parameters: {'n_layers': 4, 'embedding_dim': 64, 'lr': 0.0012029727538128135, 'lambda_val': 0.0004242504250406823, 'batch_size': 2384, 'optimizer': 'RMSprop'}.
2026-06-20 10:36:29,242 - experiment_functions - INFO - Early stopping at epoch 500. Best Metrics: (0.0005980821853536381, 0.00012631047113805733, 0.00028940757696287666)
2026-06-20 10:36:29,399 - optuna.study.study - INFO - Trial 22 finished with values: [0.0005980821853536381, 0.00012631047113805733, 0.00028940757696287666] and parameters: {'n_layers': 3, 'embedding_dim': 96, 'lr': 5.0144817119368783e-05, 'lambda_val': 0.018060701500534175, 'batch_size': 3048, 'optimizer': 'SGD'}.
2026-06-20 10:36:58,965 - experiment_functions - INFO - Early stopping at epoch 550. Best Metrics: (0.0071833420549470865, 0.0015409877478843, 0.00401392032713808)
2026-06-20 10:36:59,133 - optuna.study.study - INFO - Trial 23 finished with values: [0.0071833420549470865, 0.0015409877478843, 0.00401392032713808] and parameters: {'n_layers': 4, 'embedding_dim': 128, 'lr': 0.03446074072989, 'lambda_val': 3.2604460826854176e-06, 'batch_size': 596, 'optimizer': 'RMSprop'}.
2026-06-20 10:40:05,042 - optuna.study.study - INFO - Trial 24 finished with values: [0.003597555681455324, 0.0008241758241758242, 0.002143976467525103] and parameters: {'n_layers': 4, 'embedding_dim': 96, 'lr': 0.00011142213189930557, 'lambda_val': 2.4917147940548372e-06, 'batch_size': 860, 'optimizer': 'RMSprop'}.
2026-06-20 10:40:31,710 - experiment_functions - INFO - Early stopping at epoch 550. Best Metrics: (0.008111449345503556, 0.0017983453328280915, 0.004431254739470423)
2026-06-20 10:40:31,794 - optuna.study.study - INFO - Trial 25 finished with values: [0.008111449345503556, 0.0017983453328280915, 0.004431254739470423] and parameters: {'n_layers': 4, 'embedding_dim': 64, 'lr': 0.006719843485367568, 'lambda_val': 5.090598517742677e-05, 'batch_size': 1783, 'optimizer': 'Adam'}.
2026-06-20 10:41:06,925 - experiment_functions - INFO - Early stopping at epoch 800. Best Metrics: (0.0163642467304996, 0.003691423519009726, 0.009048733459018863)
2026-06-20 10:41:06,998 - optuna.study.study - INFO - Trial 26 finished with values: [0.0163642467304996, 0.003691423519009726, 0.009048733459018863] and parameters: {'n_layers': 3, 'embedding_dim': 32, 'lr': 0.0009241097994190195, 'lambda_val': 0.012086938131077505, 'batch_size': 3872, 'optimizer': 'Adam'}.
2026-06-20 10:41:55,643 - experiment_functions - INFO - Early stopping at epoch 1100. Best Metrics: (0.0035677747215790943, 0.0008115447770620183, 0.0019108021288285638)
2026-06-20 10:41:55,725 - optuna.study.study - INFO - Trial 27 finished with values: [0.0035677747215790943, 0.0008115447770620183, 0.0019108021288285638] and parameters: {'n_layers': 3, 'embedding_dim': 64, 'lr': 0.0022478677324906035, 'lambda_val': 0.05389321274241929, 'batch_size': 1135, 'optimizer': 'Adam'}.
2026-06-20 10:42:18,322 - experiment_functions - INFO - Early stopping at epoch 500. Best Metrics: (0.00045753418924213336, 0.00010420613868889732, 0.00027222695084367943)
