2026-06-19 14:13:03,477 - optuna.study.study - INFO - Trial 104 finished with values: [0.02660109327533071, 0.0055687128962991035, 0.014954364856694168] and parameters: {'n_layers': 3, 'embedding_dim': 32, 'lr': 0.0007090431996729071, 'lambda_val': 0.00016834827857066878, 'batch_size': 2003, 'optimizer': 'Adam'}.
2026-06-19 14:13:49,750 - experiment_functions - INFO - Early stopping at epoch 900. Best Metrics: (0.017535544762917007, 0.0038129973474801066, 0.009758515047533773)
2026-06-19 14:13:49,850 - optuna.study.study - INFO - Trial 105 finished with values: [0.017535544762917007, 0.0038129973474801066, 0.009758515047533773] and parameters: {'n_layers': 4, 'embedding_dim': 96, 'lr': 0.0012554021517059172, 'lambda_val': 0.00016834827857066878, 'batch_size': 1351, 'optimizer': 'Adam'}.
