2026-06-17 21:23:19,470 - optuna.study.study - INFO - Trial 268 finished with values: [0.003123741251767222, 0.0007436528988253127, 0.001877250896461815] and parameters: {'n_layers': 3, 'embedding_dim': 64, 'lr': 0.0032052069599508804, 'lambda_val': 0.000105123201052829, 'batch_size': 3749, 'optimizer': 'RMSprop'}.
2026-06-17 21:24:11,910 - experiment_functions - INFO - Early stopping at epoch 1100. Best Metrics: (0.0038661378793973735, 0.0009804850322091704, 0.0024156143112424987)
2026-06-17 21:24:11,988 - optuna.study.study - INFO - Trial 269 finished with values: [0.0038661378793973735, 0.0009804850322091704, 0.0024156143112424987] and parameters: {'n_layers': 4, 'embedding_dim': 128, 'lr': 0.0012702568149946026, 'lambda_val': 8.796328661080472e-05, 'batch_size': 1059, 'optimizer': 'RMSprop'}.
2026-06-17 21:25:12,147 - experiment_functions - INFO - Early stopping at epoch 1500. Best Metrics: (0.0038946103738482095, 0.0008178603006189213, 0.00232822378086719)
2026-06-17 21:25:12,223 - optuna.study.study - INFO - Trial 270 finished with values: [0.0038946103738482095, 0.0008178603006189213, 0.00232822378086719] and parameters: {'n_layers': 1, 'embedding_dim': 64, 'lr': 0.0012702568149946026, 'lambda_val': 0.00010081340740714468, 'batch_size': 1377, 'optimizer': 'RMSprop'}.
2026-06-17 21:26:02,527 - experiment_functions - INFO - Early stopping at epoch 1150. Best Metrics: (0.0032026613241916396, 0.0008036503726158898, 0.002095477922768473)
2026-06-17 21:26:02,605 - optuna.study.study - INFO - Trial 271 finished with values: [0.0032026613241916396, 0.0008036503726158898, 0.002095477922768473] and parameters: {'n_layers': 3, 'embedding_dim': 96, 'lr': 0.0012702568149946026, 'lambda_val': 8.796328661080472e-05, 'batch_size': 1482, 'optimizer': 'Adam'}.
2026-06-17 21:27:22,039 - experiment_functions - INFO - Early stopping at epoch 1850. Best Metrics: (0.0031871238188831796, 0.0007452317797145383, 0.0019145766375746906)
2026-06-17 21:27:22,131 - optuna.study.study - INFO - Trial 272 finished with values: [0.0031871238188831796, 0.0007452317797145383, 0.0019145766375746906] and parameters: {'n_layers': 2, 'embedding_dim': 128, 'lr': 0.0012702568149946026, 'lambda_val': 0.00010081340740714468, 'batch_size': 1059, 'optimizer': 'Adam'}.
2026-06-17 21:29:00,271 - experiment_functions - INFO - Early stopping at epoch 2300. Best Metrics: (0.0006157282260973852, 0.0001468359226979917, 0.0003339442983604466)
2026-06-17 21:29:00,355 - optuna.study.study - INFO - Trial 273 finished with values: [0.0006157282260973852, 0.0001468359226979917, 0.0003339442983604466] and parameters: {'n_layers': 3, 'embedding_dim': 96, 'lr': 1.2287597939345712e-05, 'lambda_val': 0.0012364501785880905, 'batch_size': 3825, 'optimizer': 'Adam'}.
2026-06-17 21:29:31,941 - experiment_functions - INFO - Early stopping at epoch 650. Best Metrics: (0.0032872991377996255, 0.0008525956801818871, 0.002055490692376753)
2026-06-17 21:29:32,035 - optuna.study.study - INFO - Trial 274 finished with values: [0.0032872991377996255, 0.0008525956801818871, 0.002055490692376753] and parameters: {'n_layers': 4, 'embedding_dim': 128, 'lr': 0.005545243953023108, 'lambda_val': 1.3870977953506033e-05, 'batch_size': 806, 'optimizer': 'Adam'}.
2026-06-17 21:31:37,923 - experiment_functions - INFO - Early stopping at epoch 3050. Best Metrics: (0.0007509379948319371, 0.00015315144625489455, 0.0003374451112389953)
2026-06-17 21:31:37,991 - optuna.study.study - INFO - Trial 275 finished with values: [0.0007509379948319371, 0.00015315144625489455, 0.0003374451112389953] and parameters: {'n_layers': 4, 'embedding_dim': 64, 'lr': 4.3864812646182747e-05, 'lambda_val': 1.375614243555729e-06, 'batch_size': 1849, 'optimizer': 'RMSprop'}.
2026-06-17 21:32:14,631 - experiment_functions - INFO - Early stopping at epoch 650. Best Metrics: (0.0033205865728934804, 0.0008289124668435014, 0.0019923183780368036)
2026-06-17 21:32:14,715 - optuna.study.study - INFO - Trial 276 finished with values: [0.0033205865728934804, 0.0008289124668435014, 0.0019923183780368036] and parameters: {'n_layers': 4, 'embedding_dim': 256, 'lr': 0.0036567747130372475, 'lambda_val': 8.796328661080472e-05, 'batch_size': 3850, 'optimizer': 'Adam'}.
2026-06-17 21:33:06,781 - experiment_functions - INFO - Early stopping at epoch 1150. Best Metrics: (0.003321603253151784, 0.0007862826828344071, 0.0021172385372049967)
2026-06-17 21:33:06,923 - optuna.study.study - INFO - Trial 277 finished with values: [0.003321603253151784, 0.0007862826828344071, 0.0021172385372049967] and parameters: {'n_layers': 3, 'embedding_dim': 128, 'lr': 0.0012702568149946026, 'lambda_val': 0.0016301286267653282, 'batch_size': 1059, 'optimizer': 'Adam'}.
2026-06-17 21:35:52,247 - optuna.study.study - INFO - Trial 278 finished with values: [0.0037759200342878867, 0.0009125931539724643, 0.002384779007729401] and parameters: {'n_layers': 4, 'embedding_dim': 64, 'lr': 0.0006032487901238422, 'lambda_val': 3.730490614220649e-06, 'batch_size': 806, 'optimizer': 'Adam'}.
2026-06-17 21:36:45,960 - experiment_functions - INFO - Early stopping at epoch 1150. Best Metrics: (0.0037438930737010664, 0.0009331186055323986, 0.0023901894381903885)
2026-06-17 21:36:46,091 - optuna.study.study - INFO - Trial 279 finished with values: [0.0037438930737010664, 0.0009331186055323986, 0.0023901894381903885] and parameters: {'n_layers': 4, 'embedding_dim': 128, 'lr': 0.0012702568149946026, 'lambda_val': 0.0002814113333569454, 'batch_size': 1377, 'optimizer': 'Adam'}.
2026-06-17 21:37:23,320 - experiment_functions - INFO - Early stopping at epoch 850. Best Metrics: (0.0018973349400713399, 0.0005462927876720979, 0.001229693135882629)
2026-06-17 21:37:23,411 - optuna.study.study - INFO - Trial 280 finished with values: [0.0018973349400713399, 0.0005462927876720979, 0.001229693135882629] and parameters: {'n_layers': 4, 'embedding_dim': 64, 'lr': 0.0036567747130372475, 'lambda_val': 0.05438350307158099, 'batch_size': 1751, 'optimizer': 'RMSprop'}.
2026-06-17 21:38:03,631 - experiment_functions - INFO - Early stopping at epoch 850. Best Metrics: (0.003410845524808858, 0.0009062776304155615, 0.0021020360170643003)
2026-06-17 21:38:03,711 - optuna.study.study - INFO - Trial 281 finished with values: [0.003410845524808858, 0.0009062776304155615, 0.0021020360170643003] and parameters: {'n_layers': 4, 'embedding_dim': 128, 'lr': 0.0032052069599508804, 'lambda_val': 1.3870977953506033e-05, 'batch_size': 806, 'optimizer': 'RMSprop'}.
2026-06-17 21:38:54,980 - experiment_functions - INFO - Early stopping at epoch 1200. Best Metrics: (0.0021554450987201663, 0.0005983958570165468, 0.0014338983611417032)
2026-06-17 21:38:55,051 - optuna.study.study - INFO - Trial 282 finished with values: [0.0021554450987201663, 0.0005983958570165468, 0.0014338983611417032] and parameters: {'n_layers': 4, 'embedding_dim': 64, 'lr': 0.0012329536436234642, 'lambda_val': 0.05025151071304005, 'batch_size': 806, 'optimizer': 'Adam'}.
2026-06-17 21:40:21,122 - experiment_functions - INFO - Early stopping at epoch 2050. Best Metrics: (0.0037029122847405376, 0.0009268030819754959, 0.0024745561700407113)
2026-06-17 21:40:21,226 - optuna.study.study - INFO - Trial 283 finished with values: [0.0037029122847405376, 0.0009268030819754959, 0.0024745561700407113] and parameters: {'n_layers': 4, 'embedding_dim': 64, 'lr': 0.0012702568149946026, 'lambda_val': 0.00010081340740714468, 'batch_size': 806, 'optimizer': 'RMSprop'}.
2026-06-17 21:41:01,422 - experiment_functions - INFO - Early stopping at epoch 850. Best Metrics: (0.0025275198126418186, 0.0006662877352532525, 0.0015547339940565478)
2026-06-17 21:41:01,521 - optuna.study.study - INFO - Trial 284 finished with values: [0.0025275198126418186, 0.0006662877352532525, 0.0015547339940565478] and parameters: {'n_layers': 4, 'embedding_dim': 128, 'lr': 0.0008244869685256396, 'lambda_val': 0.025999491544598453, 'batch_size': 2837, 'optimizer': 'RMSprop'}.
2026-06-17 21:41:44,857 - experiment_functions - INFO - Early stopping at epoch 1000. Best Metrics: (0.0030314459205200883, 0.0007436528988253126, 0.001959649502403339)
2026-06-17 21:41:45,123 - optuna.study.study - INFO - Trial 285 finished with values: [0.0030314459205200883, 0.0007436528988253126, 0.001959649502403339] and parameters: {'n_layers': 4, 'embedding_dim': 64, 'lr': 0.0012702568149946026, 'lambda_val': 0.0069523388896965115, 'batch_size': 806, 'optimizer': 'Adam'}.
2026-06-17 21:42:24,719 - experiment_functions - INFO - Early stopping at epoch 750. Best Metrics: (0.00309923030107399, 0.0008210180623973728, 0.0019667316736121676)
2026-06-17 21:42:24,793 - optuna.study.study - INFO - Trial 286 finished with values: [0.00309923030107399, 0.0008210180623973728, 0.0019667316736121676] and parameters: {'n_layers': 3, 'embedding_dim': 256, 'lr': 0.0015933103817621604, 'lambda_val': 0.000105123201052829, 'batch_size': 3903, 'optimizer': 'RMSprop'}.
2026-06-17 21:42:46,769 - experiment_functions - INFO - Early stopping at epoch 500. Best Metrics: (0.0005622342307700581, 0.00013420487558418593, 0.0003072229468692267)
2026-06-17 21:42:46,857 - optuna.study.study - INFO - Trial 287 finished with values: [0.0005622342307700581, 0.00013420487558418593, 0.0003072229468692267] and parameters: {'n_layers': 2, 'embedding_dim': 64, 'lr': 0.0032052069599508804, 'lambda_val': 0.0003461054400698027, 'batch_size': 806, 'optimizer': 'SGD'}.
2026-06-17 21:43:31,588 - experiment_functions - INFO - Early stopping at epoch 950. Best Metrics: (0.0035361093223815437, 0.0009220664393078187, 0.0022321835800937087)
2026-06-17 21:43:31,670 - optuna.study.study - INFO - Trial 288 finished with values: [0.0035361093223815437, 0.0009220664393078187, 0.0022321835800937087] and parameters: {'n_layers': 4, 'embedding_dim': 128, 'lr': 0.0012702568149946026, 'lambda_val': 8.796328661080472e-05, 'batch_size': 1751, 'optimizer': 'RMSprop'}.
2026-06-17 21:44:07,346 - experiment_functions - INFO - Early stopping at epoch 850. Best Metrics: (0.003756579273398062, 0.0009520651762031074, 0.0023877525195949672)
2026-06-17 21:44:07,483 - optuna.study.study - INFO - Trial 289 finished with values: [0.003756579273398062, 0.0009520651762031074, 0.0023877525195949672] and parameters: {'n_layers': 4, 'embedding_dim': 32, 'lr': 0.0032052069599508804, 'lambda_val': 1.0056306104108845e-05, 'batch_size': 806, 'optimizer': 'RMSprop'}.
2026-06-17 21:45:06,154 - experiment_functions - INFO - Early stopping at epoch 1250. Best Metrics: (0.0035818776465098272, 0.0008983832259694329, 0.002207147666721367)
2026-06-17 21:45:06,239 - optuna.study.study - INFO - Trial 290 finished with values: [0.0035818776465098272, 0.0008983832259694329, 0.002207147666721367] and parameters: {'n_layers': 3, 'embedding_dim': 128, 'lr': 0.0012702568149946026, 'lambda_val': 2.3768863399722796e-06, 'batch_size': 2440, 'optimizer': 'RMSprop'}.
2026-06-17 21:46:18,087 - experiment_functions - INFO - Early stopping at epoch 1650. Best Metrics: (0.0036274454812723995, 0.0008841732979664014, 0.0022871006566178823)
2026-06-17 21:46:18,162 - optuna.study.study - INFO - Trial 291 finished with values: [0.0036274454812723995, 0.0008841732979664014, 0.0022871006566178823] and parameters: {'n_layers': 4, 'embedding_dim': 64, 'lr': 0.0012702568149946026, 'lambda_val': 1.817212576768306e-05, 'batch_size': 1059, 'optimizer': 'Adam'}.
2026-06-17 21:46:43,736 - experiment_functions - INFO - Early stopping at epoch 550. Best Metrics: (0.002371251277872277, 0.0006126057850195781, 0.001585116260252985)
2026-06-17 21:46:43,826 - optuna.study.study - INFO - Trial 292 finished with values: [0.002371251277872277, 0.0006126057850195781, 0.001585116260252985] and parameters: {'n_layers': 4, 'embedding_dim': 64, 'lr': 0.04706249850587503, 'lambda_val': 4.337539728895895e-06, 'batch_size': 1849, 'optimizer': 'RMSprop'}.
2026-06-17 21:47:30,353 - experiment_functions - INFO - Early stopping at epoch 1100. Best Metrics: (0.003254941519685364, 0.0007310218517115069, 0.0020312684662099818)
2026-06-17 21:47:30,434 - optuna.study.study - INFO - Trial 293 finished with values: [0.003254941519685364, 0.0007310218517115069, 0.0020312684662099818] and parameters: {'n_layers': 1, 'embedding_dim': 64, 'lr': 0.0032052069599508804, 'lambda_val': 0.00037637631950452986, 'batch_size': 827, 'optimizer': 'Adam'}.
2026-06-17 21:48:02,405 - experiment_functions - INFO - Early stopping at epoch 700. Best Metrics: (0.003326392609366462, 0.0008162814197296956, 0.0021329159400626675)
2026-06-17 21:48:02,483 - optuna.study.study - INFO - Trial 294 finished with values: [0.003326392609366462, 0.0008162814197296956, 0.0021329159400626675] and parameters: {'n_layers': 4, 'embedding_dim': 64, 'lr': 0.0036567747130372475, 'lambda_val': 0.00040852653324075796, 'batch_size': 827, 'optimizer': 'Adam'}.
2026-06-17 21:49:19,075 - experiment_functions - INFO - Early stopping at epoch 1800. Best Metrics: (0.0031036192658321577, 0.000764178350385247, 0.0020300285344927505)
2026-06-17 21:49:19,160 - optuna.study.study - INFO - Trial 295 finished with values: [0.0031036192658321577, 0.000764178350385247, 0.0020300285344927505] and parameters: {'n_layers': 1, 'embedding_dim': 128, 'lr': 0.0028129992286072946, 'lambda_val': 1.3870977953506033e-05, 'batch_size': 806, 'optimizer': 'RMSprop'}.
2026-06-17 21:51:24,685 - experiment_functions - INFO - Early stopping at epoch 2900. Best Metrics: (0.0006504899426570785, 0.00015315144625489455, 0.0003860580823720353)
2026-06-17 21:51:24,766 - optuna.study.study - INFO - Trial 296 finished with values: [0.0006504899426570785, 0.00015315144625489455, 0.0003860580823720353] and parameters: {'n_layers': 2, 'embedding_dim': 128, 'lr': 3.0225414031236747e-05, 'lambda_val': 8.796328661080472e-05, 'batch_size': 1059, 'optimizer': 'RMSprop'}.
2026-06-17 21:52:54,927 - experiment_functions - INFO - Early stopping at epoch 2200. Best Metrics: (0.0038833428060606402, 0.0008873310597448529, 0.0024698749430126133)
2026-06-17 21:52:55,006 - optuna.study.study - INFO - Trial 297 finished with values: [0.0038833428060606402, 0.0008873310597448529, 0.0024698749430126133] and parameters: {'n_layers': 4, 'embedding_dim': 32, 'lr': 0.0008244869685256396, 'lambda_val': 0.00040852653324075796, 'batch_size': 1377, 'optimizer': 'RMSprop'}.
2026-06-17 21:54:16,348 - experiment_functions - INFO - Early stopping at epoch 1800. Best Metrics: (0.004068342107018011, 0.0010073260073260072, 0.002568048281279271)
2026-06-17 21:54:16,498 - optuna.study.study - INFO - Trial 298 finished with values: [0.004068342107018011, 0.0010073260073260072, 0.002568048281279271] and parameters: {'n_layers': 3, 'embedding_dim': 128, 'lr': 0.0012702568149946026, 'lambda_val': 1.3870977953506033e-05, 'batch_size': 806, 'optimizer': 'RMSprop'}.
2026-06-17 21:55:13,526 - experiment_functions - INFO - Early stopping at epoch 1350. Best Metrics: (0.0035157495611816717, 0.0008383857521788557, 0.0022361378145546763)
2026-06-17 21:55:13,602 - optuna.study.study - INFO - Trial 299 finished with values: [0.0035157495611816717, 0.0008383857521788557, 0.0022361378145546763] and parameters: {'n_layers': 2, 'embedding_dim': 64, 'lr': 0.0012702568149946026, 'lambda_val': 0.000105123201052829, 'batch_size': 1377, 'optimizer': 'RMSprop'}.
2026-06-17 21:55:13,617 - root - INFO - Selected Trial 179 based on Max ndcg: 0.0028
2026-06-17 21:55:13,617 - root - INFO - Associated Recall: 0.0046
2026-06-17 21:55:13,617 - experiment_functions - INFO - Training the best model ... for e_yelp_1c1dcs_strict_rand2
2026-06-17 21:56:33,506 - experiment_functions - INFO - Early stopping at epoch 1950. Best Metrics: (0.004315697248577869, 0.0009631173424276872, 0.002736896807290928)
2026-06-17 21:56:37,267 - root - INFO -   **** Training e_yelp_1c1dcs_strict_rand3
2026-06-17 21:56:37,280 - root - INFO -   **** Getting 34724/1274132 random edges
2026-06-17 21:56:37,380 - optuna.storages._rdb.storage - INFO - A new study created in RDB with name: Study_e_yelp_1c1dcs_strict_rand3
2026-06-17 21:57:37,262 - experiment_functions - INFO - Early stopping at epoch 1300. Best Metrics: (0.003045156306525339, 0.0007357584943791841, 0.0018874026758247341)
2026-06-17 21:57:37,341 - optuna.study.study - INFO - Trial 0 finished with values: [0.003045156306525339, 0.0007357584943791841, 0.0018874026758247341] and parameters: {'n_layers': 3, 'embedding_dim': 128, 'lr': 0.0008996557513210464, 'lambda_val': 0.002003406704760604, 'batch_size': 1842, 'optimizer': 'Adam'}.
2026-06-17 21:57:59,649 - experiment_functions - INFO - Early stopping at epoch 500. Best Metrics: (0.0006698205296300336, 0.00014841480358721736, 0.00036311616352699937)
2026-06-17 21:57:59,743 - optuna.study.study - INFO - Trial 1 finished with values: [0.0006698205296300336, 0.00014841480358721736, 0.00036311616352699937] and parameters: {'n_layers': 1, 'embedding_dim': 64, 'lr': 2.3653368544186697e-05, 'lambda_val': 1.6270591304270666e-06, 'batch_size': 1920, 'optimizer': 'SGD'}.
2026-06-17 21:59:32,458 - experiment_functions - INFO - Early stopping at epoch 2100. Best Metrics: (0.0030373400939176366, 0.0007704938739421498, 0.001973977269044877)
2026-06-17 21:59:32,547 - optuna.study.study - INFO - Trial 2 finished with values: [0.0030373400939176366, 0.0007704938739421498, 0.001973977269044877] and parameters: {'n_layers': 2, 'embedding_dim': 128, 'lr': 0.0009043033415384808, 'lambda_val': 7.431054110368361e-06, 'batch_size': 3359, 'optimizer': 'RMSprop'}.
2026-06-17 21:59:55,876 - experiment_functions - INFO - Early stopping at epoch 500. Best Metrics: (0.0004410917355126504, 0.00010736390046734875, 0.00024920083296243263)
2026-06-17 21:59:55,955 - optuna.study.study - INFO - Trial 3 finished with values: [0.0004410917355126504, 0.00010736390046734875, 0.00024920083296243263] and parameters: {'n_layers': 4, 'embedding_dim': 64, 'lr': 0.002058200336599396, 'lambda_val': 5.1191737952952045e-06, 'batch_size': 2006, 'optimizer': 'SGD'}.
2026-06-17 22:00:30,477 - experiment_functions - INFO - Early stopping at epoch 600. Best Metrics: (0.0029153996091989716, 0.0007925982063913099, 0.0019085642381443104)
2026-06-17 22:00:31,557 - optuna.study.study - INFO - Trial 4 finished with values: [0.0029153996091989716, 0.0007925982063913099, 0.0019085642381443104] and parameters: {'n_layers': 4, 'embedding_dim': 256, 'lr': 0.0026740026612154114, 'lambda_val': 0.0001528536356672561, 'batch_size': 3334, 'optimizer': 'RMSprop'}.
2026-06-17 22:00:58,101 - experiment_functions - INFO - Early stopping at epoch 550. Best Metrics: (0.0004897834908751678, 0.00011525830491347732, 0.0002482496615107272)
2026-06-17 22:00:58,194 - optuna.study.study - INFO - Trial 5 finished with values: [0.0004897834908751678, 0.00011525830491347732, 0.0002482496615107272] and parameters: {'n_layers': 3, 'embedding_dim': 128, 'lr': 0.0028203317193805327, 'lambda_val': 1.2774282640229279e-05, 'batch_size': 2243, 'optimizer': 'SGD'}.
2026-06-17 22:01:24,102 - experiment_functions - INFO - Early stopping at epoch 550. Best Metrics: (0.0019322330038973223, 0.0005368195023367437, 0.001245139391825353)
2026-06-17 22:01:24,221 - optuna.study.study - INFO - Trial 6 finished with values: [0.0019322330038973223, 0.0005368195023367437, 0.001245139391825353] and parameters: {'n_layers': 3, 'embedding_dim': 96, 'lr': 0.008107165242654268, 'lambda_val': 0.006515462622238777, 'batch_size': 2263, 'optimizer': 'RMSprop'}.
2026-06-17 22:01:47,433 - experiment_functions - INFO - Early stopping at epoch 500. Best Metrics: (0.0004702982849222324, 0.00012157382847038019, 0.00024286566894593997)
2026-06-17 22:01:47,523 - optuna.study.study - INFO - Trial 7 finished with values: [0.0004702982849222324, 0.00012157382847038019, 0.00024286566894593997] and parameters: {'n_layers': 2, 'embedding_dim': 96, 'lr': 0.04754239347856081, 'lambda_val': 6.696393236973679e-06, 'batch_size': 3360, 'optimizer': 'SGD'}.
2026-06-17 22:02:25,058 - experiment_functions - INFO - Early stopping at epoch 900. Best Metrics: (0.0037118985272950465, 0.0007657572312744728, 0.002342285965404017)
2026-06-17 22:02:25,138 - optuna.study.study - INFO - Trial 8 finished with values: [0.0037118985272950465, 0.0007657572312744728, 0.002342285965404017] and parameters: {'n_layers': 1, 'embedding_dim': 32, 'lr': 0.0023699548585448013, 'lambda_val': 2.2322765995099733e-06, 'batch_size': 600, 'optimizer': 'Adam'}.
2026-06-17 22:02:47,519 - experiment_functions - INFO - Early stopping at epoch 500. Best Metrics: (0.00043025308556251965, 0.00011367942402425163, 0.00026022925788145665)
2026-06-17 22:02:47,611 - optuna.study.study - INFO - Trial 9 finished with values: [0.00043025308556251965, 0.00011367942402425163, 0.00026022925788145665] and parameters: {'n_layers': 1, 'embedding_dim': 64, 'lr': 0.0026455312204392914, 'lambda_val': 0.06933347969471532, 'batch_size': 526, 'optimizer': 'SGD'}.
2026-06-17 22:03:10,253 - experiment_functions - INFO - Early stopping at epoch 500. Best Metrics: (0.00040893155995855545, 8.525956801818872e-05, 0.00020937256891028058)
2026-06-17 22:03:10,338 - optuna.study.study - INFO - Trial 10 finished with values: [0.00040893155995855545, 8.525956801818872e-05, 0.00020937256891028058] and parameters: {'n_layers': 1, 'embedding_dim': 96, 'lr': 0.00039144858720015766, 'lambda_val': 0.001683375750891558, 'batch_size': 3678, 'optimizer': 'SGD'}.
2026-06-17 22:03:38,879 - experiment_functions - INFO - Early stopping at epoch 500. Best Metrics: (0.000481365149956176, 0.00011683718580270305, 0.0002761199683362189)
2026-06-17 22:03:38,958 - optuna.study.study - INFO - Trial 11 finished with values: [0.000481365149956176, 0.00011683718580270305, 0.0002761199683362189] and parameters: {'n_layers': 4, 'embedding_dim': 256, 'lr': 0.00017904853248839535, 'lambda_val': 0.002768924660975095, 'batch_size': 2223, 'optimizer': 'SGD'}.
2026-06-17 22:04:02,001 - experiment_functions - INFO - Early stopping at epoch 500. Best Metrics: (0.0006494799376313762, 0.00012315270935960593, 0.0003150294843586088)
