2026-06-19 09:19:54,947 - optuna.study.study - INFO - Trial 165 finished with values: [0.03383183352515242, 0.007120752810407983, 0.019183034134449745] and parameters: {'n_layers': 1, 'embedding_dim': 96, 'lr': 0.0008520784697548674, 'lambda_val': 1.3063371603281255e-06, 'batch_size': 3739, 'optimizer': 'RMSprop'}.
2026-06-19 09:20:33,983 - experiment_functions - INFO - Early stopping at epoch 750. Best Metrics: (0.009523508603793645, 0.002152014652014652, 0.005252173504019663)
2026-06-19 09:20:34,411 - optuna.study.study - INFO - Trial 166 finished with values: [0.009523508603793645, 0.002152014652014652, 0.005252173504019663] and parameters: {'n_layers': 4, 'embedding_dim': 96, 'lr': 0.0008520784697548674, 'lambda_val': 0.00854510130589444, 'batch_size': 1574, 'optimizer': 'RMSprop'}.
2026-06-19 09:22:12,016 - experiment_functions - INFO - Early stopping at epoch 1500. Best Metrics: (0.016962994592833482, 0.0036961601616774032, 0.009431258203862774)
2026-06-19 09:22:12,105 - optuna.study.study - INFO - Trial 167 finished with values: [0.016962994592833482, 0.0036961601616774032, 0.009431258203862774] and parameters: {'n_layers': 4, 'embedding_dim': 256, 'lr': 0.00020897019229325828, 'lambda_val': 0.006230745660801204, 'batch_size': 3874, 'optimizer': 'RMSprop'}.
2026-06-19 09:23:16,869 - experiment_functions - INFO - Early stopping at epoch 1350. Best Metrics: (0.028682628586590334, 0.005903435644814955, 0.016513888081839047)
2026-06-19 09:23:16,959 - optuna.study.study - INFO - Trial 168 finished with values: [0.028682628586590334, 0.005903435644814955, 0.016513888081839047] and parameters: {'n_layers': 2, 'embedding_dim': 96, 'lr': 0.001237222476168443, 'lambda_val': 1.1042104634029595e-06, 'batch_size': 1875, 'optimizer': 'Adam'}.
2026-06-19 09:26:38,737 - optuna.study.study - INFO - Trial 169 finished with values: [0.025468766950604235, 0.005497663256283946, 0.014442965504107369] and parameters: {'n_layers': 3, 'embedding_dim': 128, 'lr': 0.00026546551712757383, 'lambda_val': 7.169103823221734e-06, 'batch_size': 2334, 'optimizer': 'RMSprop'}.
2026-06-19 09:28:16,879 - experiment_functions - INFO - Early stopping at epoch 2000. Best Metrics: (0.028393351238386464, 0.005886067955033472, 0.0162331210304759)
2026-06-19 09:28:16,969 - optuna.study.study - INFO - Trial 170 finished with values: [0.028393351238386464, 0.005886067955033472, 0.0162331210304759] and parameters: {'n_layers': 2, 'embedding_dim': 128, 'lr': 0.000670518483727842, 'lambda_val': 1.3063371603281255e-06, 'batch_size': 3743, 'optimizer': 'Adam'}.
2026-06-19 09:28:54,863 - experiment_functions - INFO - Early stopping at epoch 750. Best Metrics: (0.021427311698933308, 0.004567702412529999, 0.011730626780471048)
2026-06-19 09:28:54,969 - optuna.study.study - INFO - Trial 171 finished with values: [0.021427311698933308, 0.004567702412529999, 0.011730626780471048] and parameters: {'n_layers': 2, 'embedding_dim': 128, 'lr': 0.0013485218163115024, 'lambda_val': 1.5236318044232254e-06, 'batch_size': 2427, 'optimizer': 'RMSprop'}.
2026-06-19 09:30:12,763 - experiment_functions - INFO - Early stopping at epoch 1700. Best Metrics: (0.0005411564414681113, 0.0001294682329165088, 0.000275775668177437)
2026-06-19 09:30:12,853 - optuna.study.study - INFO - Trial 172 finished with values: [0.0005411564414681113, 0.0001294682329165088, 0.000275775668177437] and parameters: {'n_layers': 1, 'embedding_dim': 128, 'lr': 0.00015532243414060967, 'lambda_val': 0.0001469242914477015, 'batch_size': 1987, 'optimizer': 'Adam'}.
2026-06-19 09:31:02,789 - experiment_functions - INFO - Early stopping at epoch 900. Best Metrics: (0.01839294862981449, 0.003931413414172035, 0.01018161795951357)
2026-06-19 09:31:02,877 - optuna.study.study - INFO - Trial 173 finished with values: [0.01839294862981449, 0.003931413414172035, 0.01018161795951357] and parameters: {'n_layers': 4, 'embedding_dim': 128, 'lr': 0.000670518483727842, 'lambda_val': 0.0001469242914477015, 'batch_size': 2334, 'optimizer': 'RMSprop'}.
2026-06-19 09:31:29,310 - experiment_functions - INFO - Early stopping at epoch 500. Best Metrics: (0.0005277040182904558, 0.00011052166224580017, 0.0002795791048511333)
2026-06-19 09:31:29,398 - optuna.study.study - INFO - Trial 174 finished with values: [0.0005277040182904558, 0.00011052166224580017, 0.0002795791048511333] and parameters: {'n_layers': 3, 'embedding_dim': 96, 'lr': 9.12269898482075e-05, 'lambda_val': 0.007073096495762783, 'batch_size': 3743, 'optimizer': 'Adam'}.
2026-06-19 09:33:59,438 - experiment_functions - INFO - Early stopping at epoch 3050. Best Metrics: (0.0292684001880495, 0.0060707970190728815, 0.016487032184807408)
2026-06-19 09:33:59,526 - optuna.study.study - INFO - Trial 175 finished with values: [0.0292684001880495, 0.0060707970190728815, 0.016487032184807408] and parameters: {'n_layers': 2, 'embedding_dim': 128, 'lr': 0.000670518483727842, 'lambda_val': 1.5236318044232254e-06, 'batch_size': 2567, 'optimizer': 'Adam'}.
2026-06-19 09:35:35,094 - experiment_functions - INFO - Early stopping at epoch 2000. Best Metrics: (0.02964325903799555, 0.006298155867121384, 0.01675441417696451)
2026-06-19 09:35:35,203 - optuna.study.study - INFO - Trial 176 finished with values: [0.02964325903799555, 0.006298155867121384, 0.01675441417696451] and parameters: {'n_layers': 2, 'embedding_dim': 96, 'lr': 0.000670518483727842, 'lambda_val': 2.005340661981191e-05, 'batch_size': 2168, 'optimizer': 'Adam'}.
2026-06-19 09:36:48,637 - experiment_functions - INFO - Early stopping at epoch 1450. Best Metrics: (0.020380819555576492, 0.004768220285461665, 0.011504114506544027)
2026-06-19 09:36:48,733 - optuna.study.study - INFO - Trial 177 finished with values: [0.020380819555576492, 0.004768220285461665, 0.011504114506544027] and parameters: {'n_layers': 1, 'embedding_dim': 256, 'lr': 0.0008520784697548674, 'lambda_val': 0.017494257309708012, 'batch_size': 1264, 'optimizer': 'RMSprop'}.
2026-06-19 09:37:58,428 - experiment_functions - INFO - Early stopping at epoch 1500. Best Metrics: (0.02391878180171665, 0.00540766704559808, 0.0138226652889606)
2026-06-19 09:37:58,525 - optuna.study.study - INFO - Trial 178 finished with values: [0.02391878180171665, 0.00540766704559808, 0.0138226652889606] and parameters: {'n_layers': 1, 'embedding_dim': 128, 'lr': 0.0008520784697548674, 'lambda_val': 0.015452769230831364, 'batch_size': 1839, 'optimizer': 'RMSprop'}.
2026-06-19 09:38:32,006 - experiment_functions - INFO - Early stopping at epoch 700. Best Metrics: (0.02863263121262033, 0.00604553492484527, 0.01638731847696042)
2026-06-19 09:38:32,113 - optuna.study.study - INFO - Trial 179 finished with values: [0.02863263121262033, 0.00604553492484527, 0.01638731847696042] and parameters: {'n_layers': 1, 'embedding_dim': 64, 'lr': 0.0045010260516877044, 'lambda_val': 0.0001469242914477015, 'batch_size': 3739, 'optimizer': 'Adam'}.
2026-06-19 09:38:59,262 - experiment_functions - INFO - Early stopping at epoch 550. Best Metrics: (0.011357138908526658, 0.002459896425413667, 0.00620829231287877)
2026-06-19 09:38:59,354 - optuna.study.study - INFO - Trial 180 finished with values: [0.011357138908526658, 0.002459896425413667, 0.00620829231287877] and parameters: {'n_layers': 4, 'embedding_dim': 32, 'lr': 0.007918659350141476, 'lambda_val': 2.005340661981191e-05, 'batch_size': 2567, 'optimizer': 'Adam'}.
2026-06-19 09:39:29,058 - experiment_functions - INFO - Early stopping at epoch 550. Best Metrics: (0.0005358945255956336, 0.00012473159024883163, 0.0003073051256383502)
2026-06-19 09:39:29,156 - optuna.study.study - INFO - Trial 181 finished with values: [0.0005358945255956336, 0.00012473159024883163, 0.0003073051256383502] and parameters: {'n_layers': 1, 'embedding_dim': 256, 'lr': 2.38024412297293e-05, 'lambda_val': 0.0003743444509143199, 'batch_size': 3127, 'optimizer': 'Adam'}.
2026-06-19 09:39:55,571 - experiment_functions - INFO - Early stopping at epoch 550. Best Metrics: (0.004399464031538451, 0.0009694328659845902, 0.002377903003397829)
2026-06-19 09:39:55,657 - optuna.study.study - INFO - Trial 182 finished with values: [0.004399464031538451, 0.0009694328659845902, 0.002377903003397829] and parameters: {'n_layers': 2, 'embedding_dim': 64, 'lr': 0.006551893413620945, 'lambda_val': 0.014193031414069697, 'batch_size': 1800, 'optimizer': 'RMSprop'}.
2026-06-19 09:40:21,938 - experiment_functions - INFO - Early stopping at epoch 550. Best Metrics: (0.005186213083850413, 0.0011288998357963874, 0.0029617621247913133)
2026-06-19 09:40:22,040 - optuna.study.study - INFO - Trial 183 finished with values: [0.005186213083850413, 0.0011288998357963874, 0.0029617621247913133] and parameters: {'n_layers': 2, 'embedding_dim': 64, 'lr': 0.09962299329524602, 'lambda_val': 2.005340661981191e-05, 'batch_size': 3024, 'optimizer': 'Adam'}.
2026-06-19 09:40:50,726 - experiment_functions - INFO - Early stopping at epoch 500. Best Metrics: (0.00048802572919978503, 0.00010736390046734874, 0.0002516367713866498)
2026-06-19 09:40:50,818 - optuna.study.study - INFO - Trial 184 finished with values: [0.00048802572919978503, 0.00010736390046734874, 0.0002516367713866498] and parameters: {'n_layers': 2, 'embedding_dim': 256, 'lr': 0.0008520784697548674, 'lambda_val': 4.652725797139409e-06, 'batch_size': 3370, 'optimizer': 'SGD'}.
2026-06-19 09:44:02,705 - optuna.study.study - INFO - Trial 185 finished with values: [0.02927167839417382, 0.006171845395983328, 0.016824644342443] and parameters: {'n_layers': 2, 'embedding_dim': 128, 'lr': 0.000670518483727842, 'lambda_val': 1.5236318044232254e-06, 'batch_size': 1593, 'optimizer': 'RMSprop'}.
2026-06-19 09:44:29,390 - experiment_functions - INFO - Early stopping at epoch 500. Best Metrics: (0.00060108907201839, 0.0001278893520272831, 0.0003328798875541829)
2026-06-19 09:44:29,465 - optuna.study.study - INFO - Trial 186 finished with values: [0.00060108907201839, 0.0001278893520272831, 0.0003328798875541829] and parameters: {'n_layers': 4, 'embedding_dim': 96, 'lr': 0.00020897019229325828, 'lambda_val': 3.131845581451586e-06, 'batch_size': 2334, 'optimizer': 'SGD'}.
2026-06-19 09:45:03,941 - experiment_functions - INFO - Early stopping at epoch 650. Best Metrics: (0.019263187941071236, 0.004157193381331313, 0.010946156856501497)
2026-06-19 09:45:04,050 - optuna.study.study - INFO - Trial 187 finished with values: [0.019263187941071236, 0.004157193381331313, 0.010946156856501497] and parameters: {'n_layers': 3, 'embedding_dim': 128, 'lr': 0.0020290919563790725, 'lambda_val': 0.00016441753664921447, 'batch_size': 1875, 'optimizer': 'Adam'}.
2026-06-19 09:48:06,391 - optuna.study.study - INFO - Trial 188 finished with values: [0.033611693480274006, 0.006940760389036252, 0.01912217509357461] and parameters: {'n_layers': 1, 'embedding_dim': 128, 'lr': 0.0008520784697548674, 'lambda_val': 7.169103823221734e-06, 'batch_size': 1875, 'optimizer': 'RMSprop'}.
2026-06-19 09:48:55,296 - experiment_functions - INFO - Early stopping at epoch 950. Best Metrics: (0.018649828462725906, 0.0038603637741568774, 0.010502669483742363)
2026-06-19 09:48:55,373 - optuna.study.study - INFO - Trial 189 finished with values: [0.018649828462725906, 0.0038603637741568774, 0.010502669483742363] and parameters: {'n_layers': 1, 'embedding_dim': 256, 'lr': 0.004090131182925344, 'lambda_val': 4.652725797139409e-06, 'batch_size': 3743, 'optimizer': 'RMSprop'}.
2026-06-19 09:49:43,819 - experiment_functions - INFO - Early stopping at epoch 850. Best Metrics: (0.0222066247833251, 0.004828217759252242, 0.012531611129791044)
2026-06-19 09:49:43,908 - optuna.study.study - INFO - Trial 190 finished with values: [0.0222066247833251, 0.004828217759252242, 0.012531611129791044] and parameters: {'n_layers': 2, 'embedding_dim': 256, 'lr': 0.0008520784697548674, 'lambda_val': 0.0023217792752353666, 'batch_size': 1839, 'optimizer': 'RMSprop'}.
2026-06-19 09:50:13,962 - experiment_functions - INFO - Early stopping at epoch 650. Best Metrics: (0.026463728599954505, 0.005633447012757357, 0.015463671253189178)
2026-06-19 09:50:14,040 - optuna.study.study - INFO - Trial 191 finished with values: [0.026463728599954505, 0.005633447012757357, 0.015463671253189178] and parameters: {'n_layers': 1, 'embedding_dim': 32, 'lr': 0.007918659350141476, 'lambda_val': 1.1042104634029595e-06, 'batch_size': 2567, 'optimizer': 'Adam'}.
2026-06-19 09:50:43,573 - experiment_functions - INFO - Early stopping at epoch 600. Best Metrics: (0.02114248212418795, 0.004611911077428319, 0.012253590719475098)
2026-06-19 09:50:43,646 - optuna.study.study - INFO - Trial 192 finished with values: [0.02114248212418795, 0.004611911077428319, 0.012253590719475098] and parameters: {'n_layers': 1, 'embedding_dim': 128, 'lr': 0.00875508308708224, 'lambda_val': 7.169103823221734e-06, 'batch_size': 1875, 'optimizer': 'Adam'}.
2026-06-19 09:51:18,171 - experiment_functions - INFO - Early stopping at epoch 650. Best Metrics: (0.019979170482852155, 0.004289819376026272, 0.011112606614363594)
2026-06-19 09:51:18,409 - optuna.study.study - INFO - Trial 193 finished with values: [0.019979170482852155, 0.004289819376026272, 0.011112606614363594] and parameters: {'n_layers': 3, 'embedding_dim': 128, 'lr': 0.0020290919563790725, 'lambda_val': 7.169103823221734e-06, 'batch_size': 1875, 'optimizer': 'Adam'}.
2026-06-19 09:52:27,478 - experiment_functions - INFO - Early stopping at epoch 1400. Best Metrics: (0.028117589294001103, 0.005955538714159403, 0.015963825215945388)
2026-06-19 09:52:27,583 - optuna.study.study - INFO - Trial 194 finished with values: [0.028117589294001103, 0.005955538714159403, 0.015963825215945388] and parameters: {'n_layers': 2, 'embedding_dim': 128, 'lr': 0.000670518483727842, 'lambda_val': 0.0001228083366977069, 'batch_size': 1819, 'optimizer': 'RMSprop'}.
2026-06-19 09:56:05,419 - optuna.study.study - INFO - Trial 195 finished with values: [0.020591507929156164, 0.004724011620563346, 0.011848242230231931] and parameters: {'n_layers': 2, 'embedding_dim': 256, 'lr': 0.00020897019229325828, 'lambda_val': 0.00854510130589444, 'batch_size': 3743, 'optimizer': 'RMSprop'}.
2026-06-19 09:56:48,798 - experiment_functions - INFO - Early stopping at epoch 900. Best Metrics: (0.02741099883911168, 0.005892383478590376, 0.01580324055118688)
2026-06-19 09:56:48,878 - optuna.study.study - INFO - Trial 196 finished with values: [0.02741099883911168, 0.005892383478590376, 0.01580324055118688] and parameters: {'n_layers': 2, 'embedding_dim': 64, 'lr': 0.0013485218163115024, 'lambda_val': 2.005340661981191e-05, 'batch_size': 2427, 'optimizer': 'Adam'}.
2026-06-19 09:58:05,414 - experiment_functions - INFO - Early stopping at epoch 1650. Best Metrics: (0.032406249909715815, 0.006639194139194139, 0.018353043482218875)
2026-06-19 09:58:05,491 - optuna.study.study - INFO - Trial 197 finished with values: [0.032406249909715815, 0.006639194139194139, 0.018353043482218875] and parameters: {'n_layers': 1, 'embedding_dim': 96, 'lr': 0.0020290919563790725, 'lambda_val': 1.1042104634029595e-06, 'batch_size': 1875, 'optimizer': 'Adam'}.
2026-06-19 09:58:40,326 - experiment_functions - INFO - Early stopping at epoch 550. Best Metrics: (0.005208536151553681, 0.0011794240242516106, 0.0030139105412596294)
2026-06-19 09:58:40,887 - optuna.study.study - INFO - Trial 198 finished with values: [0.005208536151553681, 0.0011794240242516106, 0.0030139105412596294] and parameters: {'n_layers': 3, 'embedding_dim': 256, 'lr': 0.08887508312944267, 'lambda_val': 7.46585453630634e-05, 'batch_size': 2567, 'optimizer': 'RMSprop'}.
2026-06-19 09:59:23,656 - experiment_functions - INFO - Early stopping at epoch 950. Best Metrics: (0.014668563883866347, 0.0031861816344574963, 0.008343147304765076)
2026-06-19 09:59:23,733 - optuna.study.study - INFO - Trial 199 finished with values: [0.014668563883866347, 0.0031861816344574963, 0.008343147304765076] and parameters: {'n_layers': 1, 'embedding_dim': 32, 'lr': 0.007918659350141476, 'lambda_val': 2.005340661981191e-05, 'batch_size': 3743, 'optimizer': 'RMSprop'}.
2026-06-19 10:00:04,909 - experiment_functions - INFO - Early stopping at epoch 700. Best Metrics: (0.023470160226552496, 0.004971895920171783, 0.013248298035172535)
2026-06-19 10:00:05,022 - optuna.study.study - INFO - Trial 200 finished with values: [0.023470160226552496, 0.004971895920171783, 0.013248298035172535] and parameters: {'n_layers': 2, 'embedding_dim': 256, 'lr': 0.0020290919563790725, 'lambda_val': 0.0001936561537619466, 'batch_size': 1875, 'optimizer': 'Adam'}.
2026-06-19 10:00:31,715 - experiment_functions - INFO - Early stopping at epoch 550. Best Metrics: (0.013335132996230969, 0.002881457622836933, 0.007303461216314711)
2026-06-19 10:00:31,805 - optuna.study.study - INFO - Trial 201 finished with values: [0.013335132996230969, 0.002881457622836933, 0.007303461216314711] and parameters: {'n_layers': 3, 'embedding_dim': 32, 'lr': 0.007918659350141476, 'lambda_val': 0.0007436169951113747, 'batch_size': 2567, 'optimizer': 'Adam'}.
2026-06-19 10:01:32,676 - experiment_functions - INFO - Early stopping at epoch 1250. Best Metrics: (0.02839107222106019, 0.005900277883036505, 0.015936813404338956)
2026-06-19 10:01:32,756 - optuna.study.study - INFO - Trial 202 finished with values: [0.02839107222106019, 0.005900277883036505, 0.015936813404338956] and parameters: {'n_layers': 2, 'embedding_dim': 96, 'lr': 0.0008520784697548674, 'lambda_val': 0.0001469242914477015, 'batch_size': 3743, 'optimizer': 'Adam'}.
2026-06-19 10:04:39,653 - optuna.study.study - INFO - Trial 203 finished with values: [0.03465078186175682, 0.007149172666414047, 0.01974820109561095] and parameters: {'n_layers': 1, 'embedding_dim': 128, 'lr': 0.0008520784697548674, 'lambda_val': 1.5236318044232254e-06, 'batch_size': 2567, 'optimizer': 'RMSprop'}.
2026-06-19 10:07:38,895 - optuna.study.study - INFO - Trial 204 finished with values: [0.03213852506263645, 0.006743400277883038, 0.018648204403939515] and parameters: {'n_layers': 1, 'embedding_dim': 64, 'lr': 0.0013485218163115024, 'lambda_val': 0.0003743444509143199, 'batch_size': 2567, 'optimizer': 'Adam'}.
2026-06-19 10:08:15,025 - experiment_functions - INFO - Early stopping at epoch 750. Best Metrics: (0.024900424112797144, 0.005413982569154982, 0.014214655749629528)
2026-06-19 10:08:15,989 - optuna.study.study - INFO - Trial 205 finished with values: [0.024900424112797144, 0.005413982569154982, 0.014214655749629528] and parameters: {'n_layers': 2, 'embedding_dim': 64, 'lr': 0.0020290919563790725, 'lambda_val': 0.0003743444509143199, 'batch_size': 2326, 'optimizer': 'Adam'}.
2026-06-19 10:09:02,608 - experiment_functions - INFO - Early stopping at epoch 1000. Best Metrics: (0.020584271653101383, 0.004738221548566376, 0.011293773743030111)
2026-06-19 10:09:02,694 - optuna.study.study - INFO - Trial 206 finished with values: [0.020584271653101383, 0.004738221548566376, 0.011293773743030111] and parameters: {'n_layers': 1, 'embedding_dim': 96, 'lr': 0.0013485218163115024, 'lambda_val': 0.028835693333857722, 'batch_size': 2326, 'optimizer': 'Adam'}.
2026-06-19 10:10:13,886 - experiment_functions - INFO - Early stopping at epoch 1450. Best Metrics: (0.016233171261884546, 0.00344669698117974, 0.00879027185786269)
2026-06-19 10:10:13,970 - optuna.study.study - INFO - Trial 207 finished with values: [0.016233171261884546, 0.00344669698117974, 0.00879027185786269] and parameters: {'n_layers': 2, 'embedding_dim': 128, 'lr': 0.0020290919563790725, 'lambda_val': 7.169103823221734e-06, 'batch_size': 1875, 'optimizer': 'RMSprop'}.
2026-06-19 10:13:06,355 - optuna.study.study - INFO - Trial 208 finished with values: [0.0265070842448588, 0.005777125173676898, 0.015519771325285482] and parameters: {'n_layers': 1, 'embedding_dim': 32, 'lr': 0.000670518483727842, 'lambda_val': 0.0003743444509143199, 'batch_size': 2168, 'optimizer': 'RMSprop'}.
2026-06-19 10:13:53,166 - experiment_functions - INFO - Early stopping at epoch 950. Best Metrics: (0.02726557631417565, 0.005799229506126058, 0.016087704950584886)
2026-06-19 10:13:53,262 - optuna.study.study - INFO - Trial 209 finished with values: [0.02726557631417565, 0.005799229506126058, 0.016087704950584886] and parameters: {'n_layers': 2, 'embedding_dim': 96, 'lr': 0.001237222476168443, 'lambda_val': 1.1042104634029595e-06, 'batch_size': 1875, 'optimizer': 'Adam'}.
2026-06-19 10:14:30,471 - experiment_functions - INFO - Early stopping at epoch 750. Best Metrics: (0.023164560196965406, 0.005224516862447897, 0.013138185124925433)
2026-06-19 10:14:30,558 - optuna.study.study - INFO - Trial 210 finished with values: [0.023164560196965406, 0.005224516862447897, 0.013138185124925433] and parameters: {'n_layers': 1, 'embedding_dim': 128, 'lr': 0.0025726585227239724, 'lambda_val': 0.010185354073412941, 'batch_size': 2567, 'optimizer': 'Adam'}.
2026-06-19 10:17:31,007 - optuna.study.study - INFO - Trial 211 finished with values: [0.032866460640516744, 0.006891815081470254, 0.018662063267574653] and parameters: {'n_layers': 1, 'embedding_dim': 64, 'lr': 0.0008520784697548674, 'lambda_val': 0.0003743444509143199, 'batch_size': 2326, 'optimizer': 'RMSprop'}.
2026-06-19 10:18:12,473 - experiment_functions - INFO - Early stopping at epoch 900. Best Metrics: (0.025778082840813118, 0.005616079322975876, 0.014538620434803785)
2026-06-19 10:18:13,022 - optuna.study.study - INFO - Trial 212 finished with values: [0.025778082840813118, 0.005616079322975876, 0.014538620434803785] and parameters: {'n_layers': 1, 'embedding_dim': 32, 'lr': 0.0020290919563790725, 'lambda_val': 0.010701553574909452, 'batch_size': 2567, 'optimizer': 'Adam'}.
2026-06-19 10:18:57,390 - experiment_functions - INFO - Early stopping at epoch 900. Best Metrics: (0.029621210073919102, 0.006236579512441581, 0.01702390277736368)
