2026-06-19 04:11:56,961 - optuna.study.study - INFO - Trial 225 finished with values: [0.019408949846345634, 0.004100353669319187, 0.010808374931682765] and parameters: {'n_layers': 4, 'embedding_dim': 256, 'lr': 0.000870520171613823, 'lambda_val': 1.356629670066784e-05, 'batch_size': 2155, 'optimizer': 'Adam'}.
2026-06-19 04:12:29,771 - experiment_functions - INFO - Early stopping at epoch 650. Best Metrics: (0.024073570108341696, 0.0052671466464569916, 0.013797742682626709)
2026-06-19 04:12:29,871 - optuna.study.study - INFO - Trial 226 finished with values: [0.024073570108341696, 0.0052671466464569916, 0.013797742682626709] and parameters: {'n_layers': 2, 'embedding_dim': 128, 'lr': 0.00265047718248758, 'lambda_val': 0.0007604153797437305, 'batch_size': 2685, 'optimizer': 'Adam'}.
2026-06-19 04:15:29,307 - optuna.study.study - INFO - Trial 227 finished with values: [0.02625750903241053, 0.005775546292787673, 0.015268535766924718] and parameters: {'n_layers': 1, 'embedding_dim': 128, 'lr': 0.0010493496509530146, 'lambda_val': 8.339990428440081e-05, 'batch_size': 571, 'optimizer': 'Adam'}.
2026-06-19 04:15:59,589 - experiment_functions - INFO - Early stopping at epoch 650. Best Metrics: (0.023530075655956523, 0.005088733105974486, 0.013389046934459529)
2026-06-19 04:15:59,691 - optuna.study.study - INFO - Trial 228 finished with values: [0.023530075655956523, 0.005088733105974486, 0.013389046934459529] and parameters: {'n_layers': 2, 'embedding_dim': 32, 'lr': 0.003327615910950817, 'lambda_val': 5.034815386429636e-06, 'batch_size': 2712, 'optimizer': 'Adam'}.
2026-06-19 04:19:01,377 - optuna.study.study - INFO - Trial 229 finished with values: [0.02841478611343691, 0.00620026525198939, 0.016509299445295965] and parameters: {'n_layers': 1, 'embedding_dim': 128, 'lr': 0.000870520171613823, 'lambda_val': 0.003077942483029095, 'batch_size': 1184, 'optimizer': 'Adam'}.
2026-06-19 04:20:47,392 - experiment_functions - INFO - Early stopping at epoch 2400. Best Metrics: (0.0326117844705876, 0.0068412908930150325, 0.018727004618167623)
2026-06-19 04:20:47,500 - optuna.study.study - INFO - Trial 230 finished with values: [0.0326117844705876, 0.0068412908930150325, 0.018727004618167623] and parameters: {'n_layers': 1, 'embedding_dim': 64, 'lr': 0.0012134658370028314, 'lambda_val': 1.0485161698673561e-06, 'batch_size': 2499, 'optimizer': 'Adam'}.
2026-06-19 04:21:28,127 - experiment_functions - INFO - Early stopping at epoch 900. Best Metrics: (0.030545265099754387, 0.006377099911582671, 0.0173423823027617)
2026-06-19 04:21:28,226 - optuna.study.study - INFO - Trial 231 finished with values: [0.030545265099754387, 0.006377099911582671, 0.0173423823027617] and parameters: {'n_layers': 1, 'embedding_dim': 32, 'lr': 0.003327615910950817, 'lambda_val': 4.824681967841972e-06, 'batch_size': 3514, 'optimizer': 'Adam'}.
2026-06-19 04:22:27,491 - experiment_functions - INFO - Early stopping at epoch 1300. Best Metrics: (0.0005454643145297342, 0.00013262599469496023, 0.0003296698228009848)
2026-06-19 04:22:27,585 - optuna.study.study - INFO - Trial 232 finished with values: [0.0005454643145297342, 0.00013262599469496023, 0.0003296698228009848] and parameters: {'n_layers': 1, 'embedding_dim': 128, 'lr': 1.0752286534908354e-05, 'lambda_val': 0.0008294227855036249, 'batch_size': 3284, 'optimizer': 'Adam'}.
2026-06-19 04:23:13,486 - experiment_functions - INFO - Early stopping at epoch 800. Best Metrics: (0.02343980710716848, 0.00494347606416572, 0.013219362226671187)
2026-06-19 04:23:13,574 - optuna.study.study - INFO - Trial 233 finished with values: [0.02343980710716848, 0.00494347606416572, 0.013219362226671187] and parameters: {'n_layers': 2, 'embedding_dim': 256, 'lr': 0.0009110225934635639, 'lambda_val': 0.000485389202309046, 'batch_size': 3712, 'optimizer': 'RMSprop'}.
2026-06-19 04:25:58,172 - optuna.study.study - INFO - Trial 234 finished with values: [0.001746906449015003, 0.00041050903119868636, 0.0010511777395605534] and parameters: {'n_layers': 1, 'embedding_dim': 32, 'lr': 0.0005629311249195415, 'lambda_val': 0.0006131600295730269, 'batch_size': 820, 'optimizer': 'Adam'}.
2026-06-19 04:26:57,849 - experiment_functions - INFO - Early stopping at epoch 1300. Best Metrics: (0.02423000603585898, 0.005049261083743844, 0.01357453601874783)
2026-06-19 04:26:57,951 - optuna.study.study - INFO - Trial 235 finished with values: [0.02423000603585898, 0.005049261083743844, 0.01357453601874783] and parameters: {'n_layers': 4, 'embedding_dim': 32, 'lr': 0.0008568781075155826, 'lambda_val': 1.356629670066784e-05, 'batch_size': 1820, 'optimizer': 'Adam'}.
2026-06-19 04:27:23,921 - experiment_functions - INFO - Early stopping at epoch 550. Best Metrics: (0.00393791196179235, 0.0009773272704307189, 0.0023911553562957727)
2026-06-19 04:27:24,017 - optuna.study.study - INFO - Trial 236 finished with values: [0.00393791196179235, 0.0009773272704307189, 0.0023911553562957727] and parameters: {'n_layers': 1, 'embedding_dim': 96, 'lr': 0.0485633918146202, 'lambda_val': 0.0957179619117481, 'batch_size': 844, 'optimizer': 'Adam'}.
2026-06-19 04:29:32,204 - experiment_functions - INFO - Early stopping at epoch 2800. Best Metrics: (0.03310856016543276, 0.0068697107490210945, 0.01858347195232954)
2026-06-19 04:29:32,333 - optuna.study.study - INFO - Trial 237 finished with values: [0.03310856016543276, 0.0068697107490210945, 0.01858347195232954] and parameters: {'n_layers': 1, 'embedding_dim': 128, 'lr': 0.000870520171613823, 'lambda_val': 0.0008294227855036249, 'batch_size': 3284, 'optimizer': 'RMSprop'}.
2026-06-19 04:32:26,266 - optuna.study.study - INFO - Trial 238 finished with values: [0.032338037754758873, 0.006673929518757104, 0.018622815837301583] and parameters: {'n_layers': 1, 'embedding_dim': 64, 'lr': 0.000870520171613823, 'lambda_val': 1.356629670066784e-05, 'batch_size': 2155, 'optimizer': 'Adam'}.
2026-06-19 04:35:29,590 - optuna.study.study - INFO - Trial 239 finished with values: [0.034141338311771505, 0.007100227358848048, 0.019630279662764503] and parameters: {'n_layers': 1, 'embedding_dim': 128, 'lr': 0.0008568781075155826, 'lambda_val': 0.0002355536887176017, 'batch_size': 2155, 'optimizer': 'Adam'}.
2026-06-19 04:36:37,605 - experiment_functions - INFO - Early stopping at epoch 1450. Best Metrics: (0.03439810751793552, 0.00700391562460528, 0.019622949950811295)
2026-06-19 04:36:37,698 - optuna.study.study - INFO - Trial 240 finished with values: [0.03439810751793552, 0.00700391562460528, 0.019622949950811295] and parameters: {'n_layers': 1, 'embedding_dim': 128, 'lr': 0.0018868200738853993, 'lambda_val': 5.494005823267809e-06, 'batch_size': 2155, 'optimizer': 'Adam'}.
2026-06-19 04:37:50,441 - experiment_functions - INFO - Early stopping at epoch 1600. Best Metrics: (0.02836189798470046, 0.006037640520399142, 0.01618098299475026)
2026-06-19 04:37:50,527 - optuna.study.study - INFO - Trial 241 finished with values: [0.02836189798470046, 0.006037640520399142, 0.01618098299475026] and parameters: {'n_layers': 2, 'embedding_dim': 64, 'lr': 0.0012134658370028314, 'lambda_val': 5.378527278917821e-06, 'batch_size': 1184, 'optimizer': 'Adam'}.
2026-06-19 04:40:48,425 - optuna.study.study - INFO - Trial 242 finished with values: [0.03382882146105385, 0.007029177718832891, 0.019515623182584145] and parameters: {'n_layers': 1, 'embedding_dim': 96, 'lr': 0.0012134658370028314, 'lambda_val': 4.824681967841972e-06, 'batch_size': 1127, 'optimizer': 'Adam'}.
2026-06-19 04:42:07,368 - experiment_functions - INFO - Early stopping at epoch 1650. Best Metrics: (0.0217335690080646, 0.004589806744979159, 0.01223807830240905)
2026-06-19 04:42:07,465 - optuna.study.study - INFO - Trial 243 finished with values: [0.0217335690080646, 0.004589806744979159, 0.01223807830240905] and parameters: {'n_layers': 4, 'embedding_dim': 64, 'lr': 0.00045541062412396616, 'lambda_val': 0.0001388940901640043, 'batch_size': 3284, 'optimizer': 'Adam'}.
2026-06-19 04:42:52,322 - experiment_functions - INFO - Early stopping at epoch 900. Best Metrics: (0.026020089313839537, 0.00548503220917014, 0.014617467703164204)
2026-06-19 04:42:52,730 - optuna.study.study - INFO - Trial 244 finished with values: [0.026020089313839537, 0.00548503220917014, 0.014617467703164204] and parameters: {'n_layers': 2, 'embedding_dim': 128, 'lr': 0.0010493496509530146, 'lambda_val': 8.339990428440081e-05, 'batch_size': 2501, 'optimizer': 'RMSprop'}.
2026-06-19 04:45:56,352 - optuna.study.study - INFO - Trial 245 finished with values: [0.03254544389467331, 0.006812871037008968, 0.018607880140370042] and parameters: {'n_layers': 1, 'embedding_dim': 128, 'lr': 0.000870520171613823, 'lambda_val': 5.816309683274336e-06, 'batch_size': 2501, 'optimizer': 'RMSprop'}.
2026-06-19 04:47:09,080 - experiment_functions - INFO - Early stopping at epoch 1550. Best Metrics: (0.03235243546167953, 0.0066534040671971705, 0.01857346026172483)
2026-06-19 04:47:09,168 - optuna.study.study - INFO - Trial 246 finished with values: [0.03235243546167953, 0.0066534040671971705, 0.01857346026172483] and parameters: {'n_layers': 1, 'embedding_dim': 128, 'lr': 0.0012158141349950717, 'lambda_val': 5.494005823267809e-06, 'batch_size': 2916, 'optimizer': 'RMSprop'}.
2026-06-19 04:50:11,659 - optuna.study.study - INFO - Trial 247 finished with values: [0.0320370687385494, 0.006850764178350385, 0.018381489272035676] and parameters: {'n_layers': 1, 'embedding_dim': 128, 'lr': 0.0012134658370028314, 'lambda_val': 5.378527278917821e-06, 'batch_size': 1184, 'optimizer': 'RMSprop'}.
2026-06-19 04:50:50,132 - experiment_functions - INFO - Early stopping at epoch 800. Best Metrics: (0.021518943619877513, 0.004488758368068713, 0.012351980062671986)
2026-06-19 04:50:50,543 - optuna.study.study - INFO - Trial 248 finished with values: [0.021518943619877513, 0.004488758368068713, 0.012351980062671986] and parameters: {'n_layers': 1, 'embedding_dim': 128, 'lr': 0.003327615910950817, 'lambda_val': 1.2508596708246165e-05, 'batch_size': 2450, 'optimizer': 'RMSprop'}.
2026-06-19 04:53:48,240 - optuna.study.study - INFO - Trial 249 finished with values: [0.029663596999180093, 0.006384994316028799, 0.017085103751071827] and parameters: {'n_layers': 1, 'embedding_dim': 96, 'lr': 0.000870520171613823, 'lambda_val': 7.52425465718907e-06, 'batch_size': 1184, 'optimizer': 'Adam'}.
2026-06-19 04:54:11,243 - experiment_functions - INFO - Early stopping at epoch 500. Best Metrics: (0.00046317011336052236, 0.00010736390046734875, 0.0002586089628670514)
2026-06-19 04:54:11,344 - optuna.study.study - INFO - Trial 250 finished with values: [0.00046317011336052236, 0.00010736390046734875, 0.0002586089628670514] and parameters: {'n_layers': 1, 'embedding_dim': 64, 'lr': 0.0008568781075155826, 'lambda_val': 0.0008294227855036249, 'batch_size': 3284, 'optimizer': 'SGD'}.
2026-06-19 04:56:56,618 - optuna.study.study - INFO - Trial 251 finished with values: [0.03128560870553107, 0.006599722116963496, 0.018059031129428922] and parameters: {'n_layers': 1, 'embedding_dim': 32, 'lr': 0.0012134658370028314, 'lambda_val': 0.0008294227855036249, 'batch_size': 1184, 'optimizer': 'RMSprop'}.
2026-06-19 04:57:45,588 - experiment_functions - INFO - Early stopping at epoch 1150. Best Metrics: (0.017353930912951128, 0.004144562334217507, 0.009416845346831508)
2026-06-19 04:57:45,686 - optuna.study.study - INFO - Trial 252 finished with values: [0.017353930912951128, 0.004144562334217507, 0.009416845346831508] and parameters: {'n_layers': 1, 'embedding_dim': 64, 'lr': 0.0012134658370028314, 'lambda_val': 0.04480140969364338, 'batch_size': 1184, 'optimizer': 'RMSprop'}.
2026-06-19 05:00:34,990 - optuna.study.study - INFO - Trial 253 finished with values: [0.03290523292862036, 0.00687128962991032, 0.018854697383516205] and parameters: {'n_layers': 1, 'embedding_dim': 64, 'lr': 0.001097870844238379, 'lambda_val': 0.0008294227855036249, 'batch_size': 2155, 'optimizer': 'Adam'}.
2026-06-19 05:02:39,363 - experiment_functions - INFO - Early stopping at epoch 3000. Best Metrics: (0.0005316837608127012, 0.00011525830491347732, 0.00033832191042097357)
2026-06-19 05:02:39,456 - optuna.study.study - INFO - Trial 254 finished with values: [0.0005316837608127012, 0.00011525830491347732, 0.00033832191042097357] and parameters: {'n_layers': 1, 'embedding_dim': 96, 'lr': 2.065492362404621e-05, 'lambda_val': 5.494005823267809e-06, 'batch_size': 3093, 'optimizer': 'RMSprop'}.
2026-06-19 05:04:46,693 - experiment_functions - INFO - Early stopping at epoch 2850. Best Metrics: (0.03378701521241696, 0.007029177718832891, 0.019047822207063265)
2026-06-19 05:04:46,786 - optuna.study.study - INFO - Trial 255 finished with values: [0.03378701521241696, 0.007029177718832891, 0.019047822207063265] and parameters: {'n_layers': 1, 'embedding_dim': 128, 'lr': 0.000870520171613823, 'lambda_val': 0.0007296244870928884, 'batch_size': 2501, 'optimizer': 'RMSprop'}.
2026-06-19 05:07:36,550 - optuna.study.study - INFO - Trial 256 finished with values: [0.033916119794435456, 0.0069818112921561214, 0.019420824919412147] and parameters: {'n_layers': 1, 'embedding_dim': 64, 'lr': 0.0017724783344138918, 'lambda_val': 0.0001180174950905876, 'batch_size': 844, 'optimizer': 'Adam'}.
2026-06-19 05:10:32,703 - optuna.study.study - INFO - Trial 257 finished with values: [0.030173566096896243, 0.006484463812050019, 0.017376650552497805] and parameters: {'n_layers': 1, 'embedding_dim': 128, 'lr': 0.000870520171613823, 'lambda_val': 8.004253683939247e-06, 'batch_size': 1184, 'optimizer': 'Adam'}.
2026-06-19 05:13:22,585 - optuna.study.study - INFO - Trial 258 finished with values: [0.03216120288572393, 0.006793924466338259, 0.01836744644516509] and parameters: {'n_layers': 1, 'embedding_dim': 64, 'lr': 0.000870520171613823, 'lambda_val': 5.816309683274336e-06, 'batch_size': 2501, 'optimizer': 'RMSprop'}.
2026-06-19 05:13:47,527 - experiment_functions - INFO - Early stopping at epoch 550. Best Metrics: (0.006137160360393155, 0.0014967790829859798, 0.003640360704043177)
2026-06-19 05:13:47,634 - optuna.study.study - INFO - Trial 259 finished with values: [0.006137160360393155, 0.0014967790829859798, 0.003640360704043177] and parameters: {'n_layers': 1, 'embedding_dim': 64, 'lr': 0.03935939460868895, 'lambda_val': 7.52425465718907e-06, 'batch_size': 844, 'optimizer': 'RMSprop'}.
2026-06-19 05:14:33,555 - experiment_functions - INFO - Early stopping at epoch 1000. Best Metrics: (0.024485840669520743, 0.005456612353164077, 0.01381370266419449)
2026-06-19 05:14:34,044 - optuna.study.study - INFO - Trial 260 finished with values: [0.024485840669520743, 0.005456612353164077, 0.01381370266419449] and parameters: {'n_layers': 1, 'embedding_dim': 128, 'lr': 0.0012134658370028314, 'lambda_val': 0.01199518898381606, 'batch_size': 3531, 'optimizer': 'Adam'}.
2026-06-19 05:17:01,706 - experiment_functions - INFO - Early stopping at epoch 3300. Best Metrics: (0.0319803900248814, 0.0067733990147783255, 0.018559864266926008)
2026-06-19 05:17:01,902 - optuna.study.study - INFO - Trial 261 finished with values: [0.0319803900248814, 0.0067733990147783255, 0.018559864266926008] and parameters: {'n_layers': 1, 'embedding_dim': 128, 'lr': 0.0008568781075155826, 'lambda_val': 0.0008294227855036249, 'batch_size': 3284, 'optimizer': 'Adam'}.
2026-06-19 05:18:18,035 - experiment_functions - INFO - Early stopping at epoch 1750. Best Metrics: (0.0005682687934660295, 0.00013420487558418593, 0.00031488464834151484)
2026-06-19 05:18:18,127 - optuna.study.study - INFO - Trial 262 finished with values: [0.0005682687934660295, 0.00013420487558418593, 0.00031488464834151484] and parameters: {'n_layers': 1, 'embedding_dim': 128, 'lr': 4.973998851000368e-05, 'lambda_val': 0.0008294227855036249, 'batch_size': 2155, 'optimizer': 'Adam'}.
2026-06-19 05:21:17,771 - optuna.study.study - INFO - Trial 263 finished with values: [0.033816692793386956, 0.007038651004168246, 0.019286440202774497] and parameters: {'n_layers': 1, 'embedding_dim': 128, 'lr': 0.0008568781075155826, 'lambda_val': 5.494005823267809e-06, 'batch_size': 3284, 'optimizer': 'Adam'}.
2026-06-19 05:24:12,073 - optuna.study.study - INFO - Trial 264 finished with values: [0.028067900226997716, 0.005987116331943919, 0.015810012863469596] and parameters: {'n_layers': 2, 'embedding_dim': 64, 'lr': 0.00045541062412396616, 'lambda_val': 5.816309683274336e-06, 'batch_size': 2501, 'optimizer': 'Adam'}.
2026-06-19 05:25:46,281 - experiment_functions - INFO - Early stopping at epoch 2200. Best Metrics: (0.03258780084511288, 0.006740242516104585, 0.018840608108280206)
2026-06-19 05:25:46,390 - optuna.study.study - INFO - Trial 265 finished with values: [0.03258780084511288, 0.006740242516104585, 0.018840608108280206] and parameters: {'n_layers': 1, 'embedding_dim': 64, 'lr': 0.0018715145286522033, 'lambda_val': 1.7013643059238403e-06, 'batch_size': 2155, 'optimizer': 'Adam'}.
2026-06-19 05:26:12,596 - experiment_functions - INFO - Early stopping at epoch 550. Best Metrics: (0.007095242207945941, 0.0017415056208159657, 0.004180053207811133)
2026-06-19 05:26:12,708 - optuna.study.study - INFO - Trial 266 finished with values: [0.007095242207945941, 0.0017415056208159657, 0.004180053207811133] and parameters: {'n_layers': 1, 'embedding_dim': 128, 'lr': 0.059404546931102566, 'lambda_val': 7.52425465718907e-06, 'batch_size': 1184, 'optimizer': 'Adam'}.
2026-06-19 05:26:36,178 - experiment_functions - INFO - Early stopping at epoch 500. Best Metrics: (0.0005089427988246436, 9.946949602122017e-05, 0.00026231135311956033)
2026-06-19 05:26:36,282 - optuna.study.study - INFO - Trial 267 finished with values: [0.0005089427988246436, 9.946949602122017e-05, 0.00026231135311956033] and parameters: {'n_layers': 1, 'embedding_dim': 128, 'lr': 0.0018715145286522033, 'lambda_val': 0.0001270243238596297, 'batch_size': 2155, 'optimizer': 'SGD'}.
2026-06-19 05:29:32,772 - optuna.study.study - INFO - Trial 268 finished with values: [0.03007125684675795, 0.006408677529367184, 0.01734329405624624] and parameters: {'n_layers': 1, 'embedding_dim': 128, 'lr': 0.0012134658370028314, 'lambda_val': 4.824681967841972e-06, 'batch_size': 571, 'optimizer': 'Adam'}.
2026-06-19 05:30:07,197 - experiment_functions - INFO - Early stopping at epoch 750. Best Metrics: (0.0006432782601674033, 0.00014367816091954023, 0.0003418687391512952)
2026-06-19 05:30:07,443 - optuna.study.study - INFO - Trial 269 finished with values: [0.0006432782601674033, 0.00014367816091954023, 0.0003418687391512952] and parameters: {'n_layers': 1, 'embedding_dim': 128, 'lr': 1.4232193824885392e-05, 'lambda_val': 5.816309683274336e-06, 'batch_size': 3811, 'optimizer': 'Adam'}.
2026-06-19 05:32:55,778 - optuna.study.study - INFO - Trial 270 finished with values: [0.030506613358344755, 0.006547619047619049, 0.017929118038022024] and parameters: {'n_layers': 1, 'embedding_dim': 64, 'lr': 0.000870520171613823, 'lambda_val': 1.356629670066784e-05, 'batch_size': 1184, 'optimizer': 'RMSprop'}.
2026-06-19 05:35:54,767 - optuna.study.study - INFO - Trial 271 finished with values: [0.03422535185569709, 0.007074965264620438, 0.019312203563951802] and parameters: {'n_layers': 1, 'embedding_dim': 128, 'lr': 0.0009131147309837565, 'lambda_val': 5.816309683274336e-06, 'batch_size': 2155, 'optimizer': 'Adam'}.
2026-06-19 05:37:16,633 - experiment_functions - INFO - Early stopping at epoch 1650. Best Metrics: (0.030742067187992016, 0.0063439434129089305, 0.017223900496696563)
2026-06-19 05:37:16,727 - optuna.study.study - INFO - Trial 272 finished with values: [0.030742067187992016, 0.0063439434129089305, 0.017223900496696563] and parameters: {'n_layers': 1, 'embedding_dim': 256, 'lr': 0.0018715145286522033, 'lambda_val': 1.7013643059238403e-06, 'batch_size': 1184, 'optimizer': 'Adam'}.
2026-06-19 05:38:28,102 - experiment_functions - INFO - Early stopping at epoch 1500. Best Metrics: (0.027317133785410463, 0.005773967411898447, 0.015473507732823516)
2026-06-19 05:38:28,204 - optuna.study.study - INFO - Trial 273 finished with values: [0.027317133785410463, 0.005773967411898447, 0.015473507732823516] and parameters: {'n_layers': 2, 'embedding_dim': 128, 'lr': 0.0008568781075155826, 'lambda_val': 0.0008294227855036249, 'batch_size': 1532, 'optimizer': 'Adam'}.
2026-06-19 05:39:34,130 - experiment_functions - INFO - Early stopping at epoch 1500. Best Metrics: (0.00043814689033241304, 0.00012157382847038021, 0.00023817206443809178)
2026-06-19 05:39:34,220 - optuna.study.study - INFO - Trial 274 finished with values: [0.00043814689033241304, 0.00012157382847038021, 0.00023817206443809178] and parameters: {'n_layers': 1, 'embedding_dim': 128, 'lr': 3.6250772292127554e-05, 'lambda_val': 0.0008294227855036249, 'batch_size': 3085, 'optimizer': 'Adam'}.
2026-06-19 05:40:44,775 - experiment_functions - INFO - Early stopping at epoch 1450. Best Metrics: (0.02772378100910049, 0.005882910193255021, 0.01609472194542737)
2026-06-19 05:40:44,875 - optuna.study.study - INFO - Trial 275 finished with values: [0.02772378100910049, 0.005882910193255021, 0.01609472194542737] and parameters: {'n_layers': 2, 'embedding_dim': 128, 'lr': 0.0008568781075155826, 'lambda_val': 5.494005823267809e-06, 'batch_size': 2155, 'optimizer': 'Adam'}.
2026-06-19 05:41:10,252 - experiment_functions - INFO - Early stopping at epoch 500. Best Metrics: (0.0006796966127230554, 0.0001484148035872174, 0.00036652493830723423)
2026-06-19 05:41:10,391 - optuna.study.study - INFO - Trial 276 finished with values: [0.0006796966127230554, 0.0001484148035872174, 0.00036652493830723423] and parameters: {'n_layers': 2, 'embedding_dim': 128, 'lr': 0.000870520171613823, 'lambda_val': 5.378527278917821e-06, 'batch_size': 1184, 'optimizer': 'SGD'}.
2026-06-19 05:42:56,707 - experiment_functions - INFO - Early stopping at epoch 2400. Best Metrics: (0.03440587681690831, 0.007086017430845018, 0.019845419860943247)
