2026-06-20 23:21:14,433 - optuna.study.study - INFO - Trial 86 finished with values: [0.0004963356609002721, 0.00011367942402425163, 0.0002436941551262979] and parameters: {'n_layers': 1, 'embedding_dim': 32, 'lr': 0.004161234456392577, 'lambda_val': 0.020565069317939635, 'batch_size': 2711, 'optimizer': 'SGD'}.
2026-06-20 23:21:46,113 - experiment_functions - INFO - Early stopping at epoch 750. Best Metrics: (0.004432238602557263, 0.001075217885562713, 0.0026722630810920404)
2026-06-20 23:21:46,194 - optuna.study.study - INFO - Trial 87 finished with values: [0.004432238602557263, 0.001075217885562713, 0.0026722630810920404] and parameters: {'n_layers': 2, 'embedding_dim': 32, 'lr': 0.004155419971354583, 'lambda_val': 0.004386949975881728, 'batch_size': 2626, 'optimizer': 'Adam'}.
2026-06-20 23:22:08,441 - experiment_functions - INFO - Early stopping at epoch 500. Best Metrics: (0.0005798117576972053, 0.00011999494758115447, 0.0003066949580604049)
2026-06-20 23:22:08,508 - optuna.study.study - INFO - Trial 88 finished with values: [0.0005798117576972053, 0.00011999494758115447, 0.0003066949580604049] and parameters: {'n_layers': 1, 'embedding_dim': 128, 'lr': 0.0004974729077493578, 'lambda_val': 0.0011815240672291283, 'batch_size': 2711, 'optimizer': 'SGD'}.
2026-06-20 23:22:30,505 - experiment_functions - INFO - Early stopping at epoch 500. Best Metrics: (0.00038725496320304203, 0.00011052166224580018, 0.00023977003970767786)
2026-06-20 23:22:30,582 - optuna.study.study - INFO - Trial 89 finished with values: [0.00038725496320304203, 0.00011052166224580018, 0.00023977003970767786] and parameters: {'n_layers': 1, 'embedding_dim': 96, 'lr': 3.414186873836921e-05, 'lambda_val': 0.01453818670822501, 'batch_size': 2711, 'optimizer': 'SGD'}.
2026-06-20 23:23:33,008 - experiment_functions - INFO - Early stopping at epoch 1350. Best Metrics: (0.003524433959109956, 0.0008857521788556273, 0.0020006657482045435)
2026-06-20 23:23:33,092 - optuna.study.study - INFO - Trial 90 finished with values: [0.003524433959109956, 0.0008857521788556273, 0.0020006657482045435] and parameters: {'n_layers': 1, 'embedding_dim': 256, 'lr': 0.03417025022075237, 'lambda_val': 0.0013800424546559211, 'batch_size': 3330, 'optimizer': 'Adam'}.
2026-06-20 23:24:02,238 - experiment_functions - INFO - Early stopping at epoch 650. Best Metrics: (0.003810697530981413, 0.0009710117468738159, 0.0024320612735168703)
2026-06-20 23:24:02,316 - optuna.study.study - INFO - Trial 91 finished with values: [0.003810697530981413, 0.0009710117468738159, 0.0024320612735168703] and parameters: {'n_layers': 2, 'embedding_dim': 96, 'lr': 0.02088009457117759, 'lambda_val': 6.326936115170299e-06, 'batch_size': 2532, 'optimizer': 'RMSprop'}.
2026-06-20 23:24:26,199 - experiment_functions - INFO - Early stopping at epoch 550. Best Metrics: (0.00045686507961226593, 0.00010420613868889733, 0.00023344911125555094)
2026-06-20 23:24:26,277 - optuna.study.study - INFO - Trial 92 finished with values: [0.00045686507961226593, 0.00010420613868889733, 0.00023344911125555094] and parameters: {'n_layers': 3, 'embedding_dim': 32, 'lr': 0.010565983515202043, 'lambda_val': 2.802140200809185e-06, 'batch_size': 2178, 'optimizer': 'SGD'}.
2026-06-20 23:27:00,029 - optuna.study.study - INFO - Trial 93 finished with values: [0.0016382169599935775, 0.00035682708096501203, 0.0009537266101347902] and parameters: {'n_layers': 1, 'embedding_dim': 32, 'lr': 0.0003095379644452891, 'lambda_val': 0.0011815240672291283, 'batch_size': 1305, 'optimizer': 'Adam'}.
2026-06-20 23:27:37,403 - experiment_functions - INFO - Early stopping at epoch 800. Best Metrics: (0.0031135215752717696, 0.0008178603006189213, 0.0018143780319930139)
2026-06-20 23:27:37,472 - optuna.study.study - INFO - Trial 94 finished with values: [0.0031135215752717696, 0.0008178603006189213, 0.0018143780319930139] and parameters: {'n_layers': 3, 'embedding_dim': 128, 'lr': 0.001485531724582171, 'lambda_val': 0.0908364460095134, 'batch_size': 2178, 'optimizer': 'RMSprop'}.
2026-06-20 23:28:09,286 - experiment_functions - INFO - Early stopping at epoch 700. Best Metrics: (0.009650156783673921, 0.0024362132120752814, 0.005872044196381267)
2026-06-20 23:28:09,354 - optuna.study.study - INFO - Trial 95 finished with values: [0.009650156783673921, 0.0024362132120752814, 0.005872044196381267] and parameters: {'n_layers': 4, 'embedding_dim': 64, 'lr': 0.0021794693743976113, 'lambda_val': 2.8861183398799558e-06, 'batch_size': 2119, 'optimizer': 'RMSprop'}.
2026-06-20 23:28:48,518 - experiment_functions - INFO - Early stopping at epoch 850. Best Metrics: (0.007835479867525322, 0.002068333964885689, 0.004920443346185433)
2026-06-20 23:28:48,866 - optuna.study.study - INFO - Trial 96 finished with values: [0.007835479867525322, 0.002068333964885689, 0.004920443346185433] and parameters: {'n_layers': 3, 'embedding_dim': 96, 'lr': 0.0031134216844272773, 'lambda_val': 3.9553958515555e-06, 'batch_size': 1902, 'optimizer': 'Adam'}.
2026-06-20 23:29:23,371 - experiment_functions - INFO - Early stopping at epoch 800. Best Metrics: (0.006488464815594729, 0.0016262473159024883, 0.004106788108586555)
2026-06-20 23:29:23,745 - optuna.study.study - INFO - Trial 97 finished with values: [0.006488464815594729, 0.0016262473159024883, 0.004106788108586555] and parameters: {'n_layers': 2, 'embedding_dim': 32, 'lr': 0.003636390488042639, 'lambda_val': 0.0011815240672291283, 'batch_size': 1305, 'optimizer': 'RMSprop'}.
2026-06-20 23:32:15,613 - optuna.study.study - INFO - Trial 98 finished with values: [0.0006796976272486284, 0.00017999242137173172, 0.0004176036972171791] and parameters: {'n_layers': 3, 'embedding_dim': 96, 'lr': 0.00012013359363261997, 'lambda_val': 3.9553958515555e-06, 'batch_size': 646, 'optimizer': 'Adam'}.
2026-06-20 23:33:32,243 - experiment_functions - INFO - Early stopping at epoch 1800. Best Metrics: (0.0035928734455419366, 0.0009599595806492358, 0.0020981844676117704)
2026-06-20 23:33:32,330 - optuna.study.study - INFO - Trial 99 finished with values: [0.0035928734455419366, 0.0009599595806492358, 0.0020981844676117704] and parameters: {'n_layers': 1, 'embedding_dim': 128, 'lr': 0.001423675933824795, 'lambda_val': 0.038987161315163665, 'batch_size': 1788, 'optimizer': 'Adam'}.
2026-06-20 23:34:07,362 - experiment_functions - INFO - Early stopping at epoch 750. Best Metrics: (0.010274451567637455, 0.00255462927876721, 0.006403680018880282)
2026-06-20 23:34:07,454 - optuna.study.study - INFO - Trial 100 finished with values: [0.010274451567637455, 0.00255462927876721, 0.006403680018880282] and parameters: {'n_layers': 4, 'embedding_dim': 64, 'lr': 0.0031134216844272773, 'lambda_val': 3.9553958515555e-06, 'batch_size': 1257, 'optimizer': 'Adam'}.
2026-06-20 23:34:30,548 - experiment_functions - INFO - Early stopping at epoch 500. Best Metrics: (0.0005887992706889503, 0.00012473159024883163, 0.0002955040808608511)
2026-06-20 23:34:30,630 - optuna.study.study - INFO - Trial 101 finished with values: [0.0005887992706889503, 0.00012473159024883163, 0.0002955040808608511] and parameters: {'n_layers': 2, 'embedding_dim': 32, 'lr': 0.022624420343631716, 'lambda_val': 0.00010373904521477372, 'batch_size': 1086, 'optimizer': 'SGD'}.
2026-06-20 23:35:53,605 - experiment_functions - INFO - Early stopping at epoch 1950. Best Metrics: (0.003010357551067309, 0.0007831249210559555, 0.0017214773834710751)
2026-06-20 23:35:53,695 - optuna.study.study - INFO - Trial 102 finished with values: [0.003010357551067309, 0.0007831249210559555, 0.0017214773834710751] and parameters: {'n_layers': 1, 'embedding_dim': 64, 'lr': 0.010042784975460172, 'lambda_val': 0.038987161315163665, 'batch_size': 2119, 'optimizer': 'Adam'}.
2026-06-20 23:36:26,459 - experiment_functions - INFO - Early stopping at epoch 650. Best Metrics: (0.00926778373750333, 0.0023509536440570926, 0.005477119983031407)
2026-06-20 23:36:26,550 - optuna.study.study - INFO - Trial 103 finished with values: [0.00926778373750333, 0.0023509536440570926, 0.005477119983031407] and parameters: {'n_layers': 4, 'embedding_dim': 96, 'lr': 0.0021794693743976113, 'lambda_val': 2.8861183398799558e-06, 'batch_size': 3089, 'optimizer': 'RMSprop'}.
2026-06-20 23:39:16,205 - optuna.study.study - INFO - Trial 104 finished with values: [0.012186240731043574, 0.0029840848806366054, 0.007657649280531372] and parameters: {'n_layers': 4, 'embedding_dim': 64, 'lr': 0.0004974729077493578, 'lambda_val': 0.0014663279558597413, 'batch_size': 1305, 'optimizer': 'RMSprop'}.
2026-06-20 23:39:45,560 - experiment_functions - INFO - Early stopping at epoch 700. Best Metrics: (0.0043160560700719304, 0.001021535935329039, 0.002607951072554114)
2026-06-20 23:39:46,424 - optuna.study.study - INFO - Trial 105 finished with values: [0.0043160560700719304, 0.001021535935329039, 0.002607951072554114] and parameters: {'n_layers': 1, 'embedding_dim': 32, 'lr': 0.0035879353384560956, 'lambda_val': 0.0004324793718720832, 'batch_size': 3852, 'optimizer': 'RMSprop'}.
2026-06-20 23:40:12,635 - experiment_functions - INFO - Early stopping at epoch 550. Best Metrics: (0.0027395157732818896, 0.0006947075912593154, 0.001667295672078864)
2026-06-20 23:40:12,729 - optuna.study.study - INFO - Trial 106 finished with values: [0.0027395157732818896, 0.0006947075912593154, 0.001667295672078864] and parameters: {'n_layers': 4, 'embedding_dim': 96, 'lr': 0.03417025022075237, 'lambda_val': 0.007193171703938169, 'batch_size': 2630, 'optimizer': 'Adam'}.
2026-06-20 23:40:42,569 - experiment_functions - INFO - Early stopping at epoch 700. Best Metrics: (0.00445986591702493, 0.001100479979790325, 0.002819911373041895)
2026-06-20 23:40:42,639 - optuna.study.study - INFO - Trial 107 finished with values: [0.00445986591702493, 0.001100479979790325, 0.002819911373041895] and parameters: {'n_layers': 2, 'embedding_dim': 32, 'lr': 0.004155419971354583, 'lambda_val': 0.004386949975881728, 'batch_size': 4059, 'optimizer': 'Adam'}.
2026-06-20 23:41:04,135 - experiment_functions - INFO - Early stopping at epoch 500. Best Metrics: (0.0005390155665553849, 0.0001042061386888973, 0.0002789632417785806)
2026-06-20 23:41:04,216 - optuna.study.study - INFO - Trial 108 finished with values: [0.0005390155665553849, 0.0001042061386888973, 0.0002789632417785806] and parameters: {'n_layers': 2, 'embedding_dim': 32, 'lr': 0.0031134216844272773, 'lambda_val': 0.0011815240672291283, 'batch_size': 1305, 'optimizer': 'SGD'}.
2026-06-20 23:41:30,344 - experiment_functions - INFO - Early stopping at epoch 600. Best Metrics: (0.006442726177789081, 0.0016594038145762284, 0.004018474806436621)
2026-06-20 23:41:30,438 - optuna.study.study - INFO - Trial 109 finished with values: [0.006442726177789081, 0.0016594038145762284, 0.004018474806436621] and parameters: {'n_layers': 3, 'embedding_dim': 32, 'lr': 0.00997410292059067, 'lambda_val': 3.9553958515555e-06, 'batch_size': 3338, 'optimizer': 'Adam'}.
2026-06-20 23:42:09,521 - experiment_functions - INFO - Early stopping at epoch 850. Best Metrics: (0.0005937975346809835, 0.00013420487558418596, 0.0003108636827807561)
2026-06-20 23:42:09,589 - optuna.study.study - INFO - Trial 110 finished with values: [0.0005937975346809835, 0.00013420487558418596, 0.0003108636827807561] and parameters: {'n_layers': 2, 'embedding_dim': 96, 'lr': 1.7245789285671643e-05, 'lambda_val': 0.0020606879477940467, 'batch_size': 916, 'optimizer': 'Adam'}.
2026-06-20 23:42:47,913 - experiment_functions - INFO - Early stopping at epoch 800. Best Metrics: (0.007939209059614481, 0.0020604395604395605, 0.004833309152618869)
2026-06-20 23:42:47,995 - optuna.study.study - INFO - Trial 111 finished with values: [0.007939209059614481, 0.0020604395604395605, 0.004833309152618869] and parameters: {'n_layers': 3, 'embedding_dim': 96, 'lr': 0.0035879353384560956, 'lambda_val': 0.0017226178103252388, 'batch_size': 777, 'optimizer': 'Adam'}.
2026-06-20 23:43:35,780 - experiment_functions - INFO - Early stopping at epoch 1050. Best Metrics: (0.0032670450454279107, 0.0008225969432865984, 0.0019057975074095632)
2026-06-20 23:43:35,865 - optuna.study.study - INFO - Trial 112 finished with values: [0.0032670450454279107, 0.0008225969432865984, 0.0019057975074095632] and parameters: {'n_layers': 2, 'embedding_dim': 96, 'lr': 0.02088009457117759, 'lambda_val': 0.0013800424546559211, 'batch_size': 1208, 'optimizer': 'RMSprop'}.
2026-06-20 23:44:35,467 - experiment_functions - INFO - Early stopping at epoch 1200. Best Metrics: (0.0074852635370187375, 0.0019893899204244028, 0.004658499160423731)
2026-06-20 23:44:35,556 - optuna.study.study - INFO - Trial 113 finished with values: [0.0074852635370187375, 0.0019893899204244028, 0.004658499160423731] and parameters: {'n_layers': 4, 'embedding_dim': 128, 'lr': 0.0006101961971381852, 'lambda_val': 0.012097382194158528, 'batch_size': 1285, 'optimizer': 'RMSprop'}.
2026-06-20 23:45:15,514 - experiment_functions - INFO - Early stopping at epoch 800. Best Metrics: (0.0074055932518370775, 0.0018662372110647973, 0.004523605372232377)
2026-06-20 23:45:15,609 - optuna.study.study - INFO - Trial 114 finished with values: [0.0074055932518370775, 0.0018662372110647973, 0.004523605372232377] and parameters: {'n_layers': 3, 'embedding_dim': 128, 'lr': 0.0021794693743976113, 'lambda_val': 2.8861183398799558e-06, 'batch_size': 3679, 'optimizer': 'Adam'}.
2026-06-20 23:45:55,007 - experiment_functions - INFO - Early stopping at epoch 850. Best Metrics: (0.008915645185209235, 0.002298850574712644, 0.005466135686639022)
2026-06-20 23:45:55,086 - optuna.study.study - INFO - Trial 115 finished with values: [0.008915645185209235, 0.002298850574712644, 0.005466135686639022] and parameters: {'n_layers': 3, 'embedding_dim': 64, 'lr': 0.0035879353384560956, 'lambda_val': 1.282312052161098e-05, 'batch_size': 777, 'optimizer': 'RMSprop'}.
2026-06-20 23:46:39,124 - experiment_functions - INFO - Early stopping at epoch 900. Best Metrics: (0.004754225024656693, 0.0012725779967159279, 0.0027372096238881924)
2026-06-20 23:46:39,209 - optuna.study.study - INFO - Trial 116 finished with values: [0.004754225024656693, 0.0012725779967159279, 0.0027372096238881924] and parameters: {'n_layers': 3, 'embedding_dim': 128, 'lr': 0.001423675933824795, 'lambda_val': 0.038987161315163665, 'batch_size': 1902, 'optimizer': 'Adam'}.
2026-06-20 23:47:10,542 - experiment_functions - INFO - Early stopping at epoch 650. Best Metrics: (0.007779593529244786, 0.0020099153719843376, 0.004650404222969583)
2026-06-20 23:47:10,648 - optuna.study.study - INFO - Trial 117 finished with values: [0.007779593529244786, 0.0020099153719843376, 0.004650404222969583] and parameters: {'n_layers': 3, 'embedding_dim': 96, 'lr': 0.0031134216844272773, 'lambda_val': 0.0010632401775879522, 'batch_size': 1559, 'optimizer': 'RMSprop'}.
2026-06-20 23:47:54,273 - experiment_functions - INFO - Early stopping at epoch 1000. Best Metrics: (0.0037880003462093955, 0.0008668056081849187, 0.002288461986077339)
2026-06-20 23:47:54,362 - optuna.study.study - INFO - Trial 118 finished with values: [0.0037880003462093955, 0.0008668056081849187, 0.002288461986077339] and parameters: {'n_layers': 1, 'embedding_dim': 32, 'lr': 0.0035879353384560956, 'lambda_val': 1.282312052161098e-05, 'batch_size': 4059, 'optimizer': 'RMSprop'}.
2026-06-20 23:48:30,678 - experiment_functions - INFO - Early stopping at epoch 750. Best Metrics: (0.00868324931308761, 0.002166224580017683, 0.005067743733289278)
2026-06-20 23:48:30,766 - optuna.study.study - INFO - Trial 119 finished with values: [0.00868324931308761, 0.002166224580017683, 0.005067743733289278] and parameters: {'n_layers': 3, 'embedding_dim': 96, 'lr': 0.0021794693743976113, 'lambda_val': 2.8861183398799558e-06, 'batch_size': 3029, 'optimizer': 'RMSprop'}.
2026-06-20 23:49:09,406 - experiment_functions - INFO - Early stopping at epoch 800. Best Metrics: (0.007626031602192482, 0.0018883415435139576, 0.004543658276978007)
2026-06-20 23:49:09,508 - optuna.study.study - INFO - Trial 120 finished with values: [0.007626031602192482, 0.0018883415435139576, 0.004543658276978007] and parameters: {'n_layers': 4, 'embedding_dim': 96, 'lr': 0.004755645745216762, 'lambda_val': 1.282312052161098e-05, 'batch_size': 733, 'optimizer': 'RMSprop'}.
2026-06-20 23:51:52,778 - optuna.study.study - INFO - Trial 121 finished with values: [0.0023920258971073752, 0.0007089175192623469, 0.001491605794549854] and parameters: {'n_layers': 1, 'embedding_dim': 32, 'lr': 0.02088009457117759, 'lambda_val': 0.0015882841030768593, 'batch_size': 3461, 'optimizer': 'RMSprop'}.
2026-06-20 23:52:21,888 - experiment_functions - INFO - Early stopping at epoch 600. Best Metrics: (0.007365126104159739, 0.0018409751168371857, 0.004422954807033929)
2026-06-20 23:52:21,976 - optuna.study.study - INFO - Trial 122 finished with values: [0.007365126104159739, 0.0018409751168371857, 0.004422954807033929] and parameters: {'n_layers': 3, 'embedding_dim': 96, 'lr': 0.003636390488042639, 'lambda_val': 0.0014663279558597413, 'batch_size': 1285, 'optimizer': 'RMSprop'}.
2026-06-20 23:53:52,044 - experiment_functions - INFO - Early stopping at epoch 1900. Best Metrics: (0.011282044461039776, 0.002838827838827839, 0.006897502901475719)
2026-06-20 23:53:52,114 - optuna.study.study - INFO - Trial 123 finished with values: [0.011282044461039776, 0.002838827838827839, 0.006897502901475719] and parameters: {'n_layers': 4, 'embedding_dim': 96, 'lr': 0.0006101961971381852, 'lambda_val': 0.0017226178103252388, 'batch_size': 1653, 'optimizer': 'RMSprop'}.
2026-06-20 23:54:56,140 - experiment_functions - INFO - Early stopping at epoch 1150. Best Metrics: (0.005682259630270482, 0.001528356700770494, 0.0035263321620429924)
2026-06-20 23:54:56,257 - optuna.study.study - INFO - Trial 124 finished with values: [0.005682259630270482, 0.001528356700770494, 0.0035263321620429924] and parameters: {'n_layers': 3, 'embedding_dim': 256, 'lr': 0.0006101961971381852, 'lambda_val': 0.013339360902303529, 'batch_size': 3679, 'optimizer': 'Adam'}.
2026-06-20 23:55:23,086 - experiment_functions - INFO - Early stopping at epoch 550. Best Metrics: (0.0054537930587443915, 0.001365731969180245, 0.003205984112720595)
2026-06-20 23:55:23,178 - optuna.study.study - INFO - Trial 125 finished with values: [0.0054537930587443915, 0.001365731969180245, 0.003205984112720595] and parameters: {'n_layers': 3, 'embedding_dim': 96, 'lr': 0.017356358238450692, 'lambda_val': 0.0017226178103252388, 'batch_size': 1203, 'optimizer': 'Adam'}.
2026-06-20 23:58:11,061 - optuna.study.study - INFO - Trial 126 finished with values: [0.00406486523930328, 0.0008983832259694329, 0.0024183274396085727] and parameters: {'n_layers': 1, 'embedding_dim': 128, 'lr': 0.0006604859729474348, 'lambda_val': 0.0015882841030768593, 'batch_size': 3852, 'optimizer': 'Adam'}.
2026-06-20 23:58:52,658 - experiment_functions - INFO - Early stopping at epoch 1000. Best Metrics: (0.00794134260950147, 0.0020525451559934324, 0.004798302535040938)
2026-06-20 23:58:52,739 - optuna.study.study - INFO - Trial 127 finished with values: [0.00794134260950147, 0.0020525451559934324, 0.004798302535040938] and parameters: {'n_layers': 2, 'embedding_dim': 32, 'lr': 0.003636390488042639, 'lambda_val': 0.00035402317541238034, 'batch_size': 642, 'optimizer': 'RMSprop'}.
2026-06-21 00:01:32,273 - optuna.study.study - INFO - Trial 128 finished with values: [0.008319567158847505, 0.001981495515978274, 0.0051377770184587645] and parameters: {'n_layers': 3, 'embedding_dim': 32, 'lr': 0.0006101961971381852, 'lambda_val': 2.4259773382665532e-05, 'batch_size': 1203, 'optimizer': 'Adam'}.
2026-06-21 00:02:00,540 - experiment_functions - INFO - Early stopping at epoch 600. Best Metrics: (0.0074097341700292115, 0.0018662372110647976, 0.004301270344398065)
2026-06-21 00:02:00,643 - optuna.study.study - INFO - Trial 129 finished with values: [0.0074097341700292115, 0.0018662372110647976, 0.004301270344398065] and parameters: {'n_layers': 3, 'embedding_dim': 96, 'lr': 0.0035879353384560956, 'lambda_val': 1.282312052161098e-05, 'batch_size': 3149, 'optimizer': 'RMSprop'}.
2026-06-21 00:02:26,179 - experiment_functions - INFO - Early stopping at epoch 600. Best Metrics: (0.003168478072595153, 0.0006931287103700898, 0.001754417007681326)
2026-06-21 00:02:26,330 - optuna.study.study - INFO - Trial 130 finished with values: [0.003168478072595153, 0.0006931287103700898, 0.001754417007681326] and parameters: {'n_layers': 1, 'embedding_dim': 32, 'lr': 0.00997410292059067, 'lambda_val': 0.004386949975881728, 'batch_size': 3338, 'optimizer': 'Adam'}.
2026-06-21 00:02:52,305 - experiment_functions - INFO - Early stopping at epoch 600. Best Metrics: (0.00317963327848822, 0.00084785903751421, 0.0018100910479619473)
2026-06-21 00:02:52,449 - optuna.study.study - INFO - Trial 131 finished with values: [0.00317963327848822, 0.00084785903751421, 0.0018100910479619473] and parameters: {'n_layers': 3, 'embedding_dim': 32, 'lr': 0.0035879353384560956, 'lambda_val': 0.04219970118756191, 'batch_size': 1695, 'optimizer': 'RMSprop'}.
2026-06-21 00:05:28,956 - optuna.study.study - INFO - Trial 132 finished with values: [0.0007732273652895869, 0.00015946696981179742, 0.00041430920259602895] and parameters: {'n_layers': 3, 'embedding_dim': 32, 'lr': 8.846159343898707e-05, 'lambda_val': 2.4259773382665532e-05, 'batch_size': 1203, 'optimizer': 'RMSprop'}.
2026-06-21 00:08:09,145 - optuna.study.study - INFO - Trial 133 finished with values: [0.002012147964806328, 0.0004641909814323608, 0.0012186303931585854] and parameters: {'n_layers': 2, 'embedding_dim': 64, 'lr': 0.0001845505029743282, 'lambda_val': 6.326936115170299e-06, 'batch_size': 3807, 'optimizer': 'RMSprop'}.
2026-06-21 00:09:41,436 - experiment_functions - INFO - Early stopping at epoch 2050. Best Metrics: (0.010678773627725058, 0.002622521157003916, 0.006406066030340318)
