2026-06-19 01:38:02,123 - optuna.study.study - INFO - Trial 126 finished with values: [0.026534690087776314, 0.00560344827586207, 0.014745064289719128] and parameters: {'n_layers': 4, 'embedding_dim': 64, 'lr': 0.00045541062412396616, 'lambda_val': 1.356629670066784e-05, 'batch_size': 1184, 'optimizer': 'Adam'}.
2026-06-19 01:38:32,210 - experiment_functions - INFO - Early stopping at epoch 500. Best Metrics: (0.0004366036361288524, 0.0001121005431350259, 0.0002479326890723419)
2026-06-19 01:38:32,287 - optuna.study.study - INFO - Trial 127 finished with values: [0.0004366036361288524, 0.0001121005431350259, 0.0002479326890723419] and parameters: {'n_layers': 3, 'embedding_dim': 256, 'lr': 0.00265047718248758, 'lambda_val': 0.00790150266889716, 'batch_size': 3383, 'optimizer': 'SGD'}.
2026-06-19 01:40:47,325 - experiment_functions - INFO - Early stopping at epoch 2350. Best Metrics: (0.012254010334170146, 0.0025814702538840472, 0.006720149140626179)
2026-06-19 01:40:47,415 - optuna.study.study - INFO - Trial 128 finished with values: [0.012254010334170146, 0.0025814702538840472, 0.006720149140626179] and parameters: {'n_layers': 3, 'embedding_dim': 256, 'lr': 0.0018715145286522033, 'lambda_val': 8.004253683939247e-06, 'batch_size': 3284, 'optimizer': 'RMSprop'}.
2026-06-19 01:43:47,603 - optuna.study.study - INFO - Trial 129 finished with values: [0.032983885772047715, 0.006842869773904257, 0.01838449444878259] and parameters: {'n_layers': 1, 'embedding_dim': 128, 'lr': 0.0008568781075155826, 'lambda_val': 0.0008294227855036249, 'batch_size': 3284, 'optimizer': 'Adam'}.
2026-06-19 01:44:27,013 - experiment_functions - INFO - Early stopping at epoch 900. Best Metrics: (0.0236782306471015, 0.005246621194897057, 0.01364880322870876)
2026-06-19 01:44:27,092 - optuna.study.study - INFO - Trial 130 finished with values: [0.0236782306471015, 0.005246621194897057, 0.01364880322870876] and parameters: {'n_layers': 1, 'embedding_dim': 64, 'lr': 0.003327615910950817, 'lambda_val': 0.003077942483029095, 'batch_size': 844, 'optimizer': 'Adam'}.
2026-06-19 01:47:27,982 - optuna.study.study - INFO - Trial 131 finished with values: [0.001011076964989705, 0.0002431476569407604, 0.000568437100356794] and parameters: {'n_layers': 2, 'embedding_dim': 128, 'lr': 0.00010206125857252141, 'lambda_val': 0.000426873699562592, 'batch_size': 3565, 'optimizer': 'RMSprop'}.
2026-06-19 01:49:41,342 - experiment_functions - INFO - Early stopping at epoch 3000. Best Metrics: (0.03456550382025507, 0.007160224832638627, 0.019957212299854872)
2026-06-19 01:49:41,427 - optuna.study.study - INFO - Trial 132 finished with values: [0.03456550382025507, 0.007160224832638627, 0.019957212299854872] and parameters: {'n_layers': 1, 'embedding_dim': 128, 'lr': 0.000870520171613823, 'lambda_val': 8.004253683939247e-06, 'batch_size': 3224, 'optimizer': 'RMSprop'}.
2026-06-19 01:50:19,654 - experiment_functions - INFO - Early stopping at epoch 750. Best Metrics: (0.02621794911137927, 0.005611342680308198, 0.014841877697446808)
2026-06-19 01:50:19,777 - optuna.study.study - INFO - Trial 133 finished with values: [0.02621794911137927, 0.005611342680308198, 0.014841877697446808] and parameters: {'n_layers': 2, 'embedding_dim': 128, 'lr': 0.0017724783344138918, 'lambda_val': 1.356629670066784e-05, 'batch_size': 2612, 'optimizer': 'Adam'}.
2026-06-19 01:50:47,946 - experiment_functions - INFO - Early stopping at epoch 550. Best Metrics: (0.007072447738994229, 0.0016467727674624227, 0.0039831651368361235)
2026-06-19 01:50:48,049 - optuna.study.study - INFO - Trial 134 finished with values: [0.007072447738994229, 0.0016467727674624227, 0.0039831651368361235] and parameters: {'n_layers': 3, 'embedding_dim': 96, 'lr': 0.00265047718248758, 'lambda_val': 0.006605889032861164, 'batch_size': 3712, 'optimizer': 'RMSprop'}.
2026-06-19 01:51:12,992 - experiment_functions - INFO - Early stopping at epoch 500. Best Metrics: (0.005262534869838598, 0.0010894278135657447, 0.002946404015724578)
2026-06-19 01:51:13,087 - optuna.study.study - INFO - Trial 135 finished with values: [0.005262534869838598, 0.0010894278135657447, 0.002946404015724578] and parameters: {'n_layers': 2, 'embedding_dim': 128, 'lr': 0.03235246262650783, 'lambda_val': 0.003077942483029095, 'batch_size': 619, 'optimizer': 'RMSprop'}.
2026-06-19 01:52:08,398 - experiment_functions - INFO - Early stopping at epoch 1000. Best Metrics: (0.020909514565353834, 0.004796640141467728, 0.012054339278416966)
2026-06-19 01:52:08,495 - optuna.study.study - INFO - Trial 136 finished with values: [0.020909514565353834, 0.004796640141467728, 0.012054339278416966] and parameters: {'n_layers': 2, 'embedding_dim': 256, 'lr': 0.0007989615375802813, 'lambda_val': 0.006446182958325827, 'batch_size': 2155, 'optimizer': 'Adam'}.
2026-06-19 01:53:01,304 - experiment_functions - INFO - Early stopping at epoch 1000. Best Metrics: (0.016859476288559497, 0.003587217380320829, 0.009559326092555895)
2026-06-19 01:53:01,395 - optuna.study.study - INFO - Trial 137 finished with values: [0.016859476288559497, 0.003587217380320829, 0.009559326092555895] and parameters: {'n_layers': 4, 'embedding_dim': 128, 'lr': 0.000870520171613823, 'lambda_val': 1.1184488483519006e-06, 'batch_size': 1184, 'optimizer': 'RMSprop'}.
2026-06-19 01:54:47,020 - experiment_functions - INFO - Early stopping at epoch 2450. Best Metrics: (0.028985167852421962, 0.005987116331943919, 0.016191565967274276)
2026-06-19 01:54:47,121 - optuna.study.study - INFO - Trial 138 finished with values: [0.028985167852421962, 0.005987116331943919, 0.016191565967274276] and parameters: {'n_layers': 2, 'embedding_dim': 32, 'lr': 0.000870520171613823, 'lambda_val': 5.034815386429636e-06, 'batch_size': 2712, 'optimizer': 'Adam'}.
2026-06-19 01:55:12,348 - experiment_functions - INFO - Early stopping at epoch 550. Best Metrics: (0.005627024168903502, 0.0012725779967159279, 0.0031164822799065314)
2026-06-19 01:55:12,489 - optuna.study.study - INFO - Trial 139 finished with values: [0.005627024168903502, 0.0012725779967159279, 0.0031164822799065314] and parameters: {'n_layers': 3, 'embedding_dim': 32, 'lr': 0.01339497152493029, 'lambda_val': 0.008351113193864012, 'batch_size': 2145, 'optimizer': 'Adam'}.
2026-06-19 01:56:21,492 - experiment_functions - INFO - Early stopping at epoch 1300. Best Metrics: (0.018199499947756017, 0.003880889225716812, 0.009887494985506893)
2026-06-19 01:56:21,578 - optuna.study.study - INFO - Trial 140 finished with values: [0.018199499947756017, 0.003880889225716812, 0.009887494985506893] and parameters: {'n_layers': 4, 'embedding_dim': 128, 'lr': 0.0008568781075155826, 'lambda_val': 0.00011238429460135182, 'batch_size': 1184, 'optimizer': 'RMSprop'}.
2026-06-19 01:56:54,249 - experiment_functions - INFO - Early stopping at epoch 650. Best Metrics: (0.02483138457358503, 0.0052876720980169255, 0.014364958116208216)
2026-06-19 01:56:54,389 - optuna.study.study - INFO - Trial 141 finished with values: [0.02483138457358503, 0.0052876720980169255, 0.014364958116208216] and parameters: {'n_layers': 2, 'embedding_dim': 128, 'lr': 0.00265047718248758, 'lambda_val': 8.339990428440081e-05, 'batch_size': 3252, 'optimizer': 'Adam'}.
2026-06-19 01:57:55,248 - experiment_functions - INFO - Early stopping at epoch 1150. Best Metrics: (0.013639189690853272, 0.002883036503726159, 0.00761476409144996)
2026-06-19 01:57:55,384 - optuna.study.study - INFO - Trial 142 finished with values: [0.013639189690853272, 0.002883036503726159, 0.00761476409144996] and parameters: {'n_layers': 4, 'embedding_dim': 128, 'lr': 0.0012134658370028314, 'lambda_val': 0.0001180174950905876, 'batch_size': 1262, 'optimizer': 'RMSprop'}.
2026-06-19 01:58:27,712 - experiment_functions - INFO - Early stopping at epoch 700. Best Metrics: (0.016829749559584432, 0.0035919540229885057, 0.009456008832084162)
2026-06-19 01:58:27,811 - optuna.study.study - INFO - Trial 143 finished with values: [0.016829749559584432, 0.0035919540229885057, 0.009456008832084162] and parameters: {'n_layers': 3, 'embedding_dim': 32, 'lr': 0.0026777259297623827, 'lambda_val': 0.0020983857112305436, 'batch_size': 1466, 'optimizer': 'Adam'}.
2026-06-19 02:01:23,620 - optuna.study.study - INFO - Trial 144 finished with values: [0.028916265463715365, 0.006108690160414299, 0.01655426958550841] and parameters: {'n_layers': 2, 'embedding_dim': 32, 'lr': 0.0005629311249195415, 'lambda_val': 1.356629670066784e-05, 'batch_size': 1820, 'optimizer': 'Adam'}.
2026-06-19 02:01:47,669 - experiment_functions - INFO - Early stopping at epoch 500. Best Metrics: (0.0005031583014430473, 0.00010578501957812304, 0.00026317637573532843)
2026-06-19 02:01:47,757 - optuna.study.study - INFO - Trial 145 finished with values: [0.0005031583014430473, 0.00010578501957812304, 0.00026317637573532843] and parameters: {'n_layers': 2, 'embedding_dim': 64, 'lr': 0.0311226174645876, 'lambda_val': 0.002664675690305641, 'batch_size': 1959, 'optimizer': 'SGD'}.
2026-06-19 02:04:23,365 - experiment_functions - INFO - Early stopping at epoch 2950. Best Metrics: (0.007592457471302704, 0.0016909814323607427, 0.0040028541349960535)
2026-06-19 02:04:23,464 - optuna.study.study - INFO - Trial 146 finished with values: [0.007592457471302704, 0.0016909814323607427, 0.0040028541349960535] and parameters: {'n_layers': 4, 'embedding_dim': 128, 'lr': 0.0311226174645876, 'lambda_val': 0.0017861244112865895, 'batch_size': 1262, 'optimizer': 'RMSprop'}.
2026-06-19 02:05:01,394 - experiment_functions - INFO - Early stopping at epoch 650. Best Metrics: (0.007206698370796761, 0.001605721864342554, 0.003662799700813617)
2026-06-19 02:05:01,493 - optuna.study.study - INFO - Trial 147 finished with values: [0.007206698370796761, 0.001605721864342554, 0.003662799700813617] and parameters: {'n_layers': 2, 'embedding_dim': 256, 'lr': 0.00265047718248758, 'lambda_val': 0.027677218456854613, 'batch_size': 1707, 'optimizer': 'Adam'}.
2026-06-19 02:07:46,057 - optuna.study.study - INFO - Trial 148 finished with values: [0.006748621970963815, 0.0015362511052166225, 0.0038060517300354778] and parameters: {'n_layers': 1, 'embedding_dim': 32, 'lr': 0.0945353677480732, 'lambda_val': 0.014125019192014067, 'batch_size': 2434, 'optimizer': 'Adam'}.
2026-06-19 02:08:47,249 - experiment_functions - INFO - Early stopping at epoch 1400. Best Metrics: (0.019004628083919853, 0.004071933813313124, 0.010337401106178635)
2026-06-19 02:08:47,351 - optuna.study.study - INFO - Trial 149 finished with values: [0.019004628083919853, 0.004071933813313124, 0.010337401106178635] and parameters: {'n_layers': 4, 'embedding_dim': 32, 'lr': 0.0012134658370028314, 'lambda_val': 0.0001180174950905876, 'batch_size': 1184, 'optimizer': 'RMSprop'}.
2026-06-19 02:09:32,642 - experiment_functions - INFO - Early stopping at epoch 750. Best Metrics: (0.017326906298681097, 0.0037687886825817857, 0.00974663002016622)
2026-06-19 02:09:32,739 - optuna.study.study - INFO - Trial 150 finished with values: [0.017326906298681097, 0.0037687886825817857, 0.00974663002016622] and parameters: {'n_layers': 3, 'embedding_dim': 256, 'lr': 0.0008568781075155826, 'lambda_val': 4.824681967841972e-06, 'batch_size': 3284, 'optimizer': 'RMSprop'}.
2026-06-19 02:10:20,811 - experiment_functions - INFO - Early stopping at epoch 1100. Best Metrics: (0.02686484431309476, 0.005704496652772515, 0.015492008544167768)
2026-06-19 02:10:20,918 - optuna.study.study - INFO - Trial 151 finished with values: [0.02686484431309476, 0.005704496652772515, 0.015492008544167768] and parameters: {'n_layers': 1, 'embedding_dim': 64, 'lr': 0.003327615910950817, 'lambda_val': 1.2508596708246165e-05, 'batch_size': 844, 'optimizer': 'Adam'}.
2026-06-19 02:11:04,633 - experiment_functions - INFO - Early stopping at epoch 950. Best Metrics: (0.027430796217404112, 0.005658709106984969, 0.015770412232877798)
2026-06-19 02:11:04,741 - optuna.study.study - INFO - Trial 152 finished with values: [0.027430796217404112, 0.005658709106984969, 0.015770412232877798] and parameters: {'n_layers': 1, 'embedding_dim': 128, 'lr': 0.003327615910950817, 'lambda_val': 4.824681967841972e-06, 'batch_size': 844, 'optimizer': 'Adam'}.
2026-06-19 02:14:02,823 - optuna.study.study - INFO - Trial 153 finished with values: [0.03241276721373993, 0.006898130605027158, 0.01888219238063762] and parameters: {'n_layers': 1, 'embedding_dim': 128, 'lr': 0.0008568781075155826, 'lambda_val': 0.0001180174950905876, 'batch_size': 2155, 'optimizer': 'Adam'}.
2026-06-19 02:14:54,530 - experiment_functions - INFO - Early stopping at epoch 1200. Best Metrics: (0.021746718025893206, 0.004619805481874448, 0.012343150659650463)
2026-06-19 02:14:54,629 - optuna.study.study - INFO - Trial 154 finished with values: [0.021746718025893206, 0.004619805481874448, 0.012343150659650463] and parameters: {'n_layers': 3, 'embedding_dim': 32, 'lr': 0.0008568781075155826, 'lambda_val': 0.0008294227855036249, 'batch_size': 3284, 'optimizer': 'Adam'}.
2026-06-19 02:15:22,799 - experiment_functions - INFO - Early stopping at epoch 600. Best Metrics: (0.010896797264696537, 0.0023572691676139955, 0.005989304648632148)
2026-06-19 02:15:22,901 - optuna.study.study - INFO - Trial 155 finished with values: [0.010896797264696537, 0.0023572691676139955, 0.005989304648632148] and parameters: {'n_layers': 2, 'embedding_dim': 64, 'lr': 0.004532427602169928, 'lambda_val': 5.816309683274336e-06, 'batch_size': 844, 'optimizer': 'Adam'}.
2026-06-19 02:16:09,987 - experiment_functions - INFO - Early stopping at epoch 850. Best Metrics: (0.019436630139969494, 0.004201402046229633, 0.011059778392249812)
2026-06-19 02:16:10,093 - optuna.study.study - INFO - Trial 156 finished with values: [0.019436630139969494, 0.004201402046229633, 0.011059778392249812] and parameters: {'n_layers': 4, 'embedding_dim': 128, 'lr': 0.0008568781075155826, 'lambda_val': 8.004253683939247e-06, 'batch_size': 3284, 'optimizer': 'Adam'}.
2026-06-19 02:17:19,649 - experiment_functions - INFO - Early stopping at epoch 1450. Best Metrics: (0.02867349985556971, 0.0059255399772641165, 0.016284283974362698)
2026-06-19 02:17:19,750 - optuna.study.study - INFO - Trial 157 finished with values: [0.02867349985556971, 0.0059255399772641165, 0.016284283974362698] and parameters: {'n_layers': 2, 'embedding_dim': 128, 'lr': 0.000870520171613823, 'lambda_val': 5.816309683274336e-06, 'batch_size': 2501, 'optimizer': 'Adam'}.
2026-06-19 02:18:02,078 - experiment_functions - INFO - Early stopping at epoch 900. Best Metrics: (0.029842767083423184, 0.0061671087533156504, 0.017137568812126056)
2026-06-19 02:18:02,175 - optuna.study.study - INFO - Trial 158 finished with values: [0.029842767083423184, 0.0061671087533156504, 0.017137568812126056] and parameters: {'n_layers': 1, 'embedding_dim': 128, 'lr': 0.0018715145286522033, 'lambda_val': 5.494005823267809e-06, 'batch_size': 2916, 'optimizer': 'RMSprop'}.
2026-06-19 02:18:56,258 - experiment_functions - INFO - Early stopping at epoch 1200. Best Metrics: (0.019912298634345786, 0.0043356069218138185, 0.01110719123928145)
2026-06-19 02:18:56,363 - optuna.study.study - INFO - Trial 159 finished with values: [0.019912298634345786, 0.0043356069218138185, 0.01110719123928145] and parameters: {'n_layers': 4, 'embedding_dim': 32, 'lr': 0.000870520171613823, 'lambda_val': 5.034815386429636e-06, 'batch_size': 2712, 'optimizer': 'RMSprop'}.
2026-06-19 02:19:21,292 - experiment_functions - INFO - Early stopping at epoch 550. Best Metrics: (0.008909411951663003, 0.002014652014652015, 0.005006727570922602)
2026-06-19 02:19:21,384 - optuna.study.study - INFO - Trial 160 finished with values: [0.008909411951663003, 0.002014652014652015, 0.005006727570922602] and parameters: {'n_layers': 1, 'embedding_dim': 32, 'lr': 0.022537997280540817, 'lambda_val': 0.003077942483029095, 'batch_size': 1184, 'optimizer': 'Adam'}.
2026-06-19 02:19:51,022 - experiment_functions - INFO - Early stopping at epoch 600. Best Metrics: (0.018454225670625945, 0.0038003663003663007, 0.009524196149261555)
2026-06-19 02:19:51,122 - optuna.study.study - INFO - Trial 161 finished with values: [0.018454225670625945, 0.0038003663003663007, 0.009524196149261555] and parameters: {'n_layers': 2, 'embedding_dim': 64, 'lr': 0.005958049662858308, 'lambda_val': 1.356629670066784e-05, 'batch_size': 2155, 'optimizer': 'Adam'}.
2026-06-19 02:22:53,619 - optuna.study.study - INFO - Trial 162 finished with values: [0.03159704020203336, 0.0066849816849816855, 0.01828248267069375] and parameters: {'n_layers': 1, 'embedding_dim': 128, 'lr': 0.0008568781075155826, 'lambda_val': 8.808997785536571e-06, 'batch_size': 2155, 'optimizer': 'Adam'}.
2026-06-19 02:23:45,718 - experiment_functions - INFO - Early stopping at epoch 950. Best Metrics: (0.013778082328583408, 0.003028293545534925, 0.007592470420495325)
2026-06-19 02:23:45,830 - optuna.study.study - INFO - Trial 163 finished with values: [0.013778082328583408, 0.003028293545534925, 0.007592470420495325] and parameters: {'n_layers': 4, 'embedding_dim': 128, 'lr': 0.000870520171613823, 'lambda_val': 0.003077942483029095, 'batch_size': 739, 'optimizer': 'Adam'}.
2026-06-19 02:25:12,480 - experiment_functions - INFO - Early stopping at epoch 2050. Best Metrics: (0.02937514537035924, 0.006209738537324745, 0.016595564659584026)
2026-06-19 02:25:12,587 - optuna.study.study - INFO - Trial 164 finished with values: [0.02937514537035924, 0.006209738537324745, 0.016595564659584026] and parameters: {'n_layers': 2, 'embedding_dim': 32, 'lr': 0.0012134658370028314, 'lambda_val': 4.824681967841972e-06, 'batch_size': 1184, 'optimizer': 'Adam'}.
2026-06-19 02:27:49,713 - experiment_functions - INFO - Early stopping at epoch 3450. Best Metrics: (0.029222051634067603, 0.006152898825312619, 0.01666630249892397)
2026-06-19 02:27:49,814 - optuna.study.study - INFO - Trial 165 finished with values: [0.029222051634067603, 0.006152898825312619, 0.01666630249892397] and parameters: {'n_layers': 2, 'embedding_dim': 96, 'lr': 0.000870520171613823, 'lambda_val': 1.7013643059238403e-06, 'batch_size': 1184, 'optimizer': 'Adam'}.
2026-06-19 02:28:16,274 - experiment_functions - INFO - Early stopping at epoch 500. Best Metrics: (0.000635916613205546, 0.00015630920803334599, 0.0003587332116488713)
2026-06-19 02:28:16,418 - optuna.study.study - INFO - Trial 166 finished with values: [0.000635916613205546, 0.00015630920803334599, 0.0003587332116488713] and parameters: {'n_layers': 1, 'embedding_dim': 256, 'lr': 0.0018715145286522033, 'lambda_val': 2.6536886696946957e-05, 'batch_size': 571, 'optimizer': 'SGD'}.
2026-06-19 02:30:25,942 - experiment_functions - INFO - Early stopping at epoch 2650. Best Metrics: (0.02770999727138079, 0.005792913982569155, 0.015585940289851762)
2026-06-19 02:30:26,042 - optuna.study.study - INFO - Trial 167 finished with values: [0.02770999727138079, 0.005792913982569155, 0.015585940289851762] and parameters: {'n_layers': 2, 'embedding_dim': 128, 'lr': 0.0010493496509530146, 'lambda_val': 8.339990428440081e-05, 'batch_size': 571, 'optimizer': 'Adam'}.
2026-06-19 02:30:59,699 - experiment_functions - INFO - Early stopping at epoch 700. Best Metrics: (0.011361070708253273, 0.002470948591638247, 0.0062693036919679)
2026-06-19 02:31:00,108 - optuna.study.study - INFO - Trial 168 finished with values: [0.011361070708253273, 0.002470948591638247, 0.0062693036919679] and parameters: {'n_layers': 2, 'embedding_dim': 64, 'lr': 0.003327615910950817, 'lambda_val': 1.356629670066784e-05, 'batch_size': 2103, 'optimizer': 'RMSprop'}.
2026-06-19 02:32:31,488 - experiment_functions - INFO - Early stopping at epoch 1950. Best Metrics: (0.028817764978950024, 0.00595711759504863, 0.016107988752297804)
2026-06-19 02:32:31,629 - optuna.study.study - INFO - Trial 169 finished with values: [0.028817764978950024, 0.00595711759504863, 0.016107988752297804] and parameters: {'n_layers': 2, 'embedding_dim': 64, 'lr': 0.0008568781075155826, 'lambda_val': 8.004253683939247e-06, 'batch_size': 2612, 'optimizer': 'Adam'}.
2026-06-19 02:35:28,158 - optuna.study.study - INFO - Trial 170 finished with values: [0.029598783405535886, 0.006419729695591765, 0.016951050857130657] and parameters: {'n_layers': 2, 'embedding_dim': 64, 'lr': 0.00045541062412396616, 'lambda_val': 5.816309683274336e-06, 'batch_size': 2501, 'optimizer': 'RMSprop'}.
2026-06-19 02:38:17,875 - optuna.study.study - INFO - Trial 171 finished with values: [0.029776344861741147, 0.006402362005810283, 0.01748151686886508] and parameters: {'n_layers': 1, 'embedding_dim': 64, 'lr': 0.000870520171613823, 'lambda_val': 7.52425465718907e-06, 'batch_size': 1184, 'optimizer': 'RMSprop'}.
2026-06-19 02:41:18,903 - optuna.study.study - INFO - Trial 172 finished with values: [0.0007310906029143865, 0.0001957812302639889, 0.0004507078129099505] and parameters: {'n_layers': 2, 'embedding_dim': 128, 'lr': 0.00012193699117711295, 'lambda_val': 0.003077942483029095, 'batch_size': 2927, 'optimizer': 'Adam'}.
2026-06-19 02:44:18,713 - experiment_functions - INFO - Early stopping at epoch 3950. Best Metrics: (0.033056619301407464, 0.006842869773904258, 0.018741500487953415)
2026-06-19 02:44:18,795 - optuna.study.study - INFO - Trial 173 finished with values: [0.033056619301407464, 0.006842869773904258, 0.018741500487953415] and parameters: {'n_layers': 1, 'embedding_dim': 128, 'lr': 0.0008568781075155826, 'lambda_val': 0.0008294227855036249, 'batch_size': 3284, 'optimizer': 'Adam'}.
2026-06-19 02:44:46,461 - experiment_functions - INFO - Early stopping at epoch 550. Best Metrics: (0.007801080240055728, 0.001735190097259063, 0.004363090870964523)
