2026-06-22 08:43:51,628 - optuna.study.study - INFO - Trial 249 finished with values: [0.013524655716362223, 0.0028704054566123533, 0.007646032598321057] and parameters: {'n_layers': 2, 'embedding_dim': 96, 'lr': 0.007100372257236084, 'lambda_val': 0.000442118077500333, 'batch_size': 2829, 'optimizer': 'RMSprop'}.
2026-06-22 08:44:32,869 - experiment_functions - INFO - Early stopping at epoch 900. Best Metrics: (0.02882695111174471, 0.006107111279525073, 0.016294886863341875)
2026-06-22 08:44:32,960 - optuna.study.study - INFO - Trial 250 finished with values: [0.02882695111174471, 0.006107111279525073, 0.016294886863341875] and parameters: {'n_layers': 1, 'embedding_dim': 96, 'lr': 0.0012653624571519182, 'lambda_val': 8.803132640891692e-06, 'batch_size': 2362, 'optimizer': 'RMSprop'}.
2026-06-22 08:46:04,952 - experiment_functions - INFO - Early stopping at epoch 2100. Best Metrics: (0.029478331643316008, 0.006568144499178983, 0.017014840988697263)
2026-06-22 08:46:05,025 - optuna.study.study - INFO - Trial 251 finished with values: [0.029478331643316008, 0.006568144499178983, 0.017014840988697263] and parameters: {'n_layers': 1, 'embedding_dim': 96, 'lr': 0.0004249111472269399, 'lambda_val': 0.004689022509389867, 'batch_size': 3046, 'optimizer': 'RMSprop'}.
2026-06-22 08:47:38,171 - experiment_functions - INFO - Early stopping at epoch 2000. Best Metrics: (0.030428491518860797, 0.006474990526714665, 0.01799323735606998)
2026-06-22 08:47:38,260 - optuna.study.study - INFO - Trial 252 finished with values: [0.030428491518860797, 0.006474990526714665, 0.01799323735606998] and parameters: {'n_layers': 2, 'embedding_dim': 96, 'lr': 0.0004249111472269399, 'lambda_val': 2.887932809602638e-05, 'batch_size': 2113, 'optimizer': 'Adam'}.
2026-06-22 08:50:21,883 - optuna.study.study - INFO - Trial 253 finished with values: [0.02517467036957331, 0.005671340154098776, 0.014852942765602754] and parameters: {'n_layers': 1, 'embedding_dim': 32, 'lr': 0.0004249111472269399, 'lambda_val': 0.0020354160620230074, 'batch_size': 1682, 'optimizer': 'Adam'}.
2026-06-22 08:53:39,690 - optuna.study.study - INFO - Trial 254 finished with values: [0.03459151777948666, 0.007485474295819124, 0.020075875763336862] and parameters: {'n_layers': 1, 'embedding_dim': 256, 'lr': 0.0004249111472269399, 'lambda_val': 4.45671829457462e-06, 'batch_size': 1423, 'optimizer': 'RMSprop'}.
2026-06-22 08:56:12,004 - experiment_functions - INFO - Early stopping at epoch 3450. Best Metrics: (0.0296847720024947, 0.006364468864468864, 0.016796411955290524)
2026-06-22 08:56:12,091 - optuna.study.study - INFO - Trial 255 finished with values: [0.0296847720024947, 0.006364468864468864, 0.016796411955290524] and parameters: {'n_layers': 2, 'embedding_dim': 64, 'lr': 0.0004249111472269399, 'lambda_val': 0.000442118077500333, 'batch_size': 2113, 'optimizer': 'Adam'}.
2026-06-22 08:59:12,234 - optuna.study.study - INFO - Trial 256 finished with values: [0.033518905800616394, 0.007221801187318428, 0.019416832761838584] and parameters: {'n_layers': 1, 'embedding_dim': 128, 'lr': 0.0004249111472269399, 'lambda_val': 9.580805901998717e-05, 'batch_size': 2524, 'optimizer': 'Adam'}.
2026-06-22 09:01:10,993 - experiment_functions - INFO - Early stopping at epoch 2450. Best Metrics: (0.028175646107923003, 0.0059981684981684985, 0.01590095115069777)
2026-06-22 09:01:11,073 - optuna.study.study - INFO - Trial 257 finished with values: [0.028175646107923003, 0.0059981684981684985, 0.01590095115069777] and parameters: {'n_layers': 2, 'embedding_dim': 128, 'lr': 0.0004249111472269399, 'lambda_val': 9.580805901998717e-05, 'batch_size': 4064, 'optimizer': 'Adam'}.
2026-06-22 09:02:12,356 - experiment_functions - INFO - Early stopping at epoch 1100. Best Metrics: (0.021001601809160577, 0.0046008589112037385, 0.011485166245097819)
2026-06-22 09:02:12,475 - optuna.study.study - INFO - Trial 258 finished with values: [0.021001601809160577, 0.0046008589112037385, 0.011485166245097819] and parameters: {'n_layers': 4, 'embedding_dim': 128, 'lr': 0.0004249111472269399, 'lambda_val': 4.017786575271443e-05, 'batch_size': 2524, 'optimizer': 'Adam'}.
2026-06-22 09:05:07,035 - optuna.study.study - INFO - Trial 259 finished with values: [0.032205123991232106, 0.007011810029051409, 0.018563570958462984] and parameters: {'n_layers': 1, 'embedding_dim': 96, 'lr': 0.0004249111472269399, 'lambda_val': 9.580805901998717e-05, 'batch_size': 2524, 'optimizer': 'Adam'}.
2026-06-22 09:06:49,049 - experiment_functions - INFO - Early stopping at epoch 2200. Best Metrics: (0.02903243956041558, 0.006414993052924088, 0.016481380214876794)
2026-06-22 09:06:49,134 - optuna.study.study - INFO - Trial 260 finished with values: [0.02903243956041558, 0.006414993052924088, 0.016481380214876794] and parameters: {'n_layers': 2, 'embedding_dim': 96, 'lr': 0.0004249111472269399, 'lambda_val': 9.580805901998717e-05, 'batch_size': 930, 'optimizer': 'RMSprop'}.
2026-06-22 09:09:45,709 - optuna.study.study - INFO - Trial 261 finished with values: [0.035225763067696925, 0.007559681697612734, 0.020418383645418522] and parameters: {'n_layers': 1, 'embedding_dim': 96, 'lr': 0.0005396605078172515, 'lambda_val': 9.580805901998717e-05, 'batch_size': 3010, 'optimizer': 'RMSprop'}.
2026-06-22 09:12:25,273 - experiment_functions - INFO - Early stopping at epoch 3600. Best Metrics: (0.02922241107745381, 0.006266578249336871, 0.016488875149281202)
2026-06-22 09:12:25,370 - optuna.study.study - INFO - Trial 262 finished with values: [0.02922241107745381, 0.006266578249336871, 0.016488875149281202] and parameters: {'n_layers': 2, 'embedding_dim': 64, 'lr': 0.0004249111472269399, 'lambda_val': 9.580805901998717e-05, 'batch_size': 2551, 'optimizer': 'Adam'}.
2026-06-22 09:15:13,427 - optuna.study.study - INFO - Trial 263 finished with values: [0.02919005089419605, 0.006460780598711633, 0.01695447686093046] and parameters: {'n_layers': 1, 'embedding_dim': 64, 'lr': 0.0004249111472269399, 'lambda_val': 9.580805901998717e-05, 'batch_size': 2006, 'optimizer': 'Adam'}.
2026-06-22 09:15:36,096 - experiment_functions - INFO - Early stopping at epoch 500. Best Metrics: (0.00044300540948302014, 0.0001231527093596059, 0.0002448344152953776)
2026-06-22 09:15:36,188 - optuna.study.study - INFO - Trial 264 finished with values: [0.00044300540948302014, 0.0001231527093596059, 0.0002448344152953776] and parameters: {'n_layers': 2, 'embedding_dim': 32, 'lr': 0.0004249111472269399, 'lambda_val': 0.0001132240545098155, 'batch_size': 4064, 'optimizer': 'SGD'}.
2026-06-22 09:18:22,553 - optuna.study.study - INFO - Trial 265 finished with values: [0.020430968030772902, 0.004537703675634711, 0.012298735641688497] and parameters: {'n_layers': 1, 'embedding_dim': 64, 'lr': 0.0004249111472269399, 'lambda_val': 8.803132640891692e-06, 'batch_size': 930, 'optimizer': 'Adam'}.
2026-06-22 09:18:46,177 - experiment_functions - INFO - Early stopping at epoch 500. Best Metrics: (0.0006125818254352202, 0.00011683718580270306, 0.00029267540997631396)
2026-06-22 09:18:46,304 - optuna.study.study - INFO - Trial 266 finished with values: [0.0006125818254352202, 0.00011683718580270306, 0.00029267540997631396] and parameters: {'n_layers': 2, 'embedding_dim': 64, 'lr': 0.0004249111472269399, 'lambda_val': 0.000442118077500333, 'batch_size': 2829, 'optimizer': 'SGD'}.
2026-06-22 09:21:45,325 - optuna.study.study - INFO - Trial 267 finished with values: [0.03209611158309047, 0.007000757862826828, 0.018596322427137418] and parameters: {'n_layers': 1, 'embedding_dim': 128, 'lr': 0.0004249111472269399, 'lambda_val': 0.000442118077500333, 'batch_size': 2006, 'optimizer': 'Adam'}.
2026-06-22 09:24:37,593 - optuna.study.study - INFO - Trial 268 finished with values: [0.01292274781384051, 0.0030077680939749906, 0.007500275099493489] and parameters: {'n_layers': 2, 'embedding_dim': 64, 'lr': 0.00015137207544828573, 'lambda_val': 0.000442118077500333, 'batch_size': 2524, 'optimizer': 'Adam'}.
2026-06-22 09:27:28,101 - optuna.study.study - INFO - Trial 269 finished with values: [0.03390785663268305, 0.007152330428192497, 0.019406862360149123] and parameters: {'n_layers': 1, 'embedding_dim': 64, 'lr': 0.0004249111472269399, 'lambda_val': 0.000442118077500333, 'batch_size': 3046, 'optimizer': 'Adam'}.
2026-06-22 09:28:28,667 - experiment_functions - INFO - Early stopping at epoch 1300. Best Metrics: (0.015411700623729173, 0.003530377668308703, 0.008655347564372596)
2026-06-22 09:28:28,758 - optuna.study.study - INFO - Trial 270 finished with values: [0.015411700623729173, 0.003530377668308703, 0.008655347564372596] and parameters: {'n_layers': 2, 'embedding_dim': 96, 'lr': 0.0004249111472269399, 'lambda_val': 0.02347847913120635, 'batch_size': 930, 'optimizer': 'RMSprop'}.
2026-06-22 09:31:18,448 - optuna.study.study - INFO - Trial 271 finished with values: [0.028952107971165094, 0.006342364532019705, 0.01654798086778221] and parameters: {'n_layers': 2, 'embedding_dim': 32, 'lr': 0.0004249111472269399, 'lambda_val': 9.580805901998717e-05, 'batch_size': 2524, 'optimizer': 'Adam'}.
2026-06-22 09:32:00,154 - experiment_functions - INFO - Early stopping at epoch 900. Best Metrics: (0.030194708083503552, 0.006489200454717696, 0.01719563905417503)
2026-06-22 09:32:00,227 - optuna.study.study - INFO - Trial 272 finished with values: [0.030194708083503552, 0.006489200454717696, 0.01719563905417503] and parameters: {'n_layers': 1, 'embedding_dim': 96, 'lr': 0.0009385206853318974, 'lambda_val': 5.867428769760123e-05, 'batch_size': 3046, 'optimizer': 'RMSprop'}.
2026-06-22 09:34:48,312 - optuna.study.study - INFO - Trial 273 finished with values: [0.025883285337672923, 0.005802387267904509, 0.014823107004168844] and parameters: {'n_layers': 1, 'embedding_dim': 64, 'lr': 0.00029478525006326924, 'lambda_val': 0.014473661729751385, 'batch_size': 2655, 'optimizer': 'RMSprop'}.
2026-06-22 09:35:12,442 - experiment_functions - INFO - Early stopping at epoch 500. Best Metrics: (0.0005567810143290358, 0.00011210054313502589, 0.00026214123534588045)
2026-06-22 09:35:12,582 - optuna.study.study - INFO - Trial 274 finished with values: [0.0005567810143290358, 0.00011210054313502589, 0.00026214123534588045] and parameters: {'n_layers': 2, 'embedding_dim': 96, 'lr': 0.0004249111472269399, 'lambda_val': 0.000442118077500333, 'batch_size': 4051, 'optimizer': 'SGD'}.
2026-06-22 09:36:23,022 - experiment_functions - INFO - Early stopping at epoch 1500. Best Metrics: (0.030029744494028072, 0.006489200454717696, 0.01739307781243835)
2026-06-22 09:36:23,114 - optuna.study.study - INFO - Trial 275 finished with values: [0.030029744494028072, 0.006489200454717696, 0.01739307781243835] and parameters: {'n_layers': 2, 'embedding_dim': 96, 'lr': 0.0004249111472269399, 'lambda_val': 8.803132640891692e-06, 'batch_size': 930, 'optimizer': 'RMSprop'}.
2026-06-22 09:37:31,125 - experiment_functions - INFO - Early stopping at epoch 1500. Best Metrics: (0.025517452498932915, 0.0055687128962991035, 0.01428472505466065)
2026-06-22 09:37:31,228 - optuna.study.study - INFO - Trial 276 finished with values: [0.025517452498932915, 0.0055687128962991035, 0.01428472505466065] and parameters: {'n_layers': 2, 'embedding_dim': 64, 'lr': 0.0005396605078172515, 'lambda_val': 2.887932809602638e-05, 'batch_size': 4061, 'optimizer': 'RMSprop'}.
2026-06-22 09:40:52,198 - optuna.study.study - INFO - Trial 277 finished with values: [0.03463333479392667, 0.007365479348237969, 0.019870960472163718] and parameters: {'n_layers': 1, 'embedding_dim': 256, 'lr': 0.0004249111472269399, 'lambda_val': 0.000442118077500333, 'batch_size': 4015, 'optimizer': 'Adam'}.
2026-06-22 09:43:42,307 - optuna.study.study - INFO - Trial 278 finished with values: [0.009588394303955724, 0.002235695339143615, 0.005676914758685955] and parameters: {'n_layers': 2, 'embedding_dim': 64, 'lr': 0.00012737007888382856, 'lambda_val': 0.0006801364658308589, 'batch_size': 2784, 'optimizer': 'RMSprop'}.
2026-06-22 09:46:32,373 - optuna.study.study - INFO - Trial 279 finished with values: [0.031874332386076794, 0.006917077175697865, 0.018693453147500746] and parameters: {'n_layers': 1, 'embedding_dim': 64, 'lr': 0.0004249111472269399, 'lambda_val': 0.0001719588996282977, 'batch_size': 3046, 'optimizer': 'Adam'}.
2026-06-22 09:49:36,878 - optuna.study.study - INFO - Trial 280 finished with values: [0.029599383050811535, 0.006364468864468864, 0.017228938232534453] and parameters: {'n_layers': 2, 'embedding_dim': 96, 'lr': 0.0004249111472269399, 'lambda_val': 9.580805901998717e-05, 'batch_size': 1892, 'optimizer': 'Adam'}.
2026-06-22 09:52:19,812 - optuna.study.study - INFO - Trial 281 finished with values: [0.024951594505005562, 0.005627131489200455, 0.01484172178392084] and parameters: {'n_layers': 1, 'embedding_dim': 32, 'lr': 0.0004249111472269399, 'lambda_val': 0.000442118077500333, 'batch_size': 1594, 'optimizer': 'Adam'}.
2026-06-22 09:55:10,253 - optuna.study.study - INFO - Trial 282 finished with values: [0.03328143192068948, 0.007164961475306304, 0.019198940727064625] and parameters: {'n_layers': 1, 'embedding_dim': 64, 'lr': 0.0004249111472269399, 'lambda_val': 0.000442118077500333, 'batch_size': 3424, 'optimizer': 'Adam'}.
2026-06-22 09:57:58,942 - optuna.study.study - INFO - Trial 283 finished with values: [0.02515639977075527, 0.005595553871415941, 0.014680969004263045] and parameters: {'n_layers': 1, 'embedding_dim': 64, 'lr': 0.00025949794187037214, 'lambda_val': 0.0001132240545098155, 'batch_size': 4064, 'optimizer': 'RMSprop'}.
2026-06-22 09:58:28,661 - experiment_functions - INFO - Early stopping at epoch 650. Best Metrics: (0.03191094486661377, 0.006662877352532525, 0.01862436577446809)
2026-06-22 09:58:28,742 - optuna.study.study - INFO - Trial 284 finished with values: [0.03191094486661377, 0.006662877352532525, 0.01862436577446809] and parameters: {'n_layers': 1, 'embedding_dim': 64, 'lr': 0.0035447951632022754, 'lambda_val': 9.580805901998717e-05, 'batch_size': 2113, 'optimizer': 'Adam'}.
2026-06-22 09:59:57,747 - experiment_functions - INFO - Early stopping at epoch 1950. Best Metrics: (0.03067788075153039, 0.006708664898320071, 0.017478647033234155)
2026-06-22 09:59:57,826 - optuna.study.study - INFO - Trial 285 finished with values: [0.03067788075153039, 0.006708664898320071, 0.017478647033234155] and parameters: {'n_layers': 1, 'embedding_dim': 128, 'lr': 0.0004249111472269399, 'lambda_val': 0.004689022509389867, 'batch_size': 2524, 'optimizer': 'RMSprop'}.
2026-06-22 10:02:31,959 - experiment_functions - INFO - Early stopping at epoch 3550. Best Metrics: (0.016139726602295183, 0.003271441202475685, 0.008860997244198525)
2026-06-22 10:02:32,045 - optuna.study.study - INFO - Trial 286 finished with values: [0.016139726602295183, 0.003271441202475685, 0.008860997244198525] and parameters: {'n_layers': 2, 'embedding_dim': 64, 'lr': 0.0015973413467103624, 'lambda_val': 5.867428769760123e-05, 'batch_size': 930, 'optimizer': 'RMSprop'}.
2026-06-22 10:03:28,667 - experiment_functions - INFO - Early stopping at epoch 1150. Best Metrics: (0.026386223120278215, 0.005775546292787672, 0.014982329902108722)
2026-06-22 10:03:28,736 - optuna.study.study - INFO - Trial 287 finished with values: [0.026386223120278215, 0.005775546292787672, 0.014982329902108722] and parameters: {'n_layers': 2, 'embedding_dim': 128, 'lr': 0.0004249111472269399, 'lambda_val': 0.000442118077500333, 'batch_size': 2362, 'optimizer': 'RMSprop'}.
2026-06-22 10:04:40,428 - experiment_functions - INFO - Early stopping at epoch 1550. Best Metrics: (0.024661934749740228, 0.0053476695718075035, 0.013695160607604057)
2026-06-22 10:04:40,535 - optuna.study.study - INFO - Trial 288 finished with values: [0.024661934749740228, 0.0053476695718075035, 0.013695160607604057] and parameters: {'n_layers': 3, 'embedding_dim': 64, 'lr': 0.00037811925768249915, 'lambda_val': 0.001122794793330287, 'batch_size': 1914, 'optimizer': 'Adam'}.
2026-06-22 10:07:29,541 - optuna.study.study - INFO - Trial 289 finished with values: [0.02897410326878199, 0.0062713148920045475, 0.016904640512775276] and parameters: {'n_layers': 1, 'embedding_dim': 64, 'lr': 0.0004249111472269399, 'lambda_val': 4.45671829457462e-06, 'batch_size': 1423, 'optimizer': 'Adam'}.
2026-06-22 10:09:27,936 - experiment_functions - INFO - Early stopping at epoch 2100. Best Metrics: (0.03019676901097353, 0.006366047745358091, 0.016680302447351126)
2026-06-22 10:09:28,013 - optuna.study.study - INFO - Trial 290 finished with values: [0.03019676901097353, 0.006366047745358091, 0.016680302447351126] and parameters: {'n_layers': 2, 'embedding_dim': 256, 'lr': 0.00037811925768249915, 'lambda_val': 8.803132640891692e-06, 'batch_size': 1638, 'optimizer': 'RMSprop'}.
2026-06-22 10:11:14,489 - experiment_functions - INFO - Early stopping at epoch 2200. Best Metrics: (0.02721111668138743, 0.005881331312365795, 0.015244456033214598)
2026-06-22 10:11:14,573 - optuna.study.study - INFO - Trial 291 finished with values: [0.02721111668138743, 0.005881331312365795, 0.015244456033214598] and parameters: {'n_layers': 2, 'embedding_dim': 128, 'lr': 0.000331116825193498, 'lambda_val': 0.000442118077500333, 'batch_size': 3711, 'optimizer': 'Adam'}.
2026-06-22 10:14:33,669 - optuna.study.study - INFO - Trial 292 finished with values: [0.03420036917389231, 0.007326007326007326, 0.019480585015986207] and parameters: {'n_layers': 1, 'embedding_dim': 256, 'lr': 0.0004249111472269399, 'lambda_val': 2.7155265773677084e-05, 'batch_size': 2113, 'optimizer': 'Adam'}.
2026-06-22 10:16:45,274 - experiment_functions - INFO - Early stopping at epoch 3050. Best Metrics: (0.0004598635028738484, 0.00012788935202728306, 0.00024600737817512584)
2026-06-22 10:16:45,362 - optuna.study.study - INFO - Trial 293 finished with values: [0.0004598635028738484, 0.00012788935202728306, 0.00024600737817512584] and parameters: {'n_layers': 1, 'embedding_dim': 128, 'lr': 9.191449033719155e-05, 'lambda_val': 0.0003741746878936465, 'batch_size': 2006, 'optimizer': 'Adam'}.
2026-06-22 10:18:01,808 - experiment_functions - INFO - Early stopping at epoch 1350. Best Metrics: (0.02867387625348324, 0.0061702665150941026, 0.016173754037127057)
2026-06-22 10:18:01,902 - optuna.study.study - INFO - Trial 294 finished with values: [0.02867387625348324, 0.0061702665150941026, 0.016173754037127057] and parameters: {'n_layers': 2, 'embedding_dim': 256, 'lr': 0.0004249111472269399, 'lambda_val': 8.803132640891692e-06, 'batch_size': 930, 'optimizer': 'RMSprop'}.
2026-06-22 10:19:39,582 - experiment_functions - INFO - Early stopping at epoch 2100. Best Metrics: (0.030495827556066814, 0.006503410382720727, 0.017277821146738908)
2026-06-22 10:19:39,666 - optuna.study.study - INFO - Trial 295 finished with values: [0.030495827556066814, 0.006503410382720727, 0.017277821146738908] and parameters: {'n_layers': 2, 'embedding_dim': 96, 'lr': 0.0004249111472269399, 'lambda_val': 0.0006249538563380107, 'batch_size': 1638, 'optimizer': 'Adam'}.
2026-06-22 10:22:31,345 - optuna.study.study - INFO - Trial 296 finished with values: [0.03449736258079067, 0.00735442718201339, 0.01970677212691072] and parameters: {'n_layers': 1, 'embedding_dim': 64, 'lr': 0.0004249111472269399, 'lambda_val': 5.867428769760123e-05, 'batch_size': 3010, 'optimizer': 'RMSprop'}.
2026-06-22 10:25:28,487 - optuna.study.study - INFO - Trial 297 finished with values: [0.030719572911025225, 0.0066407730200833655, 0.01768924525774052] and parameters: {'n_layers': 2, 'embedding_dim': 64, 'lr': 0.0004249111472269399, 'lambda_val': 0.000442118077500333, 'batch_size': 930, 'optimizer': 'Adam'}.
2026-06-22 10:26:01,115 - experiment_functions - INFO - Early stopping at epoch 700. Best Metrics: (0.013865229115675082, 0.002944612858405962, 0.0075586242188072665)
2026-06-22 10:26:01,198 - optuna.study.study - INFO - Trial 298 finished with values: [0.013865229115675082, 0.002944612858405962, 0.0075586242188072665] and parameters: {'n_layers': 2, 'embedding_dim': 64, 'lr': 0.0012653624571519182, 'lambda_val': 0.004689022509389867, 'batch_size': 2362, 'optimizer': 'RMSprop'}.
2026-06-22 10:26:30,169 - experiment_functions - INFO - Early stopping at epoch 500. Best Metrics: (0.00038873690858830506, 0.00010262725779967159, 0.0002128630821755053)
2026-06-22 10:26:30,246 - optuna.study.study - INFO - Trial 299 finished with values: [0.00038873690858830506, 0.00010262725779967159, 0.0002128630821755053] and parameters: {'n_layers': 2, 'embedding_dim': 256, 'lr': 0.0004249111472269399, 'lambda_val': 8.803132640891692e-06, 'batch_size': 2524, 'optimizer': 'SGD'}.
2026-06-22 10:26:30,260 - root - INFO - Selected Trial 261 based on Max ndcg: 0.0204
2026-06-22 10:26:30,260 - root - INFO - Associated Recall: 0.0352
2026-06-22 10:26:30,260 - experiment_functions - INFO - Training the best model ... for e_yelp_1c2dcs
2026-06-22 10:27:54,359 - experiment_functions - INFO - Early stopping at epoch 1900. Best Metrics: (0.03520017871484025, 0.007498105342932929, 0.020138925940688907)
2026-06-22 10:27:58,031 - root - INFO -   **** Training e_yelp_1c2dcs_rand1
2026-06-22 10:27:58,199 - root - INFO -   **** Getting 575241/1274132 random edges
2026-06-22 10:27:58,502 - optuna.storages._rdb.storage - INFO - A new study created in RDB with name: Study_e_yelp_1c2dcs_rand1
2026-06-22 10:28:23,596 - experiment_functions - INFO - Early stopping at epoch 550. Best Metrics: (0.0006172731431382203, 0.0001294682329165088, 0.0003512473826438529)
2026-06-22 10:28:23,680 - optuna.study.study - INFO - Trial 0 finished with values: [0.0006172731431382203, 0.0001294682329165088, 0.0003512473826438529] and parameters: {'n_layers': 1, 'embedding_dim': 96, 'lr': 2.098640680008877e-05, 'lambda_val': 0.04107052429657521, 'batch_size': 588, 'optimizer': 'Adam'}.
2026-06-22 10:28:49,331 - experiment_functions - INFO - Early stopping at epoch 500. Best Metrics: (0.0005198345067145893, 0.00011999494758115447, 0.0002950418031039107)
