2026-06-17 11:08:49,280 - optuna.study.study - INFO - Trial 55 finished with values: [0.0005856614279210673, 0.00012315270935960593, 0.0003213372387256734] and parameters: {'n_layers': 3, 'embedding_dim': 256, 'lr': 6.301201924940835e-05, 'lambda_val': 0.010091375962284294, 'batch_size': 1615, 'optimizer': 'SGD'}.
2026-06-17 11:09:48,252 - experiment_functions - INFO - Early stopping at epoch 1050. Best Metrics: (0.003019955801015112, 0.0008068081343943415, 0.0018216683922142923)
2026-06-17 11:09:48,323 - optuna.study.study - INFO - Trial 56 finished with values: [0.003019955801015112, 0.0008068081343943415, 0.0018216683922142923] and parameters: {'n_layers': 4, 'embedding_dim': 256, 'lr': 0.0011183305289179514, 'lambda_val': 0.00027668479073292746, 'batch_size': 3004, 'optimizer': 'Adam'}.
2026-06-17 11:10:25,596 - experiment_functions - INFO - Early stopping at epoch 650. Best Metrics: (0.0028974006720606025, 0.0007989137299482126, 0.001867333810827503)
2026-06-17 11:10:25,663 - optuna.study.study - INFO - Trial 57 finished with values: [0.0028974006720606025, 0.0007989137299482126, 0.001867333810827503] and parameters: {'n_layers': 4, 'embedding_dim': 256, 'lr': 0.013498745374989938, 'lambda_val': 2.2853011169521347e-06, 'batch_size': 1507, 'optimizer': 'RMSprop'}.
2026-06-17 11:12:41,745 - experiment_functions - INFO - Early stopping at epoch 2500. Best Metrics: (0.0033527471905964944, 0.0008636478464064671, 0.0020363368614721425)
2026-06-17 11:12:41,834 - optuna.study.study - INFO - Trial 58 finished with values: [0.0033527471905964944, 0.0008636478464064671, 0.0020363368614721425] and parameters: {'n_layers': 4, 'embedding_dim': 256, 'lr': 0.0005841453281578621, 'lambda_val': 1.0310836199436669e-05, 'batch_size': 1467, 'optimizer': 'Adam'}.
2026-06-17 11:13:13,550 - experiment_functions - INFO - Early stopping at epoch 650. Best Metrics: (0.00278620394710963, 0.000691549829480864, 0.001734903879326427)
2026-06-17 11:13:13,640 - optuna.study.study - INFO - Trial 59 finished with values: [0.00278620394710963, 0.000691549829480864, 0.001734903879326427] and parameters: {'n_layers': 1, 'embedding_dim': 256, 'lr': 0.005427188960178344, 'lambda_val': 3.399802510238604e-06, 'batch_size': 2215, 'optimizer': 'RMSprop'}.
2026-06-17 11:15:54,281 - optuna.study.study - INFO - Trial 60 finished with values: [0.003368133215577619, 0.0007215485663761525, 0.001940013323705145] and parameters: {'n_layers': 1, 'embedding_dim': 32, 'lr': 0.0005086943405728801, 'lambda_val': 0.00027668479073292746, 'batch_size': 3672, 'optimizer': 'Adam'}.
2026-06-17 11:16:21,560 - experiment_functions - INFO - Early stopping at epoch 550. Best Metrics: (0.002188523063861234, 0.000530503978779841, 0.0014286570004969196)
2026-06-17 11:16:21,647 - optuna.study.study - INFO - Trial 61 finished with values: [0.002188523063861234, 0.000530503978779841, 0.0014286570004969196] and parameters: {'n_layers': 1, 'embedding_dim': 256, 'lr': 0.010547366503973673, 'lambda_val': 0.007077349748530695, 'batch_size': 3274, 'optimizer': 'Adam'}.
2026-06-17 11:17:19,563 - experiment_functions - INFO - Early stopping at epoch 1050. Best Metrics: (0.002212753986111206, 0.0006426045219148668, 0.0013460873838955251)
2026-06-17 11:17:19,662 - optuna.study.study - INFO - Trial 62 finished with values: [0.002212753986111206, 0.0006426045219148668, 0.0013460873838955251] and parameters: {'n_layers': 4, 'embedding_dim': 256, 'lr': 0.0005841453281578621, 'lambda_val': 0.06383370776268556, 'batch_size': 3371, 'optimizer': 'RMSprop'}.
2026-06-17 11:20:04,768 - experiment_functions - INFO - Early stopping at epoch 3600. Best Metrics: (0.0024408639806674883, 0.000546292787672098, 0.0014380508445096798)
2026-06-17 11:20:04,844 - optuna.study.study - INFO - Trial 63 finished with values: [0.0024408639806674883, 0.000546292787672098, 0.0014380508445096798] and parameters: {'n_layers': 1, 'embedding_dim': 256, 'lr': 0.00035885552475151193, 'lambda_val': 6.36485192314748e-05, 'batch_size': 1677, 'optimizer': 'Adam'}.
2026-06-17 11:20:39,919 - experiment_functions - INFO - Early stopping at epoch 800. Best Metrics: (0.0023311978037983258, 0.000524188455222938, 0.001454272271038085)
2026-06-17 11:20:40,011 - optuna.study.study - INFO - Trial 64 finished with values: [0.0023311978037983258, 0.000524188455222938, 0.001454272271038085] and parameters: {'n_layers': 1, 'embedding_dim': 64, 'lr': 0.0009353759827353638, 'lambda_val': 0.0157499897510737, 'batch_size': 3489, 'optimizer': 'RMSprop'}.
2026-06-17 11:23:32,982 - optuna.study.study - INFO - Trial 65 finished with values: [0.0014496154490315433, 0.0003110395351774662, 0.0009253708039376591] and parameters: {'n_layers': 2, 'embedding_dim': 96, 'lr': 0.0001269804893438298, 'lambda_val': 0.0002536793799269488, 'batch_size': 3772, 'optimizer': 'Adam'}.
2026-06-17 11:24:02,046 - experiment_functions - INFO - Early stopping at epoch 500. Best Metrics: (0.0006201068773777235, 0.0001389415182518631, 0.0003485195849062467)
2026-06-17 11:24:02,131 - optuna.study.study - INFO - Trial 66 finished with values: [0.0006201068773777235, 0.0001389415182518631, 0.0003485195849062467] and parameters: {'n_layers': 4, 'embedding_dim': 256, 'lr': 0.0001123455506269706, 'lambda_val': 0.0003014053503940445, 'batch_size': 2971, 'optimizer': 'SGD'}.
2026-06-17 11:24:46,229 - experiment_functions - INFO - Early stopping at epoch 1000. Best Metrics: (0.0030264197199697087, 0.0007215485663761525, 0.0019156778455934685)
2026-06-17 11:24:46,906 - optuna.study.study - INFO - Trial 67 finished with values: [0.0030264197199697087, 0.0007215485663761525, 0.0019156778455934685] and parameters: {'n_layers': 2, 'embedding_dim': 64, 'lr': 0.0014337059824812508, 'lambda_val': 0.00012072062045747035, 'batch_size': 2622, 'optimizer': 'RMSprop'}.
2026-06-17 11:25:10,244 - experiment_functions - INFO - Early stopping at epoch 500. Best Metrics: (0.0006503143401095944, 0.00014367816091954025, 0.000375154880279381)
2026-06-17 11:25:10,340 - optuna.study.study - INFO - Trial 68 finished with values: [0.0006503143401095944, 0.00014367816091954025, 0.000375154880279381] and parameters: {'n_layers': 2, 'embedding_dim': 64, 'lr': 0.0008643514337665815, 'lambda_val': 0.0157499897510737, 'batch_size': 2688, 'optimizer': 'SGD'}.
2026-06-17 11:27:52,456 - optuna.study.study - INFO - Trial 69 finished with values: [0.0014585629145610166, 0.0003047240116205634, 0.0008287829704504552] and parameters: {'n_layers': 1, 'embedding_dim': 32, 'lr': 0.00019981610471907728, 'lambda_val': 0.006803754413438597, 'batch_size': 1308, 'optimizer': 'Adam'}.
2026-06-17 11:29:04,371 - experiment_functions - INFO - Early stopping at epoch 1600. Best Metrics: (0.0032049009126532474, 0.0008525956801818871, 0.0020585164262949132)
2026-06-17 11:29:04,453 - optuna.study.study - INFO - Trial 70 finished with values: [0.0032049009126532474, 0.0008525956801818871, 0.0020585164262949132] and parameters: {'n_layers': 4, 'embedding_dim': 64, 'lr': 0.0009353759827353638, 'lambda_val': 0.002174949430049739, 'batch_size': 934, 'optimizer': 'Adam'}.
2026-06-17 11:29:31,903 - experiment_functions - INFO - Early stopping at epoch 500. Best Metrics: (0.0005119722472738959, 0.00012788935202728306, 0.00035295085939045267)
2026-06-17 11:29:31,999 - optuna.study.study - INFO - Trial 71 finished with values: [0.0005119722472738959, 0.00012788935202728306, 0.00035295085939045267] and parameters: {'n_layers': 3, 'embedding_dim': 256, 'lr': 0.004071349079274372, 'lambda_val': 0.0157499897510737, 'batch_size': 2732, 'optimizer': 'SGD'}.
2026-06-17 11:30:55,381 - experiment_functions - INFO - Early stopping at epoch 1750. Best Metrics: (0.0007163786348471264, 0.00016420361247947458, 0.0003644501528253042)
2026-06-17 11:30:55,462 - optuna.study.study - INFO - Trial 72 finished with values: [0.0007163786348471264, 0.00016420361247947458, 0.0003644501528253042] and parameters: {'n_layers': 4, 'embedding_dim': 128, 'lr': 2.3690189761508195e-05, 'lambda_val': 2.0826898142241347e-06, 'batch_size': 1999, 'optimizer': 'Adam'}.
2026-06-17 11:33:40,465 - optuna.study.study - INFO - Trial 73 finished with values: [0.0022380198298412664, 0.0004847164329922951, 0.0013175916276218775] and parameters: {'n_layers': 1, 'embedding_dim': 64, 'lr': 0.00032551897153632015, 'lambda_val': 0.0157499897510737, 'batch_size': 1677, 'optimizer': 'RMSprop'}.
2026-06-17 11:34:16,889 - experiment_functions - INFO - Early stopping at epoch 800. Best Metrics: (0.0005443219533522582, 0.00011999494758115447, 0.00030562665571193465)
2026-06-17 11:34:17,694 - optuna.study.study - INFO - Trial 74 finished with values: [0.0005443219533522582, 0.00011999494758115447, 0.00030562665571193465] and parameters: {'n_layers': 4, 'embedding_dim': 64, 'lr': 0.09500174427276918, 'lambda_val': 1.9289997599017184e-06, 'batch_size': 2754, 'optimizer': 'SGD'}.
2026-06-17 11:37:03,933 - optuna.study.study - INFO - Trial 75 finished with values: [0.002835919320782978, 0.0006047113805734496, 0.0016634177702829973] and parameters: {'n_layers': 1, 'embedding_dim': 96, 'lr': 0.00032551897153632015, 'lambda_val': 4.480990319634202e-06, 'batch_size': 1677, 'optimizer': 'RMSprop'}.
2026-06-17 11:37:30,774 - experiment_functions - INFO - Early stopping at epoch 600. Best Metrics: (0.0026430905245717297, 0.0005889225716811924, 0.0015892553464168613)
2026-06-17 11:37:30,859 - optuna.study.study - INFO - Trial 76 finished with values: [0.0026430905245717297, 0.0005889225716811924, 0.0015892553464168613] and parameters: {'n_layers': 1, 'embedding_dim': 64, 'lr': 0.005427188960178344, 'lambda_val': 0.0010095160923301969, 'batch_size': 2754, 'optimizer': 'Adam'}.
2026-06-17 11:38:10,222 - experiment_functions - INFO - Early stopping at epoch 900. Best Metrics: (0.0019245903518518375, 0.0005747126436781609, 0.0012909332837399937)
2026-06-17 11:38:10,327 - optuna.study.study - INFO - Trial 77 finished with values: [0.0019245903518518375, 0.0005747126436781609, 0.0012909332837399937] and parameters: {'n_layers': 1, 'embedding_dim': 96, 'lr': 0.013498745374989938, 'lambda_val': 0.07070549290225871, 'batch_size': 1507, 'optimizer': 'RMSprop'}.
2026-06-17 11:38:41,134 - experiment_functions - INFO - Early stopping at epoch 700. Best Metrics: (0.002621743311836718, 0.0006031324996842238, 0.001680848599504091)
2026-06-17 11:38:41,222 - optuna.study.study - INFO - Trial 78 finished with values: [0.002621743311836718, 0.0006031324996842238, 0.001680848599504091] and parameters: {'n_layers': 2, 'embedding_dim': 32, 'lr': 0.005427188960178344, 'lambda_val': 7.067730208761557e-06, 'batch_size': 2754, 'optimizer': 'RMSprop'}.
2026-06-17 11:39:25,050 - experiment_functions - INFO - Early stopping at epoch 1000. Best Metrics: (0.0024061951814982937, 0.0005778704054566124, 0.0015481216509976303)
2026-06-17 11:39:25,135 - optuna.study.study - INFO - Trial 79 finished with values: [0.0024061951814982937, 0.0005778704054566124, 0.0015481216509976303] and parameters: {'n_layers': 1, 'embedding_dim': 96, 'lr': 0.008224572465900129, 'lambda_val': 5.710789183812623e-06, 'batch_size': 2151, 'optimizer': 'Adam'}.
2026-06-17 11:39:53,510 - experiment_functions - INFO - Early stopping at epoch 550. Best Metrics: (0.0023467701555213655, 0.0005620815965643552, 0.0015157904662233249)
2026-06-17 11:39:53,609 - optuna.study.study - INFO - Trial 80 finished with values: [0.0023467701555213655, 0.0005620815965643552, 0.0015157904662233249] and parameters: {'n_layers': 4, 'embedding_dim': 128, 'lr': 0.04368862190874824, 'lambda_val': 1.3107624180719716e-06, 'batch_size': 3806, 'optimizer': 'RMSprop'}.
2026-06-17 11:42:02,443 - experiment_functions - INFO - Early stopping at epoch 3100. Best Metrics: (0.0027944775474628898, 0.000618921308576481, 0.0017301480390122781)
2026-06-17 11:42:02,521 - optuna.study.study - INFO - Trial 81 finished with values: [0.0027944775474628898, 0.000618921308576481, 0.0017301480390122781] and parameters: {'n_layers': 2, 'embedding_dim': 32, 'lr': 0.00035885552475151193, 'lambda_val': 1.1791971258066213e-06, 'batch_size': 4010, 'optimizer': 'Adam'}.
2026-06-17 11:42:28,298 - experiment_functions - INFO - Early stopping at epoch 500. Best Metrics: (0.0004761429120967412, 0.00010894278135657447, 0.0002871876664158166)
2026-06-17 11:42:28,386 - optuna.study.study - INFO - Trial 82 finished with values: [0.0004761429120967412, 0.00010894278135657447, 0.0002871876664158166] and parameters: {'n_layers': 4, 'embedding_dim': 128, 'lr': 5.227830469065037e-05, 'lambda_val': 0.026705485236178328, 'batch_size': 1423, 'optimizer': 'SGD'}.
2026-06-17 11:42:54,384 - experiment_functions - INFO - Early stopping at epoch 550. Best Metrics: (0.002640891419922977, 0.0006078691423519011, 0.001730041525309741)
2026-06-17 11:42:54,470 - optuna.study.study - INFO - Trial 83 finished with values: [0.002640891419922977, 0.0006078691423519011, 0.001730041525309741] and parameters: {'n_layers': 1, 'embedding_dim': 128, 'lr': 0.013498745374989938, 'lambda_val': 2.5874592399511522e-05, 'batch_size': 1507, 'optimizer': 'Adam'}.
2026-06-17 11:43:24,128 - experiment_functions - INFO - Early stopping at epoch 650. Best Metrics: (0.0026922924216203634, 0.0006378678792471896, 0.0016926035037313188)
2026-06-17 11:43:24,220 - optuna.study.study - INFO - Trial 84 finished with values: [0.0026922924216203634, 0.0006378678792471896, 0.0016926035037313188] and parameters: {'n_layers': 2, 'embedding_dim': 64, 'lr': 0.0059130773813250445, 'lambda_val': 0.0006520933628630919, 'batch_size': 1423, 'optimizer': 'Adam'}.
2026-06-17 11:43:50,434 - experiment_functions - INFO - Early stopping at epoch 500. Best Metrics: (0.0006037767515314851, 0.0001278893520272831, 0.00031706929040337654)
2026-06-17 11:43:50,521 - optuna.study.study - INFO - Trial 85 finished with values: [0.0006037767515314851, 0.0001278893520272831, 0.00031706929040337654] and parameters: {'n_layers': 4, 'embedding_dim': 128, 'lr': 2.228050329341483e-05, 'lambda_val': 0.07164269953446842, 'batch_size': 3624, 'optimizer': 'Adam'}.
2026-06-17 11:44:31,824 - experiment_functions - INFO - Early stopping at epoch 800. Best Metrics: (0.002859871313682083, 0.0007578628268283441, 0.001872951381196586)
2026-06-17 11:44:32,166 - optuna.study.study - INFO - Trial 86 finished with values: [0.002859871313682083, 0.0007578628268283441, 0.001872951381196586] and parameters: {'n_layers': 2, 'embedding_dim': 256, 'lr': 0.013498745374989938, 'lambda_val': 1.9289997599017184e-06, 'batch_size': 1507, 'optimizer': 'Adam'}.
2026-06-17 11:44:57,447 - experiment_functions - INFO - Early stopping at epoch 500. Best Metrics: (0.0005673070147495401, 0.00012631047113805733, 0.0003128578922761915)
2026-06-17 11:44:57,534 - optuna.study.study - INFO - Trial 87 finished with values: [0.0005673070147495401, 0.00012631047113805733, 0.0003128578922761915] and parameters: {'n_layers': 4, 'embedding_dim': 96, 'lr': 6.112197042497074e-05, 'lambda_val': 0.06383370776268556, 'batch_size': 3371, 'optimizer': 'RMSprop'}.
2026-06-17 11:46:29,089 - experiment_functions - INFO - Early stopping at epoch 1850. Best Metrics: (0.003069572042118202, 0.0007878615637236327, 0.0018751394889476656)
2026-06-17 11:46:29,178 - optuna.study.study - INFO - Trial 88 finished with values: [0.003069572042118202, 0.0007878615637236327, 0.0018751394889476656] and parameters: {'n_layers': 2, 'embedding_dim': 256, 'lr': 0.0007216994691528258, 'lambda_val': 6.36485192314748e-05, 'batch_size': 2022, 'optimizer': 'RMSprop'}.
2026-06-17 11:47:48,776 - experiment_functions - INFO - Early stopping at epoch 1700. Best Metrics: (0.0028173063418898926, 0.0006173424276872554, 0.0017635756828052204)
2026-06-17 11:47:48,854 - optuna.study.study - INFO - Trial 89 finished with values: [0.0028173063418898926, 0.0006173424276872554, 0.0017635756828052204] and parameters: {'n_layers': 1, 'embedding_dim': 256, 'lr': 0.0005841453281578621, 'lambda_val': 0.0004867376939360758, 'batch_size': 2776, 'optimizer': 'RMSprop'}.
2026-06-17 11:50:20,959 - experiment_functions - INFO - Early stopping at epoch 3600. Best Metrics: (0.0006451261553448102, 0.0001389415182518631, 0.00034901602667358983)
2026-06-17 11:50:21,037 - optuna.study.study - INFO - Trial 90 finished with values: [0.0006451261553448102, 0.0001389415182518631, 0.00034901602667358983] and parameters: {'n_layers': 1, 'embedding_dim': 128, 'lr': 2.3186302985344887e-05, 'lambda_val': 0.006803754413438597, 'batch_size': 1467, 'optimizer': 'Adam'}.
2026-06-17 11:53:02,412 - optuna.study.study - INFO - Trial 91 finished with values: [0.002884550379889966, 0.0006078691423519011, 0.0017101327981590964] and parameters: {'n_layers': 2, 'embedding_dim': 32, 'lr': 0.00035885552475151193, 'lambda_val': 6.36485192314748e-05, 'batch_size': 4010, 'optimizer': 'RMSprop'}.
2026-06-17 11:53:25,724 - experiment_functions - INFO - Early stopping at epoch 500. Best Metrics: (0.0004616642639587054, 0.00011052166224580017, 0.00024005238518724978)
2026-06-17 11:53:25,849 - optuna.study.study - INFO - Trial 92 finished with values: [0.0004616642639587054, 0.00011052166224580017, 0.00024005238518724978] and parameters: {'n_layers': 2, 'embedding_dim': 96, 'lr': 2.228050329341483e-05, 'lambda_val': 0.04688879328088187, 'batch_size': 674, 'optimizer': 'RMSprop'}.
2026-06-17 11:53:59,134 - experiment_functions - INFO - Early stopping at epoch 750. Best Metrics: (0.002440741597651972, 0.0005636604774535809, 0.0015003071418350931)
2026-06-17 11:53:59,226 - optuna.study.study - INFO - Trial 93 finished with values: [0.002440741597651972, 0.0005636604774535809, 0.0015003071418350931] and parameters: {'n_layers': 2, 'embedding_dim': 64, 'lr': 0.0014337059824812508, 'lambda_val': 0.003295860410553125, 'batch_size': 4027, 'optimizer': 'Adam'}.
2026-06-17 11:54:23,953 - experiment_functions - INFO - Early stopping at epoch 500. Best Metrics: (0.0005082400213043255, 0.00011841606669192877, 0.0002726442186019559)
2026-06-17 11:54:24,023 - optuna.study.study - INFO - Trial 94 finished with values: [0.0005082400213043255, 0.00011841606669192877, 0.0002726442186019559] and parameters: {'n_layers': 3, 'embedding_dim': 128, 'lr': 0.00034156278403462873, 'lambda_val': 1.0922879240964027e-05, 'batch_size': 705, 'optimizer': 'SGD'}.
2026-06-17 11:55:31,580 - experiment_functions - INFO - Early stopping at epoch 1200. Best Metrics: (0.0030512584184555066, 0.0008036503726158898, 0.0019374453951875698)
2026-06-17 11:55:31,658 - optuna.study.study - INFO - Trial 95 finished with values: [0.0030512584184555066, 0.0008036503726158898, 0.0019374453951875698] and parameters: {'n_layers': 4, 'embedding_dim': 256, 'lr': 0.0013364645200376287, 'lambda_val': 1.170012968533328e-05, 'batch_size': 3100, 'optimizer': 'Adam'}.
2026-06-17 11:56:29,213 - experiment_functions - INFO - Early stopping at epoch 1300. Best Metrics: (0.003013072381493102, 0.0007578628268283441, 0.0019329150974265006)
2026-06-17 11:56:29,282 - optuna.study.study - INFO - Trial 96 finished with values: [0.003013072381493102, 0.0007578628268283441, 0.0019329150974265006] and parameters: {'n_layers': 2, 'embedding_dim': 96, 'lr': 0.0014337059824812508, 'lambda_val': 1.8109663387347854e-06, 'batch_size': 4027, 'optimizer': 'RMSprop'}.
2026-06-17 11:57:36,776 - experiment_functions - INFO - Early stopping at epoch 1600. Best Metrics: (0.0016717548321121137, 0.00047682202854616647, 0.0011041455921997894)
2026-06-17 11:57:36,855 - optuna.study.study - INFO - Trial 97 finished with values: [0.0016717548321121137, 0.00047682202854616647, 0.0011041455921997894] and parameters: {'n_layers': 1, 'embedding_dim': 64, 'lr': 0.09500174427276918, 'lambda_val': 0.039106784502058886, 'batch_size': 1222, 'optimizer': 'RMSprop'}.
2026-06-17 11:59:38,681 - experiment_functions - INFO - Early stopping at epoch 2900. Best Metrics: (0.000502573620009293, 0.00011683718580270305, 0.0002562551081499833)
2026-06-17 11:59:38,780 - optuna.study.study - INFO - Trial 98 finished with values: [0.000502573620009293, 0.00011683718580270305, 0.0002562551081499833] and parameters: {'n_layers': 1, 'embedding_dim': 96, 'lr': 2.375103917577605e-05, 'lambda_val': 4.480990319634202e-06, 'batch_size': 2688, 'optimizer': 'Adam'}.
2026-06-17 12:00:01,760 - experiment_functions - INFO - Early stopping at epoch 500. Best Metrics: (0.0005096549134164728, 0.00011525830491347733, 0.0002673735140074131)
2026-06-17 12:00:01,848 - optuna.study.study - INFO - Trial 99 finished with values: [0.0005096549134164728, 0.00011525830491347733, 0.0002673735140074131] and parameters: {'n_layers': 2, 'embedding_dim': 32, 'lr': 2.228050329341483e-05, 'lambda_val': 0.026401742926126893, 'batch_size': 3853, 'optimizer': 'SGD'}.
2026-06-17 12:02:49,622 - optuna.study.study - INFO - Trial 100 finished with values: [0.003310434535620584, 0.000719969685486927, 0.0019278010454002962] and parameters: {'n_layers': 4, 'embedding_dim': 32, 'lr': 0.0005086943405728801, 'lambda_val': 0.00027668479073292746, 'batch_size': 1677, 'optimizer': 'Adam'}.
2026-06-17 12:03:22,261 - experiment_functions - INFO - Early stopping at epoch 550. Best Metrics: (0.0025166361594772257, 0.0007010231148162183, 0.0015984794248479666)
2026-06-17 12:03:22,351 - optuna.study.study - INFO - Trial 101 finished with values: [0.0025166361594772257, 0.0007010231148162183, 0.0015984794248479666] and parameters: {'n_layers': 4, 'embedding_dim': 256, 'lr': 0.02017776312279877, 'lambda_val': 0.001035351481412494, 'batch_size': 3672, 'optimizer': 'Adam'}.
2026-06-17 12:05:21,172 - experiment_functions - INFO - Early stopping at epoch 2800. Best Metrics: (0.0028618628922939897, 0.0006220790703549324, 0.0017481415603360527)
