2026-06-16 23:16:59,678 - optuna.study.study - INFO - Trial 94 finished with values: [0.01989127620349044, 0.003959833270178098, 0.011030794694680279] and parameters: {'n_layers': 2, 'embedding_dim': 128, 'lr': 0.013825847167324911, 'lambda_val': 6.67969903638883e-05, 'batch_size': 2691, 'optimizer': 'RMSprop'}.
2026-06-16 23:17:33,597 - experiment_functions - INFO - Early stopping at epoch 550. Best Metrics: (0.00993823339479599, 0.002246747505368195, 0.005725116768366481)
2026-06-16 23:17:33,809 - optuna.study.study - INFO - Trial 95 finished with values: [0.00993823339479599, 0.002246747505368195, 0.005725116768366481] and parameters: {'n_layers': 4, 'embedding_dim': 96, 'lr': 0.005718146934581361, 'lambda_val': 5.119347523585741e-06, 'batch_size': 582, 'optimizer': 'Adam'}.
2026-06-16 23:18:05,636 - experiment_functions - INFO - Early stopping at epoch 650. Best Metrics: (0.0054629537072677994, 0.0012236326891499306, 0.002867278968339077)
2026-06-16 23:18:05,744 - optuna.study.study - INFO - Trial 96 finished with values: [0.0054629537072677994, 0.0012236326891499306, 0.002867278968339077] and parameters: {'n_layers': 4, 'embedding_dim': 32, 'lr': 0.0034515732366684274, 'lambda_val': 0.006249457405461014, 'batch_size': 1569, 'optimizer': 'Adam'}.
2026-06-16 23:18:33,003 - experiment_functions - INFO - Early stopping at epoch 500. Best Metrics: (0.0006206794445800559, 0.0001405203991410888, 0.0003337829589446284)
2026-06-16 23:18:33,076 - optuna.study.study - INFO - Trial 97 finished with values: [0.0006206794445800559, 0.0001405203991410888, 0.0003337829589446284] and parameters: {'n_layers': 4, 'embedding_dim': 64, 'lr': 5.308983857882518e-05, 'lambda_val': 0.0024405111270550373, 'batch_size': 3338, 'optimizer': 'Adam'}.
2026-06-16 23:20:09,240 - experiment_functions - INFO - Early stopping at epoch 1850. Best Metrics: (0.01821839241064314, 0.004122458001768347, 0.01042956071256432)
2026-06-16 23:20:09,322 - optuna.study.study - INFO - Trial 98 finished with values: [0.01821839241064314, 0.004122458001768347, 0.01042956071256432] and parameters: {'n_layers': 4, 'embedding_dim': 64, 'lr': 0.0006628139134621098, 'lambda_val': 3.327121177308548e-05, 'batch_size': 835, 'optimizer': 'RMSprop'}.
2026-06-16 23:20:36,063 - experiment_functions - INFO - Early stopping at epoch 550. Best Metrics: (0.011200943176855629, 0.0024267399267399272, 0.0068146339805547065)
2026-06-16 23:20:36,162 - optuna.study.study - INFO - Trial 99 finished with values: [0.011200943176855629, 0.0024267399267399272, 0.0068146339805547065] and parameters: {'n_layers': 2, 'embedding_dim': 64, 'lr': 0.00451036175366669, 'lambda_val': 3.2707990474449004e-05, 'batch_size': 2057, 'optimizer': 'RMSprop'}.
2026-06-16 23:21:05,804 - experiment_functions - INFO - Early stopping at epoch 550. Best Metrics: (0.009165432647355795, 0.0020793861311102693, 0.005444031566852538)
2026-06-16 23:21:05,880 - optuna.study.study - INFO - Trial 100 finished with values: [0.009165432647355795, 0.0020793861311102693, 0.005444031566852538] and parameters: {'n_layers': 2, 'embedding_dim': 128, 'lr': 0.0020532474965947955, 'lambda_val': 0.0015569229111002379, 'batch_size': 1837, 'optimizer': 'RMSprop'}.
2026-06-16 23:21:46,989 - experiment_functions - INFO - Early stopping at epoch 500. Best Metrics: (0.0005718470803081394, 0.00012157382847038021, 0.0003017847122704388)
2026-06-16 23:21:47,077 - optuna.study.study - INFO - Trial 101 finished with values: [0.0005718470803081394, 0.00012157382847038021, 0.0003017847122704388] and parameters: {'n_layers': 4, 'embedding_dim': 256, 'lr': 0.0003334703704985316, 'lambda_val': 1.4405090810627564e-05, 'batch_size': 3992, 'optimizer': 'SGD'}.
2026-06-16 23:22:27,973 - experiment_functions - INFO - Early stopping at epoch 500. Best Metrics: (0.000518151206139453, 0.00012631047113805733, 0.0002755079156389321)
2026-06-16 23:22:28,274 - optuna.study.study - INFO - Trial 102 finished with values: [0.000518151206139453, 0.00012631047113805733, 0.0002755079156389321] and parameters: {'n_layers': 4, 'embedding_dim': 256, 'lr': 2.084238356427606e-05, 'lambda_val': 0.0007587984579423599, 'batch_size': 3992, 'optimizer': 'SGD'}.
2026-06-16 23:23:26,523 - experiment_functions - INFO - Early stopping at epoch 1000. Best Metrics: (0.0209727704573192, 0.004619805481874448, 0.011603234098627953)
2026-06-16 23:23:26,599 - optuna.study.study - INFO - Trial 103 finished with values: [0.0209727704573192, 0.004619805481874448, 0.011603234098627953] and parameters: {'n_layers': 3, 'embedding_dim': 128, 'lr': 0.0006340132793158045, 'lambda_val': 2.970506579255523e-05, 'batch_size': 3321, 'optimizer': 'RMSprop'}.
2026-06-16 23:24:08,435 - experiment_functions - INFO - Early stopping at epoch 900. Best Metrics: (0.013811620062359932, 0.0028988253126184162, 0.008155365262739701)
2026-06-16 23:24:08,524 - optuna.study.study - INFO - Trial 104 finished with values: [0.013811620062359932, 0.0028988253126184162, 0.008155365262739701] and parameters: {'n_layers': 2, 'embedding_dim': 32, 'lr': 0.013825847167324911, 'lambda_val': 1.3976665248992833e-06, 'batch_size': 1627, 'optimizer': 'RMSprop'}.
2026-06-16 23:24:40,729 - experiment_functions - INFO - Early stopping at epoch 600. Best Metrics: (0.011310587630263156, 0.00245515978274599, 0.006197791999979775)
2026-06-16 23:24:40,833 - optuna.study.study - INFO - Trial 105 finished with values: [0.011310587630263156, 0.00245515978274599, 0.006197791999979775] and parameters: {'n_layers': 4, 'embedding_dim': 64, 'lr': 0.0018522973992639606, 'lambda_val': 1.9413402449837055e-05, 'batch_size': 4019, 'optimizer': 'RMSprop'}.
2026-06-16 23:27:53,821 - optuna.study.study - INFO - Trial 106 finished with values: [0.006839580328319011, 0.0015662498421119113, 0.004020097447149035] and parameters: {'n_layers': 3, 'embedding_dim': 64, 'lr': 0.00017384659942437723, 'lambda_val': 1.3976665248992833e-06, 'batch_size': 603, 'optimizer': 'RMSprop'}.
2026-06-16 23:32:01,113 - optuna.study.study - INFO - Trial 107 finished with values: [0.013149922357753304, 0.0028261967917140337, 0.007309457770468199] and parameters: {'n_layers': 2, 'embedding_dim': 256, 'lr': 0.0018038449883778583, 'lambda_val': 1.0768752731630495e-05, 'batch_size': 2708, 'optimizer': 'RMSprop'}.
2026-06-16 23:36:12,567 - optuna.study.study - INFO - Trial 108 finished with values: [0.02218676295423557, 0.0043356069218138185, 0.012365675820795136] and parameters: {'n_layers': 2, 'embedding_dim': 256, 'lr': 0.011485594305176742, 'lambda_val': 3.2707990474449004e-05, 'batch_size': 3052, 'optimizer': 'RMSprop'}.
2026-06-16 23:36:36,510 - experiment_functions - INFO - Early stopping at epoch 500. Best Metrics: (0.0004076956753678049, 9.631173424276874e-05, 0.0002589793575304578)
2026-06-16 23:36:36,605 - optuna.study.study - INFO - Trial 109 finished with values: [0.0004076956753678049, 9.631173424276874e-05, 0.0002589793575304578] and parameters: {'n_layers': 1, 'embedding_dim': 32, 'lr': 0.001105921045395747, 'lambda_val': 0.0009589330611107825, 'batch_size': 3920, 'optimizer': 'SGD'}.
2026-06-16 23:37:21,147 - experiment_functions - INFO - Early stopping at epoch 600. Best Metrics: (0.013736185828318793, 0.0030330301882026023, 0.007324366928598238)
2026-06-16 23:37:21,244 - optuna.study.study - INFO - Trial 110 finished with values: [0.013736185828318793, 0.0030330301882026023, 0.007324366928598238] and parameters: {'n_layers': 3, 'embedding_dim': 256, 'lr': 0.0020532474965947955, 'lambda_val': 2.1756819847548318e-06, 'batch_size': 3043, 'optimizer': 'Adam'}.
2026-06-16 23:40:20,384 - optuna.study.study - INFO - Trial 111 finished with values: [0.034051693523840985, 0.007543892888720475, 0.02023407138889815] and parameters: {'n_layers': 1, 'embedding_dim': 32, 'lr': 0.0007178694642074494, 'lambda_val': 1.0697648887853802e-06, 'batch_size': 2369, 'optimizer': 'RMSprop'}.
2026-06-16 23:41:30,614 - experiment_functions - INFO - Early stopping at epoch 950. Best Metrics: (0.018508683732160525, 0.004065618289756221, 0.010439131017997903)
2026-06-16 23:41:30,704 - optuna.study.study - INFO - Trial 112 finished with values: [0.018508683732160525, 0.004065618289756221, 0.010439131017997903] and parameters: {'n_layers': 3, 'embedding_dim': 256, 'lr': 0.0006340132793158045, 'lambda_val': 1.3976665248992833e-06, 'batch_size': 3321, 'optimizer': 'RMSprop'}.
2026-06-16 23:43:47,308 - experiment_functions - INFO - Early stopping at epoch 2850. Best Metrics: (0.018028705508719572, 0.004041935076417835, 0.009803478313167191)
2026-06-16 23:43:47,391 - optuna.study.study - INFO - Trial 113 finished with values: [0.018028705508719572, 0.004041935076417835, 0.009803478313167191] and parameters: {'n_layers': 4, 'embedding_dim': 32, 'lr': 0.0006628139134621098, 'lambda_val': 0.002293564989415113, 'batch_size': 582, 'optimizer': 'Adam'}.
2026-06-16 23:44:29,328 - experiment_functions - INFO - Early stopping at epoch 700. Best Metrics: (0.013387390144281931, 0.002883036503726159, 0.007427814672825012)
2026-06-16 23:44:29,418 - optuna.study.study - INFO - Trial 114 finished with values: [0.013387390144281931, 0.002883036503726159, 0.007427814672825012] and parameters: {'n_layers': 3, 'embedding_dim': 128, 'lr': 0.001105921045395747, 'lambda_val': 0.0009072609457664243, 'batch_size': 3466, 'optimizer': 'RMSprop'}.
2026-06-16 23:44:58,172 - experiment_functions - INFO - Early stopping at epoch 550. Best Metrics: (0.01257136898365838, 0.002668308702791462, 0.007072592150622006)
2026-06-16 23:44:58,311 - optuna.study.study - INFO - Trial 115 finished with values: [0.01257136898365838, 0.002668308702791462, 0.007072592150622006] and parameters: {'n_layers': 3, 'embedding_dim': 64, 'lr': 0.011485594305176742, 'lambda_val': 4.635335903630149e-06, 'batch_size': 1386, 'optimizer': 'RMSprop'}.
2026-06-16 23:48:11,877 - optuna.study.study - INFO - Trial 116 finished with values: [0.01543613334445187, 0.0034956422887457376, 0.009168083411791917] and parameters: {'n_layers': 3, 'embedding_dim': 64, 'lr': 0.00018562220957177872, 'lambda_val': 2.970506579255523e-05, 'batch_size': 1265, 'optimizer': 'RMSprop'}.
2026-06-16 23:48:39,000 - experiment_functions - INFO - Early stopping at epoch 550. Best Metrics: (0.019631183563037367, 0.004300871542250852, 0.011509035991911228)
2026-06-16 23:48:39,109 - optuna.study.study - INFO - Trial 117 finished with values: [0.019631183563037367, 0.004300871542250852, 0.011509035991911228] and parameters: {'n_layers': 1, 'embedding_dim': 64, 'lr': 0.010509275955690749, 'lambda_val': 0.00012027553665042037, 'batch_size': 3321, 'optimizer': 'Adam'}.
2026-06-16 23:49:15,571 - experiment_functions - INFO - Early stopping at epoch 500. Best Metrics: (0.0005094947377674179, 0.00012473159024883163, 0.0003106535060663404)
2026-06-16 23:49:15,657 - optuna.study.study - INFO - Trial 118 finished with values: [0.0005094947377674179, 0.00012473159024883163, 0.0003106535060663404] and parameters: {'n_layers': 3, 'embedding_dim': 256, 'lr': 0.0020532474965947955, 'lambda_val': 0.0015569229111002379, 'batch_size': 3711, 'optimizer': 'SGD'}.
2026-06-16 23:49:46,293 - experiment_functions - INFO - Early stopping at epoch 550. Best Metrics: (0.009506358934193463, 0.0020257041808765947, 0.005403535871514607)
2026-06-16 23:49:46,373 - optuna.study.study - INFO - Trial 119 finished with values: [0.009506358934193463, 0.0020257041808765947, 0.005403535871514607] and parameters: {'n_layers': 4, 'embedding_dim': 64, 'lr': 0.00451036175366669, 'lambda_val': 2.6858232738417883e-06, 'batch_size': 2057, 'optimizer': 'RMSprop'}.
2026-06-16 23:50:11,795 - experiment_functions - INFO - Early stopping at epoch 550. Best Metrics: (0.0005722583861622689, 0.00012946823291650877, 0.00029347324039045633)
2026-06-16 23:50:11,875 - optuna.study.study - INFO - Trial 120 finished with values: [0.0005722583861622689, 0.00012946823291650877, 0.00029347324039045633] and parameters: {'n_layers': 1, 'embedding_dim': 64, 'lr': 0.00021448253092756084, 'lambda_val': 4.546254137443526e-06, 'batch_size': 1909, 'optimizer': 'RMSprop'}.
2026-06-16 23:53:08,865 - experiment_functions - INFO - Early stopping at epoch 2900. Best Metrics: (0.021410381449734277, 0.004619805481874448, 0.012224267052685584)
2026-06-16 23:53:08,950 - optuna.study.study - INFO - Trial 121 finished with values: [0.021410381449734277, 0.004619805481874448, 0.012224267052685584] and parameters: {'n_layers': 4, 'embedding_dim': 128, 'lr': 0.0003334703704985316, 'lambda_val': 4.546254137443526e-06, 'batch_size': 3992, 'optimizer': 'Adam'}.
2026-06-16 23:56:35,038 - optuna.study.study - INFO - Trial 122 finished with values: [0.01997573533414073, 0.003932992295061261, 0.011197844868833502] and parameters: {'n_layers': 2, 'embedding_dim': 128, 'lr': 0.011485594305176742, 'lambda_val': 1.0768752731630495e-05, 'batch_size': 2889, 'optimizer': 'RMSprop'}.
2026-06-16 23:57:15,718 - experiment_functions - INFO - Early stopping at epoch 550. Best Metrics: (0.015337656581197942, 0.0034830112416319317, 0.009330595069981155)
2026-06-16 23:57:15,919 - optuna.study.study - INFO - Trial 123 finished with values: [0.015337656581197942, 0.0034830112416319317, 0.009330595069981155] and parameters: {'n_layers': 3, 'embedding_dim': 256, 'lr': 0.0018150056018687985, 'lambda_val': 6.67969903638883e-05, 'batch_size': 678, 'optimizer': 'RMSprop'}.
2026-06-17 00:00:15,576 - optuna.study.study - INFO - Trial 124 finished with values: [0.018841976463774123, 0.0039298345332828095, 0.010715011275238993] and parameters: {'n_layers': 2, 'embedding_dim': 32, 'lr': 0.017717847936403682, 'lambda_val': 1.0768752731630495e-05, 'batch_size': 835, 'optimizer': 'RMSprop'}.
2026-06-17 00:03:44,921 - optuna.study.study - INFO - Trial 125 finished with values: [0.0005161932280939754, 0.0001215738284703802, 0.0002748359327622883] and parameters: {'n_layers': 1, 'embedding_dim': 256, 'lr': 0.00017384659942437723, 'lambda_val': 1.3976665248992833e-06, 'batch_size': 906, 'optimizer': 'RMSprop'}.
2026-06-17 00:06:37,157 - optuna.study.study - INFO - Trial 126 finished with values: [0.00726000088629576, 0.0018172919034988003, 0.004343702333644274] and parameters: {'n_layers': 2, 'embedding_dim': 32, 'lr': 0.00019812603137728135, 'lambda_val': 1.3976665248992833e-06, 'batch_size': 2889, 'optimizer': 'Adam'}.
2026-06-17 00:10:00,440 - optuna.study.study - INFO - Trial 127 finished with values: [0.005692358947352439, 0.0014146772767462423, 0.0033690539144193275] and parameters: {'n_layers': 2, 'embedding_dim': 128, 'lr': 0.00014480858275533554, 'lambda_val': 1.7085461442456565e-05, 'batch_size': 3604, 'optimizer': 'Adam'}.
2026-06-17 00:10:31,937 - experiment_functions - INFO - Early stopping at epoch 550. Best Metrics: (0.012716950053773872, 0.0029288240495137048, 0.007726454989260624)
2026-06-17 00:10:32,017 - optuna.study.study - INFO - Trial 128 finished with values: [0.012716950053773872, 0.0029288240495137048, 0.007726454989260624] and parameters: {'n_layers': 1, 'embedding_dim': 256, 'lr': 0.017717847936403682, 'lambda_val': 1.3976665248992833e-06, 'batch_size': 1627, 'optimizer': 'RMSprop'}.
2026-06-17 00:11:08,298 - experiment_functions - INFO - Early stopping at epoch 650. Best Metrics: (0.024720029845278248, 0.0054960843753947206, 0.014417217829656584)
2026-06-17 00:11:08,626 - optuna.study.study - INFO - Trial 129 finished with values: [0.024720029845278248, 0.0054960843753947206, 0.014417217829656584] and parameters: {'n_layers': 2, 'embedding_dim': 128, 'lr': 0.0017542874983550202, 'lambda_val': 0.002293564989415113, 'batch_size': 3992, 'optimizer': 'Adam'}.
2026-06-17 00:14:36,340 - optuna.study.study - INFO - Trial 130 finished with values: [0.019606986949296565, 0.003937728937728938, 0.010937823918811821] and parameters: {'n_layers': 2, 'embedding_dim': 128, 'lr': 0.013825847167324911, 'lambda_val': 6.67969903638883e-05, 'batch_size': 2691, 'optimizer': 'RMSprop'}.
2026-06-17 00:16:40,369 - experiment_functions - INFO - Early stopping at epoch 2000. Best Metrics: (0.008263130864554217, 0.0018472906403940886, 0.0045116852752113525)
2026-06-17 00:16:40,452 - optuna.study.study - INFO - Trial 131 finished with values: [0.008263130864554217, 0.0018472906403940886, 0.0045116852752113525] and parameters: {'n_layers': 2, 'embedding_dim': 256, 'lr': 0.0018522973992639606, 'lambda_val': 1.4405090810627564e-05, 'batch_size': 668, 'optimizer': 'Adam'}.
2026-06-17 00:21:25,051 - optuna.study.study - INFO - Trial 132 finished with values: [0.01794886996873298, 0.0036819502336743718, 0.00977184464169231] and parameters: {'n_layers': 3, 'embedding_dim': 256, 'lr': 0.017717847936403682, 'lambda_val': 0.0002897230611073727, 'batch_size': 2495, 'optimizer': 'RMSprop'}.
2026-06-17 00:24:59,013 - optuna.study.study - INFO - Trial 133 finished with values: [0.014635255145348554, 0.0034672224327396747, 0.008903508359572019] and parameters: {'n_layers': 1, 'embedding_dim': 256, 'lr': 0.0006628139134621098, 'lambda_val': 5.119347523585741e-06, 'batch_size': 582, 'optimizer': 'Adam'}.
2026-06-17 00:28:09,118 - optuna.study.study - INFO - Trial 134 finished with values: [0.01183166658115304, 0.0025246305418719214, 0.006796612646947177] and parameters: {'n_layers': 2, 'embedding_dim': 64, 'lr': 0.005335994508143198, 'lambda_val': 2.970506579255523e-05, 'batch_size': 3321, 'optimizer': 'RMSprop'}.
2026-06-17 00:28:48,646 - experiment_functions - INFO - Early stopping at epoch 700. Best Metrics: (0.02723197991221519, 0.005957117595048631, 0.015766591505772105)
2026-06-17 00:28:48,776 - optuna.study.study - INFO - Trial 135 finished with values: [0.02723197991221519, 0.005957117595048631, 0.015766591505772105] and parameters: {'n_layers': 2, 'embedding_dim': 128, 'lr': 0.0017542874983550202, 'lambda_val': 2.970506579255523e-05, 'batch_size': 3321, 'optimizer': 'Adam'}.
2026-06-17 00:29:23,253 - experiment_functions - INFO - Early stopping at epoch 750. Best Metrics: (0.000579812432058061, 0.00014209928003031453, 0.00032258387287005004)
2026-06-17 00:29:23,806 - optuna.study.study - INFO - Trial 136 finished with values: [0.000579812432058061, 0.00014209928003031453, 0.00032258387287005004] and parameters: {'n_layers': 1, 'embedding_dim': 64, 'lr': 5.262341520975298e-05, 'lambda_val': 1.8618951918561611e-06, 'batch_size': 1954, 'optimizer': 'RMSprop'}.
2026-06-17 00:33:09,753 - optuna.study.study - INFO - Trial 137 finished with values: [0.02197875649103668, 0.004935581659719591, 0.012504922757892981] and parameters: {'n_layers': 4, 'embedding_dim': 96, 'lr': 0.00018562220957177872, 'lambda_val': 2.6858232738417883e-06, 'batch_size': 3920, 'optimizer': 'RMSprop'}.
2026-06-17 00:36:55,627 - experiment_functions - INFO - Early stopping at epoch 3650. Best Metrics: (0.011957864872401606, 0.00246621194897057, 0.00683148254760437)
2026-06-17 00:36:55,728 - optuna.study.study - INFO - Trial 138 finished with values: [0.011957864872401606, 0.00246621194897057, 0.00683148254760437] and parameters: {'n_layers': 2, 'embedding_dim': 256, 'lr': 0.011485594305176742, 'lambda_val': 1.0768752731630495e-05, 'batch_size': 2708, 'optimizer': 'Adam'}.
2026-06-17 00:40:22,447 - optuna.study.study - INFO - Trial 139 finished with values: [0.017552315226449663, 0.00397720095995958, 0.01006971214876474] and parameters: {'n_layers': 4, 'embedding_dim': 64, 'lr': 0.00017384659942437723, 'lambda_val': 8.895198181412377e-05, 'batch_size': 1627, 'optimizer': 'RMSprop'}.
2026-06-17 00:43:49,445 - optuna.study.study - INFO - Trial 140 finished with values: [0.0194028846675954, 0.003939307818618164, 0.010836672381516543] and parameters: {'n_layers': 2, 'embedding_dim': 128, 'lr': 0.017717847936403682, 'lambda_val': 0.00012757549955462867, 'batch_size': 2889, 'optimizer': 'RMSprop'}.
2026-06-17 00:44:21,006 - experiment_functions - INFO - Early stopping at epoch 500. Best Metrics: (0.0006479468303515741, 0.00013104711380573447, 0.0003448414307526102)
2026-06-17 00:44:21,086 - optuna.study.study - INFO - Trial 141 finished with values: [0.0006479468303515741, 0.00013104711380573447, 0.0003448414307526102] and parameters: {'n_layers': 2, 'embedding_dim': 256, 'lr': 0.0003334703704985316, 'lambda_val': 0.009747650699295873, 'batch_size': 3312, 'optimizer': 'SGD'}.
2026-06-17 00:44:57,353 - experiment_functions - INFO - Early stopping at epoch 550. Best Metrics: (0.011865835622936027, 0.0027093596059113304, 0.007231359567362177)
2026-06-17 00:44:57,982 - optuna.study.study - INFO - Trial 142 finished with values: [0.011865835622936027, 0.0027093596059113304, 0.007231359567362177] and parameters: {'n_layers': 2, 'embedding_dim': 256, 'lr': 0.0020532474965947955, 'lambda_val': 2.1239788328621638e-05, 'batch_size': 1398, 'optimizer': 'RMSprop'}.
2026-06-17 00:45:38,629 - experiment_functions - INFO - Early stopping at epoch 700. Best Metrics: (0.01494612449730847, 0.0029604016672982194, 0.00832681691206604)
2026-06-17 00:45:39,627 - optuna.study.study - INFO - Trial 143 finished with values: [0.01494612449730847, 0.0029604016672982194, 0.00832681691206604] and parameters: {'n_layers': 3, 'embedding_dim': 128, 'lr': 0.013825847167324911, 'lambda_val': 2.2169472590839277e-06, 'batch_size': 582, 'optimizer': 'RMSprop'}.
2026-06-17 00:49:02,829 - optuna.study.study - INFO - Trial 144 finished with values: [0.005938578467642108, 0.001433623847416951, 0.0035294695128613093] and parameters: {'n_layers': 2, 'embedding_dim': 128, 'lr': 0.00017384659942437723, 'lambda_val': 0.0009457495874866539, 'batch_size': 1627, 'optimizer': 'RMSprop'}.
2026-06-17 00:49:45,609 - experiment_functions - INFO - Early stopping at epoch 900. Best Metrics: (0.011854798677141315, 0.002557787040545661, 0.006479927322514279)
