2026-06-19 07:33:27,869 - optuna.study.study - INFO - Trial 70 finished with values: [0.004553018036972063, 0.001037324744221296, 0.0025721151248331462] and parameters: {'n_layers': 2, 'embedding_dim': 96, 'lr': 0.09397404733704716, 'lambda_val': 4.652725797139409e-06, 'batch_size': 3323, 'optimizer': 'Adam'}.
2026-06-19 07:33:55,297 - experiment_functions - INFO - Early stopping at epoch 500. Best Metrics: (0.0005006090461231092, 0.00011052166224580017, 0.0002679428446914886)
2026-06-19 07:33:55,373 - optuna.study.study - INFO - Trial 71 finished with values: [0.0005006090461231092, 0.00011052166224580017, 0.0002679428446914886] and parameters: {'n_layers': 4, 'embedding_dim': 128, 'lr': 6.423999994205313e-05, 'lambda_val': 3.4596773195408992e-06, 'batch_size': 1628, 'optimizer': 'SGD'}.
2026-06-19 07:34:18,772 - experiment_functions - INFO - Early stopping at epoch 500. Best Metrics: (0.0004318936652591317, 0.00010104837691044589, 0.0002295533450161424)
2026-06-19 07:34:18,861 - optuna.study.study - INFO - Trial 72 finished with values: [0.0004318936652591317, 0.00010104837691044589, 0.0002295533450161424] and parameters: {'n_layers': 4, 'embedding_dim': 32, 'lr': 0.012446135186973949, 'lambda_val': 0.0862024186981037, 'batch_size': 1312, 'optimizer': 'SGD'}.
2026-06-19 07:37:32,503 - optuna.study.study - INFO - Trial 73 finished with values: [0.019749687707771732, 0.004313502589364659, 0.011388245271676766] and parameters: {'n_layers': 4, 'embedding_dim': 96, 'lr': 0.00020897019229325828, 'lambda_val': 0.00854510130589444, 'batch_size': 2334, 'optimizer': 'RMSprop'}.
2026-06-19 07:37:57,980 - experiment_functions - INFO - Early stopping at epoch 500. Best Metrics: (0.0005082780962418269, 0.00011052166224580017, 0.0002622228961993798)
2026-06-19 07:37:58,064 - optuna.study.study - INFO - Trial 74 finished with values: [0.0005082780962418269, 0.00011052166224580017, 0.0002622228961993798] and parameters: {'n_layers': 1, 'embedding_dim': 256, 'lr': 8.847609527070946e-05, 'lambda_val': 0.0003743444509143199, 'batch_size': 1628, 'optimizer': 'SGD'}.
2026-06-19 07:38:45,260 - experiment_functions - INFO - Early stopping at epoch 950. Best Metrics: (0.0027747188039634295, 0.0006315523556902868, 0.0015841983448449525)
2026-06-19 07:38:45,332 - optuna.study.study - INFO - Trial 75 finished with values: [0.0027747188039634295, 0.0006315523556902868, 0.0015841983448449525] and parameters: {'n_layers': 4, 'embedding_dim': 96, 'lr': 0.027107934338862744, 'lambda_val': 0.027956652497068718, 'batch_size': 1935, 'optimizer': 'Adam'}.
2026-06-19 07:39:19,273 - experiment_functions - INFO - Early stopping at epoch 500. Best Metrics: (0.0005805690885658585, 0.00013578375647341166, 0.00031459094428587324)
2026-06-19 07:39:19,715 - optuna.study.study - INFO - Trial 76 finished with values: [0.0005805690885658585, 0.00013578375647341166, 0.00031459094428587324] and parameters: {'n_layers': 4, 'embedding_dim': 256, 'lr': 0.00020897019229325828, 'lambda_val': 0.03693503236055113, 'batch_size': 2074, 'optimizer': 'Adam'}.
2026-06-19 07:39:51,656 - experiment_functions - INFO - Early stopping at epoch 700. Best Metrics: (0.02127987326532581, 0.004469811797398005, 0.011899333934281355)
2026-06-19 07:39:51,771 - optuna.study.study - INFO - Trial 77 finished with values: [0.02127987326532581, 0.004469811797398005, 0.011899333934281355] and parameters: {'n_layers': 3, 'embedding_dim': 32, 'lr': 0.0020290919563790725, 'lambda_val': 7.46585453630634e-05, 'batch_size': 3835, 'optimizer': 'Adam'}.
2026-06-19 07:40:18,795 - experiment_functions - INFO - Early stopping at epoch 500. Best Metrics: (0.0005799517285219316, 0.00014367816091954025, 0.0003134578569502599)
2026-06-19 07:40:18,873 - optuna.study.study - INFO - Trial 78 finished with values: [0.0005799517285219316, 0.00014367816091954025, 0.0003134578569502599] and parameters: {'n_layers': 4, 'embedding_dim': 128, 'lr': 0.003975454433665345, 'lambda_val': 0.058151096272515294, 'batch_size': 2088, 'optimizer': 'SGD'}.
2026-06-19 07:40:53,062 - experiment_functions - INFO - Early stopping at epoch 650. Best Metrics: (0.02006311693583041, 0.004269293924466338, 0.01127048229511253)
2026-06-19 07:40:53,156 - optuna.study.study - INFO - Trial 79 finished with values: [0.02006311693583041, 0.004269293924466338, 0.01127048229511253] and parameters: {'n_layers': 3, 'embedding_dim': 128, 'lr': 0.0020290919563790725, 'lambda_val': 7.169103823221734e-06, 'batch_size': 1875, 'optimizer': 'Adam'}.
2026-06-19 07:41:18,975 - experiment_functions - INFO - Early stopping at epoch 500. Best Metrics: (0.00048760961058647397, 0.0001215738284703802, 0.00025076379227941393)
2026-06-19 07:41:19,064 - optuna.study.study - INFO - Trial 80 finished with values: [0.00048760961058647397, 0.0001215738284703802, 0.00025076379227941393] and parameters: {'n_layers': 4, 'embedding_dim': 96, 'lr': 0.09622578043504722, 'lambda_val': 0.027956652497068718, 'batch_size': 1622, 'optimizer': 'SGD'}.
2026-06-19 07:41:47,798 - experiment_functions - INFO - Early stopping at epoch 550. Best Metrics: (0.004796953071811284, 0.0010846911708980672, 0.0028063578406595903)
2026-06-19 07:41:47,868 - optuna.study.study - INFO - Trial 81 finished with values: [0.004796953071811284, 0.0010846911708980672, 0.0028063578406595903] and parameters: {'n_layers': 3, 'embedding_dim': 128, 'lr': 0.049960469253932695, 'lambda_val': 7.169103823221734e-06, 'batch_size': 3852, 'optimizer': 'RMSprop'}.
2026-06-19 07:45:39,106 - optuna.study.study - INFO - Trial 82 finished with values: [0.0007263629327998475, 0.0001768346595932803, 0.0004447880986220919] and parameters: {'n_layers': 3, 'embedding_dim': 256, 'lr': 4.9732944839566914e-05, 'lambda_val': 0.0001228083366977069, 'batch_size': 3739, 'optimizer': 'Adam'}.
2026-06-19 07:46:26,927 - experiment_functions - INFO - Early stopping at epoch 1000. Best Metrics: (0.028465028785840014, 0.00601237842617153, 0.016116232720155683)
2026-06-19 07:46:27,028 - optuna.study.study - INFO - Trial 83 finished with values: [0.028465028785840014, 0.00601237842617153, 0.016116232720155683] and parameters: {'n_layers': 2, 'embedding_dim': 96, 'lr': 0.0013485218163115024, 'lambda_val': 2.005340661981191e-05, 'batch_size': 2168, 'optimizer': 'Adam'}.
2026-06-19 07:46:51,854 - experiment_functions - INFO - Early stopping at epoch 550. Best Metrics: (0.004217687435937595, 0.0009836427939876216, 0.0025504352077755817)
2026-06-19 07:46:51,953 - optuna.study.study - INFO - Trial 84 finished with values: [0.004217687435937595, 0.0009836427939876216, 0.0025504352077755817] and parameters: {'n_layers': 2, 'embedding_dim': 32, 'lr': 0.049960469253932695, 'lambda_val': 9.873205377622859e-06, 'batch_size': 3852, 'optimizer': 'RMSprop'}.
2026-06-19 07:47:28,734 - experiment_functions - INFO - Early stopping at epoch 550. Best Metrics: (0.0005627385803209517, 0.00013420487558418593, 0.0003396189571055169)
2026-06-19 07:47:28,828 - optuna.study.study - INFO - Trial 85 finished with values: [0.0005627385803209517, 0.00013420487558418593, 0.0003396189571055169] and parameters: {'n_layers': 4, 'embedding_dim': 256, 'lr': 4.851213147177158e-05, 'lambda_val': 0.006230745660801204, 'batch_size': 881, 'optimizer': 'RMSprop'}.
2026-06-19 07:47:53,615 - experiment_functions - INFO - Early stopping at epoch 500. Best Metrics: (0.0005248113185528587, 0.00010736390046734874, 0.00025609698286761665)
2026-06-19 07:47:53,689 - optuna.study.study - INFO - Trial 86 finished with values: [0.0005248113185528587, 0.00010736390046734874, 0.00025609698286761665] and parameters: {'n_layers': 4, 'embedding_dim': 64, 'lr': 0.0052943064503213075, 'lambda_val': 0.00022214804065747904, 'batch_size': 3489, 'optimizer': 'SGD'}.
2026-06-19 07:50:36,938 - optuna.study.study - INFO - Trial 87 finished with values: [0.000855005858365444, 0.0001973601111532146, 0.00048659816955376646] and parameters: {'n_layers': 3, 'embedding_dim': 32, 'lr': 8.847609527070946e-05, 'lambda_val': 3.4596773195408992e-06, 'batch_size': 1628, 'optimizer': 'RMSprop'}.
2026-06-19 07:51:32,415 - experiment_functions - INFO - Early stopping at epoch 1100. Best Metrics: (0.02314502707947007, 0.004952949349501075, 0.01330347324199373)
2026-06-19 07:51:32,531 - optuna.study.study - INFO - Trial 88 finished with values: [0.02314502707947007, 0.004952949349501075, 0.01330347324199373] and parameters: {'n_layers': 3, 'embedding_dim': 128, 'lr': 0.000670518483727842, 'lambda_val': 0.0001228083366977069, 'batch_size': 1819, 'optimizer': 'RMSprop'}.
2026-06-19 07:51:57,150 - experiment_functions - INFO - Early stopping at epoch 550. Best Metrics: (0.005042931546236722, 0.0012188960464822533, 0.0029832556512148813)
2026-06-19 07:51:57,235 - optuna.study.study - INFO - Trial 89 finished with values: [0.005042931546236722, 0.0012188960464822533, 0.0029832556512148813] and parameters: {'n_layers': 1, 'embedding_dim': 32, 'lr': 0.05075341291771216, 'lambda_val': 2.1305601218305877e-05, 'batch_size': 1588, 'optimizer': 'RMSprop'}.
2026-06-19 07:53:16,651 - experiment_functions - INFO - Early stopping at epoch 1700. Best Metrics: (0.004146634778677941, 0.0008715422508525959, 0.002307318463425069)
2026-06-19 07:53:16,763 - optuna.study.study - INFO - Trial 90 finished with values: [0.004146634778677941, 0.0008715422508525959, 0.002307318463425069] and parameters: {'n_layers': 3, 'embedding_dim': 96, 'lr': 0.004221468699196662, 'lambda_val': 0.014193031414069697, 'batch_size': 2324, 'optimizer': 'RMSprop'}.
2026-06-19 07:54:23,214 - experiment_functions - INFO - Early stopping at epoch 1350. Best Metrics: (0.020027920936776876, 0.004645067576102059, 0.011474270290566942)
2026-06-19 07:54:23,316 - optuna.study.study - INFO - Trial 91 finished with values: [0.020027920936776876, 0.004645067576102059, 0.011474270290566942] and parameters: {'n_layers': 1, 'embedding_dim': 256, 'lr': 0.0008520784697548674, 'lambda_val': 0.015452769230831364, 'batch_size': 1839, 'optimizer': 'RMSprop'}.
2026-06-19 07:54:52,711 - experiment_functions - INFO - Early stopping at epoch 650. Best Metrics: (0.027088568998010515, 0.0057250221043324495, 0.015769320625657782)
2026-06-19 07:54:52,873 - optuna.study.study - INFO - Trial 92 finished with values: [0.027088568998010515, 0.0057250221043324495, 0.015769320625657782] and parameters: {'n_layers': 1, 'embedding_dim': 32, 'lr': 0.007918659350141476, 'lambda_val': 1.1042104634029595e-06, 'batch_size': 2567, 'optimizer': 'Adam'}.
2026-06-19 07:55:35,629 - experiment_functions - INFO - Early stopping at epoch 650. Best Metrics: (0.0004958583282296143, 0.00011683718580270305, 0.00026832263264823066)
2026-06-19 07:55:35,714 - optuna.study.study - INFO - Trial 93 finished with values: [0.0004958583282296143, 0.00011683718580270305, 0.00026832263264823066] and parameters: {'n_layers': 4, 'embedding_dim': 256, 'lr': 1.4549129732870946e-05, 'lambda_val': 0.006230745660801204, 'batch_size': 881, 'optimizer': 'Adam'}.
2026-06-19 07:56:04,556 - experiment_functions - INFO - Early stopping at epoch 600. Best Metrics: (0.010009897146712918, 0.002129910319565492, 0.005460852209228448)
2026-06-19 07:56:04,642 - optuna.study.study - INFO - Trial 94 finished with values: [0.010009897146712918, 0.002129910319565492, 0.005460852209228448] and parameters: {'n_layers': 2, 'embedding_dim': 96, 'lr': 0.0025726585227239724, 'lambda_val': 0.0023217792752353666, 'batch_size': 3323, 'optimizer': 'RMSprop'}.
2026-06-19 07:56:29,401 - experiment_functions - INFO - Early stopping at epoch 500. Best Metrics: (0.0006090435573746419, 0.00011367942402425162, 0.000333766221788581)
2026-06-19 07:56:29,499 - optuna.study.study - INFO - Trial 95 finished with values: [0.0006090435573746419, 0.00011367942402425162, 0.000333766221788581] and parameters: {'n_layers': 2, 'embedding_dim': 128, 'lr': 0.0026080443940524555, 'lambda_val': 0.004420406027779212, 'batch_size': 2402, 'optimizer': 'SGD'}.
2026-06-19 07:58:10,162 - experiment_functions - INFO - Early stopping at epoch 2150. Best Metrics: (0.003058515365218797, 0.0007262852090438297, 0.001729396655378429)
2026-06-19 07:58:10,246 - optuna.study.study - INFO - Trial 96 finished with values: [0.003058515365218797, 0.0007262852090438297, 0.001729396655378429] and parameters: {'n_layers': 3, 'embedding_dim': 96, 'lr': 0.03025207384051862, 'lambda_val': 0.04233954773809469, 'batch_size': 3994, 'optimizer': 'Adam'}.
2026-06-19 07:58:55,622 - experiment_functions - INFO - Early stopping at epoch 950. Best Metrics: (0.008694291915832007, 0.00183939623594796, 0.004618596781679081)
2026-06-19 07:58:55,713 - optuna.study.study - INFO - Trial 97 finished with values: [0.008694291915832007, 0.00183939623594796, 0.004618596781679081] and parameters: {'n_layers': 4, 'embedding_dim': 64, 'lr': 0.0052943064503213075, 'lambda_val': 0.00022214804065747904, 'batch_size': 3489, 'optimizer': 'RMSprop'}.
2026-06-19 07:59:21,002 - experiment_functions - INFO - Early stopping at epoch 500. Best Metrics: (0.000526987991725063, 0.0001310471138057345, 0.00033830632789103775)
2026-06-19 07:59:21,140 - optuna.study.study - INFO - Trial 98 finished with values: [0.000526987991725063, 0.0001310471138057345, 0.00033830632789103775] and parameters: {'n_layers': 3, 'embedding_dim': 96, 'lr': 0.0026080443940524555, 'lambda_val': 0.0004362815086226961, 'batch_size': 2758, 'optimizer': 'SGD'}.
2026-06-19 07:59:47,032 - experiment_functions - INFO - Early stopping at epoch 550. Best Metrics: (0.011853989028043577, 0.0027125173676897816, 0.006079877957318006)
2026-06-19 07:59:47,121 - optuna.study.study - INFO - Trial 99 finished with values: [0.011853989028043577, 0.0027125173676897816, 0.006079877957318006] and parameters: {'n_layers': 2, 'embedding_dim': 64, 'lr': 0.006551893413620945, 'lambda_val': 0.014193031414069697, 'batch_size': 3900, 'optimizer': 'Adam'}.
2026-06-19 08:00:13,138 - experiment_functions - INFO - Early stopping at epoch 550. Best Metrics: (0.012780265118975738, 0.0028877731463938365, 0.006632092706358782)
2026-06-19 08:00:13,228 - optuna.study.study - INFO - Trial 100 finished with values: [0.012780265118975738, 0.0028877731463938365, 0.006632092706358782] and parameters: {'n_layers': 2, 'embedding_dim': 64, 'lr': 0.006551893413620945, 'lambda_val': 0.014193031414069697, 'batch_size': 3900, 'optimizer': 'Adam'}.
2026-06-19 08:01:44,130 - experiment_functions - INFO - Early stopping at epoch 1900. Best Metrics: (0.00046995170880521165, 0.00011999494758115447, 0.00025797038241099664)
2026-06-19 08:01:44,220 - optuna.study.study - INFO - Trial 101 finished with values: [0.00046995170880521165, 0.00011999494758115447, 0.00025797038241099664] and parameters: {'n_layers': 1, 'embedding_dim': 256, 'lr': 3.795035950346317e-05, 'lambda_val': 0.0005335603776371349, 'batch_size': 719, 'optimizer': 'RMSprop'}.
2026-06-19 08:02:22,482 - experiment_functions - INFO - Early stopping at epoch 700. Best Metrics: (0.016569283282743926, 0.0035114310976379947, 0.009192233884754854)
2026-06-19 08:02:22,579 - optuna.study.study - INFO - Trial 102 finished with values: [0.016569283282743926, 0.0035114310976379947, 0.009192233884754854] and parameters: {'n_layers': 4, 'embedding_dim': 128, 'lr': 0.0016951471722144954, 'lambda_val': 2.013346843188833e-05, 'batch_size': 1913, 'optimizer': 'Adam'}.
2026-06-19 08:02:51,381 - experiment_functions - INFO - Early stopping at epoch 550. Best Metrics: (0.006531694765210751, 0.001383099658961728, 0.0035285859134293286)
2026-06-19 08:02:51,473 - optuna.study.study - INFO - Trial 103 finished with values: [0.006531694765210751, 0.001383099658961728, 0.0035285859134293286] and parameters: {'n_layers': 4, 'embedding_dim': 96, 'lr': 0.004161538726755138, 'lambda_val': 0.0023217792752353666, 'batch_size': 3295, 'optimizer': 'RMSprop'}.
2026-06-19 08:03:54,695 - experiment_functions - INFO - Early stopping at epoch 1150. Best Metrics: (0.014288937811738163, 0.0029398762157382854, 0.007966049837399833)
2026-06-19 08:03:54,779 - optuna.study.study - INFO - Trial 104 finished with values: [0.014288937811738163, 0.0029398762157382854, 0.007966049837399833] and parameters: {'n_layers': 2, 'embedding_dim': 256, 'lr': 0.0020290919563790725, 'lambda_val': 7.169103823221734e-06, 'batch_size': 3846, 'optimizer': 'RMSprop'}.
2026-06-19 08:05:05,780 - experiment_functions - INFO - Early stopping at epoch 1500. Best Metrics: (0.004724669944375513, 0.0010310092206643933, 0.0026003540317883936)
2026-06-19 08:05:05,877 - optuna.study.study - INFO - Trial 105 finished with values: [0.004724669944375513, 0.0010310092206643933, 0.0026003540317883936] and parameters: {'n_layers': 2, 'embedding_dim': 128, 'lr': 0.0045010260516877044, 'lambda_val': 0.022728866657914324, 'batch_size': 3050, 'optimizer': 'RMSprop'}.
2026-06-19 08:08:19,042 - optuna.study.study - INFO - Trial 106 finished with values: [0.007792897148201156, 0.0018820260199570544, 0.00463923498132361] and parameters: {'n_layers': 3, 'embedding_dim': 128, 'lr': 0.00015378747690288278, 'lambda_val': 0.00010774725222510008, 'batch_size': 1875, 'optimizer': 'Adam'}.
2026-06-19 08:09:54,469 - experiment_functions - INFO - Early stopping at epoch 2250. Best Metrics: (0.03215351269395388, 0.0066170898067449795, 0.01879558966056687)
2026-06-19 08:09:54,555 - optuna.study.study - INFO - Trial 107 finished with values: [0.03215351269395388, 0.0066170898067449795, 0.01879558966056687] and parameters: {'n_layers': 1, 'embedding_dim': 32, 'lr': 0.0020290919563790725, 'lambda_val': 1.1042104634029595e-06, 'batch_size': 1875, 'optimizer': 'Adam'}.
2026-06-19 08:12:42,587 - optuna.study.study - INFO - Trial 108 finished with values: [0.032026754380169865, 0.006771820133889101, 0.01838750224119154] and parameters: {'n_layers': 1, 'embedding_dim': 32, 'lr': 0.0008520784697548674, 'lambda_val': 1.3063371603281255e-06, 'batch_size': 3994, 'optimizer': 'RMSprop'}.
2026-06-19 08:13:15,446 - experiment_functions - INFO - Early stopping at epoch 500. Best Metrics: (0.0006373207857187927, 0.00010736390046734875, 0.0002928887720066914)
2026-06-19 08:13:15,544 - optuna.study.study - INFO - Trial 109 finished with values: [0.0006373207857187927, 0.00010736390046734875, 0.0002928887720066914] and parameters: {'n_layers': 4, 'embedding_dim': 256, 'lr': 0.0052943064503213075, 'lambda_val': 0.00022214804065747904, 'batch_size': 2516, 'optimizer': 'SGD'}.
2026-06-19 08:14:18,431 - experiment_functions - INFO - Early stopping at epoch 1150. Best Metrics: (0.015271023295973156, 0.003257231274472654, 0.008458872674258532)
2026-06-19 08:14:18,527 - optuna.study.study - INFO - Trial 110 finished with values: [0.015271023295973156, 0.003257231274472654, 0.008458872674258532] and parameters: {'n_layers': 2, 'embedding_dim': 256, 'lr': 0.0011560622109254449, 'lambda_val': 0.0023217792752353666, 'batch_size': 689, 'optimizer': 'RMSprop'}.
2026-06-19 08:14:49,254 - experiment_functions - INFO - Early stopping at epoch 550. Best Metrics: (0.010213724384256676, 0.002229379815586712, 0.005618404310244476)
2026-06-19 08:14:49,389 - optuna.study.study - INFO - Trial 111 finished with values: [0.010213724384256676, 0.002229379815586712, 0.005618404310244476] and parameters: {'n_layers': 4, 'embedding_dim': 128, 'lr': 0.0025726585227239724, 'lambda_val': 0.0003743444509143199, 'batch_size': 1819, 'optimizer': 'RMSprop'}.
2026-06-19 08:15:25,829 - experiment_functions - INFO - Early stopping at epoch 700. Best Metrics: (0.010911291677246535, 0.0023335859542756095, 0.006096754112230842)
2026-06-19 08:15:26,187 - optuna.study.study - INFO - Trial 112 finished with values: [0.010911291677246535, 0.0023335859542756095, 0.006096754112230842] and parameters: {'n_layers': 3, 'embedding_dim': 128, 'lr': 0.00900709723708539, 'lambda_val': 7.169103823221734e-06, 'batch_size': 3852, 'optimizer': 'RMSprop'}.
2026-06-19 08:15:52,155 - experiment_functions - INFO - Early stopping at epoch 550. Best Metrics: (0.004115599284911962, 0.0010578501957812304, 0.002513487064248295)
2026-06-19 08:15:52,274 - optuna.study.study - INFO - Trial 113 finished with values: [0.004115599284911962, 0.0010578501957812304, 0.002513487064248295] and parameters: {'n_layers': 2, 'embedding_dim': 64, 'lr': 0.006551893413620945, 'lambda_val': 0.07186771550565126, 'batch_size': 600, 'optimizer': 'Adam'}.
2026-06-19 08:16:40,747 - experiment_functions - INFO - Early stopping at epoch 900. Best Metrics: (0.01413939819344304, 0.0031546040166729825, 0.00761772289672334)
2026-06-19 08:16:40,842 - optuna.study.study - INFO - Trial 114 finished with values: [0.01413939819344304, 0.0031546040166729825, 0.00761772289672334] and parameters: {'n_layers': 4, 'embedding_dim': 128, 'lr': 0.000670518483727842, 'lambda_val': 0.0082855773038374, 'batch_size': 1312, 'optimizer': 'Adam'}.
2026-06-19 08:17:13,796 - experiment_functions - INFO - Early stopping at epoch 650. Best Metrics: (0.011898614415859892, 0.0025767336112163695, 0.00652191167621645)
2026-06-19 08:17:13,886 - optuna.study.study - INFO - Trial 115 finished with values: [0.011898614415859892, 0.0025767336112163695, 0.00652191167621645] and parameters: {'n_layers': 3, 'embedding_dim': 96, 'lr': 0.0008520784697548674, 'lambda_val': 0.015452769230831364, 'batch_size': 3440, 'optimizer': 'RMSprop'}.
2026-06-19 08:20:03,246 - optuna.study.study - INFO - Trial 116 finished with values: [0.02838083425280402, 0.0061592143488695215, 0.016349027154190447] and parameters: {'n_layers': 1, 'embedding_dim': 32, 'lr': 0.000670518483727842, 'lambda_val': 4.652725797139409e-06, 'batch_size': 3739, 'optimizer': 'RMSprop'}.
2026-06-19 08:21:32,481 - experiment_functions - INFO - Early stopping at epoch 1850. Best Metrics: (0.030005938631330213, 0.006201844132878617, 0.016811322871587868)
