2026-06-18 08:36:22,663 - optuna.study.study - INFO - Trial 224 finished with values: [0.0032640562244328764, 0.0008683844890741443, 0.0020672661068611453] and parameters: {'n_layers': 3, 'embedding_dim': 256, 'lr': 0.0011084029372515364, 'lambda_val': 1.6639720416643942e-06, 'batch_size': 2514, 'optimizer': 'RMSprop'}.
2026-06-18 08:39:32,095 - optuna.study.study - INFO - Trial 225 finished with values: [0.0034255814734814012, 0.0008794366552987243, 0.0021103326542719686] and parameters: {'n_layers': 2, 'embedding_dim': 256, 'lr': 0.0007081502475512032, 'lambda_val': 1.6639720416643942e-06, 'batch_size': 2514, 'optimizer': 'RMSprop'}.
2026-06-18 08:40:17,034 - experiment_functions - INFO - Early stopping at epoch 900. Best Metrics: (0.0032444975150297036, 0.0007610205886067955, 0.0019395207537956788)
2026-06-18 08:40:17,367 - optuna.study.study - INFO - Trial 226 finished with values: [0.0032444975150297036, 0.0007610205886067955, 0.0019395207537956788] and parameters: {'n_layers': 2, 'embedding_dim': 256, 'lr': 0.0011084029372515364, 'lambda_val': 0.00029665726020447226, 'batch_size': 2514, 'optimizer': 'RMSprop'}.
2026-06-18 08:41:16,462 - experiment_functions - INFO - Early stopping at epoch 1250. Best Metrics: (0.0004973658719780728, 9.789061513199444e-05, 0.00027513601259798726)
2026-06-18 08:41:16,560 - optuna.study.study - INFO - Trial 227 finished with values: [0.0004973658719780728, 9.789061513199444e-05, 0.00027513601259798726] and parameters: {'n_layers': 4, 'embedding_dim': 128, 'lr': 3.713865819431316e-05, 'lambda_val': 0.0009339364864859292, 'batch_size': 655, 'optimizer': 'RMSprop'}.
2026-06-18 08:44:08,622 - optuna.study.study - INFO - Trial 228 finished with values: [0.0011504124347779924, 0.00024472653782998613, 0.0006193874745736541] and parameters: {'n_layers': 2, 'embedding_dim': 128, 'lr': 0.00015862735778935684, 'lambda_val': 0.0111344241066824, 'batch_size': 895, 'optimizer': 'RMSprop'}.
2026-06-18 08:46:04,682 - experiment_functions - INFO - Early stopping at epoch 2700. Best Metrics: (0.0033512692893918816, 0.0008668056081849187, 0.0022039724448708413)
2026-06-18 08:46:05,012 - optuna.study.study - INFO - Trial 229 finished with values: [0.0033512692893918816, 0.0008668056081849187, 0.0022039724448708413] and parameters: {'n_layers': 2, 'embedding_dim': 128, 'lr': 0.0009840483225184993, 'lambda_val': 1.6639720416643942e-06, 'batch_size': 1074, 'optimizer': 'RMSprop'}.
2026-06-18 08:47:44,172 - experiment_functions - INFO - Early stopping at epoch 2250. Best Metrics: (0.003341986153141527, 0.0008825944170771755, 0.002116162439665657)
2026-06-18 08:47:44,262 - optuna.study.study - INFO - Trial 230 finished with values: [0.003341986153141527, 0.0008825944170771755, 0.002116162439665657] and parameters: {'n_layers': 3, 'embedding_dim': 128, 'lr': 0.0009840483225184993, 'lambda_val': 1.6639720416643942e-06, 'batch_size': 2916, 'optimizer': 'RMSprop'}.
2026-06-18 08:50:15,271 - experiment_functions - INFO - Early stopping at epoch 3350. Best Metrics: (0.00392364751019827, 0.0009883794366552987, 0.002524002087695409)
2026-06-18 08:50:15,586 - optuna.study.study - INFO - Trial 231 finished with values: [0.00392364751019827, 0.0009883794366552987, 0.002524002087695409] and parameters: {'n_layers': 4, 'embedding_dim': 128, 'lr': 0.0004894377864752034, 'lambda_val': 5.797034595637332e-06, 'batch_size': 696, 'optimizer': 'RMSprop'}.
2026-06-18 08:51:40,289 - experiment_functions - INFO - Early stopping at epoch 1850. Best Metrics: (0.003768069270449497, 0.0009378552482000759, 0.0023361999595799834)
2026-06-18 08:51:40,399 - optuna.study.study - INFO - Trial 232 finished with values: [0.003768069270449497, 0.0009378552482000759, 0.0023361999595799834] and parameters: {'n_layers': 4, 'embedding_dim': 128, 'lr': 0.0011084029372515364, 'lambda_val': 7.3372601056335455e-06, 'batch_size': 1509, 'optimizer': 'RMSprop'}.
2026-06-18 08:52:02,227 - experiment_functions - INFO - Early stopping at epoch 500. Best Metrics: (0.0004997864110250577, 0.00011999494758115448, 0.0002827806492378834)
2026-06-18 08:52:02,331 - optuna.study.study - INFO - Trial 233 finished with values: [0.0004997864110250577, 0.00011999494758115448, 0.0002827806492378834] and parameters: {'n_layers': 4, 'embedding_dim': 32, 'lr': 6.75979093760628e-05, 'lambda_val': 0.00029665726020447226, 'batch_size': 1806, 'optimizer': 'SGD'}.
2026-06-18 08:54:43,205 - experiment_functions - INFO - Early stopping at epoch 3250. Best Metrics: (0.0040697516875453105, 0.0010294303397751674, 0.002554239257012587)
2026-06-18 08:54:43,310 - optuna.study.study - INFO - Trial 234 finished with values: [0.0040697516875453105, 0.0010294303397751674, 0.002554239257012587] and parameters: {'n_layers': 3, 'embedding_dim': 256, 'lr': 0.0011084029372515364, 'lambda_val': 1.6639720416643942e-06, 'batch_size': 793, 'optimizer': 'RMSprop'}.
2026-06-18 08:57:16,671 - optuna.study.study - INFO - Trial 235 finished with values: [0.0013045607471109464, 0.00034261715296198057, 0.0008795585185113453] and parameters: {'n_layers': 1, 'embedding_dim': 32, 'lr': 0.0008273605807562151, 'lambda_val': 0.09984968338758293, 'batch_size': 2287, 'optimizer': 'Adam'}.
2026-06-18 08:59:54,982 - optuna.study.study - INFO - Trial 236 finished with values: [0.003325214468354342, 0.0007783882783882783, 0.002139673485121764] and parameters: {'n_layers': 4, 'embedding_dim': 32, 'lr': 0.0004894377864752034, 'lambda_val': 0.00029665726020447226, 'batch_size': 2553, 'optimizer': 'RMSprop'}.
2026-06-18 09:00:44,904 - experiment_functions - INFO - Early stopping at epoch 1150. Best Metrics: (0.002082045176211335, 0.0006015536187949981, 0.0013376914752449586)
2026-06-18 09:00:45,009 - optuna.study.study - INFO - Trial 237 finished with values: [0.002082045176211335, 0.0006015536187949981, 0.0013376914752449586] and parameters: {'n_layers': 2, 'embedding_dim': 128, 'lr': 0.0009840483225184993, 'lambda_val': 0.019580455233735864, 'batch_size': 2243, 'optimizer': 'RMSprop'}.
2026-06-18 09:01:13,220 - experiment_functions - INFO - Early stopping at epoch 650. Best Metrics: (0.0026466443752792986, 0.0006426045219148668, 0.0016904424798267561)
2026-06-18 09:01:13,337 - optuna.study.study - INFO - Trial 238 finished with values: [0.0026466443752792986, 0.0006426045219148668, 0.0016904424798267561] and parameters: {'n_layers': 4, 'embedding_dim': 32, 'lr': 0.0037685849042605117, 'lambda_val': 7.3372601056335455e-06, 'batch_size': 2803, 'optimizer': 'Adam'}.
2026-06-18 09:04:00,977 - optuna.study.study - INFO - Trial 239 finished with values: [0.002988087221519956, 0.0006726032588101555, 0.0018550441436598305] and parameters: {'n_layers': 2, 'embedding_dim': 128, 'lr': 0.0004894377864752034, 'lambda_val': 7.3372601056335455e-06, 'batch_size': 655, 'optimizer': 'RMSprop'}.
2026-06-18 09:05:10,936 - experiment_functions - INFO - Early stopping at epoch 1300. Best Metrics: (0.0032869371113829313, 0.0008762788935202728, 0.0020598649986962466)
2026-06-18 09:05:11,270 - optuna.study.study - INFO - Trial 240 finished with values: [0.0032869371113829313, 0.0008762788935202728, 0.0020598649986962466] and parameters: {'n_layers': 4, 'embedding_dim': 256, 'lr': 0.0011084029372515364, 'lambda_val': 1.6639720416643942e-06, 'batch_size': 2986, 'optimizer': 'RMSprop'}.
2026-06-18 09:07:08,383 - experiment_functions - INFO - Early stopping at epoch 2200. Best Metrics: (0.0035761048573401837, 0.0009331186055323987, 0.002236209199699775)
2026-06-18 09:07:08,494 - optuna.study.study - INFO - Trial 241 finished with values: [0.0035761048573401837, 0.0009331186055323987, 0.002236209199699775] and parameters: {'n_layers': 4, 'embedding_dim': 256, 'lr': 0.0009840483225184993, 'lambda_val': 3.615242376833312e-06, 'batch_size': 1642, 'optimizer': 'RMSprop'}.
2026-06-18 09:09:28,189 - experiment_functions - INFO - Early stopping at epoch 3600. Best Metrics: (0.00355973072126833, 0.0007436528988253127, 0.0022318460870531737)
2026-06-18 09:09:28,519 - optuna.study.study - INFO - Trial 242 finished with values: [0.00355973072126833, 0.0007436528988253127, 0.0022318460870531737] and parameters: {'n_layers': 2, 'embedding_dim': 32, 'lr': 0.0004894377864752034, 'lambda_val': 5.538422897317458e-06, 'batch_size': 1975, 'optimizer': 'RMSprop'}.
2026-06-18 09:10:35,390 - experiment_functions - INFO - Early stopping at epoch 1500. Best Metrics: (0.0039196193304750545, 0.0009378552482000759, 0.0024146883844790054)
2026-06-18 09:10:35,602 - optuna.study.study - INFO - Trial 243 finished with values: [0.0039196193304750545, 0.0009378552482000759, 0.0024146883844790054] and parameters: {'n_layers': 3, 'embedding_dim': 128, 'lr': 0.0009840483225184993, 'lambda_val': 1.6639720416643942e-06, 'batch_size': 2514, 'optimizer': 'RMSprop'}.
2026-06-18 09:11:26,612 - experiment_functions - INFO - Early stopping at epoch 1000. Best Metrics: (0.002026964543769509, 0.000574712643678161, 0.0013153662595535773)
2026-06-18 09:11:26,708 - optuna.study.study - INFO - Trial 244 finished with values: [0.002026964543769509, 0.000574712643678161, 0.0013153662595535773] and parameters: {'n_layers': 3, 'embedding_dim': 128, 'lr': 0.0037685849042605117, 'lambda_val': 0.062192278060657795, 'batch_size': 696, 'optimizer': 'Adam'}.
2026-06-18 09:12:31,501 - experiment_functions - INFO - Early stopping at epoch 1200. Best Metrics: (0.0034141630099442342, 0.0009220664393078186, 0.0021623310148977232)
2026-06-18 09:12:31,860 - optuna.study.study - INFO - Trial 245 finished with values: [0.0034141630099442342, 0.0009220664393078186, 0.0021623310148977232] and parameters: {'n_layers': 4, 'embedding_dim': 256, 'lr': 0.0011084029372515364, 'lambda_val': 1.6639720416643942e-06, 'batch_size': 1650, 'optimizer': 'RMSprop'}.
2026-06-18 09:15:27,356 - optuna.study.study - INFO - Trial 246 finished with values: [0.003564379429874262, 0.0008699633699633701, 0.002284645416851653] and parameters: {'n_layers': 3, 'embedding_dim': 128, 'lr': 0.0008273605807562151, 'lambda_val': 0.00020122391761600542, 'batch_size': 655, 'optimizer': 'Adam'}.
2026-06-18 09:18:28,651 - experiment_functions - INFO - Early stopping at epoch 3600. Best Metrics: (0.0029200494176667355, 0.0007531261841606669, 0.001857361783964347)
2026-06-18 09:18:28,754 - optuna.study.study - INFO - Trial 247 finished with values: [0.0029200494176667355, 0.0007531261841606669, 0.001857361783964347] and parameters: {'n_layers': 3, 'embedding_dim': 256, 'lr': 0.00022482513952355564, 'lambda_val': 0.00029665726020447226, 'batch_size': 3821, 'optimizer': 'RMSprop'}.
2026-06-18 09:20:49,273 - experiment_functions - INFO - Early stopping at epoch 3050. Best Metrics: (0.004134096747124204, 0.0010594290766704562, 0.0026856735418881034)
2026-06-18 09:20:49,603 - optuna.study.study - INFO - Trial 248 finished with values: [0.004134096747124204, 0.0010594290766704562, 0.0026856735418881034] and parameters: {'n_layers': 4, 'embedding_dim': 128, 'lr': 0.0009840483225184993, 'lambda_val': 2.2848456976007116e-05, 'batch_size': 655, 'optimizer': 'RMSprop'}.
2026-06-18 09:23:52,540 - optuna.study.study - INFO - Trial 249 finished with values: [0.0036472321779261545, 0.0009157509157509159, 0.002377581149660606] and parameters: {'n_layers': 4, 'embedding_dim': 128, 'lr': 0.0004894377864752034, 'lambda_val': 3.481867111201764e-05, 'batch_size': 655, 'optimizer': 'RMSprop'}.
2026-06-18 09:25:42,122 - experiment_functions - INFO - Early stopping at epoch 2350. Best Metrics: (0.004095858859509239, 0.001026272577996716, 0.002529476381804325)
2026-06-18 09:25:42,227 - optuna.study.study - INFO - Trial 250 finished with values: [0.004095858859509239, 0.001026272577996716, 0.002529476381804325] and parameters: {'n_layers': 4, 'embedding_dim': 128, 'lr': 0.0009840483225184993, 'lambda_val': 1.4055284682631976e-05, 'batch_size': 655, 'optimizer': 'RMSprop'}.
2026-06-18 09:28:44,539 - optuna.study.study - INFO - Trial 251 finished with values: [0.001830164376332427, 0.00042471895920171787, 0.0011675770727649192] and parameters: {'n_layers': 4, 'embedding_dim': 128, 'lr': 0.0002152320067493787, 'lambda_val': 1.4055284682631976e-05, 'batch_size': 655, 'optimizer': 'RMSprop'}.
2026-06-18 09:30:07,203 - experiment_functions - INFO - Early stopping at epoch 1950. Best Metrics: (0.0036941914971677834, 0.000999431602879879, 0.0023859414619247505)
2026-06-18 09:30:07,537 - optuna.study.study - INFO - Trial 252 finished with values: [0.0036941914971677834, 0.000999431602879879, 0.0023859414619247505] and parameters: {'n_layers': 4, 'embedding_dim': 64, 'lr': 0.001443380359422423, 'lambda_val': 2.6367594401190188e-05, 'batch_size': 655, 'optimizer': 'RMSprop'}.
2026-06-18 09:32:28,216 - experiment_functions - INFO - Early stopping at epoch 2650. Best Metrics: (0.0006636188187199322, 0.00013420487558418593, 0.0003313064159005536)
2026-06-18 09:32:28,327 - optuna.study.study - INFO - Trial 253 finished with values: [0.0006636188187199322, 0.00013420487558418593, 0.0003313064159005536] and parameters: {'n_layers': 4, 'embedding_dim': 256, 'lr': 2.5411283932263122e-05, 'lambda_val': 0.00020122391761600542, 'batch_size': 2287, 'optimizer': 'Adam'}.
2026-06-18 09:35:05,977 - optuna.study.study - INFO - Trial 254 finished with values: [0.003619221862160199, 0.0008020714917266641, 0.0023229271375573694] and parameters: {'n_layers': 3, 'embedding_dim': 32, 'lr': 0.0005201695028924843, 'lambda_val': 5.234322219409902e-05, 'batch_size': 1405, 'optimizer': 'RMSprop'}.
2026-06-18 09:37:34,626 - experiment_functions - INFO - Early stopping at epoch 3500. Best Metrics: (0.0037887322792823797, 0.0008968043450802071, 0.002525261226115007)
2026-06-18 09:37:34,730 - optuna.study.study - INFO - Trial 255 finished with values: [0.0037887322792823797, 0.0008968043450802071, 0.002525261226115007] and parameters: {'n_layers': 2, 'embedding_dim': 128, 'lr': 0.0009840483225184993, 'lambda_val': 1.4055284682631976e-05, 'batch_size': 655, 'optimizer': 'RMSprop'}.
2026-06-18 09:38:01,022 - experiment_functions - INFO - Early stopping at epoch 550. Best Metrics: (0.002339730925019508, 0.0005905014525704181, 0.0015925469957586201)
2026-06-18 09:38:01,131 - optuna.study.study - INFO - Trial 256 finished with values: [0.002339730925019508, 0.0005905014525704181, 0.0015925469957586201] and parameters: {'n_layers': 4, 'embedding_dim': 96, 'lr': 0.036099973308899226, 'lambda_val': 2.1011583665129505e-05, 'batch_size': 3565, 'optimizer': 'RMSprop'}.
2026-06-18 09:38:23,546 - experiment_functions - INFO - Early stopping at epoch 500. Best Metrics: (0.0005128125196166206, 0.00011525830491347732, 0.0003003646210561637)
2026-06-18 09:38:23,886 - optuna.study.study - INFO - Trial 257 finished with values: [0.0005128125196166206, 0.00011525830491347732, 0.0003003646210561637] and parameters: {'n_layers': 2, 'embedding_dim': 64, 'lr': 0.0009840483225184993, 'lambda_val': 3.615242376833312e-06, 'batch_size': 2932, 'optimizer': 'SGD'}.
2026-06-18 09:41:15,201 - optuna.study.study - INFO - Trial 258 finished with values: [0.002625839243005358, 0.0006126057850195782, 0.0016881581359922853] and parameters: {'n_layers': 2, 'embedding_dim': 128, 'lr': 0.0004894377864752034, 'lambda_val': 0.005009256416697396, 'batch_size': 696, 'optimizer': 'RMSprop'}.
2026-06-18 09:42:33,873 - experiment_functions - INFO - Early stopping at epoch 1850. Best Metrics: (0.003560725644001119, 0.0008494379184034356, 0.0022378040347652275)
2026-06-18 09:42:34,191 - optuna.study.study - INFO - Trial 259 finished with values: [0.003560725644001119, 0.0008494379184034356, 0.0022378040347652275] and parameters: {'n_layers': 3, 'embedding_dim': 64, 'lr': 0.0009840483225184993, 'lambda_val': 5.538422897317458e-06, 'batch_size': 2072, 'optimizer': 'RMSprop'}.
2026-06-18 09:43:49,125 - experiment_functions - INFO - Early stopping at epoch 1750. Best Metrics: (0.003017591581248471, 0.0007468106606037641, 0.001886099460066842)
2026-06-18 09:43:49,224 - optuna.study.study - INFO - Trial 260 finished with values: [0.003017591581248471, 0.0007468106606037641, 0.001886099460066842] and parameters: {'n_layers': 3, 'embedding_dim': 64, 'lr': 0.0009840483225184993, 'lambda_val': 2.1011583665129505e-05, 'batch_size': 2514, 'optimizer': 'Adam'}.
2026-06-18 09:44:35,964 - experiment_functions - INFO - Early stopping at epoch 1100. Best Metrics: (0.002967274813983904, 0.0007468106606037641, 0.0019060324048903647)
2026-06-18 09:44:36,052 - optuna.study.study - INFO - Trial 261 finished with values: [0.002967274813983904, 0.0007468106606037641, 0.0019060324048903647] and parameters: {'n_layers': 2, 'embedding_dim': 64, 'lr': 0.0037685849042605117, 'lambda_val': 1.0560042497819773e-05, 'batch_size': 696, 'optimizer': 'RMSprop'}.
2026-06-18 09:47:28,628 - optuna.study.study - INFO - Trial 262 finished with values: [0.0008731051747446965, 0.00017999242137173172, 0.00045583609662092306] and parameters: {'n_layers': 2, 'embedding_dim': 128, 'lr': 0.00010566019800799118, 'lambda_val': 0.00029665726020447226, 'batch_size': 655, 'optimizer': 'RMSprop'}.
2026-06-18 09:50:58,792 - experiment_functions - INFO - Early stopping at epoch 3900. Best Metrics: (0.0008275245195902548, 0.00019578123026398888, 0.0004642867400556865)
2026-06-18 09:50:59,141 - optuna.study.study - INFO - Trial 263 finished with values: [0.0008275245195902548, 0.00019578123026398888, 0.0004642867400556865] and parameters: {'n_layers': 4, 'embedding_dim': 256, 'lr': 8.758440771035318e-05, 'lambda_val': 1.6639720416643942e-06, 'batch_size': 655, 'optimizer': 'RMSprop'}.
2026-06-18 09:53:48,019 - optuna.study.study - INFO - Trial 264 finished with values: [0.0034089543221049574, 0.0007594417077175698, 0.002112460608885574] and parameters: {'n_layers': 3, 'embedding_dim': 64, 'lr': 0.00046996802016152644, 'lambda_val': 0.00029665726020447226, 'batch_size': 779, 'optimizer': 'Adam'}.
2026-06-18 09:56:14,962 - experiment_functions - INFO - Early stopping at epoch 3650. Best Metrics: (0.0033139414697318835, 0.0008162814197296957, 0.0022345526867453757)
2026-06-18 09:56:15,066 - optuna.study.study - INFO - Trial 265 finished with values: [0.0033139414697318835, 0.0008162814197296957, 0.0022345526867453757] and parameters: {'n_layers': 4, 'embedding_dim': 32, 'lr': 0.0008273605807562151, 'lambda_val': 2.6367594401190188e-05, 'batch_size': 1566, 'optimizer': 'Adam'}.
2026-06-18 09:56:51,462 - experiment_functions - INFO - Early stopping at epoch 850. Best Metrics: (0.0029644313914529417, 0.0007499684223822156, 0.0019235146272953054)
2026-06-18 09:56:51,864 - optuna.study.study - INFO - Trial 266 finished with values: [0.0029644313914529417, 0.0007499684223822156, 0.0019235146272953054] and parameters: {'n_layers': 2, 'embedding_dim': 64, 'lr': 0.0037685849042605117, 'lambda_val': 0.00029665726020447226, 'batch_size': 655, 'optimizer': 'RMSprop'}.
2026-06-18 09:57:15,009 - experiment_functions - INFO - Early stopping at epoch 500. Best Metrics: (0.0005471651595637817, 0.00011052166224580017, 0.00030344678937962966)
2026-06-18 09:57:15,346 - optuna.study.study - INFO - Trial 267 finished with values: [0.0005471651595637817, 0.00011052166224580017, 0.00030344678937962966] and parameters: {'n_layers': 4, 'embedding_dim': 64, 'lr': 0.0009840483225184993, 'lambda_val': 3.615242376833312e-06, 'batch_size': 655, 'optimizer': 'SGD'}.
2026-06-18 09:57:39,148 - experiment_functions - INFO - Early stopping at epoch 500. Best Metrics: (0.0004592737121369035, 0.00010736390046734875, 0.00023173341752116068)
2026-06-18 09:57:39,494 - optuna.study.study - INFO - Trial 268 finished with values: [0.0004592737121369035, 0.00010736390046734875, 0.00023173341752116068] and parameters: {'n_layers': 3, 'embedding_dim': 128, 'lr': 0.0011084029372515364, 'lambda_val': 2.2848456976007116e-05, 'batch_size': 1892, 'optimizer': 'SGD'}.
2026-06-18 09:58:48,815 - experiment_functions - INFO - Early stopping at epoch 1650. Best Metrics: (0.0035179237501796073, 0.0008525956801818871, 0.002301576458207942)
2026-06-18 09:58:49,146 - optuna.study.study - INFO - Trial 269 finished with values: [0.0035179237501796073, 0.0008525956801818871, 0.002301576458207942] and parameters: {'n_layers': 3, 'embedding_dim': 64, 'lr': 0.0009840483225184993, 'lambda_val': 0.00029665726020447226, 'batch_size': 1722, 'optimizer': 'RMSprop'}.
2026-06-18 09:59:50,393 - experiment_functions - INFO - Early stopping at epoch 1100. Best Metrics: (0.0034989952694972934, 0.00090311986863711, 0.0021002329167603435)
2026-06-18 09:59:50,491 - optuna.study.study - INFO - Trial 270 finished with values: [0.0034989952694972934, 0.00090311986863711, 0.0021002329167603435] and parameters: {'n_layers': 4, 'embedding_dim': 256, 'lr': 0.0008273605807562151, 'lambda_val': 0.00020122391761600542, 'batch_size': 1992, 'optimizer': 'RMSprop'}.
2026-06-18 10:00:34,936 - experiment_functions - INFO - Early stopping at epoch 850. Best Metrics: (0.001983697497565854, 0.0005747126436781609, 0.0013132721497709492)
2026-06-18 10:00:35,041 - optuna.study.study - INFO - Trial 271 finished with values: [0.001983697497565854, 0.0005747126436781609, 0.0013132721497709492] and parameters: {'n_layers': 2, 'embedding_dim': 256, 'lr': 0.01850472044180492, 'lambda_val': 0.006185493652330469, 'batch_size': 1026, 'optimizer': 'RMSprop'}.
2026-06-18 10:01:53,199 - experiment_functions - INFO - Early stopping at epoch 1650. Best Metrics: (0.003653306710746258, 0.0009378552482000759, 0.002353049235267534)
2026-06-18 10:01:53,302 - optuna.study.study - INFO - Trial 272 finished with values: [0.003653306710746258, 0.0009378552482000759, 0.002353049235267534] and parameters: {'n_layers': 4, 'embedding_dim': 128, 'lr': 0.0009840483225184993, 'lambda_val': 2.2848456976007116e-05, 'batch_size': 1485, 'optimizer': 'RMSprop'}.
2026-06-18 10:03:21,601 - experiment_functions - INFO - Early stopping at epoch 2000. Best Metrics: (0.0034405652375214435, 0.0008036503726158898, 0.0021893634330984926)
