2026-06-19 10:18:57,485 - optuna.study.study - INFO - Trial 213 finished with values: [0.029621210073919102, 0.006236579512441581, 0.01702390277736368] and parameters: {'n_layers': 1, 'embedding_dim': 128, 'lr': 0.0025726585227239724, 'lambda_val': 0.0003743444509143199, 'batch_size': 2567, 'optimizer': 'Adam'}.
2026-06-19 10:21:55,020 - optuna.study.study - INFO - Trial 214 finished with values: [0.0018409234368824607, 0.0004420866489832007, 0.001059734079799657] and parameters: {'n_layers': 1, 'embedding_dim': 96, 'lr': 0.0002996331120361443, 'lambda_val': 0.0001469242914477015, 'batch_size': 2427, 'optimizer': 'Adam'}.
2026-06-19 10:22:25,060 - experiment_functions - INFO - Early stopping at epoch 650. Best Metrics: (0.02761164228103129, 0.005788177339901478, 0.01574799872261711)
2026-06-19 10:22:25,143 - optuna.study.study - INFO - Trial 215 finished with values: [0.02761164228103129, 0.005788177339901478, 0.01574799872261711] and parameters: {'n_layers': 1, 'embedding_dim': 32, 'lr': 0.00875508308708224, 'lambda_val': 0.0001469242914477015, 'batch_size': 3739, 'optimizer': 'Adam'}.
2026-06-19 10:22:56,656 - experiment_functions - INFO - Early stopping at epoch 700. Best Metrics: (0.00343208516564667, 0.000819439181508147, 0.0020311073521960487)
2026-06-19 10:22:56,746 - optuna.study.study - INFO - Trial 216 finished with values: [0.00343208516564667, 0.000819439181508147, 0.0020311073521960487] and parameters: {'n_layers': 1, 'embedding_dim': 32, 'lr': 0.07041500445698395, 'lambda_val': 7.46585453630634e-05, 'batch_size': 3693, 'optimizer': 'RMSprop'}.
2026-06-19 10:23:46,976 - experiment_functions - INFO - Early stopping at epoch 900. Best Metrics: (0.023353256382029956, 0.005077680939749906, 0.013426494027520323)
2026-06-19 10:23:47,061 - optuna.study.study - INFO - Trial 217 finished with values: [0.023353256382029956, 0.005077680939749906, 0.013426494027520323] and parameters: {'n_layers': 2, 'embedding_dim': 256, 'lr': 0.0008520784697548674, 'lambda_val': 0.0023217792752353666, 'batch_size': 1839, 'optimizer': 'RMSprop'}.
2026-06-19 10:24:09,857 - experiment_functions - INFO - Early stopping at epoch 500. Best Metrics: (0.00047520892827079825, 0.0001231527093596059, 0.0002716166839491494)
2026-06-19 10:24:09,952 - optuna.study.study - INFO - Trial 218 finished with values: [0.00047520892827079825, 0.0001231527093596059, 0.0002716166839491494] and parameters: {'n_layers': 1, 'embedding_dim': 64, 'lr': 0.0020290919563790725, 'lambda_val': 1.1042104634029595e-06, 'batch_size': 3739, 'optimizer': 'SGD'}.
2026-06-19 10:27:44,473 - optuna.study.study - INFO - Trial 219 finished with values: [0.02335156419032192, 0.005158203865100417, 0.013423947377007923] and parameters: {'n_layers': 2, 'embedding_dim': 256, 'lr': 0.00020897019229325828, 'lambda_val': 1.3063371603281255e-06, 'batch_size': 3743, 'optimizer': 'RMSprop'}.
2026-06-19 10:28:19,500 - experiment_functions - INFO - Early stopping at epoch 700. Best Metrics: (0.026271442241803476, 0.00562555260831123, 0.015199978354886512)
2026-06-19 10:28:20,431 - optuna.study.study - INFO - Trial 220 finished with values: [0.026271442241803476, 0.00562555260831123, 0.015199978354886512] and parameters: {'n_layers': 2, 'embedding_dim': 128, 'lr': 0.0020290919563790725, 'lambda_val': 1.5236318044232254e-06, 'batch_size': 2326, 'optimizer': 'Adam'}.
2026-06-19 10:30:14,951 - experiment_functions - INFO - Early stopping at epoch 2600. Best Metrics: (0.03340207716616732, 0.007013388909940635, 0.01911247975419593)
2026-06-19 10:30:15,041 - optuna.study.study - INFO - Trial 221 finished with values: [0.03340207716616732, 0.007013388909940635, 0.01911247975419593] and parameters: {'n_layers': 1, 'embedding_dim': 96, 'lr': 0.0008520784697548674, 'lambda_val': 0.000666881885592315, 'batch_size': 3739, 'optimizer': 'RMSprop'}.
2026-06-19 10:31:08,291 - experiment_functions - INFO - Early stopping at epoch 1050. Best Metrics: (0.028286875407417207, 0.006009220664393079, 0.016296249614452085)
2026-06-19 10:31:08,381 - optuna.study.study - INFO - Trial 222 finished with values: [0.028286875407417207, 0.006009220664393079, 0.016296249614452085] and parameters: {'n_layers': 1, 'embedding_dim': 256, 'lr': 0.0020290919563790725, 'lambda_val': 0.0003743444509143199, 'batch_size': 2567, 'optimizer': 'Adam'}.
2026-06-19 10:32:17,509 - experiment_functions - INFO - Early stopping at epoch 1500. Best Metrics: (0.02216902069374403, 0.004675066312997348, 0.01275122498994593)
2026-06-19 10:32:17,623 - optuna.study.study - INFO - Trial 223 finished with values: [0.02216902069374403, 0.004675066312997348, 0.01275122498994593] and parameters: {'n_layers': 2, 'embedding_dim': 96, 'lr': 0.001237222476168443, 'lambda_val': 4.652725797139409e-06, 'batch_size': 1875, 'optimizer': 'RMSprop'}.
2026-06-19 10:35:13,428 - experiment_functions - INFO - Early stopping at epoch 3750. Best Metrics: (0.029523582853720337, 0.006151319944423394, 0.01653644616958201)
2026-06-19 10:35:13,506 - optuna.study.study - INFO - Trial 224 finished with values: [0.029523582853720337, 0.006151319944423394, 0.01653644616958201] and parameters: {'n_layers': 2, 'embedding_dim': 128, 'lr': 0.000670518483727842, 'lambda_val': 1.5236318044232254e-06, 'batch_size': 1593, 'optimizer': 'RMSprop'}.
2026-06-19 10:38:31,913 - optuna.study.study - INFO - Trial 225 finished with values: [0.03249808602293893, 0.006827080965011999, 0.01861609011892041] and parameters: {'n_layers': 1, 'embedding_dim': 256, 'lr': 0.0008520784697548674, 'lambda_val': 1.3063371603281255e-06, 'batch_size': 2567, 'optimizer': 'Adam'}.
2026-06-19 10:39:27,115 - experiment_functions - INFO - Early stopping at epoch 900. Best Metrics: (0.02383217843592429, 0.004948212706833396, 0.013330029696858006)
2026-06-19 10:39:27,211 - optuna.study.study - INFO - Trial 226 finished with values: [0.02383217843592429, 0.004948212706833396, 0.013330029696858006] and parameters: {'n_layers': 3, 'embedding_dim': 256, 'lr': 0.0008520784697548674, 'lambda_val': 2.005340661981191e-05, 'batch_size': 3024, 'optimizer': 'Adam'}.
2026-06-19 10:39:49,980 - experiment_functions - INFO - Early stopping at epoch 500. Best Metrics: (0.0004997819095118572, 0.00010894278135657447, 0.0002911435069338091)
2026-06-19 10:39:50,068 - optuna.study.study - INFO - Trial 227 finished with values: [0.0004997819095118572, 0.00010894278135657447, 0.0002911435069338091] and parameters: {'n_layers': 2, 'embedding_dim': 32, 'lr': 0.000670518483727842, 'lambda_val': 7.46585453630634e-05, 'batch_size': 2427, 'optimizer': 'SGD'}.
2026-06-19 10:40:40,557 - experiment_functions - INFO - Early stopping at epoch 1150. Best Metrics: (0.02966228496456439, 0.006149741063534168, 0.017095254294488455)
2026-06-19 10:40:40,661 - optuna.study.study - INFO - Trial 228 finished with values: [0.02966228496456439, 0.006149741063534168, 0.017095254294488455] and parameters: {'n_layers': 1, 'embedding_dim': 64, 'lr': 0.0020290919563790725, 'lambda_val': 1.1042104634029595e-06, 'batch_size': 3132, 'optimizer': 'Adam'}.
2026-06-19 10:41:08,957 - experiment_functions - INFO - Early stopping at epoch 600. Best Metrics: (0.025772077222982703, 0.005552924087406846, 0.014689372973469086)
2026-06-19 10:41:09,057 - optuna.study.study - INFO - Trial 229 finished with values: [0.025772077222982703, 0.005552924087406846, 0.014689372973469086] and parameters: {'n_layers': 1, 'embedding_dim': 96, 'lr': 0.007918659350141476, 'lambda_val': 1.3063371603281255e-06, 'batch_size': 3994, 'optimizer': 'Adam'}.
2026-06-19 10:42:06,067 - experiment_functions - INFO - Early stopping at epoch 1350. Best Metrics: (0.015302349668257345, 0.0032272325375773655, 0.008288029272684874)
2026-06-19 10:42:06,151 - optuna.study.study - INFO - Trial 230 finished with values: [0.015302349668257345, 0.0032272325375773655, 0.008288029272684874] and parameters: {'n_layers': 1, 'embedding_dim': 32, 'lr': 0.007918659350141476, 'lambda_val': 1.3063371603281255e-06, 'batch_size': 2567, 'optimizer': 'RMSprop'}.
2026-06-19 10:43:49,206 - experiment_functions - INFO - Early stopping at epoch 2400. Best Metrics: (0.027803629838737427, 0.0059302766199317925, 0.016028413065497706)
2026-06-19 10:43:49,291 - optuna.study.study - INFO - Trial 231 finished with values: [0.027803629838737427, 0.0059302766199317925, 0.016028413065497706] and parameters: {'n_layers': 2, 'embedding_dim': 32, 'lr': 0.000670518483727842, 'lambda_val': 1.1042104634029595e-06, 'batch_size': 2718, 'optimizer': 'RMSprop'}.
2026-06-19 10:45:08,303 - experiment_functions - INFO - Early stopping at epoch 1500. Best Metrics: (0.023847620257147532, 0.004959264873057977, 0.013322579626788893)
2026-06-19 10:45:08,398 - optuna.study.study - INFO - Trial 232 finished with values: [0.023847620257147532, 0.004959264873057977, 0.013322579626788893] and parameters: {'n_layers': 4, 'embedding_dim': 128, 'lr': 0.00048609420002783816, 'lambda_val': 1.5236318044232254e-06, 'batch_size': 1875, 'optimizer': 'RMSprop'}.
2026-06-19 10:46:26,313 - experiment_functions - INFO - Early stopping at epoch 1400. Best Metrics: (0.028158085495200883, 0.005919224453707213, 0.016284777591424125)
2026-06-19 10:46:26,406 - optuna.study.study - INFO - Trial 233 finished with values: [0.028158085495200883, 0.005919224453707213, 0.016284777591424125] and parameters: {'n_layers': 2, 'embedding_dim': 256, 'lr': 0.0008520784697548674, 'lambda_val': 1.3063371603281255e-06, 'batch_size': 2168, 'optimizer': 'Adam'}.
2026-06-19 10:47:11,807 - experiment_functions - INFO - Early stopping at epoch 950. Best Metrics: (0.026077608088268023, 0.0055323986358469125, 0.014739644361688488)
2026-06-19 10:47:11,917 - optuna.study.study - INFO - Trial 234 finished with values: [0.026077608088268023, 0.0055323986358469125, 0.014739644361688488] and parameters: {'n_layers': 2, 'embedding_dim': 96, 'lr': 0.0013485218163115024, 'lambda_val': 2.005340661981191e-05, 'batch_size': 3743, 'optimizer': 'Adam'}.
2026-06-19 10:50:09,625 - optuna.study.study - INFO - Trial 235 finished with values: [0.029341541115993325, 0.006331312365795125, 0.01710346632066851] and parameters: {'n_layers': 1, 'embedding_dim': 128, 'lr': 0.000670518483727842, 'lambda_val': 1.5236318044232254e-06, 'batch_size': 1593, 'optimizer': 'RMSprop'}.
2026-06-19 10:53:24,574 - optuna.study.study - INFO - Trial 236 finished with values: [0.03105849829318184, 0.006637615258304913, 0.017970085813000417] and parameters: {'n_layers': 1, 'embedding_dim': 256, 'lr': 0.000670518483727842, 'lambda_val': 1.3063371603281255e-06, 'batch_size': 1593, 'optimizer': 'RMSprop'}.
2026-06-19 10:54:01,022 - experiment_functions - INFO - Early stopping at epoch 750. Best Metrics: (0.025412259874024186, 0.005238726790450929, 0.014093710698062808)
2026-06-19 10:54:01,563 - optuna.study.study - INFO - Trial 237 finished with values: [0.025412259874024186, 0.005238726790450929, 0.014093710698062808] and parameters: {'n_layers': 2, 'embedding_dim': 96, 'lr': 0.001237222476168443, 'lambda_val': 1.1042104634029595e-06, 'batch_size': 3994, 'optimizer': 'RMSprop'}.
2026-06-19 10:54:33,768 - experiment_functions - INFO - Early stopping at epoch 700. Best Metrics: (0.025341386435899164, 0.005338196286472149, 0.01436136978137299)
2026-06-19 10:54:33,865 - optuna.study.study - INFO - Trial 238 finished with values: [0.025341386435899164, 0.005338196286472149, 0.01436136978137299] and parameters: {'n_layers': 1, 'embedding_dim': 64, 'lr': 0.0025726585227239724, 'lambda_val': 0.0001469242914477015, 'batch_size': 2567, 'optimizer': 'RMSprop'}.
2026-06-19 10:55:20,481 - experiment_functions - INFO - Early stopping at epoch 1050. Best Metrics: (0.028357271991917826, 0.005974485284830113, 0.01574278424873979)
2026-06-19 10:55:20,572 - optuna.study.study - INFO - Trial 239 finished with values: [0.028357271991917826, 0.005974485284830113, 0.01574278424873979] and parameters: {'n_layers': 2, 'embedding_dim': 32, 'lr': 0.0013485218163115024, 'lambda_val': 2.005340661981191e-05, 'batch_size': 2427, 'optimizer': 'Adam'}.
2026-06-19 10:57:29,097 - experiment_functions - INFO - Early stopping at epoch 2700. Best Metrics: (0.02873036194286761, 0.006020272830617659, 0.016506468912610636)
2026-06-19 10:57:29,202 - optuna.study.study - INFO - Trial 240 finished with values: [0.02873036194286761, 0.006020272830617659, 0.016506468912610636] and parameters: {'n_layers': 2, 'embedding_dim': 128, 'lr': 0.000670518483727842, 'lambda_val': 0.0003743444509143199, 'batch_size': 1593, 'optimizer': 'RMSprop'}.
2026-06-19 11:00:21,304 - optuna.study.study - INFO - Trial 241 finished with values: [0.024650558163386217, 0.005368195023367437, 0.014090220997615768] and parameters: {'n_layers': 3, 'embedding_dim': 32, 'lr': 0.000670518483727842, 'lambda_val': 1.1042104634029595e-06, 'batch_size': 1819, 'optimizer': 'RMSprop'}.
2026-06-19 11:01:25,211 - experiment_functions - INFO - Early stopping at epoch 1450. Best Metrics: (0.031243099251926233, 0.006370784388025768, 0.017602754032176232)
2026-06-19 11:01:25,291 - optuna.study.study - INFO - Trial 242 finished with values: [0.031243099251926233, 0.006370784388025768, 0.017602754032176232] and parameters: {'n_layers': 1, 'embedding_dim': 64, 'lr': 0.0020290919563790725, 'lambda_val': 0.0001469242914477015, 'batch_size': 2567, 'optimizer': 'Adam'}.
2026-06-19 11:01:50,509 - experiment_functions - INFO - Early stopping at epoch 500. Best Metrics: (0.00039796198871897253, 0.00010104837691044589, 0.00022878678823909558)
2026-06-19 11:01:50,603 - optuna.study.study - INFO - Trial 243 finished with values: [0.00039796198871897253, 0.00010104837691044589, 0.00022878678823909558] and parameters: {'n_layers': 2, 'embedding_dim': 128, 'lr': 0.000670518483727842, 'lambda_val': 0.08830273605128346, 'batch_size': 2427, 'optimizer': 'SGD'}.
2026-06-19 11:02:31,626 - experiment_functions - INFO - Early stopping at epoch 850. Best Metrics: (0.025983594688910303, 0.005576607300745232, 0.01488884329311478)
2026-06-19 11:02:33,202 - optuna.study.study - INFO - Trial 244 finished with values: [0.025983594688910303, 0.005576607300745232, 0.01488884329311478] and parameters: {'n_layers': 2, 'embedding_dim': 96, 'lr': 0.001237222476168443, 'lambda_val': 1.3063371603281255e-06, 'batch_size': 3994, 'optimizer': 'Adam'}.
2026-06-19 11:03:06,205 - experiment_functions - INFO - Early stopping at epoch 650. Best Metrics: (0.02314824956700157, 0.004948212706833396, 0.01297791584961942)
2026-06-19 11:03:06,294 - optuna.study.study - INFO - Trial 245 finished with values: [0.02314824956700157, 0.004948212706833396, 0.01297791584961942] and parameters: {'n_layers': 2, 'embedding_dim': 128, 'lr': 0.0025726585227239724, 'lambda_val': 0.0003743444509143199, 'batch_size': 2567, 'optimizer': 'Adam'}.
2026-06-19 11:03:37,574 - experiment_functions - INFO - Early stopping at epoch 550. Best Metrics: (0.006883128389107395, 0.001544145509662751, 0.0039301848841753265)
2026-06-19 11:03:37,670 - optuna.study.study - INFO - Trial 246 finished with values: [0.006883128389107395, 0.001544145509662751, 0.0039301848841753265] and parameters: {'n_layers': 2, 'embedding_dim': 256, 'lr': 0.0322713277409003, 'lambda_val': 2.005340661981191e-05, 'batch_size': 2427, 'optimizer': 'RMSprop'}.
2026-06-19 11:05:44,933 - experiment_functions - INFO - Early stopping at epoch 2800. Best Metrics: (0.034059268856315265, 0.007032335480611342, 0.01939172266284168)
2026-06-19 11:05:45,017 - optuna.study.study - INFO - Trial 247 finished with values: [0.034059268856315265, 0.007032335480611342, 0.01939172266284168] and parameters: {'n_layers': 1, 'embedding_dim': 128, 'lr': 0.0008520784697548674, 'lambda_val': 0.00033501152249190713, 'batch_size': 3743, 'optimizer': 'RMSprop'}.
2026-06-19 11:06:34,129 - experiment_functions - INFO - Early stopping at epoch 950. Best Metrics: (0.02899224220884362, 0.006206580775546293, 0.016615556403824748)
2026-06-19 11:06:34,216 - optuna.study.study - INFO - Trial 248 finished with values: [0.02899224220884362, 0.006206580775546293, 0.016615556403824748] and parameters: {'n_layers': 1, 'embedding_dim': 256, 'lr': 0.0020290919563790725, 'lambda_val': 1.9209272632964056e-06, 'batch_size': 3024, 'optimizer': 'Adam'}.
2026-06-19 11:07:27,653 - experiment_functions - INFO - Early stopping at epoch 1050. Best Metrics: (0.021298817379417287, 0.00444928634583807, 0.012138469981617767)
2026-06-19 11:07:27,744 - optuna.study.study - INFO - Trial 249 finished with values: [0.021298817379417287, 0.00444928634583807, 0.012138469981617767] and parameters: {'n_layers': 4, 'embedding_dim': 96, 'lr': 0.000670518483727842, 'lambda_val': 0.0001469242914477015, 'batch_size': 2427, 'optimizer': 'Adam'}.
2026-06-19 11:08:01,107 - experiment_functions - INFO - Early stopping at epoch 600. Best Metrics: (0.01654795570322534, 0.003530377668308703, 0.009107023603698843)
2026-06-19 11:08:01,229 - optuna.study.study - INFO - Trial 250 finished with values: [0.01654795570322534, 0.003530377668308703, 0.009107023603698843] and parameters: {'n_layers': 4, 'embedding_dim': 128, 'lr': 0.0020290919563790725, 'lambda_val': 0.0001228083366977069, 'batch_size': 3132, 'optimizer': 'Adam'}.
2026-06-19 11:10:58,002 - optuna.study.study - INFO - Trial 251 finished with values: [0.033727991317431934, 0.0070623342175066325, 0.01956963755827123] and parameters: {'n_layers': 1, 'embedding_dim': 96, 'lr': 0.0008520784697548674, 'lambda_val': 7.169103823221734e-06, 'batch_size': 2493, 'optimizer': 'RMSprop'}.
2026-06-19 11:13:52,872 - optuna.study.study - INFO - Trial 252 finished with values: [0.023457184463572072, 0.005161361626878868, 0.013866384056288792] and parameters: {'n_layers': 1, 'embedding_dim': 96, 'lr': 0.00040915331418917104, 'lambda_val': 1.3063371603281255e-06, 'batch_size': 3994, 'optimizer': 'RMSprop'}.
2026-06-19 11:14:35,734 - experiment_functions - INFO - Early stopping at epoch 750. Best Metrics: (0.020609311082343994, 0.004472969559176456, 0.011319870062851107)
2026-06-19 11:14:35,834 - optuna.study.study - INFO - Trial 253 finished with values: [0.020609311082343994, 0.004472969559176456, 0.011319870062851107] and parameters: {'n_layers': 2, 'embedding_dim': 256, 'lr': 0.0021084866247743058, 'lambda_val': 0.0001469242914477015, 'batch_size': 1251, 'optimizer': 'Adam'}.
2026-06-19 11:17:46,355 - optuna.study.study - INFO - Trial 254 finished with values: [0.006818746403300875, 0.0016546671719085515, 0.004207501208797428] and parameters: {'n_layers': 1, 'embedding_dim': 256, 'lr': 0.00024629881721888885, 'lambda_val': 1.9209272632964056e-06, 'batch_size': 3994, 'optimizer': 'RMSprop'}.
2026-06-19 11:18:31,041 - experiment_functions - INFO - Early stopping at epoch 900. Best Metrics: (0.021549898135244924, 0.004559808008083871, 0.011977681762088561)
2026-06-19 11:18:31,357 - optuna.study.study - INFO - Trial 255 finished with values: [0.021549898135244924, 0.004559808008083871, 0.011977681762088561] and parameters: {'n_layers': 3, 'embedding_dim': 96, 'lr': 0.0008520784697548674, 'lambda_val': 1.5236318044232254e-06, 'batch_size': 2806, 'optimizer': 'RMSprop'}.
2026-06-19 11:21:31,866 - optuna.study.study - INFO - Trial 256 finished with values: [0.031871888418219835, 0.006702349374763169, 0.018220326704868704] and parameters: {'n_layers': 1, 'embedding_dim': 128, 'lr': 0.0008520784697548674, 'lambda_val': 7.169103823221734e-06, 'batch_size': 1875, 'optimizer': 'Adam'}.
2026-06-19 11:24:23,808 - optuna.study.study - INFO - Trial 257 finished with values: [0.030937781036275674, 0.006553934571175951, 0.017877356784910387] and parameters: {'n_layers': 1, 'embedding_dim': 64, 'lr': 0.0008520784697548674, 'lambda_val': 0.0003743444509143199, 'batch_size': 2326, 'optimizer': 'Adam'}.
2026-06-19 11:24:52,457 - experiment_functions - INFO - Early stopping at epoch 600. Best Metrics: (0.028136022056383016, 0.00587185802703044, 0.016117572473792075)
2026-06-19 11:24:52,552 - optuna.study.study - INFO - Trial 258 finished with values: [0.028136022056383016, 0.00587185802703044, 0.016117572473792075] and parameters: {'n_layers': 1, 'embedding_dim': 96, 'lr': 0.00875508308708224, 'lambda_val': 1.3063371603281255e-06, 'batch_size': 3739, 'optimizer': 'Adam'}.
2026-06-19 11:27:54,190 - optuna.study.study - INFO - Trial 259 finished with values: [0.03148397497580852, 0.006683402804092459, 0.01789954687959792] and parameters: {'n_layers': 1, 'embedding_dim': 128, 'lr': 0.000670518483727842, 'lambda_val': 0.0001469242914477015, 'batch_size': 3739, 'optimizer': 'Adam'}.
2026-06-19 11:28:17,920 - experiment_functions - INFO - Early stopping at epoch 500. Best Metrics: (0.0006796904950712384, 0.0001468359226979917, 0.00037465276254251145)
2026-06-19 11:28:18,014 - optuna.study.study - INFO - Trial 260 finished with values: [0.0006796904950712384, 0.0001468359226979917, 0.00037465276254251145] and parameters: {'n_layers': 1, 'embedding_dim': 128, 'lr': 0.00011542846759838175, 'lambda_val': 0.0003743444509143199, 'batch_size': 1593, 'optimizer': 'RMSprop'}.
2026-06-19 11:28:50,841 - experiment_functions - INFO - Early stopping at epoch 700. Best Metrics: (0.022401742685525323, 0.004992421371731717, 0.0127160063197347)
2026-06-19 11:28:50,925 - optuna.study.study - INFO - Trial 261 finished with values: [0.022401742685525323, 0.004992421371731717, 0.0127160063197347] and parameters: {'n_layers': 1, 'embedding_dim': 96, 'lr': 0.0020290919563790725, 'lambda_val': 0.0076252618967348, 'batch_size': 1875, 'optimizer': 'RMSprop'}.
2026-06-19 11:29:42,496 - experiment_functions - INFO - Early stopping at epoch 1000. Best Metrics: (0.027996948297328433, 0.006009220664393079, 0.01592275156458353)
