2026-06-21 20:18:11,274 - optuna.study.study - INFO - Trial 278 finished with values: [0.0004945016300500596, 0.00012473159024883166, 0.00030370033935195155] and parameters: {'n_layers': 2, 'embedding_dim': 32, 'lr': 0.00264461364827089, 'lambda_val': 6.131403610536352e-05, 'batch_size': 3442, 'optimizer': 'SGD'}.
2026-06-21 20:18:37,580 - experiment_functions - INFO - Early stopping at epoch 500. Best Metrics: (0.0019350998260415353, 0.00047366426676771507, 0.0012495735107637912)
2026-06-21 20:18:37,730 - optuna.study.study - INFO - Trial 279 finished with values: [0.0019350998260415353, 0.00047366426676771507, 0.0012495735107637912] and parameters: {'n_layers': 2, 'embedding_dim': 256, 'lr': 0.08742032790322182, 'lambda_val': 0.0004098288354602192, 'batch_size': 3442, 'optimizer': 'RMSprop'}.
2026-06-21 20:19:32,407 - experiment_functions - INFO - Early stopping at epoch 1200. Best Metrics: (0.0005309911830614813, 0.00010736390046734874, 0.0002750054416249631)
2026-06-21 20:19:32,506 - optuna.study.study - INFO - Trial 280 finished with values: [0.0005309911830614813, 0.00010736390046734874, 0.0002750054416249631] and parameters: {'n_layers': 4, 'embedding_dim': 96, 'lr': 2.144048224416008e-05, 'lambda_val': 7.771910891351295e-06, 'batch_size': 2374, 'optimizer': 'Adam'}.
2026-06-21 20:20:19,788 - experiment_functions - INFO - Early stopping at epoch 1050. Best Metrics: (0.00976129386322705, 0.0024251610458507007, 0.005881408028490249)
2026-06-21 20:20:19,890 - optuna.study.study - INFO - Trial 281 finished with values: [0.00976129386322705, 0.0024251610458507007, 0.005881408028490249] and parameters: {'n_layers': 4, 'embedding_dim': 64, 'lr': 0.00168887528029852, 'lambda_val': 8.435578644144147e-05, 'batch_size': 1741, 'optimizer': 'Adam'}.
2026-06-21 20:20:55,629 - experiment_functions - INFO - Early stopping at epoch 750. Best Metrics: (0.009285647992835563, 0.0023430592396109636, 0.0055653743271064735)
2026-06-21 20:20:55,909 - optuna.study.study - INFO - Trial 282 finished with values: [0.009285647992835563, 0.0023430592396109636, 0.0055653743271064735] and parameters: {'n_layers': 4, 'embedding_dim': 96, 'lr': 0.00168887528029852, 'lambda_val': 0.003169077271936137, 'batch_size': 1157, 'optimizer': 'RMSprop'}.
2026-06-21 20:21:27,469 - experiment_functions - INFO - Early stopping at epoch 650. Best Metrics: (0.008726526316320461, 0.002169382341796135, 0.00531220972150827)
2026-06-21 20:21:27,965 - optuna.study.study - INFO - Trial 283 finished with values: [0.008726526316320461, 0.002169382341796135, 0.00531220972150827] and parameters: {'n_layers': 4, 'embedding_dim': 96, 'lr': 0.0036608132255288727, 'lambda_val': 0.0005803217930206673, 'batch_size': 1913, 'optimizer': 'Adam'}.
2026-06-21 20:21:54,679 - experiment_functions - INFO - Early stopping at epoch 600. Best Metrics: (0.007512094740007981, 0.0019167613995200203, 0.004544829247960332)
2026-06-21 20:21:54,785 - optuna.study.study - INFO - Trial 284 finished with values: [0.007512094740007981, 0.0019167613995200203, 0.004544829247960332] and parameters: {'n_layers': 4, 'embedding_dim': 32, 'lr': 0.008463855437471605, 'lambda_val': 1.1896982541974421e-05, 'batch_size': 3442, 'optimizer': 'Adam'}.
2026-06-21 20:22:34,474 - experiment_functions - INFO - Early stopping at epoch 950. Best Metrics: (0.005731489020541081, 0.0013562586838448908, 0.003496714893717031)
2026-06-21 20:22:35,485 - optuna.study.study - INFO - Trial 285 finished with values: [0.005731489020541081, 0.0013562586838448908, 0.003496714893717031] and parameters: {'n_layers': 2, 'embedding_dim': 32, 'lr': 0.00264461364827089, 'lambda_val': 7.024518890460945e-05, 'batch_size': 3442, 'optimizer': 'Adam'}.
2026-06-21 20:22:59,989 - experiment_functions - INFO - Early stopping at epoch 550. Best Metrics: (0.0031579194170817605, 0.0008462801566249844, 0.0019390598128398997)
2026-06-21 20:23:00,282 - optuna.study.study - INFO - Trial 286 finished with values: [0.0031579194170817605, 0.0008462801566249844, 0.0019390598128398997] and parameters: {'n_layers': 4, 'embedding_dim': 32, 'lr': 0.017699547409013146, 'lambda_val': 0.0014521812774996785, 'batch_size': 1787, 'optimizer': 'RMSprop'}.
2026-06-21 20:24:00,997 - experiment_functions - INFO - Early stopping at epoch 1400. Best Metrics: (0.00982521993001054, 0.002461475306302892, 0.006042207536719738)
2026-06-21 20:24:01,129 - optuna.study.study - INFO - Trial 287 finished with values: [0.00982521993001054, 0.002461475306302892, 0.006042207536719738] and parameters: {'n_layers': 3, 'embedding_dim': 64, 'lr': 0.00168887528029852, 'lambda_val': 7.024518890460945e-05, 'batch_size': 1200, 'optimizer': 'Adam'}.
2026-06-21 20:24:23,550 - experiment_functions - INFO - Early stopping at epoch 500. Best Metrics: (0.000561236580930228, 0.0001278893520272831, 0.00033403164395489195)
2026-06-21 20:24:23,661 - optuna.study.study - INFO - Trial 288 finished with values: [0.000561236580930228, 0.0001278893520272831, 0.00033403164395489195] and parameters: {'n_layers': 4, 'embedding_dim': 32, 'lr': 0.0015158687633618723, 'lambda_val': 6.131403610536352e-05, 'batch_size': 3442, 'optimizer': 'SGD'}.
2026-06-21 20:24:52,649 - experiment_functions - INFO - Early stopping at epoch 600. Best Metrics: (0.00712545730259426, 0.0018409751168371857, 0.004154513178230705)
2026-06-21 20:24:52,751 - optuna.study.study - INFO - Trial 289 finished with values: [0.00712545730259426, 0.0018409751168371857, 0.004154513178230705] and parameters: {'n_layers': 3, 'embedding_dim': 128, 'lr': 0.0036608132255288727, 'lambda_val': 0.0005803217930206673, 'batch_size': 1157, 'optimizer': 'RMSprop'}.
2026-06-21 20:25:19,373 - experiment_functions - INFO - Early stopping at epoch 600. Best Metrics: (0.00741192858506926, 0.0018378173550587342, 0.00451272586352795)
2026-06-21 20:25:19,482 - optuna.study.study - INFO - Trial 290 finished with values: [0.00741192858506926, 0.0018378173550587342, 0.00451272586352795] and parameters: {'n_layers': 4, 'embedding_dim': 32, 'lr': 0.0072168992782938955, 'lambda_val': 1.1896982541974421e-05, 'batch_size': 3469, 'optimizer': 'Adam'}.
2026-06-21 20:25:46,332 - experiment_functions - INFO - Early stopping at epoch 600. Best Metrics: (0.008119965133723692, 0.0020557029177718836, 0.004697354936883682)
2026-06-21 20:25:46,446 - optuna.study.study - INFO - Trial 291 finished with values: [0.008119965133723692, 0.0020557029177718836, 0.004697354936883682] and parameters: {'n_layers': 4, 'embedding_dim': 32, 'lr': 0.0036608132255288727, 'lambda_val': 0.0005803217930206673, 'batch_size': 1913, 'optimizer': 'RMSprop'}.
2026-06-21 20:26:28,698 - experiment_functions - INFO - Early stopping at epoch 900. Best Metrics: (0.00901445006707583, 0.002306744979158772, 0.005429431438070716)
2026-06-21 20:26:28,800 - optuna.study.study - INFO - Trial 292 finished with values: [0.00901445006707583, 0.002306744979158772, 0.005429431438070716] and parameters: {'n_layers': 4, 'embedding_dim': 96, 'lr': 0.0015158687633618723, 'lambda_val': 6.702534509469782e-06, 'batch_size': 2925, 'optimizer': 'Adam'}.
2026-06-21 20:27:34,442 - experiment_functions - INFO - Early stopping at epoch 1600. Best Metrics: (0.007203390969915513, 0.0017778198812681571, 0.004494733810953237)
2026-06-21 20:27:34,517 - optuna.study.study - INFO - Trial 293 finished with values: [0.007203390969915513, 0.0017778198812681571, 0.004494733810953237] and parameters: {'n_layers': 2, 'embedding_dim': 32, 'lr': 0.00264461364827089, 'lambda_val': 7.635658041119374e-05, 'batch_size': 1157, 'optimizer': 'Adam'}.
2026-06-21 20:29:19,964 - experiment_functions - INFO - Early stopping at epoch 2450. Best Metrics: (0.011530611698920598, 0.0029477706201844135, 0.007220574687453681)
2026-06-21 20:29:20,052 - optuna.study.study - INFO - Trial 294 finished with values: [0.011530611698920598, 0.0029477706201844135, 0.007220574687453681] and parameters: {'n_layers': 4, 'embedding_dim': 64, 'lr': 0.0005987126964250273, 'lambda_val': 7.635658041119374e-05, 'batch_size': 2770, 'optimizer': 'RMSprop'}.
2026-06-21 20:29:50,444 - experiment_functions - INFO - Early stopping at epoch 600. Best Metrics: (0.00875059695186954, 0.002185171150688392, 0.005176073018733738)
2026-06-21 20:29:50,687 - optuna.study.study - INFO - Trial 295 finished with values: [0.00875059695186954, 0.002185171150688392, 0.005176073018733738] and parameters: {'n_layers': 4, 'embedding_dim': 128, 'lr': 0.00168887528029852, 'lambda_val': 0.0025915414899130838, 'batch_size': 2770, 'optimizer': 'RMSprop'}.
2026-06-21 20:30:29,383 - experiment_functions - INFO - Early stopping at epoch 900. Best Metrics: (0.010271865546147146, 0.002624100037893141, 0.00640266206848404)
2026-06-21 20:30:29,986 - optuna.study.study - INFO - Trial 296 finished with values: [0.010271865546147146, 0.002624100037893141, 0.00640266206848404] and parameters: {'n_layers': 4, 'embedding_dim': 32, 'lr': 0.0015158687633618723, 'lambda_val': 0.0004098288354602192, 'batch_size': 2925, 'optimizer': 'RMSprop'}.
2026-06-21 20:31:14,785 - experiment_functions - INFO - Early stopping at epoch 1050. Best Metrics: (0.008355064744647821, 0.0020935960591133007, 0.005089347548117748)
2026-06-21 20:31:14,867 - optuna.study.study - INFO - Trial 297 finished with values: [0.008355064744647821, 0.0020935960591133007, 0.005089347548117748] and parameters: {'n_layers': 4, 'embedding_dim': 32, 'lr': 0.00168887528029852, 'lambda_val': 1.1896982541974421e-05, 'batch_size': 3844, 'optimizer': 'Adam'}.
2026-06-21 20:31:43,779 - experiment_functions - INFO - Early stopping at epoch 600. Best Metrics: (0.00822054271484692, 0.002114121510673235, 0.0049633425734863365)
2026-06-21 20:31:43,876 - optuna.study.study - INFO - Trial 298 finished with values: [0.00822054271484692, 0.002114121510673235, 0.0049633425734863365] and parameters: {'n_layers': 4, 'embedding_dim': 96, 'lr': 0.0026843825331302053, 'lambda_val': 0.0005803217930206673, 'batch_size': 3442, 'optimizer': 'RMSprop'}.
2026-06-21 20:32:16,849 - experiment_functions - INFO - Early stopping at epoch 700. Best Metrics: (0.003157527595043322, 0.0008494379184034357, 0.0018271323819313496)
2026-06-21 20:32:16,948 - optuna.study.study - INFO - Trial 299 finished with values: [0.003157527595043322, 0.0008494379184034357, 0.0018271323819313496] and parameters: {'n_layers': 4, 'embedding_dim': 96, 'lr': 0.0015158687633618723, 'lambda_val': 0.06643674331229613, 'batch_size': 3122, 'optimizer': 'RMSprop'}.
2026-06-21 20:32:16,963 - root - INFO - Selected Trial 259 based on Max ndcg: 0.0078
2026-06-21 20:32:16,963 - root - INFO - Associated Recall: 0.0129
2026-06-21 20:32:16,963 - experiment_functions - INFO - Training the best model ... for e_yelp_1c2dcs_strict_rand4
2026-06-21 20:34:16,328 - experiment_functions - INFO - Early stopping at epoch 2950. Best Metrics: (0.013318093455437685, 0.0033219653909309084, 0.008120700655460967)
2026-06-21 20:34:20,158 - root - INFO -   **** Training e_yelp_1c2dcs_strict_rand5
2026-06-21 20:34:20,185 - root - INFO -   **** Getting 71258/1274132 random edges
2026-06-21 20:34:20,349 - optuna.storages._rdb.storage - INFO - A new study created in RDB with name: Study_e_yelp_1c2dcs_strict_rand5
2026-06-21 20:36:24,330 - experiment_functions - INFO - Early stopping at epoch 3000. Best Metrics: (0.0046224296962218215, 0.0010625868384489074, 0.0027446115567684864)
2026-06-21 20:36:24,412 - optuna.study.study - INFO - Trial 0 finished with values: [0.0046224296962218215, 0.0010625868384489074, 0.0027446115567684864] and parameters: {'n_layers': 1, 'embedding_dim': 96, 'lr': 0.001722483120017554, 'lambda_val': 3.602866380465963e-05, 'batch_size': 3721, 'optimizer': 'Adam'}.
2026-06-21 20:36:47,430 - experiment_functions - INFO - Early stopping at epoch 500. Best Metrics: (0.0005392661437967377, 0.00010736390046734875, 0.0002638749546699482)
2026-06-21 20:36:47,506 - optuna.study.study - INFO - Trial 1 finished with values: [0.0005392661437967377, 0.00010736390046734875, 0.0002638749546699482] and parameters: {'n_layers': 2, 'embedding_dim': 96, 'lr': 1.3625265674246152e-05, 'lambda_val': 0.04640319739794366, 'batch_size': 2247, 'optimizer': 'Adam'}.
2026-06-21 20:37:10,237 - experiment_functions - INFO - Early stopping at epoch 500. Best Metrics: (0.0004645356305254068, 0.00010894278135657447, 0.00028779927976678346)
2026-06-21 20:37:10,335 - optuna.study.study - INFO - Trial 2 finished with values: [0.0004645356305254068, 0.00010894278135657447, 0.00028779927976678346] and parameters: {'n_layers': 3, 'embedding_dim': 64, 'lr': 0.006802117509975481, 'lambda_val': 6.672949498452122e-05, 'batch_size': 2534, 'optimizer': 'SGD'}.
2026-06-21 20:40:01,974 - optuna.study.study - INFO - Trial 3 finished with values: [0.0020875268198040672, 0.00044998105342932933, 0.0012476754442312542] and parameters: {'n_layers': 2, 'embedding_dim': 128, 'lr': 0.0001781546457870682, 'lambda_val': 3.26940020460598e-05, 'batch_size': 3211, 'optimizer': 'RMSprop'}.
2026-06-21 20:42:56,760 - optuna.study.study - INFO - Trial 4 finished with values: [0.0008087279642179711, 0.00017999242137173172, 0.00041188708593999725] and parameters: {'n_layers': 4, 'embedding_dim': 64, 'lr': 3.5778108426865314e-05, 'lambda_val': 0.000470129247662684, 'batch_size': 2883, 'optimizer': 'RMSprop'}.
2026-06-21 20:43:19,991 - experiment_functions - INFO - Early stopping at epoch 500. Best Metrics: (0.0005706106201875971, 0.00011999494758115447, 0.00029002345146527303)
2026-06-21 20:43:20,084 - optuna.study.study - INFO - Trial 5 finished with values: [0.0005706106201875971, 0.00011999494758115447, 0.00029002345146527303] and parameters: {'n_layers': 1, 'embedding_dim': 32, 'lr': 0.0003967154268167435, 'lambda_val': 4.658036392157902e-05, 'batch_size': 3811, 'optimizer': 'SGD'}.
2026-06-21 20:44:12,692 - experiment_functions - INFO - Early stopping at epoch 1200. Best Metrics: (0.0029882965199592086, 0.0007547050650498927, 0.0016969728521960144)
2026-06-21 20:44:12,778 - optuna.study.study - INFO - Trial 6 finished with values: [0.0029882965199592086, 0.0007547050650498927, 0.0016969728521960144] and parameters: {'n_layers': 2, 'embedding_dim': 64, 'lr': 0.039366529883150314, 'lambda_val': 0.007932838436805362, 'batch_size': 2777, 'optimizer': 'RMSprop'}.
2026-06-21 20:44:35,324 - experiment_functions - INFO - Early stopping at epoch 500. Best Metrics: (0.00037157118919322615, 8.999621068586587e-05, 0.00023717706832301108)
2026-06-21 20:44:35,406 - optuna.study.study - INFO - Trial 7 finished with values: [0.00037157118919322615, 8.999621068586587e-05, 0.00023717706832301108] and parameters: {'n_layers': 1, 'embedding_dim': 64, 'lr': 0.00022102119100765304, 'lambda_val': 0.09507806905743242, 'batch_size': 1110, 'optimizer': 'RMSprop'}.
2026-06-21 20:47:23,036 - experiment_functions - INFO - Early stopping at epoch 3900. Best Metrics: (0.0007797319831646641, 0.0001799924213717317, 0.00048141694242842244)
2026-06-21 20:47:23,143 - optuna.study.study - INFO - Trial 8 finished with values: [0.0007797319831646641, 0.0001799924213717317, 0.00048141694242842244] and parameters: {'n_layers': 3, 'embedding_dim': 64, 'lr': 6.977063236092006e-05, 'lambda_val': 1.4463129473968207e-05, 'batch_size': 3650, 'optimizer': 'RMSprop'}.
2026-06-21 20:50:15,801 - optuna.study.study - INFO - Trial 9 finished with values: [0.0007691849515062158, 0.0001578880889225717, 0.00040257139495387327] and parameters: {'n_layers': 3, 'embedding_dim': 64, 'lr': 9.568347469317345e-05, 'lambda_val': 0.011778775382543278, 'batch_size': 2354, 'optimizer': 'RMSprop'}.
2026-06-21 20:53:22,497 - optuna.study.study - INFO - Trial 10 finished with values: [0.000950797211013975, 0.00020051787293166602, 0.0005367934178450327] and parameters: {'n_layers': 1, 'embedding_dim': 256, 'lr': 0.00012891233515915058, 'lambda_val': 1.4035287803936304e-06, 'batch_size': 1924, 'optimizer': 'Adam'}.
2026-06-21 20:53:47,734 - experiment_functions - INFO - Early stopping at epoch 500. Best Metrics: (0.0004642655815035671, 0.00011841606669192877, 0.0002655161573515443)
2026-06-21 20:53:47,934 - optuna.study.study - INFO - Trial 11 finished with values: [0.0004642655815035671, 0.00011841606669192877, 0.0002655161573515443] and parameters: {'n_layers': 4, 'embedding_dim': 128, 'lr': 0.002103872362755323, 'lambda_val': 1.722399276566065e-05, 'batch_size': 3404, 'optimizer': 'SGD'}.
2026-06-21 20:54:42,037 - experiment_functions - INFO - Early stopping at epoch 1250. Best Metrics: (0.004257917644636597, 0.0010341669824428445, 0.0025600948391536725)
2026-06-21 20:54:42,113 - optuna.study.study - INFO - Trial 12 finished with values: [0.004257917644636597, 0.0010341669824428445, 0.0025600948391536725] and parameters: {'n_layers': 1, 'embedding_dim': 128, 'lr': 0.0011267070786255592, 'lambda_val': 0.002536649916066294, 'batch_size': 3477, 'optimizer': 'RMSprop'}.
2026-06-21 20:55:08,842 - experiment_functions - INFO - Early stopping at epoch 550. Best Metrics: (0.0041431690080351215, 0.0010941644562334216, 0.0024138794953484383)
2026-06-21 20:55:08,934 - optuna.study.study - INFO - Trial 13 finished with values: [0.0041431690080351215, 0.0010941644562334216, 0.0024138794953484383] and parameters: {'n_layers': 4, 'embedding_dim': 96, 'lr': 0.007083700783329076, 'lambda_val': 0.0049720585313741935, 'batch_size': 1539, 'optimizer': 'RMSprop'}.
2026-06-21 20:55:33,267 - experiment_functions - INFO - Early stopping at epoch 550. Best Metrics: (0.0035276970917496853, 0.0008131236579512443, 0.0020921145090489384)
2026-06-21 20:55:33,347 - optuna.study.study - INFO - Trial 14 finished with values: [0.0035276970917496853, 0.0008131236579512443, 0.0020921145090489384] and parameters: {'n_layers': 2, 'embedding_dim': 32, 'lr': 0.026210587650510934, 'lambda_val': 0.0014554555241483656, 'batch_size': 3879, 'optimizer': 'Adam'}.
2026-06-21 20:56:43,344 - experiment_functions - INFO - Early stopping at epoch 1750. Best Metrics: (0.002647584411493104, 0.0007373373752684097, 0.0016163573219812473)
2026-06-21 20:56:43,431 - optuna.study.study - INFO - Trial 15 finished with values: [0.002647584411493104, 0.0007373373752684097, 0.0016163573219812473] and parameters: {'n_layers': 1, 'embedding_dim': 32, 'lr': 0.015836500648249808, 'lambda_val': 0.014586536668900354, 'batch_size': 2127, 'optimizer': 'RMSprop'}.
2026-06-21 20:57:06,396 - experiment_functions - INFO - Early stopping at epoch 500. Best Metrics: (0.00044290409758234334, 0.00011052166224580018, 0.0002976885205751333)
2026-06-21 20:57:06,482 - optuna.study.study - INFO - Trial 16 finished with values: [0.00044290409758234334, 0.00011052166224580018, 0.0002976885205751333] and parameters: {'n_layers': 2, 'embedding_dim': 96, 'lr': 0.0003840466776435171, 'lambda_val': 0.0005725041524092545, 'batch_size': 1389, 'optimizer': 'SGD'}.
2026-06-21 20:57:32,062 - experiment_functions - INFO - Early stopping at epoch 500. Best Metrics: (0.0004590425014396331, 0.0001373626373626374, 0.00026784629093317986)
2026-06-21 20:57:32,152 - optuna.study.study - INFO - Trial 17 finished with values: [0.0004590425014396331, 0.0001373626373626374, 0.00026784629093317986] and parameters: {'n_layers': 2, 'embedding_dim': 256, 'lr': 0.0003379840319553962, 'lambda_val': 0.005760256717085571, 'batch_size': 2680, 'optimizer': 'SGD'}.
2026-06-21 20:57:57,683 - experiment_functions - INFO - Early stopping at epoch 500. Best Metrics: (0.0004732482702849973, 0.00011683718580270305, 0.0002724025539693322)
2026-06-21 20:57:57,777 - optuna.study.study - INFO - Trial 18 finished with values: [0.0004732482702849973, 0.00011683718580270305, 0.0002724025539693322] and parameters: {'n_layers': 2, 'embedding_dim': 256, 'lr': 0.09492483685229738, 'lambda_val': 0.0020399055963721035, 'batch_size': 1451, 'optimizer': 'SGD'}.
2026-06-21 20:58:20,349 - experiment_functions - INFO - Early stopping at epoch 500. Best Metrics: (0.0005055983922465142, 0.00012473159024883163, 0.00028461469884316447)
2026-06-21 20:58:20,433 - optuna.study.study - INFO - Trial 19 finished with values: [0.0005055983922465142, 0.00012473159024883163, 0.00028461469884316447] and parameters: {'n_layers': 2, 'embedding_dim': 64, 'lr': 0.00038429065795738814, 'lambda_val': 0.00011719231119813046, 'batch_size': 1575, 'optimizer': 'SGD'}.
2026-06-21 20:59:58,415 - experiment_functions - INFO - Early stopping at epoch 2450. Best Metrics: (0.0005857948851983907, 0.00013262599469496023, 0.00033631439219186296)
2026-06-21 20:59:58,498 - optuna.study.study - INFO - Trial 20 finished with values: [0.0005857948851983907, 0.00013262599469496023, 0.00033631439219186296] and parameters: {'n_layers': 2, 'embedding_dim': 32, 'lr': 4.4982534108766645e-05, 'lambda_val': 4.919667530385041e-05, 'batch_size': 2644, 'optimizer': 'Adam'}.
2026-06-21 21:00:22,847 - experiment_functions - INFO - Early stopping at epoch 550. Best Metrics: (0.005569723344126409, 0.0014509915371984337, 0.003373689482009749)
2026-06-21 21:00:22,936 - optuna.study.study - INFO - Trial 21 finished with values: [0.005569723344126409, 0.0014509915371984337, 0.003373689482009749] and parameters: {'n_layers': 4, 'embedding_dim': 32, 'lr': 0.011955866081987015, 'lambda_val': 0.00797546035551026, 'batch_size': 2742, 'optimizer': 'Adam'}.
2026-06-21 21:00:46,476 - experiment_functions - INFO - Early stopping at epoch 500. Best Metrics: (0.0005460928637288564, 0.00012157382847038021, 0.0002837719912458454)
2026-06-21 21:00:46,561 - optuna.study.study - INFO - Trial 22 finished with values: [0.0005460928637288564, 0.00012157382847038021, 0.0002837719912458454] and parameters: {'n_layers': 2, 'embedding_dim': 128, 'lr': 0.023307863507197542, 'lambda_val': 1.1454689220118589e-06, 'batch_size': 835, 'optimizer': 'SGD'}.
2026-06-21 21:01:10,619 - experiment_functions - INFO - Early stopping at epoch 500. Best Metrics: (0.0005725010249228596, 0.00014052039914108882, 0.00031976738176964567)
