2026-06-17 22:57:46,903 - optuna.study.study - INFO - Trial 59 finished with values: [0.000525944578029493, 0.00011999494758115447, 0.00027760322411904794] and parameters: {'n_layers': 3, 'embedding_dim': 64, 'lr': 0.0008996557513210464, 'lambda_val': 1.722028877010181e-06, 'batch_size': 1920, 'optimizer': 'SGD'}.
2026-06-17 22:58:13,165 - experiment_functions - INFO - Early stopping at epoch 550. Best Metrics: (0.0024865418084159636, 0.0006757610205886069, 0.00161639008266932)
2026-06-17 22:58:13,250 - optuna.study.study - INFO - Trial 60 finished with values: [0.0024865418084159636, 0.0006757610205886069, 0.00161639008266932] and parameters: {'n_layers': 4, 'embedding_dim': 96, 'lr': 0.0050419503560223886, 'lambda_val': 0.002750666158846801, 'batch_size': 2780, 'optimizer': 'RMSprop'}.
2026-06-17 22:58:39,474 - experiment_functions - INFO - Early stopping at epoch 600. Best Metrics: (0.002034285972536661, 0.0004973474801061008, 0.0013206259488456583)
2026-06-17 22:58:39,548 - optuna.study.study - INFO - Trial 61 finished with values: [0.002034285972536661, 0.0004973474801061008, 0.0013206259488456583] and parameters: {'n_layers': 2, 'embedding_dim': 64, 'lr': 0.04754239347856081, 'lambda_val': 6.696393236973679e-06, 'batch_size': 2988, 'optimizer': 'RMSprop'}.
2026-06-17 23:00:25,823 - experiment_functions - INFO - Early stopping at epoch 2700. Best Metrics: (0.002719950711363526, 0.0005841859290135153, 0.0015678516874323692)
2026-06-17 23:00:25,904 - optuna.study.study - INFO - Trial 62 finished with values: [0.002719950711363526, 0.0005841859290135153, 0.0015678516874323692] and parameters: {'n_layers': 1, 'embedding_dim': 64, 'lr': 0.0006197690834854795, 'lambda_val': 0.006986427337292849, 'batch_size': 1884, 'optimizer': 'Adam'}.
2026-06-17 23:03:05,237 - experiment_functions - INFO - Early stopping at epoch 3850. Best Metrics: (0.0033512108426511688, 0.000775230516609827, 0.002003336517443446)
2026-06-17 23:03:05,327 - optuna.study.study - INFO - Trial 63 finished with values: [0.0033512108426511688, 0.000775230516609827, 0.002003336517443446] and parameters: {'n_layers': 4, 'embedding_dim': 64, 'lr': 0.0006197690834854795, 'lambda_val': 0.006986427337292849, 'batch_size': 526, 'optimizer': 'Adam'}.
2026-06-17 23:04:04,960 - experiment_functions - INFO - Early stopping at epoch 1400. Best Metrics: (0.0032715424782376146, 0.0008020714917266643, 0.0020843441685786807)
2026-06-17 23:04:05,055 - optuna.study.study - INFO - Trial 64 finished with values: [0.0032715424782376146, 0.0008020714917266643, 0.0020843441685786807] and parameters: {'n_layers': 4, 'embedding_dim': 64, 'lr': 0.0006990102643278918, 'lambda_val': 0.002750666158846801, 'batch_size': 1884, 'optimizer': 'Adam'}.
2026-06-17 23:04:27,306 - experiment_functions - INFO - Early stopping at epoch 500. Best Metrics: (0.0005645662204980798, 0.00011841606669192877, 0.0003260783705793924)
2026-06-17 23:04:27,394 - optuna.study.study - INFO - Trial 65 finished with values: [0.0005645662204980798, 0.00011841606669192877, 0.0003260783705793924] and parameters: {'n_layers': 1, 'embedding_dim': 128, 'lr': 0.033675816322253686, 'lambda_val': 0.02413589938360598, 'batch_size': 2867, 'optimizer': 'SGD'}.
2026-06-17 23:05:02,414 - experiment_functions - INFO - Early stopping at epoch 800. Best Metrics: (0.002004259667980683, 0.0005447139067828723, 0.0013163879953186984)
2026-06-17 23:05:02,543 - optuna.study.study - INFO - Trial 66 finished with values: [0.002004259667980683, 0.0005447139067828723, 0.0013163879953186984] and parameters: {'n_layers': 2, 'embedding_dim': 96, 'lr': 0.004768609881490324, 'lambda_val': 0.03302620218478116, 'batch_size': 1205, 'optimizer': 'Adam'}.
2026-06-17 23:05:27,823 - experiment_functions - INFO - Early stopping at epoch 550. Best Metrics: (0.00211885884047752, 0.0005826070481242895, 0.0013023708329781176)
2026-06-17 23:05:27,903 - optuna.study.study - INFO - Trial 67 finished with values: [0.00211885884047752, 0.0005826070481242895, 0.0013023708329781176] and parameters: {'n_layers': 4, 'embedding_dim': 64, 'lr': 0.0050419503560223886, 'lambda_val': 0.02263249127031471, 'batch_size': 749, 'optimizer': 'RMSprop'}.
2026-06-17 23:05:49,697 - experiment_functions - INFO - Early stopping at epoch 500. Best Metrics: (0.0005991986461685436, 0.00013420487558418593, 0.00030856865151226493)
2026-06-17 23:05:49,822 - optuna.study.study - INFO - Trial 68 finished with values: [0.0005991986461685436, 0.00013420487558418593, 0.00030856865151226493] and parameters: {'n_layers': 2, 'embedding_dim': 32, 'lr': 1.659087408924899e-05, 'lambda_val': 3.926096583226207e-05, 'batch_size': 3408, 'optimizer': 'SGD'}.
2026-06-17 23:06:27,130 - experiment_functions - INFO - Early stopping at epoch 800. Best Metrics: (0.0030885051020267183, 0.000764178350385247, 0.0019613430594363126)
2026-06-17 23:06:27,205 - optuna.study.study - INFO - Trial 69 finished with values: [0.0030885051020267183, 0.000764178350385247, 0.0019613430594363126] and parameters: {'n_layers': 4, 'embedding_dim': 96, 'lr': 0.0016963971500712442, 'lambda_val': 2.9025613182499857e-06, 'batch_size': 3625, 'optimizer': 'Adam'}.
2026-06-17 23:07:18,448 - experiment_functions - INFO - Early stopping at epoch 1150. Best Metrics: (0.0006115041382330397, 0.0001468359226979917, 0.00035480177955899783)
2026-06-17 23:07:18,525 - optuna.study.study - INFO - Trial 70 finished with values: [0.0006115041382330397, 0.0001468359226979917, 0.00035480177955899783] and parameters: {'n_layers': 3, 'embedding_dim': 96, 'lr': 3.3089475700282735e-05, 'lambda_val': 0.0012241552802569934, 'batch_size': 3180, 'optimizer': 'Adam'}.
2026-06-17 23:07:49,222 - experiment_functions - INFO - Early stopping at epoch 700. Best Metrics: (0.002856207599644363, 0.0006662877352532525, 0.00173745749157776)
2026-06-17 23:07:49,312 - optuna.study.study - INFO - Trial 71 finished with values: [0.002856207599644363, 0.0006662877352532525, 0.00173745749157776] and parameters: {'n_layers': 3, 'embedding_dim': 32, 'lr': 0.0026704905176286454, 'lambda_val': 3.576975505685731e-06, 'batch_size': 4090, 'optimizer': 'Adam'}.
2026-06-17 23:08:18,154 - experiment_functions - INFO - Early stopping at epoch 600. Best Metrics: (0.002864455878716787, 0.0007183908045977011, 0.001876106798549963)
2026-06-17 23:08:18,280 - optuna.study.study - INFO - Trial 72 finished with values: [0.002864455878716787, 0.0007183908045977011, 0.001876106798549963] and parameters: {'n_layers': 4, 'embedding_dim': 96, 'lr': 0.004768609881490324, 'lambda_val': 0.00048067488070277503, 'batch_size': 3724, 'optimizer': 'Adam'}.
2026-06-17 23:08:50,535 - experiment_functions - INFO - Early stopping at epoch 650. Best Metrics: (0.003157121627647795, 0.0008004926108374384, 0.0019471765182908028)
2026-06-17 23:08:50,627 - optuna.study.study - INFO - Trial 73 finished with values: [0.003157121627647795, 0.0008004926108374384, 0.0019471765182908028] and parameters: {'n_layers': 4, 'embedding_dim': 128, 'lr': 0.002692587283514102, 'lambda_val': 7.431054110368361e-06, 'batch_size': 3359, 'optimizer': 'RMSprop'}.
2026-06-17 23:09:16,881 - experiment_functions - INFO - Early stopping at epoch 600. Best Metrics: (0.002576699472950041, 0.0006378678792471896, 0.0017215003619679215)
2026-06-17 23:09:17,472 - optuna.study.study - INFO - Trial 74 finished with values: [0.002576699472950041, 0.0006378678792471896, 0.0017215003619679215] and parameters: {'n_layers': 3, 'embedding_dim': 32, 'lr': 0.004714566698419002, 'lambda_val': 0.0012144921171399186, 'batch_size': 2987, 'optimizer': 'RMSprop'}.
2026-06-17 23:09:48,451 - experiment_functions - INFO - Early stopping at epoch 650. Best Metrics: (0.0032518372523888898, 0.0008510167992926615, 0.0020773991295300834)
2026-06-17 23:09:49,824 - optuna.study.study - INFO - Trial 75 finished with values: [0.0032518372523888898, 0.0008510167992926615, 0.0020773991295300834] and parameters: {'n_layers': 4, 'embedding_dim': 96, 'lr': 0.0071378175069858425, 'lambda_val': 5.470239525476512e-06, 'batch_size': 810, 'optimizer': 'Adam'}.
2026-06-17 23:12:29,076 - optuna.study.study - INFO - Trial 76 finished with values: [0.0024955840311309103, 0.0005699760010104838, 0.001499667152088671] and parameters: {'n_layers': 2, 'embedding_dim': 32, 'lr': 0.0003042717759198202, 'lambda_val': 4.897319562750751e-05, 'batch_size': 3215, 'optimizer': 'Adam'}.
2026-06-17 23:14:24,153 - experiment_functions - INFO - Early stopping at epoch 2800. Best Metrics: (0.003041598394759791, 0.0006599722116963497, 0.0019527878084069732)
2026-06-17 23:14:24,248 - optuna.study.study - INFO - Trial 77 finished with values: [0.003041598394759791, 0.0006599722116963497, 0.0019527878084069732] and parameters: {'n_layers': 2, 'embedding_dim': 64, 'lr': 0.00039868289481353135, 'lambda_val': 4.897319562750751e-05, 'batch_size': 3215, 'optimizer': 'Adam'}.
2026-06-17 23:16:39,047 - experiment_functions - INFO - Early stopping at epoch 3250. Best Metrics: (0.0007536114480632404, 0.00015315144625489453, 0.00040262117122394424)
2026-06-17 23:16:39,110 - optuna.study.study - INFO - Trial 78 finished with values: [0.0007536114480632404, 0.00015315144625489453, 0.00040262117122394424] and parameters: {'n_layers': 3, 'embedding_dim': 64, 'lr': 3.3089475700282735e-05, 'lambda_val': 0.0008436753566369497, 'batch_size': 3180, 'optimizer': 'RMSprop'}.
2026-06-17 23:17:01,637 - experiment_functions - INFO - Early stopping at epoch 500. Best Metrics: (0.0006065006162210127, 0.0001389415182518631, 0.00032581700793655067)
2026-06-17 23:17:01,707 - optuna.study.study - INFO - Trial 79 finished with values: [0.0006065006162210127, 0.0001389415182518631, 0.00032581700793655067] and parameters: {'n_layers': 1, 'embedding_dim': 128, 'lr': 0.033675816322253686, 'lambda_val': 0.02413589938360598, 'batch_size': 2129, 'optimizer': 'SGD'}.
2026-06-17 23:18:03,385 - experiment_functions - INFO - Early stopping at epoch 1500. Best Metrics: (0.0031470247937915425, 0.000691549829480864, 0.001870690119904063)
2026-06-17 23:18:03,469 - optuna.study.study - INFO - Trial 80 finished with values: [0.0031470247937915425, 0.000691549829480864, 0.001870690119904063] and parameters: {'n_layers': 1, 'embedding_dim': 64, 'lr': 0.0009259265868741952, 'lambda_val': 1.6270591304270666e-06, 'batch_size': 3625, 'optimizer': 'RMSprop'}.
2026-06-17 23:18:31,736 - experiment_functions - INFO - Early stopping at epoch 650. Best Metrics: (0.0030515893679145894, 0.0007120752810407982, 0.0019474984380471946)
2026-06-17 23:18:31,813 - optuna.study.study - INFO - Trial 81 finished with values: [0.0030515893679145894, 0.0007120752810407982, 0.0019474984380471946] and parameters: {'n_layers': 3, 'embedding_dim': 32, 'lr': 0.004714566698419002, 'lambda_val': 3.576975505685731e-06, 'batch_size': 2987, 'optimizer': 'RMSprop'}.
2026-06-17 23:19:37,021 - experiment_functions - INFO - Early stopping at epoch 1500. Best Metrics: (0.003085577458741683, 0.0007625994694960213, 0.0019852107608649147)
2026-06-17 23:19:37,103 - optuna.study.study - INFO - Trial 82 finished with values: [0.003085577458741683, 0.0007625994694960213, 0.0019852107608649147] and parameters: {'n_layers': 4, 'embedding_dim': 64, 'lr': 0.0006197690834854795, 'lambda_val': 0.006986427337292849, 'batch_size': 1884, 'optimizer': 'Adam'}.
2026-06-17 23:20:09,676 - experiment_functions - INFO - Early stopping at epoch 750. Best Metrics: (0.003198936859880178, 0.0007420740179360869, 0.002025313937631914)
2026-06-17 23:20:09,837 - optuna.study.study - INFO - Trial 83 finished with values: [0.003198936859880178, 0.0007420740179360869, 0.002025313937631914] and parameters: {'n_layers': 2, 'embedding_dim': 64, 'lr': 0.0016427257095284614, 'lambda_val': 0.0015914958177189133, 'batch_size': 1228, 'optimizer': 'RMSprop'}.
2026-06-17 23:22:56,783 - optuna.study.study - INFO - Trial 84 finished with values: [0.0006956602698245663, 0.00016578249336870028, 0.0003737946889635604] and parameters: {'n_layers': 2, 'embedding_dim': 96, 'lr': 2.182305502835638e-05, 'lambda_val': 0.0008304977352606367, 'batch_size': 2515, 'optimizer': 'Adam'}.
2026-06-17 23:23:19,223 - experiment_functions - INFO - Early stopping at epoch 500. Best Metrics: (0.00044641373896917377, 0.0001121005431350259, 0.0002558109359115358)
2026-06-17 23:23:19,308 - optuna.study.study - INFO - Trial 85 finished with values: [0.00044641373896917377, 0.0001121005431350259, 0.0002558109359115358] and parameters: {'n_layers': 2, 'embedding_dim': 64, 'lr': 0.0002697110618998964, 'lambda_val': 0.02413589938360598, 'batch_size': 2867, 'optimizer': 'SGD'}.
2026-06-17 23:24:07,210 - experiment_functions - INFO - Early stopping at epoch 1100. Best Metrics: (0.002672930743037729, 0.0006726032588101554, 0.0016524561911146853)
2026-06-17 23:24:07,294 - optuna.study.study - INFO - Trial 86 finished with values: [0.002672930743037729, 0.0006726032588101554, 0.0016524561911146853] and parameters: {'n_layers': 2, 'embedding_dim': 96, 'lr': 0.0023699548585448013, 'lambda_val': 0.00039580305818670997, 'batch_size': 600, 'optimizer': 'Adam'}.
2026-06-17 23:24:30,228 - experiment_functions - INFO - Early stopping at epoch 500. Best Metrics: (0.0003921003371555911, 8.999621068586585e-05, 0.00022489856066361472)
2026-06-17 23:24:30,320 - optuna.study.study - INFO - Trial 87 finished with values: [0.0003921003371555911, 8.999621068586585e-05, 0.00022489856066361472] and parameters: {'n_layers': 1, 'embedding_dim': 128, 'lr': 2.3653368544186697e-05, 'lambda_val': 0.02538239565409956, 'batch_size': 1842, 'optimizer': 'RMSprop'}.
2026-06-17 23:25:20,864 - experiment_functions - INFO - Early stopping at epoch 1150. Best Metrics: (0.0029177979673386417, 0.0007262852090438297, 0.0018262787076442706)
2026-06-17 23:25:20,937 - optuna.study.study - INFO - Trial 88 finished with values: [0.0029177979673386417, 0.0007262852090438297, 0.0018262787076442706] and parameters: {'n_layers': 4, 'embedding_dim': 64, 'lr': 0.0006197690834854795, 'lambda_val': 0.006986427337292849, 'batch_size': 2988, 'optimizer': 'RMSprop'}.
2026-06-17 23:25:43,813 - experiment_functions - INFO - Early stopping at epoch 500. Best Metrics: (0.0005121844716502949, 0.0001184160666919288, 0.000271236775731352)
2026-06-17 23:25:43,896 - optuna.study.study - INFO - Trial 89 finished with values: [0.0005121844716502949, 0.0001184160666919288, 0.000271236775731352] and parameters: {'n_layers': 2, 'embedding_dim': 96, 'lr': 0.004768609881490324, 'lambda_val': 0.0012241552802569934, 'batch_size': 3724, 'optimizer': 'SGD'}.
2026-06-17 23:26:07,988 - experiment_functions - INFO - Early stopping at epoch 550. Best Metrics: (0.0021198352692105354, 0.0004894530756599723, 0.0013164235625189034)
2026-06-17 23:26:08,076 - optuna.study.study - INFO - Trial 90 finished with values: [0.0021198352692105354, 0.0004894530756599723, 0.0013164235625189034] and parameters: {'n_layers': 2, 'embedding_dim': 32, 'lr': 0.020595386756549542, 'lambda_val': 0.007786517502985627, 'batch_size': 678, 'optimizer': 'Adam'}.
2026-06-17 23:26:46,460 - experiment_functions - INFO - Early stopping at epoch 750. Best Metrics: (0.0025829563785278757, 0.0006931287103700898, 0.001652836014040845)
2026-06-17 23:26:46,741 - optuna.study.study - INFO - Trial 91 finished with values: [0.0025829563785278757, 0.0006931287103700898, 0.001652836014040845] and parameters: {'n_layers': 2, 'embedding_dim': 256, 'lr': 0.0038478937066425594, 'lambda_val': 4.897319562750751e-05, 'batch_size': 3948, 'optimizer': 'Adam'}.
2026-06-17 23:27:18,047 - experiment_functions - INFO - Early stopping at epoch 650. Best Metrics: (0.003258852222816302, 0.0008320702286219528, 0.002087954908646834)
2026-06-17 23:27:18,137 - optuna.study.study - INFO - Trial 92 finished with values: [0.003258852222816302, 0.0008320702286219528, 0.002087954908646834] and parameters: {'n_layers': 3, 'embedding_dim': 128, 'lr': 0.0026704905176286454, 'lambda_val': 3.6404845826373614e-05, 'batch_size': 2162, 'optimizer': 'RMSprop'}.
2026-06-17 23:28:33,421 - experiment_functions - INFO - Early stopping at epoch 1750. Best Metrics: (0.003151371601717281, 0.0007799671592775042, 0.0020077526592528713)
2026-06-17 23:28:33,511 - optuna.study.study - INFO - Trial 93 finished with values: [0.003151371601717281, 0.0007799671592775042, 0.0020077526592528713] and parameters: {'n_layers': 4, 'embedding_dim': 64, 'lr': 0.0006197690834854795, 'lambda_val': 0.006986427337292849, 'batch_size': 1884, 'optimizer': 'Adam'}.
2026-06-17 23:31:30,661 - optuna.study.study - INFO - Trial 94 finished with values: [0.001954297443804808, 0.0004484021725401036, 0.0011724939215561367] and parameters: {'n_layers': 1, 'embedding_dim': 256, 'lr': 0.00029388098096717836, 'lambda_val': 0.008127741001112998, 'batch_size': 1255, 'optimizer': 'RMSprop'}.
2026-06-17 23:31:55,698 - experiment_functions - INFO - Early stopping at epoch 550. Best Metrics: (0.002440255967352334, 0.0005415561450044208, 0.0014688822465615413)
2026-06-17 23:31:55,827 - optuna.study.study - INFO - Trial 95 finished with values: [0.002440255967352334, 0.0005415561450044208, 0.0014688822465615413] and parameters: {'n_layers': 2, 'embedding_dim': 32, 'lr': 0.04431807195948907, 'lambda_val': 2.8202352055535507e-05, 'batch_size': 3455, 'optimizer': 'Adam'}.
2026-06-17 23:33:04,213 - experiment_functions - INFO - Early stopping at epoch 1250. Best Metrics: (0.003394457526638204, 0.0008683844890741444, 0.0020872423249018454)
2026-06-17 23:33:04,327 - optuna.study.study - INFO - Trial 96 finished with values: [0.003394457526638204, 0.0008683844890741444, 0.0020872423249018454] and parameters: {'n_layers': 4, 'embedding_dim': 256, 'lr': 0.0006674090882881629, 'lambda_val': 0.0001528536356672561, 'batch_size': 3948, 'optimizer': 'RMSprop'}.
2026-06-17 23:33:45,437 - experiment_functions - INFO - Early stopping at epoch 950. Best Metrics: (0.0024969241710323512, 0.0005810281672350638, 0.0015784893431490554)
2026-06-17 23:33:45,538 - optuna.study.study - INFO - Trial 97 finished with values: [0.0024969241710323512, 0.0005810281672350638, 0.0015784893431490554] and parameters: {'n_layers': 2, 'embedding_dim': 64, 'lr': 0.000964774837160554, 'lambda_val': 0.006986427337292849, 'batch_size': 4066, 'optimizer': 'Adam'}.
2026-06-17 23:36:28,688 - optuna.study.study - INFO - Trial 98 finished with values: [0.0008211508777678291, 0.00017209801692560315, 0.00048198802937060434] and parameters: {'n_layers': 1, 'embedding_dim': 96, 'lr': 4.81530817538612e-05, 'lambda_val': 2.8455851568313762e-06, 'batch_size': 3960, 'optimizer': 'RMSprop'}.
2026-06-17 23:36:52,196 - experiment_functions - INFO - Early stopping at epoch 500. Best Metrics: (0.0005603232844390578, 0.00010578501957812305, 0.0002800975739155905)
2026-06-17 23:36:52,296 - optuna.study.study - INFO - Trial 99 finished with values: [0.0005603232844390578, 0.00010578501957812305, 0.0002800975739155905] and parameters: {'n_layers': 3, 'embedding_dim': 96, 'lr': 0.0023699548585448013, 'lambda_val': 0.006515462622238777, 'batch_size': 2263, 'optimizer': 'SGD'}.
2026-06-17 23:37:26,715 - experiment_functions - INFO - Early stopping at epoch 800. Best Metrics: (0.002840324545199426, 0.0007010231148162183, 0.0018488307541195438)
2026-06-17 23:37:26,818 - optuna.study.study - INFO - Trial 100 finished with values: [0.002840324545199426, 0.0007010231148162183, 0.0018488307541195438] and parameters: {'n_layers': 3, 'embedding_dim': 32, 'lr': 0.004208447521360762, 'lambda_val': 3.6404845826373614e-05, 'batch_size': 2162, 'optimizer': 'RMSprop'}.
2026-06-17 23:37:54,442 - experiment_functions - INFO - Early stopping at epoch 600. Best Metrics: (0.001948067894121184, 0.000546292787672098, 0.0012399106188304844)
2026-06-17 23:37:54,593 - optuna.study.study - INFO - Trial 101 finished with values: [0.001948067894121184, 0.000546292787672098, 0.0012399106188304844] and parameters: {'n_layers': 4, 'embedding_dim': 64, 'lr': 0.0050419503560223886, 'lambda_val': 0.02263249127031471, 'batch_size': 2780, 'optimizer': 'RMSprop'}.
2026-06-17 23:39:01,612 - experiment_functions - INFO - Early stopping at epoch 1550. Best Metrics: (0.0033217996538360667, 0.0007957559681697614, 0.0021159185267470185)
2026-06-17 23:39:01,743 - optuna.study.study - INFO - Trial 102 finished with values: [0.0033217996538360667, 0.0007957559681697614, 0.0021159185267470185] and parameters: {'n_layers': 4, 'embedding_dim': 64, 'lr': 0.0006990102643278918, 'lambda_val': 0.002750666158846801, 'batch_size': 1884, 'optimizer': 'Adam'}.
2026-06-17 23:39:50,252 - experiment_functions - INFO - Early stopping at epoch 1000. Best Metrics: (0.0033293187294876703, 0.0007815460401667298, 0.0020125168416612153)
2026-06-17 23:39:50,333 - optuna.study.study - INFO - Trial 103 finished with values: [0.0033293187294876703, 0.0007815460401667298, 0.0020125168416612153] and parameters: {'n_layers': 4, 'embedding_dim': 128, 'lr': 0.0009043033415384808, 'lambda_val': 0.00224479684416678, 'batch_size': 2091, 'optimizer': 'Adam'}.
2026-06-17 23:40:24,860 - experiment_functions - INFO - Early stopping at epoch 750. Best Metrics: (0.0029401195024220945, 0.000731021851711507, 0.00195004245141797)
2026-06-17 23:40:25,942 - optuna.study.study - INFO - Trial 104 finished with values: [0.0029401195024220945, 0.000731021851711507, 0.00195004245141797] and parameters: {'n_layers': 4, 'embedding_dim': 64, 'lr': 0.0016963971500712442, 'lambda_val': 0.006986427337292849, 'batch_size': 1954, 'optimizer': 'Adam'}.
2026-06-17 23:40:51,317 - experiment_functions - INFO - Early stopping at epoch 550. Best Metrics: (0.0019041371513033173, 0.000546292787672098, 0.0012784016682546222)
