2026-06-21 17:24:28,990 - optuna.study.study - INFO - Trial 50 finished with values: [0.0037056797644636945, 0.0008904888215233045, 0.0022626258979770437] and parameters: {'n_layers': 2, 'embedding_dim': 32, 'lr': 0.009897459095274883, 'lambda_val': 0.0005711903431452187, 'batch_size': 3354, 'optimizer': 'RMSprop'}.
2026-06-21 17:24:55,105 - experiment_functions - INFO - Early stopping at epoch 550. Best Metrics: (0.004007650980687091, 0.000982063913098396, 0.0023533248214030566)
2026-06-21 17:24:55,185 - optuna.study.study - INFO - Trial 51 finished with values: [0.004007650980687091, 0.000982063913098396, 0.0023533248214030566] and parameters: {'n_layers': 3, 'embedding_dim': 96, 'lr': 0.06305209530719037, 'lambda_val': 0.00012818615016027372, 'batch_size': 3744, 'optimizer': 'Adam'}.
2026-06-21 17:27:33,521 - optuna.study.study - INFO - Trial 52 finished with values: [0.0018623851715903216, 0.0004199823165340407, 0.0011365442149592008] and parameters: {'n_layers': 1, 'embedding_dim': 64, 'lr': 0.0002479923805032418, 'lambda_val': 0.00012818615016027372, 'batch_size': 2511, 'optimizer': 'RMSprop'}.
2026-06-21 17:28:26,839 - experiment_functions - INFO - Early stopping at epoch 1300. Best Metrics: (0.005895703688425468, 0.0014304660856384994, 0.0035551200178346783)
2026-06-21 17:28:26,912 - optuna.study.study - INFO - Trial 53 finished with values: [0.005895703688425468, 0.0014304660856384994, 0.0035551200178346783] and parameters: {'n_layers': 2, 'embedding_dim': 32, 'lr': 0.0024374436987616007, 'lambda_val': 7.024518890460945e-05, 'batch_size': 2925, 'optimizer': 'Adam'}.
2026-06-21 17:28:56,675 - experiment_functions - INFO - Early stopping at epoch 700. Best Metrics: (0.0044992544572863115, 0.0011841606669192877, 0.0028470179199175548)
2026-06-21 17:28:56,757 - optuna.study.study - INFO - Trial 54 finished with values: [0.0044992544572863115, 0.0011841606669192877, 0.0028470179199175548] and parameters: {'n_layers': 2, 'embedding_dim': 32, 'lr': 0.008463855437471605, 'lambda_val': 1.5554041679084877e-06, 'batch_size': 2030, 'optimizer': 'RMSprop'}.
2026-06-21 17:29:28,521 - experiment_functions - INFO - Early stopping at epoch 700. Best Metrics: (0.006162618311857234, 0.001526777819881268, 0.0037148953767395655)
2026-06-21 17:29:28,609 - optuna.study.study - INFO - Trial 55 finished with values: [0.006162618311857234, 0.001526777819881268, 0.0037148953767395655] and parameters: {'n_layers': 2, 'embedding_dim': 96, 'lr': 0.0036608132255288727, 'lambda_val': 1.1896982541974421e-05, 'batch_size': 3442, 'optimizer': 'RMSprop'}.
2026-06-21 17:29:51,868 - experiment_functions - INFO - Early stopping at epoch 500. Best Metrics: (0.0005078674519567043, 0.00010894278135657448, 0.0002837718058421048)
2026-06-21 17:29:51,947 - optuna.study.study - INFO - Trial 56 finished with values: [0.0005078674519567043, 0.00010894278135657448, 0.0002837718058421048] and parameters: {'n_layers': 3, 'embedding_dim': 96, 'lr': 4.6250727983243267e-05, 'lambda_val': 1.1896982541974421e-05, 'batch_size': 1182, 'optimizer': 'SGD'}.
2026-06-21 17:30:17,671 - experiment_functions - INFO - Early stopping at epoch 600. Best Metrics: (0.002425906080330925, 0.0005920803334596438, 0.0015008096255396694)
2026-06-21 17:30:17,755 - optuna.study.study - INFO - Trial 57 finished with values: [0.002425906080330925, 0.0005920803334596438, 0.0015008096255396694] and parameters: {'n_layers': 1, 'embedding_dim': 32, 'lr': 0.0290685306103869, 'lambda_val': 6.131403610536352e-05, 'batch_size': 899, 'optimizer': 'Adam'}.
2026-06-21 17:32:21,009 - experiment_functions - INFO - Early stopping at epoch 3150. Best Metrics: (0.0006562908444319137, 0.00015315144625489458, 0.00038334508215257884)
2026-06-21 17:32:21,092 - optuna.study.study - INFO - Trial 58 finished with values: [0.0006562908444319137, 0.00015315144625489458, 0.00038334508215257884] and parameters: {'n_layers': 2, 'embedding_dim': 32, 'lr': 6.437099956643849e-05, 'lambda_val': 6.836240917371827e-05, 'batch_size': 2267, 'optimizer': 'RMSprop'}.
2026-06-21 17:32:46,607 - experiment_functions - INFO - Early stopping at epoch 550. Best Metrics: (0.005859762464199244, 0.001422571681192371, 0.003454422738881456)
2026-06-21 17:32:46,714 - optuna.study.study - INFO - Trial 59 finished with values: [0.005859762464199244, 0.001422571681192371, 0.003454422738881456] and parameters: {'n_layers': 4, 'embedding_dim': 64, 'lr': 0.008671930882000575, 'lambda_val': 7.980305062842105e-06, 'batch_size': 3741, 'optimizer': 'RMSprop'}.
2026-06-21 17:33:13,630 - experiment_functions - INFO - Early stopping at epoch 550. Best Metrics: (0.004811551923913991, 0.0011604774535809018, 0.0028278024161129817)
2026-06-21 17:33:13,722 - optuna.study.study - INFO - Trial 60 finished with values: [0.004811551923913991, 0.0011604774535809018, 0.0028278024161129817] and parameters: {'n_layers': 3, 'embedding_dim': 128, 'lr': 0.017533699109926436, 'lambda_val': 2.255504078550787e-05, 'batch_size': 3850, 'optimizer': 'RMSprop'}.
2026-06-21 17:34:23,745 - experiment_functions - INFO - Early stopping at epoch 1400. Best Metrics: (0.0049885024781544315, 0.0012283693318176079, 0.0028135553783564067)
2026-06-21 17:34:23,824 - optuna.study.study - INFO - Trial 61 finished with values: [0.0049885024781544315, 0.0012283693318176079, 0.0028135553783564067] and parameters: {'n_layers': 2, 'embedding_dim': 256, 'lr': 0.011765700859700308, 'lambda_val': 1.544427077132802e-06, 'batch_size': 3261, 'optimizer': 'Adam'}.
2026-06-21 17:34:46,242 - experiment_functions - INFO - Early stopping at epoch 500. Best Metrics: (0.0005128875647420573, 0.00011841606669192877, 0.0002720965838736574)
2026-06-21 17:34:46,354 - optuna.study.study - INFO - Trial 62 finished with values: [0.0005128875647420573, 0.00011841606669192877, 0.0002720965838736574] and parameters: {'n_layers': 3, 'embedding_dim': 32, 'lr': 0.0021939216054197965, 'lambda_val': 0.00023259479036557773, 'batch_size': 3390, 'optimizer': 'SGD'}.
2026-06-21 17:35:07,856 - experiment_functions - INFO - Early stopping at epoch 500. Best Metrics: (0.00037949599043724365, 0.00010104837691044589, 0.00023917062727477976)
2026-06-21 17:35:07,929 - optuna.study.study - INFO - Trial 63 finished with values: [0.00037949599043724365, 0.00010104837691044589, 0.00023917062727477976] and parameters: {'n_layers': 1, 'embedding_dim': 32, 'lr': 0.002027978137930353, 'lambda_val': 1.2163455344248657e-06, 'batch_size': 1895, 'optimizer': 'SGD'}.
2026-06-21 17:35:35,056 - experiment_functions - INFO - Early stopping at epoch 500. Best Metrics: (0.0004691322409406326, 0.00010104837691044589, 0.00026239635840085974)
2026-06-21 17:35:35,143 - optuna.study.study - INFO - Trial 64 finished with values: [0.0004691322409406326, 0.00010104837691044589, 0.00026239635840085974] and parameters: {'n_layers': 3, 'embedding_dim': 256, 'lr': 7.026868708982117e-05, 'lambda_val': 0.0011533048964205291, 'batch_size': 1772, 'optimizer': 'SGD'}.
2026-06-21 17:35:59,420 - experiment_functions - INFO - Early stopping at epoch 500. Best Metrics: (0.0005928679271585013, 0.0001294682329165088, 0.00031536012906393596)
2026-06-21 17:35:59,508 - optuna.study.study - INFO - Trial 65 finished with values: [0.0005928679271585013, 0.0001294682329165088, 0.00031536012906393596] and parameters: {'n_layers': 4, 'embedding_dim': 96, 'lr': 4.039318371588017e-05, 'lambda_val': 4.115695115987479e-06, 'batch_size': 1658, 'optimizer': 'SGD'}.
2026-06-21 17:36:21,281 - experiment_functions - INFO - Early stopping at epoch 500. Best Metrics: (0.0005490560304379942, 0.00011210054313502591, 0.00027783230406948876)
2026-06-21 17:36:21,354 - optuna.study.study - INFO - Trial 66 finished with values: [0.0005490560304379942, 0.00011210054313502591, 0.00027783230406948876] and parameters: {'n_layers': 1, 'embedding_dim': 64, 'lr': 0.008671930882000575, 'lambda_val': 7.980305062842105e-06, 'batch_size': 3741, 'optimizer': 'SGD'}.
2026-06-21 17:36:47,456 - experiment_functions - INFO - Early stopping at epoch 600. Best Metrics: (0.003120315107135819, 0.0007562839459391184, 0.0019164915680319073)
2026-06-21 17:36:47,545 - optuna.study.study - INFO - Trial 67 finished with values: [0.003120315107135819, 0.0007562839459391184, 0.0019164915680319073] and parameters: {'n_layers': 1, 'embedding_dim': 64, 'lr': 0.012463748703097797, 'lambda_val': 2.6999085606967302e-05, 'batch_size': 3682, 'optimizer': 'RMSprop'}.
2026-06-21 17:38:38,627 - experiment_functions - INFO - Early stopping at epoch 2400. Best Metrics: (0.0008083964079698492, 0.00016578249336870026, 0.000453508595970337)
2026-06-21 17:38:38,705 - optuna.study.study - INFO - Trial 68 finished with values: [0.0008083964079698492, 0.00016578249336870026, 0.000453508595970337] and parameters: {'n_layers': 4, 'embedding_dim': 128, 'lr': 3.7077736539999764e-05, 'lambda_val': 7.980305062842105e-06, 'batch_size': 3741, 'optimizer': 'RMSprop'}.
2026-06-21 17:39:02,855 - experiment_functions - INFO - Early stopping at epoch 500. Best Metrics: (0.0005825306781889149, 0.0001278893520272831, 0.000326652280688277)
2026-06-21 17:39:02,947 - optuna.study.study - INFO - Trial 69 finished with values: [0.0005825306781889149, 0.0001278893520272831, 0.000326652280688277] and parameters: {'n_layers': 3, 'embedding_dim': 128, 'lr': 4.6250727983243267e-05, 'lambda_val': 0.00012818615016027372, 'batch_size': 3685, 'optimizer': 'SGD'}.
2026-06-21 17:40:13,526 - experiment_functions - INFO - Early stopping at epoch 1500. Best Metrics: (0.0005841389034039066, 0.00013578375647341166, 0.0003251885168070249)
2026-06-21 17:40:13,613 - optuna.study.study - INFO - Trial 70 finished with values: [0.0005841389034039066, 0.00013578375647341166, 0.0003251885168070249] and parameters: {'n_layers': 4, 'embedding_dim': 128, 'lr': 3.069284247496904e-05, 'lambda_val': 4.973043963065176e-05, 'batch_size': 3579, 'optimizer': 'RMSprop'}.
2026-06-21 17:40:39,148 - experiment_functions - INFO - Early stopping at epoch 550. Best Metrics: (0.0037968526830135713, 0.0009346974864216244, 0.002458582379126968)
2026-06-21 17:40:39,235 - optuna.study.study - INFO - Trial 71 finished with values: [0.0037968526830135713, 0.0009346974864216244, 0.002458582379126968] and parameters: {'n_layers': 2, 'embedding_dim': 96, 'lr': 0.02167141401275961, 'lambda_val': 1.1896982541974421e-05, 'batch_size': 1816, 'optimizer': 'RMSprop'}.
2026-06-21 17:41:03,249 - experiment_functions - INFO - Early stopping at epoch 500. Best Metrics: (0.0005066290353177845, 0.00012473159024883163, 0.00031528212448018154)
2026-06-21 17:41:03,338 - optuna.study.study - INFO - Trial 72 finished with values: [0.0005066290353177845, 0.00012473159024883163, 0.00031528212448018154] and parameters: {'n_layers': 1, 'embedding_dim': 256, 'lr': 0.017533699109926436, 'lambda_val': 0.0016573995447523374, 'batch_size': 1913, 'optimizer': 'SGD'}.
2026-06-21 17:41:29,278 - experiment_functions - INFO - Early stopping at epoch 500. Best Metrics: (0.000508993567368271, 0.00013262599469496023, 0.00028737547301325886)
2026-06-21 17:41:29,363 - optuna.study.study - INFO - Trial 73 finished with values: [0.000508993567368271, 0.00013262599469496023, 0.00028737547301325886] and parameters: {'n_layers': 2, 'embedding_dim': 256, 'lr': 9.903879065297301e-05, 'lambda_val': 9.823026088675991e-05, 'batch_size': 3054, 'optimizer': 'SGD'}.
2026-06-21 17:42:04,901 - experiment_functions - INFO - Early stopping at epoch 800. Best Metrics: (0.006085422725327985, 0.001488884678539851, 0.0036282545612931114)
2026-06-21 17:42:04,979 - optuna.study.study - INFO - Trial 74 finished with values: [0.006085422725327985, 0.001488884678539851, 0.0036282545612931114] and parameters: {'n_layers': 2, 'embedding_dim': 96, 'lr': 0.0036608132255288727, 'lambda_val': 1.1896982541974421e-05, 'batch_size': 3442, 'optimizer': 'RMSprop'}.
2026-06-21 17:42:30,751 - experiment_functions - INFO - Early stopping at epoch 600. Best Metrics: (0.003423769810506534, 0.0007704938739421499, 0.002104859670026141)
2026-06-21 17:42:30,845 - optuna.study.study - INFO - Trial 75 finished with values: [0.003423769810506534, 0.0007704938739421499, 0.002104859670026141] and parameters: {'n_layers': 1, 'embedding_dim': 32, 'lr': 0.01334350907803016, 'lambda_val': 0.0001564043256822168, 'batch_size': 1988, 'optimizer': 'Adam'}.
2026-06-21 17:42:57,125 - experiment_functions - INFO - Early stopping at epoch 550. Best Metrics: (0.005788980812659734, 0.0014367816091954023, 0.003372746681220871)
2026-06-21 17:42:57,203 - optuna.study.study - INFO - Trial 76 finished with values: [0.005788980812659734, 0.0014367816091954023, 0.003372746681220871] and parameters: {'n_layers': 3, 'embedding_dim': 96, 'lr': 0.018991881603422755, 'lambda_val': 0.00040764482336836375, 'batch_size': 2987, 'optimizer': 'Adam'}.
2026-06-21 17:43:19,204 - experiment_functions - INFO - Early stopping at epoch 500. Best Metrics: (0.00044436043258746453, 0.00011367942402425163, 0.0002404891036233924)
2026-06-21 17:43:19,301 - optuna.study.study - INFO - Trial 77 finished with values: [0.00044436043258746453, 0.00011367942402425163, 0.0002404891036233924] and parameters: {'n_layers': 1, 'embedding_dim': 64, 'lr': 0.00029138284219269, 'lambda_val': 0.02396897300359349, 'batch_size': 1851, 'optimizer': 'SGD'}.
2026-06-21 17:43:42,764 - experiment_functions - INFO - Early stopping at epoch 500. Best Metrics: (0.0005664989840040896, 0.00011525830491347732, 0.00028821059284303536)
2026-06-21 17:43:42,860 - optuna.study.study - INFO - Trial 78 finished with values: [0.0005664989840040896, 0.00011525830491347732, 0.00028821059284303536] and parameters: {'n_layers': 3, 'embedding_dim': 96, 'lr': 0.013692285994849401, 'lambda_val': 0.011872925377459109, 'batch_size': 3261, 'optimizer': 'SGD'}.
2026-06-21 17:44:09,427 - experiment_functions - INFO - Early stopping at epoch 600. Best Metrics: (0.007140698486806283, 0.00182834406972338, 0.0043571584881351)
2026-06-21 17:44:09,516 - optuna.study.study - INFO - Trial 79 finished with values: [0.007140698486806283, 0.00182834406972338, 0.0043571584881351] and parameters: {'n_layers': 4, 'embedding_dim': 32, 'lr': 0.008463855437471605, 'lambda_val': 7.635658041119374e-05, 'batch_size': 3469, 'optimizer': 'Adam'}.
2026-06-21 17:44:33,856 - experiment_functions - INFO - Early stopping at epoch 500. Best Metrics: (0.0005098532652492623, 0.00010420613868889732, 0.0002443846400949563)
2026-06-21 17:44:33,948 - optuna.study.study - INFO - Trial 80 finished with values: [0.0005098532652492623, 0.00010420613868889732, 0.0002443846400949563] and parameters: {'n_layers': 1, 'embedding_dim': 256, 'lr': 0.024884265697761216, 'lambda_val': 0.0004796254286547762, 'batch_size': 1772, 'optimizer': 'SGD'}.
2026-06-21 17:45:01,224 - experiment_functions - INFO - Early stopping at epoch 600. Best Metrics: (0.003229882248495708, 0.0007941770872805357, 0.002012232270338309)
2026-06-21 17:45:01,310 - optuna.study.study - INFO - Trial 81 finished with values: [0.003229882248495708, 0.0007941770872805357, 0.002012232270338309] and parameters: {'n_layers': 2, 'embedding_dim': 96, 'lr': 0.06305209530719037, 'lambda_val': 0.00012818615016027372, 'batch_size': 1095, 'optimizer': 'Adam'}.
2026-06-21 17:45:33,877 - experiment_functions - INFO - Early stopping at epoch 750. Best Metrics: (0.009573246001505603, 0.002335164835164835, 0.005666969823887062)
2026-06-21 17:45:33,952 - optuna.study.study - INFO - Trial 82 finished with values: [0.009573246001505603, 0.002335164835164835, 0.005666969823887062] and parameters: {'n_layers': 4, 'embedding_dim': 32, 'lr': 0.00264461364827089, 'lambda_val': 0.0009730028095032008, 'batch_size': 2374, 'optimizer': 'Adam'}.
2026-06-21 17:48:32,229 - optuna.study.study - INFO - Trial 83 finished with values: [0.0008234102983182776, 0.00019578123026398888, 0.0005069416886894116] and parameters: {'n_layers': 1, 'embedding_dim': 256, 'lr': 9.474798234014122e-05, 'lambda_val': 5.223651777196328e-06, 'batch_size': 2310, 'optimizer': 'RMSprop'}.
2026-06-21 17:48:58,156 - experiment_functions - INFO - Early stopping at epoch 600. Best Metrics: (0.0030415109258770624, 0.000680497663256284, 0.0017929955509067641)
2026-06-21 17:48:58,261 - optuna.study.study - INFO - Trial 84 finished with values: [0.0030415109258770624, 0.000680497663256284, 0.0017929955509067641] and parameters: {'n_layers': 1, 'embedding_dim': 32, 'lr': 0.018991881603422755, 'lambda_val': 2.2511892513467577e-06, 'batch_size': 2987, 'optimizer': 'Adam'}.
2026-06-21 17:50:03,328 - experiment_functions - INFO - Early stopping at epoch 1600. Best Metrics: (0.007859474052585148, 0.0019214980421876976, 0.004982259221390315)
2026-06-21 17:50:03,409 - optuna.study.study - INFO - Trial 85 finished with values: [0.007859474052585148, 0.0019214980421876976, 0.004982259221390315] and parameters: {'n_layers': 2, 'embedding_dim': 32, 'lr': 0.0015158687633618723, 'lambda_val': 6.702534509469782e-06, 'batch_size': 2925, 'optimizer': 'RMSprop'}.
2026-06-21 17:50:35,753 - experiment_functions - INFO - Early stopping at epoch 550. Best Metrics: (0.0005925375121671592, 0.00013420487558418593, 0.00030162796078058167)
2026-06-21 17:50:35,847 - optuna.study.study - INFO - Trial 86 finished with values: [0.0005925375121671592, 0.00013420487558418593, 0.00030162796078058167] and parameters: {'n_layers': 4, 'embedding_dim': 256, 'lr': 3.069284247496904e-05, 'lambda_val': 0.011680121336184224, 'batch_size': 3579, 'optimizer': 'RMSprop'}.
2026-06-21 17:51:15,253 - experiment_functions - INFO - Early stopping at epoch 900. Best Metrics: (0.0035598331732839515, 0.0008968043450802071, 0.0019861198129415554)
2026-06-21 17:51:16,046 - optuna.study.study - INFO - Trial 87 finished with values: [0.0035598331732839515, 0.0008968043450802071, 0.0019861198129415554] and parameters: {'n_layers': 1, 'embedding_dim': 128, 'lr': 0.00972956944940345, 'lambda_val': 0.011680121336184224, 'batch_size': 3579, 'optimizer': 'RMSprop'}.
2026-06-21 17:51:37,863 - experiment_functions - INFO - Early stopping at epoch 500. Best Metrics: (0.0006265900877208506, 0.00014525704180876593, 0.00038771663694412204)
2026-06-21 17:51:37,966 - optuna.study.study - INFO - Trial 88 finished with values: [0.0006265900877208506, 0.00014525704180876593, 0.00038771663694412204] and parameters: {'n_layers': 2, 'embedding_dim': 32, 'lr': 0.056762004516803785, 'lambda_val': 0.0005711903431452187, 'batch_size': 3823, 'optimizer': 'SGD'}.
2026-06-21 17:52:06,148 - experiment_functions - INFO - Early stopping at epoch 650. Best Metrics: (0.0028027442323828506, 0.000724706328154604, 0.001841855779214429)
2026-06-21 17:52:06,224 - optuna.study.study - INFO - Trial 89 finished with values: [0.0028027442323828506, 0.000724706328154604, 0.001841855779214429] and parameters: {'n_layers': 1, 'embedding_dim': 64, 'lr': 0.017533699109926436, 'lambda_val': 6.131403610536352e-05, 'batch_size': 1215, 'optimizer': 'RMSprop'}.
2026-06-21 17:52:49,574 - experiment_functions - INFO - Early stopping at epoch 750. Best Metrics: (0.0025329964272860833, 0.0006504989263609953, 0.0015150491005974018)
2026-06-21 17:52:49,664 - optuna.study.study - INFO - Trial 90 finished with values: [0.0025329964272860833, 0.0006504989263609953, 0.0015150491005974018] and parameters: {'n_layers': 4, 'embedding_dim': 256, 'lr': 0.0761142953819498, 'lambda_val': 0.0009730028095032008, 'batch_size': 3122, 'optimizer': 'Adam'}.
2026-06-21 17:53:11,664 - experiment_functions - INFO - Early stopping at epoch 500. Best Metrics: (0.0006034589785504709, 0.00013578375647341166, 0.00032937263760042887)
2026-06-21 17:53:11,759 - optuna.study.study - INFO - Trial 91 finished with values: [0.0006034589785504709, 0.00013578375647341166, 0.00032937263760042887] and parameters: {'n_layers': 2, 'embedding_dim': 32, 'lr': 0.009897459095274883, 'lambda_val': 0.0070365418833074735, 'batch_size': 3354, 'optimizer': 'SGD'}.
2026-06-21 17:53:35,479 - experiment_functions - INFO - Early stopping at epoch 500. Best Metrics: (0.0005314986161930263, 0.0001121005431350259, 0.00027074146185533416)
2026-06-21 17:53:35,560 - optuna.study.study - INFO - Trial 92 finished with values: [0.0005314986161930263, 0.0001121005431350259, 0.00027074146185533416] and parameters: {'n_layers': 3, 'embedding_dim': 96, 'lr': 0.024884265697761216, 'lambda_val': 0.0006100550334792186, 'batch_size': 3119, 'optimizer': 'SGD'}.
2026-06-21 17:53:58,835 - experiment_functions - INFO - Early stopping at epoch 500. Best Metrics: (0.0004947315668113114, 0.00011052166224580018, 0.00026595052097249674)
2026-06-21 17:53:58,920 - optuna.study.study - INFO - Trial 93 finished with values: [0.0004947315668113114, 0.00011052166224580018, 0.00026595052097249674] and parameters: {'n_layers': 3, 'embedding_dim': 96, 'lr': 4.6250727983243267e-05, 'lambda_val': 0.04601375549537307, 'batch_size': 1876, 'optimizer': 'SGD'}.
2026-06-21 17:54:27,284 - experiment_functions - INFO - Early stopping at epoch 550. Best Metrics: (0.006502049658235784, 0.0016751926234684857, 0.0038813904696907778)
2026-06-21 17:54:27,370 - optuna.study.study - INFO - Trial 94 finished with values: [0.006502049658235784, 0.0016751926234684857, 0.0038813904696907778] and parameters: {'n_layers': 4, 'embedding_dim': 96, 'lr': 0.013692285994849401, 'lambda_val': 1.544427077132802e-06, 'batch_size': 3261, 'optimizer': 'Adam'}.
2026-06-21 17:57:05,589 - optuna.study.study - INFO - Trial 95 finished with values: [0.0028997224984935186, 0.0006394467601364153, 0.0018769821454797074] and parameters: {'n_layers': 1, 'embedding_dim': 64, 'lr': 0.00040907011562690387, 'lambda_val': 1.6534153206465487e-05, 'batch_size': 1789, 'optimizer': 'Adam'}.
2026-06-21 17:58:34,232 - experiment_functions - INFO - Early stopping at epoch 2250. Best Metrics: (0.0005850454330378656, 0.0001310471138057345, 0.00029978892189564337)
