2026-06-21 16:43:19,833 - optuna.study.study - INFO - Trial 3 finished with values: [0.0005885127369314288, 0.0001278893520272831, 0.00030017331630213464] and parameters: {'n_layers': 2, 'embedding_dim': 256, 'lr': 0.014719610139994066, 'lambda_val': 0.0004796254286547762, 'batch_size': 3709, 'optimizer': 'SGD'}.
2026-06-21 16:44:25,309 - experiment_functions - INFO - Early stopping at epoch 1600. Best Metrics: (0.006802858414301058, 0.0017920298092711888, 0.004314130146041235)
2026-06-21 16:44:25,391 - optuna.study.study - INFO - Trial 4 finished with values: [0.006802858414301058, 0.0017920298092711888, 0.004314130146041235] and parameters: {'n_layers': 2, 'embedding_dim': 32, 'lr': 0.0015158687633618723, 'lambda_val': 7.024518890460945e-05, 'batch_size': 2925, 'optimizer': 'RMSprop'}.
2026-06-21 16:47:25,527 - optuna.study.study - INFO - Trial 5 finished with values: [0.0017151265685606874, 0.00036314260452191484, 0.000977470882924803] and parameters: {'n_layers': 1, 'embedding_dim': 256, 'lr': 0.0002919055044986262, 'lambda_val': 0.0012707964435634076, 'batch_size': 1129, 'optimizer': 'RMSprop'}.
2026-06-21 16:47:47,675 - experiment_functions - INFO - Early stopping at epoch 500. Best Metrics: (0.0005588959595472563, 0.0001278893520272831, 0.00030627703758267453)
2026-06-21 16:47:47,765 - optuna.study.study - INFO - Trial 6 finished with values: [0.0005588959595472563, 0.0001278893520272831, 0.00030627703758267453] and parameters: {'n_layers': 2, 'embedding_dim': 32, 'lr': 0.056762004516803785, 'lambda_val': 0.0005711903431452187, 'batch_size': 3823, 'optimizer': 'SGD'}.
2026-06-21 16:48:10,226 - experiment_functions - INFO - Early stopping at epoch 500. Best Metrics: (0.0005118936868552461, 0.00010420613868889732, 0.0002798884003775979)
2026-06-21 16:48:10,318 - optuna.study.study - INFO - Trial 7 finished with values: [0.0005118936868552461, 0.00010420613868889732, 0.0002798884003775979] and parameters: {'n_layers': 2, 'embedding_dim': 64, 'lr': 0.0004925378782644333, 'lambda_val': 1.2899791982755664e-06, 'batch_size': 3139, 'optimizer': 'SGD'}.
2026-06-21 16:48:40,340 - experiment_functions - INFO - Early stopping at epoch 700. Best Metrics: (0.0005461906614253368, 0.00011999494758115447, 0.00030354398359146097)
2026-06-21 16:48:40,500 - optuna.study.study - INFO - Trial 8 finished with values: [0.0005461906614253368, 0.00011999494758115447, 0.00030354398359146097] and parameters: {'n_layers': 1, 'embedding_dim': 64, 'lr': 1.825226066439967e-05, 'lambda_val': 5.223651777196328e-06, 'batch_size': 3067, 'optimizer': 'RMSprop'}.
2026-06-21 16:49:30,399 - experiment_functions - INFO - Early stopping at epoch 950. Best Metrics: (0.0005999255929105082, 0.0001310471138057345, 0.00033293725800208134)
2026-06-21 16:49:30,485 - optuna.study.study - INFO - Trial 9 finished with values: [0.0005999255929105082, 0.0001310471138057345, 0.00033293725800208134] and parameters: {'n_layers': 3, 'embedding_dim': 256, 'lr': 0.00619225458955416, 'lambda_val': 0.00587287627268423, 'batch_size': 3296, 'optimizer': 'SGD'}.
2026-06-21 16:49:54,921 - experiment_functions - INFO - Early stopping at epoch 500. Best Metrics: (0.0004945024454859661, 0.0001121005431350259, 0.0002726262131441528)
2026-06-21 16:49:55,023 - optuna.study.study - INFO - Trial 10 finished with values: [0.0004945024454859661, 0.0001121005431350259, 0.0002726262131441528] and parameters: {'n_layers': 1, 'embedding_dim': 256, 'lr': 0.007896229598947941, 'lambda_val': 1.864764422246567e-06, 'batch_size': 2320, 'optimizer': 'SGD'}.
2026-06-21 16:50:20,686 - experiment_functions - INFO - Early stopping at epoch 550. Best Metrics: (0.0033464381685281396, 0.0008604900846280156, 0.0021609532719244692)
2026-06-21 16:50:20,777 - optuna.study.study - INFO - Trial 11 finished with values: [0.0033464381685281396, 0.0008604900846280156, 0.0021609532719244692] and parameters: {'n_layers': 2, 'embedding_dim': 96, 'lr': 0.06305209530719037, 'lambda_val': 0.00012818615016027372, 'batch_size': 1095, 'optimizer': 'Adam'}.
2026-06-21 16:50:48,348 - experiment_functions - INFO - Early stopping at epoch 500. Best Metrics: (0.0006634929173494556, 0.00015630920803334596, 0.0004198602643604625)
2026-06-21 16:50:48,451 - optuna.study.study - INFO - Trial 12 finished with values: [0.0006634929173494556, 0.00015630920803334596, 0.0004198602643604625] and parameters: {'n_layers': 3, 'embedding_dim': 256, 'lr': 0.024884265697761216, 'lambda_val': 0.0006100550334792186, 'batch_size': 1772, 'optimizer': 'SGD'}.
2026-06-21 16:51:14,035 - experiment_functions - INFO - Early stopping at epoch 550. Best Metrics: (0.005445207976956609, 0.0014146772767462425, 0.0034140248713447493)
2026-06-21 16:51:14,131 - optuna.study.study - INFO - Trial 13 finished with values: [0.005445207976956609, 0.0014146772767462425, 0.0034140248713447493] and parameters: {'n_layers': 3, 'embedding_dim': 64, 'lr': 0.013729352177423387, 'lambda_val': 0.0005803217930206673, 'batch_size': 3744, 'optimizer': 'Adam'}.
2026-06-21 16:51:40,777 - experiment_functions - INFO - Early stopping at epoch 600. Best Metrics: (0.0055035383735408195, 0.001370468611847922, 0.0032998521408984793)
2026-06-21 16:51:40,874 - optuna.study.study - INFO - Trial 14 finished with values: [0.0055035383735408195, 0.001370468611847922, 0.0032998521408984793] and parameters: {'n_layers': 3, 'embedding_dim': 32, 'lr': 0.018991881603422755, 'lambda_val': 2.2511892513467577e-06, 'batch_size': 2987, 'optimizer': 'Adam'}.
2026-06-21 16:52:12,358 - experiment_functions - INFO - Early stopping at epoch 700. Best Metrics: (0.0022782999980236565, 0.0006283945939118354, 0.001393424830857415)
2026-06-21 16:52:12,454 - optuna.study.study - INFO - Trial 15 finished with values: [0.0022782999980236565, 0.0006283945939118354, 0.001393424830857415] and parameters: {'n_layers': 2, 'embedding_dim': 96, 'lr': 0.013692285994849401, 'lambda_val': 0.08422070332443249, 'batch_size': 3261, 'optimizer': 'Adam'}.
2026-06-21 16:53:23,630 - experiment_functions - INFO - Early stopping at epoch 1800. Best Metrics: (0.0004978475914465462, 0.00010578501957812304, 0.0002850876000637582)
2026-06-21 16:53:23,746 - optuna.study.study - INFO - Trial 16 finished with values: [0.0004978475914465462, 0.00010578501957812304, 0.0002850876000637582] and parameters: {'n_layers': 1, 'embedding_dim': 32, 'lr': 2.1604417466155715e-05, 'lambda_val': 0.0006394622599562037, 'batch_size': 2463, 'optimizer': 'Adam'}.
2026-06-21 16:53:50,221 - experiment_functions - INFO - Early stopping at epoch 600. Best Metrics: (0.003959340917928279, 0.0009725906277630416, 0.0023984646110044258)
2026-06-21 16:53:50,307 - optuna.study.study - INFO - Trial 17 finished with values: [0.003959340917928279, 0.0009725906277630416, 0.0023984646110044258] and parameters: {'n_layers': 2, 'embedding_dim': 64, 'lr': 0.012463748703097797, 'lambda_val': 2.6999085606967302e-05, 'batch_size': 3682, 'optimizer': 'RMSprop'}.
2026-06-21 16:56:35,918 - optuna.study.study - INFO - Trial 18 finished with values: [0.003409672309569559, 0.0007420740179360869, 0.0019867006138470943] and parameters: {'n_layers': 1, 'embedding_dim': 128, 'lr': 0.0006520158537207684, 'lambda_val': 6.131403610536352e-05, 'batch_size': 899, 'optimizer': 'Adam'}.
2026-06-21 16:56:57,883 - experiment_functions - INFO - Early stopping at epoch 500. Best Metrics: (0.0004974421379666701, 0.00012315270935960593, 0.0003161059384274661)
2026-06-21 16:56:57,971 - optuna.study.study - INFO - Trial 19 finished with values: [0.0004974421379666701, 0.00012315270935960593, 0.0003161059384274661] and parameters: {'n_layers': 1, 'embedding_dim': 64, 'lr': 1.4482751736805513e-05, 'lambda_val': 0.02396897300359349, 'batch_size': 1851, 'optimizer': 'SGD'}.
2026-06-21 16:57:21,257 - experiment_functions - INFO - Early stopping at epoch 500. Best Metrics: (0.0005664989840040896, 0.00011525830491347732, 0.00028821059284303536)
2026-06-21 16:57:21,342 - optuna.study.study - INFO - Trial 20 finished with values: [0.0005664989840040896, 0.00011525830491347732, 0.00028821059284303536] and parameters: {'n_layers': 3, 'embedding_dim': 96, 'lr': 0.0010011812960440446, 'lambda_val': 2.590562828813741e-06, 'batch_size': 2003, 'optimizer': 'SGD'}.
2026-06-21 16:57:43,472 - experiment_functions - INFO - Early stopping at epoch 500. Best Metrics: (0.0006588637515706506, 0.00013262599469496023, 0.0003511269540620805)
2026-06-21 16:57:43,567 - optuna.study.study - INFO - Trial 21 finished with values: [0.0006588637515706506, 0.00013262599469496023, 0.0003511269540620805] and parameters: {'n_layers': 2, 'embedding_dim': 32, 'lr': 0.008463855437471605, 'lambda_val': 1.5554041679084877e-06, 'batch_size': 2030, 'optimizer': 'SGD'}.
2026-06-21 16:58:16,700 - experiment_functions - INFO - Early stopping at epoch 750. Best Metrics: (0.0029190993164004554, 0.0007499684223822155, 0.0016471672604444962)
2026-06-21 16:58:16,785 - optuna.study.study - INFO - Trial 22 finished with values: [0.0029190993164004554, 0.0007499684223822155, 0.0016471672604444962] and parameters: {'n_layers': 1, 'embedding_dim': 128, 'lr': 0.00972956944940345, 'lambda_val': 0.053349751422857444, 'batch_size': 2310, 'optimizer': 'RMSprop'}.
2026-06-21 16:58:42,346 - experiment_functions - INFO - Early stopping at epoch 500. Best Metrics: (0.00046590558917988594, 0.00010578501957812304, 0.000285243813365555)
2026-06-21 16:58:42,423 - optuna.study.study - INFO - Trial 23 finished with values: [0.00046590558917988594, 0.00010578501957812304, 0.000285243813365555] and parameters: {'n_layers': 2, 'embedding_dim': 256, 'lr': 0.003116589011799872, 'lambda_val': 0.00012558815786422865, 'batch_size': 2522, 'optimizer': 'SGD'}.
2026-06-21 16:59:06,605 - experiment_functions - INFO - Early stopping at epoch 550. Best Metrics: (0.003547419794119588, 0.0009378552482000758, 0.002190003565248695)
2026-06-21 16:59:06,702 - optuna.study.study - INFO - Trial 24 finished with values: [0.003547419794119588, 0.0009378552482000758, 0.002190003565248695] and parameters: {'n_layers': 4, 'embedding_dim': 32, 'lr': 0.05237459070579243, 'lambda_val': 0.0009730028095032008, 'batch_size': 1828, 'optimizer': 'Adam'}.
2026-06-21 16:59:37,995 - experiment_functions - INFO - Early stopping at epoch 700. Best Metrics: (0.006243825388720995, 0.0015678287230011367, 0.0038627957074800203)
2026-06-21 16:59:38,078 - optuna.study.study - INFO - Trial 25 finished with values: [0.006243825388720995, 0.0015678287230011367, 0.0038627957074800203] and parameters: {'n_layers': 2, 'embedding_dim': 96, 'lr': 0.0036608132255288727, 'lambda_val': 1.1896982541974421e-05, 'batch_size': 3442, 'optimizer': 'RMSprop'}.
2026-06-21 16:59:59,782 - experiment_functions - INFO - Early stopping at epoch 500. Best Metrics: (0.00048530278089287576, 0.00011052166224580018, 0.0002624302478899623)
2026-06-21 16:59:59,878 - optuna.study.study - INFO - Trial 26 finished with values: [0.00048530278089287576, 0.00011052166224580018, 0.0002624302478899623] and parameters: {'n_layers': 2, 'embedding_dim': 32, 'lr': 0.00264461364827089, 'lambda_val': 0.053142644053770144, 'batch_size': 2374, 'optimizer': 'SGD'}.
2026-06-21 17:02:01,538 - experiment_functions - INFO - Early stopping at epoch 2750. Best Metrics: (0.0006818997020456239, 0.0001405203991410888, 0.00035199573005476867)
2026-06-21 17:02:01,614 - optuna.study.study - INFO - Trial 27 finished with values: [0.0006818997020456239, 0.0001405203991410888, 0.00035199573005476867] and parameters: {'n_layers': 3, 'embedding_dim': 128, 'lr': 1.2542248287129105e-05, 'lambda_val': 0.011872925377459109, 'batch_size': 3861, 'optimizer': 'RMSprop'}.
2026-06-21 17:04:37,584 - optuna.study.study - INFO - Trial 28 finished with values: [0.004298754904597216, 0.0009125931539724643, 0.002521800312813486] and parameters: {'n_layers': 1, 'embedding_dim': 32, 'lr': 0.0009312796651119834, 'lambda_val': 1.6534153206465487e-05, 'batch_size': 1376, 'optimizer': 'Adam'}.
2026-06-21 17:04:59,580 - experiment_functions - INFO - Early stopping at epoch 500. Best Metrics: (0.0006948915708126658, 0.0001484148035872174, 0.00039224214717281485)
2026-06-21 17:04:59,668 - optuna.study.study - INFO - Trial 29 finished with values: [0.0006948915708126658, 0.0001484148035872174, 0.00039224214717281485] and parameters: {'n_layers': 1, 'embedding_dim': 64, 'lr': 0.0005998049341257391, 'lambda_val': 0.00021324285602600436, 'batch_size': 3559, 'optimizer': 'SGD'}.
2026-06-21 17:07:37,594 - optuna.study.study - INFO - Trial 30 finished with values: [0.0006513107338656354, 0.0001515725653656688, 0.0003523486177496125] and parameters: {'n_layers': 2, 'embedding_dim': 32, 'lr': 6.437099956643849e-05, 'lambda_val': 6.836240917371827e-05, 'batch_size': 2267, 'optimizer': 'Adam'}.
2026-06-21 17:08:10,575 - experiment_functions - INFO - Early stopping at epoch 550. Best Metrics: (0.006302100844125703, 0.0016136162687886827, 0.003610034852353673)
2026-06-21 17:08:10,662 - optuna.study.study - INFO - Trial 31 finished with values: [0.006302100844125703, 0.0016136162687886827, 0.003610034852353673] and parameters: {'n_layers': 4, 'embedding_dim': 256, 'lr': 0.011765700859700308, 'lambda_val': 1.544427077132802e-06, 'batch_size': 3122, 'optimizer': 'Adam'}.
2026-06-21 17:08:34,404 - experiment_functions - INFO - Early stopping at epoch 500. Best Metrics: (0.0006105753768428359, 0.0001294682329165088, 0.00032754999213716914)
2026-06-21 17:08:34,492 - optuna.study.study - INFO - Trial 32 finished with values: [0.0006105753768428359, 0.0001294682329165088, 0.00032754999213716914] and parameters: {'n_layers': 3, 'embedding_dim': 96, 'lr': 4.6250727983243267e-05, 'lambda_val': 3.626867765054032e-06, 'batch_size': 1182, 'optimizer': 'SGD'}.
2026-06-21 17:08:56,999 - experiment_functions - INFO - Early stopping at epoch 500. Best Metrics: (0.0005680722012779676, 0.00011367942402425163, 0.0002791730366951713)
2026-06-21 17:08:57,090 - optuna.study.study - INFO - Trial 33 finished with values: [0.0005680722012779676, 0.00011367942402425163, 0.0002791730366951713] and parameters: {'n_layers': 1, 'embedding_dim': 96, 'lr': 0.011671114974103253, 'lambda_val': 0.001087761497773429, 'batch_size': 3095, 'optimizer': 'SGD'}.
2026-06-21 17:09:24,796 - experiment_functions - INFO - Early stopping at epoch 500. Best Metrics: (0.00048332334406415094, 0.00010262725779967159, 0.00027681472555647814)
2026-06-21 17:09:24,884 - optuna.study.study - INFO - Trial 34 finished with values: [0.00048332334406415094, 0.00010262725779967159, 0.00027681472555647814] and parameters: {'n_layers': 3, 'embedding_dim': 256, 'lr': 0.0021939216054197965, 'lambda_val': 1.6935364337944473e-06, 'batch_size': 3390, 'optimizer': 'SGD'}.
2026-06-21 17:10:49,723 - experiment_functions - INFO - Early stopping at epoch 1900. Best Metrics: (0.0005408981987008145, 0.00011999494758115447, 0.00030151105916374326)
2026-06-21 17:10:49,813 - optuna.study.study - INFO - Trial 35 finished with values: [0.0005408981987008145, 0.00011999494758115447, 0.00030151105916374326] and parameters: {'n_layers': 2, 'embedding_dim': 128, 'lr': 3.069284247496904e-05, 'lambda_val': 0.011680121336184224, 'batch_size': 3579, 'optimizer': 'RMSprop'}.
2026-06-21 17:11:12,071 - experiment_functions - INFO - Early stopping at epoch 500. Best Metrics: (0.0005550855492137488, 0.00012315270935960593, 0.0002917722103989003)
2026-06-21 17:11:12,162 - optuna.study.study - INFO - Trial 36 finished with values: [0.0005550855492137488, 0.00012315270935960593, 0.0002917722103989003] and parameters: {'n_layers': 2, 'embedding_dim': 32, 'lr': 0.00020793697901220912, 'lambda_val': 1.2442983339017008e-06, 'batch_size': 1843, 'optimizer': 'SGD'}.
2026-06-21 17:11:36,028 - experiment_functions - INFO - Early stopping at epoch 500. Best Metrics: (0.0006333281737817524, 0.0001389415182518631, 0.0003646419926213594)
2026-06-21 17:11:36,130 - optuna.study.study - INFO - Trial 37 finished with values: [0.0006333281737817524, 0.0001389415182518631, 0.0003646419926213594] and parameters: {'n_layers': 3, 'embedding_dim': 96, 'lr': 0.008086617943127974, 'lambda_val': 4.6612826871365884e-06, 'batch_size': 679, 'optimizer': 'SGD'}.
2026-06-21 17:14:37,162 - optuna.study.study - INFO - Trial 38 finished with values: [0.0007372164258138993, 0.0001578880889225717, 0.0004128665156299136] and parameters: {'n_layers': 3, 'embedding_dim': 128, 'lr': 5.455625958264269e-05, 'lambda_val': 6.702534509469782e-06, 'batch_size': 3752, 'optimizer': 'RMSprop'}.
2026-06-21 17:14:59,926 - experiment_functions - INFO - Early stopping at epoch 500. Best Metrics: (0.0004498508046169777, 0.00011052166224580017, 0.0002334503037397111)
2026-06-21 17:15:00,019 - optuna.study.study - INFO - Trial 39 finished with values: [0.0004498508046169777, 0.00011052166224580017, 0.0002334503037397111] and parameters: {'n_layers': 2, 'embedding_dim': 32, 'lr': 0.0003424085650869649, 'lambda_val': 8.159747509392686e-06, 'batch_size': 2014, 'optimizer': 'SGD'}.
2026-06-21 17:15:28,709 - experiment_functions - INFO - Early stopping at epoch 650. Best Metrics: (0.0028442081092949893, 0.0007215485663761526, 0.0018879089205294697)
2026-06-21 17:15:28,798 - optuna.study.study - INFO - Trial 40 finished with values: [0.0028442081092949893, 0.0007215485663761526, 0.0018879089205294697] and parameters: {'n_layers': 1, 'embedding_dim': 64, 'lr': 0.017533699109926436, 'lambda_val': 2.255504078550787e-05, 'batch_size': 1993, 'optimizer': 'RMSprop'}.
2026-06-21 17:16:49,516 - experiment_functions - INFO - Early stopping at epoch 1900. Best Metrics: (0.0030522819187244047, 0.0007657572312744726, 0.001787602627974534)
2026-06-21 17:16:49,607 - optuna.study.study - INFO - Trial 41 finished with values: [0.0030522819187244047, 0.0007657572312744726, 0.001787602627974534] and parameters: {'n_layers': 1, 'embedding_dim': 96, 'lr': 0.0290685306103869, 'lambda_val': 0.04601375549537307, 'batch_size': 1876, 'optimizer': 'Adam'}.
2026-06-21 17:17:22,432 - experiment_functions - INFO - Early stopping at epoch 650. Best Metrics: (0.0006618585317932584, 0.0001405203991410888, 0.0003464397062164624)
2026-06-21 17:17:22,514 - optuna.study.study - INFO - Trial 42 finished with values: [0.0006618585317932584, 0.0001405203991410888, 0.0003464397062164624] and parameters: {'n_layers': 4, 'embedding_dim': 128, 'lr': 3.7077736539999764e-05, 'lambda_val': 6.610442661260112e-05, 'batch_size': 1741, 'optimizer': 'Adam'}.
2026-06-21 17:18:12,589 - experiment_functions - INFO - Early stopping at epoch 1100. Best Metrics: (0.010601238543873567, 0.0026367310850069475, 0.006382819534966027)
2026-06-21 17:18:12,676 - optuna.study.study - INFO - Trial 43 finished with values: [0.010601238543873567, 0.0026367310850069475, 0.006382819534966027] and parameters: {'n_layers': 4, 'embedding_dim': 64, 'lr': 0.00168887528029852, 'lambda_val': 0.0004098288354602192, 'batch_size': 1157, 'optimizer': 'Adam'}.
2026-06-21 17:19:02,058 - experiment_functions - INFO - Early stopping at epoch 1150. Best Metrics: (0.0005364807279801142, 0.00011841606669192878, 0.00026607086345395567)
2026-06-21 17:19:02,131 - optuna.study.study - INFO - Trial 44 finished with values: [0.0005364807279801142, 0.00011841606669192878, 0.00026607086345395567] and parameters: {'n_layers': 4, 'embedding_dim': 32, 'lr': 1.681958185819029e-05, 'lambda_val': 0.005125411919429349, 'batch_size': 641, 'optimizer': 'RMSprop'}.
2026-06-21 17:19:24,373 - experiment_functions - INFO - Early stopping at epoch 500. Best Metrics: (0.0004853386337765655, 0.00010578501957812304, 0.00024930488678998264)
2026-06-21 17:19:24,457 - optuna.study.study - INFO - Trial 45 finished with values: [0.0004853386337765655, 0.00010578501957812304, 0.00024930488678998264] and parameters: {'n_layers': 3, 'embedding_dim': 32, 'lr': 0.002027978137930353, 'lambda_val': 1.2163455344248657e-06, 'batch_size': 1895, 'optimizer': 'SGD'}.
2026-06-21 17:19:50,168 - experiment_functions - INFO - Early stopping at epoch 500. Best Metrics: (0.0004691322409406326, 0.00010104837691044589, 0.00026239635840085974)
2026-06-21 17:19:50,260 - optuna.study.study - INFO - Trial 46 finished with values: [0.0004691322409406326, 0.00010104837691044589, 0.00026239635840085974] and parameters: {'n_layers': 2, 'embedding_dim': 256, 'lr': 0.0010384421564910236, 'lambda_val': 0.00014855356409154054, 'batch_size': 3776, 'optimizer': 'SGD'}.
2026-06-21 17:20:13,470 - experiment_functions - INFO - Early stopping at epoch 500. Best Metrics: (0.0006835241388805135, 0.00013578375647341163, 0.0003309580111073745)
2026-06-21 17:20:13,560 - optuna.study.study - INFO - Trial 47 finished with values: [0.0006835241388805135, 0.00013578375647341163, 0.0003309580111073745] and parameters: {'n_layers': 2, 'embedding_dim': 96, 'lr': 0.009897459095274883, 'lambda_val': 0.0070365418833074735, 'batch_size': 3354, 'optimizer': 'SGD'}.
2026-06-21 17:20:39,526 - experiment_functions - INFO - Early stopping at epoch 600. Best Metrics: (0.0039717454657447115, 0.000986800555766073, 0.0023581559312453124)
2026-06-21 17:20:39,607 - optuna.study.study - INFO - Trial 48 finished with values: [0.0039717454657447115, 0.000986800555766073, 0.0023581559312453124] and parameters: {'n_layers': 2, 'embedding_dim': 32, 'lr': 0.008671930882000575, 'lambda_val': 7.980305062842105e-06, 'batch_size': 3741, 'optimizer': 'RMSprop'}.
2026-06-21 17:24:04,504 - optuna.study.study - INFO - Trial 49 finished with values: [0.0011478513339586017, 0.00026525198938992045, 0.0006745026162205706] and parameters: {'n_layers': 3, 'embedding_dim': 256, 'lr': 9.903879065297301e-05, 'lambda_val': 0.0005792724775310896, 'batch_size': 3054, 'optimizer': 'RMSprop'}.
2026-06-21 17:24:28,903 - experiment_functions - INFO - Early stopping at epoch 550. Best Metrics: (0.0037056797644636945, 0.0008904888215233045, 0.0022626258979770437)
