2026-06-20 21:08:54,267 - optuna.study.study - INFO - Trial 247 finished with values: [0.003466191383542798, 0.0016878236705822913, 0.0027604232895299128] and parameters: {'n_layers': 1, 'embedding_dim': 64, 'lr': 0.00017647026102474964, 'lambda_val': 0.0021519517203617954, 'batch_size': 3657, 'optimizer': 'Adam'}.
2026-06-20 21:11:49,643 - optuna.study.study - INFO - Trial 248 finished with values: [0.0005911213636377873, 0.00013578375647341163, 0.0003235951170963345] and parameters: {'n_layers': 4, 'embedding_dim': 128, 'lr': 1.6547719781725815e-05, 'lambda_val': 1.3134597991064091e-06, 'batch_size': 2734, 'optimizer': 'Adam'}.
2026-06-20 21:12:14,705 - experiment_functions - INFO - Early stopping at epoch 550. Best Metrics: (0.0039024459440125023, 0.0016309839585701652, 0.00275810112975014)
2026-06-20 21:12:14,799 - optuna.study.study - INFO - Trial 249 finished with values: [0.0039024459440125023, 0.0016309839585701652, 0.00275810112975014] and parameters: {'n_layers': 1, 'embedding_dim': 128, 'lr': 0.021080815477123926, 'lambda_val': 3.1552145254862633e-06, 'batch_size': 2734, 'optimizer': 'Adam'}.
2026-06-20 21:12:43,504 - experiment_functions - INFO - Early stopping at epoch 650. Best Metrics: (0.0037856501401586106, 0.0017667677150435771, 0.0029060391819456287)
2026-06-20 21:12:43,587 - optuna.study.study - INFO - Trial 250 finished with values: [0.0037856501401586106, 0.0017667677150435771, 0.0029060391819456287] and parameters: {'n_layers': 1, 'embedding_dim': 64, 'lr': 0.002035013881396423, 'lambda_val': 3.6211720377573765e-05, 'batch_size': 2884, 'optimizer': 'Adam'}.
2026-06-20 21:13:16,633 - experiment_functions - INFO - Early stopping at epoch 750. Best Metrics: (0.0035270303746410166, 0.0016357206012378425, 0.0027622780340229585)
2026-06-20 21:13:16,718 - optuna.study.study - INFO - Trial 251 finished with values: [0.0035270303746410166, 0.0016357206012378425, 0.0027622780340229585] and parameters: {'n_layers': 1, 'embedding_dim': 128, 'lr': 0.0011914719293063967, 'lambda_val': 1.548420801174704e-06, 'batch_size': 2734, 'optimizer': 'RMSprop'}.
2026-06-20 21:13:51,909 - experiment_functions - INFO - Early stopping at epoch 850. Best Metrics: (0.0005050346017521163, 0.00011525830491347733, 0.0002464522764337851)
2026-06-20 21:13:52,249 - optuna.study.study - INFO - Trial 252 finished with values: [0.0005050346017521163, 0.00011525830491347733, 0.0002464522764337851] and parameters: {'n_layers': 1, 'embedding_dim': 32, 'lr': 2.482881450764155e-05, 'lambda_val': 0.011318308145765905, 'batch_size': 2884, 'optimizer': 'Adam'}.
2026-06-20 21:16:28,995 - optuna.study.study - INFO - Trial 253 finished with values: [0.0016126724096183261, 0.0006978653530377669, 0.0012614427804666817] and parameters: {'n_layers': 1, 'embedding_dim': 32, 'lr': 0.00017647026102474964, 'lambda_val': 0.00091460267317109, 'batch_size': 747, 'optimizer': 'Adam'}.
2026-06-20 21:17:08,309 - experiment_functions - INFO - Early stopping at epoch 900. Best Metrics: (0.003755006423665204, 0.0019214980421876971, 0.0030377304786755517)
2026-06-20 21:17:08,393 - optuna.study.study - INFO - Trial 254 finished with values: [0.003755006423665204, 0.0019214980421876971, 0.0030377304786755517] and parameters: {'n_layers': 1, 'embedding_dim': 128, 'lr': 0.0006807272940793503, 'lambda_val': 8.041596117478959e-06, 'batch_size': 2734, 'optimizer': 'RMSprop'}.
2026-06-20 21:17:38,338 - experiment_functions - INFO - Early stopping at epoch 700. Best Metrics: (0.004168672128318449, 0.0019341290893015034, 0.0031218434573132173)
2026-06-20 21:17:38,425 - optuna.study.study - INFO - Trial 255 finished with values: [0.004168672128318449, 0.0019341290893015034, 0.0031218434573132173] and parameters: {'n_layers': 1, 'embedding_dim': 32, 'lr': 0.001947201008389374, 'lambda_val': 0.00091460267317109, 'batch_size': 1931, 'optimizer': 'Adam'}.
2026-06-20 21:18:02,288 - experiment_functions - INFO - Early stopping at epoch 550. Best Metrics: (0.003722328518547187, 0.0014730958696475935, 0.002474976809773277)
2026-06-20 21:18:02,397 - optuna.study.study - INFO - Trial 256 finished with values: [0.003722328518547187, 0.0014730958696475935, 0.002474976809773277] and parameters: {'n_layers': 1, 'embedding_dim': 32, 'lr': 0.0351299935800953, 'lambda_val': 0.00091460267317109, 'batch_size': 809, 'optimizer': 'Adam'}.
2026-06-20 21:18:28,543 - experiment_functions - INFO - Early stopping at epoch 550. Best Metrics: (0.002882337903078326, 0.0012315270935960591, 0.00197647699554152)
2026-06-20 21:18:28,856 - optuna.study.study - INFO - Trial 257 finished with values: [0.002882337903078326, 0.0012315270935960591, 0.00197647699554152] and parameters: {'n_layers': 3, 'embedding_dim': 128, 'lr': 0.008754121728685619, 'lambda_val': 4.080619734488508e-05, 'batch_size': 1155, 'optimizer': 'Adam'}.
2026-06-20 21:21:05,914 - optuna.study.study - INFO - Trial 258 finished with values: [0.004735535128598724, 0.002125173676897815, 0.003678408571348454] and parameters: {'n_layers': 1, 'embedding_dim': 32, 'lr': 0.0006133385212652219, 'lambda_val': 4.922680840294995e-05, 'batch_size': 747, 'optimizer': 'Adam'}.
2026-06-20 21:21:59,375 - experiment_functions - INFO - Early stopping at epoch 1300. Best Metrics: (0.004246957710540772, 0.0019751799924213717, 0.0032427805482979914)
2026-06-20 21:21:59,450 - optuna.study.study - INFO - Trial 259 finished with values: [0.004246957710540772, 0.0019751799924213717, 0.0032427805482979914] and parameters: {'n_layers': 1, 'embedding_dim': 64, 'lr': 0.0005943725589836874, 'lambda_val': 0.0021519517203617954, 'batch_size': 1257, 'optimizer': 'Adam'}.
2026-06-20 21:23:18,558 - experiment_functions - INFO - Early stopping at epoch 2000. Best Metrics: (0.004553351628350678, 0.001995705443981306, 0.0033226456947171045)
2026-06-20 21:23:18,633 - optuna.study.study - INFO - Trial 260 finished with values: [0.004553351628350678, 0.001995705443981306, 0.0033226456947171045] and parameters: {'n_layers': 1, 'embedding_dim': 32, 'lr': 0.0005943725589836874, 'lambda_val': 0.0007336457993064653, 'batch_size': 1378, 'optimizer': 'RMSprop'}.
2026-06-20 21:23:42,373 - experiment_functions - INFO - Early stopping at epoch 550. Best Metrics: (0.0038255739683544293, 0.0016736137425792598, 0.0028654330283801174)
2026-06-20 21:23:42,501 - optuna.study.study - INFO - Trial 261 finished with values: [0.0038255739683544293, 0.0016736137425792598, 0.0028654330283801174] and parameters: {'n_layers': 1, 'embedding_dim': 32, 'lr': 0.01576360879095395, 'lambda_val': 0.00091460267317109, 'batch_size': 1155, 'optimizer': 'Adam'}.
2026-06-20 21:24:17,573 - experiment_functions - INFO - Early stopping at epoch 850. Best Metrics: (0.004441524188405764, 0.002011494252873563, 0.003438764194146308)
2026-06-20 21:24:17,989 - optuna.study.study - INFO - Trial 262 finished with values: [0.004441524188405764, 0.002011494252873563, 0.003438764194146308] and parameters: {'n_layers': 1, 'embedding_dim': 32, 'lr': 0.001947201008389374, 'lambda_val': 0.00091460267317109, 'batch_size': 747, 'optimizer': 'Adam'}.
2026-06-20 21:24:50,986 - experiment_functions - INFO - Early stopping at epoch 750. Best Metrics: (0.004404304095528126, 0.0019893899204244036, 0.003328929843979391)
2026-06-20 21:24:51,061 - optuna.study.study - INFO - Trial 263 finished with values: [0.004404304095528126, 0.0019893899204244036, 0.003328929843979391] and parameters: {'n_layers': 1, 'embedding_dim': 32, 'lr': 0.001947201008389374, 'lambda_val': 3.291707935814207e-06, 'batch_size': 747, 'optimizer': 'Adam'}.
2026-06-20 21:25:14,489 - experiment_functions - INFO - Early stopping at epoch 500. Best Metrics: (0.0003775542409789688, 0.00010578501957812305, 0.000198859537015109)
2026-06-20 21:25:14,575 - optuna.study.study - INFO - Trial 264 finished with values: [0.0003775542409789688, 0.00010578501957812305, 0.000198859537015109] and parameters: {'n_layers': 1, 'embedding_dim': 256, 'lr': 0.00010238282637215255, 'lambda_val': 0.00091460267317109, 'batch_size': 2734, 'optimizer': 'SGD'}.
2026-06-20 21:25:36,056 - experiment_functions - INFO - Early stopping at epoch 500. Best Metrics: (0.0006183576968717604, 0.0001405203991410888, 0.0003832165663965829)
2026-06-20 21:25:36,141 - optuna.study.study - INFO - Trial 265 finished with values: [0.0006183576968717604, 0.0001405203991410888, 0.0003832165663965829] and parameters: {'n_layers': 1, 'embedding_dim': 32, 'lr': 0.001947201008389374, 'lambda_val': 0.00091460267317109, 'batch_size': 747, 'optimizer': 'SGD'}.
2026-06-20 21:26:13,004 - experiment_functions - INFO - Early stopping at epoch 850. Best Metrics: (0.0033310689104601447, 0.0014130983958570164, 0.002391436066595138)
2026-06-20 21:26:13,076 - optuna.study.study - INFO - Trial 266 finished with values: [0.0033310689104601447, 0.0014130983958570164, 0.002391436066595138] and parameters: {'n_layers': 4, 'embedding_dim': 64, 'lr': 0.0005943725589836874, 'lambda_val': 0.0007336457993064653, 'batch_size': 865, 'optimizer': 'Adam'}.
2026-06-20 21:26:51,547 - experiment_functions - INFO - Early stopping at epoch 900. Best Metrics: (0.004060267194827484, 0.0018678160919540232, 0.003032873711588626)
2026-06-20 21:26:51,625 - optuna.study.study - INFO - Trial 267 finished with values: [0.004060267194827484, 0.0018678160919540232, 0.003032873711588626] and parameters: {'n_layers': 1, 'embedding_dim': 128, 'lr': 0.0011914719293063967, 'lambda_val': 3.6417495206733656e-06, 'batch_size': 891, 'optimizer': 'RMSprop'}.
2026-06-20 21:29:33,305 - optuna.study.study - INFO - Trial 268 finished with values: [0.0005390501410847936, 0.00014209928003031453, 0.0003139756009580167] and parameters: {'n_layers': 1, 'embedding_dim': 128, 'lr': 7.252550490349265e-05, 'lambda_val': 6.254367883207469e-05, 'batch_size': 891, 'optimizer': 'Adam'}.
2026-06-20 21:30:06,392 - experiment_functions - INFO - Early stopping at epoch 700. Best Metrics: (0.0038034073949824035, 0.0018851837817355059, 0.0030724454647159433)
2026-06-20 21:30:06,485 - optuna.study.study - INFO - Trial 269 finished with values: [0.0038034073949824035, 0.0018851837817355059, 0.0030724454647159433] and parameters: {'n_layers': 1, 'embedding_dim': 256, 'lr': 0.001947201008389374, 'lambda_val': 3.053178197562114e-05, 'batch_size': 747, 'optimizer': 'Adam'}.
2026-06-20 21:30:30,927 - experiment_functions - INFO - Early stopping at epoch 550. Best Metrics: (0.004304651775497737, 0.001951496779082986, 0.003255116582751961)
2026-06-20 21:30:31,010 - optuna.study.study - INFO - Trial 270 finished with values: [0.004304651775497737, 0.001951496779082986, 0.003255116582751961] and parameters: {'n_layers': 1, 'embedding_dim': 96, 'lr': 0.008754121728685619, 'lambda_val': 4.080619734488508e-05, 'batch_size': 2884, 'optimizer': 'Adam'}.
2026-06-20 21:31:06,375 - experiment_functions - INFO - Early stopping at epoch 850. Best Metrics: (0.003968355946552285, 0.001632562839459391, 0.0027734876516750467)
2026-06-20 21:31:06,973 - optuna.study.study - INFO - Trial 271 finished with values: [0.003968355946552285, 0.001632562839459391, 0.0027734876516750467] and parameters: {'n_layers': 2, 'embedding_dim': 32, 'lr': 0.0011836797126663788, 'lambda_val': 0.00091460267317109, 'batch_size': 809, 'optimizer': 'Adam'}.
2026-06-20 21:31:31,639 - experiment_functions - INFO - Early stopping at epoch 550. Best Metrics: (0.0004943701926144043, 0.0001136794240242516, 0.00026425957907347844)
2026-06-20 21:31:31,725 - optuna.study.study - INFO - Trial 272 finished with values: [0.0004943701926144043, 0.0001136794240242516, 0.00026425957907347844] and parameters: {'n_layers': 1, 'embedding_dim': 128, 'lr': 6.34513639259082e-05, 'lambda_val': 1.2802521996932673e-05, 'batch_size': 2734, 'optimizer': 'Adam'}.
2026-06-20 21:32:26,429 - experiment_functions - INFO - Early stopping at epoch 1350. Best Metrics: (0.002211760361644094, 0.0011620563344701277, 0.0017160619066687993)
2026-06-20 21:32:26,506 - optuna.study.study - INFO - Trial 273 finished with values: [0.002211760361644094, 0.0011620563344701277, 0.0017160619066687993] and parameters: {'n_layers': 1, 'embedding_dim': 64, 'lr': 0.0003585923707753069, 'lambda_val': 0.05674568655038034, 'batch_size': 2734, 'optimizer': 'Adam'}.
2026-06-20 21:35:01,967 - optuna.study.study - INFO - Trial 274 finished with values: [0.001832077554994543, 0.0007578628268283441, 0.0013788373680515616] and parameters: {'n_layers': 1, 'embedding_dim': 32, 'lr': 0.0001249452611030427, 'lambda_val': 6.254367883207469e-05, 'batch_size': 1847, 'optimizer': 'RMSprop'}.
2026-06-20 21:35:26,986 - experiment_functions - INFO - Early stopping at epoch 550. Best Metrics: (0.0029346315291261787, 0.0013199444233926994, 0.0022356305212497198)
2026-06-20 21:35:27,078 - optuna.study.study - INFO - Trial 275 finished with values: [0.0029346315291261787, 0.0013199444233926994, 0.0022356305212497198] and parameters: {'n_layers': 4, 'embedding_dim': 64, 'lr': 0.0031999437523966318, 'lambda_val': 0.0021519517203617954, 'batch_size': 1378, 'optimizer': 'Adam'}.
2026-06-20 21:36:10,865 - experiment_functions - INFO - Early stopping at epoch 1050. Best Metrics: (0.004387858279049953, 0.0020225464190981434, 0.0033146146658385033)
2026-06-20 21:36:10,946 - optuna.study.study - INFO - Trial 276 finished with values: [0.004387858279049953, 0.0020225464190981434, 0.0033146146658385033] and parameters: {'n_layers': 1, 'embedding_dim': 64, 'lr': 0.0007769635361512541, 'lambda_val': 0.002755373279313737, 'batch_size': 1257, 'optimizer': 'Adam'}.
2026-06-20 21:36:38,429 - experiment_functions - INFO - Early stopping at epoch 650. Best Metrics: (0.0035291090355461328, 0.0013625742074017937, 0.002334960931973967)
2026-06-20 21:36:38,523 - optuna.study.study - INFO - Trial 277 finished with values: [0.0035291090355461328, 0.0013625742074017937, 0.002334960931973967] and parameters: {'n_layers': 2, 'embedding_dim': 32, 'lr': 0.001947201008389374, 'lambda_val': 1.548420801174704e-06, 'batch_size': 959, 'optimizer': 'RMSprop'}.
2026-06-20 21:37:02,343 - experiment_functions - INFO - Early stopping at epoch 550. Best Metrics: (0.003676352912690803, 0.0016530882910193256, 0.0027405441083511893)
2026-06-20 21:37:02,462 - optuna.study.study - INFO - Trial 278 finished with values: [0.003676352912690803, 0.0016530882910193256, 0.0027405441083511893] and parameters: {'n_layers': 1, 'embedding_dim': 32, 'lr': 0.001947201008389374, 'lambda_val': 4.922680840294995e-05, 'batch_size': 1847, 'optimizer': 'RMSprop'}.
2026-06-20 21:37:44,085 - experiment_functions - INFO - Early stopping at epoch 900. Best Metrics: (0.003976224246074768, 0.0019499178981937603, 0.0030532160950185387)
2026-06-20 21:37:44,169 - optuna.study.study - INFO - Trial 279 finished with values: [0.003976224246074768, 0.0019499178981937603, 0.0030532160950185387] and parameters: {'n_layers': 1, 'embedding_dim': 256, 'lr': 0.0005943725589836874, 'lambda_val': 3.6417495206733656e-06, 'batch_size': 1378, 'optimizer': 'RMSprop'}.
2026-06-20 21:38:29,476 - experiment_functions - INFO - Early stopping at epoch 1050. Best Metrics: (0.0036437028682300187, 0.0018109763799418976, 0.0027880981523032973)
2026-06-20 21:38:29,574 - optuna.study.study - INFO - Trial 280 finished with values: [0.0036437028682300187, 0.0018109763799418976, 0.0027880981523032973] and parameters: {'n_layers': 1, 'embedding_dim': 128, 'lr': 0.0006133385212652219, 'lambda_val': 0.000469810978153281, 'batch_size': 2884, 'optimizer': 'Adam'}.
2026-06-20 21:38:51,367 - experiment_functions - INFO - Early stopping at epoch 500. Best Metrics: (0.0005537844445085584, 0.0001310471138057345, 0.0002987862357073079)
2026-06-20 21:38:51,441 - optuna.study.study - INFO - Trial 281 finished with values: [0.0005537844445085584, 0.0001310471138057345, 0.0002987862357073079] and parameters: {'n_layers': 1, 'embedding_dim': 64, 'lr': 0.021080815477123926, 'lambda_val': 3.1552145254862633e-06, 'batch_size': 621, 'optimizer': 'SGD'}.
2026-06-20 21:39:16,423 - experiment_functions - INFO - Early stopping at epoch 550. Best Metrics: (0.003840713244874736, 0.0016088796261210054, 0.0027253353700107254)
2026-06-20 21:39:16,519 - optuna.study.study - INFO - Trial 282 finished with values: [0.003840713244874736, 0.0016088796261210054, 0.0027253353700107254] and parameters: {'n_layers': 1, 'embedding_dim': 128, 'lr': 0.021080815477123926, 'lambda_val': 3.1552145254862633e-06, 'batch_size': 2734, 'optimizer': 'Adam'}.
2026-06-20 21:39:49,414 - experiment_functions - INFO - Early stopping at epoch 750. Best Metrics: (0.004158185615740027, 0.0019420234937476317, 0.0031606632747258096)
2026-06-20 21:39:49,502 - optuna.study.study - INFO - Trial 283 finished with values: [0.004158185615740027, 0.0019420234937476317, 0.0031606632747258096] and parameters: {'n_layers': 1, 'embedding_dim': 128, 'lr': 0.001947201008389374, 'lambda_val': 6.733205641736132e-06, 'batch_size': 747, 'optimizer': 'Adam'}.
2026-06-20 21:40:19,304 - experiment_functions - INFO - Early stopping at epoch 600. Best Metrics: (0.003178158747728661, 0.0016199317923455856, 0.002526421657131366)
2026-06-20 21:40:19,397 - optuna.study.study - INFO - Trial 284 finished with values: [0.003178158747728661, 0.0016199317923455856, 0.002526421657131366] and parameters: {'n_layers': 2, 'embedding_dim': 256, 'lr': 0.001947201008389374, 'lambda_val': 1.548420801174704e-06, 'batch_size': 1893, 'optimizer': 'Adam'}.
2026-06-20 21:40:49,229 - experiment_functions - INFO - Early stopping at epoch 700. Best Metrics: (0.0037781563890299558, 0.0017430845017051915, 0.0028511643980446972)
2026-06-20 21:40:49,318 - optuna.study.study - INFO - Trial 285 finished with values: [0.0037781563890299558, 0.0017430845017051915, 0.0028511643980446972] and parameters: {'n_layers': 1, 'embedding_dim': 64, 'lr': 0.0011836797126663788, 'lambda_val': 0.0021519517203617954, 'batch_size': 3400, 'optimizer': 'Adam'}.
2026-06-20 21:43:32,207 - optuna.study.study - INFO - Trial 286 finished with values: [0.0025831582026650036, 0.0013546798029556652, 0.0021197917017982248] and parameters: {'n_layers': 1, 'embedding_dim': 128, 'lr': 0.00015148347112373803, 'lambda_val': 6.733205641736132e-06, 'batch_size': 1155, 'optimizer': 'Adam'}.
2026-06-20 21:43:57,063 - experiment_functions - INFO - Early stopping at epoch 550. Best Metrics: (0.00260499176708575, 0.0011983705949223191, 0.001901873955605789)
2026-06-20 21:43:57,191 - optuna.study.study - INFO - Trial 287 finished with values: [0.00260499176708575, 0.0011983705949223191, 0.001901873955605789] and parameters: {'n_layers': 1, 'embedding_dim': 128, 'lr': 0.01901428874066182, 'lambda_val': 0.004379523707555612, 'batch_size': 2734, 'optimizer': 'Adam'}.
2026-06-20 21:44:18,570 - experiment_functions - INFO - Early stopping at epoch 500. Best Metrics: (0.00044834138859287993, 0.00011210054313502591, 0.0002595968050097616)
2026-06-20 21:44:18,653 - optuna.study.study - INFO - Trial 288 finished with values: [0.00044834138859287993, 0.00011210054313502591, 0.0002595968050097616] and parameters: {'n_layers': 1, 'embedding_dim': 32, 'lr': 0.0011836797126663788, 'lambda_val': 6.254367883207469e-05, 'batch_size': 809, 'optimizer': 'SGD'}.
2026-06-20 21:44:40,088 - experiment_functions - INFO - Early stopping at epoch 500. Best Metrics: (0.0005871144854466682, 0.00013578375647341163, 0.00035697930431989226)
2026-06-20 21:44:40,248 - optuna.study.study - INFO - Trial 289 finished with values: [0.0005871144854466682, 0.00013578375647341163, 0.00035697930431989226] and parameters: {'n_layers': 1, 'embedding_dim': 32, 'lr': 5.282196069021882e-05, 'lambda_val': 0.08430199526524916, 'batch_size': 762, 'optimizer': 'RMSprop'}.
2026-06-20 21:45:10,606 - experiment_functions - INFO - Early stopping at epoch 700. Best Metrics: (0.0036362484294657823, 0.0018299229506126057, 0.002914470035349755)
2026-06-20 21:45:10,700 - optuna.study.study - INFO - Trial 290 finished with values: [0.0036362484294657823, 0.0018299229506126057, 0.002914470035349755] and parameters: {'n_layers': 1, 'embedding_dim': 96, 'lr': 0.0011836797126663788, 'lambda_val': 0.00091460267317109, 'batch_size': 3094, 'optimizer': 'Adam'}.
2026-06-20 21:45:40,074 - experiment_functions - INFO - Early stopping at epoch 700. Best Metrics: (0.003986692206773106, 0.0017541366679297713, 0.002929375328627149)
2026-06-20 21:45:40,174 - optuna.study.study - INFO - Trial 291 finished with values: [0.003986692206773106, 0.0017541366679297713, 0.002929375328627149] and parameters: {'n_layers': 1, 'embedding_dim': 32, 'lr': 0.001947201008389374, 'lambda_val': 1.548420801174704e-06, 'batch_size': 891, 'optimizer': 'RMSprop'}.
2026-06-20 21:46:03,905 - experiment_functions - INFO - Early stopping at epoch 550. Best Metrics: (0.002815894394353625, 0.0011920550713654162, 0.00197312439139811)
2026-06-20 21:46:04,036 - optuna.study.study - INFO - Trial 292 finished with values: [0.002815894394353625, 0.0011920550713654162, 0.00197312439139811] and parameters: {'n_layers': 3, 'embedding_dim': 32, 'lr': 0.001947201008389374, 'lambda_val': 0.010067387666983651, 'batch_size': 1847, 'optimizer': 'RMSprop'}.
2026-06-20 21:47:07,678 - experiment_functions - INFO - Early stopping at epoch 1600. Best Metrics: (0.004391282590300712, 0.0020051787293166603, 0.0032871654575923723)
2026-06-20 21:47:07,751 - optuna.study.study - INFO - Trial 293 finished with values: [0.004391282590300712, 0.0020051787293166603, 0.0032871654575923723] and parameters: {'n_layers': 1, 'embedding_dim': 32, 'lr': 0.0006133385212652219, 'lambda_val': 5.905732326481523e-06, 'batch_size': 867, 'optimizer': 'Adam'}.
2026-06-20 21:48:03,082 - experiment_functions - INFO - Early stopping at epoch 1400. Best Metrics: (0.0005611403549494461, 0.00011367942402425162, 0.00035209615335177213)
