2026-06-20 21:48:03,174 - optuna.study.study - INFO - Trial 294 finished with values: [0.0005611403549494461, 0.00011367942402425162, 0.00035209615335177213] and parameters: {'n_layers': 1, 'embedding_dim': 32, 'lr': 8.162468203913841e-05, 'lambda_val': 0.00091460267317109, 'batch_size': 594, 'optimizer': 'Adam'}.
2026-06-20 21:48:26,820 - experiment_functions - INFO - Early stopping at epoch 550. Best Metrics: (0.0037837747680704763, 0.0016467727674624225, 0.0026917552856586028)
2026-06-20 21:48:26,891 - optuna.study.study - INFO - Trial 295 finished with values: [0.0037837747680704763, 0.0016467727674624225, 0.0026917552856586028] and parameters: {'n_layers': 1, 'embedding_dim': 32, 'lr': 0.019411003973852255, 'lambda_val': 6.254367883207469e-05, 'batch_size': 3400, 'optimizer': 'Adam'}.
2026-06-20 21:48:59,872 - experiment_functions - INFO - Early stopping at epoch 700. Best Metrics: (0.0037925598662230807, 0.001973601111532146, 0.003112858985467673)
2026-06-20 21:48:59,967 - optuna.study.study - INFO - Trial 296 finished with values: [0.0037925598662230807, 0.001973601111532146, 0.003112858985467673] and parameters: {'n_layers': 1, 'embedding_dim': 256, 'lr': 0.001947201008389374, 'lambda_val': 4.922680840294995e-05, 'batch_size': 747, 'optimizer': 'Adam'}.
2026-06-20 21:49:30,482 - experiment_functions - INFO - Early stopping at epoch 700. Best Metrics: (0.004113352029611571, 0.0018441328786156373, 0.0030602838090314465)
2026-06-20 21:49:30,574 - optuna.study.study - INFO - Trial 297 finished with values: [0.004113352029611571, 0.0018441328786156373, 0.0030602838090314465] and parameters: {'n_layers': 1, 'embedding_dim': 96, 'lr': 0.0011836797126663788, 'lambda_val': 0.002755373279313737, 'batch_size': 3050, 'optimizer': 'Adam'}.
2026-06-20 21:52:05,541 - optuna.study.study - INFO - Trial 298 finished with values: [0.00094011948079341, 0.0002794619173929519, 0.0006012100527048849] and parameters: {'n_layers': 2, 'embedding_dim': 32, 'lr': 4.948363759165365e-05, 'lambda_val': 0.004379523707555612, 'batch_size': 3655, 'optimizer': 'Adam'}.
2026-06-20 21:52:33,198 - experiment_functions - INFO - Early stopping at epoch 650. Best Metrics: (0.004257757761103107, 0.0017857142857142857, 0.003032470517426742)
2026-06-20 21:52:33,273 - optuna.study.study - INFO - Trial 299 finished with values: [0.004257757761103107, 0.0017857142857142857, 0.003032470517426742] and parameters: {'n_layers': 2, 'embedding_dim': 32, 'lr': 0.001947201008389374, 'lambda_val': 4.080619734488508e-05, 'batch_size': 747, 'optimizer': 'Adam'}.
2026-06-20 21:52:33,288 - root - INFO - Selected Trial 258 based on Max ndcg: 0.0037
2026-06-20 21:52:33,288 - root - INFO - Associated Recall: 0.0047
2026-06-20 21:52:33,288 - experiment_functions - INFO - Training the best model ... for e_yelp_1c2dcs_strict
2026-06-20 21:54:29,630 - experiment_functions - INFO - Early stopping at epoch 3000. Best Metrics: (0.00474292992538457, 0.0020335985853227236, 0.0034684820458483743)
2026-06-20 21:54:33,304 - root - INFO -   **** Training e_yelp_1c2dcs_strict_rand1
2026-06-20 21:54:33,333 - root - INFO -   **** Getting 71258/1274132 random edges
2026-06-20 21:54:33,442 - optuna.storages._rdb.storage - INFO - A new study created in RDB with name: Study_e_yelp_1c2dcs_strict_rand1
2026-06-20 21:54:55,119 - experiment_functions - INFO - Early stopping at epoch 500. Best Metrics: (0.0006455005527888607, 0.00013578375647341166, 0.00032098548746566536)
2026-06-20 21:54:55,216 - optuna.study.study - INFO - Trial 0 finished with values: [0.0006455005527888607, 0.00013578375647341166, 0.00032098548746566536] and parameters: {'n_layers': 3, 'embedding_dim': 32, 'lr': 0.010565983515202043, 'lambda_val': 0.004386949975881728, 'batch_size': 2178, 'optimizer': 'SGD'}.
2026-06-20 21:57:51,070 - optuna.study.study - INFO - Trial 1 finished with values: [0.0023251878554527935, 0.000557344953896678, 0.001540799133295375] and parameters: {'n_layers': 3, 'embedding_dim': 128, 'lr': 0.00019042887053650822, 'lambda_val': 0.0007991211790773639, 'batch_size': 1902, 'optimizer': 'Adam'}.
2026-06-20 21:58:18,123 - experiment_functions - INFO - Early stopping at epoch 650. Best Metrics: (0.003236668582776158, 0.000742074017936087, 0.0021173738835361237)
2026-06-20 21:58:18,215 - optuna.study.study - INFO - Trial 2 finished with values: [0.003236668582776158, 0.000742074017936087, 0.0021173738835361237] and parameters: {'n_layers': 1, 'embedding_dim': 32, 'lr': 0.00997410292059067, 'lambda_val': 0.0020606879477940467, 'batch_size': 916, 'optimizer': 'Adam'}.
2026-06-20 21:58:40,863 - experiment_functions - INFO - Early stopping at epoch 500. Best Metrics: (0.0005568089978743394, 0.00012315270935960593, 0.0003289307464585434)
2026-06-20 21:58:40,942 - optuna.study.study - INFO - Trial 3 finished with values: [0.0005568089978743394, 0.00012315270935960593, 0.0003289307464585434] and parameters: {'n_layers': 1, 'embedding_dim': 128, 'lr': 1.1552120242792721e-05, 'lambda_val': 0.018590717374416425, 'batch_size': 3059, 'optimizer': 'SGD'}.
2026-06-20 21:59:19,474 - experiment_functions - INFO - Early stopping at epoch 850. Best Metrics: (0.008456040313524428, 0.002125173676897815, 0.005211702963145434)
2026-06-20 21:59:19,546 - optuna.study.study - INFO - Trial 4 finished with values: [0.008456040313524428, 0.002125173676897815, 0.005211702963145434] and parameters: {'n_layers': 3, 'embedding_dim': 96, 'lr': 0.0031134216844272773, 'lambda_val': 3.9553958515555e-06, 'batch_size': 1203, 'optimizer': 'Adam'}.
2026-06-20 21:59:43,266 - experiment_functions - INFO - Early stopping at epoch 500. Best Metrics: (0.0005940122006600068, 0.00012631047113805733, 0.0002946218235719333)
2026-06-20 21:59:43,360 - optuna.study.study - INFO - Trial 5 finished with values: [0.0005940122006600068, 0.00012631047113805733, 0.0002946218235719333] and parameters: {'n_layers': 1, 'embedding_dim': 256, 'lr': 0.0003543720126235152, 'lambda_val': 0.028035684196566255, 'batch_size': 1092, 'optimizer': 'SGD'}.
2026-06-20 22:00:12,090 - experiment_functions - INFO - Early stopping at epoch 600. Best Metrics: (0.0027174981120283077, 0.0006426045219148668, 0.0017212010869989381)
2026-06-20 22:00:12,175 - optuna.study.study - INFO - Trial 6 finished with values: [0.0027174981120283077, 0.0006426045219148668, 0.0017212010869989381] and parameters: {'n_layers': 1, 'embedding_dim': 256, 'lr': 0.03725449527619446, 'lambda_val': 5.084446162730928e-06, 'batch_size': 2437, 'optimizer': 'RMSprop'}.
2026-06-20 22:01:43,189 - experiment_functions - INFO - Early stopping at epoch 2200. Best Metrics: (0.0006146583327100335, 0.00012157382847038021, 0.000314641129513356)
2026-06-20 22:01:43,282 - optuna.study.study - INFO - Trial 7 finished with values: [0.0006146583327100335, 0.00012157382847038021, 0.000314641129513356] and parameters: {'n_layers': 1, 'embedding_dim': 128, 'lr': 2.957492195351769e-05, 'lambda_val': 0.003238767309417044, 'batch_size': 2222, 'optimizer': 'Adam'}.
2026-06-20 22:04:38,321 - optuna.study.study - INFO - Trial 8 finished with values: [0.002477691574338272, 0.0006062902614626753, 0.0015139500544946252] and parameters: {'n_layers': 4, 'embedding_dim': 96, 'lr': 0.00015825288423494753, 'lambda_val': 2.0846213152739697e-06, 'batch_size': 2950, 'optimizer': 'Adam'}.
2026-06-20 22:05:00,259 - experiment_functions - INFO - Early stopping at epoch 500. Best Metrics: (0.0005424823062375945, 0.0001310471138057345, 0.0003400050369582809)
2026-06-20 22:05:00,347 - optuna.study.study - INFO - Trial 9 finished with values: [0.0005424823062375945, 0.0001310471138057345, 0.0003400050369582809] and parameters: {'n_layers': 1, 'embedding_dim': 32, 'lr': 0.004161234456392577, 'lambda_val': 0.020565069317939635, 'batch_size': 2711, 'optimizer': 'SGD'}.
2026-06-20 22:06:16,554 - experiment_functions - INFO - Early stopping at epoch 1750. Best Metrics: (0.0033414503120284206, 0.0008983832259694329, 0.0019211410708930806)
2026-06-20 22:06:16,627 - optuna.study.study - INFO - Trial 10 finished with values: [0.0033414503120284206, 0.0008983832259694329, 0.0019211410708930806] and parameters: {'n_layers': 1, 'embedding_dim': 128, 'lr': 0.04320444522245076, 'lambda_val': 0.0013800424546559211, 'batch_size': 3673, 'optimizer': 'Adam'}.
2026-06-20 22:08:54,562 - optuna.study.study - INFO - Trial 11 finished with values: [0.003336803079873961, 0.0007310218517115069, 0.0018998061553910186] and parameters: {'n_layers': 1, 'embedding_dim': 32, 'lr': 0.0004974729077493578, 'lambda_val': 0.0011815240672291283, 'batch_size': 1305, 'optimizer': 'RMSprop'}.
2026-06-20 22:11:28,405 - experiment_functions - INFO - Early stopping at epoch 3650. Best Metrics: (0.010089245413360225, 0.002467790829859796, 0.006090899877620066)
2026-06-20 22:11:28,750 - optuna.study.study - INFO - Trial 12 finished with values: [0.010089245413360225, 0.002467790829859796, 0.006090899877620066] and parameters: {'n_layers': 3, 'embedding_dim': 64, 'lr': 0.0006101961971381852, 'lambda_val': 0.0017226178103252388, 'batch_size': 2119, 'optimizer': 'RMSprop'}.
2026-06-20 22:11:53,344 - experiment_functions - INFO - Early stopping at epoch 550. Best Metrics: (0.004948665845907647, 0.0012031072375899962, 0.003052720260666692)
2026-06-20 22:11:53,425 - optuna.study.study - INFO - Trial 13 finished with values: [0.004948665845907647, 0.0012031072375899962, 0.003052720260666692] and parameters: {'n_layers': 3, 'embedding_dim': 32, 'lr': 0.01853956167633285, 'lambda_val': 0.002189116538069228, 'batch_size': 3786, 'optimizer': 'Adam'}.
2026-06-20 22:12:45,463 - experiment_functions - INFO - Early stopping at epoch 1250. Best Metrics: (0.000707395064264411, 0.00014525704180876593, 0.00034826300710562416)
2026-06-20 22:12:45,546 - optuna.study.study - INFO - Trial 14 finished with values: [0.000707395064264411, 0.00014525704180876593, 0.00034826300710562416] and parameters: {'n_layers': 1, 'embedding_dim': 96, 'lr': 3.414186873836921e-05, 'lambda_val': 4.448902023611443e-06, 'batch_size': 837, 'optimizer': 'Adam'}.
2026-06-20 22:13:10,241 - experiment_functions - INFO - Early stopping at epoch 500. Best Metrics: (0.0006073186803589781, 0.00014367816091954023, 0.0003381092605893993)
2026-06-20 22:13:10,342 - optuna.study.study - INFO - Trial 15 finished with values: [0.0006073186803589781, 0.00014367816091954023, 0.0003381092605893993] and parameters: {'n_layers': 3, 'embedding_dim': 128, 'lr': 4.081502078498842e-05, 'lambda_val': 0.0908364460095134, 'batch_size': 3521, 'optimizer': 'Adam'}.
2026-06-20 22:14:23,805 - experiment_functions - INFO - Early stopping at epoch 1500. Best Metrics: (0.002254811712307458, 0.0005826070481242896, 0.0013591789477805066)
2026-06-20 22:14:23,887 - optuna.study.study - INFO - Trial 16 finished with values: [0.002254811712307458, 0.0005826070481242896, 0.0013591789477805066] and parameters: {'n_layers': 2, 'embedding_dim': 256, 'lr': 0.022624420343631716, 'lambda_val': 0.0968617096434626, 'batch_size': 1086, 'optimizer': 'Adam'}.
2026-06-20 22:14:46,158 - experiment_functions - INFO - Early stopping at epoch 500. Best Metrics: (0.00048763216602587924, 0.00011841606669192878, 0.0002673663799924846)
2026-06-20 22:14:46,252 - optuna.study.study - INFO - Trial 17 finished with values: [0.00048763216602587924, 0.00011841606669192878, 0.0002673663799924846] and parameters: {'n_layers': 1, 'embedding_dim': 64, 'lr': 2.8959223914613547e-05, 'lambda_val': 0.00044824164772396327, 'batch_size': 2985, 'optimizer': 'SGD'}.
2026-06-20 22:15:08,006 - experiment_functions - INFO - Early stopping at epoch 500. Best Metrics: (0.0005052321866908598, 0.00011052166224580018, 0.0002839452393878707)
2026-06-20 22:15:08,109 - optuna.study.study - INFO - Trial 18 finished with values: [0.0005052321866908598, 0.00011052166224580018, 0.0002839452393878707] and parameters: {'n_layers': 1, 'embedding_dim': 32, 'lr': 0.036592834728420454, 'lambda_val': 2.676853681092835e-06, 'batch_size': 1507, 'optimizer': 'SGD'}.
2026-06-20 22:15:31,518 - experiment_functions - INFO - Early stopping at epoch 500. Best Metrics: (0.0004929712367636869, 0.00011525830491347732, 0.0002594413073439145)
2026-06-20 22:15:31,591 - optuna.study.study - INFO - Trial 19 finished with values: [0.0004929712367636869, 0.00011525830491347732, 0.0002594413073439145] and parameters: {'n_layers': 4, 'embedding_dim': 64, 'lr': 3.15457195933704e-05, 'lambda_val': 0.07199824797202324, 'batch_size': 2493, 'optimizer': 'SGD'}.
2026-06-20 22:18:19,748 - optuna.study.study - INFO - Trial 20 finished with values: [0.0007054388564024796, 0.0001499936844764431, 0.0003697944776769369] and parameters: {'n_layers': 4, 'embedding_dim': 64, 'lr': 7.940179314995432e-05, 'lambda_val': 4.957078496194799e-06, 'batch_size': 1168, 'optimizer': 'Adam'}.
2026-06-20 22:19:23,750 - experiment_functions - INFO - Early stopping at epoch 1550. Best Metrics: (0.003144188752133327, 0.0007736516357206013, 0.0017461981439514684)
2026-06-20 22:19:23,832 - optuna.study.study - INFO - Trial 21 finished with values: [0.003144188752133327, 0.0007736516357206013, 0.0017461981439514684] and parameters: {'n_layers': 1, 'embedding_dim': 64, 'lr': 0.03417025022075237, 'lambda_val': 0.007193171703938169, 'batch_size': 3330, 'optimizer': 'Adam'}.
2026-06-20 22:19:56,876 - experiment_functions - INFO - Early stopping at epoch 750. Best Metrics: (0.0031278400759690655, 0.00084785903751421, 0.0018207408866493934)
2026-06-20 22:19:56,964 - optuna.study.study - INFO - Trial 22 finished with values: [0.0031278400759690655, 0.00084785903751421, 0.0018207408866493934] and parameters: {'n_layers': 1, 'embedding_dim': 128, 'lr': 0.010042784975460172, 'lambda_val': 0.038987161315163665, 'batch_size': 3105, 'optimizer': 'Adam'}.
2026-06-20 22:20:21,171 - experiment_functions - INFO - Early stopping at epoch 500. Best Metrics: (0.00047727243134585063, 0.00011841606669192877, 0.00030307450883260666)
2026-06-20 22:20:22,262 - optuna.study.study - INFO - Trial 23 finished with values: [0.00047727243134585063, 0.00011841606669192877, 0.00030307450883260666] and parameters: {'n_layers': 1, 'embedding_dim': 256, 'lr': 0.0020951981615418484, 'lambda_val': 0.0034518750052837392, 'batch_size': 3767, 'optimizer': 'SGD'}.
2026-06-20 22:22:47,259 - experiment_functions - INFO - Early stopping at epoch 3450. Best Metrics: (0.0005009513947869838, 0.00012631047113805733, 0.0002557784962852436)
2026-06-20 22:22:47,332 - optuna.study.study - INFO - Trial 24 finished with values: [0.0005009513947869838, 0.00012631047113805733, 0.0002557784962852436] and parameters: {'n_layers': 4, 'embedding_dim': 64, 'lr': 3.219182309012811e-05, 'lambda_val': 1.9825462234694257e-05, 'batch_size': 992, 'optimizer': 'RMSprop'}.
2026-06-20 22:23:21,401 - experiment_functions - INFO - Early stopping at epoch 750. Best Metrics: (0.004469562727897871, 0.001138373121131742, 0.0026379451925519957)
2026-06-20 22:23:21,647 - optuna.study.study - INFO - Trial 25 finished with values: [0.004469562727897871, 0.001138373121131742, 0.0026379451925519957] and parameters: {'n_layers': 2, 'embedding_dim': 96, 'lr': 0.0024244689414321787, 'lambda_val': 0.010384775092533254, 'batch_size': 3019, 'optimizer': 'Adam'}.
2026-06-20 22:23:48,832 - experiment_functions - INFO - Early stopping at epoch 500. Best Metrics: (0.0004409214757717095, 9.946949602122017e-05, 0.00022279473928692295)
2026-06-20 22:23:48,935 - optuna.study.study - INFO - Trial 26 finished with values: [0.0004409214757717095, 9.946949602122017e-05, 0.00022279473928692295] and parameters: {'n_layers': 3, 'embedding_dim': 256, 'lr': 0.026108499428040794, 'lambda_val': 0.002892123606683438, 'batch_size': 3635, 'optimizer': 'SGD'}.
2026-06-20 22:24:12,196 - experiment_functions - INFO - Early stopping at epoch 500. Best Metrics: (0.0005079838820753201, 0.00011999494758115448, 0.0002522928702374007)
2026-06-20 22:24:12,319 - optuna.study.study - INFO - Trial 27 finished with values: [0.0005079838820753201, 0.00011999494758115448, 0.0002522928702374007] and parameters: {'n_layers': 4, 'embedding_dim': 64, 'lr': 0.025169341426967987, 'lambda_val': 6.022881364229611e-06, 'batch_size': 636, 'optimizer': 'SGD'}.
2026-06-20 22:24:34,497 - experiment_functions - INFO - Early stopping at epoch 500. Best Metrics: (0.00044273672283500024, 0.00011841606669192877, 0.0002513248777649697)
2026-06-20 22:24:34,581 - optuna.study.study - INFO - Trial 28 finished with values: [0.00044273672283500024, 0.00011841606669192877, 0.0002513248777649697] and parameters: {'n_layers': 3, 'embedding_dim': 32, 'lr': 0.005448152910072447, 'lambda_val': 0.005307763405594783, 'batch_size': 3883, 'optimizer': 'SGD'}.
2026-06-20 22:25:14,695 - experiment_functions - INFO - Early stopping at epoch 900. Best Metrics: (0.005825612559119384, 0.0014288872047492737, 0.00355378599068446)
2026-06-20 22:25:14,777 - optuna.study.study - INFO - Trial 29 finished with values: [0.005825612559119384, 0.0014288872047492737, 0.00355378599068446] and parameters: {'n_layers': 2, 'embedding_dim': 96, 'lr': 0.004155419971354583, 'lambda_val': 6.326936115170299e-06, 'batch_size': 2697, 'optimizer': 'Adam'}.
2026-06-20 22:25:37,047 - experiment_functions - INFO - Early stopping at epoch 500. Best Metrics: (0.0007984444278241809, 0.00015473032714412026, 0.0004061941714156881)
2026-06-20 22:25:37,136 - optuna.study.study - INFO - Trial 30 finished with values: [0.0007984444278241809, 0.00015473032714412026, 0.0004061941714156881] and parameters: {'n_layers': 1, 'embedding_dim': 64, 'lr': 1.4164340618085504e-05, 'lambda_val': 0.03431012611286831, 'batch_size': 3987, 'optimizer': 'Adam'}.
2026-06-20 22:26:03,618 - experiment_functions - INFO - Early stopping at epoch 600. Best Metrics: (0.002873201729121281, 0.0007073386383731211, 0.0018346579689009336)
2026-06-20 22:26:03,710 - optuna.study.study - INFO - Trial 31 finished with values: [0.002873201729121281, 0.0007073386383731211, 0.0018346579689009336] and parameters: {'n_layers': 1, 'embedding_dim': 96, 'lr': 0.02088009457117759, 'lambda_val': 9.728721119768561e-06, 'batch_size': 2532, 'optimizer': 'RMSprop'}.
2026-06-20 22:26:25,848 - experiment_functions - INFO - Early stopping at epoch 500. Best Metrics: (0.0006493553415777212, 0.00013420487558418593, 0.00039113460537893216)
2026-06-20 22:26:25,942 - optuna.study.study - INFO - Trial 32 finished with values: [0.0006493553415777212, 0.00013420487558418593, 0.00039113460537893216] and parameters: {'n_layers': 1, 'embedding_dim': 64, 'lr': 0.037964762124532064, 'lambda_val': 8.687949532036128e-06, 'batch_size': 2746, 'optimizer': 'SGD'}.
2026-06-20 22:27:03,649 - experiment_functions - INFO - Early stopping at epoch 800. Best Metrics: (0.0030124774611278464, 0.0007910193255020841, 0.0018378346745965566)
2026-06-20 22:27:03,735 - optuna.study.study - INFO - Trial 33 finished with values: [0.0030124774611278464, 0.0007910193255020841, 0.0018378346745965566] and parameters: {'n_layers': 1, 'embedding_dim': 256, 'lr': 0.018400258165223327, 'lambda_val': 0.009096515554245269, 'batch_size': 1078, 'optimizer': 'RMSprop'}.
2026-06-20 22:27:28,320 - experiment_functions - INFO - Early stopping at epoch 550. Best Metrics: (0.0004984654602252477, 0.00010262725779967159, 0.00025742885019726304)
2026-06-20 22:27:28,625 - optuna.study.study - INFO - Trial 34 finished with values: [0.0004984654602252477, 0.00010262725779967159, 0.00025742885019726304] and parameters: {'n_layers': 3, 'embedding_dim': 64, 'lr': 0.00012013359363261997, 'lambda_val': 0.00881284637944472, 'batch_size': 963, 'optimizer': 'RMSprop'}.
2026-06-20 22:27:52,912 - experiment_functions - INFO - Early stopping at epoch 500. Best Metrics: (0.0003907931260946706, 9.157509157509159e-05, 0.0001914775918257962)
2026-06-20 22:27:53,006 - optuna.study.study - INFO - Trial 35 finished with values: [0.0003907931260946706, 9.157509157509159e-05, 0.0001914775918257962] and parameters: {'n_layers': 1, 'embedding_dim': 256, 'lr': 0.003910614646463097, 'lambda_val': 0.00022581781106814018, 'batch_size': 3507, 'optimizer': 'SGD'}.
2026-06-20 22:28:26,490 - experiment_functions - INFO - Early stopping at epoch 700. Best Metrics: (0.00925180484887324, 0.002276746242263484, 0.005579965073408915)
2026-06-20 22:28:26,779 - optuna.study.study - INFO - Trial 36 finished with values: [0.00925180484887324, 0.002276746242263484, 0.005579965073408915] and parameters: {'n_layers': 4, 'embedding_dim': 96, 'lr': 0.004755645745216762, 'lambda_val': 2.2932520827188935e-06, 'batch_size': 733, 'optimizer': 'Adam'}.
2026-06-20 22:28:48,929 - experiment_functions - INFO - Early stopping at epoch 500. Best Metrics: (0.0005530114556307222, 0.00011210054313502589, 0.00031389481278529935)
2026-06-20 22:28:49,015 - optuna.study.study - INFO - Trial 37 finished with values: [0.0005530114556307222, 0.00011210054313502589, 0.00031389481278529935] and parameters: {'n_layers': 1, 'embedding_dim': 64, 'lr': 1.4012256622698871e-05, 'lambda_val': 0.07512166284238957, 'batch_size': 2952, 'optimizer': 'Adam'}.
2026-06-20 22:29:18,139 - experiment_functions - INFO - Early stopping at epoch 600. Best Metrics: (0.009205826887072485, 0.0022025388404698755, 0.005417698829788859)
2026-06-20 22:29:18,234 - optuna.study.study - INFO - Trial 38 finished with values: [0.009205826887072485, 0.0022025388404698755, 0.005417698829788859] and parameters: {'n_layers': 4, 'embedding_dim': 96, 'lr': 0.0021794693743976113, 'lambda_val': 2.8861183398799558e-06, 'batch_size': 3029, 'optimizer': 'RMSprop'}.
2026-06-20 22:29:40,530 - experiment_functions - INFO - Early stopping at epoch 500. Best Metrics: (0.000612755571783555, 0.0001326259946949602, 0.0003043589862630179)
