2026-06-21 04:01:28,960 - optuna.study.study - INFO - Trial 284 finished with values: [0.007398046649754182, 0.0018757104964001517, 0.004384429132454212] and parameters: {'n_layers': 4, 'embedding_dim': 256, 'lr': 0.0031134216844272773, 'lambda_val': 3.9553958515555e-06, 'batch_size': 1257, 'optimizer': 'RMSprop'}.
2026-06-21 04:02:59,151 - experiment_functions - INFO - Early stopping at epoch 2000. Best Metrics: (0.011926874601845341, 0.002961980548187445, 0.007161616991949569)
2026-06-21 04:02:59,307 - optuna.study.study - INFO - Trial 285 finished with values: [0.011926874601845341, 0.002961980548187445, 0.007161616991949569] and parameters: {'n_layers': 4, 'embedding_dim': 96, 'lr': 0.0006101961971381852, 'lambda_val': 1.282312052161098e-05, 'batch_size': 2119, 'optimizer': 'RMSprop'}.
2026-06-21 04:05:53,312 - optuna.study.study - INFO - Trial 286 finished with values: [0.009773399667494685, 0.0023746368573954782, 0.005920682145033631] and parameters: {'n_layers': 3, 'embedding_dim': 96, 'lr': 0.0006101961971381852, 'lambda_val': 8.886639399710564e-06, 'batch_size': 2119, 'optimizer': 'Adam'}.
2026-06-21 04:06:19,011 - experiment_functions - INFO - Early stopping at epoch 550. Best Metrics: (0.005375804037656477, 0.0013925729442970823, 0.0032567004774723095)
2026-06-21 04:06:19,115 - optuna.study.study - INFO - Trial 287 finished with values: [0.005375804037656477, 0.0013925729442970823, 0.0032567004774723095] and parameters: {'n_layers': 4, 'embedding_dim': 64, 'lr': 0.012258548073791899, 'lambda_val': 2.4259773382665532e-05, 'batch_size': 1444, 'optimizer': 'RMSprop'}.
2026-06-21 04:09:09,869 - optuna.study.study - INFO - Trial 288 finished with values: [0.01100023582273162, 0.002766199317923456, 0.006735965770532338] and parameters: {'n_layers': 4, 'embedding_dim': 64, 'lr': 0.0006460981719089114, 'lambda_val': 3.9553958515555e-06, 'batch_size': 1701, 'optimizer': 'Adam'}.
2026-06-21 04:09:35,840 - experiment_functions - INFO - Early stopping at epoch 550. Best Metrics: (0.003874495218406288, 0.0009283819628647215, 0.002379500988686041)
2026-06-21 04:09:35,955 - optuna.study.study - INFO - Trial 289 finished with values: [0.003874495218406288, 0.0009283819628647215, 0.002379500988686041] and parameters: {'n_layers': 3, 'embedding_dim': 96, 'lr': 0.09124912187365719, 'lambda_val': 2.0807360556667617e-05, 'batch_size': 1788, 'optimizer': 'Adam'}.
2026-06-21 04:11:31,937 - experiment_functions - INFO - Early stopping at epoch 2100. Best Metrics: (0.012314463873219274, 0.0030693444486547938, 0.007455355368853618)
2026-06-21 04:11:32,044 - optuna.study.study - INFO - Trial 290 finished with values: [0.012314463873219274, 0.0030693444486547938, 0.007455355368853618] and parameters: {'n_layers': 4, 'embedding_dim': 256, 'lr': 0.0006101961971381852, 'lambda_val': 3.9553958515555e-06, 'batch_size': 968, 'optimizer': 'RMSprop'}.
2026-06-21 04:12:09,034 - experiment_functions - INFO - Early stopping at epoch 750. Best Metrics: (0.009327430968813496, 0.0023399014778325124, 0.0055853697157481575)
2026-06-21 04:12:09,136 - optuna.study.study - INFO - Trial 291 finished with values: [0.009327430968813496, 0.0023399014778325124, 0.0055853697157481575] and parameters: {'n_layers': 4, 'embedding_dim': 128, 'lr': 0.0031134216844272773, 'lambda_val': 3.9553958515555e-06, 'batch_size': 1257, 'optimizer': 'Adam'}.
2026-06-21 04:13:20,509 - experiment_functions - INFO - Early stopping at epoch 1650. Best Metrics: (0.010069966530853316, 0.0025814702538840472, 0.0060480388191472756)
2026-06-21 04:13:20,637 - optuna.study.study - INFO - Trial 292 finished with values: [0.010069966530853316, 0.0025814702538840472, 0.0060480388191472756] and parameters: {'n_layers': 4, 'embedding_dim': 64, 'lr': 0.0006101961971381852, 'lambda_val': 0.0017226178103252388, 'batch_size': 3454, 'optimizer': 'RMSprop'}.
2026-06-21 04:14:56,514 - experiment_functions - INFO - Early stopping at epoch 1850. Best Metrics: (0.009808235524250116, 0.0024156877605153466, 0.005859821511799622)
2026-06-21 04:14:56,668 - optuna.study.study - INFO - Trial 293 finished with values: [0.009808235524250116, 0.0024156877605153466, 0.005859821511799622] and parameters: {'n_layers': 3, 'embedding_dim': 256, 'lr': 0.0006101961971381852, 'lambda_val': 1.282312052161098e-05, 'batch_size': 2119, 'optimizer': 'RMSprop'}.
2026-06-21 04:16:24,240 - experiment_functions - INFO - Early stopping at epoch 1950. Best Metrics: (0.011644567688555155, 0.0029209296450675767, 0.007095651287379987)
2026-06-21 04:16:24,346 - optuna.study.study - INFO - Trial 294 finished with values: [0.011644567688555155, 0.0029209296450675767, 0.007095651287379987] and parameters: {'n_layers': 4, 'embedding_dim': 96, 'lr': 0.0006604859729474348, 'lambda_val': 1.282312052161098e-05, 'batch_size': 2187, 'optimizer': 'RMSprop'}.
2026-06-21 04:17:54,338 - experiment_functions - INFO - Early stopping at epoch 2000. Best Metrics: (0.011923500321544904, 0.0029161930023998994, 0.007064473512077883)
2026-06-21 04:17:54,439 - optuna.study.study - INFO - Trial 295 finished with values: [0.011923500321544904, 0.0029161930023998994, 0.007064473512077883] and parameters: {'n_layers': 4, 'embedding_dim': 96, 'lr': 0.0006101961971381852, 'lambda_val': 0.0017226178103252388, 'batch_size': 1653, 'optimizer': 'RMSprop'}.
2026-06-21 04:19:00,482 - experiment_functions - INFO - Early stopping at epoch 1450. Best Metrics: (0.010285287992679751, 0.002605153467222433, 0.006187347595530176)
2026-06-21 04:19:00,623 - optuna.study.study - INFO - Trial 296 finished with values: [0.010285287992679751, 0.002605153467222433, 0.006187347595530176] and parameters: {'n_layers': 4, 'embedding_dim': 96, 'lr': 0.0006604859729474348, 'lambda_val': 0.0017226178103252388, 'batch_size': 2187, 'optimizer': 'RMSprop'}.
2026-06-21 04:21:43,427 - optuna.study.study - INFO - Trial 297 finished with values: [0.011417707171756148, 0.0027377794619173933, 0.007127260739033461] and parameters: {'n_layers': 4, 'embedding_dim': 32, 'lr': 0.0006101961971381852, 'lambda_val': 5.82846385984691e-05, 'batch_size': 1203, 'optimizer': 'Adam'}.
2026-06-21 04:24:27,380 - optuna.study.study - INFO - Trial 298 finished with values: [0.009849540591699695, 0.00242200328407225, 0.006128196107633209] and parameters: {'n_layers': 3, 'embedding_dim': 64, 'lr': 0.0006604859729474348, 'lambda_val': 5.82846385984691e-05, 'batch_size': 1203, 'optimizer': 'Adam'}.
2026-06-21 04:26:08,216 - experiment_functions - INFO - Early stopping at epoch 2250. Best Metrics: (0.009881108289385444, 0.0024630541871921187, 0.006019223230242697)
2026-06-21 04:26:08,320 - optuna.study.study - INFO - Trial 299 finished with values: [0.009881108289385444, 0.0024630541871921187, 0.006019223230242697] and parameters: {'n_layers': 3, 'embedding_dim': 128, 'lr': 0.0006101961971381852, 'lambda_val': 1.1627943650784121e-05, 'batch_size': 2917, 'optimizer': 'RMSprop'}.
2026-06-21 04:26:08,335 - root - INFO - Selected Trial 278 based on Max ndcg: 0.0086
2026-06-21 04:26:08,335 - root - INFO - Associated Recall: 0.0143
2026-06-21 04:26:08,335 - experiment_functions - INFO - Training the best model ... for e_yelp_1c2dcs_strict_rand1
2026-06-21 04:29:06,394 - root - INFO -   **** Training e_yelp_1c2dcs_strict_rand2
2026-06-21 04:29:06,420 - root - INFO -   **** Getting 71258/1274132 random edges
2026-06-21 04:29:06,550 - optuna.storages._rdb.storage - INFO - A new study created in RDB with name: Study_e_yelp_1c2dcs_strict_rand2
2026-06-21 04:30:04,432 - experiment_functions - INFO - Early stopping at epoch 1100. Best Metrics: (0.00857676730433293, 0.002136225843122395, 0.00501191052742682)
2026-06-21 04:30:04,553 - optuna.study.study - INFO - Trial 0 finished with values: [0.00857676730433293, 0.002136225843122395, 0.00501191052742682] and parameters: {'n_layers': 3, 'embedding_dim': 256, 'lr': 0.0008519094805065798, 'lambda_val': 2.7545357777694106e-05, 'batch_size': 3710, 'optimizer': 'RMSprop'}.
2026-06-21 04:30:28,803 - experiment_functions - INFO - Early stopping at epoch 500. Best Metrics: (0.000616038775546164, 0.0001294682329165088, 0.0003109317775924877)
2026-06-21 04:30:28,935 - optuna.study.study - INFO - Trial 1 finished with values: [0.000616038775546164, 0.0001294682329165088, 0.0003109317775924877] and parameters: {'n_layers': 3, 'embedding_dim': 128, 'lr': 0.007382586917044733, 'lambda_val': 4.153587777767473e-06, 'batch_size': 2500, 'optimizer': 'SGD'}.
2026-06-21 04:30:51,149 - experiment_functions - INFO - Early stopping at epoch 500. Best Metrics: (0.0005213906094492149, 0.00011052166224580018, 0.00031747903720595415)
2026-06-21 04:30:51,257 - optuna.study.study - INFO - Trial 2 finished with values: [0.0005213906094492149, 0.00011052166224580018, 0.00031747903720595415] and parameters: {'n_layers': 1, 'embedding_dim': 64, 'lr': 0.0003871730745303722, 'lambda_val': 0.08718647726541941, 'batch_size': 2801, 'optimizer': 'SGD'}.
2026-06-21 04:31:13,215 - experiment_functions - INFO - Early stopping at epoch 500. Best Metrics: (0.00046494040689932034, 0.00011525830491347733, 0.0003054798819479411)
2026-06-21 04:31:13,335 - optuna.study.study - INFO - Trial 3 finished with values: [0.00046494040689932034, 0.00011525830491347733, 0.0003054798819479411] and parameters: {'n_layers': 2, 'embedding_dim': 32, 'lr': 3.0285323139714177e-05, 'lambda_val': 0.0002448366058954655, 'batch_size': 1834, 'optimizer': 'SGD'}.
2026-06-21 04:32:05,052 - experiment_functions - INFO - Early stopping at epoch 1200. Best Metrics: (0.007677986477039241, 0.00188360490084628, 0.004752694723316957)
2026-06-21 04:32:05,154 - optuna.study.study - INFO - Trial 4 finished with values: [0.007677986477039241, 0.00188360490084628, 0.004752694723316957] and parameters: {'n_layers': 2, 'embedding_dim': 64, 'lr': 0.0018169040651244567, 'lambda_val': 5.103203231486004e-06, 'batch_size': 2370, 'optimizer': 'RMSprop'}.
2026-06-21 04:32:37,459 - experiment_functions - INFO - Early stopping at epoch 550. Best Metrics: (0.0043130465627601, 0.0010736390046734874, 0.0027056413233468185)
2026-06-21 04:32:37,603 - optuna.study.study - INFO - Trial 5 finished with values: [0.0043130465627601, 0.0010736390046734874, 0.0027056413233468185] and parameters: {'n_layers': 4, 'embedding_dim': 256, 'lr': 0.07294118006318792, 'lambda_val': 1.066568166630351e-06, 'batch_size': 862, 'optimizer': 'RMSprop'}.
2026-06-21 04:33:43,650 - experiment_functions - INFO - Early stopping at epoch 1500. Best Metrics: (0.008644323814001945, 0.0021851711506883915, 0.005267338099579674)
2026-06-21 04:33:43,753 - optuna.study.study - INFO - Trial 6 finished with values: [0.008644323814001945, 0.0021851711506883915, 0.005267338099579674] and parameters: {'n_layers': 3, 'embedding_dim': 96, 'lr': 0.0014018982084487695, 'lambda_val': 0.0018148423298626976, 'batch_size': 745, 'optimizer': 'Adam'}.
2026-06-21 04:34:07,237 - experiment_functions - INFO - Early stopping at epoch 500. Best Metrics: (0.0005877521883659086, 0.0001278893520272831, 0.00031156985332492525)
2026-06-21 04:34:08,158 - optuna.study.study - INFO - Trial 7 finished with values: [0.0005877521883659086, 0.0001278893520272831, 0.00031156985332492525] and parameters: {'n_layers': 3, 'embedding_dim': 96, 'lr': 0.0016838259888467748, 'lambda_val': 2.2595071410094373e-06, 'batch_size': 1037, 'optimizer': 'SGD'}.
2026-06-21 04:34:36,845 - experiment_functions - INFO - Early stopping at epoch 550. Best Metrics: (0.004242230297547457, 0.001043640267778199, 0.0024543248698907652)
2026-06-21 04:34:36,958 - optuna.study.study - INFO - Trial 8 finished with values: [0.004242230297547457, 0.001043640267778199, 0.0024543248698907652] and parameters: {'n_layers': 2, 'embedding_dim': 256, 'lr': 0.01649421420978625, 'lambda_val': 0.0016838745075427083, 'batch_size': 1721, 'optimizer': 'Adam'}.
2026-06-21 04:35:03,916 - experiment_functions - INFO - Early stopping at epoch 600. Best Metrics: (0.003720508522427511, 0.0009568018188707845, 0.0022953540887545552)
2026-06-21 04:35:04,017 - optuna.study.study - INFO - Trial 9 finished with values: [0.003720508522427511, 0.0009568018188707845, 0.0022953540887545552] and parameters: {'n_layers': 2, 'embedding_dim': 64, 'lr': 0.02817793678705923, 'lambda_val': 8.006464807509142e-06, 'batch_size': 764, 'optimizer': 'RMSprop'}.
2026-06-21 04:35:55,866 - experiment_functions - INFO - Early stopping at epoch 1150. Best Metrics: (0.000557316507789433, 0.0001152583049134773, 0.00027638067931100356)
2026-06-21 04:35:55,970 - optuna.study.study - INFO - Trial 10 finished with values: [0.000557316507789433, 0.0001152583049134773, 0.00027638067931100356] and parameters: {'n_layers': 3, 'embedding_dim': 128, 'lr': 0.09695435688870431, 'lambda_val': 0.007692993354694891, 'batch_size': 1041, 'optimizer': 'SGD'}.
2026-06-21 04:38:36,524 - optuna.study.study - INFO - Trial 11 finished with values: [0.000994725820058616, 0.00023841101427308326, 0.000572892521611221] and parameters: {'n_layers': 2, 'embedding_dim': 64, 'lr': 0.00020716276364902874, 'lambda_val': 5.002051797943159e-06, 'batch_size': 1051, 'optimizer': 'Adam'}.
2026-06-21 04:39:05,355 - experiment_functions - INFO - Early stopping at epoch 500. Best Metrics: (0.0006620647776025794, 0.00014052039914108882, 0.00037943028078687015)
2026-06-21 04:39:05,473 - optuna.study.study - INFO - Trial 12 finished with values: [0.0006620647776025794, 0.00014052039914108882, 0.00037943028078687015] and parameters: {'n_layers': 4, 'embedding_dim': 256, 'lr': 0.00013503577039836358, 'lambda_val': 1.465244173453917e-05, 'batch_size': 2653, 'optimizer': 'SGD'}.
2026-06-21 04:39:49,482 - experiment_functions - INFO - Early stopping at epoch 950. Best Metrics: (0.0005670054777692778, 0.00012788935202728306, 0.0002935324534226953)
2026-06-21 04:39:49,586 - optuna.study.study - INFO - Trial 13 finished with values: [0.0005670054777692778, 0.00012788935202728306, 0.0002935324534226953] and parameters: {'n_layers': 1, 'embedding_dim': 256, 'lr': 1.3827742792393235e-05, 'lambda_val': 5.3909841529157034e-06, 'batch_size': 1204, 'optimizer': 'RMSprop'}.
2026-06-21 04:40:13,811 - experiment_functions - INFO - Early stopping at epoch 500. Best Metrics: (0.00055240776925509, 0.00011367942402425163, 0.0003158043388287602)
2026-06-21 04:40:13,914 - optuna.study.study - INFO - Trial 14 finished with values: [0.00055240776925509, 0.00011367942402425163, 0.0003158043388287602] and parameters: {'n_layers': 1, 'embedding_dim': 256, 'lr': 0.00040003905632081377, 'lambda_val': 0.0003330305178129725, 'batch_size': 3252, 'optimizer': 'SGD'}.
2026-06-21 04:40:51,034 - experiment_functions - INFO - Early stopping at epoch 900. Best Metrics: (0.000609487776695725, 0.00012946823291650877, 0.0003263131112153036)
2026-06-21 04:40:51,138 - optuna.study.study - INFO - Trial 15 finished with values: [0.000609487776695725, 0.00012946823291650877, 0.0003263131112153036] and parameters: {'n_layers': 3, 'embedding_dim': 32, 'lr': 0.06502134465914547, 'lambda_val': 1.1881846107033085e-05, 'batch_size': 2756, 'optimizer': 'SGD'}.
2026-06-21 04:41:17,731 - experiment_functions - INFO - Early stopping at epoch 550. Best Metrics: (0.007325158013142501, 0.0017604521914866742, 0.004241262936805444)
2026-06-21 04:41:17,864 - optuna.study.study - INFO - Trial 16 finished with values: [0.007325158013142501, 0.0017604521914866742, 0.004241262936805444] and parameters: {'n_layers': 4, 'embedding_dim': 96, 'lr': 0.01090856583081859, 'lambda_val': 0.0003995223661719565, 'batch_size': 3537, 'optimizer': 'Adam'}.
2026-06-21 04:41:39,567 - experiment_functions - INFO - Early stopping at epoch 500. Best Metrics: (0.0004965696095847542, 0.00011999494758115448, 0.0002618874830618563)
2026-06-21 04:41:39,682 - optuna.study.study - INFO - Trial 17 finished with values: [0.0004965696095847542, 0.00011999494758115448, 0.0002618874830618563] and parameters: {'n_layers': 1, 'embedding_dim': 32, 'lr': 3.061267030261136e-05, 'lambda_val': 0.0036590896543162487, 'batch_size': 3188, 'optimizer': 'RMSprop'}.
2026-06-21 04:44:19,888 - optuna.study.study - INFO - Trial 18 finished with values: [0.008742724186266598, 0.0021709612226853605, 0.005261586624898042] and parameters: {'n_layers': 3, 'embedding_dim': 32, 'lr': 0.0005833059494809122, 'lambda_val': 0.00518549080589865, 'batch_size': 2856, 'optimizer': 'Adam'}.
2026-06-21 04:44:43,833 - experiment_functions - INFO - Early stopping at epoch 500. Best Metrics: (0.000541697699536757, 0.0001294682329165088, 0.00028934631941560617)
2026-06-21 04:44:43,938 - optuna.study.study - INFO - Trial 19 finished with values: [0.000541697699536757, 0.0001294682329165088, 0.00028934631941560617] and parameters: {'n_layers': 1, 'embedding_dim': 256, 'lr': 0.0005026415522479564, 'lambda_val': 0.00014503632394965746, 'batch_size': 2727, 'optimizer': 'SGD'}.
2026-06-21 04:45:14,293 - experiment_functions - INFO - Early stopping at epoch 650. Best Metrics: (0.007411423330955932, 0.0018172919034988005, 0.004470402139588516)
2026-06-21 04:45:14,607 - optuna.study.study - INFO - Trial 20 finished with values: [0.007411423330955932, 0.0018172919034988005, 0.004470402139588516] and parameters: {'n_layers': 3, 'embedding_dim': 96, 'lr': 0.0038927780539963937, 'lambda_val': 2.362873378234334e-06, 'batch_size': 3841, 'optimizer': 'Adam'}.
2026-06-21 04:46:00,435 - experiment_functions - INFO - Early stopping at epoch 1100. Best Metrics: (0.003081221206450109, 0.00084785903751421, 0.001707121373156578)
2026-06-21 04:46:00,545 - optuna.study.study - INFO - Trial 21 finished with values: [0.003081221206450109, 0.00084785903751421, 0.001707121373156578] and parameters: {'n_layers': 4, 'embedding_dim': 32, 'lr': 0.0013367871012247433, 'lambda_val': 0.0846423345395031, 'batch_size': 1183, 'optimizer': 'RMSprop'}.
2026-06-21 04:47:19,244 - experiment_functions - INFO - Early stopping at epoch 1750. Best Metrics: (0.0006726505445982548, 0.00013736263736263736, 0.000394804388320064)
2026-06-21 04:47:19,398 - optuna.study.study - INFO - Trial 22 finished with values: [0.0006726505445982548, 0.00013736263736263736, 0.000394804388320064] and parameters: {'n_layers': 1, 'embedding_dim': 256, 'lr': 1.0234659635836661e-05, 'lambda_val': 0.007752543237354327, 'batch_size': 3083, 'optimizer': 'RMSprop'}.
2026-06-21 04:48:06,645 - experiment_functions - INFO - Early stopping at epoch 1050. Best Metrics: (0.00046634466839087075, 0.00011052166224580018, 0.00026768932443907895)
2026-06-21 04:48:06,757 - optuna.study.study - INFO - Trial 23 finished with values: [0.00046634466839087075, 0.00011052166224580018, 0.00026768932443907895] and parameters: {'n_layers': 3, 'embedding_dim': 128, 'lr': 0.06491614472050519, 'lambda_val': 1.3738550108601896e-06, 'batch_size': 1362, 'optimizer': 'SGD'}.
2026-06-21 04:48:31,054 - experiment_functions - INFO - Early stopping at epoch 500. Best Metrics: (0.0004280503344707188, 0.00011525830491347733, 0.0002248698086624711)
2026-06-21 04:48:31,206 - optuna.study.study - INFO - Trial 24 finished with values: [0.0004280503344707188, 0.00011525830491347733, 0.0002248698086624711] and parameters: {'n_layers': 4, 'embedding_dim': 96, 'lr': 0.08767044029347149, 'lambda_val': 7.00105691479651e-06, 'batch_size': 2147, 'optimizer': 'SGD'}.
2026-06-21 04:51:05,457 - experiment_functions - INFO - Early stopping at epoch 3700. Best Metrics: (0.004811841271696961, 0.0010673234811165847, 0.002908731270000716)
2026-06-21 04:51:05,606 - optuna.study.study - INFO - Trial 25 finished with values: [0.004811841271696961, 0.0010673234811165847, 0.002908731270000716] and parameters: {'n_layers': 1, 'embedding_dim': 128, 'lr': 0.0005979572889171791, 'lambda_val': 7.876464964197065e-06, 'batch_size': 3804, 'optimizer': 'RMSprop'}.
2026-06-21 04:53:50,859 - optuna.study.study - INFO - Trial 26 finished with values: [0.0041120348220420756, 0.0009741695086522673, 0.0025272642270725335] and parameters: {'n_layers': 2, 'embedding_dim': 96, 'lr': 0.0004317731637144049, 'lambda_val': 0.004562972374668912, 'batch_size': 1493, 'optimizer': 'Adam'}.
2026-06-21 04:54:16,949 - experiment_functions - INFO - Early stopping at epoch 600. Best Metrics: (0.0025478450576373697, 0.0005699760010104838, 0.0014635209083046087)
2026-06-21 04:54:17,054 - optuna.study.study - INFO - Trial 27 finished with values: [0.0025478450576373697, 0.0005699760010104838, 0.0014635209083046087] and parameters: {'n_layers': 1, 'embedding_dim': 64, 'lr': 0.05071971167749316, 'lambda_val': 2.228641586515842e-05, 'batch_size': 2998, 'optimizer': 'RMSprop'}.
2026-06-21 04:54:39,480 - experiment_functions - INFO - Early stopping at epoch 500. Best Metrics: (0.0005540753546038609, 0.00011210054313502589, 0.0003061969574284312)
2026-06-21 04:54:39,607 - optuna.study.study - INFO - Trial 28 finished with values: [0.0005540753546038609, 0.00011210054313502589, 0.0003061969574284312] and parameters: {'n_layers': 1, 'embedding_dim': 128, 'lr': 0.0005057243861690739, 'lambda_val': 9.568984564164275e-05, 'batch_size': 1107, 'optimizer': 'SGD'}.
2026-06-21 04:55:03,327 - experiment_functions - INFO - Early stopping at epoch 550. Best Metrics: (0.0024719215671984225, 0.0005289250978906152, 0.0013915556915746494)
2026-06-21 04:55:03,431 - optuna.study.study - INFO - Trial 29 finished with values: [0.0024719215671984225, 0.0005289250978906152, 0.0013915556915746494] and parameters: {'n_layers': 1, 'embedding_dim': 32, 'lr': 0.023235337257996553, 'lambda_val': 0.007049981299764024, 'batch_size': 3851, 'optimizer': 'Adam'}.
2026-06-21 04:55:25,750 - experiment_functions - INFO - Early stopping at epoch 500. Best Metrics: (0.0003303203531910646, 8.525956801818871e-05, 0.00018945605235065363)
