2026-06-23 14:54:29,284 - optuna.study.study - INFO - Trial 105 finished with values: [0.006467889655322925, 0.001439939370973854, 0.003645626131275052] and parameters: {'n_layers': 4, 'embedding_dim': 256, 'lr': 0.036271346599532954, 'lambda_val': 0.0004020367653384255, 'batch_size': 3812, 'optimizer': 'Adam'}.
2026-06-23 14:57:49,164 - optuna.study.study - INFO - Trial 106 finished with values: [0.0233315306306637, 0.004927687255273462, 0.012856535348792351] and parameters: {'n_layers': 4, 'embedding_dim': 96, 'lr': 0.00030878795427160974, 'lambda_val': 1.939500800821711e-06, 'batch_size': 3860, 'optimizer': 'Adam'}.
2026-06-23 14:58:26,116 - experiment_functions - INFO - Early stopping at epoch 850. Best Metrics: (0.003346863859425484, 0.0007215485663761526, 0.001896624548446006)
2026-06-23 14:58:26,188 - optuna.study.study - INFO - Trial 107 finished with values: [0.003346863859425484, 0.0007215485663761526, 0.001896624548446006] and parameters: {'n_layers': 2, 'embedding_dim': 32, 'lr': 0.09496399878237523, 'lambda_val': 0.03597446195855276, 'batch_size': 3911, 'optimizer': 'RMSprop'}.
2026-06-23 14:59:04,272 - experiment_functions - INFO - Early stopping at epoch 850. Best Metrics: (0.030108905695522867, 0.006386573196918025, 0.017326794964647396)
2026-06-23 14:59:04,361 - optuna.study.study - INFO - Trial 108 finished with values: [0.030108905695522867, 0.006386573196918025, 0.017326794964647396] and parameters: {'n_layers': 1, 'embedding_dim': 64, 'lr': 0.003327046285057053, 'lambda_val': 0.00047222048784128004, 'batch_size': 1712, 'optimizer': 'Adam'}.
2026-06-23 14:59:41,386 - experiment_functions - INFO - Early stopping at epoch 700. Best Metrics: (0.029681403113091014, 0.006342364532019705, 0.017134154280936988)
2026-06-23 14:59:41,455 - optuna.study.study - INFO - Trial 109 finished with values: [0.029681403113091014, 0.006342364532019705, 0.017134154280936988] and parameters: {'n_layers': 1, 'embedding_dim': 256, 'lr': 0.003327046285057053, 'lambda_val': 0.00047222048784128004, 'batch_size': 3498, 'optimizer': 'Adam'}.
2026-06-23 15:00:16,463 - experiment_functions - INFO - Early stopping at epoch 550. Best Metrics: (0.004982897039640887, 0.001087848932676519, 0.0028381549790396127)
2026-06-23 15:00:16,545 - optuna.study.study - INFO - Trial 110 finished with values: [0.004982897039640887, 0.001087848932676519, 0.0028381549790396127] and parameters: {'n_layers': 3, 'embedding_dim': 256, 'lr': 0.04860527005399841, 'lambda_val': 0.00011941284348716088, 'batch_size': 1972, 'optimizer': 'RMSprop'}.
2026-06-23 15:00:41,331 - experiment_functions - INFO - Early stopping at epoch 500. Best Metrics: (0.0005529336386998583, 0.00011525830491347733, 0.0002975628808777501)
2026-06-23 15:00:41,422 - optuna.study.study - INFO - Trial 111 finished with values: [0.0005529336386998583, 0.00011525830491347733, 0.0002975628808777501] and parameters: {'n_layers': 4, 'embedding_dim': 64, 'lr': 0.00011634190552068439, 'lambda_val': 0.03666767151955104, 'batch_size': 2026, 'optimizer': 'RMSprop'}.
2026-06-23 15:01:35,678 - experiment_functions - INFO - Early stopping at epoch 800. Best Metrics: (0.011729102550317385, 0.0025498926360995326, 0.006355737152799133)
2026-06-23 15:01:35,809 - optuna.study.study - INFO - Trial 112 finished with values: [0.011729102550317385, 0.0025498926360995326, 0.006355737152799133] and parameters: {'n_layers': 4, 'embedding_dim': 256, 'lr': 0.000639302768855693, 'lambda_val': 0.002247784905654037, 'batch_size': 1936, 'optimizer': 'RMSprop'}.
2026-06-23 15:03:15,976 - experiment_functions - INFO - Early stopping at epoch 2100. Best Metrics: (0.009621261787720364, 0.002036756347101175, 0.0053789862718849266)
2026-06-23 15:03:16,056 - optuna.study.study - INFO - Trial 113 finished with values: [0.009621261787720364, 0.002036756347101175, 0.0053789862718849266] and parameters: {'n_layers': 3, 'embedding_dim': 96, 'lr': 0.004663972138797954, 'lambda_val': 0.00011941284348716088, 'batch_size': 3839, 'optimizer': 'RMSprop'}.
2026-06-23 15:03:43,801 - experiment_functions - INFO - Early stopping at epoch 550. Best Metrics: (0.007219067814197154, 0.0015457243905519769, 0.0038807689228129573)
2026-06-23 15:03:43,942 - optuna.study.study - INFO - Trial 114 finished with values: [0.007219067814197154, 0.0015457243905519769, 0.0038807689228129573] and parameters: {'n_layers': 2, 'embedding_dim': 128, 'lr': 0.04824394736006866, 'lambda_val': 0.0003394744400325674, 'batch_size': 2166, 'optimizer': 'Adam'}.
2026-06-23 15:07:02,306 - experiment_functions - INFO - Early stopping at epoch 3800. Best Metrics: (0.008607010039981697, 0.00178413540482506, 0.004590504893990879)
2026-06-23 15:07:02,400 - optuna.study.study - INFO - Trial 115 finished with values: [0.008607010039981697, 0.00178413540482506, 0.004590504893990879] and parameters: {'n_layers': 4, 'embedding_dim': 128, 'lr': 0.003327046285057053, 'lambda_val': 1.3181910980565608e-05, 'batch_size': 1087, 'optimizer': 'Adam'}.
2026-06-23 15:07:28,719 - experiment_functions - INFO - Early stopping at epoch 550. Best Metrics: (0.006313140744795904, 0.0013973095869647594, 0.003549942917130075)
2026-06-23 15:07:28,808 - optuna.study.study - INFO - Trial 116 finished with values: [0.006313140744795904, 0.0013973095869647594, 0.003549942917130075] and parameters: {'n_layers': 1, 'embedding_dim': 128, 'lr': 0.06165385340227955, 'lambda_val': 0.0009179871154727713, 'batch_size': 2944, 'optimizer': 'Adam'}.
2026-06-23 15:09:06,354 - experiment_functions - INFO - Early stopping at epoch 2250. Best Metrics: (0.007332357438333914, 0.0015678287230011369, 0.004116564193553772)
2026-06-23 15:09:06,461 - optuna.study.study - INFO - Trial 117 finished with values: [0.007332357438333914, 0.0015678287230011369, 0.004116564193553772] and parameters: {'n_layers': 2, 'embedding_dim': 64, 'lr': 0.09496399878237523, 'lambda_val': 0.0045842802504681, 'batch_size': 1707, 'optimizer': 'RMSprop'}.
2026-06-23 15:12:10,121 - optuna.study.study - INFO - Trial 118 finished with values: [0.010450334273147545, 0.002393583428066187, 0.006054397739588142] and parameters: {'n_layers': 4, 'embedding_dim': 64, 'lr': 0.00011634190552068439, 'lambda_val': 0.00011941284348716088, 'batch_size': 3896, 'optimizer': 'RMSprop'}.
2026-06-23 15:13:03,403 - experiment_functions - INFO - Early stopping at epoch 1150. Best Metrics: (0.009156623134829945, 0.0019420234937476317, 0.005035870225703862)
2026-06-23 15:13:03,497 - optuna.study.study - INFO - Trial 119 finished with values: [0.009156623134829945, 0.0019420234937476317, 0.005035870225703862] and parameters: {'n_layers': 3, 'embedding_dim': 64, 'lr': 0.003327046285057053, 'lambda_val': 0.0001513133030511212, 'batch_size': 3839, 'optimizer': 'RMSprop'}.
2026-06-23 15:16:06,543 - optuna.study.study - INFO - Trial 120 finished with values: [0.0055699134515752174, 0.001343627636731085, 0.0033653857624703206] and parameters: {'n_layers': 4, 'embedding_dim': 64, 'lr': 0.00011634190552068439, 'lambda_val': 0.00011941284348716088, 'batch_size': 1598, 'optimizer': 'Adam'}.
2026-06-23 15:16:52,555 - experiment_functions - INFO - Early stopping at epoch 1000. Best Metrics: (0.023988857570896888, 0.005033472274851587, 0.01415667496440684)
2026-06-23 15:16:52,637 - optuna.study.study - INFO - Trial 121 finished with values: [0.023988857570896888, 0.005033472274851587, 0.01415667496440684] and parameters: {'n_layers': 2, 'embedding_dim': 64, 'lr': 0.0012272605990543274, 'lambda_val': 1.3510549852958501e-06, 'batch_size': 3839, 'optimizer': 'RMSprop'}.
2026-06-23 15:20:21,501 - optuna.study.study - INFO - Trial 122 finished with values: [0.013679377952856054, 0.003138815207780725, 0.007964525935916594] and parameters: {'n_layers': 4, 'embedding_dim': 128, 'lr': 0.00011634190552068439, 'lambda_val': 0.00011941284348716088, 'batch_size': 3896, 'optimizer': 'RMSprop'}.
2026-06-23 15:23:30,905 - optuna.study.study - INFO - Trial 123 finished with values: [0.026866818466755215, 0.005863963622584312, 0.015463845819734364] and parameters: {'n_layers': 2, 'embedding_dim': 128, 'lr': 0.00030878795427160974, 'lambda_val': 0.00039901786521084486, 'batch_size': 2166, 'optimizer': 'RMSprop'}.
2026-06-23 15:24:03,740 - experiment_functions - INFO - Early stopping at epoch 750. Best Metrics: (0.01143644085598814, 0.0024425287356321843, 0.006436602369739621)
2026-06-23 15:24:03,826 - optuna.study.study - INFO - Trial 124 finished with values: [0.01143644085598814, 0.0024425287356321843, 0.006436602369739621] and parameters: {'n_layers': 1, 'embedding_dim': 32, 'lr': 0.019126237813714465, 'lambda_val': 4.186128358230714e-06, 'batch_size': 2159, 'optimizer': 'RMSprop'}.
2026-06-23 15:26:48,236 - optuna.study.study - INFO - Trial 125 finished with values: [0.028422657571414853, 0.00611184792219275, 0.016570869924916836] and parameters: {'n_layers': 1, 'embedding_dim': 32, 'lr': 0.000639302768855693, 'lambda_val': 0.0010458111611348288, 'batch_size': 2159, 'optimizer': 'RMSprop'}.
2026-06-23 15:27:16,063 - experiment_functions - INFO - Early stopping at epoch 550. Best Metrics: (0.0076313661013645865, 0.001645193886573197, 0.004325001268318079)
2026-06-23 15:27:16,154 - optuna.study.study - INFO - Trial 126 finished with values: [0.0076313661013645865, 0.001645193886573197, 0.004325001268318079] and parameters: {'n_layers': 2, 'embedding_dim': 128, 'lr': 0.04824394736006866, 'lambda_val': 4.6275505465924135e-05, 'batch_size': 2166, 'optimizer': 'Adam'}.
2026-06-23 15:27:47,013 - experiment_functions - INFO - Early stopping at epoch 550. Best Metrics: (0.002653700860932981, 0.0005115574081091324, 0.001513963795834822)
2026-06-23 15:27:47,151 - optuna.study.study - INFO - Trial 127 finished with values: [0.002653700860932981, 0.0005115574081091324, 0.001513963795834822] and parameters: {'n_layers': 4, 'embedding_dim': 128, 'lr': 0.06165385340227955, 'lambda_val': 0.018295822868802665, 'batch_size': 1598, 'optimizer': 'Adam'}.
2026-06-23 15:30:32,572 - experiment_functions - INFO - Early stopping at epoch 3650. Best Metrics: (0.020653998503368638, 0.00450454717696097, 0.011347072615919844)
2026-06-23 15:30:32,681 - optuna.study.study - INFO - Trial 128 finished with values: [0.020653998503368638, 0.00450454717696097, 0.011347072615919844] and parameters: {'n_layers': 3, 'embedding_dim': 64, 'lr': 0.00030878795427160974, 'lambda_val': 0.0045842802504681, 'batch_size': 3839, 'optimizer': 'Adam'}.
2026-06-23 15:33:12,687 - experiment_functions - INFO - Early stopping at epoch 3600. Best Metrics: (0.005697233286973303, 0.0012788935202728306, 0.0031946670950846836)
2026-06-23 15:33:12,774 - optuna.study.study - INFO - Trial 129 finished with values: [0.005697233286973303, 0.0012788935202728306, 0.0031946670950846836] and parameters: {'n_layers': 3, 'embedding_dim': 64, 'lr': 0.013381304939649, 'lambda_val': 0.0045842802504681, 'batch_size': 3839, 'optimizer': 'RMSprop'}.
2026-06-23 15:36:17,146 - experiment_functions - INFO - Early stopping at epoch 3950. Best Metrics: (0.022783918913872003, 0.004981369205507137, 0.012789969463333259)
2026-06-23 15:36:17,232 - optuna.study.study - INFO - Trial 130 finished with values: [0.022783918913872003, 0.004981369205507137, 0.012789969463333259] and parameters: {'n_layers': 4, 'embedding_dim': 64, 'lr': 0.00030878795427160974, 'lambda_val': 0.0007225520628850989, 'batch_size': 2797, 'optimizer': 'Adam'}.
2026-06-23 15:36:48,020 - experiment_functions - INFO - Early stopping at epoch 700. Best Metrics: (0.0005159050472274358, 0.00012631047113805733, 0.00028697987572143306)
2026-06-23 15:36:48,096 - optuna.study.study - INFO - Trial 131 finished with values: [0.0005159050472274358, 0.00012631047113805733, 0.00028697987572143306] and parameters: {'n_layers': 1, 'embedding_dim': 64, 'lr': 9.54878627627061e-05, 'lambda_val': 0.0045842802504681, 'batch_size': 2143, 'optimizer': 'RMSprop'}.
2026-06-23 15:37:22,120 - experiment_functions - INFO - Early stopping at epoch 750. Best Metrics: (0.004480427490499216, 0.0009473285335354301, 0.002539531854502427)
2026-06-23 15:37:22,972 - optuna.study.study - INFO - Trial 132 finished with values: [0.004480427490499216, 0.0009473285335354301, 0.002539531854502427] and parameters: {'n_layers': 4, 'embedding_dim': 32, 'lr': 0.025635014530483304, 'lambda_val': 0.002247784905654037, 'batch_size': 3988, 'optimizer': 'Adam'}.
2026-06-23 15:39:25,845 - experiment_functions - INFO - Early stopping at epoch 2050. Best Metrics: (0.00062836130405186, 0.00013578375647341166, 0.0003205943044588923)
2026-06-23 15:39:25,945 - optuna.study.study - INFO - Trial 133 finished with values: [0.00062836130405186, 0.00013578375647341166, 0.0003205943044588923] and parameters: {'n_layers': 3, 'embedding_dim': 256, 'lr': 4.764351038777566e-05, 'lambda_val': 0.00022486365877128186, 'batch_size': 1712, 'optimizer': 'Adam'}.
2026-06-23 15:41:39,355 - experiment_functions - INFO - Early stopping at epoch 2650. Best Metrics: (0.026137462070408655, 0.005428192497158015, 0.01446862011627007)
2026-06-23 15:41:39,430 - optuna.study.study - INFO - Trial 134 finished with values: [0.026137462070408655, 0.005428192497158015, 0.01446862011627007] and parameters: {'n_layers': 3, 'embedding_dim': 128, 'lr': 0.000639302768855693, 'lambda_val': 4.6275505465924135e-05, 'batch_size': 1456, 'optimizer': 'Adam'}.
2026-06-23 15:44:37,986 - optuna.study.study - INFO - Trial 135 finished with values: [0.03518708632115262, 0.0072960085891120375, 0.020063050119950188] and parameters: {'n_layers': 1, 'embedding_dim': 128, 'lr': 0.0007593562994788473, 'lambda_val': 0.00047222048784128004, 'batch_size': 2944, 'optimizer': 'Adam'}.
2026-06-23 15:48:07,640 - optuna.study.study - INFO - Trial 136 finished with values: [0.02133596421102441, 0.004739800429455603, 0.012333064000750585] and parameters: {'n_layers': 4, 'embedding_dim': 128, 'lr': 0.00017541467013151027, 'lambda_val': 0.00047222048784128004, 'batch_size': 2544, 'optimizer': 'RMSprop'}.
2026-06-23 15:49:08,446 - experiment_functions - INFO - Early stopping at epoch 1300. Best Metrics: (0.008778153332205928, 0.001818870784388026, 0.004851751916188243)
2026-06-23 15:49:08,536 - optuna.study.study - INFO - Trial 137 finished with values: [0.008778153332205928, 0.001818870784388026, 0.004851751916188243] and parameters: {'n_layers': 4, 'embedding_dim': 64, 'lr': 0.005431509057842341, 'lambda_val': 0.00011941284348716088, 'batch_size': 3896, 'optimizer': 'RMSprop'}.
2026-06-23 15:49:37,287 - experiment_functions - INFO - Early stopping at epoch 550. Best Metrics: (0.010739668615919518, 0.0023177971453833524, 0.005998419632209333)
2026-06-23 15:49:37,373 - optuna.study.study - INFO - Trial 138 finished with values: [0.010739668615919518, 0.0023177971453833524, 0.005998419632209333] and parameters: {'n_layers': 1, 'embedding_dim': 256, 'lr': 0.039166761633308914, 'lambda_val': 0.00011941284348716088, 'batch_size': 3896, 'optimizer': 'Adam'}.
2026-06-23 15:52:37,433 - optuna.study.study - INFO - Trial 139 finished with values: [0.025340192241296116, 0.005502399898951623, 0.014315595682756088] and parameters: {'n_layers': 3, 'embedding_dim': 64, 'lr': 0.00030878795427160974, 'lambda_val': 0.00047222048784128004, 'batch_size': 3350, 'optimizer': 'Adam'}.
2026-06-23 15:55:07,393 - experiment_functions - INFO - Early stopping at epoch 3300. Best Metrics: (0.01013245343020132, 0.0021157003915624607, 0.005633271546236497)
2026-06-23 15:55:07,469 - optuna.study.study - INFO - Trial 140 finished with values: [0.01013245343020132, 0.0021157003915624607, 0.005633271546236497] and parameters: {'n_layers': 4, 'embedding_dim': 64, 'lr': 0.003327046285057053, 'lambda_val': 3.851007859964855e-06, 'batch_size': 2544, 'optimizer': 'RMSprop'}.
2026-06-23 15:55:33,749 - experiment_functions - INFO - Early stopping at epoch 550. Best Metrics: (0.005491265726246812, 0.0012662624731590252, 0.0031492438482445327)
2026-06-23 15:55:33,850 - optuna.study.study - INFO - Trial 141 finished with values: [0.005491265726246812, 0.0012662624731590252, 0.0031492438482445327] and parameters: {'n_layers': 3, 'embedding_dim': 64, 'lr': 0.09496399878237523, 'lambda_val': 0.00018544932893785581, 'batch_size': 1962, 'optimizer': 'Adam'}.
2026-06-23 15:58:15,094 - optuna.study.study - INFO - Trial 142 finished with values: [0.0007133647179592612, 0.00014525704180876593, 0.0003568207280545176] and parameters: {'n_layers': 1, 'embedding_dim': 64, 'lr': 0.0001895879868332347, 'lambda_val': 0.0009179871154727713, 'batch_size': 1712, 'optimizer': 'RMSprop'}.
2026-06-23 16:01:42,593 - optuna.study.study - INFO - Trial 143 finished with values: [0.012954258149680035, 0.00296355942907667, 0.007484282425230443] and parameters: {'n_layers': 4, 'embedding_dim': 128, 'lr': 0.00011634190552068439, 'lambda_val': 0.0009179871154727713, 'batch_size': 2944, 'optimizer': 'RMSprop'}.
2026-06-23 16:03:04,471 - experiment_functions - INFO - Early stopping at epoch 2050. Best Metrics: (0.0006792238604908997, 0.00014525704180876596, 0.00037024686364381913)
2026-06-23 16:03:04,551 - optuna.study.study - INFO - Trial 144 finished with values: [0.0006792238604908997, 0.00014525704180876596, 0.00037024686364381913] and parameters: {'n_layers': 1, 'embedding_dim': 32, 'lr': 0.0001783964653869429, 'lambda_val': 0.0009179871154727713, 'batch_size': 2066, 'optimizer': 'RMSprop'}.
2026-06-23 16:03:33,066 - experiment_functions - INFO - Early stopping at epoch 550. Best Metrics: (0.0030737963828866705, 0.0007041808765946697, 0.0017984721954943782)
2026-06-23 16:03:33,156 - optuna.study.study - INFO - Trial 145 finished with values: [0.0030737963828866705, 0.0007041808765946697, 0.0017984721954943782] and parameters: {'n_layers': 3, 'embedding_dim': 128, 'lr': 0.003327046285057053, 'lambda_val': 0.06128628967549053, 'batch_size': 1598, 'optimizer': 'RMSprop'}.
2026-06-23 16:05:06,580 - experiment_functions - INFO - Early stopping at epoch 2200. Best Metrics: (0.005048094052170439, 0.001065744600227359, 0.0027930254254744623)
2026-06-23 16:05:06,663 - optuna.study.study - INFO - Trial 146 finished with values: [0.005048094052170439, 0.001065744600227359, 0.0027930254254744623] and parameters: {'n_layers': 4, 'embedding_dim': 32, 'lr': 0.058972767143000024, 'lambda_val': 0.0045842802504681, 'batch_size': 1717, 'optimizer': 'RMSprop'}.
2026-06-23 16:06:39,654 - experiment_functions - INFO - Early stopping at epoch 2050. Best Metrics: (0.03392094582051718, 0.007084438549955791, 0.019552233727010083)
2026-06-23 16:06:39,702 - optuna.study.study - INFO - Trial 147 finished with values: [0.03392094582051718, 0.007084438549955791, 0.019552233727010083] and parameters: {'n_layers': 1, 'embedding_dim': 128, 'lr': 0.0012272605990543274, 'lambda_val': 0.00047222048784128004, 'batch_size': 2143, 'optimizer': 'Adam'}.
2026-06-23 16:10:39,971 - optuna.study.study - INFO - Trial 148 finished with values: [0.02350391196820215, 0.0051550461033219655, 0.013203678147006622] and parameters: {'n_layers': 3, 'embedding_dim': 256, 'lr': 0.00022260990801817692, 'lambda_val': 1.601691176310597e-05, 'batch_size': 3812, 'optimizer': 'Adam'}.
2026-06-23 16:11:05,492 - experiment_functions - INFO - Early stopping at epoch 550. Best Metrics: (0.0005463064105606606, 0.00012473159024883166, 0.00029912183694850503)
2026-06-23 16:11:05,579 - optuna.study.study - INFO - Trial 149 finished with values: [0.0005463064105606606, 0.00012473159024883166, 0.00029912183694850503] and parameters: {'n_layers': 2, 'embedding_dim': 64, 'lr': 3.478192595850252e-05, 'lambda_val': 0.007498786768682151, 'batch_size': 1833, 'optimizer': 'Adam'}.
2026-06-23 16:14:09,346 - optuna.study.study - INFO - Trial 150 finished with values: [0.012418657629458308, 0.0027488316281419735, 0.006906518702901834] and parameters: {'n_layers': 2, 'embedding_dim': 128, 'lr': 0.04824394736006866, 'lambda_val': 0.00039901786521084486, 'batch_size': 2166, 'optimizer': 'RMSprop'}.
2026-06-23 16:17:13,949 - optuna.study.study - INFO - Trial 151 finished with values: [0.01317555283781374, 0.0027756726032588104, 0.007353299789242554] and parameters: {'n_layers': 2, 'embedding_dim': 128, 'lr': 0.003327046285057053, 'lambda_val': 8.888752182598546e-05, 'batch_size': 1759, 'optimizer': 'RMSprop'}.
2026-06-23 16:17:42,392 - experiment_functions - INFO - Early stopping at epoch 550. Best Metrics: (0.007322009120029839, 0.001706770241253, 0.004336986540110051)
2026-06-23 16:17:42,483 - optuna.study.study - INFO - Trial 152 finished with values: [0.007322009120029839, 0.001706770241253, 0.004336986540110051] and parameters: {'n_layers': 1, 'embedding_dim': 256, 'lr': 0.024093178935289533, 'lambda_val': 0.00011941284348716088, 'batch_size': 2105, 'optimizer': 'RMSprop'}.
2026-06-23 16:20:47,486 - optuna.study.study - INFO - Trial 153 finished with values: [0.02420287792297183, 0.005314513073133763, 0.013591265959126284] and parameters: {'n_layers': 4, 'embedding_dim': 64, 'lr': 0.00030878795427160974, 'lambda_val': 1.939500800821711e-06, 'batch_size': 1262, 'optimizer': 'RMSprop'}.
2026-06-23 16:21:19,590 - experiment_functions - INFO - Early stopping at epoch 550. Best Metrics: (0.004195598777944645, 0.0008541745610711129, 0.002169308621846253)
2026-06-23 16:21:19,689 - optuna.study.study - INFO - Trial 154 finished with values: [0.004195598777944645, 0.0008541745610711129, 0.002169308621846253] and parameters: {'n_layers': 2, 'embedding_dim': 256, 'lr': 0.039166761633308914, 'lambda_val': 0.006722918142001253, 'batch_size': 3896, 'optimizer': 'Adam'}.
2026-06-23 16:24:17,045 - experiment_functions - INFO - Early stopping at epoch 3750. Best Metrics: (0.009999654283822232, 0.0020983327017809776, 0.005471000140666279)
