2026-06-22 03:52:57,572 - optuna.study.study - INFO - Trial 52 finished with values: [0.02832772273827686, 0.006154477706201845, 0.01634321522743064] and parameters: {'n_layers': 1, 'embedding_dim': 64, 'lr': 0.0012653624571519182, 'lambda_val': 5.867428769760123e-05, 'batch_size': 2362, 'optimizer': 'RMSprop'}.
2026-06-22 03:53:48,348 - experiment_functions - INFO - Early stopping at epoch 1000. Best Metrics: (0.02118643481609118, 0.004357711254262978, 0.011336260929637956)
2026-06-22 03:53:48,433 - optuna.study.study - INFO - Trial 53 finished with values: [0.02118643481609118, 0.004357711254262978, 0.011336260929637956] and parameters: {'n_layers': 1, 'embedding_dim': 256, 'lr': 0.0015973413467103624, 'lambda_val': 0.0010803337805759545, 'batch_size': 1295, 'optimizer': 'RMSprop'}.
2026-06-22 03:56:29,875 - optuna.study.study - INFO - Trial 54 finished with values: [0.001177968168021714, 0.0002857774409498548, 0.0006900982577600073] and parameters: {'n_layers': 2, 'embedding_dim': 32, 'lr': 7.712990794978637e-05, 'lambda_val': 7.748224295942558e-06, 'batch_size': 3252, 'optimizer': 'RMSprop'}.
2026-06-22 03:56:54,878 - experiment_functions - INFO - Early stopping at epoch 550. Best Metrics: (0.020739224718640915, 0.0042471895920171785, 0.011473240197807513)
2026-06-22 03:56:54,965 - optuna.study.study - INFO - Trial 55 finished with values: [0.020739224718640915, 0.0042471895920171785, 0.011473240197807513] and parameters: {'n_layers': 2, 'embedding_dim': 32, 'lr': 0.007469393902109822, 'lambda_val': 0.0020559457467967724, 'batch_size': 3224, 'optimizer': 'Adam'}.
2026-06-22 03:57:24,747 - experiment_functions - INFO - Early stopping at epoch 550. Best Metrics: (0.013811916512450086, 0.0026683087027914616, 0.007530173833936479)
2026-06-22 03:57:24,847 - optuna.study.study - INFO - Trial 56 finished with values: [0.013811916512450086, 0.0026683087027914616, 0.007530173833936479] and parameters: {'n_layers': 3, 'embedding_dim': 128, 'lr': 0.02301165354346074, 'lambda_val': 4.017786575271443e-05, 'batch_size': 557, 'optimizer': 'Adam'}.
2026-06-22 03:59:02,212 - experiment_functions - INFO - Early stopping at epoch 2150. Best Metrics: (0.007057519689227869, 0.001473095869647594, 0.0037570929722870496)
2026-06-22 03:59:02,291 - optuna.study.study - INFO - Trial 57 finished with values: [0.007057519689227869, 0.001473095869647594, 0.0037570929722870496] and parameters: {'n_layers': 2, 'embedding_dim': 96, 'lr': 0.055642121287157426, 'lambda_val': 0.012915670786514873, 'batch_size': 2618, 'optimizer': 'Adam'}.
2026-06-22 04:02:02,077 - optuna.study.study - INFO - Trial 58 finished with values: [0.03313155654389876, 0.0071270683339648856, 0.019117336664289247] and parameters: {'n_layers': 1, 'embedding_dim': 128, 'lr': 0.0004249111472269399, 'lambda_val': 9.580805901998717e-05, 'batch_size': 2524, 'optimizer': 'Adam'}.
2026-06-22 04:02:44,976 - experiment_functions - INFO - Early stopping at epoch 900. Best Metrics: (0.017042428217379387, 0.0034798534798534805, 0.009273674562624129)
2026-06-22 04:02:45,067 - optuna.study.study - INFO - Trial 59 finished with values: [0.017042428217379387, 0.0034798534798534805, 0.009273674562624129] and parameters: {'n_layers': 3, 'embedding_dim': 64, 'lr': 0.0012653624571519182, 'lambda_val': 0.0005660338072478805, 'batch_size': 2362, 'optimizer': 'RMSprop'}.
2026-06-22 04:03:11,126 - experiment_functions - INFO - Early stopping at epoch 550. Best Metrics: (0.012672158442280207, 0.002691991916129847, 0.007297166228734376)
2026-06-22 04:03:11,229 - optuna.study.study - INFO - Trial 60 finished with values: [0.012672158442280207, 0.002691991916129847, 0.007297166228734376] and parameters: {'n_layers': 2, 'embedding_dim': 64, 'lr': 0.02006245051562491, 'lambda_val': 5.867428769760123e-05, 'batch_size': 3046, 'optimizer': 'RMSprop'}.
2026-06-22 04:04:30,344 - experiment_functions - INFO - Early stopping at epoch 1650. Best Metrics: (0.021270404041033884, 0.004733484905898699, 0.01199264918103545)
2026-06-22 04:04:30,456 - optuna.study.study - INFO - Trial 61 finished with values: [0.021270404041033884, 0.004733484905898699, 0.01199264918103545] and parameters: {'n_layers': 4, 'embedding_dim': 64, 'lr': 0.00029478525006326924, 'lambda_val': 0.0020559457467967724, 'batch_size': 2901, 'optimizer': 'RMSprop'}.
2026-06-22 04:05:08,652 - experiment_functions - INFO - Early stopping at epoch 650. Best Metrics: (0.00038415095724253094, 9.473285335354301e-05, 0.00020007251315610022)
2026-06-22 04:05:08,730 - optuna.study.study - INFO - Trial 62 finished with values: [0.00038415095724253094, 9.473285335354301e-05, 0.00020007251315610022] and parameters: {'n_layers': 2, 'embedding_dim': 256, 'lr': 1.3680280275172243e-05, 'lambda_val': 0.02734358733579112, 'batch_size': 3134, 'optimizer': 'Adam'}.
2026-06-22 04:05:37,207 - experiment_functions - INFO - Early stopping at epoch 550. Best Metrics: (0.004770946595772153, 0.0011620563344701277, 0.002822623891957497)
2026-06-22 04:05:37,274 - optuna.study.study - INFO - Trial 63 finished with values: [0.004770946595772153, 0.0011620563344701277, 0.002822623891957497] and parameters: {'n_layers': 2, 'embedding_dim': 128, 'lr': 0.055642121287157426, 'lambda_val': 0.0010932022853294527, 'batch_size': 2524, 'optimizer': 'Adam'}.
2026-06-22 04:08:53,299 - optuna.study.study - INFO - Trial 64 finished with values: [0.0013649625526477743, 0.0003426171529619805, 0.000735131855919456] and parameters: {'n_layers': 4, 'embedding_dim': 96, 'lr': 3.6772889309705276e-05, 'lambda_val': 9.354033110589646e-06, 'batch_size': 3925, 'optimizer': 'RMSprop'}.
2026-06-22 04:11:14,573 - experiment_functions - INFO - Early stopping at epoch 2300. Best Metrics: (0.008024380877750047, 0.0017051913603637742, 0.004490677409616319)
2026-06-22 04:11:14,661 - optuna.study.study - INFO - Trial 65 finished with values: [0.008024380877750047, 0.0017051913603637742, 0.004490677409616319] and parameters: {'n_layers': 3, 'embedding_dim': 256, 'lr': 0.0013289914858578777, 'lambda_val': 0.01765766854144056, 'batch_size': 1362, 'optimizer': 'Adam'}.
2026-06-22 04:14:04,798 - optuna.study.study - INFO - Trial 66 finished with values: [0.008140478169140349, 0.001907288114184666, 0.00484148675108881] and parameters: {'n_layers': 4, 'embedding_dim': 32, 'lr': 8.963815312123083e-05, 'lambda_val': 6.3531732661047e-05, 'batch_size': 2821, 'optimizer': 'Adam'}.
2026-06-22 04:14:28,651 - experiment_functions - INFO - Early stopping at epoch 500. Best Metrics: (0.0004160239885020301, 0.00010420613868889732, 0.00021326303923179438)
2026-06-22 04:14:28,720 - optuna.study.study - INFO - Trial 67 finished with values: [0.0004160239885020301, 0.00010420613868889732, 0.00021326303923179438] and parameters: {'n_layers': 3, 'embedding_dim': 64, 'lr': 0.003489774344906881, 'lambda_val': 4.9731271211321625e-05, 'batch_size': 2454, 'optimizer': 'SGD'}.
2026-06-22 04:14:56,244 - experiment_functions - INFO - Early stopping at epoch 600. Best Metrics: (0.024840429414584777, 0.005276619931792346, 0.013939978213185534)
2026-06-22 04:14:56,318 - optuna.study.study - INFO - Trial 68 finished with values: [0.024840429414584777, 0.005276619931792346, 0.013939978213185534] and parameters: {'n_layers': 2, 'embedding_dim': 32, 'lr': 0.0038079716278558275, 'lambda_val': 0.0001132240545098155, 'batch_size': 4064, 'optimizer': 'Adam'}.
2026-06-22 04:15:29,649 - experiment_functions - INFO - Early stopping at epoch 750. Best Metrics: (0.01828157448691155, 0.003779840848806367, 0.009613079398934033)
2026-06-22 04:15:30,037 - optuna.study.study - INFO - Trial 69 finished with values: [0.01828157448691155, 0.003779840848806367, 0.009613079398934033] and parameters: {'n_layers': 1, 'embedding_dim': 64, 'lr': 0.0038079716278558275, 'lambda_val': 0.0008270557136082167, 'batch_size': 3997, 'optimizer': 'RMSprop'}.
2026-06-22 04:16:54,246 - experiment_functions - INFO - Early stopping at epoch 1850. Best Metrics: (0.009304543438068514, 0.0022688518378173555, 0.0053353814399028756)
2026-06-22 04:16:54,317 - optuna.study.study - INFO - Trial 70 finished with values: [0.009304543438068514, 0.0022688518378173555, 0.0053353814399028756] and parameters: {'n_layers': 2, 'embedding_dim': 96, 'lr': 0.011640551440251735, 'lambda_val': 0.0020559457467967724, 'batch_size': 2901, 'optimizer': 'RMSprop'}.
2026-06-22 04:17:19,584 - experiment_functions - INFO - Early stopping at epoch 500. Best Metrics: (0.0006082029963979567, 0.00014209928003031453, 0.0003508990043218983)
2026-06-22 04:17:19,755 - optuna.study.study - INFO - Trial 71 finished with values: [0.0006082029963979567, 0.00014209928003031453, 0.0003508990043218983] and parameters: {'n_layers': 2, 'embedding_dim': 128, 'lr': 0.02577991798829126, 'lambda_val': 0.0035094779544837824, 'batch_size': 2566, 'optimizer': 'SGD'}.
2026-06-22 04:17:46,194 - experiment_functions - INFO - Early stopping at epoch 550. Best Metrics: (0.00033801055052092103, 8.210180623973728e-05, 0.00019588161662301466)
2026-06-22 04:17:46,545 - optuna.study.study - INFO - Trial 72 finished with values: [0.00033801055052092103, 8.210180623973728e-05, 0.00019588161662301466] and parameters: {'n_layers': 2, 'embedding_dim': 96, 'lr': 2.3625716959610772e-05, 'lambda_val': 0.02301034856049595, 'batch_size': 1260, 'optimizer': 'Adam'}.
2026-06-22 04:18:25,614 - experiment_functions - INFO - Early stopping at epoch 550. Best Metrics: (0.011924890105026962, 0.0025672603258810158, 0.006622961735669612)
2026-06-22 04:18:25,991 - optuna.study.study - INFO - Trial 73 finished with values: [0.011924890105026962, 0.0025672603258810158, 0.006622961735669612] and parameters: {'n_layers': 4, 'embedding_dim': 256, 'lr': 0.0015973413467103624, 'lambda_val': 0.001073083826061835, 'batch_size': 2784, 'optimizer': 'RMSprop'}.
2026-06-22 04:21:41,046 - optuna.study.study - INFO - Trial 74 finished with values: [0.00042552878655071784, 0.00011525830491347733, 0.00024341204719119123] and parameters: {'n_layers': 4, 'embedding_dim': 96, 'lr': 1.3281571726331566e-05, 'lambda_val': 0.000442118077500333, 'batch_size': 2524, 'optimizer': 'RMSprop'}.
2026-06-22 04:24:32,372 - optuna.study.study - INFO - Trial 75 finished with values: [0.01857042812243545, 0.00408456486042693, 0.010685197208735927] and parameters: {'n_layers': 3, 'embedding_dim': 32, 'lr': 0.0001659733154867732, 'lambda_val': 0.0020559457467967724, 'batch_size': 3484, 'optimizer': 'RMSprop'}.
2026-06-22 04:25:45,754 - experiment_functions - INFO - Early stopping at epoch 1700. Best Metrics: (0.0006329569998030172, 0.00013262599469496023, 0.00037272883334853635)
2026-06-22 04:25:45,823 - optuna.study.study - INFO - Trial 76 finished with values: [0.0006329569998030172, 0.00013262599469496023, 0.00037272883334853635] and parameters: {'n_layers': 2, 'embedding_dim': 64, 'lr': 1.3680280275172243e-05, 'lambda_val': 2.6966833277802298e-05, 'batch_size': 2780, 'optimizer': 'Adam'}.
2026-06-22 04:26:18,087 - experiment_functions - INFO - Early stopping at epoch 650. Best Metrics: (0.025485351546705764, 0.005402930402930403, 0.014414863461561426)
2026-06-22 04:26:18,230 - optuna.study.study - INFO - Trial 77 finished with values: [0.025485351546705764, 0.005402930402930403, 0.014414863461561426] and parameters: {'n_layers': 2, 'embedding_dim': 96, 'lr': 0.0017809598622910787, 'lambda_val': 2.887932809602638e-05, 'batch_size': 3314, 'optimizer': 'Adam'}.
2026-06-22 04:29:26,349 - optuna.study.study - INFO - Trial 78 finished with values: [0.01131394477109495, 0.0025972590627763043, 0.006778918978294788] and parameters: {'n_layers': 2, 'embedding_dim': 128, 'lr': 0.00011667695005637437, 'lambda_val': 7.748224295942558e-06, 'batch_size': 3252, 'optimizer': 'Adam'}.
2026-06-22 04:29:53,474 - experiment_functions - INFO - Early stopping at epoch 600. Best Metrics: (0.007437420215095229, 0.0016546671719085513, 0.0040854424232177975)
2026-06-22 04:29:53,572 - optuna.study.study - INFO - Trial 79 finished with values: [0.007437420215095229, 0.0016546671719085513, 0.0040854424232177975] and parameters: {'n_layers': 2, 'embedding_dim': 32, 'lr': 0.005023945861716535, 'lambda_val': 0.03405990314606576, 'batch_size': 4064, 'optimizer': 'Adam'}.
2026-06-22 04:30:31,857 - experiment_functions - INFO - Early stopping at epoch 750. Best Metrics: (0.012478041544634598, 0.0025625236832133385, 0.00672747516544922)
2026-06-22 04:30:31,951 - optuna.study.study - INFO - Trial 80 finished with values: [0.012478041544634598, 0.0025625236832133385, 0.00672747516544922] and parameters: {'n_layers': 3, 'embedding_dim': 96, 'lr': 0.01363223904917348, 'lambda_val': 0.00018543728181534506, 'batch_size': 2618, 'optimizer': 'Adam'}.
2026-06-22 04:31:04,129 - experiment_functions - INFO - Early stopping at epoch 500. Best Metrics: (0.0005760668025271281, 0.0001405203991410888, 0.0003267754843298592)
2026-06-22 04:31:04,226 - optuna.study.study - INFO - Trial 81 finished with values: [0.0005760668025271281, 0.0001405203991410888, 0.0003267754843298592] and parameters: {'n_layers': 3, 'embedding_dim': 256, 'lr': 0.0012653624571519182, 'lambda_val': 5.867428769760123e-05, 'batch_size': 2417, 'optimizer': 'SGD'}.
2026-06-22 04:31:32,950 - experiment_functions - INFO - Early stopping at epoch 550. Best Metrics: (0.026712849353629487, 0.0052308323860048, 0.014642367066849502)
2026-06-22 04:31:33,031 - optuna.study.study - INFO - Trial 82 finished with values: [0.026712849353629487, 0.0052308323860048, 0.014642367066849502] and parameters: {'n_layers': 2, 'embedding_dim': 128, 'lr': 0.005023945861716535, 'lambda_val': 1.3167003761918277e-05, 'batch_size': 4064, 'optimizer': 'Adam'}.
2026-06-22 04:32:50,115 - experiment_functions - INFO - Early stopping at epoch 1400. Best Metrics: (0.01627307700838212, 0.0032398635846911717, 0.008722721678448769)
2026-06-22 04:32:50,208 - optuna.study.study - INFO - Trial 83 finished with values: [0.01627307700838212, 0.0032398635846911717, 0.008722721678448769] and parameters: {'n_layers': 4, 'embedding_dim': 128, 'lr': 0.0036404225946350165, 'lambda_val': 2.5805202056832215e-06, 'batch_size': 2524, 'optimizer': 'RMSprop'}.
2026-06-22 04:36:04,428 - optuna.study.study - INFO - Trial 84 finished with values: [0.0007936646338430015, 0.00017525577870405458, 0.0004462824262996283] and parameters: {'n_layers': 1, 'embedding_dim': 256, 'lr': 8.963815312123083e-05, 'lambda_val': 0.000442118077500333, 'batch_size': 2829, 'optimizer': 'Adam'}.
2026-06-22 04:37:03,464 - experiment_functions - INFO - Early stopping at epoch 1250. Best Metrics: (0.02745060653989544, 0.005976064165719338, 0.015853590300031407)
2026-06-22 04:37:03,542 - optuna.study.study - INFO - Trial 85 finished with values: [0.02745060653989544, 0.005976064165719338, 0.015853590300031407] and parameters: {'n_layers': 2, 'embedding_dim': 96, 'lr': 0.0004249111472269399, 'lambda_val': 0.000442118077500333, 'batch_size': 2829, 'optimizer': 'RMSprop'}.
2026-06-22 04:37:38,365 - experiment_functions - INFO - Early stopping at epoch 700. Best Metrics: (0.017913618059474074, 0.003782998610584818, 0.009583340933718097)
2026-06-22 04:37:38,703 - optuna.study.study - INFO - Trial 86 finished with values: [0.017913618059474074, 0.003782998610584818, 0.009583340933718097] and parameters: {'n_layers': 4, 'embedding_dim': 64, 'lr': 0.0015973413467103624, 'lambda_val': 0.00028164204425287087, 'batch_size': 1762, 'optimizer': 'Adam'}.
2026-06-22 04:39:10,343 - experiment_functions - INFO - Early stopping at epoch 2200. Best Metrics: (0.00048827192259364756, 0.00011525830491347733, 0.0002886647992997884)
2026-06-22 04:39:10,431 - optuna.study.study - INFO - Trial 87 finished with values: [0.00048827192259364756, 0.00011525830491347733, 0.0002886647992997884] and parameters: {'n_layers': 1, 'embedding_dim': 32, 'lr': 8.963815312123083e-05, 'lambda_val': 6.3531732661047e-05, 'batch_size': 2780, 'optimizer': 'Adam'}.
2026-06-22 04:39:36,063 - experiment_functions - INFO - Early stopping at epoch 500. Best Metrics: (0.0005489335620045064, 0.00011999494758115448, 0.0002580055605451806)
2026-06-22 04:39:36,156 - optuna.study.study - INFO - Trial 88 finished with values: [0.0005489335620045064, 0.00011999494758115448, 0.0002580055605451806] and parameters: {'n_layers': 4, 'embedding_dim': 64, 'lr': 4.3395660683013514e-05, 'lambda_val': 0.027781407583756534, 'batch_size': 1681, 'optimizer': 'Adam'}.
2026-06-22 04:40:42,274 - experiment_functions - INFO - Early stopping at epoch 1250. Best Metrics: (0.01362108087992049, 0.0026635720601237843, 0.007164177276986552)
2026-06-22 04:40:42,364 - optuna.study.study - INFO - Trial 89 finished with values: [0.01362108087992049, 0.0026635720601237843, 0.007164177276986552] and parameters: {'n_layers': 4, 'embedding_dim': 96, 'lr': 0.01377260732755362, 'lambda_val': 8.803132640891692e-06, 'batch_size': 2524, 'optimizer': 'Adam'}.
2026-06-22 04:41:06,790 - experiment_functions - INFO - Early stopping at epoch 500. Best Metrics: (0.0005251031619656356, 0.00011052166224580017, 0.0002609686763845008)
2026-06-22 04:41:06,900 - optuna.study.study - INFO - Trial 90 finished with values: [0.0005251031619656356, 0.00011052166224580017, 0.0002609686763845008] and parameters: {'n_layers': 4, 'embedding_dim': 32, 'lr': 1.3281571726331566e-05, 'lambda_val': 0.000442118077500333, 'batch_size': 2829, 'optimizer': 'SGD'}.
2026-06-22 04:41:39,101 - experiment_functions - INFO - Early stopping at epoch 700. Best Metrics: (0.013673159364917978, 0.00266515094101301, 0.007421549076490546)
2026-06-22 04:41:39,175 - optuna.study.study - INFO - Trial 91 finished with values: [0.013673159364917978, 0.00266515094101301, 0.007421549076490546] and parameters: {'n_layers': 3, 'embedding_dim': 32, 'lr': 0.012857610926801856, 'lambda_val': 3.3713365034762877e-06, 'batch_size': 3903, 'optimizer': 'RMSprop'}.
2026-06-22 04:43:52,074 - experiment_functions - INFO - Early stopping at epoch 3050. Best Metrics: (0.011283627364400426, 0.0027756726032588104, 0.00638052696660506)
2026-06-22 04:43:52,163 - optuna.study.study - INFO - Trial 92 finished with values: [0.011283627364400426, 0.0027756726032588104, 0.00638052696660506] and parameters: {'n_layers': 1, 'embedding_dim': 96, 'lr': 0.04552920788730844, 'lambda_val': 0.015318144701989713, 'batch_size': 2618, 'optimizer': 'RMSprop'}.
2026-06-22 04:48:21,394 - optuna.study.study - INFO - Trial 93 finished with values: [0.0031998895697678935, 0.0007720727548313756, 0.0018765063930026055] and parameters: {'n_layers': 4, 'embedding_dim': 256, 'lr': 4.3395660683013514e-05, 'lambda_val': 0.001073083826061835, 'batch_size': 2613, 'optimizer': 'RMSprop'}.
2026-06-22 04:51:21,582 - optuna.study.study - INFO - Trial 94 finished with values: [0.0008202004952391873, 0.00019104458759631175, 0.00048304026835044387] and parameters: {'n_layers': 2, 'embedding_dim': 96, 'lr': 6.100610354483451e-05, 'lambda_val': 3.8797754277468706e-05, 'batch_size': 3663, 'optimizer': 'Adam'}.
2026-06-22 04:51:45,100 - experiment_functions - INFO - Early stopping at epoch 500. Best Metrics: (0.0007096177095057445, 0.0001484148035872174, 0.0003324668792314785)
2026-06-22 04:51:45,191 - optuna.study.study - INFO - Trial 95 finished with values: [0.0007096177095057445, 0.0001484148035872174, 0.0003324668792314785] and parameters: {'n_layers': 2, 'embedding_dim': 64, 'lr': 0.02577991798829126, 'lambda_val': 5.867428769760123e-05, 'batch_size': 2566, 'optimizer': 'SGD'}.
2026-06-22 04:52:15,333 - experiment_functions - INFO - Early stopping at epoch 550. Best Metrics: (0.013988458046919434, 0.0027109384868005556, 0.007838130395795865)
2026-06-22 04:52:15,446 - optuna.study.study - INFO - Trial 96 finished with values: [0.013988458046919434, 0.0027109384868005556, 0.007838130395795865] and parameters: {'n_layers': 3, 'embedding_dim': 128, 'lr': 0.02301165354346074, 'lambda_val': 4.017786575271443e-05, 'batch_size': 557, 'optimizer': 'Adam'}.
2026-06-22 04:52:46,095 - experiment_functions - INFO - Early stopping at epoch 650. Best Metrics: (0.01148995867305328, 0.002516736137425793, 0.006395785450705687)
2026-06-22 04:52:46,172 - optuna.study.study - INFO - Trial 97 finished with values: [0.01148995867305328, 0.002516736137425793, 0.006395785450705687] and parameters: {'n_layers': 4, 'embedding_dim': 32, 'lr': 0.0017954705664300359, 'lambda_val': 0.0020559457467967724, 'batch_size': 2524, 'optimizer': 'RMSprop'}.
2026-06-22 04:56:54,326 - optuna.study.study - INFO - Trial 98 finished with values: [0.022585204549728215, 0.00500189465706707, 0.012633211863011957] and parameters: {'n_layers': 3, 'embedding_dim': 256, 'lr': 0.00011710757927899564, 'lambda_val': 0.0005857689247732319, 'batch_size': 3633, 'optimizer': 'RMSprop'}.
2026-06-22 04:57:18,772 - experiment_functions - INFO - Early stopping at epoch 500. Best Metrics: (0.0006415308905000725, 0.00013578375647341163, 0.00031690423466070137)
2026-06-22 04:57:18,863 - optuna.study.study - INFO - Trial 99 finished with values: [0.0006415308905000725, 0.00013578375647341163, 0.00031690423466070137] and parameters: {'n_layers': 2, 'embedding_dim': 96, 'lr': 3.6772889309705276e-05, 'lambda_val': 0.0015772734475715273, 'batch_size': 2565, 'optimizer': 'SGD'}.
2026-06-22 04:57:46,627 - experiment_functions - INFO - Early stopping at epoch 550. Best Metrics: (0.02305057741392595, 0.004784009094353922, 0.013045577280586388)
2026-06-22 04:57:46,762 - optuna.study.study - INFO - Trial 100 finished with values: [0.02305057741392595, 0.004784009094353922, 0.013045577280586388] and parameters: {'n_layers': 2, 'embedding_dim': 96, 'lr': 0.0038079716278558275, 'lambda_val': 0.0010893975331714692, 'batch_size': 3711, 'optimizer': 'Adam'}.
