2026-06-19 06:58:32,583 - optuna.study.study - INFO - Trial 24 finished with values: [0.006140073388573383, 0.0013057344953896677, 0.0033359799663778326] and parameters: {'n_layers': 3, 'embedding_dim': 96, 'lr': 0.03025207384051862, 'lambda_val': 0.0004362815086226961, 'batch_size': 2758, 'optimizer': 'Adam'}.
2026-06-19 06:58:57,248 - experiment_functions - INFO - Early stopping at epoch 500. Best Metrics: (0.00042785669550056724, 0.00010894278135657447, 0.00023707087193686557)
2026-06-19 06:58:57,558 - optuna.study.study - INFO - Trial 25 finished with values: [0.00042785669550056724, 0.00010894278135657447, 0.00023707087193686557] and parameters: {'n_layers': 4, 'embedding_dim': 64, 'lr': 4.923464171821932e-05, 'lambda_val': 0.05816864963291131, 'batch_size': 2468, 'optimizer': 'SGD'}.
2026-06-19 06:59:53,668 - experiment_functions - INFO - Early stopping at epoch 1150. Best Metrics: (0.0006874252940053266, 0.0001389415182518631, 0.0003834212723093159)
2026-06-19 06:59:53,746 - optuna.study.study - INFO - Trial 26 finished with values: [0.0006874252940053266, 0.0001389415182518631, 0.0003834212723093159] and parameters: {'n_layers': 1, 'embedding_dim': 256, 'lr': 3.795035950346317e-05, 'lambda_val': 0.0005335603776371349, 'batch_size': 719, 'optimizer': 'RMSprop'}.
2026-06-19 07:00:17,157 - experiment_functions - INFO - Early stopping at epoch 500. Best Metrics: (0.0004718960494386938, 0.00011999494758115447, 0.0002807522505123508)
2026-06-19 07:00:17,228 - optuna.study.study - INFO - Trial 27 finished with values: [0.0004718960494386938, 0.00011999494758115447, 0.0002807522505123508] and parameters: {'n_layers': 4, 'embedding_dim': 32, 'lr': 8.816770444127186e-05, 'lambda_val': 0.001779600046224566, 'batch_size': 3391, 'optimizer': 'SGD'}.
2026-06-19 07:00:41,037 - experiment_functions - INFO - Early stopping at epoch 500. Best Metrics: (0.0004794920351172366, 9.946949602122017e-05, 0.0002443533535674227)
2026-06-19 07:00:41,124 - optuna.study.study - INFO - Trial 28 finished with values: [0.0004794920351172366, 9.946949602122017e-05, 0.0002443533535674227] and parameters: {'n_layers': 1, 'embedding_dim': 128, 'lr': 0.003975454433665345, 'lambda_val': 0.004710803781976507, 'batch_size': 2088, 'optimizer': 'SGD'}.
2026-06-19 07:01:05,068 - experiment_functions - INFO - Early stopping at epoch 500. Best Metrics: (0.0004942298030248237, 0.00010104837691044589, 0.0002636881764327757)
2026-06-19 07:01:05,148 - optuna.study.study - INFO - Trial 29 finished with values: [0.0004942298030248237, 0.00010104837691044589, 0.0002636881764327757] and parameters: {'n_layers': 3, 'embedding_dim': 64, 'lr': 0.025459023289063965, 'lambda_val': 0.04322044407522133, 'batch_size': 3391, 'optimizer': 'SGD'}.
2026-06-19 07:01:39,251 - experiment_functions - INFO - Early stopping at epoch 750. Best Metrics: (0.008228139340857817, 0.0018346595932802832, 0.004448608366747502)
2026-06-19 07:01:39,338 - optuna.study.study - INFO - Trial 30 finished with values: [0.008228139340857817, 0.0018346595932802832, 0.004448608366747502] and parameters: {'n_layers': 1, 'embedding_dim': 96, 'lr': 0.0025726585227239724, 'lambda_val': 0.034139488400065095, 'batch_size': 1913, 'optimizer': 'RMSprop'}.
2026-06-19 07:02:05,671 - experiment_functions - INFO - Early stopping at epoch 500. Best Metrics: (0.0004656906655974558, 0.00012788935202728306, 0.0002833808508281742)
2026-06-19 07:02:05,750 - optuna.study.study - INFO - Trial 31 finished with values: [0.0004656906655974558, 0.00012788935202728306, 0.0002833808508281742] and parameters: {'n_layers': 4, 'embedding_dim': 96, 'lr': 0.09622578043504722, 'lambda_val': 0.027956652497068718, 'batch_size': 1622, 'optimizer': 'SGD'}.
2026-06-19 07:02:33,069 - experiment_functions - INFO - Early stopping at epoch 500. Best Metrics: (0.0005336591163301545, 0.00012788935202728306, 0.00032491344119366745)
2026-06-19 07:02:33,151 - optuna.study.study - INFO - Trial 32 finished with values: [0.0005336591163301545, 0.00012788935202728306, 0.00032491344119366745] and parameters: {'n_layers': 4, 'embedding_dim': 128, 'lr': 2.652690253100192e-05, 'lambda_val': 2.013346843188833e-05, 'batch_size': 1816, 'optimizer': 'SGD'}.
2026-06-19 07:03:09,928 - experiment_functions - INFO - Early stopping at epoch 550. Best Metrics: (0.007598095910087914, 0.0017067702412529998, 0.00415697502570146)
2026-06-19 07:03:10,032 - optuna.study.study - INFO - Trial 33 finished with values: [0.007598095910087914, 0.0017067702412529998, 0.00415697502570146] and parameters: {'n_layers': 4, 'embedding_dim': 256, 'lr': 0.0012822551168411081, 'lambda_val': 0.007237229941740872, 'batch_size': 3391, 'optimizer': 'RMSprop'}.
2026-06-19 07:03:42,189 - experiment_functions - INFO - Early stopping at epoch 700. Best Metrics: (0.000517022242515144, 0.00011999494758115447, 0.0002776226728560366)
2026-06-19 07:03:42,282 - optuna.study.study - INFO - Trial 34 finished with values: [0.000517022242515144, 0.00011999494758115447, 0.0002776226728560366] and parameters: {'n_layers': 4, 'embedding_dim': 32, 'lr': 0.012446135186973949, 'lambda_val': 0.0862024186981037, 'batch_size': 2401, 'optimizer': 'SGD'}.
2026-06-19 07:04:07,964 - experiment_functions - INFO - Early stopping at epoch 500. Best Metrics: (0.000508121232850291, 0.00010104837691044589, 0.000273736911398218)
2026-06-19 07:04:08,058 - optuna.study.study - INFO - Trial 35 finished with values: [0.000508121232850291, 0.00010104837691044589, 0.000273736911398218] and parameters: {'n_layers': 1, 'embedding_dim': 256, 'lr': 0.00011355078385550283, 'lambda_val': 0.011475903246098325, 'batch_size': 1901, 'optimizer': 'SGD'}.
2026-06-19 07:04:31,213 - experiment_functions - INFO - Early stopping at epoch 500. Best Metrics: (0.0004812562610860998, 0.00011210054313502591, 0.0002798153871161222)
2026-06-19 07:04:31,308 - optuna.study.study - INFO - Trial 36 finished with values: [0.0004812562610860998, 0.00011210054313502591, 0.0002798153871161222] and parameters: {'n_layers': 4, 'embedding_dim': 32, 'lr': 0.00040600409221578336, 'lambda_val': 7.365889217672151e-06, 'batch_size': 1173, 'optimizer': 'SGD'}.
2026-06-19 07:04:59,536 - experiment_functions - INFO - Early stopping at epoch 550. Best Metrics: (0.00048377387757841126, 0.00010894278135657447, 0.0002626225311282034)
2026-06-19 07:04:59,623 - optuna.study.study - INFO - Trial 37 finished with values: [0.00048377387757841126, 0.00010894278135657447, 0.0002626225311282034] and parameters: {'n_layers': 1, 'embedding_dim': 256, 'lr': 6.17900534853265e-05, 'lambda_val': 0.02784842208998399, 'batch_size': 1671, 'optimizer': 'RMSprop'}.
2026-06-19 07:05:24,992 - experiment_functions - INFO - Early stopping at epoch 500. Best Metrics: (0.0005085564620679843, 0.00011999494758115448, 0.0002557023015958819)
2026-06-19 07:05:25,120 - optuna.study.study - INFO - Trial 38 finished with values: [0.0005085564620679843, 0.00011999494758115448, 0.0002557023015958819] and parameters: {'n_layers': 1, 'embedding_dim': 256, 'lr': 0.0081556309052786, 'lambda_val': 0.03693503236055113, 'batch_size': 2074, 'optimizer': 'SGD'}.
2026-06-19 07:05:47,287 - experiment_functions - INFO - Early stopping at epoch 500. Best Metrics: (0.0006260490150003578, 0.0001026272577996716, 0.00032335476518483876)
2026-06-19 07:05:47,381 - optuna.study.study - INFO - Trial 39 finished with values: [0.0006260490150003578, 0.0001026272577996716, 0.00032335476518483876] and parameters: {'n_layers': 1, 'embedding_dim': 32, 'lr': 8.847609527070946e-05, 'lambda_val': 3.4596773195408992e-06, 'batch_size': 1628, 'optimizer': 'SGD'}.
2026-06-19 07:07:13,398 - experiment_functions - INFO - Early stopping at epoch 1900. Best Metrics: (0.0004077905217297523, 0.0001121005431350259, 0.00023261583345564321)
2026-06-19 07:07:13,483 - optuna.study.study - INFO - Trial 40 finished with values: [0.0004077905217297523, 0.0001121005431350259, 0.00023261583345564321] and parameters: {'n_layers': 4, 'embedding_dim': 64, 'lr': 1.5135499276588919e-05, 'lambda_val': 0.0004337745353662523, 'batch_size': 2645, 'optimizer': 'RMSprop'}.
2026-06-19 07:09:56,823 - optuna.study.study - INFO - Trial 41 finished with values: [0.0024292613431634138, 0.0005952380952380953, 0.0014611966685485866] and parameters: {'n_layers': 2, 'embedding_dim': 32, 'lr': 0.0001441764358482641, 'lambda_val': 2.2594331856616834e-06, 'batch_size': 3900, 'optimizer': 'RMSprop'}.
2026-06-19 07:10:22,910 - experiment_functions - INFO - Early stopping at epoch 500. Best Metrics: (0.00046791201062944146, 0.00011683718580270305, 0.0002827197533045622)
2026-06-19 07:10:23,054 - optuna.study.study - INFO - Trial 42 finished with values: [0.00046791201062944146, 0.00011683718580270305, 0.0002827197533045622] and parameters: {'n_layers': 3, 'embedding_dim': 128, 'lr': 0.0026080443940524555, 'lambda_val': 0.00854510130589444, 'batch_size': 2402, 'optimizer': 'SGD'}.
2026-06-19 07:10:47,816 - experiment_functions - INFO - Early stopping at epoch 500. Best Metrics: (0.00042771753253466273, 0.00010104837691044589, 0.00022272834343703562)
2026-06-19 07:10:47,908 - optuna.study.study - INFO - Trial 43 finished with values: [0.00042771753253466273, 0.00010104837691044589, 0.00022272834343703562] and parameters: {'n_layers': 2, 'embedding_dim': 128, 'lr': 1.9315278647674237e-05, 'lambda_val': 0.033502463053003695, 'batch_size': 2364, 'optimizer': 'SGD'}.
2026-06-19 07:11:16,704 - experiment_functions - INFO - Early stopping at epoch 650. Best Metrics: (0.017393912717452047, 0.003931413414172035, 0.009579574091563934)
2026-06-19 07:11:16,789 - optuna.study.study - INFO - Trial 44 finished with values: [0.017393912717452047, 0.003931413414172035, 0.009579574091563934] and parameters: {'n_layers': 1, 'embedding_dim': 32, 'lr': 0.007918659350141476, 'lambda_val': 0.0082855773038374, 'batch_size': 1312, 'optimizer': 'Adam'}.
2026-06-19 07:11:39,223 - experiment_functions - INFO - Early stopping at epoch 500. Best Metrics: (0.0005631049675507044, 0.00012631047113805733, 0.0003120075895245628)
2026-06-19 07:11:39,320 - optuna.study.study - INFO - Trial 45 finished with values: [0.0005631049675507044, 0.00012631047113805733, 0.0003120075895245628] and parameters: {'n_layers': 2, 'embedding_dim': 32, 'lr': 0.0001701161587510733, 'lambda_val': 0.03632009453014282, 'batch_size': 3420, 'optimizer': 'SGD'}.
2026-06-19 07:12:15,124 - experiment_functions - INFO - Early stopping at epoch 700. Best Metrics: (0.008056971702232511, 0.001801503094606543, 0.004357473295343132)
2026-06-19 07:12:15,244 - optuna.study.study - INFO - Trial 46 finished with values: [0.008056971702232511, 0.001801503094606543, 0.004357473295343132] and parameters: {'n_layers': 4, 'embedding_dim': 96, 'lr': 0.0008520784697548674, 'lambda_val': 0.015452769230831364, 'batch_size': 2324, 'optimizer': 'RMSprop'}.
2026-06-19 07:12:41,454 - experiment_functions - INFO - Early stopping at epoch 500. Best Metrics: (0.0004913037803957625, 0.00011841606669192878, 0.00028657585294872707)
2026-06-19 07:12:41,551 - optuna.study.study - INFO - Trial 47 finished with values: [0.0004913037803957625, 0.00011841606669192878, 0.00028657585294872707] and parameters: {'n_layers': 4, 'embedding_dim': 96, 'lr': 4.502580533585944e-05, 'lambda_val': 0.004531689665891373, 'batch_size': 2607, 'optimizer': 'RMSprop'}.
2026-06-19 07:14:11,128 - experiment_functions - INFO - Early stopping at epoch 2100. Best Metrics: (0.00045572228501685456, 9.157509157509159e-05, 0.00023760074565026265)
2026-06-19 07:14:11,225 - optuna.study.study - INFO - Trial 48 finished with values: [0.00045572228501685456, 9.157509157509159e-05, 0.00023760074565026265] and parameters: {'n_layers': 2, 'embedding_dim': 64, 'lr': 2.024643129174324e-05, 'lambda_val': 9.69691152824761e-06, 'batch_size': 1715, 'optimizer': 'Adam'}.
2026-06-19 07:14:36,165 - experiment_functions - INFO - Early stopping at epoch 500. Best Metrics: (0.0003908948230016368, 8.999621068586587e-05, 0.00021748802877429876)
2026-06-19 07:14:36,251 - optuna.study.study - INFO - Trial 49 finished with values: [0.0003908948230016368, 8.999621068586587e-05, 0.00021748802877429876] and parameters: {'n_layers': 3, 'embedding_dim': 96, 'lr': 0.05618040318988694, 'lambda_val': 1.614434628549655e-06, 'batch_size': 1839, 'optimizer': 'SGD'}.
2026-06-19 07:15:06,018 - experiment_functions - INFO - Early stopping at epoch 650. Best Metrics: (0.008594231684106196, 0.0020888594164456234, 0.004580258555220322)
2026-06-19 07:15:06,106 - optuna.study.study - INFO - Trial 50 finished with values: [0.008594231684106196, 0.0020888594164456234, 0.004580258555220322] and parameters: {'n_layers': 1, 'embedding_dim': 96, 'lr': 0.0025726585227239724, 'lambda_val': 0.034139488400065095, 'batch_size': 1913, 'optimizer': 'RMSprop'}.
2026-06-19 07:17:06,206 - experiment_functions - INFO - Early stopping at epoch 2250. Best Metrics: (0.0005217751652111588, 0.00012315270935960593, 0.00031103000982907284)
2026-06-19 07:17:06,273 - optuna.study.study - INFO - Trial 51 finished with values: [0.0005217751652111588, 0.00012315270935960593, 0.00031103000982907284] and parameters: {'n_layers': 2, 'embedding_dim': 256, 'lr': 3.795035950346317e-05, 'lambda_val': 0.0005335603776371349, 'batch_size': 719, 'optimizer': 'Adam'}.
2026-06-19 07:17:29,123 - experiment_functions - INFO - Early stopping at epoch 500. Best Metrics: (0.0005984571027977707, 0.00012631047113805733, 0.00032249551928274913)
2026-06-19 07:17:29,200 - optuna.study.study - INFO - Trial 52 finished with values: [0.0005984571027977707, 0.00012631047113805733, 0.00032249551928274913] and parameters: {'n_layers': 2, 'embedding_dim': 32, 'lr': 0.0045010260516877044, 'lambda_val': 0.006313543112125617, 'batch_size': 2088, 'optimizer': 'SGD'}.
2026-06-19 07:18:19,766 - experiment_functions - INFO - Early stopping at epoch 1050. Best Metrics: (0.012200298584352799, 0.002636731085006947, 0.006860150886809807)
2026-06-19 07:18:19,841 - optuna.study.study - INFO - Trial 53 finished with values: [0.012200298584352799, 0.002636731085006947, 0.006860150886809807] and parameters: {'n_layers': 2, 'embedding_dim': 128, 'lr': 0.0045010260516877044, 'lambda_val': 4.652725797139409e-06, 'batch_size': 3050, 'optimizer': 'RMSprop'}.
2026-06-19 07:20:22,163 - experiment_functions - INFO - Early stopping at epoch 2450. Best Metrics: (0.03314737464743715, 0.0068302387267904505, 0.01866561953173259)
2026-06-19 07:20:22,243 - optuna.study.study - INFO - Trial 54 finished with values: [0.03314737464743715, 0.0068302387267904505, 0.01866561953173259] and parameters: {'n_layers': 1, 'embedding_dim': 256, 'lr': 0.0008520784697548674, 'lambda_val': 1.3063371603281255e-06, 'batch_size': 3743, 'optimizer': 'RMSprop'}.
2026-06-19 07:20:48,414 - experiment_functions - INFO - Early stopping at epoch 550. Best Metrics: (0.006198263269491824, 0.0014809902740937223, 0.003641415066770857)
2026-06-19 07:20:48,511 - optuna.study.study - INFO - Trial 55 finished with values: [0.006198263269491824, 0.0014809902740937223, 0.003641415066770857] and parameters: {'n_layers': 1, 'embedding_dim': 128, 'lr': 0.03900052278827052, 'lambda_val': 5.118201634291458e-05, 'batch_size': 521, 'optimizer': 'RMSprop'}.
2026-06-19 07:22:27,984 - experiment_functions - INFO - Early stopping at epoch 1550. Best Metrics: (0.016755799006735295, 0.0036677403056713407, 0.009073176572719643)
2026-06-19 07:22:28,064 - optuna.study.study - INFO - Trial 56 finished with values: [0.016755799006735295, 0.0036677403056713407, 0.009073176572719643] and parameters: {'n_layers': 4, 'embedding_dim': 256, 'lr': 0.00020897019229325828, 'lambda_val': 0.006230745660801204, 'batch_size': 3874, 'optimizer': 'RMSprop'}.
2026-06-19 07:25:28,645 - optuna.study.study - INFO - Trial 57 finished with values: [0.03318204006920783, 0.006932865984590122, 0.01910388303969652] and parameters: {'n_layers': 1, 'embedding_dim': 128, 'lr': 0.000670518483727842, 'lambda_val': 0.0001469242914477015, 'batch_size': 3739, 'optimizer': 'Adam'}.
2026-06-19 07:25:54,336 - experiment_functions - INFO - Early stopping at epoch 500. Best Metrics: (0.0006318101263715844, 0.00013420487558418593, 0.00035053445806450224)
2026-06-19 07:25:54,434 - optuna.study.study - INFO - Trial 58 finished with values: [0.0006318101263715844, 0.00013420487558418593, 0.00035053445806450224] and parameters: {'n_layers': 1, 'embedding_dim': 256, 'lr': 0.00011355078385550283, 'lambda_val': 0.06728318654293182, 'batch_size': 1901, 'optimizer': 'SGD'}.
2026-06-19 07:26:27,752 - experiment_functions - INFO - Early stopping at epoch 500. Best Metrics: (0.0005856614279210673, 0.00012315270935960593, 0.0003213372387256734)
2026-06-19 07:26:27,849 - optuna.study.study - INFO - Trial 59 finished with values: [0.0005856614279210673, 0.00012315270935960593, 0.0003213372387256734] and parameters: {'n_layers': 4, 'embedding_dim': 256, 'lr': 0.00011355078385550283, 'lambda_val': 7.365889217672151e-06, 'batch_size': 3104, 'optimizer': 'SGD'}.
2026-06-19 07:26:51,291 - experiment_functions - INFO - Early stopping at epoch 500. Best Metrics: (0.0006393715897250022, 0.00013736263736263736, 0.00031853556235416123)
2026-06-19 07:26:51,396 - optuna.study.study - INFO - Trial 60 finished with values: [0.0006393715897250022, 0.00013736263736263736, 0.00031853556235416123] and parameters: {'n_layers': 2, 'embedding_dim': 64, 'lr': 0.049960469253932695, 'lambda_val': 9.873205377622859e-06, 'batch_size': 1628, 'optimizer': 'SGD'}.
2026-06-19 07:27:28,187 - experiment_functions - INFO - Early stopping at epoch 650. Best Metrics: (0.017740702475134124, 0.003898256915498295, 0.009919027978967505)
2026-06-19 07:27:28,277 - optuna.study.study - INFO - Trial 61 finished with values: [0.017740702475134124, 0.003898256915498295, 0.009919027978967505] and parameters: {'n_layers': 2, 'embedding_dim': 256, 'lr': 0.0011560622109254449, 'lambda_val': 0.0023217792752353666, 'batch_size': 3323, 'optimizer': 'RMSprop'}.
2026-06-19 07:29:34,636 - experiment_functions - INFO - Early stopping at epoch 2950. Best Metrics: (0.005366236553742954, 0.0012188960464822535, 0.0028519872104382643)
2026-06-19 07:29:34,713 - optuna.study.study - INFO - Trial 62 finished with values: [0.005366236553742954, 0.0012188960464822535, 0.0028519872104382643] and parameters: {'n_layers': 2, 'embedding_dim': 64, 'lr': 0.034998205919097455, 'lambda_val': 0.015452769230831364, 'batch_size': 2324, 'optimizer': 'RMSprop'}.
2026-06-19 07:30:00,506 - experiment_functions - INFO - Early stopping at epoch 500. Best Metrics: (0.0005311210707587709, 0.00010578501957812304, 0.00027454244463930954)
2026-06-19 07:30:00,584 - optuna.study.study - INFO - Trial 63 finished with values: [0.0005311210707587709, 0.00010578501957812304, 0.00027454244463930954] and parameters: {'n_layers': 1, 'embedding_dim': 256, 'lr': 0.00011355078385550283, 'lambda_val': 0.034139488400065095, 'batch_size': 1913, 'optimizer': 'SGD'}.
2026-06-19 07:30:38,896 - experiment_functions - INFO - Early stopping at epoch 700. Best Metrics: (0.011959804620307005, 0.002527788303650373, 0.0067974968836415255)
2026-06-19 07:30:38,985 - optuna.study.study - INFO - Trial 64 finished with values: [0.011959804620307005, 0.002527788303650373, 0.0067974968836415255] and parameters: {'n_layers': 4, 'embedding_dim': 128, 'lr': 0.0016951471722144954, 'lambda_val': 2.013346843188833e-05, 'batch_size': 1913, 'optimizer': 'RMSprop'}.
2026-06-19 07:31:01,179 - experiment_functions - INFO - Early stopping at epoch 500. Best Metrics: (0.00044959983772981186, 0.00011525830491347733, 0.00025969621979189347)
2026-06-19 07:31:01,268 - optuna.study.study - INFO - Trial 65 finished with values: [0.00044959983772981186, 0.00011525830491347733, 0.00025969621979189347] and parameters: {'n_layers': 1, 'embedding_dim': 32, 'lr': 0.09622578043504722, 'lambda_val': 0.027956652497068718, 'batch_size': 1312, 'optimizer': 'SGD'}.
2026-06-19 07:31:33,010 - experiment_functions - INFO - Early stopping at epoch 700. Best Metrics: (0.0007935954322784317, 0.00015946696981179742, 0.0003913067535188928)
2026-06-19 07:31:33,092 - optuna.study.study - INFO - Trial 66 finished with values: [0.0007935954322784317, 0.00015946696981179742, 0.0003913067535188928] and parameters: {'n_layers': 1, 'embedding_dim': 96, 'lr': 2.6333158039727613e-05, 'lambda_val': 9.873205377622859e-06, 'batch_size': 3852, 'optimizer': 'RMSprop'}.
2026-06-19 07:31:59,045 - experiment_functions - INFO - Early stopping at epoch 500. Best Metrics: (0.0006594157260557772, 0.00013578375647341166, 0.0003532846618290173)
2026-06-19 07:31:59,271 - optuna.study.study - INFO - Trial 67 finished with values: [0.0006594157260557772, 0.00013578375647341166, 0.0003532846618290173] and parameters: {'n_layers': 4, 'embedding_dim': 96, 'lr': 6.072036627596599e-05, 'lambda_val': 4.276378934748554e-05, 'batch_size': 2567, 'optimizer': 'SGD'}.
2026-06-19 07:32:25,170 - experiment_functions - INFO - Early stopping at epoch 550. Best Metrics: (0.00762060090952883, 0.0016688770999115827, 0.004307322511256436)
2026-06-19 07:32:25,267 - optuna.study.study - INFO - Trial 68 finished with values: [0.00762060090952883, 0.0016688770999115827, 0.004307322511256436] and parameters: {'n_layers': 2, 'embedding_dim': 64, 'lr': 0.049960469253932695, 'lambda_val': 9.873205377622859e-06, 'batch_size': 1312, 'optimizer': 'Adam'}.
2026-06-19 07:33:00,849 - experiment_functions - INFO - Early stopping at epoch 750. Best Metrics: (0.02545052500929693, 0.005393457117595048, 0.01402369268147315)
2026-06-19 07:33:00,993 - optuna.study.study - INFO - Trial 69 finished with values: [0.02545052500929693, 0.005393457117595048, 0.01402369268147315] and parameters: {'n_layers': 1, 'embedding_dim': 128, 'lr': 0.0025726585227239724, 'lambda_val': 0.0003743444509143199, 'batch_size': 2567, 'optimizer': 'RMSprop'}.
2026-06-19 07:33:27,766 - experiment_functions - INFO - Early stopping at epoch 550. Best Metrics: (0.004553018036972063, 0.001037324744221296, 0.0025721151248331462)
