2026-06-23 05:49:36,526 - optuna.study.study - INFO - Trial 272 finished with values: [0.0273326103678173, 0.005947644309713275, 0.015844466104318347] and parameters: {'n_layers': 1, 'embedding_dim': 96, 'lr': 0.0054915489808154486, 'lambda_val': 0.0010840808687380718, 'batch_size': 2548, 'optimizer': 'Adam'}.
2026-06-23 05:50:38,821 - experiment_functions - INFO - Early stopping at epoch 1400. Best Metrics: (0.01301366989050689, 0.002791461412151067, 0.0072476615084876295)
2026-06-23 05:50:39,979 - optuna.study.study - INFO - Trial 273 finished with values: [0.01301366989050689, 0.002791461412151067, 0.0072476615084876295] and parameters: {'n_layers': 1, 'embedding_dim': 64, 'lr': 0.0054915489808154486, 'lambda_val': 0.0010840808687380718, 'batch_size': 1895, 'optimizer': 'RMSprop'}.
2026-06-23 05:54:53,486 - experiment_functions - INFO - Early stopping at epoch 3850. Best Metrics: (0.025976439587663266, 0.005601869394972844, 0.015140182777190914)
2026-06-23 05:54:53,797 - optuna.study.study - INFO - Trial 274 finished with values: [0.025976439587663266, 0.005601869394972844, 0.015140182777190914] and parameters: {'n_layers': 4, 'embedding_dim': 256, 'lr': 0.000267777720544778, 'lambda_val': 3.12735769757427e-06, 'batch_size': 1127, 'optimizer': 'RMSprop'}.
2026-06-23 05:55:56,250 - experiment_functions - INFO - Early stopping at epoch 1400. Best Metrics: (0.02006695677501389, 0.004555071365416193, 0.01112976796638206)
2026-06-23 05:55:56,402 - optuna.study.study - INFO - Trial 275 finished with values: [0.02006695677501389, 0.004555071365416193, 0.01112976796638206] and parameters: {'n_layers': 2, 'embedding_dim': 64, 'lr': 0.001046404922421146, 'lambda_val': 0.012248299243594626, 'batch_size': 536, 'optimizer': 'Adam'}.
2026-06-23 05:56:18,578 - experiment_functions - INFO - Early stopping at epoch 500. Best Metrics: (0.00044046418894249235, 0.00010104837691044587, 0.00022849751566302108)
2026-06-23 05:56:18,679 - optuna.study.study - INFO - Trial 276 finished with values: [0.00044046418894249235, 0.00010104837691044587, 0.00022849751566302108] and parameters: {'n_layers': 1, 'embedding_dim': 32, 'lr': 0.0015539285849009506, 'lambda_val': 1.1976797619462708e-05, 'batch_size': 2339, 'optimizer': 'SGD'}.
2026-06-23 05:58:16,102 - experiment_functions - INFO - Early stopping at epoch 2450. Best Metrics: (0.03079433424267428, 0.006542882404951372, 0.017525066261140598)
2026-06-23 05:58:16,205 - optuna.study.study - INFO - Trial 277 finished with values: [0.03079433424267428, 0.006542882404951372, 0.017525066261140598] and parameters: {'n_layers': 2, 'embedding_dim': 128, 'lr': 0.0004463508454333929, 'lambda_val': 4.072357478377281e-06, 'batch_size': 2144, 'optimizer': 'RMSprop'}.
2026-06-23 06:01:26,407 - optuna.study.study - INFO - Trial 278 finished with values: [0.029015695161608738, 0.006157635467980296, 0.016393777808956216] and parameters: {'n_layers': 2, 'embedding_dim': 128, 'lr': 0.0004463508454333929, 'lambda_val': 0.00019370302140894226, 'batch_size': 1807, 'optimizer': 'Adam'}.
2026-06-23 06:02:36,869 - experiment_functions - INFO - Early stopping at epoch 1500. Best Metrics: (0.032820261016507764, 0.006852343059239611, 0.018919386847133342)
2026-06-23 06:02:37,282 - optuna.study.study - INFO - Trial 279 finished with values: [0.032820261016507764, 0.006852343059239611, 0.018919386847133342] and parameters: {'n_layers': 1, 'embedding_dim': 128, 'lr': 0.0013029739660954116, 'lambda_val': 3.611427784790995e-05, 'batch_size': 3983, 'optimizer': 'Adam'}.
2026-06-23 06:05:36,305 - optuna.study.study - INFO - Trial 280 finished with values: [0.031711450274656196, 0.006784451181002906, 0.018043974879306934] and parameters: {'n_layers': 1, 'embedding_dim': 128, 'lr': 0.0008213174750905707, 'lambda_val': 1.1678222757114953e-05, 'batch_size': 940, 'optimizer': 'RMSprop'}.
2026-06-23 06:06:44,199 - experiment_functions - INFO - Early stopping at epoch 1200. Best Metrics: (0.02491952235334087, 0.005295566502463054, 0.014296344074207544)
2026-06-23 06:06:44,308 - optuna.study.study - INFO - Trial 281 finished with values: [0.02491952235334087, 0.005295566502463054, 0.014296344074207544] and parameters: {'n_layers': 2, 'embedding_dim': 256, 'lr': 0.0008213174750905707, 'lambda_val': 2.7464269407470928e-06, 'batch_size': 1887, 'optimizer': 'RMSprop'}.
2026-06-23 06:07:47,626 - experiment_functions - INFO - Early stopping at epoch 1450. Best Metrics: (0.02804375843165861, 0.005950802071491727, 0.015567358806293397)
2026-06-23 06:07:47,732 - optuna.study.study - INFO - Trial 282 finished with values: [0.02804375843165861, 0.005950802071491727, 0.015567358806293397] and parameters: {'n_layers': 2, 'embedding_dim': 32, 'lr': 0.0008213174750905707, 'lambda_val': 1.1976797619462708e-05, 'batch_size': 3305, 'optimizer': 'Adam'}.
2026-06-23 06:08:10,505 - experiment_functions - INFO - Early stopping at epoch 500. Best Metrics: (0.0006001527941210014, 0.0001373626373626374, 0.0003168591514472804)
2026-06-23 06:08:10,611 - optuna.study.study - INFO - Trial 283 finished with values: [0.0006001527941210014, 0.0001373626373626374, 0.0003168591514472804] and parameters: {'n_layers': 2, 'embedding_dim': 32, 'lr': 0.0025566338112489964, 'lambda_val': 1.1976797619462708e-05, 'batch_size': 3305, 'optimizer': 'SGD'}.
2026-06-23 06:08:41,936 - experiment_functions - INFO - Early stopping at epoch 550. Best Metrics: (0.009259495070426017, 0.002035177466211949, 0.0052868926600132685)
2026-06-23 06:08:42,041 - optuna.study.study - INFO - Trial 284 finished with values: [0.009259495070426017, 0.002035177466211949, 0.0052868926600132685] and parameters: {'n_layers': 4, 'embedding_dim': 128, 'lr': 0.0017388961332673292, 'lambda_val': 0.0011345897854453913, 'batch_size': 1180, 'optimizer': 'RMSprop'}.
2026-06-23 06:10:14,919 - experiment_functions - INFO - Early stopping at epoch 2000. Best Metrics: (0.02957285781741809, 0.006159214348869521, 0.01668788313644671)
2026-06-23 06:10:15,020 - optuna.study.study - INFO - Trial 285 finished with values: [0.02957285781741809, 0.006159214348869521, 0.01668788313644671] and parameters: {'n_layers': 2, 'embedding_dim': 96, 'lr': 0.0008213174750905707, 'lambda_val': 1.8703322549546159e-06, 'batch_size': 2258, 'optimizer': 'Adam'}.
2026-06-23 06:13:00,775 - optuna.study.study - INFO - Trial 286 finished with values: [0.030362476390213472, 0.0065002526209422765, 0.017390171716614274] and parameters: {'n_layers': 1, 'embedding_dim': 32, 'lr': 0.0008213174750905707, 'lambda_val': 1.1678222757114953e-05, 'batch_size': 1895, 'optimizer': 'Adam'}.
2026-06-23 06:13:58,721 - experiment_functions - INFO - Early stopping at epoch 1250. Best Metrics: (0.02106672901949983, 0.0045850701023114815, 0.012164633525232522)
2026-06-23 06:13:58,819 - optuna.study.study - INFO - Trial 287 finished with values: [0.02106672901949983, 0.0045850701023114815, 0.012164633525232522] and parameters: {'n_layers': 4, 'embedding_dim': 32, 'lr': 0.0008639986019635256, 'lambda_val': 0.00013327634882419378, 'batch_size': 1341, 'optimizer': 'RMSprop'}.
2026-06-23 06:14:45,321 - experiment_functions - INFO - Early stopping at epoch 1000. Best Metrics: (0.03144053323050522, 0.006501831501831503, 0.01783282682023502)
2026-06-23 06:14:45,426 - optuna.study.study - INFO - Trial 288 finished with values: [0.03144053323050522, 0.006501831501831503, 0.01783282682023502] and parameters: {'n_layers': 1, 'embedding_dim': 128, 'lr': 0.0025566338112489964, 'lambda_val': 0.00019370302140894226, 'batch_size': 1807, 'optimizer': 'Adam'}.
2026-06-23 06:15:17,421 - experiment_functions - INFO - Early stopping at epoch 650. Best Metrics: (0.024440665978298942, 0.005257673361121637, 0.014010109677414154)
2026-06-23 06:15:17,532 - optuna.study.study - INFO - Trial 289 finished with values: [0.024440665978298942, 0.005257673361121637, 0.014010109677414154] and parameters: {'n_layers': 2, 'embedding_dim': 96, 'lr': 0.0025566338112489964, 'lambda_val': 1.1976797619462708e-05, 'batch_size': 3305, 'optimizer': 'Adam'}.
2026-06-23 06:16:25,720 - experiment_functions - INFO - Early stopping at epoch 1500. Best Metrics: (0.023829722027804173, 0.005450296829607175, 0.013409055415594782)
2026-06-23 06:16:25,824 - optuna.study.study - INFO - Trial 290 finished with values: [0.023829722027804173, 0.005450296829607175, 0.013409055415594782] and parameters: {'n_layers': 1, 'embedding_dim': 128, 'lr': 0.0008213174750905707, 'lambda_val': 0.018126568573406728, 'batch_size': 2754, 'optimizer': 'Adam'}.
2026-06-23 06:19:05,061 - optuna.study.study - INFO - Trial 291 finished with values: [0.0014598982306535963, 0.00035366931918656057, 0.0008473376862106073] and parameters: {'n_layers': 1, 'embedding_dim': 32, 'lr': 0.00030540819284946834, 'lambda_val': 0.0010840808687380718, 'batch_size': 1895, 'optimizer': 'RMSprop'}.
2026-06-23 06:20:35,635 - experiment_functions - INFO - Early stopping at epoch 2100. Best Metrics: (0.033135163228696696, 0.006913919413919414, 0.018605856718431023)
2026-06-23 06:20:35,756 - optuna.study.study - INFO - Trial 292 finished with values: [0.033135163228696696, 0.006913919413919414, 0.018605856718431023] and parameters: {'n_layers': 1, 'embedding_dim': 64, 'lr': 0.0013029739660954116, 'lambda_val': 7.304755459977147e-06, 'batch_size': 3983, 'optimizer': 'Adam'}.
2026-06-23 06:23:19,381 - experiment_functions - INFO - Early stopping at epoch 3900. Best Metrics: (0.027548510983322297, 0.005908172287482632, 0.016015450558817628)
2026-06-23 06:23:19,482 - optuna.study.study - INFO - Trial 293 finished with values: [0.027548510983322297, 0.005908172287482632, 0.016015450558817628] and parameters: {'n_layers': 2, 'embedding_dim': 32, 'lr': 0.0006919442047023748, 'lambda_val': 0.0011345897854453913, 'batch_size': 1807, 'optimizer': 'RMSprop'}.
2026-06-23 06:26:04,446 - optuna.study.study - INFO - Trial 294 finished with values: [0.029485632824476086, 0.006358153340911961, 0.017106871163184236] and parameters: {'n_layers': 1, 'embedding_dim': 32, 'lr': 0.0006886562164819431, 'lambda_val': 2.7464269407470928e-06, 'batch_size': 2330, 'optimizer': 'RMSprop'}.
2026-06-23 06:26:52,915 - experiment_functions - INFO - Early stopping at epoch 1000. Best Metrics: (0.019333393454600698, 0.004108248073765315, 0.010622611950530145)
2026-06-23 06:26:53,026 - optuna.study.study - INFO - Trial 295 finished with values: [0.019333393454600698, 0.004108248073765315, 0.010622611950530145] and parameters: {'n_layers': 4, 'embedding_dim': 64, 'lr': 0.0008213174750905707, 'lambda_val': 1.1678222757114953e-05, 'batch_size': 3701, 'optimizer': 'Adam'}.
2026-06-23 06:28:59,626 - experiment_functions - INFO - Early stopping at epoch 2550. Best Metrics: (0.032455440836860694, 0.006858658582796513, 0.01864743527256895)
2026-06-23 06:28:59,727 - optuna.study.study - INFO - Trial 296 finished with values: [0.032455440836860694, 0.006858658582796513, 0.01864743527256895] and parameters: {'n_layers': 1, 'embedding_dim': 256, 'lr': 0.001046404922421146, 'lambda_val': 0.0010840808687380718, 'batch_size': 1807, 'optimizer': 'Adam'}.
2026-06-23 06:31:47,005 - optuna.study.study - INFO - Trial 297 finished with values: [0.03373678251494297, 0.007084438549955792, 0.01902456204793884] and parameters: {'n_layers': 1, 'embedding_dim': 32, 'lr': 0.001046404922421146, 'lambda_val': 0.0010840808687380718, 'batch_size': 2754, 'optimizer': 'RMSprop'}.
2026-06-23 06:33:25,457 - experiment_functions - INFO - Early stopping at epoch 2250. Best Metrics: (0.02359870692560709, 0.004987684729064039, 0.013507917602165897)
2026-06-23 06:33:25,561 - optuna.study.study - INFO - Trial 298 finished with values: [0.02359870692560709, 0.004987684729064039, 0.013507917602165897] and parameters: {'n_layers': 4, 'embedding_dim': 32, 'lr': 0.0004713458926928272, 'lambda_val': 8.867377208453881e-05, 'batch_size': 2330, 'optimizer': 'RMSprop'}.
2026-06-23 06:34:00,429 - experiment_functions - INFO - Early stopping at epoch 750. Best Metrics: (0.028331019078896003, 0.005927118858153341, 0.01637302712286203)
2026-06-23 06:34:01,023 - optuna.study.study - INFO - Trial 299 finished with values: [0.028331019078896003, 0.005927118858153341, 0.01637302712286203] and parameters: {'n_layers': 2, 'embedding_dim': 64, 'lr': 0.0016936188017047076, 'lambda_val': 0.0010840808687380718, 'batch_size': 3203, 'optimizer': 'Adam'}.
2026-06-23 06:34:01,038 - root - INFO - Selected Trial 250 based on Max ndcg: 0.0202
2026-06-23 06:34:01,038 - root - INFO - Associated Recall: 0.0358
2026-06-23 06:34:01,038 - experiment_functions - INFO - Training the best model ... for e_yelp_1c2dcs_rand3
2026-06-23 06:37:01,833 - root - INFO -   **** Training e_yelp_1c2dcs_rand4
2026-06-23 06:37:02,009 - root - INFO -   **** Getting 575241/1274132 random edges
2026-06-23 06:37:02,348 - optuna.storages._rdb.storage - INFO - A new study created in RDB with name: Study_e_yelp_1c2dcs_rand4
2026-06-23 06:37:33,365 - experiment_functions - INFO - Early stopping at epoch 500. Best Metrics: (0.0005166329272907012, 0.00012157382847038021, 0.0002557435949009416)
2026-06-23 06:37:33,748 - optuna.study.study - INFO - Trial 0 finished with values: [0.0005166329272907012, 0.00012157382847038021, 0.0002557435949009416] and parameters: {'n_layers': 3, 'embedding_dim': 256, 'lr': 2.6105982570632826e-05, 'lambda_val': 0.012052647298463197, 'batch_size': 3473, 'optimizer': 'SGD'}.
2026-06-23 06:38:05,015 - experiment_functions - INFO - Early stopping at epoch 500. Best Metrics: (0.00046912579444138494, 0.00011052166224580017, 0.0002794256450643984)
2026-06-23 06:38:05,123 - optuna.study.study - INFO - Trial 1 finished with values: [0.00046912579444138494, 0.00011052166224580017, 0.0002794256450643984] and parameters: {'n_layers': 3, 'embedding_dim': 256, 'lr': 0.002007981082492907, 'lambda_val': 3.687670906218985e-06, 'batch_size': 2782, 'optimizer': 'SGD'}.
2026-06-23 06:38:34,477 - experiment_functions - INFO - Early stopping at epoch 650. Best Metrics: (0.018217320911002657, 0.004040356195528609, 0.010230503611609801)
2026-06-23 06:38:34,796 - optuna.study.study - INFO - Trial 2 finished with values: [0.018217320911002657, 0.004040356195528609, 0.010230503611609801] and parameters: {'n_layers': 3, 'embedding_dim': 32, 'lr': 0.0024861194796259945, 'lambda_val': 0.0010797193056675054, 'batch_size': 3397, 'optimizer': 'Adam'}.
2026-06-23 06:39:02,038 - experiment_functions - INFO - Early stopping at epoch 600. Best Metrics: (0.021985015001708297, 0.004671908551218897, 0.012347153528888358)
2026-06-23 06:39:02,147 - optuna.study.study - INFO - Trial 3 finished with values: [0.021985015001708297, 0.004671908551218897, 0.012347153528888358] and parameters: {'n_layers': 2, 'embedding_dim': 32, 'lr': 0.005823892895958369, 'lambda_val': 0.0006793861457506547, 'batch_size': 3285, 'optimizer': 'Adam'}.
2026-06-23 06:39:45,192 - experiment_functions - INFO - Early stopping at epoch 750. Best Metrics: (0.025806488753384562, 0.005507136541619302, 0.014700188087434259)
2026-06-23 06:39:45,597 - optuna.study.study - INFO - Trial 4 finished with values: [0.025806488753384562, 0.005507136541619302, 0.014700188087434259] and parameters: {'n_layers': 2, 'embedding_dim': 256, 'lr': 0.0014983681509322957, 'lambda_val': 1.4455102909472541e-06, 'batch_size': 2908, 'optimizer': 'Adam'}.
2026-06-23 06:42:40,639 - optuna.study.study - INFO - Trial 5 finished with values: [0.03436515189676218, 0.007217064544650751, 0.019642045648472724] and parameters: {'n_layers': 1, 'embedding_dim': 96, 'lr': 0.0008906516956334841, 'lambda_val': 5.8617508553429225e-05, 'batch_size': 3129, 'optimizer': 'Adam'}.
2026-06-23 06:43:05,527 - experiment_functions - INFO - Early stopping at epoch 500. Best Metrics: (0.0005313213032362439, 0.00011841606669192877, 0.00026826353019249644)
2026-06-23 06:43:05,876 - optuna.study.study - INFO - Trial 6 finished with values: [0.0005313213032362439, 0.00011841606669192877, 0.00026826353019249644] and parameters: {'n_layers': 2, 'embedding_dim': 128, 'lr': 0.04541858070402749, 'lambda_val': 1.2730621642892536e-06, 'batch_size': 849, 'optimizer': 'SGD'}.
2026-06-23 06:43:39,843 - experiment_functions - INFO - Early stopping at epoch 700. Best Metrics: (0.0006389219681909817, 0.00012788935202728306, 0.0003113419951689428)
2026-06-23 06:43:39,947 - optuna.study.study - INFO - Trial 7 finished with values: [0.0006389219681909817, 0.00012788935202728306, 0.0003113419951689428] and parameters: {'n_layers': 4, 'embedding_dim': 64, 'lr': 1.4776366612197298e-05, 'lambda_val': 1.416396990125415e-05, 'batch_size': 3860, 'optimizer': 'RMSprop'}.
2026-06-23 06:44:02,367 - experiment_functions - INFO - Early stopping at epoch 500. Best Metrics: (0.000664610718262084, 0.00014525704180876593, 0.000359867292978092)
2026-06-23 06:44:02,510 - optuna.study.study - INFO - Trial 8 finished with values: [0.000664610718262084, 0.00014525704180876593, 0.000359867292978092] and parameters: {'n_layers': 2, 'embedding_dim': 32, 'lr': 0.000768516457181297, 'lambda_val': 1.1578592623213694e-05, 'batch_size': 2608, 'optimizer': 'SGD'}.
2026-06-23 06:46:55,419 - optuna.study.study - INFO - Trial 9 finished with values: [0.021783900162965168, 0.004874005305039788, 0.012690168564597575] and parameters: {'n_layers': 4, 'embedding_dim': 32, 'lr': 0.00031010998647899147, 'lambda_val': 4.540657949071036e-06, 'batch_size': 786, 'optimizer': 'RMSprop'}.
2026-06-23 06:47:29,671 - experiment_functions - INFO - Early stopping at epoch 500. Best Metrics: (0.00046623335914529156, 0.0001215738284703802, 0.0002359760471757333)
2026-06-23 06:47:29,808 - optuna.study.study - INFO - Trial 10 finished with values: [0.00046623335914529156, 0.0001215738284703802, 0.0002359760471757333] and parameters: {'n_layers': 4, 'embedding_dim': 256, 'lr': 0.0008873329418261425, 'lambda_val': 1.1627342975585443e-05, 'batch_size': 3867, 'optimizer': 'SGD'}.
2026-06-23 06:48:31,905 - experiment_functions - INFO - Early stopping at epoch 1300. Best Metrics: (0.009236310550897565, 0.0019941265630920805, 0.005158210455138227)
2026-06-23 06:48:32,017 - optuna.study.study - INFO - Trial 11 finished with values: [0.009236310550897565, 0.0019941265630920805, 0.005158210455138227] and parameters: {'n_layers': 2, 'embedding_dim': 128, 'lr': 0.007403758276913583, 'lambda_val': 0.00019730135054936066, 'batch_size': 1819, 'optimizer': 'Adam'}.
2026-06-23 06:49:03,722 - experiment_functions - INFO - Early stopping at epoch 500. Best Metrics: (0.0006462506143527557, 0.00014052039914108882, 0.000346743782962205)
2026-06-23 06:49:03,828 - optuna.study.study - INFO - Trial 12 finished with values: [0.0006462506143527557, 0.00014052039914108882, 0.000346743782962205] and parameters: {'n_layers': 3, 'embedding_dim': 256, 'lr': 1.1875036891029449e-05, 'lambda_val': 0.08903549170335508, 'batch_size': 2405, 'optimizer': 'RMSprop'}.
2026-06-23 06:49:26,252 - experiment_functions - INFO - Early stopping at epoch 500. Best Metrics: (0.0006659392718510373, 0.0001405203991410888, 0.00036419139878532435)
2026-06-23 06:49:26,398 - optuna.study.study - INFO - Trial 13 finished with values: [0.0006659392718510373, 0.0001405203991410888, 0.00036419139878532435] and parameters: {'n_layers': 1, 'embedding_dim': 32, 'lr': 6.881478597723335e-05, 'lambda_val': 0.004073293065181196, 'batch_size': 680, 'optimizer': 'SGD'}.
2026-06-23 06:49:56,201 - experiment_functions - INFO - Early stopping at epoch 700. Best Metrics: (0.0004888575817204527, 0.00011999494758115448, 0.0002885272003085461)
2026-06-23 06:49:56,314 - optuna.study.study - INFO - Trial 14 finished with values: [0.0004888575817204527, 0.00011999494758115448, 0.0002885272003085461] and parameters: {'n_layers': 1, 'embedding_dim': 32, 'lr': 0.0001778405484274013, 'lambda_val': 0.005255235569246664, 'batch_size': 2463, 'optimizer': 'Adam'}.
2026-06-23 06:50:19,365 - experiment_functions - INFO - Early stopping at epoch 500. Best Metrics: (0.0005464584098092256, 0.00011999494758115447, 0.00028643162568085833)
2026-06-23 06:50:19,468 - optuna.study.study - INFO - Trial 15 finished with values: [0.0005464584098092256, 0.00011999494758115447, 0.00028643162568085833] and parameters: {'n_layers': 4, 'embedding_dim': 32, 'lr': 1.1366505982447794e-05, 'lambda_val': 0.0626746731647964, 'batch_size': 2216, 'optimizer': 'SGD'}.
2026-06-23 06:51:26,144 - experiment_functions - INFO - Early stopping at epoch 1550. Best Metrics: (0.0004911413115652136, 0.00011999494758115448, 0.00024291660374316617)
2026-06-23 06:51:26,271 - optuna.study.study - INFO - Trial 16 finished with values: [0.0004911413115652136, 0.00011999494758115448, 0.00024291660374316617] and parameters: {'n_layers': 2, 'embedding_dim': 64, 'lr': 4.062469908079539e-05, 'lambda_val': 1.0227642833031926e-05, 'batch_size': 3372, 'optimizer': 'Adam'}.
2026-06-23 06:51:59,239 - experiment_functions - INFO - Early stopping at epoch 750. Best Metrics: (0.017709563791838676, 0.0040182518630794495, 0.009869242134994552)
2026-06-23 06:51:59,356 - optuna.study.study - INFO - Trial 17 finished with values: [0.017709563791838676, 0.0040182518630794495, 0.009869242134994552] and parameters: {'n_layers': 2, 'embedding_dim': 32, 'lr': 0.0009472628048121326, 'lambda_val': 0.019684317126267517, 'batch_size': 3610, 'optimizer': 'RMSprop'}.
2026-06-23 06:53:25,159 - experiment_functions - INFO - Early stopping at epoch 1650. Best Metrics: (0.000642269740547178, 0.00014209928003031453, 0.00034307755319659114)
2026-06-23 06:53:25,270 - optuna.study.study - INFO - Trial 18 finished with values: [0.000642269740547178, 0.00014209928003031453, 0.00034307755319659114] and parameters: {'n_layers': 4, 'embedding_dim': 128, 'lr': 2.9481170637277455e-05, 'lambda_val': 7.223435586332182e-05, 'batch_size': 1903, 'optimizer': 'RMSprop'}.
2026-06-23 06:54:06,531 - experiment_functions - INFO - Early stopping at epoch 850. Best Metrics: (0.028195100173620872, 0.006083428066186688, 0.016466342359943816)
