2026-06-17 16:42:57,279 - optuna.study.study - INFO - Trial 290 finished with values: [0.000394194723606128, 0.00010736390046734874, 0.00022515093045207931] and parameters: {'n_layers': 4, 'embedding_dim': 96, 'lr': 0.0005841453281578621, 'lambda_val': 1.0310836199436669e-05, 'batch_size': 3853, 'optimizer': 'SGD'}.
2026-06-17 16:45:24,589 - experiment_functions - INFO - Early stopping at epoch 3450. Best Metrics: (0.0032219968023279536, 0.0007783882783882784, 0.002008885939629895)
2026-06-17 16:45:24,689 - optuna.study.study - INFO - Trial 291 finished with values: [0.0032219968023279536, 0.0007783882783882784, 0.002008885939629895] and parameters: {'n_layers': 2, 'embedding_dim': 128, 'lr': 0.0005841453281578621, 'lambda_val': 1.170012968533328e-05, 'batch_size': 3100, 'optimizer': 'RMSprop'}.
2026-06-17 16:47:18,650 - experiment_functions - INFO - Early stopping at epoch 2150. Best Metrics: (0.0033886393149668015, 0.0009046987495263357, 0.0020885663043751714)
2026-06-17 16:47:18,755 - optuna.study.study - INFO - Trial 292 finished with values: [0.0033886393149668015, 0.0009046987495263357, 0.0020885663043751714] and parameters: {'n_layers': 4, 'embedding_dim': 256, 'lr': 0.0005841453281578621, 'lambda_val': 1.0310836199436669e-05, 'batch_size': 3853, 'optimizer': 'RMSprop'}.
2026-06-17 16:48:02,781 - experiment_functions - INFO - Early stopping at epoch 800. Best Metrics: (0.0005998129998630399, 0.00013262599469496023, 0.00035083488831284164)
2026-06-17 16:48:02,883 - optuna.study.study - INFO - Trial 293 finished with values: [0.0005998129998630399, 0.00013262599469496023, 0.00035083488831284164] and parameters: {'n_layers': 4, 'embedding_dim': 256, 'lr': 1.1703103187218466e-05, 'lambda_val': 0.003623250527584803, 'batch_size': 3141, 'optimizer': 'RMSprop'}.
2026-06-17 16:49:47,995 - experiment_functions - INFO - Early stopping at epoch 2400. Best Metrics: (0.00409041693782932, 0.000988379436655299, 0.002442637894846274)
2026-06-17 16:49:48,094 - optuna.study.study - INFO - Trial 294 finished with values: [0.00409041693782932, 0.000988379436655299, 0.002442637894846274] and parameters: {'n_layers': 4, 'embedding_dim': 96, 'lr': 0.0005773267382294165, 'lambda_val': 1.0310836199436669e-05, 'batch_size': 2590, 'optimizer': 'RMSprop'}.
2026-06-17 16:50:17,523 - experiment_functions - INFO - Early stopping at epoch 650. Best Metrics: (0.0025425459195447405, 0.0006710243779209298, 0.0016249372933655089)
2026-06-17 16:50:18,560 - optuna.study.study - INFO - Trial 295 finished with values: [0.0025425459195447405, 0.0006710243779209298, 0.0016249372933655089] and parameters: {'n_layers': 3, 'embedding_dim': 96, 'lr': 0.0017238025221562986, 'lambda_val': 0.018782172642730847, 'batch_size': 1975, 'optimizer': 'RMSprop'}.
2026-06-17 16:52:33,304 - experiment_functions - INFO - Early stopping at epoch 3300. Best Metrics: (0.0029213590208686502, 0.0006220790703549325, 0.0018002987031958035)
2026-06-17 16:52:33,410 - optuna.study.study - INFO - Trial 296 finished with values: [0.0029213590208686502, 0.0006220790703549325, 0.0018002987031958035] and parameters: {'n_layers': 1, 'embedding_dim': 128, 'lr': 0.0005841453281578621, 'lambda_val': 1.0310836199436669e-05, 'batch_size': 1677, 'optimizer': 'Adam'}.
2026-06-17 16:54:15,776 - experiment_functions - INFO - Early stopping at epoch 2450. Best Metrics: (0.003609709195760913, 0.0008778577744094987, 0.0022502327336124074)
2026-06-17 16:54:15,963 - optuna.study.study - INFO - Trial 297 finished with values: [0.003609709195760913, 0.0008778577744094987, 0.0022502327336124074] and parameters: {'n_layers': 4, 'embedding_dim': 64, 'lr': 0.0005841453281578621, 'lambda_val': 1.170012968533328e-05, 'batch_size': 2288, 'optimizer': 'RMSprop'}.
2026-06-17 16:57:24,527 - optuna.study.study - INFO - Trial 298 finished with values: [0.0026372617839913607, 0.000641025641025641, 0.0016240614698463697] and parameters: {'n_layers': 2, 'embedding_dim': 256, 'lr': 0.0005841453281578621, 'lambda_val': 1.0310836199436669e-05, 'batch_size': 934, 'optimizer': 'Adam'}.
2026-06-17 17:00:45,403 - optuna.study.study - INFO - Trial 299 finished with values: [0.003073925032118176, 0.0007862826828344071, 0.0019673659939832] and parameters: {'n_layers': 3, 'embedding_dim': 256, 'lr': 0.0005086943405728801, 'lambda_val': 0.00027668479073292746, 'batch_size': 1552, 'optimizer': 'Adam'}.
2026-06-17 17:00:45,419 - root - INFO - Selected Trial 273 based on Max ndcg: 0.0028
2026-06-17 17:00:45,419 - root - INFO - Associated Recall: 0.0042
2026-06-17 17:00:45,419 - experiment_functions - INFO - Training the best model ... for e_yelp_1c1dcs_strict_rand1
2026-06-17 17:02:00,310 - experiment_functions - INFO - Early stopping at epoch 1600. Best Metrics: (0.0038250307582398317, 0.0009789061513199445, 0.0024585077709055317)
2026-06-17 17:02:03,990 - root - INFO -   **** Training e_yelp_1c1dcs_strict_rand2
2026-06-17 17:02:04,003 - root - INFO -   **** Getting 34724/1274132 random edges
2026-06-17 17:02:04,652 - optuna.storages._rdb.storage - INFO - A new study created in RDB with name: Study_e_yelp_1c1dcs_strict_rand2
2026-06-17 17:04:55,893 - experiment_functions - INFO - Early stopping at epoch 3900. Best Metrics: (0.0006014066531184907, 0.00014367816091954023, 0.00033685223327051397)
2026-06-17 17:04:56,375 - optuna.study.study - INFO - Trial 0 finished with values: [0.0006014066531184907, 0.00014367816091954023, 0.00033685223327051397] and parameters: {'n_layers': 1, 'embedding_dim': 256, 'lr': 1.78217833517881e-05, 'lambda_val': 2.1342543930303124e-06, 'batch_size': 627, 'optimizer': 'RMSprop'}.
2026-06-17 17:05:19,065 - experiment_functions - INFO - Early stopping at epoch 500. Best Metrics: (0.0005225332347161889, 0.0001231527093596059, 0.00029493469994647855)
2026-06-17 17:05:19,165 - optuna.study.study - INFO - Trial 1 finished with values: [0.0005225332347161889, 0.0001231527093596059, 0.00029493469994647855] and parameters: {'n_layers': 3, 'embedding_dim': 32, 'lr': 0.00032245148595006645, 'lambda_val': 0.010895628954100298, 'batch_size': 2801, 'optimizer': 'SGD'}.
2026-06-17 17:05:44,252 - experiment_functions - INFO - Early stopping at epoch 500. Best Metrics: (0.0006190140176317632, 0.00013736263736263736, 0.000317567609480218)
2026-06-17 17:05:44,589 - optuna.study.study - INFO - Trial 2 finished with values: [0.0006190140176317632, 0.00013736263736263736, 0.000317567609480218] and parameters: {'n_layers': 4, 'embedding_dim': 128, 'lr': 0.00018285896437069874, 'lambda_val': 0.0009547772999986335, 'batch_size': 1059, 'optimizer': 'SGD'}.
2026-06-17 17:06:13,504 - experiment_functions - INFO - Early stopping at epoch 500. Best Metrics: (0.0005723002817519708, 0.0001310471138057345, 0.0003170845524513859)
2026-06-17 17:06:14,025 - optuna.study.study - INFO - Trial 3 finished with values: [0.0005723002817519708, 0.0001310471138057345, 0.0003170845524513859] and parameters: {'n_layers': 4, 'embedding_dim': 256, 'lr': 0.049835676133536275, 'lambda_val': 0.024664475751762508, 'batch_size': 3011, 'optimizer': 'SGD'}.
2026-06-17 17:06:49,405 - experiment_functions - INFO - Early stopping at epoch 750. Best Metrics: (0.003344916330635516, 0.0008494379184034359, 0.0021285561480115576)
2026-06-17 17:06:49,760 - optuna.study.study - INFO - Trial 4 finished with values: [0.003344916330635516, 0.0008494379184034359, 0.0021285561480115576] and parameters: {'n_layers': 4, 'embedding_dim': 96, 'lr': 0.0036567747130372475, 'lambda_val': 6.0082896507722305e-05, 'batch_size': 2347, 'optimizer': 'Adam'}.
2026-06-17 17:07:50,539 - experiment_functions - INFO - Early stopping at epoch 1100. Best Metrics: (0.0014821106269602288, 0.0004294556018693949, 0.0010006202806429726)
2026-06-17 17:07:50,640 - optuna.study.study - INFO - Trial 5 finished with values: [0.0014821106269602288, 0.0004294556018693949, 0.0010006202806429726] and parameters: {'n_layers': 4, 'embedding_dim': 256, 'lr': 0.07054484866312165, 'lambda_val': 0.06978294354155122, 'batch_size': 2993, 'optimizer': 'RMSprop'}.
2026-06-17 17:08:15,466 - experiment_functions - INFO - Early stopping at epoch 500. Best Metrics: (0.000450597961029129, 0.00010894278135657447, 0.0002831837435796719)
2026-06-17 17:08:15,607 - optuna.study.study - INFO - Trial 6 finished with values: [0.000450597961029129, 0.00010894278135657447, 0.0002831837435796719] and parameters: {'n_layers': 4, 'embedding_dim': 128, 'lr': 0.07994315049293382, 'lambda_val': 0.00020335857686283493, 'batch_size': 2527, 'optimizer': 'SGD'}.
2026-06-17 17:08:40,566 - experiment_functions - INFO - Early stopping at epoch 550. Best Metrics: (0.001966316427696082, 0.00045313881520778074, 0.0011791344117929807)
2026-06-17 17:08:40,669 - optuna.study.study - INFO - Trial 7 finished with values: [0.001966316427696082, 0.00045313881520778074, 0.0011791344117929807] and parameters: {'n_layers': 1, 'embedding_dim': 96, 'lr': 0.062357384270714994, 'lambda_val': 0.0002714717918892815, 'batch_size': 649, 'optimizer': 'Adam'}.
2026-06-17 17:09:03,613 - experiment_functions - INFO - Early stopping at epoch 500. Best Metrics: (0.0005432649148437202, 0.00012473159024883163, 0.0003154095934729778)
2026-06-17 17:09:03,722 - optuna.study.study - INFO - Trial 8 finished with values: [0.0005432649148437202, 0.00012473159024883163, 0.0003154095934729778] and parameters: {'n_layers': 2, 'embedding_dim': 96, 'lr': 0.0001141841111011795, 'lambda_val': 0.006488374405945417, 'batch_size': 2348, 'optimizer': 'SGD'}.
2026-06-17 17:10:50,124 - experiment_functions - INFO - Early stopping at epoch 2000. Best Metrics: (0.0005456399748843581, 0.0001231527093596059, 0.00031671562883385084)
2026-06-17 17:10:50,227 - optuna.study.study - INFO - Trial 9 finished with values: [0.0005456399748843581, 0.0001231527093596059, 0.00031671562883385084] and parameters: {'n_layers': 4, 'embedding_dim': 256, 'lr': 1.0756916422778422e-05, 'lambda_val': 1.258492397137598e-06, 'batch_size': 3186, 'optimizer': 'RMSprop'}.
2026-06-17 17:11:17,858 - experiment_functions - INFO - Early stopping at epoch 550. Best Metrics: (0.002884193018604326, 0.0007499684223822155, 0.0018837866295155115)
2026-06-17 17:11:17,957 - optuna.study.study - INFO - Trial 10 finished with values: [0.002884193018604326, 0.0007499684223822155, 0.0018837866295155115] and parameters: {'n_layers': 4, 'embedding_dim': 128, 'lr': 0.005194518548706596, 'lambda_val': 0.000105123201052829, 'batch_size': 3749, 'optimizer': 'RMSprop'}.
2026-06-17 17:14:02,579 - optuna.study.study - INFO - Trial 11 finished with values: [0.0009244954182719805, 0.00019893899204244034, 0.000541181415679306] and parameters: {'n_layers': 3, 'embedding_dim': 64, 'lr': 0.0001009171243279576, 'lambda_val': 9.444535564429457e-05, 'batch_size': 822, 'optimizer': 'RMSprop'}.
2026-06-17 17:14:25,643 - experiment_functions - INFO - Early stopping at epoch 500. Best Metrics: (0.00042865147529662687, 0.0001026272577996716, 0.00023493653683649568)
2026-06-17 17:14:25,743 - optuna.study.study - INFO - Trial 12 finished with values: [0.00042865147529662687, 0.0001026272577996716, 0.00023493653683649568] and parameters: {'n_layers': 3, 'embedding_dim': 96, 'lr': 0.0032264179945585077, 'lambda_val': 0.0005165053149204135, 'batch_size': 819, 'optimizer': 'SGD'}.
2026-06-17 17:14:50,766 - experiment_functions - INFO - Early stopping at epoch 550. Best Metrics: (0.0030623719588772943, 0.000680497663256284, 0.0019239345383384502)
2026-06-17 17:14:50,914 - optuna.study.study - INFO - Trial 13 finished with values: [0.0030623719588772943, 0.000680497663256284, 0.0019239345383384502] and parameters: {'n_layers': 3, 'embedding_dim': 64, 'lr': 0.009940147183797932, 'lambda_val': 0.00038344044885887376, 'batch_size': 3351, 'optimizer': 'Adam'}.
2026-06-17 17:15:13,127 - experiment_functions - INFO - Early stopping at epoch 500. Best Metrics: (0.0005700150172519893, 0.00012946823291650877, 0.0003086933872079181)
2026-06-17 17:15:13,249 - optuna.study.study - INFO - Trial 14 finished with values: [0.0005700150172519893, 0.00012946823291650877, 0.0003086933872079181] and parameters: {'n_layers': 3, 'embedding_dim': 32, 'lr': 3.254930242892046e-05, 'lambda_val': 0.00015440813799502288, 'batch_size': 3890, 'optimizer': 'SGD'}.
2026-06-17 17:16:11,608 - experiment_functions - INFO - Early stopping at epoch 1400. Best Metrics: (0.0030092014870985594, 0.000680497663256284, 0.001789342240366851)
2026-06-17 17:16:11,717 - optuna.study.study - INFO - Trial 15 finished with values: [0.0030092014870985594, 0.000680497663256284, 0.001789342240366851] and parameters: {'n_layers': 1, 'embedding_dim': 96, 'lr': 0.0022093138255607526, 'lambda_val': 4.81416094322387e-06, 'batch_size': 3730, 'optimizer': 'Adam'}.
2026-06-17 17:16:36,032 - experiment_functions - INFO - Early stopping at epoch 550. Best Metrics: (0.0025887438660661425, 0.0006410256410256411, 0.0015758197736024297)
2026-06-17 17:16:36,131 - optuna.study.study - INFO - Trial 16 finished with values: [0.0025887438660661425, 0.0006410256410256411, 0.0015758197736024297] and parameters: {'n_layers': 4, 'embedding_dim': 32, 'lr': 0.027019907715942967, 'lambda_val': 0.0009603984098533798, 'batch_size': 1787, 'optimizer': 'Adam'}.
2026-06-17 17:16:59,632 - experiment_functions - INFO - Early stopping at epoch 500. Best Metrics: (0.0006518804886424639, 0.0001310471138057345, 0.0003382497254308525)
2026-06-17 17:16:59,737 - optuna.study.study - INFO - Trial 17 finished with values: [0.0006518804886424639, 0.0001310471138057345, 0.0003382497254308525] and parameters: {'n_layers': 3, 'embedding_dim': 96, 'lr': 0.02235848414875542, 'lambda_val': 1.337425298324593e-06, 'batch_size': 2894, 'optimizer': 'SGD'}.
2026-06-17 17:17:22,787 - experiment_functions - INFO - Early stopping at epoch 500. Best Metrics: (0.001764573947034067, 0.0004499810534293293, 0.00120178243113531)
2026-06-17 17:17:22,864 - optuna.study.study - INFO - Trial 18 finished with values: [0.001764573947034067, 0.0004499810534293293, 0.00120178243113531] and parameters: {'n_layers': 4, 'embedding_dim': 64, 'lr': 0.04068195973191426, 'lambda_val': 0.0016190537057086897, 'batch_size': 1713, 'optimizer': 'RMSprop'}.
2026-06-17 17:17:46,183 - experiment_functions - INFO - Early stopping at epoch 500. Best Metrics: (0.0005943611314481581, 0.00013578375647341163, 0.000315809550935953)
2026-06-17 17:17:46,271 - optuna.study.study - INFO - Trial 19 finished with values: [0.0005943611314481581, 0.00013578375647341163, 0.000315809550935953] and parameters: {'n_layers': 4, 'embedding_dim': 64, 'lr': 3.906477688992476e-05, 'lambda_val': 0.0003784990701745836, 'batch_size': 3755, 'optimizer': 'SGD'}.
2026-06-17 17:18:10,791 - experiment_functions - INFO - Early stopping at epoch 500. Best Metrics: (0.0004683419199625699, 0.00010104837691044589, 0.0002511044505204445)
2026-06-17 17:18:10,868 - optuna.study.study - INFO - Trial 20 finished with values: [0.0004683419199625699, 0.00010104837691044589, 0.0002511044505204445] and parameters: {'n_layers': 4, 'embedding_dim': 128, 'lr': 0.0009591500443810845, 'lambda_val': 0.000366483280343058, 'batch_size': 2388, 'optimizer': 'SGD'}.
2026-06-17 17:18:52,829 - experiment_functions - INFO - Early stopping at epoch 750. Best Metrics: (0.0027246774062679746, 0.0007341796134899583, 0.0017341457465889028)
2026-06-17 17:18:52,906 - optuna.study.study - INFO - Trial 21 finished with values: [0.0027246774062679746, 0.0007341796134899583, 0.0017341457465889028] and parameters: {'n_layers': 4, 'embedding_dim': 256, 'lr': 0.0015933103817621604, 'lambda_val': 0.002699561195512288, 'batch_size': 3820, 'optimizer': 'Adam'}.
2026-06-17 17:19:46,937 - experiment_functions - INFO - Early stopping at epoch 1250. Best Metrics: (0.0035183834790576555, 0.0008983832259694329, 0.0021833409421353873)
2026-06-17 17:19:47,018 - optuna.study.study - INFO - Trial 22 finished with values: [0.0035183834790576555, 0.0008983832259694329, 0.0021833409421353873] and parameters: {'n_layers': 4, 'embedding_dim': 64, 'lr': 0.0012702568149946026, 'lambda_val': 8.796328661080472e-05, 'batch_size': 1751, 'optimizer': 'RMSprop'}.
2026-06-17 17:20:52,872 - experiment_functions - INFO - Early stopping at epoch 1550. Best Metrics: (0.0019003678554696361, 0.0005257673361121636, 0.0011872666442651711)
2026-06-17 17:20:52,967 - optuna.study.study - INFO - Trial 23 finished with values: [0.0019003678554696361, 0.0005257673361121636, 0.0011872666442651711] and parameters: {'n_layers': 2, 'embedding_dim': 96, 'lr': 0.08592645422936683, 'lambda_val': 0.0016110036387778574, 'batch_size': 3166, 'optimizer': 'Adam'}.
2026-06-17 17:21:23,465 - experiment_functions - INFO - Early stopping at epoch 650. Best Metrics: (0.0027285539668496874, 0.000708917519262347, 0.001678464993551491)
2026-06-17 17:21:23,566 - optuna.study.study - INFO - Trial 24 finished with values: [0.0027285539668496874, 0.000708917519262347, 0.001678464993551491] and parameters: {'n_layers': 3, 'embedding_dim': 128, 'lr': 0.016164729159531654, 'lambda_val': 1.9125850260278604e-06, 'batch_size': 1077, 'optimizer': 'RMSprop'}.
2026-06-17 17:23:07,939 - experiment_functions - INFO - Early stopping at epoch 2200. Best Metrics: (0.0005654701472099193, 0.00012788935202728306, 0.0002902713468291217)
2026-06-17 17:23:08,019 - optuna.study.study - INFO - Trial 25 finished with values: [0.0005654701472099193, 0.00012788935202728306, 0.0002902713468291217] and parameters: {'n_layers': 2, 'embedding_dim': 256, 'lr': 1.5558301295904722e-05, 'lambda_val': 0.0007853763195000559, 'batch_size': 2173, 'optimizer': 'Adam'}.
2026-06-17 17:24:46,827 - experiment_functions - INFO - Early stopping at epoch 2350. Best Metrics: (0.002947323776657906, 0.0007089175192623469, 0.0018156340640614111)
2026-06-17 17:24:46,929 - optuna.study.study - INFO - Trial 26 finished with values: [0.002947323776657906, 0.0007089175192623469, 0.0018156340640614111] and parameters: {'n_layers': 2, 'embedding_dim': 96, 'lr': 0.0006957971417897457, 'lambda_val': 0.00027195197586368466, 'batch_size': 3135, 'optimizer': 'Adam'}.
2026-06-17 17:25:10,879 - experiment_functions - INFO - Early stopping at epoch 500. Best Metrics: (0.0016912910885776072, 0.00045471769609700647, 0.0010332095417815105)
2026-06-17 17:25:10,957 - optuna.study.study - INFO - Trial 27 finished with values: [0.0016912910885776072, 0.00045471769609700647, 0.0010332095417815105] and parameters: {'n_layers': 3, 'embedding_dim': 128, 'lr': 0.0535591652570176, 'lambda_val': 0.06407795414476027, 'batch_size': 537, 'optimizer': 'RMSprop'}.
2026-06-17 17:26:38,345 - experiment_functions - INFO - Early stopping at epoch 2100. Best Metrics: (0.0006592680517842294, 0.0001389415182518631, 0.000341309858837699)
2026-06-17 17:26:38,439 - optuna.study.study - INFO - Trial 28 finished with values: [0.0006592680517842294, 0.0001389415182518631, 0.000341309858837699] and parameters: {'n_layers': 3, 'embedding_dim': 64, 'lr': 2.8597012116905028e-05, 'lambda_val': 3.710871984224586e-06, 'batch_size': 3228, 'optimizer': 'RMSprop'}.
2026-06-17 17:27:03,290 - experiment_functions - INFO - Early stopping at epoch 500. Best Metrics: (0.0005145718356551934, 0.00011999494758115448, 0.00029138440774345695)
2026-06-17 17:27:03,401 - optuna.study.study - INFO - Trial 29 finished with values: [0.0005145718356551934, 0.00011999494758115448, 0.00029138440774345695] and parameters: {'n_layers': 4, 'embedding_dim': 128, 'lr': 0.00038620082923208573, 'lambda_val': 1.7552395954128497e-06, 'batch_size': 547, 'optimizer': 'SGD'}.
2026-06-17 17:27:30,010 - experiment_functions - INFO - Early stopping at epoch 500. Best Metrics: (0.0004283479238772844, 0.00011210054313502589, 0.00022891055152345107)
2026-06-17 17:27:30,132 - optuna.study.study - INFO - Trial 30 finished with values: [0.0004283479238772844, 0.00011210054313502589, 0.00022891055152345107] and parameters: {'n_layers': 3, 'embedding_dim': 256, 'lr': 0.00020094046443669476, 'lambda_val': 8.897446151173261e-06, 'batch_size': 2367, 'optimizer': 'SGD'}.
2026-06-17 17:27:51,947 - experiment_functions - INFO - Early stopping at epoch 500. Best Metrics: (0.0005461222029042442, 0.0001136794240242516, 0.0002718762990513418)
2026-06-17 17:27:52,069 - optuna.study.study - INFO - Trial 31 finished with values: [0.0005461222029042442, 0.0001136794240242516, 0.0002718762990513418] and parameters: {'n_layers': 1, 'embedding_dim': 64, 'lr': 4.117940967800089e-05, 'lambda_val': 0.005748886343949696, 'batch_size': 1222, 'optimizer': 'SGD'}.
2026-06-17 17:30:40,797 - optuna.study.study - INFO - Trial 32 finished with values: [0.0012898416548685337, 0.00028419856006062905, 0.0007281087466690559] and parameters: {'n_layers': 3, 'embedding_dim': 96, 'lr': 9.266006673834506e-05, 'lambda_val': 3.545880423505173e-05, 'batch_size': 3519, 'optimizer': 'RMSprop'}.
2026-06-17 17:31:20,134 - experiment_functions - INFO - Early stopping at epoch 900. Best Metrics: (0.0004983610177701582, 0.00011841606669192877, 0.0003053491126289182)
2026-06-17 17:31:20,215 - optuna.study.study - INFO - Trial 33 finished with values: [0.0004983610177701582, 0.00011841606669192877, 0.0003053491126289182] and parameters: {'n_layers': 4, 'embedding_dim': 64, 'lr': 3.2584712192726544e-05, 'lambda_val': 3.1135368724698147e-06, 'batch_size': 2077, 'optimizer': 'Adam'}.
2026-06-17 17:31:43,837 - experiment_functions - INFO - Early stopping at epoch 550. Best Metrics: (0.0020860279331519757, 0.0004499810534293294, 0.0012916401471248556)
2026-06-17 17:31:43,921 - optuna.study.study - INFO - Trial 34 finished with values: [0.0020860279331519757, 0.0004499810534293294, 0.0012916401471248556] and parameters: {'n_layers': 1, 'embedding_dim': 32, 'lr': 0.06081491929533836, 'lambda_val': 0.0001325215944078086, 'batch_size': 1794, 'optimizer': 'Adam'}.
2026-06-17 17:32:06,738 - experiment_functions - INFO - Early stopping at epoch 500. Best Metrics: (0.0005794640371928934, 0.00013420487558418593, 0.00034391185362983573)
