2026-06-20 08:37:00,105 - optuna.study.study - INFO - Trial 235 finished with values: [0.02666431619221105, 0.0057613363647846414, 0.015235102910301581] and parameters: {'n_layers': 2, 'embedding_dim': 64, 'lr': 0.00041090885210817534, 'lambda_val': 1.0112597680663849e-05, 'batch_size': 3874, 'optimizer': 'Adam'}.
2026-06-20 08:38:15,541 - experiment_functions - INFO - Early stopping at epoch 1800. Best Metrics: (0.032704047384461025, 0.006707086017430846, 0.01845711004234464)
2026-06-20 08:38:15,643 - optuna.study.study - INFO - Trial 236 finished with values: [0.032704047384461025, 0.006707086017430846, 0.01845711004234464] and parameters: {'n_layers': 1, 'embedding_dim': 32, 'lr': 0.002099990505043131, 'lambda_val': 6.868274004831431e-05, 'batch_size': 3338, 'optimizer': 'Adam'}.
2026-06-20 08:40:15,605 - experiment_functions - INFO - Early stopping at epoch 2450. Best Metrics: (0.03265958017162834, 0.006781293419224454, 0.018526303987196697)
2026-06-20 08:40:15,687 - optuna.study.study - INFO - Trial 237 finished with values: [0.03265958017162834, 0.006781293419224454, 0.018526303987196697] and parameters: {'n_layers': 1, 'embedding_dim': 256, 'lr': 0.0012953028594055518, 'lambda_val': 1.0746091986357293e-06, 'batch_size': 1747, 'optimizer': 'Adam'}.
2026-06-20 08:42:14,409 - experiment_functions - INFO - Early stopping at epoch 2850. Best Metrics: (0.032089915265459096, 0.006648667424529494, 0.01816230090546366)
2026-06-20 08:42:14,481 - optuna.study.study - INFO - Trial 238 finished with values: [0.032089915265459096, 0.006648667424529494, 0.01816230090546366] and parameters: {'n_layers': 1, 'embedding_dim': 32, 'lr': 0.002099990505043131, 'lambda_val': 1.7016903226968311e-06, 'batch_size': 1458, 'optimizer': 'Adam'}.
2026-06-20 08:44:28,334 - experiment_functions - INFO - Early stopping at epoch 3150. Best Metrics: (0.03483662988752505, 0.007116016167740305, 0.020025056873162642)
2026-06-20 08:44:28,423 - optuna.study.study - INFO - Trial 239 finished with values: [0.03483662988752505, 0.007116016167740305, 0.020025056873162642] and parameters: {'n_layers': 1, 'embedding_dim': 64, 'lr': 0.0012953028594055518, 'lambda_val': 3.64590979484011e-06, 'batch_size': 2973, 'optimizer': 'RMSprop'}.
2026-06-20 08:47:07,183 - optuna.study.study - INFO - Trial 240 finished with values: [0.01592333099006365, 0.0035698496905393457, 0.009490405129430605] and parameters: {'n_layers': 1, 'embedding_dim': 32, 'lr': 0.0006438418474980425, 'lambda_val': 6.868274004831431e-05, 'batch_size': 1299, 'optimizer': 'RMSprop'}.
2026-06-20 08:48:12,754 - experiment_functions - INFO - Early stopping at epoch 1550. Best Metrics: (0.03158050389343456, 0.006568144499178983, 0.01819426688200705)
2026-06-20 08:48:12,841 - optuna.study.study - INFO - Trial 241 finished with values: [0.03158050389343456, 0.006568144499178983, 0.01819426688200705] and parameters: {'n_layers': 1, 'embedding_dim': 32, 'lr': 0.002099990505043131, 'lambda_val': 6.868274004831431e-05, 'batch_size': 2973, 'optimizer': 'Adam'}.
2026-06-20 08:49:50,615 - experiment_functions - INFO - Early stopping at epoch 2350. Best Metrics: (0.03172599634049123, 0.006478148288493116, 0.017980903426060683)
2026-06-20 08:49:50,710 - optuna.study.study - INFO - Trial 242 finished with values: [0.03172599634049123, 0.006478148288493116, 0.017980903426060683] and parameters: {'n_layers': 1, 'embedding_dim': 32, 'lr': 0.002099990505043131, 'lambda_val': 3.64590979484011e-06, 'batch_size': 2973, 'optimizer': 'Adam'}.
2026-06-20 08:51:46,978 - experiment_functions - INFO - Early stopping at epoch 2800. Best Metrics: (0.03529333381846645, 0.007196539093090818, 0.020195303301842896)
2026-06-20 08:51:47,065 - optuna.study.study - INFO - Trial 243 finished with values: [0.03529333381846645, 0.007196539093090818, 0.020195303301842896] and parameters: {'n_layers': 1, 'embedding_dim': 32, 'lr': 0.0015608654005494732, 'lambda_val': 1.1999345210285389e-05, 'batch_size': 2263, 'optimizer': 'RMSprop'}.
2026-06-20 08:55:01,670 - optuna.study.study - INFO - Trial 244 finished with values: [0.02915829855226197, 0.00611184792219275, 0.01653870179986661] and parameters: {'n_layers': 1, 'embedding_dim': 256, 'lr': 0.001705082463001927, 'lambda_val': 3.64590979484011e-06, 'batch_size': 517, 'optimizer': 'Adam'}.
2026-06-20 08:55:27,142 - experiment_functions - INFO - Early stopping at epoch 550. Best Metrics: (0.00046587033619755657, 0.00011367942402425162, 0.00025185430115850843)
2026-06-20 08:55:27,228 - optuna.study.study - INFO - Trial 245 finished with values: [0.00046587033619755657, 0.00011367942402425162, 0.00025185430115850843] and parameters: {'n_layers': 2, 'embedding_dim': 64, 'lr': 2.751328364525785e-05, 'lambda_val': 3.64590979484011e-06, 'batch_size': 2630, 'optimizer': 'RMSprop'}.
2026-06-20 08:56:53,776 - experiment_functions - INFO - Early stopping at epoch 2050. Best Metrics: (0.03125938138423813, 0.0065286724769483395, 0.01784453714838982)
2026-06-20 08:56:53,846 - optuna.study.study - INFO - Trial 246 finished with values: [0.03125938138423813, 0.0065286724769483395, 0.01784453714838982] and parameters: {'n_layers': 1, 'embedding_dim': 32, 'lr': 0.002099990505043131, 'lambda_val': 3.64590979484011e-06, 'batch_size': 2973, 'optimizer': 'Adam'}.
2026-06-20 08:58:05,395 - experiment_functions - INFO - Early stopping at epoch 1250. Best Metrics: (0.0005540782113750753, 0.00013420487558418593, 0.0003051539915256911)
2026-06-20 08:58:05,467 - optuna.study.study - INFO - Trial 247 finished with values: [0.0005540782113750753, 0.00013420487558418593, 0.0003051539915256911] and parameters: {'n_layers': 3, 'embedding_dim': 256, 'lr': 6.922635060724533e-05, 'lambda_val': 1.0112597680663849e-05, 'batch_size': 757, 'optimizer': 'RMSprop'}.
2026-06-20 08:58:40,513 - experiment_functions - INFO - Early stopping at epoch 800. Best Metrics: (0.0005848216194591504, 0.00013420487558418593, 0.00034114298775417187)
2026-06-20 08:58:40,716 - optuna.study.study - INFO - Trial 248 finished with values: [0.0005848216194591504, 0.00013420487558418593, 0.00034114298775417187] and parameters: {'n_layers': 1, 'embedding_dim': 96, 'lr': 7.448404786139695e-05, 'lambda_val': 5.8148367269156115e-06, 'batch_size': 3338, 'optimizer': 'RMSprop'}.
2026-06-20 08:59:43,953 - experiment_functions - INFO - Early stopping at epoch 1500. Best Metrics: (0.03312578278118227, 0.006759189086775294, 0.018726350409851957)
2026-06-20 08:59:44,020 - optuna.study.study - INFO - Trial 249 finished with values: [0.03312578278118227, 0.006759189086775294, 0.018726350409851957] and parameters: {'n_layers': 1, 'embedding_dim': 32, 'lr': 0.002099990505043131, 'lambda_val': 3.64590979484011e-06, 'batch_size': 2973, 'optimizer': 'Adam'}.
2026-06-20 09:00:06,149 - experiment_functions - INFO - Early stopping at epoch 500. Best Metrics: (0.0005069438237704992, 0.00012315270935960593, 0.0002765678448788214)
2026-06-20 09:00:06,237 - optuna.study.study - INFO - Trial 250 finished with values: [0.0005069438237704992, 0.00012315270935960593, 0.0002765678448788214] and parameters: {'n_layers': 1, 'embedding_dim': 64, 'lr': 0.002488784556108625, 'lambda_val': 0.002420446126660072, 'batch_size': 2912, 'optimizer': 'SGD'}.
2026-06-20 09:01:11,618 - experiment_functions - INFO - Early stopping at epoch 1550. Best Metrics: (0.031877479468567324, 0.006569723380068208, 0.018532811056897372)
2026-06-20 09:01:11,686 - optuna.study.study - INFO - Trial 251 finished with values: [0.031877479468567324, 0.006569723380068208, 0.018532811056897372] and parameters: {'n_layers': 1, 'embedding_dim': 32, 'lr': 0.002099990505043131, 'lambda_val': 6.868274004831431e-05, 'batch_size': 2973, 'optimizer': 'Adam'}.
2026-06-20 09:01:34,311 - experiment_functions - INFO - Early stopping at epoch 500. Best Metrics: (0.000498646264836513, 0.00011683718580270305, 0.00027121222687323483)
2026-06-20 09:01:34,379 - optuna.study.study - INFO - Trial 252 finished with values: [0.000498646264836513, 0.00011683718580270305, 0.00027121222687323483] and parameters: {'n_layers': 1, 'embedding_dim': 96, 'lr': 0.0006438418474980425, 'lambda_val': 3.64590979484011e-06, 'batch_size': 2973, 'optimizer': 'SGD'}.
2026-06-20 09:02:15,519 - experiment_functions - INFO - Early stopping at epoch 950. Best Metrics: (0.02605469543577796, 0.005742389794113932, 0.015207700375719103)
2026-06-20 09:02:15,610 - optuna.study.study - INFO - Trial 253 finished with values: [0.02605469543577796, 0.005742389794113932, 0.015207700375719103] and parameters: {'n_layers': 1, 'embedding_dim': 32, 'lr': 0.0017497040944488835, 'lambda_val': 0.0030160846973111464, 'batch_size': 3889, 'optimizer': 'RMSprop'}.
2026-06-20 09:05:00,463 - experiment_functions - INFO - Early stopping at epoch 3900. Best Metrics: (0.03423177896500866, 0.00700391562460528, 0.019101675333216973)
2026-06-20 09:05:00,545 - optuna.study.study - INFO - Trial 254 finished with values: [0.03423177896500866, 0.00700391562460528, 0.019101675333216973] and parameters: {'n_layers': 1, 'embedding_dim': 64, 'lr': 0.0012953028594055518, 'lambda_val': 1.6265345504793854e-05, 'batch_size': 2973, 'optimizer': 'RMSprop'}.
2026-06-20 09:07:40,541 - optuna.study.study - INFO - Trial 255 finished with values: [0.006399995001051012, 0.0014952002020967537, 0.003983047684031564] and parameters: {'n_layers': 1, 'embedding_dim': 32, 'lr': 0.000376819648993781, 'lambda_val': 3.64590979484011e-06, 'batch_size': 2973, 'optimizer': 'Adam'}.
2026-06-20 09:08:42,976 - experiment_functions - INFO - Early stopping at epoch 1250. Best Metrics: (0.030531421219256612, 0.0063992042440318316, 0.017600935479856073)
2026-06-20 09:08:43,056 - optuna.study.study - INFO - Trial 256 finished with values: [0.030531421219256612, 0.0063992042440318316, 0.017600935479856073] and parameters: {'n_layers': 1, 'embedding_dim': 256, 'lr': 0.0012953028594055518, 'lambda_val': 1.0746091986357293e-06, 'batch_size': 3338, 'optimizer': 'RMSprop'}.
2026-06-20 09:10:38,772 - experiment_functions - INFO - Early stopping at epoch 2750. Best Metrics: (0.0336937407525538, 0.006999178981937602, 0.019381157042591166)
2026-06-20 09:10:38,854 - optuna.study.study - INFO - Trial 257 finished with values: [0.0336937407525538, 0.006999178981937602, 0.019381157042591166] and parameters: {'n_layers': 1, 'embedding_dim': 32, 'lr': 0.0012953028594055518, 'lambda_val': 3.64590979484011e-06, 'batch_size': 2973, 'optimizer': 'RMSprop'}.
2026-06-20 09:13:02,642 - experiment_functions - INFO - Early stopping at epoch 3450. Best Metrics: (0.034388924795734604, 0.007060755336617405, 0.01947383841049725)
2026-06-20 09:13:02,719 - optuna.study.study - INFO - Trial 258 finished with values: [0.034388924795734604, 0.007060755336617405, 0.01947383841049725] and parameters: {'n_layers': 1, 'embedding_dim': 32, 'lr': 0.001705082463001927, 'lambda_val': 1.0746091986357293e-06, 'batch_size': 2067, 'optimizer': 'Adam'}.
2026-06-20 09:15:40,801 - experiment_functions - INFO - Early stopping at epoch 3800. Best Metrics: (0.03472416023242951, 0.00712548945307566, 0.019701297221625436)
2026-06-20 09:15:40,887 - optuna.study.study - INFO - Trial 259 finished with values: [0.03472416023242951, 0.00712548945307566, 0.019701297221625436] and parameters: {'n_layers': 1, 'embedding_dim': 32, 'lr': 0.0012953028594055518, 'lambda_val': 1.0746091986357293e-06, 'batch_size': 2973, 'optimizer': 'Adam'}.
2026-06-20 09:16:25,918 - experiment_functions - INFO - Early stopping at epoch 1050. Best Metrics: (0.029521843084195563, 0.006274472653782998, 0.01735316005388418)
2026-06-20 09:16:25,987 - optuna.study.study - INFO - Trial 260 finished with values: [0.029521843084195563, 0.006274472653782998, 0.01735316005388418] and parameters: {'n_layers': 1, 'embedding_dim': 32, 'lr': 0.002099990505043131, 'lambda_val': 1.0746091986357293e-06, 'batch_size': 2973, 'optimizer': 'Adam'}.
2026-06-20 09:17:17,291 - experiment_functions - INFO - Early stopping at epoch 1200. Best Metrics: (0.028295680737589448, 0.005996589617279273, 0.015750717186812587)
2026-06-20 09:17:17,361 - optuna.study.study - INFO - Trial 261 finished with values: [0.028295680737589448, 0.005996589617279273, 0.015750717186812587] and parameters: {'n_layers': 2, 'embedding_dim': 32, 'lr': 0.0012953028594055518, 'lambda_val': 0.0006576545081429303, 'batch_size': 2126, 'optimizer': 'Adam'}.
2026-06-20 09:18:57,611 - experiment_functions - INFO - Early stopping at epoch 2350. Best Metrics: (0.03168093894162015, 0.006664456233421751, 0.017963436345798427)
2026-06-20 09:18:57,745 - optuna.study.study - INFO - Trial 262 finished with values: [0.03168093894162015, 0.006664456233421751, 0.017963436345798427] and parameters: {'n_layers': 1, 'embedding_dim': 64, 'lr': 0.0012953028594055518, 'lambda_val': 3.64590979484011e-06, 'batch_size': 3514, 'optimizer': 'RMSprop'}.
2026-06-20 09:20:53,111 - experiment_functions - INFO - Early stopping at epoch 2700. Best Metrics: (0.03244696124877155, 0.006773399014778326, 0.01886380300246334)
2026-06-20 09:20:53,200 - optuna.study.study - INFO - Trial 263 finished with values: [0.03244696124877155, 0.006773399014778326, 0.01886380300246334] and parameters: {'n_layers': 1, 'embedding_dim': 64, 'lr': 0.0012953028594055518, 'lambda_val': 1.0112597680663849e-05, 'batch_size': 2973, 'optimizer': 'RMSprop'}.
2026-06-20 09:21:29,376 - experiment_functions - INFO - Early stopping at epoch 850. Best Metrics: (0.012326251426653593, 0.0029761904761904765, 0.006607709034940554)
2026-06-20 09:21:29,466 - optuna.study.study - INFO - Trial 264 finished with values: [0.012326251426653593, 0.0029761904761904765, 0.006607709034940554] and parameters: {'n_layers': 1, 'embedding_dim': 32, 'lr': 0.002099990505043131, 'lambda_val': 0.06500927867689532, 'batch_size': 3338, 'optimizer': 'Adam'}.
2026-06-20 09:22:44,436 - experiment_functions - INFO - Early stopping at epoch 1500. Best Metrics: (0.03232652477049218, 0.006696033851206266, 0.018233441329135725)
2026-06-20 09:22:44,530 - optuna.study.study - INFO - Trial 265 finished with values: [0.03232652477049218, 0.006696033851206266, 0.018233441329135725] and parameters: {'n_layers': 1, 'embedding_dim': 256, 'lr': 0.0012953028594055518, 'lambda_val': 3.64590979484011e-06, 'batch_size': 2973, 'optimizer': 'Adam'}.
2026-06-20 09:23:48,819 - experiment_functions - INFO - Early stopping at epoch 1500. Best Metrics: (0.03241299498132542, 0.0067212959454338765, 0.01870613641939783)
2026-06-20 09:23:49,249 - optuna.study.study - INFO - Trial 266 finished with values: [0.03241299498132542, 0.0067212959454338765, 0.01870613641939783] and parameters: {'n_layers': 1, 'embedding_dim': 32, 'lr': 0.002099990505043131, 'lambda_val': 3.64590979484011e-06, 'batch_size': 2973, 'optimizer': 'Adam'}.
2026-06-20 09:24:17,997 - experiment_functions - INFO - Early stopping at epoch 650. Best Metrics: (0.026099406459065843, 0.005502399898951623, 0.01505203518521317)
2026-06-20 09:24:18,086 - optuna.study.study - INFO - Trial 267 finished with values: [0.026099406459065843, 0.005502399898951623, 0.01505203518521317] and parameters: {'n_layers': 1, 'embedding_dim': 32, 'lr': 0.008904830338220756, 'lambda_val': 3.64590979484011e-06, 'batch_size': 3338, 'optimizer': 'Adam'}.
2026-06-20 09:27:03,821 - optuna.study.study - INFO - Trial 268 finished with values: [0.030617426226418106, 0.0064844638120500194, 0.017888632529679618] and parameters: {'n_layers': 1, 'embedding_dim': 64, 'lr': 0.0006438418474980425, 'lambda_val': 5.8148367269156115e-06, 'batch_size': 2973, 'optimizer': 'RMSprop'}.
2026-06-20 09:28:10,154 - experiment_functions - INFO - Early stopping at epoch 1350. Best Metrics: (0.031007246833432655, 0.006467096122268536, 0.018092545030483378)
2026-06-20 09:28:10,233 - optuna.study.study - INFO - Trial 269 finished with values: [0.031007246833432655, 0.006467096122268536, 0.018092545030483378] and parameters: {'n_layers': 1, 'embedding_dim': 256, 'lr': 0.001705082463001927, 'lambda_val': 1.0746091986357293e-06, 'batch_size': 1747, 'optimizer': 'Adam'}.
2026-06-20 09:28:33,410 - experiment_functions - INFO - Early stopping at epoch 500. Best Metrics: (0.0006894690167776391, 0.00013420487558418593, 0.000343411863024098)
2026-06-20 09:28:33,501 - optuna.study.study - INFO - Trial 270 finished with values: [0.0006894690167776391, 0.00013420487558418593, 0.000343411863024098] and parameters: {'n_layers': 1, 'embedding_dim': 128, 'lr': 0.002099990505043131, 'lambda_val': 3.64590979484011e-06, 'batch_size': 3338, 'optimizer': 'SGD'}.
2026-06-20 09:31:11,505 - experiment_functions - INFO - Early stopping at epoch 3850. Best Metrics: (0.032873141461487544, 0.0068381331312365795, 0.01864407087753079)
2026-06-20 09:31:11,574 - optuna.study.study - INFO - Trial 271 finished with values: [0.032873141461487544, 0.0068381331312365795, 0.01864407087753079] and parameters: {'n_layers': 1, 'embedding_dim': 32, 'lr': 0.0012953028594055518, 'lambda_val': 3.64590979484011e-06, 'batch_size': 2973, 'optimizer': 'Adam'}.
2026-06-20 09:31:56,194 - experiment_functions - INFO - Early stopping at epoch 1000. Best Metrics: (0.03057837968022116, 0.0063881520778072505, 0.017649446781710133)
2026-06-20 09:31:56,567 - optuna.study.study - INFO - Trial 272 finished with values: [0.03057837968022116, 0.0063881520778072505, 0.017649446781710133] and parameters: {'n_layers': 1, 'embedding_dim': 96, 'lr': 0.002099990505043131, 'lambda_val': 0.00038760188523077535, 'batch_size': 2973, 'optimizer': 'Adam'}.
2026-06-20 09:32:44,279 - experiment_functions - INFO - Early stopping at epoch 1100. Best Metrics: (0.027607748280835103, 0.005745547555892384, 0.015297422633775442)
2026-06-20 09:32:44,344 - optuna.study.study - INFO - Trial 273 finished with values: [0.027607748280835103, 0.005745547555892384, 0.015297422633775442] and parameters: {'n_layers': 2, 'embedding_dim': 32, 'lr': 0.0012953028594055518, 'lambda_val': 6.868274004831431e-05, 'batch_size': 3338, 'optimizer': 'Adam'}.
2026-06-20 09:33:56,243 - experiment_functions - INFO - Early stopping at epoch 1700. Best Metrics: (0.030471747751222952, 0.006290261462675257, 0.017667909420617016)
2026-06-20 09:33:56,335 - optuna.study.study - INFO - Trial 274 finished with values: [0.030471747751222952, 0.006290261462675257, 0.017667909420617016] and parameters: {'n_layers': 1, 'embedding_dim': 64, 'lr': 0.002099990505043131, 'lambda_val': 3.64590979484011e-06, 'batch_size': 1307, 'optimizer': 'RMSprop'}.
2026-06-20 09:35:10,500 - experiment_functions - INFO - Early stopping at epoch 1500. Best Metrics: (0.03080345777435466, 0.0064718327649362145, 0.017876821518697173)
2026-06-20 09:35:10,585 - optuna.study.study - INFO - Trial 275 finished with values: [0.03080345777435466, 0.0064718327649362145, 0.017876821518697173] and parameters: {'n_layers': 1, 'embedding_dim': 256, 'lr': 0.0012953028594055518, 'lambda_val': 3.64590979484011e-06, 'batch_size': 2973, 'optimizer': 'Adam'}.
2026-06-20 09:35:50,540 - experiment_functions - INFO - Early stopping at epoch 900. Best Metrics: (0.016988361202964923, 0.0036440570923329547, 0.009432246337466855)
2026-06-20 09:35:51,443 - optuna.study.study - INFO - Trial 276 finished with values: [0.016988361202964923, 0.0036440570923329547, 0.009432246337466855] and parameters: {'n_layers': 4, 'embedding_dim': 32, 'lr': 0.0012953028594055518, 'lambda_val': 6.868274004831431e-05, 'batch_size': 3338, 'optimizer': 'RMSprop'}.
2026-06-20 09:38:36,864 - optuna.study.study - INFO - Trial 277 finished with values: [0.03483664223975844, 0.007037072123279021, 0.019630056082422895] and parameters: {'n_layers': 1, 'embedding_dim': 32, 'lr': 0.0012953028594055518, 'lambda_val': 3.64590979484011e-06, 'batch_size': 3230, 'optimizer': 'Adam'}.
2026-06-20 09:40:40,612 - experiment_functions - INFO - Early stopping at epoch 3050. Best Metrics: (0.03249766209184561, 0.0068018188707843884, 0.018409007893888538)
2026-06-20 09:40:40,694 - optuna.study.study - INFO - Trial 278 finished with values: [0.03249766209184561, 0.0068018188707843884, 0.018409007893888538] and parameters: {'n_layers': 1, 'embedding_dim': 32, 'lr': 0.0012953028594055518, 'lambda_val': 3.64590979484011e-06, 'batch_size': 1493, 'optimizer': 'RMSprop'}.
2026-06-20 09:43:31,102 - optuna.study.study - INFO - Trial 279 finished with values: [0.02932146870471939, 0.006141846659088038, 0.016376851622413514] and parameters: {'n_layers': 2, 'embedding_dim': 64, 'lr': 0.00041090885210817534, 'lambda_val': 1.0112597680663849e-05, 'batch_size': 3427, 'optimizer': 'RMSprop'}.
2026-06-20 09:44:08,198 - experiment_functions - INFO - Early stopping at epoch 800. Best Metrics: (0.021760220580802386, 0.004539282556523936, 0.012241454946355868)
2026-06-20 09:44:08,263 - optuna.study.study - INFO - Trial 280 finished with values: [0.021760220580802386, 0.004539282556523936, 0.012241454946355868] and parameters: {'n_layers': 2, 'embedding_dim': 96, 'lr': 0.00153033175244873, 'lambda_val': 5.8148367269156115e-06, 'batch_size': 2990, 'optimizer': 'RMSprop'}.
2026-06-20 09:45:53,464 - experiment_functions - INFO - Early stopping at epoch 2550. Best Metrics: (0.03496992969728709, 0.00708128078817734, 0.019935947368316397)
2026-06-20 09:45:53,546 - optuna.study.study - INFO - Trial 281 finished with values: [0.03496992969728709, 0.00708128078817734, 0.019935947368316397] and parameters: {'n_layers': 1, 'embedding_dim': 32, 'lr': 0.001705082463001927, 'lambda_val': 1.0746091986357293e-06, 'batch_size': 2973, 'optimizer': 'Adam'}.
2026-06-20 09:48:18,379 - experiment_functions - INFO - Early stopping at epoch 3500. Best Metrics: (0.033198380796929605, 0.0069423392699254766, 0.0191160496528358)
