2026-06-23 13:54:21,771 - optuna.study.study - INFO - Trial 57 finished with values: [0.00044825675725862973, 9.473285335354302e-05, 0.00027194706957227755] and parameters: {'n_layers': 1, 'embedding_dim': 128, 'lr': 0.02039478639272299, 'lambda_val': 3.1181409672203094e-06, 'batch_size': 2912, 'optimizer': 'SGD'}.
2026-06-23 13:55:09,957 - experiment_functions - INFO - Early stopping at epoch 1100. Best Metrics: (0.0292169404769769, 0.006264999368447644, 0.016374080738174108)
2026-06-23 13:55:10,033 - optuna.study.study - INFO - Trial 58 finished with values: [0.0292169404769769, 0.006264999368447644, 0.016374080738174108] and parameters: {'n_layers': 1, 'embedding_dim': 64, 'lr': 0.0012272605990543274, 'lambda_val': 0.0045842802504681, 'batch_size': 2143, 'optimizer': 'RMSprop'}.
2026-06-23 13:58:13,541 - optuna.study.study - INFO - Trial 59 finished with values: [0.01894410262100932, 0.004157193381331313, 0.011075410850045101] and parameters: {'n_layers': 4, 'embedding_dim': 64, 'lr': 0.0001895879868332347, 'lambda_val': 3.0920173580229528e-06, 'batch_size': 2108, 'optimizer': 'Adam'}.
2026-06-23 14:01:40,575 - optuna.study.study - INFO - Trial 60 finished with values: [0.013962671820876316, 0.0030993431855500827, 0.00795155009564565] and parameters: {'n_layers': 4, 'embedding_dim': 128, 'lr': 0.00011634190552068439, 'lambda_val': 0.00011941284348716088, 'batch_size': 3896, 'optimizer': 'RMSprop'}.
2026-06-23 14:02:08,264 - experiment_functions - INFO - Early stopping at epoch 550. Best Metrics: (0.007145091671177026, 0.0015378299861058483, 0.003945586827243472)
2026-06-23 14:02:08,351 - optuna.study.study - INFO - Trial 61 finished with values: [0.007145091671177026, 0.0015378299861058483, 0.003945586827243472] and parameters: {'n_layers': 2, 'embedding_dim': 128, 'lr': 0.06165385340227955, 'lambda_val': 2.803995453457488e-05, 'batch_size': 3911, 'optimizer': 'Adam'}.
2026-06-23 14:02:46,223 - experiment_functions - INFO - Early stopping at epoch 550. Best Metrics: (0.006283726583786599, 0.0012962612100543137, 0.0033566960773748094)
2026-06-23 14:02:46,320 - optuna.study.study - INFO - Trial 62 finished with values: [0.006283726583786599, 0.0012962612100543137, 0.0033566960773748094] and parameters: {'n_layers': 4, 'embedding_dim': 256, 'lr': 0.03639626372159137, 'lambda_val': 0.00047222048784128004, 'batch_size': 2544, 'optimizer': 'Adam'}.
2026-06-23 14:04:22,859 - experiment_functions - INFO - Early stopping at epoch 2400. Best Metrics: (0.004978558585916357, 0.0011194265504610333, 0.0028005354647670858)
2026-06-23 14:04:22,942 - optuna.study.study - INFO - Trial 63 finished with values: [0.004978558585916357, 0.0011194265504610333, 0.0028005354647670858] and parameters: {'n_layers': 1, 'embedding_dim': 32, 'lr': 0.04824394736006866, 'lambda_val': 0.03597446195855276, 'batch_size': 3911, 'optimizer': 'RMSprop'}.
2026-06-23 14:07:18,271 - optuna.study.study - INFO - Trial 64 finished with values: [0.013613966441746084, 0.0030614500442086644, 0.007724497223667611] and parameters: {'n_layers': 3, 'embedding_dim': 64, 'lr': 0.0001895879868332347, 'lambda_val': 0.00018544932893785581, 'batch_size': 1712, 'optimizer': 'RMSprop'}.
2026-06-23 14:09:01,940 - experiment_functions - INFO - Early stopping at epoch 2300. Best Metrics: (0.021361726283569447, 0.004664014146772767, 0.011835551387384277)
2026-06-23 14:09:02,026 - optuna.study.study - INFO - Trial 65 finished with values: [0.021361726283569447, 0.004664014146772767, 0.011835551387384277] and parameters: {'n_layers': 3, 'embedding_dim': 64, 'lr': 0.00030878795427160974, 'lambda_val': 0.0045842802504681, 'batch_size': 3839, 'optimizer': 'Adam'}.
2026-06-23 14:09:51,918 - experiment_functions - INFO - Early stopping at epoch 1200. Best Metrics: (0.012135394885701624, 0.002556208159656436, 0.006935983068526896)
2026-06-23 14:09:52,008 - optuna.study.study - INFO - Trial 66 finished with values: [0.012135394885701624, 0.002556208159656436, 0.006935983068526896] and parameters: {'n_layers': 1, 'embedding_dim': 32, 'lr': 0.013147666826450598, 'lambda_val': 4.186128358230714e-06, 'batch_size': 2159, 'optimizer': 'RMSprop'}.
2026-06-23 14:10:27,536 - experiment_functions - INFO - Early stopping at epoch 750. Best Metrics: (0.03107846521680446, 0.0065365668813944676, 0.01804608206043845)
2026-06-23 14:10:27,865 - optuna.study.study - INFO - Trial 67 finished with values: [0.03107846521680446, 0.0065365668813944676, 0.01804608206043845] and parameters: {'n_layers': 1, 'embedding_dim': 128, 'lr': 0.003327046285057053, 'lambda_val': 0.00047222048784128004, 'batch_size': 2066, 'optimizer': 'Adam'}.
2026-06-23 14:13:38,137 - optuna.study.study - INFO - Trial 68 finished with values: [0.0008451425483652716, 0.00019893899204244034, 0.000498298749292838] and parameters: {'n_layers': 1, 'embedding_dim': 256, 'lr': 0.00020536254429948298, 'lambda_val': 8.06500889018782e-06, 'batch_size': 2313, 'optimizer': 'Adam'}.
2026-06-23 14:14:16,361 - experiment_functions - INFO - Early stopping at epoch 700. Best Metrics: (0.0006009046716072125, 0.0001310471138057345, 0.0003165520301333683)
2026-06-23 14:14:16,432 - optuna.study.study - INFO - Trial 69 finished with values: [0.0006009046716072125, 0.0001310471138057345, 0.0003165520301333683] and parameters: {'n_layers': 4, 'embedding_dim': 128, 'lr': 1.3276172817058854e-05, 'lambda_val': 0.00047222048784128004, 'batch_size': 3557, 'optimizer': 'Adam'}.
2026-06-23 14:17:21,091 - optuna.study.study - INFO - Trial 70 finished with values: [0.0150988576224193, 0.0034372236958443853, 0.008655106156187012] and parameters: {'n_layers': 4, 'embedding_dim': 64, 'lr': 0.00017541467013151027, 'lambda_val': 0.002247784905654037, 'batch_size': 1262, 'optimizer': 'RMSprop'}.
2026-06-23 14:20:26,990 - optuna.study.study - INFO - Trial 71 finished with values: [0.005274627149954579, 0.0013231021851711506, 0.0032195469718914603] and parameters: {'n_layers': 2, 'embedding_dim': 128, 'lr': 0.0001895879868332347, 'lambda_val': 0.0009179871154727713, 'batch_size': 1712, 'optimizer': 'RMSprop'}.
2026-06-23 14:21:01,381 - experiment_functions - INFO - Early stopping at epoch 500. Best Metrics: (0.0006140028347259325, 0.00013420487558418593, 0.0003487697525975742)
2026-06-23 14:21:01,759 - optuna.study.study - INFO - Trial 72 finished with values: [0.0006140028347259325, 0.00013420487558418593, 0.0003487697525975742] and parameters: {'n_layers': 4, 'embedding_dim': 256, 'lr': 0.00021799268096315928, 'lambda_val': 0.0020511361497476195, 'batch_size': 2163, 'optimizer': 'SGD'}.
2026-06-23 14:21:30,744 - experiment_functions - INFO - Early stopping at epoch 650. Best Metrics: (0.0036904484059140964, 0.0009125931539724643, 0.0023687017361402403)
2026-06-23 14:21:30,827 - optuna.study.study - INFO - Trial 73 finished with values: [0.0036904484059140964, 0.0009125931539724643, 0.0023687017361402403] and parameters: {'n_layers': 1, 'embedding_dim': 32, 'lr': 0.07437312656526578, 'lambda_val': 8.06500889018782e-06, 'batch_size': 2347, 'optimizer': 'RMSprop'}.
2026-06-23 14:21:57,320 - experiment_functions - INFO - Early stopping at epoch 500. Best Metrics: (0.00045969086342675995, 0.0001136794240242516, 0.0002522026386514103)
2026-06-23 14:21:57,423 - optuna.study.study - INFO - Trial 74 finished with values: [0.00045969086342675995, 0.0001136794240242516, 0.0002522026386514103] and parameters: {'n_layers': 3, 'embedding_dim': 128, 'lr': 8.004957993819838e-05, 'lambda_val': 0.04657486079864441, 'batch_size': 767, 'optimizer': 'RMSprop'}.
2026-06-23 14:22:31,831 - experiment_functions - INFO - Early stopping at epoch 500. Best Metrics: (0.000519600073281939, 0.00011999494758115447, 0.0002654223410840652)
2026-06-23 14:22:31,909 - optuna.study.study - INFO - Trial 75 finished with values: [0.000519600073281939, 0.00011999494758115447, 0.0002654223410840652] and parameters: {'n_layers': 4, 'embedding_dim': 256, 'lr': 0.00011634190552068439, 'lambda_val': 0.0008465289221707489, 'batch_size': 3896, 'optimizer': 'SGD'}.
2026-06-23 14:22:56,692 - experiment_functions - INFO - Early stopping at epoch 500. Best Metrics: (0.00043523692791678473, 0.00012157382847038021, 0.0002550955299782447)
2026-06-23 14:22:56,786 - optuna.study.study - INFO - Trial 76 finished with values: [0.00043523692791678473, 0.00012157382847038021, 0.0002550955299782447] and parameters: {'n_layers': 2, 'embedding_dim': 96, 'lr': 4.040353034766622e-05, 'lambda_val': 0.023244192276725934, 'batch_size': 3507, 'optimizer': 'Adam'}.
2026-06-23 14:23:21,786 - experiment_functions - INFO - Early stopping at epoch 550. Best Metrics: (0.0005241775535611197, 0.00011525830491347733, 0.00029911535966419835)
2026-06-23 14:23:22,155 - optuna.study.study - INFO - Trial 77 finished with values: [0.0005241775535611197, 0.00011525830491347733, 0.00029911535966419835] and parameters: {'n_layers': 3, 'embedding_dim': 32, 'lr': 1.1902125065154438e-05, 'lambda_val': 0.0001456853509054334, 'batch_size': 2306, 'optimizer': 'RMSprop'}.
2026-06-23 14:26:24,337 - optuna.study.study - INFO - Trial 78 finished with values: [0.005502012117930728, 0.0013294177087280535, 0.0032191397280706617] and parameters: {'n_layers': 4, 'embedding_dim': 64, 'lr': 0.00011634190552068439, 'lambda_val': 0.00011941284348716088, 'batch_size': 1598, 'optimizer': 'Adam'}.
2026-06-23 14:28:34,263 - experiment_functions - INFO - Early stopping at epoch 2450. Best Metrics: (0.021226124009934077, 0.004597701149425288, 0.012007126772362242)
2026-06-23 14:28:34,354 - optuna.study.study - INFO - Trial 79 finished with values: [0.021226124009934077, 0.004597701149425288, 0.012007126772362242] and parameters: {'n_layers': 4, 'embedding_dim': 128, 'lr': 0.00030878795427160974, 'lambda_val': 0.0007225520628850989, 'batch_size': 3860, 'optimizer': 'RMSprop'}.
2026-06-23 14:31:37,091 - optuna.study.study - INFO - Trial 80 finished with values: [0.018651102954067477, 0.004174561071112796, 0.01071368860421661] and parameters: {'n_layers': 4, 'embedding_dim': 64, 'lr': 0.0001895879868332347, 'lambda_val': 0.0009179871154727713, 'batch_size': 1712, 'optimizer': 'RMSprop'}.
2026-06-23 14:32:07,891 - experiment_functions - INFO - Early stopping at epoch 550. Best Metrics: (0.0056264043802879, 0.001310471138057345, 0.0031769804682679217)
2026-06-23 14:32:07,988 - optuna.study.study - INFO - Trial 81 finished with values: [0.0056264043802879, 0.001310471138057345, 0.0031769804682679217] and parameters: {'n_layers': 4, 'embedding_dim': 128, 'lr': 0.036271346599532954, 'lambda_val': 0.0004020367653384255, 'batch_size': 3812, 'optimizer': 'Adam'}.
2026-06-23 14:33:17,619 - experiment_functions - INFO - Early stopping at epoch 1400. Best Metrics: (0.0030294731587941124, 0.0006347101174687382, 0.0016474895473285772)
2026-06-23 14:33:17,701 - optuna.study.study - INFO - Trial 82 finished with values: [0.0030294731587941124, 0.0006347101174687382, 0.0016474895473285772] and parameters: {'n_layers': 3, 'embedding_dim': 128, 'lr': 0.04824394736006866, 'lambda_val': 0.03612178913805228, 'batch_size': 2166, 'optimizer': 'RMSprop'}.
2026-06-23 14:33:43,052 - experiment_functions - INFO - Early stopping at epoch 500. Best Metrics: (0.000501853406304331, 0.00012788935202728306, 0.0003168428814951526)
2026-06-23 14:33:43,136 - optuna.study.study - INFO - Trial 83 finished with values: [0.000501853406304331, 0.00012788935202728306, 0.0003168428814951526] and parameters: {'n_layers': 1, 'embedding_dim': 256, 'lr': 2.1962741941544302e-05, 'lambda_val': 7.687965322643018e-06, 'batch_size': 1384, 'optimizer': 'SGD'}.
2026-06-23 14:34:37,924 - experiment_functions - INFO - Early stopping at epoch 1250. Best Metrics: (0.0005407520034458343, 0.00012315270935960593, 0.00027212099651511266)
2026-06-23 14:34:38,025 - optuna.study.study - INFO - Trial 84 finished with values: [0.0005407520034458343, 0.00012315270935960593, 0.00027212099651511266] and parameters: {'n_layers': 1, 'embedding_dim': 128, 'lr': 2.1950108788661884e-05, 'lambda_val': 4.514960179682276e-05, 'batch_size': 1517, 'optimizer': 'RMSprop'}.
2026-06-23 14:35:07,195 - experiment_functions - INFO - Early stopping at epoch 550. Best Metrics: (0.010136373594867038, 0.002238853100922066, 0.005381907506933585)
2026-06-23 14:35:07,282 - optuna.study.study - INFO - Trial 85 finished with values: [0.010136373594867038, 0.002238853100922066, 0.005381907506933585] and parameters: {'n_layers': 3, 'embedding_dim': 128, 'lr': 0.005829813039172121, 'lambda_val': 0.002526070534045846, 'batch_size': 3498, 'optimizer': 'Adam'}.
2026-06-23 14:35:31,926 - experiment_functions - INFO - Early stopping at epoch 500. Best Metrics: (0.0005128236156883844, 0.0001136794240242516, 0.000259033080568992)
2026-06-23 14:35:32,000 - optuna.study.study - INFO - Trial 86 finished with values: [0.0005128236156883844, 0.0001136794240242516, 0.000259033080568992] and parameters: {'n_layers': 2, 'embedding_dim': 128, 'lr': 0.04824394736006866, 'lambda_val': 0.00018544932893785581, 'batch_size': 2166, 'optimizer': 'SGD'}.
2026-06-23 14:35:56,864 - experiment_functions - INFO - Early stopping at epoch 550. Best Metrics: (0.010024321229079704, 0.002339901477832512, 0.005933759704427164)
2026-06-23 14:35:56,943 - optuna.study.study - INFO - Trial 87 finished with values: [0.010024321229079704, 0.002339901477832512, 0.005933759704427164] and parameters: {'n_layers': 1, 'embedding_dim': 64, 'lr': 0.039166761633308914, 'lambda_val': 7.687965322643018e-06, 'batch_size': 1105, 'optimizer': 'Adam'}.
2026-06-23 14:36:20,439 - experiment_functions - INFO - Early stopping at epoch 500. Best Metrics: (0.00043295559376289617, 0.0001026272577996716, 0.0002441381390664321)
2026-06-23 14:36:20,587 - optuna.study.study - INFO - Trial 88 finished with values: [0.00043295559376289617, 0.0001026272577996716, 0.0002441381390664321] and parameters: {'n_layers': 1, 'embedding_dim': 128, 'lr': 0.009018000006041901, 'lambda_val': 0.011062186351904086, 'batch_size': 1568, 'optimizer': 'SGD'}.
2026-06-23 14:36:42,325 - experiment_functions - INFO - Early stopping at epoch 500. Best Metrics: (0.0006473180435419505, 0.00013262599469496025, 0.00033546156106875076)
2026-06-23 14:36:42,407 - optuna.study.study - INFO - Trial 89 finished with values: [0.0006473180435419505, 0.00013262599469496025, 0.00033546156106875076] and parameters: {'n_layers': 1, 'embedding_dim': 32, 'lr': 0.009018000006041901, 'lambda_val': 0.011062186351904086, 'batch_size': 3612, 'optimizer': 'SGD'}.
2026-06-23 14:37:50,331 - experiment_functions - INFO - Early stopping at epoch 1100. Best Metrics: (0.02338201995760482, 0.005106100795755969, 0.01345974776796689)
2026-06-23 14:37:50,417 - optuna.study.study - INFO - Trial 90 finished with values: [0.02338201995760482, 0.005106100795755969, 0.01345974776796689] and parameters: {'n_layers': 3, 'embedding_dim': 256, 'lr': 0.000639302768855693, 'lambda_val': 4.6275505465924135e-05, 'batch_size': 1972, 'optimizer': 'Adam'}.
2026-06-23 14:39:00,712 - experiment_functions - INFO - Early stopping at epoch 1700. Best Metrics: (0.0005864185473184834, 0.00013420487558418593, 0.0003384123859481237)
2026-06-23 14:39:01,090 - optuna.study.study - INFO - Trial 91 finished with values: [0.0005864185473184834, 0.00013420487558418593, 0.0003384123859481237] and parameters: {'n_layers': 1, 'embedding_dim': 64, 'lr': 4.640401381994786e-05, 'lambda_val': 1.6052088728891647e-06, 'batch_size': 669, 'optimizer': 'RMSprop'}.
2026-06-23 14:41:52,444 - experiment_functions - INFO - Early stopping at epoch 3850. Best Metrics: (0.03228884319758614, 0.0068097132752305166, 0.018604370470438465)
2026-06-23 14:41:52,533 - optuna.study.study - INFO - Trial 92 finished with values: [0.03228884319758614, 0.0068097132752305166, 0.018604370470438465] and parameters: {'n_layers': 1, 'embedding_dim': 128, 'lr': 0.0007593562994788473, 'lambda_val': 0.0009179871154727713, 'batch_size': 2944, 'optimizer': 'RMSprop'}.
2026-06-23 14:42:16,787 - experiment_functions - INFO - Early stopping at epoch 500. Best Metrics: (0.00043105225551574107, 0.00011999494758115448, 0.000249724526886461)
2026-06-23 14:42:16,869 - optuna.study.study - INFO - Trial 93 finished with values: [0.00043105225551574107, 0.00011999494758115448, 0.000249724526886461] and parameters: {'n_layers': 2, 'embedding_dim': 96, 'lr': 0.007110990523484289, 'lambda_val': 0.0008465289221707489, 'batch_size': 1694, 'optimizer': 'SGD'}.
2026-06-23 14:43:50,816 - experiment_functions - INFO - Early stopping at epoch 1550. Best Metrics: (0.012218191112088132, 0.00251042061386889, 0.0068732602731548685)
2026-06-23 14:43:50,901 - optuna.study.study - INFO - Trial 94 finished with values: [0.012218191112088132, 0.00251042061386889, 0.0068732602731548685] and parameters: {'n_layers': 3, 'embedding_dim': 256, 'lr': 0.014068370248381328, 'lambda_val': 3.2030570334749084e-05, 'batch_size': 2484, 'optimizer': 'RMSprop'}.
2026-06-23 14:44:18,511 - experiment_functions - INFO - Early stopping at epoch 550. Best Metrics: (0.006662432402034902, 0.0014399393709738537, 0.0036655879721784372)
2026-06-23 14:44:18,598 - optuna.study.study - INFO - Trial 95 finished with values: [0.006662432402034902, 0.0014399393709738537, 0.0036655879721784372] and parameters: {'n_layers': 2, 'embedding_dim': 128, 'lr': 0.06165385340227955, 'lambda_val': 0.0001456853509054334, 'batch_size': 3860, 'optimizer': 'Adam'}.
2026-06-23 14:44:44,395 - experiment_functions - INFO - Early stopping at epoch 500. Best Metrics: (0.0006059561492153017, 0.0001294682329165088, 0.00033384765178361007)
2026-06-23 14:44:44,487 - optuna.study.study - INFO - Trial 96 finished with values: [0.0006059561492153017, 0.0001294682329165088, 0.00033384765178361007] and parameters: {'n_layers': 1, 'embedding_dim': 256, 'lr': 0.012739706321161792, 'lambda_val': 3.1181409672203094e-06, 'batch_size': 518, 'optimizer': 'SGD'}.
2026-06-23 14:46:23,335 - experiment_functions - INFO - Early stopping at epoch 2300. Best Metrics: (0.004384839923350226, 0.000982063913098396, 0.0025045126202351722)
2026-06-23 14:46:23,434 - optuna.study.study - INFO - Trial 97 finished with values: [0.004384839923350226, 0.000982063913098396, 0.0025045126202351722] and parameters: {'n_layers': 4, 'embedding_dim': 32, 'lr': 0.058972767143000024, 'lambda_val': 0.002247784905654037, 'batch_size': 1717, 'optimizer': 'Adam'}.
2026-06-23 14:47:07,118 - experiment_functions - INFO - Early stopping at epoch 1000. Best Metrics: (0.0007047813521161321, 0.0001310471138057345, 0.00036744405053147096)
2026-06-23 14:47:07,203 - optuna.study.study - INFO - Trial 98 finished with values: [0.0007047813521161321, 0.0001310471138057345, 0.00036744405053147096] and parameters: {'n_layers': 1, 'embedding_dim': 96, 'lr': 0.00018876771248095393, 'lambda_val': 0.002898407729744049, 'batch_size': 1694, 'optimizer': 'RMSprop'}.
2026-06-23 14:50:09,584 - optuna.study.study - INFO - Trial 99 finished with values: [0.006319793875361702, 0.0015425666287735254, 0.003562984449412712] and parameters: {'n_layers': 4, 'embedding_dim': 64, 'lr': 0.00011634190552068439, 'lambda_val': 0.00011941284348716088, 'batch_size': 1598, 'optimizer': 'RMSprop'}.
2026-06-23 14:51:52,882 - experiment_functions - INFO - Early stopping at epoch 2350. Best Metrics: (0.004808350719219337, 0.0011052166224580018, 0.0027179168909753685)
2026-06-23 14:51:52,975 - optuna.study.study - INFO - Trial 100 finished with values: [0.004808350719219337, 0.0011052166224580018, 0.0027179168909753685] and parameters: {'n_layers': 1, 'embedding_dim': 128, 'lr': 0.04824394736006866, 'lambda_val': 0.03597446195855276, 'batch_size': 3557, 'optimizer': 'RMSprop'}.
2026-06-23 14:52:22,437 - experiment_functions - INFO - Early stopping at epoch 650. Best Metrics: (0.017814461344242326, 0.003940886699507389, 0.00976374504704604)
2026-06-23 14:52:22,542 - optuna.study.study - INFO - Trial 101 finished with values: [0.017814461344242326, 0.003940886699507389, 0.00976374504704604] and parameters: {'n_layers': 1, 'embedding_dim': 64, 'lr': 0.003327046285057053, 'lambda_val': 0.002247784905654037, 'batch_size': 1904, 'optimizer': 'RMSprop'}.
2026-06-23 14:52:48,049 - experiment_functions - INFO - Early stopping at epoch 500. Best Metrics: (0.0004919730227010901, 0.00011367942402425163, 0.00026889251710538874)
2026-06-23 14:52:48,154 - optuna.study.study - INFO - Trial 102 finished with values: [0.0004919730227010901, 0.00011367942402425163, 0.00026889251710538874] and parameters: {'n_layers': 2, 'embedding_dim': 128, 'lr': 0.00012511691521401513, 'lambda_val': 0.04449848348999269, 'batch_size': 2066, 'optimizer': 'Adam'}.
2026-06-23 14:53:23,628 - experiment_functions - INFO - Early stopping at epoch 800. Best Metrics: (0.011917164262417167, 0.002504105090311987, 0.0069420758269096525)
2026-06-23 14:53:23,922 - optuna.study.study - INFO - Trial 103 finished with values: [0.011917164262417167, 0.002504105090311987, 0.0069420758269096525] and parameters: {'n_layers': 2, 'embedding_dim': 32, 'lr': 0.014068370248381328, 'lambda_val': 3.2030570334749084e-05, 'batch_size': 2484, 'optimizer': 'RMSprop'}.
2026-06-23 14:53:51,276 - experiment_functions - INFO - Early stopping at epoch 600. Best Metrics: (0.01927963270317855, 0.004154035619552862, 0.01055903158599222)
2026-06-23 14:53:51,364 - optuna.study.study - INFO - Trial 104 finished with values: [0.01927963270317855, 0.004154035619552862, 0.01055903158599222] and parameters: {'n_layers': 2, 'embedding_dim': 32, 'lr': 0.0052160399812129, 'lambda_val': 5.8886003235134964e-05, 'batch_size': 1972, 'optimizer': 'Adam'}.
2026-06-23 14:54:29,196 - experiment_functions - INFO - Early stopping at epoch 550. Best Metrics: (0.006467889655322925, 0.001439939370973854, 0.003645626131275052)
