2026-06-21 05:45:51,733 - optuna.study.study - INFO - Trial 77 finished with values: [0.0007440361289729701, 0.00015788808892257172, 0.0003847250303288865] and parameters: {'n_layers': 4, 'embedding_dim': 64, 'lr': 8.473538078564852e-05, 'lambda_val': 0.004546347128438799, 'batch_size': 2513, 'optimizer': 'Adam'}.
2026-06-21 05:46:27,941 - experiment_functions - INFO - Early stopping at epoch 850. Best Metrics: (0.0026375646630323922, 0.000702601995705444, 0.0015410089053491628)
2026-06-21 05:46:28,389 - optuna.study.study - INFO - Trial 78 finished with values: [0.0026375646630323922, 0.000702601995705444, 0.0015410089053491628] and parameters: {'n_layers': 2, 'embedding_dim': 64, 'lr': 0.016383135881182027, 'lambda_val': 0.011091587356623701, 'batch_size': 1815, 'optimizer': 'RMSprop'}.
2026-06-21 05:46:54,210 - experiment_functions - INFO - Early stopping at epoch 550. Best Metrics: (0.004364082842279189, 0.001048376910445876, 0.002534129661200525)
2026-06-21 05:46:54,568 - optuna.study.study - INFO - Trial 79 finished with values: [0.004364082842279189, 0.001048376910445876, 0.002534129661200525] and parameters: {'n_layers': 3, 'embedding_dim': 96, 'lr': 0.05071971167749316, 'lambda_val': 2.228641586515842e-05, 'batch_size': 3841, 'optimizer': 'Adam'}.
2026-06-21 05:47:26,950 - experiment_functions - INFO - Early stopping at epoch 550. Best Metrics: (0.004994984626069125, 0.0012410003789314135, 0.002802618323228562)
2026-06-21 05:47:27,100 - optuna.study.study - INFO - Trial 80 finished with values: [0.004994984626069125, 0.0012410003789314135, 0.002802618323228562] and parameters: {'n_layers': 4, 'embedding_dim': 256, 'lr': 0.01649421420978625, 'lambda_val': 0.0016838745075427083, 'batch_size': 2581, 'optimizer': 'Adam'}.
2026-06-21 05:48:36,974 - experiment_functions - INFO - Early stopping at epoch 1600. Best Metrics: (0.003086825916814909, 0.0008147025388404699, 0.0017819453442265893)
2026-06-21 05:48:37,119 - optuna.study.study - INFO - Trial 81 finished with values: [0.003086825916814909, 0.0008147025388404699, 0.0017819453442265893] and parameters: {'n_layers': 3, 'embedding_dim': 96, 'lr': 0.05071971167749316, 'lambda_val': 0.0012040212538103386, 'batch_size': 2998, 'optimizer': 'RMSprop'}.
2026-06-21 05:49:31,723 - experiment_functions - INFO - Early stopping at epoch 1150. Best Metrics: (0.0005781949125350528, 0.00013262599469496023, 0.0003261039765923687)
2026-06-21 05:49:32,040 - optuna.study.study - INFO - Trial 82 finished with values: [0.0005781949125350528, 0.00013262599469496023, 0.0003261039765923687] and parameters: {'n_layers': 4, 'embedding_dim': 128, 'lr': 1.5282831396154152e-05, 'lambda_val': 0.0018148423298626976, 'batch_size': 3833, 'optimizer': 'Adam'}.
2026-06-21 05:52:55,129 - optuna.study.study - INFO - Trial 83 finished with values: [0.003713328231769899, 0.0008968043450802073, 0.0023640575938818544] and parameters: {'n_layers': 3, 'embedding_dim': 256, 'lr': 0.0001925912173197799, 'lambda_val': 5.103203231486004e-06, 'batch_size': 2370, 'optimizer': 'RMSprop'}.
2026-06-21 05:53:17,001 - experiment_functions - INFO - Early stopping at epoch 500. Best Metrics: (0.000792711615417013, 0.00014367816091954023, 0.0003703746744889115)
2026-06-21 05:53:17,106 - optuna.study.study - INFO - Trial 84 finished with values: [0.000792711615417013, 0.00014367816091954023, 0.0003703746744889115] and parameters: {'n_layers': 1, 'embedding_dim': 32, 'lr': 0.014606842328501285, 'lambda_val': 0.0012403436191834533, 'batch_size': 3663, 'optimizer': 'SGD'}.
2026-06-21 05:53:39,127 - experiment_functions - INFO - Early stopping at epoch 500. Best Metrics: (0.0004793503756406449, 0.00011367942402425162, 0.0002568352472279911)
2026-06-21 05:53:39,233 - optuna.study.study - INFO - Trial 85 finished with values: [0.0004793503756406449, 0.00011367942402425162, 0.0002568352472279911] and parameters: {'n_layers': 1, 'embedding_dim': 64, 'lr': 0.023235337257996553, 'lambda_val': 0.007049981299764024, 'batch_size': 3243, 'optimizer': 'SGD'}.
2026-06-21 05:54:05,320 - experiment_functions - INFO - Early stopping at epoch 550. Best Metrics: (0.0031133681749928644, 0.0008004926108374384, 0.0019119933281828484)
2026-06-21 05:54:05,666 - optuna.study.study - INFO - Trial 86 finished with values: [0.0031133681749928644, 0.0008004926108374384, 0.0019119933281828484] and parameters: {'n_layers': 3, 'embedding_dim': 96, 'lr': 0.022627403720532846, 'lambda_val': 0.0003995223661719565, 'batch_size': 3537, 'optimizer': 'RMSprop'}.
2026-06-21 05:54:28,489 - experiment_functions - INFO - Early stopping at epoch 500. Best Metrics: (0.0005955009596843434, 0.00012631047113805733, 0.000335434325511736)
2026-06-21 05:54:28,601 - optuna.study.study - INFO - Trial 87 finished with values: [0.0005955009596843434, 0.00012631047113805733, 0.000335434325511736] and parameters: {'n_layers': 3, 'embedding_dim': 64, 'lr': 1.3240552827243354e-05, 'lambda_val': 0.061457762751823845, 'batch_size': 3555, 'optimizer': 'RMSprop'}.
2026-06-21 05:54:50,868 - experiment_functions - INFO - Early stopping at epoch 500. Best Metrics: (0.0005684029135775753, 0.00011999494758115447, 0.00033073780433042675)
2026-06-21 05:54:50,976 - optuna.study.study - INFO - Trial 88 finished with values: [0.0005684029135775753, 0.00011999494758115447, 0.00033073780433042675] and parameters: {'n_layers': 4, 'embedding_dim': 32, 'lr': 0.06502134465914547, 'lambda_val': 1.1881846107033085e-05, 'batch_size': 1019, 'optimizer': 'SGD'}.
2026-06-21 05:55:14,050 - experiment_functions - INFO - Early stopping at epoch 500. Best Metrics: (0.00042154132229548435, 0.0001042061386888973, 0.00024888585811373877)
2026-06-21 05:55:14,221 - optuna.study.study - INFO - Trial 89 finished with values: [0.00042154132229548435, 0.0001042061386888973, 0.00024888585811373877] and parameters: {'n_layers': 2, 'embedding_dim': 96, 'lr': 0.0038927780539963937, 'lambda_val': 0.00044247956015671964, 'batch_size': 3062, 'optimizer': 'SGD'}.
2026-06-21 05:55:41,517 - experiment_functions - INFO - Early stopping at epoch 550. Best Metrics: (0.002724887208221004, 0.000618921308576481, 0.0015805684744261686)
2026-06-21 05:55:41,621 - optuna.study.study - INFO - Trial 90 finished with values: [0.002724887208221004, 0.000618921308576481, 0.0015805684744261686] and parameters: {'n_layers': 1, 'embedding_dim': 256, 'lr': 0.045448234415163005, 'lambda_val': 0.00029794264644292603, 'batch_size': 3604, 'optimizer': 'Adam'}.
2026-06-21 05:58:51,487 - experiment_functions - INFO - Early stopping at epoch 3750. Best Metrics: (0.0004300003990918954, 0.00011999494758115447, 0.00026212739140363825)
2026-06-21 05:58:51,596 - optuna.study.study - INFO - Trial 91 finished with values: [0.0004300003990918954, 0.00011999494758115447, 0.00026212739140363825] and parameters: {'n_layers': 3, 'embedding_dim': 256, 'lr': 1.0234659635836661e-05, 'lambda_val': 2.271742808246624e-05, 'batch_size': 1004, 'optimizer': 'RMSprop'}.
2026-06-21 05:59:13,137 - experiment_functions - INFO - Early stopping at epoch 500. Best Metrics: (0.0005075027058257002, 0.00011210054313502589, 0.0002607891556147424)
2026-06-21 05:59:13,236 - optuna.study.study - INFO - Trial 92 finished with values: [0.0005075027058257002, 0.00011210054313502589, 0.0002607891556147424] and parameters: {'n_layers': 1, 'embedding_dim': 32, 'lr': 2.4875141570891855e-05, 'lambda_val': 0.0012403436191834533, 'batch_size': 2523, 'optimizer': 'SGD'}.
2026-06-21 05:59:44,909 - experiment_functions - INFO - Early stopping at epoch 650. Best Metrics: (0.0036725782770142055, 0.0008431223948465328, 0.002253149941040159)
2026-06-21 05:59:45,015 - optuna.study.study - INFO - Trial 93 finished with values: [0.0036725782770142055, 0.0008431223948465328, 0.002253149941040159] and parameters: {'n_layers': 1, 'embedding_dim': 256, 'lr': 0.019905251855320705, 'lambda_val': 1.2612021837480589e-05, 'batch_size': 3851, 'optimizer': 'Adam'}.
2026-06-21 06:00:07,214 - experiment_functions - INFO - Early stopping at epoch 500. Best Metrics: (0.00047137024428479805, 0.00011999494758115448, 0.0002577983405631788)
2026-06-21 06:00:07,319 - optuna.study.study - INFO - Trial 94 finished with values: [0.00047137024428479805, 0.00011999494758115448, 0.0002577983405631788] and parameters: {'n_layers': 3, 'embedding_dim': 32, 'lr': 0.0014018982084487695, 'lambda_val': 0.0018148423298626976, 'batch_size': 635, 'optimizer': 'SGD'}.
2026-06-21 06:02:48,290 - optuna.study.study - INFO - Trial 95 finished with values: [0.00577073987845259, 0.001326259946949602, 0.0035344565967610074] and parameters: {'n_layers': 1, 'embedding_dim': 96, 'lr': 0.0013154801669818224, 'lambda_val': 1.1500391390523163e-06, 'batch_size': 635, 'optimizer': 'RMSprop'}.
2026-06-21 06:03:46,816 - experiment_functions - INFO - Early stopping at epoch 1050. Best Metrics: (0.0028600753150932953, 0.0007610205886067954, 0.001709767237803061)
2026-06-21 06:03:46,932 - optuna.study.study - INFO - Trial 96 finished with values: [0.0028600753150932953, 0.0007610205886067954, 0.001709767237803061] and parameters: {'n_layers': 4, 'embedding_dim': 256, 'lr': 0.0013367871012247433, 'lambda_val': 0.0776270954867753, 'batch_size': 1183, 'optimizer': 'RMSprop'}.
2026-06-21 06:04:14,015 - experiment_functions - INFO - Early stopping at epoch 600. Best Metrics: (0.0074219381775741545, 0.0018315018315018315, 0.004418158405801666)
2026-06-21 06:04:14,124 - optuna.study.study - INFO - Trial 97 finished with values: [0.0074219381775741545, 0.0018315018315018315, 0.004418158405801666] and parameters: {'n_layers': 3, 'embedding_dim': 64, 'lr': 0.0038927780539963937, 'lambda_val': 2.362873378234334e-06, 'batch_size': 3841, 'optimizer': 'RMSprop'}.
2026-06-21 06:05:03,680 - experiment_functions - INFO - Early stopping at epoch 1150. Best Metrics: (0.009086130203519237, 0.0022909561702665155, 0.005516180545647873)
2026-06-21 06:05:03,827 - optuna.study.study - INFO - Trial 98 finished with values: [0.009086130203519237, 0.0022909561702665155, 0.005516180545647873] and parameters: {'n_layers': 3, 'embedding_dim': 64, 'lr': 0.0013154801669818224, 'lambda_val': 1.1500391390523163e-06, 'batch_size': 3325, 'optimizer': 'Adam'}.
2026-06-21 06:06:05,947 - experiment_functions - INFO - Early stopping at epoch 1100. Best Metrics: (0.008167195484463003, 0.0020557029177718836, 0.004975364141732648)
2026-06-21 06:06:06,056 - optuna.study.study - INFO - Trial 99 finished with values: [0.008167195484463003, 0.0020557029177718836, 0.004975364141732648] and parameters: {'n_layers': 4, 'embedding_dim': 256, 'lr': 0.0007452315974278925, 'lambda_val': 0.004562972374668912, 'batch_size': 1493, 'optimizer': 'Adam'}.
2026-06-21 06:08:46,925 - optuna.study.study - INFO - Trial 100 finished with values: [0.010845255120927036, 0.0025925224201086275, 0.006660244342565551] and parameters: {'n_layers': 3, 'embedding_dim': 32, 'lr': 0.0014018982084487695, 'lambda_val': 1.1500391390523163e-06, 'batch_size': 635, 'optimizer': 'Adam'}.
2026-06-21 06:10:10,687 - experiment_functions - INFO - Early stopping at epoch 2100. Best Metrics: (0.002391300007752404, 0.000652077807250221, 0.0014121361611743124)
2026-06-21 06:10:10,865 - optuna.study.study - INFO - Trial 101 finished with values: [0.002391300007752404, 0.000652077807250221, 0.0014121361611743124] and parameters: {'n_layers': 3, 'embedding_dim': 32, 'lr': 0.029586555503226038, 'lambda_val': 0.0013171013233585188, 'batch_size': 1024, 'optimizer': 'RMSprop'}.
2026-06-21 06:10:58,146 - experiment_functions - INFO - Early stopping at epoch 950. Best Metrics: (0.0062058153201046, 0.0015236200581028169, 0.00359389002178115)
2026-06-21 06:10:58,257 - optuna.study.study - INFO - Trial 102 finished with values: [0.0062058153201046, 0.0015236200581028169, 0.00359389002178115] and parameters: {'n_layers': 2, 'embedding_dim': 256, 'lr': 0.001611760177794178, 'lambda_val': 0.0013171013233585188, 'batch_size': 1042, 'optimizer': 'RMSprop'}.
2026-06-21 06:12:18,641 - experiment_functions - INFO - Early stopping at epoch 1950. Best Metrics: (0.008407452524810746, 0.0021235947960085897, 0.005237553488030132)
2026-06-21 06:12:18,731 - optuna.study.study - INFO - Trial 103 finished with values: [0.008407452524810746, 0.0021235947960085897, 0.005237553488030132] and parameters: {'n_layers': 2, 'embedding_dim': 64, 'lr': 0.0014018982084487695, 'lambda_val': 0.0013171013233585188, 'batch_size': 745, 'optimizer': 'RMSprop'}.
2026-06-21 06:15:40,505 - optuna.study.study - INFO - Trial 104 finished with values: [0.0016889383034088342, 0.0003978779840848807, 0.001137475207337615] and parameters: {'n_layers': 3, 'embedding_dim': 256, 'lr': 0.00015153881325644065, 'lambda_val': 8.883909387456666e-06, 'batch_size': 1713, 'optimizer': 'RMSprop'}.
2026-06-21 06:17:29,960 - experiment_functions - INFO - Early stopping at epoch 2450. Best Metrics: (0.01112794987861236, 0.002755147151698876, 0.00672252373353923)
2026-06-21 06:17:30,070 - optuna.study.study - INFO - Trial 105 finished with values: [0.01112794987861236, 0.002755147151698876, 0.00672252373353923] and parameters: {'n_layers': 4, 'embedding_dim': 96, 'lr': 0.0007452315974278925, 'lambda_val': 2.2595071410094373e-06, 'batch_size': 1493, 'optimizer': 'Adam'}.
2026-06-21 06:20:18,502 - optuna.study.study - INFO - Trial 106 finished with values: [0.004913277311137717, 0.0012520525451559933, 0.0031485824055552517] and parameters: {'n_layers': 4, 'embedding_dim': 64, 'lr': 0.00020716276364902874, 'lambda_val': 0.0003995223661719565, 'batch_size': 3537, 'optimizer': 'Adam'}.
2026-06-21 06:20:45,927 - experiment_functions - INFO - Early stopping at epoch 550. Best Metrics: (0.0040345024164269066, 0.0010341669824428445, 0.0023041074318644445)
2026-06-21 06:20:46,019 - optuna.study.study - INFO - Trial 107 finished with values: [0.0040345024164269066, 0.0010341669824428445, 0.0023041074318644445] and parameters: {'n_layers': 4, 'embedding_dim': 128, 'lr': 0.011369965140966273, 'lambda_val': 0.0012040212538103386, 'batch_size': 1204, 'optimizer': 'RMSprop'}.
2026-06-21 06:22:10,031 - experiment_functions - INFO - Early stopping at epoch 2000. Best Metrics: (0.0030959866002770956, 0.0007799671592775042, 0.0017866155687226548)
2026-06-21 06:22:10,120 - optuna.study.study - INFO - Trial 108 finished with values: [0.0030959866002770956, 0.0007799671592775042, 0.0017866155687226548] and parameters: {'n_layers': 2, 'embedding_dim': 96, 'lr': 0.05071971167749316, 'lambda_val': 0.004562972374668912, 'batch_size': 1493, 'optimizer': 'Adam'}.
2026-06-21 06:24:49,961 - optuna.study.study - INFO - Trial 109 finished with values: [0.0019464606561461816, 0.0004784009094353922, 0.0012910058445797514] and parameters: {'n_layers': 4, 'embedding_dim': 32, 'lr': 0.00020716276364902874, 'lambda_val': 2.8562288796614426e-05, 'batch_size': 1721, 'optimizer': 'Adam'}.
2026-06-21 06:25:15,721 - experiment_functions - INFO - Early stopping at epoch 550. Best Metrics: (0.005747490002994454, 0.0014020462296324367, 0.003278629626145332)
2026-06-21 06:25:15,797 - optuna.study.study - INFO - Trial 110 finished with values: [0.005747490002994454, 0.0014020462296324367, 0.003278629626145332] and parameters: {'n_layers': 3, 'embedding_dim': 96, 'lr': 0.01090856583081859, 'lambda_val': 0.004562972374668912, 'batch_size': 3736, 'optimizer': 'Adam'}.
2026-06-21 06:25:56,579 - experiment_functions - INFO - Early stopping at epoch 700. Best Metrics: (0.008351316869044032, 0.002125173676897815, 0.004980744128117405)
2026-06-21 06:25:57,197 - optuna.study.study - INFO - Trial 111 finished with values: [0.008351316869044032, 0.002125173676897815, 0.004980744128117405] and parameters: {'n_layers': 4, 'embedding_dim': 256, 'lr': 0.0008519094805065798, 'lambda_val': 0.0016838745075427083, 'batch_size': 3710, 'optimizer': 'RMSprop'}.
2026-06-21 06:28:41,588 - optuna.study.study - INFO - Trial 112 finished with values: [0.0029503538544819064, 0.0007468106606037641, 0.0019125280922233183] and parameters: {'n_layers': 3, 'embedding_dim': 64, 'lr': 0.00019915462000059996, 'lambda_val': 0.00549551398968915, 'batch_size': 3841, 'optimizer': 'Adam'}.
2026-06-21 06:29:07,486 - experiment_functions - INFO - Early stopping at epoch 550. Best Metrics: (0.005062447384416961, 0.0012852090438297335, 0.0029519735618819694)
2026-06-21 06:29:07,568 - optuna.study.study - INFO - Trial 113 finished with values: [0.005062447384416961, 0.0012852090438297335, 0.0029519735618819694] and parameters: {'n_layers': 3, 'embedding_dim': 96, 'lr': 0.0079476369053714, 'lambda_val': 0.0007463607951250979, 'batch_size': 1378, 'optimizer': 'RMSprop'}.
2026-06-21 06:29:31,637 - experiment_functions - INFO - Early stopping at epoch 550. Best Metrics: (0.0041777601271875235, 0.001042061386888973, 0.002518540683020291)
2026-06-21 06:29:31,707 - optuna.study.study - INFO - Trial 114 finished with values: [0.0041777601271875235, 0.001042061386888973, 0.002518540683020291] and parameters: {'n_layers': 3, 'embedding_dim': 32, 'lr': 0.022627403720532846, 'lambda_val': 0.005333348216457993, 'batch_size': 2856, 'optimizer': 'Adam'}.
2026-06-21 06:31:41,499 - experiment_functions - INFO - Early stopping at epoch 3050. Best Metrics: (0.01390358332586063, 0.003460906909182771, 0.0084505633932439)
2026-06-21 06:31:41,617 - optuna.study.study - INFO - Trial 115 finished with values: [0.01390358332586063, 0.003460906909182771, 0.0084505633932439] and parameters: {'n_layers': 4, 'embedding_dim': 64, 'lr': 0.0008519094805065798, 'lambda_val': 1.1500391390523163e-06, 'batch_size': 940, 'optimizer': 'RMSprop'}.
2026-06-21 06:32:19,046 - experiment_functions - INFO - Early stopping at epoch 900. Best Metrics: (0.007076491748750142, 0.001722559050145257, 0.004307721722680559)
2026-06-21 06:32:19,122 - optuna.study.study - INFO - Trial 116 finished with values: [0.007076491748750142, 0.001722559050145257, 0.004307721722680559] and parameters: {'n_layers': 2, 'embedding_dim': 32, 'lr': 0.0035410358945148815, 'lambda_val': 0.0013171013233585188, 'batch_size': 1042, 'optimizer': 'RMSprop'}.
2026-06-21 06:32:44,075 - experiment_functions - INFO - Early stopping at epoch 550. Best Metrics: (0.004233893126341115, 0.000997852721990653, 0.0026044758028606124)
2026-06-21 06:32:44,439 - optuna.study.study - INFO - Trial 117 finished with values: [0.004233893126341115, 0.000997852721990653, 0.0026044758028606124] and parameters: {'n_layers': 3, 'embedding_dim': 64, 'lr': 0.05071971167749316, 'lambda_val': 8.006464807509142e-06, 'batch_size': 764, 'optimizer': 'RMSprop'}.
2026-06-21 06:33:13,598 - experiment_functions - INFO - Early stopping at epoch 650. Best Metrics: (0.007431154184837753, 0.0018741316155109257, 0.004545501369093713)
2026-06-21 06:33:13,958 - optuna.study.study - INFO - Trial 118 finished with values: [0.007431154184837753, 0.0018741316155109257, 0.004545501369093713] and parameters: {'n_layers': 3, 'embedding_dim': 64, 'lr': 0.0038927780539963937, 'lambda_val': 2.362873378234334e-06, 'batch_size': 3841, 'optimizer': 'RMSprop'}.
2026-06-21 06:36:11,422 - optuna.study.study - INFO - Trial 119 finished with values: [0.010208327683472554, 0.0025972590627763043, 0.006306272727058643] and parameters: {'n_layers': 4, 'embedding_dim': 96, 'lr': 0.0004317731637144049, 'lambda_val': 0.0016838745075427083, 'batch_size': 1493, 'optimizer': 'Adam'}.
2026-06-21 06:36:37,722 - experiment_functions - INFO - Early stopping at epoch 550. Best Metrics: (0.006917476781719049, 0.0017036124794745488, 0.004112641766745669)
2026-06-21 06:36:37,808 - optuna.study.study - INFO - Trial 120 finished with values: [0.006917476781719049, 0.0017036124794745488, 0.004112641766745669] and parameters: {'n_layers': 4, 'embedding_dim': 96, 'lr': 0.01090856583081859, 'lambda_val': 0.0003995223661719565, 'batch_size': 1464, 'optimizer': 'Adam'}.
2026-06-21 06:39:48,909 - optuna.study.study - INFO - Trial 121 finished with values: [0.003002010263308964, 0.0006947075912593154, 0.0018779576282808414] and parameters: {'n_layers': 2, 'embedding_dim': 256, 'lr': 0.00020716276364902874, 'lambda_val': 2.8562288796614426e-05, 'batch_size': 3983, 'optimizer': 'Adam'}.
2026-06-21 06:40:21,254 - experiment_functions - INFO - Early stopping at epoch 550. Best Metrics: (0.005147949861123866, 0.001259946949602122, 0.002864372807348012)
2026-06-21 06:40:21,336 - optuna.study.study - INFO - Trial 122 finished with values: [0.005147949861123866, 0.001259946949602122, 0.002864372807348012] and parameters: {'n_layers': 4, 'embedding_dim': 256, 'lr': 0.01649421420978625, 'lambda_val': 0.0016838745075427083, 'batch_size': 2581, 'optimizer': 'Adam'}.
2026-06-21 06:43:02,623 - optuna.study.study - INFO - Trial 123 finished with values: [0.007669121480733275, 0.0018267651888341544, 0.00482000460687488] and parameters: {'n_layers': 2, 'embedding_dim': 64, 'lr': 0.0008519094805065798, 'lambda_val': 8.006464807509142e-06, 'batch_size': 764, 'optimizer': 'RMSprop'}.
2026-06-21 06:43:30,050 - experiment_functions - INFO - Early stopping at epoch 550. Best Metrics: (0.0033360163214546405, 0.0008447012757357584, 0.0019625252641544237)
2026-06-21 06:43:30,126 - optuna.study.study - INFO - Trial 124 finished with values: [0.0033360163214546405, 0.0008447012757357584, 0.0019625252641544237] and parameters: {'n_layers': 4, 'embedding_dim': 128, 'lr': 0.015784680996026697, 'lambda_val': 0.0016838745075427083, 'batch_size': 2370, 'optimizer': 'RMSprop'}.
2026-06-21 06:44:08,498 - experiment_functions - INFO - Early stopping at epoch 750. Best Metrics: (0.005512614143891336, 0.0013483642793987623, 0.0031946365420171497)
