2026-06-20 06:17:01,728 - optuna.study.study - INFO - Trial 136 finished with values: [0.02358691715702165, 0.005194518125552609, 0.013225882884536995] and parameters: {'n_layers': 4, 'embedding_dim': 128, 'lr': 0.00021874714734455622, 'lambda_val': 0.00012018704157732538, 'batch_size': 3213, 'optimizer': 'RMSprop'}.
2026-06-20 06:17:28,876 - experiment_functions - INFO - Early stopping at epoch 550. Best Metrics: (0.005121220448662993, 0.0011557408109132247, 0.0026271426111255103)
2026-06-20 06:17:28,955 - optuna.study.study - INFO - Trial 137 finished with values: [0.005121220448662993, 0.0011557408109132247, 0.0026271426111255103] and parameters: {'n_layers': 3, 'embedding_dim': 96, 'lr': 0.002668806132567397, 'lambda_val': 0.015665527252443415, 'batch_size': 3874, 'optimizer': 'RMSprop'}.
2026-06-20 06:17:53,547 - experiment_functions - INFO - Early stopping at epoch 550. Best Metrics: (0.009310767404076097, 0.0021914866742452953, 0.005799068798656664)
2026-06-20 06:17:53,622 - optuna.study.study - INFO - Trial 138 finished with values: [0.009310767404076097, 0.0021914866742452953, 0.005799068798656664] and parameters: {'n_layers': 2, 'embedding_dim': 32, 'lr': 0.017184849258620686, 'lambda_val': 0.0022723744163998237, 'batch_size': 772, 'optimizer': 'Adam'}.
2026-06-20 06:18:51,503 - experiment_functions - INFO - Early stopping at epoch 1100. Best Metrics: (0.011213576925252641, 0.0025214727800934697, 0.006284706402231154)
2026-06-20 06:18:51,596 - optuna.study.study - INFO - Trial 139 finished with values: [0.011213576925252641, 0.0025214727800934697, 0.006284706402231154] and parameters: {'n_layers': 4, 'embedding_dim': 128, 'lr': 0.0010931128614747175, 'lambda_val': 0.0017653877117820588, 'batch_size': 631, 'optimizer': 'RMSprop'}.
2026-06-20 06:21:43,964 - experiment_functions - INFO - Early stopping at epoch 3700. Best Metrics: (0.030063708641909048, 0.006179739800429455, 0.017102815801510306)
2026-06-20 06:21:44,070 - optuna.study.study - INFO - Trial 140 finished with values: [0.030063708641909048, 0.006179739800429455, 0.017102815801510306] and parameters: {'n_layers': 2, 'embedding_dim': 128, 'lr': 0.00041090885210817534, 'lambda_val': 0.0004583308826488584, 'batch_size': 3527, 'optimizer': 'Adam'}.
2026-06-20 06:24:35,787 - optuna.study.study - INFO - Trial 141 finished with values: [0.028970003653609668, 0.006133952254641911, 0.016678919681185483] and parameters: {'n_layers': 2, 'embedding_dim': 64, 'lr': 0.00041090885210817534, 'lambda_val': 1.0112597680663849e-05, 'batch_size': 3427, 'optimizer': 'RMSprop'}.
2026-06-20 06:24:57,992 - experiment_functions - INFO - Early stopping at epoch 500. Best Metrics: (0.0005348372499862508, 0.0001136794240242516, 0.00029498542012466124)
2026-06-20 06:24:58,084 - optuna.study.study - INFO - Trial 142 finished with values: [0.0005348372499862508, 0.0001136794240242516, 0.00029498542012466124] and parameters: {'n_layers': 3, 'embedding_dim': 32, 'lr': 0.0004404210515412672, 'lambda_val': 0.0017653877117820588, 'batch_size': 3527, 'optimizer': 'SGD'}.
2026-06-20 06:26:52,337 - experiment_functions - INFO - Early stopping at epoch 2550. Best Metrics: (0.014083965003137735, 0.0029082985979537713, 0.007796835148358608)
2026-06-20 06:26:52,447 - optuna.study.study - INFO - Trial 143 finished with values: [0.014083965003137735, 0.0029082985979537713, 0.007796835148358608] and parameters: {'n_layers': 4, 'embedding_dim': 64, 'lr': 0.007284909067173104, 'lambda_val': 1.0112597680663849e-05, 'batch_size': 547, 'optimizer': 'RMSprop'}.
2026-06-20 06:27:22,335 - experiment_functions - INFO - Early stopping at epoch 650. Best Metrics: (0.016956517668478343, 0.003708791208791209, 0.009570156168235892)
2026-06-20 06:27:22,437 - optuna.study.study - INFO - Trial 144 finished with values: [0.016956517668478343, 0.003708791208791209, 0.009570156168235892] and parameters: {'n_layers': 4, 'embedding_dim': 32, 'lr': 0.002426082311234462, 'lambda_val': 1.0112597680663849e-05, 'batch_size': 2973, 'optimizer': 'Adam'}.
2026-06-20 06:27:50,990 - experiment_functions - INFO - Early stopping at epoch 650. Best Metrics: (0.026901568005109795, 0.005641341417203487, 0.01537530673390783)
2026-06-20 06:27:51,073 - optuna.study.study - INFO - Trial 145 finished with values: [0.026901568005109795, 0.005641341417203487, 0.01537530673390783] and parameters: {'n_layers': 1, 'embedding_dim': 32, 'lr': 0.008804952478863077, 'lambda_val': 6.868274004831431e-05, 'batch_size': 2973, 'optimizer': 'Adam'}.
2026-06-20 06:28:16,693 - experiment_functions - INFO - Early stopping at epoch 550. Best Metrics: (0.007347310639298035, 0.0017557155488189971, 0.0043433636486447545)
2026-06-20 06:28:17,084 - optuna.study.study - INFO - Trial 146 finished with values: [0.007347310639298035, 0.0017557155488189971, 0.0043433636486447545] and parameters: {'n_layers': 1, 'embedding_dim': 128, 'lr': 0.061381772770075456, 'lambda_val': 3.64590979484011e-06, 'batch_size': 1174, 'optimizer': 'Adam'}.
2026-06-20 06:28:42,852 - experiment_functions - INFO - Early stopping at epoch 550. Best Metrics: (0.0038213748007304613, 0.0008494379184034357, 0.0022403760020969885)
2026-06-20 06:28:42,941 - optuna.study.study - INFO - Trial 147 finished with values: [0.0038213748007304613, 0.0008494379184034357, 0.0022403760020969885] and parameters: {'n_layers': 3, 'embedding_dim': 64, 'lr': 0.07001220235035828, 'lambda_val': 1.6265345504793854e-05, 'batch_size': 2973, 'optimizer': 'RMSprop'}.
2026-06-20 06:29:07,286 - experiment_functions - INFO - Early stopping at epoch 550. Best Metrics: (0.005137619578391914, 0.001105216622458002, 0.002775369220452681)
2026-06-20 06:29:07,437 - optuna.study.study - INFO - Trial 148 finished with values: [0.005137619578391914, 0.001105216622458002, 0.002775369220452681] and parameters: {'n_layers': 2, 'embedding_dim': 32, 'lr': 0.060046366639295426, 'lambda_val': 0.0017653877117820588, 'batch_size': 3527, 'optimizer': 'Adam'}.
2026-06-20 06:31:48,003 - optuna.study.study - INFO - Trial 149 finished with values: [0.022722443623241415, 0.005137678413540483, 0.013424124229662824] and parameters: {'n_layers': 1, 'embedding_dim': 32, 'lr': 0.0006438418474980425, 'lambda_val': 0.0022723744163998237, 'batch_size': 1864, 'optimizer': 'RMSprop'}.
2026-06-20 06:34:30,642 - optuna.study.study - INFO - Trial 150 finished with values: [0.017628814223497446, 0.003986674245294935, 0.010474442107513554] and parameters: {'n_layers': 1, 'embedding_dim': 64, 'lr': 0.0006434825631436038, 'lambda_val': 1.0746091986357293e-06, 'batch_size': 1493, 'optimizer': 'Adam'}.
2026-06-20 06:35:00,755 - experiment_functions - INFO - Early stopping at epoch 700. Best Metrics: (0.020708200407648716, 0.004465075154730326, 0.01180645885036293)
2026-06-20 06:35:00,832 - optuna.study.study - INFO - Trial 151 finished with values: [0.020708200407648716, 0.004465075154730326, 0.01180645885036293] and parameters: {'n_layers': 1, 'embedding_dim': 32, 'lr': 0.006678676571422479, 'lambda_val': 0.0022723744163998237, 'batch_size': 850, 'optimizer': 'Adam'}.
2026-06-20 06:35:25,291 - experiment_functions - INFO - Early stopping at epoch 550. Best Metrics: (0.00964881525768925, 0.002019388657319692, 0.00535669567092109)
2026-06-20 06:35:25,587 - optuna.study.study - INFO - Trial 152 finished with values: [0.00964881525768925, 0.002019388657319692, 0.00535669567092109] and parameters: {'n_layers': 3, 'embedding_dim': 32, 'lr': 0.008804952478863077, 'lambda_val': 0.0009399507707776571, 'batch_size': 850, 'optimizer': 'RMSprop'}.
2026-06-20 06:36:31,895 - experiment_functions - INFO - Early stopping at epoch 1350. Best Metrics: (0.013328858485408603, 0.0028183023872679043, 0.0070975597442971316)
2026-06-20 06:36:31,998 - optuna.study.study - INFO - Trial 153 finished with values: [0.013328858485408603, 0.0028183023872679043, 0.0070975597442971316] and parameters: {'n_layers': 3, 'embedding_dim': 128, 'lr': 0.0017157774343129135, 'lambda_val': 6.355926400544048e-05, 'batch_size': 2266, 'optimizer': 'RMSprop'}.
2026-06-20 06:37:00,417 - experiment_functions - INFO - Early stopping at epoch 550. Best Metrics: (0.018986824869995995, 0.004105090311986865, 0.01090230196252685)
2026-06-20 06:37:00,504 - optuna.study.study - INFO - Trial 154 finished with values: [0.018986824869995995, 0.004105090311986865, 0.01090230196252685] and parameters: {'n_layers': 1, 'embedding_dim': 256, 'lr': 0.01747927779728318, 'lambda_val': 1.9616768085102623e-06, 'batch_size': 3427, 'optimizer': 'Adam'}.
2026-06-20 06:38:24,089 - experiment_functions - INFO - Early stopping at epoch 1700. Best Metrics: (0.03202251034576699, 0.006552355690286725, 0.018015692950588903)
2026-06-20 06:38:24,164 - optuna.study.study - INFO - Trial 155 finished with values: [0.03202251034576699, 0.006552355690286725, 0.018015692950588903] and parameters: {'n_layers': 1, 'embedding_dim': 256, 'lr': 0.0012953028594055518, 'lambda_val': 1.0746091986357293e-06, 'batch_size': 3874, 'optimizer': 'Adam'}.
2026-06-20 06:38:52,571 - experiment_functions - INFO - Early stopping at epoch 650. Best Metrics: (0.02824483182418485, 0.0060392194012883664, 0.01613438178570592)
2026-06-20 06:38:53,248 - optuna.study.study - INFO - Trial 156 finished with values: [0.02824483182418485, 0.0060392194012883664, 0.01613438178570592] and parameters: {'n_layers': 1, 'embedding_dim': 32, 'lr': 0.006590049461749219, 'lambda_val': 3.64590979484011e-06, 'batch_size': 2973, 'optimizer': 'Adam'}.
2026-06-20 06:40:18,573 - experiment_functions - INFO - Early stopping at epoch 2000. Best Metrics: (0.0337039177455598, 0.006929708222811671, 0.019639733334220994)
2026-06-20 06:40:18,644 - optuna.study.study - INFO - Trial 157 finished with values: [0.0337039177455598, 0.006929708222811671, 0.019639733334220994] and parameters: {'n_layers': 1, 'embedding_dim': 64, 'lr': 0.0012953028594055518, 'lambda_val': 3.64590979484011e-06, 'batch_size': 2630, 'optimizer': 'RMSprop'}.
2026-06-20 06:43:02,294 - optuna.study.study - INFO - Trial 158 finished with values: [0.0021855353207823457, 0.0004957685992168751, 0.0011976051024770852] and parameters: {'n_layers': 4, 'embedding_dim': 32, 'lr': 8.596621768628145e-05, 'lambda_val': 1.0107458430232444e-06, 'batch_size': 2062, 'optimizer': 'RMSprop'}.
2026-06-20 06:43:34,676 - experiment_functions - INFO - Early stopping at epoch 750. Best Metrics: (0.017711087116020163, 0.0036993179234558558, 0.009932470911704261)
2026-06-20 06:43:34,763 - optuna.study.study - INFO - Trial 159 finished with values: [0.017711087116020163, 0.0036993179234558558, 0.009932470911704261] and parameters: {'n_layers': 1, 'embedding_dim': 32, 'lr': 0.006590049461749219, 'lambda_val': 1.4923975636342595e-05, 'batch_size': 2683, 'optimizer': 'RMSprop'}.
2026-06-20 06:46:22,145 - optuna.study.study - INFO - Trial 160 finished with values: [0.018417600484928878, 0.004092459264873059, 0.010682070492606456] and parameters: {'n_layers': 2, 'embedding_dim': 64, 'lr': 0.00041090885210817534, 'lambda_val': 1.0112597680663849e-05, 'batch_size': 645, 'optimizer': 'RMSprop'}.
2026-06-20 06:49:04,946 - optuna.study.study - INFO - Trial 161 finished with values: [0.014810699540808221, 0.0034088038398383228, 0.008899231107340269] and parameters: {'n_layers': 1, 'embedding_dim': 64, 'lr': 0.00041090885210817534, 'lambda_val': 1.0112597680663849e-05, 'batch_size': 2925, 'optimizer': 'RMSprop'}.
2026-06-20 06:49:36,006 - experiment_functions - INFO - Early stopping at epoch 600. Best Metrics: (0.0100934775421967, 0.0021583301755715547, 0.005464912100337689)
2026-06-20 06:49:36,347 - optuna.study.study - INFO - Trial 162 finished with values: [0.0100934775421967, 0.0021583301755715547, 0.005464912100337689] and parameters: {'n_layers': 3, 'embedding_dim': 128, 'lr': 0.0012953028594055518, 'lambda_val': 0.007301424791536476, 'batch_size': 3213, 'optimizer': 'RMSprop'}.
2026-06-20 06:50:07,824 - experiment_functions - INFO - Early stopping at epoch 700. Best Metrics: (0.021520094608998754, 0.004634015409877479, 0.012502674391203296)
2026-06-20 06:50:07,917 - optuna.study.study - INFO - Trial 163 finished with values: [0.021520094608998754, 0.004634015409877479, 0.012502674391203296] and parameters: {'n_layers': 3, 'embedding_dim': 32, 'lr': 0.002099990505043131, 'lambda_val': 1.0112597680663849e-05, 'batch_size': 2973, 'optimizer': 'Adam'}.
2026-06-20 06:50:53,883 - experiment_functions - INFO - Early stopping at epoch 1050. Best Metrics: (0.01542250086575475, 0.003318807629152457, 0.008287718749010546)
2026-06-20 06:50:53,957 - optuna.study.study - INFO - Trial 164 finished with values: [0.01542250086575475, 0.003318807629152457, 0.008287718749010546] and parameters: {'n_layers': 4, 'embedding_dim': 32, 'lr': 0.0012031051601712145, 'lambda_val': 0.0022723744163998237, 'batch_size': 850, 'optimizer': 'RMSprop'}.
2026-06-20 06:52:00,182 - experiment_functions - INFO - Early stopping at epoch 1600. Best Metrics: (0.03317375240700908, 0.006822344322344322, 0.01873716119307253)
2026-06-20 06:52:00,295 - optuna.study.study - INFO - Trial 165 finished with values: [0.03317375240700908, 0.006822344322344322, 0.01873716119307253] and parameters: {'n_layers': 1, 'embedding_dim': 32, 'lr': 0.002099990505043131, 'lambda_val': 3.64590979484011e-06, 'batch_size': 2973, 'optimizer': 'Adam'}.
2026-06-20 06:54:40,010 - optuna.study.study - INFO - Trial 166 finished with values: [0.012463518641306083, 0.002924087406846028, 0.00733834225662746] and parameters: {'n_layers': 2, 'embedding_dim': 32, 'lr': 0.0002653271550803203, 'lambda_val': 1.0746091986357293e-06, 'batch_size': 2973, 'optimizer': 'Adam'}.
2026-06-20 06:57:14,507 - optuna.study.study - INFO - Trial 167 finished with values: [0.0020739076306422926, 0.0005005052418845523, 0.001243745985740355] and parameters: {'n_layers': 1, 'embedding_dim': 32, 'lr': 0.0002893391348218763, 'lambda_val': 4.129895985342791e-06, 'batch_size': 2721, 'optimizer': 'RMSprop'}.
2026-06-20 06:58:18,537 - experiment_functions - INFO - Early stopping at epoch 1400. Best Metrics: (0.022013535129568048, 0.004730327144120248, 0.012670989662082143)
2026-06-20 06:58:18,608 - optuna.study.study - INFO - Trial 168 finished with values: [0.022013535129568048, 0.004730327144120248, 0.012670989662082143] and parameters: {'n_layers': 4, 'embedding_dim': 64, 'lr': 0.0006438418474980425, 'lambda_val': 1.0112597680663849e-05, 'batch_size': 2062, 'optimizer': 'RMSprop'}.
2026-06-20 07:00:55,714 - optuna.study.study - INFO - Trial 169 finished with values: [0.015683126853466837, 0.0036235316407730207, 0.009296227503483958] and parameters: {'n_layers': 1, 'embedding_dim': 32, 'lr': 0.0006438418474980425, 'lambda_val': 0.0066875037866738676, 'batch_size': 1163, 'optimizer': 'RMSprop'}.
2026-06-20 07:01:22,131 - experiment_functions - INFO - Early stopping at epoch 500. Best Metrics: (0.0005853296546321207, 0.00013736263736263736, 0.00033608200417235465)
2026-06-20 07:01:22,212 - optuna.study.study - INFO - Trial 170 finished with values: [0.0005853296546321207, 0.00013736263736263736, 0.00033608200417235465] and parameters: {'n_layers': 4, 'embedding_dim': 128, 'lr': 0.028799000328810973, 'lambda_val': 2.2874461417671712e-05, 'batch_size': 2683, 'optimizer': 'SGD'}.
2026-06-20 07:04:05,377 - optuna.study.study - INFO - Trial 171 finished with values: [0.0342221288654374, 0.007038651004168245, 0.01972480702359692] and parameters: {'n_layers': 1, 'embedding_dim': 32, 'lr': 0.0012953028594055518, 'lambda_val': 6.868274004831431e-05, 'batch_size': 3338, 'optimizer': 'RMSprop'}.
2026-06-20 07:06:45,336 - optuna.study.study - INFO - Trial 172 finished with values: [0.027518130979099716, 0.006040798282177593, 0.016041920538762633] and parameters: {'n_layers': 1, 'embedding_dim': 32, 'lr': 0.0012953028594055518, 'lambda_val': 1.7016903226968311e-06, 'batch_size': 772, 'optimizer': 'Adam'}.
2026-06-20 07:09:26,820 - optuna.study.study - INFO - Trial 173 finished with values: [0.027700261250886617, 0.005991852974611595, 0.016182157495539633] and parameters: {'n_layers': 1, 'embedding_dim': 32, 'lr': 0.0006438418474980425, 'lambda_val': 3.64590979484011e-06, 'batch_size': 2973, 'optimizer': 'RMSprop'}.
2026-06-20 07:09:53,604 - experiment_functions - INFO - Early stopping at epoch 550. Best Metrics: (0.010745002863784506, 0.0023746368573954782, 0.005749890963606759)
2026-06-20 07:09:53,706 - optuna.study.study - INFO - Trial 174 finished with values: [0.010745002863784506, 0.0023746368573954782, 0.005749890963606759] and parameters: {'n_layers': 3, 'embedding_dim': 96, 'lr': 0.006590049461749219, 'lambda_val': 1.6265345504793854e-05, 'batch_size': 2266, 'optimizer': 'Adam'}.
2026-06-20 07:12:39,198 - optuna.study.study - INFO - Trial 175 finished with values: [0.030934075391701957, 0.006579196665403563, 0.01738568056504072] and parameters: {'n_layers': 1, 'embedding_dim': 64, 'lr': 0.001705082463001927, 'lambda_val': 3.64590979484011e-06, 'batch_size': 528, 'optimizer': 'Adam'}.
2026-06-20 07:14:42,460 - experiment_functions - INFO - Early stopping at epoch 3000. Best Metrics: (0.031795665227803215, 0.006643930781861817, 0.018526893718705636)
2026-06-20 07:14:42,541 - optuna.study.study - INFO - Trial 176 finished with values: [0.031795665227803215, 0.006643930781861817, 0.018526893718705636] and parameters: {'n_layers': 1, 'embedding_dim': 32, 'lr': 0.0012953028594055518, 'lambda_val': 3.64590979484011e-06, 'batch_size': 2973, 'optimizer': 'RMSprop'}.
2026-06-20 07:15:28,563 - experiment_functions - INFO - Early stopping at epoch 1000. Best Metrics: (0.03085242978317006, 0.006471832764936213, 0.017665204926814906)
2026-06-20 07:15:28,647 - optuna.study.study - INFO - Trial 177 finished with values: [0.03085242978317006, 0.006471832764936213, 0.017665204926814906] and parameters: {'n_layers': 1, 'embedding_dim': 128, 'lr': 0.002099990505043131, 'lambda_val': 3.64590979484011e-06, 'batch_size': 3338, 'optimizer': 'Adam'}.
2026-06-20 07:18:33,750 - optuna.study.study - INFO - Trial 178 finished with values: [0.0024505790819230387, 0.0006252368321333838, 0.0015833098475324533] and parameters: {'n_layers': 1, 'embedding_dim': 256, 'lr': 0.00022027863565489018, 'lambda_val': 1.0112597680663849e-05, 'batch_size': 3427, 'optimizer': 'RMSprop'}.
2026-06-20 07:19:13,462 - experiment_functions - INFO - Early stopping at epoch 750. Best Metrics: (0.009406686606054645, 0.0019941265630920805, 0.005302711952583307)
2026-06-20 07:19:13,542 - optuna.study.study - INFO - Trial 179 finished with values: [0.009406686606054645, 0.0019941265630920805, 0.005302711952583307] and parameters: {'n_layers': 4, 'embedding_dim': 128, 'lr': 0.002488784556108625, 'lambda_val': 0.00012018704157732538, 'batch_size': 3554, 'optimizer': 'RMSprop'}.
2026-06-20 07:22:59,494 - optuna.study.study - INFO - Trial 180 finished with values: [0.008776644205969582, 0.0021030693444486544, 0.0052253287358712975] and parameters: {'n_layers': 3, 'embedding_dim': 256, 'lr': 0.00022027863565489018, 'lambda_val': 4.303236972228742e-06, 'batch_size': 639, 'optimizer': 'Adam'}.
2026-06-20 07:23:34,337 - experiment_functions - INFO - Early stopping at epoch 750. Best Metrics: (0.02058359553100731, 0.004359290135152205, 0.01156904647898921)
2026-06-20 07:23:34,477 - optuna.study.study - INFO - Trial 181 finished with values: [0.02058359553100731, 0.004359290135152205, 0.01156904647898921] and parameters: {'n_layers': 2, 'embedding_dim': 32, 'lr': 0.002099990505043131, 'lambda_val': 3.64590979484011e-06, 'batch_size': 2782, 'optimizer': 'RMSprop'}.
2026-06-20 07:24:18,920 - experiment_functions - INFO - Early stopping at epoch 950. Best Metrics: (0.015727653932261828, 0.003261967917140331, 0.008757892034674553)
2026-06-20 07:24:19,018 - optuna.study.study - INFO - Trial 182 finished with values: [0.015727653932261828, 0.003261967917140331, 0.008757892034674553] and parameters: {'n_layers': 1, 'embedding_dim': 96, 'lr': 0.006590049461749219, 'lambda_val': 6.868274004831431e-05, 'batch_size': 3338, 'optimizer': 'RMSprop'}.
2026-06-20 07:25:29,385 - experiment_functions - INFO - Early stopping at epoch 1600. Best Metrics: (0.03062521986337896, 0.006272893772893774, 0.017396418401343188)
2026-06-20 07:25:29,985 - optuna.study.study - INFO - Trial 183 finished with values: [0.03062521986337896, 0.006272893772893774, 0.017396418401343188] and parameters: {'n_layers': 2, 'embedding_dim': 32, 'lr': 0.0012953028594055518, 'lambda_val': 1.7016903226968311e-06, 'batch_size': 1493, 'optimizer': 'Adam'}.
2026-06-20 07:25:59,629 - experiment_functions - INFO - Early stopping at epoch 650. Best Metrics: (0.026350363700989483, 0.005631868131868132, 0.015389420718907917)
2026-06-20 07:25:59,762 - optuna.study.study - INFO - Trial 184 finished with values: [0.026350363700989483, 0.005631868131868132, 0.015389420718907917] and parameters: {'n_layers': 1, 'embedding_dim': 96, 'lr': 0.006590049461749219, 'lambda_val': 3.64590979484011e-06, 'batch_size': 3646, 'optimizer': 'Adam'}.
2026-06-20 07:26:26,475 - experiment_functions - INFO - Early stopping at epoch 600. Best Metrics: (0.017745826819647755, 0.0038066818239232032, 0.009850224273789291)
2026-06-20 07:26:26,557 - optuna.study.study - INFO - Trial 185 finished with values: [0.017745826819647755, 0.0038066818239232032, 0.009850224273789291] and parameters: {'n_layers': 2, 'embedding_dim': 32, 'lr': 0.008804952478863077, 'lambda_val': 6.868274004831431e-05, 'batch_size': 2973, 'optimizer': 'Adam'}.
2026-06-20 07:28:07,546 - experiment_functions - INFO - Early stopping at epoch 2300. Best Metrics: (0.015410550549831746, 0.0032651256789187825, 0.008759310215182444)
2026-06-20 07:28:07,626 - optuna.study.study - INFO - Trial 186 finished with values: [0.015410550549831746, 0.0032651256789187825, 0.008759310215182444] and parameters: {'n_layers': 1, 'embedding_dim': 128, 'lr': 0.006590049461749219, 'lambda_val': 1.5505171935129606e-06, 'batch_size': 3153, 'optimizer': 'RMSprop'}.
