2026-06-22 00:06:38,089 - optuna.study.study - INFO - Trial 167 finished with values: [0.005776152798154178, 0.0014099406340785652, 0.0033660872127056532] and parameters: {'n_layers': 4, 'embedding_dim': 128, 'lr': 0.007083700783329076, 'lambda_val': 0.0005701343779094891, 'batch_size': 2194, 'optimizer': 'RMSprop'}.
2026-06-22 00:07:33,269 - experiment_functions - INFO - Early stopping at epoch 1150. Best Metrics: (0.009726507304717089, 0.0025009473285335358, 0.0060407059967160035)
2026-06-22 00:07:33,600 - optuna.study.study - INFO - Trial 168 finished with values: [0.009726507304717089, 0.0025009473285335358, 0.0060407059967160035] and parameters: {'n_layers': 4, 'embedding_dim': 128, 'lr': 0.0016253610840212534, 'lambda_val': 1.1454689220118589e-06, 'batch_size': 928, 'optimizer': 'Adam'}.
2026-06-22 00:08:14,919 - experiment_functions - INFO - Early stopping at epoch 950. Best Metrics: (0.0065565217375426485, 0.001689402551471517, 0.0038754215341792624)
2026-06-22 00:08:15,008 - optuna.study.study - INFO - Trial 169 finished with values: [0.0065565217375426485, 0.001689402551471517, 0.0038754215341792624] and parameters: {'n_layers': 3, 'embedding_dim': 64, 'lr': 0.0009291368086645142, 'lambda_val': 0.014586536668900354, 'batch_size': 4007, 'optimizer': 'Adam'}.
2026-06-22 00:10:33,324 - experiment_functions - INFO - Early stopping at epoch 3550. Best Metrics: (0.004710288882263614, 0.0010578501957812304, 0.0028614386488023474)
2026-06-22 00:10:33,417 - optuna.study.study - INFO - Trial 170 finished with values: [0.004710288882263614, 0.0010578501957812304, 0.0028614386488023474] and parameters: {'n_layers': 1, 'embedding_dim': 32, 'lr': 0.000927601540662843, 'lambda_val': 0.0011958935689814394, 'batch_size': 3720, 'optimizer': 'RMSprop'}.
2026-06-22 00:12:02,874 - experiment_functions - INFO - Early stopping at epoch 1750. Best Metrics: (0.0006011602621532034, 0.00013420487558418593, 0.00030375041336261403)
2026-06-22 00:12:02,962 - optuna.study.study - INFO - Trial 171 finished with values: [0.0006011602621532034, 0.00013420487558418593, 0.00030375041336261403] and parameters: {'n_layers': 3, 'embedding_dim': 256, 'lr': 1.7189620511787936e-05, 'lambda_val': 1.1454689220118589e-06, 'batch_size': 1550, 'optimizer': 'RMSprop'}.
2026-06-22 00:13:01,798 - experiment_functions - INFO - Early stopping at epoch 1400. Best Metrics: (0.013000100386894706, 0.0031703928255652396, 0.00787927848027285)
2026-06-22 00:13:01,885 - optuna.study.study - INFO - Trial 172 finished with values: [0.013000100386894706, 0.0031703928255652396, 0.00787927848027285] and parameters: {'n_layers': 4, 'embedding_dim': 32, 'lr': 0.0015833784127498205, 'lambda_val': 1.1454689220118589e-06, 'batch_size': 1389, 'optimizer': 'RMSprop'}.
2026-06-22 00:14:05,869 - experiment_functions - INFO - Early stopping at epoch 1400. Best Metrics: (0.009728493237773906, 0.0024267399267399264, 0.005859065223953094)
2026-06-22 00:14:05,964 - optuna.study.study - INFO - Trial 173 finished with values: [0.009728493237773906, 0.0024267399267399264, 0.005859065223953094] and parameters: {'n_layers': 3, 'embedding_dim': 128, 'lr': 0.000927601540662843, 'lambda_val': 1.98886338816991e-06, 'batch_size': 2662, 'optimizer': 'RMSprop'}.
2026-06-22 00:16:00,512 - experiment_functions - INFO - Early stopping at epoch 2800. Best Metrics: (0.012961317720292622, 0.003296703296703297, 0.00799289152181942)
2026-06-22 00:16:00,603 - optuna.study.study - INFO - Trial 174 finished with values: [0.012961317720292622, 0.003296703296703297, 0.00799289152181942] and parameters: {'n_layers': 4, 'embedding_dim': 32, 'lr': 0.000927601540662843, 'lambda_val': 1.1454689220118589e-06, 'batch_size': 1517, 'optimizer': 'RMSprop'}.
2026-06-22 00:16:29,388 - experiment_functions - INFO - Early stopping at epoch 600. Best Metrics: (0.00906312598787342, 0.00226727295692813, 0.005539130936708875)
2026-06-22 00:16:29,469 - optuna.study.study - INFO - Trial 175 finished with values: [0.00906312598787342, 0.00226727295692813, 0.005539130936708875] and parameters: {'n_layers': 4, 'embedding_dim': 96, 'lr': 0.002103872362755323, 'lambda_val': 1.722399276566065e-05, 'batch_size': 2987, 'optimizer': 'RMSprop'}.
2026-06-22 00:16:58,446 - experiment_functions - INFO - Early stopping at epoch 600. Best Metrics: (0.008276883890951265, 0.002193065555134521, 0.005019608762551911)
2026-06-22 00:16:58,545 - optuna.study.study - INFO - Trial 176 finished with values: [0.008276883890951265, 0.002193065555134521, 0.005019608762551911] and parameters: {'n_layers': 4, 'embedding_dim': 96, 'lr': 0.002520906950052724, 'lambda_val': 0.0009695798239708334, 'batch_size': 3395, 'optimizer': 'RMSprop'}.
2026-06-22 00:17:37,589 - experiment_functions - INFO - Early stopping at epoch 800. Best Metrics: (0.009734218767223647, 0.0024520020209675385, 0.0058992482451623455)
2026-06-22 00:17:37,680 - optuna.study.study - INFO - Trial 177 finished with values: [0.009734218767223647, 0.0024520020209675385, 0.0058992482451623455] and parameters: {'n_layers': 4, 'embedding_dim': 128, 'lr': 0.0012526246054029107, 'lambda_val': 1.722399276566065e-05, 'batch_size': 2573, 'optimizer': 'RMSprop'}.
2026-06-22 00:18:13,493 - experiment_functions - INFO - Early stopping at epoch 850. Best Metrics: (0.006816271592208674, 0.0018093974990526715, 0.004368376787175597)
2026-06-22 00:18:13,825 - optuna.study.study - INFO - Trial 178 finished with values: [0.006816271592208674, 0.0018093974990526715, 0.004368376787175597] and parameters: {'n_layers': 3, 'embedding_dim': 32, 'lr': 0.0010632978238593552, 'lambda_val': 0.014586536668900354, 'batch_size': 2998, 'optimizer': 'RMSprop'}.
2026-06-22 00:20:50,990 - optuna.study.study - INFO - Trial 179 finished with values: [0.00806041165738728, 0.0018993937097385376, 0.005027795941668863] and parameters: {'n_layers': 2, 'embedding_dim': 32, 'lr': 0.0016184592928403282, 'lambda_val': 1.637764938555515e-05, 'batch_size': 569, 'optimizer': 'Adam'}.
2026-06-22 00:21:13,474 - experiment_functions - INFO - Early stopping at epoch 500. Best Metrics: (0.0003958230977155258, 8.3680687128963e-05, 0.00021503839459157645)
2026-06-22 00:21:13,576 - optuna.study.study - INFO - Trial 180 finished with values: [0.0003958230977155258, 8.3680687128963e-05, 0.00021503839459157645] and parameters: {'n_layers': 3, 'embedding_dim': 64, 'lr': 0.0008655839340917536, 'lambda_val': 0.00013331215824219944, 'batch_size': 1990, 'optimizer': 'SGD'}.
2026-06-22 00:22:11,090 - experiment_functions - INFO - Early stopping at epoch 1350. Best Metrics: (0.0045543003107436164, 0.0011367942402425162, 0.002719160603312102)
2026-06-22 00:22:11,190 - optuna.study.study - INFO - Trial 181 finished with values: [0.0045543003107436164, 0.0011367942402425162, 0.002719160603312102] and parameters: {'n_layers': 1, 'embedding_dim': 128, 'lr': 0.0016253610840212534, 'lambda_val': 0.0003952312828567359, 'batch_size': 2998, 'optimizer': 'RMSprop'}.
2026-06-22 00:24:03,887 - experiment_functions - INFO - Early stopping at epoch 2800. Best Metrics: (0.010530017497548828, 0.00264304660856385, 0.006423189620186908)
2026-06-22 00:24:03,963 - optuna.study.study - INFO - Trial 182 finished with values: [0.010530017497548828, 0.00264304660856385, 0.006423189620186908] and parameters: {'n_layers': 3, 'embedding_dim': 32, 'lr': 0.0008655839340917536, 'lambda_val': 0.008048668420387728, 'batch_size': 835, 'optimizer': 'RMSprop'}.
2026-06-22 00:25:07,638 - experiment_functions - INFO - Early stopping at epoch 1200. Best Metrics: (0.0074292147369792155, 0.0018646583301755717, 0.00438766485533569)
2026-06-22 00:25:07,708 - optuna.study.study - INFO - Trial 183 finished with values: [0.0074292147369792155, 0.0018646583301755717, 0.00438766485533569] and parameters: {'n_layers': 3, 'embedding_dim': 256, 'lr': 0.0012083421906459303, 'lambda_val': 0.0006704376298746998, 'batch_size': 1795, 'optimizer': 'Adam'}.
2026-06-22 00:27:36,379 - experiment_functions - INFO - Early stopping at epoch 3400. Best Metrics: (0.006899872717859417, 0.0017194012883668057, 0.004245981065705827)
2026-06-22 00:27:36,465 - optuna.study.study - INFO - Trial 184 finished with values: [0.006899872717859417, 0.0017194012883668057, 0.004245981065705827] and parameters: {'n_layers': 2, 'embedding_dim': 128, 'lr': 0.000927601540662843, 'lambda_val': 0.0005725041524092545, 'batch_size': 1389, 'optimizer': 'Adam'}.
2026-06-22 00:28:17,635 - experiment_functions - INFO - Early stopping at epoch 800. Best Metrics: (0.009340851409549973, 0.0024393709738537326, 0.005595088121147831)
2026-06-22 00:28:17,753 - optuna.study.study - INFO - Trial 185 finished with values: [0.009340851409549973, 0.0024393709738537326, 0.005595088121147831] and parameters: {'n_layers': 4, 'embedding_dim': 128, 'lr': 0.0011267070786255592, 'lambda_val': 0.0009695798239708334, 'batch_size': 3477, 'optimizer': 'RMSprop'}.
2026-06-22 00:29:17,398 - experiment_functions - INFO - Early stopping at epoch 1250. Best Metrics: (0.010830738260402635, 0.002690413035240621, 0.006566323030247875)
2026-06-22 00:29:17,477 - optuna.study.study - INFO - Trial 186 finished with values: [0.010830738260402635, 0.002690413035240621, 0.006566323030247875] and parameters: {'n_layers': 4, 'embedding_dim': 128, 'lr': 0.000927601540662843, 'lambda_val': 1.1454689220118589e-06, 'batch_size': 2127, 'optimizer': 'RMSprop'}.
2026-06-22 00:30:14,291 - experiment_functions - INFO - Early stopping at epoch 1350. Best Metrics: (0.012236595481502955, 0.0029872426424150567, 0.007402978484155427)
2026-06-22 00:30:14,378 - optuna.study.study - INFO - Trial 187 finished with values: [0.012236595481502955, 0.0029872426424150567, 0.007402978484155427] and parameters: {'n_layers': 4, 'embedding_dim': 32, 'lr': 0.002103872362755323, 'lambda_val': 0.00014399990454015351, 'batch_size': 576, 'optimizer': 'Adam'}.
2026-06-22 00:32:13,481 - experiment_functions - INFO - Early stopping at epoch 2650. Best Metrics: (0.010745189835853049, 0.0026509410130099785, 0.006507594383041072)
2026-06-22 00:32:13,567 - optuna.study.study - INFO - Trial 188 finished with values: [0.010745189835853049, 0.0026509410130099785, 0.006507594383041072] and parameters: {'n_layers': 4, 'embedding_dim': 96, 'lr': 0.0006084514258113753, 'lambda_val': 1.5907426738824427e-06, 'batch_size': 2194, 'optimizer': 'Adam'}.
2026-06-22 00:34:52,103 - optuna.study.study - INFO - Trial 189 finished with values: [0.0012094907385816814, 0.00026051534672224326, 0.0006700316536310537] and parameters: {'n_layers': 4, 'embedding_dim': 32, 'lr': 0.0001460307483455223, 'lambda_val': 0.0011958935689814394, 'batch_size': 1169, 'optimizer': 'RMSprop'}.
2026-06-22 00:37:33,579 - optuna.study.study - INFO - Trial 190 finished with values: [0.006236932851574419, 0.0014888846785398508, 0.003812035419205206] and parameters: {'n_layers': 1, 'embedding_dim': 96, 'lr': 0.0022550052450588096, 'lambda_val': 1.1454689220118589e-06, 'batch_size': 928, 'optimizer': 'RMSprop'}.
2026-06-22 00:38:47,747 - experiment_functions - INFO - Early stopping at epoch 1800. Best Metrics: (0.011747718174470723, 0.0028909309081722877, 0.007069121200107593)
2026-06-22 00:38:47,845 - optuna.study.study - INFO - Trial 191 finished with values: [0.011747718174470723, 0.0028909309081722877, 0.007069121200107593] and parameters: {'n_layers': 4, 'embedding_dim': 32, 'lr': 0.000927601540662843, 'lambda_val': 0.0009695798239708334, 'batch_size': 2005, 'optimizer': 'RMSprop'}.
2026-06-22 00:39:27,844 - experiment_functions - INFO - Early stopping at epoch 950. Best Metrics: (0.004965583175905544, 0.0013688897309586964, 0.002881130747628486)
2026-06-22 00:39:27,927 - optuna.study.study - INFO - Trial 192 finished with values: [0.004965583175905544, 0.0013688897309586964, 0.002881130747628486] and parameters: {'n_layers': 4, 'embedding_dim': 32, 'lr': 0.0018366951231135393, 'lambda_val': 0.0445035857554338, 'batch_size': 663, 'optimizer': 'Adam'}.
2026-06-22 00:40:20,507 - experiment_functions - INFO - Early stopping at epoch 1100. Best Metrics: (0.011633393003504158, 0.002947770620184413, 0.006990649923400082)
2026-06-22 00:40:20,592 - optuna.study.study - INFO - Trial 193 finished with values: [0.011633393003504158, 0.002947770620184413, 0.006990649923400082] and parameters: {'n_layers': 4, 'embedding_dim': 128, 'lr': 0.000927601540662843, 'lambda_val': 0.0011958935689814394, 'batch_size': 1169, 'optimizer': 'RMSprop'}.
2026-06-22 00:41:10,491 - experiment_functions - INFO - Early stopping at epoch 1150. Best Metrics: (0.009775327965920635, 0.002414108879626121, 0.006039016620991935)
2026-06-22 00:41:10,559 - optuna.study.study - INFO - Trial 194 finished with values: [0.009775327965920635, 0.002414108879626121, 0.006039016620991935] and parameters: {'n_layers': 3, 'embedding_dim': 64, 'lr': 0.0011267070786255592, 'lambda_val': 1.1454689220118589e-06, 'batch_size': 3262, 'optimizer': 'RMSprop'}.
2026-06-22 00:41:43,111 - experiment_functions - INFO - Early stopping at epoch 750. Best Metrics: (0.010499926786212527, 0.002649362132120753, 0.006604259699412196)
2026-06-22 00:41:43,189 - optuna.study.study - INFO - Trial 195 finished with values: [0.010499926786212527, 0.002649362132120753, 0.006604259699412196] and parameters: {'n_layers': 4, 'embedding_dim': 32, 'lr': 0.0022550052450588096, 'lambda_val': 1.4463129473968207e-05, 'batch_size': 1925, 'optimizer': 'RMSprop'}.
2026-06-22 00:42:12,082 - experiment_functions - INFO - Early stopping at epoch 600. Best Metrics: (0.0067157314378950474, 0.001771504357711254, 0.00409607177369755)
2026-06-22 00:42:12,162 - optuna.study.study - INFO - Trial 196 finished with values: [0.0067157314378950474, 0.001771504357711254, 0.00409607177369755] and parameters: {'n_layers': 3, 'embedding_dim': 128, 'lr': 0.002520906950052724, 'lambda_val': 0.0009695798239708334, 'batch_size': 3871, 'optimizer': 'RMSprop'}.
2026-06-22 00:42:53,556 - experiment_functions - INFO - Early stopping at epoch 850. Best Metrics: (0.00912228081348251, 0.002270430718706581, 0.005451520529216631)
2026-06-22 00:42:54,106 - optuna.study.study - INFO - Trial 197 finished with values: [0.00912228081348251, 0.002270430718706581, 0.005451520529216631] and parameters: {'n_layers': 4, 'embedding_dim': 128, 'lr': 0.000927601540662843, 'lambda_val': 2.804628755433142e-06, 'batch_size': 3721, 'optimizer': 'RMSprop'}.
2026-06-22 00:43:34,105 - experiment_functions - INFO - Early stopping at epoch 850. Best Metrics: (0.0110139689292075, 0.0027472527472527475, 0.006561470667876111)
2026-06-22 00:43:34,460 - optuna.study.study - INFO - Trial 198 finished with values: [0.0110139689292075, 0.0027472527472527475, 0.006561470667876111] and parameters: {'n_layers': 4, 'embedding_dim': 96, 'lr': 0.0012083421906459303, 'lambda_val': 1.4463129473968207e-05, 'batch_size': 2080, 'optimizer': 'RMSprop'}.
2026-06-22 00:45:54,886 - experiment_functions - INFO - Early stopping at epoch 3500. Best Metrics: (0.010815262866313903, 0.0026398888467853987, 0.006565809368306623)
2026-06-22 00:45:54,977 - optuna.study.study - INFO - Trial 199 finished with values: [0.010815262866313903, 0.0026398888467853987, 0.006565809368306623] and parameters: {'n_layers': 3, 'embedding_dim': 32, 'lr': 0.0016184592928403282, 'lambda_val': 1.637764938555515e-05, 'batch_size': 569, 'optimizer': 'Adam'}.
2026-06-22 00:48:34,931 - optuna.study.study - INFO - Trial 200 finished with values: [0.012099550225792621, 0.0029809271188581533, 0.007496695168741721] and parameters: {'n_layers': 3, 'embedding_dim': 32, 'lr': 0.000927601540662843, 'lambda_val': 1.1454689220118589e-06, 'batch_size': 928, 'optimizer': 'RMSprop'}.
2026-06-22 00:50:35,513 - experiment_functions - INFO - Early stopping at epoch 2900. Best Metrics: (0.0055080619744471305, 0.0013452065176203108, 0.0032590300366691694)
2026-06-22 00:50:35,585 - optuna.study.study - INFO - Trial 201 finished with values: [0.0055080619744471305, 0.0013452065176203108, 0.0032590300366691694] and parameters: {'n_layers': 1, 'embedding_dim': 128, 'lr': 0.0012083421906459303, 'lambda_val': 1.915836082325916e-06, 'batch_size': 3582, 'optimizer': 'RMSprop'}.
2026-06-22 00:51:32,969 - experiment_functions - INFO - Early stopping at epoch 1200. Best Metrics: (0.007727724699642484, 0.0020130731337627892, 0.004717733626112081)
2026-06-22 00:51:33,053 - optuna.study.study - INFO - Trial 202 finished with values: [0.007727724699642484, 0.0020130731337627892, 0.004717733626112081] and parameters: {'n_layers': 4, 'embedding_dim': 128, 'lr': 0.0005928351587802508, 'lambda_val': 0.007612544278730116, 'batch_size': 2959, 'optimizer': 'Adam'}.
2026-06-22 00:54:14,987 - optuna.study.study - INFO - Trial 203 finished with values: [0.013000455269860288, 0.0031167108753315646, 0.008008146805242103] and parameters: {'n_layers': 4, 'embedding_dim': 32, 'lr': 0.0008655839340917536, 'lambda_val': 0.00014399990454015351, 'batch_size': 576, 'optimizer': 'Adam'}.
2026-06-22 00:55:45,615 - experiment_functions - INFO - Early stopping at epoch 2200. Best Metrics: (0.012718004491338804, 0.0031025009473285335, 0.00791304817484208)
2026-06-22 00:55:45,711 - optuna.study.study - INFO - Trial 204 finished with values: [0.012718004491338804, 0.0031025009473285335, 0.00791304817484208] and parameters: {'n_layers': 4, 'embedding_dim': 32, 'lr': 0.000927601540662843, 'lambda_val': 0.0011958935689814394, 'batch_size': 1169, 'optimizer': 'RMSprop'}.
2026-06-22 00:58:28,800 - optuna.study.study - INFO - Trial 205 finished with values: [0.014816267034155959, 0.0035477453580901857, 0.009129124282652584] and parameters: {'n_layers': 4, 'embedding_dim': 32, 'lr': 0.000927601540662843, 'lambda_val': 0.00014399990454015351, 'batch_size': 576, 'optimizer': 'RMSprop'}.
2026-06-22 00:59:03,268 - experiment_functions - INFO - Early stopping at epoch 800. Best Metrics: (0.007995637340037415, 0.0020888594164456234, 0.005196216633711119)
2026-06-22 00:59:03,652 - optuna.study.study - INFO - Trial 206 finished with values: [0.007995637340037415, 0.0020888594164456234, 0.005196216633711119] and parameters: {'n_layers': 4, 'embedding_dim': 32, 'lr': 0.002103872362755323, 'lambda_val': 0.00042920145544431403, 'batch_size': 3720, 'optimizer': 'Adam'}.
2026-06-22 00:59:46,894 - experiment_functions - INFO - Early stopping at epoch 750. Best Metrics: (0.008015074747409373, 0.00201623089554124, 0.004749172135936858)
2026-06-22 00:59:46,977 - optuna.study.study - INFO - Trial 207 finished with values: [0.008015074747409373, 0.00201623089554124, 0.004749172135936858] and parameters: {'n_layers': 4, 'embedding_dim': 256, 'lr': 0.0016184592928403282, 'lambda_val': 1.1454689220118589e-06, 'batch_size': 3638, 'optimizer': 'Adam'}.
2026-06-22 01:01:17,594 - experiment_functions - INFO - Early stopping at epoch 2300. Best Metrics: (0.0025323007445428127, 0.0006883920677024127, 0.0015730664781374603)
2026-06-22 01:01:17,676 - optuna.study.study - INFO - Trial 208 finished with values: [0.0025323007445428127, 0.0006883920677024127, 0.0015730664781374603] and parameters: {'n_layers': 2, 'embedding_dim': 32, 'lr': 0.07048108402984228, 'lambda_val': 0.0011958935689814394, 'batch_size': 1169, 'optimizer': 'RMSprop'}.
2026-06-22 01:03:27,524 - experiment_functions - INFO - Early stopping at epoch 2900. Best Metrics: (0.008804625207446034, 0.0022688518378173555, 0.00549291726179657)
2026-06-22 01:03:27,605 - optuna.study.study - INFO - Trial 209 finished with values: [0.008804625207446034, 0.0022688518378173555, 0.00549291726179657] and parameters: {'n_layers': 3, 'embedding_dim': 128, 'lr': 0.000927601540662843, 'lambda_val': 4.057189597259522e-06, 'batch_size': 1550, 'optimizer': 'Adam'}.
2026-06-22 01:04:00,211 - experiment_functions - INFO - Early stopping at epoch 750. Best Metrics: (0.01071471740013564, 0.002583049134773273, 0.006216948626007351)
2026-06-22 01:04:00,300 - optuna.study.study - INFO - Trial 210 finished with values: [0.01071471740013564, 0.002583049134773273, 0.006216948626007351] and parameters: {'n_layers': 4, 'embedding_dim': 32, 'lr': 0.0022550052450588096, 'lambda_val': 1.4463129473968207e-05, 'batch_size': 1925, 'optimizer': 'RMSprop'}.
2026-06-22 01:04:25,994 - experiment_functions - INFO - Early stopping at epoch 550. Best Metrics: (0.003741020048619117, 0.0008920677024125301, 0.002240422671193108)
2026-06-22 01:04:26,086 - optuna.study.study - INFO - Trial 211 finished with values: [0.003741020048619117, 0.0008920677024125301, 0.002240422671193108] and parameters: {'n_layers': 4, 'embedding_dim': 32, 'lr': 0.05438355727035462, 'lambda_val': 1.7181167491857816e-05, 'batch_size': 571, 'optimizer': 'RMSprop'}.
2026-06-22 01:08:01,910 - optuna.study.study - INFO - Trial 212 finished with values: [0.007299902672001264, 0.0017746621194897059, 0.004424386834847811] and parameters: {'n_layers': 4, 'embedding_dim': 256, 'lr': 0.00022875458166896675, 'lambda_val': 4.919667530385041e-05, 'batch_size': 1658, 'optimizer': 'RMSprop'}.
2026-06-22 01:08:42,421 - experiment_functions - INFO - Early stopping at epoch 1000. Best Metrics: (0.003299022402553204, 0.0007341796134899584, 0.0018825895217497862)
2026-06-22 01:08:42,716 - optuna.study.study - INFO - Trial 213 finished with values: [0.003299022402553204, 0.0007341796134899584, 0.0018825895217497862] and parameters: {'n_layers': 1, 'embedding_dim': 32, 'lr': 0.002103872362755323, 'lambda_val': 0.013905390297005821, 'batch_size': 2835, 'optimizer': 'Adam'}.
2026-06-22 01:09:47,981 - experiment_functions - INFO - Early stopping at epoch 1400. Best Metrics: (0.0006376854246021418, 0.00012631047113805733, 0.000354486730358812)
