2026-06-21 23:04:43,386 - optuna.study.study - INFO - Trial 119 finished with values: [0.009780628801520573, 0.002480421876973601, 0.006017747809982769] and parameters: {'n_layers': 4, 'embedding_dim': 32, 'lr': 0.0013129918196144053, 'lambda_val': 4.919667530385041e-05, 'batch_size': 2742, 'optimizer': 'Adam'}.
2026-06-21 23:06:02,711 - experiment_functions - INFO - Early stopping at epoch 1800. Best Metrics: (0.006226361158823787, 0.0015220411772135908, 0.0037630589649779718)
2026-06-21 23:06:02,808 - optuna.study.study - INFO - Trial 120 finished with values: [0.006226361158823787, 0.0015220411772135908, 0.0037630589649779718] and parameters: {'n_layers': 2, 'embedding_dim': 96, 'lr': 0.001722483120017554, 'lambda_val': 3.602866380465963e-05, 'batch_size': 3721, 'optimizer': 'Adam'}.
2026-06-21 23:06:39,310 - experiment_functions - INFO - Early stopping at epoch 750. Best Metrics: (0.008477037947338591, 0.002170961222685361, 0.005068167734418808)
2026-06-21 23:06:39,407 - optuna.study.study - INFO - Trial 121 finished with values: [0.008477037947338591, 0.002170961222685361, 0.005068167734418808] and parameters: {'n_layers': 4, 'embedding_dim': 96, 'lr': 0.0022550052450588096, 'lambda_val': 0.0005885182255384318, 'batch_size': 2194, 'optimizer': 'Adam'}.
2026-06-21 23:07:04,625 - experiment_functions - INFO - Early stopping at epoch 550. Best Metrics: (0.004075568569687595, 0.001026272577996716, 0.0023898603968760053)
2026-06-21 23:07:04,690 - optuna.study.study - INFO - Trial 122 finished with values: [0.004075568569687595, 0.001026272577996716, 0.0023898603968760053] and parameters: {'n_layers': 4, 'embedding_dim': 32, 'lr': 0.051369661675767474, 'lambda_val': 0.0001313947543098742, 'batch_size': 3477, 'optimizer': 'Adam'}.
2026-06-21 23:07:42,543 - experiment_functions - INFO - Early stopping at epoch 800. Best Metrics: (0.008241458489517559, 0.0020888594164456234, 0.005000372879766467)
2026-06-21 23:07:42,683 - optuna.study.study - INFO - Trial 123 finished with values: [0.008241458489517559, 0.0020888594164456234, 0.005000372879766467] and parameters: {'n_layers': 3, 'embedding_dim': 96, 'lr': 0.0011267070786255592, 'lambda_val': 0.002536649916066294, 'batch_size': 3262, 'optimizer': 'RMSprop'}.
2026-06-21 23:08:17,673 - experiment_functions - INFO - Early stopping at epoch 650. Best Metrics: (0.005564278478203587, 0.0013973095869647596, 0.003201599163490396)
2026-06-21 23:08:17,766 - optuna.study.study - INFO - Trial 124 finished with values: [0.005564278478203587, 0.0013973095869647596, 0.003201599163490396] and parameters: {'n_layers': 2, 'embedding_dim': 256, 'lr': 0.002520906950052724, 'lambda_val': 0.0009695798239708334, 'batch_size': 2998, 'optimizer': 'RMSprop'}.
2026-06-21 23:08:53,486 - experiment_functions - INFO - Early stopping at epoch 800. Best Metrics: (0.0006051590594622035, 0.0001499936844764431, 0.00033238137282185697)
2026-06-21 23:08:53,857 - optuna.study.study - INFO - Trial 125 finished with values: [0.0006051590594622035, 0.0001499936844764431, 0.00033238137282185697] and parameters: {'n_layers': 4, 'embedding_dim': 32, 'lr': 2.8810174356044122e-05, 'lambda_val': 4.919667530385041e-05, 'batch_size': 1533, 'optimizer': 'Adam'}.
2026-06-21 23:12:24,547 - optuna.study.study - INFO - Trial 126 finished with values: [0.007577054381127132, 0.0018283440697233798, 0.004625658786804825] and parameters: {'n_layers': 3, 'embedding_dim': 256, 'lr': 0.0004047353928477847, 'lambda_val': 4.866899330600482e-06, 'batch_size': 1550, 'optimizer': 'Adam'}.
2026-06-21 23:13:30,781 - experiment_functions - INFO - Early stopping at epoch 1150. Best Metrics: (0.0030055983296495316, 0.0007326007326007327, 0.0017243417278973762)
2026-06-21 23:13:30,866 - optuna.study.study - INFO - Trial 127 finished with values: [0.0030055983296495316, 0.0007326007326007327, 0.0017243417278973762] and parameters: {'n_layers': 4, 'embedding_dim': 256, 'lr': 0.020122252634636587, 'lambda_val': 0.003986025781307465, 'batch_size': 3072, 'optimizer': 'RMSprop'}.
2026-06-21 23:14:04,215 - experiment_functions - INFO - Early stopping at epoch 550. Best Metrics: (0.007183229955248543, 0.0018425539977264117, 0.004228049850895705)
2026-06-21 23:14:04,722 - optuna.study.study - INFO - Trial 128 finished with values: [0.007183229955248543, 0.0018425539977264117, 0.004228049850895705] and parameters: {'n_layers': 4, 'embedding_dim': 256, 'lr': 0.002520906950052724, 'lambda_val': 0.0009695798239708334, 'batch_size': 3871, 'optimizer': 'RMSprop'}.
2026-06-21 23:17:37,945 - optuna.study.study - INFO - Trial 129 finished with values: [0.007974366677716534, 0.0019388657319691805, 0.00490181994958961] and parameters: {'n_layers': 3, 'embedding_dim': 256, 'lr': 0.0004047353928477847, 'lambda_val': 8.523264017245288e-05, 'batch_size': 1550, 'optimizer': 'Adam'}.
2026-06-21 23:18:03,421 - experiment_functions - INFO - Early stopping at epoch 550. Best Metrics: (0.004610396552072962, 0.0011399520020209677, 0.002770140691314513)
2026-06-21 23:18:03,493 - optuna.study.study - INFO - Trial 130 finished with values: [0.004610396552072962, 0.0011399520020209677, 0.002770140691314513] and parameters: {'n_layers': 4, 'embedding_dim': 32, 'lr': 0.05397886496255383, 'lambda_val': 1.5907426738824427e-06, 'batch_size': 1550, 'optimizer': 'Adam'}.
2026-06-21 23:18:46,506 - experiment_functions - INFO - Early stopping at epoch 850. Best Metrics: (0.011047103530355734, 0.0027551471516988764, 0.006778478475202572)
2026-06-21 23:18:46,604 - optuna.study.study - INFO - Trial 131 finished with values: [0.011047103530355734, 0.0027551471516988764, 0.006778478475202572] and parameters: {'n_layers': 4, 'embedding_dim': 128, 'lr': 0.0012083421906459303, 'lambda_val': 1.4463129473968207e-05, 'batch_size': 1658, 'optimizer': 'RMSprop'}.
2026-06-21 23:19:46,532 - experiment_functions - INFO - Early stopping at epoch 1200. Best Metrics: (0.008914775717932371, 0.002267272956928129, 0.0052518531958074864)
2026-06-21 23:19:46,637 - optuna.study.study - INFO - Trial 132 finished with values: [0.008914775717932371, 0.002267272956928129, 0.0052518531958074864] and parameters: {'n_layers': 4, 'embedding_dim': 128, 'lr': 0.0008655839340917536, 'lambda_val': 1.5907426738824427e-06, 'batch_size': 3335, 'optimizer': 'Adam'}.
2026-06-21 23:22:35,978 - optuna.study.study - INFO - Trial 133 finished with values: [0.004907855862434958, 0.0011115321460149047, 0.002830706896253491] and parameters: {'n_layers': 1, 'embedding_dim': 96, 'lr': 0.0009291368086645142, 'lambda_val': 3.602866380465963e-05, 'batch_size': 1998, 'optimizer': 'Adam'}.
2026-06-21 23:23:37,130 - experiment_functions - INFO - Early stopping at epoch 1350. Best Metrics: (0.01208744021513072, 0.002968296071744348, 0.007239019111462343)
2026-06-21 23:23:37,217 - optuna.study.study - INFO - Trial 134 finished with values: [0.01208744021513072, 0.002968296071744348, 0.007239019111462343] and parameters: {'n_layers': 4, 'embedding_dim': 64, 'lr': 0.000927601540662843, 'lambda_val': 0.0009695798239708334, 'batch_size': 1802, 'optimizer': 'RMSprop'}.
2026-06-21 23:24:21,442 - experiment_functions - INFO - Early stopping at epoch 1000. Best Metrics: (0.003057020926791833, 0.0008320702286219528, 0.0018157866607587541)
2026-06-21 23:24:21,512 - optuna.study.study - INFO - Trial 135 finished with values: [0.003057020926791833, 0.0008320702286219528, 0.0018157866607587541] and parameters: {'n_layers': 1, 'embedding_dim': 96, 'lr': 0.007083700783329076, 'lambda_val': 0.0049720585313741935, 'batch_size': 1539, 'optimizer': 'RMSprop'}.
2026-06-21 23:25:05,817 - experiment_functions - INFO - Early stopping at epoch 1000. Best Metrics: (0.010245304729675025, 0.002448844259189087, 0.006228863385048645)
2026-06-21 23:25:05,894 - optuna.study.study - INFO - Trial 136 finished with values: [0.010245304729675025, 0.002448844259189087, 0.006228863385048645] and parameters: {'n_layers': 4, 'embedding_dim': 32, 'lr': 0.002103872362755323, 'lambda_val': 4.919667530385041e-05, 'batch_size': 1658, 'optimizer': 'Adam'}.
2026-06-21 23:27:51,047 - optuna.study.study - INFO - Trial 137 finished with values: [0.0076657744367680586, 0.001845711759504863, 0.004585086522085282] and parameters: {'n_layers': 2, 'embedding_dim': 32, 'lr': 0.0016184592928403282, 'lambda_val': 1.637764938555515e-05, 'batch_size': 569, 'optimizer': 'Adam'}.
2026-06-21 23:28:24,444 - experiment_functions - INFO - Early stopping at epoch 550. Best Metrics: (0.006875118883713044, 0.0016530882910193252, 0.00393424137482106)
2026-06-21 23:28:24,737 - optuna.study.study - INFO - Trial 138 finished with values: [0.006875118883713044, 0.0016530882910193252, 0.00393424137482106] and parameters: {'n_layers': 4, 'embedding_dim': 256, 'lr': 0.007083700783329076, 'lambda_val': 0.0005701343779094891, 'batch_size': 2194, 'optimizer': 'Adam'}.
2026-06-21 23:30:15,887 - experiment_functions - INFO - Early stopping at epoch 2350. Best Metrics: (0.004957526369850216, 0.0011557408109132247, 0.003054060710479736)
2026-06-21 23:30:15,963 - optuna.study.study - INFO - Trial 139 finished with values: [0.004957526369850216, 0.0011557408109132247, 0.003054060710479736] and parameters: {'n_layers': 1, 'embedding_dim': 256, 'lr': 0.001722483120017554, 'lambda_val': 3.896751352058934e-05, 'batch_size': 3075, 'optimizer': 'Adam'}.
2026-06-21 23:31:20,147 - experiment_functions - INFO - Early stopping at epoch 1500. Best Metrics: (0.010415674142296081, 0.002601995705443981, 0.006341824053452321)
2026-06-21 23:31:20,237 - optuna.study.study - INFO - Trial 140 finished with values: [0.010415674142296081, 0.002601995705443981, 0.006341824053452321] and parameters: {'n_layers': 4, 'embedding_dim': 32, 'lr': 0.000927601540662843, 'lambda_val': 1.1454689220118589e-06, 'batch_size': 3720, 'optimizer': 'RMSprop'}.
2026-06-21 23:31:50,985 - experiment_functions - INFO - Early stopping at epoch 650. Best Metrics: (0.004267416984045962, 0.0010689023620058104, 0.0027607998614294846)
2026-06-21 23:31:51,949 - optuna.study.study - INFO - Trial 141 finished with values: [0.004267416984045962, 0.0010689023620058104, 0.0027607998614294846] and parameters: {'n_layers': 2, 'embedding_dim': 128, 'lr': 0.020122252634636587, 'lambda_val': 2.4229838845984194e-06, 'batch_size': 875, 'optimizer': 'RMSprop'}.
2026-06-21 23:32:24,532 - experiment_functions - INFO - Early stopping at epoch 700. Best Metrics: (0.002415972180677234, 0.0006268157130226095, 0.0014855378744045517)
2026-06-21 23:32:24,618 - optuna.study.study - INFO - Trial 142 finished with values: [0.002415972180677234, 0.0006268157130226095, 0.0014855378744045517] and parameters: {'n_layers': 4, 'embedding_dim': 64, 'lr': 0.06459132475809307, 'lambda_val': 0.014586536668900354, 'batch_size': 2127, 'optimizer': 'Adam'}.
2026-06-21 23:35:04,495 - optuna.study.study - INFO - Trial 143 finished with values: [0.0052764363644617574, 0.0011573196918024506, 0.0032934552861132336] and parameters: {'n_layers': 1, 'embedding_dim': 32, 'lr': 0.0008655839340917536, 'lambda_val': 2.1177366308124127e-05, 'batch_size': 2127, 'optimizer': 'RMSprop'}.
2026-06-21 23:36:01,085 - experiment_functions - INFO - Early stopping at epoch 1050. Best Metrics: (0.006906008878475053, 0.0017999242137173173, 0.004115555622904414)
2026-06-21 23:36:01,173 - optuna.study.study - INFO - Trial 144 finished with values: [0.006906008878475053, 0.0017999242137173173, 0.004115555622904414] and parameters: {'n_layers': 3, 'embedding_dim': 256, 'lr': 0.0011267070786255592, 'lambda_val': 0.002536649916066294, 'batch_size': 1550, 'optimizer': 'Adam'}.
2026-06-21 23:37:28,826 - experiment_functions - INFO - Early stopping at epoch 2200. Best Metrics: (0.0037597810442663014, 0.0008178603006189213, 0.0021546685491010886)
2026-06-21 23:37:28,899 - optuna.study.study - INFO - Trial 145 finished with values: [0.0037597810442663014, 0.0008178603006189213, 0.0021546685491010886] and parameters: {'n_layers': 1, 'embedding_dim': 32, 'lr': 0.000927601540662843, 'lambda_val': 0.014586536668900354, 'batch_size': 2127, 'optimizer': 'Adam'}.
2026-06-21 23:38:19,518 - experiment_functions - INFO - Early stopping at epoch 1050. Best Metrics: (0.002874366453006748, 0.0007373373752684098, 0.0017018104503606713)
2026-06-21 23:38:19,602 - optuna.study.study - INFO - Trial 146 finished with values: [0.002874366453006748, 0.0007373373752684098, 0.0017018104503606713] and parameters: {'n_layers': 4, 'embedding_dim': 128, 'lr': 0.06119426066793775, 'lambda_val': 0.002536649916066294, 'batch_size': 3477, 'optimizer': 'RMSprop'}.
2026-06-21 23:39:04,482 - experiment_functions - INFO - Early stopping at epoch 950. Best Metrics: (0.008831174930488711, 0.0022941139320449668, 0.005399202632391394)
2026-06-21 23:39:04,560 - optuna.study.study - INFO - Trial 147 finished with values: [0.008831174930488711, 0.0022941139320449668, 0.005399202632391394] and parameters: {'n_layers': 3, 'embedding_dim': 128, 'lr': 0.0012526246054029107, 'lambda_val': 1.722399276566065e-05, 'batch_size': 3404, 'optimizer': 'RMSprop'}.
2026-06-21 23:41:44,718 - optuna.study.study - INFO - Trial 148 finished with values: [0.005160496299374728, 0.001222053808260705, 0.0032269675437674827] and parameters: {'n_layers': 1, 'embedding_dim': 64, 'lr': 0.0009291368086645142, 'lambda_val': 4.471181352641307e-06, 'batch_size': 2998, 'optimizer': 'RMSprop'}.
2026-06-21 23:42:11,385 - experiment_functions - INFO - Early stopping at epoch 600. Best Metrics: (0.0071478696203300645, 0.0017715043577112546, 0.0043891759964438965)
2026-06-21 23:42:11,460 - optuna.study.study - INFO - Trial 149 finished with values: [0.0071478696203300645, 0.0017715043577112546, 0.0043891759964438965] and parameters: {'n_layers': 4, 'embedding_dim': 32, 'lr': 0.011955866081987015, 'lambda_val': 0.0001313947543098742, 'batch_size': 2127, 'optimizer': 'Adam'}.
2026-06-21 23:42:58,554 - experiment_functions - INFO - Early stopping at epoch 1100. Best Metrics: (0.011986618293953106, 0.002982505999747379, 0.007309977441312323)
2026-06-21 23:42:58,655 - optuna.study.study - INFO - Trial 150 finished with values: [0.011986618293953106, 0.002982505999747379, 0.007309977441312323] and parameters: {'n_layers': 4, 'embedding_dim': 32, 'lr': 0.0012083421906459303, 'lambda_val': 0.0011958935689814394, 'batch_size': 1658, 'optimizer': 'RMSprop'}.
2026-06-21 23:43:34,321 - experiment_functions - INFO - Early stopping at epoch 750. Best Metrics: (0.009446762519237433, 0.0023209549071618036, 0.005559236792912115)
2026-06-21 23:43:34,667 - optuna.study.study - INFO - Trial 151 finished with values: [0.009446762519237433, 0.0023209549071618036, 0.005559236792912115] and parameters: {'n_layers': 4, 'embedding_dim': 96, 'lr': 0.0022550052450588096, 'lambda_val': 0.0005885182255384318, 'batch_size': 2194, 'optimizer': 'Adam'}.
2026-06-21 23:44:13,070 - experiment_functions - INFO - Early stopping at epoch 900. Best Metrics: (0.010558633413309702, 0.002568839206770241, 0.006366505668479662)
2026-06-21 23:44:13,180 - optuna.study.study - INFO - Trial 152 finished with values: [0.010558633413309702, 0.002568839206770241, 0.006366505668479662] and parameters: {'n_layers': 3, 'embedding_dim': 32, 'lr': 0.0022550052450588096, 'lambda_val': 0.0005885182255384318, 'batch_size': 1308, 'optimizer': 'RMSprop'}.
2026-06-21 23:44:44,278 - experiment_functions - INFO - Early stopping at epoch 650. Best Metrics: (0.009046960606888073, 0.0023177971453833524, 0.0054873197201024335)
2026-06-21 23:44:44,384 - optuna.study.study - INFO - Trial 153 finished with values: [0.009046960606888073, 0.0023177971453833524, 0.0054873197201024335] and parameters: {'n_layers': 4, 'embedding_dim': 96, 'lr': 0.002103872362755323, 'lambda_val': 1.1454689220118589e-06, 'batch_size': 3404, 'optimizer': 'RMSprop'}.
2026-06-21 23:47:33,224 - experiment_functions - INFO - Early stopping at epoch 3100. Best Metrics: (0.0006300414703431797, 0.0001294682329165088, 0.00034365582078067894)
2026-06-21 23:47:33,316 - optuna.study.study - INFO - Trial 154 finished with values: [0.0006300414703431797, 0.0001294682329165088, 0.00034365582078067894] and parameters: {'n_layers': 4, 'embedding_dim': 256, 'lr': 2.488495645047604e-05, 'lambda_val': 4.866899330600482e-06, 'batch_size': 3404, 'optimizer': 'Adam'}.
2026-06-21 23:48:41,044 - experiment_functions - INFO - Early stopping at epoch 1600. Best Metrics: (0.010845042860508322, 0.00279777693570797, 0.006707408387990741)
2026-06-21 23:48:41,128 - optuna.study.study - INFO - Trial 155 finished with values: [0.010845042860508322, 0.00279777693570797, 0.006707408387990741] and parameters: {'n_layers': 4, 'embedding_dim': 32, 'lr': 0.000927601540662843, 'lambda_val': 0.00042920145544431403, 'batch_size': 3720, 'optimizer': 'RMSprop'}.
2026-06-21 23:50:43,175 - experiment_functions - INFO - Early stopping at epoch 2700. Best Metrics: (0.009395827015885217, 0.0023146393836049007, 0.005621962749849174)
2026-06-21 23:50:43,268 - optuna.study.study - INFO - Trial 156 finished with values: [0.009395827015885217, 0.0023146393836049007, 0.005621962749849174] and parameters: {'n_layers': 3, 'embedding_dim': 128, 'lr': 0.0008655839340917536, 'lambda_val': 8.523264017245288e-05, 'batch_size': 1550, 'optimizer': 'Adam'}.
2026-06-21 23:51:12,547 - experiment_functions - INFO - Early stopping at epoch 600. Best Metrics: (0.009299853865675273, 0.0023177971453833524, 0.005553789498906733)
2026-06-21 23:51:12,627 - optuna.study.study - INFO - Trial 157 finished with values: [0.009299853865675273, 0.0023177971453833524, 0.005553789498906733] and parameters: {'n_layers': 4, 'embedding_dim': 96, 'lr': 0.0022550052450588096, 'lambda_val': 1.722399276566065e-05, 'batch_size': 3404, 'optimizer': 'RMSprop'}.
2026-06-21 23:51:44,906 - experiment_functions - INFO - Early stopping at epoch 700. Best Metrics: (0.010380120339161861, 0.002564102564102564, 0.006174920538754095)
2026-06-21 23:51:44,998 - optuna.study.study - INFO - Trial 158 finished with values: [0.010380120339161861, 0.002564102564102564, 0.006174920538754095] and parameters: {'n_layers': 4, 'embedding_dim': 64, 'lr': 0.0022550052450588096, 'lambda_val': 1.4463129473968207e-05, 'batch_size': 1925, 'optimizer': 'RMSprop'}.
2026-06-21 23:54:29,728 - optuna.study.study - INFO - Trial 159 finished with values: [0.014801269640603111, 0.003580901856763926, 0.008913688459120632] and parameters: {'n_layers': 4, 'embedding_dim': 32, 'lr': 0.0008655839340917536, 'lambda_val': 4.919667530385041e-05, 'batch_size': 622, 'optimizer': 'RMSprop'}.
2026-06-21 23:55:17,677 - experiment_functions - INFO - Early stopping at epoch 1150. Best Metrics: (0.0036328304324262425, 0.0010152204117721358, 0.0020819627446518694)
2026-06-21 23:55:17,772 - optuna.study.study - INFO - Trial 160 finished with values: [0.0036328304324262425, 0.0010152204117721358, 0.0020819627446518694] and parameters: {'n_layers': 3, 'embedding_dim': 32, 'lr': 0.0016253610840212534, 'lambda_val': 0.053868273493910775, 'batch_size': 647, 'optimizer': 'RMSprop'}.
2026-06-21 23:56:08,323 - experiment_functions - INFO - Early stopping at epoch 1050. Best Metrics: (0.009490071417751388, 0.0024267399267399272, 0.005784420281133339)
2026-06-21 23:56:08,417 - optuna.study.study - INFO - Trial 161 finished with values: [0.009490071417751388, 0.0024267399267399272, 0.005784420281133339] and parameters: {'n_layers': 4, 'embedding_dim': 128, 'lr': 0.0012083421906459303, 'lambda_val': 0.0009695798239708334, 'batch_size': 1658, 'optimizer': 'Adam'}.
2026-06-21 23:59:10,888 - optuna.study.study - INFO - Trial 162 finished with values: [0.0008485841467444849, 0.00019420234937476318, 0.00045899544489519953] and parameters: {'n_layers': 4, 'embedding_dim': 128, 'lr': 4.772381168543474e-05, 'lambda_val': 0.0011887391193144332, 'batch_size': 2127, 'optimizer': 'Adam'}.
2026-06-21 23:59:32,693 - experiment_functions - INFO - Early stopping at epoch 500. Best Metrics: (0.000438436087024403, 0.00011367942402425163, 0.00023198735595715916)
2026-06-21 23:59:32,762 - optuna.study.study - INFO - Trial 163 finished with values: [0.000438436087024403, 0.00011367942402425163, 0.00023198735595715916] and parameters: {'n_layers': 2, 'embedding_dim': 32, 'lr': 0.002103872362755323, 'lambda_val': 0.07238972764527284, 'batch_size': 1658, 'optimizer': 'SGD'}.
2026-06-22 00:02:23,658 - optuna.study.study - INFO - Trial 164 finished with values: [0.0013449334078209747, 0.0003015662498421119, 0.0007637654654441733] and parameters: {'n_layers': 3, 'embedding_dim': 96, 'lr': 0.00016539099126295433, 'lambda_val': 0.002536649916066294, 'batch_size': 1550, 'optimizer': 'Adam'}.
2026-06-22 00:03:30,576 - experiment_functions - INFO - Early stopping at epoch 1400. Best Metrics: (0.010128268426549836, 0.0026146267525577875, 0.006232081688150871)
2026-06-22 00:03:30,662 - optuna.study.study - INFO - Trial 165 finished with values: [0.010128268426549836, 0.0026146267525577875, 0.006232081688150871] and parameters: {'n_layers': 4, 'embedding_dim': 128, 'lr': 0.0005928351587802508, 'lambda_val': 1.1454689220118589e-06, 'batch_size': 3404, 'optimizer': 'RMSprop'}.
2026-06-22 00:06:10,955 - optuna.study.study - INFO - Trial 166 finished with values: [0.009780897139476384, 0.002475685234305924, 0.005870865215452201] and parameters: {'n_layers': 3, 'embedding_dim': 32, 'lr': 0.000927601540662843, 'lambda_val': 0.0011958935689814394, 'batch_size': 1169, 'optimizer': 'Adam'}.
2026-06-22 00:06:38,010 - experiment_functions - INFO - Early stopping at epoch 550. Best Metrics: (0.005776152798154178, 0.0014099406340785652, 0.0033660872127056532)
