2026-06-18 04:12:38,751 - optuna.study.study - INFO - Trial 34 finished with values: [0.0018509170920893857, 0.0003899835796387521, 0.001141790895844071] and parameters: {'n_layers': 4, 'embedding_dim': 32, 'lr': 0.00021256415646560964, 'lambda_val': 3.166935471908637e-05, 'batch_size': 1084, 'optimizer': 'RMSprop'}.
2026-06-18 04:13:01,633 - experiment_functions - INFO - Early stopping at epoch 500. Best Metrics: (0.0006760869194240707, 0.0001373626373626374, 0.00038364377263910425)
2026-06-18 04:13:01,723 - optuna.study.study - INFO - Trial 35 finished with values: [0.0006760869194240707, 0.0001373626373626374, 0.00038364377263910425] and parameters: {'n_layers': 3, 'embedding_dim': 64, 'lr': 0.00024547375617598626, 'lambda_val': 2.7739825602696133e-05, 'batch_size': 3311, 'optimizer': 'SGD'}.
2026-06-18 04:13:25,578 - experiment_functions - INFO - Early stopping at epoch 550. Best Metrics: (0.0023064342015489013, 0.0005889225716811924, 0.0013996712345944744)
2026-06-18 04:13:25,648 - optuna.study.study - INFO - Trial 36 finished with values: [0.0023064342015489013, 0.0005889225716811924, 0.0013996712345944744] and parameters: {'n_layers': 3, 'embedding_dim': 32, 'lr': 0.009898479133052968, 'lambda_val': 0.0006822884198672845, 'batch_size': 2267, 'optimizer': 'RMSprop'}.
2026-06-18 04:13:49,690 - experiment_functions - INFO - Early stopping at epoch 500. Best Metrics: (0.0006654584840544116, 0.00013736263736263736, 0.00034221053651009277)
2026-06-18 04:13:49,785 - optuna.study.study - INFO - Trial 37 finished with values: [0.0006654584840544116, 0.00013736263736263736, 0.00034221053651009277] and parameters: {'n_layers': 4, 'embedding_dim': 96, 'lr': 0.007338343150265914, 'lambda_val': 3.2094574786151052e-06, 'batch_size': 1223, 'optimizer': 'SGD'}.
2026-06-18 04:16:37,299 - optuna.study.study - INFO - Trial 38 finished with values: [0.0015921722122095618, 0.00032840722495894905, 0.0009180319980712457] and parameters: {'n_layers': 2, 'embedding_dim': 96, 'lr': 0.00013102944378274133, 'lambda_val': 3.3473095465775026e-06, 'batch_size': 3024, 'optimizer': 'Adam'}.
2026-06-18 04:18:53,921 - experiment_functions - INFO - Early stopping at epoch 3100. Best Metrics: (0.0006796921244256984, 0.00014367816091954023, 0.00038375218553498734)
2026-06-18 04:18:54,752 - optuna.study.study - INFO - Trial 39 finished with values: [0.0006796921244256984, 0.00014367816091954023, 0.00038375218553498734] and parameters: {'n_layers': 4, 'embedding_dim': 96, 'lr': 3.6092977270027075e-05, 'lambda_val': 0.0001471681539900651, 'batch_size': 1710, 'optimizer': 'RMSprop'}.
2026-06-18 04:20:59,466 - experiment_functions - INFO - Early stopping at epoch 2700. Best Metrics: (0.0006846535426769904, 0.00015630920803334599, 0.00036778778236459873)
2026-06-18 04:20:59,552 - optuna.study.study - INFO - Trial 40 finished with values: [0.0006846535426769904, 0.00015630920803334599, 0.00036778778236459873] and parameters: {'n_layers': 4, 'embedding_dim': 128, 'lr': 1.2718553529590029e-05, 'lambda_val': 0.0033430295037975904, 'batch_size': 3047, 'optimizer': 'Adam'}.
2026-06-18 04:21:23,972 - experiment_functions - INFO - Early stopping at epoch 500. Best Metrics: (0.0006518682780806478, 0.0001405203991410888, 0.0003703568484414094)
2026-06-18 04:21:24,053 - optuna.study.study - INFO - Trial 41 finished with values: [0.0006518682780806478, 0.0001405203991410888, 0.0003703568484414094] and parameters: {'n_layers': 4, 'embedding_dim': 128, 'lr': 0.0003060625625585814, 'lambda_val': 1.0512739515635816e-05, 'batch_size': 3080, 'optimizer': 'SGD'}.
2026-06-18 04:21:48,731 - experiment_functions - INFO - Early stopping at epoch 500. Best Metrics: (0.0006668594687337313, 0.00014209928003031453, 0.0003594456666684683)
2026-06-18 04:21:48,808 - optuna.study.study - INFO - Trial 42 finished with values: [0.0006668594687337313, 0.00014209928003031453, 0.0003594456666684683] and parameters: {'n_layers': 4, 'embedding_dim': 128, 'lr': 0.0003089215133690665, 'lambda_val': 0.00020122391761600542, 'batch_size': 925, 'optimizer': 'SGD'}.
2026-06-18 04:24:35,641 - experiment_functions - INFO - Early stopping at epoch 3500. Best Metrics: (0.003327438425525616, 0.000865226727295693, 0.0020962612346510025)
2026-06-18 04:24:35,731 - optuna.study.study - INFO - Trial 43 finished with values: [0.003327438425525616, 0.000865226727295693, 0.0020962612346510025] and parameters: {'n_layers': 2, 'embedding_dim': 256, 'lr': 0.0007081502475512032, 'lambda_val': 1.6639720416643942e-06, 'batch_size': 2514, 'optimizer': 'RMSprop'}.
2026-06-18 04:25:00,057 - experiment_functions - INFO - Early stopping at epoch 550. Best Metrics: (0.0020310115420419856, 0.0005605027156751295, 0.0013311038637936195)
2026-06-18 04:25:00,144 - optuna.study.study - INFO - Trial 44 finished with values: [0.0020310115420419856, 0.0005605027156751295, 0.0013311038637936195] and parameters: {'n_layers': 3, 'embedding_dim': 32, 'lr': 0.04602436565145392, 'lambda_val': 0.00010785441241137728, 'batch_size': 546, 'optimizer': 'RMSprop'}.
2026-06-18 04:27:55,161 - optuna.study.study - INFO - Trial 45 finished with values: [0.0021901203272050676, 0.000502084122773778, 0.0013001879635202048] and parameters: {'n_layers': 4, 'embedding_dim': 96, 'lr': 0.00019742482032602274, 'lambda_val': 0.0016352494456933174, 'batch_size': 1258, 'optimizer': 'RMSprop'}.
2026-06-18 04:30:07,293 - experiment_functions - INFO - Early stopping at epoch 3100. Best Metrics: (0.0040688922510772225, 0.0009283819628647215, 0.0025320470324910575)
2026-06-18 04:30:07,395 - optuna.study.study - INFO - Trial 46 finished with values: [0.0040688922510772225, 0.0009283819628647215, 0.0025320470324910575] and parameters: {'n_layers': 2, 'embedding_dim': 128, 'lr': 0.0009840483225184993, 'lambda_val': 1.4055284682631976e-05, 'batch_size': 655, 'optimizer': 'RMSprop'}.
2026-06-18 04:30:36,952 - experiment_functions - INFO - Early stopping at epoch 550. Best Metrics: (0.0021181362715408476, 0.0005873436907919668, 0.0014410041622213822)
2026-06-18 04:30:37,058 - optuna.study.study - INFO - Trial 47 finished with values: [0.0021181362715408476, 0.0005873436907919668, 0.0014410041622213822] and parameters: {'n_layers': 3, 'embedding_dim': 256, 'lr': 0.035725976778282716, 'lambda_val': 1.0646709487043788e-05, 'batch_size': 1589, 'optimizer': 'RMSprop'}.
2026-06-18 04:31:16,162 - experiment_functions - INFO - Early stopping at epoch 700. Best Metrics: (0.0030760622305347845, 0.0008178603006189213, 0.0019083833621138752)
2026-06-18 04:31:16,246 - optuna.study.study - INFO - Trial 48 finished with values: [0.0030760622305347845, 0.0008178603006189213, 0.0019083833621138752] and parameters: {'n_layers': 4, 'embedding_dim': 256, 'lr': 0.003946985249188999, 'lambda_val': 0.0002692345705128242, 'batch_size': 2395, 'optimizer': 'Adam'}.
2026-06-18 04:34:45,478 - optuna.study.study - INFO - Trial 49 finished with values: [0.001967601151136155, 0.00048155867121384366, 0.0012760967517167032] and parameters: {'n_layers': 4, 'embedding_dim': 256, 'lr': 0.0001225003495150834, 'lambda_val': 0.014864788193415631, 'batch_size': 2756, 'optimizer': 'RMSprop'}.
2026-06-18 04:37:50,561 - optuna.study.study - INFO - Trial 50 finished with values: [0.002006787240304, 0.00043103448275862074, 0.0012743720613289235] and parameters: {'n_layers': 2, 'embedding_dim': 256, 'lr': 0.00021256415646560964, 'lambda_val': 0.00021932042110835948, 'batch_size': 1084, 'optimizer': 'RMSprop'}.
2026-06-18 04:38:17,735 - experiment_functions - INFO - Early stopping at epoch 500. Best Metrics: (0.0019243452620718317, 0.0005083996463306809, 0.0012598392085385235)
2026-06-18 04:38:17,804 - optuna.study.study - INFO - Trial 51 finished with values: [0.0019243452620718317, 0.0005083996463306809, 0.0012598392085385235] and parameters: {'n_layers': 3, 'embedding_dim': 256, 'lr': 0.07380408985494451, 'lambda_val': 0.0016422579770858177, 'batch_size': 655, 'optimizer': 'RMSprop'}.
2026-06-18 04:40:56,734 - optuna.study.study - INFO - Trial 52 finished with values: [0.001763780910440482, 0.0003615637236326891, 0.0010325076123301074] and parameters: {'n_layers': 4, 'embedding_dim': 32, 'lr': 0.0001225003495150834, 'lambda_val': 0.00021932042110835948, 'batch_size': 3869, 'optimizer': 'RMSprop'}.
2026-06-18 04:42:06,054 - experiment_functions - INFO - Early stopping at epoch 1500. Best Metrics: (0.003533297060346691, 0.0008747000126310471, 0.0021048387345279796)
2026-06-18 04:42:06,129 - optuna.study.study - INFO - Trial 53 finished with values: [0.003533297060346691, 0.0008747000126310471, 0.0021048387345279796] and parameters: {'n_layers': 4, 'embedding_dim': 128, 'lr': 0.0008273605807562151, 'lambda_val': 0.00020122391761600542, 'batch_size': 2287, 'optimizer': 'Adam'}.
2026-06-18 04:42:35,868 - experiment_functions - INFO - Early stopping at epoch 650. Best Metrics: (0.0034130589958954642, 0.0008241758241758242, 0.0021379246154927447)
2026-06-18 04:42:35,948 - optuna.study.study - INFO - Trial 54 finished with values: [0.0034130589958954642, 0.0008241758241758242, 0.0021379246154927447] and parameters: {'n_layers': 3, 'embedding_dim': 96, 'lr': 0.0019141832424539585, 'lambda_val': 1.5179554986144033e-05, 'batch_size': 2942, 'optimizer': 'RMSprop'}.
2026-06-18 04:45:24,742 - optuna.study.study - INFO - Trial 55 finished with values: [0.0021897985844917056, 0.0004768220285461665, 0.0012666925133967704] and parameters: {'n_layers': 3, 'embedding_dim': 96, 'lr': 0.00021271985155806201, 'lambda_val': 0.00016604057802743083, 'batch_size': 1509, 'optimizer': 'Adam'}.
2026-06-18 04:45:48,842 - experiment_functions - INFO - Early stopping at epoch 500. Best Metrics: (0.0019673840786868205, 0.0004768220285461665, 0.0013380699006045802)
2026-06-18 04:45:48,945 - optuna.study.study - INFO - Trial 56 finished with values: [0.0019673840786868205, 0.0004768220285461665, 0.0013380699006045802] and parameters: {'n_layers': 4, 'embedding_dim': 96, 'lr': 0.07320596878747779, 'lambda_val': 0.0016352494456933174, 'batch_size': 1258, 'optimizer': 'RMSprop'}.
2026-06-18 04:48:03,362 - experiment_functions - INFO - Early stopping at epoch 2950. Best Metrics: (0.0036249361962066334, 0.0009110142730832387, 0.002242494185450948)
2026-06-18 04:48:03,455 - optuna.study.study - INFO - Trial 57 finished with values: [0.0036249361962066334, 0.0009110142730832387, 0.002242494185450948] and parameters: {'n_layers': 4, 'embedding_dim': 128, 'lr': 0.00046996802016152644, 'lambda_val': 2.2848456976007116e-05, 'batch_size': 3080, 'optimizer': 'RMSprop'}.
2026-06-18 04:49:47,142 - experiment_functions - INFO - Early stopping at epoch 2550. Best Metrics: (0.0030971326481732844, 0.0007404951370468611, 0.001956744597039084)
2026-06-18 04:49:47,211 - optuna.study.study - INFO - Trial 58 finished with values: [0.0030971326481732844, 0.0007404951370468611, 0.001956744597039084] and parameters: {'n_layers': 4, 'embedding_dim': 32, 'lr': 0.0004894377864752034, 'lambda_val': 0.00021932042110835948, 'batch_size': 3869, 'optimizer': 'RMSprop'}.
2026-06-18 04:52:18,021 - experiment_functions - INFO - Early stopping at epoch 3750. Best Metrics: (0.003443332146390979, 0.0007625994694960213, 0.002123008673912465)
2026-06-18 04:52:18,109 - optuna.study.study - INFO - Trial 59 finished with values: [0.003443332146390979, 0.0007625994694960213, 0.002123008673912465] and parameters: {'n_layers': 4, 'embedding_dim': 32, 'lr': 0.00048363299473296685, 'lambda_val': 0.00021932042110835948, 'batch_size': 2756, 'optimizer': 'RMSprop'}.
2026-06-18 04:53:24,984 - experiment_functions - INFO - Early stopping at epoch 1600. Best Metrics: (0.0005255254270633842, 0.00010420613868889732, 0.00029933596915552414)
2026-06-18 04:53:25,062 - optuna.study.study - INFO - Trial 60 finished with values: [0.0005255254270633842, 0.00010420613868889732, 0.00029933596915552414] and parameters: {'n_layers': 3, 'embedding_dim': 32, 'lr': 1.1110566526073893e-05, 'lambda_val': 0.00014775374883502693, 'batch_size': 2395, 'optimizer': 'Adam'}.
2026-06-18 04:53:58,930 - experiment_functions - INFO - Early stopping at epoch 750. Best Metrics: (0.0004460862485637383, 0.00010420613868889732, 0.0002909995860422883)
2026-06-18 04:53:59,017 - optuna.study.study - INFO - Trial 61 finished with values: [0.0004460862485637383, 0.00010420613868889732, 0.0002909995860422883] and parameters: {'n_layers': 4, 'embedding_dim': 64, 'lr': 0.02452456507815872, 'lambda_val': 0.00020122391761600542, 'batch_size': 696, 'optimizer': 'SGD'}.
2026-06-18 04:54:22,790 - experiment_functions - INFO - Early stopping at epoch 500. Best Metrics: (0.0005620902158361458, 0.0001373626373626374, 0.0003188493256978723)
2026-06-18 04:54:22,866 - optuna.study.study - INFO - Trial 62 finished with values: [0.0005620902158361458, 0.0001373626373626374, 0.0003188493256978723] and parameters: {'n_layers': 3, 'embedding_dim': 96, 'lr': 0.00046996802016152644, 'lambda_val': 2.2848456976007116e-05, 'batch_size': 1258, 'optimizer': 'SGD'}.
2026-06-18 04:54:51,686 - experiment_functions - INFO - Early stopping at epoch 650. Best Metrics: (0.003406196303152648, 0.0008399646330680814, 0.002179180784998307)
2026-06-18 04:54:51,785 - optuna.study.study - INFO - Trial 63 finished with values: [0.003406196303152648, 0.0008399646330680814, 0.002179180784998307] and parameters: {'n_layers': 4, 'embedding_dim': 32, 'lr': 0.0037241261216120077, 'lambda_val': 7.3372601056335455e-06, 'batch_size': 1509, 'optimizer': 'RMSprop'}.
2026-06-18 04:55:20,551 - experiment_functions - INFO - Early stopping at epoch 550. Best Metrics: (0.00285503844416261, 0.0007894404446128586, 0.0018060706137460296)
2026-06-18 04:55:20,632 - optuna.study.study - INFO - Trial 64 finished with values: [0.00285503844416261, 0.0007894404446128586, 0.0018060706137460296] and parameters: {'n_layers': 4, 'embedding_dim': 128, 'lr': 0.012284383685955047, 'lambda_val': 1.4055284682631976e-05, 'batch_size': 1882, 'optimizer': 'RMSprop'}.
2026-06-18 04:55:48,438 - experiment_functions - INFO - Early stopping at epoch 550. Best Metrics: (0.0025670224981536585, 0.0007199696854869269, 0.0016568207082190212)
2026-06-18 04:55:48,527 - optuna.study.study - INFO - Trial 65 finished with values: [0.0025670224981536585, 0.0007199696854869269, 0.0016568207082190212] and parameters: {'n_layers': 4, 'embedding_dim': 96, 'lr': 0.006608098041910351, 'lambda_val': 0.0006822884198672845, 'batch_size': 2931, 'optimizer': 'RMSprop'}.
2026-06-18 04:56:14,602 - experiment_functions - INFO - Early stopping at epoch 500. Best Metrics: (0.00044692296475680975, 0.00011210054313502589, 0.00024275553833993826)
2026-06-18 04:56:14,701 - optuna.study.study - INFO - Trial 66 finished with values: [0.00044692296475680975, 0.00011210054313502589, 0.00024275553833993826] and parameters: {'n_layers': 4, 'embedding_dim': 128, 'lr': 0.0004045209701974556, 'lambda_val': 0.004044231569890685, 'batch_size': 1922, 'optimizer': 'SGD'}.
2026-06-18 04:57:30,009 - experiment_functions - INFO - Early stopping at epoch 1600. Best Metrics: (0.0006359057369958742, 0.0001405203991410888, 0.0003365003531720879)
2026-06-18 04:57:30,083 - optuna.study.study - INFO - Trial 67 finished with values: [0.0006359057369958742, 0.0001405203991410888, 0.0003365003531720879] and parameters: {'n_layers': 4, 'embedding_dim': 96, 'lr': 3.175623790861494e-05, 'lambda_val': 5.088875721981583e-06, 'batch_size': 1509, 'optimizer': 'Adam'}.
2026-06-18 04:58:41,441 - experiment_functions - INFO - Early stopping at epoch 1250. Best Metrics: (0.00329302263997708, 0.000819439181508147, 0.002074109146601974)
2026-06-18 04:58:41,528 - optuna.study.study - INFO - Trial 68 finished with values: [0.00329302263997708, 0.000819439181508147, 0.002074109146601974] and parameters: {'n_layers': 4, 'embedding_dim': 256, 'lr': 0.0008273605807562151, 'lambda_val': 0.0009339364864859292, 'batch_size': 845, 'optimizer': 'Adam'}.
2026-06-18 04:59:13,731 - experiment_functions - INFO - Early stopping at epoch 700. Best Metrics: (0.0021818521798552663, 0.0005526083112290009, 0.0014280595227618182)
2026-06-18 04:59:13,813 - optuna.study.study - INFO - Trial 69 finished with values: [0.0021818521798552663, 0.0005526083112290009, 0.0014280595227618182] and parameters: {'n_layers': 4, 'embedding_dim': 32, 'lr': 0.025072127211169866, 'lambda_val': 1.0512739515635816e-05, 'batch_size': 1092, 'optimizer': 'RMSprop'}.
2026-06-18 05:01:28,016 - experiment_functions - INFO - Early stopping at epoch 3050. Best Metrics: (0.0033524979469629606, 0.0008241758241758242, 0.0021744308836927264)
2026-06-18 05:01:28,091 - optuna.study.study - INFO - Trial 70 finished with values: [0.0033524979469629606, 0.0008241758241758242, 0.0021744308836927264] and parameters: {'n_layers': 3, 'embedding_dim': 64, 'lr': 0.0004894377864752034, 'lambda_val': 0.00029665726020447226, 'batch_size': 3869, 'optimizer': 'RMSprop'}.
2026-06-18 05:04:12,490 - experiment_functions - INFO - Early stopping at epoch 3850. Best Metrics: (0.004043236043344421, 0.0009204875584185929, 0.002675189723578519)
2026-06-18 05:04:12,574 - optuna.study.study - INFO - Trial 71 finished with values: [0.004043236043344421, 0.0009204875584185929, 0.002675189723578519] and parameters: {'n_layers': 4, 'embedding_dim': 32, 'lr': 0.0008273605807562151, 'lambda_val': 0.0009339364864859292, 'batch_size': 655, 'optimizer': 'RMSprop'}.
2026-06-18 05:05:37,427 - experiment_functions - INFO - Early stopping at epoch 1800. Best Metrics: (0.0005180210448050342, 0.00012788935202728306, 0.0002896683677387979)
2026-06-18 05:05:37,520 - optuna.study.study - INFO - Trial 72 finished with values: [0.0005180210448050342, 0.00012788935202728306, 0.0002896683677387979] and parameters: {'n_layers': 3, 'embedding_dim': 128, 'lr': 1.2718553529590029e-05, 'lambda_val': 7.26632982937258e-05, 'batch_size': 3047, 'optimizer': 'RMSprop'}.
2026-06-18 05:06:04,625 - experiment_functions - INFO - Early stopping at epoch 550. Best Metrics: (0.002544996575234321, 0.0006568144499178982, 0.0016972071156426153)
2026-06-18 05:06:04,720 - optuna.study.study - INFO - Trial 73 finished with values: [0.002544996575234321, 0.0006568144499178982, 0.0016972071156426153] and parameters: {'n_layers': 3, 'embedding_dim': 96, 'lr': 0.0108387318865738, 'lambda_val': 0.00016604057802743083, 'batch_size': 1892, 'optimizer': 'RMSprop'}.
2026-06-18 05:06:31,294 - experiment_functions - INFO - Early stopping at epoch 500. Best Metrics: (0.0006119730540927445, 0.0001310471138057345, 0.0003378771336728532)
2026-06-18 05:06:31,378 - optuna.study.study - INFO - Trial 74 finished with values: [0.0006119730540927445, 0.0001310471138057345, 0.0003378771336728532] and parameters: {'n_layers': 2, 'embedding_dim': 256, 'lr': 0.00024547375617598626, 'lambda_val': 1.6639720416643942e-06, 'batch_size': 2514, 'optimizer': 'SGD'}.
2026-06-18 05:06:58,730 - experiment_functions - INFO - Early stopping at epoch 600. Best Metrics: (0.0019487648621637097, 0.0004610332196539093, 0.0011584701437871037)
2026-06-18 05:06:58,815 - optuna.study.study - INFO - Trial 75 finished with values: [0.0019487648621637097, 0.0004610332196539093, 0.0011584701437871037] and parameters: {'n_layers': 1, 'embedding_dim': 32, 'lr': 0.042010532329755206, 'lambda_val': 1.5851584365326932e-06, 'batch_size': 2287, 'optimizer': 'Adam'}.
2026-06-18 05:07:27,058 - experiment_functions - INFO - Early stopping at epoch 600. Best Metrics: (0.0026705426745877977, 0.0006741821396993811, 0.0018177899855287528)
2026-06-18 05:07:27,147 - optuna.study.study - INFO - Trial 76 finished with values: [0.0026705426745877977, 0.0006741821396993811, 0.0018177899855287528] and parameters: {'n_layers': 4, 'embedding_dim': 32, 'lr': 0.007973613552701056, 'lambda_val': 0.00029665726020447226, 'batch_size': 2931, 'optimizer': 'Adam'}.
2026-06-18 05:07:52,730 - experiment_functions - INFO - Early stopping at epoch 550. Best Metrics: (0.0026763333621495737, 0.0006236579512441581, 0.001775935312131289)
2026-06-18 05:07:52,815 - optuna.study.study - INFO - Trial 77 finished with values: [0.0026763333621495737, 0.0006236579512441581, 0.001775935312131289] and parameters: {'n_layers': 3, 'embedding_dim': 32, 'lr': 0.026856253273949384, 'lambda_val': 1.1421527735625712e-05, 'batch_size': 1892, 'optimizer': 'Adam'}.
2026-06-18 05:08:35,729 - experiment_functions - INFO - Early stopping at epoch 850. Best Metrics: (0.002568187512060829, 0.0006678666161424783, 0.0016398251412502675)
2026-06-18 05:08:35,813 - optuna.study.study - INFO - Trial 78 finished with values: [0.002568187512060829, 0.0006678666161424783, 0.0016398251412502675] and parameters: {'n_layers': 4, 'embedding_dim': 128, 'lr': 0.0006520425723369588, 'lambda_val': 0.02277446723940248, 'batch_size': 2480, 'optimizer': 'RMSprop'}.
2026-06-18 05:11:36,767 - optuna.study.study - INFO - Trial 79 finished with values: [0.0019888750938484314, 0.0004973474801061009, 0.0012490009138861379] and parameters: {'n_layers': 4, 'embedding_dim': 96, 'lr': 0.00020850286339787972, 'lambda_val': 0.01895837370153157, 'batch_size': 1882, 'optimizer': 'Adam'}.
2026-06-18 05:13:31,591 - experiment_functions - INFO - Early stopping at epoch 2500. Best Metrics: (0.0005632882426290944, 0.0001310471138057345, 0.0003664225709422531)
2026-06-18 05:13:31,690 - optuna.study.study - INFO - Trial 80 finished with values: [0.0005632882426290944, 0.0001310471138057345, 0.0003664225709422531] and parameters: {'n_layers': 4, 'embedding_dim': 128, 'lr': 2.1336246823980475e-05, 'lambda_val': 0.00016604057802743083, 'batch_size': 3937, 'optimizer': 'Adam'}.
2026-06-18 05:13:57,553 - experiment_functions - INFO - Early stopping at epoch 550. Best Metrics: (0.0031739697716944844, 0.0007357584943791841, 0.0020464130934893434)
