2026-06-19 00:45:30,510 - optuna.study.study - INFO - Trial 79 finished with values: [0.0004985440630577651, 0.00010736390046734875, 0.00027734694980249586] and parameters: {'n_layers': 3, 'embedding_dim': 96, 'lr': 0.00014446581089320301, 'lambda_val': 0.06967843853647833, 'batch_size': 897, 'optimizer': 'Adam'}.
2026-06-19 00:46:15,004 - experiment_functions - INFO - Early stopping at epoch 750. Best Metrics: (0.005114382759474739, 0.0011225843122394847, 0.002659393524453745)
2026-06-19 00:46:15,056 - optuna.study.study - INFO - Trial 80 finished with values: [0.005114382759474739, 0.0011225843122394847, 0.002659393524453745] and parameters: {'n_layers': 3, 'embedding_dim': 256, 'lr': 0.0018715145286522033, 'lambda_val': 0.05682316696015936, 'batch_size': 1707, 'optimizer': 'Adam'}.
2026-06-19 00:47:02,758 - experiment_functions - INFO - Early stopping at epoch 900. Best Metrics: (0.0126719720554467, 0.002696728558797524, 0.007025512830236652)
2026-06-19 00:47:02,841 - optuna.study.study - INFO - Trial 81 finished with values: [0.0126719720554467, 0.002696728558797524, 0.007025512830236652] and parameters: {'n_layers': 4, 'embedding_dim': 128, 'lr': 0.0009110225934635639, 'lambda_val': 0.0017861244112865895, 'batch_size': 1262, 'optimizer': 'RMSprop'}.
2026-06-19 00:47:24,795 - experiment_functions - INFO - Early stopping at epoch 500. Best Metrics: (0.0004909694267669732, 9.631173424276874e-05, 0.0002684754733557)
2026-06-19 00:47:24,920 - optuna.study.study - INFO - Trial 82 finished with values: [0.0004909694267669732, 9.631173424276874e-05, 0.0002684754733557] and parameters: {'n_layers': 1, 'embedding_dim': 32, 'lr': 6.905259164224799e-05, 'lambda_val': 0.05682316696015936, 'batch_size': 3267, 'optimizer': 'Adam'}.
2026-06-19 00:50:27,746 - optuna.study.study - INFO - Trial 83 finished with values: [0.011597667543155632, 0.0025293671845395987, 0.006512948521059086] and parameters: {'n_layers': 2, 'embedding_dim': 128, 'lr': 0.03235246262650783, 'lambda_val': 0.000426873699562592, 'batch_size': 3565, 'optimizer': 'RMSprop'}.
2026-06-19 00:52:54,362 - experiment_functions - INFO - Early stopping at epoch 3150. Best Metrics: (0.026402468108418998, 0.005620815965643552, 0.015110337675291735)
2026-06-19 00:52:54,459 - optuna.study.study - INFO - Trial 84 finished with values: [0.026402468108418998, 0.005620815965643552, 0.015110337675291735] and parameters: {'n_layers': 4, 'embedding_dim': 64, 'lr': 0.00038600927804144803, 'lambda_val': 0.0001180174950905876, 'batch_size': 1184, 'optimizer': 'RMSprop'}.
2026-06-19 00:56:11,948 - experiment_functions - INFO - Early stopping at epoch 3850. Best Metrics: (0.01462757321811885, 0.0032635467980295573, 0.008088614279584573)
2026-06-19 00:56:12,028 - optuna.study.study - INFO - Trial 85 finished with values: [0.01462757321811885, 0.0032635467980295573, 0.008088614279584573] and parameters: {'n_layers': 4, 'embedding_dim': 128, 'lr': 0.0001662467794171188, 'lambda_val': 0.02145855541741889, 'batch_size': 4089, 'optimizer': 'RMSprop'}.
2026-06-19 00:57:49,664 - experiment_functions - INFO - Early stopping at epoch 2000. Best Metrics: (0.02913952922821373, 0.0060186939497284325, 0.01680752779191321)
2026-06-19 00:57:49,753 - optuna.study.study - INFO - Trial 86 finished with values: [0.02913952922821373, 0.0060186939497284325, 0.01680752779191321] and parameters: {'n_layers': 2, 'embedding_dim': 128, 'lr': 0.0008568781075155826, 'lambda_val': 0.00011238429460135182, 'batch_size': 1729, 'optimizer': 'Adam'}.
2026-06-19 00:58:45,853 - experiment_functions - INFO - Early stopping at epoch 1000. Best Metrics: (0.0217144916743924, 0.004777693570797019, 0.012248840703531149)
2026-06-19 00:58:45,960 - optuna.study.study - INFO - Trial 87 finished with values: [0.0217144916743924, 0.004777693570797019, 0.012248840703531149] and parameters: {'n_layers': 2, 'embedding_dim': 256, 'lr': 0.0007989615375802813, 'lambda_val': 0.006446182958325827, 'batch_size': 2155, 'optimizer': 'Adam'}.
2026-06-19 00:59:09,321 - experiment_functions - INFO - Early stopping at epoch 500. Best Metrics: (0.00038448540212337654, 9.157509157509159e-05, 0.00025238194794070226)
2026-06-19 00:59:09,412 - optuna.study.study - INFO - Trial 88 finished with values: [0.00038448540212337654, 9.157509157509159e-05, 0.00025238194794070226] and parameters: {'n_layers': 2, 'embedding_dim': 32, 'lr': 8.75863633559598e-05, 'lambda_val': 0.025666079393145726, 'batch_size': 3998, 'optimizer': 'Adam'}.
2026-06-19 00:59:34,896 - experiment_functions - INFO - Early stopping at epoch 550. Best Metrics: (0.004113597786049479, 0.001053113553113553, 0.0026474738940578525)
2026-06-19 00:59:35,013 - optuna.study.study - INFO - Trial 89 finished with values: [0.004113597786049479, 0.001053113553113553, 0.0026474738940578525] and parameters: {'n_layers': 1, 'embedding_dim': 64, 'lr': 0.04730092851845055, 'lambda_val': 4.9243503314799367e-05, 'batch_size': 2145, 'optimizer': 'RMSprop'}.
2026-06-19 00:59:58,783 - experiment_functions - INFO - Early stopping at epoch 500. Best Metrics: (0.00042830555304441617, 0.00010420613868889733, 0.00022988497665769644)
2026-06-19 00:59:58,898 - optuna.study.study - INFO - Trial 90 finished with values: [0.00042830555304441617, 0.00010420613868889733, 0.00022988497665769644] and parameters: {'n_layers': 1, 'embedding_dim': 96, 'lr': 8.75863633559598e-05, 'lambda_val': 0.05682316696015936, 'batch_size': 3511, 'optimizer': 'Adam'}.
2026-06-19 01:00:22,290 - experiment_functions - INFO - Early stopping at epoch 500. Best Metrics: (0.0005049790057924027, 0.00012788935202728306, 0.0002933695531877561)
2026-06-19 01:00:22,390 - optuna.study.study - INFO - Trial 91 finished with values: [0.0005049790057924027, 0.00012788935202728306, 0.0002933695531877561] and parameters: {'n_layers': 3, 'embedding_dim': 32, 'lr': 0.003331201275908329, 'lambda_val': 0.002664675690305641, 'batch_size': 3383, 'optimizer': 'SGD'}.
2026-06-19 01:01:39,182 - experiment_functions - INFO - Early stopping at epoch 1800. Best Metrics: (0.007086888209583037, 0.0015204622963243652, 0.003899644413307785)
2026-06-19 01:01:39,278 - optuna.study.study - INFO - Trial 92 finished with values: [0.007086888209583037, 0.0015204622963243652, 0.003899644413307785] and parameters: {'n_layers': 2, 'embedding_dim': 32, 'lr': 0.0311226174645876, 'lambda_val': 0.002664675690305641, 'batch_size': 3161, 'optimizer': 'RMSprop'}.
2026-06-19 01:02:25,206 - experiment_functions - INFO - Early stopping at epoch 950. Best Metrics: (0.025908037625498113, 0.005593974990526714, 0.014787323034673961)
2026-06-19 01:02:25,573 - optuna.study.study - INFO - Trial 93 finished with values: [0.025908037625498113, 0.005593974990526714, 0.014787323034673961] and parameters: {'n_layers': 2, 'embedding_dim': 128, 'lr': 0.000870520171613823, 'lambda_val': 5.816309683274336e-06, 'batch_size': 2501, 'optimizer': 'RMSprop'}.
2026-06-19 01:02:53,614 - experiment_functions - INFO - Early stopping at epoch 550. Best Metrics: (0.004833327248838384, 0.0011888973095869647, 0.0029845642757004875)
2026-06-19 01:02:53,706 - optuna.study.study - INFO - Trial 94 finished with values: [0.004833327248838384, 0.0011888973095869647, 0.0029845642757004875] and parameters: {'n_layers': 1, 'embedding_dim': 256, 'lr': 0.04662138468157106, 'lambda_val': 0.05682316696015936, 'batch_size': 571, 'optimizer': 'Adam'}.
2026-06-19 01:03:58,493 - experiment_functions - INFO - Early stopping at epoch 1400. Best Metrics: (0.003106356752361487, 0.0007073386383731211, 0.0017437628734219943)
2026-06-19 01:03:58,598 - optuna.study.study - INFO - Trial 95 finished with values: [0.003106356752361487, 0.0007073386383731211, 0.0017437628734219943] and parameters: {'n_layers': 2, 'embedding_dim': 128, 'lr': 0.03235246262650783, 'lambda_val': 0.03975450381102954, 'batch_size': 3252, 'optimizer': 'Adam'}.
2026-06-19 01:04:24,485 - experiment_functions - INFO - Early stopping at epoch 550. Best Metrics: (0.008835100952413475, 0.002134646962233169, 0.0050645389673260755)
2026-06-19 01:04:24,580 - optuna.study.study - INFO - Trial 96 finished with values: [0.008835100952413475, 0.002134646962233169, 0.0050645389673260755] and parameters: {'n_layers': 1, 'embedding_dim': 128, 'lr': 0.043196906423782155, 'lambda_val': 7.52425465718907e-06, 'batch_size': 955, 'optimizer': 'Adam'}.
2026-06-19 01:04:47,095 - experiment_functions - INFO - Early stopping at epoch 500. Best Metrics: (0.003595382635248529, 0.0006820765441455097, 0.0020255009107109194)
2026-06-19 01:04:47,196 - optuna.study.study - INFO - Trial 97 finished with values: [0.003595382635248529, 0.0006820765441455097, 0.0020255009107109194] and parameters: {'n_layers': 2, 'embedding_dim': 32, 'lr': 0.08185503650956366, 'lambda_val': 0.01293128846809428, 'batch_size': 571, 'optimizer': 'RMSprop'}.
2026-06-19 01:05:13,961 - experiment_functions - INFO - Early stopping at epoch 500. Best Metrics: (0.0006173899037407396, 0.0001231527093596059, 0.00031636568543020065)
2026-06-19 01:05:14,048 - optuna.study.study - INFO - Trial 98 finished with values: [0.0006173899037407396, 0.0001231527093596059, 0.00031636568543020065] and parameters: {'n_layers': 3, 'embedding_dim': 128, 'lr': 1.180764623015535e-05, 'lambda_val': 8.004253683939247e-06, 'batch_size': 3284, 'optimizer': 'Adam'}.
2026-06-19 01:07:25,178 - experiment_functions - INFO - Early stopping at epoch 3100. Best Metrics: (0.03311160424522722, 0.006906025009473285, 0.019087293226880627)
2026-06-19 01:07:25,268 - optuna.study.study - INFO - Trial 99 finished with values: [0.03311160424522722, 0.006906025009473285, 0.019087293226880627] and parameters: {'n_layers': 1, 'embedding_dim': 64, 'lr': 0.0017724783344138918, 'lambda_val': 1.356629670066784e-05, 'batch_size': 571, 'optimizer': 'Adam'}.
2026-06-19 01:08:22,834 - experiment_functions - INFO - Early stopping at epoch 1100. Best Metrics: (0.013719214128468219, 0.002913035240621448, 0.007492911701905214)
2026-06-19 01:08:22,915 - optuna.study.study - INFO - Trial 100 finished with values: [0.013719214128468219, 0.002913035240621448, 0.007492911701905214] and parameters: {'n_layers': 4, 'embedding_dim': 128, 'lr': 0.0012134658370028314, 'lambda_val': 0.0001180174950905876, 'batch_size': 1184, 'optimizer': 'RMSprop'}.
2026-06-19 01:08:51,712 - experiment_functions - INFO - Early stopping at epoch 550. Best Metrics: (0.0099127898780416, 0.0022546419098143236, 0.005655801797922785)
2026-06-19 01:08:51,818 - optuna.study.study - INFO - Trial 101 finished with values: [0.0099127898780416, 0.0022546419098143236, 0.005655801797922785] and parameters: {'n_layers': 3, 'embedding_dim': 128, 'lr': 0.0026777259297623827, 'lambda_val': 0.0020983857112305436, 'batch_size': 2155, 'optimizer': 'RMSprop'}.
2026-06-19 01:12:06,501 - optuna.study.study - INFO - Trial 102 finished with values: [0.02953379971697227, 0.0061513199444233925, 0.016982121571276303] and parameters: {'n_layers': 1, 'embedding_dim': 256, 'lr': 0.0018715145286522033, 'lambda_val': 5.494005823267809e-06, 'batch_size': 571, 'optimizer': 'Adam'}.
2026-06-19 01:13:32,864 - experiment_functions - INFO - Early stopping at epoch 1850. Best Metrics: (0.011375192694784689, 0.0026683087027914616, 0.006343257564979384)
2026-06-19 01:13:32,959 - optuna.study.study - INFO - Trial 103 finished with values: [0.011375192694784689, 0.0026683087027914616, 0.006343257564979384] and parameters: {'n_layers': 2, 'embedding_dim': 128, 'lr': 0.000870520171613823, 'lambda_val': 0.05660555896065568, 'batch_size': 739, 'optimizer': 'Adam'}.
2026-06-19 01:15:02,981 - experiment_functions - INFO - Early stopping at epoch 2050. Best Metrics: (0.0309003080929266, 0.0064955159782746005, 0.017541285453237878)
2026-06-19 01:15:03,078 - optuna.study.study - INFO - Trial 104 finished with values: [0.0309003080929266, 0.0064955159782746005, 0.017541285453237878] and parameters: {'n_layers': 2, 'embedding_dim': 64, 'lr': 0.000870520171613823, 'lambda_val': 1.7013643059238403e-06, 'batch_size': 1184, 'optimizer': 'Adam'}.
2026-06-19 01:15:25,496 - experiment_functions - INFO - Early stopping at epoch 500. Best Metrics: (0.0006035752303930027, 0.00011841606669192877, 0.0003297022236857999)
2026-06-19 01:15:25,590 - optuna.study.study - INFO - Trial 105 finished with values: [0.0006035752303930027, 0.00011841606669192877, 0.0003297022236857999] and parameters: {'n_layers': 1, 'embedding_dim': 64, 'lr': 0.010267104601915706, 'lambda_val': 0.00010166126397387926, 'batch_size': 2147, 'optimizer': 'SGD'}.
2026-06-19 01:18:25,755 - optuna.study.study - INFO - Trial 106 finished with values: [0.030728384763336964, 0.006522356953391436, 0.017527967444843813] and parameters: {'n_layers': 1, 'embedding_dim': 128, 'lr': 0.0008568781075155826, 'lambda_val': 0.003077942483029095, 'batch_size': 2155, 'optimizer': 'Adam'}.
2026-06-19 01:19:19,382 - experiment_functions - INFO - Early stopping at epoch 1100. Best Metrics: (0.027157836351357253, 0.005743968675003159, 0.015502934631702959)
2026-06-19 01:19:19,474 - optuna.study.study - INFO - Trial 107 finished with values: [0.027157836351357253, 0.005743968675003159, 0.015502934631702959] and parameters: {'n_layers': 2, 'embedding_dim': 128, 'lr': 0.0009110225934635639, 'lambda_val': 0.000485389202309046, 'batch_size': 1169, 'optimizer': 'RMSprop'}.
2026-06-19 01:20:05,391 - experiment_functions - INFO - Early stopping at epoch 1000. Best Metrics: (0.005921727078426292, 0.0014130983958570164, 0.0031434165006685127)
2026-06-19 01:20:05,476 - optuna.study.study - INFO - Trial 108 finished with values: [0.005921727078426292, 0.0014130983958570164, 0.0031434165006685127] and parameters: {'n_layers': 3, 'embedding_dim': 64, 'lr': 0.0012134658370028314, 'lambda_val': 0.0707000368444346, 'batch_size': 1184, 'optimizer': 'Adam'}.
2026-06-19 01:20:31,736 - experiment_functions - INFO - Early stopping at epoch 550. Best Metrics: (0.009244572779432692, 0.0020304408235442715, 0.004860083280238681)
2026-06-19 01:20:31,847 - optuna.study.study - INFO - Trial 109 finished with values: [0.009244572779432692, 0.0020304408235442715, 0.004860083280238681] and parameters: {'n_layers': 2, 'embedding_dim': 64, 'lr': 0.019469248609387056, 'lambda_val': 0.000426873699562592, 'batch_size': 3565, 'optimizer': 'Adam'}.
2026-06-19 01:21:03,967 - experiment_functions - INFO - Early stopping at epoch 700. Best Metrics: (0.012726377734269344, 0.0027330428192497156, 0.007257150127464428)
2026-06-19 01:21:04,064 - optuna.study.study - INFO - Trial 110 finished with values: [0.012726377734269344, 0.0027330428192497156, 0.007257150127464428] and parameters: {'n_layers': 1, 'embedding_dim': 64, 'lr': 0.010267104601915706, 'lambda_val': 0.00010166126397387926, 'batch_size': 1529, 'optimizer': 'RMSprop'}.
2026-06-19 01:22:23,556 - experiment_functions - INFO - Early stopping at epoch 1200. Best Metrics: (0.014484479462124859, 0.0030882910193255025, 0.008119068453410537)
2026-06-19 01:22:23,645 - optuna.study.study - INFO - Trial 111 finished with values: [0.014484479462124859, 0.0030882910193255025, 0.008119068453410537] and parameters: {'n_layers': 4, 'embedding_dim': 256, 'lr': 0.0008568781075155826, 'lambda_val': 4.824681967841972e-06, 'batch_size': 1127, 'optimizer': 'RMSprop'}.
2026-06-19 01:23:02,763 - experiment_functions - INFO - Early stopping at epoch 850. Best Metrics: (0.013316820940920801, 0.0029161930023998994, 0.007402000030366944)
2026-06-19 01:23:02,852 - optuna.study.study - INFO - Trial 112 finished with values: [0.013316820940920801, 0.0029161930023998994, 0.007402000030366944] and parameters: {'n_layers': 1, 'embedding_dim': 64, 'lr': 0.010267104601915706, 'lambda_val': 1.7013643059238403e-06, 'batch_size': 1529, 'optimizer': 'RMSprop'}.
2026-06-19 01:23:34,910 - experiment_functions - INFO - Early stopping at epoch 650. Best Metrics: (0.011709841703367961, 0.0025893646583301758, 0.0065423721181744185)
2026-06-19 01:23:34,999 - optuna.study.study - INFO - Trial 113 finished with values: [0.011709841703367961, 0.0025893646583301758, 0.0065423721181744185] and parameters: {'n_layers': 1, 'embedding_dim': 128, 'lr': 0.010267104601915706, 'lambda_val': 0.00010166126397387926, 'batch_size': 619, 'optimizer': 'Adam'}.
2026-06-19 01:27:02,774 - optuna.study.study - INFO - Trial 114 finished with values: [0.010031717206869904, 0.0021662245800176836, 0.005514169862156354] and parameters: {'n_layers': 4, 'embedding_dim': 128, 'lr': 0.03235246262650783, 'lambda_val': 0.000426873699562592, 'batch_size': 3565, 'optimizer': 'RMSprop'}.
2026-06-19 01:27:27,351 - experiment_functions - INFO - Early stopping at epoch 550. Best Metrics: (0.005426608805333971, 0.0013578375647341167, 0.0031036564497420533)
2026-06-19 01:27:27,508 - optuna.study.study - INFO - Trial 115 finished with values: [0.005426608805333971, 0.0013578375647341167, 0.0031036564497420533] and parameters: {'n_layers': 1, 'embedding_dim': 32, 'lr': 0.03737766331140489, 'lambda_val': 0.010417737349335262, 'batch_size': 844, 'optimizer': 'Adam'}.
2026-06-19 01:28:11,147 - experiment_functions - INFO - Early stopping at epoch 800. Best Metrics: (0.0218121145551236, 0.004649804218769736, 0.012012674759720558)
2026-06-19 01:28:11,238 - optuna.study.study - INFO - Trial 116 finished with values: [0.0218121145551236, 0.004649804218769736, 0.012012674759720558] and parameters: {'n_layers': 4, 'embedding_dim': 128, 'lr': 0.0008568781075155826, 'lambda_val': 8.004253683939247e-06, 'batch_size': 3284, 'optimizer': 'Adam'}.
2026-06-19 01:28:39,216 - experiment_functions - INFO - Early stopping at epoch 600. Best Metrics: (0.01602842951974626, 0.00347985347985348, 0.009236059634360994)
2026-06-19 01:28:39,310 - optuna.study.study - INFO - Trial 117 finished with values: [0.01602842951974626, 0.00347985347985348, 0.009236059634360994] and parameters: {'n_layers': 4, 'embedding_dim': 32, 'lr': 0.003331201275908329, 'lambda_val': 0.0008294227855036249, 'batch_size': 3383, 'optimizer': 'Adam'}.
2026-06-19 01:29:09,527 - experiment_functions - INFO - Early stopping at epoch 500. Best Metrics: (0.0006689616627707838, 0.00012315270935960593, 0.0003258801592924555)
2026-06-19 01:29:09,633 - optuna.study.study - INFO - Trial 118 finished with values: [0.0006689616627707838, 0.00012315270935960593, 0.0003258801592924555] and parameters: {'n_layers': 3, 'embedding_dim': 256, 'lr': 0.0008568781075155826, 'lambda_val': 0.016541462778595126, 'batch_size': 3284, 'optimizer': 'SGD'}.
2026-06-19 01:29:39,020 - experiment_functions - INFO - Early stopping at epoch 550. Best Metrics: (0.010014929586969559, 0.002202538840469875, 0.005545371420458908)
2026-06-19 01:29:39,105 - optuna.study.study - INFO - Trial 119 finished with values: [0.010014929586969559, 0.002202538840469875, 0.005545371420458908] and parameters: {'n_layers': 3, 'embedding_dim': 96, 'lr': 0.00265047718248758, 'lambda_val': 4.1240642741322505e-05, 'batch_size': 3284, 'optimizer': 'RMSprop'}.
2026-06-19 01:30:12,948 - experiment_functions - INFO - Early stopping at epoch 700. Best Metrics: (0.014183397218102658, 0.0033819628647214855, 0.007787842449077741)
2026-06-19 01:30:13,038 - optuna.study.study - INFO - Trial 120 finished with values: [0.014183397218102658, 0.0033819628647214855, 0.007787842449077741] and parameters: {'n_layers': 2, 'embedding_dim': 128, 'lr': 0.001605678255663719, 'lambda_val': 0.03975450381102954, 'batch_size': 3252, 'optimizer': 'Adam'}.
2026-06-19 01:30:40,059 - experiment_functions - INFO - Early stopping at epoch 600. Best Metrics: (0.01369009044680604, 0.0029809271188581533, 0.007880678327507771)
2026-06-19 01:30:40,161 - optuna.study.study - INFO - Trial 121 finished with values: [0.01369009044680604, 0.0029809271188581533, 0.007880678327507771] and parameters: {'n_layers': 2, 'embedding_dim': 32, 'lr': 0.007305552959572936, 'lambda_val': 4.824681967841972e-06, 'batch_size': 844, 'optimizer': 'RMSprop'}.
2026-06-19 01:31:07,353 - experiment_functions - INFO - Early stopping at epoch 500. Best Metrics: (0.004502072569506093, 0.0009662751042061388, 0.002535286557102404)
2026-06-19 01:31:07,454 - optuna.study.study - INFO - Trial 122 finished with values: [0.004502072569506093, 0.0009662751042061388, 0.002535286557102404] and parameters: {'n_layers': 4, 'embedding_dim': 128, 'lr': 0.0311226174645876, 'lambda_val': 0.00790150266889716, 'batch_size': 1262, 'optimizer': 'RMSprop'}.
2026-06-19 01:31:33,106 - experiment_functions - INFO - Early stopping at epoch 550. Best Metrics: (0.007931402430916622, 0.0017715043577112546, 0.00444540114590957)
2026-06-19 01:31:33,199 - optuna.study.study - INFO - Trial 123 finished with values: [0.007931402430916622, 0.0017715043577112546, 0.00444540114590957] and parameters: {'n_layers': 1, 'embedding_dim': 128, 'lr': 0.010267104601915706, 'lambda_val': 0.007601366774694403, 'batch_size': 1529, 'optimizer': 'RMSprop'}.
2026-06-19 01:34:31,442 - optuna.study.study - INFO - Trial 124 finished with values: [0.03333137652175347, 0.007007073386383731, 0.019097343509769327] and parameters: {'n_layers': 1, 'embedding_dim': 128, 'lr': 0.000870520171613823, 'lambda_val': 7.52425465718907e-06, 'batch_size': 2155, 'optimizer': 'Adam'}.
2026-06-19 01:34:56,064 - experiment_functions - INFO - Early stopping at epoch 550. Best Metrics: (0.015511800186632684, 0.0035177466211948967, 0.009183664388264233)
2026-06-19 01:34:56,154 - optuna.study.study - INFO - Trial 125 finished with values: [0.015511800186632684, 0.0035177466211948967, 0.009183664388264233] and parameters: {'n_layers': 1, 'embedding_dim': 32, 'lr': 0.022537997280540817, 'lambda_val': 0.003077942483029095, 'batch_size': 2145, 'optimizer': 'Adam'}.
