2026-06-20 20:32:23,605 - optuna.study.study - INFO - Trial 200 finished with values: [0.003146026467505683, 0.0012899456864974104, 0.0022724863974543023] and parameters: {'n_layers': 1, 'embedding_dim': 128, 'lr': 0.08768462687583077, 'lambda_val': 3.6417495206733656e-06, 'batch_size': 2734, 'optimizer': 'Adam'}.
2026-06-20 20:32:48,163 - experiment_functions - INFO - Early stopping at epoch 550. Best Metrics: (0.003194138050752182, 0.001370468611847922, 0.0023167950213397333)
2026-06-20 20:32:48,420 - optuna.study.study - INFO - Trial 201 finished with values: [0.003194138050752182, 0.001370468611847922, 0.0023167950213397333] and parameters: {'n_layers': 1, 'embedding_dim': 128, 'lr': 0.044505357903961575, 'lambda_val': 4.080619734488508e-05, 'batch_size': 891, 'optimizer': 'Adam'}.
2026-06-20 20:33:12,211 - experiment_functions - INFO - Early stopping at epoch 550. Best Metrics: (0.0035690885770534686, 0.001473095869647594, 0.0024213549177902615)
2026-06-20 20:33:12,308 - optuna.study.study - INFO - Trial 202 finished with values: [0.0035690885770534686, 0.001473095869647594, 0.0024213549177902615] and parameters: {'n_layers': 1, 'embedding_dim': 32, 'lr': 0.004653703533380661, 'lambda_val': 1.548420801174704e-06, 'batch_size': 3400, 'optimizer': 'RMSprop'}.
2026-06-20 20:35:52,892 - optuna.study.study - INFO - Trial 203 finished with values: [0.0026252664939636437, 0.0013357332322849564, 0.0021834985640600923] and parameters: {'n_layers': 1, 'embedding_dim': 96, 'lr': 0.00012997201046442607, 'lambda_val': 3.6417495206733656e-06, 'batch_size': 2527, 'optimizer': 'Adam'}.
2026-06-20 20:36:34,565 - experiment_functions - INFO - Early stopping at epoch 1000. Best Metrics: (0.004170206264062485, 0.0019530756599722117, 0.0031705031906677466)
2026-06-20 20:36:34,730 - optuna.study.study - INFO - Trial 204 finished with values: [0.004170206264062485, 0.0019530756599722117, 0.0031705031906677466] and parameters: {'n_layers': 1, 'embedding_dim': 32, 'lr': 0.0011836797126663788, 'lambda_val': 6.254367883207469e-05, 'batch_size': 809, 'optimizer': 'Adam'}.
2026-06-20 20:37:19,898 - experiment_functions - INFO - Early stopping at epoch 1050. Best Metrics: (0.00386697233183228, 0.0017525577870405459, 0.002861390851934934)
2026-06-20 20:37:19,985 - optuna.study.study - INFO - Trial 205 finished with values: [0.00386697233183228, 0.0017525577870405459, 0.002861390851934934] and parameters: {'n_layers': 1, 'embedding_dim': 128, 'lr': 0.0011914719293063967, 'lambda_val': 1.548420801174704e-06, 'batch_size': 891, 'optimizer': 'RMSprop'}.
2026-06-20 20:37:51,338 - experiment_functions - INFO - Early stopping at epoch 750. Best Metrics: (0.004190366628303302, 0.001867816091954023, 0.003103812644150547)
2026-06-20 20:37:51,442 - optuna.study.study - INFO - Trial 206 finished with values: [0.004190366628303302, 0.001867816091954023, 0.003103812644150547] and parameters: {'n_layers': 1, 'embedding_dim': 32, 'lr': 0.001947201008389374, 'lambda_val': 0.00091460267317109, 'batch_size': 1931, 'optimizer': 'Adam'}.
2026-06-20 20:38:15,300 - experiment_functions - INFO - Early stopping at epoch 550. Best Metrics: (0.002617809090963104, 0.001094164456233422, 0.0018223827949499722)
2026-06-20 20:38:15,713 - optuna.study.study - INFO - Trial 207 finished with values: [0.002617809090963104, 0.001094164456233422, 0.0018223827949499722] and parameters: {'n_layers': 4, 'embedding_dim': 32, 'lr': 0.08768462687583077, 'lambda_val': 3.1799280936110466e-06, 'batch_size': 2884, 'optimizer': 'Adam'}.
2026-06-20 20:38:46,771 - experiment_functions - INFO - Early stopping at epoch 650. Best Metrics: (0.0037647581912829972, 0.0019151825186307944, 0.0029604643290001625)
2026-06-20 20:38:47,533 - optuna.study.study - INFO - Trial 208 finished with values: [0.0037647581912829972, 0.0019151825186307944, 0.0029604643290001625] and parameters: {'n_layers': 1, 'embedding_dim': 256, 'lr': 0.001947201008389374, 'lambda_val': 1.548420801174704e-06, 'batch_size': 3589, 'optimizer': 'Adam'}.
2026-06-20 20:39:17,086 - experiment_functions - INFO - Early stopping at epoch 550. Best Metrics: (0.0028525463130753296, 0.0014130983958570164, 0.002232778891665311)
2026-06-20 20:39:17,218 - optuna.study.study - INFO - Trial 209 finished with values: [0.0028525463130753296, 0.0014130983958570164, 0.002232778891665311] and parameters: {'n_layers': 3, 'embedding_dim': 256, 'lr': 0.0026465856831401676, 'lambda_val': 0.0007078744392388816, 'batch_size': 1155, 'optimizer': 'Adam'}.
2026-06-20 20:41:57,086 - optuna.study.study - INFO - Trial 210 finished with values: [0.0034408508073825706, 0.0016436150056839713, 0.0026623171966786603] and parameters: {'n_layers': 2, 'embedding_dim': 64, 'lr': 0.00017647026102474964, 'lambda_val': 4.080619734488508e-05, 'batch_size': 809, 'optimizer': 'Adam'}.
2026-06-20 20:42:28,892 - experiment_functions - INFO - Early stopping at epoch 750. Best Metrics: (0.0040295462952059345, 0.0019230769230769232, 0.0030309806345901963)
2026-06-20 20:42:28,967 - optuna.study.study - INFO - Trial 211 finished with values: [0.0040295462952059345, 0.0019230769230769232, 0.0030309806345901963] and parameters: {'n_layers': 1, 'embedding_dim': 64, 'lr': 0.0011836797126663788, 'lambda_val': 0.0021519517203617954, 'batch_size': 1257, 'optimizer': 'Adam'}.
2026-06-20 20:42:54,527 - experiment_functions - INFO - Early stopping at epoch 550. Best Metrics: (0.002794552586786414, 0.001070481242895036, 0.0019343629355997808)
2026-06-20 20:42:54,620 - optuna.study.study - INFO - Trial 212 finished with values: [0.002794552586786414, 0.001070481242895036, 0.0019343629355997808] and parameters: {'n_layers': 3, 'embedding_dim': 128, 'lr': 0.003817870632102948, 'lambda_val': 1.0693559021612933e-06, 'batch_size': 4082, 'optimizer': 'RMSprop'}.
2026-06-20 20:43:35,486 - experiment_functions - INFO - Early stopping at epoch 950. Best Metrics: (0.004087600022972124, 0.001858342806618669, 0.003030128809142298)
2026-06-20 20:43:35,888 - optuna.study.study - INFO - Trial 213 finished with values: [0.004087600022972124, 0.001858342806618669, 0.003030128809142298] and parameters: {'n_layers': 1, 'embedding_dim': 128, 'lr': 0.0005943725589836874, 'lambda_val': 3.1552145254862633e-06, 'batch_size': 2734, 'optimizer': 'RMSprop'}.
2026-06-20 20:44:42,798 - experiment_functions - INFO - Early stopping at epoch 1700. Best Metrics: (0.0005269812366756015, 0.00012473159024883163, 0.0002875209009480973)
2026-06-20 20:44:42,883 - optuna.study.study - INFO - Trial 214 finished with values: [0.0005269812366756015, 0.00012473159024883163, 0.0002875209009480973] and parameters: {'n_layers': 1, 'embedding_dim': 32, 'lr': 1.3352163095984425e-05, 'lambda_val': 1.0831894846791642e-05, 'batch_size': 1155, 'optimizer': 'Adam'}.
2026-06-20 20:45:09,598 - experiment_functions - INFO - Early stopping at epoch 600. Best Metrics: (0.002905760698243797, 0.0012804724011620564, 0.0021129889181784544)
2026-06-20 20:45:09,683 - optuna.study.study - INFO - Trial 215 finished with values: [0.002905760698243797, 0.0012804724011620564, 0.0021129889181784544] and parameters: {'n_layers': 3, 'embedding_dim': 64, 'lr': 0.0026465856831401676, 'lambda_val': 1.0693559021612933e-06, 'batch_size': 1155, 'optimizer': 'Adam'}.
2026-06-20 20:45:33,552 - experiment_functions - INFO - Early stopping at epoch 550. Best Metrics: (0.003104173090495955, 0.0013783630162940508, 0.002158917683049878)
2026-06-20 20:45:33,645 - optuna.study.study - INFO - Trial 216 finished with values: [0.003104173090495955, 0.0013783630162940508, 0.002158917683049878] and parameters: {'n_layers': 4, 'embedding_dim': 32, 'lr': 0.0024608317114397722, 'lambda_val': 0.0007282417800184716, 'batch_size': 655, 'optimizer': 'RMSprop'}.
2026-06-20 20:45:57,976 - experiment_functions - INFO - Early stopping at epoch 550. Best Metrics: (0.003270320526637515, 0.0014730958696475937, 0.0024460849126342033)
2026-06-20 20:45:58,081 - optuna.study.study - INFO - Trial 217 finished with values: [0.003270320526637515, 0.0014730958696475937, 0.0024460849126342033] and parameters: {'n_layers': 2, 'embedding_dim': 64, 'lr': 0.0011836797126663788, 'lambda_val': 0.0007336457993064653, 'batch_size': 1378, 'optimizer': 'RMSprop'}.
2026-06-20 20:46:29,602 - experiment_functions - INFO - Early stopping at epoch 750. Best Metrics: (0.004355539988850893, 0.0019183402804092459, 0.0032857570770769397)
2026-06-20 20:46:29,809 - optuna.study.study - INFO - Trial 218 finished with values: [0.004355539988850893, 0.0019183402804092459, 0.0032857570770769397] and parameters: {'n_layers': 1, 'embedding_dim': 32, 'lr': 0.001947201008389374, 'lambda_val': 0.00091460267317109, 'batch_size': 747, 'optimizer': 'Adam'}.
2026-06-20 20:47:02,094 - experiment_functions - INFO - Early stopping at epoch 700. Best Metrics: (0.002939451952254556, 0.001387836301629405, 0.002195989490818321)
2026-06-20 20:47:02,213 - optuna.study.study - INFO - Trial 219 finished with values: [0.002939451952254556, 0.001387836301629405, 0.002195989490818321] and parameters: {'n_layers': 3, 'embedding_dim': 128, 'lr': 0.0008691811996078602, 'lambda_val': 6.733205641736132e-06, 'batch_size': 1670, 'optimizer': 'Adam'}.
2026-06-20 20:47:35,096 - experiment_functions - INFO - Early stopping at epoch 700. Best Metrics: (0.0037653129689691873, 0.0019546545408614373, 0.0030081190628099773)
2026-06-20 20:47:35,189 - optuna.study.study - INFO - Trial 220 finished with values: [0.0037653129689691873, 0.0019546545408614373, 0.0030081190628099773] and parameters: {'n_layers': 1, 'embedding_dim': 256, 'lr': 0.001947201008389374, 'lambda_val': 4.922680840294995e-05, 'batch_size': 747, 'optimizer': 'Adam'}.
2026-06-20 20:47:56,762 - experiment_functions - INFO - Early stopping at epoch 500. Best Metrics: (0.000526127725076689, 0.00011367942402425163, 0.0003383438705399695)
2026-06-20 20:47:56,857 - optuna.study.study - INFO - Trial 221 finished with values: [0.000526127725076689, 0.00011367942402425163, 0.0003383438705399695] and parameters: {'n_layers': 3, 'embedding_dim': 32, 'lr': 0.0005943725589836874, 'lambda_val': 1.0693559021612933e-06, 'batch_size': 1155, 'optimizer': 'SGD'}.
2026-06-20 20:48:31,726 - experiment_functions - INFO - Early stopping at epoch 800. Best Metrics: (0.0037278150609993477, 0.0018046608563849942, 0.002969524836999202)
2026-06-20 20:48:31,813 - optuna.study.study - INFO - Trial 222 finished with values: [0.0037278150609993477, 0.0018046608563849942, 0.002969524836999202] and parameters: {'n_layers': 1, 'embedding_dim': 128, 'lr': 0.0007769635361512541, 'lambda_val': 0.002755373279313737, 'batch_size': 2734, 'optimizer': 'Adam'}.
2026-06-20 20:51:09,853 - optuna.study.study - INFO - Trial 223 finished with values: [0.003701404254600103, 0.0017241379310344825, 0.002786330905614526] and parameters: {'n_layers': 1, 'embedding_dim': 64, 'lr': 0.00017647026102474964, 'lambda_val': 3.1552145254862633e-06, 'batch_size': 3657, 'optimizer': 'RMSprop'}.
2026-06-20 20:51:34,647 - experiment_functions - INFO - Early stopping at epoch 550. Best Metrics: (0.0032081941156256056, 0.0014588859416445625, 0.0024255818759795432)
2026-06-20 20:51:34,743 - optuna.study.study - INFO - Trial 224 finished with values: [0.0032081941156256056, 0.0014588859416445625, 0.0024255818759795432] and parameters: {'n_layers': 2, 'embedding_dim': 96, 'lr': 0.0011836797126663788, 'lambda_val': 1.6056960373751058e-05, 'batch_size': 1458, 'optimizer': 'RMSprop'}.
2026-06-20 20:51:59,534 - experiment_functions - INFO - Early stopping at epoch 550. Best Metrics: (0.0018502338654029747, 0.0008368068712896299, 0.0013686345939181567)
2026-06-20 20:51:59,632 - optuna.study.study - INFO - Trial 225 finished with values: [0.0018502338654029747, 0.0008368068712896299, 0.0013686345939181567] and parameters: {'n_layers': 1, 'embedding_dim': 128, 'lr': 0.03178174845269066, 'lambda_val': 0.004379523707555612, 'batch_size': 2884, 'optimizer': 'Adam'}.
2026-06-20 20:52:38,570 - experiment_functions - INFO - Early stopping at epoch 950. Best Metrics: (0.00314209921700625, 0.0012852090438297335, 0.0021837820476661523)
2026-06-20 20:52:38,927 - optuna.study.study - INFO - Trial 226 finished with values: [0.00314209921700625, 0.0012852090438297335, 0.0021837820476661523] and parameters: {'n_layers': 1, 'embedding_dim': 32, 'lr': 0.03178174845269066, 'lambda_val': 1.3134597991064091e-06, 'batch_size': 2734, 'optimizer': 'RMSprop'}.
2026-06-20 20:53:15,687 - experiment_functions - INFO - Early stopping at epoch 850. Best Metrics: (0.0038071471137823597, 0.0018030819754957686, 0.0029905111332670475)
2026-06-20 20:53:16,798 - optuna.study.study - INFO - Trial 227 finished with values: [0.0038071471137823597, 0.0018030819754957686, 0.0029905111332670475] and parameters: {'n_layers': 1, 'embedding_dim': 128, 'lr': 0.0006133385212652219, 'lambda_val': 4.922680840294995e-05, 'batch_size': 2884, 'optimizer': 'RMSprop'}.
2026-06-20 20:53:40,278 - experiment_functions - INFO - Early stopping at epoch 550. Best Metrics: (0.0027061504214301634, 0.001233105974485285, 0.001990343636410175)
2026-06-20 20:53:40,357 - optuna.study.study - INFO - Trial 228 finished with values: [0.0027061504214301634, 0.001233105974485285, 0.001990343636410175] and parameters: {'n_layers': 1, 'embedding_dim': 32, 'lr': 0.002035013881396423, 'lambda_val': 0.037025596547861285, 'batch_size': 1378, 'optimizer': 'RMSprop'}.
2026-06-20 20:54:05,712 - experiment_functions - INFO - Early stopping at epoch 550. Best Metrics: (0.002943589538194285, 0.001270999115826702, 0.0020507281708217755)
2026-06-20 20:54:05,789 - optuna.study.study - INFO - Trial 229 finished with values: [0.002943589538194285, 0.001270999115826702, 0.0020507281708217755] and parameters: {'n_layers': 2, 'embedding_dim': 128, 'lr': 0.001947201008389374, 'lambda_val': 0.0021519517203617954, 'batch_size': 3940, 'optimizer': 'RMSprop'}.
2026-06-20 20:54:31,447 - experiment_functions - INFO - Early stopping at epoch 600. Best Metrics: (0.004174379931425828, 0.0018378173550587342, 0.002965659327157562)
2026-06-20 20:54:31,530 - optuna.study.study - INFO - Trial 230 finished with values: [0.004174379931425828, 0.0018378173550587342, 0.002965659327157562] and parameters: {'n_layers': 1, 'embedding_dim': 32, 'lr': 0.004653703533380661, 'lambda_val': 3.1552145254862633e-06, 'batch_size': 3400, 'optimizer': 'Adam'}.
2026-06-20 20:54:56,851 - experiment_functions - INFO - Early stopping at epoch 600. Best Metrics: (0.004028130556459151, 0.00177308323860048, 0.002901593138947934)
2026-06-20 20:54:56,921 - optuna.study.study - INFO - Trial 231 finished with values: [0.004028130556459151, 0.00177308323860048, 0.002901593138947934] and parameters: {'n_layers': 1, 'embedding_dim': 32, 'lr': 0.001947201008389374, 'lambda_val': 0.00091460267317109, 'batch_size': 1847, 'optimizer': 'RMSprop'}.
2026-06-20 20:55:25,145 - experiment_functions - INFO - Early stopping at epoch 650. Best Metrics: (0.00321816084852374, 0.0014273083238600481, 0.0023932325094422192)
2026-06-20 20:55:25,228 - optuna.study.study - INFO - Trial 232 finished with values: [0.00321816084852374, 0.0014273083238600481, 0.0023932325094422192] and parameters: {'n_layers': 2, 'embedding_dim': 64, 'lr': 0.0011836797126663788, 'lambda_val': 0.0021519517203617954, 'batch_size': 3940, 'optimizer': 'Adam'}.
2026-06-20 20:55:48,238 - experiment_functions - INFO - Early stopping at epoch 500. Best Metrics: (0.0013449135904426237, 0.000513136288998358, 0.0009820305954815155)
2026-06-20 20:55:48,326 - optuna.study.study - INFO - Trial 233 finished with values: [0.0013449135904426237, 0.000513136288998358, 0.0009820305954815155] and parameters: {'n_layers': 2, 'embedding_dim': 128, 'lr': 0.08768462687583077, 'lambda_val': 0.004768148457577556, 'batch_size': 2884, 'optimizer': 'Adam'}.
2026-06-20 20:58:23,272 - optuna.study.study - INFO - Trial 234 finished with values: [0.00087282466336, 0.0003205128205128205, 0.0006482020568690308] and parameters: {'n_layers': 1, 'embedding_dim': 64, 'lr': 8.681273197601347e-05, 'lambda_val': 8.944123250283024e-06, 'batch_size': 1670, 'optimizer': 'RMSprop'}.
2026-06-20 21:01:01,004 - optuna.study.study - INFO - Trial 235 finished with values: [0.0037769672551309537, 0.0017509789061513198, 0.002800402156615178] and parameters: {'n_layers': 1, 'embedding_dim': 64, 'lr': 0.00019261545870677041, 'lambda_val': 0.00091460267317109, 'batch_size': 3372, 'optimizer': 'RMSprop'}.
2026-06-20 21:01:27,056 - experiment_functions - INFO - Early stopping at epoch 500. Best Metrics: (0.003554050969921367, 0.0014936213212075283, 0.0025716549268879046)
2026-06-20 21:01:27,139 - optuna.study.study - INFO - Trial 236 finished with values: [0.003554050969921367, 0.0014936213212075283, 0.0025716549268879046] and parameters: {'n_layers': 3, 'embedding_dim': 256, 'lr': 0.01570095709375034, 'lambda_val': 8.944123250283024e-06, 'batch_size': 1670, 'optimizer': 'RMSprop'}.
2026-06-20 21:01:53,100 - experiment_functions - INFO - Early stopping at epoch 550. Best Metrics: (0.003062123986578279, 0.0014715169887583681, 0.0023154724065463103)
2026-06-20 21:01:53,190 - optuna.study.study - INFO - Trial 237 finished with values: [0.003062123986578279, 0.0014715169887583681, 0.0023154724065463103] and parameters: {'n_layers': 3, 'embedding_dim': 128, 'lr': 0.002808274561684271, 'lambda_val': 1.5947085744980874e-05, 'batch_size': 3214, 'optimizer': 'Adam'}.
2026-06-20 21:02:21,942 - experiment_functions - INFO - Early stopping at epoch 600. Best Metrics: (0.003390620051337783, 0.0017857142857142859, 0.0027295333505631724)
2026-06-20 21:02:22,027 - optuna.study.study - INFO - Trial 238 finished with values: [0.003390620051337783, 0.0017857142857142859, 0.0027295333505631724] and parameters: {'n_layers': 1, 'embedding_dim': 256, 'lr': 0.001947201008389374, 'lambda_val': 0.004379523707555612, 'batch_size': 3940, 'optimizer': 'Adam'}.
2026-06-20 21:02:48,133 - experiment_functions - INFO - Early stopping at epoch 600. Best Metrics: (0.0034901008589356256, 0.0015188834154351396, 0.002497350158912575)
2026-06-20 21:02:48,226 - optuna.study.study - INFO - Trial 239 finished with values: [0.0034901008589356256, 0.0015188834154351396, 0.002497350158912575] and parameters: {'n_layers': 2, 'embedding_dim': 64, 'lr': 0.001947201008389374, 'lambda_val': 0.0021519517203617954, 'batch_size': 3940, 'optimizer': 'Adam'}.
2026-06-20 21:03:21,870 - experiment_functions - INFO - Early stopping at epoch 750. Best Metrics: (0.003282537657315509, 0.0015473032714412027, 0.0024711538869895697)
2026-06-20 21:03:22,459 - optuna.study.study - INFO - Trial 240 finished with values: [0.003282537657315509, 0.0015473032714412027, 0.0024711538869895697] and parameters: {'n_layers': 2, 'embedding_dim': 128, 'lr': 0.0005943725589836874, 'lambda_val': 1.4583561819971732e-06, 'batch_size': 1450, 'optimizer': 'RMSprop'}.
2026-06-20 21:03:48,588 - experiment_functions - INFO - Early stopping at epoch 550. Best Metrics: (0.003401148859789933, 0.0012204749273714793, 0.002364632926745148)
2026-06-20 21:03:48,682 - optuna.study.study - INFO - Trial 241 finished with values: [0.003401148859789933, 0.0012204749273714793, 0.002364632926745148] and parameters: {'n_layers': 1, 'embedding_dim': 256, 'lr': 0.03178174845269066, 'lambda_val': 3.6417495206733656e-06, 'batch_size': 891, 'optimizer': 'RMSprop'}.
2026-06-20 21:04:16,006 - experiment_functions - INFO - Early stopping at epoch 600. Best Metrics: (0.003323644249541294, 0.0016357206012378427, 0.0026553922833189225)
2026-06-20 21:04:16,086 - optuna.study.study - INFO - Trial 242 finished with values: [0.003323644249541294, 0.0016357206012378427, 0.0026553922833189225] and parameters: {'n_layers': 2, 'embedding_dim': 128, 'lr': 0.001947201008389374, 'lambda_val': 4.922680840294995e-05, 'batch_size': 1269, 'optimizer': 'Adam'}.
2026-06-20 21:04:47,186 - experiment_functions - INFO - Early stopping at epoch 750. Best Metrics: (0.0043207304182899964, 0.0020114942528735636, 0.003286797545943476)
2026-06-20 21:04:47,256 - optuna.study.study - INFO - Trial 243 finished with values: [0.0043207304182899964, 0.0020114942528735636, 0.003286797545943476] and parameters: {'n_layers': 1, 'embedding_dim': 32, 'lr': 0.001947201008389374, 'lambda_val': 0.00091460267317109, 'batch_size': 747, 'optimizer': 'Adam'}.
2026-06-20 21:05:14,026 - experiment_functions - INFO - Early stopping at epoch 600. Best Metrics: (0.002529367598088827, 0.0010531135531135528, 0.001851787791014324)
2026-06-20 21:05:14,096 - optuna.study.study - INFO - Trial 244 finished with values: [0.002529367598088827, 0.0010531135531135528, 0.001851787791014324] and parameters: {'n_layers': 4, 'embedding_dim': 64, 'lr': 0.08768462687583077, 'lambda_val': 3.6417495206733656e-06, 'batch_size': 2734, 'optimizer': 'Adam'}.
2026-06-20 21:05:48,184 - experiment_functions - INFO - Early stopping at epoch 800. Best Metrics: (0.003729996103301744, 0.0015883541745610713, 0.0027462244658150057)
2026-06-20 21:05:48,252 - optuna.study.study - INFO - Trial 245 finished with values: [0.003729996103301744, 0.0015883541745610713, 0.0027462244658150057] and parameters: {'n_layers': 2, 'embedding_dim': 64, 'lr': 0.0011836797126663788, 'lambda_val': 3.6417495206733656e-06, 'batch_size': 747, 'optimizer': 'Adam'}.
2026-06-20 21:06:15,948 - experiment_functions - INFO - Early stopping at epoch 600. Best Metrics: (0.0031516916477750128, 0.0012867879247189591, 0.002223744130457023)
2026-06-20 21:06:16,027 - optuna.study.study - INFO - Trial 246 finished with values: [0.0031516916477750128, 0.0012867879247189591, 0.002223744130457023] and parameters: {'n_layers': 4, 'embedding_dim': 96, 'lr': 0.001947201008389374, 'lambda_val': 0.00091460267317109, 'batch_size': 1155, 'optimizer': 'Adam'}.
