2026-06-18 05:13:57,652 - optuna.study.study - INFO - Trial 81 finished with values: [0.0031739697716944844, 0.0007357584943791841, 0.0020464130934893434] and parameters: {'n_layers': 3, 'embedding_dim': 96, 'lr': 0.009898479133052968, 'lambda_val': 0.0006822884198672845, 'batch_size': 1509, 'optimizer': 'Adam'}.
2026-06-18 05:16:53,799 - optuna.study.study - INFO - Trial 82 finished with values: [0.003071509281406988, 0.0007547050650498927, 0.00195616818590614] and parameters: {'n_layers': 4, 'embedding_dim': 96, 'lr': 0.0002981283007949551, 'lambda_val': 0.0009339364864859292, 'batch_size': 2942, 'optimizer': 'Adam'}.
2026-06-18 05:18:10,370 - experiment_functions - INFO - Early stopping at epoch 1850. Best Metrics: (0.0016261748110629028, 0.0004752431476569408, 0.0010254802179111657)
2026-06-18 05:18:10,455 - optuna.study.study - INFO - Trial 83 finished with values: [0.0016261748110629028, 0.0004752431476569408, 0.0010254802179111657] and parameters: {'n_layers': 4, 'embedding_dim': 32, 'lr': 0.025072127211169866, 'lambda_val': 0.0031982885112246395, 'batch_size': 1092, 'optimizer': 'RMSprop'}.
2026-06-18 05:20:52,836 - optuna.study.study - INFO - Trial 84 finished with values: [0.0024086356920778695, 0.0005557660730074524, 0.0014905519143694522] and parameters: {'n_layers': 4, 'embedding_dim': 32, 'lr': 0.00021256415646560964, 'lambda_val': 3.166935471908637e-05, 'batch_size': 2558, 'optimizer': 'RMSprop'}.
2026-06-18 05:23:32,099 - experiment_functions - INFO - Early stopping at epoch 3600. Best Metrics: (0.0028329484725956294, 0.0006741821396993811, 0.001764564976307584)
2026-06-18 05:23:32,172 - optuna.study.study - INFO - Trial 85 finished with values: [0.0028329484725956294, 0.0006741821396993811, 0.001764564976307584] and parameters: {'n_layers': 1, 'embedding_dim': 256, 'lr': 0.00046996802016152644, 'lambda_val': 0.00016604057802743083, 'batch_size': 2135, 'optimizer': 'RMSprop'}.
2026-06-18 05:23:57,248 - experiment_functions - INFO - Early stopping at epoch 500. Best Metrics: (0.0004531083883494444, 0.00011999494758115448, 0.0002745461712188805)
2026-06-18 05:23:57,347 - optuna.study.study - INFO - Trial 86 finished with values: [0.0004531083883494444, 0.00011999494758115448, 0.0002745461712188805] and parameters: {'n_layers': 4, 'embedding_dim': 128, 'lr': 0.0003089215133690665, 'lambda_val': 0.00020122391761600542, 'batch_size': 3479, 'optimizer': 'SGD'}.
2026-06-18 05:26:36,817 - optuna.study.study - INFO - Trial 87 finished with values: [0.00186273102029265, 0.0003868258178603006, 0.0010632331922553419] and parameters: {'n_layers': 3, 'embedding_dim': 32, 'lr': 0.00021256415646560964, 'lambda_val': 0.00010785441241137728, 'batch_size': 946, 'optimizer': 'RMSprop'}.
2026-06-18 05:27:00,600 - experiment_functions - INFO - Early stopping at epoch 500. Best Metrics: (0.0006115276147929459, 0.0001310471138057345, 0.0003632880186614002)
2026-06-18 05:27:00,690 - optuna.study.study - INFO - Trial 88 finished with values: [0.0006115276147929459, 0.0001310471138057345, 0.0003632880186614002] and parameters: {'n_layers': 4, 'embedding_dim': 96, 'lr': 1.3648630936525448e-05, 'lambda_val': 0.04731057847629375, 'batch_size': 930, 'optimizer': 'SGD'}.
2026-06-18 05:27:41,285 - experiment_functions - INFO - Early stopping at epoch 950. Best Metrics: (0.0033131428144149854, 0.0008210180623973728, 0.0021439392352117447)
2026-06-18 05:27:41,367 - optuna.study.study - INFO - Trial 89 finished with values: [0.0033131428144149854, 0.0008210180623973728, 0.0021439392352117447] and parameters: {'n_layers': 2, 'embedding_dim': 64, 'lr': 0.0024576630396683807, 'lambda_val': 3.615242376833312e-06, 'batch_size': 1642, 'optimizer': 'RMSprop'}.
2026-06-18 05:28:43,295 - experiment_functions - INFO - Early stopping at epoch 1200. Best Metrics: (0.0035741251938289156, 0.0009110142730832387, 0.002230856195096998)
2026-06-18 05:28:43,362 - optuna.study.study - INFO - Trial 90 finished with values: [0.0035741251938289156, 0.0009110142730832387, 0.002230856195096998] and parameters: {'n_layers': 3, 'embedding_dim': 256, 'lr': 0.0011084029372515364, 'lambda_val': 1.6639720416643942e-06, 'batch_size': 2514, 'optimizer': 'RMSprop'}.
2026-06-18 05:31:12,308 - experiment_functions - INFO - Early stopping at epoch 3600. Best Metrics: (0.0007254489906008401, 0.00014999368447644312, 0.00039268966573812223)
2026-06-18 05:31:12,386 - optuna.study.study - INFO - Trial 91 finished with values: [0.0007254489906008401, 0.00014999368447644312, 0.00039268966573812223] and parameters: {'n_layers': 2, 'embedding_dim': 96, 'lr': 5.829003752149965e-05, 'lambda_val': 0.0016352494456933174, 'batch_size': 1498, 'optimizer': 'RMSprop'}.
2026-06-18 05:31:35,541 - experiment_functions - INFO - Early stopping at epoch 500. Best Metrics: (0.0006278324027553171, 0.0001278893520272831, 0.00029560198162785945)
2026-06-18 05:31:35,628 - optuna.study.study - INFO - Trial 92 finished with values: [0.0006278324027553171, 0.0001278893520272831, 0.00029560198162785945] and parameters: {'n_layers': 3, 'embedding_dim': 64, 'lr': 0.025072127211169866, 'lambda_val': 4.751052296396606e-05, 'batch_size': 1092, 'optimizer': 'SGD'}.
2026-06-18 05:32:02,145 - experiment_functions - INFO - Early stopping at epoch 550. Best Metrics: (0.002197650524464248, 0.0006220790703549325, 0.0014121527234160687)
2026-06-18 05:32:02,220 - optuna.study.study - INFO - Trial 93 finished with values: [0.002197650524464248, 0.0006220790703549325, 0.0014121527234160687] and parameters: {'n_layers': 4, 'embedding_dim': 96, 'lr': 0.0037685849042605117, 'lambda_val': 0.02277446723940248, 'batch_size': 2480, 'optimizer': 'RMSprop'}.
2026-06-18 05:34:10,304 - experiment_functions - INFO - Early stopping at epoch 3150. Best Metrics: (0.00418957526023068, 0.0009457496526462045, 0.0026207850138237586)
2026-06-18 05:34:10,379 - optuna.study.study - INFO - Trial 94 finished with values: [0.00418957526023068, 0.0009457496526462045, 0.0026207850138237586] and parameters: {'n_layers': 2, 'embedding_dim': 64, 'lr': 0.0009840483225184993, 'lambda_val': 3.615242376833312e-06, 'batch_size': 655, 'optimizer': 'RMSprop'}.
2026-06-18 05:37:04,280 - optuna.study.study - INFO - Trial 95 finished with values: [0.0021487508907552886, 0.0004862953138815208, 0.0012791954624292927] and parameters: {'n_layers': 4, 'embedding_dim': 96, 'lr': 0.00019742482032602274, 'lambda_val': 0.0016352494456933174, 'batch_size': 1258, 'optimizer': 'RMSprop'}.
2026-06-18 05:39:02,021 - experiment_functions - INFO - Early stopping at epoch 2950. Best Metrics: (0.0031701732651345424, 0.0006868131868131869, 0.0019188618943240063)
2026-06-18 05:39:02,117 - optuna.study.study - INFO - Trial 96 finished with values: [0.0031701732651345424, 0.0006868131868131869, 0.0019188618943240063] and parameters: {'n_layers': 1, 'embedding_dim': 64, 'lr': 0.0010693223843994991, 'lambda_val': 9.333405880902565e-05, 'batch_size': 696, 'optimizer': 'Adam'}.
2026-06-18 05:41:52,758 - optuna.study.study - INFO - Trial 97 finished with values: [0.0029368754803467973, 0.0006883920677024126, 0.0018783441431619108] and parameters: {'n_layers': 3, 'embedding_dim': 96, 'lr': 0.0002981283007949551, 'lambda_val': 1.839049008182015e-05, 'batch_size': 2942, 'optimizer': 'RMSprop'}.
2026-06-18 05:42:27,200 - experiment_functions - INFO - Early stopping at epoch 600. Best Metrics: (0.0032574778665938353, 0.0008257547050650498, 0.0019736068451047546)
2026-06-18 05:42:27,360 - optuna.study.study - INFO - Trial 98 finished with values: [0.0032574778665938353, 0.0008257547050650498, 0.0019736068451047546] and parameters: {'n_layers': 4, 'embedding_dim': 256, 'lr': 0.003946985249188999, 'lambda_val': 0.0002692345705128242, 'batch_size': 2395, 'optimizer': 'Adam'}.
2026-06-18 05:43:01,986 - experiment_functions - INFO - Early stopping at epoch 600. Best Metrics: (0.003083242238910059, 0.0008020714917266642, 0.00192778420558235)
2026-06-18 05:43:02,066 - optuna.study.study - INFO - Trial 99 finished with values: [0.003083242238910059, 0.0008020714917266642, 0.00192778420558235] and parameters: {'n_layers': 4, 'embedding_dim': 256, 'lr': 0.003946985249188999, 'lambda_val': 0.00029665726020447226, 'batch_size': 2395, 'optimizer': 'Adam'}.
2026-06-18 05:45:21,730 - experiment_functions - INFO - Early stopping at epoch 3350. Best Metrics: (0.003362940949445406, 0.0008162814197296956, 0.0020655279937615463)
2026-06-18 05:45:21,815 - optuna.study.study - INFO - Trial 100 finished with values: [0.003362940949445406, 0.0008162814197296956, 0.0020655279937615463] and parameters: {'n_layers': 4, 'embedding_dim': 64, 'lr': 0.0004894377864752034, 'lambda_val': 0.00029665726020447226, 'batch_size': 3869, 'optimizer': 'RMSprop'}.
2026-06-18 05:45:48,001 - experiment_functions - INFO - Early stopping at epoch 600. Best Metrics: (0.00217562548587868, 0.0004831375521030694, 0.0013454536869303196)
2026-06-18 05:45:48,099 - optuna.study.study - INFO - Trial 101 finished with values: [0.00217562548587868, 0.0004831375521030694, 0.0013454536869303196] and parameters: {'n_layers': 1, 'embedding_dim': 64, 'lr': 0.06961339076647434, 'lambda_val': 7.3372601056335455e-06, 'batch_size': 2790, 'optimizer': 'Adam'}.
2026-06-18 05:46:14,253 - experiment_functions - INFO - Early stopping at epoch 600. Best Metrics: (0.0028842967441880026, 0.0006741821396993811, 0.0018750404102426364)
2026-06-18 05:46:14,335 - optuna.study.study - INFO - Trial 102 finished with values: [0.0028842967441880026, 0.0006741821396993811, 0.0018750404102426364] and parameters: {'n_layers': 3, 'embedding_dim': 32, 'lr': 0.009898479133052968, 'lambda_val': 0.0006822884198672845, 'batch_size': 1177, 'optimizer': 'Adam'}.
2026-06-18 05:46:54,486 - experiment_functions - INFO - Early stopping at epoch 950. Best Metrics: (0.0026472840054029565, 0.0006362889983579638, 0.0017109948484601055)
2026-06-18 05:46:54,593 - optuna.study.study - INFO - Trial 103 finished with values: [0.0026472840054029565, 0.0006362889983579638, 0.0017109948484601055] and parameters: {'n_layers': 2, 'embedding_dim': 64, 'lr': 0.0024576630396683807, 'lambda_val': 3.615242376833312e-06, 'batch_size': 4049, 'optimizer': 'RMSprop'}.
2026-06-18 05:49:57,262 - optuna.study.study - INFO - Trial 104 finished with values: [0.003825874567452095, 0.0009662751042061388, 0.0023521192561660265] and parameters: {'n_layers': 4, 'embedding_dim': 128, 'lr': 0.0004894377864752034, 'lambda_val': 7.3372601056335455e-06, 'batch_size': 1509, 'optimizer': 'RMSprop'}.
2026-06-18 05:53:00,059 - optuna.study.study - INFO - Trial 105 finished with values: [0.0005751760251366282, 0.00012315270935960593, 0.00032157113291229623] and parameters: {'n_layers': 4, 'embedding_dim': 128, 'lr': 3.969159615588634e-05, 'lambda_val': 0.00020122391761600542, 'batch_size': 2287, 'optimizer': 'Adam'}.
2026-06-18 05:54:59,274 - experiment_functions - INFO - Early stopping at epoch 2950. Best Metrics: (0.0007105087023407546, 0.000167361374257926, 0.000413471298282506)
2026-06-18 05:54:59,362 - optuna.study.study - INFO - Trial 106 finished with values: [0.0007105087023407546, 0.000167361374257926, 0.000413471298282506] and parameters: {'n_layers': 4, 'embedding_dim': 32, 'lr': 4.901351146989036e-05, 'lambda_val': 3.166935471908637e-05, 'batch_size': 2558, 'optimizer': 'RMSprop'}.
2026-06-18 05:55:33,638 - experiment_functions - INFO - Early stopping at epoch 800. Best Metrics: (0.0029422349883123397, 0.0007815460401667298, 0.001907959521144499)
2026-06-18 05:55:34,643 - optuna.study.study - INFO - Trial 107 finished with values: [0.0029422349883123397, 0.0007815460401667298, 0.001907959521144499] and parameters: {'n_layers': 4, 'embedding_dim': 32, 'lr': 0.007259723471200344, 'lambda_val': 7.3372601056335455e-06, 'batch_size': 1509, 'optimizer': 'RMSprop'}.
2026-06-18 05:56:03,356 - experiment_functions - INFO - Early stopping at epoch 600. Best Metrics: (0.0023085929966323287, 0.0005936592143488696, 0.0014931842819710228)
2026-06-18 05:56:03,436 - optuna.study.study - INFO - Trial 108 finished with values: [0.0023085929966323287, 0.0005936592143488696, 0.0014931842819710228] and parameters: {'n_layers': 3, 'embedding_dim': 128, 'lr': 0.026856253273949384, 'lambda_val': 1.1421527735625712e-05, 'batch_size': 3869, 'optimizer': 'RMSprop'}.
2026-06-18 05:56:53,261 - experiment_functions - INFO - Early stopping at epoch 900. Best Metrics: (0.0033478507703647497, 0.0008652267272956928, 0.0020027461579909724)
2026-06-18 05:56:53,346 - optuna.study.study - INFO - Trial 109 finished with values: [0.0033478507703647497, 0.0008652267272956928, 0.0020027461579909724] and parameters: {'n_layers': 4, 'embedding_dim': 256, 'lr': 0.0011084029372515364, 'lambda_val': 1.6639720416643942e-06, 'batch_size': 3565, 'optimizer': 'RMSprop'}.
2026-06-18 05:57:32,553 - experiment_functions - INFO - Early stopping at epoch 950. Best Metrics: (0.00306708156177044, 0.0006978653530377669, 0.001926779094347653)
2026-06-18 05:57:32,862 - optuna.study.study - INFO - Trial 110 finished with values: [0.00306708156177044, 0.0006978653530377669, 0.001926779094347653] and parameters: {'n_layers': 2, 'embedding_dim': 32, 'lr': 0.0024576630396683807, 'lambda_val': 3.615242376833312e-06, 'batch_size': 1642, 'optimizer': 'RMSprop'}.
2026-06-18 05:58:17,346 - experiment_functions - INFO - Early stopping at epoch 900. Best Metrics: (0.001808194945876068, 0.0005099785272199066, 0.001178022845571207)
2026-06-18 05:58:17,440 - optuna.study.study - INFO - Trial 111 finished with values: [0.001808194945876068, 0.0005099785272199066, 0.001178022845571207] and parameters: {'n_layers': 2, 'embedding_dim': 256, 'lr': 0.06905084473248559, 'lambda_val': 0.02277446723940248, 'batch_size': 2480, 'optimizer': 'RMSprop'}.
2026-06-18 05:59:32,154 - experiment_functions - INFO - Early stopping at epoch 1600. Best Metrics: (0.003733772863682829, 0.0009189086775293672, 0.0022945709763236124)
2026-06-18 05:59:32,244 - optuna.study.study - INFO - Trial 112 finished with values: [0.003733772863682829, 0.0009189086775293672, 0.0022945709763236124] and parameters: {'n_layers': 4, 'embedding_dim': 128, 'lr': 0.0008273605807562151, 'lambda_val': 0.00020122391761600542, 'batch_size': 2287, 'optimizer': 'Adam'}.
2026-06-18 06:01:01,193 - experiment_functions - INFO - Early stopping at epoch 1650. Best Metrics: (0.0031370854840090043, 0.0008447012757357586, 0.002014437544298824)
2026-06-18 06:01:01,269 - optuna.study.study - INFO - Trial 113 finished with values: [0.0031370854840090043, 0.0008447012757357586, 0.002014437544298824] and parameters: {'n_layers': 4, 'embedding_dim': 256, 'lr': 0.0008273605807562151, 'lambda_val': 0.0009339364864859292, 'batch_size': 845, 'optimizer': 'Adam'}.
2026-06-18 06:03:45,102 - optuna.study.study - INFO - Trial 114 finished with values: [0.001428410643785632, 0.00032367058229127197, 0.0009626449775052515] and parameters: {'n_layers': 3, 'embedding_dim': 64, 'lr': 0.00018425753837898246, 'lambda_val': 1.4055284682631976e-05, 'batch_size': 655, 'optimizer': 'RMSprop'}.
2026-06-18 06:05:20,786 - experiment_functions - INFO - Early stopping at epoch 2400. Best Metrics: (0.002845044695688297, 0.0005920803334596439, 0.0016727836035685614)
2026-06-18 06:05:20,850 - optuna.study.study - INFO - Trial 115 finished with values: [0.002845044695688297, 0.0005920803334596439, 0.0016727836035685614] and parameters: {'n_layers': 1, 'embedding_dim': 64, 'lr': 0.0004932201246008738, 'lambda_val': 3.615242376833312e-06, 'batch_size': 2395, 'optimizer': 'Adam'}.
2026-06-18 06:06:05,470 - experiment_functions - INFO - Early stopping at epoch 800. Best Metrics: (0.0033429095014471132, 0.0008510167992926613, 0.0020687560546957424)
2026-06-18 06:06:05,553 - optuna.study.study - INFO - Trial 116 finished with values: [0.0033429095014471132, 0.0008510167992926613, 0.0020687560546957424] and parameters: {'n_layers': 4, 'embedding_dim': 256, 'lr': 0.0037685849042605117, 'lambda_val': 0.00029665726020447226, 'batch_size': 696, 'optimizer': 'Adam'}.
2026-06-18 06:06:30,995 - experiment_functions - INFO - Early stopping at epoch 600. Best Metrics: (0.003270019391375357, 0.0007136541619300241, 0.0019419712682933628)
2026-06-18 06:06:31,084 - optuna.study.study - INFO - Trial 117 finished with values: [0.003270019391375357, 0.0007136541619300241, 0.0019419712682933628] and parameters: {'n_layers': 1, 'embedding_dim': 32, 'lr': 0.007973613552701056, 'lambda_val': 0.00029665726020447226, 'batch_size': 655, 'optimizer': 'RMSprop'}.
2026-06-18 06:06:57,371 - experiment_functions - INFO - Early stopping at epoch 550. Best Metrics: (0.002604147195279698, 0.0007231274472653783, 0.0017209160402554304)
2026-06-18 06:06:57,475 - optuna.study.study - INFO - Trial 118 finished with values: [0.002604147195279698, 0.0007231274472653783, 0.0017209160402554304] and parameters: {'n_layers': 4, 'embedding_dim': 96, 'lr': 0.006608098041910351, 'lambda_val': 0.0010642708856562232, 'batch_size': 2086, 'optimizer': 'RMSprop'}.
2026-06-18 06:08:11,454 - experiment_functions - INFO - Early stopping at epoch 1350. Best Metrics: (0.0033348720330302205, 0.00085891120373879, 0.0020444914392470006)
2026-06-18 06:08:11,534 - optuna.study.study - INFO - Trial 119 finished with values: [0.0033348720330302205, 0.00085891120373879, 0.0020444914392470006] and parameters: {'n_layers': 4, 'embedding_dim': 256, 'lr': 0.002685013617819528, 'lambda_val': 1.6639720416643942e-06, 'batch_size': 2756, 'optimizer': 'RMSprop'}.
2026-06-18 06:10:19,854 - experiment_functions - INFO - Early stopping at epoch 2950. Best Metrics: (0.004221540199111002, 0.0009883794366552987, 0.0026873462165299226)
2026-06-18 06:10:19,941 - optuna.study.study - INFO - Trial 120 finished with values: [0.004221540199111002, 0.0009883794366552987, 0.0026873462165299226] and parameters: {'n_layers': 2, 'embedding_dim': 128, 'lr': 0.0009840483225184993, 'lambda_val': 5.538422897317458e-06, 'batch_size': 655, 'optimizer': 'RMSprop'}.
2026-06-18 06:10:46,771 - experiment_functions - INFO - Early stopping at epoch 550. Best Metrics: (0.003022462610602381, 0.0007720727548313756, 0.0018821161374005734)
2026-06-18 06:10:46,865 - optuna.study.study - INFO - Trial 121 finished with values: [0.003022462610602381, 0.0007720727548313756, 0.0018821161374005734] and parameters: {'n_layers': 4, 'embedding_dim': 96, 'lr': 0.01502084005412961, 'lambda_val': 8.606185948983422e-05, 'batch_size': 2287, 'optimizer': 'Adam'}.
2026-06-18 06:11:14,523 - experiment_functions - INFO - Early stopping at epoch 550. Best Metrics: (0.00237695155121443, 0.0006504989263609954, 0.0015082998702665095)
2026-06-18 06:11:14,606 - optuna.study.study - INFO - Trial 122 finished with values: [0.00237695155121443, 0.0006504989263609954, 0.0015082998702665095] and parameters: {'n_layers': 4, 'embedding_dim': 128, 'lr': 0.012284383685955047, 'lambda_val': 0.0010642708856562232, 'batch_size': 1882, 'optimizer': 'RMSprop'}.
2026-06-18 06:13:58,306 - optuna.study.study - INFO - Trial 123 finished with values: [0.00350463144606919, 0.0008368068712896299, 0.0021990273276905822] and parameters: {'n_layers': 4, 'embedding_dim': 32, 'lr': 0.0004894377864752034, 'lambda_val': 0.00029665726020447226, 'batch_size': 1806, 'optimizer': 'RMSprop'}.
2026-06-18 06:16:41,272 - optuna.study.study - INFO - Trial 124 finished with values: [0.0027100275723562317, 0.000607869142351901, 0.0017080833481103227] and parameters: {'n_layers': 2, 'embedding_dim': 64, 'lr': 0.0002981283007949551, 'lambda_val': 0.0009339364864859292, 'batch_size': 2942, 'optimizer': 'Adam'}.
2026-06-18 06:19:23,753 - optuna.study.study - INFO - Trial 125 finished with values: [0.0029147488766115386, 0.0006599722116963496, 0.0017694041094259375] and parameters: {'n_layers': 3, 'embedding_dim': 64, 'lr': 0.00026287438820897605, 'lambda_val': 0.00016604057802743083, 'batch_size': 3869, 'optimizer': 'RMSprop'}.
2026-06-18 06:21:21,232 - experiment_functions - INFO - Early stopping at epoch 2200. Best Metrics: (0.0034333855459813462, 0.0008889099406340787, 0.002063288160420832)
2026-06-18 06:21:21,364 - optuna.study.study - INFO - Trial 126 finished with values: [0.0034333855459813462, 0.0008889099406340787, 0.002063288160420832] and parameters: {'n_layers': 4, 'embedding_dim': 256, 'lr': 0.0008273605807562151, 'lambda_val': 0.00020122391761600542, 'batch_size': 2287, 'optimizer': 'Adam'}.
2026-06-18 06:23:59,460 - experiment_functions - INFO - Early stopping at epoch 3150. Best Metrics: (0.003265074630713795, 0.0008415435139573071, 0.002038611780902479)
2026-06-18 06:23:59,532 - optuna.study.study - INFO - Trial 127 finished with values: [0.003265074630713795, 0.0008415435139573071, 0.002038611780902479] and parameters: {'n_layers': 3, 'embedding_dim': 256, 'lr': 0.0008273605807562151, 'lambda_val': 1.1421527735625712e-05, 'batch_size': 1892, 'optimizer': 'Adam'}.
2026-06-18 06:26:39,176 - optuna.study.study - INFO - Trial 128 finished with values: [0.0028648252839045315, 0.0007010231148162183, 0.0018305239893150868] and parameters: {'n_layers': 4, 'embedding_dim': 32, 'lr': 0.0004894377864752034, 'lambda_val': 0.00021932042110835948, 'batch_size': 2500, 'optimizer': 'Adam'}.
2026-06-18 06:28:04,373 - experiment_functions - INFO - Early stopping at epoch 2150. Best Metrics: (0.0032847506742376183, 0.0006662877352532525, 0.001952120929439816)
2026-06-18 06:28:04,455 - optuna.study.study - INFO - Trial 129 finished with values: [0.0032847506742376183, 0.0006662877352532525, 0.001952120929439816] and parameters: {'n_layers': 1, 'embedding_dim': 64, 'lr': 0.0010693223843994991, 'lambda_val': 3.615242376833312e-06, 'batch_size': 1642, 'optimizer': 'Adam'}.
2026-06-18 06:28:44,989 - experiment_functions - INFO - Early stopping at epoch 1000. Best Metrics: (0.002930833484352442, 0.000607869142351901, 0.001734044827115799)
