2026-06-17 07:11:34,353 - optuna.study.study - INFO - Trial 36 finished with values: [0.00046115873485393116, 9.473285335354301e-05, 0.00024825697341031554] and parameters: {'n_layers': 2, 'embedding_dim': 64, 'lr': 0.0005325695789201119, 'lambda_val': 3.0052270668265243e-05, 'batch_size': 3625, 'optimizer': 'SGD'}.
2026-06-17 07:12:01,112 - experiment_functions - INFO - Early stopping at epoch 550. Best Metrics: (0.0016326381597423045, 0.0006773399014778326, 0.001124022120656256)
2026-06-17 07:12:02,156 - optuna.study.study - INFO - Trial 37 finished with values: [0.0016326381597423045, 0.0006773399014778326, 0.001124022120656256] and parameters: {'n_layers': 4, 'embedding_dim': 64, 'lr': 0.00446042908878494, 'lambda_val': 0.010729064222440984, 'batch_size': 856, 'optimizer': 'RMSprop'}.
2026-06-17 07:12:26,445 - experiment_functions - INFO - Early stopping at epoch 550. Best Metrics: (0.002230441089559156, 0.0008715422508525957, 0.0015434953487253335)
2026-06-17 07:12:26,579 - optuna.study.study - INFO - Trial 38 finished with values: [0.002230441089559156, 0.0008715422508525957, 0.0015434953487253335] and parameters: {'n_layers': 3, 'embedding_dim': 32, 'lr': 0.07934419482946903, 'lambda_val': 0.0003541153067555522, 'batch_size': 2645, 'optimizer': 'Adam'}.
2026-06-17 07:12:50,354 - experiment_functions - INFO - Early stopping at epoch 500. Best Metrics: (0.0003808569936453116, 9.789061513199445e-05, 0.00020055619093757316)
2026-06-17 07:12:50,451 - optuna.study.study - INFO - Trial 39 finished with values: [0.0003808569936453116, 9.789061513199445e-05, 0.00020055619093757316] and parameters: {'n_layers': 4, 'embedding_dim': 64, 'lr': 4.1435123094341326e-05, 'lambda_val': 0.024503688750493864, 'batch_size': 3180, 'optimizer': 'RMSprop'}.
2026-06-17 07:13:13,007 - experiment_functions - INFO - Early stopping at epoch 500. Best Metrics: (0.0005984522962729571, 0.00012473159024883163, 0.00029273005015060236)
2026-06-17 07:13:13,096 - optuna.study.study - INFO - Trial 40 finished with values: [0.0005984522962729571, 0.00012473159024883163, 0.00029273005015060236] and parameters: {'n_layers': 1, 'embedding_dim': 64, 'lr': 0.0006521548763575865, 'lambda_val': 0.007692244890670793, 'batch_size': 2406, 'optimizer': 'SGD'}.
2026-06-17 07:13:36,028 - experiment_functions - INFO - Early stopping at epoch 500. Best Metrics: (0.0023989737082066214, 0.0007515473032714413, 0.0014508555867838145)
2026-06-17 07:13:36,094 - optuna.study.study - INFO - Trial 41 finished with values: [0.0023989737082066214, 0.0007515473032714413, 0.0014508555867838145] and parameters: {'n_layers': 3, 'embedding_dim': 32, 'lr': 0.029862282646618256, 'lambda_val': 0.017784883340115937, 'batch_size': 1701, 'optimizer': 'RMSprop'}.
2026-06-17 07:13:58,958 - experiment_functions - INFO - Early stopping at epoch 500. Best Metrics: (0.0005715544768048189, 0.00012473159024883163, 0.0003162005935171333)
2026-06-17 07:13:59,050 - optuna.study.study - INFO - Trial 42 finished with values: [0.0005715544768048189, 0.00012473159024883163, 0.0003162005935171333] and parameters: {'n_layers': 1, 'embedding_dim': 128, 'lr': 0.0008016533232615897, 'lambda_val': 2.453969948885385e-06, 'batch_size': 3589, 'optimizer': 'SGD'}.
2026-06-17 07:14:24,460 - experiment_functions - INFO - Early stopping at epoch 550. Best Metrics: (0.0029371040439755843, 0.0011146899077933562, 0.0019324199448796798)
2026-06-17 07:14:25,795 - optuna.study.study - INFO - Trial 43 finished with values: [0.0029371040439755843, 0.0011146899077933562, 0.0019324199448796798] and parameters: {'n_layers': 3, 'embedding_dim': 64, 'lr': 0.002089031350807295, 'lambda_val': 0.0015531655766280272, 'batch_size': 1099, 'optimizer': 'RMSprop'}.
2026-06-17 07:14:56,115 - experiment_functions - INFO - Early stopping at epoch 600. Best Metrics: (0.002897677650769758, 0.0011967917140330935, 0.0020573079271151724)
2026-06-17 07:14:56,207 - optuna.study.study - INFO - Trial 44 finished with values: [0.002897677650769758, 0.0011967917140330935, 0.0020573079271151724] and parameters: {'n_layers': 2, 'embedding_dim': 128, 'lr': 0.002529382350283866, 'lambda_val': 6.565445017278844e-05, 'batch_size': 2336, 'optimizer': 'Adam'}.
2026-06-17 07:15:18,119 - experiment_functions - INFO - Early stopping at epoch 500. Best Metrics: (0.0004945449862658335, 0.00010894278135657447, 0.0002604538302489915)
2026-06-17 07:15:18,204 - optuna.study.study - INFO - Trial 45 finished with values: [0.0004945449862658335, 0.00010894278135657447, 0.0002604538302489915] and parameters: {'n_layers': 1, 'embedding_dim': 32, 'lr': 9.822015596979149e-05, 'lambda_val': 0.09430253843930178, 'batch_size': 2743, 'optimizer': 'SGD'}.
2026-06-17 07:15:44,132 - experiment_functions - INFO - Early stopping at epoch 550. Best Metrics: (0.0030079736283088474, 0.001042061386888973, 0.001935197562050159)
2026-06-17 07:15:44,222 - optuna.study.study - INFO - Trial 46 finished with values: [0.0030079736283088474, 0.001042061386888973, 0.001935197562050159] and parameters: {'n_layers': 3, 'embedding_dim': 64, 'lr': 0.007822927276622295, 'lambda_val': 1.031526593103832e-05, 'batch_size': 2659, 'optimizer': 'Adam'}.
2026-06-17 07:17:25,928 - experiment_functions - INFO - Early stopping at epoch 2200. Best Metrics: (0.0028400379463625245, 0.001215738284703802, 0.0019656067586170966)
2026-06-17 07:17:26,032 - optuna.study.study - INFO - Trial 47 finished with values: [0.0028400379463625245, 0.001215738284703802, 0.0019656067586170966] and parameters: {'n_layers': 2, 'embedding_dim': 256, 'lr': 0.00018308667519024424, 'lambda_val': 3.168163276428844e-06, 'batch_size': 2183, 'optimizer': 'RMSprop'}.
2026-06-17 07:20:45,347 - optuna.study.study - INFO - Trial 48 finished with values: [0.0009131129092192151, 0.0003284072249589491, 0.00065325793567239] and parameters: {'n_layers': 3, 'embedding_dim': 256, 'lr': 2.784734643533459e-05, 'lambda_val': 0.002197735270881275, 'batch_size': 3561, 'optimizer': 'Adam'}.
2026-06-17 07:21:08,204 - experiment_functions - INFO - Early stopping at epoch 500. Best Metrics: (0.0005420433557474382, 0.00013736263736263736, 0.00028995360250759917)
2026-06-17 07:21:08,288 - optuna.study.study - INFO - Trial 49 finished with values: [0.0005420433557474382, 0.00013736263736263736, 0.00028995360250759917] and parameters: {'n_layers': 1, 'embedding_dim': 64, 'lr': 0.012961734936573608, 'lambda_val': 1.3052788411163826e-06, 'batch_size': 3296, 'optimizer': 'SGD'}.
2026-06-17 07:21:34,763 - experiment_functions - INFO - Early stopping at epoch 600. Best Metrics: (0.0034483173714924304, 0.0013625742074017935, 0.0024654755793691325)
2026-06-17 07:21:34,828 - optuna.study.study - INFO - Trial 50 finished with values: [0.0034483173714924304, 0.0013625742074017935, 0.0024654755793691325] and parameters: {'n_layers': 1, 'embedding_dim': 64, 'lr': 0.003877789258066795, 'lambda_val': 0.00016666322755616337, 'batch_size': 2336, 'optimizer': 'Adam'}.
2026-06-17 07:21:59,417 - experiment_functions - INFO - Early stopping at epoch 500. Best Metrics: (0.0005149484125581178, 0.00011525830491347732, 0.0002992624566207238)
2026-06-17 07:21:59,497 - optuna.study.study - INFO - Trial 51 finished with values: [0.0005149484125581178, 0.00011525830491347732, 0.0002992624566207238] and parameters: {'n_layers': 2, 'embedding_dim': 256, 'lr': 0.000515681080890167, 'lambda_val': 0.002197735270881275, 'batch_size': 1777, 'optimizer': 'SGD'}.
2026-06-17 07:22:59,609 - experiment_functions - INFO - Early stopping at epoch 1350. Best Metrics: (0.0030116605659867572, 0.0011778451433623847, 0.0020863976990916056)
2026-06-17 07:22:59,695 - optuna.study.study - INFO - Trial 52 finished with values: [0.0030116605659867572, 0.0011778451433623847, 0.0020863976990916056] and parameters: {'n_layers': 3, 'embedding_dim': 96, 'lr': 0.00038610768817478637, 'lambda_val': 1.0814529836883802e-06, 'batch_size': 754, 'optimizer': 'RMSprop'}.
2026-06-17 07:23:31,713 - experiment_functions - INFO - Early stopping at epoch 650. Best Metrics: (0.0029002844267662555, 0.001182581786030062, 0.002009795127518812)
2026-06-17 07:23:31,788 - optuna.study.study - INFO - Trial 53 finished with values: [0.0029002844267662555, 0.001182581786030062, 0.002009795127518812] and parameters: {'n_layers': 2, 'embedding_dim': 256, 'lr': 0.0010198666848316574, 'lambda_val': 0.0009466382313788157, 'batch_size': 3704, 'optimizer': 'Adam'}.
2026-06-17 07:24:01,778 - experiment_functions - INFO - Early stopping at epoch 700. Best Metrics: (0.0036988360989372365, 0.001270999115826702, 0.0023746430062549285)
2026-06-17 07:24:01,909 - optuna.study.study - INFO - Trial 54 finished with values: [0.0036988360989372365, 0.001270999115826702, 0.0023746430062549285] and parameters: {'n_layers': 1, 'embedding_dim': 64, 'lr': 0.024484365885130848, 'lambda_val': 6.872101199763191e-06, 'batch_size': 3266, 'optimizer': 'RMSprop'}.
2026-06-17 07:26:45,941 - optuna.study.study - INFO - Trial 55 finished with values: [0.0009913355214827189, 0.0005052418845522293, 0.0008219480620417296] and parameters: {'n_layers': 1, 'embedding_dim': 128, 'lr': 7.91836927365731e-05, 'lambda_val': 5.2927329941475195e-06, 'batch_size': 1310, 'optimizer': 'RMSprop'}.
2026-06-17 07:27:08,250 - experiment_functions - INFO - Early stopping at epoch 500. Best Metrics: (0.0005238189885842762, 0.00011999494758115447, 0.0002942984287460109)
2026-06-17 07:27:08,365 - optuna.study.study - INFO - Trial 56 finished with values: [0.0005238189885842762, 0.00011999494758115447, 0.0002942984287460109] and parameters: {'n_layers': 1, 'embedding_dim': 32, 'lr': 9.822015596979149e-05, 'lambda_val': 0.09430253843930178, 'batch_size': 2743, 'optimizer': 'Adam'}.
2026-06-17 07:27:41,850 - experiment_functions - INFO - Early stopping at epoch 700. Best Metrics: (0.0030764236254180164, 0.001365731969180245, 0.0023943858526999508)
2026-06-17 07:27:41,934 - optuna.study.study - INFO - Trial 57 finished with values: [0.0030764236254180164, 0.001365731969180245, 0.0023943858526999508] and parameters: {'n_layers': 1, 'embedding_dim': 256, 'lr': 0.0008016533232615897, 'lambda_val': 2.453969948885385e-06, 'batch_size': 1833, 'optimizer': 'RMSprop'}.
2026-06-17 07:28:07,656 - experiment_functions - INFO - Early stopping at epoch 500. Best Metrics: (0.0005861617078229995, 0.00012315270935960593, 0.0003095659429574564)
2026-06-17 07:28:08,023 - optuna.study.study - INFO - Trial 58 finished with values: [0.0005861617078229995, 0.00012315270935960593, 0.0003095659429574564] and parameters: {'n_layers': 3, 'embedding_dim': 256, 'lr': 0.00017661397842521986, 'lambda_val': 4.625091591954486e-05, 'batch_size': 3589, 'optimizer': 'SGD'}.
2026-06-17 07:29:10,220 - experiment_functions - INFO - Early stopping at epoch 1500. Best Metrics: (0.000534562138414031, 0.00010736390046734874, 0.0002876652052722405)
2026-06-17 07:29:10,308 - optuna.study.study - INFO - Trial 59 finished with values: [0.000534562138414031, 0.00010736390046734874, 0.0002876652052722405] and parameters: {'n_layers': 1, 'embedding_dim': 32, 'lr': 1.9710210744232608e-05, 'lambda_val': 1.3849779078707614e-05, 'batch_size': 2368, 'optimizer': 'RMSprop'}.
2026-06-17 07:31:59,173 - optuna.study.study - INFO - Trial 60 finished with values: [0.0018520993061833608, 0.0009457496526462045, 0.0015084746865844964] and parameters: {'n_layers': 2, 'embedding_dim': 96, 'lr': 6.997232916900755e-05, 'lambda_val': 2.373377666068493e-06, 'batch_size': 3502, 'optimizer': 'RMSprop'}.
2026-06-17 07:32:27,490 - experiment_functions - INFO - Early stopping at epoch 650. Best Metrics: (0.0005163955941493406, 0.00011999494758115448, 0.00029542791325438706)
2026-06-17 07:32:27,658 - optuna.study.study - INFO - Trial 61 finished with values: [0.0005163955941493406, 0.00011999494758115448, 0.00029542791325438706] and parameters: {'n_layers': 1, 'embedding_dim': 64, 'lr': 1.1966870521201675e-05, 'lambda_val': 4.797979449349133e-06, 'batch_size': 2183, 'optimizer': 'RMSprop'}.
2026-06-17 07:32:51,462 - experiment_functions - INFO - Early stopping at epoch 500. Best Metrics: (0.0005701796587151337, 0.00011683718580270305, 0.00027622971710959714)
2026-06-17 07:32:52,408 - optuna.study.study - INFO - Trial 62 finished with values: [0.0005701796587151337, 0.00011683718580270305, 0.00027622971710959714] and parameters: {'n_layers': 1, 'embedding_dim': 256, 'lr': 2.6441628639530446e-05, 'lambda_val': 0.03512356455971944, 'batch_size': 3488, 'optimizer': 'Adam'}.
2026-06-17 07:33:15,670 - experiment_functions - INFO - Early stopping at epoch 500. Best Metrics: (0.0005262944890638315, 0.0001310471138057345, 0.0002836413214380021)
2026-06-17 07:33:15,761 - optuna.study.study - INFO - Trial 63 finished with values: [0.0005262944890638315, 0.0001310471138057345, 0.0002836413214380021] and parameters: {'n_layers': 1, 'embedding_dim': 256, 'lr': 2.8821831936113397e-05, 'lambda_val': 0.006880503853550419, 'batch_size': 2572, 'optimizer': 'SGD'}.
2026-06-17 07:34:27,761 - experiment_functions - INFO - Early stopping at epoch 1750. Best Metrics: (0.003205092546333884, 0.0010625868384489074, 0.0019851171507071007)
2026-06-17 07:34:27,826 - optuna.study.study - INFO - Trial 64 finished with values: [0.003205092546333884, 0.0010625868384489074, 0.0019851171507071007] and parameters: {'n_layers': 3, 'embedding_dim': 32, 'lr': 0.029862282646618256, 'lambda_val': 1.7261189135715837e-05, 'batch_size': 3410, 'optimizer': 'RMSprop'}.
2026-06-17 07:35:00,882 - experiment_functions - INFO - Early stopping at epoch 750. Best Metrics: (0.0034278147689983844, 0.0014115195149677908, 0.0024675357459484366)
2026-06-17 07:35:00,968 - optuna.study.study - INFO - Trial 65 finished with values: [0.0034278147689983844, 0.0014115195149677908, 0.0024675357459484366] and parameters: {'n_layers': 1, 'embedding_dim': 64, 'lr': 0.0011453432792901683, 'lambda_val': 1.031526593103832e-05, 'batch_size': 2572, 'optimizer': 'Adam'}.
2026-06-17 07:35:26,028 - experiment_functions - INFO - Early stopping at epoch 550. Best Metrics: (0.0009006059144889158, 0.00031893393962359484, 0.0005393488492915951)
2026-06-17 07:35:27,057 - optuna.study.study - INFO - Trial 66 finished with values: [0.0009006059144889158, 0.00031893393962359484, 0.0005393488492915951] and parameters: {'n_layers': 3, 'embedding_dim': 64, 'lr': 0.029862282646618256, 'lambda_val': 0.048148131271298036, 'batch_size': 1701, 'optimizer': 'Adam'}.
2026-06-17 07:35:52,015 - experiment_functions - INFO - Early stopping at epoch 550. Best Metrics: (0.0036105220938580777, 0.0015157256536566881, 0.002687792609264227)
2026-06-17 07:35:52,097 - optuna.study.study - INFO - Trial 67 finished with values: [0.0036105220938580777, 0.0015157256536566881, 0.002687792609264227] and parameters: {'n_layers': 1, 'embedding_dim': 96, 'lr': 0.004595237871810009, 'lambda_val': 3.567347607875195e-06, 'batch_size': 3433, 'optimizer': 'Adam'}.
2026-06-17 07:36:25,864 - experiment_functions - INFO - Early stopping at epoch 650. Best Metrics: (0.002679966603493666, 0.0012031072375899964, 0.0019524878298105856)
2026-06-17 07:36:26,150 - optuna.study.study - INFO - Trial 68 finished with values: [0.002679966603493666, 0.0012031072375899964, 0.0019524878298105856] and parameters: {'n_layers': 3, 'embedding_dim': 256, 'lr': 0.0010209094744396852, 'lambda_val': 1.561244993279661e-06, 'batch_size': 1098, 'optimizer': 'Adam'}.
2026-06-17 07:36:53,369 - experiment_functions - INFO - Early stopping at epoch 600. Best Metrics: (0.0028407527641679123, 0.0010641657193381333, 0.001910390917119982)
2026-06-17 07:36:53,456 - optuna.study.study - INFO - Trial 69 finished with values: [0.0028407527641679123, 0.0010641657193381333, 0.001910390917119982] and parameters: {'n_layers': 2, 'embedding_dim': 64, 'lr': 0.024484365885130848, 'lambda_val': 6.872101199763191e-06, 'batch_size': 1913, 'optimizer': 'Adam'}.
2026-06-17 07:39:58,989 - optuna.study.study - INFO - Trial 70 finished with values: [0.0017623754091220262, 0.000999431602879879, 0.0014937115175359674] and parameters: {'n_layers': 2, 'embedding_dim': 256, 'lr': 9.227151343927045e-05, 'lambda_val': 0.007778479458054209, 'batch_size': 580, 'optimizer': 'Adam'}.
2026-06-17 07:40:39,825 - experiment_functions - INFO - Early stopping at epoch 1000. Best Metrics: (0.0034134052245702266, 0.0009741695086522673, 0.0020351083367944624)
2026-06-17 07:40:39,902 - optuna.study.study - INFO - Trial 71 finished with values: [0.0034134052245702266, 0.0009741695086522673, 0.0020351083367944624] and parameters: {'n_layers': 2, 'embedding_dim': 32, 'lr': 0.060034049813311924, 'lambda_val': 2.373377666068493e-06, 'batch_size': 3502, 'optimizer': 'RMSprop'}.
2026-06-17 07:41:29,394 - experiment_functions - INFO - Early stopping at epoch 950. Best Metrics: (0.001472811753489202, 0.0007578628268283441, 0.001164386001005284)
2026-06-17 07:41:29,480 - optuna.study.study - INFO - Trial 72 finished with values: [0.001472811753489202, 0.0007578628268283441, 0.001164386001005284] and parameters: {'n_layers': 4, 'embedding_dim': 256, 'lr': 0.0002359819177604671, 'lambda_val': 0.028830851232177383, 'batch_size': 1749, 'optimizer': 'Adam'}.
2026-06-17 07:41:54,126 - experiment_functions - INFO - Early stopping at epoch 550. Best Metrics: (0.0030711853872901146, 0.0012615258304913477, 0.002159463066928846)
2026-06-17 07:41:54,215 - optuna.study.study - INFO - Trial 73 finished with values: [0.0030711853872901146, 0.0012615258304913477, 0.002159463066928846] and parameters: {'n_layers': 1, 'embedding_dim': 32, 'lr': 0.002231043752262738, 'lambda_val': 1.7261189135715837e-05, 'batch_size': 3410, 'optimizer': 'RMSprop'}.
2026-06-17 07:42:48,272 - experiment_functions - INFO - Early stopping at epoch 1250. Best Metrics: (0.002879720001656586, 0.0008478590375142099, 0.0017835165279223406)
2026-06-17 07:42:48,569 - optuna.study.study - INFO - Trial 74 finished with values: [0.002879720001656586, 0.0008478590375142099, 0.0017835165279223406] and parameters: {'n_layers': 3, 'embedding_dim': 64, 'lr': 0.07934419482946903, 'lambda_val': 1.031526593103832e-05, 'batch_size': 2659, 'optimizer': 'Adam'}.
2026-06-17 07:43:29,644 - experiment_functions - INFO - Early stopping at epoch 900. Best Metrics: (0.0005237885394963911, 0.0001389415182518631, 0.00029978264914425876)
2026-06-17 07:43:30,016 - optuna.study.study - INFO - Trial 75 finished with values: [0.0005237885394963911, 0.0001389415182518631, 0.00029978264914425876] and parameters: {'n_layers': 1, 'embedding_dim': 96, 'lr': 2.6441628639530446e-05, 'lambda_val': 0.002381711703565931, 'batch_size': 3690, 'optimizer': 'Adam'}.
2026-06-17 07:43:57,431 - experiment_functions - INFO - Early stopping at epoch 550. Best Metrics: (0.0031565473622458145, 0.0012094227611468991, 0.0021186305375062524)
2026-06-17 07:43:57,524 - optuna.study.study - INFO - Trial 76 finished with values: [0.0031565473622458145, 0.0012094227611468991, 0.0021186305375062524] and parameters: {'n_layers': 2, 'embedding_dim': 256, 'lr': 0.010203021680640975, 'lambda_val': 6.565445017278844e-05, 'batch_size': 1844, 'optimizer': 'Adam'}.
2026-06-17 07:44:23,006 - experiment_functions - INFO - Early stopping at epoch 550. Best Metrics: (0.0030624821862555245, 0.0010341669824428445, 0.0019315207625627824)
2026-06-17 07:44:23,080 - optuna.study.study - INFO - Trial 77 finished with values: [0.0030624821862555245, 0.0010341669824428445, 0.0019315207625627824] and parameters: {'n_layers': 4, 'embedding_dim': 32, 'lr': 0.0029893657570589515, 'lambda_val': 1.5388349045557698e-06, 'batch_size': 1281, 'optimizer': 'RMSprop'}.
2026-06-17 07:44:46,579 - experiment_functions - INFO - Early stopping at epoch 550. Best Metrics: (0.002996801976667582, 0.0011983705949223191, 0.001969580702845265)
2026-06-17 07:44:47,201 - optuna.study.study - INFO - Trial 78 finished with values: [0.002996801976667582, 0.0011983705949223191, 0.001969580702845265] and parameters: {'n_layers': 2, 'embedding_dim': 64, 'lr': 0.0019791454040792144, 'lambda_val': 3.125135396462488e-05, 'batch_size': 3256, 'optimizer': 'RMSprop'}.
2026-06-17 07:45:10,531 - experiment_functions - INFO - Early stopping at epoch 550. Best Metrics: (0.002705389932073146, 0.001008904888215233, 0.0017671062753740311)
2026-06-17 07:45:10,612 - optuna.study.study - INFO - Trial 79 finished with values: [0.002705389932073146, 0.001008904888215233, 0.0017671062753740311] and parameters: {'n_layers': 2, 'embedding_dim': 32, 'lr': 0.05952275944427514, 'lambda_val': 0.0004742943809430685, 'batch_size': 1599, 'optimizer': 'Adam'}.
2026-06-17 07:47:55,662 - optuna.study.study - INFO - Trial 80 finished with values: [0.0017182333164257341, 0.0008825944170771756, 0.0013711236720571455] and parameters: {'n_layers': 3, 'embedding_dim': 64, 'lr': 0.00010624236187060643, 'lambda_val': 0.045231718489695295, 'batch_size': 3498, 'optimizer': 'RMSprop'}.
2026-06-17 07:48:17,470 - experiment_functions - INFO - Early stopping at epoch 500. Best Metrics: (0.00043705319750298355, 9.789061513199444e-05, 0.00025822027380202384)
2026-06-17 07:48:17,539 - optuna.study.study - INFO - Trial 81 finished with values: [0.00043705319750298355, 9.789061513199444e-05, 0.00025822027380202384] and parameters: {'n_layers': 2, 'embedding_dim': 96, 'lr': 2.416247753411609e-05, 'lambda_val': 6.978722172638859e-06, 'batch_size': 895, 'optimizer': 'SGD'}.
2026-06-17 07:48:43,506 - experiment_functions - INFO - Early stopping at epoch 550. Best Metrics: (0.0030644992789780547, 0.0013373121131741823, 0.0022217206676652247)
2026-06-17 07:48:43,852 - optuna.study.study - INFO - Trial 82 finished with values: [0.0030644992789780547, 0.0013373121131741823, 0.0022217206676652247] and parameters: {'n_layers': 1, 'embedding_dim': 256, 'lr': 0.0011453432792901683, 'lambda_val': 3.737769038654263e-05, 'batch_size': 3410, 'optimizer': 'RMSprop'}.
2026-06-17 07:49:09,289 - experiment_functions - INFO - Early stopping at epoch 600. Best Metrics: (0.0037164892635965134, 0.0014746747505368194, 0.002550321742780715)
