2026-06-20 00:42:04,756 - optuna.study.study - INFO - Trial 190 finished with values: [0.03489745241582935, 0.007163382594417077, 0.02003033208915465] and parameters: {'n_layers': 1, 'embedding_dim': 32, 'lr': 0.0020150870895911718, 'lambda_val': 4.332711516457783e-05, 'batch_size': 1780, 'optimizer': 'Adam'}.
2026-06-20 00:44:09,914 - experiment_functions - INFO - Early stopping at epoch 3050. Best Metrics: (0.03248634832835079, 0.006683402804092461, 0.0186518735765623)
2026-06-20 00:44:10,022 - optuna.study.study - INFO - Trial 191 finished with values: [0.03248634832835079, 0.006683402804092461, 0.0186518735765623] and parameters: {'n_layers': 1, 'embedding_dim': 32, 'lr': 0.0020150870895911718, 'lambda_val': 4.332711516457783e-05, 'batch_size': 1780, 'optimizer': 'Adam'}.
2026-06-20 00:47:14,844 - optuna.study.study - INFO - Trial 192 finished with values: [0.028730749490107916, 0.00612290008841733, 0.016362313719737634] and parameters: {'n_layers': 2, 'embedding_dim': 128, 'lr': 0.000502008079869897, 'lambda_val': 0.000491870809962855, 'batch_size': 1916, 'optimizer': 'Adam'}.
2026-06-20 00:50:06,096 - optuna.study.study - INFO - Trial 193 finished with values: [0.03170659713338037, 0.0066691928760894284, 0.018156617760638916] and parameters: {'n_layers': 1, 'embedding_dim': 96, 'lr': 0.000778135007488856, 'lambda_val': 2.710386902101323e-06, 'batch_size': 3313, 'optimizer': 'Adam'}.
2026-06-20 00:52:48,381 - optuna.study.study - INFO - Trial 194 finished with values: [0.030592041423968385, 0.006471832764936214, 0.017579006394012546] and parameters: {'n_layers': 1, 'embedding_dim': 32, 'lr': 0.000778135007488856, 'lambda_val': 3.9435940439521e-06, 'batch_size': 3313, 'optimizer': 'Adam'}.
2026-06-20 00:53:10,730 - experiment_functions - INFO - Early stopping at epoch 500. Best Metrics: (0.0004908941197433354, 0.00012315270935960593, 0.00028504360549390525)
2026-06-20 00:53:10,815 - optuna.study.study - INFO - Trial 195 finished with values: [0.0004908941197433354, 0.00012315270935960593, 0.00028504360549390525] and parameters: {'n_layers': 3, 'embedding_dim': 32, 'lr': 0.0005537165984177899, 'lambda_val': 0.001032325420317978, 'batch_size': 1528, 'optimizer': 'SGD'}.
2026-06-20 00:54:40,976 - experiment_functions - INFO - Early stopping at epoch 1750. Best Metrics: (0.021923593841926506, 0.004635594290766705, 0.012191861367746405)
2026-06-20 00:54:41,060 - optuna.study.study - INFO - Trial 196 finished with values: [0.021923593841926506, 0.004635594290766705, 0.012191861367746405] and parameters: {'n_layers': 4, 'embedding_dim': 128, 'lr': 0.0006864603145004262, 'lambda_val': 2.710386902101323e-06, 'batch_size': 592, 'optimizer': 'Adam'}.
2026-06-20 00:55:23,568 - experiment_functions - INFO - Early stopping at epoch 1000. Best Metrics: (0.028872880977613237, 0.006129215611974231, 0.016621682818214484)
2026-06-20 00:55:23,648 - optuna.study.study - INFO - Trial 197 finished with values: [0.028872880977613237, 0.006129215611974231, 0.016621682818214484] and parameters: {'n_layers': 1, 'embedding_dim': 32, 'lr': 0.0020150870895911718, 'lambda_val': 0.001032325420317978, 'batch_size': 1780, 'optimizer': 'RMSprop'}.
2026-06-20 00:56:00,518 - experiment_functions - INFO - Early stopping at epoch 850. Best Metrics: (0.01941114018578221, 0.004201402046229633, 0.010487669725578953)
2026-06-20 00:56:00,620 - optuna.study.study - INFO - Trial 198 finished with values: [0.01941114018578221, 0.004201402046229633, 0.010487669725578953] and parameters: {'n_layers': 2, 'embedding_dim': 32, 'lr': 0.0020150870895911718, 'lambda_val': 0.001032325420317978, 'batch_size': 1780, 'optimizer': 'RMSprop'}.
2026-06-20 00:58:50,899 - optuna.study.study - INFO - Trial 199 finished with values: [0.028922309675708784, 0.006148162182644941, 0.01664983105751063] and parameters: {'n_layers': 2, 'embedding_dim': 32, 'lr': 0.0005537165984177899, 'lambda_val': 0.000491870809962855, 'batch_size': 2297, 'optimizer': 'RMSprop'}.
2026-06-20 00:59:34,364 - experiment_functions - INFO - Early stopping at epoch 1000. Best Metrics: (0.0290824493089442, 0.006228685107995453, 0.016884098914097936)
2026-06-20 00:59:34,447 - optuna.study.study - INFO - Trial 200 finished with values: [0.0290824493089442, 0.006228685107995453, 0.016884098914097936] and parameters: {'n_layers': 1, 'embedding_dim': 32, 'lr': 0.0020150870895911718, 'lambda_val': 0.001032325420317978, 'batch_size': 1780, 'optimizer': 'RMSprop'}.
2026-06-20 01:01:25,440 - experiment_functions - INFO - Early stopping at epoch 2700. Best Metrics: (0.0316690033128695, 0.006527093596059115, 0.018466774414556113)
2026-06-20 01:01:25,534 - optuna.study.study - INFO - Trial 201 finished with values: [0.0316690033128695, 0.006527093596059115, 0.018466774414556113] and parameters: {'n_layers': 1, 'embedding_dim': 32, 'lr': 0.0020150870895911718, 'lambda_val': 0.0005281001501293369, 'batch_size': 1780, 'optimizer': 'Adam'}.
2026-06-20 01:01:54,094 - experiment_functions - INFO - Early stopping at epoch 650. Best Metrics: (0.02602739641144012, 0.005522925350511559, 0.014944526292808763)
2026-06-20 01:01:54,178 - optuna.study.study - INFO - Trial 202 finished with values: [0.02602739641144012, 0.005522925350511559, 0.014944526292808763] and parameters: {'n_layers': 1, 'embedding_dim': 32, 'lr': 0.008989184367777105, 'lambda_val': 2.710386902101323e-06, 'batch_size': 2868, 'optimizer': 'Adam'}.
2026-06-20 01:04:36,643 - optuna.study.study - INFO - Trial 203 finished with values: [0.029598020003325877, 0.006351837817355059, 0.016871404175298515] and parameters: {'n_layers': 1, 'embedding_dim': 32, 'lr': 0.000778135007488856, 'lambda_val': 4.332711516457783e-05, 'batch_size': 3313, 'optimizer': 'Adam'}.
2026-06-20 01:06:31,179 - experiment_functions - INFO - Early stopping at epoch 2600. Best Metrics: (0.03302597642803306, 0.006744979158772262, 0.01857449176556961)
2026-06-20 01:06:31,248 - optuna.study.study - INFO - Trial 204 finished with values: [0.03302597642803306, 0.006744979158772262, 0.01857449176556961] and parameters: {'n_layers': 1, 'embedding_dim': 128, 'lr': 0.0013916221098515737, 'lambda_val': 1.1228763121949336e-05, 'batch_size': 1828, 'optimizer': 'RMSprop'}.
2026-06-20 01:09:26,444 - optuna.study.study - INFO - Trial 205 finished with values: [0.0334781339707569, 0.006896551724137932, 0.01915468325111053] and parameters: {'n_layers': 1, 'embedding_dim': 128, 'lr': 0.000778135007488856, 'lambda_val': 1.6250517825264063e-06, 'batch_size': 3313, 'optimizer': 'Adam'}.
2026-06-20 01:12:07,526 - optuna.study.study - INFO - Trial 206 finished with values: [0.027143219676836732, 0.005906593406593407, 0.015778787875773824] and parameters: {'n_layers': 1, 'embedding_dim': 32, 'lr': 0.000778135007488856, 'lambda_val': 3.9435940439521e-06, 'batch_size': 2068, 'optimizer': 'Adam'}.
2026-06-20 01:14:34,222 - experiment_functions - INFO - Early stopping at epoch 3550. Best Metrics: (0.027406709412308806, 0.005819754957685993, 0.015595177582403625)
2026-06-20 01:14:34,307 - optuna.study.study - INFO - Trial 207 finished with values: [0.027406709412308806, 0.005819754957685993, 0.015595177582403625] and parameters: {'n_layers': 2, 'embedding_dim': 32, 'lr': 0.000502008079869897, 'lambda_val': 0.0006161413438795785, 'batch_size': 3395, 'optimizer': 'Adam'}.
2026-06-20 01:15:00,398 - experiment_functions - INFO - Early stopping at epoch 600. Best Metrics: (0.022154190085531083, 0.0048013767841354055, 0.012654800757560435)
2026-06-20 01:15:00,476 - optuna.study.study - INFO - Trial 208 finished with values: [0.022154190085531083, 0.0048013767841354055, 0.012654800757560435] and parameters: {'n_layers': 1, 'embedding_dim': 32, 'lr': 0.011562163578381695, 'lambda_val': 0.001032325420317978, 'batch_size': 2297, 'optimizer': 'Adam'}.
2026-06-20 01:15:33,086 - experiment_functions - INFO - Early stopping at epoch 750. Best Metrics: (0.017361409690402313, 0.0037419477074649493, 0.009928770790247296)
2026-06-20 01:15:33,160 - optuna.study.study - INFO - Trial 209 finished with values: [0.017361409690402313, 0.0037419477074649493, 0.009928770790247296] and parameters: {'n_layers': 2, 'embedding_dim': 32, 'lr': 0.0020150870895911718, 'lambda_val': 0.0019292949578327476, 'batch_size': 2297, 'optimizer': 'RMSprop'}.
2026-06-20 01:16:41,349 - experiment_functions - INFO - Early stopping at epoch 1400. Best Metrics: (0.0005267681493445429, 0.0001121005431350259, 0.0002766683826326352)
2026-06-20 01:16:41,441 - optuna.study.study - INFO - Trial 210 finished with values: [0.0005267681493445429, 0.0001121005431350259, 0.0002766683826326352] and parameters: {'n_layers': 3, 'embedding_dim': 128, 'lr': 4.7928338777466427e-05, 'lambda_val': 0.0006161413438795785, 'batch_size': 989, 'optimizer': 'Adam'}.
2026-06-20 01:19:28,163 - optuna.study.study - INFO - Trial 211 finished with values: [0.03164650846034739, 0.006664456233421752, 0.018254934198895678] and parameters: {'n_layers': 1, 'embedding_dim': 32, 'lr': 0.000778135007488856, 'lambda_val': 3.9435940439521e-06, 'batch_size': 3313, 'optimizer': 'RMSprop'}.
2026-06-20 01:22:19,057 - optuna.study.study - INFO - Trial 212 finished with values: [0.01221051512812244, 0.002860932171276999, 0.007650405873269767] and parameters: {'n_layers': 1, 'embedding_dim': 128, 'lr': 0.000502008079869897, 'lambda_val': 5.1001581943832046e-05, 'batch_size': 1167, 'optimizer': 'RMSprop'}.
2026-06-20 01:25:07,001 - optuna.study.study - INFO - Trial 213 finished with values: [0.030473429147066435, 0.006342364532019705, 0.017088820638941904] and parameters: {'n_layers': 2, 'embedding_dim': 32, 'lr': 0.0005537165984177899, 'lambda_val': 2.3360853516346427e-06, 'batch_size': 3208, 'optimizer': 'Adam'}.
2026-06-20 01:27:23,305 - experiment_functions - INFO - Early stopping at epoch 3150. Best Metrics: (0.031095794739131235, 0.0064244663382594415, 0.01776328097162941)
2026-06-20 01:27:23,399 - optuna.study.study - INFO - Trial 214 finished with values: [0.031095794739131235, 0.0064244663382594415, 0.01776328097162941] and parameters: {'n_layers': 2, 'embedding_dim': 64, 'lr': 0.000778135007488856, 'lambda_val': 2.710386902101323e-06, 'batch_size': 1769, 'optimizer': 'Adam'}.
2026-06-20 01:28:51,814 - experiment_functions - INFO - Early stopping at epoch 2100. Best Metrics: (0.015756138656305634, 0.0032840722495894913, 0.008556118738929723)
2026-06-20 01:28:51,917 - optuna.study.study - INFO - Trial 215 finished with values: [0.015756138656305634, 0.0032840722495894913, 0.008556118738929723] and parameters: {'n_layers': 3, 'embedding_dim': 32, 'lr': 0.0020150870895911718, 'lambda_val': 4.332711516457783e-05, 'batch_size': 989, 'optimizer': 'RMSprop'}.
2026-06-20 01:29:38,818 - experiment_functions - INFO - Early stopping at epoch 1100. Best Metrics: (0.031689300926114564, 0.006552355690286724, 0.017944198776514958)
2026-06-20 01:29:38,952 - optuna.study.study - INFO - Trial 216 finished with values: [0.031689300926114564, 0.006552355690286724, 0.017944198776514958] and parameters: {'n_layers': 1, 'embedding_dim': 32, 'lr': 0.0024514310990239744, 'lambda_val': 2.710386902101323e-06, 'batch_size': 3313, 'optimizer': 'Adam'}.
2026-06-20 01:32:34,287 - optuna.study.study - INFO - Trial 217 finished with values: [0.031587580964838026, 0.006798661109005937, 0.018384505980697557] and parameters: {'n_layers': 1, 'embedding_dim': 128, 'lr': 0.000778135007488856, 'lambda_val': 2.710386902101323e-06, 'batch_size': 2173, 'optimizer': 'RMSprop'}.
2026-06-20 01:35:17,808 - experiment_functions - INFO - Early stopping at epoch 3500. Best Metrics: (0.026969148062768112, 0.005762915245673866, 0.01546481093862833)
2026-06-20 01:35:17,886 - optuna.study.study - INFO - Trial 218 finished with values: [0.026969148062768112, 0.005762915245673866, 0.01546481093862833] and parameters: {'n_layers': 3, 'embedding_dim': 96, 'lr': 0.000502008079869897, 'lambda_val': 5.1001581943832046e-05, 'batch_size': 1167, 'optimizer': 'RMSprop'}.
2026-06-20 01:36:06,344 - experiment_functions - INFO - Early stopping at epoch 950. Best Metrics: (0.023691051336810563, 0.004951370468611848, 0.013257970146479572)
2026-06-20 01:36:06,448 - optuna.study.study - INFO - Trial 219 finished with values: [0.023691051336810563, 0.004951370468611848, 0.013257970146479572] and parameters: {'n_layers': 3, 'embedding_dim': 128, 'lr': 0.000778135007488856, 'lambda_val': 1.5496915902370946e-06, 'batch_size': 3313, 'optimizer': 'Adam'}.
2026-06-20 01:36:42,309 - experiment_functions - INFO - Early stopping at epoch 700. Best Metrics: (0.024581160371780198, 0.005388720474927371, 0.014099890072764569)
2026-06-20 01:36:42,648 - optuna.study.study - INFO - Trial 220 finished with values: [0.024581160371780198, 0.005388720474927371, 0.014099890072764569] and parameters: {'n_layers': 1, 'embedding_dim': 256, 'lr': 0.0020150870895911718, 'lambda_val': 0.001032325420317978, 'batch_size': 3313, 'optimizer': 'RMSprop'}.
2026-06-20 01:37:22,175 - experiment_functions - INFO - Early stopping at epoch 900. Best Metrics: (0.03107462499775588, 0.006383415435139574, 0.017470993177279497)
2026-06-20 01:37:22,324 - optuna.study.study - INFO - Trial 221 finished with values: [0.03107462499775588, 0.006383415435139574, 0.017470993177279497] and parameters: {'n_layers': 1, 'embedding_dim': 32, 'lr': 0.0020150870895911718, 'lambda_val': 0.000491870809962855, 'batch_size': 3304, 'optimizer': 'RMSprop'}.
2026-06-20 01:40:07,305 - optuna.study.study - INFO - Trial 222 finished with values: [0.025969866860040745, 0.0055071365416193, 0.014934054609409565] and parameters: {'n_layers': 2, 'embedding_dim': 32, 'lr': 0.000502008079869897, 'lambda_val': 4.332711516457783e-05, 'batch_size': 1916, 'optimizer': 'Adam'}.
2026-06-20 01:41:34,639 - experiment_functions - INFO - Early stopping at epoch 1850. Best Metrics: (0.029112688798474975, 0.006055008210180624, 0.016516601080286693)
2026-06-20 01:41:34,736 - optuna.study.study - INFO - Trial 223 finished with values: [0.029112688798474975, 0.006055008210180624, 0.016516601080286693] and parameters: {'n_layers': 2, 'embedding_dim': 128, 'lr': 0.000778135007488856, 'lambda_val': 3.9435940439521e-06, 'batch_size': 1916, 'optimizer': 'Adam'}.
2026-06-20 01:42:19,898 - experiment_functions - INFO - Early stopping at epoch 1050. Best Metrics: (0.03106952343532283, 0.006474990526714665, 0.017823125845419632)
2026-06-20 01:42:19,972 - optuna.study.study - INFO - Trial 224 finished with values: [0.03106952343532283, 0.006474990526714665, 0.017823125845419632] and parameters: {'n_layers': 1, 'embedding_dim': 32, 'lr': 0.0020150870895911718, 'lambda_val': 4.332711516457783e-05, 'batch_size': 2036, 'optimizer': 'RMSprop'}.
2026-06-20 01:45:05,946 - optuna.study.study - INFO - Trial 225 finished with values: [0.032589560969036487, 0.006853921940128837, 0.018787342064805004] and parameters: {'n_layers': 1, 'embedding_dim': 32, 'lr': 0.0010742990196571252, 'lambda_val': 1.2446467426024901e-06, 'batch_size': 3223, 'optimizer': 'Adam'}.
2026-06-20 01:45:38,416 - experiment_functions - INFO - Early stopping at epoch 750. Best Metrics: (0.023526137601595273, 0.004957685992168751, 0.013643560918339534)
2026-06-20 01:45:38,481 - optuna.study.study - INFO - Trial 226 finished with values: [0.023526137601595273, 0.004957685992168751, 0.013643560918339534] and parameters: {'n_layers': 1, 'embedding_dim': 32, 'lr': 0.00733558167545691, 'lambda_val': 2.710386902101323e-06, 'batch_size': 903, 'optimizer': 'Adam'}.
2026-06-20 01:46:15,121 - experiment_functions - INFO - Early stopping at epoch 800. Best Metrics: (0.028379778960997137, 0.006001326259946951, 0.01590360934760874)
2026-06-20 01:46:15,404 - optuna.study.study - INFO - Trial 227 finished with values: [0.028379778960997137, 0.006001326259946951, 0.01590360934760874] and parameters: {'n_layers': 1, 'embedding_dim': 96, 'lr': 0.0020150870895911718, 'lambda_val': 0.0018785228357208435, 'batch_size': 3313, 'optimizer': 'RMSprop'}.
2026-06-20 01:49:00,883 - optuna.study.study - INFO - Trial 228 finished with values: [0.028640008504772645, 0.006301313628899836, 0.016847892917395156] and parameters: {'n_layers': 1, 'embedding_dim': 32, 'lr': 0.000778135007488856, 'lambda_val': 2.710386902101323e-06, 'batch_size': 3313, 'optimizer': 'RMSprop'}.
2026-06-20 01:51:09,960 - experiment_functions - INFO - Early stopping at epoch 3100. Best Metrics: (0.03038689326441616, 0.006430781861816346, 0.01717359669340067)
2026-06-20 01:51:10,031 - optuna.study.study - INFO - Trial 229 finished with values: [0.03038689326441616, 0.006430781861816346, 0.01717359669340067] and parameters: {'n_layers': 1, 'embedding_dim': 32, 'lr': 0.0020150870895911718, 'lambda_val': 4.332711516457783e-05, 'batch_size': 1780, 'optimizer': 'RMSprop'}.
2026-06-20 01:54:03,446 - optuna.study.study - INFO - Trial 230 finished with values: [0.01788622499300302, 0.004056145004420866, 0.010658121046024115] and parameters: {'n_layers': 1, 'embedding_dim': 128, 'lr': 0.000778135007488856, 'lambda_val': 3.879222949176584e-06, 'batch_size': 748, 'optimizer': 'Adam'}.
2026-06-20 01:56:48,061 - optuna.study.study - INFO - Trial 231 finished with values: [0.029411257564052076, 0.006282367058229127, 0.017024940742251388] and parameters: {'n_layers': 1, 'embedding_dim': 32, 'lr': 0.000778135007488856, 'lambda_val': 2.710386902101323e-06, 'batch_size': 3313, 'optimizer': 'Adam'}.
2026-06-20 01:57:11,034 - experiment_functions - INFO - Early stopping at epoch 500. Best Metrics: (0.0005226167127208286, 0.0001215738284703802, 0.00025222430671253254)
2026-06-20 01:57:11,121 - optuna.study.study - INFO - Trial 232 finished with values: [0.0005226167127208286, 0.0001215738284703802, 0.00025222430671253254] and parameters: {'n_layers': 1, 'embedding_dim': 96, 'lr': 0.0003140796714618388, 'lambda_val': 1.2446467426024901e-06, 'batch_size': 3313, 'optimizer': 'SGD'}.
2026-06-20 01:57:52,634 - experiment_functions - INFO - Early stopping at epoch 900. Best Metrics: (0.02927996620663697, 0.0061828975622079075, 0.01679574581766849)
2026-06-20 01:57:52,728 - optuna.study.study - INFO - Trial 233 finished with values: [0.02927996620663697, 0.0061828975622079075, 0.01679574581766849] and parameters: {'n_layers': 1, 'embedding_dim': 128, 'lr': 0.0024514310990239744, 'lambda_val': 0.00042087486522763635, 'batch_size': 2115, 'optimizer': 'Adam'}.
2026-06-20 02:00:35,573 - experiment_functions - INFO - Early stopping at epoch 3100. Best Metrics: (0.013842258468441377, 0.0029793482379689277, 0.007673825477273627)
2026-06-20 02:00:35,669 - optuna.study.study - INFO - Trial 234 finished with values: [0.013842258468441377, 0.0029793482379689277, 0.007673825477273627] and parameters: {'n_layers': 2, 'embedding_dim': 256, 'lr': 0.0020150870895911718, 'lambda_val': 4.332711516457783e-05, 'batch_size': 2713, 'optimizer': 'RMSprop'}.
2026-06-20 02:03:20,626 - optuna.study.study - INFO - Trial 235 finished with values: [0.029206943568714325, 0.006160793229758747, 0.017231114506094877] and parameters: {'n_layers': 1, 'embedding_dim': 32, 'lr': 0.000778135007488856, 'lambda_val': 4.332711516457783e-05, 'batch_size': 3313, 'optimizer': 'Adam'}.
2026-06-20 02:04:23,921 - experiment_functions - INFO - Early stopping at epoch 1500. Best Metrics: (0.02961616168046269, 0.006107111279525073, 0.01679535035393111)
2026-06-20 02:04:24,020 - optuna.study.study - INFO - Trial 236 finished with values: [0.02961616168046269, 0.006107111279525073, 0.01679535035393111] and parameters: {'n_layers': 1, 'embedding_dim': 32, 'lr': 0.0020150870895911718, 'lambda_val': 1.1228763121949336e-05, 'batch_size': 3849, 'optimizer': 'RMSprop'}.
2026-06-20 02:06:30,802 - experiment_functions - INFO - Early stopping at epoch 3050. Best Metrics: (0.03193169679551511, 0.0066170898067449795, 0.01856240048345283)
2026-06-20 02:06:30,903 - optuna.study.study - INFO - Trial 237 finished with values: [0.03193169679551511, 0.0066170898067449795, 0.01856240048345283] and parameters: {'n_layers': 1, 'embedding_dim': 32, 'lr': 0.0020150870895911718, 'lambda_val': 4.332711516457783e-05, 'batch_size': 1780, 'optimizer': 'Adam'}.
2026-06-20 02:09:37,604 - optuna.study.study - INFO - Trial 238 finished with values: [0.0017161829587060363, 0.0004026146267525578, 0.0010218400471838941] and parameters: {'n_layers': 1, 'embedding_dim': 256, 'lr': 0.000502008079869897, 'lambda_val': 0.001032325420317978, 'batch_size': 592, 'optimizer': 'Adam'}.
2026-06-20 02:10:20,837 - experiment_functions - INFO - Early stopping at epoch 950. Best Metrics: (0.02814245617879064, 0.005987116331943919, 0.016349489476178185)
2026-06-20 02:10:20,913 - optuna.study.study - INFO - Trial 239 finished with values: [0.02814245617879064, 0.005987116331943919, 0.016349489476178185] and parameters: {'n_layers': 1, 'embedding_dim': 96, 'lr': 0.002485646663868356, 'lambda_val': 0.00039574181210313535, 'batch_size': 1780, 'optimizer': 'Adam'}.
2026-06-20 02:10:52,890 - experiment_functions - INFO - Early stopping at epoch 700. Best Metrics: (0.01917039581861209, 0.004057723885310092, 0.010443631411440044)
2026-06-20 02:10:52,974 - optuna.study.study - INFO - Trial 240 finished with values: [0.01917039581861209, 0.004057723885310092, 0.010443631411440044] and parameters: {'n_layers': 2, 'embedding_dim': 32, 'lr': 0.002412678538876214, 'lambda_val': 1.1228763121949336e-05, 'batch_size': 3381, 'optimizer': 'RMSprop'}.
2026-06-20 02:11:15,464 - experiment_functions - INFO - Early stopping at epoch 500. Best Metrics: (0.000504431628317315, 0.0001231527093596059, 0.00026486603930608394)
