2026-06-22 17:07:48,843 - optuna.study.study - INFO - Trial 292 finished with values: [0.03042353255704895, 0.006621826449412656, 0.017674516096919574] and parameters: {'n_layers': 1, 'embedding_dim': 32, 'lr': 0.0006753032109319728, 'lambda_val': 1.828037239308741e-06, 'batch_size': 3712, 'optimizer': 'Adam'}.
2026-06-22 17:08:28,611 - experiment_functions - INFO - Early stopping at epoch 950. Best Metrics: (0.0006017887766830985, 0.00012473159024883163, 0.00036734256170095744)
2026-06-22 17:08:28,709 - optuna.study.study - INFO - Trial 293 finished with values: [0.0006017887766830985, 0.00012473159024883163, 0.00036734256170095744] and parameters: {'n_layers': 1, 'embedding_dim': 32, 'lr': 2.1019713801261367e-05, 'lambda_val': 0.00011379660469282507, 'batch_size': 3282, 'optimizer': 'RMSprop'}.
2026-06-22 17:10:02,902 - experiment_functions - INFO - Early stopping at epoch 2250. Best Metrics: (0.03273461937061463, 0.006920234937476316, 0.019022808224619877)
2026-06-22 17:10:03,000 - optuna.study.study - INFO - Trial 294 finished with values: [0.03273461937061463, 0.006920234937476316, 0.019022808224619877] and parameters: {'n_layers': 1, 'embedding_dim': 32, 'lr': 0.0009993547791746632, 'lambda_val': 1.3761340713703872e-05, 'batch_size': 3628, 'optimizer': 'RMSprop'}.
2026-06-22 17:12:58,444 - optuna.study.study - INFO - Trial 295 finished with values: [0.03302065949800556, 0.006923392699254768, 0.018744708378516675] and parameters: {'n_layers': 1, 'embedding_dim': 96, 'lr': 0.0006753032109319728, 'lambda_val': 0.00011379660469282507, 'batch_size': 2674, 'optimizer': 'Adam'}.
2026-06-22 17:13:32,349 - experiment_functions - INFO - Early stopping at epoch 750. Best Metrics: (0.028984447259860893, 0.006037640520399141, 0.016543741783777367)
2026-06-22 17:13:32,465 - optuna.study.study - INFO - Trial 296 finished with values: [0.028984447259860893, 0.006037640520399141, 0.016543741783777367] and parameters: {'n_layers': 1, 'embedding_dim': 32, 'lr': 0.003916255753855854, 'lambda_val': 0.0007109535707376064, 'batch_size': 2470, 'optimizer': 'Adam'}.
2026-06-22 17:16:31,816 - optuna.study.study - INFO - Trial 297 finished with values: [0.031405055747322136, 0.006680245042314008, 0.01811932241811093] and parameters: {'n_layers': 1, 'embedding_dim': 128, 'lr': 0.0006753032109319728, 'lambda_val': 0.0007109535707376064, 'batch_size': 1785, 'optimizer': 'RMSprop'}.
2026-06-22 17:17:34,954 - experiment_functions - INFO - Early stopping at epoch 1500. Best Metrics: (0.015441990842227464, 0.0037166856132373376, 0.008631902419847487)
2026-06-22 17:17:35,058 - optuna.study.study - INFO - Trial 298 finished with values: [0.015441990842227464, 0.0037166856132373376, 0.008631902419847487] and parameters: {'n_layers': 1, 'embedding_dim': 32, 'lr': 0.0009993547791746632, 'lambda_val': 0.0763529132637748, 'batch_size': 2900, 'optimizer': 'Adam'}.
2026-06-22 17:18:44,082 - experiment_functions - INFO - Early stopping at epoch 1700. Best Metrics: (0.0007576501527527238, 0.00016262473159024885, 0.0003805544230792231)
2026-06-22 17:18:44,185 - optuna.study.study - INFO - Trial 299 finished with values: [0.0007576501527527238, 0.00016262473159024885, 0.0003805544230792231] and parameters: {'n_layers': 1, 'embedding_dim': 32, 'lr': 1.0722244457029159e-05, 'lambda_val': 1.3761340713703872e-05, 'batch_size': 1891, 'optimizer': 'Adam'}.
2026-06-22 17:18:44,200 - root - INFO - Selected Trial 286 based on Max ndcg: 0.0205
2026-06-22 17:18:44,200 - root - INFO - Associated Recall: 0.0357
2026-06-22 17:18:44,200 - experiment_functions - INFO - Training the best model ... for e_yelp_1c2dcs_rand1
2026-06-22 17:22:03,587 - root - INFO -   **** Training e_yelp_1c2dcs_rand2
2026-06-22 17:22:03,775 - root - INFO -   **** Getting 575241/1274132 random edges
2026-06-22 17:22:04,105 - optuna.storages._rdb.storage - INFO - A new study created in RDB with name: Study_e_yelp_1c2dcs_rand2
2026-06-22 17:23:18,489 - experiment_functions - INFO - Early stopping at epoch 1550. Best Metrics: (0.013023231650710126, 0.002748831628141973, 0.007478073265517568)
2026-06-22 17:23:18,639 - optuna.study.study - INFO - Trial 0 finished with values: [0.013023231650710126, 0.002748831628141973, 0.007478073265517568] and parameters: {'n_layers': 3, 'embedding_dim': 96, 'lr': 0.001706237377982523, 'lambda_val': 5.8421827248860175e-05, 'batch_size': 557, 'optimizer': 'RMSprop'}.
2026-06-22 17:24:35,814 - experiment_functions - INFO - Early stopping at epoch 1550. Best Metrics: (0.008988193676887501, 0.002096753820891752, 0.004891611371306145)
2026-06-22 17:24:35,944 - optuna.study.study - INFO - Trial 1 finished with values: [0.008988193676887501, 0.002096753820891752, 0.004891611371306145] and parameters: {'n_layers': 3, 'embedding_dim': 128, 'lr': 0.0006129132477888526, 'lambda_val': 0.045001398543542404, 'batch_size': 1029, 'optimizer': 'Adam'}.
2026-06-22 17:25:07,400 - experiment_functions - INFO - Early stopping at epoch 700. Best Metrics: (0.0005321837583108348, 0.0001042061386888973, 0.0002722483896900985)
2026-06-22 17:25:07,506 - optuna.study.study - INFO - Trial 2 finished with values: [0.0005321837583108348, 0.0001042061386888973, 0.0002722483896900985] and parameters: {'n_layers': 1, 'embedding_dim': 96, 'lr': 0.048343948212643, 'lambda_val': 7.141071066849816e-06, 'batch_size': 680, 'optimizer': 'SGD'}.
2026-06-22 17:25:36,209 - experiment_functions - INFO - Early stopping at epoch 550. Best Metrics: (0.006299148348741999, 0.0014746747505368196, 0.0037077799257424085)
2026-06-22 17:25:36,315 - optuna.study.study - INFO - Trial 3 finished with values: [0.006299148348741999, 0.0014746747505368196, 0.0037077799257424085] and parameters: {'n_layers': 1, 'embedding_dim': 256, 'lr': 0.07534028152081396, 'lambda_val': 0.0001583029704774821, 'batch_size': 515, 'optimizer': 'Adam'}.
2026-06-22 17:26:03,985 - experiment_functions - INFO - Early stopping at epoch 550. Best Metrics: (0.007336270050756515, 0.0015520399141088798, 0.0039183194784390375)
2026-06-22 17:26:04,088 - optuna.study.study - INFO - Trial 4 finished with values: [0.007336270050756515, 0.0015520399141088798, 0.0039183194784390375] and parameters: {'n_layers': 3, 'embedding_dim': 96, 'lr': 0.012994567788334225, 'lambda_val': 0.0008544209026262442, 'batch_size': 2686, 'optimizer': 'RMSprop'}.
2026-06-22 17:26:26,147 - experiment_functions - INFO - Early stopping at epoch 500. Best Metrics: (0.0004110986576243232, 8.3680687128963e-05, 0.00018644904788877594)
2026-06-22 17:26:26,462 - optuna.study.study - INFO - Trial 5 finished with values: [0.0004110986576243232, 8.3680687128963e-05, 0.00018644904788877594] and parameters: {'n_layers': 1, 'embedding_dim': 32, 'lr': 0.01112113294529358, 'lambda_val': 0.0033675589958375544, 'batch_size': 2130, 'optimizer': 'SGD'}.
2026-06-22 17:29:30,636 - optuna.study.study - INFO - Trial 6 finished with values: [0.01812556697528389, 0.004051408361753189, 0.010398092231900373] and parameters: {'n_layers': 4, 'embedding_dim': 64, 'lr': 0.0001854947590635186, 'lambda_val': 0.002013482105642368, 'batch_size': 3422, 'optimizer': 'Adam'}.
2026-06-22 17:29:53,643 - experiment_functions - INFO - Early stopping at epoch 500. Best Metrics: (0.0007433650659330816, 0.00016420361247947455, 0.0004577327494711315)
2026-06-22 17:29:53,761 - optuna.study.study - INFO - Trial 7 finished with values: [0.0007433650659330816, 0.00016420361247947455, 0.0004577327494711315] and parameters: {'n_layers': 2, 'embedding_dim': 64, 'lr': 2.475958643965444e-05, 'lambda_val': 1.2347365400935575e-06, 'batch_size': 1756, 'optimizer': 'SGD'}.
2026-06-22 17:30:18,121 - experiment_functions - INFO - Early stopping at epoch 500. Best Metrics: (0.0005375902728237192, 0.0001294682329165088, 0.00031138097360278074)
2026-06-22 17:30:18,224 - optuna.study.study - INFO - Trial 8 finished with values: [0.0005375902728237192, 0.0001294682329165088, 0.00031138097360278074] and parameters: {'n_layers': 2, 'embedding_dim': 96, 'lr': 1.6815384693926122e-05, 'lambda_val': 0.059207403831256215, 'batch_size': 1429, 'optimizer': 'Adam'}.
2026-06-22 17:30:44,744 - experiment_functions - INFO - Early stopping at epoch 550. Best Metrics: (0.012308953110835073, 0.0027425161045850697, 0.007142101703845651)
2026-06-22 17:30:44,888 - optuna.study.study - INFO - Trial 9 finished with values: [0.012308953110835073, 0.0027425161045850697, 0.007142101703845651] and parameters: {'n_layers': 2, 'embedding_dim': 96, 'lr': 0.029989240467009036, 'lambda_val': 9.827421536098129e-06, 'batch_size': 558, 'optimizer': 'Adam'}.
2026-06-22 17:31:07,411 - experiment_functions - INFO - Early stopping at epoch 500. Best Metrics: (0.0004331482825337264, 0.00010104837691044589, 0.00023042654800592004)
2026-06-22 17:31:07,509 - optuna.study.study - INFO - Trial 10 finished with values: [0.0004331482825337264, 0.00010104837691044589, 0.00023042654800592004] and parameters: {'n_layers': 2, 'embedding_dim': 32, 'lr': 2.0314880556594084e-05, 'lambda_val': 0.0012621302641042254, 'batch_size': 2676, 'optimizer': 'SGD'}.
2026-06-22 17:31:34,012 - experiment_functions - INFO - Early stopping at epoch 550. Best Metrics: (0.006870305046051039, 0.0015015157256536569, 0.003908752911159165)
2026-06-22 17:31:34,117 - optuna.study.study - INFO - Trial 11 finished with values: [0.006870305046051039, 0.0015015157256536569, 0.003908752911159165] and parameters: {'n_layers': 3, 'embedding_dim': 64, 'lr': 0.00999510310957134, 'lambda_val': 0.0028529563308765807, 'batch_size': 1537, 'optimizer': 'Adam'}.
2026-06-22 17:34:11,429 - experiment_functions - INFO - Early stopping at epoch 3750. Best Metrics: (0.0007162037431697343, 0.00016104585070102312, 0.00038804438351447293)
2026-06-22 17:34:11,532 - optuna.study.study - INFO - Trial 12 finished with values: [0.0007162037431697343, 0.00016104585070102312, 0.00038804438351447293] and parameters: {'n_layers': 4, 'embedding_dim': 32, 'lr': 4.763564478976216e-05, 'lambda_val': 5.6035797096488025e-05, 'batch_size': 2804, 'optimizer': 'Adam'}.
2026-06-22 17:34:38,131 - experiment_functions - INFO - Early stopping at epoch 500. Best Metrics: (0.0005132758639184855, 0.00011999494758115448, 0.00030234714978339284)
2026-06-22 17:34:38,272 - optuna.study.study - INFO - Trial 13 finished with values: [0.0005132758639184855, 0.00011999494758115448, 0.00030234714978339284] and parameters: {'n_layers': 3, 'embedding_dim': 128, 'lr': 5.1848517027258106e-05, 'lambda_val': 3.3517926644001277e-06, 'batch_size': 2846, 'optimizer': 'SGD'}.
2026-06-22 17:35:12,697 - experiment_functions - INFO - Early stopping at epoch 700. Best Metrics: (0.007095223017008499, 0.0014652014652014654, 0.003907856167705765)
2026-06-22 17:35:12,802 - optuna.study.study - INFO - Trial 14 finished with values: [0.007095223017008499, 0.0014652014652014654, 0.003907856167705765] and parameters: {'n_layers': 4, 'embedding_dim': 64, 'lr': 0.020577409972424625, 'lambda_val': 7.4330105320237156e-06, 'batch_size': 3042, 'optimizer': 'Adam'}.
2026-06-22 17:35:38,077 - experiment_functions - INFO - Early stopping at epoch 500. Best Metrics: (0.0005293804409986468, 0.0001278893520272831, 0.00028266480599938016)
2026-06-22 17:35:38,183 - optuna.study.study - INFO - Trial 15 finished with values: [0.0005293804409986468, 0.0001278893520272831, 0.00028266480599938016] and parameters: {'n_layers': 4, 'embedding_dim': 64, 'lr': 0.0005565284238134104, 'lambda_val': 0.0057776798081195955, 'batch_size': 3851, 'optimizer': 'SGD'}.
2026-06-22 17:36:05,718 - experiment_functions - INFO - Early stopping at epoch 550. Best Metrics: (0.009481723588359857, 0.0020051787293166603, 0.005395674406096948)
2026-06-22 17:36:05,852 - optuna.study.study - INFO - Trial 16 finished with values: [0.009481723588359857, 0.0020051787293166603, 0.005395674406096948] and parameters: {'n_layers': 4, 'embedding_dim': 64, 'lr': 0.03277404265387728, 'lambda_val': 6.388650961927443e-06, 'batch_size': 3947, 'optimizer': 'RMSprop'}.
2026-06-22 17:36:39,207 - experiment_functions - INFO - Early stopping at epoch 700. Best Metrics: (0.02517180068519798, 0.005398193760262726, 0.01434278634802882)
2026-06-22 17:36:39,360 - optuna.study.study - INFO - Trial 17 finished with values: [0.02517180068519798, 0.005398193760262726, 0.01434278634802882] and parameters: {'n_layers': 2, 'embedding_dim': 64, 'lr': 0.0024593680412654663, 'lambda_val': 3.330662577836562e-06, 'batch_size': 2194, 'optimizer': 'Adam'}.
2026-06-22 17:37:16,435 - experiment_functions - INFO - Early stopping at epoch 650. Best Metrics: (0.0005292579724962698, 0.00010894278135657447, 0.00026479995851735134)
2026-06-22 17:37:16,986 - optuna.study.study - INFO - Trial 18 finished with values: [0.0005292579724962698, 0.00010894278135657447, 0.00026479995851735134] and parameters: {'n_layers': 2, 'embedding_dim': 256, 'lr': 4.6783809511923595e-05, 'lambda_val': 0.00015357353000667703, 'batch_size': 1628, 'optimizer': 'Adam'}.
2026-06-22 17:37:43,533 - experiment_functions - INFO - Early stopping at epoch 500. Best Metrics: (0.0005556772553156592, 0.00013262599469496023, 0.00032073728344925786)
2026-06-22 17:37:43,629 - optuna.study.study - INFO - Trial 19 finished with values: [0.0005556772553156592, 0.00013262599469496023, 0.00032073728344925786] and parameters: {'n_layers': 4, 'embedding_dim': 96, 'lr': 0.010519474592377669, 'lambda_val': 1.260324733159876e-06, 'batch_size': 1170, 'optimizer': 'SGD'}.
2026-06-22 17:40:45,159 - optuna.study.study - INFO - Trial 20 finished with values: [0.012955829380419245, 0.002714096248579007, 0.006998908123041139] and parameters: {'n_layers': 2, 'embedding_dim': 96, 'lr': 0.017393849903549145, 'lambda_val': 0.00036714980791779657, 'batch_size': 2159, 'optimizer': 'RMSprop'}.
2026-06-22 17:41:17,829 - experiment_functions - INFO - Early stopping at epoch 700. Best Metrics: (0.013430722734789628, 0.003064607805987117, 0.007217036701134828)
2026-06-22 17:41:17,931 - optuna.study.study - INFO - Trial 21 finished with values: [0.013430722734789628, 0.003064607805987117, 0.007217036701134828] and parameters: {'n_layers': 4, 'embedding_dim': 32, 'lr': 0.0013675886061108719, 'lambda_val': 0.008507655043799656, 'batch_size': 2857, 'optimizer': 'Adam'}.
2026-06-22 17:41:41,406 - experiment_functions - INFO - Early stopping at epoch 500. Best Metrics: (0.0004948760059647892, 0.00012788935202728306, 0.0002867069178034528)
2026-06-22 17:41:41,510 - optuna.study.study - INFO - Trial 22 finished with values: [0.0004948760059647892, 0.00012788935202728306, 0.0002867069178034528] and parameters: {'n_layers': 1, 'embedding_dim': 96, 'lr': 7.610270851230656e-05, 'lambda_val': 0.00025220826721851074, 'batch_size': 3522, 'optimizer': 'SGD'}.
2026-06-22 17:42:04,720 - experiment_functions - INFO - Early stopping at epoch 500. Best Metrics: (0.0006468604208303102, 0.0001499936844764431, 0.00035058205643406293)
2026-06-22 17:42:04,825 - optuna.study.study - INFO - Trial 23 finished with values: [0.0006468604208303102, 0.0001499936844764431, 0.00035058205643406293] and parameters: {'n_layers': 3, 'embedding_dim': 32, 'lr': 0.003472067518317249, 'lambda_val': 0.0425098267465042, 'batch_size': 916, 'optimizer': 'SGD'}.
2026-06-22 17:42:28,005 - experiment_functions - INFO - Early stopping at epoch 500. Best Metrics: (0.0005390264880823809, 0.00012631047113805733, 0.0002587039852728928)
2026-06-22 17:42:28,145 - optuna.study.study - INFO - Trial 24 finished with values: [0.0005390264880823809, 0.00012631047113805733, 0.0002587039852728928] and parameters: {'n_layers': 3, 'embedding_dim': 32, 'lr': 0.00048451920640764227, 'lambda_val': 0.00011223443704918438, 'batch_size': 3724, 'optimizer': 'SGD'}.
2026-06-22 17:43:01,942 - experiment_functions - INFO - Early stopping at epoch 500. Best Metrics: (0.0005085255330301132, 0.0001089427813565745, 0.0002973444679094537)
2026-06-22 17:43:02,049 - optuna.study.study - INFO - Trial 25 finished with values: [0.0005085255330301132, 0.0001089427813565745, 0.0002973444679094537] and parameters: {'n_layers': 4, 'embedding_dim': 256, 'lr': 4.962021893306579e-05, 'lambda_val': 6.235289471210825e-06, 'batch_size': 3629, 'optimizer': 'SGD'}.
2026-06-22 17:43:33,991 - experiment_functions - INFO - Early stopping at epoch 700. Best Metrics: (0.009217506088206177, 0.0018883415435139573, 0.005081514793366946)
2026-06-22 17:43:34,090 - optuna.study.study - INFO - Trial 26 finished with values: [0.009217506088206177, 0.0018883415435139573, 0.005081514793366946] and parameters: {'n_layers': 4, 'embedding_dim': 32, 'lr': 0.019758488139791107, 'lambda_val': 0.00016070502405844529, 'batch_size': 3636, 'optimizer': 'RMSprop'}.
2026-06-22 17:43:57,570 - experiment_functions - INFO - Early stopping at epoch 500. Best Metrics: (0.0005905487774184818, 0.00013420487558418593, 0.00030441642344470373)
2026-06-22 17:43:57,675 - optuna.study.study - INFO - Trial 27 finished with values: [0.0005905487774184818, 0.00013420487558418593, 0.00030441642344470373] and parameters: {'n_layers': 2, 'embedding_dim': 64, 'lr': 0.00023584176777876082, 'lambda_val': 0.01580485317892756, 'batch_size': 2625, 'optimizer': 'SGD'}.
2026-06-22 17:44:22,333 - experiment_functions - INFO - Early stopping at epoch 500. Best Metrics: (0.00045827541906775696, 0.0001199949475811545, 0.0002492837462552269)
2026-06-22 17:44:22,438 - optuna.study.study - INFO - Trial 28 finished with values: [0.00045827541906775696, 0.0001199949475811545, 0.0002492837462552269] and parameters: {'n_layers': 2, 'embedding_dim': 128, 'lr': 0.0020454722429035796, 'lambda_val': 0.03164901151019023, 'batch_size': 561, 'optimizer': 'SGD'}.
2026-06-22 17:44:45,103 - experiment_functions - INFO - Early stopping at epoch 500. Best Metrics: (0.0004685755143921818, 0.0001199949475811545, 0.0002602815509256573)
2026-06-22 17:44:45,208 - optuna.study.study - INFO - Trial 29 finished with values: [0.0004685755143921818, 0.0001199949475811545, 0.0002602815509256573] and parameters: {'n_layers': 3, 'embedding_dim': 32, 'lr': 0.00016986245682991952, 'lambda_val': 1.1148699214051002e-05, 'batch_size': 3601, 'optimizer': 'SGD'}.
2026-06-22 17:45:08,732 - experiment_functions - INFO - Early stopping at epoch 500. Best Metrics: (0.0005104541252225278, 0.00011683718580270305, 0.0002812943667562449)
2026-06-22 17:45:08,832 - optuna.study.study - INFO - Trial 30 finished with values: [0.0005104541252225278, 0.00011683718580270305, 0.0002812943667562449] and parameters: {'n_layers': 1, 'embedding_dim': 128, 'lr': 0.006139504413522148, 'lambda_val': 0.03736027950899606, 'batch_size': 2122, 'optimizer': 'SGD'}.
2026-06-22 17:45:31,846 - experiment_functions - INFO - Early stopping at epoch 500. Best Metrics: (0.00038000360516812515, 0.00010104837691044589, 0.00023618323784205594)
2026-06-22 17:45:31,946 - optuna.study.study - INFO - Trial 31 finished with values: [0.00038000360516812515, 0.00010104837691044589, 0.00023618323784205594] and parameters: {'n_layers': 4, 'embedding_dim': 32, 'lr': 0.00043727725158168677, 'lambda_val': 0.002304128376309129, 'batch_size': 3819, 'optimizer': 'SGD'}.
2026-06-22 17:46:46,682 - experiment_functions - INFO - Early stopping at epoch 1700. Best Metrics: (0.0036041180448435567, 0.0008004926108374384, 0.001937781953662325)
2026-06-22 17:46:46,790 - optuna.study.study - INFO - Trial 32 finished with values: [0.0036041180448435567, 0.0008004926108374384, 0.001937781953662325] and parameters: {'n_layers': 1, 'embedding_dim': 128, 'lr': 0.037550320975412374, 'lambda_val': 0.08584717251235822, 'batch_size': 3998, 'optimizer': 'Adam'}.
2026-06-22 17:47:31,024 - experiment_functions - INFO - Early stopping at epoch 1000. Best Metrics: (0.003496905867470918, 0.0008399646330680814, 0.0019872804127582114)
2026-06-22 17:47:31,127 - optuna.study.study - INFO - Trial 33 finished with values: [0.003496905867470918, 0.0008399646330680814, 0.0019872804127582114] and parameters: {'n_layers': 2, 'embedding_dim': 64, 'lr': 0.008245212395764548, 'lambda_val': 0.03546156124706191, 'batch_size': 3584, 'optimizer': 'RMSprop'}.
2026-06-22 17:47:56,178 - experiment_functions - INFO - Early stopping at epoch 500. Best Metrics: (0.0006362942991658212, 0.00012631047113805733, 0.00032457923464099833)
2026-06-22 17:47:56,282 - optuna.study.study - INFO - Trial 34 finished with values: [0.0006362942991658212, 0.00012631047113805733, 0.00032457923464099833] and parameters: {'n_layers': 3, 'embedding_dim': 96, 'lr': 2.5834572176473275e-05, 'lambda_val': 7.86057874448721e-06, 'batch_size': 3381, 'optimizer': 'SGD'}.
2026-06-22 17:48:22,502 - experiment_functions - INFO - Early stopping at epoch 500. Best Metrics: (0.0005224467852855341, 0.00011999494758115447, 0.00033002382236843375)
2026-06-22 17:48:22,603 - optuna.study.study - INFO - Trial 35 finished with values: [0.0005224467852855341, 0.00011999494758115447, 0.00033002382236843375] and parameters: {'n_layers': 4, 'embedding_dim': 96, 'lr': 0.03352035336414788, 'lambda_val': 1.0596404080078417e-05, 'batch_size': 3207, 'optimizer': 'SGD'}.
2026-06-22 17:48:57,211 - experiment_functions - INFO - Early stopping at epoch 550. Best Metrics: (0.007303930293739601, 0.0015441455096627513, 0.004156845441900757)
2026-06-22 17:48:57,321 - optuna.study.study - INFO - Trial 36 finished with values: [0.007303930293739601, 0.0015441455096627513, 0.004156845441900757] and parameters: {'n_layers': 3, 'embedding_dim': 256, 'lr': 0.06800918585800063, 'lambda_val': 1.314986245861158e-06, 'batch_size': 1052, 'optimizer': 'RMSprop'}.
2026-06-22 17:49:20,494 - experiment_functions - INFO - Early stopping at epoch 500. Best Metrics: (0.0005456142641953182, 0.00012473159024883163, 0.0002805241554081501)
2026-06-22 17:49:20,601 - optuna.study.study - INFO - Trial 37 finished with values: [0.0005456142641953182, 0.00012473159024883163, 0.0002805241554081501] and parameters: {'n_layers': 2, 'embedding_dim': 64, 'lr': 0.08646808241862093, 'lambda_val': 0.0017398126953472848, 'batch_size': 862, 'optimizer': 'SGD'}.
