2026-06-20 02:11:15,546 - optuna.study.study - INFO - Trial 241 finished with values: [0.000504431628317315, 0.0001231527093596059, 0.00026486603930608394] and parameters: {'n_layers': 3, 'embedding_dim': 32, 'lr': 0.007278576892889713, 'lambda_val': 0.0002030431860426303, 'batch_size': 1916, 'optimizer': 'SGD'}.
2026-06-20 02:12:25,411 - experiment_functions - INFO - Early stopping at epoch 1650. Best Metrics: (0.030840745337873208, 0.006359732221801188, 0.017738979615407827)
2026-06-20 02:12:25,487 - optuna.study.study - INFO - Trial 242 finished with values: [0.030840745337873208, 0.006359732221801188, 0.017738979615407827] and parameters: {'n_layers': 1, 'embedding_dim': 32, 'lr': 0.0020150870895911718, 'lambda_val': 0.000491870809962855, 'batch_size': 3313, 'optimizer': 'Adam'}.
2026-06-20 02:15:23,231 - optuna.study.study - INFO - Trial 243 finished with values: [0.03301137647727466, 0.0067655046103321966, 0.019035965619431362] and parameters: {'n_layers': 1, 'embedding_dim': 128, 'lr': 0.000778135007488856, 'lambda_val': 1.2446467426024901e-06, 'batch_size': 3313, 'optimizer': 'Adam'}.
2026-06-20 02:17:15,378 - experiment_functions - INFO - Early stopping at epoch 2600. Best Metrics: (0.03322769989356331, 0.006721295945433877, 0.019179310621653213)
2026-06-20 02:17:15,452 - optuna.study.study - INFO - Trial 244 finished with values: [0.03322769989356331, 0.006721295945433877, 0.019179310621653213] and parameters: {'n_layers': 1, 'embedding_dim': 64, 'lr': 0.0013765180361117405, 'lambda_val': 9.655588931325782e-06, 'batch_size': 3592, 'optimizer': 'Adam'}.
2026-06-20 02:17:37,687 - experiment_functions - INFO - Early stopping at epoch 500. Best Metrics: (0.0005618015653476531, 0.00011841606669192877, 0.00034975190565906747)
2026-06-20 02:17:37,832 - optuna.study.study - INFO - Trial 245 finished with values: [0.0005618015653476531, 0.00011841606669192877, 0.00034975190565906747] and parameters: {'n_layers': 1, 'embedding_dim': 32, 'lr': 0.0020150870895911718, 'lambda_val': 2.298588843809014e-06, 'batch_size': 2713, 'optimizer': 'SGD'}.
2026-06-20 02:20:22,072 - optuna.study.study - INFO - Trial 246 finished with values: [0.030727410661411405, 0.006452886194265505, 0.017685106498672915] and parameters: {'n_layers': 1, 'embedding_dim': 32, 'lr': 0.000778135007488856, 'lambda_val': 2.710386902101323e-06, 'batch_size': 3313, 'optimizer': 'Adam'}.
2026-06-20 02:20:50,520 - experiment_functions - INFO - Early stopping at epoch 500. Best Metrics: (0.0005915166955995243, 0.00011210054313502589, 0.0002904255251893076)
2026-06-20 02:20:50,615 - optuna.study.study - INFO - Trial 247 finished with values: [0.0005915166955995243, 0.00011210054313502589, 0.0002904255251893076] and parameters: {'n_layers': 2, 'embedding_dim': 256, 'lr': 0.00010821694553041439, 'lambda_val': 0.08420488885179676, 'batch_size': 1780, 'optimizer': 'Adam'}.
2026-06-20 02:23:32,674 - optuna.study.study - INFO - Trial 248 finished with values: [0.015472383677812118, 0.0035035366931918653, 0.0089874150779275] and parameters: {'n_layers': 1, 'embedding_dim': 32, 'lr': 0.000468064898707743, 'lambda_val': 2.710386902101323e-06, 'batch_size': 3313, 'optimizer': 'Adam'}.
2026-06-20 02:26:14,947 - optuna.study.study - INFO - Trial 249 finished with values: [0.020619225732064, 0.004678224074775798, 0.01212265549407958] and parameters: {'n_layers': 1, 'embedding_dim': 32, 'lr': 0.000502008079869897, 'lambda_val': 0.0006161413438795785, 'batch_size': 3646, 'optimizer': 'Adam'}.
2026-06-20 02:29:03,698 - optuna.study.study - INFO - Trial 250 finished with values: [0.03391087752964328, 0.007063913098395857, 0.019414104191557913] and parameters: {'n_layers': 1, 'embedding_dim': 64, 'lr': 0.000778135007488856, 'lambda_val': 5.354698051721027e-05, 'batch_size': 3592, 'optimizer': 'RMSprop'}.
2026-06-20 02:30:16,210 - experiment_functions - INFO - Early stopping at epoch 1600. Best Metrics: (0.031570429337955175, 0.006397625363142604, 0.01818628454512113)
2026-06-20 02:30:16,293 - optuna.study.study - INFO - Trial 251 finished with values: [0.031570429337955175, 0.006397625363142604, 0.01818628454512113] and parameters: {'n_layers': 1, 'embedding_dim': 128, 'lr': 0.0013916221098515737, 'lambda_val': 1.1228763121949336e-05, 'batch_size': 3580, 'optimizer': 'RMSprop'}.
2026-06-20 02:31:05,964 - experiment_functions - INFO - Early stopping at epoch 1100. Best Metrics: (0.030097775517805982, 0.006271314892004547, 0.016926121966473577)
2026-06-20 02:31:06,047 - optuna.study.study - INFO - Trial 252 finished with values: [0.030097775517805982, 0.006271314892004547, 0.016926121966473577] and parameters: {'n_layers': 1, 'embedding_dim': 96, 'lr': 0.0020150870895911718, 'lambda_val': 1.8510070531932525e-06, 'batch_size': 3313, 'optimizer': 'Adam'}.
2026-06-20 02:34:04,879 - optuna.study.study - INFO - Trial 253 finished with values: [0.031285200692136354, 0.006658140709864847, 0.01805685531874178] and parameters: {'n_layers': 1, 'embedding_dim': 128, 'lr': 0.000778135007488856, 'lambda_val': 2.710386902101323e-06, 'batch_size': 3313, 'optimizer': 'Adam'}.
2026-06-20 02:34:28,070 - experiment_functions - INFO - Early stopping at epoch 500. Best Metrics: (0.0005226167127208286, 0.0001215738284703802, 0.00025222430671253254)
2026-06-20 02:34:28,179 - optuna.study.study - INFO - Trial 254 finished with values: [0.0005226167127208286, 0.0001215738284703802, 0.00025222430671253254] and parameters: {'n_layers': 1, 'embedding_dim': 96, 'lr': 0.0005674841626425155, 'lambda_val': 2.710386902101323e-06, 'batch_size': 2987, 'optimizer': 'SGD'}.
2026-06-20 02:35:36,651 - experiment_functions - INFO - Early stopping at epoch 1600. Best Metrics: (0.032574554786519425, 0.0067291903498800055, 0.018750193243224106)
2026-06-20 02:35:36,733 - optuna.study.study - INFO - Trial 255 finished with values: [0.032574554786519425, 0.0067291903498800055, 0.018750193243224106] and parameters: {'n_layers': 1, 'embedding_dim': 32, 'lr': 0.0020150870895911718, 'lambda_val': 4.332711516457783e-05, 'batch_size': 1780, 'optimizer': 'Adam'}.
2026-06-20 02:38:54,666 - optuna.study.study - INFO - Trial 256 finished with values: [0.032175485290853637, 0.0067497158014399395, 0.018667772113852073] and parameters: {'n_layers': 1, 'embedding_dim': 256, 'lr': 0.000778135007488856, 'lambda_val': 3.9435940439521e-06, 'batch_size': 3313, 'optimizer': 'Adam'}.
2026-06-20 02:40:48,898 - experiment_functions - INFO - Early stopping at epoch 2700. Best Metrics: (0.03290499307857535, 0.006763925729442971, 0.018742651416455883)
2026-06-20 02:40:48,993 - optuna.study.study - INFO - Trial 257 finished with values: [0.03290499307857535, 0.006763925729442971, 0.018742651416455883] and parameters: {'n_layers': 1, 'embedding_dim': 32, 'lr': 0.0020150870895911718, 'lambda_val': 4.332711516457783e-05, 'batch_size': 1780, 'optimizer': 'Adam'}.
2026-06-20 02:43:47,626 - optuna.study.study - INFO - Trial 258 finished with values: [0.03380501012543642, 0.007070228621952759, 0.01941254543935235] and parameters: {'n_layers': 1, 'embedding_dim': 128, 'lr': 0.000778135007488856, 'lambda_val': 0.000355022057333572, 'batch_size': 2929, 'optimizer': 'RMSprop'}.
2026-06-20 02:44:47,608 - experiment_functions - INFO - Early stopping at epoch 1400. Best Metrics: (0.03397844656231399, 0.007048124289503601, 0.019524134363304142)
2026-06-20 02:44:47,695 - optuna.study.study - INFO - Trial 259 finished with values: [0.03397844656231399, 0.007048124289503601, 0.019524134363304142] and parameters: {'n_layers': 1, 'embedding_dim': 32, 'lr': 0.0020150870895911718, 'lambda_val': 0.0005281001501293369, 'batch_size': 1780, 'optimizer': 'Adam'}.
2026-06-20 02:47:29,501 - optuna.study.study - INFO - Trial 260 finished with values: [0.0016115155612330492, 0.0003820891751926235, 0.0008870098343753366] and parameters: {'n_layers': 1, 'embedding_dim': 32, 'lr': 0.0003727677601760906, 'lambda_val': 4.332711516457783e-05, 'batch_size': 1780, 'optimizer': 'Adam'}.
2026-06-20 02:48:47,848 - experiment_functions - INFO - Early stopping at epoch 1850. Best Metrics: (0.02996784015235267, 0.006337627889352028, 0.01724911717844534)
2026-06-20 02:48:47,914 - optuna.study.study - INFO - Trial 261 finished with values: [0.02996784015235267, 0.006337627889352028, 0.01724911717844534] and parameters: {'n_layers': 1, 'embedding_dim': 32, 'lr': 0.0020150870895911718, 'lambda_val': 1.1228763121949336e-05, 'batch_size': 725, 'optimizer': 'RMSprop'}.
2026-06-20 02:49:13,831 - experiment_functions - INFO - Early stopping at epoch 550. Best Metrics: (0.014267820470343423, 0.003282493368700265, 0.008304914353633832)
2026-06-20 02:49:13,894 - optuna.study.study - INFO - Trial 262 finished with values: [0.014267820470343423, 0.003282493368700265, 0.008304914353633832] and parameters: {'n_layers': 1, 'embedding_dim': 128, 'lr': 0.01706683944030927, 'lambda_val': 0.000491870809962855, 'batch_size': 1916, 'optimizer': 'Adam'}.
2026-06-20 02:51:59,726 - optuna.study.study - INFO - Trial 263 finished with values: [0.02979698156167844, 0.006280788177339901, 0.017438491490503954] and parameters: {'n_layers': 1, 'embedding_dim': 32, 'lr': 0.000778135007488856, 'lambda_val': 4.332711516457783e-05, 'batch_size': 2868, 'optimizer': 'Adam'}.
2026-06-20 02:54:46,195 - optuna.study.study - INFO - Trial 264 finished with values: [0.03366227489227272, 0.0069707591259315395, 0.019125968492580137] and parameters: {'n_layers': 1, 'embedding_dim': 32, 'lr': 0.0020150870895911718, 'lambda_val': 4.332711516457783e-05, 'batch_size': 1780, 'optimizer': 'Adam'}.
2026-06-20 02:55:14,021 - experiment_functions - INFO - Early stopping at epoch 600. Best Metrics: (0.019315688737011703, 0.004111405835543767, 0.010764222401322316)
2026-06-20 02:55:14,082 - optuna.study.study - INFO - Trial 265 finished with values: [0.019315688737011703, 0.004111405835543767, 0.010764222401322316] and parameters: {'n_layers': 1, 'embedding_dim': 96, 'lr': 0.004253577050088062, 'lambda_val': 2.710386902101323e-06, 'batch_size': 3313, 'optimizer': 'RMSprop'}.
2026-06-20 02:56:26,578 - experiment_functions - INFO - Early stopping at epoch 1700. Best Metrics: (0.02783831077848727, 0.005863963622584312, 0.015616914942858311)
2026-06-20 02:56:26,654 - optuna.study.study - INFO - Trial 266 finished with values: [0.02783831077848727, 0.005863963622584312, 0.015616914942858311] and parameters: {'n_layers': 2, 'embedding_dim': 32, 'lr': 0.000778135007488856, 'lambda_val': 2.710386902101323e-06, 'batch_size': 3313, 'optimizer': 'Adam'}.
2026-06-20 02:59:14,438 - optuna.study.study - INFO - Trial 267 finished with values: [0.02825306178297852, 0.006075533661740559, 0.016590737040111214] and parameters: {'n_layers': 1, 'embedding_dim': 64, 'lr': 0.000778135007488856, 'lambda_val': 2.710386902101323e-06, 'batch_size': 1689, 'optimizer': 'Adam'}.
2026-06-20 03:02:13,675 - optuna.study.study - INFO - Trial 268 finished with values: [0.032869419767223164, 0.006879184034356449, 0.01872612710242877] and parameters: {'n_layers': 1, 'embedding_dim': 128, 'lr': 0.000778135007488856, 'lambda_val': 3.9435940439521e-06, 'batch_size': 3313, 'optimizer': 'Adam'}.
2026-06-20 03:04:42,699 - experiment_functions - INFO - Early stopping at epoch 3450. Best Metrics: (0.032874769047715545, 0.006842869773904257, 0.018649035996852064)
2026-06-20 03:04:42,766 - optuna.study.study - INFO - Trial 269 finished with values: [0.032874769047715545, 0.006842869773904257, 0.018649035996852064] and parameters: {'n_layers': 1, 'embedding_dim': 64, 'lr': 0.0010742990196571252, 'lambda_val': 3.382134602335044e-05, 'batch_size': 2868, 'optimizer': 'RMSprop'}.
2026-06-20 03:05:22,987 - experiment_functions - INFO - Early stopping at epoch 650. Best Metrics: (0.017333414948031416, 0.003675634710117469, 0.009434605692911893)
2026-06-20 03:05:23,084 - optuna.study.study - INFO - Trial 270 finished with values: [0.017333414948031416, 0.003675634710117469, 0.009434605692911893] and parameters: {'n_layers': 3, 'embedding_dim': 256, 'lr': 0.0020150870895911718, 'lambda_val': 3.839973473325218e-05, 'batch_size': 1780, 'optimizer': 'Adam'}.
2026-06-20 03:05:45,616 - experiment_functions - INFO - Early stopping at epoch 500. Best Metrics: (0.000495982232744105, 0.00011683718580270305, 0.00026122928505837147)
2026-06-20 03:05:45,695 - optuna.study.study - INFO - Trial 271 finished with values: [0.000495982232744105, 0.00011683718580270305, 0.00026122928505837147] and parameters: {'n_layers': 1, 'embedding_dim': 64, 'lr': 0.0020150870895911718, 'lambda_val': 6.627859553422192e-05, 'batch_size': 3580, 'optimizer': 'SGD'}.
2026-06-20 03:06:27,351 - experiment_functions - INFO - Early stopping at epoch 900. Best Metrics: (0.016484970693210525, 0.0034135404825059996, 0.009290587404732969)
2026-06-20 03:06:27,446 - optuna.study.study - INFO - Trial 272 finished with values: [0.016484970693210525, 0.0034135404825059996, 0.009290587404732969] and parameters: {'n_layers': 1, 'embedding_dim': 128, 'lr': 0.006027316302484868, 'lambda_val': 2.710386902101323e-06, 'batch_size': 2868, 'optimizer': 'RMSprop'}.
2026-06-20 03:07:38,389 - experiment_functions - INFO - Early stopping at epoch 1550. Best Metrics: (0.0329030998681456, 0.006894972843248706, 0.018676347374759674)
2026-06-20 03:07:38,487 - optuna.study.study - INFO - Trial 273 finished with values: [0.0329030998681456, 0.006894972843248706, 0.018676347374759674] and parameters: {'n_layers': 1, 'embedding_dim': 128, 'lr': 0.0010742990196571252, 'lambda_val': 0.0003581566039081056, 'batch_size': 2868, 'optimizer': 'RMSprop'}.
2026-06-20 03:10:25,980 - optuna.study.study - INFO - Trial 274 finished with values: [0.0016476626595356967, 0.00036630036630036635, 0.0009517607301477999] and parameters: {'n_layers': 2, 'embedding_dim': 64, 'lr': 0.0001403494181956302, 'lambda_val': 0.000491870809962855, 'batch_size': 3592, 'optimizer': 'Adam'}.
2026-06-20 03:13:10,192 - optuna.study.study - INFO - Trial 275 finished with values: [0.029472101196341915, 0.006238158393330808, 0.0171157053038049] and parameters: {'n_layers': 1, 'embedding_dim': 32, 'lr': 0.000778135007488856, 'lambda_val': 0.00042087486522763635, 'batch_size': 2115, 'optimizer': 'RMSprop'}.
2026-06-20 03:13:48,707 - experiment_functions - INFO - Early stopping at epoch 900. Best Metrics: (0.023551013021624625, 0.005159782745989642, 0.013192055240003275)
2026-06-20 03:13:49,178 - optuna.study.study - INFO - Trial 276 finished with values: [0.023551013021624625, 0.005159782745989642, 0.013192055240003275] and parameters: {'n_layers': 1, 'embedding_dim': 32, 'lr': 0.0020150870895911718, 'lambda_val': 0.02079883625749372, 'batch_size': 2036, 'optimizer': 'Adam'}.
2026-06-20 03:14:36,257 - experiment_functions - INFO - Early stopping at epoch 1050. Best Metrics: (0.01850058358735769, 0.0038587848932676518, 0.010688194581071897)
2026-06-20 03:14:36,329 - optuna.study.study - INFO - Trial 277 finished with values: [0.01850058358735769, 0.0038587848932676518, 0.010688194581071897] and parameters: {'n_layers': 2, 'embedding_dim': 64, 'lr': 0.0020150870895911718, 'lambda_val': 4.332711516457783e-05, 'batch_size': 1972, 'optimizer': 'RMSprop'}.
2026-06-20 03:15:10,594 - experiment_functions - INFO - Early stopping at epoch 650. Best Metrics: (0.02027509013707335, 0.004261399520020209, 0.011339103297409378)
2026-06-20 03:15:10,678 - optuna.study.study - INFO - Trial 278 finished with values: [0.02027509013707335, 0.004261399520020209, 0.011339103297409378] and parameters: {'n_layers': 3, 'embedding_dim': 128, 'lr': 0.0020150870895911718, 'lambda_val': 8.140511914605322e-06, 'batch_size': 3313, 'optimizer': 'Adam'}.
2026-06-20 03:15:33,041 - experiment_functions - INFO - Early stopping at epoch 500. Best Metrics: (0.0003932558861099686, 9.473285335354301e-05, 0.00025720143085018016)
2026-06-20 03:15:33,128 - optuna.study.study - INFO - Trial 279 finished with values: [0.0003932558861099686, 9.473285335354301e-05, 0.00025720143085018016] and parameters: {'n_layers': 1, 'embedding_dim': 32, 'lr': 0.000778135007488856, 'lambda_val': 4.388555938735431e-05, 'batch_size': 1852, 'optimizer': 'SGD'}.
2026-06-20 03:17:36,024 - experiment_functions - INFO - Early stopping at epoch 3050. Best Metrics: (0.0005996300110548356, 0.0001405203991410888, 0.00034786345747454817)
2026-06-20 03:17:36,107 - optuna.study.study - INFO - Trial 280 finished with values: [0.0005996300110548356, 0.0001405203991410888, 0.00034786345747454817] and parameters: {'n_layers': 1, 'embedding_dim': 32, 'lr': 8.150925957075906e-05, 'lambda_val': 0.0012818948155382058, 'batch_size': 3313, 'optimizer': 'Adam'}.
2026-06-20 03:18:20,702 - experiment_functions - INFO - Early stopping at epoch 1000. Best Metrics: (0.03181586882380121, 0.00659498547429582, 0.017979837518194593)
2026-06-20 03:18:20,792 - optuna.study.study - INFO - Trial 281 finished with values: [0.03181586882380121, 0.00659498547429582, 0.017979837518194593] and parameters: {'n_layers': 1, 'embedding_dim': 64, 'lr': 0.0020150870895911718, 'lambda_val': 0.0009898006558235256, 'batch_size': 3592, 'optimizer': 'Adam'}.
2026-06-20 03:21:06,401 - optuna.study.study - INFO - Trial 282 finished with values: [0.030072045560128362, 0.006348680055576607, 0.01716912013158255] and parameters: {'n_layers': 1, 'embedding_dim': 32, 'lr': 0.000778135007488856, 'lambda_val': 2.3360853516346427e-06, 'batch_size': 3313, 'optimizer': 'Adam'}.
2026-06-20 03:21:56,103 - experiment_functions - INFO - Early stopping at epoch 1150. Best Metrics: (0.028339930786381837, 0.006108690160414298, 0.01603782421092307)
2026-06-20 03:21:56,189 - optuna.study.study - INFO - Trial 283 finished with values: [0.028339930786381837, 0.006108690160414298, 0.01603782421092307] and parameters: {'n_layers': 1, 'embedding_dim': 32, 'lr': 0.0020150870895911718, 'lambda_val': 0.001032325420317978, 'batch_size': 1780, 'optimizer': 'RMSprop'}.
2026-06-20 03:24:54,170 - optuna.study.study - INFO - Trial 284 finished with values: [0.03014562319867702, 0.006427624100037894, 0.01726918137950905] and parameters: {'n_layers': 1, 'embedding_dim': 128, 'lr': 0.000778135007488856, 'lambda_val': 0.00042087486522763635, 'batch_size': 2115, 'optimizer': 'Adam'}.
2026-06-20 03:27:39,929 - optuna.study.study - INFO - Trial 285 finished with values: [0.03048301892970633, 0.006369205507136541, 0.01732067129308241] and parameters: {'n_layers': 1, 'embedding_dim': 32, 'lr': 0.000778135007488856, 'lambda_val': 6.4991616052424775e-06, 'batch_size': 3313, 'optimizer': 'Adam'}.
2026-06-20 03:29:12,453 - experiment_functions - INFO - Early stopping at epoch 2200. Best Metrics: (0.03246002816322186, 0.006711822660098523, 0.0185344097624218)
2026-06-20 03:29:12,540 - optuna.study.study - INFO - Trial 286 finished with values: [0.03246002816322186, 0.006711822660098523, 0.0185344097624218] and parameters: {'n_layers': 1, 'embedding_dim': 32, 'lr': 0.0020150870895911718, 'lambda_val': 0.0002323837681020684, 'batch_size': 1780, 'optimizer': 'Adam'}.
2026-06-20 03:30:02,093 - experiment_functions - INFO - Early stopping at epoch 1100. Best Metrics: (0.00811870120466938, 0.0019278135657446005, 0.004423832649394573)
2026-06-20 03:30:02,189 - optuna.study.study - INFO - Trial 287 finished with values: [0.00811870120466938, 0.0019278135657446005, 0.004423832649394573] and parameters: {'n_layers': 3, 'embedding_dim': 64, 'lr': 0.000778135007488856, 'lambda_val': 0.05981718280556572, 'batch_size': 1769, 'optimizer': 'Adam'}.
2026-06-20 03:30:34,343 - experiment_functions - INFO - Early stopping at epoch 750. Best Metrics: (0.0006435594151264877, 0.00013104711380573447, 0.0003458897688503491)
2026-06-20 03:30:34,427 - optuna.study.study - INFO - Trial 288 finished with values: [0.0006435594151264877, 0.00013104711380573447, 0.0003458897688503491] and parameters: {'n_layers': 1, 'embedding_dim': 32, 'lr': 3.2413975358193174e-05, 'lambda_val': 2.710386902101323e-06, 'batch_size': 3223, 'optimizer': 'Adam'}.
2026-06-20 03:30:59,550 - experiment_functions - INFO - Early stopping at epoch 550. Best Metrics: (0.007058646886251532, 0.0016199317923455856, 0.003876817458077571)
2026-06-20 03:30:59,636 - optuna.study.study - INFO - Trial 289 finished with values: [0.007058646886251532, 0.0016199317923455856, 0.003876817458077571] and parameters: {'n_layers': 2, 'embedding_dim': 32, 'lr': 0.037163895260797816, 'lambda_val': 2.710386902101323e-06, 'batch_size': 2036, 'optimizer': 'RMSprop'}.
2026-06-20 03:33:32,591 - experiment_functions - INFO - Early stopping at epoch 3400. Best Metrics: (0.03289144906800638, 0.006790766704559808, 0.018414078169299738)
2026-06-20 03:33:32,680 - optuna.study.study - INFO - Trial 290 finished with values: [0.03289144906800638, 0.006790766704559808, 0.018414078169299738] and parameters: {'n_layers': 1, 'embedding_dim': 128, 'lr': 0.0010742990196571252, 'lambda_val': 2.710386902101323e-06, 'batch_size': 2840, 'optimizer': 'RMSprop'}.
2026-06-20 03:36:06,751 - experiment_functions - INFO - Early stopping at epoch 3700. Best Metrics: (0.031026423304275016, 0.006591827712517369, 0.018030630226266053)
2026-06-20 03:36:06,839 - optuna.study.study - INFO - Trial 291 finished with values: [0.031026423304275016, 0.006591827712517369, 0.018030630226266053] and parameters: {'n_layers': 1, 'embedding_dim': 32, 'lr': 0.0010742990196571252, 'lambda_val': 4.332711516457783e-05, 'batch_size': 1780, 'optimizer': 'Adam'}.
2026-06-20 03:38:50,890 - optuna.study.study - INFO - Trial 292 finished with values: [0.027629662720945, 0.00592396109637489, 0.016056363288865578] and parameters: {'n_layers': 1, 'embedding_dim': 32, 'lr': 0.000778135007488856, 'lambda_val': 3.9435940439521e-06, 'batch_size': 1780, 'optimizer': 'Adam'}.
2026-06-20 03:39:39,680 - experiment_functions - INFO - Early stopping at epoch 950. Best Metrics: (0.030312582052179272, 0.006236579512441582, 0.01702885681677315)
