2026-06-22 17:52:10,975 - optuna.study.study - INFO - Trial 38 finished with values: [0.025227779099800857, 0.005513452065176204, 0.01409104904692082] and parameters: {'n_layers': 3, 'embedding_dim': 32, 'lr': 0.0004235044324291316, 'lambda_val': 5.455116561469672e-06, 'batch_size': 2562, 'optimizer': 'RMSprop'}.
2026-06-22 17:52:35,705 - experiment_functions - INFO - Early stopping at epoch 500. Best Metrics: (0.00048083793236540853, 0.00011525830491347732, 0.0002540971347957745)
2026-06-22 17:52:35,812 - optuna.study.study - INFO - Trial 39 finished with values: [0.00048083793236540853, 0.00011525830491347732, 0.0002540971347957745] and parameters: {'n_layers': 2, 'embedding_dim': 128, 'lr': 1.884866057555816e-05, 'lambda_val': 0.0003550571011473531, 'batch_size': 2523, 'optimizer': 'SGD'}.
2026-06-22 17:53:29,755 - experiment_functions - INFO - Early stopping at epoch 800. Best Metrics: (0.011201349291507822, 0.0023225337880510293, 0.006307980786707926)
2026-06-22 17:53:29,857 - optuna.study.study - INFO - Trial 40 finished with values: [0.011201349291507822, 0.0023225337880510293, 0.006307980786707926] and parameters: {'n_layers': 4, 'embedding_dim': 256, 'lr': 0.007439851699552315, 'lambda_val': 0.00021137740027626732, 'batch_size': 1605, 'optimizer': 'RMSprop'}.
2026-06-22 17:55:27,365 - experiment_functions - INFO - Early stopping at epoch 2600. Best Metrics: (0.0005629469081972636, 0.00011841606669192877, 0.00032877018763476676)
2026-06-22 17:55:27,490 - optuna.study.study - INFO - Trial 41 finished with values: [0.0005629469081972636, 0.00011841606669192877, 0.00032877018763476676] and parameters: {'n_layers': 4, 'embedding_dim': 64, 'lr': 1.4304563865313804e-05, 'lambda_val': 7.676602669038954e-06, 'batch_size': 690, 'optimizer': 'Adam'}.
2026-06-22 17:55:51,602 - experiment_functions - INFO - Early stopping at epoch 550. Best Metrics: (0.0005887913828731288, 0.00013420487558418593, 0.0003019752456222363)
2026-06-22 17:55:51,754 - optuna.study.study - INFO - Trial 42 finished with values: [0.0005887913828731288, 0.00013420487558418593, 0.0003019752456222363] and parameters: {'n_layers': 1, 'embedding_dim': 32, 'lr': 1.2149124528210133e-05, 'lambda_val': 3.111348028811644e-05, 'batch_size': 3616, 'optimizer': 'Adam'}.
2026-06-22 17:57:15,492 - experiment_functions - INFO - Early stopping at epoch 1750. Best Metrics: (0.0006646800981138757, 0.00017051913603637742, 0.0003718613192340679)
2026-06-22 17:57:15,597 - optuna.study.study - INFO - Trial 43 finished with values: [0.0006646800981138757, 0.00017051913603637742, 0.0003718613192340679] and parameters: {'n_layers': 1, 'embedding_dim': 256, 'lr': 9.080404936426801e-05, 'lambda_val': 2.483439311238426e-05, 'batch_size': 2714, 'optimizer': 'RMSprop'}.
2026-06-22 17:57:42,013 - experiment_functions - INFO - Early stopping at epoch 500. Best Metrics: (0.0005907020422808152, 0.0001231527093596059, 0.00033378419781575374)
2026-06-22 17:57:42,139 - optuna.study.study - INFO - Trial 44 finished with values: [0.0005907020422808152, 0.0001231527093596059, 0.00033378419781575374] and parameters: {'n_layers': 3, 'embedding_dim': 128, 'lr': 0.00015091314492823933, 'lambda_val': 0.00037425157142246347, 'batch_size': 3850, 'optimizer': 'SGD'}.
2026-06-22 18:00:27,934 - optuna.study.study - INFO - Trial 45 finished with values: [0.025500074760305847, 0.005387141594038146, 0.0143914241924214] and parameters: {'n_layers': 2, 'embedding_dim': 32, 'lr': 0.00045681378220125877, 'lambda_val': 0.0008491169466682814, 'batch_size': 1126, 'optimizer': 'RMSprop'}.
2026-06-22 18:01:18,437 - experiment_functions - INFO - Early stopping at epoch 1050. Best Metrics: (0.02052720058480749, 0.004566123531640774, 0.011984615814498407)
2026-06-22 18:01:18,535 - optuna.study.study - INFO - Trial 46 finished with values: [0.02052720058480749, 0.004566123531640774, 0.011984615814498407] and parameters: {'n_layers': 4, 'embedding_dim': 64, 'lr': 0.0005347670500185667, 'lambda_val': 0.0005262293458621268, 'batch_size': 3603, 'optimizer': 'RMSprop'}.
2026-06-22 18:02:57,395 - experiment_functions - INFO - Early stopping at epoch 1850. Best Metrics: (0.0005617786850669242, 0.0001373626373626374, 0.00029911490340450687)
2026-06-22 18:02:57,503 - optuna.study.study - INFO - Trial 47 finished with values: [0.0005617786850669242, 0.0001373626373626374, 0.00029911490340450687] and parameters: {'n_layers': 2, 'embedding_dim': 256, 'lr': 1.6808644731838652e-05, 'lambda_val': 7.910735824587925e-05, 'batch_size': 3663, 'optimizer': 'RMSprop'}.
2026-06-22 18:03:22,353 - experiment_functions - INFO - Early stopping at epoch 500. Best Metrics: (0.00042417993438139035, 0.00012315270935960593, 0.0002480420142418397)
2026-06-22 18:03:22,685 - optuna.study.study - INFO - Trial 48 finished with values: [0.00042417993438139035, 0.00012315270935960593, 0.0002480420142418397] and parameters: {'n_layers': 4, 'embedding_dim': 64, 'lr': 3.587091574507894e-05, 'lambda_val': 3.911102979821776e-06, 'batch_size': 855, 'optimizer': 'SGD'}.
2026-06-22 18:03:44,699 - experiment_functions - INFO - Early stopping at epoch 500. Best Metrics: (0.0005670344859365449, 0.0001310471138057345, 0.00027741833392364777)
2026-06-22 18:03:44,803 - optuna.study.study - INFO - Trial 49 finished with values: [0.0005670344859365449, 0.0001310471138057345, 0.00027741833392364777] and parameters: {'n_layers': 1, 'embedding_dim': 32, 'lr': 0.0002955417541914445, 'lambda_val': 0.027913527546168153, 'batch_size': 669, 'optimizer': 'SGD'}.
2026-06-22 18:04:08,707 - experiment_functions - INFO - Early stopping at epoch 500. Best Metrics: (0.0005813174739806834, 0.00011841606669192877, 0.00032290876645067637)
2026-06-22 18:04:08,804 - optuna.study.study - INFO - Trial 50 finished with values: [0.0005813174739806834, 0.00011841606669192877, 0.00032290876645067637] and parameters: {'n_layers': 3, 'embedding_dim': 64, 'lr': 0.00015091314492823933, 'lambda_val': 0.045001398543542404, 'batch_size': 1029, 'optimizer': 'SGD'}.
2026-06-22 18:04:55,115 - experiment_functions - INFO - Early stopping at epoch 900. Best Metrics: (0.011264564225335469, 0.002733042819249716, 0.006426697891590435)
2026-06-22 18:04:55,219 - optuna.study.study - INFO - Trial 51 finished with values: [0.011264564225335469, 0.002733042819249716, 0.006426697891590435] and parameters: {'n_layers': 3, 'embedding_dim': 128, 'lr': 0.0006129132477888526, 'lambda_val': 0.03546156124706191, 'batch_size': 3584, 'optimizer': 'Adam'}.
2026-06-22 18:05:19,273 - experiment_functions - INFO - Early stopping at epoch 500. Best Metrics: (0.0004764621448468394, 0.00010578501957812305, 0.0002580308229526497)
2026-06-22 18:05:19,384 - optuna.study.study - INFO - Trial 52 finished with values: [0.0004764621448468394, 0.00010578501957812305, 0.0002580308229526497] and parameters: {'n_layers': 2, 'embedding_dim': 96, 'lr': 0.03352035336414788, 'lambda_val': 1.0596404080078417e-05, 'batch_size': 3207, 'optimizer': 'SGD'}.
2026-06-22 18:08:19,684 - optuna.study.study - INFO - Trial 53 finished with values: [0.0004817728809872806, 0.00011052166224580018, 0.0003036123158616954] and parameters: {'n_layers': 4, 'embedding_dim': 64, 'lr': 3.587091574507894e-05, 'lambda_val': 3.911102979821776e-06, 'batch_size': 1239, 'optimizer': 'Adam'}.
2026-06-22 18:11:19,538 - optuna.study.study - INFO - Trial 54 finished with values: [0.0008552702734226825, 0.00019262346848553748, 0.0004351084527613447] and parameters: {'n_layers': 4, 'embedding_dim': 64, 'lr': 4.763564478976216e-05, 'lambda_val': 5.6035797096488025e-05, 'batch_size': 2804, 'optimizer': 'RMSprop'}.
2026-06-22 18:14:23,456 - optuna.study.study - INFO - Trial 55 finished with values: [0.019972992351932065, 0.004351395730706076, 0.011346214869417944] and parameters: {'n_layers': 4, 'embedding_dim': 64, 'lr': 0.0001854947590635186, 'lambda_val': 0.0001583029704774821, 'batch_size': 3422, 'optimizer': 'Adam'}.
2026-06-22 18:14:48,286 - experiment_functions - INFO - Early stopping at epoch 500. Best Metrics: (0.0007433650659330816, 0.00016420361247947455, 0.0004577327494711315)
2026-06-22 18:14:48,390 - optuna.study.study - INFO - Trial 56 finished with values: [0.0007433650659330816, 0.00016420361247947455, 0.0004577327494711315] and parameters: {'n_layers': 4, 'embedding_dim': 64, 'lr': 1.6815384693926122e-05, 'lambda_val': 0.059207403831256215, 'batch_size': 1429, 'optimizer': 'Adam'}.
2026-06-22 18:15:14,573 - experiment_functions - INFO - Early stopping at epoch 500. Best Metrics: (0.0005608377176232854, 0.00014052039914108877, 0.00035010825924967925)
2026-06-22 18:15:14,690 - optuna.study.study - INFO - Trial 57 finished with values: [0.0005608377176232854, 0.00014052039914108877, 0.00035010825924967925] and parameters: {'n_layers': 3, 'embedding_dim': 128, 'lr': 5.1848517027258106e-05, 'lambda_val': 0.0046143188628976345, 'batch_size': 2846, 'optimizer': 'SGD'}.
2026-06-22 18:18:11,209 - optuna.study.study - INFO - Trial 58 finished with values: [0.011162785987293602, 0.0023620058102816724, 0.0060072138535536505] and parameters: {'n_layers': 2, 'embedding_dim': 96, 'lr': 0.03277404265387728, 'lambda_val': 0.00036714980791779657, 'batch_size': 2159, 'optimizer': 'RMSprop'}.
2026-06-22 18:21:01,701 - optuna.study.study - INFO - Trial 59 finished with values: [0.02511029317851898, 0.005475558923834787, 0.014113476012124463] and parameters: {'n_layers': 3, 'embedding_dim': 32, 'lr': 0.0004235044324291316, 'lambda_val': 1.314986245861158e-06, 'batch_size': 2562, 'optimizer': 'RMSprop'}.
2026-06-22 18:21:24,696 - experiment_functions - INFO - Early stopping at epoch 500. Best Metrics: (0.00044986744337047787, 0.0001215738284703802, 0.00026330357969356805)
2026-06-22 18:21:24,804 - optuna.study.study - INFO - Trial 60 finished with values: [0.00044986744337047787, 0.0001215738284703802, 0.00026330357969356805] and parameters: {'n_layers': 4, 'embedding_dim': 32, 'lr': 0.029989240467009036, 'lambda_val': 3.911102979821776e-06, 'batch_size': 855, 'optimizer': 'SGD'}.
2026-06-22 18:21:57,614 - experiment_functions - INFO - Early stopping at epoch 650. Best Metrics: (0.0004717245234920645, 0.00012157382847038019, 0.0002675740910885543)
2026-06-22 18:21:57,719 - optuna.study.study - INFO - Trial 61 finished with values: [0.0004717245234920645, 0.00012157382847038019, 0.0002675740910885543] and parameters: {'n_layers': 1, 'embedding_dim': 256, 'lr': 9.080404936426801e-05, 'lambda_val': 0.0001583029704774821, 'batch_size': 515, 'optimizer': 'RMSprop'}.
2026-06-22 18:22:22,692 - experiment_functions - INFO - Early stopping at epoch 550. Best Metrics: (0.009706726696619367, 0.0022688518378173555, 0.005862237627839572)
2026-06-22 18:22:22,808 - optuna.study.study - INFO - Trial 62 finished with values: [0.009706726696619367, 0.0022688518378173555, 0.005862237627839572] and parameters: {'n_layers': 3, 'embedding_dim': 32, 'lr': 0.012994567788334225, 'lambda_val': 0.0008544209026262442, 'batch_size': 680, 'optimizer': 'Adam'}.
2026-06-22 18:22:45,744 - experiment_functions - INFO - Early stopping at epoch 500. Best Metrics: (0.00041297611736197833, 0.00010420613868889732, 0.00027170047998345217)
2026-06-22 18:22:45,849 - optuna.study.study - INFO - Trial 63 finished with values: [0.00041297611736197833, 0.00010420613868889732, 0.00027170047998345217] and parameters: {'n_layers': 2, 'embedding_dim': 64, 'lr': 0.0004663721030929633, 'lambda_val': 1.2347365400935575e-06, 'batch_size': 558, 'optimizer': 'SGD'}.
2026-06-22 18:23:10,983 - experiment_functions - INFO - Early stopping at epoch 550. Best Metrics: (0.008518662904733186, 0.0018472906403940888, 0.004779384192455398)
2026-06-22 18:23:11,086 - optuna.study.study - INFO - Trial 64 finished with values: [0.008518662904733186, 0.0018472906403940888, 0.004779384192455398] and parameters: {'n_layers': 3, 'embedding_dim': 32, 'lr': 0.03277404265387728, 'lambda_val': 6.388650961927443e-06, 'batch_size': 3947, 'optimizer': 'RMSprop'}.
2026-06-22 18:23:37,097 - experiment_functions - INFO - Early stopping at epoch 500. Best Metrics: (0.0004342823246521259, 9.631173424276872e-05, 0.00022603370458213092)
2026-06-22 18:23:37,378 - optuna.study.study - INFO - Trial 65 finished with values: [0.0004342823246521259, 9.631173424276872e-05, 0.00022603370458213092] and parameters: {'n_layers': 4, 'embedding_dim': 96, 'lr': 0.001706237377982523, 'lambda_val': 5.8421827248860175e-05, 'batch_size': 557, 'optimizer': 'SGD'}.
2026-06-22 18:24:00,283 - experiment_functions - INFO - Early stopping at epoch 500. Best Metrics: (0.00047735478606800944, 0.00010262725779967159, 0.0002500140794702968)
2026-06-22 18:24:00,389 - optuna.study.study - INFO - Trial 66 finished with values: [0.00047735478606800944, 0.00010262725779967159, 0.0002500140794702968] and parameters: {'n_layers': 3, 'embedding_dim': 32, 'lr': 0.003472067518317249, 'lambda_val': 0.0425098267465042, 'batch_size': 916, 'optimizer': 'SGD'}.
2026-06-22 18:24:41,121 - experiment_functions - INFO - Early stopping at epoch 850. Best Metrics: (0.007470614969052612, 0.0015694076038903625, 0.0040815283143928625)
2026-06-22 18:24:41,866 - optuna.study.study - INFO - Trial 67 finished with values: [0.007470614969052612, 0.0015694076038903625, 0.0040815283143928625] and parameters: {'n_layers': 4, 'embedding_dim': 64, 'lr': 0.007439851699552315, 'lambda_val': 0.0005262293458621268, 'batch_size': 3603, 'optimizer': 'RMSprop'}.
2026-06-22 18:25:11,000 - experiment_functions - INFO - Early stopping at epoch 550. Best Metrics: (0.01193164864741375, 0.0027062018441328787, 0.007155158883528975)
2026-06-22 18:25:11,101 - optuna.study.study - INFO - Trial 68 finished with values: [0.01193164864741375, 0.0027062018441328787, 0.007155158883528975] and parameters: {'n_layers': 4, 'embedding_dim': 96, 'lr': 0.001706237377982523, 'lambda_val': 5.6035797096488025e-05, 'batch_size': 577, 'optimizer': 'RMSprop'}.
2026-06-22 18:25:54,444 - experiment_functions - INFO - Early stopping at epoch 900. Best Metrics: (0.01537951795398982, 0.0034198560060629025, 0.00870308628493808)
2026-06-22 18:25:54,542 - optuna.study.study - INFO - Trial 69 finished with values: [0.01537951795398982, 0.0034198560060629025, 0.00870308628493808] and parameters: {'n_layers': 4, 'embedding_dim': 64, 'lr': 0.0006129132477888526, 'lambda_val': 0.008507655043799656, 'batch_size': 2857, 'optimizer': 'Adam'}.
2026-06-22 18:26:20,013 - experiment_functions - INFO - Early stopping at epoch 550. Best Metrics: (0.005201607628238667, 0.0011178476695718077, 0.0027609614075638465)
2026-06-22 18:26:20,118 - optuna.study.study - INFO - Trial 70 finished with values: [0.005201607628238667, 0.0011178476695718077, 0.0027609614075638465] and parameters: {'n_layers': 2, 'embedding_dim': 64, 'lr': 0.07534028152081396, 'lambda_val': 0.0005262293458621268, 'batch_size': 515, 'optimizer': 'Adam'}.
2026-06-22 18:26:42,173 - experiment_functions - INFO - Early stopping at epoch 500. Best Metrics: (0.0005218492539236589, 0.00010894278135657447, 0.00028614394193065857)
2026-06-22 18:26:42,270 - optuna.study.study - INFO - Trial 71 finished with values: [0.0005218492539236589, 0.00010894278135657447, 0.00028614394193065857] and parameters: {'n_layers': 1, 'embedding_dim': 32, 'lr': 0.0003497108729716595, 'lambda_val': 0.08584717251235822, 'batch_size': 3490, 'optimizer': 'RMSprop'}.
2026-06-22 18:29:09,589 - experiment_functions - INFO - Early stopping at epoch 3550. Best Metrics: (0.004845460238795384, 0.0012125805229253506, 0.0026747676154524874)
2026-06-22 18:29:09,727 - optuna.study.study - INFO - Trial 72 finished with values: [0.004845460238795384, 0.0012125805229253506, 0.0026747676154524874] and parameters: {'n_layers': 3, 'embedding_dim': 32, 'lr': 0.0006129132477888526, 'lambda_val': 0.09925702211545788, 'batch_size': 1029, 'optimizer': 'RMSprop'}.
2026-06-22 18:32:44,959 - optuna.study.study - INFO - Trial 73 finished with values: [0.014888764054068682, 0.003116710875331565, 0.00822525848947274] and parameters: {'n_layers': 2, 'embedding_dim': 256, 'lr': 0.0024593680412654663, 'lambda_val': 3.330662577836562e-06, 'batch_size': 2194, 'optimizer': 'RMSprop'}.
2026-06-22 18:35:34,026 - optuna.study.study - INFO - Trial 74 finished with values: [0.0215083116014872, 0.0049703170392825565, 0.012665054375493158] and parameters: {'n_layers': 1, 'embedding_dim': 64, 'lr': 0.00045681378220125877, 'lambda_val': 3.111348028811644e-05, 'batch_size': 3616, 'optimizer': 'Adam'}.
2026-06-22 18:39:08,434 - optuna.study.study - INFO - Trial 75 finished with values: [0.013869806704530883, 0.003088291019325502, 0.007634558707195238] and parameters: {'n_layers': 2, 'embedding_dim': 256, 'lr': 0.025936469453006126, 'lambda_val': 0.0008491169466682814, 'batch_size': 1052, 'optimizer': 'RMSprop'}.
2026-06-22 18:39:39,750 - experiment_functions - INFO - Early stopping at epoch 500. Best Metrics: (0.0006466752906342177, 0.00012631047113805733, 0.00034094812085504666)
2026-06-22 18:39:39,845 - optuna.study.study - INFO - Trial 76 finished with values: [0.0006466752906342177, 0.00012631047113805733, 0.00034094812085504666] and parameters: {'n_layers': 3, 'embedding_dim': 256, 'lr': 2.5834572176473275e-05, 'lambda_val': 1.314986245861158e-06, 'batch_size': 2501, 'optimizer': 'SGD'}.
2026-06-22 18:40:06,062 - experiment_functions - INFO - Early stopping at epoch 500. Best Metrics: (0.0005766680985793878, 0.00013578375647341166, 0.0002994572784651112)
2026-06-22 18:40:06,166 - optuna.study.study - INFO - Trial 77 finished with values: [0.0005766680985793878, 0.00013578375647341166, 0.0002994572784651112] and parameters: {'n_layers': 4, 'embedding_dim': 96, 'lr': 7.610270851230656e-05, 'lambda_val': 0.045001398543542404, 'batch_size': 1029, 'optimizer': 'RMSprop'}.
2026-06-22 18:41:56,768 - experiment_functions - INFO - Early stopping at epoch 1850. Best Metrics: (0.00781599131242069, 0.0015851964127826198, 0.004403157526390097)
2026-06-22 18:41:56,866 - optuna.study.study - INFO - Trial 78 finished with values: [0.00781599131242069, 0.0015851964127826198, 0.004403157526390097] and parameters: {'n_layers': 3, 'embedding_dim': 256, 'lr': 0.020577409972424625, 'lambda_val': 0.0001840895885210511, 'batch_size': 1605, 'optimizer': 'Adam'}.
2026-06-22 18:42:18,651 - experiment_functions - INFO - Early stopping at epoch 500. Best Metrics: (0.00048093304293665674, 0.00010578501957812305, 0.00022753591979865256)
2026-06-22 18:42:18,754 - optuna.study.study - INFO - Trial 79 finished with values: [0.00048093304293665674, 0.00010578501957812305, 0.00022753591979865256] and parameters: {'n_layers': 1, 'embedding_dim': 32, 'lr': 0.0002955417541914445, 'lambda_val': 0.027913527546168153, 'batch_size': 669, 'optimizer': 'Adam'}.
2026-06-22 18:42:46,514 - experiment_functions - INFO - Early stopping at epoch 500. Best Metrics: (0.0005319020535934292, 0.00012473159024883163, 0.00031160902847752813)
2026-06-22 18:42:46,656 - optuna.study.study - INFO - Trial 80 finished with values: [0.0005319020535934292, 0.00012473159024883163, 0.00031160902847752813] and parameters: {'n_layers': 4, 'embedding_dim': 128, 'lr': 0.006139504413522148, 'lambda_val': 0.008507655043799656, 'batch_size': 2122, 'optimizer': 'SGD'}.
2026-06-22 18:44:12,104 - experiment_functions - INFO - Early stopping at epoch 1700. Best Metrics: (0.021043087379603417, 0.004641909814323607, 0.011912426908050305)
2026-06-22 18:44:12,206 - optuna.study.study - INFO - Trial 81 finished with values: [0.021043087379603417, 0.004641909814323607, 0.011912426908050305] and parameters: {'n_layers': 4, 'embedding_dim': 96, 'lr': 0.0004235044324291316, 'lambda_val': 1.3168385230338204e-05, 'batch_size': 2714, 'optimizer': 'RMSprop'}.
2026-06-22 18:44:50,408 - experiment_functions - INFO - Early stopping at epoch 900. Best Metrics: (0.012581224711775366, 0.0026051534672224333, 0.006783972314535173)
2026-06-22 18:44:50,507 - optuna.study.study - INFO - Trial 82 finished with values: [0.012581224711775366, 0.0026051534672224333, 0.006783972314535173] and parameters: {'n_layers': 1, 'embedding_dim': 32, 'lr': 0.01131889341331997, 'lambda_val': 7.910735824587925e-05, 'batch_size': 3663, 'optimizer': 'RMSprop'}.
2026-06-22 18:45:14,644 - experiment_functions - INFO - Early stopping at epoch 500. Best Metrics: (0.0005088778359037948, 0.00011367942402425163, 0.0002743311746548695)
2026-06-22 18:45:14,748 - optuna.study.study - INFO - Trial 83 finished with values: [0.0005088778359037948, 0.00011367942402425163, 0.0002743311746548695] and parameters: {'n_layers': 2, 'embedding_dim': 96, 'lr': 0.0005565284238134104, 'lambda_val': 0.0057776798081195955, 'batch_size': 3851, 'optimizer': 'SGD'}.
2026-06-22 18:45:38,495 - experiment_functions - INFO - Early stopping at epoch 500. Best Metrics: (0.00048333029426939316, 0.00011525830491347733, 0.00027041146467024463)
2026-06-22 18:45:39,625 - optuna.study.study - INFO - Trial 84 finished with values: [0.00048333029426939316, 0.00011525830491347733, 0.00027041146467024463] and parameters: {'n_layers': 3, 'embedding_dim': 64, 'lr': 0.011209635781341688, 'lambda_val': 1.1148699214051002e-05, 'batch_size': 3601, 'optimizer': 'SGD'}.
2026-06-22 18:46:17,437 - experiment_functions - INFO - Early stopping at epoch 850. Best Metrics: (0.0030268363317016715, 0.0006536566881394468, 0.001687428043561156)
2026-06-22 18:46:17,545 - optuna.study.study - INFO - Trial 85 finished with values: [0.0030268363317016715, 0.0006536566881394468, 0.001687428043561156] and parameters: {'n_layers': 2, 'embedding_dim': 64, 'lr': 0.071444284346666, 'lambda_val': 0.03546156124706191, 'batch_size': 2776, 'optimizer': 'RMSprop'}.
2026-06-22 18:46:53,395 - experiment_functions - INFO - Early stopping at epoch 800. Best Metrics: (0.007274230786075961, 0.0015204622963243652, 0.003958885149862138)
