2026-06-19 21:45:13,144 - optuna.study.study - INFO - Trial 45 finished with values: [0.0005116929863327051, 0.00014052039914108882, 0.00031942990718417206] and parameters: {'n_layers': 2, 'embedding_dim': 64, 'lr': 8.052666057932894e-05, 'lambda_val': 0.08015884682233063, 'batch_size': 2153, 'optimizer': 'SGD'}.
2026-06-19 21:46:39,336 - experiment_functions - INFO - Early stopping at epoch 1600. Best Metrics: (0.0005648391807750216, 0.00012157382847038021, 0.0003077080962653252)
2026-06-19 21:46:39,413 - optuna.study.study - INFO - Trial 46 finished with values: [0.0005648391807750216, 0.00012157382847038021, 0.0003077080962653252] and parameters: {'n_layers': 2, 'embedding_dim': 256, 'lr': 3.847798019780164e-05, 'lambda_val': 7.730192456005456e-06, 'batch_size': 3448, 'optimizer': 'Adam'}.
2026-06-19 21:50:07,518 - optuna.study.study - INFO - Trial 47 finished with values: [0.017519294101860546, 0.003921940128836681, 0.010065144751965042] and parameters: {'n_layers': 4, 'embedding_dim': 128, 'lr': 0.00014111781740429823, 'lambda_val': 0.004140028155545859, 'batch_size': 3450, 'optimizer': 'RMSprop'}.
2026-06-19 21:50:34,047 - experiment_functions - INFO - Early stopping at epoch 550. Best Metrics: (0.00625705996206638, 0.001372047492737148, 0.0034957660380716257)
2026-06-19 21:50:34,110 - optuna.study.study - INFO - Trial 48 finished with values: [0.00625705996206638, 0.001372047492737148, 0.0034957660380716257] and parameters: {'n_layers': 2, 'embedding_dim': 64, 'lr': 0.058649988632434, 'lambda_val': 0.000491870809962855, 'batch_size': 3592, 'optimizer': 'Adam'}.
2026-06-19 21:50:58,508 - experiment_functions - INFO - Early stopping at epoch 500. Best Metrics: (0.00034373033597638874, 9.789061513199444e-05, 0.00021502624650852168)
2026-06-19 21:50:58,567 - optuna.study.study - INFO - Trial 49 finished with values: [0.00034373033597638874, 9.789061513199444e-05, 0.00021502624650852168] and parameters: {'n_layers': 3, 'embedding_dim': 64, 'lr': 5.952484182397491e-05, 'lambda_val': 0.0113074991449977, 'batch_size': 2931, 'optimizer': 'SGD'}.
2026-06-19 21:51:45,049 - experiment_functions - INFO - Early stopping at epoch 950. Best Metrics: (0.00047048738333660173, 0.00010262725779967159, 0.0002460341792208541)
2026-06-19 21:51:45,113 - optuna.study.study - INFO - Trial 50 finished with values: [0.00047048738333660173, 0.00010262725779967159, 0.0002460341792208541] and parameters: {'n_layers': 3, 'embedding_dim': 96, 'lr': 3.416891191903703e-05, 'lambda_val': 1.2287271335574109e-05, 'batch_size': 2432, 'optimizer': 'Adam'}.
2026-06-19 21:54:28,006 - optuna.study.study - INFO - Trial 51 finished with values: [0.031967116377999955, 0.006615510925855754, 0.018533715990842144] and parameters: {'n_layers': 1, 'embedding_dim': 32, 'lr': 0.000778135007488856, 'lambda_val': 2.710386902101323e-06, 'batch_size': 3313, 'optimizer': 'Adam'}.
2026-06-19 21:55:34,918 - experiment_functions - INFO - Early stopping at epoch 1400. Best Metrics: (0.0005463794169204867, 0.00012157382847038019, 0.00030933479195107463)
2026-06-19 21:55:34,996 - optuna.study.study - INFO - Trial 52 finished with values: [0.0005463794169204867, 0.00012157382847038019, 0.00030933479195107463] and parameters: {'n_layers': 3, 'embedding_dim': 128, 'lr': 2.6950922911120836e-05, 'lambda_val': 0.001032325420317978, 'batch_size': 1916, 'optimizer': 'RMSprop'}.
2026-06-19 21:58:15,984 - optuna.study.study - INFO - Trial 53 finished with values: [0.021351224583088663, 0.0048455854490337255, 0.012291014277902156] and parameters: {'n_layers': 1, 'embedding_dim': 32, 'lr': 0.0005537165984177899, 'lambda_val': 2.710386902101323e-06, 'batch_size': 3313, 'optimizer': 'Adam'}.
2026-06-19 21:58:38,892 - experiment_functions - INFO - Early stopping at epoch 500. Best Metrics: (0.0005419435134698049, 0.00011999494758115448, 0.0003031968004856258)
2026-06-19 21:58:38,982 - optuna.study.study - INFO - Trial 54 finished with values: [0.0005419435134698049, 0.00011999494758115448, 0.0003031968004856258] and parameters: {'n_layers': 1, 'embedding_dim': 128, 'lr': 0.0002533089697816253, 'lambda_val': 0.010682944162930358, 'batch_size': 1392, 'optimizer': 'SGD'}.
2026-06-19 21:59:01,110 - experiment_functions - INFO - Early stopping at epoch 500. Best Metrics: (0.0006005096521985892, 0.00013578375647341166, 0.0003253026791989296)
2026-06-19 21:59:01,189 - optuna.study.study - INFO - Trial 55 finished with values: [0.0006005096521985892, 0.00013578375647341166, 0.0003253026791989296] and parameters: {'n_layers': 2, 'embedding_dim': 32, 'lr': 0.0002564042441924174, 'lambda_val': 0.00042087486522763635, 'batch_size': 1342, 'optimizer': 'SGD'}.
2026-06-19 21:59:24,180 - experiment_functions - INFO - Early stopping at epoch 500. Best Metrics: (0.00043497891081548074, 0.00011999494758115448, 0.00025992888682303453)
2026-06-19 21:59:24,282 - optuna.study.study - INFO - Trial 56 finished with values: [0.00043497891081548074, 0.00011999494758115448, 0.00025992888682303453] and parameters: {'n_layers': 1, 'embedding_dim': 128, 'lr': 0.00014111781740429823, 'lambda_val': 0.004140028155545859, 'batch_size': 3450, 'optimizer': 'SGD'}.
2026-06-19 21:59:51,626 - experiment_functions - INFO - Early stopping at epoch 500. Best Metrics: (0.004841203162148869, 0.0010578501957812304, 0.00278951189901278)
2026-06-19 21:59:51,712 - optuna.study.study - INFO - Trial 57 finished with values: [0.004841203162148869, 0.0010578501957812304, 0.00278951189901278] and parameters: {'n_layers': 4, 'embedding_dim': 128, 'lr': 0.03802513876197062, 'lambda_val': 0.03673719280846919, 'batch_size': 1186, 'optimizer': 'RMSprop'}.
2026-06-19 22:00:24,146 - experiment_functions - INFO - Early stopping at epoch 700. Best Metrics: (0.00046338000339010184, 0.00011210054313502589, 0.00025007694692861187)
2026-06-19 22:00:24,246 - optuna.study.study - INFO - Trial 58 finished with values: [0.00046338000339010184, 0.00011210054313502589, 0.00025007694692861187] and parameters: {'n_layers': 2, 'embedding_dim': 96, 'lr': 2.329309370131588e-05, 'lambda_val': 0.005169176848886771, 'batch_size': 592, 'optimizer': 'Adam'}.
2026-06-19 22:03:04,094 - optuna.study.study - INFO - Trial 59 finished with values: [0.016388566329989238, 0.0037324744221295947, 0.009872634855830946] and parameters: {'n_layers': 1, 'embedding_dim': 32, 'lr': 0.0005537165984177899, 'lambda_val': 0.00019085919103594895, 'batch_size': 1916, 'optimizer': 'RMSprop'}.
2026-06-19 22:06:31,270 - optuna.study.study - INFO - Trial 60 finished with values: [0.0005818861947526324, 0.0001484148035872174, 0.00035853552348922977] and parameters: {'n_layers': 2, 'embedding_dim': 256, 'lr': 8.927314985164983e-05, 'lambda_val': 1.9968956567375666e-05, 'batch_size': 2967, 'optimizer': 'Adam'}.
2026-06-19 22:06:55,979 - experiment_functions - INFO - Early stopping at epoch 500. Best Metrics: (0.0004733977923410567, 0.00010578501957812305, 0.0002354509099996147)
2026-06-19 22:06:56,065 - optuna.study.study - INFO - Trial 61 finished with values: [0.0004733977923410567, 0.00010578501957812305, 0.0002354509099996147] and parameters: {'n_layers': 1, 'embedding_dim': 128, 'lr': 0.006060706805443645, 'lambda_val': 0.0006161413438795785, 'batch_size': 844, 'optimizer': 'SGD'}.
2026-06-19 22:07:50,749 - experiment_functions - INFO - Early stopping at epoch 1250. Best Metrics: (0.0005047504386277456, 0.00011367942402425162, 0.00029407401727289884)
2026-06-19 22:07:50,811 - optuna.study.study - INFO - Trial 62 finished with values: [0.0005047504386277456, 0.00011367942402425162, 0.00029407401727289884] and parameters: {'n_layers': 2, 'embedding_dim': 32, 'lr': 8.927314985164983e-05, 'lambda_val': 2.710386902101323e-06, 'batch_size': 3760, 'optimizer': 'Adam'}.
2026-06-19 22:08:41,697 - experiment_functions - INFO - Early stopping at epoch 1250. Best Metrics: (0.0004943070799944993, 0.00010736390046734874, 0.0002571172630885341)
2026-06-19 22:08:41,810 - optuna.study.study - INFO - Trial 63 finished with values: [0.0004943070799944993, 0.00010736390046734874, 0.0002571172630885341] and parameters: {'n_layers': 1, 'embedding_dim': 32, 'lr': 2.6432422776528013e-05, 'lambda_val': 4.332711516457783e-05, 'batch_size': 2711, 'optimizer': 'Adam'}.
2026-06-19 22:09:04,341 - experiment_functions - INFO - Early stopping at epoch 500. Best Metrics: (0.0005628957316608916, 0.00012315270935960593, 0.00028328106206556485)
2026-06-19 22:09:04,435 - optuna.study.study - INFO - Trial 64 finished with values: [0.0005628957316608916, 0.00012315270935960593, 0.00028328106206556485] and parameters: {'n_layers': 2, 'embedding_dim': 64, 'lr': 0.058649988632434, 'lambda_val': 0.000491870809962855, 'batch_size': 1501, 'optimizer': 'SGD'}.
2026-06-19 22:09:29,032 - experiment_functions - INFO - Early stopping at epoch 500. Best Metrics: (0.00036488295546126487, 9.315397246431729e-05, 0.00019738754099371745)
2026-06-19 22:09:29,103 - optuna.study.study - INFO - Trial 65 finished with values: [0.00036488295546126487, 9.315397246431729e-05, 0.00019738754099371745] and parameters: {'n_layers': 3, 'embedding_dim': 96, 'lr': 2.4543257217641807e-05, 'lambda_val': 2.074274685352545e-05, 'batch_size': 3711, 'optimizer': 'SGD'}.
2026-06-19 22:10:30,793 - experiment_functions - INFO - Early stopping at epoch 1500. Best Metrics: (0.0006006584783831532, 0.00012631047113805733, 0.0003699821978522555)
2026-06-19 22:10:30,883 - optuna.study.study - INFO - Trial 66 finished with values: [0.0006006584783831532, 0.00012631047113805733, 0.0003699821978522555] and parameters: {'n_layers': 3, 'embedding_dim': 32, 'lr': 2.6432422776528013e-05, 'lambda_val': 4.332711516457783e-05, 'batch_size': 1916, 'optimizer': 'Adam'}.
2026-06-19 22:10:55,123 - experiment_functions - INFO - Early stopping at epoch 500. Best Metrics: (0.000651907490125816, 0.0001389415182518631, 0.00036512596274937425)
2026-06-19 22:10:55,214 - optuna.study.study - INFO - Trial 67 finished with values: [0.000651907490125816, 0.0001389415182518631, 0.00036512596274937425] and parameters: {'n_layers': 2, 'embedding_dim': 128, 'lr': 0.0011589998578488729, 'lambda_val': 0.03673719280846919, 'batch_size': 3856, 'optimizer': 'SGD'}.
2026-06-19 22:11:18,559 - experiment_functions - INFO - Early stopping at epoch 500. Best Metrics: (0.0005368716683010137, 0.0001231527093596059, 0.0002913201297472275)
2026-06-19 22:11:18,644 - optuna.study.study - INFO - Trial 68 finished with values: [0.0005368716683010137, 0.0001231527093596059, 0.0002913201297472275] and parameters: {'n_layers': 2, 'embedding_dim': 96, 'lr': 0.00011459050556861053, 'lambda_val': 0.010682944162930358, 'batch_size': 1991, 'optimizer': 'SGD'}.
2026-06-19 22:14:28,161 - experiment_functions - INFO - Early stopping at epoch 3350. Best Metrics: (0.004125341515892745, 0.0008668056081849187, 0.002182271161157148)
2026-06-19 22:14:28,247 - optuna.study.study - INFO - Trial 69 finished with values: [0.004125341515892745, 0.0008668056081849187, 0.002182271161157148] and parameters: {'n_layers': 3, 'embedding_dim': 256, 'lr': 0.06050501040780534, 'lambda_val': 0.02455144220265296, 'batch_size': 2824, 'optimizer': 'Adam'}.
2026-06-19 22:17:05,743 - optuna.study.study - INFO - Trial 70 finished with values: [0.00969226813304532, 0.002335164835164835, 0.005837638705920418] and parameters: {'n_layers': 1, 'embedding_dim': 32, 'lr': 0.000783803297375069, 'lambda_val': 2.3360853516346427e-06, 'batch_size': 720, 'optimizer': 'Adam'}.
2026-06-19 22:17:42,596 - experiment_functions - INFO - Early stopping at epoch 750. Best Metrics: (0.0007153421623903384, 0.0001389415182518631, 0.0003560411495556298)
2026-06-19 22:17:42,673 - optuna.study.study - INFO - Trial 71 finished with values: [0.0007153421623903384, 0.0001389415182518631, 0.0003560411495556298] and parameters: {'n_layers': 1, 'embedding_dim': 256, 'lr': 5.421967766192562e-05, 'lambda_val': 0.00554085155497608, 'batch_size': 718, 'optimizer': 'Adam'}.
2026-06-19 22:18:04,524 - experiment_functions - INFO - Early stopping at epoch 500. Best Metrics: (0.0004169033958975826, 0.00011052166224580017, 0.00022742724152745932)
2026-06-19 22:18:04,617 - optuna.study.study - INFO - Trial 72 finished with values: [0.0004169033958975826, 0.00011052166224580017, 0.00022742724152745932] and parameters: {'n_layers': 2, 'embedding_dim': 32, 'lr': 0.03324331723681414, 'lambda_val': 2.3446625426292316e-06, 'batch_size': 1422, 'optimizer': 'SGD'}.
2026-06-19 22:18:34,440 - experiment_functions - INFO - Early stopping at epoch 550. Best Metrics: (0.009089373130240434, 0.001968864468864469, 0.00501152843326276)
2026-06-19 22:18:35,057 - optuna.study.study - INFO - Trial 73 finished with values: [0.009089373130240434, 0.001968864468864469, 0.00501152843326276] and parameters: {'n_layers': 4, 'embedding_dim': 128, 'lr': 0.008256478006191592, 'lambda_val': 1.9968956567375666e-05, 'batch_size': 3395, 'optimizer': 'Adam'}.
2026-06-19 22:21:35,914 - experiment_functions - INFO - Early stopping at epoch 3800. Best Metrics: (0.0006334729554697736, 0.0001215738284703802, 0.00032169352595813545)
2026-06-19 22:21:35,977 - optuna.study.study - INFO - Trial 74 finished with values: [0.0006334729554697736, 0.0001215738284703802, 0.00032169352595813545] and parameters: {'n_layers': 1, 'embedding_dim': 256, 'lr': 8.927314985164983e-05, 'lambda_val': 0.00019085919103594895, 'batch_size': 4063, 'optimizer': 'Adam'}.
2026-06-19 22:22:03,494 - experiment_functions - INFO - Early stopping at epoch 550. Best Metrics: (0.020284201127611284, 0.004417708728053556, 0.011619138898989197)
2026-06-19 22:22:03,553 - optuna.study.study - INFO - Trial 75 finished with values: [0.020284201127611284, 0.004417708728053556, 0.011619138898989197] and parameters: {'n_layers': 1, 'embedding_dim': 128, 'lr': 0.016177903196121036, 'lambda_val': 2.710386902101323e-06, 'batch_size': 3313, 'optimizer': 'Adam'}.
2026-06-19 22:22:46,285 - experiment_functions - INFO - Early stopping at epoch 850. Best Metrics: (0.016809606354859924, 0.0037214222559050153, 0.009280526689018511)
2026-06-19 22:22:46,370 - optuna.study.study - INFO - Trial 76 finished with values: [0.016809606354859924, 0.0037214222559050153, 0.009280526689018511] and parameters: {'n_layers': 3, 'embedding_dim': 128, 'lr': 0.000502008079869897, 'lambda_val': 0.007087934326548755, 'batch_size': 3335, 'optimizer': 'RMSprop'}.
2026-06-19 22:23:17,214 - experiment_functions - INFO - Early stopping at epoch 700. Best Metrics: (0.01639171584479452, 0.003561955286093217, 0.008730748784346699)
2026-06-19 22:23:17,301 - optuna.study.study - INFO - Trial 77 finished with values: [0.01639171584479452, 0.003561955286093217, 0.008730748784346699] and parameters: {'n_layers': 1, 'embedding_dim': 64, 'lr': 0.007729246782619305, 'lambda_val': 0.0006161413438795785, 'batch_size': 720, 'optimizer': 'Adam'}.
2026-06-19 22:23:55,078 - experiment_functions - INFO - Early stopping at epoch 850. Best Metrics: (0.018565464858819127, 0.003893520272830618, 0.010270863743657894)
2026-06-19 22:23:55,158 - optuna.study.study - INFO - Trial 78 finished with values: [0.018565464858819127, 0.003893520272830618, 0.010270863743657894] and parameters: {'n_layers': 4, 'embedding_dim': 32, 'lr': 0.0020150870895911718, 'lambda_val': 3.9435940439521e-06, 'batch_size': 2432, 'optimizer': 'Adam'}.
2026-06-19 22:24:40,152 - experiment_functions - INFO - Early stopping at epoch 1050. Best Metrics: (0.00442161281217497, 0.000986800555766073, 0.0023861721169419156)
2026-06-19 22:24:40,959 - optuna.study.study - INFO - Trial 79 finished with values: [0.00442161281217497, 0.000986800555766073, 0.0023861721169419156] and parameters: {'n_layers': 1, 'embedding_dim': 96, 'lr': 0.002485646663868356, 'lambda_val': 0.08015884682233063, 'batch_size': 1029, 'optimizer': 'RMSprop'}.
2026-06-19 22:25:02,545 - experiment_functions - INFO - Early stopping at epoch 500. Best Metrics: (0.00042119002280772, 8.841732979664016e-05, 0.00021433344229772143)
2026-06-19 22:25:02,631 - optuna.study.study - INFO - Trial 80 finished with values: [0.00042119002280772, 8.841732979664016e-05, 0.00021433344229772143] and parameters: {'n_layers': 1, 'embedding_dim': 32, 'lr': 0.0021789199982845944, 'lambda_val': 0.00554085155497608, 'batch_size': 3386, 'optimizer': 'SGD'}.
2026-06-19 22:25:29,864 - experiment_functions - INFO - Early stopping at epoch 500. Best Metrics: (0.000573761499668119, 0.00011525830491347733, 0.0003040199296335081)
2026-06-19 22:25:29,953 - optuna.study.study - INFO - Trial 81 finished with values: [0.000573761499668119, 0.00011525830491347733, 0.0003040199296335081] and parameters: {'n_layers': 4, 'embedding_dim': 128, 'lr': 0.00010811055123214613, 'lambda_val': 0.007087934326548755, 'batch_size': 4063, 'optimizer': 'Adam'}.
2026-06-19 22:25:55,471 - experiment_functions - INFO - Early stopping at epoch 500. Best Metrics: (0.000452062087720639, 9.946949602122017e-05, 0.00023421171095068844)
2026-06-19 22:25:55,546 - optuna.study.study - INFO - Trial 82 finished with values: [0.000452062087720639, 9.946949602122017e-05, 0.00023421171095068844] and parameters: {'n_layers': 3, 'embedding_dim': 128, 'lr': 0.00010811055123214613, 'lambda_val': 0.021705718960970212, 'batch_size': 3215, 'optimizer': 'RMSprop'}.
2026-06-19 22:28:09,073 - experiment_functions - INFO - Early stopping at epoch 2950. Best Metrics: (0.007900304417279192, 0.0017920298092711888, 0.0043826142459063855)
2026-06-19 22:28:09,168 - optuna.study.study - INFO - Trial 83 finished with values: [0.007900304417279192, 0.0017920298092711888, 0.0043826142459063855] and parameters: {'n_layers': 2, 'embedding_dim': 128, 'lr': 0.019271744274364268, 'lambda_val': 0.004140028155545859, 'batch_size': 3450, 'optimizer': 'RMSprop'}.
2026-06-19 22:28:59,338 - experiment_functions - INFO - Early stopping at epoch 1150. Best Metrics: (0.0306730155811597, 0.006367626626247317, 0.017520241260560718)
2026-06-19 22:28:59,456 - optuna.study.study - INFO - Trial 84 finished with values: [0.0306730155811597, 0.006367626626247317, 0.017520241260560718] and parameters: {'n_layers': 1, 'embedding_dim': 64, 'lr': 0.0020150870895911718, 'lambda_val': 0.000491870809962855, 'batch_size': 3592, 'optimizer': 'Adam'}.
2026-06-19 22:29:23,124 - experiment_functions - INFO - Early stopping at epoch 550. Best Metrics: (0.005196796585312026, 0.0013246810660603764, 0.0031018370249592283)
2026-06-19 22:29:23,217 - optuna.study.study - INFO - Trial 85 finished with values: [0.005196796585312026, 0.0013246810660603764, 0.0031018370249592283] and parameters: {'n_layers': 1, 'embedding_dim': 32, 'lr': 0.06748636109741066, 'lambda_val': 0.005169176848886771, 'batch_size': 592, 'optimizer': 'Adam'}.
2026-06-19 22:30:00,243 - experiment_functions - INFO - Early stopping at epoch 850. Best Metrics: (0.013199468135836903, 0.002835670077049388, 0.007300443497298941)
2026-06-19 22:30:00,325 - optuna.study.study - INFO - Trial 86 finished with values: [0.013199468135836903, 0.002835670077049388, 0.007300443497298941] and parameters: {'n_layers': 3, 'embedding_dim': 32, 'lr': 0.0028479344086524603, 'lambda_val': 1.6250517825264063e-06, 'batch_size': 1101, 'optimizer': 'RMSprop'}.
2026-06-19 22:30:49,741 - experiment_functions - INFO - Early stopping at epoch 1200. Best Metrics: (0.0005089511090570839, 0.00010578501957812305, 0.0002679374729174581)
2026-06-19 22:30:50,078 - optuna.study.study - INFO - Trial 87 finished with values: [0.0005089511090570839, 0.00010578501957812305, 0.0002679374729174581] and parameters: {'n_layers': 2, 'embedding_dim': 32, 'lr': 2.317197687122047e-05, 'lambda_val': 1.9968956567375666e-05, 'batch_size': 1801, 'optimizer': 'Adam'}.
2026-06-19 22:31:28,920 - experiment_functions - INFO - Early stopping at epoch 950. Best Metrics: (0.0005501529457888943, 0.00012157382847038021, 0.0002917660062254248)
2026-06-19 22:31:29,009 - optuna.study.study - INFO - Trial 88 finished with values: [0.0005501529457888943, 0.00012157382847038021, 0.0002917660062254248] and parameters: {'n_layers': 1, 'embedding_dim': 32, 'lr': 1.282187392173161e-05, 'lambda_val': 1.5421142459462738e-05, 'batch_size': 945, 'optimizer': 'Adam'}.
2026-06-19 22:32:01,582 - experiment_functions - INFO - Early stopping at epoch 750. Best Metrics: (0.009650622293222862, 0.001990968801313629, 0.005426153821885081)
2026-06-19 22:32:01,661 - optuna.study.study - INFO - Trial 89 finished with values: [0.009650622293222862, 0.001990968801313629, 0.005426153821885081] and parameters: {'n_layers': 3, 'embedding_dim': 32, 'lr': 0.02436228665325216, 'lambda_val': 5.1001581943832046e-05, 'batch_size': 1422, 'optimizer': 'RMSprop'}.
2026-06-19 22:33:23,904 - experiment_functions - INFO - Early stopping at epoch 1800. Best Metrics: (0.003922438139699103, 0.0008399646330680814, 0.002167383482070408)
2026-06-19 22:33:23,984 - optuna.study.study - INFO - Trial 90 finished with values: [0.003922438139699103, 0.0008399646330680814, 0.002167383482070408] and parameters: {'n_layers': 3, 'embedding_dim': 96, 'lr': 0.02088730245216097, 'lambda_val': 0.021705718960970212, 'batch_size': 3215, 'optimizer': 'RMSprop'}.
2026-06-19 22:35:55,152 - experiment_functions - INFO - Early stopping at epoch 3100. Best Metrics: (0.025941945838289487, 0.005546608563849943, 0.014606723901735973)
2026-06-19 22:35:55,225 - optuna.study.study - INFO - Trial 91 finished with values: [0.025941945838289487, 0.005546608563849943, 0.014606723901735973] and parameters: {'n_layers': 3, 'embedding_dim': 128, 'lr': 0.0006454805060704331, 'lambda_val': 2.3360853516346427e-06, 'batch_size': 720, 'optimizer': 'Adam'}.
2026-06-19 22:36:18,471 - experiment_functions - INFO - Early stopping at epoch 500. Best Metrics: (0.0003966406138348851, 9.315397246431729e-05, 0.0002427495092166237)
