2026-06-21 21:01:10,773 - optuna.study.study - INFO - Trial 23 finished with values: [0.0005725010249228596, 0.00014052039914108882, 0.00031976738176964567] and parameters: {'n_layers': 4, 'embedding_dim': 96, 'lr': 1.9571431597771756e-05, 'lambda_val': 0.0024936513206709724, 'batch_size': 1011, 'optimizer': 'SGD'}.
2026-06-21 21:02:12,663 - experiment_functions - INFO - Early stopping at epoch 1450. Best Metrics: (0.002834873351894781, 0.0007089175192623469, 0.001686660595680555)
2026-06-21 21:02:12,810 - optuna.study.study - INFO - Trial 24 finished with values: [0.002834873351894781, 0.0007089175192623469, 0.001686660595680555] and parameters: {'n_layers': 3, 'embedding_dim': 64, 'lr': 0.02949406551777706, 'lambda_val': 0.0012473891267695022, 'batch_size': 2253, 'optimizer': 'RMSprop'}.
2026-06-21 21:02:34,951 - experiment_functions - INFO - Early stopping at epoch 500. Best Metrics: (0.00045702103239009506, 0.00010104837691044589, 0.00023731648876826453)
2026-06-21 21:02:35,032 - optuna.study.study - INFO - Trial 25 finished with values: [0.00045702103239009506, 0.00010104837691044589, 0.00023731648876826453] and parameters: {'n_layers': 1, 'embedding_dim': 64, 'lr': 0.0006270248442778234, 'lambda_val': 0.00046199568837858963, 'batch_size': 2161, 'optimizer': 'SGD'}.
2026-06-21 21:05:26,285 - optuna.study.study - INFO - Trial 26 finished with values: [0.004407158237024538, 0.0010073260073260074, 0.0026173974961919704] and parameters: {'n_layers': 2, 'embedding_dim': 128, 'lr': 0.00045961706816760893, 'lambda_val': 3.195908557073349e-05, 'batch_size': 875, 'optimizer': 'RMSprop'}.
2026-06-21 21:05:50,090 - experiment_functions - INFO - Early stopping at epoch 500. Best Metrics: (0.0006538481343674145, 0.00014525704180876596, 0.0004052532230644514)
2026-06-21 21:05:50,176 - optuna.study.study - INFO - Trial 27 finished with values: [0.0006538481343674145, 0.00014525704180876596, 0.0004052532230644514] and parameters: {'n_layers': 1, 'embedding_dim': 256, 'lr': 7.288110445724019e-05, 'lambda_val': 0.00040026779877744327, 'batch_size': 603, 'optimizer': 'SGD'}.
2026-06-21 21:06:23,936 - experiment_functions - INFO - Early stopping at epoch 650. Best Metrics: (0.004422359627977759, 0.001132057597574839, 0.002535150099790657)
2026-06-21 21:06:24,010 - optuna.study.study - INFO - Trial 28 finished with values: [0.004422359627977759, 0.001132057597574839, 0.002535150099790657] and parameters: {'n_layers': 2, 'embedding_dim': 256, 'lr': 0.002520906950052724, 'lambda_val': 0.00948344093831909, 'batch_size': 3395, 'optimizer': 'RMSprop'}.
2026-06-21 21:07:28,821 - experiment_functions - INFO - Early stopping at epoch 1600. Best Metrics: (0.004916739211202019, 0.0011162687886825818, 0.0028950840287704335)
2026-06-21 21:07:28,903 - optuna.study.study - INFO - Trial 29 finished with values: [0.004916739211202019, 0.0011162687886825818, 0.0028950840287704335] and parameters: {'n_layers': 1, 'embedding_dim': 32, 'lr': 0.0016184592928403282, 'lambda_val': 3.846634604086237e-06, 'batch_size': 2771, 'optimizer': 'RMSprop'}.
2026-06-21 21:08:01,658 - experiment_functions - INFO - Early stopping at epoch 750. Best Metrics: (0.0029869300846594687, 0.0007941770872805355, 0.0018921286016620996)
2026-06-21 21:08:01,754 - optuna.study.study - INFO - Trial 30 finished with values: [0.0029869300846594687, 0.0007941770872805355, 0.0018921286016620996] and parameters: {'n_layers': 2, 'embedding_dim': 64, 'lr': 0.021368933246539355, 'lambda_val': 1.3101431082513097e-05, 'batch_size': 3119, 'optimizer': 'RMSprop'}.
2026-06-21 21:09:26,988 - experiment_functions - INFO - Early stopping at epoch 2050. Best Metrics: (0.01286986426056211, 0.0031956549197928513, 0.007868180793250218)
2026-06-21 21:09:27,063 - optuna.study.study - INFO - Trial 31 finished with values: [0.01286986426056211, 0.0031956549197928513, 0.007868180793250218] and parameters: {'n_layers': 4, 'embedding_dim': 32, 'lr': 0.000927601540662843, 'lambda_val': 0.0011958935689814394, 'batch_size': 1169, 'optimizer': 'RMSprop'}.
2026-06-21 21:11:21,242 - experiment_functions - INFO - Early stopping at epoch 2550. Best Metrics: (0.0005657532437182939, 0.00013420487558418593, 0.00035769176896682396)
2026-06-21 21:11:21,366 - optuna.study.study - INFO - Trial 32 finished with values: [0.0005657532437182939, 0.00013420487558418593, 0.00035769176896682396] and parameters: {'n_layers': 1, 'embedding_dim': 256, 'lr': 1.8254218277676355e-05, 'lambda_val': 2.971203887257013e-06, 'batch_size': 2194, 'optimizer': 'Adam'}.
2026-06-21 21:14:31,264 - optuna.study.study - INFO - Trial 33 finished with values: [0.0008268260555316683, 0.00017999242137173172, 0.0004667942049746431] and parameters: {'n_layers': 2, 'embedding_dim': 256, 'lr': 8.15325027025849e-05, 'lambda_val': 3.0436213185788746e-06, 'batch_size': 2642, 'optimizer': 'RMSprop'}.
2026-06-21 21:16:50,444 - experiment_functions - INFO - Early stopping at epoch 3600. Best Metrics: (0.005143646899621587, 0.0011636352153593533, 0.00314058459238141)
2026-06-21 21:16:50,532 - optuna.study.study - INFO - Trial 34 finished with values: [0.005143646899621587, 0.0011636352153593533, 0.00314058459238141] and parameters: {'n_layers': 1, 'embedding_dim': 32, 'lr': 0.0008655839340917536, 'lambda_val': 0.00018061190205868213, 'batch_size': 2335, 'optimizer': 'RMSprop'}.
2026-06-21 21:17:19,645 - experiment_functions - INFO - Early stopping at epoch 650. Best Metrics: (0.004878856545828758, 0.0012283693318176077, 0.002939989456568967)
2026-06-21 21:17:19,720 - optuna.study.study - INFO - Trial 35 finished with values: [0.004878856545828758, 0.0012283693318176077, 0.002939989456568967] and parameters: {'n_layers': 2, 'embedding_dim': 96, 'lr': 0.01035266447760807, 'lambda_val': 1.637764938555515e-05, 'batch_size': 1658, 'optimizer': 'Adam'}.
2026-06-21 21:20:08,908 - optuna.study.study - INFO - Trial 36 finished with values: [0.0013384711798208105, 0.00030788177339901484, 0.0007450403820817635] and parameters: {'n_layers': 3, 'embedding_dim': 96, 'lr': 0.00016720670630217003, 'lambda_val': 4.866899330600482e-06, 'batch_size': 1347, 'optimizer': 'Adam'}.
2026-06-21 21:20:39,566 - experiment_functions - INFO - Early stopping at epoch 650. Best Metrics: (0.008583397694213742, 0.0021804345080207147, 0.005260014194109403)
2026-06-21 21:20:40,351 - optuna.study.study - INFO - Trial 37 finished with values: [0.008583397694213742, 0.0021804345080207147, 0.005260014194109403] and parameters: {'n_layers': 4, 'embedding_dim': 96, 'lr': 0.0022550052450588096, 'lambda_val': 0.0005885182255384318, 'batch_size': 1925, 'optimizer': 'RMSprop'}.
2026-06-21 21:22:57,699 - experiment_functions - INFO - Early stopping at epoch 3350. Best Metrics: (0.005521819006287054, 0.001233105974485285, 0.0032806549124537233)
2026-06-21 21:22:57,766 - optuna.study.study - INFO - Trial 38 finished with values: [0.005521819006287054, 0.001233105974485285, 0.0032806549124537233] and parameters: {'n_layers': 1, 'embedding_dim': 128, 'lr': 0.0009291368086645142, 'lambda_val': 0.0003952312828567359, 'batch_size': 1429, 'optimizer': 'RMSprop'}.
2026-06-21 21:23:21,970 - experiment_functions - INFO - Early stopping at epoch 550. Best Metrics: (0.00277820696061053, 0.0006441834028040924, 0.001725379611286181)
2026-06-21 21:23:22,050 - optuna.study.study - INFO - Trial 39 finished with values: [0.00277820696061053, 0.0006441834028040924, 0.001725379611286181] and parameters: {'n_layers': 1, 'embedding_dim': 96, 'lr': 0.0462908781010168, 'lambda_val': 0.00016636579348901437, 'batch_size': 1343, 'optimizer': 'Adam'}.
2026-06-21 21:23:44,632 - experiment_functions - INFO - Early stopping at epoch 500. Best Metrics: (0.0005530900507170407, 0.00013578375647341166, 0.0003191330604213512)
2026-06-21 21:23:44,716 - optuna.study.study - INFO - Trial 40 finished with values: [0.0005530900507170407, 0.00013578375647341166, 0.0003191330604213512] and parameters: {'n_layers': 1, 'embedding_dim': 128, 'lr': 0.00014782323437585067, 'lambda_val': 0.0003253212221115303, 'batch_size': 1425, 'optimizer': 'SGD'}.
2026-06-21 21:24:46,177 - experiment_functions - INFO - Early stopping at epoch 1150. Best Metrics: (0.00330215715416173, 0.00081470253884047, 0.0018269250618736773)
2026-06-21 21:24:46,254 - optuna.study.study - INFO - Trial 41 finished with values: [0.00330215715416173, 0.00081470253884047, 0.0018269250618736773] and parameters: {'n_layers': 3, 'embedding_dim': 256, 'lr': 0.01594273164121028, 'lambda_val': 0.003986025781307465, 'batch_size': 2959, 'optimizer': 'RMSprop'}.
2026-06-21 21:25:25,457 - experiment_functions - INFO - Early stopping at epoch 900. Best Metrics: (0.0089782672994904, 0.0022262220538082607, 0.00538787335019285)
2026-06-21 21:25:25,573 - optuna.study.study - INFO - Trial 42 finished with values: [0.0089782672994904, 0.0022262220538082607, 0.00538787335019285] and parameters: {'n_layers': 3, 'embedding_dim': 32, 'lr': 0.0016253610840212534, 'lambda_val': 0.0009695798239708334, 'batch_size': 2998, 'optimizer': 'RMSprop'}.
2026-06-21 21:25:58,483 - experiment_functions - INFO - Early stopping at epoch 550. Best Metrics: (0.004530389823948517, 0.001098901098901099, 0.002684888019881167)
2026-06-21 21:25:58,623 - optuna.study.study - INFO - Trial 43 finished with values: [0.004530389823948517, 0.001098901098901099, 0.002684888019881167] and parameters: {'n_layers': 4, 'embedding_dim': 256, 'lr': 0.05397886496255383, 'lambda_val': 3.405137805260979e-05, 'batch_size': 1550, 'optimizer': 'Adam'}.
2026-06-21 21:26:25,539 - experiment_functions - INFO - Early stopping at epoch 600. Best Metrics: (0.00802858058701071, 0.0019625489453075663, 0.004862548170711232)
2026-06-21 21:26:25,624 - optuna.study.study - INFO - Trial 44 finished with values: [0.00802858058701071, 0.0019625489453075663, 0.004862548170711232] and parameters: {'n_layers': 4, 'embedding_dim': 32, 'lr': 0.0061929658043178674, 'lambda_val': 2.804628755433142e-06, 'batch_size': 2666, 'optimizer': 'Adam'}.
2026-06-21 21:28:11,903 - experiment_functions - INFO - Early stopping at epoch 2650. Best Metrics: (0.004439992730171803, 0.0010310092206643933, 0.0026805549556671946)
2026-06-21 21:28:11,981 - optuna.study.study - INFO - Trial 45 finished with values: [0.004439992730171803, 0.0010310092206643933, 0.0026805549556671946] and parameters: {'n_layers': 1, 'embedding_dim': 32, 'lr': 0.002500381067597905, 'lambda_val': 2.4229838845984194e-06, 'batch_size': 1291, 'optimizer': 'Adam'}.
2026-06-21 21:31:04,107 - optuna.study.study - INFO - Trial 46 finished with values: [0.0009792850711009369, 0.00019893899204244034, 0.0005781054331858587] and parameters: {'n_layers': 2, 'embedding_dim': 128, 'lr': 8.07195961580498e-05, 'lambda_val': 6.718633225790777e-05, 'batch_size': 3612, 'optimizer': 'Adam'}.
2026-06-21 21:31:43,627 - experiment_functions - INFO - Early stopping at epoch 800. Best Metrics: (0.00843360224069739, 0.0021188581533409124, 0.00507364617550381)
2026-06-21 21:31:43,703 - optuna.study.study - INFO - Trial 47 finished with values: [0.00843360224069739, 0.0021188581533409124, 0.00507364617550381] and parameters: {'n_layers': 4, 'embedding_dim': 128, 'lr': 0.0018366951231135393, 'lambda_val': 1.5907426738824427e-06, 'batch_size': 3335, 'optimizer': 'Adam'}.
2026-06-21 21:32:07,534 - experiment_functions - INFO - Early stopping at epoch 550. Best Metrics: (0.0004996923836657182, 0.00010578501957812304, 0.00024162175746215948)
2026-06-21 21:32:07,616 - optuna.study.study - INFO - Trial 48 finished with values: [0.0004996923836657182, 0.00010578501957812304, 0.00024162175746215948] and parameters: {'n_layers': 2, 'embedding_dim': 32, 'lr': 1.2389752617764073e-05, 'lambda_val': 0.008346397718366885, 'batch_size': 1964, 'optimizer': 'Adam'}.
2026-06-21 21:32:55,929 - experiment_functions - INFO - Early stopping at epoch 1150. Best Metrics: (0.0004806306904492961, 0.00012473159024883163, 0.00027120798113335336)
2026-06-21 21:32:56,012 - optuna.study.study - INFO - Trial 49 finished with values: [0.0004806306904492961, 0.00012473159024883163, 0.00027120798113335336] and parameters: {'n_layers': 2, 'embedding_dim': 64, 'lr': 2.8543211105834403e-05, 'lambda_val': 0.001218527231987149, 'batch_size': 856, 'optimizer': 'RMSprop'}.
2026-06-21 21:36:22,366 - optuna.study.study - INFO - Trial 50 finished with values: [0.007120740575352146, 0.0018109763799418971, 0.004468541807336551] and parameters: {'n_layers': 3, 'embedding_dim': 256, 'lr': 0.0004047353928477847, 'lambda_val': 4.866899330600482e-06, 'batch_size': 1550, 'optimizer': 'Adam'}.
2026-06-21 21:39:14,602 - optuna.study.study - INFO - Trial 51 finished with values: [0.0077602239524200995, 0.0019941265630920805, 0.004854196959515605] and parameters: {'n_layers': 2, 'embedding_dim': 128, 'lr': 0.0007483728360217162, 'lambda_val': 0.0005725041524092545, 'batch_size': 1389, 'optimizer': 'RMSprop'}.
2026-06-21 21:39:44,297 - experiment_functions - INFO - Early stopping at epoch 650. Best Metrics: (0.004215553363198145, 0.0010246936971074904, 0.002509432176596826)
2026-06-21 21:39:44,386 - optuna.study.study - INFO - Trial 52 finished with values: [0.004215553363198145, 0.0010246936971074904, 0.002509432176596826] and parameters: {'n_layers': 2, 'embedding_dim': 96, 'lr': 0.021368933246539355, 'lambda_val': 1.3101431082513097e-05, 'batch_size': 3119, 'optimizer': 'Adam'}.
2026-06-21 21:40:22,514 - experiment_functions - INFO - Early stopping at epoch 800. Best Metrics: (0.007634865197279394, 0.002047808513325755, 0.004723035969836273)
2026-06-21 21:40:22,600 - optuna.study.study - INFO - Trial 53 finished with values: [0.007634865197279394, 0.002047808513325755, 0.004723035969836273] and parameters: {'n_layers': 3, 'embedding_dim': 128, 'lr': 0.0011267070786255592, 'lambda_val': 0.002536649916066294, 'batch_size': 3477, 'optimizer': 'RMSprop'}.
2026-06-21 21:42:57,114 - experiment_functions - INFO - Early stopping at epoch 3800. Best Metrics: (0.0010292628666056715, 0.0002415687760515347, 0.0006576178542832998)
2026-06-21 21:42:57,192 - optuna.study.study - INFO - Trial 54 finished with values: [0.0010292628666056715, 0.0002415687760515347, 0.0006576178542832998] and parameters: {'n_layers': 1, 'embedding_dim': 96, 'lr': 0.00016720670630217003, 'lambda_val': 4.866899330600482e-06, 'batch_size': 1924, 'optimizer': 'Adam'}.
2026-06-21 21:43:50,355 - experiment_functions - INFO - Early stopping at epoch 1250. Best Metrics: (0.0038901735943956376, 0.0009299608437539473, 0.00241664820712999)
2026-06-21 21:43:50,437 - optuna.study.study - INFO - Trial 55 finished with values: [0.0038901735943956376, 0.0009299608437539473, 0.00241664820712999] and parameters: {'n_layers': 1, 'embedding_dim': 96, 'lr': 0.002500381067597905, 'lambda_val': 0.0049720585313741935, 'batch_size': 1539, 'optimizer': 'Adam'}.
2026-06-21 21:44:19,593 - experiment_functions - INFO - Early stopping at epoch 600. Best Metrics: (0.009430845090567658, 0.0023399014778325124, 0.005665443613522037)
2026-06-21 21:44:19,669 - optuna.study.study - INFO - Trial 56 finished with values: [0.009430845090567658, 0.0023399014778325124, 0.005665443613522037] and parameters: {'n_layers': 4, 'embedding_dim': 96, 'lr': 0.002103872362755323, 'lambda_val': 1.722399276566065e-05, 'batch_size': 3404, 'optimizer': 'RMSprop'}.
2026-06-21 21:45:43,924 - experiment_functions - INFO - Early stopping at epoch 2050. Best Metrics: (0.012311699545353064, 0.0029998736895288625, 0.007288880796501067)
2026-06-21 21:45:44,012 - optuna.study.study - INFO - Trial 57 finished with values: [0.012311699545353064, 0.0029998736895288625, 0.007288880796501067] and parameters: {'n_layers': 4, 'embedding_dim': 32, 'lr': 0.000927601540662843, 'lambda_val': 0.0009695798239708334, 'batch_size': 1802, 'optimizer': 'RMSprop'}.
2026-06-21 21:46:07,387 - experiment_functions - INFO - Early stopping at epoch 500. Best Metrics: (0.0006352091988345597, 0.00012473159024883163, 0.0004058812312925319)
2026-06-21 21:46:07,481 - optuna.study.study - INFO - Trial 58 finished with values: [0.0006352091988345597, 0.00012473159024883163, 0.0004058812312925319] and parameters: {'n_layers': 2, 'embedding_dim': 128, 'lr': 0.023307863507197542, 'lambda_val': 0.0009695798239708334, 'batch_size': 835, 'optimizer': 'SGD'}.
2026-06-21 21:46:32,873 - experiment_functions - INFO - Early stopping at epoch 550. Best Metrics: (0.00269984396294388, 0.0006457622836933181, 0.0016981256095627132)
2026-06-21 21:46:32,952 - optuna.study.study - INFO - Trial 59 finished with values: [0.00269984396294388, 0.0006457622836933181, 0.0016981256095627132] and parameters: {'n_layers': 1, 'embedding_dim': 128, 'lr': 0.0462908781010168, 'lambda_val': 0.00016636579348901437, 'batch_size': 1343, 'optimizer': 'Adam'}.
2026-06-21 21:46:58,020 - experiment_functions - INFO - Early stopping at epoch 500. Best Metrics: (0.0005530900507170407, 0.00013578375647341166, 0.0003191330604213512)
2026-06-21 21:46:58,142 - optuna.study.study - INFO - Trial 60 finished with values: [0.0005530900507170407, 0.00013578375647341166, 0.0003191330604213512] and parameters: {'n_layers': 4, 'embedding_dim': 128, 'lr': 0.0022550052450588096, 'lambda_val': 1.722399276566065e-05, 'batch_size': 3404, 'optimizer': 'SGD'}.
2026-06-21 21:47:32,815 - experiment_functions - INFO - Early stopping at epoch 700. Best Metrics: (0.0064147594064960164, 0.0016467727674624225, 0.003801967777415881)
2026-06-21 21:47:32,900 - optuna.study.study - INFO - Trial 61 finished with values: [0.0064147594064960164, 0.0016467727674624225, 0.003801967777415881] and parameters: {'n_layers': 4, 'embedding_dim': 128, 'lr': 0.0018366951231135393, 'lambda_val': 0.014586536668900354, 'batch_size': 2127, 'optimizer': 'Adam'}.
2026-06-21 21:48:16,343 - experiment_functions - INFO - Early stopping at epoch 1000. Best Metrics: (0.010217117681086633, 0.0025088417329796647, 0.0062999181251271585)
2026-06-21 21:48:16,420 - optuna.study.study - INFO - Trial 62 finished with values: [0.010217117681086633, 0.0025088417329796647, 0.0062999181251271585] and parameters: {'n_layers': 4, 'embedding_dim': 32, 'lr': 0.0018366951231135393, 'lambda_val': 0.0001313947543098742, 'batch_size': 2127, 'optimizer': 'Adam'}.
2026-06-21 21:51:04,574 - optuna.study.study - INFO - Trial 63 finished with values: [0.0034051099828944563, 0.0007768093974990528, 0.0021561418170097796] and parameters: {'n_layers': 2, 'embedding_dim': 128, 'lr': 0.00045961706816760893, 'lambda_val': 3.405137805260979e-05, 'batch_size': 584, 'optimizer': 'RMSprop'}.
2026-06-21 21:51:33,114 - experiment_functions - INFO - Early stopping at epoch 600. Best Metrics: (0.007886128388225914, 0.0020272830617658203, 0.00469436143717972)
2026-06-21 21:51:33,186 - optuna.study.study - INFO - Trial 64 finished with values: [0.007886128388225914, 0.0020272830617658203, 0.00469436143717972] and parameters: {'n_layers': 4, 'embedding_dim': 96, 'lr': 0.007083700783329076, 'lambda_val': 2.971203887257013e-06, 'batch_size': 2194, 'optimizer': 'Adam'}.
2026-06-21 21:52:48,810 - experiment_functions - INFO - Early stopping at epoch 1800. Best Metrics: (0.0006483571184062229, 0.00013578375647341163, 0.0003772206674732372)
2026-06-21 21:52:48,904 - optuna.study.study - INFO - Trial 65 finished with values: [0.0006483571184062229, 0.00013578375647341163, 0.0003772206674732372] and parameters: {'n_layers': 4, 'embedding_dim': 64, 'lr': 3.5778108426865314e-05, 'lambda_val': 0.011778775382543278, 'batch_size': 2883, 'optimizer': 'RMSprop'}.
2026-06-21 21:53:12,676 - experiment_functions - INFO - Early stopping at epoch 550. Best Metrics: (0.003703824596076644, 0.0008794366552987243, 0.002228012731276932)
2026-06-21 21:53:13,160 - optuna.study.study - INFO - Trial 66 finished with values: [0.003703824596076644, 0.0008794366552987243, 0.002228012731276932] and parameters: {'n_layers': 3, 'embedding_dim': 32, 'lr': 0.07022703709530892, 'lambda_val': 2.4229838845984194e-06, 'batch_size': 1291, 'optimizer': 'Adam'}.
2026-06-21 21:53:55,098 - experiment_functions - INFO - Early stopping at epoch 900. Best Metrics: (0.004314022998111661, 0.001048376910445876, 0.0026338406442574956)
2026-06-21 21:53:55,177 - optuna.study.study - INFO - Trial 67 finished with values: [0.004314022998111661, 0.001048376910445876, 0.0026338406442574956] and parameters: {'n_layers': 2, 'embedding_dim': 128, 'lr': 0.020122252634636587, 'lambda_val': 2.4229838845984194e-06, 'batch_size': 875, 'optimizer': 'RMSprop'}.
2026-06-21 21:54:49,688 - experiment_functions - INFO - Early stopping at epoch 1250. Best Metrics: (0.0005690823013790872, 0.00012631047113805733, 0.00034698718619003625)
2026-06-21 21:54:50,776 - optuna.study.study - INFO - Trial 68 finished with values: [0.0005690823013790872, 0.00012631047113805733, 0.00034698718619003625] and parameters: {'n_layers': 1, 'embedding_dim': 96, 'lr': 2.802800228165645e-05, 'lambda_val': 0.00040026779877744327, 'batch_size': 603, 'optimizer': 'RMSprop'}.
2026-06-21 21:57:03,406 - experiment_functions - INFO - Early stopping at epoch 3200. Best Metrics: (0.007090520309415512, 0.0016925603132499688, 0.004399863976911597)
2026-06-21 21:57:03,488 - optuna.study.study - INFO - Trial 69 finished with values: [0.007090520309415512, 0.0016925603132499688, 0.004399863976911597] and parameters: {'n_layers': 2, 'embedding_dim': 32, 'lr': 0.0012083421906459303, 'lambda_val': 4.919667530385041e-05, 'batch_size': 1658, 'optimizer': 'Adam'}.
2026-06-21 21:58:12,254 - experiment_functions - INFO - Early stopping at epoch 1550. Best Metrics: (0.005164615434929966, 0.001244158140709865, 0.0032206053183858373)
