2026-06-21 11:24:59,885 - optuna.study.study - INFO - Trial 18 finished with values: [0.00043813865068005424, 9.631173424276872e-05, 0.00021319988193736574] and parameters: {'n_layers': 1, 'embedding_dim': 96, 'lr': 0.007357688812743246, 'lambda_val': 5.5743123082898965e-06, 'batch_size': 3946, 'optimizer': 'SGD'}.
2026-06-21 11:25:22,223 - experiment_functions - INFO - Early stopping at epoch 500. Best Metrics: (0.0004126015635178805, 9.789061513199444e-05, 0.00026106032758623675)
2026-06-21 11:25:22,303 - optuna.study.study - INFO - Trial 19 finished with values: [0.0004126015635178805, 9.789061513199444e-05, 0.00026106032758623675] and parameters: {'n_layers': 2, 'embedding_dim': 64, 'lr': 0.0012563630384796742, 'lambda_val': 0.005266937405607763, 'batch_size': 3258, 'optimizer': 'SGD'}.
2026-06-21 11:26:09,164 - experiment_functions - INFO - Early stopping at epoch 1150. Best Metrics: (0.003202114328943853, 0.0008115447770620184, 0.0020515061975021243)
2026-06-21 11:26:09,239 - optuna.study.study - INFO - Trial 20 finished with values: [0.003202114328943853, 0.0008115447770620184, 0.0020515061975021243] and parameters: {'n_layers': 1, 'embedding_dim': 64, 'lr': 0.013581397875496413, 'lambda_val': 3.989101441779141e-05, 'batch_size': 1445, 'optimizer': 'RMSprop'}.
2026-06-21 11:26:31,058 - experiment_functions - INFO - Early stopping at epoch 500. Best Metrics: (0.0005371937778239813, 0.0001294682329165088, 0.0003014543283804825)
2026-06-21 11:26:31,153 - optuna.study.study - INFO - Trial 21 finished with values: [0.0005371937778239813, 0.0001294682329165088, 0.0003014543283804825] and parameters: {'n_layers': 2, 'embedding_dim': 32, 'lr': 1.3878237958972974e-05, 'lambda_val': 2.5140512134075115e-06, 'batch_size': 3057, 'optimizer': 'SGD'}.
2026-06-21 11:26:54,132 - experiment_functions - INFO - Early stopping at epoch 500. Best Metrics: (0.0004936629894642359, 0.00011367942402425162, 0.00027146958567550856)
2026-06-21 11:26:54,222 - optuna.study.study - INFO - Trial 22 finished with values: [0.0004936629894642359, 0.00011367942402425162, 0.00027146958567550856] and parameters: {'n_layers': 4, 'embedding_dim': 64, 'lr': 0.03514951740166241, 'lambda_val': 0.008776113824497833, 'batch_size': 2797, 'optimizer': 'SGD'}.
2026-06-21 11:27:16,375 - experiment_functions - INFO - Early stopping at epoch 500. Best Metrics: (0.00044567011827916034, 0.00010894278135657447, 0.0002389633594783314)
2026-06-21 11:27:16,470 - optuna.study.study - INFO - Trial 23 finished with values: [0.00044567011827916034, 0.00010894278135657447, 0.0002389633594783314] and parameters: {'n_layers': 4, 'embedding_dim': 32, 'lr': 0.002784668968823506, 'lambda_val': 0.020636284291637125, 'batch_size': 2683, 'optimizer': 'SGD'}.
2026-06-21 11:27:47,856 - experiment_functions - INFO - Early stopping at epoch 750. Best Metrics: (0.0022413723918152184, 0.0005620815965643552, 0.00140705340593959)
2026-06-21 11:27:47,932 - optuna.study.study - INFO - Trial 24 finished with values: [0.0022413723918152184, 0.0005620815965643552, 0.00140705340593959] and parameters: {'n_layers': 2, 'embedding_dim': 32, 'lr': 0.08892310059143241, 'lambda_val': 1.9888087490246264e-06, 'batch_size': 1354, 'optimizer': 'RMSprop'}.
2026-06-21 11:28:11,810 - experiment_functions - INFO - Early stopping at epoch 500. Best Metrics: (0.0005031990754173013, 0.00013262599469496023, 0.00026974112262616784)
2026-06-21 11:28:12,010 - optuna.study.study - INFO - Trial 25 finished with values: [0.0005031990754173013, 0.00013262599469496023, 0.00026974112262616784] and parameters: {'n_layers': 4, 'embedding_dim': 96, 'lr': 3.245026360919088e-05, 'lambda_val': 0.009612780753456295, 'batch_size': 655, 'optimizer': 'SGD'}.
2026-06-21 11:28:46,635 - experiment_functions - INFO - Early stopping at epoch 850. Best Metrics: (0.00047983645543466636, 0.00012631047113805733, 0.0002571680292787844)
2026-06-21 11:28:46,726 - optuna.study.study - INFO - Trial 26 finished with values: [0.00047983645543466636, 0.00012631047113805733, 0.0002571680292787844] and parameters: {'n_layers': 1, 'embedding_dim': 32, 'lr': 0.07247580119825957, 'lambda_val': 2.046617182894844e-06, 'batch_size': 1302, 'optimizer': 'SGD'}.
2026-06-21 11:29:09,140 - experiment_functions - INFO - Early stopping at epoch 500. Best Metrics: (0.0006154908818472886, 0.00013578375647341163, 0.00033730906156091684)
2026-06-21 11:29:09,220 - optuna.study.study - INFO - Trial 27 finished with values: [0.0006154908818472886, 0.00013578375647341163, 0.00033730906156091684] and parameters: {'n_layers': 1, 'embedding_dim': 128, 'lr': 1.872602905615164e-05, 'lambda_val': 0.03729773642264025, 'batch_size': 3545, 'optimizer': 'SGD'}.
2026-06-21 11:29:46,731 - experiment_functions - INFO - Early stopping at epoch 750. Best Metrics: (0.005680568226604354, 0.0014257294429708225, 0.0033406649224976275)
2026-06-21 11:29:46,824 - optuna.study.study - INFO - Trial 28 finished with values: [0.005680568226604354, 0.0014257294429708225, 0.0033406649224976275] and parameters: {'n_layers': 2, 'embedding_dim': 256, 'lr': 0.003566354885654931, 'lambda_val': 0.00037941540794106203, 'batch_size': 1006, 'optimizer': 'RMSprop'}.
2026-06-21 11:31:43,850 - experiment_functions - INFO - Early stopping at epoch 2750. Best Metrics: (0.0007912909168133574, 0.00017209801692560318, 0.00041932172586473025)
2026-06-21 11:31:43,929 - optuna.study.study - INFO - Trial 29 finished with values: [0.0007912909168133574, 0.00017209801692560318, 0.00041932172586473025] and parameters: {'n_layers': 2, 'embedding_dim': 128, 'lr': 7.88099396852753e-05, 'lambda_val': 4.0850305001077695e-05, 'batch_size': 1249, 'optimizer': 'Adam'}.
2026-06-21 11:32:06,248 - experiment_functions - INFO - Early stopping at epoch 500. Best Metrics: (0.0004484854528913703, 0.0001136794240242516, 0.0002477064073646047)
2026-06-21 11:32:06,330 - optuna.study.study - INFO - Trial 30 finished with values: [0.0004484854528913703, 0.0001136794240242516, 0.0002477064073646047] and parameters: {'n_layers': 1, 'embedding_dim': 128, 'lr': 2.952361695748848e-05, 'lambda_val': 0.000195897886863551, 'batch_size': 2446, 'optimizer': 'SGD'}.
2026-06-21 11:33:20,586 - experiment_functions - INFO - Early stopping at epoch 1750. Best Metrics: (0.002268464174644289, 0.0006157635467980296, 0.0013415405469263647)
2026-06-21 11:33:20,659 - optuna.study.study - INFO - Trial 31 finished with values: [0.002268464174644289, 0.0006157635467980296, 0.0013415405469263647] and parameters: {'n_layers': 4, 'embedding_dim': 64, 'lr': 0.02157046343541575, 'lambda_val': 0.06149046948558226, 'batch_size': 1273, 'optimizer': 'Adam'}.
2026-06-21 11:35:49,885 - experiment_functions - INFO - Early stopping at epoch 3800. Best Metrics: (0.0010531664018342839, 0.000251042061386889, 0.0006016120038231465)
2026-06-21 11:35:49,956 - optuna.study.study - INFO - Trial 32 finished with values: [0.0010531664018342839, 0.000251042061386889, 0.0006016120038231465] and parameters: {'n_layers': 1, 'embedding_dim': 64, 'lr': 0.00015958507489757123, 'lambda_val': 0.007446257202795785, 'batch_size': 3886, 'optimizer': 'Adam'}.
2026-06-21 11:36:13,236 - experiment_functions - INFO - Early stopping at epoch 500. Best Metrics: (0.0004660226861216144, 0.00010894278135657447, 0.00027196552225000956)
2026-06-21 11:36:13,319 - optuna.study.study - INFO - Trial 33 finished with values: [0.0004660226861216144, 0.00010894278135657447, 0.00027196552225000956] and parameters: {'n_layers': 2, 'embedding_dim': 128, 'lr': 1.3188233951077145e-05, 'lambda_val': 1.7152222521710991e-06, 'batch_size': 2282, 'optimizer': 'SGD'}.
2026-06-21 11:36:54,853 - experiment_functions - INFO - Early stopping at epoch 950. Best Metrics: (0.0026684216359850427, 0.0006883920677024125, 0.0015521224681423402)
2026-06-21 11:36:54,931 - optuna.study.study - INFO - Trial 34 finished with values: [0.0026684216359850427, 0.0006883920677024125, 0.0015521224681423402] and parameters: {'n_layers': 4, 'embedding_dim': 64, 'lr': 0.003959528614934683, 'lambda_val': 0.05740532737959386, 'batch_size': 2962, 'optimizer': 'RMSprop'}.
2026-06-21 11:39:37,819 - optuna.study.study - INFO - Trial 35 finished with values: [0.0007564544110980165, 0.00015630920803334596, 0.0004385480368942914] and parameters: {'n_layers': 1, 'embedding_dim': 128, 'lr': 7.754136385392551e-05, 'lambda_val': 2.1085708841093375e-05, 'batch_size': 2624, 'optimizer': 'Adam'}.
2026-06-21 11:40:06,501 - experiment_functions - INFO - Early stopping at epoch 550. Best Metrics: (0.0041029208886172825, 0.0010136415308829101, 0.0024435013143232873)
2026-06-21 11:40:06,601 - optuna.study.study - INFO - Trial 36 finished with values: [0.0041029208886172825, 0.0010136415308829101, 0.0024435013143232873] and parameters: {'n_layers': 2, 'embedding_dim': 256, 'lr': 0.03613526617195737, 'lambda_val': 1.8308866889687562e-05, 'batch_size': 3145, 'optimizer': 'Adam'}.
2026-06-21 11:40:35,945 - experiment_functions - INFO - Early stopping at epoch 650. Best Metrics: (0.009791625229012217, 0.0024188455222937983, 0.00587924294063922)
2026-06-21 11:40:36,040 - optuna.study.study - INFO - Trial 37 finished with values: [0.009791625229012217, 0.0024188455222937983, 0.00587924294063922] and parameters: {'n_layers': 4, 'embedding_dim': 64, 'lr': 0.0044739262759054006, 'lambda_val': 6.059814023598347e-06, 'batch_size': 1014, 'optimizer': 'Adam'}.
2026-06-21 11:41:11,031 - experiment_functions - INFO - Early stopping at epoch 800. Best Metrics: (0.0040214235626371015, 0.0008889099406340786, 0.002421311697707067)
2026-06-21 11:41:11,376 - optuna.study.study - INFO - Trial 38 finished with values: [0.0040214235626371015, 0.0008889099406340786, 0.002421311697707067] and parameters: {'n_layers': 1, 'embedding_dim': 128, 'lr': 0.01594862440926431, 'lambda_val': 5.534713206436078e-06, 'batch_size': 3241, 'optimizer': 'Adam'}.
2026-06-21 11:42:14,075 - experiment_functions - INFO - Early stopping at epoch 1450. Best Metrics: (0.0005255067278312094, 0.00011367942402425162, 0.00028038324617574005)
2026-06-21 11:42:14,156 - optuna.study.study - INFO - Trial 39 finished with values: [0.0005255067278312094, 0.00011367942402425162, 0.00028038324617574005] and parameters: {'n_layers': 2, 'embedding_dim': 128, 'lr': 5.099206990105861e-05, 'lambda_val': 0.00020075399870955442, 'batch_size': 943, 'optimizer': 'RMSprop'}.
2026-06-21 11:42:36,210 - experiment_functions - INFO - Early stopping at epoch 500. Best Metrics: (0.000564294175436876, 0.0001294682329165088, 0.0003005669722531662)
2026-06-21 11:42:36,302 - optuna.study.study - INFO - Trial 40 finished with values: [0.000564294175436876, 0.0001294682329165088, 0.0003005669722531662] and parameters: {'n_layers': 4, 'embedding_dim': 32, 'lr': 0.005581239414834897, 'lambda_val': 0.05465287526760994, 'batch_size': 1133, 'optimizer': 'SGD'}.
2026-06-21 11:43:00,107 - experiment_functions - INFO - Early stopping at epoch 550. Best Metrics: (0.0024663399502808897, 0.0005668182392320325, 0.0015608649313575296)
2026-06-21 11:43:00,190 - optuna.study.study - INFO - Trial 41 finished with values: [0.0024663399502808897, 0.0005668182392320325, 0.0015608649313575296] and parameters: {'n_layers': 1, 'embedding_dim': 64, 'lr': 0.03350700431021974, 'lambda_val': 0.0009137010718801951, 'batch_size': 1379, 'optimizer': 'Adam'}.
2026-06-21 11:43:30,281 - experiment_functions - INFO - Early stopping at epoch 700. Best Metrics: (0.003314441068246135, 0.0007657572312744726, 0.0020765392351078426)
2026-06-21 11:43:30,375 - optuna.study.study - INFO - Trial 42 finished with values: [0.003314441068246135, 0.0007657572312744726, 0.0020765392351078426] and parameters: {'n_layers': 1, 'embedding_dim': 96, 'lr': 0.01648090699159999, 'lambda_val': 3.514176335303042e-05, 'batch_size': 2410, 'optimizer': 'Adam'}.
2026-06-21 11:44:04,670 - experiment_functions - INFO - Early stopping at epoch 750. Best Metrics: (0.004049284376999496, 0.000997852721990653, 0.002436378864122711)
2026-06-21 11:44:05,231 - optuna.study.study - INFO - Trial 43 finished with values: [0.004049284376999496, 0.000997852721990653, 0.002436378864122711] and parameters: {'n_layers': 2, 'embedding_dim': 128, 'lr': 0.02060883241850729, 'lambda_val': 1.4121365572109793e-06, 'batch_size': 3199, 'optimizer': 'RMSprop'}.
2026-06-21 11:44:30,513 - experiment_functions - INFO - Early stopping at epoch 500. Best Metrics: (0.0005077059107976946, 0.00010736390046734875, 0.0003198010400262949)
2026-06-21 11:44:30,607 - optuna.study.study - INFO - Trial 44 finished with values: [0.0005077059107976946, 0.00010736390046734875, 0.0003198010400262949] and parameters: {'n_layers': 2, 'embedding_dim': 256, 'lr': 0.004051056337067167, 'lambda_val': 0.04903049365330234, 'batch_size': 1087, 'optimizer': 'SGD'}.
2026-06-21 11:44:52,512 - experiment_functions - INFO - Early stopping at epoch 500. Best Metrics: (0.0005064194235424197, 0.00012631047113805736, 0.0002795674776609846)
2026-06-21 11:44:52,594 - optuna.study.study - INFO - Trial 45 finished with values: [0.0005064194235424197, 0.00012631047113805736, 0.0002795674776609846] and parameters: {'n_layers': 3, 'embedding_dim': 32, 'lr': 0.00020536131884751725, 'lambda_val': 0.04794062530500566, 'batch_size': 3626, 'optimizer': 'RMSprop'}.
2026-06-21 11:45:54,524 - experiment_functions - INFO - Early stopping at epoch 1250. Best Metrics: (0.00604023450998632, 0.001488884678539851, 0.00364266263451486)
2026-06-21 11:45:54,622 - optuna.study.study - INFO - Trial 46 finished with values: [0.00604023450998632, 0.001488884678539851, 0.00364266263451486] and parameters: {'n_layers': 2, 'embedding_dim': 256, 'lr': 0.0019529911061502276, 'lambda_val': 2.854699329527242e-06, 'batch_size': 3322, 'optimizer': 'Adam'}.
2026-06-21 11:47:07,790 - experiment_functions - INFO - Early stopping at epoch 1750. Best Metrics: (0.0035210705040359678, 0.0009110142730832387, 0.0020003532822558527)
2026-06-21 11:47:07,879 - optuna.study.study - INFO - Trial 47 finished with values: [0.0035210705040359678, 0.0009110142730832387, 0.0020003532822558527] and parameters: {'n_layers': 1, 'embedding_dim': 128, 'lr': 0.0036259653456223104, 'lambda_val': 0.05773981198429287, 'batch_size': 975, 'optimizer': 'Adam'}.
2026-06-21 11:49:44,189 - optuna.study.study - INFO - Trial 48 finished with values: [0.001530024579512541, 0.00034103827207275484, 0.001002150152980043] and parameters: {'n_layers': 3, 'embedding_dim': 32, 'lr': 0.00025078027021304685, 'lambda_val': 2.5744682794480333e-06, 'batch_size': 783, 'optimizer': 'RMSprop'}.
2026-06-21 11:50:05,816 - experiment_functions - INFO - Early stopping at epoch 500. Best Metrics: (0.0005199889057490409, 0.0001136794240242516, 0.00026382631054378995)
2026-06-21 11:50:05,887 - optuna.study.study - INFO - Trial 49 finished with values: [0.0005199889057490409, 0.0001136794240242516, 0.00026382631054378995] and parameters: {'n_layers': 3, 'embedding_dim': 32, 'lr': 3.0116561506929645e-05, 'lambda_val': 0.00012623020837242719, 'batch_size': 1649, 'optimizer': 'SGD'}.
2026-06-21 11:50:31,036 - experiment_functions - INFO - Early stopping at epoch 550. Best Metrics: (0.0048020116725516464, 0.0011810029051408364, 0.0028265966789136066)
2026-06-21 11:50:31,127 - optuna.study.study - INFO - Trial 50 finished with values: [0.0048020116725516464, 0.0011810029051408364, 0.0028265966789136066] and parameters: {'n_layers': 3, 'embedding_dim': 64, 'lr': 0.03212361641248932, 'lambda_val': 4.0850305001077695e-05, 'batch_size': 3893, 'optimizer': 'Adam'}.
2026-06-21 11:53:16,907 - optuna.study.study - INFO - Trial 51 finished with values: [0.008472734459685544, 0.0021583301755715547, 0.005301493034018179] and parameters: {'n_layers': 3, 'embedding_dim': 64, 'lr': 0.0006104134330921928, 'lambda_val': 2.854699329527242e-06, 'batch_size': 3322, 'optimizer': 'Adam'}.
2026-06-21 11:53:43,395 - experiment_functions - INFO - Early stopping at epoch 550. Best Metrics: (0.006340870404401393, 0.0016325628394593913, 0.0036432950252871027)
2026-06-21 11:53:43,499 - optuna.study.study - INFO - Trial 52 finished with values: [0.006340870404401393, 0.0016325628394593913, 0.0036432950252871027] and parameters: {'n_layers': 3, 'embedding_dim': 128, 'lr': 0.00599824014211808, 'lambda_val': 1.6213630924331792e-06, 'batch_size': 3386, 'optimizer': 'RMSprop'}.
2026-06-21 11:54:11,060 - experiment_functions - INFO - Early stopping at epoch 550. Best Metrics: (0.0061738005358879895, 0.001522041177213591, 0.0035210335164845585)
2026-06-21 11:54:11,148 - optuna.study.study - INFO - Trial 53 finished with values: [0.0061738005358879895, 0.001522041177213591, 0.0035210335164845585] and parameters: {'n_layers': 4, 'embedding_dim': 128, 'lr': 0.007517511425007554, 'lambda_val': 1.6213630924331792e-06, 'batch_size': 2732, 'optimizer': 'RMSprop'}.
2026-06-21 11:54:38,578 - experiment_functions - INFO - Early stopping at epoch 550. Best Metrics: (0.004701051051748441, 0.0011731085006947077, 0.002625670442318144)
2026-06-21 11:54:38,650 - optuna.study.study - INFO - Trial 54 finished with values: [0.004701051051748441, 0.0011731085006947077, 0.002625670442318144] and parameters: {'n_layers': 4, 'embedding_dim': 128, 'lr': 0.018560168848895237, 'lambda_val': 0.003799960425456179, 'batch_size': 2642, 'optimizer': 'Adam'}.
2026-06-21 11:55:00,254 - experiment_functions - INFO - Early stopping at epoch 500. Best Metrics: (0.0005035026962987973, 0.00011841606669192877, 0.0002732258132631482)
2026-06-21 11:55:00,338 - optuna.study.study - INFO - Trial 55 finished with values: [0.0005035026962987973, 0.00011841606669192877, 0.0002732258132631482] and parameters: {'n_layers': 1, 'embedding_dim': 64, 'lr': 0.0007376776486185891, 'lambda_val': 2.046617182894844e-06, 'batch_size': 2662, 'optimizer': 'SGD'}.
2026-06-21 11:55:27,000 - experiment_functions - INFO - Early stopping at epoch 600. Best Metrics: (0.003470468586334904, 0.0007578628268283441, 0.002056187602792919)
2026-06-21 11:55:27,078 - optuna.study.study - INFO - Trial 56 finished with values: [0.003470468586334904, 0.0007578628268283441, 0.002056187602792919] and parameters: {'n_layers': 1, 'embedding_dim': 96, 'lr': 0.02060883241850729, 'lambda_val': 1.4121365572109793e-06, 'batch_size': 3806, 'optimizer': 'Adam'}.
2026-06-21 11:57:10,043 - experiment_functions - INFO - Early stopping at epoch 2500. Best Metrics: (0.0029577009589711865, 0.0008194391815081471, 0.0017466917091367483)
2026-06-21 11:57:10,117 - optuna.study.study - INFO - Trial 57 finished with values: [0.0029577009589711865, 0.0008194391815081471, 0.0017466917091367483] and parameters: {'n_layers': 1, 'embedding_dim': 128, 'lr': 0.07247580119825957, 'lambda_val': 0.06133149598850734, 'batch_size': 3149, 'optimizer': 'RMSprop'}.
2026-06-21 11:58:09,390 - experiment_functions - INFO - Early stopping at epoch 1500. Best Metrics: (0.0043860641902586355, 0.001042061386888973, 0.002684078808044981)
2026-06-21 11:58:09,464 - optuna.study.study - INFO - Trial 58 finished with values: [0.0043860641902586355, 0.001042061386888973, 0.002684078808044981] and parameters: {'n_layers': 1, 'embedding_dim': 32, 'lr': 0.0019529911061502276, 'lambda_val': 1.9888087490246264e-06, 'batch_size': 3322, 'optimizer': 'RMSprop'}.
2026-06-21 12:00:45,130 - optuna.study.study - INFO - Trial 59 finished with values: [0.004524806635172899, 0.000982063913098396, 0.0028341114137069583] and parameters: {'n_layers': 2, 'embedding_dim': 32, 'lr': 0.0004419346142273276, 'lambda_val': 5.895416911308384e-06, 'batch_size': 1653, 'optimizer': 'RMSprop'}.
2026-06-21 12:01:10,380 - experiment_functions - INFO - Early stopping at epoch 500. Best Metrics: (0.00041311010361003955, 9.315397246431729e-05, 0.0002215172836842858)
2026-06-21 12:01:10,461 - optuna.study.study - INFO - Trial 60 finished with values: [0.00041311010361003955, 9.315397246431729e-05, 0.0002215172836842858] and parameters: {'n_layers': 2, 'embedding_dim': 256, 'lr': 0.026759733485766147, 'lambda_val': 2.706498615300197e-06, 'batch_size': 4070, 'optimizer': 'SGD'}.
2026-06-21 12:01:33,609 - experiment_functions - INFO - Early stopping at epoch 500. Best Metrics: (0.0005297366448262368, 0.00012157382847038021, 0.00029176038980854066)
2026-06-21 12:01:33,708 - optuna.study.study - INFO - Trial 61 finished with values: [0.0005297366448262368, 0.00012157382847038021, 0.00029176038980854066] and parameters: {'n_layers': 4, 'embedding_dim': 64, 'lr': 7.754136385392551e-05, 'lambda_val': 0.06149046948558226, 'batch_size': 1300, 'optimizer': 'Adam'}.
2026-06-21 12:01:57,423 - experiment_functions - INFO - Early stopping at epoch 550. Best Metrics: (0.004038678062960025, 0.0010025893646583304, 0.0024473078267824547)
2026-06-21 12:01:57,508 - optuna.study.study - INFO - Trial 62 finished with values: [0.004038678062960025, 0.0010025893646583304, 0.0024473078267824547] and parameters: {'n_layers': 3, 'embedding_dim': 32, 'lr': 0.018560168848895237, 'lambda_val': 2.5744682794480333e-06, 'batch_size': 2399, 'optimizer': 'RMSprop'}.
2026-06-21 12:02:20,209 - experiment_functions - INFO - Early stopping at epoch 500. Best Metrics: (0.0004809816930917632, 0.00010578501957812304, 0.0002678316069795246)
2026-06-21 12:02:20,301 - optuna.study.study - INFO - Trial 63 finished with values: [0.0004809816930917632, 0.00010578501957812304, 0.0002678316069795246] and parameters: {'n_layers': 2, 'embedding_dim': 96, 'lr': 2.3622017272377703e-05, 'lambda_val': 0.00037941540794106203, 'batch_size': 1006, 'optimizer': 'SGD'}.
2026-06-21 12:02:48,199 - experiment_functions - INFO - Early stopping at epoch 600. Best Metrics: (0.006969779682001524, 0.0017920298092711886, 0.004303538556029731)
