2026-06-21 00:09:41,538 - optuna.study.study - INFO - Trial 134 finished with values: [0.010678773627725058, 0.002622521157003916, 0.006406066030340318] and parameters: {'n_layers': 4, 'embedding_dim': 96, 'lr': 0.0006460981719089114, 'lambda_val': 5.82846385984691e-05, 'batch_size': 2119, 'optimizer': 'Adam'}.
2026-06-21 00:10:16,716 - experiment_functions - INFO - Early stopping at epoch 800. Best Metrics: (0.0073993933360434585, 0.0018851837817355059, 0.004556394534943363)
2026-06-21 00:10:16,818 - optuna.study.study - INFO - Trial 135 finished with values: [0.0073993933360434585, 0.0018851837817355059, 0.004556394534943363] and parameters: {'n_layers': 3, 'embedding_dim': 64, 'lr': 0.0024244689414321787, 'lambda_val': 0.004241607037560995, 'batch_size': 1367, 'optimizer': 'Adam'}.
2026-06-21 00:12:50,764 - experiment_functions - INFO - Early stopping at epoch 3850. Best Metrics: (0.008197381126796653, 0.002106227106227106, 0.00500713356820307)
2026-06-21 00:12:50,864 - optuna.study.study - INFO - Trial 136 finished with values: [0.008197381126796653, 0.002106227106227106, 0.00500713356820307] and parameters: {'n_layers': 3, 'embedding_dim': 32, 'lr': 0.0006604859729474348, 'lambda_val': 5.629872101647515e-05, 'batch_size': 3338, 'optimizer': 'Adam'}.
2026-06-21 00:13:54,266 - experiment_functions - INFO - Early stopping at epoch 1500. Best Metrics: (0.0023529056394113327, 0.000607869142351901, 0.0013674440799963923)
2026-06-21 00:13:54,371 - optuna.study.study - INFO - Trial 137 finished with values: [0.0023529056394113327, 0.000607869142351901, 0.0013674440799963923] and parameters: {'n_layers': 3, 'embedding_dim': 64, 'lr': 0.022624420343631716, 'lambda_val': 0.0968617096434626, 'batch_size': 1086, 'optimizer': 'Adam'}.
2026-06-21 00:14:27,858 - experiment_functions - INFO - Early stopping at epoch 750. Best Metrics: (0.0057883068929679045, 0.0014730958696475937, 0.0034832564488294004)
2026-06-21 00:14:28,324 - optuna.study.study - INFO - Trial 138 finished with values: [0.0057883068929679045, 0.0014730958696475937, 0.0034832564488294004] and parameters: {'n_layers': 2, 'embedding_dim': 64, 'lr': 0.003096198742357918, 'lambda_val': 2.2580566177048725e-06, 'batch_size': 3764, 'optimizer': 'RMSprop'}.
2026-06-21 00:14:51,706 - experiment_functions - INFO - Early stopping at epoch 500. Best Metrics: (0.00048575108520789963, 0.00011683718580270305, 0.0002573157254329313)
2026-06-21 00:14:51,884 - optuna.study.study - INFO - Trial 139 finished with values: [0.00048575108520789963, 0.00011683718580270305, 0.0002573157254329313] and parameters: {'n_layers': 3, 'embedding_dim': 64, 'lr': 0.0006101961971381852, 'lambda_val': 2.0807360556667617e-05, 'batch_size': 2119, 'optimizer': 'SGD'}.
2026-06-21 00:17:42,428 - optuna.study.study - INFO - Trial 140 finished with values: [0.009222868771601523, 0.002283061765820387, 0.005687230212471574] and parameters: {'n_layers': 3, 'embedding_dim': 64, 'lr': 0.0006101961971381852, 'lambda_val': 2.0807360556667617e-05, 'batch_size': 2119, 'optimizer': 'Adam'}.
2026-06-21 00:20:32,751 - optuna.study.study - INFO - Trial 141 finished with values: [0.00400538069073993, 0.0009568018188707843, 0.002475146265325522] and parameters: {'n_layers': 4, 'embedding_dim': 64, 'lr': 0.00017894449814109155, 'lambda_val': 6.037826614311375e-06, 'batch_size': 3901, 'optimizer': 'RMSprop'}.
2026-06-21 00:23:11,181 - optuna.study.study - INFO - Trial 142 finished with values: [0.00336934468487009, 0.0007294429708222812, 0.0020393556154225706] and parameters: {'n_layers': 1, 'embedding_dim': 32, 'lr': 0.0004974729077493578, 'lambda_val': 0.0011815240672291283, 'batch_size': 1305, 'optimizer': 'RMSprop'}.
2026-06-21 00:26:11,549 - optuna.study.study - INFO - Trial 143 finished with values: [0.00883446364551183, 0.0022214854111405834, 0.0055073942349560395] and parameters: {'n_layers': 3, 'embedding_dim': 128, 'lr': 0.0006101961971381852, 'lambda_val': 2.0807360556667617e-05, 'batch_size': 1788, 'optimizer': 'Adam'}.
2026-06-21 00:26:42,424 - experiment_functions - INFO - Early stopping at epoch 650. Best Metrics: (0.006797172129098766, 0.0016704559808008084, 0.004174523545072594)
2026-06-21 00:26:42,527 - optuna.study.study - INFO - Trial 144 finished with values: [0.006797172129098766, 0.0016704559808008084, 0.004174523545072594] and parameters: {'n_layers': 3, 'embedding_dim': 96, 'lr': 0.0031134216844272773, 'lambda_val': 0.0010632401775879522, 'batch_size': 3398, 'optimizer': 'Adam'}.
2026-06-21 00:29:00,758 - experiment_functions - INFO - Early stopping at epoch 3250. Best Metrics: (0.008461630018086435, 0.0021978021978021982, 0.005161846465414828)
2026-06-21 00:29:00,879 - optuna.study.study - INFO - Trial 145 finished with values: [0.008461630018086435, 0.0021978021978021982, 0.005161846465414828] and parameters: {'n_layers': 3, 'embedding_dim': 64, 'lr': 0.0006101961971381852, 'lambda_val': 0.002711618112015752, 'batch_size': 2119, 'optimizer': 'Adam'}.
2026-06-21 00:29:30,982 - experiment_functions - INFO - Early stopping at epoch 650. Best Metrics: (0.005084205425672841, 0.001304155614500442, 0.0030006801043256565)
2026-06-21 00:29:31,342 - optuna.study.study - INFO - Trial 146 finished with values: [0.005084205425672841, 0.001304155614500442, 0.0030006801043256565] and parameters: {'n_layers': 2, 'embedding_dim': 96, 'lr': 0.0024244689414321787, 'lambda_val': 0.010384775092533254, 'batch_size': 3037, 'optimizer': 'RMSprop'}.
2026-06-21 00:30:04,880 - experiment_functions - INFO - Early stopping at epoch 600. Best Metrics: (0.005414046300552466, 0.001392572944297082, 0.0031771446810434055)
2026-06-21 00:30:05,029 - optuna.study.study - INFO - Trial 147 finished with values: [0.005414046300552466, 0.001392572944297082, 0.0031771446810434055] and parameters: {'n_layers': 3, 'embedding_dim': 256, 'lr': 0.007285829724058789, 'lambda_val': 2.8861183398799558e-06, 'batch_size': 4078, 'optimizer': 'RMSprop'}.
2026-06-21 00:30:36,427 - experiment_functions - INFO - Early stopping at epoch 700. Best Metrics: (0.005852300657013023, 0.0014636225843122396, 0.0035964709889619736)
2026-06-21 00:30:36,543 - optuna.study.study - INFO - Trial 148 finished with values: [0.005852300657013023, 0.0014636225843122396, 0.0035964709889619736] and parameters: {'n_layers': 2, 'embedding_dim': 64, 'lr': 0.003636390488042639, 'lambda_val': 2.2580566177048725e-06, 'batch_size': 3764, 'optimizer': 'RMSprop'}.
2026-06-21 00:31:12,729 - experiment_functions - INFO - Early stopping at epoch 800. Best Metrics: (0.0073697203648301415, 0.0018930781861816344, 0.00450881226402906)
2026-06-21 00:31:13,121 - optuna.study.study - INFO - Trial 149 finished with values: [0.0073697203648301415, 0.0018930781861816344, 0.00450881226402906] and parameters: {'n_layers': 3, 'embedding_dim': 64, 'lr': 0.0031134216844272773, 'lambda_val': 3.9553958515555e-06, 'batch_size': 2914, 'optimizer': 'Adam'}.
2026-06-21 00:34:14,837 - optuna.study.study - INFO - Trial 150 finished with values: [0.008985681284385611, 0.0022325375773651636, 0.005538323022014906] and parameters: {'n_layers': 3, 'embedding_dim': 128, 'lr': 0.0006101961971381852, 'lambda_val': 0.0017226178103252388, 'batch_size': 777, 'optimizer': 'Adam'}.
2026-06-21 00:34:53,256 - experiment_functions - INFO - Early stopping at epoch 850. Best Metrics: (0.008045050555750034, 0.0020383352279904005, 0.0048344097087418955)
2026-06-21 00:34:53,452 - optuna.study.study - INFO - Trial 151 finished with values: [0.008045050555750034, 0.0020383352279904005, 0.0048344097087418955] and parameters: {'n_layers': 3, 'embedding_dim': 64, 'lr': 0.0021794693743976113, 'lambda_val': 2.8861183398799558e-06, 'batch_size': 3180, 'optimizer': 'Adam'}.
2026-06-21 00:35:29,436 - experiment_functions - INFO - Early stopping at epoch 750. Best Metrics: (0.007885627101355602, 0.001968864468864469, 0.004746115591219527)
2026-06-21 00:35:29,720 - optuna.study.study - INFO - Trial 152 finished with values: [0.007885627101355602, 0.001968864468864469, 0.004746115591219527] and parameters: {'n_layers': 3, 'embedding_dim': 96, 'lr': 0.0031134216844272773, 'lambda_val': 3.9553958515555e-06, 'batch_size': 3338, 'optimizer': 'Adam'}.
2026-06-21 00:35:58,011 - experiment_functions - INFO - Early stopping at epoch 600. Best Metrics: (0.00862262347760109, 0.0021614879373500063, 0.0051077149518842175)
2026-06-21 00:35:58,122 - optuna.study.study - INFO - Trial 153 finished with values: [0.00862262347760109, 0.0021614879373500063, 0.0051077149518842175] and parameters: {'n_layers': 4, 'embedding_dim': 64, 'lr': 0.0021794693743976113, 'lambda_val': 0.0017226178103252388, 'batch_size': 2423, 'optimizer': 'RMSprop'}.
2026-06-21 00:38:59,811 - optuna.study.study - INFO - Trial 154 finished with values: [0.01111820515766947, 0.0028056713401540985, 0.00692799152937007] and parameters: {'n_layers': 3, 'embedding_dim': 128, 'lr': 0.0006604859729474348, 'lambda_val': 1.282312052161098e-05, 'batch_size': 777, 'optimizer': 'RMSprop'}.
2026-06-21 00:39:31,679 - experiment_functions - INFO - Early stopping at epoch 650. Best Metrics: (0.010100951052875088, 0.0025009473285335353, 0.00608366016649269)
2026-06-21 00:39:31,778 - optuna.study.study - INFO - Trial 155 finished with values: [0.010100951052875088, 0.0025009473285335353, 0.00608366016649269] and parameters: {'n_layers': 4, 'embedding_dim': 96, 'lr': 0.0021794693743976113, 'lambda_val': 2.8861183398799558e-06, 'batch_size': 1747, 'optimizer': 'RMSprop'}.
2026-06-21 00:40:10,735 - experiment_functions - INFO - Early stopping at epoch 850. Best Metrics: (0.009330876415681486, 0.002428318807629152, 0.005739109631650821)
2026-06-21 00:40:10,845 - optuna.study.study - INFO - Trial 156 finished with values: [0.009330876415681486, 0.002428318807629152, 0.005739109631650821] and parameters: {'n_layers': 4, 'embedding_dim': 64, 'lr': 0.0031134216844272773, 'lambda_val': 3.9553958515555e-06, 'batch_size': 1257, 'optimizer': 'Adam'}.
2026-06-21 00:40:57,678 - experiment_functions - INFO - Early stopping at epoch 1100. Best Metrics: (0.003155931928501841, 0.0007847038019451813, 0.0019303047780960022)
2026-06-21 00:40:57,784 - optuna.study.study - INFO - Trial 157 finished with values: [0.003155931928501841, 0.0007847038019451813, 0.0019303047780960022] and parameters: {'n_layers': 1, 'embedding_dim': 96, 'lr': 0.013395267155238397, 'lambda_val': 1.282312052161098e-05, 'batch_size': 3149, 'optimizer': 'RMSprop'}.
2026-06-21 00:41:30,730 - experiment_functions - INFO - Early stopping at epoch 700. Best Metrics: (0.008091186572021375, 0.0020304408235442724, 0.004883550183289502)
2026-06-21 00:41:30,835 - optuna.study.study - INFO - Trial 158 finished with values: [0.008091186572021375, 0.0020304408235442724, 0.004883550183289502] and parameters: {'n_layers': 3, 'embedding_dim': 96, 'lr': 0.004755645745216762, 'lambda_val': 2.4259773382665532e-05, 'batch_size': 1071, 'optimizer': 'Adam'}.
2026-06-21 00:44:05,865 - experiment_functions - INFO - Early stopping at epoch 3000. Best Metrics: (0.010623581494062938, 0.0026114689907793358, 0.006407072088121268)
2026-06-21 00:44:05,976 - optuna.study.study - INFO - Trial 159 finished with values: [0.010623581494062938, 0.0026114689907793358, 0.006407072088121268] and parameters: {'n_layers': 3, 'embedding_dim': 256, 'lr': 0.0006101961971381852, 'lambda_val': 2.4259773382665532e-05, 'batch_size': 1203, 'optimizer': 'RMSprop'}.
2026-06-21 00:44:34,908 - experiment_functions - INFO - Early stopping at epoch 600. Best Metrics: (0.008074416593243277, 0.0020825438928887205, 0.004870351546789398)
2026-06-21 00:44:35,018 - optuna.study.study - INFO - Trial 160 finished with values: [0.008074416593243277, 0.0020825438928887205, 0.004870351546789398] and parameters: {'n_layers': 4, 'embedding_dim': 96, 'lr': 0.0035879353384560956, 'lambda_val': 1.282312052161098e-05, 'batch_size': 1653, 'optimizer': 'RMSprop'}.
2026-06-21 00:45:04,328 - experiment_functions - INFO - Early stopping at epoch 650. Best Metrics: (0.007697779943074426, 0.0019483390173045346, 0.004668985013057606)
2026-06-21 00:45:04,433 - optuna.study.study - INFO - Trial 161 finished with values: [0.007697779943074426, 0.0019483390173045346, 0.004668985013057606] and parameters: {'n_layers': 3, 'embedding_dim': 64, 'lr': 0.0021794693743976113, 'lambda_val': 0.0007967779320638475, 'batch_size': 3322, 'optimizer': 'RMSprop'}.
2026-06-21 00:45:30,723 - experiment_functions - INFO - Early stopping at epoch 550. Best Metrics: (0.005911563453231364, 0.0014652014652014654, 0.003501214426581167)
2026-06-21 00:45:30,823 - optuna.study.study - INFO - Trial 162 finished with values: [0.005911563453231364, 0.0014652014652014654, 0.003501214426581167] and parameters: {'n_layers': 3, 'embedding_dim': 96, 'lr': 0.017356358238450692, 'lambda_val': 2.900924096203213e-06, 'batch_size': 1203, 'optimizer': 'Adam'}.
2026-06-21 00:46:27,163 - experiment_functions - INFO - Early stopping at epoch 1300. Best Metrics: (0.0005606281789921547, 0.00012315270935960593, 0.00033653715495133907)
2026-06-21 00:46:27,270 - optuna.study.study - INFO - Trial 163 finished with values: [0.0005606281789921547, 0.00012315270935960593, 0.00033653715495133907] and parameters: {'n_layers': 4, 'embedding_dim': 64, 'lr': 1.7511062759851175e-05, 'lambda_val': 0.0014663279558597413, 'batch_size': 1305, 'optimizer': 'RMSprop'}.
2026-06-21 00:49:27,648 - optuna.study.study - INFO - Trial 164 finished with values: [0.01087075653131582, 0.0026288366805608185, 0.00680594859248209] and parameters: {'n_layers': 3, 'embedding_dim': 128, 'lr': 0.0006101961971381852, 'lambda_val': 2.0807360556667617e-05, 'batch_size': 642, 'optimizer': 'RMSprop'}.
2026-06-21 00:52:13,919 - optuna.study.study - INFO - Trial 165 finished with values: [0.005983068661154609, 0.0013830996589617281, 0.003712202692209793] and parameters: {'n_layers': 2, 'embedding_dim': 96, 'lr': 0.0006460981719089114, 'lambda_val': 0.00035402317541238034, 'batch_size': 642, 'optimizer': 'RMSprop'}.
2026-06-21 00:53:06,061 - experiment_functions - INFO - Early stopping at epoch 1200. Best Metrics: (0.00045660997428348784, 0.00010262725779967159, 0.0002760661058959968)
2026-06-21 00:53:06,210 - optuna.study.study - INFO - Trial 166 finished with values: [0.00045660997428348784, 0.00010262725779967159, 0.0002760661058959968] and parameters: {'n_layers': 4, 'embedding_dim': 64, 'lr': 1.1754672577380221e-05, 'lambda_val': 2.8861183398799558e-06, 'batch_size': 777, 'optimizer': 'RMSprop'}.
2026-06-21 00:53:43,411 - experiment_functions - INFO - Early stopping at epoch 800. Best Metrics: (0.007694779405851998, 0.001940444612858406, 0.004776289304296462)
2026-06-21 00:53:43,550 - optuna.study.study - INFO - Trial 167 finished with values: [0.007694779405851998, 0.001940444612858406, 0.004776289304296462] and parameters: {'n_layers': 3, 'embedding_dim': 96, 'lr': 0.0021794693743976113, 'lambda_val': 5.82846385984691e-05, 'batch_size': 3679, 'optimizer': 'Adam'}.
2026-06-21 00:54:17,217 - experiment_functions - INFO - Early stopping at epoch 700. Best Metrics: (0.008922295048780695, 0.0023004294556018693, 0.005528364574042543)
2026-06-21 00:54:17,327 - optuna.study.study - INFO - Trial 168 finished with values: [0.008922295048780695, 0.0023004294556018693, 0.005528364574042543] and parameters: {'n_layers': 4, 'embedding_dim': 96, 'lr': 0.0031134216844272773, 'lambda_val': 0.0014663279558597413, 'batch_size': 1285, 'optimizer': 'Adam'}.
2026-06-21 00:54:45,941 - experiment_functions - INFO - Early stopping at epoch 600. Best Metrics: (0.007981929592271387, 0.0020557029177718836, 0.004849265503486762)
2026-06-21 00:54:46,048 - optuna.study.study - INFO - Trial 169 finished with values: [0.007981929592271387, 0.0020557029177718836, 0.004849265503486762] and parameters: {'n_layers': 4, 'embedding_dim': 64, 'lr': 0.008779530334034448, 'lambda_val': 2.0807360556667617e-05, 'batch_size': 1653, 'optimizer': 'Adam'}.
2026-06-21 00:55:13,036 - experiment_functions - INFO - Early stopping at epoch 550. Best Metrics: (0.005803197178711866, 0.0015030946065428825, 0.003415034733841523)
2026-06-21 00:55:13,135 - optuna.study.study - INFO - Trial 170 finished with values: [0.005803197178711866, 0.0015030946065428825, 0.003415034733841523] and parameters: {'n_layers': 4, 'embedding_dim': 96, 'lr': 0.008878996311817933, 'lambda_val': 2.8861183398799558e-06, 'batch_size': 2119, 'optimizer': 'RMSprop'}.
2026-06-21 00:58:07,012 - optuna.study.study - INFO - Trial 171 finished with values: [0.011504934385378309, 0.0028277756726032594, 0.007048962379928481] and parameters: {'n_layers': 3, 'embedding_dim': 96, 'lr': 0.0006460981719089114, 'lambda_val': 5.82846385984691e-05, 'batch_size': 1203, 'optimizer': 'RMSprop'}.
2026-06-21 01:00:59,060 - optuna.study.study - INFO - Trial 172 finished with values: [0.011115893751418172, 0.0027725148414803587, 0.006754040436039876] and parameters: {'n_layers': 4, 'embedding_dim': 64, 'lr': 0.0004974729077493578, 'lambda_val': 0.0014663279558597413, 'batch_size': 2119, 'optimizer': 'Adam'}.
2026-06-21 01:01:29,234 - experiment_functions - INFO - Early stopping at epoch 650. Best Metrics: (0.009219553396798775, 0.0023146393836049007, 0.005652955676258256)
2026-06-21 01:01:29,363 - optuna.study.study - INFO - Trial 173 finished with values: [0.009219553396798775, 0.0023146393836049007, 0.005652955676258256] and parameters: {'n_layers': 4, 'embedding_dim': 64, 'lr': 0.0031134216844272773, 'lambda_val': 3.9553958515555e-06, 'batch_size': 1257, 'optimizer': 'RMSprop'}.
2026-06-21 01:02:05,244 - experiment_functions - INFO - Early stopping at epoch 800. Best Metrics: (0.009201320881761755, 0.002328849311607932, 0.0056908354763527385)
2026-06-21 01:02:05,351 - optuna.study.study - INFO - Trial 174 finished with values: [0.009201320881761755, 0.002328849311607932, 0.0056908354763527385] and parameters: {'n_layers': 3, 'embedding_dim': 64, 'lr': 0.0021794693743976113, 'lambda_val': 2.8861183398799558e-06, 'batch_size': 2119, 'optimizer': 'RMSprop'}.
2026-06-21 01:05:03,348 - optuna.study.study - INFO - Trial 175 finished with values: [0.0030743606346892594, 0.000764178350385247, 0.0018875568121451097] and parameters: {'n_layers': 1, 'embedding_dim': 256, 'lr': 0.0006101961971381852, 'lambda_val': 0.0213832945512002, 'batch_size': 1203, 'optimizer': 'RMSprop'}.
2026-06-21 01:05:25,816 - experiment_functions - INFO - Early stopping at epoch 500. Best Metrics: (0.0005339041805569449, 0.00010894278135657447, 0.0002790851997414406)
2026-06-21 01:05:25,922 - optuna.study.study - INFO - Trial 176 finished with values: [0.0005339041805569449, 0.00010894278135657447, 0.0002790851997414406] and parameters: {'n_layers': 2, 'embedding_dim': 64, 'lr': 0.0004974729077493578, 'lambda_val': 0.0014663279558597413, 'batch_size': 1305, 'optimizer': 'SGD'}.
2026-06-21 01:08:13,205 - optuna.study.study - INFO - Trial 177 finished with values: [0.009435646196739178, 0.0023967411898446382, 0.0057843174321079915] and parameters: {'n_layers': 3, 'embedding_dim': 64, 'lr': 0.0006460981719089114, 'lambda_val': 5.82846385984691e-05, 'batch_size': 2119, 'optimizer': 'Adam'}.
2026-06-21 01:08:35,141 - experiment_functions - INFO - Early stopping at epoch 500. Best Metrics: (0.0005478261300399373, 0.00012473159024883163, 0.00032463568073181823)
2026-06-21 01:08:35,328 - optuna.study.study - INFO - Trial 178 finished with values: [0.0005478261300399373, 0.00012473159024883163, 0.00032463568073181823] and parameters: {'n_layers': 1, 'embedding_dim': 64, 'lr': 0.0006101961971381852, 'lambda_val': 2.2932520827188935e-06, 'batch_size': 2119, 'optimizer': 'SGD'}.
2026-06-21 01:09:01,408 - experiment_functions - INFO - Early stopping at epoch 550. Best Metrics: (0.00558662287663163, 0.0013752052545155994, 0.003208518728072864)
2026-06-21 01:09:01,556 - optuna.study.study - INFO - Trial 179 finished with values: [0.00558662287663163, 0.0013752052545155994, 0.003208518728072864] and parameters: {'n_layers': 3, 'embedding_dim': 96, 'lr': 0.02013797442569766, 'lambda_val': 0.0017226178103252388, 'batch_size': 2119, 'optimizer': 'Adam'}.
2026-06-21 01:09:29,402 - experiment_functions - INFO - Early stopping at epoch 550. Best Metrics: (0.007984983529657168, 0.002028861942655046, 0.00479384006880471)
2026-06-21 01:09:29,550 - optuna.study.study - INFO - Trial 180 finished with values: [0.007984983529657168, 0.002028861942655046, 0.00479384006880471] and parameters: {'n_layers': 4, 'embedding_dim': 96, 'lr': 0.003636390488042639, 'lambda_val': 2.8861183398799558e-06, 'batch_size': 3029, 'optimizer': 'RMSprop'}.
2026-06-21 01:09:57,948 - experiment_functions - INFO - Early stopping at epoch 600. Best Metrics: (0.008047802127890802, 0.002024125299987369, 0.004857897258728512)
2026-06-21 01:09:58,057 - optuna.study.study - INFO - Trial 181 finished with values: [0.008047802127890802, 0.002024125299987369, 0.004857897258728512] and parameters: {'n_layers': 3, 'embedding_dim': 96, 'lr': 0.0031134216844272773, 'lambda_val': 0.0010632401775879522, 'batch_size': 1559, 'optimizer': 'RMSprop'}.
2026-06-21 01:10:28,604 - experiment_functions - INFO - Early stopping at epoch 550. Best Metrics: (0.005138448559549056, 0.0013073133762788935, 0.003024659897425632)
2026-06-21 01:10:28,713 - optuna.study.study - INFO - Trial 182 finished with values: [0.005138448559549056, 0.0013073133762788935, 0.003024659897425632] and parameters: {'n_layers': 3, 'embedding_dim': 256, 'lr': 0.0021794693743976113, 'lambda_val': 0.013339360902303529, 'batch_size': 3089, 'optimizer': 'RMSprop'}.
2026-06-21 01:10:59,223 - experiment_functions - INFO - Early stopping at epoch 650. Best Metrics: (0.007213533746652254, 0.001891499305292409, 0.00429863954470195)
