2026-06-21 17:58:34,328 - optuna.study.study - INFO - Trial 96 finished with values: [0.0005850454330378656, 0.0001310471138057345, 0.00029978892189564337] and parameters: {'n_layers': 1, 'embedding_dim': 32, 'lr': 2.1604417466155715e-05, 'lambda_val': 0.0006100550334792186, 'batch_size': 1772, 'optimizer': 'Adam'}.
2026-06-21 17:58:56,421 - experiment_functions - INFO - Early stopping at epoch 500. Best Metrics: (0.0005880124133936218, 0.00013894151825186307, 0.0003182378294434136)
2026-06-21 17:58:56,512 - optuna.study.study - INFO - Trial 97 finished with values: [0.0005880124133936218, 0.00013894151825186307, 0.0003182378294434136] and parameters: {'n_layers': 1, 'embedding_dim': 96, 'lr': 0.0006520158537207684, 'lambda_val': 6.131403610536352e-05, 'batch_size': 1182, 'optimizer': 'SGD'}.
2026-06-21 17:59:31,189 - experiment_functions - INFO - Early stopping at epoch 750. Best Metrics: (0.005813151735137001, 0.0014699381078691423, 0.003479396476551732)
2026-06-21 17:59:31,271 - optuna.study.study - INFO - Trial 98 finished with values: [0.005813151735137001, 0.0014699381078691423, 0.003479396476551732] and parameters: {'n_layers': 2, 'embedding_dim': 128, 'lr': 0.0036608132255288727, 'lambda_val': 1.1896982541974421e-05, 'batch_size': 3442, 'optimizer': 'RMSprop'}.
2026-06-21 18:01:58,309 - experiment_functions - INFO - Early stopping at epoch 3500. Best Metrics: (0.0007629294613148864, 0.0001768346595932803, 0.00041030847797137197)
2026-06-21 18:01:58,416 - optuna.study.study - INFO - Trial 99 finished with values: [0.0007629294613148864, 0.0001768346595932803, 0.00041030847797137197] and parameters: {'n_layers': 2, 'embedding_dim': 96, 'lr': 3.7077736539999764e-05, 'lambda_val': 0.000617114636181337, 'batch_size': 3442, 'optimizer': 'Adam'}.
2026-06-21 18:04:46,260 - optuna.study.study - INFO - Trial 100 finished with values: [0.006785296001339655, 0.0016862447896930657, 0.0040893876774580114] and parameters: {'n_layers': 2, 'embedding_dim': 96, 'lr': 0.0009312796651119834, 'lambda_val': 1.1896982541974421e-05, 'batch_size': 2291, 'optimizer': 'Adam'}.
2026-06-21 18:05:11,635 - experiment_functions - INFO - Early stopping at epoch 550. Best Metrics: (0.0026677555319279873, 0.0006678666161424782, 0.0016831922216755334)
2026-06-21 18:05:11,728 - optuna.study.study - INFO - Trial 101 finished with values: [0.0026677555319279873, 0.0006678666161424782, 0.0016831922216755334] and parameters: {'n_layers': 2, 'embedding_dim': 96, 'lr': 0.06305209530719037, 'lambda_val': 1.1896982541974421e-05, 'batch_size': 3442, 'optimizer': 'RMSprop'}.
2026-06-21 18:05:39,598 - experiment_functions - INFO - Early stopping at epoch 550. Best Metrics: (0.0048117554228226545, 0.0012078438802576733, 0.0028224835746969447)
2026-06-21 18:05:39,675 - optuna.study.study - INFO - Trial 102 finished with values: [0.0048117554228226545, 0.0012078438802576733, 0.0028224835746969447] and parameters: {'n_layers': 4, 'embedding_dim': 128, 'lr': 0.017533699109926436, 'lambda_val': 2.255504078550787e-05, 'batch_size': 3850, 'optimizer': 'RMSprop'}.
2026-06-21 18:08:16,984 - optuna.study.study - INFO - Trial 103 finished with values: [0.0024422191029070347, 0.0005399772641151952, 0.0014818685024608777] and parameters: {'n_layers': 2, 'embedding_dim': 32, 'lr': 0.0002479923805032418, 'lambda_val': 0.0005711903431452187, 'batch_size': 3354, 'optimizer': 'RMSprop'}.
2026-06-21 18:08:43,561 - experiment_functions - INFO - Early stopping at epoch 550. Best Metrics: (0.006065403830540362, 0.0015394088669950742, 0.0036123978022635124)
2026-06-21 18:08:43,678 - optuna.study.study - INFO - Trial 104 finished with values: [0.006065403830540362, 0.0015394088669950742, 0.0036123978022635124] and parameters: {'n_layers': 4, 'embedding_dim': 96, 'lr': 0.018991881603422755, 'lambda_val': 0.00040764482336836375, 'batch_size': 1442, 'optimizer': 'Adam'}.
2026-06-21 18:09:48,611 - experiment_functions - INFO - Early stopping at epoch 1600. Best Metrics: (0.007410745910235013, 0.0017715043577112544, 0.004461460014828365)
2026-06-21 18:09:48,705 - optuna.study.study - INFO - Trial 105 finished with values: [0.007410745910235013, 0.0017715043577112544, 0.004461460014828365] and parameters: {'n_layers': 2, 'embedding_dim': 32, 'lr': 0.0015158687633618723, 'lambda_val': 7.024518890460945e-05, 'batch_size': 2925, 'optimizer': 'RMSprop'}.
2026-06-21 18:10:15,500 - experiment_functions - INFO - Early stopping at epoch 600. Best Metrics: (0.007716717108310095, 0.001896235947960086, 0.004479891251643803)
2026-06-21 18:10:15,625 - optuna.study.study - INFO - Trial 106 finished with values: [0.007716717108310095, 0.001896235947960086, 0.004479891251643803] and parameters: {'n_layers': 4, 'embedding_dim': 32, 'lr': 0.011765700859700308, 'lambda_val': 1.544427077132802e-06, 'batch_size': 2374, 'optimizer': 'Adam'}.
2026-06-21 18:10:54,443 - experiment_functions - INFO - Early stopping at epoch 900. Best Metrics: (0.01026920004838041, 0.00262094227611469, 0.006346846485192394)
2026-06-21 18:10:55,272 - optuna.study.study - INFO - Trial 107 finished with values: [0.01026920004838041, 0.00262094227611469, 0.006346846485192394] and parameters: {'n_layers': 4, 'embedding_dim': 32, 'lr': 0.0015158687633618723, 'lambda_val': 7.024518890460945e-05, 'batch_size': 2925, 'optimizer': 'RMSprop'}.
2026-06-21 18:11:19,985 - experiment_functions - INFO - Early stopping at epoch 550. Best Metrics: (0.0042610677392158946, 0.0011020588606795506, 0.002536315463913303)
2026-06-21 18:11:20,263 - optuna.study.study - INFO - Trial 108 finished with values: [0.0042610677392158946, 0.0011020588606795506, 0.002536315463913303] and parameters: {'n_layers': 4, 'embedding_dim': 32, 'lr': 0.05237459070579243, 'lambda_val': 2.1629798606390323e-05, 'batch_size': 3261, 'optimizer': 'Adam'}.
2026-06-21 18:11:46,747 - experiment_functions - INFO - Early stopping at epoch 600. Best Metrics: (0.005712076607309864, 0.0014194139194139196, 0.0036203615938569726)
2026-06-21 18:11:47,066 - optuna.study.study - INFO - Trial 109 finished with values: [0.005712076607309864, 0.0014194139194139196, 0.0036203615938569726] and parameters: {'n_layers': 3, 'embedding_dim': 32, 'lr': 0.012808126858023893, 'lambda_val': 1.3637131181611708e-06, 'batch_size': 2987, 'optimizer': 'Adam'}.
2026-06-21 18:12:32,886 - experiment_functions - INFO - Early stopping at epoch 1100. Best Metrics: (0.006487346125882941, 0.001517304534545914, 0.004033712903827392)
2026-06-21 18:12:33,242 - optuna.study.study - INFO - Trial 110 finished with values: [0.006487346125882941, 0.001517304534545914, 0.004033712903827392] and parameters: {'n_layers': 2, 'embedding_dim': 32, 'lr': 0.0024374436987616007, 'lambda_val': 1.2027478401396182e-06, 'batch_size': 2925, 'optimizer': 'Adam'}.
2026-06-21 18:13:47,600 - experiment_functions - INFO - Early stopping at epoch 1750. Best Metrics: (0.0024906262606630702, 0.0007041808765946697, 0.0014919831423543218)
2026-06-21 18:13:47,743 - optuna.study.study - INFO - Trial 111 finished with values: [0.0024906262606630702, 0.0007041808765946697, 0.0014919831423543218] and parameters: {'n_layers': 2, 'embedding_dim': 96, 'lr': 0.0290685306103869, 'lambda_val': 0.04601375549537307, 'batch_size': 806, 'optimizer': 'Adam'}.
2026-06-21 18:14:19,465 - experiment_functions - INFO - Early stopping at epoch 700. Best Metrics: (0.004128318971641869, 0.000999431602879879, 0.0025724767773591404)
2026-06-21 18:14:19,573 - optuna.study.study - INFO - Trial 112 finished with values: [0.004128318971641869, 0.000999431602879879, 0.0025724767773591404] and parameters: {'n_layers': 2, 'embedding_dim': 96, 'lr': 0.012463748703097797, 'lambda_val': 2.6999085606967302e-05, 'batch_size': 3442, 'optimizer': 'RMSprop'}.
2026-06-21 18:14:55,513 - experiment_functions - INFO - Early stopping at epoch 800. Best Metrics: (0.005873117862514886, 0.0014446760136415308, 0.0035392226752000307)
2026-06-21 18:14:55,869 - optuna.study.study - INFO - Trial 113 finished with values: [0.005873117862514886, 0.0014446760136415308, 0.0035392226752000307] and parameters: {'n_layers': 2, 'embedding_dim': 96, 'lr': 0.0036608132255288727, 'lambda_val': 0.0006100550334792186, 'batch_size': 1772, 'optimizer': 'Adam'}.
2026-06-21 18:15:38,024 - experiment_functions - INFO - Early stopping at epoch 1000. Best Metrics: (0.0037712184150435375, 0.0008478590375142101, 0.0022354821870105655)
2026-06-21 18:15:38,130 - optuna.study.study - INFO - Trial 114 finished with values: [0.0037712184150435375, 0.0008478590375142101, 0.0022354821870105655] and parameters: {'n_layers': 1, 'embedding_dim': 64, 'lr': 0.008671930882000575, 'lambda_val': 6.131403610536352e-05, 'batch_size': 3741, 'optimizer': 'Adam'}.
2026-06-21 18:16:05,031 - experiment_functions - INFO - Early stopping at epoch 600. Best Metrics: (0.004846770459457325, 0.0011415308829101935, 0.0029399332494487876)
2026-06-21 18:16:05,137 - optuna.study.study - INFO - Trial 115 finished with values: [0.004846770459457325, 0.0011415308829101935, 0.0029399332494487876] and parameters: {'n_layers': 2, 'embedding_dim': 64, 'lr': 0.011765700859700308, 'lambda_val': 1.544427077132802e-06, 'batch_size': 3261, 'optimizer': 'Adam'}.
2026-06-21 18:16:34,726 - experiment_functions - INFO - Early stopping at epoch 650. Best Metrics: (0.004102283134562812, 0.0010278514588859418, 0.0025806361831745474)
2026-06-21 18:16:34,837 - optuna.study.study - INFO - Trial 116 finished with values: [0.004102283134562812, 0.0010278514588859418, 0.0025806361831745474] and parameters: {'n_layers': 2, 'embedding_dim': 96, 'lr': 0.013692285994849401, 'lambda_val': 1.544427077132802e-06, 'batch_size': 3261, 'optimizer': 'RMSprop'}.
2026-06-21 18:17:06,037 - experiment_functions - INFO - Early stopping at epoch 650. Best Metrics: (0.008382194479360805, 0.0021235947960085897, 0.00494803229732996)
2026-06-21 18:17:06,149 - optuna.study.study - INFO - Trial 117 finished with values: [0.008382194479360805, 0.0021235947960085897, 0.00494803229732996] and parameters: {'n_layers': 4, 'embedding_dim': 96, 'lr': 0.0036608132255288727, 'lambda_val': 5.384404839396391e-06, 'batch_size': 3122, 'optimizer': 'Adam'}.
2026-06-21 18:17:33,243 - experiment_functions - INFO - Early stopping at epoch 600. Best Metrics: (0.006772061649225961, 0.0017636099532651257, 0.004181585322539942)
2026-06-21 18:17:33,388 - optuna.study.study - INFO - Trial 118 finished with values: [0.006772061649225961, 0.0017636099532651257, 0.004181585322539942] and parameters: {'n_layers': 4, 'embedding_dim': 32, 'lr': 0.008463855437471605, 'lambda_val': 0.0009730028095032008, 'batch_size': 3469, 'optimizer': 'Adam'}.
2026-06-21 18:18:37,382 - experiment_functions - INFO - Early stopping at epoch 1550. Best Metrics: (0.0072315090347842455, 0.001867816091954023, 0.004512378285622666)
2026-06-21 18:18:37,493 - optuna.study.study - INFO - Trial 119 finished with values: [0.0072315090347842455, 0.001867816091954023, 0.004512378285622666] and parameters: {'n_layers': 2, 'embedding_dim': 32, 'lr': 0.0015158687633618723, 'lambda_val': 7.024518890460945e-05, 'batch_size': 2925, 'optimizer': 'RMSprop'}.
2026-06-21 18:19:59,199 - experiment_functions - INFO - Early stopping at epoch 2000. Best Metrics: (0.0006246508248498505, 0.0001278893520272831, 0.00037824094486116295)
2026-06-21 18:19:59,300 - optuna.study.study - INFO - Trial 120 finished with values: [0.0006246508248498505, 0.0001278893520272831, 0.00037824094486116295] and parameters: {'n_layers': 4, 'embedding_dim': 32, 'lr': 1.2324415740033917e-05, 'lambda_val': 6.702534509469782e-06, 'batch_size': 2925, 'optimizer': 'Adam'}.
2026-06-21 18:20:25,022 - experiment_functions - INFO - Early stopping at epoch 600. Best Metrics: (0.002884227345573027, 0.0006378678792471897, 0.0016788119437640184)
2026-06-21 18:20:25,154 - optuna.study.study - INFO - Trial 121 finished with values: [0.002884227345573027, 0.0006378678792471897, 0.0016788119437640184] and parameters: {'n_layers': 1, 'embedding_dim': 32, 'lr': 0.0290685306103869, 'lambda_val': 6.131403610536352e-05, 'batch_size': 899, 'optimizer': 'Adam'}.
2026-06-21 18:21:01,168 - experiment_functions - INFO - Early stopping at epoch 750. Best Metrics: (0.009857291261798313, 0.0024930529240874072, 0.005839224651366006)
2026-06-21 18:21:01,283 - optuna.study.study - INFO - Trial 122 finished with values: [0.009857291261798313, 0.0024930529240874072, 0.005839224651366006] and parameters: {'n_layers': 4, 'embedding_dim': 96, 'lr': 0.0015158687633618723, 'lambda_val': 6.702534509469782e-06, 'batch_size': 2925, 'optimizer': 'RMSprop'}.
2026-06-21 18:21:32,925 - experiment_functions - INFO - Early stopping at epoch 700. Best Metrics: (0.005213582103489193, 0.001288366805608185, 0.0031388494312935985)
2026-06-21 18:21:33,034 - optuna.study.study - INFO - Trial 123 finished with values: [0.005213582103489193, 0.001288366805608185, 0.0031388494312935985] and parameters: {'n_layers': 2, 'embedding_dim': 96, 'lr': 0.008671930882000575, 'lambda_val': 7.980305062842105e-06, 'batch_size': 3741, 'optimizer': 'Adam'}.
2026-06-21 18:22:00,208 - experiment_functions - INFO - Early stopping at epoch 600. Best Metrics: (0.008782010903818737, 0.0021599090564607803, 0.005328876172645109)
2026-06-21 18:22:00,308 - optuna.study.study - INFO - Trial 124 finished with values: [0.008782010903818737, 0.0021599090564607803, 0.005328876172645109] and parameters: {'n_layers': 4, 'embedding_dim': 32, 'lr': 0.00264461364827089, 'lambda_val': 1.1896982541974421e-05, 'batch_size': 3442, 'optimizer': 'RMSprop'}.
2026-06-21 18:22:31,397 - experiment_functions - INFO - Early stopping at epoch 700. Best Metrics: (0.004244567102242119, 0.0011131110269041304, 0.0027540003673983088)
2026-06-21 18:22:31,854 - optuna.study.study - INFO - Trial 125 finished with values: [0.004244567102242119, 0.0011131110269041304, 0.0027540003673983088] and parameters: {'n_layers': 2, 'embedding_dim': 32, 'lr': 0.008463855437471605, 'lambda_val': 1.5554041679084877e-06, 'batch_size': 2030, 'optimizer': 'RMSprop'}.
2026-06-21 18:25:22,962 - experiment_functions - INFO - Early stopping at epoch 3450. Best Metrics: (0.006134772141431795, 0.0014936213212075283, 0.0036494666944369607)
2026-06-21 18:25:23,068 - optuna.study.study - INFO - Trial 126 finished with values: [0.006134772141431795, 0.0014936213212075283, 0.0036494666944369607] and parameters: {'n_layers': 2, 'embedding_dim': 256, 'lr': 0.0006520158537207684, 'lambda_val': 6.131403610536352e-05, 'batch_size': 3261, 'optimizer': 'Adam'}.
2026-06-21 18:25:49,745 - experiment_functions - INFO - Early stopping at epoch 600. Best Metrics: (0.006808753376221512, 0.0018093974990526715, 0.0042850708340174334)
2026-06-21 18:25:49,852 - optuna.study.study - INFO - Trial 127 finished with values: [0.006808753376221512, 0.0018093974990526715, 0.0042850708340174334] and parameters: {'n_layers': 4, 'embedding_dim': 32, 'lr': 0.008463855437471605, 'lambda_val': 1.1896982541974421e-05, 'batch_size': 3469, 'optimizer': 'Adam'}.
2026-06-21 18:26:23,860 - experiment_functions - INFO - Early stopping at epoch 800. Best Metrics: (0.006764613756743565, 0.0017304534545913857, 0.0041439952162833265)
2026-06-21 18:26:23,960 - optuna.study.study - INFO - Trial 128 finished with values: [0.006764613756743565, 0.0017304534545913857, 0.0041439952162833265] and parameters: {'n_layers': 2, 'embedding_dim': 32, 'lr': 0.00264461364827089, 'lambda_val': 0.0009730028095032008, 'batch_size': 2374, 'optimizer': 'RMSprop'}.
2026-06-21 18:26:49,260 - experiment_functions - INFO - Early stopping at epoch 550. Best Metrics: (0.0026769403841997073, 0.0006757610205886068, 0.0016731113750261255)
2026-06-21 18:26:49,388 - optuna.study.study - INFO - Trial 129 finished with values: [0.0026769403841997073, 0.0006757610205886068, 0.0016731113750261255] and parameters: {'n_layers': 2, 'embedding_dim': 96, 'lr': 0.06305209530719037, 'lambda_val': 0.00012818615016027372, 'batch_size': 1095, 'optimizer': 'RMSprop'}.
2026-06-21 18:27:26,910 - experiment_functions - INFO - Early stopping at epoch 850. Best Metrics: (0.0037483299992028263, 0.0008431223948465328, 0.002193461461756478)
2026-06-21 18:27:27,040 - optuna.study.study - INFO - Trial 130 finished with values: [0.0037483299992028263, 0.0008431223948465328, 0.002193461461756478] and parameters: {'n_layers': 1, 'embedding_dim': 128, 'lr': 0.014143070868559586, 'lambda_val': 2.255504078550787e-05, 'batch_size': 3850, 'optimizer': 'Adam'}.
2026-06-21 18:28:25,279 - experiment_functions - INFO - Early stopping at epoch 1300. Best Metrics: (0.007039386724242177, 0.0018362384741695084, 0.004303097539307026)
2026-06-21 18:28:25,388 - optuna.study.study - INFO - Trial 131 finished with values: [0.007039386724242177, 0.0018362384741695084, 0.004303097539307026] and parameters: {'n_layers': 2, 'embedding_dim': 128, 'lr': 0.0012936887366358962, 'lambda_val': 1.1896982541974421e-05, 'batch_size': 3442, 'optimizer': 'RMSprop'}.
2026-06-21 18:28:48,176 - experiment_functions - INFO - Early stopping at epoch 500. Best Metrics: (0.0005069470954700934, 0.00011367942402425163, 0.00028153795464879106)
2026-06-21 18:28:48,324 - optuna.study.study - INFO - Trial 132 finished with values: [0.0005069470954700934, 0.00011367942402425163, 0.00028153795464879106] and parameters: {'n_layers': 2, 'embedding_dim': 96, 'lr': 0.013692285994849401, 'lambda_val': 0.08422070332443249, 'batch_size': 3405, 'optimizer': 'SGD'}.
2026-06-21 18:29:16,639 - experiment_functions - INFO - Early stopping at epoch 600. Best Metrics: (0.007436646101184936, 0.0018914993052924092, 0.004437032335959017)
2026-06-21 18:29:16,747 - optuna.study.study - INFO - Trial 133 finished with values: [0.007436646101184936, 0.0018914993052924092, 0.004437032335959017] and parameters: {'n_layers': 3, 'embedding_dim': 96, 'lr': 0.0036608132255288727, 'lambda_val': 1.1896982541974421e-05, 'batch_size': 3442, 'optimizer': 'RMSprop'}.
2026-06-21 18:29:43,402 - experiment_functions - INFO - Early stopping at epoch 600. Best Metrics: (0.005807268517890903, 0.0013688897309586967, 0.0033719509930851617)
2026-06-21 18:29:43,502 - optuna.study.study - INFO - Trial 134 finished with values: [0.005807268517890903, 0.0013688897309586967, 0.0033719509930851617] and parameters: {'n_layers': 3, 'embedding_dim': 32, 'lr': 0.012463748703097797, 'lambda_val': 2.2511892513467577e-06, 'batch_size': 2987, 'optimizer': 'Adam'}.
2026-06-21 18:30:58,497 - experiment_functions - INFO - Early stopping at epoch 1850. Best Metrics: (0.007261604298011428, 0.0017146646456991284, 0.004455053555223483)
2026-06-21 18:30:58,603 - optuna.study.study - INFO - Trial 135 finished with values: [0.007261604298011428, 0.0017146646456991284, 0.004455053555223483] and parameters: {'n_layers': 2, 'embedding_dim': 32, 'lr': 0.0024374436987616007, 'lambda_val': 6.131403610536352e-05, 'batch_size': 899, 'optimizer': 'Adam'}.
2026-06-21 18:31:21,309 - experiment_functions - INFO - Early stopping at epoch 500. Best Metrics: (0.00037545148228961364, 9.631173424276872e-05, 0.0001904233023272257)
2026-06-21 18:31:21,410 - optuna.study.study - INFO - Trial 136 finished with values: [0.00037545148228961364, 9.631173424276872e-05, 0.0001904233023272257] and parameters: {'n_layers': 2, 'embedding_dim': 96, 'lr': 0.07739747455901813, 'lambda_val': 1.1896982541974421e-05, 'batch_size': 3442, 'optimizer': 'SGD'}.
2026-06-21 18:32:27,622 - experiment_functions - INFO - Early stopping at epoch 1600. Best Metrics: (0.006190075664566874, 0.0014573070607553369, 0.0037379789568415876)
2026-06-21 18:32:27,752 - optuna.study.study - INFO - Trial 137 finished with values: [0.006190075664566874, 0.0014573070607553369, 0.0037379789568415876] and parameters: {'n_layers': 2, 'embedding_dim': 32, 'lr': 0.0015158687633618723, 'lambda_val': 6.702534509469782e-06, 'batch_size': 2925, 'optimizer': 'Adam'}.
2026-06-21 18:33:02,818 - experiment_functions - INFO - Early stopping at epoch 750. Best Metrics: (0.007383930604318586, 0.0018488695212833142, 0.00448414662433839)
2026-06-21 18:33:03,180 - optuna.study.study - INFO - Trial 138 finished with values: [0.007383930604318586, 0.0018488695212833142, 0.00448414662433839] and parameters: {'n_layers': 3, 'embedding_dim': 96, 'lr': 0.0026843825331302053, 'lambda_val': 0.0005803217930206673, 'batch_size': 3850, 'optimizer': 'Adam'}.
2026-06-21 18:33:30,101 - experiment_functions - INFO - Early stopping at epoch 550. Best Metrics: (0.004632414448937884, 0.0011731085006947074, 0.002656381603132807)
2026-06-21 18:33:30,210 - optuna.study.study - INFO - Trial 139 finished with values: [0.004632414448937884, 0.0011731085006947074, 0.002656381603132807] and parameters: {'n_layers': 3, 'embedding_dim': 128, 'lr': 0.017533699109926436, 'lambda_val': 2.255504078550787e-05, 'batch_size': 3850, 'optimizer': 'RMSprop'}.
2026-06-21 18:35:24,641 - experiment_functions - INFO - Early stopping at epoch 2750. Best Metrics: (0.000774261210425085, 0.0001578880889225717, 0.00044955336063100476)
2026-06-21 18:35:24,750 - optuna.study.study - INFO - Trial 140 finished with values: [0.000774261210425085, 0.0001578880889225717, 0.00044955336063100476] and parameters: {'n_layers': 2, 'embedding_dim': 96, 'lr': 3.7077736539999764e-05, 'lambda_val': 6.702534509469782e-06, 'batch_size': 2925, 'optimizer': 'RMSprop'}.
2026-06-21 18:35:57,940 - experiment_functions - INFO - Early stopping at epoch 750. Best Metrics: (0.00676593866277912, 0.0016578249336870027, 0.004074401225051135)
2026-06-21 18:35:58,043 - optuna.study.study - INFO - Trial 141 finished with values: [0.00676593866277912, 0.0016578249336870027, 0.004074401225051135] and parameters: {'n_layers': 2, 'embedding_dim': 64, 'lr': 0.00264461364827089, 'lambda_val': 0.0009730028095032008, 'batch_size': 2374, 'optimizer': 'RMSprop'}.
2026-06-21 18:36:26,911 - experiment_functions - INFO - Early stopping at epoch 600. Best Metrics: (0.007467217461359659, 0.001953075659972212, 0.004629105643556622)
