2026-06-16 22:10:39,789 - optuna.study.study - INFO - Trial 45 finished with values: [0.00063885074466831, 0.00014525704180876596, 0.0003116113303860276] and parameters: {'n_layers': 1, 'embedding_dim': 64, 'lr': 0.00013390000137096, 'lambda_val': 0.00032612355643755087, 'batch_size': 3762, 'optimizer': 'RMSprop'}.
2026-06-16 22:11:06,195 - experiment_functions - INFO - Early stopping at epoch 550. Best Metrics: (0.003293761896758492, 0.0007136541619300241, 0.001965938329903559)
2026-06-16 22:11:06,280 - optuna.study.study - INFO - Trial 46 finished with values: [0.003293761896758492, 0.0007136541619300241, 0.001965938329903559] and parameters: {'n_layers': 3, 'embedding_dim': 32, 'lr': 0.011355023581100071, 'lambda_val': 0.07129577174201741, 'batch_size': 1750, 'optimizer': 'RMSprop'}.
2026-06-16 22:12:00,429 - experiment_functions - INFO - Early stopping at epoch 1050. Best Metrics: (0.0006331900788949467, 0.0001499936844764431, 0.00035674029169817134)
2026-06-16 22:12:00,513 - optuna.study.study - INFO - Trial 47 finished with values: [0.0006331900788949467, 0.0001499936844764431, 0.00035674029169817134] and parameters: {'n_layers': 2, 'embedding_dim': 128, 'lr': 2.4900964828085233e-05, 'lambda_val': 0.00793754323651771, 'batch_size': 2541, 'optimizer': 'RMSprop'}.
2026-06-16 22:12:52,907 - experiment_functions - INFO - Early stopping at epoch 1050. Best Metrics: (0.00924419425492604, 0.0018867626626247317, 0.005298497859880606)
2026-06-16 22:12:52,988 - optuna.study.study - INFO - Trial 48 finished with values: [0.00924419425492604, 0.0018867626626247317, 0.005298497859880606] and parameters: {'n_layers': 3, 'embedding_dim': 64, 'lr': 0.00451036175366669, 'lambda_val': 3.2707990474449004e-05, 'batch_size': 3052, 'optimizer': 'RMSprop'}.
2026-06-16 22:13:28,333 - experiment_functions - INFO - Early stopping at epoch 750. Best Metrics: (0.020304059905651605, 0.00433876468359227, 0.011166953499921016)
2026-06-16 22:13:28,430 - optuna.study.study - INFO - Trial 49 finished with values: [0.020304059905651605, 0.00433876468359227, 0.011166953499921016] and parameters: {'n_layers': 2, 'embedding_dim': 32, 'lr': 0.0018522973992639606, 'lambda_val': 1.0174766115258743e-05, 'batch_size': 4019, 'optimizer': 'RMSprop'}.
2026-06-16 22:14:03,658 - experiment_functions - INFO - Early stopping at epoch 550. Best Metrics: (0.0061766391368416424, 0.0013862574207401796, 0.0035999150936766675)
2026-06-16 22:14:03,737 - optuna.study.study - INFO - Trial 50 finished with values: [0.0061766391368416424, 0.0013862574207401796, 0.0035999150936766675] and parameters: {'n_layers': 4, 'embedding_dim': 128, 'lr': 0.006922589827729467, 'lambda_val': 0.000154670200702685, 'batch_size': 1954, 'optimizer': 'Adam'}.
2026-06-16 22:14:44,133 - experiment_functions - INFO - Early stopping at epoch 550. Best Metrics: (0.01644573255758583, 0.003704054566123532, 0.009731518379198459)
2026-06-16 22:14:44,374 - optuna.study.study - INFO - Trial 51 finished with values: [0.01644573255758583, 0.003704054566123532, 0.009731518379198459] and parameters: {'n_layers': 3, 'embedding_dim': 256, 'lr': 0.0020532474965947955, 'lambda_val': 0.0015569229111002379, 'batch_size': 544, 'optimizer': 'RMSprop'}.
2026-06-16 22:18:50,008 - optuna.study.study - INFO - Trial 52 finished with values: [0.01715132930314921, 0.0036235316407730207, 0.009957810993658998] and parameters: {'n_layers': 2, 'embedding_dim': 256, 'lr': 0.017717847936403682, 'lambda_val': 1.3976665248992833e-06, 'batch_size': 1627, 'optimizer': 'RMSprop'}.
2026-06-16 22:19:27,913 - experiment_functions - INFO - Early stopping at epoch 700. Best Metrics: (0.017167458263782714, 0.003782998610584818, 0.009785252216909436)
2026-06-16 22:19:28,036 - optuna.study.study - INFO - Trial 53 finished with values: [0.017167458263782714, 0.003782998610584818, 0.009785252216909436] and parameters: {'n_layers': 4, 'embedding_dim': 64, 'lr': 0.001105921045395747, 'lambda_val': 2.970506579255523e-05, 'batch_size': 3321, 'optimizer': 'Adam'}.
2026-06-16 22:22:23,264 - optuna.study.study - INFO - Trial 54 finished with values: [0.015880034799347208, 0.0034577491474043196, 0.009058804075216633] and parameters: {'n_layers': 1, 'embedding_dim': 64, 'lr': 0.00451036175366669, 'lambda_val': 3.2707990474449004e-05, 'batch_size': 3992, 'optimizer': 'RMSprop'}.
2026-06-16 22:26:30,407 - optuna.study.study - INFO - Trial 55 finished with values: [0.02270784410642796, 0.004468232916508779, 0.012902552025335308] and parameters: {'n_layers': 2, 'embedding_dim': 256, 'lr': 0.011485594305176742, 'lambda_val': 1.0768752731630495e-05, 'batch_size': 2708, 'optimizer': 'RMSprop'}.
2026-06-16 22:27:09,635 - experiment_functions - INFO - Early stopping at epoch 800. Best Metrics: (0.016436707885507933, 0.0035587975243147655, 0.009245207769540582)
2026-06-16 22:27:09,754 - optuna.study.study - INFO - Trial 56 finished with values: [0.016436707885507933, 0.0035587975243147655, 0.009245207769540582] and parameters: {'n_layers': 4, 'embedding_dim': 32, 'lr': 0.001105921045395747, 'lambda_val': 0.0009589330611107825, 'batch_size': 2691, 'optimizer': 'RMSprop'}.
2026-06-16 22:27:46,332 - experiment_functions - INFO - Early stopping at epoch 500. Best Metrics: (0.0004156764039522101, 8.999621068586586e-05, 0.00021961337940061047)
2026-06-16 22:27:46,409 - optuna.study.study - INFO - Trial 57 finished with values: [0.0004156764039522101, 8.999621068586586e-05, 0.00021961337940061047] and parameters: {'n_layers': 3, 'embedding_dim': 256, 'lr': 0.03541535356300081, 'lambda_val': 0.004484339017081162, 'batch_size': 2224, 'optimizer': 'SGD'}.
2026-06-16 22:31:06,023 - optuna.study.study - INFO - Trial 58 finished with values: [0.0029593147758399997, 0.0006678666161424783, 0.0016412968677501033] and parameters: {'n_layers': 4, 'embedding_dim': 64, 'lr': 6.406610350494946e-05, 'lambda_val': 2.6858232738417883e-06, 'batch_size': 3920, 'optimizer': 'RMSprop'}.
2026-06-16 22:31:37,213 - experiment_functions - INFO - Early stopping at epoch 600. Best Metrics: (0.007530739631869308, 0.0016073007452317798, 0.0040767725618276384)
2026-06-16 22:31:37,312 - optuna.study.study - INFO - Trial 59 finished with values: [0.007530739631869308, 0.0016073007452317798, 0.0040767725618276384] and parameters: {'n_layers': 3, 'embedding_dim': 64, 'lr': 0.028916659279065504, 'lambda_val': 3.6220401980363786e-05, 'batch_size': 3321, 'optimizer': 'Adam'}.
2026-06-16 22:34:06,472 - experiment_functions - INFO - Early stopping at epoch 2700. Best Metrics: (0.0050615989034056555, 0.0010341669824428445, 0.002662192544953107)
2026-06-16 22:34:06,558 - optuna.study.study - INFO - Trial 60 finished with values: [0.0050615989034056555, 0.0010341669824428445, 0.002662192544953107] and parameters: {'n_layers': 3, 'embedding_dim': 128, 'lr': 0.057672097953226774, 'lambda_val': 0.01189156096880287, 'batch_size': 3244, 'optimizer': 'RMSprop'}.
2026-06-16 22:34:36,851 - experiment_functions - INFO - Early stopping at epoch 550. Best Metrics: (0.005170430597395246, 0.0011841606669192877, 0.0032027690099515277)
2026-06-16 22:34:36,941 - optuna.study.study - INFO - Trial 61 finished with values: [0.005170430597395246, 0.0011841606669192877, 0.0032027690099515277] and parameters: {'n_layers': 2, 'embedding_dim': 128, 'lr': 0.0922388973869132, 'lambda_val': 1.0174766115258743e-05, 'batch_size': 3466, 'optimizer': 'RMSprop'}.
2026-06-16 22:35:14,718 - experiment_functions - INFO - Early stopping at epoch 700. Best Metrics: (0.01125280686330892, 0.002290956170266515, 0.006353449358776181)
2026-06-16 22:35:14,787 - optuna.study.study - INFO - Trial 62 finished with values: [0.01125280686330892, 0.002290956170266515, 0.006353449358776181] and parameters: {'n_layers': 4, 'embedding_dim': 64, 'lr': 0.011003177343899849, 'lambda_val': 2.6858232738417883e-06, 'batch_size': 2159, 'optimizer': 'RMSprop'}.
2026-06-16 22:35:38,562 - experiment_functions - INFO - Early stopping at epoch 500. Best Metrics: (0.0005112491723288432, 0.00012946823291650877, 0.00028889997849787877)
2026-06-16 22:35:38,658 - optuna.study.study - INFO - Trial 63 finished with values: [0.0005112491723288432, 0.00012946823291650877, 0.00028889997849787877] and parameters: {'n_layers': 2, 'embedding_dim': 32, 'lr': 0.0020532474965947955, 'lambda_val': 0.0015569229111002379, 'batch_size': 718, 'optimizer': 'SGD'}.
2026-06-16 22:37:35,311 - experiment_functions - INFO - Early stopping at epoch 1450. Best Metrics: (0.020858980783594192, 0.004517178224074776, 0.011798662917455603)
2026-06-16 22:37:35,395 - optuna.study.study - INFO - Trial 64 finished with values: [0.020858980783594192, 0.004517178224074776, 0.011798662917455603] and parameters: {'n_layers': 4, 'embedding_dim': 256, 'lr': 0.0003334703704985316, 'lambda_val': 1.4405090810627564e-05, 'batch_size': 3992, 'optimizer': 'Adam'}.
2026-06-16 22:38:02,607 - experiment_functions - INFO - Early stopping at epoch 600. Best Metrics: (0.0004814384074192993, 0.00011210054313502591, 0.0002772830372753707)
2026-06-16 22:38:02,692 - optuna.study.study - INFO - Trial 65 finished with values: [0.0004814384074192993, 0.00011210054313502591, 0.0002772830372753707] and parameters: {'n_layers': 1, 'embedding_dim': 32, 'lr': 1.4285496929383941e-05, 'lambda_val': 1.0697648887853802e-06, 'batch_size': 2255, 'optimizer': 'RMSprop'}.
2026-06-16 22:38:32,723 - experiment_functions - INFO - Early stopping at epoch 550. Best Metrics: (0.004247231568777636, 0.0010010104837691045, 0.002643492052073206)
2026-06-16 22:38:32,821 - optuna.study.study - INFO - Trial 66 finished with values: [0.004247231568777636, 0.0010010104837691045, 0.002643492052073206] and parameters: {'n_layers': 2, 'embedding_dim': 128, 'lr': 0.07411885466503862, 'lambda_val': 0.00022627538997687695, 'batch_size': 1344, 'optimizer': 'RMSprop'}.
2026-06-16 22:39:30,905 - experiment_functions - INFO - Early stopping at epoch 1000. Best Metrics: (0.021220520165370616, 0.004559808008083871, 0.012197087799672322)
2026-06-16 22:39:30,990 - optuna.study.study - INFO - Trial 67 finished with values: [0.021220520165370616, 0.004559808008083871, 0.012197087799672322] and parameters: {'n_layers': 3, 'embedding_dim': 128, 'lr': 0.0006340132793158045, 'lambda_val': 2.970506579255523e-05, 'batch_size': 3321, 'optimizer': 'RMSprop'}.
2026-06-16 22:42:16,919 - optuna.study.study - INFO - Trial 68 finished with values: [0.0037046184226767606, 0.0009204875584185929, 0.002224307977553942] and parameters: {'n_layers': 1, 'embedding_dim': 32, 'lr': 0.0003495758618352309, 'lambda_val': 2.6858232738417883e-06, 'batch_size': 1835, 'optimizer': 'RMSprop'}.
2026-06-16 22:42:43,787 - experiment_functions - INFO - Early stopping at epoch 550. Best Metrics: (0.005200966887674337, 0.001182581786030062, 0.0030341401609599214)
2026-06-16 22:42:43,880 - optuna.study.study - INFO - Trial 69 finished with values: [0.005200966887674337, 0.001182581786030062, 0.0030341401609599214] and parameters: {'n_layers': 1, 'embedding_dim': 96, 'lr': 0.04995038334471051, 'lambda_val': 5.679298487246333e-06, 'batch_size': 3066, 'optimizer': 'RMSprop'}.
2026-06-16 22:43:22,628 - experiment_functions - INFO - Early stopping at epoch 700. Best Metrics: (0.026572547539909782, 0.005715548818997095, 0.015095671658492276)
2026-06-16 22:43:22,794 - optuna.study.study - INFO - Trial 70 finished with values: [0.026572547539909782, 0.005715548818997095, 0.015095671658492276] and parameters: {'n_layers': 2, 'embedding_dim': 128, 'lr': 0.0017542874983550202, 'lambda_val': 4.546254137443526e-06, 'batch_size': 3992, 'optimizer': 'Adam'}.
2026-06-16 22:43:50,300 - experiment_functions - INFO - Early stopping at epoch 500. Best Metrics: (0.0006644709593184758, 0.0001199949475811545, 0.00036275956491405384)
2026-06-16 22:43:50,383 - optuna.study.study - INFO - Trial 71 finished with values: [0.0006644709593184758, 0.0001199949475811545, 0.00036275956491405384] and parameters: {'n_layers': 4, 'embedding_dim': 64, 'lr': 5.177034447951541e-05, 'lambda_val': 0.000640197089155557, 'batch_size': 636, 'optimizer': 'SGD'}.
2026-06-16 22:44:18,931 - experiment_functions - INFO - Early stopping at epoch 550. Best Metrics: (0.009209369130924266, 0.0019530756599722117, 0.005181519808528563)
2026-06-16 22:44:20,110 - optuna.study.study - INFO - Trial 72 finished with values: [0.009209369130924266, 0.0019530756599722117, 0.005181519808528563] and parameters: {'n_layers': 2, 'embedding_dim': 96, 'lr': 0.03496909370828696, 'lambda_val': 0.00014566380585562914, 'batch_size': 3469, 'optimizer': 'RMSprop'}.
2026-06-16 22:44:53,564 - experiment_functions - INFO - Early stopping at epoch 700. Best Metrics: (0.010501789773093928, 0.00226727295692813, 0.006050704295299288)
2026-06-16 22:44:53,659 - optuna.study.study - INFO - Trial 73 finished with values: [0.010501789773093928, 0.00226727295692813, 0.006050704295299288] and parameters: {'n_layers': 3, 'embedding_dim': 32, 'lr': 0.013825847167324911, 'lambda_val': 6.67969903638883e-05, 'batch_size': 1954, 'optimizer': 'RMSprop'}.
2026-06-16 22:45:21,036 - experiment_functions - INFO - Early stopping at epoch 500. Best Metrics: (0.0004887971698617149, 0.00011367942402425162, 0.00027265278803852405)
2026-06-16 22:45:21,117 - optuna.study.study - INFO - Trial 74 finished with values: [0.0004887971698617149, 0.00011367942402425162, 0.00027265278803852405] and parameters: {'n_layers': 2, 'embedding_dim': 128, 'lr': 1.2326794457339162e-05, 'lambda_val': 0.0007684480453816692, 'batch_size': 3466, 'optimizer': 'RMSprop'}.
2026-06-16 22:48:43,932 - optuna.study.study - INFO - Trial 75 finished with values: [0.020138675997127604, 0.004664014146772767, 0.011898240247072926] and parameters: {'n_layers': 2, 'embedding_dim': 128, 'lr': 0.00019812603137728135, 'lambda_val': 1.0697648887853802e-06, 'batch_size': 2889, 'optimizer': 'RMSprop'}.
2026-06-16 22:49:48,718 - experiment_functions - INFO - Early stopping at epoch 1050. Best Metrics: (0.0006448025632815776, 0.0001278893520272831, 0.00034922543134551973)
2026-06-16 22:49:49,523 - optuna.study.study - INFO - Trial 76 finished with values: [0.0006448025632815776, 0.0001278893520272831, 0.00034922543134551973] and parameters: {'n_layers': 2, 'embedding_dim': 256, 'lr': 5.308983857882518e-05, 'lambda_val': 0.002293564989415113, 'batch_size': 1075, 'optimizer': 'RMSprop'}.
2026-06-16 22:53:09,197 - optuna.study.study - INFO - Trial 77 finished with values: [0.0011386307433654398, 0.00030156624984211186, 0.0007039758705364541] and parameters: {'n_layers': 4, 'embedding_dim': 64, 'lr': 5.308983857882518e-05, 'lambda_val': 0.0002293448249582992, 'batch_size': 3338, 'optimizer': 'Adam'}.
2026-06-16 22:53:32,762 - experiment_functions - INFO - Early stopping at epoch 500. Best Metrics: (0.0006255690297127268, 0.00013420487558418596, 0.00036604670483949924)
2026-06-16 22:53:32,854 - optuna.study.study - INFO - Trial 78 finished with values: [0.0006255690297127268, 0.00013420487558418596, 0.00036604670483949924] and parameters: {'n_layers': 1, 'embedding_dim': 64, 'lr': 7.842058186123007e-05, 'lambda_val': 1.9940041230698223e-05, 'batch_size': 1429, 'optimizer': 'SGD'}.
2026-06-16 22:56:37,082 - optuna.study.study - INFO - Trial 79 finished with values: [0.019208681508001493, 0.0040466717190855124, 0.011326301838169739] and parameters: {'n_layers': 2, 'embedding_dim': 64, 'lr': 0.017717847936403682, 'lambda_val': 3.327121177308548e-05, 'batch_size': 835, 'optimizer': 'RMSprop'}.
2026-06-16 22:57:12,592 - experiment_functions - INFO - Early stopping at epoch 750. Best Metrics: (0.017290516713248924, 0.0037924718959201718, 0.009366306552496559)
2026-06-16 22:57:13,928 - optuna.study.study - INFO - Trial 80 finished with values: [0.017290516713248924, 0.0037924718959201718, 0.009366306552496559] and parameters: {'n_layers': 2, 'embedding_dim': 32, 'lr': 0.0018522973992639606, 'lambda_val': 1.9413402449837055e-05, 'batch_size': 4019, 'optimizer': 'RMSprop'}.
2026-06-16 22:59:29,584 - experiment_functions - INFO - Early stopping at epoch 3100. Best Metrics: (0.014632381023610535, 0.0029951370468611852, 0.00826554613196029)
2026-06-16 22:59:29,672 - optuna.study.study - INFO - Trial 81 finished with values: [0.014632381023610535, 0.0029951370468611852, 0.00826554613196029] and parameters: {'n_layers': 1, 'embedding_dim': 64, 'lr': 0.017717847936403682, 'lambda_val': 3.327121177308548e-05, 'batch_size': 3762, 'optimizer': 'RMSprop'}.
2026-06-16 22:59:55,468 - experiment_functions - INFO - Early stopping at epoch 500. Best Metrics: (0.0004429717712054767, 0.0001042061386888973, 0.00027561897129139203)
2026-06-16 22:59:55,589 - optuna.study.study - INFO - Trial 82 finished with values: [0.0004429717712054767, 0.0001042061386888973, 0.00027561897129139203] and parameters: {'n_layers': 2, 'embedding_dim': 96, 'lr': 0.0001097610212578119, 'lambda_val': 1.86163710396572e-05, 'batch_size': 3792, 'optimizer': 'SGD'}.
2026-06-16 23:02:47,368 - optuna.study.study - INFO - Trial 83 finished with values: [0.0022912905950696694, 0.0005210306934444865, 0.001280796330296277] and parameters: {'n_layers': 2, 'embedding_dim': 32, 'lr': 0.00019812603137728135, 'lambda_val': 0.002293564989415113, 'batch_size': 1075, 'optimizer': 'RMSprop'}.
2026-06-16 23:03:16,966 - experiment_functions - INFO - Early stopping at epoch 500. Best Metrics: (0.0005104631105176589, 0.00011367942402425162, 0.0002975910631458554)
2026-06-16 23:03:17,105 - optuna.study.study - INFO - Trial 84 finished with values: [0.0005104631105176589, 0.00011367942402425162, 0.0002975910631458554] and parameters: {'n_layers': 3, 'embedding_dim': 128, 'lr': 5.177034447951541e-05, 'lambda_val': 0.027223907583749356, 'batch_size': 833, 'optimizer': 'RMSprop'}.
2026-06-16 23:04:20,849 - experiment_functions - INFO - Early stopping at epoch 1350. Best Metrics: (0.003224732414453241, 0.0006852343059239611, 0.0015905889157815719)
2026-06-16 23:04:20,935 - optuna.study.study - INFO - Trial 85 finished with values: [0.003224732414453241, 0.0006852343059239611, 0.0015905889157815719] and parameters: {'n_layers': 1, 'embedding_dim': 128, 'lr': 0.08401587075016087, 'lambda_val': 0.05431013941584991, 'batch_size': 1082, 'optimizer': 'RMSprop'}.
2026-06-16 23:08:00,795 - optuna.study.study - INFO - Trial 86 finished with values: [0.011833964412419835, 0.00251042061386889, 0.006447712738775702] and parameters: {'n_layers': 4, 'embedding_dim': 96, 'lr': 0.08562721443719762, 'lambda_val': 0.0009589330611107825, 'batch_size': 3920, 'optimizer': 'RMSprop'}.
2026-06-16 23:08:35,787 - experiment_functions - INFO - Early stopping at epoch 750. Best Metrics: (0.01513588837053616, 0.0032824933687002652, 0.008310128253807746)
2026-06-16 23:08:35,882 - optuna.study.study - INFO - Trial 87 finished with values: [0.01513588837053616, 0.0032824933687002652, 0.008310128253807746] and parameters: {'n_layers': 2, 'embedding_dim': 32, 'lr': 0.0018522973992639606, 'lambda_val': 0.002293564989415113, 'batch_size': 4019, 'optimizer': 'RMSprop'}.
2026-06-16 23:09:10,721 - experiment_functions - INFO - Early stopping at epoch 650. Best Metrics: (0.005768664289263731, 0.001177845143362385, 0.0030925334346197414)
2026-06-16 23:09:10,808 - optuna.study.study - INFO - Trial 88 finished with values: [0.005768664289263731, 0.001177845143362385, 0.0030925334346197414] and parameters: {'n_layers': 4, 'embedding_dim': 64, 'lr': 0.017717847936403682, 'lambda_val': 0.0013776875145461197, 'batch_size': 3680, 'optimizer': 'RMSprop'}.
2026-06-16 23:09:42,944 - experiment_functions - INFO - Early stopping at epoch 500. Best Metrics: (0.0005589644371407279, 0.0001373626373626374, 0.00033486951059665226)
2026-06-16 23:09:43,044 - optuna.study.study - INFO - Trial 89 finished with values: [0.0005589644371407279, 0.0001373626373626374, 0.00033486951059665226] and parameters: {'n_layers': 2, 'embedding_dim': 256, 'lr': 0.0017542874983550202, 'lambda_val': 1.4405090810627564e-05, 'batch_size': 3992, 'optimizer': 'SGD'}.
2026-06-16 23:11:16,433 - experiment_functions - INFO - Early stopping at epoch 1500. Best Metrics: (0.0005307822532532587, 0.0001294682329165088, 0.0002925272939702701)
2026-06-16 23:11:16,528 - optuna.study.study - INFO - Trial 90 finished with values: [0.0005307822532532587, 0.0001294682329165088, 0.0002925272939702701] and parameters: {'n_layers': 2, 'embedding_dim': 256, 'lr': 4.264623107737865e-05, 'lambda_val': 1.4405090810627564e-05, 'batch_size': 3992, 'optimizer': 'Adam'}.
2026-06-16 23:11:46,475 - experiment_functions - INFO - Early stopping at epoch 550. Best Metrics: (0.005009063230267295, 0.0011715296198054818, 0.0028157174541246226)
2026-06-16 23:11:46,564 - optuna.study.study - INFO - Trial 91 finished with values: [0.005009063230267295, 0.0011715296198054818, 0.0028157174541246226] and parameters: {'n_layers': 4, 'embedding_dim': 64, 'lr': 0.0043851759186162515, 'lambda_val': 0.00027509354291516515, 'batch_size': 1703, 'optimizer': 'Adam'}.
2026-06-16 23:13:06,911 - experiment_functions - INFO - Early stopping at epoch 1000. Best Metrics: (0.01424848717355806, 0.0032903877731463938, 0.008261692090254614)
2026-06-16 23:13:06,991 - optuna.study.study - INFO - Trial 92 finished with values: [0.01424848717355806, 0.0032903877731463938, 0.008261692090254614] and parameters: {'n_layers': 4, 'embedding_dim': 256, 'lr': 0.0003334703704985316, 'lambda_val': 0.009747650699295873, 'batch_size': 2988, 'optimizer': 'Adam'}.
2026-06-16 23:13:33,494 - experiment_functions - INFO - Early stopping at epoch 550. Best Metrics: (0.009198242906859666, 0.001946760136415309, 0.0051970687888672346)
2026-06-16 23:13:33,638 - optuna.study.study - INFO - Trial 93 finished with values: [0.009198242906859666, 0.001946760136415309, 0.0051970687888672346] and parameters: {'n_layers': 3, 'embedding_dim': 32, 'lr': 0.0438685708396901, 'lambda_val': 2.5934765697086813e-05, 'batch_size': 1386, 'optimizer': 'RMSprop'}.
