2026-06-17 19:00:35,505 - optuna.study.study - INFO - Trial 128 finished with values: [0.003561045209969876, 0.0008778577744094986, 0.002178058097641878] and parameters: {'n_layers': 4, 'embedding_dim': 64, 'lr': 0.0032052069599508804, 'lambda_val': 0.00027195197586368466, 'batch_size': 806, 'optimizer': 'Adam'}.
2026-06-17 19:01:11,895 - experiment_functions - INFO - Early stopping at epoch 850. Best Metrics: (0.0029080377489459504, 0.0006931287103700898, 0.0017890860238987342)
2026-06-17 19:01:11,993 - optuna.study.study - INFO - Trial 129 finished with values: [0.0029080377489459504, 0.0006931287103700898, 0.0017890860238987342] and parameters: {'n_layers': 2, 'embedding_dim': 64, 'lr': 0.0032052069599508804, 'lambda_val': 0.00040852653324075796, 'batch_size': 938, 'optimizer': 'Adam'}.
2026-06-17 19:01:43,720 - experiment_functions - INFO - Early stopping at epoch 550. Best Metrics: (0.002309906267121377, 0.0006631299734748011, 0.001487982467204063)
2026-06-17 19:01:43,803 - optuna.study.study - INFO - Trial 130 finished with values: [0.002309906267121377, 0.0006631299734748011, 0.001487982467204063] and parameters: {'n_layers': 4, 'embedding_dim': 256, 'lr': 0.01562100019075772, 'lambda_val': 0.002699561195512288, 'batch_size': 3820, 'optimizer': 'Adam'}.
2026-06-17 19:02:12,347 - experiment_functions - INFO - Early stopping at epoch 550. Best Metrics: (0.002663095714957535, 0.0006773399014778326, 0.0017454042093878101)
2026-06-17 19:02:12,435 - optuna.study.study - INFO - Trial 131 finished with values: [0.002663095714957535, 0.0006773399014778326, 0.0017454042093878101] and parameters: {'n_layers': 2, 'embedding_dim': 256, 'lr': 0.005194518548706596, 'lambda_val': 8.796328661080472e-05, 'batch_size': 3749, 'optimizer': 'RMSprop'}.
2026-06-17 19:02:43,226 - experiment_functions - INFO - Early stopping at epoch 650. Best Metrics: (0.0032905899546102502, 0.0007941770872805356, 0.0020944380875958604)
2026-06-17 19:02:43,302 - optuna.study.study - INFO - Trial 132 finished with values: [0.0032905899546102502, 0.0007941770872805356, 0.0020944380875958604] and parameters: {'n_layers': 3, 'embedding_dim': 128, 'lr': 0.0015933103817621604, 'lambda_val': 0.000105123201052829, 'batch_size': 3749, 'optimizer': 'RMSprop'}.
2026-06-17 19:03:08,497 - experiment_functions - INFO - Early stopping at epoch 550. Best Metrics: (0.002288908898585723, 0.0005936592143488697, 0.001479927242739351)
2026-06-17 19:03:08,788 - optuna.study.study - INFO - Trial 133 finished with values: [0.002288908898585723, 0.0005936592143488697, 0.001479927242739351] and parameters: {'n_layers': 2, 'embedding_dim': 96, 'lr': 0.03448090174378339, 'lambda_val': 4.4572768261600244e-05, 'batch_size': 2182, 'optimizer': 'Adam'}.
2026-06-17 19:03:42,936 - experiment_functions - INFO - Early stopping at epoch 800. Best Metrics: (0.0024424402728773155, 0.0005652393583428066, 0.001474231045044474)
2026-06-17 19:03:43,015 - optuna.study.study - INFO - Trial 134 finished with values: [0.0024424402728773155, 0.0005652393583428066, 0.001474231045044474] and parameters: {'n_layers': 1, 'embedding_dim': 96, 'lr': 0.062357384270714994, 'lambda_val': 1.645640569286691e-06, 'batch_size': 649, 'optimizer': 'RMSprop'}.
2026-06-17 19:04:40,126 - experiment_functions - INFO - Early stopping at epoch 1400. Best Metrics: (0.0035525946113121425, 0.0008162814197296957, 0.0020887060007282647)
2026-06-17 19:04:40,212 - optuna.study.study - INFO - Trial 135 finished with values: [0.0035525946113121425, 0.0008162814197296957, 0.0020887060007282647] and parameters: {'n_layers': 3, 'embedding_dim': 32, 'lr': 0.0012702568149946026, 'lambda_val': 2.3768863399722796e-06, 'batch_size': 2509, 'optimizer': 'RMSprop'}.
2026-06-17 19:07:19,234 - experiment_functions - INFO - Early stopping at epoch 3850. Best Metrics: (0.0037209911354787843, 0.0007847038019451813, 0.0023935936607997867)
2026-06-17 19:07:19,299 - optuna.study.study - INFO - Trial 136 finished with values: [0.0037209911354787843, 0.0007847038019451813, 0.0023935936607997867] and parameters: {'n_layers': 3, 'embedding_dim': 64, 'lr': 0.000416242081306151, 'lambda_val': 4.337539728895895e-06, 'batch_size': 1849, 'optimizer': 'Adam'}.
2026-06-17 19:07:41,700 - experiment_functions - INFO - Early stopping at epoch 500. Best Metrics: (0.00048586126707774493, 0.00012157382847038019, 0.00028878989963514726)
2026-06-17 19:07:41,779 - optuna.study.study - INFO - Trial 137 finished with values: [0.00048586126707774493, 0.00012157382847038019, 0.00028878989963514726] and parameters: {'n_layers': 2, 'embedding_dim': 64, 'lr': 1.3814983994262062e-05, 'lambda_val': 6.0082896507722305e-05, 'batch_size': 2347, 'optimizer': 'Adam'}.
2026-06-17 19:09:30,291 - experiment_functions - INFO - Early stopping at epoch 2650. Best Metrics: (0.0017358758298997932, 0.00048155867121384366, 0.0011619088199158769)
2026-06-17 19:09:30,378 - optuna.study.study - INFO - Trial 138 finished with values: [0.0017358758298997932, 0.00048155867121384366, 0.0011619088199158769] and parameters: {'n_layers': 1, 'embedding_dim': 96, 'lr': 0.0006957971417897457, 'lambda_val': 0.04030448941942054, 'batch_size': 3135, 'optimizer': 'Adam'}.
2026-06-17 19:12:16,519 - optuna.study.study - INFO - Trial 139 finished with values: [0.0030628067707137944, 0.0007262852090438297, 0.0019432034053452128] and parameters: {'n_layers': 3, 'embedding_dim': 64, 'lr': 0.0003063523873638634, 'lambda_val': 4.337539728895895e-06, 'batch_size': 3820, 'optimizer': 'RMSprop'}.
2026-06-17 19:12:45,480 - experiment_functions - INFO - Early stopping at epoch 600. Best Metrics: (0.00296578511282018, 0.000753126184160667, 0.0019361372622535788)
2026-06-17 19:12:45,549 - optuna.study.study - INFO - Trial 140 finished with values: [0.00296578511282018, 0.000753126184160667, 0.0019361372622535788] and parameters: {'n_layers': 4, 'embedding_dim': 96, 'lr': 0.004937154060813022, 'lambda_val': 0.00015820612384227593, 'batch_size': 3135, 'optimizer': 'Adam'}.
2026-06-17 19:13:13,390 - experiment_functions - INFO - Early stopping at epoch 550. Best Metrics: (0.002402055192477394, 0.0006457622836933182, 0.00166182763575778)
2026-06-17 19:13:13,457 - optuna.study.study - INFO - Trial 141 finished with values: [0.002402055192477394, 0.0006457622836933182, 0.00166182763575778] and parameters: {'n_layers': 4, 'embedding_dim': 128, 'lr': 0.062357384270714994, 'lambda_val': 0.000105123201052829, 'batch_size': 3749, 'optimizer': 'Adam'}.
2026-06-17 19:13:38,190 - experiment_functions - INFO - Early stopping at epoch 550. Best Metrics: (0.0020922827656372793, 0.0004657698623215865, 0.0013190990995406808)
2026-06-17 19:13:38,282 - optuna.study.study - INFO - Trial 142 finished with values: [0.0020922827656372793, 0.0004657698623215865, 0.0013190990995406808] and parameters: {'n_layers': 1, 'embedding_dim': 96, 'lr': 0.029808523605573987, 'lambda_val': 5.703242122988681e-05, 'batch_size': 3423, 'optimizer': 'RMSprop'}.
2026-06-17 19:16:23,808 - optuna.study.study - INFO - Trial 143 finished with values: [0.0010245795597948843, 0.000239989895162309, 0.0006077836439434418] and parameters: {'n_layers': 1, 'embedding_dim': 128, 'lr': 0.00014268745920688967, 'lambda_val': 0.00027195197586368466, 'batch_size': 1059, 'optimizer': 'Adam'}.
2026-06-17 19:16:47,005 - experiment_functions - INFO - Early stopping at epoch 500. Best Metrics: (0.0004523829903528273, 0.00011841606669192877, 0.0002710490897638943)
2026-06-17 19:16:47,090 - optuna.study.study - INFO - Trial 144 finished with values: [0.0004523829903528273, 0.00011841606669192877, 0.0002710490897638943] and parameters: {'n_layers': 4, 'embedding_dim': 64, 'lr': 0.00018570284117567072, 'lambda_val': 0.0069523388896965115, 'batch_size': 927, 'optimizer': 'SGD'}.
2026-06-17 19:17:11,113 - experiment_functions - INFO - Early stopping at epoch 550. Best Metrics: (0.0015837871191088872, 0.0004420866489832008, 0.0010397031615584432)
2026-06-17 19:17:11,193 - optuna.study.study - INFO - Trial 145 finished with values: [0.0015837871191088872, 0.0004420866489832008, 0.0010397031615584432] and parameters: {'n_layers': 4, 'embedding_dim': 32, 'lr': 0.027019907715942967, 'lambda_val': 0.00040852653324075796, 'batch_size': 1787, 'optimizer': 'RMSprop'}.
2026-06-17 19:17:36,650 - experiment_functions - INFO - Early stopping at epoch 550. Best Metrics: (0.003042502986765062, 0.0007357584943791841, 0.001908018062390455)
2026-06-17 19:17:36,719 - optuna.study.study - INFO - Trial 146 finished with values: [0.003042502986765062, 0.0007357584943791841, 0.001908018062390455] and parameters: {'n_layers': 4, 'embedding_dim': 64, 'lr': 0.0036567747130372475, 'lambda_val': 9.638501122128868e-05, 'batch_size': 2599, 'optimizer': 'RMSprop'}.
2026-06-17 19:18:06,800 - experiment_functions - INFO - Early stopping at epoch 550. Best Metrics: (0.002603176797648146, 0.0007026019957054441, 0.0017855119659621805)
2026-06-17 19:18:06,893 - optuna.study.study - INFO - Trial 147 finished with values: [0.002603176797648146, 0.0007026019957054441, 0.0017855119659621805] and parameters: {'n_layers': 3, 'embedding_dim': 256, 'lr': 0.01562100019075772, 'lambda_val': 3.943481674172961e-05, 'batch_size': 806, 'optimizer': 'Adam'}.
2026-06-17 19:20:57,589 - optuna.study.study - INFO - Trial 148 finished with values: [0.0030990900578481907, 0.0007341796134899583, 0.001962440644275237] and parameters: {'n_layers': 3, 'embedding_dim': 96, 'lr': 0.000416242081306151, 'lambda_val': 1.3870977953506033e-05, 'batch_size': 806, 'optimizer': 'Adam'}.
2026-06-17 19:22:35,620 - experiment_functions - INFO - Early stopping at epoch 2350. Best Metrics: (0.0031250810338055044, 0.0007215485663761526, 0.0019499929313785212)
2026-06-17 19:22:35,721 - optuna.study.study - INFO - Trial 149 finished with values: [0.0031250810338055044, 0.0007215485663761526, 0.0019499929313785212] and parameters: {'n_layers': 3, 'embedding_dim': 64, 'lr': 0.000416242081306151, 'lambda_val': 0.002699561195512288, 'batch_size': 3820, 'optimizer': 'Adam'}.
2026-06-17 19:25:32,242 - optuna.study.study - INFO - Trial 150 finished with values: [0.0032098709117935648, 0.0007768093974990527, 0.0021302119011842534] and parameters: {'n_layers': 3, 'embedding_dim': 128, 'lr': 0.000416242081306151, 'lambda_val': 0.0012364501785880905, 'batch_size': 1377, 'optimizer': 'Adam'}.
2026-06-17 19:26:29,049 - experiment_functions - INFO - Early stopping at epoch 1250. Best Metrics: (0.003164559587499858, 0.0007831249210559556, 0.0020054265415241895)
2026-06-17 19:26:29,134 - optuna.study.study - INFO - Trial 151 finished with values: [0.003164559587499858, 0.0007831249210559556, 0.0020054265415241895] and parameters: {'n_layers': 4, 'embedding_dim': 96, 'lr': 0.0008244869685256396, 'lambda_val': 6.0082896507722305e-05, 'batch_size': 3850, 'optimizer': 'Adam'}.
2026-06-17 19:27:06,302 - experiment_functions - INFO - Early stopping at epoch 800. Best Metrics: (0.0033582340186236255, 0.0008715422508525957, 0.002054748958528804)
2026-06-17 19:27:06,378 - optuna.study.study - INFO - Trial 152 finished with values: [0.0033582340186236255, 0.0008715422508525957, 0.002054748958528804] and parameters: {'n_layers': 4, 'embedding_dim': 96, 'lr': 0.0015933103817621604, 'lambda_val': 0.002699561195512288, 'batch_size': 1377, 'optimizer': 'Adam'}.
2026-06-17 19:27:39,180 - experiment_functions - INFO - Early stopping at epoch 700. Best Metrics: (0.0033352289632902323, 0.00088101553618795, 0.002115238953257991)
2026-06-17 19:27:39,250 - optuna.study.study - INFO - Trial 153 finished with values: [0.0033352289632902323, 0.00088101553618795, 0.002115238953257991] and parameters: {'n_layers': 3, 'embedding_dim': 128, 'lr': 0.0032052069599508804, 'lambda_val': 4.337539728895895e-06, 'batch_size': 1849, 'optimizer': 'RMSprop'}.
2026-06-17 19:29:34,978 - experiment_functions - INFO - Early stopping at epoch 2800. Best Metrics: (0.0008383406634014174, 0.00019420234937476318, 0.0004843666725797896)
2026-06-17 19:29:35,053 - optuna.study.study - INFO - Trial 154 finished with values: [0.0008383406634014174, 0.00019420234937476318, 0.0004843666725797896] and parameters: {'n_layers': 3, 'embedding_dim': 64, 'lr': 0.00010419953915968625, 'lambda_val': 0.00015440813799502288, 'batch_size': 927, 'optimizer': 'Adam'}.
2026-06-17 19:30:04,807 - experiment_functions - INFO - Early stopping at epoch 600. Best Metrics: (0.0030745190847000143, 0.0008052292535051155, 0.0019601040472241146)
2026-06-17 19:30:04,885 - optuna.study.study - INFO - Trial 155 finished with values: [0.0030745190847000143, 0.0008052292535051155, 0.0019601040472241146] and parameters: {'n_layers': 4, 'embedding_dim': 128, 'lr': 0.0032052069599508804, 'lambda_val': 4.337539728895895e-06, 'batch_size': 3749, 'optimizer': 'RMSprop'}.
2026-06-17 19:30:26,978 - experiment_functions - INFO - Early stopping at epoch 500. Best Metrics: (0.0004204200165608601, 9.157509157509158e-05, 0.00021552993158108506)
2026-06-17 19:30:27,047 - optuna.study.study - INFO - Trial 156 finished with values: [0.0004204200165608601, 9.157509157509158e-05, 0.00021552993158108506] and parameters: {'n_layers': 1, 'embedding_dim': 64, 'lr': 0.0006583503636698831, 'lambda_val': 6.0082896507722305e-05, 'batch_size': 1849, 'optimizer': 'SGD'}.
2026-06-17 19:32:42,583 - experiment_functions - INFO - Early stopping at epoch 2550. Best Metrics: (0.0037694315329897736, 0.0009504862953138816, 0.0022944061021943855)
2026-06-17 19:32:42,654 - optuna.study.study - INFO - Trial 157 finished with values: [0.0037694315329897736, 0.0009504862953138816, 0.0022944061021943855] and parameters: {'n_layers': 4, 'embedding_dim': 256, 'lr': 0.000416242081306151, 'lambda_val': 4.337539728895895e-06, 'batch_size': 1849, 'optimizer': 'RMSprop'}.
2026-06-17 19:33:15,746 - experiment_functions - INFO - Early stopping at epoch 700. Best Metrics: (0.0031262902292398913, 0.0007989137299482127, 0.002032379702739046)
2026-06-17 19:33:15,850 - optuna.study.study - INFO - Trial 158 finished with values: [0.0031262902292398913, 0.0007989137299482127, 0.002032379702739046] and parameters: {'n_layers': 4, 'embedding_dim': 96, 'lr': 0.0036567747130372475, 'lambda_val': 0.00040852653324075796, 'batch_size': 1377, 'optimizer': 'Adam'}.
2026-06-17 19:34:17,338 - experiment_functions - INFO - Early stopping at epoch 1450. Best Metrics: (0.003525480471138736, 0.0008731211317418215, 0.0022921218777188952)
2026-06-17 19:34:17,421 - optuna.study.study - INFO - Trial 159 finished with values: [0.003525480471138736, 0.0008731211317418215, 0.0022921218777188952] and parameters: {'n_layers': 3, 'embedding_dim': 64, 'lr': 0.0012702568149946026, 'lambda_val': 0.00010081340740714468, 'batch_size': 1377, 'optimizer': 'RMSprop'}.
2026-06-17 19:34:41,866 - experiment_functions - INFO - Early stopping at epoch 550. Best Metrics: (0.002626130186372235, 0.0006394467601364154, 0.0016827067488814202)
2026-06-17 19:34:42,187 - optuna.study.study - INFO - Trial 160 finished with values: [0.002626130186372235, 0.0006394467601364154, 0.0016827067488814202] and parameters: {'n_layers': 4, 'embedding_dim': 32, 'lr': 0.01562100019075772, 'lambda_val': 0.0069523388896965115, 'batch_size': 618, 'optimizer': 'Adam'}.
2026-06-17 19:35:07,191 - experiment_functions - INFO - Early stopping at epoch 550. Best Metrics: (0.002955111407892085, 0.000708917519262347, 0.001872816956432253)
2026-06-17 19:35:07,268 - optuna.study.study - INFO - Trial 161 finished with values: [0.002955111407892085, 0.000708917519262347, 0.001872816956432253] and parameters: {'n_layers': 3, 'embedding_dim': 64, 'lr': 0.01562100019075772, 'lambda_val': 4.337539728895895e-06, 'batch_size': 2290, 'optimizer': 'Adam'}.
2026-06-17 19:36:06,141 - experiment_functions - INFO - Early stopping at epoch 1350. Best Metrics: (0.0035465762523567103, 0.0008747000126310472, 0.0022163786238415142)
2026-06-17 19:36:06,230 - optuna.study.study - INFO - Trial 162 finished with values: [0.0035465762523567103, 0.0008747000126310472, 0.0022163786238415142] and parameters: {'n_layers': 4, 'embedding_dim': 64, 'lr': 0.0012702568149946026, 'lambda_val': 8.796328661080472e-05, 'batch_size': 1849, 'optimizer': 'RMSprop'}.
2026-06-17 19:38:45,236 - optuna.study.study - INFO - Trial 163 finished with values: [0.0032757222985968803, 0.0007168119237084754, 0.001969419165817171] and parameters: {'n_layers': 3, 'embedding_dim': 32, 'lr': 0.000416242081306151, 'lambda_val': 2.3768863399722796e-06, 'batch_size': 1849, 'optimizer': 'RMSprop'}.
2026-06-17 19:41:33,864 - experiment_functions - INFO - Early stopping at epoch 3850. Best Metrics: (0.0009034952671489977, 0.00021157003915624602, 0.0005220402650216009)
2026-06-17 19:41:33,939 - optuna.study.study - INFO - Trial 164 finished with values: [0.0009034952671489977, 0.00021157003915624602, 0.0005220402650216009] and parameters: {'n_layers': 4, 'embedding_dim': 96, 'lr': 7.958814364153483e-05, 'lambda_val': 9.638501122128868e-05, 'batch_size': 2347, 'optimizer': 'Adam'}.
2026-06-17 19:44:55,497 - optuna.study.study - INFO - Trial 165 finished with values: [0.003112363632615305, 0.0007578628268283441, 0.0019238269631408167] and parameters: {'n_layers': 3, 'embedding_dim': 256, 'lr': 0.000416242081306151, 'lambda_val': 3.49728111450608e-06, 'batch_size': 3820, 'optimizer': 'Adam'}.
2026-06-17 19:45:19,888 - experiment_functions - INFO - Early stopping at epoch 550. Best Metrics: (0.002799362507472984, 0.0006710243779209298, 0.0017131958601615052)
2026-06-17 19:45:19,954 - optuna.study.study - INFO - Trial 166 finished with values: [0.002799362507472984, 0.0006710243779209298, 0.0017131958601615052] and parameters: {'n_layers': 4, 'embedding_dim': 32, 'lr': 0.004937154060813022, 'lambda_val': 0.002699561195512288, 'batch_size': 1751, 'optimizer': 'RMSprop'}.
2026-06-17 19:46:35,501 - experiment_functions - INFO - Early stopping at epoch 1800. Best Metrics: (0.003554601715119139, 0.000819439181508147, 0.002308806722791472)
2026-06-17 19:46:35,593 - optuna.study.study - INFO - Trial 167 finished with values: [0.003554601715119139, 0.000819439181508147, 0.002308806722791472] and parameters: {'n_layers': 1, 'embedding_dim': 128, 'lr': 0.0012702568149946026, 'lambda_val': 8.796328661080472e-05, 'batch_size': 1059, 'optimizer': 'RMSprop'}.
2026-06-17 19:47:09,820 - experiment_functions - INFO - Early stopping at epoch 600. Best Metrics: (0.003061242685179189, 0.000764178350385247, 0.0019359329037711719)
2026-06-17 19:47:10,070 - optuna.study.study - INFO - Trial 168 finished with values: [0.003061242685179189, 0.000764178350385247, 0.0019359329037711719] and parameters: {'n_layers': 4, 'embedding_dim': 256, 'lr': 0.0015933103817621604, 'lambda_val': 8.796328661080472e-05, 'batch_size': 3749, 'optimizer': 'RMSprop'}.
2026-06-17 19:49:54,708 - optuna.study.study - INFO - Trial 169 finished with values: [0.0027375835407395864, 0.000629973474801061, 0.0017761949110231248] and parameters: {'n_layers': 3, 'embedding_dim': 64, 'lr': 0.0003063523873638634, 'lambda_val': 0.002699561195512288, 'batch_size': 3820, 'optimizer': 'Adam'}.
2026-06-17 19:50:45,207 - experiment_functions - INFO - Early stopping at epoch 1150. Best Metrics: (0.0030726207891199142, 0.0007578628268283442, 0.0018707052518195865)
2026-06-17 19:50:45,584 - optuna.study.study - INFO - Trial 170 finished with values: [0.0030726207891199142, 0.0007578628268283442, 0.0018707052518195865] and parameters: {'n_layers': 4, 'embedding_dim': 64, 'lr': 0.0008244869685256396, 'lambda_val': 1.375614243555729e-06, 'batch_size': 3820, 'optimizer': 'Adam'}.
2026-06-17 19:54:06,742 - optuna.study.study - INFO - Trial 171 finished with values: [0.0006037231747641677, 0.00012946823291650877, 0.00035763486233777276] and parameters: {'n_layers': 3, 'embedding_dim': 256, 'lr': 3.105046001798014e-05, 'lambda_val': 4.337539728895895e-06, 'batch_size': 806, 'optimizer': 'Adam'}.
2026-06-17 19:54:31,730 - experiment_functions - INFO - Early stopping at epoch 550. Best Metrics: (0.003116558270180664, 0.0007341796134899583, 0.002004207930404346)
2026-06-17 19:54:32,111 - optuna.study.study - INFO - Trial 172 finished with values: [0.003116558270180664, 0.0007341796134899583, 0.002004207930404346] and parameters: {'n_layers': 3, 'embedding_dim': 64, 'lr': 0.01562100019075772, 'lambda_val': 4.337539728895895e-06, 'batch_size': 1849, 'optimizer': 'Adam'}.
2026-06-17 19:55:35,651 - experiment_functions - INFO - Early stopping at epoch 1350. Best Metrics: (0.0036276020912834046, 0.0009283819628647216, 0.002236099900072385)
2026-06-17 19:55:35,847 - optuna.study.study - INFO - Trial 173 finished with values: [0.0036276020912834046, 0.0009283819628647216, 0.002236099900072385] and parameters: {'n_layers': 4, 'embedding_dim': 128, 'lr': 0.0012702568149946026, 'lambda_val': 8.796328661080472e-05, 'batch_size': 1059, 'optimizer': 'Adam'}.
2026-06-17 19:56:15,903 - experiment_functions - INFO - Early stopping at epoch 750. Best Metrics: (0.003183837694534147, 0.0008210180623973727, 0.0020781886675672327)
2026-06-17 19:56:16,051 - optuna.study.study - INFO - Trial 174 finished with values: [0.003183837694534147, 0.0008210180623973727, 0.0020781886675672327] and parameters: {'n_layers': 3, 'embedding_dim': 256, 'lr': 0.0032052069599508804, 'lambda_val': 4.337539728895895e-06, 'batch_size': 1672, 'optimizer': 'Adam'}.
2026-06-17 19:56:47,447 - experiment_functions - INFO - Early stopping at epoch 700. Best Metrics: (0.0035562223548912548, 0.00090311986863711, 0.0022742825861260794)
2026-06-17 19:56:47,552 - optuna.study.study - INFO - Trial 175 finished with values: [0.0035562223548912548, 0.00090311986863711, 0.0022742825861260794] and parameters: {'n_layers': 4, 'embedding_dim': 64, 'lr': 0.0036567747130372475, 'lambda_val': 8.796328661080472e-05, 'batch_size': 1751, 'optimizer': 'RMSprop'}.
2026-06-17 19:57:14,705 - experiment_functions - INFO - Early stopping at epoch 550. Best Metrics: (0.00257115905410108, 0.0006836554250347354, 0.001698631809515346)
