2026-06-21 10:24:14,135 - optuna.study.study - INFO - Trial 272 finished with values: [0.000504918023671756, 0.00012631047113805733, 0.00027592116162776905] and parameters: {'n_layers': 3, 'embedding_dim': 32, 'lr': 1.1788417408837781e-05, 'lambda_val': 1.1500391390523163e-06, 'batch_size': 635, 'optimizer': 'Adam'}.
2026-06-21 10:26:36,805 - experiment_functions - INFO - Early stopping at epoch 3500. Best Metrics: (0.014345582733772975, 0.0034293292913982567, 0.008621347327560041)
2026-06-21 10:26:36,886 - optuna.study.study - INFO - Trial 273 finished with values: [0.014345582733772975, 0.0034293292913982567, 0.008621347327560041] and parameters: {'n_layers': 4, 'embedding_dim': 32, 'lr': 0.0008519094805065798, 'lambda_val': 0.0012040212538103386, 'batch_size': 857, 'optimizer': 'RMSprop'}.
2026-06-21 10:27:32,872 - experiment_functions - INFO - Early stopping at epoch 1350. Best Metrics: (0.013602355193295754, 0.0032556523935834284, 0.008183797379135282)
2026-06-21 10:27:32,948 - optuna.study.study - INFO - Trial 274 finished with values: [0.013602355193295754, 0.0032556523935834284, 0.008183797379135282] and parameters: {'n_layers': 4, 'embedding_dim': 32, 'lr': 0.0013154801669818224, 'lambda_val': 0.0016838745075427083, 'batch_size': 857, 'optimizer': 'RMSprop'}.
2026-06-21 10:28:22,528 - experiment_functions - INFO - Early stopping at epoch 1200. Best Metrics: (0.00895115856493212, 0.0022325375773651636, 0.00533644371081728)
2026-06-21 10:28:22,608 - optuna.study.study - INFO - Trial 275 finished with values: [0.00895115856493212, 0.0022325375773651636, 0.00533644371081728] and parameters: {'n_layers': 3, 'embedding_dim': 32, 'lr': 0.0014018982084487695, 'lambda_val': 1.5269672996399625e-05, 'batch_size': 3712, 'optimizer': 'RMSprop'}.
2026-06-21 10:30:23,278 - experiment_functions - INFO - Early stopping at epoch 3000. Best Metrics: (0.011647328744598817, 0.0028325123152709362, 0.006981574713082817)
2026-06-21 10:30:23,366 - optuna.study.study - INFO - Trial 276 finished with values: [0.011647328744598817, 0.0028325123152709362, 0.006981574713082817] and parameters: {'n_layers': 3, 'embedding_dim': 32, 'lr': 0.0013154801669818224, 'lambda_val': 1.1500391390523163e-06, 'batch_size': 857, 'optimizer': 'RMSprop'}.
2026-06-21 10:31:29,676 - experiment_functions - INFO - Early stopping at epoch 1450. Best Metrics: (0.009205733016319004, 0.0023272704307187066, 0.005581257862570037)
2026-06-21 10:31:29,894 - optuna.study.study - INFO - Trial 277 finished with values: [0.009205733016319004, 0.0023272704307187066, 0.005581257862570037] and parameters: {'n_layers': 3, 'embedding_dim': 128, 'lr': 0.0014018982084487695, 'lambda_val': 1.1500391390523163e-06, 'batch_size': 940, 'optimizer': 'Adam'}.
2026-06-21 10:34:19,545 - optuna.study.study - INFO - Trial 278 finished with values: [0.013701810049412197, 0.0034230137678413542, 0.008356052563554948] and parameters: {'n_layers': 4, 'embedding_dim': 64, 'lr': 0.0008519094805065798, 'lambda_val': 0.00044247956015671964, 'batch_size': 745, 'optimizer': 'RMSprop'}.
2026-06-21 10:37:08,001 - optuna.study.study - INFO - Trial 279 finished with values: [0.011676283519215302, 0.00289724643172919, 0.007260874939372222] and parameters: {'n_layers': 4, 'embedding_dim': 64, 'lr': 0.0005491151006472304, 'lambda_val': 1.1500391390523163e-06, 'batch_size': 857, 'optimizer': 'RMSprop'}.
2026-06-21 10:39:58,857 - optuna.study.study - INFO - Trial 280 finished with values: [0.007922736005000356, 0.0019262346848553744, 0.004807367260266188] and parameters: {'n_layers': 3, 'embedding_dim': 96, 'lr': 0.0005979572889171791, 'lambda_val': 5.103203231486004e-06, 'batch_size': 635, 'optimizer': 'Adam'}.
2026-06-21 10:42:33,816 - experiment_functions - INFO - Early stopping at epoch 3650. Best Metrics: (0.01115320682763594, 0.002748831628141973, 0.006720960898692086)
2026-06-21 10:42:33,891 - optuna.study.study - INFO - Trial 281 finished with values: [0.01115320682763594, 0.002748831628141973, 0.006720960898692086] and parameters: {'n_layers': 4, 'embedding_dim': 64, 'lr': 0.0008519094805065798, 'lambda_val': 1.1500391390523163e-06, 'batch_size': 1309, 'optimizer': 'Adam'}.
2026-06-21 10:44:26,906 - experiment_functions - INFO - Early stopping at epoch 2550. Best Metrics: (0.007321514508183793, 0.0019041303524062146, 0.004422882107336114)
2026-06-21 10:44:26,987 - optuna.study.study - INFO - Trial 282 finished with values: [0.007321514508183793, 0.0019041303524062146, 0.004422882107336114] and parameters: {'n_layers': 4, 'embedding_dim': 96, 'lr': 0.0004317731637144049, 'lambda_val': 0.02286382022028602, 'batch_size': 1493, 'optimizer': 'Adam'}.
2026-06-21 10:46:11,129 - experiment_functions - INFO - Early stopping at epoch 2500. Best Metrics: (0.009731809962044669, 0.0024614753063028926, 0.006064773351245433)
2026-06-21 10:46:11,202 - optuna.study.study - INFO - Trial 283 finished with values: [0.009731809962044669, 0.0024614753063028926, 0.006064773351245433] and parameters: {'n_layers': 3, 'embedding_dim': 64, 'lr': 0.0014018982084487695, 'lambda_val': 2.7545357777694106e-05, 'batch_size': 940, 'optimizer': 'Adam'}.
2026-06-21 10:46:53,385 - experiment_functions - INFO - Early stopping at epoch 950. Best Metrics: (0.011148430352421905, 0.0027598837943665533, 0.00689368108072551)
2026-06-21 10:46:53,456 - optuna.study.study - INFO - Trial 284 finished with values: [0.011148430352421905, 0.0027598837943665533, 0.00689368108072551] and parameters: {'n_layers': 4, 'embedding_dim': 64, 'lr': 0.002375796180711879, 'lambda_val': 1.1500391390523163e-06, 'batch_size': 857, 'optimizer': 'RMSprop'}.
2026-06-21 10:47:33,322 - experiment_functions - INFO - Early stopping at epoch 850. Best Metrics: (0.008142712152416949, 0.002120437034230138, 0.004946914121825845)
2026-06-21 10:47:33,402 - optuna.study.study - INFO - Trial 285 finished with values: [0.008142712152416949, 0.002120437034230138, 0.004946914121825845] and parameters: {'n_layers': 3, 'embedding_dim': 128, 'lr': 0.0014018982084487695, 'lambda_val': 0.004562972374668912, 'batch_size': 1024, 'optimizer': 'RMSprop'}.
2026-06-21 10:50:13,024 - optuna.study.study - INFO - Trial 286 finished with values: [0.012026659481632267, 0.002826196791714033, 0.007299655424706815] and parameters: {'n_layers': 3, 'embedding_dim': 32, 'lr': 0.0008519094805065798, 'lambda_val': 0.0013171013233585188, 'batch_size': 857, 'optimizer': 'RMSprop'}.
2026-06-21 10:50:54,462 - experiment_functions - INFO - Early stopping at epoch 950. Best Metrics: (0.009120525990026385, 0.002290956170266515, 0.005526039124984542)
2026-06-21 10:50:54,791 - optuna.study.study - INFO - Trial 287 finished with values: [0.009120525990026385, 0.002290956170266515, 0.005526039124984542] and parameters: {'n_layers': 3, 'embedding_dim': 64, 'lr': 0.0014018982084487695, 'lambda_val': 2.362873378234334e-06, 'batch_size': 3426, 'optimizer': 'RMSprop'}.
2026-06-21 10:51:32,849 - experiment_functions - INFO - Early stopping at epoch 850. Best Metrics: (0.003186468117209095, 0.0008620689655172415, 0.0018792944501078693)
2026-06-21 10:51:32,935 - optuna.study.study - INFO - Trial 288 finished with values: [0.003186468117209095, 0.0008620689655172415, 0.0018792944501078693] and parameters: {'n_layers': 3, 'embedding_dim': 96, 'lr': 0.0014018982084487695, 'lambda_val': 0.08172426185652927, 'batch_size': 1815, 'optimizer': 'RMSprop'}.
2026-06-21 10:53:47,715 - experiment_functions - INFO - Early stopping at epoch 3150. Best Metrics: (0.012062728305767908, 0.003036187949981053, 0.007307326759474671)
2026-06-21 10:53:47,790 - optuna.study.study - INFO - Trial 289 finished with values: [0.012062728305767908, 0.003036187949981053, 0.007307326759474671] and parameters: {'n_layers': 4, 'embedding_dim': 64, 'lr': 0.0005491151006472304, 'lambda_val': 7.163252275100761e-05, 'batch_size': 2490, 'optimizer': 'RMSprop'}.
2026-06-21 10:54:22,413 - experiment_functions - INFO - Early stopping at epoch 700. Best Metrics: (0.008791174219266618, 0.0022499052671466463, 0.005298963613132365)
2026-06-21 10:54:22,802 - optuna.study.study - INFO - Trial 290 finished with values: [0.008791174219266618, 0.0022499052671466463, 0.005298963613132365] and parameters: {'n_layers': 4, 'embedding_dim': 128, 'lr': 0.003109635143915708, 'lambda_val': 1.1500391390523163e-06, 'batch_size': 2490, 'optimizer': 'Adam'}.
2026-06-21 10:54:54,649 - experiment_functions - INFO - Early stopping at epoch 700. Best Metrics: (0.008712909821973336, 0.0022641151951496774, 0.005318362540690141)
2026-06-21 10:54:54,727 - optuna.study.study - INFO - Trial 291 finished with values: [0.008712909821973336, 0.0022641151951496774, 0.005318362540690141] and parameters: {'n_layers': 4, 'embedding_dim': 64, 'lr': 0.0038927780539963937, 'lambda_val': 0.0013171013233585188, 'batch_size': 1024, 'optimizer': 'Adam'}.
2026-06-21 10:56:07,011 - experiment_functions - INFO - Early stopping at epoch 1700. Best Metrics: (0.007328933002249319, 0.001785714285714286, 0.004398382024030033)
2026-06-21 10:56:07,089 - optuna.study.study - INFO - Trial 292 finished with values: [0.007328933002249319, 0.001785714285714286, 0.004398382024030033] and parameters: {'n_layers': 2, 'embedding_dim': 96, 'lr': 0.0018169040651244567, 'lambda_val': 2.2595071410094373e-06, 'batch_size': 1493, 'optimizer': 'Adam'}.
2026-06-21 10:58:28,963 - experiment_functions - INFO - Early stopping at epoch 3400. Best Metrics: (0.010688088950734998, 0.002682518630794493, 0.006689292838247135)
2026-06-21 10:58:29,047 - optuna.study.study - INFO - Trial 293 finished with values: [0.010688088950734998, 0.002682518630794493, 0.006689292838247135] and parameters: {'n_layers': 3, 'embedding_dim': 64, 'lr': 0.0014018982084487695, 'lambda_val': 2.2595071410094373e-06, 'batch_size': 745, 'optimizer': 'Adam'}.
2026-06-21 10:59:28,670 - experiment_functions - INFO - Early stopping at epoch 1250. Best Metrics: (0.01115763291647365, 0.0028230390299355816, 0.006586002401120317)
2026-06-21 10:59:28,759 - optuna.study.study - INFO - Trial 294 finished with values: [0.01115763291647365, 0.0028230390299355816, 0.006586002401120317] and parameters: {'n_layers': 4, 'embedding_dim': 128, 'lr': 0.0008519094805065798, 'lambda_val': 0.0012040212538103386, 'batch_size': 1493, 'optimizer': 'RMSprop'}.
2026-06-21 11:01:00,187 - experiment_functions - INFO - Early stopping at epoch 2100. Best Metrics: (0.009811810655720217, 0.0024504231400783124, 0.006010997267090731)
2026-06-21 11:01:00,275 - optuna.study.study - INFO - Trial 295 finished with values: [0.009811810655720217, 0.0024504231400783124, 0.006010997267090731] and parameters: {'n_layers': 3, 'embedding_dim': 96, 'lr': 0.0014018982084487695, 'lambda_val': 1.920322033608143e-05, 'batch_size': 745, 'optimizer': 'Adam'}.
2026-06-21 11:01:48,206 - experiment_functions - INFO - Early stopping at epoch 900. Best Metrics: (0.008441440718144684, 0.002213591006694455, 0.005126581051471908)
2026-06-21 11:01:48,284 - optuna.study.study - INFO - Trial 296 finished with values: [0.008441440718144684, 0.002213591006694455, 0.005126581051471908] and parameters: {'n_layers': 3, 'embedding_dim': 256, 'lr': 0.0014018982084487695, 'lambda_val': 0.0013171013233585188, 'batch_size': 745, 'optimizer': 'RMSprop'}.
2026-06-21 11:04:28,143 - optuna.study.study - INFO - Trial 297 finished with values: [0.009975672848604022, 0.0023714790956170266, 0.006133951726083169] and parameters: {'n_layers': 3, 'embedding_dim': 32, 'lr': 0.0008519094805065798, 'lambda_val': 0.0016838745075427083, 'batch_size': 635, 'optimizer': 'Adam'}.
2026-06-21 11:07:07,820 - optuna.study.study - INFO - Trial 298 finished with values: [0.009924506562914074, 0.00243305545029683, 0.005996503027106229] and parameters: {'n_layers': 3, 'embedding_dim': 32, 'lr': 0.0008519094805065798, 'lambda_val': 1.987631616943749e-06, 'batch_size': 1463, 'optimizer': 'Adam'}.
2026-06-21 11:08:55,024 - experiment_functions - INFO - Early stopping at epoch 2650. Best Metrics: (0.011123117313414315, 0.002673045345459139, 0.006735045376697862)
2026-06-21 11:08:55,098 - optuna.study.study - INFO - Trial 299 finished with values: [0.011123117313414315, 0.002673045345459139, 0.006735045376697862] and parameters: {'n_layers': 3, 'embedding_dim': 32, 'lr': 0.0014018982084487695, 'lambda_val': 1.1500391390523163e-06, 'batch_size': 745, 'optimizer': 'Adam'}.
2026-06-21 11:08:55,113 - root - INFO - Selected Trial 208 based on Max ndcg: 0.0086
2026-06-21 11:08:55,113 - root - INFO - Associated Recall: 0.0142
2026-06-21 11:08:55,113 - experiment_functions - INFO - Training the best model ... for e_yelp_1c2dcs_strict_rand2
2026-06-21 11:11:30,518 - experiment_functions - INFO - Early stopping at epoch 3850. Best Metrics: (0.013383695664560553, 0.0032603890362511052, 0.008108741896893323)
2026-06-21 11:11:34,268 - root - INFO -   **** Training e_yelp_1c2dcs_strict_rand3
2026-06-21 11:11:34,295 - root - INFO -   **** Getting 71258/1274132 random edges
2026-06-21 11:11:34,393 - optuna.storages._rdb.storage - INFO - A new study created in RDB with name: Study_e_yelp_1c2dcs_strict_rand3
2026-06-21 11:11:59,433 - experiment_functions - INFO - Early stopping at epoch 550. Best Metrics: (0.0030026877607587732, 0.000731021851711507, 0.0018727207556762347)
2026-06-21 11:11:59,550 - optuna.study.study - INFO - Trial 0 finished with values: [0.0030026877607587732, 0.000731021851711507, 0.0018727207556762347] and parameters: {'n_layers': 3, 'embedding_dim': 64, 'lr': 0.03212361641248932, 'lambda_val': 7.185633297867177e-05, 'batch_size': 3893, 'optimizer': 'RMSprop'}.
2026-06-21 11:12:28,237 - experiment_functions - INFO - Early stopping at epoch 500. Best Metrics: (0.0004795127847622265, 0.00010736390046734874, 0.00024521069517055783)
2026-06-21 11:12:28,394 - optuna.study.study - INFO - Trial 1 finished with values: [0.0004795127847622265, 0.00010736390046734874, 0.00024521069517055783] and parameters: {'n_layers': 4, 'embedding_dim': 256, 'lr': 6.595042203635502e-05, 'lambda_val': 0.002168185252329988, 'batch_size': 1990, 'optimizer': 'SGD'}.
2026-06-21 11:12:55,944 - experiment_functions - INFO - Early stopping at epoch 550. Best Metrics: (0.004842846049770319, 0.0012188960464822535, 0.00275023566307047)
2026-06-21 11:12:56,018 - optuna.study.study - INFO - Trial 2 finished with values: [0.004842846049770319, 0.0012188960464822535, 0.00275023566307047] and parameters: {'n_layers': 4, 'embedding_dim': 128, 'lr': 0.018560168848895237, 'lambda_val': 0.003799960425456179, 'batch_size': 2399, 'optimizer': 'Adam'}.
2026-06-21 11:15:34,110 - optuna.study.study - INFO - Trial 3 finished with values: [0.0034060117790242084, 0.0007483895414929898, 0.0019804897564629467] and parameters: {'n_layers': 1, 'embedding_dim': 64, 'lr': 0.0004419346142273276, 'lambda_val': 0.00021699095102509954, 'batch_size': 2353, 'optimizer': 'Adam'}.
2026-06-21 11:15:57,326 - experiment_functions - INFO - Early stopping at epoch 500. Best Metrics: (0.00065874865792995, 0.00013420487558418593, 0.0003857897446927317)
2026-06-21 11:15:57,411 - optuna.study.study - INFO - Trial 4 finished with values: [0.00065874865792995, 0.00013420487558418593, 0.0003857897446927317] and parameters: {'n_layers': 2, 'embedding_dim': 128, 'lr': 5.973096058975652e-05, 'lambda_val': 1.8167614923265777e-05, 'batch_size': 3339, 'optimizer': 'SGD'}.
2026-06-21 11:16:21,210 - experiment_functions - INFO - Early stopping at epoch 500. Best Metrics: (0.0005367000843892264, 0.0001294682329165088, 0.000285454148552151)
2026-06-21 11:16:21,299 - optuna.study.study - INFO - Trial 5 finished with values: [0.0005367000843892264, 0.0001294682329165088, 0.000285454148552151] and parameters: {'n_layers': 4, 'embedding_dim': 96, 'lr': 0.08122027253260972, 'lambda_val': 0.0076149973106102555, 'batch_size': 1161, 'optimizer': 'SGD'}.
2026-06-21 11:16:44,865 - experiment_functions - INFO - Early stopping at epoch 500. Best Metrics: (0.0006183620117829514, 0.0001389415182518631, 0.00033360107230906487)
2026-06-21 11:16:44,943 - optuna.study.study - INFO - Trial 6 finished with values: [0.0006183620117829514, 0.0001389415182518631, 0.00033360107230906487] and parameters: {'n_layers': 3, 'embedding_dim': 96, 'lr': 0.06317125159591737, 'lambda_val': 0.0036113901070719714, 'batch_size': 2791, 'optimizer': 'SGD'}.
2026-06-21 11:17:35,778 - experiment_functions - INFO - Early stopping at epoch 1250. Best Metrics: (0.0026717860641334887, 0.0006931287103700898, 0.0015171748883946524)
2026-06-21 11:17:35,864 - optuna.study.study - INFO - Trial 7 finished with values: [0.0026717860641334887, 0.0006931287103700898, 0.0015171748883946524] and parameters: {'n_layers': 2, 'embedding_dim': 32, 'lr': 0.0256353522777213, 'lambda_val': 0.008579649260516903, 'batch_size': 3310, 'optimizer': 'Adam'}.
2026-06-21 11:18:01,764 - experiment_functions - INFO - Early stopping at epoch 550. Best Metrics: (0.006016391939594659, 0.0014857269167613994, 0.0034515901652493793)
2026-06-21 11:18:01,858 - optuna.study.study - INFO - Trial 8 finished with values: [0.006016391939594659, 0.0014857269167613994, 0.0034515901652493793] and parameters: {'n_layers': 3, 'embedding_dim': 96, 'lr': 0.007517511425007554, 'lambda_val': 0.0002491576543882324, 'batch_size': 2732, 'optimizer': 'RMSprop'}.
2026-06-21 11:18:34,242 - experiment_functions - INFO - Early stopping at epoch 550. Best Metrics: (0.00485167922572014, 0.001211001642036125, 0.0027623410673948724)
2026-06-21 11:18:34,337 - optuna.study.study - INFO - Trial 9 finished with values: [0.00485167922572014, 0.001211001642036125, 0.0027623410673948724] and parameters: {'n_layers': 4, 'embedding_dim': 256, 'lr': 0.0183275310294566, 'lambda_val': 0.00216624247898919, 'batch_size': 1179, 'optimizer': 'Adam'}.
2026-06-21 11:18:56,231 - experiment_functions - INFO - Early stopping at epoch 500. Best Metrics: (0.0005888511587461969, 0.0001310471138057345, 0.00029382496258212163)
2026-06-21 11:18:56,300 - optuna.study.study - INFO - Trial 10 finished with values: [0.0005888511587461969, 0.0001310471138057345, 0.00029382496258212163] and parameters: {'n_layers': 1, 'embedding_dim': 96, 'lr': 2.3622017272377703e-05, 'lambda_val': 1.0480033391436414e-06, 'batch_size': 1904, 'optimizer': 'SGD'}.
2026-06-21 11:20:35,711 - experiment_functions - INFO - Early stopping at epoch 2150. Best Metrics: (0.0006480813795623524, 0.00014525704180876596, 0.0003973503958961751)
2026-06-21 11:20:35,800 - optuna.study.study - INFO - Trial 11 finished with values: [0.0006480813795623524, 0.00014525704180876596, 0.0003973503958961751] and parameters: {'n_layers': 4, 'embedding_dim': 128, 'lr': 4.113205767102852e-05, 'lambda_val': 0.00042347061519553927, 'batch_size': 3116, 'optimizer': 'Adam'}.
2026-06-21 11:21:57,357 - experiment_functions - INFO - Early stopping at epoch 2050. Best Metrics: (0.005354038812188738, 0.001398888467853985, 0.0032362977872878855)
2026-06-21 11:21:57,433 - optuna.study.study - INFO - Trial 12 finished with values: [0.005354038812188738, 0.001398888467853985, 0.0032362977872878855] and parameters: {'n_layers': 2, 'embedding_dim': 32, 'lr': 0.0007376776486185891, 'lambda_val': 0.014679201594967693, 'batch_size': 2662, 'optimizer': 'Adam'}.
2026-06-21 11:22:24,150 - experiment_functions - INFO - Early stopping at epoch 550. Best Metrics: (0.005819327134498605, 0.0014446760136415308, 0.003353232754817525)
2026-06-21 11:22:24,235 - optuna.study.study - INFO - Trial 13 finished with values: [0.005819327134498605, 0.0014446760136415308, 0.003353232754817525] and parameters: {'n_layers': 3, 'embedding_dim': 128, 'lr': 0.007852338517216746, 'lambda_val': 1.6213630924331792e-06, 'batch_size': 2281, 'optimizer': 'RMSprop'}.
2026-06-21 11:23:20,286 - experiment_functions - INFO - Early stopping at epoch 1200. Best Metrics: (0.004054780783319876, 0.000988379436655299, 0.0024165240553948196)
2026-06-21 11:23:20,388 - optuna.study.study - INFO - Trial 14 finished with values: [0.004054780783319876, 0.000988379436655299, 0.0024165240553948196] and parameters: {'n_layers': 1, 'embedding_dim': 256, 'lr': 0.013297948809136581, 'lambda_val': 2.706498615300197e-06, 'batch_size': 3341, 'optimizer': 'Adam'}.
2026-06-21 11:23:47,728 - experiment_functions - INFO - Early stopping at epoch 500. Best Metrics: (0.000536267577496513, 0.00010578501957812304, 0.0002659737136639164)
2026-06-21 11:23:47,813 - optuna.study.study - INFO - Trial 15 finished with values: [0.000536267577496513, 0.00010578501957812304, 0.0002659737136639164] and parameters: {'n_layers': 3, 'embedding_dim': 256, 'lr': 3.0953399526973584e-05, 'lambda_val': 0.0005687554712483462, 'batch_size': 3567, 'optimizer': 'SGD'}.
2026-06-21 11:24:12,439 - experiment_functions - INFO - Early stopping at epoch 500. Best Metrics: (0.0005654957774533468, 0.00011525830491347733, 0.0002761890073916098)
2026-06-21 11:24:12,531 - optuna.study.study - INFO - Trial 16 finished with values: [0.0005654957774533468, 0.00011525830491347733, 0.0002761890073916098] and parameters: {'n_layers': 3, 'embedding_dim': 128, 'lr': 0.00599824014211808, 'lambda_val': 0.0007029061520953522, 'batch_size': 3386, 'optimizer': 'SGD'}.
2026-06-21 11:24:37,560 - experiment_functions - INFO - Early stopping at epoch 500. Best Metrics: (0.000573761499668119, 0.00011525830491347733, 0.0003041193386493486)
2026-06-21 11:24:37,646 - optuna.study.study - INFO - Trial 17 finished with values: [0.000573761499668119, 0.00011525830491347733, 0.0003041193386493486] and parameters: {'n_layers': 4, 'embedding_dim': 128, 'lr': 3.420559337956491e-05, 'lambda_val': 9.079672514911197e-05, 'batch_size': 3617, 'optimizer': 'SGD'}.
2026-06-21 11:24:59,792 - experiment_functions - INFO - Early stopping at epoch 500. Best Metrics: (0.00043813865068005424, 9.631173424276872e-05, 0.00021319988193736574)
