2026-06-18 13:02:01,471 - optuna.study.study - INFO - Trial 115 finished with values: [0.002698871700158115, 0.0006868131868131869, 0.0017958394574376568] and parameters: {'n_layers': 2, 'embedding_dim': 128, 'lr': 0.0010214376144180076, 'lambda_val': 1.455259422316608e-06, 'batch_size': 2863, 'optimizer': 'Adam'}.
2026-06-18 13:03:12,022 - experiment_functions - INFO - Early stopping at epoch 1500. Best Metrics: (0.0021352434006960616, 0.0006173424276872553, 0.001324405311777122)
2026-06-18 13:03:12,345 - optuna.study.study - INFO - Trial 116 finished with values: [0.0021352434006960616, 0.0006173424276872553, 0.001324405311777122] and parameters: {'n_layers': 4, 'embedding_dim': 128, 'lr': 0.0005796526912711289, 'lambda_val': 0.0630353277713049, 'batch_size': 3659, 'optimizer': 'RMSprop'}.
2026-06-18 13:04:27,180 - experiment_functions - INFO - Early stopping at epoch 1450. Best Metrics: (0.0032549535714787112, 0.000819439181508147, 0.001966722381569564)
2026-06-18 13:04:27,512 - optuna.study.study - INFO - Trial 117 finished with values: [0.0032549535714787112, 0.000819439181508147, 0.001966722381569564] and parameters: {'n_layers': 3, 'embedding_dim': 256, 'lr': 0.0016391721585660463, 'lambda_val': 5.672639985302811e-06, 'batch_size': 3659, 'optimizer': 'Adam'}.
2026-06-18 13:04:59,066 - experiment_functions - INFO - Early stopping at epoch 550. Best Metrics: (0.002304485628108995, 0.0006220790703549325, 0.0014608639013010403)
2026-06-18 13:04:59,176 - optuna.study.study - INFO - Trial 118 finished with values: [0.002304485628108995, 0.0006220790703549325, 0.0014608639013010403] and parameters: {'n_layers': 4, 'embedding_dim': 128, 'lr': 0.07625802966647915, 'lambda_val': 1.455259422316608e-06, 'batch_size': 2199, 'optimizer': 'Adam'}.
2026-06-18 13:08:01,317 - optuna.study.study - INFO - Trial 119 finished with values: [0.0008989108274647419, 0.00020051787293166602, 0.0005168383410169651] and parameters: {'n_layers': 4, 'embedding_dim': 128, 'lr': 5.9925480614583836e-05, 'lambda_val': 1.0687219886452036e-06, 'batch_size': 3378, 'optimizer': 'Adam'}.
2026-06-18 13:08:57,710 - experiment_functions - INFO - Early stopping at epoch 1300. Best Metrics: (0.0028020560505819954, 0.0007152330428192497, 0.0017890928018777581)
2026-06-18 13:08:57,830 - optuna.study.study - INFO - Trial 120 finished with values: [0.0028020560505819954, 0.0007152330428192497, 0.0017890928018777581] and parameters: {'n_layers': 4, 'embedding_dim': 64, 'lr': 0.0005516089764502217, 'lambda_val': 0.005988433373997008, 'batch_size': 2563, 'optimizer': 'RMSprop'}.
2026-06-18 13:10:09,718 - experiment_functions - INFO - Early stopping at epoch 1700. Best Metrics: (0.0017911672651831556, 0.0005589238347859038, 0.001185042852628486)
2026-06-18 13:10:10,054 - optuna.study.study - INFO - Trial 121 finished with values: [0.0017911672651831556, 0.0005589238347859038, 0.001185042852628486] and parameters: {'n_layers': 2, 'embedding_dim': 96, 'lr': 0.07625802966647915, 'lambda_val': 0.00034235453695730925, 'batch_size': 3659, 'optimizer': 'RMSprop'}.
2026-06-18 13:11:09,891 - experiment_functions - INFO - Early stopping at epoch 1400. Best Metrics: (0.0027270167430466265, 0.0006504989263609954, 0.001753433172586628)
2026-06-18 13:11:09,984 - optuna.study.study - INFO - Trial 122 finished with values: [0.0027270167430466265, 0.0006504989263609954, 0.001753433172586628] and parameters: {'n_layers': 1, 'embedding_dim': 128, 'lr': 0.0013472245469264425, 'lambda_val': 1.455259422316608e-06, 'batch_size': 2877, 'optimizer': 'Adam'}.
2026-06-18 13:12:10,985 - experiment_functions - INFO - Early stopping at epoch 1300. Best Metrics: (0.0033941177582058287, 0.0009062776304155616, 0.00214801259556909)
2026-06-18 13:12:11,085 - optuna.study.study - INFO - Trial 123 finished with values: [0.0033941177582058287, 0.0009062776304155616, 0.00214801259556909] and parameters: {'n_layers': 4, 'embedding_dim': 128, 'lr': 0.0016391721585660463, 'lambda_val': 4.669465121966091e-06, 'batch_size': 1520, 'optimizer': 'RMSprop'}.
2026-06-18 13:14:54,833 - experiment_functions - INFO - Early stopping at epoch 3650. Best Metrics: (0.0022466105016016357, 0.0006236579512441581, 0.00136869948176605)
2026-06-18 13:14:55,163 - optuna.study.study - INFO - Trial 124 finished with values: [0.0022466105016016357, 0.0006236579512441581, 0.00136869948176605] and parameters: {'n_layers': 1, 'embedding_dim': 256, 'lr': 0.05395674460341747, 'lambda_val': 0.0016802091204768195, 'batch_size': 1380, 'optimizer': 'Adam'}.
2026-06-18 13:18:03,988 - optuna.study.study - INFO - Trial 125 finished with values: [0.001487497342846162, 0.00037735253252494636, 0.001008731931034862] and parameters: {'n_layers': 2, 'embedding_dim': 256, 'lr': 0.00015421584249526724, 'lambda_val': 0.02642098205161091, 'batch_size': 3005, 'optimizer': 'RMSprop'}.
2026-06-18 13:20:02,488 - experiment_functions - INFO - Early stopping at epoch 2900. Best Metrics: (0.0032229382609635358, 0.000753126184160667, 0.0020325380091398824)
2026-06-18 13:20:02,810 - optuna.study.study - INFO - Trial 126 finished with values: [0.0032229382609635358, 0.000753126184160667, 0.0020325380091398824] and parameters: {'n_layers': 2, 'embedding_dim': 64, 'lr': 0.0005796526912711289, 'lambda_val': 1.0687219886452036e-06, 'batch_size': 3953, 'optimizer': 'RMSprop'}.
2026-06-18 13:20:40,930 - experiment_functions - INFO - Early stopping at epoch 750. Best Metrics: (0.0028661503138859156, 0.0007168119237084755, 0.0017453387975848325)
2026-06-18 13:20:41,246 - optuna.study.study - INFO - Trial 127 finished with values: [0.0028661503138859156, 0.0007168119237084755, 0.0017453387975848325] and parameters: {'n_layers': 2, 'embedding_dim': 256, 'lr': 0.003307811671556655, 'lambda_val': 0.0003734320288996398, 'batch_size': 3659, 'optimizer': 'Adam'}.
2026-06-18 13:21:06,986 - experiment_functions - INFO - Early stopping at epoch 500. Best Metrics: (0.0004894213452640206, 0.00011999494758115448, 0.00023245023520478792)
2026-06-18 13:21:07,081 - optuna.study.study - INFO - Trial 128 finished with values: [0.0004894213452640206, 0.00011999494758115448, 0.00023245023520478792] and parameters: {'n_layers': 2, 'embedding_dim': 256, 'lr': 0.0020795989989061993, 'lambda_val': 5.672639985302811e-06, 'batch_size': 3659, 'optimizer': 'SGD'}.
2026-06-18 13:21:55,315 - experiment_functions - INFO - Early stopping at epoch 1150. Best Metrics: (0.0036359937387626406, 0.0008983832259694328, 0.002393543298346807)
2026-06-18 13:21:55,648 - optuna.study.study - INFO - Trial 129 finished with values: [0.0036359937387626406, 0.0008983832259694328, 0.002393543298346807] and parameters: {'n_layers': 4, 'embedding_dim': 32, 'lr': 0.002487565347422212, 'lambda_val': 1.3344718493912024e-05, 'batch_size': 892, 'optimizer': 'RMSprop'}.
2026-06-18 13:22:19,839 - experiment_functions - INFO - Early stopping at epoch 550. Best Metrics: (0.0027399294268876575, 0.0006347101174687382, 0.0018174753672783653)
2026-06-18 13:22:19,926 - optuna.study.study - INFO - Trial 130 finished with values: [0.0027399294268876575, 0.0006347101174687382, 0.0018174753672783653] and parameters: {'n_layers': 3, 'embedding_dim': 32, 'lr': 0.003855829449851487, 'lambda_val': 2.9517437997373373e-06, 'batch_size': 3757, 'optimizer': 'RMSprop'}.
2026-06-18 13:22:53,071 - experiment_functions - INFO - Early stopping at epoch 650. Best Metrics: (0.0026098384236063654, 0.0006757610205886069, 0.001686367347442387)
2026-06-18 13:22:53,396 - optuna.study.study - INFO - Trial 131 finished with values: [0.0026098384236063654, 0.0006757610205886069, 0.001686367347442387] and parameters: {'n_layers': 2, 'embedding_dim': 256, 'lr': 0.0020795989989061993, 'lambda_val': 0.0015636957707602223, 'batch_size': 2731, 'optimizer': 'RMSprop'}.
2026-06-18 13:23:37,693 - experiment_functions - INFO - Early stopping at epoch 1050. Best Metrics: (0.003027245713863627, 0.0006789187823670582, 0.0018364792963376033)
2026-06-18 13:23:37,788 - optuna.study.study - INFO - Trial 132 finished with values: [0.003027245713863627, 0.0006789187823670582, 0.0018364792963376033] and parameters: {'n_layers': 2, 'embedding_dim': 64, 'lr': 0.0014625528771019128, 'lambda_val': 0.0015359029367627384, 'batch_size': 1836, 'optimizer': 'Adam'}.
2026-06-18 13:25:05,742 - experiment_functions - INFO - Early stopping at epoch 2050. Best Metrics: (0.0032402768000212466, 0.0008083870152835671, 0.002124025235990615)
2026-06-18 13:25:06,045 - optuna.study.study - INFO - Trial 133 finished with values: [0.0032402768000212466, 0.0008083870152835671, 0.002124025235990615] and parameters: {'n_layers': 4, 'embedding_dim': 64, 'lr': 0.0010214376144180076, 'lambda_val': 1.455259422316608e-06, 'batch_size': 3250, 'optimizer': 'RMSprop'}.
2026-06-18 13:25:28,519 - experiment_functions - INFO - Early stopping at epoch 500. Best Metrics: (0.0005265499573443128, 0.00011052166224580017, 0.00028331133722733006)
2026-06-18 13:25:28,619 - optuna.study.study - INFO - Trial 134 finished with values: [0.0005265499573443128, 0.00011052166224580017, 0.00028331133722733006] and parameters: {'n_layers': 4, 'embedding_dim': 64, 'lr': 0.0007806081988212152, 'lambda_val': 0.005988433373997008, 'batch_size': 779, 'optimizer': 'SGD'}.
2026-06-18 13:27:46,786 - experiment_functions - INFO - Early stopping at epoch 3450. Best Metrics: (0.003810914101545135, 0.0008573323228495642, 0.0022948436283273194)
2026-06-18 13:27:46,880 - optuna.study.study - INFO - Trial 135 finished with values: [0.003810914101545135, 0.0008573323228495642, 0.0022948436283273194] and parameters: {'n_layers': 3, 'embedding_dim': 64, 'lr': 0.0005796526912711289, 'lambda_val': 1.7089177370137862e-06, 'batch_size': 801, 'optimizer': 'RMSprop'}.
2026-06-18 13:29:48,459 - experiment_functions - INFO - Early stopping at epoch 2700. Best Metrics: (0.0033785811170500613, 0.0008825944170771757, 0.002177235576774667)
2026-06-18 13:29:48,552 - optuna.study.study - INFO - Trial 136 finished with values: [0.0033785811170500613, 0.0008825944170771757, 0.002177235576774667] and parameters: {'n_layers': 4, 'embedding_dim': 128, 'lr': 0.0010214376144180076, 'lambda_val': 1.455259422316608e-06, 'batch_size': 2863, 'optimizer': 'RMSprop'}.
2026-06-18 13:30:14,284 - experiment_functions - INFO - Early stopping at epoch 550. Best Metrics: (0.0026640057456436246, 0.0006931287103700898, 0.0017404146643914895)
2026-06-18 13:30:14,398 - optuna.study.study - INFO - Trial 137 finished with values: [0.0026640057456436246, 0.0006931287103700898, 0.0017404146643914895] and parameters: {'n_layers': 4, 'embedding_dim': 96, 'lr': 0.01251000483486688, 'lambda_val': 0.0038087913449814693, 'batch_size': 2844, 'optimizer': 'Adam'}.
2026-06-18 13:32:33,831 - experiment_functions - INFO - Early stopping at epoch 2650. Best Metrics: (0.0035732099093029133, 0.00085891120373879, 0.0021367149886954056)
2026-06-18 13:32:33,931 - optuna.study.study - INFO - Trial 138 finished with values: [0.0035732099093029133, 0.00085891120373879, 0.0021367149886954056] and parameters: {'n_layers': 4, 'embedding_dim': 256, 'lr': 0.00054735960254125, 'lambda_val': 9.43829822749537e-06, 'batch_size': 784, 'optimizer': 'Adam'}.
2026-06-18 13:34:57,488 - experiment_functions - INFO - Early stopping at epoch 3500. Best Metrics: (0.003410928357995699, 0.0007862826828344069, 0.00211773552551811)
2026-06-18 13:34:57,583 - optuna.study.study - INFO - Trial 139 finished with values: [0.003410928357995699, 0.0007862826828344069, 0.00211773552551811] and parameters: {'n_layers': 4, 'embedding_dim': 64, 'lr': 0.00031499139279171867, 'lambda_val': 1.455259422316608e-06, 'batch_size': 2863, 'optimizer': 'RMSprop'}.
2026-06-18 13:36:22,385 - experiment_functions - INFO - Early stopping at epoch 2100. Best Metrics: (0.0035071964743279595, 0.0007799671592775041, 0.0021336833275881926)
2026-06-18 13:36:22,478 - optuna.study.study - INFO - Trial 140 finished with values: [0.0035071964743279595, 0.0007799671592775041, 0.0021336833275881926] and parameters: {'n_layers': 2, 'embedding_dim': 64, 'lr': 0.0005796526912711289, 'lambda_val': 0.00029123929001349135, 'batch_size': 2495, 'optimizer': 'RMSprop'}.
2026-06-18 13:38:58,574 - optuna.study.study - INFO - Trial 141 finished with values: [0.003286902428829906, 0.0006662877352532524, 0.002067118833323128] and parameters: {'n_layers': 1, 'embedding_dim': 32, 'lr': 0.0005796526912711289, 'lambda_val': 0.00029123929001349135, 'batch_size': 945, 'optimizer': 'Adam'}.
2026-06-18 13:39:20,972 - experiment_functions - INFO - Early stopping at epoch 500. Best Metrics: (0.0006277214829329918, 0.00012315270935960593, 0.0003104186027618393)
2026-06-18 13:39:21,072 - optuna.study.study - INFO - Trial 142 finished with values: [0.0006277214829329918, 0.00012315270935960593, 0.0003104186027618393] and parameters: {'n_layers': 2, 'embedding_dim': 96, 'lr': 0.0005796526912711289, 'lambda_val': 0.00029123929001349135, 'batch_size': 2842, 'optimizer': 'SGD'}.
2026-06-18 13:40:00,540 - experiment_functions - INFO - Early stopping at epoch 850. Best Metrics: (0.0023279822237452616, 0.0005447139067828723, 0.0014968486178906627)
2026-06-18 13:40:00,881 - optuna.study.study - INFO - Trial 143 finished with values: [0.0023279822237452616, 0.0005447139067828723, 0.0014968486178906627] and parameters: {'n_layers': 1, 'embedding_dim': 256, 'lr': 0.0014625528771019128, 'lambda_val': 0.0015359029367627384, 'batch_size': 1836, 'optimizer': 'RMSprop'}.
2026-06-18 13:42:55,896 - optuna.study.study - INFO - Trial 144 finished with values: [0.0026654757079870067, 0.0006141846659088039, 0.0016006111691159914] and parameters: {'n_layers': 1, 'embedding_dim': 256, 'lr': 0.0005280426154865697, 'lambda_val': 0.0016802091204768195, 'batch_size': 1380, 'optimizer': 'Adam'}.
2026-06-18 13:44:37,055 - experiment_functions - INFO - Early stopping at epoch 2000. Best Metrics: (0.0030663425189344047, 0.0008004926108374384, 0.0019053627786699695)
2026-06-18 13:44:37,144 - optuna.study.study - INFO - Trial 145 finished with values: [0.0030663425189344047, 0.0008004926108374384, 0.0019053627786699695] and parameters: {'n_layers': 3, 'embedding_dim': 256, 'lr': 0.00054735960254125, 'lambda_val': 9.43829822749537e-06, 'batch_size': 3617, 'optimizer': 'Adam'}.
2026-06-18 13:45:20,793 - experiment_functions - INFO - Early stopping at epoch 1050. Best Metrics: (0.0037698646743986926, 0.0008225969432865984, 0.0023948803188574715)
2026-06-18 13:45:20,875 - optuna.study.study - INFO - Trial 146 finished with values: [0.0037698646743986926, 0.0008225969432865984, 0.0023948803188574715] and parameters: {'n_layers': 3, 'embedding_dim': 32, 'lr': 0.001229746147020764, 'lambda_val': 2.7945521753203373e-05, 'batch_size': 1789, 'optimizer': 'RMSprop'}.
2026-06-18 13:48:03,923 - optuna.study.study - INFO - Trial 147 finished with values: [0.001991490200963716, 0.0005052418845522293, 0.0012467530866478221] and parameters: {'n_layers': 2, 'embedding_dim': 64, 'lr': 0.00031499139279171867, 'lambda_val': 0.05901362678704685, 'batch_size': 3937, 'optimizer': 'RMSprop'}.
2026-06-18 13:50:45,343 - optuna.study.study - INFO - Trial 148 finished with values: [0.003436496022276272, 0.0007736516357206013, 0.002147204094813559] and parameters: {'n_layers': 2, 'embedding_dim': 64, 'lr': 0.0005796526912711289, 'lambda_val': 0.00029123929001349135, 'batch_size': 945, 'optimizer': 'RMSprop'}.
2026-06-18 13:51:17,169 - experiment_functions - INFO - Early stopping at epoch 550. Best Metrics: (0.0024427306765097425, 0.0006599722116963497, 0.0015251631947022805)
2026-06-18 13:51:17,631 - optuna.study.study - INFO - Trial 149 finished with values: [0.0024427306765097425, 0.0006599722116963497, 0.0015251631947022805] and parameters: {'n_layers': 4, 'embedding_dim': 256, 'lr': 0.01251000483486688, 'lambda_val': 0.00042665403548293836, 'batch_size': 3180, 'optimizer': 'RMSprop'}.
2026-06-18 13:52:03,633 - experiment_functions - INFO - Early stopping at epoch 700. Best Metrics: (0.0034471150507608592, 0.0009046987495263357, 0.002297319568449737)
2026-06-18 13:52:03,712 - optuna.study.study - INFO - Trial 150 finished with values: [0.0034471150507608592, 0.0009046987495263357, 0.002297319568449737] and parameters: {'n_layers': 4, 'embedding_dim': 256, 'lr': 0.002025300477572928, 'lambda_val': 3.83795684112999e-06, 'batch_size': 649, 'optimizer': 'RMSprop'}.
2026-06-18 13:52:35,756 - experiment_functions - INFO - Early stopping at epoch 750. Best Metrics: (0.003620436108127753, 0.0008210180623973727, 0.0021481974543050265)
2026-06-18 13:52:35,849 - optuna.study.study - INFO - Trial 151 finished with values: [0.003620436108127753, 0.0008210180623973727, 0.0021481974543050265] and parameters: {'n_layers': 3, 'embedding_dim': 32, 'lr': 0.003855829449851487, 'lambda_val': 2.7945521753203373e-05, 'batch_size': 892, 'optimizer': 'Adam'}.
2026-06-18 13:53:11,648 - experiment_functions - INFO - Early stopping at epoch 850. Best Metrics: (0.0034664105208760863, 0.0007215485663761526, 0.0020478800258409836)
2026-06-18 13:53:12,503 - optuna.study.study - INFO - Trial 152 finished with values: [0.0034664105208760863, 0.0007215485663761526, 0.0020478800258409836] and parameters: {'n_layers': 1, 'embedding_dim': 32, 'lr': 0.0016391721585660463, 'lambda_val': 1.455259422316608e-06, 'batch_size': 3005, 'optimizer': 'RMSprop'}.
2026-06-18 13:53:49,521 - experiment_functions - INFO - Early stopping at epoch 900. Best Metrics: (0.0032466423199524197, 0.0006915498294808641, 0.0018900892130771306)
2026-06-18 13:53:49,622 - optuna.study.study - INFO - Trial 153 finished with values: [0.0032466423199524197, 0.0006915498294808641, 0.0018900892130771306] and parameters: {'n_layers': 1, 'embedding_dim': 32, 'lr': 0.002487565347422212, 'lambda_val': 1.3344718493912024e-05, 'batch_size': 2563, 'optimizer': 'RMSprop'}.
2026-06-18 13:55:04,777 - experiment_functions - INFO - Early stopping at epoch 1450. Best Metrics: (0.003433907030400804, 0.0008857521788556273, 0.0021444216914818116)
2026-06-18 13:55:05,119 - optuna.study.study - INFO - Trial 154 finished with values: [0.003433907030400804, 0.0008857521788556273, 0.0021444216914818116] and parameters: {'n_layers': 3, 'embedding_dim': 256, 'lr': 0.002487565347422212, 'lambda_val': 3.555884843874079e-05, 'batch_size': 1032, 'optimizer': 'Adam'}.
2026-06-18 13:56:57,719 - experiment_functions - INFO - Early stopping at epoch 2600. Best Metrics: (0.0031089675618879223, 0.0008304913477327271, 0.0020292410580612236)
2026-06-18 13:56:57,801 - optuna.study.study - INFO - Trial 155 finished with values: [0.0031089675618879223, 0.0008304913477327271, 0.0020292410580612236] and parameters: {'n_layers': 3, 'embedding_dim': 96, 'lr': 0.0005796526912711289, 'lambda_val': 1.0687219886452036e-06, 'batch_size': 3953, 'optimizer': 'RMSprop'}.
2026-06-18 13:58:28,478 - experiment_functions - INFO - Early stopping at epoch 2150. Best Metrics: (0.0035602797539457214, 0.0008289124668435014, 0.0021521955052463564)
2026-06-18 13:58:28,826 - optuna.study.study - INFO - Trial 156 finished with values: [0.0035602797539457214, 0.0008289124668435014, 0.0021521955052463564] and parameters: {'n_layers': 1, 'embedding_dim': 128, 'lr': 0.001332731741784367, 'lambda_val': 1.7089177370137862e-06, 'batch_size': 801, 'optimizer': 'RMSprop'}.
2026-06-18 13:59:12,763 - experiment_functions - INFO - Early stopping at epoch 1000. Best Metrics: (0.0030278250914472, 0.0007310218517115069, 0.0017915062449225107)
2026-06-18 13:59:13,073 - optuna.study.study - INFO - Trial 157 finished with values: [0.0030278250914472, 0.0007310218517115069, 0.0017915062449225107] and parameters: {'n_layers': 2, 'embedding_dim': 96, 'lr': 0.0014625528771019128, 'lambda_val': 1.455259422316608e-06, 'batch_size': 2863, 'optimizer': 'RMSprop'}.
2026-06-18 13:59:55,580 - experiment_functions - INFO - Early stopping at epoch 800. Best Metrics: (0.002463400029936403, 0.0005983958570165466, 0.0016228026829380596)
2026-06-18 13:59:55,906 - optuna.study.study - INFO - Trial 158 finished with values: [0.002463400029936403, 0.0005983958570165466, 0.0016228026829380596] and parameters: {'n_layers': 1, 'embedding_dim': 256, 'lr': 0.01251000483486688, 'lambda_val': 1.7089177370137862e-06, 'batch_size': 2877, 'optimizer': 'RMSprop'}.
2026-06-18 14:00:40,618 - experiment_functions - INFO - Early stopping at epoch 950. Best Metrics: (0.0036317262323083896, 0.0009062776304155615, 0.0022188161230102207)
2026-06-18 14:00:40,695 - optuna.study.study - INFO - Trial 159 finished with values: [0.0036317262323083896, 0.0009062776304155615, 0.0022188161230102207] and parameters: {'n_layers': 4, 'embedding_dim': 128, 'lr': 0.0016391721585660463, 'lambda_val': 1.455259422316608e-06, 'batch_size': 2199, 'optimizer': 'RMSprop'}.
2026-06-18 14:02:08,204 - experiment_functions - INFO - Early stopping at epoch 2150. Best Metrics: (0.0033024310733700346, 0.0007089175192623469, 0.00197503230044469)
2026-06-18 14:02:08,537 - optuna.study.study - INFO - Trial 160 finished with values: [0.0033024310733700346, 0.0007089175192623469, 0.00197503230044469] and parameters: {'n_layers': 2, 'embedding_dim': 64, 'lr': 0.0005796526912711289, 'lambda_val': 9.43829822749537e-06, 'batch_size': 1934, 'optimizer': 'Adam'}.
2026-06-18 14:02:30,074 - experiment_functions - INFO - Early stopping at epoch 500. Best Metrics: (0.0006544394486835298, 0.00014525704180876596, 0.0003578269196104611)
2026-06-18 14:02:30,171 - optuna.study.study - INFO - Trial 161 finished with values: [0.0006544394486835298, 0.00014525704180876596, 0.0003578269196104611] and parameters: {'n_layers': 2, 'embedding_dim': 32, 'lr': 6.493105895469043e-05, 'lambda_val': 0.00043303604010372663, 'batch_size': 2495, 'optimizer': 'SGD'}.
2026-06-18 14:03:18,882 - experiment_functions - INFO - Early stopping at epoch 1000. Best Metrics: (0.002013325849902675, 0.0005652393583428066, 0.0012379127292582448)
