2026-06-17 13:10:50,446 - optuna.study.study - INFO - Trial 150 finished with values: [0.003928486963435902, 0.0009568018188707845, 0.002384782217077317] and parameters: {'n_layers': 4, 'embedding_dim': 96, 'lr': 0.0005773267382294165, 'lambda_val': 1.0310836199436669e-05, 'batch_size': 1677, 'optimizer': 'RMSprop'}.
2026-06-17 13:12:29,540 - experiment_functions - INFO - Early stopping at epoch 2350. Best Metrics: (0.0034753206669896623, 0.0008620689655172413, 0.0022358447617136833)
2026-06-17 13:12:29,646 - optuna.study.study - INFO - Trial 151 finished with values: [0.0034753206669896623, 0.0008620689655172413, 0.0022358447617136833] and parameters: {'n_layers': 4, 'embedding_dim': 64, 'lr': 0.0005086943405728801, 'lambda_val': 0.00027668479073292746, 'batch_size': 3141, 'optimizer': 'RMSprop'}.
2026-06-17 13:12:57,665 - experiment_functions - INFO - Early stopping at epoch 500. Best Metrics: (0.000665254506483389, 0.00013578375647341163, 0.00034267760588811426)
2026-06-17 13:12:57,744 - optuna.study.study - INFO - Trial 152 finished with values: [0.000665254506483389, 0.00013578375647341163, 0.00034267760588811426] and parameters: {'n_layers': 4, 'embedding_dim': 256, 'lr': 0.0013364645200376287, 'lambda_val': 1.0310836199436669e-05, 'batch_size': 1467, 'optimizer': 'SGD'}.
2026-06-17 13:15:56,767 - experiment_functions - INFO - Early stopping at epoch 3550. Best Metrics: (0.003388462726180224, 0.0008099658961727928, 0.0020723743336815135)
2026-06-17 13:15:56,856 - optuna.study.study - INFO - Trial 153 finished with values: [0.003388462726180224, 0.0008099658961727928, 0.0020723743336815135] and parameters: {'n_layers': 3, 'embedding_dim': 256, 'lr': 0.0005086943405728801, 'lambda_val': 0.00027668479073292746, 'batch_size': 893, 'optimizer': 'Adam'}.
2026-06-17 13:16:54,966 - experiment_functions - INFO - Early stopping at epoch 1050. Best Metrics: (0.003066391298519441, 0.0008131236579512442, 0.0019129563960479281)
2026-06-17 13:16:55,054 - optuna.study.study - INFO - Trial 154 finished with values: [0.003066391298519441, 0.0008131236579512442, 0.0019129563960479281] and parameters: {'n_layers': 4, 'embedding_dim': 256, 'lr': 0.0013364645200376287, 'lambda_val': 0.00027668479073292746, 'batch_size': 4027, 'optimizer': 'Adam'}.
2026-06-17 13:17:44,829 - experiment_functions - INFO - Early stopping at epoch 900. Best Metrics: (0.0030653694597158293, 0.0008004926108374384, 0.001901266174867323)
2026-06-17 13:17:44,919 - optuna.study.study - INFO - Trial 155 finished with values: [0.0030653694597158293, 0.0008004926108374384, 0.001901266174867323] and parameters: {'n_layers': 4, 'embedding_dim': 256, 'lr': 0.0013364645200376287, 'lambda_val': 0.00027668479073292746, 'batch_size': 3672, 'optimizer': 'Adam'}.
2026-06-17 13:20:34,038 - experiment_functions - INFO - Early stopping at epoch 3900. Best Metrics: (0.0009375555860367504, 0.00020683339648856894, 0.0005038424299182626)
2026-06-17 13:20:34,138 - optuna.study.study - INFO - Trial 156 finished with values: [0.0009375555860367504, 0.00020683339648856894, 0.0005038424299182626] and parameters: {'n_layers': 4, 'embedding_dim': 96, 'lr': 8.728005304356771e-05, 'lambda_val': 1.170012968533328e-05, 'batch_size': 873, 'optimizer': 'RMSprop'}.
2026-06-17 13:21:01,775 - experiment_functions - INFO - Early stopping at epoch 600. Best Metrics: (0.002796980946276743, 0.0007231274472653782, 0.00185254963411835)
2026-06-17 13:21:01,859 - optuna.study.study - INFO - Trial 157 finished with values: [0.002796980946276743, 0.0007231274472653782, 0.00185254963411835] and parameters: {'n_layers': 4, 'embedding_dim': 64, 'lr': 0.0238996514890283, 'lambda_val': 2.2853011169521347e-06, 'batch_size': 2622, 'optimizer': 'Adam'}.
2026-06-17 13:22:48,767 - experiment_functions - INFO - Early stopping at epoch 2100. Best Metrics: (0.003104531536059547, 0.0007957559681697613, 0.0018743853208667814)
2026-06-17 13:22:48,839 - optuna.study.study - INFO - Trial 158 finished with values: [0.003104531536059547, 0.0007957559681697613, 0.0018743853208667814] and parameters: {'n_layers': 3, 'embedding_dim': 256, 'lr': 0.0008946860620636538, 'lambda_val': 1.170012968533328e-05, 'batch_size': 4027, 'optimizer': 'Adam'}.
2026-06-17 13:24:45,836 - experiment_functions - INFO - Early stopping at epoch 2600. Best Metrics: (0.00351862214887191, 0.0009299608437539473, 0.0021964597593194294)
2026-06-17 13:24:45,913 - optuna.study.study - INFO - Trial 159 finished with values: [0.00351862214887191, 0.0009299608437539473, 0.0021964597593194294] and parameters: {'n_layers': 4, 'embedding_dim': 128, 'lr': 0.0005841453281578621, 'lambda_val': 1.170012968533328e-05, 'batch_size': 2288, 'optimizer': 'RMSprop'}.
2026-06-17 13:25:12,066 - experiment_functions - INFO - Early stopping at epoch 550. Best Metrics: (0.0022428907838478737, 0.0005383983832259694, 0.00147148698207555)
2026-06-17 13:25:12,141 - optuna.study.study - INFO - Trial 160 finished with values: [0.0022428907838478737, 0.0005383983832259694, 0.00147148698207555] and parameters: {'n_layers': 1, 'embedding_dim': 256, 'lr': 0.005427188960178344, 'lambda_val': 0.002174949430049739, 'batch_size': 2754, 'optimizer': 'RMSprop'}.
2026-06-17 13:25:55,636 - experiment_functions - INFO - Early stopping at epoch 950. Best Metrics: (0.0025843058005248095, 0.0007010231148162182, 0.001786988288571005)
2026-06-17 13:25:55,722 - optuna.study.study - INFO - Trial 161 finished with values: [0.0025843058005248095, 0.0007010231148162182, 0.001786988288571005] and parameters: {'n_layers': 1, 'embedding_dim': 256, 'lr': 0.005427188960178344, 'lambda_val': 7.067730208761557e-06, 'batch_size': 4010, 'optimizer': 'RMSprop'}.
2026-06-17 13:26:18,627 - experiment_functions - INFO - Early stopping at epoch 500. Best Metrics: (0.0005214581820561409, 0.00011999494758115448, 0.00027843776912706215)
2026-06-17 13:26:18,710 - optuna.study.study - INFO - Trial 162 finished with values: [0.0005214581820561409, 0.00011999494758115448, 0.00027843776912706215] and parameters: {'n_layers': 2, 'embedding_dim': 128, 'lr': 0.0008946860620636538, 'lambda_val': 6.36485192314748e-05, 'batch_size': 1677, 'optimizer': 'SGD'}.
2026-06-17 13:26:42,832 - experiment_functions - INFO - Early stopping at epoch 550. Best Metrics: (0.002786978719274608, 0.0006252368321333839, 0.0017186194951934282)
2026-06-17 13:26:42,908 - optuna.study.study - INFO - Trial 163 finished with values: [0.002786978719274608, 0.0006252368321333839, 0.0017186194951934282] and parameters: {'n_layers': 2, 'embedding_dim': 64, 'lr': 0.013498745374989938, 'lambda_val': 1.1791971258066213e-06, 'batch_size': 2622, 'optimizer': 'Adam'}.
2026-06-17 13:27:07,636 - experiment_functions - INFO - Early stopping at epoch 550. Best Metrics: (0.0031328295451253543, 0.0007262852090438297, 0.0019216084972058574)
2026-06-17 13:27:07,720 - optuna.study.study - INFO - Trial 164 finished with values: [0.0031328295451253543, 0.0007262852090438297, 0.0019216084972058574] and parameters: {'n_layers': 4, 'embedding_dim': 64, 'lr': 0.009567567424439887, 'lambda_val': 9.680731525938664e-06, 'batch_size': 3806, 'optimizer': 'Adam'}.
2026-06-17 13:27:56,410 - experiment_functions - INFO - Early stopping at epoch 1000. Best Metrics: (0.0030707014007252784, 0.0008068081343943415, 0.0019372609681791036)
2026-06-17 13:27:56,487 - optuna.study.study - INFO - Trial 165 finished with values: [0.0030707014007252784, 0.0008068081343943415, 0.0019372609681791036] and parameters: {'n_layers': 2, 'embedding_dim': 256, 'lr': 0.004071349079274372, 'lambda_val': 3.399802510238604e-06, 'batch_size': 3073, 'optimizer': 'RMSprop'}.
2026-06-17 13:29:18,251 - experiment_functions - INFO - Early stopping at epoch 2050. Best Metrics: (0.0029862223820394575, 0.0007120752810407984, 0.0018890620662570569)
2026-06-17 13:29:18,330 - optuna.study.study - INFO - Trial 166 finished with values: [0.0029862223820394575, 0.0007120752810407984, 0.0018890620662570569] and parameters: {'n_layers': 4, 'embedding_dim': 32, 'lr': 0.0005841453281578621, 'lambda_val': 1.0310836199436669e-05, 'batch_size': 3853, 'optimizer': 'Adam'}.
2026-06-17 13:29:46,211 - experiment_functions - INFO - Early stopping at epoch 500. Best Metrics: (0.0005119060216012724, 0.00012473159024883166, 0.0002838942784202061)
2026-06-17 13:29:46,294 - optuna.study.study - INFO - Trial 167 finished with values: [0.0005119060216012724, 0.00012473159024883166, 0.0002838942784202061] and parameters: {'n_layers': 4, 'embedding_dim': 256, 'lr': 0.0011183305289179514, 'lambda_val': 0.0006777920356670547, 'batch_size': 3004, 'optimizer': 'SGD'}.
2026-06-17 13:31:37,818 - experiment_functions - INFO - Early stopping at epoch 2800. Best Metrics: (0.0034162145880835527, 0.0007452317797145383, 0.0020587536081281463)
2026-06-17 13:31:38,067 - optuna.study.study - INFO - Trial 168 finished with values: [0.0034162145880835527, 0.0007452317797145383, 0.0020587536081281463] and parameters: {'n_layers': 1, 'embedding_dim': 96, 'lr': 0.0005841453281578621, 'lambda_val': 1.0310836199436669e-05, 'batch_size': 1677, 'optimizer': 'RMSprop'}.
2026-06-17 13:32:23,904 - experiment_functions - INFO - Early stopping at epoch 1000. Best Metrics: (0.0030357365076560303, 0.0007562839459391183, 0.00190552035186135)
2026-06-17 13:32:23,978 - optuna.study.study - INFO - Trial 169 finished with values: [0.0030357365076560303, 0.0007562839459391183, 0.00190552035186135] and parameters: {'n_layers': 3, 'embedding_dim': 128, 'lr': 0.0008946860620636538, 'lambda_val': 2.1293519513539238e-05, 'batch_size': 2544, 'optimizer': 'Adam'}.
2026-06-17 13:33:17,945 - experiment_functions - INFO - Early stopping at epoch 1300. Best Metrics: (0.0026416564229468638, 0.0005794492863458381, 0.0015926505690974989)
2026-06-17 13:33:18,024 - optuna.study.study - INFO - Trial 170 finished with values: [0.0026416564229468638, 0.0005794492863458381, 0.0015926505690974989] and parameters: {'n_layers': 1, 'embedding_dim': 96, 'lr': 0.0005841453281578621, 'lambda_val': 0.0038106336531074053, 'batch_size': 4027, 'optimizer': 'RMSprop'}.
2026-06-17 13:33:50,434 - experiment_functions - INFO - Early stopping at epoch 700. Best Metrics: (0.0032691390145972174, 0.0008320702286219528, 0.002062141347863366)
2026-06-17 13:33:50,503 - optuna.study.study - INFO - Trial 171 finished with values: [0.0032691390145972174, 0.0008320702286219528, 0.002062141347863366] and parameters: {'n_layers': 4, 'embedding_dim': 96, 'lr': 0.0013364645200376287, 'lambda_val': 1.170012968533328e-05, 'batch_size': 2080, 'optimizer': 'RMSprop'}.
2026-06-17 13:34:14,127 - experiment_functions - INFO - Early stopping at epoch 550. Best Metrics: (0.0030535955609765388, 0.0006394467601364152, 0.0018890710604013152)
2026-06-17 13:34:14,209 - optuna.study.study - INFO - Trial 172 finished with values: [0.0030535955609765388, 0.0006394467601364152, 0.0018890710604013152] and parameters: {'n_layers': 1, 'embedding_dim': 32, 'lr': 0.005427188960178344, 'lambda_val': 7.067730208761557e-06, 'batch_size': 2754, 'optimizer': 'RMSprop'}.
2026-06-17 13:36:23,110 - experiment_functions - INFO - Early stopping at epoch 2900. Best Metrics: (0.003821052661778338, 0.0009062776304155616, 0.0024053005789088948)
2026-06-17 13:36:23,198 - optuna.study.study - INFO - Trial 173 finished with values: [0.003821052661778338, 0.0009062776304155616, 0.0024053005789088948] and parameters: {'n_layers': 3, 'embedding_dim': 128, 'lr': 0.0005841453281578621, 'lambda_val': 1.170012968533328e-05, 'batch_size': 3100, 'optimizer': 'RMSprop'}.
2026-06-17 13:36:55,990 - experiment_functions - INFO - Early stopping at epoch 700. Best Metrics: (0.002570844495052593, 0.0005999747379057724, 0.0016563418056580418)
2026-06-17 13:36:56,074 - optuna.study.study - INFO - Trial 174 finished with values: [0.002570844495052593, 0.0005999747379057724, 0.0016563418056580418] and parameters: {'n_layers': 1, 'embedding_dim': 256, 'lr': 0.013498745374989938, 'lambda_val': 1.0310836199436669e-05, 'batch_size': 1507, 'optimizer': 'RMSprop'}.
2026-06-17 13:39:48,261 - experiment_functions - INFO - Early stopping at epoch 3250. Best Metrics: (0.0035834648019141594, 0.0009015409877478842, 0.00227636237465154)
2026-06-17 13:39:48,349 - optuna.study.study - INFO - Trial 175 finished with values: [0.0035834648019141594, 0.0009015409877478842, 0.00227636237465154] and parameters: {'n_layers': 4, 'embedding_dim': 256, 'lr': 0.0005841453281578621, 'lambda_val': 1.9289997599017184e-06, 'batch_size': 1507, 'optimizer': 'Adam'}.
2026-06-17 13:41:10,248 - experiment_functions - INFO - Early stopping at epoch 2050. Best Metrics: (0.0037183820969918634, 0.0007783882783882784, 0.0022022778947968957)
2026-06-17 13:41:10,340 - optuna.study.study - INFO - Trial 176 finished with values: [0.0037183820969918634, 0.0007783882783882784, 0.0022022778947968957] and parameters: {'n_layers': 1, 'embedding_dim': 64, 'lr': 0.0009353759827353638, 'lambda_val': 1.170012968533328e-05, 'batch_size': 1507, 'optimizer': 'RMSprop'}.
2026-06-17 13:41:36,845 - experiment_functions - INFO - Early stopping at epoch 600. Best Metrics: (0.0027080622350362767, 0.000618921308576481, 0.0017752654492122209)
2026-06-17 13:41:36,921 - optuna.study.study - INFO - Trial 177 finished with values: [0.0027080622350362767, 0.000618921308576481, 0.0017752654492122209] and parameters: {'n_layers': 1, 'embedding_dim': 96, 'lr': 0.013498745374989938, 'lambda_val': 1.170012968533328e-05, 'batch_size': 1507, 'optimizer': 'Adam'}.
2026-06-17 13:42:40,061 - experiment_functions - INFO - Early stopping at epoch 1400. Best Metrics: (0.0028556665779992285, 0.0006236579512441581, 0.0017807491069699736)
2026-06-17 13:42:40,150 - optuna.study.study - INFO - Trial 178 finished with values: [0.0028556665779992285, 0.0006236579512441581, 0.0017807491069699736] and parameters: {'n_layers': 1, 'embedding_dim': 256, 'lr': 0.0005841453281578621, 'lambda_val': 0.0004867376939360758, 'batch_size': 2776, 'optimizer': 'RMSprop'}.
2026-06-17 13:45:18,726 - experiment_functions - INFO - Early stopping at epoch 3350. Best Metrics: (0.0036580145136754804, 0.0008715422508525959, 0.002263923876456878)
2026-06-17 13:45:18,804 - optuna.study.study - INFO - Trial 179 finished with values: [0.0036580145136754804, 0.0008715422508525959, 0.002263923876456878] and parameters: {'n_layers': 2, 'embedding_dim': 256, 'lr': 0.0005086943405728801, 'lambda_val': 0.00012072062045747035, 'batch_size': 893, 'optimizer': 'RMSprop'}.
2026-06-17 13:46:56,368 - experiment_functions - INFO - Early stopping at epoch 1800. Best Metrics: (0.003139005191535996, 0.0008368068712896299, 0.0019470138372117592)
2026-06-17 13:46:56,458 - optuna.study.study - INFO - Trial 180 finished with values: [0.003139005191535996, 0.0008368068712896299, 0.0019470138372117592] and parameters: {'n_layers': 4, 'embedding_dim': 256, 'lr': 0.0013364645200376287, 'lambda_val': 5.723560548835963e-06, 'batch_size': 3672, 'optimizer': 'Adam'}.
2026-06-17 13:48:36,262 - experiment_functions - INFO - Early stopping at epoch 2150. Best Metrics: (0.0034214674181501626, 0.0008936465833017557, 0.0021390830407183666)
2026-06-17 13:48:36,331 - optuna.study.study - INFO - Trial 181 finished with values: [0.0034214674181501626, 0.0008936465833017557, 0.0021390830407183666] and parameters: {'n_layers': 4, 'embedding_dim': 128, 'lr': 0.0005841453281578621, 'lambda_val': 1.0310836199436669e-05, 'batch_size': 3853, 'optimizer': 'RMSprop'}.
2026-06-17 13:49:53,283 - experiment_functions - INFO - Early stopping at epoch 1400. Best Metrics: (0.003252499100547424, 0.0008289124668435014, 0.00199184854334702)
2026-06-17 13:49:53,367 - optuna.study.study - INFO - Trial 182 finished with values: [0.003252499100547424, 0.0008289124668435014, 0.00199184854334702] and parameters: {'n_layers': 4, 'embedding_dim': 256, 'lr': 0.0014337059824812508, 'lambda_val': 6.318727634085899e-05, 'batch_size': 4027, 'optimizer': 'Adam'}.
2026-06-17 13:52:31,445 - optuna.study.study - INFO - Trial 183 finished with values: [0.0032399344939653884, 0.0006915498294808642, 0.0020507846314314457] and parameters: {'n_layers': 1, 'embedding_dim': 32, 'lr': 0.00035885552475151193, 'lambda_val': 9.680731525938664e-06, 'batch_size': 4010, 'optimizer': 'RMSprop'}.
2026-06-17 13:53:48,330 - experiment_functions - INFO - Early stopping at epoch 1800. Best Metrics: (0.0032502330794718128, 0.0007910193255020841, 0.0020402959257145572)
2026-06-17 13:53:48,402 - optuna.study.study - INFO - Trial 184 finished with values: [0.0032502330794718128, 0.0007910193255020841, 0.0020402959257145572] and parameters: {'n_layers': 4, 'embedding_dim': 64, 'lr': 0.0009353759827353638, 'lambda_val': 1.4608206337312987e-05, 'batch_size': 4027, 'optimizer': 'Adam'}.
2026-06-17 13:54:17,628 - experiment_functions - INFO - Early stopping at epoch 700. Best Metrics: (0.0020536468747862258, 0.0004531388152077808, 0.0012104033805201407)
2026-06-17 13:54:17,693 - optuna.study.study - INFO - Trial 185 finished with values: [0.0020536468747862258, 0.0004531388152077808, 0.0012104033805201407] and parameters: {'n_layers': 1, 'embedding_dim': 32, 'lr': 0.0014337059824812508, 'lambda_val': 0.02735820652800046, 'batch_size': 4027, 'optimizer': 'RMSprop'}.
2026-06-17 13:55:41,150 - experiment_functions - INFO - Early stopping at epoch 1750. Best Metrics: (0.003219334983325953, 0.0008573323228495643, 0.0020382348761932294)
2026-06-17 13:55:41,224 - optuna.study.study - INFO - Trial 186 finished with values: [0.003219334983325953, 0.0008573323228495643, 0.0020382348761932294] and parameters: {'n_layers': 2, 'embedding_dim': 256, 'lr': 0.004071349079274372, 'lambda_val': 1.8109663387347854e-06, 'batch_size': 934, 'optimizer': 'RMSprop'}.
2026-06-17 13:56:47,594 - experiment_functions - INFO - Early stopping at epoch 1200. Best Metrics: (0.003612474712076866, 0.00092522420108627, 0.0022574150120980843)
2026-06-17 13:56:47,678 - optuna.study.study - INFO - Trial 187 finished with values: [0.003612474712076866, 0.00092522420108627, 0.0022574150120980843] and parameters: {'n_layers': 4, 'embedding_dim': 256, 'lr': 0.0014337059824812508, 'lambda_val': 0.00027668479073292746, 'batch_size': 815, 'optimizer': 'Adam'}.
2026-06-17 13:57:16,235 - experiment_functions - INFO - Early stopping at epoch 500. Best Metrics: (0.0004706785419130543, 0.0001278893520272831, 0.00027644348551638434)
2026-06-17 13:57:16,311 - optuna.study.study - INFO - Trial 188 finished with values: [0.0004706785419130543, 0.0001278893520272831, 0.00027644348551638434] and parameters: {'n_layers': 4, 'embedding_dim': 256, 'lr': 0.0005841453281578621, 'lambda_val': 0.00027668479073292746, 'batch_size': 3672, 'optimizer': 'SGD'}.
2026-06-17 14:00:50,866 - optuna.study.study - INFO - Trial 189 finished with values: [0.0032509163023343784, 0.000865226727295693, 0.002027547069403132] and parameters: {'n_layers': 4, 'embedding_dim': 256, 'lr': 0.0005086943405728801, 'lambda_val': 1.1791971258066213e-06, 'batch_size': 2994, 'optimizer': 'Adam'}.
2026-06-17 14:01:40,251 - experiment_functions - INFO - Early stopping at epoch 1150. Best Metrics: (0.0025868512517761605, 0.0005952380952380953, 0.0016108822346901544)
2026-06-17 14:01:40,336 - optuna.study.study - INFO - Trial 190 finished with values: [0.0025868512517761605, 0.0005952380952380953, 0.0016108822346901544] and parameters: {'n_layers': 1, 'embedding_dim': 96, 'lr': 0.0059130773813250445, 'lambda_val': 7.067730208761557e-06, 'batch_size': 2754, 'optimizer': 'Adam'}.
2026-06-17 14:03:46,732 - experiment_functions - INFO - Early stopping at epoch 2850. Best Metrics: (0.003199974878226039, 0.0007957559681697613, 0.001993234922577237)
2026-06-17 14:03:46,817 - optuna.study.study - INFO - Trial 191 finished with values: [0.003199974878226039, 0.0007957559681697613, 0.001993234922577237] and parameters: {'n_layers': 4, 'embedding_dim': 96, 'lr': 0.00035885552475151193, 'lambda_val': 5.9581019806786705e-06, 'batch_size': 4010, 'optimizer': 'RMSprop'}.
2026-06-17 14:06:43,255 - optuna.study.study - INFO - Trial 192 finished with values: [0.004064750648764384, 0.0010025893646583301, 0.0024787720649264437] and parameters: {'n_layers': 3, 'embedding_dim': 128, 'lr': 0.0005841453281578621, 'lambda_val': 1.170012968533328e-05, 'batch_size': 934, 'optimizer': 'RMSprop'}.
2026-06-17 14:08:50,659 - experiment_functions - INFO - Early stopping at epoch 3100. Best Metrics: (0.002882397074440841, 0.0006173424276872553, 0.0017616447256533997)
2026-06-17 14:08:50,734 - optuna.study.study - INFO - Trial 193 finished with values: [0.002882397074440841, 0.0006173424276872553, 0.0017616447256533997] and parameters: {'n_layers': 1, 'embedding_dim': 96, 'lr': 0.0005773267382294165, 'lambda_val': 0.0001888304595934841, 'batch_size': 3806, 'optimizer': 'Adam'}.
2026-06-17 14:10:28,844 - experiment_functions - INFO - Early stopping at epoch 2100. Best Metrics: (0.0035968028835937594, 0.0009346974864216243, 0.0021944427446212765)
2026-06-17 14:10:28,917 - optuna.study.study - INFO - Trial 194 finished with values: [0.0035968028835937594, 0.0009346974864216243, 0.0021944427446212765] and parameters: {'n_layers': 4, 'embedding_dim': 128, 'lr': 0.0008946860620636538, 'lambda_val': 6.36485192314748e-05, 'batch_size': 934, 'optimizer': 'Adam'}.
2026-06-17 14:10:53,956 - experiment_functions - INFO - Early stopping at epoch 500. Best Metrics: (0.0006203571927679659, 0.00012473159024883166, 0.00031857277396973735)
2026-06-17 14:10:54,043 - optuna.study.study - INFO - Trial 195 finished with values: [0.0006203571927679659, 0.00012473159024883166, 0.00031857277396973735] and parameters: {'n_layers': 4, 'embedding_dim': 128, 'lr': 0.0005841453281578621, 'lambda_val': 1.0310836199436669e-05, 'batch_size': 3853, 'optimizer': 'SGD'}.
2026-06-17 14:11:48,579 - experiment_functions - INFO - Early stopping at epoch 1250. Best Metrics: (0.003415990939848337, 0.0008683844890741443, 0.0021794749491671926)
