2026-06-22 19:48:48,470 - optuna.study.study - INFO - Trial 134 finished with values: [0.004467395275176202, 0.0009599595806492359, 0.0024911779645813274] and parameters: {'n_layers': 4, 'embedding_dim': 32, 'lr': 0.019758488139791107, 'lambda_val': 0.008507655043799656, 'batch_size': 2857, 'optimizer': 'RMSprop'}.
2026-06-22 19:49:51,775 - experiment_functions - INFO - Early stopping at epoch 1400. Best Metrics: (0.0005531059374193028, 0.00012315270935960593, 0.0002887331125259296)
2026-06-22 19:49:51,883 - optuna.study.study - INFO - Trial 135 finished with values: [0.0005531059374193028, 0.00012315270935960593, 0.0002887331125259296] and parameters: {'n_layers': 2, 'embedding_dim': 96, 'lr': 4.477136549250725e-05, 'lambda_val': 3.330662577836562e-06, 'batch_size': 2714, 'optimizer': 'RMSprop'}.
2026-06-22 19:52:59,225 - optuna.study.study - INFO - Trial 136 finished with values: [0.010825244686305467, 0.0023320070733863834, 0.005978764774276381] and parameters: {'n_layers': 3, 'embedding_dim': 96, 'lr': 0.012994567788334225, 'lambda_val': 0.00036714980791779657, 'batch_size': 2686, 'optimizer': 'RMSprop'}.
2026-06-22 19:53:28,360 - experiment_functions - INFO - Early stopping at epoch 550. Best Metrics: (0.007557630502326514, 0.0016136162687886827, 0.004017985885782853)
2026-06-22 19:53:28,796 - optuna.study.study - INFO - Trial 137 finished with values: [0.007557630502326514, 0.0016136162687886827, 0.004017985885782853] and parameters: {'n_layers': 4, 'embedding_dim': 96, 'lr': 0.001706237377982523, 'lambda_val': 0.008507655043799656, 'batch_size': 3574, 'optimizer': 'RMSprop'}.
2026-06-22 19:54:44,723 - experiment_functions - INFO - Early stopping at epoch 1750. Best Metrics: (0.026267580832578446, 0.005597132752305166, 0.01497609610420046)
2026-06-22 19:54:44,827 - optuna.study.study - INFO - Trial 138 finished with values: [0.026267580832578446, 0.005597132752305166, 0.01497609610420046] and parameters: {'n_layers': 3, 'embedding_dim': 32, 'lr': 0.0006129132477888526, 'lambda_val': 0.0008491169466682814, 'batch_size': 1291, 'optimizer': 'RMSprop'}.
2026-06-22 19:55:11,718 - experiment_functions - INFO - Early stopping at epoch 600. Best Metrics: (0.008166656442884486, 0.00166256157635468, 0.004473075164889283)
2026-06-22 19:55:12,043 - optuna.study.study - INFO - Trial 139 finished with values: [0.008166656442884486, 0.00166256157635468, 0.004473075164889283] and parameters: {'n_layers': 2, 'embedding_dim': 32, 'lr': 0.029989240467009036, 'lambda_val': 0.00036714980791779657, 'batch_size': 3947, 'optimizer': 'RMSprop'}.
2026-06-22 19:56:02,244 - experiment_functions - INFO - Early stopping at epoch 1050. Best Metrics: (0.02099107339932708, 0.0045850701023114815, 0.012033391663934422)
2026-06-22 19:56:02,345 - optuna.study.study - INFO - Trial 140 finished with values: [0.02099107339932708, 0.0045850701023114815, 0.012033391663934422] and parameters: {'n_layers': 4, 'embedding_dim': 64, 'lr': 0.0005347670500185667, 'lambda_val': 0.00016070502405844529, 'batch_size': 3603, 'optimizer': 'RMSprop'}.
2026-06-22 19:56:34,929 - experiment_functions - INFO - Early stopping at epoch 650. Best Metrics: (0.010821533807607458, 0.002309902740937224, 0.006129133293146813)
2026-06-22 19:56:35,022 - optuna.study.study - INFO - Trial 141 finished with values: [0.010821533807607458, 0.002309902740937224, 0.006129133293146813] and parameters: {'n_layers': 4, 'embedding_dim': 64, 'lr': 0.025936469453006126, 'lambda_val': 6.388650961927443e-06, 'batch_size': 1052, 'optimizer': 'RMSprop'}.
2026-06-22 19:56:59,068 - experiment_functions - INFO - Early stopping at epoch 500. Best Metrics: (0.0007098677839256067, 0.00015946696981179742, 0.00040641453270288074)
2026-06-22 19:56:59,175 - optuna.study.study - INFO - Trial 142 finished with values: [0.0007098677839256067, 0.00015946696981179742, 0.00040641453270288074] and parameters: {'n_layers': 4, 'embedding_dim': 32, 'lr': 0.0005347670500185667, 'lambda_val': 0.00036714980791779657, 'batch_size': 760, 'optimizer': 'SGD'}.
2026-06-22 19:57:32,035 - experiment_functions - INFO - Early stopping at epoch 650. Best Metrics: (0.008180526084365676, 0.0016736137425792598, 0.004439757117563948)
2026-06-22 19:57:32,179 - optuna.study.study - INFO - Trial 143 finished with values: [0.008180526084365676, 0.0016736137425792598, 0.004439757117563948] and parameters: {'n_layers': 3, 'embedding_dim': 96, 'lr': 0.009418619221822685, 'lambda_val': 0.0008491169466682814, 'batch_size': 2562, 'optimizer': 'RMSprop'}.
2026-06-22 20:00:13,325 - experiment_functions - INFO - Early stopping at epoch 2500. Best Metrics: (0.005645884741342304, 0.0011810029051408364, 0.002970895562230371)
2026-06-22 20:00:13,486 - optuna.study.study - INFO - Trial 144 finished with values: [0.005645884741342304, 0.0011810029051408364, 0.002970895562230371] and parameters: {'n_layers': 4, 'embedding_dim': 256, 'lr': 0.029989240467009036, 'lambda_val': 0.0015161650710988693, 'batch_size': 794, 'optimizer': 'Adam'}.
2026-06-22 20:03:06,621 - optuna.study.study - INFO - Trial 145 finished with values: [0.02194727749110976, 0.004738221548566376, 0.012376137210620183] and parameters: {'n_layers': 4, 'embedding_dim': 32, 'lr': 0.0004235044324291316, 'lambda_val': 5.455116561469672e-06, 'batch_size': 2714, 'optimizer': 'Adam'}.
2026-06-22 20:03:39,965 - experiment_functions - INFO - Early stopping at epoch 600. Best Metrics: (0.012999340422465647, 0.002829354553492485, 0.007705344555310203)
2026-06-22 20:03:40,255 - optuna.study.study - INFO - Trial 146 finished with values: [0.012999340422465647, 0.002829354553492485, 0.007705344555310203] and parameters: {'n_layers': 4, 'embedding_dim': 128, 'lr': 0.001706237377982523, 'lambda_val': 5.8421827248860175e-05, 'batch_size': 528, 'optimizer': 'RMSprop'}.
2026-06-22 20:04:05,636 - experiment_functions - INFO - Early stopping at epoch 550. Best Metrics: (0.003779541923745202, 0.0007783882783882784, 0.0019168614982814206)
2026-06-22 20:04:05,762 - optuna.study.study - INFO - Trial 147 finished with values: [0.003779541923745202, 0.0007783882783882784, 0.0019168614982814206] and parameters: {'n_layers': 4, 'embedding_dim': 32, 'lr': 0.03277404265387728, 'lambda_val': 0.008507655043799656, 'batch_size': 948, 'optimizer': 'Adam'}.
2026-06-22 20:04:30,998 - experiment_functions - INFO - Early stopping at epoch 550. Best Metrics: (0.015491819692405446, 0.0033645951749400028, 0.008860046748668806)
2026-06-22 20:04:31,104 - optuna.study.study - INFO - Trial 148 finished with values: [0.015491819692405446, 0.0033645951749400028, 0.008860046748668806] and parameters: {'n_layers': 2, 'embedding_dim': 32, 'lr': 0.007439851699552315, 'lambda_val': 0.00036714980791779657, 'batch_size': 760, 'optimizer': 'RMSprop'}.
2026-06-22 20:04:55,915 - experiment_functions - INFO - Early stopping at epoch 550. Best Metrics: (0.010421410064961511, 0.002354111405835544, 0.005267029135716372)
2026-06-22 20:04:56,021 - optuna.study.study - INFO - Trial 149 finished with values: [0.010421410064961511, 0.002354111405835544, 0.005267029135716372] and parameters: {'n_layers': 2, 'embedding_dim': 32, 'lr': 0.012994567788334225, 'lambda_val': 0.0008544209026262442, 'batch_size': 2686, 'optimizer': 'Adam'}.
2026-06-22 20:05:26,244 - experiment_functions - INFO - Early stopping at epoch 650. Best Metrics: (0.021535415129200996, 0.004818744473916887, 0.011845961202839712)
2026-06-22 20:05:26,604 - optuna.study.study - INFO - Trial 150 finished with values: [0.021535415129200996, 0.004818744473916887, 0.011845961202839712] and parameters: {'n_layers': 2, 'embedding_dim': 64, 'lr': 0.0024593680412654663, 'lambda_val': 0.008507655043799656, 'batch_size': 2857, 'optimizer': 'Adam'}.
2026-06-22 20:05:51,455 - experiment_functions - INFO - Early stopping at epoch 550. Best Metrics: (0.007112610815571326, 0.0015346722243273969, 0.0038351263446350366)
2026-06-22 20:05:51,558 - optuna.study.study - INFO - Trial 151 finished with values: [0.007112610815571326, 0.0015346722243273969, 0.0038351263446350366] and parameters: {'n_layers': 2, 'embedding_dim': 32, 'lr': 0.03277404265387728, 'lambda_val': 0.00036714980791779657, 'batch_size': 2554, 'optimizer': 'RMSprop'}.
2026-06-22 20:06:42,385 - experiment_functions - INFO - Early stopping at epoch 1000. Best Metrics: (0.015891607369968974, 0.0034088038398383228, 0.008856994480212108)
2026-06-22 20:06:42,540 - optuna.study.study - INFO - Trial 152 finished with values: [0.015891607369968974, 0.0034088038398383228, 0.008856994480212108] and parameters: {'n_layers': 4, 'embedding_dim': 96, 'lr': 0.0004235044324291316, 'lambda_val': 0.00616990447359406, 'batch_size': 2714, 'optimizer': 'RMSprop'}.
2026-06-22 20:07:44,752 - experiment_functions - INFO - Early stopping at epoch 1300. Best Metrics: (0.02064423627802735, 0.004562965769862322, 0.011553221976187519)
2026-06-22 20:07:44,842 - optuna.study.study - INFO - Trial 153 finished with values: [0.02064423627802735, 0.004562965769862322, 0.011553221976187519] and parameters: {'n_layers': 4, 'embedding_dim': 64, 'lr': 0.0005347670500185667, 'lambda_val': 0.00016070502405844529, 'batch_size': 3603, 'optimizer': 'RMSprop'}.
2026-06-22 20:08:10,175 - experiment_functions - INFO - Early stopping at epoch 550. Best Metrics: (0.01082434467292916, 0.0024788429960843753, 0.006378702233241904)
2026-06-22 20:08:10,277 - optuna.study.study - INFO - Trial 154 finished with values: [0.01082434467292916, 0.0024788429960843753, 0.006378702233241904] and parameters: {'n_layers': 2, 'embedding_dim': 32, 'lr': 0.0024593680412654663, 'lambda_val': 0.008507655043799656, 'batch_size': 557, 'optimizer': 'RMSprop'}.
2026-06-22 20:08:42,661 - experiment_functions - INFO - Early stopping at epoch 700. Best Metrics: (0.024948231477362987, 0.005379247189592017, 0.013997961839968539)
2026-06-22 20:08:42,761 - optuna.study.study - INFO - Trial 155 finished with values: [0.024948231477362987, 0.005379247189592017, 0.013997961839968539] and parameters: {'n_layers': 2, 'embedding_dim': 64, 'lr': 0.0024593680412654663, 'lambda_val': 3.330662577836562e-06, 'batch_size': 2194, 'optimizer': 'Adam'}.
2026-06-22 20:10:06,836 - experiment_functions - INFO - Early stopping at epoch 1950. Best Metrics: (0.0259500372716322, 0.00569502336743716, 0.01497648456073461)
2026-06-22 20:10:06,940 - optuna.study.study - INFO - Trial 156 finished with values: [0.0259500372716322, 0.00569502336743716, 0.01497648456073461] and parameters: {'n_layers': 3, 'embedding_dim': 32, 'lr': 0.0006129132477888526, 'lambda_val': 0.0008491169466682814, 'batch_size': 1291, 'optimizer': 'RMSprop'}.
2026-06-22 20:10:30,248 - experiment_functions - INFO - Early stopping at epoch 500. Best Metrics: (0.0006145010309795694, 0.00012473159024883163, 0.0003121401345838322)
2026-06-22 20:10:30,405 - optuna.study.study - INFO - Trial 157 finished with values: [0.0006145010309795694, 0.00012473159024883163, 0.0003121401345838322] and parameters: {'n_layers': 1, 'embedding_dim': 96, 'lr': 3.741295301221814e-05, 'lambda_val': 0.00036714980791779657, 'batch_size': 3616, 'optimizer': 'RMSprop'}.
2026-06-22 20:11:50,721 - experiment_functions - INFO - Early stopping at epoch 1700. Best Metrics: (0.02348014344220088, 0.005077680939749905, 0.013649546054693885)
2026-06-22 20:11:50,825 - optuna.study.study - INFO - Trial 158 finished with values: [0.02348014344220088, 0.005077680939749905, 0.013649546054693885] and parameters: {'n_layers': 4, 'embedding_dim': 64, 'lr': 0.00045681378220125877, 'lambda_val': 5.455116561469672e-06, 'batch_size': 3133, 'optimizer': 'RMSprop'}.
2026-06-22 20:12:15,995 - experiment_functions - INFO - Early stopping at epoch 550. Best Metrics: (0.006274046725117255, 0.001305734495389668, 0.003363003087813586)
2026-06-22 20:12:16,096 - optuna.study.study - INFO - Trial 159 finished with values: [0.006274046725117255, 0.001305734495389668, 0.003363003087813586] and parameters: {'n_layers': 3, 'embedding_dim': 32, 'lr': 0.0316853227318508, 'lambda_val': 0.0008491169466682814, 'batch_size': 760, 'optimizer': 'RMSprop'}.
2026-06-22 20:12:43,664 - experiment_functions - INFO - Early stopping at epoch 550. Best Metrics: (0.012902309744011367, 0.0027504105090311987, 0.007264832607106279)
2026-06-22 20:12:43,761 - optuna.study.study - INFO - Trial 160 finished with values: [0.012902309744011367, 0.0027504105090311987, 0.007264832607106279] and parameters: {'n_layers': 2, 'embedding_dim': 128, 'lr': 0.006250612281633036, 'lambda_val': 3.330662577836562e-06, 'batch_size': 2194, 'optimizer': 'RMSprop'}.
2026-06-22 20:15:30,039 - optuna.study.study - INFO - Trial 161 finished with values: [0.026308144968059465, 0.005698181129215612, 0.015150761421822962] and parameters: {'n_layers': 2, 'embedding_dim': 32, 'lr': 0.00045681378220125877, 'lambda_val': 5.455116561469672e-06, 'batch_size': 1126, 'optimizer': 'RMSprop'}.
2026-06-22 20:18:11,056 - optuna.study.study - INFO - Trial 162 finished with values: [0.0018433191132680043, 0.0004641909814323608, 0.0011366933467674342] and parameters: {'n_layers': 2, 'embedding_dim': 32, 'lr': 0.000262277350427754, 'lambda_val': 0.00036714980791779657, 'batch_size': 1108, 'optimizer': 'Adam'}.
2026-06-22 20:21:16,029 - optuna.study.study - INFO - Trial 163 finished with values: [0.020471554418877783, 0.004498231653404067, 0.011528438809352734] and parameters: {'n_layers': 4, 'embedding_dim': 64, 'lr': 0.0001854947590635186, 'lambda_val': 0.0001583029704774821, 'batch_size': 2857, 'optimizer': 'Adam'}.
2026-06-22 20:22:55,191 - experiment_functions - INFO - Early stopping at epoch 2300. Best Metrics: (0.023443829451087594, 0.0050303145130731345, 0.013213782934553988)
2026-06-22 20:22:55,762 - optuna.study.study - INFO - Trial 164 finished with values: [0.023443829451087594, 0.0050303145130731345, 0.013213782934553988] and parameters: {'n_layers': 3, 'embedding_dim': 32, 'lr': 0.0005347670500185667, 'lambda_val': 0.0008491169466682814, 'batch_size': 3603, 'optimizer': 'RMSprop'}.
2026-06-22 20:23:57,574 - experiment_functions - INFO - Early stopping at epoch 1400. Best Metrics: (0.01463438066516662, 0.003108816470885437, 0.008019944148442638)
2026-06-22 20:23:57,670 - optuna.study.study - INFO - Trial 165 finished with values: [0.01463438066516662, 0.003108816470885437, 0.008019944148442638] and parameters: {'n_layers': 2, 'embedding_dim': 32, 'lr': 0.0024593680412654663, 'lambda_val': 3.330662577836562e-06, 'batch_size': 1126, 'optimizer': 'RMSprop'}.
2026-06-22 20:24:27,464 - experiment_functions - INFO - Early stopping at epoch 600. Best Metrics: (0.008696822602557613, 0.0019388657319691805, 0.005097133925621325)
2026-06-22 20:24:27,605 - optuna.study.study - INFO - Trial 166 finished with values: [0.008696822602557613, 0.0019388657319691805, 0.005097133925621325] and parameters: {'n_layers': 4, 'embedding_dim': 64, 'lr': 0.005120008125291094, 'lambda_val': 1.4802779457066453e-06, 'batch_size': 558, 'optimizer': 'Adam'}.
2026-06-22 20:25:11,082 - experiment_functions - INFO - Early stopping at epoch 950. Best Metrics: (0.022773826862158782, 0.004807692307692308, 0.012298964732603352)
2026-06-22 20:25:11,773 - optuna.study.study - INFO - Trial 167 finished with values: [0.022773826862158782, 0.004807692307692308, 0.012298964732603352] and parameters: {'n_layers': 2, 'embedding_dim': 64, 'lr': 0.001706237377982523, 'lambda_val': 3.330662577836562e-06, 'batch_size': 577, 'optimizer': 'Adam'}.
2026-06-22 20:26:09,043 - experiment_functions - INFO - Early stopping at epoch 1200. Best Metrics: (0.010893869535237962, 0.002395162308955412, 0.005852359301553518)
2026-06-22 20:26:10,135 - optuna.study.study - INFO - Trial 168 finished with values: [0.010893869535237962, 0.002395162308955412, 0.005852359301553518] and parameters: {'n_layers': 4, 'embedding_dim': 64, 'lr': 0.00045681378220125877, 'lambda_val': 0.02285639776450257, 'batch_size': 1126, 'optimizer': 'RMSprop'}.
2026-06-22 20:29:47,198 - optuna.study.study - INFO - Trial 169 finished with values: [0.02667051392646472, 0.005875015788808892, 0.015346298475322982] and parameters: {'n_layers': 2, 'embedding_dim': 256, 'lr': 0.0004235044324291316, 'lambda_val': 9.70067663508609e-05, 'batch_size': 558, 'optimizer': 'RMSprop'}.
2026-06-22 20:32:46,437 - optuna.study.study - INFO - Trial 170 finished with values: [0.01262112545681244, 0.0025972590627763043, 0.006944929699391834] and parameters: {'n_layers': 2, 'embedding_dim': 96, 'lr': 0.019747370316731114, 'lambda_val': 0.00036714980791779657, 'batch_size': 2977, 'optimizer': 'RMSprop'}.
2026-06-22 20:36:04,875 - optuna.study.study - INFO - Trial 171 finished with values: [0.02520656303689239, 0.005551345206517621, 0.014438193363064624] and parameters: {'n_layers': 4, 'embedding_dim': 96, 'lr': 0.0003610033899772668, 'lambda_val': 0.0006656875066949987, 'batch_size': 558, 'optimizer': 'Adam'}.
2026-06-22 20:38:56,462 - optuna.study.study - INFO - Trial 172 finished with values: [0.021094790225132054, 0.004730327144120248, 0.012547861780880094] and parameters: {'n_layers': 1, 'embedding_dim': 96, 'lr': 0.0004235044324291316, 'lambda_val': 5.455116561469672e-06, 'batch_size': 2714, 'optimizer': 'RMSprop'}.
2026-06-22 20:39:39,812 - experiment_functions - INFO - Early stopping at epoch 900. Best Metrics: (0.011190952854170273, 0.0024362132120752814, 0.006302855597096897)
2026-06-22 20:39:39,911 - optuna.study.study - INFO - Trial 173 finished with values: [0.011190952854170273, 0.0024362132120752814, 0.006302855597096897] and parameters: {'n_layers': 4, 'embedding_dim': 64, 'lr': 0.0021859830076465816, 'lambda_val': 7.332135787641361e-06, 'batch_size': 2159, 'optimizer': 'RMSprop'}.
2026-06-22 20:42:27,046 - optuna.study.study - INFO - Trial 174 finished with values: [0.000769429103613259, 0.0002131489200454718, 0.00046397024824442254] and parameters: {'n_layers': 4, 'embedding_dim': 32, 'lr': 8.527847993642572e-05, 'lambda_val': 0.00036714980791779657, 'batch_size': 760, 'optimizer': 'RMSprop'}.
2026-06-22 20:43:04,356 - experiment_functions - INFO - Early stopping at epoch 750. Best Metrics: (0.013349573122634862, 0.003100922066439308, 0.007257299129326875)
2026-06-22 20:43:04,459 - optuna.study.study - INFO - Trial 175 finished with values: [0.013349573122634862, 0.003100922066439308, 0.007257299129326875] and parameters: {'n_layers': 2, 'embedding_dim': 128, 'lr': 0.0013546074485213668, 'lambda_val': 0.03546156124706191, 'batch_size': 3584, 'optimizer': 'Adam'}.
2026-06-22 20:43:30,934 - experiment_functions - INFO - Early stopping at epoch 550. Best Metrics: (0.006344198380400305, 0.001409940634078565, 0.003608599654851472)
2026-06-22 20:43:31,040 - optuna.study.study - INFO - Trial 176 finished with values: [0.006344198380400305, 0.001409940634078565, 0.003608599654851472] and parameters: {'n_layers': 2, 'embedding_dim': 96, 'lr': 0.03277404265387728, 'lambda_val': 0.00036714980791779657, 'batch_size': 2159, 'optimizer': 'RMSprop'}.
2026-06-22 20:46:12,309 - optuna.study.study - INFO - Trial 177 finished with values: [0.013080570066247998, 0.0030930276619931794, 0.007787605117751292] and parameters: {'n_layers': 1, 'embedding_dim': 32, 'lr': 0.0004235044324291316, 'lambda_val': 3.330662577836562e-06, 'batch_size': 3280, 'optimizer': 'Adam'}.
2026-06-22 20:47:16,101 - experiment_functions - INFO - Early stopping at epoch 1350. Best Metrics: (0.019618837463701824, 0.004127194644436024, 0.011018314330766141)
2026-06-22 20:47:16,202 - optuna.study.study - INFO - Trial 178 finished with values: [0.019618837463701824, 0.004127194644436024, 0.011018314330766141] and parameters: {'n_layers': 4, 'embedding_dim': 64, 'lr': 0.00045681378220125877, 'lambda_val': 0.002013482105642368, 'batch_size': 3422, 'optimizer': 'Adam'}.
2026-06-22 20:47:46,348 - experiment_functions - INFO - Early stopping at epoch 550. Best Metrics: (0.008661677495695576, 0.0018125552608311232, 0.0045748196159949095)
2026-06-22 20:47:46,710 - optuna.study.study - INFO - Trial 179 finished with values: [0.008661677495695576, 0.0018125552608311232, 0.0045748196159949095] and parameters: {'n_layers': 4, 'embedding_dim': 96, 'lr': 0.005013267016448741, 'lambda_val': 0.00036714980791779657, 'batch_size': 2714, 'optimizer': 'RMSprop'}.
2026-06-22 20:48:33,201 - experiment_functions - INFO - Early stopping at epoch 1100. Best Metrics: (0.010615626469870201, 0.0022609574333712266, 0.0060220258355481)
2026-06-22 20:48:33,453 - optuna.study.study - INFO - Trial 180 finished with values: [0.010615626469870201, 0.0022609574333712266, 0.0060220258355481] and parameters: {'n_layers': 1, 'embedding_dim': 32, 'lr': 0.01131889341331997, 'lambda_val': 0.0008491169466682814, 'batch_size': 3663, 'optimizer': 'RMSprop'}.
2026-06-22 20:49:41,170 - experiment_functions - INFO - Early stopping at epoch 1450. Best Metrics: (0.014233394326128215, 0.003175129468232917, 0.007765552510303544)
2026-06-22 20:49:41,274 - optuna.study.study - INFO - Trial 181 finished with values: [0.014233394326128215, 0.003175129468232917, 0.007765552510303544] and parameters: {'n_layers': 4, 'embedding_dim': 64, 'lr': 0.0006129132477888526, 'lambda_val': 0.008507655043799656, 'batch_size': 528, 'optimizer': 'Adam'}.
2026-06-22 20:52:23,254 - optuna.study.study - INFO - Trial 182 finished with values: [0.02036420895767775, 0.0045724390551976765, 0.012100684606727747] and parameters: {'n_layers': 1, 'embedding_dim': 32, 'lr': 0.00045681378220125877, 'lambda_val': 0.0008491169466682814, 'batch_size': 3280, 'optimizer': 'RMSprop'}.
2026-06-22 20:54:44,350 - experiment_functions - INFO - Early stopping at epoch 3050. Best Metrics: (0.026456316142602226, 0.005601869394972843, 0.014795522591201758)
