2026-06-20 14:37:27,199 - optuna.study.study - INFO - Trial 221 finished with values: [0.0004918054125540127, 0.00011210054313502589, 0.000296081508953468] and parameters: {'n_layers': 3, 'embedding_dim': 96, 'lr': 0.0011886097569231713, 'lambda_val': 0.001526779508134114, 'batch_size': 1643, 'optimizer': 'SGD'}.
2026-06-20 14:39:58,988 - experiment_functions - INFO - Early stopping at epoch 3150. Best Metrics: (0.030508064124398715, 0.006359732221801187, 0.017624812412803417)
2026-06-20 14:39:59,110 - optuna.study.study - INFO - Trial 222 finished with values: [0.030508064124398715, 0.006359732221801187, 0.017624812412803417] and parameters: {'n_layers': 1, 'embedding_dim': 256, 'lr': 0.0015403750227822883, 'lambda_val': 4.703980448589771e-06, 'batch_size': 1731, 'optimizer': 'RMSprop'}.
2026-06-20 14:40:37,349 - experiment_functions - INFO - Early stopping at epoch 850. Best Metrics: (0.022031243528032336, 0.004555071365416193, 0.012636517337105581)
2026-06-20 14:40:37,438 - optuna.study.study - INFO - Trial 223 finished with values: [0.022031243528032336, 0.004555071365416193, 0.012636517337105581] and parameters: {'n_layers': 4, 'embedding_dim': 32, 'lr': 0.0015403750227822883, 'lambda_val': 2.4073778609387448e-06, 'batch_size': 2012, 'optimizer': 'Adam'}.
2026-06-20 14:41:21,498 - experiment_functions - INFO - Early stopping at epoch 1000. Best Metrics: (0.02284950806338408, 0.0047697991663508904, 0.013103698021100809)
2026-06-20 14:41:21,587 - optuna.study.study - INFO - Trial 224 finished with values: [0.02284950806338408, 0.0047697991663508904, 0.013103698021100809] and parameters: {'n_layers': 3, 'embedding_dim': 32, 'lr': 0.0015403750227822883, 'lambda_val': 3.2614324792273263e-06, 'batch_size': 1380, 'optimizer': 'Adam'}.
2026-06-20 14:42:17,870 - experiment_functions - INFO - Early stopping at epoch 950. Best Metrics: (0.016462070196379002, 0.0035098522167487686, 0.00913538081204849)
2026-06-20 14:42:17,955 - optuna.study.study - INFO - Trial 225 finished with values: [0.016462070196379002, 0.0035098522167487686, 0.00913538081204849] and parameters: {'n_layers': 3, 'embedding_dim': 256, 'lr': 0.0009798834021344095, 'lambda_val': 5.848323299602918e-05, 'batch_size': 2195, 'optimizer': 'RMSprop'}.
2026-06-20 14:45:03,469 - optuna.study.study - INFO - Trial 226 finished with values: [0.036241681843241676, 0.007378110395351776, 0.020472185927280444] and parameters: {'n_layers': 1, 'embedding_dim': 32, 'lr': 0.0015403750227822883, 'lambda_val': 2.3871418678853867e-05, 'batch_size': 2177, 'optimizer': 'Adam'}.
2026-06-20 14:47:49,808 - optuna.study.study - INFO - Trial 227 finished with values: [0.024890394536216037, 0.005390299355816597, 0.013789101694156447] and parameters: {'n_layers': 3, 'embedding_dim': 32, 'lr': 0.00040210644242369826, 'lambda_val': 2.3871418678853867e-05, 'batch_size': 1147, 'optimizer': 'Adam'}.
2026-06-20 14:50:47,091 - optuna.study.study - INFO - Trial 228 finished with values: [0.0277954449266783, 0.005856069218138184, 0.016363634326106866] and parameters: {'n_layers': 2, 'embedding_dim': 96, 'lr': 0.00040210644242369826, 'lambda_val': 3.04016799063885e-05, 'batch_size': 2177, 'optimizer': 'Adam'}.
2026-06-20 14:51:23,033 - experiment_functions - INFO - Early stopping at epoch 800. Best Metrics: (0.019294379047303648, 0.004133510167992927, 0.010441018922147775)
2026-06-20 14:51:23,412 - optuna.study.study - INFO - Trial 229 finished with values: [0.019294379047303648, 0.004133510167992927, 0.010441018922147775] and parameters: {'n_layers': 4, 'embedding_dim': 32, 'lr': 0.0015403750227822883, 'lambda_val': 2.3871418678853867e-05, 'batch_size': 2177, 'optimizer': 'Adam'}.
2026-06-20 14:54:11,564 - optuna.study.study - INFO - Trial 230 finished with values: [0.0249737467932036, 0.0052860932171277, 0.013757183855498848] and parameters: {'n_layers': 3, 'embedding_dim': 32, 'lr': 0.00040210644242369826, 'lambda_val': 0.0032201101504106306, 'batch_size': 2009, 'optimizer': 'Adam'}.
2026-06-20 14:54:51,542 - experiment_functions - INFO - Early stopping at epoch 800. Best Metrics: (0.014304409490745539, 0.0032019704433497538, 0.007643801001941111)
2026-06-20 14:54:51,634 - optuna.study.study - INFO - Trial 231 finished with values: [0.014304409490745539, 0.0032019704433497538, 0.007643801001941111] and parameters: {'n_layers': 3, 'embedding_dim': 128, 'lr': 0.001069957761278356, 'lambda_val': 0.009515544906263095, 'batch_size': 1287, 'optimizer': 'Adam'}.
2026-06-20 14:55:14,692 - experiment_functions - INFO - Early stopping at epoch 500. Best Metrics: (0.000558904183716242, 0.00011841606669192878, 0.0003058995820929287)
2026-06-20 14:55:14,782 - optuna.study.study - INFO - Trial 232 finished with values: [0.000558904183716242, 0.00011841606669192878, 0.0003058995820929287] and parameters: {'n_layers': 1, 'embedding_dim': 128, 'lr': 0.0003197162451785445, 'lambda_val': 2.3871418678853867e-05, 'batch_size': 1271, 'optimizer': 'SGD'}.
2026-06-20 14:56:30,896 - experiment_functions - INFO - Early stopping at epoch 1700. Best Metrics: (0.03162527182183742, 0.006602879878741947, 0.01817819732655457)
2026-06-20 14:56:30,974 - optuna.study.study - INFO - Trial 233 finished with values: [0.03162527182183742, 0.006602879878741947, 0.01817819732655457] and parameters: {'n_layers': 1, 'embedding_dim': 128, 'lr': 0.0015403750227822883, 'lambda_val': 3.0549894793457165e-06, 'batch_size': 2449, 'optimizer': 'Adam'}.
2026-06-20 14:57:10,818 - experiment_functions - INFO - Early stopping at epoch 850. Best Metrics: (0.027617517488658008, 0.005731337627889352, 0.01549568372020885)
2026-06-20 14:57:10,888 - optuna.study.study - INFO - Trial 234 finished with values: [0.027617517488658008, 0.005731337627889352, 0.01549568372020885] and parameters: {'n_layers': 2, 'embedding_dim': 96, 'lr': 0.0015403750227822883, 'lambda_val': 3.0549894793457165e-06, 'batch_size': 2226, 'optimizer': 'Adam'}.
2026-06-20 14:59:47,066 - optuna.study.study - INFO - Trial 235 finished with values: [0.000847777665123577, 0.00021472780093469748, 0.0005326376519493188] and parameters: {'n_layers': 1, 'embedding_dim': 32, 'lr': 0.00040210644242369826, 'lambda_val': 2.3871418678853867e-05, 'batch_size': 776, 'optimizer': 'Adam'}.
2026-06-20 15:02:35,306 - optuna.study.study - INFO - Trial 236 finished with values: [0.025487662844946593, 0.005368195023367437, 0.014533235171909223] and parameters: {'n_layers': 3, 'embedding_dim': 32, 'lr': 0.00046312276480803076, 'lambda_val': 4.766839408162229e-05, 'batch_size': 3287, 'optimizer': 'Adam'}.
2026-06-20 15:02:57,275 - experiment_functions - INFO - Early stopping at epoch 500. Best Metrics: (0.0006837814180068574, 0.00015157256536566882, 0.0003812040143723828)
2026-06-20 15:02:57,474 - optuna.study.study - INFO - Trial 237 finished with values: [0.0006837814180068574, 0.00015157256536566882, 0.0003812040143723828] and parameters: {'n_layers': 1, 'embedding_dim': 64, 'lr': 0.006719843485367568, 'lambda_val': 0.001526779508134114, 'batch_size': 1271, 'optimizer': 'SGD'}.
2026-06-20 15:03:23,165 - experiment_functions - INFO - Early stopping at epoch 550. Best Metrics: (0.015372830120150558, 0.0033598585322723255, 0.00848950488835861)
2026-06-20 15:03:23,254 - optuna.study.study - INFO - Trial 238 finished with values: [0.015372830120150558, 0.0033598585322723255, 0.00848950488835861] and parameters: {'n_layers': 1, 'embedding_dim': 128, 'lr': 0.016531666463439502, 'lambda_val': 0.0032201101504106306, 'batch_size': 2195, 'optimizer': 'Adam'}.
2026-06-20 15:05:09,405 - experiment_functions - INFO - Early stopping at epoch 2400. Best Metrics: (0.03307898602554655, 0.0068018188707843884, 0.0192167665371011)
2026-06-20 15:05:09,476 - optuna.study.study - INFO - Trial 239 finished with values: [0.03307898602554655, 0.0068018188707843884, 0.0192167665371011] and parameters: {'n_layers': 1, 'embedding_dim': 128, 'lr': 0.0015403750227822883, 'lambda_val': 4.703980448589771e-06, 'batch_size': 2177, 'optimizer': 'Adam'}.
2026-06-20 15:05:37,370 - experiment_functions - INFO - Early stopping at epoch 600. Best Metrics: (0.018540678655760368, 0.0038887836301629407, 0.010210732171972145)
2026-06-20 15:05:37,449 - optuna.study.study - INFO - Trial 240 finished with values: [0.018540678655760368, 0.0038887836301629407, 0.010210732171972145] and parameters: {'n_layers': 2, 'embedding_dim': 64, 'lr': 0.006719843485367568, 'lambda_val': 5.090598517742677e-05, 'batch_size': 2384, 'optimizer': 'Adam'}.
2026-06-20 15:05:58,930 - experiment_functions - INFO - Early stopping at epoch 500. Best Metrics: (0.00043278109545415096, 0.00011367942402425163, 0.0002547588921810937)
2026-06-20 15:05:59,064 - optuna.study.study - INFO - Trial 241 finished with values: [0.00043278109545415096, 0.00011367942402425163, 0.0002547588921810937] and parameters: {'n_layers': 1, 'embedding_dim': 32, 'lr': 0.006719843485367568, 'lambda_val': 5.090598517742677e-05, 'batch_size': 2195, 'optimizer': 'SGD'}.
2026-06-20 15:06:46,764 - experiment_functions - INFO - Early stopping at epoch 800. Best Metrics: (0.01666007321297745, 0.003571428571428572, 0.009231516311788182)
2026-06-20 15:06:46,862 - optuna.study.study - INFO - Trial 242 finished with values: [0.01666007321297745, 0.003571428571428572, 0.009231516311788182] and parameters: {'n_layers': 3, 'embedding_dim': 256, 'lr': 0.0015403750227822883, 'lambda_val': 0.00013603043494972295, 'batch_size': 1271, 'optimizer': 'Adam'}.
2026-06-20 15:07:43,314 - experiment_functions - INFO - Early stopping at epoch 1350. Best Metrics: (0.028410816242743695, 0.0061465833017557165, 0.016251793258644145)
2026-06-20 15:07:43,388 - optuna.study.study - INFO - Trial 243 finished with values: [0.028410816242743695, 0.0061465833017557165, 0.016251793258644145] and parameters: {'n_layers': 1, 'embedding_dim': 32, 'lr': 0.0015403750227822883, 'lambda_val': 0.0055002522952676365, 'batch_size': 2606, 'optimizer': 'Adam'}.
2026-06-20 15:08:13,785 - experiment_functions - INFO - Early stopping at epoch 650. Best Metrics: (0.010639079752726585, 0.002218327649362132, 0.006088902639755452)
2026-06-20 15:08:13,871 - optuna.study.study - INFO - Trial 244 finished with values: [0.010639079752726585, 0.002218327649362132, 0.006088902639755452] and parameters: {'n_layers': 3, 'embedding_dim': 64, 'lr': 0.006719843485367568, 'lambda_val': 3.0549894793457165e-06, 'batch_size': 2177, 'optimizer': 'RMSprop'}.
2026-06-20 15:08:54,896 - experiment_functions - INFO - Early stopping at epoch 950. Best Metrics: (0.025390988763915427, 0.005488189970948592, 0.014884755283216174)
2026-06-20 15:08:54,979 - optuna.study.study - INFO - Trial 245 finished with values: [0.025390988763915427, 0.005488189970948592, 0.014884755283216174] and parameters: {'n_layers': 2, 'embedding_dim': 32, 'lr': 0.0012029727538128135, 'lambda_val': 0.0014313382121311877, 'batch_size': 3266, 'optimizer': 'Adam'}.
2026-06-20 15:09:34,880 - experiment_functions - INFO - Early stopping at epoch 750. Best Metrics: (0.020299193328247218, 0.004285082733358596, 0.011589270250510016)
2026-06-20 15:09:34,949 - optuna.study.study - INFO - Trial 246 finished with values: [0.020299193328247218, 0.004285082733358596, 0.011589270250510016] and parameters: {'n_layers': 4, 'embedding_dim': 128, 'lr': 0.0009942243415015796, 'lambda_val': 4.703980448589771e-06, 'batch_size': 3025, 'optimizer': 'Adam'}.
2026-06-20 15:10:11,308 - experiment_functions - INFO - Early stopping at epoch 750. Best Metrics: (0.02428543881806739, 0.005235569028672477, 0.013805208768499094)
2026-06-20 15:10:11,391 - optuna.study.study - INFO - Trial 247 finished with values: [0.02428543881806739, 0.005235569028672477, 0.013805208768499094] and parameters: {'n_layers': 2, 'embedding_dim': 128, 'lr': 0.0015403750227822883, 'lambda_val': 0.0025257501120737125, 'batch_size': 2177, 'optimizer': 'Adam'}.
2026-06-20 15:11:01,810 - experiment_functions - INFO - Early stopping at epoch 1150. Best Metrics: (0.02943287037064809, 0.006045534924845269, 0.016432190840225323)
2026-06-20 15:11:01,891 - optuna.study.study - INFO - Trial 248 finished with values: [0.02943287037064809, 0.006045534924845269, 0.016432190840225323] and parameters: {'n_layers': 2, 'embedding_dim': 64, 'lr': 0.0015403750227822883, 'lambda_val': 3.2070608037981736e-05, 'batch_size': 1287, 'optimizer': 'Adam'}.
2026-06-20 15:13:39,820 - optuna.study.study - INFO - Trial 249 finished with values: [0.012952975701292255, 0.0030993431855500823, 0.007918803537013965] and parameters: {'n_layers': 1, 'embedding_dim': 32, 'lr': 0.0005346257481211814, 'lambda_val': 2.3871418678853867e-05, 'batch_size': 2177, 'optimizer': 'Adam'}.
2026-06-20 15:16:23,431 - optuna.study.study - INFO - Trial 250 finished with values: [0.032611090985325754, 0.00678287230011368, 0.0183075521229335] and parameters: {'n_layers': 1, 'embedding_dim': 32, 'lr': 0.0013536067835738764, 'lambda_val': 4.703980448589771e-06, 'batch_size': 2203, 'optimizer': 'Adam'}.
2026-06-20 15:19:02,356 - experiment_functions - INFO - Early stopping at epoch 3800. Best Metrics: (0.02443607620390223, 0.005270304408235443, 0.01340971074227136)
2026-06-20 15:19:02,422 - optuna.study.study - INFO - Trial 251 finished with values: [0.02443607620390223, 0.005270304408235443, 0.01340971074227136] and parameters: {'n_layers': 3, 'embedding_dim': 32, 'lr': 0.00040210644242369826, 'lambda_val': 0.0032201101504106306, 'batch_size': 2009, 'optimizer': 'Adam'}.
2026-06-20 15:19:51,409 - experiment_functions - INFO - Early stopping at epoch 1100. Best Metrics: (0.027933153604601677, 0.005859226979916634, 0.016080274863853994)
2026-06-20 15:19:51,507 - optuna.study.study - INFO - Trial 252 finished with values: [0.027933153604601677, 0.005859226979916634, 0.016080274863853994] and parameters: {'n_layers': 2, 'embedding_dim': 64, 'lr': 0.0015403750227822883, 'lambda_val': 0.00040809351692507045, 'batch_size': 1399, 'optimizer': 'Adam'}.
2026-06-20 15:22:47,867 - optuna.study.study - INFO - Trial 253 finished with values: [0.028179195781430418, 0.0058876468359227, 0.0159060371041665] and parameters: {'n_layers': 3, 'embedding_dim': 64, 'lr': 0.00040210644242369826, 'lambda_val': 3.3170658569105865e-06, 'batch_size': 2177, 'optimizer': 'Adam'}.
2026-06-20 15:25:59,595 - optuna.study.study - INFO - Trial 254 finished with values: [0.02007167297498591, 0.0044524441076165214, 0.011576877146492713] and parameters: {'n_layers': 3, 'embedding_dim': 128, 'lr': 0.00023729211693529712, 'lambda_val': 4.703980448589771e-06, 'batch_size': 1038, 'optimizer': 'RMSprop'}.
2026-06-20 15:26:32,630 - experiment_functions - INFO - Early stopping at epoch 700. Best Metrics: (0.02071960741586264, 0.004487179487179487, 0.011954433312152964)
2026-06-20 15:26:32,699 - optuna.study.study - INFO - Trial 255 finished with values: [0.02071960741586264, 0.004487179487179487, 0.011954433312152964] and parameters: {'n_layers': 3, 'embedding_dim': 64, 'lr': 0.0015403750227822883, 'lambda_val': 0.0004242504250406823, 'batch_size': 4009, 'optimizer': 'Adam'}.
2026-06-20 15:28:39,646 - experiment_functions - INFO - Early stopping at epoch 2250. Best Metrics: (0.0032661007022492575, 0.0007768093974990527, 0.0018441750804685378)
2026-06-20 15:28:39,720 - optuna.study.study - INFO - Trial 256 finished with values: [0.0032661007022492575, 0.0007768093974990527, 0.0018441750804685378] and parameters: {'n_layers': 3, 'embedding_dim': 256, 'lr': 0.0012029727538128135, 'lambda_val': 0.07464518690239721, 'batch_size': 2012, 'optimizer': 'RMSprop'}.
2026-06-20 15:29:18,608 - experiment_functions - INFO - Early stopping at epoch 800. Best Metrics: (0.026576559058785306, 0.0055687128962991035, 0.014994182615316844)
2026-06-20 15:29:18,705 - optuna.study.study - INFO - Trial 257 finished with values: [0.026576559058785306, 0.0055687128962991035, 0.014994182615316844] and parameters: {'n_layers': 2, 'embedding_dim': 128, 'lr': 0.0015403750227822883, 'lambda_val': 3.0549894793457165e-06, 'batch_size': 2449, 'optimizer': 'Adam'}.
2026-06-20 15:30:06,957 - experiment_functions - INFO - Early stopping at epoch 1100. Best Metrics: (0.0006310205044855131, 0.0001484148035872174, 0.00037631488709293463)
2026-06-20 15:30:07,022 - optuna.study.study - INFO - Trial 258 finished with values: [0.0006310205044855131, 0.0001484148035872174, 0.00037631488709293463] and parameters: {'n_layers': 1, 'embedding_dim': 128, 'lr': 3.346099297078502e-05, 'lambda_val': 0.0009458606779624415, 'batch_size': 2177, 'optimizer': 'Adam'}.
2026-06-20 15:30:56,852 - experiment_functions - INFO - Early stopping at epoch 1100. Best Metrics: (0.029602747582456203, 0.006208159656435519, 0.017219703493175646)
2026-06-20 15:30:56,943 - optuna.study.study - INFO - Trial 259 finished with values: [0.029602747582456203, 0.006208159656435519, 0.017219703493175646] and parameters: {'n_layers': 1, 'embedding_dim': 128, 'lr': 0.0015403750227822883, 'lambda_val': 3.0549894793457165e-06, 'batch_size': 2449, 'optimizer': 'RMSprop'}.
2026-06-20 15:31:29,529 - experiment_functions - INFO - Early stopping at epoch 700. Best Metrics: (0.018468478293772798, 0.003983516483516484, 0.010294155744722092)
2026-06-20 15:31:29,604 - optuna.study.study - INFO - Trial 260 finished with values: [0.018468478293772798, 0.003983516483516484, 0.010294155744722092] and parameters: {'n_layers': 3, 'embedding_dim': 64, 'lr': 0.0015403750227822883, 'lambda_val': 0.0055002522952676365, 'batch_size': 2606, 'optimizer': 'Adam'}.
2026-06-20 15:34:13,456 - optuna.study.study - INFO - Trial 261 finished with values: [0.03269506290240272, 0.006871289629910319, 0.0188992527175489] and parameters: {'n_layers': 1, 'embedding_dim': 32, 'lr': 0.0015403750227822883, 'lambda_val': 1.011796455131184e-06, 'batch_size': 2009, 'optimizer': 'RMSprop'}.
2026-06-20 15:34:59,480 - experiment_functions - INFO - Early stopping at epoch 1000. Best Metrics: (0.025298455569736634, 0.00541871921182266, 0.014496924967333527)
2026-06-20 15:34:59,551 - optuna.study.study - INFO - Trial 262 finished with values: [0.025298455569736634, 0.00541871921182266, 0.014496924967333527] and parameters: {'n_layers': 2, 'embedding_dim': 96, 'lr': 0.0009942243415015796, 'lambda_val': 0.0038948567969210083, 'batch_size': 1643, 'optimizer': 'Adam'}.
2026-06-20 15:35:27,892 - experiment_functions - INFO - Early stopping at epoch 550. Best Metrics: (0.007767111036351264, 0.001610458507010231, 0.004166815322101516)
2026-06-20 15:35:27,977 - optuna.study.study - INFO - Trial 263 finished with values: [0.007767111036351264, 0.001610458507010231, 0.004166815322101516] and parameters: {'n_layers': 3, 'embedding_dim': 128, 'lr': 0.024718244813976054, 'lambda_val': 3.6991183625485248e-06, 'batch_size': 2974, 'optimizer': 'Adam'}.
2026-06-20 15:37:19,844 - experiment_functions - INFO - Early stopping at epoch 2650. Best Metrics: (0.033669878689594056, 0.0068618163445749655, 0.01902095332902768)
2026-06-20 15:37:19,927 - optuna.study.study - INFO - Trial 264 finished with values: [0.033669878689594056, 0.0068618163445749655, 0.01902095332902768] and parameters: {'n_layers': 1, 'embedding_dim': 64, 'lr': 0.0015403750227822883, 'lambda_val': 2.4073778609387448e-06, 'batch_size': 2614, 'optimizer': 'Adam'}.
2026-06-20 15:38:04,042 - experiment_functions - INFO - Early stopping at epoch 800. Best Metrics: (0.025869017122905607, 0.00552924087406846, 0.014705479992600485)
2026-06-20 15:38:04,110 - optuna.study.study - INFO - Trial 265 finished with values: [0.025869017122905607, 0.00552924087406846, 0.014705479992600485] and parameters: {'n_layers': 2, 'embedding_dim': 256, 'lr': 0.0015403750227822883, 'lambda_val': 2.085376662769769e-05, 'batch_size': 2177, 'optimizer': 'Adam'}.
2026-06-20 15:39:10,035 - experiment_functions - INFO - Early stopping at epoch 1500. Best Metrics: (0.029278752198883703, 0.006029746115953013, 0.0166620880970561)
2026-06-20 15:39:10,111 - optuna.study.study - INFO - Trial 266 finished with values: [0.029278752198883703, 0.006029746115953013, 0.0166620880970561] and parameters: {'n_layers': 2, 'embedding_dim': 64, 'lr': 0.0012029727538128135, 'lambda_val': 5.848323299602918e-05, 'batch_size': 1271, 'optimizer': 'Adam'}.
2026-06-20 15:39:53,335 - experiment_functions - INFO - Early stopping at epoch 950. Best Metrics: (0.018881686061420783, 0.0040182518630794495, 0.010894388536944317)
2026-06-20 15:39:53,464 - optuna.study.study - INFO - Trial 267 finished with values: [0.018881686061420783, 0.0040182518630794495, 0.010894388536944317] and parameters: {'n_layers': 2, 'embedding_dim': 96, 'lr': 0.0015403750227822883, 'lambda_val': 3.04016799063885e-05, 'batch_size': 2177, 'optimizer': 'RMSprop'}.
2026-06-20 15:40:33,015 - experiment_functions - INFO - Early stopping at epoch 850. Best Metrics: (0.02837269504005708, 0.005852911456359732, 0.01638586510661449)
2026-06-20 15:40:33,091 - optuna.study.study - INFO - Trial 268 finished with values: [0.02837269504005708, 0.005852911456359732, 0.01638586510661449] and parameters: {'n_layers': 2, 'embedding_dim': 96, 'lr': 0.0013536067835738764, 'lambda_val': 4.703980448589771e-06, 'batch_size': 4010, 'optimizer': 'Adam'}.
2026-06-20 15:43:19,651 - optuna.study.study - INFO - Trial 269 finished with values: [0.003590227851019241, 0.0009062776304155616, 0.0022549990795248465] and parameters: {'n_layers': 1, 'embedding_dim': 128, 'lr': 0.00040210644242369826, 'lambda_val': 4.703980448589771e-06, 'batch_size': 1643, 'optimizer': 'Adam'}.
2026-06-20 15:44:01,748 - experiment_functions - INFO - Early stopping at epoch 950. Best Metrics: (0.023765434587229527, 0.0050303145130731345, 0.013682873475354844)
