2026-06-17 04:47:49,181 - optuna.study.study - INFO - Trial 291 finished with values: [0.011423613829672302, 0.002379373500063155, 0.006621537899299857] and parameters: {'n_layers': 2, 'embedding_dim': 32, 'lr': 0.011485594305176742, 'lambda_val': 3.2707990474449004e-05, 'batch_size': 3052, 'optimizer': 'RMSprop'}.
2026-06-17 04:48:17,448 - experiment_functions - INFO - Early stopping at epoch 600. Best Metrics: (0.01985052624150635, 0.004275609448023241, 0.011768061688812548)
2026-06-17 04:48:17,589 - optuna.study.study - INFO - Trial 292 finished with values: [0.01985052624150635, 0.004275609448023241, 0.011768061688812548] and parameters: {'n_layers': 1, 'embedding_dim': 64, 'lr': 0.00847867700787837, 'lambda_val': 1.0697648887853802e-06, 'batch_size': 617, 'optimizer': 'RMSprop'}.
2026-06-17 04:48:44,679 - experiment_functions - INFO - Early stopping at epoch 600. Best Metrics: (0.003940047363744904, 0.0009662751042061388, 0.0023844566232128733)
2026-06-17 04:48:44,775 - optuna.study.study - INFO - Trial 293 finished with values: [0.003940047363744904, 0.0009662751042061388, 0.0023844566232128733] and parameters: {'n_layers': 1, 'embedding_dim': 32, 'lr': 0.09454936496251556, 'lambda_val': 1.0697648887853802e-06, 'batch_size': 2369, 'optimizer': 'RMSprop'}.
2026-06-17 04:50:38,720 - experiment_functions - INFO - Early stopping at epoch 2450. Best Metrics: (0.03003360483755812, 0.006639194139194139, 0.017125848773971657)
2026-06-17 04:50:38,791 - optuna.study.study - INFO - Trial 294 finished with values: [0.03003360483755812, 0.006639194139194139, 0.017125848773971657] and parameters: {'n_layers': 2, 'embedding_dim': 32, 'lr': 0.0007178694642074494, 'lambda_val': 1.0697648887853802e-06, 'batch_size': 2369, 'optimizer': 'Adam'}.
2026-06-17 04:54:45,931 - optuna.study.study - INFO - Trial 295 finished with values: [0.0019682318657759028, 0.0004894530756599723, 0.001106337007369971] and parameters: {'n_layers': 2, 'embedding_dim': 256, 'lr': 0.00010669587758012473, 'lambda_val': 4.452669285059839e-06, 'batch_size': 3992, 'optimizer': 'Adam'}.
2026-06-17 04:58:33,602 - optuna.study.study - INFO - Trial 296 finished with values: [0.02219233511396426, 0.004956107111279525, 0.01257317972590013] and parameters: {'n_layers': 4, 'embedding_dim': 96, 'lr': 0.00019423405222093108, 'lambda_val': 1.3976665248992833e-06, 'batch_size': 3920, 'optimizer': 'RMSprop'}.
2026-06-17 05:02:00,930 - optuna.study.study - INFO - Trial 297 finished with values: [0.014250230427269476, 0.003058292282430213, 0.007999410358734162] and parameters: {'n_layers': 2, 'embedding_dim': 128, 'lr': 0.005617658731975303, 'lambda_val': 1.0697648887853802e-06, 'batch_size': 2889, 'optimizer': 'RMSprop'}.
2026-06-17 05:02:32,588 - experiment_functions - INFO - Early stopping at epoch 700. Best Metrics: (0.02821061842063678, 0.006257104964001517, 0.016246016720946166)
2026-06-17 05:02:32,664 - optuna.study.study - INFO - Trial 298 finished with values: [0.02821061842063678, 0.006257104964001517, 0.016246016720946166] and parameters: {'n_layers': 1, 'embedding_dim': 32, 'lr': 0.0017542874983550202, 'lambda_val': 0.006991056849746283, 'batch_size': 3992, 'optimizer': 'RMSprop'}.
2026-06-17 05:03:46,463 - experiment_functions - INFO - Early stopping at epoch 1500. Best Metrics: (0.033307357237205334, 0.007183908045977011, 0.019604515778237398)
2026-06-17 05:03:46,535 - optuna.study.study - INFO - Trial 299 finished with values: [0.033307357237205334, 0.007183908045977011, 0.019604515778237398] and parameters: {'n_layers': 1, 'embedding_dim': 128, 'lr': 0.0017542874983550202, 'lambda_val': 4.546254137443526e-06, 'batch_size': 1627, 'optimizer': 'Adam'}.
2026-06-17 05:03:46,550 - root - INFO - Selected Trial 246 based on Max ndcg: 0.0218
2026-06-17 05:03:46,550 - root - INFO - Associated Recall: 0.0368
2026-06-17 05:03:46,550 - experiment_functions - INFO - Training the best model ... for e_yelp_full
2026-06-17 05:07:03,082 - root - INFO - **** Training e_yelp_1c1dcs
2026-06-17 05:07:03,082 - root - INFO -   ** 1-Dominant stats:
2026-06-17 05:07:03,082 - root - INFO -   ** Finding the dominant set:
2026-06-17 06:39:51,771 - root - INFO -   ** Getting the trainable edges:
2026-06-17 06:39:52,397 - helper_functions - INFO -      Number of nodes: 2879
2026-06-17 06:39:52,397 - helper_functions - INFO -      Ratio: 0.04129611566928682
2026-06-17 06:39:52,397 - helper_functions - INFO -      Number of unique users: 1839
2026-06-17 06:39:52,397 - helper_functions - INFO -      Number of unique items: 1040
2026-06-17 06:39:52,397 - helper_functions - INFO -      Total dominant set edge: 42911
2026-06-17 06:39:52,397 - helper_functions - INFO -      Trainable edges: 34328.8
2026-06-17 06:39:52,503 - root - INFO -   **** Getting 42911 dominant set edges
2026-06-17 06:39:53,061 - optuna.storages._rdb.storage - INFO - A new study created in RDB with name: Study_e_yelp_1c1dcs_strict
2026-06-17 06:40:16,626 - experiment_functions - INFO - Early stopping at epoch 500. Best Metrics: (0.00044234379521461854, 8.841732979664016e-05, 0.0002462783343341642)
2026-06-17 06:40:17,700 - optuna.study.study - INFO - Trial 0 finished with values: [0.00044234379521461854, 8.841732979664016e-05, 0.0002462783343341642] and parameters: {'n_layers': 4, 'embedding_dim': 96, 'lr': 0.02606419943379929, 'lambda_val': 0.002749828613250348, 'batch_size': 3222, 'optimizer': 'SGD'}.
2026-06-17 06:40:46,739 - experiment_functions - INFO - Early stopping at epoch 600. Best Metrics: (0.002810997948733517, 0.0012536314260452193, 0.0020897695802112944)
2026-06-17 06:40:46,822 - optuna.study.study - INFO - Trial 1 finished with values: [0.002810997948733517, 0.0012536314260452193, 0.0020897695802112944] and parameters: {'n_layers': 1, 'embedding_dim': 256, 'lr': 0.0011453432792901683, 'lambda_val': 0.0008240497651178975, 'batch_size': 2572, 'optimizer': 'RMSprop'}.
2026-06-17 06:41:10,866 - experiment_functions - INFO - Early stopping at epoch 500. Best Metrics: (0.0005937318081717244, 0.0001310471138057345, 0.00032653022773196415)
2026-06-17 06:41:11,027 - optuna.study.study - INFO - Trial 2 finished with values: [0.0005937318081717244, 0.0001310471138057345, 0.00032653022773196415] and parameters: {'n_layers': 2, 'embedding_dim': 128, 'lr': 1.0492334740168683e-05, 'lambda_val': 0.024318534022299595, 'batch_size': 2678, 'optimizer': 'RMSprop'}.
2026-06-17 06:44:29,850 - optuna.study.study - INFO - Trial 3 finished with values: [0.0012857981569442168, 0.0006362889983579638, 0.0009709499565683096] and parameters: {'n_layers': 4, 'embedding_dim': 256, 'lr': 3.884239453244709e-05, 'lambda_val': 1.5388349045557698e-06, 'batch_size': 1281, 'optimizer': 'RMSprop'}.
2026-06-17 06:45:02,741 - experiment_functions - INFO - Early stopping at epoch 650. Best Metrics: (0.0025580874177474097, 0.001144688644688645, 0.001930170273385249)
2026-06-17 06:45:02,842 - optuna.study.study - INFO - Trial 4 finished with values: [0.0025580874177474097, 0.001144688644688645, 0.001930170273385249] and parameters: {'n_layers': 3, 'embedding_dim': 256, 'lr': 0.0010209094744396852, 'lambda_val': 1.561244993279661e-06, 'batch_size': 1098, 'optimizer': 'Adam'}.
2026-06-17 06:47:25,131 - experiment_functions - INFO - Early stopping at epoch 3500. Best Metrics: (0.0005169552244729939, 0.00014367816091954025, 0.00030475855481015796)
2026-06-17 06:47:25,213 - optuna.study.study - INFO - Trial 5 finished with values: [0.0005169552244729939, 0.00014367816091954025, 0.00030475855481015796] and parameters: {'n_layers': 1, 'embedding_dim': 96, 'lr': 2.6441628639530446e-05, 'lambda_val': 0.002381711703565931, 'batch_size': 3488, 'optimizer': 'Adam'}.
2026-06-17 06:47:53,197 - experiment_functions - INFO - Early stopping at epoch 500. Best Metrics: (0.0026328201763700485, 0.0011367942402425162, 0.0019358634427442622)
2026-06-17 06:47:53,298 - optuna.study.study - INFO - Trial 6 finished with values: [0.0026328201763700485, 0.0011367942402425162, 0.0019358634427442622] and parameters: {'n_layers': 4, 'embedding_dim': 256, 'lr': 0.018609506171202397, 'lambda_val': 0.0015700686256870026, 'batch_size': 1833, 'optimizer': 'RMSprop'}.
2026-06-17 06:48:15,416 - experiment_functions - INFO - Early stopping at epoch 500. Best Metrics: (0.0004798160500665706, 0.00011052166224580017, 0.00023751722991806752)
2026-06-17 06:48:15,474 - optuna.study.study - INFO - Trial 7 finished with values: [0.0004798160500665706, 0.00011052166224580017, 0.00023751722991806752] and parameters: {'n_layers': 3, 'embedding_dim': 32, 'lr': 4.396978413311433e-05, 'lambda_val': 0.017308558905600645, 'batch_size': 1801, 'optimizer': 'SGD'}.
2026-06-17 06:48:38,402 - experiment_functions - INFO - Early stopping at epoch 500. Best Metrics: (0.0005608046973374489, 0.00012788935202728306, 0.0003088175617933866)
2026-06-17 06:48:38,893 - optuna.study.study - INFO - Trial 8 finished with values: [0.0005608046973374489, 0.00012788935202728306, 0.0003088175617933866] and parameters: {'n_layers': 4, 'embedding_dim': 96, 'lr': 3.198628770118475e-05, 'lambda_val': 0.0005715406990614345, 'batch_size': 1523, 'optimizer': 'SGD'}.
2026-06-17 06:49:55,331 - experiment_functions - INFO - Early stopping at epoch 1850. Best Metrics: (0.003999399679979852, 0.0013009978527219908, 0.002459568084475907)
2026-06-17 06:49:55,430 - optuna.study.study - INFO - Trial 9 finished with values: [0.003999399679979852, 0.0013009978527219908, 0.002459568084475907] and parameters: {'n_layers': 1, 'embedding_dim': 64, 'lr': 0.024484365885130848, 'lambda_val': 6.872101199763191e-06, 'batch_size': 2433, 'optimizer': 'RMSprop'}.
2026-06-17 06:50:17,343 - experiment_functions - INFO - Early stopping at epoch 500. Best Metrics: (0.00044990119329521046, 0.00011052166224580018, 0.000251557221699887)
2026-06-17 06:50:17,435 - optuna.study.study - INFO - Trial 10 finished with values: [0.00044990119329521046, 0.00011052166224580018, 0.000251557221699887] and parameters: {'n_layers': 4, 'embedding_dim': 32, 'lr': 2.8821831936113397e-05, 'lambda_val': 0.006880503853550419, 'batch_size': 3330, 'optimizer': 'SGD'}.
2026-06-17 06:50:39,153 - experiment_functions - INFO - Early stopping at epoch 500. Best Metrics: (0.0005804678577698796, 0.00011683718580270305, 0.0003174060734468455)
2026-06-17 06:50:39,340 - optuna.study.study - INFO - Trial 11 finished with values: [0.0005804678577698796, 0.00011683718580270305, 0.0003174060734468455] and parameters: {'n_layers': 2, 'embedding_dim': 64, 'lr': 0.007518934608857479, 'lambda_val': 0.0002905579912682925, 'batch_size': 3174, 'optimizer': 'SGD'}.
2026-06-17 06:51:05,865 - experiment_functions - INFO - Early stopping at epoch 550. Best Metrics: (0.002645220314746124, 0.0009078565113047872, 0.0016498416191053431)
2026-06-17 06:51:05,931 - optuna.study.study - INFO - Trial 12 finished with values: [0.002645220314746124, 0.0009078565113047872, 0.0016498416191053431] and parameters: {'n_layers': 4, 'embedding_dim': 96, 'lr': 0.004595237871810009, 'lambda_val': 3.567347607875195e-06, 'batch_size': 3433, 'optimizer': 'RMSprop'}.
2026-06-17 06:51:31,685 - experiment_functions - INFO - Early stopping at epoch 500. Best Metrics: (0.0005218909463444645, 0.00011367942402425162, 0.0002802347735252303)
2026-06-17 06:51:31,750 - optuna.study.study - INFO - Trial 13 finished with values: [0.0005218909463444645, 0.00011367942402425162, 0.0002802347735252303] and parameters: {'n_layers': 3, 'embedding_dim': 256, 'lr': 0.0019791454040792144, 'lambda_val': 3.125135396462488e-05, 'batch_size': 3256, 'optimizer': 'SGD'}.
2026-06-17 06:51:53,680 - experiment_functions - INFO - Early stopping at epoch 500. Best Metrics: (0.0022481862503869973, 0.000819439181508147, 0.0014792828302198965)
2026-06-17 06:51:53,748 - optuna.study.study - INFO - Trial 14 finished with values: [0.0022481862503869973, 0.000819439181508147, 0.0014792828302198965] and parameters: {'n_layers': 3, 'embedding_dim': 32, 'lr': 0.060034049813311924, 'lambda_val': 0.0005661492200921561, 'batch_size': 1757, 'optimizer': 'RMSprop'}.
2026-06-17 06:52:33,162 - experiment_functions - INFO - Early stopping at epoch 900. Best Metrics: (0.0038753817126252242, 0.0010467980295566501, 0.002253313507258972)
2026-06-17 06:52:33,496 - optuna.study.study - INFO - Trial 15 finished with values: [0.0038753817126252242, 0.0010467980295566501, 0.002253313507258972] and parameters: {'n_layers': 2, 'embedding_dim': 128, 'lr': 0.046129598836200957, 'lambda_val': 5.2927329941475195e-06, 'batch_size': 1310, 'optimizer': 'RMSprop'}.
2026-06-17 06:52:57,045 - experiment_functions - INFO - Early stopping at epoch 500. Best Metrics: (0.0005255585381445537, 0.00013262599469496023, 0.0002910805378706772)
2026-06-17 06:52:57,128 - optuna.study.study - INFO - Trial 16 finished with values: [0.0005255585381445537, 0.00013262599469496023, 0.0002910805378706772] and parameters: {'n_layers': 1, 'embedding_dim': 128, 'lr': 0.000902906720490206, 'lambda_val': 1.8217344752413244e-05, 'batch_size': 2923, 'optimizer': 'SGD'}.
2026-06-17 06:53:19,988 - experiment_functions - INFO - Early stopping at epoch 500. Best Metrics: (0.0005303129657884034, 0.0001136794240242516, 0.00029636403716457927)
2026-06-17 06:53:20,070 - optuna.study.study - INFO - Trial 17 finished with values: [0.0005303129657884034, 0.0001136794240242516, 0.00029636403716457927] and parameters: {'n_layers': 2, 'embedding_dim': 128, 'lr': 0.012129572694158649, 'lambda_val': 0.001719636320277082, 'batch_size': 3354, 'optimizer': 'SGD'}.
2026-06-17 06:53:47,443 - experiment_functions - INFO - Early stopping at epoch 600. Best Metrics: (0.002846905660638041, 0.0010341669824428445, 0.0019085517915043285)
2026-06-17 06:53:47,537 - optuna.study.study - INFO - Trial 18 finished with values: [0.002846905660638041, 0.0010341669824428445, 0.0019085517915043285] and parameters: {'n_layers': 3, 'embedding_dim': 96, 'lr': 0.05952275944427514, 'lambda_val': 1.0814529836883802e-06, 'batch_size': 1599, 'optimizer': 'Adam'}.
2026-06-17 06:56:25,297 - optuna.study.study - INFO - Trial 19 finished with values: [0.0008725910953694513, 0.0001973601111532146, 0.0004996897242477684] and parameters: {'n_layers': 1, 'embedding_dim': 32, 'lr': 6.997232916900755e-05, 'lambda_val': 2.6247777388082558e-05, 'batch_size': 1313, 'optimizer': 'RMSprop'}.
2026-06-17 06:57:16,320 - experiment_functions - INFO - Early stopping at epoch 1000. Best Metrics: (0.0018441817223473346, 0.0009252242010862702, 0.0014037002433829342)
2026-06-17 06:57:16,396 - optuna.study.study - INFO - Trial 20 finished with values: [0.0018441817223473346, 0.0009252242010862702, 0.0014037002433829342] and parameters: {'n_layers': 4, 'embedding_dim': 256, 'lr': 0.0002359819177604671, 'lambda_val': 0.013062814988496372, 'batch_size': 1749, 'optimizer': 'Adam'}.
2026-06-17 07:00:03,462 - optuna.study.study - INFO - Trial 21 finished with values: [0.0026947113105259338, 0.0010625868384489077, 0.0018603380382458162] and parameters: {'n_layers': 4, 'embedding_dim': 32, 'lr': 0.00011602231624540558, 'lambda_val': 5.275876201545245e-06, 'batch_size': 1255, 'optimizer': 'Adam'}.
2026-06-17 07:00:27,147 - experiment_functions - INFO - Early stopping at epoch 500. Best Metrics: (0.0004896887563018327, 0.00011683718580270305, 0.0002646001868157278)
2026-06-17 07:00:27,229 - optuna.study.study - INFO - Trial 22 finished with values: [0.0004896887563018327, 0.00011683718580270305, 0.0002646001868157278] and parameters: {'n_layers': 2, 'embedding_dim': 128, 'lr': 2.416247753411609e-05, 'lambda_val': 6.978722172638859e-06, 'batch_size': 895, 'optimizer': 'SGD'}.
2026-06-17 07:00:54,338 - experiment_functions - INFO - Early stopping at epoch 600. Best Metrics: (0.003538350091637982, 0.0014841480358721737, 0.002627036816385956)
2026-06-17 07:00:54,429 - optuna.study.study - INFO - Trial 23 finished with values: [0.003538350091637982, 0.0014841480358721737, 0.002627036816385956] and parameters: {'n_layers': 1, 'embedding_dim': 32, 'lr': 0.002231043752262738, 'lambda_val': 1.7261189135715837e-05, 'batch_size': 3410, 'optimizer': 'Adam'}.
2026-06-17 07:01:21,163 - experiment_functions - INFO - Early stopping at epoch 550. Best Metrics: (0.001835643769676033, 0.0007831249210559555, 0.0012790131339357005)
2026-06-17 07:01:21,238 - optuna.study.study - INFO - Trial 24 finished with values: [0.001835643769676033, 0.0007831249210559555, 0.0012790131339357005] and parameters: {'n_layers': 2, 'embedding_dim': 128, 'lr': 0.004004678286789067, 'lambda_val': 0.009881851286547895, 'batch_size': 1143, 'optimizer': 'RMSprop'}.
2026-06-17 07:01:43,235 - experiment_functions - INFO - Early stopping at epoch 500. Best Metrics: (0.0004821174433685566, 0.00011841606669192878, 0.0002704275324857212)
2026-06-17 07:01:43,325 - optuna.study.study - INFO - Trial 25 finished with values: [0.0004821174433685566, 0.00011841606669192878, 0.0002704275324857212] and parameters: {'n_layers': 1, 'embedding_dim': 96, 'lr': 2.9518621955105874e-05, 'lambda_val': 0.0024766754067224537, 'batch_size': 595, 'optimizer': 'SGD'}.
2026-06-17 07:02:07,370 - experiment_functions - INFO - Early stopping at epoch 500. Best Metrics: (0.0004916705240816645, 0.00012157382847038021, 0.00027521080571254694)
2026-06-17 07:02:08,369 - optuna.study.study - INFO - Trial 26 finished with values: [0.0004916705240816645, 0.00012157382847038021, 0.00027521080571254694] and parameters: {'n_layers': 2, 'embedding_dim': 256, 'lr': 9.227151343927045e-05, 'lambda_val': 0.007778479458054209, 'batch_size': 2144, 'optimizer': 'SGD'}.
2026-06-17 07:04:19,983 - experiment_functions - INFO - Early stopping at epoch 3050. Best Metrics: (0.001422769251183005, 0.000663129973474801, 0.0010596039200292252)
2026-06-17 07:04:20,066 - optuna.study.study - INFO - Trial 27 finished with values: [0.001422769251183005, 0.000663129973474801, 0.0010596039200292252] and parameters: {'n_layers': 4, 'embedding_dim': 96, 'lr': 0.00012038436287925389, 'lambda_val': 0.055262581477376435, 'batch_size': 4088, 'optimizer': 'RMSprop'}.
2026-06-17 07:04:44,611 - experiment_functions - INFO - Early stopping at epoch 550. Best Metrics: (0.0026429764821256263, 0.0009568018188707844, 0.0016970939868442708)
2026-06-17 07:04:44,691 - optuna.study.study - INFO - Trial 28 finished with values: [0.0026429764821256263, 0.0009568018188707844, 0.0016970939868442708] and parameters: {'n_layers': 4, 'embedding_dim': 32, 'lr': 0.03180567583706626, 'lambda_val': 8.214768091605456e-05, 'batch_size': 2308, 'optimizer': 'Adam'}.
2026-06-17 07:05:06,643 - experiment_functions - INFO - Early stopping at epoch 500. Best Metrics: (0.0005211410835485069, 0.00011999494758115448, 0.0002794238803489394)
2026-06-17 07:05:06,718 - optuna.study.study - INFO - Trial 29 finished with values: [0.0005211410835485069, 0.00011999494758115448, 0.0002794238803489394] and parameters: {'n_layers': 4, 'embedding_dim': 32, 'lr': 3.652263995861207e-05, 'lambda_val': 0.0012524081748392143, 'batch_size': 3638, 'optimizer': 'SGD'}.
2026-06-17 07:05:29,130 - experiment_functions - INFO - Early stopping at epoch 500. Best Metrics: (0.0006815012138662329, 0.00014209928003031453, 0.00035622378305596433)
2026-06-17 07:05:29,229 - optuna.study.study - INFO - Trial 30 finished with values: [0.0006815012138662329, 0.00014209928003031453, 0.00035622378305596433] and parameters: {'n_layers': 2, 'embedding_dim': 96, 'lr': 0.000515681080890167, 'lambda_val': 0.00397372144357261, 'batch_size': 1777, 'optimizer': 'SGD'}.
2026-06-17 07:08:16,922 - optuna.study.study - INFO - Trial 31 finished with values: [0.002482641566434867, 0.0010831122900088418, 0.0018090890623600438] and parameters: {'n_layers': 2, 'embedding_dim': 96, 'lr': 9.133885377982119e-05, 'lambda_val': 2.373377666068493e-06, 'batch_size': 3502, 'optimizer': 'RMSprop'}.
2026-06-17 07:08:43,150 - experiment_functions - INFO - Early stopping at epoch 600. Best Metrics: (0.0036805391759873246, 0.0015125678918782369, 0.002582043629257805)
2026-06-17 07:08:43,227 - optuna.study.study - INFO - Trial 32 finished with values: [0.0036805391759873246, 0.0015125678918782369, 0.002582043629257805] and parameters: {'n_layers': 1, 'embedding_dim': 64, 'lr': 0.003877789258066795, 'lambda_val': 0.00016666322755616337, 'batch_size': 1576, 'optimizer': 'Adam'}.
2026-06-17 07:10:04,301 - experiment_functions - INFO - Early stopping at epoch 1650. Best Metrics: (0.001349184392179652, 0.0007215485663761526, 0.0010552468861240655)
2026-06-17 07:10:04,474 - optuna.study.study - INFO - Trial 33 finished with values: [0.001349184392179652, 0.0007215485663761526, 0.0010552468861240655] and parameters: {'n_layers': 3, 'embedding_dim': 256, 'lr': 0.00010624236187060643, 'lambda_val': 0.045231718489695295, 'batch_size': 2890, 'optimizer': 'RMSprop'}.
2026-06-17 07:10:34,748 - experiment_functions - INFO - Early stopping at epoch 700. Best Metrics: (0.003168176410295825, 0.0011920550713654162, 0.002084774008334208)
2026-06-17 07:10:35,088 - optuna.study.study - INFO - Trial 34 finished with values: [0.003168176410295825, 0.0011920550713654162, 0.002084774008334208] and parameters: {'n_layers': 2, 'embedding_dim': 64, 'lr': 0.0010198666848316574, 'lambda_val': 0.0009466382313788157, 'batch_size': 3704, 'optimizer': 'Adam'}.
2026-06-17 07:11:12,142 - experiment_functions - INFO - Early stopping at epoch 850. Best Metrics: (0.0005836820655752207, 0.0001405203991410888, 0.0003263205453379098)
2026-06-17 07:11:12,225 - optuna.study.study - INFO - Trial 35 finished with values: [0.0005836820655752207, 0.0001405203991410888, 0.0003263205453379098] and parameters: {'n_layers': 4, 'embedding_dim': 32, 'lr': 1.9710210744232608e-05, 'lambda_val': 1.3849779078707614e-05, 'batch_size': 2368, 'optimizer': 'RMSprop'}.
2026-06-17 07:11:34,274 - experiment_functions - INFO - Early stopping at epoch 500. Best Metrics: (0.00046115873485393116, 9.473285335354301e-05, 0.00024825697341031554)
