2026-06-18 01:15:26,505 - optuna.study.study - INFO - Trial 196 finished with values: [0.0034388270342397553, 0.0008083870152835671, 0.00221422252461409] and parameters: {'n_layers': 4, 'embedding_dim': 64, 'lr': 0.0006990102643278918, 'lambda_val': 0.002003406704760604, 'batch_size': 2162, 'optimizer': 'RMSprop'}.
2026-06-18 01:15:55,467 - experiment_functions - INFO - Early stopping at epoch 600. Best Metrics: (0.002290138226486177, 0.0006173424276872552, 0.0015229826673047384)
2026-06-18 01:15:55,597 - optuna.study.study - INFO - Trial 197 finished with values: [0.002290138226486177, 0.0006173424276872552, 0.0015229826673047384] and parameters: {'n_layers': 4, 'embedding_dim': 64, 'lr': 0.004768609881490324, 'lambda_val': 0.006986427337292849, 'batch_size': 3724, 'optimizer': 'Adam'}.
2026-06-18 01:16:44,008 - experiment_functions - INFO - Early stopping at epoch 1050. Best Metrics: (0.0029971605353897417, 0.0007073386383731211, 0.0018605666596918813)
2026-06-18 01:16:44,107 - optuna.study.study - INFO - Trial 198 finished with values: [0.0029971605353897417, 0.0007073386383731211, 0.0018605666596918813] and parameters: {'n_layers': 4, 'embedding_dim': 64, 'lr': 0.0006990102643278918, 'lambda_val': 0.002750666158846801, 'batch_size': 3625, 'optimizer': 'Adam'}.
2026-06-18 01:17:25,980 - experiment_functions - INFO - Early stopping at epoch 950. Best Metrics: (0.002657848040039689, 0.0006126057850195782, 0.0015660396225631694)
2026-06-18 01:17:26,418 - optuna.study.study - INFO - Trial 199 finished with values: [0.002657848040039689, 0.0006126057850195782, 0.0015660396225631694] and parameters: {'n_layers': 1, 'embedding_dim': 64, 'lr': 0.0026704905176286454, 'lambda_val': 2.2322765995099733e-06, 'batch_size': 4090, 'optimizer': 'Adam'}.
2026-06-18 01:18:10,588 - experiment_functions - INFO - Early stopping at epoch 950. Best Metrics: (0.0036246634571338848, 0.0008447012757357586, 0.0022319609751071117)
2026-06-18 01:18:11,057 - optuna.study.study - INFO - Trial 200 finished with values: [0.0036246634571338848, 0.0008447012757357586, 0.0022319609751071117] and parameters: {'n_layers': 4, 'embedding_dim': 64, 'lr': 0.0016427257095284614, 'lambda_val': 3.6404845826373614e-05, 'batch_size': 1625, 'optimizer': 'Adam'}.
2026-06-18 01:20:47,640 - experiment_functions - INFO - Early stopping at epoch 3600. Best Metrics: (0.003937201145532553, 0.0009110142730832387, 0.0025009366125650625)
2026-06-18 01:20:47,743 - optuna.study.study - INFO - Trial 201 finished with values: [0.003937201145532553, 0.0009110142730832387, 0.0025009366125650625] and parameters: {'n_layers': 3, 'embedding_dim': 64, 'lr': 0.0006197690834854795, 'lambda_val': 3.6404845826373614e-05, 'batch_size': 1008, 'optimizer': 'RMSprop'}.
2026-06-18 01:21:27,226 - experiment_functions - INFO - Early stopping at epoch 850. Best Metrics: (0.0034047870099461913, 0.0008889099406340786, 0.00216002351179233)
2026-06-18 01:21:27,806 - optuna.study.study - INFO - Trial 202 finished with values: [0.0034047870099461913, 0.0008889099406340786, 0.00216002351179233] and parameters: {'n_layers': 4, 'embedding_dim': 64, 'lr': 0.0023699548585448013, 'lambda_val': 0.002003406704760604, 'batch_size': 600, 'optimizer': 'RMSprop'}.
2026-06-18 01:21:54,926 - experiment_functions - INFO - Early stopping at epoch 550. Best Metrics: (0.002875674112258815, 0.0007183908045977011, 0.001905732917057617)
2026-06-18 01:21:55,029 - optuna.study.study - INFO - Trial 203 finished with values: [0.002875674112258815, 0.0007183908045977011, 0.001905732917057617] and parameters: {'n_layers': 3, 'embedding_dim': 96, 'lr': 0.020346910353452183, 'lambda_val': 5.470239525476512e-06, 'batch_size': 2091, 'optimizer': 'Adam'}.
2026-06-18 01:23:27,935 - experiment_functions - INFO - Early stopping at epoch 2100. Best Metrics: (0.0030668225919329604, 0.0007436528988253126, 0.0019807539482402845)
2026-06-18 01:23:28,082 - optuna.study.study - INFO - Trial 204 finished with values: [0.0030668225919329604, 0.0007436528988253126, 0.0019807539482402845] and parameters: {'n_layers': 4, 'embedding_dim': 64, 'lr': 0.0006674090882881629, 'lambda_val': 0.0001528536356672561, 'batch_size': 3948, 'optimizer': 'Adam'}.
2026-06-18 01:25:31,939 - experiment_functions - INFO - Early stopping at epoch 2750. Best Metrics: (0.0007567225118780246, 0.00017525577870405458, 0.00045474576422760996)
2026-06-18 01:25:32,045 - optuna.study.study - INFO - Trial 205 finished with values: [0.0007567225118780246, 0.00017525577870405458, 0.00045474576422760996] and parameters: {'n_layers': 4, 'embedding_dim': 96, 'lr': 8.690835114840041e-05, 'lambda_val': 6.88069903527936e-06, 'batch_size': 810, 'optimizer': 'RMSprop'}.
2026-06-18 01:26:10,650 - experiment_functions - INFO - Early stopping at epoch 900. Best Metrics: (0.002765212547186784, 0.0006205001894657068, 0.0017417884341622263)
2026-06-18 01:26:10,754 - optuna.study.study - INFO - Trial 206 finished with values: [0.002765212547186784, 0.0006205001894657068, 0.0017417884341622263] and parameters: {'n_layers': 1, 'embedding_dim': 96, 'lr': 0.0016963971500712442, 'lambda_val': 2.9025613182499857e-06, 'batch_size': 3625, 'optimizer': 'RMSprop'}.
2026-06-18 01:26:38,991 - experiment_functions - INFO - Early stopping at epoch 500. Best Metrics: (0.0005289004677260424, 0.00012473159024883163, 0.000298087244596407)
2026-06-18 01:26:39,098 - optuna.study.study - INFO - Trial 207 finished with values: [0.0005289004677260424, 0.00012473159024883163, 0.000298087244596407] and parameters: {'n_layers': 4, 'embedding_dim': 256, 'lr': 0.0006674090882881629, 'lambda_val': 0.0001528536356672561, 'batch_size': 3948, 'optimizer': 'SGD'}.
2026-06-18 01:27:39,979 - experiment_functions - INFO - Early stopping at epoch 1300. Best Metrics: (0.0028821560672626302, 0.0007752305166098271, 0.0019252632622575043)
2026-06-18 01:27:40,077 - optuna.study.study - INFO - Trial 208 finished with values: [0.0028821560672626302, 0.0007752305166098271, 0.0019252632622575043] and parameters: {'n_layers': 4, 'embedding_dim': 128, 'lr': 0.0006197690834854795, 'lambda_val': 0.00224479684416678, 'batch_size': 2889, 'optimizer': 'RMSprop'}.
2026-06-18 01:28:24,090 - experiment_functions - INFO - Early stopping at epoch 1000. Best Metrics: (0.0033739965524431778, 0.0008304913477327271, 0.0021319290213444256)
2026-06-18 01:28:24,374 - optuna.study.study - INFO - Trial 209 finished with values: [0.0033739965524431778, 0.0008304913477327271, 0.0021319290213444256] and parameters: {'n_layers': 4, 'embedding_dim': 64, 'lr': 0.0009043033415384808, 'lambda_val': 0.00224479684416678, 'batch_size': 2162, 'optimizer': 'Adam'}.
2026-06-18 01:29:25,258 - experiment_functions - INFO - Early stopping at epoch 1450. Best Metrics: (0.003378329216625941, 0.0008083870152835671, 0.0021084606269836494)
2026-06-18 01:29:25,407 - optuna.study.study - INFO - Trial 210 finished with values: [0.003378329216625941, 0.0008083870152835671, 0.0021084606269836494] and parameters: {'n_layers': 2, 'embedding_dim': 64, 'lr': 0.0016427257095284614, 'lambda_val': 0.0015914958177189133, 'batch_size': 526, 'optimizer': 'RMSprop'}.
2026-06-18 01:30:17,906 - experiment_functions - INFO - Early stopping at epoch 1200. Best Metrics: (0.003629491627080451, 0.0008825944170771757, 0.0022911701805486276)
2026-06-18 01:30:18,007 - optuna.study.study - INFO - Trial 211 finished with values: [0.003629491627080451, 0.0008825944170771757, 0.0022911701805486276] and parameters: {'n_layers': 4, 'embedding_dim': 64, 'lr': 0.0006990102643278918, 'lambda_val': 0.002750666158846801, 'batch_size': 1659, 'optimizer': 'RMSprop'}.
2026-06-18 01:30:55,039 - experiment_functions - INFO - Early stopping at epoch 650. Best Metrics: (0.00333466047216967, 0.0008478590375142099, 0.0021183103408845424)
2026-06-18 01:30:55,136 - optuna.study.study - INFO - Trial 212 finished with values: [0.00333466047216967, 0.0008478590375142099, 0.0021183103408845424] and parameters: {'n_layers': 4, 'embedding_dim': 256, 'lr': 0.0071378175069858425, 'lambda_val': 5.470239525476512e-06, 'batch_size': 1907, 'optimizer': 'Adam'}.
2026-06-18 01:31:32,652 - experiment_functions - INFO - Early stopping at epoch 900. Best Metrics: (0.003009191645949028, 0.0006457622836933181, 0.0018523946817529664)
2026-06-18 01:31:32,762 - optuna.study.study - INFO - Trial 213 finished with values: [0.003009191645949028, 0.0006457622836933181, 0.0018523946817529664] and parameters: {'n_layers': 1, 'embedding_dim': 64, 'lr': 0.0016963971500712442, 'lambda_val': 3.6404845826373614e-05, 'batch_size': 3794, 'optimizer': 'RMSprop'}.
2026-06-18 01:33:42,585 - experiment_functions - INFO - Early stopping at epoch 3100. Best Metrics: (0.003216143845095863, 0.0008289124668435015, 0.0021485135652945047)
2026-06-18 01:33:42,690 - optuna.study.study - INFO - Trial 214 finished with values: [0.003216143845095863, 0.0008289124668435015, 0.0021485135652945047] and parameters: {'n_layers': 4, 'embedding_dim': 64, 'lr': 0.0006674090882881629, 'lambda_val': 3.6404845826373614e-05, 'batch_size': 3948, 'optimizer': 'RMSprop'}.
2026-06-18 01:34:48,957 - experiment_functions - INFO - Early stopping at epoch 1650. Best Metrics: (0.004001640615733065, 0.0009583806997600101, 0.002556623570955345)
2026-06-18 01:34:49,075 - optuna.study.study - INFO - Trial 215 finished with values: [0.004001640615733065, 0.0009583806997600101, 0.002556623570955345] and parameters: {'n_layers': 3, 'embedding_dim': 32, 'lr': 0.0023699548585448013, 'lambda_val': 6.88069903527936e-06, 'batch_size': 600, 'optimizer': 'RMSprop'}.
2026-06-18 01:37:51,159 - optuna.study.study - INFO - Trial 216 finished with values: [0.003018154948924834, 0.0007925982063913099, 0.0020444039683713802] and parameters: {'n_layers': 4, 'embedding_dim': 128, 'lr': 0.0003553642460016808, 'lambda_val': 0.006986427337292849, 'batch_size': 810, 'optimizer': 'RMSprop'}.
2026-06-18 01:40:14,681 - experiment_functions - INFO - Early stopping at epoch 3150. Best Metrics: (0.004174460948995259, 0.001026272577996716, 0.002661358340312976)
2026-06-18 01:40:14,788 - optuna.study.study - INFO - Trial 217 finished with values: [0.004174460948995259, 0.001026272577996716, 0.002661358340312976] and parameters: {'n_layers': 4, 'embedding_dim': 128, 'lr': 0.0006197690834854795, 'lambda_val': 3.6404845826373614e-05, 'batch_size': 810, 'optimizer': 'RMSprop'}.
2026-06-18 01:42:39,192 - experiment_functions - INFO - Early stopping at epoch 3450. Best Metrics: (0.0036380717394841, 0.0009189086775293672, 0.0023270562302324833)
2026-06-18 01:42:39,294 - optuna.study.study - INFO - Trial 218 finished with values: [0.0036380717394841, 0.0009189086775293672, 0.0023270562302324833] and parameters: {'n_layers': 4, 'embedding_dim': 64, 'lr': 0.0006197690834854795, 'lambda_val': 3.6404845826373614e-05, 'batch_size': 2162, 'optimizer': 'RMSprop'}.
2026-06-18 01:43:18,355 - experiment_functions - INFO - Early stopping at epoch 700. Best Metrics: (0.003119796972779257, 0.0008320702286219529, 0.002034727181361827)
2026-06-18 01:43:18,711 - optuna.study.study - INFO - Trial 219 finished with values: [0.003119796972779257, 0.0008320702286219529, 0.002034727181361827] and parameters: {'n_layers': 4, 'embedding_dim': 256, 'lr': 0.0010093534324579591, 'lambda_val': 0.0015914958177189133, 'batch_size': 1625, 'optimizer': 'RMSprop'}.
2026-06-18 01:45:57,192 - experiment_functions - INFO - Early stopping at epoch 3500. Best Metrics: (0.004011730774404875, 0.0009725906277630416, 0.00241882707788273)
2026-06-18 01:45:57,299 - optuna.study.study - INFO - Trial 220 finished with values: [0.004011730774404875, 0.0009725906277630416, 0.00241882707788273] and parameters: {'n_layers': 4, 'embedding_dim': 128, 'lr': 0.0006197690834854795, 'lambda_val': 3.6404845826373614e-05, 'batch_size': 1580, 'optimizer': 'RMSprop'}.
2026-06-18 01:46:35,389 - experiment_functions - INFO - Early stopping at epoch 800. Best Metrics: (0.0033046902139508773, 0.0008399646330680814, 0.0020459190567953278)
2026-06-18 01:46:35,488 - optuna.study.study - INFO - Trial 221 finished with values: [0.0033046902139508773, 0.0008399646330680814, 0.0020459190567953278] and parameters: {'n_layers': 4, 'embedding_dim': 128, 'lr': 0.0016963971500712442, 'lambda_val': 0.00224479684416678, 'batch_size': 1946, 'optimizer': 'Adam'}.
2026-06-18 01:47:27,462 - experiment_functions - INFO - Early stopping at epoch 1100. Best Metrics: (0.003643115165113624, 0.0009094353921940129, 0.002203809328788111)
2026-06-18 01:47:27,565 - optuna.study.study - INFO - Trial 222 finished with values: [0.003643115165113624, 0.0009094353921940129, 0.002203809328788111] and parameters: {'n_layers': 4, 'embedding_dim': 128, 'lr': 0.0010386063162588332, 'lambda_val': 3.6404845826373614e-05, 'batch_size': 2889, 'optimizer': 'RMSprop'}.
2026-06-18 01:49:59,118 - experiment_functions - INFO - Early stopping at epoch 3500. Best Metrics: (0.0006223000680150308, 0.00014367816091954023, 0.0003452188130621852)
2026-06-18 01:49:59,237 - optuna.study.study - INFO - Trial 223 finished with values: [0.0006223000680150308, 0.00014367816091954023, 0.0003452188130621852] and parameters: {'n_layers': 4, 'embedding_dim': 96, 'lr': 2.2540171939275786e-05, 'lambda_val': 0.006986427337292849, 'batch_size': 1228, 'optimizer': 'RMSprop'}.
2026-06-18 01:51:43,802 - experiment_functions - INFO - Early stopping at epoch 2500. Best Metrics: (0.0039031699294474176, 0.0008936465833017559, 0.0023924962510825125)
2026-06-18 01:51:43,944 - optuna.study.study - INFO - Trial 224 finished with values: [0.0039031699294474176, 0.0008936465833017559, 0.0023924962510825125] and parameters: {'n_layers': 4, 'embedding_dim': 64, 'lr': 0.0006197690834854795, 'lambda_val': 6.88069903527936e-06, 'batch_size': 2162, 'optimizer': 'RMSprop'}.
2026-06-18 01:53:40,889 - experiment_functions - INFO - Early stopping at epoch 2750. Best Metrics: (0.0036684388822926088, 0.000874700012631047, 0.0022835712900090197)
2026-06-18 01:53:41,036 - optuna.study.study - INFO - Trial 225 finished with values: [0.0036684388822926088, 0.000874700012631047, 0.0022835712900090197] and parameters: {'n_layers': 3, 'embedding_dim': 96, 'lr': 0.0006990102643278918, 'lambda_val': 6.88069903527936e-06, 'batch_size': 2748, 'optimizer': 'RMSprop'}.
2026-06-18 01:56:27,594 - optuna.study.study - INFO - Trial 226 finished with values: [0.0033952643994868636, 0.0008731211317418215, 0.0021695128860003813] and parameters: {'n_layers': 4, 'embedding_dim': 64, 'lr': 0.0006990102643278918, 'lambda_val': 1.3372662561958538e-06, 'batch_size': 3334, 'optimizer': 'RMSprop'}.
2026-06-18 01:57:07,536 - experiment_functions - INFO - Early stopping at epoch 950. Best Metrics: (0.003104784699727411, 0.0006615510925855753, 0.0019367654467347011)
2026-06-18 01:57:07,642 - optuna.study.study - INFO - Trial 227 finished with values: [0.003104784699727411, 0.0006615510925855753, 0.0019367654467347011] and parameters: {'n_layers': 2, 'embedding_dim': 64, 'lr': 0.0016427257095284614, 'lambda_val': 0.0015914958177189133, 'batch_size': 1228, 'optimizer': 'Adam'}.
2026-06-18 01:59:09,276 - experiment_functions - INFO - Early stopping at epoch 3100. Best Metrics: (0.0038853496714088475, 0.0008573323228495644, 0.002451576513287206)
2026-06-18 01:59:09,381 - optuna.study.study - INFO - Trial 228 finished with values: [0.0038853496714088475, 0.0008573323228495644, 0.002451576513287206] and parameters: {'n_layers': 2, 'embedding_dim': 32, 'lr': 0.0009259265868741952, 'lambda_val': 3.576975505685731e-06, 'batch_size': 1228, 'optimizer': 'RMSprop'}.
2026-06-18 01:59:46,262 - experiment_functions - INFO - Early stopping at epoch 650. Best Metrics: (0.0032534351727383382, 0.0008399646330680814, 0.0019818000542891866)
2026-06-18 01:59:46,403 - optuna.study.study - INFO - Trial 229 finished with values: [0.0032534351727383382, 0.0008399646330680814, 0.0019818000542891866] and parameters: {'n_layers': 4, 'embedding_dim': 256, 'lr': 0.003902565260480451, 'lambda_val': 1.6817097224352052e-05, 'batch_size': 1625, 'optimizer': 'Adam'}.
2026-06-18 02:00:36,166 - experiment_functions - INFO - Early stopping at epoch 1100. Best Metrics: (0.0026498599495817844, 0.0006868131868131869, 0.001698106926380165)
2026-06-18 02:00:36,679 - optuna.study.study - INFO - Trial 230 finished with values: [0.0026498599495817844, 0.0006868131868131869, 0.001698106926380165] and parameters: {'n_layers': 4, 'embedding_dim': 96, 'lr': 0.0006197690834854795, 'lambda_val': 0.011324560038593987, 'batch_size': 3027, 'optimizer': 'RMSprop'}.
2026-06-18 02:02:04,275 - experiment_functions - INFO - Early stopping at epoch 1950. Best Metrics: (0.0038159139134033644, 0.0009062776304155616, 0.0024514982400733504)
2026-06-18 02:02:04,376 - optuna.study.study - INFO - Trial 231 finished with values: [0.0038159139134033644, 0.0009062776304155616, 0.0024514982400733504] and parameters: {'n_layers': 3, 'embedding_dim': 128, 'lr': 0.0006197690834854795, 'lambda_val': 0.0012161946689456778, 'batch_size': 810, 'optimizer': 'RMSprop'}.
2026-06-18 02:03:24,579 - experiment_functions - INFO - Early stopping at epoch 1850. Best Metrics: (0.002614597665541684, 0.0006299734748010611, 0.0016363627501151717)
2026-06-18 02:03:24,704 - optuna.study.study - INFO - Trial 232 finished with values: [0.002614597665541684, 0.0006299734748010611, 0.0016363627501151717] and parameters: {'n_layers': 2, 'embedding_dim': 128, 'lr': 0.0006197690834854795, 'lambda_val': 0.006986427337292849, 'batch_size': 810, 'optimizer': 'RMSprop'}.
2026-06-18 02:03:54,192 - experiment_functions - INFO - Early stopping at epoch 700. Best Metrics: (0.003214621044624567, 0.000691549829480864, 0.001917624671251885)
2026-06-18 02:03:54,293 - optuna.study.study - INFO - Trial 233 finished with values: [0.003214621044624567, 0.000691549829480864, 0.001917624671251885] and parameters: {'n_layers': 1, 'embedding_dim': 32, 'lr': 0.0026704905176286454, 'lambda_val': 3.6404845826373614e-05, 'batch_size': 2162, 'optimizer': 'RMSprop'}.
2026-06-18 02:06:33,759 - optuna.study.study - INFO - Trial 234 finished with values: [0.004245169498935634, 0.0009252242010862699, 0.002589117585519635] and parameters: {'n_layers': 3, 'embedding_dim': 32, 'lr': 0.0006197690834854795, 'lambda_val': 0.0012144921171399186, 'batch_size': 810, 'optimizer': 'RMSprop'}.
2026-06-18 02:07:11,508 - experiment_functions - INFO - Early stopping at epoch 800. Best Metrics: (0.0032318106430222872, 0.0008431223948465328, 0.0021117326817950907)
2026-06-18 02:07:11,606 - optuna.study.study - INFO - Trial 235 finished with values: [0.0032318106430222872, 0.0008431223948465328, 0.0021117326817950907] and parameters: {'n_layers': 3, 'embedding_dim': 128, 'lr': 0.002692587283514102, 'lambda_val': 0.0008832187789313173, 'batch_size': 719, 'optimizer': 'Adam'}.
2026-06-18 02:09:14,911 - experiment_functions - INFO - Early stopping at epoch 2300. Best Metrics: (0.0037872473474927087, 0.0009741695086522673, 0.00234524419855006)
2026-06-18 02:09:15,015 - optuna.study.study - INFO - Trial 236 finished with values: [0.0037872473474927087, 0.0009741695086522673, 0.00234524419855006] and parameters: {'n_layers': 4, 'embedding_dim': 256, 'lr': 0.0006197690834854795, 'lambda_val': 3.6404845826373614e-05, 'batch_size': 1625, 'optimizer': 'RMSprop'}.
2026-06-18 02:10:22,882 - experiment_functions - INFO - Early stopping at epoch 1250. Best Metrics: (0.00368735934112326, 0.0009631173424276873, 0.002253602427957993)
2026-06-18 02:10:22,981 - optuna.study.study - INFO - Trial 237 finished with values: [0.00368735934112326, 0.0009631173424276873, 0.002253602427957993] and parameters: {'n_layers': 4, 'embedding_dim': 256, 'lr': 0.0023699548585448013, 'lambda_val': 2.2322765995099733e-06, 'batch_size': 600, 'optimizer': 'RMSprop'}.
2026-06-18 02:11:11,569 - experiment_functions - INFO - Early stopping at epoch 1050. Best Metrics: (0.003518164792945275, 0.0009015409877478843, 0.0022006866484742343)
2026-06-18 02:11:11,674 - optuna.study.study - INFO - Trial 238 finished with values: [0.003518164792945275, 0.0009015409877478843, 0.0022006866484742343] and parameters: {'n_layers': 3, 'embedding_dim': 128, 'lr': 0.002692587283514102, 'lambda_val': 7.431054110368361e-06, 'batch_size': 1255, 'optimizer': 'RMSprop'}.
2026-06-18 02:11:44,221 - experiment_functions - INFO - Early stopping at epoch 750. Best Metrics: (0.002811623228764764, 0.0007104964001515726, 0.0018402745267186785)
2026-06-18 02:11:44,324 - optuna.study.study - INFO - Trial 239 finished with values: [0.002811623228764764, 0.0007104964001515726, 0.0018402745267186785] and parameters: {'n_layers': 2, 'embedding_dim': 64, 'lr': 0.002961271322850098, 'lambda_val': 3.6404845826373614e-05, 'batch_size': 3948, 'optimizer': 'RMSprop'}.
2026-06-18 02:13:52,541 - experiment_functions - INFO - Early stopping at epoch 3150. Best Metrics: (0.0035190184995369063, 0.0007562839459391185, 0.0021259057079197393)
2026-06-18 02:13:52,650 - optuna.study.study - INFO - Trial 240 finished with values: [0.0035190184995369063, 0.0007562839459391185, 0.0021259057079197393] and parameters: {'n_layers': 2, 'embedding_dim': 64, 'lr': 0.0006197690834854795, 'lambda_val': 3.0754321300492116e-05, 'batch_size': 3948, 'optimizer': 'RMSprop'}.
2026-06-18 02:16:15,216 - experiment_functions - INFO - Early stopping at epoch 3450. Best Metrics: (0.0037515748453058355, 0.0008873310597448529, 0.00238848799723113)
2026-06-18 02:16:15,322 - optuna.study.study - INFO - Trial 241 finished with values: [0.0037515748453058355, 0.0008873310597448529, 0.00238848799723113] and parameters: {'n_layers': 3, 'embedding_dim': 64, 'lr': 0.0006197690834854795, 'lambda_val': 3.6404845826373614e-05, 'batch_size': 2889, 'optimizer': 'RMSprop'}.
2026-06-18 02:17:05,609 - experiment_functions - INFO - Early stopping at epoch 1150. Best Metrics: (0.0033448368070388445, 0.0007878615637236328, 0.0020618099325561833)
