2026-06-17 07:49:09,593 - optuna.study.study - INFO - Trial 83 finished with values: [0.0037164892635965134, 0.0014746747505368194, 0.002550321742780715] and parameters: {'n_layers': 1, 'embedding_dim': 32, 'lr': 0.003877789258066795, 'lambda_val': 0.00016666322755616337, 'batch_size': 2368, 'optimizer': 'Adam'}.
2026-06-17 07:49:55,733 - experiment_functions - INFO - Early stopping at epoch 1050. Best Metrics: (0.003207070634037857, 0.001373626373626374, 0.0023202071267849605)
2026-06-17 07:49:55,867 - optuna.study.study - INFO - Trial 84 finished with values: [0.003207070634037857, 0.001373626373626374, 0.0023202071267849605] and parameters: {'n_layers': 1, 'embedding_dim': 64, 'lr': 0.0004860515181398459, 'lambda_val': 0.007692244890670793, 'batch_size': 1599, 'optimizer': 'Adam'}.
2026-06-17 07:50:17,616 - experiment_functions - INFO - Early stopping at epoch 500. Best Metrics: (0.0005007465507042973, 0.00012631047113805733, 0.0002630228659629211)
2026-06-17 07:50:17,707 - optuna.study.study - INFO - Trial 85 finished with values: [0.0005007465507042973, 0.00012631047113805733, 0.0002630228659629211] and parameters: {'n_layers': 4, 'embedding_dim': 32, 'lr': 0.00011602231624540558, 'lambda_val': 0.003161311576024223, 'batch_size': 1255, 'optimizer': 'SGD'}.
2026-06-17 07:51:03,062 - experiment_functions - INFO - Early stopping at epoch 1000. Best Metrics: (0.0037541698213438045, 0.0012488947833775418, 0.002386352159034641)
2026-06-17 07:51:03,150 - optuna.study.study - INFO - Trial 86 finished with values: [0.0037541698213438045, 0.0012488947833775418, 0.002386352159034641] and parameters: {'n_layers': 1, 'embedding_dim': 128, 'lr': 0.024484365885130848, 'lambda_val': 6.872101199763191e-06, 'batch_size': 1310, 'optimizer': 'RMSprop'}.
2026-06-17 07:51:48,507 - experiment_functions - INFO - Early stopping at epoch 1050. Best Metrics: (0.0016417832091320315, 0.0005162940507768094, 0.001030134194722895)
2026-06-17 07:51:48,605 - optuna.study.study - INFO - Trial 87 finished with values: [0.0016417832091320315, 0.0005162940507768094, 0.001030134194722895] and parameters: {'n_layers': 4, 'embedding_dim': 32, 'lr': 0.05952275944427514, 'lambda_val': 0.006880503853550419, 'batch_size': 3330, 'optimizer': 'Adam'}.
2026-06-17 07:52:15,301 - experiment_functions - INFO - Early stopping at epoch 600. Best Metrics: (0.0036667271214065843, 0.001398888467853985, 0.0026400916451852275)
2026-06-17 07:52:15,390 - optuna.study.study - INFO - Trial 88 finished with values: [0.0036667271214065843, 0.001398888467853985, 0.0026400916451852275] and parameters: {'n_layers': 1, 'embedding_dim': 32, 'lr': 0.002231043752262738, 'lambda_val': 1.3052788411163826e-06, 'batch_size': 3296, 'optimizer': 'Adam'}.
2026-06-17 07:55:06,579 - optuna.study.study - INFO - Trial 89 finished with values: [0.0015565840293013434, 0.0007294429708222812, 0.001134705426065182] and parameters: {'n_layers': 4, 'embedding_dim': 64, 'lr': 0.00012038436287925389, 'lambda_val': 0.055262581477376435, 'batch_size': 4088, 'optimizer': 'RMSprop'}.
2026-06-17 07:55:32,827 - experiment_functions - INFO - Early stopping at epoch 600. Best Metrics: (0.002987840774361057, 0.0012157382847038023, 0.002162222709711805)
2026-06-17 07:55:32,907 - optuna.study.study - INFO - Trial 90 finished with values: [0.002987840774361057, 0.0012157382847038023, 0.002162222709711805] and parameters: {'n_layers': 2, 'embedding_dim': 32, 'lr': 0.002529382350283866, 'lambda_val': 6.565445017278844e-05, 'batch_size': 3638, 'optimizer': 'Adam'}.
2026-06-17 07:55:56,560 - experiment_functions - INFO - Early stopping at epoch 500. Best Metrics: (0.00047920058810310717, 0.00010894278135657447, 0.00025093820329944203)
2026-06-17 07:55:57,273 - optuna.study.study - INFO - Trial 91 finished with values: [0.00047920058810310717, 0.00010894278135657447, 0.00025093820329944203] and parameters: {'n_layers': 3, 'embedding_dim': 64, 'lr': 0.00021784470810498664, 'lambda_val': 0.0015531655766280272, 'batch_size': 3296, 'optimizer': 'SGD'}.
2026-06-17 07:56:22,262 - experiment_functions - INFO - Early stopping at epoch 550. Best Metrics: (0.0007145233608760184, 0.00020841227737779464, 0.00040957521095589313)
2026-06-17 07:56:22,351 - optuna.study.study - INFO - Trial 92 finished with values: [0.0007145233608760184, 0.00020841227737779464, 0.00040957521095589313] and parameters: {'n_layers': 3, 'embedding_dim': 96, 'lr': 0.029862282646618256, 'lambda_val': 0.07187039732255336, 'batch_size': 2308, 'optimizer': 'Adam'}.
2026-06-17 07:58:26,614 - experiment_functions - INFO - Early stopping at epoch 3000. Best Metrics: (0.0022705734512029167, 0.0010673234811165845, 0.0017921680611524184)
2026-06-17 07:58:26,708 - optuna.study.study - INFO - Trial 93 finished with values: [0.0022705734512029167, 0.0010673234811165845, 0.0017921680611524184] and parameters: {'n_layers': 2, 'embedding_dim': 96, 'lr': 9.133885377982119e-05, 'lambda_val': 2.373377666068493e-06, 'batch_size': 3502, 'optimizer': 'RMSprop'}.
2026-06-17 07:58:50,458 - experiment_functions - INFO - Early stopping at epoch 550. Best Metrics: (0.002774753100585707, 0.001092585575344196, 0.001948516777027996)
2026-06-17 07:58:50,527 - optuna.study.study - INFO - Trial 94 finished with values: [0.002774753100585707, 0.001092585575344196, 0.001948516777027996] and parameters: {'n_layers': 3, 'embedding_dim': 32, 'lr': 0.007822927276622295, 'lambda_val': 1.031526593103832e-05, 'batch_size': 2645, 'optimizer': 'Adam'}.
2026-06-17 07:59:18,162 - experiment_functions - INFO - Early stopping at epoch 500. Best Metrics: (0.0006365802403036585, 0.0001310471138057345, 0.00032488202459802714)
2026-06-17 07:59:18,244 - optuna.study.study - INFO - Trial 95 finished with values: [0.0006365802403036585, 0.0001310471138057345, 0.00032488202459802714] and parameters: {'n_layers': 3, 'embedding_dim': 256, 'lr': 3.884239453244709e-05, 'lambda_val': 0.06386363750618913, 'batch_size': 3738, 'optimizer': 'Adam'}.
2026-06-17 08:00:16,195 - experiment_functions - INFO - Early stopping at epoch 1150. Best Metrics: (0.0024956360235736945, 0.0011052166224580018, 0.0017978078153129415)
2026-06-17 08:00:16,279 - optuna.study.study - INFO - Trial 96 finished with values: [0.0024956360235736945, 0.0011052166224580018, 0.0017978078153129415] and parameters: {'n_layers': 4, 'embedding_dim': 256, 'lr': 0.0002359819177604671, 'lambda_val': 0.0008240497651178975, 'batch_size': 1749, 'optimizer': 'RMSprop'}.
2026-06-17 08:00:39,163 - experiment_functions - INFO - Early stopping at epoch 500. Best Metrics: (0.0005542822669755709, 0.00011841606669192878, 0.00027810730091641975)
2026-06-17 08:00:39,249 - optuna.study.study - INFO - Trial 97 finished with values: [0.0005542822669755709, 0.00011841606669192878, 0.00027810730091641975] and parameters: {'n_layers': 4, 'embedding_dim': 32, 'lr': 0.03180567583706626, 'lambda_val': 0.008038069284494655, 'batch_size': 2308, 'optimizer': 'SGD'}.
2026-06-17 08:01:07,872 - experiment_functions - INFO - Early stopping at epoch 550. Best Metrics: (0.0025848345518210184, 0.0010199570544398133, 0.0017680855491511178)
2026-06-17 08:01:07,949 - optuna.study.study - INFO - Trial 98 finished with values: [0.0025848345518210184, 0.0010199570544398133, 0.0017680855491511178] and parameters: {'n_layers': 3, 'embedding_dim': 256, 'lr': 0.004595237871810009, 'lambda_val': 3.125135396462488e-05, 'batch_size': 3433, 'optimizer': 'RMSprop'}.
2026-06-17 08:01:46,492 - experiment_functions - INFO - Early stopping at epoch 850. Best Metrics: (0.00208340461809016, 0.0007941770872805355, 0.001434475433841641)
2026-06-17 08:01:46,735 - optuna.study.study - INFO - Trial 99 finished with values: [0.00208340461809016, 0.0007941770872805355, 0.001434475433841641] and parameters: {'n_layers': 2, 'embedding_dim': 32, 'lr': 0.03180567583706626, 'lambda_val': 0.0009466382313788157, 'batch_size': 3704, 'optimizer': 'RMSprop'}.
2026-06-17 08:02:12,643 - experiment_functions - INFO - Early stopping at epoch 550. Best Metrics: (0.0034315318615197403, 0.001432044966527725, 0.0024174202514613704)
2026-06-17 08:02:12,727 - optuna.study.study - INFO - Trial 100 finished with values: [0.0034315318615197403, 0.001432044966527725, 0.0024174202514613704] and parameters: {'n_layers': 1, 'embedding_dim': 128, 'lr': 0.0019791454040792144, 'lambda_val': 3.125135396462488e-05, 'batch_size': 1310, 'optimizer': 'RMSprop'}.
2026-06-17 08:02:37,335 - experiment_functions - INFO - Early stopping at epoch 550. Best Metrics: (0.0033182289324041525, 0.0011920550713654162, 0.0021475640392548605)
2026-06-17 08:02:37,581 - optuna.study.study - INFO - Trial 101 finished with values: [0.0033182289324041525, 0.0011920550713654162, 0.0021475640392548605] and parameters: {'n_layers': 1, 'embedding_dim': 32, 'lr': 0.003877789258066795, 'lambda_val': 6.872101199763191e-06, 'batch_size': 2368, 'optimizer': 'RMSprop'}.
2026-06-17 08:03:02,499 - experiment_functions - INFO - Early stopping at epoch 550. Best Metrics: (0.0031382951074192785, 0.001270999115826702, 0.0021518677926972178)
2026-06-17 08:03:02,819 - optuna.study.study - INFO - Trial 102 finished with values: [0.0031382951074192785, 0.001270999115826702, 0.0021518677926972178] and parameters: {'n_layers': 1, 'embedding_dim': 64, 'lr': 0.0019791454040792144, 'lambda_val': 0.007692244890670793, 'batch_size': 1599, 'optimizer': 'RMSprop'}.
2026-06-17 08:03:28,053 - experiment_functions - INFO - Early stopping at epoch 550. Best Metrics: (0.003085701013610593, 0.0011431097637994191, 0.0021133609390526836)
2026-06-17 08:03:28,138 - optuna.study.study - INFO - Trial 103 finished with values: [0.003085701013610593, 0.0011431097637994191, 0.0021133609390526836] and parameters: {'n_layers': 1, 'embedding_dim': 64, 'lr': 0.07934419482946903, 'lambda_val': 1.031526593103832e-05, 'batch_size': 3704, 'optimizer': 'Adam'}.
2026-06-17 08:03:49,846 - experiment_functions - INFO - Early stopping at epoch 500. Best Metrics: (0.000463332788595182, 0.00011525830491347733, 0.00027093662757437094)
2026-06-17 08:03:49,953 - optuna.study.study - INFO - Trial 104 finished with values: [0.000463332788595182, 0.00011525830491347733, 0.00027093662757437094] and parameters: {'n_layers': 2, 'embedding_dim': 32, 'lr': 0.002231043752262738, 'lambda_val': 0.0003154703940472947, 'batch_size': 3296, 'optimizer': 'SGD'}.
2026-06-17 08:04:13,546 - experiment_functions - INFO - Early stopping at epoch 550. Best Metrics: (0.0019286657418431919, 0.0008147025388404699, 0.0013385100040268153)
2026-06-17 08:04:13,623 - optuna.study.study - INFO - Trial 105 finished with values: [0.0019286657418431919, 0.0008147025388404699, 0.0013385100040268153] and parameters: {'n_layers': 1, 'embedding_dim': 32, 'lr': 0.007451217518146802, 'lambda_val': 0.010352816336052083, 'batch_size': 1310, 'optimizer': 'RMSprop'}.
2026-06-17 08:04:39,160 - experiment_functions - INFO - Early stopping at epoch 600. Best Metrics: (0.0029185420561876852, 0.0010515346722243274, 0.0018921289090328575)
2026-06-17 08:04:39,502 - optuna.study.study - INFO - Trial 106 finished with values: [0.0029185420561876852, 0.0010515346722243274, 0.0018921289090328575] and parameters: {'n_layers': 1, 'embedding_dim': 32, 'lr': 0.024484365885130848, 'lambda_val': 0.00016666322755616337, 'batch_size': 2433, 'optimizer': 'RMSprop'}.
2026-06-17 08:05:02,678 - experiment_functions - INFO - Early stopping at epoch 500. Best Metrics: (0.0005423830070480121, 0.00011841606669192877, 0.00027674243863043163)
2026-06-17 08:05:02,764 - optuna.study.study - INFO - Trial 107 finished with values: [0.0005423830070480121, 0.00011841606669192877, 0.00027674243863043163] and parameters: {'n_layers': 3, 'embedding_dim': 32, 'lr': 8.748634314263026e-05, 'lambda_val': 1.7261189135715837e-05, 'batch_size': 796, 'optimizer': 'SGD'}.
2026-06-17 08:05:28,030 - experiment_functions - INFO - Early stopping at epoch 550. Best Metrics: (0.002338361499141885, 0.0008668056081849187, 0.0015374839466709925)
2026-06-17 08:05:28,496 - optuna.study.study - INFO - Trial 108 finished with values: [0.002338361499141885, 0.0008668056081849187, 0.0015374839466709925] and parameters: {'n_layers': 3, 'embedding_dim': 32, 'lr': 0.07934419482946903, 'lambda_val': 0.0003541153067555522, 'batch_size': 2645, 'optimizer': 'Adam'}.
2026-06-17 08:05:58,156 - experiment_functions - INFO - Early stopping at epoch 550. Best Metrics: (0.0023847299491618007, 0.0009252242010862699, 0.0016493208378217127)
2026-06-17 08:05:58,493 - optuna.study.study - INFO - Trial 109 finished with values: [0.0023847299491618007, 0.0009252242010862699, 0.0016493208378217127] and parameters: {'n_layers': 4, 'embedding_dim': 256, 'lr': 0.004595237871810009, 'lambda_val': 3.125135396462488e-05, 'batch_size': 3433, 'optimizer': 'RMSprop'}.
2026-06-17 08:06:25,094 - experiment_functions - INFO - Early stopping at epoch 600. Best Metrics: (0.0032181774075961617, 0.000986800555766073, 0.0020054367719296853)
2026-06-17 08:06:25,173 - optuna.study.study - INFO - Trial 110 finished with values: [0.0032181774075961617, 0.000986800555766073, 0.0020054367719296853] and parameters: {'n_layers': 2, 'embedding_dim': 32, 'lr': 0.060034049813311924, 'lambda_val': 6.872101199763191e-06, 'batch_size': 3502, 'optimizer': 'RMSprop'}.
2026-06-17 08:06:53,889 - experiment_functions - INFO - Early stopping at epoch 550. Best Metrics: (0.002841530597951255, 0.0010910066944549704, 0.0018454772245195925)
2026-06-17 08:06:55,276 - optuna.study.study - INFO - Trial 111 finished with values: [0.002841530597951255, 0.0010910066944549704, 0.0018454772245195925] and parameters: {'n_layers': 3, 'embedding_dim': 256, 'lr': 0.009539362358733915, 'lambda_val': 1.561244993279661e-06, 'batch_size': 1098, 'optimizer': 'Adam'}.
2026-06-17 08:07:42,492 - experiment_functions - INFO - Early stopping at epoch 1150. Best Metrics: (0.003474429261527423, 0.0012125805229253504, 0.0022278879638445606)
2026-06-17 08:07:42,576 - optuna.study.study - INFO - Trial 112 finished with values: [0.003474429261527423, 0.0012125805229253504, 0.0022278879638445606] and parameters: {'n_layers': 1, 'embedding_dim': 96, 'lr': 0.010529076355744457, 'lambda_val': 3.567347607875195e-06, 'batch_size': 3433, 'optimizer': 'RMSprop'}.
2026-06-17 08:08:59,480 - experiment_functions - INFO - Early stopping at epoch 1600. Best Metrics: (0.0026952246104493586, 0.001193633952254642, 0.0019608375860121984)
2026-06-17 08:08:59,574 - optuna.study.study - INFO - Trial 113 finished with values: [0.0026952246104493586, 0.001193633952254642, 0.0019608375860121984] and parameters: {'n_layers': 2, 'embedding_dim': 256, 'lr': 0.0002359819177604671, 'lambda_val': 3.125135396462488e-05, 'batch_size': 3256, 'optimizer': 'RMSprop'}.
2026-06-17 08:09:28,433 - experiment_functions - INFO - Early stopping at epoch 600. Best Metrics: (0.0028346292807937485, 0.0013088922571681193, 0.0020667389360923337)
2026-06-17 08:09:28,803 - optuna.study.study - INFO - Trial 114 finished with values: [0.0028346292807937485, 0.0013088922571681193, 0.0020667389360923337] and parameters: {'n_layers': 1, 'embedding_dim': 256, 'lr': 0.0011453432792901683, 'lambda_val': 3.737769038654263e-05, 'batch_size': 2351, 'optimizer': 'RMSprop'}.
2026-06-17 08:10:04,007 - experiment_functions - INFO - Early stopping at epoch 800. Best Metrics: (0.00042935686755435446, 0.00010894278135657447, 0.00022069217930593916)
2026-06-17 08:10:04,076 - optuna.study.study - INFO - Trial 115 finished with values: [0.00042935686755435446, 0.00010894278135657447, 0.00022069217930593916] and parameters: {'n_layers': 3, 'embedding_dim': 64, 'lr': 1.961199088917868e-05, 'lambda_val': 0.0015531655766280272, 'batch_size': 1099, 'optimizer': 'Adam'}.
2026-06-17 08:10:34,428 - experiment_functions - INFO - Early stopping at epoch 600. Best Metrics: (0.0026984316847828535, 0.0012031072375899964, 0.0019508734139437847)
2026-06-17 08:10:34,659 - optuna.study.study - INFO - Trial 116 finished with values: [0.0026984316847828535, 0.0012031072375899964, 0.0019508734139437847] and parameters: {'n_layers': 2, 'embedding_dim': 256, 'lr': 0.0017481121338793991, 'lambda_val': 0.0009466382313788157, 'batch_size': 2368, 'optimizer': 'Adam'}.
2026-06-17 08:11:00,440 - experiment_functions - INFO - Early stopping at epoch 550. Best Metrics: (0.0029552749893300687, 0.0012299482127068335, 0.0021191299761845095)
2026-06-17 08:11:00,511 - optuna.study.study - INFO - Trial 117 finished with values: [0.0029552749893300687, 0.0012299482127068335, 0.0021191299761845095] and parameters: {'n_layers': 2, 'embedding_dim': 128, 'lr': 0.0029893657570589515, 'lambda_val': 4.5416492127037904e-06, 'batch_size': 2336, 'optimizer': 'Adam'}.
2026-06-17 08:12:25,321 - experiment_functions - INFO - Early stopping at epoch 2100. Best Metrics: (0.0036865225013886123, 0.0013009978527219908, 0.002402897506020702)
2026-06-17 08:12:25,375 - optuna.study.study - INFO - Trial 118 finished with values: [0.0036865225013886123, 0.0013009978527219908, 0.002402897506020702] and parameters: {'n_layers': 1, 'embedding_dim': 64, 'lr': 0.024484365885130848, 'lambda_val': 6.872101199763191e-06, 'batch_size': 2433, 'optimizer': 'RMSprop'}.
2026-06-17 08:12:50,531 - experiment_functions - INFO - Early stopping at epoch 550. Best Metrics: (0.003586209816231134, 0.0013799418971832764, 0.002457280875161533)
2026-06-17 08:12:50,613 - optuna.study.study - INFO - Trial 119 finished with values: [0.003586209816231134, 0.0013799418971832764, 0.002457280875161533] and parameters: {'n_layers': 1, 'embedding_dim': 32, 'lr': 0.002231043752262738, 'lambda_val': 1.7261189135715837e-05, 'batch_size': 1310, 'optimizer': 'RMSprop'}.
2026-06-17 08:13:13,710 - experiment_functions - INFO - Early stopping at epoch 500. Best Metrics: (0.0005639835270905956, 0.00012473159024883163, 0.00031782939089389944)
2026-06-17 08:13:13,796 - optuna.study.study - INFO - Trial 120 finished with values: [0.0005639835270905956, 0.00012473159024883163, 0.00031782939089389944] and parameters: {'n_layers': 1, 'embedding_dim': 32, 'lr': 0.003877789258066795, 'lambda_val': 0.00016666322755616337, 'batch_size': 2336, 'optimizer': 'SGD'}.
2026-06-17 08:13:45,427 - experiment_functions - INFO - Early stopping at epoch 700. Best Metrics: (0.003754629504101901, 0.0010467980295566504, 0.0023011239545846452)
2026-06-17 08:13:45,514 - optuna.study.study - INFO - Trial 121 finished with values: [0.003754629504101901, 0.0010467980295566504, 0.0023011239545846452] and parameters: {'n_layers': 2, 'embedding_dim': 128, 'lr': 0.046129598836200957, 'lambda_val': 5.2927329941475195e-06, 'batch_size': 2685, 'optimizer': 'RMSprop'}.
2026-06-17 08:14:10,127 - experiment_functions - INFO - Early stopping at epoch 550. Best Metrics: (0.0024676789724987027, 0.0009473285335354301, 0.001587280356223941)
2026-06-17 08:14:10,215 - optuna.study.study - INFO - Trial 122 finished with values: [0.0024676789724987027, 0.0009473285335354301, 0.001587280356223941] and parameters: {'n_layers': 2, 'embedding_dim': 32, 'lr': 0.05952275944427514, 'lambda_val': 0.0009466382313788157, 'batch_size': 1599, 'optimizer': 'Adam'}.
2026-06-17 08:14:38,558 - experiment_functions - INFO - Early stopping at epoch 600. Best Metrics: (0.003037323194215467, 0.0011857395478085133, 0.002107330324295501)
2026-06-17 08:14:38,925 - optuna.study.study - INFO - Trial 123 finished with values: [0.003037323194215467, 0.0011857395478085133, 0.002107330324295501] and parameters: {'n_layers': 2, 'embedding_dim': 128, 'lr': 0.002529382350283866, 'lambda_val': 6.565445017278844e-05, 'batch_size': 2336, 'optimizer': 'Adam'}.
2026-06-17 08:15:01,683 - experiment_functions - INFO - Early stopping at epoch 500. Best Metrics: (0.0004536645501818916, 0.00010736390046734874, 0.0002554859752357815)
2026-06-17 08:15:01,768 - optuna.study.study - INFO - Trial 124 finished with values: [0.0004536645501818916, 0.00010736390046734874, 0.0002554859752357815] and parameters: {'n_layers': 1, 'embedding_dim': 128, 'lr': 0.003877789258066795, 'lambda_val': 0.00016666322755616337, 'batch_size': 1310, 'optimizer': 'SGD'}.
2026-06-17 08:15:26,212 - experiment_functions - INFO - Early stopping at epoch 550. Best Metrics: (0.003434356648670072, 0.0011083743842364533, 0.002125109328515262)
2026-06-17 08:15:26,430 - optuna.study.study - INFO - Trial 125 finished with values: [0.003434356648670072, 0.0011083743842364533, 0.002125109328515262] and parameters: {'n_layers': 1, 'embedding_dim': 32, 'lr': 0.046129598836200957, 'lambda_val': 1.7261189135715837e-05, 'batch_size': 1310, 'optimizer': 'RMSprop'}.
2026-06-17 08:15:52,462 - experiment_functions - INFO - Early stopping at epoch 550. Best Metrics: (0.003697324324592033, 0.0014509915371984337, 0.0026109417237878776)
2026-06-17 08:15:52,531 - optuna.study.study - INFO - Trial 126 finished with values: [0.003697324324592033, 0.0014509915371984337, 0.0026109417237878776] and parameters: {'n_layers': 1, 'embedding_dim': 96, 'lr': 0.007822927276622295, 'lambda_val': 3.567347607875195e-06, 'batch_size': 3433, 'optimizer': 'Adam'}.
2026-06-17 08:16:22,022 - experiment_functions - INFO - Early stopping at epoch 550. Best Metrics: (0.0018028334585132582, 0.0007294429708222812, 0.0012038637302773214)
2026-06-17 08:16:22,111 - optuna.study.study - INFO - Trial 127 finished with values: [0.0018028334585132582, 0.0007294429708222812, 0.0012038637302773214] and parameters: {'n_layers': 4, 'embedding_dim': 256, 'lr': 0.004595237871810009, 'lambda_val': 0.0015700686256870026, 'batch_size': 1833, 'optimizer': 'RMSprop'}.
2026-06-17 08:17:19,316 - experiment_functions - INFO - Early stopping at epoch 1100. Best Metrics: (0.0027899690865257286, 0.0011225843122394845, 0.001901251195436933)
