2026-06-19 12:32:27,581 - optuna.study.study - INFO - Trial 9 finished with values: [0.008017087104991192, 0.0019751799924213717, 0.004913700587090131] and parameters: {'n_layers': 1, 'embedding_dim': 128, 'lr': 0.0004168795119780243, 'lambda_val': 0.0004410655026986362, 'batch_size': 1551, 'optimizer': 'RMSprop'}.
2026-06-19 12:35:22,962 - optuna.study.study - INFO - Trial 10 finished with values: [0.0006218667794134352, 0.00014525704180876593, 0.0003261397226372107] and parameters: {'n_layers': 2, 'embedding_dim': 64, 'lr': 9.12972089368199e-05, 'lambda_val': 0.00023455253959635695, 'batch_size': 3297, 'optimizer': 'RMSprop'}.
2026-06-19 12:35:49,852 - experiment_functions - INFO - Early stopping at epoch 500. Best Metrics: (0.0005357984825489247, 0.00012157382847038021, 0.00029737530342690096)
2026-06-19 12:35:49,993 - optuna.study.study - INFO - Trial 11 finished with values: [0.0005357984825489247, 0.00012157382847038021, 0.00029737530342690096] and parameters: {'n_layers': 4, 'embedding_dim': 96, 'lr': 0.013517175233976662, 'lambda_val': 1.0743501993487712e-06, 'batch_size': 1770, 'optimizer': 'SGD'}.
2026-06-19 12:36:25,828 - experiment_functions - INFO - Early stopping at epoch 800. Best Metrics: (0.0006150749723525981, 0.0001484148035872174, 0.0003439296143651923)
2026-06-19 12:36:25,921 - optuna.study.study - INFO - Trial 12 finished with values: [0.0006150749723525981, 0.0001484148035872174, 0.0003439296143651923] and parameters: {'n_layers': 1, 'embedding_dim': 32, 'lr': 1.877632437792818e-05, 'lambda_val': 1.310491821531812e-05, 'batch_size': 3318, 'optimizer': 'RMSprop'}.
2026-06-19 12:39:53,869 - optuna.study.study - INFO - Trial 13 finished with values: [0.023904096362536844, 0.005000315776177846, 0.013369212396121266] and parameters: {'n_layers': 4, 'embedding_dim': 128, 'lr': 0.0003559424913838149, 'lambda_val': 0.0005349360048541204, 'batch_size': 1978, 'optimizer': 'Adam'}.
2026-06-19 12:40:17,239 - experiment_functions - INFO - Early stopping at epoch 500. Best Metrics: (0.0005581256676341689, 0.00013420487558418593, 0.00031124577025228386)
2026-06-19 12:40:17,307 - optuna.study.study - INFO - Trial 14 finished with values: [0.0005581256676341689, 0.00013420487558418593, 0.00031124577025228386] and parameters: {'n_layers': 2, 'embedding_dim': 64, 'lr': 1.890653847376378e-05, 'lambda_val': 0.004045718327713887, 'batch_size': 2800, 'optimizer': 'SGD'}.
2026-06-19 12:40:50,973 - experiment_functions - INFO - Early stopping at epoch 700. Best Metrics: (0.012139092864589982, 0.002527788303650373, 0.006939740358894691)
2026-06-19 12:40:51,051 - optuna.study.study - INFO - Trial 15 finished with values: [0.012139092864589982, 0.002527788303650373, 0.006939740358894691] and parameters: {'n_layers': 2, 'embedding_dim': 96, 'lr': 0.011947726209254472, 'lambda_val': 6.625891078039768e-05, 'batch_size': 2386, 'optimizer': 'RMSprop'}.
2026-06-19 12:41:21,699 - experiment_functions - INFO - Early stopping at epoch 650. Best Metrics: (0.020712683088043634, 0.004532967032967033, 0.011317272179543269)
2026-06-19 12:41:21,807 - optuna.study.study - INFO - Trial 16 finished with values: [0.020712683088043634, 0.004532967032967033, 0.011317272179543269] and parameters: {'n_layers': 1, 'embedding_dim': 128, 'lr': 0.004992205825175868, 'lambda_val': 0.01023634821381082, 'batch_size': 3452, 'optimizer': 'Adam'}.
2026-06-19 12:42:02,977 - experiment_functions - INFO - Early stopping at epoch 750. Best Metrics: (0.007807836639151818, 0.001638878363016294, 0.004451691021664318)
2026-06-19 12:42:04,224 - optuna.study.study - INFO - Trial 17 finished with values: [0.007807836639151818, 0.001638878363016294, 0.004451691021664318] and parameters: {'n_layers': 4, 'embedding_dim': 128, 'lr': 0.019160916230065075, 'lambda_val': 1.884002484963995e-05, 'batch_size': 1539, 'optimizer': 'Adam'}.
2026-06-19 12:42:35,388 - experiment_functions - INFO - Early stopping at epoch 550. Best Metrics: (0.009819107066909546, 0.0020714917266641407, 0.005503279522715848)
2026-06-19 12:42:35,481 - optuna.study.study - INFO - Trial 18 finished with values: [0.009819107066909546, 0.0020714917266641407, 0.005503279522715848] and parameters: {'n_layers': 4, 'embedding_dim': 128, 'lr': 0.004693020881623043, 'lambda_val': 0.0001159742696744479, 'batch_size': 2029, 'optimizer': 'RMSprop'}.
2026-06-19 12:45:37,286 - optuna.study.study - INFO - Trial 19 finished with values: [0.03238331226802271, 0.0067860300618921305, 0.018277693606910214] and parameters: {'n_layers': 1, 'embedding_dim': 96, 'lr': 0.0009161309868324035, 'lambda_val': 1.5620108941497448e-05, 'batch_size': 2397, 'optimizer': 'RMSprop'}.
2026-06-19 12:48:34,836 - optuna.study.study - INFO - Trial 20 finished with values: [0.023240393288539912, 0.005033472274851587, 0.012960066995121351] and parameters: {'n_layers': 3, 'embedding_dim': 32, 'lr': 0.00033972972787464065, 'lambda_val': 0.00011634769232475837, 'batch_size': 2098, 'optimizer': 'RMSprop'}.
2026-06-19 12:50:02,875 - experiment_functions - INFO - Early stopping at epoch 2000. Best Metrics: (0.004913529375796903, 0.0010910066944549704, 0.002765261986506576)
2026-06-19 12:50:02,965 - optuna.study.study - INFO - Trial 21 finished with values: [0.004913529375796903, 0.0010910066944549704, 0.002765261986506576] and parameters: {'n_layers': 3, 'embedding_dim': 32, 'lr': 0.049649722200049824, 'lambda_val': 0.008954355913760568, 'batch_size': 2403, 'optimizer': 'RMSprop'}.
2026-06-19 12:50:29,203 - experiment_functions - INFO - Early stopping at epoch 550. Best Metrics: (0.012261487251523045, 0.0026998863205759762, 0.00690469531783946)
2026-06-19 12:50:29,304 - optuna.study.study - INFO - Trial 22 finished with values: [0.012261487251523045, 0.0026998863205759762, 0.00690469531783946] and parameters: {'n_layers': 1, 'embedding_dim': 64, 'lr': 0.04887771788323395, 'lambda_val': 3.736362199207782e-06, 'batch_size': 3060, 'optimizer': 'Adam'}.
2026-06-19 12:50:53,863 - experiment_functions - INFO - Early stopping at epoch 500. Best Metrics: (0.000583264056918713, 0.0001310471138057345, 0.00031713189982643364)
2026-06-19 12:50:53,950 - optuna.study.study - INFO - Trial 23 finished with values: [0.000583264056918713, 0.0001310471138057345, 0.00031713189982643364] and parameters: {'n_layers': 4, 'embedding_dim': 32, 'lr': 0.0008829948663854754, 'lambda_val': 0.0008949468970728829, 'batch_size': 3194, 'optimizer': 'SGD'}.
2026-06-19 12:51:21,034 - experiment_functions - INFO - Early stopping at epoch 500. Best Metrics: (0.0005481134665018141, 0.00012631047113805733, 0.00029479241158019017)
2026-06-19 12:51:21,117 - optuna.study.study - INFO - Trial 24 finished with values: [0.0005481134665018141, 0.00012631047113805733, 0.00029479241158019017] and parameters: {'n_layers': 3, 'embedding_dim': 128, 'lr': 3.3985245100038925e-05, 'lambda_val': 0.0004521907851388952, 'batch_size': 758, 'optimizer': 'SGD'}.
2026-06-19 12:51:45,224 - experiment_functions - INFO - Early stopping at epoch 500. Best Metrics: (0.0005592555968851824, 0.00012315270935960593, 0.00029578795029181745)
2026-06-19 12:51:45,322 - optuna.study.study - INFO - Trial 25 finished with values: [0.0005592555968851824, 0.00012315270935960593, 0.00029578795029181745] and parameters: {'n_layers': 1, 'embedding_dim': 96, 'lr': 0.00024097441546115178, 'lambda_val': 0.0005144955748055688, 'batch_size': 1862, 'optimizer': 'SGD'}.
2026-06-19 12:52:35,585 - experiment_functions - INFO - Early stopping at epoch 1050. Best Metrics: (0.00043933989226814963, 9.473285335354302e-05, 0.000242007106105977)
2026-06-19 12:52:35,691 - optuna.study.study - INFO - Trial 26 finished with values: [0.00043933989226814963, 9.473285335354302e-05, 0.000242007106105977] and parameters: {'n_layers': 2, 'embedding_dim': 96, 'lr': 1.9369637039641233e-05, 'lambda_val': 0.0007257144363911538, 'batch_size': 1553, 'optimizer': 'Adam'}.
2026-06-19 12:53:02,862 - experiment_functions - INFO - Early stopping at epoch 550. Best Metrics: (0.01235174093136971, 0.002666729821902236, 0.006937938933646634)
2026-06-19 12:53:02,952 - optuna.study.study - INFO - Trial 27 finished with values: [0.01235174093136971, 0.002666729821902236, 0.006937938933646634] and parameters: {'n_layers': 2, 'embedding_dim': 64, 'lr': 0.0069364909574124835, 'lambda_val': 0.0002800804472836813, 'batch_size': 1262, 'optimizer': 'RMSprop'}.
2026-06-19 12:53:30,544 - experiment_functions - INFO - Early stopping at epoch 500. Best Metrics: (0.0006635302910630018, 0.0001373626373626374, 0.00034846823526484314)
2026-06-19 12:53:30,626 - optuna.study.study - INFO - Trial 28 finished with values: [0.0006635302910630018, 0.0001373626373626374, 0.00034846823526484314] and parameters: {'n_layers': 3, 'embedding_dim': 128, 'lr': 3.0593698685214465e-05, 'lambda_val': 0.02320659518427928, 'batch_size': 1529, 'optimizer': 'Adam'}.
2026-06-19 12:53:59,353 - experiment_functions - INFO - Early stopping at epoch 550. Best Metrics: (0.009429792961420453, 0.002011494252873563, 0.005220448949768947)
2026-06-19 12:53:59,441 - optuna.study.study - INFO - Trial 29 finished with values: [0.009429792961420453, 0.002011494252873563, 0.005220448949768947] and parameters: {'n_layers': 2, 'embedding_dim': 128, 'lr': 0.017830889569464055, 'lambda_val': 0.00034093153914644244, 'batch_size': 3681, 'optimizer': 'RMSprop'}.
2026-06-19 12:54:23,478 - experiment_functions - INFO - Early stopping at epoch 500. Best Metrics: (0.0004478754321963272, 9.946949602122017e-05, 0.00027167874421160485)
2026-06-19 12:54:23,561 - optuna.study.study - INFO - Trial 30 finished with values: [0.0004478754321963272, 9.946949602122017e-05, 0.00027167874421160485] and parameters: {'n_layers': 1, 'embedding_dim': 64, 'lr': 0.0024832825645824267, 'lambda_val': 4.931192721977658e-06, 'batch_size': 3301, 'optimizer': 'SGD'}.
2026-06-19 12:56:08,362 - experiment_functions - INFO - Early stopping at epoch 2300. Best Metrics: (0.02419611844637336, 0.005167677150435771, 0.013703606801401383)
2026-06-19 12:56:08,453 - optuna.study.study - INFO - Trial 31 finished with values: [0.02419611844637336, 0.005167677150435771, 0.013703606801401383] and parameters: {'n_layers': 3, 'embedding_dim': 32, 'lr': 0.0007090431996729071, 'lambda_val': 0.00030561828294198225, 'batch_size': 2157, 'optimizer': 'RMSprop'}.
2026-06-19 12:56:42,670 - experiment_functions - INFO - Early stopping at epoch 500. Best Metrics: (0.0006522727278271883, 0.00014525704180876596, 0.0003864111921843925)
2026-06-19 12:56:42,752 - optuna.study.study - INFO - Trial 32 finished with values: [0.0006522727278271883, 0.00014525704180876596, 0.0003864111921843925] and parameters: {'n_layers': 4, 'embedding_dim': 256, 'lr': 3.470574549802411e-05, 'lambda_val': 0.04971581257039059, 'batch_size': 3902, 'optimizer': 'SGD'}.
2026-06-19 12:57:07,368 - experiment_functions - INFO - Early stopping at epoch 500. Best Metrics: (0.000515236116837409, 0.00011999494758115448, 0.0003075300911057006)
2026-06-19 12:57:07,465 - optuna.study.study - INFO - Trial 33 finished with values: [0.000515236116837409, 0.00011999494758115448, 0.0003075300911057006] and parameters: {'n_layers': 1, 'embedding_dim': 128, 'lr': 0.005593680856177147, 'lambda_val': 0.023808201349137918, 'batch_size': 3469, 'optimizer': 'SGD'}.
2026-06-19 12:57:41,375 - experiment_functions - INFO - Early stopping at epoch 700. Best Metrics: (0.015160540572022922, 0.0031956549197928513, 0.008188237661098401)
2026-06-19 12:57:41,796 - optuna.study.study - INFO - Trial 34 finished with values: [0.015160540572022922, 0.0031956549197928513, 0.008188237661098401] and parameters: {'n_layers': 1, 'embedding_dim': 96, 'lr': 0.004815452060543289, 'lambda_val': 0.0008323498043954743, 'batch_size': 2615, 'optimizer': 'RMSprop'}.
2026-06-19 12:58:14,695 - experiment_functions - INFO - Early stopping at epoch 600. Best Metrics: (0.02165032975251368, 0.0046450675761020585, 0.012466444805718598)
2026-06-19 12:58:14,783 - optuna.study.study - INFO - Trial 35 finished with values: [0.02165032975251368, 0.0046450675761020585, 0.012466444805718598] and parameters: {'n_layers': 1, 'embedding_dim': 256, 'lr': 0.006452748655627204, 'lambda_val': 0.00016834827857066878, 'batch_size': 2003, 'optimizer': 'Adam'}.
2026-06-19 12:58:40,579 - experiment_functions - INFO - Early stopping at epoch 500. Best Metrics: (0.000434900160015552, 0.00010578501957812304, 0.00022831236816106743)
2026-06-19 12:58:40,699 - optuna.study.study - INFO - Trial 36 finished with values: [0.000434900160015552, 0.00010578501957812304, 0.00022831236816106743] and parameters: {'n_layers': 4, 'embedding_dim': 64, 'lr': 0.009126020138085573, 'lambda_val': 3.837382957190813e-05, 'batch_size': 2116, 'optimizer': 'SGD'}.
2026-06-19 12:59:07,632 - experiment_functions - INFO - Early stopping at epoch 550. Best Metrics: (0.005969892115041487, 0.0013041556145004423, 0.003271559953818314)
2026-06-19 12:59:07,718 - optuna.study.study - INFO - Trial 37 finished with values: [0.005969892115041487, 0.0013041556145004423, 0.003271559953818314] and parameters: {'n_layers': 4, 'embedding_dim': 32, 'lr': 0.020970653135785035, 'lambda_val': 0.00055120243774375, 'batch_size': 2614, 'optimizer': 'Adam'}.
2026-06-19 12:59:32,319 - experiment_functions - INFO - Early stopping at epoch 500. Best Metrics: (0.0005729368675004282, 0.00013262599469496023, 0.0003159202209132924)
2026-06-19 12:59:32,430 - optuna.study.study - INFO - Trial 38 finished with values: [0.0005729368675004282, 0.00013262599469496023, 0.0003159202209132924] and parameters: {'n_layers': 2, 'embedding_dim': 64, 'lr': 0.049668402209952216, 'lambda_val': 1.548343517035374e-05, 'batch_size': 2176, 'optimizer': 'SGD'}.
2026-06-19 13:00:34,832 - experiment_functions - INFO - Early stopping at epoch 1200. Best Metrics: (0.01029775898315811, 0.0021346469622331695, 0.005769925299143278)
2026-06-19 13:00:34,929 - optuna.study.study - INFO - Trial 39 finished with values: [0.01029775898315811, 0.0021346469622331695, 0.005769925299143278] and parameters: {'n_layers': 4, 'embedding_dim': 96, 'lr': 0.006643928261151227, 'lambda_val': 1.101902125761849e-05, 'batch_size': 3151, 'optimizer': 'RMSprop'}.
2026-06-19 13:01:02,107 - experiment_functions - INFO - Early stopping at epoch 550. Best Metrics: (0.008677957556062202, 0.0019830743968675003, 0.00510436630419577)
2026-06-19 13:01:02,196 - optuna.study.study - INFO - Trial 40 finished with values: [0.008677957556062202, 0.0019830743968675003, 0.00510436630419577] and parameters: {'n_layers': 1, 'embedding_dim': 96, 'lr': 0.02046812398618854, 'lambda_val': 1.2254977159578196e-06, 'batch_size': 3493, 'optimizer': 'RMSprop'}.
2026-06-19 13:03:17,616 - experiment_functions - INFO - Early stopping at epoch 3000. Best Metrics: (0.024197779401955655, 0.005254515599343186, 0.013698575119272464)
2026-06-19 13:03:17,704 - optuna.study.study - INFO - Trial 41 finished with values: [0.024197779401955655, 0.005254515599343186, 0.013698575119272464] and parameters: {'n_layers': 3, 'embedding_dim': 32, 'lr': 0.0005608636597976682, 'lambda_val': 0.0016284655276177452, 'batch_size': 2266, 'optimizer': 'Adam'}.
2026-06-19 13:03:47,582 - experiment_functions - INFO - Early stopping at epoch 550. Best Metrics: (0.00441007294105177, 0.000953644057092333, 0.00266917687061391)
2026-06-19 13:03:47,680 - optuna.study.study - INFO - Trial 42 finished with values: [0.00441007294105177, 0.000953644057092333, 0.00266917687061391] and parameters: {'n_layers': 4, 'embedding_dim': 96, 'lr': 0.01095245224927096, 'lambda_val': 0.038126564214361884, 'batch_size': 1222, 'optimizer': 'Adam'}.
2026-06-19 13:04:12,702 - experiment_functions - INFO - Early stopping at epoch 500. Best Metrics: (0.000534394894553419, 0.0001326259946949602, 0.00035523193641719077)
2026-06-19 13:04:12,794 - optuna.study.study - INFO - Trial 43 finished with values: [0.000534394894553419, 0.0001326259946949602, 0.00035523193641719077] and parameters: {'n_layers': 3, 'embedding_dim': 64, 'lr': 0.02315044999949159, 'lambda_val': 2.345688550751383e-06, 'batch_size': 2006, 'optimizer': 'SGD'}.
2026-06-19 13:04:46,200 - experiment_functions - INFO - Early stopping at epoch 700. Best Metrics: (0.010810101866768096, 0.002193065555134521, 0.005886848294479993)
2026-06-19 13:04:46,299 - optuna.study.study - INFO - Trial 44 finished with values: [0.010810101866768096, 0.002193065555134521, 0.005886848294479993] and parameters: {'n_layers': 3, 'embedding_dim': 32, 'lr': 0.01726298753492934, 'lambda_val': 1.699617647457366e-05, 'batch_size': 2469, 'optimizer': 'RMSprop'}.
2026-06-19 13:05:35,094 - experiment_functions - INFO - Early stopping at epoch 1000. Best Metrics: (0.013129259513086071, 0.003145130731337629, 0.007357823958953527)
2026-06-19 13:05:35,184 - optuna.study.study - INFO - Trial 45 finished with values: [0.013129259513086071, 0.003145130731337629, 0.007357823958953527] and parameters: {'n_layers': 2, 'embedding_dim': 96, 'lr': 0.000631580780877778, 'lambda_val': 0.0535406649200873, 'batch_size': 3133, 'optimizer': 'RMSprop'}.
2026-06-19 13:05:58,971 - experiment_functions - INFO - Early stopping at epoch 500. Best Metrics: (0.0004347548432064584, 0.00011367942402425163, 0.00023505146637494597)
2026-06-19 13:05:59,057 - optuna.study.study - INFO - Trial 46 finished with values: [0.0004347548432064584, 0.00011367942402425163, 0.00023505146637494597] and parameters: {'n_layers': 1, 'embedding_dim': 64, 'lr': 0.00037497405489970396, 'lambda_val': 0.01621220975416292, 'batch_size': 2603, 'optimizer': 'SGD'}.
2026-06-19 13:06:26,098 - experiment_functions - INFO - Early stopping at epoch 500. Best Metrics: (0.0005218552432226819, 0.00012631047113805733, 0.0002769321242775015)
2026-06-19 13:06:26,185 - optuna.study.study - INFO - Trial 47 finished with values: [0.0005218552432226819, 0.00012631047113805733, 0.0002769321242775015] and parameters: {'n_layers': 4, 'embedding_dim': 96, 'lr': 0.0832988937199379, 'lambda_val': 0.002256390860020162, 'batch_size': 3462, 'optimizer': 'SGD'}.
2026-06-19 13:10:44,436 - optuna.study.study - INFO - Trial 48 finished with values: [0.01057162555993259, 0.0023556902867247695, 0.0056679407895082225] and parameters: {'n_layers': 4, 'embedding_dim': 256, 'lr': 0.03986838889692316, 'lambda_val': 0.00020288060232250758, 'batch_size': 2302, 'optimizer': 'RMSprop'}.
2026-06-19 13:11:34,874 - experiment_functions - INFO - Early stopping at epoch 900. Best Metrics: (0.015457943549576405, 0.003301439939370974, 0.008272239250804655)
2026-06-19 13:11:34,960 - optuna.study.study - INFO - Trial 49 finished with values: [0.015457943549576405, 0.003301439939370974, 0.008272239250804655] and parameters: {'n_layers': 4, 'embedding_dim': 128, 'lr': 0.001312774843566062, 'lambda_val': 0.0004660072731772704, 'batch_size': 1119, 'optimizer': 'Adam'}.
2026-06-19 13:14:30,197 - optuna.study.study - INFO - Trial 50 finished with values: [0.02857108004765075, 0.006126057850195781, 0.016426898594619665] and parameters: {'n_layers': 1, 'embedding_dim': 32, 'lr': 0.0007090431996729071, 'lambda_val': 1.5620108941497448e-05, 'batch_size': 2397, 'optimizer': 'RMSprop'}.
2026-06-19 13:17:24,779 - optuna.study.study - INFO - Trial 51 finished with values: [0.000639289084929034, 0.00015630920803334593, 0.00034304704424563723] and parameters: {'n_layers': 1, 'embedding_dim': 96, 'lr': 0.00015066078286325135, 'lambda_val': 1.2254977159578196e-06, 'batch_size': 3780, 'optimizer': 'Adam'}.
2026-06-19 13:17:51,631 - experiment_functions - INFO - Early stopping at epoch 550. Best Metrics: (0.008985217855985385, 0.0020193886573196917, 0.005375293780485585)
2026-06-19 13:17:51,725 - optuna.study.study - INFO - Trial 52 finished with values: [0.008985217855985385, 0.0020193886573196917, 0.005375293780485585] and parameters: {'n_layers': 1, 'embedding_dim': 96, 'lr': 0.02046812398618854, 'lambda_val': 1.2254977159578196e-06, 'batch_size': 3493, 'optimizer': 'RMSprop'}.
2026-06-19 13:18:19,018 - experiment_functions - INFO - Early stopping at epoch 550. Best Metrics: (0.017154035210687077, 0.003707212327901984, 0.008961496872993859)
2026-06-19 13:18:19,105 - optuna.study.study - INFO - Trial 53 finished with values: [0.017154035210687077, 0.003707212327901984, 0.008961496872993859] and parameters: {'n_layers': 2, 'embedding_dim': 64, 'lr': 0.008580601632438008, 'lambda_val': 1.0547459482687297e-06, 'batch_size': 3151, 'optimizer': 'Adam'}.
2026-06-19 13:18:43,565 - experiment_functions - INFO - Early stopping at epoch 500. Best Metrics: (0.000520694305824318, 0.00012631047113805733, 0.0003426983483346753)
2026-06-19 13:18:43,652 - optuna.study.study - INFO - Trial 54 finished with values: [0.000520694305824318, 0.00012631047113805733, 0.0003426983483346753] and parameters: {'n_layers': 4, 'embedding_dim': 32, 'lr': 0.0005608636597976682, 'lambda_val': 0.0016284655276177452, 'batch_size': 2595, 'optimizer': 'SGD'}.
2026-06-19 13:19:25,025 - experiment_functions - INFO - Early stopping at epoch 600. Best Metrics: (0.010764700335885106, 0.0023793735000631555, 0.0061609100715794285)
2026-06-19 13:19:25,115 - optuna.study.study - INFO - Trial 55 finished with values: [0.010764700335885106, 0.0023793735000631555, 0.0061609100715794285] and parameters: {'n_layers': 4, 'embedding_dim': 256, 'lr': 0.01726298753492934, 'lambda_val': 1.1893676005474623e-05, 'batch_size': 1813, 'optimizer': 'RMSprop'}.
2026-06-19 13:19:51,528 - experiment_functions - INFO - Early stopping at epoch 550. Best Metrics: (0.018478975430065877, 0.004010357458633321, 0.01054765972272)
2026-06-19 13:19:51,607 - optuna.study.study - INFO - Trial 56 finished with values: [0.018478975430065877, 0.004010357458633321, 0.01054765972272] and parameters: {'n_layers': 1, 'embedding_dim': 64, 'lr': 0.020970653135785035, 'lambda_val': 0.00055120243774375, 'batch_size': 2614, 'optimizer': 'Adam'}.
2026-06-19 13:20:55,070 - experiment_functions - INFO - Early stopping at epoch 1250. Best Metrics: (0.023523285702251737, 0.005121889604648226, 0.01364354452902815)
