2026-06-20 19:33:29,529 - optuna.study.study - INFO - Trial 108 finished with values: [0.003115590399723432, 0.0015773020083364913, 0.002505372757930501] and parameters: {'n_layers': 1, 'embedding_dim': 64, 'lr': 0.0001647669262401174, 'lambda_val': 0.0021519517203617954, 'batch_size': 1847, 'optimizer': 'RMSprop'}.
2026-06-20 19:33:55,474 - experiment_functions - INFO - Early stopping at epoch 550. Best Metrics: (0.003124387437270363, 0.0012346848553745106, 0.0021546049697405774)
2026-06-20 19:33:55,563 - optuna.study.study - INFO - Trial 109 finished with values: [0.003124387437270363, 0.0012346848553745106, 0.0021546049697405774] and parameters: {'n_layers': 3, 'embedding_dim': 128, 'lr': 0.009337459713804563, 'lambda_val': 4.922680840294995e-05, 'batch_size': 1855, 'optimizer': 'Adam'}.
2026-06-20 19:34:24,380 - experiment_functions - INFO - Early stopping at epoch 550. Best Metrics: (0.00275174503752858, 0.0014352027283061767, 0.002210271230117255)
2026-06-20 19:34:24,453 - optuna.study.study - INFO - Trial 110 finished with values: [0.00275174503752858, 0.0014352027283061767, 0.002210271230117255] and parameters: {'n_layers': 3, 'embedding_dim': 256, 'lr': 0.001947201008389374, 'lambda_val': 0.00091460267317109, 'batch_size': 1989, 'optimizer': 'Adam'}.
2026-06-20 19:34:50,937 - experiment_functions - INFO - Early stopping at epoch 600. Best Metrics: (0.003307148581238746, 0.0014352027283061769, 0.002415861582992241)
2026-06-20 19:34:51,029 - optuna.study.study - INFO - Trial 111 finished with values: [0.003307148581238746, 0.0014352027283061769, 0.002415861582992241] and parameters: {'n_layers': 3, 'embedding_dim': 64, 'lr': 0.00101582767124116, 'lambda_val': 0.000902727704834239, 'batch_size': 3292, 'optimizer': 'RMSprop'}.
2026-06-20 19:35:16,937 - experiment_functions - INFO - Early stopping at epoch 550. Best Metrics: (0.0032912614921482286, 0.0013246810660603764, 0.0023310352939396274)
2026-06-20 19:35:17,031 - optuna.study.study - INFO - Trial 112 finished with values: [0.0032912614921482286, 0.0013246810660603764, 0.0023310352939396274] and parameters: {'n_layers': 3, 'embedding_dim': 128, 'lr': 0.008754121728685619, 'lambda_val': 4.080619734488508e-05, 'batch_size': 1394, 'optimizer': 'Adam'}.
2026-06-20 19:35:45,803 - experiment_functions - INFO - Early stopping at epoch 550. Best Metrics: (0.002818909913654369, 0.0012141594038145764, 0.002039078178889216)
2026-06-20 19:35:45,872 - optuna.study.study - INFO - Trial 113 finished with values: [0.002818909913654369, 0.0012141594038145764, 0.002039078178889216] and parameters: {'n_layers': 3, 'embedding_dim': 256, 'lr': 0.0013679015057362796, 'lambda_val': 0.00015675372891187499, 'batch_size': 3788, 'optimizer': 'RMSprop'}.
2026-06-20 19:36:09,451 - experiment_functions - INFO - Early stopping at epoch 550. Best Metrics: (0.003134998577274393, 0.0013452065176203108, 0.0022319159266092543)
2026-06-20 19:36:09,584 - optuna.study.study - INFO - Trial 114 finished with values: [0.003134998577274393, 0.0013452065176203108, 0.0022319159266092543] and parameters: {'n_layers': 1, 'embedding_dim': 32, 'lr': 0.03596299506332503, 'lambda_val': 0.00091460267317109, 'batch_size': 1855, 'optimizer': 'Adam'}.
2026-06-20 19:36:40,478 - experiment_functions - INFO - Early stopping at epoch 700. Best Metrics: (0.0028798019834844835, 0.0012520525451559933, 0.0020394244228989196)
2026-06-20 19:36:40,586 - optuna.study.study - INFO - Trial 115 finished with values: [0.0028798019834844835, 0.0012520525451559933, 0.0020394244228989196] and parameters: {'n_layers': 4, 'embedding_dim': 64, 'lr': 0.0011914719293063967, 'lambda_val': 1.548420801174704e-06, 'batch_size': 891, 'optimizer': 'Adam'}.
2026-06-20 19:37:12,798 - experiment_functions - INFO - Early stopping at epoch 750. Best Metrics: (0.0027949534521004406, 0.001315207780725022, 0.002013078313448242)
2026-06-20 19:37:12,904 - optuna.study.study - INFO - Trial 116 finished with values: [0.0027949534521004406, 0.001315207780725022, 0.002013078313448242] and parameters: {'n_layers': 2, 'embedding_dim': 64, 'lr': 0.000626315927172243, 'lambda_val': 0.020906283455058534, 'batch_size': 3961, 'optimizer': 'Adam'}.
2026-06-20 19:37:37,188 - experiment_functions - INFO - Early stopping at epoch 550. Best Metrics: (0.0018115623824834293, 0.0007104964001515726, 0.0012189028951259803)
2026-06-20 19:37:37,511 - optuna.study.study - INFO - Trial 117 finished with values: [0.0018115623824834293, 0.0007104964001515726, 0.0012189028951259803] and parameters: {'n_layers': 2, 'embedding_dim': 64, 'lr': 0.08768462687583077, 'lambda_val': 0.0021519517203617954, 'batch_size': 865, 'optimizer': 'Adam'}.
2026-06-20 19:38:03,520 - experiment_functions - INFO - Early stopping at epoch 550. Best Metrics: (0.0028827803569058128, 0.001138373121131742, 0.002073967869839159)
2026-06-20 19:38:03,969 - optuna.study.study - INFO - Trial 118 finished with values: [0.0028827803569058128, 0.001138373121131742, 0.002073967869839159] and parameters: {'n_layers': 4, 'embedding_dim': 96, 'lr': 0.03178174845269066, 'lambda_val': 1.6056960373751058e-05, 'batch_size': 1115, 'optimizer': 'Adam'}.
2026-06-20 19:41:00,883 - optuna.study.study - INFO - Trial 119 finished with values: [0.0019461904562577768, 0.0009757483895414929, 0.0015494649698133045] and parameters: {'n_layers': 4, 'embedding_dim': 128, 'lr': 4.966017964938659e-05, 'lambda_val': 1.548420801174704e-06, 'batch_size': 3589, 'optimizer': 'RMSprop'}.
2026-06-20 19:43:37,074 - optuna.study.study - INFO - Trial 120 finished with values: [0.0036162090485337434, 0.0016862447896930657, 0.002772118929292232] and parameters: {'n_layers': 1, 'embedding_dim': 32, 'lr': 0.00017647026102474964, 'lambda_val': 6.254367883207469e-05, 'batch_size': 3400, 'optimizer': 'Adam'}.
2026-06-20 19:44:01,089 - experiment_functions - INFO - Early stopping at epoch 550. Best Metrics: (0.002746285219673345, 0.0012646835922697993, 0.00197698516423586)
2026-06-20 19:44:01,172 - optuna.study.study - INFO - Trial 121 finished with values: [0.002746285219673345, 0.0012646835922697993, 0.00197698516423586] and parameters: {'n_layers': 1, 'embedding_dim': 64, 'lr': 0.03126276557985539, 'lambda_val': 0.0021519517203617954, 'batch_size': 865, 'optimizer': 'Adam'}.
2026-06-20 19:44:28,801 - experiment_functions - INFO - Early stopping at epoch 650. Best Metrics: (0.0038685326813320204, 0.0017557155488189973, 0.002854154461043478)
2026-06-20 19:44:28,880 - optuna.study.study - INFO - Trial 122 finished with values: [0.0038685326813320204, 0.0017557155488189973, 0.002854154461043478] and parameters: {'n_layers': 1, 'embedding_dim': 32, 'lr': 0.002035013881396423, 'lambda_val': 0.004379523707555612, 'batch_size': 2884, 'optimizer': 'Adam'}.
2026-06-20 19:45:02,209 - experiment_functions - INFO - Early stopping at epoch 800. Best Metrics: (0.003339569528961711, 0.0013862574207401794, 0.0023837881286609573)
2026-06-20 19:45:02,293 - optuna.study.study - INFO - Trial 123 finished with values: [0.003339569528961711, 0.0013862574207401794, 0.0023837881286609573] and parameters: {'n_layers': 1, 'embedding_dim': 32, 'lr': 0.021080815477123926, 'lambda_val': 3.1552145254862633e-06, 'batch_size': 2734, 'optimizer': 'RMSprop'}.
2026-06-20 19:45:26,716 - experiment_functions - INFO - Early stopping at epoch 550. Best Metrics: (0.0029329433695980157, 0.0012204749273714793, 0.0020567190948067742)
2026-06-20 19:45:26,804 - optuna.study.study - INFO - Trial 124 finished with values: [0.0029329433695980157, 0.0012204749273714793, 0.0020567190948067742] and parameters: {'n_layers': 4, 'embedding_dim': 64, 'lr': 0.001947201008389374, 'lambda_val': 1.548420801174704e-06, 'batch_size': 2043, 'optimizer': 'RMSprop'}.
2026-06-20 19:45:53,240 - experiment_functions - INFO - Early stopping at epoch 500. Best Metrics: (0.003129110687162275, 0.001477832512315271, 0.0024527096541945344)
2026-06-20 19:45:53,324 - optuna.study.study - INFO - Trial 125 finished with values: [0.003129110687162275, 0.001477832512315271, 0.0024527096541945344] and parameters: {'n_layers': 3, 'embedding_dim': 256, 'lr': 0.01570095709375034, 'lambda_val': 8.944123250283024e-06, 'batch_size': 1670, 'optimizer': 'RMSprop'}.
2026-06-20 19:46:35,899 - experiment_functions - INFO - Early stopping at epoch 800. Best Metrics: (0.0029597495453621233, 0.0013294177087280535, 0.0022549701719326394)
2026-06-20 19:46:35,991 - optuna.study.study - INFO - Trial 126 finished with values: [0.0029597495453621233, 0.0013294177087280535, 0.0022549701719326394] and parameters: {'n_layers': 4, 'embedding_dim': 256, 'lr': 0.0003219848466357513, 'lambda_val': 1.0664285396643345e-05, 'batch_size': 3453, 'optimizer': 'Adam'}.
2026-06-20 19:47:02,456 - experiment_functions - INFO - Early stopping at epoch 500. Best Metrics: (0.0016855628871460698, 0.0008352279904004043, 0.0013483710671365438)
2026-06-20 19:47:02,561 - optuna.study.study - INFO - Trial 127 finished with values: [0.0016855628871460698, 0.0008352279904004043, 0.0013483710671365438] and parameters: {'n_layers': 3, 'embedding_dim': 256, 'lr': 0.08010814822721256, 'lambda_val': 0.0056344344452909775, 'batch_size': 3292, 'optimizer': 'Adam'}.
2026-06-20 19:47:30,591 - experiment_functions - INFO - Early stopping at epoch 650. Best Metrics: (0.0034144541574134477, 0.0013941518251863081, 0.0022923181789820542)
2026-06-20 19:47:30,691 - optuna.study.study - INFO - Trial 128 finished with values: [0.0034144541574134477, 0.0013941518251863081, 0.0022923181789820542] and parameters: {'n_layers': 3, 'embedding_dim': 32, 'lr': 0.001947201008389374, 'lambda_val': 0.00091460267317109, 'batch_size': 1155, 'optimizer': 'Adam'}.
2026-06-20 19:47:57,336 - experiment_functions - INFO - Early stopping at epoch 600. Best Metrics: (0.003471414811711209, 0.0014209928003031452, 0.002397852429355319)
2026-06-20 19:47:57,693 - optuna.study.study - INFO - Trial 129 finished with values: [0.003471414811711209, 0.0014209928003031452, 0.002397852429355319] and parameters: {'n_layers': 3, 'embedding_dim': 64, 'lr': 0.0026465856831401676, 'lambda_val': 1.0693559021612933e-06, 'batch_size': 1155, 'optimizer': 'Adam'}.
2026-06-20 19:48:23,195 - experiment_functions - INFO - Early stopping at epoch 600. Best Metrics: (0.0004813420162243073, 0.0001215738284703802, 0.0002505944143483381)
2026-06-20 19:48:24,284 - optuna.study.study - INFO - Trial 130 finished with values: [0.0004813420162243073, 0.0001215738284703802, 0.0002505944143483381] and parameters: {'n_layers': 1, 'embedding_dim': 32, 'lr': 1.0963417173387242e-05, 'lambda_val': 0.014932842734384931, 'batch_size': 4041, 'optimizer': 'RMSprop'}.
2026-06-20 19:48:48,742 - experiment_functions - INFO - Early stopping at epoch 550. Best Metrics: (0.003546952923578787, 0.0015378299861058483, 0.0026183026722937067)
2026-06-20 19:48:49,209 - optuna.study.study - INFO - Trial 131 finished with values: [0.003546952923578787, 0.0015378299861058483, 0.0026183026722937067] and parameters: {'n_layers': 2, 'embedding_dim': 64, 'lr': 0.003817870632102948, 'lambda_val': 4.922680840294995e-05, 'batch_size': 1855, 'optimizer': 'Adam'}.
2026-06-20 19:49:13,976 - experiment_functions - INFO - Early stopping at epoch 550. Best Metrics: (0.0028154450312381394, 0.0013767841354048252, 0.0020955964466235527)
2026-06-20 19:49:14,449 - optuna.study.study - INFO - Trial 132 finished with values: [0.0028154450312381394, 0.0013767841354048252, 0.0020955964466235527] and parameters: {'n_layers': 3, 'embedding_dim': 64, 'lr': 0.003817870632102948, 'lambda_val': 6.733205641736132e-06, 'batch_size': 1670, 'optimizer': 'Adam'}.
2026-06-20 19:49:42,747 - experiment_functions - INFO - Early stopping at epoch 600. Best Metrics: (0.002991546712315085, 0.0014525704180876594, 0.00235766549136461)
2026-06-20 19:49:42,850 - optuna.study.study - INFO - Trial 133 finished with values: [0.002991546712315085, 0.0014525704180876594, 0.00235766549136461] and parameters: {'n_layers': 3, 'embedding_dim': 128, 'lr': 0.0013679015057362796, 'lambda_val': 0.00032074890954477043, 'batch_size': 1115, 'optimizer': 'Adam'}.
2026-06-20 19:50:16,201 - experiment_functions - INFO - Early stopping at epoch 750. Best Metrics: (0.0031281897431711374, 0.0014146772767462425, 0.002273339258127641)
2026-06-20 19:50:16,299 - optuna.study.study - INFO - Trial 134 finished with values: [0.0031281897431711374, 0.0014146772767462425, 0.002273339258127641] and parameters: {'n_layers': 3, 'embedding_dim': 96, 'lr': 0.00041936718251851416, 'lambda_val': 0.0027800062933610284, 'batch_size': 2206, 'optimizer': 'RMSprop'}.
2026-06-20 19:50:40,853 - experiment_functions - INFO - Early stopping at epoch 550. Best Metrics: (0.0029209790883163458, 0.0011636352153593535, 0.001989804109255429)
2026-06-20 19:50:41,006 - optuna.study.study - INFO - Trial 135 finished with values: [0.0029209790883163458, 0.0011636352153593535, 0.001989804109255429] and parameters: {'n_layers': 3, 'embedding_dim': 64, 'lr': 0.003817870632102948, 'lambda_val': 0.00026964451215277064, 'batch_size': 1155, 'optimizer': 'RMSprop'}.
2026-06-20 19:51:03,038 - experiment_functions - INFO - Early stopping at epoch 500. Best Metrics: (0.000486344164395887, 0.0001042061386888973, 0.0002714386871505734)
2026-06-20 19:51:03,136 - optuna.study.study - INFO - Trial 136 finished with values: [0.000486344164395887, 0.0001042061386888973, 0.0002714386871505734] and parameters: {'n_layers': 3, 'embedding_dim': 32, 'lr': 0.039811911004022954, 'lambda_val': 6.254367883207469e-05, 'batch_size': 3156, 'optimizer': 'SGD'}.
2026-06-20 19:51:28,033 - experiment_functions - INFO - Early stopping at epoch 550. Best Metrics: (0.0031458950171557344, 0.001293103448275862, 0.0020815884211228836)
2026-06-20 19:51:28,139 - optuna.study.study - INFO - Trial 137 finished with values: [0.0031458950171557344, 0.001293103448275862, 0.0020815884211228836] and parameters: {'n_layers': 4, 'embedding_dim': 64, 'lr': 0.001947201008389374, 'lambda_val': 1.548420801174704e-06, 'batch_size': 809, 'optimizer': 'RMSprop'}.
2026-06-20 19:52:00,110 - experiment_functions - INFO - Early stopping at epoch 750. Best Metrics: (0.0037310778001564487, 0.0016530882910193252, 0.0027428619783330713)
2026-06-20 19:52:00,423 - optuna.study.study - INFO - Trial 138 finished with values: [0.0037310778001564487, 0.0016530882910193252, 0.0027428619783330713] and parameters: {'n_layers': 2, 'embedding_dim': 64, 'lr': 0.0011836797126663788, 'lambda_val': 3.6417495206733656e-06, 'batch_size': 809, 'optimizer': 'Adam'}.
2026-06-20 19:52:24,152 - experiment_functions - INFO - Early stopping at epoch 550. Best Metrics: (0.0033566552078495883, 0.0014052039914108881, 0.002381016431144194)
2026-06-20 19:52:24,256 - optuna.study.study - INFO - Trial 139 finished with values: [0.0033566552078495883, 0.0014052039914108881, 0.002381016431144194] and parameters: {'n_layers': 2, 'embedding_dim': 32, 'lr': 0.009861013985366013, 'lambda_val': 0.0010613966883240662, 'batch_size': 2538, 'optimizer': 'Adam'}.
2026-06-20 19:52:50,457 - experiment_functions - INFO - Early stopping at epoch 600. Best Metrics: (0.0036045342530357937, 0.0016467727674624225, 0.0026608642353038807)
2026-06-20 19:52:50,563 - optuna.study.study - INFO - Trial 140 finished with values: [0.0036045342530357937, 0.0016467727674624225, 0.0026608642353038807] and parameters: {'n_layers': 2, 'embedding_dim': 64, 'lr': 0.001947201008389374, 'lambda_val': 0.0021519517203617954, 'batch_size': 3940, 'optimizer': 'Adam'}.
2026-06-20 19:53:15,073 - experiment_functions - INFO - Early stopping at epoch 550. Best Metrics: (0.0010066302537407544, 0.00038998357963875203, 0.0006874946348398028)
2026-06-20 19:53:15,174 - optuna.study.study - INFO - Trial 141 finished with values: [0.0010066302537407544, 0.00038998357963875203, 0.0006874946348398028] and parameters: {'n_layers': 1, 'embedding_dim': 128, 'lr': 0.025232495708805428, 'lambda_val': 0.08017075160947372, 'batch_size': 1855, 'optimizer': 'Adam'}.
2026-06-20 19:53:51,747 - experiment_functions - INFO - Early stopping at epoch 800. Best Metrics: (0.0033403408137669217, 0.0014241505620815967, 0.0024052846668998714)
2026-06-20 19:53:51,856 - optuna.study.study - INFO - Trial 142 finished with values: [0.0033403408137669217, 0.0014241505620815967, 0.0024052846668998714] and parameters: {'n_layers': 3, 'embedding_dim': 128, 'lr': 0.0006133385212652219, 'lambda_val': 4.922680840294995e-05, 'batch_size': 2884, 'optimizer': 'Adam'}.
2026-06-20 19:54:17,912 - experiment_functions - INFO - Early stopping at epoch 500. Best Metrics: (0.002996020458998044, 0.0014288872047492737, 0.0022954893620016187)
2026-06-20 19:54:18,033 - optuna.study.study - INFO - Trial 143 finished with values: [0.002996020458998044, 0.0014288872047492737, 0.0022954893620016187] and parameters: {'n_layers': 3, 'embedding_dim': 256, 'lr': 0.08010814822721256, 'lambda_val': 0.0056344344452909775, 'batch_size': 3292, 'optimizer': 'RMSprop'}.
2026-06-20 19:54:48,979 - experiment_functions - INFO - Early stopping at epoch 700. Best Metrics: (0.0030280411779736497, 0.0013278388278388277, 0.002154564456281601)
2026-06-20 19:54:49,130 - optuna.study.study - INFO - Trial 144 finished with values: [0.0030280411779736497, 0.0013278388278388277, 0.002154564456281601] and parameters: {'n_layers': 4, 'embedding_dim': 64, 'lr': 0.0011836797126663788, 'lambda_val': 0.0021519517203617954, 'batch_size': 865, 'optimizer': 'Adam'}.
2026-06-20 19:55:12,587 - experiment_functions - INFO - Early stopping at epoch 500. Best Metrics: (0.0026820378222546654, 0.0012078438802576733, 0.001973964469889408)
2026-06-20 19:55:13,029 - optuna.study.study - INFO - Trial 145 finished with values: [0.0026820378222546654, 0.0012078438802576733, 0.001973964469889408] and parameters: {'n_layers': 3, 'embedding_dim': 96, 'lr': 0.017570488054786802, 'lambda_val': 0.00015675372891187499, 'batch_size': 3788, 'optimizer': 'RMSprop'}.
2026-06-20 19:55:54,543 - experiment_functions - INFO - Early stopping at epoch 900. Best Metrics: (0.003989373936595015, 0.0014525704180876598, 0.0026646938779716976)
2026-06-20 19:55:54,642 - optuna.study.study - INFO - Trial 146 finished with values: [0.003989373936595015, 0.0014525704180876598, 0.0026646938779716976] and parameters: {'n_layers': 1, 'embedding_dim': 256, 'lr': 0.021080815477123926, 'lambda_val': 3.6417495206733656e-06, 'batch_size': 2734, 'optimizer': 'RMSprop'}.
2026-06-20 19:56:18,322 - experiment_functions - INFO - Early stopping at epoch 550. Best Metrics: (0.0030458379977147706, 0.0012852090438297335, 0.0021869632446150657)
2026-06-20 19:56:18,474 - optuna.study.study - INFO - Trial 147 finished with values: [0.0030458379977147706, 0.0012852090438297335, 0.0021869632446150657] and parameters: {'n_layers': 1, 'embedding_dim': 32, 'lr': 0.09929570364706718, 'lambda_val': 1.3134597991064091e-06, 'batch_size': 1026, 'optimizer': 'Adam'}.
2026-06-20 19:56:44,398 - experiment_functions - INFO - Early stopping at epoch 600. Best Metrics: (0.0028008161694201197, 0.0010846911708980674, 0.001917536463955401)
2026-06-20 19:56:44,503 - optuna.study.study - INFO - Trial 148 finished with values: [0.0028008161694201197, 0.0010846911708980674, 0.001917536463955401] and parameters: {'n_layers': 3, 'embedding_dim': 32, 'lr': 0.09929570364706718, 'lambda_val': 1.3134597991064091e-06, 'batch_size': 2884, 'optimizer': 'Adam'}.
2026-06-20 19:57:13,157 - experiment_functions - INFO - Early stopping at epoch 600. Best Metrics: (0.0036684502960447575, 0.00177308323860048, 0.002803282645760023)
2026-06-20 19:57:13,312 - optuna.study.study - INFO - Trial 149 finished with values: [0.0036684502960447575, 0.00177308323860048, 0.002803282645760023] and parameters: {'n_layers': 1, 'embedding_dim': 256, 'lr': 0.0011914719293063967, 'lambda_val': 1.548420801174704e-06, 'batch_size': 3589, 'optimizer': 'RMSprop'}.
2026-06-20 19:57:37,637 - experiment_functions - INFO - Early stopping at epoch 500. Best Metrics: (0.0005304582102358469, 0.0001389415182518631, 0.00030159677645182986)
2026-06-20 19:57:37,745 - optuna.study.study - INFO - Trial 150 finished with values: [0.0005304582102358469, 0.0001389415182518631, 0.00030159677645182986] and parameters: {'n_layers': 4, 'embedding_dim': 128, 'lr': 0.0005943725589836874, 'lambda_val': 8.631958283556898e-06, 'batch_size': 809, 'optimizer': 'SGD'}.
2026-06-20 19:58:04,368 - experiment_functions - INFO - Early stopping at epoch 550. Best Metrics: (0.003057231345638872, 0.0012425792598206393, 0.0020443881929162054)
2026-06-20 19:58:04,465 - optuna.study.study - INFO - Trial 151 finished with values: [0.003057231345638872, 0.0012425792598206393, 0.0020443881929162054] and parameters: {'n_layers': 4, 'embedding_dim': 128, 'lr': 0.0013679015057362796, 'lambda_val': 3.6417495206733656e-06, 'batch_size': 1115, 'optimizer': 'RMSprop'}.
2026-06-20 19:58:30,999 - experiment_functions - INFO - Early stopping at epoch 600. Best Metrics: (0.0033011530115256275, 0.0014746747505368196, 0.002434340467495732)
2026-06-20 19:58:31,102 - optuna.study.study - INFO - Trial 152 finished with values: [0.0033011530115256275, 0.0014746747505368196, 0.002434340467495732] and parameters: {'n_layers': 3, 'embedding_dim': 64, 'lr': 0.001947201008389374, 'lambda_val': 0.0002504175734936472, 'batch_size': 1709, 'optimizer': 'Adam'}.
2026-06-20 19:58:55,906 - experiment_functions - INFO - Early stopping at epoch 550. Best Metrics: (0.003655005652182943, 0.0014415182518630796, 0.0025094616725872235)
2026-06-20 19:58:56,003 - optuna.study.study - INFO - Trial 153 finished with values: [0.003655005652182943, 0.0014415182518630796, 0.0025094616725872235] and parameters: {'n_layers': 1, 'embedding_dim': 128, 'lr': 0.008754121728685619, 'lambda_val': 4.080619734488508e-05, 'batch_size': 891, 'optimizer': 'RMSprop'}.
2026-06-20 19:59:23,648 - experiment_functions - INFO - Early stopping at epoch 650. Best Metrics: (0.0033549357556992092, 0.0014004673487432108, 0.0022583320194861267)
