2026-06-17 10:18:01,920 - optuna.study.study - INFO - Trial 7 finished with values: [0.0005080359851136265, 0.00012157382847038021, 0.0003297785556534722] and parameters: {'n_layers': 4, 'embedding_dim': 256, 'lr': 0.0011183305289179514, 'lambda_val': 3.631129376685277e-06, 'batch_size': 3004, 'optimizer': 'SGD'}.
2026-06-17 10:18:27,738 - experiment_functions - INFO - Early stopping at epoch 550. Best Metrics: (0.0006289803709231785, 0.00012631047113805733, 0.0003198393164995715)
2026-06-17 10:18:27,871 - optuna.study.study - INFO - Trial 8 finished with values: [0.0006289803709231785, 0.00012631047113805733, 0.0003198393164995715] and parameters: {'n_layers': 4, 'embedding_dim': 64, 'lr': 5.227830469065037e-05, 'lambda_val': 0.026705485236178328, 'batch_size': 2370, 'optimizer': 'RMSprop'}.
2026-06-17 10:18:52,998 - experiment_functions - INFO - Early stopping at epoch 550. Best Metrics: (0.0023945178725174633, 0.0005826070481242896, 0.0015069942889870294)
2026-06-17 10:18:53,080 - optuna.study.study - INFO - Trial 9 finished with values: [0.0023945178725174633, 0.0005826070481242896, 0.0015069942889870294] and parameters: {'n_layers': 2, 'embedding_dim': 64, 'lr': 0.011697690387930714, 'lambda_val': 0.0010095160923301969, 'batch_size': 2025, 'optimizer': 'Adam'}.
2026-06-17 10:19:18,890 - experiment_functions - INFO - Early stopping at epoch 550. Best Metrics: (0.0031842987508802502, 0.000742074017936087, 0.0020124368458286288)
2026-06-17 10:19:18,982 - optuna.study.study - INFO - Trial 10 finished with values: [0.0031842987508802502, 0.000742074017936087, 0.0020124368458286288] and parameters: {'n_layers': 4, 'embedding_dim': 64, 'lr': 0.009567567424439887, 'lambda_val': 2.2853011169521347e-06, 'batch_size': 3141, 'optimizer': 'Adam'}.
2026-06-17 10:19:43,534 - experiment_functions - INFO - Early stopping at epoch 500. Best Metrics: (0.0005250398634394352, 0.0001278893520272831, 0.00028450005440705994)
2026-06-17 10:19:43,617 - optuna.study.study - INFO - Trial 11 finished with values: [0.0005250398634394352, 0.0001278893520272831, 0.00028450005440705994] and parameters: {'n_layers': 3, 'embedding_dim': 128, 'lr': 0.0009305633498128305, 'lambda_val': 1.0922879240964027e-05, 'batch_size': 705, 'optimizer': 'SGD'}.
2026-06-17 10:20:07,098 - experiment_functions - INFO - Early stopping at epoch 500. Best Metrics: (0.0005985285744398217, 0.0001405203991410888, 0.00033651498974226124)
2026-06-17 10:20:07,187 - optuna.study.study - INFO - Trial 12 finished with values: [0.0005985285744398217, 0.0001405203991410888, 0.00033651498974226124] and parameters: {'n_layers': 4, 'embedding_dim': 64, 'lr': 0.0008643514337665815, 'lambda_val': 0.0157499897510737, 'batch_size': 1034, 'optimizer': 'SGD'}.
2026-06-17 10:20:31,773 - experiment_functions - INFO - Early stopping at epoch 500. Best Metrics: (0.0005321090934064113, 0.00012315270935960593, 0.00030938045724655496)
2026-06-17 10:20:31,851 - optuna.study.study - INFO - Trial 13 finished with values: [0.0005321090934064113, 0.00012315270935960593, 0.00030938045724655496] and parameters: {'n_layers': 3, 'embedding_dim': 128, 'lr': 0.0068170522209423205, 'lambda_val': 0.03537987342277458, 'batch_size': 3337, 'optimizer': 'SGD'}.
2026-06-17 10:22:42,926 - experiment_functions - INFO - Early stopping at epoch 3150. Best Metrics: (0.003229392396961139, 0.000702601995705444, 0.0020470819030043454)
2026-06-17 10:22:43,024 - optuna.study.study - INFO - Trial 14 finished with values: [0.003229392396961139, 0.000702601995705444, 0.0020470819030043454] and parameters: {'n_layers': 1, 'embedding_dim': 96, 'lr': 0.0005773267382294165, 'lambda_val': 9.680731525938664e-06, 'batch_size': 3806, 'optimizer': 'RMSprop'}.
2026-06-17 10:23:05,620 - experiment_functions - INFO - Early stopping at epoch 500. Best Metrics: (0.0006576434253533121, 0.00014209928003031453, 0.0003452641529815186)
2026-06-17 10:23:05,702 - optuna.study.study - INFO - Trial 15 finished with values: [0.0006576434253533121, 0.00014209928003031453, 0.0003452641529815186] and parameters: {'n_layers': 2, 'embedding_dim': 32, 'lr': 0.0007216994691528258, 'lambda_val': 0.0011754311942332014, 'batch_size': 2022, 'optimizer': 'SGD'}.
2026-06-17 10:26:06,708 - optuna.study.study - INFO - Trial 16 finished with values: [0.0023421098661320335, 0.0005068207654414551, 0.0014955050034187523] and parameters: {'n_layers': 1, 'embedding_dim': 256, 'lr': 0.00032551897153632015, 'lambda_val': 4.480990319634202e-06, 'batch_size': 1677, 'optimizer': 'Adam'}.
2026-06-17 10:27:20,305 - experiment_functions - INFO - Early stopping at epoch 1650. Best Metrics: (0.0007011637329952523, 0.00014999368447644312, 0.0003945280645014524)
2026-06-17 10:27:20,374 - optuna.study.study - INFO - Trial 17 finished with values: [0.0007011637329952523, 0.00014999368447644312, 0.0003945280645014524] and parameters: {'n_layers': 2, 'embedding_dim': 128, 'lr': 2.228050329341483e-05, 'lambda_val': 0.00072513235438868, 'batch_size': 3624, 'optimizer': 'Adam'}.
2026-06-17 10:27:49,376 - experiment_functions - INFO - Early stopping at epoch 500. Best Metrics: (0.0021462143948883477, 0.0005778704054566124, 0.0014491193155859773)
2026-06-17 10:27:49,454 - optuna.study.study - INFO - Trial 18 finished with values: [0.0021462143948883477, 0.0005778704054566124, 0.0014491193155859773] and parameters: {'n_layers': 4, 'embedding_dim': 256, 'lr': 0.06248215068070222, 'lambda_val': 0.003295860410553125, 'batch_size': 1999, 'optimizer': 'RMSprop'}.
2026-06-17 10:28:13,093 - experiment_functions - INFO - Early stopping at epoch 500. Best Metrics: (0.0005791961898595272, 0.0001389415182518631, 0.0003276711708678007)
2026-06-17 10:28:13,177 - optuna.study.study - INFO - Trial 19 finished with values: [0.0005791961898595272, 0.0001389415182518631, 0.0003276711708678007] and parameters: {'n_layers': 4, 'embedding_dim': 64, 'lr': 0.0001123455506269706, 'lambda_val': 0.0003014053503940445, 'batch_size': 2971, 'optimizer': 'SGD'}.
2026-06-17 10:28:35,459 - experiment_functions - INFO - Early stopping at epoch 500. Best Metrics: (0.0004049750966911235, 0.00010420613868889732, 0.00023407842671311347)
2026-06-17 10:28:35,535 - optuna.study.study - INFO - Trial 20 finished with values: [0.0004049750966911235, 0.00010420613868889732, 0.00023407842671311347] and parameters: {'n_layers': 2, 'embedding_dim': 32, 'lr': 0.00012525005931727772, 'lambda_val': 0.00132326286461266, 'batch_size': 583, 'optimizer': 'SGD'}.
2026-06-17 10:29:00,917 - experiment_functions - INFO - Early stopping at epoch 500. Best Metrics: (0.00048675530835609333, 0.00011841606669192877, 0.0002916174857289698)
2026-06-17 10:29:01,009 - optuna.study.study - INFO - Trial 21 finished with values: [0.00048675530835609333, 0.00011841606669192877, 0.0002916174857289698] and parameters: {'n_layers': 4, 'embedding_dim': 128, 'lr': 0.04368862190874824, 'lambda_val': 1.3107624180719716e-06, 'batch_size': 2965, 'optimizer': 'SGD'}.
2026-06-17 10:30:58,111 - experiment_functions - INFO - Early stopping at epoch 2150. Best Metrics: (0.0033326127279907133, 0.0008983832259694329, 0.002032727879717637)
2026-06-17 10:30:58,205 - optuna.study.study - INFO - Trial 22 finished with values: [0.0033326127279907133, 0.0008983832259694329, 0.002032727879717637] and parameters: {'n_layers': 4, 'embedding_dim': 256, 'lr': 0.0005841453281578621, 'lambda_val': 1.0310836199436669e-05, 'batch_size': 3853, 'optimizer': 'RMSprop'}.
2026-06-17 10:31:28,352 - experiment_functions - INFO - Early stopping at epoch 650. Best Metrics: (0.001917647235073231, 0.0004973474801061009, 0.0012590494248652276)
2026-06-17 10:31:28,480 - optuna.study.study - INFO - Trial 23 finished with values: [0.001917647235073231, 0.0004973474801061009, 0.0012590494248652276] and parameters: {'n_layers': 4, 'embedding_dim': 64, 'lr': 0.09500174427276918, 'lambda_val': 1.9289997599017184e-06, 'batch_size': 3970, 'optimizer': 'RMSprop'}.
2026-06-17 10:31:56,974 - experiment_functions - INFO - Early stopping at epoch 500. Best Metrics: (0.0006153002851748663, 0.00013578375647341166, 0.0003862784474207923)
2026-06-17 10:31:57,068 - optuna.study.study - INFO - Trial 24 finished with values: [0.0006153002851748663, 0.00013578375647341166, 0.0003862784474207923] and parameters: {'n_layers': 4, 'embedding_dim': 256, 'lr': 6.112197042497074e-05, 'lambda_val': 0.06383370776268556, 'batch_size': 3371, 'optimizer': 'SGD'}.
2026-06-17 10:32:47,684 - experiment_functions - INFO - Early stopping at epoch 900. Best Metrics: (0.0031969377160986326, 0.0008210180623973727, 0.0019137554700393727)
2026-06-17 10:32:47,774 - optuna.study.study - INFO - Trial 25 finished with values: [0.0031969377160986326, 0.0008210180623973727, 0.0019137554700393727] and parameters: {'n_layers': 4, 'embedding_dim': 256, 'lr': 0.0013364645200376287, 'lambda_val': 0.00027668479073292746, 'batch_size': 3672, 'optimizer': 'Adam'}.
2026-06-17 10:33:12,038 - experiment_functions - INFO - Early stopping at epoch 500. Best Metrics: (0.0005932662238680328, 0.0001294682329165088, 0.00034557078474091116)
2026-06-17 10:33:12,110 - optuna.study.study - INFO - Trial 26 finished with values: [0.0005932662238680328, 0.0001294682329165088, 0.00034557078474091116] and parameters: {'n_layers': 1, 'embedding_dim': 256, 'lr': 2.4650104361041194e-05, 'lambda_val': 2.9540494163767325e-05, 'batch_size': 2586, 'optimizer': 'SGD'}.
2026-06-17 10:33:35,539 - experiment_functions - INFO - Early stopping at epoch 500. Best Metrics: (0.0006716233331843561, 0.0001389415182518631, 0.0003174871961092624)
2026-06-17 10:33:35,633 - optuna.study.study - INFO - Trial 27 finished with values: [0.0006716233331843561, 0.0001389415182518631, 0.0003174871961092624] and parameters: {'n_layers': 2, 'embedding_dim': 96, 'lr': 3.444990282270871e-05, 'lambda_val': 0.000306306444509694, 'batch_size': 3075, 'optimizer': 'SGD'}.
2026-06-17 10:34:00,156 - experiment_functions - INFO - Early stopping at epoch 500. Best Metrics: (0.0005075419828421312, 0.00011525830491347732, 0.000269887022978105)
2026-06-17 10:34:00,246 - optuna.study.study - INFO - Trial 28 finished with values: [0.0005075419828421312, 0.00011525830491347732, 0.000269887022978105] and parameters: {'n_layers': 3, 'embedding_dim': 64, 'lr': 0.07756730863323266, 'lambda_val': 1.6786230640835934e-06, 'batch_size': 2565, 'optimizer': 'SGD'}.
2026-06-17 10:34:50,803 - experiment_functions - INFO - Early stopping at epoch 1200. Best Metrics: (0.003211349540199201, 0.0006978653530377669, 0.0018915641753121677)
2026-06-17 10:34:50,893 - optuna.study.study - INFO - Trial 29 finished with values: [0.003211349540199201, 0.0006978653530377669, 0.0018915641753121677] and parameters: {'n_layers': 1, 'embedding_dim': 64, 'lr': 0.0009353759827353638, 'lambda_val': 0.0004867376939360758, 'batch_size': 3002, 'optimizer': 'RMSprop'}.
2026-06-17 10:37:48,277 - optuna.study.study - INFO - Trial 30 finished with values: [0.0007440192169244929, 0.00017999242137173172, 0.00043285833090930386] and parameters: {'n_layers': 4, 'embedding_dim': 96, 'lr': 4.3357126095573705e-05, 'lambda_val': 5.822400221399476e-06, 'batch_size': 3081, 'optimizer': 'RMSprop'}.
2026-06-17 10:38:57,007 - experiment_functions - INFO - Early stopping at epoch 1400. Best Metrics: (0.002785973145223262, 0.0007420740179360869, 0.0018171884825270233)
2026-06-17 10:38:57,078 - optuna.study.study - INFO - Trial 31 finished with values: [0.002785973145223262, 0.0007420740179360869, 0.0018171884825270233] and parameters: {'n_layers': 2, 'embedding_dim': 256, 'lr': 0.004071349079274372, 'lambda_val': 1.8109663387347854e-06, 'batch_size': 3073, 'optimizer': 'RMSprop'}.
2026-06-17 10:41:40,785 - optuna.study.study - INFO - Trial 32 finished with values: [0.0005884538685563989, 0.0001310471138057345, 0.00031890205698786357] and parameters: {'n_layers': 1, 'embedding_dim': 96, 'lr': 2.4301074367808295e-05, 'lambda_val': 5.934233012932309e-06, 'batch_size': 1992, 'optimizer': 'Adam'}.
2026-06-17 10:42:38,570 - experiment_functions - INFO - Early stopping at epoch 1350. Best Metrics: (0.0029280367504094813, 0.0006820765441455097, 0.0018239835871390387)
2026-06-17 10:42:38,656 - optuna.study.study - INFO - Trial 33 finished with values: [0.0029280367504094813, 0.0006820765441455097, 0.0018239835871390387] and parameters: {'n_layers': 2, 'embedding_dim': 64, 'lr': 0.0014337059824812508, 'lambda_val': 0.00012072062045747035, 'batch_size': 4027, 'optimizer': 'Adam'}.
2026-06-17 10:43:07,710 - experiment_functions - INFO - Early stopping at epoch 500. Best Metrics: (0.0005394676903935841, 0.0001215738284703802, 0.0002890594304024841)
2026-06-17 10:43:07,780 - optuna.study.study - INFO - Trial 34 finished with values: [0.0005394676903935841, 0.0001215738284703802, 0.0002890594304024841] and parameters: {'n_layers': 4, 'embedding_dim': 256, 'lr': 1.0175424050697168e-05, 'lambda_val': 0.07164269953446842, 'batch_size': 2518, 'optimizer': 'RMSprop'}.
2026-06-17 10:43:32,825 - experiment_functions - INFO - Early stopping at epoch 500. Best Metrics: (0.0004755200838507297, 0.00011841606669192877, 0.0002582821690373371)
2026-06-17 10:43:32,913 - optuna.study.study - INFO - Trial 35 finished with values: [0.0004755200838507297, 0.00011841606669192877, 0.0002582821690373371] and parameters: {'n_layers': 4, 'embedding_dim': 128, 'lr': 0.00027249157181758057, 'lambda_val': 5.152736063808046e-06, 'batch_size': 3829, 'optimizer': 'SGD'}.
2026-06-17 10:44:24,162 - experiment_functions - INFO - Early stopping at epoch 1200. Best Metrics: (0.001901648788583743, 0.0005478716685613238, 0.0011886678154740084)
2026-06-17 10:44:24,249 - optuna.study.study - INFO - Trial 36 finished with values: [0.001901648788583743, 0.0005478716685613238, 0.0011886678154740084] and parameters: {'n_layers': 1, 'embedding_dim': 96, 'lr': 0.035358354378745425, 'lambda_val': 0.04688879328088187, 'batch_size': 1067, 'optimizer': 'RMSprop'}.
2026-06-17 10:44:59,927 - experiment_functions - INFO - Early stopping at epoch 700. Best Metrics: (0.0028432697601419215, 0.0007436528988253126, 0.0017615918854549132)
2026-06-17 10:45:00,023 - optuna.study.study - INFO - Trial 37 finished with values: [0.0028432697601419215, 0.0007436528988253126, 0.0017615918854549132] and parameters: {'n_layers': 2, 'embedding_dim': 256, 'lr': 0.005427188960178344, 'lambda_val': 7.067730208761557e-06, 'batch_size': 2754, 'optimizer': 'RMSprop'}.
2026-06-17 10:45:25,724 - experiment_functions - INFO - Early stopping at epoch 500. Best Metrics: (0.0005313340068153173, 0.00011841606669192877, 0.0002845753262354707)
2026-06-17 10:45:25,802 - optuna.study.study - INFO - Trial 38 finished with values: [0.0005313340068153173, 0.00011841606669192877, 0.0002845753262354707] and parameters: {'n_layers': 2, 'embedding_dim': 256, 'lr': 0.0059130773813250445, 'lambda_val': 0.0006520933628630919, 'batch_size': 1423, 'optimizer': 'SGD'}.
2026-06-17 10:48:30,326 - optuna.study.study - INFO - Trial 39 finished with values: [0.0030073301312048464, 0.0007120752810407984, 0.001979147470083209] and parameters: {'n_layers': 4, 'embedding_dim': 128, 'lr': 0.00034156278403462873, 'lambda_val': 0.002174949430049739, 'batch_size': 934, 'optimizer': 'Adam'}.
2026-06-17 10:48:57,318 - experiment_functions - INFO - Early stopping at epoch 500. Best Metrics: (0.0003537992950253393, 8.210180623973729e-05, 0.00019561816096070751)
2026-06-17 10:48:57,404 - optuna.study.study - INFO - Trial 40 finished with values: [0.0003537992950253393, 8.210180623973729e-05, 0.00019561816096070751] and parameters: {'n_layers': 3, 'embedding_dim': 256, 'lr': 3.185410356727837e-05, 'lambda_val': 0.06761963473143826, 'batch_size': 552, 'optimizer': 'SGD'}.
2026-06-17 10:51:19,735 - experiment_functions - INFO - Early stopping at epoch 3500. Best Metrics: (0.0019352663342064992, 0.00043419224453707214, 0.0012223244469647151)
2026-06-17 10:51:19,812 - optuna.study.study - INFO - Trial 41 finished with values: [0.0019352663342064992, 0.00043419224453707214, 0.0012223244469647151] and parameters: {'n_layers': 3, 'embedding_dim': 32, 'lr': 0.00019981610471907728, 'lambda_val': 0.006803754413438597, 'batch_size': 1467, 'optimizer': 'Adam'}.
2026-06-17 10:51:42,590 - experiment_functions - INFO - Early stopping at epoch 500. Best Metrics: (0.0005362293869843748, 0.00011367942402425163, 0.00029990450426888444)
2026-06-17 10:51:42,667 - optuna.study.study - INFO - Trial 42 finished with values: [0.0005362293869843748, 0.00011367942402425163, 0.00029990450426888444] and parameters: {'n_layers': 4, 'embedding_dim': 32, 'lr': 0.0036738847664304483, 'lambda_val': 0.026401742926126893, 'batch_size': 2823, 'optimizer': 'SGD'}.
2026-06-17 10:54:32,838 - optuna.study.study - INFO - Trial 43 finished with values: [0.0030561264085889684, 0.0006789187823670582, 0.001816764657966052] and parameters: {'n_layers': 2, 'embedding_dim': 96, 'lr': 0.00035885552475151193, 'lambda_val': 6.36485192314748e-05, 'batch_size': 4010, 'optimizer': 'RMSprop'}.
2026-06-17 10:57:18,641 - optuna.study.study - INFO - Trial 44 finished with values: [0.0014976151141372893, 0.00032998610584817484, 0.0008166041169664529] and parameters: {'n_layers': 1, 'embedding_dim': 96, 'lr': 0.0001269804893438298, 'lambda_val': 5.710789183812623e-06, 'batch_size': 3031, 'optimizer': 'Adam'}.
2026-06-17 11:00:19,874 - optuna.study.study - INFO - Trial 45 finished with values: [0.0019059271721017007, 0.0005068207654414551, 0.0012559282697750692] and parameters: {'n_layers': 1, 'embedding_dim': 256, 'lr': 0.0005086943405728801, 'lambda_val': 0.013595627652556418, 'batch_size': 1308, 'optimizer': 'Adam'}.
2026-06-17 11:00:45,242 - experiment_functions - INFO - Early stopping at epoch 550. Best Metrics: (0.0025610678685660136, 0.0005683971201212582, 0.0015752048333408134)
2026-06-17 11:00:45,328 - optuna.study.study - INFO - Trial 46 finished with values: [0.0025610678685660136, 0.0005683971201212582, 0.0015752048333408134] and parameters: {'n_layers': 1, 'embedding_dim': 96, 'lr': 0.010547366503973673, 'lambda_val': 3.399802510238604e-06, 'batch_size': 3274, 'optimizer': 'Adam'}.
2026-06-17 11:01:49,604 - experiment_functions - INFO - Early stopping at epoch 1300. Best Metrics: (0.0005947595221879922, 0.0001310471138057345, 0.00031531241238516453)
2026-06-17 11:01:49,684 - optuna.study.study - INFO - Trial 47 finished with values: [0.0005947595221879922, 0.0001310471138057345, 0.00031531241238516453] and parameters: {'n_layers': 2, 'embedding_dim': 256, 'lr': 2.375103917577605e-05, 'lambda_val': 0.000569768492820892, 'batch_size': 2688, 'optimizer': 'Adam'}.
2026-06-17 11:02:15,551 - experiment_functions - INFO - Early stopping at epoch 500. Best Metrics: (0.000590909843533523, 0.00012631047113805733, 0.0003367102261704118)
2026-06-17 11:02:15,636 - optuna.study.study - INFO - Trial 48 finished with values: [0.000590909843533523, 0.00012631047113805733, 0.0003367102261704118] and parameters: {'n_layers': 2, 'embedding_dim': 256, 'lr': 0.002745231431125206, 'lambda_val': 4.001173664766538e-06, 'batch_size': 918, 'optimizer': 'SGD'}.
2026-06-17 11:03:03,417 - experiment_functions - INFO - Early stopping at epoch 850. Best Metrics: (0.002710908472250549, 0.000702601995705444, 0.0016538954659422068)
2026-06-17 11:03:03,495 - optuna.study.study - INFO - Trial 49 finished with values: [0.002710908472250549, 0.000702601995705444, 0.0016538954659422068] and parameters: {'n_layers': 4, 'embedding_dim': 256, 'lr': 0.0005022810002171992, 'lambda_val': 0.008714902788854104, 'batch_size': 3719, 'optimizer': 'RMSprop'}.
2026-06-17 11:04:02,812 - experiment_functions - INFO - Early stopping at epoch 1050. Best Metrics: (0.0033506925273473283, 0.0008825944170771757, 0.00214182902096171)
2026-06-17 11:04:02,906 - optuna.study.study - INFO - Trial 50 finished with values: [0.0033506925273473283, 0.0008825944170771757, 0.00214182902096171] and parameters: {'n_layers': 4, 'embedding_dim': 256, 'lr': 0.0013364645200376287, 'lambda_val': 0.00027668479073292746, 'batch_size': 815, 'optimizer': 'Adam'}.
2026-06-17 11:07:05,421 - optuna.study.study - INFO - Trial 51 finished with values: [0.0024977291544962263, 0.0005841859290135152, 0.0015162268028683285] and parameters: {'n_layers': 1, 'embedding_dim': 256, 'lr': 0.00032551897153632015, 'lambda_val': 0.0015370356378349003, 'batch_size': 3274, 'optimizer': 'Adam'}.
2026-06-17 11:07:31,327 - experiment_functions - INFO - Early stopping at epoch 550. Best Metrics: (0.0025467200159365166, 0.0006994442339269926, 0.0017409631741943667)
2026-06-17 11:07:31,441 - optuna.study.study - INFO - Trial 52 finished with values: [0.0025467200159365166, 0.0006994442339269926, 0.0017409631741943667] and parameters: {'n_layers': 4, 'embedding_dim': 64, 'lr': 0.010547366503973673, 'lambda_val': 3.399802510238604e-06, 'batch_size': 2971, 'optimizer': 'RMSprop'}.
2026-06-17 11:07:54,172 - experiment_functions - INFO - Early stopping at epoch 500. Best Metrics: (0.0003668624757434085, 0.00010736390046734874, 0.00022153341253996895)
2026-06-17 11:07:54,254 - optuna.study.study - INFO - Trial 53 finished with values: [0.0003668624757434085, 0.00010736390046734874, 0.00022153341253996895] and parameters: {'n_layers': 4, 'embedding_dim': 32, 'lr': 2.188613111350502e-05, 'lambda_val': 0.026401742926126893, 'batch_size': 2823, 'optimizer': 'SGD'}.
2026-06-17 11:08:22,073 - experiment_functions - INFO - Early stopping at epoch 500. Best Metrics: (0.0018163249144376695, 0.000491031956549198, 0.0012535303366411977)
2026-06-17 11:08:22,162 - optuna.study.study - INFO - Trial 54 finished with values: [0.0018163249144376695, 0.000491031956549198, 0.0012535303366411977] and parameters: {'n_layers': 3, 'embedding_dim': 256, 'lr': 0.029362518465523478, 'lambda_val': 0.007077349748530695, 'batch_size': 1901, 'optimizer': 'RMSprop'}.
2026-06-17 11:08:49,198 - experiment_functions - INFO - Early stopping at epoch 500. Best Metrics: (0.0005856614279210673, 0.00012315270935960593, 0.0003213372387256734)
