2026-06-22 02:07:36,206 - optuna.study.study - INFO - Trial 261 finished with values: [0.01178010849736275, 0.0029888215233042823, 0.007095325665375203] and parameters: {'n_layers': 4, 'embedding_dim': 128, 'lr': 0.000927601540662843, 'lambda_val': 1.1454689220118589e-06, 'batch_size': 1169, 'optimizer': 'RMSprop'}.
2026-06-22 02:07:58,080 - experiment_functions - INFO - Early stopping at epoch 500. Best Metrics: (0.0005349279877222236, 0.00012473159024883163, 0.0003252173635282615)
2026-06-22 02:07:58,171 - optuna.study.study - INFO - Trial 262 finished with values: [0.0005349279877222236, 0.00012473159024883163, 0.0003252173635282615] and parameters: {'n_layers': 4, 'embedding_dim': 32, 'lr': 0.000927601540662843, 'lambda_val': 1.1454689220118589e-06, 'batch_size': 2127, 'optimizer': 'SGD'}.
2026-06-22 02:08:48,265 - experiment_functions - INFO - Early stopping at epoch 1200. Best Metrics: (0.009739868398544816, 0.0024883162814197295, 0.005916959516075034)
2026-06-22 02:08:48,336 - optuna.study.study - INFO - Trial 263 finished with values: [0.009739868398544816, 0.0024883162814197295, 0.005916959516075034] and parameters: {'n_layers': 4, 'embedding_dim': 32, 'lr': 0.000927601540662843, 'lambda_val': 0.00652901288318178, 'batch_size': 1988, 'optimizer': 'RMSprop'}.
2026-06-22 02:09:16,582 - experiment_functions - INFO - Early stopping at epoch 650. Best Metrics: (0.005702971851174732, 0.0015362511052166227, 0.0034346486135958683)
2026-06-22 02:09:16,666 - optuna.study.study - INFO - Trial 264 finished with values: [0.005702971851174732, 0.0015362511052166227, 0.0034346486135958683] and parameters: {'n_layers': 4, 'embedding_dim': 32, 'lr': 0.002103872362755323, 'lambda_val': 0.018975293834085437, 'batch_size': 1925, 'optimizer': 'RMSprop'}.
2026-06-22 02:11:10,997 - experiment_functions - INFO - Early stopping at epoch 2800. Best Metrics: (0.012850090962200736, 0.0031198686371100167, 0.0076814173181856925)
2026-06-22 02:11:11,083 - optuna.study.study - INFO - Trial 265 finished with values: [0.012850090962200736, 0.0031198686371100167, 0.0076814173181856925] and parameters: {'n_layers': 4, 'embedding_dim': 32, 'lr': 0.000927601540662843, 'lambda_val': 0.0009695798239708334, 'batch_size': 1169, 'optimizer': 'RMSprop'}.
2026-06-22 02:12:06,437 - experiment_functions - INFO - Early stopping at epoch 1150. Best Metrics: (0.011113590923469278, 0.002826196791714033, 0.006748261875741884)
2026-06-22 02:12:06,522 - optuna.study.study - INFO - Trial 266 finished with values: [0.011113590923469278, 0.002826196791714033, 0.006748261875741884] and parameters: {'n_layers': 4, 'embedding_dim': 128, 'lr': 0.000927601540662843, 'lambda_val': 0.0011958935689814394, 'batch_size': 1169, 'optimizer': 'RMSprop'}.
2026-06-22 02:12:44,645 - experiment_functions - INFO - Early stopping at epoch 900. Best Metrics: (0.006011691113053514, 0.0016499305292408742, 0.003559242136145935)
2026-06-22 02:12:44,746 - optuna.study.study - INFO - Trial 267 finished with values: [0.006011691113053514, 0.0016499305292408742, 0.003559242136145935] and parameters: {'n_layers': 4, 'embedding_dim': 32, 'lr': 0.0012083421906459303, 'lambda_val': 0.03778518406138671, 'batch_size': 2080, 'optimizer': 'Adam'}.
2026-06-22 02:13:51,465 - experiment_functions - INFO - Early stopping at epoch 1650. Best Metrics: (0.0006120820864943208, 0.00011999494758115448, 0.0003004055479480544)
2026-06-22 02:13:51,541 - optuna.study.study - INFO - Trial 268 finished with values: [0.0006120820864943208, 0.00011999494758115448, 0.0003004055479480544] and parameters: {'n_layers': 4, 'embedding_dim': 32, 'lr': 1.0694046381363192e-05, 'lambda_val': 1.1454689220118589e-06, 'batch_size': 1169, 'optimizer': 'RMSprop'}.
2026-06-22 02:14:47,954 - experiment_functions - INFO - Early stopping at epoch 1350. Best Metrics: (0.011840078929607244, 0.0030077680939749906, 0.007345343861670646)
2026-06-22 02:14:48,041 - optuna.study.study - INFO - Trial 269 finished with values: [0.011840078929607244, 0.0030077680939749906, 0.007345343861670646] and parameters: {'n_layers': 4, 'embedding_dim': 32, 'lr': 0.0012083421906459303, 'lambda_val': 1.1454689220118589e-06, 'batch_size': 1658, 'optimizer': 'RMSprop'}.
2026-06-22 02:15:14,144 - experiment_functions - INFO - Early stopping at epoch 600. Best Metrics: (0.00299830281544081, 0.0007010231148162183, 0.0019424275063865608)
2026-06-22 02:15:14,230 - optuna.study.study - INFO - Trial 270 finished with values: [0.00299830281544081, 0.0007010231148162183, 0.0019424275063865608] and parameters: {'n_layers': 4, 'embedding_dim': 32, 'lr': 0.07409188653035345, 'lambda_val': 1.1454689220118589e-06, 'batch_size': 835, 'optimizer': 'RMSprop'}.
2026-06-22 02:16:02,816 - experiment_functions - INFO - Early stopping at epoch 1150. Best Metrics: (0.012264516905710234, 0.0030156624984211196, 0.007128798765437815)
2026-06-22 02:16:02,914 - optuna.study.study - INFO - Trial 271 finished with values: [0.012264516905710234, 0.0030156624984211196, 0.007128798765437815] and parameters: {'n_layers': 4, 'embedding_dim': 32, 'lr': 0.002042824336043298, 'lambda_val': 0.0011958935689814394, 'batch_size': 569, 'optimizer': 'RMSprop'}.
2026-06-22 02:16:55,548 - experiment_functions - INFO - Early stopping at epoch 1100. Best Metrics: (0.010135461150199601, 0.0026430466085638504, 0.006177167659847194)
2026-06-22 02:16:55,626 - optuna.study.study - INFO - Trial 272 finished with values: [0.010135461150199601, 0.0026430466085638504, 0.006177167659847194] and parameters: {'n_layers': 4, 'embedding_dim': 128, 'lr': 0.000927601540662843, 'lambda_val': 0.0011958935689814394, 'batch_size': 1517, 'optimizer': 'RMSprop'}.
2026-06-22 02:17:57,749 - experiment_functions - INFO - Early stopping at epoch 1100. Best Metrics: (0.011195839291776486, 0.0028025135783756473, 0.006691603504445009)
2026-06-22 02:17:57,826 - optuna.study.study - INFO - Trial 273 finished with values: [0.011195839291776486, 0.0028025135783756473, 0.006691603504445009] and parameters: {'n_layers': 4, 'embedding_dim': 256, 'lr': 0.000927601540662843, 'lambda_val': 1.1454689220118589e-06, 'batch_size': 1169, 'optimizer': 'RMSprop'}.
2026-06-22 02:19:49,528 - experiment_functions - INFO - Early stopping at epoch 2700. Best Metrics: (0.014795498962592838, 0.0035414298345332828, 0.0089506484408849)
2026-06-22 02:19:49,611 - optuna.study.study - INFO - Trial 274 finished with values: [0.014795498962592838, 0.0035414298345332828, 0.0089506484408849] and parameters: {'n_layers': 4, 'embedding_dim': 32, 'lr': 0.0012083421906459303, 'lambda_val': 0.00014399990454015351, 'batch_size': 622, 'optimizer': 'RMSprop'}.
2026-06-22 02:20:53,665 - experiment_functions - INFO - Early stopping at epoch 1550. Best Metrics: (0.011764649058349641, 0.0029351395730706077, 0.0071592341425623296)
2026-06-22 02:20:53,752 - optuna.study.study - INFO - Trial 275 finished with values: [0.011764649058349641, 0.0029351395730706077, 0.0071592341425623296] and parameters: {'n_layers': 4, 'embedding_dim': 32, 'lr': 0.000927601540662843, 'lambda_val': 0.0011958935689814394, 'batch_size': 1931, 'optimizer': 'RMSprop'}.
2026-06-22 02:22:03,920 - experiment_functions - INFO - Early stopping at epoch 1700. Best Metrics: (0.010538586542986792, 0.0026272577996715933, 0.006283470898240086)
2026-06-22 02:22:03,996 - optuna.study.study - INFO - Trial 276 finished with values: [0.010538586542986792, 0.0026272577996715933, 0.006283470898240086] and parameters: {'n_layers': 4, 'embedding_dim': 32, 'lr': 0.000927601540662843, 'lambda_val': 1.1454689220118589e-06, 'batch_size': 4063, 'optimizer': 'RMSprop'}.
2026-06-22 02:24:45,892 - optuna.study.study - INFO - Trial 277 finished with values: [0.01223783045950859, 0.0029509283819628648, 0.007453847331565487] and parameters: {'n_layers': 4, 'embedding_dim': 32, 'lr': 0.0006084514258113753, 'lambda_val': 1.1454689220118589e-06, 'batch_size': 1824, 'optimizer': 'RMSprop'}.
2026-06-22 02:27:29,018 - optuna.study.study - INFO - Trial 278 finished with values: [0.00491437701109465, 0.0011004799797903247, 0.0030144630687792876] and parameters: {'n_layers': 1, 'embedding_dim': 128, 'lr': 0.0007483728360217162, 'lambda_val': 0.0003952312828567359, 'batch_size': 1169, 'optimizer': 'RMSprop'}.
2026-06-22 02:28:47,883 - experiment_functions - INFO - Early stopping at epoch 1900. Best Metrics: (0.014343689704224128, 0.003448275862068966, 0.008512918036694354)
2026-06-22 02:28:47,959 - optuna.study.study - INFO - Trial 279 finished with values: [0.014343689704224128, 0.003448275862068966, 0.008512918036694354] and parameters: {'n_layers': 4, 'embedding_dim': 32, 'lr': 0.0012083421906459303, 'lambda_val': 0.0011958935689814394, 'batch_size': 622, 'optimizer': 'RMSprop'}.
2026-06-22 02:29:36,761 - experiment_functions - INFO - Early stopping at epoch 1050. Best Metrics: (0.0110827440943891, 0.002704622963243653, 0.006598615849761744)
2026-06-22 02:29:36,842 - optuna.study.study - INFO - Trial 280 finished with values: [0.0110827440943891, 0.002704622963243653, 0.006598615849761744] and parameters: {'n_layers': 4, 'embedding_dim': 96, 'lr': 0.0008655839340917536, 'lambda_val': 3.472440378289578e-05, 'batch_size': 3404, 'optimizer': 'RMSprop'}.
2026-06-22 02:30:47,121 - experiment_functions - INFO - Early stopping at epoch 1700. Best Metrics: (0.010158409120991991, 0.0025183150183150185, 0.006056436749762896)
2026-06-22 02:30:47,213 - optuna.study.study - INFO - Trial 281 finished with values: [0.010158409120991991, 0.0025183150183150185, 0.006056436749762896] and parameters: {'n_layers': 4, 'embedding_dim': 32, 'lr': 0.000927601540662843, 'lambda_val': 0.00014399990454015351, 'batch_size': 4011, 'optimizer': 'RMSprop'}.
2026-06-22 02:31:25,707 - experiment_functions - INFO - Early stopping at epoch 900. Best Metrics: (0.01005000970917276, 0.0026177845143362387, 0.0061405581751406545)
2026-06-22 02:31:25,812 - optuna.study.study - INFO - Trial 282 finished with values: [0.01005000970917276, 0.0026177845143362387, 0.0061405581751406545] and parameters: {'n_layers': 4, 'embedding_dim': 32, 'lr': 0.002103872362755323, 'lambda_val': 1.1454689220118589e-06, 'batch_size': 1517, 'optimizer': 'RMSprop'}.
2026-06-22 02:32:14,128 - experiment_functions - INFO - Early stopping at epoch 1050. Best Metrics: (0.01060051775052413, 0.0027109384868005556, 0.006392707337977736)
2026-06-22 02:32:14,204 - optuna.study.study - INFO - Trial 283 finished with values: [0.01060051775052413, 0.0027109384868005556, 0.006392707337977736] and parameters: {'n_layers': 4, 'embedding_dim': 96, 'lr': 0.000927601540662843, 'lambda_val': 0.0011958935689814394, 'batch_size': 2172, 'optimizer': 'RMSprop'}.
2026-06-22 02:33:22,305 - experiment_functions - INFO - Early stopping at epoch 1650. Best Metrics: (0.011972805225988413, 0.002894088669950739, 0.007146870168672891)
2026-06-22 02:33:22,389 - optuna.study.study - INFO - Trial 284 finished with values: [0.011972805225988413, 0.002894088669950739, 0.007146870168672891] and parameters: {'n_layers': 4, 'embedding_dim': 32, 'lr': 0.000927601540662843, 'lambda_val': 0.0011958935689814394, 'batch_size': 1931, 'optimizer': 'RMSprop'}.
2026-06-22 02:34:24,789 - experiment_functions - INFO - Early stopping at epoch 1500. Best Metrics: (0.011100494927235856, 0.002717254010357459, 0.006777564906977027)
2026-06-22 02:34:24,861 - optuna.study.study - INFO - Trial 285 finished with values: [0.011100494927235856, 0.002717254010357459, 0.006777564906977027] and parameters: {'n_layers': 4, 'embedding_dim': 32, 'lr': 0.000927601540662843, 'lambda_val': 0.0009695798239708334, 'batch_size': 2677, 'optimizer': 'RMSprop'}.
2026-06-22 02:34:47,033 - experiment_functions - INFO - Early stopping at epoch 500. Best Metrics: (0.0004989470790375195, 0.00011052166224580018, 0.0002678277602982151)
2026-06-22 02:34:47,136 - optuna.study.study - INFO - Trial 286 finished with values: [0.0004989470790375195, 0.00011052166224580018, 0.0002678277602982151] and parameters: {'n_layers': 4, 'embedding_dim': 32, 'lr': 0.002103872362755323, 'lambda_val': 0.0011958935689814394, 'batch_size': 1658, 'optimizer': 'SGD'}.
2026-06-22 02:37:21,990 - optuna.study.study - INFO - Trial 287 finished with values: [0.0045322153803840776, 0.000997852721990653, 0.0027958919157406214] and parameters: {'n_layers': 1, 'embedding_dim': 32, 'lr': 0.0008655839340917536, 'lambda_val': 0.00014399990454015351, 'batch_size': 835, 'optimizer': 'RMSprop'}.
2026-06-22 02:40:06,041 - optuna.study.study - INFO - Trial 288 finished with values: [0.0053670762094791356, 0.0012236326891499306, 0.0033120699899397165] and parameters: {'n_layers': 1, 'embedding_dim': 128, 'lr': 0.000927601540662843, 'lambda_val': 1.1454689220118589e-06, 'batch_size': 1169, 'optimizer': 'RMSprop'}.
2026-06-22 02:40:30,009 - experiment_functions - INFO - Early stopping at epoch 550. Best Metrics: (0.003700884188318174, 0.0009283819628647216, 0.0022971616984270803)
2026-06-22 02:40:30,141 - optuna.study.study - INFO - Trial 289 finished with values: [0.003700884188318174, 0.0009283819628647216, 0.0022971616984270803] and parameters: {'n_layers': 3, 'embedding_dim': 32, 'lr': 0.02133020829557788, 'lambda_val': 1.1454689220118589e-06, 'batch_size': 1169, 'optimizer': 'RMSprop'}.
2026-06-22 02:42:11,092 - experiment_functions - INFO - Early stopping at epoch 2450. Best Metrics: (0.012976624628577333, 0.003175129468232916, 0.007751646725966282)
2026-06-22 02:42:11,183 - optuna.study.study - INFO - Trial 290 finished with values: [0.012976624628577333, 0.003175129468232916, 0.007751646725966282] and parameters: {'n_layers': 4, 'embedding_dim': 32, 'lr': 0.000927601540662843, 'lambda_val': 4.130883569433713e-05, 'batch_size': 1658, 'optimizer': 'RMSprop'}.
2026-06-22 02:43:50,667 - experiment_functions - INFO - Early stopping at epoch 2100. Best Metrics: (0.013275203106997447, 0.0032240747757989133, 0.007894244996286687)
2026-06-22 02:43:50,750 - optuna.study.study - INFO - Trial 291 finished with values: [0.013275203106997447, 0.0032240747757989133, 0.007894244996286687] and parameters: {'n_layers': 4, 'embedding_dim': 128, 'lr': 0.000927601540662843, 'lambda_val': 1.1454689220118589e-06, 'batch_size': 928, 'optimizer': 'RMSprop'}.
2026-06-22 02:44:17,085 - experiment_functions - INFO - Early stopping at epoch 600. Best Metrics: (0.0005729437770298295, 0.00013262599469496023, 0.0003243964804356124)
2026-06-22 02:44:17,172 - optuna.study.study - INFO - Trial 292 finished with values: [0.0005729437770298295, 0.00013262599469496023, 0.0003243964804356124] and parameters: {'n_layers': 4, 'embedding_dim': 32, 'lr': 1.5178109375744045e-05, 'lambda_val': 1.4463129473968207e-05, 'batch_size': 1658, 'optimizer': 'RMSprop'}.
2026-06-22 02:45:26,191 - experiment_functions - INFO - Early stopping at epoch 1450. Best Metrics: (0.011618767468483787, 0.0029888215233042823, 0.007137636845880599)
2026-06-22 02:45:26,255 - optuna.study.study - INFO - Trial 293 finished with values: [0.011618767468483787, 0.0029888215233042823, 0.007137636845880599] and parameters: {'n_layers': 4, 'embedding_dim': 128, 'lr': 0.000927601540662843, 'lambda_val': 1.1454689220118589e-06, 'batch_size': 1169, 'optimizer': 'RMSprop'}.
2026-06-22 02:47:29,113 - experiment_functions - INFO - Early stopping at epoch 3000. Best Metrics: (0.011150387467897437, 0.002745673866363521, 0.006764683789296627)
2026-06-22 02:47:29,191 - optuna.study.study - INFO - Trial 294 finished with values: [0.011150387467897437, 0.002745673866363521, 0.006764683789296627] and parameters: {'n_layers': 4, 'embedding_dim': 32, 'lr': 0.0005928351587802508, 'lambda_val': 4.130883569433713e-05, 'batch_size': 3404, 'optimizer': 'RMSprop'}.
2026-06-22 02:48:15,735 - experiment_functions - INFO - Early stopping at epoch 1050. Best Metrics: (0.00955417606410831, 0.0024014778325123155, 0.00577881584422062)
2026-06-22 02:48:15,813 - optuna.study.study - INFO - Trial 295 finished with values: [0.00955417606410831, 0.0024014778325123155, 0.00577881584422062] and parameters: {'n_layers': 4, 'embedding_dim': 64, 'lr': 0.000927601540662843, 'lambda_val': 0.0009695798239708334, 'batch_size': 3725, 'optimizer': 'RMSprop'}.
2026-06-22 02:49:07,549 - experiment_functions - INFO - Early stopping at epoch 1250. Best Metrics: (0.009052278950143412, 0.002316218264494127, 0.005766479885907349)
2026-06-22 02:49:07,632 - optuna.study.study - INFO - Trial 296 finished with values: [0.009052278950143412, 0.002316218264494127, 0.005766479885907349] and parameters: {'n_layers': 3, 'embedding_dim': 32, 'lr': 0.000927601540662843, 'lambda_val': 0.002621159096093116, 'batch_size': 3738, 'optimizer': 'RMSprop'}.
2026-06-22 02:49:33,622 - experiment_functions - INFO - Early stopping at epoch 600. Best Metrics: (0.006628939324087118, 0.0016530882910193252, 0.003864219937949659)
2026-06-22 02:49:33,699 - optuna.study.study - INFO - Trial 297 finished with values: [0.006628939324087118, 0.0016530882910193252, 0.003864219937949659] and parameters: {'n_layers': 3, 'embedding_dim': 32, 'lr': 0.006322696435485476, 'lambda_val': 0.0009695798239708334, 'batch_size': 1389, 'optimizer': 'RMSprop'}.
2026-06-22 02:52:03,324 - experiment_functions - INFO - Early stopping at epoch 3800. Best Metrics: (0.0007048930495708622, 0.00015315144625489453, 0.0003909808807192443)
2026-06-22 02:52:03,396 - optuna.study.study - INFO - Trial 298 finished with values: [0.0007048930495708622, 0.00015315144625489453, 0.0003909808807192443] and parameters: {'n_layers': 4, 'embedding_dim': 32, 'lr': 2.2543924522753077e-05, 'lambda_val': 1.5907426738824427e-06, 'batch_size': 576, 'optimizer': 'Adam'}.
2026-06-22 02:52:27,441 - experiment_functions - INFO - Early stopping at epoch 550. Best Metrics: (0.004210632633038317, 0.001032588101553619, 0.0025267780012394924)
2026-06-22 02:52:27,573 - optuna.study.study - INFO - Trial 299 finished with values: [0.004210632633038317, 0.001032588101553619, 0.0025267780012394924] and parameters: {'n_layers': 4, 'embedding_dim': 32, 'lr': 0.02022309001876916, 'lambda_val': 1.2167191414599908e-06, 'batch_size': 2080, 'optimizer': 'RMSprop'}.
2026-06-22 02:52:27,588 - root - INFO - Selected Trial 243 based on Max ndcg: 0.0094
2026-06-22 02:52:27,588 - root - INFO - Associated Recall: 0.0152
2026-06-22 02:52:27,588 - experiment_functions - INFO - Training the best model ... for e_yelp_1c2dcs_strict_rand5
2026-06-22 02:54:16,302 - experiment_functions - INFO - Early stopping at epoch 2450. Best Metrics: (0.014575622422763822, 0.003580901856763926, 0.008804191758860049)
2026-06-22 02:54:20,058 - root - INFO -   ** Getting the trainable edges:
2026-06-22 02:54:20,097 - helper_functions - INFO -      Number of nodes: 4732
2026-06-22 02:54:20,097 - helper_functions - INFO -      Ratio: 0.06787538011360376
2026-06-22 02:54:20,097 - helper_functions - INFO -      Number of unique users: 2913
2026-06-22 02:54:20,097 - helper_functions - INFO -      Number of unique items: 1819
2026-06-22 02:54:20,097 - helper_functions - INFO -      Total dominant set edge: 709150
2026-06-22 02:54:20,097 - helper_functions - INFO -      Trainable edges: 567320.0
2026-06-22 02:54:20,231 - root - INFO -   **** Getting 709150 dominant set edges
2026-06-22 02:54:20,380 - optuna.storages._rdb.storage - INFO - A new study created in RDB with name: Study_e_yelp_1c2dcs
2026-06-22 02:54:53,006 - experiment_functions - INFO - Early stopping at epoch 700. Best Metrics: (0.018190596869804874, 0.0037482632310218518, 0.009581693245398515)
2026-06-22 02:54:53,128 - optuna.study.study - INFO - Trial 0 finished with values: [0.018190596869804874, 0.0037482632310218518, 0.009581693245398515] and parameters: {'n_layers': 2, 'embedding_dim': 64, 'lr': 0.0013289914858578777, 'lambda_val': 0.0008775471778420443, 'batch_size': 2708, 'optimizer': 'RMSprop'}.
2026-06-22 02:55:53,002 - experiment_functions - INFO - Early stopping at epoch 1450. Best Metrics: (0.00047074039468922047, 0.00010736390046734875, 0.00023939824194469127)
2026-06-22 02:55:53,071 - optuna.study.study - INFO - Trial 1 finished with values: [0.00047074039468922047, 0.00010736390046734875, 0.00023939824194469127] and parameters: {'n_layers': 2, 'embedding_dim': 32, 'lr': 2.3625716959610772e-05, 'lambda_val': 0.0003063108651965316, 'batch_size': 1260, 'optimizer': 'Adam'}.
2026-06-22 02:59:10,396 - optuna.study.study - INFO - Trial 2 finished with values: [0.00761648437465032, 0.001962548945307566, 0.004346698490583816] and parameters: {'n_layers': 4, 'embedding_dim': 96, 'lr': 0.00021033510254141877, 'lambda_val': 0.09244129317291143, 'batch_size': 3028, 'optimizer': 'RMSprop'}.
2026-06-22 02:59:37,574 - experiment_functions - INFO - Early stopping at epoch 550. Best Metrics: (0.014099636133464018, 0.0028025135783756473, 0.0077128848355910344)
2026-06-22 02:59:37,652 - optuna.study.study - INFO - Trial 3 finished with values: [0.014099636133464018, 0.0028025135783756473, 0.0077128848355910344] and parameters: {'n_layers': 2, 'embedding_dim': 96, 'lr': 0.02006245051562491, 'lambda_val': 2.887932809602638e-05, 'batch_size': 3046, 'optimizer': 'Adam'}.
2026-06-22 03:00:04,452 - experiment_functions - INFO - Early stopping at epoch 600. Best Metrics: (0.006734776405526029, 0.0015315144625489452, 0.003683846591779124)
2026-06-22 03:00:04,543 - optuna.study.study - INFO - Trial 4 finished with values: [0.006734776405526029, 0.0015315144625489452, 0.003683846591779124] and parameters: {'n_layers': 2, 'embedding_dim': 32, 'lr': 0.005023945861716535, 'lambda_val': 0.03405990314606576, 'batch_size': 4064, 'optimizer': 'Adam'}.
2026-06-22 03:00:29,823 - experiment_functions - INFO - Early stopping at epoch 500. Best Metrics: (0.0004266574079583818, 0.00010578501957812304, 0.00025965195567236607)
