2026-06-22 03:00:29,891 - optuna.study.study - INFO - Trial 5 finished with values: [0.0004266574079583818, 0.00010578501957812304, 0.00025965195567236607] and parameters: {'n_layers': 2, 'embedding_dim': 128, 'lr': 0.02577991798829126, 'lambda_val': 6.864354390070003e-06, 'batch_size': 2566, 'optimizer': 'SGD'}.
2026-06-22 03:01:28,447 - experiment_functions - INFO - Early stopping at epoch 1050. Best Metrics: (0.00044303387906262007, 9.789061513199444e-05, 0.00024782467605140437)
2026-06-22 03:01:28,537 - optuna.study.study - INFO - Trial 6 finished with values: [0.00044303387906262007, 9.789061513199444e-05, 0.00024782467605140437] and parameters: {'n_layers': 2, 'embedding_dim': 256, 'lr': 2.168260996229046e-05, 'lambda_val': 1.1144054323074538e-06, 'batch_size': 1806, 'optimizer': 'RMSprop'}.
2026-06-22 03:01:52,107 - experiment_functions - INFO - Early stopping at epoch 500. Best Metrics: (0.0005379322683479864, 0.0001389415182518631, 0.00034749287397131494)
2026-06-22 03:01:52,194 - optuna.study.study - INFO - Trial 7 finished with values: [0.0005379322683479864, 0.0001389415182518631, 0.00034749287397131494] and parameters: {'n_layers': 1, 'embedding_dim': 128, 'lr': 0.004158826719905658, 'lambda_val': 0.01249051721609193, 'batch_size': 4028, 'optimizer': 'SGD'}.
2026-06-22 03:02:54,993 - experiment_functions - INFO - Early stopping at epoch 1250. Best Metrics: (0.0005352584558883035, 0.00013420487558418593, 0.0003077803526620493)
2026-06-22 03:02:55,079 - optuna.study.study - INFO - Trial 8 finished with values: [0.0005352584558883035, 0.00013420487558418593, 0.0003077803526620493] and parameters: {'n_layers': 4, 'embedding_dim': 96, 'lr': 1.3281571726331566e-05, 'lambda_val': 0.000442118077500333, 'batch_size': 2829, 'optimizer': 'RMSprop'}.
2026-06-22 03:03:24,005 - experiment_functions - INFO - Early stopping at epoch 500. Best Metrics: (0.0005352716349292807, 0.00011999494758115448, 0.00029880458171810935)
2026-06-22 03:03:24,099 - optuna.study.study - INFO - Trial 9 finished with values: [0.0005352716349292807, 0.00011999494758115448, 0.00029880458171810935] and parameters: {'n_layers': 2, 'embedding_dim': 256, 'lr': 0.0003826285728418564, 'lambda_val': 8.905242560937468e-06, 'batch_size': 1938, 'optimizer': 'SGD'}.
2026-06-22 03:03:53,820 - experiment_functions - INFO - Early stopping at epoch 550. Best Metrics: (0.013690877890673607, 0.002646204370342301, 0.007406216018516644)
2026-06-22 03:03:53,953 - optuna.study.study - INFO - Trial 10 finished with values: [0.013690877890673607, 0.002646204370342301, 0.007406216018516644] and parameters: {'n_layers': 3, 'embedding_dim': 128, 'lr': 0.02301165354346074, 'lambda_val': 4.017786575271443e-05, 'batch_size': 557, 'optimizer': 'Adam'}.
2026-06-22 03:04:15,960 - experiment_functions - INFO - Early stopping at epoch 500. Best Metrics: (0.0005794883895275079, 0.00012631047113805733, 0.0003303235267841858)
2026-06-22 03:04:16,045 - optuna.study.study - INFO - Trial 11 finished with values: [0.0005794883895275079, 0.00012631047113805733, 0.0003303235267841858] and parameters: {'n_layers': 1, 'embedding_dim': 32, 'lr': 0.00012053175580563405, 'lambda_val': 0.03753799015304055, 'batch_size': 1032, 'optimizer': 'SGD'}.
2026-06-22 03:05:31,541 - experiment_functions - INFO - Early stopping at epoch 1700. Best Metrics: (0.018852696951080564, 0.0039014146772767466, 0.010501833659972763)
2026-06-22 03:05:31,626 - optuna.study.study - INFO - Trial 12 finished with values: [0.018852696951080564, 0.0039014146772767466, 0.010501833659972763] and parameters: {'n_layers': 2, 'embedding_dim': 64, 'lr': 0.0012653624571519182, 'lambda_val': 5.867428769760123e-05, 'batch_size': 2362, 'optimizer': 'RMSprop'}.
2026-06-22 03:06:54,404 - experiment_functions - INFO - Early stopping at epoch 1800. Best Metrics: (0.017794149374715715, 0.004188770999115827, 0.010304205204036104)
2026-06-22 03:06:54,490 - optuna.study.study - INFO - Trial 13 finished with values: [0.017794149374715715, 0.004188770999115827, 0.010304205204036104] and parameters: {'n_layers': 2, 'embedding_dim': 96, 'lr': 0.0004249111472269399, 'lambda_val': 0.02301034856049595, 'batch_size': 930, 'optimizer': 'Adam'}.
2026-06-22 03:08:05,976 - experiment_functions - INFO - Early stopping at epoch 1550. Best Metrics: (0.014860215971901508, 0.00342459264873058, 0.008222783077727802)
2026-06-22 03:08:06,091 - optuna.study.study - INFO - Trial 14 finished with values: [0.014860215971901508, 0.00342459264873058, 0.008222783077727802] and parameters: {'n_layers': 3, 'embedding_dim': 64, 'lr': 0.00025949794187037214, 'lambda_val': 0.015318144701989713, 'batch_size': 3484, 'optimizer': 'RMSprop'}.
2026-06-22 03:08:28,686 - experiment_functions - INFO - Early stopping at epoch 500. Best Metrics: (0.0005775046708884431, 0.00011683718580270305, 0.0002999539593959683)
2026-06-22 03:08:28,770 - optuna.study.study - INFO - Trial 15 finished with values: [0.0005775046708884431, 0.00011683718580270305, 0.0002999539593959683] and parameters: {'n_layers': 1, 'embedding_dim': 64, 'lr': 0.003489774344906881, 'lambda_val': 4.9731271211321625e-05, 'batch_size': 2454, 'optimizer': 'SGD'}.
2026-06-22 03:08:55,837 - experiment_functions - INFO - Early stopping at epoch 600. Best Metrics: (0.00048049151496697633, 0.00011683718580270305, 0.00026915538365600495)
2026-06-22 03:08:55,925 - optuna.study.study - INFO - Trial 16 finished with values: [0.00048049151496697633, 0.00011683718580270305, 0.00026915538365600495] and parameters: {'n_layers': 3, 'embedding_dim': 32, 'lr': 2.3189131608237296e-05, 'lambda_val': 1.373744475798213e-05, 'batch_size': 2734, 'optimizer': 'RMSprop'}.
2026-06-22 03:09:18,978 - experiment_functions - INFO - Early stopping at epoch 500. Best Metrics: (0.0004476870856366952, 0.00010262725779967162, 0.00024099510035783191)
2026-06-22 03:09:19,063 - optuna.study.study - INFO - Trial 17 finished with values: [0.0004476870856366952, 0.00010262725779967162, 0.00024099510035783191] and parameters: {'n_layers': 3, 'embedding_dim': 32, 'lr': 0.025206904255985773, 'lambda_val': 0.00043991922640945194, 'batch_size': 1089, 'optimizer': 'SGD'}.
2026-06-22 03:10:38,200 - experiment_functions - INFO - Early stopping at epoch 1650. Best Metrics: (0.005898627447950712, 0.0011983705949223191, 0.002998676530112433)
2026-06-22 03:10:38,281 - optuna.study.study - INFO - Trial 18 finished with values: [0.005898627447950712, 0.0011983705949223191, 0.002998676530112433] and parameters: {'n_layers': 3, 'embedding_dim': 96, 'lr': 0.015211421448074065, 'lambda_val': 0.01765766854144056, 'batch_size': 1835, 'optimizer': 'Adam'}.
2026-06-22 03:13:17,240 - experiment_functions - INFO - Early stopping at epoch 3000. Best Metrics: (0.0006755532020572691, 0.0001468359226979917, 0.00038729282322952786)
2026-06-22 03:13:17,326 - optuna.study.study - INFO - Trial 19 finished with values: [0.0006755532020572691, 0.0001468359226979917, 0.00038729282322952786] and parameters: {'n_layers': 4, 'embedding_dim': 128, 'lr': 1.7335089286368435e-05, 'lambda_val': 3.8797754277468706e-05, 'batch_size': 1429, 'optimizer': 'RMSprop'}.
2026-06-22 03:15:57,916 - optuna.study.study - INFO - Trial 20 finished with values: [0.016191190646006992, 0.0035177466211948976, 0.009665637304359927] and parameters: {'n_layers': 1, 'embedding_dim': 32, 'lr': 0.00037811925768249915, 'lambda_val': 0.0006249538563380107, 'batch_size': 926, 'optimizer': 'RMSprop'}.
2026-06-22 03:16:22,207 - experiment_functions - INFO - Early stopping at epoch 500. Best Metrics: (0.0005391344546317409, 0.00010736390046734875, 0.0002620573763220025)
2026-06-22 03:16:22,303 - optuna.study.study - INFO - Trial 21 finished with values: [0.0005391344546317409, 0.00010736390046734875, 0.0002620573763220025] and parameters: {'n_layers': 2, 'embedding_dim': 96, 'lr': 0.00019838083075076693, 'lambda_val': 2.5611905625144733e-05, 'batch_size': 4083, 'optimizer': 'SGD'}.
2026-06-22 03:16:47,573 - experiment_functions - INFO - Early stopping at epoch 550. Best Metrics: (0.009572207863800487, 0.002140962485790072, 0.005428397319828226)
2026-06-22 03:16:47,921 - optuna.study.study - INFO - Trial 22 finished with values: [0.009572207863800487, 0.002140962485790072, 0.005428397319828226] and parameters: {'n_layers': 1, 'embedding_dim': 96, 'lr': 0.04552920788730844, 'lambda_val': 0.00018543728181534506, 'batch_size': 2618, 'optimizer': 'Adam'}.
2026-06-22 03:17:19,371 - experiment_functions - INFO - Early stopping at epoch 700. Best Metrics: (0.0005031742234817548, 0.00011683718580270305, 0.0002783038810699409)
2026-06-22 03:17:19,550 - optuna.study.study - INFO - Trial 23 finished with values: [0.0005031742234817548, 0.00011683718580270305, 0.0002783038810699409] and parameters: {'n_layers': 2, 'embedding_dim': 64, 'lr': 0.021839159621077735, 'lambda_val': 0.00013467965753667237, 'batch_size': 759, 'optimizer': 'SGD'}.
2026-06-22 03:19:42,122 - experiment_functions - INFO - Early stopping at epoch 3400. Best Metrics: (0.000627620351758556, 0.00014209928003031453, 0.0003587154331121367)
2026-06-22 03:19:42,195 - optuna.study.study - INFO - Trial 24 finished with values: [0.000627620351758556, 0.00014209928003031453, 0.0003587154331121367] and parameters: {'n_layers': 1, 'embedding_dim': 96, 'lr': 6.100610354483451e-05, 'lambda_val': 2.521303338560066e-05, 'batch_size': 3663, 'optimizer': 'Adam'}.
2026-06-22 03:23:14,485 - optuna.study.study - INFO - Trial 25 finished with values: [0.016202067883387208, 0.003704054566123532, 0.009387761259631755] and parameters: {'n_layers': 4, 'embedding_dim': 128, 'lr': 9.488295560625263e-05, 'lambda_val': 2.5805202056832215e-06, 'batch_size': 2524, 'optimizer': 'RMSprop'}.
2026-06-22 03:24:36,019 - experiment_functions - INFO - Early stopping at epoch 1800. Best Metrics: (0.004169497970531819, 0.0009662751042061388, 0.0023943903687533535)
2026-06-22 03:24:36,136 - optuna.study.study - INFO - Trial 26 finished with values: [0.004169497970531819, 0.0009662751042061388, 0.0023943903687533535] and parameters: {'n_layers': 2, 'embedding_dim': 96, 'lr': 0.08007589074794301, 'lambda_val': 0.06345349981186893, 'batch_size': 3925, 'optimizer': 'RMSprop'}.
2026-06-22 03:25:05,609 - experiment_functions - INFO - Early stopping at epoch 600. Best Metrics: (0.018745109781101773, 0.003707212327901984, 0.009907534072570022)
2026-06-22 03:25:05,696 - optuna.study.study - INFO - Trial 27 finished with values: [0.018745109781101773, 0.003707212327901984, 0.009907534072570022] and parameters: {'n_layers': 2, 'embedding_dim': 96, 'lr': 0.0031961014345224187, 'lambda_val': 0.0009863209806038411, 'batch_size': 2006, 'optimizer': 'Adam'}.
2026-06-22 03:25:40,750 - experiment_functions - INFO - Early stopping at epoch 500. Best Metrics: (0.0005078033583681042, 0.00011052166224580017, 0.0002974529173713967)
2026-06-22 03:25:40,835 - optuna.study.study - INFO - Trial 28 finished with values: [0.0005078033583681042, 0.00011052166224580017, 0.0002974529173713967] and parameters: {'n_layers': 4, 'embedding_dim': 256, 'lr': 0.0036404225946350165, 'lambda_val': 5.852270692705985e-06, 'batch_size': 2651, 'optimizer': 'SGD'}.
2026-06-22 03:26:16,600 - experiment_functions - INFO - Early stopping at epoch 500. Best Metrics: (0.007372690774902649, 0.0019499178981937603, 0.004912321344143921)
2026-06-22 03:26:16,947 - optuna.study.study - INFO - Trial 29 finished with values: [0.007372690774902649, 0.0019499178981937603, 0.004912321344143921] and parameters: {'n_layers': 4, 'embedding_dim': 256, 'lr': 0.01363223904917348, 'lambda_val': 0.0030618339304157877, 'batch_size': 1163, 'optimizer': 'RMSprop'}.
2026-06-22 03:26:46,584 - experiment_functions - INFO - Early stopping at epoch 650. Best Metrics: (0.018058758609695955, 0.003693002399898952, 0.009494589816649428)
2026-06-22 03:26:46,696 - optuna.study.study - INFO - Trial 30 finished with values: [0.018058758609695955, 0.003693002399898952, 0.009494589816649428] and parameters: {'n_layers': 1, 'embedding_dim': 64, 'lr': 0.0038079716278558275, 'lambda_val': 0.0010893975331714692, 'batch_size': 3711, 'optimizer': 'RMSprop'}.
2026-06-22 03:28:15,382 - experiment_functions - INFO - Early stopping at epoch 1850. Best Metrics: (0.015363473355287358, 0.0031088164708854365, 0.008649918351768704)
2026-06-22 03:28:15,450 - optuna.study.study - INFO - Trial 31 finished with values: [0.015363473355287358, 0.0031088164708854365, 0.008649918351768704] and parameters: {'n_layers': 2, 'embedding_dim': 128, 'lr': 0.012857610926801856, 'lambda_val': 1.3167003761918277e-05, 'batch_size': 2821, 'optimizer': 'Adam'}.
2026-06-22 03:28:41,182 - experiment_functions - INFO - Early stopping at epoch 550. Best Metrics: (0.0075387504235180074, 0.00162940507768094, 0.004225294599067638)
2026-06-22 03:28:41,252 - optuna.study.study - INFO - Trial 32 finished with values: [0.0075387504235180074, 0.00162940507768094, 0.004225294599067638] and parameters: {'n_layers': 2, 'embedding_dim': 64, 'lr': 0.055642121287157426, 'lambda_val': 0.00028164204425287087, 'batch_size': 2655, 'optimizer': 'Adam'}.
2026-06-22 03:33:05,977 - optuna.study.study - INFO - Trial 33 finished with values: [0.00215259852536204, 0.0004878741947707465, 0.0011738543775645283] and parameters: {'n_layers': 4, 'embedding_dim': 256, 'lr': 4.3395660683013514e-05, 'lambda_val': 0.0012155982033044516, 'batch_size': 1681, 'optimizer': 'RMSprop'}.
2026-06-22 03:33:38,124 - experiment_functions - INFO - Early stopping at epoch 500. Best Metrics: (0.0006147596926510594, 0.00012946823291650877, 0.0003501612285364006)
2026-06-22 03:33:38,207 - optuna.study.study - INFO - Trial 34 finished with values: [0.0006147596926510594, 0.00012946823291650877, 0.0003501612285364006] and parameters: {'n_layers': 3, 'embedding_dim': 256, 'lr': 0.0017809598622910787, 'lambda_val': 0.0001153894761993408, 'batch_size': 3314, 'optimizer': 'SGD'}.
2026-06-22 03:34:17,816 - experiment_functions - INFO - Early stopping at epoch 550. Best Metrics: (0.01214822855294323, 0.002560944802324113, 0.006682771273771333)
2026-06-22 03:34:17,935 - optuna.study.study - INFO - Trial 35 finished with values: [0.01214822855294323, 0.002560944802324113, 0.006682771273771333] and parameters: {'n_layers': 4, 'embedding_dim': 256, 'lr': 0.0015973413467103624, 'lambda_val': 0.001073083826061835, 'batch_size': 2784, 'optimizer': 'RMSprop'}.
2026-06-22 03:34:54,220 - experiment_functions - INFO - Early stopping at epoch 550. Best Metrics: (0.011220616665631518, 0.0023525325249463182, 0.00622507863751416)
2026-06-22 03:34:54,299 - optuna.study.study - INFO - Trial 36 finished with values: [0.011220616665631518, 0.0023525325249463182, 0.00622507863751416] and parameters: {'n_layers': 3, 'embedding_dim': 256, 'lr': 0.032664001431965455, 'lambda_val': 1.8799138642308267e-06, 'batch_size': 2960, 'optimizer': 'Adam'}.
2026-06-22 03:35:17,091 - experiment_functions - INFO - Early stopping at epoch 500. Best Metrics: (0.00043311323120868853, 0.00011525830491347732, 0.00024858765499631514)
2026-06-22 03:35:17,179 - optuna.study.study - INFO - Trial 37 finished with values: [0.00043311323120868853, 0.00011525830491347732, 0.00024858765499631514] and parameters: {'n_layers': 3, 'embedding_dim': 32, 'lr': 0.011369163645313778, 'lambda_val': 6.160460633632431e-06, 'batch_size': 2570, 'optimizer': 'SGD'}.
2026-06-22 03:35:39,773 - experiment_functions - INFO - Early stopping at epoch 500. Best Metrics: (0.0004937981520014736, 0.00010736390046734875, 0.00022999252053066454)
2026-06-22 03:35:39,867 - optuna.study.study - INFO - Trial 38 finished with values: [0.0004937981520014736, 0.00010736390046734875, 0.00022999252053066454] and parameters: {'n_layers': 2, 'embedding_dim': 32, 'lr': 0.02323759488452382, 'lambda_val': 0.05525490551005076, 'batch_size': 2933, 'optimizer': 'SGD'}.
2026-06-22 03:38:38,617 - optuna.study.study - INFO - Trial 39 finished with values: [0.010680252019618933, 0.002380952380952381, 0.006515131581731391] and parameters: {'n_layers': 2, 'embedding_dim': 96, 'lr': 0.00011667695005637437, 'lambda_val': 8.803132640891692e-06, 'batch_size': 2982, 'optimizer': 'RMSprop'}.
2026-06-22 03:39:10,971 - experiment_functions - INFO - Early stopping at epoch 500. Best Metrics: (0.0005785498578533893, 0.0001294682329165088, 0.0003162689411077693)
2026-06-22 03:39:11,046 - optuna.study.study - INFO - Trial 40 finished with values: [0.0005785498578533893, 0.0001294682329165088, 0.0003162689411077693] and parameters: {'n_layers': 3, 'embedding_dim': 256, 'lr': 0.0021281750333839635, 'lambda_val': 0.0022310554260300966, 'batch_size': 3194, 'optimizer': 'SGD'}.
2026-06-22 03:39:41,127 - experiment_functions - INFO - Early stopping at epoch 650. Best Metrics: (0.0005729441412128505, 0.00013578375647341163, 0.00030463886154480195)
2026-06-22 03:39:41,448 - optuna.study.study - INFO - Trial 41 finished with values: [0.0005729441412128505, 0.00013578375647341163, 0.00030463886154480195] and parameters: {'n_layers': 1, 'embedding_dim': 128, 'lr': 7.712990794978637e-05, 'lambda_val': 7.748224295942558e-06, 'batch_size': 3252, 'optimizer': 'Adam'}.
2026-06-22 03:40:08,248 - experiment_functions - INFO - Early stopping at epoch 500. Best Metrics: (0.000646432973905457, 0.00014367816091954023, 0.00035375844630454207)
2026-06-22 03:40:08,317 - optuna.study.study - INFO - Trial 42 finished with values: [0.000646432973905457, 0.00014367816091954023, 0.00035375844630454207] and parameters: {'n_layers': 4, 'embedding_dim': 96, 'lr': 3.6772889309705276e-05, 'lambda_val': 9.354033110589646e-06, 'batch_size': 2565, 'optimizer': 'SGD'}.
2026-06-22 03:40:40,437 - experiment_functions - INFO - Early stopping at epoch 500. Best Metrics: (0.00036470816065672956, 0.0001010483769104459, 0.00019076124407347217)
2026-06-22 03:40:40,521 - optuna.study.study - INFO - Trial 43 finished with values: [0.00036470816065672956, 0.0001010483769104459, 0.00019076124407347217] and parameters: {'n_layers': 3, 'embedding_dim': 256, 'lr': 0.0006723270909223298, 'lambda_val': 0.0005857689247732319, 'batch_size': 3633, 'optimizer': 'SGD'}.
2026-06-22 03:41:12,815 - experiment_functions - INFO - Early stopping at epoch 500. Best Metrics: (0.0004800197025300928, 0.00012473159024883163, 0.0002952823192370571)
2026-06-22 03:41:12,884 - optuna.study.study - INFO - Trial 44 finished with values: [0.0004800197025300928, 0.00012473159024883163, 0.0002952823192370571] and parameters: {'n_layers': 3, 'embedding_dim': 256, 'lr': 9.709293320258823e-05, 'lambda_val': 0.03630749508784058, 'batch_size': 1211, 'optimizer': 'SGD'}.
2026-06-22 03:42:16,887 - experiment_functions - INFO - Early stopping at epoch 1550. Best Metrics: (0.0006278117173871035, 0.0001294682329165088, 0.00032253462544107585)
2026-06-22 03:42:16,976 - optuna.study.study - INFO - Trial 45 finished with values: [0.0006278117173871035, 0.0001294682329165088, 0.00032253462544107585] and parameters: {'n_layers': 2, 'embedding_dim': 32, 'lr': 1.3680280275172243e-05, 'lambda_val': 2.6966833277802298e-05, 'batch_size': 2780, 'optimizer': 'Adam'}.
2026-06-22 03:45:01,576 - optuna.study.study - INFO - Trial 46 finished with values: [0.020701137386684006, 0.004528230390299356, 0.011335221342922863] and parameters: {'n_layers': 2, 'embedding_dim': 32, 'lr': 0.0003047708778242714, 'lambda_val': 0.010343205800368207, 'batch_size': 732, 'optimizer': 'Adam'}.
2026-06-22 03:46:03,962 - experiment_functions - INFO - Early stopping at epoch 1550. Best Metrics: (0.000537556671313724, 0.00013578375647341166, 0.0002994975147290186)
2026-06-22 03:46:04,040 - optuna.study.study - INFO - Trial 47 finished with values: [0.000537556671313724, 0.00013578375647341166, 0.0002994975147290186] and parameters: {'n_layers': 1, 'embedding_dim': 32, 'lr': 1.0073863375941849e-05, 'lambda_val': 0.0005660338072478805, 'batch_size': 963, 'optimizer': 'RMSprop'}.
2026-06-22 03:48:47,904 - optuna.study.study - INFO - Trial 48 finished with values: [0.015073152506571886, 0.003353543008715423, 0.00865458858768649] and parameters: {'n_layers': 2, 'embedding_dim': 32, 'lr': 0.0001659733154867732, 'lambda_val': 0.0020559457467967724, 'batch_size': 2901, 'optimizer': 'RMSprop'}.
2026-06-22 03:51:25,537 - optuna.study.study - INFO - Trial 49 finished with values: [0.0006634363143490228, 0.00012473159024883166, 0.00040253987990649065] and parameters: {'n_layers': 1, 'embedding_dim': 32, 'lr': 8.963815312123083e-05, 'lambda_val': 6.3531732661047e-05, 'batch_size': 3134, 'optimizer': 'Adam'}.
2026-06-22 03:51:48,327 - experiment_functions - INFO - Early stopping at epoch 500. Best Metrics: (0.00041728424008383305, 0.00011052166224580016, 0.0002204985522904109)
2026-06-22 03:51:48,411 - optuna.study.study - INFO - Trial 50 finished with values: [0.00041728424008383305, 0.00011052166224580016, 0.0002204985522904109] and parameters: {'n_layers': 3, 'embedding_dim': 32, 'lr': 1.3172582479813542e-05, 'lambda_val': 0.0009863209806038411, 'batch_size': 2006, 'optimizer': 'Adam'}.
2026-06-22 03:52:23,119 - experiment_functions - INFO - Early stopping at epoch 600. Best Metrics: (0.0005307501059962969, 0.00012473159024883163, 0.00025630497463093125)
2026-06-22 03:52:23,218 - optuna.study.study - INFO - Trial 51 finished with values: [0.0005307501059962969, 0.00012473159024883163, 0.00025630497463093125] and parameters: {'n_layers': 2, 'embedding_dim': 256, 'lr': 4.3395660683013514e-05, 'lambda_val': 0.0012155982033044516, 'batch_size': 3682, 'optimizer': 'RMSprop'}.
2026-06-22 03:52:57,350 - experiment_functions - INFO - Early stopping at epoch 750. Best Metrics: (0.02832772273827686, 0.006154477706201845, 0.01634321522743064)
