2026-06-22 12:09:07,476 - optuna.study.study - INFO - Trial 96 finished with values: [0.0005390504663379123, 0.00014367816091954025, 0.0002968556516423786] and parameters: {'n_layers': 1, 'embedding_dim': 128, 'lr': 3.621319074558867e-05, 'lambda_val': 5.915966748772391e-06, 'batch_size': 774, 'optimizer': 'Adam'}.
2026-06-22 12:09:37,060 - experiment_functions - INFO - Early stopping at epoch 600. Best Metrics: (0.007989110431981018, 0.0017004547176960973, 0.004330462841841905)
2026-06-22 12:09:37,143 - optuna.study.study - INFO - Trial 97 finished with values: [0.007989110431981018, 0.0017004547176960973, 0.004330462841841905] and parameters: {'n_layers': 4, 'embedding_dim': 64, 'lr': 0.003916255753855854, 'lambda_val': 3.474486235936414e-05, 'batch_size': 1357, 'optimizer': 'Adam'}.
2026-06-22 12:10:11,345 - experiment_functions - INFO - Early stopping at epoch 650. Best Metrics: (0.01448093464854814, 0.003184602753568271, 0.008070401150234177)
2026-06-22 12:10:11,468 - optuna.study.study - INFO - Trial 98 finished with values: [0.01448093464854814, 0.003184602753568271, 0.008070401150234177] and parameters: {'n_layers': 4, 'embedding_dim': 96, 'lr': 0.0018725355385280041, 'lambda_val': 0.000474805591472349, 'batch_size': 2550, 'optimizer': 'Adam'}.
2026-06-22 12:10:40,614 - experiment_functions - INFO - Early stopping at epoch 550. Best Metrics: (0.0029740595866631497, 0.0005873436907919668, 0.001730281679936544)
2026-06-22 12:10:40,708 - optuna.study.study - INFO - Trial 99 finished with values: [0.0029740595866631497, 0.0005873436907919668, 0.001730281679936544] and parameters: {'n_layers': 3, 'embedding_dim': 128, 'lr': 0.04540134922123185, 'lambda_val': 0.011645098629560957, 'batch_size': 1950, 'optimizer': 'Adam'}.
2026-06-22 12:13:45,879 - optuna.study.study - INFO - Trial 100 finished with values: [0.0007492507751809555, 0.00017999242137173172, 0.0004245656178914742] and parameters: {'n_layers': 3, 'embedding_dim': 96, 'lr': 6.151952429119636e-05, 'lambda_val': 2.436573270088667e-06, 'batch_size': 3167, 'optimizer': 'Adam'}.
2026-06-22 12:14:32,961 - experiment_functions - INFO - Early stopping at epoch 1100. Best Metrics: (0.0005613022754328878, 0.0001184160666919288, 0.0002978725736679812)
2026-06-22 12:14:33,043 - optuna.study.study - INFO - Trial 101 finished with values: [0.0005613022754328878, 0.0001184160666919288, 0.0002978725736679812] and parameters: {'n_layers': 1, 'embedding_dim': 64, 'lr': 3.9445962190463365e-05, 'lambda_val': 5.915966748772391e-06, 'batch_size': 2470, 'optimizer': 'Adam'}.
2026-06-22 12:14:58,814 - experiment_functions - INFO - Early stopping at epoch 500. Best Metrics: (0.00046272062467077736, 0.00010262725779967159, 0.00025366097958975285)
2026-06-22 12:14:58,895 - optuna.study.study - INFO - Trial 102 finished with values: [0.00046272062467077736, 0.00010262725779967159, 0.00025366097958975285] and parameters: {'n_layers': 1, 'embedding_dim': 256, 'lr': 0.02423791313291444, 'lambda_val': 0.0008707501873769348, 'batch_size': 2242, 'optimizer': 'SGD'}.
2026-06-22 12:15:58,804 - experiment_functions - INFO - Early stopping at epoch 1400. Best Metrics: (0.013825201952930135, 0.002887773146393836, 0.007864390951563313)
2026-06-22 12:15:58,899 - optuna.study.study - INFO - Trial 103 finished with values: [0.013825201952930135, 0.002887773146393836, 0.007864390951563313] and parameters: {'n_layers': 1, 'embedding_dim': 64, 'lr': 0.012496828920097607, 'lambda_val': 3.90887208716658e-05, 'batch_size': 1785, 'optimizer': 'RMSprop'}.
2026-06-22 12:19:32,009 - optuna.study.study - INFO - Trial 104 finished with values: [0.0014856411680896993, 0.0003710370089680435, 0.0008973161024231673] and parameters: {'n_layers': 2, 'embedding_dim': 256, 'lr': 0.00012989982088047286, 'lambda_val': 0.00023620858897053303, 'batch_size': 2558, 'optimizer': 'Adam'}.
2026-06-22 12:22:15,314 - optuna.study.study - INFO - Trial 105 finished with values: [0.027885858504035, 0.005995010736390047, 0.01627463857180959] and parameters: {'n_layers': 1, 'embedding_dim': 32, 'lr': 0.0005652244898304067, 'lambda_val': 1.3761340713703872e-05, 'batch_size': 2900, 'optimizer': 'RMSprop'}.
2026-06-22 12:22:40,019 - experiment_functions - INFO - Early stopping at epoch 550. Best Metrics: (0.013324492421663937, 0.002851458885941645, 0.007286777248779107)
2026-06-22 12:22:40,110 - optuna.study.study - INFO - Trial 106 finished with values: [0.013324492421663937, 0.002851458885941645, 0.007286777248779107] and parameters: {'n_layers': 2, 'embedding_dim': 32, 'lr': 0.012198273658959155, 'lambda_val': 1.3761340713703872e-05, 'batch_size': 862, 'optimizer': 'RMSprop'}.
2026-06-22 12:23:07,252 - experiment_functions - INFO - Early stopping at epoch 600. Best Metrics: (0.019607644826323243, 0.004330870279146142, 0.010935350499251581)
2026-06-22 12:23:07,347 - optuna.study.study - INFO - Trial 107 finished with values: [0.019607644826323243, 0.004330870279146142, 0.010935350499251581] and parameters: {'n_layers': 1, 'embedding_dim': 64, 'lr': 0.012496828920097607, 'lambda_val': 0.00023620858897053303, 'batch_size': 2900, 'optimizer': 'Adam'}.
2026-06-22 12:23:49,984 - experiment_functions - INFO - Early stopping at epoch 1000. Best Metrics: (0.012178698230903343, 0.00255462927876721, 0.006506250984721915)
2026-06-22 12:23:50,053 - optuna.study.study - INFO - Trial 108 finished with values: [0.012178698230903343, 0.00255462927876721, 0.006506250984721915] and parameters: {'n_layers': 1, 'embedding_dim': 64, 'lr': 0.00819304475662435, 'lambda_val': 0.0003069591356068849, 'batch_size': 575, 'optimizer': 'Adam'}.
2026-06-22 12:24:25,457 - experiment_functions - INFO - Early stopping at epoch 750. Best Metrics: (0.013053179910728943, 0.0028246179108248073, 0.007353244349555826)
2026-06-22 12:24:25,739 - optuna.study.study - INFO - Trial 109 finished with values: [0.013053179910728943, 0.0028246179108248073, 0.007353244349555826] and parameters: {'n_layers': 2, 'embedding_dim': 96, 'lr': 0.012198273658959155, 'lambda_val': 4.627893684414806e-05, 'batch_size': 2470, 'optimizer': 'RMSprop'}.
2026-06-22 12:27:58,053 - optuna.study.study - INFO - Trial 110 finished with values: [0.014226516003370627, 0.0033267020335985852, 0.008262617488244878] and parameters: {'n_layers': 2, 'embedding_dim': 256, 'lr': 0.00016427114027444753, 'lambda_val': 1.5980539146025577e-06, 'batch_size': 3739, 'optimizer': 'RMSprop'}.
2026-06-22 12:28:33,941 - experiment_functions - INFO - Early stopping at epoch 800. Best Metrics: (0.023564329071468253, 0.004975053681950234, 0.013469850570533907)
2026-06-22 12:28:34,237 - optuna.study.study - INFO - Trial 111 finished with values: [0.023564329071468253, 0.004975053681950234, 0.013469850570533907] and parameters: {'n_layers': 1, 'embedding_dim': 64, 'lr': 0.0030078366574997767, 'lambda_val': 0.00023620858897053303, 'batch_size': 2360, 'optimizer': 'RMSprop'}.
2026-06-22 12:29:10,492 - experiment_functions - INFO - Early stopping at epoch 800. Best Metrics: (0.00844151108262792, 0.0017241379310344825, 0.004670884663373858)
2026-06-22 12:29:10,564 - optuna.study.study - INFO - Trial 112 finished with values: [0.00844151108262792, 0.0017241379310344825, 0.004670884663373858] and parameters: {'n_layers': 2, 'embedding_dim': 64, 'lr': 0.023133657480706095, 'lambda_val': 5.915966748772391e-06, 'batch_size': 3655, 'optimizer': 'Adam'}.
2026-06-22 12:29:47,745 - experiment_functions - INFO - Early stopping at epoch 550. Best Metrics: (0.004157573451613861, 0.000909435392194013, 0.0022953316164539277)
2026-06-22 12:29:47,836 - optuna.study.study - INFO - Trial 113 finished with values: [0.004157573451613861, 0.000909435392194013, 0.0022953316164539277] and parameters: {'n_layers': 4, 'embedding_dim': 256, 'lr': 0.001487817598059853, 'lambda_val': 0.017487405378342077, 'batch_size': 2550, 'optimizer': 'RMSprop'}.
2026-06-22 12:32:34,491 - optuna.study.study - INFO - Trial 114 finished with values: [0.02610965026260194, 0.005614500442086649, 0.015344483703200193] and parameters: {'n_layers': 2, 'embedding_dim': 32, 'lr': 0.0005652244898304067, 'lambda_val': 1.3761340713703872e-05, 'batch_size': 862, 'optimizer': 'Adam'}.
2026-06-22 12:33:07,528 - experiment_functions - INFO - Early stopping at epoch 700. Best Metrics: (0.029603669392146835, 0.006190791966654036, 0.016864511879673836)
2026-06-22 12:33:07,977 - optuna.study.study - INFO - Trial 115 finished with values: [0.029603669392146835, 0.006190791966654036, 0.016864511879673836] and parameters: {'n_layers': 1, 'embedding_dim': 128, 'lr': 0.004316399830411133, 'lambda_val': 0.00016615513360913103, 'batch_size': 2116, 'optimizer': 'Adam'}.
2026-06-22 12:33:40,274 - experiment_functions - INFO - Early stopping at epoch 700. Best Metrics: (0.02810208460176813, 0.006018693949728433, 0.015985632615287116)
2026-06-22 12:33:40,357 - optuna.study.study - INFO - Trial 116 finished with values: [0.02810208460176813, 0.006018693949728433, 0.015985632615287116] and parameters: {'n_layers': 1, 'embedding_dim': 96, 'lr': 0.003916255753855854, 'lambda_val': 0.0007109535707376064, 'batch_size': 2470, 'optimizer': 'Adam'}.
2026-06-22 12:34:17,464 - experiment_functions - INFO - Early stopping at epoch 800. Best Metrics: (0.013422818585423402, 0.0028593532903877735, 0.007529050175284381)
2026-06-22 12:34:17,547 - optuna.study.study - INFO - Trial 117 finished with values: [0.013422818585423402, 0.0028593532903877735, 0.007529050175284381] and parameters: {'n_layers': 1, 'embedding_dim': 128, 'lr': 0.012496828920097607, 'lambda_val': 2.9063354533630173e-06, 'batch_size': 2360, 'optimizer': 'RMSprop'}.
2026-06-22 12:35:21,051 - experiment_functions - INFO - Early stopping at epoch 1350. Best Metrics: (0.008770815588455617, 0.0017762410003789317, 0.004829655399746903)
2026-06-22 12:35:21,140 - optuna.study.study - INFO - Trial 118 finished with values: [0.008770815588455617, 0.0017762410003789317, 0.004829655399746903] and parameters: {'n_layers': 4, 'embedding_dim': 64, 'lr': 0.00819304475662435, 'lambda_val': 0.0003069591356068849, 'batch_size': 2674, 'optimizer': 'RMSprop'}.
2026-06-22 12:36:35,718 - experiment_functions - INFO - Early stopping at epoch 1750. Best Metrics: (0.03127239408780341, 0.006568144499178982, 0.01774171200139926)
2026-06-22 12:36:35,810 - optuna.study.study - INFO - Trial 119 finished with values: [0.03127239408780341, 0.006568144499178982, 0.01774171200139926] and parameters: {'n_layers': 1, 'embedding_dim': 32, 'lr': 0.0018725355385280041, 'lambda_val': 1.3761340713703872e-05, 'batch_size': 2900, 'optimizer': 'RMSprop'}.
2026-06-22 12:36:59,390 - experiment_functions - INFO - Early stopping at epoch 500. Best Metrics: (0.0006083001860274478, 0.00012631047113805733, 0.00033518953920777723)
2026-06-22 12:36:59,485 - optuna.study.study - INFO - Trial 120 finished with values: [0.0006083001860274478, 0.00012631047113805733, 0.00033518953920777723] and parameters: {'n_layers': 2, 'embedding_dim': 64, 'lr': 0.0044145597440869684, 'lambda_val': 5.915966748772391e-06, 'batch_size': 2674, 'optimizer': 'SGD'}.
2026-06-22 12:37:29,804 - experiment_functions - INFO - Early stopping at epoch 650. Best Metrics: (0.02331121643331161, 0.005028735632183908, 0.012906467589813179)
2026-06-22 12:37:29,885 - optuna.study.study - INFO - Trial 121 finished with values: [0.02331121643331161, 0.005028735632183908, 0.012906467589813179] and parameters: {'n_layers': 2, 'embedding_dim': 64, 'lr': 0.003154552172712802, 'lambda_val': 1.5025857759055767e-06, 'batch_size': 2307, 'optimizer': 'Adam'}.
2026-06-22 12:38:09,366 - experiment_functions - INFO - Early stopping at epoch 900. Best Metrics: (0.02576940592669103, 0.005461348995831755, 0.015184500835460723)
2026-06-22 12:38:09,457 - optuna.study.study - INFO - Trial 122 finished with values: [0.02576940592669103, 0.005461348995831755, 0.015184500835460723] and parameters: {'n_layers': 1, 'embedding_dim': 32, 'lr': 0.0030078366574997767, 'lambda_val': 3.90887208716658e-05, 'batch_size': 1785, 'optimizer': 'RMSprop'}.
2026-06-22 12:38:49,523 - experiment_functions - INFO - Early stopping at epoch 700. Best Metrics: (0.00891493521402089, 0.0018599216875078946, 0.005036932500354679)
2026-06-22 12:38:49,588 - optuna.study.study - INFO - Trial 123 finished with values: [0.00891493521402089, 0.0018599216875078946, 0.005036932500354679] and parameters: {'n_layers': 2, 'embedding_dim': 256, 'lr': 0.023133657480706095, 'lambda_val': 0.00016643563527193303, 'batch_size': 2674, 'optimizer': 'Adam'}.
2026-06-22 12:39:12,109 - experiment_functions - INFO - Early stopping at epoch 500. Best Metrics: (0.0004847433051054012, 0.00011052166224580017, 0.0003139705700085813)
2026-06-22 12:39:12,211 - optuna.study.study - INFO - Trial 124 finished with values: [0.0004847433051054012, 0.00011052166224580017, 0.0003139705700085813] and parameters: {'n_layers': 2, 'embedding_dim': 32, 'lr': 0.0006753032109319728, 'lambda_val': 5.915966748772391e-06, 'batch_size': 2674, 'optimizer': 'SGD'}.
2026-06-22 12:39:41,691 - experiment_functions - INFO - Early stopping at epoch 550. Best Metrics: (0.011502847620019331, 0.0024867374005305043, 0.006024400074611187)
2026-06-22 12:39:41,771 - optuna.study.study - INFO - Trial 125 finished with values: [0.011502847620019331, 0.0024867374005305043, 0.006024400074611187] and parameters: {'n_layers': 4, 'embedding_dim': 96, 'lr': 0.003916255753855854, 'lambda_val': 1.5025857759055767e-06, 'batch_size': 2962, 'optimizer': 'Adam'}.
2026-06-22 12:40:10,836 - experiment_functions - INFO - Early stopping at epoch 600. Best Metrics: (0.008972821412304877, 0.0019657067070860176, 0.0052643125887538245)
2026-06-22 12:40:10,929 - optuna.study.study - INFO - Trial 126 finished with values: [0.008972821412304877, 0.0019657067070860176, 0.0052643125887538245] and parameters: {'n_layers': 2, 'embedding_dim': 96, 'lr': 0.029615604839337218, 'lambda_val': 1.0095379189149863e-06, 'batch_size': 1887, 'optimizer': 'RMSprop'}.
2026-06-22 12:40:45,864 - experiment_functions - INFO - Early stopping at epoch 600. Best Metrics: (0.020737124407181246, 0.004477706201844133, 0.0117452204692561)
2026-06-22 12:40:45,951 - optuna.study.study - INFO - Trial 127 finished with values: [0.020737124407181246, 0.004477706201844133, 0.0117452204692561] and parameters: {'n_layers': 2, 'embedding_dim': 256, 'lr': 0.0030078366574997767, 'lambda_val': 0.00023620858897053303, 'batch_size': 2558, 'optimizer': 'Adam'}.
2026-06-22 12:43:31,322 - optuna.study.study - INFO - Trial 128 finished with values: [0.028920506440705193, 0.006217632941770874, 0.016776015738745927] and parameters: {'n_layers': 1, 'embedding_dim': 32, 'lr': 0.0006753032109319728, 'lambda_val': 3.90887208716658e-05, 'batch_size': 1785, 'optimizer': 'RMSprop'}.
2026-06-22 12:44:11,889 - experiment_functions - INFO - Early stopping at epoch 700. Best Metrics: (0.026081252514906, 0.005545029682960717, 0.014721403439582136)
2026-06-22 12:44:11,962 - optuna.study.study - INFO - Trial 129 finished with values: [0.026081252514906, 0.005545029682960717, 0.014721403439582136] and parameters: {'n_layers': 2, 'embedding_dim': 256, 'lr': 0.001487817598059853, 'lambda_val': 0.00023620858897053303, 'batch_size': 3627, 'optimizer': 'Adam'}.
2026-06-22 12:46:58,467 - optuna.study.study - INFO - Trial 130 finished with values: [0.025482083551189402, 0.005551345206517621, 0.01450966171209334] and parameters: {'n_layers': 2, 'embedding_dim': 32, 'lr': 0.0005652244898304067, 'lambda_val': 0.00023620858897053303, 'batch_size': 862, 'optimizer': 'Adam'}.
2026-06-22 12:47:24,788 - experiment_functions - INFO - Early stopping at epoch 550. Best Metrics: (0.020279677977274778, 0.004352974611595301, 0.011377937299437164)
2026-06-22 12:47:24,871 - optuna.study.study - INFO - Trial 131 finished with values: [0.020279677977274778, 0.004352974611595301, 0.011377937299437164] and parameters: {'n_layers': 1, 'embedding_dim': 128, 'lr': 0.018292994483412973, 'lambda_val': 1.3761340713703872e-05, 'batch_size': 2900, 'optimizer': 'Adam'}.
2026-06-22 12:48:05,413 - experiment_functions - INFO - Early stopping at epoch 900. Best Metrics: (0.0005805631387788093, 0.00011367942402425163, 0.00031425916704736807)
2026-06-22 12:48:05,526 - optuna.study.study - INFO - Trial 132 finished with values: [0.0005805631387788093, 0.00011367942402425163, 0.00031425916704736807] and parameters: {'n_layers': 1, 'embedding_dim': 128, 'lr': 6.915163499753932e-05, 'lambda_val': 2.436573270088667e-06, 'batch_size': 3042, 'optimizer': 'Adam'}.
2026-06-22 12:48:43,894 - experiment_functions - INFO - Early stopping at epoch 800. Best Metrics: (0.007240267329440257, 0.0015251989389920425, 0.003995771066540844)
2026-06-22 12:48:43,974 - optuna.study.study - INFO - Trial 133 finished with values: [0.007240267329440257, 0.0015251989389920425, 0.003995771066540844] and parameters: {'n_layers': 4, 'embedding_dim': 64, 'lr': 0.012496828920097607, 'lambda_val': 2.9063354533630173e-06, 'batch_size': 2836, 'optimizer': 'Adam'}.
2026-06-22 12:51:44,086 - optuna.study.study - INFO - Trial 134 finished with values: [0.004357957634767276, 0.001087848932676519, 0.002464120276315904] and parameters: {'n_layers': 4, 'embedding_dim': 64, 'lr': 8.437479263401244e-05, 'lambda_val': 7.724967695086265e-05, 'batch_size': 3667, 'optimizer': 'Adam'}.
2026-06-22 12:55:11,126 - optuna.study.study - INFO - Trial 135 finished with values: [0.02041956774637333, 0.0044556018693949736, 0.01165764237408038] and parameters: {'n_layers': 4, 'embedding_dim': 128, 'lr': 0.00016427114027444753, 'lambda_val': 0.0002411343501283795, 'batch_size': 2030, 'optimizer': 'RMSprop'}.
2026-06-22 12:55:48,032 - experiment_functions - INFO - Early stopping at epoch 800. Best Metrics: (0.027381332796234024, 0.005889225716811924, 0.015525278240118224)
2026-06-22 12:55:49,354 - optuna.study.study - INFO - Trial 136 finished with values: [0.027381332796234024, 0.005889225716811924, 0.015525278240118224] and parameters: {'n_layers': 2, 'embedding_dim': 64, 'lr': 0.001487817598059853, 'lambda_val': 5.5504078777122543e-05, 'batch_size': 2558, 'optimizer': 'Adam'}.
2026-06-22 12:57:12,275 - experiment_functions - INFO - Early stopping at epoch 1500. Best Metrics: (0.029202586437797703, 0.0061671087533156504, 0.016541305624307598)
2026-06-22 12:57:12,367 - optuna.study.study - INFO - Trial 137 finished with values: [0.029202586437797703, 0.0061671087533156504, 0.016541305624307598] and parameters: {'n_layers': 2, 'embedding_dim': 256, 'lr': 0.0005652244898304067, 'lambda_val': 1.3761340713703872e-05, 'batch_size': 2116, 'optimizer': 'RMSprop'}.
2026-06-22 13:00:02,793 - optuna.study.study - INFO - Trial 138 finished with values: [0.026175293117357463, 0.005519767588733107, 0.014571682436131533] and parameters: {'n_layers': 3, 'embedding_dim': 32, 'lr': 0.00045788482653762934, 'lambda_val': 3.154143842771189e-05, 'batch_size': 2558, 'optimizer': 'Adam'}.
2026-06-22 13:00:26,468 - experiment_functions - INFO - Early stopping at epoch 500. Best Metrics: (0.0004938301277127025, 0.00010104837691044589, 0.00026198538409077276)
2026-06-22 13:00:26,555 - optuna.study.study - INFO - Trial 139 finished with values: [0.0004938301277127025, 0.00010104837691044589, 0.00026198538409077276] and parameters: {'n_layers': 2, 'embedding_dim': 96, 'lr': 0.0030078366574997767, 'lambda_val': 0.05932903084828733, 'batch_size': 2290, 'optimizer': 'SGD'}.
2026-06-22 13:03:23,830 - optuna.study.study - INFO - Trial 140 finished with values: [0.029384467446457375, 0.0064165719338133125, 0.01721326600723784] and parameters: {'n_layers': 1, 'embedding_dim': 128, 'lr': 0.0005464989571285408, 'lambda_val': 0.0001979130594640894, 'batch_size': 2836, 'optimizer': 'Adam'}.
2026-06-22 13:04:06,741 - experiment_functions - INFO - Early stopping at epoch 950. Best Metrics: (0.011780285368135928, 0.002534103827207276, 0.006557220142299744)
2026-06-22 13:04:06,813 - optuna.study.study - INFO - Trial 141 finished with values: [0.011780285368135928, 0.002534103827207276, 0.006557220142299744] and parameters: {'n_layers': 2, 'embedding_dim': 64, 'lr': 0.0030078366574997767, 'lambda_val': 1.8210976230104926e-06, 'batch_size': 2558, 'optimizer': 'RMSprop'}.
2026-06-22 13:04:31,675 - experiment_functions - INFO - Early stopping at epoch 550. Best Metrics: (0.00795900619292063, 0.001852027283061766, 0.004628560624034418)
2026-06-22 13:04:31,759 - optuna.study.study - INFO - Trial 142 finished with values: [0.00795900619292063, 0.001852027283061766, 0.004628560624034418] and parameters: {'n_layers': 1, 'embedding_dim': 64, 'lr': 0.028670085288056313, 'lambda_val': 3.90887208716658e-05, 'batch_size': 2290, 'optimizer': 'RMSprop'}.
2026-06-22 13:08:05,255 - optuna.study.study - INFO - Trial 143 finished with values: [0.0007044217789732331, 0.0001484148035872174, 0.00037818953662752304] and parameters: {'n_layers': 2, 'embedding_dim': 256, 'lr': 7.42401404991632e-05, 'lambda_val': 5.5504078777122543e-05, 'batch_size': 2030, 'optimizer': 'RMSprop'}.
2026-06-22 13:10:58,334 - optuna.study.study - INFO - Trial 144 finished with values: [0.024165959475643744, 0.005434508020714918, 0.014326644952082183] and parameters: {'n_layers': 1, 'embedding_dim': 96, 'lr': 0.0004673948260611741, 'lambda_val': 8.278161575734864e-05, 'batch_size': 3039, 'optimizer': 'Adam'}.
2026-06-22 13:13:52,231 - optuna.study.study - INFO - Trial 145 finished with values: [0.001112675220985706, 0.00026525198938992045, 0.0006980889196749207] and parameters: {'n_layers': 3, 'embedding_dim': 64, 'lr': 8.147006096352362e-05, 'lambda_val': 3.154143842771189e-05, 'batch_size': 2558, 'optimizer': 'RMSprop'}.
2026-06-22 13:16:15,716 - experiment_functions - INFO - Early stopping at epoch 3450. Best Metrics: (0.032720325427768586, 0.006880762915245674, 0.01843895740027413)
