2026-06-21 13:30:21,652 - optuna.study.study - INFO - Trial 158 finished with values: [0.006303886949140605, 0.0015867752936718456, 0.004056261041761467] and parameters: {'n_layers': 3, 'embedding_dim': 64, 'lr': 0.007852338517216746, 'lambda_val': 3.813478649907156e-06, 'batch_size': 2281, 'optimizer': 'Adam'}.
2026-06-21 13:31:21,029 - experiment_functions - INFO - Early stopping at epoch 1300. Best Metrics: (0.00961962845269806, 0.002431476569407604, 0.005861882092786417)
2026-06-21 13:31:21,345 - optuna.study.study - INFO - Trial 159 finished with values: [0.00961962845269806, 0.002431476569407604, 0.005861882092786417] and parameters: {'n_layers': 4, 'embedding_dim': 96, 'lr': 0.0008890810320593691, 'lambda_val': 2.5744682794480333e-06, 'batch_size': 2399, 'optimizer': 'Adam'}.
2026-06-21 13:32:00,660 - experiment_functions - INFO - Early stopping at epoch 900. Best Metrics: (0.00679409255975485, 0.0016641404572439054, 0.003995498513001401)
2026-06-21 13:32:00,745 - optuna.study.study - INFO - Trial 160 finished with values: [0.00679409255975485, 0.0016641404572439054, 0.003995498513001401] and parameters: {'n_layers': 2, 'embedding_dim': 96, 'lr': 0.003566354885654931, 'lambda_val': 3.514176335303042e-05, 'batch_size': 2410, 'optimizer': 'RMSprop'}.
2026-06-21 13:32:27,128 - experiment_functions - INFO - Early stopping at epoch 550. Best Metrics: (0.005500550392911364, 0.001365731969180245, 0.003213412842381625)
2026-06-21 13:32:27,241 - optuna.study.study - INFO - Trial 161 finished with values: [0.005500550392911364, 0.001365731969180245, 0.003213412842381625] and parameters: {'n_layers': 4, 'embedding_dim': 96, 'lr': 0.017411800301980536, 'lambda_val': 1.00362290309107e-06, 'batch_size': 1014, 'optimizer': 'RMSprop'}.
2026-06-21 13:32:52,791 - experiment_functions - INFO - Early stopping at epoch 500. Best Metrics: (0.0005740612810220899, 0.00012631047113805733, 0.00031824392030846226)
2026-06-21 13:32:52,890 - optuna.study.study - INFO - Trial 162 finished with values: [0.0005740612810220899, 0.00012631047113805733, 0.00031824392030846226] and parameters: {'n_layers': 2, 'embedding_dim': 256, 'lr': 0.003566354885654931, 'lambda_val': 0.00037941540794106203, 'batch_size': 1006, 'optimizer': 'SGD'}.
2026-06-21 13:33:20,745 - experiment_functions - INFO - Early stopping at epoch 600. Best Metrics: (0.005740053088505523, 0.0014541492989768852, 0.003440760777626901)
2026-06-21 13:33:20,853 - optuna.study.study - INFO - Trial 163 finished with values: [0.005740053088505523, 0.0014541492989768852, 0.003440760777626901] and parameters: {'n_layers': 2, 'embedding_dim': 96, 'lr': 0.0044739262759054006, 'lambda_val': 0.0002491576543882324, 'batch_size': 3386, 'optimizer': 'RMSprop'}.
2026-06-21 13:36:10,180 - optuna.study.study - INFO - Trial 164 finished with values: [0.0039030225449643205, 0.0009694328659845902, 0.0023693987847178345] and parameters: {'n_layers': 4, 'embedding_dim': 64, 'lr': 0.0002253601320203867, 'lambda_val': 1.0480033391436414e-06, 'batch_size': 1675, 'optimizer': 'RMSprop'}.
2026-06-21 13:36:48,260 - experiment_functions - INFO - Early stopping at epoch 750. Best Metrics: (0.005417127756684379, 0.0013767841354048252, 0.003400906554800959)
2026-06-21 13:36:48,345 - optuna.study.study - INFO - Trial 165 finished with values: [0.005417127756684379, 0.0013767841354048252, 0.003400906554800959] and parameters: {'n_layers': 2, 'embedding_dim': 256, 'lr': 0.003566354885654931, 'lambda_val': 0.00037941540794106203, 'batch_size': 1006, 'optimizer': 'RMSprop'}.
2026-06-21 13:37:26,523 - experiment_functions - INFO - Early stopping at epoch 650. Best Metrics: (0.007935530650967417, 0.0019514967790829859, 0.004617232128105285)
2026-06-21 13:37:26,622 - optuna.study.study - INFO - Trial 166 finished with values: [0.007935530650967417, 0.0019514967790829859, 0.004617232128105285] and parameters: {'n_layers': 4, 'embedding_dim': 256, 'lr': 0.0044739262759054006, 'lambda_val': 2.854699329527242e-06, 'batch_size': 1014, 'optimizer': 'Adam'}.
2026-06-21 13:37:55,981 - experiment_functions - INFO - Early stopping at epoch 600. Best Metrics: (0.006894796146304057, 0.0017446633825944171, 0.004260554550902314)
2026-06-21 13:37:56,070 - optuna.study.study - INFO - Trial 167 finished with values: [0.006894796146304057, 0.0017446633825944171, 0.004260554550902314] and parameters: {'n_layers': 3, 'embedding_dim': 128, 'lr': 0.003566354885654931, 'lambda_val': 0.00037941540794106203, 'batch_size': 2399, 'optimizer': 'RMSprop'}.
2026-06-21 13:38:42,232 - experiment_functions - INFO - Early stopping at epoch 1100. Best Metrics: (0.003392776250881771, 0.0009252242010862699, 0.0019683353074663734)
2026-06-21 13:38:42,753 - optuna.study.study - INFO - Trial 168 finished with values: [0.003392776250881771, 0.0009252242010862699, 0.0019683353074663734] and parameters: {'n_layers': 4, 'embedding_dim': 32, 'lr': 0.0008890810320593691, 'lambda_val': 0.08903788229231092, 'batch_size': 2399, 'optimizer': 'RMSprop'}.
2026-06-21 13:39:08,557 - experiment_functions - INFO - Early stopping at epoch 500. Best Metrics: (0.0006266879618259253, 0.00014209928003031453, 0.00034242991922421714)
2026-06-21 13:39:08,652 - optuna.study.study - INFO - Trial 169 finished with values: [0.0006266879618259253, 0.00014209928003031453, 0.00034242991922421714] and parameters: {'n_layers': 2, 'embedding_dim': 256, 'lr': 0.003566354885654931, 'lambda_val': 0.00037941540794106203, 'batch_size': 1006, 'optimizer': 'SGD'}.
2026-06-21 13:40:26,956 - experiment_functions - INFO - Early stopping at epoch 1900. Best Metrics: (0.003539553374130764, 0.0008936465833017559, 0.002196194137591521)
2026-06-21 13:40:27,047 - optuna.study.study - INFO - Trial 170 finished with values: [0.003539553374130764, 0.0008936465833017559, 0.002196194137591521] and parameters: {'n_layers': 1, 'embedding_dim': 96, 'lr': 0.017411800301980536, 'lambda_val': 1.00362290309107e-06, 'batch_size': 1014, 'optimizer': 'Adam'}.
2026-06-21 13:40:50,787 - experiment_functions - INFO - Early stopping at epoch 500. Best Metrics: (0.0004893911019402533, 0.00011367942402425162, 0.00024502574652059285)
2026-06-21 13:40:50,877 - optuna.study.study - INFO - Trial 171 finished with values: [0.0004893911019402533, 0.00011367942402425162, 0.00024502574652059285] and parameters: {'n_layers': 3, 'embedding_dim': 96, 'lr': 4.744678592393653e-05, 'lambda_val': 1.6213630924331792e-06, 'batch_size': 518, 'optimizer': 'SGD'}.
2026-06-21 13:43:55,800 - optuna.study.study - INFO - Trial 172 finished with values: [0.009233683628647193, 0.0023004294556018697, 0.005708108358682176] and parameters: {'n_layers': 4, 'embedding_dim': 128, 'lr': 0.0003941995846468513, 'lambda_val': 0.00037941540794106203, 'batch_size': 679, 'optimizer': 'RMSprop'}.
2026-06-21 13:44:34,006 - experiment_functions - INFO - Early stopping at epoch 750. Best Metrics: (0.005456514423414278, 0.0013736263736263737, 0.003258312458455642)
2026-06-21 13:44:34,076 - optuna.study.study - INFO - Trial 173 finished with values: [0.005456514423414278, 0.0013736263736263737, 0.003258312458455642] and parameters: {'n_layers': 2, 'embedding_dim': 256, 'lr': 0.0044739262759054006, 'lambda_val': 0.0002491576543882324, 'batch_size': 1012, 'optimizer': 'RMSprop'}.
2026-06-21 13:45:09,591 - experiment_functions - INFO - Early stopping at epoch 600. Best Metrics: (0.007445725950194084, 0.0018109763799418971, 0.0043535726213917185)
2026-06-21 13:45:09,957 - optuna.study.study - INFO - Trial 174 finished with values: [0.007445725950194084, 0.0018109763799418971, 0.0043535726213917185] and parameters: {'n_layers': 4, 'embedding_dim': 256, 'lr': 0.003566354885654931, 'lambda_val': 2.854699329527242e-06, 'batch_size': 3971, 'optimizer': 'Adam'}.
2026-06-21 13:45:35,249 - experiment_functions - INFO - Early stopping at epoch 550. Best Metrics: (0.004171909428970177, 0.0010625868384489074, 0.0024949409970206294)
2026-06-21 13:45:35,325 - optuna.study.study - INFO - Trial 175 finished with values: [0.004171909428970177, 0.0010625868384489074, 0.0024949409970206294] and parameters: {'n_layers': 3, 'embedding_dim': 64, 'lr': 0.01415765729378693, 'lambda_val': 0.0008411828500307989, 'batch_size': 911, 'optimizer': 'RMSprop'}.
2026-06-21 13:46:17,155 - experiment_functions - INFO - Early stopping at epoch 950. Best Metrics: (0.0067716241710453085, 0.0016057218643425538, 0.004052818555453947)
2026-06-21 13:46:17,247 - optuna.study.study - INFO - Trial 176 finished with values: [0.0067716241710453085, 0.0016057218643425538, 0.004052818555453947] and parameters: {'n_layers': 2, 'embedding_dim': 96, 'lr': 0.0044739262759054006, 'lambda_val': 0.0002491576543882324, 'batch_size': 1014, 'optimizer': 'Adam'}.
2026-06-21 13:46:45,378 - experiment_functions - INFO - Early stopping at epoch 650. Best Metrics: (0.007240369285200462, 0.0018315018315018315, 0.004605027908092802)
2026-06-21 13:46:45,479 - optuna.study.study - INFO - Trial 177 finished with values: [0.007240369285200462, 0.0018315018315018315, 0.004605027908092802] and parameters: {'n_layers': 3, 'embedding_dim': 32, 'lr': 0.004051056337067167, 'lambda_val': 1.6213630924331792e-06, 'batch_size': 3386, 'optimizer': 'RMSprop'}.
2026-06-21 13:47:37,225 - experiment_functions - INFO - Early stopping at epoch 1250. Best Metrics: (0.005149392993401232, 0.0011983705949223191, 0.0032479139374902615)
2026-06-21 13:47:37,305 - optuna.study.study - INFO - Trial 178 finished with values: [0.005149392993401232, 0.0011983705949223191, 0.0032479139374902615] and parameters: {'n_layers': 1, 'embedding_dim': 64, 'lr': 0.0019529911061502276, 'lambda_val': 1.9888087490246264e-06, 'batch_size': 3322, 'optimizer': 'RMSprop'}.
2026-06-21 13:50:52,831 - optuna.study.study - INFO - Trial 179 finished with values: [0.005499480737224573, 0.0014352027283061767, 0.0033334066083888273] and parameters: {'n_layers': 2, 'embedding_dim': 256, 'lr': 0.0005405212661976008, 'lambda_val': 0.00034129251188470285, 'batch_size': 3322, 'optimizer': 'Adam'}.
2026-06-21 13:51:21,589 - experiment_functions - INFO - Early stopping at epoch 650. Best Metrics: (0.006360208350613957, 0.0015630920803334596, 0.003922494845512327)
2026-06-21 13:51:21,665 - optuna.study.study - INFO - Trial 180 finished with values: [0.006360208350613957, 0.0015630920803334596, 0.003922494845512327] and parameters: {'n_layers': 2, 'embedding_dim': 64, 'lr': 0.0044739262759054006, 'lambda_val': 2.1253433227122844e-05, 'batch_size': 2281, 'optimizer': 'RMSprop'}.
2026-06-21 13:51:57,733 - experiment_functions - INFO - Early stopping at epoch 650. Best Metrics: (0.006587926481013166, 0.0016925603132499686, 0.00390769066767111)
2026-06-21 13:51:57,802 - optuna.study.study - INFO - Trial 181 finished with values: [0.006587926481013166, 0.0016925603132499686, 0.00390769066767111] and parameters: {'n_layers': 3, 'embedding_dim': 256, 'lr': 0.003959528614934683, 'lambda_val': 0.00014536026487415492, 'batch_size': 3322, 'optimizer': 'Adam'}.
2026-06-21 13:52:24,486 - experiment_functions - INFO - Early stopping at epoch 550. Best Metrics: (0.0066069163439098555, 0.0016751926234684857, 0.0037332634728658226)
2026-06-21 13:52:24,550 - optuna.study.study - INFO - Trial 182 finished with values: [0.0066069163439098555, 0.0016751926234684857, 0.0037332634728658226] and parameters: {'n_layers': 4, 'embedding_dim': 96, 'lr': 0.0183275310294566, 'lambda_val': 0.00034129251188470285, 'batch_size': 1179, 'optimizer': 'Adam'}.
2026-06-21 13:52:49,928 - experiment_functions - INFO - Early stopping at epoch 550. Best Metrics: (0.0042399576051502415, 0.0010657446002273591, 0.0024952418135726485)
2026-06-21 13:52:50,021 - optuna.study.study - INFO - Trial 183 finished with values: [0.0042399576051502415, 0.0010657446002273591, 0.0024952418135726485] and parameters: {'n_layers': 4, 'embedding_dim': 64, 'lr': 0.017411800301980536, 'lambda_val': 0.0005730301953207167, 'batch_size': 1014, 'optimizer': 'RMSprop'}.
2026-06-21 13:53:26,691 - experiment_functions - INFO - Early stopping at epoch 800. Best Metrics: (0.007818171294098675, 0.001967285587975243, 0.004767561062265876)
2026-06-21 13:53:26,765 - optuna.study.study - INFO - Trial 184 finished with values: [0.007818171294098675, 0.001967285587975243, 0.004767561062265876] and parameters: {'n_layers': 3, 'embedding_dim': 96, 'lr': 0.0044739262759054006, 'lambda_val': 6.059814023598347e-06, 'batch_size': 1014, 'optimizer': 'Adam'}.
2026-06-21 13:54:11,761 - experiment_functions - INFO - Early stopping at epoch 950. Best Metrics: (0.004119563684486898, 0.0009252242010862699, 0.0023026971468079224)
2026-06-21 13:54:11,843 - optuna.study.study - INFO - Trial 185 finished with values: [0.004119563684486898, 0.0009252242010862699, 0.0023026971468079224] and parameters: {'n_layers': 1, 'embedding_dim': 256, 'lr': 0.007517511425007554, 'lambda_val': 0.0002491576543882324, 'batch_size': 4092, 'optimizer': 'Adam'}.
2026-06-21 13:56:46,497 - experiment_functions - INFO - Early stopping at epoch 3750. Best Metrics: (0.013687518186426955, 0.003284072249589491, 0.008035975193391498)
2026-06-21 13:56:46,574 - optuna.study.study - INFO - Trial 186 finished with values: [0.013687518186426955, 0.003284072249589491, 0.008035975193391498] and parameters: {'n_layers': 4, 'embedding_dim': 32, 'lr': 0.0008890810320593691, 'lambda_val': 2.5744682794480333e-06, 'batch_size': 1014, 'optimizer': 'RMSprop'}.
2026-06-21 13:57:16,660 - experiment_functions - INFO - Early stopping at epoch 650. Best Metrics: (0.007547875698776746, 0.0019151825186307946, 0.004543177488775491)
2026-06-21 13:57:16,752 - optuna.study.study - INFO - Trial 187 finished with values: [0.007547875698776746, 0.0019151825186307946, 0.004543177488775491] and parameters: {'n_layers': 4, 'embedding_dim': 64, 'lr': 0.0044739262759054006, 'lambda_val': 1.9888087490246264e-06, 'batch_size': 4067, 'optimizer': 'Adam'}.
2026-06-21 13:57:42,342 - experiment_functions - INFO - Early stopping at epoch 550. Best Metrics: (0.006043975671278483, 0.0015441455096627513, 0.003723440947984242)
2026-06-21 13:57:42,440 - optuna.study.study - INFO - Trial 188 finished with values: [0.006043975671278483, 0.0015441455096627513, 0.003723440947984242] and parameters: {'n_layers': 4, 'embedding_dim': 64, 'lr': 0.007517511425007554, 'lambda_val': 1.6213630924331792e-06, 'batch_size': 3447, 'optimizer': 'RMSprop'}.
2026-06-21 13:59:10,755 - experiment_functions - INFO - Early stopping at epoch 1800. Best Metrics: (0.0070464036710078245, 0.0017920298092711888, 0.0043006689941095175)
2026-06-21 13:59:10,824 - optuna.study.study - INFO - Trial 189 finished with values: [0.0070464036710078245, 0.0017920298092711888, 0.0043006689941095175] and parameters: {'n_layers': 2, 'embedding_dim': 256, 'lr': 0.0008890810320593691, 'lambda_val': 2.854699329527242e-06, 'batch_size': 3322, 'optimizer': 'RMSprop'}.
2026-06-21 13:59:45,772 - experiment_functions - INFO - Early stopping at epoch 750. Best Metrics: (0.008757549935100875, 0.002204117721359101, 0.00525089416517021)
2026-06-21 13:59:46,348 - optuna.study.study - INFO - Trial 190 finished with values: [0.008757549935100875, 0.002204117721359101, 0.00525089416517021] and parameters: {'n_layers': 3, 'embedding_dim': 96, 'lr': 0.0018467590222577509, 'lambda_val': 0.0002491576543882324, 'batch_size': 2732, 'optimizer': 'RMSprop'}.
2026-06-21 14:02:29,257 - optuna.study.study - INFO - Trial 191 finished with values: [0.0066975878712266885, 0.0015820386510041681, 0.00422757922400444] and parameters: {'n_layers': 2, 'embedding_dim': 64, 'lr': 0.0006104134330921928, 'lambda_val': 1.4121365572109793e-06, 'batch_size': 3199, 'optimizer': 'Adam'}.
2026-06-21 14:03:04,073 - experiment_functions - INFO - Early stopping at epoch 750. Best Metrics: (0.0044340769245390585, 0.0011020588606795506, 0.002646692083256653)
2026-06-21 14:03:04,438 - optuna.study.study - INFO - Trial 192 finished with values: [0.0044340769245390585, 0.0011020588606795506, 0.002646692083256653] and parameters: {'n_layers': 2, 'embedding_dim': 128, 'lr': 0.025038417520929643, 'lambda_val': 1.4121365572109793e-06, 'batch_size': 3199, 'optimizer': 'Adam'}.
2026-06-21 14:04:51,470 - experiment_functions - INFO - Early stopping at epoch 2050. Best Metrics: (0.008721836056980188, 0.0022483263862574207, 0.005252893863562231)
2026-06-21 14:04:51,543 - optuna.study.study - INFO - Trial 193 finished with values: [0.008721836056980188, 0.0022483263862574207, 0.005252893863562231] and parameters: {'n_layers': 3, 'embedding_dim': 256, 'lr': 0.0004419346142273276, 'lambda_val': 0.00036884249384628963, 'batch_size': 3241, 'optimizer': 'RMSprop'}.
2026-06-21 14:05:15,054 - experiment_functions - INFO - Early stopping at epoch 500. Best Metrics: (0.00054194500064615, 0.00012473159024883166, 0.00028810290978483334)
2026-06-21 14:05:15,141 - optuna.study.study - INFO - Trial 194 finished with values: [0.00054194500064615, 0.00012473159024883166, 0.00028810290978483334] and parameters: {'n_layers': 3, 'embedding_dim': 96, 'lr': 0.0044739262759054006, 'lambda_val': 1.00362290309107e-06, 'batch_size': 2662, 'optimizer': 'SGD'}.
2026-06-21 14:05:49,883 - experiment_functions - INFO - Early stopping at epoch 800. Best Metrics: (0.01013589088880857, 0.002557787040545661, 0.006148728420802259)
2026-06-21 14:05:49,967 - optuna.study.study - INFO - Trial 195 finished with values: [0.01013589088880857, 0.002557787040545661, 0.006148728420802259] and parameters: {'n_layers': 4, 'embedding_dim': 32, 'lr': 0.004051056337067167, 'lambda_val': 1.9888087490246264e-06, 'batch_size': 975, 'optimizer': 'Adam'}.
2026-06-21 14:06:23,616 - experiment_functions - INFO - Early stopping at epoch 800. Best Metrics: (0.0025581094317982406, 0.0006394467601364153, 0.0014639831639991822)
2026-06-21 14:06:24,079 - optuna.study.study - INFO - Trial 196 finished with values: [0.0025581094317982406, 0.0006394467601364153, 0.0014639831639991822] and parameters: {'n_layers': 3, 'embedding_dim': 32, 'lr': 0.011273083978829358, 'lambda_val': 0.014679201594967693, 'batch_size': 2281, 'optimizer': 'RMSprop'}.
2026-06-21 14:06:50,412 - experiment_functions - INFO - Early stopping at epoch 550. Best Metrics: (0.005960693108772943, 0.0014699381078691425, 0.003451075636382902)
2026-06-21 14:06:50,496 - optuna.study.study - INFO - Trial 197 finished with values: [0.005960693108772943, 0.0014699381078691425, 0.003451075636382902] and parameters: {'n_layers': 3, 'embedding_dim': 96, 'lr': 0.007517511425007554, 'lambda_val': 0.0002491576543882324, 'batch_size': 2732, 'optimizer': 'RMSprop'}.
2026-06-21 14:09:39,919 - optuna.study.study - INFO - Trial 198 finished with values: [0.00437918769733772, 0.0010578501957812306, 0.0027393060851496334] and parameters: {'n_layers': 4, 'embedding_dim': 64, 'lr': 0.00021004931537485223, 'lambda_val': 0.00034129251188470285, 'batch_size': 2962, 'optimizer': 'Adam'}.
2026-06-21 14:12:23,771 - optuna.study.study - INFO - Trial 199 finished with values: [0.011768238217722925, 0.002925666287735254, 0.007229935498107258] and parameters: {'n_layers': 4, 'embedding_dim': 32, 'lr': 0.0007376776486185891, 'lambda_val': 6.059814023598347e-06, 'batch_size': 1014, 'optimizer': 'Adam'}.
2026-06-21 14:14:16,004 - experiment_functions - INFO - Early stopping at epoch 2600. Best Metrics: (0.009674999317066254, 0.0024946318049766324, 0.005866162069899676)
2026-06-21 14:14:16,076 - optuna.study.study - INFO - Trial 200 finished with values: [0.009674999317066254, 0.0024946318049766324, 0.005866162069899676] and parameters: {'n_layers': 4, 'embedding_dim': 64, 'lr': 0.0006104134330921928, 'lambda_val': 6.059814023598347e-06, 'batch_size': 3322, 'optimizer': 'Adam'}.
2026-06-21 14:16:59,184 - optuna.study.study - INFO - Trial 201 finished with values: [0.009547294170741943, 0.002360426929392447, 0.0059260215621551975] and parameters: {'n_layers': 4, 'embedding_dim': 32, 'lr': 0.0003941995846468513, 'lambda_val': 0.0002491576543882324, 'batch_size': 2732, 'optimizer': 'RMSprop'}.
2026-06-21 14:17:26,080 - experiment_functions - INFO - Early stopping at epoch 550. Best Metrics: (0.006837432173286439, 0.0017557155488189973, 0.003924693420713897)
2026-06-21 14:17:26,171 - optuna.study.study - INFO - Trial 202 finished with values: [0.006837432173286439, 0.0017557155488189973, 0.003924693420713897] and parameters: {'n_layers': 4, 'embedding_dim': 96, 'lr': 0.005531406209191076, 'lambda_val': 2.5744682794480333e-06, 'batch_size': 3322, 'optimizer': 'RMSprop'}.
2026-06-21 14:18:55,656 - experiment_functions - INFO - Early stopping at epoch 2050. Best Metrics: (0.011019068917447326, 0.0028435644814955164, 0.006725064184924988)
2026-06-21 14:18:55,765 - optuna.study.study - INFO - Trial 203 finished with values: [0.011019068917447326, 0.0028435644814955164, 0.006725064184924988] and parameters: {'n_layers': 4, 'embedding_dim': 64, 'lr': 0.0006104134330921928, 'lambda_val': 2.5744682794480333e-06, 'batch_size': 3322, 'optimizer': 'RMSprop'}.
2026-06-21 14:21:34,696 - optuna.study.study - INFO - Trial 204 finished with values: [0.007920278433445716, 0.0018757104964001517, 0.004844307630961132] and parameters: {'n_layers': 2, 'embedding_dim': 32, 'lr': 0.0008890810320593691, 'lambda_val': 0.00036884249384628963, 'batch_size': 1006, 'optimizer': 'RMSprop'}.
2026-06-21 14:22:11,364 - experiment_functions - INFO - Early stopping at epoch 850. Best Metrics: (0.003661235725631421, 0.0008573323228495644, 0.0021975236520607694)
2026-06-21 14:22:12,126 - optuna.study.study - INFO - Trial 205 finished with values: [0.003661235725631421, 0.0008573323228495644, 0.0021975236520607694] and parameters: {'n_layers': 1, 'embedding_dim': 96, 'lr': 0.017501201488076355, 'lambda_val': 2.854699329527242e-06, 'batch_size': 2962, 'optimizer': 'Adam'}.
2026-06-21 14:22:44,741 - experiment_functions - INFO - Early stopping at epoch 650. Best Metrics: (0.008435205634512019, 0.0020699128457749147, 0.004824005735325682)
