2026-06-23 09:30:01,604 - optuna.study.study - INFO - Trial 163 finished with values: [0.0005830789422528294, 0.00012473159024883166, 0.00032211261376867813] and parameters: {'n_layers': 1, 'embedding_dim': 256, 'lr': 0.0001056375902368199, 'lambda_val': 0.005422944155279863, 'batch_size': 2693, 'optimizer': 'RMSprop'}.
2026-06-23 09:32:52,235 - optuna.study.study - INFO - Trial 164 finished with values: [0.010836850930784845, 0.002627257799671593, 0.0067641191360519074] and parameters: {'n_layers': 1, 'embedding_dim': 96, 'lr': 0.0003203074384831293, 'lambda_val': 0.0006793861457506547, 'batch_size': 3129, 'optimizer': 'RMSprop'}.
2026-06-23 09:35:41,624 - optuna.study.study - INFO - Trial 165 finished with values: [0.0007466226227382509, 0.00018157130226095747, 0.0004073000220442871] and parameters: {'n_layers': 1, 'embedding_dim': 96, 'lr': 0.0002012677292292479, 'lambda_val': 0.0003493536375915131, 'batch_size': 2599, 'optimizer': 'Adam'}.
2026-06-23 09:36:11,335 - experiment_functions - INFO - Early stopping at epoch 600. Best Metrics: (0.0063965277999935444, 0.001365731969180245, 0.0035293350604387475)
2026-06-23 09:36:12,005 - optuna.study.study - INFO - Trial 166 finished with values: [0.0063965277999935444, 0.001365731969180245, 0.0035293350604387475] and parameters: {'n_layers': 2, 'embedding_dim': 96, 'lr': 0.0644250231976392, 'lambda_val': 0.0001268815967640493, 'batch_size': 3090, 'optimizer': 'Adam'}.
2026-06-23 09:36:49,934 - experiment_functions - INFO - Early stopping at epoch 750. Best Metrics: (0.026241014703530657, 0.005546608563849942, 0.015030303330751706)
2026-06-23 09:36:50,038 - optuna.study.study - INFO - Trial 167 finished with values: [0.026241014703530657, 0.005546608563849942, 0.015030303330751706] and parameters: {'n_layers': 2, 'embedding_dim': 128, 'lr': 0.0016017140638771422, 'lambda_val': 3.447042784972302e-05, 'batch_size': 3253, 'optimizer': 'Adam'}.
2026-06-23 09:37:42,198 - experiment_functions - INFO - Early stopping at epoch 1000. Best Metrics: (0.030916717103696575, 0.006490779335606922, 0.01746541999437833)
2026-06-23 09:37:42,306 - optuna.study.study - INFO - Trial 168 finished with values: [0.030916717103696575, 0.006490779335606922, 0.01746541999437833] and parameters: {'n_layers': 1, 'embedding_dim': 256, 'lr': 0.0017924637075651337, 'lambda_val': 3.447042784972302e-05, 'batch_size': 3397, 'optimizer': 'Adam'}.
2026-06-23 09:38:19,387 - experiment_functions - INFO - Early stopping at epoch 850. Best Metrics: (0.02153357376600657, 0.004896109637488948, 0.01236199114330374)
2026-06-23 09:38:19,492 - optuna.study.study - INFO - Trial 169 finished with values: [0.02153357376600657, 0.004896109637488948, 0.01236199114330374] and parameters: {'n_layers': 1, 'embedding_dim': 32, 'lr': 0.0016017140638771422, 'lambda_val': 0.024392919403848676, 'batch_size': 2100, 'optimizer': 'RMSprop'}.
2026-06-23 09:38:43,760 - experiment_functions - INFO - Early stopping at epoch 500. Best Metrics: (0.0004778027103312142, 0.0001121005431350259, 0.0002762237428484378)
2026-06-23 09:38:43,869 - optuna.study.study - INFO - Trial 170 finished with values: [0.0004778027103312142, 0.0001121005431350259, 0.0002762237428484378] and parameters: {'n_layers': 3, 'embedding_dim': 64, 'lr': 0.00037748801596819556, 'lambda_val': 0.0006793861457506547, 'batch_size': 3090, 'optimizer': 'SGD'}.
2026-06-23 09:39:52,790 - experiment_functions - INFO - Early stopping at epoch 1350. Best Metrics: (0.03183674150846888, 0.006610774283188077, 0.018160201648252647)
2026-06-23 09:39:52,933 - optuna.study.study - INFO - Trial 171 finished with values: [0.03183674150846888, 0.006610774283188077, 0.018160201648252647] and parameters: {'n_layers': 1, 'embedding_dim': 256, 'lr': 0.0016017140638771422, 'lambda_val': 0.0001268815967640493, 'batch_size': 1795, 'optimizer': 'Adam'}.
2026-06-23 09:42:32,867 - optuna.study.study - INFO - Trial 172 finished with values: [0.0014753154559273322, 0.0003789314134141721, 0.0008918717430657648] and parameters: {'n_layers': 1, 'embedding_dim': 32, 'lr': 0.0003681355466910888, 'lambda_val': 6.789699211207431e-05, 'batch_size': 1794, 'optimizer': 'Adam'}.
2026-06-23 09:45:43,850 - optuna.study.study - INFO - Trial 173 finished with values: [0.027646337662499413, 0.005977643046608564, 0.015700862183658754] and parameters: {'n_layers': 2, 'embedding_dim': 128, 'lr': 0.00037748801596819556, 'lambda_val': 0.0006793861457506547, 'batch_size': 3090, 'optimizer': 'Adam'}.
2026-06-23 09:46:44,159 - experiment_functions - INFO - Early stopping at epoch 1300. Best Metrics: (0.029546035335117165, 0.006151319944423393, 0.016807137018711397)
2026-06-23 09:46:44,266 - optuna.study.study - INFO - Trial 174 finished with values: [0.029546035335117165, 0.006151319944423393, 0.016807137018711397] and parameters: {'n_layers': 1, 'embedding_dim': 128, 'lr': 0.0024861194796259945, 'lambda_val': 2.615836668667667e-06, 'batch_size': 881, 'optimizer': 'Adam'}.
2026-06-23 09:47:23,198 - experiment_functions - INFO - Early stopping at epoch 850. Best Metrics: (0.000637621878576216, 0.00012788935202728306, 0.00034595614916768186)
2026-06-23 09:47:23,315 - optuna.study.study - INFO - Trial 175 finished with values: [0.000637621878576216, 0.00012788935202728306, 0.00034595614916768186] and parameters: {'n_layers': 1, 'embedding_dim': 128, 'lr': 0.0002939896747323976, 'lambda_val': 0.0010160497642274552, 'batch_size': 847, 'optimizer': 'Adam'}.
2026-06-23 09:50:20,610 - optuna.study.study - INFO - Trial 176 finished with values: [0.014146676584221918, 0.003266704559808008, 0.008472791926836828] and parameters: {'n_layers': 1, 'embedding_dim': 128, 'lr': 0.0003681355466910888, 'lambda_val': 6.789699211207431e-05, 'batch_size': 3253, 'optimizer': 'Adam'}.
2026-06-23 09:53:02,420 - optuna.study.study - INFO - Trial 177 finished with values: [0.006538183761787343, 0.0016009852216748769, 0.004087716244323194] and parameters: {'n_layers': 1, 'embedding_dim': 32, 'lr': 0.0003681355466910888, 'lambda_val': 0.0006793861457506547, 'batch_size': 3285, 'optimizer': 'Adam'}.
2026-06-23 09:53:52,070 - experiment_functions - INFO - Early stopping at epoch 1150. Best Metrics: (0.03115257333074368, 0.006648667424529494, 0.018006054257039106)
2026-06-23 09:53:52,227 - optuna.study.study - INFO - Trial 178 finished with values: [0.03115257333074368, 0.006648667424529494, 0.018006054257039106] and parameters: {'n_layers': 1, 'embedding_dim': 32, 'lr': 0.0016017140638771422, 'lambda_val': 0.0010657666266185159, 'batch_size': 2100, 'optimizer': 'RMSprop'}.
2026-06-23 09:54:37,301 - experiment_functions - INFO - Early stopping at epoch 950. Best Metrics: (0.030459789264441567, 0.006416571933813313, 0.017649719204905354)
2026-06-23 09:54:37,408 - optuna.study.study - INFO - Trial 179 finished with values: [0.030459789264441567, 0.006416571933813313, 0.017649719204905354] and parameters: {'n_layers': 1, 'embedding_dim': 128, 'lr': 0.0016017140638771422, 'lambda_val': 3.447042784972302e-05, 'batch_size': 3426, 'optimizer': 'RMSprop'}.
2026-06-23 09:55:17,195 - experiment_functions - INFO - Early stopping at epoch 850. Best Metrics: (0.021430101852640843, 0.004566123531640774, 0.012279288670276233)
2026-06-23 09:55:17,894 - optuna.study.study - INFO - Trial 180 finished with values: [0.021430101852640843, 0.004566123531640774, 0.012279288670276233] and parameters: {'n_layers': 1, 'embedding_dim': 128, 'lr': 0.003007555350761917, 'lambda_val': 3.447042784972302e-05, 'batch_size': 2100, 'optimizer': 'RMSprop'}.
2026-06-23 09:57:53,711 - experiment_functions - INFO - Early stopping at epoch 3450. Best Metrics: (0.03162059393433392, 0.006730769230769231, 0.018018815004674792)
2026-06-23 09:57:53,826 - optuna.study.study - INFO - Trial 181 finished with values: [0.03162059393433392, 0.006730769230769231, 0.018018815004674792] and parameters: {'n_layers': 1, 'embedding_dim': 128, 'lr': 0.0008906516956334841, 'lambda_val': 0.0012833571829398344, 'batch_size': 3129, 'optimizer': 'Adam'}.
2026-06-23 09:59:25,899 - experiment_functions - INFO - Early stopping at epoch 2100. Best Metrics: (0.004817511599625325, 0.0011083743842364533, 0.002632876470134692)
2026-06-23 09:59:26,003 - optuna.study.study - INFO - Trial 182 finished with values: [0.004817511599625325, 0.0011083743842364533, 0.002632876470134692] and parameters: {'n_layers': 1, 'embedding_dim': 128, 'lr': 0.07463315144872071, 'lambda_val': 0.02616767327029391, 'batch_size': 2469, 'optimizer': 'Adam'}.
2026-06-23 10:02:18,283 - optuna.study.study - INFO - Trial 183 finished with values: [0.010774432815674194, 0.002690413035240622, 0.006419456961651049] and parameters: {'n_layers': 1, 'embedding_dim': 128, 'lr': 0.0003681355466910888, 'lambda_val': 0.0027380357457200996, 'batch_size': 2100, 'optimizer': 'RMSprop'}.
2026-06-23 10:04:34,863 - experiment_functions - INFO - Early stopping at epoch 3100. Best Metrics: (0.033215024604415305, 0.007040229885057471, 0.01887529862414904)
2026-06-23 10:04:34,970 - optuna.study.study - INFO - Trial 184 finished with values: [0.033215024604415305, 0.007040229885057471, 0.01887529862414904] and parameters: {'n_layers': 1, 'embedding_dim': 96, 'lr': 0.0008906516956334841, 'lambda_val': 0.0010657666266185159, 'batch_size': 3129, 'optimizer': 'RMSprop'}.
2026-06-23 10:05:04,707 - experiment_functions - INFO - Early stopping at epoch 650. Best Metrics: (0.008223121448199637, 0.0018172919034988003, 0.004808191561166864)
2026-06-23 10:05:04,821 - optuna.study.study - INFO - Trial 185 finished with values: [0.008223121448199637, 0.0018172919034988003, 0.004808191561166864] and parameters: {'n_layers': 3, 'embedding_dim': 32, 'lr': 0.005823892895958369, 'lambda_val': 0.0006793861457506547, 'batch_size': 3129, 'optimizer': 'RMSprop'}.
2026-06-23 10:07:18,727 - experiment_functions - INFO - Early stopping at epoch 2800. Best Metrics: (0.025919530152444626, 0.005595553871415941, 0.014463346806908512)
2026-06-23 10:07:18,876 - optuna.study.study - INFO - Trial 186 finished with values: [0.025919530152444626, 0.005595553871415941, 0.014463346806908512] and parameters: {'n_layers': 3, 'embedding_dim': 96, 'lr': 0.0005393572995981927, 'lambda_val': 0.0010657666266185159, 'batch_size': 1102, 'optimizer': 'Adam'}.
2026-06-23 10:10:59,756 - optuna.study.study - INFO - Trial 187 finished with values: [0.02865910112285795, 0.006165529872426424, 0.016259994588247697] and parameters: {'n_layers': 2, 'embedding_dim': 256, 'lr': 0.0003681355466910888, 'lambda_val': 3.35268105957243e-05, 'batch_size': 3285, 'optimizer': 'Adam'}.
2026-06-23 10:11:50,851 - experiment_functions - INFO - Early stopping at epoch 1150. Best Metrics: (0.022170782509920852, 0.0047650625236832144, 0.012559391141409647)
2026-06-23 10:11:50,964 - optuna.study.study - INFO - Trial 188 finished with values: [0.022170782509920852, 0.0047650625236832144, 0.012559391141409647] and parameters: {'n_layers': 3, 'embedding_dim': 32, 'lr': 0.0008834137156031282, 'lambda_val': 3.447042784972302e-05, 'batch_size': 2475, 'optimizer': 'RMSprop'}.
2026-06-23 10:15:10,039 - optuna.study.study - INFO - Trial 189 finished with values: [0.02485302127499805, 0.005361879499810535, 0.013510756288272984] and parameters: {'n_layers': 3, 'embedding_dim': 128, 'lr': 0.0002866478653574494, 'lambda_val': 0.0006793861457506547, 'batch_size': 3285, 'optimizer': 'Adam'}.
2026-06-23 10:15:49,545 - experiment_functions - INFO - Early stopping at epoch 800. Best Metrics: (0.01825003457494333, 0.004247189592017179, 0.010411637356246754)
2026-06-23 10:15:49,940 - optuna.study.study - INFO - Trial 190 finished with values: [0.01825003457494333, 0.004247189592017179, 0.010411637356246754] and parameters: {'n_layers': 2, 'embedding_dim': 128, 'lr': 0.0009472628048121326, 'lambda_val': 0.019684317126267517, 'batch_size': 3610, 'optimizer': 'Adam'}.
2026-06-23 10:16:30,601 - experiment_functions - INFO - Early stopping at epoch 700. Best Metrics: (0.025520663233863223, 0.005545029682960718, 0.014753097571826307)
2026-06-23 10:16:30,703 - optuna.study.study - INFO - Trial 191 finished with values: [0.025520663233863223, 0.005545029682960718, 0.014753097571826307] and parameters: {'n_layers': 2, 'embedding_dim': 256, 'lr': 0.0016009175539215897, 'lambda_val': 0.0006793861457506547, 'batch_size': 3397, 'optimizer': 'Adam'}.
2026-06-23 10:16:59,708 - experiment_functions - INFO - Early stopping at epoch 650. Best Metrics: (0.03058422019164893, 0.006337627889352027, 0.017492419934230792)
2026-06-23 10:16:59,854 - optuna.study.study - INFO - Trial 192 finished with values: [0.03058422019164893, 0.006337627889352027, 0.017492419934230792] and parameters: {'n_layers': 1, 'embedding_dim': 32, 'lr': 0.005823892895958369, 'lambda_val': 0.0006793861457506547, 'batch_size': 3129, 'optimizer': 'Adam'}.
2026-06-23 10:20:40,917 - optuna.study.study - INFO - Trial 193 finished with values: [0.029733026551292768, 0.00641025641025641, 0.016856510138996136] and parameters: {'n_layers': 2, 'embedding_dim': 256, 'lr': 0.00037748801596819556, 'lambda_val': 1.5553043024267715e-06, 'batch_size': 2813, 'optimizer': 'RMSprop'}.
2026-06-23 10:23:33,429 - optuna.study.study - INFO - Trial 194 finished with values: [0.015593737203394267, 0.0037719464443602374, 0.00936594036840827] and parameters: {'n_layers': 1, 'embedding_dim': 96, 'lr': 0.00037748801596819556, 'lambda_val': 0.004302420505385955, 'batch_size': 2813, 'optimizer': 'RMSprop'}.
2026-06-23 10:24:08,608 - experiment_functions - INFO - Early stopping at epoch 650. Best Metrics: (0.02146546558768708, 0.0046892762410003785, 0.012237532112912113)
2026-06-23 10:24:08,924 - optuna.study.study - INFO - Trial 195 finished with values: [0.02146546558768708, 0.0046892762410003785, 0.012237532112912113] and parameters: {'n_layers': 3, 'embedding_dim': 128, 'lr': 0.0016017140638771422, 'lambda_val': 1.033711147166284e-06, 'batch_size': 3253, 'optimizer': 'Adam'}.
2026-06-23 10:24:46,143 - experiment_functions - INFO - Early stopping at epoch 700. Best Metrics: (0.028789020848664807, 0.00611184792219275, 0.016758443545836398)
2026-06-23 10:24:46,254 - optuna.study.study - INFO - Trial 196 finished with values: [0.028789020848664807, 0.00611184792219275, 0.016758443545836398] and parameters: {'n_layers': 1, 'embedding_dim': 256, 'lr': 0.003808349234575029, 'lambda_val': 1.033711147166284e-06, 'batch_size': 3253, 'optimizer': 'Adam'}.
2026-06-23 10:28:06,076 - optuna.study.study - INFO - Trial 197 finished with values: [0.02380717248950224, 0.005342932929139826, 0.013749248944141791] and parameters: {'n_layers': 4, 'embedding_dim': 96, 'lr': 0.00031010998647899147, 'lambda_val': 0.0010160497642274552, 'batch_size': 847, 'optimizer': 'RMSprop'}.
2026-06-23 10:28:45,084 - experiment_functions - INFO - Early stopping at epoch 850. Best Metrics: (0.01741516941512402, 0.003764052039914109, 0.00979348099149146)
2026-06-23 10:28:45,242 - optuna.study.study - INFO - Trial 198 finished with values: [0.01741516941512402, 0.003764052039914109, 0.00979348099149146] and parameters: {'n_layers': 4, 'embedding_dim': 32, 'lr': 0.0008906516956334841, 'lambda_val': 5.8617508553429225e-05, 'batch_size': 3372, 'optimizer': 'Adam'}.
2026-06-23 10:29:20,684 - experiment_functions - INFO - Early stopping at epoch 800. Best Metrics: (0.02753908083894314, 0.0058939623594796, 0.015603082669604623)
2026-06-23 10:29:21,035 - optuna.study.study - INFO - Trial 199 finished with values: [0.02753908083894314, 0.0058939623594796, 0.015603082669604623] and parameters: {'n_layers': 1, 'embedding_dim': 32, 'lr': 0.0017036472251956306, 'lambda_val': 0.007151036194229829, 'batch_size': 2693, 'optimizer': 'RMSprop'}.
2026-06-23 10:30:07,706 - experiment_functions - INFO - Early stopping at epoch 1000. Best Metrics: (0.03218124031107676, 0.006852343059239611, 0.018528385526514042)
2026-06-23 10:30:07,813 - optuna.study.study - INFO - Trial 200 finished with values: [0.03218124031107676, 0.006852343059239611, 0.018528385526514042] and parameters: {'n_layers': 1, 'embedding_dim': 96, 'lr': 0.0017924637075651337, 'lambda_val': 3.447042784972302e-05, 'batch_size': 3397, 'optimizer': 'Adam'}.
2026-06-23 10:30:45,799 - experiment_functions - INFO - Early stopping at epoch 850. Best Metrics: (0.01594847683129967, 0.0034198560060629025, 0.008719349893817799)
2026-06-23 10:30:45,905 - optuna.study.study - INFO - Trial 201 finished with values: [0.01594847683129967, 0.0034198560060629025, 0.008719349893817799] and parameters: {'n_layers': 2, 'embedding_dim': 32, 'lr': 0.0022343781198016265, 'lambda_val': 0.0010657666266185159, 'batch_size': 2100, 'optimizer': 'RMSprop'}.
2026-06-23 10:31:44,221 - experiment_functions - INFO - Early stopping at epoch 1250. Best Metrics: (0.03104031093809464, 0.0064323607427055705, 0.018093622409377626)
2026-06-23 10:31:44,393 - optuna.study.study - INFO - Trial 202 finished with values: [0.03104031093809464, 0.0064323607427055705, 0.018093622409377626] and parameters: {'n_layers': 1, 'embedding_dim': 128, 'lr': 0.0017924637075651337, 'lambda_val': 2.773307388606753e-05, 'batch_size': 3397, 'optimizer': 'Adam'}.
2026-06-23 10:32:35,927 - experiment_functions - INFO - Early stopping at epoch 750. Best Metrics: (0.011079544385831802, 0.002332007073386384, 0.005753624927360341)
2026-06-23 10:32:36,054 - optuna.study.study - INFO - Trial 203 finished with values: [0.011079544385831802, 0.002332007073386384, 0.005753624927360341] and parameters: {'n_layers': 4, 'embedding_dim': 256, 'lr': 0.0016017140638771422, 'lambda_val': 0.0001268815967640493, 'batch_size': 1795, 'optimizer': 'Adam'}.
2026-06-23 10:35:37,305 - optuna.study.study - INFO - Trial 204 finished with values: [0.022671481667017726, 0.005106100795755968, 0.012931338989644471] and parameters: {'n_layers': 2, 'embedding_dim': 96, 'lr': 0.0002866478653574494, 'lambda_val': 0.007151036194229829, 'batch_size': 3129, 'optimizer': 'Adam'}.
2026-06-23 10:37:39,606 - experiment_functions - INFO - Early stopping at epoch 2700. Best Metrics: (0.03330845229282941, 0.006936023746368573, 0.01915485460063587)
2026-06-23 10:37:39,713 - optuna.study.study - INFO - Trial 205 finished with values: [0.03330845229282941, 0.006936023746368573, 0.01915485460063587] and parameters: {'n_layers': 1, 'embedding_dim': 128, 'lr': 0.0008906516956334841, 'lambda_val': 0.0010657666266185159, 'batch_size': 3253, 'optimizer': 'RMSprop'}.
2026-06-23 10:38:13,859 - experiment_functions - INFO - Early stopping at epoch 750. Best Metrics: (0.029844719128650922, 0.0063044713906782865, 0.017265095751847957)
2026-06-23 10:38:14,058 - optuna.study.study - INFO - Trial 206 finished with values: [0.029844719128650922, 0.0063044713906782865, 0.017265095751847957] and parameters: {'n_layers': 1, 'embedding_dim': 64, 'lr': 0.003808349234575029, 'lambda_val': 4.782028134253512e-05, 'batch_size': 2469, 'optimizer': 'Adam'}.
2026-06-23 10:38:37,424 - experiment_functions - INFO - Early stopping at epoch 500. Best Metrics: (0.0004616059370291858, 0.00010894278135657447, 0.0002762486930169052)
2026-06-23 10:38:37,534 - optuna.study.study - INFO - Trial 207 finished with values: [0.0004616059370291858, 0.00010894278135657447, 0.0002762486930169052] and parameters: {'n_layers': 1, 'embedding_dim': 96, 'lr': 0.0016017140638771422, 'lambda_val': 1.5553043024267715e-06, 'batch_size': 3253, 'optimizer': 'SGD'}.
2026-06-23 10:40:56,301 - experiment_functions - INFO - Early stopping at epoch 3150. Best Metrics: (0.033474568724229076, 0.007079701907288114, 0.018911934729447705)
2026-06-23 10:40:56,406 - optuna.study.study - INFO - Trial 208 finished with values: [0.033474568724229076, 0.007079701907288114, 0.018911934729447705] and parameters: {'n_layers': 1, 'embedding_dim': 96, 'lr': 0.0008906516956334841, 'lambda_val': 0.0010657666266185159, 'batch_size': 3129, 'optimizer': 'RMSprop'}.
2026-06-23 10:41:48,429 - experiment_functions - INFO - Early stopping at epoch 1050. Best Metrics: (0.027066105482214907, 0.005783440697233802, 0.01559138295937573)
2026-06-23 10:41:48,585 - optuna.study.study - INFO - Trial 209 finished with values: [0.027066105482214907, 0.005783440697233802, 0.01559138295937573] and parameters: {'n_layers': 2, 'embedding_dim': 128, 'lr': 0.0008873329418261425, 'lambda_val': 0.0001268815967640493, 'batch_size': 3429, 'optimizer': 'Adam'}.
2026-06-23 10:43:58,878 - experiment_functions - INFO - Early stopping at epoch 2950. Best Metrics: (0.03294333784401125, 0.006999178981937603, 0.018937862163550184)
2026-06-23 10:43:58,980 - optuna.study.study - INFO - Trial 210 finished with values: [0.03294333784401125, 0.006999178981937603, 0.018937862163550184] and parameters: {'n_layers': 1, 'embedding_dim': 96, 'lr': 0.0008906516956334841, 'lambda_val': 0.0010657666266185159, 'batch_size': 3253, 'optimizer': 'Adam'}.
2026-06-23 10:45:35,422 - experiment_functions - INFO - Early stopping at epoch 2300. Best Metrics: (0.03387572911322905, 0.007056018693949729, 0.02007596266607423)
2026-06-23 10:45:35,526 - optuna.study.study - INFO - Trial 211 finished with values: [0.03387572911322905, 0.007056018693949729, 0.02007596266607423] and parameters: {'n_layers': 1, 'embedding_dim': 32, 'lr': 0.0016017140638771422, 'lambda_val': 1.033711147166284e-06, 'batch_size': 1106, 'optimizer': 'Adam'}.
2026-06-23 10:46:37,395 - experiment_functions - INFO - Early stopping at epoch 1350. Best Metrics: (0.031876125209844, 0.006623405330301882, 0.018464256789986817)
2026-06-23 10:46:37,497 - optuna.study.study - INFO - Trial 212 finished with values: [0.031876125209844, 0.006623405330301882, 0.018464256789986817] and parameters: {'n_layers': 1, 'embedding_dim': 128, 'lr': 0.0017924637075651337, 'lambda_val': 1.463178006611751e-06, 'batch_size': 1795, 'optimizer': 'Adam'}.
2026-06-23 10:47:02,335 - experiment_functions - INFO - Early stopping at epoch 550. Best Metrics: (0.0006096713833579932, 0.00015473032714412026, 0.0003337411494845645)
