2026-06-17 19:57:14,784 - optuna.study.study - INFO - Trial 176 finished with values: [0.00257115905410108, 0.0006836554250347354, 0.001698631809515346] and parameters: {'n_layers': 3, 'embedding_dim': 128, 'lr': 0.01923671087851685, 'lambda_val': 2.1183457368999824e-05, 'batch_size': 1257, 'optimizer': 'RMSprop'}.
2026-06-17 19:57:48,877 - experiment_functions - INFO - Early stopping at epoch 600. Best Metrics: (0.0031517623486207094, 0.0008020714917266641, 0.002020615386420389)
2026-06-17 19:57:48,972 - optuna.study.study - INFO - Trial 177 finished with values: [0.0031517623486207094, 0.0008020714917266641, 0.002020615386420389] and parameters: {'n_layers': 4, 'embedding_dim': 256, 'lr': 0.005496905689472121, 'lambda_val': 4.4572768261600244e-05, 'batch_size': 3947, 'optimizer': 'RMSprop'}.
2026-06-17 19:58:18,714 - experiment_functions - INFO - Early stopping at epoch 650. Best Metrics: (0.0027244959934835814, 0.0006789187823670582, 0.0016883440160172908)
2026-06-17 19:58:19,253 - optuna.study.study - INFO - Trial 178 finished with values: [0.0027244959934835814, 0.0006789187823670582, 0.0016883440160172908] and parameters: {'n_layers': 3, 'embedding_dim': 96, 'lr': 0.0032052069599508804, 'lambda_val': 0.007966424359481514, 'batch_size': 1549, 'optimizer': 'Adam'}.
2026-06-17 19:59:56,025 - experiment_functions - INFO - Early stopping at epoch 2400. Best Metrics: (0.004581125800773437, 0.001053113553113553, 0.0028489047046761427)
2026-06-17 19:59:56,105 - optuna.study.study - INFO - Trial 179 finished with values: [0.004581125800773437, 0.001053113553113553, 0.0028489047046761427] and parameters: {'n_layers': 3, 'embedding_dim': 32, 'lr': 0.0012702568149946026, 'lambda_val': 2.3768863399722796e-06, 'batch_size': 806, 'optimizer': 'RMSprop'}.
2026-06-17 20:00:45,682 - experiment_functions - INFO - Early stopping at epoch 950. Best Metrics: (0.0033815820660344667, 0.0008652267272956927, 0.0021520940045513556)
2026-06-17 20:00:45,755 - optuna.study.study - INFO - Trial 180 finished with values: [0.0033815820660344667, 0.0008652267272956927, 0.0021520940045513556] and parameters: {'n_layers': 3, 'embedding_dim': 256, 'lr': 0.0015933103817621604, 'lambda_val': 0.000105123201052829, 'batch_size': 1377, 'optimizer': 'RMSprop'}.
2026-06-17 20:01:11,857 - experiment_functions - INFO - Early stopping at epoch 600. Best Metrics: (0.002467178645994772, 0.0006378678792471896, 0.00161556925054659)
2026-06-17 20:01:12,365 - optuna.study.study - INFO - Trial 181 finished with values: [0.002467178645994772, 0.0006378678792471896, 0.00161556925054659] and parameters: {'n_layers': 3, 'embedding_dim': 32, 'lr': 0.010977035495288605, 'lambda_val': 2.213584038265765e-05, 'batch_size': 1787, 'optimizer': 'Adam'}.
2026-06-17 20:02:02,109 - experiment_functions - INFO - Early stopping at epoch 1200. Best Metrics: (0.0029486811467498365, 0.0007578628268283442, 0.001966839156761386)
2026-06-17 20:02:02,186 - optuna.study.study - INFO - Trial 182 finished with values: [0.0029486811467498365, 0.0007578628268283442, 0.001966839156761386] and parameters: {'n_layers': 3, 'embedding_dim': 32, 'lr': 0.0015933103817621604, 'lambda_val': 0.00015440813799502288, 'batch_size': 1849, 'optimizer': 'Adam'}.
2026-06-17 20:02:30,786 - experiment_functions - INFO - Early stopping at epoch 600. Best Metrics: (0.0031977566374124973, 0.0007941770872805356, 0.001994030515312696)
2026-06-17 20:02:30,874 - optuna.study.study - INFO - Trial 183 finished with values: [0.0031977566374124973, 0.0007941770872805356, 0.001994030515312696] and parameters: {'n_layers': 4, 'embedding_dim': 96, 'lr': 0.004937154060813022, 'lambda_val': 0.00015820612384227593, 'batch_size': 2599, 'optimizer': 'Adam'}.
2026-06-17 20:03:12,798 - experiment_functions - INFO - Early stopping at epoch 950. Best Metrics: (0.003201228672751186, 0.0007326007326007326, 0.001998698034435752)
2026-06-17 20:03:12,868 - optuna.study.study - INFO - Trial 184 finished with values: [0.003201228672751186, 0.0007326007326007326, 0.001998698034435752] and parameters: {'n_layers': 4, 'embedding_dim': 64, 'lr': 0.0012329536436234642, 'lambda_val': 0.0069523388896965115, 'batch_size': 927, 'optimizer': 'Adam'}.
2026-06-17 20:03:36,055 - experiment_functions - INFO - Early stopping at epoch 500. Best Metrics: (0.00044995669978212304, 9.789061513199445e-05, 0.00026962655078200044)
2026-06-17 20:03:36,134 - optuna.study.study - INFO - Trial 185 finished with values: [0.00044995669978212304, 9.789061513199445e-05, 0.00026962655078200044] and parameters: {'n_layers': 4, 'embedding_dim': 64, 'lr': 0.0008244869685256396, 'lambda_val': 8.796328661080472e-05, 'batch_size': 1377, 'optimizer': 'SGD'}.
2026-06-17 20:04:01,739 - experiment_functions - INFO - Early stopping at epoch 550. Best Metrics: (0.0029702617973674066, 0.0007562839459391182, 0.0018521378219724237)
2026-06-17 20:04:01,836 - optuna.study.study - INFO - Trial 186 finished with values: [0.0029702617973674066, 0.0007562839459391182, 0.0018521378219724237] and parameters: {'n_layers': 3, 'embedding_dim': 96, 'lr': 0.01562100019075772, 'lambda_val': 0.00028552702489926396, 'batch_size': 523, 'optimizer': 'Adam'}.
2026-06-17 20:04:56,483 - experiment_functions - INFO - Early stopping at epoch 1200. Best Metrics: (0.0033986642917037215, 0.0008431223948465328, 0.002043276455143925)
2026-06-17 20:04:56,579 - optuna.study.study - INFO - Trial 187 finished with values: [0.0033986642917037215, 0.0008431223948465328, 0.002043276455143925] and parameters: {'n_layers': 4, 'embedding_dim': 96, 'lr': 0.001133829974266937, 'lambda_val': 8.796328661080472e-05, 'batch_size': 2347, 'optimizer': 'Adam'}.
2026-06-17 20:07:40,537 - optuna.study.study - INFO - Trial 188 finished with values: [0.0030406161941101276, 0.0007026019957054441, 0.0018781919598442542] and parameters: {'n_layers': 3, 'embedding_dim': 64, 'lr': 0.0003063523873638634, 'lambda_val': 0.000105123201052829, 'batch_size': 3820, 'optimizer': 'RMSprop'}.
2026-06-17 20:08:08,589 - experiment_functions - INFO - Early stopping at epoch 600. Best Metrics: (0.0030544759297601895, 0.0007720727548313756, 0.0020388341042829584)
2026-06-17 20:08:08,656 - optuna.study.study - INFO - Trial 189 finished with values: [0.0030544759297601895, 0.0007720727548313756, 0.0020388341042829584] and parameters: {'n_layers': 4, 'embedding_dim': 96, 'lr': 0.004937154060813022, 'lambda_val': 0.0006815323607434931, 'batch_size': 1377, 'optimizer': 'Adam'}.
2026-06-17 20:08:35,702 - experiment_functions - INFO - Early stopping at epoch 600. Best Metrics: (0.0032322454936722232, 0.0008020714917266641, 0.002077023082891226)
2026-06-17 20:08:35,778 - optuna.study.study - INFO - Trial 190 finished with values: [0.0032322454936722232, 0.0008020714917266641, 0.002077023082891226] and parameters: {'n_layers': 4, 'embedding_dim': 64, 'lr': 0.009940147183797932, 'lambda_val': 6.0082896507722305e-05, 'batch_size': 1752, 'optimizer': 'Adam'}.
2026-06-17 20:10:52,454 - experiment_functions - INFO - Early stopping at epoch 3200. Best Metrics: (0.002947552357616253, 0.0007010231148162183, 0.001859412221318712)
2026-06-17 20:10:52,534 - optuna.study.study - INFO - Trial 191 finished with values: [0.002947552357616253, 0.0007010231148162183, 0.001859412221318712] and parameters: {'n_layers': 3, 'embedding_dim': 96, 'lr': 0.000416242081306151, 'lambda_val': 1.3870977953506033e-05, 'batch_size': 3991, 'optimizer': 'Adam'}.
2026-06-17 20:11:33,825 - experiment_functions - INFO - Early stopping at epoch 1000. Best Metrics: (0.0031976172403121363, 0.000691549829480864, 0.0019555732178234983)
2026-06-17 20:11:33,910 - optuna.study.study - INFO - Trial 192 finished with values: [0.0031976172403121363, 0.000691549829480864, 0.0019555732178234983] and parameters: {'n_layers': 1, 'embedding_dim': 64, 'lr': 0.0032052069599508804, 'lambda_val': 4.337539728895895e-06, 'batch_size': 1751, 'optimizer': 'RMSprop'}.
2026-06-17 20:13:03,969 - experiment_functions - INFO - Early stopping at epoch 2000. Best Metrics: (0.0028014549619328538, 0.0006820765441455097, 0.0017811210421742746)
2026-06-17 20:13:04,061 - optuna.study.study - INFO - Trial 193 finished with values: [0.0028014549619328538, 0.0006820765441455097, 0.0017811210421742746] and parameters: {'n_layers': 1, 'embedding_dim': 256, 'lr': 0.0036567747130372475, 'lambda_val': 9.638501122128868e-05, 'batch_size': 1751, 'optimizer': 'Adam'}.
2026-06-17 20:13:29,358 - experiment_functions - INFO - Early stopping at epoch 550. Best Metrics: (0.0024965842765440633, 0.0006962864721485411, 0.001709522373786859)
2026-06-17 20:13:29,543 - optuna.study.study - INFO - Trial 194 finished with values: [0.0024965842765440633, 0.0006962864721485411, 0.001709522373786859] and parameters: {'n_layers': 4, 'embedding_dim': 64, 'lr': 0.04068195973191426, 'lambda_val': 1.0818419997025342e-05, 'batch_size': 1713, 'optimizer': 'Adam'}.
2026-06-17 20:14:17,509 - experiment_functions - INFO - Early stopping at epoch 1100. Best Metrics: (0.0033415083442509433, 0.0008304913477327272, 0.0021193984068106687)
2026-06-17 20:14:17,598 - optuna.study.study - INFO - Trial 195 finished with values: [0.0033415083442509433, 0.0008304913477327272, 0.0021193984068106687] and parameters: {'n_layers': 4, 'embedding_dim': 64, 'lr': 0.0012329536436234642, 'lambda_val': 0.0069523388896965115, 'batch_size': 806, 'optimizer': 'Adam'}.
2026-06-17 20:14:50,630 - experiment_functions - INFO - Early stopping at epoch 750. Best Metrics: (0.00298744949141371, 0.000731021851711507, 0.0018759944757140545)
2026-06-17 20:14:50,707 - optuna.study.study - INFO - Trial 196 finished with values: [0.00298744949141371, 0.000731021851711507, 0.0018759944757140545] and parameters: {'n_layers': 3, 'embedding_dim': 64, 'lr': 0.0036567747130372475, 'lambda_val': 9.638501122128868e-05, 'batch_size': 3410, 'optimizer': 'Adam'}.
2026-06-17 20:15:32,776 - experiment_functions - INFO - Early stopping at epoch 950. Best Metrics: (0.0031141552131921002, 0.0007689149930529242, 0.001959114457071745)
2026-06-17 20:15:32,867 - optuna.study.study - INFO - Trial 197 finished with values: [0.0031141552131921002, 0.0007689149930529242, 0.001959114457071745] and parameters: {'n_layers': 2, 'embedding_dim': 128, 'lr': 0.0012702568149946026, 'lambda_val': 8.796328661080472e-05, 'batch_size': 3943, 'optimizer': 'RMSprop'}.
2026-06-17 20:15:59,320 - experiment_functions - INFO - Early stopping at epoch 600. Best Metrics: (0.002887886943832742, 0.0006552355690286725, 0.0018239204025008726)
2026-06-17 20:15:59,399 - optuna.study.study - INFO - Trial 198 finished with values: [0.002887886943832742, 0.0006552355690286725, 0.0018239204025008726] and parameters: {'n_layers': 1, 'embedding_dim': 96, 'lr': 0.0032052069599508804, 'lambda_val': 0.0013772072191801396, 'batch_size': 1751, 'optimizer': 'RMSprop'}.
2026-06-17 20:18:52,812 - optuna.study.study - INFO - Trial 199 finished with values: [0.002554068034666435, 0.0005841859290135152, 0.0016723614724743696] and parameters: {'n_layers': 4, 'embedding_dim': 96, 'lr': 0.00022989906627076726, 'lambda_val': 0.00015820612384227593, 'batch_size': 1377, 'optimizer': 'RMSprop'}.
2026-06-17 20:19:36,242 - experiment_functions - INFO - Early stopping at epoch 1050. Best Metrics: (0.003221607535356178, 0.0007057597574838954, 0.0020061136477132267)
2026-06-17 20:19:36,314 - optuna.study.study - INFO - Trial 200 finished with values: [0.003221607535356178, 0.0007057597574838954, 0.0020061136477132267] and parameters: {'n_layers': 3, 'embedding_dim': 32, 'lr': 0.0009406294536470243, 'lambda_val': 0.00015440813799502288, 'batch_size': 3947, 'optimizer': 'RMSprop'}.
2026-06-17 20:20:07,058 - experiment_functions - INFO - Early stopping at epoch 700. Best Metrics: (0.0035916749756112237, 0.0008904888215233044, 0.0023190090198818374)
2026-06-17 20:20:07,138 - optuna.study.study - INFO - Trial 201 finished with values: [0.0035916749756112237, 0.0008904888215233044, 0.0023190090198818374] and parameters: {'n_layers': 3, 'embedding_dim': 64, 'lr': 0.0032052069599508804, 'lambda_val': 4.337539728895895e-06, 'batch_size': 1849, 'optimizer': 'RMSprop'}.
2026-06-17 20:20:42,700 - experiment_functions - INFO - Early stopping at epoch 850. Best Metrics: (0.002951312006583326, 0.0006978653530377669, 0.0018894923914644106)
2026-06-17 20:20:42,797 - optuna.study.study - INFO - Trial 202 finished with values: [0.002951312006583326, 0.0006978653530377669, 0.0018894923914644106] and parameters: {'n_layers': 1, 'embedding_dim': 64, 'lr': 0.0032052069599508804, 'lambda_val': 4.337539728895895e-06, 'batch_size': 1751, 'optimizer': 'RMSprop'}.
2026-06-17 20:21:40,766 - experiment_functions - INFO - Early stopping at epoch 1350. Best Metrics: (0.0035188622620245667, 0.0008683844890741443, 0.0021936220392422628)
2026-06-17 20:21:40,845 - optuna.study.study - INFO - Trial 203 finished with values: [0.0035188622620245667, 0.0008683844890741443, 0.0021936220392422628] and parameters: {'n_layers': 4, 'embedding_dim': 64, 'lr': 0.0012702568149946026, 'lambda_val': 0.00010081340740714468, 'batch_size': 1377, 'optimizer': 'Adam'}.
2026-06-17 20:22:26,749 - experiment_functions - INFO - Early stopping at epoch 1000. Best Metrics: (0.0030879263943843303, 0.0007878615637236328, 0.0019134602359612359)
2026-06-17 20:22:26,831 - optuna.study.study - INFO - Trial 204 finished with values: [0.0030879263943843303, 0.0007878615637236328, 0.0019134602359612359] and parameters: {'n_layers': 4, 'embedding_dim': 96, 'lr': 0.0036567747130372475, 'lambda_val': 6.0082896507722305e-05, 'batch_size': 2347, 'optimizer': 'Adam'}.
2026-06-17 20:23:19,799 - experiment_functions - INFO - Early stopping at epoch 950. Best Metrics: (0.0032648316477737844, 0.0008273335859542757, 0.002001830922851341)
2026-06-17 20:23:19,886 - optuna.study.study - INFO - Trial 205 finished with values: [0.0032648316477737844, 0.0008273335859542757, 0.002001830922851341] and parameters: {'n_layers': 4, 'embedding_dim': 256, 'lr': 0.0017271653443455424, 'lambda_val': 6.0082896507722305e-05, 'batch_size': 3850, 'optimizer': 'Adam'}.
2026-06-17 20:26:14,369 - experiment_functions - INFO - Early stopping at epoch 3300. Best Metrics: (0.003767710794600208, 0.0009252242010862702, 0.002260856108310291)
2026-06-17 20:26:14,445 - optuna.study.study - INFO - Trial 206 finished with values: [0.003767710794600208, 0.0009252242010862702, 0.002260856108310291] and parameters: {'n_layers': 4, 'embedding_dim': 256, 'lr': 0.00046336596032942024, 'lambda_val': 4.337539728895895e-06, 'batch_size': 3749, 'optimizer': 'RMSprop'}.
2026-06-17 20:26:46,584 - experiment_functions - INFO - Early stopping at epoch 750. Best Metrics: (0.0026971243633511595, 0.0006126057850195782, 0.0016565646553114283)
2026-06-17 20:26:46,661 - optuna.study.study - INFO - Trial 207 finished with values: [0.0026971243633511595, 0.0006126057850195782, 0.0016565646553114283] and parameters: {'n_layers': 1, 'embedding_dim': 64, 'lr': 0.0032052069599508804, 'lambda_val': 4.337539728895895e-06, 'batch_size': 3241, 'optimizer': 'RMSprop'}.
2026-06-17 20:27:18,446 - experiment_functions - INFO - Early stopping at epoch 650. Best Metrics: (0.003610187870118682, 0.0009094353921940129, 0.002176687760688573)
2026-06-17 20:27:18,565 - optuna.study.study - INFO - Trial 208 finished with values: [0.003610187870118682, 0.0009094353921940129, 0.002176687760688573] and parameters: {'n_layers': 4, 'embedding_dim': 128, 'lr': 0.0032052069599508804, 'lambda_val': 8.796328661080472e-05, 'batch_size': 1341, 'optimizer': 'RMSprop'}.
2026-06-17 20:27:59,094 - experiment_functions - INFO - Early stopping at epoch 850. Best Metrics: (0.003656662171828737, 0.0009646962233169129, 0.002297057499622067)
2026-06-17 20:27:59,209 - optuna.study.study - INFO - Trial 209 finished with values: [0.003656662171828737, 0.0009646962233169129, 0.002297057499622067] and parameters: {'n_layers': 4, 'embedding_dim': 128, 'lr': 0.0032052069599508804, 'lambda_val': 1.3870977953506033e-05, 'batch_size': 806, 'optimizer': 'RMSprop'}.
2026-06-17 20:28:28,333 - experiment_functions - INFO - Early stopping at epoch 650. Best Metrics: (0.0031555739473271105, 0.0007910193255020842, 0.002025463525317035)
2026-06-17 20:28:28,625 - optuna.study.study - INFO - Trial 210 finished with values: [0.0031555739473271105, 0.0007910193255020842, 0.002025463525317035] and parameters: {'n_layers': 4, 'embedding_dim': 64, 'lr': 0.0036567747130372475, 'lambda_val': 0.0049960575447084415, 'batch_size': 1377, 'optimizer': 'Adam'}.
2026-06-17 20:31:12,289 - optuna.study.study - INFO - Trial 211 finished with values: [0.0034273048502802316, 0.0007610205886067955, 0.0020486583090389646] and parameters: {'n_layers': 3, 'embedding_dim': 64, 'lr': 0.000416242081306151, 'lambda_val': 0.00040852653324075796, 'batch_size': 1849, 'optimizer': 'Adam'}.
2026-06-17 20:32:05,139 - experiment_functions - INFO - Early stopping at epoch 1250. Best Metrics: (0.0016911969230482297, 0.0005052418845522293, 0.0011074843373777177)
2026-06-17 20:32:05,217 - optuna.study.study - INFO - Trial 212 finished with values: [0.0016911969230482297, 0.0005052418845522293, 0.0011074843373777177] and parameters: {'n_layers': 3, 'embedding_dim': 64, 'lr': 0.0582607949233013, 'lambda_val': 0.015390462043555524, 'batch_size': 1849, 'optimizer': 'RMSprop'}.
2026-06-17 20:34:38,372 - experiment_functions - INFO - Early stopping at epoch 2900. Best Metrics: (0.0006142055225500097, 0.00011683718580270305, 0.000319686068667486)
2026-06-17 20:34:38,493 - optuna.study.study - INFO - Trial 213 finished with values: [0.0006142055225500097, 0.00011683718580270305, 0.000319686068667486] and parameters: {'n_layers': 4, 'embedding_dim': 256, 'lr': 1.9869818295144646e-05, 'lambda_val': 0.002699561195512288, 'batch_size': 1849, 'optimizer': 'Adam'}.
2026-06-17 20:35:03,657 - experiment_functions - INFO - Early stopping at epoch 550. Best Metrics: (0.003038616597361252, 0.0007610205886067955, 0.0019606249826710736)
2026-06-17 20:35:03,740 - optuna.study.study - INFO - Trial 214 finished with values: [0.003038616597361252, 0.0007610205886067955, 0.0019606249826710736] and parameters: {'n_layers': 4, 'embedding_dim': 64, 'lr': 0.01562100019075772, 'lambda_val': 4.337539728895895e-06, 'batch_size': 1463, 'optimizer': 'Adam'}.
2026-06-17 20:36:40,311 - experiment_functions - INFO - Early stopping at epoch 2100. Best Metrics: (0.004034637297890667, 0.0010246936971074904, 0.0026407429093411464)
2026-06-17 20:36:40,398 - optuna.study.study - INFO - Trial 215 finished with values: [0.004034637297890667, 0.0010246936971074904, 0.0026407429093411464] and parameters: {'n_layers': 4, 'embedding_dim': 128, 'lr': 0.0012702568149946026, 'lambda_val': 1.3870977953506033e-05, 'batch_size': 806, 'optimizer': 'RMSprop'}.
2026-06-17 20:37:45,738 - experiment_functions - INFO - Early stopping at epoch 1450. Best Metrics: (0.003116457339320519, 0.0008462801566249843, 0.002003194402323045)
2026-06-17 20:37:45,814 - optuna.study.study - INFO - Trial 216 finished with values: [0.003116457339320519, 0.0008462801566249843, 0.002003194402323045] and parameters: {'n_layers': 3, 'embedding_dim': 128, 'lr': 0.0032052069599508804, 'lambda_val': 2.3768863399722796e-06, 'batch_size': 1680, 'optimizer': 'RMSprop'}.
2026-06-17 20:38:35,306 - experiment_functions - INFO - Early stopping at epoch 950. Best Metrics: (0.003203133811402823, 0.0008241758241758242, 0.0020105132876691474)
2026-06-17 20:38:35,403 - optuna.study.study - INFO - Trial 217 finished with values: [0.003203133811402823, 0.0008241758241758242, 0.0020105132876691474] and parameters: {'n_layers': 3, 'embedding_dim': 256, 'lr': 0.0032052069599508804, 'lambda_val': 4.337539728895895e-06, 'batch_size': 1751, 'optimizer': 'Adam'}.
2026-06-17 20:39:32,358 - experiment_functions - INFO - Early stopping at epoch 1350. Best Metrics: (0.0034014819202469173, 0.0007720727548313756, 0.0021324907006630457)
2026-06-17 20:39:32,434 - optuna.study.study - INFO - Trial 218 finished with values: [0.0034014819202469173, 0.0007720727548313756, 0.0021324907006630457] and parameters: {'n_layers': 1, 'embedding_dim': 128, 'lr': 0.0015933103817621604, 'lambda_val': 0.000105123201052829, 'batch_size': 1200, 'optimizer': 'RMSprop'}.
2026-06-17 20:40:01,641 - experiment_functions - INFO - Early stopping at epoch 650. Best Metrics: (0.0028515374392587664, 0.0006773399014778326, 0.001871414061917518)
2026-06-17 20:40:01,746 - optuna.study.study - INFO - Trial 219 finished with values: [0.0028515374392587664, 0.0006773399014778326, 0.001871414061917518] and parameters: {'n_layers': 4, 'embedding_dim': 32, 'lr': 0.0032052069599508804, 'lambda_val': 0.00027195197586368466, 'batch_size': 2509, 'optimizer': 'Adam'}.
2026-06-17 20:42:18,604 - experiment_functions - INFO - Early stopping at epoch 3150. Best Metrics: (0.0006627158643723221, 0.00015630920803334596, 0.0003799185853067822)
2026-06-17 20:42:18,674 - optuna.study.study - INFO - Trial 220 finished with values: [0.0006627158643723221, 0.00015630920803334596, 0.0003799185853067822] and parameters: {'n_layers': 4, 'embedding_dim': 64, 'lr': 6.323834533800726e-05, 'lambda_val': 0.0069523388896965115, 'batch_size': 806, 'optimizer': 'Adam'}.
2026-06-17 20:43:05,429 - experiment_functions - INFO - Early stopping at epoch 1100. Best Metrics: (0.0026557579463606495, 0.0006852343059239611, 0.0017697148308355648)
2026-06-17 20:43:05,603 - optuna.study.study - INFO - Trial 221 finished with values: [0.0026557579463606495, 0.0006852343059239611, 0.0017697148308355648] and parameters: {'n_layers': 4, 'embedding_dim': 32, 'lr': 0.0015933103817621604, 'lambda_val': 0.00040852653324075796, 'batch_size': 2321, 'optimizer': 'Adam'}.
2026-06-17 20:43:36,755 - experiment_functions - INFO - Early stopping at epoch 650. Best Metrics: (0.002933328532955088, 0.0007799671592775042, 0.0018368774582669175)
