2026-06-17 02:05:17,620 - optuna.study.study - INFO - Trial 193 finished with values: [0.0007063738251847775, 0.0001373626373626374, 0.0003395332465411614] and parameters: {'n_layers': 4, 'embedding_dim': 128, 'lr': 2.2311908324287764e-05, 'lambda_val': 4.546254137443526e-06, 'batch_size': 1102, 'optimizer': 'Adam'}.
2026-06-17 02:10:33,006 - optuna.study.study - INFO - Trial 194 finished with values: [0.014075203964933749, 0.003258810155361879, 0.008088270527904246] and parameters: {'n_layers': 4, 'embedding_dim': 256, 'lr': 9.592511602839962e-05, 'lambda_val': 1.8618951918561611e-06, 'batch_size': 3992, 'optimizer': 'Adam'}.
2026-06-17 02:12:20,782 - experiment_functions - INFO - Early stopping at epoch 2550. Best Metrics: (0.0005234765434535037, 0.00013420487558418593, 0.00030119949953138353)
2026-06-17 02:12:20,861 - optuna.study.study - INFO - Trial 195 finished with values: [0.0005234765434535037, 0.00013420487558418593, 0.00030119949953138353] and parameters: {'n_layers': 1, 'embedding_dim': 32, 'lr': 0.00018120952253108887, 'lambda_val': 1.0697648887853802e-06, 'batch_size': 2889, 'optimizer': 'RMSprop'}.
2026-06-17 02:12:56,477 - experiment_functions - INFO - Early stopping at epoch 600. Best Metrics: (0.013226056755177644, 0.002930402930402931, 0.00777025101524491)
2026-06-17 02:12:56,554 - optuna.study.study - INFO - Trial 196 finished with values: [0.013226056755177644, 0.002930402930402931, 0.00777025101524491] and parameters: {'n_layers': 3, 'embedding_dim': 128, 'lr': 0.0018150056018687985, 'lambda_val': 6.67969903638883e-05, 'batch_size': 678, 'optimizer': 'RMSprop'}.
2026-06-17 02:13:30,670 - experiment_functions - INFO - Early stopping at epoch 650. Best Metrics: (0.01933072019028487, 0.00433876468359227, 0.011159948473097448)
2026-06-17 02:13:30,759 - optuna.study.study - INFO - Trial 197 finished with values: [0.01933072019028487, 0.00433876468359227, 0.011159948473097448] and parameters: {'n_layers': 3, 'embedding_dim': 64, 'lr': 0.0018522973992639606, 'lambda_val': 1.9413402449837055e-05, 'batch_size': 3321, 'optimizer': 'Adam'}.
2026-06-17 02:17:38,190 - optuna.study.study - INFO - Trial 198 finished with values: [0.0161704342055344, 0.003498800050524189, 0.008853580123401157] and parameters: {'n_layers': 2, 'embedding_dim': 256, 'lr': 0.011485594305176742, 'lambda_val': 0.0009072609457664243, 'batch_size': 3466, 'optimizer': 'RMSprop'}.
2026-06-17 02:18:56,085 - experiment_functions - INFO - Early stopping at epoch 1450. Best Metrics: (0.019296769875441225, 0.004621384362763673, 0.010928888758565847)
2026-06-17 02:18:56,186 - optuna.study.study - INFO - Trial 199 finished with values: [0.019296769875441225, 0.004621384362763673, 0.010928888758565847] and parameters: {'n_layers': 2, 'embedding_dim': 128, 'lr': 0.0003334703704985316, 'lambda_val': 0.02773390562810833, 'batch_size': 3992, 'optimizer': 'RMSprop'}.
2026-06-17 02:19:35,960 - experiment_functions - INFO - Early stopping at epoch 650. Best Metrics: (0.018250832104221692, 0.00407351269420235, 0.010169718941207922)
2026-06-17 02:19:36,040 - optuna.study.study - INFO - Trial 200 finished with values: [0.018250832104221692, 0.00407351269420235, 0.010169718941207922] and parameters: {'n_layers': 3, 'embedding_dim': 128, 'lr': 0.0018522973992639606, 'lambda_val': 2.970506579255523e-05, 'batch_size': 3321, 'optimizer': 'Adam'}.
2026-06-17 02:21:25,452 - experiment_functions - INFO - Early stopping at epoch 2400. Best Metrics: (0.02908601261282882, 0.006427624100037894, 0.01709484256349885)
2026-06-17 02:21:25,533 - optuna.study.study - INFO - Trial 201 finished with values: [0.02908601261282882, 0.006427624100037894, 0.01709484256349885] and parameters: {'n_layers': 2, 'embedding_dim': 32, 'lr': 0.0006628139134621098, 'lambda_val': 1.0768752731630495e-05, 'batch_size': 2889, 'optimizer': 'RMSprop'}.
2026-06-17 02:22:03,398 - experiment_functions - INFO - Early stopping at epoch 700. Best Metrics: (0.02642506110937543, 0.005731337627889352, 0.015255316018191679)
2026-06-17 02:22:03,505 - optuna.study.study - INFO - Trial 202 finished with values: [0.02642506110937543, 0.005731337627889352, 0.015255316018191679] and parameters: {'n_layers': 2, 'embedding_dim': 128, 'lr': 0.0017542874983550202, 'lambda_val': 2.970506579255523e-05, 'batch_size': 2889, 'optimizer': 'Adam'}.
2026-06-17 02:23:10,965 - experiment_functions - INFO - Early stopping at epoch 1300. Best Metrics: (0.023049509514020218, 0.005049261083743843, 0.013443601941210451)
2026-06-17 02:23:11,047 - optuna.study.study - INFO - Trial 203 finished with values: [0.023049509514020218, 0.005049261083743843, 0.013443601941210451] and parameters: {'n_layers': 3, 'embedding_dim': 64, 'lr': 0.0006340132793158045, 'lambda_val': 2.970506579255523e-05, 'batch_size': 3321, 'optimizer': 'Adam'}.
2026-06-17 02:24:14,706 - experiment_functions - INFO - Early stopping at epoch 1000. Best Metrics: (0.017978758760389842, 0.0038461538461538464, 0.010187609768770884)
2026-06-17 02:24:14,796 - optuna.study.study - INFO - Trial 204 finished with values: [0.017978758760389842, 0.0038461538461538464, 0.010187609768770884] and parameters: {'n_layers': 4, 'embedding_dim': 128, 'lr': 0.0006340132793158045, 'lambda_val': 2.970506579255523e-05, 'batch_size': 3321, 'optimizer': 'RMSprop'}.
2026-06-17 02:24:42,654 - experiment_functions - INFO - Early stopping at epoch 500. Best Metrics: (0.0006062504072985206, 0.00012473159024883163, 0.0003214546080147353)
2026-06-17 02:24:42,771 - optuna.study.study - INFO - Trial 205 finished with values: [0.0006062504072985206, 0.00012473159024883163, 0.0003214546080147353] and parameters: {'n_layers': 2, 'embedding_dim': 128, 'lr': 0.00017155817754431165, 'lambda_val': 0.010958637066092005, 'batch_size': 4019, 'optimizer': 'Adam'}.
2026-06-17 02:25:37,493 - experiment_functions - INFO - Early stopping at epoch 1000. Best Metrics: (0.027480107959079653, 0.005988695212833144, 0.015457170885366724)
2026-06-17 02:25:37,573 - optuna.study.study - INFO - Trial 206 finished with values: [0.027480107959079653, 0.005988695212833144, 0.015457170885366724] and parameters: {'n_layers': 2, 'embedding_dim': 128, 'lr': 0.0006340132793158045, 'lambda_val': 6.67969903638883e-05, 'batch_size': 2691, 'optimizer': 'RMSprop'}.
2026-06-17 02:26:37,066 - experiment_functions - INFO - Early stopping at epoch 1250. Best Metrics: (0.01811802766955836, 0.0040261462675255785, 0.010083855832765956)
2026-06-17 02:26:37,213 - optuna.study.study - INFO - Trial 207 finished with values: [0.01811802766955836, 0.0040261462675255785, 0.010083855832765956] and parameters: {'n_layers': 4, 'embedding_dim': 32, 'lr': 0.0007178694642074494, 'lambda_val': 1.0697648887853802e-06, 'batch_size': 3774, 'optimizer': 'Adam'}.
2026-06-17 02:30:02,040 - optuna.study.study - INFO - Trial 208 finished with values: [0.017344668873874, 0.004038777314639384, 0.010145094372724633] and parameters: {'n_layers': 2, 'embedding_dim': 128, 'lr': 0.00018562220957177872, 'lambda_val': 4.546254137443526e-06, 'batch_size': 3992, 'optimizer': 'Adam'}.
2026-06-17 02:32:53,047 - optuna.study.study - INFO - Trial 209 finished with values: [0.0005992834379834656, 0.00015473032714412026, 0.000369370402379229] and parameters: {'n_layers': 1, 'embedding_dim': 64, 'lr': 0.0001647866487414351, 'lambda_val': 2.970506579255523e-05, 'batch_size': 3992, 'optimizer': 'Adam'}.
2026-06-17 02:33:16,944 - experiment_functions - INFO - Early stopping at epoch 500. Best Metrics: (0.00040221172678244995, 0.00010578501957812301, 0.00023657174742288434)
2026-06-17 02:33:17,032 - optuna.study.study - INFO - Trial 210 finished with values: [0.00040221172678244995, 0.00010578501957812301, 0.00023657174742288434] and parameters: {'n_layers': 2, 'embedding_dim': 32, 'lr': 0.00019812603137728135, 'lambda_val': 1.0697648887853802e-06, 'batch_size': 2360, 'optimizer': 'SGD'}.
2026-06-17 02:36:41,492 - optuna.study.study - INFO - Trial 211 finished with values: [0.010552122675452111, 0.0023272704307187066, 0.005930527102313874] and parameters: {'n_layers': 2, 'embedding_dim': 128, 'lr': 0.0922388973869132, 'lambda_val': 0.0031916916515626836, 'batch_size': 3466, 'optimizer': 'RMSprop'}.
2026-06-17 02:37:21,197 - experiment_functions - INFO - Early stopping at epoch 700. Best Metrics: (0.026643638409930982, 0.00587975243147657, 0.015179130180596976)
2026-06-17 02:37:21,552 - optuna.study.study - INFO - Trial 212 finished with values: [0.026643638409930982, 0.00587975243147657, 0.015179130180596976] and parameters: {'n_layers': 2, 'embedding_dim': 128, 'lr': 0.0017542874983550202, 'lambda_val': 0.00012027553665042037, 'batch_size': 3321, 'optimizer': 'Adam'}.
2026-06-17 02:40:22,938 - optuna.study.study - INFO - Trial 213 finished with values: [0.035145468884415436, 0.007643362384741696, 0.020539885828017974] and parameters: {'n_layers': 1, 'embedding_dim': 64, 'lr': 0.0007178694642074494, 'lambda_val': 1.3976665248992833e-06, 'batch_size': 2369, 'optimizer': 'Adam'}.
2026-06-17 02:41:12,259 - experiment_functions - INFO - Early stopping at epoch 850. Best Metrics: (0.01833161842138599, 0.003967727674624226, 0.01048432885637302)
2026-06-17 02:41:12,335 - optuna.study.study - INFO - Trial 214 finished with values: [0.01833161842138599, 0.003967727674624226, 0.01048432885637302] and parameters: {'n_layers': 4, 'embedding_dim': 96, 'lr': 0.0006340132793158045, 'lambda_val': 2.970506579255523e-05, 'batch_size': 3920, 'optimizer': 'RMSprop'}.
2026-06-17 02:42:09,469 - experiment_functions - INFO - Early stopping at epoch 1150. Best Metrics: (0.03209940171088132, 0.007068649741063535, 0.01901871091091315)
2026-06-17 02:42:09,543 - optuna.study.study - INFO - Trial 215 finished with values: [0.03209940171088132, 0.007068649741063535, 0.01901871091091315] and parameters: {'n_layers': 1, 'embedding_dim': 128, 'lr': 0.0017542874983550202, 'lambda_val': 4.546254137443526e-06, 'batch_size': 1627, 'optimizer': 'Adam'}.
2026-06-17 02:43:27,502 - experiment_functions - INFO - Early stopping at epoch 1500. Best Metrics: (0.003910791698709557, 0.0008715422508525957, 0.0021615135304154606)
2026-06-17 02:43:27,579 - optuna.study.study - INFO - Trial 216 finished with values: [0.003910791698709557, 0.0008715422508525957, 0.0021615135304154606] and parameters: {'n_layers': 2, 'embedding_dim': 128, 'lr': 0.06086378993645179, 'lambda_val': 0.02773390562810833, 'batch_size': 3992, 'optimizer': 'RMSprop'}.
2026-06-17 02:45:25,595 - experiment_functions - INFO - Early stopping at epoch 2350. Best Metrics: (0.031559455790882394, 0.0066612984716432995, 0.017313707297640448)
2026-06-17 02:45:25,668 - optuna.study.study - INFO - Trial 217 finished with values: [0.031559455790882394, 0.0066612984716432995, 0.017313707297640448] and parameters: {'n_layers': 2, 'embedding_dim': 96, 'lr': 0.0006340132793158045, 'lambda_val': 1.1429368777596572e-06, 'batch_size': 3321, 'optimizer': 'Adam'}.
2026-06-17 02:46:00,548 - experiment_functions - INFO - Early stopping at epoch 650. Best Metrics: (0.005871886555705206, 0.001204686118479222, 0.003249175858261909)
2026-06-17 02:46:01,327 - optuna.study.study - INFO - Trial 218 finished with values: [0.005871886555705206, 0.001204686118479222, 0.003249175858261909] and parameters: {'n_layers': 2, 'embedding_dim': 96, 'lr': 0.011485594305176742, 'lambda_val': 0.0031752637441564277, 'batch_size': 2708, 'optimizer': 'Adam'}.
2026-06-17 02:46:48,061 - experiment_functions - INFO - Early stopping at epoch 900. Best Metrics: (0.0005510878401514308, 0.00011525830491347733, 0.0002998892549661789)
2026-06-17 02:46:48,143 - optuna.study.study - INFO - Trial 219 finished with values: [0.0005510878401514308, 0.00011525830491347733, 0.0002998892549661789] and parameters: {'n_layers': 2, 'embedding_dim': 128, 'lr': 3.5024796494950536e-05, 'lambda_val': 4.546254137443526e-06, 'batch_size': 3992, 'optimizer': 'Adam'}.
2026-06-17 02:47:13,404 - experiment_functions - INFO - Early stopping at epoch 500. Best Metrics: (0.0006556523814809367, 0.00012315270935960593, 0.00033075589716379124)
2026-06-17 02:47:13,526 - optuna.study.study - INFO - Trial 220 finished with values: [0.0006556523814809367, 0.00012315270935960593, 0.00033075589716379124] and parameters: {'n_layers': 2, 'embedding_dim': 64, 'lr': 2.273090982309165e-05, 'lambda_val': 2.970506579255523e-05, 'batch_size': 2889, 'optimizer': 'SGD'}.
2026-06-17 02:50:40,202 - optuna.study.study - INFO - Trial 221 finished with values: [0.0183842727553964, 0.0041666666666666675, 0.010688657114990601] and parameters: {'n_layers': 4, 'embedding_dim': 64, 'lr': 0.00017384659942437723, 'lambda_val': 8.895198181412377e-05, 'batch_size': 2701, 'optimizer': 'RMSprop'}.
2026-06-17 02:51:20,215 - experiment_functions - INFO - Early stopping at epoch 700. Best Metrics: (0.026412481061868092, 0.005669761273209549, 0.014992929383878773)
2026-06-17 02:51:20,297 - optuna.study.study - INFO - Trial 222 finished with values: [0.026412481061868092, 0.005669761273209549, 0.014992929383878773] and parameters: {'n_layers': 2, 'embedding_dim': 128, 'lr': 0.0017542874983550202, 'lambda_val': 4.452669285059839e-06, 'batch_size': 3992, 'optimizer': 'Adam'}.
2026-06-17 02:51:58,192 - experiment_functions - INFO - Early stopping at epoch 700. Best Metrics: (0.025979614169026114, 0.005690286724769484, 0.015294394525043874)
2026-06-17 02:51:58,268 - optuna.study.study - INFO - Trial 223 finished with values: [0.025979614169026114, 0.005690286724769484, 0.015294394525043874] and parameters: {'n_layers': 2, 'embedding_dim': 128, 'lr': 0.0017542874983550202, 'lambda_val': 4.546254137443526e-06, 'batch_size': 3321, 'optimizer': 'Adam'}.
2026-06-17 02:53:41,720 - experiment_functions - INFO - Early stopping at epoch 1950. Best Metrics: (0.031218418136744808, 0.006809713275230516, 0.017646095581823906)
2026-06-17 02:53:41,789 - optuna.study.study - INFO - Trial 224 finished with values: [0.031218418136744808, 0.006809713275230516, 0.017646095581823906] and parameters: {'n_layers': 2, 'embedding_dim': 128, 'lr': 0.0006340132793158045, 'lambda_val': 2.970506579255523e-05, 'batch_size': 2140, 'optimizer': 'Adam'}.
2026-06-17 02:56:55,904 - optuna.study.study - INFO - Trial 225 finished with values: [0.01268544679604572, 0.0029019830743968675, 0.007525269244572347] and parameters: {'n_layers': 3, 'embedding_dim': 64, 'lr': 0.00017384659942437723, 'lambda_val': 2.6858232738417883e-06, 'batch_size': 1265, 'optimizer': 'RMSprop'}.
2026-06-17 02:57:30,672 - experiment_functions - INFO - Early stopping at epoch 650. Best Metrics: (0.01698318052641314, 0.0040387773146393835, 0.009339908078284696)
2026-06-17 02:57:30,757 - optuna.study.study - INFO - Trial 226 finished with values: [0.01698318052641314, 0.0040387773146393835, 0.009339908078284696] and parameters: {'n_layers': 2, 'embedding_dim': 128, 'lr': 0.0017542874983550202, 'lambda_val': 0.021625230275574902, 'batch_size': 3321, 'optimizer': 'Adam'}.
2026-06-17 02:58:29,666 - experiment_functions - INFO - Early stopping at epoch 1000. Best Metrics: (0.020956660272429845, 0.0046734874321081215, 0.012053568006243203)
2026-06-17 02:58:29,741 - optuna.study.study - INFO - Trial 227 finished with values: [0.020956660272429845, 0.0046734874321081215, 0.012053568006243203] and parameters: {'n_layers': 3, 'embedding_dim': 128, 'lr': 0.0006340132793158045, 'lambda_val': 2.970506579255523e-05, 'batch_size': 3321, 'optimizer': 'RMSprop'}.
2026-06-17 03:03:14,673 - optuna.study.study - INFO - Trial 228 finished with values: [0.022960588922073852, 0.005282935455349249, 0.013465721318632634] and parameters: {'n_layers': 3, 'embedding_dim': 256, 'lr': 0.00017384659942437723, 'lambda_val': 1.3976665248992833e-06, 'batch_size': 1534, 'optimizer': 'RMSprop'}.
2026-06-17 03:03:49,447 - experiment_functions - INFO - Early stopping at epoch 650. Best Metrics: (0.017731291450444095, 0.003910887962612101, 0.009992014809725933)
2026-06-17 03:03:49,555 - optuna.study.study - INFO - Trial 229 finished with values: [0.017731291450444095, 0.003910887962612101, 0.009992014809725933] and parameters: {'n_layers': 3, 'embedding_dim': 64, 'lr': 0.0018522973992639606, 'lambda_val': 0.0003494774599348711, 'batch_size': 3321, 'optimizer': 'Adam'}.
2026-06-17 03:04:16,392 - experiment_functions - INFO - Early stopping at epoch 550. Best Metrics: (0.01086894927222339, 0.002330428192497158, 0.006461510262867766)
2026-06-17 03:04:16,459 - optuna.study.study - INFO - Trial 230 finished with values: [0.01086894927222339, 0.002330428192497158, 0.006461510262867766] and parameters: {'n_layers': 3, 'embedding_dim': 32, 'lr': 0.005993141995606503, 'lambda_val': 1.0697648887853802e-06, 'batch_size': 1627, 'optimizer': 'RMSprop'}.
2026-06-17 03:04:56,961 - experiment_functions - INFO - Early stopping at epoch 750. Best Metrics: (0.010359064126072468, 0.002276746242263484, 0.006017607017804298)
2026-06-17 03:04:57,066 - optuna.study.study - INFO - Trial 231 finished with values: [0.010359064126072468, 0.002276746242263484, 0.006017607017804298] and parameters: {'n_layers': 4, 'embedding_dim': 64, 'lr': 0.0017542874983550202, 'lambda_val': 2.6858232738417883e-06, 'batch_size': 2166, 'optimizer': 'RMSprop'}.
2026-06-17 03:06:26,428 - experiment_functions - INFO - Early stopping at epoch 1850. Best Metrics: (0.028170759268463606, 0.006222369584438551, 0.01607774116892785)
2026-06-17 03:06:26,514 - optuna.study.study - INFO - Trial 232 finished with values: [0.028170759268463606, 0.006222369584438551, 0.01607774116892785] and parameters: {'n_layers': 2, 'embedding_dim': 64, 'lr': 0.0007178694642074494, 'lambda_val': 1.0697648887853802e-06, 'batch_size': 1265, 'optimizer': 'RMSprop'}.
2026-06-17 03:06:59,682 - experiment_functions - INFO - Early stopping at epoch 650. Best Metrics: (0.015473561391393439, 0.0033709106984969052, 0.008200059121676302)
2026-06-17 03:06:59,770 - optuna.study.study - INFO - Trial 233 finished with values: [0.015473561391393439, 0.0033709106984969052, 0.008200059121676302] and parameters: {'n_layers': 3, 'embedding_dim': 64, 'lr': 0.0018522973992639606, 'lambda_val': 0.002293564989415113, 'batch_size': 2454, 'optimizer': 'Adam'}.
2026-06-17 03:07:29,789 - experiment_functions - INFO - Early stopping at epoch 550. Best Metrics: (0.005308832782600061, 0.0011857395478085133, 0.003207445916996312)
2026-06-17 03:07:29,898 - optuna.study.study - INFO - Trial 234 finished with values: [0.005308832782600061, 0.0011857395478085133, 0.003207445916996312] and parameters: {'n_layers': 2, 'embedding_dim': 128, 'lr': 0.0922388973869132, 'lambda_val': 1.0697648887853802e-06, 'batch_size': 3466, 'optimizer': 'RMSprop'}.
2026-06-17 03:08:00,469 - experiment_functions - INFO - Early stopping at epoch 550. Best Metrics: (0.007802172513807211, 0.00171782240747758, 0.004331708730824274)
2026-06-17 03:08:00,541 - optuna.study.study - INFO - Trial 235 finished with values: [0.007802172513807211, 0.00171782240747758, 0.004331708730824274] and parameters: {'n_layers': 2, 'embedding_dim': 128, 'lr': 0.008216180978308497, 'lambda_val': 0.0019823250318483305, 'batch_size': 3992, 'optimizer': 'RMSprop'}.
2026-06-17 03:11:29,140 - optuna.study.study - INFO - Trial 236 finished with values: [0.02030853219482488, 0.003991410887962612, 0.011151451131467522] and parameters: {'n_layers': 2, 'embedding_dim': 128, 'lr': 0.011485594305176742, 'lambda_val': 4.0794975052130595e-06, 'batch_size': 3052, 'optimizer': 'RMSprop'}.
2026-06-17 03:12:02,905 - experiment_functions - INFO - Early stopping at epoch 600. Best Metrics: (0.010776885441940803, 0.002297271693823418, 0.005898392380571256)
2026-06-17 03:12:02,984 - optuna.study.study - INFO - Trial 237 finished with values: [0.010776885441940803, 0.002297271693823418, 0.005898392380571256] and parameters: {'n_layers': 2, 'embedding_dim': 128, 'lr': 0.0017542874983550202, 'lambda_val': 0.002293564989415113, 'batch_size': 3992, 'optimizer': 'RMSprop'}.
2026-06-17 03:15:32,206 - optuna.study.study - INFO - Trial 238 finished with values: [0.001255536003964368, 0.000345774914740432, 0.0007288676776608069] and parameters: {'n_layers': 1, 'embedding_dim': 256, 'lr': 0.00017384659942437723, 'lambda_val': 1.3976665248992833e-06, 'batch_size': 3920, 'optimizer': 'RMSprop'}.
2026-06-17 03:16:11,535 - experiment_functions - INFO - Early stopping at epoch 700. Best Metrics: (0.025228034159815324, 0.0056366047745358095, 0.014522635444850064)
2026-06-17 03:16:11,858 - optuna.study.study - INFO - Trial 239 finished with values: [0.025228034159815324, 0.0056366047745358095, 0.014522635444850064] and parameters: {'n_layers': 2, 'embedding_dim': 128, 'lr': 0.0017542874983550202, 'lambda_val': 2.970506579255523e-05, 'batch_size': 3256, 'optimizer': 'Adam'}.
2026-06-17 03:19:59,187 - optuna.study.study - INFO - Trial 240 finished with values: [0.01923788231711741, 0.004431918656056587, 0.01141838619029207] and parameters: {'n_layers': 3, 'embedding_dim': 128, 'lr': 0.000154474752526151, 'lambda_val': 2.970506579255523e-05, 'batch_size': 3321, 'optimizer': 'Adam'}.
2026-06-17 03:21:34,845 - experiment_functions - INFO - Early stopping at epoch 1950. Best Metrics: (0.02182374973300275, 0.004864532019704434, 0.012568998645052254)
2026-06-17 03:21:34,931 - optuna.study.study - INFO - Trial 241 finished with values: [0.02182374973300275, 0.004864532019704434, 0.012568998645052254] and parameters: {'n_layers': 4, 'embedding_dim': 32, 'lr': 0.0007178694642074494, 'lambda_val': 1.0697648887853802e-06, 'batch_size': 1534, 'optimizer': 'RMSprop'}.
2026-06-17 03:24:46,566 - optuna.study.study - INFO - Trial 242 finished with values: [0.016702565796938282, 0.003956675508399647, 0.010077752038273708] and parameters: {'n_layers': 1, 'embedding_dim': 128, 'lr': 0.0006340132793158045, 'lambda_val': 3.327121177308548e-05, 'batch_size': 835, 'optimizer': 'Adam'}.
