2026-06-18 17:48:27,501 - optuna.study.study - INFO - Trial 45 finished with values: [0.0005519729998764236, 0.00013578375647341163, 0.000301650262429856] and parameters: {'n_layers': 1, 'embedding_dim': 64, 'lr': 0.00012751935837707415, 'lambda_val': 5.450443713475763e-06, 'batch_size': 3374, 'optimizer': 'SGD'}.
2026-06-18 17:48:55,985 - experiment_functions - INFO - Early stopping at epoch 500. Best Metrics: (0.013353484110426866, 0.0028893520272830616, 0.008433224655126042)
2026-06-18 17:48:56,140 - optuna.study.study - INFO - Trial 46 finished with values: [0.013353484110426866, 0.0028893520272830616, 0.008433224655126042] and parameters: {'n_layers': 4, 'embedding_dim': 128, 'lr': 0.0711855377482981, 'lambda_val': 0.006468486245866659, 'batch_size': 3068, 'optimizer': 'RMSprop'}.
2026-06-18 17:52:55,872 - optuna.study.study - INFO - Trial 47 finished with values: [0.0023148429925354216, 0.0005399772641151952, 0.0014373698740220494] and parameters: {'n_layers': 3, 'embedding_dim': 256, 'lr': 4.2224892519003054e-05, 'lambda_val': 0.0014622616946591267, 'batch_size': 3638, 'optimizer': 'RMSprop'}.
2026-06-18 17:54:08,957 - experiment_functions - INFO - Early stopping at epoch 1450. Best Metrics: (0.024425733152768768, 0.005417140330933436, 0.01462105545555131)
2026-06-18 17:54:09,076 - optuna.study.study - INFO - Trial 48 finished with values: [0.024425733152768768, 0.005417140330933436, 0.01462105545555131] and parameters: {'n_layers': 2, 'embedding_dim': 128, 'lr': 0.00039950195617414347, 'lambda_val': 1.4285456163687262e-06, 'batch_size': 3911, 'optimizer': 'RMSprop'}.
2026-06-18 17:54:41,642 - experiment_functions - INFO - Early stopping at epoch 500. Best Metrics: (0.0005463165405473952, 0.00012473159024883163, 0.00030418618319303823)
2026-06-18 17:54:41,763 - optuna.study.study - INFO - Trial 49 finished with values: [0.0005463165405473952, 0.00012473159024883163, 0.00030418618319303823] and parameters: {'n_layers': 3, 'embedding_dim': 256, 'lr': 1.695449469952618e-05, 'lambda_val': 0.010594230952202395, 'batch_size': 3121, 'optimizer': 'Adam'}.
2026-06-18 17:58:01,241 - optuna.study.study - INFO - Trial 50 finished with values: [0.007274479857201961, 0.001716243526588354, 0.004310786376176549] and parameters: {'n_layers': 3, 'embedding_dim': 128, 'lr': 7.876418984299764e-05, 'lambda_val': 0.0012501858024009025, 'batch_size': 1703, 'optimizer': 'RMSprop'}.
2026-06-18 18:01:32,213 - optuna.study.study - INFO - Trial 51 finished with values: [0.001096406621315452, 0.0002415687760515347, 0.0006327220932439439] and parameters: {'n_layers': 4, 'embedding_dim': 128, 'lr': 3.337881314216229e-05, 'lambda_val': 0.0008936724688910117, 'batch_size': 1703, 'optimizer': 'RMSprop'}.
2026-06-18 18:05:10,470 - optuna.study.study - INFO - Trial 52 finished with values: [0.0007508804885268394, 0.00016894025514715172, 0.0004296529536456368] and parameters: {'n_layers': 2, 'embedding_dim': 256, 'lr': 4.979412372358047e-05, 'lambda_val': 0.006137825895515928, 'batch_size': 2337, 'optimizer': 'RMSprop'}.
2026-06-18 18:05:38,962 - experiment_functions - INFO - Early stopping at epoch 550. Best Metrics: (0.02464011773266761, 0.0050303145130731345, 0.013661369861620127)
2026-06-18 18:05:39,072 - optuna.study.study - INFO - Trial 53 finished with values: [0.02464011773266761, 0.0050303145130731345, 0.013661369861620127] and parameters: {'n_layers': 2, 'embedding_dim': 96, 'lr': 0.004952675271626227, 'lambda_val': 0.0005943254859344516, 'batch_size': 3608, 'optimizer': 'Adam'}.
2026-06-18 18:06:30,356 - experiment_functions - INFO - Early stopping at epoch 1000. Best Metrics: (0.027073561784342184, 0.00578028293545535, 0.015781834196292095)
2026-06-18 18:06:30,466 - optuna.study.study - INFO - Trial 54 finished with values: [0.027073561784342184, 0.00578028293545535, 0.015781834196292095] and parameters: {'n_layers': 2, 'embedding_dim': 128, 'lr': 0.0007183006551542105, 'lambda_val': 8.320422535259038e-06, 'batch_size': 2220, 'optimizer': 'Adam'}.
2026-06-18 18:06:55,969 - experiment_functions - INFO - Early stopping at epoch 550. Best Metrics: (0.01008963478618389, 0.0021583301755715547, 0.005569477327440151)
2026-06-18 18:06:56,104 - optuna.study.study - INFO - Trial 55 finished with values: [0.01008963478618389, 0.0021583301755715547, 0.005569477327440151] and parameters: {'n_layers': 1, 'embedding_dim': 32, 'lr': 0.030101213165065234, 'lambda_val': 0.004505589428166237, 'batch_size': 2931, 'optimizer': 'Adam'}.
2026-06-18 18:08:45,380 - experiment_functions - INFO - Early stopping at epoch 2200. Best Metrics: (0.01845422650624108, 0.0036408993305545034, 0.009840037001973518)
2026-06-18 18:08:45,493 - optuna.study.study - INFO - Trial 56 finished with values: [0.01845422650624108, 0.0036408993305545034, 0.009840037001973518] and parameters: {'n_layers': 3, 'embedding_dim': 96, 'lr': 0.0018430878476133415, 'lambda_val': 4.115717615485875e-05, 'batch_size': 694, 'optimizer': 'Adam'}.
2026-06-18 18:09:13,420 - experiment_functions - INFO - Early stopping at epoch 550. Best Metrics: (0.01856334420205774, 0.0036140583554376657, 0.009696103593058437)
2026-06-18 18:09:13,530 - optuna.study.study - INFO - Trial 57 finished with values: [0.01856334420205774, 0.0036140583554376657, 0.009696103593058437] and parameters: {'n_layers': 3, 'embedding_dim': 64, 'lr': 0.020171082222098465, 'lambda_val': 4.4220733903903124e-05, 'batch_size': 4089, 'optimizer': 'Adam'}.
2026-06-18 18:09:44,150 - experiment_functions - INFO - Early stopping at epoch 550. Best Metrics: (0.018002634663908036, 0.003603006189213086, 0.009547092453950991)
2026-06-18 18:09:44,270 - optuna.study.study - INFO - Trial 58 finished with values: [0.018002634663908036, 0.003603006189213086, 0.009547092453950991] and parameters: {'n_layers': 3, 'embedding_dim': 128, 'lr': 0.022552700000257754, 'lambda_val': 6.780133728833238e-06, 'batch_size': 3338, 'optimizer': 'Adam'}.
2026-06-18 18:10:08,843 - experiment_functions - INFO - Early stopping at epoch 500. Best Metrics: (0.0005088837559043663, 0.0001310471138057345, 0.0003208503354852116)
2026-06-18 18:10:08,952 - optuna.study.study - INFO - Trial 59 finished with values: [0.0005088837559043663, 0.0001310471138057345, 0.0003208503354852116] and parameters: {'n_layers': 4, 'embedding_dim': 32, 'lr': 1.3076565524114269e-05, 'lambda_val': 0.006468486245866659, 'batch_size': 3068, 'optimizer': 'Adam'}.
2026-06-18 18:10:33,638 - experiment_functions - INFO - Early stopping at epoch 500. Best Metrics: (0.0005943634503918708, 0.0001405203991410888, 0.0003331289941896884)
2026-06-18 18:10:33,749 - optuna.study.study - INFO - Trial 60 finished with values: [0.0005943634503918708, 0.0001405203991410888, 0.0003331289941896884] and parameters: {'n_layers': 1, 'embedding_dim': 128, 'lr': 0.00013575594902465817, 'lambda_val': 0.00988731074821415, 'batch_size': 2931, 'optimizer': 'RMSprop'}.
2026-06-18 18:11:22,264 - experiment_functions - INFO - Early stopping at epoch 900. Best Metrics: (0.02079299239399378, 0.004441391941391941, 0.011534176406090432)
2026-06-18 18:11:22,368 - optuna.study.study - INFO - Trial 61 finished with values: [0.02079299239399378, 0.004441391941391941, 0.011534176406090432] and parameters: {'n_layers': 3, 'embedding_dim': 128, 'lr': 0.000746151836584117, 'lambda_val': 1.1727812158033635e-06, 'batch_size': 2618, 'optimizer': 'RMSprop'}.
2026-06-18 18:13:21,123 - experiment_functions - INFO - Early stopping at epoch 2650. Best Metrics: (0.006336491820432107, 0.0013104711380573452, 0.0033151303333742786)
2026-06-18 18:13:21,227 - optuna.study.study - INFO - Trial 62 finished with values: [0.006336491820432107, 0.0013104711380573452, 0.0033151303333742786] and parameters: {'n_layers': 4, 'embedding_dim': 32, 'lr': 0.015193525619150647, 'lambda_val': 0.03135531657672052, 'batch_size': 2546, 'optimizer': 'RMSprop'}.
2026-06-18 18:13:45,434 - experiment_functions - INFO - Early stopping at epoch 500. Best Metrics: (0.0005361901211415464, 0.00011999494758115447, 0.0003220784428957253)
2026-06-18 18:13:45,539 - optuna.study.study - INFO - Trial 63 finished with values: [0.0005361901211415464, 0.00011999494758115447, 0.0003220784428957253] and parameters: {'n_layers': 4, 'embedding_dim': 32, 'lr': 0.00011040723334956882, 'lambda_val': 0.04843015481671603, 'batch_size': 855, 'optimizer': 'SGD'}.
2026-06-18 18:14:17,614 - experiment_functions - INFO - Early stopping at epoch 600. Best Metrics: (0.01950550577151253, 0.004071933813313124, 0.010592128322173438)
2026-06-18 18:14:17,716 - optuna.study.study - INFO - Trial 64 finished with values: [0.01950550577151253, 0.004071933813313124, 0.010592128322173438] and parameters: {'n_layers': 3, 'embedding_dim': 96, 'lr': 0.0012644916907555855, 'lambda_val': 2.029370111875682e-06, 'batch_size': 3332, 'optimizer': 'RMSprop'}.
2026-06-18 18:17:18,185 - optuna.study.study - INFO - Trial 65 finished with values: [0.02320387048648478, 0.0050097890615132005, 0.013048218627519736] and parameters: {'n_layers': 4, 'embedding_dim': 32, 'lr': 0.00022471387800597823, 'lambda_val': 1.1727812158033635e-06, 'batch_size': 3512, 'optimizer': 'RMSprop'}.
2026-06-18 18:17:48,627 - experiment_functions - INFO - Early stopping at epoch 600. Best Metrics: (0.02245152443000634, 0.0048534798534798545, 0.012888314193408051)
2026-06-18 18:17:48,772 - optuna.study.study - INFO - Trial 66 finished with values: [0.02245152443000634, 0.0048534798534798545, 0.012888314193408051] and parameters: {'n_layers': 3, 'embedding_dim': 64, 'lr': 0.0018430878476133415, 'lambda_val': 1.288405727605743e-06, 'batch_size': 3995, 'optimizer': 'Adam'}.
2026-06-18 18:19:23,406 - experiment_functions - INFO - Early stopping at epoch 1800. Best Metrics: (0.025038685261420644, 0.005284514336238475, 0.014199248898119847)
2026-06-18 18:19:23,514 - optuna.study.study - INFO - Trial 67 finished with values: [0.025038685261420644, 0.005284514336238475, 0.014199248898119847] and parameters: {'n_layers': 3, 'embedding_dim': 128, 'lr': 0.00022471387800597823, 'lambda_val': 0.001270364796526946, 'batch_size': 3512, 'optimizer': 'Adam'}.
2026-06-18 18:19:57,992 - experiment_functions - INFO - Early stopping at epoch 650. Best Metrics: (0.016059745849900366, 0.0035698496905393457, 0.009116686415230215)
2026-06-18 18:19:58,114 - optuna.study.study - INFO - Trial 68 finished with values: [0.016059745849900366, 0.0035698496905393457, 0.009116686415230215] and parameters: {'n_layers': 3, 'embedding_dim': 96, 'lr': 0.0007183006551542105, 'lambda_val': 0.006468486245866659, 'batch_size': 3068, 'optimizer': 'RMSprop'}.
2026-06-18 18:20:30,467 - experiment_functions - INFO - Early stopping at epoch 700. Best Metrics: (0.01617663319494018, 0.003473537956296577, 0.009033239223828706)
2026-06-18 18:20:30,568 - optuna.study.study - INFO - Trial 69 finished with values: [0.01617663319494018, 0.003473537956296577, 0.009033239223828706] and parameters: {'n_layers': 2, 'embedding_dim': 32, 'lr': 0.01280471264191173, 'lambda_val': 7.326545203274226e-06, 'batch_size': 808, 'optimizer': 'RMSprop'}.
2026-06-18 18:21:24,363 - experiment_functions - INFO - Early stopping at epoch 1200. Best Metrics: (0.0153466718045576, 0.0035793229758747, 0.008656368651342955)
2026-06-18 18:21:24,685 - optuna.study.study - INFO - Trial 70 finished with values: [0.0153466718045576, 0.0035793229758747, 0.008656368651342955] and parameters: {'n_layers': 2, 'embedding_dim': 32, 'lr': 0.0004856174201898278, 'lambda_val': 0.04260110804834657, 'batch_size': 3515, 'optimizer': 'Adam'}.
2026-06-18 18:22:36,446 - experiment_functions - INFO - Early stopping at epoch 1050. Best Metrics: (0.016971884494804492, 0.0035335354300871542, 0.009007351830436956)
2026-06-18 18:22:36,805 - optuna.study.study - INFO - Trial 71 finished with values: [0.016971884494804492, 0.0035335354300871542, 0.009007351830436956] and parameters: {'n_layers': 4, 'embedding_dim': 256, 'lr': 0.001993370802391186, 'lambda_val': 4.735122359256782e-06, 'batch_size': 3520, 'optimizer': 'RMSprop'}.
2026-06-18 18:25:42,408 - optuna.study.study - INFO - Trial 72 finished with values: [0.01370724423528866, 0.003110395351774662, 0.008023765310904485] and parameters: {'n_layers': 2, 'embedding_dim': 96, 'lr': 0.00011040723334956882, 'lambda_val': 0.0037406360162648877, 'batch_size': 3197, 'optimizer': 'RMSprop'}.
2026-06-18 18:28:42,821 - optuna.study.study - INFO - Trial 73 finished with values: [0.012142545461576806, 0.0027251484148035875, 0.006920956702738898] and parameters: {'n_layers': 1, 'embedding_dim': 96, 'lr': 0.004952675271626227, 'lambda_val': 0.00988731074821415, 'batch_size': 694, 'optimizer': 'Adam'}.
2026-06-18 18:29:07,547 - experiment_functions - INFO - Early stopping at epoch 500. Best Metrics: (0.004630729998885084, 0.0010783756473411645, 0.0029999648893711526)
2026-06-18 18:29:07,629 - optuna.study.study - INFO - Trial 74 finished with values: [0.004630729998885084, 0.0010783756473411645, 0.0029999648893711526] and parameters: {'n_layers': 2, 'embedding_dim': 64, 'lr': 0.08120759460922362, 'lambda_val': 0.012868237118156371, 'batch_size': 1000, 'optimizer': 'RMSprop'}.
2026-06-18 18:29:41,781 - experiment_functions - INFO - Early stopping at epoch 700. Best Metrics: (0.022665636670892823, 0.00451559934318555, 0.012104237290404793)
2026-06-18 18:29:41,863 - optuna.study.study - INFO - Trial 75 finished with values: [0.022665636670892823, 0.00451559934318555, 0.012104237290404793] and parameters: {'n_layers': 1, 'embedding_dim': 96, 'lr': 0.0082956867501665, 'lambda_val': 4.521426485432383e-06, 'batch_size': 1079, 'optimizer': 'Adam'}.
2026-06-18 18:30:06,493 - experiment_functions - INFO - Early stopping at epoch 500. Best Metrics: (0.0006208673394964075, 0.0001294682329165088, 0.00031552824048764047)
2026-06-18 18:30:06,583 - optuna.study.study - INFO - Trial 76 finished with values: [0.0006208673394964075, 0.0001294682329165088, 0.00031552824048764047] and parameters: {'n_layers': 4, 'embedding_dim': 32, 'lr': 0.003314845746344176, 'lambda_val': 0.0006602480726382988, 'batch_size': 3357, 'optimizer': 'SGD'}.
2026-06-18 18:31:08,279 - experiment_functions - INFO - Early stopping at epoch 1200. Best Metrics: (0.026758075118292972, 0.005829228243021347, 0.015470957429766254)
2026-06-18 18:31:08,360 - optuna.study.study - INFO - Trial 77 finished with values: [0.026758075118292972, 0.005829228243021347, 0.015470957429766254] and parameters: {'n_layers': 2, 'embedding_dim': 128, 'lr': 0.00039950195617414347, 'lambda_val': 1.4285456163687262e-06, 'batch_size': 3012, 'optimizer': 'RMSprop'}.
2026-06-18 18:35:34,016 - optuna.study.study - INFO - Trial 78 finished with values: [0.0005769953462989675, 0.0001499936844764431, 0.0003265810826303562] and parameters: {'n_layers': 4, 'embedding_dim': 256, 'lr': 1.695449469952618e-05, 'lambda_val': 1.2639499678684216e-05, 'batch_size': 3522, 'optimizer': 'RMSprop'}.
2026-06-18 18:36:01,439 - experiment_functions - INFO - Early stopping at epoch 550. Best Metrics: (0.017064429916203914, 0.00333617531893394, 0.009082242731687248)
2026-06-18 18:36:01,523 - optuna.study.study - INFO - Trial 79 finished with values: [0.017064429916203914, 0.00333617531893394, 0.009082242731687248] and parameters: {'n_layers': 3, 'embedding_dim': 32, 'lr': 0.015193525619150647, 'lambda_val': 4.735122359256782e-06, 'batch_size': 3520, 'optimizer': 'Adam'}.
2026-06-18 18:39:03,194 - optuna.study.study - INFO - Trial 80 finished with values: [0.01083253189210375, 0.002489895162308955, 0.006463544823816747] and parameters: {'n_layers': 2, 'embedding_dim': 64, 'lr': 0.00011040723334956882, 'lambda_val': 4.115717615485875e-05, 'batch_size': 4089, 'optimizer': 'Adam'}.
2026-06-18 18:39:35,263 - experiment_functions - INFO - Early stopping at epoch 650. Best Metrics: (0.020669384493268977, 0.00437192118226601, 0.011279182978605078)
2026-06-18 18:39:35,345 - optuna.study.study - INFO - Trial 81 finished with values: [0.020669384493268977, 0.00437192118226601, 0.011279182978605078] and parameters: {'n_layers': 4, 'embedding_dim': 32, 'lr': 0.0018430878476133415, 'lambda_val': 3.4880590542162234e-06, 'batch_size': 2515, 'optimizer': 'Adam'}.
2026-06-18 18:42:29,678 - experiment_functions - INFO - Early stopping at epoch 3750. Best Metrics: (0.03277911047400724, 0.006962864721485411, 0.0188926177735096)
2026-06-18 18:42:29,780 - optuna.study.study - INFO - Trial 82 finished with values: [0.03277911047400724, 0.006962864721485411, 0.0188926177735096] and parameters: {'n_layers': 1, 'embedding_dim': 96, 'lr': 0.0007183006551542105, 'lambda_val': 4.521426485432383e-06, 'batch_size': 2689, 'optimizer': 'Adam'}.
2026-06-18 18:42:59,242 - experiment_functions - INFO - Early stopping at epoch 550. Best Metrics: (0.015680712124768386, 0.0033045977011494257, 0.008641787604834679)
2026-06-18 18:42:59,343 - optuna.study.study - INFO - Trial 83 finished with values: [0.015680712124768386, 0.0033045977011494257, 0.008641787604834679] and parameters: {'n_layers': 2, 'embedding_dim': 128, 'lr': 0.0016666158484092458, 'lambda_val': 0.0014622616946591267, 'batch_size': 3163, 'optimizer': 'RMSprop'}.
2026-06-18 18:44:22,988 - experiment_functions - INFO - Early stopping at epoch 1800. Best Metrics: (0.020154680999439265, 0.004564544650751547, 0.01102604522525384)
2026-06-18 18:44:23,089 - optuna.study.study - INFO - Trial 84 finished with values: [0.020154680999439265, 0.004564544650751547, 0.01102604522525384] and parameters: {'n_layers': 4, 'embedding_dim': 32, 'lr': 0.0004856174201898278, 'lambda_val': 0.004505589428166237, 'batch_size': 578, 'optimizer': 'Adam'}.
2026-06-18 18:47:31,839 - optuna.study.study - INFO - Trial 85 finished with values: [0.03004836787158172, 0.006563407856511305, 0.017282960376976665] and parameters: {'n_layers': 2, 'embedding_dim': 96, 'lr': 0.00039950195617414347, 'lambda_val': 0.00015514348570178205, 'batch_size': 991, 'optimizer': 'Adam'}.
2026-06-18 18:48:36,878 - experiment_functions - INFO - Early stopping at epoch 1400. Best Metrics: (0.0005868506332601995, 0.0001294682329165088, 0.00033201374811015074)
2026-06-18 18:48:36,966 - optuna.study.study - INFO - Trial 86 finished with values: [0.0005868506332601995, 0.0001294682329165088, 0.00033201374811015074] and parameters: {'n_layers': 3, 'embedding_dim': 64, 'lr': 1.963396245502517e-05, 'lambda_val': 4.457431336738457e-06, 'batch_size': 753, 'optimizer': 'Adam'}.
2026-06-18 18:52:01,381 - optuna.study.study - INFO - Trial 87 finished with values: [0.007356724200700379, 0.0018757104964001517, 0.004139000872967836] and parameters: {'n_layers': 3, 'embedding_dim': 128, 'lr': 0.00013575594902465817, 'lambda_val': 0.0654960552346548, 'batch_size': 3355, 'optimizer': 'RMSprop'}.
2026-06-18 18:52:43,824 - experiment_functions - INFO - Early stopping at epoch 850. Best Metrics: (0.02477380639507527, 0.005233990147783252, 0.014193598932239735)
2026-06-18 18:52:43,915 - optuna.study.study - INFO - Trial 88 finished with values: [0.02477380639507527, 0.005233990147783252, 0.014193598932239735] and parameters: {'n_layers': 2, 'embedding_dim': 96, 'lr': 0.0007183006551542105, 'lambda_val': 0.00015514348570178205, 'batch_size': 991, 'optimizer': 'RMSprop'}.
2026-06-18 18:53:52,441 - experiment_functions - INFO - Early stopping at epoch 1300. Best Metrics: (0.009796567858624879, 0.0023414803587217376, 0.00553146235783051)
2026-06-18 18:53:52,536 - optuna.study.study - INFO - Trial 89 finished with values: [0.009796567858624879, 0.0023414803587217376, 0.00553146235783051] and parameters: {'n_layers': 3, 'embedding_dim': 128, 'lr': 0.00045708033343298696, 'lambda_val': 0.04920148807151191, 'batch_size': 2794, 'optimizer': 'Adam'}.
2026-06-18 18:54:33,210 - experiment_functions - INFO - Early stopping at epoch 700. Best Metrics: (0.00038425054219796257, 8.999621068586586e-05, 0.00020279306644100032)
2026-06-18 18:54:33,294 - optuna.study.study - INFO - Trial 90 finished with values: [0.00038425054219796257, 8.999621068586586e-05, 0.00020279306644100032] and parameters: {'n_layers': 2, 'embedding_dim': 256, 'lr': 1.4822293429813704e-05, 'lambda_val': 0.034086085848787036, 'batch_size': 1246, 'optimizer': 'RMSprop'}.
2026-06-18 18:55:48,719 - experiment_functions - INFO - Early stopping at epoch 1600. Best Metrics: (0.025893913297576968, 0.005497663256283947, 0.014738267236823184)
2026-06-18 18:55:48,793 - optuna.study.study - INFO - Trial 91 finished with values: [0.025893913297576968, 0.005497663256283947, 0.014738267236823184] and parameters: {'n_layers': 2, 'embedding_dim': 64, 'lr': 0.0004856174201898278, 'lambda_val': 4.115717615485875e-05, 'batch_size': 4089, 'optimizer': 'Adam'}.
2026-06-18 18:56:27,952 - experiment_functions - INFO - Early stopping at epoch 550. Best Metrics: (0.007354835534742493, 0.0015583554376657827, 0.0038564953625438623)
2026-06-18 18:56:28,069 - optuna.study.study - INFO - Trial 92 finished with values: [0.007354835534742493, 0.0015583554376657827, 0.0038564953625438623] and parameters: {'n_layers': 4, 'embedding_dim': 256, 'lr': 0.011815617521112189, 'lambda_val': 0.0028755286014556106, 'batch_size': 2931, 'optimizer': 'Adam'}.
2026-06-18 18:57:58,066 - experiment_functions - INFO - Early stopping at epoch 1700. Best Metrics: (0.024864452382489348, 0.005388720474927372, 0.014221014109140976)
2026-06-18 18:57:58,151 - optuna.study.study - INFO - Trial 93 finished with values: [0.024864452382489348, 0.005388720474927372, 0.014221014109140976] and parameters: {'n_layers': 3, 'embedding_dim': 128, 'lr': 0.0004856174201898278, 'lambda_val': 1.1727812158033635e-06, 'batch_size': 578, 'optimizer': 'Adam'}.
2026-06-18 18:59:03,479 - experiment_functions - INFO - Early stopping at epoch 1450. Best Metrics: (0.006825398725266601, 0.0015204622963243654, 0.0035619646713168805)
