2026-06-23 03:14:30,949 - optuna.study.study - INFO - Trial 171 finished with values: [0.02325626023064635, 0.005012946823291652, 0.013456938290063426] and parameters: {'n_layers': 4, 'embedding_dim': 64, 'lr': 0.000267777720544778, 'lambda_val': 0.0011345897854453913, 'batch_size': 1341, 'optimizer': 'Adam'}.
2026-06-23 03:17:08,516 - optuna.study.study - INFO - Trial 172 finished with values: [0.0013788400011506613, 0.00035051155740810916, 0.0008481729024880455] and parameters: {'n_layers': 1, 'embedding_dim': 32, 'lr': 0.0003148625902411094, 'lambda_val': 1.105038231556551e-05, 'batch_size': 1895, 'optimizer': 'RMSprop'}.
2026-06-23 03:17:43,731 - experiment_functions - INFO - Early stopping at epoch 700. Best Metrics: (0.021868149366154693, 0.004717696097006442, 0.012470155611120332)
2026-06-23 03:17:43,830 - optuna.study.study - INFO - Trial 173 finished with values: [0.021868149366154693, 0.004717696097006442, 0.012470155611120332] and parameters: {'n_layers': 3, 'embedding_dim': 96, 'lr': 0.0013646646670668807, 'lambda_val': 1.105038231556551e-05, 'batch_size': 3305, 'optimizer': 'Adam'}.
2026-06-23 03:18:15,949 - experiment_functions - INFO - Early stopping at epoch 650. Best Metrics: (0.017879426114875998, 0.0038461538461538455, 0.010239482610656922)
2026-06-23 03:18:16,016 - optuna.study.study - INFO - Trial 174 finished with values: [0.017879426114875998, 0.0038461538461538455, 0.010239482610656922] and parameters: {'n_layers': 4, 'embedding_dim': 64, 'lr': 0.0016936188017047076, 'lambda_val': 8.179879507815703e-06, 'batch_size': 3305, 'optimizer': 'Adam'}.
2026-06-23 03:19:15,126 - experiment_functions - INFO - Early stopping at epoch 1350. Best Metrics: (0.02245280034636403, 0.004844006568144499, 0.01278112075762034)
2026-06-23 03:19:15,207 - optuna.study.study - INFO - Trial 175 finished with values: [0.02245280034636403, 0.004844006568144499, 0.01278112075762034] and parameters: {'n_layers': 3, 'embedding_dim': 32, 'lr': 0.0008213174750905707, 'lambda_val': 2.7464269407470928e-06, 'batch_size': 2651, 'optimizer': 'RMSprop'}.
2026-06-23 03:19:59,279 - experiment_functions - INFO - Early stopping at epoch 850. Best Metrics: (0.02049166665278874, 0.004514020462296325, 0.011909776474843554)
2026-06-23 03:19:59,359 - optuna.study.study - INFO - Trial 176 finished with values: [0.02049166665278874, 0.004514020462296325, 0.011909776474843554] and parameters: {'n_layers': 3, 'embedding_dim': 128, 'lr': 0.0008213174750905707, 'lambda_val': 0.0017972759027936231, 'batch_size': 2436, 'optimizer': 'Adam'}.
2026-06-23 03:22:55,295 - optuna.study.study - INFO - Trial 177 finished with values: [0.010164512112420528, 0.002242010862700518, 0.00564351238812357] and parameters: {'n_layers': 3, 'embedding_dim': 64, 'lr': 0.0688338651103124, 'lambda_val': 0.0010840808687380718, 'batch_size': 1249, 'optimizer': 'RMSprop'}.
2026-06-23 03:23:19,827 - experiment_functions - INFO - Early stopping at epoch 500. Best Metrics: (0.0005259767755877588, 0.0001294682329165088, 0.00029462835364379433)
2026-06-23 03:23:19,913 - optuna.study.study - INFO - Trial 178 finished with values: [0.0005259767755877588, 0.0001294682329165088, 0.00029462835364379433] and parameters: {'n_layers': 4, 'embedding_dim': 64, 'lr': 0.0008213174750905707, 'lambda_val': 1.1678222757114953e-05, 'batch_size': 3305, 'optimizer': 'SGD'}.
2026-06-23 03:24:14,157 - experiment_functions - INFO - Early stopping at epoch 800. Best Metrics: (0.01587045356390979, 0.0033819628647214855, 0.008908132162594982)
2026-06-23 03:24:14,283 - optuna.study.study - INFO - Trial 179 finished with values: [0.01587045356390979, 0.0033819628647214855, 0.008908132162594982] and parameters: {'n_layers': 4, 'embedding_dim': 256, 'lr': 0.0006886562164819431, 'lambda_val': 3.12735769757427e-06, 'batch_size': 2330, 'optimizer': 'RMSprop'}.
2026-06-23 03:26:24,608 - experiment_functions - INFO - Early stopping at epoch 2200. Best Metrics: (0.0053724744814732, 0.0011873184286977391, 0.0027871615413616554)
2026-06-23 03:26:24,689 - optuna.study.study - INFO - Trial 180 finished with values: [0.0053724744814732, 0.0011873184286977391, 0.0027871615413616554] and parameters: {'n_layers': 3, 'embedding_dim': 256, 'lr': 0.010301320128047705, 'lambda_val': 0.006418108485289533, 'batch_size': 3598, 'optimizer': 'RMSprop'}.
2026-06-23 03:28:36,829 - experiment_functions - INFO - Early stopping at epoch 2500. Best Metrics: (0.02334747830929388, 0.005016104585070102, 0.013003531521595663)
2026-06-23 03:28:36,903 - optuna.study.study - INFO - Trial 181 finished with values: [0.02334747830929388, 0.005016104585070102, 0.013003531521595663] and parameters: {'n_layers': 4, 'embedding_dim': 128, 'lr': 0.000267777720544778, 'lambda_val': 0.0005196802788376184, 'batch_size': 3305, 'optimizer': 'RMSprop'}.
2026-06-23 03:29:01,963 - experiment_functions - INFO - Early stopping at epoch 550. Best Metrics: (0.015065168651014562, 0.0032824933687002652, 0.007868791950777698)
2026-06-23 03:29:02,064 - optuna.study.study - INFO - Trial 182 finished with values: [0.015065168651014562, 0.0032824933687002652, 0.007868791950777698] and parameters: {'n_layers': 2, 'embedding_dim': 32, 'lr': 0.010581481753294916, 'lambda_val': 0.0010840808687380718, 'batch_size': 3305, 'optimizer': 'Adam'}.
2026-06-23 03:29:56,787 - experiment_functions - INFO - Early stopping at epoch 1250. Best Metrics: (0.032385586798227416, 0.006699191612984717, 0.018651150700943586)
2026-06-23 03:29:56,871 - optuna.study.study - INFO - Trial 183 finished with values: [0.032385586798227416, 0.006699191612984717, 0.018651150700943586] and parameters: {'n_layers': 1, 'embedding_dim': 64, 'lr': 0.0016936188017047076, 'lambda_val': 1.1976797619462708e-05, 'batch_size': 3305, 'optimizer': 'Adam'}.
2026-06-23 03:32:39,554 - optuna.study.study - INFO - Trial 184 finished with values: [0.025558754829174087, 0.005638183655425035, 0.015032478711043957] and parameters: {'n_layers': 1, 'embedding_dim': 32, 'lr': 0.0006886562164819431, 'lambda_val': 2.7464269407470928e-06, 'batch_size': 1895, 'optimizer': 'Adam'}.
2026-06-23 03:33:15,583 - experiment_functions - INFO - Early stopping at epoch 800. Best Metrics: (0.017299848984165332, 0.0037498421119110774, 0.009544806645449011)
2026-06-23 03:33:15,724 - optuna.study.study - INFO - Trial 185 finished with values: [0.017299848984165332, 0.0037498421119110774, 0.009544806645449011] and parameters: {'n_layers': 4, 'embedding_dim': 32, 'lr': 0.0016936188017047076, 'lambda_val': 2.7464269407470928e-06, 'batch_size': 1702, 'optimizer': 'Adam'}.
2026-06-23 03:36:09,939 - optuna.study.study - INFO - Trial 186 finished with values: [0.03324016549515316, 0.007051282051282051, 0.019111440665365447] and parameters: {'n_layers': 1, 'embedding_dim': 96, 'lr': 0.0006886562164819431, 'lambda_val': 2.7464269407470928e-06, 'batch_size': 2330, 'optimizer': 'RMSprop'}.
2026-06-23 03:37:33,324 - experiment_functions - INFO - Early stopping at epoch 1500. Best Metrics: (0.027145844084330746, 0.005808702791461412, 0.015347639181900347)
2026-06-23 03:37:33,404 - optuna.study.study - INFO - Trial 187 finished with values: [0.027145844084330746, 0.005808702791461412, 0.015347639181900347] and parameters: {'n_layers': 2, 'embedding_dim': 256, 'lr': 0.0008213174750905707, 'lambda_val': 4.998160662190083e-05, 'batch_size': 827, 'optimizer': 'Adam'}.
2026-06-23 03:40:24,338 - optuna.study.study - INFO - Trial 188 finished with values: [0.03231991242521219, 0.006894972843248706, 0.01853804270184609] and parameters: {'n_layers': 1, 'embedding_dim': 64, 'lr': 0.0008213174750905707, 'lambda_val': 1.1678222757114953e-05, 'batch_size': 2825, 'optimizer': 'RMSprop'}.
2026-06-23 03:43:03,556 - optuna.study.study - INFO - Trial 189 finished with values: [0.0009685462768104171, 0.00022893772893772894, 0.0005727050749632766] and parameters: {'n_layers': 1, 'embedding_dim': 32, 'lr': 0.000267777720544778, 'lambda_val': 2.7464269407470928e-06, 'batch_size': 1895, 'optimizer': 'RMSprop'}.
2026-06-23 03:43:44,860 - experiment_functions - INFO - Early stopping at epoch 650. Best Metrics: (0.019661888927953848, 0.004152456738663636, 0.010958279418122977)
2026-06-23 03:43:44,982 - optuna.study.study - INFO - Trial 190 finished with values: [0.019661888927953848, 0.004152456738663636, 0.010958279418122977] and parameters: {'n_layers': 3, 'embedding_dim': 256, 'lr': 0.0016936188017047076, 'lambda_val': 4.998160662190083e-05, 'batch_size': 3305, 'optimizer': 'Adam'}.
2026-06-23 03:44:09,215 - experiment_functions - INFO - Early stopping at epoch 500. Best Metrics: (0.000557741828292534, 0.00011999494758115448, 0.0003069020005551799)
2026-06-23 03:44:09,550 - optuna.study.study - INFO - Trial 191 finished with values: [0.000557741828292534, 0.00011999494758115448, 0.0003069020005551799] and parameters: {'n_layers': 3, 'embedding_dim': 64, 'lr': 0.0688338651103124, 'lambda_val': 0.0010840808687380718, 'batch_size': 1249, 'optimizer': 'SGD'}.
2026-06-23 03:44:39,465 - experiment_functions - INFO - Early stopping at epoch 650. Best Metrics: (0.02851095813696004, 0.006088164708854363, 0.016552735895012043)
2026-06-23 03:44:39,545 - optuna.study.study - INFO - Trial 192 finished with values: [0.02851095813696004, 0.006088164708854363, 0.016552735895012043] and parameters: {'n_layers': 1, 'embedding_dim': 64, 'lr': 0.0054915489808154486, 'lambda_val': 0.0010840808687380718, 'batch_size': 2548, 'optimizer': 'Adam'}.
2026-06-23 03:45:09,466 - experiment_functions - INFO - Early stopping at epoch 650. Best Metrics: (0.019094458810527373, 0.004112984716432992, 0.010550862114173692)
2026-06-23 03:45:09,788 - optuna.study.study - INFO - Trial 193 finished with values: [0.019094458810527373, 0.004112984716432992, 0.010550862114173692] and parameters: {'n_layers': 3, 'embedding_dim': 32, 'lr': 0.0025441842430441314, 'lambda_val': 1.1976797619462708e-05, 'batch_size': 3305, 'optimizer': 'Adam'}.
2026-06-23 03:45:37,831 - experiment_functions - INFO - Early stopping at epoch 550. Best Metrics: (0.011209281172577343, 0.002431476569407604, 0.006085888386402104)
2026-06-23 03:45:37,911 - optuna.study.study - INFO - Trial 194 finished with values: [0.011209281172577343, 0.002431476569407604, 0.006085888386402104] and parameters: {'n_layers': 3, 'embedding_dim': 96, 'lr': 0.006937640469041745, 'lambda_val': 0.0005196802788376184, 'batch_size': 3326, 'optimizer': 'Adam'}.
2026-06-23 03:46:16,733 - experiment_functions - INFO - Early stopping at epoch 850. Best Metrics: (0.02232366269587257, 0.0048013767841354055, 0.012428713872584892)
2026-06-23 03:46:16,813 - optuna.study.study - INFO - Trial 195 finished with values: [0.02232366269587257, 0.0048013767841354055, 0.012428713872584892] and parameters: {'n_layers': 3, 'embedding_dim': 32, 'lr': 0.0013646646670668807, 'lambda_val': 2.7464269407470928e-06, 'batch_size': 1895, 'optimizer': 'Adam'}.
2026-06-23 03:49:32,819 - optuna.study.study - INFO - Trial 196 finished with values: [0.003699166101992492, 0.0008794366552987243, 0.0021904070839386496] and parameters: {'n_layers': 3, 'embedding_dim': 128, 'lr': 9.84363326048192e-05, 'lambda_val': 1.1358678227612878e-06, 'batch_size': 2436, 'optimizer': 'RMSprop'}.
2026-06-23 03:50:24,927 - experiment_functions - INFO - Early stopping at epoch 1200. Best Metrics: (0.030619008631659533, 0.006250789440444613, 0.01728437589209956)
2026-06-23 03:50:25,010 - optuna.study.study - INFO - Trial 197 finished with values: [0.030619008631659533, 0.006250789440444613, 0.01728437589209956] and parameters: {'n_layers': 1, 'embedding_dim': 32, 'lr': 0.0025566338112489964, 'lambda_val': 1.1976797619462708e-05, 'batch_size': 3305, 'optimizer': 'Adam'}.
2026-06-23 03:53:16,486 - optuna.study.study - INFO - Trial 198 finished with values: [0.0112699225296453, 0.002616205633447013, 0.006290654450993366] and parameters: {'n_layers': 4, 'embedding_dim': 32, 'lr': 0.00017593274605774603, 'lambda_val': 0.010289861868389552, 'batch_size': 1895, 'optimizer': 'RMSprop'}.
2026-06-23 03:56:16,302 - optuna.study.study - INFO - Trial 199 finished with values: [0.03322789998190267, 0.007029177718832892, 0.019155241371632586] and parameters: {'n_layers': 1, 'embedding_dim': 128, 'lr': 0.0008213174750905707, 'lambda_val': 0.00019370302140894226, 'batch_size': 1807, 'optimizer': 'Adam'}.
2026-06-23 03:56:40,211 - experiment_functions - INFO - Early stopping at epoch 500. Best Metrics: (0.00048553749433900264, 0.00010736390046734874, 0.000265546095818863)
2026-06-23 03:56:40,292 - optuna.study.study - INFO - Trial 200 finished with values: [0.00048553749433900264, 0.00010736390046734874, 0.000265546095818863] and parameters: {'n_layers': 2, 'embedding_dim': 64, 'lr': 0.00022390508432523326, 'lambda_val': 0.029445364120390314, 'batch_size': 3305, 'optimizer': 'Adam'}.
2026-06-23 03:57:04,822 - experiment_functions - INFO - Early stopping at epoch 550. Best Metrics: (0.008381108117556782, 0.0018346595932802832, 0.004509681327841127)
2026-06-23 03:57:04,943 - optuna.study.study - INFO - Trial 201 finished with values: [0.008381108117556782, 0.0018346595932802832, 0.004509681327841127] and parameters: {'n_layers': 1, 'embedding_dim': 32, 'lr': 0.0529444809001993, 'lambda_val': 0.0011345897854453913, 'batch_size': 2548, 'optimizer': 'Adam'}.
2026-06-23 03:57:45,484 - experiment_functions - INFO - Early stopping at epoch 900. Best Metrics: (0.02272931546249993, 0.004858216496147531, 0.012852581907196268)
2026-06-23 03:57:45,582 - optuna.study.study - INFO - Trial 202 finished with values: [0.02272931546249993, 0.004858216496147531, 0.012852581907196268] and parameters: {'n_layers': 3, 'embedding_dim': 32, 'lr': 0.0013646646670668807, 'lambda_val': 0.0011345897854453913, 'batch_size': 1807, 'optimizer': 'Adam'}.
2026-06-23 03:58:15,648 - experiment_functions - INFO - Early stopping at epoch 650. Best Metrics: (0.020754957920188513, 0.0043956043956043965, 0.011551777788080034)
2026-06-23 03:58:15,734 - optuna.study.study - INFO - Trial 203 finished with values: [0.020754957920188513, 0.0043956043956043965, 0.011551777788080034] and parameters: {'n_layers': 3, 'embedding_dim': 32, 'lr': 0.0025566338112489964, 'lambda_val': 1.1976797619462708e-05, 'batch_size': 3305, 'optimizer': 'Adam'}.
2026-06-23 04:01:04,116 - optuna.study.study - INFO - Trial 204 finished with values: [0.028412130810780416, 0.00604553492484527, 0.01590093999947989] and parameters: {'n_layers': 2, 'embedding_dim': 32, 'lr': 0.0004463508454333929, 'lambda_val': 0.0016324316088680724, 'batch_size': 1807, 'optimizer': 'RMSprop'}.
2026-06-23 04:02:14,487 - experiment_functions - INFO - Early stopping at epoch 1600. Best Metrics: (0.02476526637621807, 0.005442402425161046, 0.014204420960772882)
2026-06-23 04:02:14,711 - optuna.study.study - INFO - Trial 205 finished with values: [0.02476526637621807, 0.005442402425161046, 0.014204420960772882] and parameters: {'n_layers': 3, 'embedding_dim': 32, 'lr': 0.0006886562164819431, 'lambda_val': 3.12735769757427e-06, 'batch_size': 1872, 'optimizer': 'RMSprop'}.
2026-06-23 04:02:52,612 - experiment_functions - INFO - Early stopping at epoch 550. Best Metrics: (0.013800164197518706, 0.0029098774788429965, 0.007801455528631593)
2026-06-23 04:02:52,691 - optuna.study.study - INFO - Trial 206 finished with values: [0.013800164197518706, 0.0029098774788429965, 0.007801455528631593] and parameters: {'n_layers': 4, 'embedding_dim': 256, 'lr': 0.0025566338112489964, 'lambda_val': 0.0005196802788376184, 'batch_size': 922, 'optimizer': 'RMSprop'}.
2026-06-23 04:06:01,220 - optuna.study.study - INFO - Trial 207 finished with values: [0.019163574511088036, 0.004313502589364658, 0.010830986529376434] and parameters: {'n_layers': 3, 'embedding_dim': 96, 'lr': 0.0002551141003906411, 'lambda_val': 1.105038231556551e-05, 'batch_size': 922, 'optimizer': 'Adam'}.
2026-06-23 04:06:27,513 - experiment_functions - INFO - Early stopping at epoch 500. Best Metrics: (0.0004868842648698064, 0.00011052166224580018, 0.0002603944618210967)
2026-06-23 04:06:27,600 - optuna.study.study - INFO - Trial 208 finished with values: [0.0004868842648698064, 0.00011052166224580018, 0.0002603944618210967] and parameters: {'n_layers': 1, 'embedding_dim': 256, 'lr': 3.471614991935976e-05, 'lambda_val': 4.998160662190083e-05, 'batch_size': 827, 'optimizer': 'Adam'}.
2026-06-23 04:06:51,659 - experiment_functions - INFO - Early stopping at epoch 500. Best Metrics: (0.0005189394568926929, 0.00012315270935960593, 0.00027288999775620313)
2026-06-23 04:06:51,747 - optuna.study.study - INFO - Trial 209 finished with values: [0.0005189394568926929, 0.00012315270935960593, 0.00027288999775620313] and parameters: {'n_layers': 3, 'embedding_dim': 64, 'lr': 0.0013029739660954116, 'lambda_val': 0.010832797075680732, 'batch_size': 3305, 'optimizer': 'SGD'}.
2026-06-23 04:07:28,199 - experiment_functions - INFO - Early stopping at epoch 700. Best Metrics: (0.02695865289743188, 0.005783440697233801, 0.015308737347157859)
2026-06-23 04:07:28,537 - optuna.study.study - INFO - Trial 210 finished with values: [0.02695865289743188, 0.005783440697233801, 0.015308737347157859] and parameters: {'n_layers': 1, 'embedding_dim': 256, 'lr': 0.004023997993481987, 'lambda_val': 0.0010840808687380718, 'batch_size': 2136, 'optimizer': 'Adam'}.
2026-06-23 04:08:10,393 - experiment_functions - INFO - Early stopping at epoch 800. Best Metrics: (0.01846572046175415, 0.004034040671971707, 0.010032886640462703)
2026-06-23 04:08:10,476 - optuna.study.study - INFO - Trial 211 finished with values: [0.01846572046175415, 0.004034040671971707, 0.010032886640462703] and parameters: {'n_layers': 3, 'embedding_dim': 128, 'lr': 0.0008639986019635256, 'lambda_val': 0.005404522144278895, 'batch_size': 2754, 'optimizer': 'Adam'}.
2026-06-23 04:08:53,396 - experiment_functions - INFO - Early stopping at epoch 750. Best Metrics: (0.026877035148920564, 0.005589238347859038, 0.015190298593392694)
2026-06-23 04:08:53,479 - optuna.study.study - INFO - Trial 212 finished with values: [0.026877035148920564, 0.005589238347859038, 0.015190298593392694] and parameters: {'n_layers': 2, 'embedding_dim': 256, 'lr': 0.0016936188017047076, 'lambda_val': 4.998160662190083e-05, 'batch_size': 3203, 'optimizer': 'Adam'}.
2026-06-23 04:09:33,227 - experiment_functions - INFO - Early stopping at epoch 900. Best Metrics: (0.023195710080023437, 0.004851900972590629, 0.012921857895394507)
2026-06-23 04:09:33,357 - optuna.study.study - INFO - Trial 213 finished with values: [0.023195710080023437, 0.004851900972590629, 0.012921857895394507] and parameters: {'n_layers': 2, 'embedding_dim': 32, 'lr': 0.0025566338112489964, 'lambda_val': 4.998160662190083e-05, 'batch_size': 827, 'optimizer': 'Adam'}.
2026-06-23 04:12:33,006 - optuna.study.study - INFO - Trial 214 finished with values: [0.013267143804927755, 0.003015662498421119, 0.007864031650012034] and parameters: {'n_layers': 2, 'embedding_dim': 96, 'lr': 0.00021177542534475834, 'lambda_val': 1.1976797619462708e-05, 'batch_size': 3305, 'optimizer': 'Adam'}.
2026-06-23 04:16:54,986 - optuna.study.study - INFO - Trial 215 finished with values: [0.023893208541510263, 0.0053350385246936985, 0.013718968310198393] and parameters: {'n_layers': 4, 'embedding_dim': 256, 'lr': 0.000267777720544778, 'lambda_val': 4.998160662190083e-05, 'batch_size': 741, 'optimizer': 'Adam'}.
2026-06-23 04:20:01,959 - optuna.study.study - INFO - Trial 216 finished with values: [0.021599821616538586, 0.004749273714790957, 0.012249105125783326] and parameters: {'n_layers': 4, 'embedding_dim': 64, 'lr': 0.000267777720544778, 'lambda_val': 3.12735769757427e-06, 'batch_size': 2381, 'optimizer': 'Adam'}.
2026-06-23 04:22:49,959 - optuna.study.study - INFO - Trial 217 finished with values: [0.02670433464118944, 0.005767651888341544, 0.014987879229889344] and parameters: {'n_layers': 2, 'embedding_dim': 32, 'lr': 0.0004455324044021342, 'lambda_val': 1.1976797619462708e-05, 'batch_size': 2891, 'optimizer': 'Adam'}.
2026-06-23 04:25:51,171 - optuna.study.study - INFO - Trial 218 finished with values: [0.03569806301858819, 0.007327586206896551, 0.02000681301354075] and parameters: {'n_layers': 1, 'embedding_dim': 128, 'lr': 0.0008213174750905707, 'lambda_val': 1.1678222757114953e-05, 'batch_size': 3983, 'optimizer': 'Adam'}.
2026-06-23 04:27:36,900 - experiment_functions - INFO - Early stopping at epoch 2200. Best Metrics: (0.030417461631621814, 0.006413414172034862, 0.017246882445129313)
2026-06-23 04:27:36,981 - optuna.study.study - INFO - Trial 219 finished with values: [0.030417461631621814, 0.006413414172034862, 0.017246882445129313] and parameters: {'n_layers': 2, 'embedding_dim': 128, 'lr': 0.0004463508454333929, 'lambda_val': 0.0007117388340279954, 'batch_size': 3203, 'optimizer': 'RMSprop'}.
2026-06-23 04:28:43,001 - experiment_functions - INFO - Early stopping at epoch 1500. Best Metrics: (0.02152540197503304, 0.0045724390551976765, 0.012411687798413788)
2026-06-23 04:28:43,358 - optuna.study.study - INFO - Trial 220 finished with values: [0.02152540197503304, 0.0045724390551976765, 0.012411687798413788] and parameters: {'n_layers': 3, 'embedding_dim': 32, 'lr': 0.0008213174750905707, 'lambda_val': 0.00019370302140894226, 'batch_size': 3272, 'optimizer': 'RMSprop'}.
2026-06-23 04:31:23,335 - optuna.study.study - INFO - Trial 221 finished with values: [0.0010136752733845293, 0.00023525325249463183, 0.0005825080807524099] and parameters: {'n_layers': 1, 'embedding_dim': 32, 'lr': 0.0003383181496792812, 'lambda_val': 2.7464269407470928e-06, 'batch_size': 1341, 'optimizer': 'Adam'}.
2026-06-23 04:34:39,104 - experiment_functions - INFO - Early stopping at epoch 3950. Best Metrics: (0.03271887760415748, 0.0069944423392699255, 0.01868188915233591)
