2026-06-17 12:05:21,274 - optuna.study.study - INFO - Trial 102 finished with values: [0.0028618628922939897, 0.0006220790703549324, 0.0017481415603360527] and parameters: {'n_layers': 1, 'embedding_dim': 96, 'lr': 0.0005086943405728801, 'lambda_val': 3.399802510238604e-06, 'batch_size': 3274, 'optimizer': 'Adam'}.
2026-06-17 12:06:42,444 - experiment_functions - INFO - Early stopping at epoch 1450. Best Metrics: (0.003253634917685476, 0.0008399646330680814, 0.002018912533886695)
2026-06-17 12:06:42,520 - optuna.study.study - INFO - Trial 103 finished with values: [0.003253634917685476, 0.0008399646330680814, 0.002018912533886695] and parameters: {'n_layers': 4, 'embedding_dim': 256, 'lr': 0.0009353759827353638, 'lambda_val': 0.00027668479073292746, 'batch_size': 934, 'optimizer': 'Adam'}.
2026-06-17 12:07:30,905 - experiment_functions - INFO - Early stopping at epoch 950. Best Metrics: (0.0026896103077941767, 0.0006962864721485411, 0.0016953296314260566)
2026-06-17 12:07:31,093 - optuna.study.study - INFO - Trial 104 finished with values: [0.0026896103077941767, 0.0006962864721485411, 0.0016953296314260566] and parameters: {'n_layers': 2, 'embedding_dim': 256, 'lr': 0.005427188960178344, 'lambda_val': 7.067730208761557e-06, 'batch_size': 2754, 'optimizer': 'RMSprop'}.
2026-06-17 12:10:16,690 - optuna.study.study - INFO - Trial 105 finished with values: [0.0016861267394789837, 0.00035209043829733484, 0.0010370759298594962] and parameters: {'n_layers': 2, 'embedding_dim': 64, 'lr': 0.00019406644562517362, 'lambda_val': 0.0006520933628630919, 'batch_size': 1423, 'optimizer': 'Adam'}.
2026-06-17 12:11:24,168 - experiment_functions - INFO - Early stopping at epoch 1600. Best Metrics: (0.0030758370148582107, 0.0007326007326007327, 0.0018887403373586253)
2026-06-17 12:11:24,257 - optuna.study.study - INFO - Trial 106 finished with values: [0.0030758370148582107, 0.0007326007326007327, 0.0018887403373586253] and parameters: {'n_layers': 2, 'embedding_dim': 64, 'lr': 0.0009353759827353638, 'lambda_val': 3.6026117599990615e-05, 'batch_size': 2754, 'optimizer': 'RMSprop'}.
2026-06-17 12:12:05,917 - experiment_functions - INFO - Early stopping at epoch 950. Best Metrics: (0.0027636146079494566, 0.0006331312365795125, 0.0016912499425817576)
2026-06-17 12:12:06,002 - optuna.study.study - INFO - Trial 107 finished with values: [0.0027636146079494566, 0.0006331312365795125, 0.0016912499425817576] and parameters: {'n_layers': 2, 'embedding_dim': 64, 'lr': 0.0014337059824812508, 'lambda_val': 0.003295860410553125, 'batch_size': 4027, 'optimizer': 'Adam'}.
2026-06-17 12:13:57,009 - experiment_functions - INFO - Early stopping at epoch 2500. Best Metrics: (0.002418378593056263, 0.0006141846659088038, 0.0015839680380367168)
2026-06-17 12:13:57,096 - optuna.study.study - INFO - Trial 108 finished with values: [0.002418378593056263, 0.0006141846659088038, 0.0015839680380367168] and parameters: {'n_layers': 2, 'embedding_dim': 128, 'lr': 0.0005773267382294165, 'lambda_val': 0.00012072062045747035, 'batch_size': 3806, 'optimizer': 'Adam'}.
2026-06-17 12:14:37,248 - experiment_functions - INFO - Early stopping at epoch 950. Best Metrics: (0.003134262117127884, 0.000663129973474801, 0.0017927741010186592)
2026-06-17 12:14:37,385 - optuna.study.study - INFO - Trial 109 finished with values: [0.003134262117127884, 0.000663129973474801, 0.0017927741010186592] and parameters: {'n_layers': 1, 'embedding_dim': 32, 'lr': 0.0014337059824812508, 'lambda_val': 1.8109663387347854e-06, 'batch_size': 4027, 'optimizer': 'RMSprop'}.
2026-06-17 12:17:26,317 - optuna.study.study - INFO - Trial 110 finished with values: [0.003037173038227946, 0.0007089175192623469, 0.0019006705832469418] and parameters: {'n_layers': 2, 'embedding_dim': 96, 'lr': 0.00032551897153632015, 'lambda_val': 4.480990319634202e-06, 'batch_size': 2622, 'optimizer': 'RMSprop'}.
2026-06-17 12:17:48,966 - experiment_functions - INFO - Early stopping at epoch 500. Best Metrics: (0.0006070860076344478, 0.00013262599469496023, 0.0003259547970735253)
2026-06-17 12:17:49,050 - optuna.study.study - INFO - Trial 111 finished with values: [0.0006070860076344478, 0.00013262599469496023, 0.0003259547970735253] and parameters: {'n_layers': 2, 'embedding_dim': 64, 'lr': 0.00035885552475151193, 'lambda_val': 0.0004867376939360758, 'batch_size': 2326, 'optimizer': 'SGD'}.
2026-06-17 12:18:22,997 - experiment_functions - INFO - Early stopping at epoch 650. Best Metrics: (0.002734899614673736, 0.0007231274472653783, 0.0017591823480016216)
2026-06-17 12:18:23,074 - optuna.study.study - INFO - Trial 112 finished with values: [0.002734899614673736, 0.0007231274472653783, 0.0017591823480016216] and parameters: {'n_layers': 2, 'embedding_dim': 256, 'lr': 0.0059130773813250445, 'lambda_val': 1.8109663387347854e-06, 'batch_size': 1423, 'optimizer': 'Adam'}.
2026-06-17 12:18:48,972 - experiment_functions - INFO - Early stopping at epoch 550. Best Metrics: (0.0027499579047476075, 0.0006331312365795125, 0.0017191195155066667)
2026-06-17 12:18:49,047 - optuna.study.study - INFO - Trial 113 finished with values: [0.0027499579047476075, 0.0006331312365795125, 0.0017191195155066667] and parameters: {'n_layers': 2, 'embedding_dim': 96, 'lr': 0.011697690387930714, 'lambda_val': 3.399802510238604e-06, 'batch_size': 3274, 'optimizer': 'Adam'}.
2026-06-17 12:19:21,133 - experiment_functions - INFO - Early stopping at epoch 550. Best Metrics: (0.0031642767466904262, 0.000841543513957307, 0.001985616793000109)
2026-06-17 12:19:21,220 - optuna.study.study - INFO - Trial 114 finished with values: [0.0031642767466904262, 0.000841543513957307, 0.001985616793000109] and parameters: {'n_layers': 4, 'embedding_dim': 256, 'lr': 0.013498745374989938, 'lambda_val': 1.170012968533328e-05, 'batch_size': 1507, 'optimizer': 'RMSprop'}.
2026-06-17 12:19:46,200 - experiment_functions - INFO - Early stopping at epoch 550. Best Metrics: (0.002406367607694053, 0.0005368195023367437, 0.0015033651015055219)
2026-06-17 12:19:46,299 - optuna.study.study - INFO - Trial 115 finished with values: [0.002406367607694053, 0.0005368195023367437, 0.0015033651015055219] and parameters: {'n_layers': 1, 'embedding_dim': 96, 'lr': 0.03894682947090565, 'lambda_val': 3.399802510238604e-06, 'batch_size': 2151, 'optimizer': 'Adam'}.
2026-06-17 12:23:12,150 - optuna.study.study - INFO - Trial 116 finished with values: [0.0033417862419976956, 0.0008225969432865983, 0.0021534447749324563] and parameters: {'n_layers': 3, 'embedding_dim': 256, 'lr': 0.0005086943405728801, 'lambda_val': 0.00027668479073292746, 'batch_size': 893, 'optimizer': 'Adam'}.
2026-06-17 12:24:09,122 - experiment_functions - INFO - Early stopping at epoch 1000. Best Metrics: (0.0031234464591436014, 0.0008052292535051155, 0.001915964435381813)
2026-06-17 12:24:09,198 - optuna.study.study - INFO - Trial 117 finished with values: [0.0031234464591436014, 0.0008052292535051155, 0.001915964435381813] and parameters: {'n_layers': 4, 'embedding_dim': 256, 'lr': 0.0014337059824812508, 'lambda_val': 0.00027668479073292746, 'batch_size': 4027, 'optimizer': 'Adam'}.
2026-06-17 12:26:54,431 - optuna.study.study - INFO - Trial 118 finished with values: [0.0032887449725784446, 0.0007578628268283442, 0.0019498991022310628] and parameters: {'n_layers': 2, 'embedding_dim': 64, 'lr': 0.00035885552475151193, 'lambda_val': 1.1791971258066213e-06, 'batch_size': 2622, 'optimizer': 'RMSprop'}.
2026-06-17 12:27:22,695 - experiment_functions - INFO - Early stopping at epoch 650. Best Metrics: (0.0023627355736346393, 0.0005731337627889353, 0.0015216635877928282)
2026-06-17 12:27:22,771 - optuna.study.study - INFO - Trial 119 finished with values: [0.0023627355736346393, 0.0005731337627889353, 0.0015216635877928282] and parameters: {'n_layers': 2, 'embedding_dim': 32, 'lr': 0.013498745374989938, 'lambda_val': 1.9289997599017184e-06, 'batch_size': 1507, 'optimizer': 'RMSprop'}.
2026-06-17 12:30:00,863 - experiment_functions - INFO - Early stopping at epoch 3800. Best Metrics: (0.0006100220417815064, 0.00014367816091954023, 0.0003575936079266532)
2026-06-17 12:30:00,956 - optuna.study.study - INFO - Trial 120 finished with values: [0.0006100220417815064, 0.00014367816091954023, 0.0003575936079266532] and parameters: {'n_layers': 1, 'embedding_dim': 96, 'lr': 2.05598791884374e-05, 'lambda_val': 0.003680838935502993, 'batch_size': 3176, 'optimizer': 'RMSprop'}.
2026-06-17 12:30:32,422 - experiment_functions - INFO - Early stopping at epoch 600. Best Metrics: (0.002169197939756491, 0.0005905014525704182, 0.0014343912900071345)
2026-06-17 12:30:32,504 - optuna.study.study - INFO - Trial 121 finished with values: [0.002169197939756491, 0.0005905014525704182, 0.0014343912900071345] and parameters: {'n_layers': 2, 'embedding_dim': 256, 'lr': 0.005427188960178344, 'lambda_val': 0.007077349748530695, 'batch_size': 2754, 'optimizer': 'Adam'}.
2026-06-17 12:31:01,018 - experiment_functions - INFO - Early stopping at epoch 650. Best Metrics: (0.0029831266606150653, 0.0007057597574838953, 0.0018173097845692017)
2026-06-17 12:31:01,440 - optuna.study.study - INFO - Trial 122 finished with values: [0.0029831266606150653, 0.0007057597574838953, 0.0018173097845692017] and parameters: {'n_layers': 2, 'embedding_dim': 64, 'lr': 0.0059130773813250445, 'lambda_val': 1.9289997599017184e-06, 'batch_size': 1507, 'optimizer': 'Adam'}.
2026-06-17 12:31:26,901 - experiment_functions - INFO - Early stopping at epoch 550. Best Metrics: (0.0025443640233472806, 0.0006757610205886068, 0.0016441333287133346)
2026-06-17 12:31:26,970 - optuna.study.study - INFO - Trial 123 finished with values: [0.0025443640233472806, 0.0006757610205886068, 0.0016441333287133346] and parameters: {'n_layers': 4, 'embedding_dim': 64, 'lr': 0.009567567424439887, 'lambda_val': 2.2853011169521347e-06, 'batch_size': 3141, 'optimizer': 'RMSprop'}.
2026-06-17 12:32:03,273 - experiment_functions - INFO - Early stopping at epoch 650. Best Metrics: (0.0031152285722782624, 0.000775230516609827, 0.0019493318789064412)
2026-06-17 12:32:03,377 - optuna.study.study - INFO - Trial 124 finished with values: [0.0031152285722782624, 0.000775230516609827, 0.0019493318789064412] and parameters: {'n_layers': 4, 'embedding_dim': 256, 'lr': 0.0009353759827353638, 'lambda_val': 0.002174949430049739, 'batch_size': 3371, 'optimizer': 'RMSprop'}.
2026-06-17 12:33:34,725 - experiment_functions - INFO - Early stopping at epoch 1900. Best Metrics: (0.0018322666096834898, 0.0005336617405582924, 0.001172291607029187)
2026-06-17 12:33:34,810 - optuna.study.study - INFO - Trial 125 finished with values: [0.0018322666096834898, 0.0005336617405582924, 0.001172291607029187] and parameters: {'n_layers': 2, 'embedding_dim': 256, 'lr': 0.06248215068070222, 'lambda_val': 0.003295860410553125, 'batch_size': 1999, 'optimizer': 'Adam'}.
2026-06-17 12:34:18,277 - experiment_functions - INFO - Early stopping at epoch 950. Best Metrics: (0.0019364113588974112, 0.0005636604774535809, 0.0012555562122569686)
2026-06-17 12:34:18,363 - optuna.study.study - INFO - Trial 126 finished with values: [0.0019364113588974112, 0.0005636604774535809, 0.0012555562122569686] and parameters: {'n_layers': 3, 'embedding_dim': 128, 'lr': 0.013498745374989938, 'lambda_val': 0.007077349748530695, 'batch_size': 1507, 'optimizer': 'RMSprop'}.
2026-06-17 12:35:21,479 - experiment_functions - INFO - Early stopping at epoch 1550. Best Metrics: (0.0030555763613586977, 0.0006726032588101555, 0.0018131913080460596)
2026-06-17 12:35:21,570 - optuna.study.study - INFO - Trial 127 finished with values: [0.0030555763613586977, 0.0006726032588101555, 0.0018131913080460596] and parameters: {'n_layers': 1, 'embedding_dim': 64, 'lr': 0.0009353759827353638, 'lambda_val': 0.0004867376939360758, 'batch_size': 3437, 'optimizer': 'RMSprop'}.
2026-06-17 12:35:45,851 - experiment_functions - INFO - Early stopping at epoch 500. Best Metrics: (0.0004702642597991907, 0.00010578501957812301, 0.0002619833193598628)
2026-06-17 12:35:45,936 - optuna.study.study - INFO - Trial 128 finished with values: [0.0004702642597991907, 0.00010578501957812301, 0.0002619833193598628] and parameters: {'n_layers': 1, 'embedding_dim': 256, 'lr': 0.00017715080286904688, 'lambda_val': 0.07859991099891864, 'batch_size': 1507, 'optimizer': 'Adam'}.
2026-06-17 12:36:12,204 - experiment_functions - INFO - Early stopping at epoch 600. Best Metrics: (0.0026279384734277725, 0.0006520778072502211, 0.0017449928188993586)
2026-06-17 12:36:12,347 - optuna.study.study - INFO - Trial 129 finished with values: [0.0026279384734277725, 0.0006520778072502211, 0.0017449928188993586] and parameters: {'n_layers': 4, 'embedding_dim': 32, 'lr': 0.005427188960178344, 'lambda_val': 0.0001910185883597541, 'batch_size': 3141, 'optimizer': 'RMSprop'}.
2026-06-17 12:38:35,676 - experiment_functions - INFO - Early stopping at epoch 3650. Best Metrics: (0.0026712524022230737, 0.0006015536187949981, 0.0016984165435906602)
2026-06-17 12:38:35,760 - optuna.study.study - INFO - Trial 130 finished with values: [0.0026712524022230737, 0.0006015536187949981, 0.0016984165435906602] and parameters: {'n_layers': 3, 'embedding_dim': 32, 'lr': 0.0003870961517604798, 'lambda_val': 0.007077349748530695, 'batch_size': 1615, 'optimizer': 'Adam'}.
2026-06-17 12:41:16,305 - optuna.study.study - INFO - Trial 131 finished with values: [0.0029281160009079314, 0.000663129973474801, 0.001842498585661349] and parameters: {'n_layers': 4, 'embedding_dim': 32, 'lr': 0.00035885552475151193, 'lambda_val': 1.1791971258066213e-06, 'batch_size': 4010, 'optimizer': 'Adam'}.
2026-06-17 12:41:40,779 - experiment_functions - INFO - Early stopping at epoch 500. Best Metrics: (0.0004865280641564802, 9.946949602122017e-05, 0.00023008765463463632)
2026-06-17 12:41:41,139 - optuna.study.study - INFO - Trial 132 finished with values: [0.0004865280641564802, 9.946949602122017e-05, 0.00023008765463463632] and parameters: {'n_layers': 4, 'embedding_dim': 128, 'lr': 0.00034888261134883653, 'lambda_val': 0.00022209055242806205, 'batch_size': 3141, 'optimizer': 'SGD'}.
2026-06-17 12:44:37,551 - optuna.study.study - INFO - Trial 133 finished with values: [0.002923790419537859, 0.0006283945939118353, 0.0017356337579174112] and parameters: {'n_layers': 1, 'embedding_dim': 256, 'lr': 0.0005773267382294165, 'lambda_val': 9.680731525938664e-06, 'batch_size': 1343, 'optimizer': 'Adam'}.
2026-06-17 12:47:43,655 - optuna.study.study - INFO - Trial 134 finished with values: [0.0030704609345255213, 0.0007389162561576354, 0.0018781604883986083] and parameters: {'n_layers': 2, 'embedding_dim': 256, 'lr': 0.00032551897153632015, 'lambda_val': 4.480990319634202e-06, 'batch_size': 1677, 'optimizer': 'RMSprop'}.
2026-06-17 12:49:12,455 - experiment_functions - INFO - Early stopping at epoch 2000. Best Metrics: (0.0024794884308252494, 0.0005636604774535809, 0.0014989836241739909)
2026-06-17 12:49:12,530 - optuna.study.study - INFO - Trial 135 finished with values: [0.0024794884308252494, 0.0005636604774535809, 0.0014989836241739909] and parameters: {'n_layers': 1, 'embedding_dim': 256, 'lr': 0.00032551897153632015, 'lambda_val': 0.0015370356378349003, 'batch_size': 3274, 'optimizer': 'RMSprop'}.
2026-06-17 12:52:44,149 - optuna.study.study - INFO - Trial 136 finished with values: [0.0035243171512679334, 0.0009173297966401414, 0.002152009327314717] and parameters: {'n_layers': 4, 'embedding_dim': 256, 'lr': 0.0005841453281578621, 'lambda_val': 1.0310836199436669e-05, 'batch_size': 1467, 'optimizer': 'Adam'}.
2026-06-17 12:53:33,405 - experiment_functions - INFO - Early stopping at epoch 900. Best Metrics: (0.001592166730600964, 0.0004894530756599723, 0.0010753296332610394)
2026-06-17 12:53:33,485 - optuna.study.study - INFO - Trial 137 finished with values: [0.001592166730600964, 0.0004894530756599723, 0.0010753296332610394] and parameters: {'n_layers': 4, 'embedding_dim': 256, 'lr': 0.013498745374989938, 'lambda_val': 0.06383370776268556, 'batch_size': 1507, 'optimizer': 'RMSprop'}.
2026-06-17 12:55:22,228 - experiment_functions - INFO - Early stopping at epoch 2600. Best Metrics: (0.003288754703747948, 0.0008020714917266641, 0.002122936637917623)
2026-06-17 12:55:22,308 - optuna.study.study - INFO - Trial 138 finished with values: [0.003288754703747948, 0.0008020714917266641, 0.002122936637917623] and parameters: {'n_layers': 4, 'embedding_dim': 64, 'lr': 0.0005773267382294165, 'lambda_val': 0.003623250527584803, 'batch_size': 934, 'optimizer': 'Adam'}.
2026-06-17 12:56:47,344 - experiment_functions - INFO - Early stopping at epoch 1850. Best Metrics: (0.003612826102499932, 0.0009220664393078187, 0.002190790454743584)
2026-06-17 12:56:47,418 - optuna.study.study - INFO - Trial 139 finished with values: [0.003612826102499932, 0.0009220664393078187, 0.002190790454743584] and parameters: {'n_layers': 4, 'embedding_dim': 128, 'lr': 0.0005841453281578621, 'lambda_val': 1.170012968533328e-05, 'batch_size': 3853, 'optimizer': 'RMSprop'}.
2026-06-17 12:57:15,752 - experiment_functions - INFO - Early stopping at epoch 550. Best Metrics: (0.0028545881658742925, 0.0007262852090438299, 0.0018085773204536532)
2026-06-17 12:57:15,836 - optuna.study.study - INFO - Trial 140 finished with values: [0.0028545881658742925, 0.0007262852090438299, 0.0018085773204536532] and parameters: {'n_layers': 2, 'embedding_dim': 256, 'lr': 0.013498745374989938, 'lambda_val': 1.9289997599017184e-06, 'batch_size': 1423, 'optimizer': 'Adam'}.
2026-06-17 12:59:36,419 - experiment_functions - INFO - Early stopping at epoch 2650. Best Metrics: (0.0032368123666250493, 0.0008731211317418215, 0.0020157805253759493)
2026-06-17 12:59:36,502 - optuna.study.study - INFO - Trial 141 finished with values: [0.0032368123666250493, 0.0008731211317418215, 0.0020157805253759493] and parameters: {'n_layers': 4, 'embedding_dim': 256, 'lr': 0.0005841453281578621, 'lambda_val': 0.00027668479073292746, 'batch_size': 815, 'optimizer': 'Adam'}.
2026-06-17 13:00:02,000 - experiment_functions - INFO - Early stopping at epoch 600. Best Metrics: (0.003214405560980395, 0.0006726032588101554, 0.0018810470918846965)
2026-06-17 13:00:02,094 - optuna.study.study - INFO - Trial 142 finished with values: [0.003214405560980395, 0.0006726032588101554, 0.0018810470918846965] and parameters: {'n_layers': 1, 'embedding_dim': 32, 'lr': 0.005427188960178344, 'lambda_val': 7.067730208761557e-06, 'batch_size': 2754, 'optimizer': 'RMSprop'}.
2026-06-17 13:01:28,504 - experiment_functions - INFO - Early stopping at epoch 1950. Best Metrics: (0.003512144176450238, 0.0008952254641909815, 0.002151153444553075)
2026-06-17 13:01:28,607 - optuna.study.study - INFO - Trial 143 finished with values: [0.003512144176450238, 0.0008952254641909815, 0.002151153444553075] and parameters: {'n_layers': 3, 'embedding_dim': 128, 'lr': 0.0008946860620636538, 'lambda_val': 6.36485192314748e-05, 'batch_size': 2022, 'optimizer': 'RMSprop'}.
2026-06-17 13:02:12,887 - experiment_functions - INFO - Early stopping at epoch 800. Best Metrics: (0.003140661363342986, 0.0007831249210559555, 0.001991549351558195)
2026-06-17 13:02:13,988 - optuna.study.study - INFO - Trial 144 finished with values: [0.003140661363342986, 0.0007831249210559555, 0.001991549351558195] and parameters: {'n_layers': 4, 'embedding_dim': 256, 'lr': 0.0013364645200376287, 'lambda_val': 3.399802510238604e-06, 'batch_size': 3100, 'optimizer': 'Adam'}.
2026-06-17 13:02:43,150 - experiment_functions - INFO - Early stopping at epoch 650. Best Metrics: (0.0029273516896252236, 0.0006757610205886069, 0.0017892282601315239)
2026-06-17 13:02:43,246 - optuna.study.study - INFO - Trial 145 finished with values: [0.0029273516896252236, 0.0006757610205886069, 0.0017892282601315239] and parameters: {'n_layers': 2, 'embedding_dim': 96, 'lr': 0.013498745374989938, 'lambda_val': 1.9289997599017184e-06, 'batch_size': 2151, 'optimizer': 'Adam'}.
2026-06-17 13:04:46,100 - experiment_functions - INFO - Early stopping at epoch 3050. Best Metrics: (0.003228899198424624, 0.0006552355690286725, 0.0018232294743175973)
2026-06-17 13:04:46,174 - optuna.study.study - INFO - Trial 146 finished with values: [0.003228899198424624, 0.0006552355690286725, 0.0018232294743175973] and parameters: {'n_layers': 1, 'embedding_dim': 96, 'lr': 0.00035885552475151193, 'lambda_val': 6.36485192314748e-05, 'batch_size': 4010, 'optimizer': 'RMSprop'}.
2026-06-17 13:05:12,562 - experiment_functions - INFO - Early stopping at epoch 550. Best Metrics: (0.003027807382523998, 0.0007452317797145383, 0.0018984621235214297)
2026-06-17 13:05:12,634 - optuna.study.study - INFO - Trial 147 finished with values: [0.003027807382523998, 0.0007452317797145383, 0.0018984621235214297] and parameters: {'n_layers': 4, 'embedding_dim': 96, 'lr': 0.009567567424439887, 'lambda_val': 3.399802510238604e-06, 'batch_size': 3141, 'optimizer': 'Adam'}.
2026-06-17 13:07:51,859 - optuna.study.study - INFO - Trial 148 finished with values: [0.0035245091532718456, 0.000702601995705444, 0.0021410779275035804] and parameters: {'n_layers': 1, 'embedding_dim': 96, 'lr': 0.0005841453281578621, 'lambda_val': 1.0310836199436669e-05, 'batch_size': 1677, 'optimizer': 'RMSprop'}.
2026-06-17 13:08:16,110 - experiment_functions - INFO - Early stopping at epoch 550. Best Metrics: (0.0025941697196670134, 0.0005873436907919668, 0.0016254158763465833)
2026-06-17 13:08:16,196 - optuna.study.study - INFO - Trial 149 finished with values: [0.0025941697196670134, 0.0005873436907919668, 0.0016254158763465833] and parameters: {'n_layers': 2, 'embedding_dim': 64, 'lr': 0.020434132617523096, 'lambda_val': 0.00012072062045747035, 'batch_size': 1924, 'optimizer': 'Adam'}.
2026-06-17 13:10:50,374 - experiment_functions - INFO - Early stopping at epoch 3550. Best Metrics: (0.003928486963435902, 0.0009568018188707845, 0.002384782217077317)
