2026-06-22 07:15:31,984 - optuna.study.study - INFO - Trial 198 finished with values: [0.0008518405996195951, 0.00018157130226095747, 0.00045561061808424726] and parameters: {'n_layers': 1, 'embedding_dim': 128, 'lr': 9.488295560625263e-05, 'lambda_val': 0.00013245499426730662, 'batch_size': 2524, 'optimizer': 'RMSprop'}.
2026-06-22 07:17:33,311 - experiment_functions - INFO - Early stopping at epoch 2700. Best Metrics: (0.028676203975349233, 0.006225527346217002, 0.016160754256256835)
2026-06-22 07:17:33,408 - optuna.study.study - INFO - Trial 199 finished with values: [0.028676203975349233, 0.006225527346217002, 0.016160754256256835] and parameters: {'n_layers': 2, 'embedding_dim': 64, 'lr': 0.0004249111472269399, 'lambda_val': 9.580805901998717e-05, 'batch_size': 2362, 'optimizer': 'Adam'}.
2026-06-22 07:18:16,295 - experiment_functions - INFO - Early stopping at epoch 900. Best Metrics: (0.010127156586586169, 0.0020541240368826576, 0.005718778438225429)
2026-06-22 07:18:16,388 - optuna.study.study - INFO - Trial 200 finished with values: [0.010127156586586169, 0.0020541240368826576, 0.005718778438225429] and parameters: {'n_layers': 2, 'embedding_dim': 96, 'lr': 0.005023945861716535, 'lambda_val': 0.0020388334757127998, 'batch_size': 1769, 'optimizer': 'Adam'}.
2026-06-22 07:19:59,562 - experiment_functions - INFO - Early stopping at epoch 2300. Best Metrics: (0.028880871537690814, 0.006276051534672224, 0.016502605876720377)
2026-06-22 07:19:59,634 - optuna.study.study - INFO - Trial 201 finished with values: [0.028880871537690814, 0.006276051534672224, 0.016502605876720377] and parameters: {'n_layers': 2, 'embedding_dim': 64, 'lr': 0.0004249111472269399, 'lambda_val': 6.337283063003886e-05, 'batch_size': 2524, 'optimizer': 'Adam'}.
2026-06-22 07:20:53,598 - experiment_functions - INFO - Early stopping at epoch 1150. Best Metrics: (0.016654399484291926, 0.003367752936718454, 0.008890874152407639)
2026-06-22 07:20:53,675 - optuna.study.study - INFO - Trial 202 finished with values: [0.016654399484291926, 0.003367752936718454, 0.008890874152407639] and parameters: {'n_layers': 2, 'embedding_dim': 96, 'lr': 0.0017809598622910787, 'lambda_val': 9.511530199054135e-05, 'batch_size': 3314, 'optimizer': 'RMSprop'}.
2026-06-22 07:21:47,536 - experiment_functions - INFO - Early stopping at epoch 1100. Best Metrics: (0.016450048180011848, 0.003746684350132626, 0.009255747755072666)
2026-06-22 07:21:47,615 - optuna.study.study - INFO - Trial 203 finished with values: [0.016450048180011848, 0.003746684350132626, 0.009255747755072666] and parameters: {'n_layers': 2, 'embedding_dim': 128, 'lr': 0.0004249111472269399, 'lambda_val': 0.02238534075374537, 'batch_size': 2362, 'optimizer': 'Adam'}.
2026-06-22 07:24:37,696 - optuna.study.study - INFO - Trial 204 finished with values: [0.025560863805158263, 0.005549766325628394, 0.01437749045592737] and parameters: {'n_layers': 2, 'embedding_dim': 32, 'lr': 0.00025949794187037214, 'lambda_val': 0.000442118077500333, 'batch_size': 4064, 'optimizer': 'Adam'}.
2026-06-22 07:25:04,378 - experiment_functions - INFO - Early stopping at epoch 550. Best Metrics: (0.00045339600533371574, 0.00010894278135657447, 0.0002701892737065833)
2026-06-22 07:25:04,482 - optuna.study.study - INFO - Trial 205 finished with values: [0.00045339600533371574, 0.00010894278135657447, 0.0002701892737065833] and parameters: {'n_layers': 2, 'embedding_dim': 96, 'lr': 1.954586182519177e-05, 'lambda_val': 5.272411928419156e-05, 'batch_size': 3046, 'optimizer': 'Adam'}.
2026-06-22 07:25:41,640 - experiment_functions - INFO - Early stopping at epoch 800. Best Metrics: (0.02787073701298148, 0.005905014525704181, 0.015936748904115318)
2026-06-22 07:25:41,711 - optuna.study.study - INFO - Trial 206 finished with values: [0.02787073701298148, 0.005905014525704181, 0.015936748904115318] and parameters: {'n_layers': 2, 'embedding_dim': 64, 'lr': 0.0009385206853318974, 'lambda_val': 5.867428769760123e-05, 'batch_size': 3046, 'optimizer': 'Adam'}.
2026-06-22 07:26:12,885 - experiment_functions - INFO - Early stopping at epoch 650. Best Metrics: (0.02497901108987512, 0.005031893393962359, 0.013465663841668325)
2026-06-22 07:26:12,974 - optuna.study.study - INFO - Trial 207 finished with values: [0.02497901108987512, 0.005031893393962359, 0.013465663841668325] and parameters: {'n_layers': 1, 'embedding_dim': 128, 'lr': 0.0051758360404209345, 'lambda_val': 9.580805901998717e-05, 'batch_size': 2006, 'optimizer': 'Adam'}.
2026-06-22 07:29:02,222 - optuna.study.study - INFO - Trial 208 finished with values: [0.003573718529554614, 0.0008241758241758242, 0.002226903790247997] and parameters: {'n_layers': 2, 'embedding_dim': 64, 'lr': 9.562974335629637e-05, 'lambda_val': 0.000442118077500333, 'batch_size': 2829, 'optimizer': 'RMSprop'}.
2026-06-22 07:29:37,446 - experiment_functions - INFO - Early stopping at epoch 750. Best Metrics: (0.028611006736756792, 0.006029746115953013, 0.01597713681081312)
2026-06-22 07:29:37,783 - optuna.study.study - INFO - Trial 209 finished with values: [0.028611006736756792, 0.006029746115953013, 0.01597713681081312] and parameters: {'n_layers': 2, 'embedding_dim': 64, 'lr': 0.001367505758136406, 'lambda_val': 4.017786575271443e-05, 'batch_size': 1914, 'optimizer': 'Adam'}.
2026-06-22 07:32:27,573 - optuna.study.study - INFO - Trial 210 finished with values: [0.032417097789751756, 0.006977074649488442, 0.018924223546143416] and parameters: {'n_layers': 1, 'embedding_dim': 64, 'lr': 0.0004249111472269399, 'lambda_val': 8.803132640891692e-06, 'batch_size': 2113, 'optimizer': 'RMSprop'}.
2026-06-22 07:32:50,218 - experiment_functions - INFO - Early stopping at epoch 500. Best Metrics: (0.0005708682671634506, 0.0001310471138057345, 0.0003194281607140531)
2026-06-22 07:32:50,280 - optuna.study.study - INFO - Trial 211 finished with values: [0.0005708682671634506, 0.0001310471138057345, 0.0003194281607140531] and parameters: {'n_layers': 3, 'embedding_dim': 32, 'lr': 0.00037811925768249915, 'lambda_val': 5.867428769760123e-05, 'batch_size': 3046, 'optimizer': 'SGD'}.
2026-06-22 07:35:54,901 - optuna.study.study - INFO - Trial 212 finished with values: [0.003232989642366264, 0.0007436528988253126, 0.0019033361345698729] and parameters: {'n_layers': 2, 'embedding_dim': 128, 'lr': 8.985183999750106e-05, 'lambda_val': 4.188435976175333e-05, 'batch_size': 2524, 'optimizer': 'RMSprop'}.
2026-06-22 07:38:46,511 - optuna.study.study - INFO - Trial 213 finished with values: [0.012698173880477146, 0.0028404067197170648, 0.0075805138613250144] and parameters: {'n_layers': 4, 'embedding_dim': 32, 'lr': 0.00011824068973114783, 'lambda_val': 9.580805901998717e-05, 'batch_size': 2113, 'optimizer': 'Adam'}.
2026-06-22 07:40:17,005 - experiment_functions - INFO - Early stopping at epoch 2050. Best Metrics: (0.02580570219832533, 0.005447139067828723, 0.01432390791698487)
2026-06-22 07:40:17,073 - optuna.study.study - INFO - Trial 214 finished with values: [0.02580570219832533, 0.005447139067828723, 0.01432390791698487] and parameters: {'n_layers': 1, 'embedding_dim': 96, 'lr': 0.0015973413467103624, 'lambda_val': 2.5805202056832215e-06, 'batch_size': 1295, 'optimizer': 'RMSprop'}.
2026-06-22 07:43:06,879 - optuna.study.study - INFO - Trial 215 finished with values: [0.0006040264707334674, 0.00015473032714412026, 0.0003674116093717793] and parameters: {'n_layers': 2, 'embedding_dim': 64, 'lr': 6.42537133497305e-05, 'lambda_val': 0.000442118077500333, 'batch_size': 3046, 'optimizer': 'Adam'}.
2026-06-22 07:46:07,030 - optuna.study.study - INFO - Trial 216 finished with values: [0.00903018231338302, 0.0022893772893772895, 0.005313418357719263] and parameters: {'n_layers': 2, 'embedding_dim': 96, 'lr': 0.05249323241715849, 'lambda_val': 0.000442118077500333, 'batch_size': 3046, 'optimizer': 'RMSprop'}.
2026-06-22 07:46:40,947 - experiment_functions - INFO - Early stopping at epoch 750. Best Metrics: (0.012904795709485682, 0.002906719717064545, 0.0073867988420676)
2026-06-22 07:46:41,213 - optuna.study.study - INFO - Trial 217 finished with values: [0.012904795709485682, 0.002906719717064545, 0.0073867988420676] and parameters: {'n_layers': 1, 'embedding_dim': 96, 'lr': 0.015749265439287605, 'lambda_val': 9.580805901998717e-05, 'batch_size': 2524, 'optimizer': 'RMSprop'}.
2026-06-22 07:47:23,243 - experiment_functions - INFO - Early stopping at epoch 850. Best Metrics: (0.01905906145937382, 0.00394088669950739, 0.010081245916198071)
2026-06-22 07:47:23,313 - optuna.study.study - INFO - Trial 218 finished with values: [0.01905906145937382, 0.00394088669950739, 0.010081245916198071] and parameters: {'n_layers': 2, 'embedding_dim': 128, 'lr': 0.001367505758136406, 'lambda_val': 8.803132640891692e-06, 'batch_size': 809, 'optimizer': 'Adam'}.
2026-06-22 07:47:49,942 - experiment_functions - INFO - Early stopping at epoch 600. Best Metrics: (0.010742586536832398, 0.002428318807629153, 0.005652316813916049)
2026-06-22 07:47:50,016 - optuna.study.study - INFO - Trial 219 finished with values: [0.010742586536832398, 0.002428318807629153, 0.005652316813916049] and parameters: {'n_layers': 2, 'embedding_dim': 32, 'lr': 0.003943344366916346, 'lambda_val': 0.02462525626748653, 'batch_size': 3224, 'optimizer': 'Adam'}.
2026-06-22 07:48:15,255 - experiment_functions - INFO - Early stopping at epoch 550. Best Metrics: (0.016127664599143395, 0.003604585070102311, 0.009631628275828702)
2026-06-22 07:48:15,415 - optuna.study.study - INFO - Trial 220 finished with values: [0.016127664599143395, 0.003604585070102311, 0.009631628275828702] and parameters: {'n_layers': 1, 'embedding_dim': 64, 'lr': 0.011367993162487388, 'lambda_val': 5.867428769760123e-05, 'batch_size': 930, 'optimizer': 'RMSprop'}.
2026-06-22 07:49:15,950 - experiment_functions - INFO - Early stopping at epoch 950. Best Metrics: (0.02224732339667212, 0.004842427687255274, 0.012501755845590781)
2026-06-22 07:49:16,023 - optuna.study.study - INFO - Trial 221 finished with values: [0.02224732339667212, 0.004842427687255274, 0.012501755845590781] and parameters: {'n_layers': 3, 'embedding_dim': 256, 'lr': 0.0004249111472269399, 'lambda_val': 0.000442118077500333, 'batch_size': 2113, 'optimizer': 'RMSprop'}.
2026-06-22 07:50:49,084 - experiment_functions - INFO - Early stopping at epoch 2000. Best Metrics: (0.030898183564407582, 0.006726032588101553, 0.017481246729562392)
2026-06-22 07:50:49,166 - optuna.study.study - INFO - Trial 222 finished with values: [0.030898183564407582, 0.006726032588101553, 0.017481246729562392] and parameters: {'n_layers': 2, 'embedding_dim': 96, 'lr': 0.0004249111472269399, 'lambda_val': 8.803132640891692e-06, 'batch_size': 930, 'optimizer': 'RMSprop'}.
2026-06-22 07:52:12,653 - experiment_functions - INFO - Early stopping at epoch 1850. Best Metrics: (0.030116991659284244, 0.006598143236074272, 0.017322972171090256)
2026-06-22 07:52:12,730 - optuna.study.study - INFO - Trial 223 finished with values: [0.030116991659284244, 0.006598143236074272, 0.017322972171090256] and parameters: {'n_layers': 1, 'embedding_dim': 128, 'lr': 0.0004249111472269399, 'lambda_val': 0.004689022509389867, 'batch_size': 2524, 'optimizer': 'RMSprop'}.
2026-06-22 07:55:04,083 - optuna.study.study - INFO - Trial 224 finished with values: [0.009972866316050127, 0.00226727295692813, 0.005862046925364196] and parameters: {'n_layers': 2, 'embedding_dim': 64, 'lr': 0.00011710757927899564, 'lambda_val': 6.555912014113551e-06, 'batch_size': 3633, 'optimizer': 'RMSprop'}.
2026-06-22 07:58:01,348 - optuna.study.study - INFO - Trial 225 finished with values: [0.0007000794080192927, 0.00014209928003031455, 0.00036537875645219165] and parameters: {'n_layers': 2, 'embedding_dim': 96, 'lr': 4.568282988257527e-05, 'lambda_val': 2.887932809602638e-05, 'batch_size': 2524, 'optimizer': 'Adam'}.
2026-06-22 08:00:44,322 - experiment_functions - INFO - Early stopping at epoch 3850. Best Metrics: (0.028755479784634278, 0.006205001894657067, 0.01646186810231605)
2026-06-22 08:00:44,404 - optuna.study.study - INFO - Trial 226 finished with values: [0.028755479784634278, 0.006205001894657067, 0.01646186810231605] and parameters: {'n_layers': 2, 'embedding_dim': 32, 'lr': 0.0004249111472269399, 'lambda_val': 0.0001132240545098155, 'batch_size': 2829, 'optimizer': 'RMSprop'}.
2026-06-22 08:01:53,125 - experiment_functions - INFO - Early stopping at epoch 1200. Best Metrics: (0.02742852964225647, 0.006020272830617658, 0.015656464464383305)
2026-06-22 08:01:53,206 - optuna.study.study - INFO - Trial 227 finished with values: [0.02742852964225647, 0.006020272830617658, 0.015656464464383305] and parameters: {'n_layers': 2, 'embedding_dim': 256, 'lr': 0.00037811925768249915, 'lambda_val': 0.0006249538563380107, 'batch_size': 1638, 'optimizer': 'RMSprop'}.
2026-06-22 08:04:08,637 - experiment_functions - INFO - Early stopping at epoch 3050. Best Metrics: (0.0285667920420567, 0.006154477706201845, 0.01642073066014221)
2026-06-22 08:04:08,942 - optuna.study.study - INFO - Trial 228 finished with values: [0.0285667920420567, 0.006154477706201845, 0.01642073066014221] and parameters: {'n_layers': 2, 'embedding_dim': 64, 'lr': 0.0004249111472269399, 'lambda_val': 0.000442118077500333, 'batch_size': 3046, 'optimizer': 'Adam'}.
2026-06-22 08:06:46,513 - experiment_functions - INFO - Early stopping at epoch 3600. Best Metrics: (0.03352190150232056, 0.007242326638878364, 0.019412694258655525)
2026-06-22 08:06:46,591 - optuna.study.study - INFO - Trial 229 finished with values: [0.03352190150232056, 0.007242326638878364, 0.019412694258655525] and parameters: {'n_layers': 1, 'embedding_dim': 96, 'lr': 0.0004249111472269399, 'lambda_val': 0.000442118077500333, 'batch_size': 3010, 'optimizer': 'RMSprop'}.
2026-06-22 08:10:52,952 - optuna.study.study - INFO - Trial 230 finished with values: [0.01699203194238635, 0.0037498421119110774, 0.009800158000128588] and parameters: {'n_layers': 3, 'embedding_dim': 256, 'lr': 0.00011710757927899564, 'lambda_val': 0.0005857689247732319, 'batch_size': 930, 'optimizer': 'RMSprop'}.
2026-06-22 08:11:27,941 - experiment_functions - INFO - Early stopping at epoch 700. Best Metrics: (0.020937075477305896, 0.004269293924466338, 0.011668609620486334)
2026-06-22 08:11:28,241 - optuna.study.study - INFO - Trial 231 finished with values: [0.020937075477305896, 0.004269293924466338, 0.011668609620486334] and parameters: {'n_layers': 4, 'embedding_dim': 64, 'lr': 0.0012653624571519182, 'lambda_val': 5.867428769760123e-05, 'batch_size': 2362, 'optimizer': 'Adam'}.
2026-06-22 08:11:55,709 - experiment_functions - INFO - Early stopping at epoch 600. Best Metrics: (0.02477833068883221, 0.005155046103321966, 0.014037288219234261)
2026-06-22 08:11:55,762 - optuna.study.study - INFO - Trial 232 finished with values: [0.02477833068883221, 0.005155046103321966, 0.014037288219234261] and parameters: {'n_layers': 2, 'embedding_dim': 32, 'lr': 0.0038079716278558275, 'lambda_val': 8.803132640891692e-06, 'batch_size': 4064, 'optimizer': 'Adam'}.
2026-06-22 08:14:55,510 - optuna.study.study - INFO - Trial 233 finished with values: [0.035146474021217636, 0.007404951370468612, 0.020293619366043552] and parameters: {'n_layers': 1, 'embedding_dim': 128, 'lr': 0.0005396605078172515, 'lambda_val': 2.887932809602638e-05, 'batch_size': 3314, 'optimizer': 'Adam'}.
2026-06-22 08:16:27,570 - experiment_functions - INFO - Early stopping at epoch 1650. Best Metrics: (0.016397800114882503, 0.0033203865100416828, 0.008988411016939457)
2026-06-22 08:16:27,646 - optuna.study.study - INFO - Trial 234 finished with values: [0.016397800114882503, 0.0033203865100416828, 0.008988411016939457] and parameters: {'n_layers': 2, 'embedding_dim': 256, 'lr': 0.0012653624571519182, 'lambda_val': 5.867428769760123e-05, 'batch_size': 2362, 'optimizer': 'RMSprop'}.
2026-06-22 08:16:52,855 - experiment_functions - INFO - Early stopping at epoch 500. Best Metrics: (0.0005823115200376077, 0.0001373626373626374, 0.0003424288774230608)
2026-06-22 08:16:53,062 - optuna.study.study - INFO - Trial 235 finished with values: [0.0005823115200376077, 0.0001373626373626374, 0.0003424288774230608] and parameters: {'n_layers': 2, 'embedding_dim': 128, 'lr': 1.846040635489184e-05, 'lambda_val': 4.017786575271443e-05, 'batch_size': 1881, 'optimizer': 'Adam'}.
2026-06-22 08:17:30,804 - experiment_functions - INFO - Early stopping at epoch 700. Best Metrics: (0.02191674301701584, 0.004692434002778831, 0.012655672316136391)
2026-06-22 08:17:31,180 - optuna.study.study - INFO - Trial 236 finished with values: [0.02191674301701584, 0.004692434002778831, 0.012655672316136391] and parameters: {'n_layers': 3, 'embedding_dim': 128, 'lr': 0.0012653624571519182, 'lambda_val': 1.3167003761918277e-05, 'batch_size': 2362, 'optimizer': 'Adam'}.
2026-06-22 08:18:03,933 - experiment_functions - INFO - Early stopping at epoch 700. Best Metrics: (0.026942411808539506, 0.005706075533661741, 0.015190066026725855)
2026-06-22 08:18:04,074 - optuna.study.study - INFO - Trial 237 finished with values: [0.026942411808539506, 0.005706075533661741, 0.015190066026725855] and parameters: {'n_layers': 1, 'embedding_dim': 96, 'lr': 0.0015973413467103624, 'lambda_val': 0.000442118077500333, 'batch_size': 2829, 'optimizer': 'RMSprop'}.
2026-06-22 08:20:04,383 - experiment_functions - INFO - Early stopping at epoch 2500. Best Metrics: (0.029563073967385747, 0.006463938360490085, 0.017337280165258043)
2026-06-22 08:20:04,463 - optuna.study.study - INFO - Trial 238 finished with values: [0.029563073967385747, 0.006463938360490085, 0.017337280165258043] and parameters: {'n_layers': 2, 'embedding_dim': 128, 'lr': 0.00037811925768249915, 'lambda_val': 8.803132640891692e-06, 'batch_size': 930, 'optimizer': 'RMSprop'}.
2026-06-22 08:23:39,998 - optuna.study.study - INFO - Trial 239 finished with values: [0.0047414658799861545, 0.0010057471264367816, 0.0026669199045252327] and parameters: {'n_layers': 2, 'embedding_dim': 256, 'lr': 0.00011710757927899564, 'lambda_val': 0.0005857689247732319, 'batch_size': 930, 'optimizer': 'RMSprop'}.
2026-06-22 08:26:51,424 - optuna.study.study - INFO - Trial 240 finished with values: [0.027327260629194505, 0.005862384741695087, 0.015467323394806276] and parameters: {'n_layers': 2, 'embedding_dim': 128, 'lr': 0.0004249111472269399, 'lambda_val': 9.580805901998717e-05, 'batch_size': 2496, 'optimizer': 'Adam'}.
2026-06-22 08:28:22,851 - experiment_functions - INFO - Early stopping at epoch 1600. Best Metrics: (0.028497360899396612, 0.006097637994189718, 0.016125675939111912)
2026-06-22 08:28:22,938 - optuna.study.study - INFO - Trial 241 finished with values: [0.028497360899396612, 0.006097637994189718, 0.016125675939111912] and parameters: {'n_layers': 2, 'embedding_dim': 256, 'lr': 0.0004249111472269399, 'lambda_val': 0.000442118077500333, 'batch_size': 2362, 'optimizer': 'Adam'}.
2026-06-22 08:31:17,215 - optuna.study.study - INFO - Trial 242 finished with values: [0.033832088871072225, 0.007338638373121132, 0.019436600049304746] and parameters: {'n_layers': 1, 'embedding_dim': 96, 'lr': 0.0004249111472269399, 'lambda_val': 0.000442118077500333, 'batch_size': 2113, 'optimizer': 'Adam'}.
2026-06-22 08:34:06,688 - optuna.study.study - INFO - Trial 243 finished with values: [0.027749145876850026, 0.006067639257294431, 0.01611745868533135] and parameters: {'n_layers': 1, 'embedding_dim': 64, 'lr': 0.0004249111472269399, 'lambda_val': 4.45671829457462e-06, 'batch_size': 1423, 'optimizer': 'Adam'}.
2026-06-22 08:35:48,886 - experiment_functions - INFO - Early stopping at epoch 2200. Best Metrics: (0.02888799473498974, 0.006358153340911962, 0.01662244026929378)
2026-06-22 08:35:48,962 - optuna.study.study - INFO - Trial 244 finished with values: [0.02888799473498974, 0.006358153340911962, 0.01662244026929378] and parameters: {'n_layers': 2, 'embedding_dim': 96, 'lr': 0.00037811925768249915, 'lambda_val': 9.580805901998717e-05, 'batch_size': 930, 'optimizer': 'RMSprop'}.
2026-06-22 08:36:23,073 - experiment_functions - INFO - Early stopping at epoch 750. Best Metrics: (0.029686216567990333, 0.006347101174687382, 0.016980874851700425)
2026-06-22 08:36:23,586 - optuna.study.study - INFO - Trial 245 finished with values: [0.029686216567990333, 0.006347101174687382, 0.016980874851700425] and parameters: {'n_layers': 1, 'embedding_dim': 64, 'lr': 0.0012653624571519182, 'lambda_val': 5.867428769760123e-05, 'batch_size': 2362, 'optimizer': 'RMSprop'}.
2026-06-22 08:38:53,289 - experiment_functions - INFO - Early stopping at epoch 3400. Best Metrics: (0.02189977582644996, 0.004815586712138436, 0.012299817396319917)
2026-06-22 08:38:53,378 - optuna.study.study - INFO - Trial 246 finished with values: [0.02189977582644996, 0.004815586712138436, 0.012299817396319917] and parameters: {'n_layers': 4, 'embedding_dim': 32, 'lr': 0.0005396605078172515, 'lambda_val': 9.580805901998717e-05, 'batch_size': 2006, 'optimizer': 'Adam'}.
2026-06-22 08:42:34,926 - optuna.study.study - INFO - Trial 247 finished with values: [0.017233838617907206, 0.0037087912087912095, 0.009703735671822686] and parameters: {'n_layers': 2, 'embedding_dim': 256, 'lr': 0.0041498798274010405, 'lambda_val': 5.677823602450589e-05, 'batch_size': 2362, 'optimizer': 'RMSprop'}.
2026-06-22 08:43:02,284 - experiment_functions - INFO - Early stopping at epoch 550. Best Metrics: (0.022723343248030846, 0.004714538335227991, 0.01238749938579736)
2026-06-22 08:43:02,370 - optuna.study.study - INFO - Trial 248 finished with values: [0.022723343248030846, 0.004714538335227991, 0.01238749938579736] and parameters: {'n_layers': 2, 'embedding_dim': 96, 'lr': 0.0038079716278558275, 'lambda_val': 0.002231592940717143, 'batch_size': 3711, 'optimizer': 'Adam'}.
2026-06-22 08:43:51,544 - experiment_functions - INFO - Early stopping at epoch 1050. Best Metrics: (0.013524655716362223, 0.0028704054566123533, 0.007646032598321057)
