2026-06-20 11:32:04,784 - optuna.study.study - INFO - Trial 76 finished with values: [0.0027580990451671447, 0.0006647088543640268, 0.0016149340303994262] and parameters: {'n_layers': 2, 'embedding_dim': 96, 'lr': 0.03277585555961363, 'lambda_val': 0.09128514885217996, 'batch_size': 3472, 'optimizer': 'RMSprop'}.
2026-06-20 11:32:30,630 - experiment_functions - INFO - Early stopping at epoch 500. Best Metrics: (0.0005170179030617562, 0.00011367942402425162, 0.00030433564319477845)
2026-06-20 11:32:30,730 - optuna.study.study - INFO - Trial 77 finished with values: [0.0005170179030617562, 0.00011367942402425162, 0.00030433564319477845] and parameters: {'n_layers': 3, 'embedding_dim': 128, 'lr': 4.994573122339047e-05, 'lambda_val': 0.003328284305100738, 'batch_size': 2830, 'optimizer': 'RMSprop'}.
2026-06-20 11:33:03,239 - experiment_functions - INFO - Early stopping at epoch 650. Best Metrics: (0.011910938400700085, 0.0027077807250221048, 0.006919524458717183)
2026-06-20 11:33:03,324 - optuna.study.study - INFO - Trial 78 finished with values: [0.011910938400700085, 0.0027077807250221048, 0.006919524458717183] and parameters: {'n_layers': 1, 'embedding_dim': 256, 'lr': 0.011820223547800823, 'lambda_val': 3.0549894793457165e-06, 'batch_size': 1320, 'optimizer': 'RMSprop'}.
2026-06-20 11:33:31,493 - experiment_functions - INFO - Early stopping at epoch 550. Best Metrics: (0.005344758599368357, 0.001255210306934445, 0.003055268639894293)
2026-06-20 11:33:31,568 - optuna.study.study - INFO - Trial 79 finished with values: [0.005344758599368357, 0.001255210306934445, 0.003055268639894293] and parameters: {'n_layers': 4, 'embedding_dim': 96, 'lr': 0.005629866904301548, 'lambda_val': 0.011822413068431218, 'batch_size': 2384, 'optimizer': 'Adam'}.
2026-06-20 11:34:15,035 - experiment_functions - INFO - Early stopping at epoch 900. Best Metrics: (0.02468826806212208, 0.005257673361121637, 0.014007491278846377)
2026-06-20 11:34:15,120 - optuna.study.study - INFO - Trial 80 finished with values: [0.02468826806212208, 0.005257673361121637, 0.014007491278846377] and parameters: {'n_layers': 3, 'embedding_dim': 96, 'lr': 0.0009942243415015796, 'lambda_val': 0.0004435147620568133, 'batch_size': 1643, 'optimizer': 'Adam'}.
2026-06-20 11:35:02,834 - experiment_functions - INFO - Early stopping at epoch 900. Best Metrics: (0.018672833925123825, 0.003920361247947455, 0.010358393907709009)
2026-06-20 11:35:02,918 - optuna.study.study - INFO - Trial 81 finished with values: [0.018672833925123825, 0.003920361247947455, 0.010358393907709009] and parameters: {'n_layers': 4, 'embedding_dim': 128, 'lr': 0.0009798834021344095, 'lambda_val': 5.848323299602918e-05, 'batch_size': 1183, 'optimizer': 'Adam'}.
2026-06-20 11:35:57,058 - experiment_functions - INFO - Early stopping at epoch 1100. Best Metrics: (0.014638520858987035, 0.0030251357837564733, 0.008035287923706782)
2026-06-20 11:35:57,146 - optuna.study.study - INFO - Trial 82 finished with values: [0.014638520858987035, 0.0030251357837564733, 0.008035287923706782] and parameters: {'n_layers': 4, 'embedding_dim': 96, 'lr': 0.0013536067835738764, 'lambda_val': 4.703980448589771e-06, 'batch_size': 1731, 'optimizer': 'RMSprop'}.
2026-06-20 11:37:37,955 - experiment_functions - INFO - Early stopping at epoch 2200. Best Metrics: (0.0045498350821245315, 0.0009789061513199445, 0.002393061588826456)
2026-06-20 11:37:38,065 - optuna.study.study - INFO - Trial 83 finished with values: [0.0045498350821245315, 0.0009789061513199445, 0.002393061588826456] and parameters: {'n_layers': 3, 'embedding_dim': 96, 'lr': 0.02288989879091075, 'lambda_val': 0.012086938131077505, 'batch_size': 3872, 'optimizer': 'Adam'}.
2026-06-20 11:40:15,703 - experiment_functions - INFO - Early stopping at epoch 3700. Best Metrics: (0.022773955827409435, 0.00488821523304282, 0.01313394334643554)
2026-06-20 11:40:15,769 - optuna.study.study - INFO - Trial 84 finished with values: [0.022773955827409435, 0.00488821523304282, 0.01313394334643554] and parameters: {'n_layers': 4, 'embedding_dim': 32, 'lr': 0.00046312276480803076, 'lambda_val': 0.0014313382121311877, 'batch_size': 2012, 'optimizer': 'Adam'}.
2026-06-20 11:42:46,259 - experiment_functions - INFO - Early stopping at epoch 2400. Best Metrics: (0.011263359055133282, 0.0026619931792345587, 0.006144216566799831)
2026-06-20 11:42:46,345 - optuna.study.study - INFO - Trial 85 finished with values: [0.011263359055133282, 0.0026619931792345587, 0.006144216566799831] and parameters: {'n_layers': 4, 'embedding_dim': 256, 'lr': 0.00023729211693529712, 'lambda_val': 0.025733691733705995, 'batch_size': 2012, 'optimizer': 'Adam'}.
2026-06-20 11:43:18,221 - experiment_functions - INFO - Early stopping at epoch 700. Best Metrics: (0.02599139354260208, 0.005578186181634458, 0.0147734332176235)
2026-06-20 11:43:18,382 - optuna.study.study - INFO - Trial 86 finished with values: [0.02599139354260208, 0.005578186181634458, 0.0147734332176235] and parameters: {'n_layers': 1, 'embedding_dim': 64, 'lr': 0.006719843485367568, 'lambda_val': 5.090598517742677e-05, 'batch_size': 1783, 'optimizer': 'Adam'}.
2026-06-20 11:43:43,347 - experiment_functions - INFO - Early stopping at epoch 500. Best Metrics: (0.0003840200652811639, 9.315397246431729e-05, 0.00023197578286731995)
2026-06-20 11:43:43,453 - optuna.study.study - INFO - Trial 87 finished with values: [0.0003840200652811639, 9.315397246431729e-05, 0.00023197578286731995] and parameters: {'n_layers': 2, 'embedding_dim': 128, 'lr': 0.0007879579895882207, 'lambda_val': 0.0722432446993503, 'batch_size': 608, 'optimizer': 'Adam'}.
2026-06-20 11:44:33,262 - experiment_functions - INFO - Early stopping at epoch 1100. Best Metrics: (0.028322666398524706, 0.005911330049261083, 0.016079578878476632)
2026-06-20 11:44:33,330 - optuna.study.study - INFO - Trial 88 finished with values: [0.028322666398524706, 0.005911330049261083, 0.016079578878476632] and parameters: {'n_layers': 2, 'embedding_dim': 64, 'lr': 0.0012029727538128135, 'lambda_val': 0.0004242504250406823, 'batch_size': 2384, 'optimizer': 'Adam'}.
2026-06-20 11:44:58,718 - experiment_functions - INFO - Early stopping at epoch 500. Best Metrics: (0.0005348478539515328, 0.00012157382847038021, 0.00030905340224065295)
2026-06-20 11:44:58,799 - optuna.study.study - INFO - Trial 89 finished with values: [0.0005348478539515328, 0.00012157382847038021, 0.00030905340224065295] and parameters: {'n_layers': 4, 'embedding_dim': 96, 'lr': 5.0144817119368783e-05, 'lambda_val': 3.142259437876897e-06, 'batch_size': 3048, 'optimizer': 'SGD'}.
2026-06-20 11:45:38,210 - experiment_functions - INFO - Early stopping at epoch 850. Best Metrics: (0.022942425501571884, 0.004927687255273462, 0.01301105939362391)
2026-06-20 11:45:38,294 - optuna.study.study - INFO - Trial 90 finished with values: [0.022942425501571884, 0.004927687255273462, 0.01301105939362391] and parameters: {'n_layers': 3, 'embedding_dim': 64, 'lr': 0.0015403750227822883, 'lambda_val': 2.085376662769769e-05, 'batch_size': 2177, 'optimizer': 'Adam'}.
2026-06-20 11:46:00,668 - experiment_functions - INFO - Early stopping at epoch 500. Best Metrics: (0.0005168465143286032, 0.00010420613868889732, 0.0002652101198667507)
2026-06-20 11:46:00,755 - optuna.study.study - INFO - Trial 91 finished with values: [0.0005168465143286032, 0.00010420613868889732, 0.0002652101198667507] and parameters: {'n_layers': 3, 'embedding_dim': 32, 'lr': 0.0008675647394478214, 'lambda_val': 5.898345098425546e-06, 'batch_size': 3872, 'optimizer': 'SGD'}.
2026-06-20 11:46:24,549 - experiment_functions - INFO - Early stopping at epoch 500. Best Metrics: (0.0005494615631468854, 0.0001121005431350259, 0.0002717027419048345)
2026-06-20 11:46:24,644 - optuna.study.study - INFO - Trial 92 finished with values: [0.0005494615631468854, 0.0001121005431350259, 0.0002717027419048345] and parameters: {'n_layers': 4, 'embedding_dim': 64, 'lr': 5.0144817119368783e-05, 'lambda_val': 0.0004435147620568133, 'batch_size': 1296, 'optimizer': 'SGD'}.
2026-06-20 11:47:20,588 - experiment_functions - INFO - Early stopping at epoch 1250. Best Metrics: (0.014345309012340489, 0.0029019830743968675, 0.007915954094335249)
2026-06-20 11:47:20,668 - optuna.study.study - INFO - Trial 93 finished with values: [0.014345309012340489, 0.0029019830743968675, 0.007915954094335249] and parameters: {'n_layers': 2, 'embedding_dim': 96, 'lr': 0.012491701393910511, 'lambda_val': 2.151196071407805e-06, 'batch_size': 1193, 'optimizer': 'RMSprop'}.
2026-06-20 11:49:22,323 - experiment_functions - INFO - Early stopping at epoch 2450. Best Metrics: (0.003807542065561358, 0.0008510167992926615, 0.002025451423948693)
2026-06-20 11:49:22,415 - optuna.study.study - INFO - Trial 94 finished with values: [0.003807542065561358, 0.0008510167992926615, 0.002025451423948693] and parameters: {'n_layers': 4, 'embedding_dim': 128, 'lr': 0.0015403750227822883, 'lambda_val': 0.0614554022089744, 'batch_size': 1183, 'optimizer': 'Adam'}.
2026-06-20 11:52:44,747 - optuna.study.study - INFO - Trial 95 finished with values: [0.001075131255473916, 0.000251042061386889, 0.000605794132738905] and parameters: {'n_layers': 2, 'embedding_dim': 256, 'lr': 0.00013519640271470463, 'lambda_val': 3.0549894793457165e-06, 'batch_size': 1380, 'optimizer': 'RMSprop'}.
2026-06-20 11:53:56,724 - experiment_functions - INFO - Early stopping at epoch 1500. Best Metrics: (0.0005006902897643937, 0.00012315270935960593, 0.00026425743890468983)
2026-06-20 11:53:56,807 - optuna.study.study - INFO - Trial 96 finished with values: [0.0005006902897643937, 0.00012315270935960593, 0.00026425743890468983] and parameters: {'n_layers': 3, 'embedding_dim': 128, 'lr': 2.0533926867514995e-05, 'lambda_val': 5.709570496997619e-05, 'batch_size': 2636, 'optimizer': 'Adam'}.
2026-06-20 11:54:25,149 - experiment_functions - INFO - Early stopping at epoch 550. Best Metrics: (0.009754338324690397, 0.0022230642920298095, 0.00557485102985674)
2026-06-20 11:54:25,235 - optuna.study.study - INFO - Trial 97 finished with values: [0.009754338324690397, 0.0022230642920298095, 0.00557485102985674] and parameters: {'n_layers': 1, 'embedding_dim': 256, 'lr': 0.03277585555961363, 'lambda_val': 3.0549894793457165e-06, 'batch_size': 1320, 'optimizer': 'Adam'}.
2026-06-20 11:54:53,390 - experiment_functions - INFO - Early stopping at epoch 550. Best Metrics: (0.010070069441642368, 0.002063597322218012, 0.005480399804133197)
2026-06-20 11:54:53,469 - optuna.study.study - INFO - Trial 98 finished with values: [0.010070069441642368, 0.002063597322218012, 0.005480399804133197] and parameters: {'n_layers': 4, 'embedding_dim': 96, 'lr': 0.02288989879091075, 'lambda_val': 5.090598517742677e-05, 'batch_size': 1783, 'optimizer': 'RMSprop'}.
2026-06-20 11:56:02,542 - experiment_functions - INFO - Early stopping at epoch 1400. Best Metrics: (0.012377940161366254, 0.002491474043198181, 0.007008698966149909)
2026-06-20 11:56:02,618 - optuna.study.study - INFO - Trial 99 finished with values: [0.012377940161366254, 0.002491474043198181, 0.007008698966149909] and parameters: {'n_layers': 3, 'embedding_dim': 128, 'lr': 0.004124348483373258, 'lambda_val': 1.4891573500580198e-05, 'batch_size': 3034, 'optimizer': 'RMSprop'}.
2026-06-20 11:56:33,840 - experiment_functions - INFO - Early stopping at epoch 600. Best Metrics: (0.014981329803212604, 0.0031830238726790454, 0.008020978171081189)
2026-06-20 11:56:33,917 - optuna.study.study - INFO - Trial 100 finished with values: [0.014981329803212604, 0.0031830238726790454, 0.008020978171081189] and parameters: {'n_layers': 3, 'embedding_dim': 128, 'lr': 0.004124348483373258, 'lambda_val': 5.7779857078524855e-05, 'batch_size': 3034, 'optimizer': 'Adam'}.
2026-06-20 11:57:12,191 - experiment_functions - INFO - Early stopping at epoch 800. Best Metrics: (0.013653494899544432, 0.002917771883289125, 0.007557375081050445)
2026-06-20 11:57:12,279 - optuna.study.study - INFO - Trial 101 finished with values: [0.013653494899544432, 0.002917771883289125, 0.007557375081050445] and parameters: {'n_layers': 4, 'embedding_dim': 64, 'lr': 0.0014257575686740206, 'lambda_val': 0.002980377292701446, 'batch_size': 1183, 'optimizer': 'Adam'}.
2026-06-20 11:57:43,858 - experiment_functions - INFO - Early stopping at epoch 650. Best Metrics: (0.013081965507850435, 0.0030125047366426675, 0.007071891508940759)
2026-06-20 11:57:43,934 - optuna.study.study - INFO - Trial 102 finished with values: [0.013081965507850435, 0.0030125047366426675, 0.007071891508940759] and parameters: {'n_layers': 2, 'embedding_dim': 128, 'lr': 0.0012029727538128135, 'lambda_val': 0.011822413068431218, 'batch_size': 2500, 'optimizer': 'RMSprop'}.
2026-06-20 11:58:37,785 - experiment_functions - INFO - Early stopping at epoch 900. Best Metrics: (0.022043631148456394, 0.004739800429455603, 0.012580040750000989)
2026-06-20 11:58:37,868 - optuna.study.study - INFO - Trial 103 finished with values: [0.022043631148456394, 0.004739800429455603, 0.012580040750000989] and parameters: {'n_layers': 3, 'embedding_dim': 256, 'lr': 0.0009942243415015796, 'lambda_val': 4.703980448589771e-06, 'batch_size': 1731, 'optimizer': 'Adam'}.
2026-06-20 11:59:11,558 - experiment_functions - INFO - Early stopping at epoch 550. Best Metrics: (0.009832739766348629, 0.002114121510673235, 0.005168066248705389)
2026-06-20 11:59:11,685 - optuna.study.study - INFO - Trial 104 finished with values: [0.009832739766348629, 0.002114121510673235, 0.005168066248705389] and parameters: {'n_layers': 3, 'embedding_dim': 256, 'lr': 0.006719843485367568, 'lambda_val': 0.0032201101504106306, 'batch_size': 3953, 'optimizer': 'Adam'}.
2026-06-20 11:59:49,909 - experiment_functions - INFO - Early stopping at epoch 800. Best Metrics: (0.019217699985435845, 0.004136667929771378, 0.010883696845033297)
2026-06-20 11:59:49,981 - optuna.study.study - INFO - Trial 105 finished with values: [0.019217699985435845, 0.004136667929771378, 0.010883696845033297] and parameters: {'n_layers': 4, 'embedding_dim': 64, 'lr': 0.0012029727538128135, 'lambda_val': 1.4891573500580198e-05, 'batch_size': 2734, 'optimizer': 'Adam'}.
2026-06-20 12:00:14,078 - experiment_functions - INFO - Early stopping at epoch 500. Best Metrics: (0.0005089627079292058, 0.00011367942402425163, 0.0003098230691383225)
2026-06-20 12:00:14,163 - optuna.study.study - INFO - Trial 106 finished with values: [0.0005089627079292058, 0.00011367942402425163, 0.0003098230691383225] and parameters: {'n_layers': 4, 'embedding_dim': 64, 'lr': 1.0653988519247298e-05, 'lambda_val': 0.012086938131077505, 'batch_size': 3872, 'optimizer': 'Adam'}.
2026-06-20 12:00:40,908 - experiment_functions - INFO - Early stopping at epoch 500. Best Metrics: (0.0005844883355643795, 0.0001215738284703802, 0.00030512187859471076)
2026-06-20 12:00:40,996 - optuna.study.study - INFO - Trial 107 finished with values: [0.0005844883355643795, 0.0001215738284703802, 0.00030512187859471076] and parameters: {'n_layers': 4, 'embedding_dim': 128, 'lr': 0.0005629172869768005, 'lambda_val': 0.0004242504250406823, 'batch_size': 1380, 'optimizer': 'SGD'}.
2026-06-20 12:01:13,245 - experiment_functions - INFO - Early stopping at epoch 700. Best Metrics: (0.015658733816190932, 0.003517746621194897, 0.00874090999340782)
2026-06-20 12:01:13,337 - optuna.study.study - INFO - Trial 108 finished with values: [0.015658733816190932, 0.003517746621194897, 0.00874090999340782] and parameters: {'n_layers': 3, 'embedding_dim': 64, 'lr': 0.0015403750227822883, 'lambda_val': 0.012086938131077505, 'batch_size': 2177, 'optimizer': 'Adam'}.
2026-06-20 12:03:12,825 - experiment_functions - INFO - Early stopping at epoch 2900. Best Metrics: (0.005220665327423177, 0.001199949475811545, 0.0029991851055435445)
2026-06-20 12:03:12,894 - optuna.study.study - INFO - Trial 109 finished with values: [0.005220665327423177, 0.001199949475811545, 0.0029991851055435445] and parameters: {'n_layers': 1, 'embedding_dim': 96, 'lr': 0.03277585555961363, 'lambda_val': 0.020463096963143943, 'batch_size': 1389, 'optimizer': 'RMSprop'}.
2026-06-20 12:03:35,990 - experiment_functions - INFO - Early stopping at epoch 500. Best Metrics: (0.0007307173783194021, 0.0001499936844764431, 0.00040011857714026904)
2026-06-20 12:03:36,081 - optuna.study.study - INFO - Trial 110 finished with values: [0.0007307173783194021, 0.0001499936844764431, 0.00040011857714026904] and parameters: {'n_layers': 1, 'embedding_dim': 128, 'lr': 0.0009942243415015796, 'lambda_val': 0.001526779508134114, 'batch_size': 1643, 'optimizer': 'SGD'}.
2026-06-20 12:06:41,810 - optuna.study.study - INFO - Trial 111 finished with values: [0.007332195500109904, 0.0017209801692560315, 0.003899210201466302] and parameters: {'n_layers': 1, 'embedding_dim': 256, 'lr': 0.06963517344838095, 'lambda_val': 0.012476747309767241, 'batch_size': 2533, 'optimizer': 'RMSprop'}.
2026-06-20 12:07:19,633 - experiment_functions - INFO - Early stopping at epoch 700. Best Metrics: (0.02090156332502262, 0.004495073891625616, 0.01185078878949975)
2026-06-20 12:07:19,707 - optuna.study.study - INFO - Trial 112 finished with values: [0.02090156332502262, 0.004495073891625616, 0.01185078878949975] and parameters: {'n_layers': 4, 'embedding_dim': 128, 'lr': 0.0009942243415015796, 'lambda_val': 2.3871418678853867e-05, 'batch_size': 3025, 'optimizer': 'Adam'}.
2026-06-20 12:07:45,476 - experiment_functions - INFO - Early stopping at epoch 550. Best Metrics: (0.00942927035925171, 0.0021583301755715547, 0.005459124218179027)
2026-06-20 12:07:45,559 - optuna.study.study - INFO - Trial 113 finished with values: [0.00942927035925171, 0.0021583301755715547, 0.005459124218179027] and parameters: {'n_layers': 1, 'embedding_dim': 128, 'lr': 0.03277585555961363, 'lambda_val': 1.4891573500580198e-05, 'batch_size': 1389, 'optimizer': 'Adam'}.
2026-06-20 12:08:18,869 - experiment_functions - INFO - Early stopping at epoch 650. Best Metrics: (0.008726197476950115, 0.0017951875710496398, 0.004695711035912962)
2026-06-20 12:08:18,956 - optuna.study.study - INFO - Trial 114 finished with values: [0.008726197476950115, 0.0017951875710496398, 0.004695711035912962] and parameters: {'n_layers': 3, 'embedding_dim': 128, 'lr': 0.01651788247265586, 'lambda_val': 1.4891573500580198e-05, 'batch_size': 2177, 'optimizer': 'Adam'}.
2026-06-20 12:12:31,035 - optuna.study.study - INFO - Trial 115 finished with values: [0.023979270229189546, 0.005188202601995706, 0.013798942903754139] and parameters: {'n_layers': 4, 'embedding_dim': 256, 'lr': 0.00023729211693529712, 'lambda_val': 6.639634996787226e-05, 'batch_size': 2012, 'optimizer': 'Adam'}.
2026-06-20 12:13:05,767 - experiment_functions - INFO - Early stopping at epoch 800. Best Metrics: (0.01654704414676476, 0.003775104206138689, 0.009490365592125379)
2026-06-20 12:13:06,135 - optuna.study.study - INFO - Trial 116 finished with values: [0.01654704414676476, 0.003775104206138689, 0.009490365592125379] and parameters: {'n_layers': 3, 'embedding_dim': 32, 'lr': 0.0009241097994190195, 'lambda_val': 0.012086938131077505, 'batch_size': 3872, 'optimizer': 'Adam'}.
2026-06-20 12:13:38,198 - experiment_functions - INFO - Early stopping at epoch 500. Best Metrics: (0.0003548970047253711, 9.157509157509159e-05, 0.0002088904274899129)
2026-06-20 12:13:38,282 - optuna.study.study - INFO - Trial 117 finished with values: [0.0003548970047253711, 9.157509157509159e-05, 0.0002088904274899129] and parameters: {'n_layers': 4, 'embedding_dim': 256, 'lr': 0.00023729211693529712, 'lambda_val': 0.025733691733705995, 'batch_size': 2012, 'optimizer': 'SGD'}.
2026-06-20 12:15:59,049 - experiment_functions - INFO - Early stopping at epoch 3350. Best Metrics: (0.0336000598283435, 0.006967601364153088, 0.018680703647204765)
2026-06-20 12:15:59,124 - optuna.study.study - INFO - Trial 118 finished with values: [0.0336000598283435, 0.006967601364153088, 0.018680703647204765] and parameters: {'n_layers': 1, 'embedding_dim': 64, 'lr': 0.0012029727538128135, 'lambda_val': 0.0004242504250406823, 'batch_size': 2384, 'optimizer': 'Adam'}.
2026-06-20 12:16:59,757 - experiment_functions - INFO - Early stopping at epoch 950. Best Metrics: (0.015835142955332008, 0.0033866995073891628, 0.008823976122333481)
2026-06-20 12:16:59,843 - optuna.study.study - INFO - Trial 119 finished with values: [0.015835142955332008, 0.0033866995073891628, 0.008823976122333481] and parameters: {'n_layers': 4, 'embedding_dim': 256, 'lr': 0.0009798834021344095, 'lambda_val': 5.848323299602918e-05, 'batch_size': 1183, 'optimizer': 'Adam'}.
2026-06-20 12:17:30,333 - experiment_functions - INFO - Early stopping at epoch 550. Best Metrics: (0.0055819997493565246, 0.0011652140962485791, 0.0030623457875318155)
2026-06-20 12:17:30,415 - optuna.study.study - INFO - Trial 120 finished with values: [0.0055819997493565246, 0.0011652140962485791, 0.0030623457875318155] and parameters: {'n_layers': 2, 'embedding_dim': 256, 'lr': 0.0962693664665867, 'lambda_val': 5.848323299602918e-05, 'batch_size': 998, 'optimizer': 'Adam'}.
2026-06-20 12:20:23,617 - optuna.study.study - INFO - Trial 121 finished with values: [0.015326532945686621, 0.0035493242389794117, 0.008851242558409779] and parameters: {'n_layers': 3, 'embedding_dim': 64, 'lr': 0.00018526976069552334, 'lambda_val': 0.011822413068431218, 'batch_size': 3439, 'optimizer': 'RMSprop'}.
2026-06-20 12:21:06,241 - experiment_functions - INFO - Early stopping at epoch 900. Best Metrics: (0.013160393624952624, 0.00280882910193255, 0.007121448395446487)
2026-06-20 12:21:06,311 - optuna.study.study - INFO - Trial 122 finished with values: [0.013160393624952624, 0.00280882910193255, 0.007121448395446487] and parameters: {'n_layers': 3, 'embedding_dim': 96, 'lr': 0.0014257575686740206, 'lambda_val': 0.0008009114390244755, 'batch_size': 1643, 'optimizer': 'RMSprop'}.
2026-06-20 12:21:33,605 - experiment_functions - INFO - Early stopping at epoch 550. Best Metrics: (0.011775186750529472, 0.002583049134773273, 0.006448275295341214)
