2026-06-18 10:03:21,939 - optuna.study.study - INFO - Trial 273 finished with values: [0.0034405652375214435, 0.0008036503726158898, 0.0021893634330984926] and parameters: {'n_layers': 3, 'embedding_dim': 96, 'lr': 0.0004894377864752034, 'lambda_val': 0.002242896946510979, 'batch_size': 1509, 'optimizer': 'RMSprop'}.
2026-06-18 10:05:22,509 - experiment_functions - INFO - Early stopping at epoch 2900. Best Metrics: (0.004035493487751951, 0.0009599595806492359, 0.002767245193801882)
2026-06-18 10:05:22,836 - optuna.study.study - INFO - Trial 274 finished with values: [0.004035493487751951, 0.0009599595806492359, 0.002767245193801882] and parameters: {'n_layers': 4, 'embedding_dim': 32, 'lr': 0.0011084029372515364, 'lambda_val': 0.00029665726020447226, 'batch_size': 655, 'optimizer': 'RMSprop'}.
2026-06-18 10:08:00,145 - experiment_functions - INFO - Early stopping at epoch 3650. Best Metrics: (0.0035050080912583685, 0.0008825944170771756, 0.0023134963039610702)
2026-06-18 10:08:00,225 - optuna.study.study - INFO - Trial 275 finished with values: [0.0035050080912583685, 0.0008825944170771756, 0.0023134963039610702] and parameters: {'n_layers': 2, 'embedding_dim': 128, 'lr': 0.0009840483225184993, 'lambda_val': 2.2848456976007116e-05, 'batch_size': 655, 'optimizer': 'RMSprop'}.
2026-06-18 10:09:05,225 - experiment_functions - INFO - Early stopping at epoch 1400. Best Metrics: (0.00370943915295444, 0.0009694328659845902, 0.0023142248850579455)
2026-06-18 10:09:05,555 - optuna.study.study - INFO - Trial 276 finished with values: [0.00370943915295444, 0.0009694328659845902, 0.0023142248850579455] and parameters: {'n_layers': 3, 'embedding_dim': 128, 'lr': 0.0011084029372515364, 'lambda_val': 3.615242376833312e-06, 'batch_size': 1892, 'optimizer': 'RMSprop'}.
2026-06-18 10:11:38,033 - experiment_functions - INFO - Early stopping at epoch 3000. Best Metrics: (0.004195341950533061, 0.0010578501957812304, 0.002559529674320718)
2026-06-18 10:11:38,130 - optuna.study.study - INFO - Trial 277 finished with values: [0.004195341950533061, 0.0010578501957812304, 0.002559529674320718] and parameters: {'n_layers': 3, 'embedding_dim': 256, 'lr': 0.0011084029372515364, 'lambda_val': 1.6639720416643942e-06, 'batch_size': 655, 'optimizer': 'RMSprop'}.
2026-06-18 10:13:02,846 - experiment_functions - INFO - Early stopping at epoch 1900. Best Metrics: (0.003926470252453987, 0.0009915371984337501, 0.0025956451346736908)
2026-06-18 10:13:03,026 - optuna.study.study - INFO - Trial 278 finished with values: [0.003926470252453987, 0.0009915371984337501, 0.0025956451346736908] and parameters: {'n_layers': 3, 'embedding_dim': 128, 'lr': 0.0009840483225184993, 'lambda_val': 1.6639720416643942e-06, 'batch_size': 655, 'optimizer': 'RMSprop'}.
2026-06-18 10:13:36,553 - experiment_functions - INFO - Early stopping at epoch 550. Best Metrics: (0.002680835246708808, 0.0006868131868131869, 0.0017277142798040716)
2026-06-18 10:13:37,192 - optuna.study.study - INFO - Trial 279 finished with values: [0.002680835246708808, 0.0006868131868131869, 0.0017277142798040716] and parameters: {'n_layers': 2, 'embedding_dim': 256, 'lr': 0.030971401174004636, 'lambda_val': 2.2848456976007116e-05, 'batch_size': 793, 'optimizer': 'RMSprop'}.
2026-06-18 10:14:54,964 - experiment_functions - INFO - Early stopping at epoch 1700. Best Metrics: (0.003742160200538752, 0.0009631173424276872, 0.0022726436723238415)
2026-06-18 10:14:55,067 - optuna.study.study - INFO - Trial 280 finished with values: [0.003742160200538752, 0.0009631173424276872, 0.0022726436723238415] and parameters: {'n_layers': 4, 'embedding_dim': 128, 'lr': 0.0011084029372515364, 'lambda_val': 1.4055284682631976e-05, 'batch_size': 1892, 'optimizer': 'RMSprop'}.
2026-06-18 10:16:38,761 - experiment_functions - INFO - Early stopping at epoch 2500. Best Metrics: (0.003809464658195543, 0.0009252242010862702, 0.002492867893861705)
2026-06-18 10:16:38,860 - optuna.study.study - INFO - Trial 281 finished with values: [0.003809464658195543, 0.0009252242010862702, 0.002492867893861705] and parameters: {'n_layers': 2, 'embedding_dim': 96, 'lr': 0.0009840483225184993, 'lambda_val': 5.538422897317458e-06, 'batch_size': 655, 'optimizer': 'RMSprop'}.
2026-06-18 10:18:21,471 - experiment_functions - INFO - Early stopping at epoch 2550. Best Metrics: (0.0046483156175146905, 0.0010783756473411645, 0.0029176825636311344)
2026-06-18 10:18:21,798 - optuna.study.study - INFO - Trial 282 finished with values: [0.0046483156175146905, 0.0010783756473411645, 0.0029176825636311344] and parameters: {'n_layers': 4, 'embedding_dim': 32, 'lr': 0.0011084029372515364, 'lambda_val': 2.6367594401190188e-05, 'batch_size': 793, 'optimizer': 'RMSprop'}.
2026-06-18 10:19:45,455 - experiment_functions - INFO - Early stopping at epoch 1550. Best Metrics: (0.0034172741811905882, 0.0008873310597448529, 0.0021713806833922344)
2026-06-18 10:19:45,555 - optuna.study.study - INFO - Trial 283 finished with values: [0.0034172741811905882, 0.0008873310597448529, 0.0021713806833922344] and parameters: {'n_layers': 4, 'embedding_dim': 256, 'lr': 0.0008273605807562151, 'lambda_val': 0.00020122391761600542, 'batch_size': 655, 'optimizer': 'Adam'}.
2026-06-18 10:22:22,786 - experiment_functions - INFO - Early stopping at epoch 3700. Best Metrics: (0.0033045095296463317, 0.0008099658961727927, 0.0020739940514085432)
2026-06-18 10:22:22,889 - optuna.study.study - INFO - Trial 284 finished with values: [0.0033045095296463317, 0.0008099658961727927, 0.0020739940514085432] and parameters: {'n_layers': 2, 'embedding_dim': 128, 'lr': 0.00048363299473296685, 'lambda_val': 2.2848456976007116e-05, 'batch_size': 3869, 'optimizer': 'RMSprop'}.
2026-06-18 10:25:10,440 - optuna.study.study - INFO - Trial 285 finished with values: [0.0035747277264161583, 0.0008620689655172414, 0.0022813968646746793] and parameters: {'n_layers': 4, 'embedding_dim': 64, 'lr': 0.00046996802016152644, 'lambda_val': 1.6639720416643942e-06, 'batch_size': 2514, 'optimizer': 'RMSprop'}.
2026-06-18 10:25:38,497 - experiment_functions - INFO - Early stopping at epoch 500. Best Metrics: (0.000613017490347488, 0.00013262599469496023, 0.00032798672048073546)
2026-06-18 10:25:38,598 - optuna.study.study - INFO - Trial 286 finished with values: [0.000613017490347488, 0.00013262599469496023, 0.00032798672048073546] and parameters: {'n_layers': 4, 'embedding_dim': 256, 'lr': 0.0008273605807562151, 'lambda_val': 0.00020122391761600542, 'batch_size': 655, 'optimizer': 'SGD'}.
2026-06-18 10:28:42,822 - optuna.study.study - INFO - Trial 287 finished with values: [0.004315278459530972, 0.000997852721990653, 0.0026190861684094006] and parameters: {'n_layers': 4, 'embedding_dim': 128, 'lr': 0.0004894377864752034, 'lambda_val': 5.797034595637332e-06, 'batch_size': 744, 'optimizer': 'RMSprop'}.
2026-06-18 10:31:33,010 - optuna.study.study - INFO - Trial 288 finished with values: [0.003306726090641597, 0.0008052292535051156, 0.002151890451996313] and parameters: {'n_layers': 2, 'embedding_dim': 128, 'lr': 0.00046996802016152644, 'lambda_val': 1.0560042497819773e-05, 'batch_size': 3652, 'optimizer': 'RMSprop'}.
2026-06-18 10:33:12,459 - experiment_functions - INFO - Early stopping at epoch 2400. Best Metrics: (0.003394542471060812, 0.0007199696854869269, 0.0021329117383552428)
2026-06-18 10:33:12,778 - optuna.study.study - INFO - Trial 289 finished with values: [0.003394542471060812, 0.0007199696854869269, 0.0021329117383552428] and parameters: {'n_layers': 2, 'embedding_dim': 64, 'lr': 0.0009840483225184993, 'lambda_val': 3.615242376833312e-06, 'batch_size': 655, 'optimizer': 'Adam'}.
2026-06-18 10:36:15,185 - optuna.study.study - INFO - Trial 290 finished with values: [0.003952764627493826, 0.000975748389541493, 0.0025130746809981074] and parameters: {'n_layers': 4, 'embedding_dim': 128, 'lr': 0.0004894377864752034, 'lambda_val': 3.481867111201764e-05, 'batch_size': 655, 'optimizer': 'RMSprop'}.
2026-06-18 10:39:21,431 - experiment_functions - INFO - Early stopping at epoch 3700. Best Metrics: (0.0036703339704681442, 0.0009189086775293673, 0.00232694143554401)
2026-06-18 10:39:21,764 - optuna.study.study - INFO - Trial 291 finished with values: [0.0036703339704681442, 0.0009189086775293673, 0.00232694143554401] and parameters: {'n_layers': 3, 'embedding_dim': 256, 'lr': 0.0005366322595770779, 'lambda_val': 2.2848456976007116e-05, 'batch_size': 655, 'optimizer': 'RMSprop'}.
2026-06-18 10:42:07,630 - optuna.study.study - INFO - Trial 292 finished with values: [0.002389966815774763, 0.0005289250978906152, 0.00153484038908278] and parameters: {'n_layers': 1, 'embedding_dim': 128, 'lr': 0.0004894377864752034, 'lambda_val': 7.3372601056335455e-06, 'batch_size': 655, 'optimizer': 'Adam'}.
2026-06-18 10:43:49,495 - experiment_functions - INFO - Early stopping at epoch 2200. Best Metrics: (0.003297500289702462, 0.0008099658961727927, 0.0019044693955999126)
2026-06-18 10:43:49,591 - optuna.study.study - INFO - Trial 293 finished with values: [0.003297500289702462, 0.0008099658961727927, 0.0019044693955999126] and parameters: {'n_layers': 4, 'embedding_dim': 128, 'lr': 0.0004894377864752034, 'lambda_val': 0.00020122391761600542, 'batch_size': 3310, 'optimizer': 'Adam'}.
2026-06-18 10:45:27,961 - experiment_functions - INFO - Early stopping at epoch 2200. Best Metrics: (0.0037017820893997587, 0.0009015409877478844, 0.002187597771249058)
2026-06-18 10:45:28,331 - optuna.study.study - INFO - Trial 294 finished with values: [0.0037017820893997587, 0.0009015409877478844, 0.002187597771249058] and parameters: {'n_layers': 3, 'embedding_dim': 128, 'lr': 0.0011084029372515364, 'lambda_val': 1.4055284682631976e-05, 'batch_size': 1892, 'optimizer': 'RMSprop'}.
2026-06-18 10:46:44,682 - experiment_functions - INFO - Early stopping at epoch 1800. Best Metrics: (0.0036160724227346777, 0.0008620689655172415, 0.002350449955855084)
2026-06-18 10:46:45,014 - optuna.study.study - INFO - Trial 295 finished with values: [0.0036160724227346777, 0.0008620689655172415, 0.002350449955855084] and parameters: {'n_layers': 3, 'embedding_dim': 64, 'lr': 0.0011084029372515364, 'lambda_val': 1.4055284682631976e-05, 'batch_size': 1892, 'optimizer': 'RMSprop'}.
2026-06-18 10:48:17,158 - experiment_functions - INFO - Early stopping at epoch 2250. Best Metrics: (0.003095632505034904, 0.000753126184160667, 0.002012724375980561)
2026-06-18 10:48:17,252 - optuna.study.study - INFO - Trial 296 finished with values: [0.003095632505034904, 0.000753126184160667, 0.002012724375980561] and parameters: {'n_layers': 4, 'embedding_dim': 32, 'lr': 0.00046996802016152644, 'lambda_val': 2.1011583665129505e-05, 'batch_size': 2514, 'optimizer': 'RMSprop'}.
2026-06-18 10:49:37,356 - experiment_functions - INFO - Early stopping at epoch 1550. Best Metrics: (0.003245446955881843, 0.0008889099406340786, 0.0020195519934070295)
2026-06-18 10:49:37,515 - optuna.study.study - INFO - Trial 297 finished with values: [0.003245446955881843, 0.0008889099406340786, 0.0020195519934070295] and parameters: {'n_layers': 3, 'embedding_dim': 256, 'lr': 0.0011084029372515364, 'lambda_val': 1.4055284682631976e-05, 'batch_size': 3634, 'optimizer': 'RMSprop'}.
2026-06-18 10:51:06,335 - experiment_functions - INFO - Early stopping at epoch 2050. Best Metrics: (0.0035422858518417712, 0.0008225969432865983, 0.002303371841946991)
2026-06-18 10:51:06,424 - optuna.study.study - INFO - Trial 298 finished with values: [0.0035422858518417712, 0.0008225969432865983, 0.002303371841946991] and parameters: {'n_layers': 2, 'embedding_dim': 128, 'lr': 0.0009840483225184993, 'lambda_val': 2.2848456976007116e-05, 'batch_size': 793, 'optimizer': 'RMSprop'}.
2026-06-18 10:52:17,032 - experiment_functions - INFO - Early stopping at epoch 1500. Best Metrics: (0.0036720056657894, 0.0009473285335354301, 0.0022812080449952665)
2026-06-18 10:52:17,135 - optuna.study.study - INFO - Trial 299 finished with values: [0.0036720056657894, 0.0009473285335354301, 0.0022812080449952665] and parameters: {'n_layers': 4, 'embedding_dim': 128, 'lr': 0.0011084029372515364, 'lambda_val': 3.615242376833312e-06, 'batch_size': 1642, 'optimizer': 'RMSprop'}.
2026-06-18 10:52:17,150 - root - INFO - Selected Trial 282 based on Max ndcg: 0.0029
2026-06-18 10:52:17,150 - root - INFO - Associated Recall: 0.0046
2026-06-18 10:52:17,150 - experiment_functions - INFO - Training the best model ... for e_yelp_1c1dcs_strict_rand4
2026-06-18 10:53:53,743 - experiment_functions - INFO - Early stopping at epoch 2350. Best Metrics: (0.0045517117798565, 0.0010341669824428445, 0.0029088954805782065)
2026-06-18 10:53:57,463 - root - INFO -   **** Training e_yelp_1c1dcs_strict_rand5
2026-06-18 10:53:57,476 - root - INFO -   **** Getting 34724/1274132 random edges
2026-06-18 10:53:57,778 - optuna.storages._rdb.storage - INFO - A new study created in RDB with name: Study_e_yelp_1c1dcs_strict_rand5
2026-06-18 10:54:45,117 - experiment_functions - INFO - Early stopping at epoch 1150. Best Metrics: (0.0016216634801143365, 0.00048629531388152085, 0.001105363489399948)
2026-06-18 10:54:45,218 - optuna.study.study - INFO - Trial 0 finished with values: [0.0016216634801143365, 0.00048629531388152085, 0.001105363489399948] and parameters: {'n_layers': 1, 'embedding_dim': 64, 'lr': 0.017775447648354058, 'lambda_val': 0.014526643349459604, 'batch_size': 561, 'optimizer': 'RMSprop'}.
2026-06-18 10:57:24,099 - optuna.study.study - INFO - Trial 1 finished with values: [0.0026259974941418287, 0.0005936592143488697, 0.001604338565095556] and parameters: {'n_layers': 1, 'embedding_dim': 64, 'lr': 0.0005516089764502217, 'lambda_val': 0.005988433373997008, 'batch_size': 779, 'optimizer': 'Adam'}.
2026-06-18 10:57:46,750 - experiment_functions - INFO - Early stopping at epoch 500. Best Metrics: (0.0005144845953877865, 0.00012473159024883163, 0.0003040858392867343)
2026-06-18 10:57:46,852 - optuna.study.study - INFO - Trial 2 finished with values: [0.0005144845953877865, 0.00012473159024883163, 0.0003040858392867343] and parameters: {'n_layers': 1, 'embedding_dim': 128, 'lr': 0.010413146807299888, 'lambda_val': 1.1234571578444802e-06, 'batch_size': 3542, 'optimizer': 'SGD'}.
2026-06-18 10:58:18,533 - experiment_functions - INFO - Early stopping at epoch 750. Best Metrics: (0.00041837675129986605, 0.00011210054313502589, 0.0002475229765895851)
2026-06-18 10:58:18,630 - optuna.study.study - INFO - Trial 3 finished with values: [0.00041837675129986605, 0.00011210054313502589, 0.0002475229765895851] and parameters: {'n_layers': 2, 'embedding_dim': 32, 'lr': 8.844577185094012e-05, 'lambda_val': 0.0483372286457971, 'batch_size': 1812, 'optimizer': 'RMSprop'}.
2026-06-18 10:58:48,458 - experiment_functions - INFO - Early stopping at epoch 700. Best Metrics: (0.0025634204676654873, 0.0006568144499178983, 0.0016425483252984988)
2026-06-18 10:58:48,568 - optuna.study.study - INFO - Trial 4 finished with values: [0.0025634204676654873, 0.0006568144499178983, 0.0016425483252984988] and parameters: {'n_layers': 3, 'embedding_dim': 32, 'lr': 0.015482238843201098, 'lambda_val': 4.669465121966091e-06, 'batch_size': 1520, 'optimizer': 'RMSprop'}.
2026-06-18 10:59:42,097 - experiment_functions - INFO - Early stopping at epoch 1050. Best Metrics: (0.0028453366115069184, 0.000702601995705444, 0.0018792268956704604)
2026-06-18 10:59:42,206 - optuna.study.study - INFO - Trial 5 finished with values: [0.0028453366115069184, 0.000702601995705444, 0.0018792268956704604] and parameters: {'n_layers': 1, 'embedding_dim': 256, 'lr': 0.0039744934290608215, 'lambda_val': 1.0687219886452036e-06, 'batch_size': 2877, 'optimizer': 'RMSprop'}.
2026-06-18 11:00:52,654 - experiment_functions - INFO - Early stopping at epoch 1500. Best Metrics: (0.003574254566361411, 0.0009504862953138816, 0.0022204020099283457)
2026-06-18 11:00:52,739 - optuna.study.study - INFO - Trial 6 finished with values: [0.003574254566361411, 0.0009504862953138816, 0.0022204020099283457] and parameters: {'n_layers': 4, 'embedding_dim': 128, 'lr': 0.0016391721585660463, 'lambda_val': 1.455259422316608e-06, 'batch_size': 2199, 'optimizer': 'RMSprop'}.
2026-06-18 11:01:15,358 - experiment_functions - INFO - Early stopping at epoch 500. Best Metrics: (0.00047569914867091266, 0.00011525830491347733, 0.0002482601653183045)
2026-06-18 11:01:15,468 - optuna.study.study - INFO - Trial 7 finished with values: [0.00047569914867091266, 0.00011525830491347733, 0.0002482601653183045] and parameters: {'n_layers': 3, 'embedding_dim': 64, 'lr': 2.9257063852970716e-05, 'lambda_val': 0.007186552674009227, 'batch_size': 1326, 'optimizer': 'SGD'}.
2026-06-18 11:04:01,360 - optuna.study.study - INFO - Trial 8 finished with values: [0.001385355340029892, 0.00031103953517746624, 0.0008982532228397765] and parameters: {'n_layers': 2, 'embedding_dim': 96, 'lr': 0.00010963058081904807, 'lambda_val': 1.0819711188161646e-06, 'batch_size': 3200, 'optimizer': 'RMSprop'}.
2026-06-18 11:04:23,407 - experiment_functions - INFO - Early stopping at epoch 500. Best Metrics: (0.000558550571355278, 0.00012631047113805736, 0.0002935028459342477)
2026-06-18 11:04:23,525 - optuna.study.study - INFO - Trial 9 finished with values: [0.000558550571355278, 0.00012631047113805736, 0.0002935028459342477] and parameters: {'n_layers': 2, 'embedding_dim': 32, 'lr': 0.0001408952344319084, 'lambda_val': 0.044437553437972906, 'batch_size': 3312, 'optimizer': 'SGD'}.
2026-06-18 11:05:32,193 - experiment_functions - INFO - Early stopping at epoch 1600. Best Metrics: (0.00267686523252782, 0.0006331312365795125, 0.0016901176404407726)
2026-06-18 11:05:32,294 - optuna.study.study - INFO - Trial 10 finished with values: [0.00267686523252782, 0.0006331312365795125, 0.0016901176404407726] and parameters: {'n_layers': 2, 'embedding_dim': 96, 'lr': 0.000705539749443302, 'lambda_val': 0.0038087913449814693, 'batch_size': 2844, 'optimizer': 'Adam'}.
2026-06-18 11:06:03,923 - experiment_functions - INFO - Early stopping at epoch 550. Best Metrics: (0.002991732902353008, 0.0008131236579512442, 0.0018331211913169456)
2026-06-18 11:06:04,039 - optuna.study.study - INFO - Trial 11 finished with values: [0.002991732902353008, 0.0008131236579512442, 0.0018331211913169456] and parameters: {'n_layers': 4, 'embedding_dim': 256, 'lr': 0.003307811671556655, 'lambda_val': 0.0015636957707602223, 'batch_size': 2731, 'optimizer': 'RMSprop'}.
2026-06-18 11:06:54,545 - experiment_functions - INFO - Early stopping at epoch 1200. Best Metrics: (0.00036712866272208287, 8.999621068586586e-05, 0.00018808458150017238)
2026-06-18 11:06:54,658 - optuna.study.study - INFO - Trial 12 finished with values: [0.00036712866272208287, 8.999621068586586e-05, 0.00018808458150017238] and parameters: {'n_layers': 1, 'embedding_dim': 96, 'lr': 1.4110088822474436e-05, 'lambda_val': 0.015789805653823156, 'batch_size': 3709, 'optimizer': 'RMSprop'}.
2026-06-18 11:07:20,541 - experiment_functions - INFO - Early stopping at epoch 500. Best Metrics: (0.001955694039939454, 0.0004689276241000379, 0.0013066968660611269)
2026-06-18 11:07:20,649 - optuna.study.study - INFO - Trial 13 finished with values: [0.001955694039939454, 0.0004689276241000379, 0.0013066968660611269] and parameters: {'n_layers': 4, 'embedding_dim': 64, 'lr': 0.07584258627426255, 'lambda_val': 0.00035186420772942195, 'batch_size': 1461, 'optimizer': 'RMSprop'}.
2026-06-18 11:07:45,128 - experiment_functions - INFO - Early stopping at epoch 500. Best Metrics: (0.0005374559428485095, 0.00011525830491347733, 0.000274235644535751)
2026-06-18 11:07:45,495 - optuna.study.study - INFO - Trial 14 finished with values: [0.0005374559428485095, 0.00011525830491347733, 0.000274235644535751] and parameters: {'n_layers': 3, 'embedding_dim': 128, 'lr': 9.280440396507634e-05, 'lambda_val': 0.056214748559057656, 'batch_size': 2971, 'optimizer': 'Adam'}.
2026-06-18 11:08:22,889 - experiment_functions - INFO - Early stopping at epoch 900. Best Metrics: (0.0035853530415084546, 0.000775230516609827, 0.0021124690053961376)
2026-06-18 11:08:23,237 - optuna.study.study - INFO - Trial 15 finished with values: [0.0035853530415084546, 0.000775230516609827, 0.0021124690053961376] and parameters: {'n_layers': 1, 'embedding_dim': 32, 'lr': 0.002487565347422212, 'lambda_val': 1.3344718493912024e-05, 'batch_size': 892, 'optimizer': 'Adam'}.
2026-06-18 11:08:45,370 - experiment_functions - INFO - Early stopping at epoch 500. Best Metrics: (0.0005545962908712653, 0.00011525830491347733, 0.0002746409136513276)
2026-06-18 11:08:45,480 - optuna.study.study - INFO - Trial 16 finished with values: [0.0005545962908712653, 0.00011525830491347733, 0.0002746409136513276] and parameters: {'n_layers': 3, 'embedding_dim': 32, 'lr': 0.001229746147020764, 'lambda_val': 2.7945521753203373e-05, 'batch_size': 1789, 'optimizer': 'SGD'}.
2026-06-18 11:09:59,865 - experiment_functions - INFO - Early stopping at epoch 1650. Best Metrics: (0.0005252133667982095, 0.0001231527093596059, 0.0002673960058862196)
2026-06-18 11:10:00,230 - optuna.study.study - INFO - Trial 17 finished with values: [0.0005252133667982095, 0.0001231527093596059, 0.0002673960058862196] and parameters: {'n_layers': 3, 'embedding_dim': 128, 'lr': 1.058459142524192e-05, 'lambda_val': 1.609940959377078e-06, 'batch_size': 2839, 'optimizer': 'Adam'}.
2026-06-18 11:11:31,606 - experiment_functions - INFO - Early stopping at epoch 2200. Best Metrics: (0.0005378299354283697, 0.00012788935202728306, 0.00027728130301637267)
2026-06-18 11:11:31,723 - optuna.study.study - INFO - Trial 18 finished with values: [0.0005378299354283697, 0.00012788935202728306, 0.00027728130301637267] and parameters: {'n_layers': 1, 'embedding_dim': 128, 'lr': 6.592777005617928e-05, 'lambda_val': 0.030486522346537214, 'batch_size': 1740, 'optimizer': 'RMSprop'}.
