2026-06-22 10:28:49,419 - optuna.study.study - INFO - Trial 1 finished with values: [0.0005198345067145893, 0.00011999494758115447, 0.0002950418031039107] and parameters: {'n_layers': 1, 'embedding_dim': 256, 'lr': 0.00027595922398828136, 'lambda_val': 6.0509933989483335e-05, 'batch_size': 3315, 'optimizer': 'SGD'}.
2026-06-22 10:29:20,375 - experiment_functions - INFO - Early stopping at epoch 500. Best Metrics: (0.0005053171388174568, 0.00011525830491347732, 0.000254053982335857)
2026-06-22 10:29:20,461 - optuna.study.study - INFO - Trial 2 finished with values: [0.0005053171388174568, 0.00011525830491347732, 0.000254053982335857] and parameters: {'n_layers': 3, 'embedding_dim': 256, 'lr': 0.03120354849122035, 'lambda_val': 1.3824633151650612e-06, 'batch_size': 3721, 'optimizer': 'SGD'}.
2026-06-22 10:30:08,575 - experiment_functions - INFO - Early stopping at epoch 1000. Best Metrics: (0.004405070299574027, 0.0009331186055323986, 0.002361659141337707)
2026-06-22 10:30:08,652 - optuna.study.study - INFO - Trial 3 finished with values: [0.004405070299574027, 0.0009331186055323986, 0.002361659141337707] and parameters: {'n_layers': 2, 'embedding_dim': 128, 'lr': 0.023133657480706095, 'lambda_val': 0.008413467933385188, 'batch_size': 2235, 'optimizer': 'Adam'}.
2026-06-22 10:30:42,398 - experiment_functions - INFO - Early stopping at epoch 750. Best Metrics: (0.021529675264276276, 0.00463401540987748, 0.01213909652093244)
2026-06-22 10:30:42,525 - optuna.study.study - INFO - Trial 4 finished with values: [0.021529675264276276, 0.00463401540987748, 0.01213909652093244] and parameters: {'n_layers': 3, 'embedding_dim': 32, 'lr': 0.0014581466250124255, 'lambda_val': 0.0015291691045797489, 'batch_size': 3764, 'optimizer': 'Adam'}.
2026-06-22 10:33:39,667 - optuna.study.study - INFO - Trial 5 finished with values: [0.03187707491757617, 0.0068176076796766455, 0.018258445235974103] and parameters: {'n_layers': 1, 'embedding_dim': 128, 'lr': 0.0005464989571285408, 'lambda_val': 7.724967695086265e-05, 'batch_size': 2900, 'optimizer': 'RMSprop'}.
2026-06-22 10:34:02,186 - experiment_functions - INFO - Early stopping at epoch 500. Best Metrics: (0.0004052645351957619, 0.00010104837691044589, 0.00023775479804584977)
2026-06-22 10:34:02,268 - optuna.study.study - INFO - Trial 6 finished with values: [0.0004052645351957619, 0.00010104837691044589, 0.00023775479804584977] and parameters: {'n_layers': 2, 'embedding_dim': 32, 'lr': 0.0005141610476404116, 'lambda_val': 2.1319247684418498e-05, 'batch_size': 4028, 'optimizer': 'SGD'}.
2026-06-22 10:34:33,169 - experiment_functions - INFO - Early stopping at epoch 500. Best Metrics: (0.0005363615108049316, 0.0001405203991410888, 0.0003204142191843534)
2026-06-22 10:34:33,255 - optuna.study.study - INFO - Trial 7 finished with values: [0.0005363615108049316, 0.0001405203991410888, 0.0003204142191843534] and parameters: {'n_layers': 3, 'embedding_dim': 256, 'lr': 0.0785928281370131, 'lambda_val': 0.0004971246524848312, 'batch_size': 1501, 'optimizer': 'SGD'}.
2026-06-22 10:35:03,590 - experiment_functions - INFO - Early stopping at epoch 650. Best Metrics: (0.02432083497687321, 0.005260831122900089, 0.014022342079990148)
2026-06-22 10:35:03,684 - optuna.study.study - INFO - Trial 8 finished with values: [0.02432083497687321, 0.005260831122900089, 0.014022342079990148] and parameters: {'n_layers': 2, 'embedding_dim': 64, 'lr': 0.0030078366574997767, 'lambda_val': 0.00023620858897053303, 'batch_size': 2558, 'optimizer': 'Adam'}.
2026-06-22 10:35:26,652 - experiment_functions - INFO - Early stopping at epoch 500. Best Metrics: (0.0006303360756576217, 0.00014525704180876596, 0.00033321605740254897)
2026-06-22 10:35:26,739 - optuna.study.study - INFO - Trial 9 finished with values: [0.0006303360756576217, 0.00014525704180876596, 0.00033321605740254897] and parameters: {'n_layers': 4, 'embedding_dim': 32, 'lr': 0.0009993547791746632, 'lambda_val': 0.0002411343501283795, 'batch_size': 2030, 'optimizer': 'SGD'}.
2026-06-22 10:35:52,831 - experiment_functions - INFO - Early stopping at epoch 500. Best Metrics: (0.0004617016333049272, 0.00010736390046734875, 0.0002577630813347235)
2026-06-22 10:35:52,927 - optuna.study.study - INFO - Trial 10 finished with values: [0.0004617016333049272, 0.00010736390046734875, 0.0002577630813347235] and parameters: {'n_layers': 4, 'embedding_dim': 96, 'lr': 0.0003858062661301674, 'lambda_val': 0.000474805591472349, 'batch_size': 2105, 'optimizer': 'SGD'}.
2026-06-22 10:36:28,471 - experiment_functions - INFO - Early stopping at epoch 650. Best Metrics: (0.0071236566372503834, 0.0015046734874321081, 0.003904321419595306)
2026-06-22 10:36:29,048 - optuna.study.study - INFO - Trial 11 finished with values: [0.0071236566372503834, 0.0015046734874321081, 0.003904321419595306] and parameters: {'n_layers': 4, 'embedding_dim': 128, 'lr': 0.03145978398108285, 'lambda_val': 7.1167558569830065e-06, 'batch_size': 1357, 'optimizer': 'Adam'}.
2026-06-22 10:37:03,025 - experiment_functions - INFO - Early stopping at epoch 500. Best Metrics: (0.0004588188378657181, 0.00010894278135657447, 0.00025005813652210937)
2026-06-22 10:37:03,175 - optuna.study.study - INFO - Trial 12 finished with values: [0.0004588188378657181, 0.00010894278135657447, 0.00025005813652210937] and parameters: {'n_layers': 4, 'embedding_dim': 256, 'lr': 0.00022617967523292067, 'lambda_val': 9.728739357295898e-05, 'batch_size': 1080, 'optimizer': 'SGD'}.
2026-06-22 10:38:24,297 - experiment_functions - INFO - Early stopping at epoch 1800. Best Metrics: (0.01440894177902948, 0.0029209296450675767, 0.008147942812055343)
2026-06-22 10:38:24,376 - optuna.study.study - INFO - Trial 13 finished with values: [0.01440894177902948, 0.0029209296450675767, 0.008147942812055343] and parameters: {'n_layers': 2, 'embedding_dim': 96, 'lr': 0.012198273658959155, 'lambda_val': 1.8210976230104926e-06, 'batch_size': 2234, 'optimizer': 'RMSprop'}.
2026-06-22 10:41:41,758 - optuna.study.study - INFO - Trial 14 finished with values: [0.019548273855837905, 0.00441612984716433, 0.011349432836521829] and parameters: {'n_layers': 3, 'embedding_dim': 128, 'lr': 0.00018380672173173005, 'lambda_val': 0.00016615513360913103, 'batch_size': 2836, 'optimizer': 'Adam'}.
2026-06-22 10:45:34,534 - optuna.study.study - INFO - Trial 15 finished with values: [0.005520750988946624, 0.001365731969180245, 0.0033192950052479604] and parameters: {'n_layers': 3, 'embedding_dim': 256, 'lr': 9.664753376976555e-05, 'lambda_val': 0.002300370848452134, 'batch_size': 2973, 'optimizer': 'RMSprop'}.
2026-06-22 10:47:57,194 - experiment_functions - INFO - Early stopping at epoch 3350. Best Metrics: (0.0007261979616633828, 0.0001499936844764431, 0.0003965223437163517)
2026-06-22 10:47:57,284 - optuna.study.study - INFO - Trial 16 finished with values: [0.0007261979616633828, 0.0001499936844764431, 0.0003965223437163517] and parameters: {'n_layers': 1, 'embedding_dim': 128, 'lr': 0.00012659283347610744, 'lambda_val': 4.780089926877052e-06, 'batch_size': 2456, 'optimizer': 'RMSprop'}.
2026-06-22 10:51:07,645 - optuna.study.study - INFO - Trial 17 finished with values: [0.0006056069861996534, 0.00013736263736263736, 0.0003124543576296722] and parameters: {'n_layers': 1, 'embedding_dim': 256, 'lr': 0.00013651672920024816, 'lambda_val': 3.113943166258193e-06, 'batch_size': 2511, 'optimizer': 'Adam'}.
2026-06-22 10:53:58,909 - optuna.study.study - INFO - Trial 18 finished with values: [0.012969704116562328, 0.0027551471516988764, 0.0073806178951572685] and parameters: {'n_layers': 2, 'embedding_dim': 64, 'lr': 0.006755951067799471, 'lambda_val': 7.937877230100435e-06, 'batch_size': 2290, 'optimizer': 'RMSprop'}.
2026-06-22 10:57:13,144 - optuna.study.study - INFO - Trial 19 finished with values: [0.006331710889931056, 0.0015046734874321083, 0.0038967381991464435] and parameters: {'n_layers': 4, 'embedding_dim': 96, 'lr': 8.437479263401244e-05, 'lambda_val': 0.00011037084670764752, 'batch_size': 3667, 'optimizer': 'Adam'}.
2026-06-22 10:57:42,225 - experiment_functions - INFO - Early stopping at epoch 500. Best Metrics: (0.0007313770133854134, 0.00015946696981179742, 0.0003465953612896225)
2026-06-22 10:57:42,314 - optuna.study.study - INFO - Trial 20 finished with values: [0.0007313770133854134, 0.00015946696981179742, 0.0003465953612896225] and parameters: {'n_layers': 2, 'embedding_dim': 256, 'lr': 3.754079000876886e-05, 'lambda_val': 0.0003069591356068849, 'batch_size': 575, 'optimizer': 'Adam'}.
2026-06-22 10:58:15,973 - experiment_functions - INFO - Early stopping at epoch 500. Best Metrics: (0.000522706578396708, 0.00013262599469496023, 0.00028030550449891146)
2026-06-22 10:58:16,077 - optuna.study.study - INFO - Trial 21 finished with values: [0.000522706578396708, 0.00013262599469496023, 0.00028030550449891146] and parameters: {'n_layers': 4, 'embedding_dim': 256, 'lr': 0.0023257462582252993, 'lambda_val': 1.487570127678175e-06, 'batch_size': 1728, 'optimizer': 'SGD'}.
2026-06-22 11:00:43,201 - experiment_functions - INFO - Early stopping at epoch 3100. Best Metrics: (0.004977731066979202, 0.001121005431350259, 0.002751914457229141)
2026-06-22 11:00:43,280 - optuna.study.study - INFO - Trial 22 finished with values: [0.004977731066979202, 0.001121005431350259, 0.002751914457229141] and parameters: {'n_layers': 1, 'embedding_dim': 256, 'lr': 0.02423791313291444, 'lambda_val': 0.03570221203084909, 'batch_size': 2242, 'optimizer': 'RMSprop'}.
2026-06-22 11:03:47,172 - experiment_functions - INFO - Early stopping at epoch 3400. Best Metrics: (0.027949997864070805, 0.0060629026146267525, 0.016137753177856144)
2026-06-22 11:03:47,241 - optuna.study.study - INFO - Trial 23 finished with values: [0.027949997864070805, 0.0060629026146267525, 0.016137753177856144] and parameters: {'n_layers': 2, 'embedding_dim': 256, 'lr': 0.0005652244898304067, 'lambda_val': 1.3761340713703872e-05, 'batch_size': 862, 'optimizer': 'RMSprop'}.
2026-06-22 11:04:15,712 - experiment_functions - INFO - Early stopping at epoch 600. Best Metrics: (0.011038193790024345, 0.0024172666414045726, 0.005607666277904127)
2026-06-22 11:04:15,790 - optuna.study.study - INFO - Trial 24 finished with values: [0.011038193790024345, 0.0024172666414045726, 0.005607666277904127] and parameters: {'n_layers': 3, 'embedding_dim': 64, 'lr': 0.003154552172712802, 'lambda_val': 0.01010441170406253, 'batch_size': 3167, 'optimizer': 'Adam'}.
2026-06-22 11:04:42,383 - experiment_functions - INFO - Early stopping at epoch 550. Best Metrics: (0.008483247328349682, 0.0018678160919540232, 0.004965077948303546)
2026-06-22 11:04:42,477 - optuna.study.study - INFO - Trial 25 finished with values: [0.008483247328349682, 0.0018678160919540232, 0.004965077948303546] and parameters: {'n_layers': 2, 'embedding_dim': 96, 'lr': 0.029615604839337218, 'lambda_val': 1.0095379189149863e-06, 'batch_size': 1887, 'optimizer': 'RMSprop'}.
2026-06-22 11:07:30,596 - optuna.study.study - INFO - Trial 26 finished with values: [0.029869111780970067, 0.006533409119616016, 0.017376505222229673] and parameters: {'n_layers': 1, 'embedding_dim': 64, 'lr': 0.0006753032109319728, 'lambda_val': 5.915966748772391e-06, 'batch_size': 2674, 'optimizer': 'RMSprop'}.
2026-06-22 11:08:01,868 - experiment_functions - INFO - Early stopping at epoch 600. Best Metrics: (0.019654685757394083, 0.004321396993810787, 0.011063210460357586)
2026-06-22 11:08:01,965 - optuna.study.study - INFO - Trial 27 finished with values: [0.019654685757394083, 0.004321396993810787, 0.011063210460357586] and parameters: {'n_layers': 1, 'embedding_dim': 256, 'lr': 0.008091829333064989, 'lambda_val': 0.0019833934915702706, 'batch_size': 3042, 'optimizer': 'Adam'}.
2026-06-22 11:08:33,594 - experiment_functions - INFO - Early stopping at epoch 500. Best Metrics: (0.0043546851730112265, 0.0009915371984337501, 0.0025008671442417465)
2026-06-22 11:08:33,670 - optuna.study.study - INFO - Trial 28 finished with values: [0.0043546851730112265, 0.0009915371984337501, 0.0025008671442417465] and parameters: {'n_layers': 3, 'embedding_dim': 256, 'lr': 0.04540134922123185, 'lambda_val': 0.05083032350615391, 'batch_size': 1950, 'optimizer': 'RMSprop'}.
2026-06-22 11:08:55,449 - experiment_functions - INFO - Early stopping at epoch 500. Best Metrics: (0.0006127491501472669, 0.0001278893520272831, 0.0003659708603307856)
2026-06-22 11:08:55,543 - optuna.study.study - INFO - Trial 29 finished with values: [0.0006127491501472669, 0.0001278893520272831, 0.0003659708603307856] and parameters: {'n_layers': 1, 'embedding_dim': 32, 'lr': 2.1019426934466156e-05, 'lambda_val': 0.000202759716039535, 'batch_size': 2105, 'optimizer': 'SGD'}.
2026-06-22 11:09:26,645 - experiment_functions - INFO - Early stopping at epoch 500. Best Metrics: (0.00043513753979014324, 0.00010736390046734875, 0.0002486799150304947)
2026-06-22 11:09:26,717 - optuna.study.study - INFO - Trial 30 finished with values: [0.00043513753979014324, 0.00010736390046734875, 0.0002486799150304947] and parameters: {'n_layers': 3, 'embedding_dim': 256, 'lr': 0.0008522229271335977, 'lambda_val': 0.0012724890260555712, 'batch_size': 3034, 'optimizer': 'SGD'}.
2026-06-22 11:12:54,243 - optuna.study.study - INFO - Trial 31 finished with values: [0.01914453914942439, 0.0042835038524693695, 0.010957228580456713] and parameters: {'n_layers': 4, 'embedding_dim': 128, 'lr': 0.00016427114027444753, 'lambda_val': 1.5980539146025577e-06, 'batch_size': 2085, 'optimizer': 'RMSprop'}.
2026-06-22 11:13:28,136 - experiment_functions - INFO - Early stopping at epoch 650. Best Metrics: (0.010013116714524577, 0.0021914866742452953, 0.005854832771046857)
2026-06-22 11:13:28,215 - optuna.study.study - INFO - Trial 32 finished with values: [0.010013116714524577, 0.0021914866742452953, 0.005854832771046857] and parameters: {'n_layers': 4, 'embedding_dim': 96, 'lr': 0.002037510837864816, 'lambda_val': 3.154143842771189e-05, 'batch_size': 1499, 'optimizer': 'RMSprop'}.
2026-06-22 11:14:01,248 - experiment_functions - INFO - Early stopping at epoch 750. Best Metrics: (0.01187663427469795, 0.002594101300997853, 0.00678945804413046)
2026-06-22 11:14:01,396 - optuna.study.study - INFO - Trial 33 finished with values: [0.01187663427469795, 0.002594101300997853, 0.00678945804413046] and parameters: {'n_layers': 1, 'embedding_dim': 64, 'lr': 0.012496828920097607, 'lambda_val': 2.9063354533630173e-06, 'batch_size': 2360, 'optimizer': 'RMSprop'}.
2026-06-22 11:14:30,382 - experiment_functions - INFO - Early stopping at epoch 550. Best Metrics: (0.0037315674174993796, 0.0008368068712896299, 0.0021432250704605687)
2026-06-22 11:14:30,466 - optuna.study.study - INFO - Trial 34 finished with values: [0.0037315674174993796, 0.0008368068712896299, 0.0021432250704605687] and parameters: {'n_layers': 3, 'embedding_dim': 128, 'lr': 0.018292994483412973, 'lambda_val': 0.011645098629560957, 'batch_size': 1395, 'optimizer': 'Adam'}.
2026-06-22 11:14:52,892 - experiment_functions - INFO - Early stopping at epoch 500. Best Metrics: (0.0006374530948742156, 0.00012473159024883163, 0.00032449252512483897)
2026-06-22 11:14:52,983 - optuna.study.study - INFO - Trial 35 finished with values: [0.0006374530948742156, 0.00012473159024883163, 0.00032449252512483897] and parameters: {'n_layers': 1, 'embedding_dim': 64, 'lr': 0.0004673948260611741, 'lambda_val': 0.011515132219723829, 'batch_size': 2548, 'optimizer': 'Adam'}.
2026-06-22 11:15:17,024 - experiment_functions - INFO - Early stopping at epoch 500. Best Metrics: (0.0004683254632936969, 8.841732979664016e-05, 0.0002147299205735443)
2026-06-22 11:15:17,142 - optuna.study.study - INFO - Trial 36 finished with values: [0.0004683254632936969, 8.841732979664016e-05, 0.0002147299205735443] and parameters: {'n_layers': 3, 'embedding_dim': 64, 'lr': 3.6876795129924275e-05, 'lambda_val': 0.005284374988616417, 'batch_size': 3332, 'optimizer': 'RMSprop'}.
2026-06-22 11:15:41,114 - experiment_functions - INFO - Early stopping at epoch 500. Best Metrics: (0.0005633023231923743, 0.00012473159024883163, 0.00030576396735004134)
2026-06-22 11:15:41,202 - optuna.study.study - INFO - Trial 37 finished with values: [0.0005633023231923743, 0.00012473159024883163, 0.00030576396735004134] and parameters: {'n_layers': 2, 'embedding_dim': 96, 'lr': 0.0037496935269389748, 'lambda_val': 4.3525783133165405e-06, 'batch_size': 3980, 'optimizer': 'SGD'}.
2026-06-22 11:16:03,453 - experiment_functions - INFO - Early stopping at epoch 500. Best Metrics: (0.0005598575855508192, 0.00012157382847038021, 0.0003198167899624202)
2026-06-22 11:16:03,531 - optuna.study.study - INFO - Trial 38 finished with values: [0.0005598575855508192, 0.00012157382847038021, 0.0003198167899624202] and parameters: {'n_layers': 1, 'embedding_dim': 64, 'lr': 0.00044111771543226783, 'lambda_val': 2.436573270088667e-06, 'batch_size': 3195, 'optimizer': 'SGD'}.
2026-06-22 11:16:29,997 - experiment_functions - INFO - Early stopping at epoch 500. Best Metrics: (0.00035294197388747035, 9.946949602122017e-05, 0.00020058611211826123)
2026-06-22 11:16:30,084 - optuna.study.study - INFO - Trial 39 finished with values: [0.00035294197388747035, 9.946949602122017e-05, 0.00020058611211826123] and parameters: {'n_layers': 3, 'embedding_dim': 128, 'lr': 1.2671255317344511e-05, 'lambda_val': 0.0012516594552280486, 'batch_size': 1772, 'optimizer': 'RMSprop'}.
2026-06-22 11:18:40,362 - experiment_functions - INFO - Early stopping at epoch 3150. Best Metrics: (0.03232885919589453, 0.006853921940128837, 0.018943789709904083)
2026-06-22 11:18:40,442 - optuna.study.study - INFO - Trial 40 finished with values: [0.03232885919589453, 0.006853921940128837, 0.018943789709904083] and parameters: {'n_layers': 1, 'embedding_dim': 32, 'lr': 0.0010694394042823291, 'lambda_val': 3.90887208716658e-05, 'batch_size': 1785, 'optimizer': 'RMSprop'}.
2026-06-22 11:19:29,596 - experiment_functions - INFO - Early stopping at epoch 1050. Best Metrics: (0.00045155292952790243, 9.946949602122017e-05, 0.00023509672604198273)
2026-06-22 11:19:29,683 - optuna.study.study - INFO - Trial 41 finished with values: [0.00045155292952790243, 9.946949602122017e-05, 0.00023509672604198273] and parameters: {'n_layers': 4, 'embedding_dim': 64, 'lr': 2.1405932534392546e-05, 'lambda_val': 0.0010658485741998815, 'batch_size': 1465, 'optimizer': 'Adam'}.
2026-06-22 11:19:56,268 - experiment_functions - INFO - Early stopping at epoch 500. Best Metrics: (0.0006106741766436838, 0.0001310471138057345, 0.0003398492368317799)
2026-06-22 11:19:56,369 - optuna.study.study - INFO - Trial 42 finished with values: [0.0006106741766436838, 0.0001310471138057345, 0.0003398492368317799] and parameters: {'n_layers': 3, 'embedding_dim': 128, 'lr': 3.942383174703645e-05, 'lambda_val': 0.014813177791696839, 'batch_size': 4096, 'optimizer': 'Adam'}.
2026-06-22 11:20:27,927 - experiment_functions - INFO - Early stopping at epoch 700. Best Metrics: (0.029676361672017683, 0.006274472653782999, 0.017315555849807266)
2026-06-22 11:20:28,002 - optuna.study.study - INFO - Trial 43 finished with values: [0.029676361672017683, 0.006274472653782999, 0.017315555849807266] and parameters: {'n_layers': 1, 'embedding_dim': 64, 'lr': 0.003916255753855854, 'lambda_val': 4.627893684414806e-05, 'batch_size': 2470, 'optimizer': 'Adam'}.
2026-06-22 11:21:02,568 - experiment_functions - INFO - Early stopping at epoch 600. Best Metrics: (0.012333176687720297, 0.002647783251231527, 0.006617639562260826)
2026-06-22 11:21:02,637 - optuna.study.study - INFO - Trial 44 finished with values: [0.012333176687720297, 0.002647783251231527, 0.006617639562260826] and parameters: {'n_layers': 2, 'embedding_dim': 256, 'lr': 0.001487817598059853, 'lambda_val': 0.0019557106412169583, 'batch_size': 3627, 'optimizer': 'RMSprop'}.
2026-06-22 11:21:29,279 - experiment_functions - INFO - Early stopping at epoch 500. Best Metrics: (0.0005202345292934439, 0.00010420613868889732, 0.00023101040509739833)
2026-06-22 11:21:29,362 - optuna.study.study - INFO - Trial 45 finished with values: [0.0005202345292934439, 0.00010420613868889732, 0.00023101040509739833] and parameters: {'n_layers': 4, 'embedding_dim': 96, 'lr': 1.620991145410387e-05, 'lambda_val': 0.002908785807000545, 'batch_size': 958, 'optimizer': 'SGD'}.
2026-06-22 11:21:53,972 - experiment_functions - INFO - Early stopping at epoch 550. Best Metrics: (0.0035529676626098036, 0.0008273335859542757, 0.0020127239906903315)
2026-06-22 11:21:54,058 - optuna.study.study - INFO - Trial 46 finished with values: [0.0035529676626098036, 0.0008273335859542757, 0.0020127239906903315] and parameters: {'n_layers': 2, 'embedding_dim': 32, 'lr': 0.011398535339603428, 'lambda_val': 0.038774820121888605, 'batch_size': 2300, 'optimizer': 'Adam'}.
2026-06-22 11:22:18,887 - experiment_functions - INFO - Early stopping at epoch 500. Best Metrics: (0.0005166015847064692, 0.0001215738284703802, 0.00028734888559667286)
2026-06-22 11:22:18,974 - optuna.study.study - INFO - Trial 47 finished with values: [0.0005166015847064692, 0.0001215738284703802, 0.00028734888559667286] and parameters: {'n_layers': 2, 'embedding_dim': 128, 'lr': 0.004805248979306267, 'lambda_val': 1.423487767376446e-05, 'batch_size': 3981, 'optimizer': 'SGD'}.
2026-06-22 11:22:41,403 - experiment_functions - INFO - Early stopping at epoch 500. Best Metrics: (0.00045969704626636174, 0.00010578501957812305, 0.00027275781646481204)
2026-06-22 11:22:41,491 - optuna.study.study - INFO - Trial 48 finished with values: [0.00045969704626636174, 0.00010578501957812305, 0.00027275781646481204] and parameters: {'n_layers': 1, 'embedding_dim': 64, 'lr': 0.03830114470687615, 'lambda_val': 0.030456595702826265, 'batch_size': 1364, 'optimizer': 'SGD'}.
2026-06-22 11:23:10,596 - experiment_functions - INFO - Early stopping at epoch 600. Best Metrics: (0.021048766543688473, 0.004474548440065681, 0.011710318836807466)
