2026-06-23 08:26:54,168 - optuna.study.study - INFO - Trial 114 finished with values: [0.02091886612500936, 0.004540861437413162, 0.011659150608458105] and parameters: {'n_layers': 3, 'embedding_dim': 128, 'lr': 0.0016748199551028732, 'lambda_val': 0.00019730135054936066, 'batch_size': 3397, 'optimizer': 'Adam'}.
2026-06-23 08:27:33,700 - experiment_functions - INFO - Early stopping at epoch 900. Best Metrics: (0.02069214229245204, 0.004664014146772767, 0.011637500256637534)
2026-06-23 08:27:33,809 - optuna.study.study - INFO - Trial 115 finished with values: [0.02069214229245204, 0.004664014146772767, 0.011637500256637534] and parameters: {'n_layers': 2, 'embedding_dim': 32, 'lr': 0.0009472628048121326, 'lambda_val': 0.019684317126267517, 'batch_size': 3610, 'optimizer': 'Adam'}.
2026-06-23 08:29:19,694 - experiment_functions - INFO - Early stopping at epoch 2400. Best Metrics: (0.03202907557338273, 0.0068460275356827084, 0.017955915729582658)
2026-06-23 08:29:19,808 - optuna.study.study - INFO - Trial 116 finished with values: [0.03202907557338273, 0.0068460275356827084, 0.017955915729582658] and parameters: {'n_layers': 1, 'embedding_dim': 96, 'lr': 0.0008906516956334841, 'lambda_val': 0.0010657666266185159, 'batch_size': 3129, 'optimizer': 'RMSprop'}.
2026-06-23 08:29:57,699 - experiment_functions - INFO - Early stopping at epoch 850. Best Metrics: (0.018398994172461425, 0.003966148793735, 0.010514724701174746)
2026-06-23 08:29:57,857 - optuna.study.study - INFO - Trial 117 finished with values: [0.018398994172461425, 0.003966148793735, 0.010514724701174746] and parameters: {'n_layers': 2, 'embedding_dim': 32, 'lr': 0.0017924637075651337, 'lambda_val': 0.0010657666266185159, 'batch_size': 2100, 'optimizer': 'RMSprop'}.
2026-06-23 08:32:39,450 - optuna.study.study - INFO - Trial 118 finished with values: [0.007314236899893314, 0.0018567639257294432, 0.004575582643893417] and parameters: {'n_layers': 1, 'embedding_dim': 32, 'lr': 0.0003681355466910888, 'lambda_val': 6.789699211207431e-05, 'batch_size': 3285, 'optimizer': 'Adam'}.
2026-06-23 08:33:17,591 - experiment_functions - INFO - Early stopping at epoch 850. Best Metrics: (0.016434060617016983, 0.0035824807376531515, 0.008874094439799885)
2026-06-23 08:33:17,698 - optuna.study.study - INFO - Trial 119 finished with values: [0.016434060617016983, 0.0035824807376531515, 0.008874094439799885] and parameters: {'n_layers': 3, 'embedding_dim': 32, 'lr': 0.0008906516956334841, 'lambda_val': 0.007151036194229829, 'batch_size': 3372, 'optimizer': 'RMSprop'}.
2026-06-23 08:33:52,508 - experiment_functions - INFO - Early stopping at epoch 700. Best Metrics: (0.004736110736143767, 0.0010783756473411647, 0.002522426097549809)
2026-06-23 08:33:52,839 - optuna.study.study - INFO - Trial 120 finished with values: [0.004736110736143767, 0.0010783756473411647, 0.002522426097549809] and parameters: {'n_layers': 2, 'embedding_dim': 96, 'lr': 0.0016017140638771422, 'lambda_val': 0.07063684682935711, 'batch_size': 3253, 'optimizer': 'RMSprop'}.
2026-06-23 08:36:39,341 - experiment_functions - INFO - Early stopping at epoch 3700. Best Metrics: (0.03308278127343175, 0.006953391436150057, 0.018986877372500884)
2026-06-23 08:36:39,451 - optuna.study.study - INFO - Trial 121 finished with values: [0.03308278127343175, 0.006953391436150057, 0.018986877372500884] and parameters: {'n_layers': 1, 'embedding_dim': 96, 'lr': 0.0008873329418261425, 'lambda_val': 0.0001268815967640493, 'batch_size': 1760, 'optimizer': 'RMSprop'}.
2026-06-23 08:37:10,066 - experiment_functions - INFO - Early stopping at epoch 550. Best Metrics: (0.005316869658035684, 0.0012141594038145764, 0.003024670948709152)
2026-06-23 08:37:10,197 - optuna.study.study - INFO - Trial 122 finished with values: [0.005316869658035684, 0.0012141594038145764, 0.003024670948709152] and parameters: {'n_layers': 4, 'embedding_dim': 128, 'lr': 0.0017924637075651337, 'lambda_val': 0.06837615802363052, 'batch_size': 786, 'optimizer': 'RMSprop'}.
2026-06-23 08:37:37,100 - experiment_functions - INFO - Early stopping at epoch 550. Best Metrics: (0.012977502857365352, 0.002889352027283062, 0.006989793192836662)
2026-06-23 08:37:37,213 - optuna.study.study - INFO - Trial 123 finished with values: [0.012977502857365352, 0.002889352027283062, 0.006989793192836662] and parameters: {'n_layers': 2, 'embedding_dim': 96, 'lr': 0.005823892895958369, 'lambda_val': 0.007151036194229829, 'batch_size': 3285, 'optimizer': 'Adam'}.
2026-06-23 08:38:19,022 - experiment_functions - INFO - Early stopping at epoch 900. Best Metrics: (0.030448217565714503, 0.006457622836933182, 0.017689822844621325)
2026-06-23 08:38:19,142 - optuna.study.study - INFO - Trial 124 finished with values: [0.030448217565714503, 0.006457622836933182, 0.017689822844621325] and parameters: {'n_layers': 1, 'embedding_dim': 96, 'lr': 0.0024861194796259945, 'lambda_val': 0.0006793861457506547, 'batch_size': 3365, 'optimizer': 'Adam'}.
2026-06-23 08:38:48,933 - experiment_functions - INFO - Early stopping at epoch 650. Best Metrics: (0.019768318453443987, 0.004311923708475433, 0.011273914847632354)
2026-06-23 08:38:49,085 - optuna.study.study - INFO - Trial 125 finished with values: [0.019768318453443987, 0.004311923708475433, 0.011273914847632354] and parameters: {'n_layers': 3, 'embedding_dim': 32, 'lr': 0.0024861194796259945, 'lambda_val': 6.789699211207431e-05, 'batch_size': 3285, 'optimizer': 'Adam'}.
2026-06-23 08:42:01,478 - optuna.study.study - INFO - Trial 126 finished with values: [0.025403079405684297, 0.005470822281167109, 0.014615017271642484] and parameters: {'n_layers': 3, 'embedding_dim': 96, 'lr': 0.0003681355466910888, 'lambda_val': 6.789699211207431e-05, 'batch_size': 3285, 'optimizer': 'Adam'}.
2026-06-23 08:43:08,609 - experiment_functions - INFO - Early stopping at epoch 1450. Best Metrics: (0.03248096880341685, 0.0068412908930150325, 0.018623424478960073)
2026-06-23 08:43:08,761 - optuna.study.study - INFO - Trial 127 finished with values: [0.03248096880341685, 0.0068412908930150325, 0.018623424478960073] and parameters: {'n_layers': 1, 'embedding_dim': 128, 'lr': 0.0016017140638771422, 'lambda_val': 1.033711147166284e-06, 'batch_size': 3253, 'optimizer': 'Adam'}.
2026-06-23 08:45:56,287 - optuna.study.study - INFO - Trial 128 finished with values: [0.024485758075545344, 0.005333459643804472, 0.014084387706491997] and parameters: {'n_layers': 2, 'embedding_dim': 32, 'lr': 0.0003681355466910888, 'lambda_val': 0.0010657666266185159, 'batch_size': 2100, 'optimizer': 'RMSprop'}.
2026-06-23 08:46:23,737 - experiment_functions - INFO - Early stopping at epoch 600. Best Metrics: (0.0005752232554666891, 0.00013578375647341163, 0.0003074338725989485)
2026-06-23 08:46:23,881 - optuna.study.study - INFO - Trial 129 finished with values: [0.0005752232554666891, 0.00013578375647341163, 0.0003074338725989485] and parameters: {'n_layers': 2, 'embedding_dim': 64, 'lr': 9.637820721644545e-05, 'lambda_val': 2.4585068974937548e-06, 'batch_size': 1819, 'optimizer': 'Adam'}.
2026-06-23 08:47:17,845 - experiment_functions - INFO - Early stopping at epoch 1250. Best Metrics: (0.031773219214414596, 0.006786030061892132, 0.018244885949712956)
2026-06-23 08:47:17,952 - optuna.study.study - INFO - Trial 130 finished with values: [0.031773219214414596, 0.006786030061892132, 0.018244885949712956] and parameters: {'n_layers': 1, 'embedding_dim': 32, 'lr': 0.0014237233114405305, 'lambda_val': 0.0010657666266185159, 'batch_size': 2100, 'optimizer': 'RMSprop'}.
2026-06-23 08:47:49,160 - experiment_functions - INFO - Early stopping at epoch 700. Best Metrics: (0.0005251028265230571, 0.00011841606669192877, 0.00025916102017216)
2026-06-23 08:47:49,267 - optuna.study.study - INFO - Trial 131 finished with values: [0.0005251028265230571, 0.00011841606669192877, 0.00025916102017216] and parameters: {'n_layers': 3, 'embedding_dim': 32, 'lr': 9.569316360470486e-05, 'lambda_val': 0.0010797193056675054, 'batch_size': 2469, 'optimizer': 'Adam'}.
2026-06-23 08:48:25,235 - experiment_functions - INFO - Early stopping at epoch 750. Best Metrics: (0.01616756869465538, 0.0035066944549703174, 0.008920431732613202)
2026-06-23 08:48:25,547 - optuna.study.study - INFO - Trial 132 finished with values: [0.01616756869465538, 0.0035066944549703174, 0.008920431732613202] and parameters: {'n_layers': 2, 'embedding_dim': 96, 'lr': 0.0017924637075651337, 'lambda_val': 0.0001268815967640493, 'batch_size': 3090, 'optimizer': 'RMSprop'}.
2026-06-23 08:49:47,055 - experiment_functions - INFO - Early stopping at epoch 1800. Best Metrics: (0.030844494265083837, 0.006522356953391436, 0.01773634111878908)
2026-06-23 08:49:47,182 - optuna.study.study - INFO - Trial 133 finished with values: [0.030844494265083837, 0.006522356953391436, 0.01773634111878908] and parameters: {'n_layers': 1, 'embedding_dim': 128, 'lr': 0.0016017140638771422, 'lambda_val': 0.0027380357457200996, 'batch_size': 873, 'optimizer': 'Adam'}.
2026-06-23 08:51:42,161 - experiment_functions - INFO - Early stopping at epoch 2600. Best Metrics: (0.03310213107365018, 0.00698181129215612, 0.019277867108170636)
2026-06-23 08:51:42,275 - optuna.study.study - INFO - Trial 134 finished with values: [0.03310213107365018, 0.00698181129215612, 0.019277867108170636] and parameters: {'n_layers': 1, 'embedding_dim': 96, 'lr': 0.0008834137156031282, 'lambda_val': 3.447042784972302e-05, 'batch_size': 3426, 'optimizer': 'RMSprop'}.
2026-06-23 08:55:13,116 - optuna.study.study - INFO - Trial 135 finished with values: [0.02402282113507151, 0.005229253505115575, 0.013700328228544783] and parameters: {'n_layers': 4, 'embedding_dim': 128, 'lr': 0.00031010998647899147, 'lambda_val': 1.6187020703181773e-05, 'batch_size': 1903, 'optimizer': 'Adam'}.
2026-06-23 08:55:38,193 - experiment_functions - INFO - Early stopping at epoch 550. Best Metrics: (0.011373955014601858, 0.0025735758494379183, 0.006974968908546455)
2026-06-23 08:55:38,394 - optuna.study.study - INFO - Trial 136 finished with values: [0.011373955014601858, 0.0025735758494379183, 0.006974968908546455] and parameters: {'n_layers': 2, 'embedding_dim': 32, 'lr': 0.003127312974080546, 'lambda_val': 0.00011928197551215342, 'batch_size': 786, 'optimizer': 'RMSprop'}.
2026-06-23 08:56:10,257 - experiment_functions - INFO - Early stopping at epoch 600. Best Metrics: (0.015258066090031885, 0.0032288114184665915, 0.008540790566213393)
2026-06-23 08:56:10,384 - optuna.study.study - INFO - Trial 137 finished with values: [0.015258066090031885, 0.0032288114184665915, 0.008540790566213393] and parameters: {'n_layers': 4, 'embedding_dim': 96, 'lr': 0.002568897648085955, 'lambda_val': 5.8617508553429225e-05, 'batch_size': 3372, 'optimizer': 'Adam'}.
2026-06-23 08:56:45,059 - experiment_functions - INFO - Early stopping at epoch 650. Best Metrics: (0.0198375820634483, 0.004324554755589239, 0.011227021796501431)
2026-06-23 08:56:45,182 - optuna.study.study - INFO - Trial 138 finished with values: [0.0198375820634483, 0.004324554755589239, 0.011227021796501431] and parameters: {'n_layers': 3, 'embedding_dim': 128, 'lr': 0.0016017140638771422, 'lambda_val': 0.0006793861457506547, 'batch_size': 3285, 'optimizer': 'Adam'}.
2026-06-23 08:57:24,044 - experiment_functions - INFO - Early stopping at epoch 850. Best Metrics: (0.023869833853395795, 0.005235569028672477, 0.013751404326153311)
2026-06-23 08:57:24,160 - optuna.study.study - INFO - Trial 139 finished with values: [0.023869833853395795, 0.005235569028672477, 0.013751404326153311] and parameters: {'n_layers': 1, 'embedding_dim': 96, 'lr': 0.003808349234575029, 'lambda_val': 0.0010160497642274552, 'batch_size': 847, 'optimizer': 'Adam'}.
2026-06-23 08:57:58,189 - experiment_functions - INFO - Early stopping at epoch 750. Best Metrics: (0.013019975092050927, 0.0029382973348490594, 0.006961943314820976)
2026-06-23 08:57:58,440 - optuna.study.study - INFO - Trial 140 finished with values: [0.013019975092050927, 0.0029382973348490594, 0.006961943314820976] and parameters: {'n_layers': 4, 'embedding_dim': 32, 'lr': 0.0009472628048121326, 'lambda_val': 0.019684317126267517, 'batch_size': 3372, 'optimizer': 'Adam'}.
2026-06-23 09:01:11,782 - optuna.study.study - INFO - Trial 141 finished with values: [0.024655119409536606, 0.005469243400277882, 0.014665018025852941] and parameters: {'n_layers': 1, 'embedding_dim': 256, 'lr': 0.00037748801596819556, 'lambda_val': 1.5553043024267715e-06, 'batch_size': 2813, 'optimizer': 'RMSprop'}.
2026-06-23 09:01:36,802 - experiment_functions - INFO - Early stopping at epoch 500. Best Metrics: (0.00045902777989624473, 0.00011841606669192877, 0.00027223583224026906)
2026-06-23 09:01:36,911 - optuna.study.study - INFO - Trial 142 finished with values: [0.00045902777989624473, 0.00011841606669192877, 0.00027223583224026906] and parameters: {'n_layers': 2, 'embedding_dim': 128, 'lr': 9.37824474498609e-05, 'lambda_val': 0.06837615802363052, 'batch_size': 886, 'optimizer': 'RMSprop'}.
2026-06-23 09:02:25,995 - experiment_functions - INFO - Early stopping at epoch 950. Best Metrics: (0.01884075304063953, 0.004040356195528609, 0.010597993745161507)
2026-06-23 09:02:26,118 - optuna.study.study - INFO - Trial 143 finished with values: [0.01884075304063953, 0.004040356195528609, 0.010597993745161507] and parameters: {'n_layers': 3, 'embedding_dim': 128, 'lr': 0.0008834137156031282, 'lambda_val': 4.782028134253512e-05, 'batch_size': 1976, 'optimizer': 'RMSprop'}.
2026-06-23 09:02:54,414 - experiment_functions - INFO - Early stopping at epoch 600. Best Metrics: (0.02028426498406915, 0.0044445497031703925, 0.011511446445083996)
2026-06-23 09:02:54,597 - optuna.study.study - INFO - Trial 144 finished with values: [0.02028426498406915, 0.0044445497031703925, 0.011511446445083996] and parameters: {'n_layers': 2, 'embedding_dim': 64, 'lr': 0.003808349234575029, 'lambda_val': 0.0006793861457506547, 'batch_size': 2405, 'optimizer': 'Adam'}.
2026-06-23 09:03:23,912 - experiment_functions - INFO - Early stopping at epoch 650. Best Metrics: (0.028878134005849068, 0.006138688897309587, 0.01655656865014262)
2026-06-23 09:03:24,232 - optuna.study.study - INFO - Trial 145 finished with values: [0.028878134005849068, 0.006138688897309587, 0.01655656865014262] and parameters: {'n_layers': 1, 'embedding_dim': 32, 'lr': 0.005823892895958369, 'lambda_val': 0.0006793861457506547, 'batch_size': 3129, 'optimizer': 'Adam'}.
2026-06-23 09:03:55,868 - experiment_functions - INFO - Early stopping at epoch 600. Best Metrics: (0.009792297245264836, 0.002204117721359101, 0.0050515397981881595)
2026-06-23 09:03:55,994 - optuna.study.study - INFO - Trial 146 finished with values: [0.009792297245264836, 0.002204117721359101, 0.0050515397981881595] and parameters: {'n_layers': 3, 'embedding_dim': 128, 'lr': 0.0024861194796259945, 'lambda_val': 0.005422944155279863, 'batch_size': 1794, 'optimizer': 'Adam'}.
2026-06-23 09:06:44,260 - optuna.study.study - INFO - Trial 147 finished with values: [0.025719528286043306, 0.005541871921182266, 0.014938494405149818] and parameters: {'n_layers': 2, 'embedding_dim': 32, 'lr': 0.00037748801596819556, 'lambda_val': 0.0006793861457506547, 'batch_size': 3090, 'optimizer': 'Adam'}.
2026-06-23 09:07:35,313 - experiment_functions - INFO - Early stopping at epoch 1100. Best Metrics: (0.031468546757473084, 0.006549197928508273, 0.017980046417534357)
2026-06-23 09:07:35,418 - optuna.study.study - INFO - Trial 148 finished with values: [0.031468546757473084, 0.006549197928508273, 0.017980046417534357] and parameters: {'n_layers': 1, 'embedding_dim': 128, 'lr': 0.0016017140638771422, 'lambda_val': 3.447042784972302e-05, 'batch_size': 3397, 'optimizer': 'Adam'}.
2026-06-23 09:08:31,418 - experiment_functions - INFO - Early stopping at epoch 1150. Best Metrics: (0.011041488297378398, 0.002309902740937224, 0.005814072549120855)
2026-06-23 09:08:31,523 - optuna.study.study - INFO - Trial 149 finished with values: [0.011041488297378398, 0.002309902740937224, 0.005814072549120855] and parameters: {'n_layers': 3, 'embedding_dim': 96, 'lr': 0.0024861194796259945, 'lambda_val': 0.00019730135054936066, 'batch_size': 1103, 'optimizer': 'Adam'}.
2026-06-23 09:10:12,799 - experiment_functions - INFO - Early stopping at epoch 2100. Best Metrics: (0.024700594729943535, 0.005235569028672477, 0.013747465257188174)
2026-06-23 09:10:12,899 - optuna.study.study - INFO - Trial 150 finished with values: [0.024700594729943535, 0.005235569028672477, 0.013747465257188174] and parameters: {'n_layers': 3, 'embedding_dim': 96, 'lr': 0.00037748801596819556, 'lambda_val': 0.0006793861457506547, 'batch_size': 3365, 'optimizer': 'Adam'}.
2026-06-23 09:13:09,746 - optuna.study.study - INFO - Trial 151 finished with values: [0.026349301444873297, 0.005803966148793735, 0.015181417780636306] and parameters: {'n_layers': 2, 'embedding_dim': 64, 'lr': 0.00037748801596819556, 'lambda_val': 0.0006793861457506547, 'batch_size': 3090, 'optimizer': 'Adam'}.
2026-06-23 09:13:52,120 - experiment_functions - INFO - Early stopping at epoch 950. Best Metrics: (0.027368395296831518, 0.005751863079449287, 0.015505213867764447)
2026-06-23 09:13:52,316 - optuna.study.study - INFO - Trial 152 finished with values: [0.027368395296831518, 0.005751863079449287, 0.015505213867764447] and parameters: {'n_layers': 2, 'embedding_dim': 32, 'lr': 0.0014983681509322957, 'lambda_val': 0.0006793861457506547, 'batch_size': 3397, 'optimizer': 'Adam'}.
2026-06-23 09:16:58,948 - optuna.study.study - INFO - Trial 153 finished with values: [0.02438437304274675, 0.005380826070481244, 0.01402797604261672] and parameters: {'n_layers': 4, 'embedding_dim': 64, 'lr': 0.00031010998647899147, 'lambda_val': 4.540657949071036e-06, 'batch_size': 786, 'optimizer': 'RMSprop'}.
2026-06-23 09:17:43,627 - experiment_functions - INFO - Early stopping at epoch 950. Best Metrics: (0.030364531516768822, 0.006271314892004547, 0.017346640408898766)
2026-06-23 09:17:43,730 - optuna.study.study - INFO - Trial 154 finished with values: [0.030364531516768822, 0.006271314892004547, 0.017346640408898766] and parameters: {'n_layers': 1, 'embedding_dim': 128, 'lr': 0.0024861194796259945, 'lambda_val': 6.789699211207431e-05, 'batch_size': 3365, 'optimizer': 'Adam'}.
2026-06-23 09:18:12,857 - experiment_functions - INFO - Early stopping at epoch 550. Best Metrics: (0.009670940448387606, 0.002172540103574586, 0.005637367247747825)
2026-06-23 09:18:13,000 - optuna.study.study - INFO - Trial 155 finished with values: [0.009670940448387606, 0.002172540103574586, 0.005637367247747825] and parameters: {'n_layers': 3, 'embedding_dim': 128, 'lr': 0.0024861194796259945, 'lambda_val': 0.00019730135054936066, 'batch_size': 1760, 'optimizer': 'RMSprop'}.
2026-06-23 09:19:44,699 - experiment_functions - INFO - Early stopping at epoch 2150. Best Metrics: (0.028447339013453792, 0.006081849185297462, 0.015957537264888518)
2026-06-23 09:19:44,802 - optuna.study.study - INFO - Trial 156 finished with values: [0.028447339013453792, 0.006081849185297462, 0.015957537264888518] and parameters: {'n_layers': 2, 'embedding_dim': 32, 'lr': 0.0008834137156031282, 'lambda_val': 6.789699211207431e-05, 'batch_size': 3285, 'optimizer': 'Adam'}.
2026-06-23 09:22:36,733 - optuna.study.study - INFO - Trial 157 finished with values: [0.023823389019169982, 0.005164519388657319, 0.013142461337459999] and parameters: {'n_layers': 3, 'embedding_dim': 32, 'lr': 0.0004250720614417729, 'lambda_val': 0.0006793861457506547, 'batch_size': 3397, 'optimizer': 'Adam'}.
2026-06-23 09:23:20,124 - experiment_functions - INFO - Early stopping at epoch 1000. Best Metrics: (0.031114538647731765, 0.006486042692939246, 0.018079407786186125)
2026-06-23 09:23:20,228 - optuna.study.study - INFO - Trial 158 finished with values: [0.031114538647731765, 0.006486042692939246, 0.018079407786186125] and parameters: {'n_layers': 1, 'embedding_dim': 32, 'lr': 0.0024861194796259945, 'lambda_val': 0.0006793861457506547, 'batch_size': 3397, 'optimizer': 'Adam'}.
2026-06-23 09:26:15,625 - optuna.study.study - INFO - Trial 159 finished with values: [0.01696420174740832, 0.003876152583049135, 0.010377396827434746] and parameters: {'n_layers': 1, 'embedding_dim': 128, 'lr': 0.00036918389202660496, 'lambda_val': 4.782028134253512e-05, 'batch_size': 3429, 'optimizer': 'Adam'}.
2026-06-23 09:26:45,583 - experiment_functions - INFO - Early stopping at epoch 650. Best Metrics: (0.014953814716045228, 0.003473537956296577, 0.008110293244611749)
2026-06-23 09:26:45,719 - optuna.study.study - INFO - Trial 160 finished with values: [0.014953814716045228, 0.003473537956296577, 0.008110293244611749] and parameters: {'n_layers': 1, 'embedding_dim': 96, 'lr': 0.0017339737893249116, 'lambda_val': 0.03943817363263233, 'batch_size': 3735, 'optimizer': 'RMSprop'}.
2026-06-23 09:29:03,616 - experiment_functions - INFO - Early stopping at epoch 3150. Best Metrics: (0.033543396863434244, 0.007119173929518757, 0.019173710108128583)
2026-06-23 09:29:03,749 - optuna.study.study - INFO - Trial 161 finished with values: [0.033543396863434244, 0.007119173929518757, 0.019173710108128583] and parameters: {'n_layers': 1, 'embedding_dim': 96, 'lr': 0.0008906516956334841, 'lambda_val': 0.0010657666266185159, 'batch_size': 1794, 'optimizer': 'RMSprop'}.
2026-06-23 09:29:35,181 - experiment_functions - INFO - Early stopping at epoch 700. Best Metrics: (0.023682884765571507, 0.005161361626878869, 0.014044715323352514)
2026-06-23 09:29:35,286 - optuna.study.study - INFO - Trial 162 finished with values: [0.023682884765571507, 0.005161361626878869, 0.014044715323352514] and parameters: {'n_layers': 2, 'embedding_dim': 32, 'lr': 0.0024861194796259945, 'lambda_val': 0.0006793861457506547, 'batch_size': 3285, 'optimizer': 'Adam'}.
2026-06-23 09:30:01,493 - experiment_functions - INFO - Early stopping at epoch 500. Best Metrics: (0.0005830789422528294, 0.00012473159024883166, 0.00032211261376867813)
