2026-06-22 06:01:07,268 - optuna.study.study - INFO - Trial 149 finished with values: [0.00846386810374135, 0.0018693949728432488, 0.004818997953740637] and parameters: {'n_layers': 4, 'embedding_dim': 256, 'lr': 0.0038079716278558275, 'lambda_val': 0.001073083826061835, 'batch_size': 1209, 'optimizer': 'Adam'}.
2026-06-22 06:03:52,693 - optuna.study.study - INFO - Trial 150 finished with values: [0.013894512281240199, 0.0031340785651130477, 0.008108855942287087] and parameters: {'n_layers': 2, 'embedding_dim': 32, 'lr': 0.00018496080701516134, 'lambda_val': 0.0020559457467967724, 'batch_size': 2006, 'optimizer': 'Adam'}.
2026-06-22 06:05:00,710 - experiment_functions - INFO - Early stopping at epoch 1200. Best Metrics: (0.01999002506830565, 0.004447707464948844, 0.01117989368891276)
2026-06-22 06:05:00,792 - optuna.study.study - INFO - Trial 151 finished with values: [0.01999002506830565, 0.004447707464948844, 0.01117989368891276] and parameters: {'n_layers': 2, 'embedding_dim': 256, 'lr': 0.0003047708778242714, 'lambda_val': 0.010343205800368207, 'batch_size': 1638, 'optimizer': 'RMSprop'}.
2026-06-22 06:07:45,490 - optuna.study.study - INFO - Trial 152 finished with values: [0.0007157977375320898, 0.00016262473159024885, 0.00041096534134414187] and parameters: {'n_layers': 1, 'embedding_dim': 64, 'lr': 9.687619991294357e-05, 'lambda_val': 4.215648076351537e-06, 'batch_size': 3224, 'optimizer': 'Adam'}.
2026-06-22 06:08:54,117 - experiment_functions - INFO - Early stopping at epoch 1550. Best Metrics: (0.010567404800048232, 0.0021535935329038782, 0.005804329941049594)
2026-06-22 06:08:54,239 - optuna.study.study - INFO - Trial 153 finished with values: [0.010567404800048232, 0.0021535935329038782, 0.005804329941049594] and parameters: {'n_layers': 2, 'embedding_dim': 64, 'lr': 0.0015973413467103624, 'lambda_val': 0.010343205800368207, 'batch_size': 2784, 'optimizer': 'RMSprop'}.
2026-06-22 06:09:49,863 - experiment_functions - INFO - Early stopping at epoch 1000. Best Metrics: (0.010591733373932244, 0.0024835796387520526, 0.005859644311330493)
2026-06-22 06:09:49,950 - optuna.study.study - INFO - Trial 154 finished with values: [0.010591733373932244, 0.0024835796387520526, 0.005859644311330493] and parameters: {'n_layers': 4, 'embedding_dim': 128, 'lr': 0.0004249111472269399, 'lambda_val': 0.02301034856049595, 'batch_size': 3730, 'optimizer': 'Adam'}.
2026-06-22 06:10:22,134 - experiment_functions - INFO - Early stopping at epoch 700. Best Metrics: (0.028247973057185224, 0.006126057850195781, 0.016239013931766185)
2026-06-22 06:10:22,206 - optuna.study.study - INFO - Trial 155 finished with values: [0.028247973057185224, 0.006126057850195781, 0.016239013931766185] and parameters: {'n_layers': 1, 'embedding_dim': 64, 'lr': 0.0012653624571519182, 'lambda_val': 0.0003636816041965762, 'batch_size': 3711, 'optimizer': 'RMSprop'}.
2026-06-22 06:13:01,926 - experiment_functions - INFO - Early stopping at epoch 3450. Best Metrics: (0.030265011522740543, 0.006729190349880005, 0.01742297427961828)
2026-06-22 06:13:01,995 - optuna.study.study - INFO - Trial 156 finished with values: [0.030265011522740543, 0.006729190349880005, 0.01742297427961828] and parameters: {'n_layers': 2, 'embedding_dim': 96, 'lr': 0.0004249111472269399, 'lambda_val': 0.000442118077500333, 'batch_size': 930, 'optimizer': 'Adam'}.
2026-06-22 06:13:28,809 - experiment_functions - INFO - Early stopping at epoch 500. Best Metrics: (0.011605549419126645, 0.002647783251231527, 0.0071149557043012936)
2026-06-22 06:13:28,891 - optuna.study.study - INFO - Trial 157 finished with values: [0.011605549419126645, 0.002647783251231527, 0.0071149557043012936] and parameters: {'n_layers': 4, 'embedding_dim': 96, 'lr': 0.035305749660717325, 'lambda_val': 0.01412042339566143, 'batch_size': 2362, 'optimizer': 'RMSprop'}.
2026-06-22 06:13:56,416 - experiment_functions - INFO - Early stopping at epoch 600. Best Metrics: (0.02118596773468297, 0.004329291398256915, 0.011677947331607489)
2026-06-22 06:13:56,485 - optuna.study.study - INFO - Trial 158 finished with values: [0.02118596773468297, 0.004329291398256915, 0.011677947331607489] and parameters: {'n_layers': 2, 'embedding_dim': 32, 'lr': 0.0015973413467103624, 'lambda_val': 0.0001132240545098155, 'batch_size': 4064, 'optimizer': 'RMSprop'}.
2026-06-22 06:15:12,653 - experiment_functions - INFO - Early stopping at epoch 1550. Best Metrics: (0.0005951732906448004, 0.00013262599469496023, 0.0003232343536866296)
2026-06-22 06:15:12,738 - optuna.study.study - INFO - Trial 159 finished with values: [0.0005951732906448004, 0.00013262599469496023, 0.0003232343536866296] and parameters: {'n_layers': 1, 'embedding_dim': 256, 'lr': 3.872963950897276e-05, 'lambda_val': 0.0001132240545098155, 'batch_size': 4064, 'optimizer': 'RMSprop'}.
2026-06-22 06:16:12,215 - experiment_functions - INFO - Early stopping at epoch 1300. Best Metrics: (0.02630363535328892, 0.005815018315018316, 0.0152142007855798)
2026-06-22 06:16:12,288 - optuna.study.study - INFO - Trial 160 finished with values: [0.02630363535328892, 0.005815018315018316, 0.0152142007855798] and parameters: {'n_layers': 2, 'embedding_dim': 64, 'lr': 0.0004249111472269399, 'lambda_val': 0.0006801364658308589, 'batch_size': 2784, 'optimizer': 'RMSprop'}.
2026-06-22 06:16:44,295 - experiment_functions - INFO - Early stopping at epoch 550. Best Metrics: (0.015365865181468942, 0.0031340785651130477, 0.008345377736264347)
2026-06-22 06:16:44,397 - optuna.study.study - INFO - Trial 161 finished with values: [0.015365865181468942, 0.0031340785651130477, 0.008345377736264347] and parameters: {'n_layers': 4, 'embedding_dim': 128, 'lr': 0.005023945861716535, 'lambda_val': 1.3167003761918277e-05, 'batch_size': 3763, 'optimizer': 'Adam'}.
2026-06-22 06:17:16,508 - experiment_functions - INFO - Early stopping at epoch 700. Best Metrics: (0.025902754373659825, 0.005557660730074523, 0.014619674375868169)
2026-06-22 06:17:16,592 - optuna.study.study - INFO - Trial 162 finished with values: [0.025902754373659825, 0.005557660730074523, 0.014619674375868169] and parameters: {'n_layers': 1, 'embedding_dim': 64, 'lr': 0.0012653624571519182, 'lambda_val': 0.004689022509389867, 'batch_size': 2362, 'optimizer': 'RMSprop'}.
2026-06-22 06:20:52,567 - optuna.study.study - INFO - Trial 163 finished with values: [0.016503483683179974, 0.003669319186560566, 0.00942544504089732] and parameters: {'n_layers': 4, 'embedding_dim': 128, 'lr': 9.488295560625263e-05, 'lambda_val': 2.5805202056832215e-06, 'batch_size': 3482, 'optimizer': 'RMSprop'}.
2026-06-22 06:23:54,368 - optuna.study.study - INFO - Trial 164 finished with values: [0.03338600986796586, 0.007139699381078692, 0.01989120065958942] and parameters: {'n_layers': 1, 'embedding_dim': 128, 'lr': 0.0004249111472269399, 'lambda_val': 9.580805901998717e-05, 'batch_size': 2524, 'optimizer': 'Adam'}.
2026-06-22 06:24:27,194 - experiment_functions - INFO - Early stopping at epoch 700. Best Metrics: (0.021187623571966126, 0.00467032967032967, 0.011829764368148407)
2026-06-22 06:24:27,273 - optuna.study.study - INFO - Trial 165 finished with values: [0.021187623571966126, 0.00467032967032967, 0.011829764368148407] and parameters: {'n_layers': 2, 'embedding_dim': 64, 'lr': 0.0012653624571519182, 'lambda_val': 0.010343205800368207, 'batch_size': 2362, 'optimizer': 'Adam'}.
2026-06-22 06:24:58,894 - experiment_functions - INFO - Early stopping at epoch 650. Best Metrics: (0.01969150976117047, 0.004300871542250852, 0.010959249981383215)
2026-06-22 06:24:58,991 - optuna.study.study - INFO - Trial 166 finished with values: [0.01969150976117047, 0.004300871542250852, 0.010959249981383215] and parameters: {'n_layers': 3, 'embedding_dim': 64, 'lr': 0.0017809598622910787, 'lambda_val': 0.0004959490818704716, 'batch_size': 3314, 'optimizer': 'Adam'}.
2026-06-22 06:25:39,271 - experiment_functions - INFO - Early stopping at epoch 900. Best Metrics: (0.024060751735313225, 0.005161361626878868, 0.013524765476874112)
2026-06-22 06:25:39,342 - optuna.study.study - INFO - Trial 167 finished with values: [0.024060751735313225, 0.005161361626878868, 0.013524765476874112] and parameters: {'n_layers': 2, 'embedding_dim': 32, 'lr': 0.0009084473256389459, 'lambda_val': 5.867428769760123e-05, 'batch_size': 3046, 'optimizer': 'RMSprop'}.
2026-06-22 06:28:30,297 - optuna.study.study - INFO - Trial 168 finished with values: [0.022909497773304012, 0.005039787798408488, 0.013376737246283023] and parameters: {'n_layers': 1, 'embedding_dim': 32, 'lr': 0.0003047708778242714, 'lambda_val': 0.0020658479913377025, 'batch_size': 2621, 'optimizer': 'RMSprop'}.
2026-06-22 06:28:59,052 - experiment_functions - INFO - Early stopping at epoch 600. Best Metrics: (0.025614936169926356, 0.00540766704559808, 0.014834004747236252)
2026-06-22 06:28:59,150 - optuna.study.study - INFO - Trial 169 finished with values: [0.025614936169926356, 0.00540766704559808, 0.014834004747236252] and parameters: {'n_layers': 2, 'embedding_dim': 32, 'lr': 0.0024927685535674734, 'lambda_val': 6.3531732661047e-05, 'batch_size': 4064, 'optimizer': 'Adam'}.
2026-06-22 06:29:38,984 - experiment_functions - INFO - Early stopping at epoch 850. Best Metrics: (0.022260551658903196, 0.004477706201844133, 0.011941051716027993)
2026-06-22 06:29:39,055 - optuna.study.study - INFO - Trial 170 finished with values: [0.022260551658903196, 0.004477706201844133, 0.011941051716027993] and parameters: {'n_layers': 1, 'embedding_dim': 64, 'lr': 0.0038079716278558275, 'lambda_val': 1.774165193194297e-05, 'batch_size': 2655, 'optimizer': 'RMSprop'}.
2026-06-22 06:31:28,893 - experiment_functions - INFO - Early stopping at epoch 1950. Best Metrics: (0.024001559344372102, 0.005199254768220285, 0.013361080739018706)
2026-06-22 06:31:28,965 - optuna.study.study - INFO - Trial 171 finished with values: [0.024001559344372102, 0.005199254768220285, 0.013361080739018706] and parameters: {'n_layers': 4, 'embedding_dim': 128, 'lr': 0.00029478525006326924, 'lambda_val': 9.580805901998717e-05, 'batch_size': 2524, 'optimizer': 'RMSprop'}.
2026-06-22 06:32:42,370 - experiment_functions - INFO - Early stopping at epoch 1650. Best Metrics: (0.017090963644765707, 0.003550903119868638, 0.009409471351468204)
2026-06-22 06:32:42,440 - optuna.study.study - INFO - Trial 172 finished with values: [0.017090963644765707, 0.003550903119868638, 0.009409471351468204] and parameters: {'n_layers': 2, 'embedding_dim': 64, 'lr': 0.0012653624571519182, 'lambda_val': 5.867428769760123e-05, 'batch_size': 930, 'optimizer': 'RMSprop'}.
2026-06-22 06:35:44,065 - optuna.study.study - INFO - Trial 173 finished with values: [0.03525414191266988, 0.007482316534040673, 0.019993804455056666] and parameters: {'n_layers': 1, 'embedding_dim': 128, 'lr': 0.0005396605078172515, 'lambda_val': 9.580805901998717e-05, 'batch_size': 2006, 'optimizer': 'Adam'}.
2026-06-22 06:36:21,876 - experiment_functions - INFO - Early stopping at epoch 800. Best Metrics: (0.025150116573486186, 0.005464506757610206, 0.014245675649563404)
2026-06-22 06:36:21,962 - optuna.study.study - INFO - Trial 174 finished with values: [0.025150116573486186, 0.005464506757610206, 0.014245675649563404] and parameters: {'n_layers': 2, 'embedding_dim': 64, 'lr': 0.0009385206853318974, 'lambda_val': 5.867428769760123e-05, 'batch_size': 3046, 'optimizer': 'Adam'}.
2026-06-22 06:36:51,600 - experiment_functions - INFO - Early stopping at epoch 600. Best Metrics: (0.01991342503027006, 0.004045092838196286, 0.010431406933742749)
2026-06-22 06:36:52,376 - optuna.study.study - INFO - Trial 175 finished with values: [0.01991342503027006, 0.004045092838196286, 0.010431406933742749] and parameters: {'n_layers': 2, 'embedding_dim': 64, 'lr': 0.0038079716278558275, 'lambda_val': 0.0008775471778420443, 'batch_size': 2708, 'optimizer': 'Adam'}.
2026-06-22 06:38:08,124 - experiment_functions - INFO - Early stopping at epoch 1450. Best Metrics: (0.019086953565396775, 0.004220348616900341, 0.010521443525463116)
2026-06-22 06:38:08,193 - optuna.study.study - INFO - Trial 176 finished with values: [0.019086953565396775, 0.004220348616900341, 0.010521443525463116] and parameters: {'n_layers': 1, 'embedding_dim': 256, 'lr': 0.004545633213639802, 'lambda_val': 3.0232519324759728e-05, 'batch_size': 1295, 'optimizer': 'RMSprop'}.
2026-06-22 06:41:01,806 - optuna.study.study - INFO - Trial 177 finished with values: [0.02763755734810458, 0.005998168498168498, 0.015622973050031715] and parameters: {'n_layers': 1, 'embedding_dim': 32, 'lr': 0.00037811925768249915, 'lambda_val': 5.867428769760123e-05, 'batch_size': 2362, 'optimizer': 'RMSprop'}.
2026-06-22 06:41:29,144 - experiment_functions - INFO - Early stopping at epoch 550. Best Metrics: (0.01981075231876543, 0.004052987242642416, 0.010846136787114788)
2026-06-22 06:41:29,233 - optuna.study.study - INFO - Trial 178 finished with values: [0.01981075231876543, 0.004052987242642416, 0.010846136787114788] and parameters: {'n_layers': 2, 'embedding_dim': 64, 'lr': 0.005023945861716535, 'lambda_val': 0.000442118077500333, 'batch_size': 2829, 'optimizer': 'Adam'}.
2026-06-22 06:44:42,627 - optuna.study.study - INFO - Trial 179 finished with values: [0.0316989957136091, 0.006789187823670583, 0.018259460653835536] and parameters: {'n_layers': 2, 'embedding_dim': 96, 'lr': 0.0004249111472269399, 'lambda_val': 8.803132640891692e-06, 'batch_size': 930, 'optimizer': 'Adam'}.
2026-06-22 06:46:56,700 - experiment_functions - INFO - Early stopping at epoch 2650. Best Metrics: (0.027692175538967474, 0.005860805860805862, 0.015577575965790945)
2026-06-22 06:46:56,785 - optuna.study.study - INFO - Trial 180 finished with values: [0.027692175538967474, 0.005860805860805862, 0.015577575965790945] and parameters: {'n_layers': 2, 'embedding_dim': 128, 'lr': 0.0004249111472269399, 'lambda_val': 1.3167003761918277e-05, 'batch_size': 4064, 'optimizer': 'Adam'}.
2026-06-22 06:47:32,376 - experiment_functions - INFO - Early stopping at epoch 600. Best Metrics: (0.01751632393814416, 0.0036598459012252118, 0.009615676398544683)
2026-06-22 06:47:32,656 - optuna.study.study - INFO - Trial 181 finished with values: [0.01751632393814416, 0.0036598459012252118, 0.009615676398544683] and parameters: {'n_layers': 4, 'embedding_dim': 128, 'lr': 0.0015973413467103624, 'lambda_val': 9.580805901998717e-05, 'batch_size': 2524, 'optimizer': 'Adam'}.
2026-06-22 06:47:57,506 - experiment_functions - INFO - Early stopping at epoch 550. Best Metrics: (0.00045268675450191027, 0.00010104837691044589, 0.0002455244561086354)
2026-06-22 06:47:57,644 - optuna.study.study - INFO - Trial 182 finished with values: [0.00045268675450191027, 0.00010104837691044589, 0.0002455244561086354] and parameters: {'n_layers': 1, 'embedding_dim': 32, 'lr': 0.0003047708778242714, 'lambda_val': 0.010343205800368207, 'batch_size': 732, 'optimizer': 'Adam'}.
2026-06-22 06:49:25,375 - experiment_functions - INFO - Early stopping at epoch 1950. Best Metrics: (0.027182372568568904, 0.005889225716811924, 0.01509440631792259)
2026-06-22 06:49:25,458 - optuna.study.study - INFO - Trial 183 finished with values: [0.027182372568568904, 0.005889225716811924, 0.01509440631792259] and parameters: {'n_layers': 2, 'embedding_dim': 64, 'lr': 0.0004249111472269399, 'lambda_val': 0.000442118077500333, 'batch_size': 3046, 'optimizer': 'Adam'}.
2026-06-22 06:51:44,592 - experiment_functions - INFO - Early stopping at epoch 3150. Best Metrics: (0.03061631001702015, 0.00668656056587091, 0.01788701964921887)
2026-06-22 06:51:44,675 - optuna.study.study - INFO - Trial 184 finished with values: [0.03061631001702015, 0.00668656056587091, 0.01788701964921887] and parameters: {'n_layers': 2, 'embedding_dim': 64, 'lr': 0.00037811925768249915, 'lambda_val': 8.803132640891692e-06, 'batch_size': 930, 'optimizer': 'RMSprop'}.
2026-06-22 06:53:36,023 - experiment_functions - INFO - Early stopping at epoch 2400. Best Metrics: (0.031479238824468105, 0.006684981684981686, 0.01795724756015952)
2026-06-22 06:53:36,102 - optuna.study.study - INFO - Trial 185 finished with values: [0.031479238824468105, 0.006684981684981686, 0.01795724756015952] and parameters: {'n_layers': 2, 'embedding_dim': 96, 'lr': 0.0004249111472269399, 'lambda_val': 2.887932809602638e-05, 'batch_size': 2113, 'optimizer': 'Adam'}.
2026-06-22 06:54:32,633 - experiment_functions - INFO - Early stopping at epoch 1100. Best Metrics: (0.011492505961497623, 0.002677781988126816, 0.006516950702192946)
2026-06-22 06:54:32,718 - optuna.study.study - INFO - Trial 186 finished with values: [0.011492505961497623, 0.002677781988126816, 0.006516950702192946] and parameters: {'n_layers': 4, 'embedding_dim': 96, 'lr': 0.0004249111472269399, 'lambda_val': 0.02301034856049595, 'batch_size': 1762, 'optimizer': 'Adam'}.
2026-06-22 06:57:23,635 - optuna.study.study - INFO - Trial 187 finished with values: [0.024749498435420285, 0.0056571302260957435, 0.014193599682232515] and parameters: {'n_layers': 1, 'embedding_dim': 64, 'lr': 0.00029478525006326924, 'lambda_val': 0.014473661729751385, 'batch_size': 2655, 'optimizer': 'RMSprop'}.
2026-06-22 06:58:58,216 - experiment_functions - INFO - Early stopping at epoch 1900. Best Metrics: (0.016490219063561094, 0.003517746621194897, 0.008928035275946513)
2026-06-22 06:58:58,300 - optuna.study.study - INFO - Trial 188 finished with values: [0.016490219063561094, 0.003517746621194897, 0.008928035275946513] and parameters: {'n_layers': 2, 'embedding_dim': 128, 'lr': 0.005023945861716535, 'lambda_val': 1.3167003761918277e-05, 'batch_size': 4064, 'optimizer': 'RMSprop'}.
2026-06-22 07:01:57,167 - optuna.study.study - INFO - Trial 189 finished with values: [0.03047289605875023, 0.00668656056587091, 0.017812422639929153] and parameters: {'n_layers': 1, 'embedding_dim': 64, 'lr': 0.0004249111472269399, 'lambda_val': 9.580805901998717e-05, 'batch_size': 2524, 'optimizer': 'Adam'}.
2026-06-22 07:02:59,083 - experiment_functions - INFO - Early stopping at epoch 1250. Best Metrics: (0.026531803748373026, 0.005699760010104838, 0.01494920546014365)
2026-06-22 07:02:59,167 - optuna.study.study - INFO - Trial 190 finished with values: [0.026531803748373026, 0.005699760010104838, 0.01494920546014365] and parameters: {'n_layers': 2, 'embedding_dim': 96, 'lr': 0.0004249111472269399, 'lambda_val': 5.272411928419156e-05, 'batch_size': 2829, 'optimizer': 'RMSprop'}.
2026-06-22 07:03:53,390 - experiment_functions - INFO - Early stopping at epoch 1200. Best Metrics: (0.021793138110603523, 0.004804534545913857, 0.011921342872350216)
2026-06-22 07:03:53,462 - optuna.study.study - INFO - Trial 191 finished with values: [0.021793138110603523, 0.004804534545913857, 0.011921342872350216] and parameters: {'n_layers': 2, 'embedding_dim': 32, 'lr': 0.0005237120651762908, 'lambda_val': 0.010343205800368207, 'batch_size': 1638, 'optimizer': 'RMSprop'}.
2026-06-22 07:07:12,982 - optuna.study.study - INFO - Trial 192 finished with values: [0.002548114196237186, 0.0005794492863458381, 0.00164506016997079] and parameters: {'n_layers': 1, 'embedding_dim': 256, 'lr': 0.00011710757927899564, 'lambda_val': 0.0005857689247732319, 'batch_size': 3633, 'optimizer': 'RMSprop'}.
2026-06-22 07:10:10,745 - optuna.study.study - INFO - Trial 193 finished with values: [0.01727299705250828, 0.003926676771504357, 0.009921371987797804] and parameters: {'n_layers': 3, 'embedding_dim': 32, 'lr': 0.0001659733154867732, 'lambda_val': 0.0020559457467967724, 'batch_size': 2006, 'optimizer': 'Adam'}.
2026-06-22 07:10:37,635 - experiment_functions - INFO - Early stopping at epoch 550. Best Metrics: (0.012236934560311639, 0.0025530503978779843, 0.006477740097286277)
2026-06-22 07:10:37,707 - optuna.study.study - INFO - Trial 194 finished with values: [0.012236934560311639, 0.0025530503978779843, 0.006477740097286277] and parameters: {'n_layers': 4, 'embedding_dim': 32, 'lr': 0.0067401928935946825, 'lambda_val': 0.0020559457467967724, 'batch_size': 2901, 'optimizer': 'Adam'}.
2026-06-22 07:11:58,638 - experiment_functions - INFO - Early stopping at epoch 1800. Best Metrics: (0.019763334296532254, 0.0042392951875710495, 0.011059514546148935)
2026-06-22 07:11:58,723 - optuna.study.study - INFO - Trial 195 finished with values: [0.019763334296532254, 0.0042392951875710495, 0.011059514546148935] and parameters: {'n_layers': 1, 'embedding_dim': 128, 'lr': 0.0038079716278558275, 'lambda_val': 4.215648076351537e-06, 'batch_size': 682, 'optimizer': 'RMSprop'}.
2026-06-22 07:12:24,069 - experiment_functions - INFO - Early stopping at epoch 500. Best Metrics: (0.0004622662977867605, 9.789061513199444e-05, 0.00024547688809061196)
2026-06-22 07:12:24,138 - optuna.study.study - INFO - Trial 196 finished with values: [0.0004622662977867605, 9.789061513199444e-05, 0.00024547688809061196] and parameters: {'n_layers': 2, 'embedding_dim': 128, 'lr': 0.00016676155910200834, 'lambda_val': 1.344948355534323e-06, 'batch_size': 930, 'optimizer': 'SGD'}.
2026-06-22 07:13:00,067 - experiment_functions - INFO - Early stopping at epoch 700. Best Metrics: (0.027097664229439357, 0.005726600985221675, 0.01559108047482914)
2026-06-22 07:13:00,144 - optuna.study.study - INFO - Trial 197 finished with values: [0.027097664229439357, 0.005726600985221675, 0.01559108047482914] and parameters: {'n_layers': 2, 'embedding_dim': 128, 'lr': 0.001367505758136406, 'lambda_val': 4.017786575271443e-05, 'batch_size': 1881, 'optimizer': 'Adam'}.
2026-06-22 07:15:31,880 - experiment_functions - INFO - Early stopping at epoch 3500. Best Metrics: (0.0008518405996195951, 0.00018157130226095747, 0.00045561061808424726)
