2026-06-22 14:25:20,241 - optuna.study.study - INFO - Trial 193 finished with values: [0.02077539656612468, 0.004485600606290262, 0.011225431122952918] and parameters: {'n_layers': 2, 'embedding_dim': 96, 'lr': 0.004316399830411133, 'lambda_val': 3.7531074030685855e-06, 'batch_size': 2550, 'optimizer': 'Adam'}.
2026-06-22 14:26:13,562 - experiment_functions - INFO - Early stopping at epoch 1300. Best Metrics: (0.00046913722997670267, 0.00010736390046734874, 0.00023507870992723226)
2026-06-22 14:26:13,645 - optuna.study.study - INFO - Trial 194 finished with values: [0.00046913722997670267, 0.00010736390046734874, 0.00023507870992723226] and parameters: {'n_layers': 1, 'embedding_dim': 32, 'lr': 3.067487928860663e-05, 'lambda_val': 3.154143842771189e-05, 'batch_size': 2900, 'optimizer': 'RMSprop'}.
2026-06-22 14:29:07,465 - optuna.study.study - INFO - Trial 195 finished with values: [0.031848978918488285, 0.006808134394341292, 0.01841798690948346] and parameters: {'n_layers': 1, 'embedding_dim': 96, 'lr': 0.0006753032109319728, 'lambda_val': 0.0007109535707376064, 'batch_size': 1785, 'optimizer': 'RMSprop'}.
2026-06-22 14:32:05,862 - optuna.study.study - INFO - Trial 196 finished with values: [0.0326694688110811, 0.006942339269925477, 0.01843179653465898] and parameters: {'n_layers': 1, 'embedding_dim': 128, 'lr': 0.0005652244898304067, 'lambda_val': 7.724967695086265e-05, 'batch_size': 2900, 'optimizer': 'RMSprop'}.
2026-06-22 14:32:37,249 - experiment_functions - INFO - Early stopping at epoch 600. Best Metrics: (0.007844395445527086, 0.0017004547176960973, 0.004651103381076739)
2026-06-22 14:32:37,347 - optuna.study.study - INFO - Trial 197 finished with values: [0.007844395445527086, 0.0017004547176960973, 0.004651103381076739] and parameters: {'n_layers': 4, 'embedding_dim': 96, 'lr': 0.004316399830411133, 'lambda_val': 0.00023620858897053303, 'batch_size': 764, 'optimizer': 'Adam'}.
2026-06-22 14:33:12,076 - experiment_functions - INFO - Early stopping at epoch 600. Best Metrics: (0.021199964379567775, 0.004578754578754579, 0.0120254608072294)
2026-06-22 14:33:12,159 - optuna.study.study - INFO - Trial 198 finished with values: [0.021199964379567775, 0.004578754578754579, 0.0120254608072294] and parameters: {'n_layers': 2, 'embedding_dim': 256, 'lr': 0.0030078366574997767, 'lambda_val': 0.00023620858897053303, 'batch_size': 2558, 'optimizer': 'Adam'}.
2026-06-22 14:33:45,438 - experiment_functions - INFO - Early stopping at epoch 750. Best Metrics: (0.032837460943617544, 0.0067718201338891, 0.018537934858789778)
2026-06-22 14:33:45,534 - optuna.study.study - INFO - Trial 199 finished with values: [0.032837460943617544, 0.0067718201338891, 0.018537934858789778] and parameters: {'n_layers': 1, 'embedding_dim': 32, 'lr': 0.003916255753855854, 'lambda_val': 4.627893684414806e-05, 'batch_size': 3110, 'optimizer': 'Adam'}.
2026-06-22 14:34:16,121 - experiment_functions - INFO - Early stopping at epoch 700. Best Metrics: (0.01782827022837303, 0.004071933813313123, 0.009728186456799898)
2026-06-22 14:34:16,198 - optuna.study.study - INFO - Trial 200 finished with values: [0.01782827022837303, 0.004071933813313123, 0.009728186456799898] and parameters: {'n_layers': 1, 'embedding_dim': 32, 'lr': 0.0030078366574997767, 'lambda_val': 0.01190608995222377, 'batch_size': 1785, 'optimizer': 'RMSprop'}.
2026-06-22 14:36:56,778 - experiment_functions - INFO - Early stopping at epoch 3850. Best Metrics: (0.0285665516292217, 0.006138688897309588, 0.01641816595799494)
2026-06-22 14:36:56,847 - optuna.study.study - INFO - Trial 201 finished with values: [0.0285665516292217, 0.006138688897309588, 0.01641816595799494] and parameters: {'n_layers': 2, 'embedding_dim': 32, 'lr': 0.0005464989571285408, 'lambda_val': 0.00015679042892799276, 'batch_size': 2836, 'optimizer': 'Adam'}.
2026-06-22 14:38:00,054 - experiment_functions - INFO - Early stopping at epoch 1300. Best Metrics: (0.023851480445292637, 0.005091890867752936, 0.013477404561820554)
2026-06-22 14:38:00,128 - optuna.study.study - INFO - Trial 202 finished with values: [0.023851480445292637, 0.005091890867752936, 0.013477404561820554] and parameters: {'n_layers': 3, 'embedding_dim': 96, 'lr': 0.0005464989571285408, 'lambda_val': 0.00023620858897053303, 'batch_size': 3042, 'optimizer': 'Adam'}.
2026-06-22 14:40:48,621 - optuna.study.study - INFO - Trial 203 finished with values: [0.02803212329850596, 0.006017115068839207, 0.016411235740291713] and parameters: {'n_layers': 1, 'embedding_dim': 64, 'lr': 0.0005464989571285408, 'lambda_val': 0.0001979130594640894, 'batch_size': 2836, 'optimizer': 'Adam'}.
2026-06-22 14:43:34,235 - optuna.study.study - INFO - Trial 204 finished with values: [0.032683723835854654, 0.006885499557913352, 0.018799667681545996] and parameters: {'n_layers': 1, 'embedding_dim': 32, 'lr': 0.0018725355385280041, 'lambda_val': 0.00016081976691657246, 'batch_size': 1891, 'optimizer': 'Adam'}.
2026-06-22 14:46:02,395 - experiment_functions - INFO - Early stopping at epoch 3300. Best Metrics: (0.03361010539532506, 0.007093911835291147, 0.01917807153361567)
2026-06-22 14:46:02,502 - optuna.study.study - INFO - Trial 205 finished with values: [0.03361010539532506, 0.007093911835291147, 0.01917807153361567] and parameters: {'n_layers': 1, 'embedding_dim': 128, 'lr': 0.0009993547791746632, 'lambda_val': 0.00011379660469282507, 'batch_size': 2836, 'optimizer': 'RMSprop'}.
2026-06-22 14:46:24,464 - experiment_functions - INFO - Early stopping at epoch 500. Best Metrics: (0.0005388109503565819, 0.00012315270935960593, 0.0002991126725849755)
2026-06-22 14:46:24,560 - optuna.study.study - INFO - Trial 206 finished with values: [0.0005388109503565819, 0.00012315270935960593, 0.0002991126725849755] and parameters: {'n_layers': 1, 'embedding_dim': 32, 'lr': 0.0005652244898304067, 'lambda_val': 5.915966748772391e-06, 'batch_size': 2674, 'optimizer': 'SGD'}.
2026-06-22 14:48:06,982 - experiment_functions - INFO - Early stopping at epoch 2450. Best Metrics: (0.03466166234720958, 0.0072233800682076545, 0.019463862614370404)
2026-06-22 14:48:07,110 - optuna.study.study - INFO - Trial 207 finished with values: [0.03466166234720958, 0.0072233800682076545, 0.019463862614370404] and parameters: {'n_layers': 1, 'embedding_dim': 32, 'lr': 0.0010694394042823291, 'lambda_val': 4.627893684414806e-05, 'batch_size': 3110, 'optimizer': 'RMSprop'}.
2026-06-22 14:50:48,556 - optuna.study.study - INFO - Trial 208 finished with values: [0.019826899237113303, 0.004498231653404068, 0.011931134905051587] and parameters: {'n_layers': 1, 'embedding_dim': 32, 'lr': 0.0005652244898304067, 'lambda_val': 3.90887208716658e-05, 'batch_size': 1785, 'optimizer': 'RMSprop'}.
2026-06-22 14:51:10,724 - experiment_functions - INFO - Early stopping at epoch 500. Best Metrics: (0.0004980234459617876, 0.00011367942402425162, 0.0002828207198587926)
2026-06-22 14:51:10,824 - optuna.study.study - INFO - Trial 209 finished with values: [0.0004980234459617876, 0.00011367942402425162, 0.0002828207198587926] and parameters: {'n_layers': 1, 'embedding_dim': 32, 'lr': 0.001487817598059853, 'lambda_val': 1.3761340713703872e-05, 'batch_size': 2533, 'optimizer': 'SGD'}.
2026-06-22 14:54:08,279 - optuna.study.study - INFO - Trial 210 finished with values: [0.030970436097849663, 0.006675508399646331, 0.017746880879826486] and parameters: {'n_layers': 1, 'embedding_dim': 128, 'lr': 0.0005464989571285408, 'lambda_val': 7.724967695086265e-05, 'batch_size': 2900, 'optimizer': 'RMSprop'}.
2026-06-22 14:57:06,454 - optuna.study.study - INFO - Trial 211 finished with values: [0.03118458447469965, 0.006688139446760137, 0.017673371278855033] and parameters: {'n_layers': 1, 'embedding_dim': 128, 'lr': 0.0005652244898304067, 'lambda_val': 0.00287692779327254, 'batch_size': 2900, 'optimizer': 'RMSprop'}.
2026-06-22 14:59:31,097 - experiment_functions - INFO - Early stopping at epoch 3150. Best Metrics: (0.029369085102256293, 0.006356574460022736, 0.016415647163679856)
2026-06-22 14:59:31,203 - optuna.study.study - INFO - Trial 212 finished with values: [0.029369085102256293, 0.006356574460022736, 0.016415647163679856] and parameters: {'n_layers': 2, 'embedding_dim': 96, 'lr': 0.0005652244898304067, 'lambda_val': 0.00023620858897053303, 'batch_size': 3042, 'optimizer': 'RMSprop'}.
2026-06-22 14:59:53,252 - experiment_functions - INFO - Early stopping at epoch 500. Best Metrics: (0.0005719551954756639, 0.00012473159024883163, 0.00032373181839180187)
2026-06-22 14:59:53,356 - optuna.study.study - INFO - Trial 213 finished with values: [0.0005719551954756639, 0.00012473159024883163, 0.00032373181839180187] and parameters: {'n_layers': 1, 'embedding_dim': 32, 'lr': 0.0010694394042823291, 'lambda_val': 0.007994385715315203, 'batch_size': 1785, 'optimizer': 'SGD'}.
2026-06-22 15:01:04,872 - experiment_functions - INFO - Early stopping at epoch 1600. Best Metrics: (0.02775605717698584, 0.00588291019325502, 0.015673458525227692)
2026-06-22 15:01:04,993 - optuna.study.study - INFO - Trial 214 finished with values: [0.02775605717698584, 0.00588291019325502, 0.015673458525227692] and parameters: {'n_layers': 2, 'embedding_dim': 64, 'lr': 0.0006753032109319728, 'lambda_val': 1.3761340713703872e-05, 'batch_size': 2674, 'optimizer': 'RMSprop'}.
2026-06-22 15:03:50,584 - optuna.study.study - INFO - Trial 215 finished with values: [0.02643718760998751, 0.005565555134520652, 0.014854854345354695] and parameters: {'n_layers': 2, 'embedding_dim': 32, 'lr': 0.0005652244898304067, 'lambda_val': 1.3761340713703872e-05, 'batch_size': 785, 'optimizer': 'Adam'}.
2026-06-22 15:05:08,841 - experiment_functions - INFO - Early stopping at epoch 1950. Best Metrics: (0.0005136360166913177, 0.00011367942402425163, 0.0002800106588872923)
2026-06-22 15:05:08,941 - optuna.study.study - INFO - Trial 216 finished with values: [0.0005136360166913177, 0.00011367942402425163, 0.0002800106588872923] and parameters: {'n_layers': 1, 'embedding_dim': 32, 'lr': 1.4243724408649552e-05, 'lambda_val': 1.3761340713703872e-05, 'batch_size': 2900, 'optimizer': 'Adam'}.
2026-06-22 15:05:49,365 - experiment_functions - INFO - Early stopping at epoch 950. Best Metrics: (0.018175821004164396, 0.004337185802703045, 0.010310317874956284)
2026-06-22 15:05:49,463 - optuna.study.study - INFO - Trial 217 finished with values: [0.018175821004164396, 0.004337185802703045, 0.010310317874956284] and parameters: {'n_layers': 1, 'embedding_dim': 32, 'lr': 0.0010694394042823291, 'lambda_val': 0.052476263174243046, 'batch_size': 3095, 'optimizer': 'RMSprop'}.
2026-06-22 15:07:06,543 - experiment_functions - INFO - Early stopping at epoch 1700. Best Metrics: (0.00997611632724782, 0.0021820133889099407, 0.005745516165283037)
2026-06-22 15:07:06,933 - optuna.study.study - INFO - Trial 218 finished with values: [0.00997611632724782, 0.0021820133889099407, 0.005745516165283037] and parameters: {'n_layers': 2, 'embedding_dim': 96, 'lr': 0.003916255753855854, 'lambda_val': 0.0007109535707376064, 'batch_size': 2470, 'optimizer': 'RMSprop'}.
2026-06-22 15:07:50,703 - experiment_functions - INFO - Early stopping at epoch 850. Best Metrics: (0.028288373583542175, 0.005969748642162436, 0.01598217139803831)
2026-06-22 15:07:50,811 - optuna.study.study - INFO - Trial 219 finished with values: [0.028288373583542175, 0.005969748642162436, 0.01598217139803831] and parameters: {'n_layers': 1, 'embedding_dim': 256, 'lr': 0.001487817598059853, 'lambda_val': 0.0001979130594640894, 'batch_size': 2836, 'optimizer': 'RMSprop'}.
2026-06-22 15:09:13,309 - experiment_functions - INFO - Early stopping at epoch 1750. Best Metrics: (0.020839574612127335, 0.004367184539598333, 0.011553393934388263)
2026-06-22 15:09:13,500 - optuna.study.study - INFO - Trial 220 finished with values: [0.020839574612127335, 0.004367184539598333, 0.011553393934388263] and parameters: {'n_layers': 4, 'embedding_dim': 64, 'lr': 0.0006753032109319728, 'lambda_val': 6.933147848217428e-06, 'batch_size': 2674, 'optimizer': 'Adam'}.
2026-06-22 15:09:44,248 - experiment_functions - INFO - Early stopping at epoch 700. Best Metrics: (0.02663062044030287, 0.005683971201212581, 0.015203614233322796)
2026-06-22 15:09:44,348 - optuna.study.study - INFO - Trial 221 finished with values: [0.02663062044030287, 0.005683971201212581, 0.015203614233322796] and parameters: {'n_layers': 1, 'embedding_dim': 32, 'lr': 0.005839447085446061, 'lambda_val': 0.00016615513360913103, 'batch_size': 1573, 'optimizer': 'Adam'}.
2026-06-22 15:10:42,589 - experiment_functions - INFO - Early stopping at epoch 1150. Best Metrics: (0.030569579308013947, 0.006498673740053051, 0.017524555818089458)
2026-06-22 15:10:42,714 - optuna.study.study - INFO - Trial 222 finished with values: [0.030569579308013947, 0.006498673740053051, 0.017524555818089458] and parameters: {'n_layers': 1, 'embedding_dim': 256, 'lr': 0.0018725355385280041, 'lambda_val': 3.90887208716658e-05, 'batch_size': 1785, 'optimizer': 'Adam'}.
2026-06-22 15:13:23,715 - experiment_functions - INFO - Early stopping at epoch 3500. Best Metrics: (0.02906853502729894, 0.006222369584438551, 0.016594351382827787)
2026-06-22 15:13:23,800 - optuna.study.study - INFO - Trial 223 finished with values: [0.02906853502729894, 0.006222369584438551, 0.016594351382827787] and parameters: {'n_layers': 2, 'embedding_dim': 96, 'lr': 0.0005464989571285408, 'lambda_val': 5.073229516556338e-06, 'batch_size': 2674, 'optimizer': 'Adam'}.
2026-06-22 15:13:46,078 - experiment_functions - INFO - Early stopping at epoch 500. Best Metrics: (0.0004924803690930829, 0.00010894278135657447, 0.00025417413674629107)
2026-06-22 15:13:46,251 - optuna.study.study - INFO - Trial 224 finished with values: [0.0004924803690930829, 0.00010894278135657447, 0.00025417413674629107] and parameters: {'n_layers': 1, 'embedding_dim': 32, 'lr': 0.0005652244898304067, 'lambda_val': 1.3761340713703872e-05, 'batch_size': 2900, 'optimizer': 'SGD'}.
2026-06-22 15:14:09,734 - experiment_functions - INFO - Early stopping at epoch 500. Best Metrics: (0.0004263621543869187, 0.00010736390046734875, 0.00025467690182041756)
2026-06-22 15:14:09,847 - optuna.study.study - INFO - Trial 225 finished with values: [0.0004263621543869187, 0.00010736390046734875, 0.00025467690182041756] and parameters: {'n_layers': 2, 'embedding_dim': 64, 'lr': 0.001487817598059853, 'lambda_val': 5.5504078777122543e-05, 'batch_size': 2558, 'optimizer': 'SGD'}.
2026-06-22 15:16:14,466 - experiment_functions - INFO - Early stopping at epoch 2750. Best Metrics: (0.03353747512617064, 0.00691549829480864, 0.019208747520941535)
2026-06-22 15:16:14,571 - optuna.study.study - INFO - Trial 226 finished with values: [0.03353747512617064, 0.00691549829480864, 0.019208747520941535] and parameters: {'n_layers': 1, 'embedding_dim': 128, 'lr': 0.001247135325126933, 'lambda_val': 0.0001979130594640894, 'batch_size': 2836, 'optimizer': 'Adam'}.
2026-06-22 15:16:37,652 - experiment_functions - INFO - Early stopping at epoch 500. Best Metrics: (0.00048179201454353634, 0.00011841606669192877, 0.0002509869124806067)
2026-06-22 15:16:37,754 - optuna.study.study - INFO - Trial 227 finished with values: [0.00048179201454353634, 0.00011841606669192877, 0.0002509869124806067] and parameters: {'n_layers': 1, 'embedding_dim': 96, 'lr': 0.0006753032109319728, 'lambda_val': 0.08284686860175827, 'batch_size': 2674, 'optimizer': 'Adam'}.
2026-06-22 15:19:25,544 - optuna.study.study - INFO - Trial 228 finished with values: [0.02533145807988279, 0.005597132752305166, 0.01491396543592738] and parameters: {'n_layers': 1, 'embedding_dim': 64, 'lr': 0.0005652244898304067, 'lambda_val': 4.627893684414806e-05, 'batch_size': 2470, 'optimizer': 'Adam'}.
2026-06-22 15:21:22,067 - experiment_functions - INFO - Early stopping at epoch 2750. Best Metrics: (0.02781109484248188, 0.006045534924845269, 0.01540291754142914)
2026-06-22 15:21:22,174 - optuna.study.study - INFO - Trial 229 finished with values: [0.02781109484248188, 0.006045534924845269, 0.01540291754142914] and parameters: {'n_layers': 2, 'embedding_dim': 32, 'lr': 0.0005652244898304067, 'lambda_val': 0.0007109535707376064, 'batch_size': 2900, 'optimizer': 'RMSprop'}.
2026-06-22 15:24:32,559 - optuna.study.study - INFO - Trial 230 finished with values: [0.014945197700298157, 0.0035035366931918653, 0.009124696687912577] and parameters: {'n_layers': 1, 'embedding_dim': 256, 'lr': 0.0005652244898304067, 'lambda_val': 1.3761340713703872e-05, 'batch_size': 730, 'optimizer': 'RMSprop'}.
2026-06-22 15:24:58,528 - experiment_functions - INFO - Early stopping at epoch 550. Best Metrics: (0.017901729915661777, 0.0038098395857016545, 0.00991623649984051)
2026-06-22 15:24:58,637 - optuna.study.study - INFO - Trial 231 finished with values: [0.017901729915661777, 0.0038098395857016545, 0.00991623649984051] and parameters: {'n_layers': 1, 'embedding_dim': 96, 'lr': 0.01771610918966521, 'lambda_val': 0.0007109535707376064, 'batch_size': 2596, 'optimizer': 'Adam'}.
2026-06-22 15:27:29,399 - experiment_functions - INFO - Early stopping at epoch 3600. Best Metrics: (0.033146877680989215, 0.0070781230263988896, 0.019617805762412073)
2026-06-22 15:27:29,496 - optuna.study.study - INFO - Trial 232 finished with values: [0.033146877680989215, 0.0070781230263988896, 0.019617805762412073] and parameters: {'n_layers': 1, 'embedding_dim': 32, 'lr': 0.0010694394042823291, 'lambda_val': 1.3761340713703872e-05, 'batch_size': 3628, 'optimizer': 'RMSprop'}.
2026-06-22 15:28:22,501 - experiment_functions - INFO - Early stopping at epoch 1150. Best Metrics: (0.03203277453383239, 0.006812871037008968, 0.01837783106511705)
2026-06-22 15:28:22,607 - optuna.study.study - INFO - Trial 233 finished with values: [0.03203277453383239, 0.006812871037008968, 0.01837783106511705] and parameters: {'n_layers': 1, 'embedding_dim': 128, 'lr': 0.0018725355385280041, 'lambda_val': 9.145473749401414e-05, 'batch_size': 1785, 'optimizer': 'Adam'}.
2026-06-22 15:28:59,609 - experiment_functions - INFO - Early stopping at epoch 700. Best Metrics: (0.01980422238207189, 0.004296134899583175, 0.010971933973290668)
2026-06-22 15:28:59,944 - optuna.study.study - INFO - Trial 234 finished with values: [0.01980422238207189, 0.004296134899583175, 0.010971933973290668] and parameters: {'n_layers': 3, 'embedding_dim': 128, 'lr': 0.001487817598059853, 'lambda_val': 0.0001979130594640894, 'batch_size': 2558, 'optimizer': 'Adam'}.
2026-06-22 15:31:04,671 - experiment_functions - INFO - Early stopping at epoch 2550. Best Metrics: (0.022337506495851225, 0.00454875584185929, 0.01239689976169229)
2026-06-22 15:31:04,775 - optuna.study.study - INFO - Trial 235 finished with values: [0.022337506495851225, 0.00454875584185929, 0.01239689976169229] and parameters: {'n_layers': 1, 'embedding_dim': 256, 'lr': 0.0025982385873546364, 'lambda_val': 1.3761340713703872e-05, 'batch_size': 2116, 'optimizer': 'RMSprop'}.
2026-06-22 15:33:47,641 - optuna.study.study - INFO - Trial 236 finished with values: [0.024693475267773407, 0.005428192497158015, 0.014342935705814061] and parameters: {'n_layers': 1, 'embedding_dim': 32, 'lr': 0.0005652244898304067, 'lambda_val': 1.3761340713703872e-05, 'batch_size': 2116, 'optimizer': 'RMSprop'}.
2026-06-22 15:35:02,794 - experiment_functions - INFO - Early stopping at epoch 1550. Best Metrics: (0.026100414381988322, 0.005475558923834785, 0.014742692133469404)
2026-06-22 15:35:02,897 - optuna.study.study - INFO - Trial 237 finished with values: [0.026100414381988322, 0.005475558923834785, 0.014742692133469404] and parameters: {'n_layers': 3, 'embedding_dim': 96, 'lr': 0.0005464989571285408, 'lambda_val': 0.00011379660469282507, 'batch_size': 2265, 'optimizer': 'Adam'}.
2026-06-22 15:38:17,929 - optuna.study.study - INFO - Trial 238 finished with values: [0.03147388360137185, 0.0066612984716432995, 0.018248742975170183] and parameters: {'n_layers': 1, 'embedding_dim': 256, 'lr': 0.0005652244898304067, 'lambda_val': 1.3761340713703872e-05, 'batch_size': 1556, 'optimizer': 'RMSprop'}.
2026-06-22 15:41:47,708 - optuna.study.study - INFO - Trial 239 finished with values: [0.014258617822102767, 0.0029525072628520904, 0.008225668296540048] and parameters: {'n_layers': 4, 'embedding_dim': 128, 'lr': 0.008571437544766634, 'lambda_val': 2.031733092562984e-05, 'batch_size': 862, 'optimizer': 'RMSprop'}.
2026-06-22 15:44:42,039 - optuna.study.study - INFO - Trial 240 finished with values: [0.006584565328667349, 0.001594669698117974, 0.004122426749002202] and parameters: {'n_layers': 1, 'embedding_dim': 128, 'lr': 0.0002941887882736623, 'lambda_val': 7.724967695086265e-05, 'batch_size': 2900, 'optimizer': 'RMSprop'}.
2026-06-22 15:47:34,077 - optuna.study.study - INFO - Trial 241 finished with values: [0.029016627115224812, 0.006331312365795125, 0.016533315096496512] and parameters: {'n_layers': 1, 'embedding_dim': 64, 'lr': 0.0005652244898304067, 'lambda_val': 4.627893684414806e-05, 'batch_size': 2470, 'optimizer': 'RMSprop'}.
2026-06-22 15:49:11,661 - experiment_functions - INFO - Early stopping at epoch 1950. Best Metrics: (0.021564982182417747, 0.005164519388657319, 0.012205150476999965)
2026-06-22 15:49:11,764 - optuna.study.study - INFO - Trial 242 finished with values: [0.021564982182417747, 0.005164519388657319, 0.012205150476999965] and parameters: {'n_layers': 1, 'embedding_dim': 256, 'lr': 0.0005652244898304067, 'lambda_val': 0.02551685472301946, 'batch_size': 2116, 'optimizer': 'RMSprop'}.
2026-06-22 15:49:35,637 - experiment_functions - INFO - Early stopping at epoch 500. Best Metrics: (0.0005380209172682534, 0.00011683718580270305, 0.00029806469938557854)
