2026-06-23 00:45:37,567 - optuna.study.study - INFO - Trial 30 finished with values: [0.0005284416403887911, 0.00012631047113805736, 0.00025050249929299643] and parameters: {'n_layers': 1, 'embedding_dim': 96, 'lr': 0.008704558585694612, 'lambda_val': 0.04959661323222715, 'batch_size': 2928, 'optimizer': 'SGD'}.
2026-06-23 00:46:06,621 - experiment_functions - INFO - Early stopping at epoch 550. Best Metrics: (0.005397122079310072, 0.0012110016420361247, 0.003052570860425913)
2026-06-23 00:46:06,788 - optuna.study.study - INFO - Trial 31 finished with values: [0.005397122079310072, 0.0012110016420361247, 0.003052570860425913] and parameters: {'n_layers': 4, 'embedding_dim': 96, 'lr': 0.00999058557216378, 'lambda_val': 0.005404522144278895, 'batch_size': 1270, 'optimizer': 'Adam'}.
2026-06-23 00:46:33,104 - experiment_functions - INFO - Early stopping at epoch 550. Best Metrics: (0.009057518337651673, 0.002024125299987369, 0.0050665888342225586)
2026-06-23 00:46:33,206 - optuna.study.study - INFO - Trial 32 finished with values: [0.009057518337651673, 0.002024125299987369, 0.0050665888342225586] and parameters: {'n_layers': 1, 'embedding_dim': 128, 'lr': 0.050940040347919505, 'lambda_val': 6.950755607576537e-05, 'batch_size': 2540, 'optimizer': 'Adam'}.
2026-06-23 00:50:15,597 - experiment_functions - INFO - Early stopping at epoch 3400. Best Metrics: (0.024886782764861847, 0.005442402425161047, 0.014209739088126243)
2026-06-23 00:50:15,671 - optuna.study.study - INFO - Trial 33 finished with values: [0.024886782764861847, 0.005442402425161047, 0.014209739088126243] and parameters: {'n_layers': 4, 'embedding_dim': 256, 'lr': 0.000267777720544778, 'lambda_val': 3.12735769757427e-06, 'batch_size': 1872, 'optimizer': 'RMSprop'}.
2026-06-23 00:50:44,783 - experiment_functions - INFO - Early stopping at epoch 550. Best Metrics: (0.011775252180560332, 0.00256568144499179, 0.0065715435022864616)
2026-06-23 00:50:44,918 - optuna.study.study - INFO - Trial 34 finished with values: [0.011775252180560332, 0.00256568144499179, 0.0065715435022864616] and parameters: {'n_layers': 4, 'embedding_dim': 96, 'lr': 0.004023997993481987, 'lambda_val': 0.0005196802788376184, 'batch_size': 922, 'optimizer': 'RMSprop'}.
2026-06-23 00:51:11,340 - experiment_functions - INFO - Early stopping at epoch 500. Best Metrics: (0.0006020211510544227, 0.0001373626373626374, 0.0003185353698410232)
2026-06-23 00:51:11,426 - optuna.study.study - INFO - Trial 35 finished with values: [0.0006020211510544227, 0.0001373626373626374, 0.0003185353698410232] and parameters: {'n_layers': 4, 'embedding_dim': 96, 'lr': 6.659340631371289e-05, 'lambda_val': 0.001770571737705899, 'batch_size': 2919, 'optimizer': 'SGD'}.
2026-06-23 00:51:34,727 - experiment_functions - INFO - Early stopping at epoch 500. Best Metrics: (0.0005141450975813348, 0.0001373626373626374, 0.0003169476758485169)
2026-06-23 00:51:34,887 - optuna.study.study - INFO - Trial 36 finished with values: [0.0005141450975813348, 0.0001373626373626374, 0.0003169476758485169] and parameters: {'n_layers': 4, 'embedding_dim': 32, 'lr': 0.00015736597604167302, 'lambda_val': 1.2083782185147504e-05, 'batch_size': 772, 'optimizer': 'SGD'}.
2026-06-23 00:52:14,264 - experiment_functions - INFO - Early stopping at epoch 700. Best Metrics: (0.0006970951274808313, 0.0001373626373626374, 0.0003533299244996469)
2026-06-23 00:52:14,353 - optuna.study.study - INFO - Trial 37 finished with values: [0.0006970951274808313, 0.0001373626373626374, 0.0003533299244996469] and parameters: {'n_layers': 2, 'embedding_dim': 256, 'lr': 4.8474474528468024e-05, 'lambda_val': 9.411942062780534e-06, 'batch_size': 2912, 'optimizer': 'RMSprop'}.
2026-06-23 00:53:24,317 - experiment_functions - INFO - Early stopping at epoch 1500. Best Metrics: (0.0004940130124271977, 0.00011683718580270305, 0.00027998549416356)
2026-06-23 00:53:24,395 - optuna.study.study - INFO - Trial 38 finished with values: [0.0004940130124271977, 0.00011683718580270305, 0.00027998549416356] and parameters: {'n_layers': 2, 'embedding_dim': 128, 'lr': 1.3111333390176455e-05, 'lambda_val': 3.832303953469631e-06, 'batch_size': 1432, 'optimizer': 'RMSprop'}.
2026-06-23 00:54:14,242 - experiment_functions - INFO - Early stopping at epoch 1150. Best Metrics: (0.013015785069551563, 0.002748831628141973, 0.007162112592816564)
2026-06-23 00:54:14,320 - optuna.study.study - INFO - Trial 39 finished with values: [0.013015785069551563, 0.002748831628141973, 0.007162112592816564] and parameters: {'n_layers': 1, 'embedding_dim': 64, 'lr': 0.0054915489808154486, 'lambda_val': 0.0010840808687380718, 'batch_size': 1270, 'optimizer': 'RMSprop'}.
2026-06-23 00:55:03,746 - experiment_functions - INFO - Early stopping at epoch 1150. Best Metrics: (0.0031394646758732448, 0.000663129973474801, 0.0017806319255061643)
2026-06-23 00:55:04,098 - optuna.study.study - INFO - Trial 40 finished with values: [0.0031394646758732448, 0.000663129973474801, 0.0017806319255061643] and parameters: {'n_layers': 1, 'embedding_dim': 96, 'lr': 0.05325919599509802, 'lambda_val': 0.04318888943100617, 'batch_size': 827, 'optimizer': 'RMSprop'}.
2026-06-23 00:55:29,405 - experiment_functions - INFO - Early stopping at epoch 550. Best Metrics: (0.009242904336438231, 0.0019830743968675003, 0.005267748638306269)
2026-06-23 00:55:29,983 - optuna.study.study - INFO - Trial 41 finished with values: [0.009242904336438231, 0.0019830743968675003, 0.005267748638306269] and parameters: {'n_layers': 3, 'embedding_dim': 32, 'lr': 0.006250784111486187, 'lambda_val': 3.418674010320819e-05, 'batch_size': 2340, 'optimizer': 'RMSprop'}.
2026-06-23 00:55:57,761 - experiment_functions - INFO - Early stopping at epoch 500. Best Metrics: (0.00044512732703940236, 0.00011367942402425162, 0.00027009036288433224)
2026-06-23 00:55:57,862 - optuna.study.study - INFO - Trial 42 finished with values: [0.00044512732703940236, 0.00011367942402425162, 0.00027009036288433224] and parameters: {'n_layers': 4, 'embedding_dim': 128, 'lr': 0.00027055862656996926, 'lambda_val': 6.765408248915509e-05, 'batch_size': 1424, 'optimizer': 'SGD'}.
2026-06-23 00:56:21,572 - experiment_functions - INFO - Early stopping at epoch 500. Best Metrics: (0.0004986734940673286, 0.00011841606669192875, 0.00026780900235645)
2026-06-23 00:56:21,658 - optuna.study.study - INFO - Trial 43 finished with values: [0.0004986734940673286, 0.00011841606669192875, 0.00026780900235645] and parameters: {'n_layers': 3, 'embedding_dim': 64, 'lr': 0.010426542278981389, 'lambda_val': 9.523175752962957e-05, 'batch_size': 870, 'optimizer': 'SGD'}.
2026-06-23 00:57:07,333 - experiment_functions - INFO - Early stopping at epoch 1050. Best Metrics: (0.0069196026864560955, 0.0014636225843122396, 0.003807237988741462)
2026-06-23 00:57:07,420 - optuna.study.study - INFO - Trial 44 finished with values: [0.0069196026864560955, 0.0014636225843122396, 0.003807237988741462] and parameters: {'n_layers': 3, 'embedding_dim': 32, 'lr': 0.015495037121918185, 'lambda_val': 2.0398413385251826e-06, 'batch_size': 2583, 'optimizer': 'Adam'}.
2026-06-23 00:57:31,515 - experiment_functions - INFO - Early stopping at epoch 500. Best Metrics: (0.0005239633086172747, 0.0001310471138057345, 0.0003010581448448461)
2026-06-23 00:57:31,678 - optuna.study.study - INFO - Trial 45 finished with values: [0.0005239633086172747, 0.0001310471138057345, 0.0003010581448448461] and parameters: {'n_layers': 2, 'embedding_dim': 96, 'lr': 0.00790601506412741, 'lambda_val': 0.004859722362303733, 'batch_size': 2354, 'optimizer': 'SGD'}.
2026-06-23 00:57:54,125 - experiment_functions - INFO - Early stopping at epoch 500. Best Metrics: (0.0005512226537283178, 0.0001184160666919288, 0.0002727896063570182)
2026-06-23 00:57:54,207 - optuna.study.study - INFO - Trial 46 finished with values: [0.0005512226537283178, 0.0001184160666919288, 0.0002727896063570182] and parameters: {'n_layers': 1, 'embedding_dim': 32, 'lr': 4.340587824810625e-05, 'lambda_val': 0.005815192552414719, 'batch_size': 1614, 'optimizer': 'SGD'}.
2026-06-23 00:58:19,141 - experiment_functions - INFO - Early stopping at epoch 500. Best Metrics: (0.0006729847387909256, 0.0001484148035872174, 0.000375731350039933)
2026-06-23 00:58:19,224 - optuna.study.study - INFO - Trial 47 finished with values: [0.0006729847387909256, 0.0001484148035872174, 0.000375731350039933] and parameters: {'n_layers': 3, 'embedding_dim': 96, 'lr': 0.00011915742587306721, 'lambda_val': 8.064793935683887e-06, 'batch_size': 1287, 'optimizer': 'SGD'}.
2026-06-23 01:01:06,303 - optuna.study.study - INFO - Trial 48 finished with values: [0.0007808432484252297, 0.00016104585070102312, 0.0004153951436440513] and parameters: {'n_layers': 4, 'embedding_dim': 32, 'lr': 4.043110559000417e-05, 'lambda_val': 3.913540568563244e-06, 'batch_size': 3526, 'optimizer': 'Adam'}.
2026-06-23 01:01:42,634 - experiment_functions - INFO - Early stopping at epoch 800. Best Metrics: (0.014889632410218333, 0.0031577617784514338, 0.008088858539058694)
2026-06-23 01:01:43,161 - optuna.study.study - INFO - Trial 49 finished with values: [0.014889632410218333, 0.0031577617784514338, 0.008088858539058694] and parameters: {'n_layers': 4, 'embedding_dim': 32, 'lr': 0.0016936188017047076, 'lambda_val': 1.105038231556551e-05, 'batch_size': 3305, 'optimizer': 'RMSprop'}.
2026-06-23 01:04:31,018 - optuna.study.study - INFO - Trial 50 finished with values: [0.027102159117146765, 0.005868700265251989, 0.015507276569804343] and parameters: {'n_layers': 2, 'embedding_dim': 32, 'lr': 0.0004463508454333929, 'lambda_val': 0.0016324316088680724, 'batch_size': 3203, 'optimizer': 'RMSprop'}.
2026-06-23 01:05:15,050 - experiment_functions - INFO - Early stopping at epoch 1000. Best Metrics: (0.010546869284909508, 0.0021867500315776176, 0.005863068044543752)
2026-06-23 01:05:15,138 - optuna.study.study - INFO - Trial 51 finished with values: [0.010546869284909508, 0.0021867500315776176, 0.005863068044543752] and parameters: {'n_layers': 3, 'embedding_dim': 32, 'lr': 0.010301320128047705, 'lambda_val': 1.1678222757114953e-05, 'batch_size': 2436, 'optimizer': 'RMSprop'}.
2026-06-23 01:05:37,873 - experiment_functions - INFO - Early stopping at epoch 500. Best Metrics: (0.0007279401570650067, 0.00015315144625489455, 0.0003786722537007442)
2026-06-23 01:05:37,955 - optuna.study.study - INFO - Trial 52 finished with values: [0.0007279401570650067, 0.00015315144625489455, 0.0003786722537007442] and parameters: {'n_layers': 2, 'embedding_dim': 32, 'lr': 0.009429082007684183, 'lambda_val': 0.00046869570822458774, 'batch_size': 1842, 'optimizer': 'SGD'}.
2026-06-23 01:06:04,208 - experiment_functions - INFO - Early stopping at epoch 550. Best Metrics: (0.008273066051101195, 0.0017778198812681573, 0.004567807482165742)
2026-06-23 01:06:04,292 - optuna.study.study - INFO - Trial 53 finished with values: [0.008273066051101195, 0.0017778198812681573, 0.004567807482165742] and parameters: {'n_layers': 2, 'embedding_dim': 64, 'lr': 0.009034566631006623, 'lambda_val': 0.0016324316088680724, 'batch_size': 1405, 'optimizer': 'Adam'}.
2026-06-23 01:06:30,218 - experiment_functions - INFO - Early stopping at epoch 550. Best Metrics: (0.005396710103510473, 0.0011478464064670962, 0.0029501072332492437)
2026-06-23 01:06:30,298 - optuna.study.study - INFO - Trial 54 finished with values: [0.005396710103510473, 0.0011478464064670962, 0.0029501072332492437] and parameters: {'n_layers': 4, 'embedding_dim': 32, 'lr': 0.06045802308039737, 'lambda_val': 3.611427784790995e-05, 'batch_size': 2381, 'optimizer': 'RMSprop'}.
2026-06-23 01:09:15,541 - optuna.study.study - INFO - Trial 55 finished with values: [0.0009146096121079346, 0.00023525325249463183, 0.0005405421865254069] and parameters: {'n_layers': 1, 'embedding_dim': 96, 'lr': 0.00027055862656996926, 'lambda_val': 6.765408248915509e-05, 'batch_size': 1424, 'optimizer': 'RMSprop'}.
2026-06-23 01:09:38,090 - experiment_functions - INFO - Early stopping at epoch 500. Best Metrics: (0.0005799426912981152, 0.00011525830491347732, 0.0003055823845172986)
2026-06-23 01:09:38,183 - optuna.study.study - INFO - Trial 56 finished with values: [0.0005799426912981152, 0.00011525830491347732, 0.0003055823845172986] and parameters: {'n_layers': 3, 'embedding_dim': 32, 'lr': 5.9338612353803386e-05, 'lambda_val': 0.00919381286512005, 'batch_size': 1095, 'optimizer': 'RMSprop'}.
2026-06-23 01:10:03,296 - experiment_functions - INFO - Early stopping at epoch 550. Best Metrics: (0.009217475093388947, 0.0020193886573196917, 0.005194098846721727)
2026-06-23 01:10:03,375 - optuna.study.study - INFO - Trial 57 finished with values: [0.009217475093388947, 0.0020193886573196917, 0.005194098846721727] and parameters: {'n_layers': 3, 'embedding_dim': 32, 'lr': 0.0057096641186942364, 'lambda_val': 1.1358678227612878e-06, 'batch_size': 2258, 'optimizer': 'RMSprop'}.
2026-06-23 01:10:30,810 - experiment_functions - INFO - Early stopping at epoch 550. Best Metrics: (0.010125742568944234, 0.0022120121258052297, 0.005618255651803615)
2026-06-23 01:10:30,886 - optuna.study.study - INFO - Trial 58 finished with values: [0.010125742568944234, 0.0022120121258052297, 0.005618255651803615] and parameters: {'n_layers': 4, 'embedding_dim': 64, 'lr': 0.0021019606239041683, 'lambda_val': 0.0010840808687380718, 'batch_size': 1270, 'optimizer': 'RMSprop'}.
2026-06-23 01:11:02,118 - experiment_functions - INFO - Early stopping at epoch 700. Best Metrics: (0.023994053025962983, 0.005314513073133763, 0.013228459696415848)
2026-06-23 01:11:02,186 - optuna.study.study - INFO - Trial 59 finished with values: [0.023994053025962983, 0.005314513073133763, 0.013228459696415848] and parameters: {'n_layers': 2, 'embedding_dim': 32, 'lr': 0.0025566338112489964, 'lambda_val': 0.0011345897854453913, 'batch_size': 1807, 'optimizer': 'Adam'}.
2026-06-23 01:11:31,190 - experiment_functions - INFO - Early stopping at epoch 550. Best Metrics: (0.007341115275271604, 0.001643615005683971, 0.0043329827340003735)
2026-06-23 01:11:31,313 - optuna.study.study - INFO - Trial 60 finished with values: [0.007341115275271604, 0.001643615005683971, 0.0043329827340003735] and parameters: {'n_layers': 4, 'embedding_dim': 96, 'lr': 0.004023997993481987, 'lambda_val': 0.0018733890709781709, 'batch_size': 922, 'optimizer': 'Adam'}.
2026-06-23 01:12:09,644 - experiment_functions - INFO - Early stopping at epoch 900. Best Metrics: (0.0005853734903513058, 0.0001405203991410888, 0.0003277952950223072)
2026-06-23 01:12:09,734 - optuna.study.study - INFO - Trial 61 finished with values: [0.0005853734903513058, 0.0001405203991410888, 0.0003277952950223072] and parameters: {'n_layers': 2, 'embedding_dim': 32, 'lr': 4.043110559000417e-05, 'lambda_val': 0.004859722362303733, 'batch_size': 2354, 'optimizer': 'Adam'}.
2026-06-23 01:12:31,858 - experiment_functions - INFO - Early stopping at epoch 500. Best Metrics: (0.0004119361316892291, 0.00010894278135657447, 0.0002243577897527678)
2026-06-23 01:12:31,956 - optuna.study.study - INFO - Trial 62 finished with values: [0.0004119361316892291, 0.00010894278135657447, 0.0002243577897527678] and parameters: {'n_layers': 1, 'embedding_dim': 32, 'lr': 0.005478446871857882, 'lambda_val': 1.0611453381984435e-05, 'batch_size': 3024, 'optimizer': 'SGD'}.
2026-06-23 01:15:12,449 - optuna.study.study - INFO - Trial 63 finished with values: [0.014747191445049934, 0.0032840722495894913, 0.009063306429862946] and parameters: {'n_layers': 1, 'embedding_dim': 32, 'lr': 0.0006919442047023748, 'lambda_val': 4.998160662190083e-05, 'batch_size': 827, 'optimizer': 'RMSprop'}.
2026-06-23 01:16:26,524 - experiment_functions - INFO - Early stopping at epoch 1350. Best Metrics: (0.000534285354016145, 0.00012631047113805733, 0.0002879839846773259)
2026-06-23 01:16:26,617 - optuna.study.study - INFO - Trial 64 finished with values: [0.000534285354016145, 0.00012631047113805733, 0.0002879839846773259] and parameters: {'n_layers': 2, 'embedding_dim': 256, 'lr': 6.634644386405602e-05, 'lambda_val': 1.7009465225795167e-06, 'batch_size': 1485, 'optimizer': 'RMSprop'}.
2026-06-23 01:16:50,385 - experiment_functions - INFO - Early stopping at epoch 500. Best Metrics: (0.0005135794189418916, 0.00011052166224580017, 0.0002454657258490399)
2026-06-23 01:16:50,496 - optuna.study.study - INFO - Trial 65 finished with values: [0.0005135794189418916, 0.00011052166224580017, 0.0002454657258490399] and parameters: {'n_layers': 1, 'embedding_dim': 64, 'lr': 0.0001087217845914255, 'lambda_val': 0.05428757178211284, 'batch_size': 3569, 'optimizer': 'RMSprop'}.
2026-06-23 01:18:51,066 - experiment_functions - INFO - Early stopping at epoch 2900. Best Metrics: (0.031159382711655005, 0.006707086017430846, 0.01757369272315822)
2026-06-23 01:18:51,163 - optuna.study.study - INFO - Trial 66 finished with values: [0.031159382711655005, 0.006707086017430846, 0.01757369272315822] and parameters: {'n_layers': 1, 'embedding_dim': 32, 'lr': 0.0008639986019635256, 'lambda_val': 0.005404522144278895, 'batch_size': 2754, 'optimizer': 'RMSprop'}.
2026-06-23 01:19:16,528 - experiment_functions - INFO - Early stopping at epoch 550. Best Metrics: (0.0066513317523195364, 0.001438360490084628, 0.00364140143481707)
2026-06-23 01:19:16,598 - optuna.study.study - INFO - Trial 67 finished with values: [0.0066513317523195364, 0.001438360490084628, 0.00364140143481707] and parameters: {'n_layers': 4, 'embedding_dim': 32, 'lr': 0.050940040347919505, 'lambda_val': 2.1976623094647643e-05, 'batch_size': 2583, 'optimizer': 'RMSprop'}.
2026-06-23 01:19:45,427 - experiment_functions - INFO - Early stopping at epoch 550. Best Metrics: (0.0068248425931769306, 0.0015109890109890113, 0.004000931258446083)
2026-06-23 01:19:46,106 - optuna.study.study - INFO - Trial 68 finished with values: [0.0068248425931769306, 0.0015109890109890113, 0.004000931258446083] and parameters: {'n_layers': 4, 'embedding_dim': 96, 'lr': 0.004023997993481987, 'lambda_val': 0.0005196802788376184, 'batch_size': 1270, 'optimizer': 'Adam'}.
2026-06-23 01:20:56,792 - experiment_functions - INFO - Early stopping at epoch 1700. Best Metrics: (0.004348932575238893, 0.001076796766451939, 0.0023936499539556504)
2026-06-23 01:20:56,902 - optuna.study.study - INFO - Trial 69 finished with values: [0.004348932575238893, 0.001076796766451939, 0.0023936499539556504] and parameters: {'n_layers': 1, 'embedding_dim': 64, 'lr': 0.0054915489808154486, 'lambda_val': 0.06545143277558642, 'batch_size': 3247, 'optimizer': 'RMSprop'}.
2026-06-23 01:21:21,820 - experiment_functions - INFO - Early stopping at epoch 500. Best Metrics: (0.000421753670781556, 0.00010104837691044589, 0.00025058792259059553)
2026-06-23 01:21:21,953 - optuna.study.study - INFO - Trial 70 finished with values: [0.000421753670781556, 0.00010104837691044589, 0.00025058792259059553] and parameters: {'n_layers': 3, 'embedding_dim': 96, 'lr': 0.00015736597604167302, 'lambda_val': 1.2083782185147504e-05, 'batch_size': 772, 'optimizer': 'SGD'}.
2026-06-23 01:21:47,633 - experiment_functions - INFO - Early stopping at epoch 550. Best Metrics: (0.007405430108016185, 0.0016972969559176457, 0.004210138968623229)
2026-06-23 01:21:47,725 - optuna.study.study - INFO - Trial 71 finished with values: [0.007405430108016185, 0.0016972969559176457, 0.004210138968623229] and parameters: {'n_layers': 2, 'embedding_dim': 64, 'lr': 0.009034566631006623, 'lambda_val': 0.0016324316088680724, 'batch_size': 1341, 'optimizer': 'Adam'}.
2026-06-23 01:22:22,568 - experiment_functions - INFO - Early stopping at epoch 750. Best Metrics: (0.007676277376095761, 0.0016420361247947454, 0.004246784412803313)
2026-06-23 01:22:23,050 - optuna.study.study - INFO - Trial 72 finished with values: [0.007676277376095761, 0.0016420361247947454, 0.004246784412803313] and parameters: {'n_layers': 3, 'embedding_dim': 64, 'lr': 0.025476922000667732, 'lambda_val': 1.3309158700614962e-05, 'batch_size': 2215, 'optimizer': 'Adam'}.
2026-06-23 01:22:47,156 - experiment_functions - INFO - Early stopping at epoch 550. Best Metrics: (0.0045771989627243805, 0.001121005431350259, 0.002890344240927396)
2026-06-23 01:22:47,232 - optuna.study.study - INFO - Trial 73 finished with values: [0.0045771989627243805, 0.001121005431350259, 0.002890344240927396] and parameters: {'n_layers': 1, 'embedding_dim': 32, 'lr': 0.05325919599509802, 'lambda_val': 0.04318888943100617, 'batch_size': 827, 'optimizer': 'Adam'}.
2026-06-23 01:23:12,518 - experiment_functions - INFO - Early stopping at epoch 550. Best Metrics: (0.009066244204232748, 0.0019183402804092459, 0.005263723142795456)
2026-06-23 01:23:12,783 - optuna.study.study - INFO - Trial 74 finished with values: [0.009066244204232748, 0.0019183402804092459, 0.005263723142795456] and parameters: {'n_layers': 3, 'embedding_dim': 32, 'lr': 0.010581481753294916, 'lambda_val': 1.1358678227612878e-06, 'batch_size': 3210, 'optimizer': 'RMSprop'}.
2026-06-23 01:23:39,844 - experiment_functions - INFO - Early stopping at epoch 600. Best Metrics: (0.010753591654710733, 0.0022799040040419353, 0.005983282940814185)
2026-06-23 01:23:39,925 - optuna.study.study - INFO - Trial 75 finished with values: [0.010753591654710733, 0.0022799040040419353, 0.005983282940814185] and parameters: {'n_layers': 1, 'embedding_dim': 64, 'lr': 0.010581481753294916, 'lambda_val': 0.0010840808687380718, 'batch_size': 2258, 'optimizer': 'RMSprop'}.
2026-06-23 01:24:36,724 - experiment_functions - INFO - Early stopping at epoch 1050. Best Metrics: (0.017601189110857587, 0.0037561576354679803, 0.009537875616314523)
