2026-06-21 21:58:12,358 - optuna.study.study - INFO - Trial 70 finished with values: [0.005164615434929966, 0.001244158140709865, 0.0032206053183858373] and parameters: {'n_layers': 1, 'embedding_dim': 128, 'lr': 0.002103872362755323, 'lambda_val': 1.722399276566065e-05, 'batch_size': 3404, 'optimizer': 'RMSprop'}.
2026-06-21 21:58:48,414 - experiment_functions - INFO - Early stopping at epoch 750. Best Metrics: (0.005047350093506556, 0.0012741568776051533, 0.0030756446476653933)
2026-06-21 21:58:48,514 - optuna.study.study - INFO - Trial 71 finished with values: [0.005047350093506556, 0.0012741568776051533, 0.0030756446476653933] and parameters: {'n_layers': 2, 'embedding_dim': 128, 'lr': 0.011414707006697713, 'lambda_val': 1.5907426738824427e-06, 'batch_size': 3879, 'optimizer': 'Adam'}.
2026-06-21 21:59:15,280 - experiment_functions - INFO - Early stopping at epoch 500. Best Metrics: (0.0004555675755855603, 9.789061513199444e-05, 0.00025944768902702386)
2026-06-21 21:59:15,378 - optuna.study.study - INFO - Trial 72 finished with values: [0.0004555675755855603, 9.789061513199444e-05, 0.00025944768902702386] and parameters: {'n_layers': 2, 'embedding_dim': 256, 'lr': 0.0003379840319553962, 'lambda_val': 0.005760256717085571, 'batch_size': 2680, 'optimizer': 'SGD'}.
2026-06-21 22:00:03,264 - experiment_functions - INFO - Early stopping at epoch 1100. Best Metrics: (0.007697968129586652, 0.0019625489453075663, 0.004548049132015255)
2026-06-21 22:00:03,356 - optuna.study.study - INFO - Trial 73 finished with values: [0.007697968129586652, 0.0019625489453075663, 0.004548049132015255] and parameters: {'n_layers': 3, 'embedding_dim': 32, 'lr': 0.0009291368086645142, 'lambda_val': 0.014586536668900354, 'batch_size': 2127, 'optimizer': 'RMSprop'}.
2026-06-21 22:02:52,763 - optuna.study.study - INFO - Trial 74 finished with values: [0.014254571945031769, 0.0034593280282935457, 0.008514832254391374] and parameters: {'n_layers': 4, 'embedding_dim': 32, 'lr': 0.000927601540662843, 'lambda_val': 1.1454689220118589e-06, 'batch_size': 835, 'optimizer': 'RMSprop'}.
2026-06-21 22:05:36,860 - optuna.study.study - INFO - Trial 75 finished with values: [0.004893074899637761, 0.001075217885562713, 0.0030094494690642813] and parameters: {'n_layers': 1, 'embedding_dim': 96, 'lr': 0.0009291368086645142, 'lambda_val': 3.602866380465963e-05, 'batch_size': 1429, 'optimizer': 'Adam'}.
2026-06-21 22:06:59,935 - experiment_functions - INFO - Early stopping at epoch 2050. Best Metrics: (0.0006202306600627469, 0.00013262599469496023, 0.00033050786312924143)
2026-06-21 22:07:00,025 - optuna.study.study - INFO - Trial 76 finished with values: [0.0006202306600627469, 0.00013262599469496023, 0.00033050786312924143] and parameters: {'n_layers': 1, 'embedding_dim': 64, 'lr': 3.5778108426865314e-05, 'lambda_val': 0.000470129247662684, 'batch_size': 2883, 'optimizer': 'RMSprop'}.
2026-06-21 22:07:24,357 - experiment_functions - INFO - Early stopping at epoch 500. Best Metrics: (0.002470754611963595, 0.000557344953896678, 0.0016232146333589785)
2026-06-21 22:07:24,452 - optuna.study.study - INFO - Trial 77 finished with values: [0.002470754611963595, 0.000557344953896678, 0.0016232146333589785] and parameters: {'n_layers': 4, 'embedding_dim': 96, 'lr': 0.06357360200439584, 'lambda_val': 0.0005885182255384318, 'batch_size': 1925, 'optimizer': 'RMSprop'}.
2026-06-21 22:09:58,709 - experiment_functions - INFO - Early stopping at epoch 3800. Best Metrics: (0.005250376884943143, 0.001121005431350259, 0.0029768209616697107)
2026-06-21 22:09:58,779 - optuna.study.study - INFO - Trial 78 finished with values: [0.005250376884943143, 0.001121005431350259, 0.0029768209616697107] and parameters: {'n_layers': 1, 'embedding_dim': 32, 'lr': 0.0009291368086645142, 'lambda_val': 0.0009695798239708334, 'batch_size': 2998, 'optimizer': 'RMSprop'}.
2026-06-21 22:11:01,201 - experiment_functions - INFO - Early stopping at epoch 1500. Best Metrics: (0.0029656033365559387, 0.0007957559681697613, 0.001724384520850629)
2026-06-21 22:11:01,291 - optuna.study.study - INFO - Trial 79 finished with values: [0.0029656033365559387, 0.0007957559681697613, 0.001724384520850629] and parameters: {'n_layers': 1, 'embedding_dim': 64, 'lr': 0.008336134108304867, 'lambda_val': 0.008346397718366885, 'batch_size': 1964, 'optimizer': 'RMSprop'}.
2026-06-21 22:11:34,023 - experiment_functions - INFO - Early stopping at epoch 700. Best Metrics: (0.009667119319549085, 0.0024725274725274724, 0.0060397243813583535)
2026-06-21 22:11:34,103 - optuna.study.study - INFO - Trial 80 finished with values: [0.009667119319549085, 0.0024725274725274724, 0.0060397243813583535] and parameters: {'n_layers': 4, 'embedding_dim': 64, 'lr': 0.0022550052450588096, 'lambda_val': 1.4463129473968207e-05, 'batch_size': 1925, 'optimizer': 'RMSprop'}.
2026-06-21 22:12:03,803 - experiment_functions - INFO - Early stopping at epoch 600. Best Metrics: (0.007542216520789135, 0.0019088669950738917, 0.004507918331543833)
2026-06-21 22:12:03,905 - optuna.study.study - INFO - Trial 81 finished with values: [0.007542216520789135, 0.0019088669950738917, 0.004507918331543833] and parameters: {'n_layers': 4, 'embedding_dim': 96, 'lr': 0.0061929658043178674, 'lambda_val': 2.804628755433142e-06, 'batch_size': 3721, 'optimizer': 'Adam'}.
2026-06-21 22:12:30,167 - experiment_functions - INFO - Early stopping at epoch 550. Best Metrics: (0.003118833126526595, 0.0007657572312744728, 0.00197108888458886)
2026-06-21 22:12:30,250 - optuna.study.study - INFO - Trial 82 finished with values: [0.003118833126526595, 0.0007657572312744728, 0.00197108888458886] and parameters: {'n_layers': 2, 'embedding_dim': 96, 'lr': 0.05397886496255383, 'lambda_val': 3.405137805260979e-05, 'batch_size': 1169, 'optimizer': 'RMSprop'}.
2026-06-21 22:13:03,136 - experiment_functions - INFO - Early stopping at epoch 750. Best Metrics: (0.0037369968152442495, 0.0008447012757357584, 0.002197417476637775)
2026-06-21 22:13:03,229 - optuna.study.study - INFO - Trial 83 finished with values: [0.0037369968152442495, 0.0008447012757357584, 0.002197417476637775] and parameters: {'n_layers': 1, 'embedding_dim': 32, 'lr': 0.0022550052450588096, 'lambda_val': 0.014586536668900354, 'batch_size': 1925, 'optimizer': 'RMSprop'}.
2026-06-21 22:13:47,486 - experiment_functions - INFO - Early stopping at epoch 900. Best Metrics: (0.007673285364336388, 0.0019957054439813065, 0.004557787712088986)
2026-06-21 22:13:47,561 - optuna.study.study - INFO - Trial 84 finished with values: [0.007673285364336388, 0.0019957054439813065, 0.004557787712088986] and parameters: {'n_layers': 3, 'embedding_dim': 128, 'lr': 0.0016253610840212534, 'lambda_val': 0.0009695798239708334, 'batch_size': 2666, 'optimizer': 'Adam'}.
2026-06-21 22:14:38,248 - experiment_functions - INFO - Early stopping at epoch 1200. Best Metrics: (0.00043895830140555794, 0.0001231527093596059, 0.0002612436556700076)
2026-06-21 22:14:38,319 - optuna.study.study - INFO - Trial 85 finished with values: [0.00043895830140555794, 0.0001231527093596059, 0.0002612436556700076] and parameters: {'n_layers': 3, 'embedding_dim': 32, 'lr': 3.5778108426865314e-05, 'lambda_val': 0.0009695798239708334, 'batch_size': 2998, 'optimizer': 'RMSprop'}.
2026-06-21 22:17:52,168 - optuna.study.study - INFO - Trial 86 finished with values: [0.004535327399045863, 0.0010910066944549701, 0.002764730889756407] and parameters: {'n_layers': 2, 'embedding_dim': 256, 'lr': 0.00045961706816760893, 'lambda_val': 0.003986025781307465, 'batch_size': 1295, 'optimizer': 'Adam'}.
2026-06-21 22:18:25,476 - experiment_functions - INFO - Early stopping at epoch 700. Best Metrics: (0.0028635930456752277, 0.0007783882783882784, 0.0017748905332503732)
2026-06-21 22:18:25,649 - optuna.study.study - INFO - Trial 87 finished with values: [0.0028635930456752277, 0.0007783882783882784, 0.0017748905332503732] and parameters: {'n_layers': 1, 'embedding_dim': 256, 'lr': 0.015836500648249808, 'lambda_val': 0.014586536668900354, 'batch_size': 2127, 'optimizer': 'RMSprop'}.
2026-06-21 22:18:56,041 - experiment_functions - INFO - Early stopping at epoch 550. Best Metrics: (0.0037766369002704284, 0.0009568018188707845, 0.002190611320173239)
2026-06-21 22:18:56,130 - optuna.study.study - INFO - Trial 88 finished with values: [0.0037766369002704284, 0.0009568018188707845, 0.002190611320173239] and parameters: {'n_layers': 3, 'embedding_dim': 256, 'lr': 0.01594273164121028, 'lambda_val': 0.0005885182255384318, 'batch_size': 2959, 'optimizer': 'RMSprop'}.
2026-06-21 22:21:31,015 - optuna.study.study - INFO - Trial 89 finished with values: [0.0005062901742893414, 0.00010578501957812304, 0.0002669164253918138] and parameters: {'n_layers': 1, 'embedding_dim': 32, 'lr': 3.5778108426865314e-05, 'lambda_val': 0.000470129247662684, 'batch_size': 2883, 'optimizer': 'RMSprop'}.
2026-06-21 22:22:45,881 - experiment_functions - INFO - Early stopping at epoch 1750. Best Metrics: (0.006047832061884231, 0.0015078312492105596, 0.003654869273867134)
2026-06-21 22:22:45,959 - optuna.study.study - INFO - Trial 90 finished with values: [0.006047832061884231, 0.0015078312492105596, 0.003654869273867134] and parameters: {'n_layers': 2, 'embedding_dim': 96, 'lr': 0.001722483120017554, 'lambda_val': 3.602866380465963e-05, 'batch_size': 3721, 'optimizer': 'Adam'}.
2026-06-21 22:23:09,866 - experiment_functions - INFO - Early stopping at epoch 500. Best Metrics: (0.0005263968604991121, 0.00011210054313502589, 0.0002708116072108999)
2026-06-21 22:23:09,960 - optuna.study.study - INFO - Trial 91 finished with values: [0.0005263968604991121, 0.00011210054313502589, 0.0002708116072108999] and parameters: {'n_layers': 4, 'embedding_dim': 96, 'lr': 0.015836500648249808, 'lambda_val': 0.051732878185341245, 'batch_size': 2127, 'optimizer': 'SGD'}.
2026-06-21 22:23:42,344 - experiment_functions - INFO - Early stopping at epoch 550. Best Metrics: (0.004726863150804937, 0.0011778451433623847, 0.002630366029441035)
2026-06-21 22:23:42,435 - optuna.study.study - INFO - Trial 92 finished with values: [0.004726863150804937, 0.0011778451433623847, 0.002630366029441035] and parameters: {'n_layers': 4, 'embedding_dim': 256, 'lr': 0.01594273164121028, 'lambda_val': 0.003986025781307465, 'batch_size': 1550, 'optimizer': 'Adam'}.
2026-06-21 22:26:21,020 - optuna.study.study - INFO - Trial 93 finished with values: [0.005205981759027965, 0.0011510041682455477, 0.003051433184597477] and parameters: {'n_layers': 1, 'embedding_dim': 32, 'lr': 0.0008655839340917536, 'lambda_val': 0.00018061190205868213, 'batch_size': 2127, 'optimizer': 'RMSprop'}.
2026-06-21 22:26:53,444 - experiment_functions - INFO - Early stopping at epoch 550. Best Metrics: (0.0073431300744012445, 0.001834659593280283, 0.00427094417342315)
2026-06-21 22:26:53,517 - optuna.study.study - INFO - Trial 94 finished with values: [0.0073431300744012445, 0.001834659593280283, 0.00427094417342315] and parameters: {'n_layers': 4, 'embedding_dim': 256, 'lr': 0.002520906950052724, 'lambda_val': 0.0009695798239708334, 'batch_size': 3395, 'optimizer': 'RMSprop'}.
2026-06-21 22:27:31,343 - experiment_functions - INFO - Early stopping at epoch 900. Best Metrics: (0.004218486219945611, 0.0010515346722243274, 0.0026132159068628334)
2026-06-21 22:27:31,554 - optuna.study.study - INFO - Trial 95 finished with values: [0.004218486219945611, 0.0010515346722243274, 0.0026132159068628334] and parameters: {'n_layers': 2, 'embedding_dim': 32, 'lr': 0.011955866081987015, 'lambda_val': 1.637764938555515e-05, 'batch_size': 569, 'optimizer': 'Adam'}.
2026-06-21 22:30:08,154 - experiment_functions - INFO - Early stopping at epoch 3650. Best Metrics: (0.0007033984225189499, 0.00015946696981179742, 0.0003809774100476882)
2026-06-21 22:30:08,241 - optuna.study.study - INFO - Trial 96 finished with values: [0.0007033984225189499, 0.00015946696981179742, 0.0003809774100476882] and parameters: {'n_layers': 3, 'embedding_dim': 96, 'lr': 9.568347469317345e-05, 'lambda_val': 0.011778775382543278, 'batch_size': 2354, 'optimizer': 'RMSprop'}.
2026-06-21 22:30:54,663 - experiment_functions - INFO - Early stopping at epoch 850. Best Metrics: (0.0073664853386622604, 0.0018678160919540232, 0.004467426334627401)
2026-06-21 22:30:54,759 - optuna.study.study - INFO - Trial 97 finished with values: [0.0073664853386622604, 0.0018678160919540232, 0.004467426334627401] and parameters: {'n_layers': 3, 'embedding_dim': 256, 'lr': 0.0016253610840212534, 'lambda_val': 3.405137805260979e-05, 'batch_size': 2998, 'optimizer': 'Adam'}.
2026-06-21 22:33:38,474 - optuna.study.study - INFO - Trial 98 finished with values: [0.004807645466498551, 0.0011146899077933562, 0.0028972221596930982] and parameters: {'n_layers': 1, 'embedding_dim': 96, 'lr': 0.0016184592928403282, 'lambda_val': 0.00016636579348901437, 'batch_size': 1343, 'optimizer': 'Adam'}.
2026-06-21 22:34:02,071 - experiment_functions - INFO - Early stopping at epoch 500. Best Metrics: (0.0005180581537855469, 0.0001231527093596059, 0.0002751228940392536)
2026-06-21 22:34:02,596 - optuna.study.study - INFO - Trial 99 finished with values: [0.0005180581537855469, 0.0001231527093596059, 0.0002751228940392536] and parameters: {'n_layers': 3, 'embedding_dim': 96, 'lr': 0.0003379840319553962, 'lambda_val': 0.005760256717085571, 'batch_size': 1383, 'optimizer': 'SGD'}.
2026-06-21 22:37:20,021 - optuna.study.study - INFO - Trial 100 finished with values: [0.005187034037074337, 0.0012394214980421877, 0.0032503393577155344] and parameters: {'n_layers': 2, 'embedding_dim': 256, 'lr': 0.00045961706816760893, 'lambda_val': 0.0009695798239708334, 'batch_size': 1802, 'optimizer': 'Adam'}.
2026-06-21 22:40:06,753 - optuna.study.study - INFO - Trial 101 finished with values: [0.00906323742205953, 0.0023572691676139955, 0.005789173957432714] and parameters: {'n_layers': 3, 'embedding_dim': 32, 'lr': 0.0008655839340917536, 'lambda_val': 3.405137805260979e-05, 'batch_size': 2127, 'optimizer': 'Adam'}.
2026-06-21 22:41:21,500 - experiment_functions - INFO - Early stopping at epoch 1850. Best Metrics: (0.0037474192798304866, 0.0008352279904004043, 0.0022393667775334808)
2026-06-21 22:41:21,592 - optuna.study.study - INFO - Trial 102 finished with values: [0.0037474192798304866, 0.0008352279904004043, 0.0022393667775334808] and parameters: {'n_layers': 1, 'embedding_dim': 32, 'lr': 0.0009291368086645142, 'lambda_val': 0.014586536668900354, 'batch_size': 2127, 'optimizer': 'RMSprop'}.
2026-06-21 22:42:19,162 - experiment_functions - INFO - Early stopping at epoch 1350. Best Metrics: (0.010160574087105138, 0.0025641025641025637, 0.006131021965169728)
2026-06-21 22:42:19,248 - optuna.study.study - INFO - Trial 103 finished with values: [0.010160574087105138, 0.0025641025641025637, 0.006131021965169728] and parameters: {'n_layers': 4, 'embedding_dim': 32, 'lr': 0.000927601540662843, 'lambda_val': 0.0009695798239708334, 'batch_size': 3404, 'optimizer': 'RMSprop'}.
2026-06-21 22:43:11,473 - experiment_functions - INFO - Early stopping at epoch 1150. Best Metrics: (0.00493015956863166, 0.0013278388278388277, 0.003046575190360927)
2026-06-21 22:43:11,570 - optuna.study.study - INFO - Trial 104 finished with values: [0.00493015956863166, 0.0013278388278388277, 0.003046575190360927] and parameters: {'n_layers': 2, 'embedding_dim': 128, 'lr': 0.0009291368086645142, 'lambda_val': 0.014586536668900354, 'batch_size': 2127, 'optimizer': 'RMSprop'}.
2026-06-21 22:44:37,961 - experiment_functions - INFO - Early stopping at epoch 1800. Best Metrics: (0.012830456402720302, 0.003214601490463559, 0.007933623477396007)
2026-06-21 22:44:38,046 - optuna.study.study - INFO - Trial 105 finished with values: [0.012830456402720302, 0.003214601490463559, 0.007933623477396007] and parameters: {'n_layers': 4, 'embedding_dim': 128, 'lr': 0.000927601540662843, 'lambda_val': 1.1454689220118589e-06, 'batch_size': 928, 'optimizer': 'RMSprop'}.
2026-06-21 22:45:00,967 - experiment_functions - INFO - Early stopping at epoch 500. Best Metrics: (0.0005559643396934506, 0.00013262599469496023, 0.0002902636064292079)
2026-06-21 22:45:01,052 - optuna.study.study - INFO - Trial 106 finished with values: [0.0005559643396934506, 0.00013262599469496023, 0.0002902636064292079] and parameters: {'n_layers': 1, 'embedding_dim': 96, 'lr': 0.0009291368086645142, 'lambda_val': 0.0012170439113530704, 'batch_size': 1429, 'optimizer': 'SGD'}.
2026-06-21 22:47:45,724 - optuna.study.study - INFO - Trial 107 finished with values: [0.007079971039224432, 0.0016578249336870027, 0.004373928975950151] and parameters: {'n_layers': 2, 'embedding_dim': 32, 'lr': 0.0007483728360217162, 'lambda_val': 4.919667530385041e-05, 'batch_size': 1389, 'optimizer': 'RMSprop'}.
2026-06-21 22:48:11,062 - experiment_functions - INFO - Early stopping at epoch 500. Best Metrics: (0.0005180600126442444, 0.00012315270935960593, 0.00034567561297441346)
2026-06-21 22:48:11,226 - optuna.study.study - INFO - Trial 108 finished with values: [0.0005180600126442444, 0.00012315270935960593, 0.00034567561297441346] and parameters: {'n_layers': 3, 'embedding_dim': 128, 'lr': 0.0011267070786255592, 'lambda_val': 0.002536649916066294, 'batch_size': 3477, 'optimizer': 'SGD'}.
2026-06-21 22:48:38,794 - experiment_functions - INFO - Early stopping at epoch 600. Best Metrics: (0.007429200079391922, 0.0018441328786156373, 0.00455698178866812)
2026-06-21 22:48:38,889 - optuna.study.study - INFO - Trial 109 finished with values: [0.007429200079391922, 0.0018441328786156373, 0.00455698178866812] and parameters: {'n_layers': 4, 'embedding_dim': 32, 'lr': 0.011955866081987015, 'lambda_val': 2.971203887257013e-06, 'batch_size': 2194, 'optimizer': 'Adam'}.
2026-06-21 22:50:12,834 - experiment_functions - INFO - Early stopping at epoch 2000. Best Metrics: (0.01095322046453528, 0.0027235695339143614, 0.006746620922826876)
2026-06-21 22:50:12,918 - optuna.study.study - INFO - Trial 110 finished with values: [0.01095322046453528, 0.0027235695339143614, 0.006746620922826876] and parameters: {'n_layers': 3, 'embedding_dim': 128, 'lr': 0.0007483728360217162, 'lambda_val': 0.0003952312828567359, 'batch_size': 1429, 'optimizer': 'RMSprop'}.
2026-06-21 22:53:08,274 - optuna.study.study - INFO - Trial 111 finished with values: [0.006723373237184031, 0.0016294050776809396, 0.004169170961635598] and parameters: {'n_layers': 2, 'embedding_dim': 128, 'lr': 0.00045961706816760893, 'lambda_val': 3.195908557073349e-05, 'batch_size': 3329, 'optimizer': 'RMSprop'}.
2026-06-21 22:53:41,057 - experiment_functions - INFO - Early stopping at epoch 700. Best Metrics: (0.005261888963721829, 0.001277314639383605, 0.0031147957142636682)
2026-06-21 22:53:41,161 - optuna.study.study - INFO - Trial 112 finished with values: [0.005261888963721829, 0.001277314639383605, 0.0031147957142636682] and parameters: {'n_layers': 2, 'embedding_dim': 128, 'lr': 0.01035266447760807, 'lambda_val': 0.00015102663635375033, 'batch_size': 1658, 'optimizer': 'Adam'}.
2026-06-21 22:55:00,963 - experiment_functions - INFO - Early stopping at epoch 1950. Best Metrics: (0.0038188213142790876, 0.000841543513957307, 0.0022861141715974013)
2026-06-21 22:55:01,047 - optuna.study.study - INFO - Trial 113 finished with values: [0.0038188213142790876, 0.000841543513957307, 0.0022861141715974013] and parameters: {'n_layers': 1, 'embedding_dim': 32, 'lr': 0.0008655839340917536, 'lambda_val': 0.003986025781307465, 'batch_size': 3220, 'optimizer': 'Adam'}.
2026-06-21 22:55:25,158 - experiment_functions - INFO - Early stopping at epoch 500. Best Metrics: (0.0005275324056053629, 0.00012631047113805736, 0.00027940658607753373)
2026-06-21 22:55:25,867 - optuna.study.study - INFO - Trial 114 finished with values: [0.0005275324056053629, 0.00012631047113805736, 0.00027940658607753373] and parameters: {'n_layers': 4, 'embedding_dim': 96, 'lr': 0.000927601540662843, 'lambda_val': 0.002536649916066294, 'batch_size': 1169, 'optimizer': 'SGD'}.
2026-06-21 22:56:05,712 - experiment_functions - INFO - Early stopping at epoch 950. Best Metrics: (0.003933230148257695, 0.0009915371984337501, 0.002526197208415487)
2026-06-21 22:56:05,805 - optuna.study.study - INFO - Trial 115 finished with values: [0.003933230148257695, 0.0009915371984337501, 0.002526197208415487] and parameters: {'n_layers': 1, 'embedding_dim': 32, 'lr': 0.007083700783329076, 'lambda_val': 2.971203887257013e-06, 'batch_size': 2194, 'optimizer': 'RMSprop'}.
2026-06-21 22:58:16,235 - experiment_functions - INFO - Early stopping at epoch 2350. Best Metrics: (0.0076669686611569865, 0.002011494252873563, 0.004537210290151741)
2026-06-21 22:58:16,333 - optuna.study.study - INFO - Trial 116 finished with values: [0.0076669686611569865, 0.002011494252873563, 0.004537210290151741] and parameters: {'n_layers': 4, 'embedding_dim': 256, 'lr': 0.00045961706816760893, 'lambda_val': 0.003986025781307465, 'batch_size': 1295, 'optimizer': 'Adam'}.
2026-06-21 23:01:00,657 - optuna.study.study - INFO - Trial 117 finished with values: [0.009023371285506867, 0.002243589743589744, 0.005530210453594346] and parameters: {'n_layers': 3, 'embedding_dim': 32, 'lr': 0.000927601540662843, 'lambda_val': 0.0011958935689814394, 'batch_size': 1169, 'optimizer': 'Adam'}.
2026-06-21 23:03:48,454 - optuna.study.study - INFO - Trial 118 finished with values: [0.014244248503103222, 0.0034309081722874828, 0.008599986773351278] and parameters: {'n_layers': 4, 'embedding_dim': 32, 'lr': 0.000927601540662843, 'lambda_val': 1.1454689220118589e-06, 'batch_size': 835, 'optimizer': 'RMSprop'}.
2026-06-21 23:04:43,306 - experiment_functions - INFO - Early stopping at epoch 1250. Best Metrics: (0.009780628801520573, 0.002480421876973601, 0.006017747809982769)
