2026-06-19 05:42:56,791 - optuna.study.study - INFO - Trial 277 finished with values: [0.03440587681690831, 0.007086017430845018, 0.019845419860943247] and parameters: {'n_layers': 1, 'embedding_dim': 64, 'lr': 0.0012134658370028314, 'lambda_val': 1.356629670066784e-05, 'batch_size': 2499, 'optimizer': 'Adam'}.
2026-06-19 05:44:13,566 - experiment_functions - INFO - Early stopping at epoch 1650. Best Metrics: (0.033057517723006385, 0.006921813818365544, 0.019293151918557263)
2026-06-19 05:44:13,653 - optuna.study.study - INFO - Trial 278 finished with values: [0.033057517723006385, 0.006921813818365544, 0.019293151918557263] and parameters: {'n_layers': 1, 'embedding_dim': 128, 'lr': 0.000870520171613823, 'lambda_val': 0.0008294227855036249, 'batch_size': 3565, 'optimizer': 'RMSprop'}.
2026-06-19 05:44:39,261 - experiment_functions - INFO - Early stopping at epoch 550. Best Metrics: (0.01403800567486211, 0.0031135531135531138, 0.007901629754479774)
2026-06-19 05:44:39,357 - optuna.study.study - INFO - Trial 279 finished with values: [0.01403800567486211, 0.0031135531135531138, 0.007901629754479774] and parameters: {'n_layers': 1, 'embedding_dim': 64, 'lr': 0.0269132962917652, 'lambda_val': 0.0008294227855036249, 'batch_size': 2155, 'optimizer': 'Adam'}.
2026-06-19 05:47:41,795 - optuna.study.study - INFO - Trial 280 finished with values: [0.03212008175421789, 0.006754452444107616, 0.01866478069577513] and parameters: {'n_layers': 1, 'embedding_dim': 128, 'lr': 0.000870520171613823, 'lambda_val': 5.816309683274336e-06, 'batch_size': 2501, 'optimizer': 'Adam'}.
2026-06-19 05:49:34,111 - experiment_functions - INFO - Early stopping at epoch 2250. Best Metrics: (0.028814544551585632, 0.006193949728432488, 0.016242673674426777)
2026-06-19 05:49:34,207 - optuna.study.study - INFO - Trial 281 finished with values: [0.028814544551585632, 0.006193949728432488, 0.016242673674426777] and parameters: {'n_layers': 1, 'embedding_dim': 256, 'lr': 0.000870520171613823, 'lambda_val': 0.0035219670834744942, 'batch_size': 2155, 'optimizer': 'Adam'}.
2026-06-19 05:52:34,794 - optuna.study.study - INFO - Trial 282 finished with values: [0.03300505716072207, 0.006929708222811672, 0.018830686855545314] and parameters: {'n_layers': 1, 'embedding_dim': 128, 'lr': 0.000870520171613823, 'lambda_val': 3.152200128524867e-05, 'batch_size': 2155, 'optimizer': 'RMSprop'}.
2026-06-19 05:54:07,261 - experiment_functions - INFO - Early stopping at epoch 2150. Best Metrics: (0.03120459751014084, 0.006547619047619048, 0.01754609265516807)
2026-06-19 05:54:07,354 - optuna.study.study - INFO - Trial 283 finished with values: [0.03120459751014084, 0.006547619047619048, 0.01754609265516807] and parameters: {'n_layers': 1, 'embedding_dim': 32, 'lr': 0.0012134658370028314, 'lambda_val': 0.001464554758780303, 'batch_size': 3284, 'optimizer': 'Adam'}.
2026-06-19 05:57:09,296 - optuna.study.study - INFO - Trial 284 finished with values: [0.034050989744360625, 0.007108121763294178, 0.019645888089463298] and parameters: {'n_layers': 1, 'embedding_dim': 128, 'lr': 0.000870520171613823, 'lambda_val': 5.816309683274336e-06, 'batch_size': 2501, 'optimizer': 'RMSprop'}.
2026-06-19 05:57:58,552 - experiment_functions - INFO - Early stopping at epoch 900. Best Metrics: (0.020547529397699653, 0.004435076417835039, 0.012001656999180573)
2026-06-19 05:57:58,644 - optuna.study.study - INFO - Trial 285 finished with values: [0.020547529397699653, 0.004435076417835039, 0.012001656999180573] and parameters: {'n_layers': 4, 'embedding_dim': 128, 'lr': 0.000870520171613823, 'lambda_val': 5.816309683274336e-06, 'batch_size': 2501, 'optimizer': 'Adam'}.
2026-06-19 06:00:57,927 - optuna.study.study - INFO - Trial 286 finished with values: [0.03009550501376193, 0.006369205507136541, 0.0170783410797225] and parameters: {'n_layers': 1, 'embedding_dim': 128, 'lr': 0.0009110225934635639, 'lambda_val': 0.000485389202309046, 'batch_size': 1169, 'optimizer': 'Adam'}.
2026-06-19 06:01:45,530 - experiment_functions - INFO - Early stopping at epoch 1000. Best Metrics: (0.031124860167809333, 0.006519199191612984, 0.017883540734224553)
2026-06-19 06:01:45,616 - optuna.study.study - INFO - Trial 287 finished with values: [0.031124860167809333, 0.006519199191612984, 0.017883540734224553] and parameters: {'n_layers': 1, 'embedding_dim': 128, 'lr': 0.0018868200738853993, 'lambda_val': 5.494005823267809e-06, 'batch_size': 3061, 'optimizer': 'Adam'}.
2026-06-19 06:02:58,616 - experiment_functions - INFO - Early stopping at epoch 1650. Best Metrics: (0.030795752479351943, 0.006421308576480991, 0.017475959312022987)
2026-06-19 06:02:58,749 - optuna.study.study - INFO - Trial 288 finished with values: [0.030795752479351943, 0.006421308576480991, 0.017475959312022987] and parameters: {'n_layers': 1, 'embedding_dim': 64, 'lr': 0.0017724783344138918, 'lambda_val': 1.356629670066784e-05, 'batch_size': 3561, 'optimizer': 'Adam'}.
2026-06-19 06:05:58,352 - optuna.study.study - INFO - Trial 289 finished with values: [0.029891670667502594, 0.006389730958696476, 0.017304612369128784] and parameters: {'n_layers': 1, 'embedding_dim': 128, 'lr': 0.000870520171613823, 'lambda_val': 0.0008294227855036249, 'batch_size': 1184, 'optimizer': 'Adam'}.
2026-06-19 06:08:47,699 - experiment_functions - INFO - Early stopping at epoch 3950. Best Metrics: (0.02686359688010786, 0.005718706580775547, 0.015422155164578852)
2026-06-19 06:08:47,793 - optuna.study.study - INFO - Trial 290 finished with values: [0.02686359688010786, 0.005718706580775547, 0.015422155164578852] and parameters: {'n_layers': 2, 'embedding_dim': 32, 'lr': 0.000870520171613823, 'lambda_val': 3.110883698615214e-05, 'batch_size': 2712, 'optimizer': 'Adam'}.
2026-06-19 06:11:41,602 - optuna.study.study - INFO - Trial 291 finished with values: [0.0320128252221668, 0.006711822660098523, 0.018263248015380505] and parameters: {'n_layers': 1, 'embedding_dim': 64, 'lr': 0.000870520171613823, 'lambda_val': 1.7820369734306815e-06, 'batch_size': 2155, 'optimizer': 'Adam'}.
2026-06-19 06:13:46,638 - experiment_functions - INFO - Early stopping at epoch 2750. Best Metrics: (0.032202910730650354, 0.006670771756978653, 0.018583378454817955)
2026-06-19 06:13:46,708 - optuna.study.study - INFO - Trial 292 finished with values: [0.032202910730650354, 0.006670771756978653, 0.018583378454817955] and parameters: {'n_layers': 1, 'embedding_dim': 128, 'lr': 0.0018715145286522033, 'lambda_val': 0.0002355536887176017, 'batch_size': 913, 'optimizer': 'Adam'}.
2026-06-19 06:16:42,796 - optuna.study.study - INFO - Trial 293 finished with values: [0.02896938967995776, 0.006148162182644941, 0.016137495479038325] and parameters: {'n_layers': 2, 'embedding_dim': 64, 'lr': 0.0005629311249195415, 'lambda_val': 1.356629670066784e-05, 'batch_size': 1820, 'optimizer': 'Adam'}.
2026-06-19 06:19:20,606 - experiment_functions - INFO - Early stopping at epoch 3650. Best Metrics: (0.032138788857570696, 0.006748136920550713, 0.01869423049565629)
2026-06-19 06:19:20,701 - optuna.study.study - INFO - Trial 294 finished with values: [0.032138788857570696, 0.006748136920550713, 0.01869423049565629] and parameters: {'n_layers': 1, 'embedding_dim': 64, 'lr': 0.0017724783344138918, 'lambda_val': 0.0008294227855036249, 'batch_size': 942, 'optimizer': 'Adam'}.
2026-06-19 06:21:32,371 - experiment_functions - INFO - Early stopping at epoch 3050. Best Metrics: (0.03440153285174825, 0.0070670708601743085, 0.019674506868884875)
2026-06-19 06:21:32,461 - optuna.study.study - INFO - Trial 295 finished with values: [0.03440153285174825, 0.0070670708601743085, 0.019674506868884875] and parameters: {'n_layers': 1, 'embedding_dim': 64, 'lr': 0.0017724783344138918, 'lambda_val': 1.356629670066784e-05, 'batch_size': 1184, 'optimizer': 'Adam'}.
2026-06-19 06:22:17,624 - experiment_functions - INFO - Early stopping at epoch 900. Best Metrics: (0.011867061069040176, 0.002781988126815713, 0.006556603142272231)
2026-06-19 06:22:17,714 - optuna.study.study - INFO - Trial 296 finished with values: [0.011867061069040176, 0.002781988126815713, 0.006556603142272231] and parameters: {'n_layers': 1, 'embedding_dim': 256, 'lr': 0.0017724783344138918, 'lambda_val': 0.021733968756007506, 'batch_size': 844, 'optimizer': 'RMSprop'}.
2026-06-19 06:23:14,359 - experiment_functions - INFO - Early stopping at epoch 1200. Best Metrics: (0.027836209709938105, 0.005876594669698119, 0.015814602118450587)
2026-06-19 06:23:14,466 - optuna.study.study - INFO - Trial 297 finished with values: [0.027836209709938105, 0.005876594669698119, 0.015814602118450587] and parameters: {'n_layers': 2, 'embedding_dim': 96, 'lr': 0.000870520171613823, 'lambda_val': 2.5345393328849114e-06, 'batch_size': 1184, 'optimizer': 'RMSprop'}.
2026-06-19 06:23:56,047 - experiment_functions - INFO - Early stopping at epoch 900. Best Metrics: (0.02572241844721033, 0.0054913477327270446, 0.014537549694688418)
2026-06-19 06:23:56,138 - optuna.study.study - INFO - Trial 298 finished with values: [0.02572241844721033, 0.0054913477327270446, 0.014537549694688418] and parameters: {'n_layers': 2, 'embedding_dim': 64, 'lr': 0.0012134658370028314, 'lambda_val': 1.0485161698673561e-06, 'batch_size': 2501, 'optimizer': 'RMSprop'}.
2026-06-19 06:26:49,141 - optuna.study.study - INFO - Trial 299 finished with values: [0.03508315756186007, 0.007188644688644689, 0.01992761810168968] and parameters: {'n_layers': 1, 'embedding_dim': 64, 'lr': 0.0008568781075155826, 'lambda_val': 0.0008294227855036249, 'batch_size': 3284, 'optimizer': 'Adam'}.
2026-06-19 06:26:49,158 - root - INFO - Selected Trial 132 based on Max ndcg: 0.0200
2026-06-19 06:26:49,158 - root - INFO - Associated Recall: 0.0346
2026-06-19 06:26:49,159 - experiment_functions - INFO - Training the best model ... for e_yelp_1c1dcs_rand1
2026-06-19 06:29:51,941 - root - INFO -   **** Training e_yelp_1c1dcs_rand2
2026-06-19 06:29:52,071 - root - INFO -   **** Getting 421521/1274132 random edges
2026-06-19 06:29:52,320 - optuna.storages._rdb.storage - INFO - A new study created in RDB with name: Study_e_yelp_1c1dcs_rand2
2026-06-19 06:30:17,425 - experiment_functions - INFO - Early stopping at epoch 500. Best Metrics: (0.00040292306832987384, 0.00010578501957812304, 0.00021392107779837508)
2026-06-19 06:30:17,513 - optuna.study.study - INFO - Trial 0 finished with values: [0.00040292306832987384, 0.00010578501957812304, 0.00021392107779837508] and parameters: {'n_layers': 4, 'embedding_dim': 64, 'lr': 0.006408967282480468, 'lambda_val': 2.380801909381045e-06, 'batch_size': 1356, 'optimizer': 'SGD'}.
2026-06-19 06:31:50,868 - experiment_functions - INFO - Early stopping at epoch 2000. Best Metrics: (0.0005648058974937835, 0.00012157382847038021, 0.0002968866049947292)
2026-06-19 06:31:50,957 - optuna.study.study - INFO - Trial 1 finished with values: [0.0005648058974937835, 0.00012157382847038021, 0.0002968866049947292] and parameters: {'n_layers': 3, 'embedding_dim': 96, 'lr': 4.9732944839566914e-05, 'lambda_val': 0.0001228083366977069, 'batch_size': 1819, 'optimizer': 'Adam'}.
2026-06-19 06:32:16,276 - experiment_functions - INFO - Early stopping at epoch 500. Best Metrics: (0.0005635754148229858, 0.00013420487558418593, 0.0003654021753276853)
2026-06-19 06:32:16,425 - optuna.study.study - INFO - Trial 2 finished with values: [0.0005635754148229858, 0.00013420487558418593, 0.0003654021753276853] and parameters: {'n_layers': 4, 'embedding_dim': 64, 'lr': 0.0052943064503213075, 'lambda_val': 0.00022214804065747904, 'batch_size': 3489, 'optimizer': 'SGD'}.
2026-06-19 06:32:44,069 - experiment_functions - INFO - Early stopping at epoch 550. Best Metrics: (0.00045868781226385936, 9.157509157509158e-05, 0.00024703789833010613)
2026-06-19 06:32:44,162 - optuna.study.study - INFO - Trial 3 finished with values: [0.00045868781226385936, 9.157509157509158e-05, 0.00024703789833010613] and parameters: {'n_layers': 3, 'embedding_dim': 96, 'lr': 8.614592201903997e-05, 'lambda_val': 0.08988795408943244, 'batch_size': 1667, 'optimizer': 'Adam'}.
2026-06-19 06:33:16,987 - experiment_functions - INFO - Early stopping at epoch 750. Best Metrics: (0.013558493654464356, 0.0031956549197928504, 0.00734012159820999)
2026-06-19 06:33:17,084 - optuna.study.study - INFO - Trial 4 finished with values: [0.013558493654464356, 0.0031956549197928504, 0.00734012159820999] and parameters: {'n_layers': 1, 'embedding_dim': 32, 'lr': 0.003713649922128856, 'lambda_val': 0.04233954773809469, 'batch_size': 1935, 'optimizer': 'Adam'}.
2026-06-19 06:33:43,088 - experiment_functions - INFO - Early stopping at epoch 550. Best Metrics: (0.00475157421375847, 0.001008904888215233, 0.0027208424864280187)
2026-06-19 06:33:43,174 - optuna.study.study - INFO - Trial 5 finished with values: [0.00475157421375847, 0.001008904888215233, 0.0027208424864280187] and parameters: {'n_layers': 2, 'embedding_dim': 64, 'lr': 0.049960469253932695, 'lambda_val': 9.873205377622859e-06, 'batch_size': 3852, 'optimizer': 'RMSprop'}.
2026-06-19 06:34:07,985 - experiment_functions - INFO - Early stopping at epoch 500. Best Metrics: (0.0005153835800981841, 0.0001294682329165088, 0.0002692740761420613)
2026-06-19 06:34:08,427 - optuna.study.study - INFO - Trial 6 finished with values: [0.0005153835800981841, 0.0001294682329165088, 0.0002692740761420613] and parameters: {'n_layers': 2, 'embedding_dim': 128, 'lr': 0.0028917613204526562, 'lambda_val': 1.1501339266114388e-06, 'batch_size': 1375, 'optimizer': 'SGD'}.
2026-06-19 06:34:56,990 - experiment_functions - INFO - Early stopping at epoch 1050. Best Metrics: (0.02724340192586488, 0.0057281798661109, 0.015453399087259496)
2026-06-19 06:34:57,078 - optuna.study.study - INFO - Trial 7 finished with values: [0.02724340192586488, 0.0057281798661109, 0.015453399087259496] and parameters: {'n_layers': 2, 'embedding_dim': 64, 'lr': 0.0013485218163115024, 'lambda_val': 2.005340661981191e-05, 'batch_size': 2427, 'optimizer': 'Adam'}.
2026-06-19 06:39:06,720 - optuna.study.study - INFO - Trial 8 finished with values: [0.002143122862152769, 0.0005194518125552608, 0.0012116025234114845] and parameters: {'n_layers': 4, 'embedding_dim': 256, 'lr': 6.072036627596599e-05, 'lambda_val': 0.0003743444509143199, 'batch_size': 2567, 'optimizer': 'RMSprop'}.
2026-06-19 06:39:34,516 - experiment_functions - INFO - Early stopping at epoch 500. Best Metrics: (0.0005321923219612228, 0.00013736263736263736, 0.00028553436084562226)
2026-06-19 06:39:34,597 - optuna.study.study - INFO - Trial 9 finished with values: [0.0005321923219612228, 0.00013736263736263736, 0.00028553436084562226] and parameters: {'n_layers': 4, 'embedding_dim': 128, 'lr': 2.3472921674214073e-05, 'lambda_val': 0.0013837885423483368, 'batch_size': 1188, 'optimizer': 'RMSprop'}.
2026-06-19 06:40:00,899 - experiment_functions - INFO - Early stopping at epoch 500. Best Metrics: (0.00046019961978209723, 0.00010104837691044587, 0.0002684870270715662)
2026-06-19 06:40:00,998 - optuna.study.study - INFO - Trial 10 finished with values: [0.00046019961978209723, 0.00010104837691044587, 0.0002684870270715662] and parameters: {'n_layers': 4, 'embedding_dim': 96, 'lr': 0.0023867668870027883, 'lambda_val': 4.276378934748554e-05, 'batch_size': 3534, 'optimizer': 'SGD'}.
2026-06-19 06:40:26,159 - experiment_functions - INFO - Early stopping at epoch 500. Best Metrics: (0.0006201729226750544, 0.0001389415182518631, 0.0003579920637387972)
2026-06-19 06:40:26,249 - optuna.study.study - INFO - Trial 11 finished with values: [0.0006201729226750544, 0.0001389415182518631, 0.0003579920637387972] and parameters: {'n_layers': 3, 'embedding_dim': 96, 'lr': 0.004221468699196662, 'lambda_val': 0.014193031414069697, 'batch_size': 1973, 'optimizer': 'SGD'}.
2026-06-19 06:42:33,811 - experiment_functions - INFO - Early stopping at epoch 3050. Best Metrics: (0.0006969258498845421, 0.00016578249336870028, 0.0003804538435469825)
2026-06-19 06:42:33,904 - optuna.study.study - INFO - Trial 12 finished with values: [0.0006969258498845421, 0.00016578249336870028, 0.0003804538435469825] and parameters: {'n_layers': 3, 'embedding_dim': 32, 'lr': 5.370901400903246e-05, 'lambda_val': 1.8275009462125023e-06, 'batch_size': 3835, 'optimizer': 'RMSprop'}.
2026-06-19 06:43:22,980 - experiment_functions - INFO - Early stopping at epoch 900. Best Metrics: (0.020986091353197688, 0.004465075154730328, 0.01188241937284756)
2026-06-19 06:43:23,072 - optuna.study.study - INFO - Trial 13 finished with values: [0.020986091353197688, 0.004465075154730328, 0.01188241937284756] and parameters: {'n_layers': 4, 'embedding_dim': 128, 'lr': 0.000670518483727842, 'lambda_val': 0.0001469242914477015, 'batch_size': 3739, 'optimizer': 'Adam'}.
2026-06-19 06:45:23,328 - experiment_functions - INFO - Early stopping at epoch 2850. Best Metrics: (0.012606282740404906, 0.002606732348111659, 0.007064640406497132)
2026-06-19 06:45:23,417 - optuna.study.study - INFO - Trial 14 finished with values: [0.012606282740404906, 0.002606732348111659, 0.007064640406497132] and parameters: {'n_layers': 2, 'embedding_dim': 32, 'lr': 0.0045010260516877044, 'lambda_val': 4.652725797139409e-06, 'batch_size': 3050, 'optimizer': 'RMSprop'}.
2026-06-19 06:47:49,272 - experiment_functions - INFO - Early stopping at epoch 3250. Best Metrics: (0.007463255241518965, 0.0016925603132499688, 0.00421744557218678)
2026-06-19 06:47:49,364 - optuna.study.study - INFO - Trial 15 finished with values: [0.007463255241518965, 0.0016925603132499688, 0.00421744557218678] and parameters: {'n_layers': 2, 'embedding_dim': 96, 'lr': 0.09397404733704716, 'lambda_val': 0.0023217792752353666, 'batch_size': 3323, 'optimizer': 'Adam'}.
2026-06-19 06:48:17,442 - experiment_functions - INFO - Early stopping at epoch 500. Best Metrics: (0.00045343399120706114, 0.00010578501957812301, 0.0002447113398609433)
2026-06-19 06:48:17,534 - optuna.study.study - INFO - Trial 16 finished with values: [0.00045343399120706114, 0.00010578501957812301, 0.0002447113398609433] and parameters: {'n_layers': 2, 'embedding_dim': 256, 'lr': 1.528092780845916e-05, 'lambda_val': 0.0034796208368037228, 'batch_size': 891, 'optimizer': 'SGD'}.
2026-06-19 06:48:41,166 - experiment_functions - INFO - Early stopping at epoch 500. Best Metrics: (0.0006500179535021464, 0.0001373626373626374, 0.0003238971632341367)
2026-06-19 06:48:41,325 - optuna.study.study - INFO - Trial 17 finished with values: [0.0006500179535021464, 0.0001373626373626374, 0.0003238971632341367] and parameters: {'n_layers': 1, 'embedding_dim': 128, 'lr': 0.03900052278827052, 'lambda_val': 5.118201634291458e-05, 'batch_size': 521, 'optimizer': 'SGD'}.
2026-06-19 06:50:47,520 - experiment_functions - INFO - Early stopping at epoch 2950. Best Metrics: (0.004793675507373095, 0.0011257420740179362, 0.002669660709819818)
2026-06-19 06:50:48,300 - optuna.study.study - INFO - Trial 18 finished with values: [0.004793675507373095, 0.0011257420740179362, 0.002669660709819818] and parameters: {'n_layers': 1, 'embedding_dim': 96, 'lr': 0.034998205919097455, 'lambda_val': 0.03956213839852778, 'batch_size': 2695, 'optimizer': 'Adam'}.
2026-06-19 06:53:15,785 - experiment_functions - INFO - Early stopping at epoch 3050. Best Metrics: (0.012104459152598628, 0.0027251484148035875, 0.006984348765280875)
2026-06-19 06:53:15,863 - optuna.study.study - INFO - Trial 19 finished with values: [0.012104459152598628, 0.0027251484148035875, 0.006984348765280875] and parameters: {'n_layers': 1, 'embedding_dim': 256, 'lr': 0.012325607600042974, 'lambda_val': 1.3063371603281255e-06, 'batch_size': 3743, 'optimizer': 'RMSprop'}.
2026-06-19 06:53:49,875 - experiment_functions - INFO - Early stopping at epoch 500. Best Metrics: (0.0005320121410008815, 0.0001373626373626374, 0.00028162036421203694)
2026-06-19 06:53:49,964 - optuna.study.study - INFO - Trial 20 finished with values: [0.0005320121410008815, 0.0001373626373626374, 0.00028162036421203694] and parameters: {'n_layers': 4, 'embedding_dim': 256, 'lr': 1.0389341218552708e-05, 'lambda_val': 0.006230745660801204, 'batch_size': 881, 'optimizer': 'Adam'}.
2026-06-19 06:57:06,054 - optuna.study.study - INFO - Trial 21 finished with values: [0.02110971411383324, 0.004701907288114185, 0.012122741490546462] and parameters: {'n_layers': 4, 'embedding_dim': 96, 'lr': 0.00020897019229325828, 'lambda_val': 3.131845581451586e-06, 'batch_size': 2334, 'optimizer': 'RMSprop'}.
2026-06-19 06:57:40,392 - experiment_functions - INFO - Early stopping at epoch 650. Best Metrics: (0.01968110267392792, 0.004244031830238727, 0.01100328739120447)
2026-06-19 06:57:40,979 - optuna.study.study - INFO - Trial 22 finished with values: [0.01968110267392792, 0.004244031830238727, 0.01100328739120447] and parameters: {'n_layers': 3, 'embedding_dim': 128, 'lr': 0.0020290919563790725, 'lambda_val': 7.169103823221734e-06, 'batch_size': 1875, 'optimizer': 'Adam'}.
2026-06-19 06:58:04,363 - experiment_functions - INFO - Early stopping at epoch 500. Best Metrics: (0.0005371924124861823, 0.0001294682329165088, 0.00029016603387349186)
2026-06-19 06:58:04,468 - optuna.study.study - INFO - Trial 23 finished with values: [0.0005371924124861823, 0.0001294682329165088, 0.00029016603387349186] and parameters: {'n_layers': 4, 'embedding_dim': 32, 'lr': 0.05075341291771216, 'lambda_val': 2.1305601218305877e-05, 'batch_size': 1588, 'optimizer': 'SGD'}.
2026-06-19 06:58:32,438 - experiment_functions - INFO - Early stopping at epoch 550. Best Metrics: (0.006140073388573383, 0.0013057344953896677, 0.0033359799663778326)
