2026-06-20 07:30:44,416 - optuna.study.study - INFO - Trial 187 finished with values: [0.001042787981763373, 0.0002242010862700518, 0.0005822327038721034] and parameters: {'n_layers': 1, 'embedding_dim': 32, 'lr': 0.00022027863565489018, 'lambda_val': 3.64590979484011e-06, 'batch_size': 2973, 'optimizer': 'RMSprop'}.
2026-06-20 07:31:39,435 - experiment_functions - INFO - Early stopping at epoch 1100. Best Metrics: (0.019278799241789754, 0.004310344827586207, 0.010935909016539323)
2026-06-20 07:31:40,478 - optuna.study.study - INFO - Trial 188 finished with values: [0.019278799241789754, 0.004310344827586207, 0.010935909016539323] and parameters: {'n_layers': 3, 'embedding_dim': 128, 'lr': 0.00041090885210817534, 'lambda_val': 0.00554832927684527, 'batch_size': 3321, 'optimizer': 'RMSprop'}.
2026-06-20 07:34:24,528 - optuna.study.study - INFO - Trial 189 finished with values: [0.033074233998585945, 0.006899709485916382, 0.018762441120493106] and parameters: {'n_layers': 1, 'embedding_dim': 32, 'lr': 0.001705082463001927, 'lambda_val': 1.0746091986357293e-06, 'batch_size': 1869, 'optimizer': 'Adam'}.
2026-06-20 07:35:40,606 - experiment_functions - INFO - Early stopping at epoch 1800. Best Metrics: (0.03240977242761562, 0.006847606416571935, 0.01889665572656668)
2026-06-20 07:35:40,698 - optuna.study.study - INFO - Trial 190 finished with values: [0.03240977242761562, 0.006847606416571935, 0.01889665572656668] and parameters: {'n_layers': 1, 'embedding_dim': 32, 'lr': 0.0015608654005494732, 'lambda_val': 1.6265345504793854e-05, 'batch_size': 1134, 'optimizer': 'RMSprop'}.
2026-06-20 07:36:21,157 - experiment_functions - INFO - Early stopping at epoch 950. Best Metrics: (0.02457240729981997, 0.005235569028672477, 0.014212814366008826)
2026-06-20 07:36:21,231 - optuna.study.study - INFO - Trial 191 finished with values: [0.02457240729981997, 0.005235569028672477, 0.014212814366008826] and parameters: {'n_layers': 1, 'embedding_dim': 32, 'lr': 0.006590049461749219, 'lambda_val': 1.7016903226968311e-06, 'batch_size': 772, 'optimizer': 'Adam'}.
2026-06-20 07:39:15,996 - optuna.study.study - INFO - Trial 192 finished with values: [0.019917897428680373, 0.004365605658709107, 0.011463571400712708] and parameters: {'n_layers': 3, 'embedding_dim': 64, 'lr': 0.00022027863565489018, 'lambda_val': 4.303236972228742e-06, 'batch_size': 3427, 'optimizer': 'Adam'}.
2026-06-20 07:41:27,941 - experiment_functions - INFO - Early stopping at epoch 3200. Best Metrics: (0.03330808316904497, 0.0069060250094732855, 0.019129518955731124)
2026-06-20 07:41:28,025 - optuna.study.study - INFO - Trial 193 finished with values: [0.03330808316904497, 0.0069060250094732855, 0.019129518955731124] and parameters: {'n_layers': 1, 'embedding_dim': 32, 'lr': 0.0012953028594055518, 'lambda_val': 1.0112597680663849e-05, 'batch_size': 2973, 'optimizer': 'RMSprop'}.
2026-06-20 07:43:15,088 - experiment_functions - INFO - Early stopping at epoch 2550. Best Metrics: (0.03236389527743685, 0.006637615258304913, 0.01858439922622951)
2026-06-20 07:43:15,176 - optuna.study.study - INFO - Trial 194 finished with values: [0.03236389527743685, 0.006637615258304913, 0.01858439922622951] and parameters: {'n_layers': 1, 'embedding_dim': 32, 'lr': 0.0012953028594055518, 'lambda_val': 0.0022723744163998237, 'batch_size': 2973, 'optimizer': 'RMSprop'}.
2026-06-20 07:43:43,179 - experiment_functions - INFO - Early stopping at epoch 600. Best Metrics: (0.024840868336720324, 0.005316091954022988, 0.013924793283105353)
2026-06-20 07:43:43,266 - optuna.study.study - INFO - Trial 195 finished with values: [0.024840868336720324, 0.005316091954022988, 0.013924793283105353] and parameters: {'n_layers': 1, 'embedding_dim': 128, 'lr': 0.006590049461749219, 'lambda_val': 0.00554832927684527, 'batch_size': 3646, 'optimizer': 'Adam'}.
2026-06-20 07:44:06,473 - experiment_functions - INFO - Early stopping at epoch 500. Best Metrics: (0.0006144674936072624, 0.00012631047113805733, 0.0003245948628039428)
2026-06-20 07:44:06,562 - optuna.study.study - INFO - Trial 196 finished with values: [0.0006144674936072624, 0.00012631047113805733, 0.0003245948628039428] and parameters: {'n_layers': 1, 'embedding_dim': 128, 'lr': 0.00022027863565489018, 'lambda_val': 0.03112985060450811, 'batch_size': 3213, 'optimizer': 'Adam'}.
2026-06-20 07:44:29,505 - experiment_functions - INFO - Early stopping at epoch 500. Best Metrics: (0.0005416528759153223, 0.00010262725779967159, 0.00030009734023796794)
2026-06-20 07:44:29,588 - optuna.study.study - INFO - Trial 197 finished with values: [0.0005416528759153223, 0.00010262725779967159, 0.00030009734023796794] and parameters: {'n_layers': 3, 'embedding_dim': 32, 'lr': 0.0015608654005494732, 'lambda_val': 1.6265345504793854e-05, 'batch_size': 2266, 'optimizer': 'SGD'}.
2026-06-20 07:44:53,919 - experiment_functions - INFO - Early stopping at epoch 550. Best Metrics: (0.012426975317084225, 0.0026746242263483645, 0.007142021689472373)
2026-06-20 07:44:54,008 - optuna.study.study - INFO - Trial 198 finished with values: [0.012426975317084225, 0.0026746242263483645, 0.007142021689472373] and parameters: {'n_layers': 3, 'embedding_dim': 32, 'lr': 0.006590049461749219, 'lambda_val': 1.7016903226968311e-06, 'batch_size': 850, 'optimizer': 'RMSprop'}.
2026-06-20 07:47:44,873 - optuna.study.study - INFO - Trial 199 finished with values: [0.029130925045930865, 0.006233421750663129, 0.01667733204343814] and parameters: {'n_layers': 2, 'embedding_dim': 64, 'lr': 0.00041090885210817534, 'lambda_val': 1.0112597680663849e-05, 'batch_size': 3427, 'optimizer': 'RMSprop'}.
2026-06-20 07:49:46,972 - experiment_functions - INFO - Early stopping at epoch 2900. Best Metrics: (0.03314694445572626, 0.006920234937476317, 0.0189858229226618)
2026-06-20 07:49:47,053 - optuna.study.study - INFO - Trial 200 finished with values: [0.03314694445572626, 0.006920234937476317, 0.0189858229226618] and parameters: {'n_layers': 1, 'embedding_dim': 64, 'lr': 0.0012953028594055518, 'lambda_val': 1.0746091986357293e-06, 'batch_size': 2973, 'optimizer': 'RMSprop'}.
2026-06-20 07:52:24,804 - experiment_functions - INFO - Early stopping at epoch 3800. Best Metrics: (0.03119648724654559, 0.006454465075154731, 0.018048890799355725)
2026-06-20 07:52:24,878 - optuna.study.study - INFO - Trial 201 finished with values: [0.03119648724654559, 0.006454465075154731, 0.018048890799355725] and parameters: {'n_layers': 1, 'embedding_dim': 32, 'lr': 0.0012953028594055518, 'lambda_val': 3.64590979484011e-06, 'batch_size': 2973, 'optimizer': 'RMSprop'}.
2026-06-20 07:55:13,586 - optuna.study.study - INFO - Trial 202 finished with values: [0.02587302246729908, 0.0056050271567512945, 0.014760406702978813] and parameters: {'n_layers': 2, 'embedding_dim': 64, 'lr': 0.00041090885210817534, 'lambda_val': 1.7016903226968311e-06, 'batch_size': 1493, 'optimizer': 'RMSprop'}.
2026-06-20 07:55:42,412 - experiment_functions - INFO - Early stopping at epoch 550. Best Metrics: (0.016313532281653085, 0.0035414298345332828, 0.009018424924360698)
2026-06-20 07:55:42,480 - optuna.study.study - INFO - Trial 203 finished with values: [0.016313532281653085, 0.0035414298345332828, 0.009018424924360698] and parameters: {'n_layers': 3, 'embedding_dim': 96, 'lr': 0.006590049461749219, 'lambda_val': 3.64590979484011e-06, 'batch_size': 3646, 'optimizer': 'Adam'}.
2026-06-20 07:59:05,602 - optuna.study.study - INFO - Trial 204 finished with values: [0.03121429868659851, 0.006648667424529494, 0.018184780332964955] and parameters: {'n_layers': 1, 'embedding_dim': 256, 'lr': 0.0006438418474980425, 'lambda_val': 5.8148367269156115e-06, 'batch_size': 3932, 'optimizer': 'Adam'}.
2026-06-20 07:59:29,704 - experiment_functions - INFO - Early stopping at epoch 550. Best Metrics: (0.006130042767848043, 0.0014415182518630794, 0.0036208454115077855)
2026-06-20 07:59:29,788 - optuna.study.study - INFO - Trial 205 finished with values: [0.006130042767848043, 0.0014415182518630794, 0.0036208454115077855] and parameters: {'n_layers': 1, 'embedding_dim': 32, 'lr': 0.037728183350904596, 'lambda_val': 1.7016903226968311e-06, 'batch_size': 2973, 'optimizer': 'RMSprop'}.
2026-06-20 08:00:03,004 - experiment_functions - INFO - Early stopping at epoch 800. Best Metrics: (0.0038626716318474977, 0.0009204875584185928, 0.0021793112427372654)
2026-06-20 08:00:03,091 - optuna.study.study - INFO - Trial 206 finished with values: [0.0038626716318474977, 0.0009204875584185928, 0.0021793112427372654] and parameters: {'n_layers': 1, 'embedding_dim': 32, 'lr': 0.07615563022824834, 'lambda_val': 3.64590979484011e-06, 'batch_size': 2973, 'optimizer': 'RMSprop'}.
2026-06-20 08:01:16,472 - experiment_functions - INFO - Early stopping at epoch 1800. Best Metrics: (0.022165897543891467, 0.0051313628899835794, 0.012665998053471976)
2026-06-20 08:01:16,556 - optuna.study.study - INFO - Trial 207 finished with values: [0.022165897543891467, 0.0051313628899835794, 0.012665998053471976] and parameters: {'n_layers': 1, 'embedding_dim': 32, 'lr': 0.0006438418474980425, 'lambda_val': 0.053942702933257224, 'batch_size': 2935, 'optimizer': 'RMSprop'}.
2026-06-20 08:03:06,975 - experiment_functions - INFO - Early stopping at epoch 2700. Best Metrics: (0.030890000709724533, 0.006546040166729822, 0.017809334409396502)
2026-06-20 08:03:07,063 - optuna.study.study - INFO - Trial 208 finished with values: [0.030890000709724533, 0.006546040166729822, 0.017809334409396502] and parameters: {'n_layers': 1, 'embedding_dim': 32, 'lr': 0.0015608654005494732, 'lambda_val': 3.64590979484011e-06, 'batch_size': 757, 'optimizer': 'RMSprop'}.
2026-06-20 08:03:51,366 - experiment_functions - INFO - Early stopping at epoch 800. Best Metrics: (0.026160515217003837, 0.005546608563849943, 0.015116225530260558)
2026-06-20 08:03:51,466 - optuna.study.study - INFO - Trial 209 finished with values: [0.026160515217003837, 0.005546608563849943, 0.015116225530260558] and parameters: {'n_layers': 2, 'embedding_dim': 256, 'lr': 0.0012953028594055518, 'lambda_val': 3.64590979484011e-06, 'batch_size': 3427, 'optimizer': 'Adam'}.
2026-06-20 08:04:20,916 - experiment_functions - INFO - Early stopping at epoch 650. Best Metrics: (0.015481992133129296, 0.0032651256789187825, 0.008587937645530357)
2026-06-20 08:04:21,015 - optuna.study.study - INFO - Trial 210 finished with values: [0.015481992133129296, 0.0032651256789187825, 0.008587937645530357] and parameters: {'n_layers': 4, 'embedding_dim': 32, 'lr': 0.0015608654005494732, 'lambda_val': 1.6265345504793854e-05, 'batch_size': 2973, 'optimizer': 'RMSprop'}.
2026-06-20 08:06:01,183 - experiment_functions - INFO - Early stopping at epoch 2400. Best Metrics: (0.033913874433927356, 0.006981811292156121, 0.01961165214074153)
2026-06-20 08:06:01,267 - optuna.study.study - INFO - Trial 211 finished with values: [0.033913874433927356, 0.006981811292156121, 0.01961165214074153] and parameters: {'n_layers': 1, 'embedding_dim': 32, 'lr': 0.0012953028594055518, 'lambda_val': 3.64590979484011e-06, 'batch_size': 3338, 'optimizer': 'RMSprop'}.
2026-06-20 08:06:58,050 - experiment_functions - INFO - Early stopping at epoch 1350. Best Metrics: (0.03183027476932207, 0.006511304787166856, 0.018045112175734797)
2026-06-20 08:06:58,186 - optuna.study.study - INFO - Trial 212 finished with values: [0.03183027476932207, 0.006511304787166856, 0.018045112175734797] and parameters: {'n_layers': 1, 'embedding_dim': 32, 'lr': 0.0017497040944488835, 'lambda_val': 6.045586818790797e-06, 'batch_size': 3889, 'optimizer': 'Adam'}.
2026-06-20 08:07:51,208 - experiment_functions - INFO - Early stopping at epoch 1250. Best Metrics: (0.03177834643720307, 0.006460780598711633, 0.018172334193968506)
2026-06-20 08:07:51,281 - optuna.study.study - INFO - Trial 213 finished with values: [0.03177834643720307, 0.006460780598711633, 0.018172334193968506] and parameters: {'n_layers': 1, 'embedding_dim': 32, 'lr': 0.002488784556108625, 'lambda_val': 3.64590979484011e-06, 'batch_size': 1310, 'optimizer': 'RMSprop'}.
2026-06-20 08:09:26,883 - experiment_functions - INFO - Early stopping at epoch 2250. Best Metrics: (0.03272956166938695, 0.006762346848553746, 0.018732880336450267)
2026-06-20 08:09:26,977 - optuna.study.study - INFO - Trial 214 finished with values: [0.03272956166938695, 0.006762346848553746, 0.018732880336450267] and parameters: {'n_layers': 1, 'embedding_dim': 64, 'lr': 0.0012953028594055518, 'lambda_val': 0.00012018704157732538, 'batch_size': 3338, 'optimizer': 'RMSprop'}.
2026-06-20 08:12:17,843 - optuna.study.study - INFO - Trial 215 finished with values: [0.031451658657392766, 0.006744979158772263, 0.018260936249114266] and parameters: {'n_layers': 1, 'embedding_dim': 96, 'lr': 0.0012953028594055518, 'lambda_val': 3.64590979484011e-06, 'batch_size': 757, 'optimizer': 'RMSprop'}.
2026-06-20 08:12:46,219 - experiment_functions - INFO - Early stopping at epoch 650. Best Metrics: (0.026122726565021497, 0.005646078059871163, 0.015612187678524046)
2026-06-20 08:12:46,641 - optuna.study.study - INFO - Trial 216 finished with values: [0.026122726565021497, 0.005646078059871163, 0.015612187678524046] and parameters: {'n_layers': 1, 'embedding_dim': 32, 'lr': 0.006590049461749219, 'lambda_val': 1.7016903226968311e-06, 'batch_size': 3050, 'optimizer': 'Adam'}.
2026-06-20 08:14:19,842 - experiment_functions - INFO - Early stopping at epoch 2150. Best Metrics: (0.02398265322511334, 0.00533030188202602, 0.013447882888694373)
2026-06-20 08:14:19,926 - optuna.study.study - INFO - Trial 217 finished with values: [0.02398265322511334, 0.00533030188202602, 0.013447882888694373] and parameters: {'n_layers': 2, 'embedding_dim': 64, 'lr': 0.00041090885210817534, 'lambda_val': 0.010573300867814734, 'batch_size': 2973, 'optimizer': 'RMSprop'}.
2026-06-20 08:15:35,041 - experiment_functions - INFO - Early stopping at epoch 1650. Best Metrics: (0.029020720744855417, 0.006162372110647972, 0.016793144017857867)
2026-06-20 08:15:35,127 - optuna.study.study - INFO - Trial 218 finished with values: [0.029020720744855417, 0.006162372110647972, 0.016793144017857867] and parameters: {'n_layers': 2, 'embedding_dim': 96, 'lr': 0.0006438418474980425, 'lambda_val': 5.8148367269156115e-06, 'batch_size': 2990, 'optimizer': 'Adam'}.
2026-06-20 08:18:26,931 - optuna.study.study - INFO - Trial 219 finished with values: [0.027684581407577423, 0.00593501326259947, 0.015925971189971307] and parameters: {'n_layers': 2, 'embedding_dim': 64, 'lr': 0.00041090885210817534, 'lambda_val': 1.0112597680663849e-05, 'batch_size': 3427, 'optimizer': 'RMSprop'}.
2026-06-20 08:19:11,590 - experiment_functions - INFO - Early stopping at epoch 1000. Best Metrics: (0.03066658629471245, 0.0064876215738284716, 0.01786255135320956)
2026-06-20 08:19:11,677 - optuna.study.study - INFO - Trial 220 finished with values: [0.03066658629471245, 0.0064876215738284716, 0.01786255135320956] and parameters: {'n_layers': 1, 'embedding_dim': 96, 'lr': 0.002099990505043131, 'lambda_val': 3.64590979484011e-06, 'batch_size': 2973, 'optimizer': 'Adam'}.
2026-06-20 08:19:35,987 - experiment_functions - INFO - Early stopping at epoch 550. Best Metrics: (0.02196493835713098, 0.004736642667677151, 0.012827657275236506)
2026-06-20 08:19:36,081 - optuna.study.study - INFO - Trial 221 finished with values: [0.02196493835713098, 0.004736642667677151, 0.012827657275236506] and parameters: {'n_layers': 1, 'embedding_dim': 32, 'lr': 0.02440902059212367, 'lambda_val': 3.64590979484011e-06, 'batch_size': 2973, 'optimizer': 'Adam'}.
2026-06-20 08:20:30,837 - experiment_functions - INFO - Early stopping at epoch 1300. Best Metrics: (0.03156833777217452, 0.0065081470253884055, 0.01818383921483505)
2026-06-20 08:20:30,926 - optuna.study.study - INFO - Trial 222 finished with values: [0.03156833777217452, 0.0065081470253884055, 0.01818383921483505] and parameters: {'n_layers': 1, 'embedding_dim': 32, 'lr': 0.002099990505043131, 'lambda_val': 1.0746091986357293e-06, 'batch_size': 3338, 'optimizer': 'Adam'}.
2026-06-20 08:22:59,981 - experiment_functions - INFO - Early stopping at epoch 3600. Best Metrics: (0.03368019018740144, 0.006953391436150058, 0.01918880054146499)
2026-06-20 08:23:00,086 - optuna.study.study - INFO - Trial 223 finished with values: [0.03368019018740144, 0.006953391436150058, 0.01918880054146499] and parameters: {'n_layers': 1, 'embedding_dim': 32, 'lr': 0.0012953028594055518, 'lambda_val': 3.64590979484011e-06, 'batch_size': 2973, 'optimizer': 'Adam'}.
2026-06-20 08:23:37,391 - experiment_functions - INFO - Early stopping at epoch 850. Best Metrics: (0.031431821256222875, 0.00648762157382847, 0.01795512783865517)
2026-06-20 08:23:37,487 - optuna.study.study - INFO - Trial 224 finished with values: [0.031431821256222875, 0.00648762157382847, 0.01795512783865517] and parameters: {'n_layers': 1, 'embedding_dim': 32, 'lr': 0.002488784556108625, 'lambda_val': 1.0008242885262478e-05, 'batch_size': 2912, 'optimizer': 'RMSprop'}.
2026-06-20 08:24:21,168 - experiment_functions - INFO - Early stopping at epoch 1000. Best Metrics: (0.020204932812371384, 0.004201402046229633, 0.011387827181236546)
2026-06-20 08:24:21,250 - optuna.study.study - INFO - Trial 225 finished with values: [0.020204932812371384, 0.004201402046229633, 0.011387827181236546] and parameters: {'n_layers': 3, 'embedding_dim': 32, 'lr': 0.0012953028594055518, 'lambda_val': 7.823592004208081e-05, 'batch_size': 2495, 'optimizer': 'RMSprop'}.
2026-06-20 08:24:49,831 - experiment_functions - INFO - Early stopping at epoch 650. Best Metrics: (0.024175322529627733, 0.005284514336238474, 0.014410270215292181)
2026-06-20 08:24:49,914 - optuna.study.study - INFO - Trial 226 finished with values: [0.024175322529627733, 0.005284514336238474, 0.014410270215292181] and parameters: {'n_layers': 1, 'embedding_dim': 32, 'lr': 0.008804952478863077, 'lambda_val': 6.868274004831431e-05, 'batch_size': 2973, 'optimizer': 'Adam'}.
2026-06-20 08:25:15,551 - experiment_functions - INFO - Early stopping at epoch 600. Best Metrics: (0.0005393935282075089, 0.0001405203991410888, 0.0003152451072020879)
2026-06-20 08:25:16,416 - optuna.study.study - INFO - Trial 227 finished with values: [0.0005393935282075089, 0.0001405203991410888, 0.0003152451072020879] and parameters: {'n_layers': 1, 'embedding_dim': 32, 'lr': 1.5563043643019662e-05, 'lambda_val': 1.0112597680663849e-05, 'batch_size': 2973, 'optimizer': 'Adam'}.
2026-06-20 08:26:06,520 - experiment_functions - INFO - Early stopping at epoch 1150. Best Metrics: (0.014973066001961044, 0.0031751294682329165, 0.008197189938012337)
2026-06-20 08:26:06,613 - optuna.study.study - INFO - Trial 228 finished with values: [0.014973066001961044, 0.0031751294682329165, 0.008197189938012337] and parameters: {'n_layers': 4, 'embedding_dim': 32, 'lr': 0.002099990505043131, 'lambda_val': 3.64590979484011e-06, 'batch_size': 874, 'optimizer': 'Adam'}.
2026-06-20 08:26:55,594 - experiment_functions - INFO - Early stopping at epoch 1100. Best Metrics: (0.021309306864314658, 0.004439813060502716, 0.012047133867900158)
2026-06-20 08:26:55,672 - optuna.study.study - INFO - Trial 229 finished with values: [0.021309306864314658, 0.004439813060502716, 0.012047133867900158] and parameters: {'n_layers': 2, 'embedding_dim': 64, 'lr': 0.0015608654005494732, 'lambda_val': 1.0112597680663849e-05, 'batch_size': 1134, 'optimizer': 'RMSprop'}.
2026-06-20 08:28:12,093 - experiment_functions - INFO - Early stopping at epoch 1550. Best Metrics: (0.030761503435704253, 0.006373942149804219, 0.017621170157312443)
2026-06-20 08:28:12,167 - optuna.study.study - INFO - Trial 230 finished with values: [0.030761503435704253, 0.006373942149804219, 0.017621170157312443] and parameters: {'n_layers': 1, 'embedding_dim': 256, 'lr': 0.0012953028594055518, 'lambda_val': 6.868274004831431e-05, 'batch_size': 2973, 'optimizer': 'RMSprop'}.
2026-06-20 08:29:25,796 - experiment_functions - INFO - Early stopping at epoch 1750. Best Metrics: (0.0005032575401901144, 0.00014052039914108882, 0.00030043348447927117)
2026-06-20 08:29:25,870 - optuna.study.study - INFO - Trial 231 finished with values: [0.0005032575401901144, 0.00014052039914108882, 0.00030043348447927117] and parameters: {'n_layers': 2, 'embedding_dim': 64, 'lr': 2.0782477766523292e-05, 'lambda_val': 3.64590979484011e-06, 'batch_size': 1344, 'optimizer': 'RMSprop'}.
2026-06-20 08:30:18,166 - experiment_functions - INFO - Early stopping at epoch 1050. Best Metrics: (0.0310030119712506, 0.006419729695591765, 0.017584041510322102)
2026-06-20 08:30:18,260 - optuna.study.study - INFO - Trial 232 finished with values: [0.0310030119712506, 0.006419729695591765, 0.017584041510322102] and parameters: {'n_layers': 1, 'embedding_dim': 256, 'lr': 0.0012953028594055518, 'lambda_val': 3.64590979484011e-06, 'batch_size': 3338, 'optimizer': 'RMSprop'}.
2026-06-20 08:31:23,008 - experiment_functions - INFO - Early stopping at epoch 1550. Best Metrics: (0.030108119036532245, 0.006384994316028798, 0.017256472644572775)
2026-06-20 08:31:23,937 - optuna.study.study - INFO - Trial 233 finished with values: [0.030108119036532245, 0.006384994316028798, 0.017256472644572775] and parameters: {'n_layers': 1, 'embedding_dim': 32, 'lr': 0.002099990505043131, 'lambda_val': 3.64590979484011e-06, 'batch_size': 2973, 'optimizer': 'Adam'}.
2026-06-20 08:34:09,026 - optuna.study.study - INFO - Trial 234 finished with values: [0.025245382681012556, 0.005442402425161047, 0.014472950780413357] and parameters: {'n_layers': 2, 'embedding_dim': 32, 'lr': 0.00041090885210817534, 'lambda_val': 3.64590979484011e-06, 'batch_size': 3427, 'optimizer': 'RMSprop'}.
