2026-06-22 20:54:44,679 - optuna.study.study - INFO - Trial 183 finished with values: [0.026456316142602226, 0.005601869394972843, 0.014795522591201758] and parameters: {'n_layers': 4, 'embedding_dim': 64, 'lr': 0.0004235044324291316, 'lambda_val': 0.00020526375005845972, 'batch_size': 1052, 'optimizer': 'RMSprop'}.
2026-06-22 20:56:43,356 - experiment_functions - INFO - Early stopping at epoch 2750. Best Metrics: (0.02637192235221048, 0.005803966148793735, 0.015176484302732227)
2026-06-22 20:56:43,506 - optuna.study.study - INFO - Trial 184 finished with values: [0.02637192235221048, 0.005803966148793735, 0.015176484302732227] and parameters: {'n_layers': 3, 'embedding_dim': 32, 'lr': 0.0006129132477888526, 'lambda_val': 0.0008491169466682814, 'batch_size': 1291, 'optimizer': 'RMSprop'}.
2026-06-22 20:57:17,337 - experiment_functions - INFO - Early stopping at epoch 700. Best Metrics: (0.000567736169782028, 0.00011683718580270304, 0.0002691298735512643)
2026-06-22 20:57:17,474 - optuna.study.study - INFO - Trial 185 finished with values: [0.000567736169782028, 0.00011683718580270304, 0.0002691298735512643] and parameters: {'n_layers': 4, 'embedding_dim': 64, 'lr': 2.7625064360811698e-05, 'lambda_val': 0.00016070502405844529, 'batch_size': 3584, 'optimizer': 'Adam'}.
2026-06-22 20:58:24,208 - experiment_functions - INFO - Early stopping at epoch 1500. Best Metrics: (0.027949458020924633, 0.00604553492484527, 0.016311484067585213)
2026-06-22 20:58:24,312 - optuna.study.study - INFO - Trial 186 finished with values: [0.027949458020924633, 0.00604553492484527, 0.016311484067585213] and parameters: {'n_layers': 1, 'embedding_dim': 96, 'lr': 0.001706237377982523, 'lambda_val': 0.0008491169466682814, 'batch_size': 577, 'optimizer': 'RMSprop'}.
2026-06-22 20:59:02,292 - experiment_functions - INFO - Early stopping at epoch 550. Best Metrics: (0.014130296205042499, 0.0031861816344574967, 0.00827354447924601)
2026-06-22 20:59:02,389 - optuna.study.study - INFO - Trial 187 finished with values: [0.014130296205042499, 0.0031861816344574967, 0.00827354447924601] and parameters: {'n_layers': 4, 'embedding_dim': 256, 'lr': 0.001706237377982523, 'lambda_val': 0.0008491169466682814, 'batch_size': 528, 'optimizer': 'RMSprop'}.
2026-06-22 21:00:17,909 - experiment_functions - INFO - Early stopping at epoch 1500. Best Metrics: (0.02163046192886897, 0.004654540861437412, 0.012110812133240502)
2026-06-22 21:00:18,011 - optuna.study.study - INFO - Trial 188 finished with values: [0.02163046192886897, 0.004654540861437412, 0.012110812133240502] and parameters: {'n_layers': 4, 'embedding_dim': 96, 'lr': 0.00034872763677884483, 'lambda_val': 0.002013482105642368, 'batch_size': 2159, 'optimizer': 'RMSprop'}.
2026-06-22 21:02:52,104 - experiment_functions - INFO - Early stopping at epoch 3300. Best Metrics: (0.02308612273816258, 0.005017683465959329, 0.012818680744092847)
2026-06-22 21:02:52,249 - optuna.study.study - INFO - Trial 189 finished with values: [0.02308612273816258, 0.005017683465959329, 0.012818680744092847] and parameters: {'n_layers': 4, 'embedding_dim': 64, 'lr': 0.0004235044324291316, 'lambda_val': 5.8421827248860175e-05, 'batch_size': 2562, 'optimizer': 'RMSprop'}.
2026-06-22 21:03:14,828 - experiment_functions - INFO - Early stopping at epoch 500. Best Metrics: (0.0005392947563186844, 0.00011052166224580017, 0.00025456329523554215)
2026-06-22 21:03:14,926 - optuna.study.study - INFO - Trial 190 finished with values: [0.0005392947563186844, 0.00011052166224580017, 0.00025456329523554215] and parameters: {'n_layers': 1, 'embedding_dim': 32, 'lr': 0.00045681378220125877, 'lambda_val': 0.0008491169466682814, 'batch_size': 3280, 'optimizer': 'SGD'}.
2026-06-22 21:04:21,447 - experiment_functions - INFO - Early stopping at epoch 1300. Best Metrics: (0.012001874392805522, 0.002666729821902236, 0.006628113952480066)
2026-06-22 21:04:21,552 - optuna.study.study - INFO - Trial 191 finished with values: [0.012001874392805522, 0.002666729821902236, 0.006628113952480066] and parameters: {'n_layers': 3, 'embedding_dim': 128, 'lr': 0.0006129132477888526, 'lambda_val': 0.008507655043799656, 'batch_size': 557, 'optimizer': 'RMSprop'}.
2026-06-22 21:04:45,234 - experiment_functions - INFO - Early stopping at epoch 500. Best Metrics: (0.0004989306251923741, 0.0001231527093596059, 0.00025775672011498987)
2026-06-22 21:04:45,363 - optuna.study.study - INFO - Trial 192 finished with values: [0.0004989306251923741, 0.0001231527093596059, 0.00025775672011498987] and parameters: {'n_layers': 2, 'embedding_dim': 64, 'lr': 0.00045681378220125877, 'lambda_val': 0.0008491169466682814, 'batch_size': 1126, 'optimizer': 'SGD'}.
2026-06-22 21:05:15,370 - experiment_functions - INFO - Early stopping at epoch 650. Best Metrics: (0.00938942819671137, 0.0019483390173045346, 0.0053630098605090566)
2026-06-22 21:05:15,686 - optuna.study.study - INFO - Trial 193 finished with values: [0.00938942819671137, 0.0019483390173045346, 0.0053630098605090566] and parameters: {'n_layers': 3, 'embedding_dim': 32, 'lr': 0.012994567788334225, 'lambda_val': 7.910735824587925e-05, 'batch_size': 3556, 'optimizer': 'RMSprop'}.
2026-06-22 21:05:38,699 - experiment_functions - INFO - Early stopping at epoch 500. Best Metrics: (0.00037927440003022073, 0.00010894278135657447, 0.00022513900625084269)
2026-06-22 21:05:38,849 - optuna.study.study - INFO - Trial 194 finished with values: [0.00037927440003022073, 0.00010894278135657447, 0.00022513900625084269] and parameters: {'n_layers': 1, 'embedding_dim': 96, 'lr': 0.019747370316731114, 'lambda_val': 1.551183635320485e-05, 'batch_size': 2159, 'optimizer': 'SGD'}.
2026-06-22 21:08:29,061 - experiment_functions - INFO - Early stopping at epoch 3150. Best Metrics: (0.014687216459582573, 0.0030503978779840854, 0.00808275291925282)
2026-06-22 21:08:29,205 - optuna.study.study - INFO - Trial 195 finished with values: [0.014687216459582573, 0.0030503978779840854, 0.00808275291925282] and parameters: {'n_layers': 2, 'embedding_dim': 256, 'lr': 0.0024593680412654663, 'lambda_val': 3.111348028811644e-05, 'batch_size': 2194, 'optimizer': 'RMSprop'}.
2026-06-22 21:09:13,383 - experiment_functions - INFO - Early stopping at epoch 950. Best Metrics: (0.02508893729237618, 0.005349248452696729, 0.014337570347356046)
2026-06-22 21:09:13,664 - optuna.study.study - INFO - Trial 196 finished with values: [0.02508893729237618, 0.005349248452696729, 0.014337570347356046] and parameters: {'n_layers': 2, 'embedding_dim': 64, 'lr': 0.0009614297416450062, 'lambda_val': 0.0008491169466682814, 'batch_size': 3133, 'optimizer': 'RMSprop'}.
2026-06-22 21:10:24,100 - experiment_functions - INFO - Early stopping at epoch 1550. Best Metrics: (0.02137068028460634, 0.0045724390551976765, 0.011666264058618453)
2026-06-22 21:10:24,204 - optuna.study.study - INFO - Trial 197 finished with values: [0.02137068028460634, 0.0045724390551976765, 0.011666264058618453] and parameters: {'n_layers': 2, 'embedding_dim': 64, 'lr': 0.0013675886061108719, 'lambda_val': 5.455116561469672e-06, 'batch_size': 1052, 'optimizer': 'RMSprop'}.
2026-06-22 21:12:44,713 - experiment_functions - INFO - Early stopping at epoch 2750. Best Metrics: (0.02288837074644346, 0.004954528230390299, 0.013060650415500776)
2026-06-22 21:12:45,028 - optuna.study.study - INFO - Trial 198 finished with values: [0.02288837074644346, 0.004954528230390299, 0.013060650415500776] and parameters: {'n_layers': 4, 'embedding_dim': 96, 'lr': 0.0004235044324291316, 'lambda_val': 1.3168385230338204e-05, 'batch_size': 2714, 'optimizer': 'Adam'}.
2026-06-22 21:13:13,375 - experiment_functions - INFO - Early stopping at epoch 600. Best Metrics: (0.006758595147771181, 0.0014320449665277254, 0.0036423999317353305)
2026-06-22 21:13:13,473 - optuna.study.study - INFO - Trial 199 finished with values: [0.006758595147771181, 0.0014320449665277254, 0.0036423999317353305] and parameters: {'n_layers': 4, 'embedding_dim': 32, 'lr': 0.03277404265387728, 'lambda_val': 0.00036714980791779657, 'batch_size': 2159, 'optimizer': 'RMSprop'}.
2026-06-22 21:14:12,354 - experiment_functions - INFO - Early stopping at epoch 1300. Best Metrics: (0.017665767163320616, 0.003839838322596943, 0.01005204907537915)
2026-06-22 21:14:12,794 - optuna.study.study - INFO - Trial 200 finished with values: [0.017665767163320616, 0.003839838322596943, 0.01005204907537915] and parameters: {'n_layers': 4, 'embedding_dim': 32, 'lr': 0.0009631397415203493, 'lambda_val': 0.0008491169466682814, 'batch_size': 1291, 'optimizer': 'RMSprop'}.
2026-06-22 21:15:30,891 - experiment_functions - INFO - Early stopping at epoch 1600. Best Metrics: (0.02877960622624637, 0.00621131741821397, 0.016411344171232266)
2026-06-22 21:15:31,011 - optuna.study.study - INFO - Trial 201 finished with values: [0.02877960622624637, 0.00621131741821397, 0.016411344171232266] and parameters: {'n_layers': 2, 'embedding_dim': 128, 'lr': 0.0006129132477888526, 'lambda_val': 0.0008491169466682814, 'batch_size': 1126, 'optimizer': 'RMSprop'}.
2026-06-22 21:18:28,981 - optuna.study.study - INFO - Trial 202 finished with values: [0.03431840945717503, 0.007248642162435266, 0.019590553691448295] and parameters: {'n_layers': 1, 'embedding_dim': 96, 'lr': 0.0007359228934435422, 'lambda_val': 0.0008491169466682814, 'batch_size': 2562, 'optimizer': 'RMSprop'}.
2026-06-22 21:18:58,519 - experiment_functions - INFO - Early stopping at epoch 550. Best Metrics: (0.0071241272522175195, 0.0015646709612226852, 0.0039408492862867475)
2026-06-22 21:18:58,628 - optuna.study.study - INFO - Trial 203 finished with values: [0.0071241272522175195, 0.0015646709612226852, 0.0039408492862867475] and parameters: {'n_layers': 4, 'embedding_dim': 96, 'lr': 0.005033757447953145, 'lambda_val': 0.004846331212696402, 'batch_size': 2714, 'optimizer': 'Adam'}.
2026-06-22 21:19:46,598 - experiment_functions - INFO - Early stopping at epoch 1050. Best Metrics: (0.012890720465837892, 0.002950928381962865, 0.007316605504256169)
2026-06-22 21:19:46,701 - optuna.study.study - INFO - Trial 204 finished with values: [0.012890720465837892, 0.002950928381962865, 0.007316605504256169] and parameters: {'n_layers': 4, 'embedding_dim': 32, 'lr': 0.0004235044324291316, 'lambda_val': 0.02886214111120906, 'batch_size': 3280, 'optimizer': 'RMSprop'}.
2026-06-22 21:22:40,320 - optuna.study.study - INFO - Trial 205 finished with values: [0.006106335596062324, 0.0014873057976506254, 0.0037111494298158157] and parameters: {'n_layers': 2, 'embedding_dim': 64, 'lr': 0.0001854947590635186, 'lambda_val': 0.0001583029704774821, 'batch_size': 3422, 'optimizer': 'Adam'}.
2026-06-22 21:23:03,469 - experiment_functions - INFO - Early stopping at epoch 500. Best Metrics: (0.00039868686439177754, 9.946949602122017e-05, 0.00023515752972831668)
2026-06-22 21:23:03,609 - optuna.study.study - INFO - Trial 206 finished with values: [0.00039868686439177754, 9.946949602122017e-05, 0.00023515752972831668] and parameters: {'n_layers': 2, 'embedding_dim': 32, 'lr': 0.00045681378220125877, 'lambda_val': 0.0008491169466682814, 'batch_size': 3133, 'optimizer': 'SGD'}.
2026-06-22 21:24:30,591 - experiment_functions - INFO - Early stopping at epoch 1700. Best Metrics: (0.021644280637239333, 0.004712959454338765, 0.012154545253149079)
2026-06-22 21:24:30,715 - optuna.study.study - INFO - Trial 207 finished with values: [0.021644280637239333, 0.004712959454338765, 0.012154545253149079] and parameters: {'n_layers': 4, 'embedding_dim': 96, 'lr': 0.0004235044324291316, 'lambda_val': 1.3168385230338204e-05, 'batch_size': 2714, 'optimizer': 'RMSprop'}.
2026-06-22 21:28:32,990 - optuna.study.study - INFO - Trial 208 finished with values: [0.026307483434947338, 0.00573607427055703, 0.014959152334993904] and parameters: {'n_layers': 3, 'embedding_dim': 256, 'lr': 0.0004235044324291316, 'lambda_val': 5.455116561469672e-06, 'batch_size': 558, 'optimizer': 'RMSprop'}.
2026-06-22 21:31:18,260 - optuna.study.study - INFO - Trial 209 finished with values: [0.00800977401928578, 0.001975179992421372, 0.005077104553599773] and parameters: {'n_layers': 1, 'embedding_dim': 64, 'lr': 0.00034872763677884483, 'lambda_val': 0.002013482105642368, 'batch_size': 3337, 'optimizer': 'Adam'}.
2026-06-22 21:32:25,056 - experiment_functions - INFO - Early stopping at epoch 1400. Best Metrics: (0.020781141620444588, 0.0045929645067576096, 0.011547185468198449)
2026-06-22 21:32:25,164 - optuna.study.study - INFO - Trial 210 finished with values: [0.020781141620444588, 0.0045929645067576096, 0.011547185468198449] and parameters: {'n_layers': 3, 'embedding_dim': 64, 'lr': 0.0004235044324291316, 'lambda_val': 0.007705317537376285, 'batch_size': 2562, 'optimizer': 'RMSprop'}.
2026-06-22 21:35:31,608 - experiment_functions - INFO - Early stopping at epoch 3650. Best Metrics: (0.02482301969097183, 0.005439244663382595, 0.014289266804772738)
2026-06-22 21:35:31,714 - optuna.study.study - INFO - Trial 211 finished with values: [0.02482301969097183, 0.005439244663382595, 0.014289266804772738] and parameters: {'n_layers': 4, 'embedding_dim': 96, 'lr': 0.00045681378220125877, 'lambda_val': 5.455116561469672e-06, 'batch_size': 558, 'optimizer': 'Adam'}.
2026-06-22 21:38:16,740 - optuna.study.study - INFO - Trial 212 finished with values: [0.019236676173361868, 0.004292977137804723, 0.011399772528087387] and parameters: {'n_layers': 1, 'embedding_dim': 32, 'lr': 0.0004235044324291316, 'lambda_val': 0.0008491169466682814, 'batch_size': 3698, 'optimizer': 'RMSprop'}.
2026-06-22 21:41:23,058 - optuna.study.study - INFO - Trial 213 finished with values: [0.024483653803406582, 0.005368195023367437, 0.01403179082674199] and parameters: {'n_layers': 4, 'embedding_dim': 64, 'lr': 0.0003610033899772668, 'lambda_val': 0.0006656875066949987, 'batch_size': 558, 'optimizer': 'Adam'}.
2026-06-22 21:44:20,655 - optuna.study.study - INFO - Trial 214 finished with values: [0.00609550786214396, 0.0014857269167613996, 0.003656670786007036] and parameters: {'n_layers': 2, 'embedding_dim': 96, 'lr': 0.0003610033899772668, 'lambda_val': 0.0006656875066949987, 'batch_size': 558, 'optimizer': 'Adam'}.
2026-06-22 21:45:29,568 - experiment_functions - INFO - Early stopping at epoch 1600. Best Metrics: (0.0004738169526266462, 0.00011683718580270305, 0.00028952434005979254)
2026-06-22 21:45:29,668 - optuna.study.study - INFO - Trial 215 finished with values: [0.0004738169526266462, 0.00011683718580270305, 0.00028952434005979254] and parameters: {'n_layers': 2, 'embedding_dim': 64, 'lr': 3.744821458458639e-05, 'lambda_val': 0.0001583029704774821, 'batch_size': 1052, 'optimizer': 'RMSprop'}.
2026-06-22 21:45:55,158 - experiment_functions - INFO - Early stopping at epoch 550. Best Metrics: (0.009960471421064005, 0.002235695339143615, 0.005936805951480773)
2026-06-22 21:45:55,291 - optuna.study.study - INFO - Trial 216 finished with values: [0.009960471421064005, 0.002235695339143615, 0.005936805951480773] and parameters: {'n_layers': 2, 'embedding_dim': 64, 'lr': 0.0024593680412654663, 'lambda_val': 0.008507655043799656, 'batch_size': 1000, 'optimizer': 'RMSprop'}.
2026-06-22 21:46:44,564 - experiment_functions - INFO - Early stopping at epoch 850. Best Metrics: (0.02543056544425856, 0.005477137804724012, 0.014615362242792846)
2026-06-22 21:46:44,717 - optuna.study.study - INFO - Trial 217 finished with values: [0.02543056544425856, 0.005477137804724012, 0.014615362242792846] and parameters: {'n_layers': 2, 'embedding_dim': 256, 'lr': 0.0009614297416450062, 'lambda_val': 0.0008491169466682814, 'batch_size': 3133, 'optimizer': 'Adam'}.
2026-06-22 21:47:07,377 - experiment_functions - INFO - Early stopping at epoch 500. Best Metrics: (0.00048065388042005115, 0.00012157382847038021, 0.00026646332940810007)
2026-06-22 21:47:07,526 - optuna.study.study - INFO - Trial 218 finished with values: [0.00048065388042005115, 0.00012157382847038021, 0.00026646332940810007] and parameters: {'n_layers': 1, 'embedding_dim': 64, 'lr': 0.0006129132477888526, 'lambda_val': 0.03546156124706191, 'batch_size': 3584, 'optimizer': 'Adam'}.
2026-06-22 21:47:40,192 - experiment_functions - INFO - Early stopping at epoch 700. Best Metrics: (0.025629812008214795, 0.005527661993179235, 0.014512260784291565)
2026-06-22 21:47:40,291 - optuna.study.study - INFO - Trial 219 finished with values: [0.025629812008214795, 0.005527661993179235, 0.014512260784291565] and parameters: {'n_layers': 2, 'embedding_dim': 64, 'lr': 0.001706237377982523, 'lambda_val': 0.0008491169466682814, 'batch_size': 3937, 'optimizer': 'Adam'}.
2026-06-22 21:48:40,025 - experiment_functions - INFO - Early stopping at epoch 1300. Best Metrics: (0.011866875461812839, 0.0025704180876594666, 0.0064880953917196785)
2026-06-22 21:48:40,398 - optuna.study.study - INFO - Trial 220 finished with values: [0.011866875461812839, 0.0025704180876594666, 0.0064880953917196785] and parameters: {'n_layers': 2, 'embedding_dim': 96, 'lr': 0.001706237377982523, 'lambda_val': 0.0008491169466682814, 'batch_size': 577, 'optimizer': 'RMSprop'}.
2026-06-22 21:51:32,560 - optuna.study.study - INFO - Trial 221 finished with values: [0.015417434200952035, 0.003604585070102311, 0.008934459508114046] and parameters: {'n_layers': 1, 'embedding_dim': 96, 'lr': 0.0004235044324291316, 'lambda_val': 0.0008491169466682814, 'batch_size': 2714, 'optimizer': 'Adam'}.
2026-06-22 21:51:55,894 - experiment_functions - INFO - Early stopping at epoch 500. Best Metrics: (0.0005717922791513783, 0.00013420487558418593, 0.00030984468171494647)
2026-06-22 21:51:56,248 - optuna.study.study - INFO - Trial 222 finished with values: [0.0005717922791513783, 0.00013420487558418593, 0.00030984468171494647] and parameters: {'n_layers': 4, 'embedding_dim': 32, 'lr': 0.0001854947590635186, 'lambda_val': 0.0072478653935791615, 'batch_size': 2194, 'optimizer': 'SGD'}.
2026-06-22 21:54:48,183 - experiment_functions - INFO - Early stopping at epoch 3950. Best Metrics: (0.024279464673689036, 0.005229253505115575, 0.014199825773868458)
2026-06-22 21:54:48,285 - optuna.study.study - INFO - Trial 223 finished with values: [0.024279464673689036, 0.005229253505115575, 0.014199825773868458] and parameters: {'n_layers': 4, 'embedding_dim': 32, 'lr': 0.0003610033899772668, 'lambda_val': 0.0008491169466682814, 'batch_size': 1291, 'optimizer': 'RMSprop'}.
2026-06-22 21:55:15,832 - experiment_functions - INFO - Early stopping at epoch 600. Best Metrics: (0.009204430509980427, 0.0020320197044334976, 0.004664547768160761)
2026-06-22 21:55:15,937 - optuna.study.study - INFO - Trial 224 finished with values: [0.009204430509980427, 0.0020320197044334976, 0.004664547768160761] and parameters: {'n_layers': 3, 'embedding_dim': 32, 'lr': 0.00318771282150547, 'lambda_val': 0.03546156124706191, 'batch_size': 3584, 'optimizer': 'Adam'}.
2026-06-22 21:58:07,516 - optuna.study.study - INFO - Trial 225 finished with values: [0.023894374664482715, 0.005132941770872806, 0.013649224225557725] and parameters: {'n_layers': 3, 'embedding_dim': 32, 'lr': 0.00045681378220125877, 'lambda_val': 0.0008491169466682814, 'batch_size': 2562, 'optimizer': 'Adam'}.
2026-06-22 21:58:47,769 - experiment_functions - INFO - Early stopping at epoch 900. Best Metrics: (0.010314570503590546, 0.0021235947960085893, 0.0059054162690081145)
2026-06-22 21:58:47,930 - optuna.study.study - INFO - Trial 226 finished with values: [0.010314570503590546, 0.0021235947960085893, 0.0059054162690081145] and parameters: {'n_layers': 3, 'embedding_dim': 32, 'lr': 0.011458898783031498, 'lambda_val': 5.455116561469672e-06, 'batch_size': 3296, 'optimizer': 'RMSprop'}.
2026-06-22 21:59:22,706 - experiment_functions - INFO - Early stopping at epoch 750. Best Metrics: (0.026416444291236928, 0.005601869394972843, 0.01489182878320835)
2026-06-22 21:59:22,866 - optuna.study.study - INFO - Trial 227 finished with values: [0.026416444291236928, 0.005601869394972843, 0.01489182878320835] and parameters: {'n_layers': 2, 'embedding_dim': 64, 'lr': 0.001706237377982523, 'lambda_val': 0.0008491169466682814, 'batch_size': 2857, 'optimizer': 'Adam'}.
2026-06-22 22:00:52,452 - experiment_functions - INFO - Early stopping at epoch 1900. Best Metrics: (0.022223479941750772, 0.004839269925476822, 0.012785251644268672)
2026-06-22 22:00:52,767 - optuna.study.study - INFO - Trial 228 finished with values: [0.022223479941750772, 0.004839269925476822, 0.012785251644268672] and parameters: {'n_layers': 4, 'embedding_dim': 64, 'lr': 0.00045681378220125877, 'lambda_val': 5.455116561469672e-06, 'batch_size': 3133, 'optimizer': 'RMSprop'}.
2026-06-22 22:01:44,471 - experiment_functions - INFO - Early stopping at epoch 1150. Best Metrics: (0.030538711928443076, 0.006449728432487054, 0.017489833760097388)
2026-06-22 22:01:44,576 - optuna.study.study - INFO - Trial 229 finished with values: [0.030538711928443076, 0.006449728432487054, 0.017489833760097388] and parameters: {'n_layers': 1, 'embedding_dim': 96, 'lr': 0.001706237377982523, 'lambda_val': 5.455116561469672e-06, 'batch_size': 1879, 'optimizer': 'RMSprop'}.
2026-06-22 22:03:31,971 - experiment_functions - INFO - Early stopping at epoch 2450. Best Metrics: (0.02397359891276529, 0.0050666287735253255, 0.01364563921502659)
2026-06-22 22:03:32,077 - optuna.study.study - INFO - Trial 230 finished with values: [0.02397359891276529, 0.0050666287735253255, 0.01364563921502659] and parameters: {'n_layers': 4, 'embedding_dim': 32, 'lr': 0.0006129132477888526, 'lambda_val': 0.0008491169466682814, 'batch_size': 1291, 'optimizer': 'Adam'}.
2026-06-22 22:05:09,835 - experiment_functions - INFO - Early stopping at epoch 1600. Best Metrics: (0.02484995826719789, 0.00533030188202602, 0.013894051154537752)
