2026-06-21 12:46:51,226 - optuna.study.study - INFO - Trial 111 finished with values: [0.004307542821826959, 0.0009299608437539471, 0.0025300922610982735] and parameters: {'n_layers': 1, 'embedding_dim': 64, 'lr': 0.0006104134330921928, 'lambda_val': 2.854699329527242e-06, 'batch_size': 3322, 'optimizer': 'Adam'}.
2026-06-21 12:47:16,089 - experiment_functions - INFO - Early stopping at epoch 550. Best Metrics: (0.00488565052021874, 0.0012252115700391562, 0.002868339389107659)
2026-06-21 12:47:16,193 - optuna.study.study - INFO - Trial 112 finished with values: [0.00488565052021874, 0.0012252115700391562, 0.002868339389107659] and parameters: {'n_layers': 3, 'embedding_dim': 64, 'lr': 0.03212361641248932, 'lambda_val': 4.0850305001077695e-05, 'batch_size': 2732, 'optimizer': 'Adam'}.
2026-06-21 12:47:41,042 - experiment_functions - INFO - Early stopping at epoch 550. Best Metrics: (0.004151365657518482, 0.0010073260073260072, 0.0024725561737369687)
2026-06-21 12:47:41,159 - optuna.study.study - INFO - Trial 113 finished with values: [0.004151365657518482, 0.0010073260073260072, 0.0024725561737369687] and parameters: {'n_layers': 3, 'embedding_dim': 64, 'lr': 0.01648090699159999, 'lambda_val': 7.185633297867177e-05, 'batch_size': 3893, 'optimizer': 'RMSprop'}.
2026-06-21 12:48:18,435 - experiment_functions - INFO - Early stopping at epoch 650. Best Metrics: (0.004000394820377207, 0.0009678539850953644, 0.002430043297941388)
2026-06-21 12:48:18,513 - optuna.study.study - INFO - Trial 114 finished with values: [0.004000394820377207, 0.0009678539850953644, 0.002430043297941388] and parameters: {'n_layers': 4, 'embedding_dim': 256, 'lr': 0.05051122349031436, 'lambda_val': 2.706498615300197e-06, 'batch_size': 3645, 'optimizer': 'RMSprop'}.
2026-06-21 12:49:20,022 - experiment_functions - INFO - Early stopping at epoch 1400. Best Metrics: (0.0036981000112956044, 0.0009789061513199445, 0.0022971963891144057)
2026-06-21 12:49:20,098 - optuna.study.study - INFO - Trial 115 finished with values: [0.0036981000112956044, 0.0009789061513199445, 0.0022971963891144057] and parameters: {'n_layers': 2, 'embedding_dim': 128, 'lr': 0.02060883241850729, 'lambda_val': 1.4121365572109793e-06, 'batch_size': 3199, 'optimizer': 'RMSprop'}.
2026-06-21 12:50:27,016 - experiment_functions - INFO - Early stopping at epoch 1350. Best Metrics: (0.005908025313744863, 0.0014494126563092081, 0.003576885594534768)
2026-06-21 12:50:27,086 - optuna.study.study - INFO - Trial 116 finished with values: [0.005908025313744863, 0.0014494126563092081, 0.003576885594534768] and parameters: {'n_layers': 2, 'embedding_dim': 256, 'lr': 0.0019529911061502276, 'lambda_val': 2.854699329527242e-06, 'batch_size': 3322, 'optimizer': 'Adam'}.
2026-06-21 12:53:07,631 - optuna.study.study - INFO - Trial 117 finished with values: [0.003083593795575944, 0.000686813186813187, 0.001818769458226742] and parameters: {'n_layers': 1, 'embedding_dim': 96, 'lr': 0.0004419346142273276, 'lambda_val': 0.00021699095102509954, 'batch_size': 2410, 'optimizer': 'Adam'}.
2026-06-21 12:53:34,358 - experiment_functions - INFO - Early stopping at epoch 550. Best Metrics: (0.0052689697760513465, 0.0013246810660603762, 0.003046374565135825)
2026-06-21 12:53:34,444 - optuna.study.study - INFO - Trial 118 finished with values: [0.0052689697760513465, 0.0013246810660603762, 0.003046374565135825] and parameters: {'n_layers': 3, 'embedding_dim': 128, 'lr': 0.007517511425007554, 'lambda_val': 0.0005396544876416404, 'batch_size': 2732, 'optimizer': 'RMSprop'}.
2026-06-21 12:53:56,494 - experiment_functions - INFO - Early stopping at epoch 500. Best Metrics: (0.000493709629483927, 0.00011683718580270305, 0.00029647770634255775)
2026-06-21 12:53:56,596 - optuna.study.study - INFO - Trial 119 finished with values: [0.000493709629483927, 0.00011683718580270305, 0.00029647770634255775] and parameters: {'n_layers': 2, 'embedding_dim': 64, 'lr': 0.00599824014211808, 'lambda_val': 1.6213630924331792e-06, 'batch_size': 3386, 'optimizer': 'SGD'}.
2026-06-21 12:54:23,359 - experiment_functions - INFO - Early stopping at epoch 550. Best Metrics: (0.004359563090267252, 0.001092585575344196, 0.0025898162310901123)
2026-06-21 12:54:23,436 - optuna.study.study - INFO - Trial 120 finished with values: [0.004359563090267252, 0.001092585575344196, 0.0025898162310901123] and parameters: {'n_layers': 3, 'embedding_dim': 128, 'lr': 0.006995058301313629, 'lambda_val': 0.014679201594967693, 'batch_size': 2662, 'optimizer': 'Adam'}.
2026-06-21 12:55:32,462 - experiment_functions - INFO - Early stopping at epoch 1400. Best Metrics: (0.005766434039343725, 0.0013815207780725023, 0.003361628123368727)
2026-06-21 12:55:32,551 - optuna.study.study - INFO - Trial 121 finished with values: [0.005766434039343725, 0.0013815207780725023, 0.003361628123368727] and parameters: {'n_layers': 2, 'embedding_dim': 256, 'lr': 0.003959528614934683, 'lambda_val': 1.0480033391436414e-06, 'batch_size': 3322, 'optimizer': 'Adam'}.
2026-06-21 12:55:56,239 - experiment_functions - INFO - Early stopping at epoch 550. Best Metrics: (0.002245628314352925, 0.0005731337627889352, 0.0013853346693497197)
2026-06-21 12:55:56,323 - optuna.study.study - INFO - Trial 122 finished with values: [0.002245628314352925, 0.0005731337627889352, 0.0013853346693497197] and parameters: {'n_layers': 2, 'embedding_dim': 32, 'lr': 0.0183275310294566, 'lambda_val': 0.00216624247898919, 'batch_size': 2281, 'optimizer': 'RMSprop'}.
2026-06-21 12:58:45,691 - optuna.study.study - INFO - Trial 123 finished with values: [0.0103054509133598, 0.002586206896551724, 0.006321618597568953] and parameters: {'n_layers': 4, 'embedding_dim': 64, 'lr': 0.0003941995846468513, 'lambda_val': 0.0002491576543882324, 'batch_size': 2732, 'optimizer': 'RMSprop'}.
2026-06-21 12:59:21,549 - experiment_functions - INFO - Early stopping at epoch 850. Best Metrics: (0.00928559378876975, 0.0022909561702665155, 0.005653074383691445)
2026-06-21 12:59:22,594 - optuna.study.study - INFO - Trial 124 finished with values: [0.00928559378876975, 0.0022909561702665155, 0.005653074383691445] and parameters: {'n_layers': 3, 'embedding_dim': 32, 'lr': 0.004051056337067167, 'lambda_val': 1.9888087490246264e-06, 'batch_size': 975, 'optimizer': 'Adam'}.
2026-06-21 12:59:50,562 - experiment_functions - INFO - Early stopping at epoch 600. Best Metrics: (0.004926651233981932, 0.0011810029051408364, 0.002888296988161027)
2026-06-21 12:59:50,667 - optuna.study.study - INFO - Trial 125 finished with values: [0.004926651233981932, 0.0011810029051408364, 0.002888296988161027] and parameters: {'n_layers': 2, 'embedding_dim': 128, 'lr': 0.01594862440926431, 'lambda_val': 5.534713206436078e-06, 'batch_size': 3241, 'optimizer': 'Adam'}.
2026-06-21 13:00:16,003 - experiment_functions - INFO - Early stopping at epoch 550. Best Metrics: (0.004656081438247135, 0.0012125805229253504, 0.0027791705286334483)
2026-06-21 13:00:16,085 - optuna.study.study - INFO - Trial 126 finished with values: [0.004656081438247135, 0.0012125805229253504, 0.0027791705286334483] and parameters: {'n_layers': 4, 'embedding_dim': 64, 'lr': 0.01378622273021131, 'lambda_val': 1.6213630924331792e-06, 'batch_size': 3386, 'optimizer': 'RMSprop'}.
2026-06-21 13:00:42,650 - experiment_functions - INFO - Early stopping at epoch 550. Best Metrics: (0.006948103673047331, 0.001689402551471517, 0.004011835599571403)
2026-06-21 13:00:42,737 - optuna.study.study - INFO - Trial 127 finished with values: [0.006948103673047331, 0.001689402551471517, 0.004011835599571403] and parameters: {'n_layers': 4, 'embedding_dim': 96, 'lr': 0.017411800301980536, 'lambda_val': 1.00362290309107e-06, 'batch_size': 1014, 'optimizer': 'Adam'}.
2026-06-21 13:01:24,945 - experiment_functions - INFO - Early stopping at epoch 1000. Best Metrics: (0.006342502292939623, 0.001566249842111911, 0.003788699459097011)
2026-06-21 13:01:25,017 - optuna.study.study - INFO - Trial 128 finished with values: [0.006342502292939623, 0.001566249842111911, 0.003788699459097011] and parameters: {'n_layers': 2, 'embedding_dim': 64, 'lr': 0.003566354885654931, 'lambda_val': 0.0008411828500307989, 'batch_size': 1014, 'optimizer': 'Adam'}.
2026-06-21 13:01:54,247 - experiment_functions - INFO - Early stopping at epoch 650. Best Metrics: (0.006980082197492796, 0.0017115068839206771, 0.004145921020029778)
2026-06-21 13:01:54,340 - optuna.study.study - INFO - Trial 129 finished with values: [0.006980082197492796, 0.0017115068839206771, 0.004145921020029778] and parameters: {'n_layers': 3, 'embedding_dim': 64, 'lr': 0.0044739262759054006, 'lambda_val': 6.059814023598347e-06, 'batch_size': 4092, 'optimizer': 'Adam'}.
2026-06-21 13:02:20,556 - experiment_functions - INFO - Early stopping at epoch 550. Best Metrics: (0.00203647963501943, 0.0005368195023367437, 0.0012182241945746298)
2026-06-21 13:02:20,638 - optuna.study.study - INFO - Trial 130 finished with values: [0.00203647963501943, 0.0005368195023367437, 0.0012182241945746298] and parameters: {'n_layers': 4, 'embedding_dim': 96, 'lr': 0.0044739262759054006, 'lambda_val': 0.07423024034318107, 'batch_size': 1014, 'optimizer': 'RMSprop'}.
2026-06-21 13:02:45,863 - experiment_functions - INFO - Early stopping at epoch 550. Best Metrics: (0.0028137164901756665, 0.0006599722116963497, 0.0016048032195494818)
2026-06-21 13:02:45,952 - optuna.study.study - INFO - Trial 131 finished with values: [0.0028137164901756665, 0.0006599722116963497, 0.0016048032195494818] and parameters: {'n_layers': 4, 'embedding_dim': 64, 'lr': 0.018560168848895237, 'lambda_val': 0.003799960425456179, 'batch_size': 1014, 'optimizer': 'RMSprop'}.
2026-06-21 13:03:13,944 - experiment_functions - INFO - Early stopping at epoch 650. Best Metrics: (0.0062060272913656706, 0.0015978274598964256, 0.003478935124593485)
2026-06-21 13:03:14,041 - optuna.study.study - INFO - Trial 132 finished with values: [0.0062060272913656706, 0.0015978274598964256, 0.003478935124593485] and parameters: {'n_layers': 4, 'embedding_dim': 32, 'lr': 0.0044739262759054006, 'lambda_val': 0.014679201594967693, 'batch_size': 1014, 'optimizer': 'Adam'}.
2026-06-21 13:03:41,621 - experiment_functions - INFO - Early stopping at epoch 550. Best Metrics: (0.002729445060605886, 0.0007057597574838954, 0.001586297595213389)
2026-06-21 13:03:41,710 - optuna.study.study - INFO - Trial 133 finished with values: [0.002729445060605886, 0.0007057597574838954, 0.001586297595213389] and parameters: {'n_layers': 4, 'embedding_dim': 128, 'lr': 0.018560168848895237, 'lambda_val': 0.019950251358453505, 'batch_size': 2642, 'optimizer': 'Adam'}.
2026-06-21 13:04:43,008 - experiment_functions - INFO - Early stopping at epoch 1250. Best Metrics: (0.00535008770608794, 0.001326259946949602, 0.003096875852498989)
2026-06-21 13:04:43,085 - optuna.study.study - INFO - Trial 134 finished with values: [0.00535008770608794, 0.001326259946949602, 0.003096875852498989] and parameters: {'n_layers': 2, 'embedding_dim': 256, 'lr': 0.00599824014211808, 'lambda_val': 1.6213630924331792e-06, 'batch_size': 3145, 'optimizer': 'RMSprop'}.
2026-06-21 13:05:09,930 - experiment_functions - INFO - Early stopping at epoch 550. Best Metrics: (0.005750761393829851, 0.0014146772767462423, 0.0033260001923029994)
2026-06-21 13:05:10,029 - optuna.study.study - INFO - Trial 135 finished with values: [0.005750761393829851, 0.0014146772767462423, 0.0033260001923029994] and parameters: {'n_layers': 3, 'embedding_dim': 128, 'lr': 0.007852338517216746, 'lambda_val': 1.8308866889687562e-05, 'batch_size': 3241, 'optimizer': 'RMSprop'}.
2026-06-21 13:05:35,893 - experiment_functions - INFO - Early stopping at epoch 550. Best Metrics: (0.0039440360617827575, 0.001021535935329039, 0.0022631606412908656)
2026-06-21 13:05:35,989 - optuna.study.study - INFO - Trial 136 finished with values: [0.0039440360617827575, 0.001021535935329039, 0.0022631606412908656] and parameters: {'n_layers': 3, 'embedding_dim': 96, 'lr': 0.003959528614934683, 'lambda_val': 0.01939355777550537, 'batch_size': 2962, 'optimizer': 'RMSprop'}.
2026-06-21 13:06:03,774 - experiment_functions - INFO - Early stopping at epoch 600. Best Metrics: (0.0041794513806479435, 0.001026272577996716, 0.002517826691018662)
2026-06-21 13:06:03,850 - optuna.study.study - INFO - Trial 137 finished with values: [0.0041794513806479435, 0.001026272577996716, 0.002517826691018662] and parameters: {'n_layers': 3, 'embedding_dim': 96, 'lr': 0.028165568103558247, 'lambda_val': 1.6213630924331792e-06, 'batch_size': 1726, 'optimizer': 'RMSprop'}.
2026-06-21 13:06:37,236 - experiment_functions - INFO - Early stopping at epoch 700. Best Metrics: (0.0036506938366956546, 0.0009520651762031074, 0.0022764183115095453)
2026-06-21 13:06:37,321 - optuna.study.study - INFO - Trial 138 finished with values: [0.0036506938366956546, 0.0009520651762031074, 0.0022764183115095453] and parameters: {'n_layers': 1, 'embedding_dim': 256, 'lr': 0.007517511425007554, 'lambda_val': 0.0002491576543882324, 'batch_size': 2732, 'optimizer': 'RMSprop'}.
2026-06-21 13:08:07,629 - experiment_functions - INFO - Early stopping at epoch 2000. Best Metrics: (0.009642969136893026, 0.0024156877605153466, 0.005894938492071335)
2026-06-21 13:08:07,707 - optuna.study.study - INFO - Trial 139 finished with values: [0.009642969136893026, 0.0024156877605153466, 0.005894938492071335] and parameters: {'n_layers': 4, 'embedding_dim': 96, 'lr': 0.0005405212661976008, 'lambda_val': 0.00034129251188470285, 'batch_size': 2962, 'optimizer': 'Adam'}.
2026-06-21 13:08:34,251 - experiment_functions - INFO - Early stopping at epoch 550. Best Metrics: (0.007203564009385062, 0.0018030819754957684, 0.0042848932832723835)
2026-06-21 13:08:34,337 - optuna.study.study - INFO - Trial 140 finished with values: [0.007203564009385062, 0.0018030819754957684, 0.0042848932832723835] and parameters: {'n_layers': 3, 'embedding_dim': 128, 'lr': 0.0044739262759054006, 'lambda_val': 1.8308866889687562e-05, 'batch_size': 2281, 'optimizer': 'RMSprop'}.
2026-06-21 13:09:02,087 - experiment_functions - INFO - Early stopping at epoch 550. Best Metrics: (0.006128801441096384, 0.0015409877478842998, 0.003553932155884459)
2026-06-21 13:09:02,174 - optuna.study.study - INFO - Trial 141 finished with values: [0.006128801441096384, 0.0015409877478842998, 0.003553932155884459] and parameters: {'n_layers': 4, 'embedding_dim': 128, 'lr': 0.02060883241850729, 'lambda_val': 2.1085708841093375e-05, 'batch_size': 1179, 'optimizer': 'Adam'}.
2026-06-21 13:11:44,612 - optuna.study.study - INFO - Trial 142 finished with values: [0.0063663412027328385, 0.0015267778198812681, 0.0039775990180802145] and parameters: {'n_layers': 2, 'embedding_dim': 64, 'lr': 0.0006104134330921928, 'lambda_val': 1.4121365572109793e-06, 'batch_size': 3199, 'optimizer': 'Adam'}.
2026-06-21 13:12:10,865 - experiment_functions - INFO - Early stopping at epoch 550. Best Metrics: (0.00560823896431279, 0.0014462548945307564, 0.0033653771663899133)
2026-06-21 13:12:10,953 - optuna.study.study - INFO - Trial 143 finished with values: [0.00560823896431279, 0.0014462548945307564, 0.0033653771663899133] and parameters: {'n_layers': 4, 'embedding_dim': 96, 'lr': 0.007517511425007554, 'lambda_val': 0.014679201594967693, 'batch_size': 2732, 'optimizer': 'Adam'}.
2026-06-21 13:12:34,469 - experiment_functions - INFO - Early stopping at epoch 550. Best Metrics: (0.002580842207159509, 0.0006094480232411268, 0.0015268739261817363)
2026-06-21 13:12:34,589 - optuna.study.study - INFO - Trial 144 finished with values: [0.002580842207159509, 0.0006094480232411268, 0.0015268739261817363] and parameters: {'n_layers': 2, 'embedding_dim': 32, 'lr': 0.0256353522777213, 'lambda_val': 0.008579649260516903, 'batch_size': 2331, 'optimizer': 'Adam'}.
2026-06-21 13:15:42,358 - optuna.study.study - INFO - Trial 145 finished with values: [0.0025169675841316746, 0.0005162940507768094, 0.0015229050946517397] and parameters: {'n_layers': 2, 'embedding_dim': 256, 'lr': 0.00020536131884751725, 'lambda_val': 0.00037941540794106203, 'batch_size': 2122, 'optimizer': 'RMSprop'}.
2026-06-21 13:19:04,459 - optuna.study.study - INFO - Trial 146 finished with values: [0.00937891293396605, 0.0023462170013894153, 0.005737745602384752] and parameters: {'n_layers': 3, 'embedding_dim': 256, 'lr': 0.0004419346142273276, 'lambda_val': 0.00036884249384628963, 'batch_size': 1006, 'optimizer': 'RMSprop'}.
2026-06-21 13:19:34,017 - experiment_functions - INFO - Early stopping at epoch 600. Best Metrics: (0.0033200650931829215, 0.0008683844890741443, 0.0019300758820384625)
2026-06-21 13:19:34,116 - optuna.study.study - INFO - Trial 147 finished with values: [0.0033200650931829215, 0.0008683844890741443, 0.0019300758820384625] and parameters: {'n_layers': 4, 'embedding_dim': 128, 'lr': 0.0044739262759054006, 'lambda_val': 0.037394141883602544, 'batch_size': 975, 'optimizer': 'Adam'}.
2026-06-21 13:20:07,188 - experiment_functions - INFO - Early stopping at epoch 750. Best Metrics: (0.006086313370014527, 0.0015457243905519769, 0.003713285282970869)
2026-06-21 13:20:07,283 - optuna.study.study - INFO - Trial 148 finished with values: [0.006086313370014527, 0.0015457243905519769, 0.003713285282970869] and parameters: {'n_layers': 2, 'embedding_dim': 96, 'lr': 0.0044739262759054006, 'lambda_val': 0.0002491576543882324, 'batch_size': 1014, 'optimizer': 'RMSprop'}.
2026-06-21 13:20:37,097 - experiment_functions - INFO - Early stopping at epoch 700. Best Metrics: (0.00321530939330591, 0.0007894404446128584, 0.0019675301851834097)
2026-06-21 13:20:37,188 - optuna.study.study - INFO - Trial 149 finished with values: [0.00321530939330591, 0.0007894404446128584, 0.0019675301851834097] and parameters: {'n_layers': 1, 'embedding_dim': 64, 'lr': 0.012770054992031073, 'lambda_val': 7.185633297867177e-05, 'batch_size': 2250, 'optimizer': 'RMSprop'}.
2026-06-21 13:21:01,127 - experiment_functions - INFO - Early stopping at epoch 500. Best Metrics: (0.0005542543719808204, 0.00011683718580270305, 0.0003104234119287867)
2026-06-21 13:21:01,220 - optuna.study.study - INFO - Trial 150 finished with values: [0.0005542543719808204, 0.00011683718580270305, 0.0003104234119287867] and parameters: {'n_layers': 1, 'embedding_dim': 256, 'lr': 0.0019529911061502276, 'lambda_val': 1.6213630924331792e-06, 'batch_size': 3145, 'optimizer': 'SGD'}.
2026-06-21 13:23:06,631 - experiment_functions - INFO - Early stopping at epoch 2900. Best Metrics: (0.00864875217463419, 0.0021346469622331695, 0.0052221168483791896)
2026-06-21 13:23:06,705 - optuna.study.study - INFO - Trial 151 finished with values: [0.00864875217463419, 0.0021346469622331695, 0.0052221168483791896] and parameters: {'n_layers': 3, 'embedding_dim': 96, 'lr': 0.0006104134330921928, 'lambda_val': 0.0002491576543882324, 'batch_size': 3322, 'optimizer': 'Adam'}.
2026-06-21 13:24:45,694 - experiment_functions - INFO - Early stopping at epoch 2500. Best Metrics: (0.007095263702713025, 0.0016594038145762286, 0.004279912016684949)
2026-06-21 13:24:45,765 - optuna.study.study - INFO - Trial 152 finished with values: [0.007095263702713025, 0.0016594038145762286, 0.004279912016684949] and parameters: {'n_layers': 2, 'embedding_dim': 32, 'lr': 0.0019529911061502276, 'lambda_val': 2.854699329527242e-06, 'batch_size': 1087, 'optimizer': 'Adam'}.
2026-06-21 13:25:17,978 - experiment_functions - INFO - Early stopping at epoch 650. Best Metrics: (0.007996445612662644, 0.0020335985853227236, 0.004688029102047174)
2026-06-21 13:25:18,070 - optuna.study.study - INFO - Trial 153 finished with values: [0.007996445612662644, 0.0020335985853227236, 0.004688029102047174] and parameters: {'n_layers': 4, 'embedding_dim': 128, 'lr': 0.0044739262759054006, 'lambda_val': 1.8308866889687562e-05, 'batch_size': 2281, 'optimizer': 'Adam'}.
2026-06-21 13:25:43,202 - experiment_functions - INFO - Early stopping at epoch 550. Best Metrics: (0.006420376106645092, 0.0015930908172287483, 0.003778989522401848)
2026-06-21 13:25:43,295 - optuna.study.study - INFO - Trial 154 finished with values: [0.006420376106645092, 0.0015930908172287483, 0.003778989522401848] and parameters: {'n_layers': 4, 'embedding_dim': 64, 'lr': 0.007517511425007554, 'lambda_val': 1.6213630924331792e-06, 'batch_size': 2732, 'optimizer': 'RMSprop'}.
2026-06-21 13:26:39,419 - experiment_functions - INFO - Early stopping at epoch 1350. Best Metrics: (0.005507328804589546, 0.001398888467853985, 0.003186599556449981)
2026-06-21 13:26:39,510 - optuna.study.study - INFO - Trial 155 finished with values: [0.005507328804589546, 0.001398888467853985, 0.003186599556449981] and parameters: {'n_layers': 2, 'embedding_dim': 64, 'lr': 0.0008890810320593691, 'lambda_val': 0.015776192439085224, 'batch_size': 2399, 'optimizer': 'RMSprop'}.
2026-06-21 13:29:29,782 - optuna.study.study - INFO - Trial 156 finished with values: [0.006192319590207946, 0.0015741442465580396, 0.003830089934456029] and parameters: {'n_layers': 3, 'embedding_dim': 96, 'lr': 0.0004541549556891484, 'lambda_val': 1.9888087490246264e-06, 'batch_size': 975, 'optimizer': 'Adam'}.
2026-06-21 13:29:54,609 - experiment_functions - INFO - Early stopping at epoch 550. Best Metrics: (0.004874385754959114, 0.001182581786030062, 0.0029015963708049204)
2026-06-21 13:29:54,687 - optuna.study.study - INFO - Trial 157 finished with values: [0.004874385754959114, 0.001182581786030062, 0.0029015963708049204] and parameters: {'n_layers': 3, 'embedding_dim': 64, 'lr': 0.03212361641248932, 'lambda_val': 4.0850305001077695e-05, 'batch_size': 3893, 'optimizer': 'Adam'}.
2026-06-21 13:30:21,555 - experiment_functions - INFO - Early stopping at epoch 600. Best Metrics: (0.006303886949140605, 0.0015867752936718456, 0.004056261041761467)
