2026-06-19 13:20:55,157 - optuna.study.study - INFO - Trial 57 finished with values: [0.023523285702251737, 0.005121889604648226, 0.01364354452902815] and parameters: {'n_layers': 3, 'embedding_dim': 96, 'lr': 0.000631580780877778, 'lambda_val': 0.00030561828294198225, 'batch_size': 2157, 'optimizer': 'RMSprop'}.
2026-06-19 13:21:20,320 - experiment_functions - INFO - Early stopping at epoch 500. Best Metrics: (0.0004228744385906498, 0.00011210054313502591, 0.0002571300517565916)
2026-06-19 13:21:20,400 - optuna.study.study - INFO - Trial 58 finished with values: [0.0004228744385906498, 0.00011210054313502591, 0.0002571300517565916] and parameters: {'n_layers': 2, 'embedding_dim': 96, 'lr': 0.001667420974397332, 'lambda_val': 6.625891078039768e-05, 'batch_size': 2386, 'optimizer': 'SGD'}.
2026-06-19 13:24:16,819 - optuna.study.study - INFO - Trial 59 finished with values: [0.012016531774872182, 0.0026698875836806872, 0.007111319398652821] and parameters: {'n_layers': 3, 'embedding_dim': 32, 'lr': 0.00019387500325930484, 'lambda_val': 0.0008949468970728829, 'batch_size': 2157, 'optimizer': 'RMSprop'}.
2026-06-19 13:24:54,365 - experiment_functions - INFO - Early stopping at epoch 750. Best Metrics: (0.010427522469948094, 0.002215169887583681, 0.0058962856612719255)
2026-06-19 13:24:54,466 - optuna.study.study - INFO - Trial 60 finished with values: [0.010427522469948094, 0.002215169887583681, 0.0058962856612719255] and parameters: {'n_layers': 2, 'embedding_dim': 96, 'lr': 0.004815452060543289, 'lambda_val': 0.0008323498043954743, 'batch_size': 2615, 'optimizer': 'RMSprop'}.
2026-06-19 13:28:26,178 - optuna.study.study - INFO - Trial 61 finished with values: [0.0005598099362401643, 0.00013736263736263736, 0.00030555397478318225] and parameters: {'n_layers': 4, 'embedding_dim': 128, 'lr': 3.0593698685214465e-05, 'lambda_val': 1.2254977159578196e-06, 'batch_size': 3493, 'optimizer': 'Adam'}.
2026-06-19 13:30:07,944 - experiment_functions - INFO - Early stopping at epoch 2000. Best Metrics: (0.010141858513918646, 0.0020935960591133003, 0.0054433444897345916)
2026-06-19 13:30:08,037 - optuna.study.study - INFO - Trial 62 finished with values: [0.010141858513918646, 0.0020935960591133003, 0.0054433444897345916] and parameters: {'n_layers': 4, 'embedding_dim': 96, 'lr': 0.006643928261151227, 'lambda_val': 0.0002800804472836813, 'batch_size': 1262, 'optimizer': 'RMSprop'}.
2026-06-19 13:30:50,811 - experiment_functions - INFO - Early stopping at epoch 900. Best Metrics: (0.017668909046505647, 0.0041382468106606046, 0.010057161950837895)
2026-06-19 13:30:50,898 - optuna.study.study - INFO - Trial 63 finished with values: [0.017668909046505647, 0.0041382468106606046, 0.010057161950837895] and parameters: {'n_layers': 2, 'embedding_dim': 64, 'lr': 0.000631580780877778, 'lambda_val': 0.033336651535739364, 'batch_size': 3297, 'optimizer': 'RMSprop'}.
2026-06-19 13:31:22,760 - experiment_functions - INFO - Early stopping at epoch 650. Best Metrics: (0.02280391984271823, 0.004954528230390299, 0.012929165164379353)
2026-06-19 13:31:22,857 - optuna.study.study - INFO - Trial 64 finished with values: [0.02280391984271823, 0.004954528230390299, 0.012929165164379353] and parameters: {'n_layers': 1, 'embedding_dim': 96, 'lr': 0.006643928261151227, 'lambda_val': 0.00016834827857066878, 'batch_size': 2003, 'optimizer': 'Adam'}.
2026-06-19 13:32:07,204 - experiment_functions - INFO - Early stopping at epoch 900. Best Metrics: (0.011739989761192697, 0.0028719843375015794, 0.006570630417435722)
2026-06-19 13:32:07,292 - optuna.study.study - INFO - Trial 65 finished with values: [0.011739989761192697, 0.0028719843375015794, 0.006570630417435722] and parameters: {'n_layers': 2, 'embedding_dim': 96, 'lr': 0.0007090431996729071, 'lambda_val': 0.0535406649200873, 'batch_size': 3133, 'optimizer': 'RMSprop'}.
2026-06-19 13:32:37,326 - experiment_functions - INFO - Early stopping at epoch 600. Best Metrics: (0.00468364617260406, 0.0010483769104458758, 0.0028944140248456937)
2026-06-19 13:32:37,411 - optuna.study.study - INFO - Trial 66 finished with values: [0.00468364617260406, 0.0010483769104458758, 0.0028944140248456937] and parameters: {'n_layers': 2, 'embedding_dim': 96, 'lr': 0.049668402209952216, 'lambda_val': 1.548343517035374e-05, 'batch_size': 2302, 'optimizer': 'RMSprop'}.
2026-06-19 13:33:03,667 - experiment_functions - INFO - Early stopping at epoch 550. Best Metrics: (0.010885975291588237, 0.0024267399267399272, 0.006171902713036972)
2026-06-19 13:33:03,748 - optuna.study.study - INFO - Trial 67 finished with values: [0.010885975291588237, 0.0024267399267399272, 0.006171902713036972] and parameters: {'n_layers': 1, 'embedding_dim': 64, 'lr': 0.04887771788323395, 'lambda_val': 1.0743501993487712e-06, 'batch_size': 3060, 'optimizer': 'Adam'}.
2026-06-19 13:33:28,575 - experiment_functions - INFO - Early stopping at epoch 500. Best Metrics: (0.0004301276562390956, 0.00010420613868889733, 0.000253954558785753)
2026-06-19 13:33:28,671 - optuna.study.study - INFO - Trial 68 finished with values: [0.0004301276562390956, 0.00010420613868889733, 0.000253954558785753] and parameters: {'n_layers': 1, 'embedding_dim': 128, 'lr': 3.3985245100038925e-05, 'lambda_val': 0.0004521907851388952, 'batch_size': 758, 'optimizer': 'SGD'}.
2026-06-19 13:34:09,707 - experiment_functions - INFO - Early stopping at epoch 900. Best Metrics: (0.011275633665893858, 0.0023888467853985093, 0.006527266432196203)
2026-06-19 13:34:09,803 - optuna.study.study - INFO - Trial 69 finished with values: [0.011275633665893858, 0.0023888467853985093, 0.006527266432196203] and parameters: {'n_layers': 2, 'embedding_dim': 32, 'lr': 0.011947726209254472, 'lambda_val': 1.699617647457366e-05, 'batch_size': 2386, 'optimizer': 'RMSprop'}.
2026-06-19 13:37:26,740 - optuna.study.study - INFO - Trial 70 finished with values: [0.023156327436778118, 0.005139257294429708, 0.013316968797414626] and parameters: {'n_layers': 3, 'embedding_dim': 128, 'lr': 0.0002644657037841191, 'lambda_val': 0.003800257613552334, 'batch_size': 1119, 'optimizer': 'RMSprop'}.
2026-06-19 13:40:49,715 - optuna.study.study - INFO - Trial 71 finished with values: [0.002323110236764967, 0.0005905014525704182, 0.0012688825956393016] and parameters: {'n_layers': 4, 'embedding_dim': 128, 'lr': 9.450603015753982e-05, 'lambda_val': 0.00023455253959635695, 'batch_size': 1047, 'optimizer': 'RMSprop'}.
2026-06-19 13:42:06,649 - experiment_functions - INFO - Early stopping at epoch 1550. Best Metrics: (0.013632005586088113, 0.003123026398888468, 0.007656829294454707)
2026-06-19 13:42:06,792 - optuna.study.study - INFO - Trial 72 finished with values: [0.013632005586088113, 0.003123026398888468, 0.007656829294454707] and parameters: {'n_layers': 3, 'embedding_dim': 128, 'lr': 0.0003559424913838149, 'lambda_val': 0.02320659518427928, 'batch_size': 3064, 'optimizer': 'Adam'}.
2026-06-19 13:42:37,705 - experiment_functions - INFO - Early stopping at epoch 650. Best Metrics: (0.00903271484939106, 0.001951496779082986, 0.0050409831079267445)
2026-06-19 13:42:37,823 - optuna.study.study - INFO - Trial 73 finished with values: [0.00903271484939106, 0.001951496779082986, 0.0050409831079267445] and parameters: {'n_layers': 1, 'embedding_dim': 128, 'lr': 0.017830889569464055, 'lambda_val': 0.00034093153914644244, 'batch_size': 3681, 'optimizer': 'RMSprop'}.
2026-06-19 13:44:39,003 - experiment_functions - INFO - Early stopping at epoch 2550. Best Metrics: (0.0297741610083758, 0.006209738537324745, 0.016715601630460295)
2026-06-19 13:44:39,094 - optuna.study.study - INFO - Trial 74 finished with values: [0.0297741610083758, 0.006209738537324745, 0.016715601630460295] and parameters: {'n_layers': 2, 'embedding_dim': 128, 'lr': 0.0007090431996729071, 'lambda_val': 0.00030561828294198225, 'batch_size': 2157, 'optimizer': 'Adam'}.
2026-06-19 13:45:12,184 - experiment_functions - INFO - Early stopping at epoch 500. Best Metrics: (0.0004903483100747011, 0.0001184160666919288, 0.00026782027149637485)
2026-06-19 13:45:12,281 - optuna.study.study - INFO - Trial 75 finished with values: [0.0004903483100747011, 0.0001184160666919288, 0.00026782027149637485] and parameters: {'n_layers': 4, 'embedding_dim': 256, 'lr': 0.03986838889692316, 'lambda_val': 0.009204323959038776, 'batch_size': 2302, 'optimizer': 'SGD'}.
2026-06-19 13:47:15,692 - experiment_functions - INFO - Early stopping at epoch 2400. Best Metrics: (0.011604828695809578, 0.002417266641404572, 0.006381233236129032)
2026-06-19 13:47:15,790 - optuna.study.study - INFO - Trial 76 finished with values: [0.011604828695809578, 0.002417266641404572, 0.006381233236129032] and parameters: {'n_layers': 4, 'embedding_dim': 128, 'lr': 0.004693020881623043, 'lambda_val': 2.7922138388916017e-05, 'batch_size': 2029, 'optimizer': 'RMSprop'}.
2026-06-19 13:50:08,763 - optuna.study.study - INFO - Trial 77 finished with values: [0.02664582553121089, 0.005796071744347607, 0.015600510969187196] and parameters: {'n_layers': 1, 'embedding_dim': 96, 'lr': 0.000582863667130873, 'lambda_val': 0.0015840090449723311, 'batch_size': 2397, 'optimizer': 'Adam'}.
2026-06-19 13:50:42,151 - experiment_functions - INFO - Early stopping at epoch 700. Best Metrics: (0.009196519703462929, 0.0019104458759631176, 0.004985855657486723)
2026-06-19 13:50:42,557 - optuna.study.study - INFO - Trial 78 finished with values: [0.009196519703462929, 0.0019104458759631176, 0.004985855657486723] and parameters: {'n_layers': 2, 'embedding_dim': 96, 'lr': 0.011947726209254472, 'lambda_val': 0.0008323498043954743, 'batch_size': 2615, 'optimizer': 'RMSprop'}.
2026-06-19 13:51:06,552 - experiment_functions - INFO - Early stopping at epoch 500. Best Metrics: (0.0006804174441540196, 0.00012788935202728306, 0.000345368327854581)
2026-06-19 13:51:06,633 - optuna.study.study - INFO - Trial 79 finished with values: [0.0006804174441540196, 0.00012788935202728306, 0.000345368327854581] and parameters: {'n_layers': 1, 'embedding_dim': 128, 'lr': 0.017830889569464055, 'lambda_val': 0.00034093153914644244, 'batch_size': 3681, 'optimizer': 'SGD'}.
2026-06-19 13:51:35,285 - experiment_functions - INFO - Early stopping at epoch 550. Best Metrics: (0.007530739553517921, 0.001746242263483643, 0.004263174574437768)
2026-06-19 13:51:35,391 - optuna.study.study - INFO - Trial 80 finished with values: [0.007530739553517921, 0.001746242263483643, 0.004263174574437768] and parameters: {'n_layers': 1, 'embedding_dim': 256, 'lr': 0.04887771788323395, 'lambda_val': 0.0007135041707086614, 'batch_size': 2003, 'optimizer': 'Adam'}.
2026-06-19 13:51:58,777 - experiment_functions - INFO - Early stopping at epoch 500. Best Metrics: (0.0005659603846410572, 0.00012473159024883163, 0.00032070591976309225)
2026-06-19 13:51:58,870 - optuna.study.study - INFO - Trial 81 finished with values: [0.0005659603846410572, 0.00012473159024883163, 0.00032070591976309225] and parameters: {'n_layers': 1, 'embedding_dim': 96, 'lr': 0.00024097441546115178, 'lambda_val': 0.0005144955748055688, 'batch_size': 1862, 'optimizer': 'SGD'}.
2026-06-19 13:52:54,368 - experiment_functions - INFO - Early stopping at epoch 1250. Best Metrics: (0.02331227270024692, 0.004952949349501074, 0.013286473300069756)
2026-06-19 13:52:54,456 - optuna.study.study - INFO - Trial 82 finished with values: [0.02331227270024692, 0.004952949349501074, 0.013286473300069756] and parameters: {'n_layers': 3, 'embedding_dim': 32, 'lr': 0.0009161309868324035, 'lambda_val': 1.5620108941497448e-05, 'batch_size': 2157, 'optimizer': 'RMSprop'}.
2026-06-19 13:53:25,585 - experiment_functions - INFO - Early stopping at epoch 500. Best Metrics: (0.0005140566691566511, 0.00011367942402425162, 0.0002636764302936707)
2026-06-19 13:53:25,681 - optuna.study.study - INFO - Trial 83 finished with values: [0.0005140566691566511, 0.00011367942402425162, 0.0002636764302936707] and parameters: {'n_layers': 3, 'embedding_dim': 256, 'lr': 1.0424035193184798e-05, 'lambda_val': 0.012670713927028522, 'batch_size': 1813, 'optimizer': 'RMSprop'}.
2026-06-19 13:54:10,672 - experiment_functions - INFO - Early stopping at epoch 1000. Best Metrics: (0.029849363997912746, 0.0061386888973095875, 0.017219246376194118)
2026-06-19 13:54:10,769 - optuna.study.study - INFO - Trial 84 finished with values: [0.029849363997912746, 0.0061386888973095875, 0.017219246376194118] and parameters: {'n_layers': 1, 'embedding_dim': 64, 'lr': 0.0024832825645824267, 'lambda_val': 4.931192721977658e-06, 'batch_size': 3301, 'optimizer': 'Adam'}.
2026-06-19 13:54:40,326 - experiment_functions - INFO - Early stopping at epoch 650. Best Metrics: (0.003767787873624475, 0.0008699633699633701, 0.0022404015485049046)
2026-06-19 13:54:40,423 - optuna.study.study - INFO - Trial 85 finished with values: [0.003767787873624475, 0.0008699633699633701, 0.0022404015485049046] and parameters: {'n_layers': 2, 'embedding_dim': 64, 'lr': 0.049668402209952216, 'lambda_val': 0.0002800804472836813, 'batch_size': 2176, 'optimizer': 'RMSprop'}.
2026-06-19 13:55:05,177 - experiment_functions - INFO - Early stopping at epoch 500. Best Metrics: (0.0005126168285086465, 0.0001231527093596059, 0.0003076475845934283)
2026-06-19 13:55:05,307 - optuna.study.study - INFO - Trial 86 finished with values: [0.0005126168285086465, 0.0001231527093596059, 0.0003076475845934283] and parameters: {'n_layers': 4, 'embedding_dim': 64, 'lr': 0.001312774843566062, 'lambda_val': 1.548343517035374e-05, 'batch_size': 2176, 'optimizer': 'SGD'}.
2026-06-19 13:55:33,217 - experiment_functions - INFO - Early stopping at epoch 600. Best Metrics: (0.011840415741622031, 0.0026256789187823672, 0.0067816553237290125)
2026-06-19 13:55:33,329 - optuna.study.study - INFO - Trial 87 finished with values: [0.011840415741622031, 0.0026256789187823672, 0.0067816553237290125] and parameters: {'n_layers': 1, 'embedding_dim': 96, 'lr': 0.01095245224927096, 'lambda_val': 0.0008949468970728829, 'batch_size': 1222, 'optimizer': 'RMSprop'}.
2026-06-19 13:56:47,359 - experiment_functions - INFO - Early stopping at epoch 1500. Best Metrics: (0.01752026258504389, 0.003702475685234306, 0.009744872116665335)
2026-06-19 13:56:47,454 - optuna.study.study - INFO - Trial 88 finished with values: [0.01752026258504389, 0.003702475685234306, 0.009744872116665335] and parameters: {'n_layers': 1, 'embedding_dim': 256, 'lr': 0.004992205825175868, 'lambda_val': 1.1893676005474623e-05, 'batch_size': 1813, 'optimizer': 'RMSprop'}.
2026-06-19 13:57:13,718 - experiment_functions - INFO - Early stopping at epoch 550. Best Metrics: (0.013476669474853912, 0.0029525072628520904, 0.007701513979990013)
2026-06-19 13:57:13,814 - optuna.study.study - INFO - Trial 89 finished with values: [0.013476669474853912, 0.0029525072628520904, 0.007701513979990013] and parameters: {'n_layers': 2, 'embedding_dim': 64, 'lr': 0.0069364909574124835, 'lambda_val': 2.1880895413355304e-06, 'batch_size': 1262, 'optimizer': 'RMSprop'}.
2026-06-19 14:00:08,817 - optuna.study.study - INFO - Trial 90 finished with values: [0.02200101622991882, 0.00483611216369837, 0.012694661741749092] and parameters: {'n_layers': 4, 'embedding_dim': 32, 'lr': 0.0003559424913838149, 'lambda_val': 1.0669306691822318e-05, 'batch_size': 1978, 'optimizer': 'Adam'}.
2026-06-19 14:00:32,635 - experiment_functions - INFO - Early stopping at epoch 500. Best Metrics: (0.0005581256676341689, 0.00013420487558418593, 0.00031124577025228386)
2026-06-19 14:00:32,733 - optuna.study.study - INFO - Trial 91 finished with values: [0.0005581256676341689, 0.00013420487558418593, 0.00031124577025228386] and parameters: {'n_layers': 2, 'embedding_dim': 64, 'lr': 1.890653847376378e-05, 'lambda_val': 3.837382957190813e-05, 'batch_size': 2800, 'optimizer': 'SGD'}.
2026-06-19 14:01:02,943 - experiment_functions - INFO - Early stopping at epoch 600. Best Metrics: (0.010466944842595324, 0.0021662245800176836, 0.005864414425481695)
2026-06-19 14:01:03,072 - optuna.study.study - INFO - Trial 92 finished with values: [0.010466944842595324, 0.0021662245800176836, 0.005864414425481695] and parameters: {'n_layers': 3, 'embedding_dim': 96, 'lr': 0.011947726209254472, 'lambda_val': 6.625891078039768e-05, 'batch_size': 2159, 'optimizer': 'RMSprop'}.
2026-06-19 14:02:32,986 - experiment_functions - INFO - Early stopping at epoch 1900. Best Metrics: (0.0029760211942178186, 0.0006899709485916383, 0.0017748926814470305)
2026-06-19 14:02:33,089 - optuna.study.study - INFO - Trial 93 finished with values: [0.0029760211942178186, 0.0006899709485916383, 0.0017748926814470305] and parameters: {'n_layers': 3, 'embedding_dim': 96, 'lr': 0.020970653135785035, 'lambda_val': 0.03883038069753175, 'batch_size': 3001, 'optimizer': 'Adam'}.
2026-06-19 14:04:37,373 - experiment_functions - INFO - Early stopping at epoch 2700. Best Metrics: (0.027684681327505626, 0.005917645572817986, 0.015899024774830718)
2026-06-19 14:04:37,467 - optuna.study.study - INFO - Trial 94 finished with values: [0.027684681327505626, 0.005917645572817986, 0.015899024774830718] and parameters: {'n_layers': 2, 'embedding_dim': 96, 'lr': 0.000582863667130873, 'lambda_val': 0.0008240017499392244, 'batch_size': 3133, 'optimizer': 'Adam'}.
2026-06-19 14:05:12,198 - experiment_functions - INFO - Early stopping at epoch 700. Best Metrics: (0.0073796620731034854, 0.0016199317923455854, 0.004040479439612593)
2026-06-19 14:05:12,302 - optuna.study.study - INFO - Trial 95 finished with values: [0.0073796620731034854, 0.0016199317923455854, 0.004040479439612593] and parameters: {'n_layers': 3, 'embedding_dim': 96, 'lr': 0.011900724487277728, 'lambda_val': 0.0008323498043954743, 'batch_size': 2615, 'optimizer': 'RMSprop'}.
2026-06-19 14:05:41,429 - experiment_functions - INFO - Early stopping at epoch 550. Best Metrics: (0.009139196731876313, 0.0019167613995200203, 0.0051877422568189615)
2026-06-19 14:05:41,525 - optuna.study.study - INFO - Trial 96 finished with values: [0.009139196731876313, 0.0019167613995200203, 0.0051877422568189615] and parameters: {'n_layers': 4, 'embedding_dim': 96, 'lr': 0.004693020881623043, 'lambda_val': 0.0001159742696744479, 'batch_size': 3133, 'optimizer': 'RMSprop'}.
2026-06-19 14:06:08,961 - experiment_functions - INFO - Early stopping at epoch 600. Best Metrics: (0.009533537871303989, 0.001976758873310598, 0.005060074005578049)
2026-06-19 14:06:09,051 - optuna.study.study - INFO - Trial 97 finished with values: [0.009533537871303989, 0.001976758873310598, 0.005060074005578049] and parameters: {'n_layers': 3, 'embedding_dim': 32, 'lr': 0.017830889569464055, 'lambda_val': 0.00011634769232475837, 'batch_size': 2098, 'optimizer': 'RMSprop'}.
2026-06-19 14:06:33,735 - experiment_functions - INFO - Early stopping at epoch 500. Best Metrics: (0.000630103219199555, 0.00013578375647341163, 0.000307351035551691)
2026-06-19 14:06:33,830 - optuna.study.study - INFO - Trial 98 finished with values: [0.000630103219199555, 0.00013578375647341163, 0.000307351035551691] and parameters: {'n_layers': 4, 'embedding_dim': 64, 'lr': 0.0029257749541449084, 'lambda_val': 1.101902125761849e-05, 'batch_size': 2176, 'optimizer': 'SGD'}.
2026-06-19 14:06:58,975 - experiment_functions - INFO - Early stopping at epoch 550. Best Metrics: (0.00867829371511903, 0.0020367563471011753, 0.004877290458119593)
2026-06-19 14:06:59,068 - optuna.study.study - INFO - Trial 99 finished with values: [0.00867829371511903, 0.0020367563471011753, 0.004877290458119593] and parameters: {'n_layers': 1, 'embedding_dim': 64, 'lr': 0.04887771788323395, 'lambda_val': 3.736362199207782e-06, 'batch_size': 1539, 'optimizer': 'Adam'}.
2026-06-19 14:07:40,013 - experiment_functions - INFO - Early stopping at epoch 900. Best Metrics: (0.015712342413904908, 0.0032809144878110396, 0.0087139184407537)
2026-06-19 14:07:40,510 - optuna.study.study - INFO - Trial 100 finished with values: [0.015712342413904908, 0.0032809144878110396, 0.0087139184407537] and parameters: {'n_layers': 1, 'embedding_dim': 96, 'lr': 0.004815452060543289, 'lambda_val': 0.0008323498043954743, 'batch_size': 2615, 'optimizer': 'RMSprop'}.
2026-06-19 14:08:09,052 - experiment_functions - INFO - Early stopping at epoch 600. Best Metrics: (0.013225879206444115, 0.0028072502210433246, 0.007683425161625454)
2026-06-19 14:08:09,138 - optuna.study.study - INFO - Trial 101 finished with values: [0.013225879206444115, 0.0028072502210433246, 0.007683425161625454] and parameters: {'n_layers': 1, 'embedding_dim': 96, 'lr': 0.012350234994911325, 'lambda_val': 1.101902125761849e-05, 'batch_size': 1813, 'optimizer': 'RMSprop'}.
2026-06-19 14:08:45,878 - experiment_functions - INFO - Early stopping at epoch 800. Best Metrics: (0.023850360583915056, 0.0053239863584691165, 0.013393532764807384)
2026-06-19 14:08:45,977 - optuna.study.study - INFO - Trial 102 finished with values: [0.023850360583915056, 0.0053239863584691165, 0.013393532764807384] and parameters: {'n_layers': 1, 'embedding_dim': 96, 'lr': 0.0024832825645824267, 'lambda_val': 0.0065411411931329995, 'batch_size': 2397, 'optimizer': 'Adam'}.
2026-06-19 14:10:10,860 - experiment_functions - INFO - Early stopping at epoch 1700. Best Metrics: (0.012006142728910095, 0.002458317544524441, 0.006777064225177662)
2026-06-19 14:10:10,947 - optuna.study.study - INFO - Trial 103 finished with values: [0.012006142728910095, 0.002458317544524441, 0.006777064225177662] and parameters: {'n_layers': 3, 'embedding_dim': 128, 'lr': 0.008580601632438008, 'lambda_val': 1.5644979775118323e-06, 'batch_size': 3151, 'optimizer': 'RMSprop'}.
