2026-06-21 04:55:25,856 - optuna.study.study - INFO - Trial 30 finished with values: [0.0003303203531910646, 8.525956801818871e-05, 0.00018945605235065363] and parameters: {'n_layers': 1, 'embedding_dim': 128, 'lr': 3.517304832801416e-05, 'lambda_val': 9.626598276217432e-06, 'batch_size': 3975, 'optimizer': 'SGD'}.
2026-06-21 04:57:46,800 - experiment_functions - INFO - Early stopping at epoch 3300. Best Metrics: (0.012164412221146292, 0.0030030314513073138, 0.007688962318550477)
2026-06-21 04:57:47,160 - optuna.study.study - INFO - Trial 31 finished with values: [0.012164412221146292, 0.0030030314513073138, 0.007688962318550477] and parameters: {'n_layers': 4, 'embedding_dim': 64, 'lr': 0.0005491151006472304, 'lambda_val': 7.163252275100761e-05, 'batch_size': 2490, 'optimizer': 'RMSprop'}.
2026-06-21 04:58:11,047 - experiment_functions - INFO - Early stopping at epoch 500. Best Metrics: (0.00042643451313735325, 0.00010736390046734875, 0.0002478117665865111)
2026-06-21 04:58:11,167 - optuna.study.study - INFO - Trial 32 finished with values: [0.00042643451313735325, 0.00010736390046734875, 0.0002478117665865111] and parameters: {'n_layers': 1, 'embedding_dim': 256, 'lr': 0.03149642414026303, 'lambda_val': 3.136530960148161e-05, 'batch_size': 1153, 'optimizer': 'SGD'}.
2026-06-21 04:58:45,017 - experiment_functions - INFO - Early stopping at epoch 750. Best Metrics: (0.0003688802395948938, 0.00010104837691044589, 0.00018360451155789893)
2026-06-21 04:58:45,450 - optuna.study.study - INFO - Trial 33 finished with values: [0.0003688802395948938, 0.00010104837691044589, 0.00018360451155789893] and parameters: {'n_layers': 2, 'embedding_dim': 128, 'lr': 0.04149153107208416, 'lambda_val': 1.0843584628269625e-05, 'batch_size': 3742, 'optimizer': 'SGD'}.
2026-06-21 05:01:20,994 - optuna.study.study - INFO - Trial 34 finished with values: [0.0008468264345232983, 0.00020525451559934318, 0.00048212927820363074] and parameters: {'n_layers': 2, 'embedding_dim': 32, 'lr': 8.473538078564852e-05, 'lambda_val': 0.00036810793179519125, 'batch_size': 1815, 'optimizer': 'RMSprop'}.
2026-06-21 05:01:52,510 - experiment_functions - INFO - Early stopping at epoch 650. Best Metrics: (0.008705040434082097, 0.0021709612226853605, 0.005149167708564011)
2026-06-21 05:01:52,607 - optuna.study.study - INFO - Trial 35 finished with values: [0.008705040434082097, 0.0021709612226853605, 0.005149167708564011] and parameters: {'n_layers': 3, 'embedding_dim': 128, 'lr': 0.0023805186554224675, 'lambda_val': 0.0012040212538103386, 'batch_size': 1024, 'optimizer': 'RMSprop'}.
2026-06-21 05:02:16,529 - experiment_functions - INFO - Early stopping at epoch 500. Best Metrics: (0.0005089780096302145, 0.00010894278135657447, 0.0002887247287942679)
2026-06-21 05:02:16,636 - optuna.study.study - INFO - Trial 36 finished with values: [0.0005089780096302145, 0.00010894278135657447, 0.0002887247287942679] and parameters: {'n_layers': 1, 'embedding_dim': 256, 'lr': 0.014933490983274211, 'lambda_val': 0.0007100010270708803, 'batch_size': 1541, 'optimizer': 'SGD'}.
2026-06-21 05:02:39,703 - experiment_functions - INFO - Early stopping at epoch 500. Best Metrics: (0.0005151721831663913, 0.00010894278135657448, 0.00023475028888682726)
2026-06-21 05:02:39,819 - optuna.study.study - INFO - Trial 37 finished with values: [0.0005151721831663913, 0.00010894278135657448, 0.00023475028888682726] and parameters: {'n_layers': 2, 'embedding_dim': 96, 'lr': 0.0013535078076070944, 'lambda_val': 6.399613991172046e-05, 'batch_size': 3832, 'optimizer': 'SGD'}.
2026-06-21 05:04:25,387 - experiment_functions - INFO - Early stopping at epoch 2350. Best Metrics: (0.002648516717913728, 0.0007152330428192497, 0.0015794808934879014)
2026-06-21 05:04:25,701 - optuna.study.study - INFO - Trial 38 finished with values: [0.002648516717913728, 0.0007152330428192497, 0.0015794808934879014] and parameters: {'n_layers': 1, 'embedding_dim': 256, 'lr': 0.045448234415163005, 'lambda_val': 0.0776270954867753, 'batch_size': 3604, 'optimizer': 'RMSprop'}.
2026-06-21 05:05:03,968 - experiment_functions - INFO - Early stopping at epoch 700. Best Metrics: (0.000609406863062077, 0.00012946823291650877, 0.0003183386496401077)
2026-06-21 05:05:04,071 - optuna.study.study - INFO - Trial 39 finished with values: [0.000609406863062077, 0.00012946823291650877, 0.0003183386496401077] and parameters: {'n_layers': 3, 'embedding_dim': 256, 'lr': 1.3240552827243354e-05, 'lambda_val': 0.061457762751823845, 'batch_size': 3555, 'optimizer': 'Adam'}.
2026-06-21 05:07:44,817 - optuna.study.study - INFO - Trial 40 finished with values: [0.011332174824522858, 0.0026777819881268162, 0.006945798616615333] and parameters: {'n_layers': 3, 'embedding_dim': 32, 'lr': 0.0013154801669818224, 'lambda_val': 1.1500391390523163e-06, 'batch_size': 635, 'optimizer': 'Adam'}.
2026-06-21 05:08:08,116 - experiment_functions - INFO - Early stopping at epoch 550. Best Metrics: (0.0005066620695834381, 0.0001278893520272831, 0.0002648704837204733)
2026-06-21 05:08:08,221 - optuna.study.study - INFO - Trial 41 finished with values: [0.0005066620695834381, 0.0001278893520272831, 0.0002648704837204733] and parameters: {'n_layers': 1, 'embedding_dim': 32, 'lr': 0.019506469469380183, 'lambda_val': 0.0012403436191834533, 'batch_size': 2523, 'optimizer': 'SGD'}.
2026-06-21 05:08:30,592 - experiment_functions - INFO - Early stopping at epoch 500. Best Metrics: (0.000626157217787361, 0.00012473159024883163, 0.00032226035101262917)
2026-06-21 05:08:30,702 - optuna.study.study - INFO - Trial 42 finished with values: [0.000626157217787361, 0.00012473159024883163, 0.00032226035101262917] and parameters: {'n_layers': 2, 'embedding_dim': 96, 'lr': 1.2533302797877184e-05, 'lambda_val': 0.0007463607951250979, 'batch_size': 1005, 'optimizer': 'SGD'}.
2026-06-21 05:08:52,234 - experiment_functions - INFO - Early stopping at epoch 500. Best Metrics: (0.000535837962633895, 0.00010894278135657447, 0.0002769113842547484)
2026-06-21 05:08:52,353 - optuna.study.study - INFO - Trial 43 finished with values: [0.000535837962633895, 0.00010894278135657447, 0.0002769113842547484] and parameters: {'n_layers': 1, 'embedding_dim': 32, 'lr': 0.001257180772970837, 'lambda_val': 0.00011660418755012434, 'batch_size': 2713, 'optimizer': 'SGD'}.
2026-06-21 05:11:29,179 - optuna.study.study - INFO - Trial 44 finished with values: [0.008699526719769382, 0.0020620184413287865, 0.005440494908010642] and parameters: {'n_layers': 2, 'embedding_dim': 32, 'lr': 0.0010929472603386809, 'lambda_val': 0.0013171013233585188, 'batch_size': 1042, 'optimizer': 'RMSprop'}.
2026-06-21 05:11:54,791 - experiment_functions - INFO - Early stopping at epoch 550. Best Metrics: (0.006884136540346825, 0.001735190097259063, 0.004149695736728948)
2026-06-21 05:11:54,900 - optuna.study.study - INFO - Trial 45 finished with values: [0.006884136540346825, 0.001735190097259063, 0.004149695736728948] and parameters: {'n_layers': 4, 'embedding_dim': 64, 'lr': 0.01809104682856791, 'lambda_val': 2.8562288796614426e-05, 'batch_size': 2581, 'optimizer': 'Adam'}.
2026-06-21 05:12:18,158 - experiment_functions - INFO - Early stopping at epoch 500. Best Metrics: (0.00047902907616712644, 0.00012788935202728306, 0.00027662263736557885)
2026-06-21 05:12:18,265 - optuna.study.study - INFO - Trial 46 finished with values: [0.00047902907616712644, 0.00012788935202728306, 0.00027662263736557885] and parameters: {'n_layers': 4, 'embedding_dim': 64, 'lr': 0.0016943251856798127, 'lambda_val': 0.06487624738630651, 'batch_size': 3243, 'optimizer': 'SGD'}.
2026-06-21 05:13:01,503 - experiment_functions - INFO - Early stopping at epoch 850. Best Metrics: (0.005561040843868914, 0.001360995326512568, 0.0031526176767680135)
2026-06-21 05:13:01,611 - optuna.study.study - INFO - Trial 47 finished with values: [0.005561040843868914, 0.001360995326512568, 0.0031526176767680135] and parameters: {'n_layers': 2, 'embedding_dim': 256, 'lr': 0.0035410358945148815, 'lambda_val': 0.00029794264644292603, 'batch_size': 3325, 'optimizer': 'Adam'}.
2026-06-21 05:13:31,570 - experiment_functions - INFO - Early stopping at epoch 550. Best Metrics: (0.005496056026689316, 0.0013309965896172791, 0.0033617534894830555)
2026-06-21 05:13:31,676 - optuna.study.study - INFO - Trial 48 finished with values: [0.005496056026689316, 0.0013309965896172791, 0.0033617534894830555] and parameters: {'n_layers': 3, 'embedding_dim': 64, 'lr': 0.019905251855320705, 'lambda_val': 0.00044247956015671964, 'batch_size': 1462, 'optimizer': 'Adam'}.
2026-06-21 05:14:32,628 - experiment_functions - INFO - Early stopping at epoch 1400. Best Metrics: (0.0005508122281345043, 0.00013262599469496023, 0.0003255362759404678)
2026-06-21 05:14:32,845 - optuna.study.study - INFO - Trial 49 finished with values: [0.0005508122281345043, 0.00013262599469496023, 0.0003255362759404678] and parameters: {'n_layers': 3, 'embedding_dim': 96, 'lr': 1.6987621407859473e-05, 'lambda_val': 1.3531871620615068e-05, 'batch_size': 1004, 'optimizer': 'Adam'}.
2026-06-21 05:15:38,730 - experiment_functions - INFO - Early stopping at epoch 1250. Best Metrics: (0.0068106384151057, 0.0018093974990526713, 0.004025123111127383)
2026-06-21 05:15:38,880 - optuna.study.study - INFO - Trial 50 finished with values: [0.0068106384151057, 0.0018093974990526713, 0.004025123111127383] and parameters: {'n_layers': 3, 'embedding_dim': 256, 'lr': 0.0005491151006472304, 'lambda_val': 0.00518549080589865, 'batch_size': 2490, 'optimizer': 'RMSprop'}.
2026-06-21 05:16:59,982 - experiment_functions - INFO - Early stopping at epoch 2000. Best Metrics: (0.0034479977233207414, 0.0008699633699633699, 0.0019977490219954003)
2026-06-21 05:17:00,194 - optuna.study.study - INFO - Trial 51 finished with values: [0.0034479977233207414, 0.0008699633699633699, 0.0019977490219954003] and parameters: {'n_layers': 1, 'embedding_dim': 96, 'lr': 0.045448234415163005, 'lambda_val': 0.0007463607951250979, 'batch_size': 1378, 'optimizer': 'RMSprop'}.
2026-06-21 05:19:37,839 - optuna.study.study - INFO - Trial 52 finished with values: [0.0008569959296698821, 0.00016894025514715172, 0.00047609542612712377] and parameters: {'n_layers': 3, 'embedding_dim': 32, 'lr': 3.0285323139714177e-05, 'lambda_val': 9.626598276217432e-06, 'batch_size': 3884, 'optimizer': 'Adam'}.
2026-06-21 05:20:03,205 - experiment_functions - INFO - Early stopping at epoch 600. Best Metrics: (0.0035115846327442536, 0.0007657572312744728, 0.0021273722075054657)
2026-06-21 05:20:03,305 - optuna.study.study - INFO - Trial 53 finished with values: [0.0035115846327442536, 0.0007657572312744728, 0.0021273722075054657] and parameters: {'n_layers': 1, 'embedding_dim': 32, 'lr': 0.011336770986550308, 'lambda_val': 0.00036810793179519125, 'batch_size': 1815, 'optimizer': 'Adam'}.
2026-06-21 05:23:42,073 - optuna.study.study - INFO - Trial 54 finished with values: [0.00921384123580121, 0.0022656940760389034, 0.005693871778648325] and parameters: {'n_layers': 4, 'embedding_dim': 256, 'lr': 0.00035236392400285417, 'lambda_val': 0.0003995223661719565, 'batch_size': 1204, 'optimizer': 'Adam'}.
2026-06-21 05:24:04,002 - experiment_functions - INFO - Early stopping at epoch 500. Best Metrics: (0.0005942120645046595, 0.0001152583049134773, 0.0002859482475818257)
2026-06-21 05:24:04,111 - optuna.study.study - INFO - Trial 55 finished with values: [0.0005942120645046595, 0.0001152583049134773, 0.0002859482475818257] and parameters: {'n_layers': 2, 'embedding_dim': 32, 'lr': 0.00013503577039836358, 'lambda_val': 1.465244173453917e-05, 'batch_size': 2653, 'optimizer': 'SGD'}.
2026-06-21 05:24:28,955 - experiment_functions - INFO - Early stopping at epoch 500. Best Metrics: (0.0004317896657441171, 9.473285335354301e-05, 0.0002445838991658966)
2026-06-21 05:24:29,062 - optuna.study.study - INFO - Trial 56 finished with values: [0.0004317896657441171, 9.473285335354301e-05, 0.0002445838991658966] and parameters: {'n_layers': 4, 'embedding_dim': 128, 'lr': 0.0005057243861690739, 'lambda_val': 7.163252275100761e-05, 'batch_size': 1924, 'optimizer': 'SGD'}.
2026-06-21 05:25:09,555 - experiment_functions - INFO - Early stopping at epoch 700. Best Metrics: (0.0063230536982714506, 0.0015978274598964254, 0.0037007807783901183)
2026-06-21 05:25:09,665 - optuna.study.study - INFO - Trial 57 finished with values: [0.0063230536982714506, 0.0015978274598964254, 0.0037007807783901183] and parameters: {'n_layers': 4, 'embedding_dim': 256, 'lr': 0.0013154801669818224, 'lambda_val': 0.009524830173270039, 'batch_size': 3983, 'optimizer': 'Adam'}.
2026-06-21 05:25:31,401 - experiment_functions - INFO - Early stopping at epoch 500. Best Metrics: (0.0004888032284898133, 0.00012157382847038021, 0.00027919798501809434)
2026-06-21 05:25:31,505 - optuna.study.study - INFO - Trial 58 finished with values: [0.0004888032284898133, 0.00012157382847038021, 0.00027919798501809434] and parameters: {'n_layers': 1, 'embedding_dim': 64, 'lr': 0.0005833059494809122, 'lambda_val': 0.00518549080589865, 'batch_size': 2801, 'optimizer': 'SGD'}.
2026-06-21 05:25:54,715 - experiment_functions - INFO - Early stopping at epoch 500. Best Metrics: (0.00048567667864247765, 0.00011525830491347732, 0.0002536439379481111)
2026-06-21 05:25:54,875 - optuna.study.study - INFO - Trial 59 finished with values: [0.00048567667864247765, 0.00011525830491347732, 0.0002536439379481111] and parameters: {'n_layers': 4, 'embedding_dim': 64, 'lr': 0.01649421420978625, 'lambda_val': 0.06487624738630651, 'batch_size': 1721, 'optimizer': 'SGD'}.
2026-06-21 05:26:37,114 - experiment_functions - INFO - Early stopping at epoch 1000. Best Metrics: (0.0030956084575067357, 0.0007231274472653782, 0.0019905825387724497)
2026-06-21 05:26:37,247 - optuna.study.study - INFO - Trial 60 finished with values: [0.0030956084575067357, 0.0007231274472653782, 0.0019905825387724497] and parameters: {'n_layers': 2, 'embedding_dim': 64, 'lr': 0.07294118006318792, 'lambda_val': 1.066568166630351e-06, 'batch_size': 2856, 'optimizer': 'RMSprop'}.
2026-06-21 05:27:02,682 - experiment_functions - INFO - Early stopping at epoch 550. Best Metrics: (0.0038402813087611413, 0.0009315397246431729, 0.0024251418658627296)
2026-06-21 05:27:02,829 - optuna.study.study - INFO - Trial 61 finished with values: [0.0038402813087611413, 0.0009315397246431729, 0.0024251418658627296] and parameters: {'n_layers': 2, 'embedding_dim': 96, 'lr': 0.01090856583081859, 'lambda_val': 0.004562972374668912, 'batch_size': 3736, 'optimizer': 'Adam'}.
2026-06-21 05:27:45,417 - experiment_functions - INFO - Early stopping at epoch 850. Best Metrics: (0.003843236430054173, 0.0010120626499936845, 0.002202506873390247)
2026-06-21 05:27:45,522 - optuna.study.study - INFO - Trial 62 finished with values: [0.003843236430054173, 0.0010120626499936845, 0.002202506873390247] and parameters: {'n_layers': 2, 'embedding_dim': 256, 'lr': 0.0010929472603386809, 'lambda_val': 0.07611756008508126, 'batch_size': 3252, 'optimizer': 'RMSprop'}.
2026-06-21 05:28:07,619 - experiment_functions - INFO - Early stopping at epoch 500. Best Metrics: (0.0004990989739454548, 0.00010578501957812304, 0.0002760168224093061)
2026-06-21 05:28:07,722 - optuna.study.study - INFO - Trial 63 finished with values: [0.0004990989739454548, 0.00010578501957812304, 0.0002760168224093061] and parameters: {'n_layers': 3, 'embedding_dim': 32, 'lr': 0.0013367871012247433, 'lambda_val': 0.0846423345395031, 'batch_size': 2500, 'optimizer': 'SGD'}.
2026-06-21 05:28:36,525 - experiment_functions - INFO - Early stopping at epoch 550. Best Metrics: (0.003812115763818247, 0.0009836427939876216, 0.0022827076888057686)
2026-06-21 05:28:36,632 - optuna.study.study - INFO - Trial 64 finished with values: [0.003812115763818247, 0.0009836427939876216, 0.0022827076888057686] and parameters: {'n_layers': 2, 'embedding_dim': 256, 'lr': 0.01649421420978625, 'lambda_val': 0.00036810793179519125, 'batch_size': 1721, 'optimizer': 'RMSprop'}.
2026-06-21 05:31:18,002 - optuna.study.study - INFO - Trial 65 finished with values: [0.0032129337957524803, 0.0007057597574838954, 0.001961166362214484] and parameters: {'n_layers': 1, 'embedding_dim': 96, 'lr': 0.0005979572889171791, 'lambda_val': 7.876464964197065e-06, 'batch_size': 745, 'optimizer': 'Adam'}.
2026-06-21 05:34:06,752 - optuna.study.study - INFO - Trial 66 finished with values: [0.004428484335459616, 0.0010610079575596818, 0.002691525718977646] and parameters: {'n_layers': 4, 'embedding_dim': 64, 'lr': 0.00020716276364902874, 'lambda_val': 2.8562288796614426e-05, 'batch_size': 2581, 'optimizer': 'Adam'}.
2026-06-21 05:35:23,458 - experiment_functions - INFO - Early stopping at epoch 1750. Best Metrics: (0.009867422519242499, 0.0024504231400783124, 0.006037538071874749)
2026-06-21 05:35:23,564 - optuna.study.study - INFO - Trial 67 finished with values: [0.009867422519242499, 0.0024504231400783124, 0.006037538071874749] and parameters: {'n_layers': 3, 'embedding_dim': 96, 'lr': 0.0014018982084487695, 'lambda_val': 0.00044247956015671964, 'batch_size': 745, 'optimizer': 'Adam'}.
2026-06-21 05:35:45,999 - experiment_functions - INFO - Early stopping at epoch 500. Best Metrics: (0.000572433725173446, 0.00012631047113805733, 0.00031477528450637874)
2026-06-21 05:35:46,100 - optuna.study.study - INFO - Trial 68 finished with values: [0.000572433725173446, 0.00012631047113805733, 0.00031477528450637874] and parameters: {'n_layers': 2, 'embedding_dim': 64, 'lr': 0.04149153107208416, 'lambda_val': 1.0843584628269625e-05, 'batch_size': 3742, 'optimizer': 'SGD'}.
2026-06-21 05:37:05,868 - experiment_functions - INFO - Early stopping at epoch 1900. Best Metrics: (0.009369821642120428, 0.0023904256662877353, 0.005790614308296456)
2026-06-21 05:37:06,016 - optuna.study.study - INFO - Trial 69 finished with values: [0.009369821642120428, 0.0023904256662877353, 0.005790614308296456] and parameters: {'n_layers': 3, 'embedding_dim': 64, 'lr': 0.0014018982084487695, 'lambda_val': 0.0018148423298626976, 'batch_size': 745, 'optimizer': 'Adam'}.
2026-06-21 05:38:13,703 - experiment_functions - INFO - Early stopping at epoch 1650. Best Metrics: (0.01032725792911911, 0.002505683971201212, 0.006281894550250815)
2026-06-21 05:38:13,819 - optuna.study.study - INFO - Trial 70 finished with values: [0.01032725792911911, 0.002505683971201212, 0.006281894550250815] and parameters: {'n_layers': 3, 'embedding_dim': 32, 'lr': 0.002375796180711879, 'lambda_val': 1.1500391390523163e-06, 'batch_size': 635, 'optimizer': 'Adam'}.
2026-06-21 05:39:13,480 - experiment_functions - INFO - Early stopping at epoch 1350. Best Metrics: (0.009604566346124636, 0.0023777946191739295, 0.005839519407576367)
2026-06-21 05:39:13,590 - optuna.study.study - INFO - Trial 71 finished with values: [0.009604566346124636, 0.0023777946191739295, 0.005839519407576367] and parameters: {'n_layers': 3, 'embedding_dim': 96, 'lr': 0.0016838259888467748, 'lambda_val': 2.2595071410094373e-06, 'batch_size': 1037, 'optimizer': 'Adam'}.
2026-06-21 05:39:35,291 - experiment_functions - INFO - Early stopping at epoch 500. Best Metrics: (0.0004169440308790139, 0.0001042061386888973, 0.0002481484172125904)
2026-06-21 05:39:35,391 - optuna.study.study - INFO - Trial 72 finished with values: [0.0004169440308790139, 0.0001042061386888973, 0.0002481484172125904] and parameters: {'n_layers': 1, 'embedding_dim': 32, 'lr': 1.0234659635836661e-05, 'lambda_val': 1.1881846107033085e-05, 'batch_size': 3083, 'optimizer': 'SGD'}.
2026-06-21 05:41:10,377 - experiment_functions - INFO - Early stopping at epoch 2350. Best Metrics: (0.0004888518282407171, 0.0001105216622458002, 0.00026354206368526764)
2026-06-21 05:41:10,476 - optuna.study.study - INFO - Trial 73 finished with values: [0.0004888518282407171, 0.0001105216622458002, 0.00026354206368526764] and parameters: {'n_layers': 2, 'embedding_dim': 64, 'lr': 1.7451013865436417e-05, 'lambda_val': 8.006464807509142e-06, 'batch_size': 2998, 'optimizer': 'RMSprop'}.
2026-06-21 05:42:51,227 - experiment_functions - INFO - Early stopping at epoch 1950. Best Metrics: (0.010530045407602119, 0.0026904130352406216, 0.0065468004492402)
2026-06-21 05:42:51,329 - optuna.study.study - INFO - Trial 74 finished with values: [0.010530045407602119, 0.0026904130352406216, 0.0065468004492402] and parameters: {'n_layers': 3, 'embedding_dim': 256, 'lr': 0.0008519094805065798, 'lambda_val': 2.7545357777694106e-05, 'batch_size': 940, 'optimizer': 'RMSprop'}.
2026-06-21 05:43:14,669 - experiment_functions - INFO - Early stopping at epoch 500. Best Metrics: (0.0006110800538950565, 0.0001373626373626374, 0.0003600060886709144)
2026-06-21 05:43:14,778 - optuna.study.study - INFO - Trial 75 finished with values: [0.0006110800538950565, 0.0001373626373626374, 0.0003600060886709144] and parameters: {'n_layers': 3, 'embedding_dim': 96, 'lr': 0.0016838259888467748, 'lambda_val': 2.2595071410094373e-06, 'batch_size': 2370, 'optimizer': 'SGD'}.
2026-06-21 05:43:37,050 - experiment_functions - INFO - Early stopping at epoch 500. Best Metrics: (0.0004507636669132153, 0.00011525830491347733, 0.0002617298117918977)
2026-06-21 05:43:37,159 - optuna.study.study - INFO - Trial 76 finished with values: [0.0004507636669132153, 0.00011525830491347733, 0.0002617298117918977] and parameters: {'n_layers': 1, 'embedding_dim': 96, 'lr': 0.01090856583081859, 'lambda_val': 0.0003995223661719565, 'batch_size': 3537, 'optimizer': 'SGD'}.
2026-06-21 05:45:51,197 - experiment_functions - INFO - Early stopping at epoch 3200. Best Metrics: (0.0007440361289729701, 0.00015788808892257172, 0.0003847250303288865)
