2026-06-21 01:10:59,377 - optuna.study.study - INFO - Trial 183 finished with values: [0.007213533746652254, 0.001891499305292409, 0.00429863954470195] and parameters: {'n_layers': 3, 'embedding_dim': 96, 'lr': 0.0035879353384560956, 'lambda_val': 1.282312052161098e-05, 'batch_size': 2119, 'optimizer': 'RMSprop'}.
2026-06-21 01:13:53,022 - optuna.study.study - INFO - Trial 184 finished with values: [0.008586631575212555, 0.0021456991284577493, 0.00549767999891056] and parameters: {'n_layers': 3, 'embedding_dim': 96, 'lr': 0.0006460981719089114, 'lambda_val': 5.82846385984691e-05, 'batch_size': 777, 'optimizer': 'Adam'}.
2026-06-21 01:14:17,303 - experiment_functions - INFO - Early stopping at epoch 500. Best Metrics: (0.00041841165417240374, 0.00010578501957812304, 0.00026379345424031047)
2026-06-21 01:14:17,406 - optuna.study.study - INFO - Trial 185 finished with values: [0.00041841165417240374, 0.00010578501957812304, 0.00026379345424031047] and parameters: {'n_layers': 4, 'embedding_dim': 96, 'lr': 0.0004974729077493578, 'lambda_val': 2.8861183398799558e-06, 'batch_size': 3029, 'optimizer': 'SGD'}.
2026-06-21 01:14:49,633 - experiment_functions - INFO - Early stopping at epoch 700. Best Metrics: (0.008662684586614327, 0.0022056966022483268, 0.005377942056455995)
2026-06-21 01:14:49,749 - optuna.study.study - INFO - Trial 186 finished with values: [0.008662684586614327, 0.0022056966022483268, 0.005377942056455995] and parameters: {'n_layers': 4, 'embedding_dim': 64, 'lr': 0.0031134216844272773, 'lambda_val': 0.0017226178103252388, 'batch_size': 1653, 'optimizer': 'Adam'}.
2026-06-21 01:17:56,253 - optuna.study.study - INFO - Trial 187 finished with values: [0.010136864928420758, 0.0025072628520904387, 0.006340470223223165] and parameters: {'n_layers': 4, 'embedding_dim': 128, 'lr': 0.00043327912311372766, 'lambda_val': 3.9553958515555e-06, 'batch_size': 1285, 'optimizer': 'Adam'}.
2026-06-21 01:20:06,912 - experiment_functions - INFO - Early stopping at epoch 3250. Best Metrics: (0.005925072651604161, 0.0013467853985095367, 0.0036723067544309485)
2026-06-21 01:20:07,015 - optuna.study.study - INFO - Trial 188 finished with values: [0.005925072651604161, 0.0013467853985095367, 0.0036723067544309485] and parameters: {'n_layers': 1, 'embedding_dim': 64, 'lr': 0.0014825795247409024, 'lambda_val': 2.2580566177048725e-06, 'batch_size': 777, 'optimizer': 'RMSprop'}.
2026-06-21 01:22:00,340 - experiment_functions - INFO - Early stopping at epoch 2500. Best Metrics: (0.0006618972314635257, 0.00013420487558418593, 0.0003437371741398131)
2026-06-21 01:22:00,445 - optuna.study.study - INFO - Trial 189 finished with values: [0.0006618972314635257, 0.00013420487558418593, 0.0003437371741398131] and parameters: {'n_layers': 3, 'embedding_dim': 128, 'lr': 3.5810332689353914e-05, 'lambda_val': 0.0017226178103252388, 'batch_size': 3029, 'optimizer': 'Adam'}.
2026-06-21 01:22:40,795 - experiment_functions - INFO - Early stopping at epoch 900. Best Metrics: (0.008546514755829992, 0.0021488568902362005, 0.005251812339591045)
2026-06-21 01:22:40,904 - optuna.study.study - INFO - Trial 190 finished with values: [0.008546514755829992, 0.0021488568902362005, 0.005251812339591045] and parameters: {'n_layers': 3, 'embedding_dim': 64, 'lr': 0.0024637268572947537, 'lambda_val': 2.0807360556667617e-05, 'batch_size': 2119, 'optimizer': 'Adam'}.
2026-06-21 01:23:15,082 - experiment_functions - INFO - Early stopping at epoch 700. Best Metrics: (0.007750814643704144, 0.0019830743968675003, 0.004616704525870023)
2026-06-21 01:23:15,536 - optuna.study.study - INFO - Trial 191 finished with values: [0.007750814643704144, 0.0019830743968675003, 0.004616704525870023] and parameters: {'n_layers': 3, 'embedding_dim': 128, 'lr': 0.0031134216844272773, 'lambda_val': 3.9553958515555e-06, 'batch_size': 1902, 'optimizer': 'RMSprop'}.
2026-06-21 01:25:17,422 - experiment_functions - INFO - Early stopping at epoch 2650. Best Metrics: (0.010559575251246567, 0.002538840469874953, 0.006207832006493896)
2026-06-21 01:25:17,524 - optuna.study.study - INFO - Trial 192 finished with values: [0.010559575251246567, 0.002538840469874953, 0.006207832006493896] and parameters: {'n_layers': 4, 'embedding_dim': 96, 'lr': 0.0006101961971381852, 'lambda_val': 2.0807360556667617e-05, 'batch_size': 2119, 'optimizer': 'Adam'}.
2026-06-21 01:28:00,018 - optuna.study.study - INFO - Trial 193 finished with values: [0.008534104237263656, 0.002035177466211949, 0.0054986894662459205] and parameters: {'n_layers': 3, 'embedding_dim': 32, 'lr': 0.0006101961971381852, 'lambda_val': 2.0807360556667617e-05, 'batch_size': 1788, 'optimizer': 'Adam'}.
2026-06-21 01:29:14,116 - experiment_functions - INFO - Early stopping at epoch 1300. Best Metrics: (0.01023894027049747, 0.0026177845143362387, 0.006102436738676484)
2026-06-21 01:29:14,265 - optuna.study.study - INFO - Trial 194 finished with values: [0.01023894027049747, 0.0026177845143362387, 0.006102436738676484] and parameters: {'n_layers': 4, 'embedding_dim': 256, 'lr': 0.0006101961971381852, 'lambda_val': 2.4259773382665532e-05, 'batch_size': 2119, 'optimizer': 'RMSprop'}.
2026-06-21 01:32:00,970 - optuna.study.study - INFO - Trial 195 finished with values: [0.011057313540440717, 0.0026856763925729443, 0.006723596450667442] and parameters: {'n_layers': 4, 'embedding_dim': 32, 'lr': 0.0006460981719089114, 'lambda_val': 5.82846385984691e-05, 'batch_size': 1203, 'optimizer': 'Adam'}.
2026-06-21 01:32:41,276 - experiment_functions - INFO - Early stopping at epoch 900. Best Metrics: (0.009849534327158172, 0.0024472653782998616, 0.006130906029953712)
2026-06-21 01:32:41,644 - optuna.study.study - INFO - Trial 196 finished with values: [0.009849534327158172, 0.0024472653782998616, 0.006130906029953712] and parameters: {'n_layers': 3, 'embedding_dim': 64, 'lr': 0.0031134216844272773, 'lambda_val': 3.9553958515555e-06, 'batch_size': 923, 'optimizer': 'Adam'}.
2026-06-21 01:33:37,059 - experiment_functions - INFO - Early stopping at epoch 1250. Best Metrics: (0.006453970959886103, 0.0017194012883668057, 0.004001995951701377)
2026-06-21 01:33:37,163 - optuna.study.study - INFO - Trial 197 finished with values: [0.006453970959886103, 0.0017194012883668057, 0.004001995951701377] and parameters: {'n_layers': 3, 'embedding_dim': 96, 'lr': 0.0006604859729474348, 'lambda_val': 0.013339360902303529, 'batch_size': 3901, 'optimizer': 'Adam'}.
2026-06-21 01:34:12,205 - experiment_functions - INFO - Early stopping at epoch 600. Best Metrics: (0.0064565602871424, 0.0017383478590375142, 0.003967018626618661)
2026-06-21 01:34:12,436 - optuna.study.study - INFO - Trial 198 finished with values: [0.0064565602871424, 0.0017383478590375142, 0.003967018626618661] and parameters: {'n_layers': 4, 'embedding_dim': 256, 'lr': 0.0031134216844272773, 'lambda_val': 1.2837204552285904e-05, 'batch_size': 1868, 'optimizer': 'RMSprop'}.
2026-06-21 01:36:58,550 - optuna.study.study - INFO - Trial 199 finished with values: [0.007862530711698776, 0.0019372868510799544, 0.005075372145144271] and parameters: {'n_layers': 2, 'embedding_dim': 96, 'lr': 0.0006460981719089114, 'lambda_val': 5.82846385984691e-05, 'batch_size': 1203, 'optimizer': 'RMSprop'}.
2026-06-21 01:38:11,972 - experiment_functions - INFO - Early stopping at epoch 1650. Best Metrics: (0.0006487858117920877, 0.00013578375647341163, 0.0003599286051601713)
2026-06-21 01:38:12,086 - optuna.study.study - INFO - Trial 200 finished with values: [0.0006487858117920877, 0.00013578375647341163, 0.0003599286051601713] and parameters: {'n_layers': 4, 'embedding_dim': 96, 'lr': 2.518522008992274e-05, 'lambda_val': 0.0017226178103252388, 'batch_size': 1653, 'optimizer': 'RMSprop'}.
2026-06-21 01:40:33,742 - experiment_functions - INFO - Early stopping at epoch 3150. Best Metrics: (0.01027663162424686, 0.0026146267525577875, 0.006400860406976127)
2026-06-21 01:40:33,837 - optuna.study.study - INFO - Trial 201 finished with values: [0.01027663162424686, 0.0026146267525577875, 0.006400860406976127] and parameters: {'n_layers': 3, 'embedding_dim': 128, 'lr': 0.0006101961971381852, 'lambda_val': 1.1627943650784121e-05, 'batch_size': 2119, 'optimizer': 'RMSprop'}.
2026-06-21 01:41:53,175 - experiment_functions - INFO - Early stopping at epoch 1750. Best Metrics: (0.011858476774837978, 0.0028846153846153848, 0.007415703902921049)
2026-06-21 01:41:53,277 - optuna.study.study - INFO - Trial 202 finished with values: [0.011858476774837978, 0.0028846153846153848, 0.007415703902921049] and parameters: {'n_layers': 4, 'embedding_dim': 96, 'lr': 0.0006604859729474348, 'lambda_val': 1.282312052161098e-05, 'batch_size': 2187, 'optimizer': 'RMSprop'}.
2026-06-21 01:43:33,539 - experiment_functions - INFO - Early stopping at epoch 2250. Best Metrics: (0.004028178259199604, 0.0009520651762031074, 0.002501364496279902)
2026-06-21 01:43:33,846 - optuna.study.study - INFO - Trial 203 finished with values: [0.004028178259199604, 0.0009520651762031074, 0.002501364496279902] and parameters: {'n_layers': 1, 'embedding_dim': 256, 'lr': 0.0006101961971381852, 'lambda_val': 0.003328760378494833, 'batch_size': 2423, 'optimizer': 'RMSprop'}.
2026-06-21 01:45:08,914 - experiment_functions - INFO - Early stopping at epoch 2350. Best Metrics: (0.005118390727753416, 0.001266262473159025, 0.003141350444453827)
2026-06-21 01:45:09,014 - optuna.study.study - INFO - Trial 204 finished with values: [0.005118390727753416, 0.001266262473159025, 0.003141350444453827] and parameters: {'n_layers': 1, 'embedding_dim': 96, 'lr': 0.0031134216844272773, 'lambda_val': 3.9553958515555e-06, 'batch_size': 1203, 'optimizer': 'RMSprop'}.
2026-06-21 01:46:21,193 - experiment_functions - INFO - Early stopping at epoch 1600. Best Metrics: (0.011280542679391221, 0.0028514588859416446, 0.007181070403307861)
2026-06-21 01:46:21,300 - optuna.study.study - INFO - Trial 205 finished with values: [0.011280542679391221, 0.0028514588859416446, 0.007181070403307861] and parameters: {'n_layers': 4, 'embedding_dim': 96, 'lr': 0.0006101961971381852, 'lambda_val': 2.0807360556667617e-05, 'batch_size': 2917, 'optimizer': 'RMSprop'}.
2026-06-21 01:49:19,311 - optuna.study.study - INFO - Trial 206 finished with values: [0.009512659330474507, 0.002316218264494127, 0.005858744384699594] and parameters: {'n_layers': 3, 'embedding_dim': 128, 'lr': 0.00043327912311372766, 'lambda_val': 5.97103546871185e-06, 'batch_size': 1203, 'optimizer': 'RMSprop'}.
2026-06-21 01:49:49,208 - experiment_functions - INFO - Early stopping at epoch 650. Best Metrics: (0.010024788015447483, 0.0024804218769736014, 0.006077779473331075)
2026-06-21 01:49:49,349 - optuna.study.study - INFO - Trial 207 finished with values: [0.010024788015447483, 0.0024804218769736014, 0.006077779473331075] and parameters: {'n_layers': 4, 'embedding_dim': 64, 'lr': 0.0021794693743976113, 'lambda_val': 4.288578460415674e-06, 'batch_size': 2119, 'optimizer': 'RMSprop'}.
2026-06-21 01:52:47,089 - optuna.study.study - INFO - Trial 208 finished with values: [0.013166270949577088, 0.0032382847038019452, 0.008161257160926924] and parameters: {'n_layers': 4, 'embedding_dim': 96, 'lr': 0.0006101961971381852, 'lambda_val': 0.0017226178103252388, 'batch_size': 777, 'optimizer': 'RMSprop'}.
2026-06-21 01:55:33,700 - optuna.study.study - INFO - Trial 209 finished with values: [0.009475621241038235, 0.002363584691170898, 0.005793213782023113] and parameters: {'n_layers': 3, 'embedding_dim': 64, 'lr': 0.0006460981719089114, 'lambda_val': 5.82846385984691e-05, 'batch_size': 2119, 'optimizer': 'Adam'}.
2026-06-21 01:56:07,941 - experiment_functions - INFO - Early stopping at epoch 750. Best Metrics: (0.009929227661353233, 0.002472527472527473, 0.005930807055467964)
2026-06-21 01:56:08,152 - optuna.study.study - INFO - Trial 210 finished with values: [0.009929227661353233, 0.002472527472527473, 0.005930807055467964] and parameters: {'n_layers': 4, 'embedding_dim': 64, 'lr': 0.0031134216844272773, 'lambda_val': 3.9553958515555e-06, 'batch_size': 923, 'optimizer': 'RMSprop'}.
2026-06-21 01:58:59,459 - optuna.study.study - INFO - Trial 211 finished with values: [0.00988284578423438, 0.002553050397877984, 0.006154998267760623] and parameters: {'n_layers': 4, 'embedding_dim': 64, 'lr': 0.00043327912311372766, 'lambda_val': 3.9553958515555e-06, 'batch_size': 2947, 'optimizer': 'Adam'}.
2026-06-21 01:59:32,716 - experiment_functions - INFO - Early stopping at epoch 700. Best Metrics: (0.009016411316937034, 0.002202538840469875, 0.005343126877358134)
2026-06-21 01:59:33,284 - optuna.study.study - INFO - Trial 212 finished with values: [0.009016411316937034, 0.002202538840469875, 0.005343126877358134] and parameters: {'n_layers': 4, 'embedding_dim': 96, 'lr': 0.0031134216844272773, 'lambda_val': 0.0014663279558597413, 'batch_size': 1285, 'optimizer': 'Adam'}.
2026-06-21 02:00:03,535 - experiment_functions - INFO - Early stopping at epoch 650. Best Metrics: (0.008697520626299084, 0.002142541366679298, 0.005175945287780148)
2026-06-21 02:00:03,688 - optuna.study.study - INFO - Trial 213 finished with values: [0.008697520626299084, 0.002142541366679298, 0.005175945287780148] and parameters: {'n_layers': 4, 'embedding_dim': 64, 'lr': 0.0031134216844272773, 'lambda_val': 3.9553958515555e-06, 'batch_size': 4020, 'optimizer': 'Adam'}.
2026-06-21 02:02:41,024 - optuna.study.study - INFO - Trial 214 finished with values: [0.0006340667633400307, 0.0001468359226979917, 0.0003494633691105769] and parameters: {'n_layers': 3, 'embedding_dim': 32, 'lr': 5.362355353114083e-05, 'lambda_val': 0.0017226178103252388, 'batch_size': 1653, 'optimizer': 'Adam'}.
2026-06-21 02:03:14,972 - experiment_functions - INFO - Early stopping at epoch 750. Best Metrics: (0.009913333854026546, 0.002469369710749021, 0.005985164063581187)
2026-06-21 02:03:15,070 - optuna.study.study - INFO - Trial 215 finished with values: [0.009913333854026546, 0.002469369710749021, 0.005985164063581187] and parameters: {'n_layers': 4, 'embedding_dim': 64, 'lr': 0.0031134216844272773, 'lambda_val': 2.8861183398799558e-06, 'batch_size': 1257, 'optimizer': 'Adam'}.
2026-06-21 02:05:39,718 - experiment_functions - INFO - Early stopping at epoch 2800. Best Metrics: (0.008331618720348074, 0.002065176203107238, 0.0051037183343810725)
2026-06-21 02:05:39,829 - optuna.study.study - INFO - Trial 216 finished with values: [0.008331618720348074, 0.002065176203107238, 0.0051037183343810725] and parameters: {'n_layers': 3, 'embedding_dim': 256, 'lr': 0.0006101961971381852, 'lambda_val': 2.0807360556667617e-05, 'batch_size': 1203, 'optimizer': 'Adam'}.
2026-06-21 02:06:10,463 - experiment_functions - INFO - Early stopping at epoch 650. Best Metrics: (0.008567473616195247, 0.002152014652014652, 0.005100812034408429)
2026-06-21 02:06:10,954 - optuna.study.study - INFO - Trial 217 finished with values: [0.008567473616195247, 0.002152014652014652, 0.005100812034408429] and parameters: {'n_layers': 3, 'embedding_dim': 96, 'lr': 0.0035879353384560956, 'lambda_val': 1.282312052161098e-05, 'batch_size': 1203, 'optimizer': 'RMSprop'}.
2026-06-21 02:06:41,211 - experiment_functions - INFO - Early stopping at epoch 650. Best Metrics: (0.00831056514274623, 0.0020193886573196917, 0.004924104363986349)
2026-06-21 02:06:41,393 - optuna.study.study - INFO - Trial 218 finished with values: [0.00831056514274623, 0.0020193886573196917, 0.004924104363986349] and parameters: {'n_layers': 3, 'embedding_dim': 96, 'lr': 0.0021794693743976113, 'lambda_val': 2.8861183398799558e-06, 'batch_size': 3515, 'optimizer': 'RMSprop'}.
2026-06-21 02:09:21,437 - optuna.study.study - INFO - Trial 219 finished with values: [0.008553259838506848, 0.0021346469622331695, 0.005417321148343614] and parameters: {'n_layers': 3, 'embedding_dim': 32, 'lr': 0.0006604859729474348, 'lambda_val': 5.82846385984691e-05, 'batch_size': 777, 'optimizer': 'RMSprop'}.
2026-06-21 02:09:50,826 - experiment_functions - INFO - Early stopping at epoch 650. Best Metrics: (0.0053455162338663705, 0.001510989010989011, 0.0033216345940696368)
2026-06-21 02:09:51,752 - optuna.study.study - INFO - Trial 220 finished with values: [0.0053455162338663705, 0.001510989010989011, 0.0033216345940696368] and parameters: {'n_layers': 4, 'embedding_dim': 64, 'lr': 0.0031134216844272773, 'lambda_val': 0.021367450476301852, 'batch_size': 1285, 'optimizer': 'Adam'}.
2026-06-21 02:12:43,025 - optuna.study.study - INFO - Trial 221 finished with values: [0.00645263957693108, 0.001613616268788683, 0.0042268926681874215] and parameters: {'n_layers': 2, 'embedding_dim': 128, 'lr': 0.0006101961971381852, 'lambda_val': 5.82846385984691e-05, 'batch_size': 2119, 'optimizer': 'Adam'}.
2026-06-21 02:13:05,839 - experiment_functions - INFO - Early stopping at epoch 500. Best Metrics: (0.0005478261300399373, 0.00012473159024883163, 0.00032463568073181823)
2026-06-21 02:13:05,943 - optuna.study.study - INFO - Trial 222 finished with values: [0.0005478261300399373, 0.00012473159024883163, 0.00032463568073181823] and parameters: {'n_layers': 4, 'embedding_dim': 64, 'lr': 0.0006101961971381852, 'lambda_val': 0.0014663279558597413, 'batch_size': 2119, 'optimizer': 'SGD'}.
2026-06-21 02:15:58,161 - optuna.study.study - INFO - Trial 223 finished with values: [0.009299130277994751, 0.002319376026272578, 0.0059858416785207565] and parameters: {'n_layers': 3, 'embedding_dim': 96, 'lr': 0.0006101961971381852, 'lambda_val': 2.0807360556667617e-05, 'batch_size': 1788, 'optimizer': 'Adam'}.
2026-06-21 02:18:52,212 - experiment_functions - INFO - Early stopping at epoch 3900. Best Metrics: (0.010609804541833608, 0.0026130478716685614, 0.006495337720693756)
2026-06-21 02:18:52,321 - optuna.study.study - INFO - Trial 224 finished with values: [0.010609804541833608, 0.0026130478716685614, 0.006495337720693756] and parameters: {'n_layers': 3, 'embedding_dim': 128, 'lr': 0.0006101961971381852, 'lambda_val': 1.282312052161098e-05, 'batch_size': 2119, 'optimizer': 'RMSprop'}.
2026-06-21 02:21:39,498 - optuna.study.study - INFO - Trial 225 finished with values: [0.00998295064780723, 0.0025830491347732724, 0.006187216799404816] and parameters: {'n_layers': 3, 'embedding_dim': 64, 'lr': 0.0006604859729474348, 'lambda_val': 0.0014663279558597413, 'batch_size': 1305, 'optimizer': 'RMSprop'}.
2026-06-21 02:24:31,768 - optuna.study.study - INFO - Trial 226 finished with values: [0.010473617672070678, 0.0025356827080965016, 0.0063217463850807855] and parameters: {'n_layers': 3, 'embedding_dim': 96, 'lr': 0.0006460981719089114, 'lambda_val': 5.82846385984691e-05, 'batch_size': 1203, 'optimizer': 'Adam'}.
2026-06-21 02:27:00,045 - experiment_functions - INFO - Early stopping at epoch 3750. Best Metrics: (0.004169735162749748, 0.0009015409877478844, 0.0024828247308419198)
2026-06-21 02:27:00,192 - optuna.study.study - INFO - Trial 227 finished with values: [0.004169735162749748, 0.0009015409877478844, 0.0024828247308419198] and parameters: {'n_layers': 1, 'embedding_dim': 64, 'lr': 0.0006101961971381852, 'lambda_val': 0.0017226178103252388, 'batch_size': 2119, 'optimizer': 'Adam'}.
2026-06-21 02:27:35,882 - experiment_functions - INFO - Early stopping at epoch 650. Best Metrics: (0.006978442530950261, 0.0017983453328280915, 0.004065446561836681)
2026-06-21 02:27:36,239 - optuna.study.study - INFO - Trial 228 finished with values: [0.006978442530950261, 0.0017983453328280915, 0.004065446561836681] and parameters: {'n_layers': 3, 'embedding_dim': 256, 'lr': 0.0035879353384560956, 'lambda_val': 2.4259773382665532e-05, 'batch_size': 1203, 'optimizer': 'RMSprop'}.
2026-06-21 02:28:05,032 - experiment_functions - INFO - Early stopping at epoch 600. Best Metrics: (0.007517620528993412, 0.0018725527346217003, 0.0043814601610763625)
2026-06-21 02:28:05,184 - optuna.study.study - INFO - Trial 229 finished with values: [0.007517620528993412, 0.0018725527346217003, 0.0043814601610763625] and parameters: {'n_layers': 4, 'embedding_dim': 96, 'lr': 0.0031134216844272773, 'lambda_val': 0.0014663279558597413, 'batch_size': 1285, 'optimizer': 'RMSprop'}.
2026-06-21 02:28:40,733 - experiment_functions - INFO - Early stopping at epoch 750. Best Metrics: (0.009698512691529743, 0.002360426929392447, 0.0058174449242998)
2026-06-21 02:28:41,048 - optuna.study.study - INFO - Trial 230 finished with values: [0.009698512691529743, 0.002360426929392447, 0.0058174449242998] and parameters: {'n_layers': 4, 'embedding_dim': 96, 'lr': 0.0031134216844272773, 'lambda_val': 2.0807360556667617e-05, 'batch_size': 1257, 'optimizer': 'Adam'}.
2026-06-21 02:31:27,595 - optuna.study.study - INFO - Trial 231 finished with values: [0.011468277538709383, 0.0028909309081722877, 0.007121788908747018] and parameters: {'n_layers': 3, 'embedding_dim': 64, 'lr': 0.0006460981719089114, 'lambda_val': 5.82846385984691e-05, 'batch_size': 1273, 'optimizer': 'RMSprop'}.
2026-06-21 02:31:51,010 - experiment_functions - INFO - Early stopping at epoch 500. Best Metrics: (0.0005501369707915923, 0.00012788935202728306, 0.0002930590642041035)
2026-06-21 02:31:51,131 - optuna.study.study - INFO - Trial 232 finished with values: [0.0005501369707915923, 0.00012788935202728306, 0.0002930590642041035] and parameters: {'n_layers': 3, 'embedding_dim': 96, 'lr': 0.0031134216844272773, 'lambda_val': 0.040638920060116525, 'batch_size': 1285, 'optimizer': 'SGD'}.
2026-06-21 02:32:27,862 - experiment_functions - INFO - Early stopping at epoch 800. Best Metrics: (0.00831033995253411, 0.0020493873942149803, 0.005022372132353033)
2026-06-21 02:32:27,964 - optuna.study.study - INFO - Trial 233 finished with values: [0.00831033995253411, 0.0020493873942149803, 0.005022372132353033] and parameters: {'n_layers': 3, 'embedding_dim': 96, 'lr': 0.004755645745216762, 'lambda_val': 2.4259773382665532e-05, 'batch_size': 777, 'optimizer': 'Adam'}.
2026-06-21 02:34:45,869 - experiment_functions - INFO - Early stopping at epoch 2950. Best Metrics: (0.010988134579346909, 0.002739358342806618, 0.006639724757953599)
