2026-06-18 20:51:10,246 - optuna.study.study - INFO - Trial 190 finished with values: [0.030104603642904817, 0.006523935834280662, 0.017368758230002033] and parameters: {'n_layers': 1, 'embedding_dim': 96, 'lr': 0.00039950195617414347, 'lambda_val': 4.521426485432383e-06, 'batch_size': 1490, 'optimizer': 'Adam'}.
2026-06-18 20:52:44,845 - experiment_functions - INFO - Early stopping at epoch 2050. Best Metrics: (0.028811830758982967, 0.006294998105342934, 0.016493708344871908)
2026-06-18 20:52:45,915 - optuna.study.study - INFO - Trial 191 finished with values: [0.028811830758982967, 0.006294998105342934, 0.016493708344871908] and parameters: {'n_layers': 2, 'embedding_dim': 96, 'lr': 0.0004856174201898278, 'lambda_val': 0.0005069195879480929, 'batch_size': 991, 'optimizer': 'Adam'}.
2026-06-18 20:53:09,546 - experiment_functions - INFO - Early stopping at epoch 500. Best Metrics: (0.0004957742948957893, 0.00011999494758115448, 0.0002502862308314272)
2026-06-18 20:53:09,911 - optuna.study.study - INFO - Trial 192 finished with values: [0.0004957742948957893, 0.00011999494758115448, 0.0002502862308314272] and parameters: {'n_layers': 1, 'embedding_dim': 128, 'lr': 0.0082956867501665, 'lambda_val': 0.00047613316859548355, 'batch_size': 1936, 'optimizer': 'SGD'}.
2026-06-18 20:54:00,829 - experiment_functions - INFO - Early stopping at epoch 1050. Best Metrics: (0.022033695123355544, 0.004733484905898699, 0.012308017879048219)
2026-06-18 20:54:01,259 - optuna.study.study - INFO - Trial 193 finished with values: [0.022033695123355544, 0.004733484905898699, 0.012308017879048219] and parameters: {'n_layers': 4, 'embedding_dim': 64, 'lr': 0.0004856174201898278, 'lambda_val': 4.2973684498152175e-06, 'batch_size': 2689, 'optimizer': 'Adam'}.
2026-06-18 20:57:06,338 - optuna.study.study - INFO - Trial 194 finished with values: [0.012508059631196425, 0.0028909309081722873, 0.00757018596850987] and parameters: {'n_layers': 2, 'embedding_dim': 128, 'lr': 0.0001408506946893725, 'lambda_val': 3.993933023341986e-05, 'batch_size': 1484, 'optimizer': 'Adam'}.
2026-06-18 20:57:49,435 - experiment_functions - INFO - Early stopping at epoch 950. Best Metrics: (0.031133119112291753, 0.006696033851206266, 0.017704893838111593)
2026-06-18 20:57:49,528 - optuna.study.study - INFO - Trial 195 finished with values: [0.031133119112291753, 0.006696033851206266, 0.017704893838111593] and parameters: {'n_layers': 1, 'embedding_dim': 96, 'lr': 0.0010029417148474076, 'lambda_val': 0.00015514348570178205, 'batch_size': 3300, 'optimizer': 'Adam'}.
2026-06-18 21:01:49,646 - optuna.study.study - INFO - Trial 196 finished with values: [0.024361255447379677, 0.005428192497158015, 0.014042689418266422] and parameters: {'n_layers': 3, 'embedding_dim': 256, 'lr': 0.0001408506946893725, 'lambda_val': 9.959964188496882e-05, 'batch_size': 2254, 'optimizer': 'Adam'}.
2026-06-18 21:04:49,982 - optuna.study.study - INFO - Trial 197 finished with values: [0.033044474912079534, 0.006983390173045346, 0.01943784528657125] and parameters: {'n_layers': 1, 'embedding_dim': 128, 'lr': 0.0005592470013695373, 'lambda_val': 4.521426485432383e-06, 'batch_size': 2521, 'optimizer': 'Adam'}.
2026-06-18 21:05:18,752 - experiment_functions - INFO - Early stopping at epoch 600. Best Metrics: (0.022592149754538004, 0.004760325881015536, 0.01266541437539429)
2026-06-18 21:05:18,848 - optuna.study.study - INFO - Trial 198 finished with values: [0.022592149754538004, 0.004760325881015536, 0.01266541437539429] and parameters: {'n_layers': 3, 'embedding_dim': 64, 'lr': 0.0022436517643766684, 'lambda_val': 4.115717615485875e-05, 'batch_size': 3300, 'optimizer': 'Adam'}.
2026-06-18 21:08:05,224 - optuna.study.study - INFO - Trial 199 finished with values: [0.0014002171048583293, 0.00031735505873436905, 0.0007921534975526994] and parameters: {'n_layers': 1, 'embedding_dim': 96, 'lr': 0.0001408506946893725, 'lambda_val': 9.959964188496882e-05, 'batch_size': 1538, 'optimizer': 'RMSprop'}.
2026-06-18 21:08:48,431 - experiment_functions - INFO - Early stopping at epoch 850. Best Metrics: (0.027631770585334333, 0.005928697739042567, 0.015569377383992857)
2026-06-18 21:08:48,488 - optuna.study.study - INFO - Trial 200 finished with values: [0.027631770585334333, 0.005928697739042567, 0.015569377383992857] and parameters: {'n_layers': 2, 'embedding_dim': 128, 'lr': 0.0007183006551542105, 'lambda_val': 0.00015514348570178205, 'batch_size': 2220, 'optimizer': 'Adam'}.
2026-06-18 21:09:41,103 - experiment_functions - INFO - Early stopping at epoch 1200. Best Metrics: (0.0324371573727451, 0.007057597574838953, 0.018861763871043748)
2026-06-18 21:09:41,178 - optuna.study.study - INFO - Trial 201 finished with values: [0.0324371573727451, 0.007057597574838953, 0.018861763871043748] and parameters: {'n_layers': 1, 'embedding_dim': 64, 'lr': 0.0010029417148474076, 'lambda_val': 0.0016333984694785568, 'batch_size': 1453, 'optimizer': 'Adam'}.
2026-06-18 21:10:03,641 - experiment_functions - INFO - Early stopping at epoch 500. Best Metrics: (0.0006635667187731471, 0.00014841480358721742, 0.0003509831756375578)
2026-06-18 21:10:03,722 - optuna.study.study - INFO - Trial 202 finished with values: [0.0006635667187731471, 0.00014841480358721742, 0.0003509831756375578] and parameters: {'n_layers': 2, 'embedding_dim': 32, 'lr': 0.0004856174201898278, 'lambda_val': 0.08903601154158376, 'batch_size': 578, 'optimizer': 'Adam'}.
2026-06-18 21:10:33,937 - experiment_functions - INFO - Early stopping at epoch 650. Best Metrics: (0.021044277357456256, 0.00465611974232664, 0.011635501563242742)
2026-06-18 21:10:34,044 - optuna.study.study - INFO - Trial 203 finished with values: [0.021044277357456256, 0.00465611974232664, 0.011635501563242742] and parameters: {'n_layers': 1, 'embedding_dim': 96, 'lr': 0.0010467544958961223, 'lambda_val': 0.00988731074821415, 'batch_size': 3608, 'optimizer': 'RMSprop'}.
2026-06-18 21:11:02,951 - experiment_functions - INFO - Early stopping at epoch 600. Best Metrics: (0.02867241079669548, 0.006077112542629785, 0.016530886509102116)
2026-06-18 21:11:03,056 - optuna.study.study - INFO - Trial 204 finished with values: [0.02867241079669548, 0.006077112542629785, 0.016530886509102116] and parameters: {'n_layers': 1, 'embedding_dim': 128, 'lr': 0.00418873950631108, 'lambda_val': 4.735122359256782e-06, 'batch_size': 2220, 'optimizer': 'Adam'}.
2026-06-18 21:12:22,672 - experiment_functions - INFO - Early stopping at epoch 1750. Best Metrics: (0.028235768308150833, 0.006242895035998485, 0.01632071709318222)
2026-06-18 21:12:22,802 - optuna.study.study - INFO - Trial 205 finished with values: [0.028235768308150833, 0.006242895035998485, 0.01632071709318222] and parameters: {'n_layers': 1, 'embedding_dim': 96, 'lr': 0.0004856174201898278, 'lambda_val': 0.0022646831590701676, 'batch_size': 3911, 'optimizer': 'Adam'}.
2026-06-18 21:13:19,563 - experiment_functions - INFO - Early stopping at epoch 1250. Best Metrics: (0.02586393755948084, 0.005642920298092712, 0.01467171596543991)
2026-06-18 21:13:19,642 - optuna.study.study - INFO - Trial 206 finished with values: [0.02586393755948084, 0.005642920298092712, 0.01467171596543991] and parameters: {'n_layers': 1, 'embedding_dim': 128, 'lr': 0.0005592470013695373, 'lambda_val': 0.010319345484184167, 'batch_size': 2521, 'optimizer': 'Adam'}.
2026-06-18 21:14:54,580 - experiment_functions - INFO - Early stopping at epoch 2150. Best Metrics: (0.03183508088802738, 0.0068902362005810285, 0.01847889409335678)
2026-06-18 21:14:54,649 - optuna.study.study - INFO - Trial 207 finished with values: [0.03183508088802738, 0.0068902362005810285, 0.01847889409335678] and parameters: {'n_layers': 1, 'embedding_dim': 96, 'lr': 0.0007183006551542105, 'lambda_val': 4.521426485432383e-06, 'batch_size': 2689, 'optimizer': 'Adam'}.
2026-06-18 21:15:39,582 - experiment_functions - INFO - Early stopping at epoch 900. Best Metrics: (0.02632162021394876, 0.005622394846532778, 0.014982866053366111)
2026-06-18 21:15:39,653 - optuna.study.study - INFO - Trial 208 finished with values: [0.02632162021394876, 0.005622394846532778, 0.014982866053366111] and parameters: {'n_layers': 2, 'embedding_dim': 128, 'lr': 0.0005592470013695373, 'lambda_val': 4.521426485432383e-06, 'batch_size': 2521, 'optimizer': 'RMSprop'}.
2026-06-18 21:16:11,592 - experiment_functions - INFO - Early stopping at epoch 550. Best Metrics: (0.009935978430626841, 0.0019925476822028544, 0.005142894160025505)
2026-06-18 21:16:11,676 - optuna.study.study - INFO - Trial 209 finished with values: [0.009935978430626841, 0.0019925476822028544, 0.005142894160025505] and parameters: {'n_layers': 4, 'embedding_dim': 128, 'lr': 0.0082956867501665, 'lambda_val': 0.0028757357118270968, 'batch_size': 3516, 'optimizer': 'Adam'}.
2026-06-18 21:16:44,640 - experiment_functions - INFO - Early stopping at epoch 700. Best Metrics: (0.030650533581210605, 0.006497094859163824, 0.017783395722840337)
2026-06-18 21:16:44,738 - optuna.study.study - INFO - Trial 210 finished with values: [0.030650533581210605, 0.006497094859163824, 0.017783395722840337] and parameters: {'n_layers': 1, 'embedding_dim': 128, 'lr': 0.001993370802391186, 'lambda_val': 4.735122359256782e-06, 'batch_size': 3516, 'optimizer': 'Adam'}.
2026-06-18 21:17:42,229 - experiment_functions - INFO - Early stopping at epoch 1250. Best Metrics: (0.021784723270077924, 0.004880320828596691, 0.012081875167972421)
2026-06-18 21:17:42,324 - optuna.study.study - INFO - Trial 211 finished with values: [0.021784723270077924, 0.004880320828596691, 0.012081875167972421] and parameters: {'n_layers': 2, 'embedding_dim': 96, 'lr': 0.00039950195617414347, 'lambda_val': 0.013766606228408413, 'batch_size': 1490, 'optimizer': 'Adam'}.
2026-06-18 21:20:39,096 - optuna.study.study - INFO - Trial 212 finished with values: [0.03246550279156223, 0.006964443602374637, 0.019236112193368564] and parameters: {'n_layers': 1, 'embedding_dim': 96, 'lr': 0.00039950195617414347, 'lambda_val': 1.4325187628126664e-06, 'batch_size': 2689, 'optimizer': 'Adam'}.
2026-06-18 21:23:23,874 - optuna.study.study - INFO - Trial 213 finished with values: [0.005474045511779091, 0.0012899456864974106, 0.003178561061811161] and parameters: {'n_layers': 1, 'embedding_dim': 96, 'lr': 0.00022471387800597823, 'lambda_val': 1.6752389722318858e-05, 'batch_size': 991, 'optimizer': 'RMSprop'}.
2026-06-18 21:24:05,074 - experiment_functions - INFO - Early stopping at epoch 900. Best Metrics: (0.029518738999879786, 0.006359732221801187, 0.01709348362359584)
2026-06-18 21:24:05,191 - optuna.study.study - INFO - Trial 214 finished with values: [0.029518738999879786, 0.006359732221801187, 0.01709348362359584] and parameters: {'n_layers': 1, 'embedding_dim': 96, 'lr': 0.0010029417148474076, 'lambda_val': 0.00015514348570178205, 'batch_size': 3300, 'optimizer': 'Adam'}.
2026-06-18 21:25:02,017 - experiment_functions - INFO - Early stopping at epoch 1100. Best Metrics: (0.021661460518468918, 0.004733484905898699, 0.012140565796748076)
2026-06-18 21:25:02,093 - optuna.study.study - INFO - Trial 215 finished with values: [0.021661460518468918, 0.004733484905898699, 0.012140565796748076] and parameters: {'n_layers': 4, 'embedding_dim': 96, 'lr': 0.0004856174201898278, 'lambda_val': 0.00015514348570178205, 'batch_size': 2254, 'optimizer': 'Adam'}.
2026-06-18 21:25:28,050 - experiment_functions - INFO - Early stopping at epoch 550. Best Metrics: (0.02641277729676249, 0.005437665782493369, 0.014803982198218314)
2026-06-18 21:25:28,135 - optuna.study.study - INFO - Trial 216 finished with values: [0.02641277729676249, 0.005437665782493369, 0.014803982198218314] and parameters: {'n_layers': 1, 'embedding_dim': 96, 'lr': 0.0082956867501665, 'lambda_val': 0.00047613316859548355, 'batch_size': 2618, 'optimizer': 'Adam'}.
2026-06-18 21:25:50,578 - experiment_functions - INFO - Early stopping at epoch 500. Best Metrics: (0.0005031742234817548, 0.00011683718580270305, 0.0002782841299726113)
2026-06-18 21:25:50,699 - optuna.study.study - INFO - Trial 217 finished with values: [0.0005031742234817548, 0.00011683718580270305, 0.0002782841299726113] and parameters: {'n_layers': 1, 'embedding_dim': 64, 'lr': 0.0005592470013695373, 'lambda_val': 0.00048594691701597944, 'batch_size': 991, 'optimizer': 'SGD'}.
2026-06-18 21:27:15,924 - experiment_functions - INFO - Early stopping at epoch 1950. Best Metrics: (0.03228158377173432, 0.007014967790829861, 0.01904376247238799)
2026-06-18 21:27:16,016 - optuna.study.study - INFO - Trial 218 finished with values: [0.03228158377173432, 0.007014967790829861, 0.01904376247238799] and parameters: {'n_layers': 1, 'embedding_dim': 96, 'lr': 0.0010029417148474076, 'lambda_val': 0.00015514348570178205, 'batch_size': 578, 'optimizer': 'Adam'}.
2026-06-18 21:28:26,444 - experiment_functions - INFO - Early stopping at epoch 1600. Best Metrics: (0.013465828607633783, 0.0028909309081722877, 0.007080449433686163)
2026-06-18 21:28:26,516 - optuna.study.study - INFO - Trial 219 finished with values: [0.013465828607633783, 0.0028909309081722877, 0.007080449433686163] and parameters: {'n_layers': 1, 'embedding_dim': 96, 'lr': 0.002003020991909066, 'lambda_val': 0.014265624915112317, 'batch_size': 991, 'optimizer': 'RMSprop'}.
2026-06-18 21:29:42,450 - experiment_functions - INFO - Early stopping at epoch 1500. Best Metrics: (0.023506370391062688, 0.005039787798408489, 0.013213758126440673)
2026-06-18 21:29:42,557 - optuna.study.study - INFO - Trial 220 finished with values: [0.023506370391062688, 0.005039787798408489, 0.013213758126440673] and parameters: {'n_layers': 3, 'embedding_dim': 128, 'lr': 0.0004856174201898278, 'lambda_val': 4.115717615485875e-05, 'batch_size': 3911, 'optimizer': 'Adam'}.
2026-06-18 21:30:22,299 - experiment_functions - INFO - Early stopping at epoch 850. Best Metrics: (0.02843646214757721, 0.006152898825312619, 0.016534316973788026)
2026-06-18 21:30:22,397 - optuna.study.study - INFO - Trial 221 finished with values: [0.02843646214757721, 0.006152898825312619, 0.016534316973788026] and parameters: {'n_layers': 1, 'embedding_dim': 128, 'lr': 0.0010029417148474076, 'lambda_val': 4.521426485432383e-06, 'batch_size': 3516, 'optimizer': 'RMSprop'}.
2026-06-18 21:32:54,436 - experiment_functions - INFO - Early stopping at epoch 3450. Best Metrics: (0.03265495576496672, 0.006890236200581028, 0.01920988734189897)
2026-06-18 21:32:54,520 - optuna.study.study - INFO - Trial 222 finished with values: [0.03265495576496672, 0.006890236200581028, 0.01920988734189897] and parameters: {'n_layers': 1, 'embedding_dim': 96, 'lr': 0.0005592470013695373, 'lambda_val': 0.00012665625175825525, 'batch_size': 2931, 'optimizer': 'RMSprop'}.
2026-06-18 21:34:31,253 - experiment_functions - INFO - Early stopping at epoch 1950. Best Metrics: (0.017121235270492564, 0.0033267020335985857, 0.008938380038359844)
2026-06-18 21:34:31,325 - optuna.study.study - INFO - Trial 223 finished with values: [0.017121235270492564, 0.0033267020335985857, 0.008938380038359844] and parameters: {'n_layers': 4, 'embedding_dim': 96, 'lr': 0.002003020991909066, 'lambda_val': 0.00015514348570178205, 'batch_size': 991, 'optimizer': 'Adam'}.
2026-06-18 21:35:07,960 - experiment_functions - INFO - Early stopping at epoch 650. Best Metrics: (0.020701712327931585, 0.00440507768093975, 0.011517214464999774)
2026-06-18 21:35:08,047 - optuna.study.study - INFO - Trial 224 finished with values: [0.020701712327931585, 0.00440507768093975, 0.011517214464999774] and parameters: {'n_layers': 4, 'embedding_dim': 128, 'lr': 0.0010029417148474076, 'lambda_val': 1.4285456163687262e-06, 'batch_size': 3911, 'optimizer': 'Adam'}.
2026-06-18 21:35:38,936 - experiment_functions - INFO - Early stopping at epoch 550. Best Metrics: (0.015571959847022983, 0.003102500947328534, 0.008507715666006496)
2026-06-18 21:35:39,108 - optuna.study.study - INFO - Trial 225 finished with values: [0.015571959847022983, 0.003102500947328534, 0.008507715666006496] and parameters: {'n_layers': 4, 'embedding_dim': 128, 'lr': 0.02344928247506115, 'lambda_val': 1.1727812158033635e-06, 'batch_size': 578, 'optimizer': 'Adam'}.
2026-06-18 21:37:00,417 - experiment_functions - INFO - Early stopping at epoch 1650. Best Metrics: (0.0271201035792769, 0.005905014525704181, 0.015568068309979545)
2026-06-18 21:37:00,498 - optuna.study.study - INFO - Trial 226 finished with values: [0.0271201035792769, 0.005905014525704181, 0.015568068309979545] and parameters: {'n_layers': 2, 'embedding_dim': 128, 'lr': 0.00039950195617414347, 'lambda_val': 0.00015514348570178205, 'batch_size': 2747, 'optimizer': 'Adam'}.
2026-06-18 21:37:44,752 - experiment_functions - INFO - Early stopping at epoch 1000. Best Metrics: (0.03207290680857149, 0.006806555513452065, 0.01825488726604309)
2026-06-18 21:37:44,839 - optuna.study.study - INFO - Trial 227 finished with values: [0.03207290680857149, 0.006806555513452065, 0.01825488726604309] and parameters: {'n_layers': 1, 'embedding_dim': 64, 'lr': 0.0010029417148474076, 'lambda_val': 0.00015514348570178205, 'batch_size': 3300, 'optimizer': 'Adam'}.
2026-06-18 21:40:43,914 - optuna.study.study - INFO - Trial 228 finished with values: [0.032886890050533475, 0.006989705696602249, 0.019123486933973775] and parameters: {'n_layers': 1, 'embedding_dim': 128, 'lr': 0.00039950195617414347, 'lambda_val': 0.00015514348570178205, 'batch_size': 3012, 'optimizer': 'Adam'}.
2026-06-18 21:43:43,442 - optuna.study.study - INFO - Trial 229 finished with values: [0.03464330581186703, 0.007310218517115069, 0.019829961930346956] and parameters: {'n_layers': 1, 'embedding_dim': 128, 'lr': 0.0007183006551542105, 'lambda_val': 4.521426485432383e-06, 'batch_size': 2220, 'optimizer': 'Adam'}.
2026-06-18 21:46:28,348 - experiment_functions - INFO - Early stopping at epoch 3550. Best Metrics: (0.031610748250274025, 0.006771820133889099, 0.018005127239435016)
2026-06-18 21:46:28,672 - optuna.study.study - INFO - Trial 230 finished with values: [0.031610748250274025, 0.006771820133889099, 0.018005127239435016] and parameters: {'n_layers': 2, 'embedding_dim': 96, 'lr': 0.00039950195617414347, 'lambda_val': 0.00015514348570178205, 'batch_size': 991, 'optimizer': 'Adam'}.
2026-06-18 21:46:56,298 - experiment_functions - INFO - Early stopping at epoch 600. Best Metrics: (0.029342470839034553, 0.00646551724137931, 0.016755919182264645)
2026-06-18 21:46:56,389 - optuna.study.study - INFO - Trial 231 finished with values: [0.029342470839034553, 0.00646551724137931, 0.016755919182264645] and parameters: {'n_layers': 1, 'embedding_dim': 64, 'lr': 0.003552899880081482, 'lambda_val': 0.0022646831590701676, 'batch_size': 3911, 'optimizer': 'Adam'}.
2026-06-18 21:47:35,138 - experiment_functions - INFO - Early stopping at epoch 850. Best Metrics: (0.03074184304267963, 0.006441834028040924, 0.01783666276147069)
2026-06-18 21:47:35,555 - optuna.study.study - INFO - Trial 232 finished with values: [0.03074184304267963, 0.006441834028040924, 0.01783666276147069] and parameters: {'n_layers': 1, 'embedding_dim': 96, 'lr': 0.002003020991909066, 'lambda_val': 0.00015514348570178205, 'batch_size': 991, 'optimizer': 'Adam'}.
2026-06-18 21:50:22,209 - optuna.study.study - INFO - Trial 233 finished with values: [0.021732322979632426, 0.0046845395983327025, 0.012855269357091123] and parameters: {'n_layers': 1, 'embedding_dim': 32, 'lr': 0.00039950195617414347, 'lambda_val': 0.00015514348570178205, 'batch_size': 991, 'optimizer': 'Adam'}.
2026-06-18 21:50:55,234 - experiment_functions - INFO - Early stopping at epoch 650. Best Metrics: (0.029319594402021924, 0.0063281546040166725, 0.01713846063696949)
2026-06-18 21:50:55,326 - optuna.study.study - INFO - Trial 234 finished with values: [0.029319594402021924, 0.0063281546040166725, 0.01713846063696949] and parameters: {'n_layers': 1, 'embedding_dim': 128, 'lr': 0.001993370802391186, 'lambda_val': 0.0005943254859344516, 'batch_size': 3608, 'optimizer': 'Adam'}.
2026-06-18 21:51:51,395 - experiment_functions - INFO - Early stopping at epoch 1050. Best Metrics: (0.028332993187081525, 0.006010799545282304, 0.016329259757027027)
2026-06-18 21:51:51,498 - optuna.study.study - INFO - Trial 235 finished with values: [0.028332993187081525, 0.006010799545282304, 0.016329259757027027] and parameters: {'n_layers': 2, 'embedding_dim': 96, 'lr': 0.0007183006551542105, 'lambda_val': 0.00015514348570178205, 'batch_size': 991, 'optimizer': 'Adam'}.
2026-06-18 21:53:24,443 - experiment_functions - INFO - Early stopping at epoch 2050. Best Metrics: (0.0004948515133841426, 0.00011052166224580017, 0.00027762816447999904)
2026-06-18 21:53:24,536 - optuna.study.study - INFO - Trial 236 finished with values: [0.0004948515133841426, 0.00011052166224580017, 0.00027762816447999904] and parameters: {'n_layers': 1, 'embedding_dim': 128, 'lr': 4.7711168774516746e-05, 'lambda_val': 1.4285456163687262e-06, 'batch_size': 1358, 'optimizer': 'RMSprop'}.
2026-06-18 21:55:02,029 - experiment_functions - INFO - Early stopping at epoch 2050. Best Metrics: (0.015786610012806176, 0.0037656309208033345, 0.009402880988641487)
2026-06-18 21:55:02,324 - optuna.study.study - INFO - Trial 237 finished with values: [0.015786610012806176, 0.0037656309208033345, 0.009402880988641487] and parameters: {'n_layers': 2, 'embedding_dim': 96, 'lr': 0.00039950195617414347, 'lambda_val': 0.03605343189904046, 'batch_size': 991, 'optimizer': 'Adam'}.
2026-06-18 21:56:44,539 - experiment_functions - INFO - Early stopping at epoch 2050. Best Metrics: (0.020313454817058464, 0.004125615763546798, 0.011009381901228568)
