2026-06-18 14:57:36,781 - optuna.study.study - INFO - Trial 208 finished with values: [0.0030605900882989317, 0.0008099658961727927, 0.001962040255726984] and parameters: {'n_layers': 2, 'embedding_dim': 256, 'lr': 0.0016391721585660463, 'lambda_val': 1.455259422316608e-06, 'batch_size': 2199, 'optimizer': 'RMSprop'}.
2026-06-18 14:58:14,519 - experiment_functions - INFO - Early stopping at epoch 900. Best Metrics: (0.0028243527157661053, 0.0006757610205886069, 0.001844208464121975)
2026-06-18 14:58:14,620 - optuna.study.study - INFO - Trial 209 finished with values: [0.0028243527157661053, 0.0006757610205886069, 0.001844208464121975] and parameters: {'n_layers': 4, 'embedding_dim': 32, 'lr': 0.0016391721585660463, 'lambda_val': 0.00029123929001349135, 'batch_size': 3496, 'optimizer': 'Adam'}.
2026-06-18 15:00:04,660 - experiment_functions - INFO - Early stopping at epoch 2750. Best Metrics: (0.003706654931808692, 0.0008289124668435014, 0.002289246680325946)
2026-06-18 15:00:04,758 - optuna.study.study - INFO - Trial 210 finished with values: [0.003706654931808692, 0.0008289124668435014, 0.002289246680325946] and parameters: {'n_layers': 4, 'embedding_dim': 32, 'lr': 0.0010214376144180076, 'lambda_val': 0.00029123929001349135, 'batch_size': 945, 'optimizer': 'Adam'}.
2026-06-18 15:02:35,342 - experiment_functions - INFO - Early stopping at epoch 2850. Best Metrics: (0.0032506031373715073, 0.0008794366552987243, 0.002063727939469786)
2026-06-18 15:02:35,690 - optuna.study.study - INFO - Trial 211 finished with values: [0.0032506031373715073, 0.0008794366552987243, 0.002063727939469786] and parameters: {'n_layers': 4, 'embedding_dim': 256, 'lr': 0.0010214376144180076, 'lambda_val': 9.43829822749537e-06, 'batch_size': 784, 'optimizer': 'Adam'}.
2026-06-18 15:03:13,919 - experiment_functions - INFO - Early stopping at epoch 800. Best Metrics: (0.003774757108776403, 0.0009520651762031073, 0.002308283642887394)
2026-06-18 15:03:14,235 - optuna.study.study - INFO - Trial 212 finished with values: [0.003774757108776403, 0.0009520651762031073, 0.002308283642887394] and parameters: {'n_layers': 4, 'embedding_dim': 128, 'lr': 0.002487565347422212, 'lambda_val': 2.7945521753203373e-05, 'batch_size': 801, 'optimizer': 'RMSprop'}.
2026-06-18 15:05:33,220 - experiment_functions - INFO - Early stopping at epoch 3350. Best Metrics: (0.0034324806033578796, 0.0008115447770620186, 0.0020889932343500527)
2026-06-18 15:05:33,546 - optuna.study.study - INFO - Trial 213 finished with values: [0.0034324806033578796, 0.0008115447770620186, 0.0020889932343500527] and parameters: {'n_layers': 4, 'embedding_dim': 64, 'lr': 0.00031499139279171867, 'lambda_val': 1.455259422316608e-06, 'batch_size': 2863, 'optimizer': 'RMSprop'}.
2026-06-18 15:08:20,185 - optuna.study.study - INFO - Trial 214 finished with values: [0.0033289426275646262, 0.0008178603006189213, 0.002206624203788309] and parameters: {'n_layers': 4, 'embedding_dim': 64, 'lr': 0.0005796526912711289, 'lambda_val': 1.455259422316608e-06, 'batch_size': 801, 'optimizer': 'Adam'}.
2026-06-18 15:09:43,297 - experiment_functions - INFO - Early stopping at epoch 1950. Best Metrics: (0.003563161902876147, 0.0009283819628647216, 0.002244342501264886)
2026-06-18 15:09:43,402 - optuna.study.study - INFO - Trial 215 finished with values: [0.003563161902876147, 0.0009283819628647216, 0.002244342501264886] and parameters: {'n_layers': 4, 'embedding_dim': 64, 'lr': 0.0010214376144180076, 'lambda_val': 2.7945521753203373e-05, 'batch_size': 1789, 'optimizer': 'RMSprop'}.
2026-06-18 15:10:12,258 - experiment_functions - INFO - Early stopping at epoch 500. Best Metrics: (0.0021463081217900242, 0.0005194518125552608, 0.0014603871629299578)
2026-06-18 15:10:12,358 - optuna.study.study - INFO - Trial 216 finished with values: [0.0021463081217900242, 0.0005194518125552608, 0.0014603871629299578] and parameters: {'n_layers': 4, 'embedding_dim': 256, 'lr': 0.0350079541109871, 'lambda_val': 1.3344718493912024e-05, 'batch_size': 2775, 'optimizer': 'RMSprop'}.
2026-06-18 15:10:43,372 - experiment_functions - INFO - Early stopping at epoch 750. Best Metrics: (0.00367501237710962, 0.0008004926108374383, 0.0022567072406446302)
2026-06-18 15:10:43,478 - optuna.study.study - INFO - Trial 217 finished with values: [0.00367501237710962, 0.0008004926108374383, 0.0022567072406446302] and parameters: {'n_layers': 1, 'embedding_dim': 32, 'lr': 0.002487565347422212, 'lambda_val': 1.3344718493912024e-05, 'batch_size': 892, 'optimizer': 'RMSprop'}.
2026-06-18 15:11:10,209 - experiment_functions - INFO - Early stopping at epoch 550. Best Metrics: (0.002412890060624079, 0.0006236579512441581, 0.0016226391883706597)
2026-06-18 15:11:10,313 - optuna.study.study - INFO - Trial 218 finished with values: [0.002412890060624079, 0.0006236579512441581, 0.0016226391883706597] and parameters: {'n_layers': 3, 'embedding_dim': 96, 'lr': 0.017809095345899344, 'lambda_val': 2.7945521753203373e-05, 'batch_size': 3701, 'optimizer': 'RMSprop'}.
2026-06-18 15:13:23,426 - experiment_functions - INFO - Early stopping at epoch 2900. Best Metrics: (0.0033047962248386395, 0.0008415435139573071, 0.002093224042950856)
2026-06-18 15:13:23,533 - optuna.study.study - INFO - Trial 219 finished with values: [0.0033047962248386395, 0.0008415435139573071, 0.002093224042950856] and parameters: {'n_layers': 4, 'embedding_dim': 128, 'lr': 0.00054735960254125, 'lambda_val': 9.43829822749537e-06, 'batch_size': 3005, 'optimizer': 'Adam'}.
2026-06-18 15:13:58,494 - experiment_functions - INFO - Early stopping at epoch 800. Best Metrics: (0.0034387825761034198, 0.0007957559681697614, 0.0021563086460598467)
2026-06-18 15:13:59,270 - optuna.study.study - INFO - Trial 220 finished with values: [0.0034387825761034198, 0.0007957559681697614, 0.0021563086460598467] and parameters: {'n_layers': 2, 'embedding_dim': 96, 'lr': 0.002487565347422212, 'lambda_val': 0.0006374846333108912, 'batch_size': 649, 'optimizer': 'RMSprop'}.
2026-06-18 15:15:06,563 - experiment_functions - INFO - Early stopping at epoch 1500. Best Metrics: (0.004276172296691807, 0.0010515346722243274, 0.002675169076459096)
2026-06-18 15:15:06,666 - optuna.study.study - INFO - Trial 221 finished with values: [0.004276172296691807, 0.0010515346722243274, 0.002675169076459096] and parameters: {'n_layers': 3, 'embedding_dim': 128, 'lr': 0.001229746147020764, 'lambda_val': 2.7945521753203373e-05, 'batch_size': 801, 'optimizer': 'RMSprop'}.
2026-06-18 15:17:44,786 - optuna.study.study - INFO - Trial 222 finished with values: [0.0020053568188624546, 0.00040103574586333214, 0.0011932504247275124] and parameters: {'n_layers': 3, 'embedding_dim': 32, 'lr': 0.00016664259174545122, 'lambda_val': 1.455259422316608e-06, 'batch_size': 2199, 'optimizer': 'Adam'}.
2026-06-18 15:18:29,233 - experiment_functions - INFO - Early stopping at epoch 800. Best Metrics: (0.003414386053232569, 0.0009015409877478844, 0.002186803610226262)
2026-06-18 15:18:29,335 - optuna.study.study - INFO - Trial 223 finished with values: [0.003414386053232569, 0.0009015409877478844, 0.002186803610226262] and parameters: {'n_layers': 4, 'embedding_dim': 256, 'lr': 0.002487565347422212, 'lambda_val': 4.669465121966091e-06, 'batch_size': 892, 'optimizer': 'RMSprop'}.
2026-06-18 15:19:01,209 - experiment_functions - INFO - Early stopping at epoch 700. Best Metrics: (0.0032837029731458836, 0.0008699633699633701, 0.0021424100756254343)
2026-06-18 15:19:01,306 - optuna.study.study - INFO - Trial 224 finished with values: [0.0032837029731458836, 0.0008699633699633701, 0.0021424100756254343] and parameters: {'n_layers': 3, 'embedding_dim': 96, 'lr': 0.0035939494204294854, 'lambda_val': 0.00029123929001349135, 'batch_size': 945, 'optimizer': 'RMSprop'}.
2026-06-18 15:19:46,294 - experiment_functions - INFO - Early stopping at epoch 950. Best Metrics: (0.0035276381886731227, 0.0008968043450802072, 0.0022696554146531024)
2026-06-18 15:19:46,405 - optuna.study.study - INFO - Trial 225 finished with values: [0.0035276381886731227, 0.0008968043450802072, 0.0022696554146531024] and parameters: {'n_layers': 4, 'embedding_dim': 128, 'lr': 0.0016391721585660463, 'lambda_val': 1.455259422316608e-06, 'batch_size': 2199, 'optimizer': 'RMSprop'}.
2026-06-18 15:22:15,714 - experiment_functions - INFO - Early stopping at epoch 2950. Best Metrics: (0.003446884419816493, 0.0008904888215233042, 0.0020963295952045095)
2026-06-18 15:22:15,817 - optuna.study.study - INFO - Trial 226 finished with values: [0.003446884419816493, 0.0008904888215233042, 0.0020963295952045095] and parameters: {'n_layers': 3, 'embedding_dim': 256, 'lr': 0.0010214376144180076, 'lambda_val': 1.455259422316608e-06, 'batch_size': 2863, 'optimizer': 'RMSprop'}.
2026-06-18 15:22:44,394 - experiment_functions - INFO - Early stopping at epoch 650. Best Metrics: (0.0004366800689646577, 0.00011052166224580017, 0.00025630794881330326)
2026-06-18 15:22:44,496 - optuna.study.study - INFO - Trial 227 finished with values: [0.0004366800689646577, 0.00011052166224580017, 0.00025630794881330326] and parameters: {'n_layers': 2, 'embedding_dim': 64, 'lr': 2.394900497385361e-05, 'lambda_val': 0.0009815822927788517, 'batch_size': 801, 'optimizer': 'RMSprop'}.
2026-06-18 15:23:30,807 - experiment_functions - INFO - Early stopping at epoch 1100. Best Metrics: (0.0037604034159742336, 0.0009189086775293672, 0.0024177963303527996)
2026-06-18 15:23:30,915 - optuna.study.study - INFO - Trial 228 finished with values: [0.0037604034159742336, 0.0009189086775293672, 0.0024177963303527996] and parameters: {'n_layers': 4, 'embedding_dim': 32, 'lr': 0.002487565347422212, 'lambda_val': 1.3344718493912024e-05, 'batch_size': 892, 'optimizer': 'RMSprop'}.
2026-06-18 15:24:36,630 - experiment_functions - INFO - Early stopping at epoch 1500. Best Metrics: (0.003582589733885799, 0.0009441707717569787, 0.0022537723897820554)
2026-06-18 15:24:36,733 - optuna.study.study - INFO - Trial 229 finished with values: [0.003582589733885799, 0.0009441707717569787, 0.0022537723897820554] and parameters: {'n_layers': 3, 'embedding_dim': 96, 'lr': 0.001229746147020764, 'lambda_val': 2.7945521753203373e-05, 'batch_size': 1789, 'optimizer': 'RMSprop'}.
2026-06-18 15:25:54,819 - experiment_functions - INFO - Early stopping at epoch 1900. Best Metrics: (0.003535666687820283, 0.0008525956801818871, 0.0022163007881448255)
2026-06-18 15:25:54,924 - optuna.study.study - INFO - Trial 230 finished with values: [0.003535666687820283, 0.0008525956801818871, 0.0022163007881448255] and parameters: {'n_layers': 4, 'embedding_dim': 32, 'lr': 0.001332731741784367, 'lambda_val': 1.7089177370137862e-06, 'batch_size': 801, 'optimizer': 'Adam'}.
2026-06-18 15:26:25,323 - experiment_functions - INFO - Early stopping at epoch 700. Best Metrics: (0.003111006389765548, 0.0008115447770620184, 0.0020194396888195865)
2026-06-18 15:26:25,432 - optuna.study.study - INFO - Trial 231 finished with values: [0.003111006389765548, 0.0008115447770620184, 0.0020194396888195865] and parameters: {'n_layers': 4, 'embedding_dim': 32, 'lr': 0.0036999694376910314, 'lambda_val': 1.3344718493912024e-05, 'batch_size': 2577, 'optimizer': 'RMSprop'}.
2026-06-18 15:29:27,951 - optuna.study.study - INFO - Trial 232 finished with values: [0.00320325816907169, 0.0007815460401667298, 0.002040134037446017] and parameters: {'n_layers': 4, 'embedding_dim': 128, 'lr': 0.00031499139279171867, 'lambda_val': 3.407921224690668e-06, 'batch_size': 1520, 'optimizer': 'Adam'}.
2026-06-18 15:29:59,660 - experiment_functions - INFO - Early stopping at epoch 550. Best Metrics: (0.0023215924405216967, 0.000596816976127321, 0.0015546868925553612)
2026-06-18 15:29:59,758 - optuna.study.study - INFO - Trial 233 finished with values: [0.0023215924405216967, 0.000596816976127321, 0.0015546868925553612] and parameters: {'n_layers': 4, 'embedding_dim': 256, 'lr': 0.04732380083551678, 'lambda_val': 9.43829822749537e-06, 'batch_size': 1305, 'optimizer': 'RMSprop'}.
2026-06-18 15:32:38,206 - experiment_functions - INFO - Early stopping at epoch 3800. Best Metrics: (0.0028096391280366243, 0.0006220790703549324, 0.0016893324684078633)
2026-06-18 15:32:38,333 - optuna.study.study - INFO - Trial 234 finished with values: [0.0028096391280366243, 0.0006220790703549324, 0.0016893324684078633] and parameters: {'n_layers': 1, 'embedding_dim': 128, 'lr': 0.00054735960254125, 'lambda_val': 1.455259422316608e-06, 'batch_size': 2199, 'optimizer': 'Adam'}.
2026-06-18 15:33:34,035 - experiment_functions - INFO - Early stopping at epoch 1350. Best Metrics: (0.003643171540416637, 0.0008131236579512442, 0.0023740873788233364)
2026-06-18 15:33:34,134 - optuna.study.study - INFO - Trial 235 finished with values: [0.003643171540416637, 0.0008131236579512442, 0.0023740873788233364] and parameters: {'n_layers': 3, 'embedding_dim': 32, 'lr': 0.001229746147020764, 'lambda_val': 9.197331405871651e-06, 'batch_size': 1942, 'optimizer': 'RMSprop'}.
2026-06-18 15:36:20,339 - optuna.study.study - INFO - Trial 236 finished with values: [0.0009261626584989163, 0.00018630794492863458, 0.00048031397830699315] and parameters: {'n_layers': 4, 'embedding_dim': 64, 'lr': 5.056159590243253e-05, 'lambda_val': 9.43829822749537e-06, 'batch_size': 1789, 'optimizer': 'RMSprop'}.
2026-06-18 15:39:01,517 - optuna.study.study - INFO - Trial 237 finished with values: [0.0013584075249539341, 0.0002826196791714033, 0.0007195639851730807] and parameters: {'n_layers': 4, 'embedding_dim': 32, 'lr': 9.361147507671157e-05, 'lambda_val': 1.3344718493912024e-05, 'batch_size': 3005, 'optimizer': 'RMSprop'}.
2026-06-18 15:40:36,721 - experiment_functions - INFO - Early stopping at epoch 2050. Best Metrics: (0.003917112532310451, 0.0010199570544398133, 0.0024201578581052375)
2026-06-18 15:40:36,847 - optuna.study.study - INFO - Trial 238 finished with values: [0.003917112532310451, 0.0010199570544398133, 0.0024201578581052375] and parameters: {'n_layers': 4, 'embedding_dim': 128, 'lr': 0.002025300477572928, 'lambda_val': 3.83795684112999e-06, 'batch_size': 649, 'optimizer': 'RMSprop'}.
2026-06-18 15:41:10,076 - experiment_functions - INFO - Early stopping at epoch 750. Best Metrics: (0.0028370122906549566, 0.0007389162561576354, 0.0018790026313654459)
2026-06-18 15:41:10,324 - optuna.study.study - INFO - Trial 239 finished with values: [0.0028370122906549566, 0.0007389162561576354, 0.0018790026313654459] and parameters: {'n_layers': 3, 'embedding_dim': 64, 'lr': 0.002487565347422212, 'lambda_val': 1.7089177370137862e-06, 'batch_size': 3090, 'optimizer': 'RMSprop'}.
2026-06-18 15:41:50,266 - experiment_functions - INFO - Early stopping at epoch 700. Best Metrics: (0.0036715245206707043, 0.00089206770241253, 0.002280058670848429)
2026-06-18 15:41:50,623 - optuna.study.study - INFO - Trial 240 finished with values: [0.0036715245206707043, 0.00089206770241253, 0.002280058670848429] and parameters: {'n_layers': 4, 'embedding_dim': 256, 'lr': 0.002487565347422212, 'lambda_val': 5.672639985302811e-06, 'batch_size': 892, 'optimizer': 'Adam'}.
2026-06-18 15:44:10,046 - experiment_functions - INFO - Early stopping at epoch 3350. Best Metrics: (0.003165611512271245, 0.0007262852090438297, 0.00196750447754871)
2026-06-18 15:44:10,152 - optuna.study.study - INFO - Trial 241 finished with values: [0.003165611512271245, 0.0007262852090438297, 0.00196750447754871] and parameters: {'n_layers': 1, 'embedding_dim': 128, 'lr': 0.0005796526912711289, 'lambda_val': 5.759063294226392e-05, 'batch_size': 1520, 'optimizer': 'RMSprop'}.
2026-06-18 15:45:14,032 - experiment_functions - INFO - Early stopping at epoch 1150. Best Metrics: (0.0034503735137479848, 0.0008968043450802071, 0.002143240112440209)
2026-06-18 15:45:14,146 - optuna.study.study - INFO - Trial 242 finished with values: [0.0034503735137479848, 0.0008968043450802071, 0.002143240112440209] and parameters: {'n_layers': 4, 'embedding_dim': 256, 'lr': 0.002487565347422212, 'lambda_val': 5.672639985302811e-06, 'batch_size': 892, 'optimizer': 'Adam'}.
2026-06-18 15:45:51,183 - experiment_functions - INFO - Early stopping at epoch 650. Best Metrics: (0.00312005369923608, 0.0008115447770620186, 0.001977243763162541)
2026-06-18 15:45:51,317 - optuna.study.study - INFO - Trial 243 finished with values: [0.00312005369923608, 0.0008115447770620186, 0.001977243763162541] and parameters: {'n_layers': 4, 'embedding_dim': 256, 'lr': 0.0014232781107049574, 'lambda_val': 0.0010339430296944644, 'batch_size': 2199, 'optimizer': 'RMSprop'}.
2026-06-18 15:48:56,798 - experiment_functions - INFO - Early stopping at epoch 3900. Best Metrics: (0.003850538619236353, 0.0008952254641909815, 0.0024443673882598624)
2026-06-18 15:48:56,903 - optuna.study.study - INFO - Trial 244 finished with values: [0.003850538619236353, 0.0008952254641909815, 0.0024443673882598624] and parameters: {'n_layers': 2, 'embedding_dim': 256, 'lr': 0.0005796526912711289, 'lambda_val': 5.672639985302811e-06, 'batch_size': 945, 'optimizer': 'RMSprop'}.
2026-06-18 15:49:39,857 - experiment_functions - INFO - Early stopping at epoch 1000. Best Metrics: (0.0031853709321408847, 0.0007578628268283441, 0.0020259960995430205)
2026-06-18 15:49:39,967 - optuna.study.study - INFO - Trial 245 finished with values: [0.0031853709321408847, 0.0007578628268283441, 0.0020259960995430205] and parameters: {'n_layers': 4, 'embedding_dim': 32, 'lr': 0.0012147488069171326, 'lambda_val': 0.00029123929001349135, 'batch_size': 3617, 'optimizer': 'RMSprop'}.
2026-06-18 15:50:12,473 - experiment_functions - INFO - Early stopping at epoch 750. Best Metrics: (0.0037581217692178818, 0.0008557534419603386, 0.002280891082898783)
2026-06-18 15:50:12,587 - optuna.study.study - INFO - Trial 246 finished with values: [0.0037581217692178818, 0.0008557534419603386, 0.002280891082898783] and parameters: {'n_layers': 3, 'embedding_dim': 32, 'lr': 0.003855829449851487, 'lambda_val': 2.7945521753203373e-05, 'batch_size': 892, 'optimizer': 'Adam'}.
2026-06-18 15:52:35,031 - experiment_functions - INFO - Early stopping at epoch 3200. Best Metrics: (0.003305555770331823, 0.0008399646330680814, 0.002034917471352523)
2026-06-18 15:52:35,659 - optuna.study.study - INFO - Trial 247 finished with values: [0.003305555770331823, 0.0008399646330680814, 0.002034917471352523] and parameters: {'n_layers': 3, 'embedding_dim': 128, 'lr': 0.0005796526912711289, 'lambda_val': 1.0687219886452036e-06, 'batch_size': 3953, 'optimizer': 'RMSprop'}.
2026-06-18 15:53:36,808 - experiment_functions - INFO - Early stopping at epoch 1100. Best Metrics: (0.0034924615286545556, 0.0008936465833017556, 0.0021430527332243054)
2026-06-18 15:53:36,912 - optuna.study.study - INFO - Trial 248 finished with values: [0.0034924615286545556, 0.0008936465833017556, 0.0021430527332243054] and parameters: {'n_layers': 4, 'embedding_dim': 256, 'lr': 0.002487565347422212, 'lambda_val': 3.555884843874079e-05, 'batch_size': 1520, 'optimizer': 'Adam'}.
2026-06-18 15:54:22,741 - experiment_functions - INFO - Early stopping at epoch 950. Best Metrics: (0.0035874242889539594, 0.0009062776304155616, 0.0022558048100174964)
2026-06-18 15:54:22,849 - optuna.study.study - INFO - Trial 249 finished with values: [0.0035874242889539594, 0.0009062776304155616, 0.0022558048100174964] and parameters: {'n_layers': 4, 'embedding_dim': 128, 'lr': 0.0016391721585660463, 'lambda_val': 6.474581689651504e-05, 'batch_size': 1664, 'optimizer': 'RMSprop'}.
2026-06-18 15:55:12,163 - experiment_functions - INFO - Early stopping at epoch 1200. Best Metrics: (0.0006704905965661474, 0.0001326259946949602, 0.0003471259221680034)
2026-06-18 15:55:12,264 - optuna.study.study - INFO - Trial 250 finished with values: [0.0006704905965661474, 0.0001326259946949602, 0.0003471259221680034] and parameters: {'n_layers': 4, 'embedding_dim': 32, 'lr': 2.9665655439746177e-05, 'lambda_val': 4.669465121966091e-06, 'batch_size': 892, 'optimizer': 'RMSprop'}.
2026-06-18 15:58:29,848 - optuna.study.study - INFO - Trial 251 finished with values: [0.00271342893374216, 0.0006489200454717697, 0.0017363888885470746] and parameters: {'n_layers': 3, 'embedding_dim': 256, 'lr': 0.0002698526950112619, 'lambda_val': 5.672639985302811e-06, 'batch_size': 892, 'optimizer': 'RMSprop'}.
2026-06-18 15:59:14,187 - experiment_functions - INFO - Early stopping at epoch 800. Best Metrics: (0.0033431203721314582, 0.0008810155361879499, 0.002080193087233308)
2026-06-18 15:59:14,294 - optuna.study.study - INFO - Trial 252 finished with values: [0.0033431203721314582, 0.0008810155361879499, 0.002080193087233308] and parameters: {'n_layers': 4, 'embedding_dim': 256, 'lr': 0.0016391721585660463, 'lambda_val': 1.455259422316608e-06, 'batch_size': 2199, 'optimizer': 'RMSprop'}.
2026-06-18 16:00:31,545 - experiment_functions - INFO - Early stopping at epoch 1900. Best Metrics: (0.003622504647665854, 0.0008936465833017557, 0.002380079649446059)
2026-06-18 16:00:31,634 - optuna.study.study - INFO - Trial 253 finished with values: [0.003622504647665854, 0.0008936465833017557, 0.002380079649446059] and parameters: {'n_layers': 4, 'embedding_dim': 32, 'lr': 0.0010214376144180076, 'lambda_val': 0.00029123929001349135, 'batch_size': 945, 'optimizer': 'Adam'}.
2026-06-18 16:01:01,150 - experiment_functions - INFO - Early stopping at epoch 600. Best Metrics: (0.0037382480168760587, 0.0009315397246431729, 0.00238761676590455)
2026-06-18 16:01:01,249 - optuna.study.study - INFO - Trial 254 finished with values: [0.0037382480168760587, 0.0009315397246431729, 0.00238761676590455] and parameters: {'n_layers': 4, 'embedding_dim': 128, 'lr': 0.002487565347422212, 'lambda_val': 5.672639985302811e-06, 'batch_size': 801, 'optimizer': 'RMSprop'}.
2026-06-18 16:01:57,250 - experiment_functions - INFO - Early stopping at epoch 1250. Best Metrics: (0.004005493301117133, 0.0010120626499936843, 0.0025763310901634785)
