2026-06-22 13:16:15,804 - optuna.study.study - INFO - Trial 146 finished with values: [0.032720325427768586, 0.006880762915245674, 0.01843895740027413] and parameters: {'n_layers': 1, 'embedding_dim': 32, 'lr': 0.0010694394042823291, 'lambda_val': 1.3761340713703872e-05, 'batch_size': 1785, 'optimizer': 'RMSprop'}.
2026-06-22 13:18:23,830 - experiment_functions - INFO - Early stopping at epoch 3100. Best Metrics: (0.03268372861029602, 0.006901288366805609, 0.018407534164015072)
2026-06-22 13:18:23,908 - optuna.study.study - INFO - Trial 147 finished with values: [0.03268372861029602, 0.006901288366805609, 0.018407534164015072] and parameters: {'n_layers': 1, 'embedding_dim': 32, 'lr': 0.0009993547791746632, 'lambda_val': 0.00011379660469282507, 'batch_size': 2116, 'optimizer': 'RMSprop'}.
2026-06-22 13:19:41,620 - experiment_functions - INFO - Early stopping at epoch 1750. Best Metrics: (0.004482391698571326, 0.0010120626499936843, 0.0025423592670344125)
2026-06-22 13:19:41,699 - optuna.study.study - INFO - Trial 148 finished with values: [0.004482391698571326, 0.0010120626499936843, 0.0025423592670344125] and parameters: {'n_layers': 3, 'embedding_dim': 64, 'lr': 0.006755951067799471, 'lambda_val': 0.01010441170406253, 'batch_size': 2290, 'optimizer': 'RMSprop'}.
2026-06-22 13:20:14,053 - experiment_functions - INFO - Early stopping at epoch 700. Best Metrics: (0.027729187065594584, 0.005875015788808892, 0.015804437151633502)
2026-06-22 13:20:14,134 - optuna.study.study - INFO - Trial 149 finished with values: [0.027729187065594584, 0.005875015788808892, 0.015804437151633502] and parameters: {'n_layers': 1, 'embedding_dim': 96, 'lr': 0.004316399830411133, 'lambda_val': 0.00011379660469282507, 'batch_size': 2116, 'optimizer': 'Adam'}.
2026-06-22 13:20:36,804 - experiment_functions - INFO - Early stopping at epoch 500. Best Metrics: (0.00044458797830257846, 0.00010420613868889732, 0.0002695201725866699)
2026-06-22 13:20:36,904 - optuna.study.study - INFO - Trial 150 finished with values: [0.00044458797830257846, 0.00010420613868889732, 0.0002695201725866699] and parameters: {'n_layers': 1, 'embedding_dim': 64, 'lr': 0.0030078366574997767, 'lambda_val': 0.00023620858897053303, 'batch_size': 2360, 'optimizer': 'SGD'}.
2026-06-22 13:21:56,991 - experiment_functions - INFO - Early stopping at epoch 1600. Best Metrics: (0.03149931351807495, 0.006563407856511306, 0.017894709812570353)
2026-06-22 13:21:57,076 - optuna.study.study - INFO - Trial 151 finished with values: [0.03149931351807495, 0.006563407856511306, 0.017894709812570353] and parameters: {'n_layers': 1, 'embedding_dim': 256, 'lr': 0.0010694394042823291, 'lambda_val': 5.915966748772391e-06, 'batch_size': 3537, 'optimizer': 'RMSprop'}.
2026-06-22 13:24:21,499 - experiment_functions - INFO - Early stopping at epoch 3050. Best Metrics: (0.029127100860246183, 0.0061876342048755835, 0.0167924713973317)
2026-06-22 13:24:21,573 - optuna.study.study - INFO - Trial 152 finished with values: [0.029127100860246183, 0.0061876342048755835, 0.0167924713973317] and parameters: {'n_layers': 2, 'embedding_dim': 128, 'lr': 0.0005464989571285408, 'lambda_val': 0.0001979130594640894, 'batch_size': 2558, 'optimizer': 'Adam'}.
2026-06-22 13:26:04,302 - experiment_functions - INFO - Early stopping at epoch 1850. Best Metrics: (0.028604493278822855, 0.006163950991537199, 0.016626414626100063)
2026-06-22 13:26:04,374 - optuna.study.study - INFO - Trial 153 finished with values: [0.028604493278822855, 0.006163950991537199, 0.016626414626100063] and parameters: {'n_layers': 2, 'embedding_dim': 256, 'lr': 0.0005652244898304067, 'lambda_val': 1.3761340713703872e-05, 'batch_size': 2558, 'optimizer': 'Adam'}.
2026-06-22 13:26:35,238 - experiment_functions - INFO - Early stopping at epoch 700. Best Metrics: (0.020613804297532914, 0.004427182013388911, 0.01132909410770806)
2026-06-22 13:26:35,340 - optuna.study.study - INFO - Trial 154 finished with values: [0.020613804297532914, 0.004427182013388911, 0.01132909410770806] and parameters: {'n_layers': 1, 'embedding_dim': 32, 'lr': 0.003916255753855854, 'lambda_val': 4.627893684414806e-05, 'batch_size': 2470, 'optimizer': 'RMSprop'}.
2026-06-22 13:27:28,612 - experiment_functions - INFO - Early stopping at epoch 800. Best Metrics: (0.005916191239728184, 0.0013373121131741823, 0.0031838514945842673)
2026-06-22 13:27:28,703 - optuna.study.study - INFO - Trial 155 finished with values: [0.005916191239728184, 0.0013373121131741823, 0.0031838514945842673] and parameters: {'n_layers': 4, 'embedding_dim': 256, 'lr': 0.0005652244898304067, 'lambda_val': 0.046035593180109, 'batch_size': 3764, 'optimizer': 'RMSprop'}.
2026-06-22 13:30:22,856 - optuna.study.study - INFO - Trial 156 finished with values: [0.032420085235830544, 0.006841290893015031, 0.01886914152713115] and parameters: {'n_layers': 1, 'embedding_dim': 96, 'lr': 0.0006753032109319728, 'lambda_val': 0.00011379660469282507, 'batch_size': 2674, 'optimizer': 'Adam'}.
2026-06-22 13:34:45,507 - optuna.study.study - INFO - Trial 157 finished with values: [0.02333004421514699, 0.0050792598206391305, 0.013350566971015285] and parameters: {'n_layers': 4, 'embedding_dim': 256, 'lr': 0.00018380672173173005, 'lambda_val': 0.00016615513360913103, 'batch_size': 2836, 'optimizer': 'RMSprop'}.
2026-06-22 13:38:03,021 - optuna.study.study - INFO - Trial 158 finished with values: [0.031998814683517354, 0.006842869773904256, 0.01851963443525908] and parameters: {'n_layers': 1, 'embedding_dim': 256, 'lr': 0.0005652244898304067, 'lambda_val': 1.3761340713703872e-05, 'batch_size': 2116, 'optimizer': 'RMSprop'}.
2026-06-22 13:38:34,498 - experiment_functions - INFO - Early stopping at epoch 650. Best Metrics: (0.024083186612888375, 0.005148730579765062, 0.013729504049459272)
2026-06-22 13:38:34,571 - optuna.study.study - INFO - Trial 159 finished with values: [0.024083186612888375, 0.005148730579765062, 0.013729504049459272] and parameters: {'n_layers': 2, 'embedding_dim': 96, 'lr': 0.0030078366574997767, 'lambda_val': 0.00023620858897053303, 'batch_size': 2550, 'optimizer': 'Adam'}.
2026-06-22 13:40:20,835 - experiment_functions - INFO - Early stopping at epoch 2100. Best Metrics: (0.025928550608009374, 0.0054802955665024635, 0.014696031717395683)
2026-06-22 13:40:20,911 - optuna.study.study - INFO - Trial 160 finished with values: [0.025928550608009374, 0.0054802955665024635, 0.014696031717395683] and parameters: {'n_layers': 3, 'embedding_dim': 128, 'lr': 0.00045788482653762934, 'lambda_val': 3.154143842771189e-05, 'batch_size': 2558, 'optimizer': 'Adam'}.
2026-06-22 13:40:49,534 - experiment_functions - INFO - Early stopping at epoch 600. Best Metrics: (0.010730797862408138, 0.0024156877605153466, 0.006301470100821946)
2026-06-22 13:40:49,627 - optuna.study.study - INFO - Trial 161 finished with values: [0.010730797862408138, 0.0024156877605153466, 0.006301470100821946] and parameters: {'n_layers': 1, 'embedding_dim': 128, 'lr': 0.018292994483412973, 'lambda_val': 1.3761340713703872e-05, 'batch_size': 551, 'optimizer': 'Adam'}.
2026-06-22 13:41:40,924 - experiment_functions - INFO - Early stopping at epoch 1200. Best Metrics: (0.03343439397933483, 0.007032335480611343, 0.019354112166616994)
2026-06-22 13:41:41,018 - optuna.study.study - INFO - Trial 162 finished with values: [0.03343439397933483, 0.007032335480611343, 0.019354112166616994] and parameters: {'n_layers': 1, 'embedding_dim': 32, 'lr': 0.0018725355385280041, 'lambda_val': 1.3761340713703872e-05, 'batch_size': 2900, 'optimizer': 'Adam'}.
2026-06-22 13:42:09,230 - experiment_functions - INFO - Early stopping at epoch 500. Best Metrics: (0.0005721538635622966, 0.00012788935202728306, 0.0003064793328351857)
2026-06-22 13:42:09,313 - optuna.study.study - INFO - Trial 163 finished with values: [0.0005721538635622966, 0.00012788935202728306, 0.0003064793328351857] and parameters: {'n_layers': 2, 'embedding_dim': 256, 'lr': 0.041073959396811736, 'lambda_val': 1.3761340713703872e-05, 'batch_size': 3974, 'optimizer': 'SGD'}.
2026-06-22 13:44:47,539 - experiment_functions - INFO - Early stopping at epoch 3600. Best Metrics: (0.01741262788377511, 0.0037529998736895286, 0.009753782970041106)
2026-06-22 13:44:47,625 - optuna.study.study - INFO - Trial 164 finished with values: [0.01741262788377511, 0.0037529998736895286, 0.009753782970041106] and parameters: {'n_layers': 1, 'embedding_dim': 128, 'lr': 0.004316399830411133, 'lambda_val': 0.00011379660469282507, 'batch_size': 2550, 'optimizer': 'RMSprop'}.
2026-06-22 13:45:18,704 - experiment_functions - INFO - Early stopping at epoch 600. Best Metrics: (0.010286074700251583, 0.0023430592396109636, 0.005747555962456591)
2026-06-22 13:45:18,790 - optuna.study.study - INFO - Trial 165 finished with values: [0.010286074700251583, 0.0023430592396109636, 0.005747555962456591] and parameters: {'n_layers': 1, 'embedding_dim': 256, 'lr': 0.008091829333064989, 'lambda_val': 0.0019833934915702706, 'batch_size': 759, 'optimizer': 'Adam'}.
2026-06-22 13:48:14,621 - optuna.study.study - INFO - Trial 166 finished with values: [0.027975307136072537, 0.006099216875078944, 0.016310405967434553] and parameters: {'n_layers': 1, 'embedding_dim': 128, 'lr': 0.0005464989571285408, 'lambda_val': 3.90887208716658e-05, 'batch_size': 1785, 'optimizer': 'RMSprop'}.
2026-06-22 13:50:27,219 - experiment_functions - INFO - Early stopping at epoch 3050. Best Metrics: (0.023169743836714437, 0.004934002778830365, 0.012982090690951787)
2026-06-22 13:50:27,304 - optuna.study.study - INFO - Trial 167 finished with values: [0.023169743836714437, 0.004934002778830365, 0.012982090690951787] and parameters: {'n_layers': 4, 'embedding_dim': 32, 'lr': 0.00045788482653762934, 'lambda_val': 3.154143842771189e-05, 'batch_size': 2558, 'optimizer': 'Adam'}.
2026-06-22 13:52:48,975 - experiment_functions - INFO - Early stopping at epoch 3100. Best Metrics: (0.028482867799305155, 0.006096059113300493, 0.016473878271978565)
2026-06-22 13:52:49,070 - optuna.study.study - INFO - Trial 168 finished with values: [0.028482867799305155, 0.006096059113300493, 0.016473878271978565] and parameters: {'n_layers': 2, 'embedding_dim': 96, 'lr': 0.0005652244898304067, 'lambda_val': 0.00023620858897053303, 'batch_size': 3042, 'optimizer': 'Adam'}.
2026-06-22 13:53:21,702 - experiment_functions - INFO - Early stopping at epoch 700. Best Metrics: (0.029573913829011072, 0.006285524820007579, 0.016869444668263404)
2026-06-22 13:53:21,817 - optuna.study.study - INFO - Trial 169 finished with values: [0.029573913829011072, 0.006285524820007579, 0.016869444668263404] and parameters: {'n_layers': 1, 'embedding_dim': 96, 'lr': 0.003916255753855854, 'lambda_val': 0.0007109535707376064, 'batch_size': 2470, 'optimizer': 'Adam'}.
2026-06-22 13:54:03,185 - experiment_functions - INFO - Early stopping at epoch 900. Best Metrics: (0.02274553870728635, 0.005287672098016926, 0.013036548789051248)
2026-06-22 13:54:03,261 - optuna.study.study - INFO - Trial 170 finished with values: [0.02274553870728635, 0.005287672098016926, 0.013036548789051248] and parameters: {'n_layers': 1, 'embedding_dim': 128, 'lr': 0.001487817598059853, 'lambda_val': 0.01915608437223668, 'batch_size': 2900, 'optimizer': 'Adam'}.
2026-06-22 13:56:47,594 - optuna.study.study - INFO - Trial 171 finished with values: [0.025946573200169076, 0.005690286724769483, 0.015109220728387452] and parameters: {'n_layers': 1, 'embedding_dim': 32, 'lr': 0.0005464989571285408, 'lambda_val': 7.724967695086265e-05, 'batch_size': 2900, 'optimizer': 'RMSprop'}.
2026-06-22 13:57:44,304 - experiment_functions - INFO - Early stopping at epoch 1300. Best Metrics: (0.024061914559605317, 0.0050303145130731345, 0.013264839326186762)
2026-06-22 13:57:44,388 - optuna.study.study - INFO - Trial 172 finished with values: [0.024061914559605317, 0.0050303145130731345, 0.013264839326186762] and parameters: {'n_layers': 1, 'embedding_dim': 64, 'lr': 0.0030078366574997767, 'lambda_val': 3.90887208716658e-05, 'batch_size': 1222, 'optimizer': 'RMSprop'}.
2026-06-22 13:58:24,494 - experiment_functions - INFO - Early stopping at epoch 800. Best Metrics: (0.026355658659388305, 0.005639762536314261, 0.015074404578841022)
2026-06-22 13:58:24,585 - optuna.study.study - INFO - Trial 173 finished with values: [0.026355658659388305, 0.005639762536314261, 0.015074404578841022] and parameters: {'n_layers': 2, 'embedding_dim': 128, 'lr': 0.001487817598059853, 'lambda_val': 0.0001979130594640894, 'batch_size': 2558, 'optimizer': 'Adam'}.
2026-06-22 13:59:03,945 - experiment_functions - INFO - Early stopping at epoch 900. Best Metrics: (0.02895227467482121, 0.0059981684981684985, 0.016062993154307304)
2026-06-22 13:59:04,019 - optuna.study.study - INFO - Trial 174 finished with values: [0.02895227467482121, 0.0059981684981684985, 0.016062993154307304] and parameters: {'n_layers': 1, 'embedding_dim': 32, 'lr': 0.003916255753855854, 'lambda_val': 3.90887208716658e-05, 'batch_size': 2235, 'optimizer': 'Adam'}.
2026-06-22 13:59:32,262 - experiment_functions - INFO - Early stopping at epoch 500. Best Metrics: (0.0003933950393305415, 8.841732979664016e-05, 0.000207754760443196)
2026-06-22 13:59:32,341 - optuna.study.study - INFO - Trial 175 finished with values: [0.0003933950393305415, 8.841732979664016e-05, 0.000207754760443196] and parameters: {'n_layers': 2, 'embedding_dim': 256, 'lr': 0.0005652244898304067, 'lambda_val': 1.3761340713703872e-05, 'batch_size': 862, 'optimizer': 'SGD'}.
2026-06-22 14:03:02,528 - optuna.study.study - INFO - Trial 176 finished with values: [0.02007113424402149, 0.004439813060502716, 0.01129626630451355] and parameters: {'n_layers': 4, 'embedding_dim': 128, 'lr': 0.00016427114027444753, 'lambda_val': 0.00016643563527193303, 'batch_size': 2550, 'optimizer': 'RMSprop'}.
2026-06-22 14:04:04,720 - experiment_functions - INFO - Early stopping at epoch 1350. Best Metrics: (0.03300156497238458, 0.006988126815713023, 0.0192087946782557)
2026-06-22 14:04:04,804 - optuna.study.study - INFO - Trial 177 finished with values: [0.03300156497238458, 0.006988126815713023, 0.0192087946782557] and parameters: {'n_layers': 1, 'embedding_dim': 128, 'lr': 0.001487817598059853, 'lambda_val': 0.0001979130594640894, 'batch_size': 2836, 'optimizer': 'Adam'}.
2026-06-22 14:06:30,450 - experiment_functions - INFO - Early stopping at epoch 3450. Best Metrics: (0.029154323909500242, 0.0062713148920045475, 0.016991743664171305)
2026-06-22 14:06:30,526 - optuna.study.study - INFO - Trial 178 finished with values: [0.029154323909500242, 0.0062713148920045475, 0.016991743664171305] and parameters: {'n_layers': 2, 'embedding_dim': 32, 'lr': 0.0005464989571285408, 'lambda_val': 0.00015679042892799276, 'batch_size': 2836, 'optimizer': 'Adam'}.
2026-06-22 14:06:52,446 - experiment_functions - INFO - Early stopping at epoch 500. Best Metrics: (0.00046778676880789954, 0.00010894278135657447, 0.00027651838931085695)
2026-06-22 14:06:52,530 - optuna.study.study - INFO - Trial 179 finished with values: [0.00046778676880789954, 0.00010894278135657447, 0.00027651838931085695] and parameters: {'n_layers': 1, 'embedding_dim': 32, 'lr': 0.0004399032392053918, 'lambda_val': 0.07673345714652478, 'batch_size': 3764, 'optimizer': 'Adam'}.
2026-06-22 14:07:44,925 - experiment_functions - INFO - Early stopping at epoch 1250. Best Metrics: (0.00045154098910467154, 0.00011367942402425162, 0.0003027047301512413)
2026-06-22 14:07:45,044 - optuna.study.study - INFO - Trial 180 finished with values: [0.00045154098910467154, 0.00011367942402425162, 0.0003027047301512413] and parameters: {'n_layers': 1, 'embedding_dim': 64, 'lr': 0.00016288890660590586, 'lambda_val': 2.374680419860168e-05, 'batch_size': 2116, 'optimizer': 'RMSprop'}.
2026-06-22 14:08:26,023 - experiment_functions - INFO - Early stopping at epoch 800. Best Metrics: (0.020648974885593707, 0.004746115953012504, 0.011566078562712556)
2026-06-22 14:08:26,116 - optuna.study.study - INFO - Trial 181 finished with values: [0.020648974885593707, 0.004746115953012504, 0.011566078562712556] and parameters: {'n_layers': 1, 'embedding_dim': 256, 'lr': 0.001487817598059853, 'lambda_val': 0.021333480390975556, 'batch_size': 4026, 'optimizer': 'Adam'}.
2026-06-22 14:10:09,206 - experiment_functions - INFO - Early stopping at epoch 2150. Best Metrics: (0.02410277129743711, 0.005101364153088291, 0.013776288632322409)
2026-06-22 14:10:09,276 - optuna.study.study - INFO - Trial 182 finished with values: [0.02410277129743711, 0.005101364153088291, 0.013776288632322409] and parameters: {'n_layers': 3, 'embedding_dim': 96, 'lr': 0.0004673948260611741, 'lambda_val': 0.00016615513360913103, 'batch_size': 3039, 'optimizer': 'Adam'}.
2026-06-22 14:10:45,617 - experiment_functions - INFO - Early stopping at epoch 800. Best Metrics: (0.016491824292849108, 0.0034609069091827713, 0.009352353883685768)
2026-06-22 14:10:46,499 - optuna.study.study - INFO - Trial 183 finished with values: [0.016491824292849108, 0.0034609069091827713, 0.009352353883685768] and parameters: {'n_layers': 1, 'embedding_dim': 96, 'lr': 0.004316399830411133, 'lambda_val': 3.90887208716658e-05, 'batch_size': 2550, 'optimizer': 'RMSprop'}.
2026-06-22 14:11:35,958 - experiment_functions - INFO - Early stopping at epoch 800. Best Metrics: (0.011675153000662035, 0.0025972590627763043, 0.006349899621891747)
2026-06-22 14:11:36,050 - optuna.study.study - INFO - Trial 184 finished with values: [0.011675153000662035, 0.0025972590627763043, 0.006349899621891747] and parameters: {'n_layers': 3, 'embedding_dim': 256, 'lr': 0.0005652244898304067, 'lambda_val': 0.01010441170406253, 'batch_size': 2116, 'optimizer': 'RMSprop'}.
2026-06-22 14:14:23,634 - experiment_functions - INFO - Early stopping at epoch 3950. Best Metrics: (0.032205910692901026, 0.006907603890362512, 0.018145921127494344)
2026-06-22 14:14:23,705 - optuna.study.study - INFO - Trial 185 finished with values: [0.032205910692901026, 0.006907603890362512, 0.018145921127494344] and parameters: {'n_layers': 1, 'embedding_dim': 64, 'lr': 0.0006753032109319728, 'lambda_val': 0.00011379660469282507, 'batch_size': 2674, 'optimizer': 'RMSprop'}.
2026-06-22 14:14:54,803 - experiment_functions - INFO - Early stopping at epoch 600. Best Metrics: (0.010395488160850326, 0.0023525325249463187, 0.006127278871740058)
2026-06-22 14:14:54,879 - optuna.study.study - INFO - Trial 186 finished with values: [0.010395488160850326, 0.0023525325249463187, 0.006127278871740058] and parameters: {'n_layers': 1, 'embedding_dim': 256, 'lr': 0.012496828920097607, 'lambda_val': 1.3761340713703872e-05, 'batch_size': 556, 'optimizer': 'Adam'}.
2026-06-22 14:16:55,847 - experiment_functions - INFO - Early stopping at epoch 2900. Best Metrics: (0.03343482788772073, 0.006986547934823798, 0.01942605638346407)
2026-06-22 14:16:55,938 - optuna.study.study - INFO - Trial 187 finished with values: [0.03343482788772073, 0.006986547934823798, 0.01942605638346407] and parameters: {'n_layers': 1, 'embedding_dim': 32, 'lr': 0.0010694394042823291, 'lambda_val': 3.90887208716658e-05, 'batch_size': 2116, 'optimizer': 'RMSprop'}.
2026-06-22 14:18:40,044 - experiment_functions - INFO - Early stopping at epoch 2500. Best Metrics: (0.0345520054278309, 0.00719180245042314, 0.019776882214942296)
2026-06-22 14:18:40,115 - optuna.study.study - INFO - Trial 188 finished with values: [0.0345520054278309, 0.00719180245042314, 0.019776882214942296] and parameters: {'n_layers': 1, 'embedding_dim': 32, 'lr': 0.0009993547791746632, 'lambda_val': 0.00011379660469282507, 'batch_size': 2836, 'optimizer': 'RMSprop'}.
2026-06-22 14:21:35,306 - optuna.study.study - INFO - Trial 189 finished with values: [0.0008885239619071641, 0.00022104332449160037, 0.0005141613994472449] and parameters: {'n_layers': 2, 'embedding_dim': 96, 'lr': 0.00014222833296335973, 'lambda_val': 0.00016615513360913103, 'batch_size': 2161, 'optimizer': 'Adam'}.
2026-06-22 14:22:18,306 - experiment_functions - INFO - Early stopping at epoch 750. Best Metrics: (0.023870344836455063, 0.005044524441076165, 0.013431293881126934)
2026-06-22 14:22:18,389 - optuna.study.study - INFO - Trial 190 finished with values: [0.023870344836455063, 0.005044524441076165, 0.013431293881126934] and parameters: {'n_layers': 2, 'embedding_dim': 256, 'lr': 0.001487817598059853, 'lambda_val': 0.0019833934915702706, 'batch_size': 2550, 'optimizer': 'Adam'}.
2026-06-22 14:24:07,491 - experiment_functions - INFO - Early stopping at epoch 2600. Best Metrics: (0.02568044965926556, 0.005653972464317292, 0.014577895731066187)
2026-06-22 14:24:07,565 - optuna.study.study - INFO - Trial 191 finished with values: [0.02568044965926556, 0.005653972464317292, 0.014577895731066187] and parameters: {'n_layers': 2, 'embedding_dim': 32, 'lr': 0.0005652244898304067, 'lambda_val': 0.007994385715315203, 'batch_size': 1785, 'optimizer': 'Adam'}.
2026-06-22 14:24:50,907 - experiment_functions - INFO - Early stopping at epoch 1000. Best Metrics: (0.030764362891967902, 0.006498673740053051, 0.017873198996929122)
2026-06-22 14:24:51,006 - optuna.study.study - INFO - Trial 192 finished with values: [0.030764362891967902, 0.006498673740053051, 0.017873198996929122] and parameters: {'n_layers': 1, 'embedding_dim': 32, 'lr': 0.0018725355385280041, 'lambda_val': 3.90887208716658e-05, 'batch_size': 1785, 'optimizer': 'RMSprop'}.
2026-06-22 14:25:20,158 - experiment_functions - INFO - Early stopping at epoch 600. Best Metrics: (0.02077539656612468, 0.004485600606290262, 0.011225431122952918)
