2026-06-18 00:32:40,218 - optuna.study.study - INFO - Trial 151 finished with values: [0.002748832223706531, 0.0006757610205886069, 0.001761104169067215] and parameters: {'n_layers': 4, 'embedding_dim': 64, 'lr': 0.0006197690834854795, 'lambda_val': 0.006986427337292849, 'batch_size': 2717, 'optimizer': 'Adam'}.
2026-06-18 00:33:47,606 - experiment_functions - INFO - Early stopping at epoch 1550. Best Metrics: (0.0031067838118040976, 0.0008257547050650498, 0.0019789412738294033)
2026-06-18 00:33:47,730 - optuna.study.study - INFO - Trial 152 finished with values: [0.0031067838118040976, 0.0008257547050650498, 0.0019789412738294033] and parameters: {'n_layers': 4, 'embedding_dim': 64, 'lr': 0.0006197690834854795, 'lambda_val': 0.0029189913769167002, 'batch_size': 2162, 'optimizer': 'RMSprop'}.
2026-06-18 00:34:12,316 - experiment_functions - INFO - Early stopping at epoch 500. Best Metrics: (0.00048406042408371896, 0.00011210054313502591, 0.000253270866699822)
2026-06-18 00:34:12,432 - optuna.study.study - INFO - Trial 153 finished with values: [0.00048406042408371896, 0.00011210054313502591, 0.000253270866699822] and parameters: {'n_layers': 3, 'embedding_dim': 128, 'lr': 0.002692587283514102, 'lambda_val': 7.431054110368361e-06, 'batch_size': 526, 'optimizer': 'SGD'}.
2026-06-18 00:35:13,069 - experiment_functions - INFO - Early stopping at epoch 1300. Best Metrics: (0.003306244878644172, 0.0008304913477327272, 0.0021073282172791863)
2026-06-18 00:35:13,167 - optuna.study.study - INFO - Trial 154 finished with values: [0.003306244878644172, 0.0008304913477327272, 0.0021073282172791863] and parameters: {'n_layers': 3, 'embedding_dim': 128, 'lr': 0.0012789814817663495, 'lambda_val': 2.9025613182499857e-06, 'batch_size': 3625, 'optimizer': 'RMSprop'}.
2026-06-18 00:35:40,858 - experiment_functions - INFO - Early stopping at epoch 500. Best Metrics: (0.0016959476128066441, 0.0004468232916508779, 0.0011404541974399112)
2026-06-18 00:35:40,958 - optuna.study.study - INFO - Trial 155 finished with values: [0.0016959476128066441, 0.0004468232916508779, 0.0011404541974399112] and parameters: {'n_layers': 3, 'embedding_dim': 256, 'lr': 0.054915591727147925, 'lambda_val': 3.6404845826373614e-05, 'batch_size': 3948, 'optimizer': 'RMSprop'}.
2026-06-18 00:36:36,714 - experiment_functions - INFO - Early stopping at epoch 1300. Best Metrics: (0.003461821335767232, 0.0007436528988253125, 0.0020726839944256864)
2026-06-18 00:36:36,821 - optuna.study.study - INFO - Trial 156 finished with values: [0.003461821335767232, 0.0007436528988253125, 0.0020726839944256864] and parameters: {'n_layers': 1, 'embedding_dim': 32, 'lr': 0.0009259265868741952, 'lambda_val': 3.576975505685731e-06, 'batch_size': 2987, 'optimizer': 'RMSprop'}.
2026-06-18 00:37:10,964 - experiment_functions - INFO - Early stopping at epoch 750. Best Metrics: (0.002809569050959099, 0.0006962864721485411, 0.0018052856280381436)
2026-06-18 00:37:11,118 - optuna.study.study - INFO - Trial 157 finished with values: [0.002809569050959099, 0.0006962864721485411, 0.0018052856280381436] and parameters: {'n_layers': 2, 'embedding_dim': 64, 'lr': 0.0071378175069858425, 'lambda_val': 5.470239525476512e-06, 'batch_size': 810, 'optimizer': 'RMSprop'}.
2026-06-18 00:38:14,789 - experiment_functions - INFO - Early stopping at epoch 1400. Best Metrics: (0.0023603631637350996, 0.0006268157130226095, 0.0014828592668729526)
2026-06-18 00:38:14,895 - optuna.study.study - INFO - Trial 158 finished with values: [0.0023603631637350996, 0.0006268157130226095, 0.0014828592668729526] and parameters: {'n_layers': 4, 'embedding_dim': 64, 'lr': 0.0006990102643278918, 'lambda_val': 0.03953931112392224, 'batch_size': 1884, 'optimizer': 'Adam'}.
2026-06-18 00:39:51,648 - experiment_functions - INFO - Early stopping at epoch 2150. Best Metrics: (0.003668419426195246, 0.0008983832259694329, 0.00225041291636552)
2026-06-18 00:39:51,835 - optuna.study.study - INFO - Trial 159 finished with values: [0.003668419426195246, 0.0008983832259694329, 0.00225041291636552] and parameters: {'n_layers': 4, 'embedding_dim': 64, 'lr': 0.0006990102643278918, 'lambda_val': 1.3372662561958538e-06, 'batch_size': 3334, 'optimizer': 'RMSprop'}.
2026-06-18 00:40:35,317 - experiment_functions - INFO - Early stopping at epoch 950. Best Metrics: (0.0029367411823011144, 0.0006489200454717697, 0.0018408830717736625)
2026-06-18 00:40:35,447 - optuna.study.study - INFO - Trial 160 finished with values: [0.0029367411823011144, 0.0006489200454717697, 0.0018408830717736625] and parameters: {'n_layers': 1, 'embedding_dim': 128, 'lr': 0.0023699548585448013, 'lambda_val': 2.2322765995099733e-06, 'batch_size': 2139, 'optimizer': 'Adam'}.
2026-06-18 00:41:57,735 - experiment_functions - INFO - Early stopping at epoch 1500. Best Metrics: (0.0033180283595145646, 0.0008620689655172415, 0.0020693967147713418)
2026-06-18 00:41:57,877 - optuna.study.study - INFO - Trial 161 finished with values: [0.0033180283595145646, 0.0008620689655172415, 0.0020693967147713418] and parameters: {'n_layers': 4, 'embedding_dim': 256, 'lr': 0.0006197690834854795, 'lambda_val': 3.6404845826373614e-05, 'batch_size': 2889, 'optimizer': 'RMSprop'}.
2026-06-18 00:42:27,808 - experiment_functions - INFO - Early stopping at epoch 600. Best Metrics: (0.0033050521266990494, 0.0008162814197296956, 0.0020063191805264756)
2026-06-18 00:42:28,190 - optuna.study.study - INFO - Trial 162 finished with values: [0.0033050521266990494, 0.0008162814197296956, 0.0020063191805264756] and parameters: {'n_layers': 4, 'embedding_dim': 128, 'lr': 0.004768609881490324, 'lambda_val': 0.00048067488070277503, 'batch_size': 4066, 'optimizer': 'Adam'}.
2026-06-18 00:43:23,304 - experiment_functions - INFO - Early stopping at epoch 1000. Best Metrics: (0.003413986181533026, 0.00088101553618795, 0.0021032221729564466)
2026-06-18 00:43:23,407 - optuna.study.study - INFO - Trial 163 finished with values: [0.003413986181533026, 0.00088101553618795, 0.0021032221729564466] and parameters: {'n_layers': 4, 'embedding_dim': 256, 'lr': 0.0006674090882881629, 'lambda_val': 0.0015914958177189133, 'batch_size': 1625, 'optimizer': 'RMSprop'}.
2026-06-18 00:43:48,516 - experiment_functions - INFO - Early stopping at epoch 550. Best Metrics: (0.0017892859307894657, 0.0004705065049892636, 0.0011915581287119388)
2026-06-18 00:43:48,622 - optuna.study.study - INFO - Trial 164 finished with values: [0.0017892859307894657, 0.0004705065049892636, 0.0011915581287119388] and parameters: {'n_layers': 4, 'embedding_dim': 64, 'lr': 0.06859293491971001, 'lambda_val': 3.6404845826373614e-05, 'batch_size': 2162, 'optimizer': 'RMSprop'}.
2026-06-18 00:44:15,269 - experiment_functions - INFO - Early stopping at epoch 600. Best Metrics: (0.0030659936984409938, 0.0007104964001515726, 0.0019258516254621835)
2026-06-18 00:44:15,367 - optuna.study.study - INFO - Trial 165 finished with values: [0.0030659936984409938, 0.0007104964001515726, 0.0019258516254621835] and parameters: {'n_layers': 4, 'embedding_dim': 32, 'lr': 0.0023699548585448013, 'lambda_val': 5.917167218617901e-06, 'batch_size': 3948, 'optimizer': 'RMSprop'}.
2026-06-18 00:44:45,525 - experiment_functions - INFO - Early stopping at epoch 700. Best Metrics: (0.0024550665893389666, 0.0005731337627889353, 0.001552007768292387)
2026-06-18 00:44:46,232 - optuna.study.study - INFO - Trial 166 finished with values: [0.0024550665893389666, 0.0005731337627889353, 0.001552007768292387] and parameters: {'n_layers': 1, 'embedding_dim': 64, 'lr': 0.004714566698419002, 'lambda_val': 0.0001450892533078464, 'batch_size': 3946, 'optimizer': 'RMSprop'}.
2026-06-18 00:45:36,718 - experiment_functions - INFO - Early stopping at epoch 1250. Best Metrics: (0.003237577849089732, 0.0007010231148162182, 0.0018963020531644799)
2026-06-18 00:45:36,862 - optuna.study.study - INFO - Trial 167 finished with values: [0.003237577849089732, 0.0007010231148162182, 0.0018963020531644799] and parameters: {'n_layers': 1, 'embedding_dim': 32, 'lr': 0.0009259265868741952, 'lambda_val': 3.576975505685731e-06, 'batch_size': 2987, 'optimizer': 'RMSprop'}.
2026-06-18 00:46:06,107 - experiment_functions - INFO - Early stopping at epoch 650. Best Metrics: (0.0030828910182626925, 0.0006552355690286725, 0.0017708504755647133)
2026-06-18 00:46:06,211 - optuna.study.study - INFO - Trial 168 finished with values: [0.0030828910182626925, 0.0006552355690286725, 0.0017708504755647133] and parameters: {'n_layers': 1, 'embedding_dim': 128, 'lr': 0.007122227416835467, 'lambda_val': 1.1653400566573792e-06, 'batch_size': 2471, 'optimizer': 'Adam'}.
2026-06-18 00:46:34,063 - experiment_functions - INFO - Early stopping at epoch 600. Best Metrics: (0.003054957692624858, 0.0007752305166098269, 0.0019959066994277843)
2026-06-18 00:46:34,173 - optuna.study.study - INFO - Trial 169 finished with values: [0.003054957692624858, 0.0007752305166098269, 0.0019959066994277843] and parameters: {'n_layers': 3, 'embedding_dim': 96, 'lr': 0.0071378175069858425, 'lambda_val': 5.470239525476512e-06, 'batch_size': 2091, 'optimizer': 'Adam'}.
2026-06-18 00:47:09,360 - experiment_functions - INFO - Early stopping at epoch 750. Best Metrics: (0.0032911751146402694, 0.0008778577744094987, 0.0021129393655148036)
2026-06-18 00:47:09,742 - optuna.study.study - INFO - Trial 170 finished with values: [0.0032911751146402694, 0.0008778577744094987, 0.0021129393655148036] and parameters: {'n_layers': 3, 'embedding_dim': 128, 'lr': 0.002692587283514102, 'lambda_val': 7.431054110368361e-06, 'batch_size': 1255, 'optimizer': 'RMSprop'}.
2026-06-18 00:47:48,639 - experiment_functions - INFO - Early stopping at epoch 800. Best Metrics: (0.0030770206950220223, 0.0007957559681697614, 0.0019656310175123065)
2026-06-18 00:47:48,739 - optuna.study.study - INFO - Trial 171 finished with values: [0.0030770206950220223, 0.0007957559681697614, 0.0019656310175123065] and parameters: {'n_layers': 4, 'embedding_dim': 128, 'lr': 0.0016963971500712442, 'lambda_val': 0.00224479684416678, 'batch_size': 1946, 'optimizer': 'Adam'}.
2026-06-18 00:48:18,569 - experiment_functions - INFO - Early stopping at epoch 650. Best Metrics: (0.002408377852432193, 0.0006236579512441581, 0.0015999475756515004)
2026-06-18 00:48:18,670 - optuna.study.study - INFO - Trial 172 finished with values: [0.002408377852432193, 0.0006236579512441581, 0.0015999475756515004] and parameters: {'n_layers': 4, 'embedding_dim': 64, 'lr': 0.0677235136368546, 'lambda_val': 1.6270591304270666e-06, 'batch_size': 3625, 'optimizer': 'Adam'}.
2026-06-18 00:48:45,469 - experiment_functions - INFO - Early stopping at epoch 550. Best Metrics: (0.002950270600663495, 0.0007262852090438297, 0.001905807976599095)
2026-06-18 00:48:45,567 - optuna.study.study - INFO - Trial 173 finished with values: [0.002950270600663495, 0.0007262852090438297, 0.001905807976599095] and parameters: {'n_layers': 3, 'embedding_dim': 128, 'lr': 0.002692587283514102, 'lambda_val': 0.00224479684416678, 'batch_size': 2432, 'optimizer': 'RMSprop'}.
2026-06-18 00:49:21,731 - experiment_functions - INFO - Early stopping at epoch 850. Best Metrics: (0.002566950261483554, 0.0005778704054566124, 0.0015577306217470373)
2026-06-18 00:49:22,274 - optuna.study.study - INFO - Trial 174 finished with values: [0.002566950261483554, 0.0005778704054566124, 0.0015577306217470373] and parameters: {'n_layers': 1, 'embedding_dim': 64, 'lr': 0.0026704905176286454, 'lambda_val': 0.0001450892533078464, 'batch_size': 4090, 'optimizer': 'RMSprop'}.
2026-06-18 00:50:39,694 - experiment_functions - INFO - Early stopping at epoch 1650. Best Metrics: (0.0032982321128854184, 0.0008052292535051155, 0.0020667535697182385)
2026-06-18 00:50:39,793 - optuna.study.study - INFO - Trial 175 finished with values: [0.0032982321128854184, 0.0008052292535051155, 0.0020667535697182385] and parameters: {'n_layers': 4, 'embedding_dim': 128, 'lr': 0.0005227831245976932, 'lambda_val': 0.00224479684416678, 'batch_size': 2091, 'optimizer': 'Adam'}.
2026-06-18 00:51:06,976 - experiment_functions - INFO - Early stopping at epoch 600. Best Metrics: (0.002783188627174567, 0.0006236579512441581, 0.0017853129918632496)
2026-06-18 00:51:07,119 - optuna.study.study - INFO - Trial 176 finished with values: [0.002783188627174567, 0.0006236579512441581, 0.0017853129918632496] and parameters: {'n_layers': 3, 'embedding_dim': 64, 'lr': 0.004714566698419002, 'lambda_val': 0.006986427337292849, 'batch_size': 2501, 'optimizer': 'Adam'}.
2026-06-18 00:52:40,073 - experiment_functions - INFO - Early stopping at epoch 2250. Best Metrics: (0.00277383519288421, 0.0006220790703549324, 0.001669828145685096)
2026-06-18 00:52:40,218 - optuna.study.study - INFO - Trial 177 finished with values: [0.00277383519288421, 0.0006220790703549324, 0.001669828145685096] and parameters: {'n_layers': 1, 'embedding_dim': 96, 'lr': 0.0006990102643278918, 'lambda_val': 3.576975505685731e-06, 'batch_size': 3739, 'optimizer': 'Adam'}.
2026-06-18 00:53:45,747 - experiment_functions - INFO - Early stopping at epoch 1500. Best Metrics: (0.0029588830386945704, 0.0007278640899330555, 0.0018923548301299853)
2026-06-18 00:53:45,854 - optuna.study.study - INFO - Trial 178 finished with values: [0.0029588830386945704, 0.0007278640899330555, 0.0018923548301299853] and parameters: {'n_layers': 3, 'embedding_dim': 96, 'lr': 0.0006990102643278918, 'lambda_val': 1.3756186301262744e-06, 'batch_size': 4090, 'optimizer': 'Adam'}.
2026-06-18 00:54:22,307 - experiment_functions - INFO - Early stopping at epoch 850. Best Metrics: (0.003463750124478985, 0.0007878615637236328, 0.002097422752933829)
2026-06-18 00:54:22,417 - optuna.study.study - INFO - Trial 179 finished with values: [0.003463750124478985, 0.0007878615637236328, 0.002097422752933829] and parameters: {'n_layers': 2, 'embedding_dim': 64, 'lr': 0.0016427257095284614, 'lambda_val': 0.0015914958177189133, 'batch_size': 1228, 'optimizer': 'RMSprop'}.
2026-06-18 00:54:46,857 - experiment_functions - INFO - Early stopping at epoch 550. Best Metrics: (0.0025633961568028796, 0.0006220790703549324, 0.0016484689103509087)
2026-06-18 00:54:46,980 - optuna.study.study - INFO - Trial 180 finished with values: [0.0025633961568028796, 0.0006220790703549324, 0.0016484689103509087] and parameters: {'n_layers': 3, 'embedding_dim': 32, 'lr': 0.004714566698419002, 'lambda_val': 0.0013554487323639152, 'batch_size': 2987, 'optimizer': 'RMSprop'}.
2026-06-18 00:55:23,306 - experiment_functions - INFO - Early stopping at epoch 750. Best Metrics: (0.002777596934034794, 0.0007183908045977011, 0.0016865115518948594)
2026-06-18 00:55:23,411 - optuna.study.study - INFO - Trial 181 finished with values: [0.002777596934034794, 0.0007183908045977011, 0.0016865115518948594] and parameters: {'n_layers': 4, 'embedding_dim': 128, 'lr': 0.0016427257095284614, 'lambda_val': 0.006986427337292849, 'batch_size': 1625, 'optimizer': 'Adam'}.
2026-06-18 00:57:37,034 - experiment_functions - INFO - Early stopping at epoch 3250. Best Metrics: (0.003168621172757941, 0.0007357584943791841, 0.0020216505932424407)
2026-06-18 00:57:37,137 - optuna.study.study - INFO - Trial 182 finished with values: [0.003168621172757941, 0.0007357584943791841, 0.0020216505932424407] and parameters: {'n_layers': 2, 'embedding_dim': 64, 'lr': 0.0006197690834854795, 'lambda_val': 3.6404845826373614e-05, 'batch_size': 3948, 'optimizer': 'RMSprop'}.
2026-06-18 00:58:55,194 - experiment_functions - INFO - Early stopping at epoch 1650. Best Metrics: (0.003353096345307729, 0.0008494379184034356, 0.0021415058945787324)
2026-06-18 00:58:55,297 - optuna.study.study - INFO - Trial 183 finished with values: [0.003353096345307729, 0.0008494379184034356, 0.0021415058945787324] and parameters: {'n_layers': 3, 'embedding_dim': 128, 'lr': 0.0006197690834854795, 'lambda_val': 3.6404845826373614e-05, 'batch_size': 2889, 'optimizer': 'RMSprop'}.
2026-06-18 00:59:20,138 - experiment_functions - INFO - Early stopping at epoch 500. Best Metrics: (0.0005940292789040682, 0.00012473159024883163, 0.0002992843296601455)
2026-06-18 00:59:20,240 - optuna.study.study - INFO - Trial 184 finished with values: [0.0005940292789040682, 0.00012473159024883163, 0.0002992843296601455] and parameters: {'n_layers': 4, 'embedding_dim': 96, 'lr': 0.0071378175069858425, 'lambda_val': 5.470239525476512e-06, 'batch_size': 1405, 'optimizer': 'SGD'}.
2026-06-18 01:00:01,400 - experiment_functions - INFO - Early stopping at epoch 700. Best Metrics: (0.0026668705198177553, 0.0007436528988253125, 0.001704745255942826)
2026-06-18 01:00:01,548 - optuna.study.study - INFO - Trial 185 finished with values: [0.0026668705198177553, 0.0007436528988253125, 0.001704745255942826] and parameters: {'n_layers': 4, 'embedding_dim': 256, 'lr': 0.0016963971500712442, 'lambda_val': 0.006986427337292849, 'batch_size': 1954, 'optimizer': 'Adam'}.
2026-06-18 01:00:37,118 - experiment_functions - INFO - Early stopping at epoch 750. Best Metrics: (0.002829544310946071, 0.0007152330428192498, 0.0018940356550744063)
2026-06-18 01:00:37,222 - optuna.study.study - INFO - Trial 186 finished with values: [0.002829544310946071, 0.0007152330428192498, 0.0018940356550744063] and parameters: {'n_layers': 2, 'embedding_dim': 128, 'lr': 0.0016427257095284614, 'lambda_val': 0.0015914958177189133, 'batch_size': 1228, 'optimizer': 'RMSprop'}.
2026-06-18 01:01:24,120 - experiment_functions - INFO - Early stopping at epoch 950. Best Metrics: (0.0027357908051359996, 0.0006726032588101555, 0.001739703460280849)
2026-06-18 01:01:24,649 - optuna.study.study - INFO - Trial 187 finished with values: [0.0027357908051359996, 0.0006726032588101555, 0.001739703460280849] and parameters: {'n_layers': 1, 'embedding_dim': 256, 'lr': 0.007122227416835467, 'lambda_val': 1.1653400566573792e-06, 'batch_size': 2987, 'optimizer': 'Adam'}.
2026-06-18 01:04:14,089 - optuna.study.study - INFO - Trial 188 finished with values: [0.0030570428507370926, 0.0007357584943791842, 0.0019427061262095942] and parameters: {'n_layers': 4, 'embedding_dim': 32, 'lr': 0.0006674090882881629, 'lambda_val': 0.0001528536356672561, 'batch_size': 3948, 'optimizer': 'RMSprop'}.
2026-06-18 01:07:00,442 - experiment_functions - INFO - Early stopping at epoch 3850. Best Metrics: (0.003077989680246804, 0.000686813186813187, 0.0018942996063646318)
2026-06-18 01:07:00,538 - optuna.study.study - INFO - Trial 189 finished with values: [0.003077989680246804, 0.000686813186813187, 0.0018942996063646318] and parameters: {'n_layers': 1, 'embedding_dim': 128, 'lr': 0.0023699548585448013, 'lambda_val': 2.200141832553013e-06, 'batch_size': 600, 'optimizer': 'Adam'}.
2026-06-18 01:07:40,989 - experiment_functions - INFO - Early stopping at epoch 900. Best Metrics: (0.0032507170217249415, 0.0007862826828344069, 0.002075832092357829)
2026-06-18 01:07:41,414 - optuna.study.study - INFO - Trial 190 finished with values: [0.0032507170217249415, 0.0007862826828344069, 0.002075832092357829] and parameters: {'n_layers': 2, 'embedding_dim': 64, 'lr': 0.0016427257095284614, 'lambda_val': 0.0015914958177189133, 'batch_size': 1228, 'optimizer': 'RMSprop'}.
2026-06-18 01:08:31,691 - experiment_functions - INFO - Early stopping at epoch 1150. Best Metrics: (0.0031500578023409124, 0.0006962864721485411, 0.001974216010558454)
2026-06-18 01:08:31,789 - optuna.study.study - INFO - Trial 191 finished with values: [0.0031500578023409124, 0.0006962864721485411, 0.001974216010558454] and parameters: {'n_layers': 4, 'embedding_dim': 32, 'lr': 0.0006674090882881629, 'lambda_val': 3.576975505685731e-06, 'batch_size': 2987, 'optimizer': 'Adam'}.
2026-06-18 01:10:12,386 - experiment_functions - INFO - Early stopping at epoch 2250. Best Metrics: (0.0035582435302785676, 0.000885752178855627, 0.0022761690004721633)
2026-06-18 01:10:12,494 - optuna.study.study - INFO - Trial 192 finished with values: [0.0035582435302785676, 0.000885752178855627, 0.0022761690004721633] and parameters: {'n_layers': 4, 'embedding_dim': 64, 'lr': 0.0006197690834854795, 'lambda_val': 3.6404845826373614e-05, 'batch_size': 2892, 'optimizer': 'RMSprop'}.
2026-06-18 01:10:42,507 - experiment_functions - INFO - Early stopping at epoch 600. Best Metrics: (0.002948090242785731, 0.0007862826828344069, 0.0018599059911519925)
2026-06-18 01:10:42,606 - optuna.study.study - INFO - Trial 193 finished with values: [0.002948090242785731, 0.0007862826828344069, 0.0018599059911519925] and parameters: {'n_layers': 4, 'embedding_dim': 96, 'lr': 0.0071378175069858425, 'lambda_val': 5.470239525476512e-06, 'batch_size': 2622, 'optimizer': 'Adam'}.
2026-06-18 01:12:11,997 - experiment_functions - INFO - Early stopping at epoch 2000. Best Metrics: (0.0034526770517387634, 0.0008052292535051155, 0.002093931154456138)
2026-06-18 01:12:12,100 - optuna.study.study - INFO - Trial 194 finished with values: [0.0034526770517387634, 0.0008052292535051155, 0.002093931154456138] and parameters: {'n_layers': 4, 'embedding_dim': 64, 'lr': 0.0006990102643278918, 'lambda_val': 0.002750666158846801, 'batch_size': 1884, 'optimizer': 'Adam'}.
2026-06-18 01:14:33,853 - experiment_functions - INFO - Early stopping at epoch 3150. Best Metrics: (0.0035733027340865927, 0.00084785903751421, 0.0022458511056720385)
2026-06-18 01:14:33,954 - optuna.study.study - INFO - Trial 195 finished with values: [0.0035733027340865927, 0.00084785903751421, 0.0022458511056720385] and parameters: {'n_layers': 3, 'embedding_dim': 96, 'lr': 0.0006990102643278918, 'lambda_val': 6.88069903527936e-06, 'batch_size': 3359, 'optimizer': 'RMSprop'}.
2026-06-18 01:15:26,401 - experiment_functions - INFO - Early stopping at epoch 1150. Best Metrics: (0.0034388270342397553, 0.0008083870152835671, 0.00221422252461409)
