2026-06-18 16:01:57,356 - optuna.study.study - INFO - Trial 255 finished with values: [0.004005493301117133, 0.0010120626499936843, 0.0025763310901634785] and parameters: {'n_layers': 4, 'embedding_dim': 96, 'lr': 0.002025300477572928, 'lambda_val': 3.83795684112999e-06, 'batch_size': 761, 'optimizer': 'RMSprop'}.
2026-06-18 16:04:33,131 - experiment_functions - INFO - Early stopping at epoch 3900. Best Metrics: (0.003785826052095734, 0.0008683844890741444, 0.002372984199995487)
2026-06-18 16:04:33,233 - optuna.study.study - INFO - Trial 256 finished with values: [0.003785826052095734, 0.0008683844890741444, 0.002372984199995487] and parameters: {'n_layers': 4, 'embedding_dim': 32, 'lr': 0.0005796526912711289, 'lambda_val': 2.7945521753203373e-05, 'batch_size': 1789, 'optimizer': 'RMSprop'}.
2026-06-18 16:05:34,454 - experiment_functions - INFO - Early stopping at epoch 1500. Best Metrics: (0.0041897316250081714, 0.000997852721990653, 0.002528815440031528)
2026-06-18 16:05:34,606 - optuna.study.study - INFO - Trial 257 finished with values: [0.0041897316250081714, 0.000997852721990653, 0.002528815440031528] and parameters: {'n_layers': 4, 'embedding_dim': 32, 'lr': 0.0016391721585660463, 'lambda_val': 1.3344718493912024e-05, 'batch_size': 892, 'optimizer': 'RMSprop'}.
2026-06-18 16:06:09,586 - experiment_functions - INFO - Early stopping at epoch 850. Best Metrics: (0.003450630918781733, 0.0007215485663761526, 0.0020451435639008996)
2026-06-18 16:06:09,858 - optuna.study.study - INFO - Trial 258 finished with values: [0.003450630918781733, 0.0007215485663761526, 0.0020451435639008996] and parameters: {'n_layers': 1, 'embedding_dim': 32, 'lr': 0.002487565347422212, 'lambda_val': 1.3344718493912024e-05, 'batch_size': 892, 'optimizer': 'Adam'}.
2026-06-18 16:07:06,405 - experiment_functions - INFO - Early stopping at epoch 1100. Best Metrics: (0.002096831034195548, 0.0005841859290135152, 0.0014721378366293386)
2026-06-18 16:07:06,510 - optuna.study.study - INFO - Trial 259 finished with values: [0.002096831034195548, 0.0005841859290135152, 0.0014721378366293386] and parameters: {'n_layers': 3, 'embedding_dim': 256, 'lr': 0.03159529310532965, 'lambda_val': 1.455259422316608e-06, 'batch_size': 3632, 'optimizer': 'RMSprop'}.
2026-06-18 16:07:49,418 - experiment_functions - INFO - Early stopping at epoch 900. Best Metrics: (0.0034297572324230446, 0.0008589112037387899, 0.002101471985443396)
2026-06-18 16:07:49,529 - optuna.study.study - INFO - Trial 260 finished with values: [0.0034297572324230446, 0.0008589112037387899, 0.002101471985443396] and parameters: {'n_layers': 4, 'embedding_dim': 128, 'lr': 0.002487565347422212, 'lambda_val': 2.7945521753203373e-05, 'batch_size': 801, 'optimizer': 'Adam'}.
2026-06-18 16:09:35,831 - experiment_functions - INFO - Early stopping at epoch 2650. Best Metrics: (0.004007591927739076, 0.0009394341290893015, 0.0024949141797301825)
2026-06-18 16:09:35,971 - optuna.study.study - INFO - Trial 261 finished with values: [0.004007591927739076, 0.0009394341290893015, 0.0024949141797301825] and parameters: {'n_layers': 4, 'embedding_dim': 32, 'lr': 0.0010214376144180076, 'lambda_val': 0.00040061681099488964, 'batch_size': 945, 'optimizer': 'RMSprop'}.
2026-06-18 16:10:16,182 - experiment_functions - INFO - Early stopping at epoch 850. Best Metrics: (0.001976733331788136, 0.0005889225716811925, 0.0012563514210909808)
2026-06-18 16:10:16,526 - optuna.study.study - INFO - Trial 262 finished with values: [0.001976733331788136, 0.0005889225716811925, 0.0012563514210909808] and parameters: {'n_layers': 4, 'embedding_dim': 128, 'lr': 0.002487565347422212, 'lambda_val': 0.04836457977136633, 'batch_size': 892, 'optimizer': 'RMSprop'}.
2026-06-18 16:12:58,125 - optuna.study.study - INFO - Trial 263 finished with values: [0.003264111625551936, 0.0007389162561576355, 0.002101615159902598] and parameters: {'n_layers': 3, 'embedding_dim': 64, 'lr': 0.00041543940578793584, 'lambda_val': 2.7945521753203373e-05, 'batch_size': 801, 'optimizer': 'RMSprop'}.
2026-06-18 16:15:58,470 - optuna.study.study - INFO - Trial 264 finished with values: [0.004021961226332768, 0.001019957054439813, 0.002597748720821255] and parameters: {'n_layers': 4, 'embedding_dim': 128, 'lr': 0.0005796526912711289, 'lambda_val': 1.455259422316608e-06, 'batch_size': 801, 'optimizer': 'RMSprop'}.
2026-06-18 16:16:52,293 - experiment_functions - INFO - Early stopping at epoch 1300. Best Metrics: (0.0028363826621998593, 0.0006883920677024126, 0.0018473073243317965)
2026-06-18 16:16:52,392 - optuna.study.study - INFO - Trial 265 finished with values: [0.0028363826621998593, 0.0006883920677024126, 0.0018473073243317965] and parameters: {'n_layers': 1, 'embedding_dim': 96, 'lr': 0.002487565347422212, 'lambda_val': 1.3344718493912024e-05, 'batch_size': 2149, 'optimizer': 'RMSprop'}.
2026-06-18 16:17:24,191 - experiment_functions - INFO - Early stopping at epoch 650. Best Metrics: (0.003579508790093696, 0.0008715422508525957, 0.0022645755194494782)
2026-06-18 16:17:24,388 - optuna.study.study - INFO - Trial 266 finished with values: [0.003579508790093696, 0.0008715422508525957, 0.0022645755194494782] and parameters: {'n_layers': 4, 'embedding_dim': 128, 'lr': 0.0016391721585660463, 'lambda_val': 1.455259422316608e-06, 'batch_size': 2199, 'optimizer': 'RMSprop'}.
2026-06-18 16:20:21,571 - optuna.study.study - INFO - Trial 267 finished with values: [0.0026068029552025495, 0.0005841859290135152, 0.001680886588825932] and parameters: {'n_layers': 1, 'embedding_dim': 256, 'lr': 0.0005796526912711289, 'lambda_val': 1.3344718493912024e-05, 'batch_size': 945, 'optimizer': 'Adam'}.
2026-06-18 16:21:44,568 - experiment_functions - INFO - Early stopping at epoch 2050. Best Metrics: (0.0037746190835079873, 0.0009015409877478842, 0.002376517096388502)
2026-06-18 16:21:44,672 - optuna.study.study - INFO - Trial 268 finished with values: [0.0037746190835079873, 0.0009015409877478842, 0.002376517096388502] and parameters: {'n_layers': 4, 'embedding_dim': 32, 'lr': 0.001332731741784367, 'lambda_val': 1.7089177370137862e-06, 'batch_size': 1110, 'optimizer': 'RMSprop'}.
2026-06-18 16:22:24,538 - experiment_functions - INFO - Early stopping at epoch 800. Best Metrics: (0.003283791425865971, 0.0008099658961727928, 0.002030362683439167)
2026-06-18 16:22:24,661 - optuna.study.study - INFO - Trial 269 finished with values: [0.003283791425865971, 0.0008099658961727928, 0.002030362683439167] and parameters: {'n_layers': 2, 'embedding_dim': 256, 'lr': 0.0027865590909866454, 'lambda_val': 5.672639985302811e-06, 'batch_size': 649, 'optimizer': 'RMSprop'}.
2026-06-18 16:22:58,708 - experiment_functions - INFO - Early stopping at epoch 800. Best Metrics: (0.0031608054214588657, 0.0007783882783882784, 0.0019770361950964656)
2026-06-18 16:22:58,902 - optuna.study.study - INFO - Trial 270 finished with values: [0.0031608054214588657, 0.0007783882783882784, 0.0019770361950964656] and parameters: {'n_layers': 4, 'embedding_dim': 32, 'lr': 0.0016391721585660463, 'lambda_val': 4.669465121966091e-06, 'batch_size': 3250, 'optimizer': 'RMSprop'}.
2026-06-18 16:23:40,304 - experiment_functions - INFO - Early stopping at epoch 850. Best Metrics: (0.003728898785239515, 0.0009283819628647217, 0.0024026339344225735)
2026-06-18 16:23:40,406 - optuna.study.study - INFO - Trial 271 finished with values: [0.003728898785239515, 0.0009283819628647217, 0.0024026339344225735] and parameters: {'n_layers': 4, 'embedding_dim': 128, 'lr': 0.002487565347422212, 'lambda_val': 5.672639985302811e-06, 'batch_size': 801, 'optimizer': 'RMSprop'}.
2026-06-18 16:24:14,014 - experiment_functions - INFO - Early stopping at epoch 750. Best Metrics: (0.003905360611653572, 0.000931539724643173, 0.0024589080539907044)
2026-06-18 16:24:14,126 - optuna.study.study - INFO - Trial 272 finished with values: [0.003905360611653572, 0.000931539724643173, 0.0024589080539907044] and parameters: {'n_layers': 3, 'embedding_dim': 64, 'lr': 0.002487565347422212, 'lambda_val': 1.3344718493912024e-05, 'batch_size': 892, 'optimizer': 'RMSprop'}.
2026-06-18 16:25:02,789 - experiment_functions - INFO - Early stopping at epoch 1100. Best Metrics: (0.0036327028307816286, 0.0008841732979664015, 0.0023154478981863326)
2026-06-18 16:25:02,917 - optuna.study.study - INFO - Trial 273 finished with values: [0.0036327028307816286, 0.0008841732979664015, 0.0023154478981863326] and parameters: {'n_layers': 4, 'embedding_dim': 64, 'lr': 0.002487565347422212, 'lambda_val': 1.3344718493912024e-05, 'batch_size': 892, 'optimizer': 'Adam'}.
2026-06-18 16:25:52,513 - experiment_functions - INFO - Early stopping at epoch 1200. Best Metrics: (0.0037955924292664787, 0.0008083870152835672, 0.0023435060080174556)
2026-06-18 16:25:52,642 - optuna.study.study - INFO - Trial 274 finished with values: [0.0037955924292664787, 0.0008083870152835672, 0.0023435060080174556] and parameters: {'n_layers': 1, 'embedding_dim': 32, 'lr': 0.002487565347422212, 'lambda_val': 1.3344718493912024e-05, 'batch_size': 892, 'optimizer': 'RMSprop'}.
2026-06-18 16:27:48,730 - experiment_functions - INFO - Early stopping at epoch 2150. Best Metrics: (0.0034795901337774, 0.0009173297966401415, 0.0021277386268956327)
2026-06-18 16:27:48,841 - optuna.study.study - INFO - Trial 275 finished with values: [0.0034795901337774, 0.0009173297966401415, 0.0021277386268956327] and parameters: {'n_layers': 4, 'embedding_dim': 256, 'lr': 0.0010214376144180076, 'lambda_val': 5.672639985302811e-06, 'batch_size': 4005, 'optimizer': 'RMSprop'}.
2026-06-18 16:28:20,100 - experiment_functions - INFO - Early stopping at epoch 700. Best Metrics: (0.0029889171082843596, 0.0006836554250347354, 0.0018787999827056354)
2026-06-18 16:28:20,223 - optuna.study.study - INFO - Trial 276 finished with values: [0.0029889171082843596, 0.0006836554250347354, 0.0018787999827056354] and parameters: {'n_layers': 1, 'embedding_dim': 128, 'lr': 0.0036999694376910314, 'lambda_val': 0.0012225783134158963, 'batch_size': 892, 'optimizer': 'RMSprop'}.
2026-06-18 16:28:46,994 - experiment_functions - INFO - Early stopping at epoch 600. Best Metrics: (0.0018602399532129392, 0.00046576986232158647, 0.0011991460349133013)
2026-06-18 16:28:47,093 - optuna.study.study - INFO - Trial 277 finished with values: [0.0018602399532129392, 0.00046576986232158647, 0.0011991460349133013] and parameters: {'n_layers': 4, 'embedding_dim': 32, 'lr': 0.05492778912740656, 'lambda_val': 1.7089177370137862e-06, 'batch_size': 3504, 'optimizer': 'RMSprop'}.
2026-06-18 16:29:18,908 - experiment_functions - INFO - Early stopping at epoch 700. Best Metrics: (0.0033690483696179356, 0.0008368068712896299, 0.0021007723426903807)
2026-06-18 16:29:19,012 - optuna.study.study - INFO - Trial 278 finished with values: [0.0033690483696179356, 0.0008368068712896299, 0.0021007723426903807] and parameters: {'n_layers': 4, 'embedding_dim': 64, 'lr': 0.002487565347422212, 'lambda_val': 1.455259422316608e-06, 'batch_size': 2199, 'optimizer': 'RMSprop'}.
2026-06-18 16:29:41,178 - experiment_functions - INFO - Early stopping at epoch 500. Best Metrics: (0.0005137741401553674, 0.00011683718580270305, 0.0002826446510298421)
2026-06-18 16:29:41,276 - optuna.study.study - INFO - Trial 279 finished with values: [0.0005137741401553674, 0.00011683718580270305, 0.0002826446510298421] and parameters: {'n_layers': 3, 'embedding_dim': 32, 'lr': 0.001229746147020764, 'lambda_val': 1.3344718493912024e-05, 'batch_size': 892, 'optimizer': 'SGD'}.
2026-06-18 16:30:21,333 - experiment_functions - INFO - Early stopping at epoch 750. Best Metrics: (0.003427742787438453, 0.0009078565113047872, 0.0021764262897749818)
2026-06-18 16:30:21,481 - optuna.study.study - INFO - Trial 280 finished with values: [0.003427742787438453, 0.0009078565113047872, 0.0021764262897749818] and parameters: {'n_layers': 3, 'embedding_dim': 256, 'lr': 0.002487565347422212, 'lambda_val': 5.672639985302811e-06, 'batch_size': 892, 'optimizer': 'RMSprop'}.
2026-06-18 16:32:11,219 - experiment_functions - INFO - Early stopping at epoch 2350. Best Metrics: (0.0029911711984716674, 0.0007799671592775042, 0.0018487905596278808)
2026-06-18 16:32:11,323 - optuna.study.study - INFO - Trial 281 finished with values: [0.0029911711984716674, 0.0007799671592775042, 0.0018487905596278808] and parameters: {'n_layers': 4, 'embedding_dim': 128, 'lr': 0.00054735960254125, 'lambda_val': 0.00018911354407731847, 'batch_size': 3622, 'optimizer': 'Adam'}.
2026-06-18 16:33:54,242 - experiment_functions - INFO - Early stopping at epoch 1900. Best Metrics: (0.003347286684467819, 0.0009015409877478843, 0.0020731855066342376)
2026-06-18 16:33:54,359 - optuna.study.study - INFO - Trial 282 finished with values: [0.003347286684467819, 0.0009015409877478843, 0.0020731855066342376] and parameters: {'n_layers': 4, 'embedding_dim': 256, 'lr': 0.0010214376144180076, 'lambda_val': 1.455259422316608e-06, 'batch_size': 2863, 'optimizer': 'RMSprop'}.
2026-06-18 16:34:32,584 - experiment_functions - INFO - Early stopping at epoch 850. Best Metrics: (0.004056811310062528, 0.000993116079322976, 0.0024471971219487978)
2026-06-18 16:34:32,690 - optuna.study.study - INFO - Trial 283 finished with values: [0.004056811310062528, 0.000993116079322976, 0.0024471971219487978] and parameters: {'n_layers': 4, 'embedding_dim': 64, 'lr': 0.002487565347422212, 'lambda_val': 2.7945521753203373e-05, 'batch_size': 801, 'optimizer': 'RMSprop'}.
2026-06-18 16:35:06,028 - experiment_functions - INFO - Early stopping at epoch 750. Best Metrics: (0.003905360611653572, 0.000931539724643173, 0.0024589080539907044)
2026-06-18 16:35:06,366 - optuna.study.study - INFO - Trial 284 finished with values: [0.003905360611653572, 0.000931539724643173, 0.0024589080539907044] and parameters: {'n_layers': 3, 'embedding_dim': 64, 'lr': 0.002487565347422212, 'lambda_val': 1.3344718493912024e-05, 'batch_size': 892, 'optimizer': 'RMSprop'}.
2026-06-18 16:36:03,329 - experiment_functions - INFO - Early stopping at epoch 1200. Best Metrics: (0.0036053096655283647, 0.0009283819628647216, 0.002186161856727886)
2026-06-18 16:36:03,432 - optuna.study.study - INFO - Trial 285 finished with values: [0.0036053096655283647, 0.0009283819628647216, 0.002186161856727886] and parameters: {'n_layers': 4, 'embedding_dim': 128, 'lr': 0.002487565347422212, 'lambda_val': 2.7945521753203373e-05, 'batch_size': 801, 'optimizer': 'RMSprop'}.
2026-06-18 16:36:40,159 - experiment_functions - INFO - Early stopping at epoch 750. Best Metrics: (0.003353879131842754, 0.0008825944170771757, 0.0021050759703491622)
2026-06-18 16:36:40,265 - optuna.study.study - INFO - Trial 286 finished with values: [0.003353879131842754, 0.0008825944170771757, 0.0021050759703491622] and parameters: {'n_layers': 4, 'embedding_dim': 128, 'lr': 0.002487565347422212, 'lambda_val': 5.759063294226392e-05, 'batch_size': 1374, 'optimizer': 'RMSprop'}.
2026-06-18 16:37:34,861 - experiment_functions - INFO - Early stopping at epoch 1200. Best Metrics: (0.0033433806327851884, 0.0008825944170771757, 0.002161939707390685)
2026-06-18 16:37:34,965 - optuna.study.study - INFO - Trial 287 finished with values: [0.0033433806327851884, 0.0008825944170771757, 0.002161939707390685] and parameters: {'n_layers': 4, 'embedding_dim': 96, 'lr': 0.0016391721585660463, 'lambda_val': 2.7945521753203373e-05, 'batch_size': 2199, 'optimizer': 'RMSprop'}.
2026-06-18 16:38:08,243 - experiment_functions - INFO - Early stopping at epoch 700. Best Metrics: (0.0030882171658823125, 0.0008052292535051156, 0.0019711629717969782)
2026-06-18 16:38:08,348 - optuna.study.study - INFO - Trial 288 finished with values: [0.0030882171658823125, 0.0008052292535051156, 0.0019711629717969782] and parameters: {'n_layers': 3, 'embedding_dim': 128, 'lr': 0.0014232781107049574, 'lambda_val': 0.0010339430296944644, 'batch_size': 2863, 'optimizer': 'RMSprop'}.
2026-06-18 16:39:28,572 - experiment_functions - INFO - Early stopping at epoch 2000. Best Metrics: (0.004193965965041462, 0.0009283819628647215, 0.002609114389748768)
2026-06-18 16:39:28,672 - optuna.study.study - INFO - Trial 289 finished with values: [0.004193965965041462, 0.0009283819628647215, 0.002609114389748768] and parameters: {'n_layers': 3, 'embedding_dim': 32, 'lr': 0.001332731741784367, 'lambda_val': 1.7089177370137862e-06, 'batch_size': 801, 'optimizer': 'RMSprop'}.
2026-06-18 16:40:49,701 - experiment_functions - INFO - Early stopping at epoch 1950. Best Metrics: (0.0004947908515346409, 0.00011841606669192878, 0.0003039893371058815)
2026-06-18 16:40:50,059 - optuna.study.study - INFO - Trial 290 finished with values: [0.0004947908515346409, 0.00011841606669192878, 0.0003039893371058815] and parameters: {'n_layers': 4, 'embedding_dim': 64, 'lr': 1.2183358667766179e-05, 'lambda_val': 1.455259422316608e-06, 'batch_size': 801, 'optimizer': 'RMSprop'}.
2026-06-18 16:41:32,455 - experiment_functions - INFO - Early stopping at epoch 1050. Best Metrics: (0.003612336737705345, 0.0007594417077175699, 0.002236998805692503)
2026-06-18 16:41:32,557 - optuna.study.study - INFO - Trial 291 finished with values: [0.003612336737705345, 0.0007594417077175699, 0.002236998805692503] and parameters: {'n_layers': 1, 'embedding_dim': 32, 'lr': 0.002487565347422212, 'lambda_val': 4.610936463319413e-05, 'batch_size': 892, 'optimizer': 'Adam'}.
2026-06-18 16:42:19,690 - experiment_functions - INFO - Early stopping at epoch 1050. Best Metrics: (0.0037742474612044666, 0.0009710117468738159, 0.0023597273414276317)
2026-06-18 16:42:19,834 - optuna.study.study - INFO - Trial 292 finished with values: [0.0037742474612044666, 0.0009710117468738159, 0.0023597273414276317] and parameters: {'n_layers': 4, 'embedding_dim': 96, 'lr': 0.002487565347422212, 'lambda_val': 2.7945521753203373e-05, 'batch_size': 801, 'optimizer': 'RMSprop'}.
2026-06-18 16:44:03,625 - experiment_functions - INFO - Early stopping at epoch 2600. Best Metrics: (0.004019506074975883, 0.0009757483895414929, 0.002632232072383495)
2026-06-18 16:44:03,727 - optuna.study.study - INFO - Trial 293 finished with values: [0.004019506074975883, 0.0009757483895414929, 0.002632232072383495] and parameters: {'n_layers': 4, 'embedding_dim': 32, 'lr': 0.0010214376144180076, 'lambda_val': 1.455259422316608e-06, 'batch_size': 945, 'optimizer': 'RMSprop'}.
2026-06-18 16:44:50,899 - experiment_functions - INFO - Early stopping at epoch 1000. Best Metrics: (0.0036054823972631127, 0.0009441707717569787, 0.0022754438701314823)
2026-06-18 16:44:51,008 - optuna.study.study - INFO - Trial 294 finished with values: [0.0036054823972631127, 0.0009441707717569787, 0.0022754438701314823] and parameters: {'n_layers': 4, 'embedding_dim': 128, 'lr': 0.002487565347422212, 'lambda_val': 2.7945521753203373e-05, 'batch_size': 801, 'optimizer': 'RMSprop'}.
2026-06-18 16:45:47,018 - experiment_functions - INFO - Early stopping at epoch 1400. Best Metrics: (0.003954641971115735, 0.0008352279904004043, 0.0024485633734846438)
2026-06-18 16:45:47,130 - optuna.study.study - INFO - Trial 295 finished with values: [0.003954641971115735, 0.0008352279904004043, 0.0024485633734846438] and parameters: {'n_layers': 1, 'embedding_dim': 32, 'lr': 0.002487565347422212, 'lambda_val': 1.3344718493912024e-05, 'batch_size': 540, 'optimizer': 'RMSprop'}.
2026-06-18 16:46:23,027 - experiment_functions - INFO - Early stopping at epoch 850. Best Metrics: (0.0031592761467743907, 0.000775230516609827, 0.001976808017778562)
2026-06-18 16:46:23,332 - optuna.study.study - INFO - Trial 296 finished with values: [0.0031592761467743907, 0.000775230516609827, 0.001976808017778562] and parameters: {'n_layers': 4, 'embedding_dim': 32, 'lr': 0.003855829449851487, 'lambda_val': 1.7089177370137862e-06, 'batch_size': 801, 'optimizer': 'Adam'}.
2026-06-18 16:46:47,191 - experiment_functions - INFO - Early stopping at epoch 500. Best Metrics: (0.00045966406730705813, 0.0001026272577996716, 0.00025668985571297226)
2026-06-18 16:46:47,300 - optuna.study.study - INFO - Trial 297 finished with values: [0.00045966406730705813, 0.0001026272577996716, 0.00025668985571297226] and parameters: {'n_layers': 1, 'embedding_dim': 256, 'lr': 0.0016391721585660463, 'lambda_val': 6.474581689651504e-05, 'batch_size': 892, 'optimizer': 'SGD'}.
2026-06-18 16:47:31,503 - experiment_functions - INFO - Early stopping at epoch 800. Best Metrics: (0.0033598267288455982, 0.0008999621068586586, 0.002136355123932668)
2026-06-18 16:47:31,607 - optuna.study.study - INFO - Trial 298 finished with values: [0.0033598267288455982, 0.0008999621068586586, 0.002136355123932668] and parameters: {'n_layers': 4, 'embedding_dim': 256, 'lr': 0.002487565347422212, 'lambda_val': 5.672639985302811e-06, 'batch_size': 784, 'optimizer': 'RMSprop'}.
2026-06-18 16:48:15,266 - experiment_functions - INFO - Early stopping at epoch 1000. Best Metrics: (0.003126280726447793, 0.0007910193255020842, 0.0020218059726036367)
