2026-06-18 14:03:19,148 - optuna.study.study - INFO - Trial 162 finished with values: [0.002013325849902675, 0.0005652393583428066, 0.0012379127292582448] and parameters: {'n_layers': 2, 'embedding_dim': 256, 'lr': 0.04330705811114759, 'lambda_val': 0.00022507006239543383, 'batch_size': 2731, 'optimizer': 'RMSprop'}.
2026-06-18 14:06:03,897 - optuna.study.study - INFO - Trial 163 finished with values: [0.0030285905095840584, 0.0006710243779209297, 0.00187530558016489] and parameters: {'n_layers': 4, 'embedding_dim': 64, 'lr': 0.0002882504317051682, 'lambda_val': 1.7089177370137862e-06, 'batch_size': 2030, 'optimizer': 'RMSprop'}.
2026-06-18 14:07:02,334 - experiment_functions - INFO - Early stopping at epoch 1400. Best Metrics: (0.003761332765502855, 0.000948907414424656, 0.0024478241924257614)
2026-06-18 14:07:02,482 - optuna.study.study - INFO - Trial 164 finished with values: [0.003761332765502855, 0.000948907414424656, 0.0024478241924257614] and parameters: {'n_layers': 4, 'embedding_dim': 32, 'lr': 0.002487565347422212, 'lambda_val': 1.3344718493912024e-05, 'batch_size': 801, 'optimizer': 'RMSprop'}.
2026-06-18 14:09:07,709 - experiment_functions - INFO - Early stopping at epoch 2700. Best Metrics: (0.003277353229942117, 0.0008841732979664016, 0.0020771566047450007)
2026-06-18 14:09:08,040 - optuna.study.study - INFO - Trial 165 finished with values: [0.003277353229942117, 0.0008841732979664016, 0.0020771566047450007] and parameters: {'n_layers': 4, 'embedding_dim': 128, 'lr': 0.0010214376144180076, 'lambda_val': 1.455259422316608e-06, 'batch_size': 3005, 'optimizer': 'RMSprop'}.
2026-06-18 14:09:42,291 - experiment_functions - INFO - Early stopping at epoch 700. Best Metrics: (0.003142427533655448, 0.0007231274472653782, 0.0019266258728861559)
2026-06-18 14:09:42,461 - optuna.study.study - INFO - Trial 166 finished with values: [0.003142427533655448, 0.0007231274472653782, 0.0019266258728861559] and parameters: {'n_layers': 4, 'embedding_dim': 32, 'lr': 0.003855829449851487, 'lambda_val': 9.43829822749537e-06, 'batch_size': 2199, 'optimizer': 'Adam'}.
2026-06-18 14:11:33,022 - experiment_functions - INFO - Early stopping at epoch 2050. Best Metrics: (0.0037400979733346624, 0.0009552229379815587, 0.0022768678426535074)
2026-06-18 14:11:33,341 - optuna.study.study - INFO - Trial 167 finished with values: [0.0037400979733346624, 0.0009552229379815587, 0.0022768678426535074] and parameters: {'n_layers': 4, 'embedding_dim': 256, 'lr': 0.0007370990926715837, 'lambda_val': 9.43829822749537e-06, 'batch_size': 3617, 'optimizer': 'RMSprop'}.
2026-06-18 14:12:21,451 - experiment_functions - INFO - Early stopping at epoch 1150. Best Metrics: (0.0032594745886212265, 0.0007326007326007327, 0.001961314737314555)
2026-06-18 14:12:21,550 - optuna.study.study - INFO - Trial 168 finished with values: [0.0032594745886212265, 0.0007326007326007327, 0.001961314737314555] and parameters: {'n_layers': 3, 'embedding_dim': 32, 'lr': 0.001229746147020764, 'lambda_val': 5.5317064096851435e-06, 'batch_size': 1789, 'optimizer': 'Adam'}.
2026-06-18 14:14:28,891 - experiment_functions - INFO - Early stopping at epoch 3050. Best Metrics: (0.0030788679795951345, 0.0007862826828344071, 0.0020156170095932745)
2026-06-18 14:14:28,996 - optuna.study.study - INFO - Trial 169 finished with values: [0.0030788679795951345, 0.0007862826828344071, 0.0020156170095932745] and parameters: {'n_layers': 4, 'embedding_dim': 64, 'lr': 0.0005516089764502217, 'lambda_val': 0.005988433373997008, 'batch_size': 784, 'optimizer': 'Adam'}.
2026-06-18 14:15:19,556 - experiment_functions - INFO - Early stopping at epoch 1250. Best Metrics: (0.0034126997461981484, 0.0007673361121636984, 0.002146747645331264)
2026-06-18 14:15:19,660 - optuna.study.study - INFO - Trial 170 finished with values: [0.0034126997461981484, 0.0007673361121636984, 0.002146747645331264] and parameters: {'n_layers': 1, 'embedding_dim': 64, 'lr': 0.002487565347422212, 'lambda_val': 1.3344718493912024e-05, 'batch_size': 892, 'optimizer': 'RMSprop'}.
2026-06-18 14:17:15,420 - experiment_functions - INFO - Early stopping at epoch 2550. Best Metrics: (0.0031875745916110716, 0.0008052292535051155, 0.001985974603185633)
2026-06-18 14:17:15,501 - optuna.study.study - INFO - Trial 171 finished with values: [0.0031875745916110716, 0.0008052292535051155, 0.001985974603185633] and parameters: {'n_layers': 4, 'embedding_dim': 128, 'lr': 0.00054735960254125, 'lambda_val': 9.43829822749537e-06, 'batch_size': 2199, 'optimizer': 'Adam'}.
2026-06-18 14:17:37,281 - experiment_functions - INFO - Early stopping at epoch 500. Best Metrics: (0.0006374701471419702, 0.00014525704180876596, 0.00032184830561082274)
2026-06-18 14:17:37,661 - optuna.study.study - INFO - Trial 172 finished with values: [0.0006374701471419702, 0.00014525704180876596, 0.00032184830561082274] and parameters: {'n_layers': 2, 'embedding_dim': 32, 'lr': 0.001229746147020764, 'lambda_val': 0.00029123929001349135, 'batch_size': 1789, 'optimizer': 'SGD'}.
2026-06-18 14:18:42,127 - experiment_functions - INFO - Early stopping at epoch 1550. Best Metrics: (0.002675359970446818, 0.0006504989263609954, 0.0017177018034931345)
2026-06-18 14:18:42,227 - optuna.study.study - INFO - Trial 173 finished with values: [0.002675359970446818, 0.0006504989263609954, 0.0017177018034931345] and parameters: {'n_layers': 1, 'embedding_dim': 128, 'lr': 0.0010554246980588387, 'lambda_val': 0.00022507006239543383, 'batch_size': 2284, 'optimizer': 'RMSprop'}.
2026-06-18 14:21:26,511 - experiment_functions - INFO - Early stopping at epoch 3900. Best Metrics: (0.0038805687664252, 0.0008620689655172414, 0.00249117314790748)
2026-06-18 14:21:26,599 - optuna.study.study - INFO - Trial 174 finished with values: [0.0038805687664252, 0.0008620689655172414, 0.00249117314790748] and parameters: {'n_layers': 2, 'embedding_dim': 128, 'lr': 0.0005796526912711289, 'lambda_val': 0.00029123929001349135, 'batch_size': 945, 'optimizer': 'RMSprop'}.
2026-06-18 14:22:42,120 - experiment_functions - INFO - Early stopping at epoch 1400. Best Metrics: (0.003398322295462112, 0.0008810155361879499, 0.002055912943361833)
2026-06-18 14:22:42,207 - optuna.study.study - INFO - Trial 175 finished with values: [0.003398322295462112, 0.0008810155361879499, 0.002055912943361833] and parameters: {'n_layers': 4, 'embedding_dim': 256, 'lr': 0.002487565347422212, 'lambda_val': 5.672639985302811e-06, 'batch_size': 892, 'optimizer': 'Adam'}.
2026-06-18 14:23:41,247 - experiment_functions - INFO - Early stopping at epoch 1350. Best Metrics: (0.002958620508255502, 0.0007041808765946698, 0.0018471998669430637)
2026-06-18 14:23:41,352 - optuna.study.study - INFO - Trial 176 finished with values: [0.002958620508255502, 0.0007041808765946698, 0.0018471998669430637] and parameters: {'n_layers': 2, 'embedding_dim': 128, 'lr': 0.0010214376144180076, 'lambda_val': 1.455259422316608e-06, 'batch_size': 2863, 'optimizer': 'Adam'}.
2026-06-18 14:25:52,437 - experiment_functions - INFO - Early stopping at epoch 2600. Best Metrics: (0.0035334950378831196, 0.0008683844890741444, 0.002121486097373609)
2026-06-18 14:25:52,746 - optuna.study.study - INFO - Trial 177 finished with values: [0.0035334950378831196, 0.0008683844890741444, 0.002121486097373609] and parameters: {'n_layers': 3, 'embedding_dim': 256, 'lr': 0.00054735960254125, 'lambda_val': 9.43829822749537e-06, 'batch_size': 3622, 'optimizer': 'Adam'}.
2026-06-18 14:28:32,643 - optuna.study.study - INFO - Trial 178 finished with values: [0.002934546022116722, 0.0006615510925855754, 0.001866885819802551] and parameters: {'n_layers': 4, 'embedding_dim': 32, 'lr': 0.0003362909155838135, 'lambda_val': 1.455259422316608e-06, 'batch_size': 2863, 'optimizer': 'RMSprop'}.
2026-06-18 14:30:45,757 - experiment_functions - INFO - Early stopping at epoch 3400. Best Metrics: (0.0034292971838817865, 0.0007847038019451813, 0.0021200023340618747)
2026-06-18 14:30:45,858 - optuna.study.study - INFO - Trial 179 finished with values: [0.0034292971838817865, 0.0007847038019451813, 0.0021200023340618747] and parameters: {'n_layers': 3, 'embedding_dim': 32, 'lr': 0.00054735960254125, 'lambda_val': 0.0005381875648678031, 'batch_size': 784, 'optimizer': 'Adam'}.
2026-06-18 14:33:45,336 - optuna.study.study - INFO - Trial 180 finished with values: [0.004286087860690358, 0.0010467980295566504, 0.0027446879021977904] and parameters: {'n_layers': 4, 'embedding_dim': 128, 'lr': 0.0005796526912711289, 'lambda_val': 5.759063294226392e-05, 'batch_size': 801, 'optimizer': 'RMSprop'}.
2026-06-18 14:35:42,902 - experiment_functions - INFO - Early stopping at epoch 2850. Best Metrics: (0.0042023363679453574, 0.0009978527219906533, 0.002675753781015364)
2026-06-18 14:35:43,015 - optuna.study.study - INFO - Trial 181 finished with values: [0.0042023363679453574, 0.0009978527219906533, 0.002675753781015364] and parameters: {'n_layers': 4, 'embedding_dim': 32, 'lr': 0.0010214376144180076, 'lambda_val': 0.00029123929001349135, 'batch_size': 945, 'optimizer': 'RMSprop'}.
2026-06-18 14:36:21,670 - experiment_functions - INFO - Early stopping at epoch 900. Best Metrics: (0.002937173252906142, 0.000691549829480864, 0.0019166602806892368)
2026-06-18 14:36:21,781 - optuna.study.study - INFO - Trial 182 finished with values: [0.002937173252906142, 0.000691549829480864, 0.0019166602806892368] and parameters: {'n_layers': 1, 'embedding_dim': 128, 'lr': 0.0016391721585660463, 'lambda_val': 0.00022507006239543383, 'batch_size': 3005, 'optimizer': 'RMSprop'}.
2026-06-18 14:36:58,208 - experiment_functions - INFO - Early stopping at epoch 650. Best Metrics: (0.0029876936006127497, 0.0007910193255020842, 0.001911062133608405)
2026-06-18 14:36:58,938 - optuna.study.study - INFO - Trial 183 finished with values: [0.0029876936006127497, 0.0007910193255020842, 0.001911062133608405] and parameters: {'n_layers': 4, 'embedding_dim': 256, 'lr': 0.01251000483486688, 'lambda_val': 1.7089177370137862e-06, 'batch_size': 3609, 'optimizer': 'RMSprop'}.
2026-06-18 14:38:34,004 - experiment_functions - INFO - Early stopping at epoch 2400. Best Metrics: (0.004329090848122356, 0.0009899583175445243, 0.0027160811174408894)
2026-06-18 14:38:34,094 - optuna.study.study - INFO - Trial 184 finished with values: [0.004329090848122356, 0.0009899583175445243, 0.0027160811174408894] and parameters: {'n_layers': 3, 'embedding_dim': 32, 'lr': 0.001229746147020764, 'lambda_val': 2.7945521753203373e-05, 'batch_size': 761, 'optimizer': 'RMSprop'}.
2026-06-18 14:41:39,822 - optuna.study.study - INFO - Trial 185 finished with values: [0.003567675652227438, 0.0008762788935202728, 0.0022432462552041668] and parameters: {'n_layers': 2, 'embedding_dim': 256, 'lr': 0.0005796526912711289, 'lambda_val': 5.672639985302811e-06, 'batch_size': 945, 'optimizer': 'RMSprop'}.
2026-06-18 14:43:28,238 - experiment_functions - INFO - Early stopping at epoch 2600. Best Metrics: (0.0034714530881382504, 0.0008604900846280159, 0.002167090694255132)
2026-06-18 14:43:28,336 - optuna.study.study - INFO - Trial 186 finished with values: [0.0034714530881382504, 0.0008604900846280159, 0.002167090694255132] and parameters: {'n_layers': 4, 'embedding_dim': 64, 'lr': 0.0005796526912711289, 'lambda_val': 1.7089177370137862e-06, 'batch_size': 3250, 'optimizer': 'RMSprop'}.
2026-06-18 14:43:57,900 - experiment_functions - INFO - Early stopping at epoch 550. Best Metrics: (0.003022833297263354, 0.0007957559681697614, 0.0019651540450651393)
2026-06-18 14:43:57,997 - optuna.study.study - INFO - Trial 187 finished with values: [0.003022833297263354, 0.0007957559681697614, 0.0019651540450651393] and parameters: {'n_layers': 3, 'embedding_dim': 256, 'lr': 0.01251000483486688, 'lambda_val': 2.0890410849076465e-05, 'batch_size': 801, 'optimizer': 'RMSprop'}.
2026-06-18 14:44:19,646 - experiment_functions - INFO - Early stopping at epoch 500. Best Metrics: (0.0005239656755378743, 0.0001278893520272831, 0.0002755271770822387)
2026-06-18 14:44:19,980 - optuna.study.study - INFO - Trial 188 finished with values: [0.0005239656755378743, 0.0001278893520272831, 0.0002755271770822387] and parameters: {'n_layers': 3, 'embedding_dim': 32, 'lr': 0.0016391721585660463, 'lambda_val': 3.137531146015085e-05, 'batch_size': 3659, 'optimizer': 'SGD'}.
2026-06-18 14:45:10,378 - experiment_functions - INFO - Early stopping at epoch 1200. Best Metrics: (0.003320937360289022, 0.0007768093974990527, 0.002127695826794073)
2026-06-18 14:45:10,707 - optuna.study.study - INFO - Trial 189 finished with values: [0.003320937360289022, 0.0007768093974990527, 0.002127695826794073] and parameters: {'n_layers': 1, 'embedding_dim': 128, 'lr': 0.002487565347422212, 'lambda_val': 1.3344718493912024e-05, 'batch_size': 945, 'optimizer': 'RMSprop'}.
2026-06-18 14:45:54,155 - experiment_functions - INFO - Early stopping at epoch 1050. Best Metrics: (0.0035642265243784, 0.0008399646330680814, 0.00219637858867095)
2026-06-18 14:45:54,254 - optuna.study.study - INFO - Trial 190 finished with values: [0.0035642265243784, 0.0008399646330680814, 0.00219637858867095] and parameters: {'n_layers': 4, 'embedding_dim': 32, 'lr': 0.0016391721585660463, 'lambda_val': 1.455259422316608e-06, 'batch_size': 2199, 'optimizer': 'RMSprop'}.
2026-06-18 14:46:30,263 - experiment_functions - INFO - Early stopping at epoch 650. Best Metrics: (0.0030841732238405407, 0.0008320702286219528, 0.001937391197175847)
2026-06-18 14:46:30,648 - optuna.study.study - INFO - Trial 191 finished with values: [0.0030841732238405407, 0.0008320702286219528, 0.001937391197175847] and parameters: {'n_layers': 4, 'embedding_dim': 256, 'lr': 0.0014232781107049574, 'lambda_val': 0.0010339430296944644, 'batch_size': 2199, 'optimizer': 'RMSprop'}.
2026-06-18 14:47:01,838 - experiment_functions - INFO - Early stopping at epoch 550. Best Metrics: (0.002277569730064247, 0.0006252368321333838, 0.0014485288677917054)
2026-06-18 14:47:01,946 - optuna.study.study - INFO - Trial 192 finished with values: [0.002277569730064247, 0.0006252368321333838, 0.0014485288677917054] and parameters: {'n_layers': 4, 'embedding_dim': 256, 'lr': 0.0016391721585660463, 'lambda_val': 0.030098278842116032, 'batch_size': 3659, 'optimizer': 'RMSprop'}.
2026-06-18 14:47:49,719 - experiment_functions - INFO - Early stopping at epoch 1150. Best Metrics: (0.0029267929101527528, 0.0007104964001515726, 0.0018646875600642245)
2026-06-18 14:47:49,854 - optuna.study.study - INFO - Trial 193 finished with values: [0.0029267929101527528, 0.0007104964001515726, 0.0018646875600642245] and parameters: {'n_layers': 2, 'embedding_dim': 64, 'lr': 0.0014625528771019128, 'lambda_val': 0.0015359029367627384, 'batch_size': 1836, 'optimizer': 'Adam'}.
2026-06-18 14:48:25,491 - experiment_functions - INFO - Early stopping at epoch 850. Best Metrics: (0.0034489882474073494, 0.0008778577744094984, 0.002302195702794862)
2026-06-18 14:48:26,500 - optuna.study.study - INFO - Trial 194 finished with values: [0.0034489882474073494, 0.0008778577744094984, 0.002302195702794862] and parameters: {'n_layers': 4, 'embedding_dim': 32, 'lr': 0.0036999694376910314, 'lambda_val': 1.3344718493912024e-05, 'batch_size': 892, 'optimizer': 'RMSprop'}.
2026-06-18 14:48:53,964 - experiment_functions - INFO - Early stopping at epoch 650. Best Metrics: (0.0029008832909272393, 0.0006205001894657066, 0.0017452432718886594)
2026-06-18 14:48:54,073 - optuna.study.study - INFO - Trial 195 finished with values: [0.0029008832909272393, 0.0006205001894657066, 0.0017452432718886594] and parameters: {'n_layers': 2, 'embedding_dim': 32, 'lr': 0.0016391721585660463, 'lambda_val': 0.005780089569371138, 'batch_size': 2495, 'optimizer': 'RMSprop'}.
2026-06-18 14:49:25,205 - experiment_functions - INFO - Early stopping at epoch 650. Best Metrics: (0.0021703895523154373, 0.0006236579512441581, 0.0014224073130528947)
2026-06-18 14:49:25,519 - optuna.study.study - INFO - Trial 196 finished with values: [0.0021703895523154373, 0.0006236579512441581, 0.0014224073130528947] and parameters: {'n_layers': 4, 'embedding_dim': 128, 'lr': 0.0010214376144180076, 'lambda_val': 0.028108080683562898, 'batch_size': 2863, 'optimizer': 'RMSprop'}.
2026-06-18 14:49:54,997 - experiment_functions - INFO - Early stopping at epoch 550. Best Metrics: (0.003099096628827294, 0.0007578628268283443, 0.00198859148900461)
2026-06-18 14:49:55,329 - optuna.study.study - INFO - Trial 197 finished with values: [0.003099096628827294, 0.0007578628268283443, 0.00198859148900461] and parameters: {'n_layers': 4, 'embedding_dim': 128, 'lr': 0.002487565347422212, 'lambda_val': 0.0017333088639334196, 'batch_size': 2863, 'optimizer': 'RMSprop'}.
2026-06-18 14:50:36,261 - experiment_functions - INFO - Early stopping at epoch 1000. Best Metrics: (0.0032976896447507644, 0.0007720727548313756, 0.0022332988772732656)
2026-06-18 14:50:36,356 - optuna.study.study - INFO - Trial 198 finished with values: [0.0032976896447507644, 0.0007720727548313756, 0.0022332988772732656] and parameters: {'n_layers': 2, 'embedding_dim': 32, 'lr': 0.002487565347422212, 'lambda_val': 1.3344718493912024e-05, 'batch_size': 892, 'optimizer': 'RMSprop'}.
2026-06-18 14:51:07,932 - experiment_functions - INFO - Early stopping at epoch 650. Best Metrics: (0.003060786721962377, 0.0008210180623973728, 0.0019256135619228254)
2026-06-18 14:51:08,040 - optuna.study.study - INFO - Trial 199 finished with values: [0.003060786721962377, 0.0008210180623973728, 0.0019256135619228254] and parameters: {'n_layers': 4, 'embedding_dim': 128, 'lr': 0.002487565347422212, 'lambda_val': 1.3344718493912024e-05, 'batch_size': 2775, 'optimizer': 'RMSprop'}.
2026-06-18 14:51:49,496 - experiment_functions - INFO - Early stopping at epoch 950. Best Metrics: (0.0035962906821784438, 0.0008731211317418214, 0.002203249642706154)
2026-06-18 14:51:49,817 - optuna.study.study - INFO - Trial 200 finished with values: [0.0035962906821784438, 0.0008731211317418214, 0.002203249642706154] and parameters: {'n_layers': 4, 'embedding_dim': 64, 'lr': 0.0016391721585660463, 'lambda_val': 4.669465121966091e-06, 'batch_size': 3250, 'optimizer': 'RMSprop'}.
2026-06-18 14:52:46,753 - experiment_functions - INFO - Early stopping at epoch 1050. Best Metrics: (0.001861074166623738, 0.0005447139067828723, 0.0012061817221678459)
2026-06-18 14:52:46,849 - optuna.study.study - INFO - Trial 201 finished with values: [0.001861074166623738, 0.0005447139067828723, 0.0012061817221678459] and parameters: {'n_layers': 4, 'embedding_dim': 256, 'lr': 0.002025300477572928, 'lambda_val': 0.0930525495443625, 'batch_size': 649, 'optimizer': 'RMSprop'}.
2026-06-18 14:53:08,266 - experiment_functions - INFO - Early stopping at epoch 500. Best Metrics: (0.0005239075875159758, 0.00011367942402425163, 0.0002867396588870775)
2026-06-18 14:53:08,362 - optuna.study.study - INFO - Trial 202 finished with values: [0.0005239075875159758, 0.00011367942402425163, 0.0002867396588870775] and parameters: {'n_layers': 2, 'embedding_dim': 32, 'lr': 0.0005796526912711289, 'lambda_val': 0.00029123929001349135, 'batch_size': 2495, 'optimizer': 'SGD'}.
2026-06-18 14:53:38,031 - experiment_functions - INFO - Early stopping at epoch 550. Best Metrics: (0.0029005371662824495, 0.0007957559681697614, 0.0019215293147429404)
2026-06-18 14:53:38,139 - optuna.study.study - INFO - Trial 203 finished with values: [0.0029005371662824495, 0.0007957559681697614, 0.0019215293147429404] and parameters: {'n_layers': 3, 'embedding_dim': 256, 'lr': 0.0035939494204294854, 'lambda_val': 0.0014016263791028032, 'batch_size': 649, 'optimizer': 'RMSprop'}.
2026-06-18 14:54:12,516 - experiment_functions - INFO - Early stopping at epoch 750. Best Metrics: (0.003616498938411231, 0.0009015409877478844, 0.002252793696531239)
2026-06-18 14:54:13,106 - optuna.study.study - INFO - Trial 204 finished with values: [0.003616498938411231, 0.0009015409877478844, 0.002252793696531239] and parameters: {'n_layers': 4, 'embedding_dim': 96, 'lr': 0.0014232781107049574, 'lambda_val': 0.0010339430296944644, 'batch_size': 2199, 'optimizer': 'RMSprop'}.
2026-06-18 14:55:01,655 - experiment_functions - INFO - Early stopping at epoch 1150. Best Metrics: (0.0028068397192585965, 0.0006820765441455097, 0.0017476930655430719)
2026-06-18 14:55:01,757 - optuna.study.study - INFO - Trial 205 finished with values: [0.0028068397192585965, 0.0006820765441455097, 0.0017476930655430719] and parameters: {'n_layers': 1, 'embedding_dim': 128, 'lr': 0.003855829449851487, 'lambda_val': 2.7945521753203373e-05, 'batch_size': 2222, 'optimizer': 'RMSprop'}.
2026-06-18 14:55:28,418 - experiment_functions - INFO - Early stopping at epoch 500. Best Metrics: (0.0005126615842446114, 0.00010736390046734875, 0.0002428379448122277)
2026-06-18 14:55:28,516 - optuna.study.study - INFO - Trial 206 finished with values: [0.0005126615842446114, 0.00010736390046734875, 0.0002428379448122277] and parameters: {'n_layers': 3, 'embedding_dim': 256, 'lr': 0.002025300477572928, 'lambda_val': 3.83795684112999e-06, 'batch_size': 1934, 'optimizer': 'SGD'}.
2026-06-18 14:56:36,500 - experiment_functions - INFO - Early stopping at epoch 1700. Best Metrics: (0.00452526115311211, 0.0010499557913351016, 0.002863038032800313)
2026-06-18 14:56:36,598 - optuna.study.study - INFO - Trial 207 finished with values: [0.00452526115311211, 0.0010499557913351016, 0.002863038032800313] and parameters: {'n_layers': 4, 'embedding_dim': 32, 'lr': 0.001332731741784367, 'lambda_val': 1.7089177370137862e-06, 'batch_size': 801, 'optimizer': 'RMSprop'}.
2026-06-18 14:57:36,679 - experiment_functions - INFO - Early stopping at epoch 1250. Best Metrics: (0.0030605900882989317, 0.0008099658961727927, 0.001962040255726984)
