2026-06-17 08:52:42,269 - optuna.study.study - INFO - Trial 174 finished with values: [0.00046954496216694466, 0.00012315270935960593, 0.00026096167634190304] and parameters: {'n_layers': 2, 'embedding_dim': 32, 'lr': 0.007822927276622295, 'lambda_val': 0.0009466382313788157, 'batch_size': 3313, 'optimizer': 'SGD'}.
2026-06-17 08:53:09,004 - experiment_functions - INFO - Early stopping at epoch 550. Best Metrics: (0.0024853484685163373, 0.0010689023620058104, 0.0018291046452175276)
2026-06-17 08:53:09,166 - optuna.study.study - INFO - Trial 175 finished with values: [0.0024853484685163373, 0.0010689023620058104, 0.0018291046452175276] and parameters: {'n_layers': 2, 'embedding_dim': 128, 'lr': 0.002529382350283866, 'lambda_val': 3.601407739825019e-05, 'batch_size': 1271, 'optimizer': 'RMSprop'}.
2026-06-17 08:53:34,749 - experiment_functions - INFO - Early stopping at epoch 550. Best Metrics: (0.0028240217350099473, 0.001293103448275862, 0.002064688927990163)
2026-06-17 08:53:35,090 - optuna.study.study - INFO - Trial 176 finished with values: [0.0028240217350099473, 0.001293103448275862, 0.002064688927990163] and parameters: {'n_layers': 1, 'embedding_dim': 96, 'lr': 0.004595237871810009, 'lambda_val': 0.014277267650677024, 'batch_size': 1833, 'optimizer': 'Adam'}.
2026-06-17 08:54:01,677 - experiment_functions - INFO - Early stopping at epoch 550. Best Metrics: (0.0025906565877386297, 0.0010389036251105216, 0.0017374686771210604)
2026-06-17 08:54:01,751 - optuna.study.study - INFO - Trial 177 finished with values: [0.0025906565877386297, 0.0010389036251105216, 0.0017374686771210604] and parameters: {'n_layers': 2, 'embedding_dim': 128, 'lr': 0.004595237871810009, 'lambda_val': 3.567347607875195e-06, 'batch_size': 3433, 'optimizer': 'RMSprop'}.
2026-06-17 08:54:28,611 - experiment_functions - INFO - Early stopping at epoch 550. Best Metrics: (0.0033960454041542854, 0.0013688897309586962, 0.002309709800047506)
2026-06-17 08:54:28,689 - optuna.study.study - INFO - Trial 178 finished with values: [0.0033960454041542854, 0.0013688897309586962, 0.002309709800047506] and parameters: {'n_layers': 2, 'embedding_dim': 128, 'lr': 0.004595237871810009, 'lambda_val': 6.565445017278844e-05, 'batch_size': 628, 'optimizer': 'Adam'}.
2026-06-17 08:54:55,252 - experiment_functions - INFO - Early stopping at epoch 550. Best Metrics: (0.002500842485284115, 0.0010357458633320704, 0.0016671540403292258)
2026-06-17 08:54:55,327 - optuna.study.study - INFO - Trial 179 finished with values: [0.002500842485284115, 0.0010357458633320704, 0.0016671540403292258] and parameters: {'n_layers': 2, 'embedding_dim': 128, 'lr': 0.010203021680640975, 'lambda_val': 0.00026385332315698477, 'batch_size': 1844, 'optimizer': 'RMSprop'}.
2026-06-17 08:55:20,632 - experiment_functions - INFO - Early stopping at epoch 550. Best Metrics: (0.0032021781633489025, 0.0012725779967159277, 0.002226909936181719)
2026-06-17 08:55:20,700 - optuna.study.study - INFO - Trial 180 finished with values: [0.0032021781633489025, 0.0012725779967159277, 0.002226909936181719] and parameters: {'n_layers': 1, 'embedding_dim': 64, 'lr': 0.002231043752262738, 'lambda_val': 1.031526593103832e-05, 'batch_size': 3704, 'optimizer': 'RMSprop'}.
2026-06-17 08:58:09,376 - optuna.study.study - INFO - Trial 181 finished with values: [0.0007079024389928149, 0.00016578249336870026, 0.00040379081295061525] and parameters: {'n_layers': 2, 'embedding_dim': 64, 'lr': 3.452014455450767e-05, 'lambda_val': 1.031526593103832e-05, 'batch_size': 3410, 'optimizer': 'Adam'}.
2026-06-17 08:58:34,211 - experiment_functions - INFO - Early stopping at epoch 550. Best Metrics: (0.003270298060407708, 0.0012173171655930279, 0.0020584064606366526)
2026-06-17 08:58:34,305 - optuna.study.study - INFO - Trial 182 finished with values: [0.003270298060407708, 0.0012173171655930279, 0.0020584064606366526] and parameters: {'n_layers': 1, 'embedding_dim': 32, 'lr': 0.046129598836200957, 'lambda_val': 1.7261189135715837e-05, 'batch_size': 1310, 'optimizer': 'Adam'}.
2026-06-17 08:59:02,459 - experiment_functions - INFO - Early stopping at epoch 650. Best Metrics: (0.003706148275417759, 0.0014162561576354681, 0.002584967733847102)
2026-06-17 08:59:02,551 - optuna.study.study - INFO - Trial 183 finished with values: [0.003706148275417759, 0.0014162561576354681, 0.002584967733847102] and parameters: {'n_layers': 1, 'embedding_dim': 32, 'lr': 0.002231043752262738, 'lambda_val': 6.872101199763191e-06, 'batch_size': 1921, 'optimizer': 'Adam'}.
2026-06-17 08:59:27,447 - experiment_functions - INFO - Early stopping at epoch 550. Best Metrics: (0.003196131397063668, 0.0011557408109132245, 0.0020828480513816546)
2026-06-17 08:59:27,534 - optuna.study.study - INFO - Trial 184 finished with values: [0.003196131397063668, 0.0011557408109132245, 0.0020828480513816546] and parameters: {'n_layers': 1, 'embedding_dim': 32, 'lr': 0.024484365885130848, 'lambda_val': 1.7261189135715837e-05, 'batch_size': 1310, 'optimizer': 'RMSprop'}.
2026-06-17 08:59:51,792 - experiment_functions - INFO - Early stopping at epoch 550. Best Metrics: (0.003307686356003807, 0.0012946823291650879, 0.0023029679326008784)
2026-06-17 08:59:51,873 - optuna.study.study - INFO - Trial 185 finished with values: [0.003307686356003807, 0.0012946823291650879, 0.0023029679326008784] and parameters: {'n_layers': 2, 'embedding_dim': 64, 'lr': 0.003877789258066795, 'lambda_val': 0.0024733449146701184, 'batch_size': 2433, 'optimizer': 'Adam'}.
2026-06-17 09:00:16,083 - experiment_functions - INFO - Early stopping at epoch 550. Best Metrics: (0.0033326094311602944, 0.0012804724011620564, 0.0022358131254269506)
2026-06-17 09:00:16,187 - optuna.study.study - INFO - Trial 186 finished with values: [0.0033326094311602944, 0.0012804724011620564, 0.0022358131254269506] and parameters: {'n_layers': 1, 'embedding_dim': 64, 'lr': 0.046129598836200957, 'lambda_val': 1.7261189135715837e-05, 'batch_size': 3433, 'optimizer': 'Adam'}.
2026-06-17 09:01:18,840 - experiment_functions - INFO - Early stopping at epoch 1500. Best Metrics: (0.003775777481153427, 0.0014699381078691425, 0.002606645784674424)
2026-06-17 09:01:18,919 - optuna.study.study - INFO - Trial 187 finished with values: [0.003775777481153427, 0.0014699381078691425, 0.002606645784674424] and parameters: {'n_layers': 1, 'embedding_dim': 32, 'lr': 0.0005503649596872748, 'lambda_val': 3.737769038654263e-05, 'batch_size': 965, 'optimizer': 'Adam'}.
2026-06-17 09:02:53,403 - experiment_functions - INFO - Early stopping at epoch 2150. Best Metrics: (0.003550776667806095, 0.0011952128331438679, 0.0023063322623848997)
2026-06-17 09:02:53,485 - optuna.study.study - INFO - Trial 188 finished with values: [0.003550776667806095, 0.0011952128331438679, 0.0023063322623848997] and parameters: {'n_layers': 3, 'embedding_dim': 128, 'lr': 0.024484365885130848, 'lambda_val': 1.7261189135715837e-05, 'batch_size': 1310, 'optimizer': 'RMSprop'}.
2026-06-17 09:03:22,470 - experiment_functions - INFO - Early stopping at epoch 600. Best Metrics: (0.003591828758264085, 0.0014336238474169508, 0.002491395094627119)
2026-06-17 09:03:22,555 - optuna.study.study - INFO - Trial 189 finished with values: [0.003591828758264085, 0.0014336238474169508, 0.002491395094627119] and parameters: {'n_layers': 1, 'embedding_dim': 256, 'lr': 0.003877789258066795, 'lambda_val': 0.00016666322755616337, 'batch_size': 2336, 'optimizer': 'Adam'}.
2026-06-17 09:03:49,255 - experiment_functions - INFO - Early stopping at epoch 600. Best Metrics: (0.004022821451913916, 0.0015109890109890113, 0.0027111099641858724)
2026-06-17 09:03:49,387 - optuna.study.study - INFO - Trial 190 finished with values: [0.004022821451913916, 0.0015109890109890113, 0.0027111099641858724] and parameters: {'n_layers': 1, 'embedding_dim': 96, 'lr': 0.003877789258066795, 'lambda_val': 0.00016666322755616337, 'batch_size': 1833, 'optimizer': 'Adam'}.
2026-06-17 09:04:32,581 - experiment_functions - INFO - Early stopping at epoch 1000. Best Metrics: (0.003618790596357347, 0.0010357458633320704, 0.002179979625061748)
2026-06-17 09:04:32,685 - optuna.study.study - INFO - Trial 191 finished with values: [0.003618790596357347, 0.0010357458633320704, 0.002179979625061748] and parameters: {'n_layers': 1, 'embedding_dim': 64, 'lr': 0.046129598836200957, 'lambda_val': 5.2927329941475195e-06, 'batch_size': 1310, 'optimizer': 'RMSprop'}.
2026-06-17 09:05:19,192 - experiment_functions - INFO - Early stopping at epoch 1150. Best Metrics: (0.00044564553857797903, 0.00010104837691044589, 0.00023446487533827843)
2026-06-17 09:05:19,262 - optuna.study.study - INFO - Trial 192 finished with values: [0.00044564553857797903, 0.00010104837691044589, 0.00023446487533827843] and parameters: {'n_layers': 1, 'embedding_dim': 64, 'lr': 2.413073955511862e-05, 'lambda_val': 6.872101199763191e-06, 'batch_size': 1310, 'optimizer': 'RMSprop'}.
2026-06-17 09:06:40,913 - experiment_functions - INFO - Early stopping at epoch 2000. Best Metrics: (0.003677084799759111, 0.0015330933434381713, 0.00268358520100798)
2026-06-17 09:06:40,996 - optuna.study.study - INFO - Trial 193 finished with values: [0.003677084799759111, 0.0015330933434381713, 0.00268358520100798] and parameters: {'n_layers': 1, 'embedding_dim': 64, 'lr': 0.0004860515181398459, 'lambda_val': 6.872101199763191e-06, 'batch_size': 1599, 'optimizer': 'RMSprop'}.
2026-06-17 09:07:35,157 - experiment_functions - INFO - Early stopping at epoch 1200. Best Metrics: (0.002270179892439374, 0.0008778577744094986, 0.0015506355011340475)
2026-06-17 09:07:35,242 - optuna.study.study - INFO - Trial 194 finished with values: [0.002270179892439374, 0.0008778577744094986, 0.0015506355011340475] and parameters: {'n_layers': 1, 'embedding_dim': 256, 'lr': 0.046129598836200957, 'lambda_val': 0.0008240497651178975, 'batch_size': 2572, 'optimizer': 'RMSprop'}.
2026-06-17 09:08:04,763 - experiment_functions - INFO - Early stopping at epoch 650. Best Metrics: (0.003306110768551787, 0.0013467853985095367, 0.0023331306579706074)
2026-06-17 09:08:04,847 - optuna.study.study - INFO - Trial 195 finished with values: [0.003306110768551787, 0.0013467853985095367, 0.0023331306579706074] and parameters: {'n_layers': 1, 'embedding_dim': 64, 'lr': 0.001121895106789757, 'lambda_val': 1.5216807094072505e-05, 'batch_size': 1753, 'optimizer': 'RMSprop'}.
2026-06-17 09:08:33,633 - experiment_functions - INFO - Early stopping at epoch 600. Best Metrics: (0.0027626761666220967, 0.001098901098901099, 0.001857925153289597)
2026-06-17 09:08:33,717 - optuna.study.study - INFO - Trial 196 finished with values: [0.0027626761666220967, 0.001098901098901099, 0.001857925153289597] and parameters: {'n_layers': 3, 'embedding_dim': 128, 'lr': 0.002529382350283866, 'lambda_val': 6.565445017278844e-05, 'batch_size': 2336, 'optimizer': 'Adam'}.
2026-06-17 09:11:15,945 - optuna.study.study - INFO - Trial 197 finished with values: [0.0012255880079058998, 0.0005778704054566123, 0.0009437322491710118] and parameters: {'n_layers': 2, 'embedding_dim': 32, 'lr': 6.294220039265129e-05, 'lambda_val': 0.0009466382313788157, 'batch_size': 3433, 'optimizer': 'Adam'}.
2026-06-17 09:11:48,124 - experiment_functions - INFO - Early stopping at epoch 750. Best Metrics: (0.0033953620319654835, 0.001365731969180245, 0.0024311837711314234)
2026-06-17 09:11:48,194 - optuna.study.study - INFO - Trial 198 finished with values: [0.0033953620319654835, 0.001365731969180245, 0.0024311837711314234] and parameters: {'n_layers': 1, 'embedding_dim': 32, 'lr': 0.0010209094744396852, 'lambda_val': 1.5216807094072505e-05, 'batch_size': 2685, 'optimizer': 'Adam'}.
2026-06-17 09:13:18,611 - experiment_functions - INFO - Early stopping at epoch 2150. Best Metrics: (0.0033472355267593883, 0.001193633952254642, 0.0021534304502946037)
2026-06-17 09:13:18,684 - optuna.study.study - INFO - Trial 199 finished with values: [0.0033472355267593883, 0.001193633952254642, 0.0021534304502946037] and parameters: {'n_layers': 1, 'embedding_dim': 64, 'lr': 0.060034049813311924, 'lambda_val': 0.00015924027683619893, 'batch_size': 1576, 'optimizer': 'RMSprop'}.
2026-06-17 09:13:45,390 - experiment_functions - INFO - Early stopping at epoch 550. Best Metrics: (0.0029436835450265815, 0.0010973222180118733, 0.001980018187705704)
2026-06-17 09:13:45,474 - optuna.study.study - INFO - Trial 200 finished with values: [0.0029436835450265815, 0.0010973222180118733, 0.001980018187705704] and parameters: {'n_layers': 2, 'embedding_dim': 128, 'lr': 0.002491021087526253, 'lambda_val': 5.2927329941475195e-06, 'batch_size': 2685, 'optimizer': 'RMSprop'}.
2026-06-17 09:14:11,626 - experiment_functions - INFO - Early stopping at epoch 550. Best Metrics: (0.0034003929405071686, 0.0013783630162940508, 0.0023092114427008606)
2026-06-17 09:14:11,719 - optuna.study.study - INFO - Trial 201 finished with values: [0.0034003929405071686, 0.0013783630162940508, 0.0023092114427008606] and parameters: {'n_layers': 1, 'embedding_dim': 128, 'lr': 0.0019791454040792144, 'lambda_val': 0.00016666322755616337, 'batch_size': 1599, 'optimizer': 'RMSprop'}.
2026-06-17 09:14:37,335 - experiment_functions - INFO - Early stopping at epoch 550. Best Metrics: (0.003809402858613125, 0.0014809902740937225, 0.002749899035163783)
2026-06-17 09:14:37,649 - optuna.study.study - INFO - Trial 202 finished with values: [0.003809402858613125, 0.0014809902740937225, 0.002749899035163783] and parameters: {'n_layers': 1, 'embedding_dim': 64, 'lr': 0.007822927276622295, 'lambda_val': 1.7261189135715837e-05, 'batch_size': 3410, 'optimizer': 'Adam'}.
2026-06-17 09:15:08,749 - experiment_functions - INFO - Early stopping at epoch 700. Best Metrics: (0.0035001307509125185, 0.001384678539850954, 0.002366612789788263)
2026-06-17 09:15:08,870 - optuna.study.study - INFO - Trial 203 finished with values: [0.0035001307509125185, 0.001384678539850954, 0.002366612789788263] and parameters: {'n_layers': 1, 'embedding_dim': 64, 'lr': 0.001121895106789757, 'lambda_val': 1.5216807094072505e-05, 'batch_size': 1753, 'optimizer': 'RMSprop'}.
2026-06-17 09:15:38,607 - experiment_functions - INFO - Early stopping at epoch 650. Best Metrics: (0.003567595508299577, 0.0015157256536566881, 0.0025857127683972226)
2026-06-17 09:15:38,697 - optuna.study.study - INFO - Trial 204 finished with values: [0.003567595508299577, 0.0015157256536566881, 0.0025857127683972226] and parameters: {'n_layers': 1, 'embedding_dim': 96, 'lr': 0.002231043752262738, 'lambda_val': 1.7261189135715837e-05, 'batch_size': 1833, 'optimizer': 'Adam'}.
2026-06-17 09:16:04,028 - experiment_functions - INFO - Early stopping at epoch 550. Best Metrics: (0.0035625793090878002, 0.0014920424403183027, 0.00256553497699629)
2026-06-17 09:16:04,101 - optuna.study.study - INFO - Trial 205 finished with values: [0.0035625793090878002, 0.0014920424403183027, 0.00256553497699629] and parameters: {'n_layers': 1, 'embedding_dim': 64, 'lr': 0.003877789258066795, 'lambda_val': 0.00016666322755616337, 'batch_size': 2368, 'optimizer': 'Adam'}.
2026-06-17 09:16:31,515 - experiment_functions - INFO - Early stopping at epoch 600. Best Metrics: (0.003587039602270644, 0.001522041177213591, 0.0026328044792665946)
2026-06-17 09:16:31,590 - optuna.study.study - INFO - Trial 206 finished with values: [0.003587039602270644, 0.001522041177213591, 0.0026328044792665946] and parameters: {'n_layers': 1, 'embedding_dim': 96, 'lr': 0.003877789258066795, 'lambda_val': 2.4817340791419583e-05, 'batch_size': 1833, 'optimizer': 'Adam'}.
2026-06-17 09:17:00,159 - experiment_functions - INFO - Early stopping at epoch 650. Best Metrics: (0.0038429025394646995, 0.0014730958696475937, 0.002629612875316543)
2026-06-17 09:17:00,246 - optuna.study.study - INFO - Trial 207 finished with values: [0.0038429025394646995, 0.0014730958696475937, 0.002629612875316543] and parameters: {'n_layers': 1, 'embedding_dim': 32, 'lr': 0.002231043752262738, 'lambda_val': 1.3052788411163826e-06, 'batch_size': 1687, 'optimizer': 'Adam'}.
2026-06-17 09:17:25,323 - experiment_functions - INFO - Early stopping at epoch 550. Best Metrics: (0.0032407273826628685, 0.0011636352153593533, 0.0020588024749924115)
2026-06-17 09:17:25,390 - optuna.study.study - INFO - Trial 208 finished with values: [0.0032407273826628685, 0.0011636352153593533, 0.0020588024749924115] and parameters: {'n_layers': 3, 'embedding_dim': 32, 'lr': 0.010203021680640975, 'lambda_val': 1.7261189135715837e-05, 'batch_size': 3410, 'optimizer': 'Adam'}.
2026-06-17 09:17:51,356 - experiment_functions - INFO - Early stopping at epoch 550. Best Metrics: (0.0027263494767678616, 0.001059429076670456, 0.0018360430230512654)
2026-06-17 09:17:51,446 - optuna.study.study - INFO - Trial 209 finished with values: [0.0027263494767678616, 0.001059429076670456, 0.0018360430230512654] and parameters: {'n_layers': 1, 'embedding_dim': 96, 'lr': 0.024484365885130848, 'lambda_val': 0.0003883302746608856, 'batch_size': 2433, 'optimizer': 'RMSprop'}.
2026-06-17 09:18:17,338 - experiment_functions - INFO - Early stopping at epoch 550. Best Metrics: (0.0035824169415214786, 0.0014178350385246937, 0.002497048924235353)
2026-06-17 09:18:17,860 - optuna.study.study - INFO - Trial 210 finished with values: [0.0035824169415214786, 0.0014178350385246937, 0.002497048924235353] and parameters: {'n_layers': 1, 'embedding_dim': 96, 'lr': 0.007822927276622295, 'lambda_val': 5.287376550429512e-06, 'batch_size': 2521, 'optimizer': 'Adam'}.
2026-06-17 09:18:42,487 - experiment_functions - INFO - Early stopping at epoch 500. Best Metrics: (0.0006103083780029039, 0.00013420487558418593, 0.0003247226725293589)
2026-06-17 09:18:42,562 - optuna.study.study - INFO - Trial 211 finished with values: [0.0006103083780029039, 0.00013420487558418593, 0.0003247226725293589] and parameters: {'n_layers': 1, 'embedding_dim': 256, 'lr': 0.003877789258066795, 'lambda_val': 0.00016666322755616337, 'batch_size': 2336, 'optimizer': 'SGD'}.
2026-06-17 09:19:20,795 - experiment_functions - INFO - Early stopping at epoch 850. Best Metrics: (0.00323490675416521, 0.0012899456864974106, 0.0022001422383306772)
2026-06-17 09:19:20,886 - optuna.study.study - INFO - Trial 212 finished with values: [0.00323490675416521, 0.0012899456864974106, 0.0022001422383306772] and parameters: {'n_layers': 2, 'embedding_dim': 64, 'lr': 0.0004860515181398459, 'lambda_val': 5.2927329941475195e-06, 'batch_size': 1310, 'optimizer': 'RMSprop'}.
2026-06-17 09:19:44,236 - experiment_functions - INFO - Early stopping at epoch 500. Best Metrics: (0.0004778457340103839, 0.0001231527093596059, 0.00027207400927974735)
2026-06-17 09:19:44,310 - optuna.study.study - INFO - Trial 213 finished with values: [0.0004778457340103839, 0.0001231527093596059, 0.00027207400927974735] and parameters: {'n_layers': 2, 'embedding_dim': 96, 'lr': 0.046129598836200957, 'lambda_val': 5.2927329941475195e-06, 'batch_size': 1310, 'optimizer': 'SGD'}.
2026-06-17 09:20:44,716 - experiment_functions - INFO - Early stopping at epoch 1400. Best Metrics: (0.0038390977794227994, 0.0014936213212075281, 0.0026323482508925997)
2026-06-17 09:20:44,795 - optuna.study.study - INFO - Trial 214 finished with values: [0.0038390977794227994, 0.0014936213212075281, 0.0026323482508925997] and parameters: {'n_layers': 1, 'embedding_dim': 128, 'lr': 0.0006172706266570344, 'lambda_val': 5.2927329941475195e-06, 'batch_size': 1161, 'optimizer': 'RMSprop'}.
2026-06-17 09:21:21,637 - experiment_functions - INFO - Early stopping at epoch 700. Best Metrics: (0.0025149470103538202, 0.001092585575344196, 0.0019135033986407896)
2026-06-17 09:21:21,720 - optuna.study.study - INFO - Trial 215 finished with values: [0.0025149470103538202, 0.001092585575344196, 0.0019135033986407896] and parameters: {'n_layers': 3, 'embedding_dim': 256, 'lr': 0.0007387130436099698, 'lambda_val': 4.570045263342922e-06, 'batch_size': 3433, 'optimizer': 'Adam'}.
2026-06-17 09:21:52,109 - experiment_functions - INFO - Early stopping at epoch 550. Best Metrics: (0.002273614594945507, 0.0010404825059997474, 0.0016661778902182453)
2026-06-17 09:21:53,386 - optuna.study.study - INFO - Trial 216 finished with values: [0.002273614594945507, 0.0010404825059997474, 0.0016661778902182453] and parameters: {'n_layers': 4, 'embedding_dim': 256, 'lr': 0.0010209094744396852, 'lambda_val': 5.2927329941475195e-06, 'batch_size': 4088, 'optimizer': 'RMSprop'}.
2026-06-17 09:22:45,576 - experiment_functions - INFO - Early stopping at epoch 1150. Best Metrics: (0.0037651913816246258, 0.0012204749273714793, 0.0024435723864920755)
2026-06-17 09:22:45,661 - optuna.study.study - INFO - Trial 217 finished with values: [0.0037651913816246258, 0.0012204749273714793, 0.0024435723864920755] and parameters: {'n_layers': 3, 'embedding_dim': 96, 'lr': 0.024484365885130848, 'lambda_val': 5.2927329941475195e-06, 'batch_size': 3823, 'optimizer': 'RMSprop'}.
2026-06-17 09:23:11,030 - experiment_functions - INFO - Early stopping at epoch 550. Best Metrics: (0.004169830231169573, 0.0015915119363395225, 0.00287672447870902)
2026-06-17 09:23:11,105 - optuna.study.study - INFO - Trial 218 finished with values: [0.004169830231169573, 0.0015915119363395225, 0.00287672447870902] and parameters: {'n_layers': 1, 'embedding_dim': 96, 'lr': 0.007822927276622295, 'lambda_val': 3.567347607875195e-06, 'batch_size': 1576, 'optimizer': 'Adam'}.
2026-06-17 09:23:59,038 - experiment_functions - INFO - Early stopping at epoch 1100. Best Metrics: (0.0036414966646452595, 0.0013009978527219908, 0.002390790769484586)
