2026-06-20 13:10:22,864 - optuna.study.study - INFO - Trial 170 finished with values: [0.018309315757492697, 0.004176139952002021, 0.010535490112680018] and parameters: {'n_layers': 2, 'embedding_dim': 64, 'lr': 0.0003197162451785445, 'lambda_val': 0.005967642770254264, 'batch_size': 1380, 'optimizer': 'RMSprop'}.
2026-06-20 13:13:21,810 - optuna.study.study - INFO - Trial 171 finished with values: [0.032785386161984176, 0.006842869773904256, 0.01863995368211524] and parameters: {'n_layers': 1, 'embedding_dim': 128, 'lr': 0.0009798834021344095, 'lambda_val': 5.848323299602918e-05, 'batch_size': 2195, 'optimizer': 'Adam'}.
2026-06-20 13:15:26,615 - experiment_functions - INFO - Early stopping at epoch 3100. Best Metrics: (0.0006818495247167422, 0.0001484148035872174, 0.0003909677094528183)
2026-06-20 13:15:26,689 - optuna.study.study - INFO - Trial 172 finished with values: [0.0006818495247167422, 0.0001484148035872174, 0.0003909677094528183] and parameters: {'n_layers': 1, 'embedding_dim': 64, 'lr': 0.0001943300564391481, 'lambda_val': 3.0549894793457165e-06, 'batch_size': 2449, 'optimizer': 'Adam'}.
2026-06-20 13:16:51,232 - experiment_functions - INFO - Early stopping at epoch 1750. Best Metrics: (0.019343426980818566, 0.004329291398256915, 0.010814892991793746)
2026-06-20 13:16:51,302 - optuna.study.study - INFO - Trial 173 finished with values: [0.019343426980818566, 0.004329291398256915, 0.010814892991793746] and parameters: {'n_layers': 4, 'embedding_dim': 96, 'lr': 0.0003197162451785445, 'lambda_val': 0.005967642770254264, 'batch_size': 1271, 'optimizer': 'RMSprop'}.
2026-06-20 13:19:31,858 - optuna.study.study - INFO - Trial 174 finished with values: [0.0008370664575810031, 0.00019262346848553748, 0.00048535164995232636] and parameters: {'n_layers': 1, 'embedding_dim': 64, 'lr': 0.00018526976069552334, 'lambda_val': 1.4891573500580198e-05, 'batch_size': 2734, 'optimizer': 'RMSprop'}.
2026-06-20 13:20:31,819 - experiment_functions - INFO - Early stopping at epoch 1100. Best Metrics: (0.024958716590078082, 0.005284514336238475, 0.01430180582980435)
2026-06-20 13:20:31,890 - optuna.study.study - INFO - Trial 175 finished with values: [0.024958716590078082, 0.005284514336238475, 0.01430180582980435] and parameters: {'n_layers': 2, 'embedding_dim': 256, 'lr': 0.0012029727538128135, 'lambda_val': 0.0004242504250406823, 'batch_size': 1380, 'optimizer': 'Adam'}.
2026-06-20 13:21:13,141 - experiment_functions - INFO - Early stopping at epoch 950. Best Metrics: (0.00047615232049301643, 0.00010736390046734875, 0.00023649655561619871)
2026-06-20 13:21:13,216 - optuna.study.study - INFO - Trial 176 finished with values: [0.00047615232049301643, 0.00010736390046734875, 0.00023649655561619871] and parameters: {'n_layers': 4, 'embedding_dim': 32, 'lr': 2.36036676053674e-05, 'lambda_val': 3.2614324792273263e-06, 'batch_size': 1380, 'optimizer': 'RMSprop'}.
2026-06-20 13:23:56,498 - optuna.study.study - INFO - Trial 177 finished with values: [0.03458459001870586, 0.007093911835291147, 0.01955091031281119] and parameters: {'n_layers': 1, 'embedding_dim': 32, 'lr': 0.0015403750227822883, 'lambda_val': 2.3871418678853867e-05, 'batch_size': 2177, 'optimizer': 'Adam'}.
2026-06-20 13:24:39,091 - experiment_functions - INFO - Early stopping at epoch 800. Best Metrics: (0.020056670913493214, 0.004212454212454212, 0.011265995257773819)
2026-06-20 13:24:39,184 - optuna.study.study - INFO - Trial 178 finished with values: [0.020056670913493214, 0.004212454212454212, 0.011265995257773819] and parameters: {'n_layers': 4, 'embedding_dim': 128, 'lr': 0.0009942243415015796, 'lambda_val': 5.848323299602918e-05, 'batch_size': 1643, 'optimizer': 'Adam'}.
2026-06-20 13:28:30,283 - optuna.study.study - INFO - Trial 179 finished with values: [0.024435957014321177, 0.005262410003789315, 0.013774570425866885] and parameters: {'n_layers': 3, 'embedding_dim': 256, 'lr': 0.00023729211693529712, 'lambda_val': 6.639634996787226e-05, 'batch_size': 3872, 'optimizer': 'Adam'}.
2026-06-20 13:31:18,187 - optuna.study.study - INFO - Trial 180 finished with values: [0.03363443805877915, 0.007016546671719085, 0.019462647456321983] and parameters: {'n_layers': 1, 'embedding_dim': 64, 'lr': 0.0015403750227822883, 'lambda_val': 2.4073778609387448e-06, 'batch_size': 1271, 'optimizer': 'Adam'}.
2026-06-20 13:32:20,068 - experiment_functions - INFO - Early stopping at epoch 1450. Best Metrics: (0.01597512325785925, 0.00339143615005684, 0.008869281704901387)
2026-06-20 13:32:20,155 - optuna.study.study - INFO - Trial 181 finished with values: [0.01597512325785925, 0.00339143615005684, 0.008869281704901387] and parameters: {'n_layers': 1, 'embedding_dim': 64, 'lr': 0.006719843485367568, 'lambda_val': 3.0549894793457165e-06, 'batch_size': 2449, 'optimizer': 'RMSprop'}.
2026-06-20 13:32:59,787 - experiment_functions - INFO - Early stopping at epoch 850. Best Metrics: (0.02430392599295722, 0.005162940507768094, 0.01399679761539628)
2026-06-20 13:32:59,867 - optuna.study.study - INFO - Trial 182 finished with values: [0.02430392599295722, 0.005162940507768094, 0.01399679761539628] and parameters: {'n_layers': 3, 'embedding_dim': 64, 'lr': 0.0012029727538128135, 'lambda_val': 2.3871418678853867e-05, 'batch_size': 2384, 'optimizer': 'Adam'}.
2026-06-20 13:33:38,857 - experiment_functions - INFO - Early stopping at epoch 800. Best Metrics: (0.0159283924401217, 0.0033645951749400028, 0.008549419524801186)
2026-06-20 13:33:38,925 - optuna.study.study - INFO - Trial 183 finished with values: [0.0159283924401217, 0.0033645951749400028, 0.008549419524801186] and parameters: {'n_layers': 3, 'embedding_dim': 96, 'lr': 0.0012029727538128135, 'lambda_val': 0.0001402861397507204, 'batch_size': 2648, 'optimizer': 'RMSprop'}.
2026-06-20 13:37:29,644 - optuna.study.study - INFO - Trial 184 finished with values: [0.015520114154168867, 0.003610900593659215, 0.008931337378971236] and parameters: {'n_layers': 3, 'embedding_dim': 256, 'lr': 0.00018526976069552334, 'lambda_val': 0.011822413068431218, 'batch_size': 2012, 'optimizer': 'Adam'}.
2026-06-20 13:39:29,627 - experiment_functions - INFO - Early stopping at epoch 2700. Best Metrics: (0.0006154159434391391, 0.00012157382847038021, 0.0003218875029820357)
2026-06-20 13:39:29,694 - optuna.study.study - INFO - Trial 185 finished with values: [0.0006154159434391391, 0.00012157382847038021, 0.0003218875029820357] and parameters: {'n_layers': 4, 'embedding_dim': 64, 'lr': 1.8994394702994777e-05, 'lambda_val': 5.848323299602918e-05, 'batch_size': 3397, 'optimizer': 'Adam'}.
2026-06-20 13:40:08,181 - experiment_functions - INFO - Early stopping at epoch 800. Best Metrics: (0.024479560615911687, 0.005246621194897057, 0.013829088069857087)
2026-06-20 13:40:08,266 - optuna.study.study - INFO - Trial 186 finished with values: [0.024479560615911687, 0.005246621194897057, 0.013829088069857087] and parameters: {'n_layers': 2, 'embedding_dim': 128, 'lr': 0.0015403750227822883, 'lambda_val': 0.001526779508134114, 'batch_size': 1380, 'optimizer': 'Adam'}.
2026-06-20 13:43:21,812 - optuna.study.study - INFO - Trial 187 finished with values: [0.02676908835634797, 0.005742389794113933, 0.015210435161667441] and parameters: {'n_layers': 3, 'embedding_dim': 128, 'lr': 0.00040210644242369826, 'lambda_val': 4.703980448589771e-06, 'batch_size': 1147, 'optimizer': 'Adam'}.
2026-06-20 13:44:03,886 - experiment_functions - INFO - Early stopping at epoch 950. Best Metrics: (0.01602638991579713, 0.0034245926487305803, 0.009352293635971324)
2026-06-20 13:44:03,968 - optuna.study.study - INFO - Trial 188 finished with values: [0.01602638991579713, 0.0034245926487305803, 0.009352293635971324] and parameters: {'n_layers': 4, 'embedding_dim': 32, 'lr': 0.0015403750227822883, 'lambda_val': 0.0004242504250406823, 'batch_size': 2384, 'optimizer': 'RMSprop'}.
2026-06-20 13:45:17,648 - experiment_functions - INFO - Early stopping at epoch 1650. Best Metrics: (0.03215546467754863, 0.006684981684981685, 0.01821381207499119)
2026-06-20 13:45:17,738 - optuna.study.study - INFO - Trial 189 finished with values: [0.03215546467754863, 0.006684981684981685, 0.01821381207499119] and parameters: {'n_layers': 1, 'embedding_dim': 128, 'lr': 0.0015403750227822883, 'lambda_val': 3.0549894793457165e-06, 'batch_size': 2449, 'optimizer': 'Adam'}.
2026-06-20 13:45:44,595 - experiment_functions - INFO - Early stopping at epoch 600. Best Metrics: (0.020473468916852616, 0.0043040293040293035, 0.011220699441276053)
2026-06-20 13:45:44,729 - optuna.study.study - INFO - Trial 190 finished with values: [0.020473468916852616, 0.0043040293040293035, 0.011220699441276053] and parameters: {'n_layers': 2, 'embedding_dim': 32, 'lr': 0.006719843485367568, 'lambda_val': 3.0549894793457165e-06, 'batch_size': 2449, 'optimizer': 'Adam'}.
2026-06-20 13:48:39,825 - optuna.study.study - INFO - Trial 191 finished with values: [0.021023860887135575, 0.0046734874321081215, 0.01229084350538499] and parameters: {'n_layers': 2, 'embedding_dim': 96, 'lr': 0.0003197162451785445, 'lambda_val': 0.005967642770254264, 'batch_size': 1380, 'optimizer': 'RMSprop'}.
2026-06-20 13:50:56,065 - experiment_functions - INFO - Early stopping at epoch 2900. Best Metrics: (0.0005242017098672645, 0.0001310471138057345, 0.00028778960972828684)
2026-06-20 13:50:56,140 - optuna.study.study - INFO - Trial 192 finished with values: [0.0005242017098672645, 0.0001310471138057345, 0.00028778960972828684] and parameters: {'n_layers': 3, 'embedding_dim': 128, 'lr': 5.702538946092329e-05, 'lambda_val': 1.4891573500580198e-05, 'batch_size': 844, 'optimizer': 'RMSprop'}.
2026-06-20 13:51:55,109 - experiment_functions - INFO - Early stopping at epoch 1250. Best Metrics: (0.026261097253280876, 0.005661866868763421, 0.014993716291744211)
2026-06-20 13:51:55,178 - optuna.study.study - INFO - Trial 193 finished with values: [0.026261097253280876, 0.005661866868763421, 0.014993716291744211] and parameters: {'n_layers': 2, 'embedding_dim': 128, 'lr': 0.0009241097994190195, 'lambda_val': 0.0025257501120737125, 'batch_size': 1271, 'optimizer': 'Adam'}.
2026-06-20 13:53:22,203 - experiment_functions - INFO - Early stopping at epoch 1800. Best Metrics: (0.02807924121983399, 0.0059539598332701785, 0.015944634818187895)
2026-06-20 13:53:22,522 - optuna.study.study - INFO - Trial 194 finished with values: [0.02807924121983399, 0.0059539598332701785, 0.015944634818187895] and parameters: {'n_layers': 1, 'embedding_dim': 256, 'lr': 0.0009942243415015796, 'lambda_val': 0.0038948567969210083, 'batch_size': 1643, 'optimizer': 'Adam'}.
2026-06-20 13:53:55,868 - experiment_functions - INFO - Early stopping at epoch 650. Best Metrics: (0.020299300633919756, 0.004392446633825945, 0.011321946277608932)
2026-06-20 13:53:55,960 - optuna.study.study - INFO - Trial 195 finished with values: [0.020299300633919756, 0.004392446633825945, 0.011321946277608932] and parameters: {'n_layers': 3, 'embedding_dim': 128, 'lr': 0.0015403750227822883, 'lambda_val': 0.002980377292701446, 'batch_size': 3025, 'optimizer': 'Adam'}.
2026-06-20 13:54:37,777 - experiment_functions - INFO - Early stopping at epoch 950. Best Metrics: (0.0194805868378918, 0.00415087785777441, 0.010871561129647805)
2026-06-20 13:54:37,869 - optuna.study.study - INFO - Trial 196 finished with values: [0.0194805868378918, 0.00415087785777441, 0.010871561129647805] and parameters: {'n_layers': 4, 'embedding_dim': 32, 'lr': 0.0014257575686740206, 'lambda_val': 4.703980448589771e-06, 'batch_size': 1183, 'optimizer': 'Adam'}.
2026-06-20 13:58:27,062 - optuna.study.study - INFO - Trial 197 finished with values: [0.024579367950894982, 0.005431350258936466, 0.014105197076774293] and parameters: {'n_layers': 3, 'embedding_dim': 256, 'lr': 0.00023729211693529712, 'lambda_val': 0.00013603043494972295, 'batch_size': 2012, 'optimizer': 'RMSprop'}.
2026-06-20 14:01:17,708 - optuna.study.study - INFO - Trial 198 finished with values: [0.021052332180026462, 0.004690855121889605, 0.011629594359683868] and parameters: {'n_layers': 2, 'embedding_dim': 64, 'lr': 0.0003197162451785445, 'lambda_val': 0.005967642770254264, 'batch_size': 2606, 'optimizer': 'Adam'}.
2026-06-20 14:01:53,868 - experiment_functions - INFO - Early stopping at epoch 850. Best Metrics: (0.0006142644516766449, 0.00013262599469496023, 0.00034425496687595284)
2026-06-20 14:01:54,620 - optuna.study.study - INFO - Trial 199 finished with values: [0.0006142644516766449, 0.00013262599469496023, 0.00034425496687595284] and parameters: {'n_layers': 2, 'embedding_dim': 32, 'lr': 0.00010427648469131211, 'lambda_val': 0.0032201101504106306, 'batch_size': 2009, 'optimizer': 'RMSprop'}.
2026-06-20 14:04:43,973 - optuna.study.study - INFO - Trial 200 finished with values: [0.004681521187370546, 0.0010973222180118735, 0.0028594106405152786] and parameters: {'n_layers': 1, 'embedding_dim': 128, 'lr': 0.00046312276480803076, 'lambda_val': 0.001526779508134114, 'batch_size': 1271, 'optimizer': 'Adam'}.
2026-06-20 14:06:08,015 - experiment_functions - INFO - Early stopping at epoch 1950. Best Metrics: (0.02662115582263307, 0.005845017051913604, 0.014735376236617158)
2026-06-20 14:06:08,108 - optuna.study.study - INFO - Trial 201 finished with values: [0.02662115582263307, 0.005845017051913604, 0.014735376236617158] and parameters: {'n_layers': 1, 'embedding_dim': 96, 'lr': 0.0009942243415015796, 'lambda_val': 0.010712867204290835, 'batch_size': 1731, 'optimizer': 'Adam'}.
2026-06-20 14:08:51,995 - optuna.study.study - INFO - Trial 202 finished with values: [0.03302508642863772, 0.00686023746368574, 0.018899225587412954] and parameters: {'n_layers': 1, 'embedding_dim': 32, 'lr': 0.0013536067835738764, 'lambda_val': 4.703980448589771e-06, 'batch_size': 1731, 'optimizer': 'Adam'}.
2026-06-20 14:09:38,907 - experiment_functions - INFO - Early stopping at epoch 1100. Best Metrics: (0.010989295470926383, 0.002813565744600227, 0.006031352858375142)
2026-06-20 14:09:38,984 - optuna.study.study - INFO - Trial 203 finished with values: [0.010989295470926383, 0.002813565744600227, 0.006031352858375142] and parameters: {'n_layers': 1, 'embedding_dim': 64, 'lr': 0.0012029727538128135, 'lambda_val': 0.07832052128683464, 'batch_size': 3648, 'optimizer': 'Adam'}.
2026-06-20 14:11:39,413 - experiment_functions - INFO - Early stopping at epoch 2850. Best Metrics: (0.03371957841957456, 0.0069376026272578, 0.019624617289873764)
2026-06-20 14:11:39,494 - optuna.study.study - INFO - Trial 204 finished with values: [0.03371957841957456, 0.0069376026272578, 0.019624617289873764] and parameters: {'n_layers': 1, 'embedding_dim': 64, 'lr': 0.0015403750227822883, 'lambda_val': 2.4073778609387448e-06, 'batch_size': 2177, 'optimizer': 'Adam'}.
2026-06-20 14:12:53,251 - experiment_functions - INFO - Early stopping at epoch 1750. Best Metrics: (0.02815928394905641, 0.005895541240368827, 0.015930458751485573)
2026-06-20 14:12:53,320 - optuna.study.study - INFO - Trial 205 finished with values: [0.02815928394905641, 0.005895541240368827, 0.015930458751485573] and parameters: {'n_layers': 2, 'embedding_dim': 32, 'lr': 0.0009241097994190195, 'lambda_val': 0.0004242504250406823, 'batch_size': 2384, 'optimizer': 'Adam'}.
2026-06-20 14:15:28,839 - experiment_functions - INFO - Early stopping at epoch 3700. Best Metrics: (0.034585574758326604, 0.007108121763294178, 0.019267904779666)
2026-06-20 14:15:28,917 - optuna.study.study - INFO - Trial 206 finished with values: [0.034585574758326604, 0.007108121763294178, 0.019267904779666] and parameters: {'n_layers': 1, 'embedding_dim': 64, 'lr': 0.0012029727538128135, 'lambda_val': 0.0004242504250406823, 'batch_size': 2009, 'optimizer': 'Adam'}.
2026-06-20 14:18:11,935 - optuna.study.study - INFO - Trial 207 finished with values: [0.000977315312122357, 0.00026051534672224326, 0.0005816512764806471] and parameters: {'n_layers': 1, 'embedding_dim': 96, 'lr': 0.0003197162451785445, 'lambda_val': 0.005967642770254264, 'batch_size': 1363, 'optimizer': 'RMSprop'}.
2026-06-20 14:18:34,508 - experiment_functions - INFO - Early stopping at epoch 500. Best Metrics: (0.0005507414570781942, 0.00011525830491347735, 0.00026894752893049935)
2026-06-20 14:18:34,596 - optuna.study.study - INFO - Trial 208 finished with values: [0.0005507414570781942, 0.00011525830491347735, 0.00026894752893049935] and parameters: {'n_layers': 2, 'embedding_dim': 64, 'lr': 0.0015403750227822883, 'lambda_val': 5.090598517742677e-05, 'batch_size': 1783, 'optimizer': 'SGD'}.
2026-06-20 14:19:01,873 - experiment_functions - INFO - Early stopping at epoch 550. Best Metrics: (0.015472351772635898, 0.0033314386762662634, 0.008560475685864042)
2026-06-20 14:19:01,952 - optuna.study.study - INFO - Trial 209 finished with values: [0.015472351772635898, 0.0033314386762662634, 0.008560475685864042] and parameters: {'n_layers': 2, 'embedding_dim': 128, 'lr': 0.006719843485367568, 'lambda_val': 3.0549894793457165e-06, 'batch_size': 2449, 'optimizer': 'Adam'}.
2026-06-20 14:20:27,296 - experiment_functions - INFO - Early stopping at epoch 1450. Best Metrics: (0.024422465346036707, 0.005136099532651258, 0.013842248244781004)
2026-06-20 14:20:27,379 - optuna.study.study - INFO - Trial 210 finished with values: [0.024422465346036707, 0.005136099532651258, 0.013842248244781004] and parameters: {'n_layers': 3, 'embedding_dim': 256, 'lr': 0.00046312276480803076, 'lambda_val': 4.703980448589771e-06, 'batch_size': 3287, 'optimizer': 'Adam'}.
2026-06-20 14:21:12,907 - experiment_functions - INFO - Early stopping at epoch 1050. Best Metrics: (0.02851438768645074, 0.0061750031577617786, 0.01664896223820402)
2026-06-20 14:21:12,993 - optuna.study.study - INFO - Trial 211 finished with values: [0.02851438768645074, 0.0061750031577617786, 0.01664896223820402] and parameters: {'n_layers': 1, 'embedding_dim': 64, 'lr': 0.0015403750227822883, 'lambda_val': 0.0038948567969210083, 'batch_size': 2177, 'optimizer': 'RMSprop'}.
2026-06-20 14:21:43,988 - experiment_functions - INFO - Early stopping at epoch 550. Best Metrics: (0.011696805678613417, 0.0024630541871921183, 0.0066273607992249385)
2026-06-20 14:21:44,084 - optuna.study.study - INFO - Trial 212 finished with values: [0.011696805678613417, 0.0024630541871921183, 0.0066273607992249385] and parameters: {'n_layers': 2, 'embedding_dim': 256, 'lr': 0.019968044823933592, 'lambda_val': 4.703980448589771e-06, 'batch_size': 1147, 'optimizer': 'Adam'}.
2026-06-20 14:22:07,112 - experiment_functions - INFO - Early stopping at epoch 500. Best Metrics: (0.00046215383223895237, 0.00010578501957812304, 0.00023993541133183734)
2026-06-20 14:22:07,213 - optuna.study.study - INFO - Trial 213 finished with values: [0.00046215383223895237, 0.00010578501957812304, 0.00023993541133183734] and parameters: {'n_layers': 1, 'embedding_dim': 128, 'lr': 0.0009942243415015796, 'lambda_val': 0.001526779508134114, 'batch_size': 1643, 'optimizer': 'SGD'}.
2026-06-20 14:24:52,614 - optuna.study.study - INFO - Trial 214 finished with values: [0.03600877878460005, 0.0072123279019830734, 0.020430389554950606] and parameters: {'n_layers': 1, 'embedding_dim': 32, 'lr': 0.0015403750227822883, 'lambda_val': 2.3871418678853867e-05, 'batch_size': 2203, 'optimizer': 'Adam'}.
2026-06-20 14:25:59,121 - experiment_functions - INFO - Early stopping at epoch 1500. Best Metrics: (0.03044970656778668, 0.006268157130226095, 0.01741934080286785)
2026-06-20 14:25:59,208 - optuna.study.study - INFO - Trial 215 finished with values: [0.03044970656778668, 0.006268157130226095, 0.01741934080286785] and parameters: {'n_layers': 2, 'embedding_dim': 64, 'lr': 0.0012029727538128135, 'lambda_val': 2.155585232220033e-06, 'batch_size': 1271, 'optimizer': 'Adam'}.
2026-06-20 14:28:38,442 - experiment_functions - INFO - Early stopping at epoch 3750. Best Metrics: (0.03482863535102836, 0.007201275735758494, 0.01988345438359746)
2026-06-20 14:28:38,521 - optuna.study.study - INFO - Trial 216 finished with values: [0.03482863535102836, 0.007201275735758494, 0.01988345438359746] and parameters: {'n_layers': 1, 'embedding_dim': 64, 'lr': 0.0015403750227822883, 'lambda_val': 0.00040809351692507045, 'batch_size': 1399, 'optimizer': 'Adam'}.
2026-06-20 14:29:09,219 - experiment_functions - INFO - Early stopping at epoch 650. Best Metrics: (0.024449849305262127, 0.005183465959328028, 0.013834116811569878)
2026-06-20 14:29:09,297 - optuna.study.study - INFO - Trial 217 finished with values: [0.024449849305262127, 0.005183465959328028, 0.013834116811569878] and parameters: {'n_layers': 1, 'embedding_dim': 128, 'lr': 0.006719843485367568, 'lambda_val': 0.00046705556927084506, 'batch_size': 1783, 'optimizer': 'Adam'}.
2026-06-20 14:32:40,953 - optuna.study.study - INFO - Trial 218 finished with values: [0.021976751710617026, 0.005080838701528357, 0.012367933669336993] and parameters: {'n_layers': 2, 'embedding_dim': 256, 'lr': 0.00040210644242369826, 'lambda_val': 0.008290433299205244, 'batch_size': 1147, 'optimizer': 'Adam'}.
2026-06-20 14:34:11,293 - experiment_functions - INFO - Early stopping at epoch 1900. Best Metrics: (0.00040569412281808324, 0.00010104837691044589, 0.00022912291429739266)
2026-06-20 14:34:11,369 - optuna.study.study - INFO - Trial 219 finished with values: [0.00040569412281808324, 0.00010104837691044589, 0.00022912291429739266] and parameters: {'n_layers': 1, 'embedding_dim': 256, 'lr': 3.940196868132668e-05, 'lambda_val': 0.0001709584104620503, 'batch_size': 1380, 'optimizer': 'Adam'}.
2026-06-20 14:37:02,184 - optuna.study.study - INFO - Trial 220 finished with values: [0.02465017922091336, 0.005191360363774157, 0.01403116291402909] and parameters: {'n_layers': 4, 'embedding_dim': 32, 'lr': 0.00040210644242369826, 'lambda_val': 0.0009038613669863668, 'batch_size': 2009, 'optimizer': 'RMSprop'}.
2026-06-20 14:37:26,583 - experiment_functions - INFO - Early stopping at epoch 500. Best Metrics: (0.0004918054125540127, 0.00011210054313502589, 0.000296081508953468)
