2026-06-19 02:44:46,558 - optuna.study.study - INFO - Trial 174 finished with values: [0.007801080240055728, 0.001735190097259063, 0.004363090870964523] and parameters: {'n_layers': 2, 'embedding_dim': 128, 'lr': 0.02192370417414713, 'lambda_val': 0.0008294227855036249, 'batch_size': 3284, 'optimizer': 'Adam'}.
2026-06-19 02:45:35,021 - experiment_functions - INFO - Early stopping at epoch 1000. Best Metrics: (0.019090249031336187, 0.004337185802703044, 0.010601335695299984)
2026-06-19 02:45:35,119 - optuna.study.study - INFO - Trial 175 finished with values: [0.019090249031336187, 0.004337185802703044, 0.010601335695299984] and parameters: {'n_layers': 2, 'embedding_dim': 128, 'lr': 0.0008568781075155826, 'lambda_val': 0.01832014163332176, 'batch_size': 2155, 'optimizer': 'Adam'}.
2026-06-19 02:46:01,275 - experiment_functions - INFO - Early stopping at epoch 550. Best Metrics: (0.00897852599214528, 0.001896235947960086, 0.004911880639351264)
2026-06-19 02:46:01,442 - optuna.study.study - INFO - Trial 176 finished with values: [0.00897852599214528, 0.001896235947960086, 0.004911880639351264] and parameters: {'n_layers': 2, 'embedding_dim': 64, 'lr': 0.017170732811474198, 'lambda_val': 7.52425465718907e-06, 'batch_size': 2155, 'optimizer': 'Adam'}.
2026-06-19 02:46:35,545 - experiment_functions - INFO - Early stopping at epoch 650. Best Metrics: (0.024858734151291643, 0.005287672098016926, 0.014175285761182675)
2026-06-19 02:46:36,388 - optuna.study.study - INFO - Trial 177 finished with values: [0.024858734151291643, 0.005287672098016926, 0.014175285761182675] and parameters: {'n_layers': 2, 'embedding_dim': 128, 'lr': 0.00265047718248758, 'lambda_val': 0.0008294227855036249, 'batch_size': 3344, 'optimizer': 'Adam'}.
2026-06-19 02:49:32,297 - experiment_functions - INFO - Early stopping at epoch 3800. Best Metrics: (0.03395115486655805, 0.007097069597069597, 0.019482207288513794)
2026-06-19 02:49:32,404 - optuna.study.study - INFO - Trial 178 finished with values: [0.03395115486655805, 0.007097069597069597, 0.019482207288513794] and parameters: {'n_layers': 1, 'embedding_dim': 128, 'lr': 0.000870520171613823, 'lambda_val': 5.816309683274336e-06, 'batch_size': 2501, 'optimizer': 'RMSprop'}.
2026-06-19 02:52:29,261 - optuna.study.study - INFO - Trial 179 finished with values: [0.031230205971171227, 0.006689718327649362, 0.018097951157422482] and parameters: {'n_layers': 1, 'embedding_dim': 64, 'lr': 0.0017724783344138918, 'lambda_val': 1.356629670066784e-05, 'batch_size': 571, 'optimizer': 'Adam'}.
2026-06-19 02:53:06,279 - experiment_functions - INFO - Early stopping at epoch 750. Best Metrics: (0.020534573589070716, 0.004409814323607427, 0.011594476308599617)
2026-06-19 02:53:06,356 - optuna.study.study - INFO - Trial 180 finished with values: [0.020534573589070716, 0.004409814323607427, 0.011594476308599617] and parameters: {'n_layers': 3, 'embedding_dim': 64, 'lr': 0.0014281200453643641, 'lambda_val': 7.52425465718907e-06, 'batch_size': 2155, 'optimizer': 'Adam'}.
2026-06-19 02:55:56,819 - optuna.study.study - INFO - Trial 181 finished with values: [0.018507675777892307, 0.004326133636478464, 0.011112763448306326] and parameters: {'n_layers': 1, 'embedding_dim': 32, 'lr': 0.0005629311249195415, 'lambda_val': 0.003077942483029095, 'batch_size': 2467, 'optimizer': 'Adam'}.
2026-06-19 02:58:46,574 - optuna.study.study - INFO - Trial 182 finished with values: [0.031071427312923006, 0.00665024630541872, 0.0179357438763171] and parameters: {'n_layers': 1, 'embedding_dim': 32, 'lr': 0.0012134658370028314, 'lambda_val': 5.378527278917821e-06, 'batch_size': 1184, 'optimizer': 'Adam'}.
2026-06-19 02:59:41,876 - experiment_functions - INFO - Early stopping at epoch 1250. Best Metrics: (0.023725407451624176, 0.005215043577112542, 0.013190569528411434)
2026-06-19 02:59:41,967 - optuna.study.study - INFO - Trial 183 finished with values: [0.023725407451624176, 0.005215043577112542, 0.013190569528411434] and parameters: {'n_layers': 2, 'embedding_dim': 32, 'lr': 0.0007989615375802813, 'lambda_val': 0.006446182958325827, 'batch_size': 2155, 'optimizer': 'Adam'}.
2026-06-19 03:01:24,452 - experiment_functions - INFO - Early stopping at epoch 2350. Best Metrics: (0.02530288606455675, 0.0052071491726664145, 0.014544501053329894)
2026-06-19 03:01:24,547 - optuna.study.study - INFO - Trial 184 finished with values: [0.02530288606455675, 0.0052071491726664145, 0.014544501053329894] and parameters: {'n_layers': 1, 'embedding_dim': 64, 'lr': 0.003327615910950817, 'lambda_val': 1.1184488483519006e-06, 'batch_size': 844, 'optimizer': 'RMSprop'}.
2026-06-19 03:03:30,104 - experiment_functions - INFO - Early stopping at epoch 2750. Best Metrics: (0.030669384852253036, 0.006498673740053051, 0.017369101116795366)
2026-06-19 03:03:30,202 - optuna.study.study - INFO - Trial 185 finished with values: [0.030669384852253036, 0.006498673740053051, 0.017369101116795366] and parameters: {'n_layers': 1, 'embedding_dim': 128, 'lr': 0.0012134658370028314, 'lambda_val': 0.003077942483029095, 'batch_size': 1184, 'optimizer': 'Adam'}.
2026-06-19 03:04:55,974 - experiment_functions - INFO - Early stopping at epoch 1800. Best Metrics: (0.022722033573455085, 0.0048897941139320455, 0.012862235998121616)
2026-06-19 03:04:56,146 - optuna.study.study - INFO - Trial 186 finished with values: [0.022722033573455085, 0.0048897941139320455, 0.012862235998121616] and parameters: {'n_layers': 4, 'embedding_dim': 64, 'lr': 0.0008568781075155826, 'lambda_val': 1.7013643059238403e-06, 'batch_size': 1184, 'optimizer': 'Adam'}.
2026-06-19 03:05:26,466 - experiment_functions - INFO - Early stopping at epoch 600. Best Metrics: (0.007580133031491136, 0.0017367689781482886, 0.004365129623577908)
2026-06-19 03:05:26,564 - optuna.study.study - INFO - Trial 187 finished with values: [0.007580133031491136, 0.0017367689781482886, 0.004365129623577908] and parameters: {'n_layers': 2, 'embedding_dim': 128, 'lr': 0.005066433154983977, 'lambda_val': 0.003077942483029095, 'batch_size': 739, 'optimizer': 'Adam'}.
2026-06-19 03:05:54,109 - experiment_functions - INFO - Early stopping at epoch 600. Best Metrics: (0.014103319864354478, 0.0031198686371100167, 0.007781106841048067)
2026-06-19 03:05:54,240 - optuna.study.study - INFO - Trial 188 finished with values: [0.014103319864354478, 0.0031198686371100167, 0.007781106841048067] and parameters: {'n_layers': 1, 'embedding_dim': 32, 'lr': 0.016740598539843506, 'lambda_val': 0.0001180174950905876, 'batch_size': 1184, 'optimizer': 'Adam'}.
2026-06-19 03:06:43,972 - experiment_functions - INFO - Early stopping at epoch 950. Best Metrics: (0.02270312223636091, 0.004848743210812177, 0.012900585500111196)
2026-06-19 03:06:44,098 - optuna.study.study - INFO - Trial 189 finished with values: [0.02270312223636091, 0.004848743210812177, 0.012900585500111196] and parameters: {'n_layers': 3, 'embedding_dim': 128, 'lr': 0.000870520171613823, 'lambda_val': 5.034815386429636e-06, 'batch_size': 2712, 'optimizer': 'Adam'}.
2026-06-19 03:09:38,563 - optuna.study.study - INFO - Trial 190 finished with values: [0.027239227953206456, 0.006010799545282304, 0.015952644305295197] and parameters: {'n_layers': 1, 'embedding_dim': 96, 'lr': 0.0008568781075155826, 'lambda_val': 4.824681967841972e-06, 'batch_size': 1127, 'optimizer': 'Adam'}.
2026-06-19 03:12:41,664 - optuna.study.study - INFO - Trial 191 finished with values: [0.0012207048374205175, 0.0002873563218390805, 0.0006896522280427356] and parameters: {'n_layers': 2, 'embedding_dim': 128, 'lr': 0.00017079078879558854, 'lambda_val': 9.818390321022145e-05, 'batch_size': 1729, 'optimizer': 'Adam'}.
2026-06-19 03:13:08,245 - experiment_functions - INFO - Early stopping at epoch 550. Best Metrics: (0.005673093630680077, 0.0013483642793987623, 0.0033452661115727696)
2026-06-19 03:13:08,334 - optuna.study.study - INFO - Trial 192 finished with values: [0.005673093630680077, 0.0013483642793987623, 0.0033452661115727696] and parameters: {'n_layers': 1, 'embedding_dim': 128, 'lr': 0.0341143902544953, 'lambda_val': 0.000485389202309046, 'batch_size': 844, 'optimizer': 'RMSprop'}.
2026-06-19 03:13:40,979 - experiment_functions - INFO - Early stopping at epoch 650. Best Metrics: (0.008229180280526103, 0.0018315018315018315, 0.0044114445813608506)
2026-06-19 03:13:41,067 - optuna.study.study - INFO - Trial 193 finished with values: [0.008229180280526103, 0.0018315018315018315, 0.0044114445813608506] and parameters: {'n_layers': 2, 'embedding_dim': 128, 'lr': 0.003327615910950817, 'lambda_val': 0.006446182958325827, 'batch_size': 844, 'optimizer': 'Adam'}.
2026-06-19 03:15:14,693 - experiment_functions - INFO - Early stopping at epoch 2150. Best Metrics: (0.03097661411237672, 0.0065081470253884055, 0.01774865343865458)
2026-06-19 03:15:14,789 - optuna.study.study - INFO - Trial 194 finished with values: [0.03097661411237672, 0.0065081470253884055, 0.01774865343865458] and parameters: {'n_layers': 1, 'embedding_dim': 64, 'lr': 0.0017724783344138918, 'lambda_val': 0.0008294227855036249, 'batch_size': 844, 'optimizer': 'Adam'}.
2026-06-19 03:18:17,153 - optuna.study.study - INFO - Trial 195 finished with values: [0.027528200125945538, 0.005865542503473538, 0.0154652259835474] and parameters: {'n_layers': 3, 'embedding_dim': 64, 'lr': 0.0005629311249195415, 'lambda_val': 1.7013643059238403e-06, 'batch_size': 1184, 'optimizer': 'Adam'}.
2026-06-19 03:21:10,309 - optuna.study.study - INFO - Trial 196 finished with values: [0.025583782697953042, 0.005575028419856007, 0.014672450529880988] and parameters: {'n_layers': 3, 'embedding_dim': 32, 'lr': 0.00047314361557403985, 'lambda_val': 0.0001180174950905876, 'batch_size': 825, 'optimizer': 'RMSprop'}.
2026-06-19 03:21:33,367 - experiment_functions - INFO - Early stopping at epoch 500. Best Metrics: (0.0005784152641991477, 0.00012631047113805733, 0.00032249438589824445)
2026-06-19 03:21:33,463 - optuna.study.study - INFO - Trial 197 finished with values: [0.0005784152641991477, 0.00012631047113805733, 0.00032249438589824445] and parameters: {'n_layers': 1, 'embedding_dim': 64, 'lr': 0.0007989615375802813, 'lambda_val': 0.006446182958325827, 'batch_size': 2155, 'optimizer': 'SGD'}.
2026-06-19 03:22:11,460 - experiment_functions - INFO - Early stopping at epoch 850. Best Metrics: (0.028537854075934208, 0.006072375899962108, 0.01644614284072005)
2026-06-19 03:22:11,547 - optuna.study.study - INFO - Trial 198 finished with values: [0.028537854075934208, 0.006072375899962108, 0.01644614284072005] and parameters: {'n_layers': 1, 'embedding_dim': 32, 'lr': 0.003327615910950817, 'lambda_val': 5.034815386429636e-06, 'batch_size': 3561, 'optimizer': 'Adam'}.
2026-06-19 03:25:06,808 - optuna.study.study - INFO - Trial 199 finished with values: [0.025584170136919833, 0.005456612353164077, 0.014580011611666343] and parameters: {'n_layers': 4, 'embedding_dim': 32, 'lr': 0.00045541062412396616, 'lambda_val': 0.0008294227855036249, 'batch_size': 1184, 'optimizer': 'Adam'}.
2026-06-19 03:25:59,486 - experiment_functions - INFO - Early stopping at epoch 1000. Best Metrics: (0.02383814999704195, 0.004971895920171782, 0.013288116894681732)
2026-06-19 03:25:59,592 - optuna.study.study - INFO - Trial 200 finished with values: [0.02383814999704195, 0.004971895920171782, 0.013288116894681732] and parameters: {'n_layers': 3, 'embedding_dim': 128, 'lr': 0.000870520171613823, 'lambda_val': 8.004253683939247e-06, 'batch_size': 3224, 'optimizer': 'Adam'}.
2026-06-19 03:26:30,417 - experiment_functions - INFO - Early stopping at epoch 600. Best Metrics: (0.023899000107647853, 0.005091890867752936, 0.013573859729665993)
2026-06-19 03:26:30,530 - optuna.study.study - INFO - Trial 201 finished with values: [0.023899000107647853, 0.005091890867752936, 0.013573859729665993] and parameters: {'n_layers': 2, 'embedding_dim': 128, 'lr': 0.003327615910950817, 'lambda_val': 0.00016008921216102443, 'batch_size': 3561, 'optimizer': 'Adam'}.
2026-06-19 03:27:21,843 - experiment_functions - INFO - Early stopping at epoch 1150. Best Metrics: (0.029521610503196603, 0.006272893772893772, 0.016964409415920485)
2026-06-19 03:27:21,938 - optuna.study.study - INFO - Trial 202 finished with values: [0.029521610503196603, 0.006272893772893772, 0.016964409415920485] and parameters: {'n_layers': 1, 'embedding_dim': 64, 'lr': 0.0017724783344138918, 'lambda_val': 0.003077942483029095, 'batch_size': 2155, 'optimizer': 'Adam'}.
2026-06-19 03:27:57,702 - experiment_functions - INFO - Early stopping at epoch 700. Best Metrics: (0.025814447433547216, 0.005451875710496401, 0.014697085765077417)
2026-06-19 03:27:57,856 - optuna.study.study - INFO - Trial 203 finished with values: [0.025814447433547216, 0.005451875710496401, 0.014697085765077417] and parameters: {'n_layers': 2, 'embedding_dim': 128, 'lr': 0.002416629047583412, 'lambda_val': 5.816309683274336e-06, 'batch_size': 2501, 'optimizer': 'Adam'}.
2026-06-19 03:28:25,813 - experiment_functions - INFO - Early stopping at epoch 550. Best Metrics: (0.008946383334184566, 0.0018820260199570544, 0.004894956701253203)
2026-06-19 03:28:25,923 - optuna.study.study - INFO - Trial 204 finished with values: [0.008946383334184566, 0.0018820260199570544, 0.004894956701253203] and parameters: {'n_layers': 2, 'embedding_dim': 128, 'lr': 0.02531974949577787, 'lambda_val': 0.0004159798607637914, 'batch_size': 2501, 'optimizer': 'Adam'}.
2026-06-19 03:31:18,463 - optuna.study.study - INFO - Trial 205 finished with values: [0.03193674026588002, 0.006591827712517368, 0.018323796201510666] and parameters: {'n_layers': 1, 'embedding_dim': 64, 'lr': 0.0017724783344138918, 'lambda_val': 0.0008294227855036249, 'batch_size': 844, 'optimizer': 'Adam'}.
2026-06-19 03:33:20,492 - experiment_functions - INFO - Early stopping at epoch 2800. Best Metrics: (0.0006766676755444132, 0.00017051913603637742, 0.00039718263507491946)
2026-06-19 03:33:20,580 - optuna.study.study - INFO - Trial 206 finished with values: [0.0006766676755444132, 0.00017051913603637742, 0.00039718263507491946] and parameters: {'n_layers': 1, 'embedding_dim': 128, 'lr': 0.00024736749475534874, 'lambda_val': 0.003077942483029095, 'batch_size': 1184, 'optimizer': 'Adam'}.
2026-06-19 03:36:13,949 - optuna.study.study - INFO - Trial 207 finished with values: [0.000870338358490565, 0.00018788682581786034, 0.0004678283102347968] and parameters: {'n_layers': 1, 'embedding_dim': 128, 'lr': 0.00015973027939379742, 'lambda_val': 0.0001180174950905876, 'batch_size': 2903, 'optimizer': 'Adam'}.
2026-06-19 03:37:36,699 - experiment_functions - INFO - Early stopping at epoch 1800. Best Metrics: (0.03139426959343983, 0.006604458759631174, 0.01805992974610735)
2026-06-19 03:37:36,792 - optuna.study.study - INFO - Trial 208 finished with values: [0.03139426959343983, 0.006604458759631174, 0.01805992974610735] and parameters: {'n_layers': 1, 'embedding_dim': 128, 'lr': 0.0017724783344138918, 'lambda_val': 0.0008294227855036249, 'batch_size': 1184, 'optimizer': 'Adam'}.
2026-06-19 03:38:23,533 - experiment_functions - INFO - Early stopping at epoch 1000. Best Metrics: (0.026303090011470374, 0.005535556397625364, 0.015184343082255797)
2026-06-19 03:38:23,626 - optuna.study.study - INFO - Trial 209 finished with values: [0.026303090011470374, 0.005535556397625364, 0.015184343082255797] and parameters: {'n_layers': 1, 'embedding_dim': 128, 'lr': 0.003327615910950817, 'lambda_val': 1.1021273729672765e-05, 'batch_size': 844, 'optimizer': 'Adam'}.
2026-06-19 03:41:21,650 - optuna.study.study - INFO - Trial 210 finished with values: [0.029095057515837824, 0.006198686371100164, 0.017169396927501062] and parameters: {'n_layers': 1, 'embedding_dim': 128, 'lr': 0.0008568781075155826, 'lambda_val': 0.0002533310598977532, 'batch_size': 1127, 'optimizer': 'Adam'}.
2026-06-19 03:44:03,127 - experiment_functions - INFO - Early stopping at epoch 3650. Best Metrics: (0.029472027074156176, 0.006250789440444613, 0.016841856191175116)
2026-06-19 03:44:03,220 - optuna.study.study - INFO - Trial 211 finished with values: [0.029472027074156176, 0.006250789440444613, 0.016841856191175116] and parameters: {'n_layers': 2, 'embedding_dim': 64, 'lr': 0.00045541062412396616, 'lambda_val': 5.816309683274336e-06, 'batch_size': 2501, 'optimizer': 'RMSprop'}.
2026-06-19 03:47:04,894 - optuna.study.study - INFO - Trial 212 finished with values: [0.03370160904669067, 0.007044966527725149, 0.01905730577997934] and parameters: {'n_layers': 1, 'embedding_dim': 128, 'lr': 0.0009131147309837565, 'lambda_val': 5.816309683274336e-06, 'batch_size': 2155, 'optimizer': 'Adam'}.
2026-06-19 03:47:30,287 - experiment_functions - INFO - Early stopping at epoch 500. Best Metrics: (0.0005254920710510317, 0.00011210054313502589, 0.0003199642970111621)
2026-06-19 03:47:30,380 - optuna.study.study - INFO - Trial 213 finished with values: [0.0005254920710510317, 0.00011210054313502589, 0.0003199642970111621] and parameters: {'n_layers': 3, 'embedding_dim': 96, 'lr': 0.000870520171613823, 'lambda_val': 0.00020523831534563383, 'batch_size': 2155, 'optimizer': 'SGD'}.
2026-06-19 03:50:25,011 - optuna.study.study - INFO - Trial 214 finished with values: [0.033465816476217554, 0.006937602627257801, 0.01908194744384786] and parameters: {'n_layers': 1, 'embedding_dim': 64, 'lr': 0.0008568781075155826, 'lambda_val': 0.0008294227855036249, 'batch_size': 3284, 'optimizer': 'Adam'}.
2026-06-19 03:50:48,294 - experiment_functions - INFO - Early stopping at epoch 500. Best Metrics: (0.0005841639111232146, 0.0001278893520272831, 0.00032031340127595297)
2026-06-19 03:50:48,396 - optuna.study.study - INFO - Trial 215 finished with values: [0.0005841639111232146, 0.0001278893520272831, 0.00032031340127595297] and parameters: {'n_layers': 1, 'embedding_dim': 64, 'lr': 0.0008568781075155826, 'lambda_val': 0.005087686513146096, 'batch_size': 2155, 'optimizer': 'SGD'}.
2026-06-19 03:53:34,939 - optuna.study.study - INFO - Trial 216 finished with values: [0.024357663959743214, 0.005368195023367437, 0.01427520879146721] and parameters: {'n_layers': 1, 'embedding_dim': 32, 'lr': 0.0008568781075155826, 'lambda_val': 0.0008294227855036249, 'batch_size': 1254, 'optimizer': 'Adam'}.
2026-06-19 03:56:18,765 - experiment_functions - INFO - Early stopping at epoch 3500. Best Metrics: (0.02479970578896821, 0.005368195023367437, 0.01392360807943764)
2026-06-19 03:56:18,863 - optuna.study.study - INFO - Trial 217 finished with values: [0.02479970578896821, 0.005368195023367437, 0.01392360807943764] and parameters: {'n_layers': 4, 'embedding_dim': 64, 'lr': 0.00045541062412396616, 'lambda_val': 5.816309683274336e-06, 'batch_size': 1245, 'optimizer': 'RMSprop'}.
2026-06-19 03:57:54,972 - experiment_functions - INFO - Early stopping at epoch 1900. Best Metrics: (0.030346060747295543, 0.006373942149804219, 0.017327830633922587)
2026-06-19 03:57:55,062 - optuna.study.study - INFO - Trial 218 finished with values: [0.030346060747295543, 0.006373942149804219, 0.017327830633922587] and parameters: {'n_layers': 1, 'embedding_dim': 256, 'lr': 0.0018715145286522033, 'lambda_val': 1.7013643059238403e-06, 'batch_size': 1184, 'optimizer': 'Adam'}.
2026-06-19 03:58:23,340 - experiment_functions - INFO - Early stopping at epoch 600. Best Metrics: (0.0005038254127073656, 0.00011367942402425162, 0.0002996112826410707)
2026-06-19 03:58:23,444 - optuna.study.study - INFO - Trial 219 finished with values: [0.0005038254127073656, 0.00011367942402425162, 0.0002996112826410707] and parameters: {'n_layers': 2, 'embedding_dim': 64, 'lr': 2.186133025458446e-05, 'lambda_val': 5.034815386429636e-06, 'batch_size': 2612, 'optimizer': 'Adam'}.
2026-06-19 03:59:50,558 - experiment_functions - INFO - Early stopping at epoch 2000. Best Metrics: (0.027829189294886952, 0.005751863079449288, 0.01587536317291471)
2026-06-19 03:59:50,649 - optuna.study.study - INFO - Trial 220 finished with values: [0.027829189294886952, 0.005751863079449288, 0.01587536317291471] and parameters: {'n_layers': 1, 'embedding_dim': 64, 'lr': 0.003327615910950817, 'lambda_val': 5.034815386429636e-06, 'batch_size': 571, 'optimizer': 'Adam'}.
2026-06-19 04:02:15,653 - experiment_functions - INFO - Early stopping at epoch 3250. Best Metrics: (0.02935578371866528, 0.006149741063534167, 0.01680188784981301)
2026-06-19 04:02:15,753 - optuna.study.study - INFO - Trial 221 finished with values: [0.02935578371866528, 0.006149741063534167, 0.01680188784981301] and parameters: {'n_layers': 2, 'embedding_dim': 64, 'lr': 0.0009110225934635639, 'lambda_val': 0.000485389202309046, 'batch_size': 1169, 'optimizer': 'Adam'}.
2026-06-19 04:05:16,786 - optuna.study.study - INFO - Trial 222 finished with values: [0.031627677600373175, 0.006726032588101553, 0.018320328064011647] and parameters: {'n_layers': 1, 'embedding_dim': 128, 'lr': 0.0008568781075155826, 'lambda_val': 0.003077942483029095, 'batch_size': 2155, 'optimizer': 'Adam'}.
2026-06-19 04:08:18,280 - optuna.study.study - INFO - Trial 223 finished with values: [0.032987410069840656, 0.006879184034356449, 0.019080016822637307] and parameters: {'n_layers': 1, 'embedding_dim': 128, 'lr': 0.0017724783344138918, 'lambda_val': 5.494005823267809e-06, 'batch_size': 571, 'optimizer': 'Adam'}.
2026-06-19 04:11:06,338 - optuna.study.study - INFO - Trial 224 finished with values: [0.013969709296045432, 0.0031672350637867884, 0.008571912520852059] and parameters: {'n_layers': 1, 'embedding_dim': 64, 'lr': 0.000870520171613823, 'lambda_val': 7.52425465718907e-06, 'batch_size': 571, 'optimizer': 'Adam'}.
2026-06-19 04:11:56,866 - experiment_functions - INFO - Early stopping at epoch 750. Best Metrics: (0.019408949846345634, 0.004100353669319187, 0.010808374931682765)
