2026-06-17 18:25:54,799 - optuna.study.study - INFO - Trial 83 finished with values: [0.0028660041223709624, 0.000663129973474801, 0.001805586209028958] and parameters: {'n_layers': 4, 'embedding_dim': 32, 'lr': 0.027019907715942967, 'lambda_val': 3.1135368724698147e-06, 'batch_size': 1547, 'optimizer': 'Adam'}.
2026-06-17 18:26:19,587 - experiment_functions - INFO - Early stopping at epoch 550. Best Metrics: (0.0021015054357646726, 0.0005036630036630036, 0.0012984572070310805)
2026-06-17 18:26:19,678 - optuna.study.study - INFO - Trial 84 finished with values: [0.0021015054357646726, 0.0005036630036630036, 0.0012984572070310805] and parameters: {'n_layers': 1, 'embedding_dim': 64, 'lr': 0.062357384270714994, 'lambda_val': 4.337539728895895e-06, 'batch_size': 1849, 'optimizer': 'Adam'}.
2026-06-17 18:26:54,130 - experiment_functions - INFO - Early stopping at epoch 800. Best Metrics: (0.002708601429499062, 0.0005747126436781609, 0.0016210854229985968)
2026-06-17 18:26:54,607 - optuna.study.study - INFO - Trial 85 finished with values: [0.002708601429499062, 0.0005747126436781609, 0.0016210854229985968] and parameters: {'n_layers': 2, 'embedding_dim': 32, 'lr': 0.0015933103817621604, 'lambda_val': 0.002699561195512288, 'batch_size': 3820, 'optimizer': 'Adam'}.
2026-06-17 18:27:18,561 - experiment_functions - INFO - Early stopping at epoch 500. Best Metrics: (0.00040353700012372203, 9.315397246431729e-05, 0.00022877196902036374)
2026-06-17 18:27:18,656 - optuna.study.study - INFO - Trial 86 finished with values: [0.00040353700012372203, 9.315397246431729e-05, 0.00022877196902036374] and parameters: {'n_layers': 4, 'embedding_dim': 96, 'lr': 3.906477688992476e-05, 'lambda_val': 0.0003784990701745836, 'batch_size': 3755, 'optimizer': 'SGD'}.
2026-06-17 18:27:57,234 - experiment_functions - INFO - Early stopping at epoch 750. Best Metrics: (0.002505270998251049, 0.0006426045219148668, 0.0015622873727672742)
2026-06-17 18:27:57,322 - optuna.study.study - INFO - Trial 87 finished with values: [0.002505270998251049, 0.0006426045219148668, 0.0015622873727672742] and parameters: {'n_layers': 2, 'embedding_dim': 256, 'lr': 0.0015933103817621604, 'lambda_val': 0.002699561195512288, 'batch_size': 3820, 'optimizer': 'Adam'}.
2026-06-17 18:28:23,701 - experiment_functions - INFO - Early stopping at epoch 600. Best Metrics: (0.0029311500440409497, 0.0006757610205886069, 0.001723397962140129)
2026-06-17 18:28:23,784 - optuna.study.study - INFO - Trial 88 finished with values: [0.0029311500440409497, 0.0006757610205886069, 0.001723397962140129] and parameters: {'n_layers': 3, 'embedding_dim': 32, 'lr': 0.010977035495288605, 'lambda_val': 2.213584038265765e-05, 'batch_size': 1787, 'optimizer': 'Adam'}.
2026-06-17 18:29:29,506 - experiment_functions - INFO - Early stopping at epoch 1400. Best Metrics: (0.0038000916333034277, 0.0009615384615384616, 0.002406466192245762)
2026-06-17 18:29:29,595 - optuna.study.study - INFO - Trial 89 finished with values: [0.0038000916333034277, 0.0009615384615384616, 0.002406466192245762] and parameters: {'n_layers': 4, 'embedding_dim': 128, 'lr': 0.0008244869685256396, 'lambda_val': 0.00040852653324075796, 'batch_size': 1377, 'optimizer': 'RMSprop'}.
2026-06-17 18:29:52,906 - experiment_functions - INFO - Early stopping at epoch 500. Best Metrics: (0.0005732377960848263, 0.00012473159024883163, 0.0003210335981151407)
2026-06-17 18:29:52,985 - optuna.study.study - INFO - Trial 90 finished with values: [0.0005732377960848263, 0.00012473159024883163, 0.0003210335981151407] and parameters: {'n_layers': 2, 'embedding_dim': 96, 'lr': 0.0001141841111011795, 'lambda_val': 0.006488374405945417, 'batch_size': 3896, 'optimizer': 'SGD'}.
2026-06-17 18:32:18,149 - experiment_functions - INFO - Early stopping at epoch 3550. Best Metrics: (0.0006872661622401325, 0.00015788808892257172, 0.00038539957795396206)
2026-06-17 18:32:18,429 - optuna.study.study - INFO - Trial 91 finished with values: [0.0006872661622401325, 0.00015788808892257172, 0.00038539957795396206] and parameters: {'n_layers': 2, 'embedding_dim': 64, 'lr': 5.0457469374136816e-05, 'lambda_val': 4.337539728895895e-06, 'batch_size': 1278, 'optimizer': 'Adam'}.
2026-06-17 18:32:43,750 - experiment_functions - INFO - Early stopping at epoch 550. Best Metrics: (0.0023144655292984075, 0.0005652393583428066, 0.0014847210688525884)
2026-06-17 18:32:44,842 - optuna.study.study - INFO - Trial 92 finished with values: [0.0023144655292984075, 0.0005652393583428066, 0.0014847210688525884] and parameters: {'n_layers': 2, 'embedding_dim': 96, 'lr': 0.03448090174378339, 'lambda_val': 0.00010863210182058504, 'batch_size': 2182, 'optimizer': 'Adam'}.
2026-06-17 18:33:09,212 - experiment_functions - INFO - Early stopping at epoch 500. Best Metrics: (0.0004849865670144808, 0.00010578501957812304, 0.00023381720937015773)
2026-06-17 18:33:09,314 - optuna.study.study - INFO - Trial 93 finished with values: [0.0004849865670144808, 0.00010578501957812304, 0.00023381720937015773] and parameters: {'n_layers': 4, 'embedding_dim': 128, 'lr': 0.0015153711033529756, 'lambda_val': 1.7552395954128497e-06, 'batch_size': 547, 'optimizer': 'SGD'}.
2026-06-17 18:33:34,514 - experiment_functions - INFO - Early stopping at epoch 550. Best Metrics: (0.0026662370491523256, 0.0006931287103700898, 0.0017575240581535674)
2026-06-17 18:33:34,597 - optuna.study.study - INFO - Trial 94 finished with values: [0.0026662370491523256, 0.0006931287103700898, 0.0017575240581535674] and parameters: {'n_layers': 4, 'embedding_dim': 64, 'lr': 0.04068195973191426, 'lambda_val': 1.0818419997025342e-05, 'batch_size': 1713, 'optimizer': 'Adam'}.
2026-06-17 18:34:47,178 - experiment_functions - INFO - Early stopping at epoch 1750. Best Metrics: (0.003381390205802509, 0.0007704938739421499, 0.002043222818931228)
2026-06-17 18:34:47,246 - optuna.study.study - INFO - Trial 95 finished with values: [0.003381390205802509, 0.0007704938739421499, 0.002043222818931228] and parameters: {'n_layers': 1, 'embedding_dim': 128, 'lr': 0.0012702568149946026, 'lambda_val': 8.796328661080472e-05, 'batch_size': 1059, 'optimizer': 'RMSprop'}.
2026-06-17 18:35:11,718 - experiment_functions - INFO - Early stopping at epoch 500. Best Metrics: (0.000567314195389813, 0.0001373626373626374, 0.00029866698260793545)
2026-06-17 18:35:11,998 - optuna.study.study - INFO - Trial 96 finished with values: [0.000567314195389813, 0.0001373626373626374, 0.00029866698260793545] and parameters: {'n_layers': 4, 'embedding_dim': 128, 'lr': 0.0009591500443810845, 'lambda_val': 0.000366483280343058, 'batch_size': 2388, 'optimizer': 'SGD'}.
2026-06-17 18:36:02,229 - experiment_functions - INFO - Early stopping at epoch 1200. Best Metrics: (0.0004739982401493148, 0.00011683718580270305, 0.00028826766690521224)
2026-06-17 18:36:02,296 - optuna.study.study - INFO - Trial 97 finished with values: [0.0004739982401493148, 0.00011683718580270305, 0.00028826766690521224] and parameters: {'n_layers': 1, 'embedding_dim': 128, 'lr': 0.062357384270714994, 'lambda_val': 0.0009547772999986335, 'batch_size': 649, 'optimizer': 'SGD'}.
2026-06-17 18:36:28,415 - experiment_functions - INFO - Early stopping at epoch 550. Best Metrics: (0.0026627607763777816, 0.0006915498294808641, 0.0016934709765964642)
2026-06-17 18:36:28,628 - optuna.study.study - INFO - Trial 98 finished with values: [0.0026627607763777816, 0.0006915498294808641, 0.0016934709765964642] and parameters: {'n_layers': 3, 'embedding_dim': 128, 'lr': 0.016164729159531654, 'lambda_val': 6.54710416797434e-06, 'batch_size': 927, 'optimizer': 'RMSprop'}.
2026-06-17 18:36:55,627 - experiment_functions - INFO - Early stopping at epoch 600. Best Metrics: (0.0016816639400508736, 0.0005210306934444865, 0.0011512560058103793)
2026-06-17 18:36:55,727 - optuna.study.study - INFO - Trial 99 finished with values: [0.0016816639400508736, 0.0005210306934444865, 0.0011512560058103793] and parameters: {'n_layers': 2, 'embedding_dim': 96, 'lr': 0.03448090174378339, 'lambda_val': 0.02188570532861053, 'batch_size': 3455, 'optimizer': 'Adam'}.
2026-06-17 18:37:39,015 - experiment_functions - INFO - Early stopping at epoch 1000. Best Metrics: (0.0017533324833010713, 0.0004878741947707465, 0.0012020329563356578)
2026-06-17 18:37:39,119 - optuna.study.study - INFO - Trial 100 finished with values: [0.0017533324833010713, 0.0004878741947707465, 0.0012020329563356578] and parameters: {'n_layers': 2, 'embedding_dim': 96, 'lr': 0.03448090174378339, 'lambda_val': 0.00010863210182058504, 'batch_size': 1377, 'optimizer': 'RMSprop'}.
2026-06-17 18:38:10,404 - experiment_functions - INFO - Early stopping at epoch 550. Best Metrics: (0.0028917710272344972, 0.0007768093974990527, 0.001839339938643939)
2026-06-17 18:38:10,495 - optuna.study.study - INFO - Trial 101 finished with values: [0.0028917710272344972, 0.0007768093974990527, 0.001839339938643939] and parameters: {'n_layers': 4, 'embedding_dim': 256, 'lr': 0.005194518548706596, 'lambda_val': 4.4572768261600244e-05, 'batch_size': 3749, 'optimizer': 'RMSprop'}.
2026-06-17 18:38:57,421 - experiment_functions - INFO - Early stopping at epoch 850. Best Metrics: (0.0030531281470461964, 0.0008004926108374386, 0.0019330645800584864)
2026-06-17 18:38:57,519 - optuna.study.study - INFO - Trial 102 finished with values: [0.0030531281470461964, 0.0008004926108374386, 0.0019330645800584864] and parameters: {'n_layers': 4, 'embedding_dim': 256, 'lr': 0.0015933103817621604, 'lambda_val': 0.002699561195512288, 'batch_size': 1377, 'optimizer': 'Adam'}.
2026-06-17 18:39:44,284 - experiment_functions - INFO - Early stopping at epoch 850. Best Metrics: (0.0033585193521557984, 0.0008747000126310472, 0.0021055668762558245)
2026-06-17 18:39:44,367 - optuna.study.study - INFO - Trial 103 finished with values: [0.0033585193521557984, 0.0008747000126310472, 0.0021055668762558245] and parameters: {'n_layers': 4, 'embedding_dim': 256, 'lr': 0.0012702568149946026, 'lambda_val': 8.796328661080472e-05, 'batch_size': 3820, 'optimizer': 'RMSprop'}.
2026-06-17 18:40:08,480 - experiment_functions - INFO - Early stopping at epoch 550. Best Metrics: (0.0016422050309850402, 0.0004168245547555893, 0.0009915262209379506)
2026-06-17 18:40:08,572 - optuna.study.study - INFO - Trial 104 finished with values: [0.0016422050309850402, 0.0004168245547555893, 0.0009915262209379506] and parameters: {'n_layers': 4, 'embedding_dim': 32, 'lr': 0.03217359998208145, 'lambda_val': 5.703242122988681e-05, 'batch_size': 3820, 'optimizer': 'RMSprop'}.
2026-06-17 18:40:36,539 - experiment_functions - INFO - Early stopping at epoch 500. Best Metrics: (0.0005400684970700712, 0.00012946823291650877, 0.0002668533700351471)
2026-06-17 18:40:36,624 - optuna.study.study - INFO - Trial 105 finished with values: [0.0005400684970700712, 0.00012946823291650877, 0.0002668533700351471] and parameters: {'n_layers': 4, 'embedding_dim': 256, 'lr': 0.0015933103817621604, 'lambda_val': 8.796328661080472e-05, 'batch_size': 1751, 'optimizer': 'SGD'}.
2026-06-17 18:42:23,972 - experiment_functions - INFO - Early stopping at epoch 2250. Best Metrics: (0.0031774712257573983, 0.000797334849058987, 0.0019134958857731123)
2026-06-17 18:42:24,051 - optuna.study.study - INFO - Trial 106 finished with values: [0.0031774712257573983, 0.000797334849058987, 0.0019134958857731123] and parameters: {'n_layers': 2, 'embedding_dim': 256, 'lr': 0.0032052069599508804, 'lambda_val': 4.337539728895895e-06, 'batch_size': 1672, 'optimizer': 'Adam'}.
2026-06-17 18:42:49,944 - experiment_functions - INFO - Early stopping at epoch 550. Best Metrics: (0.0024970805051337864, 0.0006741821396993811, 0.0016313521813345671)
2026-06-17 18:42:50,304 - optuna.study.study - INFO - Trial 107 finished with values: [0.0024970805051337864, 0.0006741821396993811, 0.0016313521813345671] and parameters: {'n_layers': 3, 'embedding_dim': 64, 'lr': 0.009940147183797932, 'lambda_val': 0.00021332110553414334, 'batch_size': 1751, 'optimizer': 'RMSprop'}.
2026-06-17 18:43:18,657 - experiment_functions - INFO - Early stopping at epoch 500. Best Metrics: (0.0004453210004621202, 9.789061513199445e-05, 0.0002257750558929217)
2026-06-17 18:43:19,198 - optuna.study.study - INFO - Trial 108 finished with values: [0.0004453210004621202, 9.789061513199445e-05, 0.0002257750558929217] and parameters: {'n_layers': 4, 'embedding_dim': 256, 'lr': 0.027019907715942967, 'lambda_val': 3.943481674172961e-05, 'batch_size': 1547, 'optimizer': 'SGD'}.
2026-06-17 18:45:35,637 - experiment_functions - INFO - Early stopping at epoch 3400. Best Metrics: (0.00268161962414843, 0.0005447139067828723, 0.0015016585839480521)
2026-06-17 18:45:35,963 - optuna.study.study - INFO - Trial 109 finished with values: [0.00268161962414843, 0.0005447139067828723, 0.0015016585839480521] and parameters: {'n_layers': 1, 'embedding_dim': 96, 'lr': 0.0002922169440666165, 'lambda_val': 4.337539728895895e-06, 'batch_size': 1849, 'optimizer': 'Adam'}.
2026-06-17 18:48:23,044 - optuna.study.study - INFO - Trial 110 finished with values: [0.0020078164636356728, 0.0005605027156751295, 0.0012878108626527534] and parameters: {'n_layers': 3, 'embedding_dim': 96, 'lr': 0.0003404162358956432, 'lambda_val': 0.0477781106481976, 'batch_size': 1184, 'optimizer': 'RMSprop'}.
2026-06-17 18:48:49,235 - experiment_functions - INFO - Early stopping at epoch 550. Best Metrics: (0.002955681540839619, 0.0007878615637236327, 0.0018881495698133564)
2026-06-17 18:48:49,786 - optuna.study.study - INFO - Trial 111 finished with values: [0.002955681540839619, 0.0007878615637236327, 0.0018881495698133564] and parameters: {'n_layers': 3, 'embedding_dim': 128, 'lr': 0.01923671087851685, 'lambda_val': 3.1135368724698147e-06, 'batch_size': 1257, 'optimizer': 'Adam'}.
2026-06-17 18:49:15,125 - experiment_functions - INFO - Early stopping at epoch 550. Best Metrics: (0.002828284218920153, 0.0007041808765946697, 0.0018223588865065076)
2026-06-17 18:49:15,382 - optuna.study.study - INFO - Trial 112 finished with values: [0.002828284218920153, 0.0007041808765946697, 0.0018223588865065076] and parameters: {'n_layers': 3, 'embedding_dim': 96, 'lr': 0.01562100019075772, 'lambda_val': 3.943481674172961e-05, 'batch_size': 3410, 'optimizer': 'Adam'}.
2026-06-17 18:49:38,922 - experiment_functions - INFO - Early stopping at epoch 500. Best Metrics: (0.0006523605378646606, 0.00014367816091954023, 0.00039924742831426403)
2026-06-17 18:49:39,614 - optuna.study.study - INFO - Trial 113 finished with values: [0.0006523605378646606, 0.00014367816091954023, 0.00039924742831426403] and parameters: {'n_layers': 3, 'embedding_dim': 128, 'lr': 0.001107083624793722, 'lambda_val': 0.00040852653324075796, 'batch_size': 2347, 'optimizer': 'SGD'}.
2026-06-17 18:50:43,261 - experiment_functions - INFO - Early stopping at epoch 1600. Best Metrics: (0.0034350030165599503, 0.0008083870152835671, 0.002067918551945587)
2026-06-17 18:50:43,335 - optuna.study.study - INFO - Trial 114 finished with values: [0.0034350030165599503, 0.0008083870152835671, 0.002067918551945587] and parameters: {'n_layers': 3, 'embedding_dim': 32, 'lr': 0.0015933103817621604, 'lambda_val': 0.00015440813799502288, 'batch_size': 927, 'optimizer': 'Adam'}.
2026-06-17 18:51:08,666 - experiment_functions - INFO - Early stopping at epoch 550. Best Metrics: (0.002959556733740217, 0.0007168119237084754, 0.0019082895360780856)
2026-06-17 18:51:08,750 - optuna.study.study - INFO - Trial 115 finished with values: [0.002959556733740217, 0.0007168119237084754, 0.0019082895360780856] and parameters: {'n_layers': 3, 'embedding_dim': 96, 'lr': 0.010977035495288605, 'lambda_val': 2.213584038265765e-05, 'batch_size': 3135, 'optimizer': 'Adam'}.
2026-06-17 18:51:35,498 - experiment_functions - INFO - Early stopping at epoch 550. Best Metrics: (0.0029206980606931374, 0.0007515473032714413, 0.0017687944959439378)
2026-06-17 18:51:35,574 - optuna.study.study - INFO - Trial 116 finished with values: [0.0029206980606931374, 0.0007515473032714413, 0.0017687944959439378] and parameters: {'n_layers': 4, 'embedding_dim': 128, 'lr': 0.027019907715942967, 'lambda_val': 4.337539728895895e-06, 'batch_size': 1547, 'optimizer': 'RMSprop'}.
2026-06-17 18:52:02,277 - experiment_functions - INFO - Early stopping at epoch 600. Best Metrics: (0.0017461241548171983, 0.0005083996463306808, 0.0012200534387109352)
2026-06-17 18:52:02,361 - optuna.study.study - INFO - Trial 117 finished with values: [0.0017461241548171983, 0.0005083996463306808, 0.0012200534387109352] and parameters: {'n_layers': 2, 'embedding_dim': 96, 'lr': 0.054832003091216365, 'lambda_val': 0.002699561195512288, 'batch_size': 3820, 'optimizer': 'Adam'}.
2026-06-17 18:52:25,109 - experiment_functions - INFO - Early stopping at epoch 500. Best Metrics: (0.0005115143006138675, 0.0001136794240242516, 0.0002914405393403537)
2026-06-17 18:52:25,199 - optuna.study.study - INFO - Trial 118 finished with values: [0.0005115143006138675, 0.0001136794240242516, 0.0002914405393403537] and parameters: {'n_layers': 3, 'embedding_dim': 64, 'lr': 0.0006957971417897457, 'lambda_val': 0.00027195197586368466, 'batch_size': 3351, 'optimizer': 'SGD'}.
2026-06-17 18:55:15,200 - optuna.study.study - INFO - Trial 119 finished with values: [0.001361047849133838, 0.0003552482000757863, 0.0008648762846014661] and parameters: {'n_layers': 3, 'embedding_dim': 96, 'lr': 0.0003404162358956432, 'lambda_val': 0.0477781106481976, 'batch_size': 806, 'optimizer': 'Adam'}.
2026-06-17 18:55:52,442 - experiment_functions - INFO - Early stopping at epoch 850. Best Metrics: (0.0032168058484219166, 0.0007073386383731212, 0.0019816347915638344)
2026-06-17 18:55:52,532 - optuna.study.study - INFO - Trial 120 finished with values: [0.0032168058484219166, 0.0007073386383731212, 0.0019816347915638344] and parameters: {'n_layers': 4, 'embedding_dim': 32, 'lr': 0.0015933103817621604, 'lambda_val': 0.00040852653324075796, 'batch_size': 3515, 'optimizer': 'Adam'}.
2026-06-17 18:56:23,879 - experiment_functions - INFO - Early stopping at epoch 650. Best Metrics: (0.003244362636350947, 0.0007910193255020842, 0.0019882511791264983)
2026-06-17 18:56:23,974 - optuna.study.study - INFO - Trial 121 finished with values: [0.003244362636350947, 0.0007910193255020842, 0.0019882511791264983] and parameters: {'n_layers': 4, 'embedding_dim': 96, 'lr': 0.0036567747130372475, 'lambda_val': 9.638501122128868e-05, 'batch_size': 2347, 'optimizer': 'Adam'}.
2026-06-17 18:57:47,393 - experiment_functions - INFO - Early stopping at epoch 1900. Best Metrics: (0.003604622121198912, 0.0009015409877478844, 0.002279061585347237)
2026-06-17 18:57:47,466 - optuna.study.study - INFO - Trial 122 finished with values: [0.003604622121198912, 0.0009015409877478844, 0.002279061585347237] and parameters: {'n_layers': 4, 'embedding_dim': 64, 'lr': 0.0008244869685256396, 'lambda_val': 1.375614243555729e-06, 'batch_size': 2458, 'optimizer': 'RMSprop'}.
2026-06-17 18:58:12,174 - experiment_functions - INFO - Early stopping at epoch 550. Best Metrics: (0.0018087640755191472, 0.00047524314765694085, 0.0011957022915117701)
2026-06-17 18:58:12,265 - optuna.study.study - INFO - Trial 123 finished with values: [0.0018087640755191472, 0.00047524314765694085, 0.0011957022915117701] and parameters: {'n_layers': 4, 'embedding_dim': 32, 'lr': 0.03573597026445131, 'lambda_val': 8.796328661080472e-05, 'batch_size': 1751, 'optimizer': 'RMSprop'}.
2026-06-17 18:58:37,504 - experiment_functions - INFO - Early stopping at epoch 550. Best Metrics: (0.0032134812603557463, 0.0007420740179360869, 0.0020300864719769054)
2026-06-17 18:58:37,577 - optuna.study.study - INFO - Trial 124 finished with values: [0.0032134812603557463, 0.0007420740179360869, 0.0020300864719769054] and parameters: {'n_layers': 3, 'embedding_dim': 64, 'lr': 0.01562100019075772, 'lambda_val': 4.337539728895895e-06, 'batch_size': 1849, 'optimizer': 'Adam'}.
2026-06-17 18:59:06,809 - experiment_functions - INFO - Early stopping at epoch 600. Best Metrics: (0.0032218385894621704, 0.0008510167992926615, 0.0020275203686789434)
2026-06-17 18:59:06,893 - optuna.study.study - INFO - Trial 125 finished with values: [0.0032218385894621704, 0.0008510167992926615, 0.0020275203686789434] and parameters: {'n_layers': 4, 'embedding_dim': 128, 'lr': 0.005545243953023108, 'lambda_val': 1.3870977953506033e-05, 'batch_size': 806, 'optimizer': 'RMSprop'}.
2026-06-17 18:59:33,507 - experiment_functions - INFO - Early stopping at epoch 550. Best Metrics: (0.0031930825749281375, 0.0007941770872805356, 0.0020078031025619514)
2026-06-17 18:59:33,589 - optuna.study.study - INFO - Trial 126 finished with values: [0.0031930825749281375, 0.0007941770872805356, 0.0020078031025619514] and parameters: {'n_layers': 3, 'embedding_dim': 128, 'lr': 0.01562100019075772, 'lambda_val': 2.1183457368999824e-05, 'batch_size': 901, 'optimizer': 'Adam'}.
2026-06-17 19:00:01,416 - experiment_functions - INFO - Early stopping at epoch 650. Best Metrics: (0.0029830798387883266, 0.0006662877352532525, 0.0018331165484234632)
2026-06-17 19:00:01,511 - optuna.study.study - INFO - Trial 127 finished with values: [0.0029830798387883266, 0.0006662877352532525, 0.0018331165484234632] and parameters: {'n_layers': 1, 'embedding_dim': 64, 'lr': 0.0032052069599508804, 'lambda_val': 4.337539728895895e-06, 'batch_size': 1751, 'optimizer': 'RMSprop'}.
2026-06-17 19:00:35,389 - experiment_functions - INFO - Early stopping at epoch 750. Best Metrics: (0.003561045209969876, 0.0008778577744094986, 0.002178058097641878)
