2026-06-17 23:40:51,413 - optuna.study.study - INFO - Trial 105 finished with values: [0.0019041371513033173, 0.000546292787672098, 0.0012784016682546222] and parameters: {'n_layers': 4, 'embedding_dim': 64, 'lr': 0.0050419503560223886, 'lambda_val': 0.02263249127031471, 'batch_size': 2780, 'optimizer': 'RMSprop'}.
2026-06-17 23:41:29,186 - experiment_functions - INFO - Early stopping at epoch 850. Best Metrics: (0.0029853424343685895, 0.0007152330428192497, 0.0018414943917383882)
2026-06-17 23:41:29,291 - optuna.study.study - INFO - Trial 106 finished with values: [0.0029853424343685895, 0.0007152330428192497, 0.0018414943917383882] and parameters: {'n_layers': 3, 'embedding_dim': 64, 'lr': 0.0026704905176286454, 'lambda_val': 3.576975505685731e-06, 'batch_size': 4090, 'optimizer': 'Adam'}.
2026-06-17 23:42:40,687 - experiment_functions - INFO - Early stopping at epoch 1300. Best Metrics: (0.003172422246906725, 0.0008510167992926614, 0.0020074903950701144)
2026-06-17 23:42:40,793 - optuna.study.study - INFO - Trial 107 finished with values: [0.003172422246906725, 0.0008510167992926614, 0.0020074903950701144] and parameters: {'n_layers': 4, 'embedding_dim': 256, 'lr': 0.0006674090882881629, 'lambda_val': 0.0001528536356672561, 'batch_size': 3948, 'optimizer': 'RMSprop'}.
2026-06-17 23:44:10,511 - experiment_functions - INFO - Early stopping at epoch 2200. Best Metrics: (0.003398469193656851, 0.0007783882783882786, 0.0021350298463451577)
2026-06-17 23:44:10,608 - optuna.study.study - INFO - Trial 108 finished with values: [0.003398469193656851, 0.0007783882783882786, 0.0021350298463451577] and parameters: {'n_layers': 3, 'embedding_dim': 32, 'lr': 0.0005517155227117574, 'lambda_val': 0.0012144921171399186, 'batch_size': 3027, 'optimizer': 'RMSprop'}.
2026-06-17 23:45:03,710 - experiment_functions - INFO - Early stopping at epoch 1300. Best Metrics: (0.0034211026139881213, 0.0007483895414929899, 0.0020841691383736045)
2026-06-17 23:45:03,806 - optuna.study.study - INFO - Trial 109 finished with values: [0.0034211026139881213, 0.0007483895414929899, 0.0020841691383736045] and parameters: {'n_layers': 1, 'embedding_dim': 32, 'lr': 0.0009259265868741952, 'lambda_val': 3.576975505685731e-06, 'batch_size': 2987, 'optimizer': 'RMSprop'}.
2026-06-17 23:47:44,860 - optuna.study.study - INFO - Trial 110 finished with values: [0.000734114352276376, 0.00013578375647341163, 0.00037878593067873127] and parameters: {'n_layers': 1, 'embedding_dim': 96, 'lr': 1.5978949965222522e-05, 'lambda_val': 0.002750666158846801, 'batch_size': 3331, 'optimizer': 'RMSprop'}.
2026-06-17 23:48:18,333 - experiment_functions - INFO - Early stopping at epoch 800. Best Metrics: (0.0033963019673936847, 0.0007104964001515726, 0.0020610965817239187)
2026-06-17 23:48:18,445 - optuna.study.study - INFO - Trial 111 finished with values: [0.0033963019673936847, 0.0007104964001515726, 0.0020610965817239187] and parameters: {'n_layers': 1, 'embedding_dim': 32, 'lr': 0.004714566698419002, 'lambda_val': 5.808010120101344e-06, 'batch_size': 526, 'optimizer': 'Adam'}.
2026-06-17 23:49:02,135 - experiment_functions - INFO - Early stopping at epoch 1050. Best Metrics: (0.0030395947063943554, 0.000680497663256284, 0.0017729632322167836)
2026-06-17 23:49:02,290 - optuna.study.study - INFO - Trial 112 finished with values: [0.0030395947063943554, 0.000680497663256284, 0.0017729632322167836] and parameters: {'n_layers': 1, 'embedding_dim': 64, 'lr': 0.0026857968910639833, 'lambda_val': 0.0001450892533078464, 'batch_size': 2471, 'optimizer': 'Adam'}.
2026-06-17 23:51:04,736 - experiment_functions - INFO - Early stopping at epoch 3000. Best Metrics: (0.003341317973516391, 0.0008115447770620184, 0.002032508345684848)
2026-06-17 23:51:04,848 - optuna.study.study - INFO - Trial 113 finished with values: [0.003341317973516391, 0.0008115447770620184, 0.002032508345684848] and parameters: {'n_layers': 4, 'embedding_dim': 32, 'lr': 0.0006674090882881629, 'lambda_val': 0.0001528536356672561, 'batch_size': 3948, 'optimizer': 'RMSprop'}.
2026-06-17 23:51:35,033 - experiment_functions - INFO - Early stopping at epoch 600. Best Metrics: (0.003004510603486069, 0.0007610205886067955, 0.0018270823555783305)
2026-06-17 23:51:35,138 - optuna.study.study - INFO - Trial 114 finished with values: [0.003004510603486069, 0.0007610205886067955, 0.0018270823555783305] and parameters: {'n_layers': 4, 'embedding_dim': 128, 'lr': 0.004768609881490324, 'lambda_val': 0.0001528536356672561, 'batch_size': 3724, 'optimizer': 'Adam'}.
2026-06-17 23:52:05,425 - experiment_functions - INFO - Early stopping at epoch 700. Best Metrics: (0.0029597129916357763, 0.0006157635467980297, 0.0018150280728234153)
2026-06-17 23:52:05,532 - optuna.study.study - INFO - Trial 115 finished with values: [0.0029597129916357763, 0.0006157635467980297, 0.0018150280728234153] and parameters: {'n_layers': 2, 'embedding_dim': 32, 'lr': 0.0026704905176286454, 'lambda_val': 3.6404845826373614e-05, 'batch_size': 3215, 'optimizer': 'Adam'}.
2026-06-17 23:53:29,241 - experiment_functions - INFO - Early stopping at epoch 2100. Best Metrics: (0.0007004893664924627, 0.0001405203991410888, 0.00038393160351879023)
2026-06-17 23:53:29,387 - optuna.study.study - INFO - Trial 116 finished with values: [0.0007004893664924627, 0.0001405203991410888, 0.00038393160351879023] and parameters: {'n_layers': 1, 'embedding_dim': 32, 'lr': 3.700076755585433e-05, 'lambda_val': 0.002750666158846801, 'batch_size': 1884, 'optimizer': 'Adam'}.
2026-06-17 23:54:54,733 - experiment_functions - INFO - Early stopping at epoch 2050. Best Metrics: (0.0028493127526982944, 0.0006726032588101554, 0.00180287767696861)
2026-06-17 23:54:54,844 - optuna.study.study - INFO - Trial 117 finished with values: [0.0028493127526982944, 0.0006726032588101554, 0.00180287767696861] and parameters: {'n_layers': 1, 'embedding_dim': 128, 'lr': 0.0026704905176286454, 'lambda_val': 1.1653400566573792e-06, 'batch_size': 2162, 'optimizer': 'Adam'}.
2026-06-17 23:55:25,468 - experiment_functions - INFO - Early stopping at epoch 650. Best Metrics: (0.0027407455320546236, 0.000735758494379184, 0.001736687334500367)
2026-06-17 23:55:25,566 - optuna.study.study - INFO - Trial 118 finished with values: [0.0027407455320546236, 0.000735758494379184, 0.001736687334500367] and parameters: {'n_layers': 4, 'embedding_dim': 96, 'lr': 0.004768609881490324, 'lambda_val': 0.00048067488070277503, 'batch_size': 4066, 'optimizer': 'Adam'}.
2026-06-17 23:55:49,520 - experiment_functions - INFO - Early stopping at epoch 550. Best Metrics: (0.002635445981732251, 0.0006268157130226097, 0.0015990091422719386)
2026-06-17 23:55:49,625 - optuna.study.study - INFO - Trial 119 finished with values: [0.002635445981732251, 0.0006268157130226097, 0.0015990091422719386] and parameters: {'n_layers': 3, 'embedding_dim': 32, 'lr': 0.030391160393442255, 'lambda_val': 1.1653400566573792e-06, 'batch_size': 2471, 'optimizer': 'Adam'}.
2026-06-17 23:56:20,631 - experiment_functions - INFO - Early stopping at epoch 650. Best Metrics: (0.002012751209653191, 0.0005905014525704182, 0.0014000768571633972)
2026-06-17 23:56:21,972 - optuna.study.study - INFO - Trial 120 finished with values: [0.002012751209653191, 0.0005905014525704182, 0.0014000768571633972] and parameters: {'n_layers': 1, 'embedding_dim': 256, 'lr': 0.007122227416835467, 'lambda_val': 0.0015914958177189133, 'batch_size': 2471, 'optimizer': 'RMSprop'}.
2026-06-17 23:57:18,989 - experiment_functions - INFO - Early stopping at epoch 1300. Best Metrics: (0.0033107704534375755, 0.000830491347732727, 0.002056523727668266)
2026-06-17 23:57:19,090 - optuna.study.study - INFO - Trial 121 finished with values: [0.0033107704534375755, 0.000830491347732727, 0.002056523727668266] and parameters: {'n_layers': 3, 'embedding_dim': 96, 'lr': 0.0006990102643278918, 'lambda_val': 0.002003406704760604, 'batch_size': 2748, 'optimizer': 'RMSprop'}.
2026-06-17 23:57:45,465 - experiment_functions - INFO - Early stopping at epoch 550. Best Metrics: (0.0030079903352707295, 0.0007862826828344071, 0.0019269164747437225)
2026-06-17 23:57:45,588 - optuna.study.study - INFO - Trial 122 finished with values: [0.0030079903352707295, 0.0007862826828344071, 0.0019269164747437225] and parameters: {'n_layers': 3, 'embedding_dim': 128, 'lr': 0.004714566698419002, 'lambda_val': 0.00224479684416678, 'batch_size': 1255, 'optimizer': 'RMSprop'}.
2026-06-17 23:58:09,235 - experiment_functions - INFO - Early stopping at epoch 550. Best Metrics: (0.002420662901537376, 0.0005826070481242895, 0.001482379701516028)
2026-06-17 23:58:09,337 - optuna.study.study - INFO - Trial 123 finished with values: [0.002420662901537376, 0.0005826070481242895, 0.001482379701516028] and parameters: {'n_layers': 1, 'embedding_dim': 64, 'lr': 0.007122227416835467, 'lambda_val': 0.002750666158846801, 'batch_size': 2471, 'optimizer': 'RMSprop'}.
2026-06-17 23:59:09,872 - experiment_functions - INFO - Early stopping at epoch 1300. Best Metrics: (0.003256407027138354, 0.0008620689655172414, 0.0020833902221482183)
2026-06-17 23:59:10,365 - optuna.study.study - INFO - Trial 124 finished with values: [0.003256407027138354, 0.0008620689655172414, 0.0020833902221482183] and parameters: {'n_layers': 4, 'embedding_dim': 128, 'lr': 0.0006197690834854795, 'lambda_val': 0.006986427337292849, 'batch_size': 810, 'optimizer': 'RMSprop'}.
2026-06-17 23:59:31,864 - experiment_functions - INFO - Early stopping at epoch 500. Best Metrics: (0.00037688115598854416, 9.631173424276872e-05, 0.00020983243022391096)
2026-06-17 23:59:31,959 - optuna.study.study - INFO - Trial 125 finished with values: [0.00037688115598854416, 9.631173424276872e-05, 0.00020983243022391096] and parameters: {'n_layers': 1, 'embedding_dim': 32, 'lr': 0.0026704905176286454, 'lambda_val': 3.576975505685731e-06, 'batch_size': 4090, 'optimizer': 'SGD'}.
2026-06-18 00:02:33,265 - optuna.study.study - INFO - Trial 126 finished with values: [0.0026292770571304147, 0.0006678666161424783, 0.0016811290159290918] and parameters: {'n_layers': 4, 'embedding_dim': 128, 'lr': 0.00029388098096717836, 'lambda_val': 0.00224479684416678, 'batch_size': 1255, 'optimizer': 'Adam'}.
2026-06-18 00:04:04,005 - experiment_functions - INFO - Early stopping at epoch 1700. Best Metrics: (0.0035712938415923363, 0.0009015409877478844, 0.0021626173346116213)
2026-06-18 00:04:04,112 - optuna.study.study - INFO - Trial 127 finished with values: [0.0035712938415923363, 0.0009015409877478844, 0.0021626173346116213] and parameters: {'n_layers': 4, 'embedding_dim': 256, 'lr': 0.0006197690834854795, 'lambda_val': 3.6404845826373614e-05, 'batch_size': 2889, 'optimizer': 'RMSprop'}.
2026-06-18 00:04:27,302 - experiment_functions - INFO - Early stopping at epoch 500. Best Metrics: (0.00043764245556014513, 0.0001215738284703802, 0.0002477437663203034)
2026-06-18 00:04:27,404 - optuna.study.study - INFO - Trial 128 finished with values: [0.00043764245556014513, 0.0001215738284703802, 0.0002477437663203034] and parameters: {'n_layers': 3, 'embedding_dim': 96, 'lr': 3.220821798246662e-05, 'lambda_val': 0.006986427337292849, 'batch_size': 3393, 'optimizer': 'SGD'}.
2026-06-18 00:07:08,133 - optuna.study.study - INFO - Trial 129 finished with values: [0.002629108982772317, 0.000596816976127321, 0.0015466873309478] and parameters: {'n_layers': 2, 'embedding_dim': 64, 'lr': 0.00038413560871618094, 'lambda_val': 0.0017700556112167822, 'batch_size': 1228, 'optimizer': 'Adam'}.
2026-06-18 00:07:56,926 - experiment_functions - INFO - Early stopping at epoch 1000. Best Metrics: (0.0027451717419545315, 0.0006757610205886069, 0.0017619871547277393)
2026-06-18 00:07:57,031 - optuna.study.study - INFO - Trial 130 finished with values: [0.0027451717419545315, 0.0006757610205886069, 0.0017619871547277393] and parameters: {'n_layers': 2, 'embedding_dim': 256, 'lr': 0.0006674090882881629, 'lambda_val': 0.00224479684416678, 'batch_size': 3948, 'optimizer': 'RMSprop'}.
2026-06-18 00:08:31,015 - experiment_functions - INFO - Early stopping at epoch 800. Best Metrics: (0.0029862444891802895, 0.0006378678792471897, 0.0018049117948629202)
2026-06-18 00:08:31,195 - optuna.study.study - INFO - Trial 131 finished with values: [0.0029862444891802895, 0.0006378678792471897, 0.0018049117948629202] and parameters: {'n_layers': 1, 'embedding_dim': 64, 'lr': 0.0016963971500712442, 'lambda_val': 2.9025613182499857e-06, 'batch_size': 3625, 'optimizer': 'Adam'}.
2026-06-18 00:08:59,802 - experiment_functions - INFO - Early stopping at epoch 600. Best Metrics: (0.002876701839769718, 0.0007689149930529243, 0.0018294561945660065)
2026-06-18 00:08:59,933 - optuna.study.study - INFO - Trial 132 finished with values: [0.002876701839769718, 0.0007689149930529243, 0.0018294561945660065] and parameters: {'n_layers': 3, 'embedding_dim': 128, 'lr': 0.0026704905176286454, 'lambda_val': 3.6404845826373614e-05, 'batch_size': 4090, 'optimizer': 'RMSprop'}.
2026-06-18 00:11:15,183 - experiment_functions - INFO - Early stopping at epoch 3100. Best Metrics: (0.0008416149421754428, 0.00017999242137173174, 0.0004574227580931434)
2026-06-18 00:11:15,328 - optuna.study.study - INFO - Trial 133 finished with values: [0.0008416149421754428, 0.00017999242137173174, 0.0004574227580931434] and parameters: {'n_layers': 4, 'embedding_dim': 96, 'lr': 4.8082957002888195e-05, 'lambda_val': 0.00048067488070277503, 'batch_size': 3724, 'optimizer': 'Adam'}.
2026-06-18 00:11:39,450 - experiment_functions - INFO - Early stopping at epoch 500. Best Metrics: (0.00044209804536288606, 0.00010578501957812304, 0.00026875915038690484)
2026-06-18 00:11:39,548 - optuna.study.study - INFO - Trial 134 finished with values: [0.00044209804536288606, 0.00010578501957812304, 0.00026875915038690484] and parameters: {'n_layers': 1, 'embedding_dim': 256, 'lr': 0.0016963971500712442, 'lambda_val': 2.9025613182499857e-06, 'batch_size': 3505, 'optimizer': 'SGD'}.
2026-06-18 00:14:16,141 - optuna.study.study - INFO - Trial 135 finished with values: [0.0009939283409420127, 0.00023051660982695467, 0.0005775833705152204] and parameters: {'n_layers': 1, 'embedding_dim': 64, 'lr': 0.00022087273643017747, 'lambda_val': 0.047982563602605, 'batch_size': 3215, 'optimizer': 'Adam'}.
2026-06-18 00:15:31,572 - experiment_functions - INFO - Early stopping at epoch 1550. Best Metrics: (0.003789339854099211, 0.0009899583175445243, 0.002408523071005202)
2026-06-18 00:15:31,675 - optuna.study.study - INFO - Trial 136 finished with values: [0.003789339854099211, 0.0009899583175445243, 0.002408523071005202] and parameters: {'n_layers': 4, 'embedding_dim': 128, 'lr': 0.002692587283514102, 'lambda_val': 7.431054110368361e-06, 'batch_size': 526, 'optimizer': 'RMSprop'}.
2026-06-18 00:18:28,556 - optuna.study.study - INFO - Trial 137 finished with values: [0.0004922963190806553, 0.00012788935202728306, 0.0002966873646985369] and parameters: {'n_layers': 2, 'embedding_dim': 128, 'lr': 2.058908215140545e-05, 'lambda_val': 3.6404845826373614e-05, 'batch_size': 2162, 'optimizer': 'RMSprop'}.
2026-06-18 00:18:54,825 - experiment_functions - INFO - Early stopping at epoch 550. Best Metrics: (0.0028011972440609104, 0.0007152330428192497, 0.0018586920785217025)
2026-06-18 00:18:54,927 - optuna.study.study - INFO - Trial 138 finished with values: [0.0028011972440609104, 0.0007152330428192497, 0.0018586920785217025] and parameters: {'n_layers': 3, 'embedding_dim': 64, 'lr': 0.0026704905176286454, 'lambda_val': 0.006986427337292849, 'batch_size': 1884, 'optimizer': 'RMSprop'}.
2026-06-18 00:20:36,420 - experiment_functions - INFO - Early stopping at epoch 2300. Best Metrics: (0.0006616226522211635, 0.00014209928003031453, 0.00035534564787259695)
2026-06-18 00:20:36,522 - optuna.study.study - INFO - Trial 139 finished with values: [0.0006616226522211635, 0.00014209928003031453, 0.00035534564787259695] and parameters: {'n_layers': 2, 'embedding_dim': 96, 'lr': 2.9753477270378513e-05, 'lambda_val': 0.0001528536356672561, 'batch_size': 3795, 'optimizer': 'Adam'}.
2026-06-18 00:21:08,037 - experiment_functions - INFO - Early stopping at epoch 650. Best Metrics: (0.0021402396779830143, 0.0005999747379057724, 0.0013703282164992017)
2026-06-18 00:21:08,150 - optuna.study.study - INFO - Trial 140 finished with values: [0.0021402396779830143, 0.0005999747379057724, 0.0013703282164992017] and parameters: {'n_layers': 3, 'embedding_dim': 96, 'lr': 0.0050419503560223886, 'lambda_val': 0.02263249127031471, 'batch_size': 749, 'optimizer': 'Adam'}.
2026-06-18 00:21:33,706 - experiment_functions - INFO - Early stopping at epoch 550. Best Metrics: (0.0022901360087412667, 0.0005857648099027408, 0.0015195065280781204)
2026-06-18 00:21:33,802 - optuna.study.study - INFO - Trial 141 finished with values: [0.0022901360087412667, 0.0005857648099027408, 0.0015195065280781204] and parameters: {'n_layers': 2, 'embedding_dim': 64, 'lr': 0.004768609881490324, 'lambda_val': 0.0015914958177189133, 'batch_size': 3724, 'optimizer': 'RMSprop'}.
2026-06-18 00:21:58,714 - experiment_functions - INFO - Early stopping at epoch 550. Best Metrics: (0.0025469525438611, 0.0005526083112290009, 0.00149543034770424)
2026-06-18 00:21:58,856 - optuna.study.study - INFO - Trial 142 finished with values: [0.0025469525438611, 0.0005526083112290009, 0.00149543034770424] and parameters: {'n_layers': 1, 'embedding_dim': 32, 'lr': 0.007122227416835467, 'lambda_val': 1.1653400566573792e-06, 'batch_size': 3359, 'optimizer': 'RMSprop'}.
2026-06-18 00:22:39,233 - experiment_functions - INFO - Early stopping at epoch 850. Best Metrics: (0.0028453005616982025, 0.0007357584943791841, 0.0018103940007163366)
2026-06-18 00:22:39,335 - optuna.study.study - INFO - Trial 143 finished with values: [0.0028453005616982025, 0.0007357584943791841, 0.0018103940007163366] and parameters: {'n_layers': 3, 'embedding_dim': 96, 'lr': 0.0016963971500712442, 'lambda_val': 0.002003406704760604, 'batch_size': 1842, 'optimizer': 'Adam'}.
2026-06-18 00:24:45,945 - experiment_functions - INFO - Early stopping at epoch 2950. Best Metrics: (0.002643925829333776, 0.0006110269041303525, 0.0016662697220401939)
2026-06-18 00:24:46,068 - optuna.study.study - INFO - Trial 144 finished with values: [0.002643925829333776, 0.0006110269041303525, 0.0016662697220401939] and parameters: {'n_layers': 2, 'embedding_dim': 64, 'lr': 0.00039868289481353135, 'lambda_val': 1.5677268814826385e-05, 'batch_size': 3246, 'optimizer': 'Adam'}.
2026-06-18 00:27:00,800 - experiment_functions - INFO - Early stopping at epoch 3050. Best Metrics: (0.003575036995822257, 0.0009062776304155616, 0.0022116653042962083)
2026-06-18 00:27:00,906 - optuna.study.study - INFO - Trial 145 finished with values: [0.003575036995822257, 0.0009062776304155616, 0.0022116653042962083] and parameters: {'n_layers': 4, 'embedding_dim': 64, 'lr': 0.0006197690834854795, 'lambda_val': 3.6404845826373614e-05, 'batch_size': 2162, 'optimizer': 'RMSprop'}.
2026-06-18 00:27:25,726 - experiment_functions - INFO - Early stopping at epoch 550. Best Metrics: (0.0028224861268053205, 0.0006220790703549324, 0.0017168910561574221)
2026-06-18 00:27:25,828 - optuna.study.study - INFO - Trial 146 finished with values: [0.0028224861268053205, 0.0006220790703549324, 0.0017168910561574221] and parameters: {'n_layers': 1, 'embedding_dim': 32, 'lr': 0.007122227416835467, 'lambda_val': 7.431054110368361e-06, 'batch_size': 2471, 'optimizer': 'RMSprop'}.
2026-06-18 00:27:57,878 - experiment_functions - INFO - Early stopping at epoch 650. Best Metrics: (0.0032033920877455667, 0.0008462801566249843, 0.0020772574779045505)
2026-06-18 00:27:58,033 - optuna.study.study - INFO - Trial 147 finished with values: [0.0032033920877455667, 0.0008462801566249843, 0.0020772574779045505] and parameters: {'n_layers': 4, 'embedding_dim': 96, 'lr': 0.0071378175069858425, 'lambda_val': 5.470239525476512e-06, 'batch_size': 810, 'optimizer': 'Adam'}.
2026-06-18 00:28:29,988 - experiment_functions - INFO - Early stopping at epoch 700. Best Metrics: (0.0026037278386817526, 0.0006047113805734496, 0.0015885571528479877)
2026-06-18 00:28:30,084 - optuna.study.study - INFO - Trial 148 finished with values: [0.0026037278386817526, 0.0006047113805734496, 0.0015885571528479877] and parameters: {'n_layers': 3, 'embedding_dim': 32, 'lr': 0.0026704905176286454, 'lambda_val': 0.0002525685459512338, 'batch_size': 4090, 'optimizer': 'Adam'}.
2026-06-18 00:29:53,320 - experiment_functions - INFO - Early stopping at epoch 1950. Best Metrics: (0.0035731454433678205, 0.0008889099406340787, 0.00231739755516624)
2026-06-18 00:29:53,424 - optuna.study.study - INFO - Trial 149 finished with values: [0.0035731454433678205, 0.0008889099406340787, 0.00231739755516624] and parameters: {'n_layers': 2, 'embedding_dim': 64, 'lr': 0.0016427257095284614, 'lambda_val': 5.470239525476512e-06, 'batch_size': 962, 'optimizer': 'RMSprop'}.
2026-06-18 00:31:38,220 - experiment_functions - INFO - Early stopping at epoch 2250. Best Metrics: (0.0039894401167454106, 0.0009852216748768472, 0.0024590869582861614)
2026-06-18 00:31:38,362 - optuna.study.study - INFO - Trial 150 finished with values: [0.0039894401167454106, 0.0009852216748768472, 0.0024590869582861614] and parameters: {'n_layers': 4, 'embedding_dim': 128, 'lr': 0.0006197690834854795, 'lambda_val': 6.404094044497605e-05, 'batch_size': 2162, 'optimizer': 'RMSprop'}.
2026-06-18 00:32:40,119 - experiment_functions - INFO - Early stopping at epoch 1400. Best Metrics: (0.002748832223706531, 0.0006757610205886069, 0.001761104169067215)
