2026-06-21 19:12:08,016 - optuna.study.study - INFO - Trial 188 finished with values: [0.009057889930528515, 0.0021867500315776184, 0.005625360554368831] and parameters: {'n_layers': 3, 'embedding_dim': 32, 'lr': 0.00264461364827089, 'lambda_val': 1.1896982541974421e-05, 'batch_size': 3442, 'optimizer': 'RMSprop'}.
2026-06-21 19:13:33,473 - experiment_functions - INFO - Early stopping at epoch 1950. Best Metrics: (0.0005901167199397031, 0.00011999494758115448, 0.0003208878523237377)
2026-06-21 19:13:33,575 - optuna.study.study - INFO - Trial 189 finished with values: [0.0005901167199397031, 0.00011999494758115448, 0.0003208878523237377] and parameters: {'n_layers': 3, 'embedding_dim': 96, 'lr': 1.5950236982701866e-05, 'lambda_val': 1.1896982541974421e-05, 'batch_size': 3442, 'optimizer': 'Adam'}.
2026-06-21 19:14:01,385 - experiment_functions - INFO - Early stopping at epoch 600. Best Metrics: (0.009083690431285355, 0.0021804345080207147, 0.005426218478642323)
2026-06-21 19:14:01,490 - optuna.study.study - INFO - Trial 190 finished with values: [0.009083690431285355, 0.0021804345080207147, 0.005426218478642323] and parameters: {'n_layers': 4, 'embedding_dim': 64, 'lr': 0.00264461364827089, 'lambda_val': 6.131403610536352e-05, 'batch_size': 3442, 'optimizer': 'RMSprop'}.
2026-06-21 19:14:44,221 - experiment_functions - INFO - Early stopping at epoch 950. Best Metrics: (0.009443081215512567, 0.002305166098269547, 0.005623203364521552)
2026-06-21 19:14:44,325 - optuna.study.study - INFO - Trial 191 finished with values: [0.009443081215512567, 0.002305166098269547, 0.005623203364521552] and parameters: {'n_layers': 4, 'embedding_dim': 64, 'lr': 0.00168887528029852, 'lambda_val': 8.435578644144147e-05, 'batch_size': 3122, 'optimizer': 'Adam'}.
2026-06-21 19:15:11,113 - experiment_functions - INFO - Early stopping at epoch 600. Best Metrics: (0.007624913217035978, 0.0019088669950738917, 0.004692935962162918)
2026-06-21 19:15:11,212 - optuna.study.study - INFO - Trial 192 finished with values: [0.007624913217035978, 0.0019088669950738917, 0.004692935962162918] and parameters: {'n_layers': 4, 'embedding_dim': 32, 'lr': 0.0072168992782938955, 'lambda_val': 1.1896982541974421e-05, 'batch_size': 3469, 'optimizer': 'Adam'}.
2026-06-21 19:15:45,377 - experiment_functions - INFO - Early stopping at epoch 750. Best Metrics: (0.008888351491441772, 0.0021914866742452953, 0.0053893582767228785)
2026-06-21 19:15:45,931 - optuna.study.study - INFO - Trial 193 finished with values: [0.008888351491441772, 0.0021914866742452953, 0.0053893582767228785] and parameters: {'n_layers': 4, 'embedding_dim': 64, 'lr': 0.00264461364827089, 'lambda_val': 7.504491702028956e-06, 'batch_size': 2374, 'optimizer': 'Adam'}.
2026-06-21 19:17:22,792 - experiment_functions - INFO - Early stopping at epoch 2350. Best Metrics: (0.0005336458428304504, 0.0001373626373626374, 0.00030384432906839086)
2026-06-21 19:17:22,943 - optuna.study.study - INFO - Trial 194 finished with values: [0.0005336458428304504, 0.0001373626373626374, 0.00030384432906839086] and parameters: {'n_layers': 1, 'embedding_dim': 96, 'lr': 1.9677681674976128e-05, 'lambda_val': 1.1896982541974421e-05, 'batch_size': 3469, 'optimizer': 'Adam'}.
2026-06-21 19:17:56,811 - experiment_functions - INFO - Early stopping at epoch 750. Best Metrics: (0.00573092426089312, 0.0014715169887583681, 0.0036559489247786825)
2026-06-21 19:17:57,165 - optuna.study.study - INFO - Trial 195 finished with values: [0.00573092426089312, 0.0014715169887583681, 0.0036559489247786825] and parameters: {'n_layers': 2, 'embedding_dim': 96, 'lr': 0.0036608132255288727, 'lambda_val': 1.1896982541974421e-05, 'batch_size': 3442, 'optimizer': 'RMSprop'}.
2026-06-21 19:18:47,858 - experiment_functions - INFO - Early stopping at epoch 1250. Best Metrics: (0.004952260905757934, 0.0012173171655930277, 0.0029861549638786314)
2026-06-21 19:18:48,009 - optuna.study.study - INFO - Trial 196 finished with values: [0.004952260905757934, 0.0012173171655930277, 0.0029861549638786314] and parameters: {'n_layers': 1, 'embedding_dim': 32, 'lr': 0.00264461364827089, 'lambda_val': 1.544427077132802e-06, 'batch_size': 2374, 'optimizer': 'RMSprop'}.
2026-06-21 19:19:14,175 - experiment_functions - INFO - Early stopping at epoch 550. Best Metrics: (0.00511017144056207, 0.0013294177087280535, 0.0029582907343860924)
2026-06-21 19:19:14,465 - optuna.study.study - INFO - Trial 197 finished with values: [0.00511017144056207, 0.0013294177087280535, 0.0029582907343860924] and parameters: {'n_layers': 3, 'embedding_dim': 96, 'lr': 0.0036608132255288727, 'lambda_val': 0.012658383375785598, 'batch_size': 3442, 'optimizer': 'RMSprop'}.
2026-06-21 19:19:36,922 - experiment_functions - INFO - Early stopping at epoch 500. Best Metrics: (0.0005163731854040999, 0.00011999494758115448, 0.0002994802986105816)
2026-06-21 19:19:37,028 - optuna.study.study - INFO - Trial 198 finished with values: [0.0005163731854040999, 0.00011999494758115448, 0.0002994802986105816] and parameters: {'n_layers': 3, 'embedding_dim': 32, 'lr': 0.00011773191166049841, 'lambda_val': 1.1896982541974421e-05, 'batch_size': 3442, 'optimizer': 'SGD'}.
2026-06-21 19:20:03,680 - experiment_functions - INFO - Early stopping at epoch 600. Best Metrics: (0.007615550055375616, 0.0018930781861816346, 0.004616519772349072)
2026-06-21 19:20:03,781 - optuna.study.study - INFO - Trial 199 finished with values: [0.007615550055375616, 0.0018930781861816346, 0.004616519772349072] and parameters: {'n_layers': 4, 'embedding_dim': 32, 'lr': 0.008463855437471605, 'lambda_val': 7.024518890460945e-05, 'batch_size': 3469, 'optimizer': 'Adam'}.
2026-06-21 19:20:30,499 - experiment_functions - INFO - Early stopping at epoch 600. Best Metrics: (0.006833013084230371, 0.0017825565239358344, 0.004240595352962631)
2026-06-21 19:20:30,599 - optuna.study.study - INFO - Trial 200 finished with values: [0.006833013084230371, 0.0017825565239358344, 0.004240595352962631] and parameters: {'n_layers': 4, 'embedding_dim': 32, 'lr': 0.008463855437471605, 'lambda_val': 7.024518890460945e-05, 'batch_size': 3469, 'optimizer': 'Adam'}.
2026-06-21 19:20:58,503 - experiment_functions - INFO - Early stopping at epoch 600. Best Metrics: (0.00699737101690127, 0.0017699254768220284, 0.004235631676772214)
2026-06-21 19:20:58,608 - optuna.study.study - INFO - Trial 201 finished with values: [0.00699737101690127, 0.0017699254768220284, 0.004235631676772214] and parameters: {'n_layers': 4, 'embedding_dim': 64, 'lr': 0.008463855437471605, 'lambda_val': 8.435578644144147e-05, 'batch_size': 3469, 'optimizer': 'Adam'}.
2026-06-21 19:23:25,232 - experiment_functions - INFO - Early stopping at epoch 3650. Best Metrics: (0.009638389108594962, 0.0023067449791587726, 0.005796623898620087)
2026-06-21 19:23:25,349 - optuna.study.study - INFO - Trial 202 finished with values: [0.009638389108594962, 0.0023067449791587726, 0.005796623898620087] and parameters: {'n_layers': 2, 'embedding_dim': 32, 'lr': 0.0015158687633618723, 'lambda_val': 4.204601680352417e-05, 'batch_size': 713, 'optimizer': 'RMSprop'}.
2026-06-21 19:23:51,878 - experiment_functions - INFO - Early stopping at epoch 600. Best Metrics: (0.007286963592961214, 0.0017651888341543515, 0.004367287004031167)
2026-06-21 19:23:51,981 - optuna.study.study - INFO - Trial 203 finished with values: [0.007286963592961214, 0.0017651888341543515, 0.004367287004031167] and parameters: {'n_layers': 4, 'embedding_dim': 32, 'lr': 0.008463855437471605, 'lambda_val': 7.635658041119374e-05, 'batch_size': 3442, 'optimizer': 'Adam'}.
2026-06-21 19:24:27,671 - experiment_functions - INFO - Early stopping at epoch 750. Best Metrics: (0.009841458488380705, 0.002475685234305924, 0.005696111976699163)
2026-06-21 19:24:27,784 - optuna.study.study - INFO - Trial 204 finished with values: [0.009841458488380705, 0.002475685234305924, 0.005696111976699163] and parameters: {'n_layers': 4, 'embedding_dim': 96, 'lr': 0.0015158687633618723, 'lambda_val': 1.1896982541974421e-05, 'batch_size': 2925, 'optimizer': 'RMSprop'}.
2026-06-21 19:24:54,848 - experiment_functions - INFO - Early stopping at epoch 600. Best Metrics: (0.007664574148906184, 0.0018993937097385373, 0.004617602732607613)
2026-06-21 19:24:54,947 - optuna.study.study - INFO - Trial 205 finished with values: [0.007664574148906184, 0.0018993937097385373, 0.004617602732607613] and parameters: {'n_layers': 4, 'embedding_dim': 32, 'lr': 0.011765700859700308, 'lambda_val': 0.00010177449830985686, 'batch_size': 2374, 'optimizer': 'Adam'}.
2026-06-21 19:25:40,010 - experiment_functions - INFO - Early stopping at epoch 1050. Best Metrics: (0.005612138505158239, 0.0013973095869647594, 0.0034646187066132844)
2026-06-21 19:25:40,115 - optuna.study.study - INFO - Trial 206 finished with values: [0.005612138505158239, 0.0013973095869647594, 0.0034646187066132844] and parameters: {'n_layers': 2, 'embedding_dim': 64, 'lr': 0.00264461364827089, 'lambda_val': 7.024518890460945e-05, 'batch_size': 3469, 'optimizer': 'Adam'}.
2026-06-21 19:27:49,039 - experiment_functions - INFO - Early stopping at epoch 3200. Best Metrics: (0.0006971097548554514, 0.0001689402551471517, 0.0004500476497176096)
2026-06-21 19:27:49,149 - optuna.study.study - INFO - Trial 207 finished with values: [0.0006971097548554514, 0.0001689402551471517, 0.0004500476497176096] and parameters: {'n_layers': 4, 'embedding_dim': 32, 'lr': 4.8482262603076756e-05, 'lambda_val': 1.544427077132802e-06, 'batch_size': 2925, 'optimizer': 'Adam'}.
2026-06-21 19:28:40,291 - experiment_functions - INFO - Early stopping at epoch 1250. Best Metrics: (0.004783069004073849, 0.0011841606669192879, 0.002994633109181519)
2026-06-21 19:28:40,399 - optuna.study.study - INFO - Trial 208 finished with values: [0.004783069004073849, 0.0011841606669192879, 0.002994633109181519] and parameters: {'n_layers': 1, 'embedding_dim': 32, 'lr': 0.0028956207651794296, 'lambda_val': 1.1896982541974421e-05, 'batch_size': 2987, 'optimizer': 'RMSprop'}.
2026-06-21 19:29:09,575 - experiment_functions - INFO - Early stopping at epoch 600. Best Metrics: (0.007736846379943751, 0.0020035998484274346, 0.004679394854036541)
2026-06-21 19:29:09,685 - optuna.study.study - INFO - Trial 209 finished with values: [0.007736846379943751, 0.0020035998484274346, 0.004679394854036541] and parameters: {'n_layers': 4, 'embedding_dim': 96, 'lr': 0.0026843825331302053, 'lambda_val': 0.0005803217930206673, 'batch_size': 3442, 'optimizer': 'RMSprop'}.
2026-06-21 19:29:44,812 - experiment_functions - INFO - Early stopping at epoch 800. Best Metrics: (0.009457780365832896, 0.002382531261841607, 0.005780788059364418)
2026-06-21 19:29:44,913 - optuna.study.study - INFO - Trial 210 finished with values: [0.009457780365832896, 0.002382531261841607, 0.005780788059364418] and parameters: {'n_layers': 4, 'embedding_dim': 32, 'lr': 0.0015158687633618723, 'lambda_val': 6.131403610536352e-05, 'batch_size': 3442, 'optimizer': 'RMSprop'}.
2026-06-21 19:30:17,991 - experiment_functions - INFO - Early stopping at epoch 750. Best Metrics: (0.007911628722242485, 0.0019657067070860176, 0.0047410562026594565)
2026-06-21 19:30:18,129 - optuna.study.study - INFO - Trial 211 finished with values: [0.007911628722242485, 0.0019657067070860176, 0.0047410562026594565] and parameters: {'n_layers': 3, 'embedding_dim': 32, 'lr': 0.0028956207651794296, 'lambda_val': 1.1896982541974421e-05, 'batch_size': 2987, 'optimizer': 'RMSprop'}.
2026-06-21 19:30:42,326 - experiment_functions - INFO - Early stopping at epoch 550. Best Metrics: (0.0036617989146464675, 0.0009441707717569786, 0.002249173630886202)
2026-06-21 19:30:42,914 - optuna.study.study - INFO - Trial 212 finished with values: [0.0036617989146464675, 0.0009441707717569786, 0.002249173630886202] and parameters: {'n_layers': 2, 'embedding_dim': 32, 'lr': 0.011765700859700308, 'lambda_val': 1.544427077132802e-06, 'batch_size': 2925, 'optimizer': 'RMSprop'}.
2026-06-21 19:31:24,111 - experiment_functions - INFO - Early stopping at epoch 950. Best Metrics: (0.010952995173101072, 0.002677781988126816, 0.00653532460670581)
2026-06-21 19:31:24,466 - optuna.study.study - INFO - Trial 213 finished with values: [0.010952995173101072, 0.002677781988126816, 0.00653532460670581] and parameters: {'n_layers': 4, 'embedding_dim': 32, 'lr': 0.0015158687633618723, 'lambda_val': 6.702534509469782e-06, 'batch_size': 2925, 'optimizer': 'RMSprop'}.
2026-06-21 19:32:11,388 - experiment_functions - INFO - Early stopping at epoch 1000. Best Metrics: (0.008983611178426337, 0.002292535051155741, 0.005309837463257447)
2026-06-21 19:32:11,493 - optuna.study.study - INFO - Trial 214 finished with values: [0.008983611178426337, 0.002292535051155741, 0.005309837463257447] and parameters: {'n_layers': 4, 'embedding_dim': 96, 'lr': 0.0013576389919306834, 'lambda_val': 8.435578644144147e-05, 'batch_size': 3122, 'optimizer': 'Adam'}.
2026-06-21 19:32:50,839 - experiment_functions - INFO - Early stopping at epoch 900. Best Metrics: (0.010862691976510859, 0.0026904130352406216, 0.006450924492498459)
2026-06-21 19:32:51,259 - optuna.study.study - INFO - Trial 215 finished with values: [0.010862691976510859, 0.0026904130352406216, 0.006450924492498459] and parameters: {'n_layers': 4, 'embedding_dim': 32, 'lr': 0.0015158687633618723, 'lambda_val': 1.1896982541974421e-05, 'batch_size': 3442, 'optimizer': 'RMSprop'}.
2026-06-21 19:33:13,882 - experiment_functions - INFO - Early stopping at epoch 500. Best Metrics: (0.0005490492929660908, 0.00012315270935960593, 0.00031557615204188313)
2026-06-21 19:33:13,984 - optuna.study.study - INFO - Trial 216 finished with values: [0.0005490492929660908, 0.00012315270935960593, 0.00031557615204188313] and parameters: {'n_layers': 1, 'embedding_dim': 128, 'lr': 0.00264461364827089, 'lambda_val': 0.0009730028095032008, 'batch_size': 1770, 'optimizer': 'SGD'}.
2026-06-21 19:33:38,523 - experiment_functions - INFO - Early stopping at epoch 550. Best Metrics: (0.005012573428360051, 0.0013278388278388277, 0.003060745265735222)
2026-06-21 19:33:38,626 - optuna.study.study - INFO - Trial 217 finished with values: [0.005012573428360051, 0.0013278388278388277, 0.003060745265735222] and parameters: {'n_layers': 4, 'embedding_dim': 32, 'lr': 0.008463855437471605, 'lambda_val': 0.013192422188192771, 'batch_size': 3122, 'optimizer': 'Adam'}.
2026-06-21 19:34:40,866 - experiment_functions - INFO - Early stopping at epoch 1500. Best Metrics: (0.0008014537758668498, 0.0001578880889225717, 0.0004226247131327781)
2026-06-21 19:34:40,965 - optuna.study.study - INFO - Trial 218 finished with values: [0.0008014537758668498, 0.0001578880889225717, 0.0004226247131327781] and parameters: {'n_layers': 4, 'embedding_dim': 32, 'lr': 4.129979540698311e-05, 'lambda_val': 1.1896982541974421e-05, 'batch_size': 3469, 'optimizer': 'Adam'}.
2026-06-21 19:35:11,497 - experiment_functions - INFO - Early stopping at epoch 700. Best Metrics: (0.009101084042083844, 0.002292535051155741, 0.005569132245709065)
2026-06-21 19:35:11,599 - optuna.study.study - INFO - Trial 219 finished with values: [0.009101084042083844, 0.002292535051155741, 0.005569132245709065] and parameters: {'n_layers': 3, 'embedding_dim': 32, 'lr': 0.00264461364827089, 'lambda_val': 0.0014521812774996785, 'batch_size': 1787, 'optimizer': 'RMSprop'}.
2026-06-21 19:35:46,758 - experiment_functions - INFO - Early stopping at epoch 750. Best Metrics: (0.0025424999907566865, 0.0006599722116963497, 0.0014621722600789216)
2026-06-21 19:35:47,558 - optuna.study.study - INFO - Trial 220 finished with values: [0.0025424999907566865, 0.0006599722116963497, 0.0014621722600789216] and parameters: {'n_layers': 4, 'embedding_dim': 96, 'lr': 0.0036608132255288727, 'lambda_val': 0.08891982477105011, 'batch_size': 3744, 'optimizer': 'RMSprop'}.
2026-06-21 19:36:49,902 - experiment_functions - INFO - Early stopping at epoch 1550. Best Metrics: (0.0038888841285675746, 0.0008889099406340788, 0.0023552588010584538)
2026-06-21 19:36:50,008 - optuna.study.study - INFO - Trial 221 finished with values: [0.0038888841285675746, 0.0008889099406340788, 0.0023552588010584538] and parameters: {'n_layers': 1, 'embedding_dim': 32, 'lr': 0.0015158687633618723, 'lambda_val': 7.024518890460945e-05, 'batch_size': 2925, 'optimizer': 'Adam'}.
2026-06-21 19:37:45,565 - experiment_functions - INFO - Early stopping at epoch 1350. Best Metrics: (0.006947433959952754, 0.001657824933687003, 0.004381625516826049)
2026-06-21 19:37:45,664 - optuna.study.study - INFO - Trial 222 finished with values: [0.006947433959952754, 0.001657824933687003, 0.004381625516826049] and parameters: {'n_layers': 2, 'embedding_dim': 32, 'lr': 0.0024374436987616007, 'lambda_val': 7.024518890460945e-05, 'batch_size': 1038, 'optimizer': 'Adam'}.
2026-06-21 19:40:34,680 - optuna.study.study - INFO - Trial 223 finished with values: [0.0013890571519254756, 0.0003063028925097891, 0.0007721127923533503] and parameters: {'n_layers': 4, 'embedding_dim': 64, 'lr': 0.00010520868097706175, 'lambda_val': 0.0004098288354602192, 'batch_size': 3457, 'optimizer': 'RMSprop'}.
2026-06-21 19:41:05,903 - experiment_functions - INFO - Early stopping at epoch 650. Best Metrics: (0.00869292946631587, 0.002166224580017683, 0.005268252095525114)
2026-06-21 19:41:06,050 - optuna.study.study - INFO - Trial 224 finished with values: [0.00869292946631587, 0.002166224580017683, 0.005268252095525114] and parameters: {'n_layers': 4, 'embedding_dim': 96, 'lr': 0.0036608132255288727, 'lambda_val': 0.0005803217930206673, 'batch_size': 1913, 'optimizer': 'Adam'}.
2026-06-21 19:41:32,787 - experiment_functions - INFO - Early stopping at epoch 600. Best Metrics: (0.007227873502204143, 0.0019183402804092459, 0.004599553411967744)
2026-06-21 19:41:32,902 - optuna.study.study - INFO - Trial 225 finished with values: [0.007227873502204143, 0.0019183402804092459, 0.004599553411967744] and parameters: {'n_layers': 4, 'embedding_dim': 32, 'lr': 0.008584559395253388, 'lambda_val': 1.1896982541974421e-05, 'batch_size': 3469, 'optimizer': 'Adam'}.
2026-06-21 19:42:00,799 - experiment_functions - INFO - Early stopping at epoch 650. Best Metrics: (0.003649361713627251, 0.0008589112037387899, 0.002109565690657071)
2026-06-21 19:42:00,941 - optuna.study.study - INFO - Trial 226 finished with values: [0.003649361713627251, 0.0008589112037387899, 0.002109565690657071] and parameters: {'n_layers': 1, 'embedding_dim': 32, 'lr': 0.011765700859700308, 'lambda_val': 1.544427077132802e-06, 'batch_size': 2374, 'optimizer': 'Adam'}.
2026-06-21 19:42:27,631 - experiment_functions - INFO - Early stopping at epoch 600. Best Metrics: (0.006856668037280903, 0.0017920298092711886, 0.004206414370031836)
2026-06-21 19:42:27,737 - optuna.study.study - INFO - Trial 227 finished with values: [0.006856668037280903, 0.0017920298092711886, 0.004206414370031836] and parameters: {'n_layers': 4, 'embedding_dim': 32, 'lr': 0.011765700859700308, 'lambda_val': 0.00031487100567246335, 'batch_size': 2374, 'optimizer': 'Adam'}.
2026-06-21 19:43:06,355 - experiment_functions - INFO - Early stopping at epoch 850. Best Metrics: (0.007672085797591153, 0.0019451812555260834, 0.004736756466255251)
2026-06-21 19:43:06,459 - optuna.study.study - INFO - Trial 228 finished with values: [0.007672085797591153, 0.0019451812555260834, 0.004736756466255251] and parameters: {'n_layers': 3, 'embedding_dim': 96, 'lr': 0.0026843825331302053, 'lambda_val': 0.0005803217930206673, 'batch_size': 1878, 'optimizer': 'Adam'}.
2026-06-21 19:43:47,779 - experiment_functions - INFO - Early stopping at epoch 950. Best Metrics: (0.009715951184527111, 0.002380952380952381, 0.005579246426834238)
2026-06-21 19:43:48,027 - optuna.study.study - INFO - Trial 229 finished with values: [0.009715951184527111, 0.002380952380952381, 0.005579246426834238] and parameters: {'n_layers': 4, 'embedding_dim': 32, 'lr': 0.0015158687633618723, 'lambda_val': 1.5197487708310403e-05, 'batch_size': 3744, 'optimizer': 'RMSprop'}.
2026-06-21 19:44:13,629 - experiment_functions - INFO - Early stopping at epoch 550. Best Metrics: (0.005142449989137823, 0.0012804724011620564, 0.0030089848179579064)
2026-06-21 19:44:13,825 - optuna.study.study - INFO - Trial 230 finished with values: [0.005142449989137823, 0.0012804724011620564, 0.0030089848179579064] and parameters: {'n_layers': 4, 'embedding_dim': 64, 'lr': 0.012102205652354326, 'lambda_val': 0.0004098288354602192, 'batch_size': 1033, 'optimizer': 'RMSprop'}.
2026-06-21 19:44:53,079 - experiment_functions - INFO - Early stopping at epoch 950. Best Metrics: (0.003803633551313262, 0.0008510167992926615, 0.002202091415889192)
2026-06-21 19:44:53,444 - optuna.study.study - INFO - Trial 231 finished with values: [0.003803633551313262, 0.0008510167992926615, 0.002202091415889192] and parameters: {'n_layers': 1, 'embedding_dim': 32, 'lr': 0.0036608132255288727, 'lambda_val': 0.0009730028095032008, 'batch_size': 2374, 'optimizer': 'Adam'}.
2026-06-21 19:46:06,803 - experiment_functions - INFO - Early stopping at epoch 1650. Best Metrics: (0.006800197534126787, 0.0017272956928129342, 0.004150505086792976)
2026-06-21 19:46:06,912 - optuna.study.study - INFO - Trial 232 finished with values: [0.006800197534126787, 0.0017272956928129342, 0.004150505086792976] and parameters: {'n_layers': 2, 'embedding_dim': 128, 'lr': 0.0024374436987616007, 'lambda_val': 6.131403610536352e-05, 'batch_size': 899, 'optimizer': 'Adam'}.
2026-06-21 19:46:45,883 - experiment_functions - INFO - Early stopping at epoch 850. Best Metrics: (0.0074911033431900665, 0.0018962359479600859, 0.004469899054929805)
