2026-06-18 11:14:15,255 - optuna.study.study - INFO - Trial 19 finished with values: [0.002766008403004653, 0.0006094480232411268, 0.001734114465231688] and parameters: {'n_layers': 2, 'embedding_dim': 64, 'lr': 0.00031499139279171867, 'lambda_val': 1.6374349019595285e-06, 'batch_size': 3769, 'optimizer': 'RMSprop'}.
2026-06-18 11:17:36,993 - optuna.study.study - INFO - Trial 20 finished with values: [0.0008780458797492916, 0.00019104458759631175, 0.0004388196364894141] and parameters: {'n_layers': 3, 'embedding_dim': 256, 'lr': 7.808437936329981e-05, 'lambda_val': 5.343578721318298e-06, 'batch_size': 574, 'optimizer': 'Adam'}.
2026-06-18 11:18:01,154 - experiment_functions - INFO - Early stopping at epoch 500. Best Metrics: (0.0004987723667438843, 0.00011052166224580018, 0.00023910013568228402)
2026-06-18 11:18:01,271 - optuna.study.study - INFO - Trial 21 finished with values: [0.0004987723667438843, 0.00011052166224580018, 0.00023910013568228402] and parameters: {'n_layers': 1, 'embedding_dim': 256, 'lr': 0.006286342731158655, 'lambda_val': 0.00021462126574743303, 'batch_size': 1928, 'optimizer': 'SGD'}.
2026-06-18 11:18:26,063 - experiment_functions - INFO - Early stopping at epoch 500. Best Metrics: (0.0005546312737876617, 0.0001468359226979917, 0.0003298458909225045)
2026-06-18 11:18:26,415 - optuna.study.study - INFO - Trial 22 finished with values: [0.0005546312737876617, 0.0001468359226979917, 0.0003298458909225045] and parameters: {'n_layers': 4, 'embedding_dim': 96, 'lr': 0.01122024403638141, 'lambda_val': 1.2808638655641925e-06, 'batch_size': 2404, 'optimizer': 'SGD'}.
2026-06-18 11:21:33,676 - experiment_functions - INFO - Early stopping at epoch 3500. Best Metrics: (0.0032805467176281974, 0.0008699633699633701, 0.0020271768204056665)
2026-06-18 11:21:33,797 - optuna.study.study - INFO - Trial 23 finished with values: [0.0032805467176281974, 0.0008699633699633701, 0.0020271768204056665] and parameters: {'n_layers': 4, 'embedding_dim': 256, 'lr': 0.00054735960254125, 'lambda_val': 9.43829822749537e-06, 'batch_size': 3617, 'optimizer': 'Adam'}.
2026-06-18 11:24:15,151 - optuna.study.study - INFO - Trial 24 finished with values: [0.0035076272495796882, 0.0007752305166098269, 0.002079642165488612] and parameters: {'n_layers': 2, 'embedding_dim': 64, 'lr': 0.0005796526912711289, 'lambda_val': 0.00029123929001349135, 'batch_size': 945, 'optimizer': 'RMSprop'}.
2026-06-18 11:27:36,797 - optuna.study.study - INFO - Trial 25 finished with values: [0.0018493285723669623, 0.000418403435644815, 0.0011678101299827585] and parameters: {'n_layers': 3, 'embedding_dim': 256, 'lr': 0.0001578689726353281, 'lambda_val': 0.004447109933745729, 'batch_size': 1842, 'optimizer': 'Adam'}.
2026-06-18 11:28:01,227 - experiment_functions - INFO - Early stopping at epoch 500. Best Metrics: (0.0017093259289814784, 0.0004152456738663635, 0.0012360719684354872)
2026-06-18 11:28:01,351 - optuna.study.study - INFO - Trial 26 finished with values: [0.0017093259289814784, 0.0004152456738663635, 0.0012360719684354872] and parameters: {'n_layers': 3, 'embedding_dim': 128, 'lr': 0.021918083735673895, 'lambda_val': 0.0024707717949945967, 'batch_size': 1378, 'optimizer': 'RMSprop'}.
2026-06-18 11:28:28,619 - experiment_functions - INFO - Early stopping at epoch 550. Best Metrics: (0.002462151307249588, 0.0006473411645825439, 0.001644092638678131)
2026-06-18 11:28:28,717 - optuna.study.study - INFO - Trial 27 finished with values: [0.002462151307249588, 0.0006473411645825439, 0.001644092638678131] and parameters: {'n_layers': 4, 'embedding_dim': 128, 'lr': 0.07625802966647915, 'lambda_val': 5.672639985302811e-06, 'batch_size': 3659, 'optimizer': 'Adam'}.
2026-06-18 11:29:00,886 - experiment_functions - INFO - Early stopping at epoch 750. Best Metrics: (0.0005037064344640327, 0.0001215738284703802, 0.00029189052153255076)
2026-06-18 11:29:00,975 - optuna.study.study - INFO - Trial 28 finished with values: [0.0005037064344640327, 0.0001215738284703802, 0.00029189052153255076] and parameters: {'n_layers': 3, 'embedding_dim': 32, 'lr': 1.1078140328588516e-05, 'lambda_val': 0.016682787798102124, 'batch_size': 1303, 'optimizer': 'RMSprop'}.
2026-06-18 11:29:24,348 - experiment_functions - INFO - Early stopping at epoch 500. Best Metrics: (0.0008038947225947132, 0.00014683592269799163, 0.0004160772737634849)
2026-06-18 11:29:24,468 - optuna.study.study - INFO - Trial 29 finished with values: [0.0008038947225947132, 0.00014683592269799163, 0.0004160772737634849] and parameters: {'n_layers': 2, 'embedding_dim': 128, 'lr': 2.0424845144124385e-05, 'lambda_val': 0.00255086578537524, 'batch_size': 1294, 'optimizer': 'RMSprop'}.
2026-06-18 11:29:47,907 - experiment_functions - INFO - Early stopping at epoch 500. Best Metrics: (0.00046124312912554615, 0.00010894278135657447, 0.0002236494426957455)
2026-06-18 11:29:48,263 - optuna.study.study - INFO - Trial 30 finished with values: [0.00046124312912554615, 0.00010894278135657447, 0.0002236494426957455] and parameters: {'n_layers': 2, 'embedding_dim': 128, 'lr': 1.915191936049481e-05, 'lambda_val': 4.929208838451657e-05, 'batch_size': 1139, 'optimizer': 'SGD'}.
2026-06-18 11:30:58,002 - experiment_functions - INFO - Early stopping at epoch 1600. Best Metrics: (0.002089845632199517, 0.0005983958570165466, 0.001296723822703796)
2026-06-18 11:30:58,122 - optuna.study.study - INFO - Trial 31 finished with values: [0.002089845632199517, 0.0005983958570165466, 0.001296723822703796] and parameters: {'n_layers': 2, 'embedding_dim': 128, 'lr': 0.0013472245469264425, 'lambda_val': 0.033110393858222356, 'batch_size': 1618, 'optimizer': 'Adam'}.
2026-06-18 11:31:23,232 - experiment_functions - INFO - Early stopping at epoch 550. Best Metrics: (0.001837717129985497, 0.00048313755210306944, 0.001226144766531733)
2026-06-18 11:31:23,338 - optuna.study.study - INFO - Trial 32 finished with values: [0.001837717129985497, 0.00048313755210306944, 0.001226144766531733] and parameters: {'n_layers': 3, 'embedding_dim': 64, 'lr': 0.03465961748836521, 'lambda_val': 6.182125492774287e-05, 'batch_size': 3533, 'optimizer': 'RMSprop'}.
2026-06-18 11:31:51,452 - experiment_functions - INFO - Early stopping at epoch 500. Best Metrics: (0.0004906029907782974, 0.00011841606669192877, 0.000255293402172263)
2026-06-18 11:31:51,800 - optuna.study.study - INFO - Trial 33 finished with values: [0.0004906029907782974, 0.00011841606669192877, 0.000255293402172263] and parameters: {'n_layers': 4, 'embedding_dim': 256, 'lr': 2.2991753075701822e-05, 'lambda_val': 0.0004106612872323579, 'batch_size': 1981, 'optimizer': 'SGD'}.
2026-06-18 11:32:21,985 - experiment_functions - INFO - Early stopping at epoch 650. Best Metrics: (0.003247884609182137, 0.0008778577744094986, 0.002053340925803235)
2026-06-18 11:32:22,097 - optuna.study.study - INFO - Trial 34 finished with values: [0.003247884609182137, 0.0008778577744094986, 0.002053340925803235] and parameters: {'n_layers': 3, 'embedding_dim': 96, 'lr': 0.0035939494204294854, 'lambda_val': 0.0014016263791028032, 'batch_size': 649, 'optimizer': 'RMSprop'}.
2026-06-18 11:32:50,360 - experiment_functions - INFO - Early stopping at epoch 500. Best Metrics: (0.0006517656536620892, 0.00012631047113805733, 0.0003079003316860673)
2026-06-18 11:32:50,469 - optuna.study.study - INFO - Trial 35 finished with values: [0.0006517656536620892, 0.00012631047113805733, 0.0003079003316860673] and parameters: {'n_layers': 4, 'embedding_dim': 256, 'lr': 0.0007191584801138237, 'lambda_val': 5.597188222068481e-06, 'batch_size': 1099, 'optimizer': 'SGD'}.
2026-06-18 11:33:13,319 - experiment_functions - INFO - Early stopping at epoch 500. Best Metrics: (0.0004976856855625498, 0.00011052166224580017, 0.0002528525447801853)
2026-06-18 11:33:13,679 - optuna.study.study - INFO - Trial 36 finished with values: [0.0004976856855625498, 0.00011052166224580017, 0.0002528525447801853] and parameters: {'n_layers': 3, 'embedding_dim': 64, 'lr': 0.0009065094949903636, 'lambda_val': 2.393997754259216e-05, 'batch_size': 909, 'optimizer': 'SGD'}.
2026-06-18 11:35:55,208 - optuna.study.study - INFO - Trial 37 finished with values: [0.0006649333613081201, 0.00016894025514715172, 0.0004085226274839831] and parameters: {'n_layers': 2, 'embedding_dim': 64, 'lr': 0.00014551582421006617, 'lambda_val': 0.03424183489223616, 'batch_size': 1454, 'optimizer': 'Adam'}.
2026-06-18 11:38:48,326 - optuna.study.study - INFO - Trial 38 finished with values: [0.0009677058481844257, 0.000239989895162309, 0.0005481074761638337] and parameters: {'n_layers': 4, 'embedding_dim': 96, 'lr': 6.471967039734056e-05, 'lambda_val': 6.887612985414143e-05, 'batch_size': 3660, 'optimizer': 'RMSprop'}.
2026-06-18 11:39:12,451 - experiment_functions - INFO - Early stopping at epoch 500. Best Metrics: (0.0005646840753106443, 0.00013262599469496023, 0.0003268698314696395)
2026-06-18 11:39:12,536 - optuna.study.study - INFO - Trial 39 finished with values: [0.0005646840753106443, 0.00013262599469496023, 0.0003268698314696395] and parameters: {'n_layers': 3, 'embedding_dim': 96, 'lr': 0.0020795989989061993, 'lambda_val': 0.00454439172343964, 'batch_size': 2204, 'optimizer': 'SGD'}.
2026-06-18 11:40:57,664 - experiment_functions - INFO - Early stopping at epoch 2350. Best Metrics: (0.002018736034429251, 0.0005873436907919668, 0.0012535300976153246)
2026-06-18 11:40:57,766 - optuna.study.study - INFO - Trial 40 finished with values: [0.002018736034429251, 0.0005873436907919668, 0.0012535300976153246] and parameters: {'n_layers': 1, 'embedding_dim': 256, 'lr': 0.05395674460341747, 'lambda_val': 0.0016802091204768195, 'batch_size': 1380, 'optimizer': 'Adam'}.
2026-06-18 11:41:29,522 - experiment_functions - INFO - Early stopping at epoch 750. Best Metrics: (0.0028957920123823177, 0.0006647088543640268, 0.0017224409229448893)
2026-06-18 11:41:29,622 - optuna.study.study - INFO - Trial 41 finished with values: [0.0028957920123823177, 0.0006647088543640268, 0.0017224409229448893] and parameters: {'n_layers': 2, 'embedding_dim': 32, 'lr': 0.0025439982760106436, 'lambda_val': 2.9517437997373373e-06, 'batch_size': 2328, 'optimizer': 'Adam'}.
2026-06-18 11:41:52,126 - experiment_functions - INFO - Early stopping at epoch 500. Best Metrics: (0.000538841285673952, 0.00012157382847038019, 0.0003098043778058782)
2026-06-18 11:41:52,241 - optuna.study.study - INFO - Trial 42 finished with values: [0.000538841285673952, 0.00012157382847038019, 0.0003098043778058782] and parameters: {'n_layers': 3, 'embedding_dim': 64, 'lr': 0.004583119628345995, 'lambda_val': 0.00047861420523939247, 'batch_size': 1357, 'optimizer': 'SGD'}.
2026-06-18 11:42:54,061 - experiment_functions - INFO - Early stopping at epoch 1350. Best Metrics: (0.0026126232856583022, 0.0006205001894657069, 0.0015735459864911945)
2026-06-18 11:42:54,392 - optuna.study.study - INFO - Trial 43 finished with values: [0.0026126232856583022, 0.0006205001894657069, 0.0015735459864911945] and parameters: {'n_layers': 1, 'embedding_dim': 256, 'lr': 0.0014625528771019128, 'lambda_val': 0.0015359029367627384, 'batch_size': 1836, 'optimizer': 'Adam'}.
2026-06-18 11:43:25,824 - experiment_functions - INFO - Early stopping at epoch 550. Best Metrics: (0.0027857094191717563, 0.0007373373752684098, 0.001739519832251921)
2026-06-18 11:43:26,013 - optuna.study.study - INFO - Trial 44 finished with values: [0.0027857094191717563, 0.0007373373752684098, 0.001739519832251921] and parameters: {'n_layers': 4, 'embedding_dim': 256, 'lr': 0.002025300477572928, 'lambda_val': 0.006312555433463844, 'batch_size': 3715, 'optimizer': 'RMSprop'}.
2026-06-18 11:43:52,615 - experiment_functions - INFO - Early stopping at epoch 500. Best Metrics: (0.0004860594611584423, 0.00010894278135657447, 0.0002654689094694164)
2026-06-18 11:43:52,733 - optuna.study.study - INFO - Trial 45 finished with values: [0.0004860594611584423, 0.00010894278135657447, 0.0002654689094694164] and parameters: {'n_layers': 3, 'embedding_dim': 256, 'lr': 0.0020465997419207454, 'lambda_val': 0.016234849402188063, 'batch_size': 2000, 'optimizer': 'SGD'}.
2026-06-18 11:44:24,145 - experiment_functions - INFO - Early stopping at epoch 550. Best Metrics: (0.0030648825652925663, 0.0007941770872805356, 0.0019271083975888658)
2026-06-18 11:44:24,267 - optuna.study.study - INFO - Trial 46 finished with values: [0.0030648825652925663, 0.0007941770872805356, 0.0019271083975888658] and parameters: {'n_layers': 4, 'embedding_dim': 256, 'lr': 0.01251000483486688, 'lambda_val': 1.7089177370137862e-06, 'batch_size': 801, 'optimizer': 'RMSprop'}.
2026-06-18 11:44:49,499 - experiment_functions - INFO - Early stopping at epoch 550. Best Metrics: (0.0018012886738306326, 0.0005589238347859038, 0.0011810047632978733)
2026-06-18 11:44:49,898 - optuna.study.study - INFO - Trial 47 finished with values: [0.0018012886738306326, 0.0005589238347859038, 0.0011810047632978733] and parameters: {'n_layers': 4, 'embedding_dim': 64, 'lr': 0.005512105875915726, 'lambda_val': 0.02642098205161091, 'batch_size': 3005, 'optimizer': 'RMSprop'}.
2026-06-18 11:45:12,903 - experiment_functions - INFO - Early stopping at epoch 500. Best Metrics: (0.0005218788203395889, 0.00013262599469496023, 0.00028348913263379213)
2026-06-18 11:45:13,023 - optuna.study.study - INFO - Trial 48 finished with values: [0.0005218788203395889, 0.00013262599469496023, 0.00028348913263379213] and parameters: {'n_layers': 2, 'embedding_dim': 128, 'lr': 0.0026181966986536537, 'lambda_val': 1.9720943497061824e-05, 'batch_size': 910, 'optimizer': 'SGD'}.
2026-06-18 11:46:05,069 - experiment_functions - INFO - Early stopping at epoch 1150. Best Metrics: (0.0006165746950150112, 0.0001278893520272831, 0.00032780192650829756)
2026-06-18 11:46:05,434 - optuna.study.study - INFO - Trial 49 finished with values: [0.0006165746950150112, 0.0001278893520272831, 0.00032780192650829756] and parameters: {'n_layers': 3, 'embedding_dim': 128, 'lr': 1.5184401257502543e-05, 'lambda_val': 0.0008207976130822219, 'batch_size': 3364, 'optimizer': 'RMSprop'}.
2026-06-18 11:46:39,466 - experiment_functions - INFO - Early stopping at epoch 600. Best Metrics: (0.0030857971045276816, 0.0008194391815081471, 0.0019237905873348271)
2026-06-18 11:46:40,176 - optuna.study.study - INFO - Trial 50 finished with values: [0.0030857971045276816, 0.0008194391815081471, 0.0019237905873348271] and parameters: {'n_layers': 4, 'embedding_dim': 256, 'lr': 0.01251000483486688, 'lambda_val': 1.7089177370137862e-06, 'batch_size': 801, 'optimizer': 'RMSprop'}.
2026-06-18 11:50:09,234 - optuna.study.study - INFO - Trial 51 finished with values: [0.0006538116747899058, 0.00015630920803334596, 0.0003692235564972907] and parameters: {'n_layers': 4, 'embedding_dim': 256, 'lr': 2.0923439974532284e-05, 'lambda_val': 0.006312555433463844, 'batch_size': 2785, 'optimizer': 'RMSprop'}.
2026-06-18 11:50:35,817 - experiment_functions - INFO - Early stopping at epoch 500. Best Metrics: (0.0005940349661782522, 0.0001310471138057345, 0.00032252905743596907)
2026-06-18 11:50:35,932 - optuna.study.study - INFO - Trial 52 finished with values: [0.0005940349661782522, 0.0001310471138057345, 0.00032252905743596907] and parameters: {'n_layers': 3, 'embedding_dim': 256, 'lr': 0.003307811671556655, 'lambda_val': 0.002983671998255277, 'batch_size': 2204, 'optimizer': 'SGD'}.
2026-06-18 11:54:04,304 - optuna.study.study - INFO - Trial 53 finished with values: [0.0021784911284179064, 0.0006126057850195781, 0.001404602325551733] and parameters: {'n_layers': 4, 'embedding_dim': 256, 'lr': 0.00015421584249526724, 'lambda_val': 0.02642098205161091, 'batch_size': 3005, 'optimizer': 'RMSprop'}.
2026-06-18 11:56:20,475 - experiment_functions - INFO - Early stopping at epoch 3350. Best Metrics: (0.0005956223731739602, 0.00013262599469496025, 0.0003816573426453803)
2026-06-18 11:56:20,587 - optuna.study.study - INFO - Trial 54 finished with values: [0.0005956223731739602, 0.00013262599469496025, 0.0003816573426453803] and parameters: {'n_layers': 1, 'embedding_dim': 128, 'lr': 2.0424845144124385e-05, 'lambda_val': 1.1234571578444802e-06, 'batch_size': 1294, 'optimizer': 'RMSprop'}.
2026-06-18 11:58:11,871 - experiment_functions - INFO - Early stopping at epoch 2750. Best Metrics: (0.0032263266727118097, 0.0007041808765946696, 0.001971736303881531)
2026-06-18 11:58:12,212 - optuna.study.study - INFO - Trial 55 finished with values: [0.0032263266727118097, 0.0007041808765946696, 0.001971736303881531] and parameters: {'n_layers': 2, 'embedding_dim': 64, 'lr': 0.0005796526912711289, 'lambda_val': 1.0687219886452036e-06, 'batch_size': 3953, 'optimizer': 'RMSprop'}.
2026-06-18 11:58:59,708 - experiment_functions - INFO - Early stopping at epoch 1100. Best Metrics: (0.0029758326967855107, 0.0007468106606037641, 0.0019070549931715427)
2026-06-18 11:59:00,089 - optuna.study.study - INFO - Trial 56 finished with values: [0.0029758326967855107, 0.0007468106606037641, 0.0019070549931715427] and parameters: {'n_layers': 4, 'embedding_dim': 64, 'lr': 0.0005516089764502217, 'lambda_val': 0.005988433373997008, 'batch_size': 2563, 'optimizer': 'RMSprop'}.
2026-06-18 12:01:39,586 - optuna.study.study - INFO - Trial 57 finished with values: [0.0033740718614578102, 0.0007436528988253126, 0.002096885324338781] and parameters: {'n_layers': 2, 'embedding_dim': 64, 'lr': 0.0005796526912711289, 'lambda_val': 0.00029123929001349135, 'batch_size': 945, 'optimizer': 'RMSprop'}.
2026-06-18 12:04:32,318 - optuna.study.study - INFO - Trial 58 finished with values: [0.0011410168842201775, 0.00022577996715927748, 0.0006544565874097805] and parameters: {'n_layers': 4, 'embedding_dim': 96, 'lr': 6.471967039734056e-05, 'lambda_val': 5.343578721318298e-06, 'batch_size': 3660, 'optimizer': 'RMSprop'}.
2026-06-18 12:05:07,890 - experiment_functions - INFO - Early stopping at epoch 850. Best Metrics: (0.0037803537575173086, 0.0008004926108374384, 0.0022688312079351776)
2026-06-18 12:05:08,862 - optuna.study.study - INFO - Trial 59 finished with values: [0.0037803537575173086, 0.0008004926108374384, 0.0022688312079351776] and parameters: {'n_layers': 1, 'embedding_dim': 64, 'lr': 0.002487565347422212, 'lambda_val': 1.3344718493912024e-05, 'batch_size': 892, 'optimizer': 'RMSprop'}.
2026-06-18 12:06:38,483 - experiment_functions - INFO - Early stopping at epoch 1950. Best Metrics: (0.003279079353460891, 0.0008699633699633701, 0.0020419600500997752)
2026-06-18 12:06:38,800 - optuna.study.study - INFO - Trial 60 finished with values: [0.003279079353460891, 0.0008699633699633701, 0.0020419600500997752] and parameters: {'n_layers': 4, 'embedding_dim': 128, 'lr': 0.0016391721585660463, 'lambda_val': 1.455259422316608e-06, 'batch_size': 3005, 'optimizer': 'RMSprop'}.
2026-06-18 12:07:00,384 - experiment_functions - INFO - Early stopping at epoch 500. Best Metrics: (0.00054470105017364, 0.00012315270935960593, 0.00028951595406663836)
2026-06-18 12:07:00,501 - optuna.study.study - INFO - Trial 61 finished with values: [0.00054470105017364, 0.00012315270935960593, 0.00028951595406663836] and parameters: {'n_layers': 1, 'embedding_dim': 32, 'lr': 0.0016391721585660463, 'lambda_val': 1.455259422316608e-06, 'batch_size': 2199, 'optimizer': 'SGD'}.
2026-06-18 12:07:24,627 - experiment_functions - INFO - Early stopping at epoch 500. Best Metrics: (0.0004482642582941228, 0.00010262725779967159, 0.0002507881363508453)
2026-06-18 12:07:24,716 - optuna.study.study - INFO - Trial 62 finished with values: [0.0004482642582941228, 0.00010262725779967159, 0.0002507881363508453] and parameters: {'n_layers': 3, 'embedding_dim': 128, 'lr': 1.5184401257502543e-05, 'lambda_val': 0.0038087913449814693, 'batch_size': 3364, 'optimizer': 'Adam'}.
2026-06-18 12:10:04,327 - optuna.study.study - INFO - Trial 63 finished with values: [0.0025867710804002484, 0.0005905014525704182, 0.0016264893171635305] and parameters: {'n_layers': 2, 'embedding_dim': 64, 'lr': 0.00031499139279171867, 'lambda_val': 1.6374349019595285e-06, 'batch_size': 1541, 'optimizer': 'RMSprop'}.
2026-06-18 12:10:29,076 - experiment_functions - INFO - Early stopping at epoch 550. Best Metrics: (0.0017457139387747486, 0.00046419098143236085, 0.0010991657059168651)
2026-06-18 12:10:29,423 - optuna.study.study - INFO - Trial 64 finished with values: [0.0017457139387747486, 0.00046419098143236085, 0.0010991657059168651] and parameters: {'n_layers': 2, 'embedding_dim': 96, 'lr': 0.05778308903778597, 'lambda_val': 1.7094839440532154e-05, 'batch_size': 1812, 'optimizer': 'RMSprop'}.
2026-06-18 12:13:12,827 - optuna.study.study - INFO - Trial 65 finished with values: [0.0014802758245901777, 0.00030630289250978905, 0.0008827460121349709] and parameters: {'n_layers': 2, 'embedding_dim': 96, 'lr': 0.00010963058081904807, 'lambda_val': 1.0819711188161646e-06, 'batch_size': 3200, 'optimizer': 'RMSprop'}.
2026-06-18 12:13:39,569 - experiment_functions - INFO - Early stopping at epoch 600. Best Metrics: (0.002771664772354525, 0.0007041808765946697, 0.0018186204505886126)
2026-06-18 12:13:39,670 - optuna.study.study - INFO - Trial 66 finished with values: [0.002771664772354525, 0.0007041808765946697, 0.0018186204505886126] and parameters: {'n_layers': 2, 'embedding_dim': 96, 'lr': 0.003307811671556655, 'lambda_val': 0.00022507006239543383, 'batch_size': 2844, 'optimizer': 'RMSprop'}.
2026-06-18 12:14:38,005 - experiment_functions - INFO - Early stopping at epoch 1450. Best Metrics: (0.0016680183632759062, 0.0004989263609953265, 0.001056077864003728)
2026-06-18 12:14:38,111 - optuna.study.study - INFO - Trial 67 finished with values: [0.0016680183632759062, 0.0004989263609953265, 0.001056077864003728] and parameters: {'n_layers': 3, 'embedding_dim': 32, 'lr': 0.03465961748836521, 'lambda_val': 0.010567198827065956, 'batch_size': 3533, 'optimizer': 'RMSprop'}.
2026-06-18 12:15:04,461 - experiment_functions - INFO - Early stopping at epoch 500. Best Metrics: (0.0006690565361197513, 0.00014525704180876593, 0.00037184782681345436)
