2026-06-16 21:08:31,744 - root - INFO - **** Training e_yelp_full
2026-06-16 21:08:31,744 - root - INFO - --- Hardware Check ---
2026-06-16 21:08:31,744 - root - INFO - PyTorch version 2.6.0+cu124
2026-06-16 21:08:31,744 - root - INFO - Is CUDA available? True
2026-06-16 21:08:31,781 - root - INFO - GPU Device Name: NVIDIA GeForce RTX 3090
2026-06-16 21:08:35,288 - helper_functions - INFO - Users: 31668, Items: 38048
2026-06-16 21:08:35,288 - helper_functions - INFO - Edge index: torch.Size([2, 1561406])
2026-06-16 21:08:35,288 - root - INFO - **** Generating the graph:
2026-06-16 21:08:37,328 - helper_functions - INFO - Number of unique users: 31668
2026-06-16 21:08:37,346 - helper_functions - INFO - Number of unique items: 38048
2026-06-16 21:08:37,346 - helper_functions - INFO - Number of nodes: 69716
2026-06-16 21:08:37,371 - helper_functions - INFO - Number of edges: 1561406
2026-06-16 21:08:40,550 - optuna.storages._rdb.storage - INFO - A new study created in RDB with name: Study_e_yelp_full
2026-06-16 21:11:18,086 - experiment_functions - INFO - Early stopping at epoch 3550. Best Metrics: (0.033866951729159336, 0.0075091575091575085, 0.020094957082514037)
2026-06-16 21:11:18,179 - optuna.study.study - INFO - Trial 0 finished with values: [0.033866951729159336, 0.0075091575091575085, 0.020094957082514037] and parameters: {'n_layers': 1, 'embedding_dim': 32, 'lr': 0.0007178694642074494, 'lambda_val': 1.0697648887853802e-06, 'batch_size': 2889, 'optimizer': 'RMSprop'}.
2026-06-16 21:11:47,651 - experiment_functions - INFO - Early stopping at epoch 500. Best Metrics: (0.0004456780474867326, 0.00010420613868889732, 0.00023026346889515862)
2026-06-16 21:11:47,770 - optuna.study.study - INFO - Trial 1 finished with values: [0.0004456780474867326, 0.00010420613868889732, 0.00023026346889515862] and parameters: {'n_layers': 4, 'embedding_dim': 96, 'lr': 0.0001097610212578119, 'lambda_val': 0.01336014423430066, 'batch_size': 3792, 'optimizer': 'SGD'}.
2026-06-16 21:12:57,360 - experiment_functions - INFO - Early stopping at epoch 1350. Best Metrics: (0.004794606934457264, 0.000975748389541493, 0.0025397564568555016)
2026-06-16 21:12:57,431 - optuna.study.study - INFO - Trial 2 finished with values: [0.004794606934457264, 0.000975748389541493, 0.0025397564568555016] and parameters: {'n_layers': 4, 'embedding_dim': 64, 'lr': 0.028823086620599382, 'lambda_val': 0.006249457405461014, 'batch_size': 2057, 'optimizer': 'RMSprop'}.
2026-06-16 21:13:37,919 - experiment_functions - INFO - Early stopping at epoch 550. Best Metrics: (0.008195924957296324, 0.0018362384741695086, 0.004650301672611966)
2026-06-16 21:13:38,005 - optuna.study.study - INFO - Trial 3 finished with values: [0.008195924957296324, 0.0018362384741695086, 0.004650301672611966] and parameters: {'n_layers': 3, 'embedding_dim': 256, 'lr': 0.0020532474965947955, 'lambda_val': 0.0015569229111002379, 'batch_size': 3244, 'optimizer': 'RMSprop'}.
2026-06-16 21:14:59,855 - experiment_functions - INFO - Early stopping at epoch 1650. Best Metrics: (0.024873318178333766, 0.005355563976253632, 0.014268779046106538)
2026-06-16 21:14:59,938 - optuna.study.study - INFO - Trial 4 finished with values: [0.024873318178333766, 0.005355563976253632, 0.014268779046106538] and parameters: {'n_layers': 3, 'embedding_dim': 64, 'lr': 0.0006340132793158045, 'lambda_val': 2.970506579255523e-05, 'batch_size': 3321, 'optimizer': 'Adam'}.
2026-06-16 21:15:41,014 - experiment_functions - INFO - Early stopping at epoch 550. Best Metrics: (0.0076521143826842825, 0.0016530882910193256, 0.004259497531070868)
2026-06-16 21:15:41,121 - optuna.study.study - INFO - Trial 5 finished with values: [0.0076521143826842825, 0.0016530882910193256, 0.004259497531070868] and parameters: {'n_layers': 3, 'embedding_dim': 256, 'lr': 0.04995038334471051, 'lambda_val': 1.755165508739205e-05, 'batch_size': 3066, 'optimizer': 'Adam'}.
2026-06-16 21:16:22,544 - experiment_functions - INFO - Early stopping at epoch 500. Best Metrics: (0.0005017357111563377, 0.00010578501957812305, 0.0002533252672824234)
2026-06-16 21:16:22,614 - optuna.study.study - INFO - Trial 6 finished with values: [0.0005017357111563377, 0.00010578501957812305, 0.0002533252672824234] and parameters: {'n_layers': 4, 'embedding_dim': 256, 'lr': 5.308983857882518e-05, 'lambda_val': 0.00190644218146611, 'batch_size': 3338, 'optimizer': 'Adam'}.
2026-06-16 21:17:24,632 - experiment_functions - INFO - Early stopping at epoch 1400. Best Metrics: (0.009274366778708838, 0.0019941265630920805, 0.005256126677091992)
2026-06-16 21:17:25,148 - optuna.study.study - INFO - Trial 7 finished with values: [0.009274366778708838, 0.0019941265630920805, 0.005256126677091992] and parameters: {'n_layers': 2, 'embedding_dim': 32, 'lr': 0.0034515732366684274, 'lambda_val': 0.00047026688403512977, 'batch_size': 1569, 'optimizer': 'RMSprop'}.
2026-06-16 21:22:04,688 - optuna.study.study - INFO - Trial 8 finished with values: [0.021758964472523668, 0.005112416319312872, 0.013025738387335964] and parameters: {'n_layers': 3, 'embedding_dim': 256, 'lr': 0.00017384659942437723, 'lambda_val': 1.3976665248992833e-06, 'batch_size': 1627, 'optimizer': 'RMSprop'}.
2026-06-16 21:25:13,125 - experiment_functions - INFO - Early stopping at epoch 3100. Best Metrics: (0.0007022092502044525, 0.0001578880889225717, 0.00037707438747593104)
2026-06-16 21:25:13,417 - optuna.study.study - INFO - Trial 9 finished with values: [0.0007022092502044525, 0.0001578880889225717, 0.00037707438747593104] and parameters: {'n_layers': 2, 'embedding_dim': 256, 'lr': 4.153283814674918e-05, 'lambda_val': 4.668160722444168e-06, 'batch_size': 3822, 'optimizer': 'Adam'}.
2026-06-16 21:25:44,296 - experiment_functions - INFO - Early stopping at epoch 550. Best Metrics: (0.0005192838930825983, 0.00011999494758115447, 0.0002980835987806015)
2026-06-16 21:25:44,655 - optuna.study.study - INFO - Trial 10 finished with values: [0.0005192838930825983, 0.00011999494758115447, 0.0002980835987806015] and parameters: {'n_layers': 1, 'embedding_dim': 256, 'lr': 2.0956806595188594e-05, 'lambda_val': 0.00023542921130762724, 'batch_size': 2776, 'optimizer': 'RMSprop'}.
2026-06-16 21:26:27,646 - experiment_functions - INFO - Early stopping at epoch 650. Best Metrics: (0.0262518821126639, 0.005720285461664773, 0.015236929645923896)
2026-06-16 21:26:27,719 - optuna.study.study - INFO - Trial 11 finished with values: [0.0262518821126639, 0.005720285461664773, 0.015236929645923896] and parameters: {'n_layers': 2, 'embedding_dim': 256, 'lr': 0.0017542874983550202, 'lambda_val': 1.4405090810627564e-05, 'batch_size': 3992, 'optimizer': 'Adam'}.
2026-06-16 21:29:55,554 - optuna.study.study - INFO - Trial 12 finished with values: [0.014548585835351286, 0.0030061892130857654, 0.00827057942215015] and parameters: {'n_layers': 4, 'embedding_dim': 64, 'lr': 0.017717847936403682, 'lambda_val': 3.327121177308548e-05, 'batch_size': 835, 'optimizer': 'RMSprop'}.
2026-06-16 21:31:38,523 - experiment_functions - INFO - Early stopping at epoch 2000. Best Metrics: (0.009749613331667408, 0.0020335985853227236, 0.005421083618319196)
2026-06-16 21:31:38,604 - optuna.study.study - INFO - Trial 13 finished with values: [0.009749613331667408, 0.0020335985853227236, 0.005421083618319196] and parameters: {'n_layers': 2, 'embedding_dim': 128, 'lr': 0.0043851759186162515, 'lambda_val': 4.546254137443526e-06, 'batch_size': 1704, 'optimizer': 'Adam'}.
2026-06-16 21:34:57,899 - optuna.study.study - INFO - Trial 14 finished with values: [0.006288570820597376, 0.001499936844764431, 0.00380832837706736] and parameters: {'n_layers': 2, 'embedding_dim': 128, 'lr': 0.00019812603137728135, 'lambda_val': 0.002293564989415113, 'batch_size': 1075, 'optimizer': 'RMSprop'}.
2026-06-16 21:35:24,979 - experiment_functions - INFO - Early stopping at epoch 500. Best Metrics: (0.0004946743016254017, 0.0001121005431350259, 0.0002939808076082103)
2026-06-16 21:35:25,066 - optuna.study.study - INFO - Trial 15 finished with values: [0.0004946743016254017, 0.0001121005431350259, 0.0002939808076082103] and parameters: {'n_layers': 2, 'embedding_dim': 128, 'lr': 9.061669616282746e-05, 'lambda_val': 0.0019050350117703115, 'batch_size': 1269, 'optimizer': 'SGD'}.
2026-06-16 21:36:01,305 - experiment_functions - INFO - Early stopping at epoch 500. Best Metrics: (0.0005470802767363845, 0.00011683718580270306, 0.0002737601409603735)
2026-06-16 21:36:01,391 - optuna.study.study - INFO - Trial 16 finished with values: [0.0005470802767363845, 0.00011683718580270306, 0.0002737601409603735] and parameters: {'n_layers': 3, 'embedding_dim': 256, 'lr': 0.00019792431146954263, 'lambda_val': 0.004484339017081162, 'batch_size': 673, 'optimizer': 'SGD'}.
2026-06-16 21:36:42,027 - experiment_functions - INFO - Early stopping at epoch 700. Best Metrics: (0.01752414299115049, 0.0037814197296955916, 0.009561553080065868)
2026-06-16 21:36:42,117 - optuna.study.study - INFO - Trial 17 finished with values: [0.01752414299115049, 0.0037814197296955916, 0.009561553080065868] and parameters: {'n_layers': 4, 'embedding_dim': 96, 'lr': 0.001105921045395747, 'lambda_val': 0.0009589330611107825, 'batch_size': 3920, 'optimizer': 'Adam'}.
2026-06-16 21:37:11,131 - experiment_functions - INFO - Early stopping at epoch 500. Best Metrics: (0.0005882737076559712, 0.00013262599469496023, 0.0003178670292193555)
2026-06-16 21:37:11,217 - optuna.study.study - INFO - Trial 18 finished with values: [0.0005882737076559712, 0.00013262599469496023, 0.0003178670292193555] and parameters: {'n_layers': 4, 'embedding_dim': 96, 'lr': 0.01960420741194364, 'lambda_val': 1.9413402449837055e-05, 'batch_size': 603, 'optimizer': 'SGD'}.
2026-06-16 21:37:33,638 - experiment_functions - INFO - Early stopping at epoch 500. Best Metrics: (0.0004578518240946076, 0.00010736390046734875, 0.0002737830626025717)
2026-06-16 21:37:33,728 - optuna.study.study - INFO - Trial 19 finished with values: [0.0004578518240946076, 0.00010736390046734875, 0.0002737830626025717] and parameters: {'n_layers': 1, 'embedding_dim': 32, 'lr': 0.0003495758618352309, 'lambda_val': 0.09367667261561559, 'batch_size': 1835, 'optimizer': 'Adam'}.
2026-06-16 21:38:42,208 - experiment_functions - INFO - Early stopping at epoch 850. Best Metrics: (0.01734335304688494, 0.003700896804345081, 0.009546393891634154)
2026-06-16 21:38:42,291 - optuna.study.study - INFO - Trial 20 finished with values: [0.01734335304688494, 0.003700896804345081, 0.009546393891634154] and parameters: {'n_layers': 4, 'embedding_dim': 256, 'lr': 0.000775613439496726, 'lambda_val': 1.8618951918561611e-06, 'batch_size': 1954, 'optimizer': 'Adam'}.
2026-06-16 21:39:19,704 - experiment_functions - INFO - Early stopping at epoch 500. Best Metrics: (0.0004989558560517445, 0.0001184160666919288, 0.0002928593464890326)
2026-06-16 21:39:19,785 - optuna.study.study - INFO - Trial 21 finished with values: [0.0004989558560517445, 0.0001184160666919288, 0.0002928593464890326] and parameters: {'n_layers': 1, 'embedding_dim': 256, 'lr': 1.0086574557511807e-05, 'lambda_val': 0.0002358860314305532, 'batch_size': 2596, 'optimizer': 'Adam'}.
2026-06-16 21:39:46,781 - experiment_functions - INFO - Early stopping at epoch 550. Best Metrics: (0.0004940226000752766, 0.00012157382847038019, 0.0002642656802967361)
2026-06-16 21:39:46,917 - optuna.study.study - INFO - Trial 22 finished with values: [0.0004940226000752766, 0.00012157382847038019, 0.0002642656802967361] and parameters: {'n_layers': 1, 'embedding_dim': 128, 'lr': 7.333211130312681e-05, 'lambda_val': 0.0022453635310841842, 'batch_size': 2103, 'optimizer': 'RMSprop'}.
2026-06-16 21:44:52,808 - experiment_functions - INFO - Early stopping at epoch 3900. Best Metrics: (0.009674956042966594, 0.0021014904635594293, 0.005037390449675025)
2026-06-16 21:44:52,895 - optuna.study.study - INFO - Trial 23 finished with values: [0.009674956042966594, 0.0021014904635594293, 0.005037390449675025] and parameters: {'n_layers': 4, 'embedding_dim': 256, 'lr': 0.0006628139134621098, 'lambda_val': 5.119347523585741e-06, 'batch_size': 582, 'optimizer': 'Adam'}.
2026-06-16 21:45:29,659 - experiment_functions - INFO - Early stopping at epoch 500. Best Metrics: (0.0005247751961036725, 0.00011367942402425162, 0.00027368071453439047)
2026-06-16 21:45:29,743 - optuna.study.study - INFO - Trial 24 finished with values: [0.0005247751961036725, 0.00011367942402425162, 0.00027368071453439047] and parameters: {'n_layers': 3, 'embedding_dim': 256, 'lr': 0.0034884562116689684, 'lambda_val': 0.003085444214711998, 'batch_size': 1100, 'optimizer': 'SGD'}.
2026-06-16 21:45:53,248 - experiment_functions - INFO - Early stopping at epoch 500. Best Metrics: (0.0006478991076779268, 0.00013262599469496023, 0.00033006454855457284)
2026-06-16 21:45:53,331 - optuna.study.study - INFO - Trial 25 finished with values: [0.0006478991076779268, 0.00013262599469496023, 0.00033006454855457284] and parameters: {'n_layers': 2, 'embedding_dim': 32, 'lr': 3.5404317787717374e-05, 'lambda_val': 9.417546930379629e-06, 'batch_size': 718, 'optimizer': 'SGD'}.
2026-06-16 21:46:55,204 - experiment_functions - INFO - Early stopping at epoch 1350. Best Metrics: (0.011762194219476193, 0.0024614753063028926, 0.006680263906744131)
2026-06-16 21:46:55,287 - optuna.study.study - INFO - Trial 26 finished with values: [0.011762194219476193, 0.0024614753063028926, 0.006680263906744131] and parameters: {'n_layers': 3, 'embedding_dim': 32, 'lr': 0.011485594305176742, 'lambda_val': 1.0768752731630495e-05, 'batch_size': 1386, 'optimizer': 'RMSprop'}.
2026-06-16 21:47:19,236 - experiment_functions - INFO - Early stopping at epoch 500. Best Metrics: (0.0005857089647193688, 0.00011999494758115448, 0.0002930105543769588)
2026-06-16 21:47:19,777 - optuna.study.study - INFO - Trial 27 finished with values: [0.0005857089647193688, 0.00011999494758115448, 0.0002930105543769588] and parameters: {'n_layers': 1, 'embedding_dim': 96, 'lr': 0.001115971582964825, 'lambda_val': 0.0008312788688260812, 'batch_size': 636, 'optimizer': 'SGD'}.
2026-06-16 21:47:43,242 - experiment_functions - INFO - Early stopping at epoch 500. Best Metrics: (0.0006667634917248834, 0.0001405203991410888, 0.00038753554902145373)
2026-06-16 21:47:43,338 - optuna.study.study - INFO - Trial 28 finished with values: [0.0006667634917248834, 0.0001405203991410888, 0.00038753554902145373] and parameters: {'n_layers': 1, 'embedding_dim': 64, 'lr': 7.842058186123007e-05, 'lambda_val': 1.9940041230698223e-05, 'batch_size': 1429, 'optimizer': 'SGD'}.
2026-06-16 21:49:04,343 - experiment_functions - INFO - Early stopping at epoch 1000. Best Metrics: (0.013853223110060812, 0.0032588101553618796, 0.00790988542442749)
2026-06-16 21:49:04,428 - optuna.study.study - INFO - Trial 29 finished with values: [0.013853223110060812, 0.0032588101553618796, 0.00790988542442749] and parameters: {'n_layers': 4, 'embedding_dim': 256, 'lr': 0.0003334703704985316, 'lambda_val': 0.009747650699295873, 'batch_size': 2988, 'optimizer': 'Adam'}.
2026-06-16 21:49:33,508 - experiment_functions - INFO - Early stopping at epoch 500. Best Metrics: (0.0005963184445097661, 0.0001389415182518631, 0.00031137573105615503)
2026-06-16 21:49:33,595 - optuna.study.study - INFO - Trial 30 finished with values: [0.0005963184445097661, 0.0001389415182518631, 0.00031137573105615503] and parameters: {'n_layers': 3, 'embedding_dim': 128, 'lr': 1.8650380259662448e-05, 'lambda_val': 0.00014566380585562914, 'batch_size': 3469, 'optimizer': 'SGD'}.
2026-06-16 21:49:58,450 - experiment_functions - INFO - Early stopping at epoch 500. Best Metrics: (0.0005769000710584973, 0.0001310471138057345, 0.00031872446662588875)
2026-06-16 21:49:58,544 - optuna.study.study - INFO - Trial 31 finished with values: [0.0005769000710584973, 0.0001310471138057345, 0.00031872446662588875] and parameters: {'n_layers': 1, 'embedding_dim': 128, 'lr': 0.00012690695112521012, 'lambda_val': 0.011937662179974627, 'batch_size': 2699, 'optimizer': 'Adam'}.
2026-06-16 21:53:20,570 - optuna.study.study - INFO - Trial 32 finished with values: [0.01923951630035054, 0.0038572060123784257, 0.010616696744202212] and parameters: {'n_layers': 2, 'embedding_dim': 128, 'lr': 0.013825847167324911, 'lambda_val': 6.67969903638883e-05, 'batch_size': 2691, 'optimizer': 'RMSprop'}.
2026-06-16 21:53:49,164 - experiment_functions - INFO - Early stopping at epoch 600. Best Metrics: (0.004836847556599746, 0.001132057597574839, 0.003000642061150026)
2026-06-16 21:53:49,256 - optuna.study.study - INFO - Trial 33 finished with values: [0.004836847556599746, 0.001132057597574839, 0.003000642061150026] and parameters: {'n_layers': 1, 'embedding_dim': 96, 'lr': 0.057672097953226774, 'lambda_val': 5.679298487246333e-06, 'batch_size': 3712, 'optimizer': 'RMSprop'}.
2026-06-16 21:54:14,102 - experiment_functions - INFO - Early stopping at epoch 500. Best Metrics: (0.000534284959757735, 0.00011683718580270305, 0.0002889680996497262)
2026-06-16 21:54:14,176 - optuna.study.study - INFO - Trial 34 finished with values: [0.000534284959757735, 0.00011683718580270305, 0.0002889680996497262] and parameters: {'n_layers': 1, 'embedding_dim': 128, 'lr': 0.0010046843330099816, 'lambda_val': 3.828768174841715e-05, 'batch_size': 2929, 'optimizer': 'SGD'}.
2026-06-16 21:54:38,636 - experiment_functions - INFO - Early stopping at epoch 500. Best Metrics: (0.00040512436867708596, 0.00010736390046734874, 0.0002582699683879982)
2026-06-16 21:54:38,731 - optuna.study.study - INFO - Trial 35 finished with values: [0.00040512436867708596, 0.00010736390046734874, 0.0002582699683879982] and parameters: {'n_layers': 1, 'embedding_dim': 96, 'lr': 2.1646935365710128e-05, 'lambda_val': 0.050902508959044905, 'batch_size': 3166, 'optimizer': 'Adam'}.
2026-06-16 21:55:33,141 - experiment_functions - INFO - Early stopping at epoch 1050. Best Metrics: (0.010007881240050708, 0.0020162308955412405, 0.005546907449781958)
2026-06-16 21:55:33,242 - optuna.study.study - INFO - Trial 36 finished with values: [0.010007881240050708, 0.0020162308955412405, 0.005546907449781958] and parameters: {'n_layers': 4, 'embedding_dim': 64, 'lr': 0.011003177343899849, 'lambda_val': 0.00027509354291516515, 'batch_size': 1082, 'optimizer': 'RMSprop'}.
2026-06-16 21:55:58,863 - experiment_functions - INFO - Early stopping at epoch 550. Best Metrics: (0.0006077850720767891, 0.00013420487558418593, 0.00033886926114568526)
2026-06-16 21:55:58,947 - optuna.study.study - INFO - Trial 37 finished with values: [0.0006077850720767891, 0.00013420487558418593, 0.00033886926114568526] and parameters: {'n_layers': 1, 'embedding_dim': 64, 'lr': 1.9751070934316415e-05, 'lambda_val': 3.842979577417267e-06, 'batch_size': 1111, 'optimizer': 'RMSprop'}.
2026-06-16 21:58:15,043 - experiment_functions - INFO - Early stopping at epoch 2950. Best Metrics: (0.00652610312283001, 0.0015378299861058483, 0.003785113650091899)
2026-06-16 21:58:15,134 - optuna.study.study - INFO - Trial 38 finished with values: [0.00652610312283001, 0.0015378299861058483, 0.003785113650091899] and parameters: {'n_layers': 1, 'embedding_dim': 128, 'lr': 0.08401587075016087, 'lambda_val': 0.016599393150384154, 'batch_size': 3464, 'optimizer': 'RMSprop'}.
2026-06-16 22:01:36,632 - optuna.study.study - INFO - Trial 39 finished with values: [0.01893587035818719, 0.003939307818618163, 0.0104546660714175] and parameters: {'n_layers': 2, 'embedding_dim': 128, 'lr': 0.0922388973869132, 'lambda_val': 0.0009072609457664243, 'batch_size': 3466, 'optimizer': 'RMSprop'}.
2026-06-16 22:02:08,493 - experiment_functions - INFO - Early stopping at epoch 600. Best Metrics: (0.0004487744586690375, 9.315397246431729e-05, 0.0002366649978334251)
2026-06-16 22:02:08,574 - optuna.study.study - INFO - Trial 40 finished with values: [0.0004487744586690375, 9.315397246431729e-05, 0.0002366649978334251] and parameters: {'n_layers': 2, 'embedding_dim': 128, 'lr': 1.4687400289827233e-05, 'lambda_val': 0.002557847193997681, 'batch_size': 2585, 'optimizer': 'RMSprop'}.
2026-06-16 22:02:38,549 - experiment_functions - INFO - Early stopping at epoch 550. Best Metrics: (0.011260242909473403, 0.0024409498547429583, 0.006536225073581319)
2026-06-16 22:02:38,643 - optuna.study.study - INFO - Trial 41 finished with values: [0.011260242909473403, 0.0024409498547429583, 0.006536225073581319] and parameters: {'n_layers': 2, 'embedding_dim': 128, 'lr': 0.03496909370828696, 'lambda_val': 2.1239788328621638e-05, 'batch_size': 1398, 'optimizer': 'RMSprop'}.
2026-06-16 22:05:58,130 - optuna.study.study - INFO - Trial 42 finished with values: [0.01925389222559728, 0.00425034735379563, 0.011058726787740322] and parameters: {'n_layers': 4, 'embedding_dim': 64, 'lr': 0.00018562220957177872, 'lambda_val': 2.6858232738417883e-06, 'batch_size': 1265, 'optimizer': 'RMSprop'}.
2026-06-16 22:09:17,241 - optuna.study.study - INFO - Trial 43 finished with values: [0.001112830502926397, 0.00025104206138688894, 0.0006083934942728614] and parameters: {'n_layers': 4, 'embedding_dim': 64, 'lr': 5.177034447951541e-05, 'lambda_val': 0.000640197089155557, 'batch_size': 2744, 'optimizer': 'Adam'}.
2026-06-16 22:09:48,738 - experiment_functions - INFO - Early stopping at epoch 500. Best Metrics: (0.00044528320070590777, 9.946949602122017e-05, 0.00021890153849045857)
2026-06-16 22:09:48,818 - optuna.study.study - INFO - Trial 44 finished with values: [0.00044528320070590777, 9.946949602122017e-05, 0.00021890153849045857] and parameters: {'n_layers': 4, 'embedding_dim': 128, 'lr': 0.0020718555131195226, 'lambda_val': 1.5358648532582137e-05, 'batch_size': 3353, 'optimizer': 'SGD'}.
2026-06-16 22:10:39,670 - experiment_functions - INFO - Early stopping at epoch 1150. Best Metrics: (0.00063885074466831, 0.00014525704180876596, 0.0003116113303860276)
