2026-06-21 09:04:54,479 - optuna.study.study - INFO - Trial 223 finished with values: [0.00864743258349775, 0.0022104332449160036, 0.005224358497038567] and parameters: {'n_layers': 3, 'embedding_dim': 96, 'lr': 0.003914489213662506, 'lambda_val': 1.1500391390523163e-06, 'batch_size': 635, 'optimizer': 'Adam'}.
2026-06-21 09:06:16,018 - experiment_functions - INFO - Early stopping at epoch 2000. Best Metrics: (0.01225717534651103, 0.0030203991410887965, 0.007467078586152388)
2026-06-21 09:06:16,105 - optuna.study.study - INFO - Trial 224 finished with values: [0.01225717534651103, 0.0030203991410887965, 0.007467078586152388] and parameters: {'n_layers': 3, 'embedding_dim': 32, 'lr': 0.0014018982084487695, 'lambda_val': 0.0018148423298626976, 'batch_size': 745, 'optimizer': 'RMSprop'}.
2026-06-21 09:07:09,546 - experiment_functions - INFO - Early stopping at epoch 1000. Best Metrics: (0.008401538904758041, 0.0021346469622331695, 0.004945119079110776)
2026-06-21 09:07:09,636 - optuna.study.study - INFO - Trial 225 finished with values: [0.008401538904758041, 0.0021346469622331695, 0.004945119079110776] and parameters: {'n_layers': 3, 'embedding_dim': 256, 'lr': 0.0012796039326126466, 'lambda_val': 1.0716256733312825e-05, 'batch_size': 2151, 'optimizer': 'RMSprop'}.
2026-06-21 09:07:53,303 - experiment_functions - INFO - Early stopping at epoch 900. Best Metrics: (0.008389880105276758, 0.002174118984463812, 0.00502864538326382)
2026-06-21 09:07:53,391 - optuna.study.study - INFO - Trial 226 finished with values: [0.008389880105276758, 0.002174118984463812, 0.00502864538326382] and parameters: {'n_layers': 4, 'embedding_dim': 128, 'lr': 0.0007452315974278925, 'lambda_val': 0.00937424658892633, 'batch_size': 1493, 'optimizer': 'RMSprop'}.
2026-06-21 09:08:31,653 - experiment_functions - INFO - Early stopping at epoch 900. Best Metrics: (0.009188821575870658, 0.0022562207907035497, 0.00553413353061806)
2026-06-21 09:08:31,740 - optuna.study.study - INFO - Trial 227 finished with values: [0.009188821575870658, 0.0022562207907035497, 0.00553413353061806] and parameters: {'n_layers': 3, 'embedding_dim': 32, 'lr': 0.0038927780539963937, 'lambda_val': 0.0010094181111577557, 'batch_size': 725, 'optimizer': 'Adam'}.
2026-06-21 09:09:29,288 - experiment_functions - INFO - Early stopping at epoch 1350. Best Metrics: (0.008523214265582762, 0.002204117721359101, 0.005390802705073157)
2026-06-21 09:09:29,364 - optuna.study.study - INFO - Trial 228 finished with values: [0.008523214265582762, 0.002204117721359101, 0.005390802705073157] and parameters: {'n_layers': 3, 'embedding_dim': 64, 'lr': 0.0013154801669818224, 'lambda_val': 0.004426133922992275, 'batch_size': 965, 'optimizer': 'Adam'}.
2026-06-21 09:12:12,079 - optuna.study.study - INFO - Trial 229 finished with values: [0.012958100939319244, 0.003239863584691171, 0.0077321716162170925] and parameters: {'n_layers': 4, 'embedding_dim': 32, 'lr': 0.0008519094805065798, 'lambda_val': 1.987631616943749e-06, 'batch_size': 1463, 'optimizer': 'RMSprop'}.
2026-06-21 09:14:11,713 - experiment_functions - INFO - Early stopping at epoch 2900. Best Metrics: (0.0050623048620549345, 0.0012031072375899962, 0.003186611740279961)
2026-06-21 09:14:12,087 - optuna.study.study - INFO - Trial 230 finished with values: [0.0050623048620549345, 0.0012031072375899962, 0.003186611740279961] and parameters: {'n_layers': 1, 'embedding_dim': 128, 'lr': 0.0008519094805065798, 'lambda_val': 0.0004012486090432392, 'batch_size': 2490, 'optimizer': 'RMSprop'}.
2026-06-21 09:17:00,477 - optuna.study.study - INFO - Trial 231 finished with values: [0.009600952056672392, 0.0023730579765062526, 0.006127920650498697] and parameters: {'n_layers': 4, 'embedding_dim': 64, 'lr': 0.0005491151006472304, 'lambda_val': 7.163252275100761e-05, 'batch_size': 635, 'optimizer': 'Adam'}.
2026-06-21 09:19:46,283 - optuna.study.study - INFO - Trial 232 finished with values: [0.012068045394940384, 0.0029019830743968675, 0.007307468444071606] and parameters: {'n_layers': 3, 'embedding_dim': 64, 'lr': 0.0008519094805065798, 'lambda_val': 2.7545357777694106e-05, 'batch_size': 940, 'optimizer': 'RMSprop'}.
2026-06-21 09:20:57,422 - experiment_functions - INFO - Early stopping at epoch 1750. Best Metrics: (0.008130875446454936, 0.002006757610205886, 0.004973510541586371)
2026-06-21 09:20:57,498 - optuna.study.study - INFO - Trial 233 finished with values: [0.008130875446454936, 0.002006757610205886, 0.004973510541586371] and parameters: {'n_layers': 3, 'embedding_dim': 32, 'lr': 0.0013154801669818224, 'lambda_val': 2.362873378234334e-06, 'batch_size': 2666, 'optimizer': 'Adam'}.
2026-06-21 09:22:26,840 - experiment_functions - INFO - Early stopping at epoch 2200. Best Metrics: (0.010923646186910088, 0.0026746242263483645, 0.006686054559640001)
2026-06-21 09:22:26,923 - optuna.study.study - INFO - Trial 234 finished with values: [0.010923646186910088, 0.0026746242263483645, 0.006686054559640001] and parameters: {'n_layers': 3, 'embedding_dim': 32, 'lr': 0.0013154801669818224, 'lambda_val': 1.1500391390523163e-06, 'batch_size': 940, 'optimizer': 'Adam'}.
2026-06-21 09:25:12,975 - optuna.study.study - INFO - Trial 235 finished with values: [0.0103234460845615, 0.002548313755210307, 0.006370483229679695] and parameters: {'n_layers': 3, 'embedding_dim': 64, 'lr': 0.0005491151006472304, 'lambda_val': 0.0012040212538103386, 'batch_size': 1493, 'optimizer': 'RMSprop'}.
2026-06-21 09:26:12,229 - experiment_functions - INFO - Early stopping at epoch 1350. Best Metrics: (0.011079393926853682, 0.0028025135783756477, 0.006916697721149777)
2026-06-21 09:26:12,315 - optuna.study.study - INFO - Trial 236 finished with values: [0.011079393926853682, 0.0028025135783756477, 0.006916697721149777] and parameters: {'n_layers': 4, 'embedding_dim': 64, 'lr': 0.0008519094805065798, 'lambda_val': 7.163252275100761e-05, 'batch_size': 2490, 'optimizer': 'RMSprop'}.
2026-06-21 09:27:06,524 - experiment_functions - INFO - Early stopping at epoch 1250. Best Metrics: (0.011346798699831748, 0.0028593532903877735, 0.006953031674715823)
2026-06-21 09:27:06,604 - optuna.study.study - INFO - Trial 237 finished with values: [0.011346798699831748, 0.0028593532903877735, 0.006953031674715823] and parameters: {'n_layers': 3, 'embedding_dim': 64, 'lr': 0.0014018982084487695, 'lambda_val': 0.0018148423298626976, 'batch_size': 745, 'optimizer': 'RMSprop'}.
2026-06-21 09:27:28,652 - experiment_functions - INFO - Early stopping at epoch 500. Best Metrics: (0.000504295431795993, 0.00011841606669192877, 0.0002555010465460163)
2026-06-21 09:27:28,744 - optuna.study.study - INFO - Trial 238 finished with values: [0.000504295431795993, 0.00011841606669192877, 0.0002555010465460163] and parameters: {'n_layers': 4, 'embedding_dim': 32, 'lr': 0.0005652967261337897, 'lambda_val': 1.1500391390523163e-06, 'batch_size': 635, 'optimizer': 'SGD'}.
2026-06-21 09:29:26,381 - experiment_functions - INFO - Early stopping at epoch 2750. Best Metrics: (0.010949942722138175, 0.00276462043703423, 0.006652801229084403)
2026-06-21 09:29:26,466 - optuna.study.study - INFO - Trial 239 finished with values: [0.010949942722138175, 0.00276462043703423, 0.006652801229084403] and parameters: {'n_layers': 4, 'embedding_dim': 64, 'lr': 0.0007452315974278925, 'lambda_val': 2.2595071410094373e-06, 'batch_size': 1493, 'optimizer': 'Adam'}.
2026-06-21 09:30:10,626 - experiment_functions - INFO - Early stopping at epoch 1000. Best Metrics: (0.008076336956688508, 0.0020209675382089174, 0.004937906876377139)
2026-06-21 09:30:10,703 - optuna.study.study - INFO - Trial 240 finished with values: [0.008076336956688508, 0.0020209675382089174, 0.004937906876377139] and parameters: {'n_layers': 3, 'embedding_dim': 64, 'lr': 0.0018169040651244567, 'lambda_val': 5.103203231486004e-06, 'batch_size': 2490, 'optimizer': 'Adam'}.
2026-06-21 09:31:21,877 - experiment_functions - INFO - Early stopping at epoch 1700. Best Metrics: (0.01189024843969759, 0.0028830365037261587, 0.007271701246426375)
2026-06-21 09:31:21,964 - optuna.study.study - INFO - Trial 241 finished with values: [0.01189024843969759, 0.0028830365037261587, 0.007271701246426375] and parameters: {'n_layers': 4, 'embedding_dim': 32, 'lr': 0.0018169040651244567, 'lambda_val': 5.103203231486004e-06, 'batch_size': 635, 'optimizer': 'Adam'}.
2026-06-21 09:34:04,815 - optuna.study.study - INFO - Trial 242 finished with values: [0.009018561257519675, 0.002230958696475938, 0.005518270050529288] and parameters: {'n_layers': 4, 'embedding_dim': 32, 'lr': 0.0004317731637144049, 'lambda_val': 0.0016838745075427083, 'batch_size': 1493, 'optimizer': 'RMSprop'}.
2026-06-21 09:36:18,653 - experiment_functions - INFO - Early stopping at epoch 3100. Best Metrics: (0.011107352387478077, 0.0027535682708096504, 0.006851541688893406)
2026-06-21 09:36:18,750 - optuna.study.study - INFO - Trial 243 finished with values: [0.011107352387478077, 0.0027535682708096504, 0.006851541688893406] and parameters: {'n_layers': 4, 'embedding_dim': 64, 'lr': 0.0005491151006472304, 'lambda_val': 0.0013171013233585188, 'batch_size': 2490, 'optimizer': 'RMSprop'}.
2026-06-21 09:36:57,375 - experiment_functions - INFO - Early stopping at epoch 850. Best Metrics: (0.012129692451834663, 0.0029209296450675762, 0.007237939987056134)
2026-06-21 09:36:57,459 - optuna.study.study - INFO - Trial 244 finished with values: [0.012129692451834663, 0.0029209296450675762, 0.007237939987056134] and parameters: {'n_layers': 4, 'embedding_dim': 64, 'lr': 0.002375796180711879, 'lambda_val': 1.1500391390523163e-06, 'batch_size': 857, 'optimizer': 'RMSprop'}.
2026-06-21 09:37:39,618 - experiment_functions - INFO - Early stopping at epoch 900. Best Metrics: (0.010064445354219772, 0.0025167361374257933, 0.006118387071430472)
2026-06-21 09:37:39,707 - optuna.study.study - INFO - Trial 245 finished with values: [0.010064445354219772, 0.0025167361374257933, 0.006118387071430472] and parameters: {'n_layers': 4, 'embedding_dim': 96, 'lr': 0.0012796039326126466, 'lambda_val': 7.163252275100761e-05, 'batch_size': 2490, 'optimizer': 'RMSprop'}.
2026-06-21 09:38:02,953 - experiment_functions - INFO - Early stopping at epoch 500. Best Metrics: (0.0006009151402038121, 0.0001231527093596059, 0.000331373611704111)
2026-06-21 09:38:03,041 - optuna.study.study - INFO - Trial 246 finished with values: [0.0006009151402038121, 0.0001231527093596059, 0.000331373611704111] and parameters: {'n_layers': 3, 'embedding_dim': 96, 'lr': 0.0004317731637144049, 'lambda_val': 0.00015518968594442707, 'batch_size': 1493, 'optimizer': 'SGD'}.
2026-06-21 09:40:50,365 - optuna.study.study - INFO - Trial 247 finished with values: [0.009755946263116473, 0.002392004547176961, 0.005941609761716332] and parameters: {'n_layers': 3, 'embedding_dim': 64, 'lr': 0.0005491151006472304, 'lambda_val': 2.8562288796614426e-05, 'batch_size': 1309, 'optimizer': 'RMSprop'}.
2026-06-21 09:42:38,311 - experiment_functions - INFO - Early stopping at epoch 2400. Best Metrics: (0.009094748110569099, 0.002262536314260452, 0.005615756458054469)
2026-06-21 09:42:38,397 - optuna.study.study - INFO - Trial 248 finished with values: [0.009094748110569099, 0.002262536314260452, 0.005615756458054469] and parameters: {'n_layers': 3, 'embedding_dim': 128, 'lr': 0.0008519094805065798, 'lambda_val': 0.0012040212538103386, 'batch_size': 1024, 'optimizer': 'Adam'}.
2026-06-21 09:44:37,938 - experiment_functions - INFO - Early stopping at epoch 2850. Best Metrics: (0.010300372495813757, 0.0025735758494379183, 0.006351989637829002)
2026-06-21 09:44:38,066 - optuna.study.study - INFO - Trial 249 finished with values: [0.010300372495813757, 0.0025735758494379183, 0.006351989637829002] and parameters: {'n_layers': 3, 'embedding_dim': 64, 'lr': 0.0014018982084487695, 'lambda_val': 2.2595071410094373e-06, 'batch_size': 745, 'optimizer': 'Adam'}.
2026-06-21 09:45:44,690 - experiment_functions - INFO - Early stopping at epoch 1550. Best Metrics: (0.012355824412251143, 0.0031088164708854365, 0.00786447877606813)
2026-06-21 09:45:44,779 - optuna.study.study - INFO - Trial 250 finished with values: [0.012355824412251143, 0.0031088164708854365, 0.00786447877606813] and parameters: {'n_layers': 3, 'embedding_dim': 64, 'lr': 0.0014018982084487695, 'lambda_val': 2.3899541844820115e-06, 'batch_size': 857, 'optimizer': 'RMSprop'}.
2026-06-21 09:46:08,986 - experiment_functions - INFO - Early stopping at epoch 550. Best Metrics: (0.00532877718741438, 0.001310471138057345, 0.003366284298252478)
2026-06-21 09:46:09,086 - optuna.study.study - INFO - Trial 251 finished with values: [0.00532877718741438, 0.001310471138057345, 0.003366284298252478] and parameters: {'n_layers': 4, 'embedding_dim': 32, 'lr': 0.03186636309445677, 'lambda_val': 1.1500391390523163e-06, 'batch_size': 635, 'optimizer': 'Adam'}.
2026-06-21 09:47:13,787 - experiment_functions - INFO - Early stopping at epoch 1550. Best Metrics: (0.011378690136164481, 0.002767778198812682, 0.0070089028355940115)
2026-06-21 09:47:13,856 - optuna.study.study - INFO - Trial 252 finished with values: [0.011378690136164481, 0.002767778198812682, 0.0070089028355940115] and parameters: {'n_layers': 4, 'embedding_dim': 32, 'lr': 0.0014018982084487695, 'lambda_val': 2.8562288796614426e-05, 'batch_size': 1309, 'optimizer': 'Adam'}.
2026-06-21 09:49:51,147 - optuna.study.study - INFO - Trial 253 finished with values: [0.000862991826540209, 0.00021946444360237464, 0.0005033909314474275] and parameters: {'n_layers': 3, 'embedding_dim': 32, 'lr': 0.00020169357330941084, 'lambda_val': 0.00014663987570749128, 'batch_size': 635, 'optimizer': 'RMSprop'}.
2026-06-21 09:52:34,443 - optuna.study.study - INFO - Trial 254 finished with values: [0.011586162603662482, 0.00278672476948339, 0.007021573437918273] and parameters: {'n_layers': 4, 'embedding_dim': 32, 'lr': 0.0007452315974278925, 'lambda_val': 1.987631616943749e-06, 'batch_size': 1463, 'optimizer': 'Adam'}.
2026-06-21 09:55:10,775 - experiment_functions - INFO - Early stopping at epoch 3650. Best Metrics: (0.01176148933825355, 0.0029793482379689277, 0.007198390047181259)
2026-06-21 09:55:10,853 - optuna.study.study - INFO - Trial 255 finished with values: [0.01176148933825355, 0.0029793482379689277, 0.007198390047181259] and parameters: {'n_layers': 4, 'embedding_dim': 64, 'lr': 0.0008519094805065798, 'lambda_val': 1.1500391390523163e-06, 'batch_size': 996, 'optimizer': 'Adam'}.
2026-06-21 09:57:53,767 - experiment_functions - INFO - Early stopping at epoch 3800. Best Metrics: (0.010180084030845504, 0.002611468990779336, 0.006170861214176105)
2026-06-21 09:57:53,853 - optuna.study.study - INFO - Trial 256 finished with values: [0.010180084030845504, 0.002611468990779336, 0.006170861214176105] and parameters: {'n_layers': 4, 'embedding_dim': 64, 'lr': 0.0005491151006472304, 'lambda_val': 7.163252275100761e-05, 'batch_size': 2490, 'optimizer': 'Adam'}.
2026-06-21 10:00:37,930 - optuna.study.study - INFO - Trial 257 finished with values: [0.011708495340786216, 0.0028751420992800306, 0.0072068417307122185] and parameters: {'n_layers': 4, 'embedding_dim': 32, 'lr': 0.0008519094805065798, 'lambda_val': 0.0016838745075427083, 'batch_size': 857, 'optimizer': 'Adam'}.
2026-06-21 10:02:23,869 - experiment_functions - INFO - Early stopping at epoch 2500. Best Metrics: (0.0005991900435998531, 0.00014841480358721742, 0.00036436778691138565)
2026-06-21 10:02:23,947 - optuna.study.study - INFO - Trial 258 finished with values: [0.0005991900435998531, 0.00014841480358721742, 0.00036436778691138565] and parameters: {'n_layers': 4, 'embedding_dim': 64, 'lr': 3.962296325269711e-05, 'lambda_val': 1.1500391390523163e-06, 'batch_size': 940, 'optimizer': 'RMSprop'}.
2026-06-21 10:03:00,385 - experiment_functions - INFO - Early stopping at epoch 800. Best Metrics: (0.010168744982474795, 0.0025498926360995326, 0.006047889661194209)
2026-06-21 10:03:00,461 - optuna.study.study - INFO - Trial 259 finished with values: [0.010168744982474795, 0.0025498926360995326, 0.006047889661194209] and parameters: {'n_layers': 4, 'embedding_dim': 64, 'lr': 0.0016245784699905617, 'lambda_val': 7.163252275100761e-05, 'batch_size': 2490, 'optimizer': 'RMSprop'}.
2026-06-21 10:05:06,304 - experiment_functions - INFO - Early stopping at epoch 3100. Best Metrics: (0.011981233746463267, 0.0030693444486547938, 0.0074245954881615355)
2026-06-21 10:05:06,392 - optuna.study.study - INFO - Trial 260 finished with values: [0.011981233746463267, 0.0030693444486547938, 0.0074245954881615355] and parameters: {'n_layers': 4, 'embedding_dim': 32, 'lr': 0.0013154801669818224, 'lambda_val': 1.1500391390523163e-06, 'batch_size': 635, 'optimizer': 'Adam'}.
2026-06-21 10:06:47,444 - experiment_functions - INFO - Early stopping at epoch 2200. Best Metrics: (0.0005614803585623858, 0.0001294682329165088, 0.0002952388101008369)
2026-06-21 10:06:47,545 - optuna.study.study - INFO - Trial 261 finished with values: [0.0005614803585623858, 0.0001294682329165088, 0.0002952388101008369] and parameters: {'n_layers': 4, 'embedding_dim': 128, 'lr': 2.5678151788992705e-05, 'lambda_val': 0.0012040212538103386, 'batch_size': 1024, 'optimizer': 'RMSprop'}.
2026-06-21 10:09:30,948 - experiment_functions - INFO - Early stopping at epoch 3950. Best Metrics: (0.0005849676247010511, 0.0001405203991410888, 0.00032096610092119485)
2026-06-21 10:09:31,030 - optuna.study.study - INFO - Trial 262 finished with values: [0.0005849676247010511, 0.0001405203991410888, 0.00032096610092119485] and parameters: {'n_layers': 4, 'embedding_dim': 64, 'lr': 8.883372168999434e-05, 'lambda_val': 0.0018148423298626976, 'batch_size': 745, 'optimizer': 'RMSprop'}.
2026-06-21 10:10:20,543 - experiment_functions - INFO - Early stopping at epoch 1150. Best Metrics: (0.010460693114031885, 0.00259883794366553, 0.006542650872161173)
2026-06-21 10:10:20,618 - optuna.study.study - INFO - Trial 263 finished with values: [0.010460693114031885, 0.00259883794366553, 0.006542650872161173] and parameters: {'n_layers': 3, 'embedding_dim': 64, 'lr': 0.0014018982084487695, 'lambda_val': 0.0012040212538103386, 'batch_size': 1024, 'optimizer': 'RMSprop'}.
2026-06-21 10:11:07,832 - experiment_functions - INFO - Early stopping at epoch 1100. Best Metrics: (0.00939304309565582, 0.002425161045850701, 0.005778121911877521)
2026-06-21 10:11:07,954 - optuna.study.study - INFO - Trial 264 finished with values: [0.00939304309565582, 0.002425161045850701, 0.005778121911877521] and parameters: {'n_layers': 3, 'embedding_dim': 64, 'lr': 0.0014018982084487695, 'lambda_val': 0.0016838745075427083, 'batch_size': 1674, 'optimizer': 'RMSprop'}.
2026-06-21 10:14:05,065 - optuna.study.study - INFO - Trial 265 finished with values: [0.011523749905654098, 0.0028735632183908046, 0.007031228322247352] and parameters: {'n_layers': 4, 'embedding_dim': 96, 'lr': 0.0006846375729719407, 'lambda_val': 2.8562288796614426e-05, 'batch_size': 857, 'optimizer': 'Adam'}.
2026-06-21 10:15:59,566 - experiment_functions - INFO - Early stopping at epoch 2750. Best Metrics: (0.011902282745456457, 0.0029051408361753187, 0.0072812699525252374)
2026-06-21 10:15:59,635 - optuna.study.study - INFO - Trial 266 finished with values: [0.011902282745456457, 0.0029051408361753187, 0.0072812699525252374] and parameters: {'n_layers': 3, 'embedding_dim': 64, 'lr': 0.0008519094805065798, 'lambda_val': 0.0011946849370214323, 'batch_size': 940, 'optimizer': 'RMSprop'}.
2026-06-21 10:17:40,556 - experiment_functions - INFO - Early stopping at epoch 2500. Best Metrics: (0.005147993323197651, 0.001222053808260705, 0.0031378614985204814)
2026-06-21 10:17:40,638 - optuna.study.study - INFO - Trial 267 finished with values: [0.005147993323197651, 0.001222053808260705, 0.0031378614985204814] and parameters: {'n_layers': 1, 'embedding_dim': 96, 'lr': 0.0014018982084487695, 'lambda_val': 0.0018148423298626976, 'batch_size': 745, 'optimizer': 'RMSprop'}.
2026-06-21 10:18:28,564 - experiment_functions - INFO - Early stopping at epoch 1150. Best Metrics: (0.009299891939333994, 0.002365163572060124, 0.00576372334863316)
2026-06-21 10:18:28,646 - optuna.study.study - INFO - Trial 268 finished with values: [0.009299891939333994, 0.002365163572060124, 0.00576372334863316] and parameters: {'n_layers': 3, 'embedding_dim': 32, 'lr': 0.0014018982084487695, 'lambda_val': 0.0013171013233585188, 'batch_size': 2490, 'optimizer': 'RMSprop'}.
2026-06-21 10:19:36,711 - experiment_functions - INFO - Early stopping at epoch 1550. Best Metrics: (0.012198174818177988, 0.002965138309965896, 0.007389684053885133)
2026-06-21 10:19:36,781 - optuna.study.study - INFO - Trial 269 finished with values: [0.012198174818177988, 0.002965138309965896, 0.007389684053885133] and parameters: {'n_layers': 3, 'embedding_dim': 96, 'lr': 0.0014018982084487695, 'lambda_val': 1.1500391390523163e-06, 'batch_size': 745, 'optimizer': 'RMSprop'}.
2026-06-21 10:20:10,553 - experiment_functions - INFO - Early stopping at epoch 750. Best Metrics: (0.009585562674998398, 0.002423582164961475, 0.005721948285778249)
2026-06-21 10:20:10,653 - optuna.study.study - INFO - Trial 270 finished with values: [0.009585562674998398, 0.002423582164961475, 0.005721948285778249] and parameters: {'n_layers': 4, 'embedding_dim': 64, 'lr': 0.002375796180711879, 'lambda_val': 2.7219727118150136e-06, 'batch_size': 1495, 'optimizer': 'RMSprop'}.
2026-06-21 10:23:00,149 - optuna.study.study - INFO - Trial 271 finished with values: [0.014053177693827048, 0.003451433623847417, 0.008519214971748566] and parameters: {'n_layers': 4, 'embedding_dim': 64, 'lr': 0.0008519094805065798, 'lambda_val': 2.2595071410094373e-06, 'batch_size': 857, 'optimizer': 'RMSprop'}.
2026-06-21 10:24:14,047 - experiment_functions - INFO - Early stopping at epoch 1850. Best Metrics: (0.000504918023671756, 0.00012631047113805733, 0.00027592116162776905)
