2026-06-18 19:51:27,922 - optuna.study.study - INFO - Trial 142 finished with values: [0.02487472330056899, 0.0056287103700896806, 0.014244796782946193] and parameters: {'n_layers': 1, 'embedding_dim': 96, 'lr': 0.0010467544958961223, 'lambda_val': 0.00988731074821415, 'batch_size': 1193, 'optimizer': 'Adam'}.
2026-06-18 19:52:26,915 - experiment_functions - INFO - Early stopping at epoch 1300. Best Metrics: (0.018692260714773153, 0.004146141215106732, 0.010420982827611598)
2026-06-18 19:52:26,994 - optuna.study.study - INFO - Trial 143 finished with values: [0.018692260714773153, 0.004146141215106732, 0.010420982827611598] and parameters: {'n_layers': 1, 'embedding_dim': 128, 'lr': 0.0010467544958961223, 'lambda_val': 0.026718097719612678, 'batch_size': 3235, 'optimizer': 'Adam'}.
2026-06-18 19:52:51,575 - experiment_functions - INFO - Early stopping at epoch 500. Best Metrics: (0.0005095689769149742, 0.00010736390046734875, 0.0002976543923000352)
2026-06-18 19:52:51,665 - optuna.study.study - INFO - Trial 144 finished with values: [0.0005095689769149742, 0.00010736390046734875, 0.0002976543923000352] and parameters: {'n_layers': 4, 'embedding_dim': 64, 'lr': 0.0007183006551542105, 'lambda_val': 4.521426485432383e-06, 'batch_size': 2797, 'optimizer': 'SGD'}.
2026-06-18 19:53:30,748 - experiment_functions - INFO - Early stopping at epoch 800. Best Metrics: (0.006575895714885555, 0.001405203991410888, 0.0035515027996191185)
2026-06-18 19:53:31,102 - optuna.study.study - INFO - Trial 145 finished with values: [0.006575895714885555, 0.001405203991410888, 0.0035515027996191185] and parameters: {'n_layers': 2, 'embedding_dim': 128, 'lr': 0.007905785553771548, 'lambda_val': 0.021319554778567253, 'batch_size': 3911, 'optimizer': 'Adam'}.
2026-06-18 19:57:32,849 - optuna.study.study - INFO - Trial 146 finished with values: [0.024536635776308442, 0.005336617405582923, 0.01379431312445992] and parameters: {'n_layers': 3, 'embedding_dim': 256, 'lr': 0.0001408506946893725, 'lambda_val': 9.959964188496882e-05, 'batch_size': 4089, 'optimizer': 'Adam'}.
2026-06-18 19:58:02,181 - experiment_functions - INFO - Early stopping at epoch 600. Best Metrics: (0.026871226582633072, 0.005497663256283946, 0.01513572407363895)
2026-06-18 19:58:02,279 - optuna.study.study - INFO - Trial 147 finished with values: [0.026871226582633072, 0.005497663256283946, 0.01513572407363895] and parameters: {'n_layers': 2, 'embedding_dim': 96, 'lr': 0.0022436517643766684, 'lambda_val': 5.316198242532503e-06, 'batch_size': 2254, 'optimizer': 'Adam'}.
2026-06-18 19:59:24,954 - experiment_functions - INFO - Early stopping at epoch 1550. Best Metrics: (0.02370475777554047, 0.0053034609069091835, 0.013684372178176057)
2026-06-18 19:59:25,030 - optuna.study.study - INFO - Trial 148 finished with values: [0.02370475777554047, 0.0053034609069091835, 0.013684372178176057] and parameters: {'n_layers': 4, 'embedding_dim': 128, 'lr': 0.00022471387800597823, 'lambda_val': 0.0008936724688910117, 'batch_size': 1703, 'optimizer': 'RMSprop'}.
2026-06-18 20:00:01,124 - experiment_functions - INFO - Early stopping at epoch 550. Best Metrics: (0.018550229742821337, 0.0038382594417077174, 0.010283846519014962)
2026-06-18 20:00:01,393 - optuna.study.study - INFO - Trial 149 finished with values: [0.018550229742821337, 0.0038382594417077174, 0.010283846519014962] and parameters: {'n_layers': 3, 'embedding_dim': 256, 'lr': 0.0013165446315188843, 'lambda_val': 2.029370111875682e-06, 'batch_size': 4089, 'optimizer': 'RMSprop'}.
2026-06-18 20:02:32,525 - experiment_functions - INFO - Early stopping at epoch 3050. Best Metrics: (0.03287942980200397, 0.006913919413919415, 0.018804329838444756)
2026-06-18 20:02:32,613 - optuna.study.study - INFO - Trial 150 finished with values: [0.03287942980200397, 0.006913919413919415, 0.018804329838444756] and parameters: {'n_layers': 1, 'embedding_dim': 256, 'lr': 0.0005592470013695373, 'lambda_val': 1.288405727605743e-06, 'batch_size': 2931, 'optimizer': 'RMSprop'}.
2026-06-18 20:05:56,076 - optuna.study.study - INFO - Trial 151 finished with values: [0.012731928217575274, 0.0029256662877352535, 0.0072879465096880695] and parameters: {'n_layers': 3, 'embedding_dim': 128, 'lr': 8.415032400758605e-05, 'lambda_val': 5.316198242532503e-06, 'batch_size': 3512, 'optimizer': 'Adam'}.
2026-06-18 20:06:25,006 - experiment_functions - INFO - Early stopping at epoch 550. Best Metrics: (0.016558363985698595, 0.0035161677403056715, 0.008976624403507038)
2026-06-18 20:06:25,335 - optuna.study.study - INFO - Trial 152 finished with values: [0.016558363985698595, 0.0035161677403056715, 0.008976624403507038] and parameters: {'n_layers': 2, 'embedding_dim': 128, 'lr': 0.02789750841719613, 'lambda_val': 8.320422535259038e-06, 'batch_size': 2220, 'optimizer': 'Adam'}.
2026-06-18 20:07:06,918 - experiment_functions - INFO - Early stopping at epoch 800. Best Metrics: (0.02221888612464232, 0.004880320828596691, 0.012272824592049966)
2026-06-18 20:07:06,999 - optuna.study.study - INFO - Trial 153 finished with values: [0.02221888612464232, 0.004880320828596691, 0.012272824592049966] and parameters: {'n_layers': 2, 'embedding_dim': 128, 'lr': 0.00039950195617414347, 'lambda_val': 0.005511595896572553, 'batch_size': 3911, 'optimizer': 'RMSprop'}.
2026-06-18 20:08:14,562 - experiment_functions - INFO - Early stopping at epoch 1050. Best Metrics: (0.023312699298692115, 0.0050745231779714545, 0.013396087823138945)
2026-06-18 20:08:14,667 - optuna.study.study - INFO - Trial 154 finished with values: [0.023312699298692115, 0.0050745231779714545, 0.013396087823138945] and parameters: {'n_layers': 3, 'embedding_dim': 256, 'lr': 0.00039950195617414347, 'lambda_val': 5.316198242532503e-06, 'batch_size': 2254, 'optimizer': 'RMSprop'}.
2026-06-18 20:09:03,556 - experiment_functions - INFO - Early stopping at epoch 900. Best Metrics: (0.02208949307847916, 0.0048582164961475304, 0.012479554379572905)
2026-06-18 20:09:03,690 - optuna.study.study - INFO - Trial 155 finished with values: [0.02208949307847916, 0.0048582164961475304, 0.012479554379572905] and parameters: {'n_layers': 3, 'embedding_dim': 128, 'lr': 0.00043946320757285703, 'lambda_val': 0.001270364796526946, 'batch_size': 3911, 'optimizer': 'Adam'}.
2026-06-18 20:09:50,907 - experiment_functions - INFO - Early stopping at epoch 1000. Best Metrics: (0.026139617375217927, 0.005669761273209549, 0.015122338988718217)
2026-06-18 20:09:50,998 - optuna.study.study - INFO - Trial 156 finished with values: [0.026139617375217927, 0.005669761273209549, 0.015122338988718217] and parameters: {'n_layers': 2, 'embedding_dim': 64, 'lr': 0.0004856174201898278, 'lambda_val': 0.0022646831590701676, 'batch_size': 3911, 'optimizer': 'Adam'}.
2026-06-18 20:10:23,057 - experiment_functions - INFO - Early stopping at epoch 650. Best Metrics: (0.0004943927230595982, 0.0001136794240242516, 0.00030286631381094516)
2026-06-18 20:10:23,142 - optuna.study.study - INFO - Trial 157 finished with values: [0.0004943927230595982, 0.0001136794240242516, 0.00030286631381094516] and parameters: {'n_layers': 2, 'embedding_dim': 96, 'lr': 2.0202822738854537e-05, 'lambda_val': 0.00015514348570178205, 'batch_size': 991, 'optimizer': 'RMSprop'}.
2026-06-18 20:10:50,028 - experiment_functions - INFO - Early stopping at epoch 550. Best Metrics: (0.0005611592433885773, 0.0001373626373626374, 0.00033152230172479023)
2026-06-18 20:10:50,162 - optuna.study.study - INFO - Trial 158 finished with values: [0.0005611592433885773, 0.0001373626373626374, 0.00033152230172479023] and parameters: {'n_layers': 2, 'embedding_dim': 96, 'lr': 4.357196531383252e-05, 'lambda_val': 4.521426485432383e-06, 'batch_size': 647, 'optimizer': 'RMSprop'}.
2026-06-18 20:11:30,955 - experiment_functions - INFO - Early stopping at epoch 850. Best Metrics: (0.02386953062120482, 0.004994000252620943, 0.013471472101667993)
2026-06-18 20:11:31,241 - optuna.study.study - INFO - Trial 159 finished with values: [0.02386953062120482, 0.004994000252620943, 0.013471472101667993] and parameters: {'n_layers': 2, 'embedding_dim': 96, 'lr': 0.0007183006551542105, 'lambda_val': 0.0008936724688910117, 'batch_size': 991, 'optimizer': 'RMSprop'}.
2026-06-18 20:13:18,292 - experiment_functions - INFO - Early stopping at epoch 1950. Best Metrics: (0.023729921882293815, 0.005311355311355312, 0.01349200120443494)
2026-06-18 20:13:18,371 - optuna.study.study - INFO - Trial 160 finished with values: [0.023729921882293815, 0.005311355311355312, 0.01349200120443494] and parameters: {'n_layers': 4, 'embedding_dim': 128, 'lr': 0.00022471387800597823, 'lambda_val': 0.0008936724688910117, 'batch_size': 1703, 'optimizer': 'RMSprop'}.
2026-06-18 20:14:10,392 - experiment_functions - INFO - Early stopping at epoch 800. Best Metrics: (0.02362542659528191, 0.005063471011746873, 0.013428809169268826)
2026-06-18 20:14:10,463 - optuna.study.study - INFO - Trial 161 finished with values: [0.02362542659528191, 0.005063471011746873, 0.013428809169268826] and parameters: {'n_layers': 3, 'embedding_dim': 256, 'lr': 0.0007183006551542105, 'lambda_val': 4.115717615485875e-05, 'batch_size': 2220, 'optimizer': 'Adam'}.
2026-06-18 20:14:45,478 - experiment_functions - INFO - Early stopping at epoch 700. Best Metrics: (0.0305897003724402, 0.006591827712517368, 0.017807742699966645)
2026-06-18 20:14:45,825 - optuna.study.study - INFO - Trial 162 finished with values: [0.0305897003724402, 0.006591827712517368, 0.017807742699966645] and parameters: {'n_layers': 1, 'embedding_dim': 128, 'lr': 0.001993370802391186, 'lambda_val': 4.735122359256782e-06, 'batch_size': 3516, 'optimizer': 'Adam'}.
2026-06-18 20:15:23,482 - experiment_functions - INFO - Early stopping at epoch 750. Best Metrics: (0.021593131890259756, 0.004733484905898699, 0.012270774258919264)
2026-06-18 20:15:23,569 - optuna.study.study - INFO - Trial 163 finished with values: [0.021593131890259756, 0.004733484905898699, 0.012270774258919264] and parameters: {'n_layers': 2, 'embedding_dim': 128, 'lr': 0.0004856174201898278, 'lambda_val': 0.004505589428166237, 'batch_size': 3012, 'optimizer': 'RMSprop'}.
2026-06-18 20:17:32,220 - experiment_functions - INFO - Early stopping at epoch 2500. Best Metrics: (0.02561900714622401, 0.005388720474927371, 0.014327512902908447)
2026-06-18 20:17:32,313 - optuna.study.study - INFO - Trial 164 finished with values: [0.02561900714622401, 0.005388720474927371, 0.014327512902908447] and parameters: {'n_layers': 3, 'embedding_dim': 128, 'lr': 0.00039950195617414347, 'lambda_val': 5.316198242532503e-06, 'batch_size': 2747, 'optimizer': 'Adam'}.
2026-06-18 20:17:54,228 - experiment_functions - INFO - Early stopping at epoch 500. Best Metrics: (0.0005595419958200913, 0.00012788935202728306, 0.0002970340055159377)
2026-06-18 20:17:54,304 - optuna.study.study - INFO - Trial 165 finished with values: [0.0005595419958200913, 0.00012788935202728306, 0.0002970340055159377] and parameters: {'n_layers': 1, 'embedding_dim': 32, 'lr': 0.0004856174201898278, 'lambda_val': 0.0002910356555415511, 'batch_size': 2931, 'optimizer': 'SGD'}.
2026-06-18 20:18:48,065 - experiment_functions - INFO - Early stopping at epoch 1200. Best Metrics: (0.028746298982562153, 0.006200265251989389, 0.01639993765810637)
2026-06-18 20:18:48,139 - optuna.study.study - INFO - Trial 166 finished with values: [0.028746298982562153, 0.006200265251989389, 0.01639993765810637] and parameters: {'n_layers': 1, 'embedding_dim': 96, 'lr': 0.0010029417148474076, 'lambda_val': 4.521426485432383e-06, 'batch_size': 2689, 'optimizer': 'RMSprop'}.
2026-06-18 20:21:36,963 - optuna.study.study - INFO - Trial 167 finished with values: [0.023469704485462158, 0.005245042314007832, 0.013504502711248093] and parameters: {'n_layers': 2, 'embedding_dim': 32, 'lr': 0.00022471387800597823, 'lambda_val': 5.40537951544282e-06, 'batch_size': 3012, 'optimizer': 'Adam'}.
2026-06-18 20:22:29,365 - experiment_functions - INFO - Early stopping at epoch 1100. Best Metrics: (0.022529586776786056, 0.00493242389794114, 0.012481797282261562)
2026-06-18 20:22:29,938 - optuna.study.study - INFO - Trial 168 finished with values: [0.022529586776786056, 0.00493242389794114, 0.012481797282261562] and parameters: {'n_layers': 4, 'embedding_dim': 64, 'lr': 0.0004856174201898278, 'lambda_val': 4.115717615485875e-05, 'batch_size': 3300, 'optimizer': 'Adam'}.
2026-06-18 20:23:04,532 - experiment_functions - INFO - Early stopping at epoch 500. Best Metrics: (0.0025902455064426206, 0.0007326007326007326, 0.0017515397469153168)
2026-06-18 20:23:04,913 - optuna.study.study - INFO - Trial 169 finished with values: [0.0025902455064426206, 0.0007326007326007326, 0.0017515397469153168] and parameters: {'n_layers': 4, 'embedding_dim': 256, 'lr': 0.06804024274551856, 'lambda_val': 0.00988731074821415, 'batch_size': 2931, 'optimizer': 'Adam'}.
2026-06-18 20:23:34,102 - experiment_functions - INFO - Early stopping at epoch 600. Best Metrics: (0.026779263825399295, 0.005603448275862071, 0.014928200357828438)
2026-06-18 20:23:34,232 - optuna.study.study - INFO - Trial 170 finished with values: [0.026779263825399295, 0.005603448275862071, 0.014928200357828438] and parameters: {'n_layers': 2, 'embedding_dim': 96, 'lr': 0.001993370802391186, 'lambda_val': 0.0005943254859344516, 'batch_size': 3608, 'optimizer': 'Adam'}.
2026-06-18 20:24:03,727 - experiment_functions - INFO - Early stopping at epoch 550. Best Metrics: (0.000549744164398255, 0.00012157382847038021, 0.0002959243431815176)
2026-06-18 20:24:03,828 - optuna.study.study - INFO - Trial 171 finished with values: [0.000549744164398255, 0.00012157382847038021, 0.0002959243431815176] and parameters: {'n_layers': 1, 'embedding_dim': 64, 'lr': 1.0612913430153648e-05, 'lambda_val': 1.2929761938228365e-06, 'batch_size': 1453, 'optimizer': 'Adam'}.
2026-06-18 20:24:26,951 - experiment_functions - INFO - Early stopping at epoch 500. Best Metrics: (0.0005834615782032098, 0.0001310471138057345, 0.00030462144338320893)
2026-06-18 20:24:27,090 - optuna.study.study - INFO - Trial 172 finished with values: [0.0005834615782032098, 0.0001310471138057345, 0.00030462144338320893] and parameters: {'n_layers': 1, 'embedding_dim': 128, 'lr': 0.0001674019248092106, 'lambda_val': 0.0005943254859344516, 'batch_size': 1703, 'optimizer': 'SGD'}.
2026-06-18 20:25:18,256 - experiment_functions - INFO - Early stopping at epoch 1050. Best Metrics: (0.024103967090306374, 0.005227674624226348, 0.013499864299734658)
2026-06-18 20:25:18,345 - optuna.study.study - INFO - Trial 173 finished with values: [0.024103967090306374, 0.005227674624226348, 0.013499864299734658] and parameters: {'n_layers': 3, 'embedding_dim': 64, 'lr': 0.0004856174201898278, 'lambda_val': 4.115717615485875e-05, 'batch_size': 3300, 'optimizer': 'Adam'}.
2026-06-18 20:25:41,276 - experiment_functions - INFO - Early stopping at epoch 500. Best Metrics: (0.0005471384786559052, 0.00012473159024883166, 0.0002963500943196586)
2026-06-18 20:25:41,345 - optuna.study.study - INFO - Trial 174 finished with values: [0.0005471384786559052, 0.00012473159024883166, 0.0002963500943196586] and parameters: {'n_layers': 1, 'embedding_dim': 96, 'lr': 0.0007183006551542105, 'lambda_val': 0.00015514348570178205, 'batch_size': 3012, 'optimizer': 'SGD'}.
2026-06-18 20:28:48,059 - optuna.study.study - INFO - Trial 175 finished with values: [0.010490199509719878, 0.0023888467853985097, 0.006275872942570171] and parameters: {'n_layers': 2, 'embedding_dim': 128, 'lr': 0.00011427386562980161, 'lambda_val': 1.4285456163687262e-06, 'batch_size': 2220, 'optimizer': 'Adam'}.
2026-06-18 20:29:39,148 - experiment_functions - INFO - Early stopping at epoch 1050. Best Metrics: (0.025702518541790058, 0.005575028419856005, 0.014486977248650038)
2026-06-18 20:29:39,247 - optuna.study.study - INFO - Trial 176 finished with values: [0.025702518541790058, 0.005575028419856005, 0.014486977248650038] and parameters: {'n_layers': 2, 'embedding_dim': 96, 'lr': 0.0004856174201898278, 'lambda_val': 0.004505589428166237, 'batch_size': 2254, 'optimizer': 'Adam'}.
2026-06-18 20:30:15,980 - experiment_functions - INFO - Early stopping at epoch 700. Best Metrics: (0.021079607028386262, 0.004558229127194644, 0.011828822776415632)
2026-06-18 20:30:16,063 - optuna.study.study - INFO - Trial 177 finished with values: [0.021079607028386262, 0.004558229127194644, 0.011828822776415632] and parameters: {'n_layers': 4, 'embedding_dim': 96, 'lr': 0.0010029417148474076, 'lambda_val': 5.316198242532503e-06, 'batch_size': 2254, 'optimizer': 'Adam'}.
2026-06-18 20:32:28,175 - experiment_functions - INFO - Early stopping at epoch 2800. Best Metrics: (0.018101841275255107, 0.003686686876342048, 0.00952926227005683)
2026-06-18 20:32:28,261 - optuna.study.study - INFO - Trial 178 finished with values: [0.018101841275255107, 0.003686686876342048, 0.00952926227005683] and parameters: {'n_layers': 2, 'embedding_dim': 128, 'lr': 0.0018430878476133415, 'lambda_val': 1.288405727605743e-06, 'batch_size': 578, 'optimizer': 'Adam'}.
2026-06-18 20:33:14,278 - experiment_functions - INFO - Early stopping at epoch 900. Best Metrics: (0.024550940960974023, 0.005240305671340154, 0.014109641948089757)
2026-06-18 20:33:14,363 - optuna.study.study - INFO - Trial 179 finished with values: [0.024550940960974023, 0.005240305671340154, 0.014109641948089757] and parameters: {'n_layers': 3, 'embedding_dim': 96, 'lr': 0.0005592470013695373, 'lambda_val': 0.00015514348570178205, 'batch_size': 2931, 'optimizer': 'Adam'}.
2026-06-18 20:33:44,654 - experiment_functions - INFO - Early stopping at epoch 550. Best Metrics: (0.01477235619317821, 0.00344669698117974, 0.008694015128904786)
2026-06-18 20:33:44,725 - optuna.study.study - INFO - Trial 180 finished with values: [0.01477235619317821, 0.00344669698117974, 0.008694015128904786] and parameters: {'n_layers': 1, 'embedding_dim': 256, 'lr': 0.01541022692424534, 'lambda_val': 1.1727812158033635e-06, 'batch_size': 578, 'optimizer': 'Adam'}.
2026-06-18 20:34:37,896 - experiment_functions - INFO - Early stopping at epoch 1050. Best Metrics: (0.012512736288773961, 0.002758304913477328, 0.006890907259380136)
2026-06-18 20:34:37,962 - optuna.study.study - INFO - Trial 181 finished with values: [0.012512736288773961, 0.002758304913477328, 0.006890907259380136] and parameters: {'n_layers': 3, 'embedding_dim': 128, 'lr': 0.0005592470013695373, 'lambda_val': 0.00988731074821415, 'batch_size': 578, 'optimizer': 'Adam'}.
2026-06-18 20:35:17,602 - experiment_functions - INFO - Early stopping at epoch 900. Best Metrics: (0.02559890398326577, 0.005361879499810535, 0.01453129873804266)
2026-06-18 20:35:17,699 - optuna.study.study - INFO - Trial 182 finished with values: [0.02559890398326577, 0.005361879499810535, 0.01453129873804266] and parameters: {'n_layers': 1, 'embedding_dim': 64, 'lr': 0.0018466507240200577, 'lambda_val': 1.2929761938228365e-06, 'batch_size': 991, 'optimizer': 'RMSprop'}.
2026-06-18 20:35:52,072 - experiment_functions - INFO - Early stopping at epoch 750. Best Metrics: (0.031277292320708916, 0.006714980421876975, 0.018098987063582688)
2026-06-18 20:35:52,187 - optuna.study.study - INFO - Trial 183 finished with values: [0.031277292320708916, 0.006714980421876975, 0.018098987063582688] and parameters: {'n_layers': 1, 'embedding_dim': 96, 'lr': 0.002003020991909066, 'lambda_val': 0.00015514348570178205, 'batch_size': 2689, 'optimizer': 'Adam'}.
2026-06-18 20:39:14,788 - optuna.study.study - INFO - Trial 184 finished with values: [0.027273257024137052, 0.005988695212833144, 0.015926457224614825] and parameters: {'n_layers': 3, 'embedding_dim': 128, 'lr': 0.00022471387800597823, 'lambda_val': 1.1727812158033635e-06, 'batch_size': 2931, 'optimizer': 'RMSprop'}.
2026-06-18 20:41:55,751 - experiment_functions - INFO - Early stopping at epoch 3650. Best Metrics: (0.0007788131401576925, 0.00016894025514715172, 0.0004722642991276282)
2026-06-18 20:41:55,850 - optuna.study.study - INFO - Trial 185 finished with values: [0.0007788131401576925, 0.00016894025514715172, 0.0004722642991276282] and parameters: {'n_layers': 1, 'embedding_dim': 128, 'lr': 7.763254710981808e-05, 'lambda_val': 2.57504602127859e-05, 'batch_size': 1509, 'optimizer': 'Adam'}.
2026-06-18 20:42:18,894 - experiment_functions - INFO - Early stopping at epoch 500. Best Metrics: (0.0006521624995746722, 0.00013420487558418593, 0.00033662943322286217)
2026-06-18 20:42:18,995 - optuna.study.study - INFO - Trial 186 finished with values: [0.0006521624995746722, 0.00013420487558418593, 0.00033662943322286217] and parameters: {'n_layers': 4, 'embedding_dim': 32, 'lr': 0.00022471387800597823, 'lambda_val': 1.1727812158033635e-06, 'batch_size': 578, 'optimizer': 'SGD'}.
2026-06-18 20:43:10,452 - experiment_functions - INFO - Early stopping at epoch 1150. Best Metrics: (0.030377212272113045, 0.006566565618289757, 0.017260140576596566)
2026-06-18 20:43:10,593 - optuna.study.study - INFO - Trial 187 finished with values: [0.030377212272113045, 0.006566565618289757, 0.017260140576596566] and parameters: {'n_layers': 1, 'embedding_dim': 96, 'lr': 0.0007183006551542105, 'lambda_val': 0.00012665625175825525, 'batch_size': 2689, 'optimizer': 'RMSprop'}.
2026-06-18 20:45:21,725 - experiment_functions - INFO - Early stopping at epoch 2850. Best Metrics: (0.030055168444685167, 0.00646551724137931, 0.01750633987495275)
2026-06-18 20:45:22,077 - optuna.study.study - INFO - Trial 188 finished with values: [0.030055168444685167, 0.00646551724137931, 0.01750633987495275] and parameters: {'n_layers': 2, 'embedding_dim': 96, 'lr': 0.00039950195617414347, 'lambda_val': 0.00015514348570178205, 'batch_size': 991, 'optimizer': 'Adam'}.
2026-06-18 20:48:12,990 - optuna.study.study - INFO - Trial 189 finished with values: [0.024333684513434466, 0.0055039787798408495, 0.01444157700833604] and parameters: {'n_layers': 1, 'embedding_dim': 64, 'lr': 0.00039950195617414347, 'lambda_val': 0.010972568711860843, 'batch_size': 991, 'optimizer': 'Adam'}.
