2026-06-18 03:11:37,639 - optuna.study.study - INFO - Trial 288 finished with values: [0.003258334837903301, 0.0007847038019451813, 0.002042522860290528] and parameters: {'n_layers': 3, 'embedding_dim': 96, 'lr': 0.0006197690834854795, 'lambda_val': 0.0012144921171399186, 'batch_size': 3359, 'optimizer': 'RMSprop'}.
2026-06-18 03:12:50,894 - experiment_functions - INFO - Early stopping at epoch 1650. Best Metrics: (0.0035950630849793993, 0.0008494379184034357, 0.002140376205698865)
2026-06-18 03:12:51,234 - optuna.study.study - INFO - Trial 289 finished with values: [0.0035950630849793993, 0.0008494379184034357, 0.002140376205698865] and parameters: {'n_layers': 4, 'embedding_dim': 64, 'lr': 0.0006197690834854795, 'lambda_val': 0.0026691122996758605, 'batch_size': 1884, 'optimizer': 'Adam'}.
2026-06-18 03:15:44,239 - optuna.study.study - INFO - Trial 290 finished with values: [0.0036128926887026573, 0.0008573323228495643, 0.0023407341213307047] and parameters: {'n_layers': 4, 'embedding_dim': 64, 'lr': 0.0006674090882881629, 'lambda_val': 3.6404845826373614e-05, 'batch_size': 624, 'optimizer': 'Adam'}.
2026-06-18 03:18:21,698 - experiment_functions - INFO - Early stopping at epoch 3650. Best Metrics: (0.0037898289948316596, 0.0009378552482000758, 0.002385907794934662)
2026-06-18 03:18:21,782 - optuna.study.study - INFO - Trial 291 finished with values: [0.0037898289948316596, 0.0009378552482000758, 0.002385907794934662] and parameters: {'n_layers': 4, 'embedding_dim': 64, 'lr': 0.0006197690834854795, 'lambda_val': 0.00435040723054019, 'batch_size': 526, 'optimizer': 'RMSprop'}.
2026-06-18 03:20:06,643 - experiment_functions - INFO - Early stopping at epoch 2400. Best Metrics: (0.003526098568090032, 0.0008620689655172414, 0.002259252591597673)
2026-06-18 03:20:07,028 - optuna.study.study - INFO - Trial 292 finished with values: [0.003526098568090032, 0.0008620689655172414, 0.002259252591597673] and parameters: {'n_layers': 4, 'embedding_dim': 64, 'lr': 0.0006990102643278918, 'lambda_val': 1.3372662561958538e-06, 'batch_size': 3334, 'optimizer': 'RMSprop'}.
2026-06-18 03:21:26,889 - experiment_functions - INFO - Early stopping at epoch 1850. Best Metrics: (0.0038224506336267524, 0.0009694328659845901, 0.0025373417157463773)
2026-06-18 03:21:26,999 - optuna.study.study - INFO - Trial 293 finished with values: [0.0038224506336267524, 0.0009694328659845901, 0.0025373417157463773] and parameters: {'n_layers': 3, 'embedding_dim': 96, 'lr': 0.0009259265868741952, 'lambda_val': 3.576975505685731e-06, 'batch_size': 1228, 'optimizer': 'RMSprop'}.
2026-06-18 03:21:53,592 - experiment_functions - INFO - Early stopping at epoch 550. Best Metrics: (0.0026012522343294518, 0.0007010231148162183, 0.00170692291886755)
2026-06-18 03:21:53,685 - optuna.study.study - INFO - Trial 294 finished with values: [0.0026012522343294518, 0.0007010231148162183, 0.00170692291886755] and parameters: {'n_layers': 3, 'embedding_dim': 128, 'lr': 0.03319660903678379, 'lambda_val': 0.0012161946689456778, 'batch_size': 810, 'optimizer': 'Adam'}.
2026-06-18 03:22:21,213 - experiment_functions - INFO - Early stopping at epoch 550. Best Metrics: (0.0030363068951033854, 0.0007815460401667299, 0.00190917147474116)
2026-06-18 03:22:21,746 - optuna.study.study - INFO - Trial 295 finished with values: [0.0030363068951033854, 0.0007815460401667299, 0.00190917147474116] and parameters: {'n_layers': 4, 'embedding_dim': 128, 'lr': 0.009454646193715423, 'lambda_val': 3.6404845826373614e-05, 'batch_size': 2889, 'optimizer': 'RMSprop'}.
2026-06-18 03:23:02,391 - experiment_functions - INFO - Early stopping at epoch 850. Best Metrics: (0.0019690840648650424, 0.0005699760010104838, 0.0012436005538085694)
2026-06-18 03:23:02,700 - optuna.study.study - INFO - Trial 296 finished with values: [0.0019690840648650424, 0.0005699760010104838, 0.0012436005538085694] and parameters: {'n_layers': 4, 'embedding_dim': 128, 'lr': 0.0023699548585448013, 'lambda_val': 0.0900702663030397, 'batch_size': 600, 'optimizer': 'RMSprop'}.
2026-06-18 03:24:20,479 - experiment_functions - INFO - Early stopping at epoch 1650. Best Metrics: (0.0033362730876014854, 0.0008115447770620186, 0.002084884857458793)
2026-06-18 03:24:20,571 - optuna.study.study - INFO - Trial 297 finished with values: [0.0033362730876014854, 0.0008115447770620186, 0.002084884857458793] and parameters: {'n_layers': 4, 'embedding_dim': 128, 'lr': 0.0006197690834854795, 'lambda_val': 6.404094044497605e-05, 'batch_size': 3625, 'optimizer': 'Adam'}.
2026-06-18 03:27:51,998 - optuna.study.study - INFO - Trial 298 finished with values: [0.004006293652249804, 0.0009978527219906533, 0.0025300810870372684] and parameters: {'n_layers': 4, 'embedding_dim': 256, 'lr': 0.0006197690834854795, 'lambda_val': 3.6404845826373614e-05, 'batch_size': 600, 'optimizer': 'RMSprop'}.
2026-06-18 03:28:37,966 - experiment_functions - INFO - Early stopping at epoch 1050. Best Metrics: (0.0036138923033082523, 0.0008510167992926615, 0.0021811941729539468)
2026-06-18 03:28:38,060 - optuna.study.study - INFO - Trial 299 finished with values: [0.0036138923033082523, 0.0008510167992926615, 0.0021811941729539468] and parameters: {'n_layers': 4, 'embedding_dim': 64, 'lr': 0.0016427257095284614, 'lambda_val': 0.002003406704760604, 'batch_size': 962, 'optimizer': 'Adam'}.
2026-06-18 03:28:38,076 - root - INFO - Selected Trial 217 based on Max ndcg: 0.0027
2026-06-18 03:28:38,076 - root - INFO - Associated Recall: 0.0042
2026-06-18 03:28:38,076 - experiment_functions - INFO - Training the best model ... for e_yelp_1c1dcs_strict_rand3
2026-06-18 03:30:39,156 - experiment_functions - INFO - Early stopping at epoch 2650. Best Metrics: (0.003966988390780327, 0.0009946949602122018, 0.0025342433072120456)
2026-06-18 03:30:42,651 - root - INFO -   **** Training e_yelp_1c1dcs_strict_rand4
2026-06-18 03:30:42,665 - root - INFO -   **** Getting 34724/1274132 random edges
2026-06-18 03:30:42,762 - optuna.storages._rdb.storage - INFO - A new study created in RDB with name: Study_e_yelp_1c1dcs_strict_rand4
2026-06-18 03:33:37,004 - optuna.study.study - INFO - Trial 0 finished with values: [0.002102418859984969, 0.0005541871921182266, 0.0013794570908326948] and parameters: {'n_layers': 4, 'embedding_dim': 96, 'lr': 0.00020850286339787972, 'lambda_val': 0.01895837370153157, 'batch_size': 1882, 'optimizer': 'Adam'}.
2026-06-18 03:34:57,017 - experiment_functions - INFO - Early stopping at epoch 1550. Best Metrics: (0.0033031034346141, 0.0008494379184034356, 0.001975396561744791)
2026-06-18 03:34:57,103 - optuna.study.study - INFO - Trial 1 finished with values: [0.0033031034346141, 0.0008494379184034356, 0.001975396561744791] and parameters: {'n_layers': 3, 'embedding_dim': 256, 'lr': 0.0011084029372515364, 'lambda_val': 0.00016604057802743083, 'batch_size': 1892, 'optimizer': 'Adam'}.
2026-06-18 03:37:51,436 - optuna.study.study - INFO - Trial 2 finished with values: [0.0005170552553111558, 0.00012473159024883163, 0.0002871609140699215] and parameters: {'n_layers': 4, 'embedding_dim': 96, 'lr': 1.131918789841467e-05, 'lambda_val': 0.0003918207524590079, 'batch_size': 1710, 'optimizer': 'RMSprop'}.
2026-06-18 03:38:13,632 - experiment_functions - INFO - Early stopping at epoch 500. Best Metrics: (0.0005306466974235223, 0.00010736390046734875, 0.00029430761113627006)
2026-06-18 03:38:13,726 - optuna.study.study - INFO - Trial 3 finished with values: [0.0005306466974235223, 0.00010736390046734875, 0.00029430761113627006] and parameters: {'n_layers': 2, 'embedding_dim': 64, 'lr': 0.0030151803125550943, 'lambda_val': 0.03699885801917255, 'batch_size': 3130, 'optimizer': 'SGD'}.
2026-06-18 03:38:38,031 - experiment_functions - INFO - Early stopping at epoch 550. Best Metrics: (0.002591596526649652, 0.0005810281672350637, 0.0015248501542957308)
2026-06-18 03:38:38,115 - optuna.study.study - INFO - Trial 4 finished with values: [0.002591596526649652, 0.0005810281672350637, 0.0015248501542957308] and parameters: {'n_layers': 3, 'embedding_dim': 32, 'lr': 0.026856253273949384, 'lambda_val': 0.00012156607227501548, 'batch_size': 2912, 'optimizer': 'Adam'}.
2026-06-18 03:39:18,509 - experiment_functions - INFO - Early stopping at epoch 800. Best Metrics: (0.0025532761881044298, 0.0006773399014778325, 0.001630169713195014)
2026-06-18 03:39:18,693 - optuna.study.study - INFO - Trial 5 finished with values: [0.0025532761881044298, 0.0006773399014778325, 0.001630169713195014] and parameters: {'n_layers': 4, 'embedding_dim': 128, 'lr': 0.0006520425723369588, 'lambda_val': 0.02277446723940248, 'batch_size': 2480, 'optimizer': 'RMSprop'}.
2026-06-18 03:40:31,849 - experiment_functions - INFO - Early stopping at epoch 1750. Best Metrics: (0.0016386891690628532, 0.00046419098143236085, 0.00103202433846415)
2026-06-18 03:40:31,932 - optuna.study.study - INFO - Trial 6 finished with values: [0.0016386891690628532, 0.00046419098143236085, 0.00103202433846415] and parameters: {'n_layers': 3, 'embedding_dim': 32, 'lr': 0.025072127211169866, 'lambda_val': 0.0031982885112246395, 'batch_size': 1092, 'optimizer': 'RMSprop'}.
2026-06-18 03:43:32,414 - optuna.study.study - INFO - Trial 7 finished with values: [0.0028925511716113676, 0.0006599722116963497, 0.0018040595138527234] and parameters: {'n_layers': 4, 'embedding_dim': 96, 'lr': 0.0002547850232335638, 'lambda_val': 5.088875721981583e-06, 'batch_size': 4035, 'optimizer': 'Adam'}.
2026-06-18 03:45:36,721 - experiment_functions - INFO - Early stopping at epoch 3000. Best Metrics: (0.0033849397005735553, 0.0007657572312744726, 0.00207410713576341)
2026-06-18 03:45:36,802 - optuna.study.study - INFO - Trial 8 finished with values: [0.0033849397005735553, 0.0007657572312744726, 0.00207410713576341] and parameters: {'n_layers': 3, 'embedding_dim': 32, 'lr': 0.0004894377864752034, 'lambda_val': 0.00021932042110835948, 'batch_size': 3869, 'optimizer': 'RMSprop'}.
2026-06-18 03:46:41,717 - experiment_functions - INFO - Early stopping at epoch 1150. Best Metrics: (0.00324966388970362, 0.0008336491095111786, 0.0020201170878102917)
2026-06-18 03:46:41,801 - optuna.study.study - INFO - Trial 9 finished with values: [0.00324966388970362, 0.0008336491095111786, 0.0020201170878102917] and parameters: {'n_layers': 4, 'embedding_dim': 256, 'lr': 0.0008273605807562151, 'lambda_val': 0.0009339364864859292, 'batch_size': 2287, 'optimizer': 'Adam'}.
2026-06-18 03:47:05,036 - experiment_functions - INFO - Early stopping at epoch 500. Best Metrics: (0.0005180408595679386, 0.00011367942402425162, 0.00027503124455890423)
2026-06-18 03:47:05,137 - optuna.study.study - INFO - Trial 10 finished with values: [0.0005180408595679386, 0.00011367942402425162, 0.00027503124455890423] and parameters: {'n_layers': 4, 'embedding_dim': 32, 'lr': 1.6487069053869397e-05, 'lambda_val': 0.00014775374883502693, 'batch_size': 789, 'optimizer': 'SGD'}.
2026-06-18 03:47:34,114 - experiment_functions - INFO - Early stopping at epoch 550. Best Metrics: (0.002179835426370685, 0.0006015536187949981, 0.0015000499273029615)
2026-06-18 03:47:34,224 - optuna.study.study - INFO - Trial 11 finished with values: [0.002179835426370685, 0.0006015536187949981, 0.0015000499273029615] and parameters: {'n_layers': 2, 'embedding_dim': 256, 'lr': 0.0041158673575400935, 'lambda_val': 0.006540993926312311, 'batch_size': 1670, 'optimizer': 'RMSprop'}.
2026-06-18 03:47:57,788 - experiment_functions - INFO - Early stopping at epoch 500. Best Metrics: (0.0006421647581292524, 0.00015157256536566882, 0.0003444925386130641)
2026-06-18 03:47:57,888 - optuna.study.study - INFO - Trial 12 finished with values: [0.0006421647581292524, 0.00015157256536566882, 0.0003444925386130641] and parameters: {'n_layers': 4, 'embedding_dim': 64, 'lr': 1.0574738008528193e-05, 'lambda_val': 0.004129817670245216, 'batch_size': 2152, 'optimizer': 'SGD'}.
2026-06-18 03:48:25,129 - experiment_functions - INFO - Early stopping at epoch 600. Best Metrics: (0.0031181409890541027, 0.0007073386383731211, 0.0019216113322564838)
2026-06-18 03:48:25,228 - optuna.study.study - INFO - Trial 13 finished with values: [0.0031181409890541027, 0.0007073386383731211, 0.0019216113322564838] and parameters: {'n_layers': 2, 'embedding_dim': 64, 'lr': 0.0024576630396683807, 'lambda_val': 3.615242376833312e-06, 'batch_size': 3782, 'optimizer': 'RMSprop'}.
2026-06-18 03:48:49,025 - experiment_functions - INFO - Early stopping at epoch 500. Best Metrics: (0.0004265032992660051, 0.00011841606669192877, 0.0002551972926557942)
2026-06-18 03:48:49,326 - optuna.study.study - INFO - Trial 14 finished with values: [0.0004265032992660051, 0.00011841606669192877, 0.0002551972926557942] and parameters: {'n_layers': 3, 'embedding_dim': 96, 'lr': 1.3648630936525448e-05, 'lambda_val': 0.004020179957781409, 'batch_size': 930, 'optimizer': 'SGD'}.
2026-06-18 03:49:39,208 - experiment_functions - INFO - Early stopping at epoch 1050. Best Metrics: (0.0021148584324048856, 0.000607869142351901, 0.0013643301372200031)
2026-06-18 03:49:39,294 - optuna.study.study - INFO - Trial 15 finished with values: [0.0021148584324048856, 0.000607869142351901, 0.0013643301372200031] and parameters: {'n_layers': 1, 'embedding_dim': 256, 'lr': 0.0016953904598071812, 'lambda_val': 0.014063188539313863, 'batch_size': 1921, 'optimizer': 'RMSprop'}.
2026-06-18 03:50:05,364 - experiment_functions - INFO - Early stopping at epoch 500. Best Metrics: (0.0006478544669432668, 0.00012157382847038021, 0.0003677908961751659)
2026-06-18 03:50:05,450 - optuna.study.study - INFO - Trial 16 finished with values: [0.0006478544669432668, 0.00012157382847038021, 0.0003677908961751659] and parameters: {'n_layers': 2, 'embedding_dim': 256, 'lr': 1.5078950892540291e-05, 'lambda_val': 0.002675349945292237, 'batch_size': 559, 'optimizer': 'SGD'}.
2026-06-18 03:51:01,299 - experiment_functions - INFO - Early stopping at epoch 1300. Best Metrics: (0.001770079529998529, 0.000524188455222938, 0.0011444025932796544)
2026-06-18 03:51:01,366 - optuna.study.study - INFO - Trial 17 finished with values: [0.001770079529998529, 0.000524188455222938, 0.0011444025932796544] and parameters: {'n_layers': 2, 'embedding_dim': 64, 'lr': 0.0359978602247165, 'lambda_val': 0.031615866948241124, 'batch_size': 1642, 'optimizer': 'Adam'}.
2026-06-18 03:51:28,398 - experiment_functions - INFO - Early stopping at epoch 550. Best Metrics: (0.002745983585714973, 0.0007152330428192497, 0.0017302535973513027)
2026-06-18 03:51:28,479 - optuna.study.study - INFO - Trial 18 finished with values: [0.002745983585714973, 0.0007152330428192497, 0.0017302535973513027] and parameters: {'n_layers': 4, 'embedding_dim': 96, 'lr': 0.006608098041910351, 'lambda_val': 0.0010642708856562232, 'batch_size': 2931, 'optimizer': 'RMSprop'}.
2026-06-18 03:52:40,854 - experiment_functions - INFO - Early stopping at epoch 1300. Best Metrics: (0.00047145361946376917, 0.00011999494758115448, 0.0002782816686625819)
2026-06-18 03:52:40,947 - optuna.study.study - INFO - Trial 19 finished with values: [0.00047145361946376917, 0.00011999494758115448, 0.0002782816686625819] and parameters: {'n_layers': 4, 'embedding_dim': 256, 'lr': 1.0931180327655417e-05, 'lambda_val': 4.8535828716557334e-05, 'batch_size': 3961, 'optimizer': 'RMSprop'}.
2026-06-18 03:55:10,225 - experiment_functions - INFO - Early stopping at epoch 3200. Best Metrics: (0.0005662786940580695, 0.0001484148035872174, 0.0003449608858767209)
2026-06-18 03:55:10,298 - optuna.study.study - INFO - Trial 20 finished with values: [0.0005662786940580695, 0.0001484148035872174, 0.0003449608858767209] and parameters: {'n_layers': 4, 'embedding_dim': 128, 'lr': 2.1336246823980475e-05, 'lambda_val': 0.004044231569890685, 'batch_size': 3937, 'optimizer': 'RMSprop'}.
2026-06-18 03:55:38,083 - experiment_functions - INFO - Early stopping at epoch 600. Best Metrics: (0.002917537170777444, 0.0007420740179360869, 0.0018753036543020965)
2026-06-18 03:55:38,166 - optuna.study.study - INFO - Trial 21 finished with values: [0.002917537170777444, 0.0007420740179360869, 0.0018753036543020965] and parameters: {'n_layers': 4, 'embedding_dim': 64, 'lr': 0.007973613552701056, 'lambda_val': 0.00029665726020447226, 'batch_size': 2086, 'optimizer': 'Adam'}.
2026-06-18 03:56:02,527 - experiment_functions - INFO - Early stopping at epoch 500. Best Metrics: (0.0005239332084376514, 0.00011841606669192878, 0.0002607315921343969)
2026-06-18 03:56:02,652 - optuna.study.study - INFO - Trial 22 finished with values: [0.0005239332084376514, 0.00011841606669192878, 0.0002607315921343969] and parameters: {'n_layers': 1, 'embedding_dim': 256, 'lr': 5.044395900959436e-05, 'lambda_val': 0.001917439486982073, 'batch_size': 1429, 'optimizer': 'SGD'}.
2026-06-18 03:56:38,863 - experiment_functions - INFO - Early stopping at epoch 800. Best Metrics: (0.0034319540798120416, 0.0008399646330680814, 0.002091934155151122)
2026-06-18 03:56:39,879 - optuna.study.study - INFO - Trial 23 finished with values: [0.0034319540798120416, 0.0008399646330680814, 0.002091934155151122] and parameters: {'n_layers': 4, 'embedding_dim': 64, 'lr': 0.0037685849042605117, 'lambda_val': 1.8034594907965394e-06, 'batch_size': 696, 'optimizer': 'Adam'}.
2026-06-18 03:57:38,711 - experiment_functions - INFO - Early stopping at epoch 1400. Best Metrics: (0.0030147050604171755, 0.0007010231148162183, 0.0018223473754184474)
2026-06-18 03:57:39,235 - optuna.study.study - INFO - Trial 24 finished with values: [0.0030147050604171755, 0.0007010231148162183, 0.0018223473754184474] and parameters: {'n_layers': 1, 'embedding_dim': 96, 'lr': 0.0037241261216120077, 'lambda_val': 7.3372601056335455e-06, 'batch_size': 1509, 'optimizer': 'Adam'}.
2026-06-18 04:00:18,950 - experiment_functions - INFO - Early stopping at epoch 3650. Best Metrics: (0.0030617644805887643, 0.0007215485663761526, 0.002086240842634385)
2026-06-18 04:00:19,027 - optuna.study.study - INFO - Trial 25 finished with values: [0.0030617644805887643, 0.0007215485663761526, 0.002086240842634385] and parameters: {'n_layers': 3, 'embedding_dim': 96, 'lr': 0.0002981283007949551, 'lambda_val': 1.839049008182015e-05, 'batch_size': 2942, 'optimizer': 'RMSprop'}.
2026-06-18 04:03:03,580 - optuna.study.study - INFO - Trial 26 finished with values: [0.003442015047777488, 0.0007057597574838954, 0.00198993643839256] and parameters: {'n_layers': 1, 'embedding_dim': 96, 'lr': 0.00046996802016152644, 'lambda_val': 2.2848456976007116e-05, 'batch_size': 1498, 'optimizer': 'RMSprop'}.
2026-06-18 04:03:58,364 - experiment_functions - INFO - Early stopping at epoch 1250. Best Metrics: (0.002962018053398313, 0.0006757610205886068, 0.0017879196777432214)
2026-06-18 04:03:59,417 - optuna.study.study - INFO - Trial 27 finished with values: [0.002962018053398313, 0.0006757610205886068, 0.0017879196777432214] and parameters: {'n_layers': 1, 'embedding_dim': 64, 'lr': 0.0019141832424539585, 'lambda_val': 5.538422897317458e-06, 'batch_size': 3801, 'optimizer': 'RMSprop'}.
2026-06-18 04:05:23,277 - experiment_functions - INFO - Early stopping at epoch 1950. Best Metrics: (0.0032027398415766296, 0.0006852343059239611, 0.0019679420058146073)
2026-06-18 04:05:23,394 - optuna.study.study - INFO - Trial 28 finished with values: [0.0032027398415766296, 0.0006852343059239611, 0.0019679420058146073] and parameters: {'n_layers': 1, 'embedding_dim': 64, 'lr': 0.0010693223843994991, 'lambda_val': 9.333405880902565e-05, 'batch_size': 887, 'optimizer': 'Adam'}.
2026-06-18 04:05:55,375 - experiment_functions - INFO - Early stopping at epoch 650. Best Metrics: (0.0005782145689238544, 0.00013420487558418596, 0.00033333289621965604)
2026-06-18 04:05:55,473 - optuna.study.study - INFO - Trial 29 finished with values: [0.0005782145689238544, 0.00013420487558418596, 0.00033333289621965604] and parameters: {'n_layers': 1, 'embedding_dim': 256, 'lr': 0.042010532329755206, 'lambda_val': 1.5851584365326932e-06, 'batch_size': 3882, 'optimizer': 'SGD'}.
2026-06-18 04:06:24,465 - experiment_functions - INFO - Early stopping at epoch 500. Best Metrics: (0.0004701406874136525, 0.00010420613868889732, 0.00023625445220017076)
2026-06-18 04:06:25,392 - optuna.study.study - INFO - Trial 30 finished with values: [0.0004701406874136525, 0.00010420613868889732, 0.00023625445220017076] and parameters: {'n_layers': 4, 'embedding_dim': 256, 'lr': 4.082046422932171e-05, 'lambda_val': 0.0004273943503510052, 'batch_size': 820, 'optimizer': 'SGD'}.
2026-06-18 04:06:49,219 - experiment_functions - INFO - Early stopping at epoch 500. Best Metrics: (0.0004176249093566565, 0.00010262725779967159, 0.00025260710583400407)
2026-06-18 04:06:49,297 - optuna.study.study - INFO - Trial 31 finished with values: [0.0004176249093566565, 0.00010262725779967159, 0.00025260710583400407] and parameters: {'n_layers': 2, 'embedding_dim': 128, 'lr': 0.000335328032151204, 'lambda_val': 6.371881970113608e-06, 'batch_size': 2629, 'optimizer': 'SGD'}.
2026-06-18 04:07:18,223 - experiment_functions - INFO - Early stopping at epoch 500. Best Metrics: (0.0004736083634919755, 0.00011210054313502589, 0.0002494350777206423)
2026-06-18 04:07:18,309 - optuna.study.study - INFO - Trial 32 finished with values: [0.0004736083634919755, 0.00011210054313502589, 0.0002494350777206423] and parameters: {'n_layers': 4, 'embedding_dim': 256, 'lr': 0.0022038467093960573, 'lambda_val': 0.0015599193980319953, 'batch_size': 3753, 'optimizer': 'SGD'}.
2026-06-18 04:09:58,302 - optuna.study.study - INFO - Trial 33 finished with values: [0.001879882628624903, 0.0004120879120879121, 0.0010720231454236276] and parameters: {'n_layers': 1, 'embedding_dim': 64, 'lr': 0.00016233089845677325, 'lambda_val': 4.386762014256509e-06, 'batch_size': 4014, 'optimizer': 'RMSprop'}.
