2026-06-23 04:34:39,187 - optuna.study.study - INFO - Trial 222 finished with values: [0.03271887760415748, 0.0069944423392699255, 0.01868188915233591] and parameters: {'n_layers': 1, 'embedding_dim': 256, 'lr': 0.0008213174750905707, 'lambda_val': 0.0010840808687380718, 'batch_size': 2258, 'optimizer': 'Adam'}.
2026-06-23 04:35:41,409 - experiment_functions - INFO - Early stopping at epoch 1100. Best Metrics: (0.02507238194956993, 0.005382404951370468, 0.014167240856954748)
2026-06-23 04:35:41,500 - optuna.study.study - INFO - Trial 223 finished with values: [0.02507238194956993, 0.005382404951370468, 0.014167240856954748] and parameters: {'n_layers': 2, 'embedding_dim': 256, 'lr': 0.0008213174750905707, 'lambda_val': 2.7464269407470928e-06, 'batch_size': 1887, 'optimizer': 'RMSprop'}.
2026-06-23 04:36:22,614 - experiment_functions - INFO - Early stopping at epoch 650. Best Metrics: (0.01695850371246942, 0.003631426045219149, 0.009336969236872177)
2026-06-23 04:36:22,700 - optuna.study.study - INFO - Trial 224 finished with values: [0.01695850371246942, 0.003631426045219149, 0.009336969236872177] and parameters: {'n_layers': 3, 'embedding_dim': 256, 'lr': 0.0013646646670668807, 'lambda_val': 0.004175461462120846, 'batch_size': 3305, 'optimizer': 'Adam'}.
2026-06-23 04:37:11,427 - experiment_functions - INFO - Early stopping at epoch 950. Best Metrics: (0.006990939571368436, 0.0015583554376657825, 0.003763568279550145)
2026-06-23 04:37:11,596 - optuna.study.study - INFO - Trial 225 finished with values: [0.006990939571368436, 0.0015583554376657825, 0.003763568279550145] and parameters: {'n_layers': 3, 'embedding_dim': 128, 'lr': 0.0021960529228386067, 'lambda_val': 0.0017972759027936231, 'batch_size': 869, 'optimizer': 'Adam'}.
2026-06-23 04:40:12,852 - optuna.study.study - INFO - Trial 226 finished with values: [0.02579307821164783, 0.005502399898951624, 0.01438598426962585] and parameters: {'n_layers': 3, 'embedding_dim': 64, 'lr': 0.0004052348643724966, 'lambda_val': 1.1976797619462708e-05, 'batch_size': 2261, 'optimizer': 'Adam'}.
2026-06-23 04:44:18,232 - experiment_functions - INFO - Early stopping at epoch 3750. Best Metrics: (0.024666350320991827, 0.005377668308702792, 0.014047689467630386)
2026-06-23 04:44:18,311 - optuna.study.study - INFO - Trial 227 finished with values: [0.024666350320991827, 0.005377668308702792, 0.014047689467630386] and parameters: {'n_layers': 4, 'embedding_dim': 256, 'lr': 0.000267777720544778, 'lambda_val': 3.12735769757427e-06, 'batch_size': 922, 'optimizer': 'RMSprop'}.
2026-06-23 04:47:12,962 - optuna.study.study - INFO - Trial 228 finished with values: [0.02316694460002777, 0.004964001515725653, 0.013159295649788853] and parameters: {'n_layers': 4, 'embedding_dim': 32, 'lr': 0.0004713458926928272, 'lambda_val': 8.867377208453881e-05, 'batch_size': 2330, 'optimizer': 'RMSprop'}.
2026-06-23 04:49:59,226 - optuna.study.study - INFO - Trial 229 finished with values: [0.03079180398276274, 0.006583933308071239, 0.017504329437236198] and parameters: {'n_layers': 1, 'embedding_dim': 32, 'lr': 0.0006886562164819431, 'lambda_val': 0.0014098261925433889, 'batch_size': 2877, 'optimizer': 'RMSprop'}.
2026-06-23 04:50:39,515 - experiment_functions - INFO - Early stopping at epoch 850. Best Metrics: (0.0221537406978688, 0.0047255905014525704, 0.012103196162096194)
2026-06-23 04:50:39,598 - optuna.study.study - INFO - Trial 230 finished with values: [0.0221537406978688, 0.0047255905014525704, 0.012103196162096194] and parameters: {'n_layers': 3, 'embedding_dim': 64, 'lr': 0.0013646646670668807, 'lambda_val': 2.7464269407470928e-06, 'batch_size': 1895, 'optimizer': 'Adam'}.
2026-06-23 04:51:15,910 - experiment_functions - INFO - Early stopping at epoch 800. Best Metrics: (0.00998575505779645, 0.0020493873942149807, 0.005317311832060023)
2026-06-23 04:51:15,994 - optuna.study.study - INFO - Trial 231 finished with values: [0.00998575505779645, 0.0020493873942149807, 0.005317311832060023] and parameters: {'n_layers': 2, 'embedding_dim': 64, 'lr': 0.01148432196798719, 'lambda_val': 5.8009422887733266e-06, 'batch_size': 2548, 'optimizer': 'Adam'}.
2026-06-23 04:52:18,359 - experiment_functions - INFO - Early stopping at epoch 1150. Best Metrics: (0.02220116774630518, 0.004856637615258306, 0.012419127974772395)
2026-06-23 04:52:18,450 - optuna.study.study - INFO - Trial 232 finished with values: [0.02220116774630518, 0.004856637615258306, 0.012419127974772395] and parameters: {'n_layers': 3, 'embedding_dim': 128, 'lr': 0.0004463508454333929, 'lambda_val': 0.0019245436397418532, 'batch_size': 2436, 'optimizer': 'RMSprop'}.
2026-06-23 04:53:07,450 - experiment_functions - INFO - Early stopping at epoch 1100. Best Metrics: (0.018535549888520915, 0.003967727674624226, 0.011044275665594981)
2026-06-23 04:53:07,544 - optuna.study.study - INFO - Trial 233 finished with values: [0.018535549888520915, 0.003967727674624226, 0.011044275665594981] and parameters: {'n_layers': 3, 'embedding_dim': 32, 'lr': 0.0013029739660954116, 'lambda_val': 3.611427784790995e-05, 'batch_size': 2381, 'optimizer': 'RMSprop'}.
2026-06-23 04:53:39,951 - experiment_functions - INFO - Early stopping at epoch 650. Best Metrics: (0.017062295568642576, 0.0036835291145635974, 0.009517294543032127)
2026-06-23 04:53:40,053 - optuna.study.study - INFO - Trial 234 finished with values: [0.017062295568642576, 0.0036835291145635974, 0.009517294543032127] and parameters: {'n_layers': 4, 'embedding_dim': 64, 'lr': 0.0016936188017047076, 'lambda_val': 8.179879507815703e-06, 'batch_size': 3305, 'optimizer': 'Adam'}.
2026-06-23 04:54:16,611 - experiment_functions - INFO - Early stopping at epoch 750. Best Metrics: (0.011689465101294328, 0.0026162056334470135, 0.006476910923038567)
2026-06-23 04:54:16,709 - optuna.study.study - INFO - Trial 235 finished with values: [0.011689465101294328, 0.0026162056334470135, 0.006476910923038567] and parameters: {'n_layers': 4, 'embedding_dim': 64, 'lr': 0.0008639986019635256, 'lambda_val': 0.005404522144278895, 'batch_size': 1872, 'optimizer': 'RMSprop'}.
2026-06-23 04:54:46,383 - experiment_functions - INFO - Early stopping at epoch 550. Best Metrics: (0.01368704751612917, 0.0030235569028672477, 0.008024670662684572)
2026-06-23 04:54:46,759 - optuna.study.study - INFO - Trial 236 finished with values: [0.01368704751612917, 0.0030235569028672477, 0.008024670662684572] and parameters: {'n_layers': 1, 'embedding_dim': 256, 'lr': 0.010581481753294916, 'lambda_val': 3.12735769757427e-06, 'batch_size': 1872, 'optimizer': 'RMSprop'}.
2026-06-23 04:55:44,021 - experiment_functions - INFO - Early stopping at epoch 850. Best Metrics: (0.01556731401311685, 0.003288808892257168, 0.008420133082678069)
2026-06-23 04:55:44,106 - optuna.study.study - INFO - Trial 237 finished with values: [0.01556731401311685, 0.003288808892257168, 0.008420133082678069] and parameters: {'n_layers': 4, 'embedding_dim': 256, 'lr': 0.0006886562164819431, 'lambda_val': 3.12735769757427e-06, 'batch_size': 2330, 'optimizer': 'RMSprop'}.
2026-06-23 04:56:38,679 - experiment_functions - INFO - Early stopping at epoch 1000. Best Metrics: (0.020359889947615235, 0.004245610711127952, 0.011229506632237188)
2026-06-23 04:56:38,962 - optuna.study.study - INFO - Trial 238 finished with values: [0.020359889947615235, 0.004245610711127952, 0.011229506632237188] and parameters: {'n_layers': 4, 'embedding_dim': 128, 'lr': 0.0008213174750905707, 'lambda_val': 0.00019370302140894226, 'batch_size': 2258, 'optimizer': 'Adam'}.
2026-06-23 04:59:41,651 - optuna.study.study - INFO - Trial 239 finished with values: [0.028678677786441474, 0.006220790703549324, 0.016680208595408492] and parameters: {'n_layers': 1, 'embedding_dim': 128, 'lr': 0.0007431111591868237, 'lambda_val': 0.0011345897854453913, 'batch_size': 1341, 'optimizer': 'Adam'}.
2026-06-23 05:02:22,808 - optuna.study.study - INFO - Trial 240 finished with values: [0.015520413524326638, 0.0037198433750157893, 0.009376437474505377] and parameters: {'n_layers': 1, 'embedding_dim': 32, 'lr': 0.0004463508454333929, 'lambda_val': 0.0016324316088680724, 'batch_size': 2754, 'optimizer': 'RMSprop'}.
2026-06-23 05:02:44,883 - experiment_functions - INFO - Early stopping at epoch 500. Best Metrics: (0.0004940156195078751, 0.00011210054313502589, 0.0002811275942561906)
2026-06-23 05:02:44,974 - optuna.study.study - INFO - Trial 241 finished with values: [0.0004940156195078751, 0.00011210054313502589, 0.0002811275942561906] and parameters: {'n_layers': 1, 'embedding_dim': 32, 'lr': 0.0013646646670668807, 'lambda_val': 0.013891323661131265, 'batch_size': 2381, 'optimizer': 'SGD'}.
2026-06-23 05:04:46,013 - experiment_functions - INFO - Early stopping at epoch 2200. Best Metrics: (0.027198013915194368, 0.005743968675003158, 0.015473215857526007)
2026-06-23 05:04:46,441 - optuna.study.study - INFO - Trial 242 finished with values: [0.027198013915194368, 0.005743968675003158, 0.015473215857526007] and parameters: {'n_layers': 2, 'embedding_dim': 256, 'lr': 0.0008213174750905707, 'lambda_val': 4.998160662190083e-05, 'batch_size': 827, 'optimizer': 'Adam'}.
2026-06-23 05:05:16,032 - experiment_functions - INFO - Early stopping at epoch 650. Best Metrics: (0.02775110726157076, 0.0059539598332701785, 0.01631738606874002)
2026-06-23 05:05:16,175 - optuna.study.study - INFO - Trial 243 finished with values: [0.02775110726157076, 0.0059539598332701785, 0.01631738606874002] and parameters: {'n_layers': 1, 'embedding_dim': 64, 'lr': 0.0054915489808154486, 'lambda_val': 0.0010840808687380718, 'batch_size': 2258, 'optimizer': 'Adam'}.
2026-06-23 05:06:06,552 - experiment_functions - INFO - Early stopping at epoch 750. Best Metrics: (0.0028123661520989434, 0.0006031324996842238, 0.0015525526644094999)
2026-06-23 05:06:06,647 - optuna.study.study - INFO - Trial 244 finished with values: [0.0028123661520989434, 0.0006031324996842238, 0.0015525526644094999] and parameters: {'n_layers': 4, 'embedding_dim': 256, 'lr': 0.03147050175951417, 'lambda_val': 0.028162642703793424, 'batch_size': 2261, 'optimizer': 'Adam'}.
2026-06-23 05:09:06,237 - optuna.study.study - INFO - Trial 245 finished with values: [0.022584879220594413, 0.004982948086396362, 0.01285517984254131] and parameters: {'n_layers': 3, 'embedding_dim': 64, 'lr': 0.000267777720544778, 'lambda_val': 1.1678222757114953e-05, 'batch_size': 3305, 'optimizer': 'Adam'}.
2026-06-23 05:11:48,406 - optuna.study.study - INFO - Trial 246 finished with values: [0.01644443609317916, 0.0037940507768093987, 0.009940112878309464] and parameters: {'n_layers': 1, 'embedding_dim': 32, 'lr': 0.0006886562164819431, 'lambda_val': 0.0013940329611109277, 'batch_size': 1341, 'optimizer': 'Adam'}.
2026-06-23 05:12:36,301 - experiment_functions - INFO - Early stopping at epoch 1050. Best Metrics: (0.026336887527316263, 0.005658709106984969, 0.015254822374956678)
2026-06-23 05:12:36,377 - optuna.study.study - INFO - Trial 247 finished with values: [0.026336887527316263, 0.005658709106984969, 0.015254822374956678] and parameters: {'n_layers': 2, 'embedding_dim': 64, 'lr': 0.0008213174750905707, 'lambda_val': 0.0016324316088680724, 'batch_size': 3203, 'optimizer': 'Adam'}.
2026-06-23 05:13:15,672 - experiment_functions - INFO - Early stopping at epoch 750. Best Metrics: (0.014124240555708788, 0.002996715927750411, 0.0077551664921711285)
2026-06-23 05:13:15,742 - optuna.study.study - INFO - Trial 248 finished with values: [0.014124240555708788, 0.002996715927750411, 0.0077551664921711285] and parameters: {'n_layers': 3, 'embedding_dim': 128, 'lr': 0.0013646646670668807, 'lambda_val': 1.1678222757114953e-05, 'batch_size': 2651, 'optimizer': 'RMSprop'}.
2026-06-23 05:13:46,960 - experiment_functions - INFO - Early stopping at epoch 650. Best Metrics: (0.025976316950193222, 0.005556081849185297, 0.014711215543546962)
2026-06-23 05:13:47,053 - optuna.study.study - INFO - Trial 249 finished with values: [0.025976316950193222, 0.005556081849185297, 0.014711215543546962] and parameters: {'n_layers': 1, 'embedding_dim': 128, 'lr': 0.0054915489808154486, 'lambda_val': 0.0010840808687380718, 'batch_size': 2548, 'optimizer': 'Adam'}.
2026-06-23 05:16:48,686 - optuna.study.study - INFO - Trial 250 finished with values: [0.0358223834146064, 0.007389162561576354, 0.020224572697056013] and parameters: {'n_layers': 1, 'embedding_dim': 128, 'lr': 0.0008213174750905707, 'lambda_val': 5.132964042678166e-06, 'batch_size': 3983, 'optimizer': 'Adam'}.
2026-06-23 05:17:40,148 - experiment_functions - INFO - Early stopping at epoch 900. Best Metrics: (0.02619619919165865, 0.005494505494505495, 0.014780786481972516)
2026-06-23 05:17:40,235 - optuna.study.study - INFO - Trial 251 finished with values: [0.02619619919165865, 0.005494505494505495, 0.014780786481972516] and parameters: {'n_layers': 2, 'embedding_dim': 256, 'lr': 0.001046404922421146, 'lambda_val': 5.78702538335228e-06, 'batch_size': 2825, 'optimizer': 'Adam'}.
2026-06-23 05:18:10,350 - experiment_functions - INFO - Early stopping at epoch 650. Best Metrics: (0.028537672747281077, 0.006103953517746621, 0.016172429293364876)
2026-06-23 05:18:10,466 - optuna.study.study - INFO - Trial 252 finished with values: [0.028537672747281077, 0.006103953517746621, 0.016172429293364876] and parameters: {'n_layers': 1, 'embedding_dim': 64, 'lr': 0.0054915489808154486, 'lambda_val': 0.0010840808687380718, 'batch_size': 2548, 'optimizer': 'Adam'}.
2026-06-23 05:18:32,723 - experiment_functions - INFO - Early stopping at epoch 500. Best Metrics: (0.0004865083356513851, 0.00010578501957812305, 0.0002727560623004782)
2026-06-23 05:18:32,804 - optuna.study.study - INFO - Trial 253 finished with values: [0.0004865083356513851, 0.00010578501957812305, 0.0002727560623004782] and parameters: {'n_layers': 1, 'embedding_dim': 32, 'lr': 0.0008639986019635256, 'lambda_val': 3.611427784790995e-05, 'batch_size': 3900, 'optimizer': 'SGD'}.
2026-06-23 05:18:55,077 - experiment_functions - INFO - Early stopping at epoch 500. Best Metrics: (0.0005887137787629685, 0.00012315270935960593, 0.00033122943863175515)
2026-06-23 05:18:55,169 - optuna.study.study - INFO - Trial 254 finished with values: [0.0005887137787629685, 0.00012315270935960593, 0.00033122943863175515] and parameters: {'n_layers': 1, 'embedding_dim': 32, 'lr': 2.575901254856866e-05, 'lambda_val': 0.018126568573406728, 'batch_size': 2825, 'optimizer': 'RMSprop'}.
2026-06-23 05:21:45,193 - optuna.study.study - INFO - Trial 255 finished with values: [0.03265632658819773, 0.007021283314386764, 0.019044274522219646] and parameters: {'n_layers': 1, 'embedding_dim': 64, 'lr': 0.0008213174750905707, 'lambda_val': 3.611427784790995e-05, 'batch_size': 1807, 'optimizer': 'Adam'}.
2026-06-23 05:24:36,392 - experiment_functions - INFO - Early stopping at epoch 2600. Best Metrics: (0.023535034260553058, 0.005101364153088292, 0.013388307900954001)
2026-06-23 05:24:36,478 - optuna.study.study - INFO - Trial 256 finished with values: [0.023535034260553058, 0.005101364153088292, 0.013388307900954001] and parameters: {'n_layers': 4, 'embedding_dim': 256, 'lr': 0.000267777720544778, 'lambda_val': 1.1976797619462708e-05, 'batch_size': 2261, 'optimizer': 'RMSprop'}.
2026-06-23 05:25:30,655 - experiment_functions - INFO - Early stopping at epoch 1100. Best Metrics: (0.02457104215170797, 0.005237147909561703, 0.013895518498434498)
2026-06-23 05:25:30,742 - optuna.study.study - INFO - Trial 257 finished with values: [0.02457104215170797, 0.005237147909561703, 0.013895518498434498] and parameters: {'n_layers': 3, 'embedding_dim': 96, 'lr': 0.0006886562164819431, 'lambda_val': 1.1976797619462708e-05, 'batch_size': 1721, 'optimizer': 'Adam'}.
2026-06-23 05:26:02,588 - experiment_functions - INFO - Early stopping at epoch 650. Best Metrics: (0.026050496177085908, 0.005526083112290009, 0.014882478342003031)
2026-06-23 05:26:02,665 - optuna.study.study - INFO - Trial 258 finished with values: [0.026050496177085908, 0.005526083112290009, 0.014882478342003031] and parameters: {'n_layers': 2, 'embedding_dim': 96, 'lr': 0.0025566338112489964, 'lambda_val': 3.416831683581915e-05, 'batch_size': 3305, 'optimizer': 'Adam'}.
2026-06-23 05:27:36,647 - experiment_functions - INFO - Early stopping at epoch 1850. Best Metrics: (0.03196531133501281, 0.0067134015409877484, 0.01835701146050969)
2026-06-23 05:27:36,734 - optuna.study.study - INFO - Trial 259 finished with values: [0.03196531133501281, 0.0067134015409877484, 0.01835701146050969] and parameters: {'n_layers': 1, 'embedding_dim': 256, 'lr': 0.0013029739660954116, 'lambda_val': 3.611427784790995e-05, 'batch_size': 2381, 'optimizer': 'Adam'}.
2026-06-23 05:30:30,915 - optuna.study.study - INFO - Trial 260 finished with values: [0.03300223190305148, 0.006954970317039282, 0.01900357857540303] and parameters: {'n_layers': 1, 'embedding_dim': 96, 'lr': 0.0008213174750905707, 'lambda_val': 3.611427784790995e-05, 'batch_size': 2381, 'optimizer': 'Adam'}.
2026-06-23 05:31:27,311 - experiment_functions - INFO - Early stopping at epoch 1200. Best Metrics: (0.028683335585551358, 0.0059586964759378545, 0.016248702976650563)
2026-06-23 05:31:27,386 - optuna.study.study - INFO - Trial 261 finished with values: [0.028683335585551358, 0.0059586964759378545, 0.016248702976650563] and parameters: {'n_layers': 2, 'embedding_dim': 96, 'lr': 0.0008213174750905707, 'lambda_val': 1.1976797619462708e-05, 'batch_size': 3742, 'optimizer': 'Adam'}.
2026-06-23 05:31:55,308 - experiment_functions - INFO - Early stopping at epoch 600. Best Metrics: (0.01881384295519929, 0.004035619552860932, 0.010159895163571532)
2026-06-23 05:31:55,777 - optuna.study.study - INFO - Trial 262 finished with values: [0.01881384295519929, 0.004035619552860932, 0.010159895163571532] and parameters: {'n_layers': 2, 'embedding_dim': 64, 'lr': 0.0054915489808154486, 'lambda_val': 0.0010840808687380718, 'batch_size': 3572, 'optimizer': 'Adam'}.
2026-06-23 05:32:34,941 - experiment_functions - INFO - Early stopping at epoch 850. Best Metrics: (0.02690019328760978, 0.005751863079449288, 0.01523158171238536)
2026-06-23 05:32:35,030 - optuna.study.study - INFO - Trial 263 finished with values: [0.02690019328760978, 0.005751863079449288, 0.01523158171238536] and parameters: {'n_layers': 2, 'embedding_dim': 64, 'lr': 0.0011830892051778884, 'lambda_val': 0.0016324316088680724, 'batch_size': 3203, 'optimizer': 'Adam'}.
2026-06-23 05:35:21,644 - experiment_functions - INFO - Early stopping at epoch 3350. Best Metrics: (0.03229536118022255, 0.006898130605027158, 0.018314472321365047)
2026-06-23 05:35:21,749 - optuna.study.study - INFO - Trial 264 finished with values: [0.03229536118022255, 0.006898130605027158, 0.018314472321365047] and parameters: {'n_layers': 1, 'embedding_dim': 256, 'lr': 0.001046404922421146, 'lambda_val': 0.0010840808687380718, 'batch_size': 1807, 'optimizer': 'Adam'}.
2026-06-23 05:38:19,115 - optuna.study.study - INFO - Trial 265 finished with values: [0.028116465208940247, 0.0061150056839712015, 0.016466448045523868] and parameters: {'n_layers': 1, 'embedding_dim': 128, 'lr': 0.0007431111591868237, 'lambda_val': 0.0011345897854453913, 'batch_size': 1341, 'optimizer': 'Adam'}.
2026-06-23 05:38:41,958 - experiment_functions - INFO - Early stopping at epoch 500. Best Metrics: (0.00045389594047141445, 9.789061513199445e-05, 0.000250809150827262)
2026-06-23 05:38:42,038 - optuna.study.study - INFO - Trial 266 finished with values: [0.00045389594047141445, 9.789061513199445e-05, 0.000250809150827262] and parameters: {'n_layers': 1, 'embedding_dim': 64, 'lr': 0.0007263535833396289, 'lambda_val': 0.0010840808687380718, 'batch_size': 2877, 'optimizer': 'SGD'}.
2026-06-23 05:41:30,332 - optuna.study.study - INFO - Trial 267 finished with values: [0.0325878466742753, 0.006857079701907289, 0.018274836428310313] and parameters: {'n_layers': 1, 'embedding_dim': 32, 'lr': 0.0013029739660954116, 'lambda_val': 3.611427784790995e-05, 'batch_size': 2381, 'optimizer': 'RMSprop'}.
2026-06-23 05:44:10,521 - optuna.study.study - INFO - Trial 268 finished with values: [0.016941988790955754, 0.00390773020083365, 0.010057303514268581] and parameters: {'n_layers': 1, 'embedding_dim': 32, 'lr': 0.0008213174750905707, 'lambda_val': 4.998160662190083e-05, 'batch_size': 827, 'optimizer': 'Adam'}.
2026-06-23 05:47:01,580 - experiment_functions - INFO - Early stopping at epoch 3850. Best Metrics: (0.013299446867183113, 0.002810407982821776, 0.00736209703792527)
2026-06-23 05:47:01,651 - optuna.study.study - INFO - Trial 269 finished with values: [0.013299446867183113, 0.002810407982821776, 0.00736209703792527] and parameters: {'n_layers': 2, 'embedding_dim': 96, 'lr': 0.0025566338112489964, 'lambda_val': 1.1976797619462708e-05, 'batch_size': 2258, 'optimizer': 'RMSprop'}.
2026-06-23 05:48:03,053 - experiment_functions - INFO - Early stopping at epoch 1400. Best Metrics: (0.0226951282826632, 0.004937160540608818, 0.013009775506603953)
2026-06-23 05:48:03,147 - optuna.study.study - INFO - Trial 270 finished with values: [0.0226951282826632, 0.004937160540608818, 0.013009775506603953] and parameters: {'n_layers': 3, 'embedding_dim': 32, 'lr': 0.0008337736900003446, 'lambda_val': 1.1678222757114953e-05, 'batch_size': 2871, 'optimizer': 'RMSprop'}.
2026-06-23 05:49:06,083 - experiment_functions - INFO - Early stopping at epoch 1450. Best Metrics: (0.025889316763365228, 0.005622394846532778, 0.014695245398478394)
2026-06-23 05:49:06,173 - optuna.study.study - INFO - Trial 271 finished with values: [0.025889316763365228, 0.005622394846532778, 0.014695245398478394] and parameters: {'n_layers': 2, 'embedding_dim': 32, 'lr': 0.0008213174750905707, 'lambda_val': 1.1678222757114953e-05, 'batch_size': 3983, 'optimizer': 'RMSprop'}.
2026-06-23 05:49:36,432 - experiment_functions - INFO - Early stopping at epoch 650. Best Metrics: (0.0273326103678173, 0.005947644309713275, 0.015844466104318347)
