2026-06-20 22:29:40,620 - optuna.study.study - INFO - Trial 39 finished with values: [0.000612755571783555, 0.0001326259946949602, 0.0003043589862630179] and parameters: {'n_layers': 2, 'embedding_dim': 32, 'lr': 0.03297936909530417, 'lambda_val': 0.06978823653770568, 'batch_size': 3955, 'optimizer': 'SGD'}.
2026-06-20 22:30:11,634 - experiment_functions - INFO - Early stopping at epoch 700. Best Metrics: (0.005774950386516426, 0.0014952002020967542, 0.0035435245301186336)
2026-06-20 22:30:11,717 - optuna.study.study - INFO - Trial 40 finished with values: [0.005774950386516426, 0.0014952002020967542, 0.0035435245301186336] and parameters: {'n_layers': 2, 'embedding_dim': 64, 'lr': 0.003636390488042639, 'lambda_val': 0.0014663279558597413, 'batch_size': 1285, 'optimizer': 'RMSprop'}.
2026-06-20 22:30:40,100 - experiment_functions - INFO - Early stopping at epoch 600. Best Metrics: (0.0073072692918438814, 0.0019278135657446003, 0.004389611499327738)
2026-06-20 22:30:40,200 - optuna.study.study - INFO - Trial 41 finished with values: [0.0073072692918438814, 0.0019278135657446003, 0.004389611499327738] and parameters: {'n_layers': 3, 'embedding_dim': 96, 'lr': 0.0035879353384560956, 'lambda_val': 1.282312052161098e-05, 'batch_size': 3149, 'optimizer': 'RMSprop'}.
2026-06-20 22:31:25,848 - experiment_functions - INFO - Early stopping at epoch 1050. Best Metrics: (0.0005149582327695557, 0.00013736263736263736, 0.0002820384665086525)
2026-06-20 22:31:25,917 - optuna.study.study - INFO - Trial 42 finished with values: [0.0005149582327695557, 0.00013736263736263736, 0.0002820384665086525] and parameters: {'n_layers': 1, 'embedding_dim': 128, 'lr': 2.1217060369088665e-05, 'lambda_val': 1.2524544581117692e-06, 'batch_size': 2910, 'optimizer': 'Adam'}.
2026-06-20 22:31:47,881 - experiment_functions - INFO - Early stopping at epoch 500. Best Metrics: (0.0005504372990135023, 0.00011841606669192877, 0.0002920911844328258)
2026-06-20 22:31:47,955 - optuna.study.study - INFO - Trial 43 finished with values: [0.0005504372990135023, 0.00011841606669192877, 0.0002920911844328258] and parameters: {'n_layers': 1, 'embedding_dim': 32, 'lr': 2.2188513826158764e-05, 'lambda_val': 0.0015882841030768593, 'batch_size': 3852, 'optimizer': 'SGD'}.
2026-06-20 22:34:28,794 - experiment_functions - INFO - Early stopping at epoch 3800. Best Metrics: (0.007326473394924811, 0.0018157130226095744, 0.004529405687728568)
2026-06-20 22:34:28,882 - optuna.study.study - INFO - Trial 44 finished with values: [0.007326473394924811, 0.0018157130226095744, 0.004529405687728568] and parameters: {'n_layers': 2, 'embedding_dim': 96, 'lr': 0.0006460981719089114, 'lambda_val': 5.82846385984691e-05, 'batch_size': 3901, 'optimizer': 'RMSprop'}.
2026-06-20 22:35:24,069 - experiment_functions - INFO - Early stopping at epoch 1200. Best Metrics: (0.0063346051098141015, 0.0016562460527977769, 0.003916862839855929)
2026-06-20 22:35:24,138 - optuna.study.study - INFO - Trial 45 finished with values: [0.0063346051098141015, 0.0016562460527977769, 0.003916862839855929] and parameters: {'n_layers': 3, 'embedding_dim': 128, 'lr': 0.0006604859729474348, 'lambda_val': 0.013339360902303529, 'batch_size': 3679, 'optimizer': 'Adam'}.
2026-06-20 22:35:54,919 - experiment_functions - INFO - Early stopping at epoch 600. Best Metrics: (0.005048873492648361, 0.0012599469496021223, 0.0030342511517789145)
2026-06-20 22:35:54,998 - optuna.study.study - INFO - Trial 46 finished with values: [0.005048873492648361, 0.0012599469496021223, 0.0030342511517789145] and parameters: {'n_layers': 2, 'embedding_dim': 256, 'lr': 0.004175099306741505, 'lambda_val': 0.0010632401775879522, 'batch_size': 1761, 'optimizer': 'RMSprop'}.
2026-06-20 22:36:33,630 - experiment_functions - INFO - Early stopping at epoch 900. Best Metrics: (0.006337205544888896, 0.0015773020083364915, 0.0037832540651898845)
2026-06-20 22:36:33,730 - optuna.study.study - INFO - Trial 47 finished with values: [0.006337205544888896, 0.0015773020083364915, 0.0037832540651898845] and parameters: {'n_layers': 2, 'embedding_dim': 64, 'lr': 0.003096198742357918, 'lambda_val': 2.2580566177048725e-06, 'batch_size': 3764, 'optimizer': 'RMSprop'}.
2026-06-20 22:36:55,708 - experiment_functions - INFO - Early stopping at epoch 500. Best Metrics: (0.0005486195007889878, 0.00011999494758115448, 0.00029353500598368)
2026-06-20 22:36:55,785 - optuna.study.study - INFO - Trial 48 finished with values: [0.0005486195007889878, 0.00011999494758115448, 0.00029353500598368] and parameters: {'n_layers': 2, 'embedding_dim': 64, 'lr': 0.05472060974490089, 'lambda_val': 0.0033423810321644367, 'batch_size': 1788, 'optimizer': 'SGD'}.
2026-06-20 22:37:19,657 - experiment_functions - INFO - Early stopping at epoch 500. Best Metrics: (0.0005743188454019783, 0.00011999494758115448, 0.0003069239487564685)
2026-06-20 22:37:19,746 - optuna.study.study - INFO - Trial 49 finished with values: [0.0005743188454019783, 0.00011999494758115448, 0.0003069239487564685] and parameters: {'n_layers': 4, 'embedding_dim': 96, 'lr': 0.007096981986411302, 'lambda_val': 0.036893519548867285, 'batch_size': 3847, 'optimizer': 'SGD'}.
2026-06-20 22:37:53,968 - experiment_functions - INFO - Early stopping at epoch 750. Best Metrics: (0.00724284990161051, 0.0018709738537324744, 0.004345590334630758)
2026-06-20 22:37:54,206 - optuna.study.study - INFO - Trial 50 finished with values: [0.00724284990161051, 0.0018709738537324744, 0.004345590334630758] and parameters: {'n_layers': 3, 'embedding_dim': 96, 'lr': 0.0035879353384560956, 'lambda_val': 0.0020606879477940467, 'batch_size': 916, 'optimizer': 'Adam'}.
2026-06-20 22:40:32,356 - optuna.study.study - INFO - Trial 51 finished with values: [0.0007107799219978946, 0.00014367816091954023, 0.00038968232552215695] and parameters: {'n_layers': 1, 'embedding_dim': 96, 'lr': 1.6918097449690972e-05, 'lambda_val': 9.728721119768561e-06, 'batch_size': 2532, 'optimizer': 'RMSprop'}.
2026-06-20 22:42:54,821 - experiment_functions - INFO - Early stopping at epoch 3100. Best Metrics: (0.012699054594575234, 0.0031909182771251736, 0.007743666673855219)
2026-06-20 22:42:54,911 - optuna.study.study - INFO - Trial 52 finished with values: [0.012699054594575234, 0.0031909182771251736, 0.007743666673855219] and parameters: {'n_layers': 4, 'embedding_dim': 128, 'lr': 0.0006101961971381852, 'lambda_val': 0.0017226178103252388, 'batch_size': 777, 'optimizer': 'RMSprop'}.
2026-06-20 22:43:17,214 - experiment_functions - INFO - Early stopping at epoch 500. Best Metrics: (0.0005885649117118776, 0.00014367816091954023, 0.000313344452220997)
2026-06-20 22:43:17,302 - optuna.study.study - INFO - Trial 53 finished with values: [0.0005885649117118776, 0.00014367816091954023, 0.000313344452220997] and parameters: {'n_layers': 1, 'embedding_dim': 96, 'lr': 4.081502078498842e-05, 'lambda_val': 0.0908364460095134, 'batch_size': 3521, 'optimizer': 'Adam'}.
2026-06-20 22:43:42,327 - experiment_functions - INFO - Early stopping at epoch 600. Best Metrics: (0.003646794330054558, 0.0008020714917266641, 0.0022169787297032697)
2026-06-20 22:43:42,413 - optuna.study.study - INFO - Trial 54 finished with values: [0.003646794330054558, 0.0008020714917266641, 0.0022169787297032697] and parameters: {'n_layers': 1, 'embedding_dim': 32, 'lr': 0.00997410292059067, 'lambda_val': 5.629872101647515e-05, 'batch_size': 3338, 'optimizer': 'Adam'}.
2026-06-20 22:44:04,844 - experiment_functions - INFO - Early stopping at epoch 500. Best Metrics: (0.0004586530964681718, 0.00010736390046734875, 0.0002797789668697381)
2026-06-20 22:44:04,926 - optuna.study.study - INFO - Trial 55 finished with values: [0.0004586530964681718, 0.00010736390046734875, 0.0002797789668697381] and parameters: {'n_layers': 1, 'embedding_dim': 128, 'lr': 0.03417025022075237, 'lambda_val': 0.018590717374416425, 'batch_size': 3059, 'optimizer': 'SGD'}.
2026-06-20 22:46:37,186 - experiment_functions - INFO - Early stopping at epoch 3000. Best Metrics: (0.010732554970988411, 0.00269830743968675, 0.006633717392545092)
2026-06-20 22:46:37,262 - optuna.study.study - INFO - Trial 56 finished with values: [0.010732554970988411, 0.00269830743968675, 0.006633717392545092] and parameters: {'n_layers': 3, 'embedding_dim': 256, 'lr': 0.0006101961971381852, 'lambda_val': 2.4259773382665532e-05, 'batch_size': 1203, 'optimizer': 'RMSprop'}.
2026-06-20 22:48:17,191 - experiment_functions - INFO - Early stopping at epoch 2600. Best Metrics: (0.0026404324500548205, 0.0007041808765946698, 0.0014888586274819315)
2026-06-20 22:48:17,257 - optuna.study.study - INFO - Trial 57 finished with values: [0.0026404324500548205, 0.0007041808765946698, 0.0014888586274819315] and parameters: {'n_layers': 1, 'embedding_dim': 32, 'lr': 0.01853956167633285, 'lambda_val': 0.002189116538069228, 'batch_size': 3786, 'optimizer': 'RMSprop'}.
2026-06-20 22:49:36,244 - experiment_functions - INFO - Early stopping at epoch 2000. Best Metrics: (0.0027687599370084214, 0.000731021851711507, 0.0016309024547621405)
2026-06-20 22:49:36,333 - optuna.study.study - INFO - Trial 58 finished with values: [0.0027687599370084214, 0.000731021851711507, 0.0016309024547621405] and parameters: {'n_layers': 2, 'embedding_dim': 32, 'lr': 0.01853956167633285, 'lambda_val': 0.002189116538069228, 'batch_size': 3786, 'optimizer': 'RMSprop'}.
2026-06-20 22:50:38,217 - experiment_functions - INFO - Early stopping at epoch 1600. Best Metrics: (0.0004597511953067673, 0.0001121005431350259, 0.0002504285256041417)
2026-06-20 22:50:38,301 - optuna.study.study - INFO - Trial 59 finished with values: [0.0004597511953067673, 0.0001121005431350259, 0.0002504285256041417] and parameters: {'n_layers': 1, 'embedding_dim': 32, 'lr': 0.06717563850332485, 'lambda_val': 0.0011815240672291283, 'batch_size': 3901, 'optimizer': 'SGD'}.
2026-06-20 22:51:01,970 - experiment_functions - INFO - Early stopping at epoch 500. Best Metrics: (0.0004624279405025482, 0.00011841606669192878, 0.00025811298304294507)
2026-06-20 22:51:02,070 - optuna.study.study - INFO - Trial 60 finished with values: [0.0004624279405025482, 0.00011841606669192878, 0.00025811298304294507] and parameters: {'n_layers': 1, 'embedding_dim': 256, 'lr': 2.2188513826158764e-05, 'lambda_val': 0.0165807032174809, 'batch_size': 3852, 'optimizer': 'SGD'}.
2026-06-20 22:53:56,815 - optuna.study.study - INFO - Trial 61 finished with values: [0.00231012235841907, 0.0005036630036630037, 0.0013158316216747659] and parameters: {'n_layers': 3, 'embedding_dim': 128, 'lr': 0.00019042887053650822, 'lambda_val': 0.0007991211790773639, 'batch_size': 1902, 'optimizer': 'Adam'}.
2026-06-20 22:54:18,260 - experiment_functions - INFO - Early stopping at epoch 500. Best Metrics: (0.00048686042372417585, 0.00010894278135657447, 0.00027294418386937996)
2026-06-20 22:54:18,332 - optuna.study.study - INFO - Trial 62 finished with values: [0.00048686042372417585, 0.00010894278135657447, 0.00027294418386937996] and parameters: {'n_layers': 1, 'embedding_dim': 64, 'lr': 1.4164340618085504e-05, 'lambda_val': 0.03431012611286831, 'batch_size': 3987, 'optimizer': 'RMSprop'}.
2026-06-20 22:54:41,558 - experiment_functions - INFO - Early stopping at epoch 500. Best Metrics: (0.000542414127893982, 0.00011525830491347732, 0.0002519313058283015)
2026-06-20 22:54:41,685 - optuna.study.study - INFO - Trial 63 finished with values: [0.000542414127893982, 0.00011525830491347732, 0.0002519313058283015] and parameters: {'n_layers': 4, 'embedding_dim': 64, 'lr': 3.15457195933704e-05, 'lambda_val': 0.07199824797202324, 'batch_size': 3043, 'optimizer': 'RMSprop'}.
2026-06-20 22:55:44,209 - experiment_functions - INFO - Early stopping at epoch 1500. Best Metrics: (0.0023095495615200108, 0.0006031324996842238, 0.0013524259145858083)
2026-06-20 22:55:44,299 - optuna.study.study - INFO - Trial 64 finished with values: [0.0023095495615200108, 0.0006031324996842238, 0.0013524259145858083] and parameters: {'n_layers': 3, 'embedding_dim': 64, 'lr': 0.022624420343631716, 'lambda_val': 0.0968617096434626, 'batch_size': 1086, 'optimizer': 'Adam'}.
2026-06-20 22:58:26,469 - optuna.study.study - INFO - Trial 65 finished with values: [0.0015791855121516183, 0.0003363016294050777, 0.0008898874178448613] and parameters: {'n_layers': 1, 'embedding_dim': 128, 'lr': 0.00021449741922300051, 'lambda_val': 0.0020606879477940467, 'batch_size': 1902, 'optimizer': 'Adam'}.
2026-06-20 23:01:03,992 - optuna.study.study - INFO - Trial 66 finished with values: [0.0014604629640655228, 0.0003378805102943034, 0.0007912991561105346] and parameters: {'n_layers': 1, 'embedding_dim': 64, 'lr': 0.00019042887053650822, 'lambda_val': 0.0007991211790773639, 'batch_size': 2746, 'optimizer': 'Adam'}.
2026-06-20 23:01:25,536 - experiment_functions - INFO - Early stopping at epoch 500. Best Metrics: (0.00045513303139230285, 0.00011683718580270305, 0.00023896257804272323)
2026-06-20 23:01:25,626 - optuna.study.study - INFO - Trial 67 finished with values: [0.00045513303139230285, 0.00011683718580270305, 0.00023896257804272323] and parameters: {'n_layers': 1, 'embedding_dim': 64, 'lr': 2.8959223914613547e-05, 'lambda_val': 0.00044824164772396327, 'batch_size': 2985, 'optimizer': 'SGD'}.
2026-06-20 23:01:52,992 - experiment_functions - INFO - Early stopping at epoch 650. Best Metrics: (0.0037868757676612847, 0.000887331059744853, 0.002254977513044852)
2026-06-20 23:01:53,104 - optuna.study.study - INFO - Trial 68 finished with values: [0.0037868757676612847, 0.000887331059744853, 0.002254977513044852] and parameters: {'n_layers': 1, 'embedding_dim': 32, 'lr': 0.0035879353384560956, 'lambda_val': 0.0015882841030768593, 'batch_size': 3852, 'optimizer': 'RMSprop'}.
2026-06-20 23:02:27,380 - experiment_functions - INFO - Early stopping at epoch 750. Best Metrics: (0.007547414886128586, 0.0018536061639509917, 0.004368297390442346)
2026-06-20 23:02:27,470 - optuna.study.study - INFO - Trial 69 finished with values: [0.007547414886128586, 0.0018536061639509917, 0.004368297390442346] and parameters: {'n_layers': 3, 'embedding_dim': 96, 'lr': 0.0031134216844272773, 'lambda_val': 0.0010632401775879522, 'batch_size': 3398, 'optimizer': 'Adam'}.
2026-06-20 23:02:53,132 - experiment_functions - INFO - Early stopping at epoch 600. Best Metrics: (0.0005663661815027327, 0.00010578501957812305, 0.0002581901268733167)
2026-06-20 23:02:53,212 - optuna.study.study - INFO - Trial 70 finished with values: [0.0005663661815027327, 0.00010578501957812305, 0.0002581901268733167] and parameters: {'n_layers': 1, 'embedding_dim': 64, 'lr': 1.4164340618085504e-05, 'lambda_val': 0.03431012611286831, 'batch_size': 3376, 'optimizer': 'RMSprop'}.
2026-06-20 23:03:15,272 - experiment_functions - INFO - Early stopping at epoch 500. Best Metrics: (0.0006949199352746828, 0.00014525704180876596, 0.00040486636655125)
2026-06-20 23:03:15,359 - optuna.study.study - INFO - Trial 71 finished with values: [0.0006949199352746828, 0.00014525704180876596, 0.00040486636655125] and parameters: {'n_layers': 1, 'embedding_dim': 64, 'lr': 1.4012256622698871e-05, 'lambda_val': 0.07512166284238957, 'batch_size': 2952, 'optimizer': 'Adam'}.
2026-06-20 23:04:53,723 - experiment_functions - INFO - Early stopping at epoch 2350. Best Metrics: (0.0005287067610986845, 0.00012631047113805733, 0.00032175244606464515)
2026-06-20 23:04:53,797 - optuna.study.study - INFO - Trial 72 finished with values: [0.0005287067610986845, 0.00012631047113805733, 0.00032175244606464515] and parameters: {'n_layers': 4, 'embedding_dim': 64, 'lr': 3.219182309012811e-05, 'lambda_val': 1.9825462234694257e-05, 'batch_size': 992, 'optimizer': 'RMSprop'}.
2026-06-20 23:06:05,871 - experiment_functions - INFO - Early stopping at epoch 1800. Best Metrics: (0.003354800823056881, 0.0008794366552987243, 0.0019036061765769564)
2026-06-20 23:06:05,961 - optuna.study.study - INFO - Trial 73 finished with values: [0.003354800823056881, 0.0008794366552987243, 0.0019036061765769564] and parameters: {'n_layers': 1, 'embedding_dim': 64, 'lr': 0.02088009457117759, 'lambda_val': 0.0017226178103252388, 'batch_size': 2119, 'optimizer': 'RMSprop'}.
2026-06-20 23:07:36,178 - experiment_functions - INFO - Early stopping at epoch 2150. Best Metrics: (0.003450231107903044, 0.0008273335859542757, 0.0018239695860004055)
2026-06-20 23:07:36,256 - optuna.study.study - INFO - Trial 74 finished with values: [0.003450231107903044, 0.0008273335859542757, 0.0018239695860004055] and parameters: {'n_layers': 2, 'embedding_dim': 96, 'lr': 0.04956742366373063, 'lambda_val': 0.002189116538069228, 'batch_size': 3786, 'optimizer': 'Adam'}.
2026-06-20 23:08:14,857 - experiment_functions - INFO - Early stopping at epoch 900. Best Metrics: (0.0004853421332682027, 0.00011367942402425162, 0.0002541912949701963)
2026-06-20 23:08:14,950 - optuna.study.study - INFO - Trial 75 finished with values: [0.0004853421332682027, 0.00011367942402425162, 0.0002541912949701963] and parameters: {'n_layers': 2, 'embedding_dim': 96, 'lr': 0.05472060974490089, 'lambda_val': 0.0033423810321644367, 'batch_size': 1788, 'optimizer': 'SGD'}.
2026-06-20 23:08:40,567 - experiment_functions - INFO - Early stopping at epoch 500. Best Metrics: (0.0005300447333898645, 0.00011683718580270305, 0.00028275921798505985)
2026-06-20 23:08:41,455 - optuna.study.study - INFO - Trial 76 finished with values: [0.0005300447333898645, 0.00011683718580270305, 0.00028275921798505985] and parameters: {'n_layers': 2, 'embedding_dim': 256, 'lr': 0.0020951981615418484, 'lambda_val': 1.7879188960656295e-05, 'batch_size': 3767, 'optimizer': 'SGD'}.
2026-06-20 23:09:45,207 - experiment_functions - INFO - Early stopping at epoch 1400. Best Metrics: (0.010402365556644793, 0.002622521157003916, 0.006199825241287299)
2026-06-20 23:09:45,291 - optuna.study.study - INFO - Trial 77 finished with values: [0.010402365556644793, 0.002622521157003916, 0.006199825241287299] and parameters: {'n_layers': 4, 'embedding_dim': 96, 'lr': 0.0006101961971381852, 'lambda_val': 0.0017226178103252388, 'batch_size': 3029, 'optimizer': 'RMSprop'}.
2026-06-20 23:10:08,336 - experiment_functions - INFO - Early stopping at epoch 500. Best Metrics: (0.0005082796172668214, 0.00012788935202728306, 0.0003262138893423335)
2026-06-20 23:10:08,429 - optuna.study.study - INFO - Trial 78 finished with values: [0.0005082796172668214, 0.00012788935202728306, 0.0003262138893423335] and parameters: {'n_layers': 4, 'embedding_dim': 64, 'lr': 4.081502078498842e-05, 'lambda_val': 0.0908364460095134, 'batch_size': 2950, 'optimizer': 'SGD'}.
2026-06-20 23:11:55,967 - experiment_functions - INFO - Early stopping at epoch 2700. Best Metrics: (0.0026878604012793533, 0.0006504989263609953, 0.001501045050475375)
2026-06-20 23:11:56,058 - optuna.study.study - INFO - Trial 79 finished with values: [0.0026878604012793533, 0.0006504989263609953, 0.001501045050475375] and parameters: {'n_layers': 3, 'embedding_dim': 32, 'lr': 0.04432247820921534, 'lambda_val': 0.004386949975881728, 'batch_size': 3786, 'optimizer': 'Adam'}.
2026-06-20 23:12:57,602 - experiment_functions - INFO - Early stopping at epoch 1350. Best Metrics: (0.004800316081619313, 0.0011967917140330933, 0.002890886312859626)
2026-06-20 23:12:57,695 - optuna.study.study - INFO - Trial 80 finished with values: [0.004800316081619313, 0.0011967917140330933, 0.002890886312859626] and parameters: {'n_layers': 1, 'embedding_dim': 256, 'lr': 0.003096198742357918, 'lambda_val': 5.084446162730928e-06, 'batch_size': 4059, 'optimizer': 'RMSprop'}.
2026-06-20 23:13:51,729 - experiment_functions - INFO - Early stopping at epoch 1250. Best Metrics: (0.00407130230638094, 0.0010957433371226477, 0.0022981980420359025)
2026-06-20 23:13:52,260 - optuna.study.study - INFO - Trial 81 finished with values: [0.00407130230638094, 0.0010957433371226477, 0.0022981980420359025] and parameters: {'n_layers': 4, 'embedding_dim': 64, 'lr': 0.0006604859729474348, 'lambda_val': 0.07199824797202324, 'batch_size': 3679, 'optimizer': 'Adam'}.
2026-06-20 23:15:31,188 - experiment_functions - INFO - Early stopping at epoch 2450. Best Metrics: (0.0006059478610402162, 0.0001294682329165088, 0.00031282943586184866)
2026-06-20 23:15:31,264 - optuna.study.study - INFO - Trial 82 finished with values: [0.0006059478610402162, 0.0001294682329165088, 0.00031282943586184866] and parameters: {'n_layers': 1, 'embedding_dim': 96, 'lr': 2.957492195351769e-05, 'lambda_val': 6.326936115170299e-06, 'batch_size': 2697, 'optimizer': 'Adam'}.
2026-06-20 23:15:59,803 - experiment_functions - INFO - Early stopping at epoch 600. Best Metrics: (0.0025751791088097155, 0.0007010231148162183, 0.0015150338188045691)
2026-06-20 23:15:59,886 - optuna.study.study - INFO - Trial 83 finished with values: [0.0025751791088097155, 0.0007010231148162183, 0.0015150338188045691] and parameters: {'n_layers': 4, 'embedding_dim': 96, 'lr': 0.004155419971354583, 'lambda_val': 0.09037063715843972, 'batch_size': 2697, 'optimizer': 'Adam'}.
2026-06-20 23:18:07,569 - experiment_functions - INFO - Early stopping at epoch 3300. Best Metrics: (0.0027803260496166884, 0.0007199696854869269, 0.0015839046018985422)
2026-06-20 23:18:07,648 - optuna.study.study - INFO - Trial 84 finished with values: [0.0027803260496166884, 0.0007199696854869269, 0.0015839046018985422] and parameters: {'n_layers': 1, 'embedding_dim': 32, 'lr': 0.037964762124532064, 'lambda_val': 0.009096515554245269, 'batch_size': 1078, 'optimizer': 'RMSprop'}.
2026-06-20 23:20:52,975 - optuna.study.study - INFO - Trial 85 finished with values: [0.009164823091710324, 0.002246747505368195, 0.00572255216031865] and parameters: {'n_layers': 3, 'embedding_dim': 64, 'lr': 0.0006101961971381852, 'lambda_val': 2.0807360556667617e-05, 'batch_size': 2119, 'optimizer': 'Adam'}.
2026-06-20 23:21:14,355 - experiment_functions - INFO - Early stopping at epoch 500. Best Metrics: (0.0004963356609002721, 0.00011367942402425163, 0.0002436941551262979)
