2026-06-23 13:09:26,708 - optuna.study.study - INFO - Trial 10 finished with values: [0.0037552323013227765, 0.0009220664393078187, 0.002247950725936786] and parameters: {'n_layers': 1, 'embedding_dim': 32, 'lr': 0.09502810603450783, 'lambda_val': 4.514960179682276e-05, 'batch_size': 1517, 'optimizer': 'RMSprop'}.
2026-06-23 13:11:53,745 - experiment_functions - INFO - Early stopping at epoch 3450. Best Metrics: (0.00848002929749251, 0.0018441328786156373, 0.004719339224469168)
2026-06-23 13:11:53,852 - optuna.study.study - INFO - Trial 11 finished with values: [0.00848002929749251, 0.0018441328786156373, 0.004719339224469168] and parameters: {'n_layers': 2, 'embedding_dim': 64, 'lr': 0.09496399878237523, 'lambda_val': 0.0045842802504681, 'batch_size': 3839, 'optimizer': 'RMSprop'}.
2026-06-23 13:12:28,288 - experiment_functions - INFO - Early stopping at epoch 500. Best Metrics: (0.00043534512471081726, 0.0001026272577996716, 0.00025149436080628914)
2026-06-23 13:12:28,398 - optuna.study.study - INFO - Trial 12 finished with values: [0.00043534512471081726, 0.0001026272577996716, 0.00025149436080628914] and parameters: {'n_layers': 4, 'embedding_dim': 256, 'lr': 4.8742664771419995e-05, 'lambda_val': 0.01954289888831383, 'batch_size': 1231, 'optimizer': 'RMSprop'}.
2026-06-23 13:12:52,015 - experiment_functions - INFO - Early stopping at epoch 500. Best Metrics: (0.0005047619662113201, 0.00011841606669192877, 0.0002719144902860502)
2026-06-23 13:12:52,115 - optuna.study.study - INFO - Trial 13 finished with values: [0.0005047619662113201, 0.00011841606669192877, 0.0002719144902860502] and parameters: {'n_layers': 1, 'embedding_dim': 128, 'lr': 2.1950108788661884e-05, 'lambda_val': 0.020437853799472674, 'batch_size': 2506, 'optimizer': 'RMSprop'}.
2026-06-23 13:14:03,190 - experiment_functions - INFO - Early stopping at epoch 1500. Best Metrics: (0.003752312497983699, 0.0008447012757357586, 0.0021263335998436762)
2026-06-23 13:14:03,291 - optuna.study.study - INFO - Trial 14 finished with values: [0.003752312497983699, 0.0008447012757357586, 0.0021263335998436762] and parameters: {'n_layers': 3, 'embedding_dim': 96, 'lr': 0.0040817323595222854, 'lambda_val': 0.04657486079864441, 'batch_size': 2944, 'optimizer': 'RMSprop'}.
2026-06-23 13:14:29,445 - experiment_functions - INFO - Early stopping at epoch 500. Best Metrics: (0.0005997949658133408, 0.00013578375647341166, 0.0003577400588591056)
2026-06-23 13:14:29,552 - optuna.study.study - INFO - Trial 15 finished with values: [0.0005997949658133408, 0.00013578375647341166, 0.0003577400588591056] and parameters: {'n_layers': 3, 'embedding_dim': 128, 'lr': 0.005829813039172121, 'lambda_val': 5.1869418223278785e-06, 'batch_size': 4009, 'optimizer': 'SGD'}.
2026-06-23 13:18:48,985 - optuna.study.study - INFO - Trial 16 finished with values: [0.01739773019279506, 0.003958254389288872, 0.010095449780282779] and parameters: {'n_layers': 4, 'embedding_dim': 256, 'lr': 0.00011634190552068439, 'lambda_val': 0.00011941284348716088, 'batch_size': 3896, 'optimizer': 'RMSprop'}.
2026-06-23 13:19:16,843 - experiment_functions - INFO - Early stopping at epoch 550. Best Metrics: (0.007157715930328883, 0.001488884678539851, 0.0040184414964708004)
2026-06-23 13:19:16,997 - optuna.study.study - INFO - Trial 17 finished with values: [0.007157715930328883, 0.001488884678539851, 0.0040184414964708004] and parameters: {'n_layers': 2, 'embedding_dim': 128, 'lr': 0.06165385340227955, 'lambda_val': 0.0001456853509054334, 'batch_size': 3557, 'optimizer': 'Adam'}.
2026-06-23 13:19:45,992 - experiment_functions - INFO - Early stopping at epoch 550. Best Metrics: (0.00789796693046625, 0.0018109763799418976, 0.004645781195593147)
2026-06-23 13:19:46,099 - optuna.study.study - INFO - Trial 18 finished with values: [0.00789796693046625, 0.0018109763799418976, 0.004645781195593147] and parameters: {'n_layers': 1, 'embedding_dim': 256, 'lr': 0.05804646531650009, 'lambda_val': 4.6275505465924135e-05, 'batch_size': 2108, 'optimizer': 'Adam'}.
2026-06-23 13:20:16,133 - experiment_functions - INFO - Early stopping at epoch 650. Best Metrics: (0.0005985495022662814, 0.0001499936844764431, 0.0003545259380632478)
2026-06-23 13:20:16,246 - optuna.study.study - INFO - Trial 19 finished with values: [0.0005985495022662814, 0.0001499936844764431, 0.0003545259380632478] and parameters: {'n_layers': 1, 'embedding_dim': 128, 'lr': 8.004957993819838e-05, 'lambda_val': 1.2325724481703244e-06, 'batch_size': 767, 'optimizer': 'RMSprop'}.
2026-06-23 13:20:42,354 - experiment_functions - INFO - Early stopping at epoch 500. Best Metrics: (0.000614447782382771, 0.00012631047113805733, 0.00031628482295817807)
2026-06-23 13:20:42,462 - optuna.study.study - INFO - Trial 20 finished with values: [0.000614447782382771, 0.00012631047113805733, 0.00031628482295817807] and parameters: {'n_layers': 1, 'embedding_dim': 256, 'lr': 2.1962741941544302e-05, 'lambda_val': 7.687965322643018e-06, 'batch_size': 1384, 'optimizer': 'Adam'}.
2026-06-23 13:21:07,163 - experiment_functions - INFO - Early stopping at epoch 550. Best Metrics: (0.004338996349109476, 0.0010625868384489077, 0.002686296832221596)
2026-06-23 13:21:07,267 - optuna.study.study - INFO - Trial 21 finished with values: [0.004338996349109476, 0.0010625868384489077, 0.002686296832221596] and parameters: {'n_layers': 1, 'embedding_dim': 64, 'lr': 0.025635014530483304, 'lambda_val': 0.03612178913805228, 'batch_size': 1105, 'optimizer': 'Adam'}.
2026-06-23 13:21:37,398 - experiment_functions - INFO - Early stopping at epoch 700. Best Metrics: (0.0032892135169725165, 0.0007594417077175698, 0.0018021946782581406)
2026-06-23 13:21:37,534 - optuna.study.study - INFO - Trial 22 finished with values: [0.0032892135169725165, 0.0007594417077175698, 0.0018021946782581406] and parameters: {'n_layers': 1, 'embedding_dim': 32, 'lr': 0.04483389274350463, 'lambda_val': 0.05360081450817667, 'batch_size': 3626, 'optimizer': 'Adam'}.
2026-06-23 13:22:00,294 - experiment_functions - INFO - Early stopping at epoch 500. Best Metrics: (0.000492854020181494, 0.00010578501957812304, 0.00029839378099961935)
2026-06-23 13:22:00,395 - optuna.study.study - INFO - Trial 23 finished with values: [0.000492854020181494, 0.00010578501957812304, 0.00029839378099961935] and parameters: {'n_layers': 1, 'embedding_dim': 96, 'lr': 0.00013161373483288412, 'lambda_val': 0.00398752859988433, 'batch_size': 1009, 'optimizer': 'SGD'}.
2026-06-23 13:25:04,547 - optuna.study.study - INFO - Trial 24 finished with values: [0.013025236941440779, 0.0027583049134773273, 0.00707375844713304] and parameters: {'n_layers': 2, 'embedding_dim': 128, 'lr': 0.04824394736006866, 'lambda_val': 0.00039901786521084486, 'batch_size': 2166, 'optimizer': 'RMSprop'}.
2026-06-23 13:26:02,380 - experiment_functions - INFO - Early stopping at epoch 1350. Best Metrics: (0.03319441698262135, 0.006923392699254769, 0.019238869398148124)
2026-06-23 13:26:02,479 - optuna.study.study - INFO - Trial 25 finished with values: [0.03319441698262135, 0.006923392699254769, 0.019238869398148124] and parameters: {'n_layers': 1, 'embedding_dim': 32, 'lr': 0.002325780134520749, 'lambda_val': 1.557991893656709e-05, 'batch_size': 2066, 'optimizer': 'Adam'}.
2026-06-23 13:28:23,128 - experiment_functions - INFO - Early stopping at epoch 3450. Best Metrics: (0.009139525082275071, 0.001967285587975243, 0.005067946033946582)
2026-06-23 13:28:23,228 - optuna.study.study - INFO - Trial 26 finished with values: [0.009139525082275071, 0.001967285587975243, 0.005067946033946582] and parameters: {'n_layers': 2, 'embedding_dim': 32, 'lr': 0.0052160399812129, 'lambda_val': 5.8886003235134964e-05, 'batch_size': 559, 'optimizer': 'Adam'}.
2026-06-23 13:28:46,243 - experiment_functions - INFO - Early stopping at epoch 500. Best Metrics: (0.0005096075629718763, 0.00011525830491347733, 0.0002874528848754083)
2026-06-23 13:28:46,348 - optuna.study.study - INFO - Trial 27 finished with values: [0.0005096075629718763, 0.00011525830491347733, 0.0002874528848754083] and parameters: {'n_layers': 2, 'embedding_dim': 64, 'lr': 5.650692969852866e-05, 'lambda_val': 6.499156309956539e-05, 'batch_size': 2257, 'optimizer': 'SGD'}.
2026-06-23 13:29:11,959 - experiment_functions - INFO - Early stopping at epoch 550. Best Metrics: (0.00366806267622493, 0.0008857521788556272, 0.0020161569118040718)
2026-06-23 13:29:12,061 - optuna.study.study - INFO - Trial 28 finished with values: [0.00366806267622493, 0.0008857521788556272, 0.0020161569118040718] and parameters: {'n_layers': 2, 'embedding_dim': 64, 'lr': 0.013256375555606043, 'lambda_val': 0.023244192276725934, 'batch_size': 2624, 'optimizer': 'Adam'}.
2026-06-23 13:29:37,534 - experiment_functions - INFO - Early stopping at epoch 500. Best Metrics: (0.0006177298863121535, 0.00014525704180876596, 0.0003256183523047188)
2026-06-23 13:29:37,850 - optuna.study.study - INFO - Trial 29 finished with values: [0.0006177298863121535, 0.00014525704180876596, 0.0003256183523047188] and parameters: {'n_layers': 1, 'embedding_dim': 256, 'lr': 0.006715212965817361, 'lambda_val': 2.104436035624434e-06, 'batch_size': 3612, 'optimizer': 'SGD'}.
2026-06-23 13:30:27,756 - experiment_functions - INFO - Early stopping at epoch 1050. Best Metrics: (0.007662088524244783, 0.001588354174561071, 0.004486859956870356)
2026-06-23 13:30:27,862 - optuna.study.study - INFO - Trial 30 finished with values: [0.007662088524244783, 0.001588354174561071, 0.004486859956870356] and parameters: {'n_layers': 4, 'embedding_dim': 64, 'lr': 0.02081576615660541, 'lambda_val': 2.2193936702628317e-05, 'batch_size': 1598, 'optimizer': 'Adam'}.
2026-06-23 13:30:50,948 - experiment_functions - INFO - Early stopping at epoch 500. Best Metrics: (0.0005916242165148426, 0.00012788935202728306, 0.00031781438711935)
2026-06-23 13:30:51,049 - optuna.study.study - INFO - Trial 31 finished with values: [0.0005916242165148426, 0.00012788935202728306, 0.00031781438711935] and parameters: {'n_layers': 1, 'embedding_dim': 96, 'lr': 3.0107547359607802e-05, 'lambda_val': 0.015320144850357294, 'batch_size': 2334, 'optimizer': 'Adam'}.
2026-06-23 13:31:13,389 - experiment_functions - INFO - Early stopping at epoch 500. Best Metrics: (0.0005024960580595838, 0.00011999494758115448, 0.0002807376143732867)
2026-06-23 13:31:13,489 - optuna.study.study - INFO - Trial 32 finished with values: [0.0005024960580595838, 0.00011999494758115448, 0.0002807376143732867] and parameters: {'n_layers': 1, 'embedding_dim': 32, 'lr': 0.009018000006041901, 'lambda_val': 0.011062186351904086, 'batch_size': 1568, 'optimizer': 'SGD'}.
2026-06-23 13:31:37,741 - experiment_functions - INFO - Early stopping at epoch 500. Best Metrics: (0.0004450287557051016, 0.0001121005431350259, 0.0002661588212407191)
2026-06-23 13:31:37,848 - optuna.study.study - INFO - Trial 33 finished with values: [0.0004450287557051016, 0.0001121005431350259, 0.0002661588212407191] and parameters: {'n_layers': 2, 'embedding_dim': 96, 'lr': 4.040353034766622e-05, 'lambda_val': 0.001745879667291885, 'batch_size': 3507, 'optimizer': 'RMSprop'}.
2026-06-23 13:34:15,441 - optuna.study.study - INFO - Trial 34 finished with values: [0.0008197736419692723, 0.00016736137425792601, 0.0004429085036550158] and parameters: {'n_layers': 1, 'embedding_dim': 32, 'lr': 0.00020536254429948298, 'lambda_val': 8.06500889018782e-06, 'batch_size': 2219, 'optimizer': 'RMSprop'}.
2026-06-23 13:34:46,384 - experiment_functions - INFO - Early stopping at epoch 500. Best Metrics: (0.00040820102540414, 9.789061513199444e-05, 0.0002116624038234714)
2026-06-23 13:34:46,504 - optuna.study.study - INFO - Trial 35 finished with values: [0.00040820102540414, 9.789061513199444e-05, 0.0002116624038234714] and parameters: {'n_layers': 3, 'embedding_dim': 256, 'lr': 1.8942422429509757e-05, 'lambda_val': 2.1611236564493605e-06, 'batch_size': 1944, 'optimizer': 'SGD'}.
2026-06-23 13:35:48,268 - experiment_functions - INFO - Early stopping at epoch 1000. Best Metrics: (0.019130856079897354, 0.00416193002399899, 0.011061922987707808)
2026-06-23 13:35:48,381 - optuna.study.study - INFO - Trial 36 finished with values: [0.019130856079897354, 0.00416193002399899, 0.011061922987707808] and parameters: {'n_layers': 3, 'embedding_dim': 256, 'lr': 0.000639302768855693, 'lambda_val': 3.2030570334749084e-05, 'batch_size': 1972, 'optimizer': 'RMSprop'}.
2026-06-23 13:36:10,623 - experiment_functions - INFO - Early stopping at epoch 500. Best Metrics: (0.0005534512210852846, 0.00012631047113805733, 0.0002782749379665113)
2026-06-23 13:36:10,707 - optuna.study.study - INFO - Trial 37 finished with values: [0.0005534512210852846, 0.00012631047113805733, 0.0002782749379665113] and parameters: {'n_layers': 1, 'embedding_dim': 32, 'lr': 8.561834408009964e-05, 'lambda_val': 1.1834765337479065e-06, 'batch_size': 1898, 'optimizer': 'SGD'}.
2026-06-23 13:36:33,627 - experiment_functions - INFO - Early stopping at epoch 500. Best Metrics: (0.0005782984594347438, 0.00011841606669192877, 0.000293556141093287)
2026-06-23 13:36:33,699 - optuna.study.study - INFO - Trial 38 finished with values: [0.0005782984594347438, 0.00011841606669192877, 0.000293556141093287] and parameters: {'n_layers': 1, 'embedding_dim': 96, 'lr': 0.0008513302898513469, 'lambda_val': 0.0008465289221707489, 'batch_size': 1694, 'optimizer': 'SGD'}.
2026-06-23 13:36:57,725 - experiment_functions - INFO - Early stopping at epoch 500. Best Metrics: (0.0005926427476156369, 0.00014209928003031453, 0.0003353591159511652)
2026-06-23 13:36:57,803 - optuna.study.study - INFO - Trial 39 finished with values: [0.0005926427476156369, 0.00014209928003031453, 0.0003353591159511652] and parameters: {'n_layers': 2, 'embedding_dim': 96, 'lr': 0.007110990523484289, 'lambda_val': 0.00018544932893785581, 'batch_size': 2283, 'optimizer': 'SGD'}.
2026-06-23 13:39:52,490 - optuna.study.study - INFO - Trial 40 finished with values: [0.0005426536639571561, 0.00015473032714412026, 0.0003452879390304046] and parameters: {'n_layers': 3, 'embedding_dim': 64, 'lr': 4.640401381994786e-05, 'lambda_val': 2.8960212086183194e-06, 'batch_size': 3692, 'optimizer': 'RMSprop'}.
2026-06-23 13:40:20,219 - experiment_functions - INFO - Early stopping at epoch 500. Best Metrics: (0.0004574534818225392, 9.631173424276874e-05, 0.00023684324610628944)
2026-06-23 13:40:20,298 - optuna.study.study - INFO - Trial 41 finished with values: [0.0004574534818225392, 9.631173424276874e-05, 0.00023684324610628944] and parameters: {'n_layers': 4, 'embedding_dim': 128, 'lr': 0.00700017097440491, 'lambda_val': 0.005909912546595093, 'batch_size': 3036, 'optimizer': 'SGD'}.
2026-06-23 13:42:10,361 - experiment_functions - INFO - Early stopping at epoch 2550. Best Metrics: (0.007221919532165246, 0.0014967790829859796, 0.003972077613391345)
2026-06-23 13:42:10,445 - optuna.study.study - INFO - Trial 42 finished with values: [0.007221919532165246, 0.0014967790829859796, 0.003972077613391345] and parameters: {'n_layers': 4, 'embedding_dim': 32, 'lr': 0.036271346599532954, 'lambda_val': 0.0004020367653384255, 'batch_size': 3812, 'optimizer': 'RMSprop'}.
2026-06-23 13:42:44,079 - experiment_functions - INFO - Early stopping at epoch 500. Best Metrics: (0.000501907175473588, 0.00011052166224580017, 0.0002776336727816119)
2026-06-23 13:42:44,461 - optuna.study.study - INFO - Trial 43 finished with values: [0.000501907175473588, 0.00011052166224580017, 0.0002776336727816119] and parameters: {'n_layers': 4, 'embedding_dim': 256, 'lr': 1.1262409315922172e-05, 'lambda_val': 1.1763837979418789e-06, 'batch_size': 1361, 'optimizer': 'SGD'}.
2026-06-23 13:43:10,918 - experiment_functions - INFO - Early stopping at epoch 500. Best Metrics: (0.00048380081597191145, 0.00012631047113805736, 0.00032148844925498655)
2026-06-23 13:43:11,009 - optuna.study.study - INFO - Trial 44 finished with values: [0.00048380081597191145, 0.00012631047113805736, 0.00032148844925498655] and parameters: {'n_layers': 4, 'embedding_dim': 96, 'lr': 1.2019675230063569e-05, 'lambda_val': 0.05642129780577218, 'batch_size': 1096, 'optimizer': 'Adam'}.
2026-06-23 13:43:38,138 - experiment_functions - INFO - Early stopping at epoch 550. Best Metrics: (0.003592791712086026, 0.0007389162561576355, 0.0019372833000063925)
2026-06-23 13:43:38,226 - optuna.study.study - INFO - Trial 45 finished with values: [0.003592791712086026, 0.0007389162561576355, 0.0019372833000063925] and parameters: {'n_layers': 4, 'embedding_dim': 64, 'lr': 0.058972767143000024, 'lambda_val': 0.002247784905654037, 'batch_size': 1717, 'optimizer': 'Adam'}.
2026-06-23 13:44:00,015 - experiment_functions - INFO - Early stopping at epoch 500. Best Metrics: (0.0005098501078560593, 0.00011525830491347733, 0.0002810808190177784)
2026-06-23 13:44:00,090 - optuna.study.study - INFO - Trial 46 finished with values: [0.0005098501078560593, 0.00011525830491347733, 0.0002810808190177784] and parameters: {'n_layers': 1, 'embedding_dim': 32, 'lr': 0.00018876771248095393, 'lambda_val': 0.002898407729744049, 'batch_size': 2159, 'optimizer': 'SGD'}.
2026-06-23 13:47:18,715 - optuna.study.study - INFO - Trial 47 finished with values: [0.007386893052323668, 0.0016736137425792598, 0.004294573608753074] and parameters: {'n_layers': 4, 'embedding_dim': 96, 'lr': 9.54878627627061e-05, 'lambda_val': 2.81648349492558e-05, 'batch_size': 2872, 'optimizer': 'Adam'}.
2026-06-23 13:47:45,668 - experiment_functions - INFO - Early stopping at epoch 500. Best Metrics: (0.0004942291257569422, 0.00011999494758115447, 0.0002530109949595796)
2026-06-23 13:47:45,771 - optuna.study.study - INFO - Trial 48 finished with values: [0.0004942291257569422, 0.00011999494758115447, 0.0002530109949595796] and parameters: {'n_layers': 1, 'embedding_dim': 256, 'lr': 0.012739706321161792, 'lambda_val': 3.1181409672203094e-06, 'batch_size': 2912, 'optimizer': 'SGD'}.
2026-06-23 13:50:39,286 - optuna.study.study - INFO - Trial 49 finished with values: [0.007813040071212444, 0.0019041303524062146, 0.004906073798793866] and parameters: {'n_layers': 1, 'embedding_dim': 128, 'lr': 0.00030878795427160974, 'lambda_val': 0.0002763636855160012, 'batch_size': 3860, 'optimizer': 'Adam'}.
2026-06-23 13:51:06,211 - experiment_functions - INFO - Early stopping at epoch 550. Best Metrics: (0.0004191851961615414, 0.00011367942402425163, 0.00023207455778253327)
2026-06-23 13:51:06,302 - optuna.study.study - INFO - Trial 50 finished with values: [0.0004191851961615414, 0.00011367942402425163, 0.00023207455778253327] and parameters: {'n_layers': 4, 'embedding_dim': 64, 'lr': 3.0107547359607802e-05, 'lambda_val': 0.015320144850357294, 'batch_size': 3839, 'optimizer': 'RMSprop'}.
2026-06-23 13:51:29,917 - experiment_functions - INFO - Early stopping at epoch 500. Best Metrics: (0.0005785959562513724, 0.00013578375647341166, 0.0003133267269912121)
2026-06-23 13:51:30,002 - optuna.study.study - INFO - Trial 51 finished with values: [0.0005785959562513724, 0.00013578375647341166, 0.0003133267269912121] and parameters: {'n_layers': 3, 'embedding_dim': 64, 'lr': 0.00018876771248095393, 'lambda_val': 0.002898407729744049, 'batch_size': 2159, 'optimizer': 'SGD'}.
2026-06-23 13:52:12,175 - experiment_functions - INFO - Early stopping at epoch 850. Best Metrics: (0.0004589076030255623, 0.00010262725779967159, 0.00025517008388317356)
2026-06-23 13:52:12,271 - optuna.study.study - INFO - Trial 52 finished with values: [0.0004589076030255623, 0.00010262725779967159, 0.00025517008388317356] and parameters: {'n_layers': 1, 'embedding_dim': 256, 'lr': 8.720509642670041e-05, 'lambda_val': 3.1181409672203094e-06, 'batch_size': 2911, 'optimizer': 'RMSprop'}.
2026-06-23 13:52:40,166 - experiment_functions - INFO - Early stopping at epoch 500. Best Metrics: (0.0005211770073454742, 0.00012473159024883163, 0.00028770602522285385)
2026-06-23 13:52:40,267 - optuna.study.study - INFO - Trial 53 finished with values: [0.0005211770073454742, 0.00012473159024883163, 0.00028770602522285385] and parameters: {'n_layers': 4, 'embedding_dim': 128, 'lr': 0.0005942358034592854, 'lambda_val': 0.0009179871154727713, 'batch_size': 2421, 'optimizer': 'SGD'}.
2026-06-23 13:53:05,691 - experiment_functions - INFO - Early stopping at epoch 550. Best Metrics: (0.00041889902430341874, 0.0001121005431350259, 0.00023592317595933854)
2026-06-23 13:53:05,785 - optuna.study.study - INFO - Trial 54 finished with values: [0.00041889902430341874, 0.0001121005431350259, 0.00023592317595933854] and parameters: {'n_layers': 1, 'embedding_dim': 128, 'lr': 0.00025028576946188884, 'lambda_val': 0.010784740681855899, 'batch_size': 1568, 'optimizer': 'RMSprop'}.
2026-06-23 13:53:29,983 - experiment_functions - INFO - Early stopping at epoch 550. Best Metrics: (0.0037465644978207585, 0.001008904888215233, 0.0023260271592438916)
2026-06-23 13:53:30,082 - optuna.study.study - INFO - Trial 55 finished with values: [0.0037465644978207585, 0.001008904888215233, 0.0023260271592438916] and parameters: {'n_layers': 1, 'embedding_dim': 32, 'lr': 0.025635014530483304, 'lambda_val': 0.03612178913805228, 'batch_size': 1105, 'optimizer': 'Adam'}.
2026-06-23 13:53:58,443 - experiment_functions - INFO - Early stopping at epoch 650. Best Metrics: (0.0005301366138635499, 0.0001215738284703802, 0.0002960055524788621)
2026-06-23 13:53:58,525 - optuna.study.study - INFO - Trial 56 finished with values: [0.0005301366138635499, 0.0001215738284703802, 0.0002960055524788621] and parameters: {'n_layers': 2, 'embedding_dim': 32, 'lr': 2.1962741941544302e-05, 'lambda_val': 4.514960179682276e-05, 'batch_size': 1517, 'optimizer': 'Adam'}.
2026-06-23 13:54:21,685 - experiment_functions - INFO - Early stopping at epoch 500. Best Metrics: (0.00044825675725862973, 9.473285335354302e-05, 0.00027194706957227755)
