2026-06-23 12:04:58,240 - optuna.study.study - INFO - Trial 263 finished with values: [0.030723210183335736, 0.0064039408866995075, 0.017428235261454872] and parameters: {'n_layers': 1, 'embedding_dim': 96, 'lr': 0.0016017140638771422, 'lambda_val': 1.033711147166284e-06, 'batch_size': 3806, 'optimizer': 'RMSprop'}.
2026-06-23 12:07:24,500 - experiment_functions - INFO - Early stopping at epoch 3250. Best Metrics: (0.034939696264766534, 0.007352848301124162, 0.019606622652481462)
2026-06-23 12:07:24,619 - optuna.study.study - INFO - Trial 264 finished with values: [0.034939696264766534, 0.007352848301124162, 0.019606622652481462] and parameters: {'n_layers': 1, 'embedding_dim': 128, 'lr': 0.0008834137156031282, 'lambda_val': 3.447042784972302e-05, 'batch_size': 3129, 'optimizer': 'RMSprop'}.
2026-06-23 12:08:13,714 - experiment_functions - INFO - Early stopping at epoch 1050. Best Metrics: (0.03198835139818143, 0.006735505873436909, 0.018653800884179495)
2026-06-23 12:08:13,816 - optuna.study.study - INFO - Trial 265 finished with values: [0.03198835139818143, 0.006735505873436909, 0.018653800884179495] and parameters: {'n_layers': 1, 'embedding_dim': 128, 'lr': 0.0016017140638771422, 'lambda_val': 0.0001268815967640493, 'batch_size': 3253, 'optimizer': 'Adam'}.
2026-06-23 12:09:22,248 - experiment_functions - INFO - Early stopping at epoch 1500. Best Metrics: (0.031376896823142625, 0.006667613995200202, 0.017693670317757933)
2026-06-23 12:09:22,378 - optuna.study.study - INFO - Trial 266 finished with values: [0.031376896823142625, 0.006667613995200202, 0.017693670317757933] and parameters: {'n_layers': 1, 'embedding_dim': 128, 'lr': 0.0008906516956334841, 'lambda_val': 0.0010657666266185159, 'batch_size': 3489, 'optimizer': 'RMSprop'}.
2026-06-23 12:09:57,265 - experiment_functions - INFO - Early stopping at epoch 700. Best Metrics: (0.016612938800641474, 0.0036424782114437286, 0.00894068415722627)
2026-06-23 12:09:58,120 - optuna.study.study - INFO - Trial 267 finished with values: [0.016612938800641474, 0.0036424782114437286, 0.00894068415722627] and parameters: {'n_layers': 3, 'embedding_dim': 96, 'lr': 0.0008834137156031282, 'lambda_val': 0.0027380357457200996, 'batch_size': 3426, 'optimizer': 'RMSprop'}.
2026-06-23 12:12:49,267 - optuna.study.study - INFO - Trial 268 finished with values: [0.0010350442455725358, 0.0002415687760515347, 0.0005833743210832479] and parameters: {'n_layers': 1, 'embedding_dim': 128, 'lr': 0.00026234384143979637, 'lambda_val': 3.447042784972302e-05, 'batch_size': 1760, 'optimizer': 'Adam'}.
2026-06-23 12:15:40,233 - optuna.study.study - INFO - Trial 269 finished with values: [0.03123680164331486, 0.006711822660098523, 0.017882861753733693] and parameters: {'n_layers': 1, 'embedding_dim': 64, 'lr': 0.0008873329418261425, 'lambda_val': 0.0001268815967640493, 'batch_size': 1760, 'optimizer': 'Adam'}.
2026-06-23 12:16:03,636 - experiment_functions - INFO - Early stopping at epoch 500. Best Metrics: (0.00047985477624035573, 0.00011052166224580018, 0.0002785589195173522)
2026-06-23 12:16:03,741 - optuna.study.study - INFO - Trial 270 finished with values: [0.00047985477624035573, 0.00011052166224580018, 0.0002785589195173522] and parameters: {'n_layers': 1, 'embedding_dim': 128, 'lr': 1.5053931190496522e-05, 'lambda_val': 0.0010657666266185159, 'batch_size': 2100, 'optimizer': 'SGD'}.
2026-06-23 12:16:41,034 - experiment_functions - INFO - Early stopping at epoch 800. Best Metrics: (0.029403585231527914, 0.0063281546040166725, 0.016950796155388092)
2026-06-23 12:16:41,141 - optuna.study.study - INFO - Trial 271 finished with values: [0.029403585231527914, 0.0063281546040166725, 0.016950796155388092] and parameters: {'n_layers': 1, 'embedding_dim': 96, 'lr': 0.0014237233114405305, 'lambda_val': 0.0010657666266185159, 'batch_size': 4051, 'optimizer': 'RMSprop'}.
2026-06-23 12:17:04,676 - experiment_functions - INFO - Early stopping at epoch 500. Best Metrics: (0.0006552023885528953, 0.00014525704180876596, 0.00035862564957206134)
2026-06-23 12:17:04,779 - optuna.study.study - INFO - Trial 272 finished with values: [0.0006552023885528953, 0.00014525704180876596, 0.00035862564957206134] and parameters: {'n_layers': 1, 'embedding_dim': 128, 'lr': 0.0008906516956334841, 'lambda_val': 0.0010657666266185159, 'batch_size': 3253, 'optimizer': 'SGD'}.
2026-06-23 12:20:15,597 - optuna.study.study - INFO - Trial 273 finished with values: [0.028894788189486063, 0.006227106227106227, 0.016207239389425077] and parameters: {'n_layers': 2, 'embedding_dim': 128, 'lr': 0.00037748801596819556, 'lambda_val': 0.0006793861457506547, 'batch_size': 3090, 'optimizer': 'Adam'}.
2026-06-23 12:21:09,071 - experiment_functions - INFO - Early stopping at epoch 1150. Best Metrics: (0.03181818924400236, 0.006640773020083365, 0.018371151481755943)
2026-06-23 12:21:09,195 - optuna.study.study - INFO - Trial 274 finished with values: [0.03181818924400236, 0.006640773020083365, 0.018371151481755943] and parameters: {'n_layers': 1, 'embedding_dim': 128, 'lr': 0.0016017140638771422, 'lambda_val': 3.447042784972302e-05, 'batch_size': 3426, 'optimizer': 'Adam'}.
2026-06-23 12:24:34,936 - experiment_functions - INFO - Early stopping at epoch 3750. Best Metrics: (0.029864982930081725, 0.006389730958696476, 0.01712267948470222)
2026-06-23 12:24:35,039 - optuna.study.study - INFO - Trial 275 finished with values: [0.029864982930081725, 0.006389730958696476, 0.01712267948470222] and parameters: {'n_layers': 2, 'embedding_dim': 256, 'lr': 0.00037748801596819556, 'lambda_val': 1.5553043024267715e-06, 'batch_size': 2813, 'optimizer': 'RMSprop'}.
2026-06-23 12:25:28,772 - experiment_functions - INFO - Early stopping at epoch 1150. Best Metrics: (0.03302533238347494, 0.006956549197928508, 0.01886809706739036)
2026-06-23 12:25:28,879 - optuna.study.study - INFO - Trial 276 finished with values: [0.03302533238347494, 0.006956549197928508, 0.01886809706739036] and parameters: {'n_layers': 1, 'embedding_dim': 128, 'lr': 0.0016017140638771422, 'lambda_val': 3.447042784972302e-05, 'batch_size': 3426, 'optimizer': 'Adam'}.
2026-06-23 12:26:07,261 - experiment_functions - INFO - Early stopping at epoch 850. Best Metrics: (0.017060476118181924, 0.0035493242389794117, 0.009568309348712228)
2026-06-23 12:26:07,362 - optuna.study.study - INFO - Trial 277 finished with values: [0.017060476118181924, 0.0035493242389794117, 0.009568309348712228] and parameters: {'n_layers': 3, 'embedding_dim': 32, 'lr': 0.0016017140638771422, 'lambda_val': 1.033711147166284e-06, 'batch_size': 3129, 'optimizer': 'RMSprop'}.
2026-06-23 12:26:33,407 - experiment_functions - INFO - Early stopping at epoch 550. Best Metrics: (0.021581361288520746, 0.004629278767209802, 0.012675314043320078)
2026-06-23 12:26:33,509 - optuna.study.study - INFO - Trial 278 finished with values: [0.021581361288520746, 0.004629278767209802, 0.012675314043320078] and parameters: {'n_layers': 1, 'embedding_dim': 96, 'lr': 0.014736220479245915, 'lambda_val': 1.033711147166284e-06, 'batch_size': 3009, 'optimizer': 'Adam'}.
2026-06-23 12:27:23,522 - experiment_functions - INFO - Early stopping at epoch 1150. Best Metrics: (0.030570910895776626, 0.006522356953391436, 0.017231159216142412)
2026-06-23 12:27:23,640 - optuna.study.study - INFO - Trial 279 finished with values: [0.030570910895776626, 0.006522356953391436, 0.017231159216142412] and parameters: {'n_layers': 1, 'embedding_dim': 32, 'lr': 0.0016017140638771422, 'lambda_val': 0.0010657666266185159, 'batch_size': 2100, 'optimizer': 'RMSprop'}.
2026-06-23 12:28:38,652 - experiment_functions - INFO - Early stopping at epoch 1800. Best Metrics: (0.0006477144406903016, 0.0001373626373626374, 0.00029642919913317237)
2026-06-23 12:28:38,754 - optuna.study.study - INFO - Trial 280 finished with values: [0.0006477144406903016, 0.0001373626373626374, 0.00029642919913317237] and parameters: {'n_layers': 1, 'embedding_dim': 64, 'lr': 7.934672275386618e-05, 'lambda_val': 3.447042784972302e-05, 'batch_size': 2469, 'optimizer': 'RMSprop'}.
2026-06-23 12:29:03,364 - experiment_functions - INFO - Early stopping at epoch 550. Best Metrics: (0.003830592836270788, 0.0009441707717569787, 0.002217056095690775)
2026-06-23 12:29:03,467 - optuna.study.study - INFO - Trial 281 finished with values: [0.003830592836270788, 0.0009441707717569787, 0.002217056095690775] and parameters: {'n_layers': 1, 'embedding_dim': 32, 'lr': 0.059371322060708644, 'lambda_val': 4.06288805317975e-05, 'batch_size': 3129, 'optimizer': 'RMSprop'}.
2026-06-23 12:31:58,982 - optuna.study.study - INFO - Trial 282 finished with values: [0.03595245651793585, 0.00743179234558545, 0.02041535550666169] and parameters: {'n_layers': 1, 'embedding_dim': 96, 'lr': 0.0008873329418261425, 'lambda_val': 0.0001268815967640493, 'batch_size': 1760, 'optimizer': 'RMSprop'}.
2026-06-23 12:35:09,216 - experiment_functions - INFO - Early stopping at epoch 3800. Best Metrics: (0.03545948902400336, 0.007210749021093849, 0.02014594174137361)
2026-06-23 12:35:09,320 - optuna.study.study - INFO - Trial 283 finished with values: [0.03545948902400336, 0.007210749021093849, 0.02014594174137361] and parameters: {'n_layers': 1, 'embedding_dim': 256, 'lr': 0.0008873329418261425, 'lambda_val': 0.0001268815967640493, 'batch_size': 3253, 'optimizer': 'Adam'}.
2026-06-23 12:37:58,703 - optuna.study.study - INFO - Trial 284 finished with values: [0.03220359622149891, 0.006894972843248706, 0.018280556495460884] and parameters: {'n_layers': 1, 'embedding_dim': 32, 'lr': 0.0008906516956334841, 'lambda_val': 3.447042784972302e-05, 'batch_size': 3129, 'optimizer': 'Adam'}.
2026-06-23 12:38:22,490 - experiment_functions - INFO - Early stopping at epoch 500. Best Metrics: (0.0005313213032362439, 0.00011841606669192877, 0.00026826353019249644)
2026-06-23 12:38:22,608 - optuna.study.study - INFO - Trial 285 finished with values: [0.0005313213032362439, 0.00011841606669192877, 0.00026826353019249644] and parameters: {'n_layers': 1, 'embedding_dim': 128, 'lr': 0.0008906516956334841, 'lambda_val': 3.447042784972302e-05, 'batch_size': 3129, 'optimizer': 'SGD'}.
2026-06-23 12:41:21,282 - optuna.study.study - INFO - Trial 286 finished with values: [0.03055429037930063, 0.006643930781861817, 0.017750994313284373] and parameters: {'n_layers': 1, 'embedding_dim': 128, 'lr': 0.0008906516956334841, 'lambda_val': 0.0010657666266185159, 'batch_size': 1216, 'optimizer': 'Adam'}.
2026-06-23 12:42:55,196 - experiment_functions - INFO - Early stopping at epoch 2050. Best Metrics: (0.03253167175202362, 0.006876026272577998, 0.01842238287132924)
2026-06-23 12:42:55,300 - optuna.study.study - INFO - Trial 287 finished with values: [0.03253167175202362, 0.006876026272577998, 0.01842238287132924] and parameters: {'n_layers': 1, 'embedding_dim': 128, 'lr': 0.0008906516956334841, 'lambda_val': 0.0010657666266185159, 'batch_size': 3426, 'optimizer': 'Adam'}.
2026-06-23 12:43:22,025 - experiment_functions - INFO - Early stopping at epoch 550. Best Metrics: (0.022595061751724568, 0.004870847543261336, 0.013027973059427801)
2026-06-23 12:43:22,159 - optuna.study.study - INFO - Trial 288 finished with values: [0.022595061751724568, 0.004870847543261336, 0.013027973059427801] and parameters: {'n_layers': 1, 'embedding_dim': 128, 'lr': 0.011923860768746096, 'lambda_val': 0.0012833571829398344, 'batch_size': 3426, 'optimizer': 'Adam'}.
2026-06-23 12:44:11,982 - experiment_functions - INFO - Early stopping at epoch 1050. Best Metrics: (0.03229734619746977, 0.006809713275230517, 0.018084826872668505)
2026-06-23 12:44:12,111 - optuna.study.study - INFO - Trial 289 finished with values: [0.03229734619746977, 0.006809713275230517, 0.018084826872668505] and parameters: {'n_layers': 1, 'embedding_dim': 128, 'lr': 0.0016017140638771422, 'lambda_val': 3.583598566312274e-05, 'batch_size': 3397, 'optimizer': 'Adam'}.
2026-06-23 12:46:26,238 - experiment_functions - INFO - Early stopping at epoch 2950. Best Metrics: (0.03202166640903306, 0.006844448654793482, 0.018438959972112604)
2026-06-23 12:46:26,358 - optuna.study.study - INFO - Trial 290 finished with values: [0.03202166640903306, 0.006844448654793482, 0.018438959972112604] and parameters: {'n_layers': 1, 'embedding_dim': 128, 'lr': 0.0008906516956334841, 'lambda_val': 0.0010657666266185159, 'batch_size': 3253, 'optimizer': 'Adam'}.
2026-06-23 12:47:04,033 - experiment_functions - INFO - Early stopping at epoch 700. Best Metrics: (0.019774980870183978, 0.004210875331564987, 0.010830636072539033)
2026-06-23 12:47:04,133 - optuna.study.study - INFO - Trial 291 finished with values: [0.019774980870183978, 0.004210875331564987, 0.010830636072539033] and parameters: {'n_layers': 3, 'embedding_dim': 128, 'lr': 0.0013564776239747723, 'lambda_val': 3.447042784972302e-05, 'batch_size': 3426, 'optimizer': 'Adam'}.
2026-06-23 12:47:48,928 - experiment_functions - INFO - Early stopping at epoch 850. Best Metrics: (0.020991533830046896, 0.004442970822281168, 0.01182190230955885)
2026-06-23 12:47:49,028 - optuna.study.study - INFO - Trial 292 finished with values: [0.020991533830046896, 0.004442970822281168, 0.01182190230955885] and parameters: {'n_layers': 4, 'embedding_dim': 96, 'lr': 0.0008834137156031282, 'lambda_val': 3.447042784972302e-05, 'batch_size': 3007, 'optimizer': 'Adam'}.
2026-06-23 12:50:06,994 - experiment_functions - INFO - Early stopping at epoch 3100. Best Metrics: (0.035003234621270106, 0.007381268157130226, 0.020061817809125554)
2026-06-23 12:50:07,105 - optuna.study.study - INFO - Trial 293 finished with values: [0.035003234621270106, 0.007381268157130226, 0.020061817809125554] and parameters: {'n_layers': 1, 'embedding_dim': 96, 'lr': 0.0008834137156031282, 'lambda_val': 3.447042784972302e-05, 'batch_size': 3426, 'optimizer': 'Adam'}.
2026-06-23 12:50:30,179 - experiment_functions - INFO - Early stopping at epoch 500. Best Metrics: (0.0006243934516017438, 0.00012315270935960593, 0.0003275580842861695)
2026-06-23 12:50:30,280 - optuna.study.study - INFO - Trial 294 finished with values: [0.0006243934516017438, 0.00012315270935960593, 0.0003275580842861695] and parameters: {'n_layers': 1, 'embedding_dim': 64, 'lr': 0.0024861194796259945, 'lambda_val': 0.0010657666266185159, 'batch_size': 3253, 'optimizer': 'SGD'}.
2026-06-23 12:53:28,570 - optuna.study.study - INFO - Trial 295 finished with values: [0.03481726818521357, 0.00729127194644436, 0.01990532762199635] and parameters: {'n_layers': 1, 'embedding_dim': 96, 'lr': 0.0008873329418261425, 'lambda_val': 2.773307388606753e-05, 'batch_size': 3397, 'optimizer': 'Adam'}.
2026-06-23 12:54:15,758 - experiment_functions - INFO - Early stopping at epoch 1000. Best Metrics: (0.032093142776741274, 0.006762346848553746, 0.018209573062327476)
2026-06-23 12:54:15,865 - optuna.study.study - INFO - Trial 296 finished with values: [0.032093142776741274, 0.006762346848553746, 0.018209573062327476] and parameters: {'n_layers': 1, 'embedding_dim': 128, 'lr': 0.0016017140638771422, 'lambda_val': 0.0010657666266185159, 'batch_size': 3129, 'optimizer': 'Adam'}.
2026-06-23 12:55:51,584 - experiment_functions - INFO - Early stopping at epoch 2100. Best Metrics: (0.03374777339829613, 0.006986547934823797, 0.01905997030086053)
2026-06-23 12:55:51,694 - optuna.study.study - INFO - Trial 297 finished with values: [0.03374777339829613, 0.006986547934823797, 0.01905997030086053] and parameters: {'n_layers': 1, 'embedding_dim': 128, 'lr': 0.0016017140638771422, 'lambda_val': 2.585343072688519e-05, 'batch_size': 1515, 'optimizer': 'Adam'}.
2026-06-23 12:56:39,947 - experiment_functions - INFO - Early stopping at epoch 1050. Best Metrics: (0.03072064799713133, 0.0065081470253884055, 0.017680764194942095)
2026-06-23 12:56:40,051 - optuna.study.study - INFO - Trial 298 finished with values: [0.03072064799713133, 0.0065081470253884055, 0.017680764194942095] and parameters: {'n_layers': 1, 'embedding_dim': 96, 'lr': 0.0016017140638771422, 'lambda_val': 5.002652391217108e-06, 'batch_size': 2100, 'optimizer': 'RMSprop'}.
2026-06-23 12:57:08,475 - experiment_functions - INFO - Early stopping at epoch 600. Best Metrics: (0.01843614112674251, 0.004075091575091575, 0.010435732139694188)
2026-06-23 12:57:08,577 - optuna.study.study - INFO - Trial 299 finished with values: [0.01843614112674251, 0.004075091575091575, 0.010435732139694188] and parameters: {'n_layers': 1, 'embedding_dim': 128, 'lr': 0.00799549330690551, 'lambda_val': 1.033711147166284e-06, 'batch_size': 1515, 'optimizer': 'Adam'}.
2026-06-23 12:57:08,593 - root - INFO - Selected Trial 282 based on Max ndcg: 0.0204
2026-06-23 12:57:08,593 - root - INFO - Associated Recall: 0.0360
2026-06-23 12:57:08,593 - experiment_functions - INFO - Training the best model ... for e_yelp_1c2dcs_rand4
2026-06-23 13:00:08,032 - root - INFO -   **** Training e_yelp_1c2dcs_rand5
2026-06-23 13:00:08,214 - root - INFO -   **** Getting 575241/1274132 random edges
2026-06-23 13:00:08,552 - optuna.storages._rdb.storage - INFO - A new study created in RDB with name: Study_e_yelp_1c2dcs_rand5
2026-06-23 13:01:21,532 - experiment_functions - INFO - Early stopping at epoch 1700. Best Metrics: (0.005107845595265945, 0.0011510041682455477, 0.002797207072343879)
2026-06-23 13:01:21,633 - optuna.study.study - INFO - Trial 0 finished with values: [0.005107845595265945, 0.0011510041682455477, 0.002797207072343879] and parameters: {'n_layers': 1, 'embedding_dim': 32, 'lr': 0.013381304939649, 'lambda_val': 0.03597446195855276, 'batch_size': 3911, 'optimizer': 'RMSprop'}.
2026-06-23 13:01:52,871 - experiment_functions - INFO - Early stopping at epoch 550. Best Metrics: (0.01054382346000504, 0.0022688518378173555, 0.005647715118745275)
2026-06-23 13:01:52,986 - optuna.study.study - INFO - Trial 1 finished with values: [0.01054382346000504, 0.0022688518378173555, 0.005647715118745275] and parameters: {'n_layers': 4, 'embedding_dim': 128, 'lr': 0.003327046285057053, 'lambda_val': 0.00047222048784128004, 'batch_size': 2544, 'optimizer': 'Adam'}.
2026-06-23 13:02:17,504 - experiment_functions - INFO - Early stopping at epoch 550. Best Metrics: (0.003459327583103727, 0.0008194391815081471, 0.0019746977731339194)
2026-06-23 13:02:17,609 - optuna.study.study - INFO - Trial 2 finished with values: [0.003459327583103727, 0.0008194391815081471, 0.0019746977731339194] and parameters: {'n_layers': 1, 'embedding_dim': 32, 'lr': 0.07437312656526578, 'lambda_val': 0.00010665589892798745, 'batch_size': 3311, 'optimizer': 'RMSprop'}.
2026-06-23 13:02:58,888 - experiment_functions - INFO - Early stopping at epoch 850. Best Metrics: (0.016842728021095398, 0.0036961601616774032, 0.009978833054655474)
2026-06-23 13:03:00,376 - optuna.study.study - INFO - Trial 3 finished with values: [0.016842728021095398, 0.0036961601616774032, 0.009978833054655474] and parameters: {'n_layers': 4, 'embedding_dim': 64, 'lr': 0.0012272605990543274, 'lambda_val': 0.0004989009471474681, 'batch_size': 2143, 'optimizer': 'Adam'}.
2026-06-23 13:06:04,947 - optuna.study.study - INFO - Trial 4 finished with values: [0.018770554078389186, 0.004046671719085513, 0.010668696197983813] and parameters: {'n_layers': 4, 'embedding_dim': 64, 'lr': 0.0001895879868332347, 'lambda_val': 0.0009179871154727713, 'batch_size': 1712, 'optimizer': 'RMSprop'}.
2026-06-23 13:07:06,314 - experiment_functions - INFO - Early stopping at epoch 1400. Best Metrics: (0.0005459570597324212, 0.00012631047113805733, 0.0003385963060844086)
2026-06-23 13:07:06,417 - optuna.study.study - INFO - Trial 5 finished with values: [0.0005459570597324212, 0.00012631047113805733, 0.0003385963060844086] and parameters: {'n_layers': 1, 'embedding_dim': 128, 'lr': 0.00025028576946188884, 'lambda_val': 0.001139884821583034, 'batch_size': 669, 'optimizer': 'RMSprop'}.
2026-06-23 13:07:31,354 - experiment_functions - INFO - Early stopping at epoch 500. Best Metrics: (0.000489386042405824, 0.00011841606669192878, 0.0002713735843640129)
2026-06-23 13:07:31,483 - optuna.study.study - INFO - Trial 6 finished with values: [0.000489386042405824, 0.00011841606669192878, 0.0002713735843640129] and parameters: {'n_layers': 4, 'embedding_dim': 64, 'lr': 3.398268946831149e-05, 'lambda_val': 4.002285003194925e-05, 'batch_size': 2263, 'optimizer': 'SGD'}.
2026-06-23 13:07:54,713 - experiment_functions - INFO - Early stopping at epoch 500. Best Metrics: (0.0005408155730055215, 0.00012315270935960593, 0.00030637156101805243)
2026-06-23 13:07:54,817 - optuna.study.study - INFO - Trial 7 finished with values: [0.0005408155730055215, 0.00012315270935960593, 0.00030637156101805243] and parameters: {'n_layers': 4, 'embedding_dim': 32, 'lr': 0.0035445724903410704, 'lambda_val': 9.597443253042575e-05, 'batch_size': 1072, 'optimizer': 'SGD'}.
2026-06-23 13:08:23,091 - experiment_functions - INFO - Early stopping at epoch 500. Best Metrics: (0.0004521585275434714, 0.00010262725779967159, 0.00025209107071898684)
2026-06-23 13:08:23,194 - optuna.study.study - INFO - Trial 8 finished with values: [0.0004521585275434714, 0.00010262725779967159, 0.00025209107071898684] and parameters: {'n_layers': 2, 'embedding_dim': 256, 'lr': 0.001129131670101276, 'lambda_val': 0.0020511361497476195, 'batch_size': 2163, 'optimizer': 'SGD'}.
2026-06-23 13:08:46,411 - experiment_functions - INFO - Early stopping at epoch 500. Best Metrics: (0.0004835693464443809, 0.00010894278135657447, 0.00026027570405051507)
2026-06-23 13:08:46,517 - optuna.study.study - INFO - Trial 9 finished with values: [0.0004835693464443809, 0.00010894278135657447, 0.00026027570405051507] and parameters: {'n_layers': 1, 'embedding_dim': 96, 'lr': 6.665042738100559e-05, 'lambda_val': 0.002833268593534932, 'batch_size': 948, 'optimizer': 'SGD'}.
2026-06-23 13:09:26,604 - experiment_functions - INFO - Early stopping at epoch 950. Best Metrics: (0.0037552323013227765, 0.0009220664393078187, 0.002247950725936786)
