2026-06-21 14:22:44,823 - optuna.study.study - INFO - Trial 206 finished with values: [0.008435205634512019, 0.0020699128457749147, 0.004824005735325682] and parameters: {'n_layers': 4, 'embedding_dim': 128, 'lr': 0.0044739262759054006, 'lambda_val': 1.8308866889687562e-05, 'batch_size': 2281, 'optimizer': 'Adam'}.
2026-06-21 14:23:47,079 - experiment_functions - INFO - Early stopping at epoch 1300. Best Metrics: (0.010128928238379312, 0.002519893899204244, 0.006259828226968145)
2026-06-21 14:23:47,157 - optuna.study.study - INFO - Trial 207 finished with values: [0.010128928238379312, 0.002519893899204244, 0.006259828226968145] and parameters: {'n_layers': 4, 'embedding_dim': 128, 'lr': 0.0008890810320593691, 'lambda_val': 2.5744682794480333e-06, 'batch_size': 2399, 'optimizer': 'Adam'}.
2026-06-21 14:26:37,922 - optuna.study.study - INFO - Trial 208 finished with values: [0.011205633693461791, 0.002815144625489453, 0.00678950691737105] and parameters: {'n_layers': 4, 'embedding_dim': 64, 'lr': 0.0006104134330921928, 'lambda_val': 0.0002534167291701876, 'batch_size': 1602, 'optimizer': 'Adam'}.
2026-06-21 14:27:15,839 - experiment_functions - INFO - Early stopping at epoch 650. Best Metrics: (0.007835842388576868, 0.0019025514715169888, 0.00456375175200897)
2026-06-21 14:27:15,932 - optuna.study.study - INFO - Trial 209 finished with values: [0.007835842388576868, 0.0019025514715169888, 0.00456375175200897] and parameters: {'n_layers': 4, 'embedding_dim': 256, 'lr': 0.0044739262759054006, 'lambda_val': 6.059814023598347e-06, 'batch_size': 1014, 'optimizer': 'Adam'}.
2026-06-21 14:27:42,007 - experiment_functions - INFO - Early stopping at epoch 550. Best Metrics: (0.006597387815130033, 0.0016751926234684857, 0.003938514571161702)
2026-06-21 14:27:42,137 - optuna.study.study - INFO - Trial 210 finished with values: [0.006597387815130033, 0.0016751926234684857, 0.003938514571161702] and parameters: {'n_layers': 4, 'embedding_dim': 64, 'lr': 0.017411800301980536, 'lambda_val': 1.00362290309107e-06, 'batch_size': 4092, 'optimizer': 'Adam'}.
2026-06-21 14:28:17,733 - experiment_functions - INFO - Early stopping at epoch 750. Best Metrics: (0.009453144305945118, 0.002371479095617027, 0.005622566679355859)
2026-06-21 14:28:17,809 - optuna.study.study - INFO - Trial 211 finished with values: [0.009453144305945118, 0.002371479095617027, 0.005622566679355859] and parameters: {'n_layers': 4, 'embedding_dim': 96, 'lr': 0.003566354885654931, 'lambda_val': 6.059814023598347e-06, 'batch_size': 1014, 'optimizer': 'Adam'}.
2026-06-21 14:29:20,265 - experiment_functions - INFO - Early stopping at epoch 1350. Best Metrics: (0.009515412926303297, 0.0024614753063028926, 0.005823283945540522)
2026-06-21 14:29:20,354 - optuna.study.study - INFO - Trial 212 finished with values: [0.009515412926303297, 0.0024614753063028926, 0.005823283945540522] and parameters: {'n_layers': 3, 'embedding_dim': 128, 'lr': 0.0008890810320593691, 'lambda_val': 2.5744682794480333e-06, 'batch_size': 2399, 'optimizer': 'RMSprop'}.
2026-06-21 14:31:25,170 - experiment_functions - INFO - Early stopping at epoch 2750. Best Metrics: (0.012928315569528162, 0.0032382847038019457, 0.007754658828725316)
2026-06-21 14:31:25,286 - optuna.study.study - INFO - Trial 213 finished with values: [0.012928315569528162, 0.0032382847038019457, 0.007754658828725316] and parameters: {'n_layers': 4, 'embedding_dim': 96, 'lr': 0.0008890810320593691, 'lambda_val': 2.5744682794480333e-06, 'batch_size': 1014, 'optimizer': 'RMSprop'}.
2026-06-21 14:32:44,987 - experiment_functions - INFO - Early stopping at epoch 1650. Best Metrics: (0.0005285609441137471, 0.00012631047113805733, 0.00032648468066949526)
2026-06-21 14:32:45,062 - optuna.study.study - INFO - Trial 214 finished with values: [0.0005285609441137471, 0.00012631047113805733, 0.00032648468066949526] and parameters: {'n_layers': 2, 'embedding_dim': 256, 'lr': 8.163728492572775e-05, 'lambda_val': 2.854699329527242e-06, 'batch_size': 590, 'optimizer': 'RMSprop'}.
2026-06-21 14:33:28,696 - experiment_functions - INFO - Early stopping at epoch 1050. Best Metrics: (0.006260224914091164, 0.0015046734874321083, 0.0039378065485374605)
2026-06-21 14:33:28,772 - optuna.study.study - INFO - Trial 215 finished with values: [0.006260224914091164, 0.0015046734874321083, 0.0039378065485374605] and parameters: {'n_layers': 2, 'embedding_dim': 32, 'lr': 0.004051056337067167, 'lambda_val': 6.059814023598347e-06, 'batch_size': 975, 'optimizer': 'Adam'}.
2026-06-21 14:33:53,756 - experiment_functions - INFO - Early stopping at epoch 500. Best Metrics: (0.00046383487310385234, 0.00010578501957812304, 0.00027641492768493316)
2026-06-21 14:33:54,369 - optuna.study.study - INFO - Trial 216 finished with values: [0.00046383487310385234, 0.00010578501957812304, 0.00027641492768493316] and parameters: {'n_layers': 4, 'embedding_dim': 128, 'lr': 0.0044739262759054006, 'lambda_val': 2.5744682794480333e-06, 'batch_size': 1014, 'optimizer': 'SGD'}.
2026-06-21 14:34:21,045 - experiment_functions - INFO - Early stopping at epoch 550. Best Metrics: (0.006476177432979863, 0.0016278261967917142, 0.0037833062812243417)
2026-06-21 14:34:21,118 - optuna.study.study - INFO - Trial 217 finished with values: [0.006476177432979863, 0.0016278261967917142, 0.0037833062812243417] and parameters: {'n_layers': 4, 'embedding_dim': 96, 'lr': 0.017411800301980536, 'lambda_val': 4.067888334799247e-05, 'batch_size': 1014, 'optimizer': 'Adam'}.
2026-06-21 14:36:19,293 - experiment_functions - INFO - Early stopping at epoch 2750. Best Metrics: (0.0006139799032650697, 0.00015630920803334596, 0.0003425157612043187)
2026-06-21 14:36:19,364 - optuna.study.study - INFO - Trial 218 finished with values: [0.0006139799032650697, 0.00015630920803334596, 0.0003425157612043187] and parameters: {'n_layers': 3, 'embedding_dim': 96, 'lr': 8.116834178560098e-05, 'lambda_val': 0.00037941540794106203, 'batch_size': 1006, 'optimizer': 'Adam'}.
2026-06-21 14:39:17,105 - experiment_functions - INFO - Early stopping at epoch 3800. Best Metrics: (0.010539898222623047, 0.002663572060123784, 0.006558278023391286)
2026-06-21 14:39:17,172 - optuna.study.study - INFO - Trial 219 finished with values: [0.010539898222623047, 0.002663572060123784, 0.006558278023391286] and parameters: {'n_layers': 4, 'embedding_dim': 128, 'lr': 0.0003941995846468513, 'lambda_val': 0.00037941540794106203, 'batch_size': 2732, 'optimizer': 'RMSprop'}.
2026-06-21 14:39:49,982 - experiment_functions - INFO - Early stopping at epoch 650. Best Metrics: (0.008560183447993457, 0.0021567512946823295, 0.005208186772007898)
2026-06-21 14:39:50,057 - optuna.study.study - INFO - Trial 220 finished with values: [0.008560183447993457, 0.0021567512946823295, 0.005208186772007898] and parameters: {'n_layers': 4, 'embedding_dim': 128, 'lr': 0.003566354885654931, 'lambda_val': 2.854699329527242e-06, 'batch_size': 2281, 'optimizer': 'Adam'}.
2026-06-21 14:40:30,577 - experiment_functions - INFO - Early stopping at epoch 950. Best Metrics: (0.00402236721160506, 0.0009283819628647216, 0.002355301139601062)
2026-06-21 14:40:30,647 - optuna.study.study - INFO - Trial 221 finished with values: [0.00402236721160506, 0.0009283819628647216, 0.002355301139601062] and parameters: {'n_layers': 1, 'embedding_dim': 96, 'lr': 0.007517511425007554, 'lambda_val': 0.00034129251188470285, 'batch_size': 1179, 'optimizer': 'Adam'}.
2026-06-21 14:43:14,589 - optuna.study.study - INFO - Trial 222 finished with values: [0.013649699934722355, 0.003407224958949097, 0.008422111085958313] and parameters: {'n_layers': 4, 'embedding_dim': 32, 'lr': 0.0008890810320593691, 'lambda_val': 2.5744682794480333e-06, 'batch_size': 1014, 'optimizer': 'RMSprop'}.
2026-06-21 14:45:59,000 - optuna.study.study - INFO - Trial 223 finished with values: [0.005173955884095678, 0.0012410003789314135, 0.0032511860319375005] and parameters: {'n_layers': 1, 'embedding_dim': 128, 'lr': 0.0008890810320593691, 'lambda_val': 0.00036884249384628963, 'batch_size': 1006, 'optimizer': 'RMSprop'}.
2026-06-21 14:47:17,511 - experiment_functions - INFO - Early stopping at epoch 1900. Best Metrics: (0.011778439648800208, 0.0029540861437413165, 0.007054843405566979)
2026-06-21 14:47:17,583 - optuna.study.study - INFO - Trial 224 finished with values: [0.011778439648800208, 0.0029540861437413165, 0.007054843405566979] and parameters: {'n_layers': 4, 'embedding_dim': 32, 'lr': 0.0008890810320593691, 'lambda_val': 2.5744682794480333e-06, 'batch_size': 2281, 'optimizer': 'RMSprop'}.
2026-06-21 14:48:00,840 - experiment_functions - INFO - Early stopping at epoch 800. Best Metrics: (0.007268374322545712, 0.0017715043577112546, 0.004133546725328551)
2026-06-21 14:48:00,934 - optuna.study.study - INFO - Trial 225 finished with values: [0.007268374322545712, 0.0017715043577112546, 0.004133546725328551] and parameters: {'n_layers': 3, 'embedding_dim': 256, 'lr': 0.0044739262759054006, 'lambda_val': 2.854699329527242e-06, 'batch_size': 1014, 'optimizer': 'Adam'}.
2026-06-21 14:49:02,824 - experiment_functions - INFO - Early stopping at epoch 1350. Best Metrics: (0.009321379212023062, 0.0024409498547429583, 0.005614034796862336)
2026-06-21 14:49:02,904 - optuna.study.study - INFO - Trial 226 finished with values: [0.009321379212023062, 0.0024409498547429583, 0.005614034796862336] and parameters: {'n_layers': 4, 'embedding_dim': 96, 'lr': 0.0008890810320593691, 'lambda_val': 2.854699329527242e-06, 'batch_size': 2399, 'optimizer': 'Adam'}.
2026-06-21 14:51:35,433 - experiment_functions - INFO - Early stopping at epoch 3800. Best Metrics: (0.009899821151555353, 0.0024251610458507007, 0.006332406339830239)
2026-06-21 14:51:35,508 - optuna.study.study - INFO - Trial 227 finished with values: [0.009899821151555353, 0.0024251610458507007, 0.006332406339830239] and parameters: {'n_layers': 3, 'embedding_dim': 32, 'lr': 0.0006104134330921928, 'lambda_val': 2.854699329527242e-06, 'batch_size': 2732, 'optimizer': 'RMSprop'}.
2026-06-21 14:52:06,358 - experiment_functions - INFO - Early stopping at epoch 600. Best Metrics: (0.005059906841347717, 0.0012410003789314133, 0.002889694021363533)
2026-06-21 14:52:06,459 - optuna.study.study - INFO - Trial 228 finished with values: [0.005059906841347717, 0.0012410003789314133, 0.002889694021363533] and parameters: {'n_layers': 2, 'embedding_dim': 256, 'lr': 0.004051056337067167, 'lambda_val': 0.0008080729748176025, 'batch_size': 3803, 'optimizer': 'RMSprop'}.
2026-06-21 14:52:31,504 - experiment_functions - INFO - Early stopping at epoch 550. Best Metrics: (0.005861066379340336, 0.001439939370973854, 0.0035003553007735074)
2026-06-21 14:52:31,605 - optuna.study.study - INFO - Trial 229 finished with values: [0.005861066379340336, 0.001439939370973854, 0.0035003553007735074] and parameters: {'n_layers': 3, 'embedding_dim': 64, 'lr': 0.017411800301980536, 'lambda_val': 1.00362290309107e-06, 'batch_size': 4092, 'optimizer': 'Adam'}.
2026-06-21 14:53:05,809 - experiment_functions - INFO - Early stopping at epoch 800. Best Metrics: (0.005453458938526572, 0.0014652014652014654, 0.0030747582305514377)
2026-06-21 14:53:05,900 - optuna.study.study - INFO - Trial 230 finished with values: [0.005453458938526572, 0.0014652014652014654, 0.0030747582305514377] and parameters: {'n_layers': 4, 'embedding_dim': 32, 'lr': 0.0008890810320593691, 'lambda_val': 0.045243502147210846, 'batch_size': 3241, 'optimizer': 'RMSprop'}.
2026-06-21 14:53:41,722 - experiment_functions - INFO - Early stopping at epoch 800. Best Metrics: (0.0031168232054286146, 0.0008147025388404699, 0.0017676291230977776)
2026-06-21 14:53:42,080 - optuna.study.study - INFO - Trial 231 finished with values: [0.0031168232054286146, 0.0008147025388404699, 0.0017676291230977776] and parameters: {'n_layers': 2, 'embedding_dim': 128, 'lr': 0.0044739262759054006, 'lambda_val': 0.03423543274915804, 'batch_size': 2281, 'optimizer': 'RMSprop'}.
2026-06-21 14:56:34,761 - optuna.study.study - INFO - Trial 232 finished with values: [0.008747146231006123, 0.0021599090564607807, 0.005424263045565763] and parameters: {'n_layers': 3, 'embedding_dim': 96, 'lr': 0.0004419346142273276, 'lambda_val': 1.00362290309107e-06, 'batch_size': 3241, 'optimizer': 'Adam'}.
2026-06-21 14:57:14,261 - experiment_functions - INFO - Early stopping at epoch 950. Best Metrics: (0.0070058462584623605, 0.0017588733105974486, 0.004150453707900934)
2026-06-21 14:57:14,333 - optuna.study.study - INFO - Trial 233 finished with values: [0.0070058462584623605, 0.0017588733105974486, 0.004150453707900934] and parameters: {'n_layers': 2, 'embedding_dim': 32, 'lr': 0.004051056337067167, 'lambda_val': 0.00037941540794106203, 'batch_size': 1087, 'optimizer': 'RMSprop'}.
2026-06-21 14:57:48,759 - experiment_functions - INFO - Early stopping at epoch 700. Best Metrics: (0.00894587367418048, 0.002204117721359101, 0.005235834050252192)
2026-06-21 14:57:48,853 - optuna.study.study - INFO - Trial 234 finished with values: [0.00894587367418048, 0.002204117721359101, 0.005235834050252192] and parameters: {'n_layers': 4, 'embedding_dim': 128, 'lr': 0.0044739262759054006, 'lambda_val': 1.9888087490246264e-06, 'batch_size': 679, 'optimizer': 'Adam'}.
2026-06-21 15:00:00,541 - experiment_functions - INFO - Early stopping at epoch 3050. Best Metrics: (0.008616000440690514, 0.0021614879373500063, 0.005321591986986281)
2026-06-21 15:00:00,636 - optuna.study.study - INFO - Trial 235 finished with values: [0.008616000440690514, 0.0021614879373500063, 0.005321591986986281] and parameters: {'n_layers': 3, 'embedding_dim': 96, 'lr': 0.0006104134330921928, 'lambda_val': 1.9888087490246264e-06, 'batch_size': 3322, 'optimizer': 'Adam'}.
2026-06-21 15:00:27,101 - experiment_functions - INFO - Early stopping at epoch 550. Best Metrics: (0.00676992425599128, 0.0016799292661361627, 0.004034202618103885)
2026-06-21 15:00:27,188 - optuna.study.study - INFO - Trial 236 finished with values: [0.00676992425599128, 0.0016799292661361627, 0.004034202618103885] and parameters: {'n_layers': 3, 'embedding_dim': 128, 'lr': 0.0044739262759054006, 'lambda_val': 4.853452018113512e-05, 'batch_size': 2281, 'optimizer': 'RMSprop'}.
2026-06-21 15:03:19,003 - optuna.study.study - INFO - Trial 237 finished with values: [0.00936405332492932, 0.0022562207907035493, 0.005880865351852806] and parameters: {'n_layers': 3, 'embedding_dim': 96, 'lr': 0.0003941995846468513, 'lambda_val': 1.00362290309107e-06, 'batch_size': 2732, 'optimizer': 'RMSprop'}.
2026-06-21 15:03:48,514 - experiment_functions - INFO - Early stopping at epoch 650. Best Metrics: (0.008454404143021944, 0.002024125299987369, 0.00498836182793835)
2026-06-21 15:03:48,628 - optuna.study.study - INFO - Trial 238 finished with values: [0.008454404143021944, 0.002024125299987369, 0.00498836182793835] and parameters: {'n_layers': 4, 'embedding_dim': 64, 'lr': 0.0044739262759054006, 'lambda_val': 1.9888087490246264e-06, 'batch_size': 4067, 'optimizer': 'Adam'}.
2026-06-21 15:04:15,187 - experiment_functions - INFO - Early stopping at epoch 550. Best Metrics: (0.007914008736436837, 0.0019546545408614373, 0.004529170557187518)
2026-06-21 15:04:15,326 - optuna.study.study - INFO - Trial 239 finished with values: [0.007914008736436837, 0.0019546545408614373, 0.004529170557187518] and parameters: {'n_layers': 4, 'embedding_dim': 96, 'lr': 0.0044739262759054006, 'lambda_val': 1.6213630924331792e-06, 'batch_size': 2732, 'optimizer': 'RMSprop'}.
2026-06-21 15:04:55,546 - experiment_functions - INFO - Early stopping at epoch 800. Best Metrics: (0.005404886717514252, 0.001338890994063408, 0.003175425073499178)
2026-06-21 15:04:55,641 - optuna.study.study - INFO - Trial 240 finished with values: [0.005404886717514252, 0.001338890994063408, 0.003175425073499178] and parameters: {'n_layers': 2, 'embedding_dim': 256, 'lr': 0.0044739262759054006, 'lambda_val': 2.1253433227122844e-05, 'batch_size': 2281, 'optimizer': 'RMSprop'}.
2026-06-21 15:07:06,023 - experiment_functions - INFO - Early stopping at epoch 3250. Best Metrics: (0.010431202042352827, 0.002560944802324113, 0.006381332451574102)
2026-06-21 15:07:06,098 - optuna.study.study - INFO - Trial 241 finished with values: [0.010431202042352827, 0.002560944802324113, 0.006381332451574102] and parameters: {'n_layers': 3, 'embedding_dim': 32, 'lr': 0.0008890810320593691, 'lambda_val': 1.0480033391436414e-06, 'batch_size': 2233, 'optimizer': 'RMSprop'}.
2026-06-21 15:08:51,215 - experiment_functions - INFO - Early stopping at epoch 2450. Best Metrics: (0.011467852022659838, 0.0028467222432739677, 0.006887592873258308)
2026-06-21 15:08:51,294 - optuna.study.study - INFO - Trial 242 finished with values: [0.011467852022659838, 0.0028467222432739677, 0.006887592873258308] and parameters: {'n_layers': 4, 'embedding_dim': 64, 'lr': 0.0006104134330921928, 'lambda_val': 5.165889563766286e-06, 'batch_size': 3386, 'optimizer': 'RMSprop'}.
2026-06-21 15:09:14,630 - experiment_functions - INFO - Early stopping at epoch 500. Best Metrics: (0.0005564831438773057, 0.0001215738284703802, 0.00029331296558038344)
2026-06-21 15:09:14,728 - optuna.study.study - INFO - Trial 243 finished with values: [0.0005564831438773057, 0.0001215738284703802, 0.00029331296558038344] and parameters: {'n_layers': 2, 'embedding_dim': 128, 'lr': 0.0008890810320593691, 'lambda_val': 2.5744682794480333e-06, 'batch_size': 2399, 'optimizer': 'SGD'}.
2026-06-21 15:12:10,970 - optuna.study.study - INFO - Trial 244 finished with values: [0.005010528195190972, 0.0012015283567007704, 0.0032213556891550706] and parameters: {'n_layers': 1, 'embedding_dim': 256, 'lr': 0.0008890810320593691, 'lambda_val': 1.9888087490246264e-06, 'batch_size': 975, 'optimizer': 'RMSprop'}.
2026-06-21 15:13:39,339 - experiment_functions - INFO - Early stopping at epoch 2000. Best Metrics: (0.0007948056734000282, 0.00016262473159024885, 0.0004182284418373035)
2026-06-21 15:13:39,423 - optuna.study.study - INFO - Trial 245 finished with values: [0.0007948056734000282, 0.00016262473159024885, 0.0004182284418373035] and parameters: {'n_layers': 4, 'embedding_dim': 96, 'lr': 1.0464038020890923e-05, 'lambda_val': 0.004849547843654378, 'batch_size': 1014, 'optimizer': 'Adam'}.
2026-06-21 15:14:07,412 - experiment_functions - INFO - Early stopping at epoch 600. Best Metrics: (0.007323875349042868, 0.0018188707843880257, 0.004288361442514686)
2026-06-21 15:14:07,498 - optuna.study.study - INFO - Trial 246 finished with values: [0.007323875349042868, 0.0018188707843880257, 0.004288361442514686] and parameters: {'n_layers': 3, 'embedding_dim': 96, 'lr': 0.004051056337067167, 'lambda_val': 0.0004774129141713235, 'batch_size': 1346, 'optimizer': 'RMSprop'}.
2026-06-21 15:14:34,590 - experiment_functions - INFO - Early stopping at epoch 600. Best Metrics: (0.0071542610546161, 0.0018709738537324744, 0.004366062498906488)
2026-06-21 15:14:34,673 - optuna.study.study - INFO - Trial 247 finished with values: [0.0071542610546161, 0.0018709738537324744, 0.004366062498906488] and parameters: {'n_layers': 3, 'embedding_dim': 64, 'lr': 0.003566354885654931, 'lambda_val': 2.7322606765858122e-05, 'batch_size': 3322, 'optimizer': 'RMSprop'}.
2026-06-21 15:15:05,614 - experiment_functions - INFO - Early stopping at epoch 700. Best Metrics: (0.008651174860942072, 0.002189907793356069, 0.005435730259011051)
2026-06-21 15:15:05,713 - optuna.study.study - INFO - Trial 248 finished with values: [0.008651174860942072, 0.002189907793356069, 0.005435730259011051] and parameters: {'n_layers': 4, 'embedding_dim': 32, 'lr': 0.0044739262759054006, 'lambda_val': 1.9888087490246264e-06, 'batch_size': 2281, 'optimizer': 'Adam'}.
2026-06-21 15:15:35,618 - experiment_functions - INFO - Early stopping at epoch 600. Best Metrics: (0.0068922684435355885, 0.001834659593280283, 0.004147866451686762)
2026-06-21 15:15:35,716 - optuna.study.study - INFO - Trial 249 finished with values: [0.0068922684435355885, 0.001834659593280283, 0.004147866451686762] and parameters: {'n_layers': 4, 'embedding_dim': 128, 'lr': 0.0044739262759054006, 'lambda_val': 0.00037941540794106203, 'batch_size': 1014, 'optimizer': 'RMSprop'}.
2026-06-21 15:16:10,845 - experiment_functions - INFO - Early stopping at epoch 600. Best Metrics: (0.007134955271780533, 0.00178413540482506, 0.004192454003744368)
2026-06-21 15:16:12,296 - optuna.study.study - INFO - Trial 250 finished with values: [0.007134955271780533, 0.00178413540482506, 0.004192454003744368] and parameters: {'n_layers': 4, 'embedding_dim': 256, 'lr': 0.003566354885654931, 'lambda_val': 2.5744682794480333e-06, 'batch_size': 1014, 'optimizer': 'RMSprop'}.
2026-06-21 15:16:36,871 - experiment_functions - INFO - Early stopping at epoch 550. Best Metrics: (0.004049259865536886, 0.000986800555766073, 0.0024000513373350963)
2026-06-21 15:16:36,916 - optuna.study.study - INFO - Trial 251 finished with values: [0.004049259865536886, 0.000986800555766073, 0.0024000513373350963] and parameters: {'n_layers': 4, 'embedding_dim': 32, 'lr': 0.018930324797198993, 'lambda_val': 2.854699329527242e-06, 'batch_size': 2732, 'optimizer': 'RMSprop'}.
2026-06-21 15:18:29,936 - experiment_functions - INFO - Early stopping at epoch 2400. Best Metrics: (0.013016857383433713, 0.003137236326891499, 0.007781211014154017)
2026-06-21 15:18:30,038 - optuna.study.study - INFO - Trial 252 finished with values: [0.013016857383433713, 0.003137236326891499, 0.007781211014154017] and parameters: {'n_layers': 4, 'embedding_dim': 128, 'lr': 0.0008890810320593691, 'lambda_val': 2.5744682794480333e-06, 'batch_size': 1014, 'optimizer': 'RMSprop'}.
2026-06-21 15:20:59,850 - experiment_functions - INFO - Early stopping at epoch 3200. Best Metrics: (0.010828902703247795, 0.002671466464569913, 0.006562424434856811)
