2026-06-23 01:24:36,811 - optuna.study.study - INFO - Trial 76 finished with values: [0.017601189110857587, 0.0037561576354679803, 0.009537875616314523] and parameters: {'n_layers': 4, 'embedding_dim': 128, 'lr': 0.0006886562164819431, 'lambda_val': 2.7464269407470928e-06, 'batch_size': 2330, 'optimizer': 'RMSprop'}.
2026-06-23 01:24:59,891 - experiment_functions - INFO - Early stopping at epoch 500. Best Metrics: (0.0003879639363149012, 0.00010262725779967159, 0.00024778091410840146)
2026-06-23 01:24:59,967 - optuna.study.study - INFO - Trial 77 finished with values: [0.0003879639363149012, 0.00010262725779967159, 0.00024778091410840146] and parameters: {'n_layers': 2, 'embedding_dim': 64, 'lr': 7.441243779768322e-05, 'lambda_val': 0.008700062786143456, 'batch_size': 1174, 'optimizer': 'Adam'}.
2026-06-23 01:25:24,777 - experiment_functions - INFO - Early stopping at epoch 550. Best Metrics: (0.0038063288917583988, 0.000808387015283567, 0.0020274171765569155)
2026-06-23 01:25:24,849 - optuna.study.study - INFO - Trial 78 finished with values: [0.0038063288917583988, 0.000808387015283567, 0.0020274171765569155] and parameters: {'n_layers': 3, 'embedding_dim': 32, 'lr': 0.09262371607129609, 'lambda_val': 0.001880532910656797, 'batch_size': 2258, 'optimizer': 'Adam'}.
2026-06-23 01:26:02,468 - experiment_functions - INFO - Early stopping at epoch 550. Best Metrics: (0.012877069685161278, 0.0026351522041177214, 0.0072183263579927)
2026-06-23 01:26:02,559 - optuna.study.study - INFO - Trial 79 finished with values: [0.012877069685161278, 0.0026351522041177214, 0.0072183263579927] and parameters: {'n_layers': 4, 'embedding_dim': 256, 'lr': 0.004023997993481987, 'lambda_val': 0.0002822112546812961, 'batch_size': 922, 'optimizer': 'RMSprop'}.
2026-06-23 01:28:55,022 - optuna.study.study - INFO - Trial 80 finished with values: [0.0009604112890290174, 0.0002415687760515347, 0.0005684864949093924] and parameters: {'n_layers': 3, 'embedding_dim': 64, 'lr': 8.370437176004755e-05, 'lambda_val': 1.1358678227612878e-06, 'batch_size': 1994, 'optimizer': 'RMSprop'}.
2026-06-23 01:29:17,092 - experiment_functions - INFO - Early stopping at epoch 500. Best Metrics: (0.0005249687444206913, 0.00011525830491347733, 0.0002458930564437511)
2026-06-23 01:29:17,177 - optuna.study.study - INFO - Trial 81 finished with values: [0.0005249687444206913, 0.00011525830491347733, 0.0002458930564437511] and parameters: {'n_layers': 1, 'embedding_dim': 32, 'lr': 0.0006886562164819431, 'lambda_val': 2.7464269407470928e-06, 'batch_size': 1341, 'optimizer': 'SGD'}.
2026-06-23 01:29:55,019 - experiment_functions - INFO - Early stopping at epoch 600. Best Metrics: (0.012009776188866617, 0.002699886320575976, 0.0061609187813895985)
2026-06-23 01:29:55,101 - optuna.study.study - INFO - Trial 82 finished with values: [0.012009776188866617, 0.002699886320575976, 0.0061609187813895985] and parameters: {'n_layers': 3, 'embedding_dim': 256, 'lr': 0.0025441842430441314, 'lambda_val': 0.0011345897854453913, 'batch_size': 2261, 'optimizer': 'Adam'}.
2026-06-23 01:30:25,048 - experiment_functions - INFO - Early stopping at epoch 650. Best Metrics: (0.012889118484243801, 0.0027298850574712643, 0.007235733370724313)
2026-06-23 01:30:25,137 - optuna.study.study - INFO - Trial 83 finished with values: [0.012889118484243801, 0.0027298850574712643, 0.007235733370724313] and parameters: {'n_layers': 4, 'embedding_dim': 32, 'lr': 0.0016936188017047076, 'lambda_val': 1.105038231556551e-05, 'batch_size': 3305, 'optimizer': 'RMSprop'}.
2026-06-23 01:30:53,009 - experiment_functions - INFO - Early stopping at epoch 550. Best Metrics: (0.00780567452007787, 0.0016199317923455856, 0.0044728355119786865)
2026-06-23 01:30:53,099 - optuna.study.study - INFO - Trial 84 finished with values: [0.00780567452007787, 0.0016199317923455856, 0.0044728355119786865] and parameters: {'n_layers': 3, 'embedding_dim': 96, 'lr': 0.012967549545266072, 'lambda_val': 0.0007054836248890051, 'batch_size': 1270, 'optimizer': 'RMSprop'}.
2026-06-23 01:33:43,921 - optuna.study.study - INFO - Trial 85 finished with values: [0.03337610753226796, 0.006961285840596186, 0.019055979558401416] and parameters: {'n_layers': 1, 'embedding_dim': 64, 'lr': 0.0013029739660954116, 'lambda_val': 3.611427784790995e-05, 'batch_size': 2381, 'optimizer': 'Adam'}.
2026-06-23 01:34:18,866 - experiment_functions - INFO - Early stopping at epoch 700. Best Metrics: (0.015153033149072667, 0.0034577491474043196, 0.008553965324903648)
2026-06-23 01:34:19,396 - optuna.study.study - INFO - Trial 86 finished with values: [0.015153033149072667, 0.0034577491474043196, 0.008553965324903648] and parameters: {'n_layers': 3, 'embedding_dim': 96, 'lr': 0.0013646646670668807, 'lambda_val': 0.006418108485289533, 'batch_size': 1807, 'optimizer': 'Adam'}.
2026-06-23 01:34:42,620 - experiment_functions - INFO - Early stopping at epoch 500. Best Metrics: (0.000492492003239275, 9.946949602122017e-05, 0.00025236498439842317)
2026-06-23 01:34:42,716 - optuna.study.study - INFO - Trial 87 finished with values: [0.000492492003239275, 9.946949602122017e-05, 0.00025236498439842317] and parameters: {'n_layers': 1, 'embedding_dim': 96, 'lr': 0.015495037121918185, 'lambda_val': 2.0398413385251826e-06, 'batch_size': 2583, 'optimizer': 'SGD'}.
2026-06-23 01:35:16,401 - experiment_functions - INFO - Early stopping at epoch 700. Best Metrics: (0.019347763166008138, 0.004292977137804723, 0.011212671736696574)
2026-06-23 01:35:16,531 - optuna.study.study - INFO - Trial 88 finished with values: [0.019347763166008138, 0.004292977137804723, 0.011212671736696574] and parameters: {'n_layers': 3, 'embedding_dim': 64, 'lr': 0.0016936188017047076, 'lambda_val': 1.1976797619462708e-05, 'batch_size': 3305, 'optimizer': 'Adam'}.
2026-06-23 01:38:07,262 - optuna.study.study - INFO - Trial 89 finished with values: [0.008107336152660584, 0.0019167613995200203, 0.004688323578571695] and parameters: {'n_layers': 4, 'embedding_dim': 32, 'lr': 0.00012195475224101311, 'lambda_val': 3.7911109659764386e-05, 'batch_size': 2928, 'optimizer': 'Adam'}.
2026-06-23 01:38:32,483 - experiment_functions - INFO - Early stopping at epoch 550. Best Metrics: (0.0005458086999349629, 0.00012157382847038021, 0.00028545610079442637)
2026-06-23 01:38:33,214 - optuna.study.study - INFO - Trial 90 finished with values: [0.0005458086999349629, 0.00012157382847038021, 0.00028545610079442637] and parameters: {'n_layers': 1, 'embedding_dim': 96, 'lr': 3.3856297654182696e-05, 'lambda_val': 0.0005196802788376184, 'batch_size': 922, 'optimizer': 'RMSprop'}.
2026-06-23 01:39:02,459 - experiment_functions - INFO - Early stopping at epoch 550. Best Metrics: (0.012171000759580684, 0.0026825186307944935, 0.006584064220264345)
2026-06-23 01:39:02,568 - optuna.study.study - INFO - Trial 91 finished with values: [0.012171000759580684, 0.0026825186307944935, 0.006584064220264345] and parameters: {'n_layers': 4, 'embedding_dim': 96, 'lr': 0.004023997993481987, 'lambda_val': 0.0005196802788376184, 'batch_size': 3326, 'optimizer': 'Adam'}.
2026-06-23 01:39:26,251 - experiment_functions - INFO - Early stopping at epoch 500. Best Metrics: (0.00038529214005421857, 9.315397246431728e-05, 0.00022178507414526076)
2026-06-23 01:39:26,330 - optuna.study.study - INFO - Trial 92 finished with values: [0.00038529214005421857, 9.315397246431728e-05, 0.00022178507414526076] and parameters: {'n_layers': 2, 'embedding_dim': 64, 'lr': 0.00015736597604167302, 'lambda_val': 3.611427784790995e-05, 'batch_size': 2381, 'optimizer': 'SGD'}.
2026-06-23 01:39:51,577 - experiment_functions - INFO - Early stopping at epoch 500. Best Metrics: (0.0005440317279032397, 0.00011683718580270306, 0.0002867947695579178)
2026-06-23 01:39:51,662 - optuna.study.study - INFO - Trial 93 finished with values: [0.0005440317279032397, 0.00011683718580270306, 0.0002867947695579178] and parameters: {'n_layers': 3, 'embedding_dim': 96, 'lr': 0.09715020633665543, 'lambda_val': 0.005011233724380416, 'batch_size': 3569, 'optimizer': 'SGD'}.
2026-06-23 01:42:37,220 - optuna.study.study - INFO - Trial 94 finished with values: [0.0010892651424752064, 0.00024946318049766326, 0.0006081705031645609] and parameters: {'n_layers': 3, 'embedding_dim': 32, 'lr': 0.00012195475224101311, 'lambda_val': 3.7911109659764386e-05, 'batch_size': 1341, 'optimizer': 'Adam'}.
2026-06-23 01:43:02,407 - experiment_functions - INFO - Early stopping at epoch 550. Best Metrics: (0.00752861584212153, 0.0016357206012378425, 0.004076592664327832)
2026-06-23 01:43:02,497 - optuna.study.study - INFO - Trial 95 finished with values: [0.00752861584212153, 0.0016357206012378425, 0.004076592664327832] and parameters: {'n_layers': 1, 'embedding_dim': 96, 'lr': 0.05325919599509802, 'lambda_val': 0.001880532910656797, 'batch_size': 3954, 'optimizer': 'Adam'}.
2026-06-23 01:44:34,296 - experiment_functions - INFO - Early stopping at epoch 1900. Best Metrics: (0.000729071085891429, 0.00014367816091954025, 0.00038252740937649724)
2026-06-23 01:44:34,424 - optuna.study.study - INFO - Trial 96 finished with values: [0.000729071085891429, 0.00014367816091954025, 0.00038252740937649724] and parameters: {'n_layers': 4, 'embedding_dim': 96, 'lr': 4.043110559000417e-05, 'lambda_val': 3.913540568563244e-06, 'batch_size': 922, 'optimizer': 'RMSprop'}.
2026-06-23 01:46:21,310 - experiment_functions - INFO - Early stopping at epoch 2300. Best Metrics: (0.0047600484548284624, 0.0010278514588859418, 0.0025700894832298257)
2026-06-23 01:46:21,381 - optuna.study.study - INFO - Trial 97 finished with values: [0.0047600484548284624, 0.0010278514588859418, 0.0025700894832298257] and parameters: {'n_layers': 3, 'embedding_dim': 96, 'lr': 0.050940040347919505, 'lambda_val': 0.00919381286512005, 'batch_size': 1095, 'optimizer': 'RMSprop'}.
2026-06-23 01:47:16,609 - experiment_functions - INFO - Early stopping at epoch 1100. Best Metrics: (0.007787655695456527, 0.0016451938865731969, 0.004391560931886183)
2026-06-23 01:47:16,698 - optuna.study.study - INFO - Trial 98 finished with values: [0.007787655695456527, 0.0016451938865731969, 0.004391560931886183] and parameters: {'n_layers': 4, 'embedding_dim': 96, 'lr': 0.0245548656422713, 'lambda_val': 3.611427784790995e-05, 'batch_size': 827, 'optimizer': 'Adam'}.
2026-06-23 01:47:39,536 - experiment_functions - INFO - Early stopping at epoch 500. Best Metrics: (0.0005806851133624894, 0.00012631047113805733, 0.0003245724785891506)
2026-06-23 01:47:39,602 - optuna.study.study - INFO - Trial 99 finished with values: [0.0005806851133624894, 0.00012631047113805733, 0.0003245724785891506] and parameters: {'n_layers': 4, 'embedding_dim': 32, 'lr': 0.00017661936206538753, 'lambda_val': 0.00046869570822458774, 'batch_size': 922, 'optimizer': 'SGD'}.
2026-06-23 01:48:17,543 - experiment_functions - INFO - Early stopping at epoch 550. Best Metrics: (0.010212312116515021, 0.0021220159151193636, 0.005627735004305024)
2026-06-23 01:48:17,638 - optuna.study.study - INFO - Trial 100 finished with values: [0.010212312116515021, 0.0021220159151193636, 0.005627735004305024] and parameters: {'n_layers': 4, 'embedding_dim': 256, 'lr': 0.004023997993481987, 'lambda_val': 0.0005196802788376184, 'batch_size': 1472, 'optimizer': 'RMSprop'}.
2026-06-23 01:48:59,361 - experiment_functions - INFO - Early stopping at epoch 850. Best Metrics: (0.010056340005859858, 0.0021772767462422634, 0.005842004305069998)
2026-06-23 01:48:59,448 - optuna.study.study - INFO - Trial 101 finished with values: [0.010056340005859858, 0.0021772767462422634, 0.005842004305069998] and parameters: {'n_layers': 4, 'embedding_dim': 64, 'lr': 0.0016936188017047076, 'lambda_val': 0.0010840808687380718, 'batch_size': 1270, 'optimizer': 'RMSprop'}.
2026-06-23 01:49:22,413 - experiment_functions - INFO - Early stopping at epoch 500. Best Metrics: (0.0005212520914455967, 0.00012631047113805733, 0.00029283130231668884)
2026-06-23 01:49:22,507 - optuna.study.study - INFO - Trial 102 finished with values: [0.0005212520914455967, 0.00012631047113805733, 0.00029283130231668884] and parameters: {'n_layers': 2, 'embedding_dim': 32, 'lr': 5.661672100510181e-05, 'lambda_val': 0.019482836619765062, 'batch_size': 1807, 'optimizer': 'Adam'}.
2026-06-23 01:49:49,836 - experiment_functions - INFO - Early stopping at epoch 600. Best Metrics: (0.021429161722735787, 0.004578754578754579, 0.011875574412103629)
2026-06-23 01:49:49,967 - optuna.study.study - INFO - Trial 103 finished with values: [0.021429161722735787, 0.004578754578754579, 0.011875574412103629] and parameters: {'n_layers': 1, 'embedding_dim': 64, 'lr': 0.010581481753294916, 'lambda_val': 0.0010840808687380718, 'batch_size': 2258, 'optimizer': 'Adam'}.
2026-06-23 01:50:59,739 - experiment_functions - INFO - Early stopping at epoch 1650. Best Metrics: (0.0036764303955431786, 0.0008668056081849186, 0.0019996710864695847)
2026-06-23 01:50:59,836 - optuna.study.study - INFO - Trial 104 finished with values: [0.0036764303955431786, 0.0008668056081849186, 0.0019996710864695847] and parameters: {'n_layers': 3, 'embedding_dim': 32, 'lr': 0.0057096641186942364, 'lambda_val': 0.08982840479576837, 'batch_size': 3210, 'optimizer': 'RMSprop'}.
2026-06-23 01:51:34,170 - experiment_functions - INFO - Early stopping at epoch 700. Best Metrics: (0.008571019042196652, 0.0018251863079449288, 0.004626798260097594)
2026-06-23 01:51:34,662 - optuna.study.study - INFO - Trial 105 finished with values: [0.008571019042196652, 0.0018251863079449288, 0.004626798260097594] and parameters: {'n_layers': 3, 'embedding_dim': 96, 'lr': 0.0013646646670668807, 'lambda_val': 0.006418108485289533, 'batch_size': 1807, 'optimizer': 'RMSprop'}.
2026-06-23 01:52:08,456 - experiment_functions - INFO - Early stopping at epoch 750. Best Metrics: (0.02563876783758151, 0.00531924971580144, 0.014704812007094848)
2026-06-23 01:52:08,548 - optuna.study.study - INFO - Trial 106 finished with values: [0.02563876783758151, 0.00531924971580144, 0.014704812007094848] and parameters: {'n_layers': 2, 'embedding_dim': 32, 'lr': 0.0025566338112489964, 'lambda_val': 1.1976797619462708e-05, 'batch_size': 3305, 'optimizer': 'Adam'}.
2026-06-23 01:52:49,389 - experiment_functions - INFO - Early stopping at epoch 600. Best Metrics: (0.007388461088903774, 0.0015851964127826198, 0.0040194340470245775)
2026-06-23 01:52:49,683 - optuna.study.study - INFO - Trial 107 finished with values: [0.007388461088903774, 0.0015851964127826198, 0.0040194340470245775] and parameters: {'n_layers': 4, 'embedding_dim': 256, 'lr': 0.009429082007684183, 'lambda_val': 0.000970508371024214, 'batch_size': 1842, 'optimizer': 'RMSprop'}.
2026-06-23 01:53:24,446 - experiment_functions - INFO - Early stopping at epoch 800. Best Metrics: (0.0007095856332916772, 0.0001499936844764431, 0.0003793603490482087)
2026-06-23 01:53:24,722 - optuna.study.study - INFO - Trial 108 finished with values: [0.0007095856332916772, 0.0001499936844764431, 0.0003793603490482087] and parameters: {'n_layers': 1, 'embedding_dim': 64, 'lr': 5.386857749927566e-05, 'lambda_val': 0.0010840808687380718, 'batch_size': 2258, 'optimizer': 'RMSprop'}.
2026-06-23 01:53:52,761 - experiment_functions - INFO - Early stopping at epoch 550. Best Metrics: (0.007521611069361258, 0.001668877099911583, 0.003834086248013638)
2026-06-23 01:53:52,857 - optuna.study.study - INFO - Trial 109 finished with values: [0.007521611069361258, 0.001668877099911583, 0.003834086248013638] and parameters: {'n_layers': 3, 'embedding_dim': 96, 'lr': 0.0054915489808154486, 'lambda_val': 0.0010840808687380718, 'batch_size': 2114, 'optimizer': 'Adam'}.
2026-06-23 01:55:50,343 - experiment_functions - INFO - Early stopping at epoch 2800. Best Metrics: (0.012156583366797041, 0.0025498926360995326, 0.006919942774776503)
2026-06-23 01:55:50,427 - optuna.study.study - INFO - Trial 110 finished with values: [0.012156583366797041, 0.0025498926360995326, 0.006919942774776503] and parameters: {'n_layers': 3, 'embedding_dim': 32, 'lr': 0.010301320128047705, 'lambda_val': 4.998160662190083e-05, 'batch_size': 827, 'optimizer': 'RMSprop'}.
2026-06-23 01:56:33,232 - experiment_functions - INFO - Early stopping at epoch 800. Best Metrics: (0.010616840268247057, 0.0023051660982695466, 0.00596303320674385)
2026-06-23 01:56:33,328 - optuna.study.study - INFO - Trial 111 finished with values: [0.010616840268247057, 0.0023051660982695466, 0.00596303320674385] and parameters: {'n_layers': 4, 'embedding_dim': 96, 'lr': 0.0016936188017047076, 'lambda_val': 1.1976797619462708e-05, 'batch_size': 3305, 'optimizer': 'RMSprop'}.
2026-06-23 01:57:16,624 - experiment_functions - INFO - Early stopping at epoch 850. Best Metrics: (0.007094020028625364, 0.001417835038524694, 0.0037538898282803174)
2026-06-23 01:57:17,432 - optuna.study.study - INFO - Trial 112 finished with values: [0.007094020028625364, 0.001417835038524694, 0.0037538898282803174] and parameters: {'n_layers': 4, 'embedding_dim': 96, 'lr': 0.012967549545266072, 'lambda_val': 0.0007054836248890051, 'batch_size': 3301, 'optimizer': 'RMSprop'}.
2026-06-23 01:57:41,691 - experiment_functions - INFO - Early stopping at epoch 550. Best Metrics: (0.006053269678562405, 0.0014067828723001135, 0.003474261535353628)
2026-06-23 01:57:41,834 - optuna.study.study - INFO - Trial 113 finished with values: [0.006053269678562405, 0.0014067828723001135, 0.003474261535353628] and parameters: {'n_layers': 1, 'embedding_dim': 32, 'lr': 0.0057096641186942364, 'lambda_val': 0.02210274672167655, 'batch_size': 1895, 'optimizer': 'RMSprop'}.
2026-06-23 01:58:08,028 - experiment_functions - INFO - Early stopping at epoch 600. Best Metrics: (0.007544840785040034, 0.0016972969559176459, 0.004293834101490266)
2026-06-23 01:58:08,548 - optuna.study.study - INFO - Trial 114 finished with values: [0.007544840785040034, 0.0016972969559176459, 0.004293834101490266] and parameters: {'n_layers': 1, 'embedding_dim': 32, 'lr': 0.010581481753294916, 'lambda_val': 0.005404522144278895, 'batch_size': 2258, 'optimizer': 'RMSprop'}.
2026-06-23 01:58:55,213 - experiment_functions - INFO - Early stopping at epoch 950. Best Metrics: (0.0005260081093330048, 0.00010894278135657448, 0.00031777525652261935)
2026-06-23 01:58:56,569 - optuna.study.study - INFO - Trial 115 finished with values: [0.0005260081093330048, 0.00010894278135657448, 0.00031777525652261935] and parameters: {'n_layers': 1, 'embedding_dim': 256, 'lr': 4.763262611315115e-05, 'lambda_val': 0.000970508371024214, 'batch_size': 1842, 'optimizer': 'RMSprop'}.
2026-06-23 01:59:30,150 - experiment_functions - INFO - Early stopping at epoch 650. Best Metrics: (0.012685136803354462, 0.0027519893899204248, 0.007582976178612096)
2026-06-23 01:59:30,271 - optuna.study.study - INFO - Trial 116 finished with values: [0.012685136803354462, 0.0027519893899204248, 0.007582976178612096] and parameters: {'n_layers': 1, 'embedding_dim': 256, 'lr': 0.004023997993481987, 'lambda_val': 0.0010840808687380718, 'batch_size': 922, 'optimizer': 'RMSprop'}.
2026-06-23 02:00:08,589 - experiment_functions - INFO - Early stopping at epoch 850. Best Metrics: (0.01005756852749095, 0.0022562207907035493, 0.005908255642142866)
2026-06-23 02:00:08,658 - optuna.study.study - INFO - Trial 117 finished with values: [0.01005756852749095, 0.0022562207907035493, 0.005908255642142866] and parameters: {'n_layers': 2, 'embedding_dim': 32, 'lr': 0.006250784111486187, 'lambda_val': 1.1358678227612878e-06, 'batch_size': 2340, 'optimizer': 'RMSprop'}.
2026-06-23 02:00:50,194 - experiment_functions - INFO - Early stopping at epoch 1000. Best Metrics: (0.0005950983698946931, 0.00011367942402425163, 0.0003093270900303976)
2026-06-23 02:00:50,508 - optuna.study.study - INFO - Trial 118 finished with values: [0.0005950983698946931, 0.00011367942402425163, 0.0003093270900303976] and parameters: {'n_layers': 1, 'embedding_dim': 32, 'lr': 6.572680422363934e-05, 'lambda_val': 1.1678222757114953e-05, 'batch_size': 1895, 'optimizer': 'Adam'}.
2026-06-23 02:01:43,827 - experiment_functions - INFO - Early stopping at epoch 1200. Best Metrics: (0.010590646510190514, 0.002218327649362132, 0.005480685341180302)
2026-06-23 02:01:43,917 - optuna.study.study - INFO - Trial 119 finished with values: [0.010590646510190514, 0.002218327649362132, 0.005480685341180302] and parameters: {'n_layers': 4, 'embedding_dim': 32, 'lr': 0.0025566338112489964, 'lambda_val': 1.2560415581733208e-06, 'batch_size': 827, 'optimizer': 'Adam'}.
2026-06-23 02:02:14,010 - experiment_functions - INFO - Early stopping at epoch 600. Best Metrics: (0.008005921462930218, 0.0017004547176960971, 0.004513205582766475)
2026-06-23 02:02:14,465 - optuna.study.study - INFO - Trial 120 finished with values: [0.008005921462930218, 0.0017004547176960971, 0.004513205582766475] and parameters: {'n_layers': 2, 'embedding_dim': 128, 'lr': 0.050940040347919505, 'lambda_val': 9.258306160931754e-06, 'batch_size': 910, 'optimizer': 'Adam'}.
2026-06-23 02:03:12,141 - experiment_functions - INFO - Early stopping at epoch 1100. Best Metrics: (0.022561658868008875, 0.004701907288114185, 0.012657193738974127)
2026-06-23 02:03:12,229 - optuna.study.study - INFO - Trial 121 finished with values: [0.022561658868008875, 0.004701907288114185, 0.012657193738974127] and parameters: {'n_layers': 3, 'embedding_dim': 128, 'lr': 0.0008213174750905707, 'lambda_val': 1.1678222757114953e-05, 'batch_size': 2651, 'optimizer': 'Adam'}.
2026-06-23 02:04:03,223 - experiment_functions - INFO - Early stopping at epoch 1000. Best Metrics: (0.01091945476949937, 0.0022656940760389034, 0.005890306664249249)
