2026-06-21 07:47:50,441 - optuna.study.study - INFO - Trial 173 finished with values: [0.008628976181551508, 0.0021678034609069093, 0.00527929043853934] and parameters: {'n_layers': 4, 'embedding_dim': 64, 'lr': 0.0023805186554224675, 'lambda_val': 0.004562972374668912, 'batch_size': 1493, 'optimizer': 'Adam'}.
2026-06-21 07:48:27,978 - experiment_functions - INFO - Early stopping at epoch 800. Best Metrics: (0.010053752973870206, 0.0026019957054439816, 0.006350074291690914)
2026-06-21 07:48:28,083 - optuna.study.study - INFO - Trial 174 finished with values: [0.010053752973870206, 0.0026019957054439816, 0.006350074291690914] and parameters: {'n_layers': 4, 'embedding_dim': 96, 'lr': 0.0012796039326126466, 'lambda_val': 1.0716256733312825e-05, 'batch_size': 2151, 'optimizer': 'RMSprop'}.
2026-06-21 07:49:38,061 - experiment_functions - INFO - Early stopping at epoch 1250. Best Metrics: (0.009562311673349765, 0.0023967411898446382, 0.005613346305291209)
2026-06-21 07:49:38,388 - optuna.study.study - INFO - Trial 175 finished with values: [0.009562311673349765, 0.0023967411898446382, 0.005613346305291209] and parameters: {'n_layers': 4, 'embedding_dim': 256, 'lr': 0.0014018982084487695, 'lambda_val': 1.1500391390523163e-06, 'batch_size': 635, 'optimizer': 'Adam'}.
2026-06-21 07:52:32,264 - optuna.study.study - INFO - Trial 176 finished with values: [0.000760279963286913, 0.00018630794492863458, 0.0004428417508671633] and parameters: {'n_layers': 4, 'embedding_dim': 96, 'lr': 7.920065600933663e-05, 'lambda_val': 0.005210462822957554, 'batch_size': 1493, 'optimizer': 'Adam'}.
2026-06-21 07:55:10,031 - optuna.study.study - INFO - Trial 177 finished with values: [0.00790204727376321, 0.0019104458759631173, 0.004954131286147308] and parameters: {'n_layers': 2, 'embedding_dim': 32, 'lr': 0.0008519094805065798, 'lambda_val': 1.1500391390523163e-06, 'batch_size': 2935, 'optimizer': 'RMSprop'}.
2026-06-21 07:55:44,454 - experiment_functions - INFO - Early stopping at epoch 750. Best Metrics: (0.008141255070746907, 0.0020130731337627892, 0.0047945669334909)
2026-06-21 07:55:44,791 - optuna.study.study - INFO - Trial 178 finished with values: [0.008141255070746907, 0.0020130731337627892, 0.0047945669334909] and parameters: {'n_layers': 3, 'embedding_dim': 96, 'lr': 0.0038927780539963937, 'lambda_val': 0.00044247956015671964, 'batch_size': 745, 'optimizer': 'Adam'}.
2026-06-21 07:58:25,523 - optuna.study.study - INFO - Trial 179 finished with values: [0.0074850664030449285, 0.001858342806618669, 0.00467202543378794] and parameters: {'n_layers': 2, 'embedding_dim': 64, 'lr': 0.0008519094805065798, 'lambda_val': 8.006464807509142e-06, 'batch_size': 764, 'optimizer': 'RMSprop'}.
2026-06-21 07:58:54,762 - experiment_functions - INFO - Early stopping at epoch 650. Best Metrics: (0.007924012281973782, 0.0019704433497536944, 0.0047776431378183624)
2026-06-21 07:58:54,850 - optuna.study.study - INFO - Trial 180 finished with values: [0.007924012281973782, 0.0019704433497536944, 0.0047776431378183624] and parameters: {'n_layers': 3, 'embedding_dim': 64, 'lr': 0.002375796180711879, 'lambda_val': 5.7739101339877825e-05, 'batch_size': 3715, 'optimizer': 'RMSprop'}.
2026-06-21 08:01:32,579 - optuna.study.study - INFO - Trial 181 finished with values: [0.007719126174941353, 0.0018109763799418976, 0.004815781385212453] and parameters: {'n_layers': 2, 'embedding_dim': 32, 'lr': 0.0008519094805065798, 'lambda_val': 0.0016838745075427083, 'batch_size': 1721, 'optimizer': 'RMSprop'}.
2026-06-21 08:04:10,800 - optuna.study.study - INFO - Trial 182 finished with values: [0.009709188983025077, 0.0023699002147278014, 0.005819067701818633] and parameters: {'n_layers': 3, 'embedding_dim': 32, 'lr': 0.0005979572889171791, 'lambda_val': 0.004562972374668912, 'batch_size': 1493, 'optimizer': 'RMSprop'}.
2026-06-21 08:05:10,632 - experiment_functions - INFO - Early stopping at epoch 1300. Best Metrics: (0.009348804298815476, 0.002298850574712644, 0.005648986109059768)
2026-06-21 08:05:10,710 - optuna.study.study - INFO - Trial 183 finished with values: [0.009348804298815476, 0.002298850574712644, 0.005648986109059768] and parameters: {'n_layers': 3, 'embedding_dim': 128, 'lr': 0.0008519094805065798, 'lambda_val': 2.7545357777694106e-05, 'batch_size': 3325, 'optimizer': 'RMSprop'}.
2026-06-21 08:08:08,231 - optuna.study.study - INFO - Trial 184 finished with values: [0.004579134620608607, 0.0010278514588859418, 0.0027104590174587113] and parameters: {'n_layers': 1, 'embedding_dim': 256, 'lr': 0.0010929472603386809, 'lambda_val': 0.00044247956015671964, 'batch_size': 745, 'optimizer': 'Adam'}.
2026-06-21 08:08:40,214 - experiment_functions - INFO - Early stopping at epoch 750. Best Metrics: (0.0005999083464110504, 0.00013420487558418593, 0.0003331148191548675)
2026-06-21 08:08:40,299 - optuna.study.study - INFO - Trial 185 finished with values: [0.0005999083464110504, 0.00013420487558418593, 0.0003331148191548675] and parameters: {'n_layers': 2, 'embedding_dim': 64, 'lr': 3.381895161436497e-05, 'lambda_val': 0.0012040212538103386, 'batch_size': 940, 'optimizer': 'RMSprop'}.
2026-06-21 08:09:20,285 - experiment_functions - INFO - Early stopping at epoch 950. Best Metrics: (0.007851355174456249, 0.0018962359479600859, 0.004838285670288292)
2026-06-21 08:09:20,356 - optuna.study.study - INFO - Trial 186 finished with values: [0.007851355174456249, 0.0018962359479600859, 0.004838285670288292] and parameters: {'n_layers': 3, 'embedding_dim': 32, 'lr': 0.002375796180711879, 'lambda_val': 1.1500391390523163e-06, 'batch_size': 3325, 'optimizer': 'Adam'}.
2026-06-21 08:10:47,860 - experiment_functions - INFO - Early stopping at epoch 2000. Best Metrics: (0.010283616418076524, 0.0025277883036503726, 0.006371224255157311)
2026-06-21 08:10:47,946 - optuna.study.study - INFO - Trial 187 finished with values: [0.010283616418076524, 0.0025277883036503726, 0.006371224255157311] and parameters: {'n_layers': 3, 'embedding_dim': 96, 'lr': 0.0014018982084487695, 'lambda_val': 1.1500391390523163e-06, 'batch_size': 745, 'optimizer': 'Adam'}.
2026-06-21 08:11:22,270 - experiment_functions - INFO - Early stopping at epoch 750. Best Metrics: (0.0074956418756460174, 0.0018978148288493115, 0.00457161607513956)
2026-06-21 08:11:22,596 - optuna.study.study - INFO - Trial 188 finished with values: [0.0074956418756460174, 0.0018978148288493115, 0.00457161607513956] and parameters: {'n_layers': 3, 'embedding_dim': 96, 'lr': 0.0023805186554224675, 'lambda_val': 0.00044247956015671964, 'batch_size': 3168, 'optimizer': 'Adam'}.
2026-06-21 08:12:10,599 - experiment_functions - INFO - Early stopping at epoch 1150. Best Metrics: (0.009718128695065881, 0.002393583428066187, 0.00612409245168461)
2026-06-21 08:12:10,674 - optuna.study.study - INFO - Trial 189 finished with values: [0.009718128695065881, 0.002393583428066187, 0.00612409245168461] and parameters: {'n_layers': 3, 'embedding_dim': 32, 'lr': 0.0038927780539963937, 'lambda_val': 6.25171648242475e-06, 'batch_size': 635, 'optimizer': 'Adam'}.
2026-06-21 08:12:34,084 - experiment_functions - INFO - Early stopping at epoch 500. Best Metrics: (0.0005657270858906008, 0.00012788935202728306, 0.00032265708718451293)
2026-06-21 08:12:34,169 - optuna.study.study - INFO - Trial 190 finished with values: [0.0005657270858906008, 0.00012788935202728306, 0.00032265708718451293] and parameters: {'n_layers': 3, 'embedding_dim': 96, 'lr': 0.002375796180711879, 'lambda_val': 0.0003995223661719565, 'batch_size': 3537, 'optimizer': 'SGD'}.
2026-06-21 08:13:00,613 - experiment_functions - INFO - Early stopping at epoch 550. Best Metrics: (0.005964844845312959, 0.0015567765567765569, 0.0035770159482077053)
2026-06-21 08:13:00,957 - optuna.study.study - INFO - Trial 191 finished with values: [0.005964844845312959, 0.0015567765567765569, 0.0035770159482077053] and parameters: {'n_layers': 4, 'embedding_dim': 96, 'lr': 0.003355372423452382, 'lambda_val': 0.006932634583485435, 'batch_size': 1024, 'optimizer': 'RMSprop'}.
2026-06-21 08:15:43,932 - optuna.study.study - INFO - Trial 192 finished with values: [0.012507814982523926, 0.0031151319944423394, 0.007819040439125399] and parameters: {'n_layers': 4, 'embedding_dim': 32, 'lr': 0.0013154801669818224, 'lambda_val': 1.1500391390523163e-06, 'batch_size': 635, 'optimizer': 'Adam'}.
2026-06-21 08:18:34,859 - experiment_functions - INFO - Early stopping at epoch 3600. Best Metrics: (0.008879579322601073, 0.002202538840469875, 0.005338636316080841)
2026-06-21 08:18:34,944 - optuna.study.study - INFO - Trial 193 finished with values: [0.008879579322601073, 0.002202538840469875, 0.005338636316080841] and parameters: {'n_layers': 2, 'embedding_dim': 256, 'lr': 0.0008519094805065798, 'lambda_val': 2.7545357777694106e-05, 'batch_size': 940, 'optimizer': 'RMSprop'}.
2026-06-21 08:21:26,846 - optuna.study.study - INFO - Trial 194 finished with values: [0.009184987310708837, 0.0022278009346974863, 0.005618125853791686] and parameters: {'n_layers': 3, 'embedding_dim': 96, 'lr': 0.00048069281723066455, 'lambda_val': 0.0012040212538103386, 'batch_size': 2144, 'optimizer': 'Adam'}.
2026-06-21 08:22:02,195 - experiment_functions - INFO - Early stopping at epoch 750. Best Metrics: (0.008347780074037756, 0.0021551724137931034, 0.005135565112097177)
2026-06-21 08:22:02,447 - optuna.study.study - INFO - Trial 195 finished with values: [0.008347780074037756, 0.0021551724137931034, 0.005135565112097177] and parameters: {'n_layers': 3, 'embedding_dim': 128, 'lr': 0.0023805186554224675, 'lambda_val': 0.0012040212538103386, 'batch_size': 1024, 'optimizer': 'RMSprop'}.
2026-06-21 08:22:30,735 - experiment_functions - INFO - Early stopping at epoch 650. Best Metrics: (0.00903714675313408, 0.0023509536440570926, 0.005362801358527732)
2026-06-21 08:22:30,823 - optuna.study.study - INFO - Trial 196 finished with values: [0.00903714675313408, 0.0023509536440570926, 0.005362801358527732] and parameters: {'n_layers': 4, 'embedding_dim': 32, 'lr': 0.0023805186554224675, 'lambda_val': 0.0013171013233585188, 'batch_size': 2940, 'optimizer': 'RMSprop'}.
2026-06-21 08:25:07,167 - optuna.study.study - INFO - Trial 197 finished with values: [0.00820310398056412, 0.0019262346848553744, 0.005158181435469202] and parameters: {'n_layers': 2, 'embedding_dim': 32, 'lr': 0.0008519094805065798, 'lambda_val': 1.1500391390523163e-06, 'batch_size': 1042, 'optimizer': 'RMSprop'}.
2026-06-21 08:27:12,276 - experiment_functions - INFO - Early stopping at epoch 2800. Best Metrics: (0.009147505054272084, 0.0023130605027156755, 0.005585197402594846)
2026-06-21 08:27:12,357 - optuna.study.study - INFO - Trial 198 finished with values: [0.009147505054272084, 0.0023130605027156755, 0.005585197402594846] and parameters: {'n_layers': 4, 'embedding_dim': 96, 'lr': 0.0004317731637144049, 'lambda_val': 0.0016838745075427083, 'batch_size': 3537, 'optimizer': 'Adam'}.
2026-06-21 08:27:42,619 - experiment_functions - INFO - Early stopping at epoch 650. Best Metrics: (0.006728606634223737, 0.0016783503852469371, 0.004032452852082927)
2026-06-21 08:27:42,779 - optuna.study.study - INFO - Trial 199 finished with values: [0.006728606634223737, 0.0016783503852469371, 0.004032452852082927] and parameters: {'n_layers': 3, 'embedding_dim': 96, 'lr': 0.0038927780539963937, 'lambda_val': 2.362873378234334e-06, 'batch_size': 3841, 'optimizer': 'Adam'}.
2026-06-21 08:30:19,756 - optuna.study.study - INFO - Trial 200 finished with values: [0.004545260501966999, 0.001026272577996716, 0.0027273666818585117] and parameters: {'n_layers': 1, 'embedding_dim': 64, 'lr': 0.0005491151006472304, 'lambda_val': 7.163252275100761e-05, 'batch_size': 2490, 'optimizer': 'RMSprop'}.
2026-06-21 08:31:51,232 - experiment_functions - INFO - Early stopping at epoch 1950. Best Metrics: (0.011027853256623945, 0.0027172540103574585, 0.006856401106626888)
2026-06-21 08:31:51,312 - optuna.study.study - INFO - Trial 201 finished with values: [0.011027853256623945, 0.0027172540103574585, 0.006856401106626888] and parameters: {'n_layers': 4, 'embedding_dim': 128, 'lr': 0.0008519094805065798, 'lambda_val': 0.00044247956015671964, 'batch_size': 940, 'optimizer': 'Adam'}.
2026-06-21 08:32:25,257 - experiment_functions - INFO - Early stopping at epoch 750. Best Metrics: (0.008138382655749886, 0.0021614879373500063, 0.004987924773933519)
2026-06-21 08:32:25,488 - optuna.study.study - INFO - Trial 202 finished with values: [0.008138382655749886, 0.0021614879373500063, 0.004987924773933519] and parameters: {'n_layers': 4, 'embedding_dim': 64, 'lr': 0.0023805186554224675, 'lambda_val': 0.004562972374668912, 'batch_size': 1493, 'optimizer': 'Adam'}.
2026-06-21 08:35:52,022 - optuna.study.study - INFO - Trial 203 finished with values: [0.008919258883772412, 0.0021835922697991663, 0.005398395498709946] and parameters: {'n_layers': 3, 'embedding_dim': 256, 'lr': 0.0008519094805065798, 'lambda_val': 2.7545357777694106e-05, 'batch_size': 940, 'optimizer': 'Adam'}.
2026-06-21 08:38:36,496 - optuna.study.study - INFO - Trial 204 finished with values: [0.013424534911696656, 0.0033345964380447142, 0.008418680702398073] and parameters: {'n_layers': 4, 'embedding_dim': 32, 'lr': 0.0008519094805065798, 'lambda_val': 0.0012040212538103386, 'batch_size': 635, 'optimizer': 'RMSprop'}.
2026-06-21 08:39:27,439 - experiment_functions - INFO - Early stopping at epoch 950. Best Metrics: (0.00972362057114805, 0.002420424403183024, 0.005699577664189561)
2026-06-21 08:39:27,523 - optuna.study.study - INFO - Trial 205 finished with values: [0.00972362057114805, 0.002420424403183024, 0.005699577664189561] and parameters: {'n_layers': 3, 'embedding_dim': 256, 'lr': 0.0016838259888467748, 'lambda_val': 5.103203231486004e-06, 'batch_size': 1037, 'optimizer': 'RMSprop'}.
2026-06-21 08:40:03,231 - experiment_functions - INFO - Early stopping at epoch 750. Best Metrics: (0.010236831621513022, 0.00258778577744095, 0.00640236759493532)
2026-06-21 08:40:03,550 - optuna.study.study - INFO - Trial 206 finished with values: [0.010236831621513022, 0.00258778577744095, 0.00640236759493532] and parameters: {'n_layers': 4, 'embedding_dim': 96, 'lr': 0.0016838259888467748, 'lambda_val': 2.2595071410094373e-06, 'batch_size': 1493, 'optimizer': 'RMSprop'}.
2026-06-21 08:41:45,935 - experiment_functions - INFO - Early stopping at epoch 2250. Best Metrics: (0.009194448418026854, 0.0023209549071618036, 0.005568428150332667)
2026-06-21 08:41:46,007 - optuna.study.study - INFO - Trial 207 finished with values: [0.009194448418026854, 0.0023209549071618036, 0.005568428150332667] and parameters: {'n_layers': 3, 'embedding_dim': 128, 'lr': 0.0018169040651244567, 'lambda_val': 5.103203231486004e-06, 'batch_size': 635, 'optimizer': 'Adam'}.
2026-06-21 08:44:07,680 - experiment_functions - INFO - Early stopping at epoch 3450. Best Metrics: (0.014157621811741712, 0.0034403814576228374, 0.008646937441575067)
2026-06-21 08:44:07,750 - optuna.study.study - INFO - Trial 208 finished with values: [0.014157621811741712, 0.0034403814576228374, 0.008646937441575067] and parameters: {'n_layers': 4, 'embedding_dim': 32, 'lr': 0.0008519094805065798, 'lambda_val': 0.0013171013233585188, 'batch_size': 857, 'optimizer': 'RMSprop'}.
2026-06-21 08:45:21,871 - experiment_functions - INFO - Early stopping at epoch 1750. Best Metrics: (0.01277527788958837, 0.0030251357837564733, 0.007655500420795431)
2026-06-21 08:45:21,957 - optuna.study.study - INFO - Trial 209 finished with values: [0.01277527788958837, 0.0030251357837564733, 0.007655500420795431] and parameters: {'n_layers': 3, 'embedding_dim': 64, 'lr': 0.0014018982084487695, 'lambda_val': 1.1500391390523163e-06, 'batch_size': 745, 'optimizer': 'RMSprop'}.
2026-06-21 08:46:28,418 - experiment_functions - INFO - Early stopping at epoch 1450. Best Metrics: (0.010880491544269353, 0.002712517367689782, 0.006732296981502562)
2026-06-21 08:46:28,501 - optuna.study.study - INFO - Trial 210 finished with values: [0.010880491544269353, 0.002712517367689782, 0.006732296981502562] and parameters: {'n_layers': 3, 'embedding_dim': 128, 'lr': 0.0014018982084487695, 'lambda_val': 7.488341419741897e-06, 'batch_size': 1024, 'optimizer': 'RMSprop'}.
2026-06-21 08:47:01,080 - experiment_functions - INFO - Early stopping at epoch 750. Best Metrics: (0.010052168586022406, 0.0024646330680813434, 0.00610695613290009)
2026-06-21 08:47:01,173 - optuna.study.study - INFO - Trial 211 finished with values: [0.010052168586022406, 0.0024646330680813434, 0.00610695613290009] and parameters: {'n_layers': 4, 'embedding_dim': 32, 'lr': 0.0038927780539963937, 'lambda_val': 0.0005150119535631827, 'batch_size': 1024, 'optimizer': 'Adam'}.
2026-06-21 08:47:52,567 - experiment_functions - INFO - Early stopping at epoch 1250. Best Metrics: (0.009460548175986436, 0.002259378552482001, 0.005798467211405911)
2026-06-21 08:47:52,639 - optuna.study.study - INFO - Trial 212 finished with values: [0.009460548175986436, 0.002259378552482001, 0.005798467211405911] and parameters: {'n_layers': 3, 'embedding_dim': 32, 'lr': 0.0018169040651244567, 'lambda_val': 5.103203231486004e-06, 'batch_size': 1721, 'optimizer': 'Adam'}.
2026-06-21 08:50:49,332 - optuna.study.study - INFO - Trial 213 finished with values: [0.009933860554195916, 0.002491474043198181, 0.006045081394016129] and parameters: {'n_layers': 4, 'embedding_dim': 96, 'lr': 0.0004317731637144049, 'lambda_val': 0.0016838745075427083, 'batch_size': 1493, 'optimizer': 'Adam'}.
2026-06-21 08:51:54,701 - experiment_functions - INFO - Early stopping at epoch 1250. Best Metrics: (0.00896712278850301, 0.0022388531009220666, 0.005303241932212361)
2026-06-21 08:51:54,782 - optuna.study.study - INFO - Trial 214 finished with values: [0.00896712278850301, 0.0022388531009220666, 0.005303241932212361] and parameters: {'n_layers': 3, 'embedding_dim': 256, 'lr': 0.0008519094805065798, 'lambda_val': 0.002346273182941872, 'batch_size': 940, 'optimizer': 'RMSprop'}.
2026-06-21 08:53:04,692 - experiment_functions - INFO - Early stopping at epoch 1650. Best Metrics: (0.0005827688117268438, 0.00013578375647341166, 0.0003147751894969291)
2026-06-21 08:53:04,810 - optuna.study.study - INFO - Trial 215 finished with values: [0.0005827688117268438, 0.00013578375647341166, 0.0003147751894969291] and parameters: {'n_layers': 4, 'embedding_dim': 64, 'lr': 2.3106109230119936e-05, 'lambda_val': 1.1500391390523163e-06, 'batch_size': 2368, 'optimizer': 'RMSprop'}.
2026-06-21 08:53:28,874 - experiment_functions - INFO - Early stopping at epoch 550. Best Metrics: (0.0027466152509584927, 0.0006441834028040925, 0.0017353134474813452)
2026-06-21 08:53:29,598 - optuna.study.study - INFO - Trial 216 finished with values: [0.0027466152509584927, 0.0006441834028040925, 0.0017353134474813452] and parameters: {'n_layers': 1, 'embedding_dim': 96, 'lr': 0.03430787966798925, 'lambda_val': 0.00020355102572096128, 'batch_size': 1024, 'optimizer': 'RMSprop'}.
2026-06-21 08:56:25,159 - optuna.study.study - INFO - Trial 217 finished with values: [0.003164418122230743, 0.0007152330428192497, 0.0018807301464977973] and parameters: {'n_layers': 1, 'embedding_dim': 256, 'lr': 0.0005979572889171791, 'lambda_val': 0.004282219107710887, 'batch_size': 745, 'optimizer': 'RMSprop'}.
2026-06-21 08:57:06,976 - experiment_functions - INFO - Early stopping at epoch 1000. Best Metrics: (0.008994348019896549, 0.002197802197802198, 0.005377824568192054)
2026-06-21 08:57:07,063 - optuna.study.study - INFO - Trial 218 finished with values: [0.008994348019896549, 0.002197802197802198, 0.005377824568192054] and parameters: {'n_layers': 3, 'embedding_dim': 32, 'lr': 0.0013496360239853042, 'lambda_val': 1.0716256733312825e-05, 'batch_size': 3999, 'optimizer': 'RMSprop'}.
2026-06-21 08:58:26,682 - experiment_functions - INFO - Early stopping at epoch 1850. Best Metrics: (0.011839863184931063, 0.002911456359732222, 0.00715040177596642)
2026-06-21 08:58:26,760 - optuna.study.study - INFO - Trial 219 finished with values: [0.011839863184931063, 0.002911456359732222, 0.00715040177596642] and parameters: {'n_layers': 4, 'embedding_dim': 64, 'lr': 0.0014018982084487695, 'lambda_val': 1.1500391390523163e-06, 'batch_size': 745, 'optimizer': 'Adam'}.
2026-06-21 09:00:08,265 - experiment_functions - INFO - Early stopping at epoch 2550. Best Metrics: (0.004623126946948714, 0.0010562713148920047, 0.0029047047222179466)
2026-06-21 09:00:08,358 - optuna.study.study - INFO - Trial 220 finished with values: [0.004623126946948714, 0.0010562713148920047, 0.0029047047222179466] and parameters: {'n_layers': 1, 'embedding_dim': 64, 'lr': 0.0008519094805065798, 'lambda_val': 0.0012040212538103386, 'batch_size': 2810, 'optimizer': 'RMSprop'}.
2026-06-21 09:02:57,660 - optuna.study.study - INFO - Trial 221 finished with values: [0.011353945144455266, 0.0027756726032588104, 0.0070011281719586545] and parameters: {'n_layers': 4, 'embedding_dim': 64, 'lr': 0.0005979572889171791, 'lambda_val': 2.8562288796614426e-05, 'batch_size': 1309, 'optimizer': 'Adam'}.
2026-06-21 09:04:17,745 - experiment_functions - INFO - Early stopping at epoch 1900. Best Metrics: (0.0006994771147012576, 0.0001468359226979917, 0.00038559577231752175)
2026-06-21 09:04:17,837 - optuna.study.study - INFO - Trial 222 finished with values: [0.0006994771147012576, 0.0001468359226979917, 0.00038559577231752175] and parameters: {'n_layers': 4, 'embedding_dim': 64, 'lr': 1.7014849121413912e-05, 'lambda_val': 2.8562288796614426e-05, 'batch_size': 1024, 'optimizer': 'Adam'}.
2026-06-21 09:04:54,394 - experiment_functions - INFO - Early stopping at epoch 800. Best Metrics: (0.00864743258349775, 0.0022104332449160036, 0.005224358497038567)
