2026-06-21 06:44:08,592 - optuna.study.study - INFO - Trial 125 finished with values: [0.005512614143891336, 0.0013483642793987623, 0.0031946365420171497] and parameters: {'n_layers': 2, 'embedding_dim': 256, 'lr': 0.0034862825925565688, 'lambda_val': 0.00029794264644292603, 'batch_size': 3325, 'optimizer': 'Adam'}.
2026-06-21 06:44:47,922 - experiment_functions - INFO - Early stopping at epoch 950. Best Metrics: (0.0035242991062546464, 0.000982063913098396, 0.0021784405071009335)
2026-06-21 06:44:48,069 - optuna.study.study - INFO - Trial 126 finished with values: [0.0035242991062546464, 0.000982063913098396, 0.0021784405071009335] and parameters: {'n_layers': 2, 'embedding_dim': 32, 'lr': 0.0010929472603386809, 'lambda_val': 0.07611756008508126, 'batch_size': 3252, 'optimizer': 'RMSprop'}.
2026-06-21 06:46:09,923 - experiment_functions - INFO - Early stopping at epoch 1800. Best Metrics: (0.011013213157696771, 0.002721990653025136, 0.00684465566189869)
2026-06-21 06:46:10,257 - optuna.study.study - INFO - Trial 127 finished with values: [0.011013213157696771, 0.002721990653025136, 0.00684465566189869] and parameters: {'n_layers': 3, 'embedding_dim': 128, 'lr': 0.0008519094805065798, 'lambda_val': 0.0012040212538103386, 'batch_size': 1024, 'optimizer': 'RMSprop'}.
2026-06-21 06:46:35,305 - experiment_functions - INFO - Early stopping at epoch 550. Best Metrics: (0.0045577824576433, 0.0011699507389162562, 0.0026833601019073225)
2026-06-21 06:46:35,658 - optuna.study.study - INFO - Trial 128 finished with values: [0.0045577824576433, 0.0011699507389162562, 0.0026833601019073225] and parameters: {'n_layers': 3, 'embedding_dim': 64, 'lr': 0.011367988851864337, 'lambda_val': 0.0012040212538103386, 'batch_size': 1024, 'optimizer': 'RMSprop'}.
2026-06-21 06:47:00,486 - experiment_functions - INFO - Early stopping at epoch 550. Best Metrics: (0.002931886817549593, 0.0006426045219148668, 0.0017228097420705333)
2026-06-21 06:47:00,556 - optuna.study.study - INFO - Trial 129 finished with values: [0.002931886817549593, 0.0006426045219148668, 0.0017228097420705333] and parameters: {'n_layers': 1, 'embedding_dim': 96, 'lr': 0.045448234415163005, 'lambda_val': 2.362873378234334e-06, 'batch_size': 3709, 'optimizer': 'Adam'}.
2026-06-21 06:47:44,029 - experiment_functions - INFO - Early stopping at epoch 800. Best Metrics: (0.008956467330700437, 0.002229379815586712, 0.005335448662802291)
2026-06-21 06:47:44,106 - optuna.study.study - INFO - Trial 130 finished with values: [0.008956467330700437, 0.002229379815586712, 0.005335448662802291] and parameters: {'n_layers': 3, 'embedding_dim': 256, 'lr': 0.0018169040651244567, 'lambda_val': 5.103203231486004e-06, 'batch_size': 1721, 'optimizer': 'RMSprop'}.
2026-06-21 06:49:24,860 - experiment_functions - INFO - Early stopping at epoch 2200. Best Metrics: (0.009127678292506918, 0.0023430592396109636, 0.005558071610865277)
2026-06-21 06:49:24,966 - optuna.study.study - INFO - Trial 131 finished with values: [0.009127678292506918, 0.0023430592396109636, 0.005558071610865277] and parameters: {'n_layers': 3, 'embedding_dim': 128, 'lr': 0.0005979572889171791, 'lambda_val': 7.876464964197065e-06, 'batch_size': 3804, 'optimizer': 'RMSprop'}.
2026-06-21 06:50:38,348 - experiment_functions - INFO - Early stopping at epoch 1300. Best Metrics: (0.007937999791890185, 0.002032019704433498, 0.00476789977890884)
2026-06-21 06:50:38,431 - optuna.study.study - INFO - Trial 132 finished with values: [0.007937999791890185, 0.002032019704433498, 0.00476789977890884] and parameters: {'n_layers': 4, 'embedding_dim': 256, 'lr': 0.0007452315974278925, 'lambda_val': 0.0003995223661719565, 'batch_size': 3537, 'optimizer': 'Adam'}.
2026-06-21 06:51:05,476 - experiment_functions - INFO - Early stopping at epoch 550. Best Metrics: (0.006404459638584341, 0.0015630920803334598, 0.003748798382028408)
2026-06-21 06:51:05,568 - optuna.study.study - INFO - Trial 133 finished with values: [0.006404459638584341, 0.0015630920803334598, 0.003748798382028408] and parameters: {'n_layers': 4, 'embedding_dim': 96, 'lr': 0.01809104682856791, 'lambda_val': 2.8562288796614426e-05, 'batch_size': 3841, 'optimizer': 'Adam'}.
2026-06-21 06:51:30,236 - experiment_functions - INFO - Early stopping at epoch 500. Best Metrics: (0.0028465111828961153, 0.000658393330807124, 0.0018134284597526337)
2026-06-21 06:51:30,599 - optuna.study.study - INFO - Trial 134 finished with values: [0.0028465111828961153, 0.000658393330807124, 0.0018134284597526337] and parameters: {'n_layers': 3, 'embedding_dim': 128, 'lr': 0.05071971167749316, 'lambda_val': 0.0012040212538103386, 'batch_size': 1493, 'optimizer': 'RMSprop'}.
2026-06-21 06:52:00,147 - experiment_functions - INFO - Early stopping at epoch 600. Best Metrics: (0.007548071124424493, 0.0019499178981937603, 0.004582686085275689)
2026-06-21 06:52:00,439 - optuna.study.study - INFO - Trial 135 finished with values: [0.007548071124424493, 0.0019499178981937603, 0.004582686085275689] and parameters: {'n_layers': 3, 'embedding_dim': 128, 'lr': 0.002375796180711879, 'lambda_val': 0.0003995223661719565, 'batch_size': 3537, 'optimizer': 'RMSprop'}.
2026-06-21 06:52:32,672 - experiment_functions - INFO - Early stopping at epoch 650. Best Metrics: (0.008421804312859075, 0.0021599090564607807, 0.005112148077359745)
2026-06-21 06:52:32,756 - optuna.study.study - INFO - Trial 136 finished with values: [0.008421804312859075, 0.0021599090564607807, 0.005112148077359745] and parameters: {'n_layers': 4, 'embedding_dim': 128, 'lr': 0.0023805186554224675, 'lambda_val': 0.0012040212538103386, 'batch_size': 1024, 'optimizer': 'RMSprop'}.
2026-06-21 06:55:10,757 - optuna.study.study - INFO - Trial 137 finished with values: [0.005290010747397357, 0.0011004799797903245, 0.003262674383896446] and parameters: {'n_layers': 1, 'embedding_dim': 64, 'lr': 0.0008519094805065798, 'lambda_val': 2.7545357777694106e-05, 'batch_size': 940, 'optimizer': 'RMSprop'}.
2026-06-21 06:55:40,927 - experiment_functions - INFO - Early stopping at epoch 650. Best Metrics: (0.007159504095235503, 0.0017920298092711888, 0.004255031322226746)
2026-06-21 06:55:41,014 - optuna.study.study - INFO - Trial 138 finished with values: [0.007159504095235503, 0.0017920298092711888, 0.004255031322226746] and parameters: {'n_layers': 3, 'embedding_dim': 96, 'lr': 0.0038927780539963937, 'lambda_val': 6.25171648242475e-06, 'batch_size': 3841, 'optimizer': 'Adam'}.
2026-06-21 06:57:27,992 - experiment_functions - INFO - Early stopping at epoch 2200. Best Metrics: (0.006485624547886079, 0.0015694076038903625, 0.0038404992993855184)
2026-06-21 06:57:28,071 - optuna.study.study - INFO - Trial 139 finished with values: [0.006485624547886079, 0.0015694076038903625, 0.0038404992993855184] and parameters: {'n_layers': 2, 'embedding_dim': 256, 'lr': 0.0013154801669818224, 'lambda_val': 5.912078135912686e-06, 'batch_size': 2350, 'optimizer': 'Adam'}.
2026-06-21 07:00:09,722 - optuna.study.study - INFO - Trial 140 finished with values: [0.0048026159219512095, 0.0010846911708980674, 0.0030158191901406327] and parameters: {'n_layers': 1, 'embedding_dim': 96, 'lr': 0.0005979572889171791, 'lambda_val': 0.0007463607951250979, 'batch_size': 3804, 'optimizer': 'RMSprop'}.
2026-06-21 07:01:11,559 - experiment_functions - INFO - Early stopping at epoch 1100. Best Metrics: (0.008049343618113597, 0.0019878110395351776, 0.004812100957826372)
2026-06-21 07:01:11,638 - optuna.study.study - INFO - Trial 141 finished with values: [0.008049343618113597, 0.0019878110395351776, 0.004812100957826372] and parameters: {'n_layers': 4, 'embedding_dim': 256, 'lr': 0.0007452315974278925, 'lambda_val': 0.004562972374668912, 'batch_size': 1493, 'optimizer': 'Adam'}.
2026-06-21 07:01:49,211 - experiment_functions - INFO - Early stopping at epoch 650. Best Metrics: (0.008184734508545847, 0.0020999115826702036, 0.004904587097665293)
2026-06-21 07:01:49,320 - optuna.study.study - INFO - Trial 142 finished with values: [0.008184734508545847, 0.0020999115826702036, 0.004904587097665293] and parameters: {'n_layers': 4, 'embedding_dim': 256, 'lr': 0.0012796039326126466, 'lambda_val': 0.0016838745075427083, 'batch_size': 2581, 'optimizer': 'RMSprop'}.
2026-06-21 07:03:10,447 - experiment_functions - INFO - Early stopping at epoch 1850. Best Metrics: (0.009604113621413444, 0.002376215738284704, 0.005781092368874891)
2026-06-21 07:03:10,544 - optuna.study.study - INFO - Trial 143 finished with values: [0.009604113621413444, 0.002376215738284704, 0.005781092368874891] and parameters: {'n_layers': 3, 'embedding_dim': 96, 'lr': 0.0014018982084487695, 'lambda_val': 0.00044247956015671964, 'batch_size': 745, 'optimizer': 'Adam'}.
2026-06-21 07:06:21,146 - optuna.study.study - INFO - Trial 144 finished with values: [0.003940970773724668, 0.0009141720348616901, 0.0024743040578636575] and parameters: {'n_layers': 2, 'embedding_dim': 256, 'lr': 0.00035236392400285417, 'lambda_val': 0.0003995223661719565, 'batch_size': 1721, 'optimizer': 'Adam'}.
2026-06-21 07:07:10,812 - experiment_functions - INFO - Early stopping at epoch 1150. Best Metrics: (0.007143055876595036, 0.00178413540482506, 0.004282409945931705)
2026-06-21 07:07:11,138 - optuna.study.study - INFO - Trial 145 finished with values: [0.007143055876595036, 0.00178413540482506, 0.004282409945931705] and parameters: {'n_layers': 2, 'embedding_dim': 96, 'lr': 0.0018169040651244567, 'lambda_val': 0.0018148423298626976, 'batch_size': 745, 'optimizer': 'RMSprop'}.
2026-06-21 07:09:50,803 - optuna.study.study - INFO - Trial 146 finished with values: [0.002547041187568776, 0.0005715548818997095, 0.0016223855725652286] and parameters: {'n_layers': 2, 'embedding_dim': 64, 'lr': 0.0004317731637144049, 'lambda_val': 0.0018148423298626976, 'batch_size': 745, 'optimizer': 'Adam'}.
2026-06-21 07:12:40,156 - optuna.study.study - INFO - Trial 147 finished with values: [0.01096070641824041, 0.0027393583428066185, 0.006659277429713548] and parameters: {'n_layers': 4, 'embedding_dim': 64, 'lr': 0.0005979572889171791, 'lambda_val': 2.8562288796614426e-05, 'batch_size': 1309, 'optimizer': 'Adam'}.
2026-06-21 07:13:12,228 - experiment_functions - INFO - Early stopping at epoch 700. Best Metrics: (0.008971364621301414, 0.002243589743589744, 0.005498174622525056)
2026-06-21 07:13:12,314 - optuna.study.study - INFO - Trial 148 finished with values: [0.008971364621301414, 0.002243589743589744, 0.005498174622525056] and parameters: {'n_layers': 3, 'embedding_dim': 96, 'lr': 0.0023805186554224675, 'lambda_val': 0.0012040212538103386, 'batch_size': 1024, 'optimizer': 'RMSprop'}.
2026-06-21 07:13:35,095 - experiment_functions - INFO - Early stopping at epoch 500. Best Metrics: (0.0005797084973438517, 0.00012946823291650877, 0.00032661778398352645)
2026-06-21 07:13:35,189 - optuna.study.study - INFO - Trial 149 finished with values: [0.0005797084973438517, 0.00012946823291650877, 0.00032661778398352645] and parameters: {'n_layers': 3, 'embedding_dim': 64, 'lr': 0.0013154801669818224, 'lambda_val': 0.08238786849927517, 'batch_size': 1462, 'optimizer': 'SGD'}.
2026-06-21 07:15:05,505 - experiment_functions - INFO - Early stopping at epoch 2100. Best Metrics: (0.01054705184725001, 0.0026588354174561075, 0.006447933964096906)
2026-06-21 07:15:05,584 - optuna.study.study - INFO - Trial 150 finished with values: [0.01054705184725001, 0.0026588354174561075, 0.006447933964096906] and parameters: {'n_layers': 4, 'embedding_dim': 64, 'lr': 0.0007452315974278925, 'lambda_val': 0.0013171013233585188, 'batch_size': 1493, 'optimizer': 'Adam'}.
2026-06-21 07:15:32,611 - experiment_functions - INFO - Early stopping at epoch 600. Best Metrics: (0.007418865521424779, 0.0018678160919540232, 0.004466821223973887)
2026-06-21 07:15:32,699 - optuna.study.study - INFO - Trial 151 finished with values: [0.007418865521424779, 0.0018678160919540232, 0.004466821223973887] and parameters: {'n_layers': 3, 'embedding_dim': 64, 'lr': 0.0038927780539963937, 'lambda_val': 2.362873378234334e-06, 'batch_size': 3841, 'optimizer': 'RMSprop'}.
2026-06-21 07:16:21,260 - experiment_functions - INFO - Early stopping at epoch 1100. Best Metrics: (0.010590837848082705, 0.0026462043703423016, 0.006666890670279035)
2026-06-21 07:16:21,347 - optuna.study.study - INFO - Trial 152 finished with values: [0.010590837848082705, 0.0026462043703423016, 0.006666890670279035] and parameters: {'n_layers': 4, 'embedding_dim': 64, 'lr': 0.0013154801669818224, 'lambda_val': 0.004562972374668912, 'batch_size': 725, 'optimizer': 'Adam'}.
2026-06-21 07:17:18,407 - experiment_functions - INFO - Early stopping at epoch 1400. Best Metrics: (0.006766730513828911, 0.0016546671719085515, 0.004146570092831789)
2026-06-21 07:17:18,484 - optuna.study.study - INFO - Trial 153 finished with values: [0.006766730513828911, 0.0016546671719085515, 0.004146570092831789] and parameters: {'n_layers': 2, 'embedding_dim': 32, 'lr': 0.0014018982084487695, 'lambda_val': 1.1500391390523163e-06, 'batch_size': 3924, 'optimizer': 'RMSprop'}.
2026-06-21 07:18:28,737 - experiment_functions - INFO - Early stopping at epoch 1650. Best Metrics: (0.00971839454432924, 0.0023572691676139955, 0.005939557044563599)
2026-06-21 07:18:28,813 - optuna.study.study - INFO - Trial 154 finished with values: [0.00971839454432924, 0.0023572691676139955, 0.005939557044563599] and parameters: {'n_layers': 3, 'embedding_dim': 64, 'lr': 0.0016838259888467748, 'lambda_val': 1.1500391390523163e-06, 'batch_size': 1037, 'optimizer': 'Adam'}.
2026-06-21 07:20:04,023 - experiment_functions - INFO - Early stopping at epoch 2250. Best Metrics: (0.012518198420142587, 0.0031182897562207906, 0.007645137907591506)
2026-06-21 07:20:04,119 - optuna.study.study - INFO - Trial 155 finished with values: [0.012518198420142587, 0.0031182897562207906, 0.007645137907591506] and parameters: {'n_layers': 3, 'embedding_dim': 64, 'lr': 0.0014018982084487695, 'lambda_val': 2.362873378234334e-06, 'batch_size': 745, 'optimizer': 'RMSprop'}.
2026-06-21 07:20:55,402 - experiment_functions - INFO - Early stopping at epoch 950. Best Metrics: (0.007208104080519358, 0.0018725527346217003, 0.0042742928183453046)
2026-06-21 07:20:55,486 - optuna.study.study - INFO - Trial 156 finished with values: [0.007208104080519358, 0.0018725527346217003, 0.0042742928183453046] and parameters: {'n_layers': 3, 'embedding_dim': 256, 'lr': 0.0014018982084487695, 'lambda_val': 0.0018148423298626976, 'batch_size': 1721, 'optimizer': 'Adam'}.
2026-06-21 07:23:37,983 - optuna.study.study - INFO - Trial 157 finished with values: [0.011077871325344628, 0.002769357079701908, 0.00668053795999955] and parameters: {'n_layers': 4, 'embedding_dim': 32, 'lr': 0.0005979572889171791, 'lambda_val': 0.0013171013233585188, 'batch_size': 1042, 'optimizer': 'RMSprop'}.
2026-06-21 07:24:25,073 - experiment_functions - INFO - Early stopping at epoch 950. Best Metrics: (0.004730916351449697, 0.0012173171655930277, 0.002747852590778685)
2026-06-21 07:24:25,173 - optuna.study.study - INFO - Trial 158 finished with values: [0.004730916351449697, 0.0012173171655930277, 0.002747852590778685] and parameters: {'n_layers': 2, 'embedding_dim': 256, 'lr': 0.0008519094805065798, 'lambda_val': 0.009524830173270039, 'batch_size': 3983, 'optimizer': 'RMSprop'}.
2026-06-21 07:25:54,336 - experiment_functions - INFO - Early stopping at epoch 2200. Best Metrics: (0.01109343719534141, 0.0026635720601237843, 0.006853888909409992)
2026-06-21 07:25:54,427 - optuna.study.study - INFO - Trial 159 finished with values: [0.01109343719534141, 0.0026635720601237843, 0.006853888909409992] and parameters: {'n_layers': 3, 'embedding_dim': 32, 'lr': 0.0018169040651244567, 'lambda_val': 5.103203231486004e-06, 'batch_size': 635, 'optimizer': 'Adam'}.
2026-06-21 07:26:42,824 - experiment_functions - INFO - Early stopping at epoch 850. Best Metrics: (0.00878942069723926, 0.0022609574333712266, 0.005101378110705875)
2026-06-21 07:26:43,219 - optuna.study.study - INFO - Trial 160 finished with values: [0.00878942069723926, 0.0022609574333712266, 0.005101378110705875] and parameters: {'n_layers': 4, 'embedding_dim': 256, 'lr': 0.0007452315974278925, 'lambda_val': 0.0012040212538103386, 'batch_size': 3537, 'optimizer': 'RMSprop'}.
2026-06-21 07:27:08,650 - experiment_functions - INFO - Early stopping at epoch 550. Best Metrics: (0.005490359006631126, 0.0013467853985095367, 0.003232297438775376)
2026-06-21 07:27:08,986 - optuna.study.study - INFO - Trial 161 finished with values: [0.005490359006631126, 0.0013467853985095367, 0.003232297438775376] and parameters: {'n_layers': 4, 'embedding_dim': 64, 'lr': 0.03257283780382754, 'lambda_val': 2.362873378234334e-06, 'batch_size': 2581, 'optimizer': 'Adam'}.
2026-06-21 07:28:04,461 - experiment_functions - INFO - Early stopping at epoch 1300. Best Metrics: (0.011048744390201473, 0.0027567260325881016, 0.006811964355179477)
2026-06-21 07:28:04,549 - optuna.study.study - INFO - Trial 162 finished with values: [0.011048744390201473, 0.0027567260325881016, 0.006811964355179477] and parameters: {'n_layers': 3, 'embedding_dim': 64, 'lr': 0.0014018982084487695, 'lambda_val': 0.0018148423298626976, 'batch_size': 745, 'optimizer': 'RMSprop'}.
2026-06-21 07:30:24,648 - experiment_functions - INFO - Early stopping at epoch 2900. Best Metrics: (0.006179062644280598, 0.001555197675887331, 0.0036253977116591464)
2026-06-21 07:30:24,756 - optuna.study.study - INFO - Trial 163 finished with values: [0.006179062644280598, 0.001555197675887331, 0.0036253977116591464] and parameters: {'n_layers': 2, 'embedding_dim': 256, 'lr': 0.0013154801669818224, 'lambda_val': 5.912078135912686e-06, 'batch_size': 2350, 'optimizer': 'Adam'}.
2026-06-21 07:30:54,773 - experiment_functions - INFO - Early stopping at epoch 600. Best Metrics: (0.007812183534892191, 0.001984653277756726, 0.004705399010685075)
2026-06-21 07:30:54,857 - optuna.study.study - INFO - Trial 164 finished with values: [0.007812183534892191, 0.001984653277756726, 0.004705399010685075] and parameters: {'n_layers': 4, 'embedding_dim': 128, 'lr': 0.004764093389215728, 'lambda_val': 0.00044247956015671964, 'batch_size': 2981, 'optimizer': 'Adam'}.
2026-06-21 07:33:40,471 - optuna.study.study - INFO - Trial 165 finished with values: [0.010199937581070106, 0.002425161045850701, 0.006237742433905823] and parameters: {'n_layers': 3, 'embedding_dim': 64, 'lr': 0.0008519094805065798, 'lambda_val': 1.1500391390523163e-06, 'batch_size': 940, 'optimizer': 'Adam'}.
2026-06-21 07:36:31,165 - optuna.study.study - INFO - Trial 166 finished with values: [0.012247967464578284, 0.0030630289250978904, 0.007474764247302986] and parameters: {'n_layers': 4, 'embedding_dim': 64, 'lr': 0.0005491151006472304, 'lambda_val': 7.163252275100761e-05, 'batch_size': 2490, 'optimizer': 'RMSprop'}.
2026-06-21 07:38:01,162 - experiment_functions - INFO - Early stopping at epoch 2100. Best Metrics: (0.01235959216019529, 0.0031561828975622086, 0.00764438374000696)
2026-06-21 07:38:01,236 - optuna.study.study - INFO - Trial 167 finished with values: [0.01235959216019529, 0.0031561828975622086, 0.00764438374000696] and parameters: {'n_layers': 4, 'embedding_dim': 64, 'lr': 0.0008519094805065798, 'lambda_val': 0.0016838745075427083, 'batch_size': 857, 'optimizer': 'RMSprop'}.
2026-06-21 07:38:49,660 - experiment_functions - INFO - Early stopping at epoch 1000. Best Metrics: (0.010730086348246773, 0.0026319944423392706, 0.006497434712724768)
2026-06-21 07:38:49,752 - optuna.study.study - INFO - Trial 168 finished with values: [0.010730086348246773, 0.0026319944423392706, 0.006497434712724768] and parameters: {'n_layers': 4, 'embedding_dim': 128, 'lr': 0.0014018982084487695, 'lambda_val': 0.00044247956015671964, 'batch_size': 1024, 'optimizer': 'Adam'}.
2026-06-21 07:41:09,725 - experiment_functions - INFO - Early stopping at epoch 3150. Best Metrics: (0.003806090074190602, 0.0009820639130983958, 0.0024280612800817564)
2026-06-21 07:41:09,822 - optuna.study.study - INFO - Trial 169 finished with values: [0.003806090074190602, 0.0009820639130983958, 0.0024280612800817564] and parameters: {'n_layers': 1, 'embedding_dim': 256, 'lr': 0.0007452315974278925, 'lambda_val': 0.00858516966227484, 'batch_size': 1493, 'optimizer': 'RMSprop'}.
2026-06-21 07:41:59,092 - experiment_functions - INFO - Early stopping at epoch 1100. Best Metrics: (0.01078923705958734, 0.002696728558797524, 0.0064270097286705675)
2026-06-21 07:41:59,193 - optuna.study.study - INFO - Trial 170 finished with values: [0.01078923705958734, 0.002696728558797524, 0.0064270097286705675] and parameters: {'n_layers': 3, 'embedding_dim': 96, 'lr': 0.0014018982084487695, 'lambda_val': 0.0012040212538103386, 'batch_size': 1024, 'optimizer': 'RMSprop'}.
2026-06-21 07:44:18,568 - experiment_functions - INFO - Early stopping at epoch 3350. Best Metrics: (0.009911740256334033, 0.002470948591638247, 0.006131591674363971)
2026-06-21 07:44:18,654 - optuna.study.study - INFO - Trial 171 finished with values: [0.009911740256334033, 0.002470948591638247, 0.006131591674363971] and parameters: {'n_layers': 3, 'embedding_dim': 64, 'lr': 0.0005491151006472304, 'lambda_val': 0.0012040212538103386, 'batch_size': 2490, 'optimizer': 'RMSprop'}.
2026-06-21 07:47:16,621 - optuna.study.study - INFO - Trial 172 finished with values: [0.01059140829180415, 0.00265409877478843, 0.006644420144411744] and parameters: {'n_layers': 4, 'embedding_dim': 96, 'lr': 0.0004317731637144049, 'lambda_val': 0.0016838745075427083, 'batch_size': 1493, 'optimizer': 'Adam'}.
2026-06-21 07:47:50,340 - experiment_functions - INFO - Early stopping at epoch 750. Best Metrics: (0.008628976181551508, 0.0021678034609069093, 0.00527929043853934)
