2026-06-19 11:29:42,589 - optuna.study.study - INFO - Trial 262 finished with values: [0.027996948297328433, 0.006009220664393079, 0.01592275156458353] and parameters: {'n_layers': 1, 'embedding_dim': 256, 'lr': 0.0020290919563790725, 'lambda_val': 0.0006058441723547203, 'batch_size': 2567, 'optimizer': 'Adam'}.
2026-06-19 11:30:48,273 - experiment_functions - INFO - Early stopping at epoch 1450. Best Metrics: (0.03200066615728478, 0.006710243779209296, 0.018662716735594494)
2026-06-19 11:30:48,361 - optuna.study.study - INFO - Trial 263 finished with values: [0.03200066615728478, 0.006710243779209296, 0.018662716735594494] and parameters: {'n_layers': 1, 'embedding_dim': 96, 'lr': 0.0020290919563790725, 'lambda_val': 0.0003743444509143199, 'batch_size': 1875, 'optimizer': 'Adam'}.
2026-06-19 11:31:52,232 - experiment_functions - INFO - Early stopping at epoch 1250. Best Metrics: (0.028319220244125864, 0.005925539977264116, 0.01586831218569706)
2026-06-19 11:31:52,310 - optuna.study.study - INFO - Trial 264 finished with values: [0.028319220244125864, 0.005925539977264116, 0.01586831218569706] and parameters: {'n_layers': 2, 'embedding_dim': 128, 'lr': 0.000670518483727842, 'lambda_val': 1.3063371603281255e-06, 'batch_size': 3743, 'optimizer': 'RMSprop'}.
2026-06-19 11:32:41,370 - experiment_functions - INFO - Early stopping at epoch 1000. Best Metrics: (0.031058358594699447, 0.00653972464317292, 0.01799489263640979)
2026-06-19 11:32:41,452 - optuna.study.study - INFO - Trial 265 finished with values: [0.031058358594699447, 0.00653972464317292, 0.01799489263640979] and parameters: {'n_layers': 1, 'embedding_dim': 128, 'lr': 0.0020290919563790725, 'lambda_val': 1.9209272632964056e-06, 'batch_size': 3739, 'optimizer': 'Adam'}.
2026-06-19 11:33:09,339 - experiment_functions - INFO - Early stopping at epoch 550. Best Metrics: (0.013565099263105874, 0.00307092332954402, 0.007615677057118057)
2026-06-19 11:33:09,435 - optuna.study.study - INFO - Trial 266 finished with values: [0.013565099263105874, 0.00307092332954402, 0.007615677057118057] and parameters: {'n_layers': 1, 'embedding_dim': 128, 'lr': 0.027033691506707615, 'lambda_val': 0.0001469242914477015, 'batch_size': 2567, 'optimizer': 'Adam'}.
2026-06-19 11:34:05,457 - experiment_functions - INFO - Early stopping at epoch 1300. Best Metrics: (0.0036937328654904167, 0.0009331186055323986, 0.0021602560787368236)
2026-06-19 11:34:05,556 - optuna.study.study - INFO - Trial 267 finished with values: [0.0036937328654904167, 0.0009331186055323986, 0.0021602560787368236] and parameters: {'n_layers': 1, 'embedding_dim': 64, 'lr': 0.07848868462222164, 'lambda_val': 1.3063371603281255e-06, 'batch_size': 3994, 'optimizer': 'RMSprop'}.
2026-06-19 11:34:34,606 - experiment_functions - INFO - Early stopping at epoch 550. Best Metrics: (0.006346241422282629, 0.0015457243905519769, 0.003879309157429859)
2026-06-19 11:34:34,709 - optuna.study.study - INFO - Trial 268 finished with values: [0.006346241422282629, 0.0015457243905519769, 0.003879309157429859] and parameters: {'n_layers': 1, 'embedding_dim': 256, 'lr': 0.0697492325739507, 'lambda_val': 1.1042104634029595e-06, 'batch_size': 1593, 'optimizer': 'Adam'}.
2026-06-19 11:35:00,002 - experiment_functions - INFO - Early stopping at epoch 550. Best Metrics: (0.010328553794187827, 0.002393583428066187, 0.005704942699411732)
2026-06-19 11:35:00,090 - optuna.study.study - INFO - Trial 269 finished with values: [0.010328553794187827, 0.002393583428066187, 0.005704942699411732] and parameters: {'n_layers': 1, 'embedding_dim': 64, 'lr': 0.04959207546701757, 'lambda_val': 0.000666881885592315, 'batch_size': 3739, 'optimizer': 'Adam'}.
2026-06-19 11:35:32,553 - experiment_functions - INFO - Early stopping at epoch 700. Best Metrics: (0.029513017572420086, 0.0062034230137678415, 0.016596693456048743)
2026-06-19 11:35:32,643 - optuna.study.study - INFO - Trial 270 finished with values: [0.029513017572420086, 0.0062034230137678415, 0.016596693456048743] and parameters: {'n_layers': 1, 'embedding_dim': 64, 'lr': 0.0045010260516877044, 'lambda_val': 1.1042104634029595e-06, 'batch_size': 3938, 'optimizer': 'Adam'}.
2026-06-19 11:37:02,382 - experiment_functions - INFO - Early stopping at epoch 2050. Best Metrics: (0.02286602391613554, 0.004880320828596691, 0.012953341464187088)
2026-06-19 11:37:02,473 - optuna.study.study - INFO - Trial 271 finished with values: [0.02286602391613554, 0.004880320828596691, 0.012953341464187088] and parameters: {'n_layers': 3, 'embedding_dim': 32, 'lr': 0.0008520784697548674, 'lambda_val': 0.0003743444509143199, 'batch_size': 1593, 'optimizer': 'RMSprop'}.
2026-06-19 11:39:52,889 - optuna.study.study - INFO - Trial 272 finished with values: [0.031970720984847226, 0.006773399014778326, 0.018280849029732014] and parameters: {'n_layers': 1, 'embedding_dim': 32, 'lr': 0.0008520784697548674, 'lambda_val': 1.3063371603281255e-06, 'batch_size': 3739, 'optimizer': 'RMSprop'}.
2026-06-19 11:40:49,651 - experiment_functions - INFO - Early stopping at epoch 1200. Best Metrics: (0.01579142821805274, 0.003680371352785146, 0.008467111287533167)
2026-06-19 11:40:49,745 - optuna.study.study - INFO - Trial 273 finished with values: [0.01579142821805274, 0.003680371352785146, 0.008467111287533167] and parameters: {'n_layers': 2, 'embedding_dim': 96, 'lr': 0.000670518483727842, 'lambda_val': 0.03651387850869963, 'batch_size': 2427, 'optimizer': 'Adam'}.
2026-06-19 11:41:30,227 - experiment_functions - INFO - Early stopping at epoch 750. Best Metrics: (0.025310911804692877, 0.005396614879373501, 0.014328481556188221)
2026-06-19 11:41:30,520 - optuna.study.study - INFO - Trial 274 finished with values: [0.025310911804692877, 0.005396614879373501, 0.014328481556188221] and parameters: {'n_layers': 1, 'embedding_dim': 256, 'lr': 0.0020290919563790725, 'lambda_val': 0.000605976275542129, 'batch_size': 3994, 'optimizer': 'RMSprop'}.
2026-06-19 11:42:24,445 - experiment_functions - INFO - Early stopping at epoch 1100. Best Metrics: (0.027024049942139354, 0.005750284198560061, 0.015190263856706266)
2026-06-19 11:42:24,534 - optuna.study.study - INFO - Trial 275 finished with values: [0.027024049942139354, 0.005750284198560061, 0.015190263856706266] and parameters: {'n_layers': 2, 'embedding_dim': 96, 'lr': 0.0008520784697548674, 'lambda_val': 0.000666881885592315, 'batch_size': 3739, 'optimizer': 'RMSprop'}.
2026-06-19 11:43:13,984 - experiment_functions - INFO - Early stopping at epoch 850. Best Metrics: (0.025397171303523754, 0.005398193760262725, 0.014489068227790858)
2026-06-19 11:43:14,079 - optuna.study.study - INFO - Trial 276 finished with values: [0.025397171303523754, 0.005398193760262725, 0.014489068227790858] and parameters: {'n_layers': 2, 'embedding_dim': 256, 'lr': 0.0008520784697548674, 'lambda_val': 1.5236318044232254e-06, 'batch_size': 3743, 'optimizer': 'RMSprop'}.
2026-06-19 11:43:54,238 - experiment_functions - INFO - Early stopping at epoch 900. Best Metrics: (0.0006031417011929907, 0.00012157382847038021, 0.00034318550760775593)
2026-06-19 11:43:54,629 - optuna.study.study - INFO - Trial 277 finished with values: [0.0006031417011929907, 0.00012157382847038021, 0.00034318550760775593] and parameters: {'n_layers': 1, 'embedding_dim': 32, 'lr': 2.2190125289509666e-05, 'lambda_val': 0.00033501152249190713, 'batch_size': 3743, 'optimizer': 'RMSprop'}.
2026-06-19 11:47:00,169 - optuna.study.study - INFO - Trial 278 finished with values: [0.03029341465275524, 0.006492358216496148, 0.017455647647900717] and parameters: {'n_layers': 1, 'embedding_dim': 128, 'lr': 0.000670518483727842, 'lambda_val': 0.0001469242914477015, 'batch_size': 2567, 'optimizer': 'Adam'}.
2026-06-19 11:47:34,234 - experiment_functions - INFO - Early stopping at epoch 700. Best Metrics: (0.0241098198397369, 0.005128205128205129, 0.01343063968578144)
2026-06-19 11:47:34,557 - optuna.study.study - INFO - Trial 279 finished with values: [0.0241098198397369, 0.005128205128205129, 0.01343063968578144] and parameters: {'n_layers': 1, 'embedding_dim': 96, 'lr': 0.0025726585227239724, 'lambda_val': 0.0003743444509143199, 'batch_size': 2567, 'optimizer': 'RMSprop'}.
2026-06-19 11:48:37,397 - experiment_functions - INFO - Early stopping at epoch 1200. Best Metrics: (0.027924135089481737, 0.005920803334596438, 0.01563614130290191)
2026-06-19 11:48:37,497 - optuna.study.study - INFO - Trial 280 finished with values: [0.027924135089481737, 0.005920803334596438, 0.01563614130290191] and parameters: {'n_layers': 1, 'embedding_dim': 256, 'lr': 0.0013485218163115024, 'lambda_val': 0.0017351963751467104, 'batch_size': 2567, 'optimizer': 'Adam'}.
2026-06-19 11:52:00,607 - optuna.study.study - INFO - Trial 281 finished with values: [0.032840219808274805, 0.006844448654793484, 0.01865267329822415] and parameters: {'n_layers': 1, 'embedding_dim': 256, 'lr': 0.0008520784697548674, 'lambda_val': 1.9209272632964056e-06, 'batch_size': 3024, 'optimizer': 'Adam'}.
2026-06-19 11:52:51,555 - experiment_functions - INFO - Early stopping at epoch 1100. Best Metrics: (0.02860774342394387, 0.006067639257294431, 0.01679086917438756)
2026-06-19 11:52:51,650 - optuna.study.study - INFO - Trial 282 finished with values: [0.02860774342394387, 0.006067639257294431, 0.01679086917438756] and parameters: {'n_layers': 1, 'embedding_dim': 64, 'lr': 0.0020290919563790725, 'lambda_val': 1.1042104634029595e-06, 'batch_size': 2433, 'optimizer': 'RMSprop'}.
2026-06-19 11:53:35,396 - experiment_functions - INFO - Early stopping at epoch 900. Best Metrics: (0.027771658206470505, 0.005860805860805861, 0.015842668148971367)
2026-06-19 11:53:35,486 - optuna.study.study - INFO - Trial 283 finished with values: [0.027771658206470505, 0.005860805860805861, 0.015842668148971367] and parameters: {'n_layers': 1, 'embedding_dim': 128, 'lr': 0.0018488206146974142, 'lambda_val': 0.0001469242914477015, 'batch_size': 3743, 'optimizer': 'RMSprop'}.
2026-06-19 11:54:22,779 - experiment_functions - INFO - Early stopping at epoch 1000. Best Metrics: (0.031656288870905165, 0.006583933308071239, 0.01831852634814938)
2026-06-19 11:54:22,870 - optuna.study.study - INFO - Trial 284 finished with values: [0.031656288870905165, 0.006583933308071239, 0.01831852634814938] and parameters: {'n_layers': 1, 'embedding_dim': 96, 'lr': 0.0020290919563790725, 'lambda_val': 0.0002164185206162383, 'batch_size': 3739, 'optimizer': 'Adam'}.
2026-06-19 11:57:24,971 - optuna.study.study - INFO - Trial 285 finished with values: [0.030789892483027687, 0.006555513452065177, 0.017735011666717457] and parameters: {'n_layers': 1, 'embedding_dim': 128, 'lr': 0.000670518483727842, 'lambda_val': 1.5236318044232254e-06, 'batch_size': 1593, 'optimizer': 'RMSprop'}.
2026-06-19 12:00:47,764 - optuna.study.study - INFO - Trial 286 finished with values: [0.03190793423513977, 0.006681823923203234, 0.01816490556109871] and parameters: {'n_layers': 1, 'embedding_dim': 256, 'lr': 0.0008520784697548674, 'lambda_val': 0.0001469242914477015, 'batch_size': 2567, 'optimizer': 'Adam'}.
2026-06-19 12:02:32,407 - experiment_functions - INFO - Early stopping at epoch 2250. Best Metrics: (0.03370993957706955, 0.0069660224832638635, 0.01910459203143196)
2026-06-19 12:02:32,496 - optuna.study.study - INFO - Trial 287 finished with values: [0.03370993957706955, 0.0069660224832638635, 0.01910459203143196] and parameters: {'n_layers': 1, 'embedding_dim': 128, 'lr': 0.0010813916833902575, 'lambda_val': 0.0003743444509143199, 'batch_size': 2567, 'optimizer': 'RMSprop'}.
2026-06-19 12:02:58,477 - experiment_functions - INFO - Early stopping at epoch 500. Best Metrics: (0.0003046070044190886, 0.00010104837691044589, 0.00019017262844229062)
2026-06-19 12:02:58,575 - optuna.study.study - INFO - Trial 288 finished with values: [0.0003046070044190886, 0.00010104837691044589, 0.00019017262844229062] and parameters: {'n_layers': 1, 'embedding_dim': 256, 'lr': 0.0020290919563790725, 'lambda_val': 1.1042104634029595e-06, 'batch_size': 1875, 'optimizer': 'SGD'}.
2026-06-19 12:05:52,860 - optuna.study.study - INFO - Trial 289 finished with values: [0.031391629643991815, 0.006588669950738917, 0.018102059976073174] and parameters: {'n_layers': 1, 'embedding_dim': 32, 'lr': 0.0008520784697548674, 'lambda_val': 0.0011342839011215643, 'batch_size': 2567, 'optimizer': 'RMSprop'}.
2026-06-19 12:08:58,122 - optuna.study.study - INFO - Trial 290 finished with values: [0.03169231566065924, 0.006757610205886068, 0.018536360246320698] and parameters: {'n_layers': 1, 'embedding_dim': 128, 'lr': 0.000670518483727842, 'lambda_val': 1.5236318044232254e-06, 'batch_size': 3136, 'optimizer': 'Adam'}.
2026-06-19 12:11:54,409 - optuna.study.study - INFO - Trial 291 finished with values: [0.033322993893631164, 0.006986547934823797, 0.019280143828612217] and parameters: {'n_layers': 1, 'embedding_dim': 64, 'lr': 0.0008520784697548674, 'lambda_val': 0.0003743444509143199, 'batch_size': 2567, 'optimizer': 'RMSprop'}.
2026-06-19 12:12:52,555 - experiment_functions - INFO - Early stopping at epoch 1250. Best Metrics: (0.02748163056198953, 0.005597132752305166, 0.015517046504518534)
2026-06-19 12:12:52,639 - optuna.study.study - INFO - Trial 292 finished with values: [0.02748163056198953, 0.005597132752305166, 0.015517046504518534] and parameters: {'n_layers': 1, 'embedding_dim': 96, 'lr': 0.0020290919563790725, 'lambda_val': 5.5702102384522684e-05, 'batch_size': 2567, 'optimizer': 'RMSprop'}.
2026-06-19 12:13:19,086 - experiment_functions - INFO - Early stopping at epoch 550. Best Metrics: (0.005652873680621716, 0.0013073133762788937, 0.003165377431792969)
2026-06-19 12:13:19,183 - optuna.study.study - INFO - Trial 293 finished with values: [0.005652873680621716, 0.0013073133762788937, 0.003165377431792969] and parameters: {'n_layers': 1, 'embedding_dim': 96, 'lr': 0.08030397540711055, 'lambda_val': 0.000666881885592315, 'batch_size': 3739, 'optimizer': 'Adam'}.
2026-06-19 12:13:52,784 - experiment_functions - INFO - Early stopping at epoch 700. Best Metrics: (0.023226357190953128, 0.005292408740684602, 0.013721124783170984)
2026-06-19 12:13:52,864 - optuna.study.study - INFO - Trial 294 finished with values: [0.023226357190953128, 0.005292408740684602, 0.013721124783170984] and parameters: {'n_layers': 1, 'embedding_dim': 96, 'lr': 0.0032182784380663573, 'lambda_val': 0.009458582602656408, 'batch_size': 2567, 'optimizer': 'Adam'}.
2026-06-19 12:14:40,612 - experiment_functions - INFO - Early stopping at epoch 900. Best Metrics: (0.029606083715468495, 0.006285524820007579, 0.0168170565133259)
2026-06-19 12:14:40,705 - optuna.study.study - INFO - Trial 295 finished with values: [0.029606083715468495, 0.006285524820007579, 0.0168170565133259] and parameters: {'n_layers': 1, 'embedding_dim': 256, 'lr': 0.0020290919563790725, 'lambda_val': 1.1042104634029595e-06, 'batch_size': 3688, 'optimizer': 'Adam'}.
2026-06-19 12:15:40,846 - experiment_functions - INFO - Early stopping at epoch 1200. Best Metrics: (0.026482919153216808, 0.005627131489200454, 0.014986069498055782)
2026-06-19 12:15:40,926 - optuna.study.study - INFO - Trial 296 finished with values: [0.026482919153216808, 0.005627131489200454, 0.014986069498055782] and parameters: {'n_layers': 2, 'embedding_dim': 128, 'lr': 0.000670518483727842, 'lambda_val': 1.3063371603281255e-06, 'batch_size': 4063, 'optimizer': 'RMSprop'}.
2026-06-19 12:16:36,294 - experiment_functions - INFO - Early stopping at epoch 1050. Best Metrics: (0.028849402709670274, 0.006055008210180625, 0.016766434292460258)
2026-06-19 12:16:36,371 - optuna.study.study - INFO - Trial 297 finished with values: [0.028849402709670274, 0.006055008210180625, 0.016766434292460258] and parameters: {'n_layers': 1, 'embedding_dim': 256, 'lr': 0.0020290919563790725, 'lambda_val': 0.0003743444509143199, 'batch_size': 2567, 'optimizer': 'Adam'}.
2026-06-19 12:17:55,331 - experiment_functions - INFO - Early stopping at epoch 1750. Best Metrics: (0.03223601079490489, 0.00667235063786788, 0.018854292686051564)
2026-06-19 12:17:55,421 - optuna.study.study - INFO - Trial 298 finished with values: [0.03223601079490489, 0.00667235063786788, 0.018854292686051564] and parameters: {'n_layers': 1, 'embedding_dim': 64, 'lr': 0.0020290919563790725, 'lambda_val': 1.1042104634029595e-06, 'batch_size': 1875, 'optimizer': 'Adam'}.
2026-06-19 12:19:30,210 - experiment_functions - INFO - Early stopping at epoch 2100. Best Metrics: (0.03390024769494049, 0.006923392699254768, 0.019267211763643603)
2026-06-19 12:19:30,318 - optuna.study.study - INFO - Trial 299 finished with values: [0.03390024769494049, 0.006923392699254768, 0.019267211763643603] and parameters: {'n_layers': 1, 'embedding_dim': 64, 'lr': 0.0013485218163115024, 'lambda_val': 1.0414435612364156e-06, 'batch_size': 2567, 'optimizer': 'RMSprop'}.
2026-06-19 12:19:30,334 - root - INFO - Selected Trial 203 based on Max ndcg: 0.0197
2026-06-19 12:19:30,334 - root - INFO - Associated Recall: 0.0347
2026-06-19 12:19:30,334 - experiment_functions - INFO - Training the best model ... for e_yelp_1c1dcs_rand2
2026-06-19 12:22:39,145 - root - INFO -   **** Training e_yelp_1c1dcs_rand3
2026-06-19 12:22:39,272 - root - INFO -   **** Getting 421521/1274132 random edges
2026-06-19 12:22:39,527 - optuna.storages._rdb.storage - INFO - A new study created in RDB with name: Study_e_yelp_1c1dcs_rand3
2026-06-19 12:23:02,978 - experiment_functions - INFO - Early stopping at epoch 500. Best Metrics: (0.0005122142493997269, 0.00011052166224580018, 0.00025703382126433116)
2026-06-19 12:23:03,065 - optuna.study.study - INFO - Trial 0 finished with values: [0.0005122142493997269, 0.00011052166224580018, 0.00025703382126433116] and parameters: {'n_layers': 2, 'embedding_dim': 32, 'lr': 0.0001611029445771414, 'lambda_val': 0.010414501183008833, 'batch_size': 2098, 'optimizer': 'SGD'}.
2026-06-19 12:24:29,480 - experiment_functions - INFO - Early stopping at epoch 1450. Best Metrics: (0.0006204498555391618, 0.0001310471138057345, 0.00032433402916603354)
2026-06-19 12:24:29,568 - optuna.study.study - INFO - Trial 1 finished with values: [0.0006204498555391618, 0.0001310471138057345, 0.00032433402916603354] and parameters: {'n_layers': 3, 'embedding_dim': 256, 'lr': 1.0424035193184798e-05, 'lambda_val': 1.1893676005474623e-05, 'batch_size': 1813, 'optimizer': 'RMSprop'}.
2026-06-19 12:25:35,377 - experiment_functions - INFO - Early stopping at epoch 1250. Best Metrics: (0.022422778232480952, 0.0048219022356953386, 0.012516406006423461)
2026-06-19 12:25:35,461 - optuna.study.study - INFO - Trial 2 finished with values: [0.022422778232480952, 0.0048219022356953386, 0.012516406006423461] and parameters: {'n_layers': 3, 'embedding_dim': 128, 'lr': 0.000582863667130873, 'lambda_val': 0.0015840090449723311, 'batch_size': 2793, 'optimizer': 'Adam'}.
2026-06-19 12:25:59,860 - experiment_functions - INFO - Early stopping at epoch 500. Best Metrics: (0.0004595408688146579, 0.00010736390046734875, 0.0002534663632521514)
2026-06-19 12:25:59,948 - optuna.study.study - INFO - Trial 3 finished with values: [0.0004595408688146579, 0.00010736390046734875, 0.0002534663632521514] and parameters: {'n_layers': 1, 'embedding_dim': 128, 'lr': 0.020255154559883165, 'lambda_val': 0.0028613978197931434, 'batch_size': 2218, 'optimizer': 'SGD'}.
2026-06-19 12:26:26,174 - experiment_functions - INFO - Early stopping at epoch 500. Best Metrics: (0.0004379757417857097, 0.00012473159024883163, 0.0002526195387630514)
2026-06-19 12:26:26,269 - optuna.study.study - INFO - Trial 4 finished with values: [0.0004379757417857097, 0.00012473159024883163, 0.0002526195387630514] and parameters: {'n_layers': 1, 'embedding_dim': 256, 'lr': 0.0008242952765106988, 'lambda_val': 0.00036820848127785814, 'batch_size': 2536, 'optimizer': 'SGD'}.
2026-06-19 12:26:55,884 - experiment_functions - INFO - Early stopping at epoch 500. Best Metrics: (0.0005611554980214768, 0.0001405203991410888, 0.00031446094277898516)
2026-06-19 12:26:55,980 - optuna.study.study - INFO - Trial 5 finished with values: [0.0005611554980214768, 0.0001405203991410888, 0.00031446094277898516] and parameters: {'n_layers': 2, 'embedding_dim': 256, 'lr': 1.1257561968114954e-05, 'lambda_val': 0.03883038069753175, 'batch_size': 3761, 'optimizer': 'Adam'}.
2026-06-19 12:27:22,130 - experiment_functions - INFO - Early stopping at epoch 500. Best Metrics: (0.0005107087098990268, 0.00011525830491347733, 0.00027073395644660865)
2026-06-19 12:27:22,241 - optuna.study.study - INFO - Trial 6 finished with values: [0.0005107087098990268, 0.00011525830491347733, 0.00027073395644660865] and parameters: {'n_layers': 1, 'embedding_dim': 256, 'lr': 2.7707298079736896e-05, 'lambda_val': 0.06824081087175875, 'batch_size': 1882, 'optimizer': 'SGD'}.
2026-06-19 12:29:03,378 - experiment_functions - INFO - Early stopping at epoch 2350. Best Metrics: (0.000585626106004274, 0.0001310471138057345, 0.0003548960587116739)
2026-06-19 12:29:03,472 - optuna.study.study - INFO - Trial 7 finished with values: [0.000585626106004274, 0.0001310471138057345, 0.0003548960587116739] and parameters: {'n_layers': 1, 'embedding_dim': 64, 'lr': 0.00015095273172476746, 'lambda_val': 0.00013408887821252476, 'batch_size': 2390, 'optimizer': 'RMSprop'}.
2026-06-19 12:29:29,161 - experiment_functions - INFO - Early stopping at epoch 500. Best Metrics: (0.0005025608604765382, 0.00011841606669192877, 0.0002590875112999146)
2026-06-19 12:29:29,264 - optuna.study.study - INFO - Trial 8 finished with values: [0.0005025608604765382, 0.00011841606669192877, 0.0002590875112999146] and parameters: {'n_layers': 2, 'embedding_dim': 128, 'lr': 6.329905020540317e-05, 'lambda_val': 5.330415997896343e-05, 'batch_size': 2849, 'optimizer': 'SGD'}.
