2026-06-23 16:24:17,129 - optuna.study.study - INFO - Trial 155 finished with values: [0.009999654283822232, 0.0020983327017809776, 0.005471000140666279] and parameters: {'n_layers': 3, 'embedding_dim': 96, 'lr': 0.004663972138797954, 'lambda_val': 0.00011941284348716088, 'batch_size': 3839, 'optimizer': 'RMSprop'}.
2026-06-23 16:27:05,032 - experiment_functions - INFO - Early stopping at epoch 3950. Best Metrics: (0.0006048751880168765, 0.00013578375647341166, 0.000346890322613935)
2026-06-23 16:27:05,132 - optuna.study.study - INFO - Trial 156 finished with values: [0.0006048751880168765, 0.00013578375647341166, 0.000346890322613935] and parameters: {'n_layers': 1, 'embedding_dim': 128, 'lr': 0.00011634190552068439, 'lambda_val': 0.00011941284348716088, 'batch_size': 2143, 'optimizer': 'RMSprop'}.
2026-06-23 16:28:18,169 - experiment_functions - INFO - Early stopping at epoch 1550. Best Metrics: (0.019314371808531048, 0.004226664140457244, 0.010641018279420655)
2026-06-23 16:28:18,239 - optuna.study.study - INFO - Trial 157 finished with values: [0.019314371808531048, 0.004226664140457244, 0.010641018279420655] and parameters: {'n_layers': 4, 'embedding_dim': 64, 'lr': 0.0004643723640112503, 'lambda_val': 0.0007225520628850989, 'batch_size': 3860, 'optimizer': 'RMSprop'}.
2026-06-23 16:29:11,541 - experiment_functions - INFO - Early stopping at epoch 950. Best Metrics: (0.021064457967894266, 0.004675066312997348, 0.011739850261821711)
2026-06-23 16:29:11,616 - optuna.study.study - INFO - Trial 158 finished with values: [0.021064457967894266, 0.004675066312997348, 0.011739850261821711] and parameters: {'n_layers': 2, 'embedding_dim': 256, 'lr': 0.000639302768855693, 'lambda_val': 0.004835771975121532, 'batch_size': 1972, 'optimizer': 'RMSprop'}.
2026-06-23 16:29:33,859 - experiment_functions - INFO - Early stopping at epoch 500. Best Metrics: (0.0005216473268129017, 0.00011052166224580017, 0.00028285930987305543)
2026-06-23 16:29:33,956 - optuna.study.study - INFO - Trial 159 finished with values: [0.0005216473268129017, 0.00011052166224580017, 0.00028285930987305543] and parameters: {'n_layers': 1, 'embedding_dim': 64, 'lr': 0.003327046285057053, 'lambda_val': 0.00047222048784128004, 'batch_size': 2066, 'optimizer': 'SGD'}.
2026-06-23 16:32:35,542 - optuna.study.study - INFO - Trial 160 finished with values: [0.018593899219197022, 0.004135089048882152, 0.010730034589267747] and parameters: {'n_layers': 4, 'embedding_dim': 64, 'lr': 0.0001895879868332347, 'lambda_val': 0.0009179871154727713, 'batch_size': 1712, 'optimizer': 'RMSprop'}.
2026-06-23 16:36:58,066 - optuna.study.study - INFO - Trial 161 finished with values: [0.02407640263820247, 0.005327144120247568, 0.013891643680523957] and parameters: {'n_layers': 4, 'embedding_dim': 256, 'lr': 0.0001895879868332347, 'lambda_val': 0.00011941284348716088, 'batch_size': 1712, 'optimizer': 'RMSprop'}.
2026-06-23 16:39:37,392 - optuna.study.study - INFO - Trial 162 finished with values: [0.005506969273390955, 0.0013657319691802452, 0.0035310630989873744] and parameters: {'n_layers': 1, 'embedding_dim': 32, 'lr': 0.00040063970909820913, 'lambda_val': 0.00047222048784128004, 'batch_size': 2305, 'optimizer': 'Adam'}.
2026-06-23 16:40:07,622 - experiment_functions - INFO - Early stopping at epoch 550. Best Metrics: (0.005086020979877265, 0.0011162687886825818, 0.0027891822781108506)
2026-06-23 16:40:07,693 - optuna.study.study - INFO - Trial 163 finished with values: [0.005086020979877265, 0.0011162687886825818, 0.0027891822781108506] and parameters: {'n_layers': 4, 'embedding_dim': 128, 'lr': 0.07691759067722201, 'lambda_val': 0.00047222048784128004, 'batch_size': 2143, 'optimizer': 'Adam'}.
2026-06-23 16:42:55,987 - optuna.study.study - INFO - Trial 164 finished with values: [0.012273501171658175, 0.0027393583428066185, 0.006943215452106429] and parameters: {'n_layers': 1, 'embedding_dim': 96, 'lr': 0.04584588795119111, 'lambda_val': 0.002247784905654037, 'batch_size': 1936, 'optimizer': 'RMSprop'}.
2026-06-23 16:43:22,081 - experiment_functions - INFO - Early stopping at epoch 550. Best Metrics: (0.010349021873657526, 0.0023683213338385753, 0.006182677643478371)
2026-06-23 16:43:22,170 - optuna.study.study - INFO - Trial 165 finished with values: [0.010349021873657526, 0.0023683213338385753, 0.006182677643478371] and parameters: {'n_layers': 1, 'embedding_dim': 128, 'lr': 0.019126237813714465, 'lambda_val': 4.186128358230714e-06, 'batch_size': 2159, 'optimizer': 'RMSprop'}.
2026-06-23 16:44:03,606 - experiment_functions - INFO - Early stopping at epoch 900. Best Metrics: (0.01898354173051126, 0.004613489958317545, 0.010895208758794564)
2026-06-23 16:44:04,572 - optuna.study.study - INFO - Trial 166 finished with values: [0.01898354173051126, 0.004613489958317545, 0.010895208758794564] and parameters: {'n_layers': 1, 'embedding_dim': 128, 'lr': 0.0012272605990543274, 'lambda_val': 0.03522119050237677, 'batch_size': 3769, 'optimizer': 'Adam'}.
2026-06-23 16:47:09,226 - optuna.study.study - INFO - Trial 167 finished with values: [0.02029179881791721, 0.00444928634583807, 0.011649620773829774] and parameters: {'n_layers': 4, 'embedding_dim': 64, 'lr': 0.0001895879868332347, 'lambda_val': 0.0009179871154727713, 'batch_size': 3258, 'optimizer': 'RMSprop'}.
2026-06-23 16:49:14,068 - experiment_functions - INFO - Early stopping at epoch 2500. Best Metrics: (0.022463865062990546, 0.0047050650498926365, 0.012434456451503092)
2026-06-23 16:49:14,149 - optuna.study.study - INFO - Trial 168 finished with values: [0.022463865062990546, 0.0047050650498926365, 0.012434456451503092] and parameters: {'n_layers': 4, 'embedding_dim': 96, 'lr': 0.00030878795427160974, 'lambda_val': 0.00011941284348716088, 'batch_size': 3860, 'optimizer': 'Adam'}.
2026-06-23 16:49:50,191 - experiment_functions - INFO - Early stopping at epoch 650. Best Metrics: (0.013460182883360174, 0.0029840848806366046, 0.0070176634099863525)
2026-06-23 16:49:50,271 - optuna.study.study - INFO - Trial 169 finished with values: [0.013460182883360174, 0.0029840848806366046, 0.0070176634099863525] and parameters: {'n_layers': 4, 'embedding_dim': 128, 'lr': 0.0012272605990543274, 'lambda_val': 0.0045842802504681, 'batch_size': 2143, 'optimizer': 'Adam'}.
2026-06-23 16:50:16,709 - experiment_functions - INFO - Early stopping at epoch 600. Best Metrics: (0.0005523336410898379, 0.00011052166224580017, 0.00029883983273158986)
2026-06-23 16:50:16,790 - optuna.study.study - INFO - Trial 170 finished with values: [0.0005523336410898379, 0.00011052166224580017, 0.00029883983273158986] and parameters: {'n_layers': 1, 'embedding_dim': 64, 'lr': 0.00011634190552068439, 'lambda_val': 1.557991893656709e-05, 'batch_size': 1682, 'optimizer': 'Adam'}.
2026-06-23 16:50:59,065 - experiment_functions - INFO - Early stopping at epoch 900. Best Metrics: (0.02170224804209343, 0.004722432739674119, 0.012383718302144364)
2026-06-23 16:50:59,143 - optuna.study.study - INFO - Trial 171 finished with values: [0.02170224804209343, 0.004722432739674119, 0.012383718302144364] and parameters: {'n_layers': 3, 'embedding_dim': 64, 'lr': 0.0012272605990543274, 'lambda_val': 0.0004989009471474681, 'batch_size': 1479, 'optimizer': 'Adam'}.
2026-06-23 16:53:52,028 - optuna.study.study - INFO - Trial 172 finished with values: [0.033486020100949226, 0.007112858405961856, 0.01936865584558265] and parameters: {'n_layers': 1, 'embedding_dim': 96, 'lr': 0.000639302768855693, 'lambda_val': 0.00047222048784128004, 'batch_size': 2159, 'optimizer': 'RMSprop'}.
2026-06-23 16:54:19,837 - experiment_functions - INFO - Early stopping at epoch 550. Best Metrics: (0.009164784033233666, 0.0019483390173045349, 0.005094779056077151)
2026-06-23 16:54:19,929 - optuna.study.study - INFO - Trial 173 finished with values: [0.009164784033233666, 0.0019483390173045349, 0.005094779056077151] and parameters: {'n_layers': 3, 'embedding_dim': 96, 'lr': 0.003327046285057053, 'lambda_val': 1.0247887739091929e-05, 'batch_size': 3839, 'optimizer': 'RMSprop'}.
2026-06-23 16:55:56,526 - experiment_functions - INFO - Early stopping at epoch 2250. Best Metrics: (0.03201699755531203, 0.006746558039661488, 0.018271432146226944)
2026-06-23 16:55:56,599 - optuna.study.study - INFO - Trial 174 finished with values: [0.03201699755531203, 0.006746558039661488, 0.018271432146226944] and parameters: {'n_layers': 1, 'embedding_dim': 64, 'lr': 0.0012272605990543274, 'lambda_val': 1.3510549852958501e-06, 'batch_size': 3839, 'optimizer': 'Adam'}.
2026-06-23 16:56:44,340 - experiment_functions - INFO - Early stopping at epoch 1050. Best Metrics: (0.0057437818587908925, 0.0012236326891499306, 0.0031506301083198155)
2026-06-23 16:56:44,429 - optuna.study.study - INFO - Trial 175 finished with values: [0.0057437818587908925, 0.0012236326891499306, 0.0031506301083198155] and parameters: {'n_layers': 3, 'embedding_dim': 64, 'lr': 0.04570155549643593, 'lambda_val': 0.0045842802504681, 'batch_size': 3839, 'optimizer': 'RMSprop'}.
2026-06-23 16:57:14,440 - experiment_functions - INFO - Early stopping at epoch 650. Best Metrics: (0.0006261516367763169, 0.00013736263736263736, 0.0003263584657473608)
2026-06-23 16:57:14,520 - optuna.study.study - INFO - Trial 176 finished with values: [0.0006261516367763169, 0.00013736263736263736, 0.0003263584657473608] and parameters: {'n_layers': 3, 'embedding_dim': 64, 'lr': 0.0625350558352235, 'lambda_val': 0.0045842802504681, 'batch_size': 3839, 'optimizer': 'SGD'}.
2026-06-23 17:00:02,573 - optuna.study.study - INFO - Trial 177 finished with values: [0.00196373271057207, 0.0005099785272199066, 0.0012104940832068638] and parameters: {'n_layers': 2, 'embedding_dim': 64, 'lr': 0.0001895879868332347, 'lambda_val': 0.00018544932893785581, 'batch_size': 1972, 'optimizer': 'Adam'}.
2026-06-23 17:00:40,519 - experiment_functions - INFO - Early stopping at epoch 550. Best Metrics: (0.0072453503801411575, 0.0015283567007704937, 0.0038724982835199578)
2026-06-23 17:00:40,585 - optuna.study.study - INFO - Trial 178 finished with values: [0.0072453503801411575, 0.0015283567007704937, 0.0038724982835199578] and parameters: {'n_layers': 4, 'embedding_dim': 256, 'lr': 0.04970038934884718, 'lambda_val': 0.00011941284348716088, 'batch_size': 3641, 'optimizer': 'Adam'}.
2026-06-23 17:03:45,055 - optuna.study.study - INFO - Trial 179 finished with values: [0.0128559451438213, 0.0027630415561450045, 0.00703820602589299] and parameters: {'n_layers': 2, 'embedding_dim': 128, 'lr': 0.04824394736006866, 'lambda_val': 0.00039901786521084486, 'batch_size': 2166, 'optimizer': 'RMSprop'}.
2026-06-23 17:06:42,690 - optuna.study.study - INFO - Trial 180 finished with values: [0.019239861654533213, 0.004242452949349501, 0.011061983080422853] and parameters: {'n_layers': 3, 'embedding_dim': 64, 'lr': 0.0001895879868332347, 'lambda_val': 0.0009179871154727713, 'batch_size': 3839, 'optimizer': 'RMSprop'}.
2026-06-23 17:07:16,159 - experiment_functions - INFO - Early stopping at epoch 700. Best Metrics: (0.030694701233403513, 0.006457622836933182, 0.017594625725328265)
2026-06-23 17:07:16,549 - optuna.study.study - INFO - Trial 181 finished with values: [0.030694701233403513, 0.006457622836933182, 0.017594625725328265] and parameters: {'n_layers': 1, 'embedding_dim': 128, 'lr': 0.003327046285057053, 'lambda_val': 0.00047222048784128004, 'batch_size': 3596, 'optimizer': 'Adam'}.
2026-06-23 17:07:47,763 - experiment_functions - INFO - Early stopping at epoch 650. Best Metrics: (0.021506626741004915, 0.004420866489832008, 0.012451038119347451)
2026-06-23 17:07:47,844 - optuna.study.study - INFO - Trial 182 finished with values: [0.021506626741004915, 0.004420866489832008, 0.012451038119347451] and parameters: {'n_layers': 3, 'embedding_dim': 64, 'lr': 0.0022273107767267516, 'lambda_val': 1.601691176310597e-05, 'batch_size': 3839, 'optimizer': 'Adam'}.
2026-06-23 17:10:58,420 - optuna.study.study - INFO - Trial 183 finished with values: [0.0006027283029381812, 0.00012946823291650877, 0.0003264620639324095] and parameters: {'n_layers': 1, 'embedding_dim': 256, 'lr': 0.00011634190552068439, 'lambda_val': 0.00047222048784128004, 'batch_size': 3896, 'optimizer': 'Adam'}.
2026-06-23 17:12:28,828 - experiment_functions - INFO - Early stopping at epoch 2000. Best Metrics: (0.03394407672605967, 0.007079701907288114, 0.019444799309095814)
2026-06-23 17:12:28,897 - optuna.study.study - INFO - Trial 184 finished with values: [0.03394407672605967, 0.007079701907288114, 0.019444799309095814] and parameters: {'n_layers': 1, 'embedding_dim': 128, 'lr': 0.0012272605990543274, 'lambda_val': 0.00047222048784128004, 'batch_size': 2143, 'optimizer': 'Adam'}.
2026-06-23 17:15:21,340 - optuna.study.study - INFO - Trial 185 finished with values: [0.009448825472520092, 0.0022056966022483263, 0.005739882928151041] and parameters: {'n_layers': 1, 'embedding_dim': 128, 'lr': 0.00030878795427160974, 'lambda_val': 0.0002763636855160012, 'batch_size': 3860, 'optimizer': 'Adam'}.
2026-06-23 17:18:08,723 - optuna.study.study - INFO - Trial 186 finished with values: [0.0075950235582890714, 0.001856763925729443, 0.004510458231206674] and parameters: {'n_layers': 1, 'embedding_dim': 96, 'lr': 0.00030878795427160974, 'lambda_val': 0.0045842802504681, 'batch_size': 3860, 'optimizer': 'Adam'}.
2026-06-23 17:18:30,688 - experiment_functions - INFO - Early stopping at epoch 500. Best Metrics: (0.0004231896042139254, 0.00011525830491347733, 0.00023473410226211076)
2026-06-23 17:18:30,775 - optuna.study.study - INFO - Trial 187 finished with values: [0.0004231896042139254, 0.00011525830491347733, 0.00023473410226211076] and parameters: {'n_layers': 1, 'embedding_dim': 64, 'lr': 0.00030878795427160974, 'lambda_val': 0.0045842802504681, 'batch_size': 2166, 'optimizer': 'SGD'}.
2026-06-23 17:19:04,020 - experiment_functions - INFO - Early stopping at epoch 650. Best Metrics: (0.000627352358582202, 0.0001215738284703802, 0.00032402535085248316)
2026-06-23 17:19:04,099 - optuna.study.study - INFO - Trial 188 finished with values: [0.000627352358582202, 0.0001215738284703802, 0.00032402535085248316] and parameters: {'n_layers': 4, 'embedding_dim': 96, 'lr': 1.2669674613723774e-05, 'lambda_val': 8.45655657013136e-06, 'batch_size': 3839, 'optimizer': 'Adam'}.
2026-06-23 17:20:32,632 - experiment_functions - INFO - Early stopping at epoch 2000. Best Metrics: (0.02302865238707587, 0.005069786535303777, 0.01307616185225865)
2026-06-23 17:20:32,707 - optuna.study.study - INFO - Trial 189 finished with values: [0.02302865238707587, 0.005069786535303777, 0.01307616185225865] and parameters: {'n_layers': 4, 'embedding_dim': 32, 'lr': 0.00042124605593331236, 'lambda_val': 0.0009179871154727713, 'batch_size': 2066, 'optimizer': 'RMSprop'}.
2026-06-23 17:21:23,845 - experiment_functions - INFO - Early stopping at epoch 1050. Best Metrics: (0.02424676499085109, 0.0050982063913098405, 0.013682297682381949)
2026-06-23 17:21:23,982 - optuna.study.study - INFO - Trial 190 finished with values: [0.02424676499085109, 0.0050982063913098405, 0.013682297682381949] and parameters: {'n_layers': 3, 'embedding_dim': 64, 'lr': 0.0012272605990543274, 'lambda_val': 1.3510549852958501e-06, 'batch_size': 1456, 'optimizer': 'Adam'}.
2026-06-23 17:22:23,618 - experiment_functions - INFO - Early stopping at epoch 850. Best Metrics: (0.01939952580585844, 0.004212454212454213, 0.010974812372399927)
2026-06-23 17:22:23,708 - optuna.study.study - INFO - Trial 191 finished with values: [0.01939952580585844, 0.004212454212454213, 0.010974812372399927] and parameters: {'n_layers': 4, 'embedding_dim': 256, 'lr': 0.000639302768855693, 'lambda_val': 0.00047222048784128004, 'batch_size': 2944, 'optimizer': 'Adam'}.
2026-06-23 17:25:22,099 - optuna.study.study - INFO - Trial 192 finished with values: [0.014036748859114222, 0.0032019704433497538, 0.007995273211927964] and parameters: {'n_layers': 3, 'embedding_dim': 64, 'lr': 0.0001895879868332347, 'lambda_val': 0.00018544932893785581, 'batch_size': 1712, 'optimizer': 'RMSprop'}.
2026-06-23 17:25:58,842 - experiment_functions - INFO - Early stopping at epoch 700. Best Metrics: (0.029670686545774334, 0.006309208033345965, 0.01714748810720349)
2026-06-23 17:25:58,928 - optuna.study.study - INFO - Trial 193 finished with values: [0.029670686545774334, 0.006309208033345965, 0.01714748810720349] and parameters: {'n_layers': 1, 'embedding_dim': 256, 'lr': 0.003327046285057053, 'lambda_val': 0.00047222048784128004, 'batch_size': 3896, 'optimizer': 'Adam'}.
2026-06-23 17:26:58,201 - experiment_functions - INFO - Early stopping at epoch 1050. Best Metrics: (0.025800212121042675, 0.0055039787798408495, 0.01455295872940197)
2026-06-23 17:26:58,306 - optuna.study.study - INFO - Trial 194 finished with values: [0.025800212121042675, 0.0055039787798408495, 0.01455295872940197] and parameters: {'n_layers': 2, 'embedding_dim': 256, 'lr': 0.0008245512947363742, 'lambda_val': 0.00011941284348716088, 'batch_size': 3896, 'optimizer': 'Adam'}.
