2026-06-23 07:30:30,807 - optuna.study.study - INFO - Trial 66 finished with values: [0.025224549072349025, 0.00542977137804724, 0.014357095710616344] and parameters: {'n_layers': 1, 'embedding_dim': 32, 'lr': 0.003007555350761917, 'lambda_val': 0.0010657666266185159, 'batch_size': 2100, 'optimizer': 'RMSprop'}.
2026-06-23 07:31:27,314 - experiment_functions - INFO - Early stopping at epoch 1250. Best Metrics: (0.0005306335668588244, 0.00011841606669192877, 0.00028008429184114717)
2026-06-23 07:31:27,420 - optuna.study.study - INFO - Trial 67 finished with values: [0.0005306335668588244, 0.00011841606669192877, 0.00028008429184114717] and parameters: {'n_layers': 3, 'embedding_dim': 64, 'lr': 2.9481170637277455e-05, 'lambda_val': 7.223435586332182e-05, 'batch_size': 3110, 'optimizer': 'RMSprop'}.
2026-06-23 07:34:14,808 - optuna.study.study - INFO - Trial 68 finished with values: [0.02569591200476395, 0.005545029682960718, 0.015174566814788822] and parameters: {'n_layers': 2, 'embedding_dim': 32, 'lr': 0.0003681355466910888, 'lambda_val': 6.789699211207431e-05, 'batch_size': 3285, 'optimizer': 'Adam'}.
2026-06-23 07:34:46,829 - experiment_functions - INFO - Early stopping at epoch 600. Best Metrics: (0.019403910058428387, 0.004185613237337376, 0.01105713117822093)
2026-06-23 07:34:46,946 - optuna.study.study - INFO - Trial 69 finished with values: [0.019403910058428387, 0.004185613237337376, 0.01105713117822093] and parameters: {'n_layers': 3, 'embedding_dim': 128, 'lr': 0.0024861194796259945, 'lambda_val': 0.00019730135054936066, 'batch_size': 3397, 'optimizer': 'Adam'}.
2026-06-23 07:35:49,369 - experiment_functions - INFO - Early stopping at epoch 1450. Best Metrics: (0.029209212321321565, 0.006148162182644942, 0.015599367404502275)
2026-06-23 07:35:49,519 - optuna.study.study - INFO - Trial 70 finished with values: [0.029209212321321565, 0.006148162182644942, 0.015599367404502275] and parameters: {'n_layers': 2, 'embedding_dim': 32, 'lr': 0.0008906516956334841, 'lambda_val': 5.8617508553429225e-05, 'batch_size': 3129, 'optimizer': 'Adam'}.
2026-06-23 07:36:16,979 - experiment_functions - INFO - Early stopping at epoch 500. Best Metrics: (0.0004429577226009246, 0.0001026272577996716, 0.0002386378563213727)
2026-06-23 07:36:17,086 - optuna.study.study - INFO - Trial 71 finished with values: [0.0004429577226009246, 0.0001026272577996716, 0.0002386378563213727] and parameters: {'n_layers': 4, 'embedding_dim': 128, 'lr': 0.00031010998647899147, 'lambda_val': 6.691092523769437e-05, 'batch_size': 939, 'optimizer': 'SGD'}.
2026-06-23 07:39:03,528 - optuna.study.study - INFO - Trial 72 finished with values: [0.025040917602212706, 0.005401351522041177, 0.014113546658916204] and parameters: {'n_layers': 2, 'embedding_dim': 32, 'lr': 0.00037748801596819556, 'lambda_val': 0.0006793861457506547, 'batch_size': 3090, 'optimizer': 'Adam'}.
2026-06-23 07:42:12,648 - optuna.study.study - INFO - Trial 73 finished with values: [0.011382634152668158, 0.00275356827080965, 0.0070948621759452804] and parameters: {'n_layers': 1, 'embedding_dim': 256, 'lr': 0.00037748801596819556, 'lambda_val': 0.0001268815967640493, 'batch_size': 1760, 'optimizer': 'RMSprop'}.
2026-06-23 07:45:23,955 - optuna.study.study - INFO - Trial 74 finished with values: [0.009177858112584434, 0.0022688518378173555, 0.005664549094831549] and parameters: {'n_layers': 1, 'embedding_dim': 256, 'lr': 0.00031010998647899147, 'lambda_val': 4.540657949071036e-06, 'batch_size': 3300, 'optimizer': 'Adam'}.
2026-06-23 07:48:12,823 - optuna.study.study - INFO - Trial 75 finished with values: [0.01138864334585938, 0.002759883794366553, 0.006913234295751292] and parameters: {'n_layers': 1, 'embedding_dim': 96, 'lr': 0.0003527730481819595, 'lambda_val': 1.0328809642163819e-05, 'batch_size': 3610, 'optimizer': 'Adam'}.
2026-06-23 07:49:47,040 - experiment_functions - INFO - Early stopping at epoch 1750. Best Metrics: (0.0006367420792741388, 0.00012473159024883163, 0.00033991438028473277)
2026-06-23 07:49:47,162 - optuna.study.study - INFO - Trial 76 finished with values: [0.0006367420792741388, 0.00012473159024883163, 0.00033991438028473277] and parameters: {'n_layers': 2, 'embedding_dim': 256, 'lr': 1.4776366612197298e-05, 'lambda_val': 0.0001268815967640493, 'batch_size': 3860, 'optimizer': 'Adam'}.
2026-06-23 07:52:32,847 - optuna.study.study - INFO - Trial 77 finished with values: [0.0021649277389274688, 0.0005147151698875837, 0.0012643026858818714] and parameters: {'n_layers': 1, 'embedding_dim': 96, 'lr': 0.0003527730481819595, 'lambda_val': 1.0328809642163819e-05, 'batch_size': 1794, 'optimizer': 'Adam'}.
2026-06-23 07:52:54,993 - experiment_functions - INFO - Early stopping at epoch 500. Best Metrics: (0.0006319486225625524, 0.00012631047113805733, 0.0003229846532061812)
2026-06-23 07:52:55,100 - optuna.study.study - INFO - Trial 78 finished with values: [0.0006319486225625524, 0.00012631047113805733, 0.0003229846532061812] and parameters: {'n_layers': 1, 'embedding_dim': 32, 'lr': 3.2906883918393334e-05, 'lambda_val': 4.540657949071036e-06, 'batch_size': 1212, 'optimizer': 'Adam'}.
2026-06-23 07:53:19,835 - experiment_functions - INFO - Early stopping at epoch 500. Best Metrics: (0.0004615131913759805, 0.00010104837691044589, 0.0002316775364319927)
2026-06-23 07:53:19,942 - optuna.study.study - INFO - Trial 79 finished with values: [0.0004615131913759805, 0.00010104837691044589, 0.0002316775364319927] and parameters: {'n_layers': 2, 'embedding_dim': 128, 'lr': 0.00037748801596819556, 'lambda_val': 6.244926770879595e-05, 'batch_size': 849, 'optimizer': 'SGD'}.
2026-06-23 07:53:47,465 - experiment_functions - INFO - Early stopping at epoch 550. Best Metrics: (0.004606891387116166, 0.0010136415308829101, 0.0027470307280265077)
2026-06-23 07:53:47,570 - optuna.study.study - INFO - Trial 80 finished with values: [0.004606891387116166, 0.0010136415308829101, 0.0027470307280265077] and parameters: {'n_layers': 2, 'embedding_dim': 128, 'lr': 0.08428065983831527, 'lambda_val': 1.5553043024267715e-06, 'batch_size': 2813, 'optimizer': 'RMSprop'}.
2026-06-23 07:55:39,285 - experiment_functions - INFO - Early stopping at epoch 2750. Best Metrics: (0.0005804097716247366, 0.0001468359226979917, 0.0003337707157492356)
2026-06-23 07:55:39,390 - optuna.study.study - INFO - Trial 81 finished with values: [0.0005804097716247366, 0.0001468359226979917, 0.0003337707157492356] and parameters: {'n_layers': 2, 'embedding_dim': 32, 'lr': 3.4333860439728803e-05, 'lambda_val': 0.0003421214333180639, 'batch_size': 3045, 'optimizer': 'Adam'}.
2026-06-23 07:56:01,837 - experiment_functions - INFO - Early stopping at epoch 500. Best Metrics: (0.0005197650135463225, 0.00011999494758115448, 0.00026233155688488394)
2026-06-23 07:56:01,949 - optuna.study.study - INFO - Trial 82 finished with values: [0.0005197650135463225, 0.00011999494758115448, 0.00026233155688488394] and parameters: {'n_layers': 1, 'embedding_dim': 64, 'lr': 0.004902380772226109, 'lambda_val': 1.1929007408229486e-06, 'batch_size': 3258, 'optimizer': 'SGD'}.
2026-06-23 07:56:26,158 - experiment_functions - INFO - Early stopping at epoch 500. Best Metrics: (0.0005154640869820104, 0.00011525830491347733, 0.00024056887925312834)
2026-06-23 07:56:26,259 - optuna.study.study - INFO - Trial 83 finished with values: [0.0005154640869820104, 0.00011525830491347733, 0.00024056887925312834] and parameters: {'n_layers': 2, 'embedding_dim': 96, 'lr': 0.056902708691282625, 'lambda_val': 6.789699211207431e-05, 'batch_size': 2863, 'optimizer': 'SGD'}.
2026-06-23 07:56:49,110 - experiment_functions - INFO - Early stopping at epoch 500. Best Metrics: (0.0004449713619311163, 9.789061513199443e-05, 0.00023636943908586456)
2026-06-23 07:56:49,210 - optuna.study.study - INFO - Trial 84 finished with values: [0.0004449713619311163, 9.789061513199443e-05, 0.00023636943908586456] and parameters: {'n_layers': 1, 'embedding_dim': 96, 'lr': 5.8156593738198984e-05, 'lambda_val': 0.00022428537406399856, 'batch_size': 3318, 'optimizer': 'SGD'}.
2026-06-23 07:57:43,207 - experiment_functions - INFO - Early stopping at epoch 1150. Best Metrics: (0.0006398571669492859, 0.00013420487558418593, 0.00031502318067733436)
2026-06-23 07:57:43,314 - optuna.study.study - INFO - Trial 85 finished with values: [0.0006398571669492859, 0.00013420487558418593, 0.00031502318067733436] and parameters: {'n_layers': 2, 'embedding_dim': 128, 'lr': 2.9481170637277455e-05, 'lambda_val': 7.223435586332182e-05, 'batch_size': 2019, 'optimizer': 'RMSprop'}.
2026-06-23 07:59:27,426 - experiment_functions - INFO - Early stopping at epoch 2100. Best Metrics: (0.016176880100477062, 0.003554060881647089, 0.009296684007510493)
2026-06-23 07:59:27,594 - optuna.study.study - INFO - Trial 86 finished with values: [0.016176880100477062, 0.003554060881647089, 0.009296684007510493] and parameters: {'n_layers': 4, 'embedding_dim': 96, 'lr': 0.0008873329418261425, 'lambda_val': 4.540657949071036e-06, 'batch_size': 786, 'optimizer': 'RMSprop'}.
2026-06-23 07:59:50,658 - experiment_functions - INFO - Early stopping at epoch 500. Best Metrics: (0.0004393029022607043, 0.00010894278135657447, 0.0002535059234125963)
2026-06-23 07:59:50,810 - optuna.study.study - INFO - Trial 87 finished with values: [0.0004393029022607043, 0.00010894278135657447, 0.0002535059234125963] and parameters: {'n_layers': 4, 'embedding_dim': 32, 'lr': 0.00031010998647899147, 'lambda_val': 2.4297547129783816e-05, 'batch_size': 2491, 'optimizer': 'SGD'}.
2026-06-23 08:00:14,279 - experiment_functions - INFO - Early stopping at epoch 500. Best Metrics: (0.0006563965260655143, 0.0001278893520272831, 0.0003405781711415432)
2026-06-23 08:00:14,391 - optuna.study.study - INFO - Trial 88 finished with values: [0.0006563965260655143, 0.0001278893520272831, 0.0003405781711415432] and parameters: {'n_layers': 3, 'embedding_dim': 32, 'lr': 0.007840414247451329, 'lambda_val': 6.248411324083802e-05, 'batch_size': 3285, 'optimizer': 'SGD'}.
2026-06-23 08:00:41,263 - experiment_functions - INFO - Early stopping at epoch 500. Best Metrics: (0.0005853642167772263, 0.00012473159024883166, 0.00030528426941929944)
2026-06-23 08:00:41,366 - optuna.study.study - INFO - Trial 89 finished with values: [0.0005853642167772263, 0.00012473159024883166, 0.00030528426941929944] and parameters: {'n_layers': 4, 'embedding_dim': 96, 'lr': 0.033192132568815536, 'lambda_val': 0.017542734749765216, 'batch_size': 1382, 'optimizer': 'SGD'}.
2026-06-23 08:01:13,540 - experiment_functions - INFO - Early stopping at epoch 700. Best Metrics: (0.0005769822240715924, 0.0001231527093596059, 0.00030654727414144317)
2026-06-23 08:01:13,688 - optuna.study.study - INFO - Trial 90 finished with values: [0.0005769822240715924, 0.0001231527093596059, 0.00030654727414144317] and parameters: {'n_layers': 1, 'embedding_dim': 96, 'lr': 5.8156593738198984e-05, 'lambda_val': 0.0007523973321775693, 'batch_size': 3318, 'optimizer': 'Adam'}.
2026-06-23 08:04:28,852 - experiment_functions - INFO - Early stopping at epoch 3700. Best Metrics: (0.025129532829797824, 0.005380826070481244, 0.014353319249078665)
2026-06-23 08:04:29,054 - optuna.study.study - INFO - Trial 91 finished with values: [0.025129532829797824, 0.005380826070481244, 0.014353319249078665] and parameters: {'n_layers': 4, 'embedding_dim': 128, 'lr': 0.00031010998647899147, 'lambda_val': 7.223435586332182e-05, 'batch_size': 1903, 'optimizer': 'RMSprop'}.
2026-06-23 08:04:51,957 - experiment_functions - INFO - Early stopping at epoch 500. Best Metrics: (0.000573368171020938, 0.0001121005431350259, 0.00031882601587896413)
2026-06-23 08:04:52,079 - optuna.study.study - INFO - Trial 92 finished with values: [0.000573368171020938, 0.0001121005431350259, 0.00031882601587896413] and parameters: {'n_layers': 3, 'embedding_dim': 32, 'lr': 0.017063355070361712, 'lambda_val': 1.1578592623213694e-05, 'batch_size': 2608, 'optimizer': 'SGD'}.
2026-06-23 08:05:16,906 - experiment_functions - INFO - Early stopping at epoch 500. Best Metrics: (0.0004764730354607474, 0.0001215738284703802, 0.00027980728863216046)
2026-06-23 08:05:17,054 - optuna.study.study - INFO - Trial 93 finished with values: [0.0004764730354607474, 0.0001215738284703802, 0.00027980728863216046] and parameters: {'n_layers': 2, 'embedding_dim': 128, 'lr': 0.0003681355466910888, 'lambda_val': 6.789699211207431e-05, 'batch_size': 3253, 'optimizer': 'SGD'}.
2026-06-23 08:06:00,420 - experiment_functions - INFO - Early stopping at epoch 750. Best Metrics: (0.020687403788537184, 0.00441612984716433, 0.0111655092231891)
2026-06-23 08:06:00,533 - optuna.study.study - INFO - Trial 94 finished with values: [0.020687403788537184, 0.00441612984716433, 0.0111655092231891] and parameters: {'n_layers': 2, 'embedding_dim': 256, 'lr': 0.0017924637075651337, 'lambda_val': 1.4455102909472541e-06, 'batch_size': 1128, 'optimizer': 'Adam'}.
2026-06-23 08:06:34,422 - experiment_functions - INFO - Early stopping at epoch 750. Best Metrics: (0.029231170854457256, 0.006140267778198813, 0.016958026641332058)
2026-06-23 08:06:34,578 - optuna.study.study - INFO - Trial 95 finished with values: [0.029231170854457256, 0.006140267778198813, 0.016958026641332058] and parameters: {'n_layers': 1, 'embedding_dim': 64, 'lr': 0.003808349234575029, 'lambda_val': 4.782028134253512e-05, 'batch_size': 2469, 'optimizer': 'Adam'}.
2026-06-23 08:07:07,946 - experiment_functions - INFO - Early stopping at epoch 750. Best Metrics: (0.0004722274993748861, 0.00010894278135657445, 0.0002789293905695158)
2026-06-23 08:07:08,216 - optuna.study.study - INFO - Trial 96 finished with values: [0.0004722274993748861, 0.00010894278135657445, 0.0002789293905695158] and parameters: {'n_layers': 1, 'embedding_dim': 96, 'lr': 1.4776366612197298e-05, 'lambda_val': 1.416396990125415e-05, 'batch_size': 3860, 'optimizer': 'RMSprop'}.
2026-06-23 08:07:39,900 - experiment_functions - INFO - Early stopping at epoch 600. Best Metrics: (0.014018140843215468, 0.0029540861437413165, 0.007436850521026251)
2026-06-23 08:07:40,005 - optuna.study.study - INFO - Trial 97 finished with values: [0.014018140843215468, 0.0029540861437413165, 0.007436850521026251] and parameters: {'n_layers': 4, 'embedding_dim': 96, 'lr': 0.002568897648085955, 'lambda_val': 1.033711147166284e-06, 'batch_size': 2863, 'optimizer': 'Adam'}.
2026-06-23 08:08:21,966 - experiment_functions - INFO - Early stopping at epoch 800. Best Metrics: (0.020369496134551402, 0.004346659088038399, 0.011490667093622469)
2026-06-23 08:08:22,069 - optuna.study.study - INFO - Trial 98 finished with values: [0.020369496134551402, 0.004346659088038399, 0.011490667093622469] and parameters: {'n_layers': 4, 'embedding_dim': 96, 'lr': 0.0008906516956334841, 'lambda_val': 5.8617508553429225e-05, 'batch_size': 3372, 'optimizer': 'Adam'}.
2026-06-23 08:08:48,042 - experiment_functions - INFO - Early stopping at epoch 500. Best Metrics: (0.0005003999512812861, 0.00011999494758115447, 0.0002945697886960891)
2026-06-23 08:08:48,193 - optuna.study.study - INFO - Trial 99 finished with values: [0.0005003999512812861, 0.00011999494758115447, 0.0002945697886960891] and parameters: {'n_layers': 3, 'embedding_dim': 128, 'lr': 0.003808349234575029, 'lambda_val': 0.0027380357457200996, 'batch_size': 2469, 'optimizer': 'SGD'}.
2026-06-23 08:09:27,860 - experiment_functions - INFO - Early stopping at epoch 900. Best Metrics: (0.027076132807781355, 0.00584659593280283, 0.015234990149622846)
2026-06-23 08:09:27,972 - optuna.study.study - INFO - Trial 100 finished with values: [0.027076132807781355, 0.00584659593280283, 0.015234990149622846] and parameters: {'n_layers': 1, 'embedding_dim': 32, 'lr': 0.0017036472251956306, 'lambda_val': 0.005422944155279863, 'batch_size': 2693, 'optimizer': 'RMSprop'}.
2026-06-23 08:10:06,506 - experiment_functions - INFO - Early stopping at epoch 850. Best Metrics: (0.01654756340364135, 0.0034293292913982567, 0.009013019059882945)
2026-06-23 08:10:06,640 - optuna.study.study - INFO - Trial 101 finished with values: [0.01654756340364135, 0.0034293292913982567, 0.009013019059882945] and parameters: {'n_layers': 1, 'embedding_dim': 96, 'lr': 0.003693559669443807, 'lambda_val': 0.0009938480250443395, 'batch_size': 3129, 'optimizer': 'RMSprop'}.
2026-06-23 08:13:16,357 - optuna.study.study - INFO - Trial 102 finished with values: [0.02727755324974925, 0.005868700265251989, 0.015527494398294525] and parameters: {'n_layers': 2, 'embedding_dim': 128, 'lr': 0.00036918389202660496, 'lambda_val': 0.0010657666266185159, 'batch_size': 3429, 'optimizer': 'Adam'}.
2026-06-23 08:16:05,307 - experiment_functions - INFO - Early stopping at epoch 3550. Best Metrics: (0.0254806876761371, 0.005586080586080585, 0.014532211270263351)
2026-06-23 08:16:05,418 - optuna.study.study - INFO - Trial 103 finished with values: [0.0254806876761371, 0.005586080586080585, 0.014532211270263351] and parameters: {'n_layers': 3, 'embedding_dim': 96, 'lr': 0.00037748801596819556, 'lambda_val': 0.0001268815967640493, 'batch_size': 2813, 'optimizer': 'RMSprop'}.
2026-06-23 08:18:49,803 - optuna.study.study - INFO - Trial 104 finished with values: [0.00792998759120644, 0.0016451938865731967, 0.0043011245133830235] and parameters: {'n_layers': 2, 'embedding_dim': 32, 'lr': 0.062461718764754336, 'lambda_val': 0.0006793861457506547, 'batch_size': 3285, 'optimizer': 'RMSprop'}.
2026-06-23 08:19:14,305 - experiment_functions - INFO - Early stopping at epoch 500. Best Metrics: (0.0005496890408642659, 0.00011841606669192877, 0.0002836119952546328)
2026-06-23 08:19:14,419 - optuna.study.study - INFO - Trial 105 finished with values: [0.0005496890408642659, 0.00011841606669192877, 0.0002836119952546328] and parameters: {'n_layers': 2, 'embedding_dim': 128, 'lr': 0.0016017140638771422, 'lambda_val': 0.0009036419699131071, 'batch_size': 886, 'optimizer': 'SGD'}.
2026-06-23 08:19:46,997 - experiment_functions - INFO - Early stopping at epoch 750. Best Metrics: (0.014828590566946222, 0.0034735379562965776, 0.008037929452395492)
2026-06-23 08:19:47,127 - optuna.study.study - INFO - Trial 106 finished with values: [0.014828590566946222, 0.0034735379562965776, 0.008037929452395492] and parameters: {'n_layers': 1, 'embedding_dim': 32, 'lr': 0.003007555350761917, 'lambda_val': 0.05623769807391014, 'batch_size': 2100, 'optimizer': 'Adam'}.
2026-06-23 08:20:11,355 - experiment_functions - INFO - Early stopping at epoch 550. Best Metrics: (0.008288502332959233, 0.001893078186181635, 0.004792008418480577)
2026-06-23 08:20:11,488 - optuna.study.study - INFO - Trial 107 finished with values: [0.008288502332959233, 0.001893078186181635, 0.004792008418480577] and parameters: {'n_layers': 1, 'embedding_dim': 32, 'lr': 0.030792244895502478, 'lambda_val': 0.0009938480250443395, 'batch_size': 786, 'optimizer': 'RMSprop'}.
2026-06-23 08:20:38,309 - experiment_functions - INFO - Early stopping at epoch 550. Best Metrics: (0.009546693531676429, 0.0020051787293166607, 0.0053705226352059356)
2026-06-23 08:20:38,436 - optuna.study.study - INFO - Trial 108 finished with values: [0.009546693531676429, 0.0020051787293166607, 0.0053705226352059356] and parameters: {'n_layers': 2, 'embedding_dim': 96, 'lr': 0.02606299813671231, 'lambda_val': 6.862745359820558e-05, 'batch_size': 1313, 'optimizer': 'RMSprop'}.
2026-06-23 08:23:40,258 - optuna.study.study - INFO - Trial 109 finished with values: [0.024578695982064257, 0.005545029682960718, 0.014382371963006268] and parameters: {'n_layers': 2, 'embedding_dim': 96, 'lr': 0.0002866478653574494, 'lambda_val': 0.007151036194229829, 'batch_size': 3129, 'optimizer': 'RMSprop'}.
2026-06-23 08:24:08,754 - experiment_functions - INFO - Early stopping at epoch 650. Best Metrics: (0.011964272534613643, 0.00275356827080965, 0.0066247961409314025)
2026-06-23 08:24:08,864 - optuna.study.study - INFO - Trial 110 finished with values: [0.011964272534613643, 0.00275356827080965, 0.0066247961409314025] and parameters: {'n_layers': 2, 'embedding_dim': 32, 'lr': 0.0014983681509322957, 'lambda_val': 0.019684317126267517, 'batch_size': 3610, 'optimizer': 'RMSprop'}.
2026-06-23 08:24:34,437 - experiment_functions - INFO - Early stopping at epoch 550. Best Metrics: (0.0076538864700484875, 0.0017525577870405457, 0.004517473168885895)
2026-06-23 08:24:34,557 - optuna.study.study - INFO - Trial 111 finished with values: [0.0076538864700484875, 0.0017525577870405457, 0.004517473168885895] and parameters: {'n_layers': 4, 'embedding_dim': 32, 'lr': 0.008945112708483012, 'lambda_val': 4.540657949071036e-06, 'batch_size': 786, 'optimizer': 'Adam'}.
2026-06-23 08:25:10,150 - experiment_functions - INFO - Early stopping at epoch 800. Best Metrics: (0.015689082603236686, 0.0034293292913982567, 0.008514294020945412)
2026-06-23 08:25:10,511 - optuna.study.study - INFO - Trial 112 finished with values: [0.015689082603236686, 0.0034293292913982567, 0.008514294020945412] and parameters: {'n_layers': 2, 'embedding_dim': 32, 'lr': 0.0024861194796259945, 'lambda_val': 1.4455102909472541e-06, 'batch_size': 2410, 'optimizer': 'RMSprop'}.
2026-06-23 08:26:18,262 - experiment_functions - INFO - Early stopping at epoch 1000. Best Metrics: (0.01871660051171825, 0.003999305292408741, 0.010964981192784343)
2026-06-23 08:26:18,396 - optuna.study.study - INFO - Trial 113 finished with values: [0.01871660051171825, 0.003999305292408741, 0.010964981192784343] and parameters: {'n_layers': 4, 'embedding_dim': 256, 'lr': 0.0007193243502637934, 'lambda_val': 4.540657949071036e-06, 'batch_size': 2508, 'optimizer': 'Adam'}.
2026-06-23 08:26:53,085 - experiment_functions - INFO - Early stopping at epoch 650. Best Metrics: (0.02091886612500936, 0.004540861437413162, 0.011659150608458105)
