2026-06-20 15:44:01,852 - optuna.study.study - INFO - Trial 270 finished with values: [0.023765434587229527, 0.0050303145130731345, 0.013682873475354844] and parameters: {'n_layers': 2, 'embedding_dim': 64, 'lr': 0.0013536067835738764, 'lambda_val': 4.703980448589771e-06, 'batch_size': 1731, 'optimizer': 'RMSprop'}.
2026-06-20 15:44:27,429 - experiment_functions - INFO - Early stopping at epoch 550. Best Metrics: (0.008502008411943368, 0.0018378173550587342, 0.004582650934438454)
2026-06-20 15:44:27,511 - optuna.study.study - INFO - Trial 271 finished with values: [0.008502008411943368, 0.0018378173550587342, 0.004582650934438454] and parameters: {'n_layers': 3, 'embedding_dim': 64, 'lr': 0.006719843485367568, 'lambda_val': 0.008614130882137508, 'batch_size': 2177, 'optimizer': 'Adam'}.
2026-06-20 15:45:41,030 - experiment_functions - INFO - Early stopping at epoch 1700. Best Metrics: (0.02805472445938585, 0.005903435644814956, 0.0161109235895242)
2026-06-20 15:45:41,111 - optuna.study.study - INFO - Trial 272 finished with values: [0.02805472445938585, 0.005903435644814956, 0.0161109235895242] and parameters: {'n_layers': 2, 'embedding_dim': 64, 'lr': 0.0012029727538128135, 'lambda_val': 1.4891573500580198e-05, 'batch_size': 1271, 'optimizer': 'Adam'}.
2026-06-20 15:46:26,572 - experiment_functions - INFO - Early stopping at epoch 1100. Best Metrics: (0.015502279457486345, 0.003295124415814071, 0.00874388144014021)
2026-06-20 15:46:26,676 - optuna.study.study - INFO - Trial 273 finished with values: [0.015502279457486345, 0.003295124415814071, 0.00874388144014021] and parameters: {'n_layers': 1, 'embedding_dim': 32, 'lr': 0.006719843485367568, 'lambda_val': 3.04016799063885e-05, 'batch_size': 2449, 'optimizer': 'RMSprop'}.
2026-06-20 15:47:48,205 - experiment_functions - INFO - Early stopping at epoch 1550. Best Metrics: (0.010035007921480966, 0.0021488568902362005, 0.005672546495456773)
2026-06-20 15:47:48,276 - optuna.study.study - INFO - Trial 274 finished with values: [0.010035007921480966, 0.0021488568902362005, 0.005672546495456773] and parameters: {'n_layers': 2, 'embedding_dim': 256, 'lr': 0.004313457669672437, 'lambda_val': 0.0003491086087549103, 'batch_size': 1271, 'optimizer': 'Adam'}.
2026-06-20 15:49:29,363 - experiment_functions - INFO - Early stopping at epoch 2300. Best Metrics: (0.03235977540012351, 0.006681823923203234, 0.01880186455046722)
2026-06-20 15:49:29,445 - optuna.study.study - INFO - Trial 275 finished with values: [0.03235977540012351, 0.006681823923203234, 0.01880186455046722] and parameters: {'n_layers': 1, 'embedding_dim': 128, 'lr': 0.0015403750227822883, 'lambda_val': 5.090598517742677e-05, 'batch_size': 2177, 'optimizer': 'Adam'}.
2026-06-20 15:52:20,118 - optuna.study.study - INFO - Trial 276 finished with values: [0.023034313335299258, 0.005128205128205128, 0.013415666253636915] and parameters: {'n_layers': 1, 'embedding_dim': 128, 'lr': 0.00040210644242369826, 'lambda_val': 0.0011326275261643772, 'batch_size': 3519, 'optimizer': 'RMSprop'}.
2026-06-20 15:54:54,226 - experiment_functions - INFO - Early stopping at epoch 3500. Best Metrics: (0.026964425510581258, 0.005715548818997095, 0.015629963822064795)
2026-06-20 15:54:54,327 - optuna.study.study - INFO - Trial 277 finished with values: [0.026964425510581258, 0.005715548818997095, 0.015629963822064795] and parameters: {'n_layers': 3, 'embedding_dim': 64, 'lr': 0.00040210644242369826, 'lambda_val': 1.4891573500580198e-05, 'batch_size': 2177, 'optimizer': 'Adam'}.
2026-06-20 15:55:17,261 - experiment_functions - INFO - Early stopping at epoch 500. Best Metrics: (0.0005503443110906292, 0.00011525830491347733, 0.00025410777820791266)
2026-06-20 15:55:17,354 - optuna.study.study - INFO - Trial 278 finished with values: [0.0005503443110906292, 0.00011525830491347733, 0.00025410777820791266] and parameters: {'n_layers': 4, 'embedding_dim': 32, 'lr': 0.00046312276480803076, 'lambda_val': 4.766839408162229e-05, 'batch_size': 3287, 'optimizer': 'SGD'}.
2026-06-20 15:56:55,482 - experiment_functions - INFO - Early stopping at epoch 2250. Best Metrics: (0.029834035837980725, 0.0061592143488695215, 0.01698126727435931)
2026-06-20 15:56:55,575 - optuna.study.study - INFO - Trial 279 finished with values: [0.029834035837980725, 0.0061592143488695215, 0.01698126727435931] and parameters: {'n_layers': 2, 'embedding_dim': 64, 'lr': 0.0009241097994190195, 'lambda_val': 0.0004242504250406823, 'batch_size': 2384, 'optimizer': 'Adam'}.
2026-06-20 15:57:33,345 - experiment_functions - INFO - Early stopping at epoch 850. Best Metrics: (0.0250502488268212, 0.005203991410887962, 0.01413300295228875)
2026-06-20 15:57:33,445 - optuna.study.study - INFO - Trial 280 finished with values: [0.0250502488268212, 0.005203991410887962, 0.01413300295228875] and parameters: {'n_layers': 3, 'embedding_dim': 32, 'lr': 0.0015403750227822883, 'lambda_val': 2.2631401516377123e-05, 'batch_size': 2177, 'optimizer': 'Adam'}.
2026-06-20 15:58:14,736 - experiment_functions - INFO - Early stopping at epoch 900. Best Metrics: (0.022561757094548784, 0.00486611090059366, 0.012848665148660723)
2026-06-20 15:58:14,808 - optuna.study.study - INFO - Trial 281 finished with values: [0.022561757094548784, 0.00486611090059366, 0.012848665148660723] and parameters: {'n_layers': 3, 'embedding_dim': 64, 'lr': 0.0009942243415015796, 'lambda_val': 0.0004242504250406823, 'batch_size': 2009, 'optimizer': 'Adam'}.
2026-06-20 16:00:59,687 - optuna.study.study - INFO - Trial 282 finished with values: [0.006082249982285735, 0.0014873057976506252, 0.003812634939910391] and parameters: {'n_layers': 1, 'embedding_dim': 96, 'lr': 0.00040210644242369826, 'lambda_val': 3.04016799063885e-05, 'batch_size': 2177, 'optimizer': 'Adam'}.
2026-06-20 16:03:47,166 - optuna.study.study - INFO - Trial 283 finished with values: [0.03336008729174285, 0.006929708222811672, 0.0190000554642107] and parameters: {'n_layers': 1, 'embedding_dim': 64, 'lr': 0.0012029727538128135, 'lambda_val': 5.848323299602918e-05, 'batch_size': 2195, 'optimizer': 'Adam'}.
2026-06-20 16:05:01,392 - experiment_functions - INFO - Early stopping at epoch 1650. Best Metrics: (0.0335683329726508, 0.006929708222811672, 0.01934113316786127)
2026-06-20 16:05:01,478 - optuna.study.study - INFO - Trial 284 finished with values: [0.0335683329726508, 0.006929708222811672, 0.01934113316786127] and parameters: {'n_layers': 1, 'embedding_dim': 128, 'lr': 0.0015403750227822883, 'lambda_val': 3.0549894793457165e-06, 'batch_size': 2384, 'optimizer': 'Adam'}.
2026-06-20 16:06:17,063 - experiment_functions - INFO - Early stopping at epoch 1550. Best Metrics: (0.028142198668625096, 0.00597922192749779, 0.016028546236106746)
2026-06-20 16:06:17,150 - optuna.study.study - INFO - Trial 285 finished with values: [0.028142198668625096, 0.00597922192749779, 0.016028546236106746] and parameters: {'n_layers': 1, 'embedding_dim': 256, 'lr': 0.0015403750227822883, 'lambda_val': 0.001526779508134114, 'batch_size': 1271, 'optimizer': 'Adam'}.
2026-06-20 16:08:22,665 - experiment_functions - INFO - Early stopping at epoch 3200. Best Metrics: (0.000642864138589617, 0.00014209928003031453, 0.0003152658126892934)
2026-06-20 16:08:22,756 - optuna.study.study - INFO - Trial 286 finished with values: [0.000642864138589617, 0.00014209928003031453, 0.0003152658126892934] and parameters: {'n_layers': 1, 'embedding_dim': 32, 'lr': 0.00011128248952778068, 'lambda_val': 0.0004242504250406823, 'batch_size': 2177, 'optimizer': 'RMSprop'}.
2026-06-20 16:09:01,493 - experiment_functions - INFO - Early stopping at epoch 850. Best Metrics: (0.026244683455018573, 0.005579765062523683, 0.014617207299395066)
2026-06-20 16:09:01,565 - optuna.study.study - INFO - Trial 287 finished with values: [0.026244683455018573, 0.005579765062523683, 0.014617207299395066] and parameters: {'n_layers': 2, 'embedding_dim': 64, 'lr': 0.0015403750227822883, 'lambda_val': 0.001526779508134114, 'batch_size': 2177, 'optimizer': 'Adam'}.
2026-06-20 16:11:51,432 - optuna.study.study - INFO - Trial 288 finished with values: [0.033746832694835936, 0.007065491979285084, 0.01950771063016324] and parameters: {'n_layers': 1, 'embedding_dim': 64, 'lr': 0.0015403750227822883, 'lambda_val': 4.703980448589771e-06, 'batch_size': 1271, 'optimizer': 'Adam'}.
2026-06-20 16:12:19,270 - experiment_functions - INFO - Early stopping at epoch 500. Best Metrics: (0.0004807883381880926, 0.00011210054313502589, 0.00023240493384927926)
2026-06-20 16:12:19,366 - optuna.study.study - INFO - Trial 289 finished with values: [0.0004807883381880926, 0.00011210054313502589, 0.00023240493384927926] and parameters: {'n_layers': 2, 'embedding_dim': 256, 'lr': 0.0003197162451785445, 'lambda_val': 0.005967642770254264, 'batch_size': 2606, 'optimizer': 'SGD'}.
2026-06-20 16:12:44,911 - experiment_functions - INFO - Early stopping at epoch 500. Best Metrics: (0.00052706343148464, 0.00012157382847038019, 0.0002814632125341377)
2026-06-20 16:12:45,049 - optuna.study.study - INFO - Trial 290 finished with values: [0.00052706343148464, 0.00012157382847038019, 0.0002814632125341377] and parameters: {'n_layers': 1, 'embedding_dim': 256, 'lr': 0.00040210644242369826, 'lambda_val': 1.4891573500580198e-05, 'batch_size': 2330, 'optimizer': 'SGD'}.
2026-06-20 16:15:59,406 - optuna.study.study - INFO - Trial 291 finished with values: [0.027371702918820483, 0.005863963622584313, 0.015354410400940875] and parameters: {'n_layers': 3, 'embedding_dim': 128, 'lr': 0.00040210644242369826, 'lambda_val': 4.703980448589771e-06, 'batch_size': 1147, 'optimizer': 'Adam'}.
2026-06-20 16:16:35,126 - experiment_functions - INFO - Early stopping at epoch 700. Best Metrics: (0.016613078094804296, 0.003598269546545409, 0.008812809147295632)
2026-06-20 16:16:35,307 - optuna.study.study - INFO - Trial 292 finished with values: [0.016613078094804296, 0.003598269546545409, 0.008812809147295632] and parameters: {'n_layers': 3, 'embedding_dim': 128, 'lr': 0.0015403750227822883, 'lambda_val': 0.002980377292701446, 'batch_size': 1287, 'optimizer': 'Adam'}.
2026-06-20 16:17:20,173 - experiment_functions - INFO - Early stopping at epoch 950. Best Metrics: (0.02192444191459507, 0.00458191234053303, 0.012249523988056574)
2026-06-20 16:17:20,301 - optuna.study.study - INFO - Trial 293 finished with values: [0.02192444191459507, 0.00458191234053303, 0.012249523988056574] and parameters: {'n_layers': 4, 'embedding_dim': 64, 'lr': 0.0009241097994190195, 'lambda_val': 0.0004242504250406823, 'batch_size': 2384, 'optimizer': 'Adam'}.
2026-06-20 16:20:14,932 - optuna.study.study - INFO - Trial 294 finished with values: [0.029821169543849363, 0.006329733484905898, 0.0170591853881252] and parameters: {'n_layers': 1, 'embedding_dim': 128, 'lr': 0.0009241097994190195, 'lambda_val': 0.002980377292701446, 'batch_size': 1287, 'optimizer': 'Adam'}.
2026-06-20 16:22:22,807 - experiment_functions - INFO - Early stopping at epoch 3200. Best Metrics: (0.0006825681051741012, 0.00015630920803334596, 0.0003761308256493188)
2026-06-20 16:22:22,893 - optuna.study.study - INFO - Trial 295 finished with values: [0.0006825681051741012, 0.00015630920803334596, 0.0003761308256493188] and parameters: {'n_layers': 2, 'embedding_dim': 32, 'lr': 0.00010906014994616698, 'lambda_val': 2.085376662769769e-05, 'batch_size': 2177, 'optimizer': 'RMSprop'}.
2026-06-20 16:24:36,383 - experiment_functions - INFO - Early stopping at epoch 3100. Best Metrics: (0.032216195952278356, 0.006699191612984716, 0.01803550887731063)
2026-06-20 16:24:36,459 - optuna.study.study - INFO - Trial 296 finished with values: [0.032216195952278356, 0.006699191612984716, 0.01803550887731063] and parameters: {'n_layers': 1, 'embedding_dim': 96, 'lr': 0.0012029727538128135, 'lambda_val': 0.001526779508134114, 'batch_size': 2384, 'optimizer': 'Adam'}.
2026-06-20 16:25:33,658 - experiment_functions - INFO - Early stopping at epoch 1050. Best Metrics: (0.02730198545343538, 0.005666603511431097, 0.015443602642707598)
2026-06-20 16:25:33,744 - optuna.study.study - INFO - Trial 297 finished with values: [0.02730198545343538, 0.005666603511431097, 0.015443602642707598] and parameters: {'n_layers': 2, 'embedding_dim': 256, 'lr': 0.0012029727538128135, 'lambda_val': 0.0004242504250406823, 'batch_size': 1380, 'optimizer': 'Adam'}.
2026-06-20 16:26:25,805 - experiment_functions - INFO - Early stopping at epoch 1100. Best Metrics: (0.01985358755047723, 0.004176139952002022, 0.011035522763414305)
2026-06-20 16:26:25,887 - optuna.study.study - INFO - Trial 298 finished with values: [0.01985358755047723, 0.004176139952002022, 0.011035522763414305] and parameters: {'n_layers': 3, 'embedding_dim': 96, 'lr': 0.0009942243415015796, 'lambda_val': 1.1933246402860015e-05, 'batch_size': 1643, 'optimizer': 'RMSprop'}.
2026-06-20 16:29:11,162 - optuna.study.study - INFO - Trial 299 finished with values: [0.03376264617112885, 0.007000757862826829, 0.01945707051413482] and parameters: {'n_layers': 1, 'embedding_dim': 32, 'lr': 0.0015403750227822883, 'lambda_val': 2.3871418678853867e-05, 'batch_size': 2009, 'optimizer': 'Adam'}.
2026-06-20 16:29:11,177 - root - INFO - Selected Trial 226 based on Max ndcg: 0.0205
2026-06-20 16:29:11,177 - root - INFO - Associated Recall: 0.0362
2026-06-20 16:29:11,177 - experiment_functions - INFO - Training the best model ... for e_yelp_1c1dcs_rand5
2026-06-20 16:31:38,613 - experiment_functions - INFO - Early stopping at epoch 3600. Best Metrics: (0.03338133109796116, 0.006877605153467223, 0.018934695498722297)
2026-06-20 16:31:42,456 - root - INFO - **** Training e_yelp_1c2dcs
2026-06-20 16:31:42,456 - root - INFO -   ** 2-Dominant stats:
2026-06-20 16:31:42,456 - root - INFO -   ** Finding the dominant set:
2026-06-20 18:06:50,792 - root - INFO -   ** Getting the trainable edges:
2026-06-20 18:06:50,820 - helper_functions - INFO -      Number of nodes: 4732
2026-06-20 18:06:50,820 - helper_functions - INFO -      Ratio: 0.06787538011360376
2026-06-20 18:06:50,820 - helper_functions - INFO -      Number of unique users: 2913
2026-06-20 18:06:50,820 - helper_functions - INFO -      Number of unique items: 1819
2026-06-20 18:06:50,821 - helper_functions - INFO -      Total dominant set edge: 88177
2026-06-20 18:06:50,821 - helper_functions - INFO -      Trainable edges: 70541.6
2026-06-20 18:06:50,891 - root - INFO -   **** Getting 88177 dominant set edges
2026-06-20 18:06:50,998 - optuna.storages._rdb.storage - INFO - A new study created in RDB with name: Study_e_yelp_1c2dcs_strict
2026-06-20 18:07:17,130 - experiment_functions - INFO - Early stopping at epoch 550. Best Metrics: (0.002411286505939318, 0.0013657319691802452, 0.0019622177701063143)
2026-06-20 18:07:17,226 - optuna.study.study - INFO - Trial 0 finished with values: [0.002411286505939318, 0.0013657319691802452, 0.0019622177701063143] and parameters: {'n_layers': 1, 'embedding_dim': 256, 'lr': 0.0013679015057362796, 'lambda_val': 0.014932842734384931, 'batch_size': 1115, 'optimizer': 'RMSprop'}.
2026-06-20 18:08:07,544 - experiment_functions - INFO - Early stopping at epoch 1000. Best Metrics: (0.00273380973241288, 0.001270999115826702, 0.0020471404466201482)
2026-06-20 18:08:07,626 - optuna.study.study - INFO - Trial 1 finished with values: [0.00273380973241288, 0.001270999115826702, 0.0020471404466201482] and parameters: {'n_layers': 3, 'embedding_dim': 256, 'lr': 0.00024125200546504656, 'lambda_val': 0.0031147525509907805, 'batch_size': 4096, 'optimizer': 'Adam'}.
2026-06-20 18:08:35,708 - experiment_functions - INFO - Early stopping at epoch 600. Best Metrics: (0.003279196645308858, 0.0014162561576354683, 0.0024066317218696533)
2026-06-20 18:08:35,853 - optuna.study.study - INFO - Trial 2 finished with values: [0.003279196645308858, 0.0014162561576354683, 0.0024066317218696533] and parameters: {'n_layers': 3, 'embedding_dim': 128, 'lr': 0.0007292538148544164, 'lambda_val': 6.733205641736132e-06, 'batch_size': 1670, 'optimizer': 'RMSprop'}.
2026-06-20 18:09:21,178 - experiment_functions - INFO - Early stopping at epoch 1100. Best Metrics: (0.0007383854623042507, 0.0002889352027283062, 0.0004974789041168494)
2026-06-20 18:09:21,252 - optuna.study.study - INFO - Trial 3 finished with values: [0.0007383854623042507, 0.0002889352027283062, 0.0004974789041168494] and parameters: {'n_layers': 2, 'embedding_dim': 64, 'lr': 0.039811911004022954, 'lambda_val': 0.042177857037552564, 'batch_size': 3156, 'optimizer': 'Adam'}.
2026-06-20 18:09:43,213 - experiment_functions - INFO - Early stopping at epoch 500. Best Metrics: (0.0024198223161912163, 0.0009173297966401416, 0.0016747510632493612)
2026-06-20 18:09:43,305 - optuna.study.study - INFO - Trial 4 finished with values: [0.0024198223161912163, 0.0009173297966401416, 0.0016747510632493612] and parameters: {'n_layers': 3, 'embedding_dim': 32, 'lr': 0.08010814822721256, 'lambda_val': 0.0056344344452909775, 'batch_size': 3292, 'optimizer': 'RMSprop'}.
2026-06-20 18:10:19,177 - experiment_functions - INFO - Early stopping at epoch 850. Best Metrics: (0.0037525190315997057, 0.0013183655425034737, 0.0023699064946069554)
2026-06-20 18:10:19,261 - optuna.study.study - INFO - Trial 5 finished with values: [0.0037525190315997057, 0.0013183655425034737, 0.0023699064946069554] and parameters: {'n_layers': 1, 'embedding_dim': 96, 'lr': 0.03178174845269066, 'lambda_val': 1.6056960373751058e-05, 'batch_size': 1847, 'optimizer': 'RMSprop'}.
2026-06-20 18:12:22,044 - experiment_functions - INFO - Early stopping at epoch 2950. Best Metrics: (0.0027574960325450716, 0.0012141594038145764, 0.001992582716356684)
2026-06-20 18:12:22,120 - optuna.study.study - INFO - Trial 6 finished with values: [0.0027574960325450716, 0.0012141594038145764, 0.001992582716356684] and parameters: {'n_layers': 4, 'embedding_dim': 64, 'lr': 0.00016414275370038185, 'lambda_val': 0.007605703371748731, 'batch_size': 3589, 'optimizer': 'Adam'}.
2026-06-20 18:15:00,674 - optuna.study.study - INFO - Trial 7 finished with values: [0.00228695583565265, 0.0010278514588859418, 0.0016393123394648228] and parameters: {'n_layers': 4, 'embedding_dim': 32, 'lr': 8.485959705611816e-05, 'lambda_val': 2.258251453803819e-05, 'batch_size': 2908, 'optimizer': 'Adam'}.
2026-06-20 18:15:55,937 - experiment_functions - INFO - Early stopping at epoch 1300. Best Metrics: (0.0031708587257639922, 0.0013909940634078567, 0.0022982775534805926)
2026-06-20 18:15:56,993 - optuna.study.study - INFO - Trial 8 finished with values: [0.0031708587257639922, 0.0013909940634078567, 0.0022982775534805926] and parameters: {'n_layers': 4, 'embedding_dim': 64, 'lr': 0.0003219848466357513, 'lambda_val': 8.755125650144564e-05, 'batch_size': 1584, 'optimizer': 'Adam'}.
2026-06-20 18:16:19,168 - experiment_functions - INFO - Early stopping at epoch 500. Best Metrics: (0.0005487120089191024, 0.00012473159024883163, 0.00029554321171373584)
2026-06-20 18:16:19,249 - optuna.study.study - INFO - Trial 9 finished with values: [0.0005487120089191024, 0.00012473159024883163, 0.00029554321171373584] and parameters: {'n_layers': 3, 'embedding_dim': 64, 'lr': 0.0004929818034700818, 'lambda_val': 6.780220529331646e-05, 'batch_size': 745, 'optimizer': 'SGD'}.
2026-06-20 18:16:45,989 - experiment_functions - INFO - Early stopping at epoch 550. Best Metrics: (0.00250191382771212, 0.0011731085006947077, 0.0018470941914272658)
2026-06-20 18:16:46,079 - optuna.study.study - INFO - Trial 10 finished with values: [0.00250191382771212, 0.0011731085006947077, 0.0018470941914272658] and parameters: {'n_layers': 4, 'embedding_dim': 128, 'lr': 0.039074263929726114, 'lambda_val': 9.228691340245099e-06, 'batch_size': 3842, 'optimizer': 'Adam'}.
2026-06-20 18:17:07,758 - experiment_functions - INFO - Early stopping at epoch 500. Best Metrics: (0.0005644843925154958, 0.00013420487558418593, 0.00033452797940862814)
2026-06-20 18:17:07,898 - optuna.study.study - INFO - Trial 11 finished with values: [0.0005644843925154958, 0.00013420487558418593, 0.00033452797940862814] and parameters: {'n_layers': 2, 'embedding_dim': 32, 'lr': 0.00811003253498821, 'lambda_val': 0.055778010160043356, 'batch_size': 1325, 'optimizer': 'SGD'}.
2026-06-20 18:17:31,991 - experiment_functions - INFO - Early stopping at epoch 500. Best Metrics: (0.0005522809664466259, 0.00011683718580270306, 0.0003154061997908506)
2026-06-20 18:17:32,327 - optuna.study.study - INFO - Trial 12 finished with values: [0.0005522809664466259, 0.00011683718580270306, 0.0003154061997908506] and parameters: {'n_layers': 4, 'embedding_dim': 128, 'lr': 1.141038666719674e-05, 'lambda_val': 0.01777576225075643, 'batch_size': 3171, 'optimizer': 'Adam'}.
2026-06-20 18:17:57,601 - experiment_functions - INFO - Early stopping at epoch 550. Best Metrics: (0.0027251812261167973, 0.001092585575344196, 0.0018756528244678564)
2026-06-20 18:17:57,687 - optuna.study.study - INFO - Trial 13 finished with values: [0.0027251812261167973, 0.001092585575344196, 0.0018756528244678564] and parameters: {'n_layers': 3, 'embedding_dim': 96, 'lr': 0.006000091750093614, 'lambda_val': 0.00012514028496686563, 'batch_size': 2025, 'optimizer': 'RMSprop'}.
2026-06-20 18:18:24,827 - experiment_functions - INFO - Early stopping at epoch 650. Best Metrics: (0.00047516226468100726, 0.00010894278135657447, 0.00025537421719618524)
2026-06-20 18:18:24,971 - optuna.study.study - INFO - Trial 14 finished with values: [0.00047516226468100726, 0.00010894278135657447, 0.00025537421719618524] and parameters: {'n_layers': 2, 'embedding_dim': 32, 'lr': 1.4863693251721494e-05, 'lambda_val': 0.033082770403650895, 'batch_size': 1333, 'optimizer': 'RMSprop'}.
2026-06-20 18:18:56,518 - experiment_functions - INFO - Early stopping at epoch 750. Best Metrics: (0.004201023581256461, 0.0018709738537324744, 0.003257110870314019)
