2026-06-18 18:59:03,610 - optuna.study.study - INFO - Trial 94 finished with values: [0.006825398725266601, 0.0015204622963243654, 0.0035619646713168805] and parameters: {'n_layers': 3, 'embedding_dim': 32, 'lr': 0.0018430878476133415, 'lambda_val': 0.049625866848613406, 'batch_size': 4089, 'optimizer': 'RMSprop'}.
2026-06-18 18:59:28,156 - experiment_functions - INFO - Early stopping at epoch 500. Best Metrics: (0.0005852958559558166, 0.00011999494758115448, 0.00035629366933836017)
2026-06-18 18:59:28,246 - optuna.study.study - INFO - Trial 95 finished with values: [0.0005852958559558166, 0.00011999494758115448, 0.00035629366933836017] and parameters: {'n_layers': 1, 'embedding_dim': 128, 'lr': 0.009147760801835597, 'lambda_val': 0.0006355062805216911, 'batch_size': 2797, 'optimizer': 'SGD'}.
2026-06-18 18:59:53,754 - experiment_functions - INFO - Early stopping at epoch 500. Best Metrics: (0.0004938161297804439, 0.00011052166224580017, 0.00026144691673818274)
2026-06-18 18:59:53,841 - optuna.study.study - INFO - Trial 96 finished with values: [0.0004938161297804439, 0.00011052166224580017, 0.00026144691673818274] and parameters: {'n_layers': 2, 'embedding_dim': 96, 'lr': 1.963396245502517e-05, 'lambda_val': 0.0005943254859344516, 'batch_size': 753, 'optimizer': 'Adam'}.
2026-06-18 19:00:32,966 - experiment_functions - INFO - Early stopping at epoch 800. Best Metrics: (0.024035724073557932, 0.005336617405582923, 0.01391152695282667)
2026-06-18 19:00:33,050 - optuna.study.study - INFO - Trial 97 finished with values: [0.024035724073557932, 0.005336617405582923, 0.01391152695282667] and parameters: {'n_layers': 1, 'embedding_dim': 128, 'lr': 0.0010467544958961223, 'lambda_val': 0.00988731074821415, 'batch_size': 2931, 'optimizer': 'Adam'}.
2026-06-18 19:01:07,322 - experiment_functions - INFO - Early stopping at epoch 700. Best Metrics: (0.028937056922234274, 0.006212896299103196, 0.016587905452332335)
2026-06-18 19:01:07,605 - optuna.study.study - INFO - Trial 98 finished with values: [0.028937056922234274, 0.006212896299103196, 0.016587905452332335] and parameters: {'n_layers': 1, 'embedding_dim': 96, 'lr': 0.0022436517643766684, 'lambda_val': 5.316198242532503e-06, 'batch_size': 2254, 'optimizer': 'Adam'}.
2026-06-18 19:01:37,327 - experiment_functions - INFO - Early stopping at epoch 550. Best Metrics: (0.000558210117996219, 0.00011999494758115448, 0.0002976800503336573)
2026-06-18 19:01:37,854 - optuna.study.study - INFO - Trial 99 finished with values: [0.000558210117996219, 0.00011999494758115448, 0.0002976800503336573] and parameters: {'n_layers': 1, 'embedding_dim': 256, 'lr': 1.538180749165841e-05, 'lambda_val': 0.00988731074821415, 'batch_size': 2487, 'optimizer': 'Adam'}.
2026-06-18 19:02:14,153 - experiment_functions - INFO - Early stopping at epoch 600. Best Metrics: (0.024892332466808647, 0.005162940507768094, 0.014086136915977288)
2026-06-18 19:02:14,547 - optuna.study.study - INFO - Trial 100 finished with values: [0.024892332466808647, 0.005162940507768094, 0.014086136915977288] and parameters: {'n_layers': 2, 'embedding_dim': 256, 'lr': 0.001993370802391186, 'lambda_val': 4.735122359256782e-06, 'batch_size': 2055, 'optimizer': 'Adam'}.
2026-06-18 19:03:22,826 - experiment_functions - INFO - Early stopping at epoch 1350. Best Metrics: (0.02400701344397843, 0.005066628773525325, 0.013456806555068729)
2026-06-18 19:03:22,915 - optuna.study.study - INFO - Trial 101 finished with values: [0.02400701344397843, 0.005066628773525325, 0.013456806555068729] and parameters: {'n_layers': 3, 'embedding_dim': 96, 'lr': 0.0007183006551542105, 'lambda_val': 0.00015514348570178205, 'batch_size': 991, 'optimizer': 'Adam'}.
2026-06-18 19:03:57,887 - experiment_functions - INFO - Early stopping at epoch 600. Best Metrics: (0.019229642510292216, 0.003937728937728938, 0.010250765233501352)
2026-06-18 19:03:58,188 - optuna.study.study - INFO - Trial 102 finished with values: [0.019229642510292216, 0.003937728937728938, 0.010250765233501352] and parameters: {'n_layers': 4, 'embedding_dim': 128, 'lr': 0.001993370802391186, 'lambda_val': 0.001270364796526946, 'batch_size': 3520, 'optimizer': 'Adam'}.
2026-06-18 19:04:32,331 - experiment_functions - INFO - Early stopping at epoch 650. Best Metrics: (0.020713503741630352, 0.004555071365416193, 0.011700328560682236)
2026-06-18 19:04:32,798 - optuna.study.study - INFO - Trial 103 finished with values: [0.020713503741630352, 0.004555071365416193, 0.011700328560682236] and parameters: {'n_layers': 2, 'embedding_dim': 128, 'lr': 0.0010467544958961223, 'lambda_val': 0.00988731074821415, 'batch_size': 2931, 'optimizer': 'Adam'}.
2026-06-18 19:08:00,598 - optuna.study.study - INFO - Trial 104 finished with values: [0.024503633575797393, 0.005281356574460023, 0.013749976195964216] and parameters: {'n_layers': 3, 'embedding_dim': 128, 'lr': 0.00022471387800597823, 'lambda_val': 1.1727812158033635e-06, 'batch_size': 3512, 'optimizer': 'Adam'}.
2026-06-18 19:08:31,009 - experiment_functions - INFO - Early stopping at epoch 600. Best Metrics: (0.02328246710577243, 0.004768220285461666, 0.012952434304723266)
2026-06-18 19:08:31,129 - optuna.study.study - INFO - Trial 105 finished with values: [0.02328246710577243, 0.004768220285461666, 0.012952434304723266] and parameters: {'n_layers': 2, 'embedding_dim': 96, 'lr': 0.0030858872406087346, 'lambda_val': 0.0005943254859344516, 'batch_size': 2618, 'optimizer': 'Adam'}.
2026-06-18 19:09:10,688 - experiment_functions - INFO - Early stopping at epoch 600. Best Metrics: (0.022431248002146145, 0.004664014146772767, 0.012572093371558887)
2026-06-18 19:09:10,990 - optuna.study.study - INFO - Trial 106 finished with values: [0.022431248002146145, 0.004664014146772767, 0.012572093371558887] and parameters: {'n_layers': 3, 'embedding_dim': 256, 'lr': 0.001993370802391186, 'lambda_val': 4.735122359256782e-06, 'batch_size': 3520, 'optimizer': 'Adam'}.
2026-06-18 19:09:45,856 - experiment_functions - INFO - Early stopping at epoch 600. Best Metrics: (0.01959392294347038, 0.003918782367058229, 0.010730898859856642)
2026-06-18 19:09:45,955 - optuna.study.study - INFO - Trial 107 finished with values: [0.01959392294347038, 0.003918782367058229, 0.010730898859856642] and parameters: {'n_layers': 4, 'embedding_dim': 128, 'lr': 0.0022436517643766684, 'lambda_val': 5.316198242532503e-06, 'batch_size': 3520, 'optimizer': 'Adam'}.
2026-06-18 19:12:49,302 - optuna.study.study - INFO - Trial 108 finished with values: [0.0158264599109217, 0.003569849690539346, 0.009295288815061522] and parameters: {'n_layers': 3, 'embedding_dim': 64, 'lr': 0.00014901541551160864, 'lambda_val': 3.164393194749599e-05, 'batch_size': 649, 'optimizer': 'RMSprop'}.
2026-06-18 19:13:16,330 - experiment_functions - INFO - Early stopping at epoch 550. Best Metrics: (0.009239187045205913, 0.0021551724137931034, 0.0056314586920162895)
2026-06-18 19:13:16,422 - optuna.study.study - INFO - Trial 109 finished with values: [0.009239187045205913, 0.0021551724137931034, 0.0056314586920162895] and parameters: {'n_layers': 1, 'embedding_dim': 128, 'lr': 0.04895161515179164, 'lambda_val': 5.316198242532503e-06, 'batch_size': 2254, 'optimizer': 'Adam'}.
2026-06-18 19:13:44,026 - experiment_functions - INFO - Early stopping at epoch 550. Best Metrics: (0.014715201515223255, 0.0031419729695591767, 0.008213528699359093)
2026-06-18 19:13:44,116 - optuna.study.study - INFO - Trial 110 finished with values: [0.014715201515223255, 0.0031419729695591767, 0.008213528699359093] and parameters: {'n_layers': 2, 'embedding_dim': 96, 'lr': 0.015332760458298357, 'lambda_val': 0.00015514348570178205, 'batch_size': 991, 'optimizer': 'Adam'}.
2026-06-18 19:14:40,236 - experiment_functions - INFO - Early stopping at epoch 1000. Best Metrics: (0.016548585599327495, 0.0033551218896046486, 0.008634734675517803)
2026-06-18 19:14:40,337 - optuna.study.study - INFO - Trial 111 finished with values: [0.016548585599327495, 0.0033551218896046486, 0.008634734675517803] and parameters: {'n_layers': 4, 'embedding_dim': 128, 'lr': 0.0022436517643766684, 'lambda_val': 5.316198242532503e-06, 'batch_size': 2254, 'optimizer': 'RMSprop'}.
2026-06-18 19:17:37,917 - optuna.study.study - INFO - Trial 112 finished with values: [0.002778042184353335, 0.000647341164582544, 0.001667751846870711] and parameters: {'n_layers': 4, 'embedding_dim': 32, 'lr': 5.752516085418992e-05, 'lambda_val': 0.00015514348570178205, 'batch_size': 2515, 'optimizer': 'Adam'}.
2026-06-18 19:18:25,400 - experiment_functions - INFO - Early stopping at epoch 1000. Best Metrics: (0.029785773218018934, 0.0064560439560439565, 0.01707544477767101)
2026-06-18 19:18:25,486 - optuna.study.study - INFO - Trial 113 finished with values: [0.029785773218018934, 0.0064560439560439565, 0.01707544477767101] and parameters: {'n_layers': 1, 'embedding_dim': 96, 'lr': 0.0010029417148474076, 'lambda_val': 0.00015514348570178205, 'batch_size': 991, 'optimizer': 'RMSprop'}.
2026-06-18 19:18:54,386 - experiment_functions - INFO - Early stopping at epoch 500. Best Metrics: (0.014514108257547903, 0.003107237589996211, 0.008848021313170293)
2026-06-18 19:18:54,480 - optuna.study.study - INFO - Trial 114 finished with values: [0.014514108257547903, 0.003107237589996211, 0.008848021313170293] and parameters: {'n_layers': 4, 'embedding_dim': 128, 'lr': 0.0711855377482981, 'lambda_val': 0.006468486245866659, 'batch_size': 3068, 'optimizer': 'RMSprop'}.
2026-06-18 19:21:55,274 - optuna.study.study - INFO - Trial 115 finished with values: [0.022363332302545027, 0.0048740053050397875, 0.012632070492560614] and parameters: {'n_layers': 4, 'embedding_dim': 32, 'lr': 0.00022471387800597823, 'lambda_val': 1.1727812158033635e-06, 'batch_size': 578, 'optimizer': 'Adam'}.
2026-06-18 19:22:22,800 - experiment_functions - INFO - Early stopping at epoch 500. Best Metrics: (0.0005634840436501459, 0.00011210054313502589, 0.00031856947070760635)
2026-06-18 19:22:22,889 - optuna.study.study - INFO - Trial 116 finished with values: [0.0005634840436501459, 0.00011210054313502589, 0.00031856947070760635] and parameters: {'n_layers': 4, 'embedding_dim': 96, 'lr': 3.214651420485446e-05, 'lambda_val': 0.006468486245866659, 'batch_size': 3068, 'optimizer': 'Adam'}.
2026-06-18 19:22:53,411 - experiment_functions - INFO - Early stopping at epoch 600. Best Metrics: (0.023181449104395343, 0.004885057471264369, 0.013314412193462034)
2026-06-18 19:22:53,652 - optuna.study.study - INFO - Trial 117 finished with values: [0.023181449104395343, 0.004885057471264369, 0.013314412193462034] and parameters: {'n_layers': 3, 'embedding_dim': 64, 'lr': 0.0018430878476133415, 'lambda_val': 4.115717615485875e-05, 'batch_size': 4089, 'optimizer': 'Adam'}.
2026-06-18 19:23:36,207 - experiment_functions - INFO - Early stopping at epoch 650. Best Metrics: (0.018128591156489487, 0.0036061639509915367, 0.009575924169262947)
2026-06-18 19:23:36,284 - optuna.study.study - INFO - Trial 118 finished with values: [0.018128591156489487, 0.0036061639509915367, 0.009575924169262947] and parameters: {'n_layers': 3, 'embedding_dim': 256, 'lr': 0.0018430878476133415, 'lambda_val': 1.1727812158033635e-06, 'batch_size': 3360, 'optimizer': 'RMSprop'}.
2026-06-18 19:24:17,266 - experiment_functions - INFO - Early stopping at epoch 850. Best Metrics: (0.02029140649800991, 0.004607174434760642, 0.011303212369578475)
2026-06-18 19:24:17,351 - optuna.study.study - INFO - Trial 119 finished with values: [0.02029140649800991, 0.004607174434760642, 0.011303212369578475] and parameters: {'n_layers': 4, 'embedding_dim': 32, 'lr': 0.000746151836584117, 'lambda_val': 1.1727812158033635e-06, 'batch_size': 2618, 'optimizer': 'RMSprop'}.
2026-06-18 19:24:54,069 - experiment_functions - INFO - Early stopping at epoch 700. Best Metrics: (0.026195556364817213, 0.00565870910698497, 0.014996478972618405)
2026-06-18 19:24:54,153 - optuna.study.study - INFO - Trial 120 finished with values: [0.026195556364817213, 0.00565870910698497, 0.014996478972618405] and parameters: {'n_layers': 2, 'embedding_dim': 128, 'lr': 0.0010029417148474076, 'lambda_val': 1.4285456163687262e-06, 'batch_size': 3911, 'optimizer': 'Adam'}.
2026-06-18 19:25:25,167 - experiment_functions - INFO - Early stopping at epoch 600. Best Metrics: (0.015630497131795658, 0.0032319691802450423, 0.008447473208344313)
2026-06-18 19:25:25,292 - optuna.study.study - INFO - Trial 121 finished with values: [0.015630497131795658, 0.0032319691802450423, 0.008447473208344313] and parameters: {'n_layers': 4, 'embedding_dim': 64, 'lr': 0.0018466507240200577, 'lambda_val': 0.0008133618949496412, 'batch_size': 1453, 'optimizer': 'RMSprop'}.
2026-06-18 19:25:56,269 - experiment_functions - INFO - Early stopping at epoch 550. Best Metrics: (0.020736861867256408, 0.0041714033093343435, 0.011135676907037623)
2026-06-18 19:25:56,364 - optuna.study.study - INFO - Trial 122 finished with values: [0.020736861867256408, 0.0041714033093343435, 0.011135676907037623] and parameters: {'n_layers': 3, 'embedding_dim': 128, 'lr': 0.0043327327875147025, 'lambda_val': 1.1727812158033635e-06, 'batch_size': 4089, 'optimizer': 'Adam'}.
2026-06-18 19:28:56,886 - optuna.study.study - INFO - Trial 123 finished with values: [0.012420373084656341, 0.002903561955286094, 0.007487553885095481] and parameters: {'n_layers': 1, 'embedding_dim': 128, 'lr': 0.0001674019248092106, 'lambda_val': 1.4285456163687262e-06, 'batch_size': 3012, 'optimizer': 'RMSprop'}.
2026-06-18 19:29:50,688 - experiment_functions - INFO - Early stopping at epoch 1100. Best Metrics: (0.024726062924326206, 0.005439244663382596, 0.013931100264203777)
2026-06-18 19:29:50,774 - optuna.study.study - INFO - Trial 124 finished with values: [0.024726062924326206, 0.005439244663382596, 0.013931100264203777] and parameters: {'n_layers': 3, 'embedding_dim': 64, 'lr': 0.0004856174201898278, 'lambda_val': 4.115717615485875e-05, 'batch_size': 3300, 'optimizer': 'Adam'}.
2026-06-18 19:33:29,968 - optuna.study.study - INFO - Trial 125 finished with values: [0.023532842716783017, 0.005175571554881901, 0.01340447781218304] and parameters: {'n_layers': 4, 'embedding_dim': 128, 'lr': 0.0001674019248092106, 'lambda_val': 4.2973684498152175e-06, 'batch_size': 2689, 'optimizer': 'Adam'}.
2026-06-18 19:34:16,915 - experiment_functions - INFO - Early stopping at epoch 1000. Best Metrics: (0.021623760468218917, 0.00465611974232664, 0.012275508310178677)
2026-06-18 19:34:16,984 - optuna.study.study - INFO - Trial 126 finished with values: [0.021623760468218917, 0.00465611974232664, 0.012275508310178677] and parameters: {'n_layers': 4, 'embedding_dim': 32, 'lr': 0.000635711973001454, 'lambda_val': 0.0004198890855768189, 'batch_size': 3012, 'optimizer': 'Adam'}.
2026-06-18 19:34:53,019 - experiment_functions - INFO - Early stopping at epoch 550. Best Metrics: (0.01703337599911124, 0.003582480737653152, 0.009363644233932948)
2026-06-18 19:34:53,551 - optuna.study.study - INFO - Trial 127 finished with values: [0.01703337599911124, 0.003582480737653152, 0.009363644233932948] and parameters: {'n_layers': 3, 'embedding_dim': 256, 'lr': 0.0012644916907555855, 'lambda_val': 0.00018789419542911885, 'batch_size': 3520, 'optimizer': 'RMSprop'}.
2026-06-18 19:35:19,330 - experiment_functions - INFO - Early stopping at epoch 550. Best Metrics: (0.0007384314086043437, 0.00014367816091954025, 0.0003493841576524734)
2026-06-18 19:35:19,427 - optuna.study.study - INFO - Trial 128 finished with values: [0.0007384314086043437, 0.00014367816091954025, 0.0003493841576524734] and parameters: {'n_layers': 3, 'embedding_dim': 32, 'lr': 1.7780885698204424e-05, 'lambda_val': 0.00015514348570178205, 'batch_size': 991, 'optimizer': 'RMSprop'}.
2026-06-18 19:35:54,012 - experiment_functions - INFO - Early stopping at epoch 700. Best Metrics: (0.02947111717656509, 0.006384994316028798, 0.0171604491441798)
2026-06-18 19:35:54,236 - optuna.study.study - INFO - Trial 129 finished with values: [0.02947111717656509, 0.006384994316028798, 0.0171604491441798] and parameters: {'n_layers': 1, 'embedding_dim': 128, 'lr': 0.0022436517643766684, 'lambda_val': 5.316198242532503e-06, 'batch_size': 2521, 'optimizer': 'Adam'}.
2026-06-18 19:37:47,656 - experiment_functions - INFO - Early stopping at epoch 2400. Best Metrics: (0.027203522225739966, 0.005903435644814955, 0.01582162670204736)
2026-06-18 19:37:48,002 - optuna.study.study - INFO - Trial 130 finished with values: [0.027203522225739966, 0.005903435644814955, 0.01582162670204736] and parameters: {'n_layers': 2, 'embedding_dim': 96, 'lr': 0.00039950195617414347, 'lambda_val': 5.316198242532503e-06, 'batch_size': 2254, 'optimizer': 'Adam'}.
2026-06-18 19:38:18,641 - experiment_functions - INFO - Early stopping at epoch 550. Best Metrics: (0.019578672624472403, 0.003914045724390552, 0.010426916704327443)
2026-06-18 19:38:18,946 - optuna.study.study - INFO - Trial 131 finished with values: [0.019578672624472403, 0.003914045724390552, 0.010426916704327443] and parameters: {'n_layers': 3, 'embedding_dim': 128, 'lr': 0.022552700000257754, 'lambda_val': 1.2234718907533834e-06, 'batch_size': 3512, 'optimizer': 'Adam'}.
2026-06-18 19:40:32,700 - experiment_functions - INFO - Early stopping at epoch 2600. Best Metrics: (0.03262271962071014, 0.006751294682329164, 0.018725741312267948)
2026-06-18 19:40:33,337 - optuna.study.study - INFO - Trial 132 finished with values: [0.03262271962071014, 0.006751294682329164, 0.018725741312267948] and parameters: {'n_layers': 1, 'embedding_dim': 256, 'lr': 0.0005592470013695373, 'lambda_val': 4.521426485432383e-06, 'batch_size': 2931, 'optimizer': 'RMSprop'}.
2026-06-18 19:41:00,928 - experiment_functions - INFO - Early stopping at epoch 550. Best Metrics: (0.02804154814564885, 0.005810281672350639, 0.016278598460047995)
2026-06-18 19:41:01,646 - optuna.study.study - INFO - Trial 133 finished with values: [0.02804154814564885, 0.005810281672350639, 0.016278598460047995] and parameters: {'n_layers': 1, 'embedding_dim': 128, 'lr': 0.0082956867501665, 'lambda_val': 0.0005943254859344516, 'batch_size': 3516, 'optimizer': 'Adam'}.
2026-06-18 19:42:04,022 - experiment_functions - INFO - Early stopping at epoch 1300. Best Metrics: (0.023879673071818368, 0.005139257294429708, 0.013618047351103916)
2026-06-18 19:42:05,241 - optuna.study.study - INFO - Trial 134 finished with values: [0.023879673071818368, 0.005139257294429708, 0.013618047351103916] and parameters: {'n_layers': 3, 'embedding_dim': 64, 'lr': 0.0005737959663697227, 'lambda_val': 1.288405727605743e-06, 'batch_size': 3995, 'optimizer': 'RMSprop'}.
2026-06-18 19:45:08,665 - optuna.study.study - INFO - Trial 135 finished with values: [0.012044315900212136, 0.0027535682708096504, 0.007077299543874638] and parameters: {'n_layers': 2, 'embedding_dim': 96, 'lr': 0.00011040723334956882, 'lambda_val': 0.0037406360162648877, 'batch_size': 3197, 'optimizer': 'RMSprop'}.
2026-06-18 19:48:06,454 - optuna.study.study - INFO - Trial 136 finished with values: [0.027135171189464527, 0.005944486547934824, 0.016052695865851493] and parameters: {'n_layers': 1, 'embedding_dim': 96, 'lr': 0.00039950195617414347, 'lambda_val': 0.00015514348570178205, 'batch_size': 991, 'optimizer': 'Adam'}.
2026-06-18 19:48:40,229 - experiment_functions - INFO - Early stopping at epoch 750. Best Metrics: (0.015414771998480487, 0.003257231274472654, 0.008319843294456028)
2026-06-18 19:48:40,483 - optuna.study.study - INFO - Trial 137 finished with values: [0.015414771998480487, 0.003257231274472654, 0.008319843294456028] and parameters: {'n_layers': 2, 'embedding_dim': 32, 'lr': 0.0016666158484092458, 'lambda_val': 0.0014622616946591267, 'batch_size': 1083, 'optimizer': 'RMSprop'}.
2026-06-18 19:49:10,168 - experiment_functions - INFO - Early stopping at epoch 550. Best Metrics: (0.017330804412141843, 0.0034845901225211574, 0.009247770049206874)
2026-06-18 19:49:10,272 - optuna.study.study - INFO - Trial 138 finished with values: [0.017330804412141843, 0.0034845901225211574, 0.009247770049206874] and parameters: {'n_layers': 4, 'embedding_dim': 96, 'lr': 0.004952675271626227, 'lambda_val': 0.0005943254859344516, 'batch_size': 3608, 'optimizer': 'Adam'}.
2026-06-18 19:49:39,063 - experiment_functions - INFO - Early stopping at epoch 550. Best Metrics: (0.01981497256705364, 0.0039503599848427435, 0.010579726253360294)
2026-06-18 19:49:39,150 - optuna.study.study - INFO - Trial 139 finished with values: [0.01981497256705364, 0.0039503599848427435, 0.010579726253360294] and parameters: {'n_layers': 3, 'embedding_dim': 96, 'lr': 0.0019103968846361876, 'lambda_val': 2.029370111875682e-06, 'batch_size': 4089, 'optimizer': 'RMSprop'}.
2026-06-18 19:50:09,032 - experiment_functions - INFO - Early stopping at epoch 550. Best Metrics: (0.010428524589994189, 0.0021962233169129726, 0.005698582795561107)
2026-06-18 19:50:09,127 - optuna.study.study - INFO - Trial 140 finished with values: [0.010428524589994189, 0.0021962233169129726, 0.005698582795561107] and parameters: {'n_layers': 3, 'embedding_dim': 128, 'lr': 0.022552700000257754, 'lambda_val': 0.001270364796526946, 'batch_size': 3338, 'optimizer': 'Adam'}.
2026-06-18 19:50:42,765 - experiment_functions - INFO - Early stopping at epoch 750. Best Metrics: (0.01571643447522658, 0.003331438676266263, 0.008955365530663869)
2026-06-18 19:50:43,058 - optuna.study.study - INFO - Trial 141 finished with values: [0.01571643447522658, 0.003331438676266263, 0.008955365530663869] and parameters: {'n_layers': 2, 'embedding_dim': 32, 'lr': 0.01280471264191173, 'lambda_val': 8.320422535259038e-06, 'batch_size': 808, 'optimizer': 'RMSprop'}.
2026-06-18 19:51:27,834 - experiment_functions - INFO - Early stopping at epoch 950. Best Metrics: (0.02487472330056899, 0.0056287103700896806, 0.014244796782946193)
