2026-06-20 10:42:18,408 - optuna.study.study - INFO - Trial 28 finished with values: [0.00045753418924213336, 0.00010420613868889732, 0.00027222695084367943] and parameters: {'n_layers': 2, 'embedding_dim': 64, 'lr': 9.286157519028801e-05, 'lambda_val': 0.0010260455611307618, 'batch_size': 3662, 'optimizer': 'SGD'}.
2026-06-20 10:43:27,450 - experiment_functions - INFO - Early stopping at epoch 1600. Best Metrics: (0.0006537350117929805, 0.00013104711380573452, 0.00035308730830574663)
2026-06-20 10:43:27,594 - optuna.study.study - INFO - Trial 29 finished with values: [0.0006537350117929805, 0.00013104711380573452, 0.00035308730830574663] and parameters: {'n_layers': 1, 'embedding_dim': 128, 'lr': 2.0533926867514995e-05, 'lambda_val': 5.709570496997619e-05, 'batch_size': 2636, 'optimizer': 'Adam'}.
2026-06-20 10:43:53,743 - experiment_functions - INFO - Early stopping at epoch 550. Best Metrics: (0.006933035453812648, 0.0014888846785398508, 0.003861708014214111)
2026-06-20 10:43:53,822 - optuna.study.study - INFO - Trial 30 finished with values: [0.006933035453812648, 0.0014888846785398508, 0.003861708014214111] and parameters: {'n_layers': 2, 'embedding_dim': 96, 'lr': 0.0323373638515788, 'lambda_val': 5.848323299602918e-05, 'batch_size': 2786, 'optimizer': 'RMSprop'}.
2026-06-20 10:44:18,818 - experiment_functions - INFO - Early stopping at epoch 550. Best Metrics: (0.009984262841364984, 0.0020730706075533663, 0.005405214080889867)
2026-06-20 10:44:18,904 - optuna.study.study - INFO - Trial 31 finished with values: [0.009984262841364984, 0.0020730706075533663, 0.005405214080889867] and parameters: {'n_layers': 4, 'embedding_dim': 32, 'lr': 0.0031787576826821074, 'lambda_val': 9.621415988260023e-05, 'batch_size': 3498, 'optimizer': 'RMSprop'}.
2026-06-20 10:47:08,722 - optuna.study.study - INFO - Trial 32 finished with values: [0.008953662071522513, 0.002036756347101175, 0.0050338161851951205] and parameters: {'n_layers': 1, 'embedding_dim': 128, 'lr': 0.06963517344838095, 'lambda_val': 0.006600826427834228, 'batch_size': 1271, 'optimizer': 'RMSprop'}.
2026-06-20 10:47:31,311 - experiment_functions - INFO - Early stopping at epoch 500. Best Metrics: (0.0006037418230904219, 0.00012631047113805733, 0.0003747254933152659)
2026-06-20 10:47:31,393 - optuna.study.study - INFO - Trial 33 finished with values: [0.0006037418230904219, 0.00012631047113805733, 0.0003747254933152659] and parameters: {'n_layers': 4, 'embedding_dim': 32, 'lr': 0.00503830394333252, 'lambda_val': 3.142259437876897e-06, 'batch_size': 1500, 'optimizer': 'SGD'}.
2026-06-20 10:49:11,163 - experiment_functions - INFO - Early stopping at epoch 2350. Best Metrics: (0.00047026674686754085, 0.00012315270935960593, 0.0002635917649089523)
2026-06-20 10:49:11,236 - optuna.study.study - INFO - Trial 34 finished with values: [0.00047026674686754085, 0.00012315270935960593, 0.0002635917649089523] and parameters: {'n_layers': 1, 'embedding_dim': 128, 'lr': 1.0104987829935689e-05, 'lambda_val': 6.935855244012392e-06, 'batch_size': 4056, 'optimizer': 'RMSprop'}.
2026-06-20 10:49:37,789 - experiment_functions - INFO - Early stopping at epoch 500. Best Metrics: (0.000593120461223538, 0.00012315270935960593, 0.00031323417733162645)
2026-06-20 10:49:37,867 - optuna.study.study - INFO - Trial 35 finished with values: [0.000593120461223538, 0.00012315270935960593, 0.00031323417733162645] and parameters: {'n_layers': 4, 'embedding_dim': 128, 'lr': 0.04435649056987007, 'lambda_val': 0.0004435147620568133, 'batch_size': 1296, 'optimizer': 'SGD'}.
2026-06-20 10:50:21,423 - experiment_functions - INFO - Early stopping at epoch 900. Best Metrics: (0.023721947471034784, 0.005001894657067071, 0.013332421956233131)
2026-06-20 10:50:21,496 - optuna.study.study - INFO - Trial 36 finished with values: [0.023721947471034784, 0.005001894657067071, 0.013332421956233131] and parameters: {'n_layers': 3, 'embedding_dim': 96, 'lr': 0.0009942243415015796, 'lambda_val': 2.3871418678853867e-05, 'batch_size': 3025, 'optimizer': 'Adam'}.
2026-06-20 10:50:46,730 - experiment_functions - INFO - Early stopping at epoch 550. Best Metrics: (0.009944199847989742, 0.002262536314260452, 0.005549204595942796)
2026-06-20 10:50:47,463 - optuna.study.study - INFO - Trial 37 finished with values: [0.009944199847989742, 0.002262536314260452, 0.005549204595942796] and parameters: {'n_layers': 1, 'embedding_dim': 96, 'lr': 0.03277585555961363, 'lambda_val': 0.00023746709113177394, 'batch_size': 1389, 'optimizer': 'Adam'}.
2026-06-20 10:53:42,979 - optuna.study.study - INFO - Trial 38 finished with values: [0.0261968800066698, 0.005522925350511558, 0.015461736297693568] and parameters: {'n_layers': 3, 'embedding_dim': 64, 'lr': 0.00040210644242369826, 'lambda_val': 1.4891573500580198e-05, 'batch_size': 2177, 'optimizer': 'Adam'}.
2026-06-20 10:54:06,343 - experiment_functions - INFO - Early stopping at epoch 500. Best Metrics: (0.0005099578738734839, 0.00012473159024883163, 0.00030226147500447045)
2026-06-20 10:54:06,442 - optuna.study.study - INFO - Trial 39 finished with values: [0.0005099578738734839, 0.00012473159024883163, 0.00030226147500447045] and parameters: {'n_layers': 2, 'embedding_dim': 96, 'lr': 0.006153663688041955, 'lambda_val': 1.882064658899445e-06, 'batch_size': 894, 'optimizer': 'SGD'}.
2026-06-20 10:54:33,828 - experiment_functions - INFO - Early stopping at epoch 600. Best Metrics: (0.0051534570309579005, 0.001209422761146899, 0.002655457108300577)
2026-06-20 10:54:33,907 - optuna.study.study - INFO - Trial 40 finished with values: [0.0051534570309579005, 0.001209422761146899, 0.002655457108300577] and parameters: {'n_layers': 2, 'embedding_dim': 64, 'lr': 0.005214780908192409, 'lambda_val': 0.09128514885217996, 'batch_size': 3472, 'optimizer': 'Adam'}.
2026-06-20 10:54:55,454 - experiment_functions - INFO - Early stopping at epoch 500. Best Metrics: (0.0005027729065916236, 0.00012473159024883163, 0.00029356993776353954)
2026-06-20 10:54:55,560 - optuna.study.study - INFO - Trial 41 finished with values: [0.0005027729065916236, 0.00012473159024883163, 0.00029356993776353954] and parameters: {'n_layers': 1, 'embedding_dim': 32, 'lr': 1.4053612118075061e-05, 'lambda_val': 1.4385171893101732e-06, 'batch_size': 2916, 'optimizer': 'SGD'}.
2026-06-20 10:55:31,269 - experiment_functions - INFO - Early stopping at epoch 550. Best Metrics: (0.0061780021310273315, 0.0014652014652014654, 0.003613248725222529)
2026-06-20 10:55:31,352 - optuna.study.study - INFO - Trial 42 finished with values: [0.0061780021310273315, 0.0014652014652014654, 0.003613248725222529] and parameters: {'n_layers': 4, 'embedding_dim': 256, 'lr': 0.0014257575686740206, 'lambda_val': 0.025733691733705995, 'batch_size': 782, 'optimizer': 'RMSprop'}.
2026-06-20 10:58:33,325 - optuna.study.study - INFO - Trial 43 finished with values: [0.015474016318264333, 0.0036203738789945686, 0.008969171578323852] and parameters: {'n_layers': 3, 'embedding_dim': 96, 'lr': 0.00018526976069552334, 'lambda_val': 0.011822413068431218, 'batch_size': 2500, 'optimizer': 'RMSprop'}.
2026-06-20 10:58:57,685 - experiment_functions - INFO - Early stopping at epoch 550. Best Metrics: (0.006994651441463905, 0.0015204622963243652, 0.0038443641240422494)
2026-06-20 10:58:57,777 - optuna.study.study - INFO - Trial 44 finished with values: [0.006994651441463905, 0.0015204622963243652, 0.0038443641240422494] and parameters: {'n_layers': 2, 'embedding_dim': 32, 'lr': 0.036368990038609265, 'lambda_val': 1.2738065012569515e-05, 'batch_size': 3714, 'optimizer': 'RMSprop'}.
2026-06-20 10:59:25,171 - experiment_functions - INFO - Early stopping at epoch 500. Best Metrics: (0.0005705379829968831, 0.00012315270935960593, 0.0002900212567860419)
2026-06-20 10:59:25,241 - optuna.study.study - INFO - Trial 45 finished with values: [0.0005705379829968831, 0.00012315270935960593, 0.0002900212567860419] and parameters: {'n_layers': 2, 'embedding_dim': 256, 'lr': 0.01724207112810277, 'lambda_val': 2.487218365051423e-06, 'batch_size': 2479, 'optimizer': 'SGD'}.
2026-06-20 10:59:49,493 - experiment_functions - INFO - Early stopping at epoch 500. Best Metrics: (0.0006667575756971626, 0.0001405203991410888, 0.0003539152263559242)
2026-06-20 10:59:49,589 - optuna.study.study - INFO - Trial 46 finished with values: [0.0006667575756971626, 0.0001405203991410888, 0.0003539152263559242] and parameters: {'n_layers': 3, 'embedding_dim': 96, 'lr': 0.02288989879091075, 'lambda_val': 6.625163122336359e-05, 'batch_size': 1392, 'optimizer': 'SGD'}.
2026-06-20 11:00:27,807 - experiment_functions - INFO - Early stopping at epoch 800. Best Metrics: (0.013435546858195077, 0.002789882531261842, 0.007777257650982404)
2026-06-20 11:00:27,922 - optuna.study.study - INFO - Trial 47 finished with values: [0.013435546858195077, 0.002789882531261842, 0.007777257650982404] and parameters: {'n_layers': 2, 'embedding_dim': 128, 'lr': 0.011820223547800823, 'lambda_val': 4.703980448589771e-06, 'batch_size': 1731, 'optimizer': 'RMSprop'}.
2026-06-20 11:04:10,819 - optuna.study.study - INFO - Trial 48 finished with values: [0.0005529717643789504, 0.0001389415182518631, 0.0003093545503930258] and parameters: {'n_layers': 3, 'embedding_dim': 256, 'lr': 5.695108090475677e-05, 'lambda_val': 2.1316249605839396e-05, 'batch_size': 1281, 'optimizer': 'RMSprop'}.
2026-06-20 11:04:35,351 - experiment_functions - INFO - Early stopping at epoch 500. Best Metrics: (0.0004602720384710612, 0.00011683718580270306, 0.00023636715746789313)
2026-06-20 11:04:35,433 - optuna.study.study - INFO - Trial 49 finished with values: [0.0004602720384710612, 0.00011683718580270306, 0.00023636715746789313] and parameters: {'n_layers': 3, 'embedding_dim': 96, 'lr': 0.00011201981791938952, 'lambda_val': 5.4660096132651524e-05, 'batch_size': 3367, 'optimizer': 'SGD'}.
2026-06-20 11:05:00,021 - experiment_functions - INFO - Early stopping at epoch 500. Best Metrics: (0.0006292736726259405, 0.00013262599469496025, 0.00035654223133822137)
2026-06-20 11:05:00,114 - optuna.study.study - INFO - Trial 50 finished with values: [0.0006292736726259405, 0.00013262599469496025, 0.00035654223133822137] and parameters: {'n_layers': 3, 'embedding_dim': 96, 'lr': 0.00011201981791938952, 'lambda_val': 0.05389321274241929, 'batch_size': 3367, 'optimizer': 'RMSprop'}.
2026-06-20 11:07:47,815 - optuna.study.study - INFO - Trial 51 finished with values: [0.025551082643827404, 0.0055039787798408495, 0.01437161054872631] and parameters: {'n_layers': 3, 'embedding_dim': 32, 'lr': 0.00040210644242369826, 'lambda_val': 0.0032201101504106306, 'batch_size': 2009, 'optimizer': 'Adam'}.
2026-06-20 11:08:16,686 - experiment_functions - INFO - Early stopping at epoch 650. Best Metrics: (0.005514491663327667, 0.0013341543513957308, 0.002866810587101595)
2026-06-20 11:08:16,767 - optuna.study.study - INFO - Trial 52 finished with values: [0.005514491663327667, 0.0013341543513957308, 0.002866810587101595] and parameters: {'n_layers': 1, 'embedding_dim': 96, 'lr': 0.005214780908192409, 'lambda_val': 0.09128514885217996, 'batch_size': 3472, 'optimizer': 'Adam'}.
2026-06-20 11:08:41,256 - experiment_functions - INFO - Early stopping at epoch 500. Best Metrics: (0.000509348549621499, 0.00012473159024883166, 0.00027853203987041443)
2026-06-20 11:08:41,341 - optuna.study.study - INFO - Trial 53 finished with values: [0.000509348549621499, 0.00012473159024883166, 0.00027853203987041443] and parameters: {'n_layers': 3, 'embedding_dim': 96, 'lr': 0.00011201981791938952, 'lambda_val': 5.4660096132651524e-05, 'batch_size': 3367, 'optimizer': 'SGD'}.
2026-06-20 11:09:07,196 - experiment_functions - INFO - Early stopping at epoch 550. Best Metrics: (0.008474653063833508, 0.0018946570670708603, 0.004936065094202141)
2026-06-20 11:09:07,263 - optuna.study.study - INFO - Trial 54 finished with values: [0.008474653063833508, 0.0018946570670708603, 0.004936065094202141] and parameters: {'n_layers': 3, 'embedding_dim': 64, 'lr': 0.011820223547800823, 'lambda_val': 1.4891573500580198e-05, 'batch_size': 1731, 'optimizer': 'Adam'}.
2026-06-20 11:09:33,342 - experiment_functions - INFO - Early stopping at epoch 550. Best Metrics: (0.00828927264279235, 0.0017257168119237084, 0.0046551155021915605)
2026-06-20 11:09:33,474 - optuna.study.study - INFO - Trial 55 finished with values: [0.00828927264279235, 0.0017257168119237084, 0.0046551155021915605] and parameters: {'n_layers': 2, 'embedding_dim': 96, 'lr': 0.0323373638515788, 'lambda_val': 1.882064658899445e-06, 'batch_size': 894, 'optimizer': 'RMSprop'}.
2026-06-20 11:09:57,146 - experiment_functions - INFO - Early stopping at epoch 500. Best Metrics: (0.0004666663245030003, 0.00010420613868889732, 0.00023914039610651978)
2026-06-20 11:09:57,225 - optuna.study.study - INFO - Trial 56 finished with values: [0.0004666663245030003, 0.00010420613868889732, 0.00023914039610651978] and parameters: {'n_layers': 3, 'embedding_dim': 64, 'lr': 0.00018526976069552334, 'lambda_val': 0.058092339418789656, 'batch_size': 3292, 'optimizer': 'Adam'}.
2026-06-20 11:10:51,284 - experiment_functions - INFO - Early stopping at epoch 1000. Best Metrics: (0.01912969123334432, 0.004310344827586207, 0.010696594810088032)
2026-06-20 11:10:51,363 - optuna.study.study - INFO - Trial 57 finished with values: [0.01912969123334432, 0.004310344827586207, 0.010696594810088032] and parameters: {'n_layers': 2, 'embedding_dim': 256, 'lr': 0.0009241097994190195, 'lambda_val': 0.012086938131077505, 'batch_size': 1380, 'optimizer': 'Adam'}.
2026-06-20 11:11:19,544 - experiment_functions - INFO - Early stopping at epoch 500. Best Metrics: (0.0034887595071916937, 0.0006520778072502211, 0.0019909748999955945)
2026-06-20 11:11:19,647 - optuna.study.study - INFO - Trial 58 finished with values: [0.0034887595071916937, 0.0006520778072502211, 0.0019909748999955945] and parameters: {'n_layers': 2, 'embedding_dim': 256, 'lr': 0.0323373638515788, 'lambda_val': 0.025733691733705995, 'batch_size': 2786, 'optimizer': 'RMSprop'}.
2026-06-20 11:11:50,068 - experiment_functions - INFO - Early stopping at epoch 500. Best Metrics: (0.003810734733139104, 0.0007736516357206014, 0.002126214061283214)
2026-06-20 11:11:50,169 - optuna.study.study - INFO - Trial 59 finished with values: [0.003810734733139104, 0.0007736516357206014, 0.002126214061283214] and parameters: {'n_layers': 3, 'embedding_dim': 256, 'lr': 0.06963517344838095, 'lambda_val': 0.012476747309767241, 'batch_size': 2533, 'optimizer': 'RMSprop'}.
2026-06-20 11:14:11,224 - experiment_functions - INFO - Early stopping at epoch 3200. Best Metrics: (0.0034008472118476907, 0.0008415435139573072, 0.0019289722141823276)
2026-06-20 11:14:11,305 - optuna.study.study - INFO - Trial 60 finished with values: [0.0034008472118476907, 0.0008415435139573072, 0.0019289722141823276] and parameters: {'n_layers': 4, 'embedding_dim': 64, 'lr': 0.005214780908192409, 'lambda_val': 0.09128514885217996, 'batch_size': 2384, 'optimizer': 'RMSprop'}.
2026-06-20 11:17:11,536 - optuna.study.study - INFO - Trial 61 finished with values: [0.018305746605206664, 0.004084564860426929, 0.010660674730224662] and parameters: {'n_layers': 4, 'embedding_dim': 64, 'lr': 0.0001943300564391481, 'lambda_val': 1.4082392887906815e-06, 'batch_size': 2606, 'optimizer': 'Adam'}.
2026-06-20 11:17:44,306 - experiment_functions - INFO - Early stopping at epoch 550. Best Metrics: (0.0004360349163536972, 0.00011683718580270306, 0.00024562694164507055)
2026-06-20 11:17:44,392 - optuna.study.study - INFO - Trial 62 finished with values: [0.0004360349163536972, 0.00011683718580270306, 0.00024562694164507055] and parameters: {'n_layers': 3, 'embedding_dim': 256, 'lr': 5.0144817119368783e-05, 'lambda_val': 0.006600826427834228, 'batch_size': 1252, 'optimizer': 'RMSprop'}.
2026-06-20 11:18:09,706 - experiment_functions - INFO - Early stopping at epoch 500. Best Metrics: (0.0005578307590283903, 0.00011683718580270305, 0.00033987387245566265)
2026-06-20 11:18:09,788 - optuna.study.study - INFO - Trial 63 finished with values: [0.0005578307590283903, 0.00011683718580270305, 0.00033987387245566265] and parameters: {'n_layers': 1, 'embedding_dim': 256, 'lr': 0.00013519640271470463, 'lambda_val': 9.211288064598959e-06, 'batch_size': 1320, 'optimizer': 'RMSprop'}.
2026-06-20 11:19:35,745 - experiment_functions - INFO - Early stopping at epoch 1950. Best Metrics: (0.029534144820203917, 0.006296576986232158, 0.01708172503197454)
2026-06-20 11:19:35,831 - optuna.study.study - INFO - Trial 64 finished with values: [0.029534144820203917, 0.006296576986232158, 0.01708172503197454] and parameters: {'n_layers': 1, 'embedding_dim': 128, 'lr': 0.0015403750227822883, 'lambda_val': 0.001526779508134114, 'batch_size': 1271, 'optimizer': 'Adam'}.
2026-06-20 11:19:57,850 - experiment_functions - INFO - Early stopping at epoch 500. Best Metrics: (0.0005438001918641686, 0.00011841606669192878, 0.0002785883024493607)
2026-06-20 11:19:57,918 - optuna.study.study - INFO - Trial 65 finished with values: [0.0005438001918641686, 0.00011841606669192878, 0.0002785883024493607] and parameters: {'n_layers': 1, 'embedding_dim': 64, 'lr': 0.00016290183256400495, 'lambda_val': 0.0722432446993503, 'batch_size': 3305, 'optimizer': 'Adam'}.
2026-06-20 11:20:21,375 - experiment_functions - INFO - Early stopping at epoch 500. Best Metrics: (0.0005396188119952758, 0.00010578501957812305, 0.00026103881897420443)
2026-06-20 11:20:22,607 - optuna.study.study - INFO - Trial 66 finished with values: [0.0005396188119952758, 0.00010578501957812305, 0.00026103881897420443] and parameters: {'n_layers': 2, 'embedding_dim': 96, 'lr': 0.0323373638515788, 'lambda_val': 0.0032201101504106306, 'batch_size': 2009, 'optimizer': 'SGD'}.
2026-06-20 11:20:51,947 - experiment_functions - INFO - Early stopping at epoch 650. Best Metrics: (0.0005319270680617909, 0.00010578501957812304, 0.0002599317630085306)
2026-06-20 11:20:52,068 - optuna.study.study - INFO - Trial 67 finished with values: [0.0005319270680617909, 0.00010578501957812304, 0.0002599317630085306] and parameters: {'n_layers': 1, 'embedding_dim': 128, 'lr': 2.0533926867514995e-05, 'lambda_val': 5.709570496997619e-05, 'batch_size': 2636, 'optimizer': 'Adam'}.
2026-06-20 11:21:29,718 - experiment_functions - INFO - Early stopping at epoch 800. Best Metrics: (0.014282374818088063, 0.003085133257547051, 0.007724910716263061)
2026-06-20 11:21:29,788 - optuna.study.study - INFO - Trial 68 finished with values: [0.014282374818088063, 0.003085133257547051, 0.007724910716263061] and parameters: {'n_layers': 4, 'embedding_dim': 64, 'lr': 0.0014257575686740206, 'lambda_val': 0.002980377292701446, 'batch_size': 1183, 'optimizer': 'Adam'}.
2026-06-20 11:24:18,593 - optuna.study.study - INFO - Trial 69 finished with values: [0.0008026247596222516, 0.00017051913603637742, 0.00044667035554570955] and parameters: {'n_layers': 1, 'embedding_dim': 128, 'lr': 0.00023729211693529712, 'lambda_val': 0.0014313382121311877, 'batch_size': 2012, 'optimizer': 'Adam'}.
2026-06-20 11:24:50,762 - experiment_functions - INFO - Early stopping at epoch 500. Best Metrics: (0.000503634063711125, 0.00011525830491347733, 0.00028399002561072087)
2026-06-20 11:24:50,845 - optuna.study.study - INFO - Trial 70 finished with values: [0.000503634063711125, 0.00011525830491347733, 0.00028399002561072087] and parameters: {'n_layers': 4, 'embedding_dim': 256, 'lr': 0.00018526976069552334, 'lambda_val': 0.0014313382121311877, 'batch_size': 2500, 'optimizer': 'SGD'}.
2026-06-20 11:25:28,394 - experiment_functions - INFO - Early stopping at epoch 700. Best Metrics: (0.01345846976109022, 0.0028735632183908046, 0.0071344412093062946)
2026-06-20 11:25:28,471 - optuna.study.study - INFO - Trial 71 finished with values: [0.01345846976109022, 0.0028735632183908046, 0.0071344412093062946] and parameters: {'n_layers': 4, 'embedding_dim': 128, 'lr': 0.0015403750227822883, 'lambda_val': 0.0004435147620568133, 'batch_size': 1183, 'optimizer': 'Adam'}.
2026-06-20 11:26:15,373 - experiment_functions - INFO - Early stopping at epoch 800. Best Metrics: (0.0006865397781869894, 0.00013420487558418593, 0.00034492735142483853)
2026-06-20 11:26:15,504 - optuna.study.study - INFO - Trial 72 finished with values: [0.0006865397781869894, 0.00013420487558418593, 0.00034492735142483853] and parameters: {'n_layers': 3, 'embedding_dim': 256, 'lr': 5.695108090475677e-05, 'lambda_val': 1.4891573500580198e-05, 'batch_size': 1281, 'optimizer': 'RMSprop'}.
2026-06-20 11:29:01,734 - optuna.study.study - INFO - Trial 73 finished with values: [0.020559922422757396, 0.004545598080080839, 0.011594969941163356] and parameters: {'n_layers': 3, 'embedding_dim': 32, 'lr': 0.0003197162451785445, 'lambda_val': 3.2614324792273263e-06, 'batch_size': 1380, 'optimizer': 'RMSprop'}.
2026-06-20 11:29:24,180 - experiment_functions - INFO - Early stopping at epoch 500. Best Metrics: (0.0006251858216427238, 0.0001310471138057345, 0.00031634132326796636)
2026-06-20 11:29:24,262 - optuna.study.study - INFO - Trial 74 finished with values: [0.0006251858216427238, 0.0001310471138057345, 0.00031634132326796636] and parameters: {'n_layers': 1, 'embedding_dim': 64, 'lr': 0.00017324498898808302, 'lambda_val': 0.058092339418789656, 'batch_size': 3305, 'optimizer': 'Adam'}.
2026-06-20 11:31:08,693 - experiment_functions - INFO - Early stopping at epoch 2200. Best Metrics: (0.00048732760154516006, 9.946949602122017e-05, 0.0002662955004698726)
2026-06-20 11:31:08,782 - optuna.study.study - INFO - Trial 75 finished with values: [0.00048732760154516006, 9.946949602122017e-05, 0.0002662955004698726] and parameters: {'n_layers': 3, 'embedding_dim': 128, 'lr': 1.2415190487436248e-05, 'lambda_val': 8.74606106546356e-05, 'batch_size': 2410, 'optimizer': 'Adam'}.
2026-06-20 11:32:04,701 - experiment_functions - INFO - Early stopping at epoch 1250. Best Metrics: (0.0027580990451671447, 0.0006647088543640268, 0.0016149340303994262)
