2026-06-17 00:49:45,707 - optuna.study.study - INFO - Trial 145 finished with values: [0.011854798677141315, 0.002557787040545661, 0.006479927322514279] and parameters: {'n_layers': 3, 'embedding_dim': 32, 'lr': 0.0020532474965947955, 'lambda_val': 2.1239788328621638e-05, 'batch_size': 1398, 'optimizer': 'RMSprop'}.
2026-06-17 00:50:12,763 - experiment_functions - INFO - Early stopping at epoch 550. Best Metrics: (0.01099846798045341, 0.002409372236958444, 0.006580862682679772)
2026-06-17 00:50:12,841 - optuna.study.study - INFO - Trial 146 finished with values: [0.01099846798045341, 0.002409372236958444, 0.006580862682679772] and parameters: {'n_layers': 2, 'embedding_dim': 64, 'lr': 0.00451036175366669, 'lambda_val': 3.2707990474449004e-05, 'batch_size': 2057, 'optimizer': 'RMSprop'}.
2026-06-17 00:50:53,782 - experiment_functions - INFO - Early stopping at epoch 750. Best Metrics: (0.017592107635994593, 0.0038272072754831376, 0.009889678473679891)
2026-06-17 00:50:55,133 - optuna.study.study - INFO - Trial 147 finished with values: [0.017592107635994593, 0.0038272072754831376, 0.009889678473679891] and parameters: {'n_layers': 4, 'embedding_dim': 64, 'lr': 0.001105921045395747, 'lambda_val': 2.970506579255523e-05, 'batch_size': 3052, 'optimizer': 'Adam'}.
2026-06-17 00:54:37,964 - optuna.study.study - INFO - Trial 148 finished with values: [0.011215124656030563, 0.0023477958822786405, 0.006095829504857961] and parameters: {'n_layers': 3, 'embedding_dim': 128, 'lr': 0.013825847167324911, 'lambda_val': 0.0008758319988190299, 'batch_size': 2889, 'optimizer': 'RMSprop'}.
2026-06-17 00:55:28,584 - experiment_functions - INFO - Early stopping at epoch 600. Best Metrics: (0.015042025592265558, 0.0032556523935834284, 0.008149131854878441)
2026-06-17 00:55:28,671 - optuna.study.study - INFO - Trial 149 finished with values: [0.015042025592265558, 0.0032556523935834284, 0.008149131854878441] and parameters: {'n_layers': 4, 'embedding_dim': 256, 'lr': 0.0017542874983550202, 'lambda_val': 1.4405090810627564e-05, 'batch_size': 3992, 'optimizer': 'Adam'}.
2026-06-17 00:55:55,613 - experiment_functions - INFO - Early stopping at epoch 500. Best Metrics: (0.0005158669990864221, 0.00012315270935960593, 0.00028006935221355994)
2026-06-17 00:55:55,697 - optuna.study.study - INFO - Trial 150 finished with values: [0.0005158669990864221, 0.00012315270935960593, 0.00028006935221355994] and parameters: {'n_layers': 3, 'embedding_dim': 64, 'lr': 0.00017384659942437723, 'lambda_val': 2.970506579255523e-05, 'batch_size': 720, 'optimizer': 'SGD'}.
2026-06-17 00:58:26,889 - experiment_functions - INFO - Early stopping at epoch 3300. Best Metrics: (0.0006499516878782954, 0.00015630920803334599, 0.0003442049401816652)
2026-06-17 00:58:26,975 - optuna.study.study - INFO - Trial 151 finished with values: [0.0006499516878782954, 0.00015630920803334599, 0.0003442049401816652] and parameters: {'n_layers': 1, 'embedding_dim': 128, 'lr': 0.000291102189494031, 'lambda_val': 0.0009072609457664243, 'batch_size': 652, 'optimizer': 'RMSprop'}.
2026-06-17 00:58:55,296 - experiment_functions - INFO - Early stopping at epoch 500. Best Metrics: (0.00048557018376784166, 0.00011525830491347733, 0.00027697108232486393)
2026-06-17 00:58:55,381 - optuna.study.study - INFO - Trial 152 finished with values: [0.00048557018376784166, 0.00011525830491347733, 0.00027697108232486393] and parameters: {'n_layers': 1, 'embedding_dim': 256, 'lr': 0.0017542874983550202, 'lambda_val': 1.0697648887853802e-06, 'batch_size': 2889, 'optimizer': 'SGD'}.
2026-06-17 00:59:34,891 - experiment_functions - INFO - Early stopping at epoch 700. Best Metrics: (0.02793090145785961, 0.006140267778198813, 0.016003667019200286)
2026-06-17 00:59:34,968 - optuna.study.study - INFO - Trial 153 finished with values: [0.02793090145785961, 0.006140267778198813, 0.016003667019200286] and parameters: {'n_layers': 2, 'embedding_dim': 128, 'lr': 0.0017542874983550202, 'lambda_val': 4.546254137443526e-06, 'batch_size': 3992, 'optimizer': 'Adam'}.
2026-06-17 01:03:04,452 - optuna.study.study - INFO - Trial 154 finished with values: [0.01737042620863421, 0.003978779840848806, 0.010153729089022092] and parameters: {'n_layers': 4, 'embedding_dim': 64, 'lr': 0.00017384659942437723, 'lambda_val': 4.546254137443526e-06, 'batch_size': 1627, 'optimizer': 'Adam'}.
2026-06-17 01:06:20,534 - experiment_functions - INFO - Early stopping at epoch 3250. Best Metrics: (0.013077707573543982, 0.002815144625489453, 0.006793893888497549)
2026-06-17 01:06:20,688 - optuna.study.study - INFO - Trial 155 finished with values: [0.013077707573543982, 0.002815144625489453, 0.006793893888497549] and parameters: {'n_layers': 4, 'embedding_dim': 128, 'lr': 0.0006628139134621098, 'lambda_val': 6.67969903638883e-05, 'batch_size': 582, 'optimizer': 'Adam'}.
2026-06-17 01:09:43,306 - optuna.study.study - INFO - Trial 156 finished with values: [0.015222824587485374, 0.0031214475179992423, 0.008702636374208634] and parameters: {'n_layers': 4, 'embedding_dim': 64, 'lr': 0.017717847936403682, 'lambda_val': 3.327121177308548e-05, 'batch_size': 835, 'optimizer': 'RMSprop'}.
2026-06-17 01:11:41,105 - experiment_functions - INFO - Early stopping at epoch 2550. Best Metrics: (0.010066223641172815, 0.0021172792724516868, 0.005696220895305356)
2026-06-17 01:11:41,218 - optuna.study.study - INFO - Trial 157 finished with values: [0.010066223641172815, 0.0021172792724516868, 0.005696220895305356] and parameters: {'n_layers': 3, 'embedding_dim': 32, 'lr': 0.011485594305176742, 'lambda_val': 1.0697648887853802e-06, 'batch_size': 2889, 'optimizer': 'RMSprop'}.
2026-06-17 01:12:09,521 - experiment_functions - INFO - Early stopping at epoch 550. Best Metrics: (0.008261332827858396, 0.0017272956928129342, 0.004525341867565703)
2026-06-17 01:12:09,628 - optuna.study.study - INFO - Trial 158 finished with values: [0.008261332827858396, 0.0017272956928129342, 0.004525341867565703] and parameters: {'n_layers': 2, 'embedding_dim': 64, 'lr': 0.011485594305176742, 'lambda_val': 0.002022939023188323, 'batch_size': 1664, 'optimizer': 'RMSprop'}.
2026-06-17 01:13:07,233 - experiment_functions - INFO - Early stopping at epoch 1050. Best Metrics: (0.016385471576645362, 0.003441960338512063, 0.009273883614907172)
2026-06-17 01:13:07,333 - optuna.study.study - INFO - Trial 159 finished with values: [0.016385471576645362, 0.003441960338512063, 0.009273883614907172] and parameters: {'n_layers': 4, 'embedding_dim': 64, 'lr': 0.001105921045395747, 'lambda_val': 2.970506579255523e-05, 'batch_size': 3052, 'optimizer': 'Adam'}.
2026-06-17 01:13:51,570 - experiment_functions - INFO - Early stopping at epoch 650. Best Metrics: (0.024863587420813592, 0.005563976253631426, 0.01405785803384186)
2026-06-17 01:13:51,670 - optuna.study.study - INFO - Trial 160 finished with values: [0.024863587420813592, 0.005563976253631426, 0.01405785803384186] and parameters: {'n_layers': 2, 'embedding_dim': 256, 'lr': 0.0017542874983550202, 'lambda_val': 2.970506579255523e-05, 'batch_size': 3321, 'optimizer': 'Adam'}.
2026-06-17 01:17:40,992 - optuna.study.study - INFO - Trial 161 finished with values: [0.022193582137612706, 0.004951370468611849, 0.01262885400628506] and parameters: {'n_layers': 4, 'embedding_dim': 96, 'lr': 0.00019423405222093108, 'lambda_val': 1.3976665248992833e-06, 'batch_size': 3920, 'optimizer': 'RMSprop'}.
2026-06-17 01:20:41,177 - optuna.study.study - INFO - Trial 162 finished with values: [0.018584923426976936, 0.003839838322596943, 0.01043272611009654] and parameters: {'n_layers': 2, 'embedding_dim': 32, 'lr': 0.017717847936403682, 'lambda_val': 3.327121177308548e-05, 'batch_size': 835, 'optimizer': 'RMSprop'}.
2026-06-17 01:21:47,955 - experiment_functions - INFO - Early stopping at epoch 800. Best Metrics: (0.01632863792292624, 0.0035051155740810913, 0.009167272405489977)
2026-06-17 01:21:48,513 - optuna.study.study - INFO - Trial 163 finished with values: [0.01632863792292624, 0.0035051155740810913, 0.009167272405489977] and parameters: {'n_layers': 4, 'embedding_dim': 256, 'lr': 0.0006340132793158045, 'lambda_val': 2.6858232738417883e-06, 'batch_size': 3920, 'optimizer': 'RMSprop'}.
2026-06-17 01:22:54,222 - experiment_functions - INFO - Early stopping at epoch 1100. Best Metrics: (0.020425050914720647, 0.004471390678287231, 0.011423043147980608)
2026-06-17 01:22:54,383 - optuna.study.study - INFO - Trial 164 finished with values: [0.020425050914720647, 0.004471390678287231, 0.011423043147980608] and parameters: {'n_layers': 3, 'embedding_dim': 128, 'lr': 0.0006340132793158045, 'lambda_val': 2.970506579255523e-05, 'batch_size': 3321, 'optimizer': 'RMSprop'}.
2026-06-17 01:24:32,750 - experiment_functions - INFO - Early stopping at epoch 1800. Best Metrics: (0.02850581755675696, 0.006230263988884679, 0.01621651218809845)
2026-06-17 01:24:32,848 - optuna.study.study - INFO - Trial 165 finished with values: [0.02850581755675696, 0.006230263988884679, 0.01621651218809845] and parameters: {'n_layers': 2, 'embedding_dim': 128, 'lr': 0.0006340132793158045, 'lambda_val': 2.970506579255523e-05, 'batch_size': 3321, 'optimizer': 'Adam'}.
2026-06-17 01:27:27,999 - optuna.study.study - INFO - Trial 166 finished with values: [0.025449315805473095, 0.005748705317670836, 0.01499496857628484] and parameters: {'n_layers': 1, 'embedding_dim': 32, 'lr': 0.0007178694642074494, 'lambda_val': 3.327121177308548e-05, 'batch_size': 835, 'optimizer': 'RMSprop'}.
2026-06-17 01:30:03,047 - experiment_functions - INFO - Early stopping at epoch 2700. Best Metrics: (0.008159027852295012, 0.0018172919034988003, 0.004583201921900269)
2026-06-17 01:30:03,752 - optuna.study.study - INFO - Trial 167 finished with values: [0.008159027852295012, 0.0018172919034988003, 0.004583201921900269] and parameters: {'n_layers': 3, 'embedding_dim': 128, 'lr': 0.011485594305176742, 'lambda_val': 1.0768752731630495e-05, 'batch_size': 2889, 'optimizer': 'Adam'}.
2026-06-17 01:31:20,756 - experiment_functions - INFO - Early stopping at epoch 1050. Best Metrics: (0.011343396363866427, 0.0023477958822786414, 0.0062631304059058675)
2026-06-17 01:31:20,856 - optuna.study.study - INFO - Trial 168 finished with values: [0.011343396363866427, 0.0023477958822786414, 0.0062631304059058675] and parameters: {'n_layers': 3, 'embedding_dim': 256, 'lr': 0.0011580907798527742, 'lambda_val': 2.6858232738417883e-06, 'batch_size': 3920, 'optimizer': 'RMSprop'}.
2026-06-17 01:31:49,179 - experiment_functions - INFO - Early stopping at epoch 500. Best Metrics: (0.0006643666006370091, 0.00013420487558418593, 0.0003253710661562842)
2026-06-17 01:31:49,287 - optuna.study.study - INFO - Trial 169 finished with values: [0.0006643666006370091, 0.00013420487558418593, 0.0003253710661562842] and parameters: {'n_layers': 2, 'embedding_dim': 128, 'lr': 0.0018522973992639606, 'lambda_val': 1.0174766115258743e-05, 'batch_size': 2691, 'optimizer': 'SGD'}.
2026-06-17 01:32:32,810 - experiment_functions - INFO - Early stopping at epoch 800. Best Metrics: (0.006516468920566523, 0.001594669698117974, 0.003657873784311703)
2026-06-17 01:32:32,911 - optuna.study.study - INFO - Trial 170 finished with values: [0.006516468920566523, 0.001594669698117974, 0.003657873784311703] and parameters: {'n_layers': 2, 'embedding_dim': 128, 'lr': 0.0017542874983550202, 'lambda_val': 0.09966619982655543, 'batch_size': 3992, 'optimizer': 'Adam'}.
2026-06-17 01:33:14,538 - experiment_functions - INFO - Early stopping at epoch 750. Best Metrics: (0.017248240882357324, 0.0037814197296955916, 0.009680607909117081)
2026-06-17 01:33:14,622 - optuna.study.study - INFO - Trial 171 finished with values: [0.017248240882357324, 0.0037814197296955916, 0.009680607909117081] and parameters: {'n_layers': 4, 'embedding_dim': 64, 'lr': 0.001105921045395747, 'lambda_val': 2.970506579255523e-05, 'batch_size': 3321, 'optimizer': 'Adam'}.
2026-06-17 01:33:44,894 - experiment_functions - INFO - Early stopping at epoch 550. Best Metrics: (0.008290650764868821, 0.0018520272830617659, 0.00459290821535625)
2026-06-17 01:33:45,037 - optuna.study.study - INFO - Trial 172 finished with values: [0.008290650764868821, 0.0018520272830617659, 0.00459290821535625] and parameters: {'n_layers': 2, 'embedding_dim': 128, 'lr': 0.002317737478165763, 'lambda_val': 0.0013069299404995496, 'batch_size': 2691, 'optimizer': 'RMSprop'}.
2026-06-17 01:34:19,242 - experiment_functions - INFO - Early stopping at epoch 650. Best Metrics: (0.01998891989394235, 0.004455601869394973, 0.011324936396641661)
2026-06-17 01:34:19,366 - optuna.study.study - INFO - Trial 173 finished with values: [0.01998891989394235, 0.004455601869394973, 0.011324936396641661] and parameters: {'n_layers': 3, 'embedding_dim': 64, 'lr': 0.0018522973992639606, 'lambda_val': 2.970506579255523e-05, 'batch_size': 4019, 'optimizer': 'Adam'}.
2026-06-17 01:34:57,587 - experiment_functions - INFO - Early stopping at epoch 650. Best Metrics: (0.018085659642366095, 0.003959833270178098, 0.010119165273268362)
2026-06-17 01:34:57,948 - optuna.study.study - INFO - Trial 174 finished with values: [0.018085659642366095, 0.003959833270178098, 0.010119165273268362] and parameters: {'n_layers': 3, 'embedding_dim': 128, 'lr': 0.0017542874983550202, 'lambda_val': 4.0794975052130595e-06, 'batch_size': 3321, 'optimizer': 'Adam'}.
2026-06-17 01:37:35,810 - experiment_functions - INFO - Early stopping at epoch 2800. Best Metrics: (0.005243809992420418, 0.0011873184286977391, 0.0028795078651592276)
2026-06-17 01:37:35,893 - optuna.study.study - INFO - Trial 175 finished with values: [0.005243809992420418, 0.0011873184286977391, 0.0028795078651592276] and parameters: {'n_layers': 4, 'embedding_dim': 96, 'lr': 0.017717847936403682, 'lambda_val': 0.004818726377530928, 'batch_size': 3920, 'optimizer': 'RMSprop'}.
2026-06-17 01:38:34,914 - experiment_functions - INFO - Early stopping at epoch 1000. Best Metrics: (0.021319542954707407, 0.004667171908551219, 0.012059125953587498)
2026-06-17 01:38:34,994 - optuna.study.study - INFO - Trial 176 finished with values: [0.021319542954707407, 0.004667171908551219, 0.012059125953587498] and parameters: {'n_layers': 3, 'embedding_dim': 128, 'lr': 0.0006340132793158045, 'lambda_val': 2.970506579255523e-05, 'batch_size': 3321, 'optimizer': 'RMSprop'}.
2026-06-17 01:41:59,006 - optuna.study.study - INFO - Trial 177 finished with values: [0.020041258299901818, 0.004559808008083871, 0.01165930002246889] and parameters: {'n_layers': 4, 'embedding_dim': 64, 'lr': 0.00018562220957177872, 'lambda_val': 2.970506579255523e-05, 'batch_size': 1265, 'optimizer': 'RMSprop'}.
2026-06-17 01:42:31,883 - experiment_functions - INFO - Early stopping at epoch 600. Best Metrics: (0.010703926121905119, 0.0021709612226853605, 0.005872066948437932)
2026-06-17 01:42:31,968 - optuna.study.study - INFO - Trial 178 finished with values: [0.010703926121905119, 0.0021709612226853605, 0.005872066948437932] and parameters: {'n_layers': 4, 'embedding_dim': 64, 'lr': 0.017717847936403682, 'lambda_val': 3.2707990474449004e-05, 'batch_size': 3992, 'optimizer': 'RMSprop'}.
2026-06-17 01:43:04,025 - experiment_functions - INFO - Early stopping at epoch 550. Best Metrics: (0.013223737328813474, 0.0027851458885941646, 0.006847571715971394)
2026-06-17 01:43:04,108 - optuna.study.study - INFO - Trial 179 finished with values: [0.013223737328813474, 0.0027851458885941646, 0.006847571715971394] and parameters: {'n_layers': 1, 'embedding_dim': 256, 'lr': 0.0171989208312272, 'lambda_val': 5.119347523585741e-06, 'batch_size': 3992, 'optimizer': 'Adam'}.
2026-06-17 01:43:36,577 - experiment_functions - INFO - Early stopping at epoch 500. Best Metrics: (0.00048318090237698503, 0.00011683718580270305, 0.0002723010140194339)
2026-06-17 01:43:36,660 - optuna.study.study - INFO - Trial 180 finished with values: [0.00048318090237698503, 0.00011683718580270305, 0.0002723010140194339] and parameters: {'n_layers': 2, 'embedding_dim': 256, 'lr': 0.001105921045395747, 'lambda_val': 5.119347523585741e-06, 'batch_size': 3321, 'optimizer': 'SGD'}.
2026-06-17 01:44:23,308 - experiment_functions - INFO - Early stopping at epoch 950. Best Metrics: (0.008491067502023233, 0.001771504357711254, 0.004599141060294216)
2026-06-17 01:44:23,392 - optuna.study.study - INFO - Trial 181 finished with values: [0.008491067502023233, 0.001771504357711254, 0.004599141060294216] and parameters: {'n_layers': 2, 'embedding_dim': 64, 'lr': 0.013825847167324911, 'lambda_val': 6.67969903638883e-05, 'batch_size': 2691, 'optimizer': 'Adam'}.
2026-06-17 01:45:18,301 - experiment_functions - INFO - Early stopping at epoch 950. Best Metrics: (0.0006238888664311652, 0.0001310471138057345, 0.0003059623511474413)
2026-06-17 01:45:18,401 - optuna.study.study - INFO - Trial 182 finished with values: [0.0006238888664311652, 0.0001310471138057345, 0.0003059623511474413] and parameters: {'n_layers': 3, 'embedding_dim': 128, 'lr': 3.355178244070114e-05, 'lambda_val': 2.970506579255523e-05, 'batch_size': 1627, 'optimizer': 'Adam'}.
2026-06-17 01:46:41,961 - experiment_functions - INFO - Early stopping at epoch 1750. Best Metrics: (0.022401926109042323, 0.0049908424908424905, 0.013133101032725556)
2026-06-17 01:46:42,046 - optuna.study.study - INFO - Trial 183 finished with values: [0.022401926109042323, 0.0049908424908424905, 0.013133101032725556] and parameters: {'n_layers': 4, 'embedding_dim': 32, 'lr': 0.0007178694642074494, 'lambda_val': 1.0697648887853802e-06, 'batch_size': 1534, 'optimizer': 'RMSprop'}.
2026-06-17 01:50:10,302 - optuna.study.study - INFO - Trial 184 finished with values: [0.0007659555322715766, 0.00018630794492863458, 0.00044606295128040227] and parameters: {'n_layers': 1, 'embedding_dim': 256, 'lr': 0.00017384659942437723, 'lambda_val': 8.895198181412377e-05, 'batch_size': 2889, 'optimizer': 'Adam'}.
2026-06-17 01:52:48,142 - experiment_functions - INFO - Early stopping at epoch 3600. Best Metrics: (0.03478671149723346, 0.007597574838954149, 0.020482211785960505)
2026-06-17 01:52:48,216 - optuna.study.study - INFO - Trial 185 finished with values: [0.03478671149723346, 0.007597574838954149, 0.020482211785960505] and parameters: {'n_layers': 1, 'embedding_dim': 32, 'lr': 0.0007178694642074494, 'lambda_val': 2.970506579255523e-05, 'batch_size': 2889, 'optimizer': 'RMSprop'}.
2026-06-17 01:53:24,935 - experiment_functions - INFO - Early stopping at epoch 550. Best Metrics: (0.007892795115617541, 0.0017857142857142857, 0.004754648998338175)
2026-06-17 01:53:25,026 - optuna.study.study - INFO - Trial 186 finished with values: [0.007892795115617541, 0.0017857142857142857, 0.004754648998338175] and parameters: {'n_layers': 2, 'embedding_dim': 256, 'lr': 0.04397860489821452, 'lambda_val': 1.0768752731630495e-05, 'batch_size': 2708, 'optimizer': 'RMSprop'}.
2026-06-17 01:56:32,087 - optuna.study.study - INFO - Trial 187 finished with values: [0.017595533895274778, 0.0034088038398383228, 0.009660938080683308] and parameters: {'n_layers': 2, 'embedding_dim': 64, 'lr': 0.017717847936403682, 'lambda_val': 3.327121177308548e-05, 'batch_size': 3762, 'optimizer': 'RMSprop'}.
2026-06-17 01:57:08,762 - experiment_functions - INFO - Early stopping at epoch 750. Best Metrics: (0.014359265740939223, 0.0031151319944423394, 0.007848169382551657)
2026-06-17 01:57:08,846 - optuna.study.study - INFO - Trial 188 finished with values: [0.014359265740939223, 0.0031151319944423394, 0.007848169382551657] and parameters: {'n_layers': 2, 'embedding_dim': 64, 'lr': 0.0018522973992639606, 'lambda_val': 1.9413402449837055e-05, 'batch_size': 4019, 'optimizer': 'RMSprop'}.
2026-06-17 01:57:49,842 - experiment_functions - INFO - Early stopping at epoch 550. Best Metrics: (0.017061310050328345, 0.0038887836301629407, 0.010082671854964108)
2026-06-17 01:57:49,927 - optuna.study.study - INFO - Trial 189 finished with values: [0.017061310050328345, 0.0038887836301629407, 0.010082671854964108] and parameters: {'n_layers': 3, 'embedding_dim': 256, 'lr': 0.0020532474965947955, 'lambda_val': 1.4405090810627564e-05, 'batch_size': 544, 'optimizer': 'RMSprop'}.
2026-06-17 01:59:56,407 - experiment_functions - INFO - Early stopping at epoch 2450. Best Metrics: (0.00906187743949442, 0.0019325502084122778, 0.005100729499136842)
2026-06-17 01:59:56,484 - optuna.study.study - INFO - Trial 190 finished with values: [0.00906187743949442, 0.0019325502084122778, 0.005100729499136842] and parameters: {'n_layers': 2, 'embedding_dim': 128, 'lr': 0.005349679128542954, 'lambda_val': 3.327121177308548e-05, 'batch_size': 1213, 'optimizer': 'Adam'}.
2026-06-17 02:00:42,038 - experiment_functions - INFO - Early stopping at epoch 950. Best Metrics: (0.021830211927766963, 0.0048613742579259826, 0.012088502642270134)
2026-06-17 02:00:42,148 - optuna.study.study - INFO - Trial 191 finished with values: [0.021830211927766963, 0.0048613742579259826, 0.012088502642270134] and parameters: {'n_layers': 2, 'embedding_dim': 64, 'lr': 0.0017542874983550202, 'lambda_val': 2.6858232738417883e-06, 'batch_size': 1265, 'optimizer': 'Adam'}.
2026-06-17 02:04:25,288 - experiment_functions - INFO - Early stopping at epoch 3550. Best Metrics: (0.017433558181908723, 0.003648793735000632, 0.010331837988461493)
2026-06-17 02:04:25,364 - optuna.study.study - INFO - Trial 192 finished with values: [0.017433558181908723, 0.003648793735000632, 0.010331837988461493] and parameters: {'n_layers': 2, 'embedding_dim': 256, 'lr': 0.017717847936403682, 'lambda_val': 1.3976665248992833e-06, 'batch_size': 1627, 'optimizer': 'RMSprop'}.
2026-06-17 02:05:17,552 - experiment_functions - INFO - Early stopping at epoch 850. Best Metrics: (0.0007063738251847775, 0.0001373626373626374, 0.0003395332465411614)
