2026-06-20 18:18:56,591 - optuna.study.study - INFO - Trial 15 finished with values: [0.004201023581256461, 0.0018709738537324744, 0.003257110870314019] and parameters: {'n_layers': 1, 'embedding_dim': 32, 'lr': 0.001947201008389374, 'lambda_val': 0.00091460267317109, 'batch_size': 747, 'optimizer': 'Adam'}.
2026-06-20 18:19:20,990 - experiment_functions - INFO - Early stopping at epoch 500. Best Metrics: (0.0003775542409789688, 0.00010578501957812305, 0.000198859537015109)
2026-06-20 18:19:21,082 - optuna.study.study - INFO - Trial 16 finished with values: [0.0003775542409789688, 0.00010578501957812305, 0.000198859537015109] and parameters: {'n_layers': 2, 'embedding_dim': 256, 'lr': 0.002918519995745197, 'lambda_val': 2.358463374567877e-06, 'batch_size': 1713, 'optimizer': 'SGD'}.
2026-06-20 18:19:44,666 - experiment_functions - INFO - Early stopping at epoch 500. Best Metrics: (0.00043781834508723806, 8.841732979664016e-05, 0.00021768070087328393)
2026-06-20 18:19:45,246 - optuna.study.study - INFO - Trial 17 finished with values: [0.00043781834508723806, 8.841732979664016e-05, 0.00021768070087328393] and parameters: {'n_layers': 1, 'embedding_dim': 256, 'lr': 0.0002835572877769914, 'lambda_val': 0.02779502338378831, 'batch_size': 1378, 'optimizer': 'SGD'}.
2026-06-20 18:20:17,625 - experiment_functions - INFO - Early stopping at epoch 700. Best Metrics: (0.0006002568519696529, 0.00012157382847038021, 0.0003131941306002038)
2026-06-20 18:20:17,708 - optuna.study.study - INFO - Trial 18 finished with values: [0.0006002568519696529, 0.00012157382847038021, 0.0003131941306002038] and parameters: {'n_layers': 1, 'embedding_dim': 256, 'lr': 1.586975310505985e-05, 'lambda_val': 1.2895345852190666e-05, 'batch_size': 930, 'optimizer': 'RMSprop'}.
2026-06-20 18:20:39,743 - experiment_functions - INFO - Early stopping at epoch 500. Best Metrics: (0.00044026977831932617, 0.00010736390046734875, 0.00025542152243754297)
2026-06-20 18:20:39,828 - optuna.study.study - INFO - Trial 19 finished with values: [0.00044026977831932617, 0.00010736390046734875, 0.00025542152243754297] and parameters: {'n_layers': 3, 'embedding_dim': 64, 'lr': 5.120971220745806e-05, 'lambda_val': 0.01010718381175647, 'batch_size': 3565, 'optimizer': 'SGD'}.
2026-06-20 18:21:10,813 - experiment_functions - INFO - Early stopping at epoch 700. Best Metrics: (0.003195443063791992, 0.001304155614500442, 0.002223755900453961)
2026-06-20 18:21:10,925 - optuna.study.study - INFO - Trial 20 finished with values: [0.003195443063791992, 0.001304155614500442, 0.002223755900453961] and parameters: {'n_layers': 4, 'embedding_dim': 64, 'lr': 0.0008239302540140593, 'lambda_val': 0.005462655152100235, 'batch_size': 1958, 'optimizer': 'Adam'}.
2026-06-20 18:24:22,291 - optuna.study.study - INFO - Trial 21 finished with values: [0.0030808548374127, 0.0014462548945307564, 0.002314607078174587] and parameters: {'n_layers': 3, 'embedding_dim': 256, 'lr': 8.707743617484855e-05, 'lambda_val': 0.001601066742671211, 'batch_size': 3624, 'optimizer': 'RMSprop'}.
2026-06-20 18:27:03,988 - optuna.study.study - INFO - Trial 22 finished with values: [0.0011374430728699034, 0.000535240621447518, 0.0008628576658898906] and parameters: {'n_layers': 3, 'embedding_dim': 64, 'lr': 4.693902305336072e-05, 'lambda_val': 2.4892043924672616e-06, 'batch_size': 2732, 'optimizer': 'Adam'}.
2026-06-20 18:27:28,507 - experiment_functions - INFO - Early stopping at epoch 550. Best Metrics: (0.003600516644225648, 0.0014983579638752054, 0.0025562390014328023)
2026-06-20 18:27:28,584 - optuna.study.study - INFO - Trial 23 finished with values: [0.003600516644225648, 0.0014983579638752054, 0.0025562390014328023] and parameters: {'n_layers': 3, 'embedding_dim': 64, 'lr': 0.003817870632102948, 'lambda_val': 1.0693559021612933e-06, 'batch_size': 1155, 'optimizer': 'Adam'}.
2026-06-20 18:27:58,435 - experiment_functions - INFO - Early stopping at epoch 550. Best Metrics: (0.0013920485226858517, 0.0006283945939118354, 0.0009564788304700843)
2026-06-20 18:27:58,525 - optuna.study.study - INFO - Trial 24 finished with values: [0.0013920485226858517, 0.0006283945939118354, 0.0009564788304700843] and parameters: {'n_layers': 4, 'embedding_dim': 256, 'lr': 0.004587942952147506, 'lambda_val': 0.00788851277890718, 'batch_size': 3453, 'optimizer': 'RMSprop'}.
2026-06-20 18:28:22,180 - experiment_functions - INFO - Early stopping at epoch 550. Best Metrics: (0.003390820210972358, 0.001349943160287988, 0.002247849620450465)
2026-06-20 18:28:22,274 - optuna.study.study - INFO - Trial 25 finished with values: [0.003390820210972358, 0.001349943160287988, 0.002247849620450465] and parameters: {'n_layers': 3, 'embedding_dim': 32, 'lr': 0.009861013985366013, 'lambda_val': 0.0006429249092826339, 'batch_size': 2538, 'optimizer': 'Adam'}.
2026-06-20 18:29:00,168 - experiment_functions - INFO - Early stopping at epoch 850. Best Metrics: (0.0031301678053099464, 0.0014004673487432106, 0.0021777721124565403)
2026-06-20 18:29:00,275 - optuna.study.study - INFO - Trial 26 finished with values: [0.0031301678053099464, 0.0014004673487432106, 0.0021777721124565403] and parameters: {'n_layers': 3, 'embedding_dim': 96, 'lr': 0.00041936718251851416, 'lambda_val': 0.00015675372891187499, 'batch_size': 3788, 'optimizer': 'RMSprop'}.
2026-06-20 18:29:24,825 - experiment_functions - INFO - Early stopping at epoch 550. Best Metrics: (0.0040094281063903555, 0.0018946570670708603, 0.003118387427353633)
2026-06-20 18:29:24,905 - optuna.study.study - INFO - Trial 27 finished with values: [0.0040094281063903555, 0.0018946570670708603, 0.003118387427353633] and parameters: {'n_layers': 1, 'embedding_dim': 128, 'lr': 0.008754121728685619, 'lambda_val': 4.080619734488508e-05, 'batch_size': 891, 'optimizer': 'Adam'}.
2026-06-20 18:29:57,266 - experiment_functions - INFO - Early stopping at epoch 750. Best Metrics: (0.0036279186407204705, 0.0016357206012378427, 0.002687111441822551)
2026-06-20 18:29:57,350 - optuna.study.study - INFO - Trial 28 finished with values: [0.0036279186407204705, 0.0016357206012378427, 0.002687111441822551] and parameters: {'n_layers': 2, 'embedding_dim': 64, 'lr': 0.0011836797126663788, 'lambda_val': 0.0021519517203617954, 'batch_size': 865, 'optimizer': 'Adam'}.
2026-06-20 18:31:16,020 - experiment_functions - INFO - Early stopping at epoch 2000. Best Metrics: (0.0004950913624250195, 0.00011052166224580017, 0.0002908361707023534)
2026-06-20 18:31:16,097 - optuna.study.study - INFO - Trial 29 finished with values: [0.0004950913624250195, 0.00011052166224580017, 0.0002908361707023534] and parameters: {'n_layers': 2, 'embedding_dim': 32, 'lr': 2.8684421610155413e-05, 'lambda_val': 0.00017073709840275541, 'batch_size': 789, 'optimizer': 'RMSprop'}.
2026-06-20 18:31:46,750 - experiment_functions - INFO - Early stopping at epoch 700. Best Metrics: (0.002746884479200259, 0.0011415308829101935, 0.0018742023181247134)
2026-06-20 18:31:47,574 - optuna.study.study - INFO - Trial 30 finished with values: [0.002746884479200259, 0.0011415308829101935, 0.0018742023181247134] and parameters: {'n_layers': 3, 'embedding_dim': 64, 'lr': 0.000626315927172243, 'lambda_val': 0.020906283455058534, 'batch_size': 2516, 'optimizer': 'Adam'}.
2026-06-20 18:32:09,705 - experiment_functions - INFO - Early stopping at epoch 500. Best Metrics: (0.0004767855186961593, 0.00010736390046734875, 0.00025995015020871065)
2026-06-20 18:32:09,793 - optuna.study.study - INFO - Trial 31 finished with values: [0.0004767855186961593, 0.00010736390046734875, 0.00025995015020871065] and parameters: {'n_layers': 4, 'embedding_dim': 32, 'lr': 7.881058082778024e-05, 'lambda_val': 0.013079207856750815, 'batch_size': 569, 'optimizer': 'SGD'}.
2026-06-20 18:32:44,296 - experiment_functions - INFO - Early stopping at epoch 750. Best Metrics: (0.0032032648253428183, 0.0014052039914108881, 0.002329088622021077)
2026-06-20 18:32:44,422 - optuna.study.study - INFO - Trial 32 finished with values: [0.0032032648253428183, 0.0014052039914108881, 0.002329088622021077] and parameters: {'n_layers': 3, 'embedding_dim': 128, 'lr': 0.0006133385212652219, 'lambda_val': 4.922680840294995e-05, 'batch_size': 2884, 'optimizer': 'Adam'}.
2026-06-20 18:33:06,256 - experiment_functions - INFO - Early stopping at epoch 500. Best Metrics: (0.0005797857788115603, 0.00012315270935960593, 0.0003288970686944183)
2026-06-20 18:33:06,336 - optuna.study.study - INFO - Trial 33 finished with values: [0.0005797857788115603, 0.00012315270935960593, 0.0003288970686944183] and parameters: {'n_layers': 1, 'embedding_dim': 64, 'lr': 2.1541221998925898e-05, 'lambda_val': 2.1060219145599065e-06, 'batch_size': 3723, 'optimizer': 'SGD'}.
2026-06-20 18:33:30,152 - experiment_functions - INFO - Early stopping at epoch 550. Best Metrics: (0.002671173740581587, 0.0011762662624731593, 0.001790338802215893)
2026-06-20 18:33:30,235 - optuna.study.study - INFO - Trial 34 finished with values: [0.002671173740581587, 0.0011762662624731593, 0.001790338802215893] and parameters: {'n_layers': 3, 'embedding_dim': 32, 'lr': 0.09929570364706718, 'lambda_val': 1.3134597991064091e-06, 'batch_size': 2527, 'optimizer': 'Adam'}.
2026-06-20 18:33:56,745 - experiment_functions - INFO - Early stopping at epoch 550. Best Metrics: (0.0020727491247174443, 0.0008652267272956927, 0.0015013080365904043)
2026-06-20 18:33:56,837 - optuna.study.study - INFO - Trial 35 finished with values: [0.0020727491247174443, 0.0008652267272956927, 0.0015013080365904043] and parameters: {'n_layers': 4, 'embedding_dim': 128, 'lr': 0.04325392495849709, 'lambda_val': 0.0007437404179008586, 'batch_size': 2538, 'optimizer': 'Adam'}.
2026-06-20 18:34:19,598 - experiment_functions - INFO - Early stopping at epoch 500. Best Metrics: (0.0014134829465291018, 0.0005794492863458381, 0.0011199276345016686)
2026-06-20 18:34:19,687 - optuna.study.study - INFO - Trial 36 finished with values: [0.0014134829465291018, 0.0005794492863458381, 0.0011199276345016686] and parameters: {'n_layers': 2, 'embedding_dim': 96, 'lr': 0.010346297809936884, 'lambda_val': 0.0323787314927795, 'batch_size': 1190, 'optimizer': 'RMSprop'}.
2026-06-20 18:34:45,648 - experiment_functions - INFO - Early stopping at epoch 550. Best Metrics: (0.0024300639628256557, 0.001065744600227359, 0.001755983407262483)
2026-06-20 18:34:45,735 - optuna.study.study - INFO - Trial 37 finished with values: [0.0024300639628256557, 0.001065744600227359, 0.001755983407262483] and parameters: {'n_layers': 4, 'embedding_dim': 96, 'lr': 0.021080815477123926, 'lambda_val': 6.254367883207469e-05, 'batch_size': 3789, 'optimizer': 'Adam'}.
2026-06-20 18:35:20,760 - experiment_functions - INFO - Early stopping at epoch 800. Best Metrics: (0.003978201930459315, 0.001856763925729443, 0.0030075452016607436)
2026-06-20 18:35:20,863 - optuna.study.study - INFO - Trial 38 finished with values: [0.003978201930459315, 0.001856763925729443, 0.0030075452016607436] and parameters: {'n_layers': 1, 'embedding_dim': 128, 'lr': 0.0005943725589836874, 'lambda_val': 3.1552145254862633e-06, 'batch_size': 2734, 'optimizer': 'RMSprop'}.
2026-06-20 18:35:43,393 - experiment_functions - INFO - Early stopping at epoch 500. Best Metrics: (0.0005089627079292058, 0.00011367942402425163, 0.0003098230691383225)
2026-06-20 18:35:43,523 - optuna.study.study - INFO - Trial 39 finished with values: [0.0005089627079292058, 0.00011367942402425163, 0.0003098230691383225] and parameters: {'n_layers': 3, 'embedding_dim': 64, 'lr': 7.883228101312533e-05, 'lambda_val': 0.08994958105522774, 'batch_size': 1211, 'optimizer': 'SGD'}.
2026-06-20 18:36:09,742 - experiment_functions - INFO - Early stopping at epoch 550. Best Metrics: (0.0023342383675245995, 0.001064165719338133, 0.0016598428430658764)
2026-06-20 18:36:09,826 - optuna.study.study - INFO - Trial 40 finished with values: [0.0023342383675245995, 0.001064165719338133, 0.0016598428430658764] and parameters: {'n_layers': 1, 'embedding_dim': 256, 'lr': 0.0052683494922242755, 'lambda_val': 0.0021639654253498807, 'batch_size': 3277, 'optimizer': 'RMSprop'}.
2026-06-20 18:36:32,410 - experiment_functions - INFO - Early stopping at epoch 500. Best Metrics: (0.0019714050489756836, 0.000546292787672098, 0.0012156630446718694)
2026-06-20 18:36:32,553 - optuna.study.study - INFO - Trial 41 finished with values: [0.0019714050489756836, 0.000546292787672098, 0.0012156630446718694] and parameters: {'n_layers': 1, 'embedding_dim': 128, 'lr': 0.052204712236928935, 'lambda_val': 0.001500509205926808, 'batch_size': 564, 'optimizer': 'RMSprop'}.
2026-06-20 18:36:56,869 - experiment_functions - INFO - Early stopping at epoch 500. Best Metrics: (0.00391244083496462, 0.00188360490084628, 0.002937545094301905)
2026-06-20 18:36:56,944 - optuna.study.study - INFO - Trial 42 finished with values: [0.00391244083496462, 0.00188360490084628, 0.002937545094301905] and parameters: {'n_layers': 4, 'embedding_dim': 128, 'lr': 0.08768462687583077, 'lambda_val': 3.6417495206733656e-06, 'batch_size': 809, 'optimizer': 'RMSprop'}.
2026-06-20 18:38:45,640 - experiment_functions - INFO - Early stopping at epoch 2550. Best Metrics: (0.0005080702956992666, 0.00015946696981179742, 0.0003402129871283761)
2026-06-20 18:38:45,720 - optuna.study.study - INFO - Trial 43 finished with values: [0.0005080702956992666, 0.00015946696981179742, 0.0003402129871283761] and parameters: {'n_layers': 3, 'embedding_dim': 128, 'lr': 2.823148101142806e-05, 'lambda_val': 1.910634648053198e-06, 'batch_size': 1855, 'optimizer': 'RMSprop'}.
2026-06-20 18:39:07,826 - experiment_functions - INFO - Early stopping at epoch 500. Best Metrics: (0.0006225296887407975, 0.0001373626373626374, 0.0003333075581634946)
2026-06-20 18:39:07,906 - optuna.study.study - INFO - Trial 44 finished with values: [0.0006225296887407975, 0.0001373626373626374, 0.0003333075581634946] and parameters: {'n_layers': 3, 'embedding_dim': 64, 'lr': 0.00048046584114942747, 'lambda_val': 2.7408671506073027e-06, 'batch_size': 3970, 'optimizer': 'SGD'}.
2026-06-20 18:39:30,135 - experiment_functions - INFO - Early stopping at epoch 500. Best Metrics: (0.00048724401299918437, 0.00010578501957812304, 0.0002546840615477317)
2026-06-20 18:39:30,229 - optuna.study.study - INFO - Trial 45 finished with values: [0.00048724401299918437, 0.00010578501957812304, 0.0002546840615477317] and parameters: {'n_layers': 2, 'embedding_dim': 96, 'lr': 0.0003642848912131324, 'lambda_val': 5.446696965372711e-06, 'batch_size': 1374, 'optimizer': 'SGD'}.
2026-06-20 18:42:13,240 - optuna.study.study - INFO - Trial 46 finished with values: [0.0017705854818345535, 0.0007957559681697613, 0.0013280307646908335] and parameters: {'n_layers': 4, 'embedding_dim': 64, 'lr': 5.8884409331669404e-05, 'lambda_val': 0.013145192144151734, 'batch_size': 2596, 'optimizer': 'RMSprop'}.
2026-06-20 18:42:49,430 - experiment_functions - INFO - Early stopping at epoch 850. Best Metrics: (0.0004497268608975885, 0.00011367942402425162, 0.00025917659786514803)
2026-06-20 18:42:49,527 - optuna.study.study - INFO - Trial 47 finished with values: [0.0004497268608975885, 0.00011367942402425162, 0.00025917659786514803] and parameters: {'n_layers': 1, 'embedding_dim': 128, 'lr': 1.3524494363679065e-05, 'lambda_val': 0.012228894441490553, 'batch_size': 1181, 'optimizer': 'Adam'}.
2026-06-20 18:43:14,363 - experiment_functions - INFO - Early stopping at epoch 550. Best Metrics: (0.0029642189650615804, 0.001304155614500442, 0.00212550583216139)
2026-06-20 18:43:14,453 - optuna.study.study - INFO - Trial 48 finished with values: [0.0029642189650615804, 0.001304155614500442, 0.00212550583216139] and parameters: {'n_layers': 4, 'embedding_dim': 64, 'lr': 0.0011914719293063967, 'lambda_val': 1.548420801174704e-06, 'batch_size': 3710, 'optimizer': 'RMSprop'}.
2026-06-20 18:43:45,484 - experiment_functions - INFO - Early stopping at epoch 600. Best Metrics: (0.0027753778097118027, 0.0013436276367310852, 0.00209558134566355)
2026-06-20 18:43:45,567 - optuna.study.study - INFO - Trial 49 finished with values: [0.0027753778097118027, 0.0013436276367310852, 0.00209558134566355] and parameters: {'n_layers': 3, 'embedding_dim': 256, 'lr': 0.0005985041455867306, 'lambda_val': 0.00026964451215277064, 'batch_size': 2576, 'optimizer': 'RMSprop'}.
2026-06-20 18:44:09,859 - experiment_functions - INFO - Early stopping at epoch 550. Best Metrics: (0.0029092231940517667, 0.0012773146393836048, 0.0020868654410632487)
2026-06-20 18:44:09,966 - optuna.study.study - INFO - Trial 50 finished with values: [0.0029092231940517667, 0.0012773146393836048, 0.0020868654410632487] and parameters: {'n_layers': 2, 'embedding_dim': 64, 'lr': 0.039811911004022954, 'lambda_val': 0.00010152590316654892, 'batch_size': 3156, 'optimizer': 'Adam'}.
2026-06-20 18:44:33,814 - experiment_functions - INFO - Early stopping at epoch 550. Best Metrics: (0.002456932856354133, 0.0008983832259694327, 0.0016324117721924442)
2026-06-20 18:44:33,904 - optuna.study.study - INFO - Trial 51 finished with values: [0.002456932856354133, 0.0008983832259694327, 0.0016324117721924442] and parameters: {'n_layers': 3, 'embedding_dim': 32, 'lr': 0.08010814822721256, 'lambda_val': 4.922680840294995e-05, 'batch_size': 3292, 'optimizer': 'RMSprop'}.
2026-06-20 18:45:01,619 - experiment_functions - INFO - Early stopping at epoch 650. Best Metrics: (0.0028356990745252585, 0.0011841606669192877, 0.0019881664661335887)
2026-06-20 18:45:01,706 - optuna.study.study - INFO - Trial 52 finished with values: [0.0028356990745252585, 0.0011841606669192877, 0.0019881664661335887] and parameters: {'n_layers': 3, 'embedding_dim': 32, 'lr': 0.0013679015057362796, 'lambda_val': 0.014932842734384931, 'batch_size': 2538, 'optimizer': 'Adam'}.
2026-06-20 18:46:50,607 - experiment_functions - INFO - Early stopping at epoch 2800. Best Metrics: (0.0006949669949759433, 0.00016262473159024882, 0.00036071503951576317)
2026-06-20 18:46:50,686 - optuna.study.study - INFO - Trial 53 finished with values: [0.0006949669949759433, 0.00016262473159024882, 0.00036071503951576317] and parameters: {'n_layers': 2, 'embedding_dim': 32, 'lr': 2.8684421610155413e-05, 'lambda_val': 0.001601066742671211, 'batch_size': 3624, 'optimizer': 'RMSprop'}.
2026-06-20 18:47:27,763 - experiment_functions - INFO - Early stopping at epoch 800. Best Metrics: (0.003979035726796139, 0.0013231021851711508, 0.0025052506061789327)
2026-06-20 18:47:27,858 - optuna.study.study - INFO - Trial 54 finished with values: [0.003979035726796139, 0.0013231021851711508, 0.0025052506061789327] and parameters: {'n_layers': 1, 'embedding_dim': 256, 'lr': 0.03178174845269066, 'lambda_val': 3.6417495206733656e-06, 'batch_size': 1847, 'optimizer': 'RMSprop'}.
2026-06-20 18:50:09,510 - optuna.study.study - INFO - Trial 55 finished with values: [0.002563927506893372, 0.0012457370215990906, 0.0019516308742306343] and parameters: {'n_layers': 3, 'embedding_dim': 64, 'lr': 8.707743617484855e-05, 'lambda_val': 0.005739256808144048, 'batch_size': 3624, 'optimizer': 'RMSprop'}.
2026-06-20 18:50:33,475 - experiment_functions - INFO - Early stopping at epoch 550. Best Metrics: (0.003265619485258561, 0.0014178350385246937, 0.002259411950184319)
2026-06-20 18:50:33,568 - optuna.study.study - INFO - Trial 56 finished with values: [0.003265619485258561, 0.0014178350385246937, 0.002259411950184319] and parameters: {'n_layers': 2, 'embedding_dim': 64, 'lr': 0.003817870632102948, 'lambda_val': 0.0021519517203617954, 'batch_size': 3657, 'optimizer': 'Adam'}.
2026-06-20 18:51:19,719 - experiment_functions - INFO - Early stopping at epoch 1000. Best Metrics: (0.003243964640876196, 0.001345206517620311, 0.0021850874007654274)
2026-06-20 18:51:19,828 - optuna.study.study - INFO - Trial 57 finished with values: [0.003243964640876196, 0.001345206517620311, 0.0021850874007654274] and parameters: {'n_layers': 4, 'embedding_dim': 128, 'lr': 0.0003863134997505904, 'lambda_val': 0.00026964451215277064, 'batch_size': 2576, 'optimizer': 'RMSprop'}.
2026-06-20 18:51:50,848 - experiment_functions - INFO - Early stopping at epoch 600. Best Metrics: (0.0029123591431537968, 0.0013909940634078564, 0.0022026763282470005)
2026-06-20 18:51:50,931 - optuna.study.study - INFO - Trial 58 finished with values: [0.0029123591431537968, 0.0013909940634078564, 0.0022026763282470005] and parameters: {'n_layers': 3, 'embedding_dim': 256, 'lr': 0.0005985041455867306, 'lambda_val': 0.0007437404179008586, 'batch_size': 2538, 'optimizer': 'RMSprop'}.
2026-06-20 18:54:33,858 - optuna.study.study - INFO - Trial 59 finished with values: [0.0020028254015239224, 0.001010483769104459, 0.001655986895913151] and parameters: {'n_layers': 1, 'embedding_dim': 128, 'lr': 8.707743617484855e-05, 'lambda_val': 4.080619734488508e-05, 'batch_size': 3624, 'optimizer': 'Adam'}.
2026-06-20 18:57:07,902 - optuna.study.study - INFO - Trial 60 finished with values: [0.001183249225500965, 0.0005636604774535809, 0.0009357736895401099] and parameters: {'n_layers': 1, 'embedding_dim': 32, 'lr': 0.00016414275370038185, 'lambda_val': 0.00091460267317109, 'batch_size': 747, 'optimizer': 'Adam'}.
2026-06-20 18:57:33,749 - experiment_functions - INFO - Early stopping at epoch 600. Best Metrics: (0.0035109938268461016, 0.0014967790829859798, 0.0024926331483459485)
2026-06-20 18:57:33,846 - optuna.study.study - INFO - Trial 61 finished with values: [0.0035109938268461016, 0.0014967790829859798, 0.0024926331483459485] and parameters: {'n_layers': 3, 'embedding_dim': 32, 'lr': 0.001947201008389374, 'lambda_val': 0.00091460267317109, 'batch_size': 1155, 'optimizer': 'Adam'}.
2026-06-20 18:58:21,213 - experiment_functions - INFO - Early stopping at epoch 900. Best Metrics: (0.0027798306884862247, 0.0012836301629405077, 0.0021546291263187666)
