2026-06-21 19:46:45,999 - optuna.study.study - INFO - Trial 233 finished with values: [0.0074911033431900665, 0.0018962359479600859, 0.004469899054929805] and parameters: {'n_layers': 3, 'embedding_dim': 96, 'lr': 0.0024374436987616007, 'lambda_val': 1.1896982541974421e-05, 'batch_size': 3442, 'optimizer': 'Adam'}.
2026-06-21 19:47:15,916 - experiment_functions - INFO - Early stopping at epoch 650. Best Metrics: (0.009815473023409496, 0.0024188455222937983, 0.006022707396869382)
2026-06-21 19:47:16,025 - optuna.study.study - INFO - Trial 234 finished with values: [0.009815473023409496, 0.0024188455222937983, 0.006022707396869382] and parameters: {'n_layers': 4, 'embedding_dim': 64, 'lr': 0.00168887528029852, 'lambda_val': 8.435578644144147e-05, 'batch_size': 3122, 'optimizer': 'RMSprop'}.
2026-06-21 19:48:01,921 - experiment_functions - INFO - Early stopping at epoch 1100. Best Metrics: (0.003153165320790095, 0.0007910193255020842, 0.0019090551158337356)
2026-06-21 19:48:02,030 - optuna.study.study - INFO - Trial 235 finished with values: [0.003153165320790095, 0.0007910193255020842, 0.0019090551158337356] and parameters: {'n_layers': 1, 'embedding_dim': 64, 'lr': 0.0029092853252975785, 'lambda_val': 0.010750343606965288, 'batch_size': 767, 'optimizer': 'Adam'}.
2026-06-21 19:48:48,311 - experiment_functions - INFO - Early stopping at epoch 1050. Best Metrics: (0.007249596509855327, 0.0017415056208159659, 0.00454965042502505)
2026-06-21 19:48:48,425 - optuna.study.study - INFO - Trial 236 finished with values: [0.007249596509855327, 0.0017415056208159659, 0.00454965042502505] and parameters: {'n_layers': 2, 'embedding_dim': 96, 'lr': 0.0015158687633618723, 'lambda_val': 0.000301158352327239, 'batch_size': 2925, 'optimizer': 'RMSprop'}.
2026-06-21 19:49:23,288 - experiment_functions - INFO - Early stopping at epoch 700. Best Metrics: (0.007404306753339327, 0.0018393962359479603, 0.004614297114290611)
2026-06-21 19:49:23,531 - optuna.study.study - INFO - Trial 237 finished with values: [0.007404306753339327, 0.0018393962359479603, 0.004614297114290611] and parameters: {'n_layers': 3, 'embedding_dim': 128, 'lr': 0.00264461364827089, 'lambda_val': 0.0009730028095032008, 'batch_size': 2374, 'optimizer': 'Adam'}.
2026-06-21 19:49:55,698 - experiment_functions - INFO - Early stopping at epoch 700. Best Metrics: (0.008403964415812116, 0.0020920171782240747, 0.00495062652937549)
2026-06-21 19:49:55,796 - optuna.study.study - INFO - Trial 238 finished with values: [0.008403964415812116, 0.0020920171782240747, 0.00495062652937549] and parameters: {'n_layers': 3, 'embedding_dim': 64, 'lr': 0.0036608132255288727, 'lambda_val': 0.0005803217930206673, 'batch_size': 1157, 'optimizer': 'RMSprop'}.
2026-06-21 19:50:27,425 - experiment_functions - INFO - Early stopping at epoch 700. Best Metrics: (0.009280955662077048, 0.002341480358721738, 0.005597049079346117)
2026-06-21 19:50:27,526 - optuna.study.study - INFO - Trial 239 finished with values: [0.009280955662077048, 0.002341480358721738, 0.005597049079346117] and parameters: {'n_layers': 4, 'embedding_dim': 32, 'lr': 0.00264461364827089, 'lambda_val': 7.635658041119374e-05, 'batch_size': 2770, 'optimizer': 'RMSprop'}.
2026-06-21 19:51:29,474 - experiment_functions - INFO - Early stopping at epoch 1500. Best Metrics: (0.0072336273337928, 0.0017257168119237086, 0.004319038955911494)
2026-06-21 19:51:29,578 - optuna.study.study - INFO - Trial 240 finished with values: [0.0072336273337928, 0.0017257168119237086, 0.004319038955911494] and parameters: {'n_layers': 2, 'embedding_dim': 32, 'lr': 0.0015158687633618723, 'lambda_val': 7.024518890460945e-05, 'batch_size': 2925, 'optimizer': 'RMSprop'}.
2026-06-21 19:52:00,987 - experiment_functions - INFO - Early stopping at epoch 650. Best Metrics: (0.008093603414962111, 0.002047808513325755, 0.004894268847491883)
2026-06-21 19:52:01,086 - optuna.study.study - INFO - Trial 241 finished with values: [0.008093603414962111, 0.002047808513325755, 0.004894268847491883] and parameters: {'n_layers': 4, 'embedding_dim': 96, 'lr': 0.0036608132255288727, 'lambda_val': 1.1896982541974421e-05, 'batch_size': 3122, 'optimizer': 'Adam'}.
2026-06-21 19:52:23,605 - experiment_functions - INFO - Early stopping at epoch 500. Best Metrics: (0.000482072879167601, 0.00011683718580270304, 0.00026178752001209397)
2026-06-21 19:52:23,711 - optuna.study.study - INFO - Trial 242 finished with values: [0.000482072879167601, 0.00011683718580270304, 0.00026178752001209397] and parameters: {'n_layers': 4, 'embedding_dim': 32, 'lr': 0.0015158687633618723, 'lambda_val': 0.0004098288354602192, 'batch_size': 1157, 'optimizer': 'SGD'}.
2026-06-21 19:52:54,871 - experiment_functions - INFO - Early stopping at epoch 650. Best Metrics: (0.007951812673673436, 0.002085701654667172, 0.004805308457656491)
2026-06-21 19:52:54,980 - optuna.study.study - INFO - Trial 243 finished with values: [0.007951812673673436, 0.002085701654667172, 0.004805308457656491] and parameters: {'n_layers': 4, 'embedding_dim': 96, 'lr': 0.0018573801917238443, 'lambda_val': 0.003169077271936137, 'batch_size': 1858, 'optimizer': 'RMSprop'}.
2026-06-21 19:53:23,991 - experiment_functions - INFO - Early stopping at epoch 600. Best Metrics: (0.005973199871432094, 0.0015078312492105596, 0.0035011927393978253)
2026-06-21 19:53:24,101 - optuna.study.study - INFO - Trial 244 finished with values: [0.005973199871432094, 0.0015078312492105596, 0.0035011927393978253] and parameters: {'n_layers': 4, 'embedding_dim': 96, 'lr': 0.008463855437471605, 'lambda_val': 1.655842524591166e-05, 'batch_size': 1816, 'optimizer': 'RMSprop'}.
2026-06-21 19:54:33,308 - experiment_functions - INFO - Early stopping at epoch 1700. Best Metrics: (0.006500590536725144, 0.0015883541745610713, 0.003904193719981736)
2026-06-21 19:54:33,418 - optuna.study.study - INFO - Trial 245 finished with values: [0.006500590536725144, 0.0015883541745610713, 0.003904193719981736] and parameters: {'n_layers': 2, 'embedding_dim': 32, 'lr': 0.0015158687633618723, 'lambda_val': 6.024114009426496e-06, 'batch_size': 2925, 'optimizer': 'Adam'}.
2026-06-21 19:55:08,737 - experiment_functions - INFO - Early stopping at epoch 800. Best Metrics: (0.004669039152903545, 0.001065744600227359, 0.0028760283169116554)
2026-06-21 19:55:09,043 - optuna.study.study - INFO - Trial 246 finished with values: [0.004669039152903545, 0.001065744600227359, 0.0028760283169116554] and parameters: {'n_layers': 1, 'embedding_dim': 128, 'lr': 0.00264461364827089, 'lambda_val': 0.0009730028095032008, 'batch_size': 2374, 'optimizer': 'RMSprop'}.
2026-06-21 19:56:12,612 - experiment_functions - INFO - Early stopping at epoch 1550. Best Metrics: (0.007135459012569885, 0.0017194012883668057, 0.004384529678454609)
2026-06-21 19:56:12,759 - optuna.study.study - INFO - Trial 247 finished with values: [0.007135459012569885, 0.0017194012883668057, 0.004384529678454609] and parameters: {'n_layers': 2, 'embedding_dim': 32, 'lr': 0.0015158687633618723, 'lambda_val': 6.702534509469782e-06, 'batch_size': 2925, 'optimizer': 'RMSprop'}.
2026-06-21 19:56:45,676 - experiment_functions - INFO - Early stopping at epoch 650. Best Metrics: (0.008398568358523935, 0.002106227106227106, 0.005124792207229844)
2026-06-21 19:56:45,775 - optuna.study.study - INFO - Trial 248 finished with values: [0.008398568358523935, 0.002106227106227106, 0.005124792207229844] and parameters: {'n_layers': 4, 'embedding_dim': 128, 'lr': 0.0028956207651794296, 'lambda_val': 1.1896982541974421e-05, 'batch_size': 2374, 'optimizer': 'Adam'}.
2026-06-21 19:57:28,264 - experiment_functions - INFO - Early stopping at epoch 1000. Best Metrics: (0.009189349344585323, 0.002246747505368195, 0.005628567332801575)
2026-06-21 19:57:28,379 - optuna.study.study - INFO - Trial 249 finished with values: [0.009189349344585323, 0.002246747505368195, 0.005628567332801575] and parameters: {'n_layers': 3, 'embedding_dim': 32, 'lr': 0.0015158687633618723, 'lambda_val': 7.024518890460945e-05, 'batch_size': 3469, 'optimizer': 'RMSprop'}.
2026-06-21 19:58:05,009 - experiment_functions - INFO - Early stopping at epoch 800. Best Metrics: (0.010710960726425004, 0.002625678918782367, 0.00632737957412659)
2026-06-21 19:58:05,124 - optuna.study.study - INFO - Trial 250 finished with values: [0.010710960726425004, 0.002625678918782367, 0.00632737957412659] and parameters: {'n_layers': 4, 'embedding_dim': 64, 'lr': 0.00168887528029852, 'lambda_val': 0.0039178332286970464, 'batch_size': 713, 'optimizer': 'RMSprop'}.
2026-06-21 19:58:42,710 - experiment_functions - INFO - Early stopping at epoch 850. Best Metrics: (0.006637296289817697, 0.001727295692812934, 0.00406549497191217)
2026-06-21 19:58:42,861 - optuna.study.study - INFO - Trial 251 finished with values: [0.006637296289817697, 0.001727295692812934, 0.00406549497191217] and parameters: {'n_layers': 2, 'embedding_dim': 96, 'lr': 0.0036608132255288727, 'lambda_val': 0.0005803217930206673, 'batch_size': 593, 'optimizer': 'RMSprop'}.
2026-06-21 19:59:09,603 - experiment_functions - INFO - Early stopping at epoch 600. Best Metrics: (0.009569623019752782, 0.0022735884804850324, 0.005915489768361569)
2026-06-21 19:59:09,704 - optuna.study.study - INFO - Trial 252 finished with values: [0.009569623019752782, 0.0022735884804850324, 0.005915489768361569] and parameters: {'n_layers': 4, 'embedding_dim': 32, 'lr': 0.00264461364827089, 'lambda_val': 6.131403610536352e-05, 'batch_size': 3442, 'optimizer': 'RMSprop'}.
2026-06-21 19:59:36,329 - experiment_functions - INFO - Early stopping at epoch 600. Best Metrics: (0.006903605549798745, 0.0017715043577112544, 0.004173284180588233)
2026-06-21 19:59:36,860 - optuna.study.study - INFO - Trial 253 finished with values: [0.006903605549798745, 0.0017715043577112544, 0.004173284180588233] and parameters: {'n_layers': 4, 'embedding_dim': 32, 'lr': 0.011765700859700308, 'lambda_val': 0.0004098288354602192, 'batch_size': 1157, 'optimizer': 'Adam'}.
2026-06-21 20:00:10,497 - experiment_functions - INFO - Early stopping at epoch 700. Best Metrics: (0.0089980525290974, 0.0023051660982695466, 0.005455417135552705)
2026-06-21 20:00:10,607 - optuna.study.study - INFO - Trial 254 finished with values: [0.0089980525290974, 0.0023051660982695466, 0.005455417135552705] and parameters: {'n_layers': 4, 'embedding_dim': 96, 'lr': 0.0026843825331302053, 'lambda_val': 0.0005803217930206673, 'batch_size': 1691, 'optimizer': 'Adam'}.
2026-06-21 20:00:38,404 - experiment_functions - INFO - Early stopping at epoch 550. Best Metrics: (0.004777232693105775, 0.0012346848553745106, 0.002789775992394066)
2026-06-21 20:00:38,510 - optuna.study.study - INFO - Trial 255 finished with values: [0.004777232693105775, 0.0012346848553745106, 0.002789775992394066] and parameters: {'n_layers': 4, 'embedding_dim': 128, 'lr': 0.01464056204620928, 'lambda_val': 8.435578644144147e-05, 'batch_size': 3122, 'optimizer': 'RMSprop'}.
2026-06-21 20:02:28,439 - experiment_functions - INFO - Early stopping at epoch 2600. Best Metrics: (0.0032341388554907634, 0.0008273335859542757, 0.001831675683516789)
2026-06-21 20:02:28,549 - optuna.study.study - INFO - Trial 256 finished with values: [0.0032341388554907634, 0.0008273335859542757, 0.001831675683516789] and parameters: {'n_layers': 2, 'embedding_dim': 96, 'lr': 0.05100295371052885, 'lambda_val': 0.003169077271936137, 'batch_size': 1858, 'optimizer': 'Adam'}.
2026-06-21 20:02:57,158 - experiment_functions - INFO - Early stopping at epoch 650. Best Metrics: (0.003049853940911899, 0.0008494379184034356, 0.0018169780523283182)
2026-06-21 20:02:57,261 - optuna.study.study - INFO - Trial 257 finished with values: [0.003049853940911899, 0.0008494379184034356, 0.0018169780523283182] and parameters: {'n_layers': 4, 'embedding_dim': 32, 'lr': 0.00264461364827089, 'lambda_val': 0.039318661812222745, 'batch_size': 836, 'optimizer': 'RMSprop'}.
2026-06-21 20:04:20,988 - experiment_functions - INFO - Early stopping at epoch 2050. Best Metrics: (0.002804270348477416, 0.0007357584943791842, 0.0016089653621492504)
2026-06-21 20:04:21,095 - optuna.study.study - INFO - Trial 258 finished with values: [0.002804270348477416, 0.0007357584943791842, 0.0016089653621492504] and parameters: {'n_layers': 3, 'embedding_dim': 32, 'lr': 0.020034824077947197, 'lambda_val': 0.013712652725666486, 'batch_size': 3442, 'optimizer': 'RMSprop'}.
2026-06-21 20:06:13,201 - experiment_functions - INFO - Early stopping at epoch 2750. Best Metrics: (0.012889905144330312, 0.0032209170140204625, 0.007836375463783024)
2026-06-21 20:06:13,301 - optuna.study.study - INFO - Trial 259 finished with values: [0.012889905144330312, 0.0032209170140204625, 0.007836375463783024] and parameters: {'n_layers': 3, 'embedding_dim': 32, 'lr': 0.0015158687633618723, 'lambda_val': 7.024518890460945e-05, 'batch_size': 713, 'optimizer': 'RMSprop'}.
2026-06-21 20:06:42,528 - experiment_functions - INFO - Early stopping at epoch 600. Best Metrics: (0.008561577311227014, 0.0021346469622331695, 0.005121511978257693)
2026-06-21 20:06:42,669 - optuna.study.study - INFO - Trial 260 finished with values: [0.008561577311227014, 0.0021346469622331695, 0.005121511978257693] and parameters: {'n_layers': 4, 'embedding_dim': 96, 'lr': 0.00264461364827089, 'lambda_val': 6.131403610536352e-05, 'batch_size': 2925, 'optimizer': 'RMSprop'}.
2026-06-21 20:07:20,930 - experiment_functions - INFO - Early stopping at epoch 850. Best Metrics: (0.009111883334547799, 0.0022830617658203866, 0.005513271169291914)
2026-06-21 20:07:21,032 - optuna.study.study - INFO - Trial 261 finished with values: [0.009111883334547799, 0.0022830617658203866, 0.005513271169291914] and parameters: {'n_layers': 4, 'embedding_dim': 64, 'lr': 0.00168887528029852, 'lambda_val': 8.435578644144147e-05, 'batch_size': 3122, 'optimizer': 'Adam'}.
2026-06-21 20:07:58,129 - experiment_functions - INFO - Early stopping at epoch 850. Best Metrics: (0.010285383052049563, 0.0024993684476443097, 0.006228950008615114)
2026-06-21 20:07:58,228 - optuna.study.study - INFO - Trial 262 finished with values: [0.010285383052049563, 0.0024993684476443097, 0.006228950008615114] and parameters: {'n_layers': 4, 'embedding_dim': 32, 'lr': 0.0015158687633618723, 'lambda_val': 6.131403610536352e-05, 'batch_size': 3442, 'optimizer': 'RMSprop'}.
2026-06-21 20:08:28,633 - experiment_functions - INFO - Early stopping at epoch 700. Best Metrics: (0.009322116603457454, 0.0023004294556018697, 0.005693180603209653)
2026-06-21 20:08:28,741 - optuna.study.study - INFO - Trial 263 finished with values: [0.009322116603457454, 0.0023004294556018697, 0.005693180603209653] and parameters: {'n_layers': 3, 'embedding_dim': 32, 'lr': 0.00264461364827089, 'lambda_val': 0.0014521812774996785, 'batch_size': 1787, 'optimizer': 'RMSprop'}.
2026-06-21 20:09:15,836 - experiment_functions - INFO - Early stopping at epoch 1050. Best Metrics: (0.012055470892226756, 0.0029477706201844135, 0.007343453062069605)
2026-06-21 20:09:15,967 - optuna.study.study - INFO - Trial 264 finished with values: [0.012055470892226756, 0.0029477706201844135, 0.007343453062069605] and parameters: {'n_layers': 4, 'embedding_dim': 64, 'lr': 0.0015158687633618723, 'lambda_val': 1.1896982541974421e-05, 'batch_size': 1136, 'optimizer': 'RMSprop'}.
2026-06-21 20:10:05,012 - experiment_functions - INFO - Early stopping at epoch 1100. Best Metrics: (0.010561533526964168, 0.002628836680560819, 0.006291318537569253)
2026-06-21 20:10:05,121 - optuna.study.study - INFO - Trial 265 finished with values: [0.010561533526964168, 0.002628836680560819, 0.006291318537569253] and parameters: {'n_layers': 4, 'embedding_dim': 64, 'lr': 0.00168887528029852, 'lambda_val': 7.635658041119374e-05, 'batch_size': 1157, 'optimizer': 'Adam'}.
2026-06-21 20:10:35,594 - experiment_functions - INFO - Early stopping at epoch 700. Best Metrics: (0.008092189948479728, 0.0019451812555260834, 0.0049093254340694765)
2026-06-21 20:10:35,701 - optuna.study.study - INFO - Trial 266 finished with values: [0.008092189948479728, 0.0019451812555260834, 0.0049093254340694765] and parameters: {'n_layers': 3, 'embedding_dim': 32, 'lr': 0.00264461364827089, 'lambda_val': 1.1896982541974421e-05, 'batch_size': 3442, 'optimizer': 'RMSprop'}.
2026-06-21 20:11:01,319 - experiment_functions - INFO - Early stopping at epoch 550. Best Metrics: (0.003555813049922626, 0.0008889099406340788, 0.002208758817264526)
2026-06-21 20:11:01,449 - optuna.study.study - INFO - Trial 267 finished with values: [0.003555813049922626, 0.0008889099406340788, 0.002208758817264526] and parameters: {'n_layers': 4, 'embedding_dim': 64, 'lr': 0.040421856184075136, 'lambda_val': 6.702534509469782e-06, 'batch_size': 2925, 'optimizer': 'RMSprop'}.
2026-06-21 20:11:30,622 - experiment_functions - INFO - Early stopping at epoch 600. Best Metrics: (0.007405098009340039, 0.0019104458759631173, 0.004336114885554196)
2026-06-21 20:11:30,734 - optuna.study.study - INFO - Trial 268 finished with values: [0.007405098009340039, 0.0019104458759631173, 0.004336114885554196] and parameters: {'n_layers': 4, 'embedding_dim': 96, 'lr': 0.0015158687633618723, 'lambda_val': 0.010101839011913458, 'batch_size': 3442, 'optimizer': 'RMSprop'}.
2026-06-21 20:11:58,745 - experiment_functions - INFO - Early stopping at epoch 550. Best Metrics: (0.006520532574692068, 0.0016578249336870027, 0.0039304522555560885)
2026-06-21 20:11:58,848 - optuna.study.study - INFO - Trial 269 finished with values: [0.006520532574692068, 0.0016578249336870027, 0.0039304522555560885] and parameters: {'n_layers': 4, 'embedding_dim': 128, 'lr': 0.0072168992782938955, 'lambda_val': 0.0017126496505140104, 'batch_size': 2374, 'optimizer': 'Adam'}.
2026-06-21 20:12:27,904 - experiment_functions - INFO - Early stopping at epoch 650. Best Metrics: (0.007116661681988576, 0.0018741316155109257, 0.004235141943611098)
2026-06-21 20:12:28,005 - optuna.study.study - INFO - Trial 270 finished with values: [0.007116661681988576, 0.0018741316155109257, 0.004235141943611098] and parameters: {'n_layers': 4, 'embedding_dim': 32, 'lr': 0.00264461364827089, 'lambda_val': 0.017691862948298137, 'batch_size': 3442, 'optimizer': 'Adam'}.
2026-06-21 20:13:30,667 - experiment_functions - INFO - Early stopping at epoch 1550. Best Metrics: (0.005173795563543768, 0.001199949475811545, 0.0031002451912053876)
2026-06-21 20:13:30,770 - optuna.study.study - INFO - Trial 271 finished with values: [0.005173795563543768, 0.001199949475811545, 0.0031002451912053876] and parameters: {'n_layers': 1, 'embedding_dim': 32, 'lr': 0.0015158687633618723, 'lambda_val': 6.131403610536352e-05, 'batch_size': 2925, 'optimizer': 'RMSprop'}.
2026-06-21 20:14:30,661 - experiment_functions - INFO - Early stopping at epoch 1350. Best Metrics: (0.01184638713470992, 0.002933560692181382, 0.007201217645696579)
2026-06-21 20:14:30,810 - optuna.study.study - INFO - Trial 272 finished with values: [0.01184638713470992, 0.002933560692181382, 0.007201217645696579] and parameters: {'n_layers': 4, 'embedding_dim': 64, 'lr': 0.00168887528029852, 'lambda_val': 1.42507074448704e-05, 'batch_size': 1157, 'optimizer': 'RMSprop'}.
2026-06-21 20:14:59,847 - experiment_functions - INFO - Early stopping at epoch 650. Best Metrics: (0.009021757394966952, 0.002224643172919035, 0.0055002034432194155)
2026-06-21 20:14:59,947 - optuna.study.study - INFO - Trial 273 finished with values: [0.009021757394966952, 0.002224643172919035, 0.0055002034432194155] and parameters: {'n_layers': 4, 'embedding_dim': 32, 'lr': 0.00264461364827089, 'lambda_val': 1.1896982541974421e-05, 'batch_size': 3442, 'optimizer': 'RMSprop'}.
2026-06-21 20:15:47,110 - experiment_functions - INFO - Early stopping at epoch 1100. Best Metrics: (0.00934418286397017, 0.0023730579765062526, 0.005762464058155597)
2026-06-21 20:15:47,216 - optuna.study.study - INFO - Trial 274 finished with values: [0.00934418286397017, 0.0023730579765062526, 0.005762464058155597] and parameters: {'n_layers': 4, 'embedding_dim': 32, 'lr': 0.0015158687633618723, 'lambda_val': 7.024518890460945e-05, 'batch_size': 3469, 'optimizer': 'Adam'}.
2026-06-21 20:16:36,223 - experiment_functions - INFO - Early stopping at epoch 1100. Best Metrics: (0.010339522379935106, 0.002627257799671593, 0.006284796414078343)
2026-06-21 20:16:36,342 - optuna.study.study - INFO - Trial 275 finished with values: [0.010339522379935106, 0.002627257799671593, 0.006284796414078343] and parameters: {'n_layers': 4, 'embedding_dim': 64, 'lr': 0.00168887528029852, 'lambda_val': 0.0004098288354602192, 'batch_size': 1157, 'optimizer': 'Adam'}.
2026-06-21 20:16:59,800 - experiment_functions - INFO - Early stopping at epoch 500. Best Metrics: (0.0005102919389867045, 0.00011683718580270305, 0.0002724342289834688)
2026-06-21 20:16:59,901 - optuna.study.study - INFO - Trial 276 finished with values: [0.0005102919389867045, 0.00011683718580270305, 0.0002724342289834688] and parameters: {'n_layers': 4, 'embedding_dim': 64, 'lr': 0.0015158687633618723, 'lambda_val': 7.024518890460945e-05, 'batch_size': 1157, 'optimizer': 'SGD'}.
2026-06-21 20:17:29,997 - experiment_functions - INFO - Early stopping at epoch 650. Best Metrics: (0.00944028314561243, 0.002379373500063155, 0.005630667257722717)
2026-06-21 20:17:30,102 - optuna.study.study - INFO - Trial 277 finished with values: [0.00944028314561243, 0.002379373500063155, 0.005630667257722717] and parameters: {'n_layers': 4, 'embedding_dim': 64, 'lr': 0.00264461364827089, 'lambda_val': 9.25453797899879e-06, 'batch_size': 2925, 'optimizer': 'RMSprop'}.
2026-06-21 20:18:11,151 - experiment_functions - INFO - Early stopping at epoch 1000. Best Metrics: (0.0004945016300500596, 0.00012473159024883166, 0.00030370033935195155)
