2026-06-22 18:46:53,501 - optuna.study.study - INFO - Trial 86 finished with values: [0.007274230786075961, 0.0015204622963243652, 0.003958885149862138] and parameters: {'n_layers': 4, 'embedding_dim': 32, 'lr': 0.020577409972424625, 'lambda_val': 7.4330105320237156e-06, 'batch_size': 3651, 'optimizer': 'Adam'}.
2026-06-22 18:47:25,364 - experiment_functions - INFO - Early stopping at epoch 550. Best Metrics: (0.011399146917748623, 0.0023572691676139955, 0.006470290422708304)
2026-06-22 18:47:25,460 - optuna.study.study - INFO - Trial 87 finished with values: [0.011399146917748623, 0.0023572691676139955, 0.006470290422708304] and parameters: {'n_layers': 2, 'embedding_dim': 256, 'lr': 0.019758488139791107, 'lambda_val': 1.314986245861158e-06, 'batch_size': 3636, 'optimizer': 'RMSprop'}.
2026-06-22 18:47:50,928 - experiment_functions - INFO - Early stopping at epoch 550. Best Metrics: (0.004160804469081756, 0.0008573323228495642, 0.002270549383037159)
2026-06-22 18:47:51,036 - optuna.study.study - INFO - Trial 88 finished with values: [0.004160804469081756, 0.0008573323228495642, 0.002270549383037159] and parameters: {'n_layers': 4, 'embedding_dim': 32, 'lr': 0.06800918585800063, 'lambda_val': 0.00025647511557449544, 'batch_size': 3601, 'optimizer': 'RMSprop'}.
2026-06-22 18:50:32,724 - experiment_functions - INFO - Early stopping at epoch 3800. Best Metrics: (0.023700851530178868, 0.005145572817986611, 0.01351969310616142)
2026-06-22 18:50:32,830 - optuna.study.study - INFO - Trial 89 finished with values: [0.023700851530178868, 0.005145572817986611, 0.01351969310616142] and parameters: {'n_layers': 3, 'embedding_dim': 32, 'lr': 0.0004235044324291316, 'lambda_val': 0.0008491169466682814, 'batch_size': 2562, 'optimizer': 'RMSprop'}.
2026-06-22 18:50:59,511 - experiment_functions - INFO - Early stopping at epoch 600. Best Metrics: (0.00856181105569445, 0.0018315018315018315, 0.004948317095411027)
2026-06-22 18:50:59,615 - optuna.study.study - INFO - Trial 90 finished with values: [0.00856181105569445, 0.0018315018315018315, 0.004948317095411027] and parameters: {'n_layers': 2, 'embedding_dim': 32, 'lr': 0.03277404265387728, 'lambda_val': 6.388650961927443e-06, 'batch_size': 3947, 'optimizer': 'RMSprop'}.
2026-06-22 18:52:08,699 - experiment_functions - INFO - Early stopping at epoch 1450. Best Metrics: (0.013179880787959728, 0.0028419856006062904, 0.007814206358000557)
2026-06-22 18:52:08,797 - optuna.study.study - INFO - Trial 91 finished with values: [0.013179880787959728, 0.0028419856006062904, 0.007814206358000557] and parameters: {'n_layers': 3, 'embedding_dim': 96, 'lr': 0.001706237377982523, 'lambda_val': 5.8421827248860175e-05, 'batch_size': 557, 'optimizer': 'RMSprop'}.
2026-06-22 18:54:22,369 - experiment_functions - INFO - Early stopping at epoch 2250. Best Metrics: (0.01143386139417496, 0.0024520020209675385, 0.006169208181878442)
2026-06-22 18:54:22,475 - optuna.study.study - INFO - Trial 92 finished with values: [0.01143386139417496, 0.0024520020209675385, 0.006169208181878442] and parameters: {'n_layers': 3, 'embedding_dim': 256, 'lr': 0.012994567788334225, 'lambda_val': 0.0008544209026262442, 'batch_size': 2686, 'optimizer': 'RMSprop'}.
2026-06-22 18:54:46,518 - experiment_functions - INFO - Early stopping at epoch 500. Best Metrics: (0.0005161487869253051, 0.0001294682329165088, 0.00032400664397483846)
2026-06-22 18:54:46,667 - optuna.study.study - INFO - Trial 93 finished with values: [0.0005161487869253051, 0.0001294682329165088, 0.00032400664397483846] and parameters: {'n_layers': 3, 'embedding_dim': 64, 'lr': 2.475958643965444e-05, 'lambda_val': 0.0002309043541349464, 'batch_size': 3850, 'optimizer': 'SGD'}.
2026-06-22 18:55:27,641 - experiment_functions - INFO - Early stopping at epoch 600. Best Metrics: (0.007548377449935783, 0.0016372994821270686, 0.004318759070745602)
2026-06-22 18:55:28,621 - optuna.study.study - INFO - Trial 94 finished with values: [0.007548377449935783, 0.0016372994821270686, 0.004318759070745602] and parameters: {'n_layers': 4, 'embedding_dim': 256, 'lr': 0.029989240467009036, 'lambda_val': 1.260324733159876e-06, 'batch_size': 1170, 'optimizer': 'Adam'}.
2026-06-22 18:58:59,623 - optuna.study.study - INFO - Trial 95 finished with values: [0.0010238428976007106, 0.0002747252747252748, 0.0005999086640379327] and parameters: {'n_layers': 2, 'embedding_dim': 256, 'lr': 0.0001537855186705761, 'lambda_val': 1.314986245861158e-06, 'batch_size': 1052, 'optimizer': 'RMSprop'}.
2026-06-22 18:59:38,486 - experiment_functions - INFO - Early stopping at epoch 750. Best Metrics: (0.008435264370339488, 0.0018299229506126059, 0.004756828410236776)
2026-06-22 18:59:38,631 - optuna.study.study - INFO - Trial 96 finished with values: [0.008435264370339488, 0.0018299229506126059, 0.004756828410236776] and parameters: {'n_layers': 4, 'embedding_dim': 96, 'lr': 0.009418619221822685, 'lambda_val': 0.0005262293458621268, 'batch_size': 1235, 'optimizer': 'RMSprop'}.
2026-06-22 19:00:04,210 - experiment_functions - INFO - Early stopping at epoch 550. Best Metrics: (0.0042073315780846235, 0.0009268030819754958, 0.002033793571781465)
2026-06-22 19:00:04,644 - optuna.study.study - INFO - Trial 97 finished with values: [0.0042073315780846235, 0.0009268030819754958, 0.002033793571781465] and parameters: {'n_layers': 2, 'embedding_dim': 64, 'lr': 0.008245212395764548, 'lambda_val': 0.03546156124706191, 'batch_size': 3584, 'optimizer': 'Adam'}.
2026-06-22 19:00:29,598 - experiment_functions - INFO - Early stopping at epoch 550. Best Metrics: (0.01247328081439468, 0.002755147151698876, 0.007186945795818601)
2026-06-22 19:00:29,705 - optuna.study.study - INFO - Trial 98 finished with values: [0.01247328081439468, 0.002755147151698876, 0.007186945795818601] and parameters: {'n_layers': 2, 'embedding_dim': 32, 'lr': 0.029989240467009036, 'lambda_val': 0.00036714980791779657, 'batch_size': 760, 'optimizer': 'Adam'}.
2026-06-22 19:00:56,092 - experiment_functions - INFO - Early stopping at epoch 500. Best Metrics: (0.0006141875654286929, 0.0001405203991410888, 0.0003262473367079507)
2026-06-22 19:00:56,191 - optuna.study.study - INFO - Trial 99 finished with values: [0.0006141875654286929, 0.0001405203991410888, 0.0003262473367079507] and parameters: {'n_layers': 4, 'embedding_dim': 96, 'lr': 0.010519474592377669, 'lambda_val': 1.260324733159876e-06, 'batch_size': 1170, 'optimizer': 'SGD'}.
2026-06-22 19:03:29,036 - experiment_functions - INFO - Early stopping at epoch 3400. Best Metrics: (0.01258523564035422, 0.002625678918782367, 0.006783431732889089)
2026-06-22 19:03:29,142 - optuna.study.study - INFO - Trial 100 finished with values: [0.01258523564035422, 0.002625678918782367, 0.006783431732889089] and parameters: {'n_layers': 2, 'embedding_dim': 96, 'lr': 0.019747370316731114, 'lambda_val': 0.00036714980791779657, 'batch_size': 2159, 'optimizer': 'RMSprop'}.
2026-06-22 19:06:10,384 - optuna.study.study - INFO - Trial 101 finished with values: [0.0156909224487013, 0.0036708980674497915, 0.009394264033875279] and parameters: {'n_layers': 1, 'embedding_dim': 32, 'lr': 0.0004235044324291316, 'lambda_val': 0.0008491169466682814, 'batch_size': 3280, 'optimizer': 'RMSprop'}.
2026-06-22 19:06:53,642 - experiment_functions - INFO - Early stopping at epoch 900. Best Metrics: (0.013613327085856265, 0.0028483011241631937, 0.0074526254253761024)
2026-06-22 19:06:53,743 - optuna.study.study - INFO - Trial 102 finished with values: [0.013613327085856265, 0.0028483011241631937, 0.0074526254253761024] and parameters: {'n_layers': 4, 'embedding_dim': 64, 'lr': 0.0015672638345615734, 'lambda_val': 5.5945539585145906e-05, 'batch_size': 2159, 'optimizer': 'RMSprop'}.
2026-06-22 19:08:04,264 - experiment_functions - INFO - Early stopping at epoch 1550. Best Metrics: (0.016714544993085775, 0.0035272199065302517, 0.009068513353286674)
2026-06-22 19:08:04,372 - optuna.study.study - INFO - Trial 103 finished with values: [0.016714544993085775, 0.0035272199065302517, 0.009068513353286674] and parameters: {'n_layers': 3, 'embedding_dim': 64, 'lr': 0.0013675886061108719, 'lambda_val': 1.314986245861158e-06, 'batch_size': 1052, 'optimizer': 'RMSprop'}.
2026-06-22 19:08:31,297 - experiment_functions - INFO - Early stopping at epoch 550. Best Metrics: (0.012691463457089758, 0.002781988126815713, 0.00712247107052312)
2026-06-22 19:08:31,710 - optuna.study.study - INFO - Trial 104 finished with values: [0.012691463457089758, 0.002781988126815713, 0.00712247107052312] and parameters: {'n_layers': 2, 'embedding_dim': 96, 'lr': 0.029989240467009036, 'lambda_val': 9.827421536098129e-06, 'batch_size': 558, 'optimizer': 'Adam'}.
2026-06-22 19:11:22,290 - optuna.study.study - INFO - Trial 105 finished with values: [0.01497889721001305, 0.00338038398383226, 0.008774041750700448] and parameters: {'n_layers': 4, 'embedding_dim': 32, 'lr': 0.0001854947590635186, 'lambda_val': 0.0006656875066949987, 'batch_size': 2194, 'optimizer': 'Adam'}.
2026-06-22 19:11:50,075 - experiment_functions - INFO - Early stopping at epoch 550. Best Metrics: (0.011651968543791188, 0.002527788303650373, 0.006677105344929875)
2026-06-22 19:11:50,180 - optuna.study.study - INFO - Trial 106 finished with values: [0.011651968543791188, 0.002527788303650373, 0.006677105344929875] and parameters: {'n_layers': 2, 'embedding_dim': 128, 'lr': 0.029989240467009036, 'lambda_val': 9.827421536098129e-06, 'batch_size': 558, 'optimizer': 'Adam'}.
2026-06-22 19:15:03,678 - optuna.study.study - INFO - Trial 107 finished with values: [0.010022094420379987, 0.0024220032840722495, 0.00599978495965436] and parameters: {'n_layers': 4, 'embedding_dim': 96, 'lr': 0.0001854947590635186, 'lambda_val': 0.002013482105642368, 'batch_size': 558, 'optimizer': 'Adam'}.
2026-06-22 19:15:35,698 - experiment_functions - INFO - Early stopping at epoch 550. Best Metrics: (0.01574802287021268, 0.003508273335859543, 0.009308942678578437)
2026-06-22 19:15:35,797 - optuna.study.study - INFO - Trial 108 finished with values: [0.01574802287021268, 0.003508273335859543, 0.009308942678578437] and parameters: {'n_layers': 2, 'embedding_dim': 256, 'lr': 0.0024593680412654663, 'lambda_val': 5.8421827248860175e-05, 'batch_size': 557, 'optimizer': 'RMSprop'}.
2026-06-22 19:16:11,552 - experiment_functions - INFO - Early stopping at epoch 800. Best Metrics: (0.0004510318114851803, 0.00011210054313502591, 0.000291165995354196)
2026-06-22 19:16:11,653 - optuna.study.study - INFO - Trial 109 finished with values: [0.0004510318114851803, 0.00011210054313502591, 0.000291165995354196] and parameters: {'n_layers': 2, 'embedding_dim': 64, 'lr': 0.0001854947590635186, 'lambda_val': 0.0001583029704774821, 'batch_size': 760, 'optimizer': 'Adam'}.
2026-06-22 19:19:12,028 - optuna.study.study - INFO - Trial 110 finished with values: [0.008094868763186032, 0.0018867626626247315, 0.004651256713072647] and parameters: {'n_layers': 4, 'embedding_dim': 64, 'lr': 0.0001854947590635186, 'lambda_val': 9.827421536098129e-06, 'batch_size': 558, 'optimizer': 'Adam'}.
2026-06-22 19:19:34,647 - experiment_functions - INFO - Early stopping at epoch 500. Best Metrics: (0.0006319516200934377, 0.0001373626373626374, 0.0003377404571683197)
2026-06-22 19:19:34,751 - optuna.study.study - INFO - Trial 111 finished with values: [0.0006319516200934377, 0.0001373626373626374, 0.0003377404571683197] and parameters: {'n_layers': 3, 'embedding_dim': 32, 'lr': 0.03277404265387728, 'lambda_val': 6.388650961927443e-06, 'batch_size': 3947, 'optimizer': 'SGD'}.
2026-06-22 19:20:10,932 - experiment_functions - INFO - Early stopping at epoch 750. Best Metrics: (0.004059904228503292, 0.0009062776304155615, 0.002212028961563443)
2026-06-22 19:20:11,034 - optuna.study.study - INFO - Trial 112 finished with values: [0.004059904228503292, 0.0009062776304155615, 0.002212028961563443] and parameters: {'n_layers': 4, 'embedding_dim': 64, 'lr': 0.0024593680412654663, 'lambda_val': 0.041143083727059715, 'batch_size': 2194, 'optimizer': 'Adam'}.
2026-06-22 19:23:41,671 - optuna.study.study - INFO - Trial 113 finished with values: [0.0011769316042221742, 0.00029840848806366046, 0.0006776514238800269] and parameters: {'n_layers': 2, 'embedding_dim': 256, 'lr': 0.0001537855186705761, 'lambda_val': 1.314986245861158e-06, 'batch_size': 1052, 'optimizer': 'RMSprop'}.
2026-06-22 19:24:53,718 - experiment_functions - INFO - Early stopping at epoch 1500. Best Metrics: (0.014009389214782215, 0.0029240874068460275, 0.00796063955624837)
2026-06-22 19:24:53,821 - optuna.study.study - INFO - Trial 114 finished with values: [0.014009389214782215, 0.0029240874068460275, 0.00796063955624837] and parameters: {'n_layers': 3, 'embedding_dim': 96, 'lr': 0.001706237377982523, 'lambda_val': 6.388650961927443e-06, 'batch_size': 557, 'optimizer': 'RMSprop'}.
2026-06-22 19:25:28,734 - experiment_functions - INFO - Early stopping at epoch 550. Best Metrics: (0.00931602764549012, 0.0019830743968675003, 0.005263984952714978)
2026-06-22 19:25:29,409 - optuna.study.study - INFO - Trial 115 finished with values: [0.00931602764549012, 0.0019830743968675003, 0.005263984952714978] and parameters: {'n_layers': 3, 'embedding_dim': 256, 'lr': 0.029989240467009036, 'lambda_val': 1.314986245861158e-06, 'batch_size': 1170, 'optimizer': 'RMSprop'}.
2026-06-22 19:26:04,106 - experiment_functions - INFO - Early stopping at epoch 700. Best Metrics: (0.01441530847548069, 0.003388278388278389, 0.008115945734522872)
2026-06-22 19:26:04,226 - optuna.study.study - INFO - Trial 116 finished with values: [0.01441530847548069, 0.003388278388278389, 0.008115945734522872] and parameters: {'n_layers': 2, 'embedding_dim': 128, 'lr': 0.0013546074485213668, 'lambda_val': 0.03546156124706191, 'batch_size': 3584, 'optimizer': 'Adam'}.
2026-06-22 19:27:20,292 - experiment_functions - INFO - Early stopping at epoch 1700. Best Metrics: (0.020907861323125238, 0.004911898446381205, 0.01174901585891209)
2026-06-22 19:27:20,396 - optuna.study.study - INFO - Trial 117 finished with values: [0.020907861323125238, 0.004911898446381205, 0.01174901585891209] and parameters: {'n_layers': 1, 'embedding_dim': 128, 'lr': 0.0006129132477888526, 'lambda_val': 0.03546156124706191, 'batch_size': 3584, 'optimizer': 'Adam'}.
2026-06-22 19:27:45,127 - experiment_functions - INFO - Early stopping at epoch 550. Best Metrics: (0.0067138455490915756, 0.0015030946065428827, 0.0037061783111738576)
2026-06-22 19:27:45,231 - optuna.study.study - INFO - Trial 118 finished with values: [0.0067138455490915756, 0.0015030946065428827, 0.0037061783111738576] and parameters: {'n_layers': 2, 'embedding_dim': 32, 'lr': 0.03277404265387728, 'lambda_val': 0.00036714980791779657, 'batch_size': 2159, 'optimizer': 'RMSprop'}.
2026-06-22 19:30:32,510 - optuna.study.study - INFO - Trial 119 finished with values: [0.023735498750903486, 0.005137678413540483, 0.01363756594140957] and parameters: {'n_layers': 2, 'embedding_dim': 32, 'lr': 0.0004235044324291316, 'lambda_val': 5.455116561469672e-06, 'batch_size': 1052, 'optimizer': 'RMSprop'}.
2026-06-22 19:31:01,764 - experiment_functions - INFO - Early stopping at epoch 650. Best Metrics: (0.007362377468149155, 0.0015725653656688144, 0.004148278337917007)
2026-06-22 19:31:01,916 - optuna.study.study - INFO - Trial 120 finished with values: [0.007362377468149155, 0.0015725653656688144, 0.004148278337917007] and parameters: {'n_layers': 3, 'embedding_dim': 32, 'lr': 0.012994567788334225, 'lambda_val': 0.0008491169466682814, 'batch_size': 2562, 'optimizer': 'RMSprop'}.
2026-06-22 19:32:02,574 - experiment_functions - INFO - Early stopping at epoch 1450. Best Metrics: (0.012373916183948364, 0.0025704180876594666, 0.006871068084188186)
2026-06-22 19:32:02,684 - optuna.study.study - INFO - Trial 121 finished with values: [0.012373916183948364, 0.0025704180876594666, 0.006871068084188186] and parameters: {'n_layers': 1, 'embedding_dim': 32, 'lr': 0.01131889341331997, 'lambda_val': 7.910735824587925e-05, 'batch_size': 3663, 'optimizer': 'RMSprop'}.
2026-06-22 19:32:27,244 - experiment_functions - INFO - Early stopping at epoch 550. Best Metrics: (0.009325528198164703, 0.002246747505368195, 0.005779424085490021)
2026-06-22 19:32:27,354 - optuna.study.study - INFO - Trial 122 finished with values: [0.009325528198164703, 0.002246747505368195, 0.005779424085490021] and parameters: {'n_layers': 1, 'embedding_dim': 32, 'lr': 0.07534028152081396, 'lambda_val': 0.0001583029704774821, 'batch_size': 515, 'optimizer': 'Adam'}.
2026-06-22 19:32:56,882 - experiment_functions - INFO - Early stopping at epoch 600. Best Metrics: (0.006885574404887807, 0.0014320449665277254, 0.0035907205412377178)
2026-06-22 19:32:57,028 - optuna.study.study - INFO - Trial 123 finished with values: [0.006885574404887807, 0.0014320449665277254, 0.0035907205412377178] and parameters: {'n_layers': 4, 'embedding_dim': 64, 'lr': 0.05118055681500561, 'lambda_val': 0.0001583029704774821, 'batch_size': 3422, 'optimizer': 'Adam'}.
2026-06-22 19:34:00,125 - experiment_functions - INFO - Early stopping at epoch 1400. Best Metrics: (0.0006038955030850492, 0.00014525704180876596, 0.00036370105183635)
2026-06-22 19:34:00,234 - optuna.study.study - INFO - Trial 124 finished with values: [0.0006038955030850492, 0.00014525704180876596, 0.00036370105183635] and parameters: {'n_layers': 2, 'embedding_dim': 96, 'lr': 4.4287624264553683e-05, 'lambda_val': 0.0005262293458621268, 'batch_size': 2545, 'optimizer': 'RMSprop'}.
2026-06-22 19:35:47,111 - experiment_functions - INFO - Early stopping at epoch 2450. Best Metrics: (0.0134810986580433, 0.0028419856006062904, 0.00786950900355287)
2026-06-22 19:35:48,119 - optuna.study.study - INFO - Trial 125 finished with values: [0.0134810986580433, 0.0028419856006062904, 0.00786950900355287] and parameters: {'n_layers': 2, 'embedding_dim': 64, 'lr': 0.0024593680412654663, 'lambda_val': 3.330662577836562e-06, 'batch_size': 2562, 'optimizer': 'RMSprop'}.
2026-06-22 19:36:38,136 - experiment_functions - INFO - Early stopping at epoch 1050. Best Metrics: (0.009908642719643729, 0.002240431981811292, 0.005466036639645464)
2026-06-22 19:36:38,246 - optuna.study.study - INFO - Trial 126 finished with values: [0.009908642719643729, 0.002240431981811292, 0.005466036639645464] and parameters: {'n_layers': 4, 'embedding_dim': 64, 'lr': 0.0006129132477888526, 'lambda_val': 0.045001398543542404, 'batch_size': 2857, 'optimizer': 'Adam'}.
2026-06-22 19:37:37,072 - experiment_functions - INFO - Early stopping at epoch 1350. Best Metrics: (0.00043246716272687095, 0.00010420613868889732, 0.0002442661228050091)
2026-06-22 19:37:37,173 - optuna.study.study - INFO - Trial 127 finished with values: [0.00043246716272687095, 0.00010420613868889732, 0.0002442661228050091] and parameters: {'n_layers': 4, 'embedding_dim': 32, 'lr': 1.4256367930644243e-05, 'lambda_val': 0.0008544209026262442, 'batch_size': 680, 'optimizer': 'Adam'}.
2026-06-22 19:41:08,001 - experiment_functions - INFO - Early stopping at epoch 3900. Best Metrics: (0.01385084870193063, 0.003123026398888468, 0.007892558861142141)
2026-06-22 19:41:08,155 - optuna.study.study - INFO - Trial 128 finished with values: [0.01385084870193063, 0.003123026398888468, 0.007892558861142141] and parameters: {'n_layers': 2, 'embedding_dim': 256, 'lr': 0.025936469453006126, 'lambda_val': 0.0008491169466682814, 'batch_size': 1052, 'optimizer': 'RMSprop'}.
2026-06-22 19:41:34,527 - experiment_functions - INFO - Early stopping at epoch 550. Best Metrics: (0.01033979649202153, 0.002178855627131489, 0.005948238735836566)
2026-06-22 19:41:34,626 - optuna.study.study - INFO - Trial 129 finished with values: [0.01033979649202153, 0.002178855627131489, 0.005948238735836566] and parameters: {'n_layers': 2, 'embedding_dim': 96, 'lr': 0.025936469453006126, 'lambda_val': 0.0008491169466682814, 'batch_size': 827, 'optimizer': 'Adam'}.
2026-06-22 19:43:16,665 - experiment_functions - INFO - Early stopping at epoch 2300. Best Metrics: (0.027923448761882904, 0.006021851711506885, 0.01568956695274237)
2026-06-22 19:43:16,768 - optuna.study.study - INFO - Trial 130 finished with values: [0.027923448761882904, 0.006021851711506885, 0.01568956695274237] and parameters: {'n_layers': 2, 'embedding_dim': 64, 'lr': 0.00045681378220125877, 'lambda_val': 0.0008491169466682814, 'batch_size': 3133, 'optimizer': 'RMSprop'}.
2026-06-22 19:43:42,015 - experiment_functions - INFO - Early stopping at epoch 550. Best Metrics: (0.009330041007737854, 0.002188328912466843, 0.005637372128504838)
2026-06-22 19:43:42,120 - optuna.study.study - INFO - Trial 131 finished with values: [0.009330041007737854, 0.002188328912466843, 0.005637372128504838] and parameters: {'n_layers': 3, 'embedding_dim': 32, 'lr': 0.012994567788334225, 'lambda_val': 0.0008544209026262442, 'batch_size': 680, 'optimizer': 'Adam'}.
2026-06-22 19:44:36,989 - experiment_functions - INFO - Early stopping at epoch 1250. Best Metrics: (0.02185629309743991, 0.005083996463306808, 0.012161748469173497)
2026-06-22 19:44:37,097 - optuna.study.study - INFO - Trial 132 finished with values: [0.02185629309743991, 0.005083996463306808, 0.012161748469173497] and parameters: {'n_layers': 1, 'embedding_dim': 96, 'lr': 0.0008573376761049362, 'lambda_val': 0.03546156124706191, 'batch_size': 3584, 'optimizer': 'Adam'}.
2026-06-22 19:47:22,934 - optuna.study.study - INFO - Trial 133 finished with values: [0.005303182332953706, 0.0013009978527219908, 0.0028335039015418098] and parameters: {'n_layers': 3, 'embedding_dim': 32, 'lr': 0.0006129132477888526, 'lambda_val': 0.09925702211545788, 'batch_size': 1029, 'optimizer': 'RMSprop'}.
2026-06-22 19:48:48,372 - experiment_functions - INFO - Early stopping at epoch 2000. Best Metrics: (0.004467395275176202, 0.0009599595806492359, 0.0024911779645813274)
