2026-06-20 18:58:21,301 - optuna.study.study - INFO - Trial 62 finished with values: [0.0027798306884862247, 0.0012836301629405077, 0.0021546291263187666] and parameters: {'n_layers': 4, 'embedding_dim': 256, 'lr': 0.0003219848466357513, 'lambda_val': 1.0664285396643345e-05, 'batch_size': 3453, 'optimizer': 'Adam'}.
2026-06-20 18:58:43,168 - experiment_functions - INFO - Early stopping at epoch 500. Best Metrics: (0.002018152618241056, 0.0006694454970317041, 0.001307190788232562)
2026-06-20 18:58:43,299 - optuna.study.study - INFO - Trial 63 finished with values: [0.002018152618241056, 0.0006694454970317041, 0.001307190788232562] and parameters: {'n_layers': 2, 'embedding_dim': 32, 'lr': 0.08010814822721256, 'lambda_val': 0.0021519517203617954, 'batch_size': 3292, 'optimizer': 'RMSprop'}.
2026-06-20 18:59:13,575 - experiment_functions - INFO - Early stopping at epoch 700. Best Metrics: (0.003562092603140615, 0.0012915245673866362, 0.0023947238034133993)
2026-06-20 18:59:13,704 - optuna.study.study - INFO - Trial 64 finished with values: [0.003562092603140615, 0.0012915245673866362, 0.0023947238034133993] and parameters: {'n_layers': 1, 'embedding_dim': 96, 'lr': 0.03178174845269066, 'lambda_val': 1.6056960373751058e-05, 'batch_size': 3214, 'optimizer': 'RMSprop'}.
2026-06-20 19:01:52,491 - optuna.study.study - INFO - Trial 65 finished with values: [0.0031180110983076896, 0.0013830996589617281, 0.0022305047111225414] and parameters: {'n_layers': 3, 'embedding_dim': 32, 'lr': 0.00017647026102474964, 'lambda_val': 6.254367883207469e-05, 'batch_size': 2494, 'optimizer': 'Adam'}.
2026-06-20 19:02:16,973 - experiment_functions - INFO - Early stopping at epoch 550. Best Metrics: (0.0013450606832939903, 0.0005731337627889353, 0.0009655754620729763)
2026-06-20 19:02:17,059 - optuna.study.study - INFO - Trial 66 finished with values: [0.0013450606832939903, 0.0005731337627889353, 0.0009655754620729763] and parameters: {'n_layers': 3, 'embedding_dim': 64, 'lr': 0.009861013985366013, 'lambda_val': 0.011193732601879862, 'batch_size': 3710, 'optimizer': 'RMSprop'}.
2026-06-20 19:02:53,706 - experiment_functions - INFO - Early stopping at epoch 800. Best Metrics: (0.0029858902374301677, 0.0014320449665277254, 0.0023430056857529497)
2026-06-20 19:02:53,994 - optuna.study.study - INFO - Trial 67 finished with values: [0.0029858902374301677, 0.0014320449665277254, 0.0023430056857529497] and parameters: {'n_layers': 3, 'embedding_dim': 128, 'lr': 0.0006133385212652219, 'lambda_val': 4.922680840294995e-05, 'batch_size': 1855, 'optimizer': 'Adam'}.
2026-06-20 19:03:48,021 - experiment_functions - INFO - Early stopping at epoch 1200. Best Metrics: (0.002600876762933397, 0.0015030946065428823, 0.002186880379464231)
2026-06-20 19:03:48,107 - optuna.study.study - INFO - Trial 68 finished with values: [0.002600876762933397, 0.0015030946065428823, 0.002186880379464231] and parameters: {'n_layers': 1, 'embedding_dim': 256, 'lr': 0.0002835572877769914, 'lambda_val': 0.02779502338378831, 'batch_size': 1378, 'optimizer': 'RMSprop'}.
2026-06-20 19:04:11,830 - experiment_functions - INFO - Early stopping at epoch 550. Best Metrics: (0.003359649294891617, 0.0013688897309586962, 0.0022355102679656367)
2026-06-20 19:04:11,922 - optuna.study.study - INFO - Trial 69 finished with values: [0.003359649294891617, 0.0013688897309586962, 0.0022355102679656367] and parameters: {'n_layers': 1, 'embedding_dim': 32, 'lr': 0.09929570364706718, 'lambda_val': 1.3134597991064091e-06, 'batch_size': 1026, 'optimizer': 'Adam'}.
2026-06-20 19:04:46,839 - experiment_functions - INFO - Early stopping at epoch 800. Best Metrics: (0.001196733719678733, 0.00046576986232158647, 0.0007688398836669683)
2026-06-20 19:04:47,026 - optuna.study.study - INFO - Trial 70 finished with values: [0.001196733719678733, 0.00046576986232158647, 0.0007688398836669683] and parameters: {'n_layers': 4, 'embedding_dim': 64, 'lr': 0.06205243411800694, 'lambda_val': 0.007605703371748731, 'batch_size': 3589, 'optimizer': 'Adam'}.
2026-06-20 19:07:26,944 - optuna.study.study - INFO - Trial 71 finished with values: [0.0031739037883862322, 0.001455728179866111, 0.002371675077146741] and parameters: {'n_layers': 2, 'embedding_dim': 64, 'lr': 0.00012997201046442607, 'lambda_val': 1.3134597991064091e-06, 'batch_size': 2527, 'optimizer': 'Adam'}.
2026-06-20 19:07:53,297 - experiment_functions - INFO - Early stopping at epoch 500. Best Metrics: (0.0030860426498239193, 0.001400467348743211, 0.002368611852429193)
2026-06-20 19:07:53,391 - optuna.study.study - INFO - Trial 72 finished with values: [0.0030860426498239193, 0.001400467348743211, 0.002368611852429193] and parameters: {'n_layers': 3, 'embedding_dim': 256, 'lr': 0.08010814822721256, 'lambda_val': 0.0056344344452909775, 'batch_size': 3292, 'optimizer': 'RMSprop'}.
2026-06-20 19:08:23,060 - experiment_functions - INFO - Early stopping at epoch 700. Best Metrics: (0.003367477707317384, 0.0013846785398509537, 0.0023518807858718314)
2026-06-20 19:08:23,139 - optuna.study.study - INFO - Trial 73 finished with values: [0.003367477707317384, 0.0013846785398509537, 0.0023518807858718314] and parameters: {'n_layers': 3, 'embedding_dim': 32, 'lr': 0.0016629357618135425, 'lambda_val': 0.001601066742671211, 'batch_size': 747, 'optimizer': 'Adam'}.
2026-06-20 19:08:49,303 - experiment_functions - INFO - Early stopping at epoch 500. Best Metrics: (0.0032387259285770187, 0.0015141467727674625, 0.002573806038037708)
2026-06-20 19:08:49,886 - optuna.study.study - INFO - Trial 74 finished with values: [0.0032387259285770187, 0.0015141467727674625, 0.002573806038037708] and parameters: {'n_layers': 3, 'embedding_dim': 256, 'lr': 0.09929570364706718, 'lambda_val': 1.3134597991064091e-06, 'batch_size': 3277, 'optimizer': 'RMSprop'}.
2026-06-20 19:09:38,691 - experiment_functions - INFO - Early stopping at epoch 1150. Best Metrics: (0.003977208965180585, 0.0014415182518630796, 0.0025920246984396777)
2026-06-20 19:09:38,766 - optuna.study.study - INFO - Trial 75 finished with values: [0.003977208965180585, 0.0014415182518630796, 0.0025920246984396777] and parameters: {'n_layers': 1, 'embedding_dim': 128, 'lr': 0.021080815477123926, 'lambda_val': 3.1552145254862633e-06, 'batch_size': 2734, 'optimizer': 'RMSprop'}.
2026-06-20 19:10:28,552 - experiment_functions - INFO - Early stopping at epoch 950. Best Metrics: (0.0028495088017865414, 0.001304155614500442, 0.0021207737877429224)
2026-06-20 19:10:28,654 - optuna.study.study - INFO - Trial 76 finished with values: [0.0028495088017865414, 0.001304155614500442, 0.0021207737877429224] and parameters: {'n_layers': 4, 'embedding_dim': 256, 'lr': 0.00024125200546504656, 'lambda_val': 0.0031147525509907805, 'batch_size': 4096, 'optimizer': 'Adam'}.
2026-06-20 19:11:11,374 - experiment_functions - INFO - Early stopping at epoch 1050. Best Metrics: (0.000696195572600487, 0.00013262599469496023, 0.0004276945441255999)
2026-06-20 19:11:11,465 - optuna.study.study - INFO - Trial 77 finished with values: [0.000696195572600487, 0.00013262599469496023, 0.0004276945441255999] and parameters: {'n_layers': 1, 'embedding_dim': 64, 'lr': 4.693902305336072e-05, 'lambda_val': 1.3214844966283054e-06, 'batch_size': 891, 'optimizer': 'Adam'}.
2026-06-20 19:11:41,215 - experiment_functions - INFO - Early stopping at epoch 550. Best Metrics: (0.0014304325481904506, 0.0006189213085764809, 0.0009618084113035033)
2026-06-20 19:11:41,285 - optuna.study.study - INFO - Trial 78 finished with values: [0.0014304325481904506, 0.0006189213085764809, 0.0009618084113035033] and parameters: {'n_layers': 4, 'embedding_dim': 256, 'lr': 0.004587942952147506, 'lambda_val': 0.00788851277890718, 'batch_size': 3453, 'optimizer': 'RMSprop'}.
2026-06-20 19:12:05,652 - experiment_functions - INFO - Early stopping at epoch 550. Best Metrics: (0.003357593250753278, 0.0013057344953896679, 0.0023371685311827203)
2026-06-20 19:12:05,737 - optuna.study.study - INFO - Trial 79 finished with values: [0.003357593250753278, 0.0013057344953896679, 0.0023371685311827203] and parameters: {'n_layers': 4, 'embedding_dim': 64, 'lr': 0.001947201008389374, 'lambda_val': 1.548420801174704e-06, 'batch_size': 2043, 'optimizer': 'RMSprop'}.
2026-06-20 19:12:44,588 - experiment_functions - INFO - Early stopping at epoch 850. Best Metrics: (0.0004985786176608429, 0.00010104837691044589, 0.0002596648756991465)
2026-06-20 19:12:44,672 - optuna.study.study - INFO - Trial 80 finished with values: [0.0004985786176608429, 0.00010104837691044589, 0.0002596648756991465] and parameters: {'n_layers': 1, 'embedding_dim': 256, 'lr': 1.586975310505985e-05, 'lambda_val': 0.00026964451215277064, 'batch_size': 930, 'optimizer': 'RMSprop'}.
2026-06-20 19:13:09,367 - experiment_functions - INFO - Early stopping at epoch 500. Best Metrics: (0.002079765170247161, 0.0010310092206643933, 0.001619842956151174)
2026-06-20 19:13:09,456 - optuna.study.study - INFO - Trial 81 finished with values: [0.002079765170247161, 0.0010310092206643933, 0.001619842956151174] and parameters: {'n_layers': 4, 'embedding_dim': 128, 'lr': 0.08768462687583077, 'lambda_val': 0.003119390996274206, 'batch_size': 3842, 'optimizer': 'Adam'}.
2026-06-20 19:13:35,239 - experiment_functions - INFO - Early stopping at epoch 500. Best Metrics: (0.0005216746982472473, 0.00011367942402425162, 0.00028520217300683767)
2026-06-20 19:13:35,328 - optuna.study.study - INFO - Trial 82 finished with values: [0.0005216746982472473, 0.00011367942402425162, 0.00028520217300683767] and parameters: {'n_layers': 3, 'embedding_dim': 256, 'lr': 6.245649358154166e-05, 'lambda_val': 6.733205641736132e-06, 'batch_size': 745, 'optimizer': 'SGD'}.
2026-06-20 19:14:04,393 - experiment_functions - INFO - Early stopping at epoch 600. Best Metrics: (0.0030245218289590343, 0.0014146772767462423, 0.0022560919496029588)
2026-06-20 19:14:04,468 - optuna.study.study - INFO - Trial 83 finished with values: [0.0030245218289590343, 0.0014146772767462423, 0.0022560919496029588] and parameters: {'n_layers': 4, 'embedding_dim': 128, 'lr': 0.0013679015057362796, 'lambda_val': 0.00032074890954477043, 'batch_size': 1115, 'optimizer': 'Adam'}.
2026-06-20 19:16:42,138 - optuna.study.study - INFO - Trial 84 finished with values: [0.003205401029180662, 0.0013373121131741823, 0.0022105309180441867] and parameters: {'n_layers': 3, 'embedding_dim': 32, 'lr': 0.00012250045847176557, 'lambda_val': 4.922680840294995e-05, 'batch_size': 2884, 'optimizer': 'Adam'}.
2026-06-20 19:17:10,839 - experiment_functions - INFO - Early stopping at epoch 550. Best Metrics: (0.002222556997176057, 0.0009694328659845901, 0.0016178396423134683)
2026-06-20 19:17:10,933 - optuna.study.study - INFO - Trial 85 finished with values: [0.002222556997176057, 0.0009694328659845901, 0.0016178396423134683] and parameters: {'n_layers': 3, 'embedding_dim': 256, 'lr': 0.006000091750093614, 'lambda_val': 0.00026964451215277064, 'batch_size': 2576, 'optimizer': 'RMSprop'}.
2026-06-20 19:17:37,344 - experiment_functions - INFO - Early stopping at epoch 550. Best Metrics: (0.00047057169077027017, 0.00011052166224580018, 0.00024301273323923688)
2026-06-20 19:17:37,435 - optuna.study.study - INFO - Trial 86 finished with values: [0.00047057169077027017, 0.00011052166224580018, 0.00024301273323923688] and parameters: {'n_layers': 4, 'embedding_dim': 128, 'lr': 1.141038666719674e-05, 'lambda_val': 0.01777576225075643, 'batch_size': 3805, 'optimizer': 'Adam'}.
2026-06-20 19:18:00,999 - experiment_functions - INFO - Early stopping at epoch 500. Best Metrics: (0.0005747416446214513, 0.00013262599469496023, 0.00030030871173122696)
2026-06-20 19:18:01,087 - optuna.study.study - INFO - Trial 87 finished with values: [0.0005747416446214513, 0.00013262599469496023, 0.00030030871173122696] and parameters: {'n_layers': 3, 'embedding_dim': 128, 'lr': 1.141038666719674e-05, 'lambda_val': 0.01777576225075643, 'batch_size': 4096, 'optimizer': 'Adam'}.
2026-06-20 19:18:29,777 - experiment_functions - INFO - Early stopping at epoch 550. Best Metrics: (0.0030014393288395895, 0.0012741568776051535, 0.002092297550690931)
2026-06-20 19:18:29,863 - optuna.study.study - INFO - Trial 88 finished with values: [0.0030014393288395895, 0.0012741568776051535, 0.002092297550690931] and parameters: {'n_layers': 3, 'embedding_dim': 256, 'lr': 0.01071305087229953, 'lambda_val': 4.080619734488508e-05, 'batch_size': 891, 'optimizer': 'Adam'}.
2026-06-20 19:19:01,677 - experiment_functions - INFO - Early stopping at epoch 700. Best Metrics: (0.0014607200605912549, 0.0007089175192623469, 0.001112583432477451)
2026-06-20 19:19:01,760 - optuna.study.study - INFO - Trial 89 finished with values: [0.0014607200605912549, 0.0007089175192623469, 0.001112583432477451] and parameters: {'n_layers': 4, 'embedding_dim': 96, 'lr': 0.0007292538148544164, 'lambda_val': 0.061978857049708715, 'batch_size': 1670, 'optimizer': 'Adam'}.
2026-06-20 19:20:08,247 - experiment_functions - INFO - Early stopping at epoch 1600. Best Metrics: (0.0035701550425038457, 0.0014667803460906908, 0.0024964809366237787)
2026-06-20 19:20:08,322 - optuna.study.study - INFO - Trial 90 finished with values: [0.0035701550425038457, 0.0014667803460906908, 0.0024964809366237787] and parameters: {'n_layers': 1, 'embedding_dim': 128, 'lr': 0.013213533856898626, 'lambda_val': 2.258251453803819e-05, 'batch_size': 1670, 'optimizer': 'RMSprop'}.
2026-06-20 19:20:31,720 - experiment_functions - INFO - Early stopping at epoch 500. Best Metrics: (0.0006074637814419916, 0.0001294682329165088, 0.0003401782651506333)
2026-06-20 19:20:32,812 - optuna.study.study - INFO - Trial 91 finished with values: [0.0006074637814419916, 0.0001294682329165088, 0.0003401782651506333] and parameters: {'n_layers': 1, 'embedding_dim': 256, 'lr': 0.0013679015057362796, 'lambda_val': 0.014932842734384931, 'batch_size': 3723, 'optimizer': 'SGD'}.
2026-06-20 19:21:07,317 - experiment_functions - INFO - Early stopping at epoch 750. Best Metrics: (0.0029768852647784456, 0.001438360490084628, 0.0022892213551279385)
2026-06-20 19:21:07,430 - optuna.study.study - INFO - Trial 92 finished with values: [0.0029768852647784456, 0.001438360490084628, 0.0022892213551279385] and parameters: {'n_layers': 3, 'embedding_dim': 128, 'lr': 0.0006133385212652219, 'lambda_val': 4.922680840294995e-05, 'batch_size': 1450, 'optimizer': 'Adam'}.
2026-06-20 19:21:30,668 - experiment_functions - INFO - Early stopping at epoch 500. Best Metrics: (0.0004951247932709277, 0.00011052166224580017, 0.0002487605289613507)
2026-06-20 19:21:30,750 - optuna.study.study - INFO - Trial 93 finished with values: [0.0004951247932709277, 0.00011052166224580017, 0.0002487605289613507] and parameters: {'n_layers': 3, 'embedding_dim': 128, 'lr': 0.05053540457055643, 'lambda_val': 0.00988905645222027, 'batch_size': 1855, 'optimizer': 'SGD'}.
2026-06-20 19:21:55,119 - experiment_functions - INFO - Early stopping at epoch 500. Best Metrics: (0.0005235747198752558, 0.00011052166224580017, 0.0002825798052717815)
2026-06-20 19:21:55,195 - optuna.study.study - INFO - Trial 94 finished with values: [0.0005235747198752558, 0.00011052166224580017, 0.0002825798052717815] and parameters: {'n_layers': 4, 'embedding_dim': 128, 'lr': 1.141038666719674e-05, 'lambda_val': 0.01777576225075643, 'batch_size': 3171, 'optimizer': 'Adam'}.
2026-06-20 19:22:19,980 - experiment_functions - INFO - Early stopping at epoch 550. Best Metrics: (0.0032051676889874054, 0.0013562586838448908, 0.0022410896885030054)
2026-06-20 19:22:20,079 - optuna.study.study - INFO - Trial 95 finished with values: [0.0032051676889874054, 0.0013562586838448908, 0.0022410896885030054] and parameters: {'n_layers': 4, 'embedding_dim': 64, 'lr': 0.0011914719293063967, 'lambda_val': 1.548420801174704e-06, 'batch_size': 3589, 'optimizer': 'RMSprop'}.
2026-06-20 19:22:57,975 - experiment_functions - INFO - Early stopping at epoch 850. Best Metrics: (0.0028846118283581716, 0.0013341543513957308, 0.0021817612343117145)
2026-06-20 19:22:58,058 - optuna.study.study - INFO - Trial 96 finished with values: [0.0028846118283581716, 0.0013341543513957308, 0.0021817612343117145] and parameters: {'n_layers': 3, 'embedding_dim': 96, 'lr': 0.00041936718251851416, 'lambda_val': 0.0031147525509907805, 'batch_size': 4096, 'optimizer': 'Adam'}.
2026-06-20 19:23:41,728 - experiment_functions - INFO - Early stopping at epoch 1000. Best Metrics: (0.0032745340360010064, 0.0013799418971832767, 0.0022905983258908096)
2026-06-20 19:23:41,820 - optuna.study.study - INFO - Trial 97 finished with values: [0.0032745340360010064, 0.0013799418971832767, 0.0022905983258908096] and parameters: {'n_layers': 3, 'embedding_dim': 96, 'lr': 0.00041936718251851416, 'lambda_val': 0.00015675372891187499, 'batch_size': 2206, 'optimizer': 'RMSprop'}.
2026-06-20 19:24:43,710 - experiment_functions - INFO - Early stopping at epoch 1350. Best Metrics: (0.002349983715657988, 0.001086270051787293, 0.0017382451444715044)
2026-06-20 19:24:43,793 - optuna.study.study - INFO - Trial 98 finished with values: [0.002349983715657988, 0.001086270051787293, 0.0017382451444715044] and parameters: {'n_layers': 4, 'embedding_dim': 128, 'lr': 0.00016414275370038185, 'lambda_val': 0.01777576225075643, 'batch_size': 3171, 'optimizer': 'Adam'}.
2026-06-20 19:25:05,791 - experiment_functions - INFO - Early stopping at epoch 500. Best Metrics: (0.0005783920085027238, 0.00011052166224580017, 0.00027536919775708396)
2026-06-20 19:25:05,887 - optuna.study.study - INFO - Trial 99 finished with values: [0.0005783920085027238, 0.00011052166224580017, 0.00027536919775708396] and parameters: {'n_layers': 2, 'embedding_dim': 32, 'lr': 0.00811003253498821, 'lambda_val': 0.055778010160043356, 'batch_size': 1325, 'optimizer': 'SGD'}.
2026-06-20 19:25:37,526 - experiment_functions - INFO - Early stopping at epoch 600. Best Metrics: (0.0027388108558936315, 0.0013988884678539852, 0.002113651569921663)
2026-06-20 19:25:37,610 - optuna.study.study - INFO - Trial 100 finished with values: [0.0027388108558936315, 0.0013988884678539852, 0.002113651569921663] and parameters: {'n_layers': 3, 'embedding_dim': 256, 'lr': 0.0011914719293063967, 'lambda_val': 1.548420801174704e-06, 'batch_size': 1155, 'optimizer': 'Adam'}.
2026-06-20 19:26:17,305 - experiment_functions - INFO - Early stopping at epoch 850. Best Metrics: (0.0032991876092135003, 0.0013673108500694706, 0.002225339739621339)
2026-06-20 19:26:17,473 - optuna.study.study - INFO - Trial 101 finished with values: [0.0032991876092135003, 0.0013673108500694706, 0.002225339739621339] and parameters: {'n_layers': 4, 'embedding_dim': 128, 'lr': 0.0005943725589836874, 'lambda_val': 3.6417495206733656e-06, 'batch_size': 809, 'optimizer': 'RMSprop'}.
2026-06-20 19:28:16,330 - experiment_functions - INFO - Early stopping at epoch 2400. Best Metrics: (0.0029707322951648798, 0.001433623847416951, 0.002223676436445386)
2026-06-20 19:28:16,401 - optuna.study.study - INFO - Trial 102 finished with values: [0.0029707322951648798, 0.001433623847416951, 0.002223676436445386] and parameters: {'n_layers': 3, 'embedding_dim': 256, 'lr': 0.00012250045847176557, 'lambda_val': 0.0002788270138316784, 'batch_size': 2884, 'optimizer': 'Adam'}.
2026-06-20 19:28:45,628 - experiment_functions - INFO - Early stopping at epoch 650. Best Metrics: (0.00396254405959814, 0.001942023493747632, 0.003159625976794991)
2026-06-20 19:28:45,718 - optuna.study.study - INFO - Trial 103 finished with values: [0.00396254405959814, 0.001942023493747632, 0.003159625976794991] and parameters: {'n_layers': 1, 'embedding_dim': 128, 'lr': 0.001947201008389374, 'lambda_val': 6.733205641736132e-06, 'batch_size': 1670, 'optimizer': 'Adam'}.
2026-06-20 19:29:17,216 - experiment_functions - INFO - Early stopping at epoch 600. Best Metrics: (0.0025869406594409036, 0.001299418971832765, 0.0020066938124774472)
2026-06-20 19:29:17,338 - optuna.study.study - INFO - Trial 104 finished with values: [0.0025869406594409036, 0.001299418971832765, 0.0020066938124774472] and parameters: {'n_layers': 3, 'embedding_dim': 256, 'lr': 0.0006133385212652219, 'lambda_val': 0.00026964451215277064, 'batch_size': 3631, 'optimizer': 'RMSprop'}.
2026-06-20 19:29:52,744 - experiment_functions - INFO - Early stopping at epoch 800. Best Metrics: (0.0030427601920983397, 0.0013878363016294052, 0.0022472178417643506)
2026-06-20 19:29:53,732 - optuna.study.study - INFO - Trial 105 finished with values: [0.0030427601920983397, 0.0013878363016294052, 0.0022472178417643506] and parameters: {'n_layers': 4, 'embedding_dim': 64, 'lr': 0.0005985041455867306, 'lambda_val': 0.0007437404179008586, 'batch_size': 1584, 'optimizer': 'Adam'}.
2026-06-20 19:30:18,478 - experiment_functions - INFO - Early stopping at epoch 550. Best Metrics: (0.003316208426372734, 0.001462043703423014, 0.002365846639479655)
2026-06-20 19:30:18,572 - optuna.study.study - INFO - Trial 106 finished with values: [0.003316208426372734, 0.001462043703423014, 0.002365846639479655] and parameters: {'n_layers': 3, 'embedding_dim': 64, 'lr': 0.003817870632102948, 'lambda_val': 4.080619734488508e-05, 'batch_size': 3657, 'optimizer': 'Adam'}.
2026-06-20 19:30:51,925 - experiment_functions - INFO - Early stopping at epoch 800. Best Metrics: (0.00400458882949244, 0.0019278135657446003, 0.003055828962556316)
2026-06-20 19:30:52,007 - optuna.study.study - INFO - Trial 107 finished with values: [0.00400458882949244, 0.0019278135657446003, 0.003055828962556316] and parameters: {'n_layers': 1, 'embedding_dim': 32, 'lr': 0.001947201008389374, 'lambda_val': 0.00091460267317109, 'batch_size': 747, 'optimizer': 'Adam'}.
