2026-06-17 22:04:02,095 - optuna.study.study - INFO - Trial 12 finished with values: [0.0006494799376313762, 0.00012315270935960593, 0.0003150294843586088] and parameters: {'n_layers': 2, 'embedding_dim': 96, 'lr': 0.004768609881490324, 'lambda_val': 0.0012241552802569934, 'batch_size': 3724, 'optimizer': 'SGD'}.
2026-06-17 22:04:25,815 - experiment_functions - INFO - Early stopping at epoch 500. Best Metrics: (0.0005346432687760143, 0.00011841606669192877, 0.0002930693264488026)
2026-06-17 22:04:25,902 - optuna.study.study - INFO - Trial 13 finished with values: [0.0005346432687760143, 0.00011841606669192877, 0.0002930693264488026] and parameters: {'n_layers': 3, 'embedding_dim': 96, 'lr': 0.00034851376623027547, 'lambda_val': 0.0019510980384587406, 'batch_size': 763, 'optimizer': 'SGD'}.
2026-06-17 22:04:48,905 - experiment_functions - INFO - Early stopping at epoch 500. Best Metrics: (0.0004662274151813674, 0.00010262725779967159, 0.0002408328438984993)
2026-06-17 22:04:48,998 - optuna.study.study - INFO - Trial 14 finished with values: [0.0004662274151813674, 0.00010262725779967159, 0.0002408328438984993] and parameters: {'n_layers': 4, 'embedding_dim': 64, 'lr': 0.0006063023000033222, 'lambda_val': 0.0007854902352428891, 'batch_size': 1907, 'optimizer': 'SGD'}.
2026-06-17 22:07:36,475 - optuna.study.study - INFO - Trial 15 finished with values: [0.0010954571108382851, 0.00028261967917140327, 0.0006941989332799924] and parameters: {'n_layers': 1, 'embedding_dim': 128, 'lr': 0.00014255784718054086, 'lambda_val': 0.0012144921171399186, 'batch_size': 3050, 'optimizer': 'Adam'}.
2026-06-17 22:07:58,805 - experiment_functions - INFO - Early stopping at epoch 500. Best Metrics: (0.0005749145787986258, 0.00011525830491347733, 0.0002826193309496952)
2026-06-17 22:07:58,888 - optuna.study.study - INFO - Trial 16 finished with values: [0.0005749145787986258, 0.00011525830491347733, 0.0002826193309496952] and parameters: {'n_layers': 3, 'embedding_dim': 32, 'lr': 0.0005565680644846523, 'lambda_val': 0.011026898724059514, 'batch_size': 3202, 'optimizer': 'SGD'}.
2026-06-17 22:08:44,724 - experiment_functions - INFO - Early stopping at epoch 1000. Best Metrics: (0.002848492969642103, 0.0007594417077175699, 0.0018830136262056978)
2026-06-17 22:08:44,794 - optuna.study.study - INFO - Trial 17 finished with values: [0.002848492969642103, 0.0007594417077175699, 0.0018830136262056978] and parameters: {'n_layers': 4, 'embedding_dim': 96, 'lr': 0.0006990102643278918, 'lambda_val': 0.002750666158846801, 'batch_size': 2748, 'optimizer': 'RMSprop'}.
2026-06-17 22:09:07,444 - experiment_functions - INFO - Early stopping at epoch 500. Best Metrics: (0.0005002525287127416, 0.00011999494758115447, 0.00029087485948270874)
2026-06-17 22:09:07,607 - optuna.study.study - INFO - Trial 18 finished with values: [0.0005002525287127416, 0.00011999494758115447, 0.00029087485948270874] and parameters: {'n_layers': 1, 'embedding_dim': 128, 'lr': 0.033675816322253686, 'lambda_val': 0.02413589938360598, 'batch_size': 2867, 'optimizer': 'SGD'}.
2026-06-17 22:09:44,403 - experiment_functions - INFO - Early stopping at epoch 650. Best Metrics: (0.0032110658196174936, 0.0008257547050650498, 0.0019371019456260279)
2026-06-17 22:09:44,475 - optuna.study.study - INFO - Trial 19 finished with values: [0.0032110658196174936, 0.0008257547050650498, 0.0019371019456260279] and parameters: {'n_layers': 4, 'embedding_dim': 256, 'lr': 0.0016427257095284614, 'lambda_val': 0.0015914958177189133, 'batch_size': 1625, 'optimizer': 'RMSprop'}.
2026-06-17 22:10:57,994 - experiment_functions - INFO - Early stopping at epoch 1650. Best Metrics: (0.0006064729592669009, 0.00014367816091954025, 0.0002995611055074971)
2026-06-17 22:10:58,062 - optuna.study.study - INFO - Trial 20 finished with values: [0.0006064729592669009, 0.00014367816091954025, 0.0002995611055074971] and parameters: {'n_layers': 4, 'embedding_dim': 96, 'lr': 2.182305502835638e-05, 'lambda_val': 0.0008304977352606367, 'batch_size': 2515, 'optimizer': 'Adam'}.
2026-06-17 22:14:18,189 - optuna.study.study - INFO - Trial 21 finished with values: [0.0007131394433747272, 0.00015315144625489455, 0.00042706854183470797] and parameters: {'n_layers': 3, 'embedding_dim': 256, 'lr': 2.116124323794688e-05, 'lambda_val': 9.293950030710558e-06, 'batch_size': 4066, 'optimizer': 'Adam'}.
2026-06-17 22:16:37,269 - experiment_functions - INFO - Early stopping at epoch 3500. Best Metrics: (0.0007064337084532784, 0.00016262473159024882, 0.0003823539770730489)
2026-06-17 22:16:37,355 - optuna.study.study - INFO - Trial 22 finished with values: [0.0007064337084532784, 0.00016262473159024882, 0.0003823539770730489] and parameters: {'n_layers': 2, 'embedding_dim': 32, 'lr': 2.579040907594916e-05, 'lambda_val': 2.8202352055535507e-05, 'batch_size': 3455, 'optimizer': 'Adam'}.
2026-06-17 22:17:00,275 - experiment_functions - INFO - Early stopping at epoch 500. Best Metrics: (0.0004833638607207487, 0.00010736390046734875, 0.00026887283241066966)
2026-06-17 22:17:00,359 - optuna.study.study - INFO - Trial 23 finished with values: [0.0004833638607207487, 0.00010736390046734875, 0.00026887283241066966] and parameters: {'n_layers': 4, 'embedding_dim': 64, 'lr': 2.3333246962543963e-05, 'lambda_val': 2.334734435289768e-06, 'batch_size': 1169, 'optimizer': 'SGD'}.
2026-06-17 22:17:35,918 - experiment_functions - INFO - Early stopping at epoch 800. Best Metrics: (0.0027989031496370963, 0.000641025641025641, 0.001685330557861395)
2026-06-17 22:17:36,001 - optuna.study.study - INFO - Trial 24 finished with values: [0.0027989031496370963, 0.000641025641025641, 0.001685330557861395] and parameters: {'n_layers': 1, 'embedding_dim': 128, 'lr': 0.0026857968910639833, 'lambda_val': 0.0001450892533078464, 'batch_size': 3271, 'optimizer': 'Adam'}.
2026-06-17 22:20:13,037 - optuna.study.study - INFO - Trial 25 finished with values: [0.001827124699070453, 0.0003678792471895921, 0.0010301957239843634] and parameters: {'n_layers': 2, 'embedding_dim': 32, 'lr': 0.0003042717759198202, 'lambda_val': 0.007786517502985627, 'batch_size': 678, 'optimizer': 'Adam'}.
2026-06-17 22:22:59,323 - optuna.study.study - INFO - Trial 26 finished with values: [0.0009243655033172701, 0.00022735884804850323, 0.0005018281262866442] and parameters: {'n_layers': 2, 'embedding_dim': 96, 'lr': 0.00010229225385385534, 'lambda_val': 0.00039580305818670997, 'batch_size': 1606, 'optimizer': 'Adam'}.
2026-06-17 22:23:21,476 - experiment_functions - INFO - Early stopping at epoch 500. Best Metrics: (0.0005248851611094979, 0.0001215738284703802, 0.00029629165511262144)
2026-06-17 22:23:21,544 - optuna.study.study - INFO - Trial 27 finished with values: [0.0005248851611094979, 0.0001215738284703802, 0.00029629165511262144] and parameters: {'n_layers': 4, 'embedding_dim': 32, 'lr': 1.659087408924899e-05, 'lambda_val': 3.926096583226207e-05, 'batch_size': 2380, 'optimizer': 'SGD'}.
2026-06-17 22:23:46,786 - experiment_functions - INFO - Early stopping at epoch 550. Best Metrics: (0.002513490354842445, 0.0006315523556902868, 0.001686751952143388)
2026-06-17 22:23:46,859 - optuna.study.study - INFO - Trial 28 finished with values: [0.002513490354842445, 0.0006315523556902868, 0.001686751952143388] and parameters: {'n_layers': 2, 'embedding_dim': 96, 'lr': 0.04431807195948907, 'lambda_val': 5.470239525476512e-06, 'batch_size': 810, 'optimizer': 'Adam'}.
2026-06-17 22:24:16,545 - experiment_functions - INFO - Early stopping at epoch 700. Best Metrics: (0.0004234521849721773, 0.00011525830491347733, 0.0002743009396180766)
2026-06-17 22:24:16,615 - optuna.study.study - INFO - Trial 29 finished with values: [0.0004234521849721773, 0.00011525830491347733, 0.0002743009396180766] and parameters: {'n_layers': 2, 'embedding_dim': 32, 'lr': 2.0491344377637234e-05, 'lambda_val': 0.019377146411659905, 'batch_size': 3408, 'optimizer': 'Adam'}.
2026-06-17 22:24:41,191 - experiment_functions - INFO - Early stopping at epoch 550. Best Metrics: (0.001755532612623561, 0.00047366426676771507, 0.0012189605699973998)
2026-06-17 22:24:41,261 - optuna.study.study - INFO - Trial 30 finished with values: [0.001755532612623561, 0.00047366426676771507, 0.0012189605699973998] and parameters: {'n_layers': 2, 'embedding_dim': 64, 'lr': 0.011725900168260472, 'lambda_val': 0.0019208946958172558, 'batch_size': 3682, 'optimizer': 'RMSprop'}.
2026-06-17 22:27:38,819 - optuna.study.study - INFO - Trial 31 finished with values: [0.0007974098304648264, 0.00017683465959328028, 0.0004356963908122761] and parameters: {'n_layers': 3, 'embedding_dim': 128, 'lr': 4.81530817538612e-05, 'lambda_val': 0.00027873021320236243, 'batch_size': 3960, 'optimizer': 'RMSprop'}.
2026-06-17 22:28:39,145 - experiment_functions - INFO - Early stopping at epoch 1300. Best Metrics: (0.0022395157848762713, 0.0005810281672350637, 0.0013763369042581017)
2026-06-17 22:28:39,218 - optuna.study.study - INFO - Trial 32 finished with values: [0.0022395157848762713, 0.0005810281672350637, 0.0013763369042581017] and parameters: {'n_layers': 1, 'embedding_dim': 256, 'lr': 0.0005455084498977304, 'lambda_val': 0.008127741001112998, 'batch_size': 3948, 'optimizer': 'RMSprop'}.
2026-06-17 22:29:04,234 - experiment_functions - INFO - Early stopping at epoch 500. Best Metrics: (0.000463819485622432, 8.999621068586587e-05, 0.00023174193253372433)
2026-06-17 22:29:04,302 - optuna.study.study - INFO - Trial 33 finished with values: [0.000463819485622432, 8.999621068586587e-05, 0.00023174193253372433] and parameters: {'n_layers': 4, 'embedding_dim': 128, 'lr': 0.007293294944939306, 'lambda_val': 1.2937313627142161e-06, 'batch_size': 2080, 'optimizer': 'SGD'}.
2026-06-17 22:30:04,226 - experiment_functions - INFO - Early stopping at epoch 1150. Best Metrics: (0.0005973122149776991, 0.00012631047113805733, 0.00035151756368023257)
2026-06-17 22:30:04,285 - optuna.study.study - INFO - Trial 34 finished with values: [0.0005973122149776991, 0.00012631047113805733, 0.00035151756368023257] and parameters: {'n_layers': 3, 'embedding_dim': 256, 'lr': 3.3089475700282735e-05, 'lambda_val': 0.0008436753566369497, 'batch_size': 3180, 'optimizer': 'Adam'}.
2026-06-17 22:31:11,756 - experiment_functions - INFO - Early stopping at epoch 1550. Best Metrics: (0.0029113242939368196, 0.0007420740179360869, 0.001884643331842573)
2026-06-17 22:31:11,838 - optuna.study.study - INFO - Trial 35 finished with values: [0.0029113242939368196, 0.0007420740179360869, 0.001884643331842573] and parameters: {'n_layers': 4, 'embedding_dim': 64, 'lr': 0.0006197690834854795, 'lambda_val': 0.006986427337292849, 'batch_size': 1884, 'optimizer': 'Adam'}.
2026-06-17 22:31:44,114 - experiment_functions - INFO - Early stopping at epoch 700. Best Metrics: (0.003174594559150095, 0.0007436528988253126, 0.0019389132010825074)
2026-06-17 22:31:44,192 - optuna.study.study - INFO - Trial 36 finished with values: [0.003174594559150095, 0.0007436528988253126, 0.0019389132010825074] and parameters: {'n_layers': 3, 'embedding_dim': 96, 'lr': 0.0026704905176286454, 'lambda_val': 3.6404845826373614e-05, 'batch_size': 4090, 'optimizer': 'Adam'}.
2026-06-17 22:32:09,581 - experiment_functions - INFO - Early stopping at epoch 550. Best Metrics: (0.0018361997744373417, 0.0005494505494505495, 0.0012367777071142431)
2026-06-17 22:32:09,650 - optuna.study.study - INFO - Trial 37 finished with values: [0.0018361997744373417, 0.0005494505494505495, 0.0012367777071142431] and parameters: {'n_layers': 4, 'embedding_dim': 64, 'lr': 0.0050419503560223886, 'lambda_val': 0.02263249127031471, 'batch_size': 2780, 'optimizer': 'RMSprop'}.
2026-06-17 22:35:14,395 - optuna.study.study - INFO - Trial 38 finished with values: [0.0028718387188821385, 0.0007089175192623469, 0.0017987219359106158] and parameters: {'n_layers': 4, 'embedding_dim': 128, 'lr': 0.00029388098096717836, 'lambda_val': 0.00224479684416678, 'batch_size': 1255, 'optimizer': 'Adam'}.
2026-06-17 22:37:31,047 - experiment_functions - INFO - Early stopping at epoch 3350. Best Metrics: (0.002651835250285568, 0.0005826070481242895, 0.0016739923519707729)
2026-06-17 22:37:31,114 - optuna.study.study - INFO - Trial 39 finished with values: [0.002651835250285568, 0.0005826070481242895, 0.0016739923519707729] and parameters: {'n_layers': 2, 'embedding_dim': 64, 'lr': 0.0002697110618998964, 'lambda_val': 1.4171626262243463e-05, 'batch_size': 2988, 'optimizer': 'RMSprop'}.
2026-06-17 22:37:55,303 - experiment_functions - INFO - Early stopping at epoch 500. Best Metrics: (0.000603487548080756, 0.00012788935202728306, 0.00032122514302062026)
2026-06-17 22:37:55,369 - optuna.study.study - INFO - Trial 40 finished with values: [0.000603487548080756, 0.00012788935202728306, 0.00032122514302062026] and parameters: {'n_layers': 1, 'embedding_dim': 256, 'lr': 0.0003571270807525139, 'lambda_val': 1.5854808150862056e-06, 'batch_size': 2471, 'optimizer': 'SGD'}.
2026-06-17 22:38:56,068 - experiment_functions - INFO - Early stopping at epoch 1450. Best Metrics: (0.0030966234725716135, 0.0007168119237084754, 0.002070393316802818)
2026-06-17 22:38:56,137 - optuna.study.study - INFO - Trial 41 finished with values: [0.0030966234725716135, 0.0007168119237084754, 0.002070393316802818] and parameters: {'n_layers': 1, 'embedding_dim': 96, 'lr': 0.0016963971500712442, 'lambda_val': 2.9025613182499857e-06, 'batch_size': 3625, 'optimizer': 'RMSprop'}.
2026-06-17 22:39:59,099 - experiment_functions - INFO - Early stopping at epoch 1300. Best Metrics: (0.0004595586846756492, 9.789061513199445e-05, 0.00023911935574042842)
2026-06-17 22:39:59,167 - optuna.study.study - INFO - Trial 42 finished with values: [0.0004595586846756492, 9.789061513199445e-05, 0.00023911935574042842] and parameters: {'n_layers': 2, 'embedding_dim': 256, 'lr': 3.533949311650101e-05, 'lambda_val': 0.027849421830362715, 'batch_size': 2580, 'optimizer': 'RMSprop'}.
2026-06-17 22:40:21,581 - experiment_functions - INFO - Early stopping at epoch 500. Best Metrics: (0.0005651983353301431, 0.00014525704180876596, 0.00034720293037951037)
2026-06-17 22:40:21,666 - optuna.study.study - INFO - Trial 43 finished with values: [0.0005651983353301431, 0.00014525704180876596, 0.00034720293037951037] and parameters: {'n_layers': 2, 'embedding_dim': 64, 'lr': 0.020595386756549542, 'lambda_val': 0.0015844212823856178, 'batch_size': 3861, 'optimizer': 'SGD'}.
2026-06-17 22:40:46,000 - experiment_functions - INFO - Early stopping at epoch 550. Best Metrics: (0.002908209831101452, 0.0006552355690286725, 0.0017808539903065948)
2026-06-17 22:40:46,087 - optuna.study.study - INFO - Trial 44 finished with values: [0.002908209831101452, 0.0006552355690286725, 0.0017808539903065948] and parameters: {'n_layers': 3, 'embedding_dim': 32, 'lr': 0.004714566698419002, 'lambda_val': 3.576975505685731e-06, 'batch_size': 2987, 'optimizer': 'RMSprop'}.
2026-06-17 22:42:04,295 - experiment_functions - INFO - Early stopping at epoch 1700. Best Metrics: (0.002660765038210496, 0.0006678666161424782, 0.0018097943085720923)
2026-06-17 22:42:04,385 - optuna.study.study - INFO - Trial 45 finished with values: [0.002660765038210496, 0.0006678666161424782, 0.0018097943085720923] and parameters: {'n_layers': 1, 'embedding_dim': 256, 'lr': 0.0046588425126039505, 'lambda_val': 2.9092990940925927e-06, 'batch_size': 2476, 'optimizer': 'Adam'}.
2026-06-17 22:44:21,994 - experiment_functions - INFO - Early stopping at epoch 3400. Best Metrics: (0.001851652291599266, 0.00044050776809397495, 0.0011585293413016683)
2026-06-17 22:44:22,064 - optuna.study.study - INFO - Trial 46 finished with values: [0.001851652291599266, 0.00044050776809397495, 0.0011585293413016683] and parameters: {'n_layers': 2, 'embedding_dim': 64, 'lr': 0.00039868289481353135, 'lambda_val': 0.03302620218478116, 'batch_size': 1205, 'optimizer': 'Adam'}.
2026-06-17 22:45:07,607 - experiment_functions - INFO - Early stopping at epoch 1100. Best Metrics: (0.002737379934512674, 0.0006126057850195782, 0.0016988340429884815)
2026-06-17 22:45:07,680 - optuna.study.study - INFO - Trial 47 finished with values: [0.002737379934512674, 0.0006126057850195782, 0.0016988340429884815] and parameters: {'n_layers': 2, 'embedding_dim': 32, 'lr': 0.0009769139989935218, 'lambda_val': 4.897319562750751e-05, 'batch_size': 3215, 'optimizer': 'Adam'}.
2026-06-17 22:47:39,465 - experiment_functions - INFO - Early stopping at epoch 3700. Best Metrics: (0.0006420013989441793, 0.0001515725653656688, 0.00041954327780486915)
2026-06-17 22:47:39,619 - optuna.study.study - INFO - Trial 48 finished with values: [0.0006420013989441793, 0.0001515725653656688, 0.00041954327780486915] and parameters: {'n_layers': 1, 'embedding_dim': 128, 'lr': 3.7319654855655365e-05, 'lambda_val': 0.0009679090544544568, 'batch_size': 1865, 'optimizer': 'RMSprop'}.
2026-06-17 22:48:04,443 - experiment_functions - INFO - Early stopping at epoch 500. Best Metrics: (0.0005581522219778102, 0.00011999494758115447, 0.00029630319362829286)
2026-06-17 22:48:04,515 - optuna.study.study - INFO - Trial 49 finished with values: [0.0005581522219778102, 0.00011999494758115447, 0.00029630319362829286] and parameters: {'n_layers': 4, 'embedding_dim': 128, 'lr': 4.9810267746900564e-05, 'lambda_val': 0.030129008288800264, 'batch_size': 1997, 'optimizer': 'SGD'}.
2026-06-17 22:49:29,934 - experiment_functions - INFO - Early stopping at epoch 2150. Best Metrics: (0.0007887925490658989, 0.00016736137425792601, 0.0004069228668301561)
2026-06-17 22:49:30,257 - optuna.study.study - INFO - Trial 50 finished with values: [0.0007887925490658989, 0.00016736137425792601, 0.0004069228668301561] and parameters: {'n_layers': 1, 'embedding_dim': 32, 'lr': 2.116124323794688e-05, 'lambda_val': 2.2322765995099733e-06, 'batch_size': 4066, 'optimizer': 'Adam'}.
2026-06-17 22:50:06,784 - experiment_functions - INFO - Early stopping at epoch 650. Best Metrics: (0.0004938269089897263, 0.00011841606669192878, 0.00028748247757232433)
2026-06-17 22:50:07,529 - optuna.study.study - INFO - Trial 51 finished with values: [0.0004938269089897263, 0.00011841606669192878, 0.00028748247757232433] and parameters: {'n_layers': 4, 'embedding_dim': 256, 'lr': 3.533949311650101e-05, 'lambda_val': 0.027849421830362715, 'batch_size': 2580, 'optimizer': 'Adam'}.
2026-06-17 22:50:31,358 - experiment_functions - INFO - Early stopping at epoch 500. Best Metrics: (0.0005422020566309887, 0.00011052166224580017, 0.00034459082362478755)
2026-06-17 22:50:31,445 - optuna.study.study - INFO - Trial 52 finished with values: [0.0005422020566309887, 0.00011052166224580017, 0.00034459082362478755] and parameters: {'n_layers': 3, 'embedding_dim': 128, 'lr': 4.81530817538612e-05, 'lambda_val': 0.0015013666477377053, 'batch_size': 763, 'optimizer': 'SGD'}.
2026-06-17 22:50:53,211 - experiment_functions - INFO - Early stopping at epoch 500. Best Metrics: (0.0004662274151813674, 0.00010262725779967159, 0.0002408328438984993)
2026-06-17 22:50:53,299 - optuna.study.study - INFO - Trial 53 finished with values: [0.0004662274151813674, 0.00010262725779967159, 0.0002408328438984993] and parameters: {'n_layers': 2, 'embedding_dim': 64, 'lr': 0.00015100710324150572, 'lambda_val': 0.03302620218478116, 'batch_size': 3861, 'optimizer': 'SGD'}.
2026-06-17 22:53:27,801 - optuna.study.study - INFO - Trial 54 finished with values: [0.0018874486897319503, 0.0004152456738663636, 0.0010911348822727667] and parameters: {'n_layers': 2, 'embedding_dim': 32, 'lr': 0.0003042717759198202, 'lambda_val': 2.2322765995099733e-06, 'batch_size': 678, 'optimizer': 'Adam'}.
2026-06-17 22:53:50,675 - experiment_functions - INFO - Early stopping at epoch 500. Best Metrics: (0.0005422233558591531, 0.0001294682329165088, 0.0003152473372008206)
2026-06-17 22:53:50,756 - optuna.study.study - INFO - Trial 55 finished with values: [0.0005422233558591531, 0.0001294682329165088, 0.0003152473372008206] and parameters: {'n_layers': 2, 'embedding_dim': 128, 'lr': 9.902841147311089e-05, 'lambda_val': 3.576975505685731e-06, 'batch_size': 3360, 'optimizer': 'SGD'}.
2026-06-17 22:54:17,317 - experiment_functions - INFO - Early stopping at epoch 600. Best Metrics: (0.002508475500198854, 0.0006252368321333837, 0.001592206616968918)
2026-06-17 22:54:17,409 - optuna.study.study - INFO - Trial 56 finished with values: [0.002508475500198854, 0.0006252368321333837, 0.001592206616968918] and parameters: {'n_layers': 1, 'embedding_dim': 128, 'lr': 0.011725900168260472, 'lambda_val': 4.837845614869635e-05, 'batch_size': 3359, 'optimizer': 'RMSprop'}.
2026-06-17 22:54:42,521 - experiment_functions - INFO - Early stopping at epoch 600. Best Metrics: (0.0032685875442387425, 0.0006394467601364153, 0.0019474108300454893)
2026-06-17 22:54:42,619 - optuna.study.study - INFO - Trial 57 finished with values: [0.0032685875442387425, 0.0006394467601364153, 0.0019474108300454893] and parameters: {'n_layers': 1, 'embedding_dim': 32, 'lr': 0.007122227416835467, 'lambda_val': 1.1653400566573792e-06, 'batch_size': 2471, 'optimizer': 'Adam'}.
2026-06-17 22:57:24,591 - optuna.study.study - INFO - Trial 58 finished with values: [0.0007088302484906027, 0.0001578880889225717, 0.0003609071542623183] and parameters: {'n_layers': 1, 'embedding_dim': 128, 'lr': 4.81530817538612e-05, 'lambda_val': 0.0009679090544544568, 'batch_size': 3960, 'optimizer': 'RMSprop'}.
2026-06-17 22:57:46,807 - experiment_functions - INFO - Early stopping at epoch 500. Best Metrics: (0.000525944578029493, 0.00011999494758115447, 0.00027760322411904794)
