2026-06-19 22:36:18,617 - optuna.study.study - INFO - Trial 92 finished with values: [0.0003966406138348851, 9.315397246431729e-05, 0.0002427495092166237] and parameters: {'n_layers': 1, 'embedding_dim': 128, 'lr': 0.00010811055123214613, 'lambda_val': 2.9528072060828703e-06, 'batch_size': 4063, 'optimizer': 'SGD'}.
2026-06-19 22:38:50,949 - experiment_functions - INFO - Early stopping at epoch 3300. Best Metrics: (0.028279843909588834, 0.006009220664393079, 0.016232460099894548)
2026-06-19 22:38:51,092 - optuna.study.study - INFO - Trial 93 finished with values: [0.028279843909588834, 0.006009220664393079, 0.016232460099894548] and parameters: {'n_layers': 2, 'embedding_dim': 128, 'lr': 0.000502008079869897, 'lambda_val': 0.001032325420317978, 'batch_size': 1916, 'optimizer': 'RMSprop'}.
2026-06-19 22:39:16,309 - experiment_functions - INFO - Early stopping at epoch 550. Best Metrics: (0.010181421119959129, 0.002316218264494127, 0.00587179073587443)
2026-06-19 22:39:16,398 - optuna.study.study - INFO - Trial 94 finished with values: [0.010181421119959129, 0.002316218264494127, 0.00587179073587443] and parameters: {'n_layers': 1, 'embedding_dim': 96, 'lr': 0.02088730245216097, 'lambda_val': 8.115443369116663e-05, 'batch_size': 1101, 'optimizer': 'Adam'}.
2026-06-19 22:39:41,528 - experiment_functions - INFO - Early stopping at epoch 500. Best Metrics: (0.0005026606110923337, 0.00011052166224580018, 0.0002739046917639355)
2026-06-19 22:39:41,629 - optuna.study.study - INFO - Trial 95 finished with values: [0.0005026606110923337, 0.00011052166224580018, 0.0002739046917639355] and parameters: {'n_layers': 1, 'embedding_dim': 256, 'lr': 0.000778135007488856, 'lambda_val': 0.00013592781984966978, 'batch_size': 3313, 'optimizer': 'SGD'}.
2026-06-19 22:40:48,024 - experiment_functions - INFO - Early stopping at epoch 1600. Best Metrics: (0.03218389855021867, 0.006729190349880005, 0.01891688505830764)
2026-06-19 22:40:48,118 - optuna.study.study - INFO - Trial 96 finished with values: [0.03218389855021867, 0.006729190349880005, 0.01891688505830764] and parameters: {'n_layers': 1, 'embedding_dim': 32, 'lr': 0.0020150870895911718, 'lambda_val': 4.332711516457783e-05, 'batch_size': 1780, 'optimizer': 'Adam'}.
2026-06-19 22:41:15,290 - experiment_functions - INFO - Early stopping at epoch 500. Best Metrics: (0.0006190437017708452, 0.00012788935202728306, 0.00032194680057158877)
2026-06-19 22:41:15,387 - optuna.study.study - INFO - Trial 97 finished with values: [0.0006190437017708452, 0.00012788935202728306, 0.00032194680057158877] and parameters: {'n_layers': 2, 'embedding_dim': 256, 'lr': 0.02250657819109089, 'lambda_val': 7.730192456005456e-06, 'batch_size': 2556, 'optimizer': 'SGD'}.
2026-06-19 22:41:43,246 - experiment_functions - INFO - Early stopping at epoch 600. Best Metrics: (0.0121607928382674, 0.002638309965896173, 0.006799090715877354)
2026-06-19 22:41:43,327 - optuna.study.study - INFO - Trial 98 finished with values: [0.0121607928382674, 0.002638309965896173, 0.006799090715877354] and parameters: {'n_layers': 1, 'embedding_dim': 128, 'lr': 0.007729246782619305, 'lambda_val': 0.0006161413438795785, 'batch_size': 3641, 'optimizer': 'RMSprop'}.
2026-06-19 22:44:01,239 - experiment_functions - INFO - Early stopping at epoch 3200. Best Metrics: (0.02693442080209486, 0.005687128962991032, 0.015425093577600543)
2026-06-19 22:44:01,373 - optuna.study.study - INFO - Trial 99 finished with values: [0.02693442080209486, 0.005687128962991032, 0.015425093577600543] and parameters: {'n_layers': 3, 'embedding_dim': 32, 'lr': 0.0005537165984177899, 'lambda_val': 0.001032325420317978, 'batch_size': 1916, 'optimizer': 'Adam'}.
2026-06-19 22:44:25,285 - experiment_functions - INFO - Early stopping at epoch 500. Best Metrics: (0.0005301124988290024, 0.00012157382847038019, 0.00029110302418821656)
2026-06-19 22:44:25,359 - optuna.study.study - INFO - Trial 100 finished with values: [0.0005301124988290024, 0.00012157382847038019, 0.00029110302418821656] and parameters: {'n_layers': 1, 'embedding_dim': 96, 'lr': 0.002485646663868356, 'lambda_val': 0.08015884682233063, 'batch_size': 1029, 'optimizer': 'SGD'}.
2026-06-19 22:45:10,355 - experiment_functions - INFO - Early stopping at epoch 850. Best Metrics: (0.010470004278645051, 0.002202538840469875, 0.006077927443592174)
2026-06-19 22:45:10,441 - optuna.study.study - INFO - Trial 101 finished with values: [0.010470004278645051, 0.002202538840469875, 0.006077927443592174] and parameters: {'n_layers': 4, 'embedding_dim': 128, 'lr': 0.008256478006191592, 'lambda_val': 1.9968956567375666e-05, 'batch_size': 3395, 'optimizer': 'RMSprop'}.
2026-06-19 22:46:19,904 - experiment_functions - INFO - Early stopping at epoch 1600. Best Metrics: (0.03167181522197458, 0.006538145762283695, 0.01786133667642782)
2026-06-19 22:46:19,949 - optuna.study.study - INFO - Trial 102 finished with values: [0.03167181522197458, 0.006538145762283695, 0.01786133667642782] and parameters: {'n_layers': 1, 'embedding_dim': 32, 'lr': 0.0020150870895911718, 'lambda_val': 2.3360853516346427e-06, 'batch_size': 3580, 'optimizer': 'Adam'}.
2026-06-19 22:49:21,265 - optuna.study.study - INFO - Trial 103 finished with values: [0.0332527655573398, 0.006992863458380699, 0.019168862447471367] and parameters: {'n_layers': 1, 'embedding_dim': 128, 'lr': 0.000778135007488856, 'lambda_val': 2.710386902101323e-06, 'batch_size': 3313, 'optimizer': 'RMSprop'}.
2026-06-19 22:49:48,886 - experiment_functions - INFO - Early stopping at epoch 550. Best Metrics: (0.0005798855397252812, 0.00011367942402425162, 0.000287086920541754)
2026-06-19 22:49:48,993 - optuna.study.study - INFO - Trial 104 finished with values: [0.0005798855397252812, 0.00011367942402425162, 0.000287086920541754] and parameters: {'n_layers': 1, 'embedding_dim': 256, 'lr': 8.927314985164983e-05, 'lambda_val': 0.018513591723232643, 'batch_size': 2868, 'optimizer': 'RMSprop'}.
2026-06-19 22:52:49,623 - optuna.study.study - INFO - Trial 105 finished with values: [0.009807105050671418, 0.002259378552482001, 0.005548426336797379] and parameters: {'n_layers': 2, 'embedding_dim': 128, 'lr': 0.02088730245216097, 'lambda_val': 0.0025056273572935293, 'batch_size': 3641, 'optimizer': 'RMSprop'}.
2026-06-19 22:55:54,745 - optuna.study.study - INFO - Trial 106 finished with values: [0.028052639532807757, 0.005898699002147278, 0.015754783187948613] and parameters: {'n_layers': 3, 'embedding_dim': 96, 'lr': 0.000502008079869897, 'lambda_val': 5.1001581943832046e-05, 'batch_size': 1167, 'optimizer': 'RMSprop'}.
2026-06-19 22:56:28,515 - experiment_functions - INFO - Early stopping at epoch 550. Best Metrics: (0.013269744504873206, 0.0029619805481874446, 0.007750533515062134)
2026-06-19 22:56:28,918 - optuna.study.study - INFO - Trial 107 finished with values: [0.013269744504873206, 0.0029619805481874446, 0.007750533515062134] and parameters: {'n_layers': 3, 'embedding_dim': 256, 'lr': 0.0028479344086524603, 'lambda_val': 1.6250517825264063e-06, 'batch_size': 1101, 'optimizer': 'RMSprop'}.
2026-06-19 22:56:55,875 - experiment_functions - INFO - Early stopping at epoch 500. Best Metrics: (0.00047800580550485947, 0.00011683718580270305, 0.00028061300317979923)
2026-06-19 22:56:55,958 - optuna.study.study - INFO - Trial 108 finished with values: [0.00047800580550485947, 0.00011683718580270305, 0.00028061300317979923] and parameters: {'n_layers': 4, 'embedding_dim': 128, 'lr': 0.000487984199970086, 'lambda_val': 0.00016850368809917643, 'batch_size': 3313, 'optimizer': 'SGD'}.
2026-06-19 22:57:23,823 - experiment_functions - INFO - Early stopping at epoch 600. Best Metrics: (0.011629511848644726, 0.0026083112290008845, 0.0065267594283724435)
2026-06-19 22:57:23,970 - optuna.study.study - INFO - Trial 109 finished with values: [0.011629511848644726, 0.0026083112290008845, 0.0065267594283724435] and parameters: {'n_layers': 1, 'embedding_dim': 128, 'lr': 0.008632706920549668, 'lambda_val': 0.001032325420317978, 'batch_size': 1916, 'optimizer': 'RMSprop'}.
2026-06-19 22:57:56,955 - experiment_functions - INFO - Early stopping at epoch 700. Best Metrics: (0.006282517797391948, 0.0013009978527219908, 0.0033709217751217726)
2026-06-19 22:57:57,050 - optuna.study.study - INFO - Trial 110 finished with values: [0.006282517797391948, 0.0013009978527219908, 0.0033709217751217726] and parameters: {'n_layers': 4, 'embedding_dim': 64, 'lr': 0.02436228665325216, 'lambda_val': 0.000491870809962855, 'batch_size': 1422, 'optimizer': 'Adam'}.
2026-06-19 22:59:54,393 - experiment_functions - INFO - Early stopping at epoch 2750. Best Metrics: (0.032088836451991225, 0.0066407730200833655, 0.018344943902875735)
2026-06-19 22:59:54,470 - optuna.study.study - INFO - Trial 111 finished with values: [0.032088836451991225, 0.0066407730200833655, 0.018344943902875735] and parameters: {'n_layers': 1, 'embedding_dim': 32, 'lr': 0.0020150870895911718, 'lambda_val': 3.839973473325218e-05, 'batch_size': 1780, 'optimizer': 'Adam'}.
2026-06-19 23:01:02,156 - experiment_functions - INFO - Early stopping at epoch 1400. Best Metrics: (0.009477840269408134, 0.0019278135657446003, 0.005179734172144507)
2026-06-19 23:01:02,252 - optuna.study.study - INFO - Trial 112 finished with values: [0.009477840269408134, 0.0019278135657446003, 0.005179734172144507] and parameters: {'n_layers': 4, 'embedding_dim': 96, 'lr': 0.005369917483033977, 'lambda_val': 1.2287271335574109e-05, 'batch_size': 3711, 'optimizer': 'RMSprop'}.
2026-06-19 23:02:07,682 - experiment_functions - INFO - Early stopping at epoch 1550. Best Metrics: (0.019056040906209843, 0.003997726411519515, 0.010478079979032622)
2026-06-19 23:02:07,749 - optuna.study.study - INFO - Trial 113 finished with values: [0.019056040906209843, 0.003997726411519515, 0.010478079979032622] and parameters: {'n_layers': 1, 'embedding_dim': 64, 'lr': 0.004451594077918778, 'lambda_val': 0.00011471274504099714, 'batch_size': 1392, 'optimizer': 'RMSprop'}.
2026-06-19 23:02:39,461 - experiment_functions - INFO - Early stopping at epoch 700. Best Metrics: (0.01871559223668373, 0.004193507641783504, 0.010726386981597932)
2026-06-19 23:02:39,574 - optuna.study.study - INFO - Trial 114 finished with values: [0.01871559223668373, 0.004193507641783504, 0.010726386981597932] and parameters: {'n_layers': 4, 'embedding_dim': 32, 'lr': 0.0020150870895911718, 'lambda_val': 3.9435940439521e-06, 'batch_size': 2432, 'optimizer': 'Adam'}.
2026-06-19 23:03:27,270 - experiment_functions - INFO - Early stopping at epoch 1100. Best Metrics: (0.022615854386010516, 0.00479979790324618, 0.012890673046620288)
2026-06-19 23:03:27,341 - optuna.study.study - INFO - Trial 115 finished with values: [0.022615854386010516, 0.00479979790324618, 0.012890673046620288] and parameters: {'n_layers': 3, 'embedding_dim': 32, 'lr': 0.000778135007488856, 'lambda_val': 2.710386902101323e-06, 'batch_size': 3313, 'optimizer': 'Adam'}.
2026-06-19 23:06:08,561 - optuna.study.study - INFO - Trial 116 finished with values: [0.025236841713535386, 0.005486611090059366, 0.014691384577507939] and parameters: {'n_layers': 1, 'embedding_dim': 32, 'lr': 0.0005537165984177899, 'lambda_val': 5.434615408749385e-06, 'batch_size': 3313, 'optimizer': 'RMSprop'}.
2026-06-19 23:07:09,508 - experiment_functions - INFO - Early stopping at epoch 1300. Best Metrics: (0.01145757112096643, 0.002376215738284704, 0.006497338806355074)
2026-06-19 23:07:09,594 - optuna.study.study - INFO - Trial 117 finished with values: [0.01145757112096643, 0.002376215738284704, 0.006497338806355074] and parameters: {'n_layers': 3, 'embedding_dim': 96, 'lr': 0.005369917483033977, 'lambda_val': 1.2287271335574109e-05, 'batch_size': 2824, 'optimizer': 'RMSprop'}.
2026-06-19 23:07:32,575 - experiment_functions - INFO - Early stopping at epoch 500. Best Metrics: (0.0005480569177813725, 0.00013262599469496023, 0.0003719533146493679)
2026-06-19 23:07:32,714 - optuna.study.study - INFO - Trial 118 finished with values: [0.0005480569177813725, 0.00013262599469496023, 0.0003719533146493679] and parameters: {'n_layers': 2, 'embedding_dim': 64, 'lr': 1.8944838365960415e-05, 'lambda_val': 0.0006161413438795785, 'batch_size': 720, 'optimizer': 'Adam'}.
2026-06-19 23:07:56,761 - experiment_functions - INFO - Early stopping at epoch 550. Best Metrics: (0.020317700823548064, 0.004458759631173425, 0.01187334190847024)
2026-06-19 23:07:56,832 - optuna.study.study - INFO - Trial 119 finished with values: [0.020317700823548064, 0.004458759631173425, 0.01187334190847024] and parameters: {'n_layers': 1, 'embedding_dim': 32, 'lr': 0.02088730245216097, 'lambda_val': 3.9435940439521e-06, 'batch_size': 4087, 'optimizer': 'Adam'}.
2026-06-19 23:08:40,234 - experiment_functions - INFO - Early stopping at epoch 900. Best Metrics: (0.026334575359517, 0.005565555134520651, 0.015239498633764496)
2026-06-19 23:08:40,753 - optuna.study.study - INFO - Trial 120 finished with values: [0.026334575359517, 0.005565555134520651, 0.015239498633764496] and parameters: {'n_layers': 2, 'embedding_dim': 128, 'lr': 0.000842647473455401, 'lambda_val': 1.1228763121949336e-05, 'batch_size': 3849, 'optimizer': 'RMSprop'}.
2026-06-19 23:09:26,025 - experiment_functions - INFO - Early stopping at epoch 850. Best Metrics: (0.019577420886505485, 0.004155614500442087, 0.011077912590222701)
2026-06-19 23:09:26,101 - optuna.study.study - INFO - Trial 121 finished with values: [0.019577420886505485, 0.004155614500442087, 0.011077912590222701] and parameters: {'n_layers': 4, 'embedding_dim': 128, 'lr': 0.0006864603145004262, 'lambda_val': 2.710386902101323e-06, 'batch_size': 3313, 'optimizer': 'Adam'}.
2026-06-19 23:12:30,416 - optuna.study.study - INFO - Trial 122 finished with values: [0.028413755666727346, 0.00601237842617153, 0.01585012525535102] and parameters: {'n_layers': 2, 'embedding_dim': 128, 'lr': 0.000502008079869897, 'lambda_val': 0.0006161413438795785, 'batch_size': 1916, 'optimizer': 'Adam'}.
2026-06-19 23:13:00,514 - experiment_functions - INFO - Early stopping at epoch 500. Best Metrics: (0.0004647219562568596, 0.00011841606669192878, 0.00028283694863733336)
2026-06-19 23:13:00,582 - optuna.study.study - INFO - Trial 123 finished with values: [0.0004647219562568596, 0.00011841606669192878, 0.00028283694863733336] and parameters: {'n_layers': 3, 'embedding_dim': 256, 'lr': 0.00014111781740429823, 'lambda_val': 0.004140028155545859, 'batch_size': 2824, 'optimizer': 'SGD'}.
2026-06-19 23:13:24,634 - experiment_functions - INFO - Early stopping at epoch 550. Best Metrics: (0.00931915699094111, 0.002174118984463812, 0.005392782679298144)
2026-06-19 23:13:25,006 - optuna.study.study - INFO - Trial 124 finished with values: [0.00931915699094111, 0.002174118984463812, 0.005392782679298144] and parameters: {'n_layers': 1, 'embedding_dim': 32, 'lr': 0.03802513876197062, 'lambda_val': 0.00019085919103594895, 'batch_size': 1186, 'optimizer': 'Adam'}.
2026-06-19 23:13:49,623 - experiment_functions - INFO - Early stopping at epoch 550. Best Metrics: (0.005868708133453123, 0.001349943160287988, 0.0035432104961115756)
2026-06-19 23:13:50,025 - optuna.study.study - INFO - Trial 125 finished with values: [0.005868708133453123, 0.001349943160287988, 0.0035432104961115756] and parameters: {'n_layers': 4, 'embedding_dim': 32, 'lr': 0.011555015885292643, 'lambda_val': 0.058261212247747766, 'batch_size': 592, 'optimizer': 'Adam'}.
2026-06-19 23:14:34,729 - experiment_functions - INFO - Early stopping at epoch 1050. Best Metrics: (0.028758823730986517, 0.006152898825312619, 0.016521941503157046)
2026-06-19 23:14:34,797 - optuna.study.study - INFO - Trial 126 finished with values: [0.028758823730986517, 0.006152898825312619, 0.016521941503157046] and parameters: {'n_layers': 1, 'embedding_dim': 32, 'lr': 0.0020150870895911718, 'lambda_val': 0.001032325420317978, 'batch_size': 1780, 'optimizer': 'RMSprop'}.
2026-06-19 23:16:11,438 - experiment_functions - INFO - Early stopping at epoch 1650. Best Metrics: (0.023224361911586104, 0.0050303145130731345, 0.01300228423872358)
2026-06-19 23:16:11,515 - optuna.study.study - INFO - Trial 127 finished with values: [0.023224361911586104, 0.0050303145130731345, 0.01300228423872358] and parameters: {'n_layers': 3, 'embedding_dim': 256, 'lr': 0.000502008079869897, 'lambda_val': 4.388555938735431e-05, 'batch_size': 1780, 'optimizer': 'RMSprop'}.
2026-06-19 23:19:23,103 - optuna.study.study - INFO - Trial 128 finished with values: [0.026332651358719962, 0.0058292282430213475, 0.015582556331349667] and parameters: {'n_layers': 1, 'embedding_dim': 256, 'lr': 0.0005537165984177899, 'lambda_val': 0.001032325420317978, 'batch_size': 2297, 'optimizer': 'Adam'}.
2026-06-19 23:20:15,400 - experiment_functions - INFO - Early stopping at epoch 1200. Best Metrics: (0.0005282488337352558, 0.00011683718580270305, 0.0002623295030065317)
2026-06-19 23:20:15,473 - optuna.study.study - INFO - Trial 129 finished with values: [0.0005282488337352558, 0.00011683718580270305, 0.0002623295030065317] and parameters: {'n_layers': 1, 'embedding_dim': 128, 'lr': 1.9226594810198778e-05, 'lambda_val': 2.710386902101323e-06, 'batch_size': 3313, 'optimizer': 'Adam'}.
2026-06-19 23:20:47,265 - experiment_functions - INFO - Early stopping at epoch 700. Best Metrics: (0.018203756614187345, 0.0039061513199444235, 0.009999697528152973)
2026-06-19 23:20:47,343 - optuna.study.study - INFO - Trial 130 finished with values: [0.018203756614187345, 0.0039061513199444235, 0.009999697528152973] and parameters: {'n_layers': 4, 'embedding_dim': 32, 'lr': 0.0020150870895911718, 'lambda_val': 3.9435940439521e-06, 'batch_size': 2432, 'optimizer': 'Adam'}.
2026-06-19 23:21:11,454 - experiment_functions - INFO - Early stopping at epoch 550. Best Metrics: (0.0068446336896071415, 0.0016972969559176457, 0.004145186294918554)
2026-06-19 23:21:11,541 - optuna.study.study - INFO - Trial 131 finished with values: [0.0068446336896071415, 0.0016972969559176457, 0.004145186294918554] and parameters: {'n_layers': 1, 'embedding_dim': 32, 'lr': 0.03540548378033063, 'lambda_val': 0.005169176848886771, 'batch_size': 592, 'optimizer': 'Adam'}.
2026-06-19 23:21:42,213 - experiment_functions - INFO - Early stopping at epoch 700. Best Metrics: (0.0005733579070776987, 0.00012788935202728306, 0.000320176469831314)
2026-06-19 23:21:42,292 - optuna.study.study - INFO - Trial 132 finished with values: [0.0005733579070776987, 0.00012788935202728306, 0.000320176469831314] and parameters: {'n_layers': 1, 'embedding_dim': 96, 'lr': 0.00011192827006728622, 'lambda_val': 0.00196716509652864, 'batch_size': 1029, 'optimizer': 'RMSprop'}.
2026-06-19 23:22:47,115 - experiment_functions - INFO - Early stopping at epoch 1550. Best Metrics: (0.013440216874235553, 0.002853037766830871, 0.007341133045071577)
2026-06-19 23:22:47,455 - optuna.study.study - INFO - Trial 133 finished with values: [0.013440216874235553, 0.002853037766830871, 0.007341133045071577] and parameters: {'n_layers': 2, 'embedding_dim': 32, 'lr': 0.0028479344086524603, 'lambda_val': 0.000491870809962855, 'batch_size': 1101, 'optimizer': 'RMSprop'}.
2026-06-19 23:23:27,659 - experiment_functions - INFO - Early stopping at epoch 900. Best Metrics: (0.0262539997386923, 0.005712391057218644, 0.015016821667017153)
2026-06-19 23:23:27,751 - optuna.study.study - INFO - Trial 134 finished with values: [0.0262539997386923, 0.005712391057218644, 0.015016821667017153] and parameters: {'n_layers': 1, 'embedding_dim': 96, 'lr': 0.002485646663868356, 'lambda_val': 0.003946099672702113, 'batch_size': 1780, 'optimizer': 'Adam'}.
2026-06-19 23:24:02,866 - experiment_functions - INFO - Early stopping at epoch 700. Best Metrics: (0.011315733064088439, 0.0023683213338385753, 0.0061820382747937285)
2026-06-19 23:24:03,458 - optuna.study.study - INFO - Trial 135 finished with values: [0.011315733064088439, 0.0023683213338385753, 0.0061820382747937285] and parameters: {'n_layers': 4, 'embedding_dim': 96, 'lr': 0.019271744274364268, 'lambda_val': 1.0672171882304554e-05, 'batch_size': 1101, 'optimizer': 'RMSprop'}.
2026-06-19 23:24:29,348 - experiment_functions - INFO - Early stopping at epoch 550. Best Metrics: (0.012447771553982398, 0.002793040293040293, 0.00716878281266981)
2026-06-19 23:24:29,453 - optuna.study.study - INFO - Trial 136 finished with values: [0.012447771553982398, 0.002793040293040293, 0.00716878281266981] and parameters: {'n_layers': 1, 'embedding_dim': 128, 'lr': 0.016177903196121036, 'lambda_val': 2.710386902101323e-06, 'batch_size': 1422, 'optimizer': 'Adam'}.
2026-06-19 23:24:53,532 - experiment_functions - INFO - Early stopping at epoch 550. Best Metrics: (0.007122407367594391, 0.0017857142857142857, 0.004291072326313377)
2026-06-19 23:24:53,601 - optuna.study.study - INFO - Trial 137 finished with values: [0.007122407367594391, 0.0017857142857142857, 0.004291072326313377] and parameters: {'n_layers': 1, 'embedding_dim': 64, 'lr': 0.058649988632434, 'lambda_val': 0.0006161413438795785, 'batch_size': 844, 'optimizer': 'Adam'}.
2026-06-19 23:25:22,985 - experiment_functions - INFO - Early stopping at epoch 650. Best Metrics: (0.0106566421409067, 0.002287798408488064, 0.0060386075333865264)
2026-06-19 23:25:23,061 - optuna.study.study - INFO - Trial 138 finished with values: [0.0106566421409067, 0.002287798408488064, 0.0060386075333865264] and parameters: {'n_layers': 4, 'embedding_dim': 32, 'lr': 0.0028479344086524603, 'lambda_val': 1.6250517825264063e-06, 'batch_size': 1916, 'optimizer': 'RMSprop'}.
2026-06-19 23:25:48,873 - experiment_functions - INFO - Early stopping at epoch 550. Best Metrics: (0.011631536974940732, 0.0025341038272072756, 0.006332280129008774)
