2026-06-17 09:23:59,106 - optuna.study.study - INFO - Trial 219 finished with values: [0.0036414966646452595, 0.0013009978527219908, 0.002390790769484586] and parameters: {'n_layers': 1, 'embedding_dim': 64, 'lr': 0.024484365885130848, 'lambda_val': 1.939208364293098e-05, 'batch_size': 3266, 'optimizer': 'RMSprop'}.
2026-06-17 09:24:26,354 - experiment_functions - INFO - Early stopping at epoch 550. Best Metrics: (0.0035208583709761708, 0.001480990274093722, 0.002594196295410777)
2026-06-17 09:24:26,428 - optuna.study.study - INFO - Trial 220 finished with values: [0.0035208583709761708, 0.001480990274093722, 0.002594196295410777] and parameters: {'n_layers': 1, 'embedding_dim': 256, 'lr': 0.003877789258066795, 'lambda_val': 6.872101199763191e-06, 'batch_size': 1921, 'optimizer': 'Adam'}.
2026-06-17 09:24:52,511 - experiment_functions - INFO - Early stopping at epoch 550. Best Metrics: (0.0031904885520927444, 0.0014367816091954023, 0.0024755091423409223)
2026-06-17 09:24:52,594 - optuna.study.study - INFO - Trial 221 finished with values: [0.0031904885520927444, 0.0014367816091954023, 0.0024755091423409223] and parameters: {'n_layers': 1, 'embedding_dim': 128, 'lr': 0.003877789258066795, 'lambda_val': 0.004203631833295882, 'batch_size': 2963, 'optimizer': 'Adam'}.
2026-06-17 09:25:19,924 - experiment_functions - INFO - Early stopping at epoch 600. Best Metrics: (0.0036562653743718292, 0.0014367816091954023, 0.0025833255204029573)
2026-06-17 09:25:19,994 - optuna.study.study - INFO - Trial 222 finished with values: [0.0036562653743718292, 0.0014367816091954023, 0.0025833255204029573] and parameters: {'n_layers': 1, 'embedding_dim': 64, 'lr': 0.003877789258066795, 'lambda_val': 0.00016666322755616337, 'batch_size': 2336, 'optimizer': 'Adam'}.
2026-06-17 09:25:45,829 - experiment_functions - INFO - Early stopping at epoch 550. Best Metrics: (0.0031196381372842604, 0.0011983705949223191, 0.0021250309637689895)
2026-06-17 09:25:45,905 - optuna.study.study - INFO - Trial 223 finished with values: [0.0031196381372842604, 0.0011983705949223191, 0.0021250309637689895] and parameters: {'n_layers': 2, 'embedding_dim': 96, 'lr': 0.002231043752262738, 'lambda_val': 2.2240339209313886e-06, 'batch_size': 1445, 'optimizer': 'RMSprop'}.
2026-06-17 09:26:13,021 - experiment_functions - INFO - Early stopping at epoch 600. Best Metrics: (0.0034803695901179325, 0.001387836301629405, 0.0024543367914107296)
2026-06-17 09:26:13,103 - optuna.study.study - INFO - Trial 224 finished with values: [0.0034803695901179325, 0.001387836301629405, 0.0024543367914107296] and parameters: {'n_layers': 1, 'embedding_dim': 32, 'lr': 0.002231043752262738, 'lambda_val': 6.872101199763191e-06, 'batch_size': 3410, 'optimizer': 'Adam'}.
2026-06-17 09:26:40,669 - experiment_functions - INFO - Early stopping at epoch 600. Best Metrics: (0.0039053139907003426, 0.001409940634078565, 0.0025970488021800128)
2026-06-17 09:26:40,755 - optuna.study.study - INFO - Trial 225 finished with values: [0.0039053139907003426, 0.001409940634078565, 0.0025970488021800128] and parameters: {'n_layers': 1, 'embedding_dim': 32, 'lr': 0.002231043752262738, 'lambda_val': 1.7261189135715837e-05, 'batch_size': 2669, 'optimizer': 'Adam'}.
2026-06-17 09:27:06,449 - experiment_functions - INFO - Early stopping at epoch 550. Best Metrics: (0.003721195613316341, 0.0014904635594290767, 0.0026463457299947084)
2026-06-17 09:27:07,000 - optuna.study.study - INFO - Trial 226 finished with values: [0.003721195613316341, 0.0014904635594290767, 0.0026463457299947084] and parameters: {'n_layers': 1, 'embedding_dim': 96, 'lr': 0.007822927276622295, 'lambda_val': 3.567347607875195e-06, 'batch_size': 3433, 'optimizer': 'Adam'}.
2026-06-17 09:27:35,214 - experiment_functions - INFO - Early stopping at epoch 550. Best Metrics: (0.0015793661297096137, 0.0008668056081849186, 0.001217511398588839)
2026-06-17 09:27:35,288 - optuna.study.study - INFO - Trial 227 finished with values: [0.0015793661297096137, 0.0008668056081849186, 0.001217511398588839] and parameters: {'n_layers': 2, 'embedding_dim': 256, 'lr': 0.0008016533232615897, 'lambda_val': 0.025685405239370625, 'batch_size': 1833, 'optimizer': 'RMSprop'}.
2026-06-17 09:28:00,898 - experiment_functions - INFO - Early stopping at epoch 550. Best Metrics: (0.0034768586008634404, 0.0013088922571681193, 0.002196937003576289)
2026-06-17 09:28:00,962 - optuna.study.study - INFO - Trial 228 finished with values: [0.0034768586008634404, 0.0013088922571681193, 0.002196937003576289] and parameters: {'n_layers': 1, 'embedding_dim': 96, 'lr': 0.005679313965665691, 'lambda_val': 1.614895584100367e-06, 'batch_size': 2685, 'optimizer': 'RMSprop'}.
2026-06-17 09:28:26,044 - experiment_functions - INFO - Early stopping at epoch 550. Best Metrics: (0.003315775549086395, 0.0013404698749526337, 0.002283884266662886)
2026-06-17 09:28:26,122 - optuna.study.study - INFO - Trial 229 finished with values: [0.003315775549086395, 0.0013404698749526337, 0.002283884266662886] and parameters: {'n_layers': 1, 'embedding_dim': 32, 'lr': 0.002231043752262738, 'lambda_val': 0.0008779351755019496, 'batch_size': 2191, 'optimizer': 'RMSprop'}.
2026-06-17 09:28:51,974 - experiment_functions - INFO - Early stopping at epoch 550. Best Metrics: (0.0035989973644906955, 0.0014794113932044964, 0.0026222840766742537)
2026-06-17 09:28:52,109 - optuna.study.study - INFO - Trial 230 finished with values: [0.0035989973644906955, 0.0014794113932044964, 0.0026222840766742537] and parameters: {'n_layers': 1, 'embedding_dim': 96, 'lr': 0.004595237871810009, 'lambda_val': 0.0024733449146701184, 'batch_size': 3433, 'optimizer': 'Adam'}.
2026-06-17 09:29:17,587 - experiment_functions - INFO - Early stopping at epoch 550. Best Metrics: (0.0037147136525227894, 0.001450991537198434, 0.002545522308869286)
2026-06-17 09:29:17,666 - optuna.study.study - INFO - Trial 231 finished with values: [0.0037147136525227894, 0.001450991537198434, 0.002545522308869286] and parameters: {'n_layers': 1, 'embedding_dim': 32, 'lr': 0.010203021680640975, 'lambda_val': 1.7261189135715837e-05, 'batch_size': 2685, 'optimizer': 'Adam'}.
2026-06-17 09:29:51,165 - experiment_functions - INFO - Early stopping at epoch 750. Best Metrics: (0.0034264529257911386, 0.0014320449665277252, 0.002481992817073427)
2026-06-17 09:29:51,252 - optuna.study.study - INFO - Trial 232 finished with values: [0.0034264529257911386, 0.0014320449665277252, 0.002481992817073427] and parameters: {'n_layers': 1, 'embedding_dim': 64, 'lr': 0.0011453432792901683, 'lambda_val': 1.031526593103832e-05, 'batch_size': 2572, 'optimizer': 'Adam'}.
2026-06-17 09:30:21,506 - experiment_functions - INFO - Early stopping at epoch 600. Best Metrics: (0.0034233179597021783, 0.0014209928003031454, 0.002405485073317378)
2026-06-17 09:30:21,583 - optuna.study.study - INFO - Trial 233 finished with values: [0.0034233179597021783, 0.0014209928003031454, 0.002405485073317378] and parameters: {'n_layers': 1, 'embedding_dim': 64, 'lr': 0.001121895106789757, 'lambda_val': 1.5216807094072505e-05, 'batch_size': 1753, 'optimizer': 'RMSprop'}.
2026-06-17 09:31:27,401 - experiment_functions - INFO - Early stopping at epoch 1550. Best Metrics: (0.0036343317856857463, 0.0014573070607553369, 0.0024678301717340942)
2026-06-17 09:31:27,480 - optuna.study.study - INFO - Trial 234 finished with values: [0.0036343317856857463, 0.0014573070607553369, 0.0024678301717340942] and parameters: {'n_layers': 1, 'embedding_dim': 32, 'lr': 0.0004860515181398459, 'lambda_val': 0.007692244890670793, 'batch_size': 965, 'optimizer': 'Adam'}.
2026-06-17 09:31:52,790 - experiment_functions - INFO - Early stopping at epoch 550. Best Metrics: (0.003321088066889835, 0.0012915245673866364, 0.002223615993094473)
2026-06-17 09:31:52,872 - optuna.study.study - INFO - Trial 235 finished with values: [0.003321088066889835, 0.0012915245673866364, 0.002223615993094473] and parameters: {'n_layers': 2, 'embedding_dim': 32, 'lr': 0.004595237871810009, 'lambda_val': 1.172583085860086e-05, 'batch_size': 1434, 'optimizer': 'Adam'}.
2026-06-17 09:32:18,550 - experiment_functions - INFO - Early stopping at epoch 550. Best Metrics: (0.0016420258454763934, 0.0006615510925855754, 0.001101570353128203)
2026-06-17 09:32:18,645 - optuna.study.study - INFO - Trial 236 finished with values: [0.0016420258454763934, 0.0006615510925855754, 0.001101570353128203] and parameters: {'n_layers': 1, 'embedding_dim': 128, 'lr': 0.007822927276622295, 'lambda_val': 0.02125092632723481, 'batch_size': 2685, 'optimizer': 'RMSprop'}.
2026-06-17 09:35:06,188 - experiment_functions - INFO - Early stopping at epoch 3800. Best Metrics: (0.003412574838755267, 0.0010894278135657447, 0.0021877864036471545)
2026-06-17 09:35:06,263 - optuna.study.study - INFO - Trial 237 finished with values: [0.003412574838755267, 0.0010894278135657447, 0.0021877864036471545] and parameters: {'n_layers': 2, 'embedding_dim': 128, 'lr': 0.024484365885130848, 'lambda_val': 6.872101199763191e-06, 'batch_size': 3410, 'optimizer': 'Adam'}.
2026-06-17 09:35:40,165 - experiment_functions - INFO - Early stopping at epoch 750. Best Metrics: (0.0037223776123763, 0.0014320449665277252, 0.0025905316080159085)
2026-06-17 09:35:40,235 - optuna.study.study - INFO - Trial 238 finished with values: [0.0037223776123763, 0.0014320449665277252, 0.0025905316080159085] and parameters: {'n_layers': 1, 'embedding_dim': 64, 'lr': 0.0011453432792901683, 'lambda_val': 1.031526593103832e-05, 'batch_size': 2572, 'optimizer': 'Adam'}.
2026-06-17 09:37:07,225 - experiment_functions - INFO - Early stopping at epoch 1650. Best Metrics: (0.0027598094581894822, 0.0010641657193381333, 0.0018390088952131272)
2026-06-17 09:37:07,322 - optuna.study.study - INFO - Trial 239 finished with values: [0.0027598094581894822, 0.0010641657193381333, 0.0018390088952131272] and parameters: {'n_layers': 4, 'embedding_dim': 256, 'lr': 0.00019218459721774152, 'lambda_val': 1.561244993279661e-06, 'batch_size': 3410, 'optimizer': 'Adam'}.
2026-06-17 09:37:34,699 - experiment_functions - INFO - Early stopping at epoch 600. Best Metrics: (0.0033703348231064884, 0.0013957307060755337, 0.0023689592033368984)
2026-06-17 09:37:34,771 - optuna.study.study - INFO - Trial 240 finished with values: [0.0033703348231064884, 0.0013957307060755337, 0.0023689592033368984] and parameters: {'n_layers': 1, 'embedding_dim': 64, 'lr': 0.0013845651414428515, 'lambda_val': 3.687778248139709e-05, 'batch_size': 1599, 'optimizer': 'RMSprop'}.
2026-06-17 09:38:00,700 - experiment_functions - INFO - Early stopping at epoch 550. Best Metrics: (0.0033870291204867583, 0.0012836301629405079, 0.002290296903436636)
2026-06-17 09:38:01,025 - optuna.study.study - INFO - Trial 241 finished with values: [0.0033870291204867583, 0.0012836301629405079, 0.002290296903436636] and parameters: {'n_layers': 1, 'embedding_dim': 128, 'lr': 0.002231043752262738, 'lambda_val': 6.872101199763191e-06, 'batch_size': 1921, 'optimizer': 'RMSprop'}.
2026-06-17 09:38:26,424 - experiment_functions - INFO - Early stopping at epoch 550. Best Metrics: (0.0036145988808154676, 0.0012425792598206391, 0.0023016045295244556)
2026-06-17 09:38:26,501 - optuna.study.study - INFO - Trial 242 finished with values: [0.0036145988808154676, 0.0012425792598206391, 0.0023016045295244556] and parameters: {'n_layers': 1, 'embedding_dim': 64, 'lr': 0.004595237871810009, 'lambda_val': 3.125135396462488e-05, 'batch_size': 3266, 'optimizer': 'RMSprop'}.
2026-06-17 09:38:56,406 - experiment_functions - INFO - Early stopping at epoch 650. Best Metrics: (0.0037118326029318854, 0.0014936213212075283, 0.0025776402440445246)
2026-06-17 09:38:56,493 - optuna.study.study - INFO - Trial 243 finished with values: [0.0037118326029318854, 0.0014936213212075283, 0.0025776402440445246] and parameters: {'n_layers': 1, 'embedding_dim': 96, 'lr': 0.0019791454040792144, 'lambda_val': 0.00016666322755616337, 'batch_size': 1310, 'optimizer': 'Adam'}.
2026-06-17 09:40:21,628 - experiment_functions - INFO - Early stopping at epoch 2000. Best Metrics: (0.0038550254944748363, 0.0012946823291650879, 0.0024324343276991294)
2026-06-17 09:40:21,705 - optuna.study.study - INFO - Trial 244 finished with values: [0.0038550254944748363, 0.0012946823291650879, 0.0024324343276991294] and parameters: {'n_layers': 1, 'embedding_dim': 64, 'lr': 0.024484365885130848, 'lambda_val': 6.872101199763191e-06, 'batch_size': 3266, 'optimizer': 'RMSprop'}.
2026-06-17 09:40:44,936 - experiment_functions - INFO - Early stopping at epoch 500. Best Metrics: (0.0005793118880236439, 0.00012157382847038021, 0.0003353170840535897)
2026-06-17 09:40:45,026 - optuna.study.study - INFO - Trial 245 finished with values: [0.0005793118880236439, 0.00012157382847038021, 0.0003353170840535897] and parameters: {'n_layers': 1, 'embedding_dim': 96, 'lr': 0.024484365885130848, 'lambda_val': 9.865883859359147e-06, 'batch_size': 3433, 'optimizer': 'SGD'}.
2026-06-17 09:41:46,352 - experiment_functions - INFO - Early stopping at epoch 1400. Best Metrics: (0.00329450530848776, 0.0014083617531893396, 0.0024107930773517336)
2026-06-17 09:41:46,455 - optuna.study.study - INFO - Trial 246 finished with values: [0.00329450530848776, 0.0014083617531893396, 0.0024107930773517336] and parameters: {'n_layers': 1, 'embedding_dim': 96, 'lr': 0.00039174090758620656, 'lambda_val': 6.872101199763191e-06, 'batch_size': 2433, 'optimizer': 'Adam'}.
2026-06-17 09:42:18,011 - experiment_functions - INFO - Early stopping at epoch 700. Best Metrics: (0.0025222159455889695, 0.0009789061513199445, 0.0017077645846813663)
2026-06-17 09:42:18,094 - optuna.study.study - INFO - Trial 247 finished with values: [0.0025222159455889695, 0.0009789061513199445, 0.0017077645846813663] and parameters: {'n_layers': 3, 'embedding_dim': 32, 'lr': 0.024484365885130848, 'lambda_val': 8.772950774742199e-06, 'batch_size': 2433, 'optimizer': 'RMSprop'}.
2026-06-17 09:42:44,482 - experiment_functions - INFO - Early stopping at epoch 550. Best Metrics: (0.002457436813190453, 0.0009678539850953645, 0.001696006455310363)
2026-06-17 09:42:44,569 - optuna.study.study - INFO - Trial 248 finished with values: [0.002457436813190453, 0.0009678539850953645, 0.001696006455310363] and parameters: {'n_layers': 3, 'embedding_dim': 96, 'lr': 0.007822927276622295, 'lambda_val': 3.567347607875195e-06, 'batch_size': 3433, 'optimizer': 'RMSprop'}.
2026-06-17 09:43:11,474 - experiment_functions - INFO - Early stopping at epoch 600. Best Metrics: (0.00045805758277877586, 0.00011525830491347733, 0.00025581440504140974)
2026-06-17 09:43:11,560 - optuna.study.study - INFO - Trial 249 finished with values: [0.00045805758277877586, 0.00011525830491347733, 0.00025581440504140974] and parameters: {'n_layers': 1, 'embedding_dim': 64, 'lr': 1.2491579843699801e-05, 'lambda_val': 3.567347607875195e-06, 'batch_size': 3433, 'optimizer': 'RMSprop'}.
2026-06-17 09:43:51,262 - experiment_functions - INFO - Early stopping at epoch 900. Best Metrics: (0.0037201506111835076, 0.0010673234811165847, 0.002248955815249877)
2026-06-17 09:43:51,333 - optuna.study.study - INFO - Trial 250 finished with values: [0.0037201506111835076, 0.0010673234811165847, 0.002248955815249877] and parameters: {'n_layers': 1, 'embedding_dim': 64, 'lr': 0.046129598836200957, 'lambda_val': 6.872101199763191e-06, 'batch_size': 1535, 'optimizer': 'RMSprop'}.
2026-06-17 09:44:19,022 - experiment_functions - INFO - Early stopping at epoch 550. Best Metrics: (0.0031598380883192012, 0.001447833775419982, 0.0023903324938507682)
2026-06-17 09:44:19,098 - optuna.study.study - INFO - Trial 251 finished with values: [0.0031598380883192012, 0.001447833775419982, 0.0023903324938507682] and parameters: {'n_layers': 1, 'embedding_dim': 256, 'lr': 0.003877789258066795, 'lambda_val': 5.2927329941475195e-06, 'batch_size': 1921, 'optimizer': 'Adam'}.
2026-06-17 09:45:20,812 - experiment_functions - INFO - Early stopping at epoch 1450. Best Metrics: (0.0035985794002893145, 0.0012536314260452193, 0.0023184951139345435)
2026-06-17 09:45:20,877 - optuna.study.study - INFO - Trial 252 finished with values: [0.0035985794002893145, 0.0012536314260452193, 0.0023184951139345435] and parameters: {'n_layers': 1, 'embedding_dim': 32, 'lr': 0.024484365885130848, 'lambda_val': 6.872101199763191e-06, 'batch_size': 3266, 'optimizer': 'RMSprop'}.
2026-06-17 09:45:55,017 - experiment_functions - INFO - Early stopping at epoch 750. Best Metrics: (0.0033982061583260055, 0.0012252115700391564, 0.0022190755301086645)
2026-06-17 09:45:55,125 - optuna.study.study - INFO - Trial 253 finished with values: [0.0033982061583260055, 0.0012252115700391564, 0.0022190755301086645] and parameters: {'n_layers': 1, 'embedding_dim': 96, 'lr': 0.03980324378757048, 'lambda_val': 1.7261189135715837e-05, 'batch_size': 1576, 'optimizer': 'Adam'}.
2026-06-17 09:46:20,331 - experiment_functions - INFO - Early stopping at epoch 550. Best Metrics: (0.0032399071471853062, 0.001204686118479222, 0.0021792044912231742)
2026-06-17 09:46:20,441 - optuna.study.study - INFO - Trial 254 finished with values: [0.0032399071471853062, 0.001204686118479222, 0.0021792044912231742] and parameters: {'n_layers': 1, 'embedding_dim': 64, 'lr': 0.006197456861489478, 'lambda_val': 0.00016666322755616337, 'batch_size': 2336, 'optimizer': 'RMSprop'}.
2026-06-17 09:47:01,831 - experiment_functions - INFO - Early stopping at epoch 950. Best Metrics: (0.0035464776197306302, 0.0014320449665277252, 0.002487956934403235)
2026-06-17 09:47:01,904 - optuna.study.study - INFO - Trial 255 finished with values: [0.0035464776197306302, 0.0014320449665277252, 0.002487956934403235] and parameters: {'n_layers': 1, 'embedding_dim': 64, 'lr': 0.0004860515181398459, 'lambda_val': 3.567347607875195e-06, 'batch_size': 3433, 'optimizer': 'RMSprop'}.
2026-06-17 09:47:27,060 - experiment_functions - INFO - Early stopping at epoch 550. Best Metrics: (0.003471387461505226, 0.0013404698749526335, 0.00227755439616193)
2026-06-17 09:47:27,147 - optuna.study.study - INFO - Trial 256 finished with values: [0.003471387461505226, 0.0013404698749526335, 0.00227755439616193] and parameters: {'n_layers': 1, 'embedding_dim': 32, 'lr': 0.004595237871810009, 'lambda_val': 0.0024733449146701184, 'batch_size': 2935, 'optimizer': 'Adam'}.
2026-06-17 09:47:54,291 - experiment_functions - INFO - Early stopping at epoch 600. Best Metrics: (0.0037146031816810243, 0.001378363016294051, 0.002515906505956866)
2026-06-17 09:47:54,364 - optuna.study.study - INFO - Trial 257 finished with values: [0.0037146031816810243, 0.001378363016294051, 0.002515906505956866] and parameters: {'n_layers': 1, 'embedding_dim': 32, 'lr': 0.002231043752262738, 'lambda_val': 1.3052788411163826e-06, 'batch_size': 3296, 'optimizer': 'Adam'}.
2026-06-17 09:48:20,608 - experiment_functions - INFO - Early stopping at epoch 550. Best Metrics: (0.002794533578243137, 0.0010231148162182647, 0.0017785344831348147)
2026-06-17 09:48:20,690 - optuna.study.study - INFO - Trial 258 finished with values: [0.002794533578243137, 0.0010231148162182647, 0.0017785344831348147] and parameters: {'n_layers': 3, 'embedding_dim': 96, 'lr': 0.024484365885130848, 'lambda_val': 6.872101199763191e-06, 'batch_size': 3823, 'optimizer': 'Adam'}.
2026-06-17 09:48:48,173 - experiment_functions - INFO - Early stopping at epoch 600. Best Metrics: (0.00335897469220975, 0.0013815207780725023, 0.002427765346876799)
2026-06-17 09:48:48,265 - optuna.study.study - INFO - Trial 259 finished with values: [0.00335897469220975, 0.0013815207780725023, 0.002427765346876799] and parameters: {'n_layers': 1, 'embedding_dim': 96, 'lr': 0.0011453432792901683, 'lambda_val': 1.031526593103832e-05, 'batch_size': 2763, 'optimizer': 'RMSprop'}.
2026-06-17 09:49:13,569 - experiment_functions - INFO - Early stopping at epoch 550. Best Metrics: (0.0028378876910898714, 0.0011020588606795506, 0.0018730716753468774)
2026-06-17 09:49:13,652 - optuna.study.study - INFO - Trial 260 finished with values: [0.0028378876910898714, 0.0011020588606795506, 0.0018730716753468774] and parameters: {'n_layers': 4, 'embedding_dim': 32, 'lr': 0.003877789258066795, 'lambda_val': 0.011920864703403184, 'batch_size': 2759, 'optimizer': 'Adam'}.
2026-06-17 09:49:39,073 - experiment_functions - INFO - Early stopping at epoch 550. Best Metrics: (0.0033149940334955903, 0.0014478337754199825, 0.0023927489431486543)
2026-06-17 09:49:39,355 - optuna.study.study - INFO - Trial 261 finished with values: [0.0033149940334955903, 0.0014478337754199825, 0.0023927489431486543] and parameters: {'n_layers': 1, 'embedding_dim': 96, 'lr': 0.007822927276622295, 'lambda_val': 5.2927329941475195e-06, 'batch_size': 2685, 'optimizer': 'Adam'}.
2026-06-17 09:50:13,973 - experiment_functions - INFO - Early stopping at epoch 750. Best Metrics: (0.0005510564310530584, 0.00012946823291650877, 0.0003078129726299153)
2026-06-17 09:50:14,061 - optuna.study.study - INFO - Trial 262 finished with values: [0.0005510564310530584, 0.00012946823291650877, 0.0003078129726299153] and parameters: {'n_layers': 3, 'embedding_dim': 96, 'lr': 1.7750055195676027e-05, 'lambda_val': 2.4817340791419583e-05, 'batch_size': 2116, 'optimizer': 'Adam'}.
2026-06-17 09:50:41,834 - experiment_functions - INFO - Early stopping at epoch 600. Best Metrics: (0.003782030771242112, 0.0014509915371984337, 0.002581834173900028)
2026-06-17 09:50:41,919 - optuna.study.study - INFO - Trial 263 finished with values: [0.003782030771242112, 0.0014509915371984337, 0.002581834173900028] and parameters: {'n_layers': 1, 'embedding_dim': 96, 'lr': 0.003877789258066795, 'lambda_val': 0.00016666322755616337, 'batch_size': 2336, 'optimizer': 'Adam'}.
2026-06-17 09:51:07,174 - experiment_functions - INFO - Early stopping at epoch 550. Best Metrics: (0.004017268199981679, 0.0015330933434381713, 0.0027902415060771252)
