2026-06-22 05:00:47,774 - optuna.study.study - INFO - Trial 101 finished with values: [0.014571410402074833, 0.0032761778451433623, 0.00843659528330781] and parameters: {'n_layers': 3, 'embedding_dim': 64, 'lr': 0.00011710757927899564, 'lambda_val': 0.0005660338072478805, 'batch_size': 2362, 'optimizer': 'RMSprop'}.
2026-06-22 05:02:41,790 - experiment_functions - INFO - Early stopping at epoch 2500. Best Metrics: (0.008534554334434554, 0.0017588733105974486, 0.004589611680346707)
2026-06-22 05:02:41,874 - optuna.study.study - INFO - Trial 102 finished with values: [0.008534554334434554, 0.0017588733105974486, 0.004589611680346707] and parameters: {'n_layers': 2, 'embedding_dim': 96, 'lr': 0.02006245051562491, 'lambda_val': 0.02301034856049595, 'batch_size': 3046, 'optimizer': 'Adam'}.
2026-06-22 05:03:07,638 - experiment_functions - INFO - Early stopping at epoch 500. Best Metrics: (0.006219104244947136, 0.0014304660856384994, 0.0037647617169847564)
2026-06-22 05:03:07,726 - optuna.study.study - INFO - Trial 103 finished with values: [0.006219104244947136, 0.0014304660856384994, 0.0037647617169847564] and parameters: {'n_layers': 3, 'embedding_dim': 96, 'lr': 0.04552920788730844, 'lambda_val': 0.015318144701989713, 'batch_size': 2618, 'optimizer': 'RMSprop'}.
2026-06-22 05:06:39,826 - optuna.study.study - INFO - Trial 104 finished with values: [0.005926301568526232, 0.0014636225843122396, 0.003391505814175712] and parameters: {'n_layers': 4, 'embedding_dim': 128, 'lr': 9.488295560625263e-05, 'lambda_val': 0.024891172553509516, 'batch_size': 2524, 'optimizer': 'Adam'}.
2026-06-22 05:07:15,932 - experiment_functions - INFO - Early stopping at epoch 800. Best Metrics: (0.02210750866882177, 0.0044113932044966536, 0.011933843048651657)
2026-06-22 05:07:16,014 - optuna.study.study - INFO - Trial 105 finished with values: [0.02210750866882177, 0.0044113932044966536, 0.011933843048651657] and parameters: {'n_layers': 1, 'embedding_dim': 64, 'lr': 0.0038079716278558275, 'lambda_val': 4.215648076351537e-06, 'batch_size': 2655, 'optimizer': 'RMSprop'}.
2026-06-22 05:07:42,721 - experiment_functions - INFO - Early stopping at epoch 550. Best Metrics: (0.00985993071108723, 0.001957812302639889, 0.005395606177306879)
2026-06-22 05:07:42,972 - optuna.study.study - INFO - Trial 106 finished with values: [0.00985993071108723, 0.001957812302639889, 0.005395606177306879] and parameters: {'n_layers': 3, 'embedding_dim': 64, 'lr': 0.02301165354346074, 'lambda_val': 0.0010893975331714692, 'batch_size': 557, 'optimizer': 'Adam'}.
2026-06-22 05:09:02,440 - experiment_functions - INFO - Early stopping at epoch 1550. Best Metrics: (0.021612906345349223, 0.004765062523683214, 0.012085224312959438)
2026-06-22 05:09:02,508 - optuna.study.study - INFO - Trial 107 finished with values: [0.021612906345349223, 0.004765062523683214, 0.012085224312959438] and parameters: {'n_layers': 4, 'embedding_dim': 96, 'lr': 0.0004249111472269399, 'lambda_val': 9.580805901998717e-05, 'batch_size': 2362, 'optimizer': 'Adam'}.
2026-06-22 05:10:03,458 - experiment_functions - INFO - Early stopping at epoch 1300. Best Metrics: (0.024717616213589956, 0.005353985095364405, 0.013981026419331313)
2026-06-22 05:10:03,527 - optuna.study.study - INFO - Trial 108 finished with values: [0.024717616213589956, 0.005353985095364405, 0.013981026419331313] and parameters: {'n_layers': 3, 'embedding_dim': 64, 'lr': 0.0004249111472269399, 'lambda_val': 0.000442118077500333, 'batch_size': 3046, 'optimizer': 'RMSprop'}.
2026-06-22 05:13:03,320 - optuna.study.study - INFO - Trial 109 finished with values: [0.03337711662756974, 0.007122331691297209, 0.01906817281266908] and parameters: {'n_layers': 1, 'embedding_dim': 128, 'lr': 0.0004249111472269399, 'lambda_val': 9.580805901998717e-05, 'batch_size': 2524, 'optimizer': 'Adam'}.
2026-06-22 05:15:52,222 - optuna.study.study - INFO - Trial 110 finished with values: [0.02618317685883712, 0.0056366047745358095, 0.014903061524419782] and parameters: {'n_layers': 2, 'embedding_dim': 32, 'lr': 0.00025949794187037214, 'lambda_val': 0.0001132240545098155, 'batch_size': 4064, 'optimizer': 'RMSprop'}.
2026-06-22 05:16:30,195 - experiment_functions - INFO - Early stopping at epoch 800. Best Metrics: (0.016451779165040266, 0.003543008715422509, 0.008906158397748564)
2026-06-22 05:16:30,280 - optuna.study.study - INFO - Trial 111 finished with values: [0.016451779165040266, 0.003543008715422509, 0.008906158397748564] and parameters: {'n_layers': 3, 'embedding_dim': 64, 'lr': 0.0012653624571519182, 'lambda_val': 5.867428769760123e-05, 'batch_size': 2362, 'optimizer': 'RMSprop'}.
2026-06-22 05:19:17,144 - experiment_functions - INFO - Early stopping at epoch 3850. Best Metrics: (0.01845298768713459, 0.0037877352532524945, 0.009944796802719874)
2026-06-22 05:19:17,240 - optuna.study.study - INFO - Trial 112 finished with values: [0.01845298768713459, 0.0037877352532524945, 0.009944796802719874] and parameters: {'n_layers': 2, 'embedding_dim': 64, 'lr': 0.0013289914858578777, 'lambda_val': 1.344948355534323e-06, 'batch_size': 1122, 'optimizer': 'RMSprop'}.
2026-06-22 05:19:44,657 - experiment_functions - INFO - Early stopping at epoch 600. Best Metrics: (0.023922865333985726, 0.005025577870405457, 0.013595215991724356)
2026-06-22 05:19:44,752 - optuna.study.study - INFO - Trial 113 finished with values: [0.023922865333985726, 0.005025577870405457, 0.013595215991724356] and parameters: {'n_layers': 2, 'embedding_dim': 32, 'lr': 0.003943344366916346, 'lambda_val': 0.0020559457467967724, 'batch_size': 3224, 'optimizer': 'Adam'}.
2026-06-22 05:20:41,246 - experiment_functions - INFO - Early stopping at epoch 1200. Best Metrics: (0.014544814679126552, 0.0033898572691676144, 0.008445554865812301)
2026-06-22 05:20:41,330 - optuna.study.study - INFO - Trial 114 finished with values: [0.014544814679126552, 0.0033898572691676144, 0.008445554865812301] and parameters: {'n_layers': 2, 'embedding_dim': 96, 'lr': 0.0004249111472269399, 'lambda_val': 0.02301034856049595, 'batch_size': 2362, 'optimizer': 'RMSprop'}.
2026-06-22 05:23:27,980 - optuna.study.study - INFO - Trial 115 finished with values: [0.014223075295125953, 0.0032082859669066563, 0.0083789416547603] and parameters: {'n_layers': 2, 'embedding_dim': 32, 'lr': 0.0001659733154867732, 'lambda_val': 0.0020559457467967724, 'batch_size': 2901, 'optimizer': 'Adam'}.
2026-06-22 05:24:42,634 - experiment_functions - INFO - Early stopping at epoch 1600. Best Metrics: (0.014017744362827362, 0.0033045977011494257, 0.00805401810555071)
2026-06-22 05:24:42,725 - optuna.study.study - INFO - Trial 116 finished with values: [0.014017744362827362, 0.0033045977011494257, 0.00805401810555071] and parameters: {'n_layers': 2, 'embedding_dim': 96, 'lr': 0.0004249111472269399, 'lambda_val': 0.02949902579915782, 'batch_size': 1027, 'optimizer': 'RMSprop'}.
2026-06-22 05:25:59,066 - experiment_functions - INFO - Early stopping at epoch 1700. Best Metrics: (0.018328965844698644, 0.0037908930150309466, 0.010165644642781723)
2026-06-22 05:25:59,143 - optuna.study.study - INFO - Trial 117 finished with values: [0.018328965844698644, 0.0037908930150309466, 0.010165644642781723] and parameters: {'n_layers': 2, 'embedding_dim': 64, 'lr': 0.0015973413467103624, 'lambda_val': 2.8235990387407672e-06, 'batch_size': 2784, 'optimizer': 'RMSprop'}.
2026-06-22 05:26:54,345 - experiment_functions - INFO - Early stopping at epoch 1200. Best Metrics: (0.022935254025947982, 0.004872426424150563, 0.01312878206921587)
2026-06-22 05:26:54,412 - optuna.study.study - INFO - Trial 118 finished with values: [0.022935254025947982, 0.004872426424150563, 0.01312878206921587] and parameters: {'n_layers': 2, 'embedding_dim': 64, 'lr': 0.0009385206853318974, 'lambda_val': 5.867428769760123e-05, 'batch_size': 3046, 'optimizer': 'RMSprop'}.
2026-06-22 05:27:33,096 - experiment_functions - INFO - Early stopping at epoch 750. Best Metrics: (0.013504359841641818, 0.002725148414803587, 0.00727448465247611)
2026-06-22 05:27:33,360 - optuna.study.study - INFO - Trial 119 finished with values: [0.013504359841641818, 0.002725148414803587, 0.00727448465247611] and parameters: {'n_layers': 3, 'embedding_dim': 96, 'lr': 0.01363223904917348, 'lambda_val': 4.885662670603182e-05, 'batch_size': 2618, 'optimizer': 'Adam'}.
2026-06-22 05:29:07,551 - experiment_functions - INFO - Early stopping at epoch 2050. Best Metrics: (0.027513730612105543, 0.005698181129215612, 0.015320752510843225)
2026-06-22 05:29:07,638 - optuna.study.study - INFO - Trial 120 finished with values: [0.027513730612105543, 0.005698181129215612, 0.015320752510843225] and parameters: {'n_layers': 1, 'embedding_dim': 128, 'lr': 0.0015973413467103624, 'lambda_val': 2.5805202056832215e-06, 'batch_size': 1295, 'optimizer': 'RMSprop'}.
2026-06-22 05:31:24,918 - experiment_functions - INFO - Early stopping at epoch 3250. Best Metrics: (0.024870937468348578, 0.0055039787798408495, 0.014030152235836611)
2026-06-22 05:31:24,998 - optuna.study.study - INFO - Trial 121 finished with values: [0.024870937468348578, 0.0055039787798408495, 0.014030152235836611] and parameters: {'n_layers': 2, 'embedding_dim': 32, 'lr': 0.0003047708778242714, 'lambda_val': 0.010343205800368207, 'batch_size': 1638, 'optimizer': 'RMSprop'}.
2026-06-22 05:32:06,445 - experiment_functions - INFO - Early stopping at epoch 900. Best Metrics: (0.02903881717008637, 0.005944486547934824, 0.01590328703594424)
2026-06-22 05:32:06,517 - optuna.study.study - INFO - Trial 122 finished with values: [0.02903881717008637, 0.005944486547934824, 0.01590328703594424] and parameters: {'n_layers': 1, 'embedding_dim': 96, 'lr': 0.0015973413467103624, 'lambda_val': 5.867428769760123e-05, 'batch_size': 2362, 'optimizer': 'RMSprop'}.
2026-06-22 05:34:46,714 - optuna.study.study - INFO - Trial 123 finished with values: [0.008623107345091217, 0.002017809776430466, 0.0051828427178453795] and parameters: {'n_layers': 1, 'embedding_dim': 32, 'lr': 0.00037811925768249915, 'lambda_val': 1.4778727863286488e-06, 'batch_size': 926, 'optimizer': 'Adam'}.
2026-06-22 05:35:22,610 - experiment_functions - INFO - Early stopping at epoch 700. Best Metrics: (0.02758372010980138, 0.005691865605658709, 0.015759042571453764)
2026-06-22 05:35:22,991 - optuna.study.study - INFO - Trial 124 finished with values: [0.02758372010980138, 0.005691865605658709, 0.015759042571453764] and parameters: {'n_layers': 2, 'embedding_dim': 128, 'lr': 0.001367505758136406, 'lambda_val': 4.017786575271443e-05, 'batch_size': 2006, 'optimizer': 'Adam'}.
2026-06-22 05:36:29,362 - experiment_functions - INFO - Early stopping at epoch 1400. Best Metrics: (0.030086480214052098, 0.006361311102690412, 0.01733261321205493)
2026-06-22 05:36:29,442 - optuna.study.study - INFO - Trial 125 finished with values: [0.030086480214052098, 0.006361311102690412, 0.01733261321205493] and parameters: {'n_layers': 2, 'embedding_dim': 96, 'lr': 0.0004249111472269399, 'lambda_val': 0.000442118077500333, 'batch_size': 2113, 'optimizer': 'RMSprop'}.
2026-06-22 05:37:02,284 - experiment_functions - INFO - Early stopping at epoch 550. Best Metrics: (0.012700114932576083, 0.0028167235063786787, 0.007149561623160779)
2026-06-22 05:37:02,371 - optuna.study.study - INFO - Trial 126 finished with values: [0.012700114932576083, 0.0028167235063786787, 0.007149561623160779] and parameters: {'n_layers': 2, 'embedding_dim': 256, 'lr': 0.00945250774877286, 'lambda_val': 0.0005857689247732319, 'batch_size': 1472, 'optimizer': 'RMSprop'}.
2026-06-22 05:37:43,192 - experiment_functions - INFO - Early stopping at epoch 850. Best Metrics: (0.018114657538300234, 0.00408772262220538, 0.010064179372956329)
2026-06-22 05:37:43,270 - optuna.study.study - INFO - Trial 127 finished with values: [0.018114657538300234, 0.00408772262220538, 0.010064179372956329] and parameters: {'n_layers': 2, 'embedding_dim': 96, 'lr': 0.0004249111472269399, 'lambda_val': 0.01412042339566143, 'batch_size': 3484, 'optimizer': 'RMSprop'}.
2026-06-22 05:38:08,653 - experiment_functions - INFO - Early stopping at epoch 550. Best Metrics: (0.023636323838297085, 0.0048440065681445, 0.012817855766658158)
2026-06-22 05:38:08,741 - optuna.study.study - INFO - Trial 128 finished with values: [0.023636323838297085, 0.0048440065681445, 0.012817855766658158] and parameters: {'n_layers': 2, 'embedding_dim': 32, 'lr': 0.005023945861716535, 'lambda_val': 6.3531732661047e-05, 'batch_size': 4064, 'optimizer': 'Adam'}.
2026-06-22 05:40:51,144 - experiment_functions - INFO - Early stopping at epoch 3650. Best Metrics: (0.03055239842689016, 0.006607616521409625, 0.01717458854425577)
2026-06-22 05:40:51,256 - optuna.study.study - INFO - Trial 129 finished with values: [0.03055239842689016, 0.006607616521409625, 0.01717458854425577] and parameters: {'n_layers': 2, 'embedding_dim': 64, 'lr': 0.0004249111472269399, 'lambda_val': 8.803132640891692e-06, 'batch_size': 930, 'optimizer': 'Adam'}.
2026-06-22 05:41:30,865 - experiment_functions - INFO - Early stopping at epoch 550. Best Metrics: (0.011650498415991535, 0.0024646330680813443, 0.0063202655012185695)
2026-06-22 05:41:31,507 - optuna.study.study - INFO - Trial 130 finished with values: [0.011650498415991535, 0.0024646330680813443, 0.0063202655012185695] and parameters: {'n_layers': 4, 'embedding_dim': 256, 'lr': 0.0015973413467103624, 'lambda_val': 0.001073083826061835, 'batch_size': 2784, 'optimizer': 'RMSprop'}.
2026-06-22 05:42:32,581 - experiment_functions - INFO - Early stopping at epoch 950. Best Metrics: (0.015808905973516214, 0.003164077302008337, 0.008505677990214672)
2026-06-22 05:42:32,657 - optuna.study.study - INFO - Trial 131 finished with values: [0.015808905973516214, 0.003164077302008337, 0.008505677990214672] and parameters: {'n_layers': 3, 'embedding_dim': 256, 'lr': 0.005023945861716535, 'lambda_val': 1.3167003761918277e-05, 'batch_size': 3633, 'optimizer': 'Adam'}.
2026-06-22 05:45:31,326 - optuna.study.study - INFO - Trial 132 finished with values: [0.006993775812023272, 0.0016120373878994567, 0.004127180106412843] and parameters: {'n_layers': 3, 'embedding_dim': 64, 'lr': 8.66283540421921e-05, 'lambda_val': 5.867428769760123e-05, 'batch_size': 3046, 'optimizer': 'RMSprop'}.
2026-06-22 05:46:14,761 - experiment_functions - INFO - Early stopping at epoch 750. Best Metrics: (0.0005981209538372821, 0.0001310471138057345, 0.00031985324763043654)
2026-06-22 05:46:14,840 - optuna.study.study - INFO - Trial 133 finished with values: [0.0005981209538372821, 0.0001310471138057345, 0.00031985324763043654] and parameters: {'n_layers': 2, 'embedding_dim': 256, 'lr': 3.327318266602974e-05, 'lambda_val': 0.0020559457467967724, 'batch_size': 3633, 'optimizer': 'Adam'}.
2026-06-22 05:46:41,879 - experiment_functions - INFO - Early stopping at epoch 500. Best Metrics: (0.0004446544458973341, 9.789061513199445e-05, 0.00021851548469996066)
2026-06-22 05:46:41,957 - optuna.study.study - INFO - Trial 134 finished with values: [0.0004446544458973341, 9.789061513199445e-05, 0.00021851548469996066] and parameters: {'n_layers': 3, 'embedding_dim': 128, 'lr': 9.488295560625263e-05, 'lambda_val': 0.04320495686658606, 'batch_size': 2524, 'optimizer': 'RMSprop'}.
2026-06-22 05:47:08,777 - experiment_functions - INFO - Early stopping at epoch 550. Best Metrics: (0.01686135680142901, 0.00339143615005684, 0.009212082704610729)
2026-06-22 05:47:08,869 - optuna.study.study - INFO - Trial 135 finished with values: [0.01686135680142901, 0.00339143615005684, 0.009212082704610729] and parameters: {'n_layers': 1, 'embedding_dim': 128, 'lr': 0.02301165354346074, 'lambda_val': 4.017786575271443e-05, 'batch_size': 2524, 'optimizer': 'Adam'}.
2026-06-22 05:47:32,676 - experiment_functions - INFO - Early stopping at epoch 500. Best Metrics: (0.00043127110187781694, 0.00010894278135657447, 0.0002444552126010377)
2026-06-22 05:47:32,750 - optuna.study.study - INFO - Trial 136 finished with values: [0.00043127110187781694, 0.00010894278135657447, 0.0002444552126010377] and parameters: {'n_layers': 1, 'embedding_dim': 128, 'lr': 0.0017809598622910787, 'lambda_val': 3.1788205196513454e-06, 'batch_size': 2524, 'optimizer': 'SGD'}.
2026-06-22 05:48:12,597 - experiment_functions - INFO - Early stopping at epoch 700. Best Metrics: (0.015051847528858643, 0.0030361879499810535, 0.008007369809283332)
2026-06-22 05:48:12,677 - optuna.study.study - INFO - Trial 137 finished with values: [0.015051847528858643, 0.0030361879499810535, 0.008007369809283332] and parameters: {'n_layers': 4, 'embedding_dim': 128, 'lr': 0.0036404225946350165, 'lambda_val': 2.5805202056832215e-06, 'batch_size': 3314, 'optimizer': 'RMSprop'}.
2026-06-22 05:51:03,833 - optuna.study.study - INFO - Trial 138 finished with values: [0.010828783642978117, 0.0024425287356321843, 0.006221410597274647] and parameters: {'n_layers': 3, 'embedding_dim': 32, 'lr': 0.00011710757927899564, 'lambda_val': 0.0008775471778420443, 'batch_size': 3633, 'optimizer': 'RMSprop'}.
2026-06-22 05:51:27,476 - experiment_functions - INFO - Early stopping at epoch 500. Best Metrics: (0.0006093727735250454, 0.0001199949475811545, 0.0003287857901278609)
2026-06-22 05:51:27,549 - optuna.study.study - INFO - Trial 139 finished with values: [0.0006093727735250454, 0.0001199949475811545, 0.0003287857901278609] and parameters: {'n_layers': 2, 'embedding_dim': 64, 'lr': 0.0038079716278558275, 'lambda_val': 4.017786575271443e-05, 'batch_size': 4051, 'optimizer': 'SGD'}.
2026-06-22 05:52:57,099 - experiment_functions - INFO - Early stopping at epoch 1850. Best Metrics: (0.014706163254014972, 0.0030298724264241506, 0.00827698410466851)
2026-06-22 05:52:57,171 - optuna.study.study - INFO - Trial 140 finished with values: [0.014706163254014972, 0.0030298724264241506, 0.00827698410466851] and parameters: {'n_layers': 2, 'embedding_dim': 128, 'lr': 0.012857610926801856, 'lambda_val': 1.3167003761918277e-05, 'batch_size': 2821, 'optimizer': 'Adam'}.
2026-06-22 05:53:27,288 - experiment_functions - INFO - Early stopping at epoch 550. Best Metrics: (0.016445991885708233, 0.0033630162940507767, 0.008977306485493544)
2026-06-22 05:53:27,358 - optuna.study.study - INFO - Trial 141 finished with values: [0.016445991885708233, 0.0033630162940507767, 0.008977306485493544] and parameters: {'n_layers': 3, 'embedding_dim': 128, 'lr': 0.0038079716278558275, 'lambda_val': 0.0008270557136082167, 'batch_size': 557, 'optimizer': 'RMSprop'}.
2026-06-22 05:54:02,739 - experiment_functions - INFO - Early stopping at epoch 700. Best Metrics: (0.018130801315054325, 0.0038540482505999745, 0.01019194939014024)
2026-06-22 05:54:02,834 - optuna.study.study - INFO - Trial 142 finished with values: [0.018130801315054325, 0.0038540482505999745, 0.01019194939014024] and parameters: {'n_layers': 4, 'embedding_dim': 64, 'lr': 0.0015973413467103624, 'lambda_val': 0.0001132240545098155, 'batch_size': 1762, 'optimizer': 'Adam'}.
2026-06-22 05:54:46,308 - experiment_functions - INFO - Early stopping at epoch 600. Best Metrics: (0.013781340898689065, 0.0028356700770493875, 0.007315622245005981)
2026-06-22 05:54:46,392 - optuna.study.study - INFO - Trial 143 finished with values: [0.013781340898689065, 0.0028356700770493875, 0.007315622245005981] and parameters: {'n_layers': 4, 'embedding_dim': 256, 'lr': 0.0015973413467103624, 'lambda_val': 0.001073083826061835, 'batch_size': 2186, 'optimizer': 'Adam'}.
2026-06-22 05:56:04,467 - experiment_functions - INFO - Early stopping at epoch 1800. Best Metrics: (0.01499765468272051, 0.0029572439055197677, 0.008208653817701686)
2026-06-22 05:56:04,600 - optuna.study.study - INFO - Trial 144 finished with values: [0.01499765468272051, 0.0029572439055197677, 0.008208653817701686] and parameters: {'n_layers': 3, 'embedding_dim': 32, 'lr': 0.0024738494268848423, 'lambda_val': 0.000442118077500333, 'batch_size': 1762, 'optimizer': 'RMSprop'}.
2026-06-22 05:57:30,711 - experiment_functions - INFO - Early stopping at epoch 1950. Best Metrics: (0.01900830877462045, 0.004311923708475433, 0.010497613670305809)
2026-06-22 05:57:30,780 - optuna.study.study - INFO - Trial 145 finished with values: [0.01900830877462045, 0.004311923708475433, 0.010497613670305809] and parameters: {'n_layers': 2, 'embedding_dim': 64, 'lr': 0.00025949794187037214, 'lambda_val': 0.015318144701989713, 'batch_size': 3484, 'optimizer': 'Adam'}.
2026-06-22 05:58:00,032 - experiment_functions - INFO - Early stopping at epoch 650. Best Metrics: (0.012371613895420746, 0.00253252494631805, 0.006450789007514931)
2026-06-22 05:58:00,109 - optuna.study.study - INFO - Trial 146 finished with values: [0.012371613895420746, 0.00253252494631805, 0.006450789007514931] and parameters: {'n_layers': 2, 'embedding_dim': 32, 'lr': 0.0038079716278558275, 'lambda_val': 0.001073083826061835, 'batch_size': 4064, 'optimizer': 'RMSprop'}.
2026-06-22 05:58:39,353 - experiment_functions - INFO - Early stopping at epoch 850. Best Metrics: (0.017914223180964733, 0.0037893141341417205, 0.009951343581417894)
2026-06-22 05:58:39,438 - optuna.study.study - INFO - Trial 147 finished with values: [0.017914223180964733, 0.0037893141341417205, 0.009951343581417894] and parameters: {'n_layers': 2, 'embedding_dim': 64, 'lr': 0.0012653624571519182, 'lambda_val': 5.867428769760123e-05, 'batch_size': 2362, 'optimizer': 'RMSprop'}.
2026-06-22 06:00:27,609 - experiment_functions - INFO - Early stopping at epoch 2500. Best Metrics: (0.02528486172383778, 0.005612921561197424, 0.014518775613493464)
2026-06-22 06:00:27,685 - optuna.study.study - INFO - Trial 148 finished with values: [0.02528486172383778, 0.005612921561197424, 0.014518775613493464] and parameters: {'n_layers': 3, 'embedding_dim': 32, 'lr': 0.00037811925768249915, 'lambda_val': 0.0006249538563380107, 'batch_size': 1881, 'optimizer': 'RMSprop'}.
2026-06-22 06:01:07,183 - experiment_functions - INFO - Early stopping at epoch 550. Best Metrics: (0.00846386810374135, 0.0018693949728432488, 0.004818997953740637)
