2026-06-21 12:02:48,303 - optuna.study.study - INFO - Trial 64 finished with values: [0.006969779682001524, 0.0017920298092711886, 0.004303538556029731] and parameters: {'n_layers': 3, 'embedding_dim': 96, 'lr': 0.007517511425007554, 'lambda_val': 1.00362290309107e-06, 'batch_size': 2732, 'optimizer': 'Adam'}.
2026-06-21 12:03:24,943 - experiment_functions - INFO - Early stopping at epoch 850. Best Metrics: (0.0029860468527697394, 0.0007168119237084755, 0.0019196579952492003)
2026-06-21 12:03:25,032 - optuna.study.study - INFO - Trial 65 finished with values: [0.0029860468527697394, 0.0007168119237084755, 0.0019196579952492003] and parameters: {'n_layers': 1, 'embedding_dim': 128, 'lr': 0.02060883241850729, 'lambda_val': 2.1085708841093375e-05, 'batch_size': 2624, 'optimizer': 'RMSprop'}.
2026-06-21 12:05:57,931 - experiment_functions - INFO - Early stopping at epoch 3750. Best Metrics: (0.0006400514077822403, 0.0001389415182518631, 0.00032636319760813036)
2026-06-21 12:05:58,011 - optuna.study.study - INFO - Trial 66 finished with values: [0.0006400514077822403, 0.0001389415182518631, 0.00032636319760813036] and parameters: {'n_layers': 1, 'embedding_dim': 128, 'lr': 7.88099396852753e-05, 'lambda_val': 0.014679201594967693, 'batch_size': 3734, 'optimizer': 'Adam'}.
2026-06-21 12:06:20,546 - experiment_functions - INFO - Early stopping at epoch 500. Best Metrics: (0.000544408781814307, 0.00011683718580270305, 0.0003000894343316344)
2026-06-21 12:06:20,633 - optuna.study.study - INFO - Trial 67 finished with values: [0.000544408781814307, 0.00011683718580270305, 0.0003000894343316344] and parameters: {'n_layers': 1, 'embedding_dim': 128, 'lr': 0.007517511425007554, 'lambda_val': 0.03729773642264025, 'batch_size': 3545, 'optimizer': 'SGD'}.
2026-06-21 12:06:42,966 - experiment_functions - INFO - Early stopping at epoch 500. Best Metrics: (0.00053577248043342, 0.0001310471138057345, 0.00028710576217744205)
2026-06-21 12:06:43,050 - optuna.study.study - INFO - Trial 68 finished with values: [0.00053577248043342, 0.0001310471138057345, 0.00028710576217744205] and parameters: {'n_layers': 3, 'embedding_dim': 64, 'lr': 0.02157046343541575, 'lambda_val': 2.296895526828711e-06, 'batch_size': 2791, 'optimizer': 'SGD'}.
2026-06-21 12:07:07,342 - experiment_functions - INFO - Early stopping at epoch 550. Best Metrics: (0.0035318355156641512, 0.00085891120373879, 0.0021562863490416765)
2026-06-21 12:07:07,441 - optuna.study.study - INFO - Trial 69 finished with values: [0.0035318355156641512, 0.00085891120373879, 0.0021562863490416765] and parameters: {'n_layers': 2, 'embedding_dim': 64, 'lr': 0.03212361641248932, 'lambda_val': 0.0005324235622766645, 'batch_size': 1403, 'optimizer': 'Adam'}.
2026-06-21 12:07:33,963 - experiment_functions - INFO - Early stopping at epoch 550. Best Metrics: (0.007603466795410692, 0.0018946570670708603, 0.004500715286027856)
2026-06-21 12:07:34,038 - optuna.study.study - INFO - Trial 70 finished with values: [0.007603466795410692, 0.0018946570670708603, 0.004500715286027856] and parameters: {'n_layers': 4, 'embedding_dim': 96, 'lr': 0.003959528614934683, 'lambda_val': 1.0480033391436414e-06, 'batch_size': 2962, 'optimizer': 'RMSprop'}.
2026-06-21 12:07:58,855 - experiment_functions - INFO - Early stopping at epoch 550. Best Metrics: (0.005772869149542932, 0.001417835038524694, 0.003504730981853199)
2026-06-21 12:07:58,932 - optuna.study.study - INFO - Trial 71 finished with values: [0.005772869149542932, 0.001417835038524694, 0.003504730981853199] and parameters: {'n_layers': 3, 'embedding_dim': 64, 'lr': 0.007517511425007554, 'lambda_val': 0.0002491576543882324, 'batch_size': 2732, 'optimizer': 'RMSprop'}.
2026-06-21 12:08:22,582 - experiment_functions - INFO - Early stopping at epoch 550. Best Metrics: (0.0017632378942746627, 0.00041524567386636355, 0.001083911210497949)
2026-06-21 12:08:22,665 - optuna.study.study - INFO - Trial 72 finished with values: [0.0017632378942746627, 0.00041524567386636355, 0.001083911210497949] and parameters: {'n_layers': 1, 'embedding_dim': 64, 'lr': 0.05769644059992922, 'lambda_val': 0.00216624247898919, 'batch_size': 1179, 'optimizer': 'Adam'}.
2026-06-21 12:08:47,593 - experiment_functions - INFO - Early stopping at epoch 500. Best Metrics: (0.0006541314504933005, 0.00014999368447644312, 0.0003363681730974968)
2026-06-21 12:08:47,669 - optuna.study.study - INFO - Trial 73 finished with values: [0.0006541314504933005, 0.00014999368447644312, 0.0003363681730974968] and parameters: {'n_layers': 4, 'embedding_dim': 128, 'lr': 0.0036259653456223104, 'lambda_val': 0.05773981198429287, 'batch_size': 1133, 'optimizer': 'SGD'}.
2026-06-21 12:09:55,987 - experiment_functions - INFO - Early stopping at epoch 1650. Best Metrics: (0.0045442334578548365, 0.0010357458633320704, 0.0027636298321602774)
2026-06-21 12:09:56,055 - optuna.study.study - INFO - Trial 74 finished with values: [0.0045442334578548365, 0.0010357458633320704, 0.0027636298321602774] and parameters: {'n_layers': 1, 'embedding_dim': 96, 'lr': 0.0044739262759054006, 'lambda_val': 3.514176335303042e-05, 'batch_size': 2410, 'optimizer': 'Adam'}.
2026-06-21 12:10:35,661 - experiment_functions - INFO - Early stopping at epoch 900. Best Metrics: (0.0057473197277997864, 0.0015173045345459137, 0.003530352465730039)
2026-06-21 12:10:35,732 - optuna.study.study - INFO - Trial 75 finished with values: [0.0057473197277997864, 0.0015173045345459137, 0.003530352465730039] and parameters: {'n_layers': 2, 'embedding_dim': 96, 'lr': 0.003566354885654931, 'lambda_val': 3.514176335303042e-05, 'batch_size': 2410, 'optimizer': 'Adam'}.
2026-06-21 12:13:14,492 - optuna.study.study - INFO - Trial 76 finished with values: [0.0008192409107640492, 0.00016894025514715172, 0.0004462928276250847] and parameters: {'n_layers': 4, 'embedding_dim': 32, 'lr': 3.420559337956491e-05, 'lambda_val': 0.0002491576543882324, 'batch_size': 2732, 'optimizer': 'RMSprop'}.
2026-06-21 12:13:37,082 - experiment_functions - INFO - Early stopping at epoch 500. Best Metrics: (0.000648754810409189, 0.0001215738284703802, 0.0003539964958807967)
2026-06-21 12:13:37,163 - optuna.study.study - INFO - Trial 77 finished with values: [0.000648754810409189, 0.0001215738284703802, 0.0003539964958807967] and parameters: {'n_layers': 3, 'embedding_dim': 64, 'lr': 1.872602905615164e-05, 'lambda_val': 2.0583674142350663e-05, 'batch_size': 3893, 'optimizer': 'SGD'}.
2026-06-21 12:14:03,112 - experiment_functions - INFO - Early stopping at epoch 600. Best Metrics: (0.0006429496547121018, 0.00014052039914108882, 0.00032394229621330613)
2026-06-21 12:14:03,954 - optuna.study.study - INFO - Trial 78 finished with values: [0.0006429496547121018, 0.00014052039914108882, 0.00032394229621330613] and parameters: {'n_layers': 2, 'embedding_dim': 64, 'lr': 0.01594862440926431, 'lambda_val': 5.534713206436078e-06, 'batch_size': 3241, 'optimizer': 'SGD'}.
2026-06-21 12:14:48,986 - experiment_functions - INFO - Early stopping at epoch 1100. Best Metrics: (0.007309552210127594, 0.0018425539977264115, 0.0044416203300803045)
2026-06-21 12:14:49,460 - optuna.study.study - INFO - Trial 79 finished with values: [0.007309552210127594, 0.0018425539977264115, 0.0044416203300803045] and parameters: {'n_layers': 2, 'embedding_dim': 32, 'lr': 0.004051056337067167, 'lambda_val': 1.9888087490246264e-06, 'batch_size': 1087, 'optimizer': 'RMSprop'}.
2026-06-21 12:15:20,483 - experiment_functions - INFO - Early stopping at epoch 650. Best Metrics: (0.00935281153293423, 0.002325691549829481, 0.005715954309786587)
2026-06-21 12:15:20,585 - optuna.study.study - INFO - Trial 80 finished with values: [0.00935281153293423, 0.002325691549829481, 0.005715954309786587] and parameters: {'n_layers': 4, 'embedding_dim': 96, 'lr': 0.0044739262759054006, 'lambda_val': 6.059814023598347e-06, 'batch_size': 1014, 'optimizer': 'Adam'}.
2026-06-21 12:18:43,361 - optuna.study.study - INFO - Trial 81 finished with values: [0.000581284657314893, 0.00011999494758115448, 0.00031199102081819197] and parameters: {'n_layers': 3, 'embedding_dim': 256, 'lr': 2.3622017272377703e-05, 'lambda_val': 1.0480033391436414e-06, 'batch_size': 3023, 'optimizer': 'RMSprop'}.
2026-06-21 12:19:10,173 - experiment_functions - INFO - Early stopping at epoch 550. Best Metrics: (0.005864779537580963, 0.0014225716811923708, 0.003445687387594393)
2026-06-21 12:19:10,246 - optuna.study.study - INFO - Trial 82 finished with values: [0.005864779537580963, 0.0014225716811923708, 0.003445687387594393] and parameters: {'n_layers': 3, 'embedding_dim': 128, 'lr': 0.007852338517216746, 'lambda_val': 1.8308866889687562e-05, 'batch_size': 2281, 'optimizer': 'RMSprop'}.
2026-06-21 12:19:43,661 - experiment_functions - INFO - Early stopping at epoch 650. Best Metrics: (0.0006290616234162109, 0.0001389415182518631, 0.0003287159747311325)
2026-06-21 12:19:43,746 - optuna.study.study - INFO - Trial 83 finished with values: [0.0006290616234162109, 0.0001389415182518631, 0.0003287159747311325] and parameters: {'n_layers': 2, 'embedding_dim': 256, 'lr': 1.3878237958972974e-05, 'lambda_val': 1.8308866889687562e-05, 'batch_size': 3145, 'optimizer': 'Adam'}.
2026-06-21 12:22:53,511 - optuna.study.study - INFO - Trial 84 finished with values: [0.0034715068098367177, 0.0007547050650498926, 0.002124066208342381] and parameters: {'n_layers': 2, 'embedding_dim': 256, 'lr': 0.00020536131884751725, 'lambda_val': 0.00037941540794106203, 'batch_size': 3626, 'optimizer': 'RMSprop'}.
2026-06-21 12:23:17,187 - experiment_functions - INFO - Early stopping at epoch 550. Best Metrics: (0.0012923913178474722, 0.000323670582291272, 0.0008083737537669651)
2026-06-21 12:23:17,271 - optuna.study.study - INFO - Trial 85 finished with values: [0.0012923913178474722, 0.000323670582291272, 0.0008083737537669651] and parameters: {'n_layers': 1, 'embedding_dim': 64, 'lr': 0.08892310059143241, 'lambda_val': 0.0009137010718801951, 'batch_size': 1354, 'optimizer': 'RMSprop'}.
2026-06-21 12:25:31,200 - experiment_functions - INFO - Early stopping at epoch 3250. Best Metrics: (0.0006603733092647134, 0.00015630920803334596, 0.0003491967441935518)
2026-06-21 12:25:31,286 - optuna.study.study - INFO - Trial 86 finished with values: [0.0006603733092647134, 0.00015630920803334596, 0.0003491967441935518] and parameters: {'n_layers': 2, 'embedding_dim': 96, 'lr': 3.115146571557179e-05, 'lambda_val': 1.4121365572109793e-06, 'batch_size': 2962, 'optimizer': 'RMSprop'}.
2026-06-21 12:28:05,447 - optuna.study.study - INFO - Trial 87 finished with values: [0.0008382855710008228, 0.00017051913603637742, 0.0004313163330146869] and parameters: {'n_layers': 1, 'embedding_dim': 32, 'lr': 7.754136385392551e-05, 'lambda_val': 2.854699329527242e-06, 'batch_size': 3322, 'optimizer': 'Adam'}.
2026-06-21 12:30:54,385 - optuna.study.study - INFO - Trial 88 finished with values: [0.0012605631995717451, 0.00029998736895288624, 0.0007336855652830343] and parameters: {'n_layers': 3, 'embedding_dim': 96, 'lr': 0.00011517103464482977, 'lambda_val': 4.0850305001077695e-05, 'batch_size': 2732, 'optimizer': 'RMSprop'}.
2026-06-21 12:32:29,528 - experiment_functions - INFO - Early stopping at epoch 2150. Best Metrics: (0.0006550191316407742, 0.00015630920803334596, 0.0003681590696925775)
2026-06-21 12:32:29,633 - optuna.study.study - INFO - Trial 89 finished with values: [0.0006550191316407742, 0.00015630920803334596, 0.0003681590696925775] and parameters: {'n_layers': 3, 'embedding_dim': 128, 'lr': 4.113205767102852e-05, 'lambda_val': 0.0002491576543882324, 'batch_size': 2064, 'optimizer': 'RMSprop'}.
2026-06-21 12:33:48,627 - experiment_functions - INFO - Early stopping at epoch 1850. Best Metrics: (0.0006866531421373355, 0.0001515725653656688, 0.00037238267606393616)
2026-06-21 12:33:48,729 - optuna.study.study - INFO - Trial 90 finished with values: [0.0006866531421373355, 0.0001515725653656688, 0.00037238267606393616] and parameters: {'n_layers': 2, 'embedding_dim': 128, 'lr': 7.88099396852753e-05, 'lambda_val': 0.00037941540794106203, 'batch_size': 1006, 'optimizer': 'RMSprop'}.
2026-06-21 12:34:15,265 - experiment_functions - INFO - Early stopping at epoch 550. Best Metrics: (0.002594373704000169, 0.0006252368321333838, 0.0016315121726767255)
2026-06-21 12:34:15,365 - optuna.study.study - INFO - Trial 91 finished with values: [0.002594373704000169, 0.0006252368321333838, 0.0016315121726767255] and parameters: {'n_layers': 1, 'embedding_dim': 256, 'lr': 0.03212361641248932, 'lambda_val': 2.706498615300197e-06, 'batch_size': 3893, 'optimizer': 'RMSprop'}.
2026-06-21 12:34:38,127 - experiment_functions - INFO - Early stopping at epoch 500. Best Metrics: (0.0004807766894564478, 9.631173424276874e-05, 0.00024073295499573019)
2026-06-21 12:34:38,224 - optuna.study.study - INFO - Trial 92 finished with values: [0.0004807766894564478, 9.631173424276874e-05, 0.00024073295499573019] and parameters: {'n_layers': 4, 'embedding_dim': 64, 'lr': 5.379729882363256e-05, 'lambda_val': 0.008776113824497833, 'batch_size': 2797, 'optimizer': 'SGD'}.
2026-06-21 12:35:03,819 - experiment_functions - INFO - Early stopping at epoch 550. Best Metrics: (0.004444099171388827, 0.0010973222180118733, 0.0026344862084716467)
2026-06-21 12:35:03,902 - optuna.study.study - INFO - Trial 93 finished with values: [0.004444099171388827, 0.0010973222180118733, 0.0026344862084716467] and parameters: {'n_layers': 3, 'embedding_dim': 96, 'lr': 0.01648090699159999, 'lambda_val': 7.185633297867177e-05, 'batch_size': 2136, 'optimizer': 'RMSprop'}.
2026-06-21 12:35:29,067 - experiment_functions - INFO - Early stopping at epoch 500. Best Metrics: (0.0006029821008587114, 0.00011683718580270305, 0.0003049324138852103)
2026-06-21 12:35:29,151 - optuna.study.study - INFO - Trial 94 finished with values: [0.0006029821008587114, 0.00011683718580270305, 0.0003049324138852103] and parameters: {'n_layers': 2, 'embedding_dim': 256, 'lr': 0.004051056337067167, 'lambda_val': 1.0536101625474063e-05, 'batch_size': 1087, 'optimizer': 'SGD'}.
2026-06-21 12:36:01,228 - experiment_functions - INFO - Early stopping at epoch 550. Best Metrics: (0.004788426795622535, 0.0011841606669192877, 0.0026876475736338284)
2026-06-21 12:36:01,391 - optuna.study.study - INFO - Trial 95 finished with values: [0.004788426795622535, 0.0011841606669192877, 0.0026876475736338284] and parameters: {'n_layers': 4, 'embedding_dim': 256, 'lr': 0.0183275310294566, 'lambda_val': 0.00216624247898919, 'batch_size': 1179, 'optimizer': 'Adam'}.
2026-06-21 12:36:33,595 - experiment_functions - INFO - Early stopping at epoch 750. Best Metrics: (0.003705997769153727, 0.0008841732979664014, 0.0022331673025322847)
2026-06-21 12:36:33,687 - optuna.study.study - INFO - Trial 96 finished with values: [0.003705997769153727, 0.0008841732979664014, 0.0022331673025322847] and parameters: {'n_layers': 1, 'embedding_dim': 96, 'lr': 0.01648090699159999, 'lambda_val': 2.706498615300197e-06, 'batch_size': 3341, 'optimizer': 'Adam'}.
2026-06-21 12:36:55,956 - experiment_functions - INFO - Early stopping at epoch 500. Best Metrics: (0.0005062531392441389, 0.00011367942402425163, 0.00026594299151129984)
2026-06-21 12:36:56,049 - optuna.study.study - INFO - Trial 97 finished with values: [0.0005062531392441389, 0.00011367942402425163, 0.00026594299151129984] and parameters: {'n_layers': 1, 'embedding_dim': 96, 'lr': 0.08122027253260972, 'lambda_val': 0.0076149973106102555, 'batch_size': 2728, 'optimizer': 'SGD'}.
2026-06-21 12:37:57,310 - experiment_functions - INFO - Early stopping at epoch 1250. Best Metrics: (0.0031404909940047367, 0.0007720727548313756, 0.0018772806818873453)
2026-06-21 12:37:57,413 - optuna.study.study - INFO - Trial 98 finished with values: [0.0031404909940047367, 0.0007720727548313756, 0.0018772806818873453] and parameters: {'n_layers': 2, 'embedding_dim': 256, 'lr': 0.08892310059143241, 'lambda_val': 1.9888087490246264e-06, 'batch_size': 3645, 'optimizer': 'RMSprop'}.
2026-06-21 12:38:19,690 - experiment_functions - INFO - Early stopping at epoch 500. Best Metrics: (0.0006390576034452891, 0.0001373626373626374, 0.00037465656946720306)
2026-06-21 12:38:19,781 - optuna.study.study - INFO - Trial 99 finished with values: [0.0006390576034452891, 0.0001373626373626374, 0.00037465656946720306] and parameters: {'n_layers': 1, 'embedding_dim': 96, 'lr': 3.420559337956491e-05, 'lambda_val': 9.064648013456966e-06, 'batch_size': 3617, 'optimizer': 'SGD'}.
2026-06-21 12:38:56,361 - experiment_functions - INFO - Early stopping at epoch 800. Best Metrics: (0.008308220849171877, 0.002120437034230138, 0.0052585665240455015)
2026-06-21 12:38:56,455 - optuna.study.study - INFO - Trial 100 finished with values: [0.008308220849171877, 0.002120437034230138, 0.0052585665240455015] and parameters: {'n_layers': 3, 'embedding_dim': 96, 'lr': 0.003566354885654931, 'lambda_val': 1.00362290309107e-06, 'batch_size': 1006, 'optimizer': 'Adam'}.
2026-06-21 12:39:24,053 - experiment_functions - INFO - Early stopping at epoch 650. Best Metrics: (0.003344438922888573, 0.0007973348490589871, 0.0019912921434701992)
2026-06-21 12:39:24,136 - optuna.study.study - INFO - Trial 101 finished with values: [0.003344438922888573, 0.0007973348490589871, 0.0019912921434701992] and parameters: {'n_layers': 1, 'embedding_dim': 32, 'lr': 0.01648090699159999, 'lambda_val': 3.514176335303042e-05, 'batch_size': 1654, 'optimizer': 'Adam'}.
2026-06-21 12:39:52,098 - experiment_functions - INFO - Early stopping at epoch 600. Best Metrics: (0.0051762216189841686, 0.0012678413540482508, 0.0030857058331949577)
2026-06-21 12:39:52,175 - optuna.study.study - INFO - Trial 102 finished with values: [0.0051762216189841686, 0.0012678413540482508, 0.0030857058331949577] and parameters: {'n_layers': 2, 'embedding_dim': 128, 'lr': 0.007852338517216746, 'lambda_val': 1.8308866889687562e-05, 'batch_size': 2662, 'optimizer': 'RMSprop'}.
2026-06-21 12:40:26,794 - experiment_functions - INFO - Early stopping at epoch 800. Best Metrics: (0.005618088820204122, 0.0014462548945307564, 0.003412818346224049)
2026-06-21 12:40:27,008 - optuna.study.study - INFO - Trial 103 finished with values: [0.005618088820204122, 0.0014462548945307564, 0.003412818346224049] and parameters: {'n_layers': 2, 'embedding_dim': 64, 'lr': 0.0044739262759054006, 'lambda_val': 6.059814023598347e-06, 'batch_size': 2662, 'optimizer': 'Adam'}.
2026-06-21 12:40:52,785 - experiment_functions - INFO - Early stopping at epoch 600. Best Metrics: (0.0034294189992298066, 0.0008604900846280156, 0.0020619078947215434)
2026-06-21 12:40:52,881 - optuna.study.study - INFO - Trial 104 finished with values: [0.0034294189992298066, 0.0008604900846280156, 0.0020619078947215434] and parameters: {'n_layers': 2, 'embedding_dim': 32, 'lr': 0.007517511425007554, 'lambda_val': 0.014679201594967693, 'batch_size': 2732, 'optimizer': 'Adam'}.
2026-06-21 12:41:18,005 - experiment_functions - INFO - Early stopping at epoch 550. Best Metrics: (0.003522749047864301, 0.0008794366552987243, 0.0022682185302715227)
2026-06-21 12:41:18,137 - optuna.study.study - INFO - Trial 105 finished with values: [0.003522749047864301, 0.0008794366552987243, 0.0022682185302715227] and parameters: {'n_layers': 2, 'embedding_dim': 96, 'lr': 0.01648090699159999, 'lambda_val': 0.0005324235622766645, 'batch_size': 2136, 'optimizer': 'RMSprop'}.
2026-06-21 12:41:49,659 - experiment_functions - INFO - Early stopping at epoch 750. Best Metrics: (0.00252184406788873, 0.0005683971201212581, 0.0015086817893559836)
2026-06-21 12:41:49,740 - optuna.study.study - INFO - Trial 106 finished with values: [0.00252184406788873, 0.0005683971201212581, 0.0015086817893559836] and parameters: {'n_layers': 2, 'embedding_dim': 32, 'lr': 0.08892310059143241, 'lambda_val': 9.43271733172394e-06, 'batch_size': 1354, 'optimizer': 'RMSprop'}.
2026-06-21 12:42:21,765 - experiment_functions - INFO - Early stopping at epoch 550. Best Metrics: (0.004780923568565222, 0.001211001642036125, 0.0027530709547881125)
2026-06-21 12:42:21,854 - optuna.study.study - INFO - Trial 107 finished with values: [0.004780923568565222, 0.001211001642036125, 0.0027530709547881125] and parameters: {'n_layers': 4, 'embedding_dim': 256, 'lr': 0.0183275310294566, 'lambda_val': 0.00216624247898919, 'batch_size': 1195, 'optimizer': 'Adam'}.
2026-06-21 12:42:48,785 - experiment_functions - INFO - Early stopping at epoch 550. Best Metrics: (0.0076351351240940895, 0.0018409751168371857, 0.004510739005007806)
2026-06-21 12:42:48,865 - optuna.study.study - INFO - Trial 108 finished with values: [0.0076351351240940895, 0.0018409751168371857, 0.004510739005007806] and parameters: {'n_layers': 3, 'embedding_dim': 128, 'lr': 0.003566354885654931, 'lambda_val': 0.00037941540794106203, 'batch_size': 2281, 'optimizer': 'RMSprop'}.
2026-06-21 12:43:22,023 - experiment_functions - INFO - Early stopping at epoch 600. Best Metrics: (0.004513172891022845, 0.0010310092206643933, 0.002600971547161871)
2026-06-21 12:43:22,110 - optuna.study.study - INFO - Trial 109 finished with values: [0.004513172891022845, 0.0010310092206643933, 0.002600971547161871] and parameters: {'n_layers': 3, 'embedding_dim': 256, 'lr': 0.07054158740087368, 'lambda_val': 1.00362290309107e-06, 'batch_size': 2732, 'optimizer': 'Adam'}.
2026-06-21 12:44:13,161 - experiment_functions - INFO - Early stopping at epoch 1050. Best Metrics: (0.010307404534448847, 0.0026351522041177214, 0.006166570307942974)
2026-06-21 12:44:13,251 - optuna.study.study - INFO - Trial 110 finished with values: [0.010307404534448847, 0.0026351522041177214, 0.006166570307942974] and parameters: {'n_layers': 4, 'embedding_dim': 128, 'lr': 0.0008890810320593691, 'lambda_val': 2.5744682794480333e-06, 'batch_size': 2399, 'optimizer': 'RMSprop'}.
