2026-06-20 19:59:23,755 - optuna.study.study - INFO - Trial 154 finished with values: [0.0033549357556992092, 0.0014004673487432108, 0.0022583320194861267] and parameters: {'n_layers': 3, 'embedding_dim': 32, 'lr': 0.001947201008389374, 'lambda_val': 0.00091460267317109, 'batch_size': 891, 'optimizer': 'Adam'}.
2026-06-20 19:59:51,356 - experiment_functions - INFO - Early stopping at epoch 650. Best Metrics: (0.003968340269832634, 0.001799924213717317, 0.002944777630545039)
2026-06-20 19:59:51,454 - optuna.study.study - INFO - Trial 155 finished with values: [0.003968340269832634, 0.001799924213717317, 0.002944777630545039] and parameters: {'n_layers': 1, 'embedding_dim': 32, 'lr': 0.002035013881396423, 'lambda_val': 0.004379523707555612, 'batch_size': 2884, 'optimizer': 'Adam'}.
2026-06-20 20:00:12,953 - experiment_functions - INFO - Early stopping at epoch 500. Best Metrics: (0.0004696873549682145, 0.0001089427813565745, 0.0002654954697077035)
2026-06-20 20:00:13,052 - optuna.study.study - INFO - Trial 156 finished with values: [0.0004696873549682145, 0.0001089427813565745, 0.0002654954697077035] and parameters: {'n_layers': 1, 'embedding_dim': 64, 'lr': 0.00014013877612736552, 'lambda_val': 8.755125650144564e-05, 'batch_size': 1584, 'optimizer': 'SGD'}.
2026-06-20 20:01:24,824 - experiment_functions - INFO - Early stopping at epoch 1800. Best Metrics: (0.00450515196463213, 0.0020304408235442715, 0.0034417721709283193)
2026-06-20 20:01:24,928 - optuna.study.study - INFO - Trial 157 finished with values: [0.00450515196463213, 0.0020304408235442715, 0.0034417721709283193] and parameters: {'n_layers': 1, 'embedding_dim': 32, 'lr': 0.0005943725589836874, 'lambda_val': 0.0007336457993064653, 'batch_size': 1378, 'optimizer': 'RMSprop'}.
2026-06-20 20:02:00,497 - experiment_functions - INFO - Early stopping at epoch 800. Best Metrics: (0.003509446046995515, 0.001612037387899457, 0.002596488652087725)
2026-06-20 20:02:00,596 - optuna.study.study - INFO - Trial 158 finished with values: [0.003509446046995515, 0.001612037387899457, 0.002596488652087725] and parameters: {'n_layers': 2, 'embedding_dim': 128, 'lr': 0.0005943725589836874, 'lambda_val': 4.922680840294995e-05, 'batch_size': 1450, 'optimizer': 'Adam'}.
2026-06-20 20:02:28,700 - experiment_functions - INFO - Early stopping at epoch 600. Best Metrics: (0.0033102107277001385, 0.0014778325123152708, 0.0024233283514207855)
2026-06-20 20:02:28,801 - optuna.study.study - INFO - Trial 159 finished with values: [0.0033102107277001385, 0.0014778325123152708, 0.0024233283514207855] and parameters: {'n_layers': 3, 'embedding_dim': 128, 'lr': 0.001947201008389374, 'lambda_val': 6.733205641736132e-06, 'batch_size': 1670, 'optimizer': 'Adam'}.
2026-06-20 20:02:56,413 - experiment_functions - INFO - Early stopping at epoch 650. Best Metrics: (0.003857790623088351, 0.001852027283061766, 0.0030457858436582093)
2026-06-20 20:02:56,508 - optuna.study.study - INFO - Trial 160 finished with values: [0.003857790623088351, 0.001852027283061766, 0.0030457858436582093] and parameters: {'n_layers': 1, 'embedding_dim': 32, 'lr': 0.002035013881396423, 'lambda_val': 0.004379523707555612, 'batch_size': 2884, 'optimizer': 'Adam'}.
2026-06-20 20:03:20,216 - experiment_functions - INFO - Early stopping at epoch 550. Best Metrics: (0.0039062111800361177, 0.0016830870279146142, 0.002748752114640588)
2026-06-20 20:03:20,452 - optuna.study.study - INFO - Trial 161 finished with values: [0.0039062111800361177, 0.0016830870279146142, 0.002748752114640588] and parameters: {'n_layers': 1, 'embedding_dim': 32, 'lr': 0.001947201008389374, 'lambda_val': 0.00091460267317109, 'batch_size': 1847, 'optimizer': 'RMSprop'}.
2026-06-20 20:03:53,088 - experiment_functions - INFO - Early stopping at epoch 700. Best Metrics: (0.0038775274943479224, 0.0019151825186307946, 0.0030720674866412294)
2026-06-20 20:03:53,224 - optuna.study.study - INFO - Trial 162 finished with values: [0.0038775274943479224, 0.0019151825186307946, 0.0030720674866412294] and parameters: {'n_layers': 1, 'embedding_dim': 256, 'lr': 0.001947201008389374, 'lambda_val': 0.00091460267317109, 'batch_size': 747, 'optimizer': 'Adam'}.
2026-06-20 20:06:37,255 - optuna.study.study - INFO - Trial 163 finished with values: [0.0035274179675364413, 0.0015520399141088798, 0.0025690709520112495] and parameters: {'n_layers': 2, 'embedding_dim': 96, 'lr': 0.00012997201046442607, 'lambda_val': 1.3134597991064091e-06, 'batch_size': 2527, 'optimizer': 'Adam'}.
2026-06-20 20:07:03,175 - experiment_functions - INFO - Early stopping at epoch 550. Best Metrics: (0.0031088901099832777, 0.0014983579638752052, 0.002328937966959996)
2026-06-20 20:07:03,614 - optuna.study.study - INFO - Trial 164 finished with values: [0.0031088901099832777, 0.0014983579638752052, 0.002328937966959996] and parameters: {'n_layers': 3, 'embedding_dim': 128, 'lr': 0.002808274561684271, 'lambda_val': 0.00280672324382513, 'batch_size': 1855, 'optimizer': 'Adam'}.
2026-06-20 20:07:28,394 - experiment_functions - INFO - Early stopping at epoch 550. Best Metrics: (0.0034606357034468365, 0.001315207780725022, 0.00230391287642656)
2026-06-20 20:07:28,570 - optuna.study.study - INFO - Trial 165 finished with values: [0.0034606357034468365, 0.001315207780725022, 0.00230391287642656] and parameters: {'n_layers': 1, 'embedding_dim': 128, 'lr': 0.008754121728685619, 'lambda_val': 4.080619734488508e-05, 'batch_size': 2539, 'optimizer': 'RMSprop'}.
2026-06-20 20:08:01,917 - experiment_functions - INFO - Early stopping at epoch 700. Best Metrics: (0.002864500856025704, 0.0013388909940634081, 0.002112444656299422)
2026-06-20 20:08:02,015 - optuna.study.study - INFO - Trial 166 finished with values: [0.002864500856025704, 0.0013388909940634081, 0.002112444656299422] and parameters: {'n_layers': 4, 'embedding_dim': 128, 'lr': 0.00041936718251851416, 'lambda_val': 4.080619734488508e-05, 'batch_size': 2206, 'optimizer': 'RMSprop'}.
2026-06-20 20:08:24,290 - experiment_functions - INFO - Early stopping at epoch 500. Best Metrics: (0.00044258100385095286, 0.00010736390046734875, 0.00022322810216330533)
2026-06-20 20:08:24,389 - optuna.study.study - INFO - Trial 167 finished with values: [0.00044258100385095286, 0.00010736390046734875, 0.00022322810216330533] and parameters: {'n_layers': 1, 'embedding_dim': 128, 'lr': 0.0005943725589836874, 'lambda_val': 3.6417495206733656e-06, 'batch_size': 2734, 'optimizer': 'SGD'}.
2026-06-20 20:09:07,260 - experiment_functions - INFO - Early stopping at epoch 1000. Best Metrics: (0.0039663836252806705, 0.0019072881141846659, 0.003087270619875565)
2026-06-20 20:09:07,362 - optuna.study.study - INFO - Trial 168 finished with values: [0.0039663836252806705, 0.0019072881141846659, 0.003087270619875565] and parameters: {'n_layers': 1, 'embedding_dim': 128, 'lr': 0.0005943725589836874, 'lambda_val': 1.3134597991064091e-06, 'batch_size': 2734, 'optimizer': 'RMSprop'}.
2026-06-20 20:09:34,245 - experiment_functions - INFO - Early stopping at epoch 600. Best Metrics: (0.003351330899332, 0.0014525704180876598, 0.0023605706772421484)
2026-06-20 20:09:34,378 - optuna.study.study - INFO - Trial 169 finished with values: [0.003351330899332, 0.0014525704180876598, 0.0023605706772421484] and parameters: {'n_layers': 3, 'embedding_dim': 64, 'lr': 0.001947201008389374, 'lambda_val': 0.00091460267317109, 'batch_size': 2750, 'optimizer': 'Adam'}.
2026-06-20 20:09:58,729 - experiment_functions - INFO - Early stopping at epoch 550. Best Metrics: (0.002875618417117935, 0.0011857395478085133, 0.001994783730983813)
2026-06-20 20:09:58,838 - optuna.study.study - INFO - Trial 170 finished with values: [0.002875618417117935, 0.0011857395478085133, 0.001994783730983813] and parameters: {'n_layers': 3, 'embedding_dim': 64, 'lr': 0.0026465856831401676, 'lambda_val': 1.0693559021612933e-06, 'batch_size': 1155, 'optimizer': 'RMSprop'}.
2026-06-20 20:12:41,372 - optuna.study.study - INFO - Trial 171 finished with values: [0.002471430209857687, 0.0012962612100543137, 0.0019938978174408204] and parameters: {'n_layers': 1, 'embedding_dim': 128, 'lr': 0.00010753478498406959, 'lambda_val': 6.733205641736132e-06, 'batch_size': 3292, 'optimizer': 'Adam'}.
2026-06-20 20:13:04,630 - experiment_functions - INFO - Early stopping at epoch 500. Best Metrics: (0.0005175518522449566, 0.0001278893520272831, 0.0003040272561066573)
2026-06-20 20:13:04,737 - optuna.study.study - INFO - Trial 172 finished with values: [0.0005175518522449566, 0.0001278893520272831, 0.0003040272561066573] and parameters: {'n_layers': 3, 'embedding_dim': 96, 'lr': 0.03178174845269066, 'lambda_val': 0.0027800062933610284, 'batch_size': 1847, 'optimizer': 'SGD'}.
2026-06-20 20:13:41,186 - experiment_functions - INFO - Early stopping at epoch 850. Best Metrics: (0.0006211240779372454, 0.00013420487558418596, 0.00033882566236660195)
2026-06-20 20:13:41,307 - optuna.study.study - INFO - Trial 173 finished with values: [0.0006211240779372454, 0.00013420487558418596, 0.00033882566236660195] and parameters: {'n_layers': 1, 'embedding_dim': 128, 'lr': 1.9646263067165905e-05, 'lambda_val': 3.6417495206733656e-06, 'batch_size': 2734, 'optimizer': 'RMSprop'}.
2026-06-20 20:14:06,481 - experiment_functions - INFO - Early stopping at epoch 550. Best Metrics: (0.002985888807531573, 0.0015362511052166227, 0.002346996107364751)
2026-06-20 20:14:06,626 - optuna.study.study - INFO - Trial 174 finished with values: [0.002985888807531573, 0.0015362511052166227, 0.002346996107364751] and parameters: {'n_layers': 2, 'embedding_dim': 128, 'lr': 0.003817870632102948, 'lambda_val': 4.922680840294995e-05, 'batch_size': 747, 'optimizer': 'Adam'}.
2026-06-20 20:14:30,602 - experiment_functions - INFO - Early stopping at epoch 500. Best Metrics: (0.000632231052574907, 0.0001294682329165088, 0.0003306444986073888)
2026-06-20 20:14:30,707 - optuna.study.study - INFO - Trial 175 finished with values: [0.000632231052574907, 0.0001294682329165088, 0.0003306444986073888] and parameters: {'n_layers': 4, 'embedding_dim': 128, 'lr': 0.0011836797126663788, 'lambda_val': 3.6417495206733656e-06, 'batch_size': 838, 'optimizer': 'SGD'}.
2026-06-20 20:14:55,042 - experiment_functions - INFO - Early stopping at epoch 550. Best Metrics: (0.002737390111484964, 0.001125742074017936, 0.001864497126742281)
2026-06-20 20:14:55,165 - optuna.study.study - INFO - Trial 176 finished with values: [0.002737390111484964, 0.001125742074017936, 0.001864497126742281] and parameters: {'n_layers': 3, 'embedding_dim': 64, 'lr': 0.021080815477123926, 'lambda_val': 0.00091460267317109, 'batch_size': 747, 'optimizer': 'Adam'}.
2026-06-20 20:15:36,043 - experiment_functions - INFO - Early stopping at epoch 950. Best Metrics: (0.0038365434671661816, 0.0018220285461664771, 0.0029877048728766263)
2026-06-20 20:15:36,282 - optuna.study.study - INFO - Trial 177 finished with values: [0.0038365434671661816, 0.0018220285461664771, 0.0029877048728766263] and parameters: {'n_layers': 1, 'embedding_dim': 128, 'lr': 0.0005943725589836874, 'lambda_val': 3.1552145254862633e-06, 'batch_size': 2734, 'optimizer': 'Adam'}.
2026-06-20 20:18:15,098 - optuna.study.study - INFO - Trial 178 finished with values: [0.0036577828119581635, 0.0017557155488189971, 0.0028198243903589286] and parameters: {'n_layers': 1, 'embedding_dim': 64, 'lr': 0.00017647026102474964, 'lambda_val': 4.080619734488508e-05, 'batch_size': 3657, 'optimizer': 'Adam'}.
2026-06-20 20:18:37,065 - experiment_functions - INFO - Early stopping at epoch 500. Best Metrics: (0.0005338388897823174, 0.00012631047113805733, 0.000292534325120158)
2026-06-20 20:18:37,257 - optuna.study.study - INFO - Trial 179 finished with values: [0.0005338388897823174, 0.00012631047113805733, 0.000292534325120158] and parameters: {'n_layers': 3, 'embedding_dim': 32, 'lr': 0.03178174845269066, 'lambda_val': 0.00091460267317109, 'batch_size': 1847, 'optimizer': 'SGD'}.
2026-06-20 20:19:08,687 - experiment_functions - INFO - Early stopping at epoch 750. Best Metrics: (0.004662400306840763, 0.0020225464190981434, 0.0034113005363562553)
2026-06-20 20:19:08,828 - optuna.study.study - INFO - Trial 180 finished with values: [0.004662400306840763, 0.0020225464190981434, 0.0034113005363562553] and parameters: {'n_layers': 1, 'embedding_dim': 32, 'lr': 0.001947201008389374, 'lambda_val': 0.00091460267317109, 'batch_size': 1155, 'optimizer': 'Adam'}.
2026-06-20 20:20:05,570 - experiment_functions - INFO - Early stopping at epoch 1250. Best Metrics: (0.003920087617771519, 0.0014209928003031452, 0.0026848480116129854)
2026-06-20 20:20:05,696 - optuna.study.study - INFO - Trial 181 finished with values: [0.003920087617771519, 0.0014209928003031452, 0.0026848480116129854] and parameters: {'n_layers': 1, 'embedding_dim': 256, 'lr': 0.021080815477123926, 'lambda_val': 3.6417495206733656e-06, 'batch_size': 2734, 'optimizer': 'RMSprop'}.
2026-06-20 20:20:35,971 - experiment_functions - INFO - Early stopping at epoch 550. Best Metrics: (0.0028491293307283177, 0.0012804724011620564, 0.0020770811980326143)
2026-06-20 20:20:36,074 - optuna.study.study - INFO - Trial 182 finished with values: [0.0028491293307283177, 0.0012804724011620564, 0.0020770811980326143] and parameters: {'n_layers': 4, 'embedding_dim': 256, 'lr': 0.003817870632102948, 'lambda_val': 1.0693559021612933e-06, 'batch_size': 3624, 'optimizer': 'Adam'}.
2026-06-20 20:21:10,863 - experiment_functions - INFO - Early stopping at epoch 750. Best Metrics: (0.0032903165529235513, 0.0014715169887583681, 0.002395181203081841)
2026-06-20 20:21:10,964 - optuna.study.study - INFO - Trial 183 finished with values: [0.0032903165529235513, 0.0014715169887583681, 0.002395181203081841] and parameters: {'n_layers': 3, 'embedding_dim': 128, 'lr': 0.0006133385212652219, 'lambda_val': 4.922680840294995e-05, 'batch_size': 2884, 'optimizer': 'Adam'}.
2026-06-20 20:21:35,069 - experiment_functions - INFO - Early stopping at epoch 550. Best Metrics: (0.0037828719745947154, 0.001566249842111911, 0.0026892326345806968)
2026-06-20 20:21:35,168 - optuna.study.study - INFO - Trial 184 finished with values: [0.0037828719745947154, 0.001566249842111911, 0.0026892326345806968] and parameters: {'n_layers': 1, 'embedding_dim': 64, 'lr': 0.021080815477123926, 'lambda_val': 3.1552145254862633e-06, 'batch_size': 2734, 'optimizer': 'Adam'}.
2026-06-20 20:21:58,313 - experiment_functions - INFO - Early stopping at epoch 500. Best Metrics: (0.0031624179706969007, 0.0013025767336112164, 0.002318986171277858)
2026-06-20 20:21:58,422 - optuna.study.study - INFO - Trial 185 finished with values: [0.0031624179706969007, 0.0013025767336112164, 0.002318986171277858] and parameters: {'n_layers': 3, 'embedding_dim': 96, 'lr': 0.03178174845269066, 'lambda_val': 1.1602746735516163e-05, 'batch_size': 2206, 'optimizer': 'RMSprop'}.
2026-06-20 20:22:22,520 - experiment_functions - INFO - Early stopping at epoch 550. Best Metrics: (0.003345977333657202, 0.0013231021851711508, 0.0022874966197120117)
2026-06-20 20:22:22,619 - optuna.study.study - INFO - Trial 186 finished with values: [0.003345977333657202, 0.0013231021851711508, 0.0022874966197120117] and parameters: {'n_layers': 1, 'embedding_dim': 64, 'lr': 0.021080815477123926, 'lambda_val': 3.1552145254862633e-06, 'batch_size': 2734, 'optimizer': 'RMSprop'}.
2026-06-20 20:22:53,293 - experiment_functions - INFO - Early stopping at epoch 700. Best Metrics: (0.003258579460955721, 0.0008620689655172415, 0.00182349703875803)
2026-06-20 20:22:53,440 - optuna.study.study - INFO - Trial 187 finished with values: [0.003258579460955721, 0.0008620689655172415, 0.00182349703875803] and parameters: {'n_layers': 1, 'embedding_dim': 128, 'lr': 0.08768462687583077, 'lambda_val': 6.733205641736132e-06, 'batch_size': 809, 'optimizer': 'RMSprop'}.
2026-06-20 20:23:20,700 - experiment_functions - INFO - Early stopping at epoch 650. Best Metrics: (0.0037636748750717293, 0.0016751926234684854, 0.002728029410532946)
2026-06-20 20:23:20,844 - optuna.study.study - INFO - Trial 188 finished with values: [0.0037636748750717293, 0.0016751926234684854, 0.002728029410532946] and parameters: {'n_layers': 1, 'embedding_dim': 32, 'lr': 0.001947201008389374, 'lambda_val': 0.0021519517203617954, 'batch_size': 1257, 'optimizer': 'RMSprop'}.
2026-06-20 20:25:56,499 - optuna.study.study - INFO - Trial 189 finished with values: [0.0004459666223744811, 0.00011367942402425162, 0.0002461824737380685] and parameters: {'n_layers': 3, 'embedding_dim': 32, 'lr': 2.2637312720020344e-05, 'lambda_val': 0.00091460267317109, 'batch_size': 1155, 'optimizer': 'Adam'}.
2026-06-20 20:26:22,992 - experiment_functions - INFO - Early stopping at epoch 600. Best Metrics: (0.0030256470105261804, 0.001433623847416951, 0.0022923734927715934)
2026-06-20 20:26:23,096 - optuna.study.study - INFO - Trial 190 finished with values: [0.0030256470105261804, 0.001433623847416951, 0.0022923734927715934] and parameters: {'n_layers': 3, 'embedding_dim': 64, 'lr': 0.0016280760419407157, 'lambda_val': 1.0693559021612933e-06, 'batch_size': 1155, 'optimizer': 'Adam'}.
2026-06-20 20:26:49,368 - experiment_functions - INFO - Early stopping at epoch 500. Best Metrics: (0.002045316731492027, 0.0010625868384489077, 0.0017467915238708362)
2026-06-20 20:26:49,470 - optuna.study.study - INFO - Trial 191 finished with values: [0.002045316731492027, 0.0010625868384489077, 0.0017467915238708362] and parameters: {'n_layers': 3, 'embedding_dim': 256, 'lr': 0.009861013985366013, 'lambda_val': 0.02779502338378831, 'batch_size': 1378, 'optimizer': 'RMSprop'}.
2026-06-20 20:29:07,394 - experiment_functions - INFO - Early stopping at epoch 3550. Best Metrics: (0.0005220724120142732, 0.00011683718580270305, 0.0002918328717627828)
2026-06-20 20:29:07,495 - optuna.study.study - INFO - Trial 192 finished with values: [0.0005220724120142732, 0.00011683718580270305, 0.0002918328717627828] and parameters: {'n_layers': 1, 'embedding_dim': 64, 'lr': 2.2783028537234047e-05, 'lambda_val': 6.733205641736132e-06, 'batch_size': 1670, 'optimizer': 'Adam'}.
2026-06-20 20:29:31,540 - experiment_functions - INFO - Early stopping at epoch 550. Best Metrics: (0.0036984194420532166, 0.001610458507010231, 0.00267064725023917)
2026-06-20 20:29:31,663 - optuna.study.study - INFO - Trial 193 finished with values: [0.0036984194420532166, 0.001610458507010231, 0.00267064725023917] and parameters: {'n_layers': 1, 'embedding_dim': 64, 'lr': 0.002035013881396423, 'lambda_val': 0.004379523707555612, 'batch_size': 2884, 'optimizer': 'RMSprop'}.
2026-06-20 20:29:55,522 - experiment_functions - INFO - Early stopping at epoch 550. Best Metrics: (0.0020538753732280038, 0.0009173297966401416, 0.0014831193043308556)
2026-06-20 20:29:55,872 - optuna.study.study - INFO - Trial 194 finished with values: [0.0020538753732280038, 0.0009173297966401416, 0.0014831193043308556] and parameters: {'n_layers': 1, 'embedding_dim': 64, 'lr': 0.021080815477123926, 'lambda_val': 0.0021519517203617954, 'batch_size': 1847, 'optimizer': 'RMSprop'}.
2026-06-20 20:30:17,641 - experiment_functions - INFO - Early stopping at epoch 500. Best Metrics: (0.0005589335466351133, 0.0001389415182518631, 0.00031564770365471805)
2026-06-20 20:30:17,781 - optuna.study.study - INFO - Trial 195 finished with values: [0.0005589335466351133, 0.0001389415182518631, 0.00031564770365471805] and parameters: {'n_layers': 3, 'embedding_dim': 32, 'lr': 2.2117704932608233e-05, 'lambda_val': 0.00032074890954477043, 'batch_size': 3400, 'optimizer': 'RMSprop'}.
2026-06-20 20:30:43,630 - experiment_functions - INFO - Early stopping at epoch 550. Best Metrics: (0.002374720558828834, 0.0009299608437539473, 0.0016121106097355942)
2026-06-20 20:30:43,744 - optuna.study.study - INFO - Trial 196 finished with values: [0.002374720558828834, 0.0009299608437539473, 0.0016121106097355942] and parameters: {'n_layers': 3, 'embedding_dim': 128, 'lr': 0.008108899149475466, 'lambda_val': 0.00091460267317109, 'batch_size': 1631, 'optimizer': 'RMSprop'}.
2026-06-20 20:31:07,584 - experiment_functions - INFO - Early stopping at epoch 550. Best Metrics: (0.0019784049889497485, 0.0008336491095111784, 0.0013787857615094705)
2026-06-20 20:31:07,687 - optuna.study.study - INFO - Trial 197 finished with values: [0.0019784049889497485, 0.0008336491095111784, 0.0013787857615094705] and parameters: {'n_layers': 3, 'embedding_dim': 32, 'lr': 0.08659506057569161, 'lambda_val': 0.001601066742671211, 'batch_size': 747, 'optimizer': 'Adam'}.
2026-06-20 20:31:33,235 - experiment_functions - INFO - Early stopping at epoch 600. Best Metrics: (0.0037368414761895018, 0.001724137931034483, 0.0027752260284046337)
2026-06-20 20:31:33,553 - optuna.study.study - INFO - Trial 198 finished with values: [0.0037368414761895018, 0.001724137931034483, 0.0027752260284046337] and parameters: {'n_layers': 1, 'embedding_dim': 32, 'lr': 0.004653703533380661, 'lambda_val': 1.548420801174704e-06, 'batch_size': 3400, 'optimizer': 'Adam'}.
2026-06-20 20:31:58,377 - experiment_functions - INFO - Early stopping at epoch 550. Best Metrics: (0.003360004683804124, 0.001594669698117974, 0.0024793246859311936)
2026-06-20 20:31:58,477 - optuna.study.study - INFO - Trial 199 finished with values: [0.003360004683804124, 0.001594669698117974, 0.0024793246859311936] and parameters: {'n_layers': 1, 'embedding_dim': 128, 'lr': 0.002045647389828366, 'lambda_val': 3.1552145254862633e-06, 'batch_size': 3589, 'optimizer': 'RMSprop'}.
2026-06-20 20:32:23,500 - experiment_functions - INFO - Early stopping at epoch 550. Best Metrics: (0.003146026467505683, 0.0012899456864974104, 0.0022724863974543023)
