2026-06-18 06:28:45,073 - optuna.study.study - INFO - Trial 130 finished with values: [0.002930833484352442, 0.000607869142351901, 0.001734044827115799] and parameters: {'n_layers': 1, 'embedding_dim': 32, 'lr': 0.0010693223843994991, 'lambda_val': 7.3372601056335455e-06, 'batch_size': 3965, 'optimizer': 'Adam'}.
2026-06-18 06:31:29,854 - optuna.study.study - INFO - Trial 131 finished with values: [0.0021050963599846453, 0.00048313755210306944, 0.0012652385805776993] and parameters: {'n_layers': 4, 'embedding_dim': 64, 'lr': 0.0002547850232335638, 'lambda_val': 5.088875721981583e-06, 'batch_size': 555, 'optimizer': 'RMSprop'}.
2026-06-18 06:32:18,970 - experiment_functions - INFO - Early stopping at epoch 1150. Best Metrics: (0.0035153039103045986, 0.0008557534419603386, 0.0022329257032219483)
2026-06-18 06:32:19,044 - optuna.study.study - INFO - Trial 132 finished with values: [0.0035153039103045986, 0.0008557534419603386, 0.0022329257032219483] and parameters: {'n_layers': 3, 'embedding_dim': 64, 'lr': 0.0011084029372515364, 'lambda_val': 0.00029665726020447226, 'batch_size': 2514, 'optimizer': 'RMSprop'}.
2026-06-18 06:32:50,484 - experiment_functions - INFO - Early stopping at epoch 750. Best Metrics: (0.0018169345810631165, 0.00044366552987242647, 0.0012256504676799347)
2026-06-18 06:32:50,562 - optuna.study.study - INFO - Trial 133 finished with values: [0.0018169345810631165, 0.00044366552987242647, 0.0012256504676799347] and parameters: {'n_layers': 3, 'embedding_dim': 32, 'lr': 0.03858174937572021, 'lambda_val': 5.94343459986947e-06, 'batch_size': 1413, 'optimizer': 'RMSprop'}.
2026-06-18 06:33:30,592 - experiment_functions - INFO - Early stopping at epoch 950. Best Metrics: (0.00284138969098581, 0.0006694454970317041, 0.0017653531202375225)
2026-06-18 06:33:30,930 - optuna.study.study - INFO - Trial 134 finished with values: [0.00284138969098581, 0.0006694454970317041, 0.0017653531202375225] and parameters: {'n_layers': 1, 'embedding_dim': 96, 'lr': 0.0037241261216120077, 'lambda_val': 7.3372601056335455e-06, 'batch_size': 2179, 'optimizer': 'Adam'}.
2026-06-18 06:35:59,537 - experiment_functions - INFO - Early stopping at epoch 3800. Best Metrics: (0.0032421838476674072, 0.0007120752810407983, 0.0018954166672599713)
2026-06-18 06:35:59,617 - optuna.study.study - INFO - Trial 135 finished with values: [0.0032421838476674072, 0.0007120752810407983, 0.0018954166672599713] and parameters: {'n_layers': 1, 'embedding_dim': 32, 'lr': 0.0004894377864752034, 'lambda_val': 0.00021932042110835948, 'batch_size': 3869, 'optimizer': 'RMSprop'}.
2026-06-18 06:36:32,595 - experiment_functions - INFO - Early stopping at epoch 700. Best Metrics: (0.00323560895915726, 0.000819439181508147, 0.0020373777170175546)
2026-06-18 06:36:32,687 - optuna.study.study - INFO - Trial 136 finished with values: [0.00323560895915726, 0.000819439181508147, 0.0020373777170175546] and parameters: {'n_layers': 4, 'embedding_dim': 96, 'lr': 0.0021650119100380945, 'lambda_val': 1.839049008182015e-05, 'batch_size': 2942, 'optimizer': 'RMSprop'}.
2026-06-18 06:37:01,034 - experiment_functions - INFO - Early stopping at epoch 500. Best Metrics: (0.0006171608301768268, 0.00013262599469496023, 0.00030451460309845787)
2026-06-18 06:37:01,137 - optuna.study.study - INFO - Trial 137 finished with values: [0.0006171608301768268, 0.00013262599469496023, 0.00030451460309845787] and parameters: {'n_layers': 4, 'embedding_dim': 256, 'lr': 0.007973613552701056, 'lambda_val': 4.651009491292299e-05, 'batch_size': 2395, 'optimizer': 'SGD'}.
2026-06-18 06:37:28,318 - experiment_functions - INFO - Early stopping at epoch 600. Best Metrics: (0.0023187162618286948, 0.0006299734748010611, 0.0015269364094666015)
2026-06-18 06:37:28,402 - optuna.study.study - INFO - Trial 138 finished with values: [0.0023187162618286948, 0.0006299734748010611, 0.0015269364094666015] and parameters: {'n_layers': 2, 'embedding_dim': 96, 'lr': 0.0108387318865738, 'lambda_val': 1.6639720416643942e-06, 'batch_size': 2514, 'optimizer': 'RMSprop'}.
2026-06-18 06:40:07,105 - optuna.study.study - INFO - Trial 139 finished with values: [0.0034636992527743125, 0.0008020714917266642, 0.0021212672301598096] and parameters: {'n_layers': 3, 'embedding_dim': 32, 'lr': 0.00048363299473296685, 'lambda_val': 0.00021932042110835948, 'batch_size': 3869, 'optimizer': 'RMSprop'}.
2026-06-18 06:41:45,664 - experiment_functions - INFO - Early stopping at epoch 1950. Best Metrics: (0.0006951254793125693, 0.0001405203991410888, 0.00033964881882864894)
2026-06-18 06:41:46,060 - optuna.study.study - INFO - Trial 140 finished with values: [0.0006951254793125693, 0.0001405203991410888, 0.00033964881882864894] and parameters: {'n_layers': 3, 'embedding_dim': 256, 'lr': 5.389933822780841e-05, 'lambda_val': 0.00016604057802743083, 'batch_size': 655, 'optimizer': 'Adam'}.
2026-06-18 06:42:08,459 - experiment_functions - INFO - Early stopping at epoch 500. Best Metrics: (0.00042660140422858846, 0.0001121005431350259, 0.0002639892547649434)
2026-06-18 06:42:08,541 - optuna.study.study - INFO - Trial 141 finished with values: [0.00042660140422858846, 0.0001121005431350259, 0.0002639892547649434] and parameters: {'n_layers': 4, 'embedding_dim': 32, 'lr': 0.0004894377864752034, 'lambda_val': 0.00021932042110835948, 'batch_size': 2603, 'optimizer': 'SGD'}.
2026-06-18 06:42:57,853 - experiment_functions - INFO - Early stopping at epoch 950. Best Metrics: (0.003246664624294918, 0.0008668056081849186, 0.002070832370943397)
2026-06-18 06:42:57,936 - optuna.study.study - INFO - Trial 142 finished with values: [0.003246664624294918, 0.0008668056081849186, 0.002070832370943397] and parameters: {'n_layers': 3, 'embedding_dim': 256, 'lr': 0.0011084029372515364, 'lambda_val': 0.00016604057802743083, 'batch_size': 1892, 'optimizer': 'RMSprop'}.
2026-06-18 06:45:36,339 - experiment_functions - INFO - Early stopping at epoch 3750. Best Metrics: (0.002532836030518973, 0.0005636604774535809, 0.0016282729827976985)
2026-06-18 06:45:36,420 - optuna.study.study - INFO - Trial 143 finished with values: [0.002532836030518973, 0.0005636604774535809, 0.0016282729827976985] and parameters: {'n_layers': 3, 'embedding_dim': 96, 'lr': 0.0002547850232335638, 'lambda_val': 0.0006822884198672845, 'batch_size': 1509, 'optimizer': 'Adam'}.
2026-06-18 06:46:00,376 - experiment_functions - INFO - Early stopping at epoch 500. Best Metrics: (0.0006284022068897407, 0.00011367942402425163, 0.0003779036415586012)
2026-06-18 06:46:00,491 - optuna.study.study - INFO - Trial 144 finished with values: [0.0006284022068897407, 0.00011367942402425163, 0.0003779036415586012] and parameters: {'n_layers': 3, 'embedding_dim': 128, 'lr': 0.003946985249188999, 'lambda_val': 0.00029665726020447226, 'batch_size': 903, 'optimizer': 'SGD'}.
2026-06-18 06:46:26,256 - experiment_functions - INFO - Early stopping at epoch 550. Best Metrics: (0.0017786472438349017, 0.0005147151698875837, 0.0012571892545114218)
2026-06-18 06:46:26,367 - optuna.study.study - INFO - Trial 145 finished with values: [0.0017786472438349017, 0.0005147151698875837, 0.0012571892545114218] and parameters: {'n_layers': 3, 'embedding_dim': 96, 'lr': 0.009898479133052968, 'lambda_val': 0.03207725494452658, 'batch_size': 1509, 'optimizer': 'Adam'}.
2026-06-18 06:48:49,151 - experiment_functions - INFO - Early stopping at epoch 3500. Best Metrics: (0.0036091604426476635, 0.0008304913477327271, 0.0022967277852908945)
2026-06-18 06:48:49,240 - optuna.study.study - INFO - Trial 146 finished with values: [0.0036091604426476635, 0.0008304913477327271, 0.0022967277852908945] and parameters: {'n_layers': 3, 'embedding_dim': 64, 'lr': 0.00046996802016152644, 'lambda_val': 0.00029665726020447226, 'batch_size': 1722, 'optimizer': 'RMSprop'}.
2026-06-18 06:51:26,871 - optuna.study.study - INFO - Trial 147 finished with values: [0.0035228791646099962, 0.0007720727548313755, 0.002198979236514225] and parameters: {'n_layers': 3, 'embedding_dim': 32, 'lr': 0.0005201695028924843, 'lambda_val': 1.5179554986144033e-05, 'batch_size': 655, 'optimizer': 'RMSprop'}.
2026-06-18 06:52:51,392 - experiment_functions - INFO - Early stopping at epoch 1900. Best Metrics: (0.0034461392421812785, 0.0008399646330680814, 0.0020116929806760263)
2026-06-18 06:52:51,483 - optuna.study.study - INFO - Trial 148 finished with values: [0.0034461392421812785, 0.0008399646330680814, 0.0020116929806760263] and parameters: {'n_layers': 3, 'embedding_dim': 128, 'lr': 0.0004894377864752034, 'lambda_val': 0.00029665726020447226, 'batch_size': 3869, 'optimizer': 'RMSprop'}.
2026-06-18 06:55:41,732 - optuna.study.study - INFO - Trial 149 finished with values: [0.004157134036108855, 0.0009552229379815588, 0.002566666970756149] and parameters: {'n_layers': 2, 'embedding_dim': 128, 'lr': 0.0009840483225184993, 'lambda_val': 2.2848456976007116e-05, 'batch_size': 655, 'optimizer': 'RMSprop'}.
2026-06-18 06:56:20,077 - experiment_functions - INFO - Early stopping at epoch 850. Best Metrics: (0.002743561638815582, 0.0007625994694960213, 0.0018038511839114583)
2026-06-18 06:56:20,157 - optuna.study.study - INFO - Trial 150 finished with values: [0.002743561638815582, 0.0007625994694960213, 0.0018038511839114583] and parameters: {'n_layers': 2, 'embedding_dim': 128, 'lr': 0.005514861246156716, 'lambda_val': 1.4055284682631976e-05, 'batch_size': 655, 'optimizer': 'RMSprop'}.
2026-06-18 06:56:44,973 - experiment_functions - INFO - Early stopping at epoch 550. Best Metrics: (0.0024176199574318363, 0.0006220790703549324, 0.0016357994500189707)
2026-06-18 06:56:45,102 - optuna.study.study - INFO - Trial 151 finished with values: [0.0024176199574318363, 0.0006220790703549324, 0.0016357994500189707] and parameters: {'n_layers': 2, 'embedding_dim': 96, 'lr': 0.0037241261216120077, 'lambda_val': 0.008028496373561652, 'batch_size': 1509, 'optimizer': 'RMSprop'}.
2026-06-18 06:58:19,694 - experiment_functions - INFO - Early stopping at epoch 1750. Best Metrics: (0.00344651808328006, 0.0009046987495263356, 0.0021934912796545383)
2026-06-18 06:58:19,786 - optuna.study.study - INFO - Trial 152 finished with values: [0.00344651808328006, 0.0009046987495263356, 0.0021934912796545383] and parameters: {'n_layers': 4, 'embedding_dim': 256, 'lr': 0.00048363299473296685, 'lambda_val': 0.0002692345705128242, 'batch_size': 2756, 'optimizer': 'RMSprop'}.
2026-06-18 06:58:59,078 - experiment_functions - INFO - Early stopping at epoch 900. Best Metrics: (0.003087270036199955, 0.0007436528988253126, 0.0020660399156057054)
2026-06-18 06:58:59,180 - optuna.study.study - INFO - Trial 153 finished with values: [0.003087270036199955, 0.0007436528988253126, 0.0020660399156057054] and parameters: {'n_layers': 3, 'embedding_dim': 64, 'lr': 0.002685013617819528, 'lambda_val': 1.6639720416643942e-06, 'batch_size': 2756, 'optimizer': 'Adam'}.
2026-06-18 07:01:37,044 - optuna.study.study - INFO - Trial 154 finished with values: [0.0031584308949576525, 0.0006457622836933182, 0.0019089283331933603] and parameters: {'n_layers': 1, 'embedding_dim': 64, 'lr': 0.00046996802016152644, 'lambda_val': 2.2848456976007116e-05, 'batch_size': 619, 'optimizer': 'RMSprop'}.
2026-06-18 07:04:15,821 - optuna.study.study - INFO - Trial 155 finished with values: [0.003465194222860826, 0.0007847038019451813, 0.0022035632577659323] and parameters: {'n_layers': 3, 'embedding_dim': 32, 'lr': 0.0004894377864752034, 'lambda_val': 0.00021932042110835948, 'batch_size': 1975, 'optimizer': 'RMSprop'}.
2026-06-18 07:05:14,630 - experiment_functions - INFO - Early stopping at epoch 1250. Best Metrics: (0.0031962549464771783, 0.0008241758241758243, 0.001984855863924751)
2026-06-18 07:05:14,704 - optuna.study.study - INFO - Trial 156 finished with values: [0.0031962549464771783, 0.0008241758241758243, 0.001984855863924751] and parameters: {'n_layers': 4, 'embedding_dim': 128, 'lr': 0.0008273605807562151, 'lambda_val': 0.00029665726020447226, 'batch_size': 3869, 'optimizer': 'Adam'}.
2026-06-18 07:06:57,855 - experiment_functions - INFO - Early stopping at epoch 2400. Best Metrics: (0.004060999357953026, 0.0010104837691044587, 0.0025983739307627665)
2026-06-18 07:06:57,942 - optuna.study.study - INFO - Trial 157 finished with values: [0.004060999357953026, 0.0010104837691044587, 0.0025983739307627665] and parameters: {'n_layers': 3, 'embedding_dim': 96, 'lr': 0.0011084029372515364, 'lambda_val': 1.6639720416643942e-06, 'batch_size': 655, 'optimizer': 'RMSprop'}.
2026-06-18 07:07:20,795 - experiment_functions - INFO - Early stopping at epoch 500. Best Metrics: (0.0006142229488276173, 0.00011999494758115448, 0.0002845009842381653)
2026-06-18 07:07:20,896 - optuna.study.study - INFO - Trial 158 finished with values: [0.0006142229488276173, 0.00011999494758115448, 0.0002845009842381653] and parameters: {'n_layers': 4, 'embedding_dim': 64, 'lr': 0.0008273605807562151, 'lambda_val': 0.0002692345705128242, 'batch_size': 2395, 'optimizer': 'SGD'}.
2026-06-18 07:10:00,661 - optuna.study.study - INFO - Trial 159 finished with values: [0.002951891133948671, 0.0006283945939118354, 0.0017187287023704338] and parameters: {'n_layers': 3, 'embedding_dim': 32, 'lr': 0.0003294685445249985, 'lambda_val': 0.00029665726020447226, 'batch_size': 3869, 'optimizer': 'RMSprop'}.
2026-06-18 07:12:54,763 - optuna.study.study - INFO - Trial 160 finished with values: [0.0031571921841581957, 0.0007278640899330554, 0.0019025801961870881] and parameters: {'n_layers': 4, 'embedding_dim': 96, 'lr': 0.0002981283007949551, 'lambda_val': 0.0009339364864859292, 'batch_size': 2198, 'optimizer': 'Adam'}.
2026-06-18 07:16:25,977 - optuna.study.study - INFO - Trial 161 finished with values: [0.003306539290258364, 0.0008573323228495643, 0.0020751879969780444] and parameters: {'n_layers': 4, 'embedding_dim': 256, 'lr': 0.0004894377864752034, 'lambda_val': 0.00029665726020447226, 'batch_size': 845, 'optimizer': 'Adam'}.
2026-06-18 07:16:57,934 - experiment_functions - INFO - Early stopping at epoch 650. Best Metrics: (0.0034413484692043914, 0.0008352279904004041, 0.0021943964046207214)
2026-06-18 07:16:57,999 - optuna.study.study - INFO - Trial 162 finished with values: [0.0034413484692043914, 0.0008352279904004041, 0.0021943964046207214] and parameters: {'n_layers': 4, 'embedding_dim': 128, 'lr': 0.0037685849042605117, 'lambda_val': 1.4055284682631976e-05, 'batch_size': 696, 'optimizer': 'Adam'}.
2026-06-18 07:17:33,986 - experiment_functions - INFO - Early stopping at epoch 850. Best Metrics: (0.003366093524033511, 0.0008004926108374384, 0.0021632788501632348)
2026-06-18 07:17:34,052 - optuna.study.study - INFO - Trial 163 finished with values: [0.003366093524033511, 0.0008004926108374384, 0.0021632788501632348] and parameters: {'n_layers': 4, 'embedding_dim': 32, 'lr': 0.0037241261216120077, 'lambda_val': 7.3372601056335455e-06, 'batch_size': 1509, 'optimizer': 'RMSprop'}.
2026-06-18 07:17:59,321 - experiment_functions - INFO - Early stopping at epoch 550. Best Metrics: (0.001972619256335638, 0.0005462927876720981, 0.0013143479214204506)
2026-06-18 07:17:59,407 - optuna.study.study - INFO - Trial 164 finished with values: [0.001972619256335638, 0.0005462927876720981, 0.0013143479214204506] and parameters: {'n_layers': 4, 'embedding_dim': 32, 'lr': 0.06985354918649489, 'lambda_val': 7.3372601056335455e-06, 'batch_size': 1509, 'optimizer': 'RMSprop'}.
2026-06-18 07:18:30,802 - experiment_functions - INFO - Early stopping at epoch 700. Best Metrics: (0.003490654450330517, 0.0008825944170771757, 0.0022525664419174992)
2026-06-18 07:18:30,898 - optuna.study.study - INFO - Trial 165 finished with values: [0.003490654450330517, 0.0008825944170771757, 0.0022525664419174992] and parameters: {'n_layers': 4, 'embedding_dim': 64, 'lr': 0.0037685849042605117, 'lambda_val': 0.00029665726020447226, 'batch_size': 696, 'optimizer': 'RMSprop'}.
2026-06-18 07:21:39,458 - optuna.study.study - INFO - Trial 166 finished with values: [0.0029151236714279553, 0.0007026019957054441, 0.00180224388382424] and parameters: {'n_layers': 2, 'embedding_dim': 256, 'lr': 0.0007081502475512032, 'lambda_val': 3.615242376833312e-06, 'batch_size': 1642, 'optimizer': 'Adam'}.
2026-06-18 07:22:19,347 - experiment_functions - INFO - Early stopping at epoch 950. Best Metrics: (0.0026366333197790867, 0.0006394467601364153, 0.0016993784922598634)
2026-06-18 07:22:19,433 - optuna.study.study - INFO - Trial 167 finished with values: [0.0026366333197790867, 0.0006394467601364153, 0.0016993784922598634] and parameters: {'n_layers': 2, 'embedding_dim': 64, 'lr': 0.0009840483225184993, 'lambda_val': 0.00029665726020447226, 'batch_size': 3869, 'optimizer': 'RMSprop'}.
2026-06-18 07:23:54,118 - experiment_functions - INFO - Early stopping at epoch 2200. Best Metrics: (0.0036504981938696238, 0.0008841732979664014, 0.0022589315714442114)
2026-06-18 07:23:54,212 - optuna.study.study - INFO - Trial 168 finished with values: [0.0036504981938696238, 0.0008841732979664014, 0.0022589315714442114] and parameters: {'n_layers': 2, 'embedding_dim': 128, 'lr': 0.0009840483225184993, 'lambda_val': 1.4055284682631976e-05, 'batch_size': 895, 'optimizer': 'RMSprop'}.
2026-06-18 07:26:24,084 - experiment_functions - INFO - Early stopping at epoch 3550. Best Metrics: (0.00393824273436778, 0.0009473285335354303, 0.0024594533363132562)
2026-06-18 07:26:24,150 - optuna.study.study - INFO - Trial 169 finished with values: [0.00393824273436778, 0.0009473285335354303, 0.0024594533363132562] and parameters: {'n_layers': 2, 'embedding_dim': 128, 'lr': 0.0009840483225184993, 'lambda_val': 1.4055284682631976e-05, 'batch_size': 655, 'optimizer': 'RMSprop'}.
2026-06-18 07:27:58,928 - experiment_functions - INFO - Early stopping at epoch 2300. Best Metrics: (0.0036805638504170007, 0.0008273335859542757, 0.0022002648631681216)
2026-06-18 07:27:59,017 - optuna.study.study - INFO - Trial 170 finished with values: [0.0036805638504170007, 0.0008273335859542757, 0.0022002648631681216] and parameters: {'n_layers': 3, 'embedding_dim': 64, 'lr': 0.00046996802016152644, 'lambda_val': 2.1011583665129505e-05, 'batch_size': 2514, 'optimizer': 'RMSprop'}.
2026-06-18 07:28:41,098 - experiment_functions - INFO - Early stopping at epoch 800. Best Metrics: (0.003164344919765964, 0.00084785903751421, 0.001949614018661332)
2026-06-18 07:28:41,188 - optuna.study.study - INFO - Trial 171 finished with values: [0.003164344919765964, 0.00084785903751421, 0.001949614018661332] and parameters: {'n_layers': 3, 'embedding_dim': 256, 'lr': 0.003946985249188999, 'lambda_val': 1.1421527735625712e-05, 'batch_size': 1892, 'optimizer': 'Adam'}.
2026-06-18 07:31:35,534 - experiment_functions - INFO - Early stopping at epoch 3300. Best Metrics: (0.0033820448000936114, 0.0008652267272956927, 0.0020541813844581927)
2026-06-18 07:31:35,609 - optuna.study.study - INFO - Trial 172 finished with values: [0.0033820448000936114, 0.0008652267272956927, 0.0020541813844581927] and parameters: {'n_layers': 4, 'embedding_dim': 256, 'lr': 0.0008273605807562151, 'lambda_val': 3.615242376833312e-06, 'batch_size': 1642, 'optimizer': 'Adam'}.
2026-06-18 07:32:54,761 - experiment_functions - INFO - Early stopping at epoch 1550. Best Metrics: (0.0030393899593125933, 0.0007689149930529243, 0.0019187202214153013)
2026-06-18 07:32:54,842 - optuna.study.study - INFO - Trial 173 finished with values: [0.0030393899593125933, 0.0007689149930529243, 0.0019187202214153013] and parameters: {'n_layers': 3, 'embedding_dim': 256, 'lr': 0.0008273605807562151, 'lambda_val': 0.00021932042110835948, 'batch_size': 3869, 'optimizer': 'Adam'}.
2026-06-18 07:33:47,039 - experiment_functions - INFO - Early stopping at epoch 950. Best Metrics: (0.003180632172865971, 0.0007831249210559556, 0.001925579806687726)
2026-06-18 07:33:47,118 - optuna.study.study - INFO - Trial 174 finished with values: [0.003180632172865971, 0.0007831249210559556, 0.001925579806687726] and parameters: {'n_layers': 4, 'embedding_dim': 256, 'lr': 0.0008273605807562151, 'lambda_val': 0.0009339364864859292, 'batch_size': 3425, 'optimizer': 'Adam'}.
2026-06-18 07:35:19,851 - experiment_functions - INFO - Early stopping at epoch 2350. Best Metrics: (0.0005226869719304236, 0.00011525830491347732, 0.0002729077689819088)
2026-06-18 07:35:19,939 - optuna.study.study - INFO - Trial 175 finished with values: [0.0005226869719304236, 0.00011525830491347732, 0.0002729077689819088] and parameters: {'n_layers': 3, 'embedding_dim': 32, 'lr': 1.784167914231192e-05, 'lambda_val': 3.2983725152623725e-05, 'batch_size': 655, 'optimizer': 'RMSprop'}.
2026-06-18 07:35:59,591 - experiment_functions - INFO - Early stopping at epoch 750. Best Metrics: (0.003204528195609353, 0.0008399646330680814, 0.0019406094191134523)
2026-06-18 07:35:59,765 - optuna.study.study - INFO - Trial 176 finished with values: [0.003204528195609353, 0.0008399646330680814, 0.0019406094191134523] and parameters: {'n_layers': 3, 'embedding_dim': 256, 'lr': 0.003946985249188999, 'lambda_val': 0.0002692345705128242, 'batch_size': 895, 'optimizer': 'Adam'}.
2026-06-18 07:37:01,699 - experiment_functions - INFO - Early stopping at epoch 1200. Best Metrics: (0.0031320532266008888, 0.0008099658961727928, 0.001969705589713415)
2026-06-18 07:37:01,782 - optuna.study.study - INFO - Trial 177 finished with values: [0.0031320532266008888, 0.0008099658961727928, 0.001969705589713415] and parameters: {'n_layers': 3, 'embedding_dim': 256, 'lr': 0.0011084029372515364, 'lambda_val': 0.00016604057802743083, 'batch_size': 2564, 'optimizer': 'Adam'}.
2026-06-18 07:37:27,133 - experiment_functions - INFO - Early stopping at epoch 550. Best Metrics: (0.002589116715407495, 0.0006110269041303525, 0.0016818921840015318)
