2026-06-17 08:17:19,407 - optuna.study.study - INFO - Trial 128 finished with values: [0.0027899690865257286, 0.0011225843122394845, 0.001901251195436933] and parameters: {'n_layers': 4, 'embedding_dim': 256, 'lr': 0.0002359819177604671, 'lambda_val': 0.0008240497651178975, 'batch_size': 1749, 'optimizer': 'RMSprop'}.
2026-06-17 08:17:43,936 - experiment_functions - INFO - Early stopping at epoch 550. Best Metrics: (0.0035033859881148086, 0.001288366805608185, 0.002345441441131294)
2026-06-17 08:17:44,269 - optuna.study.study - INFO - Trial 129 finished with values: [0.0035033859881148086, 0.001288366805608185, 0.002345441441131294] and parameters: {'n_layers': 3, 'embedding_dim': 32, 'lr': 0.007822927276622295, 'lambda_val': 1.031526593103832e-05, 'batch_size': 3410, 'optimizer': 'Adam'}.
2026-06-17 08:18:08,654 - experiment_functions - INFO - Early stopping at epoch 550. Best Metrics: (0.003153374669440494, 0.0011494252873563218, 0.0020305009626626304)
2026-06-17 08:18:08,732 - optuna.study.study - INFO - Trial 130 finished with values: [0.003153374669440494, 0.0011494252873563218, 0.0020305009626626304] and parameters: {'n_layers': 3, 'embedding_dim': 32, 'lr': 0.002231043752262738, 'lambda_val': 1.7261189135715837e-05, 'batch_size': 3410, 'optimizer': 'RMSprop'}.
2026-06-17 08:18:34,010 - experiment_functions - INFO - Early stopping at epoch 500. Best Metrics: (0.002716243355718911, 0.001144688644688645, 0.0019445284994111076)
2026-06-17 08:18:34,099 - optuna.study.study - INFO - Trial 131 finished with values: [0.002716243355718911, 0.001144688644688645, 0.0019445284994111076] and parameters: {'n_layers': 2, 'embedding_dim': 256, 'lr': 0.060034049813311924, 'lambda_val': 0.0009466382313788157, 'batch_size': 3704, 'optimizer': 'RMSprop'}.
2026-06-17 08:21:30,299 - optuna.study.study - INFO - Trial 132 finished with values: [0.003204388920836913, 0.0014146772767462425, 0.0023320503798086177] and parameters: {'n_layers': 1, 'embedding_dim': 256, 'lr': 0.00019218459721774152, 'lambda_val': 1.561244993279661e-06, 'batch_size': 1599, 'optimizer': 'Adam'}.
2026-06-17 08:22:04,158 - experiment_functions - INFO - Early stopping at epoch 750. Best Metrics: (0.0007035895591466421, 0.0001515725653656688, 0.0003524191218913784)
2026-06-17 08:22:04,538 - optuna.study.study - INFO - Trial 133 finished with values: [0.0007035895591466421, 0.0001515725653656688, 0.0003524191218913784] and parameters: {'n_layers': 1, 'embedding_dim': 64, 'lr': 1.0505815151226128e-05, 'lambda_val': 0.00016666322755616337, 'batch_size': 2572, 'optimizer': 'Adam'}.
2026-06-17 08:22:41,924 - experiment_functions - INFO - Early stopping at epoch 850. Best Metrics: (0.0036883603642653365, 0.001032588101553619, 0.0022282243969679533)
2026-06-17 08:22:42,009 - optuna.study.study - INFO - Trial 134 finished with values: [0.0036883603642653365, 0.001032588101553619, 0.0022282243969679533] and parameters: {'n_layers': 1, 'embedding_dim': 64, 'lr': 0.046129598836200957, 'lambda_val': 5.2927329941475195e-06, 'batch_size': 1310, 'optimizer': 'RMSprop'}.
2026-06-17 08:23:27,326 - experiment_functions - INFO - Early stopping at epoch 950. Best Metrics: (0.0032448724054261495, 0.0013909940634078564, 0.0023515512583028083)
2026-06-17 08:23:27,418 - optuna.study.study - INFO - Trial 135 finished with values: [0.0032448724054261495, 0.0013909940634078564, 0.0023515512583028083] and parameters: {'n_layers': 1, 'embedding_dim': 256, 'lr': 0.0010209094744396852, 'lambda_val': 1.5216807094072505e-05, 'batch_size': 1098, 'optimizer': 'Adam'}.
2026-06-17 08:23:53,396 - experiment_functions - INFO - Early stopping at epoch 550. Best Metrics: (0.0034505960271268513, 0.001471516988758368, 0.002511870435541381)
2026-06-17 08:23:53,525 - optuna.study.study - INFO - Trial 136 finished with values: [0.0034505960271268513, 0.001471516988758368, 0.002511870435541381] and parameters: {'n_layers': 1, 'embedding_dim': 96, 'lr': 0.004595237871810009, 'lambda_val': 0.003740096552998565, 'batch_size': 1833, 'optimizer': 'Adam'}.
2026-06-17 08:24:27,412 - experiment_functions - INFO - Early stopping at epoch 750. Best Metrics: (0.0005201228597375132, 0.00011841606669192875, 0.00026393853258678605)
2026-06-17 08:24:27,501 - optuna.study.study - INFO - Trial 137 finished with values: [0.0005201228597375132, 0.00011841606669192875, 0.00026393853258678605] and parameters: {'n_layers': 1, 'embedding_dim': 96, 'lr': 2.818937631218086e-05, 'lambda_val': 0.08339056269925893, 'batch_size': 3410, 'optimizer': 'Adam'}.
2026-06-17 08:24:54,441 - experiment_functions - INFO - Early stopping at epoch 550. Best Metrics: (0.0028554665500368955, 0.0010720601237842618, 0.0018791031603727917)
2026-06-17 08:24:54,540 - optuna.study.study - INFO - Trial 138 finished with values: [0.0028554665500368955, 0.0010720601237842618, 0.0018791031603727917] and parameters: {'n_layers': 2, 'embedding_dim': 128, 'lr': 0.0029893657570589515, 'lambda_val': 1.5388349045557698e-06, 'batch_size': 1281, 'optimizer': 'RMSprop'}.
2026-06-17 08:25:23,066 - experiment_functions - INFO - Early stopping at epoch 550. Best Metrics: (0.0027856507966924214, 0.0011178476695718074, 0.0019693813836618684)
2026-06-17 08:25:23,152 - optuna.study.study - INFO - Trial 139 finished with values: [0.0027856507966924214, 0.0011178476695718074, 0.0019693813836618684] and parameters: {'n_layers': 3, 'embedding_dim': 256, 'lr': 0.004595237871810009, 'lambda_val': 3.125135396462488e-05, 'batch_size': 2308, 'optimizer': 'Adam'}.
2026-06-17 08:25:50,661 - experiment_functions - INFO - Early stopping at epoch 550. Best Metrics: (0.002974466533238123, 0.001282051282051282, 0.0022003989401951376)
2026-06-17 08:25:50,751 - optuna.study.study - INFO - Trial 140 finished with values: [0.002974466533238123, 0.001282051282051282, 0.0022003989401951376] and parameters: {'n_layers': 2, 'embedding_dim': 256, 'lr': 0.003877789258066795, 'lambda_val': 0.00016666322755616337, 'batch_size': 1844, 'optimizer': 'Adam'}.
2026-06-17 08:26:15,266 - experiment_functions - INFO - Early stopping at epoch 550. Best Metrics: (0.0011795220736053706, 0.0005320828596690666, 0.0008674466709140052)
2026-06-17 08:26:15,369 - optuna.study.study - INFO - Trial 141 finished with values: [0.0011795220736053706, 0.0005320828596690666, 0.0008674466709140052] and parameters: {'n_layers': 1, 'embedding_dim': 64, 'lr': 0.024484365885130848, 'lambda_val': 0.042807455526447644, 'batch_size': 2433, 'optimizer': 'Adam'}.
2026-06-17 08:26:39,898 - experiment_functions - INFO - Early stopping at epoch 550. Best Metrics: (0.0033491878329565176, 0.0012678413540482506, 0.002169036167081559)
2026-06-17 08:26:39,973 - optuna.study.study - INFO - Trial 142 finished with values: [0.0033491878329565176, 0.0012678413540482506, 0.002169036167081559] and parameters: {'n_layers': 2, 'embedding_dim': 32, 'lr': 0.010203021680640975, 'lambda_val': 6.565445017278844e-05, 'batch_size': 965, 'optimizer': 'Adam'}.
2026-06-17 08:27:04,562 - experiment_functions - INFO - Early stopping at epoch 550. Best Metrics: (0.0031744047675880223, 0.001130478716685613, 0.0020028177098841645)
2026-06-17 08:27:04,890 - optuna.study.study - INFO - Trial 143 finished with values: [0.0031744047675880223, 0.001130478716685613, 0.0020028177098841645] and parameters: {'n_layers': 3, 'embedding_dim': 32, 'lr': 0.007822927276622295, 'lambda_val': 1.031526593103832e-05, 'batch_size': 2645, 'optimizer': 'Adam'}.
2026-06-17 08:27:27,303 - experiment_functions - INFO - Early stopping at epoch 500. Best Metrics: (0.00042246286077831497, 0.00010104837691044589, 0.00022448123647523003)
2026-06-17 08:27:27,381 - optuna.study.study - INFO - Trial 144 finished with values: [0.00042246286077831497, 0.00010104837691044589, 0.00022448123647523003] and parameters: {'n_layers': 4, 'embedding_dim': 32, 'lr': 0.024484365885130848, 'lambda_val': 0.038397306184641815, 'batch_size': 1310, 'optimizer': 'SGD'}.
2026-06-17 08:28:02,459 - experiment_functions - INFO - Early stopping at epoch 650. Best Metrics: (0.00265854833800681, 0.0011604774535809018, 0.0019339166706925537)
2026-06-17 08:28:02,552 - optuna.study.study - INFO - Trial 145 finished with values: [0.00265854833800681, 0.0011604774535809018, 0.0019339166706925537] and parameters: {'n_layers': 3, 'embedding_dim': 256, 'lr': 0.0011453432792901683, 'lambda_val': 3.737769038654263e-05, 'batch_size': 754, 'optimizer': 'Adam'}.
2026-06-17 08:28:31,123 - experiment_functions - INFO - Early stopping at epoch 550. Best Metrics: (0.0029453511700099242, 0.0012204749273714793, 0.0021135457843568725)
2026-06-17 08:28:31,584 - optuna.study.study - INFO - Trial 146 finished with values: [0.0029453511700099242, 0.0012204749273714793, 0.0021135457843568725] and parameters: {'n_layers': 2, 'embedding_dim': 256, 'lr': 0.004595237871810009, 'lambda_val': 0.0009466382313788157, 'batch_size': 3433, 'optimizer': 'Adam'}.
2026-06-17 08:28:54,828 - experiment_functions - INFO - Early stopping at epoch 500. Best Metrics: (0.002088519741753519, 0.000735758494379184, 0.0013674205746647128)
2026-06-17 08:28:54,914 - optuna.study.study - INFO - Trial 147 finished with values: [0.002088519741753519, 0.000735758494379184, 0.0013674205746647128] and parameters: {'n_layers': 3, 'embedding_dim': 32, 'lr': 0.029862282646618256, 'lambda_val': 0.017784883340115937, 'batch_size': 1701, 'optimizer': 'RMSprop'}.
2026-06-17 08:29:19,980 - experiment_functions - INFO - Early stopping at epoch 500. Best Metrics: (0.0017796650381854977, 0.0004768220285461665, 0.0010170114938807884)
2026-06-17 08:29:20,057 - optuna.study.study - INFO - Trial 148 finished with values: [0.0017796650381854977, 0.0004768220285461665, 0.0010170114938807884] and parameters: {'n_layers': 1, 'embedding_dim': 256, 'lr': 0.03180567583706626, 'lambda_val': 0.02696752968375807, 'batch_size': 1833, 'optimizer': 'RMSprop'}.
2026-06-17 08:32:30,521 - optuna.study.study - INFO - Trial 149 finished with values: [0.0005450029872367195, 0.00013736263736263736, 0.0003017949790209261] and parameters: {'n_layers': 2, 'embedding_dim': 256, 'lr': 1.800097082651958e-05, 'lambda_val': 6.565445017278844e-05, 'batch_size': 1844, 'optimizer': 'Adam'}.
2026-06-17 08:33:04,365 - experiment_functions - INFO - Early stopping at epoch 700. Best Metrics: (0.0032605646115389923, 0.001048376910445876, 0.002016804246645982)
2026-06-17 08:33:04,877 - optuna.study.study - INFO - Trial 150 finished with values: [0.0032605646115389923, 0.001048376910445876, 0.002016804246645982] and parameters: {'n_layers': 1, 'embedding_dim': 256, 'lr': 0.05245038577912772, 'lambda_val': 3.737769038654263e-05, 'batch_size': 3410, 'optimizer': 'Adam'}.
2026-06-17 08:33:28,771 - experiment_functions - INFO - Early stopping at epoch 550. Best Metrics: (0.0034002181685952545, 0.001383099658961728, 0.0024110777302572945)
2026-06-17 08:33:28,850 - optuna.study.study - INFO - Trial 151 finished with values: [0.0034002181685952545, 0.001383099658961728, 0.0024110777302572945] and parameters: {'n_layers': 1, 'embedding_dim': 64, 'lr': 0.0019791454040792144, 'lambda_val': 0.00016666322755616337, 'batch_size': 1599, 'optimizer': 'RMSprop'}.
2026-06-17 08:33:50,965 - experiment_functions - INFO - Early stopping at epoch 500. Best Metrics: (0.0005768245801808012, 0.00013736263736263736, 0.00031142354933871744)
2026-06-17 08:33:51,047 - optuna.study.study - INFO - Trial 152 finished with values: [0.0005768245801808012, 0.00013736263736263736, 0.00031142354933871744] and parameters: {'n_layers': 1, 'embedding_dim': 96, 'lr': 0.024484365885130848, 'lambda_val': 3.567347607875195e-06, 'batch_size': 3266, 'optimizer': 'SGD'}.
2026-06-17 08:35:41,729 - experiment_functions - INFO - Early stopping at epoch 2700. Best Metrics: (0.003653025303162324, 0.0012867879247189591, 0.002421008708676268)
2026-06-17 08:35:41,815 - optuna.study.study - INFO - Trial 153 finished with values: [0.003653025303162324, 0.0012867879247189591, 0.002421008708676268] and parameters: {'n_layers': 1, 'embedding_dim': 64, 'lr': 0.024484365885130848, 'lambda_val': 6.872101199763191e-06, 'batch_size': 2433, 'optimizer': 'RMSprop'}.
2026-06-17 08:36:04,229 - experiment_functions - INFO - Early stopping at epoch 500. Best Metrics: (0.0005840481994141434, 0.0001231527093596059, 0.00033712995149149907)
2026-06-17 08:36:04,282 - optuna.study.study - INFO - Trial 154 finished with values: [0.0005840481994141434, 0.0001231527093596059, 0.00033712995149149907] and parameters: {'n_layers': 1, 'embedding_dim': 96, 'lr': 0.004595237871810009, 'lambda_val': 1.031526593103832e-05, 'batch_size': 3433, 'optimizer': 'SGD'}.
2026-06-17 08:36:34,204 - experiment_functions - INFO - Early stopping at epoch 550. Best Metrics: (0.002755038049474927, 0.001065744600227359, 0.0018557122630578177)
2026-06-17 08:36:34,527 - optuna.study.study - INFO - Trial 155 finished with values: [0.002755038049474927, 0.001065744600227359, 0.0018557122630578177] and parameters: {'n_layers': 3, 'embedding_dim': 256, 'lr': 0.007822927276622295, 'lambda_val': 0.0001995992787689099, 'batch_size': 1098, 'optimizer': 'Adam'}.
2026-06-17 08:37:02,193 - experiment_functions - INFO - Early stopping at epoch 550. Best Metrics: (0.001950502385162399, 0.0007878615637236328, 0.0013616561150994635)
2026-06-17 08:37:02,275 - optuna.study.study - INFO - Trial 156 finished with values: [0.001950502385162399, 0.0007878615637236328, 0.0013616561150994635] and parameters: {'n_layers': 2, 'embedding_dim': 256, 'lr': 0.0019791454040792144, 'lambda_val': 0.007692244890670793, 'batch_size': 1599, 'optimizer': 'RMSprop'}.
2026-06-17 08:37:39,151 - experiment_functions - INFO - Early stopping at epoch 850. Best Metrics: (0.0034848345710983782, 0.0012157382847038023, 0.0023182282566128944)
2026-06-17 08:37:39,217 - optuna.study.study - INFO - Trial 157 finished with values: [0.0034848345710983782, 0.0012157382847038023, 0.0023182282566128944] and parameters: {'n_layers': 1, 'embedding_dim': 64, 'lr': 0.024484365885130848, 'lambda_val': 6.872101199763191e-06, 'batch_size': 3266, 'optimizer': 'RMSprop'}.
2026-06-17 08:38:04,110 - experiment_functions - INFO - Early stopping at epoch 500. Best Metrics: (0.0019002838473291398, 0.0005652393583428065, 0.0011995214785917965)
2026-06-17 08:38:04,179 - optuna.study.study - INFO - Trial 158 finished with values: [0.0019002838473291398, 0.0005652393583428065, 0.0011995214785917965] and parameters: {'n_layers': 1, 'embedding_dim': 256, 'lr': 0.046129598836200957, 'lambda_val': 0.0290035567224736, 'batch_size': 1310, 'optimizer': 'RMSprop'}.
2026-06-17 08:38:30,759 - experiment_functions - INFO - Early stopping at epoch 600. Best Metrics: (0.003202688369035075, 0.001165214096248579, 0.0020300423968175364)
2026-06-17 08:38:30,821 - optuna.study.study - INFO - Trial 159 finished with values: [0.003202688369035075, 0.001165214096248579, 0.0020300423968175364] and parameters: {'n_layers': 1, 'embedding_dim': 64, 'lr': 0.003877789258066795, 'lambda_val': 0.00016666322755616337, 'batch_size': 1576, 'optimizer': 'RMSprop'}.
2026-06-17 08:38:55,508 - experiment_functions - INFO - Early stopping at epoch 550. Best Metrics: (0.004079759584251288, 0.0014873057976506252, 0.002775462100596208)
2026-06-17 08:38:55,593 - optuna.study.study - INFO - Trial 160 finished with values: [0.004079759584251288, 0.0014873057976506252, 0.002775462100596208] and parameters: {'n_layers': 1, 'embedding_dim': 96, 'lr': 0.007822927276622295, 'lambda_val': 3.567347607875195e-06, 'batch_size': 3433, 'optimizer': 'Adam'}.
2026-06-17 08:39:29,999 - experiment_functions - INFO - Early stopping at epoch 800. Best Metrics: (0.003529682755440873, 0.0012646835922697993, 0.002326981889009067)
2026-06-17 08:39:30,096 - optuna.study.study - INFO - Trial 161 finished with values: [0.003529682755440873, 0.0012646835922697993, 0.002326981889009067] and parameters: {'n_layers': 1, 'embedding_dim': 64, 'lr': 0.024484365885130848, 'lambda_val': 3.125135396462488e-05, 'batch_size': 3266, 'optimizer': 'RMSprop'}.
2026-06-17 08:40:19,014 - experiment_functions - INFO - Early stopping at epoch 1150. Best Metrics: (0.003409173593896836, 0.001304155614500442, 0.002243596995070469)
2026-06-17 08:40:19,114 - optuna.study.study - INFO - Trial 162 finished with values: [0.003409173593896836, 0.001304155614500442, 0.002243596995070469] and parameters: {'n_layers': 1, 'embedding_dim': 64, 'lr': 0.0004860515181398459, 'lambda_val': 0.007692244890670793, 'batch_size': 2368, 'optimizer': 'Adam'}.
2026-06-17 08:41:05,064 - experiment_functions - INFO - Early stopping at epoch 1050. Best Metrics: (0.0030023824500164677, 0.0012031072375899962, 0.002082895725898134)
2026-06-17 08:41:05,205 - optuna.study.study - INFO - Trial 163 finished with values: [0.0030023824500164677, 0.0012031072375899962, 0.002082895725898134] and parameters: {'n_layers': 1, 'embedding_dim': 128, 'lr': 0.024484365885130848, 'lambda_val': 0.00017064795272658665, 'batch_size': 3565, 'optimizer': 'RMSprop'}.
2026-06-17 08:41:32,489 - experiment_functions - INFO - Early stopping at epoch 600. Best Metrics: (0.0036783652503750456, 0.0013909940634078567, 0.0025838808374667567)
2026-06-17 08:41:32,580 - optuna.study.study - INFO - Trial 164 finished with values: [0.0036783652503750456, 0.0013909940634078567, 0.0025838808374667567] and parameters: {'n_layers': 1, 'embedding_dim': 96, 'lr': 0.003877789258066795, 'lambda_val': 3.567347607875195e-06, 'batch_size': 2336, 'optimizer': 'Adam'}.
2026-06-17 08:42:50,745 - experiment_functions - INFO - Early stopping at epoch 1800. Best Metrics: (0.0034920895270011566, 0.0012299482127068335, 0.0022720135863645197)
2026-06-17 08:42:50,823 - optuna.study.study - INFO - Trial 165 finished with values: [0.0034920895270011566, 0.0012299482127068335, 0.0022720135863645197] and parameters: {'n_layers': 1, 'embedding_dim': 128, 'lr': 0.024484365885130848, 'lambda_val': 6.872101199763191e-06, 'batch_size': 3410, 'optimizer': 'Adam'}.
2026-06-17 08:43:28,469 - experiment_functions - INFO - Early stopping at epoch 850. Best Metrics: (0.003408414860423327, 0.001222053808260705, 0.002312948667060625)
2026-06-17 08:43:28,552 - optuna.study.study - INFO - Trial 166 finished with values: [0.003408414860423327, 0.001222053808260705, 0.002312948667060625] and parameters: {'n_layers': 1, 'embedding_dim': 128, 'lr': 0.010529076355744457, 'lambda_val': 3.567347607875195e-06, 'batch_size': 1310, 'optimizer': 'RMSprop'}.
2026-06-17 08:44:31,585 - experiment_functions - INFO - Early stopping at epoch 1350. Best Metrics: (0.003115215892613462, 0.0013862574207401796, 0.002284086209743793)
2026-06-17 08:44:31,666 - optuna.study.study - INFO - Trial 167 finished with values: [0.003115215892613462, 0.0013862574207401796, 0.002284086209743793] and parameters: {'n_layers': 1, 'embedding_dim': 256, 'lr': 0.0004860515181398459, 'lambda_val': 2.1661287300450508e-05, 'batch_size': 1599, 'optimizer': 'Adam'}.
2026-06-17 08:45:25,398 - experiment_functions - INFO - Early stopping at epoch 1300. Best Metrics: (0.0039699391341113735, 0.0012252115700391562, 0.0024600620161868945)
2026-06-17 08:45:25,497 - optuna.study.study - INFO - Trial 168 finished with values: [0.0039699391341113735, 0.0012252115700391562, 0.0024600620161868945] and parameters: {'n_layers': 1, 'embedding_dim': 96, 'lr': 0.024484365885130848, 'lambda_val': 5.2927329941475195e-06, 'batch_size': 2685, 'optimizer': 'RMSprop'}.
2026-06-17 08:45:49,758 - experiment_functions - INFO - Early stopping at epoch 550. Best Metrics: (0.0036168865786387603, 0.0013957307060755335, 0.0024368582054573305)
2026-06-17 08:45:49,848 - optuna.study.study - INFO - Trial 169 finished with values: [0.0036168865786387603, 0.0013957307060755335, 0.0024368582054573305] and parameters: {'n_layers': 1, 'embedding_dim': 32, 'lr': 0.010203021680640975, 'lambda_val': 1.7261189135715837e-05, 'batch_size': 3410, 'optimizer': 'Adam'}.
2026-06-17 08:46:58,505 - experiment_functions - INFO - Early stopping at epoch 1600. Best Metrics: (0.001470453685180836, 0.000607869142351901, 0.00099606468520382)
2026-06-17 08:46:58,595 - optuna.study.study - INFO - Trial 170 finished with values: [0.001470453685180836, 0.000607869142351901, 0.00099606468520382] and parameters: {'n_layers': 1, 'embedding_dim': 64, 'lr': 0.07934419482946903, 'lambda_val': 0.010921170202248205, 'batch_size': 3410, 'optimizer': 'Adam'}.
2026-06-17 08:49:47,010 - optuna.study.study - INFO - Trial 171 finished with values: [0.0020605798542222735, 0.001081533409119616, 0.0016530091498567349] and parameters: {'n_layers': 1, 'embedding_dim': 128, 'lr': 0.00011977066411784732, 'lambda_val': 1.4626497203993128e-05, 'batch_size': 1310, 'optimizer': 'RMSprop'}.
2026-06-17 08:51:40,124 - experiment_functions - INFO - Early stopping at epoch 2750. Best Metrics: (0.000524566402769175, 0.00012631047113805733, 0.0002657012345158161)
2026-06-17 08:51:40,209 - optuna.study.study - INFO - Trial 172 finished with values: [0.000524566402769175, 0.00012631047113805733, 0.0002657012345158161] and parameters: {'n_layers': 1, 'embedding_dim': 96, 'lr': 2.8962229254441682e-05, 'lambda_val': 3.737769038654263e-05, 'batch_size': 3433, 'optimizer': 'RMSprop'}.
2026-06-17 08:52:19,620 - experiment_functions - INFO - Early stopping at epoch 950. Best Metrics: (0.0034131707403114416, 0.0009852216748768474, 0.0020779251812379335)
2026-06-17 08:52:20,042 - optuna.study.study - INFO - Trial 173 finished with values: [0.0034131707403114416, 0.0009852216748768474, 0.0020779251812379335] and parameters: {'n_layers': 2, 'embedding_dim': 32, 'lr': 0.060034049813311924, 'lambda_val': 2.373377666068493e-06, 'batch_size': 1926, 'optimizer': 'RMSprop'}.
2026-06-17 08:52:42,172 - experiment_functions - INFO - Early stopping at epoch 500. Best Metrics: (0.00046954496216694466, 0.00012315270935960593, 0.00026096167634190304)
