2026-06-20 03:39:39,776 - optuna.study.study - INFO - Trial 293 finished with values: [0.030312582052179272, 0.006236579512441582, 0.01702885681677315] and parameters: {'n_layers': 1, 'embedding_dim': 256, 'lr': 0.0020150870895911718, 'lambda_val': 4.332711516457783e-05, 'batch_size': 3313, 'optimizer': 'Adam'}.
2026-06-20 03:40:11,420 - experiment_functions - INFO - Early stopping at epoch 700. Best Metrics: (0.02107710244031666, 0.004430339775167362, 0.01187367162233464)
2026-06-20 03:40:11,510 - optuna.study.study - INFO - Trial 294 finished with values: [0.02107710244031666, 0.004430339775167362, 0.01187367162233464] and parameters: {'n_layers': 2, 'embedding_dim': 32, 'lr': 0.0020150870895911718, 'lambda_val': 3.9435940439521e-06, 'batch_size': 3304, 'optimizer': 'RMSprop'}.
2026-06-20 03:42:58,452 - optuna.study.study - INFO - Trial 295 finished with values: [0.030821531457315744, 0.0064118352911456365, 0.017713214177761005] and parameters: {'n_layers': 1, 'embedding_dim': 32, 'lr': 0.0020150870895911718, 'lambda_val': 4.332711516457783e-05, 'batch_size': 1780, 'optimizer': 'RMSprop'}.
2026-06-20 03:43:33,917 - experiment_functions - INFO - Early stopping at epoch 700. Best Metrics: (0.003910149643006284, 0.000986800555766073, 0.0024422778082567997)
2026-06-20 03:43:34,034 - optuna.study.study - INFO - Trial 296 finished with values: [0.003910149643006284, 0.000986800555766073, 0.0024422778082567997] and parameters: {'n_layers': 1, 'embedding_dim': 256, 'lr': 0.06963148570474234, 'lambda_val': 2.3360853516346427e-06, 'batch_size': 3592, 'optimizer': 'RMSprop'}.
2026-06-20 03:46:22,600 - optuna.study.study - INFO - Trial 297 finished with values: [0.03063029765404004, 0.006550776809397499, 0.017544729060090313] and parameters: {'n_layers': 1, 'embedding_dim': 32, 'lr': 0.000778135007488856, 'lambda_val': 2.710386902101323e-06, 'batch_size': 2518, 'optimizer': 'RMSprop'}.
2026-06-20 03:47:04,747 - experiment_functions - INFO - Early stopping at epoch 950. Best Metrics: (0.030172888875125897, 0.006334470127573577, 0.017014539416691104)
2026-06-20 03:47:04,815 - optuna.study.study - INFO - Trial 298 finished with values: [0.030172888875125897, 0.006334470127573577, 0.017014539416691104] and parameters: {'n_layers': 1, 'embedding_dim': 32, 'lr': 0.0020150870895911718, 'lambda_val': 4.332711516457783e-05, 'batch_size': 3304, 'optimizer': 'RMSprop'}.
2026-06-20 03:50:05,058 - optuna.study.study - INFO - Trial 299 finished with values: [0.034735940905418865, 0.0070986484779588235, 0.019476090004287235] and parameters: {'n_layers': 1, 'embedding_dim': 128, 'lr': 0.0010742990196571252, 'lambda_val': 1.2446467426024901e-06, 'batch_size': 3313, 'optimizer': 'Adam'}.
2026-06-20 03:50:05,073 - root - INFO - Selected Trial 190 based on Max ndcg: 0.0200
2026-06-20 03:50:05,073 - root - INFO - Associated Recall: 0.0349
2026-06-20 03:50:05,073 - experiment_functions - INFO - Training the best model ... for e_yelp_1c1dcs_rand3
2026-06-20 03:51:58,398 - experiment_functions - INFO - Early stopping at epoch 2700. Best Metrics: (0.03290499307857535, 0.006763925729442971, 0.018742651416455883)
2026-06-20 03:52:02,599 - root - INFO -   **** Training e_yelp_1c1dcs_rand4
2026-06-20 03:52:02,728 - root - INFO -   **** Getting 421521/1274132 random edges
2026-06-20 03:52:02,978 - optuna.storages._rdb.storage - INFO - A new study created in RDB with name: Study_e_yelp_1c1dcs_rand4
2026-06-20 03:52:33,239 - experiment_functions - INFO - Early stopping at epoch 500. Best Metrics: (0.0006195917065640547, 0.00011999494758115447, 0.0002869001917082498)
2026-06-20 03:52:33,327 - optuna.study.study - INFO - Trial 0 finished with values: [0.0006195917065640547, 0.00011999494758115447, 0.0002869001917082498] and parameters: {'n_layers': 3, 'embedding_dim': 256, 'lr': 0.002080319054985919, 'lambda_val': 0.0009902624306519794, 'batch_size': 3529, 'optimizer': 'SGD'}.
2026-06-20 03:53:09,641 - experiment_functions - INFO - Early stopping at epoch 550. Best Metrics: (0.007798127794211657, 0.0015915119363395227, 0.00426714523511675)
2026-06-20 03:53:09,736 - optuna.study.study - INFO - Trial 1 finished with values: [0.007798127794211657, 0.0015915119363395227, 0.00426714523511675] and parameters: {'n_layers': 4, 'embedding_dim': 256, 'lr': 0.007001952181523415, 'lambda_val': 0.0009091531694926743, 'batch_size': 631, 'optimizer': 'RMSprop'}.
2026-06-20 03:53:34,317 - experiment_functions - INFO - Early stopping at epoch 500. Best Metrics: (0.000523505865088441, 0.0001294682329165088, 0.0002966955778360701)
2026-06-20 03:53:34,389 - optuna.study.study - INFO - Trial 2 finished with values: [0.000523505865088441, 0.0001294682329165088, 0.0002966955778360701] and parameters: {'n_layers': 4, 'embedding_dim': 64, 'lr': 1.9220259801613276e-05, 'lambda_val': 0.0003478393968718491, 'batch_size': 2453, 'optimizer': 'SGD'}.
2026-06-20 03:53:59,468 - experiment_functions - INFO - Early stopping at epoch 550. Best Metrics: (0.0062186274427922265, 0.0014257294429708223, 0.0036698966034942695)
2026-06-20 03:54:00,151 - optuna.study.study - INFO - Trial 3 finished with values: [0.0062186274427922265, 0.0014257294429708223, 0.0036698966034942695] and parameters: {'n_layers': 4, 'embedding_dim': 32, 'lr': 0.002099990505043131, 'lambda_val': 0.024205880733871414, 'batch_size': 941, 'optimizer': 'RMSprop'}.
2026-06-20 03:54:27,065 - experiment_functions - INFO - Early stopping at epoch 550. Best Metrics: (0.006236778170160717, 0.0013420487558418594, 0.003439160700468031)
2026-06-20 03:54:27,197 - optuna.study.study - INFO - Trial 4 finished with values: [0.006236778170160717, 0.0013420487558418594, 0.003439160700468031] and parameters: {'n_layers': 4, 'embedding_dim': 64, 'lr': 0.08305721718816232, 'lambda_val': 3.1573245793118836e-06, 'batch_size': 3364, 'optimizer': 'Adam'}.
2026-06-20 03:54:53,868 - experiment_functions - INFO - Early stopping at epoch 550. Best Metrics: (0.00366792166240933, 0.0008668056081849187, 0.002271054464041075)
2026-06-20 03:54:54,032 - optuna.study.study - INFO - Trial 5 finished with values: [0.00366792166240933, 0.0008668056081849187, 0.002271054464041075] and parameters: {'n_layers': 4, 'embedding_dim': 64, 'lr': 0.006678676571422479, 'lambda_val': 0.08414848274404776, 'batch_size': 1231, 'optimizer': 'Adam'}.
2026-06-20 03:55:21,561 - experiment_functions - INFO - Early stopping at epoch 500. Best Metrics: (0.0006897774341511186, 0.00013262599469496025, 0.00035650183244321707)
2026-06-20 03:55:21,648 - optuna.study.study - INFO - Trial 6 finished with values: [0.0006897774341511186, 0.00013262599469496025, 0.00035650183244321707] and parameters: {'n_layers': 2, 'embedding_dim': 256, 'lr': 0.00030425770122083373, 'lambda_val': 0.08539755150146323, 'batch_size': 2525, 'optimizer': 'SGD'}.
2026-06-20 03:56:03,083 - experiment_functions - INFO - Early stopping at epoch 750. Best Metrics: (0.0006007716379665905, 0.00013420487558418593, 0.0003407825786637472)
2026-06-20 03:56:03,178 - optuna.study.study - INFO - Trial 7 finished with values: [0.0006007716379665905, 0.00013420487558418593, 0.0003407825786637472] and parameters: {'n_layers': 2, 'embedding_dim': 256, 'lr': 7.524192790776409e-05, 'lambda_val': 0.0012518480029277007, 'batch_size': 3312, 'optimizer': 'Adam'}.
2026-06-20 03:56:27,742 - experiment_functions - INFO - Early stopping at epoch 500. Best Metrics: (0.0005803680473286857, 0.00012473159024883163, 0.00030531818477415063)
2026-06-20 03:56:27,819 - optuna.study.study - INFO - Trial 8 finished with values: [0.0005803680473286857, 0.00012473159024883163, 0.00030531818477415063] and parameters: {'n_layers': 2, 'embedding_dim': 128, 'lr': 0.0006944820841956275, 'lambda_val': 0.008547693852884232, 'batch_size': 2770, 'optimizer': 'SGD'}.
2026-06-20 03:56:58,288 - experiment_functions - INFO - Early stopping at epoch 500. Best Metrics: (0.0006334792005549636, 0.0001310471138057345, 0.000336998669744137)
2026-06-20 03:56:58,561 - optuna.study.study - INFO - Trial 9 finished with values: [0.0006334792005549636, 0.0001310471138057345, 0.000336998669744137] and parameters: {'n_layers': 3, 'embedding_dim': 256, 'lr': 0.004958786625127089, 'lambda_val': 0.0029983063298513035, 'batch_size': 3527, 'optimizer': 'SGD'}.
2026-06-20 03:57:29,798 - experiment_functions - INFO - Early stopping at epoch 700. Best Metrics: (0.013969234999815899, 0.002939876215738285, 0.007480406079226837)
2026-06-20 03:57:29,899 - optuna.study.study - INFO - Trial 10 finished with values: [0.013969234999815899, 0.002939876215738285, 0.007480406079226837] and parameters: {'n_layers': 1, 'embedding_dim': 64, 'lr': 0.007781060326314749, 'lambda_val': 0.0004431939130698793, 'batch_size': 3524, 'optimizer': 'RMSprop'}.
2026-06-20 03:57:52,437 - experiment_functions - INFO - Early stopping at epoch 500. Best Metrics: (0.00046463607112288676, 0.0001121005431350259, 0.00028598292447092874)
2026-06-20 03:57:52,538 - optuna.study.study - INFO - Trial 11 finished with values: [0.00046463607112288676, 0.0001121005431350259, 0.00028598292447092874] and parameters: {'n_layers': 2, 'embedding_dim': 32, 'lr': 0.003136090810890905, 'lambda_val': 0.0007431974991406018, 'batch_size': 3840, 'optimizer': 'SGD'}.
2026-06-20 03:58:28,617 - experiment_functions - INFO - Early stopping at epoch 750. Best Metrics: (0.004561913290907613, 0.0010310092206643933, 0.0024244481355660884)
2026-06-20 03:58:28,720 - optuna.study.study - INFO - Trial 12 finished with values: [0.004561913290907613, 0.0010310092206643933, 0.0024244481355660884] and parameters: {'n_layers': 2, 'embedding_dim': 128, 'lr': 0.00198213638870542, 'lambda_val': 0.06073091100173413, 'batch_size': 3673, 'optimizer': 'RMSprop'}.
2026-06-20 03:58:51,226 - experiment_functions - INFO - Early stopping at epoch 500. Best Metrics: (0.00044331849315069465, 0.00010736390046734875, 0.0002906192149705766)
2026-06-20 03:58:51,327 - optuna.study.study - INFO - Trial 13 finished with values: [0.00044331849315069465, 0.00010736390046734875, 0.0002906192149705766] and parameters: {'n_layers': 2, 'embedding_dim': 32, 'lr': 3.034371099219421e-05, 'lambda_val': 9.43959748706296e-06, 'batch_size': 3137, 'optimizer': 'SGD'}.
2026-06-20 03:59:14,406 - experiment_functions - INFO - Early stopping at epoch 500. Best Metrics: (0.0005095869879160813, 0.0001121005431350259, 0.00027709067704412104)
2026-06-20 03:59:14,497 - optuna.study.study - INFO - Trial 14 finished with values: [0.0005095869879160813, 0.0001121005431350259, 0.00027709067704412104] and parameters: {'n_layers': 1, 'embedding_dim': 128, 'lr': 2.370649179326126e-05, 'lambda_val': 0.03153873739344872, 'batch_size': 2871, 'optimizer': 'SGD'}.
2026-06-20 03:59:42,782 - experiment_functions - INFO - Early stopping at epoch 500. Best Metrics: (0.0005679488385302708, 0.00012631047113805733, 0.0003312509860868262)
2026-06-20 03:59:42,875 - optuna.study.study - INFO - Trial 15 finished with values: [0.0005679488385302708, 0.00012631047113805733, 0.0003312509860868262] and parameters: {'n_layers': 2, 'embedding_dim': 256, 'lr': 0.00032984323787186323, 'lambda_val': 0.08571363264394309, 'batch_size': 2516, 'optimizer': 'Adam'}.
2026-06-20 04:00:07,380 - experiment_functions - INFO - Early stopping at epoch 500. Best Metrics: (0.00055091052979192, 0.00012631047113805733, 0.0003007571164815135)
2026-06-20 04:00:07,465 - optuna.study.study - INFO - Trial 16 finished with values: [0.00055091052979192, 0.00012631047113805733, 0.0003007571164815135] and parameters: {'n_layers': 4, 'embedding_dim': 64, 'lr': 0.00014217907498133154, 'lambda_val': 0.004600138235913327, 'batch_size': 2368, 'optimizer': 'SGD'}.
2026-06-20 04:00:39,162 - experiment_functions - INFO - Early stopping at epoch 700. Best Metrics: (0.018153119907355655, 0.0039424655803966145, 0.010064010782241376)
2026-06-20 04:00:39,251 - optuna.study.study - INFO - Trial 17 finished with values: [0.018153119907355655, 0.0039424655803966145, 0.010064010782241376] and parameters: {'n_layers': 1, 'embedding_dim': 96, 'lr': 0.006464794462742712, 'lambda_val': 0.0022723744163998237, 'batch_size': 850, 'optimizer': 'Adam'}.
2026-06-20 04:01:50,665 - experiment_functions - INFO - Early stopping at epoch 1600. Best Metrics: (0.028083376757940138, 0.005908172287482633, 0.015735005275992194)
2026-06-20 04:01:50,755 - optuna.study.study - INFO - Trial 18 finished with values: [0.028083376757940138, 0.005908172287482633, 0.015735005275992194] and parameters: {'n_layers': 2, 'embedding_dim': 64, 'lr': 0.0006438418474980425, 'lambda_val': 1.0112597680663849e-05, 'batch_size': 2782, 'optimizer': 'RMSprop'}.
2026-06-20 04:02:38,154 - experiment_functions - INFO - Early stopping at epoch 800. Best Metrics: (0.00046454819505010146, 0.00010578501957812305, 0.00025862682761924573)
2026-06-20 04:02:38,244 - optuna.study.study - INFO - Trial 19 finished with values: [0.00046454819505010146, 0.00010578501957812305, 0.00025862682761924573] and parameters: {'n_layers': 3, 'embedding_dim': 256, 'lr': 1.3082510347966049e-05, 'lambda_val': 4.73766341587652e-06, 'batch_size': 2374, 'optimizer': 'RMSprop'}.
2026-06-20 04:03:26,492 - experiment_functions - INFO - Early stopping at epoch 1100. Best Metrics: (0.017720197367682385, 0.0039298345332828095, 0.009745420026747073)
2026-06-20 04:03:26,567 - optuna.study.study - INFO - Trial 20 finished with values: [0.017720197367682385, 0.0039298345332828095, 0.009745420026747073] and parameters: {'n_layers': 3, 'embedding_dim': 32, 'lr': 0.000904089143485971, 'lambda_val': 0.0066875037866738676, 'batch_size': 1192, 'optimizer': 'RMSprop'}.
2026-06-20 04:03:56,662 - experiment_functions - INFO - Early stopping at epoch 500. Best Metrics: (0.0006636315577512965, 0.00013578375647341163, 0.0003808301657087038)
2026-06-20 04:03:56,754 - optuna.study.study - INFO - Trial 21 finished with values: [0.0006636315577512965, 0.00013578375647341163, 0.0003808301657087038] and parameters: {'n_layers': 3, 'embedding_dim': 256, 'lr': 0.00022027863565489018, 'lambda_val': 4.303236972228742e-06, 'batch_size': 1869, 'optimizer': 'SGD'}.
2026-06-20 04:04:25,599 - experiment_functions - INFO - Early stopping at epoch 600. Best Metrics: (0.025682874973783354, 0.005537135278514589, 0.014909179826015412)
2026-06-20 04:04:25,695 - optuna.study.study - INFO - Trial 22 finished with values: [0.025682874973783354, 0.005537135278514589, 0.014909179826015412] and parameters: {'n_layers': 1, 'embedding_dim': 128, 'lr': 0.008804952478863077, 'lambda_val': 6.868274004831431e-05, 'batch_size': 3338, 'optimizer': 'Adam'}.
2026-06-20 04:06:19,251 - experiment_functions - INFO - Early stopping at epoch 2350. Best Metrics: (0.00724662857197203, 0.001689402551471517, 0.004039775854008867)
2026-06-20 04:06:19,346 - optuna.study.study - INFO - Trial 23 finished with values: [0.00724662857197203, 0.001689402551471517, 0.004039775854008867] and parameters: {'n_layers': 1, 'embedding_dim': 256, 'lr': 0.011366982784829003, 'lambda_val': 0.010631670857151724, 'batch_size': 3917, 'optimizer': 'RMSprop'}.
2026-06-20 04:06:51,006 - experiment_functions - INFO - Early stopping at epoch 700. Best Metrics: (0.0003723176433312557, 9.31539724643173e-05, 0.0002007313126162503)
2026-06-20 04:06:51,121 - optuna.study.study - INFO - Trial 24 finished with values: [0.0003723176433312557, 9.31539724643173e-05, 0.0002007313126162503] and parameters: {'n_layers': 1, 'embedding_dim': 96, 'lr': 2.9130534641559652e-05, 'lambda_val': 1.1460261998240768e-06, 'batch_size': 1251, 'optimizer': 'RMSprop'}.
2026-06-20 04:07:22,637 - experiment_functions - INFO - Early stopping at epoch 600. Best Metrics: (0.007974311900787573, 0.0016736137425792598, 0.004150509895425554)
2026-06-20 04:07:22,757 - optuna.study.study - INFO - Trial 25 finished with values: [0.007974311900787573, 0.0016736137425792598, 0.004150509895425554] and parameters: {'n_layers': 4, 'embedding_dim': 96, 'lr': 0.002668806132567397, 'lambda_val': 0.015665527252443415, 'batch_size': 3874, 'optimizer': 'Adam'}.
2026-06-20 04:10:32,642 - optuna.study.study - INFO - Trial 26 finished with values: [0.0013145489885891411, 0.0003284072249589491, 0.000753908757352556] and parameters: {'n_layers': 1, 'embedding_dim': 256, 'lr': 0.00020334661244642384, 'lambda_val': 0.000299333475182023, 'batch_size': 2683, 'optimizer': 'RMSprop'}.
2026-06-20 04:11:44,436 - experiment_functions - INFO - Early stopping at epoch 1550. Best Metrics: (0.0005784177695716437, 0.00012946823291650877, 0.0003271612645293933)
2026-06-20 04:11:44,516 - optuna.study.study - INFO - Trial 27 finished with values: [0.0005784177695716437, 0.00012946823291650877, 0.0003271612645293933] and parameters: {'n_layers': 3, 'embedding_dim': 96, 'lr': 3.031064165450504e-05, 'lambda_val': 3.247549575576274e-06, 'batch_size': 3914, 'optimizer': 'Adam'}.
2026-06-20 04:12:11,010 - experiment_functions - INFO - Early stopping at epoch 500. Best Metrics: (0.0005427496410286355, 0.0001215738284703802, 0.0003034218633546766)
2026-06-20 04:12:11,103 - optuna.study.study - INFO - Trial 28 finished with values: [0.0005427496410286355, 0.0001215738284703802, 0.0003034218633546766] and parameters: {'n_layers': 3, 'embedding_dim': 128, 'lr': 6.248675726120522e-05, 'lambda_val': 0.0005428476861066814, 'batch_size': 3927, 'optimizer': 'SGD'}.
2026-06-20 04:12:36,502 - experiment_functions - INFO - Early stopping at epoch 500. Best Metrics: (0.0004809059487229222, 9.946949602122016e-05, 0.00026496881216337326)
2026-06-20 04:12:37,352 - optuna.study.study - INFO - Trial 29 finished with values: [0.0004809059487229222, 9.946949602122016e-05, 0.00026496881216337326] and parameters: {'n_layers': 2, 'embedding_dim': 128, 'lr': 3.989628772142258e-05, 'lambda_val': 0.004545774966667393, 'batch_size': 3191, 'optimizer': 'Adam'}.
2026-06-20 04:15:04,020 - experiment_functions - INFO - Early stopping at epoch 3400. Best Metrics: (0.033260987684705236, 0.006888657319691804, 0.019563017706098418)
2026-06-20 04:15:04,103 - optuna.study.study - INFO - Trial 30 finished with values: [0.033260987684705236, 0.006888657319691804, 0.019563017706098418] and parameters: {'n_layers': 1, 'embedding_dim': 32, 'lr': 0.0012953028594055518, 'lambda_val': 3.64590979484011e-06, 'batch_size': 2973, 'optimizer': 'RMSprop'}.
2026-06-20 04:15:29,561 - experiment_functions - INFO - Early stopping at epoch 500. Best Metrics: (0.0005049064395972691, 0.00010736390046734875, 0.0003000584759018448)
2026-06-20 04:15:29,883 - optuna.study.study - INFO - Trial 31 finished with values: [0.0005049064395972691, 0.00010736390046734875, 0.0003000584759018448] and parameters: {'n_layers': 1, 'embedding_dim': 256, 'lr': 0.03592527199284198, 'lambda_val': 0.0011171827933879725, 'batch_size': 3724, 'optimizer': 'SGD'}.
2026-06-20 04:18:14,482 - optuna.study.study - INFO - Trial 32 finished with values: [0.006648087687226502, 0.0016183529114563598, 0.004201367104543971] and parameters: {'n_layers': 1, 'embedding_dim': 32, 'lr': 0.00044096455101841835, 'lambda_val': 8.61904669350218e-05, 'batch_size': 2313, 'optimizer': 'Adam'}.
2026-06-20 04:18:39,450 - experiment_functions - INFO - Early stopping at epoch 500. Best Metrics: (0.0005053609727161637, 0.00012157382847038021, 0.0002839769925476508)
2026-06-20 04:18:39,550 - optuna.study.study - INFO - Trial 33 finished with values: [0.0005053609727161637, 0.00012157382847038021, 0.0002839769925476508] and parameters: {'n_layers': 3, 'embedding_dim': 96, 'lr': 0.00010653325650904156, 'lambda_val': 8.155419992258185e-05, 'batch_size': 1371, 'optimizer': 'SGD'}.
2026-06-20 04:20:01,190 - experiment_functions - INFO - Early stopping at epoch 1800. Best Metrics: (0.0006199440432701548, 0.00011683718580270304, 0.00033719590977673673)
2026-06-20 04:20:01,276 - optuna.study.study - INFO - Trial 34 finished with values: [0.0006199440432701548, 0.00011683718580270304, 0.00033719590977673673] and parameters: {'n_layers': 4, 'embedding_dim': 64, 'lr': 1.208238366360822e-05, 'lambda_val': 0.00023244261764221092, 'batch_size': 3293, 'optimizer': 'Adam'}.
2026-06-20 04:22:51,013 - optuna.study.study - INFO - Trial 35 finished with values: [0.024237024611187576, 0.005374510546924341, 0.013543928300226115] and parameters: {'n_layers': 3, 'embedding_dim': 32, 'lr': 0.00041090885210817534, 'lambda_val': 0.00554832927684527, 'batch_size': 1299, 'optimizer': 'RMSprop'}.
2026-06-20 04:26:18,365 - optuna.study.study - INFO - Trial 36 finished with values: [0.024314012026026496, 0.00520872805355564, 0.014107829143963144] and parameters: {'n_layers': 4, 'embedding_dim': 128, 'lr': 0.00021874714734455622, 'lambda_val': 0.00012018704157732538, 'batch_size': 3213, 'optimizer': 'RMSprop'}.
2026-06-20 04:27:08,416 - experiment_functions - INFO - Early stopping at epoch 1050. Best Metrics: (0.004269027509523051, 0.0009346974864216244, 0.0022777312231488157)
2026-06-20 04:27:08,497 - optuna.study.study - INFO - Trial 37 finished with values: [0.004269027509523051, 0.0009346974864216244, 0.0022777312231488157] and parameters: {'n_layers': 2, 'embedding_dim': 128, 'lr': 0.002488784556108625, 'lambda_val': 0.04528396891807359, 'batch_size': 3770, 'optimizer': 'RMSprop'}.
2026-06-20 04:27:35,855 - experiment_functions - INFO - Early stopping at epoch 600. Best Metrics: (0.0004823741869342261, 0.00011999494758115447, 0.00028748835354999654)
2026-06-20 04:27:35,936 - optuna.study.study - INFO - Trial 38 finished with values: [0.0004823741869342261, 0.00011999494758115447, 0.00028748835354999654] and parameters: {'n_layers': 3, 'embedding_dim': 32, 'lr': 3.177941619862569e-05, 'lambda_val': 0.023380604178691086, 'batch_size': 554, 'optimizer': 'Adam'}.
2026-06-20 04:28:07,547 - experiment_functions - INFO - Early stopping at epoch 550. Best Metrics: (0.005673200542814008, 0.0012315270935960591, 0.003238651398741966)
