2026-06-17 20:43:37,567 - optuna.study.study - INFO - Trial 222 finished with values: [0.002933328532955088, 0.0007799671592775042, 0.0018368774582669175] and parameters: {'n_layers': 4, 'embedding_dim': 96, 'lr': 0.004937154060813022, 'lambda_val': 0.00015820612384227593, 'batch_size': 2599, 'optimizer': 'Adam'}.
2026-06-17 20:44:09,223 - experiment_functions - INFO - Early stopping at epoch 550. Best Metrics: (0.0030597756160425336, 0.0008241758241758242, 0.0019558477062981334)
2026-06-17 20:44:09,295 - optuna.study.study - INFO - Trial 223 finished with values: [0.0030597756160425336, 0.0008241758241758242, 0.0019558477062981334] and parameters: {'n_layers': 4, 'embedding_dim': 256, 'lr': 0.0032052069599508804, 'lambda_val': 4.337539728895895e-06, 'batch_size': 1849, 'optimizer': 'RMSprop'}.
2026-06-17 20:45:03,890 - experiment_functions - INFO - Early stopping at epoch 1050. Best Metrics: (0.003404731816471532, 0.0008715422508525957, 0.0021619915285913264)
2026-06-17 20:45:03,970 - optuna.study.study - INFO - Trial 224 finished with values: [0.003404731816471532, 0.0008715422508525957, 0.0021619915285913264] and parameters: {'n_layers': 3, 'embedding_dim': 256, 'lr': 0.0012702568149946026, 'lambda_val': 8.796328661080472e-05, 'batch_size': 1751, 'optimizer': 'RMSprop'}.
2026-06-17 20:46:44,401 - experiment_functions - INFO - Early stopping at epoch 2350. Best Metrics: (0.000538154559472276, 0.00011683718580270305, 0.0002873846888183419)
2026-06-17 20:46:44,488 - optuna.study.study - INFO - Trial 225 finished with values: [0.000538154559472276, 0.00011683718580270305, 0.0002873846888183419] and parameters: {'n_layers': 4, 'embedding_dim': 64, 'lr': 2.901869458748619e-05, 'lambda_val': 0.00027195197586368466, 'batch_size': 806, 'optimizer': 'Adam'}.
2026-06-17 20:47:18,312 - experiment_functions - INFO - Early stopping at epoch 750. Best Metrics: (0.00348814409299954, 0.0008557534419603384, 0.002276740607435819)
2026-06-17 20:47:18,393 - optuna.study.study - INFO - Trial 226 finished with values: [0.00348814409299954, 0.0008557534419603384, 0.002276740607435819] and parameters: {'n_layers': 4, 'embedding_dim': 64, 'lr': 0.0036567747130372475, 'lambda_val': 0.00040852653324075796, 'batch_size': 827, 'optimizer': 'Adam'}.
2026-06-17 20:49:51,669 - experiment_functions - INFO - Early stopping at epoch 3750. Best Metrics: (0.0027657910312076615, 0.0005920803334596438, 0.0016706916484018602)
2026-06-17 20:49:51,752 - optuna.study.study - INFO - Trial 227 finished with values: [0.0027657910312076615, 0.0005920803334596438, 0.0016706916484018602] and parameters: {'n_layers': 4, 'embedding_dim': 32, 'lr': 0.00023881138073756912, 'lambda_val': 8.796328661080472e-05, 'batch_size': 3875, 'optimizer': 'Adam'}.
2026-06-17 20:51:12,157 - experiment_functions - INFO - Early stopping at epoch 1800. Best Metrics: (0.00046063540569639795, 0.00010578501957812301, 0.0002470064191014139)
2026-06-17 20:51:12,228 - optuna.study.study - INFO - Trial 228 finished with values: [0.00046063540569639795, 0.00010578501957812301, 0.0002470064191014139] and parameters: {'n_layers': 3, 'embedding_dim': 128, 'lr': 1.1592151666401931e-05, 'lambda_val': 4.337539728895895e-06, 'batch_size': 1849, 'optimizer': 'RMSprop'}.
2026-06-17 20:52:20,864 - experiment_functions - INFO - Early stopping at epoch 1500. Best Metrics: (0.003681965024278755, 0.0008810155361879501, 0.00219367865493369)
2026-06-17 20:52:20,945 - optuna.study.study - INFO - Trial 229 finished with values: [0.003681965024278755, 0.0008810155361879501, 0.00219367865493369] and parameters: {'n_layers': 3, 'embedding_dim': 128, 'lr': 0.0012702568149946026, 'lambda_val': 4.4572768261600244e-05, 'batch_size': 1059, 'optimizer': 'Adam'}.
2026-06-17 20:52:44,920 - experiment_functions - INFO - Early stopping at epoch 500. Best Metrics: (0.0005287406975784556, 0.00012157382847038021, 0.0003041043603107743)
2026-06-17 20:52:46,016 - optuna.study.study - INFO - Trial 230 finished with values: [0.0005287406975784556, 0.00012157382847038021, 0.0003041043603107743] and parameters: {'n_layers': 4, 'embedding_dim': 96, 'lr': 0.0012702568149946026, 'lambda_val': 0.00015820612384227593, 'batch_size': 2599, 'optimizer': 'SGD'}.
2026-06-17 20:53:12,029 - experiment_functions - INFO - Early stopping at epoch 550. Best Metrics: (0.0030727285170706036, 0.0007183908045977012, 0.0019422349978608663)
2026-06-17 20:53:12,105 - optuna.study.study - INFO - Trial 231 finished with values: [0.0030727285170706036, 0.0007183908045977012, 0.0019422349978608663] and parameters: {'n_layers': 2, 'embedding_dim': 128, 'lr': 0.01562100019075772, 'lambda_val': 2.1183457368999824e-05, 'batch_size': 1377, 'optimizer': 'Adam'}.
2026-06-17 20:53:52,962 - experiment_functions - INFO - Early stopping at epoch 950. Best Metrics: (0.002900094033654801, 0.0006773399014778326, 0.0018310518279240576)
2026-06-17 20:53:53,070 - optuna.study.study - INFO - Trial 232 finished with values: [0.002900094033654801, 0.0006773399014778326, 0.0018310518279240576] and parameters: {'n_layers': 2, 'embedding_dim': 64, 'lr': 0.0012702568149946026, 'lambda_val': 8.796328661080472e-05, 'batch_size': 3850, 'optimizer': 'RMSprop'}.
2026-06-17 20:54:33,412 - experiment_functions - INFO - Early stopping at epoch 950. Best Metrics: (0.003278460602071978, 0.0007704938739421498, 0.002069646196886161)
2026-06-17 20:54:34,039 - optuna.study.study - INFO - Trial 233 finished with values: [0.003278460602071978, 0.0007704938739421498, 0.002069646196886161] and parameters: {'n_layers': 3, 'embedding_dim': 32, 'lr': 0.0032052069599508804, 'lambda_val': 0.00037637631950452986, 'batch_size': 806, 'optimizer': 'Adam'}.
2026-06-17 20:57:19,907 - optuna.study.study - INFO - Trial 234 finished with values: [0.002838772239984693, 0.0005999747379057725, 0.0016531711640721545] and parameters: {'n_layers': 1, 'embedding_dim': 128, 'lr': 0.000416242081306151, 'lambda_val': 0.0012364501785880905, 'batch_size': 1377, 'optimizer': 'Adam'}.
2026-06-17 20:57:50,489 - experiment_functions - INFO - Early stopping at epoch 700. Best Metrics: (0.00288530150528992, 0.000691549829480864, 0.0019423188218550041)
2026-06-17 20:57:50,562 - optuna.study.study - INFO - Trial 235 finished with values: [0.00288530150528992, 0.000691549829480864, 0.0019423188218550041] and parameters: {'n_layers': 4, 'embedding_dim': 32, 'lr': 0.0036567747130372475, 'lambda_val': 8.796328661080472e-05, 'batch_size': 2347, 'optimizer': 'Adam'}.
2026-06-17 20:58:13,948 - experiment_functions - INFO - Early stopping at epoch 500. Best Metrics: (0.001604838183472484, 0.0003899835796387521, 0.0010613630946805833)
2026-06-17 20:58:14,045 - optuna.study.study - INFO - Trial 236 finished with values: [0.001604838183472484, 0.0003899835796387521, 0.0010613630946805833] and parameters: {'n_layers': 4, 'embedding_dim': 64, 'lr': 0.0922646028089524, 'lambda_val': 0.00010081340740714468, 'batch_size': 2231, 'optimizer': 'RMSprop'}.
2026-06-17 20:58:58,904 - experiment_functions - INFO - Early stopping at epoch 1050. Best Metrics: (0.003046363819241327, 0.0007168119237084755, 0.001941827860816473)
2026-06-17 20:58:58,980 - optuna.study.study - INFO - Trial 237 finished with values: [0.003046363819241327, 0.0007168119237084755, 0.001941827860816473] and parameters: {'n_layers': 2, 'embedding_dim': 64, 'lr': 0.0012702568149946026, 'lambda_val': 0.00010081340740714468, 'batch_size': 1751, 'optimizer': 'RMSprop'}.
2026-06-17 20:59:32,209 - experiment_functions - INFO - Early stopping at epoch 700. Best Metrics: (0.0030167067497995186, 0.000775230516609827, 0.0019548236793042934)
2026-06-17 20:59:32,315 - optuna.study.study - INFO - Trial 238 finished with values: [0.0030167067497995186, 0.000775230516609827, 0.0019548236793042934] and parameters: {'n_layers': 4, 'embedding_dim': 96, 'lr': 0.0036567747130372475, 'lambda_val': 0.00013068488873874023, 'batch_size': 3139, 'optimizer': 'Adam'}.
2026-06-17 21:00:24,664 - experiment_functions - INFO - Early stopping at epoch 1100. Best Metrics: (0.003107008394961811, 0.0008210180623973727, 0.0019361306718688573)
2026-06-17 21:00:24,736 - optuna.study.study - INFO - Trial 239 finished with values: [0.003107008394961811, 0.0008210180623973727, 0.0019361306718688573] and parameters: {'n_layers': 4, 'embedding_dim': 128, 'lr': 0.0016500377880168946, 'lambda_val': 4.337539728895895e-06, 'batch_size': 3850, 'optimizer': 'RMSprop'}.
2026-06-17 21:00:56,263 - experiment_functions - INFO - Early stopping at epoch 550. Best Metrics: (0.0030675255107936866, 0.0007989137299482127, 0.0019646170502858125)
2026-06-17 21:00:56,523 - optuna.study.study - INFO - Trial 240 finished with values: [0.0030675255107936866, 0.0007989137299482127, 0.0019646170502858125] and parameters: {'n_layers': 4, 'embedding_dim': 256, 'lr': 0.005496905689472121, 'lambda_val': 4.4572768261600244e-05, 'batch_size': 3947, 'optimizer': 'RMSprop'}.
2026-06-17 21:01:21,161 - experiment_functions - INFO - Early stopping at epoch 550. Best Metrics: (0.0016066547065925513, 0.0004026146267525578, 0.00105780784373815)
2026-06-17 21:01:21,242 - optuna.study.study - INFO - Trial 241 finished with values: [0.0016066547065925513, 0.0004026146267525578, 0.00105780784373815] and parameters: {'n_layers': 1, 'embedding_dim': 64, 'lr': 0.022971998316733053, 'lambda_val': 0.0069523388896965115, 'batch_size': 806, 'optimizer': 'Adam'}.
2026-06-17 21:01:57,806 - experiment_functions - INFO - Early stopping at epoch 750. Best Metrics: (0.0031450080928971114, 0.0008162814197296956, 0.002015582820725266)
2026-06-17 21:01:57,886 - optuna.study.study - INFO - Trial 242 finished with values: [0.0031450080928971114, 0.0008162814197296956, 0.002015582820725266] and parameters: {'n_layers': 4, 'embedding_dim': 96, 'lr': 0.0015933103817621604, 'lambda_val': 9.638501122128868e-05, 'batch_size': 3825, 'optimizer': 'RMSprop'}.
2026-06-17 21:02:41,346 - experiment_functions - INFO - Early stopping at epoch 800. Best Metrics: (0.0029696698575613378, 0.0008099658961727928, 0.0018725589385280668)
2026-06-17 21:02:41,419 - optuna.study.study - INFO - Trial 243 finished with values: [0.0029696698575613378, 0.0008099658961727928, 0.0018725589385280668] and parameters: {'n_layers': 3, 'embedding_dim': 256, 'lr': 0.0032052069599508804, 'lambda_val': 2.50752616605319e-05, 'batch_size': 1672, 'optimizer': 'RMSprop'}.
2026-06-17 21:03:26,220 - experiment_functions - INFO - Early stopping at epoch 1000. Best Metrics: (0.0028863514197022934, 0.0006962864721485411, 0.001890029788778751)
2026-06-17 21:03:26,554 - optuna.study.study - INFO - Trial 244 finished with values: [0.0028863514197022934, 0.0006962864721485411, 0.001890029788778751] and parameters: {'n_layers': 1, 'embedding_dim': 128, 'lr': 0.0012702568149946026, 'lambda_val': 8.796328661080472e-05, 'batch_size': 3820, 'optimizer': 'RMSprop'}.
2026-06-17 21:03:50,048 - experiment_functions - INFO - Early stopping at epoch 500. Best Metrics: (0.0004045016112194013, 9.315397246431729e-05, 0.00021731021403837683)
2026-06-17 21:03:50,131 - optuna.study.study - INFO - Trial 245 finished with values: [0.0004045016112194013, 9.315397246431729e-05, 0.00021731021403837683] and parameters: {'n_layers': 1, 'embedding_dim': 128, 'lr': 0.0012702568149946026, 'lambda_val': 8.796328661080472e-05, 'batch_size': 1059, 'optimizer': 'SGD'}.
2026-06-17 21:04:19,218 - experiment_functions - INFO - Early stopping at epoch 600. Best Metrics: (0.0029308868905793687, 0.0007547050650498926, 0.0019019586832077994)
2026-06-17 21:04:19,628 - optuna.study.study - INFO - Trial 246 finished with values: [0.0029308868905793687, 0.0007547050650498926, 0.0019019586832077994] and parameters: {'n_layers': 4, 'embedding_dim': 64, 'lr': 0.005496905689472121, 'lambda_val': 0.0005262773721657997, 'batch_size': 3947, 'optimizer': 'Adam'}.
2026-06-17 21:05:03,478 - experiment_functions - INFO - Early stopping at epoch 1000. Best Metrics: (0.001757986957174753, 0.000502084122773778, 0.0011164233637290962)
2026-06-17 21:05:03,563 - optuna.study.study - INFO - Trial 247 finished with values: [0.001757986957174753, 0.000502084122773778, 0.0011164233637290962] and parameters: {'n_layers': 1, 'embedding_dim': 96, 'lr': 0.01923671087851685, 'lambda_val': 0.062299267278770866, 'batch_size': 806, 'optimizer': 'RMSprop'}.
2026-06-17 21:05:31,033 - experiment_functions - INFO - Early stopping at epoch 550. Best Metrics: (0.002285359676885643, 0.0006552355690286725, 0.0014990525485154987)
2026-06-17 21:05:31,120 - optuna.study.study - INFO - Trial 248 finished with values: [0.002285359676885643, 0.0006552355690286725, 0.0014990525485154987] and parameters: {'n_layers': 4, 'embedding_dim': 96, 'lr': 0.0032052069599508804, 'lambda_val': 0.016091923005648837, 'batch_size': 3238, 'optimizer': 'RMSprop'}.
2026-06-17 21:06:50,285 - experiment_functions - INFO - Early stopping at epoch 1800. Best Metrics: (0.0033268935067210645, 0.0008083870152835671, 0.0020963155307984834)
2026-06-17 21:06:50,386 - optuna.study.study - INFO - Trial 249 finished with values: [0.0033268935067210645, 0.0008083870152835671, 0.0020963155307984834] and parameters: {'n_layers': 3, 'embedding_dim': 64, 'lr': 0.0012702568149946026, 'lambda_val': 2.3768863399722796e-06, 'batch_size': 3756, 'optimizer': 'RMSprop'}.
2026-06-17 21:08:06,409 - experiment_functions - INFO - Early stopping at epoch 1700. Best Metrics: (0.0040975463814356605, 0.0010104837691044587, 0.002621036673569853)
2026-06-17 21:08:06,490 - optuna.study.study - INFO - Trial 250 finished with values: [0.0040975463814356605, 0.0010104837691044587, 0.002621036673569853] and parameters: {'n_layers': 4, 'embedding_dim': 64, 'lr': 0.0012702568149946026, 'lambda_val': 1.3870977953506033e-05, 'batch_size': 806, 'optimizer': 'RMSprop'}.
2026-06-17 21:08:32,103 - experiment_functions - INFO - Early stopping at epoch 550. Best Metrics: (0.002257541226168717, 0.0005826070481242896, 0.0014272265878030542)
2026-06-17 21:08:32,400 - optuna.study.study - INFO - Trial 251 finished with values: [0.002257541226168717, 0.0005826070481242896, 0.0014272265878030542] and parameters: {'n_layers': 3, 'embedding_dim': 64, 'lr': 0.07275930428671969, 'lambda_val': 4.337539728895895e-06, 'batch_size': 1849, 'optimizer': 'RMSprop'}.
2026-06-17 21:09:05,313 - experiment_functions - INFO - Early stopping at epoch 700. Best Metrics: (0.003241069432268128, 0.0008036503726158899, 0.0020200116081745567)
2026-06-17 21:09:05,404 - optuna.study.study - INFO - Trial 252 finished with values: [0.003241069432268128, 0.0008036503726158899, 0.0020200116081745567] and parameters: {'n_layers': 4, 'embedding_dim': 64, 'lr': 0.0032052069599508804, 'lambda_val': 2.762347862669885e-05, 'batch_size': 2838, 'optimizer': 'Adam'}.
2026-06-17 21:11:54,358 - optuna.study.study - INFO - Trial 253 finished with values: [0.0012311233540422044, 0.0002920929645067576, 0.0008139321819811056] and parameters: {'n_layers': 4, 'embedding_dim': 64, 'lr': 0.00013161097474722502, 'lambda_val': 8.796328661080472e-05, 'batch_size': 1751, 'optimizer': 'Adam'}.
2026-06-17 21:12:26,005 - experiment_functions - INFO - Early stopping at epoch 700. Best Metrics: (0.003018068692623713, 0.0007468106606037642, 0.0018641692832832846)
2026-06-17 21:12:26,089 - optuna.study.study - INFO - Trial 254 finished with values: [0.003018068692623713, 0.0007468106606037642, 0.0018641692832832846] and parameters: {'n_layers': 4, 'embedding_dim': 64, 'lr': 0.0036567747130372475, 'lambda_val': 6.0082896507722305e-05, 'batch_size': 2458, 'optimizer': 'Adam'}.
2026-06-17 21:12:53,954 - experiment_functions - INFO - Early stopping at epoch 650. Best Metrics: (0.0026023296383571475, 0.0006220790703549325, 0.0016142889606569537)
2026-06-17 21:12:54,037 - optuna.study.study - INFO - Trial 255 finished with values: [0.0026023296383571475, 0.0006220790703549325, 0.0016142889606569537] and parameters: {'n_layers': 1, 'embedding_dim': 64, 'lr': 0.0036567747130372475, 'lambda_val': 8.796328661080472e-05, 'batch_size': 3251, 'optimizer': 'RMSprop'}.
2026-06-17 21:13:22,861 - experiment_functions - INFO - Early stopping at epoch 600. Best Metrics: (0.003451384565098841, 0.0008447012757357584, 0.002169443514019548)
2026-06-17 21:13:22,943 - optuna.study.study - INFO - Trial 256 finished with values: [0.003451384565098841, 0.0008447012757357584, 0.002169443514019548] and parameters: {'n_layers': 3, 'embedding_dim': 128, 'lr': 0.0032052069599508804, 'lambda_val': 3.839443128156864e-05, 'batch_size': 1849, 'optimizer': 'RMSprop'}.
2026-06-17 21:13:54,514 - experiment_functions - INFO - Early stopping at epoch 650. Best Metrics: (0.0031827463792096855, 0.0007783882783882783, 0.0020120381406849653)
2026-06-17 21:13:54,607 - optuna.study.study - INFO - Trial 257 finished with values: [0.0031827463792096855, 0.0007783882783882783, 0.0020120381406849653] and parameters: {'n_layers': 4, 'embedding_dim': 128, 'lr': 0.0036567747130372475, 'lambda_val': 0.00040852653324075796, 'batch_size': 827, 'optimizer': 'Adam'}.
2026-06-17 21:14:19,439 - experiment_functions - INFO - Early stopping at epoch 550. Best Metrics: (0.0022444360179611836, 0.0006031324996842238, 0.0014669036222478033)
2026-06-17 21:14:19,540 - optuna.study.study - INFO - Trial 258 finished with values: [0.0022444360179611836, 0.0006031324996842238, 0.0014669036222478033] and parameters: {'n_layers': 3, 'embedding_dim': 64, 'lr': 0.009940147183797932, 'lambda_val': 0.0009209480011048537, 'batch_size': 1768, 'optimizer': 'RMSprop'}.
2026-06-17 21:15:30,808 - experiment_functions - INFO - Early stopping at epoch 1750. Best Metrics: (0.0044349016888805435, 0.0009946949602122016, 0.002782172976753227)
2026-06-17 21:15:30,891 - optuna.study.study - INFO - Trial 259 finished with values: [0.0044349016888805435, 0.0009946949602122016, 0.002782172976753227] and parameters: {'n_layers': 3, 'embedding_dim': 32, 'lr': 0.0012702568149946026, 'lambda_val': 1.3870977953506033e-05, 'batch_size': 806, 'optimizer': 'RMSprop'}.
2026-06-17 21:16:51,711 - experiment_functions - INFO - Early stopping at epoch 1950. Best Metrics: (0.0037523525189736935, 0.0009504862953138817, 0.0025024670534968103)
2026-06-17 21:16:51,800 - optuna.study.study - INFO - Trial 260 finished with values: [0.0037523525189736935, 0.0009504862953138817, 0.0025024670534968103] and parameters: {'n_layers': 4, 'embedding_dim': 32, 'lr': 0.0015933103817621604, 'lambda_val': 0.00015440813799502288, 'batch_size': 806, 'optimizer': 'RMSprop'}.
2026-06-17 21:17:25,882 - experiment_functions - INFO - Early stopping at epoch 700. Best Metrics: (0.003218243737909975, 0.0008131236579512442, 0.001948329919200923)
2026-06-17 21:17:25,974 - optuna.study.study - INFO - Trial 261 finished with values: [0.003218243737909975, 0.0008131236579512442, 0.001948329919200923] and parameters: {'n_layers': 4, 'embedding_dim': 128, 'lr': 0.0012702568149946026, 'lambda_val': 0.0036813569044890633, 'batch_size': 1849, 'optimizer': 'RMSprop'}.
2026-06-17 21:17:53,517 - experiment_functions - INFO - Early stopping at epoch 550. Best Metrics: (0.0027628589256790156, 0.0007262852090438297, 0.001845564573819216)
2026-06-17 21:17:53,604 - optuna.study.study - INFO - Trial 262 finished with values: [0.0027628589256790156, 0.0007262852090438297, 0.001845564573819216] and parameters: {'n_layers': 4, 'embedding_dim': 128, 'lr': 0.038241995880234386, 'lambda_val': 7.345836881619269e-05, 'batch_size': 806, 'optimizer': 'Adam'}.
2026-06-17 21:20:38,410 - optuna.study.study - INFO - Trial 263 finished with values: [0.0039037726576818554, 0.0008494379184034357, 0.002488086635028383] and parameters: {'n_layers': 3, 'embedding_dim': 64, 'lr': 0.000416242081306151, 'lambda_val': 8.796328661080472e-05, 'batch_size': 1118, 'optimizer': 'RMSprop'}.
2026-06-17 21:21:15,013 - experiment_functions - INFO - Early stopping at epoch 750. Best Metrics: (0.0034724202409812193, 0.0008857521788556272, 0.0021839367336291024)
2026-06-17 21:21:15,093 - optuna.study.study - INFO - Trial 264 finished with values: [0.0034724202409812193, 0.0008857521788556272, 0.0021839367336291024] and parameters: {'n_layers': 4, 'embedding_dim': 128, 'lr': 0.0032052069599508804, 'lambda_val': 1.375614243555729e-06, 'batch_size': 806, 'optimizer': 'RMSprop'}.
2026-06-17 21:21:44,924 - experiment_functions - INFO - Early stopping at epoch 600. Best Metrics: (0.003313235531184326, 0.0008999621068586587, 0.002133344150164444)
2026-06-17 21:21:45,005 - optuna.study.study - INFO - Trial 265 finished with values: [0.003313235531184326, 0.0008999621068586587, 0.002133344150164444] and parameters: {'n_layers': 4, 'embedding_dim': 128, 'lr': 0.0036567747130372475, 'lambda_val': 8.796328661080472e-05, 'batch_size': 1059, 'optimizer': 'RMSprop'}.
2026-06-17 21:22:27,237 - experiment_functions - INFO - Early stopping at epoch 950. Best Metrics: (0.0030254469179527652, 0.0007562839459391183, 0.0019200977961677153)
2026-06-17 21:22:27,335 - optuna.study.study - INFO - Trial 266 finished with values: [0.0030254469179527652, 0.0007562839459391183, 0.0019200977961677153] and parameters: {'n_layers': 4, 'embedding_dim': 64, 'lr': 0.0017271653443455424, 'lambda_val': 8.796328661080472e-05, 'batch_size': 3850, 'optimizer': 'Adam'}.
2026-06-17 21:22:51,902 - experiment_functions - INFO - Early stopping at epoch 500. Best Metrics: (0.0004991730145999093, 0.00011525830491347733, 0.0002466749459693575)
2026-06-17 21:22:51,991 - optuna.study.study - INFO - Trial 267 finished with values: [0.0004991730145999093, 0.00011525830491347733, 0.0002466749459693575] and parameters: {'n_layers': 3, 'embedding_dim': 128, 'lr': 0.0032052069599508804, 'lambda_val': 0.018642120871775948, 'batch_size': 1680, 'optimizer': 'SGD'}.
2026-06-17 21:23:19,382 - experiment_functions - INFO - Early stopping at epoch 600. Best Metrics: (0.003123741251767222, 0.0007436528988253127, 0.001877250896461815)
