2026-05-23 03:47:34,918 - optuna.study.study - INFO - Trial 64 finished with values: [0.0024449526508200452, 0.002213114754098361, 0.002629807958625065] and parameters: {'n_layers': 1, 'embedding_dim': 128, 'lr': 0.0014724028114266666, 'lambda_val': 2.0700677762543618e-06, 'batch_size': 2384, 'optimizer': 'SGD'}.
2026-05-23 03:47:43,494 - experiment_functions - INFO - Early stopping at epoch 1450. Best Metrics: (0.03975990750681221, 0.02557377049180328, 0.037445858120243605)
2026-05-23 03:47:43,699 - optuna.study.study - INFO - Trial 65 finished with values: [0.03975990750681221, 0.02557377049180328, 0.037445858120243605] and parameters: {'n_layers': 1, 'embedding_dim': 64, 'lr': 0.0025167752834235274, 'lambda_val': 0.019274562156610407, 'batch_size': 1166, 'optimizer': 'RMSprop'}.
2026-05-23 03:47:46,869 - experiment_functions - INFO - Early stopping at epoch 750. Best Metrics: (0.017133615908113818, 0.012295081967213115, 0.016160133854611018)
2026-05-23 03:47:46,942 - optuna.study.study - INFO - Trial 66 finished with values: [0.017133615908113818, 0.012295081967213115, 0.016160133854611018] and parameters: {'n_layers': 1, 'embedding_dim': 96, 'lr': 0.06381184556744872, 'lambda_val': 2.2085450512136348e-05, 'batch_size': 2515, 'optimizer': 'RMSprop'}.
2026-05-23 03:47:49,664 - experiment_functions - INFO - Early stopping at epoch 550. Best Metrics: (0.046394278444912604, 0.023114754098360654, 0.038350077922557034)
2026-05-23 03:47:50,395 - optuna.study.study - INFO - Trial 67 finished with values: [0.046394278444912604, 0.023114754098360654, 0.038350077922557034] and parameters: {'n_layers': 2, 'embedding_dim': 128, 'lr': 0.00726893620558119, 'lambda_val': 2.2085450512136348e-05, 'batch_size': 2670, 'optimizer': 'Adam'}.
2026-05-23 03:47:52,857 - experiment_functions - INFO - Early stopping at epoch 550. Best Metrics: (0.08090276908222149, 0.04278688524590164, 0.06779172321577524)
2026-05-23 03:47:52,946 - optuna.study.study - INFO - Trial 68 finished with values: [0.08090276908222149, 0.04278688524590164, 0.06779172321577524] and parameters: {'n_layers': 1, 'embedding_dim': 96, 'lr': 0.0029056396011724254, 'lambda_val': 6.13505476225876e-05, 'batch_size': 3317, 'optimizer': 'RMSprop'}.
2026-05-23 03:48:06,169 - optuna.study.study - INFO - Trial 69 finished with values: [0.02733843894177732, 0.019508196721311474, 0.02821658901831392] and parameters: {'n_layers': 2, 'embedding_dim': 96, 'lr': 7.429060060163502e-05, 'lambda_val': 3.7301555728010213e-06, 'batch_size': 3689, 'optimizer': 'RMSprop'}.
2026-05-23 03:48:08,602 - experiment_functions - INFO - Early stopping at epoch 550. Best Metrics: (0.056533987066643185, 0.028032786885245905, 0.04783435912971655)
2026-05-23 03:48:08,731 - optuna.study.study - INFO - Trial 70 finished with values: [0.056533987066643185, 0.028032786885245905, 0.04783435912971655] and parameters: {'n_layers': 1, 'embedding_dim': 64, 'lr': 0.027856035862650546, 'lambda_val': 1.6555471034129683e-06, 'batch_size': 2013, 'optimizer': 'Adam'}.
2026-05-23 03:48:14,820 - experiment_functions - INFO - Early stopping at epoch 1450. Best Metrics: (0.03803040234930826, 0.017459016393442623, 0.030271717733496274)
2026-05-23 03:48:14,957 - optuna.study.study - INFO - Trial 71 finished with values: [0.03803040234930826, 0.017459016393442623, 0.030271717733496274] and parameters: {'n_layers': 2, 'embedding_dim': 96, 'lr': 0.038572526598242896, 'lambda_val': 0.0013490791904657623, 'batch_size': 3201, 'optimizer': 'Adam'}.
2026-05-23 03:48:26,972 - optuna.study.study - INFO - Trial 72 finished with values: [0.037174613033164515, 0.023032786885245904, 0.03608959273884441] and parameters: {'n_layers': 1, 'embedding_dim': 64, 'lr': 0.00012113925642415473, 'lambda_val': 3.2544304497537934e-05, 'batch_size': 2331, 'optimizer': 'Adam'}.
2026-05-23 03:48:29,024 - experiment_functions - INFO - Early stopping at epoch 500. Best Metrics: (0.0017024401923541514, 0.0013934426229508198, 0.0019002061037273167)
2026-05-23 03:48:29,219 - optuna.study.study - INFO - Trial 73 finished with values: [0.0017024401923541514, 0.0013934426229508198, 0.0019002061037273167] and parameters: {'n_layers': 1, 'embedding_dim': 64, 'lr': 3.265766870337015e-05, 'lambda_val': 0.0009863767281582856, 'batch_size': 1529, 'optimizer': 'Adam'}.
2026-05-23 03:48:46,803 - experiment_functions - INFO - Early stopping at epoch 3200. Best Metrics: (0.04588161260323689, 0.026393442622950822, 0.038360428712262286)
2026-05-23 03:48:46,899 - optuna.study.study - INFO - Trial 74 finished with values: [0.04588161260323689, 0.026393442622950822, 0.038360428712262286] and parameters: {'n_layers': 3, 'embedding_dim': 256, 'lr': 0.0001451959463810353, 'lambda_val': 0.0003938798171532122, 'batch_size': 3689, 'optimizer': 'Adam'}.
2026-05-23 03:48:51,233 - experiment_functions - INFO - Early stopping at epoch 500. Best Metrics: (0.0030756070341583543, 0.0018852459016393442, 0.002392267415108152)
2026-05-23 03:48:52,277 - optuna.study.study - INFO - Trial 75 finished with values: [0.0030756070341583543, 0.0018852459016393442, 0.002392267415108152] and parameters: {'n_layers': 3, 'embedding_dim': 32, 'lr': 0.0006974716712164259, 'lambda_val': 0.00015302736237202981, 'batch_size': 603, 'optimizer': 'SGD'}.
2026-05-23 03:49:00,233 - experiment_functions - INFO - Early stopping at epoch 600. Best Metrics: (0.06321070008363466, 0.037950819672131146, 0.05507336520928357)
2026-05-23 03:49:00,727 - optuna.study.study - INFO - Trial 76 finished with values: [0.06321070008363466, 0.037950819672131146, 0.05507336520928357] and parameters: {'n_layers': 1, 'embedding_dim': 32, 'lr': 0.0029056396011724254, 'lambda_val': 6.13505476225876e-05, 'batch_size': 2515, 'optimizer': 'RMSprop'}.
2026-05-23 03:49:07,909 - experiment_functions - INFO - Early stopping at epoch 1700. Best Metrics: (0.016107805329561384, 0.01254098360655738, 0.016615021196927916)
2026-05-23 03:49:07,981 - optuna.study.study - INFO - Trial 77 finished with values: [0.016107805329561384, 0.01254098360655738, 0.016615021196927916] and parameters: {'n_layers': 3, 'embedding_dim': 64, 'lr': 0.03692218688617663, 'lambda_val': 0.015878618809973863, 'batch_size': 1762, 'optimizer': 'Adam'}.
2026-05-23 03:49:11,424 - experiment_functions - INFO - Early stopping at epoch 750. Best Metrics: (0.003528210118419169, 0.002377049180327869, 0.003364342250366777)
2026-05-23 03:49:11,666 - optuna.study.study - INFO - Trial 78 finished with values: [0.003528210118419169, 0.002377049180327869, 0.003364342250366777] and parameters: {'n_layers': 3, 'embedding_dim': 32, 'lr': 2.4155463292094065e-05, 'lambda_val': 0.005013716564296358, 'batch_size': 2314, 'optimizer': 'Adam'}.
2026-05-23 03:49:15,465 - experiment_functions - INFO - Early stopping at epoch 700. Best Metrics: (0.03303514979073019, 0.013688524590163937, 0.025547997604175417)
2026-05-23 03:49:15,876 - optuna.study.study - INFO - Trial 79 finished with values: [0.03303514979073019, 0.013688524590163937, 0.025547997604175417] and parameters: {'n_layers': 3, 'embedding_dim': 128, 'lr': 0.008519344251657169, 'lambda_val': 6.2109274589487925e-06, 'batch_size': 1749, 'optimizer': 'RMSprop'}.
2026-05-23 03:49:25,196 - experiment_functions - INFO - Early stopping at epoch 2900. Best Metrics: (0.002434449365453568, 0.002377049180327869, 0.002913231847283971)
2026-05-23 03:49:25,298 - optuna.study.study - INFO - Trial 80 finished with values: [0.002434449365453568, 0.002377049180327869, 0.002913231847283971] and parameters: {'n_layers': 1, 'embedding_dim': 128, 'lr': 2.9533366281094698e-05, 'lambda_val': 0.0001457265410824252, 'batch_size': 800, 'optimizer': 'RMSprop'}.
2026-05-23 03:49:40,078 - optuna.study.study - INFO - Trial 81 finished with values: [0.02583322226531088, 0.01614754098360656, 0.022883419258930133] and parameters: {'n_layers': 2, 'embedding_dim': 64, 'lr': 7.429060060163502e-05, 'lambda_val': 1.3591129711616782e-05, 'batch_size': 2589, 'optimizer': 'Adam'}.
2026-05-23 03:49:42,875 - experiment_functions - INFO - Early stopping at epoch 500. Best Metrics: (0.0008446571381421605, 0.0018852459016393442, 0.00190024216826281)
2026-05-23 03:49:42,966 - optuna.study.study - INFO - Trial 82 finished with values: [0.0008446571381421605, 0.0018852459016393442, 0.00190024216826281] and parameters: {'n_layers': 4, 'embedding_dim': 32, 'lr': 0.0959494177494899, 'lambda_val': 0.05699400458314174, 'batch_size': 2462, 'optimizer': 'SGD'}.
2026-05-23 03:49:45,432 - experiment_functions - INFO - Early stopping at epoch 550. Best Metrics: (0.043360154659466806, 0.030655737704918036, 0.04226415586942105)
2026-05-23 03:49:45,513 - optuna.study.study - INFO - Trial 83 finished with values: [0.043360154659466806, 0.030655737704918036, 0.04226415586942105] and parameters: {'n_layers': 1, 'embedding_dim': 96, 'lr': 0.006682771802508509, 'lambda_val': 0.0314882468140835, 'batch_size': 2606, 'optimizer': 'Adam'}.
2026-05-23 03:49:48,716 - experiment_functions - INFO - Early stopping at epoch 800. Best Metrics: (0.03503639874142519, 0.02262295081967213, 0.036318024310707936)
2026-05-23 03:49:49,563 - optuna.study.study - INFO - Trial 84 finished with values: [0.03503639874142519, 0.02262295081967213, 0.036318024310707936] and parameters: {'n_layers': 3, 'embedding_dim': 32, 'lr': 0.0012105647021575748, 'lambda_val': 0.0009750566560695258, 'batch_size': 2450, 'optimizer': 'Adam'}.
2026-05-23 03:49:52,453 - experiment_functions - INFO - Early stopping at epoch 650. Best Metrics: (0.018839855844212983, 0.006803278688524591, 0.013794468584700096)
2026-05-23 03:49:52,522 - optuna.study.study - INFO - Trial 85 finished with values: [0.018839855844212983, 0.006803278688524591, 0.013794468584700096] and parameters: {'n_layers': 2, 'embedding_dim': 96, 'lr': 0.09335541584008325, 'lambda_val': 1.5563426646452356e-06, 'batch_size': 2331, 'optimizer': 'Adam'}.
2026-05-23 03:50:22,318 - optuna.study.study - INFO - Trial 86 finished with values: [0.03150888391260824, 0.017704918032786888, 0.027326116045080433] and parameters: {'n_layers': 4, 'embedding_dim': 256, 'lr': 7.429060060163502e-05, 'lambda_val': 1.6693478080315474e-06, 'batch_size': 4011, 'optimizer': 'Adam'}.
2026-05-23 03:50:24,761 - experiment_functions - INFO - Early stopping at epoch 600. Best Metrics: (0.03794668846573689, 0.023688524590163934, 0.03262418989334906)
2026-05-23 03:50:24,844 - optuna.study.study - INFO - Trial 87 finished with values: [0.03794668846573689, 0.023688524590163934, 0.03262418989334906] and parameters: {'n_layers': 2, 'embedding_dim': 32, 'lr': 0.00335023134866487, 'lambda_val': 8.391673416893658e-05, 'batch_size': 3349, 'optimizer': 'Adam'}.
2026-05-23 03:50:27,304 - experiment_functions - INFO - Early stopping at epoch 500. Best Metrics: (0.0015126531291822375, 0.0017213114754098362, 0.0024181541387365666)
2026-05-23 03:50:27,503 - optuna.study.study - INFO - Trial 88 finished with values: [0.0015126531291822375, 0.0017213114754098362, 0.0024181541387365666] and parameters: {'n_layers': 3, 'embedding_dim': 32, 'lr': 0.0006974716712164259, 'lambda_val': 0.012994758243121959, 'batch_size': 2461, 'optimizer': 'SGD'}.
2026-05-23 03:50:39,705 - experiment_functions - INFO - Early stopping at epoch 3900. Best Metrics: (0.08300249134932611, 0.04672131147540984, 0.0734612576598775)
2026-05-23 03:50:39,800 - optuna.study.study - INFO - Trial 89 finished with values: [0.08300249134932611, 0.04672131147540984, 0.0734612576598775] and parameters: {'n_layers': 1, 'embedding_dim': 64, 'lr': 0.00026503485300845536, 'lambda_val': 0.0017795542900466829, 'batch_size': 2384, 'optimizer': 'RMSprop'}.
2026-05-23 03:50:45,712 - experiment_functions - INFO - Early stopping at epoch 800. Best Metrics: (0.02618322322548516, 0.016311475409836067, 0.02421754789169561)
2026-05-23 03:50:46,282 - optuna.study.study - INFO - Trial 90 finished with values: [0.02618322322548516, 0.016311475409836067, 0.02421754789169561] and parameters: {'n_layers': 4, 'embedding_dim': 256, 'lr': 0.0007420979429767307, 'lambda_val': 0.004260672290845639, 'batch_size': 3409, 'optimizer': 'Adam'}.
2026-05-23 03:51:01,225 - experiment_functions - INFO - Early stopping at epoch 3400. Best Metrics: (0.048424974912770744, 0.031229508196721312, 0.04688449032581751)
2026-05-23 03:51:01,933 - optuna.study.study - INFO - Trial 91 finished with values: [0.048424974912770744, 0.031229508196721312, 0.04688449032581751] and parameters: {'n_layers': 3, 'embedding_dim': 128, 'lr': 0.0001451959463810353, 'lambda_val': 0.0074300178381333975, 'batch_size': 1534, 'optimizer': 'RMSprop'}.
2026-05-23 03:51:04,450 - experiment_functions - INFO - Early stopping at epoch 500. Best Metrics: (0.0013146256171246468, 0.001475409836065574, 0.0018843107164132848)
2026-05-23 03:51:04,527 - optuna.study.study - INFO - Trial 92 finished with values: [0.0013146256171246468, 0.001475409836065574, 0.0018843107164132848] and parameters: {'n_layers': 2, 'embedding_dim': 96, 'lr': 4.7474885915367426e-05, 'lambda_val': 0.03952172142634439, 'batch_size': 2149, 'optimizer': 'RMSprop'}.
2026-05-23 03:51:07,906 - experiment_functions - INFO - Early stopping at epoch 750. Best Metrics: (0.024787503874642267, 0.011147540983606558, 0.01967023676345396)
2026-05-23 03:51:08,234 - optuna.study.study - INFO - Trial 93 finished with values: [0.024787503874642267, 0.011147540983606558, 0.01967023676345396] and parameters: {'n_layers': 2, 'embedding_dim': 96, 'lr': 0.027856035862650546, 'lambda_val': 9.031610003618857e-05, 'batch_size': 1992, 'optimizer': 'RMSprop'}.
2026-05-23 03:51:11,805 - experiment_functions - INFO - Early stopping at epoch 600. Best Metrics: (0.033942361641778517, 0.01655737704918033, 0.026119877849247203)
2026-05-23 03:51:11,968 - optuna.study.study - INFO - Trial 94 finished with values: [0.033942361641778517, 0.01655737704918033, 0.026119877849247203] and parameters: {'n_layers': 3, 'embedding_dim': 128, 'lr': 0.0029056396011724254, 'lambda_val': 1.204913548299723e-05, 'batch_size': 2515, 'optimizer': 'RMSprop'}.
2026-05-23 03:51:14,482 - experiment_functions - INFO - Early stopping at epoch 600. Best Metrics: (0.0019597530050301484, 0.001639344262295082, 0.0027064533835440114)
2026-05-23 03:51:14,574 - optuna.study.study - INFO - Trial 95 finished with values: [0.0019597530050301484, 0.001639344262295082, 0.0027064533835440114] and parameters: {'n_layers': 1, 'embedding_dim': 128, 'lr': 2.7505072615839748e-05, 'lambda_val': 0.0005885991132278509, 'batch_size': 1749, 'optimizer': 'Adam'}.
2026-05-23 03:51:31,317 - optuna.study.study - INFO - Trial 96 finished with values: [0.058067720656576484, 0.03360655737704918, 0.04869612268229387] and parameters: {'n_layers': 3, 'embedding_dim': 96, 'lr': 0.00011557144421774405, 'lambda_val': 4.112104521892171e-06, 'batch_size': 618, 'optimizer': 'Adam'}.
2026-05-23 03:51:40,754 - experiment_functions - INFO - Early stopping at epoch 2800. Best Metrics: (0.02917186672901722, 0.015983606557377048, 0.023171552905277885)
2026-05-23 03:51:40,849 - optuna.study.study - INFO - Trial 97 finished with values: [0.02917186672901722, 0.015983606557377048, 0.023171552905277885] and parameters: {'n_layers': 1, 'embedding_dim': 64, 'lr': 0.05621919408223721, 'lambda_val': 6.13505476225876e-05, 'batch_size': 2515, 'optimizer': 'RMSprop'}.
2026-05-23 03:51:44,264 - experiment_functions - INFO - Early stopping at epoch 550. Best Metrics: (0.02463603377799129, 0.016885245901639347, 0.022717161075849868)
2026-05-23 03:51:44,390 - optuna.study.study - INFO - Trial 98 finished with values: [0.02463603377799129, 0.016885245901639347, 0.022717161075849868] and parameters: {'n_layers': 4, 'embedding_dim': 96, 'lr': 0.0010504175483841457, 'lambda_val': 1.8084571105268367e-05, 'batch_size': 3317, 'optimizer': 'RMSprop'}.
2026-05-23 03:51:47,643 - experiment_functions - INFO - Early stopping at epoch 550. Best Metrics: (0.041829085399089, 0.02418032786885246, 0.037811094811786516)
2026-05-23 03:51:48,782 - optuna.study.study - INFO - Trial 99 finished with values: [0.041829085399089, 0.02418032786885246, 0.037811094811786516] and parameters: {'n_layers': 3, 'embedding_dim': 128, 'lr': 0.0043499485856008146, 'lambda_val': 0.0005589063407720928, 'batch_size': 1170, 'optimizer': 'Adam'}.
2026-05-23 03:51:51,733 - experiment_functions - INFO - Early stopping at epoch 550. Best Metrics: (0.09224039601612698, 0.044754098360655734, 0.07617751155325471)
2026-05-23 03:51:52,673 - optuna.study.study - INFO - Trial 100 finished with values: [0.09224039601612698, 0.044754098360655734, 0.07617751155325471] and parameters: {'n_layers': 1, 'embedding_dim': 256, 'lr': 0.006682771802508509, 'lambda_val': 3.7301555728010213e-06, 'batch_size': 3689, 'optimizer': 'Adam'}.
2026-05-23 03:51:55,450 - experiment_functions - INFO - Early stopping at epoch 650. Best Metrics: (0.048169347115062766, 0.030819672131147544, 0.044205958719667114)
2026-05-23 03:51:56,878 - optuna.study.study - INFO - Trial 101 finished with values: [0.048169347115062766, 0.030819672131147544, 0.044205958719667114] and parameters: {'n_layers': 2, 'embedding_dim': 32, 'lr': 0.00335023134866487, 'lambda_val': 8.391673416893658e-05, 'batch_size': 1784, 'optimizer': 'Adam'}.
2026-05-23 03:52:00,320 - experiment_functions - INFO - Early stopping at epoch 750. Best Metrics: (0.02925240285930337, 0.020245901639344262, 0.02760416000656127)
2026-05-23 03:52:00,495 - optuna.study.study - INFO - Trial 102 finished with values: [0.02925240285930337, 0.020245901639344262, 0.02760416000656127] and parameters: {'n_layers': 3, 'embedding_dim': 32, 'lr': 0.0012105647021575748, 'lambda_val': 6.2109274589487925e-06, 'batch_size': 2924, 'optimizer': 'Adam'}.
2026-05-23 03:52:07,908 - experiment_functions - INFO - Early stopping at epoch 1700. Best Metrics: (0.01662021814302179, 0.013524590163934426, 0.017595692932755463)
2026-05-23 03:52:08,042 - optuna.study.study - INFO - Trial 103 finished with values: [0.01662021814302179, 0.013524590163934426, 0.017595692932755463] and parameters: {'n_layers': 3, 'embedding_dim': 96, 'lr': 0.006682771802508509, 'lambda_val': 0.015878618809973863, 'batch_size': 1762, 'optimizer': 'Adam'}.
2026-05-23 03:52:10,655 - experiment_functions - INFO - Early stopping at epoch 600. Best Metrics: (0.0718997309390666, 0.040245901639344266, 0.060982777121598546)
2026-05-23 03:52:10,743 - optuna.study.study - INFO - Trial 104 finished with values: [0.0718997309390666, 0.040245901639344266, 0.060982777121598546] and parameters: {'n_layers': 1, 'embedding_dim': 32, 'lr': 0.0025167752834235274, 'lambda_val': 1.6190148297677295e-06, 'batch_size': 1166, 'optimizer': 'RMSprop'}.
2026-05-23 03:52:13,767 - experiment_functions - INFO - Early stopping at epoch 550. Best Metrics: (0.06168180642127927, 0.03959016393442623, 0.05238035024819555)
2026-05-23 03:52:13,853 - optuna.study.study - INFO - Trial 105 finished with values: [0.06168180642127927, 0.03959016393442623, 0.05238035024819555] and parameters: {'n_layers': 1, 'embedding_dim': 32, 'lr': 0.006682771802508509, 'lambda_val': 0.0314882468140835, 'batch_size': 3145, 'optimizer': 'Adam'}.
2026-05-23 03:52:22,821 - experiment_functions - INFO - Early stopping at epoch 2550. Best Metrics: (0.0251349999741722, 0.01040983606557377, 0.019485053145122933)
2026-05-23 03:52:23,783 - optuna.study.study - INFO - Trial 106 finished with values: [0.0251349999741722, 0.01040983606557377, 0.019485053145122933] and parameters: {'n_layers': 2, 'embedding_dim': 64, 'lr': 0.038572526598242896, 'lambda_val': 6.13505476225876e-05, 'batch_size': 655, 'optimizer': 'RMSprop'}.
2026-05-23 03:52:38,440 - optuna.study.study - INFO - Trial 107 finished with values: [0.03896925131394595, 0.024016393442622953, 0.037517553760230166] and parameters: {'n_layers': 2, 'embedding_dim': 96, 'lr': 0.00011557144421774405, 'lambda_val': 6.13505476225876e-05, 'batch_size': 618, 'optimizer': 'Adam'}.
2026-05-23 03:52:42,992 - experiment_functions - INFO - Early stopping at epoch 850. Best Metrics: (0.030165790917035605, 0.014262295081967212, 0.023099679540462485)
2026-05-23 03:52:43,068 - optuna.study.study - INFO - Trial 108 finished with values: [0.030165790917035605, 0.014262295081967212, 0.023099679540462485] and parameters: {'n_layers': 3, 'embedding_dim': 128, 'lr': 0.0029056396011724254, 'lambda_val': 1.204913548299723e-05, 'batch_size': 2515, 'optimizer': 'RMSprop'}.
2026-05-23 03:52:46,021 - experiment_functions - INFO - Early stopping at epoch 500. Best Metrics: (0.0007416936784068782, 0.0011475409836065574, 0.001087282236453318)
2026-05-23 03:52:46,168 - optuna.study.study - INFO - Trial 109 finished with values: [0.0007416936784068782, 0.0011475409836065574, 0.001087282236453318] and parameters: {'n_layers': 3, 'embedding_dim': 128, 'lr': 0.000233346029650438, 'lambda_val': 0.08581457425326554, 'batch_size': 1170, 'optimizer': 'Adam'}.
2026-05-23 03:52:50,112 - experiment_functions - INFO - Early stopping at epoch 750. Best Metrics: (0.03526757972193372, 0.014590163934426227, 0.02552762091950442)
2026-05-23 03:52:50,426 - optuna.study.study - INFO - Trial 110 finished with values: [0.03526757972193372, 0.014590163934426227, 0.02552762091950442] and parameters: {'n_layers': 3, 'embedding_dim': 128, 'lr': 0.008519344251657169, 'lambda_val': 6.2109274589487925e-06, 'batch_size': 1749, 'optimizer': 'RMSprop'}.
2026-05-23 03:52:56,207 - experiment_functions - INFO - Early stopping at epoch 550. Best Metrics: (0.10498811843962752, 0.04836065573770492, 0.08345348349030048)
2026-05-23 03:52:56,919 - optuna.study.study - INFO - Trial 111 finished with values: [0.10498811843962752, 0.04836065573770492, 0.08345348349030048] and parameters: {'n_layers': 1, 'embedding_dim': 128, 'lr': 0.006682771802508509, 'lambda_val': 1.1150431230027626e-06, 'batch_size': 3959, 'optimizer': 'Adam'}.
2026-05-23 03:53:13,530 - experiment_functions - INFO - Early stopping at epoch 2700. Best Metrics: (0.045201205860530586, 0.027377049180327868, 0.042190155001378675)
