2026-05-23 03:06:08,743 - optuna.study.study - INFO - Trial 289 finished with values: [0.07300224198526187, 0.04491803278688524, 0.06556276815791026] and parameters: {'n_layers': 1, 'embedding_dim': 64, 'lr': 0.0002738093623313198, 'lambda_val': 8.689122223949433e-06, 'batch_size': 2427, 'optimizer': 'RMSprop'}.
2026-05-23 03:06:19,262 - experiment_functions - INFO - Early stopping at epoch 3600. Best Metrics: (0.06161468271984747, 0.04614754098360656, 0.06456535995673804)
2026-05-23 03:06:19,858 - optuna.study.study - INFO - Trial 290 finished with values: [0.06161468271984747, 0.04614754098360656, 0.06456535995673804] and parameters: {'n_layers': 1, 'embedding_dim': 64, 'lr': 0.0002738093623313198, 'lambda_val': 0.0027428171281445477, 'batch_size': 1222, 'optimizer': 'Adam'}.
2026-05-23 03:06:29,516 - experiment_functions - INFO - Early stopping at epoch 2400. Best Metrics: (0.062469429568590584, 0.04598360655737705, 0.06491981376299767)
2026-05-23 03:06:30,298 - optuna.study.study - INFO - Trial 291 finished with values: [0.062469429568590584, 0.04598360655737705, 0.06491981376299767] and parameters: {'n_layers': 1, 'embedding_dim': 256, 'lr': 0.00033929418945457667, 'lambda_val': 0.008198149930508243, 'batch_size': 1222, 'optimizer': 'RMSprop'}.
2026-05-23 03:06:36,170 - experiment_functions - INFO - Early stopping at epoch 1250. Best Metrics: (0.061403701071954676, 0.043934426229508196, 0.062385686569102)
2026-05-23 03:06:37,271 - optuna.study.study - INFO - Trial 292 finished with values: [0.061403701071954676, 0.043934426229508196, 0.062385686569102] and parameters: {'n_layers': 1, 'embedding_dim': 96, 'lr': 0.0005134970540789423, 'lambda_val': 0.00023185127305384867, 'batch_size': 3937, 'optimizer': 'Adam'}.
2026-05-23 03:06:42,789 - experiment_functions - INFO - Early stopping at epoch 1300. Best Metrics: (0.058691215327654284, 0.04401639344262295, 0.06093168885824102)
2026-05-23 03:06:43,025 - optuna.study.study - INFO - Trial 293 finished with values: [0.058691215327654284, 0.04401639344262295, 0.06093168885824102] and parameters: {'n_layers': 1, 'embedding_dim': 256, 'lr': 0.0005134970540789423, 'lambda_val': 0.004212470249457581, 'batch_size': 527, 'optimizer': 'RMSprop'}.
2026-05-23 03:06:46,426 - experiment_functions - INFO - Early stopping at epoch 650. Best Metrics: (0.014250805347160849, 0.010491803278688525, 0.014318789083163152)
2026-05-23 03:06:46,827 - optuna.study.study - INFO - Trial 294 finished with values: [0.014250805347160849, 0.010491803278688525, 0.014318789083163152] and parameters: {'n_layers': 4, 'embedding_dim': 64, 'lr': 0.001459413805808463, 'lambda_val': 0.0027428171281445477, 'batch_size': 808, 'optimizer': 'RMSprop'}.
2026-05-23 03:06:54,612 - experiment_functions - INFO - Early stopping at epoch 2200. Best Metrics: (0.058725322353517295, 0.04139344262295082, 0.0559769442529963)
2026-05-23 03:06:54,711 - optuna.study.study - INFO - Trial 295 finished with values: [0.058725322353517295, 0.04139344262295082, 0.0559769442529963] and parameters: {'n_layers': 1, 'embedding_dim': 96, 'lr': 0.0002738093623313198, 'lambda_val': 0.004212470249457581, 'batch_size': 2701, 'optimizer': 'RMSprop'}.
2026-05-23 03:06:57,452 - experiment_functions - INFO - Early stopping at epoch 750. Best Metrics: (0.056483601061975836, 0.040901639344262296, 0.05876433599655078)
2026-05-23 03:06:58,227 - optuna.study.study - INFO - Trial 296 finished with values: [0.056483601061975836, 0.040901639344262296, 0.05876433599655078] and parameters: {'n_layers': 1, 'embedding_dim': 32, 'lr': 0.0013028688223409228, 'lambda_val': 0.003720138868239179, 'batch_size': 745, 'optimizer': 'RMSprop'}.
2026-05-23 03:07:02,646 - experiment_functions - INFO - Early stopping at epoch 1150. Best Metrics: (0.06550590962034886, 0.04475409836065574, 0.059582185364850555)
2026-05-23 03:07:03,483 - optuna.study.study - INFO - Trial 297 finished with values: [0.06550590962034886, 0.04475409836065574, 0.059582185364850555] and parameters: {'n_layers': 1, 'embedding_dim': 96, 'lr': 0.0005134970540789423, 'lambda_val': 0.006439135351806826, 'batch_size': 3577, 'optimizer': 'Adam'}.
2026-05-23 03:07:08,487 - experiment_functions - INFO - Early stopping at epoch 1300. Best Metrics: (0.060608443378469316, 0.04475409836065574, 0.062243067796219895)
2026-05-23 03:07:08,646 - optuna.study.study - INFO - Trial 298 finished with values: [0.060608443378469316, 0.04475409836065574, 0.062243067796219895] and parameters: {'n_layers': 1, 'embedding_dim': 128, 'lr': 0.0005134970540789423, 'lambda_val': 0.00023185127305384867, 'batch_size': 2427, 'optimizer': 'Adam'}.
2026-05-23 03:07:13,769 - experiment_functions - INFO - Early stopping at epoch 1150. Best Metrics: (0.02254117490019503, 0.014262295081967212, 0.01960172549954133)
2026-05-23 03:07:13,859 - optuna.study.study - INFO - Trial 299 finished with values: [0.02254117490019503, 0.014262295081967212, 0.01960172549954133] and parameters: {'n_layers': 3, 'embedding_dim': 64, 'lr': 0.00466372845018428, 'lambda_val': 0.0035064867017704023, 'batch_size': 1195, 'optimizer': 'RMSprop'}.
2026-05-23 03:07:13,874 - root - INFO - Selected Trial 184 based on Max NDCG: 0.0723
2026-05-23 03:07:13,875 - root - INFO - Associated Recall: 0.0663
2026-05-23 03:07:13,875 - experiment_functions - INFO - Training the best model ... for e_100K_1c1dcs
2026-05-23 03:07:18,118 - experiment_functions - INFO - Early stopping at epoch 1400. Best Metrics: (0.05765101076940434, 0.04147540983606557, 0.060227888951665885)
2026-05-23 03:07:18,221 - root - INFO -   **** Training e_100K_1c1dcs_rand1
2026-05-23 03:07:18,235 - root - INFO -   **** Getting 65267/81200 random edges
2026-05-23 03:07:18,461 - optuna.storages._rdb.storage - INFO - A new study created in RDB with name: Study_e_100K_1c1dcs_rand1
2026-05-23 03:07:22,006 - experiment_functions - INFO - Early stopping at epoch 500. Best Metrics: (0.0014233278561799731, 0.0020491803278688526, 0.00262321810164258)
2026-05-23 03:07:22,803 - optuna.study.study - INFO - Trial 0 finished with values: [0.0014233278561799731, 0.0020491803278688526, 0.00262321810164258] and parameters: {'n_layers': 3, 'embedding_dim': 256, 'lr': 0.00044777102638185614, 'lambda_val': 3.335859497160611e-06, 'batch_size': 3283, 'optimizer': 'SGD'}.
2026-05-23 03:07:26,803 - experiment_functions - INFO - Early stopping at epoch 1050. Best Metrics: (0.05277826936891784, 0.025491803278688524, 0.04362828173597752)
2026-05-23 03:07:27,391 - optuna.study.study - INFO - Trial 1 finished with values: [0.05277826936891784, 0.025491803278688524, 0.04362828173597752] and parameters: {'n_layers': 1, 'embedding_dim': 96, 'lr': 0.006527724949170866, 'lambda_val': 0.003792790860273115, 'batch_size': 554, 'optimizer': 'RMSprop'}.
2026-05-23 03:07:33,643 - experiment_functions - INFO - Early stopping at epoch 850. Best Metrics: (0.02477540736384448, 0.016229508196721313, 0.02235926184280067)
2026-05-23 03:07:33,801 - optuna.study.study - INFO - Trial 2 finished with values: [0.02477540736384448, 0.016229508196721313, 0.02235926184280067] and parameters: {'n_layers': 4, 'embedding_dim': 256, 'lr': 0.0005398107798250542, 'lambda_val': 1.5503036430323852e-06, 'batch_size': 4044, 'optimizer': 'Adam'}.
2026-05-23 03:07:36,818 - experiment_functions - INFO - Early stopping at epoch 600. Best Metrics: (0.023976477530820075, 0.018360655737704918, 0.023379865949431623)
2026-05-23 03:07:37,163 - optuna.study.study - INFO - Trial 3 finished with values: [0.023976477530820075, 0.018360655737704918, 0.023379865949431623] and parameters: {'n_layers': 4, 'embedding_dim': 32, 'lr': 0.001748107903617139, 'lambda_val': 6.289334810667295e-06, 'batch_size': 760, 'optimizer': 'RMSprop'}.
2026-05-23 03:07:46,264 - experiment_functions - INFO - Early stopping at epoch 2550. Best Metrics: (0.10131635731727484, 0.05098360655737705, 0.08388229558919294)
2026-05-23 03:07:46,604 - optuna.study.study - INFO - Trial 4 finished with values: [0.10131635731727484, 0.05098360655737705, 0.08388229558919294] and parameters: {'n_layers': 1, 'embedding_dim': 128, 'lr': 0.000293040961262534, 'lambda_val': 2.27009302283491e-06, 'batch_size': 3527, 'optimizer': 'Adam'}.
2026-05-23 03:07:49,402 - experiment_functions - INFO - Early stopping at epoch 600. Best Metrics: (0.026342815574868148, 0.019262295081967213, 0.025523586896132423)
2026-05-23 03:07:49,511 - optuna.study.study - INFO - Trial 5 finished with values: [0.026342815574868148, 0.019262295081967213, 0.025523586896132423] and parameters: {'n_layers': 3, 'embedding_dim': 32, 'lr': 0.0013687926891068503, 'lambda_val': 0.019304912964587643, 'batch_size': 1462, 'optimizer': 'Adam'}.
2026-05-23 03:07:54,152 - experiment_functions - INFO - Early stopping at epoch 500. Best Metrics: (0.001659928523843544, 0.0013934426229508198, 0.0018618111324666755)
2026-05-23 03:07:54,668 - optuna.study.study - INFO - Trial 6 finished with values: [0.001659928523843544, 0.0013934426229508198, 0.0018618111324666755] and parameters: {'n_layers': 4, 'embedding_dim': 256, 'lr': 0.00016153771416930503, 'lambda_val': 0.001415556448140383, 'batch_size': 2586, 'optimizer': 'SGD'}.
2026-05-23 03:07:57,480 - experiment_functions - INFO - Early stopping at epoch 650. Best Metrics: (0.09158407029955475, 0.04663934426229508, 0.07270777340662594)
2026-05-23 03:07:58,096 - optuna.study.study - INFO - Trial 7 finished with values: [0.09158407029955475, 0.04663934426229508, 0.07270777340662594] and parameters: {'n_layers': 1, 'embedding_dim': 32, 'lr': 0.0031305185360713038, 'lambda_val': 8.70357449478779e-06, 'batch_size': 2924, 'optimizer': 'Adam'}.
2026-05-23 03:08:14,623 - optuna.study.study - INFO - Trial 8 finished with values: [0.006696485790423313, 0.004672131147540984, 0.005568015601127244] and parameters: {'n_layers': 3, 'embedding_dim': 96, 'lr': 3.415310481641259e-05, 'lambda_val': 0.00041629217474633065, 'batch_size': 1494, 'optimizer': 'Adam'}.
2026-05-23 03:08:18,081 - experiment_functions - INFO - Early stopping at epoch 550. Best Metrics: (0.03151538502590672, 0.020409836065573773, 0.029974406068339867)
2026-05-23 03:08:18,150 - optuna.study.study - INFO - Trial 9 finished with values: [0.03151538502590672, 0.020409836065573773, 0.029974406068339867] and parameters: {'n_layers': 4, 'embedding_dim': 128, 'lr': 0.003117844926683785, 'lambda_val': 3.6084877322949617e-06, 'batch_size': 742, 'optimizer': 'Adam'}.
2026-05-23 03:08:20,813 - experiment_functions - INFO - Early stopping at epoch 500. Best Metrics: (0.0015198379746780204, 0.0018032786885245904, 0.002241886418570938)
2026-05-23 03:08:20,937 - optuna.study.study - INFO - Trial 10 finished with values: [0.0015198379746780204, 0.0018032786885245904, 0.002241886418570938] and parameters: {'n_layers': 3, 'embedding_dim': 64, 'lr': 0.004688928780711991, 'lambda_val': 5.841058443870926e-06, 'batch_size': 2091, 'optimizer': 'SGD'}.
2026-05-23 03:08:23,782 - experiment_functions - INFO - Early stopping at epoch 500. Best Metrics: (0.0029807691323030187, 0.0021311475409836068, 0.0025868754766244085)
2026-05-23 03:08:23,922 - optuna.study.study - INFO - Trial 11 finished with values: [0.0029807691323030187, 0.0021311475409836068, 0.0025868754766244085] and parameters: {'n_layers': 3, 'embedding_dim': 96, 'lr': 0.0016674472847175183, 'lambda_val': 0.003966779220729784, 'batch_size': 2878, 'optimizer': 'SGD'}.
2026-05-23 03:08:26,464 - experiment_functions - INFO - Early stopping at epoch 500. Best Metrics: (0.02505955879324054, 0.008688524590163935, 0.01857513279260391)
2026-05-23 03:08:26,553 - optuna.study.study - INFO - Trial 12 finished with values: [0.02505955879324054, 0.008688524590163935, 0.01857513279260391] and parameters: {'n_layers': 3, 'embedding_dim': 64, 'lr': 0.09007314227288755, 'lambda_val': 0.07730525157801574, 'batch_size': 832, 'optimizer': 'RMSprop'}.
2026-05-23 03:08:31,864 - experiment_functions - INFO - Early stopping at epoch 1450. Best Metrics: (0.06710217000712061, 0.03926229508196721, 0.06197986528399487)
2026-05-23 03:08:32,003 - optuna.study.study - INFO - Trial 13 finished with values: [0.06710217000712061, 0.03926229508196721, 0.06197986528399487] and parameters: {'n_layers': 2, 'embedding_dim': 32, 'lr': 0.0004969264317801683, 'lambda_val': 0.001406127343986641, 'batch_size': 1809, 'optimizer': 'RMSprop'}.
2026-05-23 03:08:41,074 - experiment_functions - INFO - Early stopping at epoch 500. Best Metrics: (0.021688114913689598, 0.013360655737704915, 0.02116231154416319)
2026-05-23 03:08:41,462 - optuna.study.study - INFO - Trial 14 finished with values: [0.021688114913689598, 0.013360655737704915, 0.02116231154416319] and parameters: {'n_layers': 4, 'embedding_dim': 256, 'lr': 0.01556870865298979, 'lambda_val': 0.00011132011432528227, 'batch_size': 2227, 'optimizer': 'RMSprop'}.
2026-05-23 03:08:49,484 - experiment_functions - INFO - Early stopping at epoch 500. Best Metrics: (0.028286217505628507, 0.013688524590163937, 0.025192663891632227)
2026-05-23 03:08:50,606 - optuna.study.study - INFO - Trial 15 finished with values: [0.028286217505628507, 0.013688524590163937, 0.025192663891632227] and parameters: {'n_layers': 4, 'embedding_dim': 64, 'lr': 0.06530612456991958, 'lambda_val': 0.00017177635476580495, 'batch_size': 3340, 'optimizer': 'RMSprop'}.
2026-05-23 03:08:53,949 - experiment_functions - INFO - Early stopping at epoch 800. Best Metrics: (0.027371360334684625, 0.013114754098360656, 0.021253233670437743)
2026-05-23 03:08:54,868 - optuna.study.study - INFO - Trial 16 finished with values: [0.027371360334684625, 0.013114754098360656, 0.021253233670437743] and parameters: {'n_layers': 1, 'embedding_dim': 32, 'lr': 0.06524143930040716, 'lambda_val': 1.4791571272387938e-06, 'batch_size': 955, 'optimizer': 'Adam'}.
2026-05-23 03:09:06,972 - optuna.study.study - INFO - Trial 17 finished with values: [0.0031882743982895863, 0.0025409836065573774, 0.0030362951692012186] and parameters: {'n_layers': 1, 'embedding_dim': 64, 'lr': 4.2980801908422497e-05, 'lambda_val': 5.425911743955223e-06, 'batch_size': 2096, 'optimizer': 'RMSprop'}.
2026-05-23 03:09:14,778 - experiment_functions - INFO - Early stopping at epoch 1750. Best Metrics: (0.014973365688356874, 0.010245901639344262, 0.015058028152455001)
2026-05-23 03:09:14,861 - optuna.study.study - INFO - Trial 18 finished with values: [0.014973365688356874, 0.010245901639344262, 0.015058028152455001] and parameters: {'n_layers': 4, 'embedding_dim': 64, 'lr': 0.007933290135699793, 'lambda_val': 0.006249046967079677, 'batch_size': 593, 'optimizer': 'RMSprop'}.
2026-05-23 03:09:18,067 - experiment_functions - INFO - Early stopping at epoch 500. Best Metrics: (0.001797700613372365, 0.0017213114754098362, 0.0019723442751922275)
2026-05-23 03:09:18,901 - optuna.study.study - INFO - Trial 19 finished with values: [0.001797700613372365, 0.0017213114754098362, 0.0019723442751922275] and parameters: {'n_layers': 2, 'embedding_dim': 256, 'lr': 0.010567524986873161, 'lambda_val': 1.2910852092027151e-06, 'batch_size': 3755, 'optimizer': 'SGD'}.
2026-05-23 03:09:31,714 - optuna.study.study - INFO - Trial 20 finished with values: [0.004395445871490308, 0.002459016393442623, 0.0037749063795595762] and parameters: {'n_layers': 1, 'embedding_dim': 128, 'lr': 3.4533471497397735e-05, 'lambda_val': 1.205338374334867e-05, 'batch_size': 2803, 'optimizer': 'RMSprop'}.
2026-05-23 03:09:34,827 - experiment_functions - INFO - Early stopping at epoch 500. Best Metrics: (0.003087095152134551, 0.002295081967213115, 0.0030416258114504616)
2026-05-23 03:09:35,755 - optuna.study.study - INFO - Trial 21 finished with values: [0.003087095152134551, 0.002295081967213115, 0.0030416258114504616] and parameters: {'n_layers': 4, 'embedding_dim': 128, 'lr': 0.042727126148090724, 'lambda_val': 1.0046148274106341e-06, 'batch_size': 811, 'optimizer': 'SGD'}.
2026-05-23 03:09:47,391 - experiment_functions - INFO - Early stopping at epoch 3750. Best Metrics: (0.05054218184441262, 0.034754098360655745, 0.04992880843855872)
2026-05-23 03:09:47,796 - optuna.study.study - INFO - Trial 22 finished with values: [0.05054218184441262, 0.034754098360655745, 0.04992880843855872] and parameters: {'n_layers': 1, 'embedding_dim': 96, 'lr': 0.05127434843395431, 'lambda_val': 0.021930849416017365, 'batch_size': 3013, 'optimizer': 'RMSprop'}.
2026-05-23 03:09:52,959 - experiment_functions - INFO - Early stopping at epoch 500. Best Metrics: (0.0009067995726727804, 0.0017213114754098362, 0.001633981578918453)
2026-05-23 03:09:53,700 - optuna.study.study - INFO - Trial 23 finished with values: [0.0009067995726727804, 0.0017213114754098362, 0.001633981578918453] and parameters: {'n_layers': 1, 'embedding_dim': 96, 'lr': 8.858495635553385e-05, 'lambda_val': 5.3785186281624496e-06, 'batch_size': 1630, 'optimizer': 'SGD'}.
2026-05-23 03:10:08,066 - experiment_functions - INFO - Early stopping at epoch 2850. Best Metrics: (0.0022449735452926617, 0.0020491803278688526, 0.0033624985501708765)
2026-05-23 03:10:08,144 - optuna.study.study - INFO - Trial 24 finished with values: [0.0022449735452926617, 0.0020491803278688526, 0.0033624985501708765] and parameters: {'n_layers': 1, 'embedding_dim': 64, 'lr': 2.3197664199856527e-05, 'lambda_val': 1.4868585084973531e-06, 'batch_size': 3769, 'optimizer': 'RMSprop'}.
2026-05-23 03:10:23,535 - optuna.study.study - INFO - Trial 25 finished with values: [0.013060615406704534, 0.008114754098360656, 0.013033582265052837] and parameters: {'n_layers': 4, 'embedding_dim': 32, 'lr': 5.795056258182954e-05, 'lambda_val': 0.001142799850304835, 'batch_size': 1197, 'optimizer': 'Adam'}.
2026-05-23 03:10:43,372 - optuna.study.study - INFO - Trial 26 finished with values: [0.013386519282519037, 0.008770491803278688, 0.01286348617047527] and parameters: {'n_layers': 4, 'embedding_dim': 96, 'lr': 4.5283111815717906e-05, 'lambda_val': 1.241330855394676e-06, 'batch_size': 3936, 'optimizer': 'Adam'}.
2026-05-23 03:10:46,523 - experiment_functions - INFO - Early stopping at epoch 500. Best Metrics: (0.019781486806011436, 0.008688524590163936, 0.016448432423818465)
2026-05-23 03:10:46,595 - optuna.study.study - INFO - Trial 27 finished with values: [0.019781486806011436, 0.008688524590163936, 0.016448432423818465] and parameters: {'n_layers': 4, 'embedding_dim': 96, 'lr': 0.04152546660825017, 'lambda_val': 0.005672765240199157, 'batch_size': 3274, 'optimizer': 'RMSprop'}.
2026-05-23 03:11:04,429 - optuna.study.study - INFO - Trial 28 finished with values: [0.006881838030749279, 0.005737704918032787, 0.007339350755389418] and parameters: {'n_layers': 3, 'embedding_dim': 128, 'lr': 3.627079413285807e-05, 'lambda_val': 1.6553244073465298e-06, 'batch_size': 3290, 'optimizer': 'RMSprop'}.
2026-05-23 03:11:06,805 - experiment_functions - INFO - Early stopping at epoch 500. Best Metrics: (0.0029559316192593293, 0.001967213114754099, 0.002696467011142081)
2026-05-23 03:11:06,894 - optuna.study.study - INFO - Trial 29 finished with values: [0.0029559316192593293, 0.001967213114754099, 0.002696467011142081] and parameters: {'n_layers': 2, 'embedding_dim': 32, 'lr': 9.519375347266739e-05, 'lambda_val': 0.03322464541117807, 'batch_size': 1841, 'optimizer': 'SGD'}.
2026-05-23 03:11:09,943 - experiment_functions - INFO - Early stopping at epoch 700. Best Metrics: (0.06127565413682365, 0.03336065573770492, 0.05977059722796107)
2026-05-23 03:11:10,038 - optuna.study.study - INFO - Trial 30 finished with values: [0.06127565413682365, 0.03336065573770492, 0.05977059722796107] and parameters: {'n_layers': 2, 'embedding_dim': 32, 'lr': 0.0019040849385408827, 'lambda_val': 0.0005365242793466337, 'batch_size': 1828, 'optimizer': 'Adam'}.
2026-05-23 03:11:12,859 - experiment_functions - INFO - Early stopping at epoch 500. Best Metrics: (0.0018489215090836486, 0.0017213114754098362, 0.0022177702168489286)
2026-05-23 03:11:13,973 - optuna.study.study - INFO - Trial 31 finished with values: [0.0018489215090836486, 0.0017213114754098362, 0.0022177702168489286] and parameters: {'n_layers': 3, 'embedding_dim': 128, 'lr': 2.0644860696738728e-05, 'lambda_val': 0.00010195670573593226, 'batch_size': 1546, 'optimizer': 'SGD'}.
2026-05-23 03:11:16,292 - experiment_functions - INFO - Early stopping at epoch 500. Best Metrics: (0.002099598388377279, 0.0018852459016393446, 0.0021963481213776266)
2026-05-23 03:11:16,410 - optuna.study.study - INFO - Trial 32 finished with values: [0.002099598388377279, 0.0018852459016393446, 0.0021963481213776266] and parameters: {'n_layers': 1, 'embedding_dim': 128, 'lr': 0.014414611240177289, 'lambda_val': 1.4174689842440343e-05, 'batch_size': 3360, 'optimizer': 'SGD'}.
2026-05-23 03:11:18,983 - experiment_functions - INFO - Early stopping at epoch 500. Best Metrics: (0.0023122719910345295, 0.0018852459016393442, 0.0022953994757504955)
2026-05-23 03:11:19,130 - optuna.study.study - INFO - Trial 33 finished with values: [0.0023122719910345295, 0.0018852459016393442, 0.0022953994757504955] and parameters: {'n_layers': 2, 'embedding_dim': 128, 'lr': 0.007139202801953985, 'lambda_val': 0.06303728373890795, 'batch_size': 1552, 'optimizer': 'SGD'}.
2026-05-23 03:11:21,647 - experiment_functions - INFO - Early stopping at epoch 500. Best Metrics: (0.0024639322922374875, 0.0020491803278688526, 0.0025404803295457743)
2026-05-23 03:11:21,727 - optuna.study.study - INFO - Trial 34 finished with values: [0.0024639322922374875, 0.0020491803278688526, 0.0025404803295457743] and parameters: {'n_layers': 3, 'embedding_dim': 32, 'lr': 0.0015238104652997432, 'lambda_val': 0.015619351730975346, 'batch_size': 1733, 'optimizer': 'SGD'}.
2026-05-23 03:11:28,628 - experiment_functions - INFO - Early stopping at epoch 1500. Best Metrics: (0.0029776229399308377, 0.0019672131147540984, 0.0034519275600098285)
