2026-05-23 01:10:06,982 - optuna.study.study - INFO - Trial 276 finished with values: [0.027785245124174244, 0.017049180327868854, 0.02337658981126826] and parameters: {'n_layers': 2, 'embedding_dim': 64, 'lr': 0.0007586035361839872, 'lambda_val': 0.004686874294387785, 'batch_size': 2156, 'optimizer': 'Adam'}.
2026-05-23 01:10:10,556 - experiment_functions - INFO - Early stopping at epoch 850. Best Metrics: (0.034824440340928464, 0.019836065573770493, 0.03087213052820896)
2026-05-23 01:10:10,636 - optuna.study.study - INFO - Trial 277 finished with values: [0.034824440340928464, 0.019836065573770493, 0.03087213052820896] and parameters: {'n_layers': 2, 'embedding_dim': 256, 'lr': 0.0007586035361839872, 'lambda_val': 0.004686874294387785, 'batch_size': 785, 'optimizer': 'Adam'}.
2026-05-23 01:10:16,260 - experiment_functions - INFO - Early stopping at epoch 750. Best Metrics: (0.021910729804186922, 0.016639344262295082, 0.022084534508705556)
2026-05-23 01:10:16,818 - optuna.study.study - INFO - Trial 278 finished with values: [0.021910729804186922, 0.016639344262295082, 0.022084534508705556] and parameters: {'n_layers': 3, 'embedding_dim': 96, 'lr': 0.0007442610977334545, 'lambda_val': 0.004686874294387785, 'batch_size': 2004, 'optimizer': 'Adam'}.
2026-05-23 01:10:22,870 - experiment_functions - INFO - Early stopping at epoch 750. Best Metrics: (0.024645624167457972, 0.018114754098360657, 0.02370089062427535)
2026-05-23 01:10:22,959 - optuna.study.study - INFO - Trial 279 finished with values: [0.024645624167457972, 0.018114754098360657, 0.02370089062427535] and parameters: {'n_layers': 4, 'embedding_dim': 128, 'lr': 0.0007442610977334545, 'lambda_val': 0.0006167459118972293, 'batch_size': 861, 'optimizer': 'Adam'}.
2026-05-23 01:10:24,934 - experiment_functions - INFO - Early stopping at epoch 500. Best Metrics: (0.0015522340868719684, 0.0017213114754098366, 0.0019411079525476869)
2026-05-23 01:10:25,033 - optuna.study.study - INFO - Trial 280 finished with values: [0.0015522340868719684, 0.0017213114754098366, 0.0019411079525476869] and parameters: {'n_layers': 1, 'embedding_dim': 96, 'lr': 0.00037164008089034755, 'lambda_val': 0.0038174614428129216, 'batch_size': 979, 'optimizer': 'SGD'}.
2026-05-23 01:10:27,944 - experiment_functions - INFO - Early stopping at epoch 700. Best Metrics: (0.0298026703028692, 0.018278688524590164, 0.028013932863074034)
2026-05-23 01:10:28,035 - optuna.study.study - INFO - Trial 281 finished with values: [0.0298026703028692, 0.018278688524590164, 0.028013932863074034] and parameters: {'n_layers': 1, 'embedding_dim': 128, 'lr': 0.0034805464000646717, 'lambda_val': 0.0007172417291421626, 'batch_size': 971, 'optimizer': 'Adam'}.
2026-05-23 01:10:30,482 - experiment_functions - INFO - Early stopping at epoch 650. Best Metrics: (0.03336363616654918, 0.017295081967213115, 0.025867429035351663)
2026-05-23 01:10:30,578 - optuna.study.study - INFO - Trial 282 finished with values: [0.03336363616654918, 0.017295081967213115, 0.025867429035351663] and parameters: {'n_layers': 2, 'embedding_dim': 96, 'lr': 0.0021135494885504793, 'lambda_val': 0.004686874294387785, 'batch_size': 785, 'optimizer': 'Adam'}.
2026-05-23 01:10:33,254 - experiment_functions - INFO - Early stopping at epoch 700. Best Metrics: (0.03720558561326872, 0.020245901639344265, 0.03270528699564885)
2026-05-23 01:10:33,354 - optuna.study.study - INFO - Trial 283 finished with values: [0.03720558561326872, 0.020245901639344265, 0.03270528699564885] and parameters: {'n_layers': 2, 'embedding_dim': 128, 'lr': 0.0012673220264025206, 'lambda_val': 5.775336112034289e-05, 'batch_size': 1639, 'optimizer': 'Adam'}.
2026-05-23 01:10:36,036 - experiment_functions - INFO - Early stopping at epoch 800. Best Metrics: (0.030129435125419265, 0.018770491803278687, 0.02702939517848126)
2026-05-23 01:10:36,119 - optuna.study.study - INFO - Trial 284 finished with values: [0.030129435125419265, 0.018770491803278687, 0.02702939517848126] and parameters: {'n_layers': 1, 'embedding_dim': 128, 'lr': 0.0012673220264025206, 'lambda_val': 5.775336112034289e-05, 'batch_size': 1326, 'optimizer': 'RMSprop'}.
2026-05-23 01:10:47,587 - optuna.study.study - INFO - Trial 285 finished with values: [0.0014626235553706647, 0.0015573770491803278, 0.0020359183955226913] and parameters: {'n_layers': 1, 'embedding_dim': 256, 'lr': 3.1109067413893495e-05, 'lambda_val': 0.006616376079935662, 'batch_size': 1079, 'optimizer': 'Adam'}.
2026-05-23 01:10:51,248 - experiment_functions - INFO - Early stopping at epoch 1200. Best Metrics: (0.0327309506400733, 0.019180327868852463, 0.028272453674461424)
2026-05-23 01:10:51,351 - optuna.study.study - INFO - Trial 286 finished with values: [0.0327309506400733, 0.019180327868852463, 0.028272453674461424] and parameters: {'n_layers': 2, 'embedding_dim': 32, 'lr': 0.0007442610977334545, 'lambda_val': 6.335945209609284e-06, 'batch_size': 1007, 'optimizer': 'RMSprop'}.
2026-05-23 01:10:55,084 - experiment_functions - INFO - Early stopping at epoch 1250. Best Metrics: (0.030169276972402397, 0.019426229508196724, 0.027423249146806203)
2026-05-23 01:10:55,182 - optuna.study.study - INFO - Trial 287 finished with values: [0.030169276972402397, 0.019426229508196724, 0.027423249146806203] and parameters: {'n_layers': 1, 'embedding_dim': 128, 'lr': 0.0006241453841646659, 'lambda_val': 0.00017926987599292546, 'batch_size': 2156, 'optimizer': 'RMSprop'}.
2026-05-23 01:10:59,127 - experiment_functions - INFO - Early stopping at epoch 1150. Best Metrics: (0.034844197884489565, 0.01778688524590164, 0.02816942015388999)
2026-05-23 01:10:59,210 - optuna.study.study - INFO - Trial 288 finished with values: [0.034844197884489565, 0.01778688524590164, 0.02816942015388999] and parameters: {'n_layers': 3, 'embedding_dim': 96, 'lr': 0.0004014419530027751, 'lambda_val': 1.2051712435160432e-05, 'batch_size': 2831, 'optimizer': 'Adam'}.
2026-05-23 01:11:04,587 - experiment_functions - INFO - Early stopping at epoch 1200. Best Metrics: (0.03075432544773349, 0.01819672131147541, 0.026838397944517544)
2026-05-23 01:11:04,989 - optuna.study.study - INFO - Trial 289 finished with values: [0.03075432544773349, 0.01819672131147541, 0.026838397944517544] and parameters: {'n_layers': 1, 'embedding_dim': 96, 'lr': 0.0007586035361839872, 'lambda_val': 0.004686874294387785, 'batch_size': 2490, 'optimizer': 'Adam'}.
2026-05-23 01:11:13,812 - experiment_functions - INFO - Early stopping at epoch 1150. Best Metrics: (0.03311794665923224, 0.019836065573770493, 0.03137173861811125)
2026-05-23 01:11:14,726 - optuna.study.study - INFO - Trial 290 finished with values: [0.03311794665923224, 0.019836065573770493, 0.03137173861811125] and parameters: {'n_layers': 1, 'embedding_dim': 128, 'lr': 0.0006241453841646659, 'lambda_val': 5.775336112034289e-05, 'batch_size': 1254, 'optimizer': 'RMSprop'}.
2026-05-23 01:11:21,882 - experiment_functions - INFO - Early stopping at epoch 1050. Best Metrics: (0.02675453287201865, 0.017540983606557377, 0.026807497890739523)
2026-05-23 01:11:21,966 - optuna.study.study - INFO - Trial 291 finished with values: [0.02675453287201865, 0.017540983606557377, 0.026807497890739523] and parameters: {'n_layers': 2, 'embedding_dim': 256, 'lr': 0.0004014419530027751, 'lambda_val': 1.2051712435160432e-05, 'batch_size': 2831, 'optimizer': 'Adam'}.
2026-05-23 01:11:23,987 - experiment_functions - INFO - Early stopping at epoch 500. Best Metrics: (0.0015688229077588333, 0.0013114754098360656, 0.0013595151075344127)
2026-05-23 01:11:24,067 - optuna.study.study - INFO - Trial 292 finished with values: [0.0015688229077588333, 0.0013114754098360656, 0.0013595151075344127] and parameters: {'n_layers': 1, 'embedding_dim': 64, 'lr': 6.660559448944585e-05, 'lambda_val': 0.0007172417291421626, 'batch_size': 2156, 'optimizer': 'SGD'}.
2026-05-23 01:11:29,304 - experiment_functions - INFO - Early stopping at epoch 1700. Best Metrics: (0.03305917027870042, 0.017950819672131146, 0.026949151049107136)
2026-05-23 01:11:30,353 - optuna.study.study - INFO - Trial 293 finished with values: [0.03305917027870042, 0.017950819672131146, 0.026949151049107136] and parameters: {'n_layers': 1, 'embedding_dim': 96, 'lr': 0.0006241453841646659, 'lambda_val': 0.0007172417291421626, 'batch_size': 1588, 'optimizer': 'Adam'}.
2026-05-23 01:11:34,167 - experiment_functions - INFO - Early stopping at epoch 900. Best Metrics: (0.031686393890570916, 0.018360655737704918, 0.026987292779890464)
2026-05-23 01:11:34,261 - optuna.study.study - INFO - Trial 294 finished with values: [0.031686393890570916, 0.018360655737704918, 0.026987292779890464] and parameters: {'n_layers': 2, 'embedding_dim': 256, 'lr': 0.0007586035361839872, 'lambda_val': 0.004686874294387785, 'batch_size': 785, 'optimizer': 'Adam'}.
2026-05-23 01:11:37,673 - experiment_functions - INFO - Early stopping at epoch 850. Best Metrics: (0.038636245702314956, 0.022213114754098363, 0.03571581883493489)
2026-05-23 01:11:38,792 - optuna.study.study - INFO - Trial 295 finished with values: [0.038636245702314956, 0.022213114754098363, 0.03571581883493489] and parameters: {'n_layers': 3, 'embedding_dim': 96, 'lr': 0.0007442610977334545, 'lambda_val': 5.5532012635423735e-06, 'batch_size': 939, 'optimizer': 'Adam'}.
2026-05-23 01:11:44,072 - experiment_functions - INFO - Early stopping at epoch 1700. Best Metrics: (0.03907600893020721, 0.021475409836065572, 0.034466931341078554)
2026-05-23 01:11:44,569 - optuna.study.study - INFO - Trial 296 finished with values: [0.03907600893020721, 0.021475409836065572, 0.034466931341078554] and parameters: {'n_layers': 1, 'embedding_dim': 128, 'lr': 0.0004975305503445845, 'lambda_val': 5.775336112034289e-05, 'batch_size': 1639, 'optimizer': 'RMSprop'}.
2026-05-23 01:11:48,579 - experiment_functions - INFO - Early stopping at epoch 1250. Best Metrics: (0.03602837467491971, 0.01901639344262295, 0.02933933382078798)
2026-05-23 01:11:49,179 - optuna.study.study - INFO - Trial 297 finished with values: [0.03602837467491971, 0.01901639344262295, 0.02933933382078798] and parameters: {'n_layers': 1, 'embedding_dim': 32, 'lr': 0.0012673220264025206, 'lambda_val': 5.5532012635423735e-06, 'batch_size': 939, 'optimizer': 'RMSprop'}.
2026-05-23 01:11:53,514 - experiment_functions - INFO - Early stopping at epoch 1050. Best Metrics: (0.0367343411187423, 0.020491803278688523, 0.029662219509937544)
2026-05-23 01:11:53,639 - optuna.study.study - INFO - Trial 298 finished with values: [0.0367343411187423, 0.020491803278688523, 0.029662219509937544] and parameters: {'n_layers': 2, 'embedding_dim': 256, 'lr': 0.0006241453841646659, 'lambda_val': 5.228100030668519e-06, 'batch_size': 1254, 'optimizer': 'Adam'}.
2026-05-23 01:11:56,684 - experiment_functions - INFO - Early stopping at epoch 900. Best Metrics: (0.016369684406638583, 0.014426229508196723, 0.0179653628482971)
2026-05-23 01:11:56,773 - optuna.study.study - INFO - Trial 299 finished with values: [0.016369684406638583, 0.014426229508196723, 0.0179653628482971] and parameters: {'n_layers': 1, 'embedding_dim': 32, 'lr': 0.0012673220264025206, 'lambda_val': 0.06268979067743248, 'batch_size': 861, 'optimizer': 'Adam'}.
2026-05-23 01:11:56,789 - root - INFO - Selected Trial 154 based on Max NDCG: 0.0377
2026-05-23 01:11:56,789 - root - INFO - Associated Recall: 0.0416
2026-05-23 01:11:56,789 - experiment_functions - INFO - Training the best model ... for e_100K_1c1dcs_strict_rand2
2026-05-23 01:12:04,492 - experiment_functions - INFO - Early stopping at epoch 2950. Best Metrics: (0.03525119200189425, 0.020327868852459016, 0.030416278262410494)
2026-05-23 01:12:04,586 - root - INFO -   **** Training e_100K_1c1dcs_strict_rand3
2026-05-23 01:12:04,588 - root - INFO -   **** Getting 7229/81200 random edges
2026-05-23 01:12:04,890 - optuna.storages._rdb.storage - INFO - A new study created in RDB with name: Study_e_100K_1c1dcs_strict_rand3
2026-05-23 01:12:07,123 - experiment_functions - INFO - Early stopping at epoch 500. Best Metrics: (0.006256869383808462, 0.005491803278688524, 0.00822021809646868)
2026-05-23 01:12:07,230 - optuna.study.study - INFO - Trial 0 finished with values: [0.006256869383808462, 0.005491803278688524, 0.00822021809646868] and parameters: {'n_layers': 4, 'embedding_dim': 96, 'lr': 0.04858483877276336, 'lambda_val': 0.015280698226488912, 'batch_size': 833, 'optimizer': 'RMSprop'}.
2026-05-23 01:12:09,521 - experiment_functions - INFO - Early stopping at epoch 500. Best Metrics: (0.001176492402439601, 0.0012295081967213116, 0.001565771879821304)
2026-05-23 01:12:09,618 - optuna.study.study - INFO - Trial 1 finished with values: [0.001176492402439601, 0.0012295081967213116, 0.001565771879821304] and parameters: {'n_layers': 4, 'embedding_dim': 128, 'lr': 0.00232278729927878, 'lambda_val': 0.02391904319988148, 'batch_size': 2580, 'optimizer': 'SGD'}.
2026-05-23 01:12:12,801 - experiment_functions - INFO - Early stopping at epoch 800. Best Metrics: (0.0038673493297542434, 0.004426229508196722, 0.005462982929274437)
2026-05-23 01:12:12,885 - optuna.study.study - INFO - Trial 2 finished with values: [0.0038673493297542434, 0.004426229508196722, 0.005462982929274437] and parameters: {'n_layers': 4, 'embedding_dim': 64, 'lr': 0.0181553252436734, 'lambda_val': 0.0472767292805195, 'batch_size': 3684, 'optimizer': 'RMSprop'}.
2026-05-23 01:12:15,790 - experiment_functions - INFO - Early stopping at epoch 750. Best Metrics: (0.001397771999538046, 0.0019672131147540984, 0.0022463363966422124)
2026-05-23 01:12:15,881 - optuna.study.study - INFO - Trial 3 finished with values: [0.001397771999538046, 0.0019672131147540984, 0.0022463363966422124] and parameters: {'n_layers': 3, 'embedding_dim': 32, 'lr': 1.0198287877240019e-05, 'lambda_val': 0.018387339235117255, 'batch_size': 2407, 'optimizer': 'Adam'}.
2026-05-23 01:12:19,567 - experiment_functions - INFO - Early stopping at epoch 1150. Best Metrics: (0.0024974575199526268, 0.0020491803278688526, 0.0024899379611665845)
2026-05-23 01:12:20,690 - optuna.study.study - INFO - Trial 4 finished with values: [0.0024974575199526268, 0.0020491803278688526, 0.0024899379611665845] and parameters: {'n_layers': 1, 'embedding_dim': 64, 'lr': 0.035893869315947735, 'lambda_val': 0.0001067945767074503, 'batch_size': 2646, 'optimizer': 'SGD'}.
2026-05-23 01:12:22,801 - experiment_functions - INFO - Early stopping at epoch 500. Best Metrics: (0.002089317409921174, 0.0013934426229508196, 0.0019911872805886497)
2026-05-23 01:12:22,902 - optuna.study.study - INFO - Trial 5 finished with values: [0.002089317409921174, 0.0013934426229508196, 0.0019911872805886497] and parameters: {'n_layers': 2, 'embedding_dim': 64, 'lr': 0.0005864091804749678, 'lambda_val': 3.7159455962709016e-06, 'batch_size': 3763, 'optimizer': 'SGD'}.
2026-05-23 01:12:29,424 - experiment_functions - INFO - Early stopping at epoch 1700. Best Metrics: (0.009431885148239364, 0.006721311475409837, 0.008683091227731853)
2026-05-23 01:12:29,529 - optuna.study.study - INFO - Trial 6 finished with values: [0.009431885148239364, 0.006721311475409837, 0.008683091227731853] and parameters: {'n_layers': 4, 'embedding_dim': 96, 'lr': 0.08338835440209422, 'lambda_val': 0.0003520982341206958, 'batch_size': 3153, 'optimizer': 'Adam'}.
2026-05-23 01:12:31,706 - experiment_functions - INFO - Early stopping at epoch 500. Best Metrics: (0.002172682743306037, 0.001639344262295082, 0.002080372033777062)
2026-05-23 01:12:31,840 - optuna.study.study - INFO - Trial 7 finished with values: [0.002172682743306037, 0.001639344262295082, 0.002080372033777062] and parameters: {'n_layers': 1, 'embedding_dim': 96, 'lr': 0.015685338333062435, 'lambda_val': 0.00048767792259203, 'batch_size': 3054, 'optimizer': 'SGD'}.
2026-05-23 01:12:38,760 - experiment_functions - INFO - Early stopping at epoch 2200. Best Metrics: (0.016284254957324763, 0.012295081967213115, 0.016322519599794444)
2026-05-23 01:12:38,836 - optuna.study.study - INFO - Trial 8 finished with values: [0.016284254957324763, 0.012295081967213115, 0.016322519599794444] and parameters: {'n_layers': 1, 'embedding_dim': 64, 'lr': 0.024055272907309386, 'lambda_val': 0.03290724756030903, 'batch_size': 3085, 'optimizer': 'Adam'}.
2026-05-23 01:12:41,174 - experiment_functions - INFO - Early stopping at epoch 550. Best Metrics: (0.01602573622238833, 0.009262295081967215, 0.0127355108298332)
2026-05-23 01:12:41,262 - optuna.study.study - INFO - Trial 9 finished with values: [0.01602573622238833, 0.009262295081967215, 0.0127355108298332] and parameters: {'n_layers': 2, 'embedding_dim': 64, 'lr': 0.012518042433364582, 'lambda_val': 1.8703886629471356e-05, 'batch_size': 3122, 'optimizer': 'RMSprop'}.
2026-05-23 01:12:44,470 - experiment_functions - INFO - Early stopping at epoch 500. Best Metrics: (0.0020997485603609454, 0.0013114754098360656, 0.0016087204780043933)
2026-05-23 01:12:44,557 - optuna.study.study - INFO - Trial 10 finished with values: [0.0020997485603609454, 0.0013114754098360656, 0.0016087204780043933] and parameters: {'n_layers': 2, 'embedding_dim': 64, 'lr': 0.006136698942876551, 'lambda_val': 0.019329947758474065, 'batch_size': 1763, 'optimizer': 'SGD'}.
2026-05-23 01:12:46,793 - experiment_functions - INFO - Early stopping at epoch 500. Best Metrics: (0.0018122167330647504, 0.0017213114754098362, 0.0021871892778689917)
2026-05-23 01:12:46,880 - optuna.study.study - INFO - Trial 11 finished with values: [0.0018122167330647504, 0.0017213114754098362, 0.0021871892778689917] and parameters: {'n_layers': 2, 'embedding_dim': 128, 'lr': 0.00013675057348364563, 'lambda_val': 0.014594945501508534, 'batch_size': 3212, 'optimizer': 'SGD'}.
2026-05-23 01:12:50,274 - experiment_functions - INFO - Early stopping at epoch 850. Best Metrics: (0.01085175018547962, 0.006885245901639345, 0.009901355569339635)
2026-05-23 01:12:50,363 - optuna.study.study - INFO - Trial 12 finished with values: [0.01085175018547962, 0.006885245901639345, 0.009901355569339635] and parameters: {'n_layers': 2, 'embedding_dim': 32, 'lr': 0.03788718493482174, 'lambda_val': 0.008502387362746779, 'batch_size': 2300, 'optimizer': 'RMSprop'}.
2026-05-23 01:12:52,721 - experiment_functions - INFO - Early stopping at epoch 500. Best Metrics: (0.002504550660019605, 0.0018032786885245904, 0.0024894850107775998)
2026-05-23 01:12:52,819 - optuna.study.study - INFO - Trial 13 finished with values: [0.002504550660019605, 0.0018032786885245904, 0.0024894850107775998] and parameters: {'n_layers': 1, 'embedding_dim': 64, 'lr': 0.0009118081521070731, 'lambda_val': 0.009511174306630992, 'batch_size': 1593, 'optimizer': 'SGD'}.
2026-05-23 01:12:56,082 - experiment_functions - INFO - Early stopping at epoch 900. Best Metrics: (0.010572376410982381, 0.007950819672131147, 0.010419706036745404)
2026-05-23 01:12:56,592 - optuna.study.study - INFO - Trial 14 finished with values: [0.010572376410982381, 0.007950819672131147, 0.010419706036745404] and parameters: {'n_layers': 3, 'embedding_dim': 64, 'lr': 0.02917036398747882, 'lambda_val': 0.0008536732895970744, 'batch_size': 1758, 'optimizer': 'Adam'}.
2026-05-23 01:12:59,148 - experiment_functions - INFO - Early stopping at epoch 600. Best Metrics: (0.025265997408001895, 0.016475409836065574, 0.023189229828354443)
2026-05-23 01:12:59,247 - optuna.study.study - INFO - Trial 15 finished with values: [0.025265997408001895, 0.016475409836065574, 0.023189229828354443] and parameters: {'n_layers': 1, 'embedding_dim': 64, 'lr': 0.00736079824955284, 'lambda_val': 0.002510988429844692, 'batch_size': 3712, 'optimizer': 'Adam'}.
2026-05-23 01:13:01,862 - experiment_functions - INFO - Early stopping at epoch 500. Best Metrics: (0.0031652569502030577, 0.0018852459016393442, 0.003548783462104367)
2026-05-23 01:13:02,456 - optuna.study.study - INFO - Trial 16 finished with values: [0.0031652569502030577, 0.0018852459016393442, 0.003548783462104367] and parameters: {'n_layers': 4, 'embedding_dim': 64, 'lr': 1.17578383030161e-05, 'lambda_val': 0.013339937076514785, 'batch_size': 1530, 'optimizer': 'SGD'}.
2026-05-23 01:13:04,998 - experiment_functions - INFO - Early stopping at epoch 500. Best Metrics: (0.0025564617252046705, 0.001967213114754099, 0.002650319315335449)
2026-05-23 01:13:05,088 - optuna.study.study - INFO - Trial 17 finished with values: [0.0025564617252046705, 0.001967213114754099, 0.002650319315335449] and parameters: {'n_layers': 1, 'embedding_dim': 32, 'lr': 0.0014902400429312995, 'lambda_val': 0.010949527724278119, 'batch_size': 2440, 'optimizer': 'SGD'}.
2026-05-23 01:13:08,130 - experiment_functions - INFO - Early stopping at epoch 800. Best Metrics: (0.012520073540125746, 0.009098360655737705, 0.012541501397979677)
2026-05-23 01:13:08,253 - optuna.study.study - INFO - Trial 18 finished with values: [0.012520073540125746, 0.009098360655737705, 0.012541501397979677] and parameters: {'n_layers': 1, 'embedding_dim': 32, 'lr': 0.0054017846217753514, 'lambda_val': 0.06839725671798878, 'batch_size': 3018, 'optimizer': 'Adam'}.
2026-05-23 01:13:10,569 - experiment_functions - INFO - Early stopping at epoch 500. Best Metrics: (0.0025062374041207487, 0.0012295081967213116, 0.0016597663318828441)
2026-05-23 01:13:10,651 - optuna.study.study - INFO - Trial 19 finished with values: [0.0025062374041207487, 0.0012295081967213116, 0.0016597663318828441] and parameters: {'n_layers': 1, 'embedding_dim': 256, 'lr': 5.371261341390484e-05, 'lambda_val': 3.529029906313647e-05, 'batch_size': 3095, 'optimizer': 'SGD'}.
2026-05-23 01:13:12,766 - experiment_functions - INFO - Early stopping at epoch 500. Best Metrics: (0.0030087491802596447, 0.0019672131147540984, 0.00261162540076094)
2026-05-23 01:13:12,863 - optuna.study.study - INFO - Trial 20 finished with values: [0.0030087491802596447, 0.0019672131147540984, 0.00261162540076094] and parameters: {'n_layers': 2, 'embedding_dim': 128, 'lr': 0.00014789833189629128, 'lambda_val': 0.09293342363551857, 'batch_size': 649, 'optimizer': 'Adam'}.
