2026-05-22 23:28:37,851 - optuna.study.study - INFO - Trial 195 finished with values: [0.06820187687440218, 0.03778688524590164, 0.057246881390734534] and parameters: {'n_layers': 2, 'embedding_dim': 128, 'lr': 0.0008184011149012127, 'lambda_val': 6.850018651910113e-05, 'batch_size': 2759, 'optimizer': 'Adam'}.
2026-05-22 23:28:44,896 - experiment_functions - INFO - Early stopping at epoch 1550. Best Metrics: (0.12450342134325439, 0.06336065573770491, 0.110052830700039)
2026-05-22 23:28:45,042 - optuna.study.study - INFO - Trial 196 finished with values: [0.12450342134325439, 0.06336065573770491, 0.110052830700039] and parameters: {'n_layers': 1, 'embedding_dim': 256, 'lr': 0.0005586191809811369, 'lambda_val': 0.0007483799258451436, 'batch_size': 1990, 'optimizer': 'Adam'}.
2026-05-22 23:28:48,387 - experiment_functions - INFO - Early stopping at epoch 700. Best Metrics: (0.05455153589388109, 0.030000000000000002, 0.048170468974899884)
2026-05-22 23:28:48,487 - optuna.study.study - INFO - Trial 197 finished with values: [0.05455153589388109, 0.030000000000000002, 0.048170468974899884] and parameters: {'n_layers': 1, 'embedding_dim': 128, 'lr': 0.01158026631563179, 'lambda_val': 1.1763921861783511e-05, 'batch_size': 704, 'optimizer': 'RMSprop'}.
2026-05-22 23:28:55,708 - experiment_functions - INFO - Early stopping at epoch 1500. Best Metrics: (0.1033297853821656, 0.05557377049180327, 0.09168547635586281)
2026-05-22 23:28:55,802 - optuna.study.study - INFO - Trial 198 finished with values: [0.1033297853821656, 0.05557377049180327, 0.09168547635586281] and parameters: {'n_layers': 1, 'embedding_dim': 256, 'lr': 0.0003253883741862748, 'lambda_val': 0.004805532813491775, 'batch_size': 3643, 'optimizer': 'Adam'}.
2026-05-22 23:29:11,882 - optuna.study.study - INFO - Trial 199 finished with values: [0.06684655013018646, 0.04286885245901639, 0.06331701182113145] and parameters: {'n_layers': 2, 'embedding_dim': 128, 'lr': 0.00014191753167124515, 'lambda_val': 4.1855561222722974e-06, 'batch_size': 1459, 'optimizer': 'RMSprop'}.
2026-05-22 23:29:15,981 - experiment_functions - INFO - Early stopping at epoch 600. Best Metrics: (0.07906630892253838, 0.039180327868852456, 0.06492654659792722)
2026-05-22 23:29:16,083 - optuna.study.study - INFO - Trial 200 finished with values: [0.07906630892253838, 0.039180327868852456, 0.06492654659792722] and parameters: {'n_layers': 2, 'embedding_dim': 256, 'lr': 0.0014373137364726936, 'lambda_val': 2.3648996790815136e-05, 'batch_size': 2288, 'optimizer': 'Adam'}.
2026-05-22 23:29:20,991 - experiment_functions - INFO - Early stopping at epoch 1050. Best Metrics: (0.06688644889715807, 0.0330327868852459, 0.05402361653665718)
2026-05-22 23:29:21,127 - optuna.study.study - INFO - Trial 201 finished with values: [0.06688644889715807, 0.0330327868852459, 0.05402361653665718] and parameters: {'n_layers': 1, 'embedding_dim': 256, 'lr': 0.0029369804066849336, 'lambda_val': 0.0011596678103466965, 'batch_size': 653, 'optimizer': 'RMSprop'}.
2026-05-22 23:29:26,021 - experiment_functions - INFO - Early stopping at epoch 750. Best Metrics: (0.06683964832719523, 0.03959016393442623, 0.06032781479109944)
2026-05-22 23:29:26,273 - optuna.study.study - INFO - Trial 202 finished with values: [0.06683964832719523, 0.03959016393442623, 0.06032781479109944] and parameters: {'n_layers': 2, 'embedding_dim': 256, 'lr': 0.0005586191809811369, 'lambda_val': 2.3648996790815136e-05, 'batch_size': 3643, 'optimizer': 'RMSprop'}.
2026-05-22 23:29:28,993 - experiment_functions - INFO - Early stopping at epoch 550. Best Metrics: (0.0944026426408518, 0.047213114754098354, 0.0828150027566818)
2026-05-22 23:29:29,127 - optuna.study.study - INFO - Trial 203 finished with values: [0.0944026426408518, 0.047213114754098354, 0.0828150027566818] and parameters: {'n_layers': 1, 'embedding_dim': 64, 'lr': 0.005542934754442859, 'lambda_val': 0.0007483799258451436, 'batch_size': 1033, 'optimizer': 'Adam'}.
2026-05-22 23:29:43,682 - optuna.study.study - INFO - Trial 204 finished with values: [0.07671832228509622, 0.0490983606557377, 0.07603210471204569] and parameters: {'n_layers': 1, 'embedding_dim': 128, 'lr': 0.00014191753167124515, 'lambda_val': 0.005129821983037811, 'batch_size': 3643, 'optimizer': 'RMSprop'}.
2026-05-22 23:29:47,395 - experiment_functions - INFO - Early stopping at epoch 550. Best Metrics: (0.07128290208516297, 0.04131147540983606, 0.06157639104534606)
2026-05-22 23:29:47,569 - optuna.study.study - INFO - Trial 205 finished with values: [0.07128290208516297, 0.04131147540983606, 0.06157639104534606] and parameters: {'n_layers': 2, 'embedding_dim': 256, 'lr': 0.0029369804066849336, 'lambda_val': 2.3648996790815136e-05, 'batch_size': 3490, 'optimizer': 'Adam'}.
2026-05-22 23:30:07,731 - optuna.study.study - INFO - Trial 206 finished with values: [0.08473034268232102, 0.04967213114754099, 0.0754049913563935] and parameters: {'n_layers': 2, 'embedding_dim': 256, 'lr': 0.00014191753167124515, 'lambda_val': 0.0016010999314799575, 'batch_size': 1459, 'optimizer': 'RMSprop'}.
2026-05-22 23:30:23,376 - optuna.study.study - INFO - Trial 207 finished with values: [0.064561992831501, 0.035573770491803276, 0.05761390498448355] and parameters: {'n_layers': 1, 'embedding_dim': 256, 'lr': 0.00014044488297116188, 'lambda_val': 2.3648996790815136e-05, 'batch_size': 874, 'optimizer': 'RMSprop'}.
2026-05-22 23:30:40,070 - optuna.study.study - INFO - Trial 208 finished with values: [0.0051810845412181466, 0.0034426229508196723, 0.005475627286647828] and parameters: {'n_layers': 1, 'embedding_dim': 256, 'lr': 3.0071847962897436e-05, 'lambda_val': 2.3648996790815136e-05, 'batch_size': 3835, 'optimizer': 'RMSprop'}.
2026-05-22 23:30:43,553 - experiment_functions - INFO - Early stopping at epoch 600. Best Metrics: (0.06000493036288386, 0.040327868852459016, 0.06035225178221186)
2026-05-22 23:30:43,911 - optuna.study.study - INFO - Trial 209 finished with values: [0.06000493036288386, 0.040327868852459016, 0.06035225178221186] and parameters: {'n_layers': 2, 'embedding_dim': 96, 'lr': 0.002406863740771825, 'lambda_val': 1.2429846238556994e-05, 'batch_size': 2952, 'optimizer': 'Adam'}.
2026-05-22 23:31:00,509 - optuna.study.study - INFO - Trial 210 finished with values: [0.08677490854462046, 0.04680327868852459, 0.08069821904242934] and parameters: {'n_layers': 2, 'embedding_dim': 128, 'lr': 0.00018259329948876513, 'lambda_val': 4.1855561222722974e-06, 'batch_size': 653, 'optimizer': 'Adam'}.
2026-05-22 23:31:02,942 - experiment_functions - INFO - Early stopping at epoch 500. Best Metrics: (0.0022794189068404006, 0.001967213114754099, 0.0027156870705368)
2026-05-22 23:31:03,086 - optuna.study.study - INFO - Trial 211 finished with values: [0.0022794189068404006, 0.001967213114754099, 0.0027156870705368] and parameters: {'n_layers': 1, 'embedding_dim': 64, 'lr': 0.0005586191809811369, 'lambda_val': 0.0007483799258451436, 'batch_size': 2288, 'optimizer': 'SGD'}.
2026-05-22 23:31:06,779 - experiment_functions - INFO - Early stopping at epoch 750. Best Metrics: (0.05160228019417046, 0.03573770491803279, 0.05006987480874847)
2026-05-22 23:31:06,918 - optuna.study.study - INFO - Trial 212 finished with values: [0.05160228019417046, 0.03573770491803279, 0.05006987480874847] and parameters: {'n_layers': 2, 'embedding_dim': 96, 'lr': 0.0005586191809811369, 'lambda_val': 0.004805532813491775, 'batch_size': 1459, 'optimizer': 'RMSprop'}.
2026-05-22 23:31:23,750 - optuna.study.study - INFO - Trial 213 finished with values: [0.07895114833987053, 0.04967213114754099, 0.07554886400595567] and parameters: {'n_layers': 1, 'embedding_dim': 256, 'lr': 0.00014191753167124515, 'lambda_val': 0.0016010999314799575, 'batch_size': 2610, 'optimizer': 'Adam'}.
2026-05-22 23:31:32,464 - experiment_functions - INFO - Early stopping at epoch 1500. Best Metrics: (0.07874722434492397, 0.03836065573770492, 0.06276854946191691)
2026-05-22 23:31:33,726 - optuna.study.study - INFO - Trial 214 finished with values: [0.07874722434492397, 0.03836065573770492, 0.06276854946191691] and parameters: {'n_layers': 1, 'embedding_dim': 256, 'lr': 0.008816462778745638, 'lambda_val': 0.0016010999314799575, 'batch_size': 3643, 'optimizer': 'RMSprop'}.
2026-05-22 23:31:51,427 - optuna.study.study - INFO - Trial 215 finished with values: [0.06627548647497157, 0.04180327868852459, 0.06502867959539761] and parameters: {'n_layers': 3, 'embedding_dim': 64, 'lr': 0.0002391583318230419, 'lambda_val': 0.0007483799258451436, 'batch_size': 829, 'optimizer': 'Adam'}.
2026-05-22 23:32:04,759 - experiment_functions - INFO - Early stopping at epoch 3100. Best Metrics: (0.046418162707059965, 0.02180327868852459, 0.03626133163148997)
2026-05-22 23:32:04,858 - optuna.study.study - INFO - Trial 216 finished with values: [0.046418162707059965, 0.02180327868852459, 0.03626133163148997] and parameters: {'n_layers': 2, 'embedding_dim': 128, 'lr': 0.043456479039298314, 'lambda_val': 0.0011407825104914925, 'batch_size': 3045, 'optimizer': 'Adam'}.
2026-05-22 23:32:13,354 - experiment_functions - INFO - Early stopping at epoch 1900. Best Metrics: (0.11207678451099991, 0.06081967213114754, 0.10167072717094576)
2026-05-22 23:32:13,491 - optuna.study.study - INFO - Trial 217 finished with values: [0.11207678451099991, 0.06081967213114754, 0.10167072717094576] and parameters: {'n_layers': 1, 'embedding_dim': 256, 'lr': 0.0002391583318230419, 'lambda_val': 4.1855561222722974e-06, 'batch_size': 3643, 'optimizer': 'RMSprop'}.
2026-05-22 23:32:26,208 - experiment_functions - INFO - Early stopping at epoch 1700. Best Metrics: (0.03897844542024909, 0.02475409836065574, 0.03592543453652823)
2026-05-22 23:32:26,802 - optuna.study.study - INFO - Trial 218 finished with values: [0.03897844542024909, 0.02475409836065574, 0.03592543453652823] and parameters: {'n_layers': 4, 'embedding_dim': 256, 'lr': 0.00014191753167124515, 'lambda_val': 0.0016010999314799575, 'batch_size': 3045, 'optimizer': 'RMSprop'}.
2026-05-22 23:32:30,864 - experiment_functions - INFO - Early stopping at epoch 600. Best Metrics: (0.061201514859585415, 0.037295081967213116, 0.05629570386363908)
2026-05-22 23:32:31,005 - optuna.study.study - INFO - Trial 219 finished with values: [0.061201514859585415, 0.037295081967213116, 0.05629570386363908] and parameters: {'n_layers': 2, 'embedding_dim': 256, 'lr': 0.0014373137364726936, 'lambda_val': 0.004805532813491775, 'batch_size': 2610, 'optimizer': 'Adam'}.
2026-05-22 23:32:48,132 - optuna.study.study - INFO - Trial 220 finished with values: [0.09890059844513859, 0.05491803278688524, 0.09157999251976891] and parameters: {'n_layers': 1, 'embedding_dim': 256, 'lr': 0.00014191753167124515, 'lambda_val': 0.0001473158611730725, 'batch_size': 3643, 'optimizer': 'RMSprop'}.
2026-05-22 23:32:53,937 - experiment_functions - INFO - Early stopping at epoch 1200. Best Metrics: (0.12267662520841073, 0.059262295081967224, 0.10304701125518921)
2026-05-22 23:32:54,320 - optuna.study.study - INFO - Trial 221 finished with values: [0.12267662520841073, 0.059262295081967224, 0.10304701125518921] and parameters: {'n_layers': 1, 'embedding_dim': 256, 'lr': 0.0005586191809811369, 'lambda_val': 4.810636183413156e-06, 'batch_size': 2844, 'optimizer': 'RMSprop'}.
2026-05-22 23:33:09,015 - optuna.study.study - INFO - Trial 222 finished with values: [0.08400202970908746, 0.05040983606557377, 0.07420677194481429] and parameters: {'n_layers': 1, 'embedding_dim': 96, 'lr': 0.00018259329948876513, 'lambda_val': 4.1855561222722974e-06, 'batch_size': 4085, 'optimizer': 'RMSprop'}.
2026-05-22 23:33:21,917 - optuna.study.study - INFO - Trial 223 finished with values: [0.07326373434233968, 0.04221311475409836, 0.07207184066737338] and parameters: {'n_layers': 1, 'embedding_dim': 128, 'lr': 0.00014191753167124515, 'lambda_val': 0.0001473158611730725, 'batch_size': 3643, 'optimizer': 'RMSprop'}.
2026-05-22 23:33:31,017 - experiment_functions - INFO - Early stopping at epoch 2150. Best Metrics: (0.05590781446628707, 0.035081967213114754, 0.05210962616943511)
2026-05-22 23:33:31,971 - optuna.study.study - INFO - Trial 224 finished with values: [0.05590781446628707, 0.035081967213114754, 0.05210962616943511] and parameters: {'n_layers': 2, 'embedding_dim': 128, 'lr': 0.00018259329948876513, 'lambda_val': 0.004805532813491775, 'batch_size': 3507, 'optimizer': 'Adam'}.
2026-05-22 23:33:34,546 - experiment_functions - INFO - Early stopping at epoch 600. Best Metrics: (0.10033400795509237, 0.05516393442622951, 0.09129232657884631)
2026-05-22 23:33:36,037 - optuna.study.study - INFO - Trial 225 finished with values: [0.10033400795509237, 0.05516393442622951, 0.09129232657884631] and parameters: {'n_layers': 1, 'embedding_dim': 96, 'lr': 0.0032374955494066686, 'lambda_val': 3.88974253204855e-05, 'batch_size': 1033, 'optimizer': 'Adam'}.
2026-05-22 23:33:48,481 - optuna.study.study - INFO - Trial 226 finished with values: [0.020902294788577046, 0.01639344262295082, 0.022911637519926843] and parameters: {'n_layers': 1, 'embedding_dim': 128, 'lr': 7.999391039389191e-05, 'lambda_val': 0.0016010999314799575, 'batch_size': 2864, 'optimizer': 'Adam'}.
2026-05-22 23:33:52,664 - experiment_functions - INFO - Early stopping at epoch 1000. Best Metrics: (0.0874836388244903, 0.05139344262295082, 0.0802738899872565)
2026-05-22 23:33:52,907 - optuna.study.study - INFO - Trial 227 finished with values: [0.0874836388244903, 0.05139344262295082, 0.0802738899872565] and parameters: {'n_layers': 1, 'embedding_dim': 96, 'lr': 0.0005586191809811369, 'lambda_val': 0.004805532813491775, 'batch_size': 3835, 'optimizer': 'RMSprop'}.
2026-05-22 23:33:55,624 - experiment_functions - INFO - Early stopping at epoch 500. Best Metrics: (0.0010639024003218068, 0.0013114754098360656, 0.0013628851046442127)
2026-05-22 23:33:55,764 - optuna.study.study - INFO - Trial 228 finished with values: [0.0010639024003218068, 0.0013114754098360656, 0.0013628851046442127] and parameters: {'n_layers': 3, 'embedding_dim': 32, 'lr': 0.0014373137364726936, 'lambda_val': 0.004805532813491775, 'batch_size': 891, 'optimizer': 'SGD'}.
2026-05-22 23:34:02,740 - experiment_functions - INFO - Early stopping at epoch 1500. Best Metrics: (0.0747661977555024, 0.03467213114754098, 0.056852320361542044)
2026-05-22 23:34:02,896 - optuna.study.study - INFO - Trial 229 finished with values: [0.0747661977555024, 0.03467213114754098, 0.056852320361542044] and parameters: {'n_layers': 1, 'embedding_dim': 256, 'lr': 0.024045711553966904, 'lambda_val': 0.0016010999314799575, 'batch_size': 3643, 'optimizer': 'Adam'}.
2026-05-22 23:34:06,417 - experiment_functions - INFO - Early stopping at epoch 800. Best Metrics: (0.09299760469476802, 0.053934426229508205, 0.08502469549140684)
2026-05-22 23:34:07,206 - optuna.study.study - INFO - Trial 230 finished with values: [0.09299760469476802, 0.053934426229508205, 0.08502469549140684] and parameters: {'n_layers': 1, 'embedding_dim': 128, 'lr': 0.0014373137364726936, 'lambda_val': 4.1855561222722974e-06, 'batch_size': 653, 'optimizer': 'RMSprop'}.
2026-05-22 23:34:12,023 - experiment_functions - INFO - Early stopping at epoch 950. Best Metrics: (0.11689771054557223, 0.055163934426229515, 0.09704082407905285)
2026-05-22 23:34:13,222 - optuna.study.study - INFO - Trial 231 finished with values: [0.11689771054557223, 0.055163934426229515, 0.09704082407905285] and parameters: {'n_layers': 1, 'embedding_dim': 256, 'lr': 0.0005586191809811369, 'lambda_val': 2.3648996790815136e-05, 'batch_size': 3997, 'optimizer': 'RMSprop'}.
2026-05-22 23:34:29,545 - optuna.study.study - INFO - Trial 232 finished with values: [0.1013767763658149, 0.058032786885245914, 0.09355357609313453] and parameters: {'n_layers': 1, 'embedding_dim': 256, 'lr': 0.00018259329948876513, 'lambda_val': 0.0016010999314799575, 'batch_size': 1116, 'optimizer': 'RMSprop'}.
2026-05-22 23:34:39,659 - experiment_functions - INFO - Early stopping at epoch 2600. Best Metrics: (0.002081745759934211, 0.002295081967213115, 0.0029748743385604455)
2026-05-22 23:34:40,009 - optuna.study.study - INFO - Trial 233 finished with values: [0.002081745759934211, 0.002295081967213115, 0.0029748743385604455] and parameters: {'n_layers': 1, 'embedding_dim': 256, 'lr': 1.4116361062257988e-05, 'lambda_val': 3.408069633520805e-06, 'batch_size': 2149, 'optimizer': 'RMSprop'}.
2026-05-22 23:34:43,636 - experiment_functions - INFO - Early stopping at epoch 600. Best Metrics: (0.10954511924930499, 0.05377049180327868, 0.0916802387242438)
2026-05-22 23:34:44,355 - optuna.study.study - INFO - Trial 234 finished with values: [0.10954511924930499, 0.05377049180327868, 0.0916802387242438] and parameters: {'n_layers': 1, 'embedding_dim': 256, 'lr': 0.0014373137364726936, 'lambda_val': 0.0001333811184810849, 'batch_size': 3835, 'optimizer': 'RMSprop'}.
2026-05-22 23:34:47,233 - experiment_functions - INFO - Early stopping at epoch 600. Best Metrics: (0.0753020651210171, 0.04704918032786886, 0.07032728691899674)
2026-05-22 23:34:47,326 - optuna.study.study - INFO - Trial 235 finished with values: [0.0753020651210171, 0.04704918032786886, 0.07032728691899674] and parameters: {'n_layers': 1, 'embedding_dim': 64, 'lr': 0.0014373137364726936, 'lambda_val': 0.004805532813491775, 'batch_size': 3965, 'optimizer': 'RMSprop'}.
2026-05-22 23:34:54,821 - experiment_functions - INFO - Early stopping at epoch 1700. Best Metrics: (0.06894019106129243, 0.041721311475409834, 0.06531686508208323)
2026-05-22 23:34:55,267 - optuna.study.study - INFO - Trial 236 finished with values: [0.06894019106129243, 0.041721311475409834, 0.06531686508208323] and parameters: {'n_layers': 2, 'embedding_dim': 128, 'lr': 0.0002391583318230419, 'lambda_val': 2.3648996790815136e-05, 'batch_size': 3045, 'optimizer': 'RMSprop'}.
2026-05-22 23:34:57,739 - experiment_functions - INFO - Early stopping at epoch 500. Best Metrics: (0.0015418727398204205, 0.0012295081967213116, 0.0019023849659967748)
2026-05-22 23:34:57,883 - optuna.study.study - INFO - Trial 237 finished with values: [0.0015418727398204205, 0.0012295081967213116, 0.0019023849659967748] and parameters: {'n_layers': 1, 'embedding_dim': 128, 'lr': 0.00014191753167124515, 'lambda_val': 4.1855561222722974e-06, 'batch_size': 1459, 'optimizer': 'SGD'}.
2026-05-22 23:35:03,327 - experiment_functions - INFO - Early stopping at epoch 1250. Best Metrics: (0.06726071822782129, 0.044508196721311476, 0.06343539710488603)
2026-05-22 23:35:03,608 - optuna.study.study - INFO - Trial 238 finished with values: [0.06726071822782129, 0.044508196721311476, 0.06343539710488603] and parameters: {'n_layers': 2, 'embedding_dim': 96, 'lr': 0.00043580535895868097, 'lambda_val': 0.004805532813491775, 'batch_size': 1169, 'optimizer': 'Adam'}.
2026-05-22 23:35:06,539 - experiment_functions - INFO - Early stopping at epoch 550. Best Metrics: (0.06602372078069066, 0.03885245901639345, 0.05338722366958741)
2026-05-22 23:35:06,640 - optuna.study.study - INFO - Trial 239 finished with values: [0.06602372078069066, 0.03885245901639345, 0.05338722366958741] and parameters: {'n_layers': 1, 'embedding_dim': 128, 'lr': 0.009572593212470684, 'lambda_val': 0.004805532813491775, 'batch_size': 653, 'optimizer': 'Adam'}.
2026-05-22 23:35:09,876 - experiment_functions - INFO - Early stopping at epoch 550. Best Metrics: (0.04728860352752468, 0.022868852459016396, 0.03914525658761997)
2026-05-22 23:35:09,984 - optuna.study.study - INFO - Trial 240 finished with values: [0.04728860352752468, 0.022868852459016396, 0.03914525658761997] and parameters: {'n_layers': 1, 'embedding_dim': 256, 'lr': 0.029217039468801956, 'lambda_val': 4.1855561222722974e-06, 'batch_size': 2536, 'optimizer': 'Adam'}.
2026-05-22 23:35:14,407 - experiment_functions - INFO - Early stopping at epoch 1150. Best Metrics: (0.11165687735352914, 0.06393442622950819, 0.10265338087627746)
2026-05-22 23:35:14,872 - optuna.study.study - INFO - Trial 241 finished with values: [0.11165687735352914, 0.06393442622950819, 0.10265338087627746] and parameters: {'n_layers': 1, 'embedding_dim': 32, 'lr': 0.0013596200813318466, 'lambda_val': 0.0001473158611730725, 'batch_size': 653, 'optimizer': 'Adam'}.
2026-05-22 23:35:29,200 - optuna.study.study - INFO - Trial 242 finished with values: [0.07999049443544395, 0.04909836065573771, 0.07597717299508408] and parameters: {'n_layers': 1, 'embedding_dim': 128, 'lr': 0.00014191753167124515, 'lambda_val': 0.0016010999314799575, 'batch_size': 3643, 'optimizer': 'RMSprop'}.
2026-05-22 23:35:34,238 - experiment_functions - INFO - Early stopping at epoch 750. Best Metrics: (0.07076744156914519, 0.04467213114754098, 0.06710528977891164)
2026-05-22 23:35:34,764 - optuna.study.study - INFO - Trial 243 finished with values: [0.07076744156914519, 0.04467213114754098, 0.06710528977891164] and parameters: {'n_layers': 2, 'embedding_dim': 128, 'lr': 0.0005615984280931736, 'lambda_val': 4.1855561222722974e-06, 'batch_size': 1315, 'optimizer': 'RMSprop'}.
2026-05-22 23:35:51,872 - optuna.study.study - INFO - Trial 244 finished with values: [0.08788258011606316, 0.05188524590163936, 0.08023249083098948] and parameters: {'n_layers': 1, 'embedding_dim': 256, 'lr': 0.00014191753167124515, 'lambda_val': 0.0001473158611730725, 'batch_size': 3643, 'optimizer': 'Adam'}.
2026-05-22 23:36:03,730 - experiment_functions - INFO - Early stopping at epoch 2800. Best Metrics: (0.0858009897112954, 0.05073770491803278, 0.08358777066330268)
2026-05-22 23:36:03,980 - optuna.study.study - INFO - Trial 245 finished with values: [0.0858009897112954, 0.05073770491803278, 0.08358777066330268] and parameters: {'n_layers': 2, 'embedding_dim': 128, 'lr': 0.0002391583318230419, 'lambda_val': 0.004805532813491775, 'batch_size': 653, 'optimizer': 'Adam'}.
2026-05-22 23:36:07,100 - experiment_functions - INFO - Early stopping at epoch 600. Best Metrics: (0.05886803151721847, 0.0389344262295082, 0.05496749158168382)
