2026-05-23 05:21:15,939 - optuna.study.study - INFO - Trial 280 finished with values: [0.08563699279046325, 0.04114754098360656, 0.06892389666164242] and parameters: {'n_layers': 1, 'embedding_dim': 32, 'lr': 0.0032256937887088586, 'lambda_val': 0.00039751224330328457, 'batch_size': 2816, 'optimizer': 'Adam'}.
2026-05-23 05:21:21,596 - experiment_functions - INFO - Early stopping at epoch 800. Best Metrics: (0.004258739580691674, 0.0042622950819672135, 0.004939326047198781)
2026-05-23 05:21:21,861 - optuna.study.study - INFO - Trial 281 finished with values: [0.004258739580691674, 0.0042622950819672135, 0.004939326047198781] and parameters: {'n_layers': 4, 'embedding_dim': 256, 'lr': 0.007500361823223764, 'lambda_val': 0.09758248615834916, 'batch_size': 2784, 'optimizer': 'Adam'}.
2026-05-23 05:21:24,132 - experiment_functions - INFO - Early stopping at epoch 500. Best Metrics: (0.0005056058815240862, 0.0009016393442622952, 0.001044980021780619)
2026-05-23 05:21:24,244 - optuna.study.study - INFO - Trial 282 finished with values: [0.0005056058815240862, 0.0009016393442622952, 0.001044980021780619] and parameters: {'n_layers': 1, 'embedding_dim': 64, 'lr': 0.00019262259007340505, 'lambda_val': 4.915768160138094e-05, 'batch_size': 3864, 'optimizer': 'SGD'}.
2026-05-23 05:21:26,837 - experiment_functions - INFO - Early stopping at epoch 600. Best Metrics: (0.08809608129648977, 0.04491803278688525, 0.07481141389755594)
2026-05-23 05:21:26,966 - optuna.study.study - INFO - Trial 283 finished with values: [0.08809608129648977, 0.04491803278688525, 0.07481141389755594] and parameters: {'n_layers': 1, 'embedding_dim': 64, 'lr': 0.0032256937887088586, 'lambda_val': 1.2213470032695958e-05, 'batch_size': 1291, 'optimizer': 'Adam'}.
2026-05-23 05:21:31,189 - experiment_functions - INFO - Early stopping at epoch 1000. Best Metrics: (0.09868382366705665, 0.05311475409836065, 0.08731077109038922)
2026-05-23 05:21:31,494 - optuna.study.study - INFO - Trial 284 finished with values: [0.09868382366705665, 0.05311475409836065, 0.08731077109038922] and parameters: {'n_layers': 1, 'embedding_dim': 256, 'lr': 0.0005663247330896729, 'lambda_val': 0.0022074927841841977, 'batch_size': 2871, 'optimizer': 'Adam'}.
2026-05-23 05:21:37,056 - experiment_functions - INFO - Early stopping at epoch 1000. Best Metrics: (0.08095361720521539, 0.04860655737704918, 0.07262027412837706)
2026-05-23 05:21:37,917 - optuna.study.study - INFO - Trial 285 finished with values: [0.08095361720521539, 0.04860655737704918, 0.07262027412837706] and parameters: {'n_layers': 1, 'embedding_dim': 32, 'lr': 0.0009137435649842768, 'lambda_val': 4.006717999944042e-05, 'batch_size': 2784, 'optimizer': 'RMSprop'}.
2026-05-23 05:21:46,123 - experiment_functions - INFO - Early stopping at epoch 600. Best Metrics: (0.09588651834319008, 0.046557377049180323, 0.07895722798166623)
2026-05-23 05:21:46,895 - optuna.study.study - INFO - Trial 286 finished with values: [0.09588651834319008, 0.046557377049180323, 0.07895722798166623] and parameters: {'n_layers': 1, 'embedding_dim': 128, 'lr': 0.0027034335159540246, 'lambda_val': 0.0010473675830108427, 'batch_size': 2784, 'optimizer': 'Adam'}.
2026-05-23 05:21:51,545 - experiment_functions - INFO - Early stopping at epoch 550. Best Metrics: (0.07875769626881947, 0.03836065573770492, 0.06447778194149904)
2026-05-23 05:21:51,628 - optuna.study.study - INFO - Trial 287 finished with values: [0.07875769626881947, 0.03836065573770492, 0.06447778194149904] and parameters: {'n_layers': 1, 'embedding_dim': 64, 'lr': 0.0032256937887088586, 'lambda_val': 6.509910298202351e-05, 'batch_size': 3627, 'optimizer': 'RMSprop'}.
2026-05-23 05:21:54,445 - experiment_functions - INFO - Early stopping at epoch 600. Best Metrics: (0.0992969353764737, 0.04926229508196721, 0.08111694255264905)
2026-05-23 05:21:54,520 - optuna.study.study - INFO - Trial 288 finished with values: [0.0992969353764737, 0.04926229508196721, 0.08111694255264905] and parameters: {'n_layers': 1, 'embedding_dim': 128, 'lr': 0.0027034335159540246, 'lambda_val': 0.00039751224330328457, 'batch_size': 2553, 'optimizer': 'Adam'}.
2026-05-23 05:21:57,872 - experiment_functions - INFO - Early stopping at epoch 750. Best Metrics: (0.07922835057441877, 0.042049180327868856, 0.06731088631575649)
2026-05-23 05:21:57,975 - optuna.study.study - INFO - Trial 289 finished with values: [0.07922835057441877, 0.042049180327868856, 0.06731088631575649] and parameters: {'n_layers': 1, 'embedding_dim': 64, 'lr': 0.0017360496635105975, 'lambda_val': 2.7554943772348907e-05, 'batch_size': 3864, 'optimizer': 'Adam'}.
2026-05-23 05:22:01,160 - experiment_functions - INFO - Early stopping at epoch 600. Best Metrics: (0.10588351425604718, 0.048114754098360656, 0.08478391588599737)
2026-05-23 05:22:01,255 - optuna.study.study - INFO - Trial 290 finished with values: [0.10588351425604718, 0.048114754098360656, 0.08478391588599737] and parameters: {'n_layers': 1, 'embedding_dim': 256, 'lr': 0.0027034335159540246, 'lambda_val': 0.0010473675830108427, 'batch_size': 2166, 'optimizer': 'Adam'}.
2026-05-23 05:22:04,223 - experiment_functions - INFO - Early stopping at epoch 700. Best Metrics: (0.08309769529317867, 0.04434426229508196, 0.07144577408865975)
2026-05-23 05:22:04,306 - optuna.study.study - INFO - Trial 291 finished with values: [0.08309769529317867, 0.04434426229508196, 0.07144577408865975] and parameters: {'n_layers': 1, 'embedding_dim': 32, 'lr': 0.0032256937887088586, 'lambda_val': 2.574139920026743e-05, 'batch_size': 675, 'optimizer': 'Adam'}.
2026-05-23 05:22:07,290 - experiment_functions - INFO - Early stopping at epoch 550. Best Metrics: (0.0912608933396091, 0.04663934426229508, 0.0789833784940963)
2026-05-23 05:22:07,371 - optuna.study.study - INFO - Trial 292 finished with values: [0.0912608933396091, 0.04663934426229508, 0.0789833784940963] and parameters: {'n_layers': 1, 'embedding_dim': 256, 'lr': 0.0032256937887088586, 'lambda_val': 1.2213470032695958e-05, 'batch_size': 3945, 'optimizer': 'Adam'}.
2026-05-23 05:22:12,541 - experiment_functions - INFO - Early stopping at epoch 1100. Best Metrics: (0.10877345787161237, 0.052213114754098365, 0.08496588918590413)
2026-05-23 05:22:12,691 - optuna.study.study - INFO - Trial 293 finished with values: [0.10877345787161237, 0.052213114754098365, 0.08496588918590413] and parameters: {'n_layers': 1, 'embedding_dim': 256, 'lr': 0.000498408569398285, 'lambda_val': 0.00475024784706787, 'batch_size': 2784, 'optimizer': 'Adam'}.
2026-05-23 05:22:30,922 - optuna.study.study - INFO - Trial 294 finished with values: [0.05144868689292015, 0.028606557377049185, 0.04639392520568931] and parameters: {'n_layers': 3, 'embedding_dim': 128, 'lr': 0.00014111372590646973, 'lambda_val': 0.0010473675830108427, 'batch_size': 2385, 'optimizer': 'Adam'}.
2026-05-23 05:22:33,459 - experiment_functions - INFO - Early stopping at epoch 550. Best Metrics: (0.08195719047173383, 0.04147540983606558, 0.06533734207464943)
2026-05-23 05:22:33,556 - optuna.study.study - INFO - Trial 295 finished with values: [0.08195719047173383, 0.04147540983606558, 0.06533734207464943] and parameters: {'n_layers': 1, 'embedding_dim': 128, 'lr': 0.0027034335159540246, 'lambda_val': 4.915768160138094e-05, 'batch_size': 2385, 'optimizer': 'RMSprop'}.
2026-05-23 05:22:36,444 - experiment_functions - INFO - Early stopping at epoch 600. Best Metrics: (0.10705422429969966, 0.049836065573770495, 0.08830113130742086)
2026-05-23 05:22:36,768 - optuna.study.study - INFO - Trial 296 finished with values: [0.10705422429969966, 0.049836065573770495, 0.08830113130742086] and parameters: {'n_layers': 1, 'embedding_dim': 128, 'lr': 0.0027034335159540246, 'lambda_val': 2.7554943772348907e-05, 'batch_size': 3864, 'optimizer': 'Adam'}.
2026-05-23 05:22:39,294 - experiment_functions - INFO - Early stopping at epoch 600. Best Metrics: (0.1060129002838627, 0.05024590163934426, 0.08802927928338392)
2026-05-23 05:22:39,379 - optuna.study.study - INFO - Trial 297 finished with values: [0.1060129002838627, 0.05024590163934426, 0.08802927928338392] and parameters: {'n_layers': 1, 'embedding_dim': 64, 'lr': 0.0032256937887088586, 'lambda_val': 2.6112469187203954e-06, 'batch_size': 1291, 'optimizer': 'Adam'}.
2026-05-23 05:22:45,369 - experiment_functions - INFO - Early stopping at epoch 1400. Best Metrics: (0.10733808814756003, 0.05516393442622951, 0.09284780082312732)
2026-05-23 05:22:45,537 - optuna.study.study - INFO - Trial 298 finished with values: [0.10733808814756003, 0.05516393442622951, 0.09284780082312732] and parameters: {'n_layers': 1, 'embedding_dim': 256, 'lr': 0.000498408569398285, 'lambda_val': 0.00011374857041945478, 'batch_size': 1834, 'optimizer': 'Adam'}.
2026-05-23 05:22:48,311 - experiment_functions - INFO - Early stopping at epoch 600. Best Metrics: (0.05323774834451095, 0.03155737704918033, 0.04873771448798668)
2026-05-23 05:22:48,393 - optuna.study.study - INFO - Trial 299 finished with values: [0.05323774834451095, 0.03155737704918033, 0.04873771448798668] and parameters: {'n_layers': 2, 'embedding_dim': 64, 'lr': 0.0027034335159540246, 'lambda_val': 0.0003464722773423699, 'batch_size': 2202, 'optimizer': 'Adam'}.
2026-05-23 05:22:48,408 - root - INFO - Selected Trial 224 based on Max NDCG: 0.0953
2026-05-23 05:22:48,408 - root - INFO - Associated Recall: 0.1199
2026-05-23 05:22:48,408 - experiment_functions - INFO - Training the best model ... for e_100K_1c1dcs_rand4
2026-05-23 05:22:54,809 - experiment_functions - INFO - Early stopping at epoch 2050. Best Metrics: (0.11513279894838581, 0.053442622950819675, 0.09429966451376103)
2026-05-23 05:22:54,919 - root - INFO -   **** Training e_100K_1c1dcs_rand5
2026-05-23 05:22:54,931 - root - INFO -   **** Getting 65267/81200 random edges
2026-05-23 05:22:55,037 - optuna.storages._rdb.storage - INFO - A new study created in RDB with name: Study_e_100K_1c1dcs_rand5
2026-05-23 05:22:59,306 - experiment_functions - INFO - Early stopping at epoch 550. Best Metrics: (0.027361884966854905, 0.01737704918032787, 0.025409989209448678)
2026-05-23 05:23:00,642 - optuna.study.study - INFO - Trial 0 finished with values: [0.027361884966854905, 0.01737704918032787, 0.025409989209448678] and parameters: {'n_layers': 4, 'embedding_dim': 256, 'lr': 0.0026271984480321668, 'lambda_val': 0.0016872549049523802, 'batch_size': 1844, 'optimizer': 'Adam'}.
2026-05-23 05:23:18,686 - optuna.study.study - INFO - Trial 1 finished with values: [0.02787447967771977, 0.02172131147540984, 0.028754246650380937] and parameters: {'n_layers': 4, 'embedding_dim': 96, 'lr': 8.903239708963781e-05, 'lambda_val': 0.004484906087404067, 'batch_size': 1930, 'optimizer': 'RMSprop'}.
2026-05-23 05:23:21,282 - experiment_functions - INFO - Early stopping at epoch 550. Best Metrics: (0.011917590700895193, 0.012049180327868851, 0.014094343727366093)
2026-05-23 05:23:21,419 - optuna.study.study - INFO - Trial 2 finished with values: [0.011917590700895193, 0.012049180327868851, 0.014094343727366093] and parameters: {'n_layers': 2, 'embedding_dim': 32, 'lr': 0.006832650701048396, 'lambda_val': 0.06794962569788122, 'batch_size': 2612, 'optimizer': 'Adam'}.
2026-05-23 05:23:24,876 - experiment_functions - INFO - Early stopping at epoch 550. Best Metrics: (0.06190981146029251, 0.028852459016393446, 0.04926316773561954)
2026-05-23 05:23:25,731 - optuna.study.study - INFO - Trial 3 finished with values: [0.06190981146029251, 0.028852459016393446, 0.04926316773561954] and parameters: {'n_layers': 2, 'embedding_dim': 256, 'lr': 0.006312777493233292, 'lambda_val': 0.00013338361174833875, 'batch_size': 1794, 'optimizer': 'Adam'}.
2026-05-23 05:23:27,901 - experiment_functions - INFO - Early stopping at epoch 500. Best Metrics: (0.0007369918760612255, 0.0009836065573770494, 0.0009857375125268506)
2026-05-23 05:23:28,067 - optuna.study.study - INFO - Trial 4 finished with values: [0.0007369918760612255, 0.0009836065573770494, 0.0009857375125268506] and parameters: {'n_layers': 1, 'embedding_dim': 64, 'lr': 0.0004229869688174832, 'lambda_val': 0.0006889618347242515, 'batch_size': 1071, 'optimizer': 'SGD'}.
2026-05-23 05:23:43,955 - optuna.study.study - INFO - Trial 5 finished with values: [0.004686650436962519, 0.0030327868852459017, 0.004582828724684923] and parameters: {'n_layers': 3, 'embedding_dim': 96, 'lr': 2.883058733220993e-05, 'lambda_val': 0.003273430437450601, 'batch_size': 1306, 'optimizer': 'Adam'}.
2026-05-23 05:23:49,695 - experiment_functions - INFO - Early stopping at epoch 1050. Best Metrics: (0.0407568764998857, 0.016885245901639347, 0.030615457768516825)
2026-05-23 05:23:50,054 - optuna.study.study - INFO - Trial 6 finished with values: [0.0407568764998857, 0.016885245901639347, 0.030615457768516825] and parameters: {'n_layers': 2, 'embedding_dim': 256, 'lr': 0.0087991751940927, 'lambda_val': 0.00045534797562752613, 'batch_size': 3604, 'optimizer': 'RMSprop'}.
2026-05-23 05:23:52,093 - experiment_functions - INFO - Early stopping at epoch 500. Best Metrics: (0.0021890075956837083, 0.001475409836065574, 0.0016870923255889593)
2026-05-23 05:23:52,222 - optuna.study.study - INFO - Trial 7 finished with values: [0.0021890075956837083, 0.001475409836065574, 0.0016870923255889593] and parameters: {'n_layers': 1, 'embedding_dim': 32, 'lr': 0.00021537135361004157, 'lambda_val': 0.00022579928830836286, 'batch_size': 3842, 'optimizer': 'SGD'}.
2026-05-23 05:23:57,935 - experiment_functions - INFO - Early stopping at epoch 1250. Best Metrics: (0.013514027716875182, 0.009836065573770493, 0.013615607490937251)
2026-05-23 05:23:58,038 - optuna.study.study - INFO - Trial 8 finished with values: [0.013514027716875182, 0.009836065573770493, 0.013615607490937251] and parameters: {'n_layers': 4, 'embedding_dim': 64, 'lr': 0.009510259729206636, 'lambda_val': 0.00832080343107862, 'batch_size': 1072, 'optimizer': 'RMSprop'}.
2026-05-23 05:24:00,783 - experiment_functions - INFO - Early stopping at epoch 500. Best Metrics: (0.003607276759192235, 0.002049180327868853, 0.0025834156944015514)
2026-05-23 05:24:00,875 - optuna.study.study - INFO - Trial 9 finished with values: [0.003607276759192235, 0.002049180327868853, 0.0025834156944015514] and parameters: {'n_layers': 4, 'embedding_dim': 64, 'lr': 0.006120926767051833, 'lambda_val': 0.015066959435532682, 'batch_size': 2640, 'optimizer': 'SGD'}.
2026-05-23 05:24:04,195 - experiment_functions - INFO - Early stopping at epoch 500. Best Metrics: (0.0013552050290317474, 0.0021311475409836068, 0.0019010516225932343)
2026-05-23 05:24:04,282 - optuna.study.study - INFO - Trial 10 finished with values: [0.0013552050290317474, 0.0021311475409836068, 0.0019010516225932343] and parameters: {'n_layers': 3, 'embedding_dim': 256, 'lr': 6.682572529727744e-05, 'lambda_val': 0.022292817207198976, 'batch_size': 957, 'optimizer': 'SGD'}.
2026-05-23 05:24:06,310 - experiment_functions - INFO - Early stopping at epoch 500. Best Metrics: (0.00178560895363731, 0.0018852459016393446, 0.0025042747256586785)
2026-05-23 05:24:06,396 - optuna.study.study - INFO - Trial 11 finished with values: [0.00178560895363731, 0.0018852459016393446, 0.0025042747256586785] and parameters: {'n_layers': 1, 'embedding_dim': 96, 'lr': 0.02809820741284959, 'lambda_val': 0.03698791518872917, 'batch_size': 1442, 'optimizer': 'SGD'}.
2026-05-23 05:24:17,798 - experiment_functions - INFO - Early stopping at epoch 2500. Best Metrics: (0.012773146794643253, 0.00959016393442623, 0.014595690118610059)
2026-05-23 05:24:18,297 - optuna.study.study - INFO - Trial 12 finished with values: [0.012773146794643253, 0.00959016393442623, 0.014595690118610059] and parameters: {'n_layers': 4, 'embedding_dim': 96, 'lr': 0.04108276478412852, 'lambda_val': 0.011225450134900047, 'batch_size': 759, 'optimizer': 'Adam'}.
2026-05-23 05:24:26,235 - experiment_functions - INFO - Early stopping at epoch 500. Best Metrics: (0.0013709593600548333, 0.001639344262295082, 0.0018123339134710312)
2026-05-23 05:24:27,001 - optuna.study.study - INFO - Trial 13 finished with values: [0.0013709593600548333, 0.001639344262295082, 0.0018123339134710312] and parameters: {'n_layers': 2, 'embedding_dim': 32, 'lr': 0.04730092216888439, 'lambda_val': 1.3564276176821035e-06, 'batch_size': 2876, 'optimizer': 'SGD'}.
2026-05-23 05:24:32,454 - experiment_functions - INFO - Early stopping at epoch 550. Best Metrics: (0.03604704231109934, 0.018032786885245903, 0.027399862385532155)
2026-05-23 05:24:32,546 - optuna.study.study - INFO - Trial 14 finished with values: [0.03604704231109934, 0.018032786885245903, 0.027399862385532155] and parameters: {'n_layers': 2, 'embedding_dim': 256, 'lr': 0.00889050274911736, 'lambda_val': 0.0017980181304045255, 'batch_size': 1631, 'optimizer': 'Adam'}.
2026-05-23 05:24:35,578 - experiment_functions - INFO - Early stopping at epoch 500. Best Metrics: (0.0028161860907640656, 0.001967213114754099, 0.002577553209490051)
2026-05-23 05:24:35,667 - optuna.study.study - INFO - Trial 15 finished with values: [0.0028161860907640656, 0.001967213114754099, 0.002577553209490051] and parameters: {'n_layers': 4, 'embedding_dim': 96, 'lr': 0.011589313509533357, 'lambda_val': 0.005496962291729983, 'batch_size': 2427, 'optimizer': 'SGD'}.
2026-05-23 05:24:38,620 - experiment_functions - INFO - Early stopping at epoch 500. Best Metrics: (0.0017330738528309776, 0.0011475409836065576, 0.0015128436983373832)
2026-05-23 05:24:38,702 - optuna.study.study - INFO - Trial 16 finished with values: [0.0017330738528309776, 0.0011475409836065576, 0.0015128436983373832] and parameters: {'n_layers': 3, 'embedding_dim': 128, 'lr': 0.0002605442581439172, 'lambda_val': 2.279224808418887e-06, 'batch_size': 2522, 'optimizer': 'SGD'}.
2026-05-23 05:24:51,675 - experiment_functions - INFO - Early stopping at epoch 3000. Best Metrics: (0.003433042608211765, 0.002377049180327869, 0.003121751895059551)
2026-05-23 05:24:51,760 - optuna.study.study - INFO - Trial 17 finished with values: [0.003433042608211765, 0.002377049180327869, 0.003121751895059551] and parameters: {'n_layers': 3, 'embedding_dim': 96, 'lr': 2.1109971025706064e-05, 'lambda_val': 0.002746822646290224, 'batch_size': 3258, 'optimizer': 'Adam'}.
2026-05-23 05:25:06,254 - optuna.study.study - INFO - Trial 18 finished with values: [0.004947410998927088, 0.004098360655737705, 0.0055949997738190165] and parameters: {'n_layers': 4, 'embedding_dim': 32, 'lr': 3.621212385184791e-05, 'lambda_val': 0.0003396935209744395, 'batch_size': 954, 'optimizer': 'RMSprop'}.
2026-05-23 05:25:08,977 - experiment_functions - INFO - Early stopping at epoch 550. Best Metrics: (0.03199809190501635, 0.01836065573770492, 0.025367939783035653)
2026-05-23 05:25:09,191 - optuna.study.study - INFO - Trial 19 finished with values: [0.03199809190501635, 0.01836065573770492, 0.025367939783035653] and parameters: {'n_layers': 4, 'embedding_dim': 32, 'lr': 0.004748827105127406, 'lambda_val': 9.6014648956156e-06, 'batch_size': 2590, 'optimizer': 'Adam'}.
2026-05-23 05:25:11,374 - experiment_functions - INFO - Early stopping at epoch 500. Best Metrics: (0.0009633881834773901, 0.0011475409836065574, 0.001332676783217098)
2026-05-23 05:25:11,443 - optuna.study.study - INFO - Trial 20 finished with values: [0.0009633881834773901, 0.0011475409836065574, 0.001332676783217098] and parameters: {'n_layers': 3, 'embedding_dim': 64, 'lr': 0.002393459875114457, 'lambda_val': 0.003547940118574836, 'batch_size': 3512, 'optimizer': 'SGD'}.
2026-05-23 05:25:14,904 - experiment_functions - INFO - Early stopping at epoch 900. Best Metrics: (0.03254104625905983, 0.02245901639344262, 0.03085657492903141)
2026-05-23 05:25:15,035 - optuna.study.study - INFO - Trial 21 finished with values: [0.03254104625905983, 0.02245901639344262, 0.03085657492903141] and parameters: {'n_layers': 2, 'embedding_dim': 32, 'lr': 0.0005886314074719387, 'lambda_val': 0.023481160793884376, 'batch_size': 2251, 'optimizer': 'RMSprop'}.
2026-05-23 05:25:18,937 - experiment_functions - INFO - Early stopping at epoch 500. Best Metrics: (0.0027371162278479943, 0.0012295081967213116, 0.0028386856369696446)
2026-05-23 05:25:19,488 - optuna.study.study - INFO - Trial 22 finished with values: [0.0027371162278479943, 0.0012295081967213116, 0.0028386856369696446] and parameters: {'n_layers': 4, 'embedding_dim': 256, 'lr': 0.00011774695335120651, 'lambda_val': 1.8594843551394848e-05, 'batch_size': 2609, 'optimizer': 'SGD'}.
2026-05-23 05:25:32,314 - optuna.study.study - INFO - Trial 23 finished with values: [0.008184679082904295, 0.004836065573770492, 0.007658350355641584] and parameters: {'n_layers': 3, 'embedding_dim': 64, 'lr': 3.435957120246227e-05, 'lambda_val': 6.166182403013613e-06, 'batch_size': 2161, 'optimizer': 'RMSprop'}.
2026-05-23 05:25:43,234 - experiment_functions - INFO - Early stopping at epoch 3400. Best Metrics: (0.10427885667258747, 0.05327868852459016, 0.08864010728354259)
2026-05-23 05:25:43,770 - optuna.study.study - INFO - Trial 24 finished with values: [0.10427885667258747, 0.05327868852459016, 0.08864010728354259] and parameters: {'n_layers': 1, 'embedding_dim': 128, 'lr': 0.000360608106860257, 'lambda_val': 6.19406847114503e-05, 'batch_size': 1321, 'optimizer': 'RMSprop'}.
2026-05-23 05:25:56,145 - experiment_functions - INFO - Early stopping at epoch 3150. Best Metrics: (0.03733577575769336, 0.022786885245901643, 0.036651634419612576)
2026-05-23 05:25:56,251 - optuna.study.study - INFO - Trial 25 finished with values: [0.03733577575769336, 0.022786885245901643, 0.036651634419612576] and parameters: {'n_layers': 4, 'embedding_dim': 32, 'lr': 0.0003614258129820434, 'lambda_val': 0.002389697052100668, 'batch_size': 1628, 'optimizer': 'Adam'}.
