2026-05-22 23:01:34,704 - root - INFO - **** Training e_100K_full
2026-05-22 23:01:34,726 - helper_functions - INFO - Users: 610, Items: 9742
2026-05-22 23:01:34,856 - helper_functions - INFO - Edge index: torch.Size([2, 100836])
2026-05-22 23:01:34,856 - root - INFO - **** Generating the graph:
2026-05-22 23:01:34,937 - helper_functions - INFO - Number of unique users: 610
2026-05-22 23:01:34,938 - helper_functions - INFO - Number of unique items: 9724
2026-05-22 23:01:34,938 - helper_functions - INFO - Number of nodes: 10334
2026-05-22 23:01:34,939 - helper_functions - INFO - Number of edges: 100836
2026-05-22 23:01:39,144 - optuna.storages._rdb.storage - INFO - A new study created in RDB with name: Study_e_100K_full
2026-05-22 23:01:41,930 - experiment_functions - INFO - Early stopping at epoch 500. Best Metrics: (0.002746067767188848, 0.002131147540983607, 0.0028139735712507516)
2026-05-22 23:01:42,226 - optuna.study.study - INFO - Trial 0 finished with values: [0.002746067767188848, 0.002131147540983607, 0.0028139735712507516] and parameters: {'n_layers': 1, 'embedding_dim': 64, 'lr': 7.461044270230025e-05, 'lambda_val': 0.050418715508469554, 'batch_size': 761, 'optimizer': 'SGD'}.
2026-05-22 23:01:44,805 - experiment_functions - INFO - Early stopping at epoch 500. Best Metrics: (0.0020806538078767364, 0.0009836065573770494, 0.001197287669632657)
2026-05-22 23:01:44,905 - optuna.study.study - INFO - Trial 1 finished with values: [0.0020806538078767364, 0.0009836065573770494, 0.001197287669632657] and parameters: {'n_layers': 1, 'embedding_dim': 256, 'lr': 0.00018851163802024055, 'lambda_val': 3.287265915456076e-06, 'batch_size': 580, 'optimizer': 'SGD'}.
2026-05-22 23:01:55,564 - experiment_functions - INFO - Early stopping at epoch 2600. Best Metrics: (0.06950475839935642, 0.042786885245901636, 0.06443653066370027)
2026-05-22 23:01:56,344 - optuna.study.study - INFO - Trial 2 finished with values: [0.06950475839935642, 0.042786885245901636, 0.06443653066370027] and parameters: {'n_layers': 3, 'embedding_dim': 64, 'lr': 0.0002391583318230419, 'lambda_val': 0.0011596678103466965, 'batch_size': 1116, 'optimizer': 'RMSprop'}.
2026-05-22 23:01:59,366 - experiment_functions - INFO - Early stopping at epoch 650. Best Metrics: (0.03907056344796853, 0.029262295081967215, 0.03772636340985836)
2026-05-22 23:01:59,525 - optuna.study.study - INFO - Trial 3 finished with values: [0.03907056344796853, 0.029262295081967215, 0.03772636340985836] and parameters: {'n_layers': 2, 'embedding_dim': 32, 'lr': 0.0015716374883028592, 'lambda_val': 0.004163877683375522, 'batch_size': 3689, 'optimizer': 'Adam'}.
2026-05-22 23:02:11,521 - optuna.study.study - INFO - Trial 4 finished with values: [0.05299390970535296, 0.03163934426229509, 0.04615853626338947] and parameters: {'n_layers': 1, 'embedding_dim': 32, 'lr': 0.05241207551926649, 'lambda_val': 0.004805532813491775, 'batch_size': 653, 'optimizer': 'Adam'}.
2026-05-22 23:02:14,673 - experiment_functions - INFO - Early stopping at epoch 550. Best Metrics: (0.0014013665939610535, 0.002459016393442623, 0.0025385408060945927)
2026-05-22 23:02:15,469 - optuna.study.study - INFO - Trial 5 finished with values: [0.0014013665939610535, 0.002459016393442623, 0.0025385408060945927] and parameters: {'n_layers': 2, 'embedding_dim': 128, 'lr': 1.797539004209822e-05, 'lambda_val': 0.0001469413918404598, 'batch_size': 2731, 'optimizer': 'RMSprop'}.
2026-05-22 23:02:19,204 - experiment_functions - INFO - Early stopping at epoch 650. Best Metrics: (0.010228625433568585, 0.010655737704918032, 0.013011543585600058)
2026-05-22 23:02:19,298 - optuna.study.study - INFO - Trial 6 finished with values: [0.010228625433568585, 0.010655737704918032, 0.013011543585600058] and parameters: {'n_layers': 4, 'embedding_dim': 64, 'lr': 0.0009386876662853627, 'lambda_val': 0.053735510419040323, 'batch_size': 3061, 'optimizer': 'Adam'}.
2026-05-22 23:02:22,758 - experiment_functions - INFO - Early stopping at epoch 650. Best Metrics: (0.02368468980651056, 0.015327868852459018, 0.02634572765622445)
2026-05-22 23:02:23,583 - optuna.study.study - INFO - Trial 7 finished with values: [0.02368468980651056, 0.015327868852459018, 0.02634572765622445] and parameters: {'n_layers': 4, 'embedding_dim': 32, 'lr': 0.0032374955494066686, 'lambda_val': 7.613685556639934e-06, 'batch_size': 1995, 'optimizer': 'Adam'}.
2026-05-22 23:02:28,250 - experiment_functions - INFO - Early stopping at epoch 850. Best Metrics: (0.03181783258830713, 0.020163934426229508, 0.03147081995219664)
2026-05-22 23:02:28,347 - optuna.study.study - INFO - Trial 8 finished with values: [0.03181783258830713, 0.020163934426229508, 0.03147081995219664] and parameters: {'n_layers': 4, 'embedding_dim': 64, 'lr': 0.0008184011149012127, 'lambda_val': 0.0014275524741385077, 'batch_size': 2759, 'optimizer': 'Adam'}.
2026-05-22 23:02:31,579 - experiment_functions - INFO - Early stopping at epoch 600. Best Metrics: (0.034210296351953204, 0.0169672131147541, 0.02542654175101727)
2026-05-22 23:02:31,690 - optuna.study.study - INFO - Trial 9 finished with values: [0.034210296351953204, 0.0169672131147541, 0.02542654175101727] and parameters: {'n_layers': 2, 'embedding_dim': 128, 'lr': 0.0052410285088808715, 'lambda_val': 6.546533282327237e-06, 'batch_size': 3355, 'optimizer': 'RMSprop'}.
2026-05-22 23:02:35,341 - experiment_functions - INFO - Early stopping at epoch 550. Best Metrics: (0.02494628248503202, 0.01442622950819672, 0.021431833918897886)
2026-05-22 23:02:35,887 - optuna.study.study - INFO - Trial 10 finished with values: [0.02494628248503202, 0.01442622950819672, 0.021431833918897886] and parameters: {'n_layers': 2, 'embedding_dim': 256, 'lr': 0.014120604580233384, 'lambda_val': 1.4547563369375583e-05, 'batch_size': 3257, 'optimizer': 'Adam'}.
2026-05-22 23:02:38,921 - experiment_functions - INFO - Early stopping at epoch 500. Best Metrics: (0.0019143219491009784, 0.0014754098360655738, 0.0020391977106305336)
2026-05-22 23:02:39,636 - optuna.study.study - INFO - Trial 11 finished with values: [0.0019143219491009784, 0.0014754098360655738, 0.0020391977106305336] and parameters: {'n_layers': 3, 'embedding_dim': 128, 'lr': 1.3348209653118081e-05, 'lambda_val': 1.548329080636729e-05, 'batch_size': 751, 'optimizer': 'SGD'}.
2026-05-22 23:02:42,694 - experiment_functions - INFO - Early stopping at epoch 600. Best Metrics: (0.07167348874411998, 0.03991803278688525, 0.06319378325845924)
2026-05-22 23:02:44,724 - optuna.study.study - INFO - Trial 12 finished with values: [0.07167348874411998, 0.03991803278688525, 0.06319378325845924] and parameters: {'n_layers': 2, 'embedding_dim': 96, 'lr': 0.002406863740771825, 'lambda_val': 1.2429846238556994e-05, 'batch_size': 2952, 'optimizer': 'Adam'}.
2026-05-22 23:02:49,778 - experiment_functions - INFO - Early stopping at epoch 600. Best Metrics: (0.002976151664726687, 0.001557377049180328, 0.0033181671480277653)
2026-05-22 23:02:50,469 - optuna.study.study - INFO - Trial 13 finished with values: [0.002976151664726687, 0.001557377049180328, 0.0033181671480277653] and parameters: {'n_layers': 3, 'embedding_dim': 256, 'lr': 2.0790954971725015e-05, 'lambda_val': 1.7624994538127396e-05, 'batch_size': 867, 'optimizer': 'Adam'}.
2026-05-22 23:03:14,907 - optuna.study.study - INFO - Trial 14 finished with values: [0.004317901189412907, 0.0033606557377049177, 0.0046507983762869845] and parameters: {'n_layers': 3, 'embedding_dim': 256, 'lr': 2.7239313875063443e-05, 'lambda_val': 0.0025093371085558066, 'batch_size': 1352, 'optimizer': 'Adam'}.
2026-05-22 23:03:22,150 - experiment_functions - INFO - Early stopping at epoch 1450. Best Metrics: (0.010686763500781224, 0.008934426229508198, 0.011608746778070255)
2026-05-22 23:03:22,259 - optuna.study.study - INFO - Trial 15 finished with values: [0.010686763500781224, 0.008934426229508198, 0.011608746778070255] and parameters: {'n_layers': 3, 'embedding_dim': 128, 'lr': 0.02095070132580942, 'lambda_val': 0.052847000166949855, 'batch_size': 2400, 'optimizer': 'RMSprop'}.
2026-05-22 23:03:27,154 - experiment_functions - INFO - Early stopping at epoch 600. Best Metrics: (0.01838178192330041, 0.01721311475409836, 0.021460052473880584)
2026-05-22 23:03:27,255 - optuna.study.study - INFO - Trial 16 finished with values: [0.01838178192330041, 0.01721311475409836, 0.021460052473880584] and parameters: {'n_layers': 2, 'embedding_dim': 256, 'lr': 0.0019593624136751238, 'lambda_val': 0.027541242379727653, 'batch_size': 1334, 'optimizer': 'Adam'}.
2026-05-22 23:03:48,460 - optuna.study.study - INFO - Trial 17 finished with values: [0.0419669489174057, 0.030819672131147537, 0.04404955370192958] and parameters: {'n_layers': 4, 'embedding_dim': 96, 'lr': 0.00014702351969030086, 'lambda_val': 0.00013566611589542861, 'batch_size': 3414, 'optimizer': 'RMSprop'}.
2026-05-22 23:03:51,598 - experiment_functions - INFO - Early stopping at epoch 500. Best Metrics: (0.001618074088165142, 0.001475409836065574, 0.0015973723636116053)
2026-05-22 23:03:51,771 - optuna.study.study - INFO - Trial 18 finished with values: [0.001618074088165142, 0.001475409836065574, 0.0015973723636116053] and parameters: {'n_layers': 4, 'embedding_dim': 64, 'lr': 5.2697892740103746e-05, 'lambda_val': 7.181623128613778e-05, 'batch_size': 1369, 'optimizer': 'SGD'}.
2026-05-22 23:03:55,484 - experiment_functions - INFO - Early stopping at epoch 800. Best Metrics: (0.0561694720932625, 0.03418032786885246, 0.05175639070737769)
2026-05-22 23:03:56,503 - optuna.study.study - INFO - Trial 19 finished with values: [0.0561694720932625, 0.03418032786885246, 0.05175639070737769] and parameters: {'n_layers': 2, 'embedding_dim': 32, 'lr': 0.0013596200813318466, 'lambda_val': 7.913101106142164e-06, 'batch_size': 1636, 'optimizer': 'Adam'}.
2026-05-22 23:04:03,256 - experiment_functions - INFO - Early stopping at epoch 1350. Best Metrics: (0.016572680616627186, 0.01344262295081967, 0.017278218529020978)
2026-05-22 23:04:03,831 - optuna.study.study - INFO - Trial 20 finished with values: [0.016572680616627186, 0.01344262295081967, 0.017278218529020978] and parameters: {'n_layers': 2, 'embedding_dim': 96, 'lr': 0.0049640220604848925, 'lambda_val': 0.044766261489018064, 'batch_size': 1459, 'optimizer': 'RMSprop'}.
2026-05-22 23:04:07,340 - experiment_functions - INFO - Early stopping at epoch 700. Best Metrics: (0.05092340116917916, 0.027295081967213117, 0.04510577582827724)
2026-05-22 23:04:07,479 - optuna.study.study - INFO - Trial 21 finished with values: [0.05092340116917916, 0.027295081967213117, 0.04510577582827724] and parameters: {'n_layers': 1, 'embedding_dim': 128, 'lr': 0.01158026631563179, 'lambda_val': 0.000154598890124529, 'batch_size': 704, 'optimizer': 'RMSprop'}.
2026-05-22 23:04:12,313 - experiment_functions - INFO - Early stopping at epoch 500. Best Metrics: (0.002136396976395961, 0.0011475409836065576, 0.0013885128696632758)
2026-05-22 23:04:12,975 - optuna.study.study - INFO - Trial 22 finished with values: [0.002136396976395961, 0.0011475409836065576, 0.0013885128696632758] and parameters: {'n_layers': 4, 'embedding_dim': 128, 'lr': 0.0043180745145269305, 'lambda_val': 0.09317692348671457, 'batch_size': 577, 'optimizer': 'SGD'}.
2026-05-22 23:04:16,263 - experiment_functions - INFO - Early stopping at epoch 500. Best Metrics: (0.0026614470550398927, 0.0017213114754098362, 0.002430869066309001)
2026-05-22 23:04:17,162 - optuna.study.study - INFO - Trial 23 finished with values: [0.0026614470550398927, 0.0017213114754098362, 0.002430869066309001] and parameters: {'n_layers': 3, 'embedding_dim': 128, 'lr': 0.009913555801309003, 'lambda_val': 0.00020403161061397152, 'batch_size': 576, 'optimizer': 'SGD'}.
2026-05-22 23:04:22,983 - experiment_functions - INFO - Early stopping at epoch 1000. Best Metrics: (0.002413753928554934, 0.001639344262295082, 0.0020009553000873118)
2026-05-22 23:04:23,290 - optuna.study.study - INFO - Trial 24 finished with values: [0.002413753928554934, 0.001639344262295082, 0.0020009553000873118] and parameters: {'n_layers': 2, 'embedding_dim': 256, 'lr': 2.4827340190790358e-05, 'lambda_val': 0.0008012950117145599, 'batch_size': 696, 'optimizer': 'Adam'}.
2026-05-22 23:04:26,302 - experiment_functions - INFO - Early stopping at epoch 500. Best Metrics: (0.00153931533722093, 0.001557377049180328, 0.0016248506903337033)
2026-05-22 23:04:26,445 - optuna.study.study - INFO - Trial 25 finished with values: [0.00153931533722093, 0.001557377049180328, 0.0016248506903337033] and parameters: {'n_layers': 3, 'embedding_dim': 96, 'lr': 0.0018057976408500306, 'lambda_val': 0.0003272540787425954, 'batch_size': 1198, 'optimizer': 'SGD'}.
2026-05-22 23:04:29,490 - experiment_functions - INFO - Early stopping at epoch 500. Best Metrics: (0.003806711121502547, 0.002704918032786885, 0.0033319068789938347)
2026-05-22 23:04:29,635 - optuna.study.study - INFO - Trial 26 finished with values: [0.003806711121502547, 0.002704918032786885, 0.0033319068789938347] and parameters: {'n_layers': 2, 'embedding_dim': 64, 'lr': 4.810562174851323e-05, 'lambda_val': 0.009705879745865276, 'batch_size': 2887, 'optimizer': 'Adam'}.
2026-05-22 23:04:37,815 - experiment_functions - INFO - Early stopping at epoch 1500. Best Metrics: (0.030232444899928285, 0.014672131147540986, 0.02489218764676624)
2026-05-22 23:04:37,963 - optuna.study.study - INFO - Trial 27 finished with values: [0.030232444899928285, 0.014672131147540986, 0.02489218764676624] and parameters: {'n_layers': 3, 'embedding_dim': 128, 'lr': 0.06514473676765253, 'lambda_val': 0.0014101679442333785, 'batch_size': 3639, 'optimizer': 'Adam'}.
2026-05-22 23:04:43,004 - experiment_functions - INFO - Early stopping at epoch 950. Best Metrics: (0.007951413261515286, 0.006639344262295082, 0.0090940739666791)
2026-05-22 23:04:43,158 - optuna.study.study - INFO - Trial 28 finished with values: [0.007951413261515286, 0.006639344262295082, 0.0090940739666791] and parameters: {'n_layers': 4, 'embedding_dim': 32, 'lr': 0.008580452800657222, 'lambda_val': 0.04236774170162714, 'batch_size': 3025, 'optimizer': 'RMSprop'}.
2026-05-22 23:04:47,107 - experiment_functions - INFO - Early stopping at epoch 600. Best Metrics: (0.012609949497763317, 0.009098360655737705, 0.01243682933600109)
2026-05-22 23:04:47,247 - optuna.study.study - INFO - Trial 29 finished with values: [0.012609949497763317, 0.009098360655737705, 0.01243682933600109] and parameters: {'n_layers': 4, 'embedding_dim': 96, 'lr': 0.01243482202597104, 'lambda_val': 0.0006542099358730213, 'batch_size': 874, 'optimizer': 'Adam'}.
2026-05-22 23:05:05,028 - optuna.study.study - INFO - Trial 30 finished with values: [0.010470661890404454, 0.007049180327868854, 0.01024034442396856] and parameters: {'n_layers': 3, 'embedding_dim': 96, 'lr': 4.02607929442622e-05, 'lambda_val': 1.1217659892376085e-05, 'batch_size': 2652, 'optimizer': 'Adam'}.
2026-05-22 23:05:07,594 - experiment_functions - INFO - Early stopping at epoch 500. Best Metrics: (0.0018191363031403983, 0.0017213114754098362, 0.002267368765559159)
2026-05-22 23:05:07,737 - optuna.study.study - INFO - Trial 31 finished with values: [0.0018191363031403983, 0.0017213114754098362, 0.002267368765559159] and parameters: {'n_layers': 1, 'embedding_dim': 32, 'lr': 0.00011821518721162253, 'lambda_val': 0.07726077475923344, 'batch_size': 3137, 'optimizer': 'SGD'}.
2026-05-22 23:05:12,155 - experiment_functions - INFO - Early stopping at epoch 500. Best Metrics: (0.001655233852559095, 0.0013114754098360656, 0.0014675242625268297)
2026-05-22 23:05:12,303 - optuna.study.study - INFO - Trial 32 finished with values: [0.001655233852559095, 0.0013114754098360656, 0.0014675242625268297] and parameters: {'n_layers': 4, 'embedding_dim': 256, 'lr': 0.0001630282835951468, 'lambda_val': 0.028611958283108238, 'batch_size': 3936, 'optimizer': 'SGD'}.
2026-05-22 23:05:23,642 - experiment_functions - INFO - Early stopping at epoch 1500. Best Metrics: (0.0054212280060716165, 0.00540983606557377, 0.0076681802212746905)
2026-05-22 23:05:24,094 - optuna.study.study - INFO - Trial 33 finished with values: [0.0054212280060716165, 0.00540983606557377, 0.0076681802212746905] and parameters: {'n_layers': 4, 'embedding_dim': 256, 'lr': 0.006488972193504976, 'lambda_val': 0.07299302124361523, 'batch_size': 3835, 'optimizer': 'RMSprop'}.
2026-05-22 23:05:28,512 - experiment_functions - INFO - Early stopping at epoch 500. Best Metrics: (0.002519331497990455, 0.0012295081967213116, 0.002695248972733546)
2026-05-22 23:05:28,650 - optuna.study.study - INFO - Trial 34 finished with values: [0.002519331497990455, 0.0012295081967213116, 0.002695248972733546] and parameters: {'n_layers': 2, 'embedding_dim': 96, 'lr': 3.0049269137857e-05, 'lambda_val': 0.004454692083429469, 'batch_size': 2640, 'optimizer': 'SGD'}.
2026-05-22 23:05:32,538 - experiment_functions - INFO - Early stopping at epoch 700. Best Metrics: (0.035438390345315554, 0.02622950819672131, 0.03507845799064984)
2026-05-22 23:05:33,039 - optuna.study.study - INFO - Trial 35 finished with values: [0.035438390345315554, 0.02622950819672131, 0.03507845799064984] and parameters: {'n_layers': 3, 'embedding_dim': 64, 'lr': 0.0014373137364726936, 'lambda_val': 2.3648996790815136e-05, 'batch_size': 2288, 'optimizer': 'Adam'}.
2026-05-22 23:05:35,950 - experiment_functions - INFO - Early stopping at epoch 500. Best Metrics: (0.0020332248471365924, 0.001639344262295082, 0.002106466185917562)
2026-05-22 23:05:36,050 - optuna.study.study - INFO - Trial 36 finished with values: [0.0020332248471365924, 0.001639344262295082, 0.002106466185917562] and parameters: {'n_layers': 1, 'embedding_dim': 256, 'lr': 0.0003997085987777929, 'lambda_val': 0.019954727513163555, 'batch_size': 2361, 'optimizer': 'SGD'}.
2026-05-22 23:05:39,508 - experiment_functions - INFO - Early stopping at epoch 500. Best Metrics: (0.0018114057016571504, 0.0014754098360655738, 0.002062930959867452)
2026-05-22 23:05:39,620 - optuna.study.study - INFO - Trial 37 finished with values: [0.0018114057016571504, 0.0014754098360655738, 0.002062930959867452] and parameters: {'n_layers': 2, 'embedding_dim': 64, 'lr': 0.09467174598105292, 'lambda_val': 0.00014966029952989454, 'batch_size': 2839, 'optimizer': 'SGD'}.
2026-05-22 23:05:53,147 - optuna.study.study - INFO - Trial 38 finished with values: [0.07927729153717933, 0.04549180327868853, 0.07088147437410577] and parameters: {'n_layers': 1, 'embedding_dim': 128, 'lr': 0.00014191753167124515, 'lambda_val': 4.1855561222722974e-06, 'batch_size': 3643, 'optimizer': 'RMSprop'}.
2026-05-22 23:05:55,935 - experiment_functions - INFO - Early stopping at epoch 500. Best Metrics: (0.0010720270057894541, 0.0011475409836065574, 0.0011603874213276058)
2026-05-22 23:05:56,077 - optuna.study.study - INFO - Trial 39 finished with values: [0.0010720270057894541, 0.0011475409836065574, 0.0011603874213276058] and parameters: {'n_layers': 2, 'embedding_dim': 128, 'lr': 0.0045334920747323705, 'lambda_val': 0.015281369853354964, 'batch_size': 1021, 'optimizer': 'SGD'}.
2026-05-22 23:05:59,175 - experiment_functions - INFO - Early stopping at epoch 500. Best Metrics: (0.0033106150668322505, 0.0022950819672131148, 0.0037222629947101663)
2026-05-22 23:05:59,316 - optuna.study.study - INFO - Trial 40 finished with values: [0.0033106150668322505, 0.0022950819672131148, 0.0037222629947101663] and parameters: {'n_layers': 3, 'embedding_dim': 128, 'lr': 0.00013057059295783932, 'lambda_val': 0.001765616581850774, 'batch_size': 2795, 'optimizer': 'SGD'}.
2026-05-22 23:06:06,226 - experiment_functions - INFO - Early stopping at epoch 1700. Best Metrics: (0.03536475487061315, 0.017540983606557377, 0.027691833134480277)
2026-05-22 23:06:06,318 - optuna.study.study - INFO - Trial 41 finished with values: [0.03536475487061315, 0.017540983606557377, 0.027691833134480277] and parameters: {'n_layers': 2, 'embedding_dim': 128, 'lr': 0.03402233003375248, 'lambda_val': 0.005129821983037811, 'batch_size': 2149, 'optimizer': 'Adam'}.
2026-05-22 23:06:09,515 - experiment_functions - INFO - Early stopping at epoch 500. Best Metrics: (0.0032836709163721603, 0.0020491803278688526, 0.0032617535317563465)
2026-05-22 23:06:10,009 - optuna.study.study - INFO - Trial 42 finished with values: [0.0032836709163721603, 0.0020491803278688526, 0.0032617535317563465] and parameters: {'n_layers': 1, 'embedding_dim': 96, 'lr': 1.2538970443469547e-05, 'lambda_val': 0.002505839269429127, 'batch_size': 3520, 'optimizer': 'RMSprop'}.
2026-05-22 23:06:19,652 - experiment_functions - INFO - Early stopping at epoch 1550. Best Metrics: (0.02011320573775009, 0.007295081967213115, 0.014109889240687422)
2026-05-22 23:06:19,811 - optuna.study.study - INFO - Trial 43 finished with values: [0.02011320573775009, 0.007295081967213115, 0.014109889240687422] and parameters: {'n_layers': 4, 'embedding_dim': 128, 'lr': 0.0626248099317006, 'lambda_val': 4.7204869445784795e-05, 'batch_size': 1714, 'optimizer': 'Adam'}.
2026-05-22 23:06:23,650 - experiment_functions - INFO - Early stopping at epoch 650. Best Metrics: (0.0312460963685488, 0.01901639344262295, 0.029164313624802016)
2026-05-22 23:06:23,817 - optuna.study.study - INFO - Trial 44 finished with values: [0.0312460963685488, 0.01901639344262295, 0.029164313624802016] and parameters: {'n_layers': 4, 'embedding_dim': 64, 'lr': 0.0012691035628072148, 'lambda_val': 6.372306706033745e-06, 'batch_size': 1091, 'optimizer': 'RMSprop'}.
2026-05-22 23:06:27,710 - experiment_functions - INFO - Early stopping at epoch 500. Best Metrics: (0.0018818098492998743, 0.001639344262295082, 0.0017616447289662924)
