2026-05-22 23:12:34,469 - optuna.study.study - INFO - Trial 94 finished with values: [0.06640586757669441, 0.039672131147540986, 0.06275057196082144] and parameters: {'n_layers': 4, 'embedding_dim': 128, 'lr': 0.00014044488297116188, 'lambda_val': 0.0006542099358730213, 'batch_size': 874, 'optimizer': 'RMSprop'}.
2026-05-22 23:12:37,378 - experiment_functions - INFO - Early stopping at epoch 500. Best Metrics: (0.001711313338454316, 0.002295081967213115, 0.0026073898618268806)
2026-05-22 23:12:37,520 - optuna.study.study - INFO - Trial 95 finished with values: [0.001711313338454316, 0.002295081967213115, 0.0026073898618268806] and parameters: {'n_layers': 3, 'embedding_dim': 64, 'lr': 2.0790954971725015e-05, 'lambda_val': 2.3648996790815136e-05, 'batch_size': 867, 'optimizer': 'SGD'}.
2026-05-22 23:12:41,540 - experiment_functions - INFO - Early stopping at epoch 600. Best Metrics: (0.01083553108818021, 0.007295081967213115, 0.010949901847988323)
2026-05-22 23:12:41,682 - optuna.study.study - INFO - Trial 96 finished with values: [0.01083553108818021, 0.007295081967213115, 0.010949901847988323] and parameters: {'n_layers': 4, 'embedding_dim': 96, 'lr': 0.01243482202597104, 'lambda_val': 0.0006542099358730213, 'batch_size': 874, 'optimizer': 'Adam'}.
2026-05-22 23:12:58,938 - optuna.study.study - INFO - Trial 97 finished with values: [0.03920901234005954, 0.025573770491803278, 0.03795759802621649] and parameters: {'n_layers': 4, 'embedding_dim': 32, 'lr': 0.00014702351969030086, 'lambda_val': 0.00013566611589542861, 'batch_size': 874, 'optimizer': 'RMSprop'}.
2026-05-22 23:13:14,134 - experiment_functions - INFO - Early stopping at epoch 3950. Best Metrics: (0.02799480176913466, 0.016885245901639347, 0.02337886188002274)
2026-05-22 23:13:14,279 - optuna.study.study - INFO - Trial 98 finished with values: [0.02799480176913466, 0.016885245901639347, 0.02337886188002274] and parameters: {'n_layers': 3, 'embedding_dim': 32, 'lr': 0.05241207551926649, 'lambda_val': 0.004805532813491775, 'batch_size': 653, 'optimizer': 'Adam'}.
2026-05-22 23:13:18,504 - experiment_functions - INFO - Early stopping at epoch 1000. Best Metrics: (0.05235994549711289, 0.03360655737704918, 0.051563122195999934)
2026-05-22 23:13:18,651 - optuna.study.study - INFO - Trial 99 finished with values: [0.05235994549711289, 0.03360655737704918, 0.051563122195999934] and parameters: {'n_layers': 2, 'embedding_dim': 32, 'lr': 0.0006058550434647582, 'lambda_val': 0.004805532813491775, 'batch_size': 3586, 'optimizer': 'Adam'}.
2026-05-22 23:13:28,795 - experiment_functions - INFO - Early stopping at epoch 2150. Best Metrics: (0.02949924020535644, 0.019672131147540985, 0.02774138123190572)
2026-05-22 23:13:28,940 - optuna.study.study - INFO - Trial 100 finished with values: [0.02949924020535644, 0.019672131147540985, 0.02774138123190572] and parameters: {'n_layers': 2, 'embedding_dim': 128, 'lr': 0.03402233003375248, 'lambda_val': 0.005129821983037811, 'batch_size': 2149, 'optimizer': 'Adam'}.
2026-05-22 23:13:32,231 - experiment_functions - INFO - Early stopping at epoch 650. Best Metrics: (0.0972281036482865, 0.05385245901639345, 0.09004166392059734)
2026-05-22 23:13:32,731 - optuna.study.study - INFO - Trial 101 finished with values: [0.0972281036482865, 0.05385245901639345, 0.09004166392059734] and parameters: {'n_layers': 1, 'embedding_dim': 128, 'lr': 0.0014373137364726936, 'lambda_val': 0.004805532813491775, 'batch_size': 3643, 'optimizer': 'Adam'}.
2026-05-22 23:13:36,770 - experiment_functions - INFO - Early stopping at epoch 600. Best Metrics: (0.02637915514425048, 0.009262295081967215, 0.01854170697998117)
2026-05-22 23:13:37,030 - optuna.study.study - INFO - Trial 102 finished with values: [0.02637915514425048, 0.009262295081967215, 0.01854170697998117] and parameters: {'n_layers': 2, 'embedding_dim': 256, 'lr': 0.036303500410505576, 'lambda_val': 3.7779470846945565e-05, 'batch_size': 1636, 'optimizer': 'Adam'}.
2026-05-22 23:13:41,628 - experiment_functions - INFO - Early stopping at epoch 850. Best Metrics: (0.13148611832807428, 0.06303278688524591, 0.11142705240833808)
2026-05-22 23:13:43,207 - optuna.study.study - INFO - Trial 103 finished with values: [0.13148611832807428, 0.06303278688524591, 0.11142705240833808] and parameters: {'n_layers': 1, 'embedding_dim': 256, 'lr': 0.0005586191809811369, 'lambda_val': 2.3648996790815136e-05, 'batch_size': 3835, 'optimizer': 'RMSprop'}.
2026-05-22 23:13:51,456 - experiment_functions - INFO - Early stopping at epoch 2150. Best Metrics: (0.0686704855748278, 0.03934426229508197, 0.05975029755342859)
2026-05-22 23:13:51,598 - optuna.study.study - INFO - Trial 104 finished with values: [0.0686704855748278, 0.03934426229508197, 0.05975029755342859] and parameters: {'n_layers': 1, 'embedding_dim': 128, 'lr': 0.01158026631563179, 'lambda_val': 0.005129821983037811, 'batch_size': 2149, 'optimizer': 'Adam'}.
2026-05-22 23:13:54,866 - experiment_functions - INFO - Early stopping at epoch 600. Best Metrics: (0.07711400851200131, 0.045983606557377044, 0.06792444560590795)
2026-05-22 23:13:55,042 - optuna.study.study - INFO - Trial 105 finished with values: [0.07711400851200131, 0.045983606557377044, 0.06792444560590795] and parameters: {'n_layers': 1, 'embedding_dim': 32, 'lr': 0.0014373137364726936, 'lambda_val': 0.004805532813491775, 'batch_size': 3643, 'optimizer': 'RMSprop'}.
2026-05-22 23:14:09,353 - optuna.study.study - INFO - Trial 106 finished with values: [0.030007299526220724, 0.019672131147540985, 0.030661069238567505] and parameters: {'n_layers': 1, 'embedding_dim': 128, 'lr': 0.00014191753167124515, 'lambda_val': 0.0001473158611730725, 'batch_size': 653, 'optimizer': 'Adam'}.
2026-05-22 23:14:19,517 - experiment_functions - INFO - Early stopping at epoch 2100. Best Metrics: (0.04783001307881952, 0.030081967213114756, 0.04433646726657394)
2026-05-22 23:14:19,667 - optuna.study.study - INFO - Trial 107 finished with values: [0.04783001307881952, 0.030081967213114756, 0.04433646726657394] and parameters: {'n_layers': 4, 'embedding_dim': 64, 'lr': 0.0002391583318230419, 'lambda_val': 0.0014275524741385077, 'batch_size': 2759, 'optimizer': 'RMSprop'}.
2026-05-22 23:14:36,425 - optuna.study.study - INFO - Trial 108 finished with values: [0.07224602599540705, 0.043934426229508196, 0.06894363216056985] and parameters: {'n_layers': 2, 'embedding_dim': 128, 'lr': 0.00014191753167124515, 'lambda_val': 4.1855561222722974e-06, 'batch_size': 1459, 'optimizer': 'RMSprop'}.
2026-05-22 23:14:39,741 - experiment_functions - INFO - Early stopping at epoch 600. Best Metrics: (0.029429845504054114, 0.016721311475409836, 0.027578158789355923)
2026-05-22 23:14:40,410 - optuna.study.study - INFO - Trial 109 finished with values: [0.029429845504054114, 0.016721311475409836, 0.027578158789355923] and parameters: {'n_layers': 2, 'embedding_dim': 128, 'lr': 0.01158026631563179, 'lambda_val': 3.503594966954898e-05, 'batch_size': 704, 'optimizer': 'Adam'}.
2026-05-22 23:14:43,750 - experiment_functions - INFO - Early stopping at epoch 600. Best Metrics: (0.04310702663810417, 0.028606557377049185, 0.04111695738815557)
2026-05-22 23:14:44,104 - optuna.study.study - INFO - Trial 110 finished with values: [0.04310702663810417, 0.028606557377049185, 0.04111695738815557] and parameters: {'n_layers': 2, 'embedding_dim': 64, 'lr': 0.002406863740771825, 'lambda_val': 1.7214490937304805e-05, 'batch_size': 2952, 'optimizer': 'RMSprop'}.
2026-05-22 23:15:00,057 - experiment_functions - INFO - Early stopping at epoch 3850. Best Metrics: (0.0689031646432427, 0.04360655737704918, 0.061308761829762144)
2026-05-22 23:15:00,947 - optuna.study.study - INFO - Trial 111 finished with values: [0.0689031646432427, 0.04360655737704918, 0.061308761829762144] and parameters: {'n_layers': 3, 'embedding_dim': 64, 'lr': 0.0002391583318230419, 'lambda_val': 7.613685556639934e-06, 'batch_size': 1116, 'optimizer': 'RMSprop'}.
2026-05-22 23:15:12,789 - experiment_functions - INFO - Early stopping at epoch 2650. Best Metrics: (0.05956699952742687, 0.0369672131147541, 0.053882662158482746)
2026-05-22 23:15:12,972 - optuna.study.study - INFO - Trial 112 finished with values: [0.05956699952742687, 0.0369672131147541, 0.053882662158482746] and parameters: {'n_layers': 3, 'embedding_dim': 64, 'lr': 0.0002391583318230419, 'lambda_val': 0.0011596678103466965, 'batch_size': 3045, 'optimizer': 'RMSprop'}.
2026-05-22 23:15:29,778 - optuna.study.study - INFO - Trial 113 finished with values: [0.005977267621159826, 0.004016393442622951, 0.005431885341033257] and parameters: {'n_layers': 1, 'embedding_dim': 256, 'lr': 4.120984647406723e-05, 'lambda_val': 4.1855561222722974e-06, 'batch_size': 2434, 'optimizer': 'RMSprop'}.
2026-05-22 23:15:44,677 - experiment_functions - INFO - Early stopping at epoch 2000. Best Metrics: (0.04464618827548241, 0.03204918032786885, 0.04474419335117817)
2026-05-22 23:15:44,773 - optuna.study.study - INFO - Trial 114 finished with values: [0.04464618827548241, 0.03204918032786885, 0.04474419335117817] and parameters: {'n_layers': 4, 'embedding_dim': 256, 'lr': 0.00014044488297116188, 'lambda_val': 0.005129821983037811, 'batch_size': 891, 'optimizer': 'Adam'}.
2026-05-22 23:15:49,123 - experiment_functions - INFO - Early stopping at epoch 700. Best Metrics: (0.03253404355608611, 0.016967213114754097, 0.027237917470085218)
2026-05-22 23:15:49,279 - optuna.study.study - INFO - Trial 115 finished with values: [0.03253404355608611, 0.016967213114754097, 0.027237917470085218] and parameters: {'n_layers': 2, 'embedding_dim': 256, 'lr': 0.002406863740771825, 'lambda_val': 2.3648996790815136e-05, 'batch_size': 891, 'optimizer': 'RMSprop'}.
2026-05-22 23:15:53,041 - experiment_functions - INFO - Early stopping at epoch 550. Best Metrics: (0.015975484187201086, 0.013524590163934426, 0.018249557243590966)
2026-05-22 23:15:53,142 - optuna.study.study - INFO - Trial 116 finished with values: [0.015975484187201086, 0.013524590163934426, 0.018249557243590966] and parameters: {'n_layers': 4, 'embedding_dim': 96, 'lr': 0.0008184011149012127, 'lambda_val': 0.004163877683375522, 'batch_size': 3643, 'optimizer': 'RMSprop'}.
2026-05-22 23:16:01,284 - experiment_functions - INFO - Early stopping at epoch 1500. Best Metrics: (0.05094228815622143, 0.029672131147540987, 0.04529432929744989)
2026-05-22 23:16:01,383 - optuna.study.study - INFO - Trial 117 finished with values: [0.05094228815622143, 0.029672131147540987, 0.04529432929744989] and parameters: {'n_layers': 3, 'embedding_dim': 128, 'lr': 0.0003253883741862748, 'lambda_val': 0.0014101679442333785, 'batch_size': 3639, 'optimizer': 'Adam'}.
2026-05-22 23:16:05,029 - experiment_functions - INFO - Early stopping at epoch 700. Best Metrics: (0.06366445585299119, 0.03959016393442623, 0.05641317319664193)
2026-05-22 23:16:06,325 - optuna.study.study - INFO - Trial 118 finished with values: [0.06366445585299119, 0.03959016393442623, 0.05641317319664193] and parameters: {'n_layers': 2, 'embedding_dim': 96, 'lr': 0.0008839940075688664, 'lambda_val': 0.00013566611589542861, 'batch_size': 704, 'optimizer': 'RMSprop'}.
2026-05-22 23:16:09,801 - experiment_functions - INFO - Early stopping at epoch 500. Best Metrics: (0.004332208003998255, 0.0020491803278688526, 0.0028623484656539926)
2026-05-22 23:16:10,350 - optuna.study.study - INFO - Trial 119 finished with values: [0.004332208003998255, 0.0020491803278688526, 0.0028623484656539926] and parameters: {'n_layers': 2, 'embedding_dim': 256, 'lr': 0.00014191753167124515, 'lambda_val': 4.1855561222722974e-06, 'batch_size': 891, 'optimizer': 'SGD'}.
2026-05-22 23:16:12,990 - experiment_functions - INFO - Early stopping at epoch 500. Best Metrics: (0.0017341370685591336, 0.0013934426229508198, 0.0018864718726513874)
2026-05-22 23:16:13,130 - optuna.study.study - INFO - Trial 120 finished with values: [0.0017341370685591336, 0.0013934426229508198, 0.0018864718726513874] and parameters: {'n_layers': 1, 'embedding_dim': 96, 'lr': 0.0052410285088808715, 'lambda_val': 4.1855561222722974e-06, 'batch_size': 3355, 'optimizer': 'SGD'}.
2026-05-22 23:16:20,515 - experiment_functions - INFO - Early stopping at epoch 1600. Best Metrics: (0.023679443906656585, 0.016065573770491805, 0.02261048302179875)
2026-05-22 23:16:20,671 - optuna.study.study - INFO - Trial 121 finished with values: [0.023679443906656585, 0.016065573770491805, 0.02261048302179875] and parameters: {'n_layers': 3, 'embedding_dim': 64, 'lr': 0.03402233003375248, 'lambda_val': 0.005129821983037811, 'batch_size': 2926, 'optimizer': 'Adam'}.
2026-05-22 23:16:37,983 - optuna.study.study - INFO - Trial 122 finished with values: [0.07560984216420177, 0.04540983606557378, 0.07107956674441362] and parameters: {'n_layers': 2, 'embedding_dim': 128, 'lr': 0.00014191753167124515, 'lambda_val': 4.1855561222722974e-06, 'batch_size': 653, 'optimizer': 'RMSprop'}.
2026-05-22 23:16:54,898 - optuna.study.study - INFO - Trial 123 finished with values: [0.0795654970583513, 0.04639344262295082, 0.07871075273226756] and parameters: {'n_layers': 2, 'embedding_dim': 128, 'lr': 0.00018259329948876513, 'lambda_val': 0.004805532813491775, 'batch_size': 653, 'optimizer': 'Adam'}.
2026-05-22 23:17:10,749 - optuna.study.study - INFO - Trial 124 finished with values: [0.07532058063688395, 0.043360655737704916, 0.06934674242730657] and parameters: {'n_layers': 1, 'embedding_dim': 256, 'lr': 0.00014191753167124515, 'lambda_val': 2.3648996790815136e-05, 'batch_size': 1071, 'optimizer': 'RMSprop'}.
2026-05-22 23:17:16,566 - experiment_functions - INFO - Early stopping at epoch 1200. Best Metrics: (0.026045917446637895, 0.013114754098360656, 0.01953481541393586)
2026-05-22 23:17:17,350 - optuna.study.study - INFO - Trial 125 finished with values: [0.026045917446637895, 0.013114754098360656, 0.01953481541393586] and parameters: {'n_layers': 3, 'embedding_dim': 32, 'lr': 0.06514473676765253, 'lambda_val': 0.0014101679442333785, 'batch_size': 2541, 'optimizer': 'Adam'}.
2026-05-22 23:17:34,492 - optuna.study.study - INFO - Trial 126 finished with values: [0.10944394367404109, 0.05844262295081967, 0.09618017896615322] and parameters: {'n_layers': 1, 'embedding_dim': 256, 'lr': 0.00014191753167124515, 'lambda_val': 0.0016010999314799575, 'batch_size': 3643, 'optimizer': 'RMSprop'}.
2026-05-22 23:17:37,815 - experiment_functions - INFO - Early stopping at epoch 500. Best Metrics: (0.0010720270057894541, 0.0011475409836065574, 0.0011603874213276058)
2026-05-22 23:17:37,990 - optuna.study.study - INFO - Trial 127 finished with values: [0.0010720270057894541, 0.0011475409836065574, 0.0011603874213276058] and parameters: {'n_layers': 3, 'embedding_dim': 128, 'lr': 0.05276816817799237, 'lambda_val': 0.0014101679442333785, 'batch_size': 3639, 'optimizer': 'SGD'}.
2026-05-22 23:17:47,915 - experiment_functions - INFO - Early stopping at epoch 1700. Best Metrics: (0.01864701454369823, 0.011475409836065573, 0.016812083127193997)
2026-05-22 23:17:48,065 - optuna.study.study - INFO - Trial 128 finished with values: [0.01864701454369823, 0.011475409836065573, 0.016812083127193997] and parameters: {'n_layers': 4, 'embedding_dim': 128, 'lr': 0.06514473676765253, 'lambda_val': 0.0014275524741385077, 'batch_size': 2640, 'optimizer': 'Adam'}.
2026-05-22 23:17:52,734 - experiment_functions - INFO - Early stopping at epoch 750. Best Metrics: (0.06126521676707839, 0.03901639344262295, 0.05909451500046903)
2026-05-22 23:17:52,879 - optuna.study.study - INFO - Trial 129 finished with values: [0.06126521676707839, 0.03901639344262295, 0.05909451500046903] and parameters: {'n_layers': 2, 'embedding_dim': 256, 'lr': 0.0005586191809811369, 'lambda_val': 0.004163877683375522, 'batch_size': 1990, 'optimizer': 'Adam'}.
2026-05-22 23:18:07,436 - experiment_functions - INFO - Early stopping at epoch 3500. Best Metrics: (0.07228348724425263, 0.04278688524590164, 0.06485403150226927)
2026-05-22 23:18:08,555 - optuna.study.study - INFO - Trial 130 finished with values: [0.07228348724425263, 0.04278688524590164, 0.06485403150226927] and parameters: {'n_layers': 3, 'embedding_dim': 64, 'lr': 0.0002391583318230419, 'lambda_val': 0.0011596678103466965, 'batch_size': 1116, 'optimizer': 'RMSprop'}.
2026-05-22 23:18:11,708 - experiment_functions - INFO - Early stopping at epoch 600. Best Metrics: (0.02299298886083788, 0.012950819672131148, 0.020950001248936825)
2026-05-22 23:18:11,867 - optuna.study.study - INFO - Trial 131 finished with values: [0.02299298886083788, 0.012950819672131148, 0.020950001248936825] and parameters: {'n_layers': 2, 'embedding_dim': 32, 'lr': 0.01243482202597104, 'lambda_val': 1.1217659892376085e-05, 'batch_size': 2652, 'optimizer': 'RMSprop'}.
2026-05-22 23:18:15,147 - experiment_functions - INFO - Early stopping at epoch 600. Best Metrics: (0.02124905057167893, 0.018852459016393444, 0.022652358969100513)
2026-05-22 23:18:15,287 - optuna.study.study - INFO - Trial 132 finished with values: [0.02124905057167893, 0.018852459016393444, 0.022652358969100513] and parameters: {'n_layers': 3, 'embedding_dim': 32, 'lr': 0.0014373137364726936, 'lambda_val': 0.044766261489018064, 'batch_size': 2288, 'optimizer': 'Adam'}.
2026-05-22 23:18:34,903 - optuna.study.study - INFO - Trial 133 finished with values: [0.0868296154396604, 0.05147540983606558, 0.07938618214980152] and parameters: {'n_layers': 2, 'embedding_dim': 256, 'lr': 0.00014044488297116188, 'lambda_val': 2.3648996790815136e-05, 'batch_size': 874, 'optimizer': 'RMSprop'}.
2026-05-22 23:18:39,910 - experiment_functions - INFO - Early stopping at epoch 600. Best Metrics: (0.057259770739937, 0.036967213114754094, 0.05312335445838467)
2026-05-22 23:18:40,698 - optuna.study.study - INFO - Trial 134 finished with values: [0.057259770739937, 0.036967213114754094, 0.05312335445838467] and parameters: {'n_layers': 2, 'embedding_dim': 96, 'lr': 0.002406863740771825, 'lambda_val': 0.004163877683375522, 'batch_size': 2952, 'optimizer': 'Adam'}.
2026-05-22 23:18:49,677 - experiment_functions - INFO - Early stopping at epoch 750. Best Metrics: (0.026160677250783856, 0.01819672131147541, 0.025528231066104676)
2026-05-22 23:18:50,212 - optuna.study.study - INFO - Trial 135 finished with values: [0.026160677250783856, 0.01819672131147541, 0.025528231066104676] and parameters: {'n_layers': 4, 'embedding_dim': 32, 'lr': 0.0015716374883028592, 'lambda_val': 7.613685556639934e-06, 'batch_size': 1995, 'optimizer': 'Adam'}.
2026-05-22 23:18:55,357 - experiment_functions - INFO - Early stopping at epoch 700. Best Metrics: (0.049883308701544525, 0.03409836065573771, 0.045682872591488954)
2026-05-22 23:18:55,522 - optuna.study.study - INFO - Trial 136 finished with values: [0.049883308701544525, 0.03409836065573771, 0.045682872591488954] and parameters: {'n_layers': 2, 'embedding_dim': 96, 'lr': 0.0009386876662853627, 'lambda_val': 0.025122383954869695, 'batch_size': 809, 'optimizer': 'Adam'}.
2026-05-22 23:18:58,528 - experiment_functions - INFO - Early stopping at epoch 500. Best Metrics: (0.0010639794674521786, 0.0018032786885245904, 0.001822964779650716)
2026-05-22 23:18:58,684 - optuna.study.study - INFO - Trial 137 finished with values: [0.0010639794674521786, 0.0018032786885245904, 0.001822964779650716] and parameters: {'n_layers': 2, 'embedding_dim': 128, 'lr': 0.00018259329948876513, 'lambda_val': 0.005129821983037811, 'batch_size': 2149, 'optimizer': 'SGD'}.
2026-05-22 23:19:13,531 - optuna.study.study - INFO - Trial 138 finished with values: [0.08515995639442614, 0.05122950819672132, 0.07707900490435524] and parameters: {'n_layers': 1, 'embedding_dim': 96, 'lr': 0.00018259329948876513, 'lambda_val': 4.1855561222722974e-06, 'batch_size': 2536, 'optimizer': 'Adam'}.
2026-05-22 23:19:28,702 - optuna.study.study - INFO - Trial 139 finished with values: [0.06890131173561277, 0.03778688524590163, 0.062004937363271354] and parameters: {'n_layers': 2, 'embedding_dim': 96, 'lr': 0.00014191753167124515, 'lambda_val': 4.1855561222722974e-06, 'batch_size': 1459, 'optimizer': 'Adam'}.
2026-05-22 23:19:42,256 - optuna.study.study - INFO - Trial 140 finished with values: [0.08932872273876606, 0.05475409836065575, 0.08784388586251977] and parameters: {'n_layers': 1, 'embedding_dim': 128, 'lr': 0.0002391583318230419, 'lambda_val': 0.004805532813491775, 'batch_size': 653, 'optimizer': 'Adam'}.
2026-05-22 23:19:46,388 - experiment_functions - INFO - Early stopping at epoch 1050. Best Metrics: (0.014919147978749953, 0.011147540983606558, 0.014849049756935063)
2026-05-22 23:19:47,722 - optuna.study.study - INFO - Trial 141 finished with values: [0.014919147978749953, 0.011147540983606558, 0.014849049756935063] and parameters: {'n_layers': 1, 'embedding_dim': 128, 'lr': 0.05241207551926649, 'lambda_val': 7.913101106142164e-06, 'batch_size': 653, 'optimizer': 'RMSprop'}.
2026-05-22 23:19:50,828 - experiment_functions - INFO - Early stopping at epoch 650. Best Metrics: (0.04538546027640177, 0.03270491803278689, 0.04307487066134936)
2026-05-22 23:19:51,029 - optuna.study.study - INFO - Trial 142 finished with values: [0.04538546027640177, 0.03270491803278689, 0.04307487066134936] and parameters: {'n_layers': 2, 'embedding_dim': 32, 'lr': 0.0015716374883028592, 'lambda_val': 0.005129821983037811, 'batch_size': 2149, 'optimizer': 'Adam'}.
2026-05-22 23:20:10,458 - optuna.study.study - INFO - Trial 143 finished with values: [0.04729166446938086, 0.026557377049180327, 0.04257277010086663] and parameters: {'n_layers': 4, 'embedding_dim': 64, 'lr': 0.00014191753167124515, 'lambda_val': 0.0014275524741385077, 'batch_size': 3242, 'optimizer': 'Adam'}.
2026-05-22 23:20:14,322 - experiment_functions - INFO - Early stopping at epoch 650. Best Metrics: (0.03726441896878801, 0.023688524590163938, 0.03273209068253271)
