2026-05-23 04:35:36,287 - optuna.study.study - INFO - Trial 193 finished with values: [0.06768921517069927, 0.039098360655737706, 0.06147905649237352] and parameters: {'n_layers': 2, 'embedding_dim': 64, 'lr': 0.0002433821756193056, 'lambda_val': 0.00044044195678744806, 'batch_size': 944, 'optimizer': 'RMSprop'}.
2026-05-23 04:35:41,558 - experiment_functions - INFO - Early stopping at epoch 800. Best Metrics: (0.04712197196308167, 0.029508196721311476, 0.046129832709754)
2026-05-23 04:35:42,403 - optuna.study.study - INFO - Trial 194 finished with values: [0.04712197196308167, 0.029508196721311476, 0.046129832709754] and parameters: {'n_layers': 3, 'embedding_dim': 256, 'lr': 0.0005216893769116646, 'lambda_val': 0.001092384612961102, 'batch_size': 601, 'optimizer': 'RMSprop'}.
2026-05-23 04:35:47,882 - experiment_functions - INFO - Early stopping at epoch 750. Best Metrics: (0.03715309053825182, 0.022540983606557378, 0.03233235334645649)
2026-05-23 04:35:47,963 - optuna.study.study - INFO - Trial 195 finished with values: [0.03715309053825182, 0.022540983606557378, 0.03233235334645649] and parameters: {'n_layers': 4, 'embedding_dim': 256, 'lr': 0.00039831203487280473, 'lambda_val': 0.00016096936828266907, 'batch_size': 2002, 'optimizer': 'RMSprop'}.
2026-05-23 04:35:50,802 - experiment_functions - INFO - Early stopping at epoch 600. Best Metrics: (0.02651652057023353, 0.015983606557377048, 0.022229668856801433)
2026-05-23 04:35:51,040 - optuna.study.study - INFO - Trial 196 finished with values: [0.02651652057023353, 0.015983606557377048, 0.022229668856801433] and parameters: {'n_layers': 2, 'embedding_dim': 64, 'lr': 0.00466856942146688, 'lambda_val': 0.0060103019678805995, 'batch_size': 3135, 'optimizer': 'RMSprop'}.
2026-05-23 04:35:54,973 - experiment_functions - INFO - Early stopping at epoch 600. Best Metrics: (0.05299818247569584, 0.029918032786885245, 0.04883744180933902)
2026-05-23 04:35:55,077 - optuna.study.study - INFO - Trial 197 finished with values: [0.05299818247569584, 0.029918032786885245, 0.04883744180933902] and parameters: {'n_layers': 2, 'embedding_dim': 64, 'lr': 0.0010602693611052227, 'lambda_val': 1.374096848370064e-06, 'batch_size': 3562, 'optimizer': 'RMSprop'}.
2026-05-23 04:35:58,645 - experiment_functions - INFO - Early stopping at epoch 550. Best Metrics: (0.02866071971569524, 0.010901639344262295, 0.019164268749956206)
2026-05-23 04:35:58,738 - optuna.study.study - INFO - Trial 198 finished with values: [0.02866071971569524, 0.010901639344262295, 0.019164268749956206] and parameters: {'n_layers': 2, 'embedding_dim': 256, 'lr': 0.0406369613134867, 'lambda_val': 4.043398626155609e-05, 'batch_size': 2902, 'optimizer': 'Adam'}.
2026-05-23 04:36:02,194 - experiment_functions - INFO - Early stopping at epoch 600. Best Metrics: (0.022886373514368022, 0.009426229508196722, 0.01681263716028321)
2026-05-23 04:36:02,306 - optuna.study.study - INFO - Trial 199 finished with values: [0.022886373514368022, 0.009426229508196722, 0.01681263716028321] and parameters: {'n_layers': 2, 'embedding_dim': 256, 'lr': 0.0406369613134867, 'lambda_val': 1.8513831213284574e-05, 'batch_size': 2240, 'optimizer': 'Adam'}.
2026-05-23 04:36:08,963 - experiment_functions - INFO - Early stopping at epoch 1250. Best Metrics: (0.07384077833150453, 0.036967213114754094, 0.05982115589380483)
2026-05-23 04:36:10,125 - optuna.study.study - INFO - Trial 200 finished with values: [0.07384077833150453, 0.036967213114754094, 0.05982115589380483] and parameters: {'n_layers': 2, 'embedding_dim': 256, 'lr': 0.0003054746060910338, 'lambda_val': 0.0002794201622830738, 'batch_size': 4093, 'optimizer': 'Adam'}.
2026-05-23 04:36:17,891 - experiment_functions - INFO - Early stopping at epoch 1550. Best Metrics: (0.07634418111249286, 0.04081967213114754, 0.06352641345029904)
2026-05-23 04:36:18,542 - optuna.study.study - INFO - Trial 201 finished with values: [0.07634418111249286, 0.04081967213114754, 0.06352641345029904] and parameters: {'n_layers': 2, 'embedding_dim': 128, 'lr': 0.0005076161055190746, 'lambda_val': 7.250972757062111e-06, 'batch_size': 1477, 'optimizer': 'Adam'}.
2026-05-23 04:36:25,320 - experiment_functions - INFO - Early stopping at epoch 550. Best Metrics: (0.030866829016467017, 0.01614754098360656, 0.027139610854887718)
2026-05-23 04:36:25,829 - optuna.study.study - INFO - Trial 202 finished with values: [0.030866829016467017, 0.01614754098360656, 0.027139610854887718] and parameters: {'n_layers': 3, 'embedding_dim': 256, 'lr': 0.0027017778110061804, 'lambda_val': 0.00010447269915261112, 'batch_size': 1427, 'optimizer': 'RMSprop'}.
2026-05-23 04:36:38,065 - experiment_functions - INFO - Early stopping at epoch 3750. Best Metrics: (0.0019392817482317322, 0.0017213114754098366, 0.001900057328476006)
2026-05-23 04:36:38,147 - optuna.study.study - INFO - Trial 203 finished with values: [0.0019392817482317322, 0.0017213114754098366, 0.001900057328476006] and parameters: {'n_layers': 2, 'embedding_dim': 64, 'lr': 1.78608910976881e-05, 'lambda_val': 0.002225291349266682, 'batch_size': 849, 'optimizer': 'RMSprop'}.
2026-05-23 04:36:41,913 - experiment_functions - INFO - Early stopping at epoch 800. Best Metrics: (0.07010524943860824, 0.038688524590163934, 0.06223406431351287)
2026-05-23 04:36:41,997 - optuna.study.study - INFO - Trial 204 finished with values: [0.07010524943860824, 0.038688524590163934, 0.06223406431351287] and parameters: {'n_layers': 2, 'embedding_dim': 96, 'lr': 0.0005216893769116646, 'lambda_val': 0.001092384612961102, 'batch_size': 2479, 'optimizer': 'RMSprop'}.
2026-05-23 04:36:46,382 - experiment_functions - INFO - Early stopping at epoch 750. Best Metrics: (0.03089609049230052, 0.020655737704918034, 0.030412875305136006)
2026-05-23 04:36:47,047 - optuna.study.study - INFO - Trial 205 finished with values: [0.03089609049230052, 0.020655737704918034, 0.030412875305136006] and parameters: {'n_layers': 4, 'embedding_dim': 128, 'lr': 0.0005076161055190746, 'lambda_val': 5.056399789315724e-06, 'batch_size': 1919, 'optimizer': 'Adam'}.
2026-05-23 04:36:52,437 - experiment_functions - INFO - Early stopping at epoch 1500. Best Metrics: (0.09565145124938859, 0.04795081967213115, 0.08032076822339192)
2026-05-23 04:36:53,267 - optuna.study.study - INFO - Trial 206 finished with values: [0.09565145124938859, 0.04795081967213115, 0.08032076822339192] and parameters: {'n_layers': 1, 'embedding_dim': 64, 'lr': 0.0006640426930867159, 'lambda_val': 0.00062453091272787, 'batch_size': 3135, 'optimizer': 'Adam'}.
2026-05-23 04:37:03,823 - optuna.study.study - INFO - Trial 207 finished with values: [0.04347492754215963, 0.02459016393442623, 0.03935383090525099] and parameters: {'n_layers': 1, 'embedding_dim': 64, 'lr': 0.00013938780887061617, 'lambda_val': 0.009427137842512492, 'batch_size': 1515, 'optimizer': 'Adam'}.
2026-05-23 04:37:08,183 - experiment_functions - INFO - Early stopping at epoch 1100. Best Metrics: (0.09241008475765587, 0.04934426229508197, 0.07894343995976269)
2026-05-23 04:37:08,347 - optuna.study.study - INFO - Trial 208 finished with values: [0.09241008475765587, 0.04934426229508197, 0.07894343995976269] and parameters: {'n_layers': 1, 'embedding_dim': 64, 'lr': 0.0006640426930867159, 'lambda_val': 0.006639299505918974, 'batch_size': 1505, 'optimizer': 'RMSprop'}.
2026-05-23 04:37:19,858 - optuna.study.study - INFO - Trial 209 finished with values: [0.08670688471324738, 0.04639344262295082, 0.07028971775984666] and parameters: {'n_layers': 1, 'embedding_dim': 64, 'lr': 0.0002758788994373932, 'lambda_val': 1.5294397943948484e-05, 'batch_size': 3135, 'optimizer': 'RMSprop'}.
2026-05-23 04:37:32,939 - experiment_functions - INFO - Early stopping at epoch 3300. Best Metrics: (0.05998555378504876, 0.03368852459016394, 0.04885777412056434)
2026-05-23 04:37:33,868 - optuna.study.study - INFO - Trial 210 finished with values: [0.05998555378504876, 0.03368852459016394, 0.04885777412056434] and parameters: {'n_layers': 2, 'embedding_dim': 32, 'lr': 0.0003054746060910338, 'lambda_val': 0.0009962507800702286, 'batch_size': 2987, 'optimizer': 'RMSprop'}.
2026-05-23 04:37:43,153 - experiment_functions - INFO - Early stopping at epoch 3250. Best Metrics: (0.09671943350129811, 0.05040983606557377, 0.08529124976745081)
2026-05-23 04:37:44,467 - optuna.study.study - INFO - Trial 211 finished with values: [0.09671943350129811, 0.05040983606557377, 0.08529124976745081] and parameters: {'n_layers': 1, 'embedding_dim': 32, 'lr': 0.0005076161055190746, 'lambda_val': 0.00044044195678744806, 'batch_size': 1477, 'optimizer': 'Adam'}.
2026-05-23 04:37:55,267 - optuna.study.study - INFO - Trial 212 finished with values: [0.07974017186760965, 0.04434426229508197, 0.07044309114489403] and parameters: {'n_layers': 1, 'embedding_dim': 64, 'lr': 0.0003054746060910338, 'lambda_val': 1.374096848370064e-06, 'batch_size': 601, 'optimizer': 'RMSprop'}.
2026-05-23 04:37:58,169 - experiment_functions - INFO - Early stopping at epoch 550. Best Metrics: (0.06823504466272606, 0.029508196721311476, 0.050487423421933166)
2026-05-23 04:37:58,266 - optuna.study.study - INFO - Trial 213 finished with values: [0.06823504466272606, 0.029508196721311476, 0.050487423421933166] and parameters: {'n_layers': 1, 'embedding_dim': 96, 'lr': 0.01729355128210771, 'lambda_val': 1.4811025229652691e-05, 'batch_size': 3576, 'optimizer': 'Adam'}.
2026-05-23 04:38:03,215 - experiment_functions - INFO - Early stopping at epoch 1100. Best Metrics: (0.07488635775068694, 0.038688524590163934, 0.06362813668232908)
2026-05-23 04:38:04,327 - optuna.study.study - INFO - Trial 214 finished with values: [0.07488635775068694, 0.038688524590163934, 0.06362813668232908] and parameters: {'n_layers': 2, 'embedding_dim': 128, 'lr': 0.0005076161055190746, 'lambda_val': 0.002225291349266682, 'batch_size': 849, 'optimizer': 'Adam'}.
2026-05-23 04:38:10,000 - experiment_functions - INFO - Early stopping at epoch 1500. Best Metrics: (0.06788050936475297, 0.038032786885245896, 0.06061376113205096)
2026-05-23 04:38:10,549 - optuna.study.study - INFO - Trial 215 finished with values: [0.06788050936475297, 0.038032786885245896, 0.06061376113205096] and parameters: {'n_layers': 2, 'embedding_dim': 64, 'lr': 0.0005076161055190746, 'lambda_val': 1.374096848370064e-06, 'batch_size': 1477, 'optimizer': 'Adam'}.
2026-05-23 04:38:15,523 - experiment_functions - INFO - Early stopping at epoch 1250. Best Metrics: (0.06750933461953539, 0.039098360655737706, 0.05776444691457694)
2026-05-23 04:38:15,808 - optuna.study.study - INFO - Trial 216 finished with values: [0.06750933461953539, 0.039098360655737706, 0.05776444691457694] and parameters: {'n_layers': 2, 'embedding_dim': 64, 'lr': 0.0004803146544874298, 'lambda_val': 0.00037894592886494253, 'batch_size': 2183, 'optimizer': 'RMSprop'}.
2026-05-23 04:38:27,255 - experiment_functions - INFO - Early stopping at epoch 3700. Best Metrics: (0.09168747188083383, 0.04901639344262295, 0.07645563548176915)
2026-05-23 04:38:27,345 - optuna.study.study - INFO - Trial 217 finished with values: [0.09168747188083383, 0.04901639344262295, 0.07645563548176915] and parameters: {'n_layers': 1, 'embedding_dim': 64, 'lr': 0.0002758788994373932, 'lambda_val': 0.001092384612961102, 'batch_size': 1505, 'optimizer': 'RMSprop'}.
2026-05-23 04:38:31,691 - experiment_functions - INFO - Early stopping at epoch 600. Best Metrics: (0.045298375348697247, 0.028442622950819674, 0.040460556279185406)
2026-05-23 04:38:33,280 - optuna.study.study - INFO - Trial 218 finished with values: [0.045298375348697247, 0.028442622950819674, 0.040460556279185406] and parameters: {'n_layers': 2, 'embedding_dim': 256, 'lr': 0.0006640426930867159, 'lambda_val': 0.006639299505918974, 'batch_size': 2002, 'optimizer': 'RMSprop'}.
2026-05-23 04:38:51,802 - experiment_functions - INFO - Early stopping at epoch 3450. Best Metrics: (0.024590049236103154, 0.019098360655737702, 0.02532691715162572)
2026-05-23 04:38:51,878 - optuna.study.study - INFO - Trial 219 finished with values: [0.024590049236103154, 0.019098360655737702, 0.02532691715162572] and parameters: {'n_layers': 2, 'embedding_dim': 128, 'lr': 0.006207348828089935, 'lambda_val': 0.01858066348850605, 'batch_size': 1477, 'optimizer': 'Adam'}.
2026-05-23 04:39:03,592 - experiment_functions - INFO - Early stopping at epoch 3000. Best Metrics: (0.11149723455691574, 0.054672131147540985, 0.09274532066857054)
2026-05-23 04:39:03,722 - optuna.study.study - INFO - Trial 220 finished with values: [0.11149723455691574, 0.054672131147540985, 0.09274532066857054] and parameters: {'n_layers': 1, 'embedding_dim': 256, 'lr': 0.0002433821756193056, 'lambda_val': 0.0060103019678805995, 'batch_size': 1954, 'optimizer': 'Adam'}.
2026-05-23 04:39:06,512 - experiment_functions - INFO - Early stopping at epoch 550. Best Metrics: (0.062058914110481894, 0.03311475409836066, 0.048997750576831436)
2026-05-23 04:39:06,584 - optuna.study.study - INFO - Trial 221 finished with values: [0.062058914110481894, 0.03311475409836066, 0.048997750576831436] and parameters: {'n_layers': 2, 'embedding_dim': 64, 'lr': 0.00466856942146688, 'lambda_val': 0.0004769034760402413, 'batch_size': 1477, 'optimizer': 'Adam'}.
2026-05-23 04:39:11,767 - experiment_functions - INFO - Early stopping at epoch 1200. Best Metrics: (0.06288028409311765, 0.03639344262295082, 0.04947851667064384)
2026-05-23 04:39:11,838 - optuna.study.study - INFO - Trial 222 finished with values: [0.06288028409311765, 0.03639344262295082, 0.04947851667064384] and parameters: {'n_layers': 2, 'embedding_dim': 64, 'lr': 0.0006640426930867159, 'lambda_val': 0.00010447269915261112, 'batch_size': 1427, 'optimizer': 'Adam'}.
2026-05-23 04:39:24,456 - experiment_functions - INFO - Early stopping at epoch 3350. Best Metrics: (0.06739616870478803, 0.0380327868852459, 0.05763818166941896)
2026-05-23 04:39:24,530 - optuna.study.study - INFO - Trial 223 finished with values: [0.06739616870478803, 0.0380327868852459, 0.05763818166941896] and parameters: {'n_layers': 1, 'embedding_dim': 256, 'lr': 0.0360898011163686, 'lambda_val': 0.006639299505918974, 'batch_size': 3576, 'optimizer': 'Adam'}.
2026-05-23 04:39:28,740 - experiment_functions - INFO - Early stopping at epoch 1450. Best Metrics: (0.1015183350140536, 0.052704918032786895, 0.08850808151265997)
2026-05-23 04:39:29,354 - optuna.study.study - INFO - Trial 224 finished with values: [0.1015183350140536, 0.052704918032786895, 0.08850808151265997] and parameters: {'n_layers': 1, 'embedding_dim': 64, 'lr': 0.0005076161055190746, 'lambda_val': 0.006639299505918974, 'batch_size': 1477, 'optimizer': 'RMSprop'}.
2026-05-23 04:39:40,108 - optuna.study.study - INFO - Trial 225 finished with values: [0.07829002356675552, 0.044590163934426226, 0.07278507623059022] and parameters: {'n_layers': 1, 'embedding_dim': 64, 'lr': 0.0002433821756193056, 'lambda_val': 0.0029498596669714134, 'batch_size': 1477, 'optimizer': 'Adam'}.
2026-05-23 04:39:49,822 - experiment_functions - INFO - Early stopping at epoch 3600. Best Metrics: (0.09937574868264727, 0.05188524590163935, 0.08534209349529599)
2026-05-23 04:39:49,935 - optuna.study.study - INFO - Trial 226 finished with values: [0.09937574868264727, 0.05188524590163935, 0.08534209349529599] and parameters: {'n_layers': 1, 'embedding_dim': 64, 'lr': 0.0005076161055190746, 'lambda_val': 1.5250659263577613e-05, 'batch_size': 563, 'optimizer': 'Adam'}.
2026-05-23 04:39:53,640 - experiment_functions - INFO - Early stopping at epoch 1150. Best Metrics: (0.10668848632409217, 0.05081967213114754, 0.08649438144479013)
2026-05-23 04:39:54,043 - optuna.study.study - INFO - Trial 227 finished with values: [0.10668848632409217, 0.05081967213114754, 0.08649438144479013] and parameters: {'n_layers': 1, 'embedding_dim': 64, 'lr': 0.0006640426930867159, 'lambda_val': 0.00010447269915261112, 'batch_size': 3135, 'optimizer': 'RMSprop'}.
2026-05-23 04:39:58,526 - experiment_functions - INFO - Early stopping at epoch 600. Best Metrics: (0.0282491636512779, 0.019918032786885247, 0.028310694717465414)
2026-05-23 04:39:58,810 - optuna.study.study - INFO - Trial 228 finished with values: [0.0282491636512779, 0.019918032786885247, 0.028310694717465414] and parameters: {'n_layers': 4, 'embedding_dim': 256, 'lr': 0.0012715072595827332, 'lambda_val': 0.00062453091272787, 'batch_size': 2240, 'optimizer': 'Adam'}.
2026-05-23 04:40:03,662 - experiment_functions - INFO - Early stopping at epoch 1200. Best Metrics: (0.11781398231156642, 0.05672131147540984, 0.09550900084024591)
2026-05-23 04:40:04,727 - optuna.study.study - INFO - Trial 229 finished with values: [0.11781398231156642, 0.05672131147540984, 0.09550900084024591] and parameters: {'n_layers': 1, 'embedding_dim': 256, 'lr': 0.0006640426930867159, 'lambda_val': 8.780584753439128e-06, 'batch_size': 2183, 'optimizer': 'Adam'}.
2026-05-23 04:40:19,160 - optuna.study.study - INFO - Trial 230 finished with values: [0.0640088119508629, 0.037868852459016396, 0.06270803961953716] and parameters: {'n_layers': 4, 'embedding_dim': 32, 'lr': 0.0003054746060910338, 'lambda_val': 0.0009962507800702286, 'batch_size': 601, 'optimizer': 'RMSprop'}.
2026-05-23 04:40:21,353 - experiment_functions - INFO - Early stopping at epoch 550. Best Metrics: (0.07923760237360285, 0.04180327868852459, 0.06753850859396719)
2026-05-23 04:40:21,440 - optuna.study.study - INFO - Trial 231 finished with values: [0.07923760237360285, 0.04180327868852459, 0.06753850859396719] and parameters: {'n_layers': 1, 'embedding_dim': 64, 'lr': 0.00466856942146688, 'lambda_val': 0.00062453091272787, 'batch_size': 2999, 'optimizer': 'Adam'}.
2026-05-23 04:40:26,640 - experiment_functions - INFO - Early stopping at epoch 1400. Best Metrics: (0.0599171698981289, 0.030901639344262297, 0.04743901592382651)
2026-05-23 04:40:26,714 - optuna.study.study - INFO - Trial 232 finished with values: [0.0599171698981289, 0.030901639344262297, 0.04743901592382651] and parameters: {'n_layers': 3, 'embedding_dim': 32, 'lr': 0.0004803146544874298, 'lambda_val': 0.002225291349266682, 'batch_size': 2183, 'optimizer': 'RMSprop'}.
2026-05-23 04:40:29,129 - experiment_functions - INFO - Early stopping at epoch 550. Best Metrics: (0.07473638949800437, 0.03885245901639345, 0.06165542232858636)
2026-05-23 04:40:29,215 - optuna.study.study - INFO - Trial 233 finished with values: [0.07473638949800437, 0.03885245901639345, 0.06165542232858636] and parameters: {'n_layers': 2, 'embedding_dim': 64, 'lr': 0.00466856942146688, 'lambda_val': 0.0004769034760402413, 'batch_size': 3135, 'optimizer': 'Adam'}.
2026-05-23 04:40:34,218 - experiment_functions - INFO - Early stopping at epoch 950. Best Metrics: (0.06782461975797219, 0.03737704918032787, 0.05860552515439704)
2026-05-23 04:40:34,940 - optuna.study.study - INFO - Trial 234 finished with values: [0.06782461975797219, 0.03737704918032787, 0.05860552515439704] and parameters: {'n_layers': 2, 'embedding_dim': 256, 'lr': 0.0003054746060910338, 'lambda_val': 0.0002794201622830738, 'batch_size': 4093, 'optimizer': 'RMSprop'}.
2026-05-23 04:40:48,044 - optuna.study.study - INFO - Trial 235 finished with values: [0.10129164778464123, 0.05245901639344262, 0.09019372698156852] and parameters: {'n_layers': 1, 'embedding_dim': 64, 'lr': 0.0002758788994373932, 'lambda_val': 0.0004769034760402413, 'batch_size': 1505, 'optimizer': 'RMSprop'}.
2026-05-23 04:40:54,720 - experiment_functions - INFO - Early stopping at epoch 650. Best Metrics: (0.05545565065469372, 0.03172131147540983, 0.04789509187889998)
2026-05-23 04:40:55,331 - optuna.study.study - INFO - Trial 236 finished with values: [0.05545565065469372, 0.03172131147540983, 0.04789509187889998] and parameters: {'n_layers': 3, 'embedding_dim': 64, 'lr': 0.001134436508843411, 'lambda_val': 1.374096848370064e-06, 'batch_size': 2902, 'optimizer': 'RMSprop'}.
2026-05-23 04:41:06,247 - optuna.study.study - INFO - Trial 237 finished with values: [0.007686783997493699, 0.003934426229508198, 0.006569076433800233] and parameters: {'n_layers': 1, 'embedding_dim': 64, 'lr': 5.851686535164335e-05, 'lambda_val': 0.0002794201622830738, 'batch_size': 3576, 'optimizer': 'RMSprop'}.
2026-05-23 04:41:10,732 - experiment_functions - INFO - Early stopping at epoch 1050. Best Metrics: (0.07604803070317455, 0.04139344262295082, 0.06513738203475335)
2026-05-23 04:41:11,699 - optuna.study.study - INFO - Trial 238 finished with values: [0.07604803070317455, 0.04139344262295082, 0.06513738203475335] and parameters: {'n_layers': 2, 'embedding_dim': 128, 'lr': 0.00039831203487280473, 'lambda_val': 0.002225291349266682, 'batch_size': 2268, 'optimizer': 'Adam'}.
2026-05-23 04:41:23,836 - experiment_functions - INFO - Early stopping at epoch 3750. Best Metrics: (0.003305169049782923, 0.0021311475409836068, 0.0027984285667942365)
2026-05-23 04:41:23,915 - optuna.study.study - INFO - Trial 239 finished with values: [0.003305169049782923, 0.0021311475409836068, 0.0027984285667942365] and parameters: {'n_layers': 1, 'embedding_dim': 256, 'lr': 4.764513076994961e-05, 'lambda_val': 0.001092384612961102, 'batch_size': 601, 'optimizer': 'RMSprop'}.
2026-05-23 04:41:37,199 - optuna.study.study - INFO - Trial 240 finished with values: [0.03508314328069203, 0.024262295081967214, 0.03423195181989558] and parameters: {'n_layers': 2, 'embedding_dim': 96, 'lr': 9.704000146674069e-05, 'lambda_val': 1.374096848370064e-06, 'batch_size': 3135, 'optimizer': 'RMSprop'}.
2026-05-23 04:41:40,909 - experiment_functions - INFO - Early stopping at epoch 950. Best Metrics: (0.09362506426619945, 0.04975409836065574, 0.08031379111838377)
