2026-05-23 06:32:05,333 - optuna.study.study - INFO - Trial 90 finished with values: [0.006728886180039636, 0.005327868852459016, 0.0063048569895749204] and parameters: {'n_layers': 4, 'embedding_dim': 32, 'lr': 0.016320210842073777, 'lambda_val': 3.6543758813358244e-05, 'batch_size': 3522, 'optimizer': 'Adam'}.
2026-05-23 06:32:07,721 - experiment_functions - INFO - Early stopping at epoch 600. Best Metrics: (0.038781129182678634, 0.018114754098360657, 0.0313602763224001)
2026-05-23 06:32:07,813 - optuna.study.study - INFO - Trial 91 finished with values: [0.038781129182678634, 0.018114754098360657, 0.0313602763224001] and parameters: {'n_layers': 1, 'embedding_dim': 32, 'lr': 0.006511379953096499, 'lambda_val': 0.0010960072481100915, 'batch_size': 3332, 'optimizer': 'Adam'}.
2026-05-23 06:32:11,324 - experiment_functions - INFO - Early stopping at epoch 900. Best Metrics: (0.039698797064719536, 0.022540983606557378, 0.035730551492594395)
2026-05-23 06:32:11,411 - optuna.study.study - INFO - Trial 92 finished with values: [0.039698797064719536, 0.022540983606557378, 0.035730551492594395] and parameters: {'n_layers': 2, 'embedding_dim': 128, 'lr': 0.000664690953252874, 'lambda_val': 0.0018827383963552864, 'batch_size': 1510, 'optimizer': 'Adam'}.
2026-05-23 06:32:13,819 - experiment_functions - INFO - Early stopping at epoch 550. Best Metrics: (0.012513599998924582, 0.009344262295081968, 0.01318621749874053)
2026-05-23 06:32:13,911 - optuna.study.study - INFO - Trial 93 finished with values: [0.012513599998924582, 0.009344262295081968, 0.01318621749874053] and parameters: {'n_layers': 2, 'embedding_dim': 128, 'lr': 0.016055862829867446, 'lambda_val': 0.0029735962591633316, 'batch_size': 542, 'optimizer': 'Adam'}.
2026-05-23 06:32:16,595 - experiment_functions - INFO - Early stopping at epoch 600. Best Metrics: (0.04626831574599027, 0.02204918032786885, 0.036091478946295524)
2026-05-23 06:32:16,721 - optuna.study.study - INFO - Trial 94 finished with values: [0.04626831574599027, 0.02204918032786885, 0.036091478946295524] and parameters: {'n_layers': 1, 'embedding_dim': 256, 'lr': 0.0014308085114682584, 'lambda_val': 1.2349382351402382e-05, 'batch_size': 3209, 'optimizer': 'RMSprop'}.
2026-05-23 06:32:18,989 - experiment_functions - INFO - Early stopping at epoch 550. Best Metrics: (0.040007697699222404, 0.022213114754098363, 0.03738682844801981)
2026-05-23 06:32:19,051 - optuna.study.study - INFO - Trial 95 finished with values: [0.040007697699222404, 0.022213114754098363, 0.03738682844801981] and parameters: {'n_layers': 2, 'embedding_dim': 64, 'lr': 0.005575586908390307, 'lambda_val': 2.2332391286564103e-05, 'batch_size': 2289, 'optimizer': 'Adam'}.
2026-05-23 06:32:22,147 - experiment_functions - INFO - Early stopping at epoch 700. Best Metrics: (0.013053166862257439, 0.01, 0.012895728476302316)
2026-05-23 06:32:22,270 - optuna.study.study - INFO - Trial 96 finished with values: [0.013053166862257439, 0.01, 0.012895728476302316] and parameters: {'n_layers': 3, 'embedding_dim': 32, 'lr': 0.001014286967432895, 'lambda_val': 0.056636570322801144, 'batch_size': 2339, 'optimizer': 'Adam'}.
2026-05-23 06:32:26,281 - experiment_functions - INFO - Early stopping at epoch 850. Best Metrics: (0.0022351056157464337, 0.0017213114754098366, 0.002709596348841465)
2026-05-23 06:32:26,565 - optuna.study.study - INFO - Trial 97 finished with values: [0.0022351056157464337, 0.0017213114754098366, 0.002709596348841465] and parameters: {'n_layers': 3, 'embedding_dim': 256, 'lr': 0.01961542746261612, 'lambda_val': 0.0003140758742541971, 'batch_size': 2227, 'optimizer': 'SGD'}.
2026-05-23 06:32:38,921 - experiment_functions - INFO - Early stopping at epoch 3950. Best Metrics: (0.01544800885007799, 0.008770491803278688, 0.012938561060209864)
2026-05-23 06:32:39,012 - optuna.study.study - INFO - Trial 98 finished with values: [0.01544800885007799, 0.008770491803278688, 0.012938561060209864] and parameters: {'n_layers': 3, 'embedding_dim': 64, 'lr': 6.850762248123774e-05, 'lambda_val': 0.006084767092372325, 'batch_size': 3208, 'optimizer': 'Adam'}.
2026-05-23 06:32:42,732 - experiment_functions - INFO - Early stopping at epoch 850. Best Metrics: (0.028688551881131497, 0.01762295081967213, 0.027667207936883084)
2026-05-23 06:32:43,178 - optuna.study.study - INFO - Trial 99 finished with values: [0.028688551881131497, 0.01762295081967213, 0.027667207936883084] and parameters: {'n_layers': 3, 'embedding_dim': 96, 'lr': 0.0006455056540536045, 'lambda_val': 3.358284940070747e-05, 'batch_size': 3624, 'optimizer': 'Adam'}.
2026-05-23 06:32:45,684 - experiment_functions - INFO - Early stopping at epoch 550. Best Metrics: (0.01120646789304621, 0.009180327868852459, 0.012244808423325725)
2026-05-23 06:32:45,802 - optuna.study.study - INFO - Trial 100 finished with values: [0.01120646789304621, 0.009180327868852459, 0.012244808423325725] and parameters: {'n_layers': 2, 'embedding_dim': 96, 'lr': 0.029359450332429586, 'lambda_val': 6.689493347784772e-06, 'batch_size': 2413, 'optimizer': 'Adam'}.
2026-05-23 06:32:49,487 - experiment_functions - INFO - Early stopping at epoch 900. Best Metrics: (0.054848159654675314, 0.025819672131147543, 0.044807156849287835)
2026-05-23 06:32:49,633 - optuna.study.study - INFO - Trial 101 finished with values: [0.054848159654675314, 0.025819672131147543, 0.044807156849287835] and parameters: {'n_layers': 1, 'embedding_dim': 256, 'lr': 0.0008759436093290035, 'lambda_val': 4.470892478605119e-05, 'batch_size': 3624, 'optimizer': 'Adam'}.
2026-05-23 06:32:52,749 - experiment_functions - INFO - Early stopping at epoch 550. Best Metrics: (0.04314230414577079, 0.02237704918032787, 0.03595471799803551)
2026-05-23 06:32:53,718 - optuna.study.study - INFO - Trial 102 finished with values: [0.04314230414577079, 0.02237704918032787, 0.03595471799803551] and parameters: {'n_layers': 3, 'embedding_dim': 256, 'lr': 0.0023890551445205745, 'lambda_val': 0.0010640003632219933, 'batch_size': 2030, 'optimizer': 'Adam'}.
2026-05-23 06:32:56,671 - experiment_functions - INFO - Early stopping at epoch 700. Best Metrics: (0.0386898204609099, 0.020245901639344265, 0.03269016812706731)
2026-05-23 06:32:58,423 - optuna.study.study - INFO - Trial 103 finished with values: [0.0386898204609099, 0.020245901639344265, 0.03269016812706731] and parameters: {'n_layers': 3, 'embedding_dim': 64, 'lr': 0.0012063661436249296, 'lambda_val': 4.470892478605119e-05, 'batch_size': 1555, 'optimizer': 'Adam'}.
2026-05-23 06:33:02,243 - experiment_functions - INFO - Early stopping at epoch 950. Best Metrics: (0.04887007595027966, 0.022213114754098363, 0.03789459970889701)
2026-05-23 06:33:02,357 - optuna.study.study - INFO - Trial 104 finished with values: [0.04887007595027966, 0.022213114754098363, 0.03789459970889701] and parameters: {'n_layers': 1, 'embedding_dim': 256, 'lr': 0.0008759436093290035, 'lambda_val': 4.470892478605119e-05, 'batch_size': 1555, 'optimizer': 'Adam'}.
2026-05-23 06:33:04,899 - experiment_functions - INFO - Early stopping at epoch 500. Best Metrics: (0.004436095088002662, 0.002459016393442623, 0.004910364261462976)
2026-05-23 06:33:05,276 - optuna.study.study - INFO - Trial 105 finished with values: [0.004436095088002662, 0.002459016393442623, 0.004910364261462976] and parameters: {'n_layers': 3, 'embedding_dim': 32, 'lr': 0.000664690953252874, 'lambda_val': 2.8054741806304403e-06, 'batch_size': 2186, 'optimizer': 'SGD'}.
2026-05-23 06:33:12,292 - experiment_functions - INFO - Early stopping at epoch 1050. Best Metrics: (0.034682519604352195, 0.018278688524590164, 0.030741662378945978)
2026-05-23 06:33:12,958 - optuna.study.study - INFO - Trial 106 finished with values: [0.034682519604352195, 0.018278688524590164, 0.030741662378945978] and parameters: {'n_layers': 3, 'embedding_dim': 256, 'lr': 0.0002779300422306739, 'lambda_val': 6.689493347784772e-06, 'batch_size': 3478, 'optimizer': 'Adam'}.
2026-05-23 06:33:29,906 - optuna.study.study - INFO - Trial 107 finished with values: [0.04133486119588501, 0.020327868852459016, 0.03326077022816382] and parameters: {'n_layers': 1, 'embedding_dim': 128, 'lr': 0.0001681912395064878, 'lambda_val': 1.3238653697855508e-06, 'batch_size': 1555, 'optimizer': 'Adam'}.
2026-05-23 06:33:45,687 - optuna.study.study - INFO - Trial 108 finished with values: [0.023775363203789677, 0.013360655737704919, 0.022925674933051206] and parameters: {'n_layers': 4, 'embedding_dim': 128, 'lr': 8.981382437399417e-05, 'lambda_val': 0.0005103737914204569, 'batch_size': 3478, 'optimizer': 'Adam'}.
2026-05-23 06:33:49,914 - experiment_functions - INFO - Early stopping at epoch 1150. Best Metrics: (0.04806257087161769, 0.02237704918032787, 0.03560051580092691)
2026-05-23 06:33:50,491 - optuna.study.study - INFO - Trial 109 finished with values: [0.04806257087161769, 0.02237704918032787, 0.03560051580092691] and parameters: {'n_layers': 1, 'embedding_dim': 32, 'lr': 0.0008759436093290035, 'lambda_val': 4.470892478605119e-05, 'batch_size': 2991, 'optimizer': 'Adam'}.
2026-05-23 06:33:56,453 - experiment_functions - INFO - Early stopping at epoch 1850. Best Metrics: (0.05623817451748028, 0.027131147540983606, 0.047609249664161656)
2026-05-23 06:33:57,091 - optuna.study.study - INFO - Trial 110 finished with values: [0.05623817451748028, 0.027131147540983606, 0.047609249664161656] and parameters: {'n_layers': 1, 'embedding_dim': 96, 'lr': 0.000664690953252874, 'lambda_val': 0.0018827383963552864, 'batch_size': 724, 'optimizer': 'Adam'}.
2026-05-23 06:34:00,723 - experiment_functions - INFO - Early stopping at epoch 950. Best Metrics: (0.025846211817246893, 0.015409836065573772, 0.022448369428380056)
2026-05-23 06:34:00,807 - optuna.study.study - INFO - Trial 111 finished with values: [0.025846211817246893, 0.015409836065573772, 0.022448369428380056] and parameters: {'n_layers': 3, 'embedding_dim': 32, 'lr': 0.0008759436093290035, 'lambda_val': 0.0018827383963552864, 'batch_size': 2085, 'optimizer': 'Adam'}.
2026-05-23 06:34:04,461 - experiment_functions - INFO - Early stopping at epoch 900. Best Metrics: (0.04846987084115579, 0.025327868852459016, 0.04050758506071563)
2026-05-23 06:34:04,814 - optuna.study.study - INFO - Trial 112 finished with values: [0.04846987084115579, 0.025327868852459016, 0.04050758506071563] and parameters: {'n_layers': 1, 'embedding_dim': 256, 'lr': 0.0008759436093290035, 'lambda_val': 4.470892478605119e-05, 'batch_size': 1555, 'optimizer': 'Adam'}.
2026-05-23 06:34:10,834 - experiment_functions - INFO - Early stopping at epoch 1400. Best Metrics: (0.042713625202910076, 0.02122950819672131, 0.0329485097037888)
2026-05-23 06:34:11,127 - optuna.study.study - INFO - Trial 113 finished with values: [0.042713625202910076, 0.02122950819672131, 0.0329485097037888] and parameters: {'n_layers': 2, 'embedding_dim': 256, 'lr': 0.0002779300422306739, 'lambda_val': 6.689493347784772e-06, 'batch_size': 2551, 'optimizer': 'Adam'}.
2026-05-23 06:34:15,125 - experiment_functions - INFO - Early stopping at epoch 650. Best Metrics: (0.0014322895251758154, 0.001639344262295082, 0.0018730942119578446)
2026-05-23 06:34:15,711 - optuna.study.study - INFO - Trial 114 finished with values: [0.0014322895251758154, 0.001639344262295082, 0.0018730942119578446] and parameters: {'n_layers': 1, 'embedding_dim': 64, 'lr': 0.048413276973233305, 'lambda_val': 0.013840432502784892, 'batch_size': 542, 'optimizer': 'SGD'}.
2026-05-23 06:34:28,273 - experiment_functions - INFO - Early stopping at epoch 2200. Best Metrics: (0.030593518688341856, 0.017540983606557377, 0.026241127063214784)
2026-05-23 06:34:28,358 - optuna.study.study - INFO - Trial 115 finished with values: [0.030593518688341856, 0.017540983606557377, 0.026241127063214784] and parameters: {'n_layers': 1, 'embedding_dim': 64, 'lr': 0.048413276973233305, 'lambda_val': 0.013840432502784892, 'batch_size': 3624, 'optimizer': 'Adam'}.
2026-05-23 06:34:39,229 - experiment_functions - INFO - Early stopping at epoch 3550. Best Metrics: (0.0453273252031765, 0.022540983606557378, 0.03588677664208406)
2026-05-23 06:34:40,316 - optuna.study.study - INFO - Trial 116 finished with values: [0.0453273252031765, 0.022540983606557378, 0.03588677664208406] and parameters: {'n_layers': 1, 'embedding_dim': 96, 'lr': 0.0003566130628047912, 'lambda_val': 4.470892478605119e-05, 'batch_size': 2413, 'optimizer': 'Adam'}.
2026-05-23 06:34:43,321 - experiment_functions - INFO - Early stopping at epoch 650. Best Metrics: (0.024544046033380437, 0.012950819672131148, 0.022937821415931762)
2026-05-23 06:34:43,848 - optuna.study.study - INFO - Trial 117 finished with values: [0.024544046033380437, 0.012950819672131148, 0.022937821415931762] and parameters: {'n_layers': 4, 'embedding_dim': 64, 'lr': 0.0014308085114682584, 'lambda_val': 1.160548750868123e-06, 'batch_size': 2923, 'optimizer': 'Adam'}.
2026-05-23 06:34:47,406 - experiment_functions - INFO - Early stopping at epoch 900. Best Metrics: (0.043766609022539774, 0.021475409836065575, 0.035806318720882385)
2026-05-23 06:34:47,492 - optuna.study.study - INFO - Trial 118 finished with values: [0.043766609022539774, 0.021475409836065575, 0.035806318720882385] and parameters: {'n_layers': 1, 'embedding_dim': 96, 'lr': 0.0007958391483531121, 'lambda_val': 0.0018827383963552864, 'batch_size': 3522, 'optimizer': 'Adam'}.
2026-05-23 06:34:51,409 - experiment_functions - INFO - Early stopping at epoch 1100. Best Metrics: (0.017522332927926664, 0.011393442622950821, 0.016055247601939018)
2026-05-23 06:34:51,843 - optuna.study.study - INFO - Trial 119 finished with values: [0.017522332927926664, 0.011393442622950821, 0.016055247601939018] and parameters: {'n_layers': 1, 'embedding_dim': 32, 'lr': 0.048413276973233305, 'lambda_val': 2.304014009204138e-06, 'batch_size': 3624, 'optimizer': 'Adam'}.
2026-05-23 06:34:56,174 - experiment_functions - INFO - Early stopping at epoch 1150. Best Metrics: (0.023859413270503345, 0.015327868852459016, 0.02221157095066775)
2026-05-23 06:34:56,309 - optuna.study.study - INFO - Trial 120 finished with values: [0.023859413270503345, 0.015327868852459016, 0.02221157095066775] and parameters: {'n_layers': 1, 'embedding_dim': 128, 'lr': 0.04266777470177692, 'lambda_val': 0.01072594130410366, 'batch_size': 2546, 'optimizer': 'Adam'}.
2026-05-23 06:35:08,789 - optuna.study.study - INFO - Trial 121 finished with values: [0.009454518858031126, 0.006721311475409835, 0.008748460798880522] and parameters: {'n_layers': 1, 'embedding_dim': 256, 'lr': 0.00011688866907532978, 'lambda_val': 6.689493347784772e-06, 'batch_size': 630, 'optimizer': 'RMSprop'}.
2026-05-23 06:35:12,434 - experiment_functions - INFO - Early stopping at epoch 750. Best Metrics: (0.026623153774844914, 0.016311475409836063, 0.02473767053702326)
2026-05-23 06:35:12,531 - optuna.study.study - INFO - Trial 122 finished with values: [0.026623153774844914, 0.016311475409836063, 0.02473767053702326] and parameters: {'n_layers': 2, 'embedding_dim': 256, 'lr': 0.0003566130628047912, 'lambda_val': 0.02350411146978007, 'batch_size': 2199, 'optimizer': 'RMSprop'}.
2026-05-23 06:35:26,542 - optuna.study.study - INFO - Trial 123 finished with values: [0.001588808715860576, 0.001557377049180328, 0.0018203602161399564] and parameters: {'n_layers': 4, 'embedding_dim': 96, 'lr': 1.8997273905283062e-05, 'lambda_val': 0.008141045244285614, 'batch_size': 2991, 'optimizer': 'Adam'}.
2026-05-23 06:35:28,813 - experiment_functions - INFO - Early stopping at epoch 550. Best Metrics: (0.04338372213198163, 0.02163934426229508, 0.03501907577774687)
2026-05-23 06:35:28,902 - optuna.study.study - INFO - Trial 124 finished with values: [0.04338372213198163, 0.02163934426229508, 0.03501907577774687] and parameters: {'n_layers': 1, 'embedding_dim': 64, 'lr': 0.013868600017201397, 'lambda_val': 2.2332391286564103e-05, 'batch_size': 2289, 'optimizer': 'Adam'}.
2026-05-23 06:35:33,632 - experiment_functions - INFO - Early stopping at epoch 1150. Best Metrics: (0.04392224210359924, 0.023442622950819673, 0.03852574783123023)
2026-05-23 06:35:34,219 - optuna.study.study - INFO - Trial 125 finished with values: [0.04392224210359924, 0.023442622950819673, 0.03852574783123023] and parameters: {'n_layers': 1, 'embedding_dim': 256, 'lr': 0.000437352573427761, 'lambda_val': 0.0010960072481100915, 'batch_size': 3188, 'optimizer': 'Adam'}.
2026-05-23 06:35:39,010 - experiment_functions - INFO - Early stopping at epoch 1400. Best Metrics: (0.013984932893366877, 0.008934426229508198, 0.012345649961432724)
2026-05-23 06:35:39,096 - optuna.study.study - INFO - Trial 126 finished with values: [0.013984932893366877, 0.008934426229508198, 0.012345649961432724] and parameters: {'n_layers': 2, 'embedding_dim': 32, 'lr': 0.06136195989867191, 'lambda_val': 0.009797133052167752, 'batch_size': 2659, 'optimizer': 'Adam'}.
2026-05-23 06:35:43,548 - experiment_functions - INFO - Early stopping at epoch 1250. Best Metrics: (0.013614287701389751, 0.009508196721311476, 0.012861908924158802)
2026-05-23 06:35:43,683 - optuna.study.study - INFO - Trial 127 finished with values: [0.013614287701389751, 0.009508196721311476, 0.012861908924158802] and parameters: {'n_layers': 2, 'embedding_dim': 32, 'lr': 0.06136195989867191, 'lambda_val': 0.0010960072481100915, 'batch_size': 2659, 'optimizer': 'RMSprop'}.
2026-05-23 06:35:48,338 - experiment_functions - INFO - Early stopping at epoch 1300. Best Metrics: (0.04904210781081843, 0.023442622950819673, 0.03842416243911093)
2026-05-23 06:35:48,512 - optuna.study.study - INFO - Trial 128 finished with values: [0.04904210781081843, 0.023442622950819673, 0.03842416243911093] and parameters: {'n_layers': 1, 'embedding_dim': 32, 'lr': 0.0007958391483531121, 'lambda_val': 0.001962445290785147, 'batch_size': 3332, 'optimizer': 'Adam'}.
2026-05-23 06:35:51,824 - experiment_functions - INFO - Early stopping at epoch 800. Best Metrics: (0.02897292826538381, 0.01680327868852459, 0.024357013882992013)
2026-05-23 06:35:52,038 - optuna.study.study - INFO - Trial 129 finished with values: [0.02897292826538381, 0.01680327868852459, 0.024357013882992013] and parameters: {'n_layers': 1, 'embedding_dim': 256, 'lr': 0.013868600017201397, 'lambda_val': 0.012643202346609827, 'batch_size': 1555, 'optimizer': 'Adam'}.
2026-05-23 06:36:13,203 - optuna.study.study - INFO - Trial 130 finished with values: [0.03063442130465126, 0.016885245901639347, 0.026298303308632785] and parameters: {'n_layers': 2, 'embedding_dim': 256, 'lr': 8.981382437399417e-05, 'lambda_val': 0.0005103737914204569, 'batch_size': 3383, 'optimizer': 'RMSprop'}.
2026-05-23 06:36:19,708 - experiment_functions - INFO - Early stopping at epoch 1950. Best Metrics: (0.04770387779869539, 0.02262295081967213, 0.036207067963594255)
2026-05-23 06:36:19,792 - optuna.study.study - INFO - Trial 131 finished with values: [0.04770387779869539, 0.02262295081967213, 0.036207067963594255] and parameters: {'n_layers': 1, 'embedding_dim': 128, 'lr': 0.0003566130628047912, 'lambda_val': 3.822612857526585e-06, 'batch_size': 3478, 'optimizer': 'Adam'}.
2026-05-23 06:36:23,018 - experiment_functions - INFO - Early stopping at epoch 550. Best Metrics: (0.03661535738275822, 0.018606557377049183, 0.02937510634199817)
2026-05-23 06:36:23,635 - optuna.study.study - INFO - Trial 132 finished with values: [0.03661535738275822, 0.018606557377049183, 0.02937510634199817] and parameters: {'n_layers': 3, 'embedding_dim': 256, 'lr': 0.0023890551445205745, 'lambda_val': 2.8054741806304403e-06, 'batch_size': 2030, 'optimizer': 'Adam'}.
2026-05-23 06:36:34,453 - experiment_functions - INFO - Early stopping at epoch 3400. Best Metrics: (0.04407020368283164, 0.023688524590163934, 0.03689449579448262)
