2026-05-22 23:44:46,973 - optuna.study.study - INFO - Trial 299 finished with values: [0.1090284652653537, 0.05581967213114754, 0.09328593003869906] and parameters: {'n_layers': 1, 'embedding_dim': 64, 'lr': 0.0014373137364726936, 'lambda_val': 4.1855561222722974e-06, 'batch_size': 653, 'optimizer': 'RMSprop'}.
2026-05-22 23:44:46,989 - root - INFO - Selected Trial 103 based on Max NDCG: 0.1114
2026-05-22 23:44:46,989 - root - INFO - Associated Recall: 0.1315
2026-05-22 23:44:46,989 - experiment_functions - INFO - Training the best model ... for e_100K_full
2026-05-22 23:44:50,801 - experiment_functions - INFO - Early stopping at epoch 950. Best Metrics: (0.12287485302646127, 0.06040983606557377, 0.1033728790947985)
2026-05-22 23:44:50,911 - root - INFO - **** Training e_100K_1c1dcs
2026-05-22 23:44:50,911 - root - INFO -   ** 1-Dominant stats:
2026-05-22 23:44:50,911 - root - INFO -   ** Finding the dominant set:
2026-05-22 23:45:11,349 - root - INFO -   ** Getting the trainable edges:
2026-05-22 23:45:11,352 - helper_functions - INFO -      Number of nodes: 535
2026-05-22 23:45:11,352 - helper_functions - INFO -      Ratio: 0.05177085349332301
2026-05-22 23:45:11,352 - helper_functions - INFO -      Number of unique users: 303
2026-05-22 23:45:11,352 - helper_functions - INFO -      Number of unique items: 232
2026-05-22 23:45:11,352 - helper_functions - INFO -      Total dominant set edge: 8849
2026-05-22 23:45:11,352 - helper_functions - INFO -      Trainable edges: 7079.200000000001
2026-05-22 23:45:11,356 - root - INFO -   **** Getting 8849 dominant set edges
2026-05-22 23:45:12,007 - optuna.storages._rdb.storage - INFO - A new study created in RDB with name: Study_e_100K_1c1dcs_strict
2026-05-22 23:45:14,775 - experiment_functions - INFO - Early stopping at epoch 600. Best Metrics: (0.002480820702602771, 0.0018032786885245904, 0.0022816223720836144)
2026-05-22 23:45:14,919 - optuna.study.study - INFO - Trial 0 finished with values: [0.002480820702602771, 0.0018032786885245904, 0.0022816223720836144] and parameters: {'n_layers': 2, 'embedding_dim': 96, 'lr': 1.7861902566012577e-05, 'lambda_val': 2.004123419605473e-05, 'batch_size': 1623, 'optimizer': 'RMSprop'}.
2026-05-22 23:45:18,037 - experiment_functions - INFO - Early stopping at epoch 650. Best Metrics: (0.008900083522467432, 0.009918032786885246, 0.011751186307932138)
2026-05-22 23:45:18,185 - optuna.study.study - INFO - Trial 1 finished with values: [0.008900083522467432, 0.009918032786885246, 0.011751186307932138] and parameters: {'n_layers': 4, 'embedding_dim': 96, 'lr': 0.0006693247579890929, 'lambda_val': 8.019970575757968e-05, 'batch_size': 3664, 'optimizer': 'Adam'}.
2026-05-22 23:45:21,136 - experiment_functions - INFO - Early stopping at epoch 500. Best Metrics: (0.0030522948685931515, 0.0022950819672131148, 0.003730985220285108)
2026-05-22 23:45:21,277 - optuna.study.study - INFO - Trial 2 finished with values: [0.0030522948685931515, 0.0022950819672131148, 0.003730985220285108] and parameters: {'n_layers': 4, 'embedding_dim': 256, 'lr': 0.005189995302443359, 'lambda_val': 0.0011900697866601866, 'batch_size': 3028, 'optimizer': 'SGD'}.
2026-05-22 23:45:32,879 - experiment_functions - INFO - Early stopping at epoch 3350. Best Metrics: (0.008140036580730637, 0.008278688524590166, 0.010071889808687048)
2026-05-22 23:45:33,044 - optuna.study.study - INFO - Trial 3 finished with values: [0.008140036580730637, 0.008278688524590166, 0.010071889808687048] and parameters: {'n_layers': 3, 'embedding_dim': 128, 'lr': 3.328770811653986e-05, 'lambda_val': 0.00023986489473645103, 'batch_size': 2851, 'optimizer': 'Adam'}.
2026-05-22 23:45:45,849 - experiment_functions - INFO - Early stopping at epoch 3900. Best Metrics: (0.005157177411530314, 0.006229508196721311, 0.006850768621282007)
2026-05-22 23:45:46,026 - optuna.study.study - INFO - Trial 4 finished with values: [0.005157177411530314, 0.006229508196721311, 0.006850768621282007] and parameters: {'n_layers': 2, 'embedding_dim': 256, 'lr': 2.6060588144348295e-05, 'lambda_val': 1.1768503186882487e-06, 'batch_size': 2587, 'optimizer': 'RMSprop'}.
2026-05-22 23:45:49,965 - experiment_functions - INFO - Early stopping at epoch 1450. Best Metrics: (0.00236736480439798, 0.001639344262295082, 0.0024527210128995995)
2026-05-22 23:45:50,510 - optuna.study.study - INFO - Trial 5 finished with values: [0.00236736480439798, 0.001639344262295082, 0.0024527210128995995] and parameters: {'n_layers': 2, 'embedding_dim': 32, 'lr': 1.7505605166860213e-05, 'lambda_val': 4.624053967722746e-05, 'batch_size': 1468, 'optimizer': 'Adam'}.
2026-05-22 23:45:53,076 - experiment_functions - INFO - Early stopping at epoch 500. Best Metrics: (0.0025232182779370673, 0.002131147540983607, 0.0022728015976441517)
2026-05-22 23:45:53,169 - optuna.study.study - INFO - Trial 6 finished with values: [0.0025232182779370673, 0.002131147540983607, 0.0022728015976441517] and parameters: {'n_layers': 3, 'embedding_dim': 256, 'lr': 0.023644922086958446, 'lambda_val': 0.00028548726518121717, 'batch_size': 2183, 'optimizer': 'SGD'}.
2026-05-22 23:45:55,609 - experiment_functions - INFO - Early stopping at epoch 550. Best Metrics: (0.006877235634339729, 0.007868852459016395, 0.009519722172580054)
2026-05-22 23:45:55,770 - optuna.study.study - INFO - Trial 7 finished with values: [0.006877235634339729, 0.007868852459016395, 0.009519722172580054] and parameters: {'n_layers': 4, 'embedding_dim': 96, 'lr': 0.0010357136596424467, 'lambda_val': 1.5257841801841251e-06, 'batch_size': 1686, 'optimizer': 'RMSprop'}.
2026-05-22 23:45:59,316 - experiment_functions - INFO - Early stopping at epoch 850. Best Metrics: (0.010352033235526746, 0.00959016393442623, 0.012207648230211901)
2026-05-22 23:45:59,986 - optuna.study.study - INFO - Trial 8 finished with values: [0.010352033235526746, 0.00959016393442623, 0.012207648230211901] and parameters: {'n_layers': 2, 'embedding_dim': 128, 'lr': 0.0002569617882019084, 'lambda_val': 0.0009600144450506561, 'batch_size': 2393, 'optimizer': 'Adam'}.
2026-05-22 23:46:02,560 - experiment_functions - INFO - Early stopping at epoch 500. Best Metrics: (0.0035817965909193086, 0.0018852459016393442, 0.00324789898613686)
2026-05-22 23:46:02,659 - optuna.study.study - INFO - Trial 9 finished with values: [0.0035817965909193086, 0.0018852459016393442, 0.00324789898613686] and parameters: {'n_layers': 4, 'embedding_dim': 64, 'lr': 0.0006523114556225972, 'lambda_val': 0.0045217143361813514, 'batch_size': 2218, 'optimizer': 'SGD'}.
2026-05-22 23:46:05,907 - experiment_functions - INFO - Early stopping at epoch 800. Best Metrics: (0.001909077200218686, 0.0015573770491803278, 0.001811775389003989)
2026-05-22 23:46:06,325 - optuna.study.study - INFO - Trial 10 finished with values: [0.001909077200218686, 0.0015573770491803278, 0.001811775389003989] and parameters: {'n_layers': 1, 'embedding_dim': 64, 'lr': 0.07027744775381183, 'lambda_val': 0.0065409860272209455, 'batch_size': 4061, 'optimizer': 'SGD'}.
2026-05-22 23:46:20,195 - optuna.study.study - INFO - Trial 11 finished with values: [0.015842726349690698, 0.014262295081967215, 0.01862724204514906] and parameters: {'n_layers': 4, 'embedding_dim': 96, 'lr': 0.016757203845338013, 'lambda_val': 2.590190399307384e-06, 'batch_size': 3526, 'optimizer': 'Adam'}.
2026-05-22 23:46:23,143 - experiment_functions - INFO - Early stopping at epoch 650. Best Metrics: (0.0038150888425411804, 0.007131147540983608, 0.006978024617317896)
2026-05-22 23:46:23,239 - optuna.study.study - INFO - Trial 12 finished with values: [0.0038150888425411804, 0.007131147540983608, 0.006978024617317896] and parameters: {'n_layers': 2, 'embedding_dim': 32, 'lr': 0.0008163219241937832, 'lambda_val': 0.05180299472836962, 'batch_size': 4068, 'optimizer': 'Adam'}.
2026-05-22 23:46:27,580 - experiment_functions - INFO - Early stopping at epoch 900. Best Metrics: (0.003512395076314867, 0.002213114754098361, 0.002989515224896404)
2026-05-22 23:46:28,670 - optuna.study.study - INFO - Trial 13 finished with values: [0.003512395076314867, 0.002213114754098361, 0.002989515224896404] and parameters: {'n_layers': 3, 'embedding_dim': 256, 'lr': 0.023326199382540633, 'lambda_val': 7.745965293213905e-06, 'batch_size': 1211, 'optimizer': 'SGD'}.
2026-05-22 23:46:37,898 - experiment_functions - INFO - Early stopping at epoch 2900. Best Metrics: (0.01296991456344786, 0.012622950819672133, 0.01770267231075689)
2026-05-22 23:46:38,164 - optuna.study.study - INFO - Trial 14 finished with values: [0.01296991456344786, 0.012622950819672133, 0.01770267231075689] and parameters: {'n_layers': 4, 'embedding_dim': 64, 'lr': 0.01852608372473555, 'lambda_val': 1.0988779505731458e-05, 'batch_size': 716, 'optimizer': 'Adam'}.
2026-05-22 23:46:40,686 - experiment_functions - INFO - Early stopping at epoch 550. Best Metrics: (0.00809279207054285, 0.00860655737704918, 0.010718635035348156)
2026-05-22 23:46:40,891 - optuna.study.study - INFO - Trial 15 finished with values: [0.00809279207054285, 0.00860655737704918, 0.010718635035348156] and parameters: {'n_layers': 1, 'embedding_dim': 32, 'lr': 0.0015424183837958855, 'lambda_val': 0.0018705788836218182, 'batch_size': 1042, 'optimizer': 'RMSprop'}.
2026-05-22 23:46:48,697 - experiment_functions - INFO - Early stopping at epoch 2450. Best Metrics: (0.01496353202507358, 0.015409836065573772, 0.021986106578540755)
2026-05-22 23:46:48,805 - optuna.study.study - INFO - Trial 16 finished with values: [0.01496353202507358, 0.015409836065573772, 0.021986106578540755] and parameters: {'n_layers': 2, 'embedding_dim': 32, 'lr': 0.032125088922163904, 'lambda_val': 7.367374344877376e-05, 'batch_size': 2552, 'optimizer': 'Adam'}.
2026-05-22 23:47:04,686 - optuna.study.study - INFO - Trial 17 finished with values: [0.002145149371582347, 0.0038524590163934434, 0.004598475565137493] and parameters: {'n_layers': 4, 'embedding_dim': 256, 'lr': 2.1064898678194487e-05, 'lambda_val': 1.620594028036075e-05, 'batch_size': 2060, 'optimizer': 'RMSprop'}.
2026-05-22 23:47:07,038 - experiment_functions - INFO - Early stopping at epoch 500. Best Metrics: (0.0010115477082454501, 0.0010655737704918036, 0.0012930192219472725)
2026-05-22 23:47:07,178 - optuna.study.study - INFO - Trial 18 finished with values: [0.0010115477082454501, 0.0010655737704918036, 0.0012930192219472725] and parameters: {'n_layers': 1, 'embedding_dim': 32, 'lr': 0.0017194474226062662, 'lambda_val': 1.665330484528702e-06, 'batch_size': 3860, 'optimizer': 'SGD'}.
2026-05-22 23:47:22,878 - optuna.study.study - INFO - Trial 19 finished with values: [0.006307717602679644, 0.006557377049180328, 0.007626937516971782] and parameters: {'n_layers': 2, 'embedding_dim': 256, 'lr': 2.627763050367707e-05, 'lambda_val': 0.004701762314715582, 'batch_size': 2736, 'optimizer': 'Adam'}.
2026-05-22 23:47:25,712 - experiment_functions - INFO - Early stopping at epoch 550. Best Metrics: (0.011439075585278992, 0.010245901639344262, 0.013130396046443202)
2026-05-22 23:47:25,820 - optuna.study.study - INFO - Trial 20 finished with values: [0.011439075585278992, 0.010245901639344262, 0.013130396046443202] and parameters: {'n_layers': 4, 'embedding_dim': 64, 'lr': 0.0034872026493997328, 'lambda_val': 9.956828255961624e-05, 'batch_size': 3969, 'optimizer': 'Adam'}.
2026-05-22 23:47:28,932 - experiment_functions - INFO - Early stopping at epoch 750. Best Metrics: (0.0061582862398203535, 0.00860655737704918, 0.009781577882031219)
2026-05-22 23:47:29,063 - optuna.study.study - INFO - Trial 21 finished with values: [0.0061582862398203535, 0.00860655737704918, 0.009781577882031219] and parameters: {'n_layers': 4, 'embedding_dim': 32, 'lr': 0.00038603420377640905, 'lambda_val': 0.009482701668518351, 'batch_size': 1982, 'optimizer': 'RMSprop'}.
2026-05-22 23:47:39,033 - experiment_functions - INFO - Early stopping at epoch 2900. Best Metrics: (0.017015177582540765, 0.012950819672131148, 0.016990213930062583)
2026-05-22 23:47:39,823 - optuna.study.study - INFO - Trial 22 finished with values: [0.017015177582540765, 0.012950819672131148, 0.016990213930062583] and parameters: {'n_layers': 4, 'embedding_dim': 32, 'lr': 0.02143903136401803, 'lambda_val': 0.0003143503113741062, 'batch_size': 2505, 'optimizer': 'Adam'}.
2026-05-22 23:47:42,335 - experiment_functions - INFO - Early stopping at epoch 500. Best Metrics: (0.0022726149535037877, 0.0018852459016393446, 0.002715177843887749)
2026-05-22 23:47:42,418 - optuna.study.study - INFO - Trial 23 finished with values: [0.0022726149535037877, 0.0018852459016393446, 0.002715177843887749] and parameters: {'n_layers': 4, 'embedding_dim': 64, 'lr': 6.617542185949929e-05, 'lambda_val': 0.030409667703848946, 'batch_size': 1763, 'optimizer': 'SGD'}.
2026-05-22 23:47:45,208 - experiment_functions - INFO - Early stopping at epoch 550. Best Metrics: (0.00900877090018618, 0.009180327868852459, 0.01133276538365929)
2026-05-22 23:47:45,341 - optuna.study.study - INFO - Trial 24 finished with values: [0.00900877090018618, 0.009180327868852459, 0.01133276538365929] and parameters: {'n_layers': 4, 'embedding_dim': 128, 'lr': 0.0015012790650110219, 'lambda_val': 2.0926872137727736e-06, 'batch_size': 2069, 'optimizer': 'Adam'}.
2026-05-22 23:47:50,810 - experiment_functions - INFO - Early stopping at epoch 1500. Best Metrics: (0.006513334936397659, 0.009836065573770493, 0.010839523171268392)
2026-05-22 23:47:51,253 - optuna.study.study - INFO - Trial 25 finished with values: [0.006513334936397659, 0.009836065573770493, 0.010839523171268392] and parameters: {'n_layers': 2, 'embedding_dim': 96, 'lr': 0.008919635780751861, 'lambda_val': 0.0007844384959792041, 'batch_size': 2647, 'optimizer': 'RMSprop'}.
2026-05-22 23:48:02,975 - optuna.study.study - INFO - Trial 26 finished with values: [0.0032968619199119586, 0.0036065573770491808, 0.00487379147408427] and parameters: {'n_layers': 3, 'embedding_dim': 64, 'lr': 2.2947416206114396e-05, 'lambda_val': 4.866311282133683e-06, 'batch_size': 1781, 'optimizer': 'RMSprop'}.
2026-05-22 23:48:05,163 - experiment_functions - INFO - Early stopping at epoch 500. Best Metrics: (0.0026025727217149704, 0.0017213114754098362, 0.0022845897741798934)
2026-05-22 23:48:05,312 - optuna.study.study - INFO - Trial 27 finished with values: [0.0026025727217149704, 0.0017213114754098362, 0.0022845897741798934] and parameters: {'n_layers': 1, 'embedding_dim': 32, 'lr': 1.2159655743158371e-05, 'lambda_val': 0.000501771331363437, 'batch_size': 2290, 'optimizer': 'SGD'}.
2026-05-22 23:48:08,375 - experiment_functions - INFO - Early stopping at epoch 800. Best Metrics: (0.002701931977067545, 0.0018852459016393442, 0.002513767385147653)
2026-05-22 23:48:08,510 - optuna.study.study - INFO - Trial 28 finished with values: [0.002701931977067545, 0.0018852459016393442, 0.002513767385147653] and parameters: {'n_layers': 2, 'embedding_dim': 32, 'lr': 0.0018467163642241881, 'lambda_val': 0.04545802711838999, 'batch_size': 971, 'optimizer': 'SGD'}.
2026-05-22 23:48:11,159 - experiment_functions - INFO - Early stopping at epoch 550. Best Metrics: (0.0073020521839405415, 0.009262295081967215, 0.010836253810400983)
2026-05-22 23:48:11,254 - optuna.study.study - INFO - Trial 29 finished with values: [0.0073020521839405415, 0.009262295081967215, 0.010836253810400983] and parameters: {'n_layers': 3, 'embedding_dim': 64, 'lr': 0.001034403930869181, 'lambda_val': 1.3004610683945288e-06, 'batch_size': 1657, 'optimizer': 'RMSprop'}.
2026-05-22 23:48:14,652 - experiment_functions - INFO - Early stopping at epoch 1000. Best Metrics: (0.004674573996065221, 0.007622950819672132, 0.007827940613429889)
2026-05-22 23:48:14,723 - optuna.study.study - INFO - Trial 30 finished with values: [0.004674573996065221, 0.007622950819672132, 0.007827940613429889] and parameters: {'n_layers': 1, 'embedding_dim': 64, 'lr': 0.050521999039995734, 'lambda_val': 0.09461361801265902, 'batch_size': 2985, 'optimizer': 'RMSprop'}.
2026-05-22 23:48:26,527 - optuna.study.study - INFO - Trial 31 finished with values: [0.005885255068250769, 0.007868852459016395, 0.00894734058672931] and parameters: {'n_layers': 4, 'embedding_dim': 32, 'lr': 5.091403630622509e-05, 'lambda_val': 5.5728013760561e-06, 'batch_size': 1272, 'optimizer': 'Adam'}.
2026-05-22 23:48:29,700 - experiment_functions - INFO - Early stopping at epoch 550. Best Metrics: (0.0071538747937902915, 0.009262295081967215, 0.010159170305986967)
2026-05-22 23:48:30,216 - optuna.study.study - INFO - Trial 32 finished with values: [0.0071538747937902915, 0.009262295081967215, 0.010159170305986967] and parameters: {'n_layers': 4, 'embedding_dim': 256, 'lr': 0.0025255710774305645, 'lambda_val': 0.0002544213702887892, 'batch_size': 1954, 'optimizer': 'Adam'}.
2026-05-22 23:48:46,763 - optuna.study.study - INFO - Trial 33 finished with values: [0.00224726505552347, 0.002459016393442623, 0.002745039526574422] and parameters: {'n_layers': 3, 'embedding_dim': 256, 'lr': 1.5577531866093316e-05, 'lambda_val': 4.753623138033071e-06, 'batch_size': 3558, 'optimizer': 'RMSprop'}.
2026-05-22 23:48:55,305 - experiment_functions - INFO - Early stopping at epoch 2750. Best Metrics: (0.004309935502783982, 0.002540983606557377, 0.004224002515396336)
2026-05-22 23:48:55,438 - optuna.study.study - INFO - Trial 34 finished with values: [0.004309935502783982, 0.002540983606557377, 0.004224002515396336] and parameters: {'n_layers': 3, 'embedding_dim': 32, 'lr': 2.4247768434294115e-05, 'lambda_val': 2.0112396730417335e-06, 'batch_size': 1382, 'optimizer': 'Adam'}.
2026-05-22 23:48:58,530 - experiment_functions - INFO - Early stopping at epoch 600. Best Metrics: (0.0063822237480004275, 0.008934426229508198, 0.010541902399328095)
2026-05-22 23:48:58,642 - optuna.study.study - INFO - Trial 35 finished with values: [0.0063822237480004275, 0.008934426229508198, 0.010541902399328095] and parameters: {'n_layers': 4, 'embedding_dim': 128, 'lr': 0.0005935175040388062, 'lambda_val': 1.0140665206256351e-06, 'batch_size': 3034, 'optimizer': 'Adam'}.
2026-05-22 23:49:01,966 - experiment_functions - INFO - Early stopping at epoch 500. Best Metrics: (0.0022296956640650224, 0.002459016393442623, 0.0031136689888503597)
2026-05-22 23:49:02,471 - optuna.study.study - INFO - Trial 36 finished with values: [0.0022296956640650224, 0.002459016393442623, 0.0031136689888503597] and parameters: {'n_layers': 2, 'embedding_dim': 64, 'lr': 1.0311797387784992e-05, 'lambda_val': 0.00197345537130382, 'batch_size': 942, 'optimizer': 'SGD'}.
2026-05-22 23:49:10,813 - experiment_functions - INFO - Early stopping at epoch 550. Best Metrics: (0.004991737835603768, 0.007540983606557377, 0.008099819553176527)
2026-05-22 23:49:11,180 - optuna.study.study - INFO - Trial 37 finished with values: [0.004991737835603768, 0.007540983606557377, 0.008099819553176527] and parameters: {'n_layers': 2, 'embedding_dim': 96, 'lr': 0.000629118282770242, 'lambda_val': 0.003433682134969518, 'batch_size': 3205, 'optimizer': 'RMSprop'}.
2026-05-22 23:49:20,999 - experiment_functions - INFO - Early stopping at epoch 1600. Best Metrics: (0.0024413156805827294, 0.0022950819672131148, 0.003373787461997515)
2026-05-22 23:49:21,222 - optuna.study.study - INFO - Trial 38 finished with values: [0.0024413156805827294, 0.0022950819672131148, 0.003373787461997515] and parameters: {'n_layers': 3, 'embedding_dim': 256, 'lr': 1.1068635231402115e-05, 'lambda_val': 8.357949029622283e-05, 'batch_size': 2794, 'optimizer': 'RMSprop'}.
2026-05-22 23:49:27,521 - experiment_functions - INFO - Early stopping at epoch 1900. Best Metrics: (0.011880170758394327, 0.013360655737704922, 0.015743304305087004)
2026-05-22 23:49:27,597 - optuna.study.study - INFO - Trial 39 finished with values: [0.011880170758394327, 0.013360655737704922, 0.015743304305087004] and parameters: {'n_layers': 2, 'embedding_dim': 64, 'lr': 0.0602894258387779, 'lambda_val': 0.0005183974282222809, 'batch_size': 2360, 'optimizer': 'Adam'}.
2026-05-22 23:49:30,771 - experiment_functions - INFO - Early stopping at epoch 800. Best Metrics: (0.0050956054170668424, 0.009098360655737705, 0.009589387583193982)
2026-05-22 23:49:31,188 - optuna.study.study - INFO - Trial 40 finished with values: [0.0050956054170668424, 0.009098360655737705, 0.009589387583193982] and parameters: {'n_layers': 1, 'embedding_dim': 96, 'lr': 0.0018742346468367153, 'lambda_val': 5.160671986054495e-05, 'batch_size': 1815, 'optimizer': 'RMSprop'}.
2026-05-22 23:49:34,059 - experiment_functions - INFO - Early stopping at epoch 750. Best Metrics: (0.002200331915181196, 0.0019672131147540984, 0.0025466411846844167)
2026-05-22 23:49:34,152 - optuna.study.study - INFO - Trial 41 finished with values: [0.002200331915181196, 0.0019672131147540984, 0.0025466411846844167] and parameters: {'n_layers': 3, 'embedding_dim': 32, 'lr': 1.5070890207807546e-05, 'lambda_val': 0.08678876875199347, 'batch_size': 1156, 'optimizer': 'RMSprop'}.
2026-05-22 23:49:38,571 - experiment_functions - INFO - Early stopping at epoch 1000. Best Metrics: (0.007006356236553424, 0.008688524590163935, 0.010838293496545352)
2026-05-22 23:49:38,661 - optuna.study.study - INFO - Trial 42 finished with values: [0.007006356236553424, 0.008688524590163935, 0.010838293496545352] and parameters: {'n_layers': 1, 'embedding_dim': 256, 'lr': 0.00014250542592028934, 'lambda_val': 0.00873796310430859, 'batch_size': 2498, 'optimizer': 'RMSprop'}.
2026-05-22 23:49:41,090 - experiment_functions - INFO - Early stopping at epoch 550. Best Metrics: (0.004576052614168456, 0.007377049180327869, 0.007698828789038583)
