2026-05-23 01:54:41,135 - optuna.study.study - INFO - Trial 187 finished with values: [0.021558579220495127, 0.013524590163934426, 0.020547397856802294] and parameters: {'n_layers': 3, 'embedding_dim': 128, 'lr': 0.0038879627229032143, 'lambda_val': 3.317665133673459e-05, 'batch_size': 728, 'optimizer': 'RMSprop'}.
2026-05-23 01:54:50,143 - experiment_functions - INFO - Early stopping at epoch 1250. Best Metrics: (0.03622746899324999, 0.021475409836065575, 0.033674741544698746)
2026-05-23 01:54:50,427 - optuna.study.study - INFO - Trial 188 finished with values: [0.03622746899324999, 0.021475409836065575, 0.033674741544698746] and parameters: {'n_layers': 1, 'embedding_dim': 64, 'lr': 0.0013488534539100193, 'lambda_val': 0.001138541292442641, 'batch_size': 733, 'optimizer': 'Adam'}.
2026-05-23 01:54:52,956 - experiment_functions - INFO - Early stopping at epoch 550. Best Metrics: (0.023723682602751973, 0.015655737704918033, 0.022958368831783555)
2026-05-23 01:54:53,050 - optuna.study.study - INFO - Trial 189 finished with values: [0.023723682602751973, 0.015655737704918033, 0.022958368831783555] and parameters: {'n_layers': 2, 'embedding_dim': 256, 'lr': 0.004412673482764488, 'lambda_val': 0.0029444127697785846, 'batch_size': 1056, 'optimizer': 'Adam'}.
2026-05-23 01:54:55,165 - experiment_functions - INFO - Early stopping at epoch 550. Best Metrics: (0.024175908884471534, 0.014672131147540983, 0.02024916499811026)
2026-05-23 01:54:55,262 - optuna.study.study - INFO - Trial 190 finished with values: [0.024175908884471534, 0.014672131147540983, 0.02024916499811026] and parameters: {'n_layers': 1, 'embedding_dim': 128, 'lr': 0.016630265747118476, 'lambda_val': 2.93627524432445e-06, 'batch_size': 2160, 'optimizer': 'Adam'}.
2026-05-23 01:54:57,894 - experiment_functions - INFO - Early stopping at epoch 750. Best Metrics: (0.021175873364725706, 0.014426229508196723, 0.019062719125275216)
2026-05-23 01:54:57,983 - optuna.study.study - INFO - Trial 191 finished with values: [0.021175873364725706, 0.014426229508196723, 0.019062719125275216] and parameters: {'n_layers': 1, 'embedding_dim': 128, 'lr': 0.0013488534539100193, 'lambda_val': 0.04091488268426768, 'batch_size': 733, 'optimizer': 'Adam'}.
2026-05-23 01:55:00,987 - experiment_functions - INFO - Early stopping at epoch 700. Best Metrics: (0.033191337749639616, 0.018770491803278687, 0.02962305367442199)
2026-05-23 01:55:01,079 - optuna.study.study - INFO - Trial 192 finished with values: [0.033191337749639616, 0.018770491803278687, 0.02962305367442199] and parameters: {'n_layers': 1, 'embedding_dim': 96, 'lr': 0.0020363221304348245, 'lambda_val': 0.001138541292442641, 'batch_size': 2893, 'optimizer': 'Adam'}.
2026-05-23 01:55:16,073 - optuna.study.study - INFO - Trial 193 finished with values: [0.027777453532130358, 0.01721311475409836, 0.027616732919119754] and parameters: {'n_layers': 3, 'embedding_dim': 256, 'lr': 0.00012667151006330983, 'lambda_val': 0.0029444127697785846, 'batch_size': 833, 'optimizer': 'RMSprop'}.
2026-05-23 01:55:28,060 - optuna.study.study - INFO - Trial 194 finished with values: [0.027757398087542046, 0.01721311475409836, 0.025636197763634957] and parameters: {'n_layers': 1, 'embedding_dim': 256, 'lr': 0.0002669734398444981, 'lambda_val': 0.003970365783082511, 'batch_size': 833, 'optimizer': 'Adam'}.
2026-05-23 01:55:40,620 - optuna.study.study - INFO - Trial 195 finished with values: [0.015027366270513612, 0.009754098360655739, 0.013915653323339057] and parameters: {'n_layers': 3, 'embedding_dim': 128, 'lr': 6.639918285744861e-05, 'lambda_val': 6.3998980027240765e-06, 'batch_size': 1631, 'optimizer': 'RMSprop'}.
2026-05-23 01:55:53,370 - optuna.study.study - INFO - Trial 196 finished with values: [0.01898643794040116, 0.012049180327868853, 0.017719258254470422] and parameters: {'n_layers': 1, 'embedding_dim': 256, 'lr': 0.00012667151006330983, 'lambda_val': 3.7205125829824535e-06, 'batch_size': 2578, 'optimizer': 'Adam'}.
2026-05-23 01:55:56,079 - experiment_functions - INFO - Early stopping at epoch 600. Best Metrics: (0.03223165839793684, 0.02, 0.030247412899352507)
2026-05-23 01:55:56,168 - optuna.study.study - INFO - Trial 197 finished with values: [0.03223165839793684, 0.02, 0.030247412899352507] and parameters: {'n_layers': 3, 'embedding_dim': 128, 'lr': 0.0022564826852050435, 'lambda_val': 3.7205125829824535e-06, 'batch_size': 1475, 'optimizer': 'Adam'}.
2026-05-23 01:55:59,488 - experiment_functions - INFO - Early stopping at epoch 900. Best Metrics: (0.028669996171970955, 0.01836065573770492, 0.026587349193735645)
2026-05-23 01:55:59,583 - optuna.study.study - INFO - Trial 198 finished with values: [0.028669996171970955, 0.01836065573770492, 0.026587349193735645] and parameters: {'n_layers': 1, 'embedding_dim': 128, 'lr': 0.0022564826852050435, 'lambda_val': 0.0033582080301553614, 'batch_size': 728, 'optimizer': 'Adam'}.
2026-05-23 01:56:02,879 - experiment_functions - INFO - Early stopping at epoch 950. Best Metrics: (0.015854732017706007, 0.012540983606557376, 0.014840910359310963)
2026-05-23 01:56:02,973 - optuna.study.study - INFO - Trial 199 finished with values: [0.015854732017706007, 0.012540983606557376, 0.014840910359310963] and parameters: {'n_layers': 1, 'embedding_dim': 32, 'lr': 0.0013488534539100193, 'lambda_val': 0.07601058695474548, 'batch_size': 733, 'optimizer': 'Adam'}.
2026-05-23 01:56:05,971 - experiment_functions - INFO - Early stopping at epoch 750. Best Metrics: (0.029269626829106773, 0.01860655737704918, 0.025464835680604515)
2026-05-23 01:56:06,059 - optuna.study.study - INFO - Trial 200 finished with values: [0.029269626829106773, 0.01860655737704918, 0.025464835680604515] and parameters: {'n_layers': 1, 'embedding_dim': 128, 'lr': 0.0022564826852050435, 'lambda_val': 0.01459437896938573, 'batch_size': 728, 'optimizer': 'Adam'}.
2026-05-23 01:56:10,336 - experiment_functions - INFO - Early stopping at epoch 1150. Best Metrics: (0.023611112874614613, 0.015491803278688524, 0.02374587895124449)
2026-05-23 01:56:11,469 - optuna.study.study - INFO - Trial 201 finished with values: [0.023611112874614613, 0.015491803278688524, 0.02374587895124449] and parameters: {'n_layers': 2, 'embedding_dim': 96, 'lr': 0.00043748821652125875, 'lambda_val': 0.001138541292442641, 'batch_size': 3801, 'optimizer': 'Adam'}.
2026-05-23 01:56:14,964 - experiment_functions - INFO - Early stopping at epoch 900. Best Metrics: (0.03618084939756917, 0.020245901639344262, 0.03202977627281135)
2026-05-23 01:56:15,064 - optuna.study.study - INFO - Trial 202 finished with values: [0.03618084939756917, 0.020245901639344262, 0.03202977627281135] and parameters: {'n_layers': 3, 'embedding_dim': 128, 'lr': 0.0006111868479200038, 'lambda_val': 3.7205125829824535e-06, 'batch_size': 728, 'optimizer': 'Adam'}.
2026-05-23 01:56:22,684 - experiment_functions - INFO - Early stopping at epoch 2800. Best Metrics: (0.010066020522023626, 0.007459016393442624, 0.0097786448811379)
2026-05-23 01:56:22,780 - optuna.study.study - INFO - Trial 203 finished with values: [0.010066020522023626, 0.007459016393442624, 0.0097786448811379] and parameters: {'n_layers': 1, 'embedding_dim': 64, 'lr': 0.00012667151006330983, 'lambda_val': 3.7205125829824535e-06, 'batch_size': 2578, 'optimizer': 'RMSprop'}.
2026-05-23 01:56:27,945 - experiment_functions - INFO - Early stopping at epoch 1050. Best Metrics: (0.02792801354578528, 0.016885245901639347, 0.026159358587977494)
2026-05-23 01:56:28,192 - optuna.study.study - INFO - Trial 204 finished with values: [0.02792801354578528, 0.016885245901639347, 0.026159358587977494] and parameters: {'n_layers': 4, 'embedding_dim': 256, 'lr': 0.0002669734398444981, 'lambda_val': 0.00038573936819964353, 'batch_size': 1493, 'optimizer': 'Adam'}.
2026-05-23 01:56:32,078 - experiment_functions - INFO - Early stopping at epoch 950. Best Metrics: (0.027068063136816003, 0.016475409836065574, 0.022417789467792992)
2026-05-23 01:56:32,178 - optuna.study.study - INFO - Trial 205 finished with values: [0.027068063136816003, 0.016475409836065574, 0.022417789467792992] and parameters: {'n_layers': 1, 'embedding_dim': 64, 'lr': 0.0013488534539100193, 'lambda_val': 0.0005795183242806687, 'batch_size': 3696, 'optimizer': 'Adam'}.
2026-05-23 01:56:36,886 - experiment_functions - INFO - Early stopping at epoch 1450. Best Metrics: (0.035001432725098466, 0.019672131147540985, 0.028903386381679646)
2026-05-23 01:56:37,473 - optuna.study.study - INFO - Trial 206 finished with values: [0.035001432725098466, 0.019672131147540985, 0.028903386381679646] and parameters: {'n_layers': 1, 'embedding_dim': 128, 'lr': 0.0006111868479200038, 'lambda_val': 0.0017105841747060543, 'batch_size': 728, 'optimizer': 'RMSprop'}.
2026-05-23 01:56:41,054 - experiment_functions - INFO - Early stopping at epoch 1050. Best Metrics: (0.03694438254039185, 0.01901639344262295, 0.030015869518025883)
2026-05-23 01:56:41,156 - optuna.study.study - INFO - Trial 207 finished with values: [0.03694438254039185, 0.01901639344262295, 0.030015869518025883] and parameters: {'n_layers': 1, 'embedding_dim': 32, 'lr': 0.0018860187490457373, 'lambda_val': 0.001138541292442641, 'batch_size': 728, 'optimizer': 'Adam'}.
2026-05-23 01:56:47,399 - experiment_functions - INFO - Early stopping at epoch 1800. Best Metrics: (0.036868831364979614, 0.01975409836065574, 0.030538444191907526)
2026-05-23 01:56:47,623 - optuna.study.study - INFO - Trial 208 finished with values: [0.036868831364979614, 0.01975409836065574, 0.030538444191907526] and parameters: {'n_layers': 3, 'embedding_dim': 128, 'lr': 0.000302020510284504, 'lambda_val': 0.0005985360677675016, 'batch_size': 733, 'optimizer': 'Adam'}.
2026-05-23 01:56:53,893 - experiment_functions - INFO - Early stopping at epoch 600. Best Metrics: (0.022088944148778388, 0.01459016393442623, 0.020843180093961786)
2026-05-23 01:56:54,351 - optuna.study.study - INFO - Trial 209 finished with values: [0.022088944148778388, 0.01459016393442623, 0.020843180093961786] and parameters: {'n_layers': 3, 'embedding_dim': 32, 'lr': 0.002966327242338245, 'lambda_val': 1.2922176688378956e-05, 'batch_size': 1200, 'optimizer': 'Adam'}.
2026-05-23 01:57:02,393 - experiment_functions - INFO - Early stopping at epoch 650. Best Metrics: (0.03334483936307984, 0.020000000000000004, 0.028566219455174513)
2026-05-23 01:57:02,490 - optuna.study.study - INFO - Trial 210 finished with values: [0.03334483936307984, 0.020000000000000004, 0.028566219455174513] and parameters: {'n_layers': 3, 'embedding_dim': 64, 'lr': 0.0020363221304348245, 'lambda_val': 1.2088183506469562e-05, 'batch_size': 733, 'optimizer': 'Adam'}.
2026-05-23 01:57:04,929 - experiment_functions - INFO - Early stopping at epoch 550. Best Metrics: (0.02545348298203315, 0.016311475409836063, 0.02323017577474611)
2026-05-23 01:57:05,022 - optuna.study.study - INFO - Trial 211 finished with values: [0.02545348298203315, 0.016311475409836063, 0.02323017577474611] and parameters: {'n_layers': 3, 'embedding_dim': 64, 'lr': 0.009455185494500208, 'lambda_val': 0.001138541292442641, 'batch_size': 733, 'optimizer': 'Adam'}.
2026-05-23 01:57:16,786 - optuna.study.study - INFO - Trial 212 finished with values: [0.013250846294711028, 0.010901639344262295, 0.014758356166571654] and parameters: {'n_layers': 1, 'embedding_dim': 128, 'lr': 0.00012667151006330983, 'lambda_val': 3.7205125829824535e-06, 'batch_size': 2578, 'optimizer': 'RMSprop'}.
2026-05-23 01:57:19,815 - experiment_functions - INFO - Early stopping at epoch 800. Best Metrics: (0.030576486668763163, 0.015409836065573768, 0.02502359649246857)
2026-05-23 01:57:19,987 - optuna.study.study - INFO - Trial 213 finished with values: [0.030576486668763163, 0.015409836065573768, 0.02502359649246857] and parameters: {'n_layers': 1, 'embedding_dim': 32, 'lr': 0.0018860187490457373, 'lambda_val': 0.002934629856065645, 'batch_size': 3696, 'optimizer': 'Adam'}.
2026-05-23 01:57:22,227 - experiment_functions - INFO - Early stopping at epoch 650. Best Metrics: (0.030057372323000073, 0.017049180327868854, 0.026198532229836317)
2026-05-23 01:57:22,332 - optuna.study.study - INFO - Trial 214 finished with values: [0.030057372323000073, 0.017049180327868854, 0.026198532229836317] and parameters: {'n_layers': 1, 'embedding_dim': 96, 'lr': 0.0020363221304348245, 'lambda_val': 0.001138541292442641, 'batch_size': 2893, 'optimizer': 'RMSprop'}.
2026-05-23 01:57:25,407 - experiment_functions - INFO - Early stopping at epoch 750. Best Metrics: (0.028185325451700435, 0.017786885245901638, 0.02679868854182932)
2026-05-23 01:57:26,148 - optuna.study.study - INFO - Trial 215 finished with values: [0.028185325451700435, 0.017786885245901638, 0.02679868854182932] and parameters: {'n_layers': 1, 'embedding_dim': 256, 'lr': 0.0016673009325501693, 'lambda_val': 2.2024563054207274e-05, 'batch_size': 3696, 'optimizer': 'Adam'}.
2026-05-23 01:57:31,860 - experiment_functions - INFO - Early stopping at epoch 1800. Best Metrics: (0.011443533220020901, 0.008688524590163936, 0.010626244806982012)
2026-05-23 01:57:32,279 - optuna.study.study - INFO - Trial 216 finished with values: [0.011443533220020901, 0.008688524590163936, 0.010626244806982012] and parameters: {'n_layers': 2, 'embedding_dim': 32, 'lr': 0.0393619276250865, 'lambda_val': 0.001138541292442641, 'batch_size': 3815, 'optimizer': 'RMSprop'}.
2026-05-23 01:57:34,704 - experiment_functions - INFO - Early stopping at epoch 550. Best Metrics: (0.02443453413738231, 0.015000000000000003, 0.02251483907878407)
2026-05-23 01:57:34,795 - optuna.study.study - INFO - Trial 217 finished with values: [0.02443453413738231, 0.015000000000000003, 0.02251483907878407] and parameters: {'n_layers': 1, 'embedding_dim': 128, 'lr': 0.00916366589660171, 'lambda_val': 0.0022435114946451214, 'batch_size': 3801, 'optimizer': 'Adam'}.
2026-05-23 01:57:37,649 - experiment_functions - INFO - Early stopping at epoch 750. Best Metrics: (0.017227877725853113, 0.013770491803278693, 0.017035257818062994)
2026-05-23 01:57:37,727 - optuna.study.study - INFO - Trial 218 finished with values: [0.017227877725853113, 0.013770491803278693, 0.017035257818062994] and parameters: {'n_layers': 1, 'embedding_dim': 96, 'lr': 0.0006111868479200038, 'lambda_val': 0.036874101021637164, 'batch_size': 2925, 'optimizer': 'RMSprop'}.
2026-05-23 01:57:41,006 - experiment_functions - INFO - Early stopping at epoch 950. Best Metrics: (0.03113474129940383, 0.018770491803278687, 0.029661171165501415)
2026-05-23 01:57:41,165 - optuna.study.study - INFO - Trial 219 finished with values: [0.03113474129940383, 0.018770491803278687, 0.029661171165501415] and parameters: {'n_layers': 1, 'embedding_dim': 64, 'lr': 0.0013488534539100193, 'lambda_val': 0.001138541292442641, 'batch_size': 733, 'optimizer': 'Adam'}.
2026-05-23 01:57:53,112 - experiment_functions - INFO - Early stopping at epoch 3300. Best Metrics: (0.019188515032667733, 0.011721311475409836, 0.02003476475763139)
2026-05-23 01:57:53,412 - optuna.study.study - INFO - Trial 220 finished with values: [0.019188515032667733, 0.011721311475409836, 0.02003476475763139] and parameters: {'n_layers': 1, 'embedding_dim': 256, 'lr': 0.00012667151006330983, 'lambda_val': 0.0017105841747060543, 'batch_size': 2578, 'optimizer': 'RMSprop'}.
2026-05-23 01:57:57,748 - experiment_functions - INFO - Early stopping at epoch 700. Best Metrics: (0.031984161977035235, 0.019508196721311474, 0.026970368669709772)
2026-05-23 01:57:58,436 - optuna.study.study - INFO - Trial 221 finished with values: [0.031984161977035235, 0.019508196721311474, 0.026970368669709772] and parameters: {'n_layers': 3, 'embedding_dim': 64, 'lr': 0.0013488534539100193, 'lambda_val': 2.2024563054207274e-05, 'batch_size': 833, 'optimizer': 'Adam'}.
2026-05-23 01:58:06,396 - experiment_functions - INFO - Early stopping at epoch 1950. Best Metrics: (0.011521954224527422, 0.00877049180327869, 0.010697260126726027)
2026-05-23 01:58:07,677 - optuna.study.study - INFO - Trial 222 finished with values: [0.011521954224527422, 0.00877049180327869, 0.010697260126726027] and parameters: {'n_layers': 3, 'embedding_dim': 256, 'lr': 0.0002669734398444981, 'lambda_val': 0.05272283951709805, 'batch_size': 833, 'optimizer': 'Adam'}.
2026-05-23 01:58:11,023 - experiment_functions - INFO - Early stopping at epoch 800. Best Metrics: (0.03558419565095306, 0.020081967213114754, 0.02718099068464169)
2026-05-23 01:58:11,098 - optuna.study.study - INFO - Trial 223 finished with values: [0.03558419565095306, 0.020081967213114754, 0.02718099068464169] and parameters: {'n_layers': 1, 'embedding_dim': 256, 'lr': 0.0013488534539100193, 'lambda_val': 0.001138541292442641, 'batch_size': 2619, 'optimizer': 'Adam'}.
2026-05-23 01:58:23,452 - optuna.study.study - INFO - Trial 224 finished with values: [0.002430259762559513, 0.002377049180327869, 0.003091293282429807] and parameters: {'n_layers': 3, 'embedding_dim': 128, 'lr': 2.6982305523044483e-05, 'lambda_val': 2.093095368912283e-06, 'batch_size': 733, 'optimizer': 'Adam'}.
2026-05-23 01:58:27,033 - experiment_functions - INFO - Early stopping at epoch 900. Best Metrics: (0.036208559985475064, 0.018278688524590164, 0.03126399044831634)
2026-05-23 01:58:27,415 - optuna.study.study - INFO - Trial 225 finished with values: [0.036208559985475064, 0.018278688524590164, 0.03126399044831634] and parameters: {'n_layers': 3, 'embedding_dim': 128, 'lr': 0.0006111868479200038, 'lambda_val': 3.7205125829824535e-06, 'batch_size': 728, 'optimizer': 'Adam'}.
2026-05-23 01:58:33,254 - experiment_functions - INFO - Early stopping at epoch 1800. Best Metrics: (0.03180369731025993, 0.019262295081967213, 0.029540791595971738)
2026-05-23 01:58:34,137 - optuna.study.study - INFO - Trial 226 finished with values: [0.03180369731025993, 0.019262295081967213, 0.029540791595971738] and parameters: {'n_layers': 1, 'embedding_dim': 256, 'lr': 0.00036519209261400785, 'lambda_val': 0.00038573936819964353, 'batch_size': 1493, 'optimizer': 'RMSprop'}.
2026-05-23 01:58:36,635 - experiment_functions - INFO - Early stopping at epoch 750. Best Metrics: (0.04133856970230675, 0.020245901639344265, 0.03434365871882878)
2026-05-23 01:58:36,725 - optuna.study.study - INFO - Trial 227 finished with values: [0.04133856970230675, 0.020245901639344265, 0.03434365871882878] and parameters: {'n_layers': 2, 'embedding_dim': 64, 'lr': 0.0013488534539100193, 'lambda_val': 0.001138541292442641, 'batch_size': 1549, 'optimizer': 'Adam'}.
2026-05-23 01:58:43,222 - experiment_functions - INFO - Early stopping at epoch 550. Best Metrics: (0.009255110111032257, 0.006147540983606558, 0.007933808457823611)
2026-05-23 01:58:43,741 - optuna.study.study - INFO - Trial 228 finished with values: [0.009255110111032257, 0.006147540983606558, 0.007933808457823611] and parameters: {'n_layers': 2, 'embedding_dim': 256, 'lr': 0.06078538356788004, 'lambda_val': 0.0029444127697785846, 'batch_size': 1056, 'optimizer': 'Adam'}.
2026-05-23 01:58:51,331 - experiment_functions - INFO - Early stopping at epoch 750. Best Metrics: (0.02657978609793472, 0.01672131147540984, 0.02540710036136909)
2026-05-23 01:58:51,934 - optuna.study.study - INFO - Trial 229 finished with values: [0.02657978609793472, 0.01672131147540984, 0.02540710036136909] and parameters: {'n_layers': 1, 'embedding_dim': 128, 'lr': 0.0018860187490457373, 'lambda_val': 0.022821085889920392, 'batch_size': 728, 'optimizer': 'Adam'}.
2026-05-23 01:58:55,703 - experiment_functions - INFO - Early stopping at epoch 850. Best Metrics: (0.008158180832821283, 0.006803278688524591, 0.008071768112759151)
2026-05-23 01:58:56,920 - optuna.study.study - INFO - Trial 230 finished with values: [0.008158180832821283, 0.006803278688524591, 0.008071768112759151] and parameters: {'n_layers': 3, 'embedding_dim': 128, 'lr': 0.0006111868479200038, 'lambda_val': 0.09061903467798961, 'batch_size': 728, 'optimizer': 'Adam'}.
2026-05-23 01:58:59,664 - experiment_functions - INFO - Early stopping at epoch 800. Best Metrics: (0.03081903525564688, 0.018524590163934426, 0.028207429492528822)
2026-05-23 01:58:59,751 - optuna.study.study - INFO - Trial 231 finished with values: [0.03081903525564688, 0.018524590163934426, 0.028207429492528822] and parameters: {'n_layers': 2, 'embedding_dim': 96, 'lr': 0.0006111868479200038, 'lambda_val': 0.0017105841747060543, 'batch_size': 3166, 'optimizer': 'RMSprop'}.
2026-05-23 01:59:06,898 - experiment_functions - INFO - Early stopping at epoch 1750. Best Metrics: (0.03367763321943584, 0.019262295081967216, 0.0300115347199758)
2026-05-23 01:59:07,169 - optuna.study.study - INFO - Trial 232 finished with values: [0.03367763321943584, 0.019262295081967216, 0.0300115347199758] and parameters: {'n_layers': 3, 'embedding_dim': 256, 'lr': 0.0002669734398444981, 'lambda_val': 3.7205125829824535e-06, 'batch_size': 728, 'optimizer': 'Adam'}.
2026-05-23 01:59:17,606 - experiment_functions - INFO - Early stopping at epoch 2700. Best Metrics: (0.026797444058999753, 0.018442622950819672, 0.02670070762031314)
2026-05-23 01:59:17,699 - optuna.study.study - INFO - Trial 233 finished with values: [0.026797444058999753, 0.018442622950819672, 0.02670070762031314] and parameters: {'n_layers': 3, 'embedding_dim': 256, 'lr': 0.000171992203307018, 'lambda_val': 3.7205125829824535e-06, 'batch_size': 1493, 'optimizer': 'RMSprop'}.
2026-05-23 01:59:19,995 - experiment_functions - INFO - Early stopping at epoch 650. Best Metrics: (0.027935276290046964, 0.016639344262295085, 0.024161287181000024)
2026-05-23 01:59:20,078 - optuna.study.study - INFO - Trial 234 finished with values: [0.027935276290046964, 0.016639344262295085, 0.024161287181000024] and parameters: {'n_layers': 4, 'embedding_dim': 32, 'lr': 0.0021679791502810398, 'lambda_val': 0.001138541292442641, 'batch_size': 733, 'optimizer': 'Adam'}.
2026-05-23 01:59:28,241 - experiment_functions - INFO - Early stopping at epoch 2300. Best Metrics: (0.03209213283889902, 0.018934426229508198, 0.028611419894919034)
