2026-05-22 23:53:26,302 - optuna.study.study - INFO - Trial 89 finished with values: [0.014020443549971905, 0.011639344262295083, 0.016192430469158484] and parameters: {'n_layers': 3, 'embedding_dim': 256, 'lr': 0.06796687548548233, 'lambda_val': 3.7696639076813204e-06, 'batch_size': 3969, 'optimizer': 'Adam'}.
2026-05-22 23:53:28,649 - experiment_functions - INFO - Early stopping at epoch 500. Best Metrics: (0.0022953874100507567, 0.0017213114754098362, 0.002715565656084982)
2026-05-22 23:53:28,742 - optuna.study.study - INFO - Trial 90 finished with values: [0.0022953874100507567, 0.0017213114754098362, 0.002715565656084982] and parameters: {'n_layers': 1, 'embedding_dim': 64, 'lr': 0.0006693247579890929, 'lambda_val': 8.019970575757968e-05, 'batch_size': 2985, 'optimizer': 'SGD'}.
2026-05-22 23:53:31,805 - experiment_functions - INFO - Early stopping at epoch 550. Best Metrics: (0.006752654919254842, 0.008114754098360656, 0.008959683111772537)
2026-05-22 23:53:31,896 - optuna.study.study - INFO - Trial 91 finished with values: [0.006752654919254842, 0.008114754098360656, 0.008959683111772537] and parameters: {'n_layers': 3, 'embedding_dim': 256, 'lr': 0.00038603420377640905, 'lambda_val': 0.009482701668518351, 'batch_size': 2381, 'optimizer': 'RMSprop'}.
2026-05-22 23:53:37,961 - experiment_functions - INFO - Early stopping at epoch 1500. Best Metrics: (0.0035978906040388145, 0.006557377049180328, 0.007332871815129237)
2026-05-22 23:53:38,576 - optuna.study.study - INFO - Trial 92 finished with values: [0.0035978906040388145, 0.006557377049180328, 0.007332871815129237] and parameters: {'n_layers': 4, 'embedding_dim': 128, 'lr': 0.02143903136401803, 'lambda_val': 0.0011900697866601866, 'batch_size': 3028, 'optimizer': 'Adam'}.
2026-05-22 23:53:41,677 - experiment_functions - INFO - Early stopping at epoch 550. Best Metrics: (0.00462319097948515, 0.007540983606557377, 0.007677296009001172)
2026-05-22 23:53:42,497 - optuna.study.study - INFO - Trial 93 finished with values: [0.00462319097948515, 0.007540983606557377, 0.007677296009001172] and parameters: {'n_layers': 4, 'embedding_dim': 256, 'lr': 0.0005935175040388062, 'lambda_val': 0.00019552406710701323, 'batch_size': 3034, 'optimizer': 'RMSprop'}.
2026-05-22 23:53:50,646 - experiment_functions - INFO - Early stopping at epoch 2350. Best Metrics: (0.010311434171139293, 0.013196721311475411, 0.014883072590851304)
2026-05-22 23:53:50,748 - optuna.study.study - INFO - Trial 94 finished with values: [0.010311434171139293, 0.013196721311475411, 0.014883072590851304] and parameters: {'n_layers': 3, 'embedding_dim': 96, 'lr': 0.006178111746348912, 'lambda_val': 2.0112396730417335e-06, 'batch_size': 2395, 'optimizer': 'RMSprop'}.
2026-05-22 23:53:53,881 - experiment_functions - INFO - Early stopping at epoch 550. Best Metrics: (0.00804130770800855, 0.00819672131147541, 0.009653056234955368)
2026-05-22 23:53:53,969 - optuna.study.study - INFO - Trial 95 finished with values: [0.00804130770800855, 0.00819672131147541, 0.009653056234955368] and parameters: {'n_layers': 3, 'embedding_dim': 64, 'lr': 0.001034403930869181, 'lambda_val': 0.002802498355712308, 'batch_size': 3460, 'optimizer': 'RMSprop'}.
2026-05-22 23:53:56,633 - experiment_functions - INFO - Early stopping at epoch 550. Best Metrics: (0.008691063709869242, 0.01, 0.011994309570618426)
2026-05-22 23:53:56,775 - optuna.study.study - INFO - Trial 96 finished with values: [0.008691063709869242, 0.01, 0.011994309570618426] and parameters: {'n_layers': 3, 'embedding_dim': 128, 'lr': 0.0034872026493997328, 'lambda_val': 0.00023986489473645103, 'batch_size': 3969, 'optimizer': 'Adam'}.
2026-05-22 23:54:00,245 - experiment_functions - INFO - Early stopping at epoch 850. Best Metrics: (0.00601516349138352, 0.008524590163934427, 0.009830477546007192)
2026-05-22 23:54:00,354 - optuna.study.study - INFO - Trial 97 finished with values: [0.00601516349138352, 0.008524590163934427, 0.009830477546007192] and parameters: {'n_layers': 4, 'embedding_dim': 32, 'lr': 0.00038603420377640905, 'lambda_val': 0.0003143503113741062, 'batch_size': 1982, 'optimizer': 'Adam'}.
2026-05-22 23:54:08,910 - experiment_functions - INFO - Early stopping at epoch 2750. Best Metrics: (0.001872939649157337, 0.0031147540983606555, 0.003748494856416592)
2026-05-22 23:54:09,581 - optuna.study.study - INFO - Trial 98 finished with values: [0.001872939649157337, 0.0031147540983606555, 0.003748494856416592] and parameters: {'n_layers': 2, 'embedding_dim': 32, 'lr': 3.328770811653986e-05, 'lambda_val': 0.00023986489473645103, 'batch_size': 2552, 'optimizer': 'Adam'}.
2026-05-22 23:54:11,765 - experiment_functions - INFO - Early stopping at epoch 550. Best Metrics: (0.009124818021907552, 0.009344262295081968, 0.011839444009205663)
2026-05-22 23:54:11,875 - optuna.study.study - INFO - Trial 99 finished with values: [0.009124818021907552, 0.009344262295081968, 0.011839444009205663] and parameters: {'n_layers': 3, 'embedding_dim': 32, 'lr': 0.001881283664806877, 'lambda_val': 0.002802498355712308, 'batch_size': 1291, 'optimizer': 'Adam'}.
2026-05-22 23:54:14,985 - experiment_functions - INFO - Early stopping at epoch 650. Best Metrics: (0.012216648678144669, 0.01237704918032787, 0.015722546866095283)
2026-05-22 23:54:15,075 - optuna.study.study - INFO - Trial 100 finished with values: [0.012216648678144669, 0.01237704918032787, 0.015722546866095283] and parameters: {'n_layers': 2, 'embedding_dim': 256, 'lr': 0.032125088922163904, 'lambda_val': 2.0926872137727736e-06, 'batch_size': 2123, 'optimizer': 'Adam'}.
2026-05-22 23:54:22,188 - experiment_functions - INFO - Early stopping at epoch 1550. Best Metrics: (0.0030894643826879843, 0.006147540983606557, 0.007563557947726984)
2026-05-22 23:54:23,243 - optuna.study.study - INFO - Trial 101 finished with values: [0.0030894643826879843, 0.006147540983606557, 0.007563557947726984] and parameters: {'n_layers': 4, 'embedding_dim': 96, 'lr': 0.02773153918226887, 'lambda_val': 0.06032752218215281, 'batch_size': 1660, 'optimizer': 'Adam'}.
2026-05-22 23:54:30,407 - experiment_functions - INFO - Early stopping at epoch 750. Best Metrics: (0.009693429212694445, 0.010737704918032788, 0.012813086145345414)
2026-05-22 23:54:30,499 - optuna.study.study - INFO - Trial 102 finished with values: [0.009693429212694445, 0.010737704918032788, 0.012813086145345414] and parameters: {'n_layers': 3, 'embedding_dim': 32, 'lr': 0.032125088922163904, 'lambda_val': 1.5257841801841251e-06, 'batch_size': 1657, 'optimizer': 'RMSprop'}.
2026-05-22 23:54:32,985 - experiment_functions - INFO - Early stopping at epoch 550. Best Metrics: (0.009730151516703006, 0.00778688524590164, 0.00948794177946095)
2026-05-22 23:54:33,499 - optuna.study.study - INFO - Trial 103 finished with values: [0.009730151516703006, 0.00778688524590164, 0.00948794177946095] and parameters: {'n_layers': 2, 'embedding_dim': 32, 'lr': 0.0031769402206672614, 'lambda_val': 0.0005183974282222809, 'batch_size': 2792, 'optimizer': 'Adam'}.
2026-05-22 23:54:36,599 - experiment_functions - INFO - Early stopping at epoch 700. Best Metrics: (0.007288127912063361, 0.009016393442622951, 0.01016546005209229)
2026-05-22 23:54:36,764 - optuna.study.study - INFO - Trial 104 finished with values: [0.007288127912063361, 0.009016393442622951, 0.01016546005209229] and parameters: {'n_layers': 4, 'embedding_dim': 64, 'lr': 0.00027781556769439117, 'lambda_val': 8.019970575757968e-05, 'batch_size': 1687, 'optimizer': 'RMSprop'}.
2026-05-22 23:54:39,063 - experiment_functions - INFO - Early stopping at epoch 550. Best Metrics: (0.006390951296291047, 0.00778688524590164, 0.00804687035075432)
2026-05-22 23:54:39,182 - optuna.study.study - INFO - Trial 105 finished with values: [0.006390951296291047, 0.00778688524590164, 0.00804687035075432] and parameters: {'n_layers': 2, 'embedding_dim': 96, 'lr': 0.0014804985061135636, 'lambda_val': 0.0017221611941405045, 'batch_size': 2552, 'optimizer': 'Adam'}.
2026-05-22 23:54:41,927 - experiment_functions - INFO - Early stopping at epoch 550. Best Metrics: (0.008462324104109787, 0.00959016393442623, 0.012159829156414292)
2026-05-22 23:54:42,015 - optuna.study.study - INFO - Trial 106 finished with values: [0.008462324104109787, 0.00959016393442623, 0.012159829156414292] and parameters: {'n_layers': 4, 'embedding_dim': 128, 'lr': 0.0015012790650110219, 'lambda_val': 0.0003143503113741062, 'batch_size': 2152, 'optimizer': 'Adam'}.
2026-05-22 23:54:45,748 - experiment_functions - INFO - Early stopping at epoch 850. Best Metrics: (0.011483667947735043, 0.013032786885245902, 0.01706511300810187)
2026-05-22 23:54:45,884 - optuna.study.study - INFO - Trial 107 finished with values: [0.011483667947735043, 0.013032786885245902, 0.01706511300810187] and parameters: {'n_layers': 4, 'embedding_dim': 128, 'lr': 0.032125088922163904, 'lambda_val': 2.0926872137727736e-06, 'batch_size': 2123, 'optimizer': 'Adam'}.
2026-05-22 23:54:54,359 - experiment_functions - INFO - Early stopping at epoch 3000. Best Metrics: (0.0034305565543040956, 0.003278688524590164, 0.0036757668178387416)
2026-05-22 23:54:54,527 - optuna.study.study - INFO - Trial 108 finished with values: [0.0034305565543040956, 0.003278688524590164, 0.0036757668178387416] and parameters: {'n_layers': 4, 'embedding_dim': 64, 'lr': 2.6430079337170096e-05, 'lambda_val': 1.0988779505731458e-05, 'batch_size': 716, 'optimizer': 'Adam'}.
2026-05-22 23:54:56,762 - experiment_functions - INFO - Early stopping at epoch 550. Best Metrics: (0.0071368551933619654, 0.008524590163934425, 0.009818494476829347)
2026-05-22 23:54:56,897 - optuna.study.study - INFO - Trial 109 finished with values: [0.0071368551933619654, 0.008524590163934425, 0.009818494476829347] and parameters: {'n_layers': 2, 'embedding_dim': 64, 'lr': 0.0602894258387779, 'lambda_val': 1.0988779505731458e-05, 'batch_size': 716, 'optimizer': 'Adam'}.
2026-05-22 23:54:59,607 - experiment_functions - INFO - Early stopping at epoch 650. Best Metrics: (0.006423402043431918, 0.008032786885245903, 0.010542178513066104)
2026-05-22 23:54:59,746 - optuna.study.study - INFO - Trial 110 finished with values: [0.006423402043431918, 0.008032786885245903, 0.010542178513066104] and parameters: {'n_layers': 1, 'embedding_dim': 96, 'lr': 0.0018742346468367153, 'lambda_val': 1.5257841801841251e-06, 'batch_size': 1686, 'optimizer': 'RMSprop'}.
2026-05-22 23:55:04,002 - experiment_functions - INFO - Early stopping at epoch 1050. Best Metrics: (0.005338319385024403, 0.007950819672131149, 0.00853516749409646)
2026-05-22 23:55:04,099 - optuna.study.study - INFO - Trial 111 finished with values: [0.005338319385024403, 0.007950819672131149, 0.00853516749409646] and parameters: {'n_layers': 3, 'embedding_dim': 96, 'lr': 7.217061367190653e-05, 'lambda_val': 1.5257841801841251e-06, 'batch_size': 3969, 'optimizer': 'RMSprop'}.
2026-05-22 23:55:14,490 - experiment_functions - INFO - Early stopping at epoch 3150. Best Metrics: (0.014735266068493446, 0.012704918032786885, 0.017987650131888702)
2026-05-22 23:55:14,587 - optuna.study.study - INFO - Trial 112 finished with values: [0.014735266068493446, 0.012704918032786885, 0.017987650131888702] and parameters: {'n_layers': 4, 'embedding_dim': 32, 'lr': 0.02143903136401803, 'lambda_val': 0.00010360674255217468, 'batch_size': 2505, 'optimizer': 'Adam'}.
2026-05-22 23:55:16,891 - experiment_functions - INFO - Early stopping at epoch 550. Best Metrics: (0.008030603483113795, 0.009180327868852459, 0.010302278394124656)
2026-05-22 23:55:16,979 - optuna.study.study - INFO - Trial 113 finished with values: [0.008030603483113795, 0.009180327868852459, 0.010302278394124656] and parameters: {'n_layers': 2, 'embedding_dim': 32, 'lr': 0.0031769402206672614, 'lambda_val': 0.0005183974282222809, 'batch_size': 2393, 'optimizer': 'Adam'}.
2026-05-22 23:55:19,350 - experiment_functions - INFO - Early stopping at epoch 550. Best Metrics: (0.006567713980685524, 0.007540983606557378, 0.009093585507948199)
2026-05-22 23:55:19,441 - optuna.study.study - INFO - Trial 114 finished with values: [0.006567713980685524, 0.007540983606557378, 0.009093585507948199] and parameters: {'n_layers': 4, 'embedding_dim': 32, 'lr': 0.00038603420377640905, 'lambda_val': 1.5257841801841251e-06, 'batch_size': 2841, 'optimizer': 'RMSprop'}.
2026-05-22 23:55:21,527 - experiment_functions - INFO - Early stopping at epoch 500. Best Metrics: (0.0014959313071705805, 0.001639344262295082, 0.0025574383618470983)
2026-05-22 23:55:21,658 - optuna.study.study - INFO - Trial 115 finished with values: [0.0014959313071705805, 0.001639344262295082, 0.0025574383618470983] and parameters: {'n_layers': 3, 'embedding_dim': 64, 'lr': 0.00010173719456212431, 'lambda_val': 7.367374344877376e-05, 'batch_size': 2647, 'optimizer': 'SGD'}.
2026-05-22 23:55:24,095 - experiment_functions - INFO - Early stopping at epoch 650. Best Metrics: (0.011206135077739697, 0.010819672131147541, 0.01291840901228807)
2026-05-22 23:55:24,224 - optuna.study.study - INFO - Trial 116 finished with values: [0.011206135077739697, 0.010819672131147541, 0.01291840901228807] and parameters: {'n_layers': 1, 'embedding_dim': 128, 'lr': 0.0006693247579890929, 'lambda_val': 2.0926872137727736e-06, 'batch_size': 1815, 'optimizer': 'Adam'}.
2026-05-22 23:55:32,785 - experiment_functions - INFO - Early stopping at epoch 1850. Best Metrics: (0.011918125246627973, 0.010819672131147541, 0.013869556641880412)
2026-05-22 23:55:32,989 - optuna.study.study - INFO - Trial 117 finished with values: [0.011918125246627973, 0.010819672131147541, 0.013869556641880412] and parameters: {'n_layers': 3, 'embedding_dim': 96, 'lr': 0.02773153918226887, 'lambda_val': 0.0006106302283455917, 'batch_size': 2919, 'optimizer': 'Adam'}.
2026-05-22 23:55:43,965 - optuna.study.study - INFO - Trial 118 finished with values: [0.015362711195939406, 0.011311475409836066, 0.017119529708448575] and parameters: {'n_layers': 4, 'embedding_dim': 96, 'lr': 0.0034872026493997328, 'lambda_val': 9.956828255961624e-05, 'batch_size': 1449, 'optimizer': 'RMSprop'}.
2026-05-22 23:55:46,633 - experiment_functions - INFO - Early stopping at epoch 550. Best Metrics: (0.003769850501692537, 0.006639344262295083, 0.007734500759329756)
2026-05-22 23:55:46,781 - optuna.study.study - INFO - Trial 119 finished with values: [0.003769850501692537, 0.006639344262295083, 0.007734500759329756] and parameters: {'n_layers': 3, 'embedding_dim': 32, 'lr': 0.0010357136596424467, 'lambda_val': 1.5257841801841251e-06, 'batch_size': 1657, 'optimizer': 'RMSprop'}.
2026-05-22 23:55:55,748 - experiment_functions - INFO - Early stopping at epoch 2900. Best Metrics: (0.012170189701399155, 0.015491803278688524, 0.018768951748142696)
2026-05-22 23:55:56,241 - optuna.study.study - INFO - Trial 120 finished with values: [0.012170189701399155, 0.015491803278688524, 0.018768951748142696] and parameters: {'n_layers': 1, 'embedding_dim': 96, 'lr': 0.007748276590311343, 'lambda_val': 1.0988779505731458e-05, 'batch_size': 3089, 'optimizer': 'Adam'}.
2026-05-22 23:56:01,855 - experiment_functions - INFO - Early stopping at epoch 1750. Best Metrics: (0.004563895822369335, 0.006885245901639345, 0.008405188394060627)
2026-05-22 23:56:02,308 - optuna.study.study - INFO - Trial 121 finished with values: [0.004563895822369335, 0.006885245901639345, 0.008405188394060627] and parameters: {'n_layers': 2, 'embedding_dim': 32, 'lr': 0.0031769402206672614, 'lambda_val': 0.0005183974282222809, 'batch_size': 2393, 'optimizer': 'RMSprop'}.
2026-05-22 23:56:09,951 - experiment_functions - INFO - Early stopping at epoch 2300. Best Metrics: (0.012526240385169642, 0.012213114754098359, 0.01749497706085317)
2026-05-22 23:56:10,044 - optuna.study.study - INFO - Trial 122 finished with values: [0.012526240385169642, 0.012213114754098359, 0.01749497706085317] and parameters: {'n_layers': 4, 'embedding_dim': 96, 'lr': 0.016757203845338013, 'lambda_val': 8.019970575757968e-05, 'batch_size': 717, 'optimizer': 'Adam'}.
2026-05-22 23:56:13,367 - experiment_functions - INFO - Early stopping at epoch 850. Best Metrics: (0.004137225969769142, 0.006885245901639345, 0.00796978135020558)
2026-05-22 23:56:14,087 - optuna.study.study - INFO - Trial 123 finished with values: [0.004137225969769142, 0.006885245901639345, 0.00796978135020558] and parameters: {'n_layers': 3, 'embedding_dim': 32, 'lr': 0.06798876080572501, 'lambda_val': 0.002802498355712308, 'batch_size': 2513, 'optimizer': 'Adam'}.
2026-05-22 23:56:18,962 - experiment_functions - INFO - Early stopping at epoch 1100. Best Metrics: (0.013109158971707087, 0.013852459016393445, 0.018064108293984034)
2026-05-22 23:56:19,385 - optuna.study.study - INFO - Trial 124 finished with values: [0.013109158971707087, 0.013852459016393445, 0.018064108293984034] and parameters: {'n_layers': 3, 'embedding_dim': 256, 'lr': 0.02143903136401803, 'lambda_val': 3.7696639076813204e-06, 'batch_size': 1845, 'optimizer': 'Adam'}.
2026-05-22 23:56:21,922 - experiment_functions - INFO - Early stopping at epoch 550. Best Metrics: (0.007210760502813804, 0.00836065573770492, 0.009499281035566506)
2026-05-22 23:56:22,838 - optuna.study.study - INFO - Trial 125 finished with values: [0.007210760502813804, 0.00836065573770492, 0.009499281035566506] and parameters: {'n_layers': 2, 'embedding_dim': 32, 'lr': 0.0034872026493997328, 'lambda_val': 0.00023986489473645103, 'batch_size': 3969, 'optimizer': 'Adam'}.
2026-05-22 23:56:26,039 - experiment_functions - INFO - Early stopping at epoch 700. Best Metrics: (0.005388194708308642, 0.007950819672131147, 0.008646428575518563)
2026-05-22 23:56:26,134 - optuna.study.study - INFO - Trial 126 finished with values: [0.005388194708308642, 0.007950819672131147, 0.008646428575518563] and parameters: {'n_layers': 2, 'embedding_dim': 32, 'lr': 0.006178111746348912, 'lambda_val': 2.0112396730417335e-06, 'batch_size': 2552, 'optimizer': 'RMSprop'}.
2026-05-22 23:56:36,933 - experiment_functions - INFO - Early stopping at epoch 1900. Best Metrics: (0.020456303247106265, 0.015737704918032787, 0.02239553096880365)
2026-05-22 23:56:37,010 - optuna.study.study - INFO - Trial 127 finished with values: [0.020456303247106265, 0.015737704918032787, 0.02239553096880365] and parameters: {'n_layers': 4, 'embedding_dim': 128, 'lr': 0.012476072772677116, 'lambda_val': 7.367374344877376e-05, 'batch_size': 2069, 'optimizer': 'RMSprop'}.
2026-05-22 23:56:39,694 - experiment_functions - INFO - Early stopping at epoch 600. Best Metrics: (0.008196608631637878, 0.008360655737704918, 0.010278042485379876)
2026-05-22 23:56:39,789 - optuna.study.study - INFO - Trial 128 finished with values: [0.008196608631637878, 0.008360655737704918, 0.010278042485379876] and parameters: {'n_layers': 4, 'embedding_dim': 32, 'lr': 0.0010357136596424467, 'lambda_val': 1.5257841801841251e-06, 'batch_size': 3195, 'optimizer': 'Adam'}.
2026-05-22 23:56:43,276 - experiment_functions - INFO - Early stopping at epoch 600. Best Metrics: (0.0064760564955639605, 0.009918032786885246, 0.010626766207676854)
2026-05-22 23:56:43,372 - optuna.study.study - INFO - Trial 129 finished with values: [0.0064760564955639605, 0.009918032786885246, 0.010626766207676854] and parameters: {'n_layers': 4, 'embedding_dim': 256, 'lr': 0.0006693247579890929, 'lambda_val': 8.019970575757968e-05, 'batch_size': 3664, 'optimizer': 'Adam'}.
2026-05-22 23:56:54,633 - experiment_functions - INFO - Early stopping at epoch 3450. Best Metrics: (0.009942914905695823, 0.010081967213114754, 0.015601694603152774)
2026-05-22 23:56:55,194 - optuna.study.study - INFO - Trial 130 finished with values: [0.009942914905695823, 0.010081967213114754, 0.015601694603152774] and parameters: {'n_layers': 3, 'embedding_dim': 64, 'lr': 0.0034872026493997328, 'lambda_val': 0.00023986489473645103, 'batch_size': 3460, 'optimizer': 'RMSprop'}.
2026-05-22 23:57:08,295 - optuna.study.study - INFO - Trial 131 finished with values: [0.005931055976510774, 0.007704918032786886, 0.009115256481889553] and parameters: {'n_layers': 3, 'embedding_dim': 96, 'lr': 4.1005313044469535e-05, 'lambda_val': 2.0112396730417335e-06, 'batch_size': 2395, 'optimizer': 'Adam'}.
2026-05-22 23:57:10,901 - experiment_functions - INFO - Early stopping at epoch 650. Best Metrics: (0.008630002159962248, 0.009754098360655737, 0.012013034591754767)
2026-05-22 23:57:11,007 - optuna.study.study - INFO - Trial 132 finished with values: [0.008630002159962248, 0.009754098360655737, 0.012013034591754767] and parameters: {'n_layers': 2, 'embedding_dim': 96, 'lr': 0.0006693247579890929, 'lambda_val': 5.7691148409924975e-05, 'batch_size': 1815, 'optimizer': 'Adam'}.
2026-05-22 23:57:13,428 - experiment_functions - INFO - Early stopping at epoch 550. Best Metrics: (0.006684278978634555, 0.008524590163934427, 0.010411395748610922)
2026-05-22 23:57:13,520 - optuna.study.study - INFO - Trial 133 finished with values: [0.006684278978634555, 0.008524590163934427, 0.010411395748610922] and parameters: {'n_layers': 3, 'embedding_dim': 96, 'lr': 0.001034403930869181, 'lambda_val': 8.019970575757968e-05, 'batch_size': 2197, 'optimizer': 'Adam'}.
2026-05-22 23:57:15,642 - experiment_functions - INFO - Early stopping at epoch 500. Best Metrics: (0.003097278074819967, 0.002213114754098361, 0.00333710335468326)
2026-05-22 23:57:15,779 - optuna.study.study - INFO - Trial 134 finished with values: [0.003097278074819967, 0.002213114754098361, 0.00333710335468326] and parameters: {'n_layers': 2, 'embedding_dim': 32, 'lr': 0.00027781556769439117, 'lambda_val': 0.0007844384959792041, 'batch_size': 3526, 'optimizer': 'SGD'}.
2026-05-22 23:57:20,856 - experiment_functions - INFO - Early stopping at epoch 1400. Best Metrics: (0.010003245915106653, 0.012049180327868853, 0.014888751704550873)
