2026-05-23 03:42:14,913 - optuna.study.study - INFO - Trial 17 finished with values: [0.042855431534565155, 0.023606557377049184, 0.03557579319478166] and parameters: {'n_layers': 3, 'embedding_dim': 128, 'lr': 0.0043499485856008146, 'lambda_val': 1.3772112230008558e-06, 'batch_size': 3424, 'optimizer': 'Adam'}.
2026-05-23 03:42:33,525 - optuna.study.study - INFO - Trial 18 finished with values: [0.005545338196996044, 0.0036885245901639345, 0.004917382251466408] and parameters: {'n_layers': 3, 'embedding_dim': 128, 'lr': 2.7505072615839748e-05, 'lambda_val': 1.204913548299723e-05, 'batch_size': 1749, 'optimizer': 'RMSprop'}.
2026-05-23 03:42:51,159 - optuna.study.study - INFO - Trial 19 finished with values: [0.02192643300509495, 0.015737704918032787, 0.022114068494266496] and parameters: {'n_layers': 3, 'embedding_dim': 128, 'lr': 6.587161607809317e-05, 'lambda_val': 0.015878618809973863, 'batch_size': 1762, 'optimizer': 'Adam'}.
2026-05-23 03:42:53,598 - experiment_functions - INFO - Early stopping at epoch 550. Best Metrics: (0.022743153521715923, 0.016639344262295082, 0.023738591860091487)
2026-05-23 03:42:53,840 - optuna.study.study - INFO - Trial 20 finished with values: [0.022743153521715923, 0.016639344262295082, 0.023738591860091487] and parameters: {'n_layers': 1, 'embedding_dim': 96, 'lr': 0.006682771802508509, 'lambda_val': 0.06373167425045108, 'batch_size': 1623, 'optimizer': 'Adam'}.
2026-05-23 03:42:56,860 - experiment_functions - INFO - Early stopping at epoch 750. Best Metrics: (0.0017290121463743979, 0.002213114754098361, 0.0026575994406271407)
2026-05-23 03:42:56,941 - optuna.study.study - INFO - Trial 21 finished with values: [0.0017290121463743979, 0.002213114754098361, 0.0026575994406271407] and parameters: {'n_layers': 1, 'embedding_dim': 96, 'lr': 0.06361709291588687, 'lambda_val': 0.001362999954077262, 'batch_size': 3029, 'optimizer': 'SGD'}.
2026-05-23 03:43:00,837 - experiment_functions - INFO - Early stopping at epoch 950. Best Metrics: (0.019349977678494893, 0.006885245901639345, 0.01336158330467465)
2026-05-23 03:43:00,937 - optuna.study.study - INFO - Trial 22 finished with values: [0.019349977678494893, 0.006885245901639345, 0.01336158330467465] and parameters: {'n_layers': 2, 'embedding_dim': 96, 'lr': 0.06381184556744872, 'lambda_val': 2.2085450512136348e-05, 'batch_size': 1672, 'optimizer': 'Adam'}.
2026-05-23 03:43:07,033 - experiment_functions - INFO - Early stopping at epoch 1750. Best Metrics: (0.10837413295097424, 0.05270491803278688, 0.08795101888904903)
2026-05-23 03:43:07,692 - optuna.study.study - INFO - Trial 23 finished with values: [0.10837413295097424, 0.05270491803278688, 0.08795101888904903] and parameters: {'n_layers': 1, 'embedding_dim': 64, 'lr': 0.0005201459519511334, 'lambda_val': 8.391673416893658e-05, 'batch_size': 2589, 'optimizer': 'Adam'}.
2026-05-23 03:43:10,523 - experiment_functions - INFO - Early stopping at epoch 550. Best Metrics: (0.028369225165845856, 0.01278688524590164, 0.02136603596443938)
2026-05-23 03:43:10,631 - optuna.study.study - INFO - Trial 24 finished with values: [0.028369225165845856, 0.01278688524590164, 0.02136603596443938] and parameters: {'n_layers': 3, 'embedding_dim': 64, 'lr': 0.01410422583394185, 'lambda_val': 0.00015302736237202981, 'batch_size': 1353, 'optimizer': 'RMSprop'}.
2026-05-23 03:43:13,447 - experiment_functions - INFO - Early stopping at epoch 600. Best Metrics: (0.0016722072511601148, 0.0018852459016393442, 0.002331826273154471)
2026-05-23 03:43:13,530 - optuna.study.study - INFO - Trial 25 finished with values: [0.0016722072511601148, 0.0018852459016393442, 0.002331826273154471] and parameters: {'n_layers': 2, 'embedding_dim': 32, 'lr': 2.1050998864808984e-05, 'lambda_val': 0.0780623114013696, 'batch_size': 3922, 'optimizer': 'RMSprop'}.
2026-05-23 03:43:18,647 - experiment_functions - INFO - Early stopping at epoch 1100. Best Metrics: (0.0029481312842706093, 0.0017213114754098362, 0.002783530245396435)
2026-05-23 03:43:18,841 - optuna.study.study - INFO - Trial 26 finished with values: [0.0029481312842706093, 0.0017213114754098362, 0.002783530245396435] and parameters: {'n_layers': 4, 'embedding_dim': 32, 'lr': 0.0959494177494899, 'lambda_val': 0.05699400458314174, 'batch_size': 1784, 'optimizer': 'SGD'}.
2026-05-23 03:43:22,710 - experiment_functions - INFO - Early stopping at epoch 500. Best Metrics: (0.0016675198307944837, 0.0015573770491803282, 0.0021051910289900987)
2026-05-23 03:43:22,838 - optuna.study.study - INFO - Trial 27 finished with values: [0.0016675198307944837, 0.0015573770491803282, 0.0021051910289900987] and parameters: {'n_layers': 4, 'embedding_dim': 256, 'lr': 0.006124357790097156, 'lambda_val': 4.7753367516556194e-06, 'batch_size': 2649, 'optimizer': 'SGD'}.
2026-05-23 03:43:35,237 - optuna.study.study - INFO - Trial 28 finished with values: [0.042760657591960044, 0.02180327868852459, 0.03387986157141019] and parameters: {'n_layers': 1, 'embedding_dim': 32, 'lr': 0.00011904232189756788, 'lambda_val': 4.112104521892171e-06, 'batch_size': 3839, 'optimizer': 'Adam'}.
2026-05-23 03:43:37,688 - experiment_functions - INFO - Early stopping at epoch 500. Best Metrics: (0.0029453923819520132, 0.0015573770491803282, 0.0021040973593976957)
2026-05-23 03:43:37,824 - optuna.study.study - INFO - Trial 29 finished with values: [0.0029453923819520132, 0.0015573770491803282, 0.0021040973593976957] and parameters: {'n_layers': 3, 'embedding_dim': 32, 'lr': 0.0006974716712164259, 'lambda_val': 0.009330535931572508, 'batch_size': 2461, 'optimizer': 'SGD'}.
2026-05-23 03:43:40,400 - experiment_functions - INFO - Early stopping at epoch 500. Best Metrics: (0.002873682813076508, 0.0017213114754098366, 0.0025299749994372876)
2026-05-23 03:43:40,535 - optuna.study.study - INFO - Trial 30 finished with values: [0.002873682813076508, 0.0017213114754098366, 0.0025299749994372876] and parameters: {'n_layers': 3, 'embedding_dim': 32, 'lr': 0.020450435057706502, 'lambda_val': 1.3988501160556413e-05, 'batch_size': 3502, 'optimizer': 'SGD'}.
2026-05-23 03:43:43,991 - experiment_functions - INFO - Early stopping at epoch 750. Best Metrics: (0.013502698885993203, 0.005737704918032787, 0.009628197281833128)
2026-05-23 03:43:44,743 - optuna.study.study - INFO - Trial 31 finished with values: [0.013502698885993203, 0.005737704918032787, 0.009628197281833128] and parameters: {'n_layers': 2, 'embedding_dim': 96, 'lr': 0.09335541584008325, 'lambda_val': 1.5563426646452356e-06, 'batch_size': 1357, 'optimizer': 'Adam'}.
2026-05-23 03:43:50,714 - experiment_functions - INFO - Early stopping at epoch 600. Best Metrics: (0.05893089218880847, 0.033196721311475406, 0.05210726033714046)
2026-05-23 03:43:51,291 - optuna.study.study - INFO - Trial 32 finished with values: [0.05893089218880847, 0.033196721311475406, 0.05210726033714046] and parameters: {'n_layers': 2, 'embedding_dim': 64, 'lr': 0.0025167752834235274, 'lambda_val': 6.4213979022807815e-06, 'batch_size': 1367, 'optimizer': 'Adam'}.
2026-05-23 03:44:11,725 - optuna.study.study - INFO - Trial 33 finished with values: [0.01398897050246005, 0.00819672131147541, 0.012778138545854802] and parameters: {'n_layers': 2, 'embedding_dim': 96, 'lr': 4.7474885915367426e-05, 'lambda_val': 3.780128918133326e-06, 'batch_size': 2149, 'optimizer': 'RMSprop'}.
2026-05-23 03:44:18,116 - experiment_functions - INFO - Early stopping at epoch 2100. Best Metrics: (0.002951193000314015, 0.002295081967213115, 0.003173754111394229)
2026-05-23 03:44:18,183 - optuna.study.study - INFO - Trial 34 finished with values: [0.002951193000314015, 0.002295081967213115, 0.003173754111394229] and parameters: {'n_layers': 1, 'embedding_dim': 64, 'lr': 2.246055937756982e-05, 'lambda_val': 4.09726411773762e-06, 'batch_size': 1348, 'optimizer': 'RMSprop'}.
2026-05-23 03:44:20,942 - experiment_functions - INFO - Early stopping at epoch 500. Best Metrics: (0.0018833978159570218, 0.0022950819672131148, 0.0023076286705442837)
2026-05-23 03:44:21,029 - optuna.study.study - INFO - Trial 35 finished with values: [0.0018833978159570218, 0.0022950819672131148, 0.0023076286705442837] and parameters: {'n_layers': 3, 'embedding_dim': 96, 'lr': 2.4155463292094065e-05, 'lambda_val': 0.04310206163698699, 'batch_size': 618, 'optimizer': 'Adam'}.
2026-05-23 03:44:23,586 - experiment_functions - INFO - Early stopping at epoch 550. Best Metrics: (0.10064257459593114, 0.04762295081967213, 0.08052385785106228)
2026-05-23 03:44:23,679 - optuna.study.study - INFO - Trial 36 finished with values: [0.10064257459593114, 0.04762295081967213, 0.08052385785106228] and parameters: {'n_layers': 1, 'embedding_dim': 128, 'lr': 0.00726893620558119, 'lambda_val': 2.0700677762543618e-06, 'batch_size': 2670, 'optimizer': 'Adam'}.
2026-05-23 03:44:28,072 - experiment_functions - INFO - Early stopping at epoch 1200. Best Metrics: (0.10003126444414337, 0.04918032786885246, 0.0868005848875176)
2026-05-23 03:44:28,431 - optuna.study.study - INFO - Trial 37 finished with values: [0.10003126444414337, 0.04918032786885246, 0.0868005848875176] and parameters: {'n_layers': 1, 'embedding_dim': 32, 'lr': 0.0007420979429767307, 'lambda_val': 0.005013716564296358, 'batch_size': 2314, 'optimizer': 'Adam'}.
2026-05-23 03:44:32,009 - experiment_functions - INFO - Early stopping at epoch 800. Best Metrics: (0.00116017794706808, 0.001639344262295082, 0.0016564039358949794)
2026-05-23 03:44:32,648 - optuna.study.study - INFO - Trial 38 finished with values: [0.00116017794706808, 0.001639344262295082, 0.0016564039358949794] and parameters: {'n_layers': 2, 'embedding_dim': 128, 'lr': 0.009758330025506357, 'lambda_val': 0.0790258017560125, 'batch_size': 568, 'optimizer': 'SGD'}.
2026-05-23 03:44:34,713 - experiment_functions - INFO - Early stopping at epoch 500. Best Metrics: (0.002894805325103872, 0.0020491803278688526, 0.00247720210093431)
2026-05-23 03:44:34,799 - optuna.study.study - INFO - Trial 39 finished with values: [0.002894805325103872, 0.0020491803278688526, 0.00247720210093431] and parameters: {'n_layers': 1, 'embedding_dim': 32, 'lr': 0.00014091144348253842, 'lambda_val': 0.019274562156610407, 'batch_size': 1166, 'optimizer': 'RMSprop'}.
2026-05-23 03:44:50,865 - experiment_functions - INFO - Early stopping at epoch 3600. Best Metrics: (0.015800661457333685, 0.012049180327868855, 0.016897823342044226)
2026-05-23 03:44:52,131 - optuna.study.study - INFO - Trial 40 finished with values: [0.015800661457333685, 0.012049180327868855, 0.016897823342044226] and parameters: {'n_layers': 3, 'embedding_dim': 128, 'lr': 0.038572526598242896, 'lambda_val': 0.03952172142634439, 'batch_size': 3201, 'optimizer': 'Adam'}.
2026-05-23 03:44:55,206 - experiment_functions - INFO - Early stopping at epoch 500. Best Metrics: (0.002431721115549352, 0.0013934426229508198, 0.002536750825479941)
2026-05-23 03:44:55,456 - optuna.study.study - INFO - Trial 41 finished with values: [0.002431721115549352, 0.0013934426229508198, 0.002536750825479941] and parameters: {'n_layers': 2, 'embedding_dim': 256, 'lr': 0.002591667158122534, 'lambda_val': 1.1492467131457105e-05, 'batch_size': 2867, 'optimizer': 'SGD'}.
2026-05-23 03:44:58,070 - experiment_functions - INFO - Early stopping at epoch 500. Best Metrics: (0.0022477013221568164, 0.002213114754098361, 0.002586401257505049)
2026-05-23 03:44:58,655 - optuna.study.study - INFO - Trial 42 finished with values: [0.0022477013221568164, 0.002213114754098361, 0.002586401257505049] and parameters: {'n_layers': 1, 'embedding_dim': 64, 'lr': 0.0021127433436148794, 'lambda_val': 0.0001457265410824252, 'batch_size': 800, 'optimizer': 'SGD'}.
2026-05-23 03:45:18,830 - experiment_functions - INFO - Early stopping at epoch 3050. Best Metrics: (0.05492052902569467, 0.033934426229508194, 0.051489966179342074)
2026-05-23 03:45:18,959 - optuna.study.study - INFO - Trial 43 finished with values: [0.05492052902569467, 0.033934426229508194, 0.051489966179342074] and parameters: {'n_layers': 3, 'embedding_dim': 256, 'lr': 0.0001451959463810353, 'lambda_val': 0.0003938798171532122, 'batch_size': 3689, 'optimizer': 'RMSprop'}.
2026-05-23 03:45:22,871 - experiment_functions - INFO - Early stopping at epoch 500. Best Metrics: (0.0006915140397752187, 0.0009836065573770494, 0.0012279517154877367)
2026-05-23 03:45:23,179 - optuna.study.study - INFO - Trial 44 finished with values: [0.0006915140397752187, 0.0009836065573770494, 0.0012279517154877367] and parameters: {'n_layers': 4, 'embedding_dim': 256, 'lr': 1.5518181379512924e-05, 'lambda_val': 0.01665292264329761, 'batch_size': 2213, 'optimizer': 'RMSprop'}.
2026-05-23 03:45:46,519 - experiment_functions - INFO - Early stopping at epoch 3500. Best Metrics: (0.002844183422383799, 0.002295081967213115, 0.003165252028300476)
2026-05-23 03:45:46,988 - optuna.study.study - INFO - Trial 45 finished with values: [0.002844183422383799, 0.002295081967213115, 0.003165252028300476] and parameters: {'n_layers': 4, 'embedding_dim': 256, 'lr': 1.2727491511866686e-05, 'lambda_val': 0.004260672290845639, 'batch_size': 3409, 'optimizer': 'Adam'}.
2026-05-23 03:45:50,438 - experiment_functions - INFO - Early stopping at epoch 900. Best Metrics: (0.10712686365042907, 0.05180327868852459, 0.0903660209997323)
2026-05-23 03:45:50,982 - optuna.study.study - INFO - Trial 46 finished with values: [0.10712686365042907, 0.05180327868852459, 0.0903660209997323] and parameters: {'n_layers': 1, 'embedding_dim': 64, 'lr': 0.0016044647069746135, 'lambda_val': 0.0005885991132278509, 'batch_size': 1529, 'optimizer': 'Adam'}.
2026-05-23 03:45:55,168 - experiment_functions - INFO - Early stopping at epoch 800. Best Metrics: (0.003027608965729053, 0.0021311475409836068, 0.0026714598850885053)
2026-05-23 03:45:55,899 - optuna.study.study - INFO - Trial 47 finished with values: [0.003027608965729053, 0.0021311475409836068, 0.0026714598850885053] and parameters: {'n_layers': 2, 'embedding_dim': 256, 'lr': 0.04527706879130706, 'lambda_val': 0.0001131436776992654, 'batch_size': 1167, 'optimizer': 'SGD'}.
2026-05-23 03:46:02,169 - experiment_functions - INFO - Early stopping at epoch 1400. Best Metrics: (0.07039130126602726, 0.039672131147540986, 0.06252103208772501)
2026-05-23 03:46:02,279 - optuna.study.study - INFO - Trial 48 finished with values: [0.07039130126602726, 0.039672131147540986, 0.06252103208772501] and parameters: {'n_layers': 2, 'embedding_dim': 128, 'lr': 0.00026503485300845536, 'lambda_val': 0.0017795542900466829, 'batch_size': 2384, 'optimizer': 'RMSprop'}.
2026-05-23 03:46:05,397 - experiment_functions - INFO - Early stopping at epoch 500. Best Metrics: (0.01967411876288241, 0.009098360655737705, 0.017144366453007116)
2026-05-23 03:46:05,539 - optuna.study.study - INFO - Trial 49 finished with values: [0.01967411876288241, 0.009098360655737705, 0.017144366453007116] and parameters: {'n_layers': 2, 'embedding_dim': 256, 'lr': 0.027856035862650546, 'lambda_val': 1.6555471034129683e-06, 'batch_size': 1534, 'optimizer': 'RMSprop'}.
2026-05-23 03:46:08,332 - experiment_functions - INFO - Early stopping at epoch 500. Best Metrics: (0.0022449119342831396, 0.0018032786885245904, 0.0024919296323840864)
2026-05-23 03:46:08,424 - optuna.study.study - INFO - Trial 50 finished with values: [0.0022449119342831396, 0.0018032786885245904, 0.0024919296323840864] and parameters: {'n_layers': 3, 'embedding_dim': 96, 'lr': 0.00026503485300845536, 'lambda_val': 3.780128918133326e-06, 'batch_size': 2116, 'optimizer': 'SGD'}.
2026-05-23 03:46:13,269 - experiment_functions - INFO - Early stopping at epoch 1350. Best Metrics: (0.07487139310346624, 0.04426229508196721, 0.06758247399567185)
2026-05-23 03:46:14,094 - optuna.study.study - INFO - Trial 51 finished with values: [0.07487139310346624, 0.04426229508196721, 0.06758247399567185] and parameters: {'n_layers': 1, 'embedding_dim': 32, 'lr': 0.0006974716712164259, 'lambda_val': 0.005013716564296358, 'batch_size': 2314, 'optimizer': 'Adam'}.
2026-05-23 03:46:16,970 - experiment_functions - INFO - Early stopping at epoch 550. Best Metrics: (0.07332606540716816, 0.03721311475409836, 0.059576378973027595)
2026-05-23 03:46:17,099 - optuna.study.study - INFO - Trial 52 finished with values: [0.07332606540716816, 0.03721311475409836, 0.059576378973027595] and parameters: {'n_layers': 1, 'embedding_dim': 256, 'lr': 0.0029056396011724254, 'lambda_val': 6.13505476225876e-05, 'batch_size': 2515, 'optimizer': 'RMSprop'}.
2026-05-23 03:46:19,856 - experiment_functions - INFO - Early stopping at epoch 650. Best Metrics: (0.06620808612059016, 0.036639344262295086, 0.05958149249623216)
2026-05-23 03:46:20,630 - optuna.study.study - INFO - Trial 53 finished with values: [0.06620808612059016, 0.036639344262295086, 0.05958149249623216] and parameters: {'n_layers': 2, 'embedding_dim': 32, 'lr': 0.0025167752834235274, 'lambda_val': 6.4213979022807815e-06, 'batch_size': 1784, 'optimizer': 'Adam'}.
2026-05-23 03:46:29,240 - experiment_functions - INFO - Early stopping at epoch 500. Best Metrics: (0.002833845233168112, 0.0013114754098360656, 0.002109234109267827)
2026-05-23 03:46:29,855 - optuna.study.study - INFO - Trial 54 finished with values: [0.002833845233168112, 0.0013114754098360656, 0.002109234109267827] and parameters: {'n_layers': 1, 'embedding_dim': 32, 'lr': 8.289805712737858e-05, 'lambda_val': 0.000826940797500259, 'batch_size': 2461, 'optimizer': 'SGD'}.
2026-05-23 03:46:35,960 - experiment_functions - INFO - Early stopping at epoch 500. Best Metrics: (0.0032390191695627416, 0.0018032786885245904, 0.0023655037327871132)
2026-05-23 03:46:36,082 - optuna.study.study - INFO - Trial 55 finished with values: [0.0032390191695627416, 0.0018032786885245904, 0.0023655037327871132] and parameters: {'n_layers': 3, 'embedding_dim': 96, 'lr': 0.0005201459519511334, 'lambda_val': 5.8350086934831045e-06, 'batch_size': 2589, 'optimizer': 'SGD'}.
2026-05-23 03:46:51,303 - optuna.study.study - INFO - Trial 56 finished with values: [0.06728095370558837, 0.035655737704918034, 0.05700169824924631] and parameters: {'n_layers': 3, 'embedding_dim': 32, 'lr': 0.000233346029650438, 'lambda_val': 2.0700677762543618e-06, 'batch_size': 1170, 'optimizer': 'Adam'}.
2026-05-23 03:46:57,780 - experiment_functions - INFO - Early stopping at epoch 1350. Best Metrics: (0.0722470599161566, 0.03950819672131148, 0.06245373008164873)
2026-05-23 03:46:58,056 - optuna.study.study - INFO - Trial 57 finished with values: [0.0722470599161566, 0.03950819672131148, 0.06245373008164873] and parameters: {'n_layers': 3, 'embedding_dim': 128, 'lr': 0.00026503485300845536, 'lambda_val': 0.0017795542900466829, 'batch_size': 635, 'optimizer': 'RMSprop'}.
2026-05-23 03:47:09,907 - optuna.study.study - INFO - Trial 58 finished with values: [0.04423168139747611, 0.02475409836065574, 0.03678908214922991] and parameters: {'n_layers': 1, 'embedding_dim': 64, 'lr': 0.00012113925642415473, 'lambda_val': 8.391673416893658e-05, 'batch_size': 2127, 'optimizer': 'Adam'}.
2026-05-23 03:47:11,884 - experiment_functions - INFO - Early stopping at epoch 500. Best Metrics: (0.0016510615704245664, 0.0018852459016393446, 0.002071279136337947)
2026-05-23 03:47:11,966 - optuna.study.study - INFO - Trial 59 finished with values: [0.0016510615704245664, 0.0018852459016393446, 0.002071279136337947] and parameters: {'n_layers': 1, 'embedding_dim': 64, 'lr': 0.06361709291588687, 'lambda_val': 0.001362999954077262, 'batch_size': 2589, 'optimizer': 'SGD'}.
2026-05-23 03:47:14,065 - experiment_functions - INFO - Early stopping at epoch 500. Best Metrics: (0.002000398887370387, 0.002213114754098361, 0.0025648422293510715)
2026-05-23 03:47:14,214 - optuna.study.study - INFO - Trial 60 finished with values: [0.002000398887370387, 0.002213114754098361, 0.0025648422293510715] and parameters: {'n_layers': 2, 'embedding_dim': 32, 'lr': 6.587161607809317e-05, 'lambda_val': 0.03388893078570896, 'batch_size': 1762, 'optimizer': 'Adam'}.
2026-05-23 03:47:17,385 - experiment_functions - INFO - Early stopping at epoch 650. Best Metrics: (0.0024188053512194875, 0.001967213114754099, 0.002229285014277907)
2026-05-23 03:47:18,563 - optuna.study.study - INFO - Trial 61 finished with values: [0.0024188053512194875, 0.001967213114754099, 0.002229285014277907] and parameters: {'n_layers': 3, 'embedding_dim': 64, 'lr': 0.06361709291588687, 'lambda_val': 6.2109274589487925e-06, 'batch_size': 1335, 'optimizer': 'SGD'}.
2026-05-23 03:47:21,699 - experiment_functions - INFO - Early stopping at epoch 500. Best Metrics: (0.0028897341554462107, 0.0018032786885245904, 0.002902256053212655)
2026-05-23 03:47:21,788 - optuna.study.study - INFO - Trial 62 finished with values: [0.0028897341554462107, 0.0018032786885245904, 0.002902256053212655] and parameters: {'n_layers': 3, 'embedding_dim': 256, 'lr': 0.003409549337562684, 'lambda_val': 4.265182576276967e-06, 'batch_size': 618, 'optimizer': 'SGD'}.
2026-05-23 03:47:25,651 - experiment_functions - INFO - Early stopping at epoch 500. Best Metrics: (0.0019514205579747267, 0.001557377049180328, 0.001862083456832367)
2026-05-23 03:47:25,942 - optuna.study.study - INFO - Trial 63 finished with values: [0.0019514205579747267, 0.001557377049180328, 0.001862083456832367] and parameters: {'n_layers': 4, 'embedding_dim': 256, 'lr': 0.011997581390738117, 'lambda_val': 0.00027888454856497016, 'batch_size': 2867, 'optimizer': 'SGD'}.
2026-05-23 03:47:34,387 - experiment_functions - INFO - Early stopping at epoch 500. Best Metrics: (0.0024449526508200452, 0.002213114754098361, 0.002629807958625065)
