2026-05-23 03:00:42,724 - optuna.study.study - INFO - Trial 241 finished with values: [0.06808266878946105, 0.047213114754098354, 0.06796863827948216] and parameters: {'n_layers': 1, 'embedding_dim': 128, 'lr': 0.0002738093623313198, 'lambda_val': 8.689122223949433e-06, 'batch_size': 2701, 'optimizer': 'RMSprop'}.
2026-05-23 03:00:44,673 - experiment_functions - INFO - Early stopping at epoch 500. Best Metrics: (0.0011750787485653124, 0.0018032786885245904, 0.0024235056155491857)
2026-05-23 03:00:44,740 - optuna.study.study - INFO - Trial 242 finished with values: [0.0011750787485653124, 0.0018032786885245904, 0.0024235056155491857] and parameters: {'n_layers': 1, 'embedding_dim': 128, 'lr': 0.002298797644471547, 'lambda_val': 2.2233828874401383e-06, 'batch_size': 745, 'optimizer': 'SGD'}.
2026-05-23 03:00:56,248 - optuna.study.study - INFO - Trial 243 finished with values: [0.06275134972224322, 0.045081967213114756, 0.06376342421018594] and parameters: {'n_layers': 1, 'embedding_dim': 64, 'lr': 0.00033929418945457667, 'lambda_val': 2.2233828874401383e-06, 'batch_size': 2773, 'optimizer': 'Adam'}.
2026-05-23 03:01:01,857 - experiment_functions - INFO - Early stopping at epoch 1450. Best Metrics: (0.0327879611113691, 0.021147540983606557, 0.031115783656729422)
2026-05-23 03:01:02,246 - optuna.study.study - INFO - Trial 244 finished with values: [0.0327879611113691, 0.021147540983606557, 0.031115783656729422] and parameters: {'n_layers': 1, 'embedding_dim': 256, 'lr': 0.0230944958375383, 'lambda_val': 0.00023185127305384867, 'batch_size': 2223, 'optimizer': 'RMSprop'}.
2026-05-23 03:01:16,743 - optuna.study.study - INFO - Trial 245 finished with values: [0.058098565060652724, 0.03844262295081967, 0.055388166409977936] and parameters: {'n_layers': 1, 'embedding_dim': 256, 'lr': 0.00015087698888573533, 'lambda_val': 8.60783053151504e-05, 'batch_size': 1084, 'optimizer': 'RMSprop'}.
2026-05-23 03:01:28,239 - optuna.study.study - INFO - Trial 246 finished with values: [0.050164290535766654, 0.035655737704918034, 0.05050531434465719] and parameters: {'n_layers': 1, 'embedding_dim': 64, 'lr': 0.00015452220750004716, 'lambda_val': 8.689122223949433e-06, 'batch_size': 2701, 'optimizer': 'Adam'}.
2026-05-23 03:01:34,686 - experiment_functions - INFO - Early stopping at epoch 1450. Best Metrics: (0.07531048635972407, 0.04704918032786885, 0.06738251118250123)
2026-05-23 03:01:34,770 - optuna.study.study - INFO - Trial 247 finished with values: [0.07531048635972407, 0.04704918032786885, 0.06738251118250123] and parameters: {'n_layers': 1, 'embedding_dim': 256, 'lr': 0.00033929418945457667, 'lambda_val': 8.60783053151504e-05, 'batch_size': 2773, 'optimizer': 'RMSprop'}.
2026-05-23 03:01:37,161 - experiment_functions - INFO - Early stopping at epoch 550. Best Metrics: (0.028276290443058513, 0.019918032786885247, 0.027899243065800095)
2026-05-23 03:01:37,249 - optuna.study.study - INFO - Trial 248 finished with values: [0.028276290443058513, 0.019918032786885247, 0.027899243065800095] and parameters: {'n_layers': 1, 'embedding_dim': 64, 'lr': 0.03797533771098226, 'lambda_val': 0.00010574161158144353, 'batch_size': 1091, 'optimizer': 'Adam'}.
2026-05-23 03:01:42,009 - experiment_functions - INFO - Early stopping at epoch 1300. Best Metrics: (0.05948716047583892, 0.04360655737704918, 0.06248661564663982)
2026-05-23 03:01:42,443 - optuna.study.study - INFO - Trial 249 finished with values: [0.05948716047583892, 0.04360655737704918, 0.06248661564663982] and parameters: {'n_layers': 1, 'embedding_dim': 64, 'lr': 0.0005134970540789423, 'lambda_val': 0.008198149930508243, 'batch_size': 2427, 'optimizer': 'RMSprop'}.
2026-05-23 03:01:56,351 - experiment_functions - INFO - Early stopping at epoch 2700. Best Metrics: (0.0596185848105899, 0.043524590163934423, 0.06149821147399285)
2026-05-23 03:01:57,482 - optuna.study.study - INFO - Trial 250 finished with values: [0.0596185848105899, 0.043524590163934423, 0.06149821147399285] and parameters: {'n_layers': 1, 'embedding_dim': 64, 'lr': 0.0002738093623313198, 'lambda_val': 2.2233828874401383e-06, 'batch_size': 2264, 'optimizer': 'RMSprop'}.
2026-05-23 03:02:04,988 - experiment_functions - INFO - Early stopping at epoch 650. Best Metrics: (0.05751819497388663, 0.04229508196721311, 0.057667212452819645)
2026-05-23 03:02:05,103 - optuna.study.study - INFO - Trial 251 finished with values: [0.05751819497388663, 0.04229508196721311, 0.057667212452819645] and parameters: {'n_layers': 1, 'embedding_dim': 64, 'lr': 0.0013555052564010479, 'lambda_val': 0.0027428171281445477, 'batch_size': 3152, 'optimizer': 'RMSprop'}.
2026-05-23 03:02:11,933 - experiment_functions - INFO - Early stopping at epoch 1600. Best Metrics: (0.07023931453011854, 0.046803278688524595, 0.06857482578923602)
2026-05-23 03:02:12,075 - optuna.study.study - INFO - Trial 252 finished with values: [0.07023931453011854, 0.046803278688524595, 0.06857482578923602] and parameters: {'n_layers': 1, 'embedding_dim': 256, 'lr': 0.0005134970540789423, 'lambda_val': 0.0006950236889333469, 'batch_size': 1414, 'optimizer': 'Adam'}.
2026-05-23 03:02:19,063 - experiment_functions - INFO - Early stopping at epoch 2050. Best Metrics: (0.0584040620396526, 0.04467213114754098, 0.06107676967567905)
2026-05-23 03:02:19,138 - optuna.study.study - INFO - Trial 253 finished with values: [0.0584040620396526, 0.04467213114754098, 0.06107676967567905] and parameters: {'n_layers': 1, 'embedding_dim': 32, 'lr': 0.0005134970540789423, 'lambda_val': 0.0001408586097439621, 'batch_size': 3771, 'optimizer': 'RMSprop'}.
2026-05-23 03:02:21,893 - experiment_functions - INFO - Early stopping at epoch 500. Best Metrics: (0.002563186386224688, 0.0018032786885245904, 0.0019775528347583996)
2026-05-23 03:02:21,992 - optuna.study.study - INFO - Trial 254 finished with values: [0.002563186386224688, 0.0018032786885245904, 0.0019775528347583996] and parameters: {'n_layers': 3, 'embedding_dim': 64, 'lr': 0.0005134970540789423, 'lambda_val': 2.2233828874401383e-06, 'batch_size': 2427, 'optimizer': 'SGD'}.
2026-05-23 03:02:24,945 - experiment_functions - INFO - Early stopping at epoch 550. Best Metrics: (0.04764160129137753, 0.03590163934426229, 0.05172711626111429)
2026-05-23 03:02:25,019 - optuna.study.study - INFO - Trial 255 finished with values: [0.04764160129137753, 0.03590163934426229, 0.05172711626111429] and parameters: {'n_layers': 1, 'embedding_dim': 256, 'lr': 0.0013028688223409228, 'lambda_val': 0.008198149930508243, 'batch_size': 2427, 'optimizer': 'RMSprop'}.
2026-05-23 03:02:35,594 - experiment_functions - INFO - Early stopping at epoch 2850. Best Metrics: (0.07654191684338299, 0.04540983606557377, 0.06961599113096996)
2026-05-23 03:02:36,061 - optuna.study.study - INFO - Trial 256 finished with values: [0.07654191684338299, 0.04540983606557377, 0.06961599113096996] and parameters: {'n_layers': 1, 'embedding_dim': 256, 'lr': 0.0005134970540789423, 'lambda_val': 0.00023185127305384867, 'batch_size': 1651, 'optimizer': 'Adam'}.
2026-05-23 03:02:39,836 - experiment_functions - INFO - Early stopping at epoch 1150. Best Metrics: (0.05579132355853535, 0.04327868852459016, 0.058816331741231236)
2026-05-23 03:02:40,038 - optuna.study.study - INFO - Trial 257 finished with values: [0.05579132355853535, 0.04327868852459016, 0.058816331741231236] and parameters: {'n_layers': 1, 'embedding_dim': 64, 'lr': 0.0005838890493565157, 'lambda_val': 0.0035064867017704023, 'batch_size': 1969, 'optimizer': 'RMSprop'}.
2026-05-23 03:02:42,788 - experiment_functions - INFO - Early stopping at epoch 550. Best Metrics: (0.06002476874489942, 0.04114754098360656, 0.05877323064261559)
2026-05-23 03:02:43,916 - optuna.study.study - INFO - Trial 258 finished with values: [0.06002476874489942, 0.04114754098360656, 0.05877323064261559] and parameters: {'n_layers': 1, 'embedding_dim': 96, 'lr': 0.007526325741077799, 'lambda_val': 0.0001408586097439621, 'batch_size': 3771, 'optimizer': 'Adam'}.
2026-05-23 03:02:49,819 - experiment_functions - INFO - Early stopping at epoch 1400. Best Metrics: (0.04314038315438778, 0.032704918032786884, 0.04614963126857219)
2026-05-23 03:02:49,983 - optuna.study.study - INFO - Trial 259 finished with values: [0.04314038315438778, 0.032704918032786884, 0.04614963126857219] and parameters: {'n_layers': 2, 'embedding_dim': 64, 'lr': 0.0005134970540789423, 'lambda_val': 0.0011797503400601253, 'batch_size': 2427, 'optimizer': 'Adam'}.
2026-05-23 03:03:06,592 - optuna.study.study - INFO - Trial 260 finished with values: [0.04837971173197145, 0.035, 0.046932005863618544] and parameters: {'n_layers': 2, 'embedding_dim': 64, 'lr': 0.00019324235493803607, 'lambda_val': 8.60783053151504e-05, 'batch_size': 1651, 'optimizer': 'Adam'}.
2026-05-23 03:03:12,125 - experiment_functions - INFO - Early stopping at epoch 1150. Best Metrics: (0.046368358743038664, 0.03590163934426229, 0.048446917974881)
2026-05-23 03:03:12,233 - optuna.study.study - INFO - Trial 261 finished with values: [0.046368358743038664, 0.03590163934426229, 0.048446917974881] and parameters: {'n_layers': 2, 'embedding_dim': 128, 'lr': 0.00033929418945457667, 'lambda_val': 8.60783053151504e-05, 'batch_size': 2773, 'optimizer': 'RMSprop'}.
2026-05-23 03:03:17,802 - experiment_functions - INFO - Early stopping at epoch 1250. Best Metrics: (0.06857525442105213, 0.04418032786885246, 0.06590499506902744)
2026-05-23 03:03:18,339 - optuna.study.study - INFO - Trial 262 finished with values: [0.06857525442105213, 0.04418032786885246, 0.06590499506902744] and parameters: {'n_layers': 1, 'embedding_dim': 256, 'lr': 0.0005134970540789423, 'lambda_val': 0.0010178158364642271, 'batch_size': 2427, 'optimizer': 'RMSprop'}.
2026-05-23 03:03:24,934 - experiment_functions - INFO - Early stopping at epoch 1450. Best Metrics: (0.06855257140717039, 0.04491803278688525, 0.06365948378024029)
2026-05-23 03:03:25,025 - optuna.study.study - INFO - Trial 263 finished with values: [0.06855257140717039, 0.04491803278688525, 0.06365948378024029] and parameters: {'n_layers': 1, 'embedding_dim': 256, 'lr': 0.0003465182892109986, 'lambda_val': 0.0006934432893870002, 'batch_size': 2773, 'optimizer': 'RMSprop'}.
2026-05-23 03:03:32,337 - experiment_functions - INFO - Early stopping at epoch 1750. Best Metrics: (0.07364006828872112, 0.04491803278688524, 0.06933969415030378)
2026-05-23 03:03:32,471 - optuna.study.study - INFO - Trial 264 finished with values: [0.07364006828872112, 0.04491803278688524, 0.06933969415030378] and parameters: {'n_layers': 1, 'embedding_dim': 256, 'lr': 0.0005134970540789423, 'lambda_val': 0.0009810927157913494, 'batch_size': 2109, 'optimizer': 'RMSprop'}.
2026-05-23 03:03:36,763 - experiment_functions - INFO - Early stopping at epoch 950. Best Metrics: (0.05494452563461976, 0.028606557377049185, 0.04702960801550556)
2026-05-23 03:03:37,422 - optuna.study.study - INFO - Trial 265 finished with values: [0.05494452563461976, 0.028606557377049185, 0.04702960801550556] and parameters: {'n_layers': 1, 'embedding_dim': 256, 'lr': 0.00466372845018428, 'lambda_val': 2.2233828874401383e-06, 'batch_size': 1269, 'optimizer': 'RMSprop'}.
2026-05-23 03:03:43,881 - experiment_functions - INFO - Early stopping at epoch 1800. Best Metrics: (0.05910762372628631, 0.04491803278688525, 0.06362902550620995)
2026-05-23 03:03:43,964 - optuna.study.study - INFO - Trial 266 finished with values: [0.05910762372628631, 0.04491803278688525, 0.06362902550620995] and parameters: {'n_layers': 1, 'embedding_dim': 64, 'lr': 0.00033929418945457667, 'lambda_val': 0.007024459859123817, 'batch_size': 2749, 'optimizer': 'RMSprop'}.
2026-05-23 03:03:57,356 - optuna.study.study - INFO - Trial 267 finished with values: [0.05840511634457433, 0.0410655737704918, 0.06018781506513104] and parameters: {'n_layers': 1, 'embedding_dim': 128, 'lr': 0.00019324235493803607, 'lambda_val': 0.0001408586097439621, 'batch_size': 1651, 'optimizer': 'RMSprop'}.
2026-05-23 03:04:06,206 - experiment_functions - INFO - Early stopping at epoch 1950. Best Metrics: (0.07012415782947293, 0.046967213114754096, 0.06890806754403174)
2026-05-23 03:04:07,127 - optuna.study.study - INFO - Trial 268 finished with values: [0.07012415782947293, 0.046967213114754096, 0.06890806754403174] and parameters: {'n_layers': 1, 'embedding_dim': 64, 'lr': 0.0005134970540789423, 'lambda_val': 0.0011797503400601253, 'batch_size': 2427, 'optimizer': 'Adam'}.
2026-05-23 03:04:11,743 - experiment_functions - INFO - Early stopping at epoch 850. Best Metrics: (0.03486430550107896, 0.024426229508196718, 0.036524496643530725)
2026-05-23 03:04:12,758 - optuna.study.study - INFO - Trial 269 finished with values: [0.03486430550107896, 0.024426229508196718, 0.036524496643530725] and parameters: {'n_layers': 3, 'embedding_dim': 96, 'lr': 0.0005134970540789423, 'lambda_val': 0.0001408586097439621, 'batch_size': 3771, 'optimizer': 'Adam'}.
2026-05-23 03:04:18,385 - experiment_functions - INFO - Early stopping at epoch 1500. Best Metrics: (0.06693287378243569, 0.04614754098360656, 0.06274861531593132)
2026-05-23 03:04:18,935 - optuna.study.study - INFO - Trial 270 finished with values: [0.06693287378243569, 0.04614754098360656, 0.06274861531593132] and parameters: {'n_layers': 1, 'embedding_dim': 128, 'lr': 0.0005134970540789423, 'lambda_val': 0.0011797503400601253, 'batch_size': 2427, 'optimizer': 'Adam'}.
2026-05-23 03:04:21,812 - experiment_functions - INFO - Early stopping at epoch 550. Best Metrics: (0.024822305760620646, 0.023032786885245904, 0.03021890766701503)
2026-05-23 03:04:21,900 - optuna.study.study - INFO - Trial 271 finished with values: [0.024822305760620646, 0.023032786885245904, 0.03021890766701503] and parameters: {'n_layers': 2, 'embedding_dim': 64, 'lr': 0.007526325741077799, 'lambda_val': 0.0001408586097439621, 'batch_size': 2701, 'optimizer': 'Adam'}.
2026-05-23 03:04:32,743 - optuna.study.study - INFO - Trial 272 finished with values: [0.04354767648582267, 0.03295081967213115, 0.046691277318308584] and parameters: {'n_layers': 1, 'embedding_dim': 32, 'lr': 0.00019324235493803607, 'lambda_val': 8.60783053151504e-05, 'batch_size': 2427, 'optimizer': 'RMSprop'}.
2026-05-23 03:04:42,867 - experiment_functions - INFO - Early stopping at epoch 3150. Best Metrics: (0.05556649645856521, 0.044426229508196725, 0.0655134919291816)
2026-05-23 03:04:43,935 - optuna.study.study - INFO - Trial 273 finished with values: [0.05556649645856521, 0.044426229508196725, 0.0655134919291816] and parameters: {'n_layers': 1, 'embedding_dim': 128, 'lr': 0.0002738093623313198, 'lambda_val': 0.0035064867017704023, 'batch_size': 3937, 'optimizer': 'Adam'}.
2026-05-23 03:04:46,620 - experiment_functions - INFO - Early stopping at epoch 550. Best Metrics: (0.07304975247810234, 0.04434426229508197, 0.07081713714197514)
2026-05-23 03:04:46,707 - optuna.study.study - INFO - Trial 274 finished with values: [0.07304975247810234, 0.04434426229508197, 0.07081713714197514] and parameters: {'n_layers': 1, 'embedding_dim': 96, 'lr': 0.00466372845018428, 'lambda_val': 0.0001408586097439621, 'batch_size': 3771, 'optimizer': 'Adam'}.
2026-05-23 03:04:49,078 - experiment_functions - INFO - Early stopping at epoch 500. Best Metrics: (0.0011455808616739015, 0.0017213114754098366, 0.0018877183055935358)
2026-05-23 03:04:49,242 - optuna.study.study - INFO - Trial 275 finished with values: [0.0011455808616739015, 0.0017213114754098366, 0.0018877183055935358] and parameters: {'n_layers': 1, 'embedding_dim': 128, 'lr': 0.0005134970540789423, 'lambda_val': 0.013489522394415601, 'batch_size': 3937, 'optimizer': 'SGD'}.
2026-05-23 03:04:54,987 - experiment_functions - INFO - Early stopping at epoch 1600. Best Metrics: (0.0660779538585729, 0.04524590163934426, 0.06585116486421216)
2026-05-23 03:04:55,579 - optuna.study.study - INFO - Trial 276 finished with values: [0.0660779538585729, 0.04524590163934426, 0.06585116486421216] and parameters: {'n_layers': 1, 'embedding_dim': 64, 'lr': 0.0005134970540789423, 'lambda_val': 0.006439135351806826, 'batch_size': 2427, 'optimizer': 'Adam'}.
2026-05-23 03:04:57,726 - experiment_functions - INFO - Early stopping at epoch 500. Best Metrics: (0.000990274869868658, 0.0013934426229508198, 0.0016948046943140755)
2026-05-23 03:04:57,892 - optuna.study.study - INFO - Trial 277 finished with values: [0.000990274869868658, 0.0013934426229508198, 0.0016948046943140755] and parameters: {'n_layers': 1, 'embedding_dim': 96, 'lr': 0.04355058083567188, 'lambda_val': 0.007024459859123817, 'batch_size': 1651, 'optimizer': 'SGD'}.
2026-05-23 03:05:00,430 - experiment_functions - INFO - Early stopping at epoch 600. Best Metrics: (0.05986533895978338, 0.04049180327868853, 0.056668267083086234)
2026-05-23 03:05:00,571 - optuna.study.study - INFO - Trial 278 finished with values: [0.05986533895978338, 0.04049180327868853, 0.056668267083086234] and parameters: {'n_layers': 1, 'embedding_dim': 64, 'lr': 0.00466372845018428, 'lambda_val': 0.0009810927157913494, 'batch_size': 1222, 'optimizer': 'Adam'}.
2026-05-23 03:05:03,066 - experiment_functions - INFO - Early stopping at epoch 500. Best Metrics: (0.0010456130877140573, 0.0020491803278688526, 0.002240841475704579)
2026-05-23 03:05:03,150 - optuna.study.study - INFO - Trial 279 finished with values: [0.0010456130877140573, 0.0020491803278688526, 0.002240841475704579] and parameters: {'n_layers': 1, 'embedding_dim': 256, 'lr': 0.00466372845018428, 'lambda_val': 5.485831556535543e-05, 'batch_size': 1269, 'optimizer': 'SGD'}.
2026-05-23 03:05:15,756 - optuna.study.study - INFO - Trial 280 finished with values: [0.061378111588487216, 0.04352459016393443, 0.059915459491299956] and parameters: {'n_layers': 1, 'embedding_dim': 32, 'lr': 0.0003465182892109986, 'lambda_val': 0.00017445053981747112, 'batch_size': 2773, 'optimizer': 'RMSprop'}.
2026-05-23 03:05:18,371 - experiment_functions - INFO - Early stopping at epoch 550. Best Metrics: (0.05445607782122065, 0.037377049180327866, 0.05216713968141326)
2026-05-23 03:05:18,512 - optuna.study.study - INFO - Trial 281 finished with values: [0.05445607782122065, 0.037377049180327866, 0.05216713968141326] and parameters: {'n_layers': 1, 'embedding_dim': 32, 'lr': 0.007526325741077799, 'lambda_val': 0.003720138868239179, 'batch_size': 3771, 'optimizer': 'Adam'}.
2026-05-23 03:05:24,492 - experiment_functions - INFO - Early stopping at epoch 1900. Best Metrics: (0.0025332229565498605, 0.002622950819672131, 0.003354399263647836)
2026-05-23 03:05:25,369 - optuna.study.study - INFO - Trial 282 finished with values: [0.0025332229565498605, 0.002622950819672131, 0.003354399263647836] and parameters: {'n_layers': 1, 'embedding_dim': 96, 'lr': 2.9600478190314336e-05, 'lambda_val': 8.60783053151504e-05, 'batch_size': 3771, 'optimizer': 'RMSprop'}.
2026-05-23 03:05:27,874 - experiment_functions - INFO - Early stopping at epoch 500. Best Metrics: (0.0037690689004511503, 0.002131147540983607, 0.0030173580613410745)
2026-05-23 03:05:27,981 - optuna.study.study - INFO - Trial 283 finished with values: [0.0037690689004511503, 0.002131147540983607, 0.0030173580613410745] and parameters: {'n_layers': 1, 'embedding_dim': 64, 'lr': 0.00012314747430599343, 'lambda_val': 0.003720138868239179, 'batch_size': 3937, 'optimizer': 'SGD'}.
2026-05-23 03:05:38,016 - experiment_functions - INFO - Early stopping at epoch 2950. Best Metrics: (0.05974220068647173, 0.044508196721311476, 0.0648361046171627)
2026-05-23 03:05:38,249 - optuna.study.study - INFO - Trial 284 finished with values: [0.05974220068647173, 0.044508196721311476, 0.0648361046171627] and parameters: {'n_layers': 1, 'embedding_dim': 64, 'lr': 0.00033929418945457667, 'lambda_val': 0.0035064867017704023, 'batch_size': 2773, 'optimizer': 'Adam'}.
2026-05-23 03:05:41,380 - experiment_functions - INFO - Early stopping at epoch 750. Best Metrics: (0.06345448050566682, 0.04368852459016394, 0.061951192878114264)
2026-05-23 03:05:41,474 - optuna.study.study - INFO - Trial 285 finished with values: [0.06345448050566682, 0.04368852459016394, 0.061951192878114264] and parameters: {'n_layers': 1, 'embedding_dim': 96, 'lr': 0.001459413805808463, 'lambda_val': 0.00023185127305384867, 'batch_size': 808, 'optimizer': 'Adam'}.
2026-05-23 03:05:46,390 - experiment_functions - INFO - Early stopping at epoch 1450. Best Metrics: (0.06281686240479578, 0.04188524590163934, 0.06375256069131478)
2026-05-23 03:05:46,530 - optuna.study.study - INFO - Trial 286 finished with values: [0.06281686240479578, 0.04188524590163934, 0.06375256069131478] and parameters: {'n_layers': 1, 'embedding_dim': 32, 'lr': 0.0005134970540789423, 'lambda_val': 0.004212470249457581, 'batch_size': 2427, 'optimizer': 'RMSprop'}.
2026-05-23 03:05:51,972 - experiment_functions - INFO - Early stopping at epoch 1300. Best Metrics: (0.061873960417752526, 0.043196721311475415, 0.06409021627436463)
2026-05-23 03:05:52,077 - optuna.study.study - INFO - Trial 287 finished with values: [0.061873960417752526, 0.043196721311475415, 0.06409021627436463] and parameters: {'n_layers': 1, 'embedding_dim': 256, 'lr': 0.0005134970540789423, 'lambda_val': 0.0009810927157913494, 'batch_size': 2427, 'optimizer': 'RMSprop'}.
2026-05-23 03:06:00,858 - experiment_functions - INFO - Early stopping at epoch 2400. Best Metrics: (0.0746558292721983, 0.04598360655737705, 0.07206258074472324)
2026-05-23 03:06:01,571 - optuna.study.study - INFO - Trial 288 finished with values: [0.0746558292721983, 0.04598360655737705, 0.07206258074472324] and parameters: {'n_layers': 1, 'embedding_dim': 256, 'lr': 0.0005134970540789423, 'lambda_val': 2.1146074643297403e-05, 'batch_size': 1269, 'optimizer': 'RMSprop'}.
2026-05-23 03:06:08,648 - experiment_functions - INFO - Early stopping at epoch 2450. Best Metrics: (0.07300224198526187, 0.04491803278688524, 0.06556276815791026)
