2026-05-23 01:21:23,992 - optuna.study.study - INFO - Trial 115 finished with values: [0.01938054261394329, 0.014098360655737708, 0.018630203721767453] and parameters: {'n_layers': 1, 'embedding_dim': 96, 'lr': 0.01491993466802033, 'lambda_val': 0.002338309902012662, 'batch_size': 3712, 'optimizer': 'RMSprop'}.
2026-05-23 01:21:26,441 - experiment_functions - INFO - Early stopping at epoch 600. Best Metrics: (0.035730866737771524, 0.01959016393442623, 0.03166565985615378)
2026-05-23 01:21:26,529 - optuna.study.study - INFO - Trial 116 finished with values: [0.035730866737771524, 0.01959016393442623, 0.03166565985615378] and parameters: {'n_layers': 1, 'embedding_dim': 96, 'lr': 0.0033679369179454638, 'lambda_val': 0.0004948769403467439, 'batch_size': 1031, 'optimizer': 'RMSprop'}.
2026-05-23 01:21:29,060 - experiment_functions - INFO - Early stopping at epoch 550. Best Metrics: (0.006896860314114266, 0.006721311475409837, 0.0074682649595189535)
2026-05-23 01:21:29,152 - optuna.study.study - INFO - Trial 117 finished with values: [0.006896860314114266, 0.006721311475409837, 0.0074682649595189535] and parameters: {'n_layers': 3, 'embedding_dim': 64, 'lr': 0.0054017846217753514, 'lambda_val': 0.06839725671798878, 'batch_size': 2846, 'optimizer': 'Adam'}.
2026-05-23 01:21:31,565 - experiment_functions - INFO - Early stopping at epoch 550. Best Metrics: (0.027598183456541095, 0.014672131147540986, 0.02172425552556909)
2026-05-23 01:21:31,661 - optuna.study.study - INFO - Trial 118 finished with values: [0.027598183456541095, 0.014672131147540986, 0.02172425552556909] and parameters: {'n_layers': 2, 'embedding_dim': 64, 'lr': 0.010275728897055822, 'lambda_val': 1.150702232586112e-06, 'batch_size': 3143, 'optimizer': 'Adam'}.
2026-05-23 01:21:34,779 - experiment_functions - INFO - Early stopping at epoch 550. Best Metrics: (0.03294318261961507, 0.01795081967213115, 0.027518441458291267)
2026-05-23 01:21:34,869 - optuna.study.study - INFO - Trial 119 finished with values: [0.03294318261961507, 0.01795081967213115, 0.027518441458291267] and parameters: {'n_layers': 2, 'embedding_dim': 64, 'lr': 0.010275728897055822, 'lambda_val': 1.150702232586112e-06, 'batch_size': 1031, 'optimizer': 'Adam'}.
2026-05-23 01:21:39,208 - experiment_functions - INFO - Early stopping at epoch 1250. Best Metrics: (0.018014752963077214, 0.009672131147540983, 0.013850677432373424)
2026-05-23 01:21:39,895 - optuna.study.study - INFO - Trial 120 finished with values: [0.018014752963077214, 0.009672131147540983, 0.013850677432373424] and parameters: {'n_layers': 2, 'embedding_dim': 128, 'lr': 0.010275728897055822, 'lambda_val': 4.477419176425064e-06, 'batch_size': 1322, 'optimizer': 'RMSprop'}.
2026-05-23 01:21:48,579 - experiment_functions - INFO - Early stopping at epoch 3000. Best Metrics: (0.0013559850297695064, 0.001557377049180328, 0.0018839905919930018)
2026-05-23 01:21:48,655 - optuna.study.study - INFO - Trial 121 finished with values: [0.0013559850297695064, 0.001557377049180328, 0.0018839905919930018] and parameters: {'n_layers': 1, 'embedding_dim': 32, 'lr': 2.6035332066765006e-05, 'lambda_val': 0.0008216615808921624, 'batch_size': 542, 'optimizer': 'RMSprop'}.
2026-05-23 01:21:52,626 - experiment_functions - INFO - Early stopping at epoch 1150. Best Metrics: (0.01301005488578546, 0.009344262295081968, 0.013597794577152923)
2026-05-23 01:21:52,778 - optuna.study.study - INFO - Trial 122 finished with values: [0.01301005488578546, 0.009344262295081968, 0.013597794577152923] and parameters: {'n_layers': 2, 'embedding_dim': 32, 'lr': 0.03788718493482174, 'lambda_val': 1.150702232586112e-06, 'batch_size': 3838, 'optimizer': 'RMSprop'}.
2026-05-23 01:21:54,973 - experiment_functions - INFO - Early stopping at epoch 500. Best Metrics: (0.0014867906074246084, 0.0013114754098360656, 0.0014712298115391214)
2026-05-23 01:21:55,090 - optuna.study.study - INFO - Trial 123 finished with values: [0.0014867906074246084, 0.0013114754098360656, 0.0014712298115391214] and parameters: {'n_layers': 3, 'embedding_dim': 64, 'lr': 0.010275728897055822, 'lambda_val': 4.064611678585387e-05, 'batch_size': 3937, 'optimizer': 'SGD'}.
2026-05-23 01:22:01,599 - experiment_functions - INFO - Early stopping at epoch 1850. Best Metrics: (0.039193111028412476, 0.022131147540983605, 0.03451893078017442)
2026-05-23 01:22:01,712 - optuna.study.study - INFO - Trial 124 finished with values: [0.039193111028412476, 0.022131147540983605, 0.03451893078017442] and parameters: {'n_layers': 1, 'embedding_dim': 64, 'lr': 0.0006071804751429957, 'lambda_val': 0.00012261737938750884, 'batch_size': 1088, 'optimizer': 'RMSprop'}.
2026-05-23 01:22:04,596 - experiment_functions - INFO - Early stopping at epoch 700. Best Metrics: (0.02934501331471385, 0.01852459016393443, 0.026220091840112123)
2026-05-23 01:22:04,820 - optuna.study.study - INFO - Trial 125 finished with values: [0.02934501331471385, 0.01852459016393443, 0.026220091840112123] and parameters: {'n_layers': 3, 'embedding_dim': 96, 'lr': 0.0006071804751429957, 'lambda_val': 3.599619235549841e-05, 'batch_size': 2030, 'optimizer': 'RMSprop'}.
2026-05-23 01:22:07,589 - experiment_functions - INFO - Early stopping at epoch 550. Best Metrics: (0.030987516154093803, 0.01639344262295082, 0.02760304647146861)
2026-05-23 01:22:07,673 - optuna.study.study - INFO - Trial 126 finished with values: [0.030987516154093803, 0.01639344262295082, 0.02760304647146861] and parameters: {'n_layers': 3, 'embedding_dim': 32, 'lr': 0.010275728897055822, 'lambda_val': 4.064611678585387e-05, 'batch_size': 1031, 'optimizer': 'Adam'}.
2026-05-23 01:22:11,256 - experiment_functions - INFO - Early stopping at epoch 600. Best Metrics: (0.016141697122836057, 0.011639344262295083, 0.016201291000708138)
2026-05-23 01:22:11,343 - optuna.study.study - INFO - Trial 127 finished with values: [0.016141697122836057, 0.011639344262295083, 0.016201291000708138] and parameters: {'n_layers': 1, 'embedding_dim': 96, 'lr': 0.020530939277008692, 'lambda_val': 0.0004948769403467439, 'batch_size': 3882, 'optimizer': 'RMSprop'}.
2026-05-23 01:22:14,201 - experiment_functions - INFO - Early stopping at epoch 550. Best Metrics: (0.01561834208562439, 0.009508196721311476, 0.013895715767016079)
2026-05-23 01:22:14,278 - optuna.study.study - INFO - Trial 128 finished with values: [0.01561834208562439, 0.009508196721311476, 0.013895715767016079] and parameters: {'n_layers': 3, 'embedding_dim': 256, 'lr': 0.00843988907664269, 'lambda_val': 0.00021481591111836083, 'batch_size': 2351, 'optimizer': 'RMSprop'}.
2026-05-23 01:22:16,698 - experiment_functions - INFO - Early stopping at epoch 600. Best Metrics: (0.03387650618099561, 0.017295081967213115, 0.027964731869357624)
2026-05-23 01:22:16,790 - optuna.study.study - INFO - Trial 129 finished with values: [0.03387650618099561, 0.017295081967213115, 0.027964731869357624] and parameters: {'n_layers': 2, 'embedding_dim': 32, 'lr': 0.0054017846217753514, 'lambda_val': 1.150702232586112e-06, 'batch_size': 542, 'optimizer': 'Adam'}.
2026-05-23 01:22:21,293 - experiment_functions - INFO - Early stopping at epoch 1200. Best Metrics: (0.03501290111557541, 0.01918032786885246, 0.030405627270957965)
2026-05-23 01:22:21,725 - optuna.study.study - INFO - Trial 130 finished with values: [0.03501290111557541, 0.01918032786885246, 0.030405627270957965] and parameters: {'n_layers': 2, 'embedding_dim': 96, 'lr': 0.00037298587418552697, 'lambda_val': 7.202525708659488e-05, 'batch_size': 2030, 'optimizer': 'RMSprop'}.
2026-05-23 01:22:25,447 - experiment_functions - INFO - Early stopping at epoch 850. Best Metrics: (0.0331554996184269, 0.01901639344262295, 0.02891899253403723)
2026-05-23 01:22:27,186 - optuna.study.study - INFO - Trial 131 finished with values: [0.0331554996184269, 0.01901639344262295, 0.02891899253403723] and parameters: {'n_layers': 2, 'embedding_dim': 96, 'lr': 0.0006071804751429957, 'lambda_val': 7.202525708659488e-05, 'batch_size': 4030, 'optimizer': 'Adam'}.
2026-05-23 01:22:29,614 - experiment_functions - INFO - Early stopping at epoch 600. Best Metrics: (0.011931103596470842, 0.010245901639344263, 0.012543044057619763)
2026-05-23 01:22:29,707 - optuna.study.study - INFO - Trial 132 finished with values: [0.011931103596470842, 0.010245901639344263, 0.012543044057619763] and parameters: {'n_layers': 1, 'embedding_dim': 32, 'lr': 0.0054017846217753514, 'lambda_val': 0.06839725671798878, 'batch_size': 2846, 'optimizer': 'Adam'}.
2026-05-23 01:22:32,134 - experiment_functions - INFO - Early stopping at epoch 550. Best Metrics: (0.01761246592328686, 0.011475409836065573, 0.015736830672423072)
2026-05-23 01:22:32,307 - optuna.study.study - INFO - Trial 133 finished with values: [0.01761246592328686, 0.011475409836065573, 0.015736830672423072] and parameters: {'n_layers': 2, 'embedding_dim': 64, 'lr': 0.012518042433364582, 'lambda_val': 0.0035465163760097325, 'batch_size': 3122, 'optimizer': 'Adam'}.
2026-05-23 01:22:34,682 - experiment_functions - INFO - Early stopping at epoch 550. Best Metrics: (0.022109547778021457, 0.01557377049180328, 0.020175204437760833)
2026-05-23 01:22:35,324 - optuna.study.study - INFO - Trial 134 finished with values: [0.022109547778021457, 0.01557377049180328, 0.020175204437760833] and parameters: {'n_layers': 1, 'embedding_dim': 96, 'lr': 0.0033679369179454638, 'lambda_val': 0.019329947758474065, 'batch_size': 2846, 'optimizer': 'RMSprop'}.
2026-05-23 01:22:37,599 - experiment_functions - INFO - Early stopping at epoch 500. Best Metrics: (0.0018283349095569662, 0.0010655737704918036, 0.001758635423450474)
2026-05-23 01:22:37,819 - optuna.study.study - INFO - Trial 135 finished with values: [0.0018283349095569662, 0.0010655737704918036, 0.001758635423450474] and parameters: {'n_layers': 1, 'embedding_dim': 96, 'lr': 0.0054017846217753514, 'lambda_val': 3.0220683903863306e-06, 'batch_size': 3018, 'optimizer': 'SGD'}.
2026-05-23 01:22:41,630 - experiment_functions - INFO - Early stopping at epoch 1100. Best Metrics: (0.011665540017732741, 0.007540983606557377, 0.01075211506430117)
2026-05-23 01:22:41,727 - optuna.study.study - INFO - Trial 136 finished with values: [0.011665540017732741, 0.007540983606557377, 0.01075211506430117] and parameters: {'n_layers': 3, 'embedding_dim': 32, 'lr': 0.08338835440209422, 'lambda_val': 4.477419176425064e-06, 'batch_size': 2236, 'optimizer': 'RMSprop'}.
2026-05-23 01:22:57,161 - optuna.study.study - INFO - Trial 137 finished with values: [0.00827867456201644, 0.005409836065573771, 0.008532575301003388] and parameters: {'n_layers': 2, 'embedding_dim': 256, 'lr': 6.470304829805458e-05, 'lambda_val': 4.477419176425064e-06, 'batch_size': 2913, 'optimizer': 'RMSprop'}.
2026-05-23 01:22:59,875 - experiment_functions - INFO - Early stopping at epoch 550. Best Metrics: (0.006934687199182996, 0.006311475409836066, 0.00810757234991314)
2026-05-23 01:22:59,960 - optuna.study.study - INFO - Trial 138 finished with values: [0.006934687199182996, 0.006311475409836066, 0.00810757234991314] and parameters: {'n_layers': 2, 'embedding_dim': 32, 'lr': 0.0054017846217753514, 'lambda_val': 0.06839725671798878, 'batch_size': 3712, 'optimizer': 'Adam'}.
2026-05-23 01:23:03,182 - experiment_functions - INFO - Early stopping at epoch 650. Best Metrics: (0.011438377152825014, 0.008032786885245903, 0.010909527782308895)
2026-05-23 01:23:03,264 - optuna.study.study - INFO - Trial 139 finished with values: [0.011438377152825014, 0.008032786885245903, 0.010909527782308895] and parameters: {'n_layers': 3, 'embedding_dim': 64, 'lr': 0.02917036398747882, 'lambda_val': 1.150702232586112e-06, 'batch_size': 1758, 'optimizer': 'Adam'}.
2026-05-23 01:23:06,223 - experiment_functions - INFO - Early stopping at epoch 750. Best Metrics: (0.012313113851765884, 0.007950819672131147, 0.010460175895613797)
2026-05-23 01:23:06,310 - optuna.study.study - INFO - Trial 140 finished with values: [0.012313113851765884, 0.007950819672131147, 0.010460175895613797] and parameters: {'n_layers': 2, 'embedding_dim': 64, 'lr': 0.010275728897055822, 'lambda_val': 0.00805052892318061, 'batch_size': 3122, 'optimizer': 'RMSprop'}.
2026-05-23 01:23:10,116 - experiment_functions - INFO - Early stopping at epoch 950. Best Metrics: (0.0068867442376661534, 0.0042622950819672135, 0.006022739471988026)
2026-05-23 01:23:10,422 - optuna.study.study - INFO - Trial 141 finished with values: [0.0068867442376661534, 0.0042622950819672135, 0.006022739471988026] and parameters: {'n_layers': 3, 'embedding_dim': 128, 'lr': 0.0054017846217753514, 'lambda_val': 0.06839725671798878, 'batch_size': 3018, 'optimizer': 'Adam'}.
2026-05-23 01:23:14,212 - experiment_functions - INFO - Early stopping at epoch 1100. Best Metrics: (0.03591224663825252, 0.019098360655737705, 0.02980392216169102)
2026-05-23 01:23:14,508 - optuna.study.study - INFO - Trial 142 finished with values: [0.03591224663825252, 0.019098360655737705, 0.02980392216169102] and parameters: {'n_layers': 3, 'embedding_dim': 32, 'lr': 0.0006237069115447143, 'lambda_val': 3.0220683903863306e-06, 'batch_size': 1031, 'optimizer': 'RMSprop'}.
2026-05-23 01:23:17,731 - experiment_functions - INFO - Early stopping at epoch 900. Best Metrics: (0.011721439682250364, 0.008360655737704918, 0.013009021553467847)
2026-05-23 01:23:17,819 - optuna.study.study - INFO - Trial 143 finished with values: [0.011721439682250364, 0.008360655737704918, 0.013009021553467847] and parameters: {'n_layers': 2, 'embedding_dim': 64, 'lr': 0.012518042433364582, 'lambda_val': 1.8703886629471356e-05, 'batch_size': 881, 'optimizer': 'RMSprop'}.
2026-05-23 01:23:21,682 - experiment_functions - INFO - Early stopping at epoch 1100. Best Metrics: (0.014571463894372312, 0.011393442622950821, 0.015122449749501495)
2026-05-23 01:23:21,799 - optuna.study.study - INFO - Trial 144 finished with values: [0.014571463894372312, 0.011393442622950821, 0.015122449749501495] and parameters: {'n_layers': 3, 'embedding_dim': 64, 'lr': 0.01491993466802033, 'lambda_val': 2.185196333765497e-06, 'batch_size': 2236, 'optimizer': 'RMSprop'}.
2026-05-23 01:23:24,148 - experiment_functions - INFO - Early stopping at epoch 600. Best Metrics: (0.027972832005444745, 0.014262295081967212, 0.02425442616225233)
2026-05-23 01:23:24,232 - optuna.study.study - INFO - Trial 145 finished with values: [0.027972832005444745, 0.014262295081967212, 0.02425442616225233] and parameters: {'n_layers': 1, 'embedding_dim': 64, 'lr': 0.00736079824955284, 'lambda_val': 1.150702232586112e-06, 'batch_size': 542, 'optimizer': 'RMSprop'}.
2026-05-23 01:23:27,438 - experiment_functions - INFO - Early stopping at epoch 650. Best Metrics: (0.015722194963979075, 0.009754098360655739, 0.013276032555687128)
2026-05-23 01:23:27,533 - optuna.study.study - INFO - Trial 146 finished with values: [0.015722194963979075, 0.009754098360655739, 0.013276032555687128] and parameters: {'n_layers': 3, 'embedding_dim': 64, 'lr': 0.010275728897055822, 'lambda_val': 7.202525708659488e-05, 'batch_size': 1088, 'optimizer': 'RMSprop'}.
2026-05-23 01:23:32,028 - experiment_functions - INFO - Early stopping at epoch 1450. Best Metrics: (0.016805693167242553, 0.01180327868852459, 0.017467072350495)
2026-05-23 01:23:32,264 - optuna.study.study - INFO - Trial 147 finished with values: [0.016805693167242553, 0.01180327868852459, 0.017467072350495] and parameters: {'n_layers': 1, 'embedding_dim': 64, 'lr': 0.017022768569889442, 'lambda_val': 4.477419176425064e-06, 'batch_size': 798, 'optimizer': 'RMSprop'}.
2026-05-23 01:23:35,389 - experiment_functions - INFO - Early stopping at epoch 750. Best Metrics: (0.00987940305642062, 0.006475409836065574, 0.008930128504861074)
2026-05-23 01:23:35,515 - optuna.study.study - INFO - Trial 148 finished with values: [0.00987940305642062, 0.006475409836065574, 0.008930128504861074] and parameters: {'n_layers': 2, 'embedding_dim': 64, 'lr': 0.010275728897055822, 'lambda_val': 0.018651450167950074, 'batch_size': 3122, 'optimizer': 'RMSprop'}.
2026-05-23 01:23:50,205 - optuna.study.study - INFO - Trial 149 finished with values: [0.012028088933631463, 0.007377049180327869, 0.01205343170160879] and parameters: {'n_layers': 2, 'embedding_dim': 256, 'lr': 6.470304829805458e-05, 'lambda_val': 5.171882167091852e-06, 'batch_size': 2913, 'optimizer': 'Adam'}.
2026-05-23 01:23:55,177 - experiment_functions - INFO - Early stopping at epoch 1550. Best Metrics: (0.03347930178258037, 0.01959016393442623, 0.030748157055744282)
2026-05-23 01:23:55,259 - optuna.study.study - INFO - Trial 150 finished with values: [0.03347930178258037, 0.01959016393442623, 0.030748157055744282] and parameters: {'n_layers': 1, 'embedding_dim': 96, 'lr': 0.0006071804751429957, 'lambda_val': 7.202525708659488e-05, 'batch_size': 1554, 'optimizer': 'RMSprop'}.
2026-05-23 01:23:57,819 - experiment_functions - INFO - Early stopping at epoch 600. Best Metrics: (0.02894242099013997, 0.015655737704918033, 0.02417026193584325)
2026-05-23 01:23:57,912 - optuna.study.study - INFO - Trial 151 finished with values: [0.02894242099013997, 0.015655737704918033, 0.02417026193584325] and parameters: {'n_layers': 3, 'embedding_dim': 32, 'lr': 0.0054017846217753514, 'lambda_val': 1.150702232586112e-06, 'batch_size': 542, 'optimizer': 'Adam'}.
2026-05-23 01:24:02,330 - experiment_functions - INFO - Early stopping at epoch 1350. Best Metrics: (0.040015076714850446, 0.021065573770491803, 0.03307096520819275)
2026-05-23 01:24:02,429 - optuna.study.study - INFO - Trial 152 finished with values: [0.040015076714850446, 0.021065573770491803, 0.03307096520819275] and parameters: {'n_layers': 1, 'embedding_dim': 96, 'lr': 0.000496802361339361, 'lambda_val': 7.202525708659488e-05, 'batch_size': 2030, 'optimizer': 'RMSprop'}.
2026-05-23 01:24:06,277 - experiment_functions - INFO - Early stopping at epoch 1100. Best Metrics: (0.020812303057922234, 0.014836065573770494, 0.021071935508411833)
2026-05-23 01:24:06,685 - optuna.study.study - INFO - Trial 153 finished with values: [0.020812303057922234, 0.014836065573770494, 0.021071935508411833] and parameters: {'n_layers': 3, 'embedding_dim': 32, 'lr': 0.0006071804751429957, 'lambda_val': 7.202525708659488e-05, 'batch_size': 1987, 'optimizer': 'RMSprop'}.
2026-05-23 01:24:11,325 - experiment_functions - INFO - Early stopping at epoch 1150. Best Metrics: (0.0392932536445947, 0.019836065573770493, 0.032088964609711605)
2026-05-23 01:24:11,400 - optuna.study.study - INFO - Trial 154 finished with values: [0.0392932536445947, 0.019836065573770493, 0.032088964609711605] and parameters: {'n_layers': 3, 'embedding_dim': 32, 'lr': 0.0006071804751429957, 'lambda_val': 0.00012261737938750884, 'batch_size': 1031, 'optimizer': 'RMSprop'}.
2026-05-23 01:24:13,618 - experiment_functions - INFO - Early stopping at epoch 500. Best Metrics: (0.002277758477645044, 0.0017213114754098362, 0.0027165573329836195)
2026-05-23 01:24:13,993 - optuna.study.study - INFO - Trial 155 finished with values: [0.002277758477645044, 0.0017213114754098362, 0.0027165573329836195] and parameters: {'n_layers': 2, 'embedding_dim': 128, 'lr': 0.010275728897055822, 'lambda_val': 4.477419176425064e-06, 'batch_size': 1322, 'optimizer': 'SGD'}.
2026-05-23 01:24:18,191 - experiment_functions - INFO - Early stopping at epoch 1100. Best Metrics: (0.03559359078516459, 0.019344262295081967, 0.03049084669087164)
2026-05-23 01:24:18,286 - optuna.study.study - INFO - Trial 156 finished with values: [0.03559359078516459, 0.019344262295081967, 0.03049084669087164] and parameters: {'n_layers': 1, 'embedding_dim': 96, 'lr': 0.0006071804751429957, 'lambda_val': 0.004992537024777532, 'batch_size': 3085, 'optimizer': 'RMSprop'}.
2026-05-23 01:24:21,574 - experiment_functions - INFO - Early stopping at epoch 900. Best Metrics: (0.023674635766978945, 0.01639344262295082, 0.023095072642396394)
2026-05-23 01:24:21,664 - optuna.study.study - INFO - Trial 157 finished with values: [0.023674635766978945, 0.01639344262295082, 0.023095072642396394] and parameters: {'n_layers': 2, 'embedding_dim': 96, 'lr': 0.0006071804751429957, 'lambda_val': 0.023058969332518622, 'batch_size': 1031, 'optimizer': 'Adam'}.
2026-05-23 01:24:23,964 - experiment_functions - INFO - Early stopping at epoch 550. Best Metrics: (0.022095073660612648, 0.014344262295081968, 0.02029184225853118)
2026-05-23 01:24:24,079 - optuna.study.study - INFO - Trial 158 finished with values: [0.022095073660612648, 0.014344262295081968, 0.02029184225853118] and parameters: {'n_layers': 1, 'embedding_dim': 96, 'lr': 0.00736079824955284, 'lambda_val': 7.202525708659488e-05, 'batch_size': 3712, 'optimizer': 'RMSprop'}.
2026-05-23 01:24:26,328 - experiment_functions - INFO - Early stopping at epoch 550. Best Metrics: (0.021173584761217216, 0.013770491803278693, 0.022038824143588463)
2026-05-23 01:24:26,805 - optuna.study.study - INFO - Trial 159 finished with values: [0.021173584761217216, 0.013770491803278693, 0.022038824143588463] and parameters: {'n_layers': 1, 'embedding_dim': 64, 'lr': 0.01491993466802033, 'lambda_val': 2.185196333765497e-06, 'batch_size': 1987, 'optimizer': 'Adam'}.
2026-05-23 01:24:29,216 - experiment_functions - INFO - Early stopping at epoch 500. Best Metrics: (0.0012391208575829604, 0.0014754098360655736, 0.0018383549035197613)
2026-05-23 01:24:29,337 - optuna.study.study - INFO - Trial 160 finished with values: [0.0012391208575829604, 0.0014754098360655736, 0.0018383549035197613] and parameters: {'n_layers': 1, 'embedding_dim': 256, 'lr': 0.0014902400429312995, 'lambda_val': 0.010949527724278119, 'batch_size': 1031, 'optimizer': 'SGD'}.
2026-05-23 01:24:31,804 - experiment_functions - INFO - Early stopping at epoch 550. Best Metrics: (0.022411976609214908, 0.015491803278688524, 0.021677555858135817)
