2026-05-22 23:20:14,819 - optuna.study.study - INFO - Trial 144 finished with values: [0.03726441896878801, 0.023688524590163938, 0.03273209068253271] and parameters: {'n_layers': 4, 'embedding_dim': 64, 'lr': 0.0012691035628072148, 'lambda_val': 7.613685556639934e-06, 'batch_size': 1091, 'optimizer': 'Adam'}.
2026-05-22 23:20:36,524 - optuna.study.study - INFO - Trial 145 finished with values: [0.07044418813811704, 0.04245901639344262, 0.06395638550829753] and parameters: {'n_layers': 4, 'embedding_dim': 128, 'lr': 0.00014044488297116188, 'lambda_val': 0.0006542099358730213, 'batch_size': 874, 'optimizer': 'RMSprop'}.
2026-05-22 23:20:41,620 - experiment_functions - INFO - Early stopping at epoch 550. Best Metrics: (0.03599649971858451, 0.02262295081967213, 0.03284533612350959)
2026-05-22 23:20:41,897 - optuna.study.study - INFO - Trial 146 finished with values: [0.03599649971858451, 0.02262295081967213, 0.03284533612350959] and parameters: {'n_layers': 4, 'embedding_dim': 256, 'lr': 0.0015972864508252563, 'lambda_val': 4.1855561222722974e-06, 'batch_size': 3835, 'optimizer': 'Adam'}.
2026-05-22 23:20:45,191 - experiment_functions - INFO - Early stopping at epoch 700. Best Metrics: (0.0955620002183746, 0.0539344262295082, 0.08708103033828904)
2026-05-22 23:20:46,460 - optuna.study.study - INFO - Trial 147 finished with values: [0.0955620002183746, 0.0539344262295082, 0.08708103033828904] and parameters: {'n_layers': 1, 'embedding_dim': 64, 'lr': 0.0014373137364726936, 'lambda_val': 0.004805532813491775, 'batch_size': 2610, 'optimizer': 'Adam'}.
2026-05-22 23:20:49,946 - experiment_functions - INFO - Early stopping at epoch 600. Best Metrics: (0.01658839641959866, 0.009672131147540983, 0.014178838497970669)
2026-05-22 23:20:50,780 - optuna.study.study - INFO - Trial 148 finished with values: [0.01658839641959866, 0.009672131147540983, 0.014178838497970669] and parameters: {'n_layers': 4, 'embedding_dim': 32, 'lr': 0.014120604580233384, 'lambda_val': 7.613685556639934e-06, 'batch_size': 1995, 'optimizer': 'Adam'}.
2026-05-22 23:20:53,467 - experiment_functions - INFO - Early stopping at epoch 600. Best Metrics: (0.0926157540559018, 0.05147540983606558, 0.08522443766091091)
2026-05-22 23:20:53,606 - optuna.study.study - INFO - Trial 149 finished with values: [0.0926157540559018, 0.05147540983606558, 0.08522443766091091] and parameters: {'n_layers': 1, 'embedding_dim': 64, 'lr': 0.0032374955494066686, 'lambda_val': 0.0007483799258451436, 'batch_size': 1033, 'optimizer': 'Adam'}.
2026-05-22 23:21:10,005 - optuna.study.study - INFO - Trial 150 finished with values: [0.11654966697036193, 0.06303278688524591, 0.10464798701352016] and parameters: {'n_layers': 1, 'embedding_dim': 256, 'lr': 0.0002391583318230419, 'lambda_val': 0.0001333811184810849, 'batch_size': 2149, 'optimizer': 'Adam'}.
2026-05-22 23:21:13,148 - experiment_functions - INFO - Early stopping at epoch 550. Best Metrics: (0.031317123747668776, 0.01852459016393443, 0.027397838348430195)
2026-05-22 23:21:13,332 - optuna.study.study - INFO - Trial 151 finished with values: [0.031317123747668776, 0.01852459016393443, 0.027397838348430195] and parameters: {'n_layers': 1, 'embedding_dim': 256, 'lr': 0.038659458348695774, 'lambda_val': 2.3648996790815136e-05, 'batch_size': 1071, 'optimizer': 'Adam'}.
2026-05-22 23:21:16,108 - experiment_functions - INFO - Early stopping at epoch 550. Best Metrics: (0.04630515972621633, 0.033688524590163936, 0.04751761224671731)
2026-05-22 23:21:16,254 - optuna.study.study - INFO - Trial 152 finished with values: [0.04630515972621633, 0.033688524590163936, 0.04751761224671731] and parameters: {'n_layers': 1, 'embedding_dim': 128, 'lr': 0.0014373137364726936, 'lambda_val': 0.03380374300181671, 'batch_size': 3643, 'optimizer': 'RMSprop'}.
2026-05-22 23:21:30,191 - optuna.study.study - INFO - Trial 153 finished with values: [0.0512422589748492, 0.035, 0.052038705165900236] and parameters: {'n_layers': 2, 'embedding_dim': 64, 'lr': 0.00014191753167124515, 'lambda_val': 2.2495991978320352e-05, 'batch_size': 653, 'optimizer': 'RMSprop'}.
2026-05-22 23:21:40,940 - experiment_functions - INFO - Early stopping at epoch 2500. Best Metrics: (0.048801886622640615, 0.03270491803278689, 0.04622318784270799)
2026-05-22 23:21:41,460 - optuna.study.study - INFO - Trial 154 finished with values: [0.048801886622640615, 0.03270491803278689, 0.04622318784270799] and parameters: {'n_layers': 3, 'embedding_dim': 64, 'lr': 0.0002391583318230419, 'lambda_val': 0.0011596678103466965, 'batch_size': 1661, 'optimizer': 'Adam'}.
2026-05-22 23:21:44,381 - experiment_functions - INFO - Early stopping at epoch 500. Best Metrics: (0.0008925174111682042, 0.0014754098360655738, 0.0018499893973515705)
2026-05-22 23:21:44,552 - optuna.study.study - INFO - Trial 155 finished with values: [0.0008925174111682042, 0.0014754098360655738, 0.0018499893973515705] and parameters: {'n_layers': 1, 'embedding_dim': 256, 'lr': 0.002406863740771825, 'lambda_val': 1.2429846238556994e-05, 'batch_size': 3643, 'optimizer': 'SGD'}.
2026-05-22 23:21:58,178 - optuna.study.study - INFO - Trial 156 finished with values: [0.0739412890168239, 0.04885245901639345, 0.07097910279197477] and parameters: {'n_layers': 1, 'embedding_dim': 96, 'lr': 0.00018259329948876513, 'lambda_val': 4.1855561222722974e-06, 'batch_size': 2536, 'optimizer': 'Adam'}.
2026-05-22 23:22:14,701 - optuna.study.study - INFO - Trial 157 finished with values: [0.07157001390876612, 0.045737704918032786, 0.06809021468105315] and parameters: {'n_layers': 2, 'embedding_dim': 128, 'lr': 0.00018259329948876513, 'lambda_val': 0.004805532813491775, 'batch_size': 653, 'optimizer': 'Adam'}.
2026-05-22 23:22:31,037 - optuna.study.study - INFO - Trial 158 finished with values: [0.0717601921563228, 0.04204918032786885, 0.06895406231427166] and parameters: {'n_layers': 2, 'embedding_dim': 128, 'lr': 0.00014191753167124515, 'lambda_val': 4.1855561222722974e-06, 'batch_size': 653, 'optimizer': 'RMSprop'}.
2026-05-22 23:22:36,897 - experiment_functions - INFO - Early stopping at epoch 1250. Best Metrics: (0.12137851046105708, 0.05942622950819672, 0.10025347394278099)
2026-05-22 23:22:37,193 - optuna.study.study - INFO - Trial 159 finished with values: [0.12137851046105708, 0.05942622950819672, 0.10025347394278099] and parameters: {'n_layers': 1, 'embedding_dim': 256, 'lr': 0.0005586191809811369, 'lambda_val': 2.3648996790815136e-05, 'batch_size': 2288, 'optimizer': 'RMSprop'}.
2026-05-22 23:22:54,558 - optuna.study.study - INFO - Trial 160 finished with values: [0.04960962559748219, 0.036065573770491806, 0.05106622972816639] and parameters: {'n_layers': 3, 'embedding_dim': 64, 'lr': 0.0002391583318230419, 'lambda_val': 0.0011596678103466965, 'batch_size': 653, 'optimizer': 'Adam'}.
2026-05-22 23:22:59,119 - experiment_functions - INFO - Early stopping at epoch 650. Best Metrics: (0.06263360971113634, 0.037540983606557374, 0.05851760053856718)
2026-05-22 23:22:59,928 - optuna.study.study - INFO - Trial 161 finished with values: [0.06263360971113634, 0.037540983606557374, 0.05851760053856718] and parameters: {'n_layers': 2, 'embedding_dim': 256, 'lr': 0.0005586191809811369, 'lambda_val': 2.3648996790815136e-05, 'batch_size': 3835, 'optimizer': 'RMSprop'}.
2026-05-22 23:23:07,596 - experiment_functions - INFO - Early stopping at epoch 500. Best Metrics: (0.003124657752553308, 0.002704918032786885, 0.003127213863071688)
2026-05-22 23:23:08,114 - optuna.study.study - INFO - Trial 162 finished with values: [0.003124657752553308, 0.002704918032786885, 0.003127213863071688] and parameters: {'n_layers': 1, 'embedding_dim': 128, 'lr': 0.01158026631563179, 'lambda_val': 0.000154598890124529, 'batch_size': 704, 'optimizer': 'SGD'}.
2026-05-22 23:23:12,305 - experiment_functions - INFO - Early stopping at epoch 550. Best Metrics: (0.05692669676803802, 0.03516393442622951, 0.052874532026296994)
2026-05-22 23:23:12,401 - optuna.study.study - INFO - Trial 163 finished with values: [0.05692669676803802, 0.03516393442622951, 0.052874532026296994] and parameters: {'n_layers': 2, 'embedding_dim': 256, 'lr': 0.0008839940075688664, 'lambda_val': 0.00013566611589542861, 'batch_size': 3643, 'optimizer': 'RMSprop'}.
2026-05-22 23:23:27,013 - experiment_functions - INFO - Early stopping at epoch 2600. Best Metrics: (0.04869307724877751, 0.029262295081967215, 0.04226184148004112)
2026-05-22 23:23:27,626 - optuna.study.study - INFO - Trial 164 finished with values: [0.04869307724877751, 0.029262295081967215, 0.04226184148004112] and parameters: {'n_layers': 4, 'embedding_dim': 128, 'lr': 0.00014044488297116188, 'lambda_val': 0.004805532813491775, 'batch_size': 2448, 'optimizer': 'RMSprop'}.
2026-05-22 23:23:40,331 - optuna.study.study - INFO - Trial 165 finished with values: [0.0335221730228751, 0.022540983606557378, 0.033231682068413426] and parameters: {'n_layers': 1, 'embedding_dim': 32, 'lr': 0.0001268613074675354, 'lambda_val': 0.004805532813491775, 'batch_size': 3643, 'optimizer': 'RMSprop'}.
2026-05-22 23:23:43,483 - experiment_functions - INFO - Early stopping at epoch 600. Best Metrics: (0.05849265073131843, 0.037868852459016396, 0.056717166820251706)
2026-05-22 23:23:44,223 - optuna.study.study - INFO - Trial 166 finished with values: [0.05849265073131843, 0.037868852459016396, 0.056717166820251706] and parameters: {'n_layers': 2, 'embedding_dim': 96, 'lr': 0.002406863740771825, 'lambda_val': 4.1855561222722974e-06, 'batch_size': 1303, 'optimizer': 'Adam'}.
2026-05-22 23:23:47,629 - experiment_functions - INFO - Early stopping at epoch 500. Best Metrics: (0.029638490489427214, 0.015245901639344264, 0.02628387362408662)
2026-05-22 23:23:48,017 - optuna.study.study - INFO - Trial 167 finished with values: [0.029638490489427214, 0.015245901639344264, 0.02628387362408662] and parameters: {'n_layers': 3, 'embedding_dim': 128, 'lr': 0.033714003644687525, 'lambda_val': 4.1855561222722974e-06, 'batch_size': 3643, 'optimizer': 'RMSprop'}.
2026-05-22 23:23:56,927 - experiment_functions - INFO - Early stopping at epoch 2550. Best Metrics: (0.07046420272311099, 0.04057377049180328, 0.06229323020395061)
2026-05-22 23:23:57,106 - optuna.study.study - INFO - Trial 168 finished with values: [0.07046420272311099, 0.04057377049180328, 0.06229323020395061] and parameters: {'n_layers': 1, 'embedding_dim': 96, 'lr': 0.04749259226820051, 'lambda_val': 0.004805532813491775, 'batch_size': 3835, 'optimizer': 'RMSprop'}.
2026-05-22 23:24:09,931 - optuna.study.study - INFO - Trial 169 finished with values: [0.058081127349531844, 0.036721311475409836, 0.051724530096189006] and parameters: {'n_layers': 1, 'embedding_dim': 64, 'lr': 0.00014191753167124515, 'lambda_val': 1.953346404746138e-05, 'batch_size': 3835, 'optimizer': 'RMSprop'}.
2026-05-22 23:24:12,640 - experiment_functions - INFO - Early stopping at epoch 500. Best Metrics: (0.0007910217773308179, 0.0014754098360655738, 0.0017584309658317566)
2026-05-22 23:24:12,776 - optuna.study.study - INFO - Trial 170 finished with values: [0.0007910217773308179, 0.0014754098360655738, 0.0017584309658317566] and parameters: {'n_layers': 2, 'embedding_dim': 32, 'lr': 0.0002391583318230419, 'lambda_val': 0.015604800721470977, 'batch_size': 1459, 'optimizer': 'SGD'}.
2026-05-22 23:24:16,605 - experiment_functions - INFO - Early stopping at epoch 850. Best Metrics: (0.019860284336886712, 0.01081967213114754, 0.017755611793078673)
2026-05-22 23:24:16,742 - optuna.study.study - INFO - Trial 171 finished with values: [0.019860284336886712, 0.01081967213114754, 0.017755611793078673] and parameters: {'n_layers': 1, 'embedding_dim': 96, 'lr': 0.07830847329586445, 'lambda_val': 4.1855561222722974e-06, 'batch_size': 3643, 'optimizer': 'Adam'}.
2026-05-22 23:24:35,777 - experiment_functions - INFO - Early stopping at epoch 3850. Best Metrics: (0.04412286705496929, 0.03295081967213115, 0.043148118301493836)
2026-05-22 23:24:35,918 - optuna.study.study - INFO - Trial 172 finished with values: [0.04412286705496929, 0.03295081967213115, 0.043148118301493836] and parameters: {'n_layers': 2, 'embedding_dim': 256, 'lr': 0.00014044488297116188, 'lambda_val': 0.03782840193511915, 'batch_size': 612, 'optimizer': 'RMSprop'}.
2026-05-22 23:24:50,350 - optuna.study.study - INFO - Trial 173 finished with values: [0.058642484487196646, 0.03434426229508197, 0.05341309369044184] and parameters: {'n_layers': 1, 'embedding_dim': 128, 'lr': 0.00014191753167124515, 'lambda_val': 4.1855561222722974e-06, 'batch_size': 1144, 'optimizer': 'RMSprop'}.
2026-05-22 23:24:53,448 - experiment_functions - INFO - Early stopping at epoch 500. Best Metrics: (0.0031908480778710248, 0.002295081967213115, 0.0030642643192516704)
2026-05-22 23:24:53,609 - optuna.study.study - INFO - Trial 174 finished with values: [0.0031908480778710248, 0.002295081967213115, 0.0030642643192516704] and parameters: {'n_layers': 4, 'embedding_dim': 64, 'lr': 1.4653622832861874e-05, 'lambda_val': 0.004805532813491775, 'batch_size': 653, 'optimizer': 'SGD'}.
2026-05-22 23:25:06,053 - experiment_functions - INFO - Early stopping at epoch 3000. Best Metrics: (0.06194495467745106, 0.03819672131147541, 0.06032483276486715)
2026-05-22 23:25:06,726 - optuna.study.study - INFO - Trial 175 finished with values: [0.06194495467745106, 0.03819672131147541, 0.06032483276486715] and parameters: {'n_layers': 3, 'embedding_dim': 64, 'lr': 0.0002391583318230419, 'lambda_val': 1.1461566563812868e-06, 'batch_size': 1116, 'optimizer': 'RMSprop'}.
2026-05-22 23:25:29,521 - optuna.study.study - INFO - Trial 176 finished with values: [0.1065939242300686, 0.0589344262295082, 0.09707406000922318] and parameters: {'n_layers': 1, 'embedding_dim': 256, 'lr': 0.00018259329948876513, 'lambda_val': 0.0016010999314799575, 'batch_size': 2536, 'optimizer': 'Adam'}.
2026-05-22 23:25:41,950 - experiment_functions - INFO - Early stopping at epoch 2850. Best Metrics: (0.11055598858604958, 0.061229508196721315, 0.10213434220397076)
2026-05-22 23:25:42,089 - optuna.study.study - INFO - Trial 177 finished with values: [0.11055598858604958, 0.061229508196721315, 0.10213434220397076] and parameters: {'n_layers': 1, 'embedding_dim': 256, 'lr': 0.00022439006945493, 'lambda_val': 0.004163877683375522, 'batch_size': 3643, 'optimizer': 'Adam'}.
2026-05-22 23:25:46,131 - experiment_functions - INFO - Early stopping at epoch 900. Best Metrics: (0.08058938261040531, 0.04745901639344262, 0.07172884462387949)
2026-05-22 23:25:46,276 - optuna.study.study - INFO - Trial 178 finished with values: [0.08058938261040531, 0.04745901639344262, 0.07172884462387949] and parameters: {'n_layers': 2, 'embedding_dim': 32, 'lr': 0.0013596200813318466, 'lambda_val': 7.913101106142164e-06, 'batch_size': 891, 'optimizer': 'Adam'}.
2026-05-22 23:25:59,822 - optuna.study.study - INFO - Trial 179 finished with values: [0.0528128354240569, 0.03762295081967213, 0.05248137073413769] and parameters: {'n_layers': 1, 'embedding_dim': 64, 'lr': 0.00014191753167124515, 'lambda_val': 0.004805532813491775, 'batch_size': 2610, 'optimizer': 'Adam'}.
2026-05-22 23:26:03,558 - experiment_functions - INFO - Early stopping at epoch 550. Best Metrics: (0.0526095689431529, 0.024754098360655737, 0.04068377507714397)
2026-05-22 23:26:03,706 - optuna.study.study - INFO - Trial 180 finished with values: [0.0526095689431529, 0.024754098360655737, 0.04068377507714397] and parameters: {'n_layers': 1, 'embedding_dim': 64, 'lr': 0.012599454153819625, 'lambda_val': 2.3648996790815136e-05, 'batch_size': 3835, 'optimizer': 'RMSprop'}.
2026-05-22 23:26:20,983 - optuna.study.study - INFO - Trial 181 finished with values: [0.045415456084978156, 0.03163934426229508, 0.04349271751023598] and parameters: {'n_layers': 3, 'embedding_dim': 64, 'lr': 0.00014191753167124515, 'lambda_val': 0.0011596678103466965, 'batch_size': 3045, 'optimizer': 'RMSprop'}.
2026-05-22 23:26:25,067 - experiment_functions - INFO - Early stopping at epoch 800. Best Metrics: (0.05670356424788631, 0.03778688524590164, 0.05254276044262368)
2026-05-22 23:26:25,226 - optuna.study.study - INFO - Trial 182 finished with values: [0.05670356424788631, 0.03778688524590164, 0.05254276044262368] and parameters: {'n_layers': 2, 'embedding_dim': 96, 'lr': 0.0008184011149012127, 'lambda_val': 0.004163877683375522, 'batch_size': 2759, 'optimizer': 'Adam'}.
2026-05-22 23:26:41,976 - optuna.study.study - INFO - Trial 183 finished with values: [0.06720361018731721, 0.04368852459016394, 0.06676805465700075] and parameters: {'n_layers': 3, 'embedding_dim': 64, 'lr': 0.0002391583318230419, 'lambda_val': 0.0007483799258451436, 'batch_size': 1033, 'optimizer': 'RMSprop'}.
2026-05-22 23:26:45,476 - experiment_functions - INFO - Early stopping at epoch 650. Best Metrics: (0.09748727519354722, 0.05155737704918033, 0.0895212199752859)
2026-05-22 23:26:46,058 - optuna.study.study - INFO - Trial 184 finished with values: [0.09748727519354722, 0.05155737704918033, 0.0895212199752859] and parameters: {'n_layers': 1, 'embedding_dim': 256, 'lr': 0.0029369804066849336, 'lambda_val': 0.0001473158611730725, 'batch_size': 653, 'optimizer': 'Adam'}.
2026-05-22 23:26:57,214 - experiment_functions - INFO - Early stopping at epoch 2550. Best Metrics: (0.026089890151971835, 0.022459016393442624, 0.03009692426794449)
2026-05-22 23:26:57,502 - optuna.study.study - INFO - Trial 185 finished with values: [0.026089890151971835, 0.022459016393442624, 0.03009692426794449] and parameters: {'n_layers': 2, 'embedding_dim': 128, 'lr': 0.00014702351969030086, 'lambda_val': 0.05557682822493449, 'batch_size': 3414, 'optimizer': 'RMSprop'}.
2026-05-22 23:27:14,658 - optuna.study.study - INFO - Trial 186 finished with values: [0.09246740877106173, 0.05122950819672131, 0.0824301967077835] and parameters: {'n_layers': 1, 'embedding_dim': 256, 'lr': 0.00014191753167124515, 'lambda_val': 0.0016010999314799575, 'batch_size': 3643, 'optimizer': 'Adam'}.
2026-05-22 23:27:30,688 - experiment_functions - INFO - Early stopping at epoch 3700. Best Metrics: (0.030233441219858548, 0.021147540983606557, 0.02865788316676247)
2026-05-22 23:27:30,988 - optuna.study.study - INFO - Trial 187 finished with values: [0.030233441219858548, 0.021147540983606557, 0.02865788316676247] and parameters: {'n_layers': 4, 'embedding_dim': 32, 'lr': 0.00014044488297116188, 'lambda_val': 0.005129821983037811, 'batch_size': 891, 'optimizer': 'Adam'}.
2026-05-22 23:27:35,667 - experiment_functions - INFO - Early stopping at epoch 1000. Best Metrics: (0.08563489214316855, 0.04606557377049181, 0.07925335546012527)
2026-05-22 23:27:36,883 - optuna.study.study - INFO - Trial 188 finished with values: [0.08563489214316855, 0.04606557377049181, 0.07925335546012527] and parameters: {'n_layers': 2, 'embedding_dim': 96, 'lr': 0.0005586191809811369, 'lambda_val': 2.3648996790815136e-05, 'batch_size': 1459, 'optimizer': 'RMSprop'}.
2026-05-22 23:27:54,009 - optuna.study.study - INFO - Trial 189 finished with values: [0.06297256339666978, 0.03901639344262295, 0.05841065822823231] and parameters: {'n_layers': 2, 'embedding_dim': 128, 'lr': 0.00014191753167124515, 'lambda_val': 0.0001473158611730725, 'batch_size': 3643, 'optimizer': 'RMSprop'}.
2026-05-22 23:28:15,528 - experiment_functions - INFO - Early stopping at epoch 3950. Best Metrics: (0.06663470740718148, 0.03762295081967213, 0.06120481380079591)
2026-05-22 23:28:15,700 - optuna.study.study - INFO - Trial 190 finished with values: [0.06663470740718148, 0.03762295081967213, 0.06120481380079591] and parameters: {'n_layers': 4, 'embedding_dim': 128, 'lr': 0.00014191753167124515, 'lambda_val': 2.3648996790815136e-05, 'batch_size': 1873, 'optimizer': 'RMSprop'}.
2026-05-22 23:28:18,569 - experiment_functions - INFO - Early stopping at epoch 600. Best Metrics: (0.0815934920933583, 0.05024590163934427, 0.08010837552208583)
2026-05-22 23:28:18,666 - optuna.study.study - INFO - Trial 191 finished with values: [0.0815934920933583, 0.05024590163934427, 0.08010837552208583] and parameters: {'n_layers': 1, 'embedding_dim': 64, 'lr': 0.0014373137364726936, 'lambda_val': 0.004805532813491775, 'batch_size': 3835, 'optimizer': 'RMSprop'}.
2026-05-22 23:28:22,205 - experiment_functions - INFO - Early stopping at epoch 700. Best Metrics: (0.059996423191930146, 0.03795081967213115, 0.0545183309424018)
2026-05-22 23:28:22,302 - optuna.study.study - INFO - Trial 192 finished with values: [0.059996423191930146, 0.03795081967213115, 0.0545183309424018] and parameters: {'n_layers': 2, 'embedding_dim': 96, 'lr': 0.0009918603670402933, 'lambda_val': 0.011110708622102677, 'batch_size': 704, 'optimizer': 'Adam'}.
2026-05-22 23:28:29,072 - experiment_functions - INFO - Early stopping at epoch 1450. Best Metrics: (0.07144740654200495, 0.04483606557377049, 0.06787697025467879)
2026-05-22 23:28:29,171 - optuna.study.study - INFO - Trial 193 finished with values: [0.07144740654200495, 0.04483606557377049, 0.06787697025467879] and parameters: {'n_layers': 2, 'embedding_dim': 128, 'lr': 0.0002391583318230419, 'lambda_val': 0.0011407825104914925, 'batch_size': 3045, 'optimizer': 'RMSprop'}.
2026-05-22 23:28:32,772 - experiment_functions - INFO - Early stopping at epoch 800. Best Metrics: (0.10769898394051797, 0.05901639344262295, 0.10010611666186757)
2026-05-22 23:28:32,965 - optuna.study.study - INFO - Trial 194 finished with values: [0.10769898394051797, 0.05901639344262295, 0.10010611666186757] and parameters: {'n_layers': 1, 'embedding_dim': 128, 'lr': 0.0014373137364726936, 'lambda_val': 0.004805532813491775, 'batch_size': 653, 'optimizer': 'Adam'}.
2026-05-22 23:28:37,711 - experiment_functions - INFO - Early stopping at epoch 800. Best Metrics: (0.06820187687440218, 0.03778688524590164, 0.057246881390734534)
