2026-05-23 05:31:29,578 - optuna.study.study - INFO - Trial 74 finished with values: [0.002699894355234894, 0.001967213114754099, 0.002390688010257974] and parameters: {'n_layers': 4, 'embedding_dim': 32, 'lr': 0.04108276478412852, 'lambda_val': 0.011225450134900047, 'batch_size': 2530, 'optimizer': 'SGD'}.
2026-05-23 05:31:33,900 - experiment_functions - INFO - Early stopping at epoch 1150. Best Metrics: (0.009938800435335196, 0.01139344262295082, 0.012930250769704223)
2026-05-23 05:31:34,499 - optuna.study.study - INFO - Trial 75 finished with values: [0.009938800435335196, 0.01139344262295082, 0.012930250769704223] and parameters: {'n_layers': 2, 'embedding_dim': 32, 'lr': 0.0027639393129429376, 'lambda_val': 0.0721378002753936, 'batch_size': 1106, 'optimizer': 'RMSprop'}.
2026-05-23 05:31:39,544 - experiment_functions - INFO - Early stopping at epoch 1150. Best Metrics: (0.03822997362702314, 0.020245901639344265, 0.02953739309910604)
2026-05-23 05:31:40,050 - optuna.study.study - INFO - Trial 76 finished with values: [0.03822997362702314, 0.020245901639344265, 0.02953739309910604] and parameters: {'n_layers': 4, 'embedding_dim': 32, 'lr': 0.0005886314074719387, 'lambda_val': 0.0005805183270689483, 'batch_size': 2251, 'optimizer': 'Adam'}.
2026-05-23 05:31:44,691 - experiment_functions - INFO - Early stopping at epoch 600. Best Metrics: (0.026308189246661853, 0.011475409836065573, 0.019352899624228207)
2026-05-23 05:31:45,276 - optuna.study.study - INFO - Trial 77 finished with values: [0.026308189246661853, 0.011475409836065573, 0.019352899624228207] and parameters: {'n_layers': 4, 'embedding_dim': 256, 'lr': 0.011589313509533357, 'lambda_val': 9.846611640816427e-06, 'batch_size': 2427, 'optimizer': 'RMSprop'}.
2026-05-23 05:31:49,118 - experiment_functions - INFO - Early stopping at epoch 700. Best Metrics: (0.019998393342845325, 0.01081967213114754, 0.01692872788927251)
2026-05-23 05:31:49,214 - optuna.study.study - INFO - Trial 78 finished with values: [0.019998393342845325, 0.01081967213114754, 0.01692872788927251] and parameters: {'n_layers': 3, 'embedding_dim': 128, 'lr': 0.011589313509533357, 'lambda_val': 0.005496962291729983, 'batch_size': 827, 'optimizer': 'Adam'}.
2026-05-23 05:32:00,040 - experiment_functions - INFO - Early stopping at epoch 3200. Best Metrics: (0.10883817742179798, 0.054098360655737705, 0.09015642108440763)
2026-05-23 05:32:00,928 - optuna.study.study - INFO - Trial 79 finished with values: [0.10883817742179798, 0.054098360655737705, 0.09015642108440763] and parameters: {'n_layers': 1, 'embedding_dim': 96, 'lr': 0.0003614258129820434, 'lambda_val': 0.002389697052100668, 'batch_size': 1628, 'optimizer': 'Adam'}.
2026-05-23 05:32:04,495 - experiment_functions - INFO - Early stopping at epoch 750. Best Metrics: (0.016966748815414146, 0.009672131147540983, 0.014056775692844088)
2026-05-23 05:32:05,395 - optuna.study.study - INFO - Trial 80 finished with values: [0.016966748815414146, 0.009672131147540983, 0.014056775692844088] and parameters: {'n_layers': 4, 'embedding_dim': 32, 'lr': 0.012849109517633149, 'lambda_val': 0.000664429487393602, 'batch_size': 1015, 'optimizer': 'Adam'}.
2026-05-23 05:32:08,102 - experiment_functions - INFO - Early stopping at epoch 500. Best Metrics: (0.0032815039915271944, 0.0018852459016393442, 0.0032518027830163478)
2026-05-23 05:32:08,702 - optuna.study.study - INFO - Trial 81 finished with values: [0.0032815039915271944, 0.0018852459016393442, 0.0032518027830163478] and parameters: {'n_layers': 2, 'embedding_dim': 128, 'lr': 0.08896231910396749, 'lambda_val': 0.0016327510816781727, 'batch_size': 3604, 'optimizer': 'SGD'}.
2026-05-23 05:32:13,430 - experiment_functions - INFO - Early stopping at epoch 1050. Best Metrics: (0.01834986183147085, 0.009344262295081968, 0.015764214904863353)
2026-05-23 05:32:13,625 - optuna.study.study - INFO - Trial 82 finished with values: [0.01834986183147085, 0.009344262295081968, 0.015764214904863353] and parameters: {'n_layers': 4, 'embedding_dim': 32, 'lr': 0.012849109517633149, 'lambda_val': 0.0008155225898951439, 'batch_size': 1015, 'optimizer': 'Adam'}.
2026-05-23 05:32:16,272 - experiment_functions - INFO - Early stopping at epoch 600. Best Metrics: (0.07817232812094918, 0.040245901639344266, 0.06805970095454603)
2026-05-23 05:32:16,417 - optuna.study.study - INFO - Trial 83 finished with values: [0.07817232812094918, 0.040245901639344266, 0.06805970095454603] and parameters: {'n_layers': 1, 'embedding_dim': 96, 'lr': 0.006832650701048396, 'lambda_val': 0.0006591181316301599, 'batch_size': 568, 'optimizer': 'Adam'}.
2026-05-23 05:32:29,853 - optuna.study.study - INFO - Trial 84 finished with values: [0.07492862240362878, 0.04426229508196721, 0.07018164649672716] and parameters: {'n_layers': 1, 'embedding_dim': 96, 'lr': 0.00015653541413289526, 'lambda_val': 0.020679334364233817, 'batch_size': 3638, 'optimizer': 'RMSprop'}.
2026-05-23 05:32:52,447 - optuna.study.study - INFO - Trial 85 finished with values: [0.004740718939277709, 0.002950819672131148, 0.004157514758967769] and parameters: {'n_layers': 3, 'embedding_dim': 256, 'lr': 1.693864270670899e-05, 'lambda_val': 0.00021066385790357534, 'batch_size': 3500, 'optimizer': 'RMSprop'}.
2026-05-23 05:32:56,245 - experiment_functions - INFO - Early stopping at epoch 500. Best Metrics: (0.0016006297793886876, 0.0021311475409836068, 0.002420739719421641)
2026-05-23 05:32:56,540 - optuna.study.study - INFO - Trial 86 finished with values: [0.0016006297793886876, 0.0021311475409836068, 0.002420739719421641] and parameters: {'n_layers': 4, 'embedding_dim': 256, 'lr': 0.0026271984480321668, 'lambda_val': 1.8594843551394848e-05, 'batch_size': 1844, 'optimizer': 'SGD'}.
2026-05-23 05:33:13,211 - optuna.study.study - INFO - Trial 87 finished with values: [0.025797208253228718, 0.018852459016393444, 0.02724104617969447] and parameters: {'n_layers': 2, 'embedding_dim': 128, 'lr': 6.920314910446582e-05, 'lambda_val': 1.3277522347276125e-05, 'batch_size': 4025, 'optimizer': 'Adam'}.
2026-05-23 05:33:35,055 - optuna.study.study - INFO - Trial 88 finished with values: [0.008319562674002263, 0.006311475409836066, 0.008789800437123732] and parameters: {'n_layers': 3, 'embedding_dim': 256, 'lr': 3.621212385184791e-05, 'lambda_val': 0.0003396935209744395, 'batch_size': 954, 'optimizer': 'RMSprop'}.
2026-05-23 05:33:53,553 - optuna.study.study - INFO - Trial 89 finished with values: [0.010665710897436348, 0.008852459016393444, 0.011739449705577259] and parameters: {'n_layers': 2, 'embedding_dim': 256, 'lr': 3.85307862411345e-05, 'lambda_val': 0.00045534797562752613, 'batch_size': 3041, 'optimizer': 'RMSprop'}.
2026-05-23 05:33:56,773 - experiment_functions - INFO - Early stopping at epoch 600. Best Metrics: (0.0338587288332249, 0.020655737704918034, 0.03050520540611895)
2026-05-23 05:33:56,959 - optuna.study.study - INFO - Trial 90 finished with values: [0.0338587288332249, 0.020655737704918034, 0.03050520540611895] and parameters: {'n_layers': 3, 'embedding_dim': 96, 'lr': 0.0014897144525931195, 'lambda_val': 1.5020668090190421e-06, 'batch_size': 3105, 'optimizer': 'RMSprop'}.
2026-05-23 05:33:59,435 - experiment_functions - INFO - Early stopping at epoch 550. Best Metrics: (0.039070347885441024, 0.024836065573770494, 0.03483733775314161)
2026-05-23 05:33:59,525 - optuna.study.study - INFO - Trial 91 finished with values: [0.039070347885441024, 0.024836065573770494, 0.03483733775314161] and parameters: {'n_layers': 2, 'embedding_dim': 96, 'lr': 0.0027639393129429376, 'lambda_val': 0.009869894388059158, 'batch_size': 1892, 'optimizer': 'Adam'}.
2026-05-23 05:34:13,954 - optuna.study.study - INFO - Trial 92 finished with values: [0.04344021901674504, 0.026557377049180327, 0.0403851815225302] and parameters: {'n_layers': 3, 'embedding_dim': 96, 'lr': 0.00010087308294325385, 'lambda_val': 0.000750074454420214, 'batch_size': 661, 'optimizer': 'RMSprop'}.
2026-05-23 05:34:17,394 - experiment_functions - INFO - Early stopping at epoch 1150. Best Metrics: (0.08013676569762787, 0.04401639344262295, 0.07226878323376186)
2026-05-23 05:34:17,488 - optuna.study.study - INFO - Trial 93 finished with values: [0.08013676569762787, 0.04401639344262295, 0.07226878323376186] and parameters: {'n_layers': 1, 'embedding_dim': 64, 'lr': 0.0014897144525931195, 'lambda_val': 0.0001780270767671239, 'batch_size': 568, 'optimizer': 'RMSprop'}.
2026-05-23 05:34:19,819 - experiment_functions - INFO - Early stopping at epoch 550. Best Metrics: (0.07197724664652452, 0.03926229508196721, 0.06528702122918151)
2026-05-23 05:34:19,911 - optuna.study.study - INFO - Trial 94 finished with values: [0.07197724664652452, 0.03926229508196721, 0.06528702122918151] and parameters: {'n_layers': 1, 'embedding_dim': 32, 'lr': 0.006312777493233292, 'lambda_val': 0.00013338361174833875, 'batch_size': 1794, 'optimizer': 'Adam'}.
2026-05-23 05:34:27,932 - experiment_functions - INFO - Early stopping at epoch 2350. Best Metrics: (0.05321840652862458, 0.02877049180327869, 0.04379007722230754)
2026-05-23 05:34:28,014 - optuna.study.study - INFO - Trial 95 finished with values: [0.05321840652862458, 0.02877049180327869, 0.04379007722230754] and parameters: {'n_layers': 1, 'embedding_dim': 128, 'lr': 0.00545110887354259, 'lambda_val': 0.003273430437450601, 'batch_size': 893, 'optimizer': 'RMSprop'}.
2026-05-23 05:34:30,623 - experiment_functions - INFO - Early stopping at epoch 550. Best Metrics: (0.10389409208004649, 0.05049180327868852, 0.08176724797636402)
2026-05-23 05:34:30,714 - optuna.study.study - INFO - Trial 96 finished with values: [0.10389409208004649, 0.05049180327868852, 0.08176724797636402] and parameters: {'n_layers': 1, 'embedding_dim': 128, 'lr': 0.004748827105127406, 'lambda_val': 1.7408384781052897e-06, 'batch_size': 2590, 'optimizer': 'Adam'}.
2026-05-23 05:34:43,096 - optuna.study.study - INFO - Trial 97 finished with values: [0.048991261659094364, 0.03147540983606558, 0.0448712471640469] and parameters: {'n_layers': 1, 'embedding_dim': 96, 'lr': 0.00015653541413289526, 'lambda_val': 0.0022842764195591505, 'batch_size': 1098, 'optimizer': 'RMSprop'}.
2026-05-23 05:34:47,449 - experiment_functions - INFO - Early stopping at epoch 900. Best Metrics: (0.009125211436010316, 0.00877049180327869, 0.01306096535281447)
2026-05-23 05:34:47,884 - optuna.study.study - INFO - Trial 98 finished with values: [0.009125211436010316, 0.00877049180327869, 0.01306096535281447] and parameters: {'n_layers': 4, 'embedding_dim': 32, 'lr': 0.0003646245687775073, 'lambda_val': 0.06576273625887245, 'batch_size': 3845, 'optimizer': 'RMSprop'}.
2026-05-23 05:35:04,457 - optuna.study.study - INFO - Trial 99 finished with values: [0.0028026802243345554, 0.00418032786885246, 0.0053814479271682] and parameters: {'n_layers': 3, 'embedding_dim': 96, 'lr': 2.883058733220993e-05, 'lambda_val': 0.002389697052100668, 'batch_size': 3131, 'optimizer': 'Adam'}.
2026-05-23 05:35:06,731 - experiment_functions - INFO - Early stopping at epoch 500. Best Metrics: (0.001311023398411306, 0.0013114754098360656, 0.0017841658204842206)
2026-05-23 05:35:06,861 - optuna.study.study - INFO - Trial 100 finished with values: [0.001311023398411306, 0.0013114754098360656, 0.0017841658204842206] and parameters: {'n_layers': 1, 'embedding_dim': 32, 'lr': 0.0005886314074719387, 'lambda_val': 0.00013338361174833875, 'batch_size': 1794, 'optimizer': 'SGD'}.
2026-05-23 05:35:10,635 - experiment_functions - INFO - Early stopping at epoch 1000. Best Metrics: (0.09238670753521398, 0.04704918032786885, 0.07513784883314321)
2026-05-23 05:35:10,843 - optuna.study.study - INFO - Trial 101 finished with values: [0.09238670753521398, 0.04704918032786885, 0.07513784883314321] and parameters: {'n_layers': 1, 'embedding_dim': 32, 'lr': 0.001288815314225091, 'lambda_val': 0.0005805183270689483, 'batch_size': 2591, 'optimizer': 'Adam'}.
2026-05-23 05:35:13,727 - experiment_functions - INFO - Early stopping at epoch 700. Best Metrics: (0.058169529202672966, 0.03827868852459016, 0.05513888455873858)
2026-05-23 05:35:13,824 - optuna.study.study - INFO - Trial 102 finished with values: [0.058169529202672966, 0.03827868852459016, 0.05513888455873858] and parameters: {'n_layers': 1, 'embedding_dim': 32, 'lr': 0.0010280524003593034, 'lambda_val': 0.03086324296076535, 'batch_size': 1321, 'optimizer': 'RMSprop'}.
2026-05-23 05:35:16,611 - experiment_functions - INFO - Early stopping at epoch 550. Best Metrics: (0.03319484701721432, 0.017295081967213115, 0.02470076785580614)
2026-05-23 05:35:16,701 - optuna.study.study - INFO - Trial 103 finished with values: [0.03319484701721432, 0.017295081967213115, 0.02470076785580614] and parameters: {'n_layers': 2, 'embedding_dim': 64, 'lr': 0.0087991751940927, 'lambda_val': 1.2068197527148229e-06, 'batch_size': 2755, 'optimizer': 'RMSprop'}.
2026-05-23 05:35:23,329 - experiment_functions - INFO - Early stopping at epoch 550. Best Metrics: (0.09811184628564282, 0.04959016393442623, 0.08349262754045228)
2026-05-23 05:35:24,034 - optuna.study.study - INFO - Trial 104 finished with values: [0.09811184628564282, 0.04959016393442623, 0.08349262754045228] and parameters: {'n_layers': 1, 'embedding_dim': 128, 'lr': 0.004748827105127406, 'lambda_val': 1.7408384781052897e-06, 'batch_size': 2590, 'optimizer': 'Adam'}.
2026-05-23 05:35:31,307 - experiment_functions - INFO - Early stopping at epoch 500. Best Metrics: (0.0016056949109642298, 0.0021311475409836063, 0.0026023749611329508)
2026-05-23 05:35:31,413 - optuna.study.study - INFO - Trial 105 finished with values: [0.0016056949109642298, 0.0021311475409836063, 0.0026023749611329508] and parameters: {'n_layers': 1, 'embedding_dim': 96, 'lr': 0.0014897144525931195, 'lambda_val': 0.0001780270767671239, 'batch_size': 568, 'optimizer': 'SGD'}.
2026-05-23 05:35:34,132 - experiment_functions - INFO - Early stopping at epoch 600. Best Metrics: (0.10179499927832834, 0.05, 0.08357935856899364)
2026-05-23 05:35:34,268 - optuna.study.study - INFO - Trial 106 finished with values: [0.10179499927832834, 0.05, 0.08357935856899364] and parameters: {'n_layers': 1, 'embedding_dim': 128, 'lr': 0.0026271984480321668, 'lambda_val': 1.7408384781052897e-06, 'batch_size': 1844, 'optimizer': 'Adam'}.
2026-05-23 05:35:37,268 - experiment_functions - INFO - Early stopping at epoch 750. Best Metrics: (0.08962646913217148, 0.0489344262295082, 0.07916938096242011)
2026-05-23 05:35:37,366 - optuna.study.study - INFO - Trial 107 finished with values: [0.08962646913217148, 0.0489344262295082, 0.07916938096242011] and parameters: {'n_layers': 1, 'embedding_dim': 96, 'lr': 0.0014897144525931195, 'lambda_val': 1.916622569179001e-06, 'batch_size': 568, 'optimizer': 'RMSprop'}.
2026-05-23 05:35:40,087 - experiment_functions - INFO - Early stopping at epoch 550. Best Metrics: (0.07935023502639656, 0.04262295081967213, 0.06860462847159306)
2026-05-23 05:35:40,165 - optuna.study.study - INFO - Trial 108 finished with values: [0.07935023502639656, 0.04262295081967213, 0.06860462847159306] and parameters: {'n_layers': 1, 'embedding_dim': 64, 'lr': 0.0087991751940927, 'lambda_val': 1.5271587203565615e-05, 'batch_size': 1628, 'optimizer': 'Adam'}.
2026-05-23 05:35:44,667 - experiment_functions - INFO - Early stopping at epoch 1250. Best Metrics: (0.03437955520139821, 0.01459016393442623, 0.0250333245811478)
2026-05-23 05:35:45,159 - optuna.study.study - INFO - Trial 109 finished with values: [0.03437955520139821, 0.01459016393442623, 0.0250333245811478] and parameters: {'n_layers': 1, 'embedding_dim': 64, 'lr': 0.05611707761730447, 'lambda_val': 0.00013338361174833875, 'batch_size': 3338, 'optimizer': 'Adam'}.
2026-05-23 05:35:48,112 - experiment_functions - INFO - Early stopping at epoch 550. Best Metrics: (0.08772823529747377, 0.04131147540983607, 0.06857188661902278)
2026-05-23 05:35:49,443 - optuna.study.study - INFO - Trial 110 finished with values: [0.08772823529747377, 0.04131147540983607, 0.06857188661902278] and parameters: {'n_layers': 1, 'embedding_dim': 256, 'lr': 0.006312777493233292, 'lambda_val': 0.0038219476201083865, 'batch_size': 3604, 'optimizer': 'Adam'}.
2026-05-23 05:35:52,214 - experiment_functions - INFO - Early stopping at epoch 650. Best Metrics: (0.09058556031520082, 0.046311475409836066, 0.08110516184170061)
2026-05-23 05:35:52,303 - optuna.study.study - INFO - Trial 111 finished with values: [0.09058556031520082, 0.046311475409836066, 0.08110516184170061] and parameters: {'n_layers': 1, 'embedding_dim': 32, 'lr': 0.0026271984480321668, 'lambda_val': 0.0016208673244223802, 'batch_size': 1844, 'optimizer': 'Adam'}.
2026-05-23 05:35:55,500 - experiment_functions - INFO - Early stopping at epoch 600. Best Metrics: (0.029207181262475613, 0.019262295081967213, 0.027123751220551877)
2026-05-23 05:35:55,603 - optuna.study.study - INFO - Trial 112 finished with values: [0.029207181262475613, 0.019262295081967213, 0.027123751220551877] and parameters: {'n_layers': 4, 'embedding_dim': 64, 'lr': 0.0014897144525931195, 'lambda_val': 0.0017980181304045255, 'batch_size': 1631, 'optimizer': 'Adam'}.
2026-05-23 05:35:59,067 - experiment_functions - INFO - Early stopping at epoch 650. Best Metrics: (0.04509575164195935, 0.025327868852459016, 0.03979787068871533)
2026-05-23 05:35:59,203 - optuna.study.study - INFO - Trial 113 finished with values: [0.04509575164195935, 0.025327868852459016, 0.03979787068871533] and parameters: {'n_layers': 3, 'embedding_dim': 128, 'lr': 0.001257701414193144, 'lambda_val': 0.0005805183270689483, 'batch_size': 827, 'optimizer': 'RMSprop'}.
2026-05-23 05:36:04,534 - experiment_functions - INFO - Early stopping at epoch 1000. Best Metrics: (0.0818758172187937, 0.04131147540983606, 0.0661459795448143)
2026-05-23 05:36:05,550 - optuna.study.study - INFO - Trial 114 finished with values: [0.0818758172187937, 0.04131147540983606, 0.0661459795448143] and parameters: {'n_layers': 2, 'embedding_dim': 256, 'lr': 0.000360608106860257, 'lambda_val': 0.00013338361174833875, 'batch_size': 1794, 'optimizer': 'RMSprop'}.
2026-05-23 05:36:19,679 - optuna.study.study - INFO - Trial 115 finished with values: [0.03090000518203618, 0.021311475409836064, 0.029251946791781155] and parameters: {'n_layers': 2, 'embedding_dim': 96, 'lr': 0.00010087308294325385, 'lambda_val': 1.3277522347276125e-05, 'batch_size': 661, 'optimizer': 'RMSprop'}.
2026-05-23 05:36:22,298 - experiment_functions - INFO - Early stopping at epoch 650. Best Metrics: (0.0984695376086105, 0.05098360655737705, 0.0834872486528614)
2026-05-23 05:36:22,394 - optuna.study.study - INFO - Trial 116 finished with values: [0.0984695376086105, 0.05098360655737705, 0.0834872486528614] and parameters: {'n_layers': 1, 'embedding_dim': 32, 'lr': 0.0026271984480321668, 'lambda_val': 0.0016872549049523802, 'batch_size': 1631, 'optimizer': 'Adam'}.
2026-05-23 05:36:38,667 - optuna.study.study - INFO - Trial 117 finished with values: [0.006810889348932157, 0.006147540983606558, 0.008273133979784235] and parameters: {'n_layers': 1, 'embedding_dim': 256, 'lr': 4.5280347481791435e-05, 'lambda_val': 0.0001780270767671239, 'batch_size': 3751, 'optimizer': 'RMSprop'}.
2026-05-23 05:36:48,200 - experiment_functions - INFO - Early stopping at epoch 2600. Best Metrics: (0.05379770569514959, 0.03155737704918033, 0.04401897529118101)
2026-05-23 05:36:48,275 - optuna.study.study - INFO - Trial 118 finished with values: [0.05379770569514959, 0.03155737704918033, 0.04401897529118101] and parameters: {'n_layers': 3, 'embedding_dim': 32, 'lr': 0.0003614258129820434, 'lambda_val': 0.002389697052100668, 'batch_size': 827, 'optimizer': 'Adam'}.
2026-05-23 05:36:51,627 - experiment_functions - INFO - Early stopping at epoch 750. Best Metrics: (0.04784955558058304, 0.026393442622950816, 0.03846878385500949)
2026-05-23 05:36:51,732 - optuna.study.study - INFO - Trial 119 finished with values: [0.04784955558058304, 0.026393442622950816, 0.03846878385500949] and parameters: {'n_layers': 2, 'embedding_dim': 96, 'lr': 0.0014897144525931195, 'lambda_val': 5.0126150958077e-05, 'batch_size': 568, 'optimizer': 'RMSprop'}.
2026-05-23 05:36:58,783 - experiment_functions - INFO - Early stopping at epoch 1700. Best Metrics: (0.07604485878809024, 0.04188524590163935, 0.06632151034555368)
2026-05-23 05:36:58,852 - optuna.study.study - INFO - Trial 120 finished with values: [0.07604485878809024, 0.04188524590163935, 0.06632151034555368] and parameters: {'n_layers': 2, 'embedding_dim': 128, 'lr': 0.0003614258129820434, 'lambda_val': 2.691057746425052e-06, 'batch_size': 1976, 'optimizer': 'Adam'}.
2026-05-23 05:37:14,882 - optuna.study.study - INFO - Trial 121 finished with values: [0.07236352773333754, 0.03901639344262295, 0.06127123419964387] and parameters: {'n_layers': 3, 'embedding_dim': 96, 'lr': 0.00015653541413289526, 'lambda_val': 0.0022842764195591505, 'batch_size': 1098, 'optimizer': 'RMSprop'}.
2026-05-23 05:37:20,340 - experiment_functions - INFO - Early stopping at epoch 550. Best Metrics: (0.09772238135546166, 0.04770491803278689, 0.0829963353999313)
2026-05-23 05:37:21,099 - optuna.study.study - INFO - Trial 122 finished with values: [0.09772238135546166, 0.04770491803278689, 0.0829963353999313] and parameters: {'n_layers': 1, 'embedding_dim': 256, 'lr': 0.006312777493233292, 'lambda_val': 0.00013338361174833875, 'batch_size': 1794, 'optimizer': 'Adam'}.
2026-05-23 05:37:31,484 - experiment_functions - INFO - Early stopping at epoch 1450. Best Metrics: (0.0194060673496644, 0.011639344262295081, 0.01595447814924935)
