2026-05-23 04:57:58,623 - optuna.study.study - INFO - Trial 84 finished with values: [0.020457772119009166, 0.008196721311475412, 0.014791178931642479] and parameters: {'n_layers': 2, 'embedding_dim': 128, 'lr': 0.05244400632546388, 'lambda_val': 4.915768160138094e-05, 'batch_size': 1182, 'optimizer': 'Adam'}.
2026-05-23 04:58:02,124 - experiment_functions - INFO - Early stopping at epoch 500. Best Metrics: (0.0026714350323583133, 0.0013934426229508196, 0.001967786974431425)
2026-05-23 04:58:03,399 - optuna.study.study - INFO - Trial 85 finished with values: [0.0026714350323583133, 0.0013934426229508196, 0.001967786974431425] and parameters: {'n_layers': 3, 'embedding_dim': 256, 'lr': 0.00336717922999122, 'lambda_val': 9.101189235790046e-06, 'batch_size': 3439, 'optimizer': 'SGD'}.
2026-05-23 04:58:20,293 - optuna.study.study - INFO - Trial 86 finished with values: [0.03157457531787061, 0.022377049180327867, 0.032459260805975707] and parameters: {'n_layers': 4, 'embedding_dim': 64, 'lr': 0.00015281876966777362, 'lambda_val': 0.011064300904059448, 'batch_size': 1407, 'optimizer': 'Adam'}.
2026-05-23 04:58:24,955 - experiment_functions - INFO - Early stopping at epoch 1200. Best Metrics: (0.10049556556951329, 0.049426229508196716, 0.0809386182613355)
2026-05-23 04:58:25,448 - optuna.study.study - INFO - Trial 87 finished with values: [0.10049556556951329, 0.049426229508196716, 0.0809386182613355] and parameters: {'n_layers': 1, 'embedding_dim': 128, 'lr': 0.0005663247330896729, 'lambda_val': 4.006717999944042e-05, 'batch_size': 2871, 'optimizer': 'Adam'}.
2026-05-23 04:58:41,061 - experiment_functions - INFO - Early stopping at epoch 2250. Best Metrics: (0.001805122059601081, 0.002622950819672131, 0.0025159222171547892)
2026-05-23 04:58:41,638 - optuna.study.study - INFO - Trial 88 finished with values: [0.001805122059601081, 0.002622950819672131, 0.0025159222171547892] and parameters: {'n_layers': 4, 'embedding_dim': 256, 'lr': 1.0288110565541047e-05, 'lambda_val': 3.088246341233559e-05, 'batch_size': 3077, 'optimizer': 'RMSprop'}.
2026-05-23 04:58:44,231 - experiment_functions - INFO - Early stopping at epoch 550. Best Metrics: (0.02188520559969417, 0.010819672131147541, 0.016785617153008865)
2026-05-23 04:58:44,321 - optuna.study.study - INFO - Trial 89 finished with values: [0.02188520559969417, 0.010819672131147541, 0.016785617153008865] and parameters: {'n_layers': 2, 'embedding_dim': 32, 'lr': 0.014307049433242047, 'lambda_val': 3.088246341233559e-05, 'batch_size': 2784, 'optimizer': 'RMSprop'}.
2026-05-23 04:58:46,814 - experiment_functions - INFO - Early stopping at epoch 500. Best Metrics: (0.0011139503117933572, 0.0010655737704918032, 0.0013176913295528977)
2026-05-23 04:58:46,977 - optuna.study.study - INFO - Trial 90 finished with values: [0.0011139503117933572, 0.0010655737704918032, 0.0013176913295528977] and parameters: {'n_layers': 2, 'embedding_dim': 96, 'lr': 0.03051424799989736, 'lambda_val': 3.988188689373916e-06, 'batch_size': 599, 'optimizer': 'SGD'}.
2026-05-23 04:58:58,651 - experiment_functions - INFO - Early stopping at epoch 3700. Best Metrics: (0.001985694686495052, 0.0020491803278688526, 0.0022705762135163373)
2026-05-23 04:58:58,776 - optuna.study.study - INFO - Trial 91 finished with values: [0.001985694686495052, 0.0020491803278688526, 0.0022705762135163373] and parameters: {'n_layers': 1, 'embedding_dim': 128, 'lr': 2.8816410973423224e-05, 'lambda_val': 6.583494589051588e-06, 'batch_size': 1025, 'optimizer': 'Adam'}.
2026-05-23 04:59:17,324 - optuna.study.study - INFO - Trial 92 finished with values: [0.013633926589918563, 0.011721311475409836, 0.016955394552440207] and parameters: {'n_layers': 4, 'embedding_dim': 96, 'lr': 5.1942813475457885e-05, 'lambda_val': 0.005758170316328264, 'batch_size': 2533, 'optimizer': 'RMSprop'}.
2026-05-23 04:59:25,966 - experiment_functions - INFO - Early stopping at epoch 1900. Best Metrics: (0.010569303328393016, 0.008934426229508198, 0.012403738396523062)
2026-05-23 04:59:26,048 - optuna.study.study - INFO - Trial 93 finished with values: [0.010569303328393016, 0.008934426229508198, 0.012403738396523062] and parameters: {'n_layers': 3, 'embedding_dim': 128, 'lr': 0.020674917202339466, 'lambda_val': 0.030374414852054388, 'batch_size': 996, 'optimizer': 'Adam'}.
2026-05-23 04:59:34,339 - experiment_functions - INFO - Early stopping at epoch 1700. Best Metrics: (0.03537987030251898, 0.01959016393442623, 0.027551820595162865)
2026-05-23 04:59:35,425 - optuna.study.study - INFO - Trial 94 finished with values: [0.03537987030251898, 0.01959016393442623, 0.027551820595162865] and parameters: {'n_layers': 3, 'embedding_dim': 128, 'lr': 0.000145468795718925, 'lambda_val': 0.009884403542259862, 'batch_size': 3864, 'optimizer': 'RMSprop'}.
2026-05-23 04:59:51,578 - optuna.study.study - INFO - Trial 95 finished with values: [0.08611182983737133, 0.04557377049180328, 0.07195420848350877] and parameters: {'n_layers': 1, 'embedding_dim': 256, 'lr': 0.00015281876966777362, 'lambda_val': 0.014381121669718087, 'batch_size': 2378, 'optimizer': 'Adam'}.
2026-05-23 04:59:56,821 - experiment_functions - INFO - Early stopping at epoch 1150. Best Metrics: (0.09608757784638049, 0.05032786885245902, 0.08089588271217045)
2026-05-23 04:59:57,733 - optuna.study.study - INFO - Trial 96 finished with values: [0.09608757784638049, 0.05032786885245902, 0.08089588271217045] and parameters: {'n_layers': 1, 'embedding_dim': 256, 'lr': 0.000498408569398285, 'lambda_val': 0.00475024784706787, 'batch_size': 2784, 'optimizer': 'Adam'}.
2026-05-23 05:00:00,894 - experiment_functions - INFO - Early stopping at epoch 700. Best Metrics: (0.03173441115992189, 0.012459016393442626, 0.022450193030670734)
2026-05-23 05:00:01,765 - optuna.study.study - INFO - Trial 97 finished with values: [0.03173441115992189, 0.012459016393442626, 0.022450193030670734] and parameters: {'n_layers': 2, 'embedding_dim': 64, 'lr': 0.014307049433242047, 'lambda_val': 3.088246341233559e-05, 'batch_size': 1387, 'optimizer': 'RMSprop'}.
2026-05-23 05:00:19,439 - optuna.study.study - INFO - Trial 98 finished with values: [0.015542634049358, 0.01, 0.014462098037217163] and parameters: {'n_layers': 4, 'embedding_dim': 96, 'lr': 5.1942813475457885e-05, 'lambda_val': 0.005758170316328264, 'batch_size': 1105, 'optimizer': 'RMSprop'}.
2026-05-23 05:00:23,278 - experiment_functions - INFO - Early stopping at epoch 500. Best Metrics: (0.0024165112660496503, 0.001639344262295082, 0.001939794744806839)
2026-05-23 05:00:24,394 - optuna.study.study - INFO - Trial 99 finished with values: [0.0024165112660496503, 0.001639344262295082, 0.001939794744806839] and parameters: {'n_layers': 4, 'embedding_dim': 256, 'lr': 0.061625038224454844, 'lambda_val': 0.00014410999451068505, 'batch_size': 1335, 'optimizer': 'SGD'}.
2026-05-23 05:00:38,227 - optuna.study.study - INFO - Trial 100 finished with values: [0.07920641800952878, 0.04057377049180328, 0.06880524316448944] and parameters: {'n_layers': 1, 'embedding_dim': 128, 'lr': 0.000145468795718925, 'lambda_val': 0.00619655064381492, 'batch_size': 3864, 'optimizer': 'RMSprop'}.
2026-05-23 05:00:41,402 - experiment_functions - INFO - Early stopping at epoch 600. Best Metrics: (0.10545999348217612, 0.049999999999999996, 0.08321685947134119)
2026-05-23 05:00:41,671 - optuna.study.study - INFO - Trial 101 finished with values: [0.10545999348217612, 0.049999999999999996, 0.08321685947134119] and parameters: {'n_layers': 1, 'embedding_dim': 256, 'lr': 0.0027034335159540246, 'lambda_val': 0.0022074927841841977, 'batch_size': 3648, 'optimizer': 'Adam'}.
2026-05-23 05:00:53,743 - optuna.study.study - INFO - Trial 102 finished with values: [0.01849428656924773, 0.012377049180327868, 0.018446568679970975] and parameters: {'n_layers': 1, 'embedding_dim': 64, 'lr': 8.163547537557747e-05, 'lambda_val': 9.351980182836982e-05, 'batch_size': 3126, 'optimizer': 'RMSprop'}.
2026-05-23 05:00:56,218 - experiment_functions - INFO - Early stopping at epoch 600. Best Metrics: (0.09431744873131034, 0.05032786885245902, 0.07968582710132796)
2026-05-23 05:00:57,195 - optuna.study.study - INFO - Trial 103 finished with values: [0.09431744873131034, 0.05032786885245902, 0.07968582710132796] and parameters: {'n_layers': 1, 'embedding_dim': 32, 'lr': 0.0032256937887088586, 'lambda_val': 4.006717999944042e-05, 'batch_size': 3699, 'optimizer': 'Adam'}.
2026-05-23 05:01:06,743 - experiment_functions - INFO - Early stopping at epoch 1750. Best Metrics: (0.051250785730586904, 0.02811475409836065, 0.04453961893284198)
2026-05-23 05:01:06,842 - optuna.study.study - INFO - Trial 104 finished with values: [0.051250785730586904, 0.02811475409836065, 0.04453961893284198] and parameters: {'n_layers': 4, 'embedding_dim': 128, 'lr': 0.00019262259007340505, 'lambda_val': 0.00023851930345844492, 'batch_size': 3696, 'optimizer': 'RMSprop'}.
2026-05-23 05:01:11,457 - experiment_functions - INFO - Early stopping at epoch 1250. Best Metrics: (0.09587466510417467, 0.0519672131147541, 0.08044778377911793)
2026-05-23 05:01:11,548 - optuna.study.study - INFO - Trial 105 finished with values: [0.09587466510417467, 0.0519672131147541, 0.08044778377911793] and parameters: {'n_layers': 1, 'embedding_dim': 64, 'lr': 0.0005663247330896729, 'lambda_val': 4.006717999944042e-05, 'batch_size': 2871, 'optimizer': 'RMSprop'}.
2026-05-23 05:01:16,459 - experiment_functions - INFO - Early stopping at epoch 650. Best Metrics: (0.02915538389370332, 0.01762295081967213, 0.025119554532413463)
2026-05-23 05:01:16,977 - optuna.study.study - INFO - Trial 106 finished with values: [0.02915538389370332, 0.01762295081967213, 0.025119554532413463] and parameters: {'n_layers': 4, 'embedding_dim': 256, 'lr': 0.0004134349417792622, 'lambda_val': 0.0006153780524713789, 'batch_size': 3696, 'optimizer': 'RMSprop'}.
2026-05-23 05:01:22,378 - experiment_functions - INFO - Early stopping at epoch 750. Best Metrics: (0.03733370702528912, 0.024016393442622953, 0.03435532236563758)
2026-05-23 05:01:22,529 - optuna.study.study - INFO - Trial 107 finished with values: [0.03733370702528912, 0.024016393442622953, 0.03435532236563758] and parameters: {'n_layers': 4, 'embedding_dim': 256, 'lr': 0.0004134349417792622, 'lambda_val': 0.0006153780524713789, 'batch_size': 1007, 'optimizer': 'RMSprop'}.
2026-05-23 05:01:24,723 - experiment_functions - INFO - Early stopping at epoch 550. Best Metrics: (0.04298378066351836, 0.02483606557377049, 0.03816266256976963)
2026-05-23 05:01:24,820 - optuna.study.study - INFO - Trial 108 finished with values: [0.04298378066351836, 0.02483606557377049, 0.03816266256976963] and parameters: {'n_layers': 1, 'embedding_dim': 96, 'lr': 0.007629002645455095, 'lambda_val': 0.01778793337338722, 'batch_size': 2378, 'optimizer': 'Adam'}.
2026-05-23 05:01:37,794 - optuna.study.study - INFO - Trial 109 finished with values: [0.06567094996530713, 0.03663934426229508, 0.05477566790998951] and parameters: {'n_layers': 1, 'embedding_dim': 96, 'lr': 0.00015281876966777362, 'lambda_val': 0.009884403542259862, 'batch_size': 2378, 'optimizer': 'Adam'}.
2026-05-23 05:01:40,574 - experiment_functions - INFO - Early stopping at epoch 500. Best Metrics: (0.0021883126604046853, 0.001639344262295082, 0.001983679200721484)
2026-05-23 05:01:40,670 - optuna.study.study - INFO - Trial 110 finished with values: [0.0021883126604046853, 0.001639344262295082, 0.001983679200721484] and parameters: {'n_layers': 4, 'embedding_dim': 32, 'lr': 0.025853363866627378, 'lambda_val': 4.915768160138094e-05, 'batch_size': 3696, 'optimizer': 'SGD'}.
2026-05-23 05:01:43,371 - experiment_functions - INFO - Early stopping at epoch 600. Best Metrics: (0.05046801235166005, 0.034754098360655745, 0.048898238525817116)
2026-05-23 05:01:43,458 - optuna.study.study - INFO - Trial 111 finished with values: [0.05046801235166005, 0.034754098360655745, 0.048898238525817116] and parameters: {'n_layers': 1, 'embedding_dim': 32, 'lr': 0.0032256937887088586, 'lambda_val': 0.021857441898757924, 'batch_size': 2390, 'optimizer': 'Adam'}.
2026-05-23 05:01:46,630 - experiment_functions - INFO - Early stopping at epoch 650. Best Metrics: (0.09573942322035281, 0.046967213114754096, 0.07821944397050323)
2026-05-23 05:01:47,728 - optuna.study.study - INFO - Trial 112 finished with values: [0.09573942322035281, 0.046967213114754096, 0.07821944397050323] and parameters: {'n_layers': 1, 'embedding_dim': 256, 'lr': 0.001814498584431129, 'lambda_val': 0.00011374857041945478, 'batch_size': 1834, 'optimizer': 'Adam'}.
2026-05-23 05:02:03,775 - optuna.study.study - INFO - Trial 113 finished with values: [0.06706076323251142, 0.03950819672131148, 0.06009666111190897] and parameters: {'n_layers': 2, 'embedding_dim': 128, 'lr': 0.00015281876966777362, 'lambda_val': 4.006717999944042e-05, 'batch_size': 1025, 'optimizer': 'Adam'}.
2026-05-23 05:02:14,073 - experiment_functions - INFO - Early stopping at epoch 650. Best Metrics: (0.030302431124563586, 0.016229508196721313, 0.024379530142411693)
2026-05-23 05:02:14,319 - optuna.study.study - INFO - Trial 114 finished with values: [0.030302431124563586, 0.016229508196721313, 0.024379530142411693] and parameters: {'n_layers': 4, 'embedding_dim': 256, 'lr': 0.0004134349417792622, 'lambda_val': 0.00023851930345844492, 'batch_size': 3696, 'optimizer': 'RMSprop'}.
2026-05-23 05:02:19,295 - experiment_functions - INFO - Early stopping at epoch 950. Best Metrics: (0.07160070885349182, 0.03778688524590164, 0.0641848154732591)
2026-05-23 05:02:19,570 - optuna.study.study - INFO - Trial 115 finished with values: [0.07160070885349182, 0.03778688524590164, 0.0641848154732591] and parameters: {'n_layers': 2, 'embedding_dim': 256, 'lr': 0.0004134349417792622, 'lambda_val': 3.5614573447749906e-05, 'batch_size': 1854, 'optimizer': 'RMSprop'}.
2026-05-23 05:02:22,300 - experiment_functions - INFO - Early stopping at epoch 650. Best Metrics: (0.09372382482208959, 0.04860655737704918, 0.0788789445187151)
2026-05-23 05:02:22,392 - optuna.study.study - INFO - Trial 116 finished with values: [0.09372382482208959, 0.04860655737704918, 0.0788789445187151] and parameters: {'n_layers': 1, 'embedding_dim': 96, 'lr': 0.0016740667020226415, 'lambda_val': 4.006717999944042e-05, 'batch_size': 1699, 'optimizer': 'RMSprop'}.
2026-05-23 05:02:27,523 - experiment_functions - INFO - Early stopping at epoch 650. Best Metrics: (0.029898033169939452, 0.019590163934426228, 0.0283704888290284)
2026-05-23 05:02:27,617 - optuna.study.study - INFO - Trial 117 finished with values: [0.029898033169939452, 0.019590163934426228, 0.0283704888290284] and parameters: {'n_layers': 4, 'embedding_dim': 256, 'lr': 0.0004134349417792622, 'lambda_val': 5.1749265389269726e-05, 'batch_size': 2428, 'optimizer': 'RMSprop'}.
2026-05-23 05:02:41,078 - optuna.study.study - INFO - Trial 118 finished with values: [0.06780534213551162, 0.030409836065573764, 0.052458904385445315] and parameters: {'n_layers': 1, 'embedding_dim': 128, 'lr': 0.061625038224454844, 'lambda_val': 0.000765889777157795, 'batch_size': 2244, 'optimizer': 'RMSprop'}.
2026-05-23 05:02:53,098 - experiment_functions - INFO - Early stopping at epoch 1800. Best Metrics: (0.051387649346874606, 0.028688524590163935, 0.04254067997188659)
2026-05-23 05:02:53,234 - optuna.study.study - INFO - Trial 119 finished with values: [0.051387649346874606, 0.028688524590163935, 0.04254067997188659] and parameters: {'n_layers': 4, 'embedding_dim': 256, 'lr': 0.0001413193463806038, 'lambda_val': 0.000765889777157795, 'batch_size': 2244, 'optimizer': 'RMSprop'}.
2026-05-23 05:02:56,780 - experiment_functions - INFO - Early stopping at epoch 500. Best Metrics: (0.02285087275273648, 0.01377049180327869, 0.02266167608829391)
2026-05-23 05:02:57,866 - optuna.study.study - INFO - Trial 120 finished with values: [0.02285087275273648, 0.01377049180327869, 0.02266167608829391] and parameters: {'n_layers': 3, 'embedding_dim': 256, 'lr': 0.0774279273897018, 'lambda_val': 1.3452638917936216e-05, 'batch_size': 1950, 'optimizer': 'RMSprop'}.
2026-05-23 05:03:00,779 - experiment_functions - INFO - Early stopping at epoch 600. Best Metrics: (0.09659761904047162, 0.05, 0.08189457892830572)
2026-05-23 05:03:00,868 - optuna.study.study - INFO - Trial 121 finished with values: [0.09659761904047162, 0.05, 0.08189457892830572] and parameters: {'n_layers': 1, 'embedding_dim': 128, 'lr': 0.0027034335159540246, 'lambda_val': 2.7554943772348907e-05, 'batch_size': 3864, 'optimizer': 'Adam'}.
2026-05-23 05:03:12,831 - experiment_functions - INFO - Early stopping at epoch 2950. Best Metrics: (0.07157251019985324, 0.043196721311475415, 0.06383872202712484)
2026-05-23 05:03:13,199 - optuna.study.study - INFO - Trial 122 finished with values: [0.07157251019985324, 0.043196721311475415, 0.06383872202712484] and parameters: {'n_layers': 1, 'embedding_dim': 256, 'lr': 0.00015281876966777362, 'lambda_val': 0.014381121669718087, 'batch_size': 2378, 'optimizer': 'Adam'}.
2026-05-23 05:03:25,510 - optuna.study.study - INFO - Trial 123 finished with values: [0.06776115682227529, 0.04311475409836065, 0.06470039475336181] and parameters: {'n_layers': 1, 'embedding_dim': 64, 'lr': 0.00019262259007340505, 'lambda_val': 0.030374414852054388, 'batch_size': 1335, 'optimizer': 'RMSprop'}.
2026-05-23 05:03:28,918 - experiment_functions - INFO - Early stopping at epoch 850. Best Metrics: (0.0973404818422465, 0.0490983606557377, 0.08292263742766434)
2026-05-23 05:03:29,004 - optuna.study.study - INFO - Trial 124 finished with values: [0.0973404818422465, 0.0490983606557377, 0.08292263742766434] and parameters: {'n_layers': 1, 'embedding_dim': 32, 'lr': 0.0032256937887088586, 'lambda_val': 6.509910298202351e-05, 'batch_size': 514, 'optimizer': 'Adam'}.
2026-05-23 05:03:31,718 - experiment_functions - INFO - Early stopping at epoch 650. Best Metrics: (0.05467586430037331, 0.03172131147540984, 0.05058090892759224)
2026-05-23 05:03:31,795 - optuna.study.study - INFO - Trial 125 finished with values: [0.05467586430037331, 0.03172131147540984, 0.05058090892759224] and parameters: {'n_layers': 2, 'embedding_dim': 32, 'lr': 0.0025251998940112653, 'lambda_val': 3.827155829365953e-06, 'batch_size': 1407, 'optimizer': 'Adam'}.
2026-05-23 05:03:34,308 - experiment_functions - INFO - Early stopping at epoch 500. Best Metrics: (0.0008470787768412747, 0.0012295081967213116, 0.0011493546059650342)
2026-05-23 05:03:34,390 - optuna.study.study - INFO - Trial 126 finished with values: [0.0008470787768412747, 0.0012295081967213116, 0.0011493546059650342] and parameters: {'n_layers': 1, 'embedding_dim': 256, 'lr': 0.00015281876966777362, 'lambda_val': 0.030374414852054388, 'batch_size': 1335, 'optimizer': 'Adam'}.
2026-05-23 05:03:36,868 - experiment_functions - INFO - Early stopping at epoch 600. Best Metrics: (0.08674126943382665, 0.04524590163934426, 0.07008033540659667)
2026-05-23 05:03:36,957 - optuna.study.study - INFO - Trial 127 finished with values: [0.08674126943382665, 0.04524590163934426, 0.07008033540659667] and parameters: {'n_layers': 1, 'embedding_dim': 32, 'lr': 0.0032256937887088586, 'lambda_val': 0.021857441898757924, 'batch_size': 2244, 'optimizer': 'Adam'}.
2026-05-23 05:03:52,109 - optuna.study.study - INFO - Trial 128 finished with values: [0.09187452584909228, 0.04770491803278688, 0.08371574140994448] and parameters: {'n_layers': 1, 'embedding_dim': 128, 'lr': 0.00019262259007340505, 'lambda_val': 4.915768160138094e-05, 'batch_size': 1182, 'optimizer': 'RMSprop'}.
2026-05-23 05:03:54,248 - experiment_functions - INFO - Early stopping at epoch 500. Best Metrics: (0.0007353840747982787, 0.0017213114754098366, 0.00173853009758215)
2026-05-23 05:03:54,378 - optuna.study.study - INFO - Trial 129 finished with values: [0.0007353840747982787, 0.0017213114754098366, 0.00173853009758215] and parameters: {'n_layers': 1, 'embedding_dim': 64, 'lr': 0.00015281876966777362, 'lambda_val': 0.09697909683671758, 'batch_size': 1025, 'optimizer': 'Adam'}.
2026-05-23 05:03:57,131 - experiment_functions - INFO - Early stopping at epoch 600. Best Metrics: (0.1057600016440883, 0.051557377049180335, 0.08805111016961452)
2026-05-23 05:03:57,235 - optuna.study.study - INFO - Trial 130 finished with values: [0.1057600016440883, 0.051557377049180335, 0.08805111016961452] and parameters: {'n_layers': 1, 'embedding_dim': 64, 'lr': 0.0027034335159540246, 'lambda_val': 0.0003464722773423699, 'batch_size': 3648, 'optimizer': 'Adam'}.
2026-05-23 05:04:09,954 - optuna.study.study - INFO - Trial 131 finished with values: [0.0794254864392175, 0.038442622950819676, 0.06618746608175359] and parameters: {'n_layers': 1, 'embedding_dim': 32, 'lr': 0.00019262259007340505, 'lambda_val': 4.915768160138094e-05, 'batch_size': 3887, 'optimizer': 'Adam'}.
2026-05-23 05:04:28,525 - optuna.study.study - INFO - Trial 132 finished with values: [0.07658256895394891, 0.04295081967213115, 0.06585483483657399] and parameters: {'n_layers': 2, 'embedding_dim': 256, 'lr': 0.00015281876966777362, 'lambda_val': 0.0006153780524713789, 'batch_size': 1025, 'optimizer': 'Adam'}.
2026-05-23 05:04:45,049 - optuna.study.study - INFO - Trial 133 finished with values: [0.0460288741769089, 0.02745901639344262, 0.04224279328847264] and parameters: {'n_layers': 3, 'embedding_dim': 64, 'lr': 0.00017559923823258955, 'lambda_val': 0.0003464722773423699, 'batch_size': 4027, 'optimizer': 'Adam'}.
2026-05-23 05:04:51,257 - experiment_functions - INFO - Early stopping at epoch 1800. Best Metrics: (0.03832597738715041, 0.017868852459016392, 0.02845519709815182)
