2026-05-22 23:49:41,184 - optuna.study.study - INFO - Trial 43 finished with values: [0.004576052614168456, 0.007377049180327869, 0.007698828789038583] and parameters: {'n_layers': 3, 'embedding_dim': 32, 'lr': 0.001881283664806877, 'lambda_val': 0.03387477402713897, 'batch_size': 1997, 'optimizer': 'Adam'}.
2026-05-22 23:49:47,491 - experiment_functions - INFO - Early stopping at epoch 1800. Best Metrics: (0.01138899952493378, 0.012704918032786885, 0.01598789618179053)
2026-05-22 23:49:47,709 - optuna.study.study - INFO - Trial 44 finished with values: [0.01138899952493378, 0.012704918032786885, 0.01598789618179053] and parameters: {'n_layers': 3, 'embedding_dim': 96, 'lr': 0.006178111746348912, 'lambda_val': 0.00019552406710701323, 'batch_size': 2381, 'optimizer': 'RMSprop'}.
2026-05-22 23:49:51,613 - experiment_functions - INFO - Early stopping at epoch 1000. Best Metrics: (0.005105965779385333, 0.007540983606557377, 0.008437348513181477)
2026-05-22 23:49:51,830 - optuna.study.study - INFO - Trial 45 finished with values: [0.005105965779385333, 0.007540983606557377, 0.008437348513181477] and parameters: {'n_layers': 3, 'embedding_dim': 64, 'lr': 0.004726887752655103, 'lambda_val': 0.002802498355712308, 'batch_size': 1291, 'optimizer': 'RMSprop'}.
2026-05-22 23:49:57,457 - experiment_functions - INFO - Early stopping at epoch 1150. Best Metrics: (0.008616761287244513, 0.011311475409836066, 0.011831305082160142)
2026-05-22 23:49:57,621 - optuna.study.study - INFO - Trial 46 finished with values: [0.008616761287244513, 0.011311475409836066, 0.011831305082160142] and parameters: {'n_layers': 4, 'embedding_dim': 96, 'lr': 0.02773153918226887, 'lambda_val': 0.0006106302283455917, 'batch_size': 2919, 'optimizer': 'Adam'}.
2026-05-22 23:50:01,576 - experiment_functions - INFO - Early stopping at epoch 600. Best Metrics: (0.00522499013277574, 0.006721311475409835, 0.0069386567713882975)
2026-05-22 23:50:01,674 - optuna.study.study - INFO - Trial 47 finished with values: [0.00522499013277574, 0.006721311475409835, 0.0069386567713882975] and parameters: {'n_layers': 4, 'embedding_dim': 96, 'lr': 0.0001953423842169361, 'lambda_val': 1.5241524820689183e-05, 'batch_size': 2714, 'optimizer': 'RMSprop'}.
2026-05-22 23:50:04,361 - experiment_functions - INFO - Early stopping at epoch 600. Best Metrics: (0.0070339235477940645, 0.00778688524590164, 0.008942598251702934)
2026-05-22 23:50:04,486 - optuna.study.study - INFO - Trial 48 finished with values: [0.0070339235477940645, 0.00778688524590164, 0.008942598251702934] and parameters: {'n_layers': 3, 'embedding_dim': 64, 'lr': 0.0009260592412628807, 'lambda_val': 0.00021021809673449753, 'batch_size': 2061, 'optimizer': 'Adam'}.
2026-05-22 23:50:06,632 - experiment_functions - INFO - Early stopping at epoch 500. Best Metrics: (0.0016313779516716935, 0.002213114754098361, 0.002725353110231787)
2026-05-22 23:50:06,712 - optuna.study.study - INFO - Trial 49 finished with values: [0.0016313779516716935, 0.002213114754098361, 0.002725353110231787] and parameters: {'n_layers': 2, 'embedding_dim': 64, 'lr': 0.0002482190311187583, 'lambda_val': 1.0966280548058074e-06, 'batch_size': 585, 'optimizer': 'SGD'}.
2026-05-22 23:50:10,689 - experiment_functions - INFO - Early stopping at epoch 1050. Best Metrics: (0.004032349968730375, 0.007377049180327869, 0.00777004228332801)
2026-05-22 23:50:10,787 - optuna.study.study - INFO - Trial 50 finished with values: [0.004032349968730375, 0.007377049180327869, 0.00777004228332801] and parameters: {'n_layers': 1, 'embedding_dim': 96, 'lr': 0.006178111746348912, 'lambda_val': 0.00873796310430859, 'batch_size': 2381, 'optimizer': 'RMSprop'}.
2026-05-22 23:50:13,423 - experiment_functions - INFO - Early stopping at epoch 600. Best Metrics: (0.006945209416219726, 0.009754098360655739, 0.011510869040570568)
2026-05-22 23:50:13,521 - optuna.study.study - INFO - Trial 51 finished with values: [0.006945209416219726, 0.009754098360655739, 0.011510869040570568] and parameters: {'n_layers': 1, 'embedding_dim': 32, 'lr': 0.0015424183837958855, 'lambda_val': 5.5728013760561e-06, 'batch_size': 1042, 'optimizer': 'Adam'}.
2026-05-22 23:50:16,128 - experiment_functions - INFO - Early stopping at epoch 550. Best Metrics: (0.007791311255988859, 0.008278688524590166, 0.009519811745739404)
2026-05-22 23:50:16,223 - optuna.study.study - INFO - Trial 52 finished with values: [0.007791311255988859, 0.008278688524590166, 0.009519811745739404] and parameters: {'n_layers': 4, 'embedding_dim': 64, 'lr': 0.0025255710774305645, 'lambda_val': 1.0988779505731458e-05, 'batch_size': 1954, 'optimizer': 'Adam'}.
2026-05-22 23:50:20,744 - experiment_functions - INFO - Early stopping at epoch 1150. Best Metrics: (0.010222401025098141, 0.012622950819672133, 0.01553388742342519)
2026-05-22 23:50:20,874 - optuna.study.study - INFO - Trial 53 finished with values: [0.010222401025098141, 0.012622950819672133, 0.01553388742342519] and parameters: {'n_layers': 2, 'embedding_dim': 32, 'lr': 0.016757203845338013, 'lambda_val': 2.590190399307384e-06, 'batch_size': 3526, 'optimizer': 'RMSprop'}.
2026-05-22 23:50:23,717 - experiment_functions - INFO - Early stopping at epoch 550. Best Metrics: (0.007584730372614278, 0.007459016393442624, 0.009538087411705224)
2026-05-22 23:50:23,886 - optuna.study.study - INFO - Trial 54 finished with values: [0.007584730372614278, 0.007459016393442624, 0.009538087411705224] and parameters: {'n_layers': 4, 'embedding_dim': 128, 'lr': 0.0010357136596424467, 'lambda_val': 1.5257841801841251e-06, 'batch_size': 1686, 'optimizer': 'Adam'}.
2026-05-22 23:50:28,001 - experiment_functions - INFO - Early stopping at epoch 1100. Best Metrics: (0.012915511995778416, 0.013688524590163937, 0.017465427649704327)
2026-05-22 23:50:28,134 - optuna.study.study - INFO - Trial 55 finished with values: [0.012915511995778416, 0.013688524590163937, 0.017465427649704327] and parameters: {'n_layers': 2, 'embedding_dim': 32, 'lr': 0.032125088922163904, 'lambda_val': 7.367374344877376e-05, 'batch_size': 2552, 'optimizer': 'RMSprop'}.
2026-05-22 23:50:31,894 - experiment_functions - INFO - Early stopping at epoch 750. Best Metrics: (0.0017374141298957993, 0.0017213114754098362, 0.002104823237707856)
2026-05-22 23:50:31,985 - optuna.study.study - INFO - Trial 56 finished with values: [0.0017374141298957993, 0.0017213114754098362, 0.002104823237707856] and parameters: {'n_layers': 4, 'embedding_dim': 256, 'lr': 1.1068635231402115e-05, 'lambda_val': 8.357949029622283e-05, 'batch_size': 2228, 'optimizer': 'Adam'}.
2026-05-22 23:50:34,791 - experiment_functions - INFO - Early stopping at epoch 650. Best Metrics: (0.009250233339010873, 0.010081967213114754, 0.012918444479135599)
2026-05-22 23:50:34,899 - optuna.study.study - INFO - Trial 57 finished with values: [0.009250233339010873, 0.010081967213114754, 0.012918444479135599] and parameters: {'n_layers': 1, 'embedding_dim': 96, 'lr': 0.0006693247579890929, 'lambda_val': 5.7691148409924975e-05, 'batch_size': 1815, 'optimizer': 'Adam'}.
2026-05-22 23:50:39,656 - experiment_functions - INFO - Early stopping at epoch 1450. Best Metrics: (0.010508397776861246, 0.011147540983606557, 0.014890030726811845)
2026-05-22 23:50:40,142 - optuna.study.study - INFO - Trial 58 finished with values: [0.010508397776861246, 0.011147540983606557, 0.014890030726811845] and parameters: {'n_layers': 4, 'embedding_dim': 64, 'lr': 0.02143903136401803, 'lambda_val': 0.0003143503113741062, 'batch_size': 2152, 'optimizer': 'Adam'}.
2026-05-22 23:50:50,257 - experiment_functions - INFO - Early stopping at epoch 2850. Best Metrics: (0.01827795733337705, 0.01573770491803279, 0.021493751518178884)
2026-05-22 23:50:50,591 - optuna.study.study - INFO - Trial 59 finished with values: [0.01827795733337705, 0.01573770491803279, 0.021493751518178884] and parameters: {'n_layers': 4, 'embedding_dim': 96, 'lr': 0.02773153918226887, 'lambda_val': 2.590190399307384e-06, 'batch_size': 2919, 'optimizer': 'Adam'}.
2026-05-22 23:50:52,714 - experiment_functions - INFO - Early stopping at epoch 500. Best Metrics: (0.002644395704853105, 0.0013934426229508198, 0.0022475555590534733)
2026-05-22 23:50:52,818 - optuna.study.study - INFO - Trial 60 finished with values: [0.002644395704853105, 0.0013934426229508198, 0.0022475555590534733] and parameters: {'n_layers': 2, 'embedding_dim': 96, 'lr': 0.00028896218391289503, 'lambda_val': 0.018893094798483508, 'batch_size': 2985, 'optimizer': 'SGD'}.
2026-05-22 23:50:55,282 - experiment_functions - INFO - Early stopping at epoch 550. Best Metrics: (0.006097980859006731, 0.00778688524590164, 0.009307026023472373)
2026-05-22 23:50:55,410 - optuna.study.study - INFO - Trial 61 finished with values: [0.006097980859006731, 0.00778688524590164, 0.009307026023472373] and parameters: {'n_layers': 2, 'embedding_dim': 32, 'lr': 0.0031769402206672614, 'lambda_val': 0.0005183974282222809, 'batch_size': 2393, 'optimizer': 'Adam'}.
2026-05-22 23:50:59,749 - experiment_functions - INFO - Early stopping at epoch 1200. Best Metrics: (0.008176777068020115, 0.011475409836065573, 0.013492643883296476)
2026-05-22 23:50:59,827 - optuna.study.study - INFO - Trial 62 finished with values: [0.008176777068020115, 0.011475409836065573, 0.013492643883296476] and parameters: {'n_layers': 2, 'embedding_dim': 96, 'lr': 0.02773153918226887, 'lambda_val': 0.0006106302283455917, 'batch_size': 2393, 'optimizer': 'Adam'}.
2026-05-22 23:51:03,012 - experiment_functions - INFO - Early stopping at epoch 550. Best Metrics: (0.00665812055416689, 0.008032786885245903, 0.008971112733836363)
2026-05-22 23:51:03,569 - optuna.study.study - INFO - Trial 63 finished with values: [0.00665812055416689, 0.008032786885245903, 0.008971112733836363] and parameters: {'n_layers': 4, 'embedding_dim': 256, 'lr': 0.0015424183837958855, 'lambda_val': 0.004701762314715582, 'batch_size': 2736, 'optimizer': 'Adam'}.
2026-05-22 23:51:05,682 - experiment_functions - INFO - Early stopping at epoch 500. Best Metrics: (0.002155398295654639, 0.0018032786885245904, 0.002380168533295664)
2026-05-22 23:51:05,772 - optuna.study.study - INFO - Trial 64 finished with values: [0.002155398295654639, 0.0018032786885245904, 0.002380168533295664] and parameters: {'n_layers': 1, 'embedding_dim': 64, 'lr': 6.617542185949929e-05, 'lambda_val': 0.000501771331363437, 'batch_size': 2290, 'optimizer': 'SGD'}.
2026-05-22 23:51:09,860 - experiment_functions - INFO - Early stopping at epoch 900. Best Metrics: (0.004805937896465385, 0.007131147540983606, 0.008561862647496261)
2026-05-22 23:51:10,707 - optuna.study.study - INFO - Trial 65 finished with values: [0.004805937896465385, 0.007131147540983606, 0.008561862647496261] and parameters: {'n_layers': 4, 'embedding_dim': 256, 'lr': 0.001034403930869181, 'lambda_val': 0.0003143503113741062, 'batch_size': 2505, 'optimizer': 'RMSprop'}.
2026-05-22 23:51:13,076 - experiment_functions - INFO - Early stopping at epoch 500. Best Metrics: (0.0018149408091539727, 0.0013114754098360656, 0.0019429628393658554)
2026-05-22 23:51:13,209 - optuna.study.study - INFO - Trial 66 finished with values: [0.0018149408091539727, 0.0013114754098360656, 0.0019429628393658554] and parameters: {'n_layers': 3, 'embedding_dim': 128, 'lr': 1.2159655743158371e-05, 'lambda_val': 0.000501771331363437, 'batch_size': 2290, 'optimizer': 'SGD'}.
2026-05-22 23:51:15,525 - experiment_functions - INFO - Early stopping at epoch 550. Best Metrics: (0.00654282016736195, 0.007704918032786886, 0.008612517598240273)
2026-05-22 23:51:15,655 - optuna.study.study - INFO - Trial 67 finished with values: [0.00654282016736195, 0.007704918032786886, 0.008612517598240273] and parameters: {'n_layers': 3, 'embedding_dim': 96, 'lr': 0.0010357136596424467, 'lambda_val': 1.5257841801841251e-06, 'batch_size': 1657, 'optimizer': 'RMSprop'}.
2026-05-22 23:51:21,318 - experiment_functions - INFO - Early stopping at epoch 1750. Best Metrics: (0.002156423825746666, 0.0017213114754098362, 0.002174230815786843)
2026-05-22 23:51:21,671 - optuna.study.study - INFO - Trial 68 finished with values: [0.002156423825746666, 0.0017213114754098362, 0.002174230815786843] and parameters: {'n_layers': 2, 'embedding_dim': 96, 'lr': 1.7861902566012577e-05, 'lambda_val': 2.004123419605473e-05, 'batch_size': 3193, 'optimizer': 'RMSprop'}.
2026-05-22 23:51:23,845 - experiment_functions - INFO - Early stopping at epoch 550. Best Metrics: (0.004490121459900804, 0.006885245901639343, 0.008178569683311265)
2026-05-22 23:51:23,986 - optuna.study.study - INFO - Trial 69 finished with values: [0.004490121459900804, 0.006885245901639343, 0.008178569683311265] and parameters: {'n_layers': 3, 'embedding_dim': 32, 'lr': 0.02773153918226887, 'lambda_val': 0.0006106302283455917, 'batch_size': 862, 'optimizer': 'Adam'}.
2026-05-22 23:51:37,145 - optuna.study.study - INFO - Trial 70 finished with values: [0.0043333130592847, 0.006311475409836066, 0.007104974637745552] and parameters: {'n_layers': 2, 'embedding_dim': 256, 'lr': 2.627763050367707e-05, 'lambda_val': 0.004701762314715582, 'batch_size': 2736, 'optimizer': 'Adam'}.
2026-05-22 23:51:39,328 - experiment_functions - INFO - Early stopping at epoch 500. Best Metrics: (0.0012243116437760087, 0.0017213114754098362, 0.0018552256413081807)
2026-05-22 23:51:39,425 - optuna.study.study - INFO - Trial 71 finished with values: [0.0012243116437760087, 0.0017213114754098362, 0.0018552256413081807] and parameters: {'n_layers': 4, 'embedding_dim': 96, 'lr': 0.0006693247579890929, 'lambda_val': 8.019970575757968e-05, 'batch_size': 1483, 'optimizer': 'SGD'}.
2026-05-22 23:51:43,012 - experiment_functions - INFO - Early stopping at epoch 700. Best Metrics: (0.005879332668421235, 0.008114754098360656, 0.008705882987167407)
2026-05-22 23:51:43,157 - optuna.study.study - INFO - Trial 72 finished with values: [0.005879332668421235, 0.008114754098360656, 0.008705882987167407] and parameters: {'n_layers': 4, 'embedding_dim': 256, 'lr': 0.00014250542592028934, 'lambda_val': 1.620594028036075e-05, 'batch_size': 2498, 'optimizer': 'RMSprop'}.
2026-05-22 23:51:46,059 - experiment_functions - INFO - Early stopping at epoch 650. Best Metrics: (0.006605335043287675, 0.009262295081967215, 0.010222948308541115)
2026-05-22 23:51:46,190 - optuna.study.study - INFO - Trial 73 finished with values: [0.006605335043287675, 0.009262295081967215, 0.010222948308541115] and parameters: {'n_layers': 3, 'embedding_dim': 96, 'lr': 0.00038603420377640905, 'lambda_val': 0.009482701668518351, 'batch_size': 1449, 'optimizer': 'RMSprop'}.
2026-05-22 23:51:49,265 - experiment_functions - INFO - Early stopping at epoch 850. Best Metrics: (0.00808561358473204, 0.009426229508196722, 0.01097252676918081)
2026-05-22 23:51:49,343 - optuna.study.study - INFO - Trial 74 finished with values: [0.00808561358473204, 0.009426229508196722, 0.01097252676918081] and parameters: {'n_layers': 2, 'embedding_dim': 64, 'lr': 0.00027781556769439117, 'lambda_val': 0.0007844384959792041, 'batch_size': 2360, 'optimizer': 'RMSprop'}.
2026-05-22 23:52:00,201 - optuna.study.study - INFO - Trial 75 finished with values: [0.002535653450489702, 0.001967213114754099, 0.0026670207928804297] and parameters: {'n_layers': 1, 'embedding_dim': 128, 'lr': 2.0201923381464337e-05, 'lambda_val': 0.0003143503113741062, 'batch_size': 3411, 'optimizer': 'RMSprop'}.
2026-05-22 23:52:02,743 - experiment_functions - INFO - Early stopping at epoch 500. Best Metrics: (0.0017997193834328078, 0.0017213114754098362, 0.0016457477696367473)
2026-05-22 23:52:02,876 - optuna.study.study - INFO - Trial 76 finished with values: [0.0017997193834328078, 0.0017213114754098362, 0.0016457477696367473] and parameters: {'n_layers': 4, 'embedding_dim': 32, 'lr': 0.00038603420377640905, 'lambda_val': 0.0011900697866601866, 'batch_size': 3028, 'optimizer': 'SGD'}.
2026-05-22 23:52:08,657 - experiment_functions - INFO - Early stopping at epoch 1800. Best Metrics: (0.010896605633582974, 0.014098360655737708, 0.017039867128039666)
2026-05-22 23:52:08,775 - optuna.study.study - INFO - Trial 77 finished with values: [0.010896605633582974, 0.014098360655737708, 0.017039867128039666] and parameters: {'n_layers': 2, 'embedding_dim': 32, 'lr': 0.032125088922163904, 'lambda_val': 2.0926872137727736e-06, 'batch_size': 2123, 'optimizer': 'Adam'}.
2026-05-22 23:52:11,680 - experiment_functions - INFO - Early stopping at epoch 600. Best Metrics: (0.010645722183721668, 0.009672131147540983, 0.012642092281762978)
2026-05-22 23:52:11,841 - optuna.study.study - INFO - Trial 78 finished with values: [0.010645722183721668, 0.009672131147540983, 0.012642092281762978] and parameters: {'n_layers': 4, 'embedding_dim': 96, 'lr': 0.00038603420377640905, 'lambda_val': 1.5257841801841251e-06, 'batch_size': 1686, 'optimizer': 'RMSprop'}.
2026-05-22 23:52:19,594 - experiment_functions - INFO - Early stopping at epoch 550. Best Metrics: (0.003784384983891304, 0.006803278688524591, 0.007654716072897909)
2026-05-22 23:52:20,166 - optuna.study.study - INFO - Trial 79 finished with values: [0.003784384983891304, 0.006803278688524591, 0.007654716072897909] and parameters: {'n_layers': 1, 'embedding_dim': 256, 'lr': 0.0025255710774305645, 'lambda_val': 0.00873796310430859, 'batch_size': 1954, 'optimizer': 'RMSprop'}.
2026-05-22 23:52:24,648 - experiment_functions - INFO - Early stopping at epoch 1200. Best Metrics: (0.004564639951161103, 0.006721311475409835, 0.00851089778703643)
2026-05-22 23:52:24,968 - optuna.study.study - INFO - Trial 80 finished with values: [0.004564639951161103, 0.006721311475409835, 0.00851089778703643] and parameters: {'n_layers': 3, 'embedding_dim': 32, 'lr': 0.050521999039995734, 'lambda_val': 0.08678876875199347, 'batch_size': 1156, 'optimizer': 'RMSprop'}.
2026-05-22 23:52:29,919 - experiment_functions - INFO - Early stopping at epoch 1350. Best Metrics: (0.012085377500368108, 0.014918032786885247, 0.019065478284048434)
2026-05-22 23:52:31,002 - optuna.study.study - INFO - Trial 81 finished with values: [0.012085377500368108, 0.014918032786885247, 0.019065478284048434] and parameters: {'n_layers': 2, 'embedding_dim': 96, 'lr': 0.012476072772677116, 'lambda_val': 7.367374344877376e-05, 'batch_size': 2647, 'optimizer': 'RMSprop'}.
2026-05-22 23:52:36,774 - experiment_functions - INFO - Early stopping at epoch 1700. Best Metrics: (0.012248512375223477, 0.01262295081967213, 0.015409612708122617)
2026-05-22 23:52:36,959 - optuna.study.study - INFO - Trial 82 finished with values: [0.012248512375223477, 0.01262295081967213, 0.015409612708122617] and parameters: {'n_layers': 4, 'embedding_dim': 96, 'lr': 0.016757203845338013, 'lambda_val': 0.0003143503113741062, 'batch_size': 2505, 'optimizer': 'Adam'}.
2026-05-22 23:52:42,692 - experiment_functions - INFO - Early stopping at epoch 1700. Best Metrics: (0.008874517368999114, 0.009098360655737705, 0.011041691892202771)
2026-05-22 23:52:43,213 - optuna.study.study - INFO - Trial 83 finished with values: [0.008874517368999114, 0.009098360655737705, 0.011041691892202771] and parameters: {'n_layers': 1, 'embedding_dim': 128, 'lr': 0.00014250542592028934, 'lambda_val': 0.00873796310430859, 'batch_size': 2498, 'optimizer': 'RMSprop'}.
2026-05-22 23:52:50,463 - experiment_functions - INFO - Early stopping at epoch 2250. Best Metrics: (0.0016552777032082602, 0.0014754098360655738, 0.001555582859676057)
2026-05-22 23:52:50,601 - optuna.study.study - INFO - Trial 84 finished with values: [0.0016552777032082602, 0.0014754098360655738, 0.001555582859676057] and parameters: {'n_layers': 1, 'embedding_dim': 96, 'lr': 1.7505605166860213e-05, 'lambda_val': 4.624053967722746e-05, 'batch_size': 3205, 'optimizer': 'Adam'}.
2026-05-22 23:52:53,566 - experiment_functions - INFO - Early stopping at epoch 700. Best Metrics: (0.0019579972204050813, 0.0013114754098360656, 0.0015521346506370216)
2026-05-22 23:52:53,711 - optuna.study.study - INFO - Trial 85 finished with values: [0.0019579972204050813, 0.0013114754098360656, 0.0015521346506370216] and parameters: {'n_layers': 2, 'embedding_dim': 128, 'lr': 0.09847341765086269, 'lambda_val': 0.00023986489473645103, 'batch_size': 2851, 'optimizer': 'SGD'}.
2026-05-22 23:53:11,258 - optuna.study.study - INFO - Trial 86 finished with values: [0.005981919501962303, 0.005491803278688524, 0.007668414935126295] and parameters: {'n_layers': 4, 'embedding_dim': 256, 'lr': 2.1064898678194487e-05, 'lambda_val': 9.956828255961624e-05, 'batch_size': 2060, 'optimizer': 'RMSprop'}.
2026-05-22 23:53:17,861 - experiment_functions - INFO - Early stopping at epoch 500. Best Metrics: (0.0007336544525848197, 0.0012295081967213116, 0.0011852912397450695)
2026-05-22 23:53:18,004 - optuna.study.study - INFO - Trial 87 finished with values: [0.0007336544525848197, 0.0012295081967213116, 0.0011852912397450695] and parameters: {'n_layers': 3, 'embedding_dim': 256, 'lr': 0.008487053669964195, 'lambda_val': 0.004701762314715582, 'batch_size': 2736, 'optimizer': 'SGD'}.
2026-05-22 23:53:22,848 - experiment_functions - INFO - Early stopping at epoch 1350. Best Metrics: (0.002251956160558738, 0.0018032786885245904, 0.0032239719804796675)
2026-05-22 23:53:22,914 - optuna.study.study - INFO - Trial 88 finished with values: [0.002251956160558738, 0.0018032786885245904, 0.0032239719804796675] and parameters: {'n_layers': 4, 'embedding_dim': 32, 'lr': 1.2159655743158371e-05, 'lambda_val': 0.000501771331363437, 'batch_size': 2290, 'optimizer': 'RMSprop'}.
2026-05-22 23:53:26,016 - experiment_functions - INFO - Early stopping at epoch 550. Best Metrics: (0.014020443549971905, 0.011639344262295083, 0.016192430469158484)
