2026-05-22 23:06:27,847 - optuna.study.study - INFO - Trial 45 finished with values: [0.0018818098492998743, 0.001639344262295082, 0.0017616447289662924] and parameters: {'n_layers': 3, 'embedding_dim': 256, 'lr': 1.0616806106502517e-05, 'lambda_val': 0.000634733794413211, 'batch_size': 3667, 'optimizer': 'SGD'}.
2026-05-22 23:06:33,499 - experiment_functions - INFO - Early stopping at epoch 1650. Best Metrics: (0.016154286339020534, 0.019344262295081967, 0.02440417398240461)
2026-05-22 23:06:33,645 - optuna.study.study - INFO - Trial 46 finished with values: [0.016154286339020534, 0.019344262295081967, 0.02440417398240461] and parameters: {'n_layers': 1, 'embedding_dim': 96, 'lr': 0.004300536862193349, 'lambda_val': 0.08423311433489059, 'batch_size': 1384, 'optimizer': 'Adam'}.
2026-05-22 23:06:36,902 - experiment_functions - INFO - Early stopping at epoch 500. Best Metrics: (0.0026782674766427316, 0.001967213114754099, 0.0031654728849869816)
2026-05-22 23:06:38,203 - optuna.study.study - INFO - Trial 47 finished with values: [0.0026782674766427316, 0.001967213114754099, 0.0031654728849869816] and parameters: {'n_layers': 3, 'embedding_dim': 128, 'lr': 0.00048680444198246877, 'lambda_val': 0.03012512700433234, 'batch_size': 512, 'optimizer': 'SGD'}.
2026-05-22 23:07:02,934 - optuna.study.study - INFO - Trial 48 finished with values: [0.008667308170307045, 0.007540983606557378, 0.011358928149289396] and parameters: {'n_layers': 3, 'embedding_dim': 256, 'lr': 2.4615220637814243e-05, 'lambda_val': 0.00046750087014425833, 'batch_size': 3733, 'optimizer': 'RMSprop'}.
2026-05-22 23:07:05,973 - experiment_functions - INFO - Early stopping at epoch 500. Best Metrics: (0.0009243098965287372, 0.001639344262295082, 0.0016090711408158693)
2026-05-22 23:07:06,074 - optuna.study.study - INFO - Trial 49 finished with values: [0.0009243098965287372, 0.001639344262295082, 0.0016090711408158693] and parameters: {'n_layers': 3, 'embedding_dim': 64, 'lr': 0.032972394450530546, 'lambda_val': 1.7632399681083993e-06, 'batch_size': 1898, 'optimizer': 'SGD'}.
2026-05-22 23:07:23,668 - optuna.study.study - INFO - Trial 50 finished with values: [0.11743711796475882, 0.061885245901639345, 0.10389615876885366] and parameters: {'n_layers': 1, 'embedding_dim': 256, 'lr': 0.00014191753167124515, 'lambda_val': 0.0001473158611730725, 'batch_size': 3643, 'optimizer': 'RMSprop'}.
2026-05-22 23:07:26,702 - experiment_functions - INFO - Early stopping at epoch 500. Best Metrics: (0.001382334089936421, 0.001639344262295082, 0.0022162833977378295)
2026-05-22 23:07:26,847 - optuna.study.study - INFO - Trial 51 finished with values: [0.001382334089936421, 0.001639344262295082, 0.0022162833977378295] and parameters: {'n_layers': 2, 'embedding_dim': 64, 'lr': 0.0030756517738792406, 'lambda_val': 3.287265915456076e-06, 'batch_size': 1456, 'optimizer': 'SGD'}.
2026-05-22 23:07:32,350 - experiment_functions - INFO - Early stopping at epoch 900. Best Metrics: (0.08239172650944505, 0.043852459016393446, 0.06877493246786541)
2026-05-22 23:07:33,135 - optuna.study.study - INFO - Trial 52 finished with values: [0.08239172650944505, 0.043852459016393446, 0.06877493246786541] and parameters: {'n_layers': 2, 'embedding_dim': 256, 'lr': 0.0005586191809811369, 'lambda_val': 2.3648996790815136e-05, 'batch_size': 2288, 'optimizer': 'Adam'}.
2026-05-22 23:07:48,468 - optuna.study.study - INFO - Trial 53 finished with values: [0.006079233757815574, 0.0036065573770491808, 0.005704329252103511] and parameters: {'n_layers': 1, 'embedding_dim': 256, 'lr': 7.461044270230025e-05, 'lambda_val': 0.00046750087014425833, 'batch_size': 761, 'optimizer': 'RMSprop'}.
2026-05-22 23:07:54,508 - experiment_functions - INFO - Early stopping at epoch 1650. Best Metrics: (0.015960949027447564, 0.01918032786885246, 0.024018832873224354)
2026-05-22 23:07:55,575 - optuna.study.study - INFO - Trial 54 finished with values: [0.015960949027447564, 0.01918032786885246, 0.024018832873224354] and parameters: {'n_layers': 1, 'embedding_dim': 96, 'lr': 0.004300536862193349, 'lambda_val': 0.08423311433489059, 'batch_size': 1384, 'optimizer': 'Adam'}.
2026-05-22 23:07:59,631 - experiment_functions - INFO - Early stopping at epoch 600. Best Metrics: (0.020121653295614977, 0.017704918032786888, 0.022053294009078114)
2026-05-22 23:07:59,885 - optuna.study.study - INFO - Trial 55 finished with values: [0.020121653295614977, 0.017704918032786888, 0.022053294009078114] and parameters: {'n_layers': 2, 'embedding_dim': 256, 'lr': 0.0019593624136751238, 'lambda_val': 0.027541242379727653, 'batch_size': 1334, 'optimizer': 'Adam'}.
2026-05-22 23:08:08,915 - experiment_functions - INFO - Early stopping at epoch 1900. Best Metrics: (0.0016131448157938964, 0.0018852459016393442, 0.00234321007243573)
2026-05-22 23:08:09,251 - optuna.study.study - INFO - Trial 56 finished with values: [0.0016131448157938964, 0.0018852459016393442, 0.00234321007243573] and parameters: {'n_layers': 3, 'embedding_dim': 96, 'lr': 1.2538970443469547e-05, 'lambda_val': 0.002505839269429127, 'batch_size': 3520, 'optimizer': 'RMSprop'}.
2026-05-22 23:08:13,005 - experiment_functions - INFO - Early stopping at epoch 650. Best Metrics: (0.026776949241438787, 0.012950819672131148, 0.02116355228361098)
2026-05-22 23:08:13,101 - optuna.study.study - INFO - Trial 57 finished with values: [0.026776949241438787, 0.012950819672131148, 0.02116355228361098] and parameters: {'n_layers': 3, 'embedding_dim': 96, 'lr': 0.008306055115080375, 'lambda_val': 0.0014101679442333785, 'batch_size': 1384, 'optimizer': 'RMSprop'}.
2026-05-22 23:08:24,008 - experiment_functions - INFO - Early stopping at epoch 3100. Best Metrics: (0.02229889567391305, 0.023770491803278688, 0.02819693747032763)
2026-05-22 23:08:24,100 - optuna.study.study - INFO - Trial 58 finished with values: [0.02229889567391305, 0.023770491803278688, 0.02819693747032763] and parameters: {'n_layers': 1, 'embedding_dim': 96, 'lr': 0.06514473676765253, 'lambda_val': 0.08423311433489059, 'batch_size': 3639, 'optimizer': 'Adam'}.
2026-05-22 23:08:27,890 - experiment_functions - INFO - Early stopping at epoch 700. Best Metrics: (0.021206510811443827, 0.018278688524590164, 0.02460041171289423)
2026-05-22 23:08:28,572 - optuna.study.study - INFO - Trial 59 finished with values: [0.021206510811443827, 0.018278688524590164, 0.02460041171289423] and parameters: {'n_layers': 2, 'embedding_dim': 96, 'lr': 0.0009386876662853627, 'lambda_val': 0.053735510419040323, 'batch_size': 3061, 'optimizer': 'Adam'}.
2026-05-22 23:08:34,705 - experiment_functions - INFO - Early stopping at epoch 1350. Best Metrics: (0.028601726360349564, 0.012950819672131148, 0.0220499496091533)
2026-05-22 23:08:34,818 - optuna.study.study - INFO - Trial 60 finished with values: [0.028601726360349564, 0.012950819672131148, 0.0220499496091533] and parameters: {'n_layers': 3, 'embedding_dim': 32, 'lr': 0.06514473676765253, 'lambda_val': 0.0014101679442333785, 'batch_size': 2759, 'optimizer': 'Adam'}.
2026-05-22 23:08:38,246 - experiment_functions - INFO - Early stopping at epoch 800. Best Metrics: (0.08813960204896797, 0.05262295081967213, 0.07795550552755852)
2026-05-22 23:08:38,343 - optuna.study.study - INFO - Trial 61 finished with values: [0.08813960204896797, 0.05262295081967213, 0.07795550552755852] and parameters: {'n_layers': 1, 'embedding_dim': 64, 'lr': 0.0014373137364726936, 'lambda_val': 0.004805532813491775, 'batch_size': 653, 'optimizer': 'Adam'}.
2026-05-22 23:08:50,039 - experiment_functions - INFO - Early stopping at epoch 2050. Best Metrics: (0.025453243011045325, 0.009426229508196722, 0.018366159519827722)
2026-05-22 23:08:50,137 - optuna.study.study - INFO - Trial 62 finished with values: [0.025453243011045325, 0.009426229508196722, 0.018366159519827722] and parameters: {'n_layers': 4, 'embedding_dim': 128, 'lr': 0.0626248099317006, 'lambda_val': 4.7204869445784795e-05, 'batch_size': 2952, 'optimizer': 'Adam'}.
2026-05-22 23:08:55,904 - experiment_functions - INFO - Early stopping at epoch 1350. Best Metrics: (0.05510838127941295, 0.03647540983606557, 0.0512004233985848)
2026-05-22 23:08:56,008 - optuna.study.study - INFO - Trial 63 finished with values: [0.05510838127941295, 0.03647540983606557, 0.0512004233985848] and parameters: {'n_layers': 2, 'embedding_dim': 96, 'lr': 0.0002391583318230419, 'lambda_val': 0.015604800721470977, 'batch_size': 1459, 'optimizer': 'RMSprop'}.
2026-05-22 23:08:59,317 - experiment_functions - INFO - Early stopping at epoch 500. Best Metrics: (0.001224276249207831, 0.002377049180327869, 0.002808579171630735)
2026-05-22 23:08:59,909 - optuna.study.study - INFO - Trial 64 finished with values: [0.001224276249207831, 0.002377049180327869, 0.002808579171630735] and parameters: {'n_layers': 3, 'embedding_dim': 128, 'lr': 0.004300536862193349, 'lambda_val': 1.2190458248548848e-06, 'batch_size': 3505, 'optimizer': 'SGD'}.
2026-05-22 23:09:03,360 - experiment_functions - INFO - Early stopping at epoch 500. Best Metrics: (0.001426172179199495, 0.001639344262295082, 0.0018816237922442635)
2026-05-22 23:09:03,512 - optuna.study.study - INFO - Trial 65 finished with values: [0.001426172179199495, 0.001639344262295082, 0.0018816237922442635] and parameters: {'n_layers': 3, 'embedding_dim': 64, 'lr': 0.00014702351969030086, 'lambda_val': 0.0011596678103466965, 'batch_size': 1116, 'optimizer': 'SGD'}.
2026-05-22 23:09:06,678 - experiment_functions - INFO - Early stopping at epoch 500. Best Metrics: (0.0024404857051953536, 0.0021311475409836068, 0.0024884672219800405)
2026-05-22 23:09:07,251 - optuna.study.study - INFO - Trial 66 finished with values: [0.0024404857051953536, 0.0021311475409836068, 0.0024884672219800405] and parameters: {'n_layers': 4, 'embedding_dim': 32, 'lr': 1.0012773405393919e-05, 'lambda_val': 0.04236774170162714, 'batch_size': 3025, 'optimizer': 'RMSprop'}.
2026-05-22 23:09:14,278 - experiment_functions - INFO - Early stopping at epoch 1250. Best Metrics: (0.0049350796350819464, 0.006229508196721312, 0.007000573791271932)
2026-05-22 23:09:14,419 - optuna.study.study - INFO - Trial 67 finished with values: [0.0049350796350819464, 0.006229508196721312, 0.007000573791271932] and parameters: {'n_layers': 4, 'embedding_dim': 96, 'lr': 0.0013596200813318466, 'lambda_val': 0.07299302124361523, 'batch_size': 1636, 'optimizer': 'RMSprop'}.
2026-05-22 23:09:18,336 - experiment_functions - INFO - Early stopping at epoch 550. Best Metrics: (0.027984429857821735, 0.011639344262295083, 0.018150381678764656)
2026-05-22 23:09:19,841 - optuna.study.study - INFO - Trial 68 finished with values: [0.027984429857821735, 0.011639344262295083, 0.018150381678764656] and parameters: {'n_layers': 2, 'embedding_dim': 256, 'lr': 0.036303500410505576, 'lambda_val': 3.7779470846945565e-05, 'batch_size': 1636, 'optimizer': 'Adam'}.
2026-05-22 23:09:22,778 - experiment_functions - INFO - Early stopping at epoch 500. Best Metrics: (0.0030099047092935656, 0.0018032786885245904, 0.0029457562711770807)
2026-05-22 23:09:22,913 - optuna.study.study - INFO - Trial 69 finished with values: [0.0030099047092935656, 0.0018032786885245904, 0.0029457562711770807] and parameters: {'n_layers': 1, 'embedding_dim': 96, 'lr': 1.2538970443469547e-05, 'lambda_val': 0.002505839269429127, 'batch_size': 3520, 'optimizer': 'RMSprop'}.
2026-05-22 23:09:29,343 - experiment_functions - INFO - Early stopping at epoch 900. Best Metrics: (0.018835730001632318, 0.009016393442622951, 0.01618080917072233)
2026-05-22 23:09:29,487 - optuna.study.study - INFO - Trial 70 finished with values: [0.018835730001632318, 0.009016393442622951, 0.01618080917072233] and parameters: {'n_layers': 3, 'embedding_dim': 256, 'lr': 0.06514473676765253, 'lambda_val': 1.9276880825438222e-05, 'batch_size': 3639, 'optimizer': 'Adam'}.
2026-05-22 23:09:32,774 - experiment_functions - INFO - Early stopping at epoch 550. Best Metrics: (0.0186487651093621, 0.009344262295081968, 0.014958496860527545)
2026-05-22 23:09:32,919 - optuna.study.study - INFO - Trial 71 finished with values: [0.0186487651093621, 0.009344262295081968, 0.014958496860527545] and parameters: {'n_layers': 4, 'embedding_dim': 32, 'lr': 0.05241207551926649, 'lambda_val': 0.0006542099358730213, 'batch_size': 874, 'optimizer': 'Adam'}.
2026-05-22 23:09:35,470 - experiment_functions - INFO - Early stopping at epoch 500. Best Metrics: (0.0014582491279215213, 0.001557377049180328, 0.0015929523882042076)
2026-05-22 23:09:35,606 - optuna.study.study - INFO - Trial 72 finished with values: [0.0014582491279215213, 0.001557377049180328, 0.0015929523882042076] and parameters: {'n_layers': 1, 'embedding_dim': 128, 'lr': 0.01158026631563179, 'lambda_val': 0.000154598890124529, 'batch_size': 3061, 'optimizer': 'SGD'}.
2026-05-22 23:09:39,231 - experiment_functions - INFO - Early stopping at epoch 500. Best Metrics: (0.0010970020930878568, 0.0013114754098360656, 0.0015843461431082485)
2026-05-22 23:09:39,387 - optuna.study.study - INFO - Trial 73 finished with values: [0.0010970020930878568, 0.0013114754098360656, 0.0015843461431082485] and parameters: {'n_layers': 4, 'embedding_dim': 128, 'lr': 0.0043180745145269305, 'lambda_val': 0.09317692348671457, 'batch_size': 1636, 'optimizer': 'SGD'}.
2026-05-22 23:09:50,819 - experiment_functions - INFO - Early stopping at epoch 2650. Best Metrics: (0.05728360340098295, 0.04024590163934426, 0.05380877983772251)
2026-05-22 23:09:51,460 - optuna.study.study - INFO - Trial 74 finished with values: [0.05728360340098295, 0.04024590163934426, 0.05380877983772251] and parameters: {'n_layers': 2, 'embedding_dim': 128, 'lr': 0.00018259329948876513, 'lambda_val': 0.005129821983037811, 'batch_size': 2149, 'optimizer': 'Adam'}.
2026-05-22 23:10:08,019 - optuna.study.study - INFO - Trial 75 finished with values: [0.07643740278176311, 0.04360655737704918, 0.07067626848101811] and parameters: {'n_layers': 2, 'embedding_dim': 128, 'lr': 0.00014191753167124515, 'lambda_val': 4.1855561222722974e-06, 'batch_size': 1459, 'optimizer': 'RMSprop'}.
2026-05-22 23:10:13,465 - experiment_functions - INFO - Early stopping at epoch 900. Best Metrics: (0.01434935533498394, 0.010245901639344262, 0.013737553343016814)
2026-05-22 23:10:13,808 - optuna.study.study - INFO - Trial 76 finished with values: [0.01434935533498394, 0.010245901639344262, 0.013737553343016814] and parameters: {'n_layers': 4, 'embedding_dim': 96, 'lr': 0.00033449569428321705, 'lambda_val': 0.053735510419040323, 'batch_size': 3414, 'optimizer': 'Adam'}.
2026-05-22 23:10:18,609 - experiment_functions - INFO - Early stopping at epoch 950. Best Metrics: (0.04941257708960965, 0.027049180327868853, 0.043266254785284314)
2026-05-22 23:10:18,751 - optuna.study.study - INFO - Trial 77 finished with values: [0.04941257708960965, 0.027049180327868853, 0.043266254785284314] and parameters: {'n_layers': 1, 'embedding_dim': 128, 'lr': 0.01158026631563179, 'lambda_val': 0.000154598890124529, 'batch_size': 704, 'optimizer': 'RMSprop'}.
2026-05-22 23:10:22,620 - experiment_functions - INFO - Early stopping at epoch 550. Best Metrics: (0.05120138493393854, 0.03114754098360656, 0.04945118165025117)
2026-05-22 23:10:23,685 - optuna.study.study - INFO - Trial 78 finished with values: [0.05120138493393854, 0.03114754098360656, 0.04945118165025117] and parameters: {'n_layers': 2, 'embedding_dim': 256, 'lr': 0.002406863740771825, 'lambda_val': 0.005129821983037811, 'batch_size': 891, 'optimizer': 'Adam'}.
2026-05-22 23:10:28,171 - experiment_functions - INFO - Early stopping at epoch 700. Best Metrics: (0.05372586198057891, 0.036639344262295086, 0.05401953590340296)
2026-05-22 23:10:28,747 - optuna.study.study - INFO - Trial 79 finished with values: [0.05372586198057891, 0.036639344262295086, 0.05401953590340296] and parameters: {'n_layers': 2, 'embedding_dim': 96, 'lr': 0.0008184011149012127, 'lambda_val': 0.004163877683375522, 'batch_size': 2759, 'optimizer': 'Adam'}.
2026-05-22 23:10:35,637 - experiment_functions - INFO - Early stopping at epoch 1300. Best Metrics: (0.012847417841911872, 0.012049180327868851, 0.014500701642214188)
2026-05-22 23:10:35,784 - optuna.study.study - INFO - Trial 80 finished with values: [0.012847417841911872, 0.012049180327868851, 0.014500701642214188] and parameters: {'n_layers': 4, 'embedding_dim': 64, 'lr': 0.000190429558887039, 'lambda_val': 0.04126390974558691, 'batch_size': 4072, 'optimizer': 'Adam'}.
2026-05-22 23:10:39,349 - experiment_functions - INFO - Early stopping at epoch 650. Best Metrics: (0.018903713602561913, 0.017131147540983604, 0.02112001536823441)
2026-05-22 23:10:39,689 - optuna.study.study - INFO - Trial 81 finished with values: [0.018903713602561913, 0.017131147540983604, 0.02112001536823441] and parameters: {'n_layers': 3, 'embedding_dim': 32, 'lr': 0.0014373137364726936, 'lambda_val': 0.044766261489018064, 'batch_size': 2288, 'optimizer': 'Adam'}.
2026-05-22 23:10:43,545 - experiment_functions - INFO - Early stopping at epoch 600. Best Metrics: (0.027177110029908427, 0.01418032786885246, 0.02327359401491055)
2026-05-22 23:10:44,094 - optuna.study.study - INFO - Trial 82 finished with values: [0.027177110029908427, 0.01418032786885246, 0.02327359401491055] and parameters: {'n_layers': 3, 'embedding_dim': 96, 'lr': 0.01243482202597104, 'lambda_val': 1.1217659892376085e-05, 'batch_size': 2652, 'optimizer': 'Adam'}.
2026-05-22 23:10:48,277 - experiment_functions - INFO - Early stopping at epoch 650. Best Metrics: (0.0280934489376725, 0.019098360655737705, 0.027563628497234257)
2026-05-22 23:10:48,732 - optuna.study.study - INFO - Trial 83 finished with values: [0.0280934489376725, 0.019098360655737705, 0.027563628497234257] and parameters: {'n_layers': 4, 'embedding_dim': 96, 'lr': 0.0008839940075688664, 'lambda_val': 0.00013566611589542861, 'batch_size': 704, 'optimizer': 'RMSprop'}.
2026-05-22 23:11:03,121 - optuna.study.study - INFO - Trial 84 finished with values: [0.07561316731289532, 0.040245901639344266, 0.06588730482535483] and parameters: {'n_layers': 1, 'embedding_dim': 96, 'lr': 0.00014191753167124515, 'lambda_val': 4.1855561222722974e-06, 'batch_size': 3643, 'optimizer': 'Adam'}.
2026-05-22 23:11:20,197 - optuna.study.study - INFO - Trial 85 finished with values: [0.10521512828072062, 0.05721311475409837, 0.09330048368734649] and parameters: {'n_layers': 1, 'embedding_dim': 256, 'lr': 0.00014191753167124515, 'lambda_val': 4.1855561222722974e-06, 'batch_size': 3835, 'optimizer': 'RMSprop'}.
2026-05-22 23:11:22,694 - experiment_functions - INFO - Early stopping at epoch 500. Best Metrics: (0.0014625390077278233, 0.001475409836065574, 0.0021244002894509765)
2026-05-22 23:11:22,883 - optuna.study.study - INFO - Trial 86 finished with values: [0.0014625390077278233, 0.001475409836065574, 0.0021244002894509765] and parameters: {'n_layers': 1, 'embedding_dim': 96, 'lr': 0.01243482202597104, 'lambda_val': 0.0017010397570991157, 'batch_size': 874, 'optimizer': 'SGD'}.
2026-05-22 23:11:27,637 - experiment_functions - INFO - Early stopping at epoch 1300. Best Metrics: (0.003172626141851806, 0.0027049180327868854, 0.00334240995801856)
2026-05-22 23:11:28,152 - optuna.study.study - INFO - Trial 87 finished with values: [0.003172626141851806, 0.0027049180327868854, 0.00334240995801856] and parameters: {'n_layers': 2, 'embedding_dim': 32, 'lr': 1.797539004209822e-05, 'lambda_val': 0.0001469413918404598, 'batch_size': 2731, 'optimizer': 'RMSprop'}.
2026-05-22 23:11:40,843 - optuna.study.study - INFO - Trial 88 finished with values: [0.06700541565841829, 0.03926229508196722, 0.058278907750617864] and parameters: {'n_layers': 1, 'embedding_dim': 128, 'lr': 0.05241207551926649, 'lambda_val': 0.004805532813491775, 'batch_size': 653, 'optimizer': 'Adam'}.
2026-05-22 23:11:53,821 - optuna.study.study - INFO - Trial 89 finished with values: [0.042152934189721186, 0.027622950819672133, 0.04007546281701475] and parameters: {'n_layers': 2, 'embedding_dim': 32, 'lr': 0.00014191753167124515, 'lambda_val': 7.913101106142164e-06, 'batch_size': 1636, 'optimizer': 'Adam'}.
2026-05-22 23:11:57,285 - experiment_functions - INFO - Early stopping at epoch 600. Best Metrics: (0.02955434302958795, 0.020163934426229508, 0.02576419566307692)
2026-05-22 23:11:57,425 - optuna.study.study - INFO - Trial 90 finished with values: [0.02955434302958795, 0.020163934426229508, 0.02576419566307692] and parameters: {'n_layers': 4, 'embedding_dim': 32, 'lr': 0.0032374955494066686, 'lambda_val': 0.0001469413918404598, 'batch_size': 1995, 'optimizer': 'Adam'}.
2026-05-22 23:12:01,063 - experiment_functions - INFO - Early stopping at epoch 600. Best Metrics: (0.016902250352423293, 0.008114754098360656, 0.01437238968817429)
2026-05-22 23:12:01,206 - optuna.study.study - INFO - Trial 91 finished with values: [0.016902250352423293, 0.008114754098360656, 0.01437238968817429] and parameters: {'n_layers': 4, 'embedding_dim': 32, 'lr': 0.05090632208686795, 'lambda_val': 1.2194778469454053e-06, 'batch_size': 1636, 'optimizer': 'Adam'}.
2026-05-22 23:12:04,997 - experiment_functions - INFO - Early stopping at epoch 650. Best Metrics: (0.02624798330652023, 0.018688524590163937, 0.02884041160244597)
2026-05-22 23:12:05,091 - optuna.study.study - INFO - Trial 92 finished with values: [0.02624798330652023, 0.018688524590163937, 0.02884041160244597] and parameters: {'n_layers': 4, 'embedding_dim': 32, 'lr': 0.0032374955494066686, 'lambda_val': 7.613685556639934e-06, 'batch_size': 1995, 'optimizer': 'Adam'}.
2026-05-22 23:12:11,899 - experiment_functions - INFO - Early stopping at epoch 1550. Best Metrics: (0.031336892658160156, 0.01778688524590164, 0.026793911097873012)
2026-05-22 23:12:12,272 - optuna.study.study - INFO - Trial 93 finished with values: [0.031336892658160156, 0.01778688524590164, 0.026793911097873012] and parameters: {'n_layers': 2, 'embedding_dim': 96, 'lr': 0.03402233003375248, 'lambda_val': 0.005129821983037811, 'batch_size': 3520, 'optimizer': 'Adam'}.
