2026-05-23 05:48:03,807 - optuna.study.study - INFO - Trial 219 finished with values: [0.09755899837013277, 0.04639344262295082, 0.0773574423393723] and parameters: {'n_layers': 1, 'embedding_dim': 32, 'lr': 0.0026271984480321668, 'lambda_val': 0.0016872549049523802, 'batch_size': 918, 'optimizer': 'Adam'}.
2026-05-23 05:48:17,934 - optuna.study.study - INFO - Trial 220 finished with values: [0.029977986056237502, 0.01918032786885246, 0.026454916607506433] and parameters: {'n_layers': 2, 'embedding_dim': 32, 'lr': 0.00015653541413289526, 'lambda_val': 0.020679334364233817, 'batch_size': 3638, 'optimizer': 'Adam'}.
2026-05-23 05:48:24,678 - experiment_functions - INFO - Early stopping at epoch 1650. Best Metrics: (0.12351237430982716, 0.05737704918032787, 0.10189409359608967)
2026-05-23 05:48:25,075 - optuna.study.study - INFO - Trial 221 finished with values: [0.12351237430982716, 0.05737704918032787, 0.10189409359608967] and parameters: {'n_layers': 1, 'embedding_dim': 256, 'lr': 0.0003614258129820434, 'lambda_val': 0.00013338361174833875, 'batch_size': 1794, 'optimizer': 'RMSprop'}.
2026-05-23 05:48:37,938 - optuna.study.study - INFO - Trial 222 finished with values: [0.10407337777471132, 0.05491803278688524, 0.09269727999541358] and parameters: {'n_layers': 1, 'embedding_dim': 96, 'lr': 0.000360608106860257, 'lambda_val': 0.00013338361174833875, 'batch_size': 568, 'optimizer': 'Adam'}.
2026-05-23 05:48:43,834 - experiment_functions - INFO - Early stopping at epoch 1300. Best Metrics: (0.05475948385952648, 0.030081967213114756, 0.04999801685623761)
2026-05-23 05:48:43,931 - optuna.study.study - INFO - Trial 223 finished with values: [0.05475948385952648, 0.030081967213114756, 0.04999801685623761] and parameters: {'n_layers': 3, 'embedding_dim': 96, 'lr': 0.0003614258129820434, 'lambda_val': 1.5271587203565615e-05, 'batch_size': 1628, 'optimizer': 'Adam'}.
2026-05-23 05:48:46,529 - experiment_functions - INFO - Early stopping at epoch 600. Best Metrics: (0.0724677115782053, 0.04286885245901639, 0.06381556716556083)
2026-05-23 05:48:46,660 - optuna.study.study - INFO - Trial 224 finished with values: [0.0724677115782053, 0.04286885245901639, 0.06381556716556083] and parameters: {'n_layers': 1, 'embedding_dim': 128, 'lr': 0.0026271984480321668, 'lambda_val': 0.020679334364233817, 'batch_size': 1844, 'optimizer': 'Adam'}.
2026-05-23 05:48:50,153 - experiment_functions - INFO - Early stopping at epoch 550. Best Metrics: (0.023496630662605843, 0.013278688524590167, 0.018912210646119493)
2026-05-23 05:48:50,237 - optuna.study.study - INFO - Trial 225 finished with values: [0.023496630662605843, 0.013278688524590167, 0.018912210646119493] and parameters: {'n_layers': 4, 'embedding_dim': 128, 'lr': 0.006312777493233292, 'lambda_val': 0.00013338361174833875, 'batch_size': 2283, 'optimizer': 'Adam'}.
2026-05-23 05:48:52,885 - experiment_functions - INFO - Early stopping at epoch 600. Best Metrics: (0.09690559318872895, 0.05024590163934426, 0.08333416194955542)
2026-05-23 05:48:52,973 - optuna.study.study - INFO - Trial 226 finished with values: [0.09690559318872895, 0.05024590163934426, 0.08333416194955542] and parameters: {'n_layers': 1, 'embedding_dim': 64, 'lr': 0.0026271984480321668, 'lambda_val': 0.0016872549049523802, 'batch_size': 3886, 'optimizer': 'Adam'}.
2026-05-23 05:48:59,523 - experiment_functions - INFO - Early stopping at epoch 2150. Best Metrics: (0.11644577488098555, 0.055163934426229515, 0.09410161438725112)
2026-05-23 05:49:00,059 - optuna.study.study - INFO - Trial 227 finished with values: [0.11644577488098555, 0.055163934426229515, 0.09410161438725112] and parameters: {'n_layers': 1, 'embedding_dim': 128, 'lr': 0.000360608106860257, 'lambda_val': 6.19406847114503e-05, 'batch_size': 1976, 'optimizer': 'RMSprop'}.
2026-05-23 05:49:08,158 - experiment_functions - INFO - Early stopping at epoch 850. Best Metrics: (0.02478699336602951, 0.016639344262295082, 0.02409799743767911)
2026-05-23 05:49:08,230 - optuna.study.study - INFO - Trial 228 finished with values: [0.02478699336602951, 0.016639344262295082, 0.02409799743767911] and parameters: {'n_layers': 3, 'embedding_dim': 32, 'lr': 0.001288815314225091, 'lambda_val': 3.017168118404269e-06, 'batch_size': 2591, 'optimizer': 'Adam'}.
2026-05-23 05:49:11,431 - experiment_functions - INFO - Early stopping at epoch 700. Best Metrics: (0.10144439331411219, 0.04524590163934426, 0.07998964662372923)
2026-05-23 05:49:11,558 - optuna.study.study - INFO - Trial 229 finished with values: [0.10144439331411219, 0.04524590163934426, 0.07998964662372923] and parameters: {'n_layers': 1, 'embedding_dim': 128, 'lr': 0.0014897144525931195, 'lambda_val': 1.916622569179001e-06, 'batch_size': 3257, 'optimizer': 'RMSprop'}.
2026-05-23 05:49:14,677 - experiment_functions - INFO - Early stopping at epoch 600. Best Metrics: (0.08784167619003251, 0.04836065573770492, 0.07142290711635892)
2026-05-23 05:49:14,747 - optuna.study.study - INFO - Trial 230 finished with values: [0.08784167619003251, 0.04836065573770492, 0.07142290711635892] and parameters: {'n_layers': 1, 'embedding_dim': 128, 'lr': 0.0027639393129429376, 'lambda_val': 0.006533974012850517, 'batch_size': 1794, 'optimizer': 'Adam'}.
2026-05-23 05:49:17,418 - experiment_functions - INFO - Early stopping at epoch 600. Best Metrics: (0.08117895705596527, 0.0440983606557377, 0.07224510620251874)
2026-05-23 05:49:17,585 - optuna.study.study - INFO - Trial 231 finished with values: [0.08117895705596527, 0.0440983606557377, 0.07224510620251874] and parameters: {'n_layers': 1, 'embedding_dim': 32, 'lr': 0.004748827105127406, 'lambda_val': 1.7408384781052897e-06, 'batch_size': 3654, 'optimizer': 'Adam'}.
2026-05-23 05:49:29,701 - experiment_functions - INFO - Early stopping at epoch 3100. Best Metrics: (0.12522874170836998, 0.05901639344262295, 0.1018139299485911)
2026-05-23 05:49:29,771 - optuna.study.study - INFO - Trial 232 finished with values: [0.12522874170836998, 0.05901639344262295, 0.1018139299485911] and parameters: {'n_layers': 1, 'embedding_dim': 256, 'lr': 0.000360608106860257, 'lambda_val': 0.00016785947403210068, 'batch_size': 1321, 'optimizer': 'RMSprop'}.
2026-05-23 05:49:32,618 - experiment_functions - INFO - Early stopping at epoch 550. Best Metrics: (0.06789540232458677, 0.038196721311475404, 0.05849432242638817)
2026-05-23 05:49:32,707 - optuna.study.study - INFO - Trial 233 finished with values: [0.06789540232458677, 0.038196721311475404, 0.05849432242638817] and parameters: {'n_layers': 1, 'embedding_dim': 128, 'lr': 0.0087991751940927, 'lambda_val': 6.19406847114503e-05, 'batch_size': 1628, 'optimizer': 'Adam'}.
2026-05-23 05:49:39,032 - experiment_functions - INFO - Early stopping at epoch 1550. Best Metrics: (0.07780075875008845, 0.03926229508196721, 0.06598655884438932)
2026-05-23 05:49:39,119 - optuna.study.study - INFO - Trial 234 finished with values: [0.07780075875008845, 0.03926229508196721, 0.06598655884438932] and parameters: {'n_layers': 2, 'embedding_dim': 96, 'lr': 0.0003614258129820434, 'lambda_val': 0.0016208673244223802, 'batch_size': 1628, 'optimizer': 'Adam'}.
2026-05-23 05:49:41,504 - experiment_functions - INFO - Early stopping at epoch 550. Best Metrics: (0.09276072637628718, 0.04786885245901639, 0.08453904249084686)
2026-05-23 05:49:41,822 - optuna.study.study - INFO - Trial 235 finished with values: [0.09276072637628718, 0.04786885245901639, 0.08453904249084686] and parameters: {'n_layers': 1, 'embedding_dim': 64, 'lr': 0.00889050274911736, 'lambda_val': 0.0001780270767671239, 'batch_size': 1631, 'optimizer': 'Adam'}.
2026-05-23 05:49:44,809 - experiment_functions - INFO - Early stopping at epoch 650. Best Metrics: (0.08605962551648709, 0.04598360655737705, 0.07737899882027084)
2026-05-23 05:49:45,653 - optuna.study.study - INFO - Trial 236 finished with values: [0.08605962551648709, 0.04598360655737705, 0.07737899882027084] and parameters: {'n_layers': 1, 'embedding_dim': 128, 'lr': 0.0015423586705359572, 'lambda_val': 6.19406847114503e-05, 'batch_size': 1321, 'optimizer': 'RMSprop'}.
2026-05-23 05:49:58,487 - optuna.study.study - INFO - Trial 237 finished with values: [0.10630105330078372, 0.0539344262295082, 0.08483161344032751] and parameters: {'n_layers': 1, 'embedding_dim': 128, 'lr': 0.000360608106860257, 'lambda_val': 1.8188478145428612e-06, 'batch_size': 1321, 'optimizer': 'RMSprop'}.
2026-05-23 05:50:05,544 - experiment_functions - INFO - Early stopping at epoch 650. Best Metrics: (0.07192507558232619, 0.041475409836065576, 0.06335408889896045)
2026-05-23 05:50:06,019 - optuna.study.study - INFO - Trial 238 finished with values: [0.07192507558232619, 0.041475409836065576, 0.06335408889896045] and parameters: {'n_layers': 1, 'embedding_dim': 96, 'lr': 0.001288815314225091, 'lambda_val': 0.020679334364233817, 'batch_size': 3638, 'optimizer': 'Adam'}.
2026-05-23 05:50:13,870 - experiment_functions - INFO - Early stopping at epoch 550. Best Metrics: (0.04314161825494633, 0.020081967213114754, 0.03375630444934735)
2026-05-23 05:50:14,467 - optuna.study.study - INFO - Trial 239 finished with values: [0.04314161825494633, 0.020081967213114754, 0.03375630444934735] and parameters: {'n_layers': 1, 'embedding_dim': 32, 'lr': 0.009775285747671312, 'lambda_val': 0.0005805183270689483, 'batch_size': 2591, 'optimizer': 'RMSprop'}.
2026-05-23 05:50:22,963 - experiment_functions - INFO - Early stopping at epoch 2550. Best Metrics: (0.11223284346253527, 0.05598360655737706, 0.09837266666696937)
2026-05-23 05:50:23,543 - optuna.study.study - INFO - Trial 240 finished with values: [0.11223284346253527, 0.05598360655737706, 0.09837266666696937] and parameters: {'n_layers': 1, 'embedding_dim': 128, 'lr': 0.000360608106860257, 'lambda_val': 6.19406847114503e-05, 'batch_size': 1321, 'optimizer': 'RMSprop'}.
2026-05-23 05:50:33,320 - experiment_functions - INFO - Early stopping at epoch 2750. Best Metrics: (0.10223791472640235, 0.05098360655737705, 0.08453670016110072)
2026-05-23 05:50:33,964 - optuna.study.study - INFO - Trial 241 finished with values: [0.10223791472640235, 0.05098360655737705, 0.08453670016110072] and parameters: {'n_layers': 1, 'embedding_dim': 128, 'lr': 0.000360608106860257, 'lambda_val': 1.7408384781052897e-06, 'batch_size': 2590, 'optimizer': 'RMSprop'}.
2026-05-23 05:50:38,711 - experiment_functions - INFO - Early stopping at epoch 1250. Best Metrics: (0.057176169265955715, 0.028688524590163935, 0.046517864031877)
2026-05-23 05:50:38,856 - optuna.study.study - INFO - Trial 242 finished with values: [0.057176169265955715, 0.028688524590163935, 0.046517864031877] and parameters: {'n_layers': 1, 'embedding_dim': 128, 'lr': 0.004748827105127406, 'lambda_val': 0.00016785947403210068, 'batch_size': 1321, 'optimizer': 'RMSprop'}.
2026-05-23 05:50:41,400 - experiment_functions - INFO - Early stopping at epoch 550. Best Metrics: (0.10054367034222564, 0.05098360655737705, 0.0840869736493644)
2026-05-23 05:50:41,489 - optuna.study.study - INFO - Trial 243 finished with values: [0.10054367034222564, 0.05098360655737705, 0.0840869736493644] and parameters: {'n_layers': 1, 'embedding_dim': 128, 'lr': 0.006312777493233292, 'lambda_val': 3.419556065869318e-05, 'batch_size': 2974, 'optimizer': 'Adam'}.
2026-05-23 05:50:43,897 - experiment_functions - INFO - Early stopping at epoch 550. Best Metrics: (0.05542580244067399, 0.027950819672131148, 0.04572938355617864)
2026-05-23 05:50:44,022 - optuna.study.study - INFO - Trial 244 finished with values: [0.05542580244067399, 0.027950819672131148, 0.04572938355617864] and parameters: {'n_layers': 1, 'embedding_dim': 128, 'lr': 0.0173957430350459, 'lambda_val': 1.7408384781052897e-06, 'batch_size': 1976, 'optimizer': 'Adam'}.
2026-05-23 05:50:46,279 - experiment_functions - INFO - Early stopping at epoch 550. Best Metrics: (0.08926271681075913, 0.04836065573770492, 0.07625459824596714)
2026-05-23 05:50:46,367 - optuna.study.study - INFO - Trial 245 finished with values: [0.08926271681075913, 0.04836065573770492, 0.07625459824596714] and parameters: {'n_layers': 1, 'embedding_dim': 96, 'lr': 0.006312777493233292, 'lambda_val': 0.002389697052100668, 'batch_size': 2934, 'optimizer': 'Adam'}.
2026-05-23 05:50:49,731 - experiment_functions - INFO - Early stopping at epoch 1100. Best Metrics: (0.09636887532013508, 0.04795081967213115, 0.07816592660126517)
2026-05-23 05:50:50,187 - optuna.study.study - INFO - Trial 246 finished with values: [0.09636887532013508, 0.04795081967213115, 0.07816592660126517] and parameters: {'n_layers': 1, 'embedding_dim': 32, 'lr': 0.001288815314225091, 'lambda_val': 0.0005805183270689483, 'batch_size': 2591, 'optimizer': 'Adam'}.
2026-05-23 05:50:52,633 - experiment_functions - INFO - Early stopping at epoch 600. Best Metrics: (0.090723618197898, 0.04598360655737705, 0.07889655256394282)
2026-05-23 05:50:52,730 - optuna.study.study - INFO - Trial 247 finished with values: [0.090723618197898, 0.04598360655737705, 0.07889655256394282] and parameters: {'n_layers': 1, 'embedding_dim': 128, 'lr': 0.004748827105127406, 'lambda_val': 1.7408384781052897e-06, 'batch_size': 1321, 'optimizer': 'Adam'}.
2026-05-23 05:50:55,221 - experiment_functions - INFO - Early stopping at epoch 650. Best Metrics: (0.07494350261731572, 0.04344262295081967, 0.06709533800287397)
2026-05-23 05:50:55,375 - optuna.study.study - INFO - Trial 248 finished with values: [0.07494350261731572, 0.04344262295081967, 0.06709533800287397] and parameters: {'n_layers': 1, 'embedding_dim': 32, 'lr': 0.0026271984480321668, 'lambda_val': 0.0016872549049523802, 'batch_size': 2591, 'optimizer': 'Adam'}.
2026-05-23 05:50:58,007 - experiment_functions - INFO - Early stopping at epoch 650. Best Metrics: (0.0880110963850079, 0.04434426229508197, 0.07428104888134004)
2026-05-23 05:50:58,095 - optuna.study.study - INFO - Trial 249 finished with values: [0.0880110963850079, 0.04434426229508197, 0.07428104888134004] and parameters: {'n_layers': 1, 'embedding_dim': 32, 'lr': 0.0026271984480321668, 'lambda_val': 0.00016785947403210068, 'batch_size': 1844, 'optimizer': 'Adam'}.
2026-05-23 05:51:03,589 - experiment_functions - INFO - Early stopping at epoch 1400. Best Metrics: (0.10316873325459414, 0.05426229508196721, 0.08845069258111059)
2026-05-23 05:51:04,195 - optuna.study.study - INFO - Trial 250 finished with values: [0.10316873325459414, 0.05426229508196721, 0.08845069258111059] and parameters: {'n_layers': 1, 'embedding_dim': 128, 'lr': 0.000360608106860257, 'lambda_val': 1.7408384781052897e-06, 'batch_size': 2590, 'optimizer': 'RMSprop'}.
2026-05-23 05:51:07,757 - experiment_functions - INFO - Early stopping at epoch 850. Best Metrics: (0.10360699612166124, 0.051147540983606556, 0.09002813505742255)
2026-05-23 05:51:08,849 - optuna.study.study - INFO - Trial 251 finished with values: [0.10360699612166124, 0.051147540983606556, 0.09002813505742255] and parameters: {'n_layers': 1, 'embedding_dim': 64, 'lr': 0.001288815314225091, 'lambda_val': 1.7408384781052897e-06, 'batch_size': 2591, 'optimizer': 'Adam'}.
2026-05-23 05:51:22,418 - optuna.study.study - INFO - Trial 252 finished with values: [0.11972153820368568, 0.05713114754098361, 0.10239912457003046] and parameters: {'n_layers': 1, 'embedding_dim': 128, 'lr': 0.000360608106860257, 'lambda_val': 1.8188478145428612e-06, 'batch_size': 1321, 'optimizer': 'Adam'}.
2026-05-23 05:51:28,764 - experiment_functions - INFO - Early stopping at epoch 1750. Best Metrics: (0.12799200054682183, 0.060000000000000005, 0.10391484571110295)
2026-05-23 05:51:28,842 - optuna.study.study - INFO - Trial 253 finished with values: [0.12799200054682183, 0.060000000000000005, 0.10391484571110295] and parameters: {'n_layers': 1, 'embedding_dim': 128, 'lr': 0.000360608106860257, 'lambda_val': 0.00016785947403210068, 'batch_size': 1976, 'optimizer': 'RMSprop'}.
2026-05-23 05:51:34,763 - experiment_functions - INFO - Early stopping at epoch 1750. Best Metrics: (0.003742550773606161, 0.0018032786885245904, 0.0026207666829035094)
2026-05-23 05:51:34,944 - optuna.study.study - INFO - Trial 254 finished with values: [0.003742550773606161, 0.0018032786885245904, 0.0026207666829035094] and parameters: {'n_layers': 1, 'embedding_dim': 128, 'lr': 1.6416431902729794e-05, 'lambda_val': 0.00013338361174833875, 'batch_size': 745, 'optimizer': 'Adam'}.
2026-05-23 05:51:38,171 - experiment_functions - INFO - Early stopping at epoch 550. Best Metrics: (0.034819262047061504, 0.01680327868852459, 0.026063726709178944)
2026-05-23 05:51:38,399 - optuna.study.study - INFO - Trial 255 finished with values: [0.034819262047061504, 0.01680327868852459, 0.026063726709178944] and parameters: {'n_layers': 3, 'embedding_dim': 128, 'lr': 0.004748827105127406, 'lambda_val': 1.7408384781052897e-06, 'batch_size': 2590, 'optimizer': 'RMSprop'}.
2026-05-23 05:51:46,544 - experiment_functions - INFO - Early stopping at epoch 2150. Best Metrics: (0.11349060724535688, 0.05434426229508196, 0.09528186557650102)
2026-05-23 05:51:46,624 - optuna.study.study - INFO - Trial 256 finished with values: [0.11349060724535688, 0.05434426229508196, 0.09528186557650102] and parameters: {'n_layers': 1, 'embedding_dim': 128, 'lr': 0.0003614258129820434, 'lambda_val': 6.19406847114503e-05, 'batch_size': 3024, 'optimizer': 'Adam'}.
2026-05-23 05:51:53,015 - experiment_functions - INFO - Early stopping at epoch 1800. Best Metrics: (0.10141406981272105, 0.054016393442622955, 0.08560895899540688)
2026-05-23 05:51:53,103 - optuna.study.study - INFO - Trial 257 finished with values: [0.10141406981272105, 0.054016393442622955, 0.08560895899540688] and parameters: {'n_layers': 1, 'embedding_dim': 128, 'lr': 0.0003614258129820434, 'lambda_val': 1.7408384781052897e-06, 'batch_size': 2283, 'optimizer': 'RMSprop'}.
2026-05-23 05:52:01,826 - experiment_functions - INFO - Early stopping at epoch 2500. Best Metrics: (0.12166952161129663, 0.05778688524590164, 0.1025161748102917)
2026-05-23 05:52:02,157 - optuna.study.study - INFO - Trial 258 finished with values: [0.12166952161129663, 0.05778688524590164, 0.1025161748102917] and parameters: {'n_layers': 1, 'embedding_dim': 128, 'lr': 0.000360608106860257, 'lambda_val': 6.19406847114503e-05, 'batch_size': 1976, 'optimizer': 'Adam'}.
2026-05-23 05:52:04,973 - experiment_functions - INFO - Early stopping at epoch 650. Best Metrics: (0.10854695708703849, 0.0521311475409836, 0.0906498150849629)
2026-05-23 05:52:05,054 - optuna.study.study - INFO - Trial 259 finished with values: [0.10854695708703849, 0.0521311475409836, 0.0906498150849629] and parameters: {'n_layers': 1, 'embedding_dim': 32, 'lr': 0.0026271984480321668, 'lambda_val': 0.0016872549049523802, 'batch_size': 1794, 'optimizer': 'Adam'}.
2026-05-23 05:52:07,586 - experiment_functions - INFO - Early stopping at epoch 550. Best Metrics: (0.10784232102674524, 0.052786885245901645, 0.09240214094048238)
2026-05-23 05:52:07,675 - optuna.study.study - INFO - Trial 260 finished with values: [0.10784232102674524, 0.052786885245901645, 0.09240214094048238] and parameters: {'n_layers': 1, 'embedding_dim': 64, 'lr': 0.00889050274911736, 'lambda_val': 1.7408384781052897e-06, 'batch_size': 1631, 'optimizer': 'Adam'}.
2026-05-23 05:52:10,081 - experiment_functions - INFO - Early stopping at epoch 550. Best Metrics: (0.03504828477090848, 0.01795081967213115, 0.027618597151862993)
2026-05-23 05:52:10,197 - optuna.study.study - INFO - Trial 261 finished with values: [0.03504828477090848, 0.01795081967213115, 0.027618597151862993] and parameters: {'n_layers': 1, 'embedding_dim': 32, 'lr': 0.05063500223983108, 'lambda_val': 1.916622569179001e-06, 'batch_size': 568, 'optimizer': 'Adam'}.
2026-05-23 05:52:23,606 - optuna.study.study - INFO - Trial 262 finished with values: [0.08975538600085303, 0.048032786885245905, 0.07923875624619364] and parameters: {'n_layers': 1, 'embedding_dim': 128, 'lr': 0.0002989172315835839, 'lambda_val': 1.9980730180115724e-05, 'batch_size': 568, 'optimizer': 'Adam'}.
2026-05-23 05:52:26,361 - experiment_functions - INFO - Early stopping at epoch 650. Best Metrics: (0.0920070572823571, 0.046557377049180323, 0.07793433236310413)
2026-05-23 05:52:26,459 - optuna.study.study - INFO - Trial 263 finished with values: [0.0920070572823571, 0.046557377049180323, 0.07793433236310413] and parameters: {'n_layers': 1, 'embedding_dim': 32, 'lr': 0.0026271984480321668, 'lambda_val': 0.0016208673244223802, 'batch_size': 1342, 'optimizer': 'Adam'}.
2026-05-23 05:52:28,783 - experiment_functions - INFO - Early stopping at epoch 550. Best Metrics: (0.09555368729709098, 0.04729508196721311, 0.08144936769108058)
2026-05-23 05:52:28,863 - optuna.study.study - INFO - Trial 264 finished with values: [0.09555368729709098, 0.04729508196721311, 0.08144936769108058] and parameters: {'n_layers': 1, 'embedding_dim': 32, 'lr': 0.008640760792826645, 'lambda_val': 0.0005387179014417885, 'batch_size': 838, 'optimizer': 'Adam'}.
2026-05-23 05:52:41,414 - experiment_functions - INFO - Early stopping at epoch 3700. Best Metrics: (0.10580141135643038, 0.05442622950819673, 0.08928718188674371)
2026-05-23 05:52:41,687 - optuna.study.study - INFO - Trial 265 finished with values: [0.10580141135643038, 0.05442622950819673, 0.08928718188674371] and parameters: {'n_layers': 1, 'embedding_dim': 96, 'lr': 0.0003614258129820434, 'lambda_val': 0.00013338361174833875, 'batch_size': 1976, 'optimizer': 'Adam'}.
2026-05-23 05:52:51,432 - experiment_functions - INFO - Early stopping at epoch 2600. Best Metrics: (0.07174643880620019, 0.04081967213114754, 0.0631738979472884)
2026-05-23 05:52:51,748 - optuna.study.study - INFO - Trial 266 finished with values: [0.07174643880620019, 0.04081967213114754, 0.0631738979472884] and parameters: {'n_layers': 3, 'embedding_dim': 32, 'lr': 0.000360608106860257, 'lambda_val': 0.00016785947403210068, 'batch_size': 747, 'optimizer': 'RMSprop'}.
