2026-05-23 02:32:28,219 - optuna.study.study - INFO - Trial 4 finished with values: [0.03297225554822089, 0.015901639344262294, 0.027120465362638606] and parameters: {'n_layers': 2, 'embedding_dim': 128, 'lr': 0.015248903119772129, 'lambda_val': 0.0003664364618235428, 'batch_size': 3543, 'optimizer': 'Adam'}.
2026-05-23 02:32:31,265 - experiment_functions - INFO - Early stopping at epoch 500. Best Metrics: (0.0019929900667176744, 0.0018852459016393446, 0.0023288058755719754)
2026-05-23 02:32:31,815 - optuna.study.study - INFO - Trial 5 finished with values: [0.0019929900667176744, 0.0018852459016393446, 0.0023288058755719754] and parameters: {'n_layers': 3, 'embedding_dim': 128, 'lr': 0.00033455032227028644, 'lambda_val': 6.117271014584931e-05, 'batch_size': 1394, 'optimizer': 'SGD'}.
2026-05-23 02:32:49,569 - optuna.study.study - INFO - Trial 6 finished with values: [0.029747880395527542, 0.020163934426229508, 0.029001439967895424] and parameters: {'n_layers': 3, 'embedding_dim': 96, 'lr': 9.051379658933054e-05, 'lambda_val': 4.7882296112713654e-05, 'batch_size': 2882, 'optimizer': 'RMSprop'}.
2026-05-23 02:32:51,858 - experiment_functions - INFO - Early stopping at epoch 500. Best Metrics: (0.0018133260602244303, 0.0013934426229508198, 0.001981084990319112)
2026-05-23 02:32:51,948 - optuna.study.study - INFO - Trial 7 finished with values: [0.0018133260602244303, 0.0013934426229508198, 0.001981084990319112] and parameters: {'n_layers': 1, 'embedding_dim': 32, 'lr': 1.3128392098375758e-05, 'lambda_val': 0.005328250063351955, 'batch_size': 3678, 'optimizer': 'SGD'}.
2026-05-23 02:32:54,495 - experiment_functions - INFO - Early stopping at epoch 500. Best Metrics: (0.0014725722948137876, 0.001639344262295082, 0.0017436631674195354)
2026-05-23 02:32:54,575 - optuna.study.study - INFO - Trial 8 finished with values: [0.0014725722948137876, 0.001639344262295082, 0.0017436631674195354] and parameters: {'n_layers': 2, 'embedding_dim': 64, 'lr': 0.0005838890493565157, 'lambda_val': 6.501058820242015e-05, 'batch_size': 3412, 'optimizer': 'SGD'}.
2026-05-23 02:33:15,541 - optuna.study.study - INFO - Trial 9 finished with values: [0.006121753700573489, 0.005081967213114754, 0.006311794306194123] and parameters: {'n_layers': 2, 'embedding_dim': 256, 'lr': 3.355161728681744e-05, 'lambda_val': 0.007352147641655774, 'batch_size': 2773, 'optimizer': 'RMSprop'}.
2026-05-23 02:33:18,597 - experiment_functions - INFO - Early stopping at epoch 750. Best Metrics: (0.05336647146754608, 0.03180327868852459, 0.049412578835714815)
2026-05-23 02:33:19,547 - optuna.study.study - INFO - Trial 10 finished with values: [0.05336647146754608, 0.03180327868852459, 0.049412578835714815] and parameters: {'n_layers': 1, 'embedding_dim': 32, 'lr': 0.0036479636125195114, 'lambda_val': 2.2233828874401383e-06, 'batch_size': 745, 'optimizer': 'RMSprop'}.
2026-05-23 02:33:22,418 - experiment_functions - INFO - Early stopping at epoch 500. Best Metrics: (0.0018854577413990668, 0.0013934426229508198, 0.00153271840962132)
2026-05-23 02:33:22,535 - optuna.study.study - INFO - Trial 11 finished with values: [0.0018854577413990668, 0.0013934426229508198, 0.00153271840962132] and parameters: {'n_layers': 4, 'embedding_dim': 64, 'lr': 0.00399270774969022, 'lambda_val': 0.0029058433736546202, 'batch_size': 880, 'optimizer': 'SGD'}.
2026-05-23 02:33:26,063 - experiment_functions - INFO - Early stopping at epoch 650. Best Metrics: (0.03555391414386711, 0.02401639344262295, 0.032139479080899244)
2026-05-23 02:33:26,279 - optuna.study.study - INFO - Trial 12 finished with values: [0.03555391414386711, 0.02401639344262295, 0.032139479080899244] and parameters: {'n_layers': 2, 'embedding_dim': 128, 'lr': 0.001459413805808463, 'lambda_val': 0.0009810927157913494, 'batch_size': 3144, 'optimizer': 'RMSprop'}.
2026-05-23 02:33:29,586 - experiment_functions - INFO - Early stopping at epoch 650. Best Metrics: (0.029097219328795852, 0.02065573770491803, 0.029972490122261167)
2026-05-23 02:33:29,658 - optuna.study.study - INFO - Trial 13 finished with values: [0.029097219328795852, 0.02065573770491803, 0.029972490122261167] and parameters: {'n_layers': 3, 'embedding_dim': 64, 'lr': 0.002461940751629359, 'lambda_val': 0.0035064867017704023, 'batch_size': 1571, 'optimizer': 'Adam'}.
2026-05-23 02:33:42,398 - experiment_functions - INFO - Early stopping at epoch 2500. Best Metrics: (0.01684398584167348, 0.014262295081967212, 0.01916455217538656)
2026-05-23 02:33:42,487 - optuna.study.study - INFO - Trial 14 finished with values: [0.01684398584167348, 0.014262295081967212, 0.01916455217538656] and parameters: {'n_layers': 2, 'embedding_dim': 256, 'lr': 0.05689630640582892, 'lambda_val': 0.048251117754060005, 'batch_size': 2936, 'optimizer': 'RMSprop'}.
2026-05-23 02:33:45,246 - experiment_functions - INFO - Early stopping at epoch 500. Best Metrics: (0.002008452383395807, 0.0017213114754098362, 0.0023035509274778204)
2026-05-23 02:33:45,347 - optuna.study.study - INFO - Trial 15 finished with values: [0.002008452383395807, 0.0017213114754098362, 0.0023035509274778204] and parameters: {'n_layers': 3, 'embedding_dim': 96, 'lr': 6.0737425693933e-05, 'lambda_val': 1.3552076648068048e-05, 'batch_size': 1629, 'optimizer': 'SGD'}.
2026-05-23 02:33:49,972 - experiment_functions - INFO - Early stopping at epoch 600. Best Metrics: (0.024532435938812783, 0.011065573770491803, 0.019511736087030888)
2026-05-23 02:33:50,404 - optuna.study.study - INFO - Trial 16 finished with values: [0.024532435938812783, 0.011065573770491803, 0.019511736087030888] and parameters: {'n_layers': 2, 'embedding_dim': 256, 'lr': 0.02107335765652346, 'lambda_val': 2.9502979801246835e-06, 'batch_size': 1462, 'optimizer': 'Adam'}.
2026-05-23 02:33:53,342 - experiment_functions - INFO - Early stopping at epoch 550. Best Metrics: (0.06036551454596698, 0.039098360655737706, 0.0587058315337349)
2026-05-23 02:33:53,441 - optuna.study.study - INFO - Trial 17 finished with values: [0.06036551454596698, 0.039098360655737706, 0.0587058315337349] and parameters: {'n_layers': 1, 'embedding_dim': 256, 'lr': 0.00466372845018428, 'lambda_val': 2.1146074643297403e-05, 'batch_size': 1269, 'optimizer': 'Adam'}.
2026-05-23 02:33:56,052 - experiment_functions - INFO - Early stopping at epoch 550. Best Metrics: (0.05481057582178001, 0.03885245901639344, 0.05565330941819588)
2026-05-23 02:33:56,151 - optuna.study.study - INFO - Trial 18 finished with values: [0.05481057582178001, 0.03885245901639344, 0.05565330941819588] and parameters: {'n_layers': 1, 'embedding_dim': 128, 'lr': 0.0056420762452804776, 'lambda_val': 7.156905198005013e-05, 'batch_size': 1651, 'optimizer': 'Adam'}.
2026-05-23 02:34:00,268 - experiment_functions - INFO - Early stopping at epoch 1050. Best Metrics: (0.03160020533017979, 0.01762295081967213, 0.028281615074872608)
2026-05-23 02:34:00,361 - optuna.study.study - INFO - Trial 19 finished with values: [0.03160020533017979, 0.01762295081967213, 0.028281615074872608] and parameters: {'n_layers': 1, 'embedding_dim': 96, 'lr': 0.028994770422090605, 'lambda_val': 2.7732924006039397e-06, 'batch_size': 3964, 'optimizer': 'Adam'}.
2026-05-23 02:34:09,210 - experiment_functions - INFO - Early stopping at epoch 2150. Best Metrics: (0.02208460352521152, 0.02, 0.02627101013135197)
2026-05-23 02:34:09,402 - optuna.study.study - INFO - Trial 20 finished with values: [0.02208460352521152, 0.02, 0.02627101013135197] and parameters: {'n_layers': 2, 'embedding_dim': 96, 'lr': 0.013407249308971856, 'lambda_val': 0.015180930077175619, 'batch_size': 3577, 'optimizer': 'Adam'}.
2026-05-23 02:34:17,237 - experiment_functions - INFO - Early stopping at epoch 2100. Best Metrics: (0.010260191511159944, 0.011065573770491803, 0.01393752692952341)
2026-05-23 02:34:17,338 - optuna.study.study - INFO - Trial 21 finished with values: [0.010260191511159944, 0.011065573770491803, 0.01393752692952341] and parameters: {'n_layers': 3, 'embedding_dim': 32, 'lr': 0.00792179159300908, 'lambda_val': 0.0824360910298542, 'batch_size': 1534, 'optimizer': 'RMSprop'}.
2026-05-23 02:34:19,938 - experiment_functions - INFO - Early stopping at epoch 550. Best Metrics: (0.026885829187693413, 0.016639344262295082, 0.025032621858246274)
2026-05-23 02:34:20,044 - optuna.study.study - INFO - Trial 22 finished with values: [0.026885829187693413, 0.016639344262295082, 0.025032621858246274] and parameters: {'n_layers': 2, 'embedding_dim': 64, 'lr': 0.013832663687407772, 'lambda_val': 0.00010574161158144353, 'batch_size': 1091, 'optimizer': 'Adam'}.
2026-05-23 02:34:30,447 - experiment_functions - INFO - Early stopping at epoch 3500. Best Metrics: (0.06587949721455535, 0.043852459016393446, 0.0613734530286212)
2026-05-23 02:34:30,682 - optuna.study.study - INFO - Trial 23 finished with values: [0.06587949721455535, 0.043852459016393446, 0.0613734530286212] and parameters: {'n_layers': 1, 'embedding_dim': 64, 'lr': 0.0002738093623313198, 'lambda_val': 0.0027428171281445477, 'batch_size': 1222, 'optimizer': 'Adam'}.
2026-05-23 02:34:46,490 - experiment_functions - INFO - Early stopping at epoch 3700. Best Metrics: (0.02864417589635695, 0.022786885245901636, 0.028736206556883723)
2026-05-23 02:34:46,684 - optuna.study.study - INFO - Trial 24 finished with values: [0.02864417589635695, 0.022786885245901636, 0.028736206556883723] and parameters: {'n_layers': 4, 'embedding_dim': 32, 'lr': 0.00019324235493803607, 'lambda_val': 8.60783053151504e-05, 'batch_size': 2109, 'optimizer': 'Adam'}.
2026-05-23 02:34:49,398 - experiment_functions - INFO - Early stopping at epoch 600. Best Metrics: (0.05218655900091097, 0.03344262295081967, 0.05132435114518281)
2026-05-23 02:34:49,483 - optuna.study.study - INFO - Trial 25 finished with values: [0.05218655900091097, 0.03344262295081967, 0.05132435114518281] and parameters: {'n_layers': 1, 'embedding_dim': 128, 'lr': 0.004434110743664845, 'lambda_val': 0.00023185127305384867, 'batch_size': 808, 'optimizer': 'Adam'}.
2026-05-23 02:35:01,944 - experiment_functions - INFO - Early stopping at epoch 1700. Best Metrics: (0.01967119788933092, 0.015655737704918033, 0.02152859097823148)
2026-05-23 02:35:02,900 - optuna.study.study - INFO - Trial 26 finished with values: [0.01967119788933092, 0.015655737704918033, 0.02152859097823148] and parameters: {'n_layers': 3, 'embedding_dim': 96, 'lr': 0.0021850542723936923, 'lambda_val': 0.006439135351806826, 'batch_size': 1518, 'optimizer': 'RMSprop'}.
2026-05-23 02:35:11,349 - experiment_functions - INFO - Early stopping at epoch 750. Best Metrics: (0.01592952100497623, 0.009016393442622951, 0.013776321434971863)
2026-05-23 02:35:11,535 - optuna.study.study - INFO - Trial 27 finished with values: [0.01592952100497623, 0.009016393442622951, 0.013776321434971863] and parameters: {'n_layers': 4, 'embedding_dim': 256, 'lr': 0.006050830378634505, 'lambda_val': 0.00046559903847207706, 'batch_size': 1776, 'optimizer': 'Adam'}.
2026-05-23 02:35:14,784 - experiment_functions - INFO - Early stopping at epoch 750. Best Metrics: (0.03732790885976479, 0.026393442622950822, 0.04185930723346785)
2026-05-23 02:35:14,871 - optuna.study.study - INFO - Trial 28 finished with values: [0.03732790885976479, 0.026393442622950822, 0.04185930723346785] and parameters: {'n_layers': 2, 'embedding_dim': 64, 'lr': 0.0016700189374904077, 'lambda_val': 0.008198149930508243, 'batch_size': 584, 'optimizer': 'Adam'}.
2026-05-23 02:35:28,013 - optuna.study.study - INFO - Trial 29 finished with values: [0.0037072557824742126, 0.004344262295081968, 0.005208883397543923] and parameters: {'n_layers': 2, 'embedding_dim': 32, 'lr': 4.89090010072628e-05, 'lambda_val': 7.0199808561721e-05, 'batch_size': 1768, 'optimizer': 'RMSprop'}.
2026-05-23 02:35:30,705 - experiment_functions - INFO - Early stopping at epoch 500. Best Metrics: (0.003152552656664456, 0.002131147540983607, 0.0028880957900849916)
2026-05-23 02:35:30,791 - optuna.study.study - INFO - Trial 30 finished with values: [0.003152552656664456, 0.002131147540983607, 0.0028880957900849916] and parameters: {'n_layers': 2, 'embedding_dim': 96, 'lr': 0.00015524200313215037, 'lambda_val': 0.0005078800969532651, 'batch_size': 4063, 'optimizer': 'SGD'}.
2026-05-23 02:35:33,385 - experiment_functions - INFO - Early stopping at epoch 500. Best Metrics: (0.00179446639618239, 0.001967213114754099, 0.002716554160543259)
2026-05-23 02:35:34,625 - optuna.study.study - INFO - Trial 31 finished with values: [0.00179446639618239, 0.001967213114754099, 0.002716554160543259] and parameters: {'n_layers': 2, 'embedding_dim': 32, 'lr': 2.3992179183514827e-05, 'lambda_val': 1.8374670296062184e-06, 'batch_size': 1399, 'optimizer': 'RMSprop'}.
2026-05-23 02:35:43,011 - experiment_functions - INFO - Early stopping at epoch 1900. Best Metrics: (0.019153437218172014, 0.013606557377049182, 0.018693099868046216)
2026-05-23 02:35:43,864 - optuna.study.study - INFO - Trial 32 finished with values: [0.019153437218172014, 0.013606557377049182, 0.018693099868046216] and parameters: {'n_layers': 3, 'embedding_dim': 96, 'lr': 0.019000542348847693, 'lambda_val': 0.004254562856567521, 'batch_size': 997, 'optimizer': 'Adam'}.
2026-05-23 02:35:46,614 - experiment_functions - INFO - Early stopping at epoch 500. Best Metrics: (0.0014635624971757687, 0.0010655737704918036, 0.0014040727979794461)
2026-05-23 02:35:46,697 - optuna.study.study - INFO - Trial 33 finished with values: [0.0014635624971757687, 0.0010655737704918036, 0.0014040727979794461] and parameters: {'n_layers': 4, 'embedding_dim': 32, 'lr': 0.00011109967366256883, 'lambda_val': 0.0004300955613715492, 'batch_size': 1320, 'optimizer': 'SGD'}.
2026-05-23 02:36:04,562 - experiment_functions - INFO - Early stopping at epoch 2900. Best Metrics: (0.03754375059235631, 0.027213114754098364, 0.037771566827573065)
2026-05-23 02:36:04,639 - optuna.study.study - INFO - Trial 34 finished with values: [0.03754375059235631, 0.027213114754098364, 0.037771566827573065] and parameters: {'n_layers': 3, 'embedding_dim': 256, 'lr': 0.00015087698888573533, 'lambda_val': 2.03435521078093e-06, 'batch_size': 4005, 'optimizer': 'Adam'}.
2026-05-23 02:36:08,375 - experiment_functions - INFO - Early stopping at epoch 500. Best Metrics: (0.001428304720300144, 0.0009836065573770494, 0.0014207808908295431)
2026-05-23 02:36:08,967 - optuna.study.study - INFO - Trial 35 finished with values: [0.001428304720300144, 0.0009836065573770494, 0.0014207808908295431] and parameters: {'n_layers': 1, 'embedding_dim': 256, 'lr': 0.0012125307990976187, 'lambda_val': 1.8937106323873986e-06, 'batch_size': 1160, 'optimizer': 'SGD'}.
2026-05-23 02:36:23,928 - optuna.study.study - INFO - Trial 36 finished with values: [0.04624001764892347, 0.02975409836065574, 0.04261039595223798] and parameters: {'n_layers': 1, 'embedding_dim': 128, 'lr': 0.00011658772604970312, 'lambda_val': 2.2998934295669292e-05, 'batch_size': 3755, 'optimizer': 'Adam'}.
2026-05-23 02:36:27,163 - experiment_functions - INFO - Early stopping at epoch 550. Best Metrics: (0.0021735309958881457, 0.002213114754098361, 0.002891602245884044)
2026-05-23 02:36:27,236 - optuna.study.study - INFO - Trial 37 finished with values: [0.0021735309958881457, 0.002213114754098361, 0.002891602245884044] and parameters: {'n_layers': 2, 'embedding_dim': 256, 'lr': 0.016266514372218804, 'lambda_val': 5.140401727082709e-06, 'batch_size': 1335, 'optimizer': 'SGD'}.
2026-05-23 02:36:33,008 - experiment_functions - INFO - Early stopping at epoch 1700. Best Metrics: (0.06521193495320583, 0.045737704918032786, 0.06790227363403108)
2026-05-23 02:36:33,420 - optuna.study.study - INFO - Trial 38 finished with values: [0.06521193495320583, 0.045737704918032786, 0.06790227363403108] and parameters: {'n_layers': 1, 'embedding_dim': 32, 'lr': 0.0005134970540789423, 'lambda_val': 0.005469691175731185, 'batch_size': 2427, 'optimizer': 'RMSprop'}.
2026-05-23 02:36:36,452 - experiment_functions - INFO - Early stopping at epoch 600. Best Metrics: (0.04081947972420421, 0.027049180327868853, 0.03766434391992665)
2026-05-23 02:36:36,548 - optuna.study.study - INFO - Trial 39 finished with values: [0.04081947972420421, 0.027049180327868853, 0.03766434391992665] and parameters: {'n_layers': 2, 'embedding_dim': 128, 'lr': 0.0013555052564010479, 'lambda_val': 8.689122223949433e-06, 'batch_size': 2701, 'optimizer': 'RMSprop'}.
2026-05-23 02:36:51,124 - experiment_functions - INFO - Early stopping at epoch 3550. Best Metrics: (0.04271007071169569, 0.03114754098360656, 0.04320963417182026)
2026-05-23 02:36:51,238 - optuna.study.study - INFO - Trial 40 finished with values: [0.04271007071169569, 0.03114754098360656, 0.04320963417182026] and parameters: {'n_layers': 2, 'embedding_dim': 128, 'lr': 0.00015616559996727892, 'lambda_val': 0.013489522394415601, 'batch_size': 2637, 'optimizer': 'Adam'}.
2026-05-23 02:36:53,719 - experiment_functions - INFO - Early stopping at epoch 500. Best Metrics: (0.0011698655597161152, 0.001639344262295082, 0.0018051701609249641)
2026-05-23 02:36:53,829 - optuna.study.study - INFO - Trial 41 finished with values: [0.0011698655597161152, 0.001639344262295082, 0.0018051701609249641] and parameters: {'n_layers': 1, 'embedding_dim': 128, 'lr': 8.103949693667584e-05, 'lambda_val': 0.07097027313685479, 'batch_size': 4095, 'optimizer': 'SGD'}.
2026-05-23 02:36:58,051 - experiment_functions - INFO - Early stopping at epoch 650. Best Metrics: (0.015176596644828804, 0.011147540983606558, 0.013628545632869473)
2026-05-23 02:36:58,145 - optuna.study.study - INFO - Trial 42 finished with values: [0.015176596644828804, 0.011147540983606558, 0.013628545632869473] and parameters: {'n_layers': 4, 'embedding_dim': 128, 'lr': 0.0020055160341323525, 'lambda_val': 2.245533809568855e-05, 'batch_size': 3463, 'optimizer': 'RMSprop'}.
2026-05-23 02:37:11,704 - experiment_functions - INFO - Early stopping at epoch 1700. Best Metrics: (0.025082729543762672, 0.021311475409836064, 0.028822553815751474)
2026-05-23 02:37:12,741 - optuna.study.study - INFO - Trial 43 finished with values: [0.025082729543762672, 0.021311475409836064, 0.028822553815751474] and parameters: {'n_layers': 4, 'embedding_dim': 256, 'lr': 0.00014365444793142175, 'lambda_val': 0.016642864973986538, 'batch_size': 652, 'optimizer': 'Adam'}.
2026-05-23 02:37:20,225 - experiment_functions - INFO - Early stopping at epoch 500. Best Metrics: (0.0008196008551589986, 0.001557377049180328, 0.0014170496670924248)
2026-05-23 02:37:21,710 - optuna.study.study - INFO - Trial 44 finished with values: [0.0008196008551589986, 0.001557377049180328, 0.0014170496670924248] and parameters: {'n_layers': 1, 'embedding_dim': 64, 'lr': 0.0001426292843740007, 'lambda_val': 0.0003322502319127277, 'batch_size': 580, 'optimizer': 'SGD'}.
2026-05-23 02:37:28,178 - experiment_functions - INFO - Early stopping at epoch 950. Best Metrics: (0.016090984062031116, 0.006065573770491804, 0.0102507562878644)
2026-05-23 02:37:28,268 - optuna.study.study - INFO - Trial 45 finished with values: [0.016090984062031116, 0.006065573770491804, 0.0102507562878644] and parameters: {'n_layers': 2, 'embedding_dim': 256, 'lr': 0.08650288818953528, 'lambda_val': 1.0486263526014875e-06, 'batch_size': 3877, 'optimizer': 'Adam'}.
2026-05-23 02:37:31,251 - experiment_functions - INFO - Early stopping at epoch 550. Best Metrics: (0.05660441218125379, 0.036147540983606556, 0.054176180048921545)
2026-05-23 02:37:32,002 - optuna.study.study - INFO - Trial 46 finished with values: [0.05660441218125379, 0.036147540983606556, 0.054176180048921545] and parameters: {'n_layers': 1, 'embedding_dim': 256, 'lr': 0.007526325741077799, 'lambda_val': 0.0001408586097439621, 'batch_size': 3771, 'optimizer': 'Adam'}.
2026-05-23 02:37:36,241 - experiment_functions - INFO - Early stopping at epoch 500. Best Metrics: (0.00671934868059019, 0.00319672131147541, 0.006321392156683852)
2026-05-23 02:37:37,140 - optuna.study.study - INFO - Trial 47 finished with values: [0.00671934868059019, 0.00319672131147541, 0.006321392156683852] and parameters: {'n_layers': 4, 'embedding_dim': 256, 'lr': 0.025589592485043958, 'lambda_val': 0.05386437521203161, 'batch_size': 3536, 'optimizer': 'RMSprop'}.
2026-05-23 02:37:44,228 - experiment_functions - INFO - Early stopping at epoch 2300. Best Metrics: (0.002866923070886753, 0.002622950819672131, 0.003073988043181495)
2026-05-23 02:37:44,384 - optuna.study.study - INFO - Trial 48 finished with values: [0.002866923070886753, 0.002622950819672131, 0.003073988043181495] and parameters: {'n_layers': 1, 'embedding_dim': 64, 'lr': 3.8994045320645396e-05, 'lambda_val': 1.3592984867190825e-06, 'batch_size': 2087, 'optimizer': 'Adam'}.
2026-05-23 02:37:47,363 - experiment_functions - INFO - Early stopping at epoch 500. Best Metrics: (0.0038356541306883707, 0.0015573770491803278, 0.0026781743550818348)
2026-05-23 02:37:47,460 - optuna.study.study - INFO - Trial 49 finished with values: [0.0038356541306883707, 0.0015573770491803278, 0.0026781743550818348] and parameters: {'n_layers': 3, 'embedding_dim': 96, 'lr': 0.02479779769698491, 'lambda_val': 0.006647525063630853, 'batch_size': 3974, 'optimizer': 'SGD'}.
2026-05-23 02:37:52,295 - experiment_functions - INFO - Early stopping at epoch 900. Best Metrics: (0.018227866246292735, 0.020081967213114754, 0.023629660014804686)
2026-05-23 02:37:52,941 - optuna.study.study - INFO - Trial 50 finished with values: [0.018227866246292735, 0.020081967213114754, 0.023629660014804686] and parameters: {'n_layers': 4, 'embedding_dim': 32, 'lr': 0.0005134970540789423, 'lambda_val': 0.005469691175731185, 'batch_size': 2229, 'optimizer': 'RMSprop'}.
