2026-05-23 01:36:45,804 - optuna.study.study - INFO - Trial 299 finished with values: [0.029653648765109224, 0.01655737704918033, 0.025010739869503067] and parameters: {'n_layers': 3, 'embedding_dim': 64, 'lr': 0.007900979161458202, 'lambda_val': 0.00012261737938750884, 'batch_size': 1031, 'optimizer': 'Adam'}.
2026-05-23 01:36:45,819 - root - INFO - Selected Trial 285 based on Max NDCG: 0.0363
2026-05-23 01:36:45,819 - root - INFO - Associated Recall: 0.0414
2026-05-23 01:36:45,819 - experiment_functions - INFO - Training the best model ... for e_100K_1c1dcs_strict_rand3
2026-05-23 01:36:50,975 - experiment_functions - INFO - Early stopping at epoch 1900. Best Metrics: (0.031223396170106686, 0.017868852459016392, 0.025335873930109148)
2026-05-23 01:36:51,067 - root - INFO -   **** Training e_100K_1c1dcs_strict_rand4
2026-05-23 01:36:51,070 - root - INFO -   **** Getting 7229/81200 random edges
2026-05-23 01:36:51,921 - optuna.storages._rdb.storage - INFO - A new study created in RDB with name: Study_e_100K_1c1dcs_strict_rand4
2026-05-23 01:36:56,459 - experiment_functions - INFO - Early stopping at epoch 800. Best Metrics: (0.016549883199110958, 0.011229508196721312, 0.015879841398362703)
2026-05-23 01:36:56,550 - optuna.study.study - INFO - Trial 0 finished with values: [0.016549883199110958, 0.011229508196721312, 0.015879841398362703] and parameters: {'n_layers': 1, 'embedding_dim': 96, 'lr': 0.019021824366748853, 'lambda_val': 4.75474570432114e-06, 'batch_size': 3889, 'optimizer': 'RMSprop'}.
2026-05-23 01:37:01,042 - experiment_functions - INFO - Early stopping at epoch 1250. Best Metrics: (0.009532982306435022, 0.006147540983606557, 0.008155192319406352)
2026-05-23 01:37:02,242 - optuna.study.study - INFO - Trial 1 finished with values: [0.009532982306435022, 0.006147540983606557, 0.008155192319406352] and parameters: {'n_layers': 4, 'embedding_dim': 96, 'lr': 0.05607188434869406, 'lambda_val': 0.0012209206673371394, 'batch_size': 1517, 'optimizer': 'RMSprop'}.
2026-05-23 01:37:06,639 - experiment_functions - INFO - Early stopping at epoch 1350. Best Metrics: (0.034023653457197066, 0.018770491803278687, 0.028696668046589772)
2026-05-23 01:37:07,200 - optuna.study.study - INFO - Trial 2 finished with values: [0.034023653457197066, 0.018770491803278687, 0.028696668046589772] and parameters: {'n_layers': 1, 'embedding_dim': 64, 'lr': 0.0013488534539100193, 'lambda_val': 2.2024563054207274e-05, 'batch_size': 733, 'optimizer': 'Adam'}.
2026-05-23 01:37:23,150 - optuna.study.study - INFO - Trial 3 finished with values: [0.005543750070045242, 0.005, 0.005805673307041235] and parameters: {'n_layers': 3, 'embedding_dim': 256, 'lr': 4.141155963074916e-05, 'lambda_val': 0.005777654962393587, 'batch_size': 3081, 'optimizer': 'RMSprop'}.
2026-05-23 01:37:35,365 - optuna.study.study - INFO - Trial 4 finished with values: [0.02674593882285981, 0.013934426229508197, 0.020876639886407575] and parameters: {'n_layers': 3, 'embedding_dim': 32, 'lr': 0.00018537483068886885, 'lambda_val': 1.2922176688378956e-05, 'batch_size': 2912, 'optimizer': 'Adam'}.
2026-05-23 01:37:38,079 - experiment_functions - INFO - Early stopping at epoch 650. Best Metrics: (0.016819432234225225, 0.010327868852459017, 0.015186946116013771)
2026-05-23 01:37:38,174 - optuna.study.study - INFO - Trial 5 finished with values: [0.016819432234225225, 0.010327868852459017, 0.015186946116013771] and parameters: {'n_layers': 3, 'embedding_dim': 128, 'lr': 0.01148659924395743, 'lambda_val': 2.6751762866578596e-06, 'batch_size': 2245, 'optimizer': 'RMSprop'}.
2026-05-23 01:37:42,682 - experiment_functions - INFO - Early stopping at epoch 1300. Best Metrics: (0.0115374330040684, 0.008442622950819673, 0.010744489066915091)
2026-05-23 01:37:42,762 - optuna.study.study - INFO - Trial 6 finished with values: [0.0115374330040684, 0.008442622950819673, 0.010744489066915091] and parameters: {'n_layers': 2, 'embedding_dim': 96, 'lr': 0.032715276127621755, 'lambda_val': 0.005857214055349572, 'batch_size': 3861, 'optimizer': 'Adam'}.
2026-05-23 01:37:48,259 - experiment_functions - INFO - Early stopping at epoch 1900. Best Metrics: (0.002159831240988741, 0.0018852459016393446, 0.002789533436503683)
2026-05-23 01:37:48,607 - optuna.study.study - INFO - Trial 7 finished with values: [0.002159831240988741, 0.0018852459016393446, 0.002789533436503683] and parameters: {'n_layers': 1, 'embedding_dim': 32, 'lr': 1.051930343645746e-05, 'lambda_val': 0.00028698928719198935, 'batch_size': 819, 'optimizer': 'RMSprop'}.
2026-05-23 01:38:00,317 - experiment_functions - INFO - Early stopping at epoch 2950. Best Metrics: (0.02981628906802839, 0.017049180327868854, 0.0271148437086658)
2026-05-23 01:38:00,402 - optuna.study.study - INFO - Trial 8 finished with values: [0.02981628906802839, 0.017049180327868854, 0.0271148437086658] and parameters: {'n_layers': 3, 'embedding_dim': 256, 'lr': 0.000171992203307018, 'lambda_val': 0.0029444127697785846, 'batch_size': 833, 'optimizer': 'Adam'}.
2026-05-23 01:38:03,051 - experiment_functions - INFO - Early stopping at epoch 700. Best Metrics: (0.03237802075434677, 0.017295081967213115, 0.026262061300668927)
2026-05-23 01:38:03,149 - optuna.study.study - INFO - Trial 9 finished with values: [0.03237802075434677, 0.017295081967213115, 0.026262061300668927] and parameters: {'n_layers': 1, 'embedding_dim': 64, 'lr': 0.0014494764650589468, 'lambda_val': 0.0005795183242806687, 'batch_size': 3696, 'optimizer': 'RMSprop'}.
2026-05-23 01:38:05,517 - experiment_functions - INFO - Early stopping at epoch 550. Best Metrics: (0.01771445210292843, 0.013196721311475411, 0.017290932028995842)
2026-05-23 01:38:05,621 - optuna.study.study - INFO - Trial 10 finished with values: [0.01771445210292843, 0.013196721311475411, 0.017290932028995842] and parameters: {'n_layers': 1, 'embedding_dim': 128, 'lr': 0.013012356577675598, 'lambda_val': 0.0004980362717774532, 'batch_size': 2981, 'optimizer': 'Adam'}.
2026-05-23 01:38:09,016 - experiment_functions - INFO - Early stopping at epoch 600. Best Metrics: (0.020660034229143257, 0.01418032786885246, 0.01949282034276124)
2026-05-23 01:38:09,108 - optuna.study.study - INFO - Trial 11 finished with values: [0.020660034229143257, 0.01418032786885246, 0.01949282034276124] and parameters: {'n_layers': 4, 'embedding_dim': 256, 'lr': 0.0015293939939349619, 'lambda_val': 0.0022435114946451214, 'batch_size': 2515, 'optimizer': 'Adam'}.
2026-05-23 01:38:12,330 - experiment_functions - INFO - Early stopping at epoch 900. Best Metrics: (0.014749310073661152, 0.010081967213114754, 0.01427906551552103)
2026-05-23 01:38:12,875 - optuna.study.study - INFO - Trial 12 finished with values: [0.014749310073661152, 0.010081967213114754, 0.01427906551552103] and parameters: {'n_layers': 1, 'embedding_dim': 64, 'lr': 0.034233573938468376, 'lambda_val': 0.03068794925286214, 'batch_size': 3905, 'optimizer': 'Adam'}.
2026-05-23 01:38:15,274 - experiment_functions - INFO - Early stopping at epoch 550. Best Metrics: (0.0024329473117248018, 0.0015573770491803278, 0.002556551972436797)
2026-05-23 01:38:15,363 - optuna.study.study - INFO - Trial 13 finished with values: [0.0024329473117248018, 0.0015573770491803278, 0.002556551972436797] and parameters: {'n_layers': 3, 'embedding_dim': 128, 'lr': 0.047435985291467246, 'lambda_val': 1.1934454252683428e-06, 'batch_size': 884, 'optimizer': 'SGD'}.
2026-05-23 01:38:19,944 - experiment_functions - INFO - Early stopping at epoch 1100. Best Metrics: (0.0036561847242494506, 0.001967213114754099, 0.002955042850276921)
2026-05-23 01:38:20,677 - optuna.study.study - INFO - Trial 14 finished with values: [0.0036561847242494506, 0.001967213114754099, 0.002955042850276921] and parameters: {'n_layers': 2, 'embedding_dim': 256, 'lr': 1.3008210553089148e-05, 'lambda_val': 0.0030779052365341084, 'batch_size': 3067, 'optimizer': 'Adam'}.
2026-05-23 01:38:23,803 - experiment_functions - INFO - Early stopping at epoch 500. Best Metrics: (0.007527992271128473, 0.005573770491803278, 0.008790138044285564)
2026-05-23 01:38:23,899 - optuna.study.study - INFO - Trial 15 finished with values: [0.007527992271128473, 0.005573770491803278, 0.008790138044285564] and parameters: {'n_layers': 4, 'embedding_dim': 256, 'lr': 0.029672800787657647, 'lambda_val': 0.00016867724057381548, 'batch_size': 764, 'optimizer': 'RMSprop'}.
2026-05-23 01:38:28,459 - experiment_functions - INFO - Early stopping at epoch 1100. Best Metrics: (0.010624251330741468, 0.0072131147540983615, 0.009487145224237405)
2026-05-23 01:38:28,650 - optuna.study.study - INFO - Trial 16 finished with values: [0.010624251330741468, 0.0072131147540983615, 0.009487145224237405] and parameters: {'n_layers': 4, 'embedding_dim': 128, 'lr': 0.05646765158331323, 'lambda_val': 0.0007171946214256783, 'batch_size': 3638, 'optimizer': 'Adam'}.
2026-05-23 01:38:31,090 - experiment_functions - INFO - Early stopping at epoch 550. Best Metrics: (0.025728111773284247, 0.014426229508196723, 0.02163512547255181)
2026-05-23 01:38:31,172 - optuna.study.study - INFO - Trial 17 finished with values: [0.025728111773284247, 0.014426229508196723, 0.02163512547255181] and parameters: {'n_layers': 2, 'embedding_dim': 96, 'lr': 0.009455185494500208, 'lambda_val': 1.901210707193677e-05, 'batch_size': 3378, 'optimizer': 'Adam'}.
2026-05-23 01:38:35,319 - experiment_functions - INFO - Early stopping at epoch 1250. Best Metrics: (0.004135508549836394, 0.003770491803278689, 0.005401117332841081)
2026-05-23 01:38:35,434 - optuna.study.study - INFO - Trial 18 finished with values: [0.004135508549836394, 0.003770491803278689, 0.005401117332841081] and parameters: {'n_layers': 3, 'embedding_dim': 32, 'lr': 0.04306895762505192, 'lambda_val': 0.08187317117055098, 'batch_size': 2014, 'optimizer': 'RMSprop'}.
2026-05-23 01:38:44,854 - experiment_functions - INFO - Early stopping at epoch 3250. Best Metrics: (0.004926044563351546, 0.0027049180327868854, 0.005600515827106105)
2026-05-23 01:38:44,965 - optuna.study.study - INFO - Trial 19 finished with values: [0.004926044563351546, 0.0027049180327868854, 0.005600515827106105] and parameters: {'n_layers': 1, 'embedding_dim': 128, 'lr': 4.3246218222629636e-05, 'lambda_val': 7.032468787159558e-05, 'batch_size': 3368, 'optimizer': 'RMSprop'}.
2026-05-23 01:38:53,926 - experiment_functions - INFO - Early stopping at epoch 3100. Best Metrics: (0.001060176020901176, 0.0017213114754098362, 0.0022589481705810946)
2026-05-23 01:38:54,202 - optuna.study.study - INFO - Trial 20 finished with values: [0.001060176020901176, 0.0017213114754098362, 0.0022589481705810946] and parameters: {'n_layers': 3, 'embedding_dim': 32, 'lr': 4.471514627498736e-05, 'lambda_val': 3.072509921788014e-06, 'batch_size': 1116, 'optimizer': 'Adam'}.
2026-05-23 01:38:56,955 - experiment_functions - INFO - Early stopping at epoch 500. Best Metrics: (0.0015356708932320567, 0.0013934426229508198, 0.0020095730874060912)
2026-05-23 01:38:58,296 - optuna.study.study - INFO - Trial 21 finished with values: [0.0015356708932320567, 0.0013934426229508198, 0.0020095730874060912] and parameters: {'n_layers': 4, 'embedding_dim': 128, 'lr': 0.013515272865220413, 'lambda_val': 0.0001904592467569356, 'batch_size': 841, 'optimizer': 'SGD'}.
2026-05-23 01:39:07,943 - experiment_functions - INFO - Early stopping at epoch 3150. Best Metrics: (0.022118489674732882, 0.014098360655737704, 0.020023254595008793)
2026-05-23 01:39:08,022 - optuna.study.study - INFO - Trial 22 finished with values: [0.022118489674732882, 0.014098360655737704, 0.020023254595008793] and parameters: {'n_layers': 3, 'embedding_dim': 96, 'lr': 0.00012667151006330983, 'lambda_val': 0.012826080211321403, 'batch_size': 2068, 'optimizer': 'Adam'}.
2026-05-23 01:39:12,487 - experiment_functions - INFO - Early stopping at epoch 1400. Best Metrics: (0.003071465701845152, 0.002213114754098361, 0.0033719084829276665)
2026-05-23 01:39:12,584 - optuna.study.study - INFO - Trial 23 finished with values: [0.003071465701845152, 0.002213114754098361, 0.0033719084829276665] and parameters: {'n_layers': 2, 'embedding_dim': 96, 'lr': 1.1882399685564556e-05, 'lambda_val': 1.6409067079928013e-05, 'batch_size': 1124, 'optimizer': 'Adam'}.
2026-05-23 01:39:15,164 - experiment_functions - INFO - Early stopping at epoch 550. Best Metrics: (0.024975981928290505, 0.01418032786885246, 0.022293053279072064)
2026-05-23 01:39:15,249 - optuna.study.study - INFO - Trial 24 finished with values: [0.024975981928290505, 0.01418032786885246, 0.022293053279072064] and parameters: {'n_layers': 3, 'embedding_dim': 128, 'lr': 0.0022986573704001376, 'lambda_val': 6.3998980027240765e-06, 'batch_size': 1004, 'optimizer': 'RMSprop'}.
2026-05-23 01:39:19,036 - experiment_functions - INFO - Early stopping at epoch 1000. Best Metrics: (0.029455568712640944, 0.018032786885245903, 0.026377688240979993)
2026-05-23 01:39:19,120 - optuna.study.study - INFO - Trial 25 finished with values: [0.029455568712640944, 0.018032786885245903, 0.026377688240979993] and parameters: {'n_layers': 2, 'embedding_dim': 128, 'lr': 0.0006111868479200038, 'lambda_val': 0.0017105841747060543, 'batch_size': 3738, 'optimizer': 'Adam'}.
2026-05-23 01:39:22,014 - experiment_functions - INFO - Early stopping at epoch 650. Best Metrics: (0.010472948267361067, 0.006721311475409837, 0.0100329531508826)
2026-05-23 01:39:22,107 - optuna.study.study - INFO - Trial 26 finished with values: [0.010472948267361067, 0.006721311475409837, 0.0100329531508826] and parameters: {'n_layers': 3, 'embedding_dim': 128, 'lr': 0.03831974283319575, 'lambda_val': 0.004048394957907183, 'batch_size': 3584, 'optimizer': 'Adam'}.
2026-05-23 01:39:29,676 - experiment_functions - INFO - Early stopping at epoch 2550. Best Metrics: (0.012779916832602647, 0.007950819672131149, 0.011704476719127324)
2026-05-23 01:39:29,769 - optuna.study.study - INFO - Trial 27 finished with values: [0.012779916832602647, 0.007950819672131149, 0.011704476719127324] and parameters: {'n_layers': 2, 'embedding_dim': 64, 'lr': 0.00012172392422427819, 'lambda_val': 5.880237193914909e-05, 'batch_size': 1056, 'optimizer': 'Adam'}.
2026-05-23 01:39:32,522 - experiment_functions - INFO - Early stopping at epoch 750. Best Metrics: (0.03373694087532905, 0.01819672131147541, 0.028280546811531374)
2026-05-23 01:39:32,642 - optuna.study.study - INFO - Trial 28 finished with values: [0.03373694087532905, 0.01819672131147541, 0.028280546811531374] and parameters: {'n_layers': 1, 'embedding_dim': 32, 'lr': 0.0021679791502810398, 'lambda_val': 0.001138541292442641, 'batch_size': 2080, 'optimizer': 'Adam'}.
2026-05-23 01:39:44,635 - optuna.study.study - INFO - Trial 29 finished with values: [0.008321634925550603, 0.004836065573770492, 0.008576202974204765] and parameters: {'n_layers': 2, 'embedding_dim': 96, 'lr': 5.0130001272096357e-05, 'lambda_val': 1.4508587425405414e-05, 'batch_size': 3749, 'optimizer': 'RMSprop'}.
2026-05-23 01:39:47,967 - experiment_functions - INFO - Early stopping at epoch 550. Best Metrics: (0.023243482478623522, 0.014262295081967212, 0.02171032835429388)
2026-05-23 01:39:48,052 - optuna.study.study - INFO - Trial 30 finished with values: [0.023243482478623522, 0.014262295081967212, 0.02171032835429388] and parameters: {'n_layers': 1, 'embedding_dim': 128, 'lr': 0.016630265747118476, 'lambda_val': 9.51579131949383e-06, 'batch_size': 902, 'optimizer': 'Adam'}.
2026-05-23 01:39:56,135 - experiment_functions - INFO - Early stopping at epoch 2150. Best Metrics: (0.03616307433098821, 0.021065573770491806, 0.03179189716979058)
2026-05-23 01:39:57,804 - optuna.study.study - INFO - Trial 31 finished with values: [0.03616307433098821, 0.021065573770491806, 0.03179189716979058] and parameters: {'n_layers': 1, 'embedding_dim': 256, 'lr': 0.00036519209261400785, 'lambda_val': 0.00038573936819964353, 'batch_size': 1493, 'optimizer': 'RMSprop'}.
2026-05-23 01:39:59,709 - experiment_functions - INFO - Early stopping at epoch 500. Best Metrics: (0.0016688354941552853, 0.0013114754098360656, 0.0016802949021198878)
2026-05-23 01:39:59,805 - optuna.study.study - INFO - Trial 32 finished with values: [0.0016688354941552853, 0.0013114754098360656, 0.0016802949021198878] and parameters: {'n_layers': 1, 'embedding_dim': 96, 'lr': 0.005149064186472745, 'lambda_val': 6.025557370158357e-05, 'batch_size': 2881, 'optimizer': 'SGD'}.
2026-05-23 01:40:03,401 - experiment_functions - INFO - Early stopping at epoch 1200. Best Metrics: (0.03346543707092184, 0.018278688524590164, 0.028366887738512724)
2026-05-23 01:40:03,490 - optuna.study.study - INFO - Trial 33 finished with values: [0.03346543707092184, 0.018278688524590164, 0.028366887738512724] and parameters: {'n_layers': 1, 'embedding_dim': 128, 'lr': 0.0022564826852050435, 'lambda_val': 3.7205125829824535e-06, 'batch_size': 728, 'optimizer': 'RMSprop'}.
2026-05-23 01:40:05,734 - experiment_functions - INFO - Early stopping at epoch 550. Best Metrics: (0.008345255613376774, 0.0063114754098360665, 0.008354207303660408)
2026-05-23 01:40:05,838 - optuna.study.study - INFO - Trial 34 finished with values: [0.008345255613376774, 0.0063114754098360665, 0.008354207303660408] and parameters: {'n_layers': 4, 'embedding_dim': 64, 'lr': 0.010835614461595464, 'lambda_val': 0.00048156763565591486, 'batch_size': 3308, 'optimizer': 'Adam'}.
2026-05-23 01:40:08,035 - experiment_functions - INFO - Early stopping at epoch 550. Best Metrics: (0.021447578187726205, 0.01122950819672131, 0.017012398149815696)
2026-05-23 01:40:08,117 - optuna.study.study - INFO - Trial 35 finished with values: [0.021447578187726205, 0.01122950819672131, 0.017012398149815696] and parameters: {'n_layers': 3, 'embedding_dim': 64, 'lr': 0.002966327242338245, 'lambda_val': 1.1323751698585685e-06, 'batch_size': 3950, 'optimizer': 'RMSprop'}.
2026-05-23 01:40:12,318 - experiment_functions - INFO - Early stopping at epoch 850. Best Metrics: (0.02571828730725674, 0.015737704918032787, 0.02198162488474154)
2026-05-23 01:40:12,398 - optuna.study.study - INFO - Trial 36 finished with values: [0.02571828730725674, 0.015737704918032787, 0.02198162488474154] and parameters: {'n_layers': 3, 'embedding_dim': 256, 'lr': 0.000302020510284504, 'lambda_val': 0.0005985360677675016, 'batch_size': 3166, 'optimizer': 'RMSprop'}.
2026-05-23 01:40:14,919 - experiment_functions - INFO - Early stopping at epoch 550. Best Metrics: (0.013781977204011722, 0.009344262295081968, 0.011371398327363617)
2026-05-23 01:40:15,803 - optuna.study.study - INFO - Trial 37 finished with values: [0.013781977204011722, 0.009344262295081968, 0.011371398327363617] and parameters: {'n_layers': 4, 'embedding_dim': 128, 'lr': 0.0018860187490457373, 'lambda_val': 0.0012603554083774884, 'batch_size': 3736, 'optimizer': 'RMSprop'}.
2026-05-23 01:40:19,185 - experiment_functions - INFO - Early stopping at epoch 600. Best Metrics: (0.0018296216523365166, 0.0013934426229508198, 0.0015226670885717204)
2026-05-23 01:40:20,161 - optuna.study.study - INFO - Trial 38 finished with values: [0.0018296216523365166, 0.0013934426229508198, 0.0015226670885717204] and parameters: {'n_layers': 3, 'embedding_dim': 256, 'lr': 0.05742950128207227, 'lambda_val': 9.899041652438856e-06, 'batch_size': 1524, 'optimizer': 'SGD'}.
2026-05-23 01:40:25,280 - experiment_functions - INFO - Early stopping at epoch 1150. Best Metrics: (0.0034069817399018814, 0.0018852459016393446, 0.00293683344503311)
2026-05-23 01:40:26,494 - optuna.study.study - INFO - Trial 39 finished with values: [0.0034069817399018814, 0.0018852459016393446, 0.00293683344503311] and parameters: {'n_layers': 4, 'embedding_dim': 256, 'lr': 0.08211884805531462, 'lambda_val': 0.0009519855089405753, 'batch_size': 573, 'optimizer': 'SGD'}.
2026-05-23 01:40:36,111 - optuna.study.study - INFO - Trial 40 finished with values: [0.008042032382637234, 0.0045901639344262295, 0.006486054029590456] and parameters: {'n_layers': 1, 'embedding_dim': 128, 'lr': 0.0001019807450449115, 'lambda_val': 7.337492410061229e-06, 'batch_size': 1048, 'optimizer': 'RMSprop'}.
2026-05-23 01:40:43,876 - experiment_functions - INFO - Early stopping at epoch 3050. Best Metrics: (0.0020943741365917097, 0.0018852459016393446, 0.0021084829042294136)
2026-05-23 01:40:43,959 - optuna.study.study - INFO - Trial 41 finished with values: [0.0020943741365917097, 0.0018852459016393446, 0.0021084829042294136] and parameters: {'n_layers': 1, 'embedding_dim': 96, 'lr': 1.546457002062403e-05, 'lambda_val': 0.0008626370421804727, 'batch_size': 3711, 'optimizer': 'RMSprop'}.
2026-05-23 01:40:46,830 - experiment_functions - INFO - Early stopping at epoch 900. Best Metrics: (0.008002585854290723, 0.005491803278688524, 0.007899501197698607)
2026-05-23 01:40:47,369 - optuna.study.study - INFO - Trial 42 finished with values: [0.008002585854290723, 0.005491803278688524, 0.007899501197698607] and parameters: {'n_layers': 4, 'embedding_dim': 32, 'lr': 0.007818990256003876, 'lambda_val': 0.0006161160999015657, 'batch_size': 2885, 'optimizer': 'RMSprop'}.
2026-05-23 01:40:57,640 - optuna.study.study - INFO - Trial 43 finished with values: [0.018748650882000922, 0.01344262295081967, 0.01981654445826074] and parameters: {'n_layers': 1, 'embedding_dim': 128, 'lr': 0.00019017292293356, 'lambda_val': 2.8432891896341922e-06, 'batch_size': 2692, 'optimizer': 'Adam'}.
2026-05-23 01:40:59,514 - experiment_functions - INFO - Early stopping at epoch 500. Best Metrics: (0.001797947901055441, 0.0013114754098360656, 0.0015385220821948194)
2026-05-23 01:40:59,603 - optuna.study.study - INFO - Trial 44 finished with values: [0.001797947901055441, 0.0013114754098360656, 0.0015385220821948194] and parameters: {'n_layers': 3, 'embedding_dim': 32, 'lr': 5.8200323254207105e-05, 'lambda_val': 0.014552097566327802, 'batch_size': 4014, 'optimizer': 'SGD'}.
2026-05-23 01:41:01,862 - experiment_functions - INFO - Early stopping at epoch 550. Best Metrics: (0.008111885669179484, 0.0069672131147540985, 0.008634463525430031)
