2026-05-23 00:02:34,385 - optuna.study.study - INFO - Trial 181 finished with values: [0.013324322573853343, 0.011557377049180327, 0.015371098535970278] and parameters: {'n_layers': 4, 'embedding_dim': 96, 'lr': 0.06796687548548233, 'lambda_val': 3.7696639076813204e-06, 'batch_size': 4078, 'optimizer': 'Adam'}.
2026-05-23 00:02:50,888 - optuna.study.study - INFO - Trial 182 finished with values: [0.01274742227281794, 0.013606557377049182, 0.01650383497053612] and parameters: {'n_layers': 2, 'embedding_dim': 32, 'lr': 0.006178111746348912, 'lambda_val': 4.890741275615565e-05, 'batch_size': 3526, 'optimizer': 'RMSprop'}.
2026-05-23 00:03:06,516 - experiment_functions - INFO - Early stopping at epoch 3950. Best Metrics: (0.017770364558423565, 0.015000000000000001, 0.019560720399521437)
2026-05-23 00:03:06,622 - optuna.study.study - INFO - Trial 183 finished with values: [0.017770364558423565, 0.015000000000000001, 0.019560720399521437] and parameters: {'n_layers': 3, 'embedding_dim': 128, 'lr': 0.006178111746348912, 'lambda_val': 4.890741275615565e-05, 'batch_size': 1815, 'optimizer': 'RMSprop'}.
2026-05-23 00:03:13,157 - experiment_functions - INFO - Early stopping at epoch 1500. Best Metrics: (0.012187328336889984, 0.015409836065573772, 0.018712095325300663)
2026-05-23 00:03:13,379 - optuna.study.study - INFO - Trial 184 finished with values: [0.012187328336889984, 0.015409836065573772, 0.018712095325300663] and parameters: {'n_layers': 2, 'embedding_dim': 128, 'lr': 0.016757203845338013, 'lambda_val': 0.00023986489473645103, 'batch_size': 3969, 'optimizer': 'RMSprop'}.
2026-05-23 00:03:16,807 - experiment_functions - INFO - Early stopping at epoch 750. Best Metrics: (0.010011145708893027, 0.012295081967213115, 0.0151582131633623)
2026-05-23 00:03:16,909 - optuna.study.study - INFO - Trial 185 finished with values: [0.010011145708893027, 0.012295081967213115, 0.0151582131633623] and parameters: {'n_layers': 1, 'embedding_dim': 96, 'lr': 0.02773153918226887, 'lambda_val': 2.590190399307384e-06, 'batch_size': 2152, 'optimizer': 'Adam'}.
2026-05-23 00:03:24,536 - experiment_functions - INFO - Early stopping at epoch 1850. Best Metrics: (0.01644426997740379, 0.01581967213114754, 0.02054429156223752)
2026-05-23 00:03:24,616 - optuna.study.study - INFO - Trial 186 finished with values: [0.01644426997740379, 0.01581967213114754, 0.02054429156223752] and parameters: {'n_layers': 1, 'embedding_dim': 96, 'lr': 0.007748276590311343, 'lambda_val': 1.0988779505731458e-05, 'batch_size': 2919, 'optimizer': 'Adam'}.
2026-05-23 00:03:27,650 - experiment_functions - INFO - Early stopping at epoch 550. Best Metrics: (0.012773942295010844, 0.011065573770491803, 0.016298099404083825)
2026-05-23 00:03:28,046 - optuna.study.study - INFO - Trial 187 finished with values: [0.012773942295010844, 0.011065573770491803, 0.016298099404083825] and parameters: {'n_layers': 3, 'embedding_dim': 256, 'lr': 0.06796687548548233, 'lambda_val': 1.5257841801841251e-06, 'batch_size': 1686, 'optimizer': 'Adam'}.
2026-05-23 00:03:40,826 - experiment_functions - INFO - Early stopping at epoch 2700. Best Metrics: (0.010686133693899315, 0.011229508196721312, 0.014872245742911691)
2026-05-23 00:03:40,923 - optuna.study.study - INFO - Trial 188 finished with values: [0.010686133693899315, 0.011229508196721312, 0.014872245742911691] and parameters: {'n_layers': 4, 'embedding_dim': 96, 'lr': 0.016757203845338013, 'lambda_val': 0.0003143503113741062, 'batch_size': 572, 'optimizer': 'Adam'}.
2026-05-23 00:03:45,787 - experiment_functions - INFO - Early stopping at epoch 1100. Best Metrics: (0.00975856007703101, 0.013196721311475411, 0.016543645914336068)
2026-05-23 00:03:45,889 - optuna.study.study - INFO - Trial 189 finished with values: [0.00975856007703101, 0.013196721311475411, 0.016543645914336068] and parameters: {'n_layers': 1, 'embedding_dim': 96, 'lr': 0.032125088922163904, 'lambda_val': 0.0007135877943290441, 'batch_size': 2552, 'optimizer': 'Adam'}.
2026-05-23 00:03:50,043 - experiment_functions - INFO - Early stopping at epoch 800. Best Metrics: (0.0027720626291640607, 0.0060655737704918035, 0.00638979475566772)
2026-05-23 00:03:50,175 - optuna.study.study - INFO - Trial 190 finished with values: [0.0027720626291640607, 0.0060655737704918035, 0.00638979475566772] and parameters: {'n_layers': 4, 'embedding_dim': 64, 'lr': 0.0057059196255990026, 'lambda_val': 0.03829444852087455, 'batch_size': 3460, 'optimizer': 'RMSprop'}.
2026-05-23 00:03:53,122 - experiment_functions - INFO - Early stopping at epoch 550. Best Metrics: (0.004616946886265156, 0.006557377049180328, 0.007166753740763782)
2026-05-23 00:03:53,211 - optuna.study.study - INFO - Trial 191 finished with values: [0.004616946886265156, 0.006557377049180328, 0.007166753740763782] and parameters: {'n_layers': 4, 'embedding_dim': 96, 'lr': 0.0010525529735676993, 'lambda_val': 2.590190399307384e-06, 'batch_size': 1449, 'optimizer': 'RMSprop'}.
2026-05-23 00:03:56,266 - experiment_functions - INFO - Early stopping at epoch 550. Best Metrics: (0.010990280112703804, 0.011311475409836066, 0.015334274561315867)
2026-05-23 00:03:56,359 - optuna.study.study - INFO - Trial 192 finished with values: [0.010990280112703804, 0.011311475409836066, 0.015334274561315867] and parameters: {'n_layers': 3, 'embedding_dim': 256, 'lr': 0.06796687548548233, 'lambda_val': 3.7696639076813204e-06, 'batch_size': 2123, 'optimizer': 'Adam'}.
2026-05-23 00:04:13,854 - optuna.study.study - INFO - Trial 193 finished with values: [0.008439261922726623, 0.008114754098360658, 0.009960161263123117] and parameters: {'n_layers': 3, 'embedding_dim': 256, 'lr': 2.975828485566795e-05, 'lambda_val': 3.7696639076813204e-06, 'batch_size': 3969, 'optimizer': 'RMSprop'}.
2026-05-23 00:04:16,923 - experiment_functions - INFO - Early stopping at epoch 600. Best Metrics: (0.007533779776658266, 0.009836065573770493, 0.01207772128924394)
2026-05-23 00:04:17,019 - optuna.study.study - INFO - Trial 194 finished with values: [0.007533779776658266, 0.009836065573770493, 0.01207772128924394] and parameters: {'n_layers': 2, 'embedding_dim': 128, 'lr': 0.02773153918226887, 'lambda_val': 0.0006106302283455917, 'batch_size': 3239, 'optimizer': 'Adam'}.
2026-05-23 00:04:19,894 - experiment_functions - INFO - Early stopping at epoch 550. Best Metrics: (0.00600696089481698, 0.008934426229508198, 0.009134915669962175)
2026-05-23 00:04:20,284 - optuna.study.study - INFO - Trial 195 finished with values: [0.00600696089481698, 0.008934426229508198, 0.009134915669962175] and parameters: {'n_layers': 3, 'embedding_dim': 32, 'lr': 0.006178111746348912, 'lambda_val': 7.367374344877376e-05, 'batch_size': 3526, 'optimizer': 'Adam'}.
2026-05-23 00:04:25,206 - experiment_functions - INFO - Early stopping at epoch 800. Best Metrics: (0.002145513119588679, 0.0019672131147540984, 0.0028378589644917082)
2026-05-23 00:04:25,781 - optuna.study.study - INFO - Trial 196 finished with values: [0.002145513119588679, 0.0019672131147540984, 0.0028378589644917082] and parameters: {'n_layers': 2, 'embedding_dim': 32, 'lr': 0.032125088922163904, 'lambda_val': 7.367374344877376e-05, 'batch_size': 2552, 'optimizer': 'SGD'}.
2026-05-23 00:04:42,575 - optuna.study.study - INFO - Trial 197 finished with values: [0.01403538468489554, 0.01344262295081967, 0.01752478642669699] and parameters: {'n_layers': 4, 'embedding_dim': 128, 'lr': 0.012476072772677116, 'lambda_val': 2.590190399307384e-06, 'batch_size': 2919, 'optimizer': 'Adam'}.
2026-05-23 00:04:45,276 - experiment_functions - INFO - Early stopping at epoch 500. Best Metrics: (0.001506944238453653, 0.001475409836065574, 0.001914271716902008)
2026-05-23 00:04:45,358 - optuna.study.study - INFO - Trial 198 finished with values: [0.001506944238453653, 0.001475409836065574, 0.001914271716902008] and parameters: {'n_layers': 3, 'embedding_dim': 96, 'lr': 0.006178111746348912, 'lambda_val': 2.0112396730417335e-06, 'batch_size': 3526, 'optimizer': 'SGD'}.
2026-05-23 00:04:49,152 - experiment_functions - INFO - Early stopping at epoch 750. Best Metrics: (0.006738853901251417, 0.008524590163934427, 0.008714731236060185)
2026-05-23 00:04:49,257 - optuna.study.study - INFO - Trial 199 finished with values: [0.006738853901251417, 0.008524590163934427, 0.008714731236060185] and parameters: {'n_layers': 2, 'embedding_dim': 128, 'lr': 0.0002569617882019084, 'lambda_val': 0.0009600144450506561, 'batch_size': 2647, 'optimizer': 'RMSprop'}.
2026-05-23 00:04:52,105 - experiment_functions - INFO - Early stopping at epoch 500. Best Metrics: (0.014156474696834577, 0.012459016393442622, 0.01640578390662043)
2026-05-23 00:04:52,237 - optuna.study.study - INFO - Trial 200 finished with values: [0.014156474696834577, 0.012459016393442622, 0.01640578390662043] and parameters: {'n_layers': 2, 'embedding_dim': 128, 'lr': 0.016757203845338013, 'lambda_val': 4.890741275615565e-05, 'batch_size': 3526, 'optimizer': 'RMSprop'}.
2026-05-23 00:05:00,674 - experiment_functions - INFO - Early stopping at epoch 1950. Best Metrics: (0.011220902144365018, 0.012295081967213115, 0.01562619263473556)
2026-05-23 00:05:00,758 - optuna.study.study - INFO - Trial 201 finished with values: [0.011220902144365018, 0.012295081967213115, 0.01562619263473556] and parameters: {'n_layers': 3, 'embedding_dim': 96, 'lr': 0.006178111746348912, 'lambda_val': 0.00019552406710701323, 'batch_size': 2381, 'optimizer': 'RMSprop'}.
2026-05-23 00:05:05,498 - experiment_functions - INFO - Early stopping at epoch 1050. Best Metrics: (0.007157166076208609, 0.008524590163934427, 0.00976708865560636)
2026-05-23 00:05:05,658 - optuna.study.study - INFO - Trial 202 finished with values: [0.007157166076208609, 0.008524590163934427, 0.00976708865560636] and parameters: {'n_layers': 2, 'embedding_dim': 32, 'lr': 0.00021266593586102424, 'lambda_val': 7.367374344877376e-05, 'batch_size': 2552, 'optimizer': 'RMSprop'}.
2026-05-23 00:05:12,240 - experiment_functions - INFO - Early stopping at epoch 1200. Best Metrics: (0.016849169873885673, 0.01557377049180328, 0.020047333567738544)
2026-05-23 00:05:12,373 - optuna.study.study - INFO - Trial 203 finished with values: [0.016849169873885673, 0.01557377049180328, 0.020047333567738544] and parameters: {'n_layers': 4, 'embedding_dim': 256, 'lr': 0.02773153918226887, 'lambda_val': 2.590190399307384e-06, 'batch_size': 3969, 'optimizer': 'Adam'}.
2026-05-23 00:05:25,506 - experiment_functions - INFO - Early stopping at epoch 1950. Best Metrics: (0.011220111495470034, 0.012459016393442622, 0.016763880463204005)
2026-05-23 00:05:25,690 - optuna.study.study - INFO - Trial 204 finished with values: [0.011220111495470034, 0.012459016393442622, 0.016763880463204005] and parameters: {'n_layers': 4, 'embedding_dim': 96, 'lr': 0.012476072772677116, 'lambda_val': 1.0988779505731458e-05, 'batch_size': 3526, 'optimizer': 'Adam'}.
2026-05-23 00:05:28,380 - experiment_functions - INFO - Early stopping at epoch 500. Best Metrics: (0.0029437500124416473, 0.0013114754098360656, 0.0021887807678057252)
2026-05-23 00:05:28,463 - optuna.study.study - INFO - Trial 205 finished with values: [0.0029437500124416473, 0.0013114754098360656, 0.0021887807678057252] and parameters: {'n_layers': 4, 'embedding_dim': 96, 'lr': 0.016757203845338013, 'lambda_val': 2.590190399307384e-06, 'batch_size': 723, 'optimizer': 'SGD'}.
2026-05-23 00:05:35,579 - experiment_functions - INFO - Early stopping at epoch 1500. Best Metrics: (0.013002283900851907, 0.011557377049180327, 0.016269023599958896)
2026-05-23 00:05:35,661 - optuna.study.study - INFO - Trial 206 finished with values: [0.013002283900851907, 0.011557377049180327, 0.016269023599958896] and parameters: {'n_layers': 4, 'embedding_dim': 64, 'lr': 0.01852608372473555, 'lambda_val': 0.00023986489473645103, 'batch_size': 2919, 'optimizer': 'Adam'}.
2026-05-23 00:05:38,543 - experiment_functions - INFO - Early stopping at epoch 600. Best Metrics: (0.00753059881308731, 0.010245901639344262, 0.013245078574530058)
2026-05-23 00:05:38,638 - optuna.study.study - INFO - Trial 207 finished with values: [0.00753059881308731, 0.010245901639344262, 0.013245078574530058] and parameters: {'n_layers': 1, 'embedding_dim': 96, 'lr': 0.028277027009751265, 'lambda_val': 8.019970575757968e-05, 'batch_size': 717, 'optimizer': 'RMSprop'}.
2026-05-23 00:05:53,910 - experiment_functions - INFO - Early stopping at epoch 3700. Best Metrics: (0.008165395056177045, 0.008934426229508198, 0.010182023534458007)
2026-05-23 00:05:54,338 - optuna.study.study - INFO - Trial 208 finished with values: [0.008165395056177045, 0.008934426229508198, 0.010182023534458007] and parameters: {'n_layers': 2, 'embedding_dim': 256, 'lr': 4.618325019011703e-05, 'lambda_val': 7.367374344877376e-05, 'batch_size': 2919, 'optimizer': 'Adam'}.
2026-05-23 00:06:03,088 - experiment_functions - INFO - Early stopping at epoch 1900. Best Metrics: (0.0141828879228613, 0.013032786885245902, 0.01820203147175896)
2026-05-23 00:06:03,483 - optuna.study.study - INFO - Trial 209 finished with values: [0.0141828879228613, 0.013032786885245902, 0.01820203147175896] and parameters: {'n_layers': 4, 'embedding_dim': 96, 'lr': 0.012476072772677116, 'lambda_val': 1.0988779505731458e-05, 'batch_size': 2919, 'optimizer': 'Adam'}.
2026-05-23 00:06:11,897 - experiment_functions - INFO - Early stopping at epoch 1950. Best Metrics: (0.010685556368345731, 0.011311475409836066, 0.014448867778833389)
2026-05-23 00:06:11,975 - optuna.study.study - INFO - Trial 210 finished with values: [0.010685556368345731, 0.011311475409836066, 0.014448867778833389] and parameters: {'n_layers': 3, 'embedding_dim': 128, 'lr': 0.004829794450369514, 'lambda_val': 0.00023986489473645103, 'batch_size': 3526, 'optimizer': 'RMSprop'}.
2026-05-23 00:06:15,994 - experiment_functions - INFO - Early stopping at epoch 850. Best Metrics: (0.004003297112188716, 0.006639344262295083, 0.007532985091409536)
2026-05-23 00:06:16,445 - optuna.study.study - INFO - Trial 211 finished with values: [0.004003297112188716, 0.006639344262295083, 0.007532985091409536] and parameters: {'n_layers': 2, 'embedding_dim': 128, 'lr': 0.032125088922163904, 'lambda_val': 0.07874376225812088, 'batch_size': 2919, 'optimizer': 'RMSprop'}.
2026-05-23 00:06:23,387 - experiment_functions - INFO - Early stopping at epoch 1600. Best Metrics: (0.009502615087764683, 0.011885245901639346, 0.014502487494642906)
2026-05-23 00:06:23,478 - optuna.study.study - INFO - Trial 212 finished with values: [0.009502615087764683, 0.011885245901639346, 0.014502487494642906] and parameters: {'n_layers': 3, 'embedding_dim': 32, 'lr': 0.016125236118389796, 'lambda_val': 3.7696639076813204e-06, 'batch_size': 2489, 'optimizer': 'Adam'}.
2026-05-23 00:06:31,153 - experiment_functions - INFO - Early stopping at epoch 550. Best Metrics: (0.008045270744475577, 0.009016393442622951, 0.009609396472528746)
2026-05-23 00:06:31,851 - optuna.study.study - INFO - Trial 213 finished with values: [0.008045270744475577, 0.009016393442622951, 0.009609396472528746] and parameters: {'n_layers': 2, 'embedding_dim': 32, 'lr': 0.006178111746348912, 'lambda_val': 1.0988779505731458e-05, 'batch_size': 3526, 'optimizer': 'Adam'}.
2026-05-23 00:06:50,386 - experiment_functions - INFO - Early stopping at epoch 3700. Best Metrics: (0.012143504863315273, 0.014098360655737708, 0.016739184179776913)
2026-05-23 00:06:50,460 - optuna.study.study - INFO - Trial 214 finished with values: [0.012143504863315273, 0.014098360655737708, 0.016739184179776913] and parameters: {'n_layers': 2, 'embedding_dim': 32, 'lr': 0.02143903136401803, 'lambda_val': 2.590190399307384e-06, 'batch_size': 1657, 'optimizer': 'Adam'}.
2026-05-23 00:06:56,545 - experiment_functions - INFO - Early stopping at epoch 1350. Best Metrics: (0.011576530448348941, 0.013606557377049182, 0.016433094012316837)
2026-05-23 00:06:56,940 - optuna.study.study - INFO - Trial 215 finished with values: [0.011576530448348941, 0.013606557377049182, 0.016433094012316837] and parameters: {'n_layers': 2, 'embedding_dim': 256, 'lr': 0.006178111746348912, 'lambda_val': 4.758702584839068e-06, 'batch_size': 3526, 'optimizer': 'Adam'}.
2026-05-23 00:07:05,210 - experiment_functions - INFO - Early stopping at epoch 1750. Best Metrics: (0.015239630109691047, 0.014426229508196723, 0.01855275004643125)
2026-05-23 00:07:06,460 - optuna.study.study - INFO - Trial 216 finished with values: [0.015239630109691047, 0.014426229508196723, 0.01855275004643125] and parameters: {'n_layers': 4, 'embedding_dim': 256, 'lr': 0.031031266699012076, 'lambda_val': 7.367374344877376e-05, 'batch_size': 2069, 'optimizer': 'RMSprop'}.
2026-05-23 00:07:13,295 - experiment_functions - INFO - Early stopping at epoch 1550. Best Metrics: (0.013787806409427618, 0.01237704918032787, 0.01601638495352032)
2026-05-23 00:07:13,382 - optuna.study.study - INFO - Trial 217 finished with values: [0.013787806409427618, 0.01237704918032787, 0.01601638495352032] and parameters: {'n_layers': 3, 'embedding_dim': 96, 'lr': 0.02773153918226887, 'lambda_val': 0.0003368401682621321, 'batch_size': 2552, 'optimizer': 'RMSprop'}.
2026-05-23 00:07:25,872 - experiment_functions - INFO - Early stopping at epoch 2900. Best Metrics: (0.02063035123614799, 0.015901639344262294, 0.022089510766755374)
2026-05-23 00:07:25,993 - optuna.study.study - INFO - Trial 218 finished with values: [0.02063035123614799, 0.015901639344262294, 0.022089510766755374] and parameters: {'n_layers': 4, 'embedding_dim': 32, 'lr': 0.032125088922163904, 'lambda_val': 7.367374344877376e-05, 'batch_size': 2552, 'optimizer': 'RMSprop'}.
2026-05-23 00:07:29,081 - experiment_functions - INFO - Early stopping at epoch 550. Best Metrics: (0.011421181747049064, 0.012868852459016393, 0.01565893994558973)
2026-05-23 00:07:29,174 - optuna.study.study - INFO - Trial 219 finished with values: [0.011421181747049064, 0.012868852459016393, 0.01565893994558973] and parameters: {'n_layers': 3, 'embedding_dim': 256, 'lr': 0.06796687548548233, 'lambda_val': 4.890741275615565e-05, 'batch_size': 1815, 'optimizer': 'Adam'}.
2026-05-23 00:07:42,769 - experiment_functions - INFO - Early stopping at epoch 3400. Best Metrics: (0.015515921831865469, 0.01377049180327869, 0.019989912843301736)
2026-05-23 00:07:42,840 - optuna.study.study - INFO - Trial 220 finished with values: [0.015515921831865469, 0.01377049180327869, 0.019989912843301736] and parameters: {'n_layers': 2, 'embedding_dim': 32, 'lr': 0.016757203845338013, 'lambda_val': 2.590190399307384e-06, 'batch_size': 3526, 'optimizer': 'Adam'}.
2026-05-23 00:07:47,665 - experiment_functions - INFO - Early stopping at epoch 1100. Best Metrics: (0.004026360308683389, 0.0072131147540983615, 0.00821430346240603)
2026-05-23 00:07:47,807 - optuna.study.study - INFO - Trial 221 finished with values: [0.004026360308683389, 0.0072131147540983615, 0.00821430346240603] and parameters: {'n_layers': 3, 'embedding_dim': 32, 'lr': 0.005193691100164764, 'lambda_val': 4.890741275615565e-05, 'batch_size': 1815, 'optimizer': 'RMSprop'}.
2026-05-23 00:08:04,453 - optuna.study.study - INFO - Trial 222 finished with values: [0.01629149247480213, 0.015491803278688524, 0.020922351500995716] and parameters: {'n_layers': 3, 'embedding_dim': 96, 'lr': 0.016757203845338013, 'lambda_val': 2.590190399307384e-06, 'batch_size': 2919, 'optimizer': 'Adam'}.
2026-05-23 00:08:11,981 - experiment_functions - INFO - Early stopping at epoch 500. Best Metrics: (0.010733678346742723, 0.012459016393442624, 0.014558840728677025)
2026-05-23 00:08:12,338 - optuna.study.study - INFO - Trial 223 finished with values: [0.010733678346742723, 0.012459016393442624, 0.014558840728677025] and parameters: {'n_layers': 2, 'embedding_dim': 96, 'lr': 0.012476072772677116, 'lambda_val': 0.0007883874990779626, 'batch_size': 3969, 'optimizer': 'RMSprop'}.
2026-05-23 00:08:30,658 - experiment_functions - INFO - Early stopping at epoch 2950. Best Metrics: (0.016022007114755068, 0.01557377049180328, 0.02067008836566262)
2026-05-23 00:08:30,737 - optuna.study.study - INFO - Trial 224 finished with values: [0.016022007114755068, 0.01557377049180328, 0.02067008836566262] and parameters: {'n_layers': 3, 'embedding_dim': 256, 'lr': 0.032125088922163904, 'lambda_val': 9.956828255961624e-05, 'batch_size': 2552, 'optimizer': 'Adam'}.
2026-05-23 00:08:40,698 - experiment_functions - INFO - Early stopping at epoch 2200. Best Metrics: (0.009300017260789568, 0.00959016393442623, 0.011980435462771393)
2026-05-23 00:08:40,799 - optuna.study.study - INFO - Trial 225 finished with values: [0.009300017260789568, 0.00959016393442623, 0.011980435462771393] and parameters: {'n_layers': 4, 'embedding_dim': 96, 'lr': 9.344782276008147e-05, 'lambda_val': 2.590190399307384e-06, 'batch_size': 3526, 'optimizer': 'Adam'}.
2026-05-23 00:08:58,374 - optuna.study.study - INFO - Trial 226 finished with values: [0.01545741519948896, 0.015327868852459018, 0.020272536621175515] and parameters: {'n_layers': 4, 'embedding_dim': 96, 'lr': 0.02143903136401803, 'lambda_val': 2.590190399307384e-06, 'batch_size': 3737, 'optimizer': 'Adam'}.
2026-05-23 00:09:01,363 - experiment_functions - INFO - Early stopping at epoch 500. Best Metrics: (0.015056786532376479, 0.012868852459016394, 0.0188182624823076)
2026-05-23 00:09:01,499 - optuna.study.study - INFO - Trial 227 finished with values: [0.015056786532376479, 0.012868852459016394, 0.0188182624823076] and parameters: {'n_layers': 4, 'embedding_dim': 96, 'lr': 0.02773153918226887, 'lambda_val': 2.590190399307384e-06, 'batch_size': 2919, 'optimizer': 'RMSprop'}.
2026-05-23 00:09:07,533 - experiment_functions - INFO - Early stopping at epoch 1350. Best Metrics: (0.016264795132698878, 0.013524590163934426, 0.01951182602922621)
