2026-05-23 02:43:57,051 - optuna.study.study - INFO - Trial 99 finished with values: [0.05006202721893355, 0.035409836065573776, 0.05123181697413702] and parameters: {'n_layers': 2, 'embedding_dim': 128, 'lr': 0.00019408305137116525, 'lambda_val': 1.0486263526014875e-06, 'batch_size': 3771, 'optimizer': 'Adam'}.
2026-05-23 02:43:59,610 - experiment_functions - INFO - Early stopping at epoch 550. Best Metrics: (0.04103762789975672, 0.02852459016393443, 0.03917142387649794)
2026-05-23 02:43:59,745 - optuna.study.study - INFO - Trial 100 finished with values: [0.04103762789975672, 0.02852459016393443, 0.03917142387649794] and parameters: {'n_layers': 2, 'embedding_dim': 96, 'lr': 0.0037403648147249892, 'lambda_val': 0.0009810927157913494, 'batch_size': 1462, 'optimizer': 'Adam'}.
2026-05-23 02:44:07,928 - experiment_functions - INFO - Early stopping at epoch 2100. Best Metrics: (0.02506485235921746, 0.02040983606557377, 0.027334460523146312)
2026-05-23 02:44:08,023 - optuna.study.study - INFO - Trial 101 finished with values: [0.02506485235921746, 0.02040983606557377, 0.027334460523146312] and parameters: {'n_layers': 2, 'embedding_dim': 128, 'lr': 0.0056420762452804776, 'lambda_val': 0.008198149930508243, 'batch_size': 2637, 'optimizer': 'RMSprop'}.
2026-05-23 02:44:18,987 - experiment_functions - INFO - Early stopping at epoch 3950. Best Metrics: (0.05813172693157259, 0.04245901639344262, 0.059966232054927626)
2026-05-23 02:44:19,846 - optuna.study.study - INFO - Trial 102 finished with values: [0.05813172693157259, 0.04245901639344262, 0.059966232054927626] and parameters: {'n_layers': 1, 'embedding_dim': 64, 'lr': 0.0002738093623313198, 'lambda_val': 8.689122223949433e-06, 'batch_size': 2701, 'optimizer': 'RMSprop'}.
2026-05-23 02:44:22,666 - experiment_functions - INFO - Early stopping at epoch 800. Best Metrics: (0.05470617622703148, 0.03819672131147541, 0.055182701374466264)
2026-05-23 02:44:22,811 - optuna.study.study - INFO - Trial 103 finished with values: [0.05470617622703148, 0.03819672131147541, 0.055182701374466264] and parameters: {'n_layers': 1, 'embedding_dim': 64, 'lr': 0.0013555052564010479, 'lambda_val': 2.2233828874401383e-06, 'batch_size': 2607, 'optimizer': 'RMSprop'}.
2026-05-23 02:44:33,686 - experiment_functions - INFO - Early stopping at epoch 3500. Best Metrics: (0.055932148047449504, 0.04057377049180328, 0.05654754265842862)
2026-05-23 02:44:34,042 - optuna.study.study - INFO - Trial 104 finished with values: [0.055932148047449504, 0.04057377049180328, 0.05654754265842862] and parameters: {'n_layers': 1, 'embedding_dim': 128, 'lr': 0.00019408305137116525, 'lambda_val': 1.6723789265724614e-06, 'batch_size': 2427, 'optimizer': 'Adam'}.
2026-05-23 02:44:49,313 - optuna.study.study - INFO - Trial 105 finished with values: [0.039615270288893334, 0.026557377049180327, 0.037486707537883523] and parameters: {'n_layers': 4, 'embedding_dim': 32, 'lr': 0.00019324235493803607, 'lambda_val': 8.60783053151504e-05, 'batch_size': 2109, 'optimizer': 'RMSprop'}.
2026-05-23 02:44:55,425 - experiment_functions - INFO - Early stopping at epoch 550. Best Metrics: (0.06179217665397323, 0.04237704918032787, 0.0605646479560002)
2026-05-23 02:44:55,883 - optuna.study.study - INFO - Trial 106 finished with values: [0.06179217665397323, 0.04237704918032787, 0.0605646479560002] and parameters: {'n_layers': 1, 'embedding_dim': 128, 'lr': 0.00466372845018428, 'lambda_val': 0.007024459859123817, 'batch_size': 1651, 'optimizer': 'Adam'}.
2026-05-23 02:45:05,755 - experiment_functions - INFO - Early stopping at epoch 1000. Best Metrics: (0.04693244738710245, 0.03377049180327869, 0.048582600515265965)
2026-05-23 02:45:06,119 - optuna.study.study - INFO - Trial 107 finished with values: [0.04693244738710245, 0.03377049180327869, 0.048582600515265965] and parameters: {'n_layers': 2, 'embedding_dim': 64, 'lr': 0.0005134970540789423, 'lambda_val': 0.008198149930508243, 'batch_size': 584, 'optimizer': 'Adam'}.
2026-05-23 02:45:10,616 - experiment_functions - INFO - Early stopping at epoch 1000. Best Metrics: (0.06238310734911943, 0.04311475409836066, 0.061206480822045516)
2026-05-23 02:45:10,703 - optuna.study.study - INFO - Trial 108 finished with values: [0.06238310734911943, 0.04311475409836066, 0.061206480822045516] and parameters: {'n_layers': 1, 'embedding_dim': 96, 'lr': 0.0005838890493565157, 'lambda_val': 6.501058820242015e-05, 'batch_size': 3577, 'optimizer': 'RMSprop'}.
2026-05-23 02:45:20,023 - experiment_functions - INFO - Early stopping at epoch 2400. Best Metrics: (0.03341524435655132, 0.025655737704918035, 0.03525472203858528)
2026-05-23 02:45:20,402 - optuna.study.study - INFO - Trial 109 finished with values: [0.03341524435655132, 0.025655737704918035, 0.03525472203858528] and parameters: {'n_layers': 3, 'embedding_dim': 64, 'lr': 0.0002738093623313198, 'lambda_val': 2.2233828874401383e-06, 'batch_size': 2658, 'optimizer': 'Adam'}.
2026-05-23 02:45:47,654 - optuna.study.study - INFO - Trial 110 finished with values: [0.024251289496692727, 0.019262295081967213, 0.02527131353831599] and parameters: {'n_layers': 4, 'embedding_dim': 256, 'lr': 9.625644076571635e-05, 'lambda_val': 8.60783053151504e-05, 'batch_size': 4005, 'optimizer': 'Adam'}.
2026-05-23 02:45:50,492 - experiment_functions - INFO - Early stopping at epoch 550. Best Metrics: (0.04101596613477454, 0.034344262295081966, 0.04601955400501935)
2026-05-23 02:45:50,719 - optuna.study.study - INFO - Trial 111 finished with values: [0.04101596613477454, 0.034344262295081966, 0.04601955400501935] and parameters: {'n_layers': 1, 'embedding_dim': 256, 'lr': 0.00466372845018428, 'lambda_val': 0.013489522394415601, 'batch_size': 3063, 'optimizer': 'Adam'}.
2026-05-23 02:45:53,194 - experiment_functions - INFO - Early stopping at epoch 550. Best Metrics: (0.06006690077517443, 0.04057377049180328, 0.060736984370779554)
2026-05-23 02:45:53,287 - optuna.study.study - INFO - Trial 112 finished with values: [0.06006690077517443, 0.04057377049180328, 0.060736984370779554] and parameters: {'n_layers': 1, 'embedding_dim': 128, 'lr': 0.0056420762452804776, 'lambda_val': 8.60783053151504e-05, 'batch_size': 1651, 'optimizer': 'Adam'}.
2026-05-23 02:45:57,789 - experiment_functions - INFO - Early stopping at epoch 1300. Best Metrics: (0.06552561303054202, 0.045737704918032786, 0.06864764450139581)
2026-05-23 02:45:57,883 - optuna.study.study - INFO - Trial 113 finished with values: [0.06552561303054202, 0.045737704918032786, 0.06864764450139581] and parameters: {'n_layers': 1, 'embedding_dim': 128, 'lr': 0.0005134970540789423, 'lambda_val': 0.0009810927157913494, 'batch_size': 2427, 'optimizer': 'RMSprop'}.
2026-05-23 02:46:02,666 - experiment_functions - INFO - Early stopping at epoch 1300. Best Metrics: (0.060210272452040504, 0.04467213114754098, 0.060916075761553945)
2026-05-23 02:46:03,154 - optuna.study.study - INFO - Trial 114 finished with values: [0.060210272452040504, 0.04467213114754098, 0.060916075761553945] and parameters: {'n_layers': 1, 'embedding_dim': 128, 'lr': 0.0005134970540789423, 'lambda_val': 0.008198149930508243, 'batch_size': 2427, 'optimizer': 'Adam'}.
2026-05-23 02:46:15,561 - optuna.study.study - INFO - Trial 115 finished with values: [0.04451614601151705, 0.03336065573770492, 0.044784568174464794] and parameters: {'n_layers': 2, 'embedding_dim': 64, 'lr': 0.00015616559996727892, 'lambda_val': 0.0027428171281445477, 'batch_size': 1222, 'optimizer': 'Adam'}.
2026-05-23 02:46:23,617 - experiment_functions - INFO - Early stopping at epoch 2150. Best Metrics: (0.020637997326110078, 0.019344262295081967, 0.02557995763944892)
2026-05-23 02:46:23,701 - optuna.study.study - INFO - Trial 116 finished with values: [0.020637997326110078, 0.019344262295081967, 0.02557995763944892] and parameters: {'n_layers': 2, 'embedding_dim': 96, 'lr': 0.013407249308971856, 'lambda_val': 0.015180930077175619, 'batch_size': 3577, 'optimizer': 'Adam'}.
2026-05-23 02:46:27,832 - experiment_functions - INFO - Early stopping at epoch 1000. Best Metrics: (0.04575759373622958, 0.03377049180327869, 0.04307862477503739)
2026-05-23 02:46:27,921 - optuna.study.study - INFO - Trial 117 finished with values: [0.04575759373622958, 0.03377049180327869, 0.04307862477503739] and parameters: {'n_layers': 2, 'embedding_dim': 96, 'lr': 0.0005838890493565157, 'lambda_val': 6.501058820242015e-05, 'batch_size': 2558, 'optimizer': 'RMSprop'}.
2026-05-23 02:46:30,356 - experiment_functions - INFO - Early stopping at epoch 550. Best Metrics: (0.03676374265462404, 0.025, 0.036473153924854694)
2026-05-23 02:46:30,456 - optuna.study.study - INFO - Trial 118 finished with values: [0.03676374265462404, 0.025, 0.036473153924854694] and parameters: {'n_layers': 1, 'embedding_dim': 32, 'lr': 0.02107335765652346, 'lambda_val': 0.005469691175731185, 'batch_size': 1462, 'optimizer': 'Adam'}.
2026-05-23 02:46:40,349 - experiment_functions - INFO - Early stopping at epoch 1950. Best Metrics: (0.05471677169295154, 0.03827868852459017, 0.05511335728250648)
2026-05-23 02:46:40,459 - optuna.study.study - INFO - Trial 119 finished with values: [0.05471677169295154, 0.03827868852459017, 0.05511335728250648] and parameters: {'n_layers': 2, 'embedding_dim': 256, 'lr': 0.00015616559996727892, 'lambda_val': 8.689122223949433e-06, 'batch_size': 2498, 'optimizer': 'RMSprop'}.
2026-05-23 02:46:43,829 - experiment_functions - INFO - Early stopping at epoch 600. Best Metrics: (0.03305146233216379, 0.02540983606557377, 0.033389190634873056)
2026-05-23 02:46:43,927 - optuna.study.study - INFO - Trial 120 finished with values: [0.03305146233216379, 0.02540983606557377, 0.033389190634873056] and parameters: {'n_layers': 2, 'embedding_dim': 128, 'lr': 0.001459413805808463, 'lambda_val': 0.0009810927157913494, 'batch_size': 2701, 'optimizer': 'RMSprop'}.
2026-05-23 02:46:46,647 - experiment_functions - INFO - Early stopping at epoch 600. Best Metrics: (0.050739749054402976, 0.03467213114754098, 0.05220760111711792)
2026-05-23 02:46:46,738 - optuna.study.study - INFO - Trial 121 finished with values: [0.050739749054402976, 0.03467213114754098, 0.05220760111711792] and parameters: {'n_layers': 1, 'embedding_dim': 32, 'lr': 0.0036479636125195114, 'lambda_val': 2.7976049140240637e-06, 'batch_size': 1651, 'optimizer': 'RMSprop'}.
2026-05-23 02:46:50,050 - experiment_functions - INFO - Early stopping at epoch 550. Best Metrics: (0.032442530877713066, 0.02516393442622951, 0.036219585852176085)
2026-05-23 02:46:50,135 - optuna.study.study - INFO - Trial 122 finished with values: [0.032442530877713066, 0.02516393442622951, 0.036219585852176085] and parameters: {'n_layers': 2, 'embedding_dim': 128, 'lr': 0.001459413805808463, 'lambda_val': 0.0009810927157913494, 'batch_size': 3536, 'optimizer': 'RMSprop'}.
2026-05-23 02:47:01,405 - experiment_functions - INFO - Early stopping at epoch 3300. Best Metrics: (0.06416322049122541, 0.04483606557377049, 0.06394195716649133)
2026-05-23 02:47:01,525 - optuna.study.study - INFO - Trial 123 finished with values: [0.06416322049122541, 0.04483606557377049, 0.06394195716649133] and parameters: {'n_layers': 1, 'embedding_dim': 128, 'lr': 0.00019324235493803607, 'lambda_val': 8.60783053151504e-05, 'batch_size': 2109, 'optimizer': 'RMSprop'}.
2026-05-23 02:47:13,435 - optuna.study.study - INFO - Trial 124 finished with values: [0.011171862575068445, 0.01, 0.013227120627127035] and parameters: {'n_layers': 1, 'embedding_dim': 64, 'lr': 0.00011658772604970312, 'lambda_val': 0.00047063136500321776, 'batch_size': 745, 'optimizer': 'RMSprop'}.
2026-05-23 02:47:19,460 - experiment_functions - INFO - Early stopping at epoch 750. Best Metrics: (0.025604452509768307, 0.017295081967213115, 0.02330328743923644)
2026-05-23 02:47:20,509 - optuna.study.study - INFO - Trial 125 finished with values: [0.025604452509768307, 0.017295081967213115, 0.02330328743923644] and parameters: {'n_layers': 4, 'embedding_dim': 256, 'lr': 0.00033929418945457667, 'lambda_val': 0.007352147641655774, 'batch_size': 2773, 'optimizer': 'RMSprop'}.
2026-05-23 02:47:24,018 - experiment_functions - INFO - Early stopping at epoch 700. Best Metrics: (0.0283070174020299, 0.020081967213114754, 0.028125269724071596)
2026-05-23 02:47:24,115 - optuna.study.study - INFO - Trial 126 finished with values: [0.0283070174020299, 0.020081967213114754, 0.028125269724071596] and parameters: {'n_layers': 3, 'embedding_dim': 64, 'lr': 0.002461940751629359, 'lambda_val': 0.0035064867017704023, 'batch_size': 1571, 'optimizer': 'Adam'}.
2026-05-23 02:47:26,575 - experiment_functions - INFO - Early stopping at epoch 500. Best Metrics: (0.0023837600768536987, 0.0018852459016393442, 0.0026092246068320727)
2026-05-23 02:47:26,677 - optuna.study.study - INFO - Trial 127 finished with values: [0.0023837600768536987, 0.0018852459016393442, 0.0026092246068320727] and parameters: {'n_layers': 2, 'embedding_dim': 64, 'lr': 0.001459413805808463, 'lambda_val': 2.092774761539315e-05, 'batch_size': 1462, 'optimizer': 'SGD'}.
2026-05-23 02:47:29,359 - experiment_functions - INFO - Early stopping at epoch 550. Best Metrics: (0.06729307222402978, 0.04147540983606557, 0.06183639096582928)
2026-05-23 02:47:29,499 - optuna.study.study - INFO - Trial 128 finished with values: [0.06729307222402978, 0.04147540983606557, 0.06183639096582928] and parameters: {'n_layers': 1, 'embedding_dim': 96, 'lr': 0.007526325741077799, 'lambda_val': 0.0001408586097439621, 'batch_size': 3771, 'optimizer': 'Adam'}.
2026-05-23 02:47:32,659 - experiment_functions - INFO - Early stopping at epoch 550. Best Metrics: (0.020426960721306276, 0.013032786885245902, 0.01910160674202849)
2026-05-23 02:47:32,752 - optuna.study.study - INFO - Trial 129 finished with values: [0.020426960721306276, 0.013032786885245902, 0.01910160674202849] and parameters: {'n_layers': 2, 'embedding_dim': 128, 'lr': 0.015248903119772129, 'lambda_val': 0.0003664364618235428, 'batch_size': 3965, 'optimizer': 'Adam'}.
2026-05-23 02:47:36,960 - experiment_functions - INFO - Early stopping at epoch 700. Best Metrics: (0.032274051371181944, 0.015491803278688526, 0.023925822386307336)
2026-05-23 02:47:37,393 - optuna.study.study - INFO - Trial 130 finished with values: [0.032274051371181944, 0.015491803278688526, 0.023925822386307336] and parameters: {'n_layers': 2, 'embedding_dim': 256, 'lr': 0.007526325741077799, 'lambda_val': 0.0001408586097439621, 'batch_size': 3144, 'optimizer': 'Adam'}.
2026-05-23 02:47:50,344 - experiment_functions - INFO - Early stopping at epoch 3100. Best Metrics: (0.04484329865086993, 0.034918032786885246, 0.04720809079346997)
2026-05-23 02:47:50,438 - optuna.study.study - INFO - Trial 131 finished with values: [0.04484329865086993, 0.034918032786885246, 0.04720809079346997] and parameters: {'n_layers': 2, 'embedding_dim': 128, 'lr': 0.00019408305137116525, 'lambda_val': 1.0486263526014875e-06, 'batch_size': 3771, 'optimizer': 'RMSprop'}.
2026-05-23 02:47:52,935 - experiment_functions - INFO - Early stopping at epoch 550. Best Metrics: (0.05432563777418438, 0.03827868852459017, 0.058818968115825765)
2026-05-23 02:47:53,026 - optuna.study.study - INFO - Trial 132 finished with values: [0.05432563777418438, 0.03827868852459017, 0.058818968115825765] and parameters: {'n_layers': 1, 'embedding_dim': 128, 'lr': 0.0056420762452804776, 'lambda_val': 0.006439135351806826, 'batch_size': 1518, 'optimizer': 'Adam'}.
2026-05-23 02:47:56,569 - experiment_functions - INFO - Early stopping at epoch 650. Best Metrics: (0.03196989992990423, 0.023442622950819673, 0.03143419039295794)
2026-05-23 02:47:56,806 - optuna.study.study - INFO - Trial 133 finished with values: [0.03196989992990423, 0.023442622950819673, 0.03143419039295794] and parameters: {'n_layers': 2, 'embedding_dim': 96, 'lr': 0.0013555052564010479, 'lambda_val': 0.008198149930508243, 'batch_size': 2701, 'optimizer': 'RMSprop'}.
2026-05-23 02:48:03,188 - experiment_functions - INFO - Early stopping at epoch 1100. Best Metrics: (0.013252214321371717, 0.010081967213114754, 0.01532748779853242)
2026-05-23 02:48:03,326 - optuna.study.study - INFO - Trial 134 finished with values: [0.013252214321371717, 0.010081967213114754, 0.01532748779853242] and parameters: {'n_layers': 4, 'embedding_dim': 128, 'lr': 0.001459413805808463, 'lambda_val': 8.60783053151504e-05, 'batch_size': 1518, 'optimizer': 'RMSprop'}.
2026-05-23 02:48:07,290 - experiment_functions - INFO - Early stopping at epoch 800. Best Metrics: (0.06450381795510472, 0.04237704918032787, 0.06663929867661779)
2026-05-23 02:48:08,138 - optuna.study.study - INFO - Trial 135 finished with values: [0.06450381795510472, 0.04237704918032787, 0.06663929867661779] and parameters: {'n_layers': 1, 'embedding_dim': 256, 'lr': 0.001459413805808463, 'lambda_val': 0.00023185127305384867, 'batch_size': 808, 'optimizer': 'Adam'}.
2026-05-23 02:48:13,873 - experiment_functions - INFO - Early stopping at epoch 850. Best Metrics: (0.01595625228121843, 0.015245901639344264, 0.01879562691191484)
2026-05-23 02:48:14,408 - optuna.study.study - INFO - Trial 136 finished with values: [0.01595625228121843, 0.015245901639344264, 0.01879562691191484] and parameters: {'n_layers': 3, 'embedding_dim': 256, 'lr': 0.0015170350666212236, 'lambda_val': 0.007352147641655774, 'batch_size': 2882, 'optimizer': 'RMSprop'}.
2026-05-23 02:48:27,082 - experiment_functions - INFO - Early stopping at epoch 1750. Best Metrics: (0.027203873983680044, 0.022213114754098363, 0.029208980160286682)
2026-05-23 02:48:27,170 - optuna.study.study - INFO - Trial 137 finished with values: [0.027203873983680044, 0.022213114754098363, 0.029208980160286682] and parameters: {'n_layers': 4, 'embedding_dim': 256, 'lr': 0.00014365444793142175, 'lambda_val': 0.0009810927157913494, 'batch_size': 3144, 'optimizer': 'RMSprop'}.
2026-05-23 02:48:41,457 - optuna.study.study - INFO - Trial 138 finished with values: [0.06184848760604915, 0.040983606557377046, 0.05953944951033264] and parameters: {'n_layers': 2, 'embedding_dim': 64, 'lr': 0.00016298601179134825, 'lambda_val': 6.158799740696895e-06, 'batch_size': 897, 'optimizer': 'RMSprop'}.
2026-05-23 02:48:48,379 - experiment_functions - INFO - Early stopping at epoch 700. Best Metrics: (0.04069245702634961, 0.029672131147540987, 0.041935371125755266)
2026-05-23 02:48:48,747 - optuna.study.study - INFO - Trial 139 finished with values: [0.04069245702634961, 0.029672131147540987, 0.041935371125755266] and parameters: {'n_layers': 2, 'embedding_dim': 128, 'lr': 0.001459413805808463, 'lambda_val': 0.0009810927157913494, 'batch_size': 808, 'optimizer': 'Adam'}.
2026-05-23 02:49:10,867 - optuna.study.study - INFO - Trial 140 finished with values: [0.03773060197747147, 0.02811475409836065, 0.03750721166694107] and parameters: {'n_layers': 2, 'embedding_dim': 128, 'lr': 0.00011658772604970312, 'lambda_val': 0.00033129952170282684, 'batch_size': 3755, 'optimizer': 'Adam'}.
2026-05-23 02:49:13,230 - experiment_functions - INFO - Early stopping at epoch 550. Best Metrics: (0.060412579799646274, 0.03926229508196721, 0.05657641208203878)
2026-05-23 02:49:13,351 - optuna.study.study - INFO - Trial 141 finished with values: [0.060412579799646274, 0.03926229508196721, 0.05657641208203878] and parameters: {'n_layers': 1, 'embedding_dim': 64, 'lr': 0.0056420762452804776, 'lambda_val': 0.00010574161158144353, 'batch_size': 1091, 'optimizer': 'Adam'}.
2026-05-23 02:49:16,692 - experiment_functions - INFO - Early stopping at epoch 650. Best Metrics: (0.030528310537088602, 0.021557377049180326, 0.030105691154621243)
2026-05-23 02:49:16,771 - optuna.study.study - INFO - Trial 142 finished with values: [0.030528310537088602, 0.021557377049180326, 0.030105691154621243] and parameters: {'n_layers': 3, 'embedding_dim': 64, 'lr': 0.002461940751629359, 'lambda_val': 0.0035064867017704023, 'batch_size': 1571, 'optimizer': 'Adam'}.
2026-05-23 02:49:19,967 - experiment_functions - INFO - Early stopping at epoch 600. Best Metrics: (0.033562255276978085, 0.024672131147540986, 0.035091676660953176)
2026-05-23 02:49:20,356 - optuna.study.study - INFO - Trial 143 finished with values: [0.033562255276978085, 0.024672131147540986, 0.035091676660953176] and parameters: {'n_layers': 2, 'embedding_dim': 128, 'lr': 0.0013555052564010479, 'lambda_val': 2.1146074643297403e-05, 'batch_size': 2701, 'optimizer': 'RMSprop'}.
2026-05-23 02:49:23,194 - experiment_functions - INFO - Early stopping at epoch 600. Best Metrics: (0.04650660296075925, 0.02811475409836066, 0.041206089135471975)
2026-05-23 02:49:23,277 - optuna.study.study - INFO - Trial 144 finished with values: [0.04650660296075925, 0.02811475409836066, 0.041206089135471975] and parameters: {'n_layers': 1, 'embedding_dim': 128, 'lr': 0.005418970500003363, 'lambda_val': 8.689122223949433e-06, 'batch_size': 2701, 'optimizer': 'RMSprop'}.
2026-05-23 02:49:36,577 - experiment_functions - INFO - Early stopping at epoch 2200. Best Metrics: (0.03561319650704736, 0.024426229508196725, 0.03586412030309138)
2026-05-23 02:49:36,658 - optuna.study.study - INFO - Trial 145 finished with values: [0.03561319650704736, 0.024426229508196725, 0.03586412030309138] and parameters: {'n_layers': 3, 'embedding_dim': 256, 'lr': 0.00015087698888573533, 'lambda_val': 0.0035064867017704023, 'batch_size': 1651, 'optimizer': 'Adam'}.
2026-05-23 02:49:44,021 - experiment_functions - INFO - Early stopping at epoch 1700. Best Metrics: (0.06427202936062978, 0.045163934426229506, 0.061576182407199004)
2026-05-23 02:49:44,101 - optuna.study.study - INFO - Trial 146 finished with values: [0.06427202936062978, 0.045163934426229506, 0.061576182407199004] and parameters: {'n_layers': 1, 'embedding_dim': 256, 'lr': 0.00033929418945457667, 'lambda_val': 0.004212470249457581, 'batch_size': 2773, 'optimizer': 'RMSprop'}.
2026-05-23 02:49:49,745 - experiment_functions - INFO - Early stopping at epoch 550. Best Metrics: (0.04224603904139084, 0.030819672131147544, 0.04326281640352)
