2026-05-23 02:03:51,887 - optuna.study.study - INFO - Trial 282 finished with values: [0.021486133401672994, 0.014508196721311479, 0.02047604340134757] and parameters: {'n_layers': 4, 'embedding_dim': 64, 'lr': 0.00012667151006330983, 'lambda_val': 0.0029444127697785846, 'batch_size': 833, 'optimizer': 'Adam'}.
2026-05-23 02:03:55,161 - experiment_functions - INFO - Early stopping at epoch 900. Best Metrics: (0.03478033616413933, 0.02057377049180328, 0.030781274293327335)
2026-05-23 02:03:55,260 - optuna.study.study - INFO - Trial 283 finished with values: [0.03478033616413933, 0.02057377049180328, 0.030781274293327335] and parameters: {'n_layers': 1, 'embedding_dim': 64, 'lr': 0.0022564826852050435, 'lambda_val': 3.7205125829824535e-06, 'batch_size': 728, 'optimizer': 'Adam'}.
2026-05-23 02:03:59,174 - experiment_functions - INFO - Early stopping at epoch 1100. Best Metrics: (0.031283124756982694, 0.01852459016393443, 0.02929967299906003)
2026-05-23 02:03:59,252 - optuna.study.study - INFO - Trial 284 finished with values: [0.031283124756982694, 0.01852459016393443, 0.02929967299906003] and parameters: {'n_layers': 1, 'embedding_dim': 256, 'lr': 0.0006111868479200038, 'lambda_val': 0.00038573936819964353, 'batch_size': 1553, 'optimizer': 'RMSprop'}.
2026-05-23 02:04:06,224 - experiment_functions - INFO - Early stopping at epoch 2100. Best Metrics: (0.029983326037358444, 0.016229508196721313, 0.026541024217735545)
2026-05-23 02:04:06,318 - optuna.study.study - INFO - Trial 285 finished with values: [0.029983326037358444, 0.016229508196721313, 0.026541024217735545] and parameters: {'n_layers': 3, 'embedding_dim': 128, 'lr': 0.0001615556274201916, 'lambda_val': 3.7205125829824535e-06, 'batch_size': 1985, 'optimizer': 'RMSprop'}.
2026-05-23 02:04:18,807 - optuna.study.study - INFO - Trial 286 finished with values: [0.029332743662995618, 0.01672131147540984, 0.025126753509781406] and parameters: {'n_layers': 3, 'embedding_dim': 64, 'lr': 0.000171992203307018, 'lambda_val': 2.2024563054207274e-05, 'batch_size': 733, 'optimizer': 'Adam'}.
2026-05-23 02:04:30,706 - optuna.study.study - INFO - Trial 287 finished with values: [0.016892085162601565, 0.012704918032786885, 0.01676104180104204] and parameters: {'n_layers': 3, 'embedding_dim': 64, 'lr': 0.00012667151006330983, 'lambda_val': 0.0029444127697785846, 'batch_size': 1475, 'optimizer': 'Adam'}.
2026-05-23 02:04:34,385 - experiment_functions - INFO - Early stopping at epoch 750. Best Metrics: (0.038740026087362746, 0.020655737704918034, 0.031241033909407405)
2026-05-23 02:04:34,501 - optuna.study.study - INFO - Trial 288 finished with values: [0.038740026087362746, 0.020655737704918034, 0.031241033909407405] and parameters: {'n_layers': 3, 'embedding_dim': 256, 'lr': 0.0006111868479200038, 'lambda_val': 0.0002372391296934162, 'batch_size': 1493, 'optimizer': 'Adam'}.
2026-05-23 02:04:37,672 - experiment_functions - INFO - Early stopping at epoch 650. Best Metrics: (0.028052125065001238, 0.017295081967213115, 0.026627316068636706)
2026-05-23 02:04:37,747 - optuna.study.study - INFO - Trial 289 finished with values: [0.028052125065001238, 0.017295081967213115, 0.026627316068636706] and parameters: {'n_layers': 3, 'embedding_dim': 64, 'lr': 0.0020363221304348245, 'lambda_val': 3.7205125829824535e-06, 'batch_size': 733, 'optimizer': 'Adam'}.
2026-05-23 02:04:42,151 - experiment_functions - INFO - Early stopping at epoch 1300. Best Metrics: (0.03428101671856381, 0.020737704918032788, 0.031175252563273553)
2026-05-23 02:04:42,580 - optuna.study.study - INFO - Trial 290 finished with values: [0.03428101671856381, 0.020737704918032788, 0.031175252563273553] and parameters: {'n_layers': 2, 'embedding_dim': 128, 'lr': 0.0006111868479200038, 'lambda_val': 2.2024563054207274e-05, 'batch_size': 728, 'optimizer': 'Adam'}.
2026-05-23 02:04:50,597 - experiment_functions - INFO - Early stopping at epoch 3000. Best Metrics: (0.03241362862774471, 0.018360655737704918, 0.028043117952664093)
2026-05-23 02:04:50,696 - optuna.study.study - INFO - Trial 291 finished with values: [0.03241362862774471, 0.018360655737704918, 0.028043117952664093] and parameters: {'n_layers': 3, 'embedding_dim': 64, 'lr': 0.0002669734398444981, 'lambda_val': 2.2024563054207274e-05, 'batch_size': 733, 'optimizer': 'Adam'}.
2026-05-23 02:04:59,271 - experiment_functions - INFO - Early stopping at epoch 2450. Best Metrics: (0.03545900026339221, 0.019672131147540985, 0.02832521035983899)
2026-05-23 02:04:59,967 - optuna.study.study - INFO - Trial 292 finished with values: [0.03545900026339221, 0.019672131147540985, 0.02832521035983899] and parameters: {'n_layers': 2, 'embedding_dim': 256, 'lr': 0.0002669734398444981, 'lambda_val': 1.901210707193677e-05, 'batch_size': 1759, 'optimizer': 'Adam'}.
2026-05-23 02:05:06,577 - experiment_functions - INFO - Early stopping at epoch 1650. Best Metrics: (0.0019966831827819545, 0.001639344262295082, 0.002267832697374731)
2026-05-23 02:05:06,665 - optuna.study.study - INFO - Trial 293 finished with values: [0.0019966831827819545, 0.001639344262295082, 0.002267832697374731] and parameters: {'n_layers': 3, 'embedding_dim': 256, 'lr': 1.4115079947008275e-05, 'lambda_val': 3.317665133673459e-05, 'batch_size': 728, 'optimizer': 'Adam'}.
2026-05-23 02:05:09,106 - experiment_functions - INFO - Early stopping at epoch 700. Best Metrics: (0.0315804426026383, 0.018032786885245903, 0.02785781945696523)
2026-05-23 02:05:09,217 - optuna.study.study - INFO - Trial 294 finished with values: [0.0315804426026383, 0.018032786885245903, 0.02785781945696523] and parameters: {'n_layers': 3, 'embedding_dim': 64, 'lr': 0.0018860187490457373, 'lambda_val': 0.0004434231025609452, 'batch_size': 1003, 'optimizer': 'Adam'}.
2026-05-23 02:05:11,269 - experiment_functions - INFO - Early stopping at epoch 500. Best Metrics: (0.002076314684188918, 0.0013934426229508198, 0.001716618836345288)
2026-05-23 02:05:11,350 - optuna.study.study - INFO - Trial 295 finished with values: [0.002076314684188918, 0.0013934426229508198, 0.001716618836345288] and parameters: {'n_layers': 1, 'embedding_dim': 128, 'lr': 0.0020363221304348245, 'lambda_val': 0.0017105841747060543, 'batch_size': 2893, 'optimizer': 'SGD'}.
2026-05-23 02:05:14,126 - experiment_functions - INFO - Early stopping at epoch 850. Best Metrics: (0.03598871848558362, 0.019262295081967213, 0.032542874938566245)
2026-05-23 02:05:14,222 - optuna.study.study - INFO - Trial 296 finished with values: [0.03598871848558362, 0.019262295081967213, 0.032542874938566245] and parameters: {'n_layers': 1, 'embedding_dim': 96, 'lr': 0.0013488534539100193, 'lambda_val': 0.000344753291567706, 'batch_size': 2033, 'optimizer': 'Adam'}.
2026-05-23 02:05:16,836 - experiment_functions - INFO - Early stopping at epoch 750. Best Metrics: (0.03329361465103322, 0.017459016393442623, 0.027484592602144864)
2026-05-23 02:05:16,927 - optuna.study.study - INFO - Trial 297 finished with values: [0.03329361465103322, 0.017459016393442623, 0.027484592602144864] and parameters: {'n_layers': 3, 'embedding_dim': 64, 'lr': 0.0013488534539100193, 'lambda_val': 3.2250899740263746e-06, 'batch_size': 733, 'optimizer': 'Adam'}.
2026-05-23 02:05:19,836 - experiment_functions - INFO - Early stopping at epoch 850. Best Metrics: (0.031014511776626823, 0.01918032786885246, 0.028425624869810946)
2026-05-23 02:05:20,358 - optuna.study.study - INFO - Trial 298 finished with values: [0.031014511776626823, 0.01918032786885246, 0.028425624869810946] and parameters: {'n_layers': 3, 'embedding_dim': 96, 'lr': 0.0006111868479200038, 'lambda_val': 0.0029444127697785846, 'batch_size': 728, 'optimizer': 'Adam'}.
2026-05-23 02:05:36,775 - optuna.study.study - INFO - Trial 299 finished with values: [0.028391516777170587, 0.017704918032786888, 0.024631299783043414] and parameters: {'n_layers': 3, 'embedding_dim': 256, 'lr': 0.00012667151006330983, 'lambda_val': 0.0029444127697785846, 'batch_size': 2638, 'optimizer': 'Adam'}.
2026-05-23 02:05:36,790 - root - INFO - Selected Trial 55 based on Max NDCG: 0.0348
2026-05-23 02:05:36,790 - root - INFO - Associated Recall: 0.0346
2026-05-23 02:05:36,790 - experiment_functions - INFO - Training the best model ... for e_100K_1c1dcs_strict_rand4
2026-05-23 02:05:38,562 - experiment_functions - INFO - Early stopping at epoch 800. Best Metrics: (0.03468009971735299, 0.019344262295081967, 0.030512257380351297)
2026-05-23 02:05:38,655 - root - INFO -   **** Training e_100K_1c1dcs_strict_rand5
2026-05-23 02:05:38,658 - root - INFO -   **** Getting 7229/81200 random edges
2026-05-23 02:05:38,755 - optuna.storages._rdb.storage - INFO - A new study created in RDB with name: Study_e_100K_1c1dcs_strict_rand5
2026-05-23 02:05:51,152 - optuna.study.study - INFO - Trial 0 finished with values: [0.00883794661946882, 0.00639344262295082, 0.008773980850274218] and parameters: {'n_layers': 3, 'embedding_dim': 128, 'lr': 4.87885568543097e-05, 'lambda_val': 2.9618497126488523e-06, 'batch_size': 2730, 'optimizer': 'RMSprop'}.
2026-05-23 02:05:53,447 - experiment_functions - INFO - Early stopping at epoch 500. Best Metrics: (0.0027395230755886493, 0.001639344262295082, 0.002186398311037873)
2026-05-23 02:05:53,537 - optuna.study.study - INFO - Trial 1 finished with values: [0.0027395230755886493, 0.001639344262295082, 0.002186398311037873] and parameters: {'n_layers': 2, 'embedding_dim': 256, 'lr': 2.866856018175102e-05, 'lambda_val': 3.844865377767095e-06, 'batch_size': 524, 'optimizer': 'SGD'}.
2026-05-23 02:05:55,658 - experiment_functions - INFO - Early stopping at epoch 500. Best Metrics: (0.0015965019939950564, 0.0013934426229508198, 0.0015919139861625905)
2026-05-23 02:05:55,749 - optuna.study.study - INFO - Trial 2 finished with values: [0.0015965019939950564, 0.0013934426229508198, 0.0015919139861625905] and parameters: {'n_layers': 2, 'embedding_dim': 32, 'lr': 1.6370999883720367e-05, 'lambda_val': 0.04860503371339249, 'batch_size': 1646, 'optimizer': 'SGD'}.
2026-05-23 02:06:05,353 - optuna.study.study - INFO - Trial 3 finished with values: [0.005072520527737552, 0.003770491803278689, 0.005962200717598099] and parameters: {'n_layers': 1, 'embedding_dim': 32, 'lr': 6.663330287409543e-05, 'lambda_val': 2.136269763775958e-06, 'batch_size': 3665, 'optimizer': 'RMSprop'}.
2026-05-23 02:06:08,315 - experiment_functions - INFO - Early stopping at epoch 650. Best Metrics: (0.019411949595609764, 0.012459016393442624, 0.01926862176058526)
2026-05-23 02:06:08,410 - optuna.study.study - INFO - Trial 4 finished with values: [0.019411949595609764, 0.012459016393442624, 0.01926862176058526] and parameters: {'n_layers': 2, 'embedding_dim': 256, 'lr': 0.003012176927562537, 'lambda_val': 0.0004959813913081047, 'batch_size': 2679, 'optimizer': 'RMSprop'}.
2026-05-23 02:06:10,852 - experiment_functions - INFO - Early stopping at epoch 700. Best Metrics: (0.03274653925389343, 0.019672131147540985, 0.03245603030666285)
2026-05-23 02:06:10,940 - optuna.study.study - INFO - Trial 5 finished with values: [0.03274653925389343, 0.019672131147540985, 0.03245603030666285] and parameters: {'n_layers': 3, 'embedding_dim': 64, 'lr': 0.0010193114088728706, 'lambda_val': 0.003734260471985348, 'batch_size': 1698, 'optimizer': 'Adam'}.
2026-05-23 02:06:12,950 - experiment_functions - INFO - Early stopping at epoch 500. Best Metrics: (0.0029046131600478924, 0.002213114754098361, 0.003203155142243739)
2026-05-23 02:06:13,029 - optuna.study.study - INFO - Trial 6 finished with values: [0.0029046131600478924, 0.002213114754098361, 0.003203155142243739] and parameters: {'n_layers': 1, 'embedding_dim': 96, 'lr': 0.004251456926748961, 'lambda_val': 0.0008703400037511266, 'batch_size': 2895, 'optimizer': 'SGD'}.
2026-05-23 02:06:15,160 - experiment_functions - INFO - Early stopping at epoch 550. Best Metrics: (0.0018400946532491319, 0.001639344262295082, 0.002249292401747744)
2026-05-23 02:06:15,253 - optuna.study.study - INFO - Trial 7 finished with values: [0.0018400946532491319, 0.001639344262295082, 0.002249292401747744] and parameters: {'n_layers': 2, 'embedding_dim': 96, 'lr': 3.346156661717391e-05, 'lambda_val': 0.03626174005876648, 'batch_size': 863, 'optimizer': 'RMSprop'}.
2026-05-23 02:06:27,469 - optuna.study.study - INFO - Trial 8 finished with values: [0.016674612481308766, 0.011885245901639344, 0.017089328023879916] and parameters: {'n_layers': 1, 'embedding_dim': 256, 'lr': 0.00011089595098502456, 'lambda_val': 0.01380676127429418, 'batch_size': 3441, 'optimizer': 'RMSprop'}.
2026-05-23 02:06:34,202 - experiment_functions - INFO - Early stopping at epoch 2400. Best Metrics: (0.001334724658996867, 0.0018852459016393446, 0.0024386023400806713)
2026-05-23 02:06:34,292 - optuna.study.study - INFO - Trial 9 finished with values: [0.001334724658996867, 0.0018852459016393446, 0.0024386023400806713] and parameters: {'n_layers': 1, 'embedding_dim': 96, 'lr': 3.361312250780337e-05, 'lambda_val': 0.001993315555156626, 'batch_size': 2766, 'optimizer': 'RMSprop'}.
2026-05-23 02:06:46,626 - optuna.study.study - INFO - Trial 10 finished with values: [0.020085427881197958, 0.012540983606557378, 0.018666818933132927] and parameters: {'n_layers': 2, 'embedding_dim': 128, 'lr': 0.00010788024120426728, 'lambda_val': 0.0003977734214389728, 'batch_size': 3213, 'optimizer': 'Adam'}.
2026-05-23 02:06:48,859 - experiment_functions - INFO - Early stopping at epoch 500. Best Metrics: (0.002420506311686159, 0.0014754098360655738, 0.0017776851780301045)
2026-05-23 02:06:48,944 - optuna.study.study - INFO - Trial 11 finished with values: [0.002420506311686159, 0.0014754098360655738, 0.0017776851780301045] and parameters: {'n_layers': 1, 'embedding_dim': 256, 'lr': 0.002427758503321885, 'lambda_val': 3.7460575122560327e-06, 'batch_size': 2809, 'optimizer': 'SGD'}.
2026-05-23 02:06:51,921 - experiment_functions - INFO - Early stopping at epoch 900. Best Metrics: (0.002578835213908355, 0.0014754098360655738, 0.002308016586134902)
2026-05-23 02:06:52,018 - optuna.study.study - INFO - Trial 12 finished with values: [0.002578835213908355, 0.0014754098360655738, 0.002308016586134902] and parameters: {'n_layers': 1, 'embedding_dim': 96, 'lr': 0.05021331045075244, 'lambda_val': 7.24991630997103e-05, 'batch_size': 1698, 'optimizer': 'SGD'}.
2026-05-23 02:06:58,517 - experiment_functions - INFO - Early stopping at epoch 1700. Best Metrics: (0.01135687994588855, 0.007295081967213115, 0.010482162486782692)
2026-05-23 02:06:58,609 - optuna.study.study - INFO - Trial 13 finished with values: [0.01135687994588855, 0.007295081967213115, 0.010482162486782692] and parameters: {'n_layers': 4, 'embedding_dim': 128, 'lr': 0.011385784020717018, 'lambda_val': 1.6024291339987423e-06, 'batch_size': 2759, 'optimizer': 'Adam'}.
2026-05-23 02:07:00,633 - experiment_functions - INFO - Early stopping at epoch 500. Best Metrics: (0.0023476233543784975, 0.0025409836065573774, 0.002797026831783243)
2026-05-23 02:07:00,717 - optuna.study.study - INFO - Trial 14 finished with values: [0.0023476233543784975, 0.0025409836065573774, 0.002797026831783243] and parameters: {'n_layers': 1, 'embedding_dim': 128, 'lr': 1.0269988621128265e-05, 'lambda_val': 2.2416813493374988e-05, 'batch_size': 1248, 'optimizer': 'SGD'}.
2026-05-23 02:07:03,277 - experiment_functions - INFO - Early stopping at epoch 550. Best Metrics: (0.022605830918003632, 0.01344262295081967, 0.01845519816368562)
2026-05-23 02:07:03,367 - optuna.study.study - INFO - Trial 15 finished with values: [0.022605830918003632, 0.01344262295081967, 0.01845519816368562] and parameters: {'n_layers': 2, 'embedding_dim': 256, 'lr': 0.01140479989462853, 'lambda_val': 0.0012175795951631463, 'batch_size': 1786, 'optimizer': 'Adam'}.
2026-05-23 02:07:17,067 - experiment_functions - INFO - Early stopping at epoch 3650. Best Metrics: (0.006165322072887699, 0.004918032786885246, 0.007427006434819953)
2026-05-23 02:07:17,798 - optuna.study.study - INFO - Trial 16 finished with values: [0.006165322072887699, 0.004918032786885246, 0.007427006434819953] and parameters: {'n_layers': 2, 'embedding_dim': 96, 'lr': 5.554365750728636e-05, 'lambda_val': 0.015057926346698529, 'batch_size': 4068, 'optimizer': 'RMSprop'}.
2026-05-23 02:07:20,081 - experiment_functions - INFO - Early stopping at epoch 500. Best Metrics: (0.0013069644226343239, 0.0017213114754098357, 0.0022503958443799168)
2026-05-23 02:07:20,172 - optuna.study.study - INFO - Trial 17 finished with values: [0.0013069644226343239, 0.0017213114754098357, 0.0022503958443799168] and parameters: {'n_layers': 4, 'embedding_dim': 96, 'lr': 2.4424835217145386e-05, 'lambda_val': 0.02488729211731946, 'batch_size': 1075, 'optimizer': 'SGD'}.
2026-05-23 02:07:23,075 - experiment_functions - INFO - Early stopping at epoch 500. Best Metrics: (0.0034829350345305906, 0.0017213114754098362, 0.002332851571280983)
2026-05-23 02:07:23,208 - optuna.study.study - INFO - Trial 18 finished with values: [0.0034829350345305906, 0.0017213114754098362, 0.002332851571280983] and parameters: {'n_layers': 3, 'embedding_dim': 256, 'lr': 0.003719648469234652, 'lambda_val': 1.7029222948570324e-06, 'batch_size': 1805, 'optimizer': 'SGD'}.
2026-05-23 02:07:25,483 - experiment_functions - INFO - Early stopping at epoch 500. Best Metrics: (0.0028573138486476103, 0.0020491803278688526, 0.002450037386478676)
2026-05-23 02:07:25,582 - optuna.study.study - INFO - Trial 19 finished with values: [0.0028573138486476103, 0.0020491803278688526, 0.002450037386478676] and parameters: {'n_layers': 3, 'embedding_dim': 128, 'lr': 0.0009556468953438958, 'lambda_val': 0.00939648690917786, 'batch_size': 3338, 'optimizer': 'SGD'}.
2026-05-23 02:07:28,060 - experiment_functions - INFO - Early stopping at epoch 600. Best Metrics: (0.025160707372125682, 0.01418032786885246, 0.021256716398814268)
2026-05-23 02:07:28,199 - optuna.study.study - INFO - Trial 20 finished with values: [0.025160707372125682, 0.01418032786885246, 0.021256716398814268] and parameters: {'n_layers': 3, 'embedding_dim': 64, 'lr': 0.003779700217577169, 'lambda_val': 0.0005709667211110341, 'batch_size': 1258, 'optimizer': 'Adam'}.
2026-05-23 02:07:30,388 - experiment_functions - INFO - Early stopping at epoch 550. Best Metrics: (0.0124157439781583, 0.007868852459016393, 0.011640130371517855)
2026-05-23 02:07:30,466 - optuna.study.study - INFO - Trial 21 finished with values: [0.0124157439781583, 0.007868852459016393, 0.011640130371517855] and parameters: {'n_layers': 1, 'embedding_dim': 128, 'lr': 0.05671137520020283, 'lambda_val': 1.1655205445930693e-06, 'batch_size': 1412, 'optimizer': 'RMSprop'}.
2026-05-23 02:07:32,621 - experiment_functions - INFO - Early stopping at epoch 500. Best Metrics: (0.0023473419968883134, 0.0018032786885245904, 0.0028417363566033103)
2026-05-23 02:07:32,707 - optuna.study.study - INFO - Trial 22 finished with values: [0.0023473419968883134, 0.0018032786885245904, 0.0028417363566033103] and parameters: {'n_layers': 2, 'embedding_dim': 128, 'lr': 2.377051068836772e-05, 'lambda_val': 3.300313206864679e-06, 'batch_size': 2651, 'optimizer': 'SGD'}.
2026-05-23 02:07:43,703 - optuna.study.study - INFO - Trial 23 finished with values: [0.007203230079260204, 0.005081967213114754, 0.008693429472472857] and parameters: {'n_layers': 2, 'embedding_dim': 32, 'lr': 9.917692877856437e-05, 'lambda_val': 7.3050833305021745e-06, 'batch_size': 611, 'optimizer': 'RMSprop'}.
2026-05-23 02:07:45,739 - experiment_functions - INFO - Early stopping at epoch 500. Best Metrics: (0.005842175037244604, 0.004262295081967214, 0.006445067249796575)
2026-05-23 02:07:46,131 - optuna.study.study - INFO - Trial 24 finished with values: [0.005842175037244604, 0.004262295081967214, 0.006445067249796575] and parameters: {'n_layers': 2, 'embedding_dim': 64, 'lr': 0.015353409156564976, 'lambda_val': 0.08877022780038901, 'batch_size': 528, 'optimizer': 'RMSprop'}.
2026-05-23 02:07:57,273 - experiment_functions - INFO - Early stopping at epoch 3050. Best Metrics: (0.007985337908779797, 0.0069672131147540985, 0.008531685009202938)
2026-05-23 02:07:58,342 - optuna.study.study - INFO - Trial 25 finished with values: [0.007985337908779797, 0.0069672131147540985, 0.008531685009202938] and parameters: {'n_layers': 2, 'embedding_dim': 256, 'lr': 0.00018178347106692703, 'lambda_val': 0.07920199067891599, 'batch_size': 2546, 'optimizer': 'Adam'}.
2026-05-23 02:08:01,135 - experiment_functions - INFO - Early stopping at epoch 750. Best Metrics: (0.004554902669000575, 0.004836065573770492, 0.006485746475379772)
2026-05-23 02:08:01,927 - optuna.study.study - INFO - Trial 26 finished with values: [0.004554902669000575, 0.004836065573770492, 0.006485746475379772] and parameters: {'n_layers': 2, 'embedding_dim': 64, 'lr': 0.010855402575129876, 'lambda_val': 0.05156477046092871, 'batch_size': 2369, 'optimizer': 'RMSprop'}.
2026-05-23 02:08:05,047 - experiment_functions - INFO - Early stopping at epoch 900. Best Metrics: (0.0025645272400615466, 0.002295081967213115, 0.00319418614571193)
2026-05-23 02:08:05,804 - optuna.study.study - INFO - Trial 27 finished with values: [0.0025645272400615466, 0.002295081967213115, 0.00319418614571193] and parameters: {'n_layers': 2, 'embedding_dim': 128, 'lr': 0.020843658636834694, 'lambda_val': 1.0733117407369128e-05, 'batch_size': 2080, 'optimizer': 'SGD'}.
2026-05-23 02:08:17,085 - experiment_functions - INFO - Early stopping at epoch 1800. Best Metrics: (0.03750970598451771, 0.01991803278688525, 0.03194423665731512)
2026-05-23 02:08:17,800 - optuna.study.study - INFO - Trial 28 finished with values: [0.03750970598451771, 0.01991803278688525, 0.03194423665731512] and parameters: {'n_layers': 1, 'embedding_dim': 96, 'lr': 0.0004474461075792833, 'lambda_val': 8.858691676718628e-05, 'batch_size': 2886, 'optimizer': 'RMSprop'}.
2026-05-23 02:08:20,652 - experiment_functions - INFO - Early stopping at epoch 700. Best Metrics: (0.009182285907721051, 0.005901639344262294, 0.008297280318657424)
