2026-05-23 00:41:40,602 - optuna.study.study - INFO - Trial 254 finished with values: [0.036461425691256086, 0.020409836065573773, 0.030299154318266807] and parameters: {'n_layers': 2, 'embedding_dim': 96, 'lr': 0.0005010322067376279, 'lambda_val': 7.591109531033929e-05, 'batch_size': 1675, 'optimizer': 'RMSprop'}.
2026-05-23 00:41:43,204 - experiment_functions - INFO - Early stopping at epoch 600. Best Metrics: (0.022063324584587103, 0.013114754098360656, 0.01977163720626823)
2026-05-23 00:41:43,301 - optuna.study.study - INFO - Trial 255 finished with values: [0.022063324584587103, 0.013114754098360656, 0.01977163720626823] and parameters: {'n_layers': 3, 'embedding_dim': 64, 'lr': 0.0011286476195635738, 'lambda_val': 0.00551038486085562, 'batch_size': 2560, 'optimizer': 'RMSprop'}.
2026-05-23 00:41:45,683 - experiment_functions - INFO - Early stopping at epoch 550. Best Metrics: (0.027619413023988022, 0.014344262295081968, 0.02116276033695807)
2026-05-23 00:41:45,823 - optuna.study.study - INFO - Trial 256 finished with values: [0.027619413023988022, 0.014344262295081968, 0.02116276033695807] and parameters: {'n_layers': 3, 'embedding_dim': 64, 'lr': 0.009421736003538229, 'lambda_val': 7.591109531033929e-05, 'batch_size': 1369, 'optimizer': 'Adam'}.
2026-05-23 00:41:52,505 - experiment_functions - INFO - Early stopping at epoch 900. Best Metrics: (0.02452928268903829, 0.016885245901639347, 0.024429362589832145)
2026-05-23 00:41:52,584 - optuna.study.study - INFO - Trial 257 finished with values: [0.02452928268903829, 0.016885245901639347, 0.024429362589832145] and parameters: {'n_layers': 1, 'embedding_dim': 128, 'lr': 0.0013882664669042468, 'lambda_val': 0.00011624026828970741, 'batch_size': 3264, 'optimizer': 'RMSprop'}.
2026-05-23 00:42:06,281 - experiment_functions - INFO - Early stopping at epoch 3500. Best Metrics: (0.028925061745163176, 0.01581967213114754, 0.024848209037302213)
2026-05-23 00:42:06,362 - optuna.study.study - INFO - Trial 258 finished with values: [0.028925061745163176, 0.01581967213114754, 0.024848209037302213] and parameters: {'n_layers': 1, 'embedding_dim': 32, 'lr': 0.0003566717415961628, 'lambda_val': 0.0016955781212138713, 'batch_size': 2778, 'optimizer': 'Adam'}.
2026-05-23 00:42:10,578 - experiment_functions - INFO - Early stopping at epoch 800. Best Metrics: (0.031505002014775255, 0.01721311475409836, 0.0280505767452439)
2026-05-23 00:42:11,086 - optuna.study.study - INFO - Trial 259 finished with values: [0.031505002014775255, 0.01721311475409836, 0.0280505767452439] and parameters: {'n_layers': 3, 'embedding_dim': 96, 'lr': 0.0005010322067376279, 'lambda_val': 5.790863900505623e-06, 'batch_size': 2834, 'optimizer': 'RMSprop'}.
2026-05-23 00:42:14,727 - experiment_functions - INFO - Early stopping at epoch 750. Best Metrics: (0.030636056847705456, 0.017868852459016395, 0.026436882353617283)
2026-05-23 00:42:15,596 - optuna.study.study - INFO - Trial 260 finished with values: [0.030636056847705456, 0.017868852459016395, 0.026436882353617283] and parameters: {'n_layers': 2, 'embedding_dim': 128, 'lr': 0.000568575874483035, 'lambda_val': 0.006734268474296521, 'batch_size': 1457, 'optimizer': 'RMSprop'}.
2026-05-23 00:42:21,552 - experiment_functions - INFO - Early stopping at epoch 1300. Best Metrics: (0.024925032577226714, 0.01655737704918033, 0.023680248864914537)
2026-05-23 00:42:22,980 - optuna.study.study - INFO - Trial 261 finished with values: [0.024925032577226714, 0.01655737704918033, 0.023680248864914537] and parameters: {'n_layers': 2, 'embedding_dim': 256, 'lr': 0.00029826529867114525, 'lambda_val': 0.010543195562282087, 'batch_size': 1243, 'optimizer': 'Adam'}.
2026-05-23 00:42:27,310 - experiment_functions - INFO - Early stopping at epoch 900. Best Metrics: (0.02904123560298022, 0.01918032786885246, 0.02922540743855528)
2026-05-23 00:42:27,492 - optuna.study.study - INFO - Trial 262 finished with values: [0.02904123560298022, 0.01918032786885246, 0.02922540743855528] and parameters: {'n_layers': 2, 'embedding_dim': 96, 'lr': 0.0007184162715631311, 'lambda_val': 0.00011624026828970741, 'batch_size': 2491, 'optimizer': 'Adam'}.
2026-05-23 00:42:32,517 - experiment_functions - INFO - Early stopping at epoch 1150. Best Metrics: (0.033031680936789286, 0.017295081967213115, 0.0271785991639138)
2026-05-23 00:42:33,098 - optuna.study.study - INFO - Trial 263 finished with values: [0.033031680936789286, 0.017295081967213115, 0.0271785991639138] and parameters: {'n_layers': 2, 'embedding_dim': 64, 'lr': 0.0007184162715631311, 'lambda_val': 0.001981990620864252, 'batch_size': 1369, 'optimizer': 'Adam'}.
2026-05-23 00:42:37,674 - experiment_functions - INFO - Early stopping at epoch 950. Best Metrics: (0.032386872230714854, 0.01901639344262295, 0.02915307944639134)
2026-05-23 00:42:37,758 - optuna.study.study - INFO - Trial 264 finished with values: [0.032386872230714854, 0.01901639344262295, 0.02915307944639134] and parameters: {'n_layers': 2, 'embedding_dim': 256, 'lr': 0.0003566717415961628, 'lambda_val': 0.00011624026828970741, 'batch_size': 1675, 'optimizer': 'RMSprop'}.
2026-05-23 00:42:53,610 - optuna.study.study - INFO - Trial 265 finished with values: [0.027408257571786252, 0.014508196721311479, 0.022272591921143923] and parameters: {'n_layers': 2, 'embedding_dim': 32, 'lr': 0.00022079369433681775, 'lambda_val': 5.790863900505623e-06, 'batch_size': 1457, 'optimizer': 'RMSprop'}.
2026-05-23 00:42:56,561 - experiment_functions - INFO - Early stopping at epoch 550. Best Metrics: (0.015131635517925348, 0.01016393442622951, 0.013383136907324794)
2026-05-23 00:42:57,144 - optuna.study.study - INFO - Trial 266 finished with values: [0.015131635517925348, 0.01016393442622951, 0.013383136907324794] and parameters: {'n_layers': 3, 'embedding_dim': 96, 'lr': 0.0029335455314602995, 'lambda_val': 0.00551038486085562, 'batch_size': 1312, 'optimizer': 'RMSprop'}.
2026-05-23 00:43:00,668 - experiment_functions - INFO - Early stopping at epoch 700. Best Metrics: (0.024557338454759648, 0.01655737704918033, 0.022895188475176267)
2026-05-23 00:43:01,019 - optuna.study.study - INFO - Trial 267 finished with values: [0.024557338454759648, 0.01655737704918033, 0.022895188475176267] and parameters: {'n_layers': 3, 'embedding_dim': 64, 'lr': 0.0009422878098805214, 'lambda_val': 0.0002603879699437796, 'batch_size': 1833, 'optimizer': 'RMSprop'}.
2026-05-23 00:43:22,240 - optuna.study.study - INFO - Trial 268 finished with values: [0.03087132963284517, 0.017377049180327873, 0.027307687415014156] and parameters: {'n_layers': 1, 'embedding_dim': 96, 'lr': 0.00029826529867114525, 'lambda_val': 2.9099669967589168e-06, 'batch_size': 1735, 'optimizer': 'Adam'}.
2026-05-23 00:43:25,810 - experiment_functions - INFO - Early stopping at epoch 700. Best Metrics: (0.03327356776705651, 0.018360655737704918, 0.02867635974845571)
2026-05-23 00:43:26,333 - optuna.study.study - INFO - Trial 269 finished with values: [0.03327356776705651, 0.018360655737704918, 0.02867635974845571] and parameters: {'n_layers': 2, 'embedding_dim': 256, 'lr': 0.0009422878098805214, 'lambda_val': 1.1997881499867485e-06, 'batch_size': 1861, 'optimizer': 'RMSprop'}.
2026-05-23 00:43:42,241 - optuna.study.study - INFO - Trial 270 finished with values: [0.03602318414561188, 0.018442622950819672, 0.028518301688597848] and parameters: {'n_layers': 2, 'embedding_dim': 64, 'lr': 0.0002242398424095658, 'lambda_val': 1.7207712053457044e-06, 'batch_size': 1533, 'optimizer': 'Adam'}.
2026-05-23 00:43:45,186 - experiment_functions - INFO - Early stopping at epoch 600. Best Metrics: (0.021477598808970082, 0.013114754098360656, 0.017509326867619485)
2026-05-23 00:43:45,284 - optuna.study.study - INFO - Trial 271 finished with values: [0.021477598808970082, 0.013114754098360656, 0.017509326867619485] and parameters: {'n_layers': 2, 'embedding_dim': 32, 'lr': 0.006707303428396144, 'lambda_val': 5.790863900505623e-06, 'batch_size': 1369, 'optimizer': 'Adam'}.
2026-05-23 00:43:51,335 - experiment_functions - INFO - Early stopping at epoch 1250. Best Metrics: (0.0256021170954645, 0.01377049180327869, 0.019475744906720393)
2026-05-23 00:43:52,571 - optuna.study.study - INFO - Trial 272 finished with values: [0.0256021170954645, 0.01377049180327869, 0.019475744906720393] and parameters: {'n_layers': 4, 'embedding_dim': 96, 'lr': 0.00029826529867114525, 'lambda_val': 5.790863900505623e-06, 'batch_size': 2834, 'optimizer': 'Adam'}.
2026-05-23 00:43:57,740 - experiment_functions - INFO - Early stopping at epoch 1100. Best Metrics: (0.030182843912129022, 0.018032786885245903, 0.026910199370476135)
2026-05-23 00:43:57,827 - optuna.study.study - INFO - Trial 273 finished with values: [0.030182843912129022, 0.018032786885245903, 0.026910199370476135] and parameters: {'n_layers': 2, 'embedding_dim': 96, 'lr': 0.0003566717415961628, 'lambda_val': 0.00551038486085562, 'batch_size': 2834, 'optimizer': 'RMSprop'}.
2026-05-23 00:44:13,003 - optuna.study.study - INFO - Trial 274 finished with values: [0.0047996618765180545, 0.004098360655737705, 0.00586599180933387] and parameters: {'n_layers': 2, 'embedding_dim': 64, 'lr': 7.086677956702455e-05, 'lambda_val': 0.0016955781212138713, 'batch_size': 1369, 'optimizer': 'Adam'}.
2026-05-23 00:44:21,513 - experiment_functions - INFO - Early stopping at epoch 1950. Best Metrics: (0.0339543849723253, 0.020737704918032788, 0.029984766661051713)
2026-05-23 00:44:21,598 - optuna.study.study - INFO - Trial 275 finished with values: [0.0339543849723253, 0.020737704918032788, 0.029984766661051713] and parameters: {'n_layers': 1, 'embedding_dim': 96, 'lr': 0.0003566717415961628, 'lambda_val': 0.006734268474296521, 'batch_size': 1541, 'optimizer': 'RMSprop'}.
2026-05-23 00:44:25,485 - experiment_functions - INFO - Early stopping at epoch 800. Best Metrics: (0.03036140480490174, 0.01655737704918033, 0.027048428365150614)
2026-05-23 00:44:25,585 - optuna.study.study - INFO - Trial 276 finished with values: [0.03036140480490174, 0.01655737704918033, 0.027048428365150614] and parameters: {'n_layers': 1, 'embedding_dim': 96, 'lr': 0.0013882664669042468, 'lambda_val': 1.1997881499867485e-06, 'batch_size': 2778, 'optimizer': 'Adam'}.
2026-05-23 00:44:40,093 - experiment_functions - INFO - Early stopping at epoch 3900. Best Metrics: (0.033315037098350375, 0.018442622950819672, 0.02950298751119402)
2026-05-23 00:44:40,378 - optuna.study.study - INFO - Trial 277 finished with values: [0.033315037098350375, 0.018442622950819672, 0.02950298751119402] and parameters: {'n_layers': 1, 'embedding_dim': 96, 'lr': 0.0003566717415961628, 'lambda_val': 0.00011624026828970741, 'batch_size': 1369, 'optimizer': 'Adam'}.
2026-05-23 00:44:43,781 - experiment_functions - INFO - Early stopping at epoch 700. Best Metrics: (0.03413114732220679, 0.018934426229508198, 0.027415289415914475)
2026-05-23 00:44:43,878 - optuna.study.study - INFO - Trial 278 finished with values: [0.03413114732220679, 0.018934426229508198, 0.027415289415914475] and parameters: {'n_layers': 1, 'embedding_dim': 96, 'lr': 0.0016072373570504854, 'lambda_val': 0.0065369214410388975, 'batch_size': 1040, 'optimizer': 'RMSprop'}.
2026-05-23 00:44:52,781 - experiment_functions - INFO - Early stopping at epoch 2250. Best Metrics: (0.02950717458406221, 0.017377049180327873, 0.027413906324915922)
2026-05-23 00:44:52,894 - optuna.study.study - INFO - Trial 279 finished with values: [0.02950717458406221, 0.017377049180327873, 0.027413906324915922] and parameters: {'n_layers': 2, 'embedding_dim': 64, 'lr': 0.0003566717415961628, 'lambda_val': 8.440860485092967e-06, 'batch_size': 1369, 'optimizer': 'Adam'}.
2026-05-23 00:44:56,422 - experiment_functions - INFO - Early stopping at epoch 700. Best Metrics: (0.008502856561059159, 0.005573770491803279, 0.008601812622393495)
2026-05-23 00:44:57,396 - optuna.study.study - INFO - Trial 280 finished with values: [0.008502856561059159, 0.005573770491803279, 0.008601812622393495] and parameters: {'n_layers': 2, 'embedding_dim': 256, 'lr': 0.04022763191236312, 'lambda_val': 0.00011624026828970741, 'batch_size': 573, 'optimizer': 'Adam'}.
2026-05-23 00:45:01,050 - experiment_functions - INFO - Early stopping at epoch 800. Best Metrics: (0.02968764890820098, 0.01737704918032787, 0.026028303736591513)
2026-05-23 00:45:01,555 - optuna.study.study - INFO - Trial 281 finished with values: [0.02968764890820098, 0.01737704918032787, 0.026028303736591513] and parameters: {'n_layers': 1, 'embedding_dim': 96, 'lr': 0.0013882664669042468, 'lambda_val': 0.006734268474296521, 'batch_size': 1541, 'optimizer': 'Adam'}.
2026-05-23 00:45:05,447 - experiment_functions - INFO - Early stopping at epoch 750. Best Metrics: (0.02782206124138662, 0.01639344262295082, 0.02672545872318509)
2026-05-23 00:45:05,535 - optuna.study.study - INFO - Trial 282 finished with values: [0.02782206124138662, 0.01639344262295082, 0.02672545872318509] and parameters: {'n_layers': 3, 'embedding_dim': 96, 'lr': 0.0005010322067376279, 'lambda_val': 0.005644424689055683, 'batch_size': 3898, 'optimizer': 'RMSprop'}.
2026-05-23 00:45:14,983 - experiment_functions - INFO - Early stopping at epoch 2450. Best Metrics: (0.035902451195498834, 0.018114754098360657, 0.030130206271640165)
2026-05-23 00:45:15,834 - optuna.study.study - INFO - Trial 283 finished with values: [0.035902451195498834, 0.018114754098360657, 0.030130206271640165] and parameters: {'n_layers': 2, 'embedding_dim': 128, 'lr': 0.00022079369433681775, 'lambda_val': 5.790863900505623e-06, 'batch_size': 3264, 'optimizer': 'RMSprop'}.
2026-05-23 00:45:22,590 - experiment_functions - INFO - Early stopping at epoch 1050. Best Metrics: (0.03032489410230535, 0.018114754098360657, 0.026573453923813824)
2026-05-23 00:45:23,199 - optuna.study.study - INFO - Trial 284 finished with values: [0.03032489410230535, 0.018114754098360657, 0.026573453923813824] and parameters: {'n_layers': 2, 'embedding_dim': 256, 'lr': 0.0005513489459732522, 'lambda_val': 0.0016955781212138713, 'batch_size': 1369, 'optimizer': 'Adam'}.
2026-05-23 00:45:38,635 - experiment_functions - INFO - Early stopping at epoch 2450. Best Metrics: (0.0349335797134028, 0.019344262295081967, 0.029307686935134324)
2026-05-23 00:45:38,928 - optuna.study.study - INFO - Trial 285 finished with values: [0.0349335797134028, 0.019344262295081967, 0.029307686935134324] and parameters: {'n_layers': 1, 'embedding_dim': 256, 'lr': 0.00029826529867114525, 'lambda_val': 2.9099669967589168e-06, 'batch_size': 2778, 'optimizer': 'Adam'}.
2026-05-23 00:45:50,937 - experiment_functions - INFO - Early stopping at epoch 3050. Best Metrics: (0.03619195416639968, 0.02180327868852459, 0.03085349512336441)
2026-05-23 00:45:51,184 - optuna.study.study - INFO - Trial 286 finished with values: [0.03619195416639968, 0.02180327868852459, 0.03085349512336441] and parameters: {'n_layers': 2, 'embedding_dim': 96, 'lr': 0.0002242398424095658, 'lambda_val': 0.00551038486085562, 'batch_size': 987, 'optimizer': 'Adam'}.
2026-05-23 00:45:54,225 - experiment_functions - INFO - Early stopping at epoch 550. Best Metrics: (0.018890896080072165, 0.014426229508196723, 0.01916159751855484)
2026-05-23 00:45:54,318 - optuna.study.study - INFO - Trial 287 finished with values: [0.018890896080072165, 0.014426229508196723, 0.01916159751855484] and parameters: {'n_layers': 2, 'embedding_dim': 256, 'lr': 0.0061889858125242486, 'lambda_val': 0.00900452452939523, 'batch_size': 2604, 'optimizer': 'Adam'}.
2026-05-23 00:46:01,214 - experiment_functions - INFO - Early stopping at epoch 1800. Best Metrics: (0.030226098432988218, 0.019426229508196724, 0.029103886438788886)
2026-05-23 00:46:02,064 - optuna.study.study - INFO - Trial 288 finished with values: [0.030226098432988218, 0.019426229508196724, 0.029103886438788886] and parameters: {'n_layers': 1, 'embedding_dim': 256, 'lr': 0.0005513489459732522, 'lambda_val': 0.00011624026828970741, 'batch_size': 1603, 'optimizer': 'Adam'}.
2026-05-23 00:46:08,732 - experiment_functions - INFO - Early stopping at epoch 1600. Best Metrics: (0.03483074673049202, 0.019426229508196724, 0.029539617148002385)
2026-05-23 00:46:08,829 - optuna.study.study - INFO - Trial 289 finished with values: [0.03483074673049202, 0.019426229508196724, 0.029539617148002385] and parameters: {'n_layers': 2, 'embedding_dim': 96, 'lr': 0.00029826529867114525, 'lambda_val': 5.790863900505623e-06, 'batch_size': 2834, 'optimizer': 'Adam'}.
2026-05-23 00:46:21,410 - experiment_functions - INFO - Early stopping at epoch 3250. Best Metrics: (0.027080767720640015, 0.016639344262295082, 0.026103131535906172)
2026-05-23 00:46:21,799 - optuna.study.study - INFO - Trial 290 finished with values: [0.027080767720640015, 0.016639344262295082, 0.026103131535906172] and parameters: {'n_layers': 2, 'embedding_dim': 96, 'lr': 0.00022079369433681775, 'lambda_val': 0.0016955781212138713, 'batch_size': 2923, 'optimizer': 'Adam'}.
2026-05-23 00:46:24,836 - experiment_functions - INFO - Early stopping at epoch 700. Best Metrics: (0.02892281039401923, 0.017295081967213115, 0.026349374427700703)
2026-05-23 00:46:24,944 - optuna.study.study - INFO - Trial 291 finished with values: [0.02892281039401923, 0.017295081967213115, 0.026349374427700703] and parameters: {'n_layers': 1, 'embedding_dim': 96, 'lr': 0.0016072373570504854, 'lambda_val': 8.440860485092967e-06, 'batch_size': 4039, 'optimizer': 'RMSprop'}.
2026-05-23 00:46:30,171 - experiment_functions - INFO - Early stopping at epoch 850. Best Metrics: (0.032145334336322974, 0.01762295081967213, 0.027720916804713166)
2026-05-23 00:46:30,265 - optuna.study.study - INFO - Trial 292 finished with values: [0.032145334336322974, 0.01762295081967213, 0.027720916804713166] and parameters: {'n_layers': 1, 'embedding_dim': 64, 'lr': 0.0016072373570504854, 'lambda_val': 0.00011624026828970741, 'batch_size': 2451, 'optimizer': 'Adam'}.
2026-05-23 00:46:34,617 - experiment_functions - INFO - Early stopping at epoch 1200. Best Metrics: (0.030620050298783216, 0.019344262295081967, 0.02751174196995402)
2026-05-23 00:46:34,720 - optuna.study.study - INFO - Trial 293 finished with values: [0.030620050298783216, 0.019344262295081967, 0.02751174196995402] and parameters: {'n_layers': 3, 'embedding_dim': 128, 'lr': 0.0003566717415961628, 'lambda_val': 0.00011624026828970741, 'batch_size': 1369, 'optimizer': 'RMSprop'}.
2026-05-23 00:46:40,801 - experiment_functions - INFO - Early stopping at epoch 1950. Best Metrics: (0.036058787227901505, 0.018770491803278687, 0.02842476314165465)
2026-05-23 00:46:40,892 - optuna.study.study - INFO - Trial 294 finished with values: [0.036058787227901505, 0.018770491803278687, 0.02842476314165465] and parameters: {'n_layers': 2, 'embedding_dim': 128, 'lr': 0.0002242398424095658, 'lambda_val': 0.00551038486085562, 'batch_size': 2834, 'optimizer': 'Adam'}.
2026-05-23 00:46:42,782 - experiment_functions - INFO - Early stopping at epoch 500. Best Metrics: (0.0025501399600924737, 0.002704918032786885, 0.0035049981056205297)
2026-05-23 00:46:42,917 - optuna.study.study - INFO - Trial 295 finished with values: [0.0025501399600924737, 0.002704918032786885, 0.0035049981056205297] and parameters: {'n_layers': 2, 'embedding_dim': 96, 'lr': 0.0016072373570504854, 'lambda_val': 9.404222607025974e-05, 'batch_size': 2068, 'optimizer': 'SGD'}.
2026-05-23 00:46:51,560 - experiment_functions - INFO - Early stopping at epoch 2750. Best Metrics: (0.03095232321129649, 0.018442622950819672, 0.028478016193657436)
2026-05-23 00:46:51,652 - optuna.study.study - INFO - Trial 296 finished with values: [0.03095232321129649, 0.018442622950819672, 0.028478016193657436] and parameters: {'n_layers': 1, 'embedding_dim': 256, 'lr': 0.0003566717415961628, 'lambda_val': 0.001981990620864252, 'batch_size': 1457, 'optimizer': 'Adam'}.
2026-05-23 00:47:03,675 - optuna.study.study - INFO - Trial 297 finished with values: [0.031326341858877525, 0.01754098360655738, 0.027348692803998282] and parameters: {'n_layers': 1, 'embedding_dim': 64, 'lr': 0.00029826529867114525, 'lambda_val': 0.00011907611003513393, 'batch_size': 1735, 'optimizer': 'RMSprop'}.
2026-05-23 00:47:13,345 - experiment_functions - INFO - Early stopping at epoch 3250. Best Metrics: (0.03590516422802835, 0.02057377049180328, 0.029406634995158998)
2026-05-23 00:47:14,339 - optuna.study.study - INFO - Trial 298 finished with values: [0.03590516422802835, 0.02057377049180328, 0.029406634995158998] and parameters: {'n_layers': 2, 'embedding_dim': 64, 'lr': 0.0002242398424095658, 'lambda_val': 4.416597544825473e-05, 'batch_size': 1369, 'optimizer': 'Adam'}.
2026-05-23 00:47:20,354 - experiment_functions - INFO - Early stopping at epoch 1350. Best Metrics: (0.03150548983839251, 0.018278688524590168, 0.029024262735665614)
2026-05-23 00:47:20,451 - optuna.study.study - INFO - Trial 299 finished with values: [0.03150548983839251, 0.018278688524590168, 0.029024262735665614] and parameters: {'n_layers': 2, 'embedding_dim': 256, 'lr': 0.0003566717415961628, 'lambda_val': 2.0395641111336252e-06, 'batch_size': 1457, 'optimizer': 'Adam'}.
2026-05-23 00:47:20,467 - root - INFO - Selected Trial 245 based on Max NDCG: 0.0340
2026-05-23 00:47:20,467 - root - INFO - Associated Recall: 0.0380
2026-05-23 00:47:20,467 - experiment_functions - INFO - Training the best model ... for e_100K_1c1dcs_strict_rand1
2026-05-23 00:47:23,184 - experiment_functions - INFO - Early stopping at epoch 800. Best Metrics: (0.032308803069439306, 0.018688524590163937, 0.02850640149610019)
2026-05-23 00:47:23,281 - root - INFO -   **** Training e_100K_1c1dcs_strict_rand2
2026-05-23 00:47:23,283 - root - INFO -   **** Getting 7229/81200 random edges
2026-05-23 00:47:23,376 - optuna.storages._rdb.storage - INFO - A new study created in RDB with name: Study_e_100K_1c1dcs_strict_rand2
