2026-05-22 23:36:07,205 - optuna.study.study - INFO - Trial 246 finished with values: [0.05886803151721847, 0.0389344262295082, 0.05496749158168382] and parameters: {'n_layers': 2, 'embedding_dim': 64, 'lr': 0.0032374955494066686, 'lambda_val': 1.0756980926958564e-05, 'batch_size': 874, 'optimizer': 'Adam'}.
2026-05-22 23:36:23,675 - optuna.study.study - INFO - Trial 247 finished with values: [0.0391516470824636, 0.024918032786885248, 0.03806197569543899] and parameters: {'n_layers': 2, 'embedding_dim': 128, 'lr': 8.638938560045799e-05, 'lambda_val': 4.1855561222722974e-06, 'batch_size': 1459, 'optimizer': 'Adam'}.
2026-05-22 23:36:39,907 - optuna.study.study - INFO - Trial 248 finished with values: [0.1050775547341428, 0.05368852459016393, 0.08954352130398685] and parameters: {'n_layers': 1, 'embedding_dim': 256, 'lr': 0.0002391583318230419, 'lambda_val': 7.613685556639934e-06, 'batch_size': 653, 'optimizer': 'Adam'}.
2026-05-22 23:36:53,706 - optuna.study.study - INFO - Trial 249 finished with values: [0.09479991403007268, 0.055901639344262295, 0.08631801555015227] and parameters: {'n_layers': 1, 'embedding_dim': 64, 'lr': 0.0002391583318230419, 'lambda_val': 4.1855561222722974e-06, 'batch_size': 3835, 'optimizer': 'RMSprop'}.
2026-05-22 23:37:05,074 - experiment_functions - INFO - Early stopping at epoch 1150. Best Metrics: (0.10858189092012173, 0.06114754098360655, 0.09569468412929069)
2026-05-22 23:37:05,747 - optuna.study.study - INFO - Trial 250 finished with values: [0.10858189092012173, 0.06114754098360655, 0.09569468412929069] and parameters: {'n_layers': 1, 'embedding_dim': 256, 'lr': 0.0005586191809811369, 'lambda_val': 0.0024512493288420334, 'batch_size': 2134, 'optimizer': 'Adam'}.
2026-05-22 23:37:14,588 - experiment_functions - INFO - Early stopping at epoch 1050. Best Metrics: (0.12737241272356642, 0.05942622950819672, 0.10364700382718406)
2026-05-22 23:37:14,765 - optuna.study.study - INFO - Trial 251 finished with values: [0.12737241272356642, 0.05942622950819672, 0.10364700382718406] and parameters: {'n_layers': 1, 'embedding_dim': 256, 'lr': 0.0005586191809811369, 'lambda_val': 5.505548987767001e-05, 'batch_size': 3643, 'optimizer': 'RMSprop'}.
2026-05-22 23:37:31,901 - optuna.study.study - INFO - Trial 252 finished with values: [0.004382199842132572, 0.004344262295081968, 0.006388148903207395] and parameters: {'n_layers': 1, 'embedding_dim': 256, 'lr': 4.7842950004117934e-05, 'lambda_val': 0.0001333811184810849, 'batch_size': 2536, 'optimizer': 'Adam'}.
2026-05-22 23:37:35,136 - experiment_functions - INFO - Early stopping at epoch 650. Best Metrics: (0.07735055826100866, 0.04836065573770492, 0.07639108380600207)
2026-05-22 23:37:35,282 - optuna.study.study - INFO - Trial 253 finished with values: [0.07735055826100866, 0.04836065573770492, 0.07639108380600207] and parameters: {'n_layers': 1, 'embedding_dim': 128, 'lr': 0.0032374955494066686, 'lambda_val': 0.004805532813491775, 'batch_size': 653, 'optimizer': 'Adam'}.
2026-05-22 23:37:44,219 - experiment_functions - INFO - Early stopping at epoch 2100. Best Metrics: (0.11271123099196252, 0.06163934426229507, 0.09821749879745083)
2026-05-22 23:37:44,884 - optuna.study.study - INFO - Trial 254 finished with values: [0.11271123099196252, 0.06163934426229507, 0.09821749879745083] and parameters: {'n_layers': 1, 'embedding_dim': 256, 'lr': 0.0002391583318230419, 'lambda_val': 0.004805532813491775, 'batch_size': 2268, 'optimizer': 'RMSprop'}.
2026-05-22 23:37:56,210 - optuna.study.study - INFO - Trial 255 finished with values: [0.05844275176857937, 0.03901639344262295, 0.05674740839168731] and parameters: {'n_layers': 1, 'embedding_dim': 64, 'lr': 0.00018259329948876513, 'lambda_val': 0.0007473225023338327, 'batch_size': 1116, 'optimizer': 'Adam'}.
2026-05-22 23:38:09,338 - optuna.study.study - INFO - Trial 256 finished with values: [0.00327949646048367, 0.0033606557377049177, 0.004418589043647277] and parameters: {'n_layers': 2, 'embedding_dim': 96, 'lr': 4.1710131589105334e-05, 'lambda_val': 2.3648996790815136e-05, 'batch_size': 1459, 'optimizer': 'RMSprop'}.
2026-05-22 23:38:12,050 - experiment_functions - INFO - Early stopping at epoch 600. Best Metrics: (0.10167689062274542, 0.05639344262295083, 0.09323393157507692)
2026-05-22 23:38:12,195 - optuna.study.study - INFO - Trial 257 finished with values: [0.10167689062274542, 0.05639344262295083, 0.09323393157507692] and parameters: {'n_layers': 1, 'embedding_dim': 96, 'lr': 0.0032374955494066686, 'lambda_val': 3.88974253204855e-05, 'batch_size': 1033, 'optimizer': 'Adam'}.
2026-05-22 23:38:28,100 - optuna.study.study - INFO - Trial 258 finished with values: [0.10415210442666585, 0.05827868852459016, 0.09685033607471634] and parameters: {'n_layers': 1, 'embedding_dim': 256, 'lr': 0.00018259329948876513, 'lambda_val': 0.0016010999314799575, 'batch_size': 1284, 'optimizer': 'RMSprop'}.
2026-05-22 23:38:44,880 - optuna.study.study - INFO - Trial 259 finished with values: [0.09205595623725896, 0.0519672131147541, 0.08293929216319179] and parameters: {'n_layers': 1, 'embedding_dim': 256, 'lr': 0.00014191753167124515, 'lambda_val': 0.0016010999314799575, 'batch_size': 2536, 'optimizer': 'Adam'}.
2026-05-22 23:39:01,968 - optuna.study.study - INFO - Trial 260 finished with values: [0.08993077545404529, 0.05442622950819673, 0.09001671500179952] and parameters: {'n_layers': 1, 'embedding_dim': 256, 'lr': 0.00014191753167124515, 'lambda_val': 0.004805532813491775, 'batch_size': 3643, 'optimizer': 'Adam'}.
2026-05-22 23:39:05,610 - experiment_functions - INFO - Early stopping at epoch 800. Best Metrics: (0.09859193894704096, 0.05770491803278689, 0.09209700147308182)
2026-05-22 23:39:05,720 - optuna.study.study - INFO - Trial 261 finished with values: [0.09859193894704096, 0.05770491803278689, 0.09209700147308182] and parameters: {'n_layers': 1, 'embedding_dim': 128, 'lr': 0.0014373137364726936, 'lambda_val': 0.004805532813491775, 'batch_size': 653, 'optimizer': 'Adam'}.
2026-05-22 23:39:22,873 - optuna.study.study - INFO - Trial 262 finished with values: [0.11307756614058223, 0.05754098360655737, 0.09596107748383167] and parameters: {'n_layers': 1, 'embedding_dim': 256, 'lr': 0.00018259329948876513, 'lambda_val': 4.1855561222722974e-06, 'batch_size': 4085, 'optimizer': 'RMSprop'}.
2026-05-22 23:39:28,775 - experiment_functions - INFO - Early stopping at epoch 1050. Best Metrics: (0.028373567181610163, 0.015000000000000001, 0.024451505712292966)
2026-05-22 23:39:29,867 - optuna.study.study - INFO - Trial 263 finished with values: [0.028373567181610163, 0.015000000000000001, 0.024451505712292966] and parameters: {'n_layers': 2, 'embedding_dim': 256, 'lr': 0.0022078963722517936, 'lambda_val': 0.0016010999314799575, 'batch_size': 874, 'optimizer': 'RMSprop'}.
2026-05-22 23:39:41,408 - experiment_functions - INFO - Early stopping at epoch 1800. Best Metrics: (0.06749015515575138, 0.0430327868852459, 0.06283377632036735)
2026-05-22 23:39:41,963 - optuna.study.study - INFO - Trial 264 finished with values: [0.06749015515575138, 0.0430327868852459, 0.06283377632036735] and parameters: {'n_layers': 3, 'embedding_dim': 256, 'lr': 0.0002391583318230419, 'lambda_val': 0.0016010999314799575, 'batch_size': 653, 'optimizer': 'Adam'}.
2026-05-22 23:39:59,043 - optuna.study.study - INFO - Trial 265 finished with values: [0.09493811855453359, 0.0519672131147541, 0.08684390082604208] and parameters: {'n_layers': 1, 'embedding_dim': 256, 'lr': 0.0002391583318230419, 'lambda_val': 7.613685556639934e-06, 'batch_size': 653, 'optimizer': 'Adam'}.
2026-05-22 23:40:19,459 - optuna.study.study - INFO - Trial 266 finished with values: [0.08995296210420414, 0.05147540983606558, 0.07950413560040548] and parameters: {'n_layers': 2, 'embedding_dim': 256, 'lr': 0.00018259329948876513, 'lambda_val': 0.002358586641710204, 'batch_size': 1116, 'optimizer': 'Adam'}.
2026-05-22 23:40:22,626 - experiment_functions - INFO - Early stopping at epoch 550. Best Metrics: (0.09622783274853257, 0.04672131147540984, 0.08250378120583933)
2026-05-22 23:40:23,300 - optuna.study.study - INFO - Trial 267 finished with values: [0.09622783274853257, 0.04672131147540984, 0.08250378120583933] and parameters: {'n_layers': 1, 'embedding_dim': 256, 'lr': 0.008042146947589026, 'lambda_val': 7.613685556639934e-06, 'batch_size': 2943, 'optimizer': 'Adam'}.
2026-05-22 23:40:40,172 - optuna.study.study - INFO - Trial 268 finished with values: [0.10626855231342382, 0.060000000000000005, 0.09772071105257298] and parameters: {'n_layers': 1, 'embedding_dim': 256, 'lr': 0.00018259329948876513, 'lambda_val': 0.004805532813491775, 'batch_size': 2536, 'optimizer': 'Adam'}.
2026-05-22 23:40:56,526 - optuna.study.study - INFO - Trial 269 finished with values: [0.09021798158717771, 0.04426229508196721, 0.07304868273445274] and parameters: {'n_layers': 1, 'embedding_dim': 256, 'lr': 0.021949167053037115, 'lambda_val': 0.0016010999314799575, 'batch_size': 2244, 'optimizer': 'Adam'}.
2026-05-22 23:41:07,035 - experiment_functions - INFO - Early stopping at epoch 2400. Best Metrics: (0.1189123326565498, 0.06040983606557376, 0.10157442961093954)
2026-05-22 23:41:07,638 - optuna.study.study - INFO - Trial 270 finished with values: [0.1189123326565498, 0.06040983606557376, 0.10157442961093954] and parameters: {'n_layers': 1, 'embedding_dim': 256, 'lr': 0.0002391583318230419, 'lambda_val': 7.613685556639934e-06, 'batch_size': 3835, 'optimizer': 'Adam'}.
2026-05-22 23:41:10,767 - experiment_functions - INFO - Early stopping at epoch 850. Best Metrics: (0.09531316253558755, 0.05713114754098361, 0.08902436188329826)
2026-05-22 23:41:10,857 - optuna.study.study - INFO - Trial 271 finished with values: [0.09531316253558755, 0.05713114754098361, 0.08902436188329826] and parameters: {'n_layers': 1, 'embedding_dim': 32, 'lr': 0.0013596200813318466, 'lambda_val': 0.004805532813491775, 'batch_size': 653, 'optimizer': 'Adam'}.
2026-05-22 23:41:24,911 - optuna.study.study - INFO - Trial 272 finished with values: [0.1025856694864321, 0.060491803278688534, 0.09084316138536043] and parameters: {'n_layers': 1, 'embedding_dim': 64, 'lr': 0.0002391583318230419, 'lambda_val': 0.004805532813491775, 'batch_size': 3835, 'optimizer': 'RMSprop'}.
2026-05-22 23:41:27,693 - experiment_functions - INFO - Early stopping at epoch 500. Best Metrics: (0.0024783504484329174, 0.0009836065573770494, 0.002215871494522618)
2026-05-22 23:41:27,832 - optuna.study.study - INFO - Trial 273 finished with values: [0.0024783504484329174, 0.0009836065573770494, 0.002215871494522618] and parameters: {'n_layers': 1, 'embedding_dim': 256, 'lr': 0.00014191753167124515, 'lambda_val': 0.0001473158611730725, 'batch_size': 653, 'optimizer': 'SGD'}.
2026-05-22 23:41:31,589 - experiment_functions - INFO - Early stopping at epoch 650. Best Metrics: (0.11163740194349826, 0.055327868852459015, 0.08942494202619047)
2026-05-22 23:41:31,688 - optuna.study.study - INFO - Trial 274 finished with values: [0.11163740194349826, 0.055327868852459015, 0.08942494202619047] and parameters: {'n_layers': 1, 'embedding_dim': 256, 'lr': 0.0016525876024041841, 'lambda_val': 0.002237772810847188, 'batch_size': 3643, 'optimizer': 'Adam'}.
2026-05-22 23:41:44,737 - optuna.study.study - INFO - Trial 275 finished with values: [0.02097851196225744, 0.01557377049180328, 0.02323724585542101] and parameters: {'n_layers': 1, 'embedding_dim': 96, 'lr': 0.00014191753167124515, 'lambda_val': 0.004805532813491775, 'batch_size': 653, 'optimizer': 'Adam'}.
2026-05-22 23:41:50,037 - experiment_functions - INFO - Early stopping at epoch 1050. Best Metrics: (0.11786327983266977, 0.06098360655737706, 0.10252906183884178)
2026-05-22 23:41:50,788 - optuna.study.study - INFO - Trial 276 finished with values: [0.11786327983266977, 0.06098360655737706, 0.10252906183884178] and parameters: {'n_layers': 1, 'embedding_dim': 256, 'lr': 0.0005586191809811369, 'lambda_val': 0.0007483799258451436, 'batch_size': 3835, 'optimizer': 'Adam'}.
2026-05-22 23:41:54,555 - experiment_functions - INFO - Early stopping at epoch 900. Best Metrics: (0.04381089843166225, 0.03352459016393443, 0.04544089004231485)
2026-05-22 23:41:54,971 - optuna.study.study - INFO - Trial 277 finished with values: [0.04381089843166225, 0.03352459016393443, 0.04544089004231485] and parameters: {'n_layers': 1, 'embedding_dim': 96, 'lr': 0.0005586191809811369, 'lambda_val': 0.08432998569585348, 'batch_size': 653, 'optimizer': 'RMSprop'}.
2026-05-22 23:41:59,075 - experiment_functions - INFO - Early stopping at epoch 700. Best Metrics: (0.12661420242960736, 0.05688524590163935, 0.10248555272736651)
2026-05-22 23:41:59,219 - optuna.study.study - INFO - Trial 278 finished with values: [0.12661420242960736, 0.05688524590163935, 0.10248555272736651] and parameters: {'n_layers': 1, 'embedding_dim': 256, 'lr': 0.0014373137364726936, 'lambda_val': 0.0001473158611730725, 'batch_size': 3835, 'optimizer': 'Adam'}.
2026-05-22 23:42:12,386 - experiment_functions - INFO - Early stopping at epoch 2050. Best Metrics: (0.06374107006121589, 0.03704918032786886, 0.05880272076886644)
2026-05-22 23:42:12,543 - optuna.study.study - INFO - Trial 279 finished with values: [0.06374107006121589, 0.03704918032786886, 0.05880272076886644] and parameters: {'n_layers': 3, 'embedding_dim': 256, 'lr': 0.0002391583318230419, 'lambda_val': 0.0001333811184810849, 'batch_size': 2149, 'optimizer': 'Adam'}.
2026-05-22 23:42:15,552 - experiment_functions - INFO - Early stopping at epoch 600. Best Metrics: (0.06609915416654595, 0.043852459016393446, 0.06283479366251092)
2026-05-22 23:42:15,696 - optuna.study.study - INFO - Trial 280 finished with values: [0.06609915416654595, 0.043852459016393446, 0.06283479366251092] and parameters: {'n_layers': 1, 'embedding_dim': 64, 'lr': 0.0014373137364726936, 'lambda_val': 0.004805532813491775, 'batch_size': 3643, 'optimizer': 'RMSprop'}.
2026-05-22 23:42:18,616 - experiment_functions - INFO - Early stopping at epoch 600. Best Metrics: (0.07207831937581052, 0.04549180327868853, 0.06725101887588958)
2026-05-22 23:42:18,711 - optuna.study.study - INFO - Trial 281 finished with values: [0.07207831937581052, 0.04549180327868853, 0.06725101887588958] and parameters: {'n_layers': 1, 'embedding_dim': 32, 'lr': 0.0032374955494066686, 'lambda_val': 0.0007483799258451436, 'batch_size': 3835, 'optimizer': 'Adam'}.
2026-05-22 23:42:22,464 - experiment_functions - INFO - Early stopping at epoch 700. Best Metrics: (0.11730307146323525, 0.06049180327868852, 0.10096256394525047)
2026-05-22 23:42:22,701 - optuna.study.study - INFO - Trial 282 finished with values: [0.11730307146323525, 0.06049180327868852, 0.10096256394525047] and parameters: {'n_layers': 1, 'embedding_dim': 256, 'lr': 0.0014373137364726936, 'lambda_val': 0.0007483799258451436, 'batch_size': 1990, 'optimizer': 'Adam'}.
2026-05-22 23:42:25,730 - experiment_functions - INFO - Early stopping at epoch 600. Best Metrics: (0.07198154579300874, 0.04581967213114754, 0.06833145064029979)
2026-05-22 23:42:25,826 - optuna.study.study - INFO - Trial 283 finished with values: [0.07198154579300874, 0.04581967213114754, 0.06833145064029979] and parameters: {'n_layers': 1, 'embedding_dim': 64, 'lr': 0.0014373137364726936, 'lambda_val': 0.004805532813491775, 'batch_size': 3835, 'optimizer': 'RMSprop'}.
2026-05-22 23:42:31,587 - experiment_functions - INFO - Early stopping at epoch 1250. Best Metrics: (0.126175395242057, 0.06377049180327869, 0.10921570095867579)
2026-05-22 23:42:32,185 - optuna.study.study - INFO - Trial 284 finished with values: [0.126175395242057, 0.06377049180327869, 0.10921570095867579] and parameters: {'n_layers': 1, 'embedding_dim': 256, 'lr': 0.0005586191809811369, 'lambda_val': 0.000107434574274214, 'batch_size': 1990, 'optimizer': 'RMSprop'}.
2026-05-22 23:42:36,233 - experiment_functions - INFO - Early stopping at epoch 600. Best Metrics: (0.036870140477937005, 0.024098360655737703, 0.0358310788927161)
2026-05-22 23:42:37,211 - optuna.study.study - INFO - Trial 285 finished with values: [0.036870140477937005, 0.024098360655737703, 0.0358310788927161] and parameters: {'n_layers': 2, 'embedding_dim': 256, 'lr': 0.0008234331798191084, 'lambda_val': 0.01669809465073922, 'batch_size': 3643, 'optimizer': 'Adam'}.
2026-05-22 23:42:42,498 - experiment_functions - INFO - Early stopping at epoch 850. Best Metrics: (0.054642290094454704, 0.03295081967213115, 0.0501569414933864)
2026-05-22 23:42:43,588 - optuna.study.study - INFO - Trial 286 finished with values: [0.054642290094454704, 0.03295081967213115, 0.0501569414933864] and parameters: {'n_layers': 2, 'embedding_dim': 256, 'lr': 0.0003253883741862748, 'lambda_val': 0.004805532813491775, 'batch_size': 3643, 'optimizer': 'Adam'}.
2026-05-22 23:42:50,967 - experiment_functions - INFO - Early stopping at epoch 550. Best Metrics: (0.07577188797515118, 0.04680327868852459, 0.06994465281541548)
2026-05-22 23:42:51,546 - optuna.study.study - INFO - Trial 287 finished with values: [0.07577188797515118, 0.04680327868852459, 0.06994465281541548] and parameters: {'n_layers': 1, 'embedding_dim': 128, 'lr': 0.0014373137364726936, 'lambda_val': 0.004805532813491775, 'batch_size': 3643, 'optimizer': 'RMSprop'}.
2026-05-22 23:43:02,168 - experiment_functions - INFO - Early stopping at epoch 1050. Best Metrics: (0.11676089020002305, 0.05811475409836066, 0.09694061302360592)
2026-05-22 23:43:02,871 - optuna.study.study - INFO - Trial 288 finished with values: [0.11676089020002305, 0.05811475409836066, 0.09694061302360592] and parameters: {'n_layers': 1, 'embedding_dim': 256, 'lr': 0.0005586191809811369, 'lambda_val': 0.0007483799258451436, 'batch_size': 3826, 'optimizer': 'RMSprop'}.
2026-05-22 23:43:15,618 - optuna.study.study - INFO - Trial 289 finished with values: [0.011329724038899874, 0.0063114754098360665, 0.009865106587099761] and parameters: {'n_layers': 1, 'embedding_dim': 96, 'lr': 0.00010738716815671631, 'lambda_val': 0.004805532813491775, 'batch_size': 653, 'optimizer': 'RMSprop'}.
2026-05-22 23:43:36,133 - optuna.study.study - INFO - Trial 290 finished with values: [0.003360059895910754, 0.0027868852459016396, 0.0034382491478923264] and parameters: {'n_layers': 2, 'embedding_dim': 256, 'lr': 1.8485150675290167e-05, 'lambda_val': 2.3648996790815136e-05, 'batch_size': 3643, 'optimizer': 'RMSprop'}.
2026-05-22 23:43:39,423 - experiment_functions - INFO - Early stopping at epoch 650. Best Metrics: (0.09823700521252317, 0.05713114754098361, 0.08852363670016661)
2026-05-22 23:43:39,579 - optuna.study.study - INFO - Trial 291 finished with values: [0.09823700521252317, 0.05713114754098361, 0.08852363670016661] and parameters: {'n_layers': 1, 'embedding_dim': 128, 'lr': 0.0014373137364726936, 'lambda_val': 0.004805532813491775, 'batch_size': 2054, 'optimizer': 'Adam'}.
2026-05-22 23:43:42,500 - experiment_functions - INFO - Early stopping at epoch 500. Best Metrics: (0.001959465874662119, 0.001639344262295082, 0.0019463163948812607)
2026-05-22 23:43:42,646 - optuna.study.study - INFO - Trial 292 finished with values: [0.001959465874662119, 0.001639344262295082, 0.0019463163948812607] and parameters: {'n_layers': 1, 'embedding_dim': 256, 'lr': 0.00014191753167124515, 'lambda_val': 4.1855561222722974e-06, 'batch_size': 3835, 'optimizer': 'SGD'}.
2026-05-22 23:43:58,964 - optuna.study.study - INFO - Trial 293 finished with values: [0.0713198895866171, 0.04270491803278688, 0.06630878858347079] and parameters: {'n_layers': 1, 'embedding_dim': 256, 'lr': 0.00018259329948876513, 'lambda_val': 0.004805532813491775, 'batch_size': 653, 'optimizer': 'Adam'}.
2026-05-22 23:44:02,943 - experiment_functions - INFO - Early stopping at epoch 500. Best Metrics: (0.0022317932364245897, 0.0017213114754098362, 0.0023283105574129245)
2026-05-22 23:44:03,384 - optuna.study.study - INFO - Trial 294 finished with values: [0.0022317932364245897, 0.0017213114754098362, 0.0023283105574129245] and parameters: {'n_layers': 3, 'embedding_dim': 256, 'lr': 0.0005586191809811369, 'lambda_val': 2.3648996790815136e-05, 'batch_size': 3997, 'optimizer': 'SGD'}.
2026-05-22 23:44:18,045 - optuna.study.study - INFO - Trial 295 finished with values: [0.07777506730589209, 0.04590163934426229, 0.06853481675962521] and parameters: {'n_layers': 1, 'embedding_dim': 128, 'lr': 0.00014191753167124515, 'lambda_val': 0.004805532813491775, 'batch_size': 3835, 'optimizer': 'RMSprop'}.
2026-05-22 23:44:21,085 - experiment_functions - INFO - Early stopping at epoch 650. Best Metrics: (0.11144387639473351, 0.060573770491803285, 0.10299456596008365)
2026-05-22 23:44:21,261 - optuna.study.study - INFO - Trial 296 finished with values: [0.11144387639473351, 0.060573770491803285, 0.10299456596008365] and parameters: {'n_layers': 1, 'embedding_dim': 64, 'lr': 0.0029369804066849336, 'lambda_val': 7.613685556639934e-06, 'batch_size': 653, 'optimizer': 'Adam'}.
2026-05-22 23:44:24,843 - experiment_functions - INFO - Early stopping at epoch 800. Best Metrics: (0.10086038921578452, 0.06040983606557377, 0.09567231144411766)
2026-05-22 23:44:24,983 - optuna.study.study - INFO - Trial 297 finished with values: [0.10086038921578452, 0.06040983606557377, 0.09567231144411766] and parameters: {'n_layers': 1, 'embedding_dim': 128, 'lr': 0.0014373137364726936, 'lambda_val': 0.004805532813491775, 'batch_size': 653, 'optimizer': 'Adam'}.
2026-05-22 23:44:41,862 - optuna.study.study - INFO - Trial 298 finished with values: [0.10520886274204054, 0.05499999999999999, 0.089962900606563] and parameters: {'n_layers': 1, 'embedding_dim': 256, 'lr': 0.00018259329948876513, 'lambda_val': 1.1095121236392227e-05, 'batch_size': 2536, 'optimizer': 'Adam'}.
2026-05-22 23:44:46,741 - experiment_functions - INFO - Early stopping at epoch 1300. Best Metrics: (0.1090284652653537, 0.05581967213114754, 0.09328593003869906)
