2026-05-23 01:05:46,469 - optuna.study.study - INFO - Trial 229 finished with values: [0.033014277129529444, 0.019836065573770493, 0.029281286556883723] and parameters: {'n_layers': 1, 'embedding_dim': 96, 'lr': 0.0012673220264025206, 'lambda_val': 1.2051712435160432e-05, 'batch_size': 1639, 'optimizer': 'Adam'}.
2026-05-23 01:05:49,267 - experiment_functions - INFO - Early stopping at epoch 700. Best Metrics: (0.03332963359259022, 0.018278688524590164, 0.028764094983506266)
2026-05-23 01:05:49,357 - optuna.study.study - INFO - Trial 230 finished with values: [0.03332963359259022, 0.018278688524590164, 0.028764094983506266] and parameters: {'n_layers': 2, 'embedding_dim': 96, 'lr': 0.0007586035361839872, 'lambda_val': 0.0022698059971385885, 'batch_size': 2156, 'optimizer': 'RMSprop'}.
2026-05-23 01:05:52,797 - experiment_functions - INFO - Early stopping at epoch 900. Best Metrics: (0.026190197417536594, 0.0169672131147541, 0.02349149677374977)
2026-05-23 01:05:52,954 - optuna.study.study - INFO - Trial 231 finished with values: [0.026190197417536594, 0.0169672131147541, 0.02349149677374977] and parameters: {'n_layers': 3, 'embedding_dim': 64, 'lr': 0.0007442610977334545, 'lambda_val': 0.004686874294387785, 'batch_size': 2156, 'optimizer': 'Adam'}.
2026-05-23 01:06:02,050 - experiment_functions - INFO - Early stopping at epoch 700. Best Metrics: (0.0301498050116124, 0.01721311475409836, 0.026320212933608783)
2026-05-23 01:06:03,708 - optuna.study.study - INFO - Trial 232 finished with values: [0.0301498050116124, 0.01721311475409836, 0.026320212933608783] and parameters: {'n_layers': 3, 'embedding_dim': 256, 'lr': 0.0006241453841646659, 'lambda_val': 0.006616376079935662, 'batch_size': 2023, 'optimizer': 'Adam'}.
2026-05-23 01:06:11,492 - experiment_functions - INFO - Early stopping at epoch 1100. Best Metrics: (0.029736153215122102, 0.017459016393442623, 0.029548792457443067)
2026-05-23 01:06:12,612 - optuna.study.study - INFO - Trial 233 finished with values: [0.029736153215122102, 0.017459016393442623, 0.029548792457443067] and parameters: {'n_layers': 1, 'embedding_dim': 256, 'lr': 0.0006241453841646659, 'lambda_val': 0.00010898776228747154, 'batch_size': 1428, 'optimizer': 'RMSprop'}.
2026-05-23 01:06:15,697 - experiment_functions - INFO - Early stopping at epoch 750. Best Metrics: (0.01302737394497464, 0.010245901639344262, 0.012900902723907906)
2026-05-23 01:06:15,790 - optuna.study.study - INFO - Trial 234 finished with values: [0.01302737394497464, 0.010245901639344262, 0.012900902723907906] and parameters: {'n_layers': 4, 'embedding_dim': 96, 'lr': 0.0006241453841646659, 'lambda_val': 0.025196788086623147, 'batch_size': 939, 'optimizer': 'Adam'}.
2026-05-23 01:06:20,772 - experiment_functions - INFO - Early stopping at epoch 1450. Best Metrics: (0.030647817229560146, 0.019098360655737705, 0.02751615548417402)
2026-05-23 01:06:20,915 - optuna.study.study - INFO - Trial 235 finished with values: [0.030647817229560146, 0.019098360655737705, 0.02751615548417402] and parameters: {'n_layers': 1, 'embedding_dim': 96, 'lr': 0.0006241453841646659, 'lambda_val': 0.006616376079935662, 'batch_size': 1079, 'optimizer': 'RMSprop'}.
2026-05-23 01:06:23,960 - experiment_functions - INFO - Early stopping at epoch 700. Best Metrics: (0.0208666171356008, 0.013360655737704919, 0.018304301185676126)
2026-05-23 01:06:24,055 - optuna.study.study - INFO - Trial 236 finished with values: [0.0208666171356008, 0.013360655737704919, 0.018304301185676126] and parameters: {'n_layers': 4, 'embedding_dim': 96, 'lr': 0.0006997302727889885, 'lambda_val': 0.004686874294387785, 'batch_size': 2156, 'optimizer': 'Adam'}.
2026-05-23 01:06:29,584 - experiment_functions - INFO - Early stopping at epoch 1350. Best Metrics: (0.03341496969605984, 0.019672131147540985, 0.02952421876086208)
2026-05-23 01:06:29,821 - optuna.study.study - INFO - Trial 237 finished with values: [0.03341496969605984, 0.019672131147540985, 0.02952421876086208] and parameters: {'n_layers': 2, 'embedding_dim': 96, 'lr': 0.00037164008089034755, 'lambda_val': 6.335945209609284e-06, 'batch_size': 2410, 'optimizer': 'RMSprop'}.
2026-05-23 01:06:41,379 - optuna.study.study - INFO - Trial 238 finished with values: [0.03240356281215599, 0.018934426229508198, 0.029776765803520917] and parameters: {'n_layers': 1, 'embedding_dim': 96, 'lr': 0.00037164008089034755, 'lambda_val': 6.335945209609284e-06, 'batch_size': 979, 'optimizer': 'Adam'}.
2026-05-23 01:06:44,296 - experiment_functions - INFO - Early stopping at epoch 750. Best Metrics: (0.03008233760894224, 0.018114754098360657, 0.026801403799455413)
2026-05-23 01:06:44,392 - optuna.study.study - INFO - Trial 239 finished with values: [0.03008233760894224, 0.018114754098360657, 0.026801403799455413] and parameters: {'n_layers': 1, 'embedding_dim': 96, 'lr': 0.0012673220264025206, 'lambda_val': 5.775336112034289e-05, 'batch_size': 1468, 'optimizer': 'RMSprop'}.
2026-05-23 01:06:47,916 - experiment_functions - INFO - Early stopping at epoch 800. Best Metrics: (0.0322861003460527, 0.018032786885245903, 0.028790294462626462)
2026-05-23 01:06:48,003 - optuna.study.study - INFO - Trial 240 finished with values: [0.0322861003460527, 0.018032786885245903, 0.028790294462626462] and parameters: {'n_layers': 2, 'embedding_dim': 256, 'lr': 0.0007586035361839872, 'lambda_val': 8.923547676789324e-05, 'batch_size': 2004, 'optimizer': 'Adam'}.
2026-05-23 01:06:51,187 - experiment_functions - INFO - Early stopping at epoch 850. Best Metrics: (0.034113601802469855, 0.017950819672131146, 0.028908568902800892)
2026-05-23 01:06:52,232 - optuna.study.study - INFO - Trial 241 finished with values: [0.034113601802469855, 0.017950819672131146, 0.028908568902800892] and parameters: {'n_layers': 1, 'embedding_dim': 96, 'lr': 0.0021135494885504793, 'lambda_val': 0.0005699959841252275, 'batch_size': 1079, 'optimizer': 'Adam'}.
2026-05-23 01:06:54,449 - experiment_functions - INFO - Early stopping at epoch 500. Best Metrics: (0.0020413736717418973, 0.0012295081967213116, 0.0018322053845306705)
2026-05-23 01:06:54,543 - optuna.study.study - INFO - Trial 242 finished with values: [0.0020413736717418973, 0.0012295081967213116, 0.0018322053845306705] and parameters: {'n_layers': 2, 'embedding_dim': 96, 'lr': 0.0007586035361839872, 'lambda_val': 0.0006167459118972293, 'batch_size': 861, 'optimizer': 'SGD'}.
2026-05-23 01:07:01,216 - experiment_functions - INFO - Early stopping at epoch 2000. Best Metrics: (0.03125252241444928, 0.017295081967213115, 0.02784398853419783)
2026-05-23 01:07:01,308 - optuna.study.study - INFO - Trial 243 finished with values: [0.03125252241444928, 0.017295081967213115, 0.02784398853419783] and parameters: {'n_layers': 1, 'embedding_dim': 256, 'lr': 0.0006241453841646659, 'lambda_val': 5.775336112034289e-05, 'batch_size': 1639, 'optimizer': 'Adam'}.
2026-05-23 01:07:05,047 - experiment_functions - INFO - Early stopping at epoch 900. Best Metrics: (0.03436266469077063, 0.019918032786885247, 0.030563372889035267)
2026-05-23 01:07:05,984 - optuna.study.study - INFO - Trial 244 finished with values: [0.03436266469077063, 0.019918032786885247, 0.030563372889035267] and parameters: {'n_layers': 2, 'embedding_dim': 256, 'lr': 0.0007586035361839872, 'lambda_val': 0.004686874294387785, 'batch_size': 785, 'optimizer': 'Adam'}.
2026-05-23 01:07:10,367 - experiment_functions - INFO - Early stopping at epoch 1250. Best Metrics: (0.036572143972188276, 0.019836065573770493, 0.02868603150331909)
2026-05-23 01:07:10,911 - optuna.study.study - INFO - Trial 245 finished with values: [0.036572143972188276, 0.019836065573770493, 0.02868603150331909] and parameters: {'n_layers': 2, 'embedding_dim': 128, 'lr': 0.0004975305503445845, 'lambda_val': 0.0006167459118972293, 'batch_size': 861, 'optimizer': 'Adam'}.
2026-05-23 01:07:16,839 - experiment_functions - INFO - Early stopping at epoch 600. Best Metrics: (0.027187218697562063, 0.013934426229508197, 0.022990993558545527)
2026-05-23 01:07:17,494 - optuna.study.study - INFO - Trial 246 finished with values: [0.027187218697562063, 0.013934426229508197, 0.022990993558545527] and parameters: {'n_layers': 3, 'embedding_dim': 96, 'lr': 0.0008732317857197807, 'lambda_val': 0.0007172417291421626, 'batch_size': 2861, 'optimizer': 'RMSprop'}.
2026-05-23 01:07:26,319 - experiment_functions - INFO - Early stopping at epoch 950. Best Metrics: (0.028593584653878092, 0.01721311475409836, 0.025324961169438425)
2026-05-23 01:07:27,219 - optuna.study.study - INFO - Trial 247 finished with values: [0.028593584653878092, 0.01721311475409836, 0.025324961169438425] and parameters: {'n_layers': 3, 'embedding_dim': 32, 'lr': 0.0006997302727889885, 'lambda_val': 5.775336112034289e-05, 'batch_size': 1079, 'optimizer': 'Adam'}.
2026-05-23 01:07:33,107 - experiment_functions - INFO - Early stopping at epoch 1800. Best Metrics: (0.03439541656445043, 0.019672131147540985, 0.030416015001303788)
2026-05-23 01:07:33,380 - optuna.study.study - INFO - Trial 248 finished with values: [0.03439541656445043, 0.019672131147540985, 0.030416015001303788] and parameters: {'n_layers': 1, 'embedding_dim': 64, 'lr': 0.0006241453841646659, 'lambda_val': 5.5532012635423735e-06, 'batch_size': 939, 'optimizer': 'RMSprop'}.
2026-05-23 01:07:37,021 - experiment_functions - INFO - Early stopping at epoch 900. Best Metrics: (0.025619360465363585, 0.015737704918032787, 0.02485037565563607)
2026-05-23 01:07:37,140 - optuna.study.study - INFO - Trial 249 finished with values: [0.025619360465363585, 0.015737704918032787, 0.02485037565563607] and parameters: {'n_layers': 4, 'embedding_dim': 96, 'lr': 0.0006241453841646659, 'lambda_val': 0.0003391336234513702, 'batch_size': 939, 'optimizer': 'Adam'}.
2026-05-23 01:07:40,138 - experiment_functions - INFO - Early stopping at epoch 600. Best Metrics: (0.032026256937759276, 0.018688524590163937, 0.028097871000061263)
2026-05-23 01:07:40,226 - optuna.study.study - INFO - Trial 250 finished with values: [0.032026256937759276, 0.018688524590163937, 0.028097871000061263] and parameters: {'n_layers': 2, 'embedding_dim': 256, 'lr': 0.002478140259491724, 'lambda_val': 5.228100030668519e-06, 'batch_size': 1574, 'optimizer': 'Adam'}.
2026-05-23 01:07:45,763 - experiment_functions - INFO - Early stopping at epoch 1700. Best Metrics: (0.035547424067048417, 0.018606557377049183, 0.03029337047053511)
2026-05-23 01:07:45,916 - optuna.study.study - INFO - Trial 251 finished with values: [0.035547424067048417, 0.018606557377049183, 0.03029337047053511] and parameters: {'n_layers': 1, 'embedding_dim': 128, 'lr': 0.0004975305503445845, 'lambda_val': 8.923547676789324e-05, 'batch_size': 2831, 'optimizer': 'Adam'}.
2026-05-23 01:07:49,036 - experiment_functions - INFO - Early stopping at epoch 800. Best Metrics: (0.0319524662827551, 0.018442622950819672, 0.02779467697860414)
2026-05-23 01:07:49,742 - optuna.study.study - INFO - Trial 252 finished with values: [0.0319524662827551, 0.018442622950819672, 0.02779467697860414] and parameters: {'n_layers': 1, 'embedding_dim': 128, 'lr': 0.0012673220264025206, 'lambda_val': 0.003237223847988301, 'batch_size': 1639, 'optimizer': 'Adam'}.
2026-05-23 01:07:58,455 - experiment_functions - INFO - Early stopping at epoch 3100. Best Metrics: (0.03529917763846476, 0.02098360655737705, 0.030986688339214325)
2026-05-23 01:07:58,646 - optuna.study.study - INFO - Trial 253 finished with values: [0.03529917763846476, 0.02098360655737705, 0.030986688339214325] and parameters: {'n_layers': 1, 'embedding_dim': 64, 'lr': 0.0004975305503445845, 'lambda_val': 0.0007172417291421626, 'batch_size': 939, 'optimizer': 'RMSprop'}.
2026-05-23 01:08:00,986 - experiment_functions - INFO - Early stopping at epoch 550. Best Metrics: (0.019423016651779222, 0.011803278688524592, 0.016492078308098474)
2026-05-23 01:08:01,084 - optuna.study.study - INFO - Trial 254 finished with values: [0.019423016651779222, 0.011803278688524592, 0.016492078308098474] and parameters: {'n_layers': 2, 'embedding_dim': 96, 'lr': 0.005526795866573214, 'lambda_val': 0.0005699959841252275, 'batch_size': 2156, 'optimizer': 'RMSprop'}.
2026-05-23 01:08:04,068 - experiment_functions - INFO - Early stopping at epoch 600. Best Metrics: (0.03335231480378176, 0.01918032786885246, 0.028942407386721807)
2026-05-23 01:08:04,169 - optuna.study.study - INFO - Trial 255 finished with values: [0.03335231480378176, 0.01918032786885246, 0.028942407386721807] and parameters: {'n_layers': 2, 'embedding_dim': 128, 'lr': 0.0034805464000646717, 'lambda_val': 0.0006167459118972293, 'batch_size': 861, 'optimizer': 'Adam'}.
2026-05-23 01:08:07,691 - experiment_functions - INFO - Early stopping at epoch 900. Best Metrics: (0.026576235952500082, 0.0169672131147541, 0.02309916516410705)
2026-05-23 01:08:07,783 - optuna.study.study - INFO - Trial 256 finished with values: [0.026576235952500082, 0.0169672131147541, 0.02309916516410705] and parameters: {'n_layers': 3, 'embedding_dim': 96, 'lr': 0.0007442610977334545, 'lambda_val': 0.0003391336234513702, 'batch_size': 1850, 'optimizer': 'Adam'}.
2026-05-23 01:08:13,397 - experiment_functions - INFO - Early stopping at epoch 1550. Best Metrics: (0.03551105136317864, 0.019508196721311474, 0.030225551415604457)
2026-05-23 01:08:14,107 - optuna.study.study - INFO - Trial 257 finished with values: [0.03551105136317864, 0.019508196721311474, 0.030225551415604457] and parameters: {'n_layers': 1, 'embedding_dim': 128, 'lr': 0.0007586035361839872, 'lambda_val': 5.228100030668519e-06, 'batch_size': 1326, 'optimizer': 'Adam'}.
2026-05-23 01:08:31,498 - optuna.study.study - INFO - Trial 258 finished with values: [0.030437645768577753, 0.018442622950819672, 0.027322910954026683] and parameters: {'n_layers': 1, 'embedding_dim': 96, 'lr': 0.0002639115492457367, 'lambda_val': 1.2051712435160432e-05, 'batch_size': 2831, 'optimizer': 'Adam'}.
2026-05-23 01:08:35,445 - experiment_functions - INFO - Early stopping at epoch 900. Best Metrics: (0.03727180520716307, 0.01975409836065574, 0.03064129190790547)
2026-05-23 01:08:36,274 - optuna.study.study - INFO - Trial 259 finished with values: [0.03727180520716307, 0.01975409836065574, 0.03064129190790547] and parameters: {'n_layers': 2, 'embedding_dim': 256, 'lr': 0.0007586035361839872, 'lambda_val': 6.335945209609284e-06, 'batch_size': 785, 'optimizer': 'Adam'}.
2026-05-23 01:08:40,193 - experiment_functions - INFO - Early stopping at epoch 1100. Best Metrics: (0.036945808529518606, 0.01975409836065574, 0.030935465245099287)
2026-05-23 01:08:40,286 - optuna.study.study - INFO - Trial 260 finished with values: [0.036945808529518606, 0.01975409836065574, 0.030935465245099287] and parameters: {'n_layers': 3, 'embedding_dim': 64, 'lr': 0.0006241453841646659, 'lambda_val': 6.335945209609284e-06, 'batch_size': 939, 'optimizer': 'Adam'}.
2026-05-23 01:08:46,633 - experiment_functions - INFO - Early stopping at epoch 2150. Best Metrics: (0.02337208454833568, 0.016639344262295082, 0.021675424776090052)
2026-05-23 01:08:47,892 - optuna.study.study - INFO - Trial 261 finished with values: [0.02337208454833568, 0.016639344262295082, 0.021675424776090052] and parameters: {'n_layers': 1, 'embedding_dim': 64, 'lr': 0.00037164008089034755, 'lambda_val': 0.04322694943484018, 'batch_size': 979, 'optimizer': 'Adam'}.
2026-05-23 01:08:54,371 - experiment_functions - INFO - Early stopping at epoch 2200. Best Metrics: (0.03990040756908866, 0.020737704918032784, 0.03155226052615349)
2026-05-23 01:08:54,460 - optuna.study.study - INFO - Trial 262 finished with values: [0.03990040756908866, 0.020737704918032784, 0.03155226052615349] and parameters: {'n_layers': 1, 'embedding_dim': 64, 'lr': 0.0006241453841646659, 'lambda_val': 5.380566367916435e-05, 'batch_size': 1254, 'optimizer': 'Adam'}.
2026-05-23 01:09:06,681 - optuna.study.study - INFO - Trial 263 finished with values: [0.030906583161720128, 0.017377049180327873, 0.024127290925772454] and parameters: {'n_layers': 1, 'embedding_dim': 96, 'lr': 0.0004014419530027751, 'lambda_val': 2.0458426715606476e-06, 'batch_size': 1588, 'optimizer': 'Adam'}.
2026-05-23 01:09:08,938 - experiment_functions - INFO - Early stopping at epoch 550. Best Metrics: (0.023645993612329764, 0.013196721311475411, 0.018535459318419257)
2026-05-23 01:09:09,030 - optuna.study.study - INFO - Trial 264 finished with values: [0.023645993612329764, 0.013196721311475411, 0.018535459318419257] and parameters: {'n_layers': 1, 'embedding_dim': 128, 'lr': 0.014621899259057753, 'lambda_val': 0.004662435394613103, 'batch_size': 939, 'optimizer': 'Adam'}.
2026-05-23 01:09:12,629 - experiment_functions - INFO - Early stopping at epoch 1000. Best Metrics: (0.04305512032721731, 0.021885245901639348, 0.03612161448245009)
2026-05-23 01:09:13,110 - optuna.study.study - INFO - Trial 265 finished with values: [0.04305512032721731, 0.021885245901639348, 0.03612161448245009] and parameters: {'n_layers': 2, 'embedding_dim': 96, 'lr': 0.0004975305503445845, 'lambda_val': 0.003237223847988301, 'batch_size': 1326, 'optimizer': 'RMSprop'}.
2026-05-23 01:09:16,961 - experiment_functions - INFO - Early stopping at epoch 950. Best Metrics: (0.03564308453414345, 0.01754098360655738, 0.028209052952043834)
2026-05-23 01:09:17,134 - optuna.study.study - INFO - Trial 266 finished with values: [0.03564308453414345, 0.01754098360655738, 0.028209052952043834] and parameters: {'n_layers': 2, 'embedding_dim': 64, 'lr': 0.0007442610977334545, 'lambda_val': 0.0003391336234513702, 'batch_size': 2156, 'optimizer': 'Adam'}.
2026-05-23 01:09:22,327 - experiment_functions - INFO - Early stopping at epoch 850. Best Metrics: (0.030930277511316526, 0.01672131147540984, 0.025692996820712834)
2026-05-23 01:09:22,767 - optuna.study.study - INFO - Trial 267 finished with values: [0.030930277511316526, 0.01672131147540984, 0.025692996820712834] and parameters: {'n_layers': 4, 'embedding_dim': 128, 'lr': 0.0007442610977334545, 'lambda_val': 0.0003391336234513702, 'batch_size': 521, 'optimizer': 'Adam'}.
2026-05-23 01:09:30,754 - experiment_functions - INFO - Early stopping at epoch 600. Best Metrics: (0.029066730143276768, 0.01901639344262295, 0.027943056459210438)
2026-05-23 01:09:31,470 - optuna.study.study - INFO - Trial 268 finished with values: [0.029066730143276768, 0.01901639344262295, 0.027943056459210438] and parameters: {'n_layers': 2, 'embedding_dim': 256, 'lr': 0.0007586035361839872, 'lambda_val': 0.004686874294387785, 'batch_size': 3965, 'optimizer': 'RMSprop'}.
2026-05-23 01:09:36,661 - experiment_functions - INFO - Early stopping at epoch 1000. Best Metrics: (0.029719211087185424, 0.01721311475409836, 0.025148618544510736)
2026-05-23 01:09:36,744 - optuna.study.study - INFO - Trial 269 finished with values: [0.029719211087185424, 0.01721311475409836, 0.025148618544510736] and parameters: {'n_layers': 2, 'embedding_dim': 96, 'lr': 0.0006241453841646659, 'lambda_val': 0.00010898776228747154, 'batch_size': 1428, 'optimizer': 'Adam'}.
2026-05-23 01:09:44,324 - experiment_functions - INFO - Early stopping at epoch 2950. Best Metrics: (0.03578759807207229, 0.021311475409836064, 0.03248048140634394)
2026-05-23 01:09:44,411 - optuna.study.study - INFO - Trial 270 finished with values: [0.03578759807207229, 0.021311475409836064, 0.03248048140634394] and parameters: {'n_layers': 1, 'embedding_dim': 128, 'lr': 0.0004975305503445845, 'lambda_val': 0.0007172417291421626, 'batch_size': 521, 'optimizer': 'RMSprop'}.
2026-05-23 01:09:47,037 - experiment_functions - INFO - Early stopping at epoch 650. Best Metrics: (0.02855517095916808, 0.019344262295081967, 0.026881561448408076)
2026-05-23 01:09:47,132 - optuna.study.study - INFO - Trial 271 finished with values: [0.02855517095916808, 0.019344262295081967, 0.026881561448408076] and parameters: {'n_layers': 1, 'embedding_dim': 256, 'lr': 0.0034805464000646717, 'lambda_val': 0.004662435394613103, 'batch_size': 971, 'optimizer': 'Adam'}.
2026-05-23 01:09:50,893 - experiment_functions - INFO - Early stopping at epoch 1000. Best Metrics: (0.029961989603292414, 0.01901639344262295, 0.030255849008059894)
2026-05-23 01:09:50,986 - optuna.study.study - INFO - Trial 272 finished with values: [0.029961989603292414, 0.01901639344262295, 0.030255849008059894] and parameters: {'n_layers': 2, 'embedding_dim': 96, 'lr': 0.0007586035361839872, 'lambda_val': 5.5532012635423735e-06, 'batch_size': 939, 'optimizer': 'Adam'}.
2026-05-23 01:09:53,678 - experiment_functions - INFO - Early stopping at epoch 800. Best Metrics: (0.03684585551235599, 0.019262295081967213, 0.03284584420721949)
2026-05-23 01:09:53,773 - optuna.study.study - INFO - Trial 273 finished with values: [0.03684585551235599, 0.019262295081967213, 0.03284584420721949] and parameters: {'n_layers': 2, 'embedding_dim': 64, 'lr': 0.0012673220264025206, 'lambda_val': 0.00010898776228747154, 'batch_size': 1639, 'optimizer': 'Adam'}.
2026-05-23 01:09:56,606 - experiment_functions - INFO - Early stopping at epoch 800. Best Metrics: (0.03675327420575188, 0.01975409836065574, 0.0305051508065564)
2026-05-23 01:09:56,692 - optuna.study.study - INFO - Trial 274 finished with values: [0.03675327420575188, 0.01975409836065574, 0.0305051508065564] and parameters: {'n_layers': 3, 'embedding_dim': 96, 'lr': 0.0007442610977334545, 'lambda_val': 0.0007172417291421626, 'batch_size': 1007, 'optimizer': 'Adam'}.
2026-05-23 01:10:03,696 - experiment_functions - INFO - Early stopping at epoch 2900. Best Metrics: (0.010668047436387884, 0.007049180327868854, 0.009466584806219949)
2026-05-23 01:10:03,786 - optuna.study.study - INFO - Trial 275 finished with values: [0.010668047436387884, 0.007049180327868854, 0.009466584806219949] and parameters: {'n_layers': 2, 'embedding_dim': 32, 'lr': 0.00013891725580674567, 'lambda_val': 5.775336112034289e-05, 'batch_size': 2156, 'optimizer': 'RMSprop'}.
2026-05-23 01:10:06,894 - experiment_functions - INFO - Early stopping at epoch 950. Best Metrics: (0.027785245124174244, 0.017049180327868854, 0.02337658981126826)
