2026-05-23 02:38:08,184 - optuna.study.study - INFO - Trial 51 finished with values: [0.02100804940914173, 0.01918032786885246, 0.023515752055021374] and parameters: {'n_layers': 4, 'embedding_dim': 32, 'lr': 0.00019324235493803607, 'lambda_val': 8.60783053151504e-05, 'batch_size': 2109, 'optimizer': 'Adam'}.
2026-05-23 02:38:11,416 - experiment_functions - INFO - Early stopping at epoch 500. Best Metrics: (0.018965575564140195, 0.012950819672131148, 0.018742986983983655)
2026-05-23 02:38:11,919 - optuna.study.study - INFO - Trial 52 finished with values: [0.018965575564140195, 0.012950819672131148, 0.018742986983983655] and parameters: {'n_layers': 4, 'embedding_dim': 128, 'lr': 0.016266514372218804, 'lambda_val': 5.140401727082709e-06, 'batch_size': 3463, 'optimizer': 'RMSprop'}.
2026-05-23 02:38:35,877 - optuna.study.study - INFO - Trial 53 finished with values: [0.004019640376825557, 0.005409836065573771, 0.005943900002043766] and parameters: {'n_layers': 2, 'embedding_dim': 256, 'lr': 2.9793579869863167e-05, 'lambda_val': 0.0009810927157913494, 'batch_size': 3144, 'optimizer': 'Adam'}.
2026-05-23 02:38:38,760 - experiment_functions - INFO - Early stopping at epoch 500. Best Metrics: (0.0007178859436855034, 0.0009016393442622952, 0.0013309276379507102)
2026-05-23 02:38:38,893 - optuna.study.study - INFO - Trial 54 finished with values: [0.0007178859436855034, 0.0009016393442622952, 0.0013309276379507102] and parameters: {'n_layers': 3, 'embedding_dim': 96, 'lr': 0.02107335765652346, 'lambda_val': 8.570410966993293e-06, 'batch_size': 1462, 'optimizer': 'SGD'}.
2026-05-23 02:38:42,257 - experiment_functions - INFO - Early stopping at epoch 500. Best Metrics: (0.001208195660953709, 0.0017213114754098362, 0.0019744036558714826)
2026-05-23 02:38:42,350 - optuna.study.study - INFO - Trial 55 finished with values: [0.001208195660953709, 0.0017213114754098362, 0.0019744036558714826] and parameters: {'n_layers': 1, 'embedding_dim': 256, 'lr': 0.02107335765652346, 'lambda_val': 0.005469691175731185, 'batch_size': 1462, 'optimizer': 'SGD'}.
2026-05-23 02:38:46,493 - experiment_functions - INFO - Early stopping at epoch 500. Best Metrics: (0.03403796144883854, 0.01139344262295082, 0.02430315011967732)
2026-05-23 02:38:46,581 - optuna.study.study - INFO - Trial 56 finished with values: [0.03403796144883854, 0.01139344262295082, 0.02430315011967732] and parameters: {'n_layers': 4, 'embedding_dim': 256, 'lr': 0.025589592485043958, 'lambda_val': 0.05386437521203161, 'batch_size': 808, 'optimizer': 'RMSprop'}.
2026-05-23 02:38:50,327 - experiment_functions - INFO - Early stopping at epoch 600. Best Metrics: (0.04121202460928198, 0.03040983606557377, 0.04018910156232993)
2026-05-23 02:38:50,751 - optuna.study.study - INFO - Trial 57 finished with values: [0.04121202460928198, 0.03040983606557377, 0.04018910156232993] and parameters: {'n_layers': 2, 'embedding_dim': 256, 'lr': 0.001459413805808463, 'lambda_val': 0.0009810927157913494, 'batch_size': 1462, 'optimizer': 'Adam'}.
2026-05-23 02:38:53,620 - experiment_functions - INFO - Early stopping at epoch 550. Best Metrics: (0.028137583065599228, 0.015737704918032787, 0.024843233906813013)
2026-05-23 02:38:53,701 - optuna.study.study - INFO - Trial 58 finished with values: [0.028137583065599228, 0.015737704918032787, 0.024843233906813013] and parameters: {'n_layers': 2, 'embedding_dim': 128, 'lr': 0.004434110743664845, 'lambda_val': 5.206945836303924e-05, 'batch_size': 2121, 'optimizer': 'RMSprop'}.
2026-05-23 02:38:57,619 - experiment_functions - INFO - Early stopping at epoch 750. Best Metrics: (0.03175781210538214, 0.022213114754098363, 0.031757443909148454)
2026-05-23 02:38:57,722 - optuna.study.study - INFO - Trial 59 finished with values: [0.03175781210538214, 0.022213114754098363, 0.031757443909148454] and parameters: {'n_layers': 2, 'embedding_dim': 128, 'lr': 0.001459413805808463, 'lambda_val': 0.0009810927157913494, 'batch_size': 3144, 'optimizer': 'RMSprop'}.
2026-05-23 02:39:02,370 - experiment_functions - INFO - Early stopping at epoch 1000. Best Metrics: (0.03702235518368832, 0.02483606557377049, 0.03699603265248431)
2026-05-23 02:39:02,462 - optuna.study.study - INFO - Trial 60 finished with values: [0.03702235518368832, 0.02483606557377049, 0.03699603265248431] and parameters: {'n_layers': 3, 'embedding_dim': 64, 'lr': 0.0005134970540789423, 'lambda_val': 0.006439135351806826, 'batch_size': 1518, 'optimizer': 'RMSprop'}.
2026-05-23 02:39:07,243 - experiment_functions - INFO - Early stopping at epoch 1050. Best Metrics: (0.05825436216151308, 0.04155737704918033, 0.0556724394506217)
2026-05-23 02:39:07,650 - optuna.study.study - INFO - Trial 61 finished with values: [0.05825436216151308, 0.04155737704918033, 0.0556724394506217] and parameters: {'n_layers': 1, 'embedding_dim': 256, 'lr': 0.00033929418945457667, 'lambda_val': 0.007352147641655774, 'batch_size': 2773, 'optimizer': 'RMSprop'}.
2026-05-23 02:39:27,704 - optuna.study.study - INFO - Trial 62 finished with values: [0.05223519379030724, 0.033852459016393444, 0.04843600047415016] and parameters: {'n_layers': 2, 'embedding_dim': 128, 'lr': 0.00015616559996727892, 'lambda_val': 8.689122223949433e-06, 'batch_size': 2701, 'optimizer': 'Adam'}.
2026-05-23 02:39:36,790 - experiment_functions - INFO - Early stopping at epoch 2250. Best Metrics: (0.01290556452447897, 0.0119672131147541, 0.015436337814859216)
2026-05-23 02:39:36,954 - optuna.study.study - INFO - Trial 63 finished with values: [0.01290556452447897, 0.0119672131147541, 0.015436337814859216] and parameters: {'n_layers': 2, 'embedding_dim': 128, 'lr': 0.013832663687407772, 'lambda_val': 0.09172929473030231, 'batch_size': 2121, 'optimizer': 'RMSprop'}.
2026-05-23 02:39:40,457 - experiment_functions - INFO - Early stopping at epoch 500. Best Metrics: (0.002998809112510308, 0.0018852459016393442, 0.0023522483370642384)
2026-05-23 02:39:40,539 - optuna.study.study - INFO - Trial 64 finished with values: [0.002998809112510308, 0.0018852459016393442, 0.0023522483370642384] and parameters: {'n_layers': 3, 'embedding_dim': 256, 'lr': 0.00466372845018428, 'lambda_val': 2.1146074643297403e-05, 'batch_size': 1269, 'optimizer': 'SGD'}.
2026-05-23 02:39:45,145 - experiment_functions - INFO - Early stopping at epoch 700. Best Metrics: (0.01547299203167152, 0.010655737704918032, 0.01536325325937545)
2026-05-23 02:39:45,379 - optuna.study.study - INFO - Trial 65 finished with values: [0.01547299203167152, 0.010655737704918032, 0.01536325325937545] and parameters: {'n_layers': 4, 'embedding_dim': 128, 'lr': 0.0020055160341323525, 'lambda_val': 3.929475659781769e-06, 'batch_size': 2891, 'optimizer': 'RMSprop'}.
2026-05-23 02:39:48,451 - experiment_functions - INFO - Early stopping at epoch 600. Best Metrics: (0.040679344573921236, 0.02540983606557377, 0.039874304381349354)
2026-05-23 02:39:49,791 - optuna.study.study - INFO - Trial 66 finished with values: [0.040679344573921236, 0.02540983606557377, 0.039874304381349354] and parameters: {'n_layers': 2, 'embedding_dim': 64, 'lr': 0.0013555052564010479, 'lambda_val': 0.0014273026194918, 'batch_size': 2345, 'optimizer': 'Adam'}.
2026-05-23 02:39:56,408 - experiment_functions - INFO - Early stopping at epoch 1500. Best Metrics: (0.017597410379250143, 0.013032786885245902, 0.01684786334475601)
2026-05-23 02:39:56,511 - optuna.study.study - INFO - Trial 67 finished with values: [0.017597410379250143, 0.013032786885245902, 0.01684786334475601] and parameters: {'n_layers': 2, 'embedding_dim': 128, 'lr': 0.05689630640582892, 'lambda_val': 0.048251117754060005, 'batch_size': 2637, 'optimizer': 'Adam'}.
2026-05-23 02:39:58,729 - experiment_functions - INFO - Early stopping at epoch 500. Best Metrics: (0.0015322476270278147, 0.001639344262295082, 0.0020482440601554087)
2026-05-23 02:39:58,826 - optuna.study.study - INFO - Trial 68 finished with values: [0.0015322476270278147, 0.001639344262295082, 0.0020482440601554087] and parameters: {'n_layers': 1, 'embedding_dim': 32, 'lr': 0.0036479636125195114, 'lambda_val': 2.2233828874401383e-06, 'batch_size': 1534, 'optimizer': 'SGD'}.
2026-05-23 02:40:06,447 - experiment_functions - INFO - Early stopping at epoch 1400. Best Metrics: (0.031195779550569912, 0.019344262295081967, 0.02813883757001254)
2026-05-23 02:40:06,535 - optuna.study.study - INFO - Trial 69 finished with values: [0.031195779550569912, 0.019344262295081967, 0.02813883757001254] and parameters: {'n_layers': 2, 'embedding_dim': 256, 'lr': 0.02107335765652346, 'lambda_val': 0.001458172438893335, 'batch_size': 2773, 'optimizer': 'RMSprop'}.
2026-05-23 02:40:09,558 - experiment_functions - INFO - Early stopping at epoch 500. Best Metrics: (0.0018458757179152254, 0.0013934426229508198, 0.0017320063223981792)
2026-05-23 02:40:10,722 - optuna.study.study - INFO - Trial 70 finished with values: [0.0018458757179152254, 0.0013934426229508198, 0.0017320063223981792] and parameters: {'n_layers': 4, 'embedding_dim': 96, 'lr': 0.019000542348847693, 'lambda_val': 0.004254562856567521, 'batch_size': 652, 'optimizer': 'SGD'}.
2026-05-23 02:40:13,118 - experiment_functions - INFO - Early stopping at epoch 550. Best Metrics: (0.029623239037180296, 0.019508196721311474, 0.026400602226911207)
2026-05-23 02:40:13,217 - optuna.study.study - INFO - Trial 71 finished with values: [0.029623239037180296, 0.019508196721311474, 0.026400602226911207] and parameters: {'n_layers': 1, 'embedding_dim': 64, 'lr': 0.03235167672222509, 'lambda_val': 2.1146074643297403e-05, 'batch_size': 1269, 'optimizer': 'Adam'}.
2026-05-23 02:40:17,559 - experiment_functions - INFO - Early stopping at epoch 700. Best Metrics: (0.03189627858416788, 0.016885245901639347, 0.02690476113493803)
2026-05-23 02:40:17,642 - optuna.study.study - INFO - Trial 72 finished with values: [0.03189627858416788, 0.016885245901639347, 0.02690476113493803] and parameters: {'n_layers': 2, 'embedding_dim': 256, 'lr': 0.00466372845018428, 'lambda_val': 2.1146074643297403e-05, 'batch_size': 2701, 'optimizer': 'RMSprop'}.
2026-05-23 02:40:34,439 - optuna.study.study - INFO - Trial 73 finished with values: [0.030386109734460626, 0.021311475409836064, 0.030440156595361246] and parameters: {'n_layers': 3, 'embedding_dim': 64, 'lr': 0.00015087698888573533, 'lambda_val': 0.0012184553283408725, 'batch_size': 4005, 'optimizer': 'Adam'}.
2026-05-23 02:40:42,003 - experiment_functions - INFO - Early stopping at epoch 500. Best Metrics: (0.0026877393976669933, 0.0017213114754098362, 0.0024452597252310735)
2026-05-23 02:40:42,535 - optuna.study.study - INFO - Trial 74 finished with values: [0.0026877393976669933, 0.0017213114754098362, 0.0024452597252310735] and parameters: {'n_layers': 1, 'embedding_dim': 128, 'lr': 0.07977028062624456, 'lambda_val': 2.2998934295669292e-05, 'batch_size': 880, 'optimizer': 'SGD'}.
2026-05-23 02:40:50,795 - experiment_functions - INFO - Early stopping at epoch 600. Best Metrics: (0.02410699094543288, 0.01778688524590164, 0.025371370868363104)
2026-05-23 02:40:50,963 - optuna.study.study - INFO - Trial 75 finished with values: [0.02410699094543288, 0.01778688524590164, 0.025371370868363104] and parameters: {'n_layers': 4, 'embedding_dim': 128, 'lr': 0.0013555052564010479, 'lambda_val': 0.00046559903847207706, 'batch_size': 1776, 'optimizer': 'Adam'}.
2026-05-23 02:40:53,946 - experiment_functions - INFO - Early stopping at epoch 600. Best Metrics: (0.01661203801685467, 0.012049180327868851, 0.01522836166365488)
2026-05-23 02:40:54,022 - optuna.study.study - INFO - Trial 76 finished with values: [0.01661203801685467, 0.012049180327868851, 0.01522836166365488] and parameters: {'n_layers': 3, 'embedding_dim': 32, 'lr': 0.0036479636125195114, 'lambda_val': 1.1357535977913585e-05, 'batch_size': 1518, 'optimizer': 'RMSprop'}.
2026-05-23 02:41:03,719 - experiment_functions - INFO - Early stopping at epoch 2300. Best Metrics: (0.04194382933984586, 0.03221311475409836, 0.0423952793319301)
2026-05-23 02:41:03,815 - optuna.study.study - INFO - Trial 77 finished with values: [0.04194382933984586, 0.03221311475409836, 0.0423952793319301] and parameters: {'n_layers': 2, 'embedding_dim': 128, 'lr': 0.00015616559996727892, 'lambda_val': 0.013489522394415601, 'batch_size': 2637, 'optimizer': 'RMSprop'}.
2026-05-23 02:41:06,680 - experiment_functions - INFO - Early stopping at epoch 550. Best Metrics: (0.026140824126113578, 0.019836065573770493, 0.030706801070712587)
2026-05-23 02:41:06,769 - optuna.study.study - INFO - Trial 78 finished with values: [0.026140824126113578, 0.019836065573770493, 0.030706801070712587] and parameters: {'n_layers': 3, 'embedding_dim': 32, 'lr': 0.00792179159300908, 'lambda_val': 2.2233828874401383e-06, 'batch_size': 2658, 'optimizer': 'Adam'}.
2026-05-23 02:41:09,750 - experiment_functions - INFO - Early stopping at epoch 600. Best Metrics: (0.024285374838064634, 0.01762295081967213, 0.024413258608717278)
2026-05-23 02:41:09,839 - optuna.study.study - INFO - Trial 79 finished with values: [0.024285374838064634, 0.01762295081967213, 0.024413258608717278] and parameters: {'n_layers': 3, 'embedding_dim': 32, 'lr': 0.0036479636125195114, 'lambda_val': 2.2233828874401383e-06, 'batch_size': 4005, 'optimizer': 'RMSprop'}.
2026-05-23 02:41:14,426 - experiment_functions - INFO - Early stopping at epoch 650. Best Metrics: (0.025826010897267326, 0.010737704918032788, 0.019938056545356915)
2026-05-23 02:41:14,558 - optuna.study.study - INFO - Trial 80 finished with values: [0.025826010897267326, 0.010737704918032788, 0.019938056545356915] and parameters: {'n_layers': 3, 'embedding_dim': 256, 'lr': 0.013407249308971856, 'lambda_val': 2.03435521078093e-06, 'batch_size': 3577, 'optimizer': 'Adam'}.
2026-05-23 02:41:27,667 - optuna.study.study - INFO - Trial 81 finished with values: [0.031177424299750373, 0.022049180327868855, 0.030615510039528702] and parameters: {'n_layers': 1, 'embedding_dim': 128, 'lr': 0.00011658772604970312, 'lambda_val': 1.8374670296062184e-06, 'batch_size': 1399, 'optimizer': 'RMSprop'}.
2026-05-23 02:41:48,041 - optuna.study.study - INFO - Trial 82 finished with values: [0.018458459582016737, 0.01639344262295082, 0.021647781036773978] and parameters: {'n_layers': 2, 'embedding_dim': 256, 'lr': 5.559831217576422e-05, 'lambda_val': 2.2233828874401383e-06, 'batch_size': 2782, 'optimizer': 'RMSprop'}.
2026-05-23 02:42:04,003 - optuna.study.study - INFO - Trial 83 finished with values: [0.012290895021620254, 0.00959016393442623, 0.015055637755536576] and parameters: {'n_layers': 2, 'embedding_dim': 96, 'lr': 4.932918565796537e-05, 'lambda_val': 1.3552076648068048e-05, 'batch_size': 3755, 'optimizer': 'Adam'}.
2026-05-23 02:42:12,159 - experiment_functions - INFO - Early stopping at epoch 1300. Best Metrics: (0.013237710050337545, 0.007704918032786886, 0.012037958724350888)
2026-05-23 02:42:12,403 - optuna.study.study - INFO - Trial 84 finished with values: [0.013237710050337545, 0.007704918032786886, 0.012037958724350888] and parameters: {'n_layers': 3, 'embedding_dim': 256, 'lr': 0.05689630640582892, 'lambda_val': 2.03435521078093e-06, 'batch_size': 1196, 'optimizer': 'Adam'}.
2026-05-23 02:42:15,475 - experiment_functions - INFO - Early stopping at epoch 500. Best Metrics: (0.0026008128796436883, 0.002377049180327869, 0.0028269151196865594)
2026-05-23 02:42:15,573 - optuna.study.study - INFO - Trial 85 finished with values: [0.0026008128796436883, 0.002377049180327869, 0.0028269151196865594] and parameters: {'n_layers': 2, 'embedding_dim': 256, 'lr': 1.3793237824968505e-05, 'lambda_val': 0.0064882006082458005, 'batch_size': 1609, 'optimizer': 'SGD'}.
2026-05-23 02:42:18,214 - experiment_functions - INFO - Early stopping at epoch 500. Best Metrics: (0.001786293688721662, 0.0018852459016393446, 0.0022816107304756143)
2026-05-23 02:42:18,350 - optuna.study.study - INFO - Trial 86 finished with values: [0.001786293688721662, 0.0018852459016393446, 0.0022816107304756143] and parameters: {'n_layers': 2, 'embedding_dim': 96, 'lr': 0.00015524200313215037, 'lambda_val': 0.0005078800969532651, 'batch_size': 4063, 'optimizer': 'SGD'}.
2026-05-23 02:42:22,249 - experiment_functions - INFO - Early stopping at epoch 700. Best Metrics: (0.022927185257947135, 0.013032786885245902, 0.02128841023807226)
2026-05-23 02:42:22,344 - optuna.study.study - INFO - Trial 87 finished with values: [0.022927185257947135, 0.013032786885245902, 0.02128841023807226] and parameters: {'n_layers': 2, 'embedding_dim': 128, 'lr': 0.015248903119772129, 'lambda_val': 5.711933561566114e-06, 'batch_size': 3964, 'optimizer': 'Adam'}.
2026-05-23 02:42:25,889 - experiment_functions - INFO - Early stopping at epoch 500. Best Metrics: (0.004021872111358704, 0.0022950819672131148, 0.002610477482861898)
2026-05-23 02:42:25,978 - optuna.study.study - INFO - Trial 88 finished with values: [0.004021872111358704, 0.0022950819672131148, 0.002610477482861898] and parameters: {'n_layers': 3, 'embedding_dim': 256, 'lr': 0.02479779769698491, 'lambda_val': 0.006647525063630853, 'batch_size': 2129, 'optimizer': 'SGD'}.
2026-05-23 02:42:30,415 - experiment_functions - INFO - Early stopping at epoch 1150. Best Metrics: (0.014996914254841454, 0.010081967213114754, 0.013067591592751374)
2026-05-23 02:42:31,211 - optuna.study.study - INFO - Trial 89 finished with values: [0.014996914254841454, 0.010081967213114754, 0.013067591592751374] and parameters: {'n_layers': 2, 'embedding_dim': 32, 'lr': 0.05689630640582892, 'lambda_val': 0.048251117754060005, 'batch_size': 1534, 'optimizer': 'RMSprop'}.
2026-05-23 02:42:33,777 - experiment_functions - INFO - Early stopping at epoch 550. Best Metrics: (0.04867767859486734, 0.03704918032786886, 0.05114010715179505)
2026-05-23 02:42:33,866 - optuna.study.study - INFO - Trial 90 finished with values: [0.04867767859486734, 0.03704918032786886, 0.05114010715179505] and parameters: {'n_layers': 1, 'embedding_dim': 128, 'lr': 0.0056420762452804776, 'lambda_val': 0.008198149930508243, 'batch_size': 1651, 'optimizer': 'Adam'}.
2026-05-23 02:42:57,508 - optuna.study.study - INFO - Trial 91 finished with values: [0.04753162361300629, 0.03516393442622951, 0.04910497193122634] and parameters: {'n_layers': 3, 'embedding_dim': 256, 'lr': 0.00015087698888573533, 'lambda_val': 1.0486263526014875e-06, 'batch_size': 1084, 'optimizer': 'Adam'}.
2026-05-23 02:43:02,630 - experiment_functions - INFO - Early stopping at epoch 1150. Best Metrics: (0.04570982484287855, 0.032704918032786884, 0.04415206682996988)
2026-05-23 02:43:03,595 - optuna.study.study - INFO - Trial 92 finished with values: [0.04570982484287855, 0.032704918032786884, 0.04415206682996988] and parameters: {'n_layers': 2, 'embedding_dim': 96, 'lr': 0.0005838890493565157, 'lambda_val': 6.501058820242015e-05, 'batch_size': 3577, 'optimizer': 'Adam'}.
2026-05-23 02:43:08,836 - experiment_functions - INFO - Early stopping at epoch 950. Best Metrics: (0.016147611836376037, 0.009344262295081968, 0.0136926129967892)
2026-05-23 02:43:09,415 - optuna.study.study - INFO - Trial 93 finished with values: [0.016147611836376037, 0.009344262295081968, 0.0136926129967892] and parameters: {'n_layers': 3, 'embedding_dim': 128, 'lr': 0.07651787137009443, 'lambda_val': 1.0486263526014875e-06, 'batch_size': 3877, 'optimizer': 'Adam'}.
2026-05-23 02:43:26,344 - optuna.study.study - INFO - Trial 94 finished with values: [0.0268922683690679, 0.02352459016393443, 0.029023004298051592] and parameters: {'n_layers': 4, 'embedding_dim': 32, 'lr': 0.00019324235493803607, 'lambda_val': 8.60783053151504e-05, 'batch_size': 1518, 'optimizer': 'RMSprop'}.
2026-05-23 02:43:28,897 - experiment_functions - INFO - Early stopping at epoch 550. Best Metrics: (0.052512142515571306, 0.039016393442622956, 0.05542314105392106)
2026-05-23 02:43:29,034 - optuna.study.study - INFO - Trial 95 finished with values: [0.052512142515571306, 0.039016393442622956, 0.05542314105392106] and parameters: {'n_layers': 1, 'embedding_dim': 64, 'lr': 0.0056420762452804776, 'lambda_val': 0.0035064867017704023, 'batch_size': 1651, 'optimizer': 'Adam'}.
2026-05-23 02:43:31,991 - experiment_functions - INFO - Early stopping at epoch 550. Best Metrics: (0.03794604938578223, 0.027868852459016394, 0.038809119382381616)
2026-05-23 02:43:32,166 - optuna.study.study - INFO - Trial 96 finished with values: [0.03794604938578223, 0.027868852459016394, 0.038809119382381616] and parameters: {'n_layers': 2, 'embedding_dim': 64, 'lr': 0.004434110743664845, 'lambda_val': 0.0009810927157913494, 'batch_size': 3144, 'optimizer': 'Adam'}.
2026-05-23 02:43:35,065 - experiment_functions - INFO - Early stopping at epoch 500. Best Metrics: (0.0022823516932786486, 0.0017213114754098357, 0.00191601645948034)
2026-05-23 02:43:35,165 - optuna.study.study - INFO - Trial 97 finished with values: [0.0022823516932786486, 0.0017213114754098357, 0.00191601645948034] and parameters: {'n_layers': 4, 'embedding_dim': 32, 'lr': 0.0026177158385323265, 'lambda_val': 5.315424178965949e-06, 'batch_size': 3820, 'optimizer': 'SGD'}.
2026-05-23 02:43:38,149 - experiment_functions - INFO - Early stopping at epoch 500. Best Metrics: (0.0017881010123265032, 0.001639344262295082, 0.0018309968256631037)
2026-05-23 02:43:38,783 - optuna.study.study - INFO - Trial 98 finished with values: [0.0017881010123265032, 0.001639344262295082, 0.0018309968256631037] and parameters: {'n_layers': 3, 'embedding_dim': 128, 'lr': 0.00011658772604970312, 'lambda_val': 2.03435521078093e-06, 'batch_size': 4005, 'optimizer': 'SGD'}.
2026-05-23 02:43:56,978 - experiment_functions - INFO - Early stopping at epoch 3000. Best Metrics: (0.05006202721893355, 0.035409836065573776, 0.05123181697413702)
