2026-05-23 00:54:41,966 - optuna.study.study - INFO - Trial 91 finished with values: [0.0014048888320008926, 0.0013114754098360656, 0.001362251679288091] and parameters: {'n_layers': 3, 'embedding_dim': 64, 'lr': 0.00037668262170108415, 'lambda_val': 0.01898559526463911, 'batch_size': 3822, 'optimizer': 'SGD'}.
2026-05-23 00:54:51,405 - experiment_functions - INFO - Early stopping at epoch 1150. Best Metrics: (0.009372872777544363, 0.010163934426229508, 0.011915681800178032)
2026-05-23 00:54:51,713 - optuna.study.study - INFO - Trial 92 finished with values: [0.009372872777544363, 0.010163934426229508, 0.011915681800178032] and parameters: {'n_layers': 3, 'embedding_dim': 96, 'lr': 0.00037164008089034755, 'lambda_val': 0.05198557064802391, 'batch_size': 1079, 'optimizer': 'Adam'}.
2026-05-23 00:55:05,217 - optuna.study.study - INFO - Trial 93 finished with values: [0.005157266472450384, 0.004344262295081968, 0.005993214278593539] and parameters: {'n_layers': 2, 'embedding_dim': 256, 'lr': 5.9557953840550475e-05, 'lambda_val': 0.00012517387739655414, 'batch_size': 1252, 'optimizer': 'RMSprop'}.
2026-05-23 00:55:07,350 - experiment_functions - INFO - Early stopping at epoch 500. Best Metrics: (0.0009114370790903403, 0.0013934426229508196, 0.0013638417686532838)
2026-05-23 00:55:07,451 - optuna.study.study - INFO - Trial 94 finished with values: [0.0009114370790903403, 0.0013934426229508196, 0.0013638417686532838] and parameters: {'n_layers': 1, 'embedding_dim': 64, 'lr': 9.292602357246689e-05, 'lambda_val': 0.0009242890422830459, 'batch_size': 4026, 'optimizer': 'SGD'}.
2026-05-23 00:55:09,786 - experiment_functions - INFO - Early stopping at epoch 550. Best Metrics: (0.01699092540389492, 0.013524590163934426, 0.018802621471615242)
2026-05-23 00:55:09,872 - optuna.study.study - INFO - Trial 95 finished with values: [0.01699092540389492, 0.013524590163934426, 0.018802621471615242] and parameters: {'n_layers': 1, 'embedding_dim': 96, 'lr': 0.023407816690797043, 'lambda_val': 1.2051712435160432e-05, 'batch_size': 3681, 'optimizer': 'Adam'}.
2026-05-23 00:55:12,300 - experiment_functions - INFO - Early stopping at epoch 550. Best Metrics: (0.020084092197795743, 0.013196721311475411, 0.019899294634349973)
2026-05-23 00:55:12,399 - optuna.study.study - INFO - Trial 96 finished with values: [0.020084092197795743, 0.013196721311475411, 0.019899294634349973] and parameters: {'n_layers': 1, 'embedding_dim': 96, 'lr': 0.026138874490899314, 'lambda_val': 5.5532012635423735e-06, 'batch_size': 2970, 'optimizer': 'Adam'}.
2026-05-23 00:55:14,676 - experiment_functions - INFO - Early stopping at epoch 500. Best Metrics: (0.002091894076824229, 0.0019672131147540984, 0.00226278580704539)
2026-05-23 00:55:14,767 - optuna.study.study - INFO - Trial 97 finished with values: [0.002091894076824229, 0.0019672131147540984, 0.00226278580704539] and parameters: {'n_layers': 4, 'embedding_dim': 32, 'lr': 0.08325120475310396, 'lambda_val': 0.006444212008125494, 'batch_size': 1426, 'optimizer': 'SGD'}.
2026-05-23 00:55:17,368 - experiment_functions - INFO - Early stopping at epoch 550. Best Metrics: (0.02712533657720466, 0.014836065573770494, 0.022982269573678698)
2026-05-23 00:55:17,511 - optuna.study.study - INFO - Trial 98 finished with values: [0.02712533657720466, 0.014836065573770494, 0.022982269573678698] and parameters: {'n_layers': 1, 'embedding_dim': 32, 'lr': 0.005611868685167141, 'lambda_val': 7.376845066520137e-05, 'batch_size': 2394, 'optimizer': 'RMSprop'}.
2026-05-23 00:55:20,476 - experiment_functions - INFO - Early stopping at epoch 800. Best Metrics: (0.023648911503273737, 0.013442622950819674, 0.021252316255305857)
2026-05-23 00:55:20,578 - optuna.study.study - INFO - Trial 99 finished with values: [0.023648911503273737, 0.013442622950819674, 0.021252316255305857] and parameters: {'n_layers': 1, 'embedding_dim': 128, 'lr': 0.010166696672717489, 'lambda_val': 1.0903882774469256e-05, 'batch_size': 1353, 'optimizer': 'Adam'}.
2026-05-23 00:55:23,284 - experiment_functions - INFO - Early stopping at epoch 650. Best Metrics: (0.027653158369706606, 0.016147540983606556, 0.022657258747646458)
2026-05-23 00:55:23,399 - optuna.study.study - INFO - Trial 100 finished with values: [0.027653158369706606, 0.016147540983606556, 0.022657258747646458] and parameters: {'n_layers': 2, 'embedding_dim': 96, 'lr': 0.0018845351019360292, 'lambda_val': 5.5532012635423735e-06, 'batch_size': 1468, 'optimizer': 'RMSprop'}.
2026-05-23 00:55:27,654 - experiment_functions - INFO - Early stopping at epoch 1100. Best Metrics: (0.03041244456788376, 0.016967213114754097, 0.026801545539742816)
2026-05-23 00:55:28,084 - optuna.study.study - INFO - Trial 101 finished with values: [0.03041244456788376, 0.016967213114754097, 0.026801545539742816] and parameters: {'n_layers': 3, 'embedding_dim': 96, 'lr': 0.0004014419530027751, 'lambda_val': 1.2051712435160432e-05, 'batch_size': 2831, 'optimizer': 'Adam'}.
2026-05-23 00:55:36,032 - experiment_functions - INFO - Early stopping at epoch 750. Best Metrics: (0.037520633417727725, 0.019344262295081967, 0.03177911113833273)
2026-05-23 00:55:36,795 - optuna.study.study - INFO - Trial 102 finished with values: [0.037520633417727725, 0.019344262295081967, 0.03177911113833273] and parameters: {'n_layers': 4, 'embedding_dim': 96, 'lr': 0.0007442610977334545, 'lambda_val': 0.0003391336234513702, 'batch_size': 1007, 'optimizer': 'Adam'}.
2026-05-23 00:55:40,456 - experiment_functions - INFO - Early stopping at epoch 700. Best Metrics: (0.026600787796507635, 0.015000000000000001, 0.022701433204464473)
2026-05-23 00:55:40,543 - optuna.study.study - INFO - Trial 103 finished with values: [0.026600787796507635, 0.015000000000000001, 0.022701433204464473] and parameters: {'n_layers': 2, 'embedding_dim': 128, 'lr': 0.0007586035361839872, 'lambda_val': 0.015502429266973289, 'batch_size': 1287, 'optimizer': 'RMSprop'}.
2026-05-23 00:55:52,113 - optuna.study.study - INFO - Trial 104 finished with values: [0.012996818916322652, 0.00959016393442623, 0.012851855005930638] and parameters: {'n_layers': 1, 'embedding_dim': 64, 'lr': 0.00015321866220049384, 'lambda_val': 0.004662435394613103, 'batch_size': 2410, 'optimizer': 'Adam'}.
2026-05-23 00:55:55,011 - experiment_functions - INFO - Early stopping at epoch 750. Best Metrics: (0.025504582430599287, 0.017131147540983604, 0.025615513881369158)
2026-05-23 00:55:55,990 - optuna.study.study - INFO - Trial 105 finished with values: [0.025504582430599287, 0.017131147540983604, 0.025615513881369158] and parameters: {'n_layers': 1, 'embedding_dim': 64, 'lr': 0.00208644616811878, 'lambda_val': 5.228100030668519e-06, 'batch_size': 2979, 'optimizer': 'Adam'}.
2026-05-23 00:55:59,829 - experiment_functions - INFO - Early stopping at epoch 1100. Best Metrics: (0.03262011228133144, 0.018934426229508198, 0.027894093415537016)
2026-05-23 00:55:59,920 - optuna.study.study - INFO - Trial 106 finished with values: [0.03262011228133144, 0.018934426229508198, 0.027894093415537016] and parameters: {'n_layers': 2, 'embedding_dim': 64, 'lr': 0.0004975305503445845, 'lambda_val': 0.00053956191152972, 'batch_size': 1468, 'optimizer': 'RMSprop'}.
2026-05-23 00:56:02,946 - experiment_functions - INFO - Early stopping at epoch 750. Best Metrics: (0.0225603629264062, 0.014754098360655738, 0.021726861965740328)
2026-05-23 00:56:03,045 - optuna.study.study - INFO - Trial 107 finished with values: [0.0225603629264062, 0.014754098360655738, 0.021726861965740328] and parameters: {'n_layers': 4, 'embedding_dim': 96, 'lr': 0.0008732317857197807, 'lambda_val': 0.0011831582271383224, 'batch_size': 1139, 'optimizer': 'Adam'}.
2026-05-23 00:56:06,591 - experiment_functions - INFO - Early stopping at epoch 1000. Best Metrics: (0.03295816704815388, 0.019098360655737705, 0.029725172186262215)
2026-05-23 00:56:07,623 - optuna.study.study - INFO - Trial 108 finished with values: [0.03295816704815388, 0.019098360655737705, 0.029725172186262215] and parameters: {'n_layers': 1, 'embedding_dim': 128, 'lr': 0.0008732317857197807, 'lambda_val': 0.00010898776228747154, 'batch_size': 3011, 'optimizer': 'Adam'}.
2026-05-23 00:56:10,913 - experiment_functions - INFO - Early stopping at epoch 600. Best Metrics: (0.02769966552612843, 0.015655737704918033, 0.02237469130301718)
2026-05-23 00:56:11,003 - optuna.study.study - INFO - Trial 109 finished with values: [0.02769966552612843, 0.015655737704918033, 0.02237469130301718] and parameters: {'n_layers': 4, 'embedding_dim': 256, 'lr': 0.0007442610977334545, 'lambda_val': 2.4582546816090515e-05, 'batch_size': 1254, 'optimizer': 'RMSprop'}.
2026-05-23 00:56:13,800 - experiment_functions - INFO - Early stopping at epoch 750. Best Metrics: (0.011953261545553087, 0.010081967213114754, 0.014189734504337947)
2026-05-23 00:56:13,948 - optuna.study.study - INFO - Trial 110 finished with values: [0.011953261545553087, 0.010081967213114754, 0.014189734504337947] and parameters: {'n_layers': 1, 'embedding_dim': 64, 'lr': 0.0342219547256439, 'lambda_val': 1.6272236642036505e-05, 'batch_size': 1007, 'optimizer': 'RMSprop'}.
2026-05-23 00:56:19,724 - experiment_functions - INFO - Early stopping at epoch 900. Best Metrics: (0.026932367797206758, 0.015409836065573772, 0.0240721333814641)
2026-05-23 00:56:20,352 - optuna.study.study - INFO - Trial 111 finished with values: [0.026932367797206758, 0.015409836065573772, 0.0240721333814641] and parameters: {'n_layers': 2, 'embedding_dim': 64, 'lr': 0.0007586035361839872, 'lambda_val': 0.00088631233841794, 'batch_size': 1468, 'optimizer': 'RMSprop'}.
2026-05-23 00:56:28,602 - experiment_functions - INFO - Early stopping at epoch 600. Best Metrics: (0.02982364051979714, 0.01762295081967213, 0.02551816305659506)
2026-05-23 00:56:29,059 - optuna.study.study - INFO - Trial 112 finished with values: [0.02982364051979714, 0.01762295081967213, 0.02551816305659506] and parameters: {'n_layers': 3, 'embedding_dim': 128, 'lr': 0.0012673220264025206, 'lambda_val': 0.00020972208651910077, 'batch_size': 1639, 'optimizer': 'RMSprop'}.
2026-05-23 00:56:36,660 - experiment_functions - INFO - Early stopping at epoch 1600. Best Metrics: (0.03603908966875029, 0.019426229508196724, 0.02885620778726282)
2026-05-23 00:56:36,806 - optuna.study.study - INFO - Trial 113 finished with values: [0.03603908966875029, 0.019426229508196724, 0.02885620778726282] and parameters: {'n_layers': 1, 'embedding_dim': 96, 'lr': 0.0006997302727889885, 'lambda_val': 5.228100030668519e-06, 'batch_size': 1326, 'optimizer': 'Adam'}.
2026-05-23 00:56:39,926 - experiment_functions - INFO - Early stopping at epoch 500. Best Metrics: (0.0028137386450023203, 0.001475409836065574, 0.0024490487352183633)
2026-05-23 00:56:40,025 - optuna.study.study - INFO - Trial 114 finished with values: [0.0028137386450023203, 0.001475409836065574, 0.0024490487352183633] and parameters: {'n_layers': 1, 'embedding_dim': 128, 'lr': 0.0012673220264025206, 'lambda_val': 5.775336112034289e-05, 'batch_size': 2156, 'optimizer': 'SGD'}.
2026-05-23 00:56:42,295 - experiment_functions - INFO - Early stopping at epoch 500. Best Metrics: (0.0021316199441935788, 0.002377049180327869, 0.0024791843569530116)
2026-05-23 00:56:42,393 - optuna.study.study - INFO - Trial 115 finished with values: [0.0021316199441935788, 0.002377049180327869, 0.0024791843569530116] and parameters: {'n_layers': 2, 'embedding_dim': 32, 'lr': 0.0007586035361839872, 'lambda_val': 7.376845066520137e-05, 'batch_size': 2156, 'optimizer': 'SGD'}.
2026-05-23 00:56:45,638 - experiment_functions - INFO - Early stopping at epoch 850. Best Metrics: (0.02893123150936102, 0.016639344262295082, 0.025209794712389905)
2026-05-23 00:56:46,056 - optuna.study.study - INFO - Trial 116 finished with values: [0.02893123150936102, 0.016639344262295082, 0.025209794712389905] and parameters: {'n_layers': 2, 'embedding_dim': 64, 'lr': 0.0007586035361839872, 'lambda_val': 1.6272236642036505e-05, 'batch_size': 1727, 'optimizer': 'RMSprop'}.
2026-05-23 00:56:49,434 - experiment_functions - INFO - Early stopping at epoch 850. Best Metrics: (0.0363258554704286, 0.017868852459016395, 0.028967587438929833)
2026-05-23 00:56:50,684 - optuna.study.study - INFO - Trial 117 finished with values: [0.0363258554704286, 0.017868852459016395, 0.028967587438929833] and parameters: {'n_layers': 2, 'embedding_dim': 128, 'lr': 0.0007586035361839872, 'lambda_val': 0.0001031838170332706, 'batch_size': 2410, 'optimizer': 'Adam'}.
2026-05-23 00:56:53,225 - experiment_functions - INFO - Early stopping at epoch 550. Best Metrics: (0.027874518483893683, 0.016721311475409836, 0.02512415926730871)
2026-05-23 00:56:53,317 - optuna.study.study - INFO - Trial 118 finished with values: [0.027874518483893683, 0.016721311475409836, 0.02512415926730871] and parameters: {'n_layers': 4, 'embedding_dim': 128, 'lr': 0.0030767169926472077, 'lambda_val': 0.004662435394613103, 'batch_size': 1864, 'optimizer': 'Adam'}.
2026-05-23 00:56:55,646 - experiment_functions - INFO - Early stopping at epoch 500. Best Metrics: (0.002383980229171034, 0.0017213114754098362, 0.002102504061717549)
2026-05-23 00:56:55,740 - optuna.study.study - INFO - Trial 119 finished with values: [0.002383980229171034, 0.0017213114754098362, 0.002102504061717549] and parameters: {'n_layers': 3, 'embedding_dim': 128, 'lr': 0.0006241453841646659, 'lambda_val': 5.228100030668519e-06, 'batch_size': 939, 'optimizer': 'SGD'}.
2026-05-23 00:56:58,508 - experiment_functions - INFO - Early stopping at epoch 550. Best Metrics: (0.014072423062991696, 0.009016393442622951, 0.011851823401670045)
2026-05-23 00:56:58,605 - optuna.study.study - INFO - Trial 120 finished with values: [0.014072423062991696, 0.009016393442622951, 0.011851823401670045] and parameters: {'n_layers': 4, 'embedding_dim': 128, 'lr': 0.012999472865203938, 'lambda_val': 5.472243143002854e-05, 'batch_size': 3011, 'optimizer': 'RMSprop'}.
2026-05-23 00:57:01,928 - experiment_functions - INFO - Early stopping at epoch 750. Best Metrics: (0.031609434860259994, 0.018934426229508194, 0.027921090595727047)
2026-05-23 00:57:02,017 - optuna.study.study - INFO - Trial 121 finished with values: [0.031609434860259994, 0.018934426229508194, 0.027921090595727047] and parameters: {'n_layers': 2, 'embedding_dim': 256, 'lr': 0.0007442610977334545, 'lambda_val': 0.004686874294387785, 'batch_size': 2156, 'optimizer': 'Adam'}.
2026-05-23 00:57:06,115 - experiment_functions - INFO - Early stopping at epoch 750. Best Metrics: (0.028922715318228258, 0.014918032786885247, 0.021644905283990882)
2026-05-23 00:57:06,208 - optuna.study.study - INFO - Trial 122 finished with values: [0.028922715318228258, 0.014918032786885247, 0.021644905283990882] and parameters: {'n_layers': 4, 'embedding_dim': 128, 'lr': 0.0005962779280495407, 'lambda_val': 0.004115172739844668, 'batch_size': 3082, 'optimizer': 'Adam'}.
2026-05-23 00:57:09,464 - experiment_functions - INFO - Early stopping at epoch 700. Best Metrics: (0.017460672815699473, 0.011147540983606558, 0.016563936775126735)
2026-05-23 00:57:09,540 - optuna.study.study - INFO - Trial 123 finished with values: [0.017460672815699473, 0.011147540983606558, 0.016563936775126735] and parameters: {'n_layers': 3, 'embedding_dim': 128, 'lr': 0.0004908910385795771, 'lambda_val': 0.021707008087328228, 'batch_size': 2979, 'optimizer': 'RMSprop'}.
2026-05-23 00:57:12,182 - experiment_functions - INFO - Early stopping at epoch 550. Best Metrics: (0.011119272390231407, 0.009262295081967215, 0.011893221700783102)
2026-05-23 00:57:12,264 - optuna.study.study - INFO - Trial 124 finished with values: [0.011119272390231407, 0.009262295081967215, 0.011893221700783102] and parameters: {'n_layers': 4, 'embedding_dim': 96, 'lr': 0.0012673220264025206, 'lambda_val': 0.02068841888151619, 'batch_size': 3659, 'optimizer': 'RMSprop'}.
2026-05-23 00:57:17,410 - experiment_functions - INFO - Early stopping at epoch 1400. Best Metrics: (0.02841300475050879, 0.018114754098360657, 0.026630537352960518)
2026-05-23 00:57:17,723 - optuna.study.study - INFO - Trial 125 finished with values: [0.02841300475050879, 0.018114754098360657, 0.026630537352960518] and parameters: {'n_layers': 1, 'embedding_dim': 256, 'lr': 0.00034335523469639003, 'lambda_val': 0.006616376079935662, 'batch_size': 3659, 'optimizer': 'Adam'}.
2026-05-23 00:57:20,135 - experiment_functions - INFO - Early stopping at epoch 500. Best Metrics: (0.002799770990672675, 0.0017213114754098366, 0.0027521869685503595)
2026-05-23 00:57:20,268 - optuna.study.study - INFO - Trial 126 finished with values: [0.002799770990672675, 0.0017213114754098366, 0.0027521869685503595] and parameters: {'n_layers': 4, 'embedding_dim': 96, 'lr': 0.0004014419530027751, 'lambda_val': 6.335945209609284e-06, 'batch_size': 2831, 'optimizer': 'SGD'}.
2026-05-23 00:57:22,986 - experiment_functions - INFO - Early stopping at epoch 600. Best Metrics: (0.030772382546975705, 0.019098360655737705, 0.028742615562073477)
2026-05-23 00:57:23,072 - optuna.study.study - INFO - Trial 127 finished with values: [0.030772382546975705, 0.019098360655737705, 0.028742615562073477] and parameters: {'n_layers': 3, 'embedding_dim': 96, 'lr': 0.0021135494885504793, 'lambda_val': 5.228100030668519e-06, 'batch_size': 1079, 'optimizer': 'Adam'}.
2026-05-23 00:57:26,286 - experiment_functions - INFO - Early stopping at epoch 950. Best Metrics: (0.03708159049340397, 0.018688524590163937, 0.03140983693174934)
2026-05-23 00:57:26,372 - optuna.study.study - INFO - Trial 128 finished with values: [0.03708159049340397, 0.018688524590163937, 0.03140983693174934] and parameters: {'n_layers': 1, 'embedding_dim': 32, 'lr': 0.0012673220264025206, 'lambda_val': 5.775336112034289e-05, 'batch_size': 1639, 'optimizer': 'RMSprop'}.
2026-05-23 00:57:28,732 - experiment_functions - INFO - Early stopping at epoch 550. Best Metrics: (0.018546329772034735, 0.012459016393442622, 0.0165014946974559)
2026-05-23 00:57:28,806 - optuna.study.study - INFO - Trial 129 finished with values: [0.018546329772034735, 0.012459016393442622, 0.0165014946974559] and parameters: {'n_layers': 2, 'embedding_dim': 96, 'lr': 0.0018845351019360292, 'lambda_val': 0.02068841888151619, 'batch_size': 3823, 'optimizer': 'RMSprop'}.
2026-05-23 00:57:34,744 - experiment_functions - INFO - Early stopping at epoch 1350. Best Metrics: (0.03524854474669626, 0.01959016393442623, 0.02960290658046204)
2026-05-23 00:57:35,425 - optuna.study.study - INFO - Trial 130 finished with values: [0.03524854474669626, 0.01959016393442623, 0.02960290658046204] and parameters: {'n_layers': 3, 'embedding_dim': 96, 'lr': 0.00037164008089034755, 'lambda_val': 6.335945209609284e-06, 'batch_size': 1079, 'optimizer': 'Adam'}.
2026-05-23 00:57:43,204 - experiment_functions - INFO - Early stopping at epoch 600. Best Metrics: (0.026255976848542136, 0.014098360655737708, 0.0216325465898845)
2026-05-23 00:57:45,610 - optuna.study.study - INFO - Trial 131 finished with values: [0.026255976848542136, 0.014098360655737708, 0.0216325465898845] and parameters: {'n_layers': 1, 'embedding_dim': 32, 'lr': 0.005611868685167141, 'lambda_val': 7.376845066520137e-05, 'batch_size': 2394, 'optimizer': 'RMSprop'}.
2026-05-23 00:57:51,068 - experiment_functions - INFO - Early stopping at epoch 700. Best Metrics: (0.021931846745919713, 0.013196721311475411, 0.019400153393686892)
2026-05-23 00:57:52,267 - optuna.study.study - INFO - Trial 132 finished with values: [0.021931846745919713, 0.013196721311475411, 0.019400153393686892] and parameters: {'n_layers': 4, 'embedding_dim': 64, 'lr': 0.0007586035361839872, 'lambda_val': 0.0001031838170332706, 'batch_size': 2410, 'optimizer': 'RMSprop'}.
2026-05-23 00:57:58,509 - experiment_functions - INFO - Early stopping at epoch 2100. Best Metrics: (0.03192843936467335, 0.017868852459016395, 0.02907926157255368)
2026-05-23 00:57:58,591 - optuna.study.study - INFO - Trial 133 finished with values: [0.03192843936467335, 0.017868852459016395, 0.02907926157255368] and parameters: {'n_layers': 1, 'embedding_dim': 64, 'lr': 0.0006241453841646659, 'lambda_val': 5.5532012635423735e-06, 'batch_size': 939, 'optimizer': 'Adam'}.
2026-05-23 00:58:00,934 - experiment_functions - INFO - Early stopping at epoch 550. Best Metrics: (0.014589697760433512, 0.009508196721311476, 0.015502107315082368)
2026-05-23 00:58:01,578 - optuna.study.study - INFO - Trial 134 finished with values: [0.014589697760433512, 0.009508196721311476, 0.015502107315082368] and parameters: {'n_layers': 2, 'embedding_dim': 96, 'lr': 0.0018845351019360292, 'lambda_val': 0.024269426427970246, 'batch_size': 1468, 'optimizer': 'RMSprop'}.
2026-05-23 00:58:04,326 - experiment_functions - INFO - Early stopping at epoch 700. Best Metrics: (0.03257264908929626, 0.018032786885245903, 0.027564658565657686)
2026-05-23 00:58:04,415 - optuna.study.study - INFO - Trial 135 finished with values: [0.03257264908929626, 0.018032786885245903, 0.027564658565657686] and parameters: {'n_layers': 1, 'embedding_dim': 64, 'lr': 0.0030767169926472077, 'lambda_val': 1.0903882774469256e-05, 'batch_size': 1353, 'optimizer': 'Adam'}.
2026-05-23 00:58:07,341 - experiment_functions - INFO - Early stopping at epoch 700. Best Metrics: (0.026071858375877957, 0.01557377049180328, 0.021481190277716295)
2026-05-23 00:58:07,878 - optuna.study.study - INFO - Trial 136 finished with values: [0.026071858375877957, 0.01557377049180328, 0.021481190277716295] and parameters: {'n_layers': 4, 'embedding_dim': 96, 'lr': 0.0007586035361839872, 'lambda_val': 0.0007172417291421626, 'batch_size': 1492, 'optimizer': 'RMSprop'}.
2026-05-23 00:58:17,797 - experiment_functions - INFO - Early stopping at epoch 3400. Best Metrics: (0.027498397332143844, 0.016229508196721313, 0.02380827474221212)
