2026-05-23 04:13:13,009 - optuna.study.study - INFO - Trial 2 finished with values: [0.0019245900418798554, 0.0014754098360655738, 0.0019700735790314596] and parameters: {'n_layers': 3, 'embedding_dim': 256, 'lr': 0.000444153331580694, 'lambda_val': 0.000746519711761532, 'batch_size': 2842, 'optimizer': 'SGD'}.
2026-05-23 04:13:25,224 - experiment_functions - INFO - Early stopping at epoch 3400. Best Metrics: (0.04506465669635169, 0.021311475409836064, 0.036197383179901)
2026-05-23 04:13:25,323 - optuna.study.study - INFO - Trial 3 finished with values: [0.04506465669635169, 0.021311475409836064, 0.036197383179901] and parameters: {'n_layers': 2, 'embedding_dim': 64, 'lr': 0.02990805822010038, 'lambda_val': 0.001092384612961102, 'batch_size': 3821, 'optimizer': 'RMSprop'}.
2026-05-23 04:13:30,179 - experiment_functions - INFO - Early stopping at epoch 1200. Best Metrics: (0.010184464326754473, 0.00819672131147541, 0.011437742205234264)
2026-05-23 04:13:30,941 - optuna.study.study - INFO - Trial 4 finished with values: [0.010184464326754473, 0.00819672131147541, 0.011437742205234264] and parameters: {'n_layers': 1, 'embedding_dim': 256, 'lr': 0.08092159114837257, 'lambda_val': 0.0007862951211926313, 'batch_size': 649, 'optimizer': 'RMSprop'}.
2026-05-23 04:13:33,309 - experiment_functions - INFO - Early stopping at epoch 500. Best Metrics: (0.0018150520879106227, 0.0013114754098360656, 0.002034948482942097)
2026-05-23 04:13:33,403 - optuna.study.study - INFO - Trial 5 finished with values: [0.0018150520879106227, 0.0013114754098360656, 0.002034948482942097] and parameters: {'n_layers': 3, 'embedding_dim': 32, 'lr': 0.0001295152361111425, 'lambda_val': 7.256730340361083e-06, 'batch_size': 538, 'optimizer': 'SGD'}.
2026-05-23 04:13:47,488 - optuna.study.study - INFO - Trial 6 finished with values: [0.02366034193079273, 0.014344262295081968, 0.023030476742389457] and parameters: {'n_layers': 2, 'embedding_dim': 64, 'lr': 7.466128919882156e-05, 'lambda_val': 0.00062453091272787, 'batch_size': 3271, 'optimizer': 'RMSprop'}.
2026-05-23 04:14:02,514 - optuna.study.study - INFO - Trial 7 finished with values: [0.009300303089019642, 0.006147540983606557, 0.009382185198656726] and parameters: {'n_layers': 2, 'embedding_dim': 128, 'lr': 5.790623176035216e-05, 'lambda_val': 1.554000639581942e-06, 'batch_size': 944, 'optimizer': 'Adam'}.
2026-05-23 04:14:05,286 - experiment_functions - INFO - Early stopping at epoch 550. Best Metrics: (0.0016328482424753667, 0.001475409836065574, 0.001779480023337575)
2026-05-23 04:14:05,386 - optuna.study.study - INFO - Trial 8 finished with values: [0.0016328482424753667, 0.001475409836065574, 0.001779480023337575] and parameters: {'n_layers': 1, 'embedding_dim': 256, 'lr': 0.012189239332707642, 'lambda_val': 0.004522310405441063, 'batch_size': 3092, 'optimizer': 'SGD'}.
2026-05-23 04:14:08,355 - experiment_functions - INFO - Early stopping at epoch 500. Best Metrics: (0.0019165945554675211, 0.0020491803278688526, 0.0021467527881465632)
2026-05-23 04:14:08,518 - optuna.study.study - INFO - Trial 9 finished with values: [0.0019165945554675211, 0.0020491803278688526, 0.0021467527881465632] and parameters: {'n_layers': 3, 'embedding_dim': 128, 'lr': 0.0219897682213557, 'lambda_val': 0.016843643973547776, 'batch_size': 1385, 'optimizer': 'SGD'}.
2026-05-23 04:14:16,572 - experiment_functions - INFO - Early stopping at epoch 1150. Best Metrics: (0.05235795545582857, 0.028442622950819674, 0.044549741332688714)
2026-05-23 04:14:16,653 - optuna.study.study - INFO - Trial 10 finished with values: [0.05235795545582857, 0.028442622950819674, 0.044549741332688714] and parameters: {'n_layers': 4, 'embedding_dim': 256, 'lr': 0.0002758788994373932, 'lambda_val': 4.5174002812526645e-05, 'batch_size': 1427, 'optimizer': 'RMSprop'}.
2026-05-23 04:14:18,973 - experiment_functions - INFO - Early stopping at epoch 500. Best Metrics: (0.0023828470073852933, 0.0020491803278688526, 0.0029623876159202197)
2026-05-23 04:14:19,113 - optuna.study.study - INFO - Trial 11 finished with values: [0.0023828470073852933, 0.0020491803278688526, 0.0029623876159202197] and parameters: {'n_layers': 2, 'embedding_dim': 32, 'lr': 0.0010602693611052227, 'lambda_val': 1.374096848370064e-06, 'batch_size': 2680, 'optimizer': 'SGD'}.
2026-05-23 04:14:33,133 - optuna.study.study - INFO - Trial 12 finished with values: [0.012513074404561368, 0.006065573770491804, 0.010040519706108796] and parameters: {'n_layers': 2, 'embedding_dim': 96, 'lr': 4.645656890020163e-05, 'lambda_val': 1.2217706587380246e-06, 'batch_size': 1308, 'optimizer': 'RMSprop'}.
2026-05-23 04:14:35,516 - experiment_functions - INFO - Early stopping at epoch 500. Best Metrics: (0.0016451165559427648, 0.0011475409836065576, 0.0020485985513625632)
2026-05-23 04:14:35,601 - optuna.study.study - INFO - Trial 13 finished with values: [0.0016451165559427648, 0.0011475409836065576, 0.0020485985513625632] and parameters: {'n_layers': 3, 'embedding_dim': 96, 'lr': 0.03135377993567746, 'lambda_val': 1.4637749004012292e-06, 'batch_size': 1462, 'optimizer': 'SGD'}.
2026-05-23 04:14:38,381 - experiment_functions - INFO - Early stopping at epoch 500. Best Metrics: (0.0024610332703490375, 0.0018032786885245904, 0.0024726403201267714)
2026-05-23 04:14:38,481 - optuna.study.study - INFO - Trial 14 finished with values: [0.0024610332703490375, 0.0018032786885245904, 0.0024726403201267714] and parameters: {'n_layers': 4, 'embedding_dim': 96, 'lr': 0.006677452205663748, 'lambda_val': 0.00025328780171676946, 'batch_size': 1653, 'optimizer': 'SGD'}.
2026-05-23 04:14:40,687 - experiment_functions - INFO - Early stopping at epoch 500. Best Metrics: (0.0019844592984434514, 0.0012295081967213116, 0.002365286516742715)
2026-05-23 04:14:40,784 - optuna.study.study - INFO - Trial 15 finished with values: [0.0019844592984434514, 0.0012295081967213116, 0.002365286516742715] and parameters: {'n_layers': 1, 'embedding_dim': 32, 'lr': 0.0002645419878273553, 'lambda_val': 0.01332528370869152, 'batch_size': 2955, 'optimizer': 'SGD'}.
2026-05-23 04:14:50,423 - experiment_functions - INFO - Early stopping at epoch 2700. Best Metrics: (0.030825367887164286, 0.020737704918032788, 0.027597541568400424)
2026-05-23 04:14:50,520 - optuna.study.study - INFO - Trial 16 finished with values: [0.030825367887164286, 0.020737704918032788, 0.027597541568400424] and parameters: {'n_layers': 4, 'embedding_dim': 32, 'lr': 0.00017970143388914436, 'lambda_val': 0.00021677474817854593, 'batch_size': 1582, 'optimizer': 'Adam'}.
2026-05-23 04:15:00,693 - optuna.study.study - INFO - Trial 17 finished with values: [0.005779799294524485, 0.004180327868852459, 0.005739291676930977] and parameters: {'n_layers': 1, 'embedding_dim': 32, 'lr': 5.537773148410438e-05, 'lambda_val': 0.00011523339069242345, 'batch_size': 2893, 'optimizer': 'RMSprop'}.
2026-05-23 04:15:09,118 - experiment_functions - INFO - Early stopping at epoch 2200. Best Metrics: (0.022099924959860066, 0.014016393442622952, 0.020360790830367508)
2026-05-23 04:15:09,258 - optuna.study.study - INFO - Trial 18 finished with values: [0.022099924959860066, 0.014016393442622952, 0.020360790830367508] and parameters: {'n_layers': 3, 'embedding_dim': 96, 'lr': 0.09106756518072165, 'lambda_val': 0.0038546327658745766, 'batch_size': 2324, 'optimizer': 'RMSprop'}.
2026-05-23 04:15:12,290 - experiment_functions - INFO - Early stopping at epoch 500. Best Metrics: (0.0023005423588308874, 0.0018032786885245904, 0.0026435053312485373)
2026-05-23 04:15:12,368 - optuna.study.study - INFO - Trial 19 finished with values: [0.0023005423588308874, 0.0018032786885245904, 0.0026435053312485373] and parameters: {'n_layers': 4, 'embedding_dim': 128, 'lr': 0.00021244083219355942, 'lambda_val': 3.1186599995256504e-05, 'batch_size': 3572, 'optimizer': 'SGD'}.
2026-05-23 04:15:19,469 - experiment_functions - INFO - Early stopping at epoch 2000. Best Metrics: (0.016215975914075458, 0.01254098360655738, 0.01834395862461289)
2026-05-23 04:15:19,541 - optuna.study.study - INFO - Trial 20 finished with values: [0.016215975914075458, 0.01254098360655738, 0.01834395862461289] and parameters: {'n_layers': 2, 'embedding_dim': 64, 'lr': 0.02553831304260938, 'lambda_val': 0.03849528838868552, 'batch_size': 1576, 'optimizer': 'RMSprop'}.
2026-05-23 04:15:30,252 - optuna.study.study - INFO - Trial 21 finished with values: [0.012095889045018165, 0.009508196721311476, 0.013008705432325837] and parameters: {'n_layers': 1, 'embedding_dim': 64, 'lr': 8.124800370693163e-05, 'lambda_val': 0.00037894592886494253, 'batch_size': 2370, 'optimizer': 'RMSprop'}.
2026-05-23 04:15:38,288 - experiment_functions - INFO - Early stopping at epoch 2050. Best Metrics: (0.019581057930920957, 0.0072131147540983615, 0.013888589700295908)
2026-05-23 04:15:38,384 - optuna.study.study - INFO - Trial 22 finished with values: [0.019581057930920957, 0.0072131147540983615, 0.013888589700295908] and parameters: {'n_layers': 4, 'embedding_dim': 64, 'lr': 0.09103529918529618, 'lambda_val': 3.4373462504025866e-05, 'batch_size': 2631, 'optimizer': 'Adam'}.
2026-05-23 04:15:41,008 - experiment_functions - INFO - Early stopping at epoch 650. Best Metrics: (0.050164528344266865, 0.026065573770491804, 0.04103311246420311)
2026-05-23 04:15:41,152 - optuna.study.study - INFO - Trial 23 finished with values: [0.050164528344266865, 0.026065573770491804, 0.04103311246420311] and parameters: {'n_layers': 3, 'embedding_dim': 32, 'lr': 0.0011639497848050708, 'lambda_val': 0.000832274284637742, 'batch_size': 604, 'optimizer': 'RMSprop'}.
2026-05-23 04:15:55,797 - experiment_functions - INFO - Early stopping at epoch 3200. Best Metrics: (0.0426207723641853, 0.022295081967213116, 0.03648709205041605)
2026-05-23 04:15:56,398 - optuna.study.study - INFO - Trial 24 finished with values: [0.0426207723641853, 0.022295081967213116, 0.03648709205041605] and parameters: {'n_layers': 2, 'embedding_dim': 256, 'lr': 0.0406369613134867, 'lambda_val': 0.002018128655848671, 'batch_size': 3562, 'optimizer': 'Adam'}.
2026-05-23 04:16:05,403 - experiment_functions - INFO - Early stopping at epoch 3100. Best Metrics: (0.002225520808725876, 0.002213114754098361, 0.0027105903170664505)
2026-05-23 04:16:05,494 - optuna.study.study - INFO - Trial 25 finished with values: [0.002225520808725876, 0.002213114754098361, 0.0027105903170664505] and parameters: {'n_layers': 2, 'embedding_dim': 64, 'lr': 1.945874674058634e-05, 'lambda_val': 5.716195116201499e-06, 'batch_size': 1720, 'optimizer': 'Adam'}.
2026-05-23 04:16:08,998 - experiment_functions - INFO - Early stopping at epoch 500. Best Metrics: (0.0036685439307638395, 0.0018852459016393446, 0.0029423356555263397)
2026-05-23 04:16:09,096 - optuna.study.study - INFO - Trial 26 finished with values: [0.0036685439307638395, 0.0018852459016393446, 0.0029423356555263397] and parameters: {'n_layers': 3, 'embedding_dim': 256, 'lr': 1.297151300970941e-05, 'lambda_val': 0.0013514799251675893, 'batch_size': 1941, 'optimizer': 'SGD'}.
2026-05-23 04:16:24,063 - optuna.study.study - INFO - Trial 27 finished with values: [0.0046524660271535555, 0.003934426229508197, 0.005070447498831792] and parameters: {'n_layers': 1, 'embedding_dim': 256, 'lr': 4.417687553726942e-05, 'lambda_val': 0.0009962507800702286, 'batch_size': 3335, 'optimizer': 'RMSprop'}.
2026-05-23 04:16:34,613 - experiment_functions - INFO - Early stopping at epoch 800. Best Metrics: (0.05053198147133, 0.027213114754098364, 0.04469347007712596)
2026-05-23 04:16:35,325 - optuna.study.study - INFO - Trial 28 finished with values: [0.05053198147133, 0.027213114754098364, 0.04469347007712596] and parameters: {'n_layers': 3, 'embedding_dim': 256, 'lr': 0.0004803146544874298, 'lambda_val': 2.5817364532829402e-05, 'batch_size': 2183, 'optimizer': 'RMSprop'}.
2026-05-23 04:16:44,478 - experiment_functions - INFO - Early stopping at epoch 750. Best Metrics: (0.0356238328621208, 0.020901639344262295, 0.030615385169884917)
2026-05-23 04:16:45,045 - optuna.study.study - INFO - Trial 29 finished with values: [0.0356238328621208, 0.020901639344262295, 0.030615385169884917] and parameters: {'n_layers': 4, 'embedding_dim': 256, 'lr': 0.0003054746060910338, 'lambda_val': 0.0002794201622830738, 'batch_size': 2468, 'optimizer': 'RMSprop'}.
2026-05-23 04:16:48,797 - experiment_functions - INFO - Early stopping at epoch 850. Best Metrics: (0.0257720528489037, 0.012540983606557376, 0.020038284652510154)
2026-05-23 04:16:49,217 - optuna.study.study - INFO - Trial 30 finished with values: [0.0257720528489037, 0.012540983606557376, 0.020038284652510154] and parameters: {'n_layers': 3, 'embedding_dim': 64, 'lr': 0.004473575507756899, 'lambda_val': 0.0006976990437379927, 'batch_size': 817, 'optimizer': 'RMSprop'}.
2026-05-23 04:16:55,136 - experiment_functions - INFO - Early stopping at epoch 1200. Best Metrics: (0.009068697539281186, 0.00819672131147541, 0.010445051925747127)
2026-05-23 04:16:55,704 - optuna.study.study - INFO - Trial 31 finished with values: [0.009068697539281186, 0.00819672131147541, 0.010445051925747127] and parameters: {'n_layers': 4, 'embedding_dim': 96, 'lr': 0.003089269906462994, 'lambda_val': 0.029290434640410864, 'batch_size': 805, 'optimizer': 'RMSprop'}.
2026-05-23 04:16:58,270 - experiment_functions - INFO - Early stopping at epoch 500. Best Metrics: (0.001316067500079882, 0.0017213114754098362, 0.001858331580248083)
2026-05-23 04:16:58,360 - optuna.study.study - INFO - Trial 32 finished with values: [0.001316067500079882, 0.0017213114754098362, 0.001858331580248083] and parameters: {'n_layers': 2, 'embedding_dim': 128, 'lr': 0.00014371961670453065, 'lambda_val': 0.01996479013146454, 'batch_size': 2401, 'optimizer': 'SGD'}.
2026-05-23 04:17:02,842 - experiment_functions - INFO - Early stopping at epoch 1000. Best Metrics: (0.07136379120853152, 0.03622950819672131, 0.05867212548309887)
2026-05-23 04:17:02,923 - optuna.study.study - INFO - Trial 33 finished with values: [0.07136379120853152, 0.03622950819672131, 0.05867212548309887] and parameters: {'n_layers': 2, 'embedding_dim': 128, 'lr': 0.00039831203487280473, 'lambda_val': 0.002225291349266682, 'batch_size': 2002, 'optimizer': 'RMSprop'}.
2026-05-23 04:17:05,088 - experiment_functions - INFO - Early stopping at epoch 500. Best Metrics: (0.000852952497875511, 0.0013114754098360656, 0.0018603386473985174)
2026-05-23 04:17:05,175 - optuna.study.study - INFO - Trial 34 finished with values: [0.000852952497875511, 0.0013114754098360656, 0.0018603386473985174] and parameters: {'n_layers': 1, 'embedding_dim': 96, 'lr': 0.01057344924732702, 'lambda_val': 1.603918116860512e-05, 'batch_size': 1636, 'optimizer': 'SGD'}.
2026-05-23 04:17:08,800 - experiment_functions - INFO - Early stopping at epoch 500. Best Metrics: (0.017727433139490593, 0.00819672131147541, 0.014165397850661331)
2026-05-23 04:17:08,887 - optuna.study.study - INFO - Trial 35 finished with values: [0.017727433139490593, 0.00819672131147541, 0.014165397850661331] and parameters: {'n_layers': 3, 'embedding_dim': 256, 'lr': 0.0399895421175634, 'lambda_val': 0.006639299505918974, 'batch_size': 3872, 'optimizer': 'RMSprop'}.
2026-05-23 04:17:12,453 - experiment_functions - INFO - Early stopping at epoch 650. Best Metrics: (0.027247275369628395, 0.01622950819672131, 0.027710747267161058)
2026-05-23 04:17:12,574 - optuna.study.study - INFO - Trial 36 finished with values: [0.027247275369628395, 0.01622950819672131, 0.027710747267161058] and parameters: {'n_layers': 3, 'embedding_dim': 128, 'lr': 0.002000405672242202, 'lambda_val': 0.0003830295511690824, 'batch_size': 2409, 'optimizer': 'RMSprop'}.
2026-05-23 04:17:15,663 - experiment_functions - INFO - Early stopping at epoch 600. Best Metrics: (0.06571002646904038, 0.026721311475409838, 0.04465023072137661)
2026-05-23 04:17:15,754 - optuna.study.study - INFO - Trial 37 finished with values: [0.06571002646904038, 0.026721311475409838, 0.04465023072137661] and parameters: {'n_layers': 1, 'embedding_dim': 256, 'lr': 0.01729355128210771, 'lambda_val': 1.4811025229652691e-05, 'batch_size': 3576, 'optimizer': 'Adam'}.
2026-05-23 04:17:17,915 - experiment_functions - INFO - Early stopping at epoch 500. Best Metrics: (0.0017205354935056528, 0.0020491803278688526, 0.002200352699428969)
2026-05-23 04:17:18,003 - optuna.study.study - INFO - Trial 38 finished with values: [0.0017205354935056528, 0.0020491803278688526, 0.002200352699428969] and parameters: {'n_layers': 1, 'embedding_dim': 64, 'lr': 0.00466856942146688, 'lambda_val': 0.00986473029610754, 'batch_size': 3135, 'optimizer': 'SGD'}.
2026-05-23 04:17:44,481 - optuna.study.study - INFO - Trial 39 finished with values: [0.014828161824178033, 0.00860655737704918, 0.014262286369035945] and parameters: {'n_layers': 4, 'embedding_dim': 256, 'lr': 3.4982045311689254e-05, 'lambda_val': 0.0001595232884371999, 'batch_size': 1469, 'optimizer': 'RMSprop'}.
2026-05-23 04:17:57,394 - experiment_functions - INFO - Early stopping at epoch 3850. Best Metrics: (0.0020867010886755554, 0.0017213114754098366, 0.0019904957919894346)
2026-05-23 04:17:57,478 - optuna.study.study - INFO - Trial 40 finished with values: [0.0020867010886755554, 0.0017213114754098366, 0.0019904957919894346] and parameters: {'n_layers': 2, 'embedding_dim': 64, 'lr': 2.3441841423245388e-05, 'lambda_val': 1.8513831213284574e-05, 'batch_size': 2240, 'optimizer': 'Adam'}.
2026-05-23 04:18:09,735 - experiment_functions - INFO - Early stopping at epoch 3250. Best Metrics: (0.046516207816224626, 0.028278688524590163, 0.038598492681110985)
2026-05-23 04:18:09,818 - optuna.study.study - INFO - Trial 41 finished with values: [0.046516207816224626, 0.028278688524590163, 0.038598492681110985] and parameters: {'n_layers': 3, 'embedding_dim': 32, 'lr': 0.00030210764029141594, 'lambda_val': 0.0011674275547394154, 'batch_size': 2288, 'optimizer': 'Adam'}.
2026-05-23 04:18:15,099 - experiment_functions - INFO - Early stopping at epoch 1350. Best Metrics: (0.08525693447506696, 0.044426229508196725, 0.07672342666229308)
2026-05-23 04:18:15,447 - optuna.study.study - INFO - Trial 42 finished with values: [0.08525693447506696, 0.044426229508196725, 0.07672342666229308] and parameters: {'n_layers': 2, 'embedding_dim': 64, 'lr': 0.0005076161055190746, 'lambda_val': 1.5250659263577613e-05, 'batch_size': 1477, 'optimizer': 'Adam'}.
2026-05-23 04:18:21,876 - experiment_functions - INFO - Early stopping at epoch 1600. Best Metrics: (0.021120238275457122, 0.012950819672131148, 0.01860824492633654)
2026-05-23 04:18:23,221 - optuna.study.study - INFO - Trial 43 finished with values: [0.021120238275457122, 0.012950819672131148, 0.01860824492633654] and parameters: {'n_layers': 3, 'embedding_dim': 32, 'lr': 0.013467154695281406, 'lambda_val': 0.002163595970301106, 'batch_size': 4061, 'optimizer': 'RMSprop'}.
2026-05-23 04:18:25,889 - experiment_functions - INFO - Early stopping at epoch 500. Best Metrics: (0.001182871734922053, 0.0010655737704918034, 0.0012703589153063234)
2026-05-23 04:18:25,982 - optuna.study.study - INFO - Trial 44 finished with values: [0.001182871734922053, 0.0010655737704918034, 0.0012703589153063234] and parameters: {'n_layers': 3, 'embedding_dim': 32, 'lr': 2.0758832292088727e-05, 'lambda_val': 1.4842704264338568e-06, 'batch_size': 3741, 'optimizer': 'SGD'}.
2026-05-23 04:18:28,663 - experiment_functions - INFO - Early stopping at epoch 500. Best Metrics: (0.002744088940552641, 0.001639344262295082, 0.0024005082645699284)
2026-05-23 04:18:28,733 - optuna.study.study - INFO - Trial 45 finished with values: [0.002744088940552641, 0.001639344262295082, 0.0024005082645699284] and parameters: {'n_layers': 3, 'embedding_dim': 64, 'lr': 0.037696722978878265, 'lambda_val': 0.007650682958624026, 'batch_size': 3321, 'optimizer': 'SGD'}.
2026-05-23 04:18:31,398 - experiment_functions - INFO - Early stopping at epoch 500. Best Metrics: (0.0014282177186992569, 0.0018032786885245904, 0.001731715083907212)
2026-05-23 04:18:31,489 - optuna.study.study - INFO - Trial 46 finished with values: [0.0014282177186992569, 0.0018032786885245904, 0.001731715083907212] and parameters: {'n_layers': 4, 'embedding_dim': 64, 'lr': 4.321846210984281e-05, 'lambda_val': 0.00010447269915261112, 'batch_size': 1887, 'optimizer': 'SGD'}.
2026-05-23 04:18:34,685 - experiment_functions - INFO - Early stopping at epoch 550. Best Metrics: (0.04365722192558221, 0.02540983606557377, 0.04392912877849662)
2026-05-23 04:18:34,775 - optuna.study.study - INFO - Trial 47 finished with values: [0.04365722192558221, 0.02540983606557377, 0.04392912877849662] and parameters: {'n_layers': 3, 'embedding_dim': 128, 'lr': 0.001134436508843411, 'lambda_val': 4.043398626155609e-05, 'batch_size': 2902, 'optimizer': 'RMSprop'}.
2026-05-23 04:18:37,798 - experiment_functions - INFO - Early stopping at epoch 550. Best Metrics: (0.06387503530271767, 0.03549180327868852, 0.05373409759593384)
2026-05-23 04:18:38,294 - optuna.study.study - INFO - Trial 48 finished with values: [0.06387503530271767, 0.03549180327868852, 0.05373409759593384] and parameters: {'n_layers': 2, 'embedding_dim': 128, 'lr': 0.0031094691602440725, 'lambda_val': 0.0060103019678805995, 'batch_size': 1954, 'optimizer': 'Adam'}.
2026-05-23 04:18:46,644 - experiment_functions - INFO - Early stopping at epoch 500. Best Metrics: (0.001357962008977461, 0.001475409836065574, 0.0016192406946829358)
2026-05-23 04:18:47,265 - optuna.study.study - INFO - Trial 49 finished with values: [0.001357962008977461, 0.001475409836065574, 0.0016192406946829358] and parameters: {'n_layers': 1, 'embedding_dim': 96, 'lr': 0.00824698863381855, 'lambda_val': 0.008185260289697087, 'batch_size': 2013, 'optimizer': 'SGD'}.
2026-05-23 04:18:55,949 - experiment_functions - INFO - Early stopping at epoch 750. Best Metrics: (0.028777486254655937, 0.02057377049180328, 0.027694346307806122)
