2026-05-23 06:13:33,941 - optuna.study.study - INFO - Trial 199 finished with values: [0.0034144391510696355, 0.0018032786885245904, 0.002454508021449097] and parameters: {'n_layers': 2, 'embedding_dim': 64, 'lr': 0.014958588920169108, 'lambda_val': 0.0003409353796005995, 'batch_size': 2799, 'optimizer': 'Adam'}.
2026-05-23 06:13:37,704 - experiment_functions - INFO - Early stopping at epoch 1050. Best Metrics: (0.016276932371155538, 0.01672131147540984, 0.022105596291364774)
2026-05-23 06:13:37,814 - optuna.study.study - INFO - Trial 200 finished with values: [0.016276932371155538, 0.01672131147540984, 0.022105596291364774] and parameters: {'n_layers': 1, 'embedding_dim': 96, 'lr': 0.0004278261152456948, 'lambda_val': 1.643232822744187e-06, 'batch_size': 1489, 'optimizer': 'RMSprop'}.
2026-05-23 06:13:41,370 - experiment_functions - INFO - Early stopping at epoch 850. Best Metrics: (0.008056065209879884, 0.01180327868852459, 0.014094955462802476)
2026-05-23 06:13:41,469 - optuna.study.study - INFO - Trial 201 finished with values: [0.008056065209879884, 0.01180327868852459, 0.014094955462802476] and parameters: {'n_layers': 1, 'embedding_dim': 256, 'lr': 0.0022084270117427845, 'lambda_val': 0.00012304464175487333, 'batch_size': 3111, 'optimizer': 'RMSprop'}.
2026-05-23 06:13:44,543 - experiment_functions - INFO - Early stopping at epoch 800. Best Metrics: (0.006915762706598369, 0.00860655737704918, 0.00972186533200329)
2026-05-23 06:13:44,606 - optuna.study.study - INFO - Trial 202 finished with values: [0.006915762706598369, 0.00860655737704918, 0.00972186533200329] and parameters: {'n_layers': 3, 'embedding_dim': 32, 'lr': 0.0007855341580113746, 'lambda_val': 0.0003409353796005995, 'batch_size': 894, 'optimizer': 'Adam'}.
2026-05-23 06:13:47,179 - experiment_functions - INFO - Early stopping at epoch 650. Best Metrics: (0.01796790935099765, 0.018032786885245903, 0.022986344126474833)
2026-05-23 06:13:47,239 - optuna.study.study - INFO - Trial 203 finished with values: [0.01796790935099765, 0.018032786885245903, 0.022986344126474833] and parameters: {'n_layers': 1, 'embedding_dim': 128, 'lr': 0.0012169182947165634, 'lambda_val': 1.90692593503121e-05, 'batch_size': 1356, 'optimizer': 'Adam'}.
2026-05-23 06:13:49,726 - experiment_functions - INFO - Early stopping at epoch 600. Best Metrics: (0.014578594782531689, 0.01655737704918033, 0.0216234271631528)
2026-05-23 06:13:49,881 - optuna.study.study - INFO - Trial 204 finished with values: [0.014578594782531689, 0.01655737704918033, 0.0216234271631528] and parameters: {'n_layers': 1, 'embedding_dim': 256, 'lr': 0.001181661214584453, 'lambda_val': 0.0003146553194028543, 'batch_size': 1356, 'optimizer': 'Adam'}.
2026-05-23 06:13:51,865 - experiment_functions - INFO - Early stopping at epoch 500. Best Metrics: (0.0022609186976228716, 0.0013114754098360656, 0.0017818692245604594)
2026-05-23 06:13:51,934 - optuna.study.study - INFO - Trial 205 finished with values: [0.0022609186976228716, 0.0013114754098360656, 0.0017818692245604594] and parameters: {'n_layers': 1, 'embedding_dim': 64, 'lr': 2.1744761961639963e-05, 'lambda_val': 0.007897636732099256, 'batch_size': 669, 'optimizer': 'SGD'}.
2026-05-23 06:13:59,929 - experiment_functions - INFO - Early stopping at epoch 1100. Best Metrics: (0.007999653320484485, 0.010983606557377049, 0.012651010527849503)
2026-05-23 06:14:00,867 - optuna.study.study - INFO - Trial 206 finished with values: [0.007999653320484485, 0.010983606557377049, 0.012651010527849503] and parameters: {'n_layers': 1, 'embedding_dim': 256, 'lr': 0.011644283247743916, 'lambda_val': 4.6549010887576886e-06, 'batch_size': 2045, 'optimizer': 'RMSprop'}.
2026-05-23 06:14:13,914 - optuna.study.study - INFO - Trial 207 finished with values: [0.018908892719032032, 0.017950819672131146, 0.023454532679417005] and parameters: {'n_layers': 1, 'embedding_dim': 256, 'lr': 0.00011765782983091902, 'lambda_val': 0.0018518013272191423, 'batch_size': 1073, 'optimizer': 'RMSprop'}.
2026-05-23 06:14:16,839 - experiment_functions - INFO - Early stopping at epoch 700. Best Metrics: (0.012240639221676163, 0.014180327868852457, 0.015873017239380352)
2026-05-23 06:14:17,221 - optuna.study.study - INFO - Trial 208 finished with values: [0.012240639221676163, 0.014180327868852457, 0.015873017239380352] and parameters: {'n_layers': 1, 'embedding_dim': 32, 'lr': 0.0012169182947165634, 'lambda_val': 1.90692593503121e-05, 'batch_size': 1356, 'optimizer': 'Adam'}.
2026-05-23 06:14:21,098 - experiment_functions - INFO - Early stopping at epoch 1150. Best Metrics: (0.01558936210384491, 0.01647540983606557, 0.019386536988878593)
2026-05-23 06:14:21,550 - optuna.study.study - INFO - Trial 209 finished with values: [0.01558936210384491, 0.01647540983606557, 0.019386536988878593] and parameters: {'n_layers': 1, 'embedding_dim': 64, 'lr': 0.0004278261152456948, 'lambda_val': 1.1371570226930704e-05, 'batch_size': 924, 'optimizer': 'Adam'}.
2026-05-23 06:14:23,943 - experiment_functions - INFO - Early stopping at epoch 600. Best Metrics: (0.00980558561933612, 0.010737704918032786, 0.01283274692698051)
2026-05-23 06:14:24,031 - optuna.study.study - INFO - Trial 210 finished with values: [0.00980558561933612, 0.010737704918032786, 0.01283274692698051] and parameters: {'n_layers': 1, 'embedding_dim': 96, 'lr': 0.0006491420320140972, 'lambda_val': 1.643232822744187e-06, 'batch_size': 3814, 'optimizer': 'RMSprop'}.
2026-05-23 06:14:35,690 - optuna.study.study - INFO - Trial 211 finished with values: [0.015986843859481376, 0.015983606557377048, 0.021947414131607473] and parameters: {'n_layers': 1, 'embedding_dim': 64, 'lr': 0.00013647495897976545, 'lambda_val': 1.90692593503121e-05, 'batch_size': 916, 'optimizer': 'RMSprop'}.
2026-05-23 06:14:47,176 - optuna.study.study - INFO - Trial 212 finished with values: [0.01393874213127671, 0.01573770491803279, 0.02042330245873117] and parameters: {'n_layers': 1, 'embedding_dim': 96, 'lr': 0.00012869980734826536, 'lambda_val': 0.008974765382487945, 'batch_size': 669, 'optimizer': 'RMSprop'}.
2026-05-23 06:14:58,955 - optuna.study.study - INFO - Trial 213 finished with values: [0.012941513127235894, 0.013278688524590167, 0.015727951246773408] and parameters: {'n_layers': 2, 'embedding_dim': 64, 'lr': 0.00012869980734826536, 'lambda_val': 0.0003409353796005995, 'batch_size': 669, 'optimizer': 'RMSprop'}.
2026-05-23 06:15:01,772 - experiment_functions - INFO - Early stopping at epoch 650. Best Metrics: (0.015424246741008835, 0.014836065573770494, 0.018146829858597068)
2026-05-23 06:15:01,853 - optuna.study.study - INFO - Trial 214 finished with values: [0.015424246741008835, 0.014836065573770494, 0.018146829858597068] and parameters: {'n_layers': 1, 'embedding_dim': 64, 'lr': 0.001181661214584453, 'lambda_val': 0.00022615849293998648, 'batch_size': 1356, 'optimizer': 'Adam'}.
2026-05-23 06:15:11,262 - experiment_functions - INFO - Early stopping at epoch 1950. Best Metrics: (0.011495496511616222, 0.0119672131147541, 0.015610654867709232)
2026-05-23 06:15:11,360 - optuna.study.study - INFO - Trial 215 finished with values: [0.011495496511616222, 0.0119672131147541, 0.015610654867709232] and parameters: {'n_layers': 2, 'embedding_dim': 96, 'lr': 0.00011765782983091902, 'lambda_val': 0.00022615849293998648, 'batch_size': 790, 'optimizer': 'Adam'}.
2026-05-23 06:15:16,211 - experiment_functions - INFO - Early stopping at epoch 1500. Best Metrics: (0.004622614686345853, 0.007622950819672132, 0.008536092462350065)
2026-05-23 06:15:16,291 - optuna.study.study - INFO - Trial 216 finished with values: [0.004622614686345853, 0.007622950819672132, 0.008536092462350065] and parameters: {'n_layers': 1, 'embedding_dim': 96, 'lr': 0.005414777514892289, 'lambda_val': 0.018327766420510483, 'batch_size': 1073, 'optimizer': 'RMSprop'}.
2026-05-23 06:15:18,892 - experiment_functions - INFO - Early stopping at epoch 600. Best Metrics: (0.019713869225437986, 0.02073770491803279, 0.02775625708603611)
2026-05-23 06:15:18,980 - optuna.study.study - INFO - Trial 217 finished with values: [0.019713869225437986, 0.02073770491803279, 0.02775625708603611] and parameters: {'n_layers': 1, 'embedding_dim': 64, 'lr': 0.0022084270117427845, 'lambda_val': 1.1371570226930704e-05, 'batch_size': 809, 'optimizer': 'Adam'}.
2026-05-23 06:15:22,177 - experiment_functions - INFO - Early stopping at epoch 500. Best Metrics: (0.005257898891267389, 0.006721311475409835, 0.008498878654436938)
2026-05-23 06:15:22,265 - optuna.study.study - INFO - Trial 218 finished with values: [0.005257898891267389, 0.006721311475409835, 0.008498878654436938] and parameters: {'n_layers': 4, 'embedding_dim': 256, 'lr': 0.06087081030438792, 'lambda_val': 0.002206220255221525, 'batch_size': 669, 'optimizer': 'RMSprop'}.
2026-05-23 06:15:24,660 - experiment_functions - INFO - Early stopping at epoch 550. Best Metrics: (0.014909040399732598, 0.017295081967213115, 0.02116948772217738)
2026-05-23 06:15:25,440 - optuna.study.study - INFO - Trial 219 finished with values: [0.014909040399732598, 0.017295081967213115, 0.02116948772217738] and parameters: {'n_layers': 1, 'embedding_dim': 256, 'lr': 0.0012169182947165634, 'lambda_val': 1.711820466055588e-05, 'batch_size': 916, 'optimizer': 'RMSprop'}.
2026-05-23 06:15:38,589 - optuna.study.study - INFO - Trial 220 finished with values: [0.01180060239692604, 0.0119672131147541, 0.016499610112370066] and parameters: {'n_layers': 4, 'embedding_dim': 64, 'lr': 0.00012869980734826536, 'lambda_val': 0.002206220255221525, 'batch_size': 809, 'optimizer': 'RMSprop'}.
2026-05-23 06:15:41,112 - experiment_functions - INFO - Early stopping at epoch 600. Best Metrics: (0.014765672287820886, 0.015409836065573772, 0.019420566022590725)
2026-05-23 06:15:41,249 - optuna.study.study - INFO - Trial 221 finished with values: [0.014765672287820886, 0.015409836065573772, 0.019420566022590725] and parameters: {'n_layers': 1, 'embedding_dim': 128, 'lr': 0.0022084270117427845, 'lambda_val': 0.00018535716709622545, 'batch_size': 3814, 'optimizer': 'Adam'}.
2026-05-23 06:15:43,829 - experiment_functions - INFO - Early stopping at epoch 500. Best Metrics: (0.0022857130101831455, 0.0021311475409836068, 0.002589297789300979)
2026-05-23 06:15:43,981 - optuna.study.study - INFO - Trial 222 finished with values: [0.0022857130101831455, 0.0021311475409836068, 0.002589297789300979] and parameters: {'n_layers': 4, 'embedding_dim': 128, 'lr': 0.0022084270117427845, 'lambda_val': 0.033087491950563035, 'batch_size': 1139, 'optimizer': 'Adam'}.
2026-05-23 06:15:47,010 - experiment_functions - INFO - Early stopping at epoch 700. Best Metrics: (0.007064628255417548, 0.010245901639344262, 0.012270876325273686)
2026-05-23 06:15:47,741 - optuna.study.study - INFO - Trial 223 finished with values: [0.007064628255417548, 0.010245901639344262, 0.012270876325273686] and parameters: {'n_layers': 1, 'embedding_dim': 128, 'lr': 0.0007855341580113746, 'lambda_val': 0.00010550314296984844, 'batch_size': 3814, 'optimizer': 'Adam'}.
2026-05-23 06:15:56,242 - experiment_functions - INFO - Early stopping at epoch 600. Best Metrics: (0.009416769059992964, 0.010491803278688525, 0.014054034341741392)
2026-05-23 06:15:56,714 - optuna.study.study - INFO - Trial 224 finished with values: [0.009416769059992964, 0.010491803278688525, 0.014054034341741392] and parameters: {'n_layers': 2, 'embedding_dim': 64, 'lr': 0.0012169182947165634, 'lambda_val': 0.00012304464175487333, 'batch_size': 3111, 'optimizer': 'Adam'}.
2026-05-23 06:16:03,252 - experiment_functions - INFO - Early stopping at epoch 650. Best Metrics: (0.013606557986315718, 0.012950819672131148, 0.016613295039577262)
2026-05-23 06:16:03,976 - optuna.study.study - INFO - Trial 225 finished with values: [0.013606557986315718, 0.012950819672131148, 0.016613295039577262] and parameters: {'n_layers': 2, 'embedding_dim': 256, 'lr': 0.0007855341580113746, 'lambda_val': 0.0003409353796005995, 'batch_size': 894, 'optimizer': 'Adam'}.
2026-05-23 06:16:17,231 - optuna.study.study - INFO - Trial 226 finished with values: [0.011124799925377314, 0.011557377049180325, 0.015396632691749242] and parameters: {'n_layers': 4, 'embedding_dim': 64, 'lr': 0.00012869980734826536, 'lambda_val': 0.002206220255221525, 'batch_size': 669, 'optimizer': 'RMSprop'}.
2026-05-23 06:16:19,586 - experiment_functions - INFO - Early stopping at epoch 550. Best Metrics: (0.010519036207404677, 0.01081967213114754, 0.014428565034567041)
2026-05-23 06:16:19,664 - optuna.study.study - INFO - Trial 227 finished with values: [0.010519036207404677, 0.01081967213114754, 0.014428565034567041] and parameters: {'n_layers': 2, 'embedding_dim': 64, 'lr': 0.0009699915116782758, 'lambda_val': 0.0003409353796005995, 'batch_size': 894, 'optimizer': 'RMSprop'}.
2026-05-23 06:16:23,059 - experiment_functions - INFO - Early stopping at epoch 900. Best Metrics: (0.015889297441468987, 0.017295081967213115, 0.021249367562053652)
2026-05-23 06:16:23,159 - optuna.study.study - INFO - Trial 228 finished with values: [0.015889297441468987, 0.017295081967213115, 0.021249367562053652] and parameters: {'n_layers': 1, 'embedding_dim': 64, 'lr': 0.00048792308917982896, 'lambda_val': 1.1371570226930704e-05, 'batch_size': 916, 'optimizer': 'Adam'}.
2026-05-23 06:16:30,826 - experiment_functions - INFO - Early stopping at epoch 2000. Best Metrics: (0.006486709019112402, 0.008688524590163936, 0.009981916229426888)
2026-05-23 06:16:30,977 - optuna.study.study - INFO - Trial 229 finished with values: [0.006486709019112402, 0.008688524590163936, 0.009981916229426888] and parameters: {'n_layers': 4, 'embedding_dim': 128, 'lr': 0.00012869980734826536, 'lambda_val': 0.007897636732099256, 'batch_size': 669, 'optimizer': 'RMSprop'}.
2026-05-23 06:16:34,177 - experiment_functions - INFO - Early stopping at epoch 800. Best Metrics: (0.01749566329498281, 0.015000000000000001, 0.020673301929532383)
2026-05-23 06:16:34,276 - optuna.study.study - INFO - Trial 230 finished with values: [0.01749566329498281, 0.015000000000000001, 0.020673301929532383] and parameters: {'n_layers': 1, 'embedding_dim': 128, 'lr': 0.00036854228595864275, 'lambda_val': 0.00034042279429205883, 'batch_size': 3814, 'optimizer': 'Adam'}.
2026-05-23 06:16:36,836 - experiment_functions - INFO - Early stopping at epoch 550. Best Metrics: (0.013350225787398914, 0.012950819672131148, 0.014609596963473926)
2026-05-23 06:16:36,928 - optuna.study.study - INFO - Trial 231 finished with values: [0.013350225787398914, 0.012950819672131148, 0.014609596963473926] and parameters: {'n_layers': 1, 'embedding_dim': 64, 'lr': 0.0012169182947165634, 'lambda_val': 0.0027991254768102896, 'batch_size': 1356, 'optimizer': 'RMSprop'}.
2026-05-23 06:16:48,740 - optuna.study.study - INFO - Trial 232 finished with values: [0.014009077446909655, 0.014262295081967215, 0.018493976441141476] and parameters: {'n_layers': 1, 'embedding_dim': 64, 'lr': 0.00010761667973786786, 'lambda_val': 0.008843867790050126, 'batch_size': 2073, 'optimizer': 'Adam'}.
2026-05-23 06:16:51,093 - experiment_functions - INFO - Early stopping at epoch 550. Best Metrics: (0.011038417500168247, 0.012950819672131148, 0.01417869024329793)
2026-05-23 06:16:51,222 - optuna.study.study - INFO - Trial 233 finished with values: [0.011038417500168247, 0.012950819672131148, 0.01417869024329793] and parameters: {'n_layers': 1, 'embedding_dim': 64, 'lr': 0.002071711216736608, 'lambda_val': 8.943594938418504e-05, 'batch_size': 1383, 'optimizer': 'RMSprop'}.
2026-05-23 06:17:03,906 - optuna.study.study - INFO - Trial 234 finished with values: [0.01014713990176558, 0.01180327868852459, 0.013149367659780253] and parameters: {'n_layers': 3, 'embedding_dim': 64, 'lr': 0.00012869980734826536, 'lambda_val': 1.1371570226930704e-05, 'batch_size': 1059, 'optimizer': 'RMSprop'}.
2026-05-23 06:17:06,449 - experiment_functions - INFO - Early stopping at epoch 600. Best Metrics: (0.015234942434001723, 0.01581967213114754, 0.020454690593049222)
2026-05-23 06:17:06,538 - optuna.study.study - INFO - Trial 235 finished with values: [0.015234942434001723, 0.01581967213114754, 0.020454690593049222] and parameters: {'n_layers': 1, 'embedding_dim': 64, 'lr': 0.0022084270117427845, 'lambda_val': 0.00012304464175487333, 'batch_size': 1420, 'optimizer': 'Adam'}.
2026-05-23 06:17:18,432 - optuna.study.study - INFO - Trial 236 finished with values: [0.007459457959524615, 0.007704918032786886, 0.009308728379793513] and parameters: {'n_layers': 3, 'embedding_dim': 32, 'lr': 0.00012869980734826536, 'lambda_val': 0.00029292236724190197, 'batch_size': 1073, 'optimizer': 'RMSprop'}.
2026-05-23 06:17:22,118 - experiment_functions - INFO - Early stopping at epoch 650. Best Metrics: (0.01564162288146673, 0.017459016393442623, 0.02129082230890398)
2026-05-23 06:17:22,248 - optuna.study.study - INFO - Trial 237 finished with values: [0.01564162288146673, 0.017459016393442623, 0.02129082230890398] and parameters: {'n_layers': 1, 'embedding_dim': 96, 'lr': 0.001181661214584453, 'lambda_val': 0.00022615849293998648, 'batch_size': 1356, 'optimizer': 'Adam'}.
2026-05-23 06:17:25,076 - experiment_functions - INFO - Early stopping at epoch 550. Best Metrics: (0.013617999416052606, 0.015901639344262294, 0.019446831042233395)
2026-05-23 06:17:25,176 - optuna.study.study - INFO - Trial 238 finished with values: [0.013617999416052606, 0.015901639344262294, 0.019446831042233395] and parameters: {'n_layers': 1, 'embedding_dim': 256, 'lr': 0.0022084270117427845, 'lambda_val': 0.00012304464175487333, 'batch_size': 3670, 'optimizer': 'Adam'}.
2026-05-23 06:17:36,865 - optuna.study.study - INFO - Trial 239 finished with values: [0.009201719517980643, 0.012295081967213115, 0.014812836936773651] and parameters: {'n_layers': 1, 'embedding_dim': 64, 'lr': 0.00012869980734826536, 'lambda_val': 0.00029292236724190197, 'batch_size': 669, 'optimizer': 'RMSprop'}.
2026-05-23 06:17:40,316 - experiment_functions - INFO - Early stopping at epoch 600. Best Metrics: (0.017628778170887725, 0.015901639344262298, 0.022448880079805826)
2026-05-23 06:17:40,858 - optuna.study.study - INFO - Trial 240 finished with values: [0.017628778170887725, 0.015901639344262298, 0.022448880079805826] and parameters: {'n_layers': 1, 'embedding_dim': 32, 'lr': 0.0012169182947165634, 'lambda_val': 1.643232822744187e-06, 'batch_size': 916, 'optimizer': 'RMSprop'}.
2026-05-23 06:17:57,943 - experiment_functions - INFO - Early stopping at epoch 3100. Best Metrics: (0.011997799072427028, 0.011967213114754098, 0.01613852249618939)
2026-05-23 06:17:58,906 - optuna.study.study - INFO - Trial 241 finished with values: [0.011997799072427028, 0.011967213114754098, 0.01613852249618939] and parameters: {'n_layers': 3, 'embedding_dim': 128, 'lr': 0.00012869980734826536, 'lambda_val': 0.00012888238317256375, 'batch_size': 3814, 'optimizer': 'RMSprop'}.
2026-05-23 06:18:02,316 - experiment_functions - INFO - Early stopping at epoch 650. Best Metrics: (0.01216128366682148, 0.013770491803278686, 0.015815962815393315)
2026-05-23 06:18:02,423 - optuna.study.study - INFO - Trial 242 finished with values: [0.01216128366682148, 0.013770491803278686, 0.015815962815393315] and parameters: {'n_layers': 1, 'embedding_dim': 128, 'lr': 0.0007855341580113746, 'lambda_val': 0.005787983943972103, 'batch_size': 1073, 'optimizer': 'Adam'}.
2026-05-23 06:18:05,029 - experiment_functions - INFO - Early stopping at epoch 650. Best Metrics: (0.010759513910326122, 0.010737704918032786, 0.012666126342576033)
2026-05-23 06:18:05,159 - optuna.study.study - INFO - Trial 243 finished with values: [0.010759513910326122, 0.010737704918032786, 0.012666126342576033] and parameters: {'n_layers': 2, 'embedding_dim': 32, 'lr': 0.0009699915116782758, 'lambda_val': 1.90692593503121e-05, 'batch_size': 596, 'optimizer': 'Adam'}.
2026-05-23 06:18:17,076 - optuna.study.study - INFO - Trial 244 finished with values: [0.01994612368327127, 0.020163934426229508, 0.02888928135069892] and parameters: {'n_layers': 1, 'embedding_dim': 64, 'lr': 0.00016882222048828941, 'lambda_val': 0.0008199279436924151, 'batch_size': 916, 'optimizer': 'RMSprop'}.
2026-05-23 06:18:28,423 - optuna.study.study - INFO - Trial 245 finished with values: [0.015067442242618785, 0.01622950819672131, 0.019824260053057062] and parameters: {'n_layers': 1, 'embedding_dim': 64, 'lr': 0.00012869980734826536, 'lambda_val': 1.1371570226930704e-05, 'batch_size': 877, 'optimizer': 'RMSprop'}.
2026-05-23 06:18:30,665 - experiment_functions - INFO - Early stopping at epoch 500. Best Metrics: (0.0031375804950644196, 0.0018032786885245904, 0.002400853408159937)
2026-05-23 06:18:30,757 - optuna.study.study - INFO - Trial 246 finished with values: [0.0031375804950644196, 0.0018032786885245904, 0.002400853408159937] and parameters: {'n_layers': 2, 'embedding_dim': 64, 'lr': 0.0009350408589784744, 'lambda_val': 0.02519103653545587, 'batch_size': 669, 'optimizer': 'SGD'}.
2026-05-23 06:18:37,470 - experiment_functions - INFO - Early stopping at epoch 2250. Best Metrics: (0.006365120473304189, 0.011721311475409836, 0.013757176806048309)
2026-05-23 06:18:37,574 - optuna.study.study - INFO - Trial 247 finished with values: [0.006365120473304189, 0.011721311475409836, 0.013757176806048309] and parameters: {'n_layers': 1, 'embedding_dim': 64, 'lr': 0.011704452608888144, 'lambda_val': 0.0003409353796005995, 'batch_size': 2381, 'optimizer': 'RMSprop'}.
2026-05-23 06:18:41,277 - experiment_functions - INFO - Early stopping at epoch 800. Best Metrics: (0.00893323431332855, 0.009098360655737705, 0.010824249462845404)
