2026-05-23 05:58:24,802 - optuna.study.study - INFO - Trial 12 finished with values: [0.0019580411202389067, 0.0019672131147540984, 0.0019222591571695763] and parameters: {'n_layers': 4, 'embedding_dim': 128, 'lr': 0.014958588920169108, 'lambda_val': 4.730833678906346e-06, 'batch_size': 3213, 'optimizer': 'SGD'}.
2026-05-23 05:58:27,081 - experiment_functions - INFO - Early stopping at epoch 500. Best Metrics: (0.002142196923156366, 0.0015573770491803282, 0.001957583572425108)
2026-05-23 05:58:27,213 - optuna.study.study - INFO - Trial 13 finished with values: [0.002142196923156366, 0.0015573770491803282, 0.001957583572425108] and parameters: {'n_layers': 2, 'embedding_dim': 128, 'lr': 0.000119163266657484, 'lambda_val': 0.004328037622434779, 'batch_size': 1351, 'optimizer': 'SGD'}.
2026-05-23 05:58:29,576 - experiment_functions - INFO - Early stopping at epoch 500. Best Metrics: (0.0011506673916747386, 0.0016393442622950817, 0.0018276132957580765)
2026-05-23 05:58:29,662 - optuna.study.study - INFO - Trial 14 finished with values: [0.0011506673916747386, 0.0016393442622950817, 0.0018276132957580765] and parameters: {'n_layers': 1, 'embedding_dim': 256, 'lr': 0.0020729443689159184, 'lambda_val': 1.1153408673216333e-06, 'batch_size': 4096, 'optimizer': 'SGD'}.
2026-05-23 05:58:32,455 - experiment_functions - INFO - Early stopping at epoch 550. Best Metrics: (0.0017936321108671025, 0.0013934426229508198, 0.0017064141383592805)
2026-05-23 05:58:32,594 - optuna.study.study - INFO - Trial 15 finished with values: [0.0017936321108671025, 0.0013934426229508198, 0.0017064141383592805] and parameters: {'n_layers': 4, 'embedding_dim': 96, 'lr': 5.379458565878549e-05, 'lambda_val': 4.545962355793143e-06, 'batch_size': 3539, 'optimizer': 'Adam'}.
2026-05-23 05:58:35,256 - experiment_functions - INFO - Early stopping at epoch 500. Best Metrics: (0.001978684465177611, 0.0018032786885245904, 0.0018040614664449923)
2026-05-23 05:58:35,346 - optuna.study.study - INFO - Trial 16 finished with values: [0.001978684465177611, 0.0018032786885245904, 0.0018040614664449923] and parameters: {'n_layers': 2, 'embedding_dim': 256, 'lr': 6.380088278428048e-05, 'lambda_val': 0.0018518013272191423, 'batch_size': 3010, 'optimizer': 'SGD'}.
2026-05-23 05:58:48,424 - experiment_functions - INFO - Early stopping at epoch 2700. Best Metrics: (0.004034229270940447, 0.007049180327868852, 0.008493500572751335)
2026-05-23 05:58:48,864 - optuna.study.study - INFO - Trial 17 finished with values: [0.004034229270940447, 0.007049180327868852, 0.008493500572751335] and parameters: {'n_layers': 1, 'embedding_dim': 96, 'lr': 0.09388280516514556, 'lambda_val': 0.027251947202207506, 'batch_size': 2799, 'optimizer': 'Adam'}.
2026-05-23 05:58:56,288 - experiment_functions - INFO - Early stopping at epoch 700. Best Metrics: (0.002577168945676402, 0.002459016393442623, 0.003017324045505672)
2026-05-23 05:58:57,239 - optuna.study.study - INFO - Trial 18 finished with values: [0.002577168945676402, 0.002459016393442623, 0.003017324045505672] and parameters: {'n_layers': 3, 'embedding_dim': 128, 'lr': 1.2018861443162076e-05, 'lambda_val': 7.349705844771799e-06, 'batch_size': 842, 'optimizer': 'RMSprop'}.
2026-05-23 05:59:02,964 - experiment_functions - INFO - Early stopping at epoch 1650. Best Metrics: (0.007997481109810928, 0.012459016393442622, 0.013888686235460728)
2026-05-23 05:59:03,861 - optuna.study.study - INFO - Trial 19 finished with values: [0.007997481109810928, 0.012459016393442622, 0.013888686235460728] and parameters: {'n_layers': 1, 'embedding_dim': 256, 'lr': 0.011644283247743916, 'lambda_val': 1.643232822744187e-06, 'batch_size': 1073, 'optimizer': 'RMSprop'}.
2026-05-23 05:59:06,171 - experiment_functions - INFO - Early stopping at epoch 500. Best Metrics: (0.002758432417572804, 0.002213114754098361, 0.002498657472821196)
2026-05-23 05:59:06,284 - optuna.study.study - INFO - Trial 20 finished with values: [0.002758432417572804, 0.002213114754098361, 0.002498657472821196] and parameters: {'n_layers': 2, 'embedding_dim': 32, 'lr': 4.001121509302567e-05, 'lambda_val': 2.9405199459966574e-06, 'batch_size': 1348, 'optimizer': 'SGD'}.
2026-05-23 05:59:08,731 - experiment_functions - INFO - Early stopping at epoch 500. Best Metrics: (0.004534137957338689, 0.0036885245901639345, 0.004941233629819409)
2026-05-23 05:59:08,863 - optuna.study.study - INFO - Trial 21 finished with values: [0.004534137957338689, 0.0036885245901639345, 0.004941233629819409] and parameters: {'n_layers': 2, 'embedding_dim': 64, 'lr': 0.014991415365741289, 'lambda_val': 0.000575656004347868, 'batch_size': 3155, 'optimizer': 'RMSprop'}.
2026-05-23 05:59:17,257 - experiment_functions - INFO - Early stopping at epoch 2850. Best Metrics: (0.00597972604691623, 0.007622950819672132, 0.007638449151119688)
2026-05-23 05:59:17,335 - optuna.study.study - INFO - Trial 22 finished with values: [0.00597972604691623, 0.007622950819672132, 0.007638449151119688] and parameters: {'n_layers': 2, 'embedding_dim': 32, 'lr': 0.00013647495897976545, 'lambda_val': 0.01536287204836458, 'batch_size': 916, 'optimizer': 'RMSprop'}.
2026-05-23 05:59:19,786 - experiment_functions - INFO - Early stopping at epoch 500. Best Metrics: (0.0022273234803208758, 0.002622950819672131, 0.0031568516496813357)
2026-05-23 05:59:19,880 - optuna.study.study - INFO - Trial 23 finished with values: [0.0022273234803208758, 0.002622950819672131, 0.0031568516496813357] and parameters: {'n_layers': 4, 'embedding_dim': 96, 'lr': 0.006264504410927441, 'lambda_val': 6.233631905560847e-05, 'batch_size': 1489, 'optimizer': 'RMSprop'}.
2026-05-23 05:59:22,048 - experiment_functions - INFO - Early stopping at epoch 500. Best Metrics: (0.0021896680921381514, 0.0019672131147540984, 0.0026585482202423345)
2026-05-23 05:59:22,136 - optuna.study.study - INFO - Trial 24 finished with values: [0.0021896680921381514, 0.0019672131147540984, 0.0026585482202423345] and parameters: {'n_layers': 2, 'embedding_dim': 64, 'lr': 2.9289197451018518e-05, 'lambda_val': 0.0001296764045418255, 'batch_size': 3156, 'optimizer': 'SGD'}.
2026-05-23 05:59:30,398 - experiment_functions - INFO - Early stopping at epoch 2850. Best Metrics: (0.005278383781282758, 0.009098360655737705, 0.01104744686505214)
2026-05-23 05:59:30,615 - optuna.study.study - INFO - Trial 25 finished with values: [0.005278383781282758, 0.009098360655737705, 0.01104744686505214] and parameters: {'n_layers': 1, 'embedding_dim': 64, 'lr': 0.025586589449076432, 'lambda_val': 0.007897636732099256, 'batch_size': 1489, 'optimizer': 'Adam'}.
2026-05-23 05:59:33,208 - experiment_functions - INFO - Early stopping at epoch 500. Best Metrics: (0.003259563982215319, 0.002295081967213115, 0.002693855668751768)
2026-05-23 05:59:33,292 - optuna.study.study - INFO - Trial 26 finished with values: [0.003259563982215319, 0.002295081967213115, 0.002693855668751768] and parameters: {'n_layers': 4, 'embedding_dim': 128, 'lr': 0.00011211714788430738, 'lambda_val': 0.008069433035806131, 'batch_size': 2024, 'optimizer': 'SGD'}.
2026-05-23 05:59:36,935 - experiment_functions - INFO - Early stopping at epoch 1000. Best Metrics: (0.009218547437640542, 0.010573770491803278, 0.011797149007803851)
2026-05-23 05:59:37,653 - optuna.study.study - INFO - Trial 27 finished with values: [0.009218547437640542, 0.010573770491803278, 0.011797149007803851] and parameters: {'n_layers': 2, 'embedding_dim': 64, 'lr': 0.00034122242598680385, 'lambda_val': 0.002206220255221525, 'batch_size': 2282, 'optimizer': 'Adam'}.
2026-05-23 05:59:40,542 - experiment_functions - INFO - Early stopping at epoch 650. Best Metrics: (0.0017938007641496276, 0.0013934426229508198, 0.0017052258729964868)
2026-05-23 05:59:41,119 - optuna.study.study - INFO - Trial 28 finished with values: [0.0017938007641496276, 0.0013934426229508198, 0.0017052258729964868] and parameters: {'n_layers': 1, 'embedding_dim': 256, 'lr': 1.154247710776303e-05, 'lambda_val': 0.00016175547104968382, 'batch_size': 1752, 'optimizer': 'Adam'}.
2026-05-23 05:59:43,550 - experiment_functions - INFO - Early stopping at epoch 500. Best Metrics: (0.0018028532540858633, 0.0020491803278688526, 0.0023106205217616254)
2026-05-23 05:59:43,696 - optuna.study.study - INFO - Trial 29 finished with values: [0.0018028532540858633, 0.0020491803278688526, 0.0023106205217616254] and parameters: {'n_layers': 2, 'embedding_dim': 64, 'lr': 0.00015707829715157166, 'lambda_val': 0.06485124594087502, 'batch_size': 3307, 'optimizer': 'SGD'}.
2026-05-23 05:59:46,009 - experiment_functions - INFO - Early stopping at epoch 500. Best Metrics: (0.0020958965102540993, 0.0020491803278688526, 0.0021520051820671728)
2026-05-23 05:59:46,144 - optuna.study.study - INFO - Trial 30 finished with values: [0.0020958965102540993, 0.0020491803278688526, 0.0021520051820671728] and parameters: {'n_layers': 1, 'embedding_dim': 96, 'lr': 0.047847436117002144, 'lambda_val': 0.05655118281335753, 'batch_size': 3721, 'optimizer': 'SGD'}.
2026-05-23 05:59:50,031 - experiment_functions - INFO - Early stopping at epoch 1000. Best Metrics: (0.007105405253448998, 0.009672131147540983, 0.010752716952801545)
2026-05-23 05:59:50,105 - optuna.study.study - INFO - Trial 31 finished with values: [0.007105405253448998, 0.009672131147540983, 0.010752716952801545] and parameters: {'n_layers': 1, 'embedding_dim': 64, 'lr': 0.0002508736427382596, 'lambda_val': 0.04114156919115699, 'batch_size': 1888, 'optimizer': 'Adam'}.
2026-05-23 05:59:57,801 - experiment_functions - INFO - Early stopping at epoch 500. Best Metrics: (0.0019636843259477677, 0.0013114754098360656, 0.0016508754596996414)
2026-05-23 05:59:58,287 - optuna.study.study - INFO - Trial 32 finished with values: [0.0019636843259477677, 0.0013114754098360656, 0.0016508754596996414] and parameters: {'n_layers': 1, 'embedding_dim': 256, 'lr': 0.04803250892419795, 'lambda_val': 0.0005975382995577236, 'batch_size': 2523, 'optimizer': 'SGD'}.
2026-05-23 06:00:05,935 - experiment_functions - INFO - Early stopping at epoch 550. Best Metrics: (0.011060539940428032, 0.011065573770491803, 0.014268878712380147)
2026-05-23 06:00:06,161 - optuna.study.study - INFO - Trial 33 finished with values: [0.011060539940428032, 0.011065573770491803, 0.014268878712380147] and parameters: {'n_layers': 2, 'embedding_dim': 256, 'lr': 0.0007855341580113746, 'lambda_val': 0.0003409353796005995, 'batch_size': 894, 'optimizer': 'RMSprop'}.
2026-05-23 06:00:08,568 - experiment_functions - INFO - Early stopping at epoch 500. Best Metrics: (0.0012439672428206745, 0.0011475409836065576, 0.0014048730311073752)
2026-05-23 06:00:08,654 - optuna.study.study - INFO - Trial 34 finished with values: [0.0012439672428206745, 0.0011475409836065576, 0.0014048730311073752] and parameters: {'n_layers': 4, 'embedding_dim': 32, 'lr': 0.019116828843400498, 'lambda_val': 0.0012103052503725108, 'batch_size': 3359, 'optimizer': 'Adam'}.
2026-05-23 06:00:11,043 - experiment_functions - INFO - Early stopping at epoch 500. Best Metrics: (0.0013876527088630185, 0.0014754098360655738, 0.0016068916043345532)
2026-05-23 06:00:11,142 - optuna.study.study - INFO - Trial 35 finished with values: [0.0013876527088630185, 0.0014754098360655738, 0.0016068916043345532] and parameters: {'n_layers': 3, 'embedding_dim': 128, 'lr': 2.9626291791961457e-05, 'lambda_val': 0.01933719470444085, 'batch_size': 584, 'optimizer': 'SGD'}.
2026-05-23 06:00:13,442 - experiment_functions - INFO - Early stopping at epoch 500. Best Metrics: (0.0013511932786709415, 0.0011475409836065576, 0.001548658500417195)
2026-05-23 06:00:13,536 - optuna.study.study - INFO - Trial 36 finished with values: [0.0013511932786709415, 0.0011475409836065576, 0.001548658500417195] and parameters: {'n_layers': 2, 'embedding_dim': 128, 'lr': 0.08021165318066971, 'lambda_val': 0.0790804021986742, 'batch_size': 1047, 'optimizer': 'SGD'}.
2026-05-23 06:00:16,277 - experiment_functions - INFO - Early stopping at epoch 550. Best Metrics: (0.010303849945165245, 0.011475409836065573, 0.013959239520369418)
2026-05-23 06:00:16,368 - optuna.study.study - INFO - Trial 37 finished with values: [0.010303849945165245, 0.011475409836065573, 0.013959239520369418] and parameters: {'n_layers': 2, 'embedding_dim': 256, 'lr': 0.0022084270117427845, 'lambda_val': 0.00811231567759129, 'batch_size': 1139, 'optimizer': 'Adam'}.
2026-05-23 06:00:19,014 - experiment_functions - INFO - Early stopping at epoch 700. Best Metrics: (0.002777252055662357, 0.0018852459016393446, 0.0026282641948740053)
2026-05-23 06:00:19,110 - optuna.study.study - INFO - Trial 38 finished with values: [0.002777252055662357, 0.0018852459016393446, 0.0026282641948740053] and parameters: {'n_layers': 1, 'embedding_dim': 96, 'lr': 1.194088775511757e-05, 'lambda_val': 0.002416712650661108, 'batch_size': 1993, 'optimizer': 'RMSprop'}.
2026-05-23 06:00:22,114 - experiment_functions - INFO - Early stopping at epoch 800. Best Metrics: (0.0022417505873230073, 0.0028688524590163933, 0.0033918159678663815)
2026-05-23 06:00:22,206 - optuna.study.study - INFO - Trial 39 finished with values: [0.0022417505873230073, 0.0028688524590163933, 0.0033918159678663815] and parameters: {'n_layers': 2, 'embedding_dim': 32, 'lr': 0.01837949443771539, 'lambda_val': 0.00043313110721109564, 'batch_size': 685, 'optimizer': 'RMSprop'}.
2026-05-23 06:00:30,365 - experiment_functions - INFO - Early stopping at epoch 2550. Best Metrics: (0.006910564549227057, 0.009426229508196722, 0.010008361509552616)
2026-05-23 06:00:30,438 - optuna.study.study - INFO - Trial 40 finished with values: [0.006910564549227057, 0.009426229508196722, 0.010008361509552616] and parameters: {'n_layers': 1, 'embedding_dim': 32, 'lr': 0.00011765782983091902, 'lambda_val': 0.00034042279429205883, 'batch_size': 3670, 'optimizer': 'Adam'}.
2026-05-23 06:00:33,073 - experiment_functions - INFO - Early stopping at epoch 500. Best Metrics: (0.0017950444372539813, 0.0014754098360655738, 0.001976563915528907)
2026-05-23 06:00:33,219 - optuna.study.study - INFO - Trial 41 finished with values: [0.0017950444372539813, 0.0014754098360655738, 0.001976563915528907] and parameters: {'n_layers': 3, 'embedding_dim': 128, 'lr': 0.0053879510964687394, 'lambda_val': 0.021833372271374076, 'batch_size': 2972, 'optimizer': 'Adam'}.
2026-05-23 06:00:39,359 - experiment_functions - INFO - Early stopping at epoch 500. Best Metrics: (0.0016043253844535855, 0.0015573770491803282, 0.0019709884279661832)
2026-05-23 06:00:40,059 - optuna.study.study - INFO - Trial 42 finished with values: [0.0016043253844535855, 0.0015573770491803282, 0.0019709884279661832] and parameters: {'n_layers': 4, 'embedding_dim': 128, 'lr': 0.0007631747907207328, 'lambda_val': 2.6934386815816503e-06, 'batch_size': 3852, 'optimizer': 'SGD'}.
2026-05-23 06:00:47,849 - experiment_functions - INFO - Early stopping at epoch 500. Best Metrics: (0.001317982438580699, 0.0020491803278688526, 0.0025039315603314566)
2026-05-23 06:00:48,245 - optuna.study.study - INFO - Trial 43 finished with values: [0.001317982438580699, 0.0020491803278688526, 0.0025039315603314566] and parameters: {'n_layers': 1, 'embedding_dim': 128, 'lr': 0.0004403673518016574, 'lambda_val': 1.0739564606939635e-05, 'batch_size': 1480, 'optimizer': 'SGD'}.
2026-05-23 06:00:50,992 - experiment_functions - INFO - Early stopping at epoch 500. Best Metrics: (0.005389690302846586, 0.005901639344262295, 0.0064842827273119295)
2026-05-23 06:00:51,077 - optuna.study.study - INFO - Trial 44 finished with values: [0.005389690302846586, 0.005901639344262295, 0.0064842827273119295] and parameters: {'n_layers': 2, 'embedding_dim': 128, 'lr': 0.052893544478494675, 'lambda_val': 3.070687389591576e-06, 'batch_size': 1460, 'optimizer': 'RMSprop'}.
2026-05-23 06:00:53,305 - experiment_functions - INFO - Early stopping at epoch 500. Best Metrics: (0.002011239774015439, 0.0018032786885245904, 0.0027489609416462267)
2026-05-23 06:00:53,410 - optuna.study.study - INFO - Trial 45 finished with values: [0.002011239774015439, 0.0018032786885245904, 0.0027489609416462267] and parameters: {'n_layers': 3, 'embedding_dim': 32, 'lr': 0.010696673333778817, 'lambda_val': 1.9624710669739648e-06, 'batch_size': 1011, 'optimizer': 'SGD'}.
2026-05-23 06:00:55,801 - experiment_functions - INFO - Early stopping at epoch 500. Best Metrics: (0.001999356597151514, 0.0013934426229508198, 0.002076932955659572)
2026-05-23 06:00:55,932 - optuna.study.study - INFO - Trial 46 finished with values: [0.001999356597151514, 0.0013934426229508198, 0.002076932955659572] and parameters: {'n_layers': 4, 'embedding_dim': 96, 'lr': 0.002293617092994788, 'lambda_val': 0.00027930861690939925, 'batch_size': 735, 'optimizer': 'RMSprop'}.
2026-05-23 06:00:58,313 - experiment_functions - INFO - Early stopping at epoch 550. Best Metrics: (0.005229095368821573, 0.008032786885245903, 0.008648667717846925)
2026-05-23 06:00:58,410 - optuna.study.study - INFO - Trial 47 finished with values: [0.005229095368821573, 0.008032786885245903, 0.008648667717846925] and parameters: {'n_layers': 2, 'embedding_dim': 96, 'lr': 0.0009699915116782758, 'lambda_val': 0.005501300014684501, 'batch_size': 3814, 'optimizer': 'RMSprop'}.
2026-05-23 06:01:00,871 - experiment_functions - INFO - Early stopping at epoch 500. Best Metrics: (0.0033900031886527644, 0.002049180327868853, 0.002756760048526924)
2026-05-23 06:01:01,002 - optuna.study.study - INFO - Trial 48 finished with values: [0.0033900031886527644, 0.002049180327868853, 0.002756760048526924] and parameters: {'n_layers': 3, 'embedding_dim': 96, 'lr': 0.0016861738279884903, 'lambda_val': 0.002440479546350061, 'batch_size': 2899, 'optimizer': 'SGD'}.
2026-05-23 06:01:13,404 - optuna.study.study - INFO - Trial 49 finished with values: [0.00995462559099359, 0.010983606557377049, 0.012648942521212493] and parameters: {'n_layers': 2, 'embedding_dim': 64, 'lr': 0.00010761667973786786, 'lambda_val': 0.008843867790050126, 'batch_size': 2073, 'optimizer': 'Adam'}.
2026-05-23 06:01:15,883 - experiment_functions - INFO - Early stopping at epoch 500. Best Metrics: (0.001257570580347356, 0.0011475409836065576, 0.001315681878439398)
2026-05-23 06:01:16,023 - optuna.study.study - INFO - Trial 50 finished with values: [0.001257570580347356, 0.0011475409836065576, 0.001315681878439398] and parameters: {'n_layers': 4, 'embedding_dim': 64, 'lr': 0.0017610207917895856, 'lambda_val': 0.007897636732099256, 'batch_size': 1489, 'optimizer': 'RMSprop'}.
2026-05-23 06:01:18,266 - experiment_functions - INFO - Early stopping at epoch 550. Best Metrics: (0.00855287019516929, 0.01139344262295082, 0.014744476705850955)
2026-05-23 06:01:18,454 - optuna.study.study - INFO - Trial 51 finished with values: [0.00855287019516929, 0.01139344262295082, 0.014744476705850955] and parameters: {'n_layers': 2, 'embedding_dim': 32, 'lr': 0.001890263218393761, 'lambda_val': 8.827132755589773e-05, 'batch_size': 3249, 'optimizer': 'RMSprop'}.
2026-05-23 06:01:21,270 - experiment_functions - INFO - Early stopping at epoch 550. Best Metrics: (0.008978084227315416, 0.011147540983606558, 0.014671850208231854)
2026-05-23 06:01:21,353 - optuna.study.study - INFO - Trial 52 finished with values: [0.008978084227315416, 0.011147540983606558, 0.014671850208231854] and parameters: {'n_layers': 2, 'embedding_dim': 256, 'lr': 0.0022084270117427845, 'lambda_val': 0.0018518013272191423, 'batch_size': 3102, 'optimizer': 'Adam'}.
2026-05-23 06:01:23,559 - experiment_functions - INFO - Early stopping at epoch 500. Best Metrics: (0.0020878908534223356, 0.001557377049180328, 0.0018869285193727197)
2026-05-23 06:01:23,676 - optuna.study.study - INFO - Trial 53 finished with values: [0.0020878908534223356, 0.001557377049180328, 0.0018869285193727197] and parameters: {'n_layers': 2, 'embedding_dim': 128, 'lr': 0.01814623553599214, 'lambda_val': 2.6934386815816503e-06, 'batch_size': 894, 'optimizer': 'SGD'}.
2026-05-23 06:01:26,100 - experiment_functions - INFO - Early stopping at epoch 500. Best Metrics: (0.0010418617363331716, 0.0013114754098360656, 0.0015202958494250974)
2026-05-23 06:01:26,231 - optuna.study.study - INFO - Trial 54 finished with values: [0.0010418617363331716, 0.0013114754098360656, 0.0015202958494250974] and parameters: {'n_layers': 4, 'embedding_dim': 128, 'lr': 0.00011211714788430738, 'lambda_val': 0.008069433035806131, 'batch_size': 1011, 'optimizer': 'SGD'}.
2026-05-23 06:01:28,584 - experiment_functions - INFO - Early stopping at epoch 500. Best Metrics: (0.0011884317813513577, 0.0014754098360655738, 0.001544550076983222)
2026-05-23 06:01:28,720 - optuna.study.study - INFO - Trial 55 finished with values: [0.0011884317813513577, 0.0014754098360655738, 0.001544550076983222] and parameters: {'n_layers': 4, 'embedding_dim': 32, 'lr': 0.00017357295347883076, 'lambda_val': 4.409435461756805e-05, 'batch_size': 3335, 'optimizer': 'SGD'}.
2026-05-23 06:01:34,184 - experiment_functions - INFO - Early stopping at epoch 1600. Best Metrics: (0.004778964840668769, 0.003524590163934426, 0.00456778273300885)
2026-05-23 06:01:34,313 - optuna.study.study - INFO - Trial 56 finished with values: [0.004778964840668769, 0.003524590163934426, 0.00456778273300885] and parameters: {'n_layers': 2, 'embedding_dim': 128, 'lr': 0.052893544478494675, 'lambda_val': 3.070687389591576e-06, 'batch_size': 1460, 'optimizer': 'Adam'}.
2026-05-23 06:01:36,493 - experiment_functions - INFO - Early stopping at epoch 500. Best Metrics: (0.0020919158462244024, 0.001967213114754099, 0.002388318975353818)
2026-05-23 06:01:36,616 - optuna.study.study - INFO - Trial 57 finished with values: [0.0020919158462244024, 0.001967213114754099, 0.002388318975353818] and parameters: {'n_layers': 4, 'embedding_dim': 32, 'lr': 0.0006256443216207046, 'lambda_val': 1.6775370695272307e-06, 'batch_size': 967, 'optimizer': 'SGD'}.
2026-05-23 06:01:39,818 - experiment_functions - INFO - Early stopping at epoch 650. Best Metrics: (0.013171217275172049, 0.013688524590163934, 0.016653191902796516)
