2026-05-23 02:08:20,985 - optuna.study.study - INFO - Trial 29 finished with values: [0.009182285907721051, 0.005901639344262294, 0.008297280318657424] and parameters: {'n_layers': 4, 'embedding_dim': 96, 'lr': 0.013707028468469483, 'lambda_val': 0.0004199340181336044, 'batch_size': 2242, 'optimizer': 'Adam'}.
2026-05-23 02:08:23,096 - experiment_functions - INFO - Early stopping at epoch 500. Best Metrics: (0.001960718703688295, 0.0013114754098360656, 0.0016073383699512188)
2026-05-23 02:08:23,237 - optuna.study.study - INFO - Trial 30 finished with values: [0.001960718703688295, 0.0013114754098360656, 0.0016073383699512188] and parameters: {'n_layers': 1, 'embedding_dim': 256, 'lr': 0.03305198544025041, 'lambda_val': 0.0888499069977898, 'batch_size': 2060, 'optimizer': 'SGD'}.
2026-05-23 02:08:26,740 - experiment_functions - INFO - Early stopping at epoch 900. Best Metrics: (0.02263301163660787, 0.012131147540983607, 0.018105464131156428)
2026-05-23 02:08:27,391 - optuna.study.study - INFO - Trial 31 finished with values: [0.02263301163660787, 0.012131147540983607, 0.018105464131156428] and parameters: {'n_layers': 4, 'embedding_dim': 32, 'lr': 0.000570547504131271, 'lambda_val': 0.002125709045009131, 'batch_size': 4025, 'optimizer': 'RMSprop'}.
2026-05-23 02:08:31,157 - experiment_functions - INFO - Early stopping at epoch 700. Best Metrics: (0.02196739674100954, 0.012459016393442624, 0.01919745136462403)
2026-05-23 02:08:31,626 - optuna.study.study - INFO - Trial 32 finished with values: [0.02196739674100954, 0.012459016393442624, 0.01919745136462403] and parameters: {'n_layers': 4, 'embedding_dim': 256, 'lr': 0.0003432142400602671, 'lambda_val': 0.0010210780536973009, 'batch_size': 3759, 'optimizer': 'RMSprop'}.
2026-05-23 02:08:41,874 - experiment_functions - INFO - Early stopping at epoch 3750. Best Metrics: (0.0027920705980591523, 0.0025409836065573774, 0.0034296788501463516)
2026-05-23 02:08:41,963 - optuna.study.study - INFO - Trial 33 finished with values: [0.0027920705980591523, 0.0025409836065573774, 0.0034296788501463516] and parameters: {'n_layers': 1, 'embedding_dim': 128, 'lr': 3.739262166714816e-05, 'lambda_val': 4.132421892830272e-06, 'batch_size': 1723, 'optimizer': 'Adam'}.
2026-05-23 02:08:55,699 - optuna.study.study - INFO - Trial 34 finished with values: [0.01271138895520946, 0.00819672131147541, 0.01216304373592262] and parameters: {'n_layers': 3, 'embedding_dim': 128, 'lr': 5.113057585622387e-05, 'lambda_val': 1.6012413972032166e-05, 'batch_size': 3197, 'optimizer': 'Adam'}.
2026-05-23 02:08:57,671 - experiment_functions - INFO - Early stopping at epoch 500. Best Metrics: (0.002514976649373318, 0.0018852459016393446, 0.0029159115352337633)
2026-05-23 02:08:57,751 - optuna.study.study - INFO - Trial 35 finished with values: [0.002514976649373318, 0.0018852459016393446, 0.0029159115352337633] and parameters: {'n_layers': 1, 'embedding_dim': 96, 'lr': 0.030354428666155252, 'lambda_val': 0.03939237213845169, 'batch_size': 1405, 'optimizer': 'SGD'}.
2026-05-23 02:09:03,961 - experiment_functions - INFO - Early stopping at epoch 1850. Best Metrics: (0.002303285565025934, 0.0020491803278688526, 0.0022995750209212473)
2026-05-23 02:09:04,983 - optuna.study.study - INFO - Trial 36 finished with values: [0.002303285565025934, 0.0020491803278688526, 0.0022995750209212473] and parameters: {'n_layers': 3, 'embedding_dim': 96, 'lr': 1.295899002149347e-05, 'lambda_val': 0.009865971826982454, 'batch_size': 1185, 'optimizer': 'Adam'}.
2026-05-23 02:09:14,301 - experiment_functions - INFO - Early stopping at epoch 1000. Best Metrics: (0.011557830495080678, 0.00860655737704918, 0.012013616036088162)
2026-05-23 02:09:14,709 - optuna.study.study - INFO - Trial 37 finished with values: [0.011557830495080678, 0.00860655737704918, 0.012013616036088162] and parameters: {'n_layers': 1, 'embedding_dim': 32, 'lr': 0.026680582558344934, 'lambda_val': 0.06799272203728716, 'batch_size': 3086, 'optimizer': 'Adam'}.
2026-05-23 02:09:23,803 - experiment_functions - INFO - Early stopping at epoch 1700. Best Metrics: (0.02285083552317303, 0.015000000000000001, 0.019368178836125162)
2026-05-23 02:09:24,113 - optuna.study.study - INFO - Trial 38 finished with values: [0.02285083552317303, 0.015000000000000001, 0.019368178836125162] and parameters: {'n_layers': 3, 'embedding_dim': 128, 'lr': 0.0001642455197684349, 'lambda_val': 0.020702741472597427, 'batch_size': 2477, 'optimizer': 'RMSprop'}.
2026-05-23 02:09:26,946 - experiment_functions - INFO - Early stopping at epoch 650. Best Metrics: (0.0051635313494308045, 0.0033606557377049177, 0.005746779916989925)
2026-05-23 02:09:27,105 - optuna.study.study - INFO - Trial 39 finished with values: [0.0051635313494308045, 0.0033606557377049177, 0.005746779916989925] and parameters: {'n_layers': 4, 'embedding_dim': 128, 'lr': 0.027958217322504274, 'lambda_val': 0.05174047898933555, 'batch_size': 1594, 'optimizer': 'Adam'}.
2026-05-23 02:09:29,467 - experiment_functions - INFO - Early stopping at epoch 500. Best Metrics: (0.0016237227009415814, 0.0014754098360655738, 0.0016072463742781875)
2026-05-23 02:09:29,568 - optuna.study.study - INFO - Trial 40 finished with values: [0.0016237227009415814, 0.0014754098360655738, 0.0016072463742781875] and parameters: {'n_layers': 2, 'embedding_dim': 256, 'lr': 0.0629594157094867, 'lambda_val': 1.045033412284246e-06, 'batch_size': 2320, 'optimizer': 'SGD'}.
2026-05-23 02:09:31,707 - experiment_functions - INFO - Early stopping at epoch 500. Best Metrics: (0.002256738011500023, 0.0021311475409836068, 0.0024917217165414045)
2026-05-23 02:09:31,798 - optuna.study.study - INFO - Trial 41 finished with values: [0.002256738011500023, 0.0021311475409836068, 0.0024917217165414045] and parameters: {'n_layers': 4, 'embedding_dim': 32, 'lr': 2.7565599968052197e-05, 'lambda_val': 6.20330999080519e-05, 'batch_size': 1137, 'optimizer': 'SGD'}.
2026-05-23 02:09:34,708 - experiment_functions - INFO - Early stopping at epoch 850. Best Metrics: (0.02819217856209028, 0.017049180327868854, 0.024211793961277112)
2026-05-23 02:09:34,791 - optuna.study.study - INFO - Trial 42 finished with values: [0.02819217856209028, 0.017049180327868854, 0.024211793961277112] and parameters: {'n_layers': 1, 'embedding_dim': 32, 'lr': 0.001529501184394163, 'lambda_val': 0.01576185866290203, 'batch_size': 664, 'optimizer': 'RMSprop'}.
2026-05-23 02:09:42,711 - experiment_functions - INFO - Early stopping at epoch 2650. Best Metrics: (0.0018736692370221297, 0.0014754098360655738, 0.0021842497565637163)
2026-05-23 02:09:42,797 - optuna.study.study - INFO - Trial 43 finished with values: [0.0018736692370221297, 0.0014754098360655738, 0.0021842497565637163] and parameters: {'n_layers': 2, 'embedding_dim': 128, 'lr': 1.749554297715623e-05, 'lambda_val': 0.0005681359694249771, 'batch_size': 1858, 'optimizer': 'Adam'}.
2026-05-23 02:09:44,914 - experiment_functions - INFO - Early stopping at epoch 500. Best Metrics: (0.0013818784408074236, 0.0013934426229508198, 0.001775725271206803)
2026-05-23 02:09:45,033 - optuna.study.study - INFO - Trial 44 finished with values: [0.0013818784408074236, 0.0013934426229508198, 0.001775725271206803] and parameters: {'n_layers': 4, 'embedding_dim': 32, 'lr': 0.0011659235473695736, 'lambda_val': 2.964330825381288e-05, 'batch_size': 1047, 'optimizer': 'SGD'}.
2026-05-23 02:09:47,696 - experiment_functions - INFO - Early stopping at epoch 600. Best Metrics: (0.034410766592996904, 0.017131147540983608, 0.025087782967165215)
2026-05-23 02:09:47,797 - optuna.study.study - INFO - Trial 45 finished with values: [0.034410766592996904, 0.017131147540983608, 0.025087782967165215] and parameters: {'n_layers': 3, 'embedding_dim': 96, 'lr': 0.0009933779564808808, 'lambda_val': 0.0005428353674897035, 'batch_size': 3132, 'optimizer': 'RMSprop'}.
2026-05-23 02:09:50,370 - experiment_functions - INFO - Early stopping at epoch 650. Best Metrics: (0.012301323739104843, 0.008852459016393444, 0.011360967776767069)
2026-05-23 02:09:50,464 - optuna.study.study - INFO - Trial 46 finished with values: [0.012301323739104843, 0.008852459016393444, 0.011360967776767069] and parameters: {'n_layers': 4, 'embedding_dim': 64, 'lr': 0.09222515610247088, 'lambda_val': 8.444255672002887e-06, 'batch_size': 895, 'optimizer': 'RMSprop'}.
2026-05-23 02:09:55,511 - experiment_functions - INFO - Early stopping at epoch 1650. Best Metrics: (0.003219582797303442, 0.002377049180327869, 0.0037540903643508918)
2026-05-23 02:09:56,546 - optuna.study.study - INFO - Trial 47 finished with values: [0.003219582797303442, 0.002377049180327869, 0.0037540903643508918] and parameters: {'n_layers': 2, 'embedding_dim': 64, 'lr': 1.8319527089005968e-05, 'lambda_val': 2.9616336590570207e-05, 'batch_size': 1556, 'optimizer': 'Adam'}.
2026-05-23 02:10:00,324 - experiment_functions - INFO - Early stopping at epoch 1050. Best Metrics: (0.00913654907694703, 0.0058196721311475404, 0.008763283371684227)
2026-05-23 02:10:00,688 - optuna.study.study - INFO - Trial 48 finished with values: [0.00913654907694703, 0.0058196721311475404, 0.008763283371684227] and parameters: {'n_layers': 2, 'embedding_dim': 128, 'lr': 0.009770284610371589, 'lambda_val': 0.02715527563611178, 'batch_size': 2963, 'optimizer': 'Adam'}.
2026-05-23 02:10:03,395 - experiment_functions - INFO - Early stopping at epoch 600. Best Metrics: (0.027752480573683996, 0.014836065573770494, 0.023371207471020738)
2026-05-23 02:10:03,492 - optuna.study.study - INFO - Trial 49 finished with values: [0.027752480573683996, 0.014836065573770494, 0.023371207471020738] and parameters: {'n_layers': 4, 'embedding_dim': 64, 'lr': 0.0020135118692985172, 'lambda_val': 0.00013294480587825716, 'batch_size': 3427, 'optimizer': 'Adam'}.
2026-05-23 02:10:06,330 - experiment_functions - INFO - Early stopping at epoch 600. Best Metrics: (0.028228852368739697, 0.015655737704918033, 0.023205961688244067)
2026-05-23 02:10:06,453 - optuna.study.study - INFO - Trial 50 finished with values: [0.028228852368739697, 0.015655737704918033, 0.023205961688244067] and parameters: {'n_layers': 4, 'embedding_dim': 64, 'lr': 0.0020135118692985172, 'lambda_val': 0.00013294480587825716, 'batch_size': 2759, 'optimizer': 'Adam'}.
2026-05-23 02:10:14,400 - experiment_functions - INFO - Early stopping at epoch 2400. Best Metrics: (0.003695263798713321, 0.0033606557377049177, 0.004378417350830296)
2026-05-23 02:10:14,559 - optuna.study.study - INFO - Trial 51 finished with values: [0.003695263798713321, 0.0033606557377049177, 0.004378417350830296] and parameters: {'n_layers': 1, 'embedding_dim': 128, 'lr': 5.113057585622387e-05, 'lambda_val': 1.6012413972032166e-05, 'batch_size': 3197, 'optimizer': 'RMSprop'}.
2026-05-23 02:10:18,623 - experiment_functions - INFO - Early stopping at epoch 1050. Best Metrics: (0.0033522856590292483, 0.001639344262295082, 0.002019536953511593)
2026-05-23 02:10:18,758 - optuna.study.study - INFO - Trial 52 finished with values: [0.0033522856590292483, 0.001639344262295082, 0.002019536953511593] and parameters: {'n_layers': 1, 'embedding_dim': 128, 'lr': 1.295899002149347e-05, 'lambda_val': 0.009865971826982454, 'batch_size': 3441, 'optimizer': 'RMSprop'}.
2026-05-23 02:10:21,168 - experiment_functions - INFO - Early stopping at epoch 500. Best Metrics: (0.0005643644635517826, 0.0009836065573770492, 0.0008866544880481303)
2026-05-23 02:10:21,274 - optuna.study.study - INFO - Trial 53 finished with values: [0.0005643644635517826, 0.0009836065573770492, 0.0008866544880481303] and parameters: {'n_layers': 3, 'embedding_dim': 64, 'lr': 0.0009556468953438958, 'lambda_val': 0.012096571595325683, 'batch_size': 675, 'optimizer': 'SGD'}.
2026-05-23 02:10:23,681 - experiment_functions - INFO - Early stopping at epoch 550. Best Metrics: (0.026300105150818015, 0.014754098360655738, 0.02243180949777298)
2026-05-23 02:10:23,763 - optuna.study.study - INFO - Trial 54 finished with values: [0.026300105150818015, 0.014754098360655738, 0.02243180949777298] and parameters: {'n_layers': 1, 'embedding_dim': 32, 'lr': 0.011385784020717018, 'lambda_val': 1.6024291339987423e-06, 'batch_size': 2759, 'optimizer': 'Adam'}.
2026-05-23 02:10:37,197 - optuna.study.study - INFO - Trial 55 finished with values: [0.008984679998537798, 0.005983606557377049, 0.008695475400143503] and parameters: {'n_layers': 3, 'embedding_dim': 96, 'lr': 5.113057585622387e-05, 'lambda_val': 8.858691676718628e-05, 'batch_size': 2886, 'optimizer': 'Adam'}.
2026-05-23 02:10:44,771 - experiment_functions - INFO - Early stopping at epoch 1200. Best Metrics: (0.002226056213424354, 0.002213114754098361, 0.0032361953700454776)
2026-05-23 02:10:45,104 - optuna.study.study - INFO - Trial 56 finished with values: [0.002226056213424354, 0.002213114754098361, 0.0032361953700454776] and parameters: {'n_layers': 4, 'embedding_dim': 128, 'lr': 1.0269988621128265e-05, 'lambda_val': 1.6024291339987423e-06, 'batch_size': 2759, 'optimizer': 'Adam'}.
2026-05-23 02:10:50,620 - experiment_functions - INFO - Early stopping at epoch 1550. Best Metrics: (0.018923473093527793, 0.01139344262295082, 0.01698330272849356)
2026-05-23 02:10:50,768 - optuna.study.study - INFO - Trial 57 finished with values: [0.018923473093527793, 0.01139344262295082, 0.01698330272849356] and parameters: {'n_layers': 1, 'embedding_dim': 128, 'lr': 0.04643734687718579, 'lambda_val': 0.0038475852967126147, 'batch_size': 2886, 'optimizer': 'RMSprop'}.
2026-05-23 02:10:53,434 - experiment_functions - INFO - Early stopping at epoch 650. Best Metrics: (0.02658160817955077, 0.014754098360655738, 0.024181028720851074)
2026-05-23 02:10:53,530 - optuna.study.study - INFO - Trial 58 finished with values: [0.02658160817955077, 0.014754098360655738, 0.024181028720851074] and parameters: {'n_layers': 1, 'embedding_dim': 32, 'lr': 0.004251456926748961, 'lambda_val': 0.0008703400037511266, 'batch_size': 3086, 'optimizer': 'Adam'}.
2026-05-23 02:10:56,361 - experiment_functions - INFO - Early stopping at epoch 550. Best Metrics: (0.02682617346574893, 0.01573770491803279, 0.0240706696552706)
2026-05-23 02:10:56,445 - optuna.study.study - INFO - Trial 59 finished with values: [0.02682617346574893, 0.01573770491803279, 0.0240706696552706] and parameters: {'n_layers': 2, 'embedding_dim': 64, 'lr': 0.010855402575129876, 'lambda_val': 2.505292726657355e-05, 'batch_size': 2242, 'optimizer': 'Adam'}.
2026-05-23 02:10:59,698 - experiment_functions - INFO - Early stopping at epoch 700. Best Metrics: (0.008374810537596302, 0.006721311475409835, 0.008891376811860096)
2026-05-23 02:11:00,511 - optuna.study.study - INFO - Trial 60 finished with values: [0.008374810537596302, 0.006721311475409835, 0.008891376811860096] and parameters: {'n_layers': 2, 'embedding_dim': 32, 'lr': 0.010855402575129876, 'lambda_val': 0.05156477046092871, 'batch_size': 4025, 'optimizer': 'RMSprop'}.
2026-05-23 02:11:11,475 - optuna.study.study - INFO - Trial 61 finished with values: [0.009597054478093241, 0.006557377049180328, 0.009700043804271483] and parameters: {'n_layers': 1, 'embedding_dim': 128, 'lr': 0.0001642455197684349, 'lambda_val': 0.020702741472597427, 'batch_size': 664, 'optimizer': 'RMSprop'}.
2026-05-23 02:11:24,206 - experiment_functions - INFO - Early stopping at epoch 3750. Best Metrics: (0.01826301045311083, 0.01139344262295082, 0.015656896619693578)
2026-05-23 02:11:24,277 - optuna.study.study - INFO - Trial 62 finished with values: [0.01826301045311083, 0.01139344262295082, 0.015656896619693578] and parameters: {'n_layers': 3, 'embedding_dim': 32, 'lr': 0.0001642455197684349, 'lambda_val': 0.020702741472597427, 'batch_size': 2477, 'optimizer': 'RMSprop'}.
2026-05-23 02:11:29,889 - experiment_functions - INFO - Early stopping at epoch 1150. Best Metrics: (0.029762103303740173, 0.017868852459016395, 0.027126223070373892)
2026-05-23 02:11:30,343 - optuna.study.study - INFO - Trial 63 finished with values: [0.029762103303740173, 0.017868852459016395, 0.027126223070373892] and parameters: {'n_layers': 3, 'embedding_dim': 96, 'lr': 0.0003432142400602671, 'lambda_val': 0.0010210780536973009, 'batch_size': 3384, 'optimizer': 'Adam'}.
2026-05-23 02:11:44,567 - optuna.study.study - INFO - Trial 64 finished with values: [0.01779793315046149, 0.012131147540983609, 0.016140546046235136] and parameters: {'n_layers': 2, 'embedding_dim': 128, 'lr': 0.00011089595098502456, 'lambda_val': 0.01380676127429418, 'batch_size': 2051, 'optimizer': 'RMSprop'}.
2026-05-23 02:11:51,932 - experiment_functions - INFO - Early stopping at epoch 1400. Best Metrics: (0.0035338318937220554, 0.00459016393442623, 0.004692677781984315)
2026-05-23 02:11:52,029 - optuna.study.study - INFO - Trial 65 finished with values: [0.0035338318937220554, 0.00459016393442623, 0.004692677781984315] and parameters: {'n_layers': 4, 'embedding_dim': 256, 'lr': 0.00018178347106692703, 'lambda_val': 0.07920199067891599, 'batch_size': 3171, 'optimizer': 'Adam'}.
2026-05-23 02:12:06,165 - experiment_functions - INFO - Early stopping at epoch 3950. Best Metrics: (0.003554188887061098, 0.0019672131147540984, 0.003297470078058274)
2026-05-23 02:12:06,294 - optuna.study.study - INFO - Trial 66 finished with values: [0.003554188887061098, 0.0019672131147540984, 0.003297470078058274] and parameters: {'n_layers': 2, 'embedding_dim': 256, 'lr': 1.8319527089005968e-05, 'lambda_val': 2.9616336590570207e-05, 'batch_size': 1786, 'optimizer': 'Adam'}.
2026-05-23 02:12:08,858 - experiment_functions - INFO - Early stopping at epoch 600. Best Metrics: (0.02938173830823065, 0.017540983606557377, 0.026536483086617976)
2026-05-23 02:12:08,993 - optuna.study.study - INFO - Trial 67 finished with values: [0.02938173830823065, 0.017540983606557377, 0.026536483086617976] and parameters: {'n_layers': 3, 'embedding_dim': 64, 'lr': 0.0027017388551690887, 'lambda_val': 1.6012413972032166e-05, 'batch_size': 1698, 'optimizer': 'Adam'}.
2026-05-23 02:12:11,730 - experiment_functions - INFO - Early stopping at epoch 500. Best Metrics: (0.0022620677643340643, 0.0012295081967213116, 0.0023007997106525603)
2026-05-23 02:12:11,819 - optuna.study.study - INFO - Trial 68 finished with values: [0.0022620677643340643, 0.0012295081967213116, 0.0023007997106525603] and parameters: {'n_layers': 3, 'embedding_dim': 256, 'lr': 0.003719648469234652, 'lambda_val': 8.858691676718628e-05, 'batch_size': 2886, 'optimizer': 'SGD'}.
2026-05-23 02:12:17,113 - experiment_functions - INFO - Early stopping at epoch 1550. Best Metrics: (0.014406505951171454, 0.012049180327868853, 0.015405115071339022)
2026-05-23 02:12:17,769 - optuna.study.study - INFO - Trial 69 finished with values: [0.014406505951171454, 0.012049180327868853, 0.015405115071339022] and parameters: {'n_layers': 1, 'embedding_dim': 256, 'lr': 0.01140479989462853, 'lambda_val': 0.0006368779226349178, 'batch_size': 1786, 'optimizer': 'RMSprop'}.
2026-05-23 02:12:23,612 - experiment_functions - INFO - Early stopping at epoch 1250. Best Metrics: (0.0025054835260379044, 0.0019672131147540984, 0.0026900577012165007)
2026-05-23 02:12:24,065 - optuna.study.study - INFO - Trial 70 finished with values: [0.0025054835260379044, 0.0019672131147540984, 0.0026900577012165007] and parameters: {'n_layers': 4, 'embedding_dim': 256, 'lr': 0.0629594157094867, 'lambda_val': 2.674540612069612e-05, 'batch_size': 2320, 'optimizer': 'SGD'}.
2026-05-23 02:12:27,422 - experiment_functions - INFO - Early stopping at epoch 700. Best Metrics: (0.029040231186294875, 0.016065573770491805, 0.024626455561725255)
2026-05-23 02:12:27,525 - optuna.study.study - INFO - Trial 71 finished with values: [0.029040231186294875, 0.016065573770491805, 0.024626455561725255] and parameters: {'n_layers': 3, 'embedding_dim': 32, 'lr': 0.0009933779564808808, 'lambda_val': 0.0005428353674897035, 'batch_size': 2477, 'optimizer': 'RMSprop'}.
2026-05-23 02:12:30,670 - experiment_functions - INFO - Early stopping at epoch 850. Best Metrics: (0.01744389266210144, 0.012704918032786885, 0.01759820479884725)
2026-05-23 02:12:30,749 - optuna.study.study - INFO - Trial 72 finished with values: [0.01744389266210144, 0.012704918032786885, 0.01759820479884725] and parameters: {'n_layers': 1, 'embedding_dim': 128, 'lr': 0.0010682175784251788, 'lambda_val': 0.06799272203728716, 'batch_size': 1594, 'optimizer': 'Adam'}.
2026-05-23 02:12:33,525 - experiment_functions - INFO - Early stopping at epoch 550. Best Metrics: (0.019078592741511836, 0.012131147540983607, 0.01692254457058455)
2026-05-23 02:12:33,654 - optuna.study.study - INFO - Trial 73 finished with values: [0.019078592741511836, 0.012131147540983607, 0.01692254457058455] and parameters: {'n_layers': 2, 'embedding_dim': 256, 'lr': 0.001529501184394163, 'lambda_val': 0.01380676127429418, 'batch_size': 3441, 'optimizer': 'RMSprop'}.
2026-05-23 02:12:36,860 - experiment_functions - INFO - Early stopping at epoch 500. Best Metrics: (0.0014375323929621134, 0.001967213114754099, 0.002117011134200861)
2026-05-23 02:12:36,950 - optuna.study.study - INFO - Trial 74 finished with values: [0.0014375323929621134, 0.001967213114754099, 0.002117011134200861] and parameters: {'n_layers': 4, 'embedding_dim': 256, 'lr': 0.003012176927562537, 'lambda_val': 1.7029222948570324e-06, 'batch_size': 2126, 'optimizer': 'SGD'}.
2026-05-23 02:12:39,257 - experiment_functions - INFO - Early stopping at epoch 550. Best Metrics: (0.027796143306791823, 0.01614754098360656, 0.025128108385747683)
2026-05-23 02:12:39,345 - optuna.study.study - INFO - Trial 75 finished with values: [0.027796143306791823, 0.01614754098360656, 0.025128108385747683] and parameters: {'n_layers': 2, 'embedding_dim': 64, 'lr': 0.0020135118692985172, 'lambda_val': 0.0004199340181336044, 'batch_size': 2242, 'optimizer': 'RMSprop'}.
