2026-05-23 05:04:51,391 - optuna.study.study - INFO - Trial 134 finished with values: [0.03832597738715041, 0.017868852459016392, 0.02845519709815182] and parameters: {'n_layers': 1, 'embedding_dim': 32, 'lr': 0.04200164298544427, 'lambda_val': 0.00046960506652318453, 'batch_size': 2445, 'optimizer': 'RMSprop'}.
2026-05-23 05:04:59,758 - experiment_functions - INFO - Early stopping at epoch 2650. Best Metrics: (0.04298518348285618, 0.02877049180327869, 0.0390205966673571)
2026-05-23 05:05:00,706 - optuna.study.study - INFO - Trial 135 finished with values: [0.04298518348285618, 0.02877049180327869, 0.0390205966673571] and parameters: {'n_layers': 1, 'embedding_dim': 96, 'lr': 0.05244400632546388, 'lambda_val': 0.030374414852054388, 'batch_size': 1182, 'optimizer': 'RMSprop'}.
2026-05-23 05:05:03,079 - experiment_functions - INFO - Early stopping at epoch 500. Best Metrics: (0.0012394774070519623, 0.001639344262295082, 0.0016548951481599793)
2026-05-23 05:05:03,173 - optuna.study.study - INFO - Trial 136 finished with values: [0.0012394774070519623, 0.001639344262295082, 0.0016548951481599793] and parameters: {'n_layers': 1, 'embedding_dim': 128, 'lr': 0.014307049433242047, 'lambda_val': 1.500239937859637e-05, 'batch_size': 2401, 'optimizer': 'SGD'}.
2026-05-23 05:05:05,876 - experiment_functions - INFO - Early stopping at epoch 650. Best Metrics: (0.06356897655931174, 0.03532786885245902, 0.05434671788913314)
2026-05-23 05:05:05,960 - optuna.study.study - INFO - Trial 137 finished with values: [0.06356897655931174, 0.03532786885245902, 0.05434671788913314] and parameters: {'n_layers': 1, 'embedding_dim': 32, 'lr': 0.001814498584431129, 'lambda_val': 0.011064300904059448, 'batch_size': 1090, 'optimizer': 'RMSprop'}.
2026-05-23 05:05:10,364 - experiment_functions - INFO - Early stopping at epoch 1000. Best Metrics: (0.01425409109836336, 0.009426229508196722, 0.01335104672296593)
2026-05-23 05:05:11,510 - optuna.study.study - INFO - Trial 138 finished with values: [0.01425409109836336, 0.009426229508196722, 0.01335104672296593] and parameters: {'n_layers': 1, 'embedding_dim': 256, 'lr': 0.08325297886899372, 'lambda_val': 3.5614573447749906e-05, 'batch_size': 1335, 'optimizer': 'RMSprop'}.
2026-05-23 05:05:15,628 - experiment_functions - INFO - Early stopping at epoch 1050. Best Metrics: (0.045649320065653476, 0.03106557377049181, 0.044823982201498955)
2026-05-23 05:05:16,471 - optuna.study.study - INFO - Trial 139 finished with values: [0.045649320065653476, 0.03106557377049181, 0.044823982201498955] and parameters: {'n_layers': 1, 'embedding_dim': 128, 'lr': 0.0032256937887088586, 'lambda_val': 0.021857441898757924, 'batch_size': 3864, 'optimizer': 'RMSprop'}.
2026-05-23 05:05:20,558 - experiment_functions - INFO - Early stopping at epoch 1000. Best Metrics: (0.07995756447839218, 0.04360655737704918, 0.06879148168234452)
2026-05-23 05:05:21,481 - optuna.study.study - INFO - Trial 140 finished with values: [0.07995756447839218, 0.04360655737704918, 0.06879148168234452] and parameters: {'n_layers': 1, 'embedding_dim': 64, 'lr': 0.000498408569398285, 'lambda_val': 0.009884403542259862, 'batch_size': 3864, 'optimizer': 'Adam'}.
2026-05-23 05:05:29,755 - experiment_functions - INFO - Early stopping at epoch 1400. Best Metrics: (0.05523433900480756, 0.029344262295081972, 0.04691215073033027)
2026-05-23 05:05:29,979 - optuna.study.study - INFO - Trial 141 finished with values: [0.05523433900480756, 0.029344262295081972, 0.04691215073033027] and parameters: {'n_layers': 3, 'embedding_dim': 256, 'lr': 0.0004134349417792622, 'lambda_val': 3.817491759844064e-06, 'batch_size': 2428, 'optimizer': 'Adam'}.
2026-05-23 05:05:34,121 - experiment_functions - INFO - Early stopping at epoch 550. Best Metrics: (0.0447185803026632, 0.024918032786885248, 0.03801511995388648)
2026-05-23 05:05:34,219 - optuna.study.study - INFO - Trial 142 finished with values: [0.0447185803026632, 0.024918032786885248, 0.03801511995388648] and parameters: {'n_layers': 3, 'embedding_dim': 256, 'lr': 0.0025251998940112653, 'lambda_val': 3.827155829365953e-06, 'batch_size': 3439, 'optimizer': 'Adam'}.
2026-05-23 05:05:37,145 - experiment_functions - INFO - Early stopping at epoch 650. Best Metrics: (0.014779561352653755, 0.009508196721311476, 0.01306838174506736)
2026-05-23 05:05:37,362 - optuna.study.study - INFO - Trial 143 finished with values: [0.014779561352653755, 0.009508196721311476, 0.01306838174506736] and parameters: {'n_layers': 4, 'embedding_dim': 32, 'lr': 0.0032256937887088586, 'lambda_val': 1.2213470032695958e-05, 'batch_size': 1291, 'optimizer': 'RMSprop'}.
2026-05-23 05:05:39,923 - experiment_functions - INFO - Early stopping at epoch 500. Best Metrics: (0.03717888133979025, 0.01418032786885246, 0.029050090108024108)
2026-05-23 05:05:40,017 - optuna.study.study - INFO - Trial 144 finished with values: [0.03717888133979025, 0.01418032786885246, 0.029050090108024108] and parameters: {'n_layers': 4, 'embedding_dim': 64, 'lr': 0.030168979659929537, 'lambda_val': 1.7201488669889816e-06, 'batch_size': 665, 'optimizer': 'RMSprop'}.
2026-05-23 05:05:48,233 - experiment_functions - INFO - Early stopping at epoch 2700. Best Metrics: (0.03927605652609398, 0.02459016393442623, 0.035574062773672956)
2026-05-23 05:05:48,309 - optuna.study.study - INFO - Trial 145 finished with values: [0.03927605652609398, 0.02459016393442623, 0.035574062773672956] and parameters: {'n_layers': 1, 'embedding_dim': 32, 'lr': 0.09357442715478712, 'lambda_val': 0.030374414852054388, 'batch_size': 1182, 'optimizer': 'Adam'}.
2026-05-23 05:05:56,371 - experiment_functions - INFO - Early stopping at epoch 1600. Best Metrics: (0.024228674358018957, 0.015901639344262294, 0.02156787766060991)
2026-05-23 05:05:57,408 - optuna.study.study - INFO - Trial 146 finished with values: [0.024228674358018957, 0.015901639344262294, 0.02156787766060991] and parameters: {'n_layers': 4, 'embedding_dim': 96, 'lr': 0.00023403261991529253, 'lambda_val': 0.005758170316328264, 'batch_size': 2533, 'optimizer': 'Adam'}.
2026-05-23 05:06:02,751 - experiment_functions - INFO - Early stopping at epoch 500. Best Metrics: (0.0014074515991846788, 0.002213114754098361, 0.0022954275509112177)
2026-05-23 05:06:03,187 - optuna.study.study - INFO - Trial 147 finished with values: [0.0014074515991846788, 0.002213114754098361, 0.0022954275509112177] and parameters: {'n_layers': 1, 'embedding_dim': 256, 'lr': 1.8136181994893172e-05, 'lambda_val': 0.006989797387892844, 'batch_size': 2737, 'optimizer': 'RMSprop'}.
2026-05-23 05:06:11,832 - experiment_functions - INFO - Early stopping at epoch 550. Best Metrics: (0.03141653028627071, 0.020819672131147538, 0.029841816245665138)
2026-05-23 05:06:12,406 - optuna.study.study - INFO - Trial 148 finished with values: [0.03141653028627071, 0.020819672131147538, 0.029841816245665138] and parameters: {'n_layers': 3, 'embedding_dim': 32, 'lr': 0.00336717922999122, 'lambda_val': 0.00010416156330755775, 'batch_size': 3439, 'optimizer': 'Adam'}.
2026-05-23 05:06:15,663 - experiment_functions - INFO - Early stopping at epoch 650. Best Metrics: (0.0633583562935923, 0.03344262295081967, 0.057038055316622954)
2026-05-23 05:06:15,791 - optuna.study.study - INFO - Trial 149 finished with values: [0.0633583562935923, 0.03344262295081967, 0.057038055316622954] and parameters: {'n_layers': 1, 'embedding_dim': 64, 'lr': 0.0032256937887088586, 'lambda_val': 1.2213470032695958e-05, 'batch_size': 1291, 'optimizer': 'RMSprop'}.
2026-05-23 05:06:18,586 - experiment_functions - INFO - Early stopping at epoch 550. Best Metrics: (0.07613041968780636, 0.041639344262295076, 0.06789547089047045)
2026-05-23 05:06:18,664 - optuna.study.study - INFO - Trial 150 finished with values: [0.07613041968780636, 0.041639344262295076, 0.06789547089047045] and parameters: {'n_layers': 1, 'embedding_dim': 128, 'lr': 0.0027034335159540246, 'lambda_val': 2.7554943772348907e-05, 'batch_size': 3864, 'optimizer': 'RMSprop'}.
2026-05-23 05:06:23,063 - experiment_functions - INFO - Early stopping at epoch 1150. Best Metrics: (0.07082614658911526, 0.04204918032786885, 0.06245606804594101)
2026-05-23 05:06:23,259 - optuna.study.study - INFO - Trial 151 finished with values: [0.07082614658911526, 0.04204918032786885, 0.06245606804594101] and parameters: {'n_layers': 1, 'embedding_dim': 64, 'lr': 0.0004134349417792622, 'lambda_val': 0.021857441898757924, 'batch_size': 2390, 'optimizer': 'Adam'}.
2026-05-23 05:06:29,919 - experiment_functions - INFO - Early stopping at epoch 1850. Best Metrics: (0.1181180131840143, 0.05598360655737706, 0.08930502616347026)
2026-05-23 05:06:30,002 - optuna.study.study - INFO - Trial 152 finished with values: [0.1181180131840143, 0.05598360655737706, 0.08930502616347026] and parameters: {'n_layers': 1, 'embedding_dim': 128, 'lr': 0.0004134349417792622, 'lambda_val': 3.5614573447749906e-05, 'batch_size': 3864, 'optimizer': 'Adam'}.
2026-05-23 05:06:32,593 - experiment_functions - INFO - Early stopping at epoch 550. Best Metrics: (0.0785350452056951, 0.039754098360655736, 0.06709095534362731)
2026-05-23 05:06:32,724 - optuna.study.study - INFO - Trial 153 finished with values: [0.0785350452056951, 0.039754098360655736, 0.06709095534362731] and parameters: {'n_layers': 1, 'embedding_dim': 32, 'lr': 0.01455213187251788, 'lambda_val': 0.00032113881713361967, 'batch_size': 3816, 'optimizer': 'Adam'}.
2026-05-23 05:06:40,214 - experiment_functions - INFO - Early stopping at epoch 1250. Best Metrics: (0.07065229593583128, 0.03418032786885246, 0.05755910004503639)
2026-05-23 05:06:40,331 - optuna.study.study - INFO - Trial 154 finished with values: [0.07065229593583128, 0.03418032786885246, 0.05755910004503639] and parameters: {'n_layers': 3, 'embedding_dim': 256, 'lr': 0.0004134349417792622, 'lambda_val': 3.817491759844064e-06, 'batch_size': 2374, 'optimizer': 'Adam'}.
2026-05-23 05:06:42,710 - experiment_functions - INFO - Early stopping at epoch 650. Best Metrics: (0.09724946630601701, 0.0471311475409836, 0.07875840277204248)
2026-05-23 05:06:42,843 - optuna.study.study - INFO - Trial 155 finished with values: [0.09724946630601701, 0.0471311475409836, 0.07875840277204248] and parameters: {'n_layers': 1, 'embedding_dim': 64, 'lr': 0.0032256937887088586, 'lambda_val': 1.2213470032695958e-05, 'batch_size': 1291, 'optimizer': 'Adam'}.
2026-05-23 05:06:48,331 - experiment_functions - INFO - Early stopping at epoch 1750. Best Metrics: (0.09257573698357112, 0.04967213114754099, 0.07592227750563348)
2026-05-23 05:06:48,764 - optuna.study.study - INFO - Trial 156 finished with values: [0.09257573698357112, 0.04967213114754099, 0.07592227750563348] and parameters: {'n_layers': 1, 'embedding_dim': 32, 'lr': 0.000498408569398285, 'lambda_val': 4.915768160138094e-05, 'batch_size': 3864, 'optimizer': 'RMSprop'}.
2026-05-23 05:07:04,930 - optuna.study.study - INFO - Trial 157 finished with values: [0.05259297462771212, 0.030901639344262297, 0.04772169454970655] and parameters: {'n_layers': 3, 'embedding_dim': 64, 'lr': 0.00015281876966777362, 'lambda_val': 4.006717999944042e-05, 'batch_size': 1025, 'optimizer': 'Adam'}.
2026-05-23 05:07:20,239 - optuna.study.study - INFO - Trial 158 finished with values: [0.062034866585879284, 0.035655737704918034, 0.05683135504727617] and parameters: {'n_layers': 1, 'embedding_dim': 256, 'lr': 0.000145468795718925, 'lambda_val': 0.0006153780524713789, 'batch_size': 1025, 'optimizer': 'RMSprop'}.
2026-05-23 05:07:23,054 - experiment_functions - INFO - Early stopping at epoch 600. Best Metrics: (0.08368342327355559, 0.040409836065573766, 0.06834049785848785)
2026-05-23 05:07:23,149 - optuna.study.study - INFO - Trial 159 finished with values: [0.08368342327355559, 0.040409836065573766, 0.06834049785848785] and parameters: {'n_layers': 1, 'embedding_dim': 64, 'lr': 0.0032256937887088586, 'lambda_val': 1.2213470032695958e-05, 'batch_size': 3864, 'optimizer': 'RMSprop'}.
2026-05-23 05:07:25,692 - experiment_functions - INFO - Early stopping at epoch 550. Best Metrics: (0.09162566072387968, 0.04704918032786886, 0.07777912134033352)
2026-05-23 05:07:25,831 - optuna.study.study - INFO - Trial 160 finished with values: [0.09162566072387968, 0.04704918032786886, 0.07777912134033352] and parameters: {'n_layers': 1, 'embedding_dim': 128, 'lr': 0.007500361823223764, 'lambda_val': 4.915768160138094e-05, 'batch_size': 1834, 'optimizer': 'Adam'}.
2026-05-23 05:07:30,334 - experiment_functions - INFO - Early stopping at epoch 1150. Best Metrics: (0.0421818873708405, 0.028032786885245905, 0.04039717248282009)
2026-05-23 05:07:31,081 - optuna.study.study - INFO - Trial 161 finished with values: [0.0421818873708405, 0.028032786885245905, 0.04039717248282009] and parameters: {'n_layers': 2, 'embedding_dim': 32, 'lr': 0.0005663247330896729, 'lambda_val': 0.00475024784706787, 'batch_size': 2784, 'optimizer': 'Adam'}.
2026-05-23 05:07:34,080 - experiment_functions - INFO - Early stopping at epoch 700. Best Metrics: (0.002440764161580655, 0.0017213114754098362, 0.0024407918887125756)
2026-05-23 05:07:34,663 - optuna.study.study - INFO - Trial 162 finished with values: [0.002440764161580655, 0.0017213114754098362, 0.0024407918887125756] and parameters: {'n_layers': 1, 'embedding_dim': 128, 'lr': 2.2225228540172587e-05, 'lambda_val': 0.030374414852054388, 'batch_size': 1182, 'optimizer': 'Adam'}.
2026-05-23 05:07:36,994 - experiment_functions - INFO - Early stopping at epoch 500. Best Metrics: (0.0024800427236962405, 0.0018852459016393446, 0.0023118428883384346)
2026-05-23 05:07:37,110 - optuna.study.study - INFO - Trial 163 finished with values: [0.0024800427236962405, 0.0018852459016393446, 0.0023118428883384346] and parameters: {'n_layers': 1, 'embedding_dim': 64, 'lr': 0.0005663247330896729, 'lambda_val': 0.009884403542259862, 'batch_size': 3864, 'optimizer': 'SGD'}.
2026-05-23 05:07:55,233 - experiment_functions - INFO - Early stopping at epoch 3600. Best Metrics: (0.06186945022329628, 0.034098360655737715, 0.05309125035558089)
2026-05-23 05:07:55,302 - optuna.study.study - INFO - Trial 164 finished with values: [0.06186945022329628, 0.034098360655737715, 0.05309125035558089] and parameters: {'n_layers': 4, 'embedding_dim': 128, 'lr': 0.00014581096265244323, 'lambda_val': 8.668980017012997e-05, 'batch_size': 1950, 'optimizer': 'RMSprop'}.
2026-05-23 05:08:00,814 - experiment_functions - INFO - Early stopping at epoch 1500. Best Metrics: (0.09576939140257022, 0.04918032786885246, 0.07795986278014642)
2026-05-23 05:08:00,905 - optuna.study.study - INFO - Trial 165 finished with values: [0.09576939140257022, 0.04918032786885246, 0.07795986278014642] and parameters: {'n_layers': 1, 'embedding_dim': 96, 'lr': 0.000498408569398285, 'lambda_val': 0.00475024784706787, 'batch_size': 2784, 'optimizer': 'Adam'}.
2026-05-23 05:08:13,999 - optuna.study.study - INFO - Trial 166 finished with values: [0.07456423970312481, 0.04131147540983606, 0.06478305703635152] and parameters: {'n_layers': 1, 'embedding_dim': 64, 'lr': 0.00017559923823258955, 'lambda_val': 0.0003464722773423699, 'batch_size': 3424, 'optimizer': 'Adam'}.
2026-05-23 05:08:19,126 - experiment_functions - INFO - Early stopping at epoch 500. Best Metrics: (0.002290488977580665, 0.0021311475409836068, 0.002691043072247246)
2026-05-23 05:08:19,729 - optuna.study.study - INFO - Trial 167 finished with values: [0.002290488977580665, 0.0021311475409836068, 0.002691043072247246] and parameters: {'n_layers': 1, 'embedding_dim': 32, 'lr': 0.00019262259007340505, 'lambda_val': 4.915768160138094e-05, 'batch_size': 2445, 'optimizer': 'SGD'}.
2026-05-23 05:08:27,058 - experiment_functions - INFO - Early stopping at epoch 500. Best Metrics: (0.0019609957707102253, 0.002622950819672131, 0.002919124993575784)
2026-05-23 05:08:27,663 - optuna.study.study - INFO - Trial 168 finished with values: [0.0019609957707102253, 0.002622950819672131, 0.002919124993575784] and parameters: {'n_layers': 1, 'embedding_dim': 64, 'lr': 0.00015281876966777362, 'lambda_val': 0.009884403542259862, 'batch_size': 557, 'optimizer': 'Adam'}.
2026-05-23 05:08:31,626 - experiment_functions - INFO - Early stopping at epoch 600. Best Metrics: (0.06274807315744134, 0.03459016393442623, 0.05840567367204137)
2026-05-23 05:08:31,694 - optuna.study.study - INFO - Trial 169 finished with values: [0.06274807315744134, 0.03459016393442623, 0.05840567367204137] and parameters: {'n_layers': 2, 'embedding_dim': 128, 'lr': 0.0025251998940112653, 'lambda_val': 3.827155829365953e-06, 'batch_size': 1407, 'optimizer': 'Adam'}.
2026-05-23 05:08:35,042 - experiment_functions - INFO - Early stopping at epoch 850. Best Metrics: (0.05838636828844639, 0.036147540983606556, 0.049392478281512324)
2026-05-23 05:08:35,500 - optuna.study.study - INFO - Trial 170 finished with values: [0.05838636828844639, 0.036147540983606556, 0.049392478281512324] and parameters: {'n_layers': 1, 'embedding_dim': 32, 'lr': 0.0005663247330896729, 'lambda_val': 0.021857441898757924, 'batch_size': 2871, 'optimizer': 'RMSprop'}.
2026-05-23 05:08:39,118 - experiment_functions - INFO - Early stopping at epoch 550. Best Metrics: (0.03615209687861424, 0.021639344262295083, 0.030182350153194752)
2026-05-23 05:08:39,310 - optuna.study.study - INFO - Trial 171 finished with values: [0.03615209687861424, 0.021639344262295083, 0.030182350153194752] and parameters: {'n_layers': 4, 'embedding_dim': 128, 'lr': 0.0027034335159540246, 'lambda_val': 2.7554943772348907e-05, 'batch_size': 2533, 'optimizer': 'Adam'}.
2026-05-23 05:08:41,740 - experiment_functions - INFO - Early stopping at epoch 550. Best Metrics: (0.08559135895575486, 0.04368852459016393, 0.07317972214574853)
2026-05-23 05:08:41,822 - optuna.study.study - INFO - Trial 172 finished with values: [0.08559135895575486, 0.04368852459016393, 0.07317972214574853] and parameters: {'n_layers': 1, 'embedding_dim': 32, 'lr': 0.0032256937887088586, 'lambda_val': 4.006717999944042e-05, 'batch_size': 2871, 'optimizer': 'RMSprop'}.
2026-05-23 05:08:46,050 - experiment_functions - INFO - Early stopping at epoch 1100. Best Metrics: (0.0029699435562914474, 0.0018852459016393446, 0.0031326819687544473)
2026-05-23 05:08:46,144 - optuna.study.study - INFO - Trial 173 finished with values: [0.0029699435562914474, 0.0018852459016393446, 0.0031326819687544473] and parameters: {'n_layers': 1, 'embedding_dim': 128, 'lr': 2.1423625908892185e-05, 'lambda_val': 0.021857441898757924, 'batch_size': 2390, 'optimizer': 'Adam'}.
2026-05-23 05:08:58,973 - optuna.study.study - INFO - Trial 174 finished with values: [0.04983447376141379, 0.03270491803278689, 0.04725540688168335] and parameters: {'n_layers': 1, 'embedding_dim': 32, 'lr': 0.047792792291927955, 'lambda_val': 0.021857441898757924, 'batch_size': 2390, 'optimizer': 'Adam'}.
2026-05-23 05:09:14,950 - optuna.study.study - INFO - Trial 175 finished with values: [0.06948429912936582, 0.03934426229508197, 0.05932124995064213] and parameters: {'n_layers': 3, 'embedding_dim': 64, 'lr': 0.00017559923823258955, 'lambda_val': 0.0003464722773423699, 'batch_size': 1182, 'optimizer': 'RMSprop'}.
2026-05-23 05:09:17,586 - experiment_functions - INFO - Early stopping at epoch 500. Best Metrics: (0.003417414909004416, 0.0017213114754098362, 0.0025295983329684637)
2026-05-23 05:09:17,683 - optuna.study.study - INFO - Trial 176 finished with values: [0.003417414909004416, 0.0017213114754098362, 0.0025295983329684637] and parameters: {'n_layers': 3, 'embedding_dim': 96, 'lr': 0.0016740667020226415, 'lambda_val': 4.006717999944042e-05, 'batch_size': 1699, 'optimizer': 'SGD'}.
2026-05-23 05:09:32,283 - experiment_functions - INFO - Early stopping at epoch 3100. Best Metrics: (0.0758253781915837, 0.04237704918032787, 0.06856537900671211)
2026-05-23 05:09:32,857 - optuna.study.study - INFO - Trial 177 finished with values: [0.0758253781915837, 0.04237704918032787, 0.06856537900671211] and parameters: {'n_layers': 2, 'embedding_dim': 256, 'lr': 0.0001413193463806038, 'lambda_val': 0.000765889777157795, 'batch_size': 2244, 'optimizer': 'RMSprop'}.
2026-05-23 05:09:48,805 - optuna.study.study - INFO - Trial 178 finished with values: [0.09869764993971843, 0.05057377049180328, 0.08274909836408802] and parameters: {'n_layers': 1, 'embedding_dim': 256, 'lr': 0.000145468795718925, 'lambda_val': 0.00619655064381492, 'batch_size': 3864, 'optimizer': 'RMSprop'}.
2026-05-23 05:09:52,102 - experiment_functions - INFO - Early stopping at epoch 600. Best Metrics: (0.023752218734706364, 0.015655737704918033, 0.02092508228054918)
2026-05-23 05:09:52,190 - optuna.study.study - INFO - Trial 179 finished with values: [0.023752218734706364, 0.015655737704918033, 0.02092508228054918] and parameters: {'n_layers': 4, 'embedding_dim': 32, 'lr': 0.0032256937887088586, 'lambda_val': 0.00475024784706787, 'batch_size': 2572, 'optimizer': 'Adam'}.
2026-05-23 05:09:55,151 - experiment_functions - INFO - Early stopping at epoch 600. Best Metrics: (0.08509649785549077, 0.0440983606557377, 0.06726314967534432)
2026-05-23 05:09:56,122 - optuna.study.study - INFO - Trial 180 finished with values: [0.08509649785549077, 0.0440983606557377, 0.06726314967534432] and parameters: {'n_layers': 1, 'embedding_dim': 128, 'lr': 0.0027034335159540246, 'lambda_val': 0.00619655064381492, 'batch_size': 3864, 'optimizer': 'Adam'}.
2026-05-23 05:10:09,875 - optuna.study.study - INFO - Trial 181 finished with values: [0.09168690302854014, 0.04557377049180328, 0.07726464391100295] and parameters: {'n_layers': 1, 'embedding_dim': 64, 'lr': 0.00019262259007340505, 'lambda_val': 4.915768160138094e-05, 'batch_size': 3864, 'optimizer': 'Adam'}.
