2026-05-23 04:08:50,116 - optuna.study.study - INFO - Trial 256 finished with values: [0.09473921381509065, 0.046967213114754096, 0.07998751063092521] and parameters: {'n_layers': 1, 'embedding_dim': 256, 'lr': 0.0029056396011724254, 'lambda_val': 3.830785019134848e-06, 'batch_size': 3317, 'optimizer': 'Adam'}.
2026-05-23 04:08:53,173 - experiment_functions - INFO - Early stopping at epoch 600. Best Metrics: (0.11160358866430352, 0.05139344262295082, 0.08847456458563277)
2026-05-23 04:08:53,252 - optuna.study.study - INFO - Trial 257 finished with values: [0.11160358866430352, 0.05139344262295082, 0.08847456458563277] and parameters: {'n_layers': 1, 'embedding_dim': 256, 'lr': 0.0029056396011724254, 'lambda_val': 1.395072065085088e-06, 'batch_size': 2670, 'optimizer': 'Adam'}.
2026-05-23 04:08:56,512 - experiment_functions - INFO - Early stopping at epoch 550. Best Metrics: (0.09986158004375306, 0.04737704918032787, 0.0776042716271858)
2026-05-23 04:08:56,595 - optuna.study.study - INFO - Trial 258 finished with values: [0.09986158004375306, 0.04737704918032787, 0.0776042716271858] and parameters: {'n_layers': 1, 'embedding_dim': 256, 'lr': 0.006682771802508509, 'lambda_val': 4.349199552665058e-05, 'batch_size': 2314, 'optimizer': 'Adam'}.
2026-05-23 04:08:59,198 - experiment_functions - INFO - Early stopping at epoch 600. Best Metrics: (0.08992527164165522, 0.047786885245901634, 0.07244418350415419)
2026-05-23 04:08:59,274 - optuna.study.study - INFO - Trial 259 finished with values: [0.08992527164165522, 0.047786885245901634, 0.07244418350415419] and parameters: {'n_layers': 1, 'embedding_dim': 64, 'lr': 0.0033147733619128938, 'lambda_val': 8.173822349987447e-05, 'batch_size': 3317, 'optimizer': 'Adam'}.
2026-05-23 04:09:02,692 - experiment_functions - INFO - Early stopping at epoch 650. Best Metrics: (0.028558127804231656, 0.018688524590163937, 0.028508374739085275)
2026-05-23 04:09:03,688 - optuna.study.study - INFO - Trial 260 finished with values: [0.028558127804231656, 0.018688524590163937, 0.028508374739085275] and parameters: {'n_layers': 4, 'embedding_dim': 64, 'lr': 0.0015660906918692206, 'lambda_val': 0.0005885991132278509, 'batch_size': 2386, 'optimizer': 'Adam'}.
2026-05-23 04:09:07,233 - experiment_functions - INFO - Early stopping at epoch 750. Best Metrics: (0.058952335464380425, 0.028196721311475416, 0.04600762616553804)
2026-05-23 04:09:07,305 - optuna.study.study - INFO - Trial 261 finished with values: [0.058952335464380425, 0.028196721311475416, 0.04600762616553804] and parameters: {'n_layers': 3, 'embedding_dim': 32, 'lr': 0.0016044647069746135, 'lambda_val': 8.391673416893658e-05, 'batch_size': 2589, 'optimizer': 'Adam'}.
2026-05-23 04:09:09,935 - experiment_functions - INFO - Early stopping at epoch 600. Best Metrics: (0.08657184273113962, 0.04344262295081967, 0.07440275578047836)
2026-05-23 04:09:10,881 - optuna.study.study - INFO - Trial 262 finished with values: [0.08657184273113962, 0.04344262295081967, 0.07440275578047836] and parameters: {'n_layers': 1, 'embedding_dim': 64, 'lr': 0.003390923411508913, 'lambda_val': 6.13505476225876e-05, 'batch_size': 4072, 'optimizer': 'Adam'}.
2026-05-23 04:09:18,953 - experiment_functions - INFO - Early stopping at epoch 600. Best Metrics: (0.0924178118467102, 0.04770491803278689, 0.07887703301466763)
2026-05-23 04:09:19,341 - optuna.study.study - INFO - Trial 263 finished with values: [0.0924178118467102, 0.04770491803278689, 0.07887703301466763] and parameters: {'n_layers': 1, 'embedding_dim': 96, 'lr': 0.0029056396011724254, 'lambda_val': 0.005013716564296358, 'batch_size': 2314, 'optimizer': 'Adam'}.
2026-05-23 04:09:25,404 - experiment_functions - INFO - Early stopping at epoch 600. Best Metrics: (0.09178718918588727, 0.04737704918032787, 0.07889685478902544)
2026-05-23 04:09:25,491 - optuna.study.study - INFO - Trial 264 finished with values: [0.09178718918588727, 0.04737704918032787, 0.07889685478902544] and parameters: {'n_layers': 1, 'embedding_dim': 96, 'lr': 0.0033147733619128938, 'lambda_val': 2.0700677762543618e-06, 'batch_size': 1635, 'optimizer': 'Adam'}.
2026-05-23 04:09:28,474 - experiment_functions - INFO - Early stopping at epoch 700. Best Metrics: (0.08193549513253644, 0.045737704918032786, 0.0695714994182378)
2026-05-23 04:09:28,557 - optuna.study.study - INFO - Trial 265 finished with values: [0.08193549513253644, 0.045737704918032786, 0.0695714994182378] and parameters: {'n_layers': 1, 'embedding_dim': 128, 'lr': 0.0015660906918692206, 'lambda_val': 0.005013716564296358, 'batch_size': 2386, 'optimizer': 'Adam'}.
2026-05-23 04:09:32,690 - experiment_functions - INFO - Early stopping at epoch 1050. Best Metrics: (0.10771283365334126, 0.052868852459016395, 0.08983639111392416)
2026-05-23 04:09:32,855 - optuna.study.study - INFO - Trial 266 finished with values: [0.10771283365334126, 0.052868852459016395, 0.08983639111392416] and parameters: {'n_layers': 1, 'embedding_dim': 128, 'lr': 0.0007420979429767307, 'lambda_val': 2.8437538312167664e-05, 'batch_size': 2314, 'optimizer': 'Adam'}.
2026-05-23 04:09:35,990 - experiment_functions - INFO - Early stopping at epoch 550. Best Metrics: (0.08252488259352249, 0.04213114754098361, 0.06783524246110965)
2026-05-23 04:09:36,122 - optuna.study.study - INFO - Trial 267 finished with values: [0.08252488259352249, 0.04213114754098361, 0.06783524246110965] and parameters: {'n_layers': 1, 'embedding_dim': 128, 'lr': 0.0026219032996952565, 'lambda_val': 6.13505476225876e-05, 'batch_size': 2515, 'optimizer': 'RMSprop'}.
2026-05-23 04:09:39,690 - experiment_functions - INFO - Early stopping at epoch 700. Best Metrics: (0.11636086642532464, 0.05270491803278688, 0.09429469597165713)
2026-05-23 04:09:39,942 - optuna.study.study - INFO - Trial 268 finished with values: [0.11636086642532464, 0.05270491803278688, 0.09429469597165713] and parameters: {'n_layers': 1, 'embedding_dim': 256, 'lr': 0.0016044647069746135, 'lambda_val': 1.1150431230027626e-06, 'batch_size': 3959, 'optimizer': 'Adam'}.
2026-05-23 04:09:52,195 - experiment_functions - INFO - Early stopping at epoch 2700. Best Metrics: (0.09308605321833491, 0.04491803278688524, 0.07857350455141128)
2026-05-23 04:09:53,439 - optuna.study.study - INFO - Trial 269 finished with values: [0.09308605321833491, 0.04491803278688524, 0.07857350455141128] and parameters: {'n_layers': 2, 'embedding_dim': 256, 'lr': 0.00026503485300845536, 'lambda_val': 0.0009750566560695258, 'batch_size': 1170, 'optimizer': 'Adam'}.
2026-05-23 04:09:55,720 - experiment_functions - INFO - Early stopping at epoch 500. Best Metrics: (0.0035461251990998536, 0.0013114754098360656, 0.0020765080322983497)
2026-05-23 04:09:55,851 - optuna.study.study - INFO - Trial 270 finished with values: [0.0035461251990998536, 0.0013114754098360656, 0.0020765080322983497] and parameters: {'n_layers': 1, 'embedding_dim': 128, 'lr': 0.0007420979429767307, 'lambda_val': 2.0700677762543618e-06, 'batch_size': 2933, 'optimizer': 'SGD'}.
2026-05-23 04:10:01,619 - experiment_functions - INFO - Early stopping at epoch 1850. Best Metrics: (0.10816473728735493, 0.05327868852459016, 0.09218527201753053)
2026-05-23 04:10:01,754 - optuna.study.study - INFO - Trial 271 finished with values: [0.10816473728735493, 0.05327868852459016, 0.09218527201753053] and parameters: {'n_layers': 1, 'embedding_dim': 64, 'lr': 0.0005201459519511334, 'lambda_val': 1.660484306084372e-05, 'batch_size': 2589, 'optimizer': 'Adam'}.
2026-05-23 04:10:03,557 - experiment_functions - INFO - Early stopping at epoch 500. Best Metrics: (0.0011623557833950185, 0.0011475409836065574, 0.0011229940491192434)
2026-05-23 04:10:03,648 - optuna.study.study - INFO - Trial 272 finished with values: [0.0011623557833950185, 0.0011475409836065574, 0.0011229940491192434] and parameters: {'n_layers': 1, 'embedding_dim': 32, 'lr': 0.0007420979429767307, 'lambda_val': 0.005013716564296358, 'batch_size': 2933, 'optimizer': 'SGD'}.
2026-05-23 04:10:06,404 - experiment_functions - INFO - Early stopping at epoch 600. Best Metrics: (0.05290481005752339, 0.030000000000000002, 0.04700615863933293)
2026-05-23 04:10:06,492 - optuna.study.study - INFO - Trial 273 finished with values: [0.05290481005752339, 0.030000000000000002, 0.04700615863933293] and parameters: {'n_layers': 2, 'embedding_dim': 64, 'lr': 0.0016044647069746135, 'lambda_val': 1.6693478080315474e-06, 'batch_size': 2515, 'optimizer': 'Adam'}.
2026-05-23 04:10:09,374 - experiment_functions - INFO - Early stopping at epoch 800. Best Metrics: (0.10394720906657089, 0.05032786885245902, 0.08235243316479937)
2026-05-23 04:10:09,469 - optuna.study.study - INFO - Trial 274 finished with values: [0.10394720906657089, 0.05032786885245902, 0.08235243316479937] and parameters: {'n_layers': 1, 'embedding_dim': 32, 'lr': 0.0016044647069746135, 'lambda_val': 2.0700677762543618e-06, 'batch_size': 3317, 'optimizer': 'Adam'}.
2026-05-23 04:10:12,233 - experiment_functions - INFO - Early stopping at epoch 600. Best Metrics: (0.08049637142193931, 0.04434426229508197, 0.07209258534482409)
2026-05-23 04:10:12,322 - optuna.study.study - INFO - Trial 275 finished with values: [0.08049637142193931, 0.04434426229508197, 0.07209258534482409] and parameters: {'n_layers': 1, 'embedding_dim': 256, 'lr': 0.0015660906918692206, 'lambda_val': 0.012856603629435468, 'batch_size': 2386, 'optimizer': 'Adam'}.
2026-05-23 04:10:23,796 - optuna.study.study - INFO - Trial 276 finished with values: [0.07305035979722246, 0.04262295081967213, 0.07169924032629128] and parameters: {'n_layers': 1, 'embedding_dim': 64, 'lr': 0.000233346029650438, 'lambda_val': 2.0700677762543618e-06, 'batch_size': 1170, 'optimizer': 'Adam'}.
2026-05-23 04:10:28,188 - experiment_functions - INFO - Early stopping at epoch 650. Best Metrics: (0.10933507063266759, 0.05114754098360656, 0.08926516191084884)
2026-05-23 04:10:28,507 - optuna.study.study - INFO - Trial 277 finished with values: [0.10933507063266759, 0.05114754098360656, 0.08926516191084884] and parameters: {'n_layers': 1, 'embedding_dim': 256, 'lr': 0.0016044647069746135, 'lambda_val': 2.0700677762543618e-06, 'batch_size': 3317, 'optimizer': 'Adam'}.
2026-05-23 04:10:35,405 - experiment_functions - INFO - Early stopping at epoch 550. Best Metrics: (0.10318301605693073, 0.052295081967213115, 0.08458254609460396)
2026-05-23 04:10:36,697 - optuna.study.study - INFO - Trial 278 finished with values: [0.10318301605693073, 0.052295081967213115, 0.08458254609460396] and parameters: {'n_layers': 1, 'embedding_dim': 96, 'lr': 0.00726893620558119, 'lambda_val': 2.0700677762543618e-06, 'batch_size': 3317, 'optimizer': 'Adam'}.
2026-05-23 04:10:43,168 - experiment_functions - INFO - Early stopping at epoch 850. Best Metrics: (0.1013030931457334, 0.05180327868852459, 0.0852328936006446)
2026-05-23 04:10:43,238 - optuna.study.study - INFO - Trial 279 finished with values: [0.1013030931457334, 0.05180327868852459, 0.0852328936006446] and parameters: {'n_layers': 1, 'embedding_dim': 96, 'lr': 0.0015660906918692206, 'lambda_val': 6.13505476225876e-05, 'batch_size': 2386, 'optimizer': 'Adam'}.
2026-05-23 04:10:45,890 - experiment_functions - INFO - Early stopping at epoch 600. Best Metrics: (0.09134349088128593, 0.04762295081967213, 0.07513032737646214)
2026-05-23 04:10:46,054 - optuna.study.study - INFO - Trial 280 finished with values: [0.09134349088128593, 0.04762295081967213, 0.07513032737646214] and parameters: {'n_layers': 1, 'embedding_dim': 32, 'lr': 0.0033147733619128938, 'lambda_val': 5.018701389508482e-06, 'batch_size': 2670, 'optimizer': 'Adam'}.
2026-05-23 04:10:48,451 - experiment_functions - INFO - Early stopping at epoch 600. Best Metrics: (0.04240463634846871, 0.02319672131147541, 0.035727717094561136)
2026-05-23 04:10:48,564 - optuna.study.study - INFO - Trial 281 finished with values: [0.04240463634846871, 0.02319672131147541, 0.035727717094561136] and parameters: {'n_layers': 1, 'embedding_dim': 32, 'lr': 0.010391718902979885, 'lambda_val': 0.0017795542900466829, 'batch_size': 2118, 'optimizer': 'RMSprop'}.
2026-05-23 04:10:53,189 - experiment_functions - INFO - Early stopping at epoch 1150. Best Metrics: (0.10243770876727087, 0.052786885245901645, 0.0905756846021557)
2026-05-23 04:10:53,571 - optuna.study.study - INFO - Trial 282 finished with values: [0.10243770876727087, 0.052786885245901645, 0.0905756846021557] and parameters: {'n_layers': 1, 'embedding_dim': 128, 'lr': 0.0005201459519511334, 'lambda_val': 0.005013716564296358, 'batch_size': 2386, 'optimizer': 'Adam'}.
2026-05-23 04:10:59,272 - experiment_functions - INFO - Early stopping at epoch 1350. Best Metrics: (0.11270901153758615, 0.05606557377049181, 0.09848817419369708)
2026-05-23 04:10:59,386 - optuna.study.study - INFO - Trial 283 finished with values: [0.11270901153758615, 0.05606557377049181, 0.09848817419369708] and parameters: {'n_layers': 1, 'embedding_dim': 256, 'lr': 0.0005201459519511334, 'lambda_val': 6.13505476225876e-05, 'batch_size': 1584, 'optimizer': 'Adam'}.
2026-05-23 04:11:16,863 - optuna.study.study - INFO - Trial 284 finished with values: [0.03943155652979892, 0.022295081967213116, 0.03353204171685967] and parameters: {'n_layers': 4, 'embedding_dim': 64, 'lr': 0.0001811079364118203, 'lambda_val': 6.13505476225876e-05, 'batch_size': 2386, 'optimizer': 'Adam'}.
2026-05-23 04:11:22,277 - experiment_functions - INFO - Early stopping at epoch 1300. Best Metrics: (0.11543250692413184, 0.05467213114754097, 0.09643748888807031)
2026-05-23 04:11:22,372 - optuna.study.study - INFO - Trial 285 finished with values: [0.11543250692413184, 0.05467213114754097, 0.09643748888807031] and parameters: {'n_layers': 1, 'embedding_dim': 256, 'lr': 0.0005025722918895278, 'lambda_val': 6.13505476225876e-05, 'batch_size': 1584, 'optimizer': 'RMSprop'}.
2026-05-23 04:11:35,175 - optuna.study.study - INFO - Trial 286 finished with values: [0.0769494141337345, 0.0430327868852459, 0.06216109656093743] and parameters: {'n_layers': 1, 'embedding_dim': 64, 'lr': 0.000233346029650438, 'lambda_val': 8.173822349987447e-05, 'batch_size': 3317, 'optimizer': 'RMSprop'}.
2026-05-23 04:11:47,614 - optuna.study.study - INFO - Trial 287 finished with values: [0.03159622573811065, 0.019262295081967213, 0.02865250797151099] and parameters: {'n_layers': 1, 'embedding_dim': 128, 'lr': 9.265846139669187e-05, 'lambda_val': 6.13505476225876e-05, 'batch_size': 2670, 'optimizer': 'Adam'}.
2026-05-23 04:11:51,847 - experiment_functions - INFO - Early stopping at epoch 1350. Best Metrics: (0.09457547058161564, 0.04967213114754098, 0.08045760200469174)
2026-05-23 04:11:51,941 - optuna.study.study - INFO - Trial 288 finished with values: [0.09457547058161564, 0.04967213114754098, 0.08045760200469174] and parameters: {'n_layers': 1, 'embedding_dim': 64, 'lr': 0.0005201459519511334, 'lambda_val': 0.005781626840745942, 'batch_size': 2515, 'optimizer': 'Adam'}.
2026-05-23 04:11:55,527 - experiment_functions - INFO - Early stopping at epoch 1050. Best Metrics: (0.09564766126968369, 0.047540983606557376, 0.07943882083463497)
2026-05-23 04:11:56,367 - optuna.study.study - INFO - Trial 289 finished with values: [0.09564766126968369, 0.047540983606557376, 0.07943882083463497] and parameters: {'n_layers': 1, 'embedding_dim': 64, 'lr': 0.0016044647069746135, 'lambda_val': 1.6693478080315474e-06, 'batch_size': 1529, 'optimizer': 'Adam'}.
2026-05-23 04:12:00,143 - experiment_functions - INFO - Early stopping at epoch 1300. Best Metrics: (0.08562906559625086, 0.04770491803278689, 0.07285460232365085)
2026-05-23 04:12:00,365 - optuna.study.study - INFO - Trial 290 finished with values: [0.08562906559625086, 0.04770491803278689, 0.07285460232365085] and parameters: {'n_layers': 1, 'embedding_dim': 32, 'lr': 0.0007420979429767307, 'lambda_val': 0.005013716564296358, 'batch_size': 1621, 'optimizer': 'Adam'}.
2026-05-23 04:12:04,891 - experiment_functions - INFO - Early stopping at epoch 1400. Best Metrics: (0.11548224364112177, 0.05581967213114754, 0.09183210970303955)
2026-05-23 04:12:05,464 - optuna.study.study - INFO - Trial 291 finished with values: [0.11548224364112177, 0.05581967213114754, 0.09183210970303955] and parameters: {'n_layers': 1, 'embedding_dim': 64, 'lr': 0.0005025722918895278, 'lambda_val': 6.13505476225876e-05, 'batch_size': 3317, 'optimizer': 'RMSprop'}.
2026-05-23 04:12:13,487 - experiment_functions - INFO - Early stopping at epoch 500. Best Metrics: (0.004160133800675139, 0.002622950819672131, 0.0037204496535528206)
2026-05-23 04:12:14,035 - optuna.study.study - INFO - Trial 292 finished with values: [0.004160133800675139, 0.002622950819672131, 0.0037204496535528206] and parameters: {'n_layers': 1, 'embedding_dim': 96, 'lr': 0.0007025971423340902, 'lambda_val': 1.6693478080315474e-06, 'batch_size': 2376, 'optimizer': 'SGD'}.
2026-05-23 04:12:22,155 - experiment_functions - INFO - Early stopping at epoch 750. Best Metrics: (0.05751397178953229, 0.02688524590163934, 0.046160781379890006)
2026-05-23 04:12:22,551 - optuna.study.study - INFO - Trial 293 finished with values: [0.05751397178953229, 0.02688524590163934, 0.046160781379890006] and parameters: {'n_layers': 1, 'embedding_dim': 256, 'lr': 0.00726893620558119, 'lambda_val': 1.8084571105268367e-05, 'batch_size': 2670, 'optimizer': 'RMSprop'}.
2026-05-23 04:12:25,288 - experiment_functions - INFO - Early stopping at epoch 550. Best Metrics: (0.10593293663514468, 0.05204918032786885, 0.08491045775523742)
2026-05-23 04:12:25,375 - optuna.study.study - INFO - Trial 294 finished with values: [0.10593293663514468, 0.05204918032786885, 0.08491045775523742] and parameters: {'n_layers': 1, 'embedding_dim': 96, 'lr': 0.004718798316204746, 'lambda_val': 0.005013716564296358, 'batch_size': 2933, 'optimizer': 'Adam'}.
2026-05-23 04:12:29,320 - experiment_functions - INFO - Early stopping at epoch 550. Best Metrics: (0.038272471636155034, 0.018934426229508198, 0.02907215587468815)
2026-05-23 04:12:29,735 - optuna.study.study - INFO - Trial 295 finished with values: [0.038272471636155034, 0.018934426229508198, 0.02907215587468815] and parameters: {'n_layers': 2, 'embedding_dim': 256, 'lr': 0.0033147733619128938, 'lambda_val': 2.0700677762543618e-06, 'batch_size': 2670, 'optimizer': 'RMSprop'}.
2026-05-23 04:12:36,919 - experiment_functions - INFO - Early stopping at epoch 1750. Best Metrics: (0.0587429884126758, 0.039016393442622956, 0.05298690306533231)
2026-05-23 04:12:37,050 - optuna.study.study - INFO - Trial 296 finished with values: [0.0587429884126758, 0.039016393442622956, 0.05298690306533231] and parameters: {'n_layers': 1, 'embedding_dim': 256, 'lr': 0.000233346029650438, 'lambda_val': 0.02250157426048354, 'batch_size': 2145, 'optimizer': 'Adam'}.
2026-05-23 04:12:40,407 - experiment_functions - INFO - Early stopping at epoch 750. Best Metrics: (0.10960424777312233, 0.05024590163934426, 0.08303294890974457)
2026-05-23 04:12:40,971 - optuna.study.study - INFO - Trial 297 finished with values: [0.10960424777312233, 0.05024590163934426, 0.08303294890974457] and parameters: {'n_layers': 1, 'embedding_dim': 128, 'lr': 0.0016044647069746135, 'lambda_val': 2.0700677762543618e-06, 'batch_size': 1815, 'optimizer': 'Adam'}.
2026-05-23 04:12:51,907 - experiment_functions - INFO - Early stopping at epoch 2800. Best Metrics: (0.1175784723698566, 0.05598360655737706, 0.09437488768884209)
2026-05-23 04:12:52,833 - optuna.study.study - INFO - Trial 298 finished with values: [0.1175784723698566, 0.05598360655737706, 0.09437488768884209] and parameters: {'n_layers': 1, 'embedding_dim': 256, 'lr': 0.0005201459519511334, 'lambda_val': 1.8084571105268367e-05, 'batch_size': 583, 'optimizer': 'Adam'}.
2026-05-23 04:12:57,553 - experiment_functions - INFO - Early stopping at epoch 1050. Best Metrics: (0.05591170772611789, 0.028606557377049185, 0.045053539786112734)
2026-05-23 04:12:57,699 - optuna.study.study - INFO - Trial 299 finished with values: [0.05591170772611789, 0.028606557377049185, 0.045053539786112734] and parameters: {'n_layers': 1, 'embedding_dim': 256, 'lr': 0.00726893620558119, 'lambda_val': 6.13505476225876e-05, 'batch_size': 1584, 'optimizer': 'RMSprop'}.
2026-05-23 04:12:57,714 - root - INFO - Selected Trial 243 based on Max NDCG: 0.1001
2026-05-23 04:12:57,714 - root - INFO - Associated Recall: 0.1205
2026-05-23 04:12:57,714 - experiment_functions - INFO - Training the best model ... for e_100K_1c1dcs_rand2
2026-05-23 04:13:02,458 - experiment_functions - INFO - Early stopping at epoch 1250. Best Metrics: (0.12386617691333539, 0.0548360655737705, 0.09765884924849418)
2026-05-23 04:13:02,568 - root - INFO -   **** Training e_100K_1c1dcs_rand3
2026-05-23 04:13:02,586 - root - INFO -   **** Getting 65267/81200 random edges
2026-05-23 04:13:02,947 - optuna.storages._rdb.storage - INFO - A new study created in RDB with name: Study_e_100K_1c1dcs_rand3
2026-05-23 04:13:05,529 - experiment_functions - INFO - Early stopping at epoch 500. Best Metrics: (0.002777884587302285, 0.0013114754098360656, 0.0023836270359431774)
2026-05-23 04:13:05,616 - optuna.study.study - INFO - Trial 0 finished with values: [0.002777884587302285, 0.0013114754098360656, 0.0023836270359431774] and parameters: {'n_layers': 2, 'embedding_dim': 128, 'lr': 0.02705293246389281, 'lambda_val': 0.041537423812262476, 'batch_size': 2932, 'optimizer': 'SGD'}.
2026-05-23 04:13:09,293 - experiment_functions - INFO - Early stopping at epoch 750. Best Metrics: (0.028062688006867842, 0.018114754098360657, 0.02431239365134574)
2026-05-23 04:13:09,368 - optuna.study.study - INFO - Trial 1 finished with values: [0.028062688006867842, 0.018114754098360657, 0.02431239365134574] and parameters: {'n_layers': 4, 'embedding_dim': 64, 'lr': 0.0005216893769116646, 'lambda_val': 0.014740079559979705, 'batch_size': 601, 'optimizer': 'RMSprop'}.
2026-05-23 04:13:12,923 - experiment_functions - INFO - Early stopping at epoch 500. Best Metrics: (0.0019245900418798554, 0.0014754098360655738, 0.0019700735790314596)
