2026-05-23 00:32:13,624 - optuna.study.study - INFO - Trial 159 finished with values: [0.0295486197221393, 0.019590163934426228, 0.027717826735823663] and parameters: {'n_layers': 2, 'embedding_dim': 96, 'lr': 0.00022079369433681775, 'lambda_val': 0.007327352195130867, 'batch_size': 2834, 'optimizer': 'RMSprop'}.
2026-05-23 00:32:16,425 - experiment_functions - INFO - Early stopping at epoch 650. Best Metrics: (0.02401082581150847, 0.015163934426229509, 0.020435967488198738)
2026-05-23 00:32:16,528 - optuna.study.study - INFO - Trial 160 finished with values: [0.02401082581150847, 0.015163934426229509, 0.020435967488198738] and parameters: {'n_layers': 3, 'embedding_dim': 96, 'lr': 0.0011286476195635738, 'lambda_val': 2.7537109132117532e-06, 'batch_size': 2834, 'optimizer': 'Adam'}.
2026-05-23 00:32:19,832 - experiment_functions - INFO - Early stopping at epoch 800. Best Metrics: (0.030820483656590684, 0.01836065573770492, 0.027031634120547664)
2026-05-23 00:32:20,719 - optuna.study.study - INFO - Trial 161 finished with values: [0.030820483656590684, 0.01836065573770492, 0.027031634120547664] and parameters: {'n_layers': 1, 'embedding_dim': 256, 'lr': 0.0013882664669042468, 'lambda_val': 2.0395641111336252e-06, 'batch_size': 2778, 'optimizer': 'Adam'}.
2026-05-23 00:32:26,780 - experiment_functions - INFO - Early stopping at epoch 1600. Best Metrics: (0.025825769580224516, 0.016311475409836063, 0.02320425217163025)
2026-05-23 00:32:26,889 - optuna.study.study - INFO - Trial 162 finished with values: [0.025825769580224516, 0.016311475409836063, 0.02320425217163025] and parameters: {'n_layers': 2, 'embedding_dim': 256, 'lr': 0.00029826529867114525, 'lambda_val': 0.0030204840190239295, 'batch_size': 1369, 'optimizer': 'Adam'}.
2026-05-23 00:32:38,583 - experiment_functions - INFO - Early stopping at epoch 3850. Best Metrics: (0.03247061459121422, 0.01778688524590164, 0.027642459499034183)
2026-05-23 00:32:38,716 - optuna.study.study - INFO - Trial 163 finished with values: [0.03247061459121422, 0.01778688524590164, 0.027642459499034183] and parameters: {'n_layers': 2, 'embedding_dim': 96, 'lr': 0.00022079369433681775, 'lambda_val': 0.00551038486085562, 'batch_size': 2834, 'optimizer': 'RMSprop'}.
2026-05-23 00:32:41,547 - experiment_functions - INFO - Early stopping at epoch 750. Best Metrics: (0.010471854500203584, 0.006147540983606557, 0.00972944653078084)
2026-05-23 00:32:41,870 - optuna.study.study - INFO - Trial 164 finished with values: [0.010471854500203584, 0.006147540983606557, 0.00972944653078084] and parameters: {'n_layers': 2, 'embedding_dim': 96, 'lr': 0.050608160639514184, 'lambda_val': 0.001981990620864252, 'batch_size': 984, 'optimizer': 'RMSprop'}.
2026-05-23 00:32:45,988 - experiment_functions - INFO - Early stopping at epoch 550. Best Metrics: (0.011079463960816547, 0.00778688524590164, 0.010650273968071796)
2026-05-23 00:32:46,782 - optuna.study.study - INFO - Trial 165 finished with values: [0.011079463960816547, 0.00778688524590164, 0.010650273968071796] and parameters: {'n_layers': 2, 'embedding_dim': 64, 'lr': 0.06588173255432893, 'lambda_val': 6.4060906691487274e-06, 'batch_size': 1735, 'optimizer': 'Adam'}.
2026-05-23 00:33:01,105 - experiment_functions - INFO - Early stopping at epoch 3000. Best Metrics: (0.04168046334203433, 0.02139344262295082, 0.033780571513250486)
2026-05-23 00:33:01,722 - optuna.study.study - INFO - Trial 166 finished with values: [0.04168046334203433, 0.02139344262295082, 0.033780571513250486] and parameters: {'n_layers': 2, 'embedding_dim': 96, 'lr': 0.00022079369433681775, 'lambda_val': 0.00551038486085562, 'batch_size': 1675, 'optimizer': 'RMSprop'}.
2026-05-23 00:33:04,227 - experiment_functions - INFO - Early stopping at epoch 650. Best Metrics: (0.027508833059028733, 0.01762295081967213, 0.026358057266974117)
2026-05-23 00:33:04,367 - optuna.study.study - INFO - Trial 167 finished with values: [0.027508833059028733, 0.01762295081967213, 0.026358057266974117] and parameters: {'n_layers': 1, 'embedding_dim': 32, 'lr': 0.005832819514590744, 'lambda_val': 8.819162328566226e-05, 'batch_size': 843, 'optimizer': 'Adam'}.
2026-05-23 00:33:06,749 - experiment_functions - INFO - Early stopping at epoch 600. Best Metrics: (0.024283235539929195, 0.014918032786885247, 0.020796211667004162)
2026-05-23 00:33:06,874 - optuna.study.study - INFO - Trial 168 finished with values: [0.024283235539929195, 0.014918032786885247, 0.020796211667004162] and parameters: {'n_layers': 1, 'embedding_dim': 96, 'lr': 0.00825106800832782, 'lambda_val': 0.0002603879699437796, 'batch_size': 2231, 'optimizer': 'Adam'}.
2026-05-23 00:33:10,082 - experiment_functions - INFO - Early stopping at epoch 900. Best Metrics: (0.03162504687979671, 0.018278688524590164, 0.026569803481073465)
2026-05-23 00:33:10,177 - optuna.study.study - INFO - Trial 169 finished with values: [0.03162504687979671, 0.018278688524590164, 0.026569803481073465] and parameters: {'n_layers': 2, 'embedding_dim': 32, 'lr': 0.0009422878098805214, 'lambda_val': 0.0012845303849127949, 'batch_size': 987, 'optimizer': 'RMSprop'}.
2026-05-23 00:33:20,476 - experiment_functions - INFO - Early stopping at epoch 3500. Best Metrics: (0.03446260980214638, 0.01918032786885246, 0.027511916670863397)
2026-05-23 00:33:21,578 - optuna.study.study - INFO - Trial 170 finished with values: [0.03446260980214638, 0.01918032786885246, 0.027511916670863397] and parameters: {'n_layers': 2, 'embedding_dim': 96, 'lr': 0.00022079369433681775, 'lambda_val': 0.00551038486085562, 'batch_size': 1833, 'optimizer': 'RMSprop'}.
2026-05-23 00:33:23,962 - experiment_functions - INFO - Early stopping at epoch 550. Best Metrics: (0.006989120164730937, 0.007049180327868854, 0.00822667866702714)
2026-05-23 00:33:24,050 - optuna.study.study - INFO - Trial 171 finished with values: [0.006989120164730937, 0.007049180327868854, 0.00822667866702714] and parameters: {'n_layers': 2, 'embedding_dim': 64, 'lr': 0.0016072373570504854, 'lambda_val': 0.08746768738490818, 'batch_size': 4039, 'optimizer': 'RMSprop'}.
2026-05-23 00:33:30,177 - experiment_functions - INFO - Early stopping at epoch 1850. Best Metrics: (0.03544332968071164, 0.017049180327868854, 0.028875955973270747)
2026-05-23 00:33:30,725 - optuna.study.study - INFO - Trial 172 finished with values: [0.03544332968071164, 0.017049180327868854, 0.028875955973270747] and parameters: {'n_layers': 2, 'embedding_dim': 96, 'lr': 0.0003645259243247324, 'lambda_val': 0.000258841521491552, 'batch_size': 2343, 'optimizer': 'Adam'}.
2026-05-23 00:33:34,880 - experiment_functions - INFO - Early stopping at epoch 1150. Best Metrics: (0.035353114475075796, 0.020245901639344265, 0.030980200309923066)
2026-05-23 00:33:35,653 - optuna.study.study - INFO - Trial 173 finished with values: [0.035353114475075796, 0.020245901639344265, 0.030980200309923066] and parameters: {'n_layers': 2, 'embedding_dim': 128, 'lr': 0.0003566717415961628, 'lambda_val': 0.00011624026828970741, 'batch_size': 3264, 'optimizer': 'RMSprop'}.
2026-05-23 00:33:38,638 - experiment_functions - INFO - Early stopping at epoch 750. Best Metrics: (0.030145163269619416, 0.016967213114754097, 0.02606831568931079)
2026-05-23 00:33:38,784 - optuna.study.study - INFO - Trial 174 finished with values: [0.030145163269619416, 0.016967213114754097, 0.02606831568931079] and parameters: {'n_layers': 3, 'embedding_dim': 64, 'lr': 0.0011286476195635738, 'lambda_val': 0.00011624026828970741, 'batch_size': 1369, 'optimizer': 'Adam'}.
2026-05-23 00:33:46,748 - experiment_functions - INFO - Early stopping at epoch 650. Best Metrics: (0.03213190356880204, 0.01819672131147541, 0.029567269151810766)
2026-05-23 00:33:47,233 - optuna.study.study - INFO - Trial 175 finished with values: [0.03213190356880204, 0.01819672131147541, 0.029567269151810766] and parameters: {'n_layers': 1, 'embedding_dim': 64, 'lr': 0.0016072373570504854, 'lambda_val': 8.440860485092967e-06, 'batch_size': 4039, 'optimizer': 'RMSprop'}.
2026-05-23 00:33:54,313 - experiment_functions - INFO - Early stopping at epoch 600. Best Metrics: (0.02711650923626419, 0.01557377049180328, 0.024610505376882034)
2026-05-23 00:33:54,402 - optuna.study.study - INFO - Trial 176 finished with values: [0.02711650923626419, 0.01557377049180328, 0.024610505376882034] and parameters: {'n_layers': 2, 'embedding_dim': 128, 'lr': 0.0022902309759455907, 'lambda_val': 0.00011624026828970741, 'batch_size': 2430, 'optimizer': 'Adam'}.
2026-05-23 00:33:57,260 - experiment_functions - INFO - Early stopping at epoch 800. Best Metrics: (0.0039180248506915675, 0.002295081967213115, 0.0028630857769273406)
2026-05-23 00:33:58,053 - optuna.study.study - INFO - Trial 177 finished with values: [0.0039180248506915675, 0.002295081967213115, 0.0028630857769273406] and parameters: {'n_layers': 1, 'embedding_dim': 96, 'lr': 1.459953375745048e-05, 'lambda_val': 0.00011624026828970741, 'batch_size': 987, 'optimizer': 'Adam'}.
2026-05-23 00:34:07,988 - experiment_functions - INFO - Early stopping at epoch 3550. Best Metrics: (0.007535370642051079, 0.005491803278688525, 0.007904006564147671)
2026-05-23 00:34:08,126 - optuna.study.study - INFO - Trial 178 finished with values: [0.007535370642051079, 0.005491803278688525, 0.007904006564147671] and parameters: {'n_layers': 2, 'embedding_dim': 32, 'lr': 0.00010968199108550004, 'lambda_val': 0.004024707386158114, 'batch_size': 987, 'optimizer': 'Adam'}.
2026-05-23 00:34:18,045 - experiment_functions - INFO - Early stopping at epoch 3350. Best Metrics: (0.031209600974484816, 0.01852459016393443, 0.028179118247135145)
2026-05-23 00:34:18,461 - optuna.study.study - INFO - Trial 179 finished with values: [0.031209600974484816, 0.01852459016393443, 0.028179118247135145] and parameters: {'n_layers': 1, 'embedding_dim': 96, 'lr': 0.0003566717415961628, 'lambda_val': 0.00011624026828970741, 'batch_size': 3041, 'optimizer': 'Adam'}.
2026-05-23 00:34:21,010 - experiment_functions - INFO - Early stopping at epoch 700. Best Metrics: (0.03190900435781392, 0.019098360655737702, 0.02874758284049063)
2026-05-23 00:34:21,100 - optuna.study.study - INFO - Trial 180 finished with values: [0.03190900435781392, 0.019098360655737702, 0.02874758284049063] and parameters: {'n_layers': 1, 'embedding_dim': 64, 'lr': 0.0016072373570504854, 'lambda_val': 0.00551038486085562, 'batch_size': 1457, 'optimizer': 'RMSprop'}.
2026-05-23 00:34:30,065 - experiment_functions - INFO - Early stopping at epoch 2800. Best Metrics: (0.030722535289168, 0.019098360655737705, 0.02600279644884488)
2026-05-23 00:34:30,537 - optuna.study.study - INFO - Trial 181 finished with values: [0.030722535289168, 0.019098360655737705, 0.02600279644884488] and parameters: {'n_layers': 1, 'embedding_dim': 256, 'lr': 0.0003566717415961628, 'lambda_val': 0.001981990620864252, 'batch_size': 1457, 'optimizer': 'Adam'}.
2026-05-23 00:34:32,867 - experiment_functions - INFO - Early stopping at epoch 500. Best Metrics: (0.0020966453625128507, 0.0009836065573770494, 0.0015366793697752061)
2026-05-23 00:34:32,951 - optuna.study.study - INFO - Trial 182 finished with values: [0.0020966453625128507, 0.0009836065573770494, 0.0015366793697752061] and parameters: {'n_layers': 4, 'embedding_dim': 64, 'lr': 0.0013882664669042468, 'lambda_val': 0.0002603879699437796, 'batch_size': 2552, 'optimizer': 'SGD'}.
2026-05-23 00:34:44,258 - optuna.study.study - INFO - Trial 183 finished with values: [0.03192507477676327, 0.018934426229508198, 0.029297745982017055] and parameters: {'n_layers': 1, 'embedding_dim': 96, 'lr': 0.0003566717415961628, 'lambda_val': 4.416597544825473e-05, 'batch_size': 1369, 'optimizer': 'RMSprop'}.
2026-05-23 00:34:46,758 - experiment_functions - INFO - Early stopping at epoch 550. Best Metrics: (0.02688712789382022, 0.015573770491803281, 0.02361274362003097)
2026-05-23 00:34:46,848 - optuna.study.study - INFO - Trial 184 finished with values: [0.02688712789382022, 0.015573770491803281, 0.02361274362003097] and parameters: {'n_layers': 3, 'embedding_dim': 96, 'lr': 0.005832819514590744, 'lambda_val': 8.819162328566226e-05, 'batch_size': 2834, 'optimizer': 'Adam'}.
2026-05-23 00:34:49,092 - experiment_functions - INFO - Early stopping at epoch 550. Best Metrics: (0.02370706979191608, 0.015163934426229509, 0.020831553932124155)
2026-05-23 00:34:49,183 - optuna.study.study - INFO - Trial 185 finished with values: [0.02370706979191608, 0.015163934426229509, 0.020831553932124155] and parameters: {'n_layers': 1, 'embedding_dim': 96, 'lr': 0.018510298087666868, 'lambda_val': 0.00551038486085562, 'batch_size': 1369, 'optimizer': 'Adam'}.
2026-05-23 00:35:00,811 - optuna.study.study - INFO - Trial 186 finished with values: [0.02349035094727039, 0.01459016393442623, 0.02238459677040851] and parameters: {'n_layers': 1, 'embedding_dim': 64, 'lr': 0.0002242398424095658, 'lambda_val': 5.790863900505623e-06, 'batch_size': 2778, 'optimizer': 'Adam'}.
2026-05-23 00:35:06,379 - experiment_functions - INFO - Early stopping at epoch 1350. Best Metrics: (0.029351349245152227, 0.018360655737704918, 0.027322181873561124)
2026-05-23 00:35:07,039 - optuna.study.study - INFO - Trial 187 finished with values: [0.029351349245152227, 0.018360655737704918, 0.027322181873561124] and parameters: {'n_layers': 2, 'embedding_dim': 256, 'lr': 0.00029826529867114525, 'lambda_val': 2.9099669967589168e-06, 'batch_size': 3695, 'optimizer': 'Adam'}.
2026-05-23 00:35:09,445 - experiment_functions - INFO - Early stopping at epoch 550. Best Metrics: (0.01164094368541524, 0.007622950819672132, 0.01007378418617569)
2026-05-23 00:35:09,540 - optuna.study.study - INFO - Trial 188 finished with values: [0.01164094368541524, 0.007622950819672132, 0.01007378418617569] and parameters: {'n_layers': 2, 'embedding_dim': 96, 'lr': 0.006215487236112131, 'lambda_val': 0.00551038486085562, 'batch_size': 2834, 'optimizer': 'RMSprop'}.
2026-05-23 00:35:20,857 - optuna.study.study - INFO - Trial 189 finished with values: [0.03361934618971162, 0.01901639344262295, 0.030664141821966008] and parameters: {'n_layers': 2, 'embedding_dim': 32, 'lr': 0.0003566717415961628, 'lambda_val': 0.0016955781212138713, 'batch_size': 987, 'optimizer': 'Adam'}.
2026-05-23 00:35:25,068 - experiment_functions - INFO - Early stopping at epoch 1000. Best Metrics: (0.012649874655821262, 0.008032786885245903, 0.010958170150240544)
2026-05-23 00:35:26,133 - optuna.study.study - INFO - Trial 190 finished with values: [0.012649874655821262, 0.008032786885245903, 0.010958170150240544] and parameters: {'n_layers': 2, 'embedding_dim': 256, 'lr': 0.0516270294381269, 'lambda_val': 0.001981990620864252, 'batch_size': 3148, 'optimizer': 'RMSprop'}.
2026-05-23 00:35:28,450 - experiment_functions - INFO - Early stopping at epoch 550. Best Metrics: (0.03027345979602521, 0.01581967213114754, 0.024008164989878962)
2026-05-23 00:35:28,546 - optuna.study.study - INFO - Trial 191 finished with values: [0.03027345979602521, 0.01581967213114754, 0.024008164989878962] and parameters: {'n_layers': 4, 'embedding_dim': 96, 'lr': 0.0014120698261668326, 'lambda_val': 0.0002603879699437796, 'batch_size': 2834, 'optimizer': 'RMSprop'}.
2026-05-23 00:35:37,553 - optuna.study.study - INFO - Trial 192 finished with values: [0.027180094080337915, 0.015983606557377048, 0.023026378470740752] and parameters: {'n_layers': 2, 'embedding_dim': 64, 'lr': 0.00022079369433681775, 'lambda_val': 0.00551038486085562, 'batch_size': 1675, 'optimizer': 'RMSprop'}.
2026-05-23 00:35:40,692 - experiment_functions - INFO - Early stopping at epoch 650. Best Metrics: (0.027845746723015697, 0.01655737704918033, 0.02505658279722122)
2026-05-23 00:35:40,774 - optuna.study.study - INFO - Trial 193 finished with values: [0.027845746723015697, 0.01655737704918033, 0.02505658279722122] and parameters: {'n_layers': 3, 'embedding_dim': 256, 'lr': 0.0009422878098805214, 'lambda_val': 0.001981990620864252, 'batch_size': 3107, 'optimizer': 'Adam'}.
2026-05-23 00:35:45,512 - experiment_functions - INFO - Early stopping at epoch 1950. Best Metrics: (0.037380906389831846, 0.019836065573770493, 0.03318756076394814)
2026-05-23 00:35:46,305 - optuna.study.study - INFO - Trial 194 finished with values: [0.037380906389831846, 0.019836065573770493, 0.03318756076394814] and parameters: {'n_layers': 1, 'embedding_dim': 96, 'lr': 0.0003566717415961628, 'lambda_val': 0.006734268474296521, 'batch_size': 1541, 'optimizer': 'RMSprop'}.
2026-05-23 00:35:56,135 - optuna.study.study - INFO - Trial 195 finished with values: [0.030659018867721034, 0.01762295081967213, 0.029275814806476938] and parameters: {'n_layers': 2, 'embedding_dim': 64, 'lr': 0.00022079369433681775, 'lambda_val': 5.790863900505623e-06, 'batch_size': 2834, 'optimizer': 'RMSprop'}.
2026-05-23 00:36:07,551 - optuna.study.study - INFO - Trial 196 finished with values: [0.027972692540615778, 0.016311475409836067, 0.02402586025368806] and parameters: {'n_layers': 1, 'embedding_dim': 128, 'lr': 0.00022079369433681775, 'lambda_val': 5.790863900505623e-06, 'batch_size': 2834, 'optimizer': 'RMSprop'}.
2026-05-23 00:36:18,300 - optuna.study.study - INFO - Trial 197 finished with values: [0.029850370069937317, 0.016721311475409836, 0.024710884617083588] and parameters: {'n_layers': 1, 'embedding_dim': 64, 'lr': 0.0003566717415961628, 'lambda_val': 1.7207712053457044e-06, 'batch_size': 984, 'optimizer': 'RMSprop'}.
2026-05-23 00:36:20,679 - experiment_functions - INFO - Early stopping at epoch 550. Best Metrics: (0.0008243148319310368, 0.0011475409836065576, 0.0012048713837855159)
2026-05-23 00:36:20,772 - optuna.study.study - INFO - Trial 198 finished with values: [0.0008243148319310368, 0.0011475409836065576, 0.0012048713837855159] and parameters: {'n_layers': 2, 'embedding_dim': 256, 'lr': 0.04137730972673825, 'lambda_val': 0.0021335803209076563, 'batch_size': 2834, 'optimizer': 'SGD'}.
2026-05-23 00:36:24,332 - experiment_functions - INFO - Early stopping at epoch 900. Best Metrics: (0.03330372589905393, 0.02040983606557377, 0.030224241358638864)
2026-05-23 00:36:24,649 - optuna.study.study - INFO - Trial 199 finished with values: [0.03330372589905393, 0.02040983606557377, 0.030224241358638864] and parameters: {'n_layers': 2, 'embedding_dim': 256, 'lr': 0.0005513489459732522, 'lambda_val': 0.001981990620864252, 'batch_size': 1603, 'optimizer': 'Adam'}.
2026-05-23 00:36:26,953 - experiment_functions - INFO - Early stopping at epoch 700. Best Metrics: (0.03379355584016013, 0.018688524590163937, 0.026283674816599583)
2026-05-23 00:36:27,053 - optuna.study.study - INFO - Trial 200 finished with values: [0.03379355584016013, 0.018688524590163937, 0.026283674816599583] and parameters: {'n_layers': 1, 'embedding_dim': 64, 'lr': 0.0029335455314602995, 'lambda_val': 0.00011624026828970741, 'batch_size': 1833, 'optimizer': 'Adam'}.
2026-05-23 00:36:29,985 - experiment_functions - INFO - Early stopping at epoch 650. Best Metrics: (0.035789160576821175, 0.019344262295081967, 0.029250414364090566)
2026-05-23 00:36:30,117 - optuna.study.study - INFO - Trial 201 finished with values: [0.035789160576821175, 0.019344262295081967, 0.029250414364090566] and parameters: {'n_layers': 2, 'embedding_dim': 256, 'lr': 0.00148933003205761, 'lambda_val': 0.00011624026828970741, 'batch_size': 3041, 'optimizer': 'Adam'}.
2026-05-23 00:36:33,836 - experiment_functions - INFO - Early stopping at epoch 900. Best Metrics: (0.03219924789317675, 0.018934426229508198, 0.02876396323508856)
2026-05-23 00:36:33,922 - optuna.study.study - INFO - Trial 202 finished with values: [0.03219924789317675, 0.018934426229508198, 0.02876396323508856] and parameters: {'n_layers': 2, 'embedding_dim': 256, 'lr': 0.0005513489459732522, 'lambda_val': 0.001981990620864252, 'batch_size': 2834, 'optimizer': 'Adam'}.
2026-05-23 00:36:39,534 - experiment_functions - INFO - Early stopping at epoch 2050. Best Metrics: (0.03452558506771152, 0.01778688524590164, 0.02879811301315038)
2026-05-23 00:36:39,909 - optuna.study.study - INFO - Trial 203 finished with values: [0.03452558506771152, 0.01778688524590164, 0.02879811301315038] and parameters: {'n_layers': 2, 'embedding_dim': 96, 'lr': 0.00022079369433681775, 'lambda_val': 0.00551038486085562, 'batch_size': 2834, 'optimizer': 'Adam'}.
2026-05-23 00:36:47,689 - experiment_functions - INFO - Early stopping at epoch 3000. Best Metrics: (0.030744957234315078, 0.018278688524590164, 0.027579690510420574)
2026-05-23 00:36:47,777 - optuna.study.study - INFO - Trial 204 finished with values: [0.030744957234315078, 0.018278688524590164, 0.027579690510420574] and parameters: {'n_layers': 2, 'embedding_dim': 64, 'lr': 0.00030576438444748696, 'lambda_val': 1.7207712053457044e-06, 'batch_size': 1457, 'optimizer': 'RMSprop'}.
2026-05-23 00:36:51,223 - experiment_functions - INFO - Early stopping at epoch 900. Best Metrics: (0.03020158559397162, 0.01680327868852459, 0.026744313936917175)
2026-05-23 00:36:51,317 - optuna.study.study - INFO - Trial 205 finished with values: [0.03020158559397162, 0.01680327868852459, 0.026744313936917175] and parameters: {'n_layers': 2, 'embedding_dim': 96, 'lr': 0.0005464720177916712, 'lambda_val': 1.7207712053457044e-06, 'batch_size': 2662, 'optimizer': 'Adam'}.
2026-05-23 00:36:53,716 - experiment_functions - INFO - Early stopping at epoch 650. Best Metrics: (0.0296286824759952, 0.01573770491803279, 0.025823301964779846)
2026-05-23 00:36:53,800 - optuna.study.study - INFO - Trial 206 finished with values: [0.0296286824759952, 0.01573770491803279, 0.025823301964779846] and parameters: {'n_layers': 2, 'embedding_dim': 128, 'lr': 0.0009422878098805214, 'lambda_val': 5.790863900505623e-06, 'batch_size': 2834, 'optimizer': 'RMSprop'}.
2026-05-23 00:37:00,432 - experiment_functions - INFO - Early stopping at epoch 2000. Best Metrics: (0.032110844635071384, 0.01942622950819672, 0.027744516863570778)
