2026-05-23 02:21:04,023 - optuna.study.study - INFO - Trial 169 finished with values: [0.017565182763593912, 0.010491803278688525, 0.015706305163949327] and parameters: {'n_layers': 1, 'embedding_dim': 64, 'lr': 0.0328373396847582, 'lambda_val': 4.391961880033394e-06, 'batch_size': 3441, 'optimizer': 'RMSprop'}.
2026-05-23 02:21:08,750 - experiment_functions - INFO - Early stopping at epoch 1300. Best Metrics: (0.02895267612071385, 0.017295081967213115, 0.027673882009490378)
2026-05-23 02:21:08,842 - optuna.study.study - INFO - Trial 170 finished with values: [0.02895267612071385, 0.017295081967213115, 0.027673882009490378] and parameters: {'n_layers': 4, 'embedding_dim': 64, 'lr': 0.0004474461075792833, 'lambda_val': 8.858691676718628e-05, 'batch_size': 1226, 'optimizer': 'Adam'}.
2026-05-23 02:21:22,732 - optuna.study.study - INFO - Trial 171 finished with values: [0.028255254706479306, 0.019098360655737705, 0.025339583514186796] and parameters: {'n_layers': 3, 'embedding_dim': 128, 'lr': 0.0001642455197684349, 'lambda_val': 0.003734260471985348, 'batch_size': 2477, 'optimizer': 'Adam'}.
2026-05-23 02:21:28,530 - experiment_functions - INFO - Early stopping at epoch 900. Best Metrics: (0.029784159260457094, 0.015491803278688524, 0.022765105243832486)
2026-05-23 02:21:28,622 - optuna.study.study - INFO - Trial 172 finished with values: [0.029784159260457094, 0.015491803278688524, 0.022765105243832486] and parameters: {'n_layers': 3, 'embedding_dim': 96, 'lr': 0.0004474461075792833, 'lambda_val': 8.858691676718628e-05, 'batch_size': 2886, 'optimizer': 'RMSprop'}.
2026-05-23 02:21:32,579 - experiment_functions - INFO - Early stopping at epoch 1000. Best Metrics: (0.024747504792220088, 0.01672131147540984, 0.02233614658517255)
2026-05-23 02:21:33,019 - optuna.study.study - INFO - Trial 173 finished with values: [0.024747504792220088, 0.01672131147540984, 0.02233614658517255] and parameters: {'n_layers': 1, 'embedding_dim': 32, 'lr': 0.0010682175784251788, 'lambda_val': 0.01576185866290203, 'batch_size': 2759, 'optimizer': 'Adam'}.
2026-05-23 02:21:35,597 - experiment_functions - INFO - Early stopping at epoch 550. Best Metrics: (0.026895731387644162, 0.013360655737704919, 0.02065592341659093)
2026-05-23 02:21:35,736 - optuna.study.study - INFO - Trial 174 finished with values: [0.026895731387644162, 0.013360655737704919, 0.02065592341659093] and parameters: {'n_layers': 3, 'embedding_dim': 64, 'lr': 0.009752916576911692, 'lambda_val': 1.6012413972032166e-05, 'batch_size': 1698, 'optimizer': 'Adam'}.
2026-05-23 02:21:38,587 - experiment_functions - INFO - Early stopping at epoch 750. Best Metrics: (0.027257039248099264, 0.015983606557377048, 0.023698007229124126)
2026-05-23 02:21:39,960 - optuna.study.study - INFO - Trial 175 finished with values: [0.027257039248099264, 0.015983606557377048, 0.023698007229124126] and parameters: {'n_layers': 1, 'embedding_dim': 32, 'lr': 0.001529501184394163, 'lambda_val': 0.0003977734214389728, 'batch_size': 3213, 'optimizer': 'RMSprop'}.
2026-05-23 02:21:42,668 - experiment_functions - INFO - Early stopping at epoch 550. Best Metrics: (0.022588383070554503, 0.013360655737704919, 0.019098995924800494)
2026-05-23 02:21:42,765 - optuna.study.study - INFO - Trial 176 finished with values: [0.022588383070554503, 0.013360655737704919, 0.019098995924800494] and parameters: {'n_layers': 2, 'embedding_dim': 256, 'lr': 0.01140479989462853, 'lambda_val': 7.120522979358461e-06, 'batch_size': 1786, 'optimizer': 'Adam'}.
2026-05-23 02:21:45,265 - experiment_functions - INFO - Early stopping at epoch 600. Best Metrics: (0.023354451831652724, 0.016475409836065574, 0.02378461610625294)
2026-05-23 02:21:45,383 - optuna.study.study - INFO - Trial 177 finished with values: [0.023354451831652724, 0.016475409836065574, 0.02378461610625294] and parameters: {'n_layers': 1, 'embedding_dim': 64, 'lr': 0.001529501184394163, 'lambda_val': 0.01576185866290203, 'batch_size': 3132, 'optimizer': 'RMSprop'}.
2026-05-23 02:21:48,254 - experiment_functions - INFO - Early stopping at epoch 700. Best Metrics: (0.03338834742920775, 0.017868852459016395, 0.026480531225377232)
2026-05-23 02:21:48,673 - optuna.study.study - INFO - Trial 178 finished with values: [0.03338834742920775, 0.017868852459016395, 0.026480531225377232] and parameters: {'n_layers': 3, 'embedding_dim': 64, 'lr': 0.0010193114088728706, 'lambda_val': 0.003734260471985348, 'batch_size': 2242, 'optimizer': 'Adam'}.
2026-05-23 02:21:52,307 - experiment_functions - INFO - Early stopping at epoch 850. Best Metrics: (0.023229269687775563, 0.01377049180327869, 0.018853891766518045)
2026-05-23 02:21:52,418 - optuna.study.study - INFO - Trial 179 finished with values: [0.023229269687775563, 0.01377049180327869, 0.018853891766518045] and parameters: {'n_layers': 4, 'embedding_dim': 96, 'lr': 0.0004474461075792833, 'lambda_val': 2.3136910244372533e-06, 'batch_size': 3384, 'optimizer': 'Adam'}.
2026-05-23 02:21:55,197 - experiment_functions - INFO - Early stopping at epoch 600. Best Metrics: (0.018815178224286123, 0.011311475409836066, 0.015151929112474967)
2026-05-23 02:21:55,278 - optuna.study.study - INFO - Trial 180 finished with values: [0.018815178224286123, 0.011311475409836066, 0.015151929112474967] and parameters: {'n_layers': 4, 'embedding_dim': 64, 'lr': 0.0020135118692985172, 'lambda_val': 0.00013294480587825716, 'batch_size': 2759, 'optimizer': 'Adam'}.
2026-05-23 02:22:00,223 - experiment_functions - INFO - Early stopping at epoch 1250. Best Metrics: (0.028658589305442288, 0.015000000000000001, 0.0249260555474911)
2026-05-23 02:22:00,873 - optuna.study.study - INFO - Trial 181 finished with values: [0.028658589305442288, 0.015000000000000001, 0.0249260555474911] and parameters: {'n_layers': 3, 'embedding_dim': 128, 'lr': 0.0003432142400602671, 'lambda_val': 1.6012413972032166e-05, 'batch_size': 3213, 'optimizer': 'Adam'}.
2026-05-23 02:22:04,268 - experiment_functions - INFO - Early stopping at epoch 550. Best Metrics: (0.027601012208799732, 0.01557377049180328, 0.023881066387009306)
2026-05-23 02:22:04,368 - optuna.study.study - INFO - Trial 182 finished with values: [0.027601012208799732, 0.01557377049180328, 0.023881066387009306] and parameters: {'n_layers': 3, 'embedding_dim': 256, 'lr': 0.0010193114088728706, 'lambda_val': 0.0038475852967126147, 'batch_size': 2886, 'optimizer': 'RMSprop'}.
2026-05-23 02:22:07,880 - experiment_functions - INFO - Early stopping at epoch 800. Best Metrics: (0.02665273954979824, 0.015491803278688524, 0.022861835214402618)
2026-05-23 02:22:07,951 - optuna.study.study - INFO - Trial 183 finished with values: [0.02665273954979824, 0.015491803278688524, 0.022861835214402618] and parameters: {'n_layers': 4, 'embedding_dim': 64, 'lr': 0.0006838964806225416, 'lambda_val': 2.8888036308667125e-06, 'batch_size': 3197, 'optimizer': 'Adam'}.
2026-05-23 02:22:10,873 - experiment_functions - INFO - Early stopping at epoch 600. Best Metrics: (0.029180943995407445, 0.016639344262295082, 0.0258166501867163)
2026-05-23 02:22:11,198 - optuna.study.study - INFO - Trial 184 finished with values: [0.029180943995407445, 0.016639344262295082, 0.0258166501867163] and parameters: {'n_layers': 3, 'embedding_dim': 128, 'lr': 0.0009933779564808808, 'lambda_val': 0.0005428353674897035, 'batch_size': 2477, 'optimizer': 'RMSprop'}.
2026-05-23 02:22:23,007 - optuna.study.study - INFO - Trial 185 finished with values: [0.017304612884625814, 0.010491803278688525, 0.015333596263762782] and parameters: {'n_layers': 1, 'embedding_dim': 32, 'lr': 0.00031796963245752367, 'lambda_val': 0.0030797334480481965, 'batch_size': 1616, 'optimizer': 'RMSprop'}.
2026-05-23 02:22:28,262 - experiment_functions - INFO - Early stopping at epoch 1550. Best Metrics: (0.03083245572036795, 0.019918032786885247, 0.028788663199259563)
2026-05-23 02:22:28,613 - optuna.study.study - INFO - Trial 186 finished with values: [0.03083245572036795, 0.019918032786885247, 0.028788663199259563] and parameters: {'n_layers': 1, 'embedding_dim': 96, 'lr': 0.0004474461075792833, 'lambda_val': 0.0003977734214389728, 'batch_size': 3213, 'optimizer': 'RMSprop'}.
2026-05-23 02:22:31,287 - experiment_functions - INFO - Early stopping at epoch 700. Best Metrics: (0.0366198337480608, 0.018606557377049183, 0.030363739085905356)
2026-05-23 02:22:31,423 - optuna.study.study - INFO - Trial 187 finished with values: [0.0366198337480608, 0.018606557377049183, 0.030363739085905356] and parameters: {'n_layers': 1, 'embedding_dim': 32, 'lr': 0.0020135118692985172, 'lambda_val': 1.8731629011795012e-06, 'batch_size': 1698, 'optimizer': 'RMSprop'}.
2026-05-23 02:22:36,327 - experiment_functions - INFO - Early stopping at epoch 1400. Best Metrics: (0.028953579138750962, 0.015901639344262294, 0.023900036491512164)
2026-05-23 02:22:36,432 - optuna.study.study - INFO - Trial 188 finished with values: [0.028953579138750962, 0.015901639344262294, 0.023900036491512164] and parameters: {'n_layers': 2, 'embedding_dim': 96, 'lr': 0.0003432142400602671, 'lambda_val': 8.858691676718628e-05, 'batch_size': 2886, 'optimizer': 'RMSprop'}.
2026-05-23 02:22:40,531 - experiment_functions - INFO - Early stopping at epoch 1100. Best Metrics: (0.024830721223008567, 0.016557377049180328, 0.02075286766762558)
2026-05-23 02:22:40,800 - optuna.study.study - INFO - Trial 189 finished with values: [0.024830721223008567, 0.016557377049180328, 0.02075286766762558] and parameters: {'n_layers': 2, 'embedding_dim': 96, 'lr': 0.0003432142400602671, 'lambda_val': 0.01576185866290203, 'batch_size': 3384, 'optimizer': 'RMSprop'}.
2026-05-23 02:22:43,490 - experiment_functions - INFO - Early stopping at epoch 550. Best Metrics: (0.03085137295457732, 0.017213114754098365, 0.026360724635266435)
2026-05-23 02:22:43,594 - optuna.study.study - INFO - Trial 190 finished with values: [0.03085137295457732, 0.017213114754098365, 0.026360724635266435] and parameters: {'n_layers': 3, 'embedding_dim': 128, 'lr': 0.0010682175784251788, 'lambda_val': 7.3050833305021745e-06, 'batch_size': 2242, 'optimizer': 'RMSprop'}.
2026-05-23 02:22:47,333 - experiment_functions - INFO - Early stopping at epoch 950. Best Metrics: (0.029493344969262543, 0.01639344262295082, 0.025769967749625658)
2026-05-23 02:22:47,892 - optuna.study.study - INFO - Trial 191 finished with values: [0.029493344969262543, 0.01639344262295082, 0.025769967749625658] and parameters: {'n_layers': 1, 'embedding_dim': 128, 'lr': 0.0010151510446538632, 'lambda_val': 7.3050833305021745e-06, 'batch_size': 2886, 'optimizer': 'Adam'}.
2026-05-23 02:22:56,079 - experiment_functions - INFO - Early stopping at epoch 550. Best Metrics: (0.02333872814215661, 0.01418032786885246, 0.022803448165608625)
2026-05-23 02:22:56,600 - optuna.study.study - INFO - Trial 192 finished with values: [0.02333872814215661, 0.01418032786885246, 0.022803448165608625] and parameters: {'n_layers': 1, 'embedding_dim': 64, 'lr': 0.01140479989462853, 'lambda_val': 0.0004199340181336044, 'batch_size': 2242, 'optimizer': 'Adam'}.
2026-05-23 02:23:05,234 - experiment_functions - INFO - Early stopping at epoch 1500. Best Metrics: (0.031709546721905596, 0.017459016393442623, 0.026272604173578303)
2026-05-23 02:23:05,827 - optuna.study.study - INFO - Trial 193 finished with values: [0.031709546721905596, 0.017459016393442623, 0.026272604173578303] and parameters: {'n_layers': 1, 'embedding_dim': 128, 'lr': 0.0004474461075792833, 'lambda_val': 0.0003977734214389728, 'batch_size': 3213, 'optimizer': 'RMSprop'}.
2026-05-23 02:23:08,998 - experiment_functions - INFO - Early stopping at epoch 700. Best Metrics: (0.033628716885941434, 0.01614754098360656, 0.027048972494794758)
2026-05-23 02:23:09,163 - optuna.study.study - INFO - Trial 194 finished with values: [0.033628716885941434, 0.01614754098360656, 0.027048972494794758] and parameters: {'n_layers': 3, 'embedding_dim': 32, 'lr': 0.0009933779564808808, 'lambda_val': 0.0001348402175281296, 'batch_size': 3086, 'optimizer': 'RMSprop'}.
2026-05-23 02:23:12,431 - experiment_functions - INFO - Early stopping at epoch 750. Best Metrics: (0.026223422423670775, 0.015655737704918033, 0.02361345136162811)
2026-05-23 02:23:12,527 - optuna.study.study - INFO - Trial 195 finished with values: [0.026223422423670775, 0.015655737704918033, 0.02361345136162811] and parameters: {'n_layers': 4, 'embedding_dim': 96, 'lr': 0.0004474461075792833, 'lambda_val': 0.002125709045009131, 'batch_size': 2886, 'optimizer': 'RMSprop'}.
2026-05-23 02:23:15,325 - experiment_functions - INFO - Early stopping at epoch 750. Best Metrics: (0.0349377812170196, 0.01860655737704918, 0.0281854700018568)
2026-05-23 02:23:16,187 - optuna.study.study - INFO - Trial 196 finished with values: [0.0349377812170196, 0.01860655737704918, 0.0281854700018568] and parameters: {'n_layers': 3, 'embedding_dim': 64, 'lr': 0.0010193114088728706, 'lambda_val': 1.8731629011795012e-06, 'batch_size': 1698, 'optimizer': 'Adam'}.
2026-05-23 02:23:23,956 - experiment_functions - INFO - Early stopping at epoch 2600. Best Metrics: (0.024272028645502673, 0.013606557377049182, 0.020242489198238213)
2026-05-23 02:23:24,072 - optuna.study.study - INFO - Trial 197 finished with values: [0.024272028645502673, 0.013606557377049182, 0.020242489198238213] and parameters: {'n_layers': 1, 'embedding_dim': 32, 'lr': 0.004251456926748961, 'lambda_val': 0.02744721846470932, 'batch_size': 3159, 'optimizer': 'RMSprop'}.
2026-05-23 02:23:26,343 - experiment_functions - INFO - Early stopping at epoch 550. Best Metrics: (0.0193931039570503, 0.010983606557377049, 0.01816628743611448)
2026-05-23 02:23:26,444 - optuna.study.study - INFO - Trial 198 finished with values: [0.0193931039570503, 0.010983606557377049, 0.01816628743611448] and parameters: {'n_layers': 1, 'embedding_dim': 96, 'lr': 0.03877349535365796, 'lambda_val': 2.325489515687155e-06, 'batch_size': 664, 'optimizer': 'Adam'}.
2026-05-23 02:23:28,814 - experiment_functions - INFO - Early stopping at epoch 550. Best Metrics: (0.019542671021637387, 0.011475409836065573, 0.017671759215408672)
2026-05-23 02:23:28,911 - optuna.study.study - INFO - Trial 199 finished with values: [0.019542671021637387, 0.011475409836065573, 0.017671759215408672] and parameters: {'n_layers': 3, 'embedding_dim': 64, 'lr': 0.0027017388551690887, 'lambda_val': 1.6012413972032166e-05, 'batch_size': 1698, 'optimizer': 'RMSprop'}.
2026-05-23 02:23:31,224 - experiment_functions - INFO - Early stopping at epoch 500. Best Metrics: (0.0021965105059998866, 0.002213114754098361, 0.0025847419990954502)
2026-05-23 02:23:31,364 - optuna.study.study - INFO - Trial 200 finished with values: [0.0021965105059998866, 0.002213114754098361, 0.0025847419990954502] and parameters: {'n_layers': 1, 'embedding_dim': 32, 'lr': 0.007023409779815748, 'lambda_val': 8.858691676718628e-05, 'batch_size': 3086, 'optimizer': 'SGD'}.
2026-05-23 02:23:38,025 - experiment_functions - INFO - Early stopping at epoch 2250. Best Metrics: (0.036373304230586795, 0.01909836065573771, 0.03131810231785706)
2026-05-23 02:23:38,110 - optuna.study.study - INFO - Trial 201 finished with values: [0.036373304230586795, 0.01909836065573771, 0.03131810231785706] and parameters: {'n_layers': 1, 'embedding_dim': 96, 'lr': 0.0003432142400602671, 'lambda_val': 0.0010210780536973009, 'batch_size': 2231, 'optimizer': 'Adam'}.
2026-05-23 02:23:44,718 - experiment_functions - INFO - Early stopping at epoch 800. Best Metrics: (0.028737372475157306, 0.01778688524590164, 0.026425472648060697)
2026-05-23 02:23:46,057 - optuna.study.study - INFO - Trial 202 finished with values: [0.028737372475157306, 0.01778688524590164, 0.026425472648060697] and parameters: {'n_layers': 3, 'embedding_dim': 64, 'lr': 0.0010193114088728706, 'lambda_val': 0.00012961346244400303, 'batch_size': 1032, 'optimizer': 'Adam'}.
2026-05-23 02:23:48,818 - experiment_functions - INFO - Early stopping at epoch 650. Best Metrics: (0.023375309081578904, 0.015000000000000001, 0.021931967036420544)
2026-05-23 02:23:48,954 - optuna.study.study - INFO - Trial 203 finished with values: [0.023375309081578904, 0.015000000000000001, 0.021931967036420544] and parameters: {'n_layers': 3, 'embedding_dim': 128, 'lr': 0.0010193114088728706, 'lambda_val': 0.003734260471985348, 'batch_size': 3443, 'optimizer': 'Adam'}.
2026-05-23 02:23:51,476 - experiment_functions - INFO - Early stopping at epoch 550. Best Metrics: (0.011518987148064362, 0.006557377049180328, 0.009730432754042503)
2026-05-23 02:23:51,575 - optuna.study.study - INFO - Trial 204 finished with values: [0.011518987148064362, 0.006557377049180328, 0.009730432754042503] and parameters: {'n_layers': 2, 'embedding_dim': 256, 'lr': 0.08483027053340271, 'lambda_val': 1.8731629011795012e-06, 'batch_size': 2242, 'optimizer': 'Adam'}.
2026-05-23 02:23:58,781 - experiment_functions - INFO - Early stopping at epoch 2650. Best Metrics: (0.03256359824573165, 0.017704918032786888, 0.026656492398532752)
2026-05-23 02:23:58,943 - optuna.study.study - INFO - Trial 205 finished with values: [0.03256359824573165, 0.017704918032786888, 0.026656492398532752] and parameters: {'n_layers': 1, 'embedding_dim': 128, 'lr': 0.0003432142400602671, 'lambda_val': 2.072742692273282e-06, 'batch_size': 3213, 'optimizer': 'RMSprop'}.
2026-05-23 02:24:02,352 - experiment_functions - INFO - Early stopping at epoch 600. Best Metrics: (0.029281136814282963, 0.015983606557377048, 0.023557748724044404)
2026-05-23 02:24:02,438 - optuna.study.study - INFO - Trial 206 finished with values: [0.029281136814282963, 0.015983606557377048, 0.023557748724044404] and parameters: {'n_layers': 4, 'embedding_dim': 256, 'lr': 0.0011164422280390935, 'lambda_val': 8.858691676718628e-05, 'batch_size': 1974, 'optimizer': 'Adam'}.
2026-05-23 02:24:10,778 - experiment_functions - INFO - Early stopping at epoch 2900. Best Metrics: (0.0357748240499793, 0.019836065573770493, 0.029594892231440056)
2026-05-23 02:24:11,521 - optuna.study.study - INFO - Trial 207 finished with values: [0.0357748240499793, 0.019836065573770493, 0.029594892231440056] and parameters: {'n_layers': 3, 'embedding_dim': 64, 'lr': 0.00023663705269380512, 'lambda_val': 1.8731629011795012e-06, 'batch_size': 664, 'optimizer': 'Adam'}.
2026-05-23 02:24:14,305 - experiment_functions - INFO - Early stopping at epoch 650. Best Metrics: (0.0278665493271952, 0.018032786885245903, 0.024962914394328625)
2026-05-23 02:24:14,381 - optuna.study.study - INFO - Trial 208 finished with values: [0.0278665493271952, 0.018032786885245903, 0.024962914394328625] and parameters: {'n_layers': 1, 'embedding_dim': 128, 'lr': 0.0016804875255015902, 'lambda_val': 7.3050833305021745e-06, 'batch_size': 2886, 'optimizer': 'RMSprop'}.
2026-05-23 02:24:20,072 - experiment_functions - INFO - Early stopping at epoch 1850. Best Metrics: (0.03519933615126103, 0.020163934426229508, 0.03377788107018503)
2026-05-23 02:24:20,161 - optuna.study.study - INFO - Trial 209 finished with values: [0.03519933615126103, 0.020163934426229508, 0.03377788107018503] and parameters: {'n_layers': 1, 'embedding_dim': 64, 'lr': 0.0005120769952376107, 'lambda_val': 8.858691676718628e-05, 'batch_size': 664, 'optimizer': 'Adam'}.
2026-05-23 02:24:22,721 - experiment_functions - INFO - Early stopping at epoch 550. Best Metrics: (0.026687314591769543, 0.015409836065573772, 0.022608692866359647)
2026-05-23 02:24:23,519 - optuna.study.study - INFO - Trial 210 finished with values: [0.026687314591769543, 0.015409836065573772, 0.022608692866359647] and parameters: {'n_layers': 3, 'embedding_dim': 128, 'lr': 0.0009933779564808808, 'lambda_val': 0.00576692598344647, 'batch_size': 3132, 'optimizer': 'RMSprop'}.
2026-05-23 02:24:28,712 - experiment_functions - INFO - Early stopping at epoch 750. Best Metrics: (0.0293995283784682, 0.015819672131147544, 0.022951441326018413)
2026-05-23 02:24:29,859 - optuna.study.study - INFO - Trial 211 finished with values: [0.0293995283784682, 0.015819672131147544, 0.022951441326018413] and parameters: {'n_layers': 3, 'embedding_dim': 32, 'lr': 0.001529501184394163, 'lambda_val': 1.6012413972032166e-05, 'batch_size': 3136, 'optimizer': 'Adam'}.
2026-05-23 02:24:35,632 - experiment_functions - INFO - Early stopping at epoch 1050. Best Metrics: (0.0205419090256987, 0.014672131147540983, 0.019725335292038484)
2026-05-23 02:24:36,259 - optuna.study.study - INFO - Trial 212 finished with values: [0.0205419090256987, 0.014672131147540983, 0.019725335292038484] and parameters: {'n_layers': 2, 'embedding_dim': 128, 'lr': 0.0003432142400602671, 'lambda_val': 0.01576185866290203, 'batch_size': 3213, 'optimizer': 'Adam'}.
2026-05-23 02:24:45,335 - experiment_functions - INFO - Early stopping at epoch 1350. Best Metrics: (0.03590294384099278, 0.020081967213114758, 0.030752343721059297)
2026-05-23 02:24:45,438 - optuna.study.study - INFO - Trial 213 finished with values: [0.03590294384099278, 0.020081967213114758, 0.030752343721059297] and parameters: {'n_layers': 1, 'embedding_dim': 64, 'lr': 0.0010193114088728706, 'lambda_val': 0.003734260471985348, 'batch_size': 664, 'optimizer': 'Adam'}.
2026-05-23 02:24:48,172 - experiment_functions - INFO - Early stopping at epoch 650. Best Metrics: (0.03480654616364481, 0.01860655737704918, 0.02952498805520757)
2026-05-23 02:24:48,257 - optuna.study.study - INFO - Trial 214 finished with values: [0.03480654616364481, 0.01860655737704918, 0.02952498805520757] and parameters: {'n_layers': 3, 'embedding_dim': 96, 'lr': 0.0020135118692985172, 'lambda_val': 1.1605868627809288e-05, 'batch_size': 664, 'optimizer': 'Adam'}.
2026-05-23 02:24:52,096 - experiment_functions - INFO - Early stopping at epoch 800. Best Metrics: (0.036563951164077735, 0.01852459016393443, 0.028556356507138204)
