2026-05-23 02:17:14,856 - optuna.study.study - INFO - Trial 123 finished with values: [0.0009116600952901661, 0.0012295081967213116, 0.001552761786704371] and parameters: {'n_layers': 3, 'embedding_dim': 128, 'lr': 0.0001642455197684349, 'lambda_val': 0.003734260471985348, 'batch_size': 3197, 'optimizer': 'SGD'}.
2026-05-23 02:17:18,914 - experiment_functions - INFO - Early stopping at epoch 1150. Best Metrics: (0.002465237579840211, 0.002540983606557377, 0.002867071871626695)
2026-05-23 02:17:19,519 - optuna.study.study - INFO - Trial 124 finished with values: [0.002465237579840211, 0.002540983606557377, 0.002867071871626695] and parameters: {'n_layers': 2, 'embedding_dim': 64, 'lr': 1.3122420893153017e-05, 'lambda_val': 2.505292726657355e-05, 'batch_size': 3132, 'optimizer': 'Adam'}.
2026-05-23 02:17:22,755 - experiment_functions - INFO - Early stopping at epoch 650. Best Metrics: (0.019557348481691203, 0.012622950819672131, 0.0179443459283475)
2026-05-23 02:17:22,853 - optuna.study.study - INFO - Trial 125 finished with values: [0.019557348481691203, 0.012622950819672131, 0.0179443459283475] and parameters: {'n_layers': 2, 'embedding_dim': 256, 'lr': 0.003012176927562537, 'lambda_val': 0.0004959813913081047, 'batch_size': 2679, 'optimizer': 'RMSprop'}.
2026-05-23 02:17:34,776 - optuna.study.study - INFO - Trial 126 finished with values: [0.01074598505533051, 0.006475409836065575, 0.00908635419018117] and parameters: {'n_layers': 2, 'embedding_dim': 32, 'lr': 0.00010788024120426728, 'lambda_val': 1.7681576764531157e-06, 'batch_size': 3213, 'optimizer': 'Adam'}.
2026-05-23 02:17:37,594 - experiment_functions - INFO - Early stopping at epoch 600. Best Metrics: (0.033684269120744785, 0.01745901639344262, 0.028647890400536207)
2026-05-23 02:17:37,696 - optuna.study.study - INFO - Trial 127 finished with values: [0.033684269120744785, 0.01745901639344262, 0.028647890400536207] and parameters: {'n_layers': 3, 'embedding_dim': 128, 'lr': 0.0009933779564808808, 'lambda_val': 0.0005428353674897035, 'batch_size': 2477, 'optimizer': 'RMSprop'}.
2026-05-23 02:17:40,577 - experiment_functions - INFO - Early stopping at epoch 700. Best Metrics: (0.02827814471111978, 0.019262295081967213, 0.027629900833241152)
2026-05-23 02:17:41,308 - optuna.study.study - INFO - Trial 128 finished with values: [0.02827814471111978, 0.019262295081967213, 0.027629900833241152] and parameters: {'n_layers': 1, 'embedding_dim': 128, 'lr': 0.001529501184394163, 'lambda_val': 0.01576185866290203, 'batch_size': 3132, 'optimizer': 'Adam'}.
2026-05-23 02:17:54,650 - experiment_functions - INFO - Early stopping at epoch 2500. Best Metrics: (0.01694571308668494, 0.012868852459016394, 0.017984007482914757)
2026-05-23 02:17:54,746 - optuna.study.study - INFO - Trial 129 finished with values: [0.01694571308668494, 0.012868852459016394, 0.017984007482914757] and parameters: {'n_layers': 1, 'embedding_dim': 64, 'lr': 0.04105283659839535, 'lambda_val': 0.020702741472597427, 'batch_size': 2477, 'optimizer': 'RMSprop'}.
2026-05-23 02:17:57,820 - experiment_functions - INFO - Early stopping at epoch 800. Best Metrics: (0.017241968355669275, 0.01221311475409836, 0.015682090647969965)
2026-05-23 02:17:57,917 - optuna.study.study - INFO - Trial 130 finished with values: [0.017241968355669275, 0.01221311475409836, 0.015682090647969965] and parameters: {'n_layers': 1, 'embedding_dim': 64, 'lr': 0.0010682175784251788, 'lambda_val': 0.06799272203728716, 'batch_size': 2242, 'optimizer': 'Adam'}.
2026-05-23 02:18:04,533 - experiment_functions - INFO - Early stopping at epoch 2100. Best Metrics: (0.03180695145022483, 0.019426229508196724, 0.027863526327891453)
2026-05-23 02:18:04,622 - optuna.study.study - INFO - Trial 131 finished with values: [0.03180695145022483, 0.019426229508196724, 0.027863526327891453] and parameters: {'n_layers': 1, 'embedding_dim': 96, 'lr': 0.0004474461075792833, 'lambda_val': 0.0015620530681847225, 'batch_size': 2886, 'optimizer': 'RMSprop'}.
2026-05-23 02:18:08,305 - experiment_functions - INFO - Early stopping at epoch 900. Best Metrics: (0.002989798728493215, 0.0022950819672131148, 0.0027765830968407073)
2026-05-23 02:18:08,880 - optuna.study.study - INFO - Trial 132 finished with values: [0.002989798728493215, 0.0022950819672131148, 0.0027765830968407073] and parameters: {'n_layers': 4, 'embedding_dim': 64, 'lr': 2.2110545145098015e-05, 'lambda_val': 0.00013294480587825716, 'batch_size': 2886, 'optimizer': 'RMSprop'}.
2026-05-23 02:18:13,787 - experiment_functions - INFO - Early stopping at epoch 1450. Best Metrics: (0.012089785628196294, 0.008278688524590166, 0.013813543821259787)
2026-05-23 02:18:13,887 - optuna.study.study - INFO - Trial 133 finished with values: [0.012089785628196294, 0.008278688524590166, 0.013813543821259787] and parameters: {'n_layers': 1, 'embedding_dim': 256, 'lr': 0.05671137520020283, 'lambda_val': 1.1655205445930693e-06, 'batch_size': 1412, 'optimizer': 'RMSprop'}.
2026-05-23 02:18:17,579 - experiment_functions - INFO - Early stopping at epoch 1100. Best Metrics: (0.043319929738843854, 0.020901639344262295, 0.03663613669184008)
2026-05-23 02:18:17,669 - optuna.study.study - INFO - Trial 134 finished with values: [0.043319929738843854, 0.020901639344262295, 0.03663613669184008] and parameters: {'n_layers': 1, 'embedding_dim': 32, 'lr': 0.001529501184394163, 'lambda_val': 1.6012413972032166e-05, 'batch_size': 664, 'optimizer': 'RMSprop'}.
2026-05-23 02:18:23,038 - experiment_functions - INFO - Early stopping at epoch 1400. Best Metrics: (0.03270001137455441, 0.019836065573770493, 0.02967546088772134)
2026-05-23 02:18:23,242 - optuna.study.study - INFO - Trial 135 finished with values: [0.03270001137455441, 0.019836065573770493, 0.02967546088772134] and parameters: {'n_layers': 4, 'embedding_dim': 64, 'lr': 0.0004474461075792833, 'lambda_val': 8.858691676718628e-05, 'batch_size': 701, 'optimizer': 'Adam'}.
2026-05-23 02:18:33,129 - experiment_functions - INFO - Early stopping at epoch 3100. Best Metrics: (0.02986900386984555, 0.017295081967213115, 0.024081013590261224)
2026-05-23 02:18:33,207 - optuna.study.study - INFO - Trial 136 finished with values: [0.02986900386984555, 0.017295081967213115, 0.024081013590261224] and parameters: {'n_layers': 3, 'embedding_dim': 128, 'lr': 0.0001642455197684349, 'lambda_val': 0.003734260471985348, 'batch_size': 2477, 'optimizer': 'Adam'}.
2026-05-23 02:18:37,768 - experiment_functions - INFO - Early stopping at epoch 1100. Best Metrics: (0.02946783619502074, 0.01655737704918033, 0.02388666484994598)
2026-05-23 02:18:38,349 - optuna.study.study - INFO - Trial 137 finished with values: [0.02946783619502074, 0.01655737704918033, 0.02388666484994598] and parameters: {'n_layers': 3, 'embedding_dim': 96, 'lr': 0.0003432142400602671, 'lambda_val': 0.0010210780536973009, 'batch_size': 3384, 'optimizer': 'Adam'}.
2026-05-23 02:18:48,117 - experiment_functions - INFO - Early stopping at epoch 1800. Best Metrics: (0.01926059065238926, 0.0119672131147541, 0.01656634500731479)
2026-05-23 02:18:48,562 - optuna.study.study - INFO - Trial 138 finished with values: [0.01926059065238926, 0.0119672131147541, 0.01656634500731479] and parameters: {'n_layers': 1, 'embedding_dim': 128, 'lr': 0.05671137520020283, 'lambda_val': 0.020702741472597427, 'batch_size': 2477, 'optimizer': 'RMSprop'}.
2026-05-23 02:18:58,440 - experiment_functions - INFO - Early stopping at epoch 3400. Best Metrics: (0.007729273991110454, 0.004836065573770492, 0.007769480407289717)
2026-05-23 02:18:58,739 - optuna.study.study - INFO - Trial 139 finished with values: [0.007729273991110454, 0.004836065573770492, 0.007769480407289717] and parameters: {'n_layers': 1, 'embedding_dim': 32, 'lr': 0.00011089595098502456, 'lambda_val': 0.01380676127429418, 'batch_size': 2759, 'optimizer': 'RMSprop'}.
2026-05-23 02:19:01,581 - experiment_functions - INFO - Early stopping at epoch 650. Best Metrics: (0.016628091281187838, 0.009098360655737705, 0.012969316084697818)
2026-05-23 02:19:01,667 - optuna.study.study - INFO - Trial 140 finished with values: [0.016628091281187838, 0.009098360655737705, 0.012969316084697818] and parameters: {'n_layers': 3, 'embedding_dim': 96, 'lr': 0.016569821197157334, 'lambda_val': 1.6024291339987423e-06, 'batch_size': 2308, 'optimizer': 'RMSprop'}.
2026-05-23 02:19:13,632 - optuna.study.study - INFO - Trial 141 finished with values: [0.01297128261117345, 0.009426229508196722, 0.013248859235924566] and parameters: {'n_layers': 1, 'embedding_dim': 32, 'lr': 0.0001642455197684349, 'lambda_val': 1.1859052695202747e-05, 'batch_size': 3371, 'optimizer': 'RMSprop'}.
2026-05-23 02:19:17,517 - experiment_functions - INFO - Early stopping at epoch 1100. Best Metrics: (0.03241343486715269, 0.017049180327868858, 0.027204581414478155)
2026-05-23 02:19:17,614 - optuna.study.study - INFO - Trial 142 finished with values: [0.03241343486715269, 0.017049180327868858, 0.027204581414478155] and parameters: {'n_layers': 2, 'embedding_dim': 32, 'lr': 0.0010193114088728706, 'lambda_val': 0.0004959813913081047, 'batch_size': 1295, 'optimizer': 'Adam'}.
2026-05-23 02:19:20,753 - experiment_functions - INFO - Early stopping at epoch 850. Best Metrics: (0.0020958649627152762, 0.0018852459016393442, 0.0021459947300696103)
2026-05-23 02:19:21,064 - optuna.study.study - INFO - Trial 143 finished with values: [0.0020958649627152762, 0.0018852459016393442, 0.0021459947300696103] and parameters: {'n_layers': 1, 'embedding_dim': 32, 'lr': 1.4597925071975105e-05, 'lambda_val': 0.0010210780536973009, 'batch_size': 1769, 'optimizer': 'RMSprop'}.
2026-05-23 02:19:33,175 - optuna.study.study - INFO - Trial 144 finished with values: [0.02285488760857006, 0.013606557377049182, 0.019163791488047557] and parameters: {'n_layers': 2, 'embedding_dim': 64, 'lr': 0.0001642455197684349, 'lambda_val': 0.0004199340181336044, 'batch_size': 3197, 'optimizer': 'RMSprop'}.
2026-05-23 02:19:35,959 - experiment_functions - INFO - Early stopping at epoch 600. Best Metrics: (0.012371780916550622, 0.008442622950819673, 0.012425301661215762)
2026-05-23 02:19:36,056 - optuna.study.study - INFO - Trial 145 finished with values: [0.012371780916550622, 0.008442622950819673, 0.012425301661215762] and parameters: {'n_layers': 3, 'embedding_dim': 128, 'lr': 0.01140479989462853, 'lambda_val': 0.0012175795951631463, 'batch_size': 963, 'optimizer': 'RMSprop'}.
2026-05-23 02:19:43,810 - experiment_functions - INFO - Early stopping at epoch 650. Best Metrics: (0.030356771862520757, 0.018032786885245903, 0.02775395665747162)
2026-05-23 02:19:44,191 - optuna.study.study - INFO - Trial 146 finished with values: [0.030356771862520757, 0.018032786885245903, 0.02775395665747162] and parameters: {'n_layers': 3, 'embedding_dim': 64, 'lr': 0.0020135118692985172, 'lambda_val': 1.8731629011795012e-06, 'batch_size': 1698, 'optimizer': 'Adam'}.
2026-05-23 02:19:52,438 - experiment_functions - INFO - Early stopping at epoch 850. Best Metrics: (0.013625424022515176, 0.009016393442622951, 0.013067909969001009)
2026-05-23 02:19:52,911 - optuna.study.study - INFO - Trial 147 finished with values: [0.013625424022515176, 0.009016393442622951, 0.013067909969001009] and parameters: {'n_layers': 2, 'embedding_dim': 64, 'lr': 0.02327624032515225, 'lambda_val': 2.505292726657355e-05, 'batch_size': 1786, 'optimizer': 'Adam'}.
2026-05-23 02:19:55,661 - experiment_functions - INFO - Early stopping at epoch 650. Best Metrics: (0.014650327149202528, 0.009754098360655739, 0.013366215079244993)
2026-05-23 02:19:55,749 - optuna.study.study - INFO - Trial 148 finished with values: [0.014650327149202528, 0.009754098360655739, 0.013366215079244993] and parameters: {'n_layers': 2, 'embedding_dim': 64, 'lr': 0.010855402575129876, 'lambda_val': 8.858691676718628e-05, 'batch_size': 2886, 'optimizer': 'RMSprop'}.
2026-05-23 02:19:58,271 - experiment_functions - INFO - Early stopping at epoch 600. Best Metrics: (0.02765975138129998, 0.014508196721311479, 0.0223999701537937)
2026-05-23 02:19:58,366 - optuna.study.study - INFO - Trial 149 finished with values: [0.02765975138129998, 0.014508196721311479, 0.0223999701537937] and parameters: {'n_layers': 1, 'embedding_dim': 32, 'lr': 0.004251456926748961, 'lambda_val': 8.897322827645169e-05, 'batch_size': 2477, 'optimizer': 'RMSprop'}.
2026-05-23 02:20:01,426 - experiment_functions - INFO - Early stopping at epoch 700. Best Metrics: (0.027598198113959315, 0.01614754098360656, 0.023694539806584015)
2026-05-23 02:20:01,515 - optuna.study.study - INFO - Trial 150 finished with values: [0.027598198113959315, 0.01614754098360656, 0.023694539806584015] and parameters: {'n_layers': 4, 'embedding_dim': 64, 'lr': 0.0010193114088728706, 'lambda_val': 0.00013294480587825716, 'batch_size': 1698, 'optimizer': 'Adam'}.
2026-05-23 02:20:04,247 - experiment_functions - INFO - Early stopping at epoch 700. Best Metrics: (0.029126430422585683, 0.01819672131147541, 0.02607444324942866)
2026-05-23 02:20:04,342 - optuna.study.study - INFO - Trial 151 finished with values: [0.029126430422585683, 0.01819672131147541, 0.02607444324942866] and parameters: {'n_layers': 3, 'embedding_dim': 64, 'lr': 0.0011164422280390935, 'lambda_val': 0.003734260471985348, 'batch_size': 1698, 'optimizer': 'Adam'}.
2026-05-23 02:20:06,711 - experiment_functions - INFO - Early stopping at epoch 550. Best Metrics: (0.01831953849773826, 0.011311475409836066, 0.016630891579596643)
2026-05-23 02:20:06,828 - optuna.study.study - INFO - Trial 152 finished with values: [0.01831953849773826, 0.011311475409836066, 0.016630891579596643] and parameters: {'n_layers': 4, 'embedding_dim': 32, 'lr': 0.011385784020717018, 'lambda_val': 0.00013294480587825716, 'batch_size': 1959, 'optimizer': 'Adam'}.
2026-05-23 02:20:10,247 - experiment_functions - INFO - Early stopping at epoch 650. Best Metrics: (0.030359999099684235, 0.01991803278688525, 0.029882050118972055)
2026-05-23 02:20:10,341 - optuna.study.study - INFO - Trial 153 finished with values: [0.030359999099684235, 0.01991803278688525, 0.029882050118972055] and parameters: {'n_layers': 1, 'embedding_dim': 256, 'lr': 0.0010193114088728706, 'lambda_val': 0.00576692598344647, 'batch_size': 2759, 'optimizer': 'RMSprop'}.
2026-05-23 02:20:12,673 - experiment_functions - INFO - Early stopping at epoch 550. Best Metrics: (0.024570141494358055, 0.013442622950819674, 0.02066417390690704)
2026-05-23 02:20:12,748 - optuna.study.study - INFO - Trial 154 finished with values: [0.024570141494358055, 0.013442622950819674, 0.02066417390690704] and parameters: {'n_layers': 2, 'embedding_dim': 64, 'lr': 0.010855402575129876, 'lambda_val': 2.505292726657355e-05, 'batch_size': 2886, 'optimizer': 'Adam'}.
2026-05-23 02:20:15,263 - experiment_functions - INFO - Early stopping at epoch 550. Best Metrics: (0.02789985633978342, 0.016557377049180328, 0.025071326654366805)
2026-05-23 02:20:15,354 - optuna.study.study - INFO - Trial 155 finished with values: [0.02789985633978342, 0.016557377049180328, 0.025071326654366805] and parameters: {'n_layers': 2, 'embedding_dim': 64, 'lr': 0.01140479989462853, 'lambda_val': 0.0005709667211110341, 'batch_size': 2361, 'optimizer': 'Adam'}.
2026-05-23 02:20:19,153 - experiment_functions - INFO - Early stopping at epoch 1100. Best Metrics: (0.03152798022696774, 0.01819672131147541, 0.030222309338744046)
2026-05-23 02:20:19,289 - optuna.study.study - INFO - Trial 156 finished with values: [0.03152798022696774, 0.01819672131147541, 0.030222309338744046] and parameters: {'n_layers': 1, 'embedding_dim': 96, 'lr': 0.0020135118692985172, 'lambda_val': 8.858691676718628e-05, 'batch_size': 664, 'optimizer': 'Adam'}.
2026-05-23 02:20:22,118 - experiment_functions - INFO - Early stopping at epoch 600. Best Metrics: (0.025757561976589755, 0.01614754098360656, 0.02276961752252643)
2026-05-23 02:20:22,355 - optuna.study.study - INFO - Trial 157 finished with values: [0.025757561976589755, 0.01614754098360656, 0.02276961752252643] and parameters: {'n_layers': 3, 'embedding_dim': 128, 'lr': 0.0009933779564808808, 'lambda_val': 0.0005428353674897035, 'batch_size': 3195, 'optimizer': 'RMSprop'}.
2026-05-23 02:20:24,728 - experiment_functions - INFO - Early stopping at epoch 600. Best Metrics: (0.0013096563701229325, 0.0018032786885245904, 0.0023748220483107607)
2026-05-23 02:20:24,809 - optuna.study.study - INFO - Trial 158 finished with values: [0.0013096563701229325, 0.0018032786885245904, 0.0023748220483107607] and parameters: {'n_layers': 1, 'embedding_dim': 96, 'lr': 0.001529501184394163, 'lambda_val': 7.3050833305021745e-06, 'batch_size': 3441, 'optimizer': 'SGD'}.
2026-05-23 02:20:27,848 - experiment_functions - INFO - Early stopping at epoch 700. Best Metrics: (0.026232752851381515, 0.017131147540983608, 0.024724976548112836)
2026-05-23 02:20:27,939 - optuna.study.study - INFO - Trial 159 finished with values: [0.026232752851381515, 0.017131147540983608, 0.024724976548112836] and parameters: {'n_layers': 3, 'embedding_dim': 64, 'lr': 0.0011164422280390935, 'lambda_val': 0.003734260471985348, 'batch_size': 1698, 'optimizer': 'Adam'}.
2026-05-23 02:20:31,388 - experiment_functions - INFO - Early stopping at epoch 700. Best Metrics: (0.030065518577236786, 0.016229508196721316, 0.024307746430869515)
2026-05-23 02:20:32,308 - optuna.study.study - INFO - Trial 160 finished with values: [0.030065518577236786, 0.016229508196721316, 0.024307746430869515] and parameters: {'n_layers': 2, 'embedding_dim': 256, 'lr': 0.0020135118692985172, 'lambda_val': 1.8731629011795012e-06, 'batch_size': 1698, 'optimizer': 'Adam'}.
2026-05-23 02:20:35,267 - experiment_functions - INFO - Early stopping at epoch 650. Best Metrics: (0.029217793054267138, 0.015327868852459018, 0.02516667193441833)
2026-05-23 02:20:35,626 - optuna.study.study - INFO - Trial 161 finished with values: [0.029217793054267138, 0.015327868852459018, 0.02516667193441833] and parameters: {'n_layers': 3, 'embedding_dim': 64, 'lr': 0.0009933779564808808, 'lambda_val': 0.0005428353674897035, 'batch_size': 2654, 'optimizer': 'RMSprop'}.
2026-05-23 02:20:38,862 - experiment_functions - INFO - Early stopping at epoch 600. Best Metrics: (0.028813648736098766, 0.016639344262295085, 0.02439141011017901)
2026-05-23 02:20:38,966 - optuna.study.study - INFO - Trial 162 finished with values: [0.028813648736098766, 0.016639344262295085, 0.02439141011017901] and parameters: {'n_layers': 3, 'embedding_dim': 128, 'lr': 0.0020135118692985172, 'lambda_val': 1.6012413972032166e-05, 'batch_size': 2242, 'optimizer': 'Adam'}.
2026-05-23 02:20:41,468 - experiment_functions - INFO - Early stopping at epoch 550. Best Metrics: (0.021990565508513776, 0.012950819672131148, 0.019098662966210073)
2026-05-23 02:20:41,560 - optuna.study.study - INFO - Trial 163 finished with values: [0.021990565508513776, 0.012950819672131148, 0.019098662966210073] and parameters: {'n_layers': 4, 'embedding_dim': 64, 'lr': 0.0010193114088728706, 'lambda_val': 0.0003977734214389728, 'batch_size': 3500, 'optimizer': 'RMSprop'}.
2026-05-23 02:20:47,603 - experiment_functions - INFO - Early stopping at epoch 1800. Best Metrics: (0.02824706393438818, 0.01754098360655738, 0.023701955181678388)
2026-05-23 02:20:48,332 - optuna.study.study - INFO - Trial 164 finished with values: [0.02824706393438818, 0.01754098360655738, 0.023701955181678388] and parameters: {'n_layers': 2, 'embedding_dim': 64, 'lr': 0.0003432142400602671, 'lambda_val': 7.3050833305021745e-06, 'batch_size': 3213, 'optimizer': 'RMSprop'}.
2026-05-23 02:20:50,970 - experiment_functions - INFO - Early stopping at epoch 650. Best Metrics: (0.02606218250032701, 0.015491803278688526, 0.022290975501940962)
2026-05-23 02:20:51,103 - optuna.study.study - INFO - Trial 165 finished with values: [0.02606218250032701, 0.015491803278688526, 0.022290975501940962] and parameters: {'n_layers': 3, 'embedding_dim': 64, 'lr': 0.0020135118692985172, 'lambda_val': 1.8731629011795012e-06, 'batch_size': 1698, 'optimizer': 'Adam'}.
2026-05-23 02:20:54,066 - experiment_functions - INFO - Early stopping at epoch 700. Best Metrics: (0.030296073293783796, 0.017459016393442623, 0.02593281923894974)
2026-05-23 02:20:54,174 - optuna.study.study - INFO - Trial 166 finished with values: [0.030296073293783796, 0.017459016393442623, 0.02593281923894974] and parameters: {'n_layers': 3, 'embedding_dim': 64, 'lr': 0.0010193114088728706, 'lambda_val': 0.003734260471985348, 'batch_size': 1698, 'optimizer': 'Adam'}.
2026-05-23 02:20:57,269 - experiment_functions - INFO - Early stopping at epoch 750. Best Metrics: (0.025836219798639874, 0.016475409836065574, 0.025261132396958867)
2026-05-23 02:20:57,403 - optuna.study.study - INFO - Trial 167 finished with values: [0.025836219798639874, 0.016475409836065574, 0.025261132396958867] and parameters: {'n_layers': 4, 'embedding_dim': 64, 'lr': 0.0010193114088728706, 'lambda_val': 1.6012413972032166e-05, 'batch_size': 664, 'optimizer': 'Adam'}.
2026-05-23 02:21:00,031 - experiment_functions - INFO - Early stopping at epoch 600. Best Metrics: (0.02706498594511079, 0.016475409836065574, 0.02309421208880317)
2026-05-23 02:21:00,130 - optuna.study.study - INFO - Trial 168 finished with values: [0.02706498594511079, 0.016475409836065574, 0.02309421208880317] and parameters: {'n_layers': 3, 'embedding_dim': 128, 'lr': 0.0010193114088728706, 'lambda_val': 0.00040097660300078195, 'batch_size': 1698, 'optimizer': 'RMSprop'}.
2026-05-23 02:21:03,935 - experiment_functions - INFO - Early stopping at epoch 1050. Best Metrics: (0.017565182763593912, 0.010491803278688525, 0.015706305163949327)
