2026-05-23 03:25:47,828 - optuna.study.study - INFO - Trial 175 finished with values: [0.06523188086669751, 0.03991803278688525, 0.06116961327340727] and parameters: {'n_layers': 1, 'embedding_dim': 32, 'lr': 0.0005051991365347398, 'lambda_val': 0.00018385882411773826, 'batch_size': 4091, 'optimizer': 'Adam'}.
2026-05-23 03:25:55,419 - experiment_functions - INFO - Early stopping at epoch 2500. Best Metrics: (0.0508965791470982, 0.028524590163934424, 0.04458829570670973)
2026-05-23 03:25:55,485 - optuna.study.study - INFO - Trial 176 finished with values: [0.0508965791470982, 0.028524590163934424, 0.04458829570670973] and parameters: {'n_layers': 1, 'embedding_dim': 96, 'lr': 0.006527724949170866, 'lambda_val': 0.003792790860273115, 'batch_size': 825, 'optimizer': 'RMSprop'}.
2026-05-23 03:25:58,080 - experiment_functions - INFO - Early stopping at epoch 600. Best Metrics: (0.09689548345744065, 0.0478688524590164, 0.08151579379649355)
2026-05-23 03:25:58,171 - optuna.study.study - INFO - Trial 177 finished with values: [0.09689548345744065, 0.0478688524590164, 0.08151579379649355] and parameters: {'n_layers': 1, 'embedding_dim': 128, 'lr': 0.0031305185360713038, 'lambda_val': 8.70357449478779e-06, 'batch_size': 2924, 'optimizer': 'Adam'}.
2026-05-23 03:26:00,176 - experiment_functions - INFO - Early stopping at epoch 550. Best Metrics: (0.045297546583196104, 0.024672131147540986, 0.035386710537027716)
2026-05-23 03:26:00,255 - optuna.study.study - INFO - Trial 178 finished with values: [0.045297546583196104, 0.024672131147540986, 0.035386710537027716] and parameters: {'n_layers': 1, 'embedding_dim': 32, 'lr': 0.017768633999709002, 'lambda_val': 0.00549729113611209, 'batch_size': 1100, 'optimizer': 'Adam'}.
2026-05-23 03:26:04,303 - experiment_functions - INFO - Early stopping at epoch 1300. Best Metrics: (0.0872022317246053, 0.04663934426229509, 0.06990459717393792)
2026-05-23 03:26:04,384 - optuna.study.study - INFO - Trial 179 finished with values: [0.0872022317246053, 0.04663934426229509, 0.06990459717393792] and parameters: {'n_layers': 1, 'embedding_dim': 64, 'lr': 0.0005051991365347398, 'lambda_val': 0.003682953748927488, 'batch_size': 2913, 'optimizer': 'RMSprop'}.
2026-05-23 03:26:08,879 - experiment_functions - INFO - Early stopping at epoch 1600. Best Metrics: (0.10515658501874846, 0.05245901639344262, 0.08852889480558025)
2026-05-23 03:26:09,779 - optuna.study.study - INFO - Trial 180 finished with values: [0.10515658501874846, 0.05245901639344262, 0.08852889480558025] and parameters: {'n_layers': 1, 'embedding_dim': 32, 'lr': 0.0007646684933610155, 'lambda_val': 0.0021605260106213964, 'batch_size': 1429, 'optimizer': 'Adam'}.
2026-05-23 03:26:26,776 - experiment_functions - INFO - Early stopping at epoch 3750. Best Metrics: (0.09797196487735768, 0.050491803278688525, 0.07820665704762585)
2026-05-23 03:26:26,848 - optuna.study.study - INFO - Trial 181 finished with values: [0.09797196487735768, 0.050491803278688525, 0.07820665704762585] and parameters: {'n_layers': 1, 'embedding_dim': 128, 'lr': 0.000293040961262534, 'lambda_val': 0.003966779220729784, 'batch_size': 2913, 'optimizer': 'Adam'}.
2026-05-23 03:26:29,410 - experiment_functions - INFO - Early stopping at epoch 600. Best Metrics: (0.08033289913231327, 0.04139344262295082, 0.06695356917672937)
2026-05-23 03:26:29,545 - optuna.study.study - INFO - Trial 182 finished with values: [0.08033289913231327, 0.04139344262295082, 0.06695356917672937] and parameters: {'n_layers': 1, 'embedding_dim': 32, 'lr': 0.0031305185360713038, 'lambda_val': 8.70357449478779e-06, 'batch_size': 2924, 'optimizer': 'Adam'}.
2026-05-23 03:26:32,613 - experiment_functions - INFO - Early stopping at epoch 600. Best Metrics: (0.07024394310889037, 0.039180327868852456, 0.05778135339940972)
2026-05-23 03:26:32,730 - optuna.study.study - INFO - Trial 183 finished with values: [0.07024394310889037, 0.039180327868852456, 0.05778135339940972] and parameters: {'n_layers': 1, 'embedding_dim': 32, 'lr': 0.0031305185360713038, 'lambda_val': 0.003966779220729784, 'batch_size': 1809, 'optimizer': 'RMSprop'}.
2026-05-23 03:26:35,070 - experiment_functions - INFO - Early stopping at epoch 500. Best Metrics: (0.002677965149086549, 0.002213114754098361, 0.0028927850001365944)
2026-05-23 03:26:35,150 - optuna.study.study - INFO - Trial 184 finished with values: [0.002677965149086549, 0.002213114754098361, 0.0028927850001365944] and parameters: {'n_layers': 1, 'embedding_dim': 32, 'lr': 7.783118449295183e-05, 'lambda_val': 0.00018385882411773826, 'batch_size': 3013, 'optimizer': 'SGD'}.
2026-05-23 03:26:42,878 - experiment_functions - INFO - Early stopping at epoch 2300. Best Metrics: (0.10544401291140704, 0.05319672131147542, 0.0885165114521088)
2026-05-23 03:26:43,011 - optuna.study.study - INFO - Trial 185 finished with values: [0.10544401291140704, 0.05319672131147542, 0.0885165114521088] and parameters: {'n_layers': 1, 'embedding_dim': 64, 'lr': 0.0005051991365347398, 'lambda_val': 0.00018385882411773826, 'batch_size': 3013, 'optimizer': 'Adam'}.
2026-05-23 03:26:46,350 - experiment_functions - INFO - Early stopping at epoch 600. Best Metrics: (0.025612899691980055, 0.01680327868852459, 0.02561625476528048)
2026-05-23 03:26:46,443 - optuna.study.study - INFO - Trial 186 finished with values: [0.025612899691980055, 0.01680327868852459, 0.02561625476528048] and parameters: {'n_layers': 4, 'embedding_dim': 64, 'lr': 0.0011231897304398494, 'lambda_val': 8.029603261406284e-05, 'batch_size': 2798, 'optimizer': 'RMSprop'}.
2026-05-23 03:27:01,679 - optuna.study.study - INFO - Trial 187 finished with values: [0.06887330247810723, 0.03901639344262295, 0.05874609769218322] and parameters: {'n_layers': 1, 'embedding_dim': 256, 'lr': 0.0684810830759299, 'lambda_val': 0.003792790860273115, 'batch_size': 1921, 'optimizer': 'Adam'}.
2026-05-23 03:27:09,918 - experiment_functions - INFO - Early stopping at epoch 2500. Best Metrics: (0.1041008101693112, 0.052950819672131146, 0.0877749491933222)
2026-05-23 03:27:10,374 - optuna.study.study - INFO - Trial 188 finished with values: [0.1041008101693112, 0.052950819672131146, 0.0877749491933222] and parameters: {'n_layers': 1, 'embedding_dim': 32, 'lr': 0.0005051991365347398, 'lambda_val': 8.474115370818157e-05, 'batch_size': 2924, 'optimizer': 'Adam'}.
2026-05-23 03:27:19,064 - experiment_functions - INFO - Early stopping at epoch 2450. Best Metrics: (0.09191755011923722, 0.05, 0.07928885160091484)
2026-05-23 03:27:19,213 - optuna.study.study - INFO - Trial 189 finished with values: [0.09191755011923722, 0.05, 0.07928885160091484] and parameters: {'n_layers': 1, 'embedding_dim': 128, 'lr': 0.000293040961262534, 'lambda_val': 0.001089705043918853, 'batch_size': 3128, 'optimizer': 'RMSprop'}.
2026-05-23 03:27:21,780 - experiment_functions - INFO - Early stopping at epoch 600. Best Metrics: (0.020532680985826696, 0.01975409836065574, 0.02219292225664281)
2026-05-23 03:27:21,919 - optuna.study.study - INFO - Trial 190 finished with values: [0.020532680985826696, 0.01975409836065574, 0.02219292225664281] and parameters: {'n_layers': 1, 'embedding_dim': 32, 'lr': 0.001714769855795085, 'lambda_val': 0.09486054723379006, 'batch_size': 2913, 'optimizer': 'RMSprop'}.
2026-05-23 03:27:24,235 - experiment_functions - INFO - Early stopping at epoch 550. Best Metrics: (0.06334145043086517, 0.03459016393442623, 0.056569348091823235)
2026-05-23 03:27:24,341 - optuna.study.study - INFO - Trial 191 finished with values: [0.06334145043086517, 0.03459016393442623, 0.056569348091823235] and parameters: {'n_layers': 1, 'embedding_dim': 32, 'lr': 0.0031305185360713038, 'lambda_val': 1.3383838105435522e-06, 'batch_size': 2913, 'optimizer': 'RMSprop'}.
2026-05-23 03:27:29,098 - experiment_functions - INFO - Early stopping at epoch 1300. Best Metrics: (0.08858698220342553, 0.04680327868852459, 0.07365219504452637)
2026-05-23 03:27:29,459 - optuna.study.study - INFO - Trial 192 finished with values: [0.08858698220342553, 0.04680327868852459, 0.07365219504452637] and parameters: {'n_layers': 1, 'embedding_dim': 64, 'lr': 0.0006141623244842363, 'lambda_val': 0.00012928174782861758, 'batch_size': 2913, 'optimizer': 'RMSprop'}.
2026-05-23 03:27:32,019 - experiment_functions - INFO - Early stopping at epoch 550. Best Metrics: (0.1001261150861064, 0.04647540983606557, 0.08149757554643887)
2026-05-23 03:27:32,112 - optuna.study.study - INFO - Trial 193 finished with values: [0.1001261150861064, 0.04647540983606557, 0.08149757554643887] and parameters: {'n_layers': 1, 'embedding_dim': 96, 'lr': 0.001917913774554907, 'lambda_val': 2.27009302283491e-06, 'batch_size': 3527, 'optimizer': 'RMSprop'}.
2026-05-23 03:27:37,816 - experiment_functions - INFO - Early stopping at epoch 1650. Best Metrics: (0.10290707747022823, 0.05147540983606557, 0.08368946272537439)
2026-05-23 03:27:38,341 - optuna.study.study - INFO - Trial 194 finished with values: [0.10290707747022823, 0.05147540983606557, 0.08368946272537439] and parameters: {'n_layers': 1, 'embedding_dim': 64, 'lr': 0.0005051991365347398, 'lambda_val': 0.00012928174782861758, 'batch_size': 2913, 'optimizer': 'RMSprop'}.
2026-05-23 03:27:49,483 - experiment_functions - INFO - Early stopping at epoch 3000. Best Metrics: (0.04447853921016223, 0.030163934426229506, 0.042491023263076584)
2026-05-23 03:27:50,159 - optuna.study.study - INFO - Trial 195 finished with values: [0.04447853921016223, 0.030163934426229506, 0.042491023263076584] and parameters: {'n_layers': 1, 'embedding_dim': 256, 'lr': 0.05127434843395431, 'lambda_val': 0.021930849416017365, 'batch_size': 1091, 'optimizer': 'RMSprop'}.
2026-05-23 03:28:03,856 - optuna.study.study - INFO - Trial 196 finished with values: [0.06749020610247648, 0.038688524590163934, 0.058603191307205454] and parameters: {'n_layers': 1, 'embedding_dim': 32, 'lr': 0.00021523829821246926, 'lambda_val': 0.01488744756343836, 'batch_size': 1702, 'optimizer': 'RMSprop'}.
2026-05-23 03:28:14,961 - experiment_functions - INFO - Early stopping at epoch 3500. Best Metrics: (0.0015502620150474565, 0.0017213114754098362, 0.0023278161382454575)
2026-05-23 03:28:15,233 - optuna.study.study - INFO - Trial 197 finished with values: [0.0015502620150474565, 0.0017213114754098362, 0.0023278161382454575] and parameters: {'n_layers': 1, 'embedding_dim': 96, 'lr': 3.395942348407495e-05, 'lambda_val': 0.0007186463755590673, 'batch_size': 3274, 'optimizer': 'RMSprop'}.
2026-05-23 03:28:27,573 - optuna.study.study - INFO - Trial 198 finished with values: [0.10109860784622791, 0.05327868852459016, 0.08925902474249285] and parameters: {'n_layers': 1, 'embedding_dim': 64, 'lr': 0.000293040961262534, 'lambda_val': 0.003966779220729784, 'batch_size': 1355, 'optimizer': 'Adam'}.
2026-05-23 03:28:32,124 - experiment_functions - INFO - Early stopping at epoch 1150. Best Metrics: (0.09188309322077812, 0.04581967213114754, 0.07891865387982708)
2026-05-23 03:28:32,233 - optuna.study.study - INFO - Trial 199 finished with values: [0.09188309322077812, 0.04581967213114754, 0.07891865387982708] and parameters: {'n_layers': 1, 'embedding_dim': 128, 'lr': 0.0004969264317801683, 'lambda_val': 0.00018385882411773826, 'batch_size': 3009, 'optimizer': 'RMSprop'}.
2026-05-23 03:28:36,933 - experiment_functions - INFO - Early stopping at epoch 1000. Best Metrics: (0.11271135452634544, 0.053360655737704925, 0.08939661927176458)
2026-05-23 03:28:37,583 - optuna.study.study - INFO - Trial 200 finished with values: [0.11271135452634544, 0.053360655737704925, 0.08939661927176458] and parameters: {'n_layers': 1, 'embedding_dim': 256, 'lr': 0.0005051991365347398, 'lambda_val': 0.00012928174782861758, 'batch_size': 3013, 'optimizer': 'RMSprop'}.
2026-05-23 03:28:43,128 - experiment_functions - INFO - Early stopping at epoch 1550. Best Metrics: (0.0033281286568596006, 0.002377049180327869, 0.0031301160386951197)
2026-05-23 03:28:43,210 - optuna.study.study - INFO - Trial 201 finished with values: [0.0033281286568596006, 0.002377049180327869, 0.0031301160386951197] and parameters: {'n_layers': 1, 'embedding_dim': 128, 'lr': 1.2084756840411245e-05, 'lambda_val': 8.474115370818157e-05, 'batch_size': 3009, 'optimizer': 'Adam'}.
2026-05-23 03:28:45,007 - experiment_functions - INFO - Early stopping at epoch 500. Best Metrics: (0.0025738154681450996, 0.0013934426229508198, 0.0019498789818511027)
2026-05-23 03:28:45,090 - optuna.study.study - INFO - Trial 202 finished with values: [0.0025738154681450996, 0.0013934426229508198, 0.0019498789818511027] and parameters: {'n_layers': 1, 'embedding_dim': 32, 'lr': 0.0007646684933610155, 'lambda_val': 0.000137344748672732, 'batch_size': 1429, 'optimizer': 'SGD'}.
2026-05-23 03:28:47,285 - experiment_functions - INFO - Early stopping at epoch 600. Best Metrics: (0.07361250595000489, 0.03885245901639344, 0.06636083793427891)
2026-05-23 03:28:47,378 - optuna.study.study - INFO - Trial 203 finished with values: [0.07361250595000489, 0.03885245901639344, 0.06636083793427891] and parameters: {'n_layers': 1, 'embedding_dim': 32, 'lr': 0.0031305185360713038, 'lambda_val': 0.00012928174782861758, 'batch_size': 1921, 'optimizer': 'Adam'}.
2026-05-23 03:28:53,524 - experiment_functions - INFO - Early stopping at epoch 1950. Best Metrics: (0.11210014172550974, 0.05508196721311476, 0.09306413658563333)
2026-05-23 03:28:53,679 - optuna.study.study - INFO - Trial 204 finished with values: [0.11210014172550974, 0.05508196721311476, 0.09306413658563333] and parameters: {'n_layers': 1, 'embedding_dim': 128, 'lr': 0.0005051991365347398, 'lambda_val': 0.00012928174782861758, 'batch_size': 1510, 'optimizer': 'RMSprop'}.
2026-05-23 03:28:55,703 - experiment_functions - INFO - Early stopping at epoch 500. Best Metrics: (0.0025719786109486757, 0.001557377049180328, 0.0018282716973004871)
2026-05-23 03:28:55,891 - optuna.study.study - INFO - Trial 205 finished with values: [0.0025719786109486757, 0.001557377049180328, 0.0018282716973004871] and parameters: {'n_layers': 1, 'embedding_dim': 64, 'lr': 0.0005051991365347398, 'lambda_val': 0.00012928174782861758, 'batch_size': 2924, 'optimizer': 'SGD'}.
2026-05-23 03:29:11,772 - optuna.study.study - INFO - Trial 206 finished with values: [0.0023191575114574862, 0.002377049180327869, 0.002863923324596898] and parameters: {'n_layers': 3, 'embedding_dim': 96, 'lr': 1.6594324190468484e-05, 'lambda_val': 0.0021605260106213964, 'batch_size': 3903, 'optimizer': 'Adam'}.
2026-05-23 03:29:22,785 - experiment_functions - INFO - Early stopping at epoch 3650. Best Metrics: (0.09481509379942457, 0.04959016393442623, 0.08316264405032595)
2026-05-23 03:29:23,226 - optuna.study.study - INFO - Trial 207 finished with values: [0.09481509379942457, 0.04959016393442623, 0.08316264405032595] and parameters: {'n_layers': 1, 'embedding_dim': 64, 'lr': 0.000293040961262534, 'lambda_val': 0.003966779220729784, 'batch_size': 1355, 'optimizer': 'Adam'}.
2026-05-23 03:29:35,961 - experiment_functions - INFO - Early stopping at epoch 2350. Best Metrics: (0.07591247702210015, 0.043852459016393446, 0.06803771461409452)
2026-05-23 03:29:36,194 - optuna.study.study - INFO - Trial 208 finished with values: [0.07591247702210015, 0.043852459016393446, 0.06803771461409452] and parameters: {'n_layers': 1, 'embedding_dim': 128, 'lr': 0.000293040961262534, 'lambda_val': 0.005672765240199157, 'batch_size': 3527, 'optimizer': 'Adam'}.
2026-05-23 03:29:41,495 - experiment_functions - INFO - Early stopping at epoch 1400. Best Metrics: (0.08807901516192954, 0.04745901639344262, 0.08245483219154767)
2026-05-23 03:29:41,633 - optuna.study.study - INFO - Trial 209 finished with values: [0.08807901516192954, 0.04745901639344262, 0.08245483219154767] and parameters: {'n_layers': 1, 'embedding_dim': 128, 'lr': 0.000293040961262534, 'lambda_val': 0.003966779220729784, 'batch_size': 3128, 'optimizer': 'RMSprop'}.
2026-05-23 03:29:44,361 - experiment_functions - INFO - Early stopping at epoch 650. Best Metrics: (0.08559091144337909, 0.04704918032786885, 0.07801610102160979)
2026-05-23 03:29:44,468 - optuna.study.study - INFO - Trial 210 finished with values: [0.08559091144337909, 0.04704918032786885, 0.07801610102160979] and parameters: {'n_layers': 1, 'embedding_dim': 32, 'lr': 0.0031305185360713038, 'lambda_val': 8.70357449478779e-06, 'batch_size': 2924, 'optimizer': 'Adam'}.
2026-05-23 03:29:50,633 - experiment_functions - INFO - Early stopping at epoch 1600. Best Metrics: (0.08346492761131998, 0.04352459016393443, 0.07318791401202888)
2026-05-23 03:29:51,544 - optuna.study.study - INFO - Trial 211 finished with values: [0.08346492761131998, 0.04352459016393443, 0.07318791401202888] and parameters: {'n_layers': 2, 'embedding_dim': 64, 'lr': 0.0005051991365347398, 'lambda_val': 3.3377771113138e-05, 'batch_size': 1809, 'optimizer': 'Adam'}.
2026-05-23 03:29:55,439 - experiment_functions - INFO - Early stopping at epoch 1000. Best Metrics: (0.09779030344285401, 0.05081967213114754, 0.08422738144896841)
2026-05-23 03:29:55,528 - optuna.study.study - INFO - Trial 212 finished with values: [0.09779030344285401, 0.05081967213114754, 0.08422738144896841] and parameters: {'n_layers': 1, 'embedding_dim': 64, 'lr': 0.0007646684933610155, 'lambda_val': 0.0006383294603067735, 'batch_size': 4016, 'optimizer': 'Adam'}.
2026-05-23 03:29:58,826 - experiment_functions - INFO - Early stopping at epoch 700. Best Metrics: (0.10885906802610047, 0.05311475409836067, 0.0919996871058988)
2026-05-23 03:29:59,430 - optuna.study.study - INFO - Trial 213 finished with values: [0.10885906802610047, 0.05311475409836067, 0.0919996871058988] and parameters: {'n_layers': 1, 'embedding_dim': 128, 'lr': 0.001917913774554907, 'lambda_val': 2.27009302283491e-06, 'batch_size': 3527, 'optimizer': 'Adam'}.
2026-05-23 03:30:03,373 - experiment_functions - INFO - Early stopping at epoch 700. Best Metrics: (0.029256885933894285, 0.016475409836065574, 0.02749257168606104)
2026-05-23 03:30:04,384 - optuna.study.study - INFO - Trial 214 finished with values: [0.029256885933894285, 0.016475409836065574, 0.02749257168606104] and parameters: {'n_layers': 2, 'embedding_dim': 256, 'lr': 0.0025569316205861954, 'lambda_val': 2.111115782689415e-06, 'batch_size': 1921, 'optimizer': 'RMSprop'}.
2026-05-23 03:30:08,524 - experiment_functions - INFO - Early stopping at epoch 900. Best Metrics: (0.10638695350408285, 0.05221311475409836, 0.09112796848302133)
2026-05-23 03:30:09,631 - optuna.study.study - INFO - Trial 215 finished with values: [0.10638695350408285, 0.05221311475409836, 0.09112796848302133] and parameters: {'n_layers': 1, 'embedding_dim': 256, 'lr': 0.0005051991365347398, 'lambda_val': 0.003966779220729784, 'batch_size': 1921, 'optimizer': 'RMSprop'}.
2026-05-23 03:30:18,258 - experiment_functions - INFO - Early stopping at epoch 1250. Best Metrics: (0.07526919760794347, 0.04057377049180328, 0.06443403888747436)
2026-05-23 03:30:19,023 - optuna.study.study - INFO - Trial 216 finished with values: [0.07526919760794347, 0.04057377049180328, 0.06443403888747436] and parameters: {'n_layers': 2, 'embedding_dim': 32, 'lr': 0.0004969264317801683, 'lambda_val': 0.001406127343986641, 'batch_size': 1809, 'optimizer': 'RMSprop'}.
2026-05-23 03:30:25,390 - experiment_functions - INFO - Early stopping at epoch 1850. Best Metrics: (0.09642328516829529, 0.04844262295081968, 0.0795136093408212)
2026-05-23 03:30:25,970 - optuna.study.study - INFO - Trial 217 finished with values: [0.09642328516829529, 0.04844262295081968, 0.0795136093408212] and parameters: {'n_layers': 1, 'embedding_dim': 32, 'lr': 0.0005051991365347398, 'lambda_val': 6.426340693845084e-05, 'batch_size': 4091, 'optimizer': 'Adam'}.
2026-05-23 03:30:29,653 - experiment_functions - INFO - Early stopping at epoch 550. Best Metrics: (0.017553623066478948, 0.012950819672131148, 0.0181740094865333)
2026-05-23 03:30:29,745 - optuna.study.study - INFO - Trial 218 finished with values: [0.017553623066478948, 0.012950819672131148, 0.0181740094865333] and parameters: {'n_layers': 4, 'embedding_dim': 128, 'lr': 0.0031305185360713038, 'lambda_val': 2.27009302283491e-06, 'batch_size': 2924, 'optimizer': 'RMSprop'}.
2026-05-23 03:30:36,323 - experiment_functions - INFO - Early stopping at epoch 1200. Best Metrics: (0.03172542033201967, 0.018852459016393444, 0.026676297328922235)
2026-05-23 03:30:36,395 - optuna.study.study - INFO - Trial 219 finished with values: [0.03172542033201967, 0.018852459016393444, 0.026676297328922235] and parameters: {'n_layers': 4, 'embedding_dim': 128, 'lr': 0.000293040961262534, 'lambda_val': 0.0021605260106213964, 'batch_size': 2924, 'optimizer': 'Adam'}.
2026-05-23 03:30:38,941 - experiment_functions - INFO - Early stopping at epoch 550. Best Metrics: (0.057382740817349766, 0.026721311475409838, 0.045746430043604965)
2026-05-23 03:30:39,075 - optuna.study.study - INFO - Trial 220 finished with values: [0.057382740817349766, 0.026721311475409838, 0.045746430043604965] and parameters: {'n_layers': 1, 'embedding_dim': 128, 'lr': 0.019650033412506894, 'lambda_val': 0.00012928174782861758, 'batch_size': 1921, 'optimizer': 'Adam'}.
2026-05-23 03:30:44,397 - experiment_functions - INFO - Early stopping at epoch 1600. Best Metrics: (0.0032253313561480795, 0.001967213114754099, 0.0031897106051788737)
2026-05-23 03:30:44,744 - optuna.study.study - INFO - Trial 221 finished with values: [0.0032253313561480795, 0.001967213114754099, 0.0031897106051788737] and parameters: {'n_layers': 1, 'embedding_dim': 32, 'lr': 1.0847316613069792e-05, 'lambda_val': 8.70357449478779e-06, 'batch_size': 2924, 'optimizer': 'Adam'}.
2026-05-23 03:30:57,203 - optuna.study.study - INFO - Trial 222 finished with values: [0.10506868255709781, 0.05573770491803279, 0.09075884083312323] and parameters: {'n_layers': 1, 'embedding_dim': 128, 'lr': 0.000293040961262534, 'lambda_val': 0.003966779220729784, 'batch_size': 1660, 'optimizer': 'Adam'}.
