2026-05-23 03:11:28,698 - optuna.study.study - INFO - Trial 35 finished with values: [0.0029776229399308377, 0.0019672131147540984, 0.0034519275600098285] and parameters: {'n_layers': 4, 'embedding_dim': 64, 'lr': 1.3253835776045699e-05, 'lambda_val': 0.0036351530418377537, 'batch_size': 2927, 'optimizer': 'RMSprop'}.
2026-05-23 03:11:33,287 - experiment_functions - INFO - Early stopping at epoch 1650. Best Metrics: (0.01460812469606999, 0.016475409836065574, 0.020862467087933486)
2026-05-23 03:11:33,480 - optuna.study.study - INFO - Trial 36 finished with values: [0.01460812469606999, 0.016475409836065574, 0.020862467087933486] and parameters: {'n_layers': 1, 'embedding_dim': 64, 'lr': 0.017768633999709002, 'lambda_val': 0.0858467956200004, 'batch_size': 2059, 'optimizer': 'Adam'}.
2026-05-23 03:11:36,122 - experiment_functions - INFO - Early stopping at epoch 500. Best Metrics: (0.0017696814678501243, 0.0017213114754098362, 0.00215773858385689)
2026-05-23 03:11:36,211 - optuna.study.study - INFO - Trial 37 finished with values: [0.0017696814678501243, 0.0017213114754098362, 0.00215773858385689] and parameters: {'n_layers': 1, 'embedding_dim': 32, 'lr': 2.544377968028041e-05, 'lambda_val': 3.6687448305351913e-06, 'batch_size': 2660, 'optimizer': 'SGD'}.
2026-05-23 03:11:38,853 - experiment_functions - INFO - Early stopping at epoch 500. Best Metrics: (0.004393340446297902, 0.002295081967213115, 0.0037815771924686204)
2026-05-23 03:11:38,953 - optuna.study.study - INFO - Trial 38 finished with values: [0.004393340446297902, 0.002295081967213115, 0.0037815771924686204] and parameters: {'n_layers': 3, 'embedding_dim': 128, 'lr': 0.015061842757370438, 'lambda_val': 0.0022196356459980807, 'batch_size': 1951, 'optimizer': 'SGD'}.
2026-05-23 03:11:44,808 - experiment_functions - INFO - Early stopping at epoch 1550. Best Metrics: (0.019753281641675707, 0.014426229508196723, 0.018323948417142896)
2026-05-23 03:11:45,951 - optuna.study.study - INFO - Trial 39 finished with values: [0.019753281641675707, 0.014426229508196723, 0.018323948417142896] and parameters: {'n_layers': 3, 'embedding_dim': 64, 'lr': 0.046700360059710164, 'lambda_val': 0.00593373053842378, 'batch_size': 3522, 'optimizer': 'RMSprop'}.
2026-05-23 03:11:51,928 - experiment_functions - INFO - Early stopping at epoch 1400. Best Metrics: (0.04148015672127796, 0.023688524590163938, 0.03504517928813255)
2026-05-23 03:11:52,262 - optuna.study.study - INFO - Trial 40 finished with values: [0.04148015672127796, 0.023688524590163938, 0.03504517928813255] and parameters: {'n_layers': 4, 'embedding_dim': 64, 'lr': 0.0003085416137069091, 'lambda_val': 8.029603261406284e-05, 'batch_size': 3903, 'optimizer': 'RMSprop'}.
2026-05-23 03:11:55,282 - experiment_functions - INFO - Early stopping at epoch 850. Best Metrics: (0.027847084002491973, 0.023278688524590162, 0.03182349913195764)
2026-05-23 03:11:55,874 - optuna.study.study - INFO - Trial 41 finished with values: [0.027847084002491973, 0.023278688524590162, 0.03182349913195764] and parameters: {'n_layers': 1, 'embedding_dim': 64, 'lr': 0.0005051991365347398, 'lambda_val': 0.08435118404967043, 'batch_size': 2913, 'optimizer': 'RMSprop'}.
2026-05-23 03:11:58,905 - experiment_functions - INFO - Early stopping at epoch 800. Best Metrics: (0.02929719130987322, 0.012459016393442622, 0.021026287036771913)
2026-05-23 03:11:59,008 - optuna.study.study - INFO - Trial 42 finished with values: [0.02929719130987322, 0.012459016393442622, 0.021026287036771913] and parameters: {'n_layers': 2, 'embedding_dim': 64, 'lr': 0.01164548533263704, 'lambda_val': 0.00012928174782861758, 'batch_size': 1643, 'optimizer': 'RMSprop'}.
2026-05-23 03:12:01,063 - experiment_functions - INFO - Early stopping at epoch 550. Best Metrics: (0.05554153500512723, 0.028852459016393446, 0.049331624047077895)
2026-05-23 03:12:01,165 - optuna.study.study - INFO - Trial 43 finished with values: [0.05554153500512723, 0.028852459016393446, 0.049331624047077895] and parameters: {'n_layers': 1, 'embedding_dim': 32, 'lr': 0.006343661696405227, 'lambda_val': 0.00018385882411773826, 'batch_size': 3009, 'optimizer': 'RMSprop'}.
2026-05-23 03:12:04,600 - experiment_functions - INFO - Early stopping at epoch 750. Best Metrics: (0.035524159524207094, 0.01901639344262295, 0.0271430004215381)
2026-05-23 03:12:04,946 - optuna.study.study - INFO - Trial 44 finished with values: [0.035524159524207094, 0.01901639344262295, 0.0271430004215381] and parameters: {'n_layers': 4, 'embedding_dim': 64, 'lr': 0.0008554339753230373, 'lambda_val': 0.0006383294603067735, 'batch_size': 2528, 'optimizer': 'Adam'}.
2026-05-23 03:12:07,144 - experiment_functions - INFO - Early stopping at epoch 500. Best Metrics: (0.0018368462711888024, 0.001967213114754099, 0.002161394918379098)
2026-05-23 03:12:07,239 - optuna.study.study - INFO - Trial 45 finished with values: [0.0018368462711888024, 0.001967213114754099, 0.002161394918379098] and parameters: {'n_layers': 3, 'embedding_dim': 32, 'lr': 0.017937765861601472, 'lambda_val': 0.06273015712638838, 'batch_size': 1757, 'optimizer': 'SGD'}.
2026-05-23 03:12:10,084 - experiment_functions - INFO - Early stopping at epoch 500. Best Metrics: (0.002701269983650597, 0.0017213114754098362, 0.0027005711064119887)
2026-05-23 03:12:11,065 - optuna.study.study - INFO - Trial 46 finished with values: [0.002701269983650597, 0.0017213114754098362, 0.0027005711064119887] and parameters: {'n_layers': 2, 'embedding_dim': 256, 'lr': 0.00023475121049979693, 'lambda_val': 0.0671979645136365, 'batch_size': 2535, 'optimizer': 'SGD'}.
2026-05-23 03:12:14,045 - experiment_functions - INFO - Early stopping at epoch 550. Best Metrics: (0.021088011184731578, 0.00959016393442623, 0.015805881899491003)
2026-05-23 03:12:14,249 - optuna.study.study - INFO - Trial 47 finished with values: [0.021088011184731578, 0.00959016393442623, 0.015805881899491003] and parameters: {'n_layers': 4, 'embedding_dim': 96, 'lr': 0.034485584124371305, 'lambda_val': 0.0010831802731174698, 'batch_size': 565, 'optimizer': 'Adam'}.
2026-05-23 03:12:25,239 - experiment_functions - INFO - Early stopping at epoch 1600. Best Metrics: (0.040745061851388084, 0.026557377049180327, 0.03640636773846605)
2026-05-23 03:12:25,604 - optuna.study.study - INFO - Trial 48 finished with values: [0.040745061851388084, 0.026557377049180327, 0.03640636773846605] and parameters: {'n_layers': 3, 'embedding_dim': 64, 'lr': 0.00021523829821246926, 'lambda_val': 0.01488744756343836, 'batch_size': 1702, 'optimizer': 'RMSprop'}.
2026-05-23 03:12:32,800 - experiment_functions - INFO - Early stopping at epoch 500. Best Metrics: (0.0010973137540629823, 0.0009016393442622952, 0.001278019016733199)
2026-05-23 03:12:33,693 - optuna.study.study - INFO - Trial 49 finished with values: [0.0010973137540629823, 0.0009016393442622952, 0.001278019016733199] and parameters: {'n_layers': 3, 'embedding_dim': 256, 'lr': 0.07114169523494483, 'lambda_val': 0.016624606918159788, 'batch_size': 1704, 'optimizer': 'SGD'}.
2026-05-23 03:12:38,921 - experiment_functions - INFO - Early stopping at epoch 1050. Best Metrics: (0.021231902668780937, 0.014836065573770494, 0.020923158027371016)
2026-05-23 03:12:39,731 - optuna.study.study - INFO - Trial 50 finished with values: [0.021231902668780937, 0.014836065573770494, 0.020923158027371016] and parameters: {'n_layers': 3, 'embedding_dim': 96, 'lr': 0.0088555932419804, 'lambda_val': 0.00593373053842378, 'batch_size': 3013, 'optimizer': 'RMSprop'}.
2026-05-23 03:12:45,114 - experiment_functions - INFO - Early stopping at epoch 750. Best Metrics: (0.033121232002018226, 0.02040983606557377, 0.028544533289881834)
2026-05-23 03:12:45,215 - optuna.study.study - INFO - Trial 51 finished with values: [0.033121232002018226, 0.02040983606557377, 0.028544533289881834] and parameters: {'n_layers': 4, 'embedding_dim': 256, 'lr': 0.0003085416137069091, 'lambda_val': 8.029603261406284e-05, 'batch_size': 2956, 'optimizer': 'RMSprop'}.
2026-05-23 03:12:47,575 - experiment_functions - INFO - Early stopping at epoch 550. Best Metrics: (0.04958981654608267, 0.03049180327868853, 0.04657347960420407)
2026-05-23 03:12:47,670 - optuna.study.study - INFO - Trial 52 finished with values: [0.04958981654608267, 0.03049180327868853, 0.04657347960420407] and parameters: {'n_layers': 2, 'embedding_dim': 32, 'lr': 0.005792015834107535, 'lambda_val': 0.0005365242793466337, 'batch_size': 3009, 'optimizer': 'Adam'}.
2026-05-23 03:12:56,050 - experiment_functions - INFO - Early stopping at epoch 2000. Best Metrics: (0.042558535059298845, 0.021967213114754094, 0.03349696964391598)
2026-05-23 03:12:56,155 - optuna.study.study - INFO - Trial 53 finished with values: [0.042558535059298845, 0.021967213114754094, 0.03349696964391598] and parameters: {'n_layers': 4, 'embedding_dim': 64, 'lr': 0.000293040961262534, 'lambda_val': 0.00017177635476580495, 'batch_size': 3527, 'optimizer': 'Adam'}.
2026-05-23 03:13:00,734 - experiment_functions - INFO - Early stopping at epoch 1400. Best Metrics: (0.08118392559500008, 0.04073770491803279, 0.06454843080098539)
2026-05-23 03:13:01,191 - optuna.study.study - INFO - Trial 54 finished with values: [0.08118392559500008, 0.04073770491803279, 0.06454843080098539] and parameters: {'n_layers': 2, 'embedding_dim': 32, 'lr': 0.0004969264317801683, 'lambda_val': 0.001406127343986641, 'batch_size': 1809, 'optimizer': 'RMSprop'}.
2026-05-23 03:13:03,810 - experiment_functions - INFO - Early stopping at epoch 600. Best Metrics: (0.06370234014892458, 0.030655737704918033, 0.05194049971861143)
2026-05-23 03:13:03,948 - optuna.study.study - INFO - Trial 55 finished with values: [0.06370234014892458, 0.030655737704918033, 0.05194049971861143] and parameters: {'n_layers': 1, 'embedding_dim': 32, 'lr': 0.006343661696405227, 'lambda_val': 0.00018385882411773826, 'batch_size': 3013, 'optimizer': 'RMSprop'}.
2026-05-23 03:13:09,626 - experiment_functions - INFO - Early stopping at epoch 1850. Best Metrics: (0.10081969998569282, 0.05024590163934426, 0.08572593145600803)
2026-05-23 03:13:09,713 - optuna.study.study - INFO - Trial 56 finished with values: [0.10081969998569282, 0.05024590163934426, 0.08572593145600803] and parameters: {'n_layers': 1, 'embedding_dim': 64, 'lr': 0.0005051991365347398, 'lambda_val': 0.0006383294603067735, 'batch_size': 2528, 'optimizer': 'Adam'}.
2026-05-23 03:13:12,867 - experiment_functions - INFO - Early stopping at epoch 750. Best Metrics: (0.013894081929886672, 0.011885245901639344, 0.014324998025361144)
2026-05-23 03:13:14,102 - optuna.study.study - INFO - Trial 57 finished with values: [0.013894081929886672, 0.011885245901639344, 0.014324998025361144] and parameters: {'n_layers': 4, 'embedding_dim': 32, 'lr': 0.0004969264317801683, 'lambda_val': 0.020146249059107224, 'batch_size': 3274, 'optimizer': 'RMSprop'}.
2026-05-23 03:13:17,094 - experiment_functions - INFO - Early stopping at epoch 500. Best Metrics: (0.0012098660877861505, 0.0015573770491803278, 0.0016864288460700066)
2026-05-23 03:13:17,596 - optuna.study.study - INFO - Trial 58 finished with values: [0.0012098660877861505, 0.0015573770491803278, 0.0016864288460700066] and parameters: {'n_layers': 4, 'embedding_dim': 128, 'lr': 0.06530612456991958, 'lambda_val': 0.00010195670573593226, 'batch_size': 1546, 'optimizer': 'SGD'}.
2026-05-23 03:13:20,347 - experiment_functions - INFO - Early stopping at epoch 850. Best Metrics: (0.002699156324415398, 0.002213114754098361, 0.0034336150543592143)
2026-05-23 03:13:20,481 - optuna.study.study - INFO - Trial 59 finished with values: [0.002699156324415398, 0.002213114754098361, 0.0034336150543592143] and parameters: {'n_layers': 1, 'embedding_dim': 64, 'lr': 4.2980801908422497e-05, 'lambda_val': 0.00012928174782861758, 'batch_size': 1643, 'optimizer': 'RMSprop'}.
2026-05-23 03:13:23,165 - experiment_functions - INFO - Early stopping at epoch 650. Best Metrics: (0.02284422311953024, 0.019098360655737702, 0.02353440534922025)
2026-05-23 03:13:23,301 - optuna.study.study - INFO - Trial 60 finished with values: [0.02284422311953024, 0.019098360655737702, 0.02353440534922025] and parameters: {'n_layers': 3, 'embedding_dim': 32, 'lr': 0.0013687926891068503, 'lambda_val': 0.019304912964587643, 'batch_size': 1462, 'optimizer': 'Adam'}.
2026-05-23 03:13:26,446 - experiment_functions - INFO - Early stopping at epoch 500. Best Metrics: (0.033805801990923055, 0.01680327868852459, 0.02902299032561086)
2026-05-23 03:13:26,563 - optuna.study.study - INFO - Trial 61 finished with values: [0.033805801990923055, 0.01680327868852459, 0.02902299032561086] and parameters: {'n_layers': 4, 'embedding_dim': 128, 'lr': 0.06524143930040716, 'lambda_val': 6.255131917327214e-06, 'batch_size': 3290, 'optimizer': 'RMSprop'}.
2026-05-23 03:13:37,558 - optuna.study.study - INFO - Trial 62 finished with values: [0.011867389740311261, 0.008934426229508198, 0.013139811545544118] and parameters: {'n_layers': 1, 'embedding_dim': 96, 'lr': 8.858495635553385e-05, 'lambda_val': 5.3785186281624496e-06, 'batch_size': 1630, 'optimizer': 'Adam'}.
2026-05-23 03:13:44,108 - experiment_functions - INFO - Early stopping at epoch 1500. Best Metrics: (0.018983137387697073, 0.01344262295081967, 0.017778635678079725)
2026-05-23 03:13:44,351 - optuna.study.study - INFO - Trial 63 finished with values: [0.018983137387697073, 0.01344262295081967, 0.017778635678079725] and parameters: {'n_layers': 3, 'embedding_dim': 96, 'lr': 0.046700360059710164, 'lambda_val': 0.00593373053842378, 'batch_size': 3522, 'optimizer': 'RMSprop'}.
2026-05-23 03:13:58,775 - optuna.study.study - INFO - Trial 64 finished with values: [0.025040679831522878, 0.016229508196721313, 0.02285005094297246] and parameters: {'n_layers': 2, 'embedding_dim': 32, 'lr': 9.519375347266739e-05, 'lambda_val': 1.6553244073465298e-06, 'batch_size': 1841, 'optimizer': 'RMSprop'}.
2026-05-23 03:14:02,713 - experiment_functions - INFO - Early stopping at epoch 500. Best Metrics: (0.020636614925935992, 0.012459016393442624, 0.02009855370756712)
2026-05-23 03:14:02,804 - optuna.study.study - INFO - Trial 65 finished with values: [0.020636614925935992, 0.012459016393442624, 0.02009855370756712] and parameters: {'n_layers': 4, 'embedding_dim': 256, 'lr': 0.01556870865298979, 'lambda_val': 0.0020228422425021294, 'batch_size': 1702, 'optimizer': 'RMSprop'}.
2026-05-23 03:14:05,728 - experiment_functions - INFO - Early stopping at epoch 600. Best Metrics: (0.027085068122223152, 0.018114754098360657, 0.02667714818013687)
2026-05-23 03:14:05,827 - optuna.study.study - INFO - Trial 66 finished with values: [0.027085068122223152, 0.018114754098360657, 0.02667714818013687] and parameters: {'n_layers': 3, 'embedding_dim': 96, 'lr': 0.0016674472847175183, 'lambda_val': 0.003966779220729784, 'batch_size': 3009, 'optimizer': 'RMSprop'}.
2026-05-23 03:14:13,139 - experiment_functions - INFO - Early stopping at epoch 2450. Best Metrics: (0.06086659607516998, 0.036803278688524586, 0.05554789271284051)
2026-05-23 03:14:13,222 - optuna.study.study - INFO - Trial 67 finished with values: [0.06086659607516998, 0.036803278688524586, 0.05554789271284051] and parameters: {'n_layers': 1, 'embedding_dim': 96, 'lr': 0.026301056367902406, 'lambda_val': 0.005672765240199157, 'batch_size': 3274, 'optimizer': 'RMSprop'}.
2026-05-23 03:14:16,164 - experiment_functions - INFO - Early stopping at epoch 500. Best Metrics: (0.0016822051033756273, 0.0013934426229508198, 0.0014462792547073424)
2026-05-23 03:14:16,251 - optuna.study.study - INFO - Trial 68 finished with values: [0.0016822051033756273, 0.0013934426229508198, 0.0014462792547073424] and parameters: {'n_layers': 4, 'embedding_dim': 128, 'lr': 0.015061842757370438, 'lambda_val': 1.5503036430323852e-06, 'batch_size': 1951, 'optimizer': 'SGD'}.
2026-05-23 03:14:19,238 - experiment_functions - INFO - Early stopping at epoch 750. Best Metrics: (0.06721471318978668, 0.036147540983606556, 0.0556184077005614)
2026-05-23 03:14:19,309 - optuna.study.study - INFO - Trial 69 finished with values: [0.06721471318978668, 0.036147540983606556, 0.0556184077005614] and parameters: {'n_layers': 2, 'embedding_dim': 64, 'lr': 0.0019040849385408827, 'lambda_val': 0.0005365242793466337, 'batch_size': 593, 'optimizer': 'Adam'}.
2026-05-23 03:14:22,763 - experiment_functions - INFO - Early stopping at epoch 800. Best Metrics: (0.00484829099037692, 0.00639344262295082, 0.008659140013586919)
2026-05-23 03:14:22,852 - optuna.study.study - INFO - Trial 70 finished with values: [0.00484829099037692, 0.00639344262295082, 0.008659140013586919] and parameters: {'n_layers': 2, 'embedding_dim': 64, 'lr': 0.017768633999709002, 'lambda_val': 0.0858467956200004, 'batch_size': 2059, 'optimizer': 'RMSprop'}.
2026-05-23 03:14:25,347 - experiment_functions - INFO - Early stopping at epoch 550. Best Metrics: (0.05249686554668491, 0.030737704918032786, 0.046633581972192216)
2026-05-23 03:14:25,433 - optuna.study.study - INFO - Trial 71 finished with values: [0.05249686554668491, 0.030737704918032786, 0.046633581972192216] and parameters: {'n_layers': 1, 'embedding_dim': 32, 'lr': 0.017768633999709002, 'lambda_val': 0.001440371353379977, 'batch_size': 1355, 'optimizer': 'Adam'}.
2026-05-23 03:14:31,617 - experiment_functions - INFO - Early stopping at epoch 2150. Best Metrics: (0.10231474565776412, 0.052622950819672144, 0.08705423962073994)
2026-05-23 03:14:31,706 - optuna.study.study - INFO - Trial 72 finished with values: [0.10231474565776412, 0.052622950819672144, 0.08705423962073994] and parameters: {'n_layers': 1, 'embedding_dim': 64, 'lr': 0.0005051991365347398, 'lambda_val': 0.00012928174782861758, 'batch_size': 1921, 'optimizer': 'Adam'}.
2026-05-23 03:14:40,104 - experiment_functions - INFO - Early stopping at epoch 2050. Best Metrics: (0.02733846562734535, 0.017377049180327873, 0.024152006390674136)
2026-05-23 03:14:40,379 - optuna.study.study - INFO - Trial 73 finished with values: [0.02733846562734535, 0.017377049180327873, 0.024152006390674136] and parameters: {'n_layers': 4, 'embedding_dim': 64, 'lr': 0.0003085416137069091, 'lambda_val': 3.6084877322949617e-06, 'batch_size': 3903, 'optimizer': 'Adam'}.
2026-05-23 03:14:55,293 - experiment_functions - INFO - Early stopping at epoch 3400. Best Metrics: (0.008755227064574676, 0.0069672131147540985, 0.008815761127021)
2026-05-23 03:14:55,521 - optuna.study.study - INFO - Trial 74 finished with values: [0.008755227064574676, 0.0069672131147540985, 0.008815761127021] and parameters: {'n_layers': 4, 'embedding_dim': 96, 'lr': 4.5283111815717906e-05, 'lambda_val': 1.5503036430323852e-06, 'batch_size': 4044, 'optimizer': 'Adam'}.
2026-05-23 03:15:05,099 - experiment_functions - INFO - Early stopping at epoch 1400. Best Metrics: (0.04287743823790649, 0.02204918032786885, 0.036232451795417)
2026-05-23 03:15:06,521 - optuna.study.study - INFO - Trial 75 finished with values: [0.04287743823790649, 0.02204918032786885, 0.036232451795417] and parameters: {'n_layers': 4, 'embedding_dim': 256, 'lr': 0.0003085416137069091, 'lambda_val': 1.5503036430323852e-06, 'batch_size': 2442, 'optimizer': 'Adam'}.
2026-05-23 03:15:10,425 - experiment_functions - INFO - Early stopping at epoch 500. Best Metrics: (0.03221350477734475, 0.019590163934426228, 0.03198807672118474)
2026-05-23 03:15:10,689 - optuna.study.study - INFO - Trial 76 finished with values: [0.03221350477734475, 0.019590163934426228, 0.03198807672118474] and parameters: {'n_layers': 4, 'embedding_dim': 256, 'lr': 0.06530612456991958, 'lambda_val': 0.00017177635476580495, 'batch_size': 3340, 'optimizer': 'RMSprop'}.
2026-05-23 03:15:13,782 - experiment_functions - INFO - Early stopping at epoch 500. Best Metrics: (0.026547160880264636, 0.013934426229508197, 0.022162445743970225)
2026-05-23 03:15:13,867 - optuna.study.study - INFO - Trial 77 finished with values: [0.026547160880264636, 0.013934426229508197, 0.022162445743970225] and parameters: {'n_layers': 4, 'embedding_dim': 96, 'lr': 0.05127434843395431, 'lambda_val': 8.029603261406284e-05, 'batch_size': 3013, 'optimizer': 'RMSprop'}.
2026-05-23 03:15:16,660 - experiment_functions - INFO - Early stopping at epoch 700. Best Metrics: (0.09868499436911234, 0.0490983606557377, 0.08112778329127678)
2026-05-23 03:15:17,682 - optuna.study.study - INFO - Trial 78 finished with values: [0.09868499436911234, 0.0490983606557377, 0.08112778329127678] and parameters: {'n_layers': 1, 'embedding_dim': 32, 'lr': 0.0019040849385408827, 'lambda_val': 1.9953918103416195e-06, 'batch_size': 1128, 'optimizer': 'Adam'}.
2026-05-23 03:15:22,142 - experiment_functions - INFO - Early stopping at epoch 1300. Best Metrics: (0.04937023406795493, 0.034508196721311474, 0.04763386197703405)
2026-05-23 03:15:22,443 - optuna.study.study - INFO - Trial 79 finished with values: [0.04937023406795493, 0.034508196721311474, 0.04763386197703405] and parameters: {'n_layers': 1, 'embedding_dim': 128, 'lr': 0.000293040961262534, 'lambda_val': 0.028299411735441895, 'batch_size': 2913, 'optimizer': 'Adam'}.
2026-05-23 03:15:24,714 - experiment_functions - INFO - Early stopping at epoch 500. Best Metrics: (0.002898609502644196, 0.002295081967213115, 0.002846216393868991)
2026-05-23 03:15:24,802 - optuna.study.study - INFO - Trial 80 finished with values: [0.002898609502644196, 0.002295081967213115, 0.002846216393868991] and parameters: {'n_layers': 1, 'embedding_dim': 64, 'lr': 0.0303207708410605, 'lambda_val': 1.4868585084973531e-06, 'batch_size': 3767, 'optimizer': 'SGD'}.
2026-05-23 03:15:27,062 - experiment_functions - INFO - Early stopping at epoch 500. Best Metrics: (0.002542847072329671, 0.0017213114754098362, 0.0028824714965367273)
