2026-05-23 02:49:50,472 - optuna.study.study - INFO - Trial 147 finished with values: [0.04224603904139084, 0.030819672131147544, 0.04326281640352] and parameters: {'n_layers': 2, 'embedding_dim': 96, 'lr': 0.004434110743664845, 'lambda_val': 2.1146074643297403e-05, 'batch_size': 2701, 'optimizer': 'Adam'}.
2026-05-23 02:50:00,326 - experiment_functions - INFO - Early stopping at epoch 700. Best Metrics: (0.01639778310178955, 0.014016393442622952, 0.017901064624526987)
2026-05-23 02:50:00,558 - optuna.study.study - INFO - Trial 148 finished with values: [0.01639778310178955, 0.014016393442622952, 0.017901064624526987] and parameters: {'n_layers': 4, 'embedding_dim': 128, 'lr': 0.0005134970540789423, 'lambda_val': 0.013489522394415601, 'batch_size': 2637, 'optimizer': 'Adam'}.
2026-05-23 02:50:04,625 - experiment_functions - INFO - Early stopping at epoch 550. Best Metrics: (0.03209002383654508, 0.025491803278688524, 0.03478269032555818)
2026-05-23 02:50:04,774 - optuna.study.study - INFO - Trial 149 finished with values: [0.03209002383654508, 0.025491803278688524, 0.03478269032555818] and parameters: {'n_layers': 2, 'embedding_dim': 256, 'lr': 0.00466372845018428, 'lambda_val': 2.1146074643297403e-05, 'batch_size': 2701, 'optimizer': 'Adam'}.
2026-05-23 02:50:21,775 - optuna.study.study - INFO - Trial 150 finished with values: [0.047970998507047044, 0.0340983606557377, 0.05105361401680531] and parameters: {'n_layers': 1, 'embedding_dim': 256, 'lr': 0.00011658772604970312, 'lambda_val': 2.2998934295669292e-05, 'batch_size': 3755, 'optimizer': 'Adam'}.
2026-05-23 02:50:27,331 - experiment_functions - INFO - Early stopping at epoch 1600. Best Metrics: (0.05669124157707171, 0.04295081967213115, 0.05933587500444465)
2026-05-23 02:50:28,119 - optuna.study.study - INFO - Trial 151 finished with values: [0.05669124157707171, 0.04295081967213115, 0.05933587500444465] and parameters: {'n_layers': 1, 'embedding_dim': 64, 'lr': 0.0005134970540789423, 'lambda_val': 0.013489522394415601, 'batch_size': 584, 'optimizer': 'Adam'}.
2026-05-23 02:50:33,442 - experiment_functions - INFO - Early stopping at epoch 950. Best Metrics: (0.042555132159280355, 0.031311475409836066, 0.04368336192228894)
2026-05-23 02:50:33,556 - optuna.study.study - INFO - Trial 152 finished with values: [0.042555132159280355, 0.031311475409836066, 0.04368336192228894] and parameters: {'n_layers': 2, 'embedding_dim': 256, 'lr': 0.00033929418945457667, 'lambda_val': 0.0001550039370894526, 'batch_size': 2773, 'optimizer': 'RMSprop'}.
2026-05-23 02:50:36,456 - experiment_functions - INFO - Early stopping at epoch 500. Best Metrics: (0.010648214052366755, 0.0063934426229508194, 0.008578453359534251)
2026-05-23 02:50:36,542 - optuna.study.study - INFO - Trial 153 finished with values: [0.010648214052366755, 0.0063934426229508194, 0.008578453359534251] and parameters: {'n_layers': 2, 'embedding_dim': 128, 'lr': 0.07102912565096459, 'lambda_val': 8.60783053151504e-05, 'batch_size': 2109, 'optimizer': 'RMSprop'}.
2026-05-23 02:50:41,421 - experiment_functions - INFO - Early stopping at epoch 1200. Best Metrics: (0.03644483393499205, 0.026393442622950822, 0.033861893572414224)
2026-05-23 02:50:42,162 - optuna.study.study - INFO - Trial 154 finished with values: [0.03644483393499205, 0.026393442622950822, 0.033861893572414224] and parameters: {'n_layers': 2, 'embedding_dim': 32, 'lr': 0.0005134970540789423, 'lambda_val': 0.013489522394415601, 'batch_size': 2637, 'optimizer': 'RMSprop'}.
2026-05-23 02:50:46,364 - experiment_functions - INFO - Early stopping at epoch 700. Best Metrics: (0.02915203082583054, 0.025081967213114755, 0.03242812147956901)
2026-05-23 02:50:47,059 - optuna.study.study - INFO - Trial 155 finished with values: [0.02915203082583054, 0.025081967213114755, 0.03242812147956901] and parameters: {'n_layers': 3, 'embedding_dim': 128, 'lr': 0.0005134970540789423, 'lambda_val': 0.004212470249457581, 'batch_size': 2427, 'optimizer': 'RMSprop'}.
2026-05-23 02:50:51,284 - experiment_functions - INFO - Early stopping at epoch 550. Best Metrics: (0.05174683419622449, 0.03795081967213115, 0.054853017641238094)
2026-05-23 02:50:51,954 - optuna.study.study - INFO - Trial 156 finished with values: [0.05174683419622449, 0.03795081967213115, 0.054853017641238094] and parameters: {'n_layers': 1, 'embedding_dim': 128, 'lr': 0.0056420762452804776, 'lambda_val': 0.013489522394415601, 'batch_size': 2637, 'optimizer': 'Adam'}.
2026-05-23 02:51:02,046 - experiment_functions - INFO - Early stopping at epoch 500. Best Metrics: (0.0024493704262802643, 0.0017213114754098362, 0.0021911059119034642)
2026-05-23 02:51:02,709 - optuna.study.study - INFO - Trial 157 finished with values: [0.0024493704262802643, 0.0017213114754098362, 0.0021911059119034642] and parameters: {'n_layers': 4, 'embedding_dim': 256, 'lr': 0.001459413805808463, 'lambda_val': 1.920440422719017e-05, 'batch_size': 3771, 'optimizer': 'SGD'}.
2026-05-23 02:51:09,341 - experiment_functions - INFO - Early stopping at epoch 1050. Best Metrics: (0.036292103083868314, 0.02901639344262295, 0.04034780760712383)
2026-05-23 02:51:09,417 - optuna.study.study - INFO - Trial 158 finished with values: [0.036292103083868314, 0.02901639344262295, 0.04034780760712383] and parameters: {'n_layers': 2, 'embedding_dim': 96, 'lr': 0.0005838890493565157, 'lambda_val': 6.501058820242015e-05, 'batch_size': 3577, 'optimizer': 'Adam'}.
2026-05-23 02:51:12,917 - experiment_functions - INFO - Early stopping at epoch 750. Best Metrics: (0.06235769347732004, 0.04704918032786885, 0.06841874287596449)
2026-05-23 02:51:13,001 - optuna.study.study - INFO - Trial 159 finished with values: [0.06235769347732004, 0.04704918032786885, 0.06841874287596449] and parameters: {'n_layers': 1, 'embedding_dim': 32, 'lr': 0.0013028688223409228, 'lambda_val': 0.003720138868239179, 'batch_size': 745, 'optimizer': 'RMSprop'}.
2026-05-23 02:51:18,370 - experiment_functions - INFO - Early stopping at epoch 1450. Best Metrics: (0.04676484280281674, 0.028852459016393446, 0.04336884372820836)
2026-05-23 02:51:19,135 - optuna.study.study - INFO - Trial 160 finished with values: [0.04676484280281674, 0.028852459016393446, 0.04336884372820836] and parameters: {'n_layers': 1, 'embedding_dim': 128, 'lr': 0.0056420762452804776, 'lambda_val': 0.00013132248917306012, 'batch_size': 1651, 'optimizer': 'RMSprop'}.
2026-05-23 02:51:34,998 - optuna.study.study - INFO - Trial 161 finished with values: [0.06577828805615848, 0.04409836065573771, 0.06711727695733104] and parameters: {'n_layers': 1, 'embedding_dim': 256, 'lr': 0.00019324235493803607, 'lambda_val': 8.60783053151504e-05, 'batch_size': 2109, 'optimizer': 'RMSprop'}.
2026-05-23 02:51:41,494 - experiment_functions - INFO - Early stopping at epoch 1000. Best Metrics: (0.015923094703312237, 0.013278688524590167, 0.01835852474153342)
2026-05-23 02:51:42,851 - optuna.study.study - INFO - Trial 162 finished with values: [0.015923094703312237, 0.013278688524590167, 0.01835852474153342] and parameters: {'n_layers': 3, 'embedding_dim': 256, 'lr': 0.00466372845018428, 'lambda_val': 0.007024459859123817, 'batch_size': 1651, 'optimizer': 'Adam'}.
2026-05-23 02:51:58,344 - experiment_functions - INFO - Early stopping at epoch 3150. Best Metrics: (0.062174264672583725, 0.04188524590163935, 0.05787569525849476)
2026-05-23 02:51:58,432 - optuna.study.study - INFO - Trial 163 finished with values: [0.062174264672583725, 0.04188524590163935, 0.05787569525849476] and parameters: {'n_layers': 2, 'embedding_dim': 256, 'lr': 0.00015087698888573533, 'lambda_val': 8.689122223949433e-06, 'batch_size': 1084, 'optimizer': 'RMSprop'}.
2026-05-23 02:52:07,888 - experiment_functions - INFO - Early stopping at epoch 2450. Best Metrics: (0.06402520482234843, 0.045, 0.06512293911963839)
2026-05-23 02:52:08,507 - optuna.study.study - INFO - Trial 164 finished with values: [0.06402520482234843, 0.045, 0.06512293911963839] and parameters: {'n_layers': 1, 'embedding_dim': 128, 'lr': 0.0002738093623313198, 'lambda_val': 0.00023185127305384867, 'batch_size': 3937, 'optimizer': 'Adam'}.
2026-05-23 02:52:15,518 - experiment_functions - INFO - Early stopping at epoch 2100. Best Metrics: (0.06235034539980975, 0.04557377049180328, 0.06495983406041705)
2026-05-23 02:52:15,607 - optuna.study.study - INFO - Trial 165 finished with values: [0.06235034539980975, 0.04557377049180328, 0.06495983406041705] and parameters: {'n_layers': 1, 'embedding_dim': 64, 'lr': 0.0005134970540789423, 'lambda_val': 0.0035064867017704023, 'batch_size': 1651, 'optimizer': 'Adam'}.
2026-05-23 02:52:21,786 - experiment_functions - INFO - Early stopping at epoch 1550. Best Metrics: (0.060704458624844485, 0.043196721311475415, 0.06129836994670723)
2026-05-23 02:52:22,349 - optuna.study.study - INFO - Trial 166 finished with values: [0.060704458624844485, 0.043196721311475415, 0.06129836994670723] and parameters: {'n_layers': 1, 'embedding_dim': 128, 'lr': 0.00033929418945457667, 'lambda_val': 0.008198149930508243, 'batch_size': 2427, 'optimizer': 'Adam'}.
2026-05-23 02:52:42,579 - optuna.study.study - INFO - Trial 167 finished with values: [0.04097471714924744, 0.030983606557377048, 0.04079217673937691] and parameters: {'n_layers': 2, 'embedding_dim': 128, 'lr': 0.00015616559996727892, 'lambda_val': 0.008198149930508243, 'batch_size': 2427, 'optimizer': 'Adam'}.
2026-05-23 02:52:45,366 - experiment_functions - INFO - Early stopping at epoch 600. Best Metrics: (0.05320144378732775, 0.04098360655737705, 0.05732936180203393)
2026-05-23 02:52:45,511 - optuna.study.study - INFO - Trial 168 finished with values: [0.05320144378732775, 0.04098360655737705, 0.05732936180203393] and parameters: {'n_layers': 1, 'embedding_dim': 64, 'lr': 0.0013555052564010479, 'lambda_val': 2.2233828874401383e-06, 'batch_size': 2607, 'optimizer': 'RMSprop'}.
2026-05-23 02:53:06,704 - experiment_functions - INFO - Early stopping at epoch 3050. Best Metrics: (0.03828989724017879, 0.025491803278688524, 0.0361083508999185)
2026-05-23 02:53:07,312 - optuna.study.study - INFO - Trial 169 finished with values: [0.03828989724017879, 0.025491803278688524, 0.0361083508999185] and parameters: {'n_layers': 4, 'embedding_dim': 256, 'lr': 0.00015087698888573533, 'lambda_val': 5.93125958274664e-06, 'batch_size': 1091, 'optimizer': 'Adam'}.
2026-05-23 02:53:11,261 - experiment_functions - INFO - Early stopping at epoch 1000. Best Metrics: (0.0027316631192722427, 0.002213114754098361, 0.0028846637599929115)
2026-05-23 02:53:11,531 - optuna.study.study - INFO - Trial 170 finished with values: [0.0027316631192722427, 0.002213114754098361, 0.0028846637599929115] and parameters: {'n_layers': 1, 'embedding_dim': 64, 'lr': 0.0056420762452804776, 'lambda_val': 0.00010574161158144353, 'batch_size': 1651, 'optimizer': 'SGD'}.
2026-05-23 02:53:15,573 - experiment_functions - INFO - Early stopping at epoch 950. Best Metrics: (0.046402688311946466, 0.033196721311475406, 0.04732049760762278)
2026-05-23 02:53:15,647 - optuna.study.study - INFO - Trial 171 finished with values: [0.046402688311946466, 0.033196721311475406, 0.04732049760762278] and parameters: {'n_layers': 2, 'embedding_dim': 64, 'lr': 0.0005134970540789423, 'lambda_val': 0.013692906632550161, 'batch_size': 584, 'optimizer': 'Adam'}.
2026-05-23 02:53:18,445 - experiment_functions - INFO - Early stopping at epoch 550. Best Metrics: (0.03861988974369897, 0.028032786885245898, 0.03658083113661952)
2026-05-23 02:53:18,571 - optuna.study.study - INFO - Trial 172 finished with values: [0.03861988974369897, 0.028032786885245898, 0.03658083113661952] and parameters: {'n_layers': 2, 'embedding_dim': 64, 'lr': 0.0056420762452804776, 'lambda_val': 0.007024459859123817, 'batch_size': 1651, 'optimizer': 'Adam'}.
2026-05-23 02:53:22,557 - experiment_functions - INFO - Early stopping at epoch 850. Best Metrics: (0.03923668358903176, 0.027950819672131148, 0.03810723312840085)
2026-05-23 02:53:22,640 - optuna.study.study - INFO - Trial 173 finished with values: [0.03923668358903176, 0.027950819672131148, 0.03810723312840085] and parameters: {'n_layers': 2, 'embedding_dim': 96, 'lr': 0.0005838890493565157, 'lambda_val': 8.60783053151504e-05, 'batch_size': 3577, 'optimizer': 'RMSprop'}.
2026-05-23 02:53:25,535 - experiment_functions - INFO - Early stopping at epoch 650. Best Metrics: (0.02422464245693386, 0.016229508196721313, 0.0232992835131938)
2026-05-23 02:53:25,622 - optuna.study.study - INFO - Trial 174 finished with values: [0.02422464245693386, 0.016229508196721313, 0.0232992835131938] and parameters: {'n_layers': 1, 'embedding_dim': 96, 'lr': 0.0560602870910239, 'lambda_val': 0.0001408586097439621, 'batch_size': 2106, 'optimizer': 'Adam'}.
2026-05-23 02:53:30,703 - experiment_functions - INFO - Early stopping at epoch 1250. Best Metrics: (0.04740234496885176, 0.03836065573770492, 0.05469098017714249)
2026-05-23 02:53:30,948 - optuna.study.study - INFO - Trial 175 finished with values: [0.04740234496885176, 0.03836065573770492, 0.05469098017714249] and parameters: {'n_layers': 1, 'embedding_dim': 128, 'lr': 0.00033929418945457667, 'lambda_val': 0.03972892700463238, 'batch_size': 2637, 'optimizer': 'RMSprop'}.
2026-05-23 02:53:33,532 - experiment_functions - INFO - Early stopping at epoch 550. Best Metrics: (0.05603375348467954, 0.037459016393442617, 0.05625342614986031)
2026-05-23 02:53:33,703 - optuna.study.study - INFO - Trial 176 finished with values: [0.05603375348467954, 0.037459016393442617, 0.05625342614986031] and parameters: {'n_layers': 1, 'embedding_dim': 96, 'lr': 0.0036479636125195114, 'lambda_val': 0.0001408586097439621, 'batch_size': 3771, 'optimizer': 'Adam'}.
2026-05-23 02:53:36,431 - experiment_functions - INFO - Early stopping at epoch 550. Best Metrics: (0.06000634272610808, 0.03901639344262295, 0.05640149242899658)
2026-05-23 02:53:36,525 - optuna.study.study - INFO - Trial 177 finished with values: [0.06000634272610808, 0.03901639344262295, 0.05640149242899658] and parameters: {'n_layers': 1, 'embedding_dim': 96, 'lr': 0.004434110743664845, 'lambda_val': 1.850486598332162e-05, 'batch_size': 3771, 'optimizer': 'Adam'}.
2026-05-23 02:53:41,735 - experiment_functions - INFO - Early stopping at epoch 1000. Best Metrics: (0.0646124350855381, 0.042377049180327864, 0.05962935646575929)
2026-05-23 02:53:41,856 - optuna.study.study - INFO - Trial 178 finished with values: [0.0646124350855381, 0.042377049180327864, 0.05962935646575929] and parameters: {'n_layers': 1, 'embedding_dim': 256, 'lr': 0.0005134970540789423, 'lambda_val': 0.004212470249457581, 'batch_size': 2427, 'optimizer': 'RMSprop'}.
2026-05-23 02:53:44,680 - experiment_functions - INFO - Early stopping at epoch 550. Best Metrics: (0.052193555061851436, 0.036065573770491806, 0.051538829870391996)
2026-05-23 02:53:44,822 - optuna.study.study - INFO - Trial 179 finished with values: [0.052193555061851436, 0.036065573770491806, 0.051538829870391996] and parameters: {'n_layers': 1, 'embedding_dim': 64, 'lr': 0.0056420762452804776, 'lambda_val': 0.0035064867017704023, 'batch_size': 2913, 'optimizer': 'Adam'}.
2026-05-23 02:53:47,471 - experiment_functions - INFO - Early stopping at epoch 550. Best Metrics: (0.05962268206402909, 0.03926229508196722, 0.058669643785120226)
2026-05-23 02:53:47,555 - optuna.study.study - INFO - Trial 180 finished with values: [0.05962268206402909, 0.03926229508196722, 0.058669643785120226] and parameters: {'n_layers': 1, 'embedding_dim': 96, 'lr': 0.007526325741077799, 'lambda_val': 0.0001408586097439621, 'batch_size': 2135, 'optimizer': 'Adam'}.
2026-05-23 02:54:08,604 - optuna.study.study - INFO - Trial 181 finished with values: [0.05354972332645943, 0.03778688524590164, 0.055321826213267526] and parameters: {'n_layers': 2, 'embedding_dim': 256, 'lr': 0.00015087698888573533, 'lambda_val': 6.158799740696895e-06, 'batch_size': 897, 'optimizer': 'Adam'}.
2026-05-23 02:54:17,229 - experiment_functions - INFO - Early stopping at epoch 1500. Best Metrics: (0.06777152186800509, 0.04795081967213115, 0.06822389039082555)
2026-05-23 02:54:17,519 - optuna.study.study - INFO - Trial 182 finished with values: [0.06777152186800509, 0.04795081967213115, 0.06822389039082555] and parameters: {'n_layers': 1, 'embedding_dim': 128, 'lr': 0.0005134970540789423, 'lambda_val': 0.0011797503400601253, 'batch_size': 2427, 'optimizer': 'Adam'}.
2026-05-23 02:54:26,405 - experiment_functions - INFO - Early stopping at epoch 2900. Best Metrics: (0.05834610219771799, 0.04540983606557378, 0.06286608557748624)
2026-05-23 02:54:26,481 - optuna.study.study - INFO - Trial 183 finished with values: [0.05834610219771799, 0.04540983606557378, 0.06286608557748624] and parameters: {'n_layers': 1, 'embedding_dim': 64, 'lr': 0.00033929418945457667, 'lambda_val': 2.2233828874401383e-06, 'batch_size': 2773, 'optimizer': 'RMSprop'}.
2026-05-23 02:54:32,246 - experiment_functions - INFO - Early stopping at epoch 1550. Best Metrics: (0.06630584193558393, 0.04778688524590164, 0.07233531899539997)
2026-05-23 02:54:33,384 - optuna.study.study - INFO - Trial 184 finished with values: [0.06630584193558393, 0.04778688524590164, 0.07233531899539997] and parameters: {'n_layers': 1, 'embedding_dim': 64, 'lr': 0.0005134970540789423, 'lambda_val': 0.0027428171281445477, 'batch_size': 2427, 'optimizer': 'RMSprop'}.
2026-05-23 02:54:36,539 - experiment_functions - INFO - Early stopping at epoch 750. Best Metrics: (0.0021380085284459236, 0.0017213114754098362, 0.002770587136362997)
2026-05-23 02:54:36,647 - optuna.study.study - INFO - Trial 185 finished with values: [0.0021380085284459236, 0.0017213114754098362, 0.002770587136362997] and parameters: {'n_layers': 1, 'embedding_dim': 128, 'lr': 1.7417992985206386e-05, 'lambda_val': 1.0486263526014875e-06, 'batch_size': 3771, 'optimizer': 'Adam'}.
2026-05-23 02:54:54,323 - optuna.study.study - INFO - Trial 186 finished with values: [0.05456525297226542, 0.03647540983606558, 0.04966616205467901] and parameters: {'n_layers': 3, 'embedding_dim': 128, 'lr': 0.00015087698888573533, 'lambda_val': 2.262285689814337e-06, 'batch_size': 808, 'optimizer': 'Adam'}.
2026-05-23 02:54:56,254 - experiment_functions - INFO - Early stopping at epoch 500. Best Metrics: (0.0012563306288382644, 0.0018852459016393442, 0.0022084784431657227)
2026-05-23 02:54:56,393 - optuna.study.study - INFO - Trial 187 finished with values: [0.0012563306288382644, 0.0018852459016393442, 0.0022084784431657227] and parameters: {'n_layers': 1, 'embedding_dim': 96, 'lr': 0.0005134970540789423, 'lambda_val': 0.0009810927157913494, 'batch_size': 1651, 'optimizer': 'SGD'}.
2026-05-23 02:55:06,291 - optuna.study.study - INFO - Trial 188 finished with values: [0.035676051460509055, 0.025901639344262296, 0.037437640426660396] and parameters: {'n_layers': 1, 'embedding_dim': 32, 'lr': 0.00015446198883953233, 'lambda_val': 0.005469691175731185, 'batch_size': 1434, 'optimizer': 'RMSprop'}.
2026-05-23 02:55:09,492 - experiment_functions - INFO - Early stopping at epoch 650. Best Metrics: (0.03585223745324267, 0.02442622950819672, 0.036849645782711445)
2026-05-23 02:55:09,577 - optuna.study.study - INFO - Trial 189 finished with values: [0.03585223745324267, 0.02442622950819672, 0.036849645782711445] and parameters: {'n_layers': 3, 'embedding_dim': 96, 'lr': 0.001459413805808463, 'lambda_val': 0.006439135351806826, 'batch_size': 1518, 'optimizer': 'Adam'}.
2026-05-23 02:55:14,863 - experiment_functions - INFO - Early stopping at epoch 1750. Best Metrics: (0.055162360735197515, 0.04139344262295082, 0.0573769263361425)
2026-05-23 02:55:15,335 - optuna.study.study - INFO - Trial 190 finished with values: [0.055162360735197515, 0.04139344262295082, 0.0573769263361425] and parameters: {'n_layers': 1, 'embedding_dim': 96, 'lr': 0.0005134970540789423, 'lambda_val': 0.008198149930508243, 'batch_size': 1694, 'optimizer': 'Adam'}.
2026-05-23 02:55:18,383 - experiment_functions - INFO - Early stopping at epoch 550. Best Metrics: (0.04458672328757319, 0.03229508196721311, 0.049577670939753744)
2026-05-23 02:55:19,748 - optuna.study.study - INFO - Trial 191 finished with values: [0.04458672328757319, 0.03229508196721311, 0.049577670939753744] and parameters: {'n_layers': 2, 'embedding_dim': 128, 'lr': 0.0028625674712238853, 'lambda_val': 8.689122223949433e-06, 'batch_size': 2701, 'optimizer': 'Adam'}.
2026-05-23 02:55:22,999 - experiment_functions - INFO - Early stopping at epoch 650. Best Metrics: (0.03557481324235292, 0.027295081967213117, 0.037444634035166194)
2026-05-23 02:55:23,090 - optuna.study.study - INFO - Trial 192 finished with values: [0.03557481324235292, 0.027295081967213117, 0.037444634035166194] and parameters: {'n_layers': 2, 'embedding_dim': 64, 'lr': 0.0013555052564010479, 'lambda_val': 0.0014273026194918, 'batch_size': 2345, 'optimizer': 'Adam'}.
2026-05-23 02:55:38,975 - experiment_functions - INFO - Early stopping at epoch 3850. Best Metrics: (0.0406963989974489, 0.028606557377049185, 0.041341308717184826)
2026-05-23 02:55:39,937 - optuna.study.study - INFO - Trial 193 finished with values: [0.0406963989974489, 0.028606557377049185, 0.041341308717184826] and parameters: {'n_layers': 2, 'embedding_dim': 128, 'lr': 0.00015616559996727892, 'lambda_val': 8.689122223949433e-06, 'batch_size': 2701, 'optimizer': 'Adam'}.
2026-05-23 02:55:42,537 - experiment_functions - INFO - Early stopping at epoch 550. Best Metrics: (0.0412470442149129, 0.03483606557377049, 0.04583242014929366)
2026-05-23 02:55:42,637 - optuna.study.study - INFO - Trial 194 finished with values: [0.0412470442149129, 0.03483606557377049, 0.04583242014929366] and parameters: {'n_layers': 1, 'embedding_dim': 128, 'lr': 0.007526325741077799, 'lambda_val': 0.0001408586097439621, 'batch_size': 2619, 'optimizer': 'Adam'}.
2026-05-23 02:55:45,303 - experiment_functions - INFO - Early stopping at epoch 550. Best Metrics: (0.030472315478626607, 0.02163934426229508, 0.03070312858509764)
