2026-05-23 02:12:52,895 - optuna.study.study - INFO - Trial 76 finished with values: [0.016539113029544847, 0.010163934426229508, 0.013923725132042413] and parameters: {'n_layers': 2, 'embedding_dim': 96, 'lr': 9.917692877856437e-05, 'lambda_val': 8.858691676718628e-05, 'batch_size': 2886, 'optimizer': 'RMSprop'}.
2026-05-23 02:12:56,546 - experiment_functions - INFO - Early stopping at epoch 800. Best Metrics: (0.010505588347364345, 0.006229508196721312, 0.009590936385120624)
2026-05-23 02:12:57,415 - optuna.study.study - INFO - Trial 77 finished with values: [0.010505588347364345, 0.006229508196721312, 0.009590936385120624] and parameters: {'n_layers': 4, 'embedding_dim': 128, 'lr': 0.016569821197157334, 'lambda_val': 1.6024291339987423e-06, 'batch_size': 2308, 'optimizer': 'Adam'}.
2026-05-23 02:13:00,254 - experiment_functions - INFO - Early stopping at epoch 650. Best Metrics: (0.004130135059616002, 0.00418032786885246, 0.006108402667927781)
2026-05-23 02:13:00,334 - optuna.study.study - INFO - Trial 78 finished with values: [0.004130135059616002, 0.00418032786885246, 0.006108402667927781] and parameters: {'n_layers': 4, 'embedding_dim': 64, 'lr': 0.0020135118692985172, 'lambda_val': 0.0843019908786963, 'batch_size': 3427, 'optimizer': 'Adam'}.
2026-05-23 02:13:02,442 - experiment_functions - INFO - Early stopping at epoch 500. Best Metrics: (0.003288392427876933, 0.0013934426229508198, 0.0023377421377145115)
2026-05-23 02:13:02,531 - optuna.study.study - INFO - Trial 79 finished with values: [0.003288392427876933, 0.0013934426229508198, 0.0023377421377145115] and parameters: {'n_layers': 2, 'embedding_dim': 32, 'lr': 2.866856018175102e-05, 'lambda_val': 0.0007907415664377911, 'batch_size': 524, 'optimizer': 'SGD'}.
2026-05-23 02:13:05,512 - experiment_functions - INFO - Early stopping at epoch 750. Best Metrics: (0.02339110192856589, 0.014016393442622952, 0.02177652088036591)
2026-05-23 02:13:05,609 - optuna.study.study - INFO - Trial 80 finished with values: [0.02339110192856589, 0.014016393442622952, 0.02177652088036591] and parameters: {'n_layers': 1, 'embedding_dim': 96, 'lr': 0.007023409779815748, 'lambda_val': 8.858691676718628e-05, 'batch_size': 2886, 'optimizer': 'RMSprop'}.
2026-05-23 02:13:10,385 - experiment_functions - INFO - Early stopping at epoch 650. Best Metrics: (0.005796500535298682, 0.004918032786885246, 0.006688368281634025)
2026-05-23 02:13:10,729 - optuna.study.study - INFO - Trial 81 finished with values: [0.005796500535298682, 0.004918032786885246, 0.006688368281634025] and parameters: {'n_layers': 2, 'embedding_dim': 256, 'lr': 0.003012176927562537, 'lambda_val': 0.06799272203728716, 'batch_size': 3086, 'optimizer': 'RMSprop'}.
2026-05-23 02:13:13,229 - experiment_functions - INFO - Early stopping at epoch 600. Best Metrics: (0.028816713825162175, 0.017950819672131146, 0.026973343023400466)
2026-05-23 02:13:13,357 - optuna.study.study - INFO - Trial 82 finished with values: [0.028816713825162175, 0.017950819672131146, 0.026973343023400466] and parameters: {'n_layers': 1, 'embedding_dim': 64, 'lr': 0.001529501184394163, 'lambda_val': 0.01576185866290203, 'batch_size': 3132, 'optimizer': 'RMSprop'}.
2026-05-23 02:13:16,244 - experiment_functions - INFO - Early stopping at epoch 550. Best Metrics: (0.010665350944455266, 0.007622950819672132, 0.012027574755655442)
2026-05-23 02:13:16,384 - optuna.study.study - INFO - Trial 83 finished with values: [0.010665350944455266, 0.007622950819672132, 0.012027574755655442] and parameters: {'n_layers': 3, 'embedding_dim': 256, 'lr': 0.01140479989462853, 'lambda_val': 0.0012175795951631463, 'batch_size': 1786, 'optimizer': 'Adam'}.
2026-05-23 02:13:29,135 - optuna.study.study - INFO - Trial 84 finished with values: [0.00753962185125244, 0.005245901639344262, 0.007339851468375444] and parameters: {'n_layers': 4, 'embedding_dim': 32, 'lr': 6.663330287409543e-05, 'lambda_val': 0.0006231836299255652, 'batch_size': 895, 'optimizer': 'RMSprop'}.
2026-05-23 02:13:31,783 - experiment_functions - INFO - Early stopping at epoch 700. Best Metrics: (0.0035064350122271243, 0.002213114754098361, 0.0026376228025190964)
2026-05-23 02:13:31,861 - optuna.study.study - INFO - Trial 85 finished with values: [0.0035064350122271243, 0.002213114754098361, 0.0026376228025190964] and parameters: {'n_layers': 1, 'embedding_dim': 128, 'lr': 0.05671137520020283, 'lambda_val': 0.0010210780536973009, 'batch_size': 1412, 'optimizer': 'SGD'}.
2026-05-23 02:13:37,090 - experiment_functions - INFO - Early stopping at epoch 1400. Best Metrics: (0.017079559043650994, 0.012131147540983607, 0.016181966243850994)
2026-05-23 02:13:37,380 - optuna.study.study - INFO - Trial 86 finished with values: [0.017079559043650994, 0.012131147540983607, 0.016181966243850994] and parameters: {'n_layers': 3, 'embedding_dim': 128, 'lr': 0.0001642455197684349, 'lambda_val': 0.020702741472597427, 'batch_size': 3197, 'optimizer': 'RMSprop'}.
2026-05-23 02:13:44,566 - experiment_functions - INFO - Early stopping at epoch 2450. Best Metrics: (0.002190056871346858, 0.002131147540983607, 0.0027310551621881067)
2026-05-23 02:13:44,650 - optuna.study.study - INFO - Trial 87 finished with values: [0.002190056871346858, 0.002131147540983607, 0.0027310551621881067] and parameters: {'n_layers': 1, 'embedding_dim': 128, 'lr': 3.739262166714816e-05, 'lambda_val': 4.132421892830272e-06, 'batch_size': 1723, 'optimizer': 'Adam'}.
2026-05-23 02:13:47,614 - experiment_functions - INFO - Early stopping at epoch 700. Best Metrics: (0.030125252404684652, 0.017049180327868854, 0.027730295409162723)
2026-05-23 02:13:48,978 - optuna.study.study - INFO - Trial 88 finished with values: [0.030125252404684652, 0.017049180327868854, 0.027730295409162723] and parameters: {'n_layers': 1, 'embedding_dim': 256, 'lr': 0.0011164422280390935, 'lambda_val': 7.3050833305021745e-06, 'batch_size': 3441, 'optimizer': 'RMSprop'}.
2026-05-23 02:13:53,852 - experiment_functions - INFO - Early stopping at epoch 1200. Best Metrics: (0.007034716303248642, 0.005491803278688525, 0.0075900152702080125)
2026-05-23 02:13:54,479 - optuna.study.study - INFO - Trial 89 finished with values: [0.007034716303248642, 0.005491803278688525, 0.0075900152702080125] and parameters: {'n_layers': 4, 'embedding_dim': 128, 'lr': 0.0002154359749435351, 'lambda_val': 0.05174047898933555, 'batch_size': 3132, 'optimizer': 'RMSprop'}.
2026-05-23 02:14:06,079 - optuna.study.study - INFO - Trial 90 finished with values: [0.00320402429961229, 0.002622950819672131, 0.0032790003218123465] and parameters: {'n_layers': 1, 'embedding_dim': 96, 'lr': 5.113057585622387e-05, 'lambda_val': 1.6012413972032166e-05, 'batch_size': 2760, 'optimizer': 'Adam'}.
2026-05-23 02:14:08,246 - experiment_functions - INFO - Early stopping at epoch 500. Best Metrics: (0.0036645791822530758, 0.001967213114754099, 0.002987390082545281)
2026-05-23 02:14:08,376 - optuna.study.study - INFO - Trial 91 finished with values: [0.0036645791822530758, 0.001967213114754099, 0.002987390082545281] and parameters: {'n_layers': 2, 'embedding_dim': 96, 'lr': 0.0006576673193419612, 'lambda_val': 0.00630672499632553, 'batch_size': 1405, 'optimizer': 'SGD'}.
2026-05-23 02:14:22,978 - optuna.study.study - INFO - Trial 92 finished with values: [0.019670422665105224, 0.012950819672131148, 0.017806900278571625] and parameters: {'n_layers': 1, 'embedding_dim': 32, 'lr': 0.0003432142400602671, 'lambda_val': 0.0010210780536973009, 'batch_size': 3665, 'optimizer': 'RMSprop'}.
2026-05-23 02:14:35,135 - optuna.study.study - INFO - Trial 93 finished with values: [0.008103284279536375, 0.0051639344262295085, 0.007706889203072577] and parameters: {'n_layers': 3, 'embedding_dim': 64, 'lr': 5.554365750728636e-05, 'lambda_val': 0.003734260471985348, 'batch_size': 1698, 'optimizer': 'RMSprop'}.
2026-05-23 02:14:47,974 - optuna.study.study - INFO - Trial 94 finished with values: [0.017694883566065696, 0.010573770491803278, 0.015401513643852435] and parameters: {'n_layers': 2, 'embedding_dim': 128, 'lr': 0.00010788024120426728, 'lambda_val': 0.0003977734214389728, 'batch_size': 3213, 'optimizer': 'Adam'}.
2026-05-23 02:14:50,344 - experiment_functions - INFO - Early stopping at epoch 500. Best Metrics: (0.0026878886353995115, 0.0015573770491803278, 0.0025922592717319334)
2026-05-23 02:14:50,435 - optuna.study.study - INFO - Trial 95 finished with values: [0.0026878886353995115, 0.0015573770491803278, 0.0025922592717319334] and parameters: {'n_layers': 3, 'embedding_dim': 96, 'lr': 0.00011089595098502456, 'lambda_val': 0.01380676127429418, 'batch_size': 3441, 'optimizer': 'SGD'}.
2026-05-23 02:14:53,188 - experiment_functions - INFO - Early stopping at epoch 700. Best Metrics: (0.04105995587977525, 0.02098360655737705, 0.03306535329352252)
2026-05-23 02:14:53,287 - optuna.study.study - INFO - Trial 96 finished with values: [0.04105995587977525, 0.02098360655737705, 0.03306535329352252] and parameters: {'n_layers': 3, 'embedding_dim': 64, 'lr': 0.0010193114088728706, 'lambda_val': 0.003734260471985348, 'batch_size': 664, 'optimizer': 'Adam'}.
2026-05-23 02:14:59,169 - experiment_functions - INFO - Early stopping at epoch 1200. Best Metrics: (0.010200432103055174, 0.006475409836065574, 0.008504117151195598)
2026-05-23 02:14:59,470 - optuna.study.study - INFO - Trial 97 finished with values: [0.010200432103055174, 0.006475409836065574, 0.008504117151195598] and parameters: {'n_layers': 4, 'embedding_dim': 256, 'lr': 0.013707028468469483, 'lambda_val': 0.0004199340181336044, 'batch_size': 2242, 'optimizer': 'Adam'}.
2026-05-23 02:15:02,415 - experiment_functions - INFO - Early stopping at epoch 500. Best Metrics: (0.00281339140260213, 0.0018032786885245904, 0.0022676169885999273)
2026-05-23 02:15:03,192 - optuna.study.study - INFO - Trial 98 finished with values: [0.00281339140260213, 0.0018032786885245904, 0.0022676169885999273] and parameters: {'n_layers': 4, 'embedding_dim': 256, 'lr': 0.0003432142400602671, 'lambda_val': 4.599450184776653e-05, 'batch_size': 3657, 'optimizer': 'SGD'}.
2026-05-23 02:15:08,508 - experiment_functions - INFO - Early stopping at epoch 1650. Best Metrics: (0.030276181662392095, 0.017377049180327873, 0.02592958011928891)
2026-05-23 02:15:09,388 - optuna.study.study - INFO - Trial 99 finished with values: [0.030276181662392095, 0.017377049180327873, 0.02592958011928891] and parameters: {'n_layers': 1, 'embedding_dim': 96, 'lr': 0.0004474461075792833, 'lambda_val': 8.858691676718628e-05, 'batch_size': 2886, 'optimizer': 'RMSprop'}.
2026-05-23 02:15:15,956 - experiment_functions - INFO - Early stopping at epoch 2100. Best Metrics: (0.019068180300455144, 0.01344262295081967, 0.017499054120670487)
2026-05-23 02:15:16,292 - optuna.study.study - INFO - Trial 100 finished with values: [0.019068180300455144, 0.01344262295081967, 0.017499054120670487] and parameters: {'n_layers': 1, 'embedding_dim': 128, 'lr': 0.04643734687718579, 'lambda_val': 0.0038475852967126147, 'batch_size': 1698, 'optimizer': 'RMSprop'}.
2026-05-23 02:15:21,203 - experiment_functions - INFO - Early stopping at epoch 550. Best Metrics: (0.023501158727920097, 0.014016393442622952, 0.020245362890764767)
2026-05-23 02:15:21,861 - optuna.study.study - INFO - Trial 101 finished with values: [0.023501158727920097, 0.014016393442622952, 0.020245362890764767] and parameters: {'n_layers': 2, 'embedding_dim': 256, 'lr': 0.01140479989462853, 'lambda_val': 7.120522979358461e-06, 'batch_size': 1786, 'optimizer': 'Adam'}.
2026-05-23 02:15:30,497 - experiment_functions - INFO - Early stopping at epoch 1000. Best Metrics: (0.03971709845207598, 0.020409836065573773, 0.03165860381383394)
2026-05-23 02:15:31,845 - optuna.study.study - INFO - Trial 102 finished with values: [0.03971709845207598, 0.020409836065573773, 0.03165860381383394] and parameters: {'n_layers': 1, 'embedding_dim': 128, 'lr': 0.0010682175784251788, 'lambda_val': 5.787806000886398e-06, 'batch_size': 1594, 'optimizer': 'Adam'}.
2026-05-23 02:15:36,324 - experiment_functions - INFO - Early stopping at epoch 750. Best Metrics: (0.02927171262654873, 0.017131147540983604, 0.025819274204186376)
2026-05-23 02:15:36,420 - optuna.study.study - INFO - Trial 103 finished with values: [0.02927171262654873, 0.017131147540983604, 0.025819274204186376] and parameters: {'n_layers': 1, 'embedding_dim': 128, 'lr': 0.0010682175784251788, 'lambda_val': 0.01576185866290203, 'batch_size': 3132, 'optimizer': 'Adam'}.
2026-05-23 02:15:39,375 - experiment_functions - INFO - Early stopping at epoch 550. Best Metrics: (0.02273454302050408, 0.01459016393442623, 0.02264817735941003)
2026-05-23 02:15:39,461 - optuna.study.study - INFO - Trial 104 finished with values: [0.02273454302050408, 0.01459016393442623, 0.02264817735941003] and parameters: {'n_layers': 3, 'embedding_dim': 256, 'lr': 0.0010193114088728706, 'lambda_val': 0.003734260471985348, 'batch_size': 3441, 'optimizer': 'RMSprop'}.
2026-05-23 02:15:42,597 - experiment_functions - INFO - Early stopping at epoch 800. Best Metrics: (0.02797714207024845, 0.01778688524590164, 0.025631750343954703)
2026-05-23 02:15:42,686 - optuna.study.study - INFO - Trial 105 finished with values: [0.02797714207024845, 0.01778688524590164, 0.025631750343954703] and parameters: {'n_layers': 3, 'embedding_dim': 64, 'lr': 0.0010193114088728706, 'lambda_val': 1.6012413972032166e-05, 'batch_size': 1698, 'optimizer': 'Adam'}.
2026-05-23 02:15:45,225 - experiment_functions - INFO - Early stopping at epoch 600. Best Metrics: (0.031792599517519705, 0.018360655737704918, 0.026701271213705968)
2026-05-23 02:15:45,313 - optuna.study.study - INFO - Trial 106 finished with values: [0.031792599517519705, 0.018360655737704918, 0.026701271213705968] and parameters: {'n_layers': 1, 'embedding_dim': 96, 'lr': 0.007023409779815748, 'lambda_val': 8.858691676718628e-05, 'batch_size': 2886, 'optimizer': 'Adam'}.
2026-05-23 02:15:48,001 - experiment_functions - INFO - Early stopping at epoch 600. Best Metrics: (0.016181141345590695, 0.011639344262295083, 0.014986823653026742)
2026-05-23 02:15:48,096 - optuna.study.study - INFO - Trial 107 finished with values: [0.016181141345590695, 0.011639344262295083, 0.014986823653026742] and parameters: {'n_layers': 4, 'embedding_dim': 64, 'lr': 0.0009933779564808808, 'lambda_val': 0.0005428353674897035, 'batch_size': 2477, 'optimizer': 'RMSprop'}.
2026-05-23 02:15:57,943 - experiment_functions - INFO - Early stopping at epoch 3450. Best Metrics: (0.004526137310946761, 0.004262295081967214, 0.004767353909885702)
2026-05-23 02:15:58,610 - optuna.study.study - INFO - Trial 108 finished with values: [0.004526137310946761, 0.004262295081967214, 0.004767353909885702] and parameters: {'n_layers': 2, 'embedding_dim': 32, 'lr': 0.00011089595098502456, 'lambda_val': 0.01380676127429418, 'batch_size': 1291, 'optimizer': 'Adam'}.
2026-05-23 02:16:01,920 - experiment_functions - INFO - Early stopping at epoch 750. Best Metrics: (0.009289507317050204, 0.006229508196721311, 0.008810768264085443)
2026-05-23 02:16:02,012 - optuna.study.study - INFO - Trial 109 finished with values: [0.009289507317050204, 0.006229508196721311, 0.008810768264085443] and parameters: {'n_layers': 2, 'embedding_dim': 64, 'lr': 0.024916892195373658, 'lambda_val': 0.01576185866290203, 'batch_size': 3132, 'optimizer': 'RMSprop'}.
2026-05-23 02:16:06,471 - experiment_functions - INFO - Early stopping at epoch 1200. Best Metrics: (0.030544907912913002, 0.016311475409836067, 0.02649217196547081)
2026-05-23 02:16:07,854 - optuna.study.study - INFO - Trial 110 finished with values: [0.030544907912913002, 0.016311475409836067, 0.02649217196547081] and parameters: {'n_layers': 2, 'embedding_dim': 128, 'lr': 0.0003432142400602671, 'lambda_val': 0.0003977734214389728, 'batch_size': 3213, 'optimizer': 'RMSprop'}.
2026-05-23 02:16:10,369 - experiment_functions - INFO - Early stopping at epoch 550. Best Metrics: (0.015146344245395967, 0.009754098360655739, 0.013888187951724832)
2026-05-23 02:16:10,471 - optuna.study.study - INFO - Trial 111 finished with values: [0.015146344245395967, 0.009754098360655739, 0.013888187951724832] and parameters: {'n_layers': 4, 'embedding_dim': 96, 'lr': 0.0027017388551690887, 'lambda_val': 1.6012413972032166e-05, 'batch_size': 1698, 'optimizer': 'RMSprop'}.
2026-05-23 02:16:12,952 - experiment_functions - INFO - Early stopping at epoch 600. Best Metrics: (0.019176681856109073, 0.01377049180327869, 0.019147950881388976)
2026-05-23 02:16:13,044 - optuna.study.study - INFO - Trial 112 finished with values: [0.019176681856109073, 0.01377049180327869, 0.019147950881388976] and parameters: {'n_layers': 1, 'embedding_dim': 32, 'lr': 0.011385784020717018, 'lambda_val': 1.6024291339987423e-06, 'batch_size': 2759, 'optimizer': 'Adam'}.
2026-05-23 02:16:16,167 - experiment_functions - INFO - Early stopping at epoch 900. Best Metrics: (0.02697388305410846, 0.01655737704918033, 0.024602951931297766)
2026-05-23 02:16:16,269 - optuna.study.study - INFO - Trial 113 finished with values: [0.02697388305410846, 0.01655737704918033, 0.024602951931297766] and parameters: {'n_layers': 1, 'embedding_dim': 64, 'lr': 0.0020135118692985172, 'lambda_val': 0.00013294480587825716, 'batch_size': 664, 'optimizer': 'Adam'}.
2026-05-23 02:16:19,153 - experiment_functions - INFO - Early stopping at epoch 650. Best Metrics: (0.020334195386057626, 0.012786885245901639, 0.019044958943017977)
2026-05-23 02:16:19,240 - optuna.study.study - INFO - Trial 114 finished with values: [0.020334195386057626, 0.012786885245901639, 0.019044958943017977] and parameters: {'n_layers': 4, 'embedding_dim': 64, 'lr': 0.0010193114088728706, 'lambda_val': 0.00013294480587825716, 'batch_size': 1698, 'optimizer': 'Adam'}.
2026-05-23 02:16:21,538 - experiment_functions - INFO - Early stopping at epoch 550. Best Metrics: (0.02373393399150135, 0.014098360655737704, 0.020099007464511286)
2026-05-23 02:16:21,625 - optuna.study.study - INFO - Trial 115 finished with values: [0.02373393399150135, 0.014098360655737704, 0.020099007464511286] and parameters: {'n_layers': 2, 'embedding_dim': 64, 'lr': 0.01140479989462853, 'lambda_val': 0.0004199340181336044, 'batch_size': 2242, 'optimizer': 'Adam'}.
2026-05-23 02:16:26,719 - experiment_functions - INFO - Early stopping at epoch 1450. Best Metrics: (0.029732260924898207, 0.018852459016393444, 0.027261228414978734)
2026-05-23 02:16:27,821 - optuna.study.study - INFO - Trial 116 finished with values: [0.029732260924898207, 0.018852459016393444, 0.027261228414978734] and parameters: {'n_layers': 2, 'embedding_dim': 96, 'lr': 0.0003432142400602671, 'lambda_val': 1.6024291339987423e-06, 'batch_size': 2461, 'optimizer': 'Adam'}.
2026-05-23 02:16:30,637 - experiment_functions - INFO - Early stopping at epoch 700. Best Metrics: (0.029364982993723497, 0.01909836065573771, 0.026687627263366466)
2026-05-23 02:16:30,726 - optuna.study.study - INFO - Trial 117 finished with values: [0.029364982993723497, 0.01909836065573771, 0.026687627263366466] and parameters: {'n_layers': 1, 'embedding_dim': 128, 'lr': 0.0011164422280390935, 'lambda_val': 0.0038475852967126147, 'batch_size': 2886, 'optimizer': 'RMSprop'}.
2026-05-23 02:16:42,831 - optuna.study.study - INFO - Trial 118 finished with values: [0.018495117203542036, 0.011721311475409836, 0.01776617490495312] and parameters: {'n_layers': 1, 'embedding_dim': 96, 'lr': 0.0001642455197684349, 'lambda_val': 8.858691676718628e-05, 'batch_size': 2477, 'optimizer': 'RMSprop'}.
2026-05-23 02:16:51,012 - experiment_functions - INFO - Early stopping at epoch 500. Best Metrics: (0.002975228421309112, 0.0017213114754098362, 0.0031233757828526758)
2026-05-23 02:16:51,529 - optuna.study.study - INFO - Trial 119 finished with values: [0.002975228421309112, 0.0017213114754098362, 0.0031233757828526758] and parameters: {'n_layers': 1, 'embedding_dim': 256, 'lr': 0.0011164422280390935, 'lambda_val': 7.3050833305021745e-06, 'batch_size': 2242, 'optimizer': 'SGD'}.
2026-05-23 02:17:00,193 - experiment_functions - INFO - Early stopping at epoch 1300. Best Metrics: (0.0212498042849131, 0.014344262295081968, 0.019507439346313667)
2026-05-23 02:17:01,493 - optuna.study.study - INFO - Trial 120 finished with values: [0.0212498042849131, 0.014344262295081968, 0.019507439346313667] and parameters: {'n_layers': 2, 'embedding_dim': 96, 'lr': 0.0003432142400602671, 'lambda_val': 0.01576185866290203, 'batch_size': 3384, 'optimizer': 'Adam'}.
2026-05-23 02:17:09,609 - experiment_functions - INFO - Early stopping at epoch 2100. Best Metrics: (0.02046677794481061, 0.012622950819672131, 0.016624079143943198)
2026-05-23 02:17:09,684 - optuna.study.study - INFO - Trial 121 finished with values: [0.02046677794481061, 0.012622950819672131, 0.016624079143943198] and parameters: {'n_layers': 4, 'embedding_dim': 128, 'lr': 0.0001642455197684349, 'lambda_val': 0.0010210780536973009, 'batch_size': 3759, 'optimizer': 'RMSprop'}.
2026-05-23 02:17:12,266 - experiment_functions - INFO - Early stopping at epoch 600. Best Metrics: (0.029382503725220024, 0.016803278688524593, 0.023899348352201737)
2026-05-23 02:17:12,356 - optuna.study.study - INFO - Trial 122 finished with values: [0.029382503725220024, 0.016803278688524593, 0.023899348352201737] and parameters: {'n_layers': 3, 'embedding_dim': 64, 'lr': 0.0011164422280390935, 'lambda_val': 7.3050833305021745e-06, 'batch_size': 2242, 'optimizer': 'RMSprop'}.
2026-05-23 02:17:14,763 - experiment_functions - INFO - Early stopping at epoch 500. Best Metrics: (0.0009116600952901661, 0.0012295081967213116, 0.001552761786704371)
