2026-05-23 05:37:32,122 - optuna.study.study - INFO - Trial 123 finished with values: [0.0194060673496644, 0.011639344262295081, 0.01595447814924935] and parameters: {'n_layers': 1, 'embedding_dim': 64, 'lr': 0.06799973953093838, 'lambda_val': 0.0001780270767671239, 'batch_size': 568, 'optimizer': 'RMSprop'}.
2026-05-23 05:37:36,449 - experiment_functions - INFO - Early stopping at epoch 550. Best Metrics: (0.04325403287666446, 0.0239344262295082, 0.038103374234308277)
2026-05-23 05:37:36,723 - optuna.study.study - INFO - Trial 124 finished with values: [0.04325403287666446, 0.0239344262295082, 0.038103374234308277] and parameters: {'n_layers': 2, 'embedding_dim': 256, 'lr': 0.006312777493233292, 'lambda_val': 0.00013338361174833875, 'batch_size': 2612, 'optimizer': 'Adam'}.
2026-05-23 05:37:44,687 - experiment_functions - INFO - Early stopping at epoch 2200. Best Metrics: (0.09673312486610683, 0.0530327868852459, 0.08223412593273888)
2026-05-23 05:37:44,766 - optuna.study.study - INFO - Trial 125 finished with values: [0.09673312486610683, 0.0530327868852459, 0.08223412593273888] and parameters: {'n_layers': 1, 'embedding_dim': 128, 'lr': 0.000360608106860257, 'lambda_val': 1.7408384781052897e-06, 'batch_size': 2590, 'optimizer': 'RMSprop'}.
2026-05-23 05:37:48,125 - experiment_functions - INFO - Early stopping at epoch 850. Best Metrics: (0.0192474701210038, 0.014426229508196723, 0.019375026792083243)
2026-05-23 05:37:48,896 - optuna.study.study - INFO - Trial 126 finished with values: [0.0192474701210038, 0.014426229508196723, 0.019375026792083243] and parameters: {'n_layers': 1, 'embedding_dim': 96, 'lr': 0.03931237666050179, 'lambda_val': 1.916622569179001e-06, 'batch_size': 568, 'optimizer': 'RMSprop'}.
2026-05-23 05:37:52,522 - experiment_functions - INFO - Early stopping at epoch 500. Best Metrics: (0.024046544508688487, 0.014754098360655738, 0.022235670769790473)
2026-05-23 05:37:52,867 - optuna.study.study - INFO - Trial 127 finished with values: [0.024046544508688487, 0.014754098360655738, 0.022235670769790473] and parameters: {'n_layers': 3, 'embedding_dim': 256, 'lr': 0.04737727445304164, 'lambda_val': 0.0016872549049523802, 'batch_size': 3656, 'optimizer': 'RMSprop'}.
2026-05-23 05:38:03,065 - experiment_functions - INFO - Early stopping at epoch 2100. Best Metrics: (0.01744564560475942, 0.011475409836065575, 0.01761031227418608)
2026-05-23 05:38:04,387 - optuna.study.study - INFO - Trial 128 finished with values: [0.01744564560475942, 0.011475409836065575, 0.01761031227418608] and parameters: {'n_layers': 4, 'embedding_dim': 96, 'lr': 0.004748827105127406, 'lambda_val': 0.0022842764195591505, 'batch_size': 3419, 'optimizer': 'RMSprop'}.
2026-05-23 05:38:19,749 - optuna.study.study - INFO - Trial 129 finished with values: [0.05858781500883469, 0.0330327868852459, 0.05105596465988976] and parameters: {'n_layers': 2, 'embedding_dim': 96, 'lr': 0.00015653541413289526, 'lambda_val': 0.00045534797562752613, 'batch_size': 2417, 'optimizer': 'Adam'}.
2026-05-23 05:38:24,503 - experiment_functions - INFO - Early stopping at epoch 800. Best Metrics: (0.03528759390365721, 0.015081967213114753, 0.02752522145640337)
2026-05-23 05:38:24,638 - optuna.study.study - INFO - Trial 130 finished with values: [0.03528759390365721, 0.015081967213114753, 0.02752522145640337] and parameters: {'n_layers': 2, 'embedding_dim': 256, 'lr': 0.0087991751940927, 'lambda_val': 0.00045534797562752613, 'batch_size': 568, 'optimizer': 'RMSprop'}.
2026-05-23 05:38:31,391 - experiment_functions - INFO - Early stopping at epoch 1250. Best Metrics: (0.040345379000362655, 0.02270491803278689, 0.034853220144697286)
2026-05-23 05:38:31,497 - optuna.study.study - INFO - Trial 131 finished with values: [0.040345379000362655, 0.02270491803278689, 0.034853220144697286] and parameters: {'n_layers': 4, 'embedding_dim': 128, 'lr': 0.0003646245687775073, 'lambda_val': 0.0006740293287734596, 'batch_size': 1892, 'optimizer': 'Adam'}.
2026-05-23 05:38:36,989 - experiment_functions - INFO - Early stopping at epoch 550. Best Metrics: (0.051532930532790476, 0.03163934426229509, 0.04718679148557686)
2026-05-23 05:38:37,702 - optuna.study.study - INFO - Trial 132 finished with values: [0.051532930532790476, 0.03163934426229509, 0.04718679148557686] and parameters: {'n_layers': 2, 'embedding_dim': 96, 'lr': 0.0027639393129429376, 'lambda_val': 0.009869894388059158, 'batch_size': 3176, 'optimizer': 'Adam'}.
2026-05-23 05:38:45,916 - experiment_functions - INFO - Early stopping at epoch 750. Best Metrics: (0.02728529131928885, 0.013524590163934426, 0.02179372997394509)
2026-05-23 05:38:47,180 - optuna.study.study - INFO - Trial 133 finished with values: [0.02728529131928885, 0.013524590163934426, 0.02179372997394509] and parameters: {'n_layers': 3, 'embedding_dim': 32, 'lr': 0.006312777493233292, 'lambda_val': 0.00013338361174833875, 'batch_size': 1885, 'optimizer': 'RMSprop'}.
2026-05-23 05:38:50,946 - experiment_functions - INFO - Early stopping at epoch 900. Best Metrics: (0.001759001686730825, 0.0018032786885245904, 0.0024839034263119232)
2026-05-23 05:38:51,243 - optuna.study.study - INFO - Trial 134 finished with values: [0.001759001686730825, 0.0018032786885245904, 0.0024839034263119232] and parameters: {'n_layers': 1, 'embedding_dim': 32, 'lr': 0.006832650701048396, 'lambda_val': 0.0006591181316301599, 'batch_size': 568, 'optimizer': 'SGD'}.
2026-05-23 05:38:57,551 - experiment_functions - INFO - Early stopping at epoch 1100. Best Metrics: (0.015806121685794296, 0.010409836065573769, 0.015083607639434228)
2026-05-23 05:38:58,536 - optuna.study.study - INFO - Trial 135 finished with values: [0.015806121685794296, 0.010409836065573769, 0.015083607639434228] and parameters: {'n_layers': 4, 'embedding_dim': 128, 'lr': 0.00545110887354259, 'lambda_val': 0.003273430437450601, 'batch_size': 2590, 'optimizer': 'RMSprop'}.
2026-05-23 05:39:01,490 - experiment_functions - INFO - Early stopping at epoch 550. Best Metrics: (0.02264654025050567, 0.011147540983606558, 0.018079150635553907)
2026-05-23 05:39:02,385 - optuna.study.study - INFO - Trial 136 finished with values: [0.02264654025050567, 0.011147540983606558, 0.018079150635553907] and parameters: {'n_layers': 4, 'embedding_dim': 64, 'lr': 0.008982393972037851, 'lambda_val': 0.00013338361174833875, 'batch_size': 1794, 'optimizer': 'RMSprop'}.
2026-05-23 05:39:16,799 - optuna.study.study - INFO - Trial 137 finished with values: [0.024095536322961977, 0.016229508196721313, 0.022232946642458715] and parameters: {'n_layers': 2, 'embedding_dim': 128, 'lr': 6.920314910446582e-05, 'lambda_val': 1.3277522347276125e-05, 'batch_size': 1976, 'optimizer': 'Adam'}.
2026-05-23 05:39:25,616 - experiment_functions - INFO - Early stopping at epoch 2750. Best Metrics: (0.07034152663546855, 0.042131147540983606, 0.0632825771576833)
2026-05-23 05:39:25,850 - optuna.study.study - INFO - Trial 138 finished with values: [0.07034152663546855, 0.042131147540983606, 0.0632825771576833] and parameters: {'n_layers': 2, 'embedding_dim': 32, 'lr': 0.0003614258129820434, 'lambda_val': 0.002389697052100668, 'batch_size': 1098, 'optimizer': 'RMSprop'}.
2026-05-23 05:39:28,657 - experiment_functions - INFO - Early stopping at epoch 650. Best Metrics: (0.049846218381170114, 0.025, 0.04148667897517533)
2026-05-23 05:39:28,790 - optuna.study.study - INFO - Trial 139 finished with values: [0.049846218381170114, 0.025, 0.04148667897517533] and parameters: {'n_layers': 1, 'embedding_dim': 96, 'lr': 0.008982393972037851, 'lambda_val': 0.00013338361174833875, 'batch_size': 2011, 'optimizer': 'RMSprop'}.
2026-05-23 05:39:33,199 - experiment_functions - INFO - Early stopping at epoch 850. Best Metrics: (0.005721583586250328, 0.0042622950819672135, 0.006199349254809975)
2026-05-23 05:39:34,097 - optuna.study.study - INFO - Trial 140 finished with values: [0.005721583586250328, 0.0042622950819672135, 0.006199349254809975] and parameters: {'n_layers': 4, 'embedding_dim': 96, 'lr': 0.011140161288498823, 'lambda_val': 0.06158542332963208, 'batch_size': 2267, 'optimizer': 'RMSprop'}.
2026-05-23 05:39:37,375 - experiment_functions - INFO - Early stopping at epoch 600. Best Metrics: (0.024156032093950237, 0.011885245901639344, 0.018375106455592708)
2026-05-23 05:39:37,472 - optuna.study.study - INFO - Trial 141 finished with values: [0.024156032093950237, 0.011885245901639344, 0.018375106455592708] and parameters: {'n_layers': 3, 'embedding_dim': 96, 'lr': 0.013660345711285361, 'lambda_val': 0.0005805183270689483, 'batch_size': 3879, 'optimizer': 'Adam'}.
2026-05-23 05:39:40,189 - experiment_functions - INFO - Early stopping at epoch 500. Best Metrics: (0.0015402045111012818, 0.001639344262295082, 0.002440489309158376)
2026-05-23 05:39:40,293 - optuna.study.study - INFO - Trial 142 finished with values: [0.0015402045111012818, 0.001639344262295082, 0.002440489309158376] and parameters: {'n_layers': 3, 'embedding_dim': 96, 'lr': 0.00010087308294325385, 'lambda_val': 0.0492834302965744, 'batch_size': 661, 'optimizer': 'Adam'}.
2026-05-23 05:39:53,002 - optuna.study.study - INFO - Trial 143 finished with values: [0.06653757762890031, 0.04081967213114754, 0.06093044405331374] and parameters: {'n_layers': 1, 'embedding_dim': 96, 'lr': 0.00015653541413289526, 'lambda_val': 6.19406847114503e-05, 'batch_size': 3604, 'optimizer': 'RMSprop'}.
2026-05-23 05:40:06,732 - optuna.study.study - INFO - Trial 144 finished with values: [0.03744525113556445, 0.022950819672131147, 0.03317534995576287] and parameters: {'n_layers': 2, 'embedding_dim': 96, 'lr': 0.00010087308294325385, 'lambda_val': 0.023481160793884376, 'batch_size': 2251, 'optimizer': 'RMSprop'}.
2026-05-23 05:40:18,120 - experiment_functions - INFO - Early stopping at epoch 3450. Best Metrics: (0.111288722302551, 0.055245901639344265, 0.08953681582814237)
2026-05-23 05:40:18,494 - optuna.study.study - INFO - Trial 145 finished with values: [0.111288722302551, 0.055245901639344265, 0.08953681582814237] and parameters: {'n_layers': 1, 'embedding_dim': 128, 'lr': 0.0003614258129820434, 'lambda_val': 6.19406847114503e-05, 'batch_size': 1976, 'optimizer': 'Adam'}.
2026-05-23 05:40:22,384 - experiment_functions - INFO - Early stopping at epoch 700. Best Metrics: (0.059164564009905996, 0.031885245901639346, 0.05147860084451852)
2026-05-23 05:40:22,759 - optuna.study.study - INFO - Trial 146 finished with values: [0.059164564009905996, 0.031885245901639346, 0.05147860084451852] and parameters: {'n_layers': 3, 'embedding_dim': 128, 'lr': 0.001257701414193144, 'lambda_val': 0.000750074454420214, 'batch_size': 661, 'optimizer': 'Adam'}.
2026-05-23 05:40:44,834 - optuna.study.study - INFO - Trial 147 finished with values: [0.04014655445867082, 0.025, 0.0371190828743421] and parameters: {'n_layers': 4, 'embedding_dim': 32, 'lr': 0.00015653541413289526, 'lambda_val': 0.0005387179014417885, 'batch_size': 1098, 'optimizer': 'RMSprop'}.
2026-05-23 05:40:47,339 - experiment_functions - INFO - Early stopping at epoch 550. Best Metrics: (0.060314184305254225, 0.032459016393442626, 0.05149888653058798)
2026-05-23 05:40:47,423 - optuna.study.study - INFO - Trial 148 finished with values: [0.060314184305254225, 0.032459016393442626, 0.05149888653058798] and parameters: {'n_layers': 1, 'embedding_dim': 64, 'lr': 0.013585216259591065, 'lambda_val': 0.002389697052100668, 'batch_size': 1628, 'optimizer': 'Adam'}.
2026-05-23 05:40:57,395 - experiment_functions - INFO - Early stopping at epoch 2000. Best Metrics: (0.021693754109073284, 0.018032786885245903, 0.024245244061139315)
2026-05-23 05:40:57,527 - optuna.study.study - INFO - Trial 149 finished with values: [0.021693754109073284, 0.018032786885245903, 0.024245244061139315] and parameters: {'n_layers': 2, 'embedding_dim': 256, 'lr': 0.006312777493233292, 'lambda_val': 0.027669721033388165, 'batch_size': 3059, 'optimizer': 'Adam'}.
2026-05-23 05:41:00,066 - experiment_functions - INFO - Early stopping at epoch 550. Best Metrics: (0.10625688630517245, 0.05245901639344262, 0.08613603937080952)
2026-05-23 05:41:00,186 - optuna.study.study - INFO - Trial 150 finished with values: [0.10625688630517245, 0.05245901639344262, 0.08613603937080952] and parameters: {'n_layers': 1, 'embedding_dim': 96, 'lr': 0.006832650701048396, 'lambda_val': 0.0006591181316301599, 'batch_size': 3886, 'optimizer': 'Adam'}.
2026-05-23 05:41:08,071 - experiment_functions - INFO - Early stopping at epoch 2350. Best Metrics: (0.05708513161143128, 0.031885245901639346, 0.049240832540832995)
2026-05-23 05:41:08,156 - optuna.study.study - INFO - Trial 151 finished with values: [0.05708513161143128, 0.031885245901639346, 0.049240832540832995] and parameters: {'n_layers': 2, 'embedding_dim': 32, 'lr': 0.0003614258129820434, 'lambda_val': 0.002389697052100668, 'batch_size': 2003, 'optimizer': 'RMSprop'}.
2026-05-23 05:41:10,583 - experiment_functions - INFO - Early stopping at epoch 550. Best Metrics: (0.0781634239748308, 0.04434426229508196, 0.0713372506988522)
2026-05-23 05:41:10,715 - optuna.study.study - INFO - Trial 152 finished with values: [0.0781634239748308, 0.04434426229508196, 0.0713372506988522] and parameters: {'n_layers': 1, 'embedding_dim': 32, 'lr': 0.00889050274911736, 'lambda_val': 0.001268961959264583, 'batch_size': 1631, 'optimizer': 'Adam'}.
2026-05-23 05:41:15,148 - experiment_functions - INFO - Early stopping at epoch 1050. Best Metrics: (0.05420069578055185, 0.025655737704918035, 0.042827217599825926)
2026-05-23 05:41:15,236 - optuna.study.study - INFO - Trial 153 finished with values: [0.05420069578055185, 0.025655737704918035, 0.042827217599825926] and parameters: {'n_layers': 1, 'embedding_dim': 128, 'lr': 0.00545110887354259, 'lambda_val': 0.003273430437450601, 'batch_size': 893, 'optimizer': 'RMSprop'}.
2026-05-23 05:41:25,467 - experiment_functions - INFO - Early stopping at epoch 3200. Best Metrics: (0.08600556266104617, 0.0489344262295082, 0.07398975393654984)
2026-05-23 05:41:26,766 - optuna.study.study - INFO - Trial 154 finished with values: [0.08600556266104617, 0.0489344262295082, 0.07398975393654984] and parameters: {'n_layers': 1, 'embedding_dim': 96, 'lr': 0.000360608106860257, 'lambda_val': 6.19406847114503e-05, 'batch_size': 1673, 'optimizer': 'RMSprop'}.
2026-05-23 05:41:35,049 - experiment_functions - INFO - Early stopping at epoch 550. Best Metrics: (0.1039063566165083, 0.05098360655737705, 0.08581491408590766)
2026-05-23 05:41:35,479 - optuna.study.study - INFO - Trial 155 finished with values: [0.1039063566165083, 0.05098360655737705, 0.08581491408590766] and parameters: {'n_layers': 1, 'embedding_dim': 32, 'lr': 0.0087991751940927, 'lambda_val': 0.0016208673244223802, 'batch_size': 1844, 'optimizer': 'Adam'}.
2026-05-23 05:41:43,276 - experiment_functions - INFO - Early stopping at epoch 750. Best Metrics: (0.10926715305278875, 0.048852459016393436, 0.08689692418459849)
2026-05-23 05:41:43,379 - optuna.study.study - INFO - Trial 156 finished with values: [0.10926715305278875, 0.048852459016393436, 0.08689692418459849] and parameters: {'n_layers': 1, 'embedding_dim': 256, 'lr': 0.0013934373396930837, 'lambda_val': 0.00013338361174833875, 'batch_size': 1976, 'optimizer': 'Adam'}.
2026-05-23 05:41:50,405 - experiment_functions - INFO - Early stopping at epoch 1800. Best Metrics: (0.0550124126983517, 0.03229508196721312, 0.04898536346905548)
2026-05-23 05:41:50,499 - optuna.study.study - INFO - Trial 157 finished with values: [0.0550124126983517, 0.03229508196721312, 0.04898536346905548] and parameters: {'n_layers': 2, 'embedding_dim': 96, 'lr': 0.0003614258129820434, 'lambda_val': 0.002389697052100668, 'batch_size': 1976, 'optimizer': 'Adam'}.
2026-05-23 05:41:54,746 - experiment_functions - INFO - Early stopping at epoch 1000. Best Metrics: (0.0024188786140720516, 0.0018032786885245904, 0.0026855079127290175)
2026-05-23 05:41:55,438 - optuna.study.study - INFO - Trial 158 finished with values: [0.0024188786140720516, 0.0018032786885245904, 0.0026855079127290175] and parameters: {'n_layers': 1, 'embedding_dim': 256, 'lr': 1.1950359184339538e-05, 'lambda_val': 0.00013338361174833875, 'batch_size': 1794, 'optimizer': 'Adam'}.
2026-05-23 05:41:58,006 - experiment_functions - INFO - Early stopping at epoch 550. Best Metrics: (0.09623850352488, 0.046557377049180323, 0.07964035857764235)
2026-05-23 05:41:58,094 - optuna.study.study - INFO - Trial 159 finished with values: [0.09623850352488, 0.046557377049180323, 0.07964035857764235] and parameters: {'n_layers': 1, 'embedding_dim': 128, 'lr': 0.004748827105127406, 'lambda_val': 1.7408384781052897e-06, 'batch_size': 2590, 'optimizer': 'Adam'}.
2026-05-23 05:42:01,870 - experiment_functions - INFO - Early stopping at epoch 550. Best Metrics: (0.09641102986857437, 0.04827868852459017, 0.08276133984856714)
2026-05-23 05:42:01,958 - optuna.study.study - INFO - Trial 160 finished with values: [0.09641102986857437, 0.04827868852459017, 0.08276133984856714] and parameters: {'n_layers': 1, 'embedding_dim': 32, 'lr': 0.00889050274911736, 'lambda_val': 0.0005805183270689483, 'batch_size': 2591, 'optimizer': 'Adam'}.
2026-05-23 05:42:16,197 - optuna.study.study - INFO - Trial 161 finished with values: [0.11084069114049909, 0.0530327868852459, 0.09297034936445354] and parameters: {'n_layers': 1, 'embedding_dim': 128, 'lr': 0.000360608106860257, 'lambda_val': 6.19406847114503e-05, 'batch_size': 568, 'optimizer': 'Adam'}.
2026-05-23 05:42:25,173 - experiment_functions - INFO - Early stopping at epoch 2750. Best Metrics: (0.10810808723784744, 0.05360655737704918, 0.09081272950742654)
2026-05-23 05:42:25,251 - optuna.study.study - INFO - Trial 162 finished with values: [0.10810808723784744, 0.05360655737704918, 0.09081272950742654] and parameters: {'n_layers': 1, 'embedding_dim': 128, 'lr': 0.000360608106860257, 'lambda_val': 0.00016785947403210068, 'batch_size': 1321, 'optimizer': 'RMSprop'}.
2026-05-23 05:42:28,395 - experiment_functions - INFO - Early stopping at epoch 650. Best Metrics: (0.07392895262906564, 0.039180327868852456, 0.06249903301463329)
2026-05-23 05:42:28,485 - optuna.study.study - INFO - Trial 163 finished with values: [0.07392895262906564, 0.039180327868852456, 0.06249903301463329] and parameters: {'n_layers': 1, 'embedding_dim': 256, 'lr': 0.004748827105127406, 'lambda_val': 1.7408384781052897e-06, 'batch_size': 916, 'optimizer': 'Adam'}.
2026-05-23 05:42:35,864 - experiment_functions - INFO - Early stopping at epoch 1800. Best Metrics: (0.08057576242272706, 0.041475409836065576, 0.06510205271323741)
2026-05-23 05:42:35,958 - optuna.study.study - INFO - Trial 164 finished with values: [0.08057576242272706, 0.041475409836065576, 0.06510205271323741] and parameters: {'n_layers': 2, 'embedding_dim': 128, 'lr': 0.0003614258129820434, 'lambda_val': 2.691057746425052e-06, 'batch_size': 1976, 'optimizer': 'Adam'}.
2026-05-23 05:42:38,818 - experiment_functions - INFO - Early stopping at epoch 750. Best Metrics: (0.0027092963901509995, 0.002377049180327869, 0.0026167502140430525)
2026-05-23 05:42:39,741 - optuna.study.study - INFO - Trial 165 finished with values: [0.0027092963901509995, 0.002377049180327869, 0.0026167502140430525] and parameters: {'n_layers': 1, 'embedding_dim': 32, 'lr': 5.4012095735581406e-05, 'lambda_val': 0.0031180100102822512, 'batch_size': 1844, 'optimizer': 'Adam'}.
2026-05-23 05:42:44,952 - experiment_functions - INFO - Early stopping at epoch 1200. Best Metrics: (0.016663132573791557, 0.013360655737704919, 0.019383956328179467)
2026-05-23 05:42:45,926 - optuna.study.study - INFO - Trial 166 finished with values: [0.016663132573791557, 0.013360655737704919, 0.019383956328179467] and parameters: {'n_layers': 1, 'embedding_dim': 256, 'lr': 0.0087991751940927, 'lambda_val': 0.09659147900560644, 'batch_size': 3460, 'optimizer': 'RMSprop'}.
2026-05-23 05:42:49,183 - experiment_functions - INFO - Early stopping at epoch 800. Best Metrics: (0.09161877275659427, 0.04680327868852459, 0.07347861109955008)
2026-05-23 05:42:50,327 - optuna.study.study - INFO - Trial 167 finished with values: [0.09161877275659427, 0.04680327868852459, 0.07347861109955008] and parameters: {'n_layers': 1, 'embedding_dim': 96, 'lr': 0.001225573456916406, 'lambda_val': 0.002389697052100668, 'batch_size': 2130, 'optimizer': 'Adam'}.
2026-05-23 05:42:54,283 - experiment_functions - INFO - Early stopping at epoch 600. Best Metrics: (0.06253371814052634, 0.03180327868852459, 0.05516410900241203)
2026-05-23 05:42:55,147 - optuna.study.study - INFO - Trial 168 finished with values: [0.06253371814052634, 0.03180327868852459, 0.05516410900241203] and parameters: {'n_layers': 2, 'embedding_dim': 128, 'lr': 0.0026271984480321668, 'lambda_val': 0.0016208673244223802, 'batch_size': 1844, 'optimizer': 'Adam'}.
2026-05-23 05:43:10,568 - experiment_functions - INFO - Early stopping at epoch 2500. Best Metrics: (0.11602038785340597, 0.05631147540983607, 0.09541837506133852)
2026-05-23 05:43:11,327 - optuna.study.study - INFO - Trial 169 finished with values: [0.11602038785340597, 0.05631147540983607, 0.09541837506133852] and parameters: {'n_layers': 1, 'embedding_dim': 256, 'lr': 0.0003614258129820434, 'lambda_val': 0.00013338361174833875, 'batch_size': 1976, 'optimizer': 'RMSprop'}.
2026-05-23 05:43:16,912 - experiment_functions - INFO - Early stopping at epoch 1300. Best Metrics: (0.0680075614656109, 0.039180327868852456, 0.06052312718323609)
2026-05-23 05:43:17,198 - optuna.study.study - INFO - Trial 170 finished with values: [0.0680075614656109, 0.039180327868852456, 0.06052312718323609] and parameters: {'n_layers': 2, 'embedding_dim': 128, 'lr': 0.000360608106860257, 'lambda_val': 6.19406847114503e-05, 'batch_size': 1976, 'optimizer': 'RMSprop'}.
2026-05-23 05:43:23,927 - experiment_functions - INFO - Early stopping at epoch 1500. Best Metrics: (0.07894536972913771, 0.04311475409836066, 0.06532977349972761)
