2026-05-23 04:30:33,072 - optuna.study.study - INFO - Trial 146 finished with values: [0.06419535701897701, 0.038688524590163934, 0.05909729244549085] and parameters: {'n_layers': 2, 'embedding_dim': 64, 'lr': 0.0006640426930867159, 'lambda_val': 0.00010447269915261112, 'batch_size': 1427, 'optimizer': 'RMSprop'}.
2026-05-23 04:30:35,342 - experiment_functions - INFO - Early stopping at epoch 500. Best Metrics: (0.0016754237280623824, 0.0014754098360655738, 0.002366551934501727)
2026-05-23 04:30:35,485 - optuna.study.study - INFO - Trial 147 finished with values: [0.0016754237280623824, 0.0014754098360655738, 0.002366551934501727] and parameters: {'n_layers': 2, 'embedding_dim': 64, 'lr': 0.0010602693611052227, 'lambda_val': 1.374096848370064e-06, 'batch_size': 2454, 'optimizer': 'SGD'}.
2026-05-23 04:30:38,526 - experiment_functions - INFO - Early stopping at epoch 650. Best Metrics: (0.04031873245360909, 0.026967213114754102, 0.03896210779667889)
2026-05-23 04:30:38,643 - optuna.study.study - INFO - Trial 148 finished with values: [0.04031873245360909, 0.026967213114754102, 0.03896210779667889] and parameters: {'n_layers': 3, 'embedding_dim': 96, 'lr': 0.001134436508843411, 'lambda_val': 0.00010447269915261112, 'batch_size': 1427, 'optimizer': 'RMSprop'}.
2026-05-23 04:30:41,036 - experiment_functions - INFO - Early stopping at epoch 550. Best Metrics: (0.02332875023844299, 0.014180327868852462, 0.023183250656498962)
2026-05-23 04:30:41,211 - optuna.study.study - INFO - Trial 149 finished with values: [0.02332875023844299, 0.014180327868852462, 0.023183250656498962] and parameters: {'n_layers': 2, 'embedding_dim': 64, 'lr': 0.004473575507756899, 'lambda_val': 0.0006976990437379927, 'batch_size': 3680, 'optimizer': 'RMSprop'}.
2026-05-23 04:30:49,391 - experiment_functions - INFO - Early stopping at epoch 700. Best Metrics: (0.03719421315259075, 0.01459016393442623, 0.026796379550619333)
2026-05-23 04:30:49,498 - optuna.study.study - INFO - Trial 150 finished with values: [0.03719421315259075, 0.01459016393442623, 0.026796379550619333] and parameters: {'n_layers': 2, 'embedding_dim': 256, 'lr': 0.01729355128210771, 'lambda_val': 0.00010447269915261112, 'batch_size': 1477, 'optimizer': 'Adam'}.
2026-05-23 04:30:52,928 - experiment_functions - INFO - Early stopping at epoch 550. Best Metrics: (0.06157021858330778, 0.030819672131147544, 0.04964076473977687)
2026-05-23 04:30:53,492 - optuna.study.study - INFO - Trial 151 finished with values: [0.06157021858330778, 0.030819672131147544, 0.04964076473977687] and parameters: {'n_layers': 2, 'embedding_dim': 256, 'lr': 0.0012715072595827332, 'lambda_val': 0.00062453091272787, 'batch_size': 3821, 'optimizer': 'RMSprop'}.
2026-05-23 04:30:56,271 - experiment_functions - INFO - Early stopping at epoch 600. Best Metrics: (0.09838689226653975, 0.049426229508196716, 0.07835948555057826)
2026-05-23 04:30:56,341 - optuna.study.study - INFO - Trial 152 finished with values: [0.09838689226653975, 0.049426229508196716, 0.07835948555057826] and parameters: {'n_layers': 1, 'embedding_dim': 64, 'lr': 0.00466856942146688, 'lambda_val': 0.00062453091272787, 'batch_size': 3135, 'optimizer': 'Adam'}.
2026-05-23 04:31:02,887 - experiment_functions - INFO - Early stopping at epoch 1650. Best Metrics: (0.06945288355675341, 0.03827868852459017, 0.055789345784093676)
2026-05-23 04:31:03,783 - optuna.study.study - INFO - Trial 153 finished with values: [0.06945288355675341, 0.03827868852459017, 0.055789345784093676] and parameters: {'n_layers': 2, 'embedding_dim': 32, 'lr': 0.0004803146544874298, 'lambda_val': 0.002225291349266682, 'batch_size': 2183, 'optimizer': 'RMSprop'}.
2026-05-23 04:31:08,290 - experiment_functions - INFO - Early stopping at epoch 800. Best Metrics: (0.058004609916895475, 0.03213114754098361, 0.04906120392669402)
2026-05-23 04:31:08,422 - optuna.study.study - INFO - Trial 154 finished with values: [0.058004609916895475, 0.03213114754098361, 0.04906120392669402] and parameters: {'n_layers': 2, 'embedding_dim': 256, 'lr': 0.0004803146544874298, 'lambda_val': 0.0060103019678805995, 'batch_size': 2183, 'optimizer': 'Adam'}.
2026-05-23 04:31:14,008 - experiment_functions - INFO - Early stopping at epoch 1250. Best Metrics: (0.061492956234686064, 0.03598360655737704, 0.05871838223470611)
2026-05-23 04:31:14,190 - optuna.study.study - INFO - Trial 155 finished with values: [0.061492956234686064, 0.03598360655737704, 0.05871838223470611] and parameters: {'n_layers': 2, 'embedding_dim': 128, 'lr': 0.0003054746060910338, 'lambda_val': 0.0009962507800702286, 'batch_size': 3113, 'optimizer': 'RMSprop'}.
2026-05-23 04:31:29,496 - optuna.study.study - INFO - Trial 156 finished with values: [0.06499115840219845, 0.037540983606557374, 0.056819080914248025] and parameters: {'n_layers': 2, 'embedding_dim': 96, 'lr': 0.00013938780887061617, 'lambda_val': 5.716195116201499e-06, 'batch_size': 1515, 'optimizer': 'Adam'}.
2026-05-23 04:31:38,409 - experiment_functions - INFO - Early stopping at epoch 2500. Best Metrics: (0.044168520514554735, 0.02819672131147541, 0.044146498856367324)
2026-05-23 04:31:38,903 - optuna.study.study - INFO - Trial 157 finished with values: [0.044168520514554735, 0.02819672131147541, 0.044146498856367324] and parameters: {'n_layers': 3, 'embedding_dim': 32, 'lr': 0.00030210764029141594, 'lambda_val': 0.0006753060981377928, 'batch_size': 2288, 'optimizer': 'Adam'}.
2026-05-23 04:31:42,307 - experiment_functions - INFO - Early stopping at epoch 700. Best Metrics: (0.08810451616481182, 0.044426229508196725, 0.07563226451111)
2026-05-23 04:31:42,386 - optuna.study.study - INFO - Trial 158 finished with values: [0.08810451616481182, 0.044426229508196725, 0.07563226451111] and parameters: {'n_layers': 1, 'embedding_dim': 256, 'lr': 0.0006640426930867159, 'lambda_val': 0.006639299505918974, 'batch_size': 2002, 'optimizer': 'RMSprop'}.
2026-05-23 04:31:46,409 - experiment_functions - INFO - Early stopping at epoch 550. Best Metrics: (0.029440963658692074, 0.016557377049180328, 0.02538803955022621)
2026-05-23 04:31:46,750 - optuna.study.study - INFO - Trial 159 finished with values: [0.029440963658692074, 0.016557377049180328, 0.02538803955022621] and parameters: {'n_layers': 3, 'embedding_dim': 256, 'lr': 0.003567094770598002, 'lambda_val': 2.5817364532829402e-05, 'batch_size': 1427, 'optimizer': 'RMSprop'}.
2026-05-23 04:31:57,055 - experiment_functions - INFO - Early stopping at epoch 950. Best Metrics: (0.05580877726486098, 0.033278688524590164, 0.04885138692352041)
2026-05-23 04:31:58,038 - optuna.study.study - INFO - Trial 160 finished with values: [0.05580877726486098, 0.033278688524590164, 0.04885138692352041] and parameters: {'n_layers': 2, 'embedding_dim': 128, 'lr': 0.0004803146544874298, 'lambda_val': 4.043398626155609e-05, 'batch_size': 2902, 'optimizer': 'RMSprop'}.
2026-05-23 04:32:12,936 - optuna.study.study - INFO - Trial 161 finished with values: [0.09748350496058866, 0.05065573770491803, 0.08109978567535694] and parameters: {'n_layers': 1, 'embedding_dim': 64, 'lr': 0.0002758788994373932, 'lambda_val': 0.00010447269915261112, 'batch_size': 1505, 'optimizer': 'RMSprop'}.
2026-05-23 04:32:17,931 - experiment_functions - INFO - Early stopping at epoch 1250. Best Metrics: (0.05556964070470842, 0.03221311475409836, 0.0460255694296531)
2026-05-23 04:32:18,015 - optuna.study.study - INFO - Trial 162 finished with values: [0.05556964070470842, 0.03221311475409836, 0.0460255694296531] and parameters: {'n_layers': 3, 'embedding_dim': 64, 'lr': 0.0005076161055190746, 'lambda_val': 1.5250659263577613e-05, 'batch_size': 2240, 'optimizer': 'Adam'}.
2026-05-23 04:32:24,945 - experiment_functions - INFO - Early stopping at epoch 2300. Best Metrics: (0.08444172896418377, 0.04426229508196721, 0.07333908873214434)
2026-05-23 04:32:25,085 - optuna.study.study - INFO - Trial 163 finished with values: [0.08444172896418377, 0.04426229508196721, 0.07333908873214434] and parameters: {'n_layers': 2, 'embedding_dim': 32, 'lr': 0.0005076161055190746, 'lambda_val': 1.3792344289538332e-06, 'batch_size': 1477, 'optimizer': 'Adam'}.
2026-05-23 04:32:31,986 - experiment_functions - INFO - Early stopping at epoch 2000. Best Metrics: (0.05556258194926004, 0.0330327868852459, 0.05050670157771924)
2026-05-23 04:32:32,069 - optuna.study.study - INFO - Trial 164 finished with values: [0.05556258194926004, 0.0330327868852459, 0.05050670157771924] and parameters: {'n_layers': 1, 'embedding_dim': 64, 'lr': 0.027514332960363132, 'lambda_val': 0.009427137842512492, 'batch_size': 2370, 'optimizer': 'Adam'}.
2026-05-23 04:32:34,983 - experiment_functions - INFO - Early stopping at epoch 700. Best Metrics: (0.056072755684135174, 0.03286885245901639, 0.050173318072893415)
2026-05-23 04:32:35,078 - optuna.study.study - INFO - Trial 165 finished with values: [0.056072755684135174, 0.03286885245901639, 0.050173318072893415] and parameters: {'n_layers': 2, 'embedding_dim': 64, 'lr': 0.0011639497848050708, 'lambda_val': 0.00062453091272787, 'batch_size': 3821, 'optimizer': 'Adam'}.
2026-05-23 04:32:38,409 - experiment_functions - INFO - Early stopping at epoch 750. Best Metrics: (0.0659641816977029, 0.03532786885245901, 0.05503123089658155)
2026-05-23 04:32:38,481 - optuna.study.study - INFO - Trial 166 finished with values: [0.0659641816977029, 0.03532786885245901, 0.05503123089658155] and parameters: {'n_layers': 2, 'embedding_dim': 96, 'lr': 0.0010602693611052227, 'lambda_val': 4.3768288390683484e-05, 'batch_size': 2680, 'optimizer': 'Adam'}.
2026-05-23 04:32:42,350 - experiment_functions - INFO - Early stopping at epoch 700. Best Metrics: (0.06386032276678139, 0.03237704918032787, 0.05296525905149854)
2026-05-23 04:32:42,440 - optuna.study.study - INFO - Trial 167 finished with values: [0.06386032276678139, 0.03237704918032787, 0.05296525905149854] and parameters: {'n_layers': 2, 'embedding_dim': 256, 'lr': 0.0012715072595827332, 'lambda_val': 0.00062453091272787, 'batch_size': 3562, 'optimizer': 'Adam'}.
2026-05-23 04:32:47,151 - experiment_functions - INFO - Early stopping at epoch 1200. Best Metrics: (0.06503912938791934, 0.03467213114754099, 0.05438267905312859)
2026-05-23 04:32:48,477 - optuna.study.study - INFO - Trial 168 finished with values: [0.06503912938791934, 0.03467213114754099, 0.05438267905312859] and parameters: {'n_layers': 2, 'embedding_dim': 96, 'lr': 0.0003054746060910338, 'lambda_val': 0.0002794201622830738, 'batch_size': 4093, 'optimizer': 'RMSprop'}.
2026-05-23 04:33:02,795 - optuna.study.study - INFO - Trial 169 finished with values: [0.04861833871168189, 0.02754098360655738, 0.041229721492740894] and parameters: {'n_layers': 3, 'embedding_dim': 64, 'lr': 0.0001570293281004134, 'lambda_val': 0.0011674275547394154, 'batch_size': 3576, 'optimizer': 'Adam'}.
2026-05-23 04:33:04,996 - experiment_functions - INFO - Early stopping at epoch 550. Best Metrics: (0.02839777104211081, 0.015163934426229509, 0.022778504224495934)
2026-05-23 04:33:05,390 - optuna.study.study - INFO - Trial 170 finished with values: [0.02839777104211081, 0.015163934426229509, 0.022778504224495934] and parameters: {'n_layers': 2, 'embedding_dim': 64, 'lr': 0.01729355128210771, 'lambda_val': 5.983141803621233e-05, 'batch_size': 982, 'optimizer': 'Adam'}.
2026-05-23 04:33:13,276 - experiment_functions - INFO - Early stopping at epoch 500. Best Metrics: (0.0011447947567887788, 0.0013114754098360656, 0.0015244719965979464)
2026-05-23 04:33:13,843 - optuna.study.study - INFO - Trial 171 finished with values: [0.0011447947567887788, 0.0013114754098360656, 0.0015244719965979464] and parameters: {'n_layers': 2, 'embedding_dim': 32, 'lr': 0.0003054746060910338, 'lambda_val': 1.374096848370064e-06, 'batch_size': 601, 'optimizer': 'SGD'}.
2026-05-23 04:33:22,754 - experiment_functions - INFO - Early stopping at epoch 1350. Best Metrics: (0.0546500814750539, 0.031393442622950817, 0.0513480721435333)
2026-05-23 04:33:23,430 - optuna.study.study - INFO - Trial 172 finished with values: [0.0546500814750539, 0.031393442622950817, 0.0513480721435333] and parameters: {'n_layers': 4, 'embedding_dim': 32, 'lr': 0.0005076161055190746, 'lambda_val': 2.5817364532829402e-05, 'batch_size': 1427, 'optimizer': 'RMSprop'}.
2026-05-23 04:33:29,711 - experiment_functions - INFO - Early stopping at epoch 1250. Best Metrics: (0.08196471044592447, 0.04286885245901639, 0.07036493159499024)
2026-05-23 04:33:30,790 - optuna.study.study - INFO - Trial 173 finished with values: [0.08196471044592447, 0.04286885245901639, 0.07036493159499024] and parameters: {'n_layers': 2, 'embedding_dim': 256, 'lr': 0.0003054746060910338, 'lambda_val': 0.0009962507800702286, 'batch_size': 2240, 'optimizer': 'Adam'}.
2026-05-23 04:33:38,006 - experiment_functions - INFO - Early stopping at epoch 2300. Best Metrics: (0.08054479685834556, 0.03991803278688525, 0.06904283900705017)
2026-05-23 04:33:39,034 - optuna.study.study - INFO - Trial 174 finished with values: [0.08054479685834556, 0.03991803278688525, 0.06904283900705017] and parameters: {'n_layers': 2, 'embedding_dim': 64, 'lr': 0.0002758788994373932, 'lambda_val': 8.871062558547097e-05, 'batch_size': 1427, 'optimizer': 'RMSprop'}.
2026-05-23 04:33:43,448 - experiment_functions - INFO - Early stopping at epoch 1150. Best Metrics: (0.09434449551126721, 0.04795081967213115, 0.08186231002380405)
2026-05-23 04:33:43,585 - optuna.study.study - INFO - Trial 175 finished with values: [0.09434449551126721, 0.04795081967213115, 0.08186231002380405] and parameters: {'n_layers': 1, 'embedding_dim': 64, 'lr': 0.0006640426930867159, 'lambda_val': 0.0002794201622830738, 'batch_size': 3576, 'optimizer': 'RMSprop'}.
2026-05-23 04:33:46,900 - experiment_functions - INFO - Early stopping at epoch 650. Best Metrics: (0.05824286621023572, 0.036147540983606556, 0.05334367999360508)
2026-05-23 04:33:47,314 - optuna.study.study - INFO - Trial 176 finished with values: [0.05824286621023572, 0.036147540983606556, 0.05334367999360508] and parameters: {'n_layers': 2, 'embedding_dim': 128, 'lr': 0.0012715072595827332, 'lambda_val': 0.0060103019678805995, 'batch_size': 1954, 'optimizer': 'Adam'}.
2026-05-23 04:33:49,516 - experiment_functions - INFO - Early stopping at epoch 500. Best Metrics: (0.001342645431950562, 0.001475409836065574, 0.0013685438166950849)
2026-05-23 04:33:49,594 - optuna.study.study - INFO - Trial 177 finished with values: [0.001342645431950562, 0.001475409836065574, 0.0013685438166950849] and parameters: {'n_layers': 2, 'embedding_dim': 32, 'lr': 0.0005076161055190746, 'lambda_val': 1.5250659263577613e-05, 'batch_size': 1477, 'optimizer': 'SGD'}.
2026-05-23 04:33:53,294 - experiment_functions - INFO - Early stopping at epoch 950. Best Metrics: (0.055490835140988994, 0.033934426229508194, 0.05273326544807199)
2026-05-23 04:33:53,383 - optuna.study.study - INFO - Trial 178 finished with values: [0.055490835140988994, 0.033934426229508194, 0.05273326544807199] and parameters: {'n_layers': 2, 'embedding_dim': 64, 'lr': 0.0004803146544874298, 'lambda_val': 0.0060103019678805995, 'batch_size': 1954, 'optimizer': 'RMSprop'}.
2026-05-23 04:33:57,735 - experiment_functions - INFO - Early stopping at epoch 1150. Best Metrics: (0.04997366754805187, 0.029672131147540987, 0.04377816893627833)
2026-05-23 04:33:58,011 - optuna.study.study - INFO - Trial 179 finished with values: [0.04997366754805187, 0.029672131147540987, 0.04377816893627833] and parameters: {'n_layers': 2, 'embedding_dim': 64, 'lr': 0.0002758788994373932, 'lambda_val': 0.012719821482421548, 'batch_size': 4093, 'optimizer': 'RMSprop'}.
2026-05-23 04:34:00,579 - experiment_functions - INFO - Early stopping at epoch 500. Best Metrics: (0.00172633998229999, 0.001967213114754099, 0.0020556284833034583)
2026-05-23 04:34:00,679 - optuna.study.study - INFO - Trial 180 finished with values: [0.00172633998229999, 0.001967213114754099, 0.0020556284833034583] and parameters: {'n_layers': 4, 'embedding_dim': 64, 'lr': 0.06396710231262097, 'lambda_val': 0.0006976990437379927, 'batch_size': 2002, 'optimizer': 'SGD'}.
2026-05-23 04:34:02,656 - experiment_functions - INFO - Early stopping at epoch 500. Best Metrics: (0.0020836824929504447, 0.0014754098360655738, 0.0018576237641095919)
2026-05-23 04:34:02,756 - optuna.study.study - INFO - Trial 181 finished with values: [0.0020836824929504447, 0.0014754098360655738, 0.0018576237641095919] and parameters: {'n_layers': 1, 'embedding_dim': 64, 'lr': 0.0005076161055190746, 'lambda_val': 1.5250659263577613e-05, 'batch_size': 3576, 'optimizer': 'SGD'}.
2026-05-23 04:34:08,346 - experiment_functions - INFO - Early stopping at epoch 1350. Best Metrics: (0.08408829983796924, 0.043524590163934423, 0.07366024782484372)
2026-05-23 04:34:08,435 - optuna.study.study - INFO - Trial 182 finished with values: [0.08408829983796924, 0.043524590163934423, 0.07366024782484372] and parameters: {'n_layers': 2, 'embedding_dim': 64, 'lr': 0.0005076161055190746, 'lambda_val': 1.374096848370064e-06, 'batch_size': 1477, 'optimizer': 'Adam'}.
2026-05-23 04:34:11,805 - experiment_functions - INFO - Early stopping at epoch 550. Best Metrics: (0.09810925147809171, 0.04688524590163934, 0.0817922281263596)
2026-05-23 04:34:12,258 - optuna.study.study - INFO - Trial 183 finished with values: [0.09810925147809171, 0.04688524590163934, 0.0817922281263596] and parameters: {'n_layers': 1, 'embedding_dim': 64, 'lr': 0.00466856942146688, 'lambda_val': 0.0004769034760402413, 'batch_size': 3576, 'optimizer': 'Adam'}.
2026-05-23 04:34:23,372 - experiment_functions - INFO - Early stopping at epoch 1500. Best Metrics: (0.06356648176566333, 0.03614754098360656, 0.053401312005246476)
2026-05-23 04:34:23,719 - optuna.study.study - INFO - Trial 184 finished with values: [0.06356648176566333, 0.03614754098360656, 0.053401312005246476] and parameters: {'n_layers': 2, 'embedding_dim': 64, 'lr': 0.0005076161055190746, 'lambda_val': 1.5250659263577613e-05, 'batch_size': 3456, 'optimizer': 'Adam'}.
2026-05-23 04:34:27,437 - experiment_functions - INFO - Early stopping at epoch 1050. Best Metrics: (0.05057397458246522, 0.03295081967213115, 0.04595765404820679)
2026-05-23 04:34:27,661 - optuna.study.study - INFO - Trial 185 finished with values: [0.05057397458246522, 0.03295081967213115, 0.04595765404820679] and parameters: {'n_layers': 2, 'embedding_dim': 64, 'lr': 0.0004803146544874298, 'lambda_val': 0.0060103019678805995, 'batch_size': 1427, 'optimizer': 'RMSprop'}.
2026-05-23 04:34:36,451 - experiment_functions - INFO - Early stopping at epoch 3000. Best Metrics: (0.06791492808116809, 0.040409836065573766, 0.06060701689173511)
2026-05-23 04:34:36,553 - optuna.study.study - INFO - Trial 186 finished with values: [0.06791492808116809, 0.040409836065573766, 0.06060701689173511] and parameters: {'n_layers': 2, 'embedding_dim': 32, 'lr': 0.0003054746060910338, 'lambda_val': 0.0009962507800702286, 'batch_size': 2987, 'optimizer': 'RMSprop'}.
2026-05-23 04:34:39,168 - experiment_functions - INFO - Early stopping at epoch 550. Best Metrics: (0.0822081208559393, 0.04327868852459016, 0.07348739384293952)
2026-05-23 04:34:39,265 - optuna.study.study - INFO - Trial 187 finished with values: [0.0822081208559393, 0.04327868852459016, 0.07348739384293952] and parameters: {'n_layers': 1, 'embedding_dim': 64, 'lr': 0.00466856942146688, 'lambda_val': 0.009427137842512492, 'batch_size': 3135, 'optimizer': 'Adam'}.
2026-05-23 04:34:51,271 - optuna.study.study - INFO - Trial 188 finished with values: [0.0766341425969011, 0.04327868852459016, 0.06925572080954925] and parameters: {'n_layers': 1, 'embedding_dim': 64, 'lr': 0.0002433821756193056, 'lambda_val': 0.00044044195678744806, 'batch_size': 944, 'optimizer': 'Adam'}.
2026-05-23 04:34:57,849 - experiment_functions - INFO - Early stopping at epoch 1150. Best Metrics: (0.06350682227447978, 0.03647540983606557, 0.057536318002054915)
2026-05-23 04:34:58,034 - optuna.study.study - INFO - Trial 189 finished with values: [0.06350682227447978, 0.03647540983606557, 0.057536318002054915] and parameters: {'n_layers': 3, 'embedding_dim': 256, 'lr': 0.00030210764029141594, 'lambda_val': 0.00010447269915261112, 'batch_size': 1427, 'optimizer': 'RMSprop'}.
2026-05-23 04:35:04,630 - experiment_functions - INFO - Early stopping at epoch 1500. Best Metrics: (0.08584637040757563, 0.04360655737704918, 0.0740869520641944)
2026-05-23 04:35:04,731 - optuna.study.study - INFO - Trial 190 finished with values: [0.08584637040757563, 0.04360655737704918, 0.0740869520641944] and parameters: {'n_layers': 2, 'embedding_dim': 128, 'lr': 0.00039831203487280473, 'lambda_val': 0.002225291349266682, 'batch_size': 849, 'optimizer': 'RMSprop'}.
2026-05-23 04:35:22,574 - experiment_functions - INFO - Early stopping at epoch 3800. Best Metrics: (0.0871770910105069, 0.04516393442622951, 0.07173898159502189)
2026-05-23 04:35:22,757 - optuna.study.study - INFO - Trial 191 finished with values: [0.0871770910105069, 0.04516393442622951, 0.07173898159502189] and parameters: {'n_layers': 2, 'embedding_dim': 256, 'lr': 0.00013938780887061617, 'lambda_val': 5.716195116201499e-06, 'batch_size': 1720, 'optimizer': 'RMSprop'}.
2026-05-23 04:35:25,004 - experiment_functions - INFO - Early stopping at epoch 500. Best Metrics: (0.001966567067524073, 0.0020491803278688526, 0.002656145722470606)
2026-05-23 04:35:25,164 - optuna.study.study - INFO - Trial 192 finished with values: [0.001966567067524073, 0.0020491803278688526, 0.002656145722470606] and parameters: {'n_layers': 1, 'embedding_dim': 32, 'lr': 0.0399895421175634, 'lambda_val': 0.000832274284637742, 'batch_size': 3188, 'optimizer': 'SGD'}.
2026-05-23 04:35:36,121 - experiment_functions - INFO - Early stopping at epoch 3150. Best Metrics: (0.06768921517069927, 0.039098360655737706, 0.06147905649237352)
