2026-05-23 01:59:28,335 - optuna.study.study - INFO - Trial 235 finished with values: [0.03209213283889902, 0.018934426229508198, 0.028611419894919034] and parameters: {'n_layers': 2, 'embedding_dim': 256, 'lr': 0.0002669734398444981, 'lambda_val': 3.6888192788873195e-06, 'batch_size': 1493, 'optimizer': 'Adam'}.
2026-05-23 01:59:30,660 - experiment_functions - INFO - Early stopping at epoch 600. Best Metrics: (0.022005989775234117, 0.012868852459016394, 0.018779380881623408)
2026-05-23 01:59:30,757 - optuna.study.study - INFO - Trial 236 finished with values: [0.022005989775234117, 0.012868852459016394, 0.018779380881623408] and parameters: {'n_layers': 3, 'embedding_dim': 32, 'lr': 0.0021679791502810398, 'lambda_val': 0.001138541292442641, 'batch_size': 3802, 'optimizer': 'Adam'}.
2026-05-23 01:59:40,022 - optuna.study.study - INFO - Trial 237 finished with values: [0.024962532231393306, 0.01647540983606557, 0.02402161230644992] and parameters: {'n_layers': 1, 'embedding_dim': 64, 'lr': 0.0002669734398444981, 'lambda_val': 2.2024563054207274e-05, 'batch_size': 733, 'optimizer': 'Adam'}.
2026-05-23 01:59:46,030 - experiment_functions - INFO - Early stopping at epoch 2100. Best Metrics: (0.036273407243012146, 0.01795081967213115, 0.029330800222688434)
2026-05-23 01:59:46,290 - optuna.study.study - INFO - Trial 238 finished with values: [0.036273407243012146, 0.01795081967213115, 0.029330800222688434] and parameters: {'n_layers': 2, 'embedding_dim': 128, 'lr': 0.0002669734398444981, 'lambda_val': 2.093095368912283e-06, 'batch_size': 1759, 'optimizer': 'Adam'}.
2026-05-23 01:59:49,855 - experiment_functions - INFO - Early stopping at epoch 1150. Best Metrics: (0.028304068483742104, 0.018606557377049183, 0.029000264820481274)
2026-05-23 01:59:51,134 - optuna.study.study - INFO - Trial 239 finished with values: [0.028304068483742104, 0.018606557377049183, 0.029000264820481274] and parameters: {'n_layers': 1, 'embedding_dim': 96, 'lr': 0.0006111868479200038, 'lambda_val': 0.0017105841747060543, 'batch_size': 2925, 'optimizer': 'RMSprop'}.
2026-05-23 01:59:54,621 - experiment_functions - INFO - Early stopping at epoch 1000. Best Metrics: (0.0317935350188524, 0.019262295081967213, 0.026467507094367262)
2026-05-23 01:59:54,715 - optuna.study.study - INFO - Trial 240 finished with values: [0.0317935350188524, 0.019262295081967213, 0.026467507094367262] and parameters: {'n_layers': 3, 'embedding_dim': 128, 'lr': 0.0006111868479200038, 'lambda_val': 3.317665133673459e-05, 'batch_size': 728, 'optimizer': 'Adam'}.
2026-05-23 01:59:59,707 - experiment_functions - INFO - Early stopping at epoch 1950. Best Metrics: (0.03162015039272484, 0.017704918032786888, 0.028516848770529027)
2026-05-23 01:59:59,811 - optuna.study.study - INFO - Trial 241 finished with values: [0.03162015039272484, 0.017704918032786888, 0.028516848770529027] and parameters: {'n_layers': 1, 'embedding_dim': 96, 'lr': 0.00036519209261400785, 'lambda_val': 0.0004597460119892848, 'batch_size': 1475, 'optimizer': 'RMSprop'}.
2026-05-23 02:00:01,755 - experiment_functions - INFO - Early stopping at epoch 500. Best Metrics: (0.002382815746870435, 0.002295081967213115, 0.0027466312059099144)
2026-05-23 02:00:01,859 - optuna.study.study - INFO - Trial 242 finished with values: [0.002382815746870435, 0.002295081967213115, 0.0027466312059099144] and parameters: {'n_layers': 1, 'embedding_dim': 64, 'lr': 0.0013488534539100193, 'lambda_val': 1.901210707193677e-05, 'batch_size': 833, 'optimizer': 'SGD'}.
2026-05-23 02:00:06,409 - experiment_functions - INFO - Early stopping at epoch 1150. Best Metrics: (0.03266384450912553, 0.018688524590163937, 0.029430936593329175)
2026-05-23 02:00:06,751 - optuna.study.study - INFO - Trial 243 finished with values: [0.03266384450912553, 0.018688524590163937, 0.029430936593329175] and parameters: {'n_layers': 1, 'embedding_dim': 64, 'lr': 0.0013488534539100193, 'lambda_val': 7.337492410061229e-06, 'batch_size': 733, 'optimizer': 'Adam'}.
2026-05-23 02:00:20,232 - experiment_functions - INFO - Early stopping at epoch 3000. Best Metrics: (0.03210751466644847, 0.01901639344262295, 0.02814074389757123)
2026-05-23 02:00:20,314 - optuna.study.study - INFO - Trial 244 finished with values: [0.03210751466644847, 0.01901639344262295, 0.02814074389757123] and parameters: {'n_layers': 1, 'embedding_dim': 128, 'lr': 0.000302020510284504, 'lambda_val': 0.005724843503092353, 'batch_size': 1292, 'optimizer': 'Adam'}.
2026-05-23 02:00:23,990 - experiment_functions - INFO - Early stopping at epoch 1300. Best Metrics: (0.03666270842197846, 0.019344262295081967, 0.029740617138863328)
2026-05-23 02:00:24,112 - optuna.study.study - INFO - Trial 245 finished with values: [0.03666270842197846, 0.019344262295081967, 0.029740617138863328] and parameters: {'n_layers': 2, 'embedding_dim': 96, 'lr': 0.0006111868479200038, 'lambda_val': 2.2024563054207274e-05, 'batch_size': 733, 'optimizer': 'Adam'}.
2026-05-23 02:00:26,722 - experiment_functions - INFO - Early stopping at epoch 850. Best Metrics: (0.014818294635686263, 0.009754098360655739, 0.014821626203975162)
2026-05-23 02:00:26,817 - optuna.study.study - INFO - Trial 246 finished with values: [0.014818294635686263, 0.009754098360655739, 0.014821626203975162] and parameters: {'n_layers': 1, 'embedding_dim': 32, 'lr': 0.08332750349565263, 'lambda_val': 2.093095368912283e-06, 'batch_size': 733, 'optimizer': 'RMSprop'}.
2026-05-23 02:00:30,472 - experiment_functions - INFO - Early stopping at epoch 1100. Best Metrics: (0.033670312228261286, 0.019344262295081967, 0.03160589831267779)
2026-05-23 02:00:30,562 - optuna.study.study - INFO - Trial 247 finished with values: [0.033670312228261286, 0.019344262295081967, 0.03160589831267779] and parameters: {'n_layers': 1, 'embedding_dim': 256, 'lr': 0.0013488534539100193, 'lambda_val': 3.2250899740263746e-06, 'batch_size': 733, 'optimizer': 'Adam'}.
2026-05-23 02:00:32,704 - experiment_functions - INFO - Early stopping at epoch 600. Best Metrics: (0.02777446773453762, 0.014180327868852462, 0.022847865414813057)
2026-05-23 02:00:32,792 - optuna.study.study - INFO - Trial 248 finished with values: [0.02777446773453762, 0.014180327868852462, 0.022847865414813057] and parameters: {'n_layers': 2, 'embedding_dim': 64, 'lr': 0.004412673482764488, 'lambda_val': 1.2922176688378956e-05, 'batch_size': 2912, 'optimizer': 'Adam'}.
2026-05-23 02:00:37,671 - experiment_functions - INFO - Early stopping at epoch 1400. Best Metrics: (0.00230814968794095, 0.002295081967213115, 0.003359944669764272)
2026-05-23 02:00:39,018 - optuna.study.study - INFO - Trial 249 finished with values: [0.00230814968794095, 0.002295081967213115, 0.003359944669764272] and parameters: {'n_layers': 3, 'embedding_dim': 128, 'lr': 1.8800559076759978e-05, 'lambda_val': 0.0004430479375371788, 'batch_size': 3273, 'optimizer': 'Adam'}.
2026-05-23 02:00:42,369 - experiment_functions - INFO - Early stopping at epoch 850. Best Metrics: (0.03002298562368206, 0.017540983606557377, 0.026015850747722037)
2026-05-23 02:00:42,459 - optuna.study.study - INFO - Trial 250 finished with values: [0.03002298562368206, 0.017540983606557377, 0.026015850747722037] and parameters: {'n_layers': 2, 'embedding_dim': 96, 'lr': 0.0006111868479200038, 'lambda_val': 0.0017105841747060543, 'batch_size': 3166, 'optimizer': 'RMSprop'}.
2026-05-23 02:00:46,418 - experiment_functions - INFO - Early stopping at epoch 1000. Best Metrics: (0.030151716717149935, 0.018606557377049183, 0.029511394445187685)
2026-05-23 02:00:46,651 - optuna.study.study - INFO - Trial 251 finished with values: [0.030151716717149935, 0.018606557377049183, 0.029511394445187685] and parameters: {'n_layers': 3, 'embedding_dim': 128, 'lr': 0.0006111868479200038, 'lambda_val': 0.00038573936819964353, 'batch_size': 728, 'optimizer': 'Adam'}.
2026-05-23 02:00:49,964 - experiment_functions - INFO - Early stopping at epoch 950. Best Metrics: (0.03372459441454287, 0.01819672131147541, 0.026366221891702346)
2026-05-23 02:00:50,207 - optuna.study.study - INFO - Trial 252 finished with values: [0.03372459441454287, 0.01819672131147541, 0.026366221891702346] and parameters: {'n_layers': 1, 'embedding_dim': 64, 'lr': 0.0013488534539100193, 'lambda_val': 0.001138541292442641, 'batch_size': 733, 'optimizer': 'Adam'}.
2026-05-23 02:00:57,230 - experiment_functions - INFO - Early stopping at epoch 500. Best Metrics: (0.001417009252326211, 0.0013934426229508196, 0.0017320329902743678)
2026-05-23 02:00:57,722 - optuna.study.study - INFO - Trial 253 finished with values: [0.001417009252326211, 0.0013934426229508196, 0.0017320329902743678] and parameters: {'n_layers': 1, 'embedding_dim': 64, 'lr': 0.0013488534539100193, 'lambda_val': 0.001138541292442641, 'batch_size': 733, 'optimizer': 'SGD'}.
2026-05-23 02:01:14,738 - optuna.study.study - INFO - Trial 254 finished with values: [0.02942164034637234, 0.017704918032786888, 0.029407863359621027] and parameters: {'n_layers': 1, 'embedding_dim': 128, 'lr': 0.000302020510284504, 'lambda_val': 3.7205125829824535e-06, 'batch_size': 728, 'optimizer': 'Adam'}.
2026-05-23 02:01:16,766 - experiment_functions - INFO - Early stopping at epoch 500. Best Metrics: (0.0017123738170170425, 0.0011475409836065576, 0.001520296700880322)
2026-05-23 02:01:16,934 - optuna.study.study - INFO - Trial 255 finished with values: [0.0017123738170170425, 0.0011475409836065576, 0.001520296700880322] and parameters: {'n_layers': 1, 'embedding_dim': 64, 'lr': 0.0018860187490457373, 'lambda_val': 0.001138541292442641, 'batch_size': 1003, 'optimizer': 'SGD'}.
2026-05-23 02:01:19,484 - experiment_functions - INFO - Early stopping at epoch 600. Best Metrics: (0.02786038637901696, 0.017131147540983604, 0.027314682682583424)
2026-05-23 02:01:19,588 - optuna.study.study - INFO - Trial 256 finished with values: [0.02786038637901696, 0.017131147540983604, 0.027314682682583424] and parameters: {'n_layers': 1, 'embedding_dim': 256, 'lr': 0.0073698882645500145, 'lambda_val': 0.001138541292442641, 'batch_size': 733, 'optimizer': 'Adam'}.
2026-05-23 02:01:25,109 - experiment_functions - INFO - Early stopping at epoch 1550. Best Metrics: (0.03134785078684733, 0.018852459016393444, 0.029828152349414373)
2026-05-23 02:01:25,316 - optuna.study.study - INFO - Trial 257 finished with values: [0.03134785078684733, 0.018852459016393444, 0.029828152349414373] and parameters: {'n_layers': 1, 'embedding_dim': 256, 'lr': 0.00036519209261400785, 'lambda_val': 0.00038573936819964353, 'batch_size': 2578, 'optimizer': 'RMSprop'}.
2026-05-23 02:01:27,930 - experiment_functions - INFO - Early stopping at epoch 550. Best Metrics: (0.025462840988228593, 0.016065573770491805, 0.02409295496852659)
2026-05-23 02:01:28,021 - optuna.study.study - INFO - Trial 258 finished with values: [0.025462840988228593, 0.016065573770491805, 0.02409295496852659] and parameters: {'n_layers': 2, 'embedding_dim': 256, 'lr': 0.0037628057693077097, 'lambda_val': 0.0029444127697785846, 'batch_size': 1056, 'optimizer': 'Adam'}.
2026-05-23 02:01:30,504 - experiment_functions - INFO - Early stopping at epoch 500. Best Metrics: (0.0031629907037555626, 0.001557377049180328, 0.0019927354101571975)
2026-05-23 02:01:30,594 - optuna.study.study - INFO - Trial 259 finished with values: [0.0031629907037555626, 0.001557377049180328, 0.0019927354101571975] and parameters: {'n_layers': 3, 'embedding_dim': 256, 'lr': 0.0018860187490457373, 'lambda_val': 1.218758628427785e-06, 'batch_size': 728, 'optimizer': 'SGD'}.
2026-05-23 02:01:40,557 - experiment_functions - INFO - Early stopping at epoch 2850. Best Metrics: (0.03133828075278738, 0.019098360655737705, 0.031555255671157516)
2026-05-23 02:01:41,291 - optuna.study.study - INFO - Trial 260 finished with values: [0.03133828075278738, 0.019098360655737705, 0.031555255671157516] and parameters: {'n_layers': 2, 'embedding_dim': 256, 'lr': 0.0002669734398444981, 'lambda_val': 1.901210707193677e-05, 'batch_size': 833, 'optimizer': 'Adam'}.
2026-05-23 02:01:43,442 - experiment_functions - INFO - Early stopping at epoch 500. Best Metrics: (0.0014331228064161491, 0.0009836065573770494, 0.0012826001836929218)
2026-05-23 02:01:43,537 - optuna.study.study - INFO - Trial 261 finished with values: [0.0014331228064161491, 0.0009836065573770494, 0.0012826001836929218] and parameters: {'n_layers': 3, 'embedding_dim': 64, 'lr': 0.0013488534539100193, 'lambda_val': 6.920826707938834e-06, 'batch_size': 3834, 'optimizer': 'SGD'}.
2026-05-23 02:01:49,038 - experiment_functions - INFO - Early stopping at epoch 1250. Best Metrics: (0.029335913538581494, 0.017786885245901638, 0.026836141813143796)
2026-05-23 02:01:49,475 - optuna.study.study - INFO - Trial 262 finished with values: [0.029335913538581494, 0.017786885245901638, 0.026836141813143796] and parameters: {'n_layers': 1, 'embedding_dim': 64, 'lr': 0.0006111868479200038, 'lambda_val': 0.0017105841747060543, 'batch_size': 3166, 'optimizer': 'RMSprop'}.
2026-05-23 02:01:57,457 - experiment_functions - INFO - Early stopping at epoch 700. Best Metrics: (0.03286666612240998, 0.018606557377049183, 0.029799902235334987)
2026-05-23 02:01:58,174 - optuna.study.study - INFO - Trial 263 finished with values: [0.03286666612240998, 0.018606557377049183, 0.029799902235334987] and parameters: {'n_layers': 3, 'embedding_dim': 64, 'lr': 0.0013488534539100193, 'lambda_val': 0.001138541292442641, 'batch_size': 733, 'optimizer': 'Adam'}.
2026-05-23 02:02:04,189 - experiment_functions - INFO - Early stopping at epoch 1250. Best Metrics: (0.02973613773323056, 0.01762295081967213, 0.027805784382506662)
2026-05-23 02:02:04,288 - optuna.study.study - INFO - Trial 264 finished with values: [0.02973613773323056, 0.01762295081967213, 0.027805784382506662] and parameters: {'n_layers': 3, 'embedding_dim': 128, 'lr': 0.00036519209261400785, 'lambda_val': 0.00038573936819964353, 'batch_size': 1493, 'optimizer': 'Adam'}.
2026-05-23 02:02:07,263 - experiment_functions - INFO - Early stopping at epoch 950. Best Metrics: (0.034546935065603974, 0.01852459016393443, 0.02842866641482305)
2026-05-23 02:02:07,356 - optuna.study.study - INFO - Trial 265 finished with values: [0.034546935065603974, 0.01852459016393443, 0.02842866641482305] and parameters: {'n_layers': 1, 'embedding_dim': 32, 'lr': 0.0013488534539100193, 'lambda_val': 0.0004597460119892848, 'batch_size': 733, 'optimizer': 'Adam'}.
2026-05-23 02:02:15,309 - experiment_functions - INFO - Early stopping at epoch 2550. Best Metrics: (0.03699408785071258, 0.020901639344262295, 0.02969593331318314)
2026-05-23 02:02:15,403 - optuna.study.study - INFO - Trial 266 finished with values: [0.03699408785071258, 0.020901639344262295, 0.02969593331318314] and parameters: {'n_layers': 3, 'embedding_dim': 128, 'lr': 0.000302020510284504, 'lambda_val': 0.0005985360677675016, 'batch_size': 733, 'optimizer': 'Adam'}.
2026-05-23 02:02:18,540 - experiment_functions - INFO - Early stopping at epoch 1000. Best Metrics: (0.0343755659248633, 0.01942622950819672, 0.029222122771237136)
2026-05-23 02:02:18,750 - optuna.study.study - INFO - Trial 267 finished with values: [0.0343755659248633, 0.01942622950819672, 0.029222122771237136] and parameters: {'n_layers': 1, 'embedding_dim': 64, 'lr': 0.0013488534539100193, 'lambda_val': 2.093095368912283e-06, 'batch_size': 733, 'optimizer': 'Adam'}.
2026-05-23 02:02:22,281 - experiment_functions - INFO - Early stopping at epoch 850. Best Metrics: (0.03394022740975487, 0.01778688524590164, 0.02665887499342082)
2026-05-23 02:02:22,854 - optuna.study.study - INFO - Trial 268 finished with values: [0.03394022740975487, 0.01778688524590164, 0.02665887499342082] and parameters: {'n_layers': 3, 'embedding_dim': 128, 'lr': 0.0006111868479200038, 'lambda_val': 0.001138541292442641, 'batch_size': 2585, 'optimizer': 'Adam'}.
2026-05-23 02:02:26,837 - experiment_functions - INFO - Early stopping at epoch 1100. Best Metrics: (0.029145605682512295, 0.016311475409836067, 0.02568090346158092)
2026-05-23 02:02:27,332 - optuna.study.study - INFO - Trial 269 finished with values: [0.029145605682512295, 0.016311475409836067, 0.02568090346158092] and parameters: {'n_layers': 2, 'embedding_dim': 64, 'lr': 0.0006111868479200038, 'lambda_val': 0.0017105841747060543, 'batch_size': 3166, 'optimizer': 'Adam'}.
2026-05-23 02:02:29,491 - experiment_functions - INFO - Early stopping at epoch 500. Best Metrics: (0.002507559384094086, 0.001557377049180328, 0.0021178436412802194)
2026-05-23 02:02:29,589 - optuna.study.study - INFO - Trial 270 finished with values: [0.002507559384094086, 0.001557377049180328, 0.0021178436412802194] and parameters: {'n_layers': 1, 'embedding_dim': 64, 'lr': 0.0006111868479200038, 'lambda_val': 0.0017105841747060543, 'batch_size': 3166, 'optimizer': 'SGD'}.
2026-05-23 02:02:32,997 - experiment_functions - INFO - Early stopping at epoch 1000. Best Metrics: (0.03495442489607974, 0.02057377049180328, 0.032209064296840464)
2026-05-23 02:02:33,100 - optuna.study.study - INFO - Trial 271 finished with values: [0.03495442489607974, 0.02057377049180328, 0.032209064296840464] and parameters: {'n_layers': 1, 'embedding_dim': 64, 'lr': 0.0013488534539100193, 'lambda_val': 0.001138541292442641, 'batch_size': 1549, 'optimizer': 'Adam'}.
2026-05-23 02:02:36,309 - experiment_functions - INFO - Early stopping at epoch 700. Best Metrics: (0.030587356961890137, 0.016639344262295082, 0.026924876838409495)
2026-05-23 02:02:36,397 - optuna.study.study - INFO - Trial 272 finished with values: [0.030587356961890137, 0.016639344262295082, 0.026924876838409495] and parameters: {'n_layers': 3, 'embedding_dim': 64, 'lr': 0.0013488534539100193, 'lambda_val': 7.337492410061229e-06, 'batch_size': 728, 'optimizer': 'Adam'}.
2026-05-23 02:02:47,347 - experiment_functions - INFO - Early stopping at epoch 3900. Best Metrics: (0.03147839452008861, 0.018688524590163937, 0.028238839456422995)
2026-05-23 02:02:48,719 - optuna.study.study - INFO - Trial 273 finished with values: [0.03147839452008861, 0.018688524590163937, 0.028238839456422995] and parameters: {'n_layers': 1, 'embedding_dim': 64, 'lr': 0.00036519209261400785, 'lambda_val': 0.0006841616188567225, 'batch_size': 733, 'optimizer': 'Adam'}.
2026-05-23 02:03:02,056 - optuna.study.study - INFO - Trial 274 finished with values: [0.03369690861253972, 0.01762295081967213, 0.02871333721824583] and parameters: {'n_layers': 1, 'embedding_dim': 64, 'lr': 0.000302020510284504, 'lambda_val': 0.001138541292442641, 'batch_size': 3802, 'optimizer': 'Adam'}.
2026-05-23 02:03:06,583 - experiment_functions - INFO - Early stopping at epoch 1400. Best Metrics: (0.003689822454170812, 0.002540983606557377, 0.003059936931929684)
2026-05-23 02:03:06,687 - optuna.study.study - INFO - Trial 275 finished with values: [0.003689822454170812, 0.002540983606557377, 0.003059936931929684] and parameters: {'n_layers': 1, 'embedding_dim': 128, 'lr': 4.655512503233057e-05, 'lambda_val': 0.0017105841747060543, 'batch_size': 728, 'optimizer': 'Adam'}.
2026-05-23 02:03:10,091 - experiment_functions - INFO - Early stopping at epoch 700. Best Metrics: (0.034723018703885784, 0.018852459016393444, 0.030411406236599034)
2026-05-23 02:03:10,194 - optuna.study.study - INFO - Trial 276 finished with values: [0.034723018703885784, 0.018852459016393444, 0.030411406236599034] and parameters: {'n_layers': 3, 'embedding_dim': 256, 'lr': 0.0008408219441387434, 'lambda_val': 3.7205125829824535e-06, 'batch_size': 1493, 'optimizer': 'Adam'}.
2026-05-23 02:03:13,254 - experiment_functions - INFO - Early stopping at epoch 850. Best Metrics: (0.031661564886560155, 0.01901639344262295, 0.027703617143964233)
2026-05-23 02:03:13,695 - optuna.study.study - INFO - Trial 277 finished with values: [0.031661564886560155, 0.01901639344262295, 0.027703617143964233] and parameters: {'n_layers': 1, 'embedding_dim': 128, 'lr': 0.0018860187490457373, 'lambda_val': 0.001138541292442641, 'batch_size': 733, 'optimizer': 'Adam'}.
2026-05-23 02:03:24,210 - experiment_functions - INFO - Early stopping at epoch 3700. Best Metrics: (0.030206455261460367, 0.01819672131147541, 0.02635561327532649)
2026-05-23 02:03:25,203 - optuna.study.study - INFO - Trial 278 finished with values: [0.030206455261460367, 0.01819672131147541, 0.02635561327532649] and parameters: {'n_layers': 1, 'embedding_dim': 96, 'lr': 0.00036519209261400785, 'lambda_val': 0.0029444127697785846, 'batch_size': 1475, 'optimizer': 'Adam'}.
2026-05-23 02:03:28,809 - experiment_functions - INFO - Early stopping at epoch 1050. Best Metrics: (0.03114398070466589, 0.01680327868852459, 0.029079624861398104)
2026-05-23 02:03:28,908 - optuna.study.study - INFO - Trial 279 finished with values: [0.03114398070466589, 0.01680327868852459, 0.029079624861398104] and parameters: {'n_layers': 1, 'embedding_dim': 64, 'lr': 0.0013488534539100193, 'lambda_val': 0.001138541292442641, 'batch_size': 1282, 'optimizer': 'Adam'}.
2026-05-23 02:03:31,641 - experiment_functions - INFO - Early stopping at epoch 750. Best Metrics: (0.037506082399435293, 0.019426229508196724, 0.031365606655420805)
2026-05-23 02:03:31,723 - optuna.study.study - INFO - Trial 280 finished with values: [0.037506082399435293, 0.019426229508196724, 0.031365606655420805] and parameters: {'n_layers': 1, 'embedding_dim': 32, 'lr': 0.0021679791502810398, 'lambda_val': 0.001138541292442641, 'batch_size': 2080, 'optimizer': 'Adam'}.
2026-05-23 02:03:35,237 - experiment_functions - INFO - Early stopping at epoch 650. Best Metrics: (0.028637884988530156, 0.01639344262295082, 0.025608540702742735)
2026-05-23 02:03:35,473 - optuna.study.study - INFO - Trial 281 finished with values: [0.028637884988530156, 0.01639344262295082, 0.025608540702742735] and parameters: {'n_layers': 4, 'embedding_dim': 256, 'lr': 0.0006111868479200038, 'lambda_val': 4.942836147907753e-06, 'batch_size': 833, 'optimizer': 'RMSprop'}.
