2026-05-23 00:37:01,049 - optuna.study.study - INFO - Trial 207 finished with values: [0.032110844635071384, 0.01942622950819672, 0.027744516863570778] and parameters: {'n_layers': 2, 'embedding_dim': 256, 'lr': 0.0002242398424095658, 'lambda_val': 0.003265600459695188, 'batch_size': 1603, 'optimizer': 'RMSprop'}.
2026-05-23 00:37:09,993 - optuna.study.study - INFO - Trial 208 finished with values: [0.028686909557914815, 0.017131147540983604, 0.02834987960777596] and parameters: {'n_layers': 1, 'embedding_dim': 96, 'lr': 0.0003566717415961628, 'lambda_val': 4.416597544825473e-05, 'batch_size': 1369, 'optimizer': 'Adam'}.
2026-05-23 00:37:15,969 - experiment_functions - INFO - Early stopping at epoch 1750. Best Metrics: (0.03930967306601306, 0.02114754098360656, 0.031528179029823446)
2026-05-23 00:37:16,385 - optuna.study.study - INFO - Trial 209 finished with values: [0.03930967306601306, 0.02114754098360656, 0.031528179029823446] and parameters: {'n_layers': 2, 'embedding_dim': 256, 'lr': 0.00029826529867114525, 'lambda_val': 1.7207712053457044e-06, 'batch_size': 1243, 'optimizer': 'Adam'}.
2026-05-23 00:37:18,466 - experiment_functions - INFO - Early stopping at epoch 550. Best Metrics: (0.02188899849571049, 0.01377049180327869, 0.01860585359273786)
2026-05-23 00:37:18,597 - optuna.study.study - INFO - Trial 210 finished with values: [0.02188899849571049, 0.01377049180327869, 0.01860585359273786] and parameters: {'n_layers': 1, 'embedding_dim': 96, 'lr': 0.004849652609435375, 'lambda_val': 0.006734268474296521, 'batch_size': 2642, 'optimizer': 'RMSprop'}.
2026-05-23 00:37:20,590 - experiment_functions - INFO - Early stopping at epoch 600. Best Metrics: (0.0341073783385563, 0.018688524590163933, 0.028741241796262206)
2026-05-23 00:37:20,677 - optuna.study.study - INFO - Trial 211 finished with values: [0.0341073783385563, 0.018688524590163933, 0.028741241796262206] and parameters: {'n_layers': 1, 'embedding_dim': 96, 'lr': 0.006147790205056758, 'lambda_val': 0.0002603879699437796, 'batch_size': 1833, 'optimizer': 'Adam'}.
2026-05-23 00:37:24,591 - experiment_functions - INFO - Early stopping at epoch 1000. Best Metrics: (0.03393867937446613, 0.01901639344262295, 0.02889355617067939)
2026-05-23 00:37:24,775 - optuna.study.study - INFO - Trial 212 finished with values: [0.03393867937446613, 0.01901639344262295, 0.02889355617067939] and parameters: {'n_layers': 2, 'embedding_dim': 256, 'lr': 0.0005513489459732522, 'lambda_val': 0.00011624026828970741, 'batch_size': 2491, 'optimizer': 'Adam'}.
2026-05-23 00:37:34,221 - experiment_functions - INFO - Early stopping at epoch 2400. Best Metrics: (0.028973545202130236, 0.017131147540983604, 0.024011050738379537)
2026-05-23 00:37:34,592 - optuna.study.study - INFO - Trial 213 finished with values: [0.028973545202130236, 0.017131147540983604, 0.024011050738379537] and parameters: {'n_layers': 2, 'embedding_dim': 96, 'lr': 0.00022079369433681775, 'lambda_val': 0.00551038486085562, 'batch_size': 1833, 'optimizer': 'RMSprop'}.
2026-05-23 00:37:42,409 - experiment_functions - INFO - Early stopping at epoch 800. Best Metrics: (0.0397940563472728, 0.02139344262295082, 0.03188066286907185)
2026-05-23 00:37:43,517 - optuna.study.study - INFO - Trial 214 finished with values: [0.0397940563472728, 0.02139344262295082, 0.03188066286907185] and parameters: {'n_layers': 3, 'embedding_dim': 96, 'lr': 0.0005010322067376279, 'lambda_val': 7.591109531033929e-05, 'batch_size': 1369, 'optimizer': 'RMSprop'}.
2026-05-23 00:37:48,639 - experiment_functions - INFO - Early stopping at epoch 1850. Best Metrics: (0.031895132519355704, 0.020491803278688523, 0.030846980306430405)
2026-05-23 00:37:49,510 - optuna.study.study - INFO - Trial 215 finished with values: [0.031895132519355704, 0.020491803278688523, 0.030846980306430405] and parameters: {'n_layers': 2, 'embedding_dim': 96, 'lr': 0.00029826529867114525, 'lambda_val': 5.790863900505623e-06, 'batch_size': 2834, 'optimizer': 'Adam'}.
2026-05-23 00:37:58,454 - optuna.study.study - INFO - Trial 216 finished with values: [0.031612558217000944, 0.017295081967213115, 0.025128203755145004] and parameters: {'n_layers': 2, 'embedding_dim': 32, 'lr': 0.0003566717415961628, 'lambda_val': 0.00011624026828970741, 'batch_size': 1369, 'optimizer': 'Adam'}.
2026-05-23 00:38:00,295 - experiment_functions - INFO - Early stopping at epoch 500. Best Metrics: (0.0030701948622855004, 0.002213114754098361, 0.0028809217578542635)
2026-05-23 00:38:00,390 - optuna.study.study - INFO - Trial 217 finished with values: [0.0030701948622855004, 0.002213114754098361, 0.0028809217578542635] and parameters: {'n_layers': 2, 'embedding_dim': 32, 'lr': 0.0007184162715631311, 'lambda_val': 2.0395641111336252e-06, 'batch_size': 2894, 'optimizer': 'SGD'}.
2026-05-23 00:38:03,224 - experiment_functions - INFO - Early stopping at epoch 800. Best Metrics: (0.024062592167897936, 0.014344262295081968, 0.01930734597908079)
2026-05-23 00:38:03,305 - optuna.study.study - INFO - Trial 218 finished with values: [0.024062592167897936, 0.014344262295081968, 0.01930734597908079] and parameters: {'n_layers': 4, 'embedding_dim': 96, 'lr': 0.0007184162715631311, 'lambda_val': 0.001981990620864252, 'batch_size': 1541, 'optimizer': 'Adam'}.
2026-05-23 00:38:14,506 - optuna.study.study - INFO - Trial 219 finished with values: [0.032487895279683154, 0.01721311475409836, 0.028017682848578234] and parameters: {'n_layers': 1, 'embedding_dim': 96, 'lr': 0.00029826529867114525, 'lambda_val': 5.790863900505623e-06, 'batch_size': 1338, 'optimizer': 'Adam'}.
2026-05-23 00:38:18,705 - experiment_functions - INFO - Early stopping at epoch 1200. Best Metrics: (0.030077029478352384, 0.018360655737704918, 0.026340073714944838)
2026-05-23 00:38:19,123 - optuna.study.study - INFO - Trial 220 finished with values: [0.030077029478352384, 0.018360655737704918, 0.026340073714944838] and parameters: {'n_layers': 2, 'embedding_dim': 64, 'lr': 0.0005513489459732522, 'lambda_val': 0.001981990620864252, 'batch_size': 3041, 'optimizer': 'Adam'}.
2026-05-23 00:38:21,862 - experiment_functions - INFO - Early stopping at epoch 600. Best Metrics: (0.029176224794555717, 0.017049180327868854, 0.02654315226030454)
2026-05-23 00:38:21,959 - optuna.study.study - INFO - Trial 221 finished with values: [0.029176224794555717, 0.017049180327868854, 0.02654315226030454] and parameters: {'n_layers': 2, 'embedding_dim': 256, 'lr': 0.0011286476195635738, 'lambda_val': 0.0009465451961168807, 'batch_size': 1280, 'optimizer': 'RMSprop'}.
2026-05-23 00:38:28,918 - experiment_functions - INFO - Early stopping at epoch 1900. Best Metrics: (0.02950064348862189, 0.017704918032786888, 0.02447812682435455)
2026-05-23 00:38:29,573 - optuna.study.study - INFO - Trial 222 finished with values: [0.02950064348862189, 0.017704918032786888, 0.02447812682435455] and parameters: {'n_layers': 2, 'embedding_dim': 256, 'lr': 0.00022079369433681775, 'lambda_val': 5.790863900505623e-06, 'batch_size': 2834, 'optimizer': 'RMSprop'}.
2026-05-23 00:38:34,755 - experiment_functions - INFO - Early stopping at epoch 1300. Best Metrics: (0.033096179374552476, 0.017459016393442623, 0.027443707875733813)
2026-05-23 00:38:35,312 - optuna.study.study - INFO - Trial 223 finished with values: [0.033096179374552476, 0.017459016393442623, 0.027443707875733813] and parameters: {'n_layers': 3, 'embedding_dim': 256, 'lr': 0.00022079369433681775, 'lambda_val': 0.00551038486085562, 'batch_size': 1055, 'optimizer': 'RMSprop'}.
2026-05-23 00:38:42,020 - experiment_functions - INFO - Early stopping at epoch 2050. Best Metrics: (0.03409698723453589, 0.01901639344262295, 0.028762183931260513)
2026-05-23 00:38:42,118 - optuna.study.study - INFO - Trial 224 finished with values: [0.03409698723453589, 0.01901639344262295, 0.028762183931260513] and parameters: {'n_layers': 2, 'embedding_dim': 128, 'lr': 0.00022079369433681775, 'lambda_val': 5.790863900505623e-06, 'batch_size': 3264, 'optimizer': 'RMSprop'}.
2026-05-23 00:38:54,032 - experiment_functions - INFO - Early stopping at epoch 3900. Best Metrics: (0.0308740177742307, 0.018114754098360657, 0.027213879854016892)
2026-05-23 00:38:54,240 - optuna.study.study - INFO - Trial 225 finished with values: [0.0308740177742307, 0.018114754098360657, 0.027213879854016892] and parameters: {'n_layers': 2, 'embedding_dim': 64, 'lr': 0.00022079369433681775, 'lambda_val': 0.00011624026828970741, 'batch_size': 987, 'optimizer': 'RMSprop'}.
2026-05-23 00:38:56,746 - experiment_functions - INFO - Early stopping at epoch 600. Best Metrics: (0.03328474218631466, 0.01778688524590164, 0.026972550818325797)
2026-05-23 00:38:56,829 - optuna.study.study - INFO - Trial 226 finished with values: [0.03328474218631466, 0.01778688524590164, 0.026972550818325797] and parameters: {'n_layers': 3, 'embedding_dim': 64, 'lr': 0.0011286476195635738, 'lambda_val': 0.0010220113588320242, 'batch_size': 685, 'optimizer': 'RMSprop'}.
2026-05-23 00:39:01,366 - experiment_functions - INFO - Early stopping at epoch 900. Best Metrics: (0.03269333312646679, 0.019918032786885247, 0.030722319148290864)
2026-05-23 00:39:01,479 - optuna.study.study - INFO - Trial 227 finished with values: [0.03269333312646679, 0.019918032786885247, 0.030722319148290864] and parameters: {'n_layers': 2, 'embedding_dim': 256, 'lr': 0.0005513489459732522, 'lambda_val': 0.003265600459695188, 'batch_size': 1603, 'optimizer': 'Adam'}.
2026-05-23 00:39:10,869 - experiment_functions - INFO - Early stopping at epoch 3400. Best Metrics: (0.031671033407736936, 0.0169672131147541, 0.025494595036191618)
2026-05-23 00:39:11,319 - optuna.study.study - INFO - Trial 228 finished with values: [0.031671033407736936, 0.0169672131147541, 0.025494595036191618] and parameters: {'n_layers': 1, 'embedding_dim': 64, 'lr': 0.00029826529867114525, 'lambda_val': 0.0002603879699437796, 'batch_size': 1735, 'optimizer': 'Adam'}.
2026-05-23 00:39:23,298 - optuna.study.study - INFO - Trial 229 finished with values: [0.02384705429305549, 0.014262295081967212, 0.02135733427688889] and parameters: {'n_layers': 2, 'embedding_dim': 64, 'lr': 0.00022079369433681775, 'lambda_val': 2.9099669967589168e-06, 'batch_size': 3649, 'optimizer': 'RMSprop'}.
2026-05-23 00:39:31,991 - experiment_functions - INFO - Early stopping at epoch 2900. Best Metrics: (0.031951975776052306, 0.01819672131147541, 0.02780607489072419)
2026-05-23 00:39:32,084 - optuna.study.study - INFO - Trial 230 finished with values: [0.031951975776052306, 0.01819672131147541, 0.02780607489072419] and parameters: {'n_layers': 1, 'embedding_dim': 96, 'lr': 0.0003566717415961628, 'lambda_val': 2.0395641111336252e-06, 'batch_size': 2778, 'optimizer': 'RMSprop'}.
2026-05-23 00:39:36,173 - experiment_functions - INFO - Early stopping at epoch 1100. Best Metrics: (0.03458891245384417, 0.018114754098360657, 0.027405702464095436)
2026-05-23 00:39:36,248 - optuna.study.study - INFO - Trial 231 finished with values: [0.03458891245384417, 0.018114754098360657, 0.027405702464095436] and parameters: {'n_layers': 3, 'embedding_dim': 128, 'lr': 0.0003566717415961628, 'lambda_val': 4.416597544825473e-05, 'batch_size': 1664, 'optimizer': 'RMSprop'}.
2026-05-23 00:39:48,580 - optuna.study.study - INFO - Trial 232 finished with values: [0.02783564864233116, 0.01639344262295082, 0.02598223937227419] and parameters: {'n_layers': 2, 'embedding_dim': 96, 'lr': 0.00022079369433681775, 'lambda_val': 6.1450339997947674e-06, 'batch_size': 2834, 'optimizer': 'RMSprop'}.
2026-05-23 00:40:05,408 - experiment_functions - INFO - Early stopping at epoch 3850. Best Metrics: (0.03829286131231768, 0.019672131147540985, 0.03146427019690793)
2026-05-23 00:40:06,750 - optuna.study.study - INFO - Trial 233 finished with values: [0.03829286131231768, 0.019672131147540985, 0.03146427019690793] and parameters: {'n_layers': 2, 'embedding_dim': 32, 'lr': 0.0003566717415961628, 'lambda_val': 0.0016955781212138713, 'batch_size': 1369, 'optimizer': 'Adam'}.
2026-05-23 00:40:09,526 - experiment_functions - INFO - Early stopping at epoch 700. Best Metrics: (0.02759334782729822, 0.015983606557377048, 0.024461539250080433)
2026-05-23 00:40:10,391 - optuna.study.study - INFO - Trial 234 finished with values: [0.02759334782729822, 0.015983606557377048, 0.024461539250080433] and parameters: {'n_layers': 2, 'embedding_dim': 96, 'lr': 0.0009422878098805214, 'lambda_val': 0.00551038486085562, 'batch_size': 2834, 'optimizer': 'RMSprop'}.
2026-05-23 00:40:14,077 - experiment_functions - INFO - Early stopping at epoch 850. Best Metrics: (0.029251456109870285, 0.018688524590163937, 0.02614079541376177)
2026-05-23 00:40:14,376 - optuna.study.study - INFO - Trial 235 finished with values: [0.029251456109870285, 0.018688524590163937, 0.02614079541376177] and parameters: {'n_layers': 2, 'embedding_dim': 256, 'lr': 0.0007184162715631311, 'lambda_val': 0.001981990620864252, 'batch_size': 1603, 'optimizer': 'Adam'}.
2026-05-23 00:40:23,581 - experiment_functions - INFO - Early stopping at epoch 3000. Best Metrics: (0.026105277271140443, 0.016475409836065574, 0.022646989812037)
2026-05-23 00:40:23,780 - optuna.study.study - INFO - Trial 236 finished with values: [0.026105277271140443, 0.016475409836065574, 0.022646989812037] and parameters: {'n_layers': 3, 'embedding_dim': 32, 'lr': 0.00022079369433681775, 'lambda_val': 0.00551038486085562, 'batch_size': 2834, 'optimizer': 'RMSprop'}.
2026-05-23 00:40:30,829 - experiment_functions - INFO - Early stopping at epoch 2350. Best Metrics: (0.036317674655460166, 0.019590163934426228, 0.029730241475756574)
2026-05-23 00:40:30,911 - optuna.study.study - INFO - Trial 237 finished with values: [0.036317674655460166, 0.019590163934426228, 0.029730241475756574] and parameters: {'n_layers': 2, 'embedding_dim': 64, 'lr': 0.0003566717415961628, 'lambda_val': 0.00011624026828970741, 'batch_size': 1735, 'optimizer': 'Adam'}.
2026-05-23 00:40:33,643 - experiment_functions - INFO - Early stopping at epoch 650. Best Metrics: (0.02740445981718537, 0.017868852459016395, 0.027531252887592554)
2026-05-23 00:40:33,776 - optuna.study.study - INFO - Trial 238 finished with values: [0.02740445981718537, 0.017868852459016395, 0.027531252887592554] and parameters: {'n_layers': 2, 'embedding_dim': 256, 'lr': 0.0009422878098805214, 'lambda_val': 2.9099669967589168e-06, 'batch_size': 1861, 'optimizer': 'RMSprop'}.
2026-05-23 00:40:36,885 - experiment_functions - INFO - Early stopping at epoch 1050. Best Metrics: (0.03841844943644446, 0.019262295081967213, 0.03301024140904663)
2026-05-23 00:40:36,973 - optuna.study.study - INFO - Trial 239 finished with values: [0.03841844943644446, 0.019262295081967213, 0.03301024140904663] and parameters: {'n_layers': 1, 'embedding_dim': 96, 'lr': 0.0013882664669042468, 'lambda_val': 1.1997881499867485e-06, 'batch_size': 2778, 'optimizer': 'Adam'}.
2026-05-23 00:40:38,831 - experiment_functions - INFO - Early stopping at epoch 550. Best Metrics: (0.029107778678152924, 0.015081967213114753, 0.022066985671674883)
2026-05-23 00:40:38,921 - optuna.study.study - INFO - Trial 240 finished with values: [0.029107778678152924, 0.015081967213114753, 0.022066985671674883] and parameters: {'n_layers': 2, 'embedding_dim': 64, 'lr': 0.0029335455314602995, 'lambda_val': 3.285224636612506e-05, 'batch_size': 1833, 'optimizer': 'RMSprop'}.
2026-05-23 00:40:42,345 - experiment_functions - INFO - Early stopping at epoch 1150. Best Metrics: (0.030797740591995533, 0.01754098360655738, 0.027131522581219047)
2026-05-23 00:40:42,439 - optuna.study.study - INFO - Trial 241 finished with values: [0.030797740591995533, 0.01754098360655738, 0.027131522581219047] and parameters: {'n_layers': 2, 'embedding_dim': 96, 'lr': 0.0003566717415961628, 'lambda_val': 5.790863900505623e-06, 'batch_size': 2834, 'optimizer': 'RMSprop'}.
2026-05-23 00:40:45,888 - experiment_functions - INFO - Early stopping at epoch 600. Best Metrics: (0.024997279008640898, 0.015000000000000001, 0.021544766757355654)
2026-05-23 00:40:46,477 - optuna.study.study - INFO - Trial 242 finished with values: [0.024997279008640898, 0.015000000000000001, 0.021544766757355654] and parameters: {'n_layers': 2, 'embedding_dim': 96, 'lr': 0.0029672352594358334, 'lambda_val': 5.790863900505623e-06, 'batch_size': 2834, 'optimizer': 'Adam'}.
2026-05-23 00:40:54,329 - experiment_functions - INFO - Early stopping at epoch 700. Best Metrics: (0.03176980380425422, 0.01737704918032787, 0.028875121349325173)
2026-05-23 00:40:54,919 - optuna.study.study - INFO - Trial 243 finished with values: [0.03176980380425422, 0.01737704918032787, 0.028875121349325173] and parameters: {'n_layers': 3, 'embedding_dim': 32, 'lr': 0.0011286476195635738, 'lambda_val': 7.591109531033929e-05, 'batch_size': 1280, 'optimizer': 'RMSprop'}.
2026-05-23 00:40:59,517 - experiment_functions - INFO - Early stopping at epoch 600. Best Metrics: (0.029429335158331803, 0.017131147540983604, 0.026731668499537477)
2026-05-23 00:40:59,608 - optuna.study.study - INFO - Trial 244 finished with values: [0.029429335158331803, 0.017131147540983604, 0.026731668499537477] and parameters: {'n_layers': 3, 'embedding_dim': 64, 'lr': 0.0029335455314602995, 'lambda_val': 4.416597544825473e-05, 'batch_size': 1833, 'optimizer': 'Adam'}.
2026-05-23 00:41:01,769 - experiment_functions - INFO - Early stopping at epoch 700. Best Metrics: (0.03795489729054309, 0.020491803278688523, 0.03401559743803714)
2026-05-23 00:41:01,921 - optuna.study.study - INFO - Trial 245 finished with values: [0.03795489729054309, 0.020491803278688523, 0.03401559743803714] and parameters: {'n_layers': 1, 'embedding_dim': 64, 'lr': 0.0016072373570504854, 'lambda_val': 1.0986329485253682e-05, 'batch_size': 1457, 'optimizer': 'RMSprop'}.
2026-05-23 00:41:04,723 - experiment_functions - INFO - Early stopping at epoch 750. Best Metrics: (0.0347423518273955, 0.017950819672131146, 0.027913518316643668)
2026-05-23 00:41:04,819 - optuna.study.study - INFO - Trial 246 finished with values: [0.0347423518273955, 0.017950819672131146, 0.027913518316643668] and parameters: {'n_layers': 2, 'embedding_dim': 64, 'lr': 0.0007772550943595981, 'lambda_val': 5.790863900505623e-06, 'batch_size': 2834, 'optimizer': 'RMSprop'}.
2026-05-23 00:41:06,822 - experiment_functions - INFO - Early stopping at epoch 550. Best Metrics: (0.0226683290993309, 0.013360655737704922, 0.01935775030391037)
2026-05-23 00:41:06,911 - optuna.study.study - INFO - Trial 247 finished with values: [0.0226683290993309, 0.013360655737704922, 0.01935775030391037] and parameters: {'n_layers': 3, 'embedding_dim': 64, 'lr': 0.0029672352594358334, 'lambda_val': 8.6075268775813e-06, 'batch_size': 3107, 'optimizer': 'RMSprop'}.
2026-05-23 00:41:14,470 - experiment_functions - INFO - Early stopping at epoch 2750. Best Metrics: (0.031842263813710504, 0.01778688524590164, 0.027976142954606483)
2026-05-23 00:41:14,981 - optuna.study.study - INFO - Trial 248 finished with values: [0.031842263813710504, 0.01778688524590164, 0.027976142954606483] and parameters: {'n_layers': 1, 'embedding_dim': 96, 'lr': 0.0003566717415961628, 'lambda_val': 0.0016955781212138713, 'batch_size': 1369, 'optimizer': 'RMSprop'}.
2026-05-23 00:41:17,572 - experiment_functions - INFO - Early stopping at epoch 550. Best Metrics: (0.019608139918907596, 0.010491803278688525, 0.015856105571739318)
2026-05-23 00:41:17,665 - optuna.study.study - INFO - Trial 249 finished with values: [0.019608139918907596, 0.010491803278688525, 0.015856105571739318] and parameters: {'n_layers': 3, 'embedding_dim': 96, 'lr': 0.003773078791864705, 'lambda_val': 0.0010220113588320242, 'batch_size': 1280, 'optimizer': 'RMSprop'}.
2026-05-23 00:41:20,259 - experiment_functions - INFO - Early stopping at epoch 500. Best Metrics: (0.0017241552239923167, 0.0011475409836065574, 0.001570125537284598)
2026-05-23 00:41:20,350 - optuna.study.study - INFO - Trial 250 finished with values: [0.0017241552239923167, 0.0011475409836065574, 0.001570125537284598] and parameters: {'n_layers': 2, 'embedding_dim': 96, 'lr': 0.00022079369433681775, 'lambda_val': 5.790863900505623e-06, 'batch_size': 1675, 'optimizer': 'SGD'}.
2026-05-23 00:41:27,220 - experiment_functions - INFO - Early stopping at epoch 1850. Best Metrics: (0.034873667263443625, 0.019918032786885247, 0.030143565835353454)
2026-05-23 00:41:27,342 - optuna.study.study - INFO - Trial 251 finished with values: [0.034873667263443625, 0.019918032786885247, 0.030143565835353454] and parameters: {'n_layers': 2, 'embedding_dim': 256, 'lr': 0.0003566717415961628, 'lambda_val': 0.0016955781212138713, 'batch_size': 987, 'optimizer': 'Adam'}.
2026-05-23 00:41:30,813 - experiment_functions - INFO - Early stopping at epoch 950. Best Metrics: (0.027668243309516224, 0.01721311475409836, 0.025245558350535664)
2026-05-23 00:41:31,678 - optuna.study.study - INFO - Trial 252 finished with values: [0.027668243309516224, 0.01721311475409836, 0.025245558350535664] and parameters: {'n_layers': 4, 'embedding_dim': 32, 'lr': 0.0005513489459732522, 'lambda_val': 0.000617869267747167, 'batch_size': 1430, 'optimizer': 'Adam'}.
2026-05-23 00:41:34,877 - experiment_functions - INFO - Early stopping at epoch 900. Best Metrics: (0.03478593399126688, 0.019918032786885247, 0.030414893446001626)
2026-05-23 00:41:35,620 - optuna.study.study - INFO - Trial 253 finished with values: [0.03478593399126688, 0.019918032786885247, 0.030414893446001626] and parameters: {'n_layers': 1, 'embedding_dim': 64, 'lr': 0.0016072373570504854, 'lambda_val': 1.7207712053457044e-06, 'batch_size': 987, 'optimizer': 'Adam'}.
2026-05-23 00:41:39,552 - experiment_functions - INFO - Early stopping at epoch 1150. Best Metrics: (0.036461425691256086, 0.020409836065573773, 0.030299154318266807)
