2026-05-23 04:48:04,494 - optuna.study.study - INFO - Trial 290 finished with values: [0.08078901852328144, 0.04377049180327869, 0.06784654013064251] and parameters: {'n_layers': 1, 'embedding_dim': 64, 'lr': 0.0002758788994373932, 'lambda_val': 6.986668366047046e-05, 'batch_size': 563, 'optimizer': 'Adam'}.
2026-05-23 04:48:11,086 - experiment_functions - INFO - Early stopping at epoch 1300. Best Metrics: (0.11420889532407073, 0.05368852459016393, 0.0950644331752098)
2026-05-23 04:48:11,660 - optuna.study.study - INFO - Trial 291 finished with values: [0.11420889532407073, 0.05368852459016393, 0.0950644331752098] and parameters: {'n_layers': 1, 'embedding_dim': 256, 'lr': 0.0006640426930867159, 'lambda_val': 0.00062453091272787, 'batch_size': 1477, 'optimizer': 'Adam'}.
2026-05-23 04:48:19,572 - experiment_functions - INFO - Early stopping at epoch 500. Best Metrics: (0.0022641899446889276, 0.001557377049180328, 0.0025792705076790445)
2026-05-23 04:48:20,109 - optuna.study.study - INFO - Trial 292 finished with values: [0.0022641899446889276, 0.001557377049180328, 0.0025792705076790445] and parameters: {'n_layers': 1, 'embedding_dim': 128, 'lr': 0.00039831203487280473, 'lambda_val': 0.00010447269915261112, 'batch_size': 784, 'optimizer': 'SGD'}.
2026-05-23 04:48:31,097 - experiment_functions - INFO - Early stopping at epoch 2500. Best Metrics: (0.07153596335417063, 0.040983606557377046, 0.06403824069311544)
2026-05-23 04:48:31,193 - optuna.study.study - INFO - Trial 293 finished with values: [0.07153596335417063, 0.040983606557377046, 0.06403824069311544] and parameters: {'n_layers': 2, 'embedding_dim': 64, 'lr': 0.0003054746060910338, 'lambda_val': 0.0009962507800702286, 'batch_size': 1477, 'optimizer': 'RMSprop'}.
2026-05-23 04:48:33,942 - experiment_functions - INFO - Early stopping at epoch 500. Best Metrics: (0.003318136983711, 0.002540983606557377, 0.0035132907034443866)
2026-05-23 04:48:34,082 - optuna.study.study - INFO - Trial 294 finished with values: [0.003318136983711, 0.002540983606557377, 0.0035132907034443866] and parameters: {'n_layers': 4, 'embedding_dim': 32, 'lr': 0.0005076161055190746, 'lambda_val': 2.009600829542654e-06, 'batch_size': 3510, 'optimizer': 'SGD'}.
2026-05-23 04:48:44,773 - experiment_functions - INFO - Early stopping at epoch 3550. Best Metrics: (0.07961800218244221, 0.045163934426229506, 0.06847861386104985)
2026-05-23 04:48:44,956 - optuna.study.study - INFO - Trial 295 finished with values: [0.07961800218244221, 0.045163934426229506, 0.06847861386104985] and parameters: {'n_layers': 1, 'embedding_dim': 64, 'lr': 0.0002758788994373932, 'lambda_val': 0.00062453091272787, 'batch_size': 3397, 'optimizer': 'RMSprop'}.
2026-05-23 04:48:47,228 - experiment_functions - INFO - Early stopping at epoch 500. Best Metrics: (0.0012597895980816108, 0.0017213114754098366, 0.0018840893637716012)
2026-05-23 04:48:47,325 - optuna.study.study - INFO - Trial 296 finished with values: [0.0012597895980816108, 0.0017213114754098366, 0.0018840893637716012] and parameters: {'n_layers': 1, 'embedding_dim': 64, 'lr': 0.00466856942146688, 'lambda_val': 0.0009962507800702286, 'batch_size': 3135, 'optimizer': 'SGD'}.
2026-05-23 04:48:53,267 - experiment_functions - INFO - Early stopping at epoch 1800. Best Metrics: (0.11081087300244853, 0.05426229508196721, 0.0919169679819617)
2026-05-23 04:48:53,506 - optuna.study.study - INFO - Trial 297 finished with values: [0.11081087300244853, 0.05426229508196721, 0.0919169679819617] and parameters: {'n_layers': 1, 'embedding_dim': 128, 'lr': 0.0005076161055190746, 'lambda_val': 0.002225291349266682, 'batch_size': 1254, 'optimizer': 'Adam'}.
2026-05-23 04:49:06,260 - optuna.study.study - INFO - Trial 298 finished with values: [0.09698906017110462, 0.05122950819672131, 0.08568325411213464] and parameters: {'n_layers': 1, 'embedding_dim': 64, 'lr': 0.0002758788994373932, 'lambda_val': 0.00010447269915261112, 'batch_size': 1505, 'optimizer': 'RMSprop'}.
2026-05-23 04:49:12,030 - experiment_functions - INFO - Early stopping at epoch 1400. Best Metrics: (0.07227529480993593, 0.03844262295081967, 0.061539358433260465)
2026-05-23 04:49:12,625 - optuna.study.study - INFO - Trial 299 finished with values: [0.07227529480993593, 0.03844262295081967, 0.061539358433260465] and parameters: {'n_layers': 2, 'embedding_dim': 64, 'lr': 0.0005076161055190746, 'lambda_val': 7.250972757062111e-06, 'batch_size': 2850, 'optimizer': 'Adam'}.
2026-05-23 04:49:12,641 - root - INFO - Selected Trial 229 based on Max NDCG: 0.0955
2026-05-23 04:49:12,642 - root - INFO - Associated Recall: 0.1178
2026-05-23 04:49:12,642 - experiment_functions - INFO - Training the best model ... for e_100K_1c1dcs_rand3
2026-05-23 04:49:17,067 - experiment_functions - INFO - Early stopping at epoch 1200. Best Metrics: (0.11795444640882485, 0.05221311475409836, 0.08642606556373432)
2026-05-23 04:49:17,178 - root - INFO -   **** Training e_100K_1c1dcs_rand4
2026-05-23 04:49:17,192 - root - INFO -   **** Getting 65267/81200 random edges
2026-05-23 04:49:17,330 - optuna.storages._rdb.storage - INFO - A new study created in RDB with name: Study_e_100K_1c1dcs_rand4
2026-05-23 04:49:19,699 - experiment_functions - INFO - Early stopping at epoch 500. Best Metrics: (0.0029271937474404336, 0.0018032786885245904, 0.002405344902302918)
2026-05-23 04:49:19,789 - optuna.study.study - INFO - Trial 0 finished with values: [0.0029271937474404336, 0.0018032786885245904, 0.002405344902302918] and parameters: {'n_layers': 1, 'embedding_dim': 96, 'lr': 0.00035241606698564455, 'lambda_val': 0.00034894706974588095, 'batch_size': 1113, 'optimizer': 'SGD'}.
2026-05-23 04:49:22,633 - experiment_functions - INFO - Early stopping at epoch 500. Best Metrics: (0.0012738709821390921, 0.0013934426229508196, 0.0016046441588738348)
2026-05-23 04:49:22,838 - optuna.study.study - INFO - Trial 1 finished with values: [0.0012738709821390921, 0.0013934426229508196, 0.0016046441588738348] and parameters: {'n_layers': 3, 'embedding_dim': 64, 'lr': 0.03691349813668507, 'lambda_val': 2.4565232450587037e-06, 'batch_size': 4049, 'optimizer': 'SGD'}.
2026-05-23 04:49:25,857 - experiment_functions - INFO - Early stopping at epoch 500. Best Metrics: (0.004101560125822371, 0.002704918032786885, 0.003401997821461174)
2026-05-23 04:49:25,946 - optuna.study.study - INFO - Trial 2 finished with values: [0.004101560125822371, 0.002704918032786885, 0.003401997821461174] and parameters: {'n_layers': 4, 'embedding_dim': 128, 'lr': 5.740670310773949e-05, 'lambda_val': 0.05720462423641499, 'batch_size': 1295, 'optimizer': 'SGD'}.
2026-05-23 04:49:30,381 - experiment_functions - INFO - Early stopping at epoch 600. Best Metrics: (0.03648856141176158, 0.019508196721311478, 0.03137545957236396)
2026-05-23 04:49:30,497 - optuna.study.study - INFO - Trial 3 finished with values: [0.03648856141176158, 0.019508196721311478, 0.03137545957236396] and parameters: {'n_layers': 3, 'embedding_dim': 256, 'lr': 0.00336717922999122, 'lambda_val': 0.00010416156330755775, 'batch_size': 3439, 'optimizer': 'Adam'}.
2026-05-23 04:49:34,637 - experiment_functions - INFO - Early stopping at epoch 500. Best Metrics: (0.0020340011815548073, 0.0020491803278688526, 0.00230227850138041)
2026-05-23 04:49:34,967 - optuna.study.study - INFO - Trial 4 finished with values: [0.0020340011815548073, 0.0020491803278688526, 0.00230227850138041] and parameters: {'n_layers': 3, 'embedding_dim': 256, 'lr': 0.0003087085260128348, 'lambda_val': 0.00026614142977548295, 'batch_size': 3944, 'optimizer': 'SGD'}.
2026-05-23 04:49:50,703 - experiment_functions - INFO - Early stopping at epoch 2350. Best Metrics: (0.02608735131617912, 0.013852459016393445, 0.023008207459251185)
2026-05-23 04:49:50,782 - optuna.study.study - INFO - Trial 5 finished with values: [0.02608735131617912, 0.013852459016393445, 0.023008207459251185] and parameters: {'n_layers': 4, 'embedding_dim': 256, 'lr': 0.08325297886899372, 'lambda_val': 0.0006553265700000473, 'batch_size': 1834, 'optimizer': 'Adam'}.
2026-05-23 04:50:08,843 - optuna.study.study - INFO - Trial 6 finished with values: [0.01605405026698939, 0.011311475409836066, 0.01710753847142865] and parameters: {'n_layers': 4, 'embedding_dim': 96, 'lr': 5.1942813475457885e-05, 'lambda_val': 0.005758170316328264, 'batch_size': 1105, 'optimizer': 'RMSprop'}.
2026-05-23 04:50:11,643 - experiment_functions - INFO - Early stopping at epoch 500. Best Metrics: (0.0027422116136807716, 0.001967213114754099, 0.0027543073012241963)
2026-05-23 04:50:11,776 - optuna.study.study - INFO - Trial 7 finished with values: [0.0027422116136807716, 0.001967213114754099, 0.0027543073012241963] and parameters: {'n_layers': 4, 'embedding_dim': 64, 'lr': 0.0343541086847779, 'lambda_val': 0.03830448946588032, 'batch_size': 1276, 'optimizer': 'SGD'}.
2026-05-23 04:50:25,497 - experiment_functions - INFO - Early stopping at epoch 3100. Best Metrics: (0.0026577666133558967, 0.001639344262295082, 0.00182331555308696)
2026-05-23 04:50:26,605 - optuna.study.study - INFO - Trial 8 finished with values: [0.0026577666133558967, 0.001639344262295082, 0.00182331555308696] and parameters: {'n_layers': 2, 'embedding_dim': 64, 'lr': 2.6019046855607833e-05, 'lambda_val': 6.708085391622047e-06, 'batch_size': 1586, 'optimizer': 'RMSprop'}.
2026-05-23 04:50:29,599 - experiment_functions - INFO - Early stopping at epoch 500. Best Metrics: (0.0014334387346173758, 0.0013114754098360656, 0.0012262507302414425)
2026-05-23 04:50:29,701 - optuna.study.study - INFO - Trial 9 finished with values: [0.0014334387346173758, 0.0013114754098360656, 0.0012262507302414425] and parameters: {'n_layers': 4, 'embedding_dim': 64, 'lr': 0.0008900825778876233, 'lambda_val': 5.1749265389269726e-05, 'batch_size': 2428, 'optimizer': 'SGD'}.
2026-05-23 04:50:32,685 - experiment_functions - INFO - Early stopping at epoch 500. Best Metrics: (0.0006397918113037457, 0.0009016393442622952, 0.0009501635388092539)
2026-05-23 04:50:32,772 - optuna.study.study - INFO - Trial 10 finished with values: [0.0006397918113037457, 0.0009016393442622952, 0.0009501635388092539] and parameters: {'n_layers': 2, 'embedding_dim': 256, 'lr': 0.02169711350336702, 'lambda_val': 0.0002900069453761333, 'batch_size': 2009, 'optimizer': 'SGD'}.
2026-05-23 04:50:36,965 - experiment_functions - INFO - Early stopping at epoch 1100. Best Metrics: (0.0027230611753493636, 0.0020491803278688526, 0.0027811407766961957)
2026-05-23 04:50:37,544 - optuna.study.study - INFO - Trial 11 finished with values: [0.0027230611753493636, 0.0020491803278688526, 0.0027811407766961957] and parameters: {'n_layers': 1, 'embedding_dim': 128, 'lr': 1.2483118375719722e-05, 'lambda_val': 6.151899527550822e-05, 'batch_size': 1709, 'optimizer': 'RMSprop'}.
2026-05-23 04:50:50,351 - optuna.study.study - INFO - Trial 12 finished with values: [0.06872765189980529, 0.03467213114754098, 0.05348779076719561] and parameters: {'n_layers': 1, 'embedding_dim': 32, 'lr': 0.00019262259007340505, 'lambda_val': 4.915768160138094e-05, 'batch_size': 2445, 'optimizer': 'RMSprop'}.
2026-05-23 04:50:53,025 - experiment_functions - INFO - Early stopping at epoch 500. Best Metrics: (0.0013747411717789852, 0.0018032786885245904, 0.0019912598918551297)
2026-05-23 04:50:53,162 - optuna.study.study - INFO - Trial 13 finished with values: [0.0013747411717789852, 0.0018032786885245904, 0.0019912598918551297] and parameters: {'n_layers': 1, 'embedding_dim': 256, 'lr': 8.024724571830428e-05, 'lambda_val': 0.004409174472970404, 'batch_size': 3578, 'optimizer': 'SGD'}.
2026-05-23 04:50:56,235 - experiment_functions - INFO - Early stopping at epoch 500. Best Metrics: (0.026957745530381796, 0.012950819672131148, 0.023139338106075262)
2026-05-23 04:50:56,327 - optuna.study.study - INFO - Trial 14 finished with values: [0.026957745530381796, 0.012950819672131148, 0.023139338106075262] and parameters: {'n_layers': 4, 'embedding_dim': 96, 'lr': 0.061625038224454844, 'lambda_val': 1.6537799984876733e-06, 'batch_size': 1335, 'optimizer': 'RMSprop'}.
2026-05-23 04:50:58,811 - experiment_functions - INFO - Early stopping at epoch 500. Best Metrics: (0.0025614972856081684, 0.0021311475409836068, 0.0027165131436563887)
2026-05-23 04:50:58,900 - optuna.study.study - INFO - Trial 15 finished with values: [0.0025614972856081684, 0.0021311475409836068, 0.0027165131436563887] and parameters: {'n_layers': 2, 'embedding_dim': 32, 'lr': 6.922551405679396e-05, 'lambda_val': 0.012979468977007368, 'batch_size': 2030, 'optimizer': 'Adam'}.
2026-05-23 04:51:16,992 - optuna.study.study - INFO - Trial 16 finished with values: [0.07439416909118517, 0.038688524590163934, 0.06559139700624092] and parameters: {'n_layers': 3, 'embedding_dim': 64, 'lr': 0.00017559923823258955, 'lambda_val': 0.0003464722773423699, 'batch_size': 514, 'optimizer': 'RMSprop'}.
2026-05-23 04:51:19,356 - experiment_functions - INFO - Early stopping at epoch 500. Best Metrics: (0.0014320728556785171, 0.001967213114754099, 0.0020554053077872086)
2026-05-23 04:51:19,431 - optuna.study.study - INFO - Trial 17 finished with values: [0.0014320728556785171, 0.001967213114754099, 0.0020554053077872086] and parameters: {'n_layers': 2, 'embedding_dim': 32, 'lr': 0.010022983319994364, 'lambda_val': 9.101189235790046e-06, 'batch_size': 4064, 'optimizer': 'SGD'}.
2026-05-23 04:51:23,224 - experiment_functions - INFO - Early stopping at epoch 550. Best Metrics: (0.027423703072651743, 0.014016393442622952, 0.023591903323905)
2026-05-23 04:51:23,902 - optuna.study.study - INFO - Trial 18 finished with values: [0.027423703072651743, 0.014016393442622952, 0.023591903323905] and parameters: {'n_layers': 3, 'embedding_dim': 256, 'lr': 0.008901562085878903, 'lambda_val': 3.5614573447749906e-05, 'batch_size': 996, 'optimizer': 'RMSprop'}.
2026-05-23 04:51:42,507 - optuna.study.study - INFO - Trial 19 finished with values: [0.05966950314098514, 0.03221311475409836, 0.05072549666107482] and parameters: {'n_layers': 4, 'embedding_dim': 96, 'lr': 0.00014581096265244323, 'lambda_val': 8.668980017012997e-05, 'batch_size': 1950, 'optimizer': 'RMSprop'}.
2026-05-23 04:51:48,554 - experiment_functions - INFO - Early stopping at epoch 1750. Best Metrics: (0.09445737410693104, 0.05081967213114754, 0.08264340815243967)
2026-05-23 04:51:48,777 - optuna.study.study - INFO - Trial 20 finished with values: [0.09445737410693104, 0.05081967213114754, 0.08264340815243967] and parameters: {'n_layers': 1, 'embedding_dim': 32, 'lr': 0.000498408569398285, 'lambda_val': 0.00475024784706787, 'batch_size': 2784, 'optimizer': 'Adam'}.
2026-05-23 04:51:51,105 - experiment_functions - INFO - Early stopping at epoch 500. Best Metrics: (0.001482620455795262, 0.001475409836065574, 0.0016262799053470254)
2026-05-23 04:51:51,190 - optuna.study.study - INFO - Trial 21 finished with values: [0.001482620455795262, 0.001475409836065574, 0.0016262799053470254] and parameters: {'n_layers': 1, 'embedding_dim': 128, 'lr': 0.012467832619058953, 'lambda_val': 0.00016024499533081097, 'batch_size': 2503, 'optimizer': 'SGD'}.
2026-05-23 04:52:02,740 - optuna.study.study - INFO - Trial 22 finished with values: [0.04275385541627808, 0.032622950819672134, 0.04493515747858291] and parameters: {'n_layers': 1, 'embedding_dim': 128, 'lr': 0.05244400632546388, 'lambda_val': 0.030374414852054388, 'batch_size': 1182, 'optimizer': 'Adam'}.
2026-05-23 04:52:05,701 - experiment_functions - INFO - Early stopping at epoch 700. Best Metrics: (0.08280509368386593, 0.04229508196721311, 0.06947497499908321)
2026-05-23 04:52:05,797 - optuna.study.study - INFO - Trial 23 finished with values: [0.08280509368386593, 0.04229508196721311, 0.06947497499908321] and parameters: {'n_layers': 1, 'embedding_dim': 128, 'lr': 0.0027034335159540246, 'lambda_val': 4.006717999944042e-05, 'batch_size': 3648, 'optimizer': 'Adam'}.
2026-05-23 04:52:08,704 - experiment_functions - INFO - Early stopping at epoch 500. Best Metrics: (0.0021765066047275666, 0.002459016393442623, 0.002687968022715861)
2026-05-23 04:52:08,797 - optuna.study.study - INFO - Trial 24 finished with values: [0.0021765066047275666, 0.002459016393442623, 0.002687968022715861] and parameters: {'n_layers': 3, 'embedding_dim': 128, 'lr': 0.0815330144295802, 'lambda_val': 0.010953944904227055, 'batch_size': 1933, 'optimizer': 'SGD'}.
2026-05-23 04:52:22,023 - optuna.study.study - INFO - Trial 25 finished with values: [0.06581274331494165, 0.03721311475409836, 0.05751752936025365] and parameters: {'n_layers': 1, 'embedding_dim': 96, 'lr': 0.000145468795718925, 'lambda_val': 0.009884403542259862, 'batch_size': 3864, 'optimizer': 'RMSprop'}.
2026-05-23 04:52:33,086 - experiment_functions - INFO - Early stopping at epoch 1950. Best Metrics: (0.061155668260460316, 0.033196721311475406, 0.050388994273562054)
2026-05-23 04:52:33,160 - optuna.study.study - INFO - Trial 26 finished with values: [0.061155668260460316, 0.033196721311475406, 0.050388994273562054] and parameters: {'n_layers': 2, 'embedding_dim': 256, 'lr': 0.00015281876966777362, 'lambda_val': 0.012460947960816766, 'batch_size': 1025, 'optimizer': 'Adam'}.
2026-05-23 04:52:38,464 - experiment_functions - INFO - Early stopping at epoch 700. Best Metrics: (0.03360304475416176, 0.020573770491803277, 0.030571586824631784)
2026-05-23 04:52:38,910 - optuna.study.study - INFO - Trial 27 finished with values: [0.03360304475416176, 0.020573770491803277, 0.030571586824631784] and parameters: {'n_layers': 4, 'embedding_dim': 256, 'lr': 0.0004134349417792622, 'lambda_val': 0.0006153780524713789, 'batch_size': 3696, 'optimizer': 'RMSprop'}.
2026-05-23 04:52:41,335 - experiment_functions - INFO - Early stopping at epoch 500. Best Metrics: (0.0012893227303251154, 0.0018852459016393442, 0.00199438750305459)
2026-05-23 04:52:41,468 - optuna.study.study - INFO - Trial 28 finished with values: [0.0012893227303251154, 0.0018852459016393442, 0.00199438750305459] and parameters: {'n_layers': 1, 'embedding_dim': 128, 'lr': 2.8816410973423224e-05, 'lambda_val': 0.00023802443257382069, 'batch_size': 1932, 'optimizer': 'Adam'}.
2026-05-23 04:52:58,390 - optuna.study.study - INFO - Trial 29 finished with values: [0.032734842369868476, 0.020901639344262295, 0.031566618332612525] and parameters: {'n_layers': 4, 'embedding_dim': 64, 'lr': 0.00013096249546305178, 'lambda_val': 0.011064300904059448, 'batch_size': 1407, 'optimizer': 'RMSprop'}.
2026-05-23 04:53:03,466 - experiment_functions - INFO - Early stopping at epoch 1100. Best Metrics: (0.022406372125844058, 0.011475409836065575, 0.01643515206074319)
2026-05-23 04:53:03,550 - optuna.study.study - INFO - Trial 30 finished with values: [0.022406372125844058, 0.011475409836065575, 0.01643515206074319] and parameters: {'n_layers': 4, 'embedding_dim': 96, 'lr': 0.0022567607203477632, 'lambda_val': 0.0011531144517310456, 'batch_size': 2135, 'optimizer': 'RMSprop'}.
2026-05-23 04:53:05,888 - experiment_functions - INFO - Early stopping at epoch 650. Best Metrics: (0.0008567709017538592, 0.0015573770491803278, 0.001896924026382877)
2026-05-23 04:53:05,973 - optuna.study.study - INFO - Trial 31 finished with values: [0.0008567709017538592, 0.0015573770491803278, 0.001896924026382877] and parameters: {'n_layers': 1, 'embedding_dim': 96, 'lr': 0.06577946033013556, 'lambda_val': 0.004288422301955245, 'batch_size': 1260, 'optimizer': 'SGD'}.
2026-05-23 04:53:17,294 - optuna.study.study - INFO - Trial 32 finished with values: [0.021523628229975385, 0.014180327868852462, 0.02064891604485626] and parameters: {'n_layers': 1, 'embedding_dim': 96, 'lr': 8.163547537557747e-05, 'lambda_val': 9.351980182836982e-05, 'batch_size': 3126, 'optimizer': 'RMSprop'}.
2026-05-23 04:53:20,579 - experiment_functions - INFO - Early stopping at epoch 500. Best Metrics: (0.002990214980957901, 0.0021311475409836068, 0.002500226032715154)
2026-05-23 04:53:20,802 - optuna.study.study - INFO - Trial 33 finished with values: [0.002990214980957901, 0.0021311475409836068, 0.002500226032715154] and parameters: {'n_layers': 3, 'embedding_dim': 256, 'lr': 0.03051424799989736, 'lambda_val': 1.2117009140271532e-05, 'batch_size': 2763, 'optimizer': 'SGD'}.
2026-05-23 04:53:28,960 - experiment_functions - INFO - Early stopping at epoch 2650. Best Metrics: (0.0022058609980232873, 0.002459016393442623, 0.0025253353916820857)
2026-05-23 04:53:29,072 - optuna.study.study - INFO - Trial 34 finished with values: [0.0022058609980232873, 0.002459016393442623, 0.0025253353916820857] and parameters: {'n_layers': 2, 'embedding_dim': 96, 'lr': 4.205608185622306e-05, 'lambda_val': 4.625898585443723e-05, 'batch_size': 599, 'optimizer': 'Adam'}.
2026-05-23 04:53:31,578 - experiment_functions - INFO - Early stopping at epoch 600. Best Metrics: (0.05561220699897606, 0.030819672131147544, 0.04526861204617048)
2026-05-23 04:53:31,712 - optuna.study.study - INFO - Trial 35 finished with values: [0.05561220699897606, 0.030819672131147544, 0.04526861204617048] and parameters: {'n_layers': 2, 'embedding_dim': 32, 'lr': 0.0025251998940112653, 'lambda_val': 3.827155829365953e-06, 'batch_size': 2533, 'optimizer': 'Adam'}.
2026-05-23 04:53:34,443 - experiment_functions - INFO - Early stopping at epoch 550. Best Metrics: (0.06404651738328203, 0.028196721311475416, 0.04674364649601462)
2026-05-23 04:53:34,517 - optuna.study.study - INFO - Trial 36 finished with values: [0.06404651738328203, 0.028196721311475416, 0.04674364649601462] and parameters: {'n_layers': 1, 'embedding_dim': 256, 'lr': 0.01455213187251788, 'lambda_val': 0.00032113881713361967, 'batch_size': 3816, 'optimizer': 'Adam'}.
2026-05-23 04:53:36,889 - experiment_functions - INFO - Early stopping at epoch 500. Best Metrics: (0.0034445157203546236, 0.0020491803278688526, 0.0028568735031691507)
