2026-05-23 00:14:30,838 - optuna.study.study - INFO - Trial 274 finished with values: [0.008500214697868312, 0.007295081967213115, 0.009725955223362616] and parameters: {'n_layers': 3, 'embedding_dim': 32, 'lr': 0.012476072772677116, 'lambda_val': 7.367374344877376e-05, 'batch_size': 2919, 'optimizer': 'Adam'}.
2026-05-23 00:14:35,427 - experiment_functions - INFO - Early stopping at epoch 1250. Best Metrics: (0.013445748264947396, 0.013524590163934426, 0.01766563033841215)
2026-05-23 00:14:35,899 - optuna.study.study - INFO - Trial 275 finished with values: [0.013445748264947396, 0.013524590163934426, 0.01766563033841215] and parameters: {'n_layers': 3, 'embedding_dim': 256, 'lr': 0.012476072772677116, 'lambda_val': 4.890741275615565e-05, 'batch_size': 2069, 'optimizer': 'RMSprop'}.
2026-05-23 00:14:38,886 - experiment_functions - INFO - Early stopping at epoch 950. Best Metrics: (0.0053585175145004155, 0.006229508196721311, 0.007185284237127859)
2026-05-23 00:14:40,096 - optuna.study.study - INFO - Trial 276 finished with values: [0.0053585175145004155, 0.006229508196721311, 0.007185284237127859] and parameters: {'n_layers': 4, 'embedding_dim': 96, 'lr': 0.0022010063526247026, 'lambda_val': 1.334536768240747e-05, 'batch_size': 1449, 'optimizer': 'RMSprop'}.
2026-05-23 00:14:49,408 - experiment_functions - INFO - Early stopping at epoch 3900. Best Metrics: (0.014436036981752288, 0.012049180327868853, 0.01924130879524212)
2026-05-23 00:14:50,264 - optuna.study.study - INFO - Trial 277 finished with values: [0.014436036981752288, 0.012049180327868853, 0.01924130879524212] and parameters: {'n_layers': 3, 'embedding_dim': 32, 'lr': 0.006178111746348912, 'lambda_val': 0.00020797598055321284, 'batch_size': 3526, 'optimizer': 'RMSprop'}.
2026-05-23 00:15:02,845 - experiment_functions - INFO - Early stopping at epoch 2450. Best Metrics: (0.017072371739914154, 0.01483606557377049, 0.02125150372329802)
2026-05-23 00:15:03,844 - optuna.study.study - INFO - Trial 278 finished with values: [0.017072371739914154, 0.01483606557377049, 0.02125150372329802] and parameters: {'n_layers': 4, 'embedding_dim': 96, 'lr': 0.007748276590311343, 'lambda_val': 1.0988779505731458e-05, 'batch_size': 2552, 'optimizer': 'RMSprop'}.
2026-05-23 00:15:10,485 - experiment_functions - INFO - Early stopping at epoch 1000. Best Metrics: (0.0047246730243421745, 0.00639344262295082, 0.007337326574589579)
2026-05-23 00:15:11,767 - optuna.study.study - INFO - Trial 279 finished with values: [0.0047246730243421745, 0.00639344262295082, 0.007337326574589579] and parameters: {'n_layers': 4, 'embedding_dim': 96, 'lr': 0.016757203845338013, 'lambda_val': 0.01278737182008337, 'batch_size': 3526, 'optimizer': 'Adam'}.
2026-05-23 00:15:21,449 - experiment_functions - INFO - Early stopping at epoch 2900. Best Metrics: (0.014568986847584882, 0.015081967213114753, 0.01981187437513578)
2026-05-23 00:15:22,051 - optuna.study.study - INFO - Trial 280 finished with values: [0.014568986847584882, 0.015081967213114753, 0.01981187437513578] and parameters: {'n_layers': 3, 'embedding_dim': 64, 'lr': 0.032125088922163904, 'lambda_val': 9.956828255961624e-05, 'batch_size': 2505, 'optimizer': 'Adam'}.
2026-05-23 00:15:25,985 - experiment_functions - INFO - Early stopping at epoch 900. Best Metrics: (0.0015730845317005388, 0.001639344262295082, 0.001861059231287655)
2026-05-23 00:15:27,110 - optuna.study.study - INFO - Trial 281 finished with values: [0.0015730845317005388, 0.001639344262295082, 0.001861059231287655] and parameters: {'n_layers': 3, 'embedding_dim': 256, 'lr': 0.02773153918226887, 'lambda_val': 1.0988779505731458e-05, 'batch_size': 3969, 'optimizer': 'SGD'}.
2026-05-23 00:15:37,554 - experiment_functions - INFO - Early stopping at epoch 3450. Best Metrics: (0.011753261969690593, 0.013032786885245904, 0.016097545669638235)
2026-05-23 00:15:37,660 - optuna.study.study - INFO - Trial 282 finished with values: [0.011753261969690593, 0.013032786885245904, 0.016097545669638235] and parameters: {'n_layers': 2, 'embedding_dim': 32, 'lr': 0.016757203845338013, 'lambda_val': 2.590190399307384e-06, 'batch_size': 3526, 'optimizer': 'Adam'}.
2026-05-23 00:15:42,243 - experiment_functions - INFO - Early stopping at epoch 950. Best Metrics: (0.016233122370672336, 0.01418032786885246, 0.01937658726488911)
2026-05-23 00:15:43,123 - optuna.study.study - INFO - Trial 283 finished with values: [0.016233122370672336, 0.01418032786885246, 0.01937658726488911] and parameters: {'n_layers': 4, 'embedding_dim': 256, 'lr': 0.02143903136401803, 'lambda_val': 2.590190399307384e-06, 'batch_size': 2505, 'optimizer': 'Adam'}.
2026-05-23 00:15:45,608 - experiment_functions - INFO - Early stopping at epoch 550. Best Metrics: (0.005413880429677756, 0.00778688524590164, 0.008199249722798577)
2026-05-23 00:15:45,712 - optuna.study.study - INFO - Trial 284 finished with values: [0.005413880429677756, 0.00778688524590164, 0.008199249722798577] and parameters: {'n_layers': 4, 'embedding_dim': 96, 'lr': 0.0034872026493997328, 'lambda_val': 9.956828255961624e-05, 'batch_size': 1449, 'optimizer': 'Adam'}.
2026-05-23 00:15:51,361 - experiment_functions - INFO - Early stopping at epoch 1350. Best Metrics: (0.013568287653716418, 0.012131147540983607, 0.016777628850027745)
2026-05-23 00:15:52,001 - optuna.study.study - INFO - Trial 285 finished with values: [0.013568287653716418, 0.012131147540983607, 0.016777628850027745] and parameters: {'n_layers': 3, 'embedding_dim': 256, 'lr': 0.08213657708507706, 'lambda_val': 9.956828255961624e-05, 'batch_size': 2552, 'optimizer': 'RMSprop'}.
2026-05-23 00:15:57,132 - experiment_functions - INFO - Early stopping at epoch 1200. Best Metrics: (0.011400809478428213, 0.01122950819672131, 0.016190097581337267)
2026-05-23 00:15:57,500 - optuna.study.study - INFO - Trial 286 finished with values: [0.011400809478428213, 0.01122950819672131, 0.016190097581337267] and parameters: {'n_layers': 4, 'embedding_dim': 32, 'lr': 0.032125088922163904, 'lambda_val': 0.0003143503113741062, 'batch_size': 2505, 'optimizer': 'Adam'}.
2026-05-23 00:15:59,700 - experiment_functions - INFO - Early stopping at epoch 500. Best Metrics: (0.001597343084934797, 0.0013114754098360656, 0.00166539066609601)
2026-05-23 00:15:59,833 - optuna.study.study - INFO - Trial 287 finished with values: [0.001597343084934797, 0.0013114754098360656, 0.00166539066609601] and parameters: {'n_layers': 2, 'embedding_dim': 96, 'lr': 0.032125088922163904, 'lambda_val': 9.956828255961624e-05, 'batch_size': 2552, 'optimizer': 'SGD'}.
2026-05-23 00:16:02,090 - experiment_functions - INFO - Early stopping at epoch 550. Best Metrics: (0.007045453455792346, 0.009672131147540983, 0.011257439541418229)
2026-05-23 00:16:02,228 - optuna.study.study - INFO - Trial 288 finished with values: [0.007045453455792346, 0.009672131147540983, 0.011257439541418229] and parameters: {'n_layers': 1, 'embedding_dim': 96, 'lr': 0.003452055280392495, 'lambda_val': 4.890741275615565e-05, 'batch_size': 716, 'optimizer': 'Adam'}.
2026-05-23 00:16:08,094 - experiment_functions - INFO - Early stopping at epoch 1750. Best Metrics: (0.012392834292603723, 0.013934426229508197, 0.017230111488494047)
2026-05-23 00:16:08,213 - optuna.study.study - INFO - Trial 289 finished with values: [0.012392834292603723, 0.013934426229508197, 0.017230111488494047] and parameters: {'n_layers': 2, 'embedding_dim': 96, 'lr': 0.02143903136401803, 'lambda_val': 0.00010360674255217468, 'batch_size': 2505, 'optimizer': 'Adam'}.
2026-05-23 00:16:10,523 - experiment_functions - INFO - Early stopping at epoch 550. Best Metrics: (0.007706244459029996, 0.009918032786885246, 0.012619077142434333)
2026-05-23 00:16:10,615 - optuna.study.study - INFO - Trial 290 finished with values: [0.007706244459029996, 0.009918032786885246, 0.012619077142434333] and parameters: {'n_layers': 1, 'embedding_dim': 64, 'lr': 0.007748276590311343, 'lambda_val': 4.481581747537329e-05, 'batch_size': 3089, 'optimizer': 'Adam'}.
2026-05-23 00:16:13,587 - experiment_functions - INFO - Early stopping at epoch 750. Best Metrics: (0.014201578739532282, 0.013606557377049182, 0.01752606920932257)
2026-05-23 00:16:13,680 - optuna.study.study - INFO - Trial 291 finished with values: [0.014201578739532282, 0.013606557377049182, 0.01752606920932257] and parameters: {'n_layers': 2, 'embedding_dim': 96, 'lr': 0.01852608372473555, 'lambda_val': 5.071290024292256e-05, 'batch_size': 2647, 'optimizer': 'RMSprop'}.
2026-05-23 00:16:26,869 - experiment_functions - INFO - Early stopping at epoch 3250. Best Metrics: (0.005911131997893288, 0.008360655737704918, 0.008745642877817612)
2026-05-23 00:16:26,958 - optuna.study.study - INFO - Trial 292 finished with values: [0.005911131997893288, 0.008360655737704918, 0.008745642877817612] and parameters: {'n_layers': 4, 'embedding_dim': 256, 'lr': 3.190390213606107e-05, 'lambda_val': 9.956828255961624e-05, 'batch_size': 2552, 'optimizer': 'RMSprop'}.
2026-05-23 00:16:40,030 - experiment_functions - INFO - Early stopping at epoch 2800. Best Metrics: (0.013531926598685356, 0.014754098360655738, 0.02099247049376708)
2026-05-23 00:16:41,557 - optuna.study.study - INFO - Trial 293 finished with values: [0.013531926598685356, 0.014754098360655738, 0.02099247049376708] and parameters: {'n_layers': 4, 'embedding_dim': 96, 'lr': 0.02143903136401803, 'lambda_val': 2.590190399307384e-06, 'batch_size': 3969, 'optimizer': 'Adam'}.
2026-05-23 00:16:44,082 - experiment_functions - INFO - Early stopping at epoch 550. Best Metrics: (0.006346724429762475, 0.00819672131147541, 0.00940704263102952)
2026-05-23 00:16:44,178 - optuna.study.study - INFO - Trial 294 finished with values: [0.006346724429762475, 0.00819672131147541, 0.00940704263102952] and parameters: {'n_layers': 4, 'embedding_dim': 96, 'lr': 0.0008091932147626044, 'lambda_val': 2.590190399307384e-06, 'batch_size': 2483, 'optimizer': 'Adam'}.
2026-05-23 00:16:46,623 - experiment_functions - INFO - Early stopping at epoch 500. Best Metrics: (0.01007212069487491, 0.011065573770491803, 0.013507703131828162)
2026-05-23 00:16:46,723 - optuna.study.study - INFO - Trial 295 finished with values: [0.01007212069487491, 0.011065573770491803, 0.013507703131828162] and parameters: {'n_layers': 3, 'embedding_dim': 128, 'lr': 0.032125088922163904, 'lambda_val': 1.6084993351680746e-06, 'batch_size': 2919, 'optimizer': 'RMSprop'}.
2026-05-23 00:16:50,678 - experiment_functions - INFO - Early stopping at epoch 1050. Best Metrics: (0.004917092293120302, 0.006475409836065573, 0.00815785559938413)
2026-05-23 00:16:52,108 - optuna.study.study - INFO - Trial 296 finished with values: [0.004917092293120302, 0.006475409836065573, 0.00815785559938413] and parameters: {'n_layers': 3, 'embedding_dim': 96, 'lr': 0.00016261097907738957, 'lambda_val': 4.890741275615565e-05, 'batch_size': 2919, 'optimizer': 'RMSprop'}.
2026-05-23 00:16:54,552 - experiment_functions - INFO - Early stopping at epoch 550. Best Metrics: (0.006747916653605833, 0.007868852459016393, 0.00990968481483539)
2026-05-23 00:16:54,643 - optuna.study.study - INFO - Trial 297 finished with values: [0.006747916653605833, 0.007868852459016393, 0.00990968481483539] and parameters: {'n_layers': 4, 'embedding_dim': 128, 'lr': 0.0004132662463434477, 'lambda_val': 7.367374344877376e-05, 'batch_size': 2069, 'optimizer': 'RMSprop'}.
2026-05-23 00:17:00,930 - experiment_functions - INFO - Early stopping at epoch 1950. Best Metrics: (0.014063138773470752, 0.014754098360655738, 0.01918894025247843)
2026-05-23 00:17:01,118 - optuna.study.study - INFO - Trial 298 finished with values: [0.014063138773470752, 0.014754098360655738, 0.01918894025247843] and parameters: {'n_layers': 3, 'embedding_dim': 32, 'lr': 0.016757203845338013, 'lambda_val': 2.590190399307384e-06, 'batch_size': 2919, 'optimizer': 'RMSprop'}.
2026-05-23 00:17:06,311 - experiment_functions - INFO - Early stopping at epoch 1400. Best Metrics: (0.010763238943981913, 0.012295081967213115, 0.014749031843073903)
2026-05-23 00:17:06,448 - optuna.study.study - INFO - Trial 299 finished with values: [0.010763238943981913, 0.012295081967213115, 0.014749031843073903] and parameters: {'n_layers': 3, 'embedding_dim': 64, 'lr': 0.06796687548548233, 'lambda_val': 4.890741275615565e-05, 'batch_size': 3239, 'optimizer': 'RMSprop'}.
2026-05-23 00:17:06,465 - root - INFO - Selected Trial 235 based on Max NDCG: 0.0244
2026-05-23 00:17:06,465 - root - INFO - Associated Recall: 0.0253
2026-05-23 00:17:06,465 - experiment_functions - INFO - Training the best model ... for e_100K_1c1dcs_strict
2026-05-23 00:17:12,953 - experiment_functions - INFO - Early stopping at epoch 2250. Best Metrics: (0.017891277614990927, 0.014754098360655738, 0.018951785310499094)
2026-05-23 00:17:13,042 - root - INFO -   **** Training e_100K_1c1dcs_strict_rand1
2026-05-23 00:17:13,044 - root - INFO -   **** Getting 7229/81200 random edges
2026-05-23 00:17:13,137 - optuna.storages._rdb.storage - INFO - A new study created in RDB with name: Study_e_100K_1c1dcs_strict_rand1
2026-05-23 00:17:17,067 - experiment_functions - INFO - Early stopping at epoch 1100. Best Metrics: (0.011000924808608438, 0.007540983606557377, 0.010297967198314929)
2026-05-23 00:17:17,171 - optuna.study.study - INFO - Trial 0 finished with values: [0.011000924808608438, 0.007540983606557377, 0.010297967198314929] and parameters: {'n_layers': 3, 'embedding_dim': 32, 'lr': 0.017459772797731272, 'lambda_val': 0.004655126099253904, 'batch_size': 3848, 'optimizer': 'RMSprop'}.
2026-05-23 00:17:19,600 - experiment_functions - INFO - Early stopping at epoch 550. Best Metrics: (0.026686394159694725, 0.015327868852459016, 0.02273232147069515)
2026-05-23 00:17:19,699 - optuna.study.study - INFO - Trial 1 finished with values: [0.026686394159694725, 0.015327868852459016, 0.02273232147069515] and parameters: {'n_layers': 4, 'embedding_dim': 64, 'lr': 0.005832819514590744, 'lambda_val': 0.000258841521491552, 'batch_size': 623, 'optimizer': 'Adam'}.
2026-05-23 00:17:28,289 - experiment_functions - INFO - Early stopping at epoch 2650. Best Metrics: (0.004485404379341274, 0.005491803278688525, 0.007146622915273574)
2026-05-23 00:17:29,096 - optuna.study.study - INFO - Trial 2 finished with values: [0.004485404379341274, 0.005491803278688525, 0.007146622915273574] and parameters: {'n_layers': 3, 'embedding_dim': 128, 'lr': 5.2140602563647875e-05, 'lambda_val': 6.707954107556364e-05, 'batch_size': 1465, 'optimizer': 'RMSprop'}.
2026-05-23 00:17:40,482 - optuna.study.study - INFO - Trial 3 finished with values: [0.03505079985297836, 0.020655737704918034, 0.0317513777127212] and parameters: {'n_layers': 1, 'embedding_dim': 96, 'lr': 0.0003566717415961628, 'lambda_val': 0.00011624026828970741, 'batch_size': 1369, 'optimizer': 'Adam'}.
2026-05-23 00:17:44,037 - experiment_functions - INFO - Early stopping at epoch 1000. Best Metrics: (0.002710476730600187, 0.002295081967213115, 0.0025188472702608535)
2026-05-23 00:17:44,138 - optuna.study.study - INFO - Trial 4 finished with values: [0.002710476730600187, 0.002295081967213115, 0.0025188472702608535] and parameters: {'n_layers': 2, 'embedding_dim': 96, 'lr': 0.03480782942431075, 'lambda_val': 0.0004517995465148704, 'batch_size': 3929, 'optimizer': 'SGD'}.
2026-05-23 00:17:46,470 - experiment_functions - INFO - Early stopping at epoch 500. Best Metrics: (0.0016236909507204261, 0.0018032786885245904, 0.002248453908187383)
2026-05-23 00:17:46,563 - optuna.study.study - INFO - Trial 5 finished with values: [0.0016236909507204261, 0.0018032786885245904, 0.002248453908187383] and parameters: {'n_layers': 4, 'embedding_dim': 96, 'lr': 0.0001035527152130959, 'lambda_val': 1.8975336806539246e-05, 'batch_size': 3148, 'optimizer': 'SGD'}.
2026-05-23 00:17:48,808 - experiment_functions - INFO - Early stopping at epoch 500. Best Metrics: (0.0018620067634347512, 0.0018852459016393442, 0.0023708358874023013)
2026-05-23 00:17:48,897 - optuna.study.study - INFO - Trial 6 finished with values: [0.0018620067634347512, 0.0018852459016393442, 0.0023708358874023013] and parameters: {'n_layers': 3, 'embedding_dim': 128, 'lr': 2.377338776886509e-05, 'lambda_val': 8.552723663691465e-05, 'batch_size': 1232, 'optimizer': 'SGD'}.
2026-05-23 00:17:51,001 - experiment_functions - INFO - Early stopping at epoch 500. Best Metrics: (0.0010282945249684235, 0.001557377049180328, 0.0016903296481133516)
2026-05-23 00:17:51,089 - optuna.study.study - INFO - Trial 7 finished with values: [0.0010282945249684235, 0.001557377049180328, 0.0016903296481133516] and parameters: {'n_layers': 4, 'embedding_dim': 32, 'lr': 7.734893779053443e-05, 'lambda_val': 0.0002155125341051743, 'batch_size': 1541, 'optimizer': 'SGD'}.
2026-05-23 00:17:55,157 - experiment_functions - INFO - Early stopping at epoch 1100. Best Metrics: (0.006421461949662889, 0.005901639344262296, 0.0075357909118782635)
2026-05-23 00:17:55,468 - optuna.study.study - INFO - Trial 8 finished with values: [0.006421461949662889, 0.005901639344262296, 0.0075357909118782635] and parameters: {'n_layers': 3, 'embedding_dim': 128, 'lr': 0.014076733709420296, 'lambda_val': 0.062270696592229356, 'batch_size': 2098, 'optimizer': 'Adam'}.
2026-05-23 00:17:59,248 - experiment_functions - INFO - Early stopping at epoch 900. Best Metrics: (0.03301500646257232, 0.017540983606557377, 0.027979198004180122)
2026-05-23 00:18:00,444 - optuna.study.study - INFO - Trial 9 finished with values: [0.03301500646257232, 0.017540983606557377, 0.027979198004180122] and parameters: {'n_layers': 2, 'embedding_dim': 256, 'lr': 0.0005513489459732522, 'lambda_val': 0.003265600459695188, 'batch_size': 1603, 'optimizer': 'Adam'}.
2026-05-23 00:18:08,907 - experiment_functions - INFO - Early stopping at epoch 2500. Best Metrics: (0.001457340527800237, 0.001639344262295082, 0.0017484104596613593)
2026-05-23 00:18:09,010 - optuna.study.study - INFO - Trial 10 finished with values: [0.001457340527800237, 0.001639344262295082, 0.0017484104596613593] and parameters: {'n_layers': 3, 'embedding_dim': 128, 'lr': 1.4096431570588794e-05, 'lambda_val': 0.005157645915319578, 'batch_size': 3385, 'optimizer': 'Adam'}.
2026-05-23 00:18:11,674 - experiment_functions - INFO - Early stopping at epoch 650. Best Metrics: (0.032899800963591186, 0.017540983606557377, 0.028334357123533955)
2026-05-23 00:18:11,765 - optuna.study.study - INFO - Trial 11 finished with values: [0.032899800963591186, 0.017540983606557377, 0.028334357123533955] and parameters: {'n_layers': 3, 'embedding_dim': 32, 'lr': 0.0011286476195635738, 'lambda_val': 7.591109531033929e-05, 'batch_size': 1280, 'optimizer': 'RMSprop'}.
2026-05-23 00:18:14,458 - experiment_functions - INFO - Early stopping at epoch 550. Best Metrics: (0.016000417425415817, 0.01139344262295082, 0.015392283787942987)
2026-05-23 00:18:14,548 - optuna.study.study - INFO - Trial 12 finished with values: [0.016000417425415817, 0.01139344262295082, 0.015392283787942987] and parameters: {'n_layers': 2, 'embedding_dim': 32, 'lr': 0.005375583079687442, 'lambda_val': 8.819162328566226e-05, 'batch_size': 2230, 'optimizer': 'RMSprop'}.
2026-05-23 00:18:26,603 - optuna.study.study - INFO - Trial 13 finished with values: [0.0036388233897310758, 0.003278688524590164, 0.004284864055115799] and parameters: {'n_layers': 2, 'embedding_dim': 32, 'lr': 7.691410396457882e-05, 'lambda_val': 8.491469818294885e-05, 'batch_size': 2197, 'optimizer': 'Adam'}.
2026-05-23 00:18:28,655 - experiment_functions - INFO - Early stopping at epoch 500. Best Metrics: (0.0018587366174625747, 0.0017213114754098362, 0.0022298706656575366)
2026-05-23 00:18:28,756 - optuna.study.study - INFO - Trial 14 finished with values: [0.0018587366174625747, 0.0017213114754098362, 0.0022298706656575366] and parameters: {'n_layers': 1, 'embedding_dim': 128, 'lr': 0.002727509350064901, 'lambda_val': 8.071368279735022e-05, 'batch_size': 2145, 'optimizer': 'SGD'}.
2026-05-23 00:18:34,042 - experiment_functions - INFO - Early stopping at epoch 1100. Best Metrics: (0.03556900893919353, 0.019918032786885247, 0.031703920089021724)
2026-05-23 00:18:34,269 - optuna.study.study - INFO - Trial 15 finished with values: [0.03556900893919353, 0.019918032786885247, 0.031703920089021724] and parameters: {'n_layers': 1, 'embedding_dim': 96, 'lr': 0.0013882664669042468, 'lambda_val': 5.790863900505623e-06, 'batch_size': 2778, 'optimizer': 'Adam'}.
2026-05-23 00:18:36,782 - experiment_functions - INFO - Early stopping at epoch 550. Best Metrics: (0.02623928775134908, 0.01557377049180328, 0.022065276436462607)
2026-05-23 00:18:36,993 - optuna.study.study - INFO - Trial 16 finished with values: [0.02623928775134908, 0.01557377049180328, 0.022065276436462607] and parameters: {'n_layers': 3, 'embedding_dim': 64, 'lr': 0.00580797875191725, 'lambda_val': 0.006734268474296521, 'batch_size': 3695, 'optimizer': 'Adam'}.
2026-05-23 00:18:44,874 - experiment_functions - INFO - Early stopping at epoch 500. Best Metrics: (0.002563064136279806, 0.0017213114754098362, 0.0023408978551421713)
2026-05-23 00:18:45,447 - optuna.study.study - INFO - Trial 17 finished with values: [0.002563064136279806, 0.0017213114754098362, 0.0023408978551421713] and parameters: {'n_layers': 1, 'embedding_dim': 256, 'lr': 0.006197050289001536, 'lambda_val': 3.7122632654682245e-05, 'batch_size': 2999, 'optimizer': 'SGD'}.
2026-05-23 00:18:54,667 - experiment_functions - INFO - Early stopping at epoch 1450. Best Metrics: (0.0023703255880183796, 0.0021311475409836068, 0.0028845940450577387)
2026-05-23 00:18:55,020 - optuna.study.study - INFO - Trial 18 finished with values: [0.0023703255880183796, 0.0021311475409836068, 0.0028845940450577387] and parameters: {'n_layers': 2, 'embedding_dim': 96, 'lr': 0.02281756610602231, 'lambda_val': 4.012852371796415e-06, 'batch_size': 2439, 'optimizer': 'SGD'}.
2026-05-23 00:18:57,138 - experiment_functions - INFO - Early stopping at epoch 500. Best Metrics: (0.0031406659748567174, 0.0018852459016393442, 0.0024938395418192642)
