2026-05-23 00:09:08,046 - optuna.study.study - INFO - Trial 228 finished with values: [0.016264795132698878, 0.013524590163934426, 0.01951182602922621] and parameters: {'n_layers': 3, 'embedding_dim': 64, 'lr': 0.02773153918226887, 'lambda_val': 0.00010360674255217468, 'batch_size': 2505, 'optimizer': 'Adam'}.
2026-05-23 00:09:10,912 - experiment_functions - INFO - Early stopping at epoch 500. Best Metrics: (0.010787656008138023, 0.009262295081967215, 0.012820660047525587)
2026-05-23 00:09:11,653 - optuna.study.study - INFO - Trial 229 finished with values: [0.010787656008138023, 0.009262295081967215, 0.012820660047525587] and parameters: {'n_layers': 4, 'embedding_dim': 64, 'lr': 0.032125088922163904, 'lambda_val': 2.590190399307384e-06, 'batch_size': 2381, 'optimizer': 'RMSprop'}.
2026-05-23 00:09:14,727 - experiment_functions - INFO - Early stopping at epoch 550. Best Metrics: (0.005620906240032609, 0.007377049180327869, 0.008757784658436723)
2026-05-23 00:09:14,800 - optuna.study.study - INFO - Trial 230 finished with values: [0.005620906240032609, 0.007377049180327869, 0.008757784658436723] and parameters: {'n_layers': 4, 'embedding_dim': 96, 'lr': 0.02143903136401803, 'lambda_val': 0.0006457988495878367, 'batch_size': 3969, 'optimizer': 'Adam'}.
2026-05-23 00:09:18,017 - experiment_functions - INFO - Early stopping at epoch 550. Best Metrics: (0.013211368560933714, 0.010983606557377049, 0.015123996801613238)
2026-05-23 00:09:18,097 - optuna.study.study - INFO - Trial 231 finished with values: [0.013211368560933714, 0.010983606557377049, 0.015123996801613238] and parameters: {'n_layers': 3, 'embedding_dim': 256, 'lr': 0.06796687548548233, 'lambda_val': 4.890741275615565e-05, 'batch_size': 3665, 'optimizer': 'Adam'}.
2026-05-23 00:09:31,051 - experiment_functions - INFO - Early stopping at epoch 3150. Best Metrics: (0.015937069293166035, 0.015655737704918033, 0.0184963651008002)
2026-05-23 00:09:31,128 - optuna.study.study - INFO - Trial 232 finished with values: [0.015937069293166035, 0.015655737704918033, 0.0184963651008002] and parameters: {'n_layers': 3, 'embedding_dim': 32, 'lr': 0.02143903136401803, 'lambda_val': 7.367374344877376e-05, 'batch_size': 3969, 'optimizer': 'Adam'}.
2026-05-23 00:09:33,844 - experiment_functions - INFO - Early stopping at epoch 500. Best Metrics: (0.002112047711301043, 0.0013114754098360656, 0.0016469845157485936)
2026-05-23 00:09:33,939 - optuna.study.study - INFO - Trial 233 finished with values: [0.002112047711301043, 0.0013114754098360656, 0.0016469845157485936] and parameters: {'n_layers': 3, 'embedding_dim': 128, 'lr': 0.0034872026493997328, 'lambda_val': 0.00023986489473645103, 'batch_size': 3460, 'optimizer': 'SGD'}.
2026-05-23 00:09:43,760 - experiment_functions - INFO - Early stopping at epoch 2050. Best Metrics: (0.02081577451401051, 0.014754098360655738, 0.022508844191390046)
2026-05-23 00:09:44,407 - optuna.study.study - INFO - Trial 234 finished with values: [0.02081577451401051, 0.014754098360655738, 0.022508844191390046] and parameters: {'n_layers': 4, 'embedding_dim': 32, 'lr': 0.012476072772677116, 'lambda_val': 9.956828255961624e-05, 'batch_size': 2919, 'optimizer': 'RMSprop'}.
2026-05-23 00:10:01,529 - experiment_functions - INFO - Early stopping at epoch 2850. Best Metrics: (0.02526066808251341, 0.017377049180327873, 0.024412445524521303)
2026-05-23 00:10:01,596 - optuna.study.study - INFO - Trial 235 finished with values: [0.02526066808251341, 0.017377049180327873, 0.024412445524521303] and parameters: {'n_layers': 4, 'embedding_dim': 96, 'lr': 0.01852608372473555, 'lambda_val': 5.071290024292256e-05, 'batch_size': 716, 'optimizer': 'RMSprop'}.
2026-05-23 00:10:05,142 - experiment_functions - INFO - Early stopping at epoch 700. Best Metrics: (0.010741683922107214, 0.010491803278688525, 0.015411381585777498)
2026-05-23 00:10:06,030 - optuna.study.study - INFO - Trial 236 finished with values: [0.010741683922107214, 0.010491803278688525, 0.015411381585777498] and parameters: {'n_layers': 2, 'embedding_dim': 256, 'lr': 0.032125088922163904, 'lambda_val': 2.0926872137727736e-06, 'batch_size': 2123, 'optimizer': 'Adam'}.
2026-05-23 00:10:13,068 - experiment_functions - INFO - Early stopping at epoch 1500. Best Metrics: (0.014595154306030174, 0.013278688524590163, 0.018109225439480684)
2026-05-23 00:10:13,159 - optuna.study.study - INFO - Trial 237 finished with values: [0.014595154306030174, 0.013278688524590163, 0.018109225439480684] and parameters: {'n_layers': 4, 'embedding_dim': 96, 'lr': 0.02143903136401803, 'lambda_val': 0.00010360674255217468, 'batch_size': 2505, 'optimizer': 'Adam'}.
2026-05-23 00:10:26,503 - experiment_functions - INFO - Early stopping at epoch 3250. Best Metrics: (0.017415591307733753, 0.01721311475409836, 0.02255555484559372)
2026-05-23 00:10:26,597 - optuna.study.study - INFO - Trial 238 finished with values: [0.017415591307733753, 0.01721311475409836, 0.02255555484559372] and parameters: {'n_layers': 3, 'embedding_dim': 32, 'lr': 0.06796687548548233, 'lambda_val': 0.00010360674255217468, 'batch_size': 3969, 'optimizer': 'Adam'}.
2026-05-23 00:10:39,860 - experiment_functions - INFO - Early stopping at epoch 2950. Best Metrics: (0.01587774431883564, 0.015081967213114753, 0.02081641807139743)
2026-05-23 00:10:39,947 - optuna.study.study - INFO - Trial 239 finished with values: [0.01587774431883564, 0.015081967213114753, 0.02081641807139743] and parameters: {'n_layers': 4, 'embedding_dim': 256, 'lr': 0.032125088922163904, 'lambda_val': 9.956828255961624e-05, 'batch_size': 866, 'optimizer': 'RMSprop'}.
2026-05-23 00:10:43,061 - experiment_functions - INFO - Early stopping at epoch 600. Best Metrics: (0.005315169176147922, 0.006803278688524591, 0.008605408738533054)
2026-05-23 00:10:43,268 - optuna.study.study - INFO - Trial 240 finished with values: [0.005315169176147922, 0.006803278688524591, 0.008605408738533054] and parameters: {'n_layers': 4, 'embedding_dim': 96, 'lr': 0.007748276590311343, 'lambda_val': 0.00238735433976733, 'batch_size': 2123, 'optimizer': 'Adam'}.
2026-05-23 00:10:47,298 - experiment_functions - INFO - Early stopping at epoch 850. Best Metrics: (0.009735025886145453, 0.012704918032786885, 0.01654554638045462)
2026-05-23 00:10:47,835 - optuna.study.study - INFO - Trial 241 finished with values: [0.009735025886145453, 0.012704918032786885, 0.01654554638045462] and parameters: {'n_layers': 1, 'embedding_dim': 256, 'lr': 0.007748276590311343, 'lambda_val': 4.890741275615565e-05, 'batch_size': 2919, 'optimizer': 'RMSprop'}.
2026-05-23 00:10:59,513 - experiment_functions - INFO - Early stopping at epoch 2850. Best Metrics: (0.012717578876838984, 0.012704918032786885, 0.015964651084500184)
2026-05-23 00:10:59,603 - optuna.study.study - INFO - Trial 242 finished with values: [0.012717578876838984, 0.012704918032786885, 0.015964651084500184] and parameters: {'n_layers': 2, 'embedding_dim': 64, 'lr': 0.0602894258387779, 'lambda_val': 0.0005183974282222809, 'batch_size': 2505, 'optimizer': 'Adam'}.
2026-05-23 00:11:07,764 - experiment_functions - INFO - Early stopping at epoch 1950. Best Metrics: (0.009865989083665172, 0.010245901639344262, 0.012880728876082572)
2026-05-23 00:11:08,711 - optuna.study.study - INFO - Trial 243 finished with values: [0.009865989083665172, 0.010245901639344262, 0.012880728876082572] and parameters: {'n_layers': 2, 'embedding_dim': 64, 'lr': 0.00016499221653036125, 'lambda_val': 4.890741275615565e-05, 'batch_size': 2360, 'optimizer': 'RMSprop'}.
2026-05-23 00:11:12,044 - experiment_functions - INFO - Early stopping at epoch 600. Best Metrics: (0.005115763908472695, 0.006885245901639343, 0.008329057320598644)
2026-05-23 00:11:12,124 - optuna.study.study - INFO - Trial 244 finished with values: [0.005115763908472695, 0.006885245901639343, 0.008329057320598644] and parameters: {'n_layers': 4, 'embedding_dim': 96, 'lr': 0.007748276590311343, 'lambda_val': 0.00021258161074658505, 'batch_size': 3089, 'optimizer': 'Adam'}.
2026-05-23 00:11:27,170 - optuna.study.study - INFO - Trial 245 finished with values: [0.013299376216746612, 0.012377049180327868, 0.017564796504271903] and parameters: {'n_layers': 3, 'embedding_dim': 32, 'lr': 0.006178111746348912, 'lambda_val': 7.367374344877376e-05, 'batch_size': 2552, 'optimizer': 'RMSprop'}.
2026-05-23 00:11:33,787 - experiment_functions - INFO - Early stopping at epoch 1550. Best Metrics: (0.012504494399537951, 0.012704918032786885, 0.015909055666343437)
2026-05-23 00:11:33,911 - optuna.study.study - INFO - Trial 246 finished with values: [0.012504494399537951, 0.012704918032786885, 0.015909055666343437] and parameters: {'n_layers': 2, 'embedding_dim': 32, 'lr': 0.032125088922163904, 'lambda_val': 4.890741275615565e-05, 'batch_size': 3772, 'optimizer': 'RMSprop'}.
2026-05-23 00:11:37,085 - experiment_functions - INFO - Early stopping at epoch 550. Best Metrics: (0.005460572390465428, 0.0069672131147540985, 0.007124037635639116)
2026-05-23 00:11:37,440 - optuna.study.study - INFO - Trial 247 finished with values: [0.005460572390465428, 0.0069672131147540985, 0.007124037635639116] and parameters: {'n_layers': 4, 'embedding_dim': 96, 'lr': 0.006178111746348912, 'lambda_val': 0.0010448931132833446, 'batch_size': 4078, 'optimizer': 'Adam'}.
2026-05-23 00:11:42,254 - experiment_functions - INFO - Early stopping at epoch 1100. Best Metrics: (0.011043566133364659, 0.013852459016393445, 0.016953989387462468)
2026-05-23 00:11:42,957 - optuna.study.study - INFO - Trial 248 finished with values: [0.011043566133364659, 0.013852459016393445, 0.016953989387462468] and parameters: {'n_layers': 1, 'embedding_dim': 96, 'lr': 0.032125088922163904, 'lambda_val': 0.0007135877943290441, 'batch_size': 2552, 'optimizer': 'RMSprop'}.
2026-05-23 00:11:53,360 - experiment_functions - INFO - Early stopping at epoch 2550. Best Metrics: (0.014313612177872758, 0.015163934426229509, 0.01880956254911111)
2026-05-23 00:11:53,815 - optuna.study.study - INFO - Trial 249 finished with values: [0.014313612177872758, 0.015163934426229509, 0.01880956254911111] and parameters: {'n_layers': 2, 'embedding_dim': 32, 'lr': 0.032125088922163904, 'lambda_val': 7.367374344877376e-05, 'batch_size': 2552, 'optimizer': 'Adam'}.
2026-05-23 00:12:06,394 - experiment_functions - INFO - Early stopping at epoch 2750. Best Metrics: (0.01664890825833329, 0.015163934426229509, 0.021191240417598897)
2026-05-23 00:12:06,490 - optuna.study.study - INFO - Trial 250 finished with values: [0.01664890825833329, 0.015163934426229509, 0.021191240417598897] and parameters: {'n_layers': 4, 'embedding_dim': 96, 'lr': 0.02143903136401803, 'lambda_val': 2.590190399307384e-06, 'batch_size': 3737, 'optimizer': 'Adam'}.
2026-05-23 00:12:14,293 - experiment_functions - INFO - Early stopping at epoch 1500. Best Metrics: (0.012072798713386375, 0.01081967213114754, 0.013821874587008785)
2026-05-23 00:12:14,369 - optuna.study.study - INFO - Trial 251 finished with values: [0.012072798713386375, 0.01081967213114754, 0.013821874587008785] and parameters: {'n_layers': 4, 'embedding_dim': 256, 'lr': 0.02143903136401803, 'lambda_val': 0.0003143503113741062, 'batch_size': 2505, 'optimizer': 'Adam'}.
2026-05-23 00:12:25,597 - experiment_functions - INFO - Early stopping at epoch 2750. Best Metrics: (0.0032210479450328353, 0.00319672131147541, 0.0036038086920210884)
2026-05-23 00:12:25,914 - optuna.study.study - INFO - Trial 252 finished with values: [0.0032210479450328353, 0.00319672131147541, 0.0036038086920210884] and parameters: {'n_layers': 3, 'embedding_dim': 32, 'lr': 2.6943759834865433e-05, 'lambda_val': 9.956828255961624e-05, 'batch_size': 3420, 'optimizer': 'Adam'}.
2026-05-23 00:12:32,500 - experiment_functions - INFO - Early stopping at epoch 500. Best Metrics: (0.005722252335648227, 0.007704918032786886, 0.009065842887489314)
2026-05-23 00:12:32,974 - optuna.study.study - INFO - Trial 253 finished with values: [0.005722252335648227, 0.007704918032786886, 0.009065842887489314] and parameters: {'n_layers': 3, 'embedding_dim': 96, 'lr': 0.06796687548548233, 'lambda_val': 0.005944043741569813, 'batch_size': 3969, 'optimizer': 'Adam'}.
2026-05-23 00:12:44,306 - experiment_functions - INFO - Early stopping at epoch 1800. Best Metrics: (0.009658088490408074, 0.011639344262295083, 0.01392355395345496)
2026-05-23 00:12:44,374 - optuna.study.study - INFO - Trial 254 finished with values: [0.009658088490408074, 0.011639344262295083, 0.01392355395345496] and parameters: {'n_layers': 3, 'embedding_dim': 32, 'lr': 0.016757203845338013, 'lambda_val': 2.590190399307384e-06, 'batch_size': 2489, 'optimizer': 'Adam'}.
2026-05-23 00:12:46,975 - experiment_functions - INFO - Early stopping at epoch 550. Best Metrics: (0.007048267642156309, 0.007459016393442624, 0.00802230615177178)
2026-05-23 00:12:47,065 - optuna.study.study - INFO - Trial 255 finished with values: [0.007048267642156309, 0.007459016393442624, 0.00802230615177178] and parameters: {'n_layers': 4, 'embedding_dim': 32, 'lr': 0.0011735270991900411, 'lambda_val': 2.590190399307384e-06, 'batch_size': 2552, 'optimizer': 'RMSprop'}.
2026-05-23 00:12:52,154 - experiment_functions - INFO - Early stopping at epoch 1600. Best Metrics: (0.009936430877273009, 0.012622950819672133, 0.014483236963147832)
2026-05-23 00:12:52,782 - optuna.study.study - INFO - Trial 256 finished with values: [0.009936430877273009, 0.012622950819672133, 0.014483236963147832] and parameters: {'n_layers': 1, 'embedding_dim': 128, 'lr': 0.007748276590311343, 'lambda_val': 1.0988779505731458e-05, 'batch_size': 2069, 'optimizer': 'RMSprop'}.
2026-05-23 00:12:55,607 - experiment_functions - INFO - Early stopping at epoch 700. Best Metrics: (0.003275883797390954, 0.006147540983606557, 0.007707725626292172)
2026-05-23 00:12:55,770 - optuna.study.study - INFO - Trial 257 finished with values: [0.003275883797390954, 0.006147540983606557, 0.007707725626292172] and parameters: {'n_layers': 3, 'embedding_dim': 128, 'lr': 0.032125088922163904, 'lambda_val': 0.03800983217467434, 'batch_size': 783, 'optimizer': 'RMSprop'}.
2026-05-23 00:13:04,979 - experiment_functions - INFO - Early stopping at epoch 2950. Best Metrics: (0.016489449539705932, 0.014836065573770494, 0.020197947002445045)
2026-05-23 00:13:05,434 - optuna.study.study - INFO - Trial 258 finished with values: [0.016489449539705932, 0.014836065573770494, 0.020197947002445045] and parameters: {'n_layers': 3, 'embedding_dim': 32, 'lr': 0.032125088922163904, 'lambda_val': 0.00023986489473645103, 'batch_size': 2552, 'optimizer': 'RMSprop'}.
2026-05-23 00:13:07,933 - experiment_functions - INFO - Early stopping at epoch 500. Best Metrics: (0.01120627966646403, 0.012459016393442626, 0.014596210054515477)
2026-05-23 00:13:08,012 - optuna.study.study - INFO - Trial 259 finished with values: [0.01120627966646403, 0.012459016393442626, 0.014596210054515477] and parameters: {'n_layers': 2, 'embedding_dim': 256, 'lr': 0.032125088922163904, 'lambda_val': 9.956828255961624e-05, 'batch_size': 3600, 'optimizer': 'RMSprop'}.
2026-05-23 00:13:13,672 - experiment_functions - INFO - Early stopping at epoch 1500. Best Metrics: (0.017615311024070122, 0.013852459016393441, 0.019845602869010798)
2026-05-23 00:13:14,128 - optuna.study.study - INFO - Trial 260 finished with values: [0.017615311024070122, 0.013852459016393441, 0.019845602869010798] and parameters: {'n_layers': 4, 'embedding_dim': 32, 'lr': 0.032125088922163904, 'lambda_val': 9.956828255961624e-05, 'batch_size': 2552, 'optimizer': 'Adam'}.
2026-05-23 00:13:16,637 - experiment_functions - INFO - Early stopping at epoch 550. Best Metrics: (0.0059317437586060276, 0.0069672131147540985, 0.009825836533252781)
2026-05-23 00:13:16,717 - optuna.study.study - INFO - Trial 261 finished with values: [0.0059317437586060276, 0.0069672131147540985, 0.009825836533252781] and parameters: {'n_layers': 4, 'embedding_dim': 96, 'lr': 0.0034872026493997328, 'lambda_val': 9.956828255961624e-05, 'batch_size': 1801, 'optimizer': 'Adam'}.
2026-05-23 00:13:28,216 - experiment_functions - INFO - Early stopping at epoch 2950. Best Metrics: (0.016148165540954978, 0.015327868852459018, 0.02106752026797575)
2026-05-23 00:13:28,324 - optuna.study.study - INFO - Trial 262 finished with values: [0.016148165540954978, 0.015327868852459018, 0.02106752026797575] and parameters: {'n_layers': 4, 'embedding_dim': 256, 'lr': 0.032125088922163904, 'lambda_val': 9.956828255961624e-05, 'batch_size': 866, 'optimizer': 'RMSprop'}.
2026-05-23 00:13:34,095 - experiment_functions - INFO - Early stopping at epoch 1600. Best Metrics: (0.016826932871281317, 0.016967213114754097, 0.021615484049994988)
2026-05-23 00:13:34,450 - optuna.study.study - INFO - Trial 263 finished with values: [0.016826932871281317, 0.016967213114754097, 0.021615484049994988] and parameters: {'n_layers': 3, 'embedding_dim': 128, 'lr': 0.02143903136401803, 'lambda_val': 1.0988779505731458e-05, 'batch_size': 3969, 'optimizer': 'Adam'}.
2026-05-23 00:13:37,140 - experiment_functions - INFO - Early stopping at epoch 500. Best Metrics: (0.011943961252804586, 0.011229508196721312, 0.014442539472539219)
2026-05-23 00:13:37,227 - optuna.study.study - INFO - Trial 264 finished with values: [0.011943961252804586, 0.011229508196721312, 0.014442539472539219] and parameters: {'n_layers': 4, 'embedding_dim': 256, 'lr': 0.032125088922163904, 'lambda_val': 9.956828255961624e-05, 'batch_size': 866, 'optimizer': 'RMSprop'}.
2026-05-23 00:13:43,198 - experiment_functions - INFO - Early stopping at epoch 1900. Best Metrics: (0.014076456699204943, 0.015655737704918033, 0.020115669151544262)
2026-05-23 00:13:45,057 - optuna.study.study - INFO - Trial 265 finished with values: [0.014076456699204943, 0.015655737704918033, 0.020115669151544262] and parameters: {'n_layers': 1, 'embedding_dim': 32, 'lr': 0.017984791671690405, 'lambda_val': 2.590190399307384e-06, 'batch_size': 2919, 'optimizer': 'Adam'}.
2026-05-23 00:13:49,656 - experiment_functions - INFO - Early stopping at epoch 1350. Best Metrics: (0.0113224408584146, 0.014426229508196723, 0.016861394239812467)
2026-05-23 00:13:49,752 - optuna.study.study - INFO - Trial 266 finished with values: [0.0113224408584146, 0.014426229508196723, 0.016861394239812467] and parameters: {'n_layers': 2, 'embedding_dim': 32, 'lr': 0.032125088922163904, 'lambda_val': 7.367374344877376e-05, 'batch_size': 2552, 'optimizer': 'RMSprop'}.
2026-05-23 00:13:56,375 - experiment_functions - INFO - Early stopping at epoch 1500. Best Metrics: (0.015681023583124478, 0.015983606557377048, 0.019630288612971874)
2026-05-23 00:13:56,459 - optuna.study.study - INFO - Trial 267 finished with values: [0.015681023583124478, 0.015983606557377048, 0.019630288612971874] and parameters: {'n_layers': 4, 'embedding_dim': 256, 'lr': 0.012476072772677116, 'lambda_val': 7.367374344877376e-05, 'batch_size': 3969, 'optimizer': 'RMSprop'}.
2026-05-23 00:14:06,995 - experiment_functions - INFO - Early stopping at epoch 3250. Best Metrics: (0.02151018756951256, 0.017049180327868854, 0.022867590944363272)
2026-05-23 00:14:07,802 - optuna.study.study - INFO - Trial 268 finished with values: [0.02151018756951256, 0.017049180327868854, 0.022867590944363272] and parameters: {'n_layers': 3, 'embedding_dim': 96, 'lr': 0.02143903136401803, 'lambda_val': 7.367374344877376e-05, 'batch_size': 2919, 'optimizer': 'Adam'}.
2026-05-23 00:14:12,817 - experiment_functions - INFO - Early stopping at epoch 1500. Best Metrics: (0.014891964214964621, 0.013442622950819674, 0.01900158338851062)
2026-05-23 00:14:13,161 - optuna.study.study - INFO - Trial 269 finished with values: [0.014891964214964621, 0.013442622950819674, 0.01900158338851062] and parameters: {'n_layers': 3, 'embedding_dim': 32, 'lr': 0.02143903136401803, 'lambda_val': 0.00010360674255217468, 'batch_size': 3969, 'optimizer': 'Adam'}.
2026-05-23 00:14:19,347 - experiment_functions - INFO - Early stopping at epoch 1900. Best Metrics: (0.013281223520231216, 0.014754098360655738, 0.018068873226206972)
2026-05-23 00:14:20,121 - optuna.study.study - INFO - Trial 270 finished with values: [0.013281223520231216, 0.014754098360655738, 0.018068873226206972] and parameters: {'n_layers': 2, 'embedding_dim': 96, 'lr': 0.016757203845338013, 'lambda_val': 2.590190399307384e-06, 'batch_size': 2919, 'optimizer': 'Adam'}.
2026-05-23 00:14:22,791 - experiment_functions - INFO - Early stopping at epoch 600. Best Metrics: (0.00903518629297194, 0.01081967213114754, 0.013642799405987723)
2026-05-23 00:14:22,887 - optuna.study.study - INFO - Trial 271 finished with values: [0.00903518629297194, 0.01081967213114754, 0.013642799405987723] and parameters: {'n_layers': 1, 'embedding_dim': 256, 'lr': 0.02143903136401803, 'lambda_val': 2.590190399307384e-06, 'batch_size': 3526, 'optimizer': 'Adam'}.
2026-05-23 00:14:25,419 - experiment_functions - INFO - Early stopping at epoch 700. Best Metrics: (0.004238381903852615, 0.006803278688524591, 0.007176182879298843)
2026-05-23 00:14:25,521 - optuna.study.study - INFO - Trial 272 finished with values: [0.004238381903852615, 0.006803278688524591, 0.007176182879298843] and parameters: {'n_layers': 3, 'embedding_dim': 32, 'lr': 0.006178111746348912, 'lambda_val': 0.009973562248313673, 'batch_size': 2552, 'optimizer': 'RMSprop'}.
2026-05-23 00:14:28,557 - experiment_functions - INFO - Early stopping at epoch 650. Best Metrics: (0.010440320391897597, 0.011229508196721312, 0.0143831642850267)
2026-05-23 00:14:28,643 - optuna.study.study - INFO - Trial 273 finished with values: [0.010440320391897597, 0.011229508196721312, 0.0143831642850267] and parameters: {'n_layers': 3, 'embedding_dim': 256, 'lr': 0.06796687548548233, 'lambda_val': 4.890741275615565e-05, 'batch_size': 3969, 'optimizer': 'Adam'}.
2026-05-23 00:14:30,644 - experiment_functions - INFO - Early stopping at epoch 550. Best Metrics: (0.008500214697868312, 0.007295081967213115, 0.009725955223362616)
