2026-05-23 06:18:41,383 - optuna.study.study - INFO - Trial 248 finished with values: [0.00893323431332855, 0.009098360655737705, 0.010824249462845404] and parameters: {'n_layers': 4, 'embedding_dim': 128, 'lr': 0.0004278261152456948, 'lambda_val': 0.00029292236724190197, 'batch_size': 669, 'optimizer': 'RMSprop'}.
2026-05-23 06:18:44,250 - experiment_functions - INFO - Early stopping at epoch 650. Best Metrics: (0.009807950495954303, 0.01139344262295082, 0.0137470662593385)
2026-05-23 06:18:44,330 - optuna.study.study - INFO - Trial 249 finished with values: [0.009807950495954303, 0.01139344262295082, 0.0137470662593385] and parameters: {'n_layers': 1, 'embedding_dim': 256, 'lr': 0.0004278261152456948, 'lambda_val': 1.2684111432161195e-05, 'batch_size': 3670, 'optimizer': 'RMSprop'}.
2026-05-23 06:18:54,069 - experiment_functions - INFO - Early stopping at epoch 3000. Best Metrics: (0.013776531617166106, 0.0169672131147541, 0.02110769259041954)
2026-05-23 06:18:54,332 - optuna.study.study - INFO - Trial 250 finished with values: [0.013776531617166106, 0.0169672131147541, 0.02110769259041954] and parameters: {'n_layers': 1, 'embedding_dim': 256, 'lr': 0.00011765782983091902, 'lambda_val': 0.00022615849293998648, 'batch_size': 1356, 'optimizer': 'Adam'}.
2026-05-23 06:18:56,842 - experiment_functions - INFO - Early stopping at epoch 600. Best Metrics: (0.010416484043061993, 0.014918032786885246, 0.017003868666646577)
2026-05-23 06:18:56,949 - optuna.study.study - INFO - Trial 251 finished with values: [0.010416484043061993, 0.014918032786885246, 0.017003868666646577] and parameters: {'n_layers': 1, 'embedding_dim': 64, 'lr': 0.0012169182947165634, 'lambda_val': 1.90692593503121e-05, 'batch_size': 1356, 'optimizer': 'RMSprop'}.
2026-05-23 06:18:59,482 - experiment_functions - INFO - Early stopping at epoch 600. Best Metrics: (0.008289317245070912, 0.010163934426229508, 0.011902177375700687)
2026-05-23 06:18:59,596 - optuna.study.study - INFO - Trial 252 finished with values: [0.008289317245070912, 0.010163934426229508, 0.011902177375700687] and parameters: {'n_layers': 2, 'embedding_dim': 64, 'lr': 0.001181661214584453, 'lambda_val': 0.00501533971979, 'batch_size': 1356, 'optimizer': 'Adam'}.
2026-05-23 06:19:11,035 - optuna.study.study - INFO - Trial 253 finished with values: [0.005353285917596539, 0.006229508196721312, 0.008118687220006995] and parameters: {'n_layers': 1, 'embedding_dim': 64, 'lr': 7.500732036365339e-05, 'lambda_val': 1.7961727527921352e-06, 'batch_size': 877, 'optimizer': 'RMSprop'}.
2026-05-23 06:19:15,305 - experiment_functions - INFO - Early stopping at epoch 1300. Best Metrics: (0.01605172902634675, 0.016639344262295082, 0.020653759044649875)
2026-05-23 06:19:16,223 - optuna.study.study - INFO - Trial 254 finished with values: [0.01605172902634675, 0.016639344262295082, 0.020653759044649875] and parameters: {'n_layers': 1, 'embedding_dim': 64, 'lr': 0.00036854228595864275, 'lambda_val': 0.00034042279429205883, 'batch_size': 916, 'optimizer': 'Adam'}.
2026-05-23 06:19:30,656 - experiment_functions - INFO - Early stopping at epoch 2150. Best Metrics: (0.01076209195726713, 0.012950819672131146, 0.01673061593415486)
2026-05-23 06:19:30,828 - optuna.study.study - INFO - Trial 255 finished with values: [0.01076209195726713, 0.012950819672131146, 0.01673061593415486] and parameters: {'n_layers': 3, 'embedding_dim': 256, 'lr': 0.00012869980734826536, 'lambda_val': 1.191740143116061e-06, 'batch_size': 3670, 'optimizer': 'RMSprop'}.
2026-05-23 06:19:42,490 - optuna.study.study - INFO - Trial 256 finished with values: [0.016127195269000014, 0.01639344262295082, 0.021669890756198653] and parameters: {'n_layers': 1, 'embedding_dim': 64, 'lr': 0.00012869980734826536, 'lambda_val': 0.008843867790050126, 'batch_size': 877, 'optimizer': 'RMSprop'}.
2026-05-23 06:19:45,468 - experiment_functions - INFO - Early stopping at epoch 850. Best Metrics: (0.014990901754327554, 0.015655737704918033, 0.019698492696937332)
2026-05-23 06:19:45,547 - optuna.study.study - INFO - Trial 257 finished with values: [0.014990901754327554, 0.015655737704918033, 0.019698492696937332] and parameters: {'n_layers': 1, 'embedding_dim': 64, 'lr': 0.0007855341580113746, 'lambda_val': 0.0018518013272191423, 'batch_size': 916, 'optimizer': 'Adam'}.
2026-05-23 06:19:48,204 - experiment_functions - INFO - Early stopping at epoch 650. Best Metrics: (0.006127291613755967, 0.009836065573770493, 0.010879644468919371)
2026-05-23 06:19:48,290 - optuna.study.study - INFO - Trial 258 finished with values: [0.006127291613755967, 0.009836065573770493, 0.010879644468919371] and parameters: {'n_layers': 1, 'embedding_dim': 32, 'lr': 0.006488320674487586, 'lambda_val': 0.0018518013272191423, 'batch_size': 1073, 'optimizer': 'RMSprop'}.
2026-05-23 06:19:50,930 - experiment_functions - INFO - Early stopping at epoch 550. Best Metrics: (0.01636764783795981, 0.016721311475409836, 0.02250036022330957)
2026-05-23 06:19:51,015 - optuna.study.study - INFO - Trial 259 finished with values: [0.01636764783795981, 0.016721311475409836, 0.02250036022330957] and parameters: {'n_layers': 1, 'embedding_dim': 256, 'lr': 0.0023311184980515085, 'lambda_val': 0.0003146553194028543, 'batch_size': 1356, 'optimizer': 'Adam'}.
2026-05-23 06:19:55,386 - experiment_functions - INFO - Early stopping at epoch 1250. Best Metrics: (0.014358059634691963, 0.014836065573770494, 0.018874093943653008)
2026-05-23 06:19:56,295 - optuna.study.study - INFO - Trial 260 finished with values: [0.014358059634691963, 0.014836065573770494, 0.018874093943653008] and parameters: {'n_layers': 1, 'embedding_dim': 64, 'lr': 0.00036854228595864275, 'lambda_val': 1.90692593503121e-05, 'batch_size': 2799, 'optimizer': 'RMSprop'}.
2026-05-23 06:19:59,223 - experiment_functions - INFO - Early stopping at epoch 650. Best Metrics: (0.016722097928907494, 0.015901639344262294, 0.022043105369621608)
2026-05-23 06:20:00,591 - optuna.study.study - INFO - Trial 261 finished with values: [0.016722097928907494, 0.015901639344262294, 0.022043105369621608] and parameters: {'n_layers': 1, 'embedding_dim': 256, 'lr': 0.0012169182947165634, 'lambda_val': 1.90692593503121e-05, 'batch_size': 1356, 'optimizer': 'Adam'}.
2026-05-23 06:20:02,908 - experiment_functions - INFO - Early stopping at epoch 500. Best Metrics: (0.0017729710279679564, 0.0017213114754098362, 0.0019994637978936972)
2026-05-23 06:20:03,707 - optuna.study.study - INFO - Trial 262 finished with values: [0.0017729710279679564, 0.0017213114754098362, 0.0019994637978936972] and parameters: {'n_layers': 1, 'embedding_dim': 128, 'lr': 0.00011765782983091902, 'lambda_val': 0.08928627500031257, 'batch_size': 2899, 'optimizer': 'RMSprop'}.
2026-05-23 06:20:07,235 - experiment_functions - INFO - Early stopping at epoch 900. Best Metrics: (0.014592034394945236, 0.015163934426229509, 0.017618733101361188)
2026-05-23 06:20:07,361 - optuna.study.study - INFO - Trial 263 finished with values: [0.014592034394945236, 0.015163934426229509, 0.017618733101361188] and parameters: {'n_layers': 1, 'embedding_dim': 128, 'lr': 0.00036854228595864275, 'lambda_val': 1.643232822744187e-06, 'batch_size': 2799, 'optimizer': 'Adam'}.
2026-05-23 06:20:10,306 - experiment_functions - INFO - Early stopping at epoch 750. Best Metrics: (0.012891460054974, 0.012540983606557378, 0.015379237964645872)
2026-05-23 06:20:10,407 - optuna.study.study - INFO - Trial 264 finished with values: [0.012891460054974, 0.012540983606557378, 0.015379237964645872] and parameters: {'n_layers': 1, 'embedding_dim': 96, 'lr': 0.0004278261152456948, 'lambda_val': 1.643232822744187e-06, 'batch_size': 3091, 'optimizer': 'Adam'}.
2026-05-23 06:20:13,643 - experiment_functions - INFO - Early stopping at epoch 700. Best Metrics: (0.008000774345053413, 0.011311475409836066, 0.012187849698790906)
2026-05-23 06:20:13,741 - optuna.study.study - INFO - Trial 265 finished with values: [0.008000774345053413, 0.011311475409836066, 0.012187849698790906] and parameters: {'n_layers': 2, 'embedding_dim': 64, 'lr': 0.0007855341580113746, 'lambda_val': 6.869019829439177e-05, 'batch_size': 1073, 'optimizer': 'Adam'}.
2026-05-23 06:20:16,508 - experiment_functions - INFO - Early stopping at epoch 650. Best Metrics: (0.015531999070776884, 0.01819672131147541, 0.022203410806651662)
2026-05-23 06:20:17,248 - optuna.study.study - INFO - Trial 266 finished with values: [0.015531999070776884, 0.01819672131147541, 0.022203410806651662] and parameters: {'n_layers': 1, 'embedding_dim': 96, 'lr': 0.0012169182947165634, 'lambda_val': 1.711820466055588e-05, 'batch_size': 916, 'optimizer': 'Adam'}.
2026-05-23 06:20:26,486 - experiment_functions - INFO - Early stopping at epoch 950. Best Metrics: (0.0021084159147611394, 0.0013934426229508198, 0.001958662737647335)
2026-05-23 06:20:26,835 - optuna.study.study - INFO - Trial 267 finished with values: [0.0021084159147611394, 0.0013934426229508198, 0.001958662737647335] and parameters: {'n_layers': 1, 'embedding_dim': 256, 'lr': 1.054361682141051e-05, 'lambda_val': 1.1371570226930704e-05, 'batch_size': 3670, 'optimizer': 'RMSprop'}.
2026-05-23 06:20:29,271 - experiment_functions - INFO - Early stopping at epoch 550. Best Metrics: (0.008587924301937788, 0.01139344262295082, 0.012940114519144475)
2026-05-23 06:20:29,387 - optuna.study.study - INFO - Trial 268 finished with values: [0.008587924301937788, 0.01139344262295082, 0.012940114519144475] and parameters: {'n_layers': 1, 'embedding_dim': 64, 'lr': 0.0017213741469949933, 'lambda_val': 1.643232822744187e-06, 'batch_size': 1815, 'optimizer': 'RMSprop'}.
2026-05-23 06:20:32,606 - experiment_functions - INFO - Early stopping at epoch 850. Best Metrics: (0.013954582197058371, 0.012049180327868853, 0.015829271639342484)
2026-05-23 06:20:32,710 - optuna.study.study - INFO - Trial 269 finished with values: [0.013954582197058371, 0.012049180327868853, 0.015829271639342484] and parameters: {'n_layers': 1, 'embedding_dim': 128, 'lr': 0.00036854228595864275, 'lambda_val': 1.90692593503121e-05, 'batch_size': 1781, 'optimizer': 'Adam'}.
2026-05-23 06:20:44,186 - optuna.study.study - INFO - Trial 270 finished with values: [0.017515482364636542, 0.017540983606557377, 0.025106833024724627] and parameters: {'n_layers': 1, 'embedding_dim': 64, 'lr': 0.00016882222048828941, 'lambda_val': 0.0008199279436924151, 'batch_size': 910, 'optimizer': 'RMSprop'}.
2026-05-23 06:20:54,724 - experiment_functions - INFO - Early stopping at epoch 3850. Best Metrics: (0.01845005270951406, 0.017868852459016395, 0.02500795155872054)
2026-05-23 06:20:55,088 - optuna.study.study - INFO - Trial 271 finished with values: [0.01845005270951406, 0.017868852459016395, 0.02500795155872054] and parameters: {'n_layers': 1, 'embedding_dim': 64, 'lr': 0.00013647495897976545, 'lambda_val': 1.643232822744187e-06, 'batch_size': 916, 'optimizer': 'RMSprop'}.
2026-05-23 06:21:05,605 - optuna.study.study - INFO - Trial 272 finished with values: [0.00957636202683786, 0.01237704918032787, 0.014277644992483657] and parameters: {'n_layers': 1, 'embedding_dim': 64, 'lr': 0.00011765782983091902, 'lambda_val': 1.1371570226930704e-05, 'batch_size': 877, 'optimizer': 'RMSprop'}.
2026-05-23 06:21:15,559 - optuna.study.study - INFO - Trial 273 finished with values: [0.002533418707329899, 0.002377049180327869, 0.003060999959275101] and parameters: {'n_layers': 2, 'embedding_dim': 96, 'lr': 3.6623579438215364e-05, 'lambda_val': 0.0018518013272191423, 'batch_size': 916, 'optimizer': 'Adam'}.
2026-05-23 06:21:17,950 - experiment_functions - INFO - Early stopping at epoch 700. Best Metrics: (0.019139544533663684, 0.02122950819672131, 0.02581609086474973)
2026-05-23 06:21:18,057 - optuna.study.study - INFO - Trial 274 finished with values: [0.019139544533663684, 0.02122950819672131, 0.02581609086474973] and parameters: {'n_layers': 1, 'embedding_dim': 64, 'lr': 0.0012169182947165634, 'lambda_val': 0.00012377438022736999, 'batch_size': 809, 'optimizer': 'Adam'}.
2026-05-23 06:21:20,856 - experiment_functions - INFO - Early stopping at epoch 700. Best Metrics: (0.012936306912342436, 0.015901639344262294, 0.01909618595074185)
2026-05-23 06:21:21,485 - optuna.study.study - INFO - Trial 275 finished with values: [0.012936306912342436, 0.015901639344262294, 0.01909618595074185] and parameters: {'n_layers': 1, 'embedding_dim': 96, 'lr': 0.001181661214584453, 'lambda_val': 0.00022615849293998648, 'batch_size': 1356, 'optimizer': 'Adam'}.
2026-05-23 06:21:33,755 - optuna.study.study - INFO - Trial 276 finished with values: [0.013494188183952153, 0.017131147540983604, 0.021583936891159016] and parameters: {'n_layers': 1, 'embedding_dim': 128, 'lr': 0.00012869980734826536, 'lambda_val': 0.008974765382487945, 'batch_size': 669, 'optimizer': 'RMSprop'}.
2026-05-23 06:21:37,304 - experiment_functions - INFO - Early stopping at epoch 850. Best Metrics: (0.020702360989001075, 0.018934426229508198, 0.02714373082276864)
2026-05-23 06:21:38,958 - optuna.study.study - INFO - Trial 277 finished with values: [0.020702360989001075, 0.018934426229508198, 0.02714373082276864] and parameters: {'n_layers': 1, 'embedding_dim': 256, 'lr': 0.00048792308917982896, 'lambda_val': 1.643232822744187e-06, 'batch_size': 1059, 'optimizer': 'Adam'}.
2026-05-23 06:21:57,031 - optuna.study.study - INFO - Trial 278 finished with values: [0.022445606179943598, 0.020655737704918034, 0.028270473025998374] and parameters: {'n_layers': 1, 'embedding_dim': 256, 'lr': 0.00011765782983091902, 'lambda_val': 0.0018518013272191423, 'batch_size': 916, 'optimizer': 'RMSprop'}.
2026-05-23 06:21:59,650 - experiment_functions - INFO - Early stopping at epoch 600. Best Metrics: (0.014814093530733105, 0.01778688524590164, 0.022911004929196302)
2026-05-23 06:21:59,733 - optuna.study.study - INFO - Trial 279 finished with values: [0.014814093530733105, 0.01778688524590164, 0.022911004929196302] and parameters: {'n_layers': 1, 'embedding_dim': 64, 'lr': 0.0012169182947165634, 'lambda_val': 1.711820466055588e-05, 'batch_size': 916, 'optimizer': 'RMSprop'}.
2026-05-23 06:22:03,031 - experiment_functions - INFO - Early stopping at epoch 600. Best Metrics: (0.010362087257812335, 0.01237704918032787, 0.013749004029461625)
2026-05-23 06:22:03,099 - optuna.study.study - INFO - Trial 280 finished with values: [0.010362087257812335, 0.01237704918032787, 0.013749004029461625] and parameters: {'n_layers': 3, 'embedding_dim': 256, 'lr': 0.0012169182947165634, 'lambda_val': 1.711820466055588e-05, 'batch_size': 924, 'optimizer': 'Adam'}.
2026-05-23 06:22:16,751 - optuna.study.study - INFO - Trial 281 finished with values: [0.012133008904113885, 0.01221311475409836, 0.016160005061374015] and parameters: {'n_layers': 3, 'embedding_dim': 128, 'lr': 0.00012869980734826536, 'lambda_val': 1.1371570226930704e-05, 'batch_size': 2072, 'optimizer': 'RMSprop'}.
2026-05-23 06:22:27,378 - optuna.study.study - INFO - Trial 282 finished with values: [0.012571682471103383, 0.013360655737704915, 0.017554958890259327] and parameters: {'n_layers': 1, 'embedding_dim': 64, 'lr': 0.00016882222048828941, 'lambda_val': 0.0008199279436924151, 'batch_size': 2799, 'optimizer': 'RMSprop'}.
2026-05-23 06:22:30,040 - experiment_functions - INFO - Early stopping at epoch 850. Best Metrics: (0.012772534303079942, 0.013196721311475411, 0.016909233023203237)
2026-05-23 06:22:30,139 - optuna.study.study - INFO - Trial 283 finished with values: [0.012772534303079942, 0.013196721311475411, 0.016909233023203237] and parameters: {'n_layers': 1, 'embedding_dim': 64, 'lr': 0.00048792308917982896, 'lambda_val': 1.90692593503121e-05, 'batch_size': 2746, 'optimizer': 'Adam'}.
2026-05-23 06:22:32,317 - experiment_functions - INFO - Early stopping at epoch 750. Best Metrics: (0.01300766817637548, 0.016229508196721313, 0.01895813796289189)
2026-05-23 06:22:32,391 - optuna.study.study - INFO - Trial 284 finished with values: [0.01300766817637548, 0.016229508196721313, 0.01895813796289189] and parameters: {'n_layers': 1, 'embedding_dim': 64, 'lr': 0.0007855341580113746, 'lambda_val': 0.0018518013272191423, 'batch_size': 916, 'optimizer': 'Adam'}.
2026-05-23 06:22:34,455 - experiment_functions - INFO - Early stopping at epoch 700. Best Metrics: (0.0009165393513359738, 0.0013114754098360656, 0.0016567888878653092)
2026-05-23 06:22:34,531 - optuna.study.study - INFO - Trial 285 finished with values: [0.0009165393513359738, 0.0013114754098360656, 0.0016567888878653092] and parameters: {'n_layers': 1, 'embedding_dim': 64, 'lr': 3.051096675649753e-05, 'lambda_val': 0.00012304464175487333, 'batch_size': 809, 'optimizer': 'Adam'}.
2026-05-23 06:22:43,740 - optuna.study.study - INFO - Trial 286 finished with values: [0.015083890025348714, 0.016065573770491805, 0.020996634044810843] and parameters: {'n_layers': 1, 'embedding_dim': 96, 'lr': 0.00016882222048828941, 'lambda_val': 0.0008199279436924151, 'batch_size': 916, 'optimizer': 'Adam'}.
2026-05-23 06:22:55,140 - optuna.study.study - INFO - Trial 287 finished with values: [0.010512413636389516, 0.010245901639344262, 0.014070056362978341] and parameters: {'n_layers': 1, 'embedding_dim': 32, 'lr': 0.00011765782983091902, 'lambda_val': 1.1371570226930704e-05, 'batch_size': 3670, 'optimizer': 'RMSprop'}.
2026-05-23 06:22:57,818 - experiment_functions - INFO - Early stopping at epoch 650. Best Metrics: (0.012991856507630543, 0.014098360655737704, 0.01735484045295575)
2026-05-23 06:22:57,963 - optuna.study.study - INFO - Trial 288 finished with values: [0.012991856507630543, 0.014098360655737704, 0.01735484045295575] and parameters: {'n_layers': 1, 'embedding_dim': 128, 'lr': 0.0012169182947165634, 'lambda_val': 6.521299954176742e-06, 'batch_size': 2913, 'optimizer': 'Adam'}.
2026-05-23 06:23:01,867 - experiment_functions - INFO - Early stopping at epoch 850. Best Metrics: (0.003994494102832967, 0.004016393442622951, 0.004907584010404124)
2026-05-23 06:23:01,965 - optuna.study.study - INFO - Trial 289 finished with values: [0.003994494102832967, 0.004016393442622951, 0.004907584010404124] and parameters: {'n_layers': 4, 'embedding_dim': 128, 'lr': 0.0004278261152456948, 'lambda_val': 1.4660714994608745e-06, 'batch_size': 2899, 'optimizer': 'RMSprop'}.
2026-05-23 06:23:04,296 - experiment_functions - INFO - Early stopping at epoch 600. Best Metrics: (0.009304516108729798, 0.010901639344262293, 0.013640866218141243)
2026-05-23 06:23:04,376 - optuna.study.study - INFO - Trial 290 finished with values: [0.009304516108729798, 0.010901639344262293, 0.013640866218141243] and parameters: {'n_layers': 2, 'embedding_dim': 96, 'lr': 0.0012169182947165634, 'lambda_val': 1.711820466055588e-05, 'batch_size': 916, 'optimizer': 'Adam'}.
2026-05-23 06:23:06,749 - experiment_functions - INFO - Early stopping at epoch 700. Best Metrics: (0.015789295357503064, 0.017049180327868854, 0.023893402593502686)
2026-05-23 06:23:06,840 - optuna.study.study - INFO - Trial 291 finished with values: [0.015789295357503064, 0.017049180327868854, 0.023893402593502686] and parameters: {'n_layers': 1, 'embedding_dim': 128, 'lr': 0.0012169182947165634, 'lambda_val': 1.90692593503121e-05, 'batch_size': 1356, 'optimizer': 'Adam'}.
2026-05-23 06:23:08,924 - experiment_functions - INFO - Early stopping at epoch 600. Best Metrics: (0.015793542481310863, 0.016967213114754097, 0.020171033603021842)
2026-05-23 06:23:09,024 - optuna.study.study - INFO - Trial 292 finished with values: [0.015793542481310863, 0.016967213114754097, 0.020171033603021842] and parameters: {'n_layers': 1, 'embedding_dim': 64, 'lr': 0.0022084270117427845, 'lambda_val': 0.00012304464175487333, 'batch_size': 916, 'optimizer': 'Adam'}.
2026-05-23 06:23:11,236 - experiment_functions - INFO - Early stopping at epoch 550. Best Metrics: (0.0019405734581633201, 0.002622950819672131, 0.0026603771597770807)
2026-05-23 06:23:11,325 - optuna.study.study - INFO - Trial 293 finished with values: [0.0019405734581633201, 0.002622950819672131, 0.0026603771597770807] and parameters: {'n_layers': 4, 'embedding_dim': 64, 'lr': 0.0012169182947165634, 'lambda_val': 0.004026163451513262, 'batch_size': 1356, 'optimizer': 'RMSprop'}.
2026-05-23 06:23:14,232 - experiment_functions - INFO - Early stopping at epoch 700. Best Metrics: (0.01754694723024193, 0.0169672131147541, 0.022131431202729066)
2026-05-23 06:23:14,315 - optuna.study.study - INFO - Trial 294 finished with values: [0.01754694723024193, 0.0169672131147541, 0.022131431202729066] and parameters: {'n_layers': 1, 'embedding_dim': 32, 'lr': 0.001181661214584453, 'lambda_val': 0.00022615849293998648, 'batch_size': 1356, 'optimizer': 'Adam'}.
2026-05-23 06:23:17,445 - experiment_functions - INFO - Early stopping at epoch 850. Best Metrics: (0.019725418501606844, 0.018278688524590164, 0.02743584262936774)
2026-05-23 06:23:17,590 - optuna.study.study - INFO - Trial 295 finished with values: [0.019725418501606844, 0.018278688524590164, 0.02743584262936774] and parameters: {'n_layers': 1, 'embedding_dim': 256, 'lr': 0.00048792308917982896, 'lambda_val': 1.4581970839196103e-06, 'batch_size': 916, 'optimizer': 'Adam'}.
2026-05-23 06:23:20,066 - experiment_functions - INFO - Early stopping at epoch 550. Best Metrics: (0.017102797765031572, 0.01778688524590164, 0.02166469222058796)
2026-05-23 06:23:20,597 - optuna.study.study - INFO - Trial 296 finished with values: [0.017102797765031572, 0.01778688524590164, 0.02166469222058796] and parameters: {'n_layers': 1, 'embedding_dim': 96, 'lr': 0.0012169182947165634, 'lambda_val': 0.0018518013272191423, 'batch_size': 916, 'optimizer': 'RMSprop'}.
2026-05-23 06:23:23,426 - experiment_functions - INFO - Early stopping at epoch 650. Best Metrics: (0.014515067830797342, 0.016639344262295085, 0.022147933079909605)
