2026-05-23 00:51:06,106 - optuna.study.study - INFO - Trial 45 finished with values: [0.02730329085259838, 0.017540983606557377, 0.025286945571217162] and parameters: {'n_layers': 1, 'embedding_dim': 96, 'lr': 0.0006241453841646659, 'lambda_val': 0.004662435394613103, 'batch_size': 939, 'optimizer': 'Adam'}.
2026-05-23 00:51:08,797 - experiment_functions - INFO - Early stopping at epoch 750. Best Metrics: (0.006097415107807642, 0.005573770491803278, 0.006649997304523061)
2026-05-23 00:51:08,929 - optuna.study.study - INFO - Trial 46 finished with values: [0.006097415107807642, 0.005573770491803278, 0.006649997304523061] and parameters: {'n_layers': 4, 'embedding_dim': 96, 'lr': 0.04829139371332197, 'lambda_val': 0.019269949670008647, 'batch_size': 1452, 'optimizer': 'Adam'}.
2026-05-23 00:51:12,877 - experiment_functions - INFO - Early stopping at epoch 1250. Best Metrics: (0.016190058052689846, 0.011803278688524592, 0.016018768373281023)
2026-05-23 00:51:12,960 - optuna.study.study - INFO - Trial 47 finished with values: [0.016190058052689846, 0.011803278688524592, 0.016018768373281023] and parameters: {'n_layers': 1, 'embedding_dim': 128, 'lr': 0.0212974880701787, 'lambda_val': 0.0011282239267751141, 'batch_size': 1948, 'optimizer': 'RMSprop'}.
2026-05-23 00:51:15,113 - experiment_functions - INFO - Early stopping at epoch 500. Best Metrics: (0.00904410282950364, 0.006475409836065574, 0.008979315552146093)
2026-05-23 00:51:15,245 - optuna.study.study - INFO - Trial 48 finished with values: [0.00904410282950364, 0.006475409836065574, 0.008979315552146093] and parameters: {'n_layers': 4, 'embedding_dim': 96, 'lr': 0.04079538021682179, 'lambda_val': 1.3220447834833066e-05, 'batch_size': 2507, 'optimizer': 'RMSprop'}.
2026-05-23 00:51:19,253 - experiment_functions - INFO - Early stopping at epoch 1450. Best Metrics: (0.017635310169932382, 0.010901639344262295, 0.01539888948764467)
2026-05-23 00:51:20,084 - optuna.study.study - INFO - Trial 49 finished with values: [0.017635310169932382, 0.010901639344262295, 0.01539888948764467] and parameters: {'n_layers': 4, 'embedding_dim': 32, 'lr': 0.0004373431878704552, 'lambda_val': 0.00030576887852059177, 'batch_size': 3082, 'optimizer': 'Adam'}.
2026-05-23 00:51:22,384 - experiment_functions - INFO - Early stopping at epoch 500. Best Metrics: (0.0018112009722450178, 0.0018852459016393442, 0.002413766740343288)
2026-05-23 00:51:22,501 - optuna.study.study - INFO - Trial 50 finished with values: [0.0018112009722450178, 0.0018852459016393442, 0.002413766740343288] and parameters: {'n_layers': 4, 'embedding_dim': 64, 'lr': 0.0004975305503445845, 'lambda_val': 0.0001031838170332706, 'batch_size': 2057, 'optimizer': 'SGD'}.
2026-05-23 00:51:32,465 - experiment_functions - INFO - Early stopping at epoch 3850. Best Metrics: (0.01178878969290025, 0.008524590163934427, 0.011575096346818593)
2026-05-23 00:51:33,211 - optuna.study.study - INFO - Trial 51 finished with values: [0.01178878969290025, 0.008524590163934427, 0.011575096346818593] and parameters: {'n_layers': 1, 'embedding_dim': 128, 'lr': 0.00011182467711810074, 'lambda_val': 0.0011282239267751141, 'batch_size': 2675, 'optimizer': 'RMSprop'}.
2026-05-23 00:51:37,165 - experiment_functions - INFO - Early stopping at epoch 1450. Best Metrics: (0.004324053113918546, 0.002622950819672131, 0.003791917094278028)
2026-05-23 00:51:37,245 - optuna.study.study - INFO - Trial 52 finished with values: [0.004324053113918546, 0.002622950819672131, 0.003791917094278028] and parameters: {'n_layers': 3, 'embedding_dim': 32, 'lr': 1.4745003367411473e-05, 'lambda_val': 1.2906405560114349e-06, 'batch_size': 2979, 'optimizer': 'RMSprop'}.
2026-05-23 00:51:39,161 - experiment_functions - INFO - Early stopping at epoch 550. Best Metrics: (0.0028783826115836974, 0.0018032786885245904, 0.002670264664790471)
2026-05-23 00:51:39,248 - optuna.study.study - INFO - Trial 53 finished with values: [0.0028783826115836974, 0.0018032786885245904, 0.002670264664790471] and parameters: {'n_layers': 1, 'embedding_dim': 64, 'lr': 1.134131653322191e-05, 'lambda_val': 1.3784461683317798e-06, 'batch_size': 3069, 'optimizer': 'RMSprop'}.
2026-05-23 00:51:45,391 - experiment_functions - INFO - Early stopping at epoch 750. Best Metrics: (0.03235506253572197, 0.01680327868852459, 0.02539937272016386)
2026-05-23 00:51:45,950 - optuna.study.study - INFO - Trial 54 finished with values: [0.03235506253572197, 0.01680327868852459, 0.02539937272016386] and parameters: {'n_layers': 4, 'embedding_dim': 64, 'lr': 0.0007442610977334545, 'lambda_val': 1.6272236642036505e-05, 'batch_size': 1007, 'optimizer': 'RMSprop'}.
2026-05-23 00:51:53,144 - experiment_functions - INFO - Early stopping at epoch 500. Best Metrics: (0.0020527917715515583, 0.002213114754098361, 0.002752808115314666)
2026-05-23 00:51:53,836 - optuna.study.study - INFO - Trial 55 finished with values: [0.0020527917715515583, 0.002213114754098361, 0.002752808115314666] and parameters: {'n_layers': 1, 'embedding_dim': 96, 'lr': 0.012999472865203938, 'lambda_val': 4.838531142366333e-06, 'batch_size': 1938, 'optimizer': 'SGD'}.
2026-05-23 00:51:56,663 - experiment_functions - INFO - Early stopping at epoch 550. Best Metrics: (0.01685784384906236, 0.010737704918032788, 0.015422174125109834)
2026-05-23 00:51:56,757 - optuna.study.study - INFO - Trial 56 finished with values: [0.01685784384906236, 0.010737704918032788, 0.015422174125109834] and parameters: {'n_layers': 4, 'embedding_dim': 96, 'lr': 0.0017367055415770025, 'lambda_val': 2.4582546816090515e-05, 'batch_size': 1514, 'optimizer': 'RMSprop'}.
2026-05-23 00:52:00,269 - experiment_functions - INFO - Early stopping at epoch 1200. Best Metrics: (0.0020644572490726935, 0.0014754098360655738, 0.0022239945480524307)
2026-05-23 00:52:00,406 - optuna.study.study - INFO - Trial 57 finished with values: [0.0020644572490726935, 0.0014754098360655738, 0.0022239945480524307] and parameters: {'n_layers': 1, 'embedding_dim': 96, 'lr': 2.2902320528471964e-05, 'lambda_val': 4.794618333881492e-05, 'batch_size': 4026, 'optimizer': 'RMSprop'}.
2026-05-23 00:52:03,125 - experiment_functions - INFO - Early stopping at epoch 850. Best Metrics: (0.032609888216120625, 0.01762295081967213, 0.02614217888689119)
2026-05-23 00:52:03,216 - optuna.study.study - INFO - Trial 58 finished with values: [0.032609888216120625, 0.01762295081967213, 0.02614217888689119] and parameters: {'n_layers': 2, 'embedding_dim': 64, 'lr': 0.0007586035361839872, 'lambda_val': 0.004686874294387785, 'batch_size': 2156, 'optimizer': 'Adam'}.
2026-05-23 00:52:05,224 - experiment_functions - INFO - Early stopping at epoch 500. Best Metrics: (0.001778778827910947, 0.0017213114754098362, 0.0019386715886914392)
2026-05-23 00:52:05,395 - optuna.study.study - INFO - Trial 59 finished with values: [0.001778778827910947, 0.0017213114754098362, 0.0019386715886914392] and parameters: {'n_layers': 3, 'embedding_dim': 64, 'lr': 8.913283574158017e-05, 'lambda_val': 0.0002006249663471649, 'batch_size': 1001, 'optimizer': 'SGD'}.
2026-05-23 00:52:09,557 - experiment_functions - INFO - Early stopping at epoch 900. Best Metrics: (0.01159440012569284, 0.008114754098360658, 0.010866068115495458)
2026-05-23 00:52:09,688 - optuna.study.study - INFO - Trial 60 finished with values: [0.01159440012569284, 0.008114754098360658, 0.010866068115495458] and parameters: {'n_layers': 2, 'embedding_dim': 256, 'lr': 0.04079538021682179, 'lambda_val': 0.004686874294387785, 'batch_size': 2226, 'optimizer': 'RMSprop'}.
2026-05-23 00:52:11,799 - experiment_functions - INFO - Early stopping at epoch 550. Best Metrics: (0.01413659428293179, 0.010327868852459015, 0.014604529170126264)
2026-05-23 00:52:11,912 - optuna.study.study - INFO - Trial 61 finished with values: [0.01413659428293179, 0.010327868852459015, 0.014604529170126264] and parameters: {'n_layers': 3, 'embedding_dim': 96, 'lr': 0.013616344028618636, 'lambda_val': 0.0007172417291421626, 'batch_size': 1304, 'optimizer': 'Adam'}.
2026-05-23 00:52:14,087 - experiment_functions - INFO - Early stopping at epoch 500. Best Metrics: (0.0018787297685844521, 0.0017213114754098362, 0.001789993187472991)
2026-05-23 00:52:14,191 - optuna.study.study - INFO - Trial 62 finished with values: [0.0018787297685844521, 0.0017213114754098362, 0.001789993187472991] and parameters: {'n_layers': 3, 'embedding_dim': 128, 'lr': 0.00020345967561145935, 'lambda_val': 1.015273791496844e-06, 'batch_size': 4024, 'optimizer': 'SGD'}.
2026-05-23 00:52:17,947 - experiment_functions - INFO - Early stopping at epoch 500. Best Metrics: (0.0021221012203590617, 0.0014754098360655738, 0.002312847780996302)
2026-05-23 00:52:18,046 - optuna.study.study - INFO - Trial 63 finished with values: [0.0021221012203590617, 0.0014754098360655738, 0.002312847780996302] and parameters: {'n_layers': 4, 'embedding_dim': 256, 'lr': 0.054071408644872025, 'lambda_val': 0.00030576887852059177, 'batch_size': 800, 'optimizer': 'SGD'}.
2026-05-23 00:52:21,477 - experiment_functions - INFO - Early stopping at epoch 1100. Best Metrics: (0.03604075409398689, 0.019672131147540985, 0.032946187425002896)
2026-05-23 00:52:21,568 - optuna.study.study - INFO - Trial 64 finished with values: [0.03604075409398689, 0.019672131147540985, 0.032946187425002896] and parameters: {'n_layers': 3, 'embedding_dim': 96, 'lr': 0.0006997302727889885, 'lambda_val': 5.228100030668519e-06, 'batch_size': 1079, 'optimizer': 'Adam'}.
2026-05-23 00:52:23,628 - experiment_functions - INFO - Early stopping at epoch 500. Best Metrics: (0.002804499917986283, 0.002377049180327869, 0.0029647954729666672)
2026-05-23 00:52:23,715 - optuna.study.study - INFO - Trial 65 finished with values: [0.002804499917986283, 0.002377049180327869, 0.0029647954729666672] and parameters: {'n_layers': 4, 'embedding_dim': 96, 'lr': 0.00020345967561145935, 'lambda_val': 1.015273791496844e-06, 'batch_size': 1098, 'optimizer': 'SGD'}.
2026-05-23 00:52:28,058 - experiment_functions - INFO - Early stopping at epoch 1300. Best Metrics: (0.03066210075330553, 0.019590163934426228, 0.02788645065189152)
2026-05-23 00:52:28,929 - optuna.study.study - INFO - Trial 66 finished with values: [0.03066210075330553, 0.019590163934426228, 0.02788645065189152] and parameters: {'n_layers': 1, 'embedding_dim': 256, 'lr': 0.0006241453841646659, 'lambda_val': 0.006616376079935662, 'batch_size': 1254, 'optimizer': 'Adam'}.
2026-05-23 00:52:31,717 - experiment_functions - INFO - Early stopping at epoch 1000. Best Metrics: (0.009693360513414124, 0.008114754098360658, 0.01065054192833345)
2026-05-23 00:52:31,817 - optuna.study.study - INFO - Trial 67 finished with values: [0.009693360513414124, 0.008114754098360658, 0.01065054192833345] and parameters: {'n_layers': 1, 'embedding_dim': 96, 'lr': 0.04829139371332197, 'lambda_val': 0.08226047724640036, 'batch_size': 1361, 'optimizer': 'Adam'}.
2026-05-23 00:52:39,093 - experiment_functions - INFO - Early stopping at epoch 2450. Best Metrics: (0.0020808026190932503, 0.0020491803278688526, 0.00246933895793718)
2026-05-23 00:52:39,171 - optuna.study.study - INFO - Trial 68 finished with values: [0.0020808026190932503, 0.0020491803278688526, 0.00246933895793718] and parameters: {'n_layers': 4, 'embedding_dim': 96, 'lr': 1.2952277086583405e-05, 'lambda_val': 0.00010794232621792934, 'batch_size': 3011, 'optimizer': 'Adam'}.
2026-05-23 00:52:41,799 - experiment_functions - INFO - Early stopping at epoch 600. Best Metrics: (0.02129453045561971, 0.014836065573770494, 0.02191636042288778)
2026-05-23 00:52:41,904 - optuna.study.study - INFO - Trial 69 finished with values: [0.02129453045561971, 0.014836065573770494, 0.02191636042288778] and parameters: {'n_layers': 4, 'embedding_dim': 128, 'lr': 0.0012673220264025206, 'lambda_val': 0.0007449565466447987, 'batch_size': 3082, 'optimizer': 'Adam'}.
2026-05-23 00:52:43,994 - experiment_functions - INFO - Early stopping at epoch 550. Best Metrics: (0.025304903079901825, 0.015901639344262298, 0.024725112823771614)
2026-05-23 00:52:44,111 - optuna.study.study - INFO - Trial 70 finished with values: [0.025304903079901825, 0.015901639344262298, 0.024725112823771614] and parameters: {'n_layers': 2, 'embedding_dim': 96, 'lr': 0.0018845351019360292, 'lambda_val': 5.5532012635423735e-06, 'batch_size': 1468, 'optimizer': 'RMSprop'}.
2026-05-23 00:52:48,402 - experiment_functions - INFO - Early stopping at epoch 1750. Best Metrics: (0.03372786330610832, 0.019590163934426228, 0.028319858473911236)
2026-05-23 00:52:49,711 - optuna.study.study - INFO - Trial 71 finished with values: [0.03372786330610832, 0.019590163934426228, 0.028319858473911236] and parameters: {'n_layers': 1, 'embedding_dim': 96, 'lr': 0.0006241453841646659, 'lambda_val': 0.004662435394613103, 'batch_size': 939, 'optimizer': 'Adam'}.
2026-05-23 00:52:53,908 - experiment_functions - INFO - Early stopping at epoch 900. Best Metrics: (0.014716861860509254, 0.011065573770491803, 0.016118113151549568)
2026-05-23 00:52:54,158 - optuna.study.study - INFO - Trial 72 finished with values: [0.014716861860509254, 0.011065573770491803, 0.016118113151549568] and parameters: {'n_layers': 4, 'embedding_dim': 256, 'lr': 0.00037164008089034755, 'lambda_val': 0.019887116619642948, 'batch_size': 1079, 'optimizer': 'RMSprop'}.
2026-05-23 00:52:55,988 - experiment_functions - INFO - Early stopping at epoch 500. Best Metrics: (0.001472512248848374, 0.0017213114754098357, 0.0020204223356175086)
2026-05-23 00:52:56,073 - optuna.study.study - INFO - Trial 73 finished with values: [0.001472512248848374, 0.0017213114754098357, 0.0020204223356175086] and parameters: {'n_layers': 2, 'embedding_dim': 32, 'lr': 8.913283574158017e-05, 'lambda_val': 0.021707008087328228, 'batch_size': 2979, 'optimizer': 'SGD'}.
2026-05-23 00:52:58,291 - experiment_functions - INFO - Early stopping at epoch 550. Best Metrics: (0.026140651414880568, 0.014508196721311479, 0.021660513148202026)
2026-05-23 00:52:58,374 - optuna.study.study - INFO - Trial 74 finished with values: [0.026140651414880568, 0.014508196721311479, 0.021660513148202026] and parameters: {'n_layers': 4, 'embedding_dim': 96, 'lr': 0.0063764389280221365, 'lambda_val': 0.0007172417291421626, 'batch_size': 1492, 'optimizer': 'Adam'}.
2026-05-23 00:53:01,936 - experiment_functions - INFO - Early stopping at epoch 1250. Best Metrics: (0.018271935128886592, 0.011721311475409836, 0.01648321685378005)
2026-05-23 00:53:03,279 - optuna.study.study - INFO - Trial 75 finished with values: [0.018271935128886592, 0.011721311475409836, 0.01648321685378005] and parameters: {'n_layers': 4, 'embedding_dim': 32, 'lr': 0.0004373431878704552, 'lambda_val': 0.00030576887852059177, 'batch_size': 4024, 'optimizer': 'Adam'}.
2026-05-23 00:53:06,875 - experiment_functions - INFO - Early stopping at epoch 1150. Best Metrics: (0.02524423163662854, 0.015327868852459018, 0.02185144726728164)
2026-05-23 00:53:07,254 - optuna.study.study - INFO - Trial 76 finished with values: [0.02524423163662854, 0.015327868852459018, 0.02185144726728164] and parameters: {'n_layers': 2, 'embedding_dim': 96, 'lr': 0.00034335523469639003, 'lambda_val': 0.02068841888151619, 'batch_size': 3659, 'optimizer': 'Adam'}.
2026-05-23 00:53:09,933 - experiment_functions - INFO - Early stopping at epoch 600. Best Metrics: (0.028120472940422792, 0.01721311475409836, 0.025645978190312075)
2026-05-23 00:53:10,020 - optuna.study.study - INFO - Trial 77 finished with values: [0.028120472940422792, 0.01721311475409836, 0.025645978190312075] and parameters: {'n_layers': 3, 'embedding_dim': 64, 'lr': 0.0030767169926472077, 'lambda_val': 0.0015316223250778048, 'batch_size': 1525, 'optimizer': 'Adam'}.
2026-05-23 00:53:14,829 - experiment_functions - INFO - Early stopping at epoch 700. Best Metrics: (0.028959634777177463, 0.017868852459016395, 0.02817270979596034)
2026-05-23 00:53:15,377 - optuna.study.study - INFO - Trial 78 finished with values: [0.028959634777177463, 0.017868852459016395, 0.02817270979596034] and parameters: {'n_layers': 3, 'embedding_dim': 96, 'lr': 0.0008732317857197807, 'lambda_val': 0.0007172417291421626, 'batch_size': 1588, 'optimizer': 'Adam'}.
2026-05-23 00:53:23,170 - experiment_functions - INFO - Early stopping at epoch 550. Best Metrics: (0.027197116737705036, 0.015655737704918033, 0.022749690033905128)
2026-05-23 00:53:23,572 - optuna.study.study - INFO - Trial 79 finished with values: [0.027197116737705036, 0.015655737704918033, 0.022749690033905128] and parameters: {'n_layers': 4, 'embedding_dim': 128, 'lr': 0.0030767169926472077, 'lambda_val': 6.335945209609284e-06, 'batch_size': 1864, 'optimizer': 'Adam'}.
2026-05-23 00:53:28,466 - experiment_functions - INFO - Early stopping at epoch 700. Best Metrics: (0.01582601255547587, 0.010655737704918034, 0.014500785483738128)
2026-05-23 00:53:28,597 - optuna.study.study - INFO - Trial 80 finished with values: [0.01582601255547587, 0.010655737704918034, 0.014500785483738128] and parameters: {'n_layers': 4, 'embedding_dim': 128, 'lr': 0.000534396994429506, 'lambda_val': 0.011470733297102229, 'batch_size': 1996, 'optimizer': 'Adam'}.
2026-05-23 00:53:44,964 - optuna.study.study - INFO - Trial 81 finished with values: [0.015438253409893628, 0.009344262295081968, 0.014938064970011013] and parameters: {'n_layers': 3, 'embedding_dim': 256, 'lr': 5.9557953840550475e-05, 'lambda_val': 0.00012517387739655414, 'batch_size': 1252, 'optimizer': 'RMSprop'}.
2026-05-23 00:53:47,420 - experiment_functions - INFO - Early stopping at epoch 600. Best Metrics: (0.010943555982250858, 0.008278688524590164, 0.010329637172096924)
2026-05-23 00:53:47,520 - optuna.study.study - INFO - Trial 82 finished with values: [0.010943555982250858, 0.008278688524590164, 0.010329637172096924] and parameters: {'n_layers': 1, 'embedding_dim': 128, 'lr': 0.04079538021682179, 'lambda_val': 0.0003967308570966961, 'batch_size': 1948, 'optimizer': 'RMSprop'}.
2026-05-23 00:53:50,766 - experiment_functions - INFO - Early stopping at epoch 550. Best Metrics: (0.025225968324595283, 0.01557377049180328, 0.02247564627210854)
2026-05-23 00:53:50,862 - optuna.study.study - INFO - Trial 83 finished with values: [0.025225968324595283, 0.01557377049180328, 0.02247564627210854] and parameters: {'n_layers': 4, 'embedding_dim': 256, 'lr': 0.0017367055415770025, 'lambda_val': 0.0002862773838710965, 'batch_size': 2873, 'optimizer': 'Adam'}.
2026-05-23 00:53:55,208 - experiment_functions - INFO - Early stopping at epoch 1300. Best Metrics: (0.01645383574293556, 0.011311475409836066, 0.016114290665116843)
2026-05-23 00:53:56,014 - optuna.study.study - INFO - Trial 84 finished with values: [0.01645383574293556, 0.011311475409836066, 0.016114290665116843] and parameters: {'n_layers': 1, 'embedding_dim': 96, 'lr': 0.0212974880701787, 'lambda_val': 0.024269426427970246, 'batch_size': 3664, 'optimizer': 'RMSprop'}.
2026-05-23 00:54:00,815 - experiment_functions - INFO - Early stopping at epoch 1500. Best Metrics: (0.034936156282241206, 0.01959016393442623, 0.030851896556430267)
2026-05-23 00:54:02,040 - optuna.study.study - INFO - Trial 85 finished with values: [0.034936156282241206, 0.01959016393442623, 0.030851896556430267] and parameters: {'n_layers': 1, 'embedding_dim': 128, 'lr': 0.0006241453841646659, 'lambda_val': 0.004662435394613103, 'batch_size': 939, 'optimizer': 'Adam'}.
2026-05-23 00:54:04,910 - experiment_functions - INFO - Early stopping at epoch 750. Best Metrics: (0.03962026686290004, 0.021557377049180326, 0.03412049466234015)
2026-05-23 00:54:05,037 - optuna.study.study - INFO - Trial 86 finished with values: [0.03962026686290004, 0.021557377049180326, 0.03412049466234015] and parameters: {'n_layers': 1, 'embedding_dim': 128, 'lr': 0.0012673220264025206, 'lambda_val': 5.775336112034289e-05, 'batch_size': 1639, 'optimizer': 'RMSprop'}.
2026-05-23 00:54:08,318 - experiment_functions - INFO - Early stopping at epoch 800. Best Metrics: (0.025983954164765618, 0.016065573770491805, 0.023768269118346355)
2026-05-23 00:54:08,415 - optuna.study.study - INFO - Trial 87 finished with values: [0.025983954164765618, 0.016065573770491805, 0.023768269118346355] and parameters: {'n_layers': 3, 'embedding_dim': 96, 'lr': 0.0006241453841646659, 'lambda_val': 0.004662435394613103, 'batch_size': 3601, 'optimizer': 'Adam'}.
2026-05-23 00:54:11,814 - experiment_functions - INFO - Early stopping at epoch 850. Best Metrics: (0.014908308246489178, 0.010081967213114754, 0.012027121625689701)
2026-05-23 00:54:11,905 - optuna.study.study - INFO - Trial 88 finished with values: [0.014908308246489178, 0.010081967213114754, 0.012027121625689701] and parameters: {'n_layers': 4, 'embedding_dim': 64, 'lr': 0.0004975305503445845, 'lambda_val': 0.00053956191152972, 'batch_size': 2410, 'optimizer': 'RMSprop'}.
2026-05-23 00:54:24,846 - optuna.study.study - INFO - Trial 89 finished with values: [0.02533951892936316, 0.014508196721311479, 0.021402818419327282] and parameters: {'n_layers': 4, 'embedding_dim': 96, 'lr': 0.0001356272514557574, 'lambda_val': 4.838531142366333e-06, 'batch_size': 2080, 'optimizer': 'Adam'}.
2026-05-23 00:54:34,598 - experiment_functions - INFO - Early stopping at epoch 3250. Best Metrics: (0.03741563384216279, 0.020327868852459016, 0.03204411497540443)
2026-05-23 00:54:34,879 - optuna.study.study - INFO - Trial 90 finished with values: [0.03741563384216279, 0.020327868852459016, 0.03204411497540443] and parameters: {'n_layers': 1, 'embedding_dim': 96, 'lr': 0.0004014419530027751, 'lambda_val': 1.2051712435160432e-05, 'batch_size': 2831, 'optimizer': 'Adam'}.
2026-05-23 00:54:40,898 - experiment_functions - INFO - Early stopping at epoch 500. Best Metrics: (0.0014048888320008926, 0.0013114754098360656, 0.001362251679288091)
