2026-05-23 03:58:51,351 - optuna.study.study - INFO - Trial 161 finished with values: [0.06602240714273012, 0.037950819672131146, 0.05658692615854407] and parameters: {'n_layers': 1, 'embedding_dim': 32, 'lr': 0.006682771802508509, 'lambda_val': 0.0314882468140835, 'batch_size': 1166, 'optimizer': 'Adam'}.
2026-05-23 03:58:54,051 - experiment_functions - INFO - Early stopping at epoch 600. Best Metrics: (0.01855744474751271, 0.01221311475409836, 0.016793387223226857)
2026-05-23 03:58:54,185 - optuna.study.study - INFO - Trial 162 finished with values: [0.01855744474751271, 0.01221311475409836, 0.016793387223226857] and parameters: {'n_layers': 1, 'embedding_dim': 32, 'lr': 0.08219687603327691, 'lambda_val': 2.151227794485713e-06, 'batch_size': 2384, 'optimizer': 'Adam'}.
2026-05-23 03:58:56,920 - experiment_functions - INFO - Early stopping at epoch 650. Best Metrics: (0.08036458182204025, 0.04286885245901639, 0.06979703638515483)
2026-05-23 03:58:57,008 - optuna.study.study - INFO - Trial 163 finished with values: [0.08036458182204025, 0.04286885245901639, 0.06979703638515483] and parameters: {'n_layers': 1, 'embedding_dim': 32, 'lr': 0.0025167752834235274, 'lambda_val': 1.6190148297677295e-06, 'batch_size': 1166, 'optimizer': 'RMSprop'}.
2026-05-23 03:58:59,912 - experiment_functions - INFO - Early stopping at epoch 750. Best Metrics: (0.054279627542647695, 0.03024590163934426, 0.04874361972501623)
2026-05-23 03:59:00,350 - optuna.study.study - INFO - Trial 164 finished with values: [0.054279627542647695, 0.03024590163934426, 0.04874361972501623] and parameters: {'n_layers': 1, 'embedding_dim': 96, 'lr': 0.0029056396011724254, 'lambda_val': 0.0017795542900466829, 'batch_size': 635, 'optimizer': 'RMSprop'}.
2026-05-23 03:59:03,557 - experiment_functions - INFO - Early stopping at epoch 750. Best Metrics: (0.03346629828411681, 0.021475409836065575, 0.03191873028509442)
2026-05-23 03:59:03,664 - optuna.study.study - INFO - Trial 165 finished with values: [0.03346629828411681, 0.021475409836065575, 0.03191873028509442] and parameters: {'n_layers': 3, 'embedding_dim': 32, 'lr': 0.0006974716712164259, 'lambda_val': 0.005013716564296358, 'batch_size': 2314, 'optimizer': 'Adam'}.
2026-05-23 03:59:20,912 - optuna.study.study - INFO - Trial 166 finished with values: [0.043717327734391756, 0.026065573770491804, 0.04160959759723615] and parameters: {'n_layers': 4, 'embedding_dim': 32, 'lr': 0.00026503485300845536, 'lambda_val': 6.4213979022807815e-06, 'batch_size': 2384, 'optimizer': 'Adam'}.
2026-05-23 03:59:23,838 - experiment_functions - INFO - Early stopping at epoch 550. Best Metrics: (0.09208696719059752, 0.04377049180327869, 0.07321056532261379)
2026-05-23 03:59:23,915 - optuna.study.study - INFO - Trial 167 finished with values: [0.09208696719059752, 0.04377049180327869, 0.07321056532261379] and parameters: {'n_layers': 1, 'embedding_dim': 256, 'lr': 0.006682771802508509, 'lambda_val': 9.148299075234438e-06, 'batch_size': 3689, 'optimizer': 'Adam'}.
2026-05-23 03:59:26,734 - experiment_functions - INFO - Early stopping at epoch 600. Best Metrics: (0.09426793220748853, 0.051065573770491805, 0.07696007276860954)
2026-05-23 03:59:26,821 - optuna.study.study - INFO - Trial 168 finished with values: [0.09426793220748853, 0.051065573770491805, 0.07696007276860954] and parameters: {'n_layers': 1, 'embedding_dim': 64, 'lr': 0.0029056396011724254, 'lambda_val': 8.173822349987447e-05, 'batch_size': 2515, 'optimizer': 'Adam'}.
2026-05-23 03:59:29,119 - experiment_functions - INFO - Early stopping at epoch 550. Best Metrics: (0.08523564111207822, 0.04237704918032787, 0.07129040424528145)
2026-05-23 03:59:29,223 - optuna.study.study - INFO - Trial 169 finished with values: [0.08523564111207822, 0.04237704918032787, 0.07129040424528145] and parameters: {'n_layers': 1, 'embedding_dim': 32, 'lr': 0.0025167752834235274, 'lambda_val': 0.0005885991132278509, 'batch_size': 1529, 'optimizer': 'RMSprop'}.
2026-05-23 03:59:37,631 - experiment_functions - INFO - Early stopping at epoch 2600. Best Metrics: (0.05583833509008959, 0.030655737704918036, 0.05115256724703827)
2026-05-23 03:59:37,727 - optuna.study.study - INFO - Trial 170 finished with values: [0.05583833509008959, 0.030655737704918036, 0.05115256724703827] and parameters: {'n_layers': 1, 'embedding_dim': 32, 'lr': 0.034338259499645425, 'lambda_val': 0.005013716564296358, 'batch_size': 2314, 'optimizer': 'Adam'}.
2026-05-23 03:59:42,726 - experiment_functions - INFO - Early stopping at epoch 1400. Best Metrics: (0.0938402062176571, 0.051721311475409835, 0.08169343546328374)
2026-05-23 03:59:43,152 - optuna.study.study - INFO - Trial 171 finished with values: [0.0938402062176571, 0.051721311475409835, 0.08169343546328374] and parameters: {'n_layers': 1, 'embedding_dim': 64, 'lr': 0.0005025722918895278, 'lambda_val': 6.13505476225876e-05, 'batch_size': 2515, 'optimizer': 'RMSprop'}.
2026-05-23 03:59:46,130 - experiment_functions - INFO - Early stopping at epoch 600. Best Metrics: (0.055565298883978535, 0.031311475409836066, 0.04726084699913157)
2026-05-23 03:59:46,263 - optuna.study.study - INFO - Trial 172 finished with values: [0.055565298883978535, 0.031311475409836066, 0.04726084699913157] and parameters: {'n_layers': 2, 'embedding_dim': 64, 'lr': 0.0025167752834235274, 'lambda_val': 6.4213979022807815e-06, 'batch_size': 3296, 'optimizer': 'Adam'}.
2026-05-23 03:59:49,272 - experiment_functions - INFO - Early stopping at epoch 550. Best Metrics: (0.09808036019471288, 0.044508196721311476, 0.07521413193279879)
2026-05-23 03:59:49,349 - optuna.study.study - INFO - Trial 173 finished with values: [0.09808036019471288, 0.044508196721311476, 0.07521413193279879] and parameters: {'n_layers': 1, 'embedding_dim': 256, 'lr': 0.00726893620558119, 'lambda_val': 1.8084571105268367e-05, 'batch_size': 2670, 'optimizer': 'Adam'}.
2026-05-23 03:59:51,453 - experiment_functions - INFO - Early stopping at epoch 500. Best Metrics: (0.0015540773672010149, 0.0012295081967213116, 0.0015174686828155857)
2026-05-23 03:59:51,554 - optuna.study.study - INFO - Trial 174 finished with values: [0.0015540773672010149, 0.0012295081967213116, 0.0015174686828155857] and parameters: {'n_layers': 1, 'embedding_dim': 64, 'lr': 0.008293406838085174, 'lambda_val': 0.0017795542900466829, 'batch_size': 2384, 'optimizer': 'SGD'}.
2026-05-23 03:59:54,270 - experiment_functions - INFO - Early stopping at epoch 550. Best Metrics: (0.04635005466867236, 0.023196721311475415, 0.0332560318789296)
2026-05-23 03:59:54,365 - optuna.study.study - INFO - Trial 175 finished with values: [0.04635005466867236, 0.023196721311475415, 0.0332560318789296] and parameters: {'n_layers': 1, 'embedding_dim': 64, 'lr': 0.027856035862650546, 'lambda_val': 1.6555471034129683e-06, 'batch_size': 1018, 'optimizer': 'Adam'}.
2026-05-23 04:00:07,445 - experiment_functions - INFO - Early stopping at epoch 3150. Best Metrics: (0.03463226350074654, 0.02122950819672131, 0.03092947077226026)
2026-05-23 04:00:07,529 - optuna.study.study - INFO - Trial 176 finished with values: [0.03463226350074654, 0.02122950819672131, 0.03092947077226026] and parameters: {'n_layers': 4, 'embedding_dim': 32, 'lr': 0.00026503485300845536, 'lambda_val': 0.005013716564296358, 'batch_size': 2515, 'optimizer': 'Adam'}.
2026-05-23 04:00:13,328 - experiment_functions - INFO - Early stopping at epoch 500. Best Metrics: (0.0005415365204158461, 0.0009836065573770494, 0.0010642222002258074)
2026-05-23 04:00:13,945 - optuna.study.study - INFO - Trial 177 finished with values: [0.0005415365204158461, 0.0009836065573770494, 0.0010642222002258074] and parameters: {'n_layers': 1, 'embedding_dim': 32, 'lr': 0.0029056396011724254, 'lambda_val': 6.13505476225876e-05, 'batch_size': 3317, 'optimizer': 'SGD'}.
2026-05-23 04:00:21,911 - experiment_functions - INFO - Early stopping at epoch 500. Best Metrics: (0.003213765563561721, 0.002459016393442623, 0.003309356557581723)
2026-05-23 04:00:22,395 - optuna.study.study - INFO - Trial 178 finished with values: [0.003213765563561721, 0.002459016393442623, 0.003309356557581723] and parameters: {'n_layers': 1, 'embedding_dim': 128, 'lr': 3.8147855793451816e-05, 'lambda_val': 0.005013716564296358, 'batch_size': 1358, 'optimizer': 'Adam'}.
2026-05-23 04:00:39,511 - optuna.study.study - INFO - Trial 179 finished with values: [0.06411192284529774, 0.03663934426229508, 0.053545933077110586] and parameters: {'n_layers': 3, 'embedding_dim': 96, 'lr': 0.000233346029650438, 'lambda_val': 2.0700677762543618e-06, 'batch_size': 1170, 'optimizer': 'Adam'}.
2026-05-23 04:00:42,731 - experiment_functions - INFO - Early stopping at epoch 600. Best Metrics: (0.10818871526078463, 0.05131147540983607, 0.08666665566746977)
2026-05-23 04:00:43,799 - optuna.study.study - INFO - Trial 180 finished with values: [0.10818871526078463, 0.05131147540983607, 0.08666665566746977] and parameters: {'n_layers': 1, 'embedding_dim': 256, 'lr': 0.0029056396011724254, 'lambda_val': 6.13505476225876e-05, 'batch_size': 2314, 'optimizer': 'Adam'}.
2026-05-23 04:00:56,529 - experiment_functions - INFO - Early stopping at epoch 3450. Best Metrics: (0.05754280912165928, 0.03483606557377049, 0.051992419397763466)
2026-05-23 04:00:56,597 - optuna.study.study - INFO - Trial 181 finished with values: [0.05754280912165928, 0.03483606557377049, 0.051992419397763466] and parameters: {'n_layers': 2, 'embedding_dim': 64, 'lr': 0.00026503485300845536, 'lambda_val': 6.4213979022807815e-06, 'batch_size': 2592, 'optimizer': 'Adam'}.
2026-05-23 04:01:23,779 - optuna.study.study - INFO - Trial 182 finished with values: [0.057179852647686435, 0.03442622950819672, 0.05208828193008461] and parameters: {'n_layers': 4, 'embedding_dim': 256, 'lr': 0.00011557144421774405, 'lambda_val': 4.112104521892171e-06, 'batch_size': 635, 'optimizer': 'Adam'}.
2026-05-23 04:01:29,375 - experiment_functions - INFO - Early stopping at epoch 1050. Best Metrics: (0.07514901244035696, 0.03950819672131148, 0.0644589649364632)
2026-05-23 04:01:29,469 - optuna.study.study - INFO - Trial 183 finished with values: [0.07514901244035696, 0.03950819672131148, 0.0644589649364632] and parameters: {'n_layers': 2, 'embedding_dim': 256, 'lr': 0.0005201459519511334, 'lambda_val': 8.391673416893658e-05, 'batch_size': 1534, 'optimizer': 'Adam'}.
2026-05-23 04:01:32,085 - experiment_functions - INFO - Early stopping at epoch 550. Best Metrics: (0.07360175283987913, 0.039098360655737706, 0.06222717117285607)
2026-05-23 04:01:32,182 - optuna.study.study - INFO - Trial 184 finished with values: [0.07360175283987913, 0.039098360655737706, 0.06222717117285607] and parameters: {'n_layers': 1, 'embedding_dim': 96, 'lr': 0.0029056396011724254, 'lambda_val': 6.13505476225876e-05, 'batch_size': 2515, 'optimizer': 'RMSprop'}.
2026-05-23 04:01:37,571 - experiment_functions - INFO - Early stopping at epoch 950. Best Metrics: (0.04629127174037336, 0.02516393442622951, 0.04601229654093161)
2026-05-23 04:01:37,645 - optuna.study.study - INFO - Trial 185 finished with values: [0.04629127174037336, 0.02516393442622951, 0.04601229654093161] and parameters: {'n_layers': 3, 'embedding_dim': 32, 'lr': 0.0006974716712164259, 'lambda_val': 6.13505476225876e-05, 'batch_size': 2314, 'optimizer': 'Adam'}.
2026-05-23 04:01:40,075 - experiment_functions - INFO - Early stopping at epoch 550. Best Metrics: (0.08703038677523665, 0.044426229508196725, 0.07413959690470708)
2026-05-23 04:01:40,169 - optuna.study.study - INFO - Trial 186 finished with values: [0.08703038677523665, 0.044426229508196725, 0.07413959690470708] and parameters: {'n_layers': 1, 'embedding_dim': 32, 'lr': 0.00726893620558119, 'lambda_val': 1.8084571105268367e-05, 'batch_size': 2314, 'optimizer': 'Adam'}.
2026-05-23 04:01:43,676 - experiment_functions - INFO - Early stopping at epoch 700. Best Metrics: (0.11490078954980293, 0.05377049180327868, 0.09301840396034115)
2026-05-23 04:01:43,808 - optuna.study.study - INFO - Trial 187 finished with values: [0.11490078954980293, 0.05377049180327868, 0.09301840396034115] and parameters: {'n_layers': 1, 'embedding_dim': 256, 'lr': 0.0015660906918692206, 'lambda_val': 0.0005885991132278509, 'batch_size': 2386, 'optimizer': 'Adam'}.
2026-05-23 04:02:00,253 - optuna.study.study - INFO - Trial 188 finished with values: [0.053426113453728184, 0.030000000000000002, 0.047664400550018686] and parameters: {'n_layers': 3, 'embedding_dim': 96, 'lr': 0.00011557144421774405, 'lambda_val': 4.112104521892171e-06, 'batch_size': 618, 'optimizer': 'Adam'}.
2026-05-23 04:02:03,396 - experiment_functions - INFO - Early stopping at epoch 550. Best Metrics: (0.04860665159955032, 0.02450819672131148, 0.042247880825666766)
2026-05-23 04:02:03,829 - optuna.study.study - INFO - Trial 189 finished with values: [0.04860665159955032, 0.02450819672131148, 0.042247880825666766] and parameters: {'n_layers': 1, 'embedding_dim': 64, 'lr': 0.027856035862650546, 'lambda_val': 1.6555471034129683e-06, 'batch_size': 2013, 'optimizer': 'Adam'}.
2026-05-23 04:02:17,044 - experiment_functions - INFO - Early stopping at epoch 2150. Best Metrics: (0.09974537495269957, 0.04975409836065574, 0.08287894645789003)
2026-05-23 04:02:17,131 - optuna.study.study - INFO - Trial 190 finished with values: [0.09974537495269957, 0.04975409836065574, 0.08287894645789003] and parameters: {'n_layers': 1, 'embedding_dim': 64, 'lr': 0.0005201459519511334, 'lambda_val': 1.8084571105268367e-05, 'batch_size': 2670, 'optimizer': 'Adam'}.
2026-05-23 04:02:29,875 - optuna.study.study - INFO - Trial 191 finished with values: [0.04989093517383319, 0.02540983606557377, 0.04387051497820259] and parameters: {'n_layers': 1, 'embedding_dim': 64, 'lr': 0.00011557144421774405, 'lambda_val': 4.112104521892171e-06, 'batch_size': 3675, 'optimizer': 'RMSprop'}.
2026-05-23 04:02:32,786 - experiment_functions - INFO - Early stopping at epoch 700. Best Metrics: (0.09696025226648705, 0.0478688524590164, 0.08005354628516884)
2026-05-23 04:02:32,886 - optuna.study.study - INFO - Trial 192 finished with values: [0.09696025226648705, 0.0478688524590164, 0.08005354628516884] and parameters: {'n_layers': 1, 'embedding_dim': 64, 'lr': 0.0016044647069746135, 'lambda_val': 4.0917763253209226e-05, 'batch_size': 2589, 'optimizer': 'Adam'}.
2026-05-23 04:02:35,353 - experiment_functions - INFO - Early stopping at epoch 550. Best Metrics: (0.10721404973381492, 0.051721311475409835, 0.0853724316380764)
2026-05-23 04:02:35,476 - optuna.study.study - INFO - Trial 193 finished with values: [0.10721404973381492, 0.051721311475409835, 0.0853724316380764] and parameters: {'n_layers': 1, 'embedding_dim': 96, 'lr': 0.00726893620558119, 'lambda_val': 2.0700677762543618e-06, 'batch_size': 3317, 'optimizer': 'Adam'}.
2026-05-23 04:02:40,451 - experiment_functions - INFO - Early stopping at epoch 1200. Best Metrics: (0.025635085542692955, 0.012131147540983607, 0.020014807598599242)
2026-05-23 04:02:40,547 - optuna.study.study - INFO - Trial 194 finished with values: [0.025635085542692955, 0.012131147540983607, 0.020014807598599242] and parameters: {'n_layers': 3, 'embedding_dim': 32, 'lr': 0.08950989930281485, 'lambda_val': 0.000799709362089851, 'batch_size': 2515, 'optimizer': 'Adam'}.
2026-05-23 04:02:46,511 - experiment_functions - INFO - Early stopping at epoch 1450. Best Metrics: (0.026168514974697885, 0.019918032786885247, 0.025362440236679894)
2026-05-23 04:02:46,767 - optuna.study.study - INFO - Trial 195 finished with values: [0.026168514974697885, 0.019918032786885247, 0.025362440236679894] and parameters: {'n_layers': 3, 'embedding_dim': 32, 'lr': 0.000233346029650438, 'lambda_val': 0.0314882468140835, 'batch_size': 2606, 'optimizer': 'Adam'}.
2026-05-23 04:02:50,151 - experiment_functions - INFO - Early stopping at epoch 750. Best Metrics: (0.1050921200790277, 0.0489344262295082, 0.0861609024673178)
2026-05-23 04:02:50,249 - optuna.study.study - INFO - Trial 196 finished with values: [0.1050921200790277, 0.0489344262295082, 0.0861609024673178] and parameters: {'n_layers': 1, 'embedding_dim': 128, 'lr': 0.0016044647069746135, 'lambda_val': 2.0700677762543618e-06, 'batch_size': 2933, 'optimizer': 'Adam'}.
2026-05-23 04:02:53,104 - experiment_functions - INFO - Early stopping at epoch 550. Best Metrics: (0.09811085321000321, 0.04680327868852459, 0.08183030711980967)
2026-05-23 04:02:53,186 - optuna.study.study - INFO - Trial 197 finished with values: [0.09811085321000321, 0.04680327868852459, 0.08183030711980967] and parameters: {'n_layers': 1, 'embedding_dim': 256, 'lr': 0.006682771802508509, 'lambda_val': 6.13505476225876e-05, 'batch_size': 2314, 'optimizer': 'Adam'}.
2026-05-23 04:02:57,370 - experiment_functions - INFO - Early stopping at epoch 850. Best Metrics: (0.03849628464725161, 0.023852459016393445, 0.03262406482960943)
2026-05-23 04:02:58,711 - optuna.study.study - INFO - Trial 198 finished with values: [0.03849628464725161, 0.023852459016393445, 0.03262406482960943] and parameters: {'n_layers': 3, 'embedding_dim': 64, 'lr': 0.0007420979429767307, 'lambda_val': 6.13505476225876e-05, 'batch_size': 2837, 'optimizer': 'Adam'}.
2026-05-23 04:03:19,849 - optuna.study.study - INFO - Trial 199 finished with values: [0.01704183104208729, 0.013196721311475411, 0.017170486760360107] and parameters: {'n_layers': 2, 'embedding_dim': 128, 'lr': 6.291024185419685e-05, 'lambda_val': 1.8084571105268367e-05, 'batch_size': 1784, 'optimizer': 'Adam'}.
2026-05-23 04:03:24,005 - experiment_functions - INFO - Early stopping at epoch 1000. Best Metrics: (0.10271251422795838, 0.050819672131147534, 0.0824106018243161)
2026-05-23 04:03:24,537 - optuna.study.study - INFO - Trial 200 finished with values: [0.10271251422795838, 0.050819672131147534, 0.0824106018243161] and parameters: {'n_layers': 1, 'embedding_dim': 128, 'lr': 0.0007420979429767307, 'lambda_val': 0.005013716564296358, 'batch_size': 2933, 'optimizer': 'Adam'}.
2026-05-23 04:03:27,242 - experiment_functions - INFO - Early stopping at epoch 600. Best Metrics: (0.07993107141278102, 0.040983606557377046, 0.0669877491735601)
2026-05-23 04:03:27,338 - optuna.study.study - INFO - Trial 201 finished with values: [0.07993107141278102, 0.040983606557377046, 0.0669877491735601] and parameters: {'n_layers': 2, 'embedding_dim': 32, 'lr': 0.0025167752834235274, 'lambda_val': 6.4213979022807815e-06, 'batch_size': 841, 'optimizer': 'Adam'}.
2026-05-23 04:03:30,129 - experiment_functions - INFO - Early stopping at epoch 600. Best Metrics: (0.10740265254775641, 0.05180327868852459, 0.09015024245858103)
2026-05-23 04:03:30,231 - optuna.study.study - INFO - Trial 202 finished with values: [0.10740265254775641, 0.05180327868852459, 0.09015024245858103] and parameters: {'n_layers': 1, 'embedding_dim': 64, 'lr': 0.0033147733619128938, 'lambda_val': 6.13505476225876e-05, 'batch_size': 2670, 'optimizer': 'Adam'}.
2026-05-23 04:03:33,743 - experiment_functions - INFO - Early stopping at epoch 700. Best Metrics: (0.10668580790162845, 0.04967213114754099, 0.08229700692323097)
2026-05-23 04:03:34,303 - optuna.study.study - INFO - Trial 203 finished with values: [0.10668580790162845, 0.04967213114754099, 0.08229700692323097] and parameters: {'n_layers': 1, 'embedding_dim': 256, 'lr': 0.0016044647069746135, 'lambda_val': 6.13505476225876e-05, 'batch_size': 1529, 'optimizer': 'Adam'}.
2026-05-23 04:03:36,721 - experiment_functions - INFO - Early stopping at epoch 550. Best Metrics: (0.05056895051707732, 0.028524590163934424, 0.043110727120619974)
2026-05-23 04:03:36,836 - optuna.study.study - INFO - Trial 204 finished with values: [0.05056895051707732, 0.028524590163934424, 0.043110727120619974] and parameters: {'n_layers': 1, 'embedding_dim': 32, 'lr': 0.006682771802508509, 'lambda_val': 9.148299075234438e-06, 'batch_size': 3689, 'optimizer': 'RMSprop'}.
2026-05-23 04:03:39,683 - experiment_functions - INFO - Early stopping at epoch 550. Best Metrics: (0.04691717225188359, 0.025081967213114755, 0.038657291987207125)
2026-05-23 04:03:39,820 - optuna.study.study - INFO - Trial 205 finished with values: [0.04691717225188359, 0.025081967213114755, 0.038657291987207125] and parameters: {'n_layers': 2, 'embedding_dim': 128, 'lr': 0.00726893620558119, 'lambda_val': 1.1150431230027626e-06, 'batch_size': 761, 'optimizer': 'Adam'}.
2026-05-23 04:03:46,234 - experiment_functions - INFO - Early stopping at epoch 1600. Best Metrics: (0.0012246950555767787, 0.0013934426229508198, 0.001407108904913841)
2026-05-23 04:03:46,907 - optuna.study.study - INFO - Trial 206 finished with values: [0.0012246950555767787, 0.0013934426229508198, 0.001407108904913841] and parameters: {'n_layers': 1, 'embedding_dim': 96, 'lr': 1.1058324589027041e-05, 'lambda_val': 0.0009374888888813629, 'batch_size': 3317, 'optimizer': 'Adam'}.
2026-05-23 04:03:50,232 - experiment_functions - INFO - Early stopping at epoch 800. Best Metrics: (0.1051131087345175, 0.05139344262295081, 0.08692026155981307)
2026-05-23 04:03:50,780 - optuna.study.study - INFO - Trial 207 finished with values: [0.1051131087345175, 0.05139344262295081, 0.08692026155981307] and parameters: {'n_layers': 1, 'embedding_dim': 64, 'lr': 0.0016044647069746135, 'lambda_val': 8.173822349987447e-05, 'batch_size': 3317, 'optimizer': 'Adam'}.
2026-05-23 04:03:54,806 - experiment_functions - INFO - Early stopping at epoch 900. Best Metrics: (0.08135283159205345, 0.04213114754098361, 0.0686081739445202)
2026-05-23 04:03:54,889 - optuna.study.study - INFO - Trial 208 finished with values: [0.08135283159205345, 0.04213114754098361, 0.0686081739445202] and parameters: {'n_layers': 1, 'embedding_dim': 32, 'lr': 0.001400888165625605, 'lambda_val': 4.0917763253209226e-05, 'batch_size': 2589, 'optimizer': 'Adam'}.
