2026-05-23 01:32:26,731 - optuna.study.study - INFO - Trial 253 finished with values: [0.024605376196027026, 0.01459016393442623, 0.022742605668238363] and parameters: {'n_layers': 2, 'embedding_dim': 96, 'lr': 0.0054017846217753514, 'lambda_val': 1.150702232586112e-06, 'batch_size': 2030, 'optimizer': 'Adam'}.
2026-05-23 01:32:32,786 - experiment_functions - INFO - Early stopping at epoch 2050. Best Metrics: (0.030652137954099122, 0.017950819672131146, 0.027285656848048467)
2026-05-23 01:32:33,252 - optuna.study.study - INFO - Trial 254 finished with values: [0.030652137954099122, 0.017950819672131146, 0.027285656848048467] and parameters: {'n_layers': 1, 'embedding_dim': 64, 'lr': 0.0006071804751429957, 'lambda_val': 0.00012261737938750884, 'batch_size': 1088, 'optimizer': 'RMSprop'}.
2026-05-23 01:32:37,832 - experiment_functions - INFO - Early stopping at epoch 1450. Best Metrics: (0.03131313808999932, 0.017459016393442623, 0.02852551471899813)
2026-05-23 01:32:38,025 - optuna.study.study - INFO - Trial 255 finished with values: [0.03131313808999932, 0.017459016393442623, 0.02852551471899813] and parameters: {'n_layers': 1, 'embedding_dim': 64, 'lr': 0.0006071804751429957, 'lambda_val': 3.599619235549841e-05, 'batch_size': 2193, 'optimizer': 'Adam'}.
2026-05-23 01:32:42,027 - experiment_functions - INFO - Early stopping at epoch 1150. Best Metrics: (0.032466142645024655, 0.01721311475409836, 0.025787673568788028)
2026-05-23 01:32:42,530 - optuna.study.study - INFO - Trial 256 finished with values: [0.032466142645024655, 0.01721311475409836, 0.025787673568788028] and parameters: {'n_layers': 2, 'embedding_dim': 96, 'lr': 0.000496802361339361, 'lambda_val': 1.150702232586112e-06, 'batch_size': 2030, 'optimizer': 'Adam'}.
2026-05-23 01:32:45,378 - experiment_functions - INFO - Early stopping at epoch 750. Best Metrics: (0.02019788725624708, 0.013442622950819674, 0.0196785517687802)
2026-05-23 01:32:45,464 - optuna.study.study - INFO - Trial 257 finished with values: [0.02019788725624708, 0.013442622950819674, 0.0196785517687802] and parameters: {'n_layers': 1, 'embedding_dim': 96, 'lr': 0.013866533073102115, 'lambda_val': 7.202525708659488e-05, 'batch_size': 1031, 'optimizer': 'RMSprop'}.
2026-05-23 01:32:47,920 - experiment_functions - INFO - Early stopping at epoch 600. Best Metrics: (0.03143245826661236, 0.017868852459016392, 0.027550856637468188)
2026-05-23 01:32:48,008 - optuna.study.study - INFO - Trial 258 finished with values: [0.03143245826661236, 0.017868852459016392, 0.027550856637468188] and parameters: {'n_layers': 2, 'embedding_dim': 32, 'lr': 0.0054017846217753514, 'lambda_val': 1.150702232586112e-06, 'batch_size': 1031, 'optimizer': 'Adam'}.
2026-05-23 01:32:56,587 - experiment_functions - INFO - Early stopping at epoch 3000. Best Metrics: (0.03324735822798445, 0.02081967213114754, 0.033026333527417996)
2026-05-23 01:32:56,738 - optuna.study.study - INFO - Trial 259 finished with values: [0.03324735822798445, 0.02081967213114754, 0.033026333527417996] and parameters: {'n_layers': 1, 'embedding_dim': 64, 'lr': 0.000496802361339361, 'lambda_val': 7.202525708659488e-05, 'batch_size': 1088, 'optimizer': 'RMSprop'}.
2026-05-23 01:33:07,486 - experiment_functions - INFO - Early stopping at epoch 3500. Best Metrics: (0.036384336901399535, 0.021475409836065575, 0.03444720305163198)
2026-05-23 01:33:08,772 - optuna.study.study - INFO - Trial 260 finished with values: [0.036384336901399535, 0.021475409836065575, 0.03444720305163198] and parameters: {'n_layers': 3, 'embedding_dim': 96, 'lr': 0.0002386554512236704, 'lambda_val': 3.599619235549841e-05, 'batch_size': 638, 'optimizer': 'RMSprop'}.
2026-05-23 01:33:11,110 - experiment_functions - INFO - Early stopping at epoch 550. Best Metrics: (0.01972799713297737, 0.012131147540983607, 0.017306719878211363)
2026-05-23 01:33:11,275 - optuna.study.study - INFO - Trial 261 finished with values: [0.01972799713297737, 0.012131147540983607, 0.017306719878211363] and parameters: {'n_layers': 3, 'embedding_dim': 32, 'lr': 0.004215440141897363, 'lambda_val': 1.150702232586112e-06, 'batch_size': 1088, 'optimizer': 'RMSprop'}.
2026-05-23 01:33:13,454 - experiment_functions - INFO - Early stopping at epoch 500. Best Metrics: (0.0019253293766122682, 0.0018032786885245904, 0.002400136567256395)
2026-05-23 01:33:13,548 - optuna.study.study - INFO - Trial 262 finished with values: [0.0019253293766122682, 0.0018032786885245904, 0.002400136567256395] and parameters: {'n_layers': 2, 'embedding_dim': 64, 'lr': 0.0006071804751429957, 'lambda_val': 7.108706732950844e-06, 'batch_size': 848, 'optimizer': 'SGD'}.
2026-05-23 01:33:17,382 - experiment_functions - INFO - Early stopping at epoch 1150. Best Metrics: (0.028497565287522356, 0.01655737704918033, 0.025388696422012046)
2026-05-23 01:33:17,483 - optuna.study.study - INFO - Trial 263 finished with values: [0.028497565287522356, 0.01655737704918033, 0.025388696422012046] and parameters: {'n_layers': 1, 'embedding_dim': 96, 'lr': 0.0006071804751429957, 'lambda_val': 7.202525708659488e-05, 'batch_size': 2030, 'optimizer': 'RMSprop'}.
2026-05-23 01:33:28,535 - optuna.study.study - INFO - Trial 264 finished with values: [0.0025675239272517293, 0.0019672131147540984, 0.003104528851467048] and parameters: {'n_layers': 2, 'embedding_dim': 32, 'lr': 5.290828279003827e-05, 'lambda_val': 1.150702232586112e-06, 'batch_size': 542, 'optimizer': 'Adam'}.
2026-05-23 01:33:35,724 - experiment_functions - INFO - Early stopping at epoch 2450. Best Metrics: (0.027423822459566337, 0.01901639344262295, 0.02735055137574896)
2026-05-23 01:33:35,802 - optuna.study.study - INFO - Trial 265 finished with values: [0.027423822459566337, 0.01901639344262295, 0.02735055137574896] and parameters: {'n_layers': 1, 'embedding_dim': 96, 'lr': 0.000496802361339361, 'lambda_val': 0.0015604142770877156, 'batch_size': 1031, 'optimizer': 'Adam'}.
2026-05-23 01:33:39,288 - experiment_functions - INFO - Early stopping at epoch 950. Best Metrics: (0.037561532099370076, 0.019672131147540985, 0.03251005142413723)
2026-05-23 01:33:39,670 - optuna.study.study - INFO - Trial 266 finished with values: [0.037561532099370076, 0.019672131147540985, 0.03251005142413723] and parameters: {'n_layers': 2, 'embedding_dim': 64, 'lr': 0.0006071804751429957, 'lambda_val': 0.0059187170891626, 'batch_size': 1031, 'optimizer': 'RMSprop'}.
2026-05-23 01:33:45,655 - experiment_functions - INFO - Early stopping at epoch 1750. Best Metrics: (0.03230351773226643, 0.01827868852459016, 0.028984766793407484)
2026-05-23 01:33:46,599 - optuna.study.study - INFO - Trial 267 finished with values: [0.03230351773226643, 0.01827868852459016, 0.028984766793407484] and parameters: {'n_layers': 1, 'embedding_dim': 256, 'lr': 0.00037298587418552697, 'lambda_val': 7.202525708659488e-05, 'batch_size': 1554, 'optimizer': 'RMSprop'}.
2026-05-23 01:33:55,484 - experiment_functions - INFO - Early stopping at epoch 3000. Best Metrics: (0.027703602140129253, 0.015901639344262294, 0.025558091995123124)
2026-05-23 01:33:55,569 - optuna.study.study - INFO - Trial 268 finished with values: [0.027703602140129253, 0.015901639344262294, 0.025558091995123124] and parameters: {'n_layers': 1, 'embedding_dim': 32, 'lr': 0.0006071804751429957, 'lambda_val': 2.2314988157211746e-06, 'batch_size': 2030, 'optimizer': 'RMSprop'}.
2026-05-23 01:33:59,838 - experiment_functions - INFO - Early stopping at epoch 1300. Best Metrics: (0.031135185910579694, 0.017950819672131146, 0.02769046901866239)
2026-05-23 01:33:59,919 - optuna.study.study - INFO - Trial 269 finished with values: [0.031135185910579694, 0.017950819672131146, 0.02769046901866239] and parameters: {'n_layers': 1, 'embedding_dim': 64, 'lr': 0.0006335857209731445, 'lambda_val': 0.0004602041010031341, 'batch_size': 3044, 'optimizer': 'Adam'}.
2026-05-23 01:34:02,189 - experiment_functions - INFO - Early stopping at epoch 500. Best Metrics: (0.002535009798160871, 0.0021311475409836068, 0.003097255145600907)
2026-05-23 01:34:02,277 - optuna.study.study - INFO - Trial 270 finished with values: [0.002535009798160871, 0.0021311475409836068, 0.003097255145600907] and parameters: {'n_layers': 3, 'embedding_dim': 96, 'lr': 0.0002386554512236704, 'lambda_val': 0.00016867595805103173, 'batch_size': 2130, 'optimizer': 'SGD'}.
2026-05-23 01:34:06,542 - experiment_functions - INFO - Early stopping at epoch 1300. Best Metrics: (0.03355504380922458, 0.01909836065573771, 0.02914368413538354)
2026-05-23 01:34:06,637 - optuna.study.study - INFO - Trial 271 finished with values: [0.03355504380922458, 0.01909836065573771, 0.02914368413538354] and parameters: {'n_layers': 1, 'embedding_dim': 96, 'lr': 0.0006071804751429957, 'lambda_val': 7.202525708659488e-05, 'batch_size': 2030, 'optimizer': 'RMSprop'}.
2026-05-23 01:34:10,775 - experiment_functions - INFO - Early stopping at epoch 1250. Best Metrics: (0.02678514688173635, 0.01614754098360656, 0.024704028841883396)
2026-05-23 01:34:12,231 - optuna.study.study - INFO - Trial 272 finished with values: [0.02678514688173635, 0.01614754098360656, 0.024704028841883396] and parameters: {'n_layers': 2, 'embedding_dim': 32, 'lr': 0.0006237069115447143, 'lambda_val': 1.150702232586112e-06, 'batch_size': 1749, 'optimizer': 'RMSprop'}.
2026-05-23 01:34:16,525 - experiment_functions - INFO - Early stopping at epoch 1350. Best Metrics: (0.002823152497851073, 0.0017213114754098362, 0.0024208029607770023)
2026-05-23 01:34:16,614 - optuna.study.study - INFO - Trial 273 finished with values: [0.002823152497851073, 0.0017213114754098362, 0.0024208029607770023] and parameters: {'n_layers': 1, 'embedding_dim': 96, 'lr': 1.4610697330829987e-05, 'lambda_val': 0.0033837644191650825, 'batch_size': 2030, 'optimizer': 'RMSprop'}.
2026-05-23 01:34:25,080 - experiment_functions - INFO - Early stopping at epoch 2950. Best Metrics: (0.03528320974801544, 0.021065573770491803, 0.03398088212963046)
2026-05-23 01:34:25,439 - optuna.study.study - INFO - Trial 274 finished with values: [0.03528320974801544, 0.021065573770491803, 0.03398088212963046] and parameters: {'n_layers': 1, 'embedding_dim': 64, 'lr': 0.0005346818701204757, 'lambda_val': 0.00012261737938750884, 'batch_size': 1088, 'optimizer': 'RMSprop'}.
2026-05-23 01:34:27,798 - experiment_functions - INFO - Early stopping at epoch 550. Best Metrics: (0.009538497831288028, 0.008032786885245903, 0.010729440803964362)
2026-05-23 01:34:27,899 - optuna.study.study - INFO - Trial 275 finished with values: [0.009538497831288028, 0.008032786885245903, 0.010729440803964362] and parameters: {'n_layers': 4, 'embedding_dim': 32, 'lr': 0.0054017846217753514, 'lambda_val': 1.150702232586112e-06, 'batch_size': 1031, 'optimizer': 'RMSprop'}.
2026-05-23 01:34:31,897 - experiment_functions - INFO - Early stopping at epoch 850. Best Metrics: (0.03772297033962733, 0.018934426229508198, 0.029864015344442815)
2026-05-23 01:34:33,462 - optuna.study.study - INFO - Trial 276 finished with values: [0.03772297033962733, 0.018934426229508198, 0.029864015344442815] and parameters: {'n_layers': 3, 'embedding_dim': 256, 'lr': 0.0006191306748157756, 'lambda_val': 0.0003594757486320111, 'batch_size': 1031, 'optimizer': 'Adam'}.
2026-05-23 01:34:37,655 - experiment_functions - INFO - Early stopping at epoch 1300. Best Metrics: (0.032628137868741226, 0.01819672131147541, 0.029810773404001192)
2026-05-23 01:34:38,270 - optuna.study.study - INFO - Trial 277 finished with values: [0.032628137868741226, 0.01819672131147541, 0.029810773404001192] and parameters: {'n_layers': 1, 'embedding_dim': 64, 'lr': 0.0006071804751429957, 'lambda_val': 0.003114911934260745, 'batch_size': 2030, 'optimizer': 'RMSprop'}.
2026-05-23 01:34:41,841 - experiment_functions - INFO - Early stopping at epoch 950. Best Metrics: (0.03541688212901874, 0.01918032786885246, 0.029455241442505036)
2026-05-23 01:34:41,940 - optuna.study.study - INFO - Trial 278 finished with values: [0.03541688212901874, 0.01918032786885246, 0.029455241442505036] and parameters: {'n_layers': 3, 'embedding_dim': 96, 'lr': 0.0006071804751429957, 'lambda_val': 0.0003594757486320111, 'batch_size': 1088, 'optimizer': 'Adam'}.
2026-05-23 01:34:44,021 - experiment_functions - INFO - Early stopping at epoch 500. Best Metrics: (0.0021629827915237957, 0.001475409836065574, 0.0020813523864195763)
2026-05-23 01:34:44,119 - optuna.study.study - INFO - Trial 279 finished with values: [0.0021629827915237957, 0.001475409836065574, 0.0020813523864195763] and parameters: {'n_layers': 2, 'embedding_dim': 96, 'lr': 0.0006237069115447143, 'lambda_val': 7.202525708659488e-05, 'batch_size': 1031, 'optimizer': 'SGD'}.
2026-05-23 01:34:55,513 - optuna.study.study - INFO - Trial 280 finished with values: [0.0028109785165250597, 0.0020491803278688526, 0.0026755326283467835] and parameters: {'n_layers': 1, 'embedding_dim': 64, 'lr': 1.884134747654167e-05, 'lambda_val': 0.00012261737938750884, 'batch_size': 2030, 'optimizer': 'RMSprop'}.
2026-05-23 01:35:00,392 - experiment_functions - INFO - Early stopping at epoch 1600. Best Metrics: (0.033995371697618224, 0.01959016393442623, 0.02864574988750729)
2026-05-23 01:35:00,477 - optuna.study.study - INFO - Trial 281 finished with values: [0.033995371697618224, 0.01959016393442623, 0.02864574988750729] and parameters: {'n_layers': 1, 'embedding_dim': 64, 'lr': 0.0006335857209731445, 'lambda_val': 1.150702232586112e-06, 'batch_size': 1032, 'optimizer': 'RMSprop'}.
2026-05-23 01:35:12,663 - optuna.study.study - INFO - Trial 282 finished with values: [0.009501394816356711, 0.007704918032786886, 0.010563454978508384] and parameters: {'n_layers': 1, 'embedding_dim': 96, 'lr': 0.00012479442362325468, 'lambda_val': 7.202525708659488e-05, 'batch_size': 2108, 'optimizer': 'RMSprop'}.
2026-05-23 01:35:16,528 - experiment_functions - INFO - Early stopping at epoch 1150. Best Metrics: (0.03328190656542488, 0.01860655737704918, 0.03077407310120677)
2026-05-23 01:35:16,844 - optuna.study.study - INFO - Trial 283 finished with values: [0.03328190656542488, 0.01860655737704918, 0.03077407310120677] and parameters: {'n_layers': 2, 'embedding_dim': 32, 'lr': 0.0006237069115447143, 'lambda_val': 0.0033461806696319725, 'batch_size': 1031, 'optimizer': 'RMSprop'}.
2026-05-23 01:35:24,978 - experiment_functions - INFO - Early stopping at epoch 2850. Best Metrics: (0.032561073912530214, 0.017540983606557377, 0.0273205047200069)
2026-05-23 01:35:25,476 - optuna.study.study - INFO - Trial 284 finished with values: [0.032561073912530214, 0.017540983606557377, 0.0273205047200069] and parameters: {'n_layers': 1, 'embedding_dim': 32, 'lr': 0.000496802361339361, 'lambda_val': 0.0009657244544246451, 'batch_size': 1861, 'optimizer': 'RMSprop'}.
2026-05-23 01:35:33,232 - experiment_functions - INFO - Early stopping at epoch 2500. Best Metrics: (0.04142112748218532, 0.02237704918032787, 0.03631133366668423)
2026-05-23 01:35:33,974 - optuna.study.study - INFO - Trial 285 finished with values: [0.04142112748218532, 0.02237704918032787, 0.03631133366668423] and parameters: {'n_layers': 2, 'embedding_dim': 96, 'lr': 0.00037298587418552697, 'lambda_val': 1.150702232586112e-06, 'batch_size': 1031, 'optimizer': 'Adam'}.
2026-05-23 01:35:36,888 - experiment_functions - INFO - Early stopping at epoch 650. Best Metrics: (0.025761973451301046, 0.015163934426229509, 0.024594223058383796)
2026-05-23 01:35:37,010 - optuna.study.study - INFO - Trial 286 finished with values: [0.025761973451301046, 0.015163934426229509, 0.024594223058383796] and parameters: {'n_layers': 2, 'embedding_dim': 32, 'lr': 0.0054017846217753514, 'lambda_val': 1.150702232586112e-06, 'batch_size': 542, 'optimizer': 'Adam'}.
2026-05-23 01:35:41,566 - experiment_functions - INFO - Early stopping at epoch 1450. Best Metrics: (0.03490756838504119, 0.018360655737704918, 0.02936919881339444)
2026-05-23 01:35:41,934 - optuna.study.study - INFO - Trial 287 finished with values: [0.03490756838504119, 0.018360655737704918, 0.02936919881339444] and parameters: {'n_layers': 1, 'embedding_dim': 96, 'lr': 0.0006071804751429957, 'lambda_val': 7.202525708659488e-05, 'batch_size': 1554, 'optimizer': 'RMSprop'}.
2026-05-23 01:35:45,480 - experiment_functions - INFO - Early stopping at epoch 1000. Best Metrics: (0.04202223569969986, 0.020655737704918034, 0.031748356333573514)
2026-05-23 01:35:45,567 - optuna.study.study - INFO - Trial 288 finished with values: [0.04202223569969986, 0.020655737704918034, 0.031748356333573514] and parameters: {'n_layers': 2, 'embedding_dim': 64, 'lr': 0.0006071804751429957, 'lambda_val': 0.00012261737938750884, 'batch_size': 2030, 'optimizer': 'RMSprop'}.
2026-05-23 01:35:48,551 - experiment_functions - INFO - Early stopping at epoch 800. Best Metrics: (0.0328876117443622, 0.017950819672131146, 0.026892353507101348)
2026-05-23 01:35:48,624 - optuna.study.study - INFO - Trial 289 finished with values: [0.0328876117443622, 0.017950819672131146, 0.026892353507101348] and parameters: {'n_layers': 2, 'embedding_dim': 96, 'lr': 0.0006071804751429957, 'lambda_val': 1.770202893112185e-05, 'batch_size': 2030, 'optimizer': 'RMSprop'}.
2026-05-23 01:35:57,009 - experiment_functions - INFO - Early stopping at epoch 2150. Best Metrics: (0.028550719357569317, 0.015245901639344264, 0.024140638579838537)
2026-05-23 01:35:57,109 - optuna.study.study - INFO - Trial 290 finished with values: [0.028550719357569317, 0.015245901639344264, 0.024140638579838537] and parameters: {'n_layers': 2, 'embedding_dim': 32, 'lr': 0.0002386554512236704, 'lambda_val': 0.00012261737938750884, 'batch_size': 3064, 'optimizer': 'Adam'}.
2026-05-23 01:35:59,519 - experiment_functions - INFO - Early stopping at epoch 550. Best Metrics: (0.026675973805756453, 0.014836065573770494, 0.02263825963923752)
2026-05-23 01:35:59,613 - optuna.study.study - INFO - Trial 291 finished with values: [0.026675973805756453, 0.014836065573770494, 0.02263825963923752] and parameters: {'n_layers': 3, 'embedding_dim': 32, 'lr': 0.0054017846217753514, 'lambda_val': 1.150702232586112e-06, 'batch_size': 3064, 'optimizer': 'Adam'}.
2026-05-23 01:36:08,183 - experiment_functions - INFO - Early stopping at epoch 3050. Best Metrics: (0.002758771202431276, 0.001967213114754099, 0.002451297088179713)
2026-05-23 01:36:08,280 - optuna.study.study - INFO - Trial 292 finished with values: [0.002758771202431276, 0.001967213114754099, 0.002451297088179713] and parameters: {'n_layers': 2, 'embedding_dim': 32, 'lr': 1.3324408486550127e-05, 'lambda_val': 1.150702232586112e-06, 'batch_size': 1031, 'optimizer': 'RMSprop'}.
2026-05-23 01:36:16,421 - experiment_functions - INFO - Early stopping at epoch 2750. Best Metrics: (0.03139034200630948, 0.016885245901639347, 0.02503957893474374)
2026-05-23 01:36:16,504 - optuna.study.study - INFO - Trial 293 finished with values: [0.03139034200630948, 0.016885245901639347, 0.02503957893474374] and parameters: {'n_layers': 1, 'embedding_dim': 32, 'lr': 0.000496802361339361, 'lambda_val': 7.202525708659488e-05, 'batch_size': 3085, 'optimizer': 'RMSprop'}.
2026-05-23 01:36:20,220 - experiment_functions - INFO - Early stopping at epoch 1000. Best Metrics: (0.035629530094098874, 0.019918032786885247, 0.03310153116177193)
2026-05-23 01:36:20,302 - optuna.study.study - INFO - Trial 294 finished with values: [0.035629530094098874, 0.019918032786885247, 0.03310153116177193] and parameters: {'n_layers': 1, 'embedding_dim': 256, 'lr': 0.0005346818701204757, 'lambda_val': 1.150702232586112e-06, 'batch_size': 1880, 'optimizer': 'RMSprop'}.
2026-05-23 01:36:22,581 - experiment_functions - INFO - Early stopping at epoch 550. Best Metrics: (0.026602199269708842, 0.015327868852459018, 0.02335553439613503)
2026-05-23 01:36:22,728 - optuna.study.study - INFO - Trial 295 finished with values: [0.026602199269708842, 0.015327868852459018, 0.02335553439613503] and parameters: {'n_layers': 2, 'embedding_dim': 96, 'lr': 0.0054017846217753514, 'lambda_val': 1.150702232586112e-06, 'batch_size': 1031, 'optimizer': 'Adam'}.
2026-05-23 01:36:25,175 - experiment_functions - INFO - Early stopping at epoch 600. Best Metrics: (0.030985391694627926, 0.016229508196721313, 0.02738699032261854)
2026-05-23 01:36:26,322 - optuna.study.study - INFO - Trial 296 finished with values: [0.030985391694627926, 0.016229508196721313, 0.02738699032261854] and parameters: {'n_layers': 2, 'embedding_dim': 32, 'lr': 0.0054017846217753514, 'lambda_val': 1.150702232586112e-06, 'batch_size': 542, 'optimizer': 'Adam'}.
2026-05-23 01:36:37,801 - optuna.study.study - INFO - Trial 297 finished with values: [0.03732968628627001, 0.02081967213114754, 0.031004607986395736] and parameters: {'n_layers': 2, 'embedding_dim': 32, 'lr': 0.000496802361339361, 'lambda_val': 1.150702232586112e-06, 'batch_size': 542, 'optimizer': 'Adam'}.
2026-05-23 01:36:43,211 - experiment_functions - INFO - Early stopping at epoch 1750. Best Metrics: (0.02994098176840438, 0.01877049180327869, 0.02631018782040326)
2026-05-23 01:36:43,306 - optuna.study.study - INFO - Trial 298 finished with values: [0.02994098176840438, 0.01877049180327869, 0.02631018782040326] and parameters: {'n_layers': 1, 'embedding_dim': 96, 'lr': 0.0006237069115447143, 'lambda_val': 0.004280757702424935, 'batch_size': 1031, 'optimizer': 'RMSprop'}.
2026-05-23 01:36:45,705 - experiment_functions - INFO - Early stopping at epoch 550. Best Metrics: (0.029653648765109224, 0.01655737704918033, 0.025010739869503067)
