2026-05-23 02:28:44,067 - optuna.study.study - INFO - Trial 261 finished with values: [0.03136311985575232, 0.01819672131147541, 0.02605940871421459] and parameters: {'n_layers': 3, 'embedding_dim': 64, 'lr': 0.00023663705269380512, 'lambda_val': 8.858691676718628e-05, 'batch_size': 664, 'optimizer': 'Adam'}.
2026-05-23 02:28:46,132 - experiment_functions - INFO - Early stopping at epoch 500. Best Metrics: (0.0012508278467155086, 0.0013114754098360656, 0.001805311290480491)
2026-05-23 02:28:46,216 - optuna.study.study - INFO - Trial 262 finished with values: [0.0012508278467155086, 0.0013114754098360656, 0.001805311290480491] and parameters: {'n_layers': 1, 'embedding_dim': 128, 'lr': 0.0010193114088728706, 'lambda_val': 5.787806000886398e-06, 'batch_size': 1594, 'optimizer': 'SGD'}.
2026-05-23 02:28:56,312 - experiment_functions - INFO - Early stopping at epoch 3300. Best Metrics: (0.004760406187565356, 0.0036885245901639345, 0.00498650577150322)
2026-05-23 02:28:56,539 - optuna.study.study - INFO - Trial 263 finished with values: [0.004760406187565356, 0.0036885245901639345, 0.00498650577150322] and parameters: {'n_layers': 3, 'embedding_dim': 32, 'lr': 5.1022303039891616e-05, 'lambda_val': 0.0015620530681847225, 'batch_size': 1698, 'optimizer': 'Adam'}.
2026-05-23 02:29:01,548 - experiment_functions - INFO - Early stopping at epoch 1450. Best Metrics: (0.02298150984959149, 0.015491803278688524, 0.020514454202929754)
2026-05-23 02:29:01,728 - optuna.study.study - INFO - Trial 264 finished with values: [0.02298150984959149, 0.015491803278688524, 0.020514454202929754] and parameters: {'n_layers': 4, 'embedding_dim': 32, 'lr': 0.0004474461075792833, 'lambda_val': 8.858691676718628e-05, 'batch_size': 2233, 'optimizer': 'Adam'}.
2026-05-23 02:29:05,244 - experiment_functions - INFO - Early stopping at epoch 900. Best Metrics: (0.010423210683327635, 0.006229508196721313, 0.008554426348504502)
2026-05-23 02:29:05,383 - optuna.study.study - INFO - Trial 265 finished with values: [0.010423210683327635, 0.006229508196721313, 0.008554426348504502] and parameters: {'n_layers': 4, 'embedding_dim': 96, 'lr': 0.018677862950507756, 'lambda_val': 0.0005428353674897035, 'batch_size': 1209, 'optimizer': 'Adam'}.
2026-05-23 02:29:07,981 - experiment_functions - INFO - Early stopping at epoch 600. Best Metrics: (0.027716299784618724, 0.015491803278688524, 0.023830628596211195)
2026-05-23 02:29:08,056 - optuna.study.study - INFO - Trial 266 finished with values: [0.027716299784618724, 0.015491803278688524, 0.023830628596211195] and parameters: {'n_layers': 1, 'embedding_dim': 96, 'lr': 0.0020135118692985172, 'lambda_val': 8.858691676718628e-05, 'batch_size': 2886, 'optimizer': 'RMSprop'}.
2026-05-23 02:29:12,224 - experiment_functions - INFO - Early stopping at epoch 1300. Best Metrics: (0.031720172692625566, 0.018360655737704918, 0.02744698743594428)
2026-05-23 02:29:12,751 - optuna.study.study - INFO - Trial 267 finished with values: [0.031720172692625566, 0.018360655737704918, 0.02744698743594428] and parameters: {'n_layers': 1, 'embedding_dim': 64, 'lr': 0.0010193114088728706, 'lambda_val': 8.858691676718628e-05, 'batch_size': 664, 'optimizer': 'RMSprop'}.
2026-05-23 02:29:14,946 - experiment_functions - INFO - Early stopping at epoch 500. Best Metrics: (0.001046787440092717, 0.0013934426229508198, 0.0019317559216098683)
2026-05-23 02:29:15,042 - optuna.study.study - INFO - Trial 268 finished with values: [0.001046787440092717, 0.0013934426229508198, 0.0019317559216098683] and parameters: {'n_layers': 3, 'embedding_dim': 64, 'lr': 0.0010193114088728706, 'lambda_val': 8.858691676718628e-05, 'batch_size': 966, 'optimizer': 'SGD'}.
2026-05-23 02:29:17,814 - experiment_functions - INFO - Early stopping at epoch 700. Best Metrics: (0.02414082270694817, 0.015409836065573772, 0.02073385970602548)
2026-05-23 02:29:17,892 - optuna.study.study - INFO - Trial 269 finished with values: [0.02414082270694817, 0.015409836065573772, 0.02073385970602548] and parameters: {'n_layers': 1, 'embedding_dim': 128, 'lr': 0.001529501184394163, 'lambda_val': 0.01576185866290203, 'batch_size': 3132, 'optimizer': 'Adam'}.
2026-05-23 02:29:27,141 - experiment_functions - INFO - Early stopping at epoch 3100. Best Metrics: (0.04009513956487194, 0.02204918032786885, 0.03244525988188831)
2026-05-23 02:29:27,549 - optuna.study.study - INFO - Trial 270 finished with values: [0.04009513956487194, 0.02204918032786885, 0.03244525988188831] and parameters: {'n_layers': 3, 'embedding_dim': 32, 'lr': 0.0003432142400602671, 'lambda_val': 2.6649531566148095e-05, 'batch_size': 664, 'optimizer': 'Adam'}.
2026-05-23 02:29:34,770 - experiment_functions - INFO - Early stopping at epoch 2350. Best Metrics: (0.035553943612051275, 0.02057377049180328, 0.032860857253512336)
2026-05-23 02:29:34,972 - optuna.study.study - INFO - Trial 271 finished with values: [0.035553943612051275, 0.02057377049180328, 0.032860857253512336] and parameters: {'n_layers': 1, 'embedding_dim': 128, 'lr': 0.0003432142400602671, 'lambda_val': 2.072742692273282e-06, 'batch_size': 2477, 'optimizer': 'RMSprop'}.
2026-05-23 02:29:39,047 - experiment_functions - INFO - Early stopping at epoch 600. Best Metrics: (0.029849866938206373, 0.017950819672131146, 0.0270952199335683)
2026-05-23 02:29:40,351 - optuna.study.study - INFO - Trial 272 finished with values: [0.029849866938206373, 0.017950819672131146, 0.0270952199335683] and parameters: {'n_layers': 4, 'embedding_dim': 128, 'lr': 0.0020135118692985172, 'lambda_val': 8.858691676718628e-05, 'batch_size': 664, 'optimizer': 'Adam'}.
2026-05-23 02:29:53,114 - optuna.study.study - INFO - Trial 273 finished with values: [0.028460241209196286, 0.01819672131147541, 0.024496109815354713] and parameters: {'n_layers': 1, 'embedding_dim': 64, 'lr': 0.0005120769952376107, 'lambda_val': 8.858691676718628e-05, 'batch_size': 664, 'optimizer': 'RMSprop'}.
2026-05-23 02:29:55,662 - experiment_functions - INFO - Early stopping at epoch 550. Best Metrics: (0.010077262267361374, 0.007950819672131147, 0.010479469507090099)
2026-05-23 02:29:57,113 - optuna.study.study - INFO - Trial 274 finished with values: [0.010077262267361374, 0.007950819672131147, 0.010479469507090099] and parameters: {'n_layers': 3, 'embedding_dim': 128, 'lr': 0.037259102076962786, 'lambda_val': 0.00019071736774909856, 'batch_size': 1594, 'optimizer': 'Adam'}.
2026-05-23 02:30:02,522 - experiment_functions - INFO - Early stopping at epoch 1750. Best Metrics: (0.021670938581027994, 0.013196721311475411, 0.017978242838224856)
2026-05-23 02:30:03,213 - optuna.study.study - INFO - Trial 275 finished with values: [0.021670938581027994, 0.013196721311475411, 0.017978242838224856] and parameters: {'n_layers': 1, 'embedding_dim': 64, 'lr': 0.03201959441406591, 'lambda_val': 0.003734260471985348, 'batch_size': 664, 'optimizer': 'Adam'}.
2026-05-23 02:30:06,425 - experiment_functions - INFO - Early stopping at epoch 850. Best Metrics: (0.03210872572400162, 0.019344262295081967, 0.02708679589921129)
2026-05-23 02:30:06,549 - optuna.study.study - INFO - Trial 276 finished with values: [0.03210872572400162, 0.019344262295081967, 0.02708679589921129] and parameters: {'n_layers': 1, 'embedding_dim': 96, 'lr': 0.0009933779564808808, 'lambda_val': 1.8287336384981437e-06, 'batch_size': 3213, 'optimizer': 'RMSprop'}.
2026-05-23 02:30:09,351 - experiment_functions - INFO - Early stopping at epoch 750. Best Metrics: (0.029805903085434658, 0.01680327868852459, 0.02507199936498172)
2026-05-23 02:30:09,566 - optuna.study.study - INFO - Trial 277 finished with values: [0.029805903085434658, 0.01680327868852459, 0.02507199936498172] and parameters: {'n_layers': 1, 'embedding_dim': 96, 'lr': 0.0011164422280390935, 'lambda_val': 8.095491138274642e-05, 'batch_size': 3441, 'optimizer': 'RMSprop'}.
2026-05-23 02:30:15,038 - experiment_functions - INFO - Early stopping at epoch 1700. Best Metrics: (0.029061649969947142, 0.018688524590163937, 0.02533780031112808)
2026-05-23 02:30:15,146 - optuna.study.study - INFO - Trial 278 finished with values: [0.029061649969947142, 0.018688524590163937, 0.02533780031112808] and parameters: {'n_layers': 1, 'embedding_dim': 64, 'lr': 0.0004474461075792833, 'lambda_val': 0.01265136057274937, 'batch_size': 2886, 'optimizer': 'Adam'}.
2026-05-23 02:30:18,085 - experiment_functions - INFO - Early stopping at epoch 750. Best Metrics: (0.02636935994572649, 0.015000000000000001, 0.02025729329546211)
2026-05-23 02:30:19,287 - optuna.study.study - INFO - Trial 279 finished with values: [0.02636935994572649, 0.015000000000000001, 0.02025729329546211] and parameters: {'n_layers': 3, 'embedding_dim': 64, 'lr': 0.0010193114088728706, 'lambda_val': 0.003734260471985348, 'batch_size': 2971, 'optimizer': 'Adam'}.
2026-05-23 02:30:21,540 - experiment_functions - INFO - Early stopping at epoch 500. Best Metrics: (0.002414291698885157, 0.0013114754098360656, 0.001884436999461525)
2026-05-23 02:30:21,610 - optuna.study.study - INFO - Trial 280 finished with values: [0.002414291698885157, 0.0013114754098360656, 0.001884436999461525] and parameters: {'n_layers': 3, 'embedding_dim': 64, 'lr': 0.0020135118692985172, 'lambda_val': 9.936858221156379e-06, 'batch_size': 1698, 'optimizer': 'SGD'}.
2026-05-23 02:30:28,414 - experiment_functions - INFO - Early stopping at epoch 1200. Best Metrics: (0.031224793221684945, 0.017950819672131146, 0.026928873235165206)
2026-05-23 02:30:28,761 - optuna.study.study - INFO - Trial 281 finished with values: [0.031224793221684945, 0.017950819672131146, 0.026928873235165206] and parameters: {'n_layers': 1, 'embedding_dim': 64, 'lr': 0.0010682175784251788, 'lambda_val': 2.4205981056103473e-06, 'batch_size': 1698, 'optimizer': 'Adam'}.
2026-05-23 02:30:40,470 - experiment_functions - INFO - Early stopping at epoch 2150. Best Metrics: (0.03144189625619039, 0.01737704918032787, 0.02654760338857297)
2026-05-23 02:30:40,560 - optuna.study.study - INFO - Trial 282 finished with values: [0.03144189625619039, 0.01737704918032787, 0.02654760338857297] and parameters: {'n_layers': 1, 'embedding_dim': 64, 'lr': 0.0004474461075792833, 'lambda_val': 0.0015620530681847225, 'batch_size': 1373, 'optimizer': 'RMSprop'}.
2026-05-23 02:30:50,056 - experiment_functions - INFO - Early stopping at epoch 3150. Best Metrics: (0.03562480906620589, 0.02065573770491803, 0.03170904181153086)
2026-05-23 02:30:50,537 - optuna.study.study - INFO - Trial 283 finished with values: [0.03562480906620589, 0.02065573770491803, 0.03170904181153086] and parameters: {'n_layers': 1, 'embedding_dim': 128, 'lr': 0.0004474461075792833, 'lambda_val': 0.0005428353674897035, 'batch_size': 2886, 'optimizer': 'Adam'}.
2026-05-23 02:30:53,084 - experiment_functions - INFO - Early stopping at epoch 600. Best Metrics: (0.032145059714149105, 0.018278688524590164, 0.028850558938850208)
2026-05-23 02:30:53,165 - optuna.study.study - INFO - Trial 284 finished with values: [0.032145059714149105, 0.018278688524590164, 0.028850558938850208] and parameters: {'n_layers': 1, 'embedding_dim': 256, 'lr': 0.0020135118692985172, 'lambda_val': 1.8731629011795012e-06, 'batch_size': 1698, 'optimizer': 'RMSprop'}.
2026-05-23 02:30:56,285 - experiment_functions - INFO - Early stopping at epoch 700. Best Metrics: (0.0203127495732792, 0.013196721311475411, 0.018025871640269035)
2026-05-23 02:30:57,137 - optuna.study.study - INFO - Trial 285 finished with values: [0.0203127495732792, 0.013196721311475411, 0.018025871640269035] and parameters: {'n_layers': 4, 'embedding_dim': 64, 'lr': 0.0010193114088728706, 'lambda_val': 8.858691676718628e-05, 'batch_size': 3977, 'optimizer': 'Adam'}.
2026-05-23 02:31:00,618 - experiment_functions - INFO - Early stopping at epoch 1000. Best Metrics: (0.02975184581032344, 0.017377049180327873, 0.026776397607185733)
2026-05-23 02:31:01,202 - optuna.study.study - INFO - Trial 286 finished with values: [0.02975184581032344, 0.017377049180327873, 0.026776397607185733] and parameters: {'n_layers': 1, 'embedding_dim': 128, 'lr': 0.0011164422280390935, 'lambda_val': 0.003734260471985348, 'batch_size': 1594, 'optimizer': 'Adam'}.
2026-05-23 02:31:04,023 - experiment_functions - INFO - Early stopping at epoch 700. Best Metrics: (0.023844451421999785, 0.015491803278688524, 0.021488559235390642)
2026-05-23 02:31:04,129 - optuna.study.study - INFO - Trial 287 finished with values: [0.023844451421999785, 0.015491803278688524, 0.021488559235390642] and parameters: {'n_layers': 3, 'embedding_dim': 64, 'lr': 0.0010193114088728706, 'lambda_val': 0.003734260471985348, 'batch_size': 3931, 'optimizer': 'Adam'}.
2026-05-23 02:31:08,515 - experiment_functions - INFO - Early stopping at epoch 1000. Best Metrics: (0.03753082663862527, 0.019672131147540985, 0.030515758495111903)
2026-05-23 02:31:08,604 - optuna.study.study - INFO - Trial 288 finished with values: [0.03753082663862527, 0.019672131147540985, 0.030515758495111903] and parameters: {'n_layers': 3, 'embedding_dim': 128, 'lr': 0.0004474461075792833, 'lambda_val': 0.003734260471985348, 'batch_size': 664, 'optimizer': 'Adam'}.
2026-05-23 02:31:11,690 - experiment_functions - INFO - Early stopping at epoch 850. Best Metrics: (0.027158810889087465, 0.017540983606557377, 0.025258320038361946)
2026-05-23 02:31:12,664 - optuna.study.study - INFO - Trial 289 finished with values: [0.027158810889087465, 0.017540983606557377, 0.025258320038361946] and parameters: {'n_layers': 1, 'embedding_dim': 96, 'lr': 0.0009933779564808808, 'lambda_val': 0.0005428353674897035, 'batch_size': 3132, 'optimizer': 'RMSprop'}.
2026-05-23 02:31:17,784 - experiment_functions - INFO - Early stopping at epoch 1550. Best Metrics: (0.029102784097742786, 0.017377049180327873, 0.028167569915726585)
2026-05-23 02:31:18,343 - optuna.study.study - INFO - Trial 290 finished with values: [0.029102784097742786, 0.017377049180327873, 0.028167569915726585] and parameters: {'n_layers': 1, 'embedding_dim': 96, 'lr': 0.0004474461075792833, 'lambda_val': 0.0003977734214389728, 'batch_size': 3213, 'optimizer': 'Adam'}.
2026-05-23 02:31:23,619 - experiment_functions - INFO - Early stopping at epoch 750. Best Metrics: (0.0260824517983594, 0.01581967213114754, 0.02192907178577896)
2026-05-23 02:31:23,836 - optuna.study.study - INFO - Trial 291 finished with values: [0.0260824517983594, 0.01581967213114754, 0.02192907178577896] and parameters: {'n_layers': 4, 'embedding_dim': 96, 'lr': 0.0004474461075792833, 'lambda_val': 0.0015620530681847225, 'batch_size': 1373, 'optimizer': 'RMSprop'}.
2026-05-23 02:31:27,255 - experiment_functions - INFO - Early stopping at epoch 500. Best Metrics: (0.0016395652258144279, 0.0014754098360655738, 0.001544480550587997)
2026-05-23 02:31:27,448 - optuna.study.study - INFO - Trial 292 finished with values: [0.0016395652258144279, 0.0014754098360655738, 0.001544480550587997] and parameters: {'n_layers': 1, 'embedding_dim': 96, 'lr': 0.0004474461075792833, 'lambda_val': 0.0005428353674897035, 'batch_size': 3213, 'optimizer': 'SGD'}.
2026-05-23 02:31:32,873 - experiment_functions - INFO - Early stopping at epoch 1100. Best Metrics: (0.03317942193839048, 0.018852459016393444, 0.030636483351900022)
2026-05-23 02:31:33,829 - optuna.study.study - INFO - Trial 293 finished with values: [0.03317942193839048, 0.018852459016393444, 0.030636483351900022] and parameters: {'n_layers': 3, 'embedding_dim': 64, 'lr': 0.0005120769952376107, 'lambda_val': 8.858691676718628e-05, 'batch_size': 2119, 'optimizer': 'Adam'}.
2026-05-23 02:31:37,818 - experiment_functions - INFO - Early stopping at epoch 600. Best Metrics: (0.027635486440741618, 0.016229508196721313, 0.023697036810611867)
2026-05-23 02:31:38,172 - optuna.study.study - INFO - Trial 294 finished with values: [0.027635486440741618, 0.016229508196721313, 0.023697036810611867] and parameters: {'n_layers': 1, 'embedding_dim': 128, 'lr': 0.0020135118692985172, 'lambda_val': 8.858691676718628e-05, 'batch_size': 2477, 'optimizer': 'RMSprop'}.
2026-05-23 02:31:42,324 - experiment_functions - INFO - Early stopping at epoch 950. Best Metrics: (0.03239554888123384, 0.020081967213114754, 0.028677841674413045)
2026-05-23 02:31:42,403 - optuna.study.study - INFO - Trial 295 finished with values: [0.03239554888123384, 0.020081967213114754, 0.028677841674413045] and parameters: {'n_layers': 1, 'embedding_dim': 64, 'lr': 0.0010193114088728706, 'lambda_val': 0.01576185866290203, 'batch_size': 664, 'optimizer': 'RMSprop'}.
2026-05-23 02:31:47,354 - experiment_functions - INFO - Early stopping at epoch 1500. Best Metrics: (0.03538121046254999, 0.01942622950819672, 0.02939871095543579)
2026-05-23 02:31:47,448 - optuna.study.study - INFO - Trial 296 finished with values: [0.03538121046254999, 0.01942622950819672, 0.02939871095543579] and parameters: {'n_layers': 1, 'embedding_dim': 96, 'lr': 0.0004474461075792833, 'lambda_val': 0.0003977734214389728, 'batch_size': 3213, 'optimizer': 'RMSprop'}.
2026-05-23 02:31:52,827 - experiment_functions - INFO - Early stopping at epoch 1650. Best Metrics: (0.035470448243654584, 0.018442622950819672, 0.02831553393895481)
2026-05-23 02:31:53,554 - optuna.study.study - INFO - Trial 297 finished with values: [0.035470448243654584, 0.018442622950819672, 0.02831553393895481] and parameters: {'n_layers': 1, 'embedding_dim': 64, 'lr': 0.0010193114088728706, 'lambda_val': 8.858691676718628e-05, 'batch_size': 664, 'optimizer': 'Adam'}.
2026-05-23 02:31:55,967 - experiment_functions - INFO - Early stopping at epoch 550. Best Metrics: (0.02311396279748532, 0.015163934426229509, 0.022504635698818564)
2026-05-23 02:31:56,065 - optuna.study.study - INFO - Trial 298 finished with values: [0.02311396279748532, 0.015163934426229509, 0.022504635698818564] and parameters: {'n_layers': 3, 'embedding_dim': 64, 'lr': 0.001529501184394163, 'lambda_val': 8.858691676718628e-05, 'batch_size': 4096, 'optimizer': 'RMSprop'}.
2026-05-23 02:31:58,870 - experiment_functions - INFO - Early stopping at epoch 700. Best Metrics: (0.03557737354114955, 0.020327868852459016, 0.029412579603489315)
2026-05-23 02:31:58,953 - optuna.study.study - INFO - Trial 299 finished with values: [0.03557737354114955, 0.020327868852459016, 0.029412579603489315] and parameters: {'n_layers': 1, 'embedding_dim': 96, 'lr': 0.001529501184394163, 'lambda_val': 1.6012413972032166e-05, 'batch_size': 664, 'optimizer': 'RMSprop'}.
2026-05-23 02:31:58,968 - root - INFO - Selected Trial 134 based on Max NDCG: 0.0366
2026-05-23 02:31:58,968 - root - INFO - Associated Recall: 0.0433
2026-05-23 02:31:58,968 - experiment_functions - INFO - Training the best model ... for e_100K_1c1dcs_strict_rand5
2026-05-23 02:32:01,453 - experiment_functions - INFO - Early stopping at epoch 950. Best Metrics: (0.032769954890933845, 0.018934426229508194, 0.02913704263493264)
2026-05-23 02:32:01,550 - root - INFO -   ** Getting the trainable edges:
2026-05-23 02:32:01,554 - helper_functions - INFO -      Number of nodes: 535
2026-05-23 02:32:01,554 - helper_functions - INFO -      Ratio: 0.05177085349332301
2026-05-23 02:32:01,554 - helper_functions - INFO -      Number of unique users: 303
2026-05-23 02:32:01,554 - helper_functions - INFO -      Number of unique items: 232
2026-05-23 02:32:01,554 - helper_functions - INFO -      Total dominant set edge: 81241
2026-05-23 02:32:01,554 - helper_functions - INFO -      Trainable edges: 64992.8
2026-05-23 02:32:01,564 - root - INFO -   **** Getting 81241 dominant set edges
2026-05-23 02:32:01,993 - optuna.storages._rdb.storage - INFO - A new study created in RDB with name: Study_e_100K_1c1dcs
2026-05-23 02:32:04,282 - experiment_functions - INFO - Early stopping at epoch 500. Best Metrics: (0.0021789929217358958, 0.0019672131147540984, 0.0020640445384369206)
2026-05-23 02:32:04,426 - optuna.study.study - INFO - Trial 0 finished with values: [0.0021789929217358958, 0.0019672131147540984, 0.0020640445384369206] and parameters: {'n_layers': 1, 'embedding_dim': 128, 'lr': 1.7695524916367408e-05, 'lambda_val': 5.315424178965949e-06, 'batch_size': 2792, 'optimizer': 'SGD'}.
2026-05-23 02:32:07,267 - experiment_functions - INFO - Early stopping at epoch 500. Best Metrics: (0.017474410826661138, 0.007622950819672132, 0.012297507401009116)
2026-05-23 02:32:07,376 - optuna.study.study - INFO - Trial 1 finished with values: [0.017474410826661138, 0.007622950819672132, 0.012297507401009116] and parameters: {'n_layers': 2, 'embedding_dim': 128, 'lr': 0.07651787137009443, 'lambda_val': 5.206945836303924e-05, 'batch_size': 2121, 'optimizer': 'RMSprop'}.
2026-05-23 02:32:10,486 - experiment_functions - INFO - Early stopping at epoch 500. Best Metrics: (0.003198308962473371, 0.001639344262295082, 0.0025774863624455756)
2026-05-23 02:32:10,562 - optuna.study.study - INFO - Trial 2 finished with values: [0.003198308962473371, 0.001639344262295082, 0.0025774863624455756] and parameters: {'n_layers': 2, 'embedding_dim': 256, 'lr': 1.3793237824968505e-05, 'lambda_val': 0.0064882006082458005, 'batch_size': 1708, 'optimizer': 'SGD'}.
2026-05-23 02:32:12,738 - experiment_functions - INFO - Early stopping at epoch 500. Best Metrics: (0.001660706560714027, 0.0011475409836065576, 0.001535998540298951)
2026-05-23 02:32:12,832 - optuna.study.study - INFO - Trial 3 finished with values: [0.001660706560714027, 0.0011475409836065576, 0.001535998540298951] and parameters: {'n_layers': 1, 'embedding_dim': 32, 'lr': 0.0002469829440016313, 'lambda_val': 3.929475659781769e-06, 'batch_size': 2891, 'optimizer': 'SGD'}.
2026-05-23 02:32:28,096 - experiment_functions - INFO - Early stopping at epoch 3550. Best Metrics: (0.03297225554822089, 0.015901639344262294, 0.027120465362638606)
