2026-05-23 06:23:23,528 - optuna.study.study - INFO - Trial 297 finished with values: [0.014515067830797342, 0.016639344262295085, 0.022147933079909605] and parameters: {'n_layers': 1, 'embedding_dim': 256, 'lr': 0.0007855341580113746, 'lambda_val': 1.2684111432161195e-05, 'batch_size': 3670, 'optimizer': 'Adam'}.
2026-05-23 06:23:26,352 - experiment_functions - INFO - Early stopping at epoch 750. Best Metrics: (0.0070122599297179015, 0.01016393442622951, 0.012023700805782307)
2026-05-23 06:23:26,437 - optuna.study.study - INFO - Trial 298 finished with values: [0.0070122599297179015, 0.01016393442622951, 0.012023700805782307] and parameters: {'n_layers': 1, 'embedding_dim': 128, 'lr': 0.017573434963982993, 'lambda_val': 1.1371570226930704e-05, 'batch_size': 3814, 'optimizer': 'Adam'}.
2026-05-23 06:23:28,963 - experiment_functions - INFO - Early stopping at epoch 650. Best Metrics: (0.01571831730067169, 0.015163934426229509, 0.019010054868198602)
2026-05-23 06:23:29,048 - optuna.study.study - INFO - Trial 299 finished with values: [0.01571831730067169, 0.015163934426229509, 0.019010054868198602] and parameters: {'n_layers': 1, 'embedding_dim': 128, 'lr': 0.0007855341580113746, 'lambda_val': 0.00018535716709622545, 'batch_size': 3482, 'optimizer': 'Adam'}.
2026-05-23 06:23:29,063 - root - INFO - Selected Trial 244 based on Max NDCG: 0.0289
2026-05-23 06:23:29,063 - root - INFO - Associated Recall: 0.0199
2026-05-23 06:23:29,063 - experiment_functions - INFO - Training the best model ... for e_100K_1c2dcs_strict
2026-05-23 06:23:36,385 - experiment_functions - INFO - Early stopping at epoch 3600. Best Metrics: (0.013054924827635312, 0.012295081967213115, 0.015888134129461672)
2026-05-23 06:23:36,482 - root - INFO -   **** Training e_100K_1c2dcs_strict_rand1
2026-05-23 06:23:36,485 - root - INFO -   **** Getting 10763/81200 random edges
2026-05-23 06:23:36,572 - optuna.storages._rdb.storage - INFO - A new study created in RDB with name: Study_e_100K_1c2dcs_strict_rand1
2026-05-23 06:23:39,887 - experiment_functions - INFO - Early stopping at epoch 950. Best Metrics: (0.010221988135533641, 0.009754098360655737, 0.012502956561162416)
2026-05-23 06:23:40,002 - optuna.study.study - INFO - Trial 0 finished with values: [0.010221988135533641, 0.009754098360655737, 0.012502956561162416] and parameters: {'n_layers': 1, 'embedding_dim': 256, 'lr': 0.08713770899067318, 'lambda_val': 3.3830863317497866e-05, 'batch_size': 756, 'optimizer': 'Adam'}.
2026-05-23 06:23:43,981 - experiment_functions - INFO - Early stopping at epoch 1550. Best Metrics: (0.014397395700711668, 0.008770491803278688, 0.01287202241622846)
2026-05-23 06:23:45,359 - optuna.study.study - INFO - Trial 1 finished with values: [0.014397395700711668, 0.008770491803278688, 0.01287202241622846] and parameters: {'n_layers': 2, 'embedding_dim': 32, 'lr': 0.04742649418610358, 'lambda_val': 1.0124028722173646e-06, 'batch_size': 752, 'optimizer': 'Adam'}.
2026-05-23 06:23:47,788 - experiment_functions - INFO - Early stopping at epoch 600. Best Metrics: (0.0269492996090699, 0.014918032786885246, 0.022879168790331233)
2026-05-23 06:23:47,869 - optuna.study.study - INFO - Trial 2 finished with values: [0.0269492996090699, 0.014918032786885246, 0.022879168790331233] and parameters: {'n_layers': 3, 'embedding_dim': 96, 'lr': 0.0022093258859188615, 'lambda_val': 2.0972763516315873e-06, 'batch_size': 3517, 'optimizer': 'Adam'}.
2026-05-23 06:23:50,587 - experiment_functions - INFO - Early stopping at epoch 650. Best Metrics: (0.008769427468825149, 0.006475409836065574, 0.009016802196022652)
2026-05-23 06:23:50,678 - optuna.study.study - INFO - Trial 3 finished with values: [0.008769427468825149, 0.006475409836065574, 0.009016802196022652] and parameters: {'n_layers': 2, 'embedding_dim': 96, 'lr': 0.012975464591494191, 'lambda_val': 0.015689490324302544, 'batch_size': 724, 'optimizer': 'Adam'}.
2026-05-23 06:23:55,161 - experiment_functions - INFO - Early stopping at epoch 1100. Best Metrics: (0.0560675170492547, 0.02352459016393443, 0.0399153073894421)
2026-05-23 06:23:55,435 - optuna.study.study - INFO - Trial 4 finished with values: [0.0560675170492547, 0.02352459016393443, 0.0399153073894421] and parameters: {'n_layers': 1, 'embedding_dim': 256, 'lr': 0.0008759436093290035, 'lambda_val': 4.470892478605119e-05, 'batch_size': 1555, 'optimizer': 'Adam'}.
2026-05-23 06:23:58,024 - experiment_functions - INFO - Early stopping at epoch 500. Best Metrics: (0.0017427027902289372, 0.0017213114754098362, 0.0017314001436399026)
2026-05-23 06:23:58,116 - optuna.study.study - INFO - Trial 5 finished with values: [0.0017427027902289372, 0.0017213114754098362, 0.0017314001436399026] and parameters: {'n_layers': 1, 'embedding_dim': 64, 'lr': 0.0012094272851054134, 'lambda_val': 0.043481245710212134, 'batch_size': 1625, 'optimizer': 'SGD'}.
2026-05-23 06:24:00,231 - experiment_functions - INFO - Early stopping at epoch 500. Best Metrics: (0.0015139480917096902, 0.001967213114754099, 0.002013683811039505)
2026-05-23 06:24:00,317 - optuna.study.study - INFO - Trial 6 finished with values: [0.0015139480917096902, 0.001967213114754099, 0.002013683811039505] and parameters: {'n_layers': 2, 'embedding_dim': 32, 'lr': 0.0053709514587043355, 'lambda_val': 0.0001228274865648324, 'batch_size': 3498, 'optimizer': 'SGD'}.
2026-05-23 06:24:03,018 - experiment_functions - INFO - Early stopping at epoch 500. Best Metrics: (0.0022254694261591022, 0.0013114754098360656, 0.001747113847838494)
2026-05-23 06:24:03,098 - optuna.study.study - INFO - Trial 7 finished with values: [0.0022254694261591022, 0.0013114754098360656, 0.001747113847838494] and parameters: {'n_layers': 3, 'embedding_dim': 256, 'lr': 2.608875920385181e-05, 'lambda_val': 7.127683526198682e-06, 'batch_size': 2227, 'optimizer': 'SGD'}.
2026-05-23 06:24:05,437 - experiment_functions - INFO - Early stopping at epoch 500. Best Metrics: (0.0021128432079258967, 0.0014754098360655738, 0.0019552676095294856)
2026-05-23 06:24:05,530 - optuna.study.study - INFO - Trial 8 finished with values: [0.0021128432079258967, 0.0014754098360655738, 0.0019552676095294856] and parameters: {'n_layers': 4, 'embedding_dim': 96, 'lr': 0.02624954209883817, 'lambda_val': 0.06041549920741527, 'batch_size': 1662, 'optimizer': 'SGD'}.
2026-05-23 06:24:07,688 - experiment_functions - INFO - Early stopping at epoch 500. Best Metrics: (0.0018855114291144118, 0.001967213114754099, 0.0024314513770039774)
2026-05-23 06:24:07,780 - optuna.study.study - INFO - Trial 9 finished with values: [0.0018855114291144118, 0.001967213114754099, 0.0024314513770039774] and parameters: {'n_layers': 2, 'embedding_dim': 32, 'lr': 0.0005525597591840595, 'lambda_val': 3.2328485230063465e-06, 'batch_size': 3814, 'optimizer': 'SGD'}.
2026-05-23 06:24:11,360 - experiment_functions - INFO - Early stopping at epoch 850. Best Metrics: (0.03450516987964908, 0.018278688524590164, 0.03083293695071606)
2026-05-23 06:24:11,707 - optuna.study.study - INFO - Trial 10 finished with values: [0.03450516987964908, 0.018278688524590164, 0.03083293695071606] and parameters: {'n_layers': 3, 'embedding_dim': 96, 'lr': 0.0006455056540536045, 'lambda_val': 2.1070395102311856e-06, 'batch_size': 3624, 'optimizer': 'Adam'}.
2026-05-23 06:24:26,920 - optuna.study.study - INFO - Trial 11 finished with values: [0.008810891589630398, 0.005, 0.007456811938040151] and parameters: {'n_layers': 2, 'embedding_dim': 256, 'lr': 4.2308586940121026e-05, 'lambda_val': 2.417797010199819e-05, 'batch_size': 3454, 'optimizer': 'Adam'}.
2026-05-23 06:24:34,728 - experiment_functions - INFO - Early stopping at epoch 550. Best Metrics: (0.04664540640112622, 0.023278688524590165, 0.03876625655076579)
2026-05-23 06:24:35,468 - optuna.study.study - INFO - Trial 12 finished with values: [0.04664540640112622, 0.023278688524590165, 0.03876625655076579] and parameters: {'n_layers': 1, 'embedding_dim': 256, 'lr': 0.006511379953096499, 'lambda_val': 6.689493347784772e-06, 'batch_size': 2546, 'optimizer': 'Adam'}.
2026-05-23 06:24:43,826 - experiment_functions - INFO - Early stopping at epoch 1000. Best Metrics: (0.010434772834209117, 0.005819672131147541, 0.008109768740761764)
2026-05-23 06:24:44,314 - optuna.study.study - INFO - Trial 13 finished with values: [0.010434772834209117, 0.005819672131147541, 0.008109768740761764] and parameters: {'n_layers': 4, 'embedding_dim': 64, 'lr': 0.016320210842073777, 'lambda_val': 3.6543758813358244e-05, 'batch_size': 2109, 'optimizer': 'Adam'}.
2026-05-23 06:24:57,127 - optuna.study.study - INFO - Trial 14 finished with values: [0.031083741662878698, 0.018852459016393444, 0.02893945712347036] and parameters: {'n_layers': 4, 'embedding_dim': 64, 'lr': 0.00011688866907532978, 'lambda_val': 0.006084767092372325, 'batch_size': 630, 'optimizer': 'RMSprop'}.
2026-05-23 06:25:00,401 - experiment_functions - INFO - Early stopping at epoch 1000. Best Metrics: (0.04639907467425543, 0.02459016393442623, 0.03897616020850204)
2026-05-23 06:25:00,534 - optuna.study.study - INFO - Trial 15 finished with values: [0.04639907467425543, 0.02459016393442623, 0.03897616020850204] and parameters: {'n_layers': 3, 'embedding_dim': 96, 'lr': 0.000664690953252874, 'lambda_val': 0.0018827383963552864, 'batch_size': 642, 'optimizer': 'Adam'}.
2026-05-23 06:25:05,248 - experiment_functions - INFO - Early stopping at epoch 900. Best Metrics: (0.033695300171035725, 0.019672131147540985, 0.030209212450927808)
2026-05-23 06:25:05,331 - optuna.study.study - INFO - Trial 16 finished with values: [0.033695300171035725, 0.019672131147540985, 0.030209212450927808] and parameters: {'n_layers': 3, 'embedding_dim': 256, 'lr': 0.0002779300422306739, 'lambda_val': 1.3238653697855508e-06, 'batch_size': 3340, 'optimizer': 'RMSprop'}.
2026-05-23 06:25:08,700 - experiment_functions - INFO - Early stopping at epoch 900. Best Metrics: (0.002752074649824663, 0.0017213114754098362, 0.00259202764502187)
2026-05-23 06:25:08,786 - optuna.study.study - INFO - Trial 17 finished with values: [0.002752074649824663, 0.0017213114754098362, 0.00259202764502187] and parameters: {'n_layers': 2, 'embedding_dim': 256, 'lr': 0.07662251264232535, 'lambda_val': 2.1261877304192134e-06, 'batch_size': 2094, 'optimizer': 'SGD'}.
2026-05-23 06:25:11,086 - experiment_functions - INFO - Early stopping at epoch 500. Best Metrics: (0.001818779371457507, 0.0018852459016393446, 0.0021648313171321746)
2026-05-23 06:25:11,165 - optuna.study.study - INFO - Trial 18 finished with values: [0.001818779371457507, 0.0018852459016393446, 0.0021648313171321746] and parameters: {'n_layers': 3, 'embedding_dim': 32, 'lr': 0.0004413321029520665, 'lambda_val': 3.7214433277682794e-06, 'batch_size': 1381, 'optimizer': 'SGD'}.
2026-05-23 06:25:13,427 - experiment_functions - INFO - Early stopping at epoch 500. Best Metrics: (0.002677861165222252, 0.001639344262295082, 0.00249816229176249)
2026-05-23 06:25:13,520 - optuna.study.study - INFO - Trial 19 finished with values: [0.002677861165222252, 0.001639344262295082, 0.00249816229176249] and parameters: {'n_layers': 2, 'embedding_dim': 64, 'lr': 0.0001681912395064878, 'lambda_val': 0.045648551437508594, 'batch_size': 1700, 'optimizer': 'SGD'}.
2026-05-23 06:25:18,219 - experiment_functions - INFO - Early stopping at epoch 1400. Best Metrics: (0.01619371405299064, 0.009098360655737705, 0.01284814657255387)
2026-05-23 06:25:18,314 - optuna.study.study - INFO - Trial 20 finished with values: [0.01619371405299064, 0.009098360655737705, 0.01284814657255387] and parameters: {'n_layers': 3, 'embedding_dim': 32, 'lr': 0.05409487293042758, 'lambda_val': 0.0010960072481100915, 'batch_size': 2659, 'optimizer': 'Adam'}.
2026-05-23 06:25:20,789 - experiment_functions - INFO - Early stopping at epoch 500. Best Metrics: (0.0014276385220142105, 0.0009836065573770494, 0.0013091018568795675)
2026-05-23 06:25:20,883 - optuna.study.study - INFO - Trial 21 finished with values: [0.0014276385220142105, 0.0009836065573770494, 0.0013091018568795675] and parameters: {'n_layers': 4, 'embedding_dim': 64, 'lr': 0.0006625622989998571, 'lambda_val': 1.2655951890552534e-05, 'batch_size': 2824, 'optimizer': 'SGD'}.
2026-05-23 06:25:23,102 - experiment_functions - INFO - Early stopping at epoch 500. Best Metrics: (0.0012804183708722545, 0.0013934426229508198, 0.0015589510801785021)
2026-05-23 06:25:23,189 - optuna.study.study - INFO - Trial 22 finished with values: [0.0012804183708722545, 0.0013934426229508198, 0.0015589510801785021] and parameters: {'n_layers': 2, 'embedding_dim': 128, 'lr': 0.00014503975146332006, 'lambda_val': 7.567156426332108e-06, 'batch_size': 2531, 'optimizer': 'SGD'}.
2026-05-23 06:25:27,251 - experiment_functions - INFO - Early stopping at epoch 950. Best Metrics: (0.013740406149613998, 0.008770491803278688, 0.012783567514667438)
2026-05-23 06:25:27,340 - optuna.study.study - INFO - Trial 23 finished with values: [0.013740406149613998, 0.008770491803278688, 0.012783567514667438] and parameters: {'n_layers': 3, 'embedding_dim': 96, 'lr': 0.013868600017201397, 'lambda_val': 2.388546090615206e-05, 'batch_size': 941, 'optimizer': 'Adam'}.
2026-05-23 06:25:32,649 - experiment_functions - INFO - Early stopping at epoch 850. Best Metrics: (0.04537290460710981, 0.021967213114754094, 0.03430859242744827)
2026-05-23 06:25:32,897 - optuna.study.study - INFO - Trial 24 finished with values: [0.04537290460710981, 0.021967213114754094, 0.03430859242744827] and parameters: {'n_layers': 2, 'embedding_dim': 256, 'lr': 0.0004152932764115524, 'lambda_val': 0.0015968336491314992, 'batch_size': 1707, 'optimizer': 'RMSprop'}.
2026-05-23 06:25:35,257 - experiment_functions - INFO - Early stopping at epoch 500. Best Metrics: (0.0011703554497761684, 0.0013114754098360656, 0.0018322761380440303)
2026-05-23 06:25:35,396 - optuna.study.study - INFO - Trial 25 finished with values: [0.0011703554497761684, 0.0013114754098360656, 0.0018322761380440303] and parameters: {'n_layers': 4, 'embedding_dim': 96, 'lr': 0.0023352222116664744, 'lambda_val': 0.0077751906376212505, 'batch_size': 3725, 'optimizer': 'SGD'}.
2026-05-23 06:25:38,106 - experiment_functions - INFO - Early stopping at epoch 650. Best Metrics: (0.024106932513164255, 0.014672131147540986, 0.020891891889888606)
2026-05-23 06:25:38,216 - optuna.study.study - INFO - Trial 26 finished with values: [0.024106932513164255, 0.014672131147540986, 0.020891891889888606] and parameters: {'n_layers': 3, 'embedding_dim': 32, 'lr': 0.0023890551445205745, 'lambda_val': 2.8054741806304403e-06, 'batch_size': 2030, 'optimizer': 'Adam'}.
2026-05-23 06:25:40,595 - experiment_functions - INFO - Early stopping at epoch 500. Best Metrics: (0.001995565790590136, 0.0018852459016393442, 0.002329893700918593)
2026-05-23 06:25:40,738 - optuna.study.study - INFO - Trial 27 finished with values: [0.001995565790590136, 0.0018852459016393442, 0.002329893700918593] and parameters: {'n_layers': 1, 'embedding_dim': 256, 'lr': 0.005147040370749884, 'lambda_val': 8.18222862106426e-05, 'batch_size': 744, 'optimizer': 'SGD'}.
2026-05-23 06:25:46,880 - experiment_functions - INFO - Early stopping at epoch 1900. Best Metrics: (0.0018358961223115075, 0.0013114754098360656, 0.001918567441067259)
2026-05-23 06:25:48,165 - optuna.study.study - INFO - Trial 28 finished with values: [0.0018358961223115075, 0.0013114754098360656, 0.001918567441067259] and parameters: {'n_layers': 2, 'embedding_dim': 32, 'lr': 1.3288706747201224e-05, 'lambda_val': 0.008501800331612443, 'batch_size': 2614, 'optimizer': 'Adam'}.
2026-05-23 06:26:02,326 - optuna.study.study - INFO - Trial 29 finished with values: [0.00928580199268986, 0.007049180327868854, 0.009044224376975338] and parameters: {'n_layers': 3, 'embedding_dim': 128, 'lr': 4.329209987091179e-05, 'lambda_val': 1.9718290434308107e-05, 'batch_size': 3587, 'optimizer': 'Adam'}.
2026-05-23 06:26:05,550 - experiment_functions - INFO - Early stopping at epoch 800. Best Metrics: (0.04214112900263978, 0.022540983606557378, 0.035687860425576166)
2026-05-23 06:26:05,676 - optuna.study.study - INFO - Trial 30 finished with values: [0.04214112900263978, 0.022540983606557378, 0.035687860425576166] and parameters: {'n_layers': 1, 'embedding_dim': 64, 'lr': 0.0014308085114682584, 'lambda_val': 1.2349382351402382e-05, 'batch_size': 3209, 'optimizer': 'Adam'}.
2026-05-23 06:26:07,926 - experiment_functions - INFO - Early stopping at epoch 500. Best Metrics: (0.001497282902879313, 0.0017213114754098366, 0.0019092656600916238)
2026-05-23 06:26:08,010 - optuna.study.study - INFO - Trial 31 finished with values: [0.001497282902879313, 0.0017213114754098366, 0.0019092656600916238] and parameters: {'n_layers': 1, 'embedding_dim': 64, 'lr': 0.0016723343822150295, 'lambda_val': 0.0044821077313550025, 'batch_size': 3889, 'optimizer': 'SGD'}.
2026-05-23 06:26:10,244 - experiment_functions - INFO - Early stopping at epoch 500. Best Metrics: (0.00376002438707882, 0.001639344262295082, 0.0022719907423053884)
2026-05-23 06:26:10,333 - optuna.study.study - INFO - Trial 32 finished with values: [0.00376002438707882, 0.001639344262295082, 0.0022719907423053884] and parameters: {'n_layers': 2, 'embedding_dim': 128, 'lr': 0.0004520733767048645, 'lambda_val': 2.3526529117698504e-06, 'batch_size': 2087, 'optimizer': 'SGD'}.
2026-05-23 06:26:18,658 - experiment_functions - INFO - Early stopping at epoch 1650. Best Metrics: (0.02878091256709538, 0.016065573770491805, 0.024296846410437497)
2026-05-23 06:26:18,786 - optuna.study.study - INFO - Trial 33 finished with values: [0.02878091256709538, 0.016065573770491805, 0.024296846410437497] and parameters: {'n_layers': 4, 'embedding_dim': 256, 'lr': 0.00015503744322066125, 'lambda_val': 1.160548750868123e-06, 'batch_size': 2923, 'optimizer': 'Adam'}.
2026-05-23 06:26:28,435 - optuna.study.study - INFO - Trial 34 finished with values: [0.0109762350506386, 0.007540983606557378, 0.011573511767648483] and parameters: {'n_layers': 1, 'embedding_dim': 128, 'lr': 0.00012543209374887493, 'lambda_val': 0.000357869820771127, 'batch_size': 745, 'optimizer': 'RMSprop'}.
2026-05-23 06:26:47,335 - optuna.study.study - INFO - Trial 35 finished with values: [0.031180442440252608, 0.015409836065573772, 0.026227160783627045] and parameters: {'n_layers': 4, 'embedding_dim': 256, 'lr': 8.981382437399417e-05, 'lambda_val': 0.0005103737914204569, 'batch_size': 3383, 'optimizer': 'RMSprop'}.
2026-05-23 06:26:50,775 - experiment_functions - INFO - Early stopping at epoch 700. Best Metrics: (0.04370790764909988, 0.02180327868852459, 0.035349860396542636)
2026-05-23 06:26:50,868 - optuna.study.study - INFO - Trial 36 finished with values: [0.04370790764909988, 0.02180327868852459, 0.035349860396542636] and parameters: {'n_layers': 1, 'embedding_dim': 128, 'lr': 0.0016352707212588652, 'lambda_val': 3.822612857526585e-06, 'batch_size': 3478, 'optimizer': 'Adam'}.
2026-05-23 06:27:01,756 - experiment_functions - INFO - Early stopping at epoch 3700. Best Metrics: (0.0035896509149923256, 0.003770491803278689, 0.004856265411805291)
2026-05-23 06:27:01,900 - optuna.study.study - INFO - Trial 37 finished with values: [0.0035896509149923256, 0.003770491803278689, 0.004856265411805291] and parameters: {'n_layers': 1, 'embedding_dim': 64, 'lr': 6.850762248123774e-05, 'lambda_val': 0.013840432502784892, 'batch_size': 3208, 'optimizer': 'Adam'}.
2026-05-23 06:27:04,319 - experiment_functions - INFO - Early stopping at epoch 550. Best Metrics: (0.011413144232825, 0.006721311475409837, 0.009817138664481032)
2026-05-23 06:27:04,511 - optuna.study.study - INFO - Trial 38 finished with values: [0.011413144232825, 0.006721311475409837, 0.009817138664481032] and parameters: {'n_layers': 2, 'embedding_dim': 128, 'lr': 0.06136195989867191, 'lambda_val': 5.940732376493659e-06, 'batch_size': 1510, 'optimizer': 'Adam'}.
2026-05-23 06:27:15,826 - experiment_functions - INFO - Early stopping at epoch 3650. Best Metrics: (0.0025084085204567317, 0.0018852459016393446, 0.002466381625208353)
2026-05-23 06:27:16,335 - optuna.study.study - INFO - Trial 39 finished with values: [0.0025084085204567317, 0.0018852459016393446, 0.002466381625208353] and parameters: {'n_layers': 3, 'embedding_dim': 128, 'lr': 1.2384893589076112e-05, 'lambda_val': 3.8964278872552114e-05, 'batch_size': 2824, 'optimizer': 'RMSprop'}.
2026-05-23 06:27:18,342 - experiment_functions - INFO - Early stopping at epoch 500. Best Metrics: (0.002037926284726541, 0.0018032786885245904, 0.002572242602156098)
2026-05-23 06:27:18,474 - optuna.study.study - INFO - Trial 40 finished with values: [0.002037926284726541, 0.0018032786885245904, 0.002572242602156098] and parameters: {'n_layers': 2, 'embedding_dim': 96, 'lr': 0.0013757872363495426, 'lambda_val': 0.04473436801113999, 'batch_size': 1602, 'optimizer': 'SGD'}.
2026-05-23 06:27:24,274 - experiment_functions - INFO - Early stopping at epoch 1850. Best Metrics: (0.030690165078263023, 0.016721311475409836, 0.026751524889990254)
2026-05-23 06:27:24,970 - optuna.study.study - INFO - Trial 41 finished with values: [0.030690165078263023, 0.016721311475409836, 0.026751524889990254] and parameters: {'n_layers': 4, 'embedding_dim': 32, 'lr': 0.0003566130628047912, 'lambda_val': 1.4282021456079451e-05, 'batch_size': 2413, 'optimizer': 'RMSprop'}.
2026-05-23 06:27:27,192 - experiment_functions - INFO - Early stopping at epoch 650. Best Metrics: (0.010211235249466388, 0.008278688524590166, 0.012701644958228973)
2026-05-23 06:27:27,283 - optuna.study.study - INFO - Trial 42 finished with values: [0.010211235249466388, 0.008278688524590166, 0.012701644958228973] and parameters: {'n_layers': 2, 'embedding_dim': 32, 'lr': 0.002226352988720447, 'lambda_val': 0.07032486646002754, 'batch_size': 2526, 'optimizer': 'Adam'}.
2026-05-23 06:27:30,562 - experiment_functions - INFO - Early stopping at epoch 1150. Best Metrics: (0.04295028970511865, 0.0219672131147541, 0.03590706805420572)
