2026-05-23 06:01:39,903 - optuna.study.study - INFO - Trial 58 finished with values: [0.013171217275172049, 0.013688524590163934, 0.016653191902796516] and parameters: {'n_layers': 1, 'embedding_dim': 96, 'lr': 0.0004278261152456948, 'lambda_val': 0.005501300014684501, 'batch_size': 3814, 'optimizer': 'RMSprop'}.
2026-05-23 06:01:43,110 - experiment_functions - INFO - Early stopping at epoch 850. Best Metrics: (0.008791660404702483, 0.010901639344262295, 0.012764403329613625)
2026-05-23 06:01:43,214 - optuna.study.study - INFO - Trial 59 finished with values: [0.008791660404702483, 0.010901639344262295, 0.012764403329613625] and parameters: {'n_layers': 2, 'embedding_dim': 64, 'lr': 0.00034122242598680385, 'lambda_val': 0.002206220255221525, 'batch_size': 2282, 'optimizer': 'Adam'}.
2026-05-23 06:01:45,362 - experiment_functions - INFO - Early stopping at epoch 500. Best Metrics: (0.0029435054747512283, 0.0011475409836065576, 0.001792953482570758)
2026-05-23 06:01:45,647 - optuna.study.study - INFO - Trial 60 finished with values: [0.0029435054747512283, 0.0011475409836065576, 0.001792953482570758] and parameters: {'n_layers': 2, 'embedding_dim': 32, 'lr': 1.194088775511757e-05, 'lambda_val': 2.9405199459966574e-06, 'batch_size': 1993, 'optimizer': 'SGD'}.
2026-05-23 06:01:53,971 - experiment_functions - INFO - Early stopping at epoch 500. Best Metrics: (0.002470160851549663, 0.0018852459016393446, 0.0025190742275332735)
2026-05-23 06:01:54,362 - optuna.study.study - INFO - Trial 61 finished with values: [0.002470160851549663, 0.0018852459016393446, 0.0025190742275332735] and parameters: {'n_layers': 2, 'embedding_dim': 64, 'lr': 0.01061047406048849, 'lambda_val': 0.004328037622434779, 'batch_size': 2200, 'optimizer': 'SGD'}.
2026-05-23 06:02:01,230 - experiment_functions - INFO - Early stopping at epoch 500. Best Metrics: (0.0013680653572498288, 0.0012295081967213116, 0.0014365648539930768)
2026-05-23 06:02:01,405 - optuna.study.study - INFO - Trial 62 finished with values: [0.0013680653572498288, 0.0012295081967213116, 0.0014365648539930768] and parameters: {'n_layers': 4, 'embedding_dim': 128, 'lr': 5.379458565878549e-05, 'lambda_val': 4.730833678906346e-06, 'batch_size': 3213, 'optimizer': 'SGD'}.
2026-05-23 06:02:04,149 - experiment_functions - INFO - Early stopping at epoch 500. Best Metrics: (0.001518934244584231, 0.0017213114754098362, 0.001992815597763186)
2026-05-23 06:02:04,225 - optuna.study.study - INFO - Trial 63 finished with values: [0.001518934244584231, 0.0017213114754098362, 0.001992815597763186] and parameters: {'n_layers': 2, 'embedding_dim': 256, 'lr': 0.00015707829715157166, 'lambda_val': 0.00811231567759129, 'batch_size': 2201, 'optimizer': 'SGD'}.
2026-05-23 06:02:06,599 - experiment_functions - INFO - Early stopping at epoch 500. Best Metrics: (0.002515933765066363, 0.0015573770491803278, 0.002673953309149557)
2026-05-23 06:02:06,680 - optuna.study.study - INFO - Trial 64 finished with values: [0.002515933765066363, 0.0015573770491803278, 0.002673953309149557] and parameters: {'n_layers': 3, 'embedding_dim': 128, 'lr': 0.000119163266657484, 'lambda_val': 0.002440479546350061, 'batch_size': 1351, 'optimizer': 'SGD'}.
2026-05-23 06:02:08,914 - experiment_functions - INFO - Early stopping at epoch 500. Best Metrics: (0.0017164459806370547, 0.001639344262295082, 0.0018178475714985475)
2026-05-23 06:02:09,047 - optuna.study.study - INFO - Trial 65 finished with values: [0.0017164459806370547, 0.001639344262295082, 0.0018178475714985475] and parameters: {'n_layers': 3, 'embedding_dim': 64, 'lr': 5.558951612286882e-05, 'lambda_val': 0.004070149229762474, 'batch_size': 2282, 'optimizer': 'RMSprop'}.
2026-05-23 06:02:12,002 - experiment_functions - INFO - Early stopping at epoch 550. Best Metrics: (0.009792467928294607, 0.009918032786885246, 0.012652790140978969)
2026-05-23 06:02:12,366 - optuna.study.study - INFO - Trial 66 finished with values: [0.009792467928294607, 0.009918032786885246, 0.012652790140978969] and parameters: {'n_layers': 2, 'embedding_dim': 256, 'lr': 0.0007855341580113746, 'lambda_val': 0.0003409353796005995, 'batch_size': 2381, 'optimizer': 'RMSprop'}.
2026-05-23 06:02:15,274 - experiment_functions - INFO - Early stopping at epoch 750. Best Metrics: (0.009473320833482485, 0.011065573770491803, 0.012786687995986713)
2026-05-23 06:02:15,362 - optuna.study.study - INFO - Trial 67 finished with values: [0.009473320833482485, 0.011065573770491803, 0.012786687995986713] and parameters: {'n_layers': 2, 'embedding_dim': 32, 'lr': 0.0007855341580113746, 'lambda_val': 0.0003409353796005995, 'batch_size': 2052, 'optimizer': 'Adam'}.
2026-05-23 06:02:18,338 - experiment_functions - INFO - Early stopping at epoch 500. Best Metrics: (0.0035195796619880266, 0.001639344262295082, 0.002280973672619138)
2026-05-23 06:02:19,023 - optuna.study.study - INFO - Trial 68 finished with values: [0.0035195796619880266, 0.001639344262295082, 0.002280973672619138] and parameters: {'n_layers': 4, 'embedding_dim': 256, 'lr': 0.0014868423202414264, 'lambda_val': 4.409435461756805e-05, 'batch_size': 3335, 'optimizer': 'SGD'}.
2026-05-23 06:02:21,245 - experiment_functions - INFO - Early stopping at epoch 500. Best Metrics: (0.0019229286880223983, 0.0013114754098360656, 0.0019224987618727224)
2026-05-23 06:02:21,347 - optuna.study.study - INFO - Trial 69 finished with values: [0.0019229286880223983, 0.0013114754098360656, 0.0019224987618727224] and parameters: {'n_layers': 2, 'embedding_dim': 32, 'lr': 0.001890263218393761, 'lambda_val': 0.0011044576132309863, 'batch_size': 2073, 'optimizer': 'SGD'}.
2026-05-23 06:02:23,660 - experiment_functions - INFO - Early stopping at epoch 550. Best Metrics: (0.006804271177083128, 0.008688524590163935, 0.009675284211029936)
2026-05-23 06:02:23,801 - optuna.study.study - INFO - Trial 70 finished with values: [0.006804271177083128, 0.008688524590163935, 0.009675284211029936] and parameters: {'n_layers': 1, 'embedding_dim': 96, 'lr': 0.01837949443771539, 'lambda_val': 0.00043313110721109564, 'batch_size': 685, 'optimizer': 'Adam'}.
2026-05-23 06:02:26,410 - experiment_functions - INFO - Early stopping at epoch 500. Best Metrics: (0.002209333702765623, 0.001475409836065574, 0.0018781852190688536)
2026-05-23 06:02:26,671 - optuna.study.study - INFO - Trial 71 finished with values: [0.002209333702765623, 0.001475409836065574, 0.0018781852190688536] and parameters: {'n_layers': 2, 'embedding_dim': 256, 'lr': 0.0022084270117427845, 'lambda_val': 0.00811231567759129, 'batch_size': 3156, 'optimizer': 'SGD'}.
2026-05-23 06:02:30,390 - experiment_functions - INFO - Early stopping at epoch 950. Best Metrics: (0.0021578438323542654, 0.0012295081967213116, 0.0023966769028147877)
2026-05-23 06:02:30,567 - optuna.study.study - INFO - Trial 72 finished with values: [0.0021578438323542654, 0.0012295081967213116, 0.0023966769028147877] and parameters: {'n_layers': 1, 'embedding_dim': 256, 'lr': 0.0033544030720054257, 'lambda_val': 0.002416712650661108, 'batch_size': 3335, 'optimizer': 'SGD'}.
2026-05-23 06:02:33,216 - experiment_functions - INFO - Early stopping at epoch 500. Best Metrics: (0.003200809716275936, 0.0018852459016393446, 0.002782243961682847)
2026-05-23 06:02:33,309 - optuna.study.study - INFO - Trial 73 finished with values: [0.003200809716275936, 0.0018852459016393446, 0.002782243961682847] and parameters: {'n_layers': 2, 'embedding_dim': 256, 'lr': 0.00010761667973786786, 'lambda_val': 4.409435461756805e-05, 'batch_size': 3335, 'optimizer': 'SGD'}.
2026-05-23 06:02:35,946 - experiment_functions - INFO - Early stopping at epoch 650. Best Metrics: (0.01037334668549647, 0.011885245901639344, 0.015662268233003474)
2026-05-23 06:02:36,090 - optuna.study.study - INFO - Trial 74 finished with values: [0.01037334668549647, 0.011885245901639344, 0.015662268233003474] and parameters: {'n_layers': 1, 'embedding_dim': 32, 'lr': 0.0009699915116782758, 'lambda_val': 0.005501300014684501, 'batch_size': 3814, 'optimizer': 'Adam'}.
2026-05-23 06:02:38,689 - experiment_functions - INFO - Early stopping at epoch 500. Best Metrics: (0.0010803311310409148, 0.0014754098360655738, 0.001400758508041955)
2026-05-23 06:02:38,777 - optuna.study.study - INFO - Trial 75 finished with values: [0.0010803311310409148, 0.0014754098360655738, 0.001400758508041955] and parameters: {'n_layers': 4, 'embedding_dim': 128, 'lr': 0.00011211714788430738, 'lambda_val': 0.008069433035806131, 'batch_size': 916, 'optimizer': 'SGD'}.
2026-05-23 06:02:51,660 - optuna.study.study - INFO - Trial 76 finished with values: [0.0071847309503869725, 0.006721311475409837, 0.008423550830428518] and parameters: {'n_layers': 1, 'embedding_dim': 96, 'lr': 5.379458565878549e-05, 'lambda_val': 4.545962355793143e-06, 'batch_size': 3539, 'optimizer': 'Adam'}.
2026-05-23 06:02:53,862 - experiment_functions - INFO - Early stopping at epoch 500. Best Metrics: (0.002903152906674809, 0.0017213114754098362, 0.0022154936709945687)
2026-05-23 06:02:53,960 - optuna.study.study - INFO - Trial 77 finished with values: [0.002903152906674809, 0.0017213114754098362, 0.0022154936709945687] and parameters: {'n_layers': 2, 'embedding_dim': 32, 'lr': 4.001121509302567e-05, 'lambda_val': 0.002440479546350061, 'batch_size': 1348, 'optimizer': 'SGD'}.
2026-05-23 06:02:56,084 - experiment_functions - INFO - Early stopping at epoch 500. Best Metrics: (0.0010135076851659965, 0.001557377049180328, 0.0025173640509121875)
2026-05-23 06:02:56,183 - optuna.study.study - INFO - Trial 78 finished with values: [0.0010135076851659965, 0.001557377049180328, 0.0025173640509121875] and parameters: {'n_layers': 2, 'embedding_dim': 64, 'lr': 0.00010761667973786786, 'lambda_val': 0.002440479546350061, 'batch_size': 1278, 'optimizer': 'SGD'}.
2026-05-23 06:02:58,659 - experiment_functions - INFO - Early stopping at epoch 600. Best Metrics: (0.003148678086519234, 0.005, 0.006807273997630372)
2026-05-23 06:02:58,749 - optuna.study.study - INFO - Trial 79 finished with values: [0.003148678086519234, 0.005, 0.006807273997630372] and parameters: {'n_layers': 1, 'embedding_dim': 96, 'lr': 0.09388280516514556, 'lambda_val': 1.0739564606939635e-05, 'batch_size': 1480, 'optimizer': 'Adam'}.
2026-05-23 06:03:05,975 - experiment_functions - INFO - Early stopping at epoch 500. Best Metrics: (0.0029292023635651035, 0.001967213114754099, 0.0031808683807650817)
2026-05-23 06:03:06,634 - optuna.study.study - INFO - Trial 80 finished with values: [0.0029292023635651035, 0.001967213114754099, 0.0031808683807650817] and parameters: {'n_layers': 1, 'embedding_dim': 96, 'lr': 0.047847436117002144, 'lambda_val': 0.05655118281335753, 'batch_size': 2377, 'optimizer': 'SGD'}.
2026-05-23 06:03:20,338 - experiment_functions - INFO - Early stopping at epoch 3100. Best Metrics: (0.011485083074620435, 0.01278688524590164, 0.01587762178090761)
2026-05-23 06:03:20,414 - optuna.study.study - INFO - Trial 81 finished with values: [0.011485083074620435, 0.01278688524590164, 0.01587762178090761] and parameters: {'n_layers': 1, 'embedding_dim': 32, 'lr': 0.00011765782983091902, 'lambda_val': 0.00022615849293998648, 'batch_size': 3670, 'optimizer': 'Adam'}.
2026-05-23 06:03:23,035 - experiment_functions - INFO - Early stopping at epoch 650. Best Metrics: (0.001543017017037245, 0.0018852459016393446, 0.0020057906918711245)
2026-05-23 06:03:23,123 - optuna.study.study - INFO - Trial 82 finished with values: [0.001543017017037245, 0.0018852459016393446, 0.0020057906918711245] and parameters: {'n_layers': 2, 'embedding_dim': 128, 'lr': 0.08021165318066971, 'lambda_val': 0.0790804021986742, 'batch_size': 1047, 'optimizer': 'SGD'}.
2026-05-23 06:03:25,553 - experiment_functions - INFO - Early stopping at epoch 500. Best Metrics: (0.001862488892002803, 0.001639344262295082, 0.002003148121234144)
2026-05-23 06:03:25,646 - optuna.study.study - INFO - Trial 83 finished with values: [0.001862488892002803, 0.001639344262295082, 0.002003148121234144] and parameters: {'n_layers': 4, 'embedding_dim': 128, 'lr': 0.00011211714788430738, 'lambda_val': 0.008069433035806131, 'batch_size': 2024, 'optimizer': 'SGD'}.
2026-05-23 06:03:27,888 - experiment_functions - INFO - Early stopping at epoch 500. Best Metrics: (0.0021085767103637596, 0.0025409836065573774, 0.0033496841249021025)
2026-05-23 06:03:28,017 - optuna.study.study - INFO - Trial 84 finished with values: [0.0021085767103637596, 0.0025409836065573774, 0.0033496841249021025] and parameters: {'n_layers': 2, 'embedding_dim': 128, 'lr': 4.001121509302567e-05, 'lambda_val': 0.0003169623783689911, 'batch_size': 1348, 'optimizer': 'SGD'}.
2026-05-23 06:03:31,473 - experiment_functions - INFO - Early stopping at epoch 850. Best Metrics: (0.006955094631967095, 0.01081967213114754, 0.01315568675137304)
2026-05-23 06:03:31,560 - optuna.study.study - INFO - Trial 85 finished with values: [0.006955094631967095, 0.01081967213114754, 0.01315568675137304] and parameters: {'n_layers': 1, 'embedding_dim': 96, 'lr': 0.011644283247743916, 'lambda_val': 0.0013550316116179714, 'batch_size': 2799, 'optimizer': 'RMSprop'}.
2026-05-23 06:03:35,826 - experiment_functions - INFO - Early stopping at epoch 850. Best Metrics: (0.0024480171212037005, 0.001639344262295082, 0.00215655943465245)
2026-05-23 06:03:36,115 - optuna.study.study - INFO - Trial 86 finished with values: [0.0024480171212037005, 0.001639344262295082, 0.00215655943465245] and parameters: {'n_layers': 3, 'embedding_dim': 256, 'lr': 1.2018861443162076e-05, 'lambda_val': 7.349705844771799e-06, 'batch_size': 3906, 'optimizer': 'RMSprop'}.
2026-05-23 06:03:38,331 - experiment_functions - INFO - Early stopping at epoch 500. Best Metrics: (0.0031585012343496063, 0.0017213114754098362, 0.002323263925082961)
2026-05-23 06:03:38,471 - optuna.study.study - INFO - Trial 87 finished with values: [0.0031585012343496063, 0.0017213114754098362, 0.002323263925082961] and parameters: {'n_layers': 1, 'embedding_dim': 128, 'lr': 0.0899703554910188, 'lambda_val': 0.008069433035806131, 'batch_size': 3111, 'optimizer': 'SGD'}.
2026-05-23 06:03:40,852 - experiment_functions - INFO - Early stopping at epoch 500. Best Metrics: (0.001550644253756827, 0.0017213114754098362, 0.0018356109792337857)
2026-05-23 06:03:40,948 - optuna.study.study - INFO - Trial 88 finished with values: [0.001550644253756827, 0.0017213114754098362, 0.0018356109792337857] and parameters: {'n_layers': 3, 'embedding_dim': 128, 'lr': 0.08923753116517288, 'lambda_val': 7.349705844771799e-06, 'batch_size': 842, 'optimizer': 'SGD'}.
2026-05-23 06:03:55,762 - optuna.study.study - INFO - Trial 89 finished with values: [0.013448279673870585, 0.014262295081967212, 0.018307324045657783] and parameters: {'n_layers': 3, 'embedding_dim': 128, 'lr': 0.00012869980734826536, 'lambda_val': 1.1371570226930704e-05, 'batch_size': 2899, 'optimizer': 'RMSprop'}.
2026-05-23 06:03:58,472 - experiment_functions - INFO - Early stopping at epoch 500. Best Metrics: (0.001753204439886723, 0.0018852459016393442, 0.002172052595588334)
2026-05-23 06:03:58,559 - optuna.study.study - INFO - Trial 90 finished with values: [0.001753204439886723, 0.0018852459016393442, 0.002172052595588334] and parameters: {'n_layers': 4, 'embedding_dim': 128, 'lr': 1.2018861443162076e-05, 'lambda_val': 0.01933719470444085, 'batch_size': 1539, 'optimizer': 'SGD'}.
2026-05-23 06:04:10,303 - optuna.study.study - INFO - Trial 91 finished with values: [0.013151595857351093, 0.01557377049180328, 0.018978237989952986] and parameters: {'n_layers': 1, 'embedding_dim': 64, 'lr': 0.00013647495897976545, 'lambda_val': 1.643232822744187e-06, 'batch_size': 916, 'optimizer': 'RMSprop'}.
2026-05-23 06:04:12,706 - experiment_functions - INFO - Early stopping at epoch 550. Best Metrics: (0.0014262768771124098, 0.000819672131147541, 0.0012780680612834822)
2026-05-23 06:04:12,791 - optuna.study.study - INFO - Trial 92 finished with values: [0.0014262768771124098, 0.000819672131147541, 0.0012780680612834822] and parameters: {'n_layers': 1, 'embedding_dim': 128, 'lr': 1.194088775511757e-05, 'lambda_val': 0.002416712650661108, 'batch_size': 1993, 'optimizer': 'RMSprop'}.
2026-05-23 06:04:16,742 - experiment_functions - INFO - Early stopping at epoch 1100. Best Metrics: (0.005756259159368189, 0.010901639344262295, 0.012095789088259014)
2026-05-23 06:04:16,837 - optuna.study.study - INFO - Trial 93 finished with values: [0.005756259159368189, 0.010901639344262295, 0.012095789088259014] and parameters: {'n_layers': 1, 'embedding_dim': 64, 'lr': 0.014958588920169108, 'lambda_val': 0.002206220255221525, 'batch_size': 2282, 'optimizer': 'Adam'}.
2026-05-23 06:04:19,327 - experiment_functions - INFO - Early stopping at epoch 500. Best Metrics: (0.002796579137134955, 0.0018852459016393446, 0.002213197117347446)
2026-05-23 06:04:19,424 - optuna.study.study - INFO - Trial 94 finished with values: [0.002796579137134955, 0.0018852459016393446, 0.002213197117347446] and parameters: {'n_layers': 2, 'embedding_dim': 256, 'lr': 0.0014868423202414264, 'lambda_val': 4.409435461756805e-05, 'batch_size': 2282, 'optimizer': 'SGD'}.
2026-05-23 06:04:21,593 - experiment_functions - INFO - Early stopping at epoch 500. Best Metrics: (0.003092734558349169, 0.002622950819672131, 0.0036501892260209167)
2026-05-23 06:04:21,681 - optuna.study.study - INFO - Trial 95 finished with values: [0.003092734558349169, 0.002622950819672131, 0.0036501892260209167] and parameters: {'n_layers': 2, 'embedding_dim': 32, 'lr': 0.01837949443771539, 'lambda_val': 0.00016175547104968382, 'batch_size': 685, 'optimizer': 'RMSprop'}.
2026-05-23 06:04:37,174 - optuna.study.study - INFO - Trial 96 finished with values: [0.007618823322957172, 0.009836065573770493, 0.012197472536219087] and parameters: {'n_layers': 2, 'embedding_dim': 256, 'lr': 6.380088278428048e-05, 'lambda_val': 0.0018518013272191423, 'batch_size': 3010, 'optimizer': 'RMSprop'}.
2026-05-23 06:04:46,269 - experiment_functions - INFO - Early stopping at epoch 3050. Best Metrics: (0.008022801957373874, 0.010819672131147543, 0.013100009123855083)
2026-05-23 06:04:46,575 - optuna.study.study - INFO - Trial 97 finished with values: [0.008022801957373874, 0.010819672131147543, 0.013100009123855083] and parameters: {'n_layers': 1, 'embedding_dim': 96, 'lr': 0.059429223534384505, 'lambda_val': 0.00027930861690939925, 'batch_size': 1888, 'optimizer': 'Adam'}.
2026-05-23 06:04:53,944 - experiment_functions - INFO - Early stopping at epoch 550. Best Metrics: (0.014311377739391482, 0.017704918032786888, 0.02225394438649403)
2026-05-23 06:04:54,471 - optuna.study.study - INFO - Trial 98 finished with values: [0.014311377739391482, 0.017704918032786888, 0.02225394438649403] and parameters: {'n_layers': 1, 'embedding_dim': 64, 'lr': 0.0012169182947165634, 'lambda_val': 1.90692593503121e-05, 'batch_size': 1888, 'optimizer': 'RMSprop'}.
2026-05-23 06:05:01,558 - experiment_functions - INFO - Early stopping at epoch 650. Best Metrics: (0.0016076064727944999, 0.0018852459016393446, 0.0018790871490688942)
2026-05-23 06:05:01,670 - optuna.study.study - INFO - Trial 99 finished with values: [0.0016076064727944999, 0.0018852459016393446, 0.0018790871490688942] and parameters: {'n_layers': 2, 'embedding_dim': 128, 'lr': 0.01837949443771539, 'lambda_val': 0.00043313110721109564, 'batch_size': 685, 'optimizer': 'SGD'}.
2026-05-23 06:05:05,549 - experiment_functions - INFO - Early stopping at epoch 950. Best Metrics: (0.0064487743035657056, 0.008852459016393444, 0.010030010353260921)
2026-05-23 06:05:05,637 - optuna.study.study - INFO - Trial 100 finished with values: [0.0064487743035657056, 0.008852459016393444, 0.010030010353260921] and parameters: {'n_layers': 2, 'embedding_dim': 64, 'lr': 0.00036854228595864275, 'lambda_val': 0.0003409353796005995, 'batch_size': 2799, 'optimizer': 'Adam'}.
2026-05-23 06:05:09,856 - experiment_functions - INFO - Early stopping at epoch 1300. Best Metrics: (0.0038210118883595648, 0.007540983606557377, 0.008377053296162413)
2026-05-23 06:05:09,953 - optuna.study.study - INFO - Trial 101 finished with values: [0.0038210118883595648, 0.007540983606557377, 0.008377053296162413] and parameters: {'n_layers': 1, 'embedding_dim': 32, 'lr': 0.009010569458105152, 'lambda_val': 0.027251947202207506, 'batch_size': 2799, 'optimizer': 'Adam'}.
2026-05-23 06:05:12,154 - experiment_functions - INFO - Early stopping at epoch 500. Best Metrics: (0.0029578380410079062, 0.0027049180327868854, 0.0030602118691215262)
2026-05-23 06:05:12,247 - optuna.study.study - INFO - Trial 102 finished with values: [0.0029578380410079062, 0.0027049180327868854, 0.0030602118691215262] and parameters: {'n_layers': 2, 'embedding_dim': 32, 'lr': 0.01837949443771539, 'lambda_val': 0.00043313110721109564, 'batch_size': 894, 'optimizer': 'RMSprop'}.
2026-05-23 06:05:15,197 - experiment_functions - INFO - Early stopping at epoch 550. Best Metrics: (0.005539257445497639, 0.006229508196721311, 0.007334536826542738)
2026-05-23 06:05:15,282 - optuna.study.study - INFO - Trial 103 finished with values: [0.005539257445497639, 0.006229508196721311, 0.007334536826542738] and parameters: {'n_layers': 2, 'embedding_dim': 256, 'lr': 0.0007855341580113746, 'lambda_val': 0.008843867790050126, 'batch_size': 2880, 'optimizer': 'RMSprop'}.
2026-05-23 06:05:30,434 - optuna.study.study - INFO - Trial 104 finished with values: [0.003621272424854138, 0.003524590163934427, 0.004821472081497442] and parameters: {'n_layers': 4, 'embedding_dim': 128, 'lr': 5.345329022092173e-05, 'lambda_val': 0.00029292236724190197, 'batch_size': 1763, 'optimizer': 'RMSprop'}.
2026-05-23 06:05:33,151 - experiment_functions - INFO - Early stopping at epoch 700. Best Metrics: (0.011496712091441728, 0.013114754098360656, 0.018721356471150002)
