2026-05-23 04:53:36,985 - optuna.study.study - INFO - Trial 37 finished with values: [0.0034445157203546236, 0.0020491803278688526, 0.0028568735031691507] and parameters: {'n_layers': 2, 'embedding_dim': 96, 'lr': 0.00010218583984224516, 'lambda_val': 0.00014458268269192416, 'batch_size': 4027, 'optimizer': 'SGD'}.
2026-05-23 04:53:39,925 - experiment_functions - INFO - Early stopping at epoch 550. Best Metrics: (0.026993992450826208, 0.013360655737704919, 0.020903155762356164)
2026-05-23 04:53:40,021 - optuna.study.study - INFO - Trial 38 finished with values: [0.026993992450826208, 0.013360655737704919, 0.020903155762356164] and parameters: {'n_layers': 2, 'embedding_dim': 64, 'lr': 0.014307049433242047, 'lambda_val': 3.088246341233559e-05, 'batch_size': 2401, 'optimizer': 'RMSprop'}.
2026-05-23 04:53:44,475 - experiment_functions - INFO - Early stopping at epoch 500. Best Metrics: (0.0019582332620570186, 0.001557377049180328, 0.0019933048798866514)
2026-05-23 04:53:44,933 - optuna.study.study - INFO - Trial 39 finished with values: [0.0019582332620570186, 0.001557377049180328, 0.0019933048798866514] and parameters: {'n_layers': 4, 'embedding_dim': 32, 'lr': 0.06072046334481538, 'lambda_val': 0.00014410999451068505, 'batch_size': 1897, 'optimizer': 'SGD'}.
2026-05-23 04:53:54,988 - experiment_functions - INFO - Early stopping at epoch 1450. Best Metrics: (0.001343847631723103, 0.0018852459016393442, 0.002058458595825471)
2026-05-23 04:53:56,716 - optuna.study.study - INFO - Trial 40 finished with values: [0.001343847631723103, 0.0018852459016393442, 0.002058458595825471] and parameters: {'n_layers': 1, 'embedding_dim': 128, 'lr': 3.3296713748155645e-05, 'lambda_val': 1.2213470032695958e-05, 'batch_size': 1291, 'optimizer': 'RMSprop'}.
2026-05-23 04:54:00,404 - experiment_functions - INFO - Early stopping at epoch 600. Best Metrics: (0.07496794272341749, 0.04245901639344262, 0.061598375412147605)
2026-05-23 04:54:00,488 - optuna.study.study - INFO - Trial 41 finished with values: [0.07496794272341749, 0.04245901639344262, 0.061598375412147605] and parameters: {'n_layers': 1, 'embedding_dim': 32, 'lr': 0.0032256937887088586, 'lambda_val': 0.021857441898757924, 'batch_size': 2390, 'optimizer': 'Adam'}.
2026-05-23 04:54:03,324 - experiment_functions - INFO - Early stopping at epoch 800. Best Metrics: (0.0014169434211975867, 0.0009016393442622952, 0.001050568130048992)
2026-05-23 04:54:03,776 - optuna.study.study - INFO - Trial 42 finished with values: [0.0014169434211975867, 0.0009016393442622952, 0.001050568130048992] and parameters: {'n_layers': 2, 'embedding_dim': 32, 'lr': 1.0170017130769499e-05, 'lambda_val': 0.02096624062583424, 'batch_size': 2036, 'optimizer': 'RMSprop'}.
2026-05-23 04:54:05,992 - experiment_functions - INFO - Early stopping at epoch 500. Best Metrics: (0.0023552685054742156, 0.0018032786885245904, 0.0031380285971404176)
2026-05-23 04:54:06,078 - optuna.study.study - INFO - Trial 43 finished with values: [0.0023552685054742156, 0.0018032786885245904, 0.0031380285971404176] and parameters: {'n_layers': 1, 'embedding_dim': 128, 'lr': 0.0001273376731516613, 'lambda_val': 0.014381121669718087, 'batch_size': 2378, 'optimizer': 'SGD'}.
2026-05-23 04:54:09,719 - experiment_functions - INFO - Early stopping at epoch 750. Best Metrics: (0.033232249326489244, 0.01614754098360656, 0.02768034911746299)
2026-05-23 04:54:09,860 - optuna.study.study - INFO - Trial 44 finished with values: [0.033232249326489244, 0.01614754098360656, 0.02768034911746299] and parameters: {'n_layers': 3, 'embedding_dim': 64, 'lr': 0.006743846796490162, 'lambda_val': 6.509910298202351e-05, 'batch_size': 1354, 'optimizer': 'Adam'}.
2026-05-23 04:54:15,114 - experiment_functions - INFO - Early stopping at epoch 1750. Best Metrics: (0.009910494486934401, 0.010737704918032788, 0.012560431212433228)
2026-05-23 04:54:15,201 - optuna.study.study - INFO - Trial 45 finished with values: [0.009910494486934401, 0.010737704918032788, 0.012560431212433228] and parameters: {'n_layers': 2, 'embedding_dim': 32, 'lr': 0.009297509827129314, 'lambda_val': 0.0619454527593508, 'batch_size': 703, 'optimizer': 'Adam'}.
2026-05-23 04:54:18,103 - experiment_functions - INFO - Early stopping at epoch 650. Best Metrics: (0.01820799275977838, 0.008770491803278688, 0.014432709974224094)
2026-05-23 04:54:18,997 - optuna.study.study - INFO - Trial 46 finished with values: [0.01820799275977838, 0.008770491803278688, 0.014432709974224094] and parameters: {'n_layers': 4, 'embedding_dim': 32, 'lr': 0.0076345154209776665, 'lambda_val': 1.3758839649631051e-06, 'batch_size': 3423, 'optimizer': 'RMSprop'}.
2026-05-23 04:54:26,286 - experiment_functions - INFO - Early stopping at epoch 1550. Best Metrics: (0.01756959297501086, 0.013114754098360656, 0.017139280458262338)
2026-05-23 04:54:26,377 - optuna.study.study - INFO - Trial 47 finished with values: [0.01756959297501086, 0.013114754098360656, 0.017139280458262338] and parameters: {'n_layers': 3, 'embedding_dim': 128, 'lr': 0.017342928447992203, 'lambda_val': 0.015931319360365178, 'batch_size': 3476, 'optimizer': 'Adam'}.
2026-05-23 04:54:30,231 - experiment_functions - INFO - Early stopping at epoch 1400. Best Metrics: (0.001670632107366704, 0.0013114754098360656, 0.0017130785427633736)
2026-05-23 04:54:30,841 - optuna.study.study - INFO - Trial 48 finished with values: [0.001670632107366704, 0.0013114754098360656, 0.0017130785427633736] and parameters: {'n_layers': 1, 'embedding_dim': 32, 'lr': 1.2201728173269423e-05, 'lambda_val': 1.3861891069005088e-05, 'batch_size': 2517, 'optimizer': 'RMSprop'}.
2026-05-23 04:54:37,865 - experiment_functions - INFO - Early stopping at epoch 1100. Best Metrics: (0.04335310792298194, 0.02811475409836066, 0.040517110127460156)
2026-05-23 04:54:38,411 - optuna.study.study - INFO - Trial 49 finished with values: [0.04335310792298194, 0.02811475409836066, 0.040517110127460156] and parameters: {'n_layers': 3, 'embedding_dim': 256, 'lr': 0.0002566620185802701, 'lambda_val': 0.0010816149679677492, 'batch_size': 2512, 'optimizer': 'RMSprop'}.
2026-05-23 04:54:41,043 - experiment_functions - INFO - Early stopping at epoch 550. Best Metrics: (0.056531093217670886, 0.02811475409836065, 0.047368890932852584)
2026-05-23 04:54:41,185 - optuna.study.study - INFO - Trial 50 finished with values: [0.056531093217670886, 0.02811475409836065, 0.047368890932852584] and parameters: {'n_layers': 1, 'embedding_dim': 128, 'lr': 0.014307049433242047, 'lambda_val': 0.000765889777157795, 'batch_size': 2244, 'optimizer': 'Adam'}.
2026-05-23 04:54:43,974 - experiment_functions - INFO - Early stopping at epoch 500. Best Metrics: (0.002628363241048045, 0.001967213114754099, 0.0023083956122122357)
2026-05-23 04:54:44,045 - optuna.study.study - INFO - Trial 51 finished with values: [0.002628363241048045, 0.001967213114754099, 0.0023083956122122357] and parameters: {'n_layers': 4, 'embedding_dim': 32, 'lr': 5.740670310773949e-05, 'lambda_val': 0.03880437709506188, 'batch_size': 2390, 'optimizer': 'Adam'}.
2026-05-23 04:54:55,560 - experiment_functions - INFO - Early stopping at epoch 2250. Best Metrics: (0.04354568361819077, 0.020409836065573773, 0.034617656251625106)
2026-05-23 04:54:55,842 - optuna.study.study - INFO - Trial 52 finished with values: [0.04354568361819077, 0.020409836065573773, 0.034617656251625106] and parameters: {'n_layers': 2, 'embedding_dim': 256, 'lr': 0.0076345154209776665, 'lambda_val': 0.0006153780524713789, 'batch_size': 3423, 'optimizer': 'RMSprop'}.
2026-05-23 04:54:58,055 - experiment_functions - INFO - Early stopping at epoch 500. Best Metrics: (0.0027778543741934945, 0.0018852459016393442, 0.0029666644583007155)
2026-05-23 04:54:58,143 - optuna.study.study - INFO - Trial 53 finished with values: [0.0027778543741934945, 0.0018852459016393442, 0.0029666644583007155] and parameters: {'n_layers': 1, 'embedding_dim': 32, 'lr': 8.024724571830428e-05, 'lambda_val': 0.00475024784706787, 'batch_size': 2784, 'optimizer': 'SGD'}.
2026-05-23 04:55:11,066 - optuna.study.study - INFO - Trial 54 finished with values: [0.00440824963895431, 0.003524590163934427, 0.005222025560049809] and parameters: {'n_layers': 2, 'embedding_dim': 32, 'lr': 4.205608185622306e-05, 'lambda_val': 4.625898585443723e-05, 'batch_size': 1586, 'optimizer': 'RMSprop'}.
2026-05-23 04:55:13,355 - experiment_functions - INFO - Early stopping at epoch 500. Best Metrics: (0.0034454674683320062, 0.0021311475409836063, 0.002809982593282384)
2026-05-23 04:55:13,445 - optuna.study.study - INFO - Trial 55 finished with values: [0.0034454674683320062, 0.0021311475409836063, 0.002809982593282384] and parameters: {'n_layers': 1, 'embedding_dim': 96, 'lr': 0.06577946033013556, 'lambda_val': 0.004288422301955245, 'batch_size': 1260, 'optimizer': 'SGD'}.
2026-05-23 04:55:15,538 - experiment_functions - INFO - Early stopping at epoch 500. Best Metrics: (0.0018432148611690975, 0.001475409836065574, 0.0016527292730400833)
2026-05-23 04:55:15,615 - optuna.study.study - INFO - Trial 56 finished with values: [0.0018432148611690975, 0.001475409836065574, 0.0016527292730400833] and parameters: {'n_layers': 2, 'embedding_dim': 32, 'lr': 0.010022983319994364, 'lambda_val': 9.101189235790046e-06, 'batch_size': 2784, 'optimizer': 'SGD'}.
2026-05-23 04:55:20,189 - experiment_functions - INFO - Early stopping at epoch 850. Best Metrics: (0.0367561306299062, 0.021229508196721314, 0.03223150750183819)
2026-05-23 04:55:20,307 - optuna.study.study - INFO - Trial 57 finished with values: [0.0367561306299062, 0.021229508196721314, 0.03223150750183819] and parameters: {'n_layers': 4, 'embedding_dim': 128, 'lr': 0.0004134349417792622, 'lambda_val': 0.00023851930345844492, 'batch_size': 3696, 'optimizer': 'RMSprop'}.
2026-05-23 04:55:24,381 - experiment_functions - INFO - Early stopping at epoch 500. Best Metrics: (0.0492770871696726, 0.021229508196721314, 0.04095922374207635)
2026-05-23 04:55:24,504 - optuna.study.study - INFO - Trial 58 finished with values: [0.0492770871696726, 0.021229508196721314, 0.04095922374207635] and parameters: {'n_layers': 4, 'embedding_dim': 256, 'lr': 0.08325297886899372, 'lambda_val': 3.5614573447749906e-05, 'batch_size': 996, 'optimizer': 'RMSprop'}.
2026-05-23 04:55:28,556 - experiment_functions - INFO - Early stopping at epoch 1150. Best Metrics: (0.0017966706410206187, 0.0012295081967213116, 0.0017198481809399513)
2026-05-23 04:55:29,387 - optuna.study.study - INFO - Trial 59 finished with values: [0.0017966706410206187, 0.0012295081967213116, 0.0017198481809399513] and parameters: {'n_layers': 1, 'embedding_dim': 32, 'lr': 1.2201728173269423e-05, 'lambda_val': 1.3861891069005088e-05, 'batch_size': 2517, 'optimizer': 'RMSprop'}.
2026-05-23 04:55:35,446 - experiment_functions - INFO - Early stopping at epoch 800. Best Metrics: (0.03448335044298228, 0.020901639344262295, 0.030550830035904898)
2026-05-23 04:55:35,579 - optuna.study.study - INFO - Trial 60 finished with values: [0.03448335044298228, 0.020901639344262295, 0.030550830035904898] and parameters: {'n_layers': 4, 'embedding_dim': 256, 'lr': 0.0004134349417792622, 'lambda_val': 5.1749265389269726e-05, 'batch_size': 2428, 'optimizer': 'RMSprop'}.
2026-05-23 04:55:49,329 - optuna.study.study - INFO - Trial 61 finished with values: [0.014226087497888848, 0.009754098360655737, 0.01404816724285634] and parameters: {'n_layers': 2, 'embedding_dim': 32, 'lr': 6.922551405679396e-05, 'lambda_val': 3.827155829365953e-06, 'batch_size': 2533, 'optimizer': 'Adam'}.
2026-05-23 04:56:05,704 - optuna.study.study - INFO - Trial 62 finished with values: [0.038049525092974885, 0.023606557377049184, 0.03789933263330136] and parameters: {'n_layers': 4, 'embedding_dim': 32, 'lr': 0.00019262259007340505, 'lambda_val': 0.00619655064381492, 'batch_size': 2445, 'optimizer': 'RMSprop'}.
2026-05-23 04:56:08,332 - experiment_functions - INFO - Early stopping at epoch 500. Best Metrics: (0.0013747411717789852, 0.0018032786885245904, 0.0019912598918551297)
2026-05-23 04:56:08,427 - optuna.study.study - INFO - Trial 63 finished with values: [0.0013747411717789852, 0.0018032786885245904, 0.0019912598918551297] and parameters: {'n_layers': 1, 'embedding_dim': 256, 'lr': 0.00010218583984224516, 'lambda_val': 0.0047876136643436075, 'batch_size': 4027, 'optimizer': 'SGD'}.
2026-05-23 04:56:18,459 - experiment_functions - INFO - Early stopping at epoch 2350. Best Metrics: (0.011390341027349203, 0.008852459016393444, 0.012327875525200935)
2026-05-23 04:56:18,578 - optuna.study.study - INFO - Trial 64 finished with values: [0.011390341027349203, 0.008852459016393444, 0.012327875525200935] and parameters: {'n_layers': 4, 'embedding_dim': 64, 'lr': 0.0032256937887088586, 'lambda_val': 0.021857441898757924, 'batch_size': 1303, 'optimizer': 'RMSprop'}.
2026-05-23 04:56:25,667 - experiment_functions - INFO - Early stopping at epoch 800. Best Metrics: (0.06008329498409515, 0.036147540983606556, 0.05360073534598083)
2026-05-23 04:56:26,321 - optuna.study.study - INFO - Trial 65 finished with values: [0.06008329498409515, 0.036147540983606556, 0.05360073534598083] and parameters: {'n_layers': 1, 'embedding_dim': 32, 'lr': 0.001814498584431129, 'lambda_val': 4.915768160138094e-05, 'batch_size': 2445, 'optimizer': 'RMSprop'}.
2026-05-23 04:56:33,785 - experiment_functions - INFO - Early stopping at epoch 500. Best Metrics: (0.030497477737678323, 0.017868852459016395, 0.025338402079352788)
2026-05-23 04:56:33,880 - optuna.study.study - INFO - Trial 66 finished with values: [0.030497477737678323, 0.017868852459016395, 0.025338402079352788] and parameters: {'n_layers': 4, 'embedding_dim': 96, 'lr': 0.061625038224454844, 'lambda_val': 2.7554943772348907e-05, 'batch_size': 3864, 'optimizer': 'RMSprop'}.
2026-05-23 04:56:38,002 - experiment_functions - INFO - Early stopping at epoch 500. Best Metrics: (0.0029117689998923407, 0.002377049180327869, 0.0032714587306028665)
2026-05-23 04:56:38,199 - optuna.study.study - INFO - Trial 67 finished with values: [0.0029117689998923407, 0.002377049180327869, 0.0032714587306028665] and parameters: {'n_layers': 4, 'embedding_dim': 256, 'lr': 0.008901562085878903, 'lambda_val': 3.5614573447749906e-05, 'batch_size': 3578, 'optimizer': 'SGD'}.
2026-05-23 04:56:40,499 - experiment_functions - INFO - Early stopping at epoch 500. Best Metrics: (0.001762868983402758, 0.0015573770491803282, 0.001795032517186791)
2026-05-23 04:56:40,590 - optuna.study.study - INFO - Trial 68 finished with values: [0.001762868983402758, 0.0015573770491803282, 0.001795032517186791] and parameters: {'n_layers': 1, 'embedding_dim': 128, 'lr': 0.0027034335159540246, 'lambda_val': 0.043538493211978564, 'batch_size': 1295, 'optimizer': 'SGD'}.
2026-05-23 04:56:43,852 - experiment_functions - INFO - Early stopping at epoch 500. Best Metrics: (0.025271732278620326, 0.012459016393442624, 0.022867953291778466)
2026-05-23 04:56:43,913 - optuna.study.study - INFO - Trial 69 finished with values: [0.025271732278620326, 0.012459016393442624, 0.022867953291778466] and parameters: {'n_layers': 3, 'embedding_dim': 256, 'lr': 0.0774279273897018, 'lambda_val': 0.0010816149679677492, 'batch_size': 1950, 'optimizer': 'RMSprop'}.
2026-05-23 04:56:47,697 - experiment_functions - INFO - Early stopping at epoch 500. Best Metrics: (0.003777814038336544, 0.0018852459016393442, 0.0028166657663338326)
2026-05-23 04:56:47,788 - optuna.study.study - INFO - Trial 70 finished with values: [0.003777814038336544, 0.0018852459016393442, 0.0028166657663338326] and parameters: {'n_layers': 4, 'embedding_dim': 256, 'lr': 0.0343541086847779, 'lambda_val': 0.03830448946588032, 'batch_size': 1950, 'optimizer': 'SGD'}.
2026-05-23 04:56:50,791 - experiment_functions - INFO - Early stopping at epoch 500. Best Metrics: (0.01574175169043214, 0.006311475409836066, 0.013676037534466369)
2026-05-23 04:56:51,970 - optuna.study.study - INFO - Trial 71 finished with values: [0.01574175169043214, 0.006311475409836066, 0.013676037534466369] and parameters: {'n_layers': 4, 'embedding_dim': 96, 'lr': 0.0815330144295802, 'lambda_val': 0.010953944904227055, 'batch_size': 2135, 'optimizer': 'RMSprop'}.
2026-05-23 04:56:57,950 - experiment_functions - INFO - Early stopping at epoch 950. Best Metrics: (0.06388442594222402, 0.03573770491803279, 0.054450006128427056)
2026-05-23 04:56:58,655 - optuna.study.study - INFO - Trial 72 finished with values: [0.06388442594222402, 0.03573770491803279, 0.054450006128427056] and parameters: {'n_layers': 2, 'embedding_dim': 256, 'lr': 0.0004134349417792622, 'lambda_val': 0.0006153780524713789, 'batch_size': 3696, 'optimizer': 'Adam'}.
2026-05-23 04:57:02,045 - experiment_functions - INFO - Early stopping at epoch 850. Best Metrics: (0.022626435869554345, 0.011311475409836066, 0.017757841322595613)
2026-05-23 04:57:02,367 - optuna.study.study - INFO - Trial 73 finished with values: [0.022626435869554345, 0.011311475409836066, 0.017757841322595613] and parameters: {'n_layers': 2, 'embedding_dim': 32, 'lr': 0.017342928447992203, 'lambda_val': 0.0010816149679677492, 'batch_size': 3476, 'optimizer': 'RMSprop'}.
2026-05-23 04:57:05,763 - experiment_functions - INFO - Early stopping at epoch 550. Best Metrics: (0.04530860504576878, 0.027950819672131144, 0.03713676526787045)
2026-05-23 04:57:06,038 - optuna.study.study - INFO - Trial 74 finished with values: [0.04530860504576878, 0.027950819672131144, 0.03713676526787045] and parameters: {'n_layers': 2, 'embedding_dim': 256, 'lr': 0.0027034335159540246, 'lambda_val': 0.013762289841876453, 'batch_size': 3648, 'optimizer': 'Adam'}.
2026-05-23 04:57:11,456 - experiment_functions - INFO - Early stopping at epoch 800. Best Metrics: (0.013182899262014294, 0.01081967213114754, 0.014436994453837663)
2026-05-23 04:57:11,905 - optuna.study.study - INFO - Trial 75 finished with values: [0.013182899262014294, 0.01081967213114754, 0.014436994453837663] and parameters: {'n_layers': 3, 'embedding_dim': 128, 'lr': 0.0032256937887088586, 'lambda_val': 0.021857441898757924, 'batch_size': 686, 'optimizer': 'Adam'}.
2026-05-23 04:57:18,844 - experiment_functions - INFO - Early stopping at epoch 2200. Best Metrics: (0.03348580618760347, 0.025655737704918035, 0.03378509094441133)
2026-05-23 04:57:18,937 - optuna.study.study - INFO - Trial 76 finished with values: [0.03348580618760347, 0.025655737704918035, 0.03378509094441133] and parameters: {'n_layers': 1, 'embedding_dim': 96, 'lr': 0.061625038224454844, 'lambda_val': 0.030374414852054388, 'batch_size': 1335, 'optimizer': 'RMSprop'}.
2026-05-23 04:57:31,739 - optuna.study.study - INFO - Trial 77 finished with values: [0.08603505256331787, 0.043934426229508196, 0.07505893867497941] and parameters: {'n_layers': 1, 'embedding_dim': 64, 'lr': 0.00019262259007340505, 'lambda_val': 4.915768160138094e-05, 'batch_size': 2445, 'optimizer': 'RMSprop'}.
2026-05-23 04:57:35,380 - experiment_functions - INFO - Early stopping at epoch 500. Best Metrics: (0.029274854952826748, 0.01516393442622951, 0.028196952526889477)
2026-05-23 04:57:35,468 - optuna.study.study - INFO - Trial 78 finished with values: [0.029274854952826748, 0.01516393442622951, 0.028196952526889477] and parameters: {'n_layers': 3, 'embedding_dim': 256, 'lr': 0.03051424799989736, 'lambda_val': 3.817491759844064e-06, 'batch_size': 2763, 'optimizer': 'RMSprop'}.
2026-05-23 04:57:40,844 - experiment_functions - INFO - Early stopping at epoch 1100. Best Metrics: (0.019051754388481088, 0.011147540983606558, 0.01720448678485798)
2026-05-23 04:57:40,944 - optuna.study.study - INFO - Trial 79 finished with values: [0.019051754388481088, 0.011147540983606558, 0.01720448678485798] and parameters: {'n_layers': 3, 'embedding_dim': 128, 'lr': 0.05244400632546388, 'lambda_val': 0.0023295903200776695, 'batch_size': 1182, 'optimizer': 'Adam'}.
2026-05-23 04:57:43,987 - experiment_functions - INFO - Early stopping at epoch 600. Best Metrics: (0.03411305130911892, 0.016639344262295082, 0.02761029494994952)
2026-05-23 04:57:45,036 - optuna.study.study - INFO - Trial 80 finished with values: [0.03411305130911892, 0.016639344262295082, 0.02761029494994952] and parameters: {'n_layers': 2, 'embedding_dim': 96, 'lr': 0.007629002645455095, 'lambda_val': 8.668980017012997e-05, 'batch_size': 4027, 'optimizer': 'RMSprop'}.
2026-05-23 04:57:49,207 - experiment_functions - INFO - Early stopping at epoch 950. Best Metrics: (0.05722300119296708, 0.03950819672131148, 0.05566653972579396)
2026-05-23 04:57:49,531 - optuna.study.study - INFO - Trial 81 finished with values: [0.05722300119296708, 0.03950819672131148, 0.05566653972579396] and parameters: {'n_layers': 1, 'embedding_dim': 256, 'lr': 0.0004134349417792622, 'lambda_val': 0.030374414852054388, 'batch_size': 1182, 'optimizer': 'RMSprop'}.
2026-05-23 04:57:52,184 - experiment_functions - INFO - Early stopping at epoch 600. Best Metrics: (0.061949074041746446, 0.03622950819672131, 0.06036035655623401)
2026-05-23 04:57:52,294 - optuna.study.study - INFO - Trial 82 finished with values: [0.061949074041746446, 0.03622950819672131, 0.06036035655623401] and parameters: {'n_layers': 1, 'embedding_dim': 32, 'lr': 0.0032256937887088586, 'lambda_val': 0.021857441898757924, 'batch_size': 514, 'optimizer': 'Adam'}.
2026-05-23 04:57:54,725 - experiment_functions - INFO - Early stopping at epoch 650. Best Metrics: (0.08131317880350106, 0.03950819672131148, 0.06930255602366277)
2026-05-23 04:57:54,806 - optuna.study.study - INFO - Trial 83 finished with values: [0.08131317880350106, 0.03950819672131148, 0.06930255602366277] and parameters: {'n_layers': 1, 'embedding_dim': 32, 'lr': 0.0032256937887088586, 'lambda_val': 1.2213470032695958e-05, 'batch_size': 1291, 'optimizer': 'RMSprop'}.
2026-05-23 04:57:58,499 - experiment_functions - INFO - Early stopping at epoch 850. Best Metrics: (0.020457772119009166, 0.008196721311475412, 0.014791178931642479)
