2026-05-23 00:47:41,682 - optuna.study.study - INFO - Trial 0 finished with values: [0.0029472151005674758, 0.0034426229508196723, 0.00386661708698401] and parameters: {'n_layers': 4, 'embedding_dim': 256, 'lr': 2.299547835261009e-05, 'lambda_val': 0.011470733297102229, 'batch_size': 4087, 'optimizer': 'Adam'}.
2026-05-23 00:47:45,521 - experiment_functions - INFO - Early stopping at epoch 900. Best Metrics: (0.012379512244194214, 0.007049180327868854, 0.009731200656680065)
2026-05-23 00:47:45,611 - optuna.study.study - INFO - Trial 1 finished with values: [0.012379512244194214, 0.007049180327868854, 0.009731200656680065] and parameters: {'n_layers': 2, 'embedding_dim': 256, 'lr': 0.05454572929251441, 'lambda_val': 0.004686874294387785, 'batch_size': 2156, 'optimizer': 'Adam'}.
2026-05-23 00:47:57,068 - experiment_functions - INFO - Early stopping at epoch 3750. Best Metrics: (0.004405784085829313, 0.0030327868852459017, 0.0046500871369306775)
2026-05-23 00:47:57,831 - optuna.study.study - INFO - Trial 2 finished with values: [0.004405784085829313, 0.0030327868852459017, 0.0046500871369306775] and parameters: {'n_layers': 3, 'embedding_dim': 64, 'lr': 1.9503235599935387e-05, 'lambda_val': 0.0022202936595299566, 'batch_size': 4024, 'optimizer': 'RMSprop'}.
2026-05-23 00:48:00,973 - experiment_functions - INFO - Early stopping at epoch 650. Best Metrics: (0.02677270433457895, 0.017295081967213115, 0.02518120845184388)
2026-05-23 00:48:01,860 - optuna.study.study - INFO - Trial 3 finished with values: [0.02677270433457895, 0.017295081967213115, 0.02518120845184388] and parameters: {'n_layers': 3, 'embedding_dim': 256, 'lr': 0.0007442610977334545, 'lambda_val': 0.0005699959841252275, 'batch_size': 1254, 'optimizer': 'RMSprop'}.
2026-05-23 00:48:04,212 - experiment_functions - INFO - Early stopping at epoch 500. Best Metrics: (0.002144998067248012, 0.0015573770491803278, 0.0024513778448839608)
2026-05-23 00:48:04,999 - optuna.study.study - INFO - Trial 4 finished with values: [0.002144998067248012, 0.0015573770491803278, 0.0024513778448839608] and parameters: {'n_layers': 4, 'embedding_dim': 128, 'lr': 1.7247935677155384e-05, 'lambda_val': 1.0103747332028432e-06, 'batch_size': 1816, 'optimizer': 'SGD'}.
2026-05-23 00:48:10,636 - experiment_functions - INFO - Early stopping at epoch 1550. Best Metrics: (0.0028616931737391904, 0.0021311475409836068, 0.0030421328695517027)
2026-05-23 00:48:10,733 - optuna.study.study - INFO - Trial 5 finished with values: [0.0028616931737391904, 0.0021311475409836068, 0.0030421328695517027] and parameters: {'n_layers': 4, 'embedding_dim': 32, 'lr': 1.4745003367411473e-05, 'lambda_val': 1.2906405560114349e-06, 'batch_size': 2394, 'optimizer': 'RMSprop'}.
2026-05-23 00:48:14,802 - experiment_functions - INFO - Early stopping at epoch 1200. Best Metrics: (0.009692897087941774, 0.007540983606557377, 0.010590676443612817)
2026-05-23 00:48:14,897 - optuna.study.study - INFO - Trial 6 finished with values: [0.009692897087941774, 0.007540983606557377, 0.010590676443612817] and parameters: {'n_layers': 3, 'embedding_dim': 32, 'lr': 0.08325120475310396, 'lambda_val': 4.0186579890517005e-06, 'batch_size': 1426, 'optimizer': 'Adam'}.
2026-05-23 00:48:16,981 - experiment_functions - INFO - Early stopping at epoch 500. Best Metrics: (0.0019387691030366015, 0.0018032786885245904, 0.002103974248348716)
2026-05-23 00:48:17,119 - optuna.study.study - INFO - Trial 7 finished with values: [0.0019387691030366015, 0.0018032786885245904, 0.002103974248348716] and parameters: {'n_layers': 1, 'embedding_dim': 96, 'lr': 0.00012092720978028936, 'lambda_val': 6.0828291105846935e-05, 'batch_size': 597, 'optimizer': 'SGD'}.
2026-05-23 00:48:19,573 - experiment_functions - INFO - Early stopping at epoch 550. Best Metrics: (0.006067664595293666, 0.005491803278688524, 0.007321818667366992)
2026-05-23 00:48:19,669 - optuna.study.study - INFO - Trial 8 finished with values: [0.006067664595293666, 0.005491803278688524, 0.007321818667366992] and parameters: {'n_layers': 4, 'embedding_dim': 64, 'lr': 0.0027798096743762773, 'lambda_val': 0.006755542828576923, 'batch_size': 2454, 'optimizer': 'RMSprop'}.
2026-05-23 00:48:22,703 - experiment_functions - INFO - Early stopping at epoch 700. Best Metrics: (0.021521412146985972, 0.013770491803278693, 0.018952939316013495)
2026-05-23 00:48:22,788 - optuna.study.study - INFO - Trial 9 finished with values: [0.021521412146985972, 0.013770491803278693, 0.018952939316013495] and parameters: {'n_layers': 3, 'embedding_dim': 64, 'lr': 0.0004908910385795771, 'lambda_val': 0.021707008087328228, 'batch_size': 2979, 'optimizer': 'RMSprop'}.
2026-05-23 00:48:24,857 - experiment_functions - INFO - Early stopping at epoch 500. Best Metrics: (0.0013631728789927295, 0.001639344262295082, 0.0019696481480033835)
2026-05-23 00:48:24,956 - optuna.study.study - INFO - Trial 10 finished with values: [0.0013631728789927295, 0.001639344262295082, 0.0019696481480033835] and parameters: {'n_layers': 1, 'embedding_dim': 32, 'lr': 0.005611868685167141, 'lambda_val': 7.376845066520137e-05, 'batch_size': 1486, 'optimizer': 'SGD'}.
2026-05-23 00:48:28,496 - experiment_functions - INFO - Early stopping at epoch 800. Best Metrics: (0.028018600461873037, 0.017540983606557377, 0.026639987207193454)
2026-05-23 00:48:28,584 - optuna.study.study - INFO - Trial 11 finished with values: [0.028018600461873037, 0.017540983606557377, 0.026639987207193454] and parameters: {'n_layers': 2, 'embedding_dim': 64, 'lr': 0.0007586035361839872, 'lambda_val': 0.0001031838170332706, 'batch_size': 2410, 'optimizer': 'RMSprop'}.
2026-05-23 00:48:44,341 - experiment_functions - INFO - Early stopping at epoch 3750. Best Metrics: (0.005413194672765257, 0.00418032786885246, 0.0058536799146585525)
2026-05-23 00:48:45,101 - optuna.study.study - INFO - Trial 12 finished with values: [0.005413194672765257, 0.00418032786885246, 0.0058536799146585525] and parameters: {'n_layers': 1, 'embedding_dim': 256, 'lr': 5.9557953840550475e-05, 'lambda_val': 0.00012517387739655414, 'batch_size': 1252, 'optimizer': 'RMSprop'}.
2026-05-23 00:48:47,718 - experiment_functions - INFO - Early stopping at epoch 550. Best Metrics: (0.022383350022860224, 0.013442622950819674, 0.018949497124018416)
2026-05-23 00:48:47,806 - optuna.study.study - INFO - Trial 13 finished with values: [0.022383350022860224, 0.013442622950819674, 0.018949497124018416] and parameters: {'n_layers': 4, 'embedding_dim': 128, 'lr': 0.0012673220264025206, 'lambda_val': 0.0007449565466447987, 'batch_size': 1639, 'optimizer': 'RMSprop'}.
2026-05-23 00:48:52,039 - experiment_functions - INFO - Early stopping at epoch 1200. Best Metrics: (0.032803282716224166, 0.019836065573770493, 0.027743742039157727)
2026-05-23 00:48:52,135 - optuna.study.study - INFO - Trial 14 finished with values: [0.032803282716224166, 0.019836065573770493, 0.027743742039157727] and parameters: {'n_layers': 3, 'embedding_dim': 96, 'lr': 0.00034335523469639003, 'lambda_val': 0.0007172417291421626, 'batch_size': 1304, 'optimizer': 'Adam'}.
2026-05-23 00:48:54,542 - experiment_functions - INFO - Early stopping at epoch 550. Best Metrics: (0.017620333148830682, 0.010983606557377049, 0.01611189884684653)
2026-05-23 00:48:54,627 - optuna.study.study - INFO - Trial 15 finished with values: [0.017620333148830682, 0.010983606557377049, 0.01611189884684653] and parameters: {'n_layers': 2, 'embedding_dim': 96, 'lr': 0.0018845351019360292, 'lambda_val': 0.02068841888151619, 'batch_size': 1468, 'optimizer': 'RMSprop'}.
2026-05-23 00:48:57,018 - experiment_functions - INFO - Early stopping at epoch 600. Best Metrics: (0.0015226523550811654, 0.0020491803278688526, 0.002130203359588429)
2026-05-23 00:48:57,158 - optuna.study.study - INFO - Trial 16 finished with values: [0.0015226523550811654, 0.0020491803278688526, 0.002130203359588429] and parameters: {'n_layers': 1, 'embedding_dim': 96, 'lr': 0.08544861628870072, 'lambda_val': 0.0005075007351723118, 'batch_size': 3359, 'optimizer': 'SGD'}.
2026-05-23 00:48:59,884 - experiment_functions - INFO - Early stopping at epoch 500. Best Metrics: (0.0031887014035839527, 0.0021311475409836068, 0.002671151358128979)
2026-05-23 00:48:59,971 - optuna.study.study - INFO - Trial 17 finished with values: [0.0031887014035839527, 0.0021311475409836068, 0.002671151358128979] and parameters: {'n_layers': 4, 'embedding_dim': 256, 'lr': 0.0017367055415770025, 'lambda_val': 0.0002862773838710965, 'batch_size': 1514, 'optimizer': 'SGD'}.
2026-05-23 00:49:03,523 - experiment_functions - INFO - Early stopping at epoch 850. Best Metrics: (0.0017015316611281824, 0.0018032786885245904, 0.002178849278065042)
2026-05-23 00:49:03,627 - optuna.study.study - INFO - Trial 18 finished with values: [0.0017015316611281824, 0.0018032786885245904, 0.002178849278065042] and parameters: {'n_layers': 4, 'embedding_dim': 128, 'lr': 0.054071408644872025, 'lambda_val': 0.04122169585522084, 'batch_size': 3519, 'optimizer': 'SGD'}.
2026-05-23 00:49:08,579 - experiment_functions - INFO - Early stopping at epoch 1300. Best Metrics: (0.014649121715319081, 0.007868852459016395, 0.011870808761510107)
2026-05-23 00:49:08,827 - optuna.study.study - INFO - Trial 19 finished with values: [0.014649121715319081, 0.007868852459016395, 0.011870808761510107] and parameters: {'n_layers': 4, 'embedding_dim': 128, 'lr': 0.010166696672717489, 'lambda_val': 2.038559126285539e-06, 'batch_size': 1996, 'optimizer': 'Adam'}.
2026-05-23 00:49:15,864 - experiment_functions - INFO - Early stopping at epoch 1200. Best Metrics: (0.013300063000232221, 0.010983606557377049, 0.014979736687425296)
2026-05-23 00:49:16,320 - optuna.study.study - INFO - Trial 20 finished with values: [0.013300063000232221, 0.010983606557377049, 0.014979736687425296] and parameters: {'n_layers': 3, 'embedding_dim': 96, 'lr': 0.00037164008089034755, 'lambda_val': 0.05198557064802391, 'batch_size': 1079, 'optimizer': 'Adam'}.
2026-05-23 00:49:23,709 - experiment_functions - INFO - Early stopping at epoch 500. Best Metrics: (0.0008714793230726051, 0.0013114754098360656, 0.00139873499168165)
2026-05-23 00:49:24,261 - optuna.study.study - INFO - Trial 21 finished with values: [0.0008714793230726051, 0.0013114754098360656, 0.00139873499168165] and parameters: {'n_layers': 3, 'embedding_dim': 96, 'lr': 0.00037668262170108415, 'lambda_val': 0.01898559526463911, 'batch_size': 3032, 'optimizer': 'SGD'}.
2026-05-23 00:49:28,154 - experiment_functions - INFO - Early stopping at epoch 550. Best Metrics: (0.002592843025812028, 0.0014754098360655738, 0.0018983026237809446)
2026-05-23 00:49:28,285 - optuna.study.study - INFO - Trial 22 finished with values: [0.002592843025812028, 0.0014754098360655738, 0.0018983026237809446] and parameters: {'n_layers': 4, 'embedding_dim': 32, 'lr': 0.06558798695996301, 'lambda_val': 0.0068901224683239, 'batch_size': 3761, 'optimizer': 'SGD'}.
2026-05-23 00:49:32,451 - experiment_functions - INFO - Early stopping at epoch 1450. Best Metrics: (0.0018480673529666697, 0.0019672131147540984, 0.003049018293414376)
2026-05-23 00:49:32,895 - optuna.study.study - INFO - Trial 23 finished with values: [0.0018480673529666697, 0.0019672131147540984, 0.003049018293414376] and parameters: {'n_layers': 1, 'embedding_dim': 32, 'lr': 0.027771684405938586, 'lambda_val': 0.005455713679342844, 'batch_size': 1192, 'optimizer': 'SGD'}.
2026-05-23 00:49:36,692 - experiment_functions - INFO - Early stopping at epoch 1100. Best Metrics: (0.019648609409356015, 0.013114754098360656, 0.020189243903653495)
2026-05-23 00:49:36,859 - optuna.study.study - INFO - Trial 24 finished with values: [0.019648609409356015, 0.013114754098360656, 0.020189243903653495] and parameters: {'n_layers': 1, 'embedding_dim': 96, 'lr': 0.012999472865203938, 'lambda_val': 4.838531142366333e-06, 'batch_size': 2675, 'optimizer': 'RMSprop'}.
2026-05-23 00:49:39,100 - experiment_functions - INFO - Early stopping at epoch 500. Best Metrics: (0.000808723223937528, 0.0011475409836065576, 0.001117945478785751)
2026-05-23 00:49:39,183 - optuna.study.study - INFO - Trial 25 finished with values: [0.000808723223937528, 0.0011475409836065576, 0.001117945478785751] and parameters: {'n_layers': 2, 'embedding_dim': 96, 'lr': 0.004413457240809386, 'lambda_val': 0.000601816554588929, 'batch_size': 2429, 'optimizer': 'SGD'}.
2026-05-23 00:49:45,876 - experiment_functions - INFO - Early stopping at epoch 2150. Best Metrics: (0.03902166206821252, 0.019098360655737705, 0.029974741745155725)
2026-05-23 00:49:45,956 - optuna.study.study - INFO - Trial 26 finished with values: [0.03902166206821252, 0.019098360655737705, 0.029974741745155725] and parameters: {'n_layers': 1, 'embedding_dim': 96, 'lr': 0.0004014419530027751, 'lambda_val': 1.2051712435160432e-05, 'batch_size': 2831, 'optimizer': 'Adam'}.
2026-05-23 00:49:49,638 - experiment_functions - INFO - Early stopping at epoch 900. Best Metrics: (0.02377973891092043, 0.014426229508196723, 0.022773515807909674)
2026-05-23 00:49:50,061 - optuna.study.study - INFO - Trial 27 finished with values: [0.02377973891092043, 0.014426229508196723, 0.022773515807909674] and parameters: {'n_layers': 4, 'embedding_dim': 64, 'lr': 0.0004975305503445845, 'lambda_val': 0.00053956191152972, 'batch_size': 3096, 'optimizer': 'Adam'}.
2026-05-23 00:49:52,267 - experiment_functions - INFO - Early stopping at epoch 500. Best Metrics: (0.0009760481211702343, 0.0013114754098360656, 0.0014275551205382567)
2026-05-23 00:49:52,351 - optuna.study.study - INFO - Trial 28 finished with values: [0.0009760481211702343, 0.0013114754098360656, 0.0014275551205382567] and parameters: {'n_layers': 1, 'embedding_dim': 128, 'lr': 0.004041666457497854, 'lambda_val': 0.00015376591496455786, 'batch_size': 1604, 'optimizer': 'SGD'}.
2026-05-23 00:49:55,595 - experiment_functions - INFO - Early stopping at epoch 900. Best Metrics: (0.00456525199022098, 0.001967213114754099, 0.003151652090457605)
2026-05-23 00:49:55,692 - optuna.study.study - INFO - Trial 29 finished with values: [0.00456525199022098, 0.001967213114754099, 0.003151652090457605] and parameters: {'n_layers': 1, 'embedding_dim': 96, 'lr': 0.05724683374134346, 'lambda_val': 3.7879359633347e-05, 'batch_size': 3280, 'optimizer': 'SGD'}.
2026-05-23 00:49:58,901 - experiment_functions - INFO - Early stopping at epoch 650. Best Metrics: (0.007297328905256425, 0.00540983606557377, 0.007517894813183305)
2026-05-23 00:49:59,035 - optuna.study.study - INFO - Trial 30 finished with values: [0.007297328905256425, 0.00540983606557377, 0.007517894813183305] and parameters: {'n_layers': 2, 'embedding_dim': 96, 'lr': 0.07286124567317281, 'lambda_val': 0.024269426427970246, 'batch_size': 3664, 'optimizer': 'Adam'}.
2026-05-23 00:50:01,243 - experiment_functions - INFO - Early stopping at epoch 500. Best Metrics: (0.0030522948685931515, 0.0022950819672131148, 0.003730985220285108)
2026-05-23 00:50:01,334 - optuna.study.study - INFO - Trial 31 finished with values: [0.0030522948685931515, 0.0022950819672131148, 0.003730985220285108] and parameters: {'n_layers': 1, 'embedding_dim': 256, 'lr': 2.2873614997948058e-05, 'lambda_val': 0.00022914216691435863, 'batch_size': 1005, 'optimizer': 'SGD'}.
2026-05-23 00:50:10,703 - experiment_functions - INFO - Early stopping at epoch 1650. Best Metrics: (0.002934359995380315, 0.0028688524590163933, 0.0037104440596058947)
2026-05-23 00:50:11,794 - optuna.study.study - INFO - Trial 32 finished with values: [0.002934359995380315, 0.0028688524590163933, 0.0037104440596058947] and parameters: {'n_layers': 1, 'embedding_dim': 96, 'lr': 2.2902320528471964e-05, 'lambda_val': 4.794618333881492e-05, 'batch_size': 4026, 'optimizer': 'RMSprop'}.
2026-05-23 00:50:18,185 - experiment_functions - INFO - Early stopping at epoch 1800. Best Metrics: (0.0083446681982467, 0.006229508196721311, 0.009180288560158094)
2026-05-23 00:50:18,294 - optuna.study.study - INFO - Trial 33 finished with values: [0.0083446681982467, 0.006229508196721311, 0.009180288560158094] and parameters: {'n_layers': 4, 'embedding_dim': 32, 'lr': 0.03553426949359535, 'lambda_val': 0.00012613790017959958, 'batch_size': 2448, 'optimizer': 'Adam'}.
2026-05-23 00:50:20,896 - experiment_functions - INFO - Early stopping at epoch 650. Best Metrics: (0.024717907016209947, 0.01680327868852459, 0.02385496267785191)
2026-05-23 00:50:21,275 - optuna.study.study - INFO - Trial 34 finished with values: [0.024717907016209947, 0.01680327868852459, 0.02385496267785191] and parameters: {'n_layers': 1, 'embedding_dim': 96, 'lr': 0.002823327203965183, 'lambda_val': 8.923547676789324e-05, 'batch_size': 3681, 'optimizer': 'Adam'}.
2026-05-23 00:50:25,880 - experiment_functions - INFO - Early stopping at epoch 1250. Best Metrics: (0.009950480544553407, 0.007295081967213115, 0.011033879810479567)
2026-05-23 00:50:26,305 - optuna.study.study - INFO - Trial 35 finished with values: [0.009950480544553407, 0.007295081967213115, 0.011033879810479567] and parameters: {'n_layers': 3, 'embedding_dim': 128, 'lr': 0.02897541499896247, 'lambda_val': 0.0001881821577453545, 'batch_size': 819, 'optimizer': 'Adam'}.
2026-05-23 00:50:28,831 - experiment_functions - INFO - Early stopping at epoch 550. Best Metrics: (0.024663863839163212, 0.014016393442622952, 0.02198631699442532)
2026-05-23 00:50:28,910 - optuna.study.study - INFO - Trial 36 finished with values: [0.024663863839163212, 0.014016393442622952, 0.02198631699442532] and parameters: {'n_layers': 4, 'embedding_dim': 96, 'lr': 0.004218807542385418, 'lambda_val': 0.0006167459118972293, 'batch_size': 2873, 'optimizer': 'Adam'}.
2026-05-23 00:50:30,966 - experiment_functions - INFO - Early stopping at epoch 500. Best Metrics: (0.0021711038792919086, 0.0013934426229508198, 0.0016330683993467396)
2026-05-23 00:50:31,101 - optuna.study.study - INFO - Trial 37 finished with values: [0.0021711038792919086, 0.0013934426229508198, 0.0016330683993467396] and parameters: {'n_layers': 1, 'embedding_dim': 64, 'lr': 9.292602357246689e-05, 'lambda_val': 0.0015316223250778048, 'batch_size': 556, 'optimizer': 'SGD'}.
2026-05-23 00:50:33,727 - experiment_functions - INFO - Early stopping at epoch 500. Best Metrics: (0.0013618101722305106, 0.001557377049180328, 0.0021652670062015096)
2026-05-23 00:50:33,875 - optuna.study.study - INFO - Trial 38 finished with values: [0.0013618101722305106, 0.001557377049180328, 0.0021652670062015096] and parameters: {'n_layers': 4, 'embedding_dim': 96, 'lr': 0.00020345967561145935, 'lambda_val': 1.015273791496844e-06, 'batch_size': 1098, 'optimizer': 'SGD'}.
2026-05-23 00:50:36,880 - experiment_functions - INFO - Early stopping at epoch 500. Best Metrics: (0.00174771603341532, 0.0018032786885245904, 0.002755240251151697)
2026-05-23 00:50:36,986 - optuna.study.study - INFO - Trial 39 finished with values: [0.00174771603341532, 0.0018032786885245904, 0.002755240251151697] and parameters: {'n_layers': 1, 'embedding_dim': 256, 'lr': 1.134131653322191e-05, 'lambda_val': 1.3784461683317798e-06, 'batch_size': 3069, 'optimizer': 'SGD'}.
2026-05-23 00:50:40,546 - experiment_functions - INFO - Early stopping at epoch 1200. Best Metrics: (0.01479340369276652, 0.010081967213114754, 0.01486391436416011)
2026-05-23 00:50:40,623 - optuna.study.study - INFO - Trial 40 finished with values: [0.01479340369276652, 0.010081967213114754, 0.01486391436416011] and parameters: {'n_layers': 1, 'embedding_dim': 64, 'lr': 0.026138874490899314, 'lambda_val': 5.5532012635423735e-06, 'batch_size': 2122, 'optimizer': 'RMSprop'}.
2026-05-23 00:50:43,029 - experiment_functions - INFO - Early stopping at epoch 550. Best Metrics: (0.02531791568289763, 0.01418032786885246, 0.021486444166294076)
2026-05-23 00:50:43,112 - optuna.study.study - INFO - Trial 41 finished with values: [0.02531791568289763, 0.01418032786885246, 0.021486444166294076] and parameters: {'n_layers': 3, 'embedding_dim': 128, 'lr': 0.0030767169926472077, 'lambda_val': 6.335945209609284e-06, 'batch_size': 1623, 'optimizer': 'Adam'}.
2026-05-23 00:50:45,881 - experiment_functions - INFO - Early stopping at epoch 700. Best Metrics: (0.026630552409590443, 0.017049180327868858, 0.02394398786033862)
2026-05-23 00:50:45,966 - optuna.study.study - INFO - Trial 42 finished with values: [0.026630552409590443, 0.017049180327868858, 0.02394398786033862] and parameters: {'n_layers': 4, 'embedding_dim': 96, 'lr': 0.0008732317857197807, 'lambda_val': 5.472243143002854e-05, 'batch_size': 3011, 'optimizer': 'Adam'}.
2026-05-23 00:50:51,855 - experiment_functions - INFO - Early stopping at epoch 2200. Best Metrics: (0.012226792484459601, 0.008852459016393444, 0.011883775538500169)
2026-05-23 00:50:52,644 - optuna.study.study - INFO - Trial 43 finished with values: [0.012226792484459601, 0.008852459016393444, 0.011883775538500169] and parameters: {'n_layers': 4, 'embedding_dim': 64, 'lr': 0.0001356272514557574, 'lambda_val': 0.042606469172947255, 'batch_size': 2080, 'optimizer': 'Adam'}.
2026-05-23 00:50:56,105 - experiment_functions - INFO - Early stopping at epoch 500. Best Metrics: (0.002297797869172974, 0.0021311475409836068, 0.0023858023966020544)
2026-05-23 00:50:56,510 - optuna.study.study - INFO - Trial 44 finished with values: [0.002297797869172974, 0.0021311475409836068, 0.0023858023966020544] and parameters: {'n_layers': 3, 'embedding_dim': 32, 'lr': 8.913283574158017e-05, 'lambda_val': 0.0002006249663471649, 'batch_size': 1001, 'optimizer': 'SGD'}.
2026-05-23 00:51:06,014 - experiment_functions - INFO - Early stopping at epoch 2000. Best Metrics: (0.02730329085259838, 0.017540983606557377, 0.025286945571217162)
