2026-05-23 01:28:22,570 - optuna.study.study - INFO - Trial 207 finished with values: [0.028209922768752733, 0.018032786885245903, 0.02454990177441114] and parameters: {'n_layers': 1, 'embedding_dim': 96, 'lr': 0.00037298587418552697, 'lambda_val': 0.005804938451008042, 'batch_size': 2030, 'optimizer': 'Adam'}.
2026-05-23 01:28:33,704 - experiment_functions - INFO - Early stopping at epoch 3850. Best Metrics: (0.012356320997883342, 0.006639344262295083, 0.010329379124040475)
2026-05-23 01:28:34,041 - optuna.study.study - INFO - Trial 208 finished with values: [0.012356320997883342, 0.006639344262295083, 0.010329379124040475] and parameters: {'n_layers': 2, 'embedding_dim': 32, 'lr': 0.0001630703519000999, 'lambda_val': 0.002510988429844692, 'batch_size': 542, 'optimizer': 'Adam'}.
2026-05-23 01:28:37,243 - experiment_functions - INFO - Early stopping at epoch 800. Best Metrics: (0.035446158514655816, 0.019344262295081967, 0.029560733284063185)
2026-05-23 01:28:37,329 - optuna.study.study - INFO - Trial 209 finished with values: [0.035446158514655816, 0.019344262295081967, 0.029560733284063185] and parameters: {'n_layers': 3, 'embedding_dim': 96, 'lr': 0.0006237069115447143, 'lambda_val': 0.004280757702424935, 'batch_size': 1031, 'optimizer': 'Adam'}.
2026-05-23 01:28:44,188 - experiment_functions - INFO - Early stopping at epoch 2300. Best Metrics: (0.0050421953598311555, 0.005491803278688525, 0.006991071841931556)
2026-05-23 01:28:45,342 - optuna.study.study - INFO - Trial 210 finished with values: [0.0050421953598311555, 0.005491803278688525, 0.006991071841931556] and parameters: {'n_layers': 1, 'embedding_dim': 64, 'lr': 0.00011452860495621292, 'lambda_val': 0.0004948769403467439, 'batch_size': 3061, 'optimizer': 'RMSprop'}.
2026-05-23 01:28:56,356 - experiment_functions - INFO - Early stopping at epoch 3200. Best Metrics: (0.030878781067556264, 0.01672131147540984, 0.024812234129612507)
2026-05-23 01:28:57,244 - optuna.study.study - INFO - Trial 211 finished with values: [0.030878781067556264, 0.01672131147540984, 0.024812234129612507] and parameters: {'n_layers': 1, 'embedding_dim': 32, 'lr': 0.0006071804751429957, 'lambda_val': 0.00014297366550674857, 'batch_size': 1031, 'optimizer': 'Adam'}.
2026-05-23 01:28:59,640 - experiment_functions - INFO - Early stopping at epoch 600. Best Metrics: (0.02868406305727259, 0.01819672131147541, 0.027878584884114845)
2026-05-23 01:28:59,902 - optuna.study.study - INFO - Trial 212 finished with values: [0.02868406305727259, 0.01819672131147541, 0.027878584884114845] and parameters: {'n_layers': 1, 'embedding_dim': 96, 'lr': 0.00736079824955284, 'lambda_val': 7.202525708659488e-05, 'batch_size': 1088, 'optimizer': 'Adam'}.
2026-05-23 01:29:02,766 - experiment_functions - INFO - Early stopping at epoch 750. Best Metrics: (0.012662901415613124, 0.007704918032786886, 0.011179372557429818)
2026-05-23 01:29:02,855 - optuna.study.study - INFO - Trial 213 finished with values: [0.012662901415613124, 0.007704918032786886, 0.011179372557429818] and parameters: {'n_layers': 2, 'embedding_dim': 32, 'lr': 0.03650165655360922, 'lambda_val': 0.0004948769403467439, 'batch_size': 542, 'optimizer': 'RMSprop'}.
2026-05-23 01:29:08,794 - experiment_functions - INFO - Early stopping at epoch 1950. Best Metrics: (0.032799031911469274, 0.018114754098360657, 0.02902890848160107)
2026-05-23 01:29:09,278 - optuna.study.study - INFO - Trial 214 finished with values: [0.032799031911469274, 0.018114754098360657, 0.02902890848160107] and parameters: {'n_layers': 1, 'embedding_dim': 64, 'lr': 0.0006071804751429957, 'lambda_val': 0.00012261737938750884, 'batch_size': 1088, 'optimizer': 'RMSprop'}.
2026-05-23 01:29:12,937 - experiment_functions - INFO - Early stopping at epoch 950. Best Metrics: (0.03176846694703787, 0.016639344262295082, 0.0280190257913257)
2026-05-23 01:29:13,029 - optuna.study.study - INFO - Trial 215 finished with values: [0.03176846694703787, 0.016639344262295082, 0.0280190257913257] and parameters: {'n_layers': 2, 'embedding_dim': 96, 'lr': 0.0006071804751429957, 'lambda_val': 1.150702232586112e-06, 'batch_size': 3538, 'optimizer': 'RMSprop'}.
2026-05-23 01:29:16,942 - experiment_functions - INFO - Early stopping at epoch 1100. Best Metrics: (0.04070569184982047, 0.02098360655737705, 0.0327511267556986)
2026-05-23 01:29:17,054 - optuna.study.study - INFO - Trial 216 finished with values: [0.04070569184982047, 0.02098360655737705, 0.0327511267556986] and parameters: {'n_layers': 3, 'embedding_dim': 64, 'lr': 0.000496802361339361, 'lambda_val': 1.150702232586112e-06, 'batch_size': 1031, 'optimizer': 'RMSprop'}.
2026-05-23 01:29:20,628 - experiment_functions - INFO - Early stopping at epoch 950. Best Metrics: (0.03204143677045269, 0.018278688524590164, 0.02953176299186006)
2026-05-23 01:29:20,734 - optuna.study.study - INFO - Trial 217 finished with values: [0.03204143677045269, 0.018278688524590164, 0.02953176299186006] and parameters: {'n_layers': 2, 'embedding_dim': 64, 'lr': 0.0006071804751429957, 'lambda_val': 4.709336823209938e-05, 'batch_size': 4030, 'optimizer': 'Adam'}.
2026-05-23 01:29:23,571 - experiment_functions - INFO - Early stopping at epoch 550. Best Metrics: (0.01907484800986598, 0.012704918032786885, 0.01883323170283011)
2026-05-23 01:29:24,543 - optuna.study.study - INFO - Trial 218 finished with values: [0.01907484800986598, 0.012704918032786885, 0.01883323170283011] and parameters: {'n_layers': 1, 'embedding_dim': 96, 'lr': 0.010275728897055822, 'lambda_val': 0.0009323274124990124, 'batch_size': 1031, 'optimizer': 'RMSprop'}.
2026-05-23 01:29:27,504 - experiment_functions - INFO - Early stopping at epoch 550. Best Metrics: (0.017140554099240642, 0.009426229508196722, 0.013387508396404837)
2026-05-23 01:29:27,818 - optuna.study.study - INFO - Trial 219 finished with values: [0.017140554099240642, 0.009426229508196722, 0.013387508396404837] and parameters: {'n_layers': 2, 'embedding_dim': 32, 'lr': 0.0054017846217753514, 'lambda_val': 0.00851496936328099, 'batch_size': 3085, 'optimizer': 'RMSprop'}.
2026-05-23 01:29:42,938 - optuna.study.study - INFO - Trial 220 finished with values: [0.022947928418909833, 0.013688524590163934, 0.02067175599219661] and parameters: {'n_layers': 1, 'embedding_dim': 32, 'lr': 0.00037298587418552697, 'lambda_val': 1.231305276419093e-06, 'batch_size': 1445, 'optimizer': 'Adam'}.
2026-05-23 01:29:45,861 - experiment_functions - INFO - Early stopping at epoch 550. Best Metrics: (0.029009831470074972, 0.017049180327868854, 0.0276204779306579)
2026-05-23 01:29:46,974 - optuna.study.study - INFO - Trial 221 finished with values: [0.029009831470074972, 0.017049180327868854, 0.0276204779306579] and parameters: {'n_layers': 3, 'embedding_dim': 96, 'lr': 0.0054017846217753514, 'lambda_val': 1.150702232586112e-06, 'batch_size': 542, 'optimizer': 'Adam'}.
2026-05-23 01:29:57,892 - experiment_functions - INFO - Early stopping at epoch 2500. Best Metrics: (0.035192684958312855, 0.019098360655737705, 0.03120032727001311)
2026-05-23 01:29:59,423 - optuna.study.study - INFO - Trial 222 finished with values: [0.035192684958312855, 0.019098360655737705, 0.03120032727001311] and parameters: {'n_layers': 3, 'embedding_dim': 96, 'lr': 0.0002386554512236704, 'lambda_val': 3.599619235549841e-05, 'batch_size': 3064, 'optimizer': 'Adam'}.
2026-05-23 01:30:06,459 - experiment_functions - INFO - Early stopping at epoch 1750. Best Metrics: (0.036145950746299386, 0.02073770491803279, 0.028827765761217216)
2026-05-23 01:30:06,553 - optuna.study.study - INFO - Trial 223 finished with values: [0.036145950746299386, 0.02073770491803279, 0.028827765761217216] and parameters: {'n_layers': 2, 'embedding_dim': 96, 'lr': 0.0004599021655017754, 'lambda_val': 0.0008549330936180361, 'batch_size': 1031, 'optimizer': 'Adam'}.
2026-05-23 01:30:14,553 - experiment_functions - INFO - Early stopping at epoch 1900. Best Metrics: (0.029120250872706522, 0.017868852459016392, 0.0256961623787438)
2026-05-23 01:30:14,933 - optuna.study.study - INFO - Trial 224 finished with values: [0.029120250872706522, 0.017868852459016392, 0.0256961623787438] and parameters: {'n_layers': 3, 'embedding_dim': 96, 'lr': 0.0002386554512236704, 'lambda_val': 0.00016867595805103173, 'batch_size': 1554, 'optimizer': 'RMSprop'}.
2026-05-23 01:30:18,405 - experiment_functions - INFO - Early stopping at epoch 600. Best Metrics: (0.03022014914941154, 0.0169672131147541, 0.02594483981251421)
2026-05-23 01:30:18,504 - optuna.study.study - INFO - Trial 225 finished with values: [0.03022014914941154, 0.0169672131147541, 0.02594483981251421] and parameters: {'n_layers': 1, 'embedding_dim': 96, 'lr': 0.0033679369179454638, 'lambda_val': 7.202525708659488e-05, 'batch_size': 1088, 'optimizer': 'RMSprop'}.
2026-05-23 01:30:22,575 - experiment_functions - INFO - Early stopping at epoch 1200. Best Metrics: (0.029390587528135732, 0.018114754098360657, 0.027842083719479306)
2026-05-23 01:30:22,667 - optuna.study.study - INFO - Trial 226 finished with values: [0.029390587528135732, 0.018114754098360657, 0.027842083719479306] and parameters: {'n_layers': 1, 'embedding_dim': 64, 'lr': 0.0006335857209731445, 'lambda_val': 5.008375332145283e-05, 'batch_size': 3712, 'optimizer': 'Adam'}.
2026-05-23 01:30:24,845 - experiment_functions - INFO - Early stopping at epoch 500. Best Metrics: (0.0028031208245315182, 0.0018852459016393442, 0.0020303167887175664)
2026-05-23 01:30:24,915 - optuna.study.study - INFO - Trial 227 finished with values: [0.0028031208245315182, 0.0018852459016393442, 0.0020303167887175664] and parameters: {'n_layers': 2, 'embedding_dim': 96, 'lr': 0.0006071804751429957, 'lambda_val': 0.08318717863495124, 'batch_size': 1031, 'optimizer': 'SGD'}.
2026-05-23 01:30:27,510 - experiment_functions - INFO - Early stopping at epoch 600. Best Metrics: (0.014912890269281427, 0.011721311475409835, 0.01399134409246798)
2026-05-23 01:30:28,413 - optuna.study.study - INFO - Trial 228 finished with values: [0.014912890269281427, 0.011721311475409835, 0.01399134409246798] and parameters: {'n_layers': 3, 'embedding_dim': 96, 'lr': 0.0006071804751429957, 'lambda_val': 0.026314441575461485, 'batch_size': 3582, 'optimizer': 'RMSprop'}.
2026-05-23 01:30:33,019 - experiment_functions - INFO - Early stopping at epoch 1450. Best Metrics: (0.03710396493426737, 0.019426229508196724, 0.02970560310975818)
2026-05-23 01:30:33,140 - optuna.study.study - INFO - Trial 229 finished with values: [0.03710396493426737, 0.019426229508196724, 0.02970560310975818] and parameters: {'n_layers': 2, 'embedding_dim': 32, 'lr': 0.0006237069115447143, 'lambda_val': 1.150702232586112e-06, 'batch_size': 1031, 'optimizer': 'RMSprop'}.
2026-05-23 01:30:38,063 - experiment_functions - INFO - Early stopping at epoch 1400. Best Metrics: (0.0333750393238204, 0.01795081967213115, 0.029568130861813674)
2026-05-23 01:30:38,881 - optuna.study.study - INFO - Trial 230 finished with values: [0.0333750393238204, 0.01795081967213115, 0.029568130861813674] and parameters: {'n_layers': 2, 'embedding_dim': 32, 'lr': 0.0006071804751429957, 'lambda_val': 0.00012261737938750884, 'batch_size': 1031, 'optimizer': 'RMSprop'}.
2026-05-23 01:30:41,334 - experiment_functions - INFO - Early stopping at epoch 600. Best Metrics: (0.029935976793929342, 0.016885245901639347, 0.02603314682804713)
2026-05-23 01:30:41,426 - optuna.study.study - INFO - Trial 231 finished with values: [0.029935976793929342, 0.016885245901639347, 0.02603314682804713] and parameters: {'n_layers': 1, 'embedding_dim': 64, 'lr': 0.0033679369179454638, 'lambda_val': 0.002309848095107031, 'batch_size': 1031, 'optimizer': 'RMSprop'}.
2026-05-23 01:30:43,858 - experiment_functions - INFO - Early stopping at epoch 600. Best Metrics: (0.027446709617177146, 0.016311475409836067, 0.022952738176598868)
2026-05-23 01:30:43,991 - optuna.study.study - INFO - Trial 232 finished with values: [0.027446709617177146, 0.016311475409836067, 0.022952738176598868] and parameters: {'n_layers': 2, 'embedding_dim': 32, 'lr': 0.0054017846217753514, 'lambda_val': 1.150702232586112e-06, 'batch_size': 542, 'optimizer': 'Adam'}.
2026-05-23 01:30:49,926 - experiment_functions - INFO - Early stopping at epoch 1000. Best Metrics: (0.006334462931075088, 0.0060655737704918035, 0.006997926607558558)
2026-05-23 01:30:50,024 - optuna.study.study - INFO - Trial 233 finished with values: [0.006334462931075088, 0.0060655737704918035, 0.006997926607558558] and parameters: {'n_layers': 3, 'embedding_dim': 256, 'lr': 0.00037298587418552697, 'lambda_val': 0.07062301167329864, 'batch_size': 2030, 'optimizer': 'RMSprop'}.
2026-05-23 01:30:53,725 - experiment_functions - INFO - Early stopping at epoch 1050. Best Metrics: (0.031362874413635465, 0.01901639344262295, 0.028188334420054615)
2026-05-23 01:30:54,297 - optuna.study.study - INFO - Trial 234 finished with values: [0.031362874413635465, 0.01901639344262295, 0.028188334420054615] and parameters: {'n_layers': 2, 'embedding_dim': 64, 'lr': 0.0005522357340015574, 'lambda_val': 7.202525708659488e-05, 'batch_size': 2030, 'optimizer': 'RMSprop'}.
2026-05-23 01:30:58,252 - experiment_functions - INFO - Early stopping at epoch 1150. Best Metrics: (0.028663150244481354, 0.017049180327868858, 0.023948130457024687)
2026-05-23 01:30:59,217 - optuna.study.study - INFO - Trial 235 finished with values: [0.028663150244481354, 0.017049180327868858, 0.023948130457024687] and parameters: {'n_layers': 3, 'embedding_dim': 32, 'lr': 0.0006071804751429957, 'lambda_val': 0.0004948769403467439, 'batch_size': 2030, 'optimizer': 'Adam'}.
2026-05-23 01:31:02,519 - experiment_functions - INFO - Early stopping at epoch 750. Best Metrics: (0.032765138821677225, 0.017049180327868858, 0.028895318722619006)
2026-05-23 01:31:02,610 - optuna.study.study - INFO - Trial 236 finished with values: [0.032765138821677225, 0.017049180327868858, 0.028895318722619006] and parameters: {'n_layers': 2, 'embedding_dim': 256, 'lr': 0.0006071804751429957, 'lambda_val': 1.770202893112185e-05, 'batch_size': 2030, 'optimizer': 'RMSprop'}.
2026-05-23 01:31:05,033 - experiment_functions - INFO - Early stopping at epoch 600. Best Metrics: (0.0029269499827948263, 0.0021311475409836063, 0.0026829242170891285)
2026-05-23 01:31:05,142 - optuna.study.study - INFO - Trial 237 finished with values: [0.0029269499827948263, 0.0021311475409836063, 0.0026829242170891285] and parameters: {'n_layers': 1, 'embedding_dim': 32, 'lr': 0.0006071804751429957, 'lambda_val': 0.0009657244544246451, 'batch_size': 2030, 'optimizer': 'SGD'}.
2026-05-23 01:31:12,147 - experiment_functions - INFO - Early stopping at epoch 2350. Best Metrics: (0.03446572962363194, 0.018442622950819672, 0.028665178492114845)
2026-05-23 01:31:12,240 - optuna.study.study - INFO - Trial 238 finished with values: [0.03446572962363194, 0.018442622950819672, 0.028665178492114845] and parameters: {'n_layers': 2, 'embedding_dim': 32, 'lr': 0.000496802361339361, 'lambda_val': 1.150702232586112e-06, 'batch_size': 1031, 'optimizer': 'Adam'}.
2026-05-23 01:31:17,319 - experiment_functions - INFO - Early stopping at epoch 1350. Best Metrics: (0.029999015769761644, 0.018360655737704918, 0.026064738764018137)
2026-05-23 01:31:17,431 - optuna.study.study - INFO - Trial 239 finished with values: [0.029999015769761644, 0.018360655737704918, 0.026064738764018137] and parameters: {'n_layers': 2, 'embedding_dim': 64, 'lr': 0.00037298587418552697, 'lambda_val': 0.00016867595805103173, 'batch_size': 3906, 'optimizer': 'RMSprop'}.
2026-05-23 01:31:23,296 - experiment_functions - INFO - Early stopping at epoch 1950. Best Metrics: (0.0024985430907738977, 0.0017213114754098362, 0.0021328059119009686)
2026-05-23 01:31:23,385 - optuna.study.study - INFO - Trial 240 finished with values: [0.0024985430907738977, 0.0017213114754098362, 0.0021328059119009686] and parameters: {'n_layers': 2, 'embedding_dim': 96, 'lr': 2.3068096710956677e-05, 'lambda_val': 7.202525708659488e-05, 'batch_size': 1031, 'optimizer': 'RMSprop'}.
2026-05-23 01:31:31,826 - experiment_functions - INFO - Early stopping at epoch 2800. Best Metrics: (0.0365254520967674, 0.018278688524590164, 0.029312574721016303)
2026-05-23 01:31:31,918 - optuna.study.study - INFO - Trial 241 finished with values: [0.0365254520967674, 0.018278688524590164, 0.029312574721016303] and parameters: {'n_layers': 3, 'embedding_dim': 32, 'lr': 0.0004599021655017754, 'lambda_val': 0.0004948769403467439, 'batch_size': 1031, 'optimizer': 'Adam'}.
2026-05-23 01:31:35,712 - experiment_functions - INFO - Early stopping at epoch 1100. Best Metrics: (0.025771456731985522, 0.016147540983606556, 0.022810246983354588)
2026-05-23 01:31:36,304 - optuna.study.study - INFO - Trial 242 finished with values: [0.025771456731985522, 0.016147540983606556, 0.022810246983354588] and parameters: {'n_layers': 2, 'embedding_dim': 32, 'lr': 0.0006237069115447143, 'lambda_val': 1.150702232586112e-06, 'batch_size': 2929, 'optimizer': 'RMSprop'}.
2026-05-23 01:31:41,051 - experiment_functions - INFO - Early stopping at epoch 1550. Best Metrics: (0.040654117744674194, 0.019098360655737702, 0.03317367653008006)
2026-05-23 01:31:41,321 - optuna.study.study - INFO - Trial 243 finished with values: [0.040654117744674194, 0.019098360655737702, 0.03317367653008006] and parameters: {'n_layers': 1, 'embedding_dim': 64, 'lr': 0.0006071804751429957, 'lambda_val': 0.00012261737938750884, 'batch_size': 1088, 'optimizer': 'RMSprop'}.
2026-05-23 01:31:45,018 - experiment_functions - INFO - Early stopping at epoch 1050. Best Metrics: (0.03562283161113782, 0.01901639344262295, 0.03049124084773876)
2026-05-23 01:31:45,299 - optuna.study.study - INFO - Trial 244 finished with values: [0.03562283161113782, 0.01901639344262295, 0.03049124084773876] and parameters: {'n_layers': 3, 'embedding_dim': 32, 'lr': 0.0006191306748157756, 'lambda_val': 0.0003594757486320111, 'batch_size': 1031, 'optimizer': 'Adam'}.
2026-05-23 01:31:51,051 - experiment_functions - INFO - Early stopping at epoch 1850. Best Metrics: (0.03740524942500774, 0.02057377049180328, 0.032062398875766736)
2026-05-23 01:31:53,519 - optuna.study.study - INFO - Trial 245 finished with values: [0.03740524942500774, 0.02057377049180328, 0.032062398875766736] and parameters: {'n_layers': 2, 'embedding_dim': 64, 'lr': 0.0006071804751429957, 'lambda_val': 7.108706732950844e-06, 'batch_size': 587, 'optimizer': 'Adam'}.
2026-05-23 01:31:56,713 - experiment_functions - INFO - Early stopping at epoch 700. Best Metrics: (0.030063300414156727, 0.01459016393442623, 0.025312555047867617)
2026-05-23 01:31:56,809 - optuna.study.study - INFO - Trial 246 finished with values: [0.030063300414156727, 0.01459016393442623, 0.025312555047867617] and parameters: {'n_layers': 2, 'embedding_dim': 32, 'lr': 0.001659243367980631, 'lambda_val': 1.150702232586112e-06, 'batch_size': 1031, 'optimizer': 'RMSprop'}.
2026-05-23 01:31:59,969 - experiment_functions - INFO - Early stopping at epoch 800. Best Metrics: (0.03584808762404315, 0.01959016393442623, 0.02830886317045163)
2026-05-23 01:32:00,531 - optuna.study.study - INFO - Trial 247 finished with values: [0.03584808762404315, 0.01959016393442623, 0.02830886317045163] and parameters: {'n_layers': 3, 'embedding_dim': 96, 'lr': 0.0006071804751429957, 'lambda_val': 0.0002911794052529677, 'batch_size': 1088, 'optimizer': 'RMSprop'}.
2026-05-23 01:32:05,010 - experiment_functions - INFO - Early stopping at epoch 1300. Best Metrics: (0.02596751379263362, 0.015655737704918033, 0.023419328593506508)
2026-05-23 01:32:05,088 - optuna.study.study - INFO - Trial 248 finished with values: [0.02596751379263362, 0.015655737704918033, 0.023419328593506508] and parameters: {'n_layers': 2, 'embedding_dim': 32, 'lr': 0.0006071804751429957, 'lambda_val': 0.00014297366550674857, 'batch_size': 4030, 'optimizer': 'Adam'}.
2026-05-23 01:32:14,245 - experiment_functions - INFO - Early stopping at epoch 3050. Best Metrics: (0.039986369606931395, 0.019836065573770493, 0.03330083001867578)
2026-05-23 01:32:14,664 - optuna.study.study - INFO - Trial 249 finished with values: [0.039986369606931395, 0.019836065573770493, 0.03330083001867578] and parameters: {'n_layers': 1, 'embedding_dim': 32, 'lr': 0.000496802361339361, 'lambda_val': 0.0009657244544246451, 'batch_size': 2030, 'optimizer': 'RMSprop'}.
2026-05-23 01:32:17,847 - experiment_functions - INFO - Early stopping at epoch 800. Best Metrics: (0.009323186707688473, 0.006475409836065575, 0.008991317517129971)
2026-05-23 01:32:17,933 - optuna.study.study - INFO - Trial 250 finished with values: [0.009323186707688473, 0.006475409836065575, 0.008991317517129971] and parameters: {'n_layers': 2, 'embedding_dim': 96, 'lr': 0.05198180578359806, 'lambda_val': 6.431098746359693e-05, 'batch_size': 3064, 'optimizer': 'Adam'}.
2026-05-23 01:32:20,257 - experiment_functions - INFO - Early stopping at epoch 550. Best Metrics: (0.025327735996894266, 0.014918032786885247, 0.023124083357652172)
2026-05-23 01:32:20,343 - optuna.study.study - INFO - Trial 251 finished with values: [0.025327735996894266, 0.014918032786885247, 0.023124083357652172] and parameters: {'n_layers': 1, 'embedding_dim': 128, 'lr': 0.0033679369179454638, 'lambda_val': 0.0004948769403467439, 'batch_size': 2549, 'optimizer': 'RMSprop'}.
2026-05-23 01:32:23,595 - experiment_functions - INFO - Early stopping at epoch 850. Best Metrics: (0.029186223080388287, 0.016065573770491805, 0.022987723840812813)
2026-05-23 01:32:23,700 - optuna.study.study - INFO - Trial 252 finished with values: [0.029186223080388287, 0.016065573770491805, 0.022987723840812813] and parameters: {'n_layers': 2, 'embedding_dim': 96, 'lr': 0.0006071804751429957, 'lambda_val': 1.150702232586112e-06, 'batch_size': 3538, 'optimizer': 'RMSprop'}.
2026-05-23 01:32:26,618 - experiment_functions - INFO - Early stopping at epoch 600. Best Metrics: (0.024605376196027026, 0.01459016393442623, 0.022742605668238363)
