2026-05-23 05:43:24,582 - optuna.study.study - INFO - Trial 171 finished with values: [0.07894536972913771, 0.04311475409836066, 0.06532977349972761] and parameters: {'n_layers': 2, 'embedding_dim': 128, 'lr': 0.0003614258129820434, 'lambda_val': 1.7408384781052897e-06, 'batch_size': 1976, 'optimizer': 'Adam'}.
2026-05-23 05:43:27,552 - experiment_functions - INFO - Early stopping at epoch 650. Best Metrics: (0.09514193605770743, 0.04721311475409836, 0.0806773049900024)
2026-05-23 05:43:27,683 - optuna.study.study - INFO - Trial 172 finished with values: [0.09514193605770743, 0.04721311475409836, 0.0806773049900024] and parameters: {'n_layers': 1, 'embedding_dim': 128, 'lr': 0.0027639393129429376, 'lambda_val': 1.7408384781052897e-06, 'batch_size': 1342, 'optimizer': 'Adam'}.
2026-05-23 05:43:42,060 - optuna.study.study - INFO - Trial 173 finished with values: [0.06799537016750508, 0.039180327868852456, 0.06022822775243827] and parameters: {'n_layers': 1, 'embedding_dim': 128, 'lr': 0.00015653541413289526, 'lambda_val': 0.0005387179014417885, 'batch_size': 3638, 'optimizer': 'Adam'}.
2026-05-23 05:43:46,063 - experiment_functions - INFO - Early stopping at epoch 1050. Best Metrics: (0.09308508034600238, 0.0471311475409836, 0.07579196585253742)
2026-05-23 05:43:46,147 - optuna.study.study - INFO - Trial 174 finished with values: [0.09308508034600238, 0.0471311475409836, 0.07579196585253742] and parameters: {'n_layers': 1, 'embedding_dim': 32, 'lr': 0.001288815314225091, 'lambda_val': 3.017168118404269e-06, 'batch_size': 2591, 'optimizer': 'Adam'}.
2026-05-23 05:43:49,954 - experiment_functions - INFO - Early stopping at epoch 650. Best Metrics: (0.024104701240213133, 0.015081967213114753, 0.020114961180870257)
2026-05-23 05:43:50,987 - optuna.study.study - INFO - Trial 175 finished with values: [0.024104701240213133, 0.015081967213114753, 0.020114961180870257] and parameters: {'n_layers': 3, 'embedding_dim': 128, 'lr': 0.0027639393129429376, 'lambda_val': 0.009869894388059158, 'batch_size': 3176, 'optimizer': 'RMSprop'}.
2026-05-23 05:43:53,494 - experiment_functions - INFO - Early stopping at epoch 500. Best Metrics: (0.0020050163173027033, 0.0021311475409836068, 0.002595396117203201)
2026-05-23 05:43:53,622 - optuna.study.study - INFO - Trial 176 finished with values: [0.0020050163173027033, 0.0021311475409836068, 0.002595396117203201] and parameters: {'n_layers': 2, 'embedding_dim': 128, 'lr': 0.0003614258129820434, 'lambda_val': 6.19406847114503e-05, 'batch_size': 1600, 'optimizer': 'SGD'}.
2026-05-23 05:44:05,346 - optuna.study.study - INFO - Trial 177 finished with values: [0.005888901215716401, 0.004754098360655738, 0.0062127277156901455] and parameters: {'n_layers': 1, 'embedding_dim': 32, 'lr': 7.907484801211952e-05, 'lambda_val': 0.00013338361174833875, 'batch_size': 1794, 'optimizer': 'Adam'}.
2026-05-23 05:44:08,828 - experiment_functions - INFO - Early stopping at epoch 700. Best Metrics: (0.10245185293768581, 0.05040983606557377, 0.08420576134037769)
2026-05-23 05:44:09,250 - optuna.study.study - INFO - Trial 178 finished with values: [0.10245185293768581, 0.05040983606557377, 0.08420576134037769] and parameters: {'n_layers': 1, 'embedding_dim': 256, 'lr': 0.0014897144525931195, 'lambda_val': 1.7408384781052897e-06, 'batch_size': 1844, 'optimizer': 'Adam'}.
2026-05-23 05:44:12,334 - experiment_functions - INFO - Early stopping at epoch 750. Best Metrics: (0.09767226509634558, 0.05262295081967213, 0.08387652354012841)
2026-05-23 05:44:12,727 - optuna.study.study - INFO - Trial 179 finished with values: [0.09767226509634558, 0.05262295081967213, 0.08387652354012841] and parameters: {'n_layers': 1, 'embedding_dim': 32, 'lr': 0.0014897144525931195, 'lambda_val': 1.916622569179001e-06, 'batch_size': 568, 'optimizer': 'RMSprop'}.
2026-05-23 05:44:16,984 - experiment_functions - INFO - Early stopping at epoch 550. Best Metrics: (0.07626569665225286, 0.041721311475409834, 0.06897196465127771)
2026-05-23 05:44:17,123 - optuna.study.study - INFO - Trial 180 finished with values: [0.07626569665225286, 0.041721311475409834, 0.06897196465127771] and parameters: {'n_layers': 1, 'embedding_dim': 32, 'lr': 0.010572417355919682, 'lambda_val': 0.00513720112205785, 'batch_size': 2011, 'optimizer': 'Adam'}.
2026-05-23 05:44:24,151 - experiment_functions - INFO - Early stopping at epoch 550. Best Metrics: (0.09047489920480135, 0.04590163934426229, 0.0738545092645514)
2026-05-23 05:44:24,837 - optuna.study.study - INFO - Trial 181 finished with values: [0.09047489920480135, 0.04590163934426229, 0.0738545092645514] and parameters: {'n_layers': 1, 'embedding_dim': 256, 'lr': 0.006312777493233292, 'lambda_val': 0.00013338361174833875, 'batch_size': 2934, 'optimizer': 'Adam'}.
2026-05-23 05:44:30,457 - experiment_functions - INFO - Early stopping at epoch 600. Best Metrics: (0.09236951911879891, 0.046229508196721315, 0.07964142151889218)
2026-05-23 05:44:30,561 - optuna.study.study - INFO - Trial 182 finished with values: [0.09236951911879891, 0.046229508196721315, 0.07964142151889218] and parameters: {'n_layers': 1, 'embedding_dim': 128, 'lr': 0.0014897144525931195, 'lambda_val': 1.8188478145428612e-06, 'batch_size': 2590, 'optimizer': 'RMSprop'}.
2026-05-23 05:44:43,953 - optuna.study.study - INFO - Trial 183 finished with values: [0.06690468223386906, 0.03704918032786886, 0.05912312726002058] and parameters: {'n_layers': 1, 'embedding_dim': 96, 'lr': 0.00015653541413289526, 'lambda_val': 0.0022842764195591505, 'batch_size': 1628, 'optimizer': 'Adam'}.
2026-05-23 05:44:46,747 - experiment_functions - INFO - Early stopping at epoch 600. Best Metrics: (0.05902022319363634, 0.033114754098360656, 0.054121442657111385)
2026-05-23 05:44:46,869 - optuna.study.study - INFO - Trial 184 finished with values: [0.05902022319363634, 0.033114754098360656, 0.054121442657111385] and parameters: {'n_layers': 2, 'embedding_dim': 96, 'lr': 0.001257701414193144, 'lambda_val': 0.009869894388059158, 'batch_size': 1892, 'optimizer': 'Adam'}.
2026-05-23 05:44:59,282 - optuna.study.study - INFO - Trial 185 finished with values: [0.05148292654861162, 0.030409836065573764, 0.04432474603726869] and parameters: {'n_layers': 1, 'embedding_dim': 32, 'lr': 0.00015653541413289526, 'lambda_val': 0.0016872549049523802, 'batch_size': 3604, 'optimizer': 'RMSprop'}.
2026-05-23 05:45:12,571 - experiment_functions - INFO - Early stopping at epoch 2850. Best Metrics: (0.07951634522647998, 0.04393442622950819, 0.06914057184352408)
2026-05-23 05:45:13,393 - optuna.study.study - INFO - Trial 186 finished with values: [0.07951634522647998, 0.04393442622950819, 0.06914057184352408] and parameters: {'n_layers': 2, 'embedding_dim': 256, 'lr': 0.00015653541413289526, 'lambda_val': 0.00049747981237656, 'batch_size': 1794, 'optimizer': 'RMSprop'}.
2026-05-23 05:45:18,771 - experiment_functions - INFO - Early stopping at epoch 1300. Best Metrics: (0.07349799778614068, 0.04057377049180328, 0.06564480232653012)
2026-05-23 05:45:19,049 - optuna.study.study - INFO - Trial 187 finished with values: [0.07349799778614068, 0.04057377049180328, 0.06564480232653012] and parameters: {'n_layers': 2, 'embedding_dim': 128, 'lr': 0.000360608106860257, 'lambda_val': 6.19406847114503e-05, 'batch_size': 1844, 'optimizer': 'RMSprop'}.
2026-05-23 05:45:21,439 - experiment_functions - INFO - Early stopping at epoch 550. Best Metrics: (0.07921658608405859, 0.043852459016393446, 0.06798675142286258)
2026-05-23 05:45:21,522 - optuna.study.study - INFO - Trial 188 finished with values: [0.07921658608405859, 0.043852459016393446, 0.06798675142286258] and parameters: {'n_layers': 1, 'embedding_dim': 64, 'lr': 0.00889050274911736, 'lambda_val': 0.0001780270767671239, 'batch_size': 1631, 'optimizer': 'Adam'}.
2026-05-23 05:45:23,983 - experiment_functions - INFO - Early stopping at epoch 550. Best Metrics: (0.08737034931006671, 0.04795081967213115, 0.07880532123947687)
2026-05-23 05:45:25,272 - optuna.study.study - INFO - Trial 189 finished with values: [0.08737034931006671, 0.04795081967213115, 0.07880532123947687] and parameters: {'n_layers': 1, 'embedding_dim': 64, 'lr': 0.009775285747671312, 'lambda_val': 8.379668074343212e-06, 'batch_size': 1631, 'optimizer': 'Adam'}.
2026-05-23 05:45:31,468 - experiment_functions - INFO - Early stopping at epoch 1700. Best Metrics: (0.10953206762041504, 0.053934426229508205, 0.09012000354188858)
2026-05-23 05:45:31,593 - optuna.study.study - INFO - Trial 190 finished with values: [0.10953206762041504, 0.053934426229508205, 0.09012000354188858] and parameters: {'n_layers': 1, 'embedding_dim': 128, 'lr': 0.0003614258129820434, 'lambda_val': 1.7408384781052897e-06, 'batch_size': 2283, 'optimizer': 'RMSprop'}.
2026-05-23 05:45:33,940 - experiment_functions - INFO - Early stopping at epoch 500. Best Metrics: (0.0019507538014230626, 0.002213114754098361, 0.0023482197292301055)
2026-05-23 05:45:34,009 - optuna.study.study - INFO - Trial 191 finished with values: [0.0019507538014230626, 0.002213114754098361, 0.0023482197292301055] and parameters: {'n_layers': 2, 'embedding_dim': 96, 'lr': 0.0003614258129820434, 'lambda_val': 0.0006591181316301599, 'batch_size': 1976, 'optimizer': 'SGD'}.
2026-05-23 05:45:37,749 - experiment_functions - INFO - Early stopping at epoch 600. Best Metrics: (0.08384197135932228, 0.04204918032786885, 0.06665067309254447)
2026-05-23 05:45:38,306 - optuna.study.study - INFO - Trial 192 finished with values: [0.08384197135932228, 0.04204918032786885, 0.06665067309254447] and parameters: {'n_layers': 1, 'embedding_dim': 128, 'lr': 0.0026271984480321668, 'lambda_val': 6.19406847114503e-05, 'batch_size': 1844, 'optimizer': 'RMSprop'}.
2026-05-23 05:45:41,531 - experiment_functions - INFO - Early stopping at epoch 550. Best Metrics: (0.05969640784699489, 0.030081967213114756, 0.0475298772772339)
2026-05-23 05:45:42,169 - optuna.study.study - INFO - Trial 193 finished with values: [0.05969640784699489, 0.030081967213114756, 0.0475298772772339] and parameters: {'n_layers': 1, 'embedding_dim': 32, 'lr': 0.006312777493233292, 'lambda_val': 0.004042944264174355, 'batch_size': 3604, 'optimizer': 'RMSprop'}.
2026-05-23 05:45:48,857 - experiment_functions - INFO - Early stopping at epoch 600. Best Metrics: (0.033514322671814034, 0.020901639344262295, 0.029686927612192552)
2026-05-23 05:45:49,340 - optuna.study.study - INFO - Trial 194 finished with values: [0.033514322671814034, 0.020901639344262295, 0.029686927612192552] and parameters: {'n_layers': 3, 'embedding_dim': 128, 'lr': 0.0014897144525931195, 'lambda_val': 2.691057746425052e-06, 'batch_size': 1976, 'optimizer': 'RMSprop'}.
2026-05-23 05:45:56,360 - experiment_functions - INFO - Early stopping at epoch 550. Best Metrics: (0.0770430557785778, 0.04, 0.06241379729165214)
2026-05-23 05:45:56,474 - optuna.study.study - INFO - Trial 195 finished with values: [0.0770430557785778, 0.04, 0.06241379729165214] and parameters: {'n_layers': 1, 'embedding_dim': 64, 'lr': 0.0087991751940927, 'lambda_val': 1.5271587203565615e-05, 'batch_size': 1628, 'optimizer': 'Adam'}.
2026-05-23 05:45:58,516 - experiment_functions - INFO - Early stopping at epoch 500. Best Metrics: (0.0022319795552581466, 0.0018032786885245904, 0.0021662040516662365)
2026-05-23 05:45:59,359 - optuna.study.study - INFO - Trial 196 finished with values: [0.0022319795552581466, 0.0018032786885245904, 0.0021662040516662365] and parameters: {'n_layers': 1, 'embedding_dim': 64, 'lr': 0.00015653541413289526, 'lambda_val': 0.0038219476201083865, 'batch_size': 1098, 'optimizer': 'SGD'}.
2026-05-23 05:46:04,354 - experiment_functions - INFO - Early stopping at epoch 1350. Best Metrics: (0.05189298565969336, 0.026475409836065573, 0.04200519221825644)
2026-05-23 05:46:04,696 - optuna.study.study - INFO - Trial 197 finished with values: [0.05189298565969336, 0.026475409836065573, 0.04200519221825644] and parameters: {'n_layers': 1, 'embedding_dim': 128, 'lr': 0.00545110887354259, 'lambda_val': 0.003273430437450601, 'batch_size': 893, 'optimizer': 'RMSprop'}.
2026-05-23 05:46:08,524 - experiment_functions - INFO - Early stopping at epoch 750. Best Metrics: (0.037431188395861674, 0.021967213114754098, 0.03385960179344089)
2026-05-23 05:46:08,671 - optuna.study.study - INFO - Trial 198 finished with values: [0.037431188395861674, 0.021967213114754098, 0.03385960179344089] and parameters: {'n_layers': 3, 'embedding_dim': 96, 'lr': 0.001257701414193144, 'lambda_val': 0.0015178475199800403, 'batch_size': 2591, 'optimizer': 'Adam'}.
2026-05-23 05:46:20,162 - experiment_functions - INFO - Early stopping at epoch 3350. Best Metrics: (0.06502963882534384, 0.03409836065573771, 0.051902745615173655)
2026-05-23 05:46:20,539 - optuna.study.study - INFO - Trial 199 finished with values: [0.06502963882534384, 0.03409836065573771, 0.051902745615173655] and parameters: {'n_layers': 2, 'embedding_dim': 32, 'lr': 0.0003614258129820434, 'lambda_val': 0.0005387179014417885, 'batch_size': 2535, 'optimizer': 'Adam'}.
2026-05-23 05:46:22,996 - experiment_functions - INFO - Early stopping at epoch 550. Best Metrics: (0.08829843052313516, 0.04540983606557377, 0.07515889762772149)
2026-05-23 05:46:23,536 - optuna.study.study - INFO - Trial 200 finished with values: [0.08829843052313516, 0.04540983606557377, 0.07515889762772149] and parameters: {'n_layers': 1, 'embedding_dim': 128, 'lr': 0.006661701732557814, 'lambda_val': 6.19406847114503e-05, 'batch_size': 1321, 'optimizer': 'Adam'}.
2026-05-23 05:46:26,683 - experiment_functions - INFO - Early stopping at epoch 550. Best Metrics: (0.03211890579649836, 0.019836065573770493, 0.028472831471314207)
2026-05-23 05:46:26,821 - optuna.study.study - INFO - Trial 201 finished with values: [0.03211890579649836, 0.019836065573770493, 0.028472831471314207] and parameters: {'n_layers': 3, 'embedding_dim': 128, 'lr': 0.004748827105127406, 'lambda_val': 1.7408384781052897e-06, 'batch_size': 1976, 'optimizer': 'Adam'}.
2026-05-23 05:46:29,624 - experiment_functions - INFO - Early stopping at epoch 550. Best Metrics: (0.09313957593081627, 0.04836065573770492, 0.08061677050708028)
2026-05-23 05:46:30,261 - optuna.study.study - INFO - Trial 202 finished with values: [0.09313957593081627, 0.04836065573770492, 0.08061677050708028] and parameters: {'n_layers': 1, 'embedding_dim': 256, 'lr': 0.006312777493233292, 'lambda_val': 1.955773642148345e-06, 'batch_size': 1321, 'optimizer': 'Adam'}.
2026-05-23 05:46:32,810 - experiment_functions - INFO - Early stopping at epoch 600. Best Metrics: (0.05264254323840205, 0.037868852459016396, 0.050205340526253917)
2026-05-23 05:46:32,893 - optuna.study.study - INFO - Trial 203 finished with values: [0.05264254323840205, 0.037868852459016396, 0.050205340526253917] and parameters: {'n_layers': 1, 'embedding_dim': 32, 'lr': 0.0026271984480321668, 'lambda_val': 0.023064033515175695, 'batch_size': 1631, 'optimizer': 'Adam'}.
2026-05-23 05:46:36,243 - experiment_functions - INFO - Early stopping at epoch 700. Best Metrics: (0.06002556659151271, 0.028852459016393446, 0.04481571006779381)
2026-05-23 05:46:36,321 - optuna.study.study - INFO - Trial 204 finished with values: [0.06002556659151271, 0.028852459016393446, 0.04481571006779381] and parameters: {'n_layers': 1, 'embedding_dim': 256, 'lr': 0.0087991751940927, 'lambda_val': 1.7408384781052897e-06, 'batch_size': 1844, 'optimizer': 'RMSprop'}.
2026-05-23 05:46:38,968 - experiment_functions - INFO - Early stopping at epoch 650. Best Metrics: (0.10807079641284731, 0.05254098360655737, 0.08597924815219936)
2026-05-23 05:46:39,053 - optuna.study.study - INFO - Trial 205 finished with values: [0.10807079641284731, 0.05254098360655737, 0.08597924815219936] and parameters: {'n_layers': 1, 'embedding_dim': 32, 'lr': 0.0026271984480321668, 'lambda_val': 0.0016872549049523802, 'batch_size': 1794, 'optimizer': 'Adam'}.
2026-05-23 05:46:51,860 - optuna.study.study - INFO - Trial 206 finished with values: [0.1010543781689664, 0.0530327868852459, 0.08854711199624928] and parameters: {'n_layers': 1, 'embedding_dim': 128, 'lr': 0.0003614258129820434, 'lambda_val': 2.691057746425052e-06, 'batch_size': 568, 'optimizer': 'Adam'}.
2026-05-23 05:46:57,305 - experiment_functions - INFO - Early stopping at epoch 1250. Best Metrics: (0.07156047666369017, 0.036885245901639344, 0.060243390533616)
2026-05-23 05:46:58,002 - optuna.study.study - INFO - Trial 207 finished with values: [0.07156047666369017, 0.036885245901639344, 0.060243390533616] and parameters: {'n_layers': 2, 'embedding_dim': 128, 'lr': 0.000360608106860257, 'lambda_val': 6.19406847114503e-05, 'batch_size': 1844, 'optimizer': 'RMSprop'}.
2026-05-23 05:47:04,682 - experiment_functions - INFO - Early stopping at epoch 550. Best Metrics: (0.10875144993215324, 0.054180327868852456, 0.08995093792067908)
2026-05-23 05:47:04,775 - optuna.study.study - INFO - Trial 208 finished with values: [0.10875144993215324, 0.054180327868852456, 0.08995093792067908] and parameters: {'n_layers': 1, 'embedding_dim': 96, 'lr': 0.006832650701048396, 'lambda_val': 0.0006591181316301599, 'batch_size': 3886, 'optimizer': 'Adam'}.
2026-05-23 05:47:07,424 - experiment_functions - INFO - Early stopping at epoch 550. Best Metrics: (0.10851092670322364, 0.049180327868852465, 0.09042117341819483)
2026-05-23 05:47:07,528 - optuna.study.study - INFO - Trial 209 finished with values: [0.10851092670322364, 0.049180327868852465, 0.09042117341819483] and parameters: {'n_layers': 1, 'embedding_dim': 128, 'lr': 0.004748827105127406, 'lambda_val': 1.7408384781052897e-06, 'batch_size': 2590, 'optimizer': 'Adam'}.
2026-05-23 05:47:10,543 - experiment_functions - INFO - Early stopping at epoch 550. Best Metrics: (0.07345504979147333, 0.033688524590163936, 0.05865320495620523)
2026-05-23 05:47:11,873 - optuna.study.study - INFO - Trial 210 finished with values: [0.07345504979147333, 0.033688524590163936, 0.05865320495620523] and parameters: {'n_layers': 1, 'embedding_dim': 256, 'lr': 0.011349410379121086, 'lambda_val': 0.0005805183270689483, 'batch_size': 2577, 'optimizer': 'Adam'}.
2026-05-23 05:47:14,301 - experiment_functions - INFO - Early stopping at epoch 550. Best Metrics: (0.0899710189554585, 0.04672131147540984, 0.08173114646080841)
2026-05-23 05:47:14,503 - optuna.study.study - INFO - Trial 211 finished with values: [0.0899710189554585, 0.04672131147540984, 0.08173114646080841] and parameters: {'n_layers': 1, 'embedding_dim': 32, 'lr': 0.00889050274911736, 'lambda_val': 0.0005805183270689483, 'batch_size': 2130, 'optimizer': 'Adam'}.
2026-05-23 05:47:30,897 - optuna.study.study - INFO - Trial 212 finished with values: [0.08617897959344246, 0.04770491803278689, 0.07687628480776347] and parameters: {'n_layers': 1, 'embedding_dim': 256, 'lr': 0.00015653541413289526, 'lambda_val': 0.00049747981237656, 'batch_size': 2591, 'optimizer': 'RMSprop'}.
2026-05-23 05:47:33,725 - experiment_functions - INFO - Early stopping at epoch 700. Best Metrics: (0.08506604434771846, 0.04311475409836066, 0.07180010063755486)
2026-05-23 05:47:33,947 - optuna.study.study - INFO - Trial 213 finished with values: [0.08506604434771846, 0.04311475409836066, 0.07180010063755486] and parameters: {'n_layers': 1, 'embedding_dim': 64, 'lr': 0.0027639393129429376, 'lambda_val': 0.00019640644566046214, 'batch_size': 1342, 'optimizer': 'Adam'}.
2026-05-23 05:47:37,266 - experiment_functions - INFO - Early stopping at epoch 800. Best Metrics: (0.10856976633068409, 0.05237704918032786, 0.08911280410688542)
2026-05-23 05:47:37,358 - optuna.study.study - INFO - Trial 214 finished with values: [0.10856976633068409, 0.05237704918032786, 0.08911280410688542] and parameters: {'n_layers': 1, 'embedding_dim': 64, 'lr': 0.0014897144525931195, 'lambda_val': 1.7408384781052897e-06, 'batch_size': 1844, 'optimizer': 'Adam'}.
2026-05-23 05:47:40,665 - experiment_functions - INFO - Early stopping at epoch 550. Best Metrics: (0.020206956766694057, 0.011885245901639344, 0.017891429058000917)
2026-05-23 05:47:40,919 - optuna.study.study - INFO - Trial 215 finished with values: [0.020206956766694057, 0.011885245901639344, 0.017891429058000917] and parameters: {'n_layers': 4, 'embedding_dim': 32, 'lr': 0.00889050274911736, 'lambda_val': 0.00016785947403210068, 'batch_size': 1321, 'optimizer': 'RMSprop'}.
2026-05-23 05:47:43,917 - experiment_functions - INFO - Early stopping at epoch 550. Best Metrics: (0.08248293130761337, 0.03745901639344262, 0.06866324358767883)
2026-05-23 05:47:44,003 - optuna.study.study - INFO - Trial 216 finished with values: [0.08248293130761337, 0.03745901639344262, 0.06866324358767883] and parameters: {'n_layers': 1, 'embedding_dim': 256, 'lr': 0.00889050274911736, 'lambda_val': 0.0005805183270689483, 'batch_size': 2591, 'optimizer': 'Adam'}.
2026-05-23 05:47:49,397 - experiment_functions - INFO - Early stopping at epoch 550. Best Metrics: (0.09943023684562619, 0.047213114754098354, 0.08238162580106724)
2026-05-23 05:47:50,008 - optuna.study.study - INFO - Trial 217 finished with values: [0.09943023684562619, 0.047213114754098354, 0.08238162580106724] and parameters: {'n_layers': 1, 'embedding_dim': 128, 'lr': 0.004748827105127406, 'lambda_val': 1.7408384781052897e-06, 'batch_size': 2590, 'optimizer': 'Adam'}.
2026-05-23 05:47:58,619 - experiment_functions - INFO - Early stopping at epoch 550. Best Metrics: (0.1057007709356827, 0.048770491803278686, 0.08351666659841034)
2026-05-23 05:47:58,969 - optuna.study.study - INFO - Trial 218 finished with values: [0.1057007709356827, 0.048770491803278686, 0.08351666659841034] and parameters: {'n_layers': 1, 'embedding_dim': 256, 'lr': 0.006312777493233292, 'lambda_val': 0.0005805183270689483, 'batch_size': 3747, 'optimizer': 'Adam'}.
2026-05-23 05:48:02,490 - experiment_functions - INFO - Early stopping at epoch 650. Best Metrics: (0.09755899837013277, 0.04639344262295082, 0.0773574423393723)
