2026-05-23 01:50:01,598 - optuna.study.study - INFO - Trial 140 finished with values: [0.030995914147957822, 0.01901639344262295, 0.029420296686139866] and parameters: {'n_layers': 3, 'embedding_dim': 128, 'lr': 0.0006111868479200038, 'lambda_val': 3.317665133673459e-05, 'batch_size': 728, 'optimizer': 'Adam'}.
2026-05-23 01:50:06,347 - experiment_functions - INFO - Early stopping at epoch 1250. Best Metrics: (0.03091503949092098, 0.017540983606557377, 0.027606339463183967)
2026-05-23 01:50:06,486 - optuna.study.study - INFO - Trial 141 finished with values: [0.03091503949092098, 0.017540983606557377, 0.027606339463183967] and parameters: {'n_layers': 3, 'embedding_dim': 128, 'lr': 0.000302020510284504, 'lambda_val': 0.0005985360677675016, 'batch_size': 2885, 'optimizer': 'RMSprop'}.
2026-05-23 01:50:17,564 - experiment_functions - INFO - Early stopping at epoch 3750. Best Metrics: (0.029570791016708665, 0.017540983606557377, 0.025674251715672603)
2026-05-23 01:50:18,125 - optuna.study.study - INFO - Trial 142 finished with values: [0.029570791016708665, 0.017540983606557377, 0.025674251715672603] and parameters: {'n_layers': 3, 'embedding_dim': 32, 'lr': 0.0002669734398444981, 'lambda_val': 2.093095368912283e-06, 'batch_size': 1493, 'optimizer': 'RMSprop'}.
2026-05-23 01:50:28,504 - optuna.study.study - INFO - Trial 143 finished with values: [0.02987270796304893, 0.017295081967213115, 0.025931137065309452] and parameters: {'n_layers': 3, 'embedding_dim': 32, 'lr': 0.0002669734398444981, 'lambda_val': 2.093095368912283e-06, 'batch_size': 4001, 'optimizer': 'RMSprop'}.
2026-05-23 01:50:31,934 - experiment_functions - INFO - Early stopping at epoch 950. Best Metrics: (0.03293814066888697, 0.018114754098360657, 0.028054545189790503)
2026-05-23 01:50:32,011 - optuna.study.study - INFO - Trial 144 finished with values: [0.03293814066888697, 0.018114754098360657, 0.028054545189790503] and parameters: {'n_layers': 2, 'embedding_dim': 128, 'lr': 0.0006111868479200038, 'lambda_val': 0.0017105841747060543, 'batch_size': 2925, 'optimizer': 'Adam'}.
2026-05-23 01:50:34,518 - experiment_functions - INFO - Early stopping at epoch 650. Best Metrics: (0.03257314524826465, 0.0169672131147541, 0.026603653537487927)
2026-05-23 01:50:34,637 - optuna.study.study - INFO - Trial 145 finished with values: [0.03257314524826465, 0.0169672131147541, 0.026603653537487927] and parameters: {'n_layers': 3, 'embedding_dim': 128, 'lr': 0.0006696996604664924, 'lambda_val': 6.3998980027240765e-06, 'batch_size': 1631, 'optimizer': 'RMSprop'}.
2026-05-23 01:50:36,907 - experiment_functions - INFO - Early stopping at epoch 550. Best Metrics: (0.025768914349212062, 0.013934426229508197, 0.0226052081121949)
2026-05-23 01:50:36,999 - optuna.study.study - INFO - Trial 146 finished with values: [0.025768914349212062, 0.013934426229508197, 0.0226052081121949] and parameters: {'n_layers': 2, 'embedding_dim': 128, 'lr': 0.0022564826852050435, 'lambda_val': 0.00010282851860885764, 'batch_size': 3801, 'optimizer': 'RMSprop'}.
2026-05-23 01:50:50,564 - optuna.study.study - INFO - Trial 147 finished with values: [0.018544602545272435, 0.013688524590163934, 0.017393105943361846] and parameters: {'n_layers': 2, 'embedding_dim': 256, 'lr': 0.00012667151006330983, 'lambda_val': 0.012826080211321403, 'batch_size': 1056, 'optimizer': 'Adam'}.
2026-05-23 01:50:53,505 - experiment_functions - INFO - Early stopping at epoch 1000. Best Metrics: (0.03755489184627141, 0.01909836065573771, 0.028747564582886725)
2026-05-23 01:50:53,595 - optuna.study.study - INFO - Trial 148 finished with values: [0.03755489184627141, 0.01909836065573771, 0.028747564582886725] and parameters: {'n_layers': 1, 'embedding_dim': 64, 'lr': 0.0013488534539100193, 'lambda_val': 0.001138541292442641, 'batch_size': 733, 'optimizer': 'Adam'}.
2026-05-23 01:50:55,712 - experiment_functions - INFO - Early stopping at epoch 550. Best Metrics: (0.03084441737698386, 0.014836065573770494, 0.023564899354214033)
2026-05-23 01:50:55,807 - optuna.study.study - INFO - Trial 149 finished with values: [0.03084441737698386, 0.014836065573770494, 0.023564899354214033] and parameters: {'n_layers': 3, 'embedding_dim': 32, 'lr': 0.009455185494500208, 'lambda_val': 0.003373624884488296, 'batch_size': 1475, 'optimizer': 'Adam'}.
2026-05-23 01:51:07,256 - experiment_functions - INFO - Early stopping at epoch 3650. Best Metrics: (0.0265707009490321, 0.01778688524590164, 0.02310101945965857)
2026-05-23 01:51:07,344 - optuna.study.study - INFO - Trial 150 finished with values: [0.0265707009490321, 0.01778688524590164, 0.02310101945965857] and parameters: {'n_layers': 3, 'embedding_dim': 128, 'lr': 0.00012489769900364984, 'lambda_val': 0.0033582080301553614, 'batch_size': 2357, 'optimizer': 'Adam'}.
2026-05-23 01:51:10,285 - experiment_functions - INFO - Early stopping at epoch 1000. Best Metrics: (0.032845859612676186, 0.01901639344262295, 0.029168462547670665)
2026-05-23 01:51:10,373 - optuna.study.study - INFO - Trial 151 finished with values: [0.032845859612676186, 0.01901639344262295, 0.029168462547670665] and parameters: {'n_layers': 1, 'embedding_dim': 64, 'lr': 0.0013488534539100193, 'lambda_val': 0.001138541292442641, 'batch_size': 733, 'optimizer': 'Adam'}.
2026-05-23 01:51:19,335 - experiment_functions - INFO - Early stopping at epoch 2850. Best Metrics: (0.03024817525782584, 0.016639344262295082, 0.024183901900460616)
2026-05-23 01:51:20,789 - optuna.study.study - INFO - Trial 152 finished with values: [0.03024817525782584, 0.016639344262295082, 0.024183901900460616] and parameters: {'n_layers': 3, 'embedding_dim': 128, 'lr': 0.000171992203307018, 'lambda_val': 3.317665133673459e-05, 'batch_size': 3738, 'optimizer': 'Adam'}.
2026-05-23 01:51:23,545 - experiment_functions - INFO - Early stopping at epoch 800. Best Metrics: (0.03270632599081825, 0.017377049180327873, 0.02668017281654505)
2026-05-23 01:51:23,635 - optuna.study.study - INFO - Trial 153 finished with values: [0.03270632599081825, 0.017377049180327873, 0.02668017281654505] and parameters: {'n_layers': 2, 'embedding_dim': 96, 'lr': 0.0006111868479200038, 'lambda_val': 0.0017105841747060543, 'batch_size': 3166, 'optimizer': 'RMSprop'}.
2026-05-23 01:51:26,554 - experiment_functions - INFO - Early stopping at epoch 600. Best Metrics: (0.024554492292719242, 0.01581967213114754, 0.02477351884113492)
2026-05-23 01:51:26,643 - optuna.study.study - INFO - Trial 154 finished with values: [0.024554492292719242, 0.01581967213114754, 0.02477351884113492] and parameters: {'n_layers': 2, 'embedding_dim': 256, 'lr': 0.0018860187490457373, 'lambda_val': 0.0029444127697785846, 'batch_size': 3736, 'optimizer': 'Adam'}.
2026-05-23 01:51:36,759 - optuna.study.study - INFO - Trial 155 finished with values: [0.011094972956988141, 0.007377049180327869, 0.010719562284879428] and parameters: {'n_layers': 2, 'embedding_dim': 32, 'lr': 0.00010182408680733353, 'lambda_val': 2.093095368912283e-06, 'batch_size': 3801, 'optimizer': 'Adam'}.
2026-05-23 01:51:39,175 - experiment_functions - INFO - Early stopping at epoch 600. Best Metrics: (0.026400829776830385, 0.014508196721311479, 0.02154115140373859)
2026-05-23 01:51:39,252 - optuna.study.study - INFO - Trial 156 finished with values: [0.026400829776830385, 0.014508196721311479, 0.02154115140373859] and parameters: {'n_layers': 4, 'embedding_dim': 96, 'lr': 0.0021679791502810398, 'lambda_val': 0.001138541292442641, 'batch_size': 1631, 'optimizer': 'Adam'}.
2026-05-23 01:51:41,795 - experiment_functions - INFO - Early stopping at epoch 600. Best Metrics: (0.0352439135166874, 0.018606557377049183, 0.02862909852508514)
2026-05-23 01:51:41,896 - optuna.study.study - INFO - Trial 157 finished with values: [0.0352439135166874, 0.018606557377049183, 0.02862909852508514] and parameters: {'n_layers': 3, 'embedding_dim': 128, 'lr': 0.0018860187490457373, 'lambda_val': 0.0004434231025609452, 'batch_size': 1003, 'optimizer': 'Adam'}.
2026-05-23 01:51:53,667 - experiment_functions - INFO - Early stopping at epoch 2650. Best Metrics: (0.03375344106489581, 0.018934426229508198, 0.03091463506803721)
2026-05-23 01:51:53,749 - optuna.study.study - INFO - Trial 158 finished with values: [0.03375344106489581, 0.018934426229508198, 0.03091463506803721] and parameters: {'n_layers': 2, 'embedding_dim': 128, 'lr': 0.0002669734398444981, 'lambda_val': 2.093095368912283e-06, 'batch_size': 1304, 'optimizer': 'Adam'}.
2026-05-23 01:52:09,347 - optuna.study.study - INFO - Trial 159 finished with values: [0.029023057296106155, 0.017868852459016395, 0.02612847642308208] and parameters: {'n_layers': 3, 'embedding_dim': 256, 'lr': 0.00012667151006330983, 'lambda_val': 3.7205125829824535e-06, 'batch_size': 2578, 'optimizer': 'RMSprop'}.
2026-05-23 01:52:11,364 - experiment_functions - INFO - Early stopping at epoch 500. Best Metrics: (0.0030833322458111104, 0.002213114754098361, 0.003277152501699879)
2026-05-23 01:52:11,465 - optuna.study.study - INFO - Trial 160 finished with values: [0.0030833322458111104, 0.002213114754098361, 0.003277152501699879] and parameters: {'n_layers': 3, 'embedding_dim': 32, 'lr': 0.0002669734398444981, 'lambda_val': 2.093095368912283e-06, 'batch_size': 1493, 'optimizer': 'SGD'}.
2026-05-23 01:52:13,598 - experiment_functions - INFO - Early stopping at epoch 500. Best Metrics: (0.001290281274165922, 0.001557377049180328, 0.0015808070103309779)
2026-05-23 01:52:13,688 - optuna.study.study - INFO - Trial 161 finished with values: [0.001290281274165922, 0.001557377049180328, 0.0015808070103309779] and parameters: {'n_layers': 1, 'embedding_dim': 128, 'lr': 0.0006111868479200038, 'lambda_val': 0.0017105841747060543, 'batch_size': 2925, 'optimizer': 'SGD'}.
2026-05-23 01:52:17,533 - experiment_functions - INFO - Early stopping at epoch 1000. Best Metrics: (0.027478547433593944, 0.016065573770491805, 0.024319117766549887)
2026-05-23 01:52:17,907 - optuna.study.study - INFO - Trial 162 finished with values: [0.027478547433593944, 0.016065573770491805, 0.024319117766549887] and parameters: {'n_layers': 3, 'embedding_dim': 128, 'lr': 0.000302020510284504, 'lambda_val': 0.0020916535485531675, 'batch_size': 3696, 'optimizer': 'RMSprop'}.
2026-05-23 01:52:21,154 - experiment_functions - INFO - Early stopping at epoch 950. Best Metrics: (0.03230578695686838, 0.018032786885245903, 0.02563148939504813)
2026-05-23 01:52:21,251 - optuna.study.study - INFO - Trial 163 finished with values: [0.03230578695686838, 0.018032786885245903, 0.02563148939504813] and parameters: {'n_layers': 1, 'embedding_dim': 64, 'lr': 0.0014494764650589468, 'lambda_val': 0.0005795183242806687, 'batch_size': 3696, 'optimizer': 'Adam'}.
2026-05-23 01:52:24,060 - experiment_functions - INFO - Early stopping at epoch 700. Best Metrics: (0.02788377998230951, 0.015901639344262294, 0.023709146865203427)
2026-05-23 01:52:24,143 - optuna.study.study - INFO - Trial 164 finished with values: [0.02788377998230951, 0.015901639344262294, 0.023709146865203427] and parameters: {'n_layers': 2, 'embedding_dim': 96, 'lr': 0.0013488534539100193, 'lambda_val': 1.901210707193677e-05, 'batch_size': 3801, 'optimizer': 'Adam'}.
2026-05-23 01:52:26,639 - experiment_functions - INFO - Early stopping at epoch 600. Best Metrics: (0.027163072890709773, 0.01622950819672131, 0.022003721882298537)
2026-05-23 01:52:26,775 - optuna.study.study - INFO - Trial 165 finished with values: [0.027163072890709773, 0.01622950819672131, 0.022003721882298537] and parameters: {'n_layers': 2, 'embedding_dim': 128, 'lr': 0.0013488534539100193, 'lambda_val': 0.00038573936819964353, 'batch_size': 3166, 'optimizer': 'RMSprop'}.
2026-05-23 01:52:38,546 - optuna.study.study - INFO - Trial 166 finished with values: [0.021834776655781853, 0.012377049180327868, 0.019848897432912946] and parameters: {'n_layers': 2, 'embedding_dim': 32, 'lr': 0.00019017292293356, 'lambda_val': 1.901210707193677e-05, 'batch_size': 1056, 'optimizer': 'Adam'}.
2026-05-23 01:52:40,995 - experiment_functions - INFO - Early stopping at epoch 600. Best Metrics: (0.02703061835831713, 0.015983606557377048, 0.024327933979803373)
2026-05-23 01:52:41,078 - optuna.study.study - INFO - Trial 167 finished with values: [0.02703061835831713, 0.015983606557377048, 0.024327933979803373] and parameters: {'n_layers': 1, 'embedding_dim': 128, 'lr': 0.00878506123035515, 'lambda_val': 2.093095368912283e-06, 'batch_size': 1493, 'optimizer': 'Adam'}.
2026-05-23 01:52:44,031 - experiment_functions - INFO - Early stopping at epoch 850. Best Metrics: (0.030932791275597178, 0.018114754098360657, 0.02981652727662409)
2026-05-23 01:52:44,135 - optuna.study.study - INFO - Trial 168 finished with values: [0.030932791275597178, 0.018114754098360657, 0.02981652727662409] and parameters: {'n_layers': 1, 'embedding_dim': 32, 'lr': 0.0021679791502810398, 'lambda_val': 0.001138541292442641, 'batch_size': 2080, 'optimizer': 'Adam'}.
2026-05-23 01:52:47,886 - experiment_functions - INFO - Early stopping at epoch 1050. Best Metrics: (0.042532410253944566, 0.020819672131147538, 0.0327799071685517)
2026-05-23 01:52:47,978 - optuna.study.study - INFO - Trial 169 finished with values: [0.042532410253944566, 0.020819672131147538, 0.0327799071685517] and parameters: {'n_layers': 3, 'embedding_dim': 128, 'lr': 0.0006111868479200038, 'lambda_val': 3.7205125829824535e-06, 'batch_size': 728, 'optimizer': 'Adam'}.
2026-05-23 01:52:54,892 - experiment_functions - INFO - Early stopping at epoch 1700. Best Metrics: (0.02853184843885689, 0.01819672131147541, 0.028099219688568843)
2026-05-23 01:52:54,981 - optuna.study.study - INFO - Trial 170 finished with values: [0.02853184843885689, 0.01819672131147541, 0.028099219688568843] and parameters: {'n_layers': 3, 'embedding_dim': 256, 'lr': 0.0002669734398444981, 'lambda_val': 1.901210707193677e-05, 'batch_size': 833, 'optimizer': 'Adam'}.
2026-05-23 01:52:58,556 - experiment_functions - INFO - Early stopping at epoch 1100. Best Metrics: (0.019206949050899588, 0.0119672131147541, 0.015400932349430322)
2026-05-23 01:52:58,653 - optuna.study.study - INFO - Trial 171 finished with values: [0.019206949050899588, 0.0119672131147541, 0.015400932349430322] and parameters: {'n_layers': 4, 'embedding_dim': 32, 'lr': 0.0006111868479200038, 'lambda_val': 0.0017105841747060543, 'batch_size': 2925, 'optimizer': 'Adam'}.
2026-05-23 01:53:01,050 - experiment_functions - INFO - Early stopping at epoch 650. Best Metrics: (0.027253360422250867, 0.0169672131147541, 0.025340034663194545)
2026-05-23 01:53:01,136 - optuna.study.study - INFO - Trial 172 finished with values: [0.027253360422250867, 0.0169672131147541, 0.025340034663194545] and parameters: {'n_layers': 4, 'embedding_dim': 64, 'lr': 0.0013488534539100193, 'lambda_val': 0.001138541292442641, 'batch_size': 733, 'optimizer': 'Adam'}.
2026-05-23 01:53:03,854 - experiment_functions - INFO - Early stopping at epoch 600. Best Metrics: (0.02471912256761607, 0.016229508196721313, 0.023858131454593354)
2026-05-23 01:53:03,991 - optuna.study.study - INFO - Trial 173 finished with values: [0.02471912256761607, 0.016229508196721313, 0.023858131454593354] and parameters: {'n_layers': 2, 'embedding_dim': 256, 'lr': 0.0013488534539100193, 'lambda_val': 4.318753706819872e-06, 'batch_size': 733, 'optimizer': 'RMSprop'}.
2026-05-23 01:53:10,996 - experiment_functions - INFO - Early stopping at epoch 1750. Best Metrics: (0.032998104544457174, 0.019508196721311474, 0.02923243897921156)
2026-05-23 01:53:11,088 - optuna.study.study - INFO - Trial 174 finished with values: [0.032998104544457174, 0.019508196721311474, 0.02923243897921156] and parameters: {'n_layers': 3, 'embedding_dim': 256, 'lr': 0.000171992203307018, 'lambda_val': 2.008845612286364e-06, 'batch_size': 1493, 'optimizer': 'RMSprop'}.
2026-05-23 01:53:22,734 - experiment_functions - INFO - Early stopping at epoch 2900. Best Metrics: (0.03235326605161349, 0.02, 0.028112068778833134)
2026-05-23 01:53:22,830 - optuna.study.study - INFO - Trial 175 finished with values: [0.03235326605161349, 0.02, 0.028112068778833134] and parameters: {'n_layers': 3, 'embedding_dim': 256, 'lr': 0.00012667151006330983, 'lambda_val': 0.0017105841747060543, 'batch_size': 2578, 'optimizer': 'RMSprop'}.
2026-05-23 01:53:30,760 - experiment_functions - INFO - Early stopping at epoch 1000. Best Metrics: (0.028872882129519988, 0.0169672131147541, 0.02385069149628018)
2026-05-23 01:53:31,704 - optuna.study.study - INFO - Trial 176 finished with values: [0.028872882129519988, 0.0169672131147541, 0.02385069149628018] and parameters: {'n_layers': 2, 'embedding_dim': 32, 'lr': 0.0006696996604664924, 'lambda_val': 1.276982343137876e-06, 'batch_size': 3166, 'optimizer': 'Adam'}.
2026-05-23 01:53:38,798 - experiment_functions - INFO - Early stopping at epoch 550. Best Metrics: (0.015963676576233796, 0.010245901639344262, 0.014495962068849764)
2026-05-23 01:53:39,134 - optuna.study.study - INFO - Trial 177 finished with values: [0.015963676576233796, 0.010245901639344262, 0.014495962068849764] and parameters: {'n_layers': 2, 'embedding_dim': 128, 'lr': 0.004412673482764488, 'lambda_val': 0.0029444127697785846, 'batch_size': 1056, 'optimizer': 'RMSprop'}.
2026-05-23 01:53:42,434 - experiment_functions - INFO - Early stopping at epoch 850. Best Metrics: (0.02811680885084348, 0.01918032786885246, 0.02741831696719977)
2026-05-23 01:53:42,607 - optuna.study.study - INFO - Trial 178 finished with values: [0.02811680885084348, 0.01918032786885246, 0.02741831696719977] and parameters: {'n_layers': 1, 'embedding_dim': 256, 'lr': 0.0013488534539100193, 'lambda_val': 0.001138541292442641, 'batch_size': 1056, 'optimizer': 'Adam'}.
2026-05-23 01:53:47,096 - experiment_functions - INFO - Early stopping at epoch 1450. Best Metrics: (0.027558376502869523, 0.018934426229508198, 0.0246029120101025)
2026-05-23 01:53:47,445 - optuna.study.study - INFO - Trial 179 finished with values: [0.027558376502869523, 0.018934426229508198, 0.0246029120101025] and parameters: {'n_layers': 1, 'embedding_dim': 128, 'lr': 0.0006111868479200038, 'lambda_val': 0.0022435114946451214, 'batch_size': 3801, 'optimizer': 'Adam'}.
2026-05-23 01:53:50,970 - experiment_functions - INFO - Early stopping at epoch 1150. Best Metrics: (0.03143728676083811, 0.018032786885245903, 0.02809916867281292)
2026-05-23 01:53:51,342 - optuna.study.study - INFO - Trial 180 finished with values: [0.03143728676083811, 0.018032786885245903, 0.02809916867281292] and parameters: {'n_layers': 1, 'embedding_dim': 96, 'lr': 0.0006111868479200038, 'lambda_val': 0.0017105841747060543, 'batch_size': 2925, 'optimizer': 'RMSprop'}.
2026-05-23 01:53:55,018 - experiment_functions - INFO - Early stopping at epoch 800. Best Metrics: (0.008379946926958214, 0.006229508196721313, 0.008916758986837981)
2026-05-23 01:53:55,372 - optuna.study.study - INFO - Trial 181 finished with values: [0.008379946926958214, 0.006229508196721313, 0.008916758986837981] and parameters: {'n_layers': 3, 'embedding_dim': 256, 'lr': 0.07095484550519729, 'lambda_val': 0.0029444127697785846, 'batch_size': 1789, 'optimizer': 'RMSprop'}.
2026-05-23 01:53:57,699 - experiment_functions - INFO - Early stopping at epoch 550. Best Metrics: (0.019665041506643874, 0.010327868852459015, 0.015818219264884872)
2026-05-23 01:53:57,838 - optuna.study.study - INFO - Trial 182 finished with values: [0.019665041506643874, 0.010327868852459015, 0.015818219264884872] and parameters: {'n_layers': 3, 'embedding_dim': 32, 'lr': 0.005415061589635617, 'lambda_val': 2.093095368912283e-06, 'batch_size': 1774, 'optimizer': 'RMSprop'}.
2026-05-23 01:54:11,790 - experiment_functions - INFO - Early stopping at epoch 3700. Best Metrics: (0.021765594480915734, 0.014836065573770494, 0.020635290518710898)
2026-05-23 01:54:11,878 - optuna.study.study - INFO - Trial 183 finished with values: [0.021765594480915734, 0.014836065573770494, 0.020635290518710898] and parameters: {'n_layers': 3, 'embedding_dim': 128, 'lr': 0.00012489769900364984, 'lambda_val': 0.011303484006743482, 'batch_size': 2893, 'optimizer': 'Adam'}.
2026-05-23 01:54:26,220 - experiment_functions - INFO - Early stopping at epoch 3600. Best Metrics: (0.03651642253288844, 0.02057377049180328, 0.032705976407819165)
2026-05-23 01:54:26,872 - optuna.study.study - INFO - Trial 184 finished with values: [0.03651642253288844, 0.02057377049180328, 0.032705976407819165] and parameters: {'n_layers': 3, 'embedding_dim': 64, 'lr': 0.0002669734398444981, 'lambda_val': 2.2024563054207274e-05, 'batch_size': 733, 'optimizer': 'Adam'}.
2026-05-23 01:54:30,735 - experiment_functions - INFO - Early stopping at epoch 750. Best Metrics: (0.02619888276191731, 0.017868852459016395, 0.02234754211093696)
2026-05-23 01:54:31,255 - optuna.study.study - INFO - Trial 185 finished with values: [0.02619888276191731, 0.017868852459016395, 0.02234754211093696] and parameters: {'n_layers': 3, 'embedding_dim': 96, 'lr': 0.0006696996604664924, 'lambda_val': 6.3998980027240765e-06, 'batch_size': 3696, 'optimizer': 'Adam'}.
2026-05-23 01:54:34,313 - experiment_functions - INFO - Early stopping at epoch 550. Best Metrics: (0.012726111891577286, 0.009180327868852459, 0.01109322805159981)
2026-05-23 01:54:34,407 - optuna.study.study - INFO - Trial 186 finished with values: [0.012726111891577286, 0.009180327868852459, 0.01109322805159981] and parameters: {'n_layers': 3, 'embedding_dim': 256, 'lr': 0.009455185494500208, 'lambda_val': 0.003373624884488296, 'batch_size': 833, 'optimizer': 'Adam'}.
2026-05-23 01:54:40,635 - experiment_functions - INFO - Early stopping at epoch 550. Best Metrics: (0.021558579220495127, 0.013524590163934426, 0.020547397856802294)
