2026-05-23 05:10:28,846 - optuna.study.study - INFO - Trial 182 finished with values: [0.08156065079934326, 0.041639344262295076, 0.06855951292863907] and parameters: {'n_layers': 1, 'embedding_dim': 128, 'lr': 0.000145468795718925, 'lambda_val': 0.000296528986412799, 'batch_size': 3864, 'optimizer': 'RMSprop'}.
2026-05-23 05:10:33,624 - experiment_functions - INFO - Early stopping at epoch 850. Best Metrics: (0.08143265930654853, 0.03926229508196721, 0.06560662959821811)
2026-05-23 05:10:33,762 - optuna.study.study - INFO - Trial 183 finished with values: [0.08143265930654853, 0.03926229508196721, 0.06560662959821811] and parameters: {'n_layers': 2, 'embedding_dim': 256, 'lr': 0.0005663247330896729, 'lambda_val': 0.0006153780524713789, 'batch_size': 2871, 'optimizer': 'Adam'}.
2026-05-23 05:10:36,353 - experiment_functions - INFO - Early stopping at epoch 650. Best Metrics: (0.0713610497715128, 0.03721311475409836, 0.05893207638719869)
2026-05-23 05:10:36,438 - optuna.study.study - INFO - Trial 184 finished with values: [0.0713610497715128, 0.03721311475409836, 0.05893207638719869] and parameters: {'n_layers': 1, 'embedding_dim': 32, 'lr': 0.0032256937887088586, 'lambda_val': 4.915768160138094e-05, 'batch_size': 1291, 'optimizer': 'RMSprop'}.
2026-05-23 05:10:39,156 - experiment_functions - INFO - Early stopping at epoch 600. Best Metrics: (0.09960884515320687, 0.05155737704918033, 0.07936623361157852)
2026-05-23 05:10:39,227 - optuna.study.study - INFO - Trial 185 finished with values: [0.09960884515320687, 0.05155737704918033, 0.07936623361157852] and parameters: {'n_layers': 1, 'embedding_dim': 128, 'lr': 0.0027034335159540246, 'lambda_val': 0.0010473675830108427, 'batch_size': 2385, 'optimizer': 'Adam'}.
2026-05-23 05:10:42,585 - experiment_functions - INFO - Early stopping at epoch 500. Best Metrics: (0.0035129996684568265, 0.0020491803278688526, 0.003204914877532414)
2026-05-23 05:10:42,671 - optuna.study.study - INFO - Trial 186 finished with values: [0.0035129996684568265, 0.0020491803278688526, 0.003204914877532414] and parameters: {'n_layers': 3, 'embedding_dim': 256, 'lr': 0.0004134349417792622, 'lambda_val': 3.817491759844064e-06, 'batch_size': 2141, 'optimizer': 'SGD'}.
2026-05-23 05:10:55,227 - optuna.study.study - INFO - Trial 187 finished with values: [0.05169907020768371, 0.030901639344262297, 0.04918961304837551] and parameters: {'n_layers': 1, 'embedding_dim': 32, 'lr': 0.00019262259007340505, 'lambda_val': 4.006717999944042e-05, 'batch_size': 2871, 'optimizer': 'Adam'}.
2026-05-23 05:10:58,255 - experiment_functions - INFO - Early stopping at epoch 500. Best Metrics: (0.0020143015744375457, 0.002213114754098361, 0.002954955378991858)
2026-05-23 05:10:58,346 - optuna.study.study - INFO - Trial 188 finished with values: [0.0020143015744375457, 0.002213114754098361, 0.002954955378991858] and parameters: {'n_layers': 2, 'embedding_dim': 256, 'lr': 0.000498408569398285, 'lambda_val': 0.00475024784706787, 'batch_size': 3221, 'optimizer': 'SGD'}.
2026-05-23 05:11:10,310 - optuna.study.study - INFO - Trial 189 finished with values: [0.005708172297199432, 0.003524590163934427, 0.004701809727482053] and parameters: {'n_layers': 1, 'embedding_dim': 32, 'lr': 6.972522103415218e-05, 'lambda_val': 1.5151010201857327e-06, 'batch_size': 2390, 'optimizer': 'Adam'}.
2026-05-23 05:11:12,965 - experiment_functions - INFO - Early stopping at epoch 600. Best Metrics: (0.0863157645809988, 0.04598360655737705, 0.0789086259579588)
2026-05-23 05:11:13,047 - optuna.study.study - INFO - Trial 190 finished with values: [0.0863157645809988, 0.04598360655737705, 0.0789086259579588] and parameters: {'n_layers': 1, 'embedding_dim': 64, 'lr': 0.0027034335159540246, 'lambda_val': 0.0022074927841841977, 'batch_size': 3945, 'optimizer': 'Adam'}.
2026-05-23 05:11:15,520 - experiment_functions - INFO - Early stopping at epoch 550. Best Metrics: (0.06860910144440226, 0.038688524590163934, 0.06163428936394909)
2026-05-23 05:11:15,669 - optuna.study.study - INFO - Trial 191 finished with values: [0.06860910144440226, 0.038688524590163934, 0.06163428936394909] and parameters: {'n_layers': 1, 'embedding_dim': 32, 'lr': 0.0032256937887088586, 'lambda_val': 4.006717999944042e-05, 'batch_size': 2390, 'optimizer': 'RMSprop'}.
2026-05-23 05:11:18,266 - experiment_functions - INFO - Early stopping at epoch 500. Best Metrics: (0.0020122787513292325, 0.0018852459016393442, 0.0019393520509259164)
2026-05-23 05:11:18,346 - optuna.study.study - INFO - Trial 192 finished with values: [0.0020122787513292325, 0.0018852459016393442, 0.0019393520509259164] and parameters: {'n_layers': 1, 'embedding_dim': 256, 'lr': 0.000498408569398285, 'lambda_val': 0.00649767144966084, 'batch_size': 3648, 'optimizer': 'SGD'}.
2026-05-23 05:11:33,552 - optuna.study.study - INFO - Trial 193 finished with values: [0.043552848437466214, 0.02745901639344262, 0.04086776875395118] and parameters: {'n_layers': 3, 'embedding_dim': 64, 'lr': 0.000145468795718925, 'lambda_val': 0.00619655064381492, 'batch_size': 1404, 'optimizer': 'RMSprop'}.
2026-05-23 05:11:46,570 - optuna.study.study - INFO - Trial 194 finished with values: [0.03925521874721594, 0.024016393442622953, 0.0361010783199381] and parameters: {'n_layers': 2, 'embedding_dim': 32, 'lr': 0.00015281876966777362, 'lambda_val': 4.1180591213499634e-05, 'batch_size': 514, 'optimizer': 'Adam'}.
2026-05-23 05:11:49,231 - experiment_functions - INFO - Early stopping at epoch 650. Best Metrics: (0.10227915537883589, 0.05024590163934427, 0.08757935031903662)
2026-05-23 05:11:49,325 - optuna.study.study - INFO - Trial 195 finished with values: [0.10227915537883589, 0.05024590163934427, 0.08757935031903662] and parameters: {'n_layers': 1, 'embedding_dim': 32, 'lr': 0.0032256937887088586, 'lambda_val': 6.509910298202351e-05, 'batch_size': 514, 'optimizer': 'Adam'}.
2026-05-23 05:12:01,817 - optuna.study.study - INFO - Trial 196 finished with values: [0.05217631052003052, 0.033852459016393444, 0.04849232312918805] and parameters: {'n_layers': 1, 'embedding_dim': 32, 'lr': 0.00019262259007340505, 'lambda_val': 0.021857441898757924, 'batch_size': 2908, 'optimizer': 'RMSprop'}.
2026-05-23 05:12:04,456 - experiment_functions - INFO - Early stopping at epoch 600. Best Metrics: (0.08262853277258413, 0.04590163934426229, 0.07615887629891037)
2026-05-23 05:12:04,587 - optuna.study.study - INFO - Trial 197 finished with values: [0.08262853277258413, 0.04590163934426229, 0.07615887629891037] and parameters: {'n_layers': 1, 'embedding_dim': 64, 'lr': 0.0027034335159540246, 'lambda_val': 4.006717999944042e-05, 'batch_size': 2871, 'optimizer': 'Adam'}.
2026-05-23 05:12:08,460 - experiment_functions - INFO - Early stopping at epoch 1050. Best Metrics: (0.05155895268600949, 0.0330327868852459, 0.046112400124900456)
2026-05-23 05:12:08,811 - optuna.study.study - INFO - Trial 198 finished with values: [0.05155895268600949, 0.0330327868852459, 0.046112400124900456] and parameters: {'n_layers': 1, 'embedding_dim': 32, 'lr': 0.000498408569398285, 'lambda_val': 0.021857441898757924, 'batch_size': 3864, 'optimizer': 'Adam'}.
2026-05-23 05:12:12,008 - experiment_functions - INFO - Early stopping at epoch 600. Best Metrics: (0.05153554549723371, 0.0269672131147541, 0.04181510619939133)
2026-05-23 05:12:12,673 - optuna.study.study - INFO - Trial 199 finished with values: [0.05153554549723371, 0.0269672131147541, 0.04181510619939133] and parameters: {'n_layers': 2, 'embedding_dim': 128, 'lr': 0.0016740667020226415, 'lambda_val': 0.00021101472337125337, 'batch_size': 3696, 'optimizer': 'RMSprop'}.
2026-05-23 05:12:20,055 - experiment_functions - INFO - Early stopping at epoch 2150. Best Metrics: (0.11374001559696756, 0.05426229508196721, 0.08895180283345092)
2026-05-23 05:12:20,145 - optuna.study.study - INFO - Trial 200 finished with values: [0.11374001559696756, 0.05426229508196721, 0.08895180283345092] and parameters: {'n_layers': 1, 'embedding_dim': 96, 'lr': 0.000498408569398285, 'lambda_val': 0.00039751224330328457, 'batch_size': 1699, 'optimizer': 'RMSprop'}.
2026-05-23 05:12:23,801 - experiment_functions - INFO - Early stopping at epoch 750. Best Metrics: (0.0294118338104158, 0.014016393442622952, 0.022879736880849568)
2026-05-23 05:12:24,777 - optuna.study.study - INFO - Trial 201 finished with values: [0.0294118338104158, 0.014016393442622952, 0.022879736880849568] and parameters: {'n_layers': 3, 'embedding_dim': 64, 'lr': 0.0032256937887088586, 'lambda_val': 1.2213470032695958e-05, 'batch_size': 3544, 'optimizer': 'RMSprop'}.
2026-05-23 05:12:27,536 - experiment_functions - INFO - Early stopping at epoch 650. Best Metrics: (0.07672510357510405, 0.04434426229508196, 0.0676015112500871)
2026-05-23 05:12:27,669 - optuna.study.study - INFO - Trial 202 finished with values: [0.07672510357510405, 0.04434426229508196, 0.0676015112500871] and parameters: {'n_layers': 1, 'embedding_dim': 32, 'lr': 0.0032256937887088586, 'lambda_val': 2.574139920026743e-05, 'batch_size': 1571, 'optimizer': 'Adam'}.
2026-05-23 05:12:43,495 - optuna.study.study - INFO - Trial 203 finished with values: [0.07542589315915268, 0.04221311475409836, 0.06287276078474614] and parameters: {'n_layers': 1, 'embedding_dim': 256, 'lr': 0.00015281876966777362, 'lambda_val': 0.014381121669718087, 'batch_size': 2378, 'optimizer': 'Adam'}.
2026-05-23 05:12:46,022 - experiment_functions - INFO - Early stopping at epoch 600. Best Metrics: (0.07495743834749695, 0.037295081967213116, 0.06470412080505765)
2026-05-23 05:12:46,107 - optuna.study.study - INFO - Trial 204 finished with values: [0.07495743834749695, 0.037295081967213116, 0.06470412080505765] and parameters: {'n_layers': 1, 'embedding_dim': 32, 'lr': 0.0038395352156522272, 'lambda_val': 1.2213470032695958e-05, 'batch_size': 1291, 'optimizer': 'RMSprop'}.
2026-05-23 05:12:50,084 - experiment_functions - INFO - Early stopping at epoch 550. Best Metrics: (0.040715976933104865, 0.021147540983606557, 0.0338700000804698)
2026-05-23 05:12:50,160 - optuna.study.study - INFO - Trial 205 finished with values: [0.040715976933104865, 0.021147540983606557, 0.0338700000804698] and parameters: {'n_layers': 1, 'embedding_dim': 32, 'lr': 0.03033667620390057, 'lambda_val': 0.0006153780524713789, 'batch_size': 3699, 'optimizer': 'Adam'}.
2026-05-23 05:12:52,851 - experiment_functions - INFO - Early stopping at epoch 650. Best Metrics: (0.08508806395788869, 0.04557377049180328, 0.0739329779479554)
2026-05-23 05:12:52,942 - optuna.study.study - INFO - Trial 206 finished with values: [0.08508806395788869, 0.04557377049180328, 0.0739329779479554] and parameters: {'n_layers': 1, 'embedding_dim': 32, 'lr': 0.0032256937887088586, 'lambda_val': 6.509910298202351e-05, 'batch_size': 514, 'optimizer': 'Adam'}.
2026-05-23 05:13:06,661 - optuna.study.study - INFO - Trial 207 finished with values: [0.09917592201006054, 0.049918032786885246, 0.0825819547101037] and parameters: {'n_layers': 1, 'embedding_dim': 128, 'lr': 0.00019262259007340505, 'lambda_val': 0.001047860017743232, 'batch_size': 2445, 'optimizer': 'RMSprop'}.
2026-05-23 05:13:09,143 - experiment_functions - INFO - Early stopping at epoch 550. Best Metrics: (0.07732885761334043, 0.04, 0.06492895259404605)
2026-05-23 05:13:09,244 - optuna.study.study - INFO - Trial 208 finished with values: [0.07732885761334043, 0.04, 0.06492895259404605] and parameters: {'n_layers': 1, 'embedding_dim': 32, 'lr': 0.0032256937887088586, 'lambda_val': 4.006717999944042e-05, 'batch_size': 2871, 'optimizer': 'RMSprop'}.
2026-05-23 05:13:29,955 - experiment_functions - INFO - Early stopping at epoch 3900. Best Metrics: (0.06571343050201296, 0.03844262295081967, 0.0577603283691764)
2026-05-23 05:13:30,167 - optuna.study.study - INFO - Trial 209 finished with values: [0.06571343050201296, 0.03844262295081967, 0.0577603283691764] and parameters: {'n_layers': 2, 'embedding_dim': 256, 'lr': 0.0001413193463806038, 'lambda_val': 0.000765889777157795, 'batch_size': 2244, 'optimizer': 'Adam'}.
2026-05-23 05:13:32,845 - experiment_functions - INFO - Early stopping at epoch 600. Best Metrics: (0.044223793001584244, 0.030573770491803282, 0.038704870644156814)
2026-05-23 05:13:32,922 - optuna.study.study - INFO - Trial 210 finished with values: [0.044223793001584244, 0.030573770491803282, 0.038704870644156814] and parameters: {'n_layers': 1, 'embedding_dim': 128, 'lr': 0.0027034335159540246, 'lambda_val': 0.05016509155849099, 'batch_size': 1182, 'optimizer': 'Adam'}.
2026-05-23 05:13:37,644 - experiment_functions - INFO - Early stopping at epoch 1400. Best Metrics: (0.0013181441508517352, 0.001639344262295082, 0.001934772648172764)
2026-05-23 05:13:38,461 - optuna.study.study - INFO - Trial 211 finished with values: [0.0013181441508517352, 0.001639344262295082, 0.001934772648172764] and parameters: {'n_layers': 1, 'embedding_dim': 32, 'lr': 2.1147333937282323e-05, 'lambda_val': 6.509910298202351e-05, 'batch_size': 514, 'optimizer': 'Adam'}.
2026-05-23 05:13:43,592 - experiment_functions - INFO - Early stopping at epoch 1400. Best Metrics: (0.09472350974143363, 0.05008196721311475, 0.08043920548678563)
2026-05-23 05:13:43,741 - optuna.study.study - INFO - Trial 212 finished with values: [0.09472350974143363, 0.05008196721311475, 0.08043920548678563] and parameters: {'n_layers': 1, 'embedding_dim': 64, 'lr': 0.000498408569398285, 'lambda_val': 0.00475024784706787, 'batch_size': 2784, 'optimizer': 'Adam'}.
2026-05-23 05:13:46,577 - experiment_functions - INFO - Early stopping at epoch 600. Best Metrics: (0.0944766252307499, 0.04614754098360656, 0.0790643085824648)
2026-05-23 05:13:47,740 - optuna.study.study - INFO - Trial 213 finished with values: [0.0944766252307499, 0.04614754098360656, 0.0790643085824648] and parameters: {'n_layers': 1, 'embedding_dim': 128, 'lr': 0.0027034335159540246, 'lambda_val': 2.7554943772348907e-05, 'batch_size': 3864, 'optimizer': 'Adam'}.
2026-05-23 05:14:00,828 - optuna.study.study - INFO - Trial 214 finished with values: [0.07088729777800439, 0.038688524590163934, 0.062347802474477174] and parameters: {'n_layers': 1, 'embedding_dim': 128, 'lr': 0.00015281876966777362, 'lambda_val': 4.915768160138094e-05, 'batch_size': 1182, 'optimizer': 'RMSprop'}.
2026-05-23 05:14:19,557 - optuna.study.study - INFO - Trial 215 finished with values: [0.07823936244278035, 0.04180327868852459, 0.06676147735178381] and parameters: {'n_layers': 2, 'embedding_dim': 256, 'lr': 0.00015281876966777362, 'lambda_val': 0.0006153780524713789, 'batch_size': 1025, 'optimizer': 'Adam'}.
2026-05-23 05:14:23,416 - experiment_functions - INFO - Early stopping at epoch 600. Best Metrics: (0.09031793992464707, 0.0490983606557377, 0.07789010314221795)
2026-05-23 05:14:24,235 - optuna.study.study - INFO - Trial 216 finished with values: [0.09031793992464707, 0.0490983606557377, 0.07789010314221795] and parameters: {'n_layers': 1, 'embedding_dim': 128, 'lr': 0.0027034335159540246, 'lambda_val': 0.0010473675830108427, 'batch_size': 2385, 'optimizer': 'Adam'}.
2026-05-23 05:14:32,596 - experiment_functions - INFO - Early stopping at epoch 650. Best Metrics: (0.09718021100767965, 0.04737704918032787, 0.07812508211181997)
2026-05-23 05:14:32,950 - optuna.study.study - INFO - Trial 217 finished with values: [0.09718021100767965, 0.04737704918032787, 0.07812508211181997] and parameters: {'n_layers': 1, 'embedding_dim': 64, 'lr': 0.0032256937887088586, 'lambda_val': 2.6112469187203954e-06, 'batch_size': 1291, 'optimizer': 'Adam'}.
2026-05-23 05:14:40,304 - experiment_functions - INFO - Early stopping at epoch 1250. Best Metrics: (0.05476849215554776, 0.03467213114754098, 0.04934746181037592)
2026-05-23 05:14:41,365 - optuna.study.study - INFO - Trial 218 finished with values: [0.05476849215554776, 0.03467213114754098, 0.04934746181037592] and parameters: {'n_layers': 3, 'embedding_dim': 32, 'lr': 0.000498408569398285, 'lambda_val': 0.00475024784706787, 'batch_size': 622, 'optimizer': 'Adam'}.
2026-05-23 05:14:43,693 - experiment_functions - INFO - Early stopping at epoch 600. Best Metrics: (0.07456913824553563, 0.04262295081967213, 0.06733374652694585)
2026-05-23 05:14:43,789 - optuna.study.study - INFO - Trial 219 finished with values: [0.07456913824553563, 0.04262295081967213, 0.06733374652694585] and parameters: {'n_layers': 1, 'embedding_dim': 64, 'lr': 0.0027034335159540246, 'lambda_val': 0.0022074927841841977, 'batch_size': 3945, 'optimizer': 'Adam'}.
2026-05-23 05:14:46,419 - experiment_functions - INFO - Early stopping at epoch 600. Best Metrics: (0.09662453057665676, 0.0489344262295082, 0.08167198760863215)
2026-05-23 05:14:46,586 - optuna.study.study - INFO - Trial 220 finished with values: [0.09662453057665676, 0.0489344262295082, 0.08167198760863215] and parameters: {'n_layers': 1, 'embedding_dim': 128, 'lr': 0.00339188356309059, 'lambda_val': 3.5614573447749906e-05, 'batch_size': 3864, 'optimizer': 'Adam'}.
2026-05-23 05:15:01,186 - optuna.study.study - INFO - Trial 221 finished with values: [0.08575053707660002, 0.04885245901639344, 0.076147677623105] and parameters: {'n_layers': 1, 'embedding_dim': 256, 'lr': 0.000145468795718925, 'lambda_val': 0.00619655064381492, 'batch_size': 2904, 'optimizer': 'RMSprop'}.
2026-05-23 05:15:03,765 - experiment_functions - INFO - Early stopping at epoch 750. Best Metrics: (0.08575219908070558, 0.042704918032786886, 0.07428374653532772)
2026-05-23 05:15:03,851 - optuna.study.study - INFO - Trial 222 finished with values: [0.08575219908070558, 0.042704918032786886, 0.07428374653532772] and parameters: {'n_layers': 1, 'embedding_dim': 64, 'lr': 0.0027034335159540246, 'lambda_val': 0.0003464722773423699, 'batch_size': 837, 'optimizer': 'Adam'}.
2026-05-23 05:15:06,324 - experiment_functions - INFO - Early stopping at epoch 700. Best Metrics: (0.08446905598197257, 0.04418032786885246, 0.07413756675116374)
2026-05-23 05:15:06,412 - optuna.study.study - INFO - Trial 223 finished with values: [0.08446905598197257, 0.04418032786885246, 0.07413756675116374] and parameters: {'n_layers': 1, 'embedding_dim': 32, 'lr': 0.0032256937887088586, 'lambda_val': 1.2213470032695958e-05, 'batch_size': 1291, 'optimizer': 'Adam'}.
2026-05-23 05:15:17,665 - experiment_functions - INFO - Early stopping at epoch 3850. Best Metrics: (0.11993038364640955, 0.055901639344262295, 0.09528302003018169)
2026-05-23 05:15:18,734 - optuna.study.study - INFO - Trial 224 finished with values: [0.11993038364640955, 0.055901639344262295, 0.09528302003018169] and parameters: {'n_layers': 1, 'embedding_dim': 128, 'lr': 0.0004134349417792622, 'lambda_val': 4.915768160138094e-05, 'batch_size': 1834, 'optimizer': 'Adam'}.
2026-05-23 05:15:21,849 - experiment_functions - INFO - Early stopping at epoch 700. Best Metrics: (0.11232645511153941, 0.05360655737704918, 0.08964216001563963)
2026-05-23 05:15:22,854 - optuna.study.study - INFO - Trial 225 finished with values: [0.11232645511153941, 0.05360655737704918, 0.08964216001563963] and parameters: {'n_layers': 1, 'embedding_dim': 256, 'lr': 0.001814498584431129, 'lambda_val': 1.2001855638465737e-05, 'batch_size': 1834, 'optimizer': 'Adam'}.
2026-05-23 05:15:25,338 - experiment_functions - INFO - Early stopping at epoch 600. Best Metrics: (0.07832206605970636, 0.04024590163934426, 0.06628011102266343)
2026-05-23 05:15:26,351 - optuna.study.study - INFO - Trial 226 finished with values: [0.07832206605970636, 0.04024590163934426, 0.06628011102266343] and parameters: {'n_layers': 1, 'embedding_dim': 128, 'lr': 0.0027034335159540246, 'lambda_val': 2.7554943772348907e-05, 'batch_size': 2385, 'optimizer': 'RMSprop'}.
2026-05-23 05:15:31,071 - experiment_functions - INFO - Early stopping at epoch 850. Best Metrics: (0.06357350998931209, 0.03532786885245901, 0.057016415986104074)
2026-05-23 05:15:31,190 - optuna.study.study - INFO - Trial 227 finished with values: [0.06357350998931209, 0.03532786885245901, 0.057016415986104074] and parameters: {'n_layers': 2, 'embedding_dim': 256, 'lr': 0.0005663247330896729, 'lambda_val': 4.006717999944042e-05, 'batch_size': 2871, 'optimizer': 'Adam'}.
2026-05-23 05:15:46,339 - optuna.study.study - INFO - Trial 228 finished with values: [0.08268168167820295, 0.0430327868852459, 0.06623465140408206] and parameters: {'n_layers': 1, 'embedding_dim': 256, 'lr': 0.00015281876966777362, 'lambda_val': 0.005533850674744085, 'batch_size': 2378, 'optimizer': 'Adam'}.
2026-05-23 05:15:51,731 - experiment_functions - INFO - Early stopping at epoch 1900. Best Metrics: (0.0018019970371244997, 0.002213114754098361, 0.0023240485381671124)
2026-05-23 05:15:51,813 - optuna.study.study - INFO - Trial 229 finished with values: [0.0018019970371244997, 0.002213114754098361, 0.0023240485381671124] and parameters: {'n_layers': 1, 'embedding_dim': 64, 'lr': 4.73866023741188e-05, 'lambda_val': 4.006717999944042e-05, 'batch_size': 2871, 'optimizer': 'Adam'}.
2026-05-23 05:16:04,207 - experiment_functions - INFO - Early stopping at epoch 2650. Best Metrics: (0.060330440542708474, 0.03278688524590164, 0.05281067091479016)
2026-05-23 05:16:04,284 - optuna.study.study - INFO - Trial 230 finished with values: [0.060330440542708474, 0.03278688524590164, 0.05281067091479016] and parameters: {'n_layers': 2, 'embedding_dim': 256, 'lr': 0.000145468795718925, 'lambda_val': 0.0022074927841841977, 'batch_size': 3648, 'optimizer': 'Adam'}.
2026-05-23 05:16:06,398 - experiment_functions - INFO - Early stopping at epoch 500. Best Metrics: (0.0019008632746037415, 0.0017213114754098362, 0.0021428848546045077)
2026-05-23 05:16:06,497 - optuna.study.study - INFO - Trial 231 finished with values: [0.0019008632746037415, 0.0017213114754098362, 0.0021428848546045077] and parameters: {'n_layers': 1, 'embedding_dim': 128, 'lr': 0.0032256937887088586, 'lambda_val': 4.915768160138094e-05, 'batch_size': 1291, 'optimizer': 'SGD'}.
