2026-05-23 03:31:09,600 - optuna.study.study - INFO - Trial 223 finished with values: [0.06826076036626087, 0.03770491803278689, 0.058589185450567315] and parameters: {'n_layers': 1, 'embedding_dim': 32, 'lr': 0.0002420461840440046, 'lambda_val': 0.0021605260106213964, 'batch_size': 2924, 'optimizer': 'Adam'}.
2026-05-23 03:31:20,540 - optuna.study.study - INFO - Trial 224 finished with values: [0.0034137804570425483, 0.002459016393442623, 0.0035069291469933626] and parameters: {'n_layers': 1, 'embedding_dim': 32, 'lr': 5.2006071349896806e-05, 'lambda_val': 2.27009302283491e-06, 'batch_size': 2924, 'optimizer': 'Adam'}.
2026-05-23 03:31:27,732 - experiment_functions - INFO - Early stopping at epoch 2500. Best Metrics: (0.09067320012452243, 0.04770491803278689, 0.07764691570475554)
2026-05-23 03:31:27,803 - optuna.study.study - INFO - Trial 225 finished with values: [0.09067320012452243, 0.04770491803278689, 0.07764691570475554] and parameters: {'n_layers': 1, 'embedding_dim': 64, 'lr': 0.0003045924167681918, 'lambda_val': 0.00012928174782861758, 'batch_size': 2325, 'optimizer': 'RMSprop'}.
2026-05-23 03:31:32,238 - experiment_functions - INFO - Early stopping at epoch 1450. Best Metrics: (0.09925436256173613, 0.048032786885245905, 0.07831270489273663)
2026-05-23 03:31:33,314 - optuna.study.study - INFO - Trial 226 finished with values: [0.09925436256173613, 0.048032786885245905, 0.07831270489273663] and parameters: {'n_layers': 1, 'embedding_dim': 32, 'lr': 0.0007646684933610155, 'lambda_val': 0.0021605260106213964, 'batch_size': 3903, 'optimizer': 'Adam'}.
2026-05-23 03:31:40,394 - experiment_functions - INFO - Early stopping at epoch 2150. Best Metrics: (0.10283047055716502, 0.04950819672131147, 0.09007226204583357)
2026-05-23 03:31:40,477 - optuna.study.study - INFO - Trial 227 finished with values: [0.10283047055716502, 0.04950819672131147, 0.09007226204583357] and parameters: {'n_layers': 1, 'embedding_dim': 128, 'lr': 0.000293040961262534, 'lambda_val': 0.003966779220729784, 'batch_size': 3009, 'optimizer': 'Adam'}.
2026-05-23 03:31:45,100 - experiment_functions - INFO - Early stopping at epoch 1250. Best Metrics: (0.09039879215481583, 0.04836065573770492, 0.0833620811876456)
2026-05-23 03:31:46,122 - optuna.study.study - INFO - Trial 228 finished with values: [0.09039879215481583, 0.04836065573770492, 0.0833620811876456] and parameters: {'n_layers': 1, 'embedding_dim': 32, 'lr': 0.0007646684933610155, 'lambda_val': 9.572532355529234e-05, 'batch_size': 2913, 'optimizer': 'Adam'}.
2026-05-23 03:31:48,577 - experiment_functions - INFO - Early stopping at epoch 500. Best Metrics: (0.002395392289027794, 0.0022950819672131148, 0.002792079351298903)
2026-05-23 03:31:48,664 - optuna.study.study - INFO - Trial 229 finished with values: [0.002395392289027794, 0.0022950819672131148, 0.002792079351298903] and parameters: {'n_layers': 2, 'embedding_dim': 96, 'lr': 0.0006141623244842363, 'lambda_val': 0.0006383294603067735, 'batch_size': 2956, 'optimizer': 'SGD'}.
2026-05-23 03:32:03,654 - optuna.study.study - INFO - Trial 230 finished with values: [0.09484589223431396, 0.048606557377049185, 0.07764787447368689] and parameters: {'n_layers': 1, 'embedding_dim': 256, 'lr': 0.00016280054939343404, 'lambda_val': 0.00011132011432528227, 'batch_size': 1809, 'optimizer': 'RMSprop'}.
2026-05-23 03:32:05,719 - experiment_functions - INFO - Early stopping at epoch 500. Best Metrics: (0.0014960023808485183, 0.0017213114754098366, 0.002037782072374276)
2026-05-23 03:32:05,804 - optuna.study.study - INFO - Trial 231 finished with values: [0.0014960023808485183, 0.0017213114754098366, 0.002037782072374276] and parameters: {'n_layers': 1, 'embedding_dim': 32, 'lr': 0.0005051991365347398, 'lambda_val': 0.003682953748927488, 'batch_size': 1482, 'optimizer': 'SGD'}.
2026-05-23 03:32:13,158 - experiment_functions - INFO - Early stopping at epoch 650. Best Metrics: (0.08477428492811535, 0.042950819672131144, 0.07013645871667727)
2026-05-23 03:32:13,732 - optuna.study.study - INFO - Trial 232 finished with values: [0.08477428492811535, 0.042950819672131144, 0.07013645871667727] and parameters: {'n_layers': 1, 'embedding_dim': 32, 'lr': 0.0031305185360713038, 'lambda_val': 8.70357449478779e-06, 'batch_size': 2924, 'optimizer': 'Adam'}.
2026-05-23 03:32:24,621 - experiment_functions - INFO - Early stopping at epoch 1700. Best Metrics: (0.08518722826866561, 0.048770491803278686, 0.07550403858193754)
2026-05-23 03:32:24,705 - optuna.study.study - INFO - Trial 233 finished with values: [0.08518722826866561, 0.048770491803278686, 0.07550403858193754] and parameters: {'n_layers': 1, 'embedding_dim': 32, 'lr': 0.0005051991365347398, 'lambda_val': 0.00018385882411773826, 'batch_size': 4091, 'optimizer': 'RMSprop'}.
2026-05-23 03:32:30,746 - experiment_functions - INFO - Early stopping at epoch 1600. Best Metrics: (0.11519770723777405, 0.0548360655737705, 0.09601139491439613)
2026-05-23 03:32:31,936 - optuna.study.study - INFO - Trial 234 finished with values: [0.11519770723777405, 0.0548360655737705, 0.09601139491439613] and parameters: {'n_layers': 1, 'embedding_dim': 96, 'lr': 0.0005051991365347398, 'lambda_val': 0.00012928174782861758, 'batch_size': 1921, 'optimizer': 'Adam'}.
2026-05-23 03:32:36,485 - experiment_functions - INFO - Early stopping at epoch 1100. Best Metrics: (0.06905221928342822, 0.040245901639344266, 0.0601967303436595)
2026-05-23 03:32:36,840 - optuna.study.study - INFO - Trial 235 finished with values: [0.06905221928342822, 0.040245901639344266, 0.0601967303436595] and parameters: {'n_layers': 2, 'embedding_dim': 64, 'lr': 0.0005051991365347398, 'lambda_val': 1.1089062865721479e-05, 'batch_size': 2913, 'optimizer': 'RMSprop'}.
2026-05-23 03:32:45,777 - experiment_functions - INFO - Early stopping at epoch 2150. Best Metrics: (0.04751015551763481, 0.028606557377049178, 0.041844182400736465)
2026-05-23 03:32:46,022 - optuna.study.study - INFO - Trial 236 finished with values: [0.04751015551763481, 0.028606557377049178, 0.041844182400736465] and parameters: {'n_layers': 3, 'embedding_dim': 64, 'lr': 0.000293040961262534, 'lambda_val': 2.27009302283491e-06, 'batch_size': 2924, 'optimizer': 'Adam'}.
2026-05-23 03:32:52,031 - experiment_functions - INFO - Early stopping at epoch 1450. Best Metrics: (0.07739039227112396, 0.044590163934426226, 0.06843780918766192)
2026-05-23 03:32:52,882 - optuna.study.study - INFO - Trial 237 finished with values: [0.07739039227112396, 0.044590163934426226, 0.06843780918766192] and parameters: {'n_layers': 1, 'embedding_dim': 256, 'lr': 0.000293040961262534, 'lambda_val': 0.005672765240199157, 'batch_size': 3527, 'optimizer': 'RMSprop'}.
2026-05-23 03:32:55,336 - experiment_functions - INFO - Early stopping at epoch 650. Best Metrics: (0.05542600197746431, 0.032622950819672134, 0.044665917740592066)
2026-05-23 03:32:55,419 - optuna.study.study - INFO - Trial 238 finished with values: [0.05542600197746431, 0.032622950819672134, 0.044665917740592066] and parameters: {'n_layers': 2, 'embedding_dim': 32, 'lr': 0.0019040849385408827, 'lambda_val': 0.0005365242793466337, 'batch_size': 1828, 'optimizer': 'Adam'}.
2026-05-23 03:32:57,824 - experiment_functions - INFO - Early stopping at epoch 650. Best Metrics: (0.06091688952086133, 0.03532786885245902, 0.0536024235867409)
2026-05-23 03:32:57,986 - optuna.study.study - INFO - Trial 239 finished with values: [0.06091688952086133, 0.03532786885245902, 0.0536024235867409] and parameters: {'n_layers': 1, 'embedding_dim': 32, 'lr': 0.0031305185360713038, 'lambda_val': 0.003966779220729784, 'batch_size': 800, 'optimizer': 'RMSprop'}.
2026-05-23 03:33:12,160 - experiment_functions - INFO - Early stopping at epoch 3750. Best Metrics: (0.043096089843072276, 0.024918032786885244, 0.03902886304324265)
2026-05-23 03:33:12,655 - optuna.study.study - INFO - Trial 240 finished with values: [0.043096089843072276, 0.024918032786885244, 0.03902886304324265] and parameters: {'n_layers': 4, 'embedding_dim': 32, 'lr': 0.000293040961262534, 'lambda_val': 8.70357449478779e-06, 'batch_size': 2924, 'optimizer': 'Adam'}.
2026-05-23 03:33:29,773 - optuna.study.study - INFO - Trial 241 finished with values: [0.08431428984022722, 0.04418032786885246, 0.07418171231336382] and parameters: {'n_layers': 1, 'embedding_dim': 64, 'lr': 0.00026369318535533407, 'lambda_val': 0.00018385882411773826, 'batch_size': 2924, 'optimizer': 'Adam'}.
2026-05-23 03:33:35,199 - experiment_functions - INFO - Early stopping at epoch 1750. Best Metrics: (0.10058616403703301, 0.049180327868852465, 0.08469740025110095)
2026-05-23 03:33:35,959 - optuna.study.study - INFO - Trial 242 finished with values: [0.10058616403703301, 0.049180327868852465, 0.08469740025110095] and parameters: {'n_layers': 1, 'embedding_dim': 64, 'lr': 0.0005051991365347398, 'lambda_val': 0.00012928174782861758, 'batch_size': 2924, 'optimizer': 'Adam'}.
2026-05-23 03:33:42,091 - experiment_functions - INFO - Early stopping at epoch 1700. Best Metrics: (0.10835854806406688, 0.05245901639344262, 0.0901804809888207)
2026-05-23 03:33:42,171 - optuna.study.study - INFO - Trial 243 finished with values: [0.10835854806406688, 0.05245901639344262, 0.0901804809888207] and parameters: {'n_layers': 1, 'embedding_dim': 96, 'lr': 0.0005051991365347398, 'lambda_val': 0.0006925998341796127, 'batch_size': 3013, 'optimizer': 'Adam'}.
2026-05-23 03:33:44,256 - experiment_functions - INFO - Early stopping at epoch 500. Best Metrics: (0.0016451289379062848, 0.001967213114754099, 0.0019230710133826493)
2026-05-23 03:33:44,355 - optuna.study.study - INFO - Trial 244 finished with values: [0.0016451289379062848, 0.001967213114754099, 0.0019230710133826493] and parameters: {'n_layers': 1, 'embedding_dim': 64, 'lr': 0.0003084507924491364, 'lambda_val': 8.029603261406284e-05, 'batch_size': 2528, 'optimizer': 'SGD'}.
2026-05-23 03:33:56,400 - optuna.study.study - INFO - Trial 245 finished with values: [0.057818293656708604, 0.03270491803278689, 0.05096795183894139] and parameters: {'n_layers': 1, 'embedding_dim': 32, 'lr': 0.00017874589253277036, 'lambda_val': 0.0021605260106213964, 'batch_size': 3903, 'optimizer': 'Adam'}.
2026-05-23 03:33:59,099 - experiment_functions - INFO - Early stopping at epoch 650. Best Metrics: (0.10116720078026742, 0.048770491803278686, 0.08535114985831907)
2026-05-23 03:33:59,197 - optuna.study.study - INFO - Trial 246 finished with values: [0.10116720078026742, 0.048770491803278686, 0.08535114985831907] and parameters: {'n_layers': 1, 'embedding_dim': 32, 'lr': 0.0031305185360713038, 'lambda_val': 0.0006383294603067735, 'batch_size': 2228, 'optimizer': 'Adam'}.
2026-05-23 03:34:05,846 - experiment_functions - INFO - Early stopping at epoch 2050. Best Metrics: (0.09521245162068682, 0.04786885245901639, 0.07863631385806896)
2026-05-23 03:34:05,930 - optuna.study.study - INFO - Trial 247 finished with values: [0.09521245162068682, 0.04786885245901639, 0.07863631385806896] and parameters: {'n_layers': 1, 'embedding_dim': 32, 'lr': 0.0005051991365347398, 'lambda_val': 0.003682953748927488, 'batch_size': 1429, 'optimizer': 'RMSprop'}.
2026-05-23 03:34:11,116 - experiment_functions - INFO - Early stopping at epoch 1350. Best Metrics: (0.11124219593229809, 0.05319672131147542, 0.08747431944320047)
2026-05-23 03:34:11,275 - optuna.study.study - INFO - Trial 248 finished with values: [0.11124219593229809, 0.05319672131147542, 0.08747431944320047] and parameters: {'n_layers': 1, 'embedding_dim': 128, 'lr': 0.00040399467358961797, 'lambda_val': 0.002975925723961986, 'batch_size': 2913, 'optimizer': 'Adam'}.
2026-05-23 03:34:14,157 - experiment_functions - INFO - Early stopping at epoch 600. Best Metrics: (0.0791898010054908, 0.04188524590163935, 0.07366263790178923)
2026-05-23 03:34:14,526 - optuna.study.study - INFO - Trial 249 finished with values: [0.0791898010054908, 0.04188524590163935, 0.07366263790178923] and parameters: {'n_layers': 1, 'embedding_dim': 32, 'lr': 0.0031305185360713038, 'lambda_val': 0.00013240222123871482, 'batch_size': 2924, 'optimizer': 'Adam'}.
2026-05-23 03:34:26,936 - experiment_functions - INFO - Early stopping at epoch 2050. Best Metrics: (0.12297563183935065, 0.05778688524590164, 0.09761337449450642)
2026-05-23 03:34:27,710 - optuna.study.study - INFO - Trial 250 finished with values: [0.12297563183935065, 0.05778688524590164, 0.09761337449450642] and parameters: {'n_layers': 1, 'embedding_dim': 128, 'lr': 0.0005051991365347398, 'lambda_val': 0.00018385882411773826, 'batch_size': 1160, 'optimizer': 'Adam'}.
2026-05-23 03:34:38,798 - experiment_functions - INFO - Early stopping at epoch 1950. Best Metrics: (0.11279748554223533, 0.05254098360655737, 0.08920282103842601)
2026-05-23 03:34:39,163 - optuna.study.study - INFO - Trial 251 finished with values: [0.11279748554223533, 0.05254098360655737, 0.08920282103842601] and parameters: {'n_layers': 1, 'embedding_dim': 96, 'lr': 0.0007646684933610155, 'lambda_val': 3.305135746713665e-06, 'batch_size': 1434, 'optimizer': 'Adam'}.
2026-05-23 03:34:43,881 - experiment_functions - INFO - Early stopping at epoch 1350. Best Metrics: (0.09982412271995841, 0.05098360655737705, 0.08746121128570952)
2026-05-23 03:34:44,499 - optuna.study.study - INFO - Trial 252 finished with values: [0.09982412271995841, 0.05098360655737705, 0.08746121128570952] and parameters: {'n_layers': 1, 'embedding_dim': 32, 'lr': 0.0007646684933610155, 'lambda_val': 0.003966779220729784, 'batch_size': 1921, 'optimizer': 'Adam'}.
2026-05-23 03:34:49,426 - experiment_functions - INFO - Early stopping at epoch 1200. Best Metrics: (0.06808540805877822, 0.039672131147540986, 0.060164495045288334)
2026-05-23 03:34:49,972 - optuna.study.study - INFO - Trial 253 finished with values: [0.06808540805877822, 0.039672131147540986, 0.060164495045288334] and parameters: {'n_layers': 2, 'embedding_dim': 96, 'lr': 0.0005051991365347398, 'lambda_val': 8.474115370818157e-05, 'batch_size': 1847, 'optimizer': 'Adam'}.
2026-05-23 03:34:52,708 - experiment_functions - INFO - Early stopping at epoch 600. Best Metrics: (0.09559762942343786, 0.04770491803278689, 0.07644293862570913)
2026-05-23 03:34:52,836 - optuna.study.study - INFO - Trial 254 finished with values: [0.09559762942343786, 0.04770491803278689, 0.07644293862570913] and parameters: {'n_layers': 1, 'embedding_dim': 96, 'lr': 0.0031305185360713038, 'lambda_val': 0.0021605260106213964, 'batch_size': 2924, 'optimizer': 'Adam'}.
2026-05-23 03:34:59,323 - experiment_functions - INFO - Early stopping at epoch 1900. Best Metrics: (0.11104267551948774, 0.05475409836065575, 0.0934055350463492)
2026-05-23 03:34:59,806 - optuna.study.study - INFO - Trial 255 finished with values: [0.11104267551948774, 0.05475409836065575, 0.0934055350463492] and parameters: {'n_layers': 1, 'embedding_dim': 96, 'lr': 0.0005051991365347398, 'lambda_val': 0.00012928174782861758, 'batch_size': 1921, 'optimizer': 'Adam'}.
2026-05-23 03:35:01,998 - experiment_functions - INFO - Early stopping at epoch 500. Best Metrics: (0.0022325169089548124, 0.0020491803278688526, 0.00245881535266035)
2026-05-23 03:35:02,083 - optuna.study.study - INFO - Trial 256 finished with values: [0.0022325169089548124, 0.0020491803278688526, 0.00245881535266035] and parameters: {'n_layers': 1, 'embedding_dim': 64, 'lr': 0.0003084507924491364, 'lambda_val': 1.3593165217532054e-05, 'batch_size': 4016, 'optimizer': 'SGD'}.
2026-05-23 03:35:12,851 - experiment_functions - INFO - Early stopping at epoch 3350. Best Metrics: (0.09995734063516455, 0.05467213114754097, 0.08421529845723756)
2026-05-23 03:35:13,803 - optuna.study.study - INFO - Trial 257 finished with values: [0.09995734063516455, 0.05467213114754097, 0.08421529845723756] and parameters: {'n_layers': 1, 'embedding_dim': 128, 'lr': 0.000293040961262534, 'lambda_val': 0.00012928174782861758, 'batch_size': 1751, 'optimizer': 'RMSprop'}.
2026-05-23 03:35:16,478 - experiment_functions - INFO - Early stopping at epoch 600. Best Metrics: (0.04573609937085059, 0.02745901639344262, 0.04005350961036242)
2026-05-23 03:35:16,616 - optuna.study.study - INFO - Trial 258 finished with values: [0.04573609937085059, 0.02745901639344262, 0.04005350961036242] and parameters: {'n_layers': 1, 'embedding_dim': 128, 'lr': 0.004270219485281677, 'lambda_val': 0.003966779220729784, 'batch_size': 1510, 'optimizer': 'RMSprop'}.
2026-05-23 03:35:22,332 - experiment_functions - INFO - Early stopping at epoch 1950. Best Metrics: (0.1041202625917761, 0.052295081967213115, 0.08971129487809157)
2026-05-23 03:35:22,652 - optuna.study.study - INFO - Trial 259 finished with values: [0.1041202625917761, 0.052295081967213115, 0.08971129487809157] and parameters: {'n_layers': 1, 'embedding_dim': 32, 'lr': 0.0007646684933610155, 'lambda_val': 0.0021605260106213964, 'batch_size': 1429, 'optimizer': 'Adam'}.
2026-05-23 03:35:32,876 - experiment_functions - INFO - Early stopping at epoch 2600. Best Metrics: (0.031091278155711725, 0.01901639344262295, 0.029014256806845756)
2026-05-23 03:35:33,166 - optuna.study.study - INFO - Trial 260 finished with values: [0.031091278155711725, 0.01901639344262295, 0.029014256806845756] and parameters: {'n_layers': 2, 'embedding_dim': 128, 'lr': 0.07131980652476508, 'lambda_val': 0.003966779220729784, 'batch_size': 3009, 'optimizer': 'Adam'}.
2026-05-23 03:35:38,324 - experiment_functions - INFO - Early stopping at epoch 950. Best Metrics: (0.04381520367477858, 0.02401639344262295, 0.03716634646834839)
2026-05-23 03:35:38,418 - optuna.study.study - INFO - Trial 261 finished with values: [0.04381520367477858, 0.02401639344262295, 0.03716634646834839] and parameters: {'n_layers': 4, 'embedding_dim': 128, 'lr': 0.000293040961262534, 'lambda_val': 0.003966779220729784, 'batch_size': 1510, 'optimizer': 'RMSprop'}.
2026-05-23 03:35:40,617 - experiment_functions - INFO - Early stopping at epoch 550. Best Metrics: (0.053350308041469105, 0.033278688524590164, 0.046961695432152395)
2026-05-23 03:35:40,706 - optuna.study.study - INFO - Trial 262 finished with values: [0.053350308041469105, 0.033278688524590164, 0.046961695432152395] and parameters: {'n_layers': 1, 'embedding_dim': 32, 'lr': 0.0031305185360713038, 'lambda_val': 0.003966779220729784, 'batch_size': 3892, 'optimizer': 'RMSprop'}.
2026-05-23 03:35:44,271 - experiment_functions - INFO - Early stopping at epoch 1150. Best Metrics: (0.08224633233975101, 0.0419672131147541, 0.06737743221119806)
2026-05-23 03:35:44,354 - optuna.study.study - INFO - Trial 263 finished with values: [0.08224633233975101, 0.0419672131147541, 0.06737743221119806] and parameters: {'n_layers': 1, 'embedding_dim': 32, 'lr': 0.0007646684933610155, 'lambda_val': 0.0021605260106213964, 'batch_size': 1429, 'optimizer': 'RMSprop'}.
2026-05-23 03:35:53,310 - experiment_functions - INFO - Early stopping at epoch 3100. Best Metrics: (0.08877787341266193, 0.047786885245901634, 0.07362841482236822)
2026-05-23 03:35:54,301 - optuna.study.study - INFO - Trial 264 finished with values: [0.08877787341266193, 0.047786885245901634, 0.07362841482236822] and parameters: {'n_layers': 1, 'embedding_dim': 32, 'lr': 0.0005051991365347398, 'lambda_val': 6.426340693845084e-05, 'batch_size': 3174, 'optimizer': 'Adam'}.
2026-05-23 03:36:04,762 - experiment_functions - INFO - Early stopping at epoch 1550. Best Metrics: (0.1033761498848854, 0.051639344262295085, 0.08219560372996866)
2026-05-23 03:36:06,081 - optuna.study.study - INFO - Trial 265 finished with values: [0.1033761498848854, 0.051639344262295085, 0.08219560372996866] and parameters: {'n_layers': 1, 'embedding_dim': 32, 'lr': 0.0010018742478050552, 'lambda_val': 0.0006383294603067735, 'batch_size': 1355, 'optimizer': 'Adam'}.
2026-05-23 03:36:13,204 - experiment_functions - INFO - Early stopping at epoch 950. Best Metrics: (0.10426999366344256, 0.05040983606557377, 0.08507817007046183)
2026-05-23 03:36:14,047 - optuna.study.study - INFO - Trial 266 finished with values: [0.10426999366344256, 0.05040983606557377, 0.08507817007046183] and parameters: {'n_layers': 1, 'embedding_dim': 256, 'lr': 0.0005051991365347398, 'lambda_val': 5.129913499907851e-06, 'batch_size': 3013, 'optimizer': 'RMSprop'}.
2026-05-23 03:36:21,214 - experiment_functions - INFO - Early stopping at epoch 2150. Best Metrics: (0.09117677924800881, 0.04975409836065574, 0.07321622409382071)
2026-05-23 03:36:21,299 - optuna.study.study - INFO - Trial 267 finished with values: [0.09117677924800881, 0.04975409836065574, 0.07321622409382071] and parameters: {'n_layers': 1, 'embedding_dim': 64, 'lr': 0.0004969264317801683, 'lambda_val': 0.00018385882411773826, 'batch_size': 3009, 'optimizer': 'Adam'}.
2026-05-23 03:36:27,642 - experiment_functions - INFO - Early stopping at epoch 1950. Best Metrics: (0.11253515725797561, 0.052622950819672124, 0.09141460503048295)
2026-05-23 03:36:27,727 - optuna.study.study - INFO - Trial 268 finished with values: [0.11253515725797561, 0.052622950819672124, 0.09141460503048295] and parameters: {'n_layers': 1, 'embedding_dim': 96, 'lr': 0.0005051991365347398, 'lambda_val': 2.27009302283491e-06, 'batch_size': 3527, 'optimizer': 'Adam'}.
2026-05-23 03:36:32,118 - experiment_functions - INFO - Early stopping at epoch 1150. Best Metrics: (0.003118047860649606, 0.0017213114754098362, 0.002527920950394737)
2026-05-23 03:36:32,409 - optuna.study.study - INFO - Trial 269 finished with values: [0.003118047860649606, 0.0017213114754098362, 0.002527920950394737] and parameters: {'n_layers': 1, 'embedding_dim': 128, 'lr': 2.3147731378302506e-05, 'lambda_val': 6.918388857788462e-05, 'batch_size': 3009, 'optimizer': 'RMSprop'}.
2026-05-23 03:36:45,429 - experiment_functions - INFO - Early stopping at epoch 3600. Best Metrics: (0.04945616966109169, 0.029016393442622943, 0.04311304120109769)
