2026-05-23 04:18:56,800 - optuna.study.study - INFO - Trial 50 finished with values: [0.028777486254655937, 0.02057377049180328, 0.027694346307806122] and parameters: {'n_layers': 4, 'embedding_dim': 256, 'lr': 0.0005216893769116646, 'lambda_val': 0.0009962507800702286, 'batch_size': 601, 'optimizer': 'RMSprop'}.
2026-05-23 04:18:59,608 - experiment_functions - INFO - Early stopping at epoch 500. Best Metrics: (0.00224292780968661, 0.001639344262295082, 0.002049183420551257)
2026-05-23 04:18:59,689 - optuna.study.study - INFO - Trial 51 finished with values: [0.00224292780968661, 0.001639344262295082, 0.002049183420551257] and parameters: {'n_layers': 3, 'embedding_dim': 96, 'lr': 1.334296335490341e-05, 'lambda_val': 0.0038546327658745766, 'batch_size': 3054, 'optimizer': 'SGD'}.
2026-05-23 04:19:04,442 - experiment_functions - INFO - Early stopping at epoch 900. Best Metrics: (0.03456447680255503, 0.021147540983606557, 0.03036183214129534)
2026-05-23 04:19:04,871 - optuna.study.study - INFO - Trial 52 finished with values: [0.03456447680255503, 0.021147540983606557, 0.03036183214129534] and parameters: {'n_layers': 3, 'embedding_dim': 96, 'lr': 0.001134436508843411, 'lambda_val': 4.043398626155609e-05, 'batch_size': 695, 'optimizer': 'RMSprop'}.
2026-05-23 04:19:17,354 - experiment_functions - INFO - Early stopping at epoch 3150. Best Metrics: (0.0792406240795035, 0.043524590163934423, 0.06930356910471525)
2026-05-23 04:19:17,565 - optuna.study.study - INFO - Trial 53 finished with values: [0.0792406240795035, 0.043524590163934423, 0.06930356910471525] and parameters: {'n_layers': 2, 'embedding_dim': 128, 'lr': 0.0002433821756193056, 'lambda_val': 0.00044044195678744806, 'batch_size': 944, 'optimizer': 'Adam'}.
2026-05-23 04:19:20,863 - experiment_functions - INFO - Early stopping at epoch 750. Best Metrics: (0.03037601026488957, 0.013524590163934426, 0.022574364754446335)
2026-05-23 04:19:21,609 - optuna.study.study - INFO - Trial 54 finished with values: [0.03037601026488957, 0.013524590163934426, 0.022574364754446335] and parameters: {'n_layers': 2, 'embedding_dim': 64, 'lr': 0.015468347513063738, 'lambda_val': 2.977236205866237e-06, 'batch_size': 2002, 'optimizer': 'RMSprop'}.
2026-05-23 04:19:35,452 - optuna.study.study - INFO - Trial 55 finished with values: [0.031801671997985656, 0.017295081967213115, 0.025911973430725193] and parameters: {'n_layers': 2, 'embedding_dim': 64, 'lr': 8.124800370693163e-05, 'lambda_val': 0.00037894592886494253, 'batch_size': 2370, 'optimizer': 'RMSprop'}.
2026-05-23 04:19:37,581 - experiment_functions - INFO - Early stopping at epoch 500. Best Metrics: (0.0011678703738109049, 0.0017213114754098362, 0.0018063076101160352)
2026-05-23 04:19:37,723 - optuna.study.study - INFO - Trial 56 finished with values: [0.0011678703738109049, 0.0017213114754098362, 0.0018063076101160352] and parameters: {'n_layers': 1, 'embedding_dim': 32, 'lr': 5.537773148410438e-05, 'lambda_val': 0.00011523339069242345, 'batch_size': 3092, 'optimizer': 'SGD'}.
2026-05-23 04:19:41,878 - experiment_functions - INFO - Early stopping at epoch 850. Best Metrics: (0.031212579914126435, 0.020081967213114754, 0.030835111969302723)
2026-05-23 04:19:41,953 - optuna.study.study - INFO - Trial 57 finished with values: [0.031212579914126435, 0.020081967213114754, 0.030835111969302723] and parameters: {'n_layers': 4, 'embedding_dim': 64, 'lr': 0.0005216893769116646, 'lambda_val': 0.014740079559979705, 'batch_size': 601, 'optimizer': 'RMSprop'}.
2026-05-23 04:19:45,956 - experiment_functions - INFO - Early stopping at epoch 500. Best Metrics: (0.031845574652879044, 0.020163934426229508, 0.03273565307785336)
2026-05-23 04:19:46,251 - optuna.study.study - INFO - Trial 58 finished with values: [0.031845574652879044, 0.020163934426229508, 0.03273565307785336] and parameters: {'n_layers': 4, 'embedding_dim': 256, 'lr': 0.09103529918529618, 'lambda_val': 4.5174002812526645e-05, 'batch_size': 2631, 'optimizer': 'RMSprop'}.
2026-05-23 04:19:49,808 - experiment_functions - INFO - Early stopping at epoch 900. Best Metrics: (0.05214586537202881, 0.031229508196721312, 0.046085088367110186)
2026-05-23 04:19:49,896 - optuna.study.study - INFO - Trial 59 finished with values: [0.05214586537202881, 0.031229508196721312, 0.046085088367110186] and parameters: {'n_layers': 2, 'embedding_dim': 32, 'lr': 0.0010602693611052227, 'lambda_val': 1.374096848370064e-06, 'batch_size': 2680, 'optimizer': 'Adam'}.
2026-05-23 04:19:54,514 - experiment_functions - INFO - Early stopping at epoch 650. Best Metrics: (0.05825030541588387, 0.031885245901639346, 0.0506192801747717)
2026-05-23 04:19:54,901 - optuna.study.study - INFO - Trial 60 finished with values: [0.05825030541588387, 0.031885245901639346, 0.0506192801747717] and parameters: {'n_layers': 2, 'embedding_dim': 64, 'lr': 0.0012715072595827332, 'lambda_val': 0.00062453091272787, 'batch_size': 3821, 'optimizer': 'RMSprop'}.
2026-05-23 04:20:04,656 - experiment_functions - INFO - Early stopping at epoch 750. Best Metrics: (0.02873207419712585, 0.01459016393442623, 0.023184803492151917)
2026-05-23 04:20:05,397 - optuna.study.study - INFO - Trial 61 finished with values: [0.02873207419712585, 0.01459016393442623, 0.023184803492151917] and parameters: {'n_layers': 3, 'embedding_dim': 128, 'lr': 0.015587913980186776, 'lambda_val': 2.0430354422146705e-06, 'batch_size': 1927, 'optimizer': 'RMSprop'}.
2026-05-23 04:20:20,146 - optuna.study.study - INFO - Trial 62 finished with values: [0.003626433803779681, 0.0025409836065573774, 0.004136993073235969] and parameters: {'n_layers': 3, 'embedding_dim': 64, 'lr': 2.3441841423245388e-05, 'lambda_val': 1.8513831213284574e-05, 'batch_size': 2240, 'optimizer': 'Adam'}.
2026-05-23 04:20:23,795 - experiment_functions - INFO - Early stopping at epoch 600. Best Metrics: (0.031754530606973884, 0.018852459016393444, 0.02802862010914719)
2026-05-23 04:20:24,055 - optuna.study.study - INFO - Trial 63 finished with values: [0.031754530606973884, 0.018852459016393444, 0.02802862010914719] and parameters: {'n_layers': 4, 'embedding_dim': 128, 'lr': 0.0009118019738243731, 'lambda_val': 0.0060103019678805995, 'batch_size': 3898, 'optimizer': 'Adam'}.
2026-05-23 04:20:27,390 - experiment_functions - INFO - Early stopping at epoch 500. Best Metrics: (0.02226415824887588, 0.01057377049180328, 0.019490798665922408)
2026-05-23 04:20:27,475 - optuna.study.study - INFO - Trial 64 finished with values: [0.02226415824887588, 0.01057377049180328, 0.019490798665922408] and parameters: {'n_layers': 3, 'embedding_dim': 128, 'lr': 0.09106756518072165, 'lambda_val': 0.0003830295511690824, 'batch_size': 2409, 'optimizer': 'RMSprop'}.
2026-05-23 04:20:30,827 - experiment_functions - INFO - Early stopping at epoch 500. Best Metrics: (0.001329130951951641, 0.0018852459016393442, 0.00240161311412308)
2026-05-23 04:20:30,915 - optuna.study.study - INFO - Trial 65 finished with values: [0.001329130951951641, 0.0018852459016393442, 0.00240161311412308] and parameters: {'n_layers': 3, 'embedding_dim': 256, 'lr': 1.0549118561436361e-05, 'lambda_val': 0.000746519711761532, 'batch_size': 2842, 'optimizer': 'SGD'}.
2026-05-23 04:20:48,036 - optuna.study.study - INFO - Trial 66 finished with values: [0.014112354181253417, 0.010573770491803278, 0.01642074542755774] and parameters: {'n_layers': 4, 'embedding_dim': 64, 'lr': 5.790623176035216e-05, 'lambda_val': 1.554000639581942e-06, 'batch_size': 601, 'optimizer': 'RMSprop'}.
2026-05-23 04:20:55,937 - experiment_functions - INFO - Early stopping at epoch 2150. Best Metrics: (0.03727836302552648, 0.018442622950819672, 0.029227850240534998)
2026-05-23 04:20:56,071 - optuna.study.study - INFO - Trial 67 finished with values: [0.03727836302552648, 0.018442622950819672, 0.029227850240534998] and parameters: {'n_layers': 2, 'embedding_dim': 64, 'lr': 0.02553831304260938, 'lambda_val': 0.0038546327658745766, 'batch_size': 2324, 'optimizer': 'Adam'}.
2026-05-23 04:21:18,320 - optuna.study.study - INFO - Trial 68 finished with values: [0.018072405743917726, 0.013196721311475411, 0.018590758088324773] and parameters: {'n_layers': 3, 'embedding_dim': 256, 'lr': 4.40844808626701e-05, 'lambda_val': 0.00037894592886494253, 'batch_size': 2183, 'optimizer': 'RMSprop'}.
2026-05-23 04:21:28,878 - experiment_functions - INFO - Early stopping at epoch 2700. Best Metrics: (0.034894672793323436, 0.022213114754098363, 0.03261792317617415)
2026-05-23 04:21:29,198 - optuna.study.study - INFO - Trial 69 finished with values: [0.034894672793323436, 0.022213114754098363, 0.03261792317617415] and parameters: {'n_layers': 2, 'embedding_dim': 128, 'lr': 0.013467154695281406, 'lambda_val': 0.0060103019678805995, 'batch_size': 1954, 'optimizer': 'RMSprop'}.
2026-05-23 04:21:35,722 - experiment_functions - INFO - Early stopping at epoch 1550. Best Metrics: (0.026816320008162097, 0.012049180327868851, 0.020266727936096844)
2026-05-23 04:21:35,822 - optuna.study.study - INFO - Trial 70 finished with values: [0.026816320008162097, 0.012049180327868851, 0.020266727936096844] and parameters: {'n_layers': 3, 'embedding_dim': 64, 'lr': 0.03135377993567746, 'lambda_val': 1.4637749004012292e-06, 'batch_size': 1462, 'optimizer': 'RMSprop'}.
2026-05-23 04:21:51,794 - optuna.study.study - INFO - Trial 71 finished with values: [0.008036488789375443, 0.005901639344262295, 0.008656782007469919] and parameters: {'n_layers': 2, 'embedding_dim': 128, 'lr': 5.790623176035216e-05, 'lambda_val': 1.554000639581942e-06, 'batch_size': 944, 'optimizer': 'Adam'}.
2026-05-23 04:22:18,515 - optuna.study.study - INFO - Trial 72 finished with values: [0.009416620483237048, 0.005655737704918032, 0.008645485200676283] and parameters: {'n_layers': 4, 'embedding_dim': 256, 'lr': 2.3441841423245388e-05, 'lambda_val': 1.8513831213284574e-05, 'batch_size': 3562, 'optimizer': 'Adam'}.
2026-05-23 04:22:25,715 - experiment_functions - INFO - Early stopping at epoch 550. Best Metrics: (0.0506459764744223, 0.032540983606557376, 0.04667859163537693)
2026-05-23 04:22:26,270 - optuna.study.study - INFO - Trial 73 finished with values: [0.0506459764744223, 0.032540983606557376, 0.04667859163537693] and parameters: {'n_layers': 2, 'embedding_dim': 64, 'lr': 0.004473575507756899, 'lambda_val': 0.0006976990437379927, 'batch_size': 3562, 'optimizer': 'Adam'}.
2026-05-23 04:22:34,374 - experiment_functions - INFO - Early stopping at epoch 900. Best Metrics: (0.023177312780922235, 0.011475409836065573, 0.018095157081016163)
2026-05-23 04:22:34,454 - optuna.study.study - INFO - Trial 74 finished with values: [0.023177312780922235, 0.011475409836065573, 0.018095157081016163] and parameters: {'n_layers': 3, 'embedding_dim': 32, 'lr': 0.01729355128210771, 'lambda_val': 0.000832274284637742, 'batch_size': 604, 'optimizer': 'RMSprop'}.
2026-05-23 04:22:37,031 - experiment_functions - INFO - Early stopping at epoch 500. Best Metrics: (0.0008167854561386332, 0.0013114754098360656, 0.0013999891307722506)
2026-05-23 04:22:37,110 - optuna.study.study - INFO - Trial 75 finished with values: [0.0008167854561386332, 0.0013114754098360656, 0.0013999891307722506] and parameters: {'n_layers': 4, 'embedding_dim': 32, 'lr': 0.0005076161055190746, 'lambda_val': 0.0011674275547394154, 'batch_size': 2288, 'optimizer': 'SGD'}.
2026-05-23 04:22:41,246 - experiment_functions - INFO - Early stopping at epoch 950. Best Metrics: (0.052639643172433546, 0.031229508196721312, 0.046222159732239546)
2026-05-23 04:22:41,750 - optuna.study.study - INFO - Trial 76 finished with values: [0.052639643172433546, 0.031229508196721312, 0.046222159732239546] and parameters: {'n_layers': 2, 'embedding_dim': 64, 'lr': 0.0006640426930867159, 'lambda_val': 0.0002794201622830738, 'batch_size': 2468, 'optimizer': 'RMSprop'}.
2026-05-23 04:22:58,029 - optuna.study.study - INFO - Trial 77 finished with values: [0.06848418498174115, 0.03639344262295082, 0.059509877056887296] and parameters: {'n_layers': 2, 'embedding_dim': 128, 'lr': 0.00013938780887061617, 'lambda_val': 5.716195116201499e-06, 'batch_size': 1720, 'optimizer': 'Adam'}.
2026-05-23 04:23:13,817 - optuna.study.study - INFO - Trial 78 finished with values: [0.071465924832358, 0.04073770491803279, 0.0674670418361832] and parameters: {'n_layers': 1, 'embedding_dim': 256, 'lr': 0.00012846677155064665, 'lambda_val': 1.8513831213284574e-05, 'batch_size': 2240, 'optimizer': 'Adam'}.
2026-05-23 04:23:21,907 - experiment_functions - INFO - Early stopping at epoch 2450. Best Metrics: (0.002469801283548134, 0.002622950819672131, 0.0030492510170926426)
2026-05-23 04:23:21,994 - optuna.study.study - INFO - Trial 79 finished with values: [0.002469801283548134, 0.002622950819672131, 0.0030492510170926426] and parameters: {'n_layers': 1, 'embedding_dim': 128, 'lr': 1.0864033445002813e-05, 'lambda_val': 1.554000639581942e-06, 'batch_size': 944, 'optimizer': 'RMSprop'}.
2026-05-23 04:23:39,755 - optuna.study.study - INFO - Trial 80 finished with values: [0.03192241466385358, 0.021721311475409837, 0.02976727247846357] and parameters: {'n_layers': 4, 'embedding_dim': 64, 'lr': 0.00017970143388914436, 'lambda_val': 0.001092384612961102, 'batch_size': 3821, 'optimizer': 'Adam'}.
2026-05-23 04:23:41,930 - experiment_functions - INFO - Early stopping at epoch 500. Best Metrics: (0.001537073834232748, 0.001639344262295082, 0.001897860975493523)
2026-05-23 04:23:42,030 - optuna.study.study - INFO - Trial 81 finished with values: [0.001537073834232748, 0.001639344262295082, 0.001897860975493523] and parameters: {'n_layers': 1, 'embedding_dim': 32, 'lr': 0.024261202860770287, 'lambda_val': 0.00120604214596236, 'batch_size': 1941, 'optimizer': 'SGD'}.
2026-05-23 04:23:50,356 - experiment_functions - INFO - Early stopping at epoch 2200. Best Metrics: (0.026148769126339837, 0.01581967213114754, 0.023085336987653096)
2026-05-23 04:23:50,422 - optuna.study.study - INFO - Trial 82 finished with values: [0.026148769126339837, 0.01581967213114754, 0.023085336987653096] and parameters: {'n_layers': 3, 'embedding_dim': 64, 'lr': 0.037696722978878265, 'lambda_val': 0.002018128655848671, 'batch_size': 3562, 'optimizer': 'Adam'}.
2026-05-23 04:23:59,907 - experiment_functions - INFO - Early stopping at epoch 1150. Best Metrics: (0.01934866994969639, 0.006721311475409835, 0.012570409799593233)
2026-05-23 04:23:59,987 - optuna.study.study - INFO - Trial 83 finished with values: [0.01934866994969639, 0.006721311475409835, 0.012570409799593233] and parameters: {'n_layers': 4, 'embedding_dim': 64, 'lr': 0.09103529918529618, 'lambda_val': 3.4373462504025866e-05, 'batch_size': 3271, 'optimizer': 'Adam'}.
2026-05-23 04:24:03,231 - experiment_functions - INFO - Early stopping at epoch 500. Best Metrics: (0.001123370653323155, 0.0013934426229508198, 0.0015064739425836948)
2026-05-23 04:24:03,367 - optuna.study.study - INFO - Trial 84 finished with values: [0.001123370653323155, 0.0013934426229508198, 0.0015064739425836948] and parameters: {'n_layers': 3, 'embedding_dim': 256, 'lr': 4.321846210984281e-05, 'lambda_val': 0.00010447269915261112, 'batch_size': 1887, 'optimizer': 'SGD'}.
2026-05-23 04:24:05,778 - experiment_functions - INFO - Early stopping at epoch 500. Best Metrics: (0.0023452954766378345, 0.001557377049180328, 0.0022216167971701437)
2026-05-23 04:24:05,857 - optuna.study.study - INFO - Trial 85 finished with values: [0.0023452954766378345, 0.001557377049180328, 0.0022216167971701437] and parameters: {'n_layers': 3, 'embedding_dim': 64, 'lr': 0.001134436508843411, 'lambda_val': 0.007650682958624026, 'batch_size': 3321, 'optimizer': 'SGD'}.
2026-05-23 04:24:18,556 - optuna.study.study - INFO - Trial 86 finished with values: [0.02416747532155006, 0.017868852459016392, 0.024718299125789905] and parameters: {'n_layers': 2, 'embedding_dim': 64, 'lr': 7.466128919882156e-05, 'lambda_val': 0.00034637401802051877, 'batch_size': 3576, 'optimizer': 'Adam'}.
2026-05-23 04:24:20,506 - experiment_functions - INFO - Early stopping at epoch 500. Best Metrics: (0.0012807380942997338, 0.0018032786885245904, 0.001970531767462778)
2026-05-23 04:24:20,593 - optuna.study.study - INFO - Trial 87 finished with values: [0.0012807380942997338, 0.0018032786885245904, 0.001970531767462778] and parameters: {'n_layers': 1, 'embedding_dim': 64, 'lr': 0.037696722978878265, 'lambda_val': 0.007650682958624026, 'batch_size': 2019, 'optimizer': 'SGD'}.
2026-05-23 04:24:22,918 - experiment_functions - INFO - Early stopping at epoch 500. Best Metrics: (0.0016021191331971947, 0.0014754098360655738, 0.0014314440877210477)
2026-05-23 04:24:23,022 - optuna.study.study - INFO - Trial 88 finished with values: [0.0016021191331971947, 0.0014754098360655738, 0.0014314440877210477] and parameters: {'n_layers': 1, 'embedding_dim': 96, 'lr': 0.0010602693611052227, 'lambda_val': 0.0008171654051295805, 'batch_size': 2680, 'optimizer': 'SGD'}.
2026-05-23 04:24:25,587 - experiment_functions - INFO - Early stopping at epoch 650. Best Metrics: (0.03401690109142847, 0.02098360655737705, 0.02861705419792873)
2026-05-23 04:24:25,678 - optuna.study.study - INFO - Trial 89 finished with values: [0.03401690109142847, 0.02098360655737705, 0.02861705419792873] and parameters: {'n_layers': 2, 'embedding_dim': 64, 'lr': 0.0011639497848050708, 'lambda_val': 0.009427137842512492, 'batch_size': 604, 'optimizer': 'RMSprop'}.
2026-05-23 04:24:39,846 - optuna.study.study - INFO - Trial 90 finished with values: [0.007228085594413113, 0.005245901639344262, 0.007227428071126523] and parameters: {'n_layers': 2, 'embedding_dim': 128, 'lr': 3.8136398075384974e-05, 'lambda_val': 0.0003830295511690824, 'batch_size': 2409, 'optimizer': 'RMSprop'}.
2026-05-23 04:24:42,529 - experiment_functions - INFO - Early stopping at epoch 600. Best Metrics: (0.1019532617061911, 0.04721311475409836, 0.07715689241950993)
2026-05-23 04:24:42,619 - optuna.study.study - INFO - Trial 91 finished with values: [0.1019532617061911, 0.04721311475409836, 0.07715689241950993] and parameters: {'n_layers': 1, 'embedding_dim': 64, 'lr': 0.00466856942146688, 'lambda_val': 0.0004769034760402413, 'batch_size': 3135, 'optimizer': 'Adam'}.
2026-05-23 04:24:53,565 - experiment_functions - INFO - Early stopping at epoch 3150. Best Metrics: (0.07596817960316872, 0.03950819672131147, 0.06947384193090501)
2026-05-23 04:24:54,207 - optuna.study.study - INFO - Trial 92 finished with values: [0.07596817960316872, 0.03950819672131147, 0.06947384193090501] and parameters: {'n_layers': 2, 'embedding_dim': 64, 'lr': 0.0002758788994373932, 'lambda_val': 0.00010447269915261112, 'batch_size': 1427, 'optimizer': 'RMSprop'}.
2026-05-23 04:25:02,309 - experiment_functions - INFO - Early stopping at epoch 1950. Best Metrics: (0.05855152710543446, 0.03295081967213115, 0.04913838805892513)
2026-05-23 04:25:02,400 - optuna.study.study - INFO - Trial 93 finished with values: [0.05855152710543446, 0.03295081967213115, 0.04913838805892513] and parameters: {'n_layers': 1, 'embedding_dim': 256, 'lr': 0.0399895421175634, 'lambda_val': 0.006639299505918974, 'batch_size': 3188, 'optimizer': 'RMSprop'}.
2026-05-23 04:25:05,562 - experiment_functions - INFO - Early stopping at epoch 600. Best Metrics: (0.06546064582271141, 0.03459016393442623, 0.05557990477699352)
2026-05-23 04:25:05,658 - optuna.study.study - INFO - Trial 94 finished with values: [0.06546064582271141, 0.03459016393442623, 0.05557990477699352] and parameters: {'n_layers': 2, 'embedding_dim': 128, 'lr': 0.001134436508843411, 'lambda_val': 4.043398626155609e-05, 'batch_size': 2902, 'optimizer': 'RMSprop'}.
2026-05-23 04:25:09,309 - experiment_functions - INFO - Early stopping at epoch 500. Best Metrics: (0.00240347513072559, 0.001967213114754099, 0.002650314424890278)
2026-05-23 04:25:09,454 - optuna.study.study - INFO - Trial 95 finished with values: [0.00240347513072559, 0.001967213114754099, 0.002650314424890278] and parameters: {'n_layers': 3, 'embedding_dim': 32, 'lr': 0.0002645419878273553, 'lambda_val': 0.01332528370869152, 'batch_size': 1110, 'optimizer': 'SGD'}.
2026-05-23 04:25:14,502 - experiment_functions - INFO - Early stopping at epoch 1200. Best Metrics: (0.014004481183242594, 0.010655737704918034, 0.014903510540146955)
2026-05-23 04:25:15,000 - optuna.study.study - INFO - Trial 96 finished with values: [0.014004481183242594, 0.010655737704918034, 0.014903510540146955] and parameters: {'n_layers': 1, 'embedding_dim': 256, 'lr': 0.08092159114837257, 'lambda_val': 1.3415888677055366e-05, 'batch_size': 2519, 'optimizer': 'RMSprop'}.
2026-05-23 04:25:18,047 - experiment_functions - INFO - Early stopping at epoch 650. Best Metrics: (0.038523376116534246, 0.021475409836065575, 0.03022048632527921)
2026-05-23 04:25:18,209 - optuna.study.study - INFO - Trial 97 finished with values: [0.038523376116534246, 0.021475409836065575, 0.03022048632527921] and parameters: {'n_layers': 3, 'embedding_dim': 32, 'lr': 0.0011639497848050708, 'lambda_val': 0.000832274284637742, 'batch_size': 604, 'optimizer': 'RMSprop'}.
2026-05-23 04:25:28,712 - experiment_functions - INFO - Early stopping at epoch 1550. Best Metrics: (0.02025243992467683, 0.011311475409836066, 0.017519417213288452)
2026-05-23 04:25:29,349 - optuna.study.study - INFO - Trial 98 finished with values: [0.02025243992467683, 0.011311475409836066, 0.017519417213288452] and parameters: {'n_layers': 4, 'embedding_dim': 256, 'lr': 0.006677452205663748, 'lambda_val': 0.0015082295089352401, 'batch_size': 1653, 'optimizer': 'RMSprop'}.
2026-05-23 04:25:34,955 - experiment_functions - INFO - Early stopping at epoch 1450. Best Metrics: (0.03155645881075887, 0.013196721311475408, 0.023885824989412698)
