2026-05-23 03:53:13,621 - optuna.study.study - INFO - Trial 112 finished with values: [0.045201205860530586, 0.027377049180327868, 0.042190155001378675] and parameters: {'n_layers': 3, 'embedding_dim': 64, 'lr': 0.00026503485300845536, 'lambda_val': 6.4213979022807815e-06, 'batch_size': 2384, 'optimizer': 'Adam'}.
2026-05-23 03:53:28,870 - optuna.study.study - INFO - Trial 113 finished with values: [0.07793913128134156, 0.038196721311475404, 0.06750785556335932] and parameters: {'n_layers': 3, 'embedding_dim': 32, 'lr': 0.00026503485300845536, 'lambda_val': 0.0009750566560695258, 'batch_size': 1170, 'optimizer': 'Adam'}.
2026-05-23 03:53:31,455 - experiment_functions - INFO - Early stopping at epoch 550. Best Metrics: (0.09078427229816384, 0.04680327868852459, 0.079515259408392)
2026-05-23 03:53:31,549 - optuna.study.study - INFO - Trial 114 finished with values: [0.09078427229816384, 0.04680327868852459, 0.079515259408392] and parameters: {'n_layers': 1, 'embedding_dim': 32, 'lr': 0.00726893620558119, 'lambda_val': 2.0700677762543618e-06, 'batch_size': 3542, 'optimizer': 'Adam'}.
2026-05-23 03:53:36,379 - experiment_functions - INFO - Early stopping at epoch 1050. Best Metrics: (0.12041573433920023, 0.056475409836065575, 0.09739302416557602)
2026-05-23 03:53:36,488 - optuna.study.study - INFO - Trial 115 finished with values: [0.12041573433920023, 0.056475409836065575, 0.09739302416557602] and parameters: {'n_layers': 1, 'embedding_dim': 256, 'lr': 0.0005025722918895278, 'lambda_val': 6.13505476225876e-05, 'batch_size': 2515, 'optimizer': 'RMSprop'}.
2026-05-23 03:53:45,896 - experiment_functions - INFO - Early stopping at epoch 2950. Best Metrics: (0.054726615088267844, 0.026147540983606558, 0.04605172426477863)
2026-05-23 03:53:46,540 - optuna.study.study - INFO - Trial 116 finished with values: [0.054726615088267844, 0.026147540983606558, 0.04605172426477863] and parameters: {'n_layers': 1, 'embedding_dim': 64, 'lr': 0.03355477991096496, 'lambda_val': 0.0009863767281582856, 'batch_size': 1569, 'optimizer': 'Adam'}.
2026-05-23 03:53:51,038 - experiment_functions - INFO - Early stopping at epoch 650. Best Metrics: (0.0431747979693135, 0.024098360655737703, 0.03515913285059922)
2026-05-23 03:53:51,461 - optuna.study.study - INFO - Trial 117 finished with values: [0.0431747979693135, 0.024098360655737703, 0.03515913285059922] and parameters: {'n_layers': 3, 'embedding_dim': 256, 'lr': 0.0016044647069746135, 'lambda_val': 4.112104521892171e-06, 'batch_size': 1529, 'optimizer': 'Adam'}.
2026-05-23 03:53:54,379 - experiment_functions - INFO - Early stopping at epoch 650. Best Metrics: (0.09568868158433269, 0.04827868852459017, 0.08187505699532555)
2026-05-23 03:53:55,324 - optuna.study.study - INFO - Trial 118 finished with values: [0.09568868158433269, 0.04827868852459017, 0.08187505699532555] and parameters: {'n_layers': 1, 'embedding_dim': 128, 'lr': 0.0016044647069746135, 'lambda_val': 0.005013716564296358, 'batch_size': 2314, 'optimizer': 'Adam'}.
2026-05-23 03:53:57,973 - experiment_functions - INFO - Early stopping at epoch 500. Best Metrics: (0.001249335453203664, 0.0018852459016393442, 0.002287928157698823)
2026-05-23 03:53:58,656 - optuna.study.study - INFO - Trial 119 finished with values: [0.001249335453203664, 0.0018852459016393442, 0.002287928157698823] and parameters: {'n_layers': 1, 'embedding_dim': 64, 'lr': 0.0001451959463810353, 'lambda_val': 0.04164784585013574, 'batch_size': 2013, 'optimizer': 'RMSprop'}.
2026-05-23 03:54:13,647 - experiment_functions - INFO - Early stopping at epoch 2450. Best Metrics: (0.03602697690302297, 0.01778688524590164, 0.030353949285689057)
2026-05-23 03:54:14,176 - optuna.study.study - INFO - Trial 120 finished with values: [0.03602697690302297, 0.01778688524590164, 0.030353949285689057] and parameters: {'n_layers': 2, 'embedding_dim': 64, 'lr': 0.038572526598242896, 'lambda_val': 0.0013490791904657623, 'batch_size': 3201, 'optimizer': 'Adam'}.
2026-05-23 03:54:17,675 - experiment_functions - INFO - Early stopping at epoch 650. Best Metrics: (0.02922682450978088, 0.013032786885245904, 0.02145246059366487)
2026-05-23 03:54:18,346 - optuna.study.study - INFO - Trial 121 finished with values: [0.02922682450978088, 0.013032786885245904, 0.02145246059366487] and parameters: {'n_layers': 3, 'embedding_dim': 32, 'lr': 0.008519344251657169, 'lambda_val': 6.2109274589487925e-06, 'batch_size': 1749, 'optimizer': 'RMSprop'}.
2026-05-23 03:54:23,262 - experiment_functions - INFO - Early stopping at epoch 600. Best Metrics: (0.024573404854409973, 0.016147540983606556, 0.02446490403015807)
2026-05-23 03:54:23,362 - optuna.study.study - INFO - Trial 122 finished with values: [0.024573404854409973, 0.016147540983606556, 0.02446490403015807] and parameters: {'n_layers': 4, 'embedding_dim': 256, 'lr': 0.0007420979429767307, 'lambda_val': 0.004260672290845639, 'batch_size': 3409, 'optimizer': 'Adam'}.
2026-05-23 03:54:27,664 - experiment_functions - INFO - Early stopping at epoch 600. Best Metrics: (0.10498666605176252, 0.05254098360655737, 0.08627188049578839)
2026-05-23 03:54:27,759 - optuna.study.study - INFO - Trial 123 finished with values: [0.10498666605176252, 0.05254098360655737, 0.08627188049578839] and parameters: {'n_layers': 1, 'embedding_dim': 256, 'lr': 0.0029056396011724254, 'lambda_val': 6.13505476225876e-05, 'batch_size': 2314, 'optimizer': 'Adam'}.
2026-05-23 03:54:37,075 - experiment_functions - INFO - Early stopping at epoch 3100. Best Metrics: (0.060696426088190994, 0.035, 0.051258123518437046)
2026-05-23 03:54:37,181 - optuna.study.study - INFO - Trial 124 finished with values: [0.060696426088190994, 0.035, 0.051258123518437046] and parameters: {'n_layers': 1, 'embedding_dim': 32, 'lr': 0.028950674653766096, 'lambda_val': 0.005013716564296358, 'batch_size': 2606, 'optimizer': 'Adam'}.
2026-05-23 03:54:40,225 - experiment_functions - INFO - Early stopping at epoch 600. Best Metrics: (0.03146775990851133, 0.019672131147540985, 0.03019578342596274)
2026-05-23 03:54:40,369 - optuna.study.study - INFO - Trial 125 finished with values: [0.03146775990851133, 0.019672131147540985, 0.03019578342596274] and parameters: {'n_layers': 4, 'embedding_dim': 32, 'lr': 0.0025167752834235274, 'lambda_val': 2.594597210356708e-05, 'batch_size': 1784, 'optimizer': 'Adam'}.
2026-05-23 03:54:50,195 - experiment_functions - INFO - Early stopping at epoch 2150. Best Metrics: (0.07552846902081485, 0.03836065573770492, 0.06218497621847745)
2026-05-23 03:54:50,275 - optuna.study.study - INFO - Trial 126 finished with values: [0.07552846902081485, 0.03836065573770492, 0.06218497621847745] and parameters: {'n_layers': 3, 'embedding_dim': 128, 'lr': 0.000233346029650438, 'lambda_val': 2.0700677762543618e-06, 'batch_size': 1170, 'optimizer': 'RMSprop'}.
2026-05-23 03:54:56,714 - experiment_functions - INFO - Early stopping at epoch 1250. Best Metrics: (0.013736668890225952, 0.01098360655737705, 0.015767719342177744)
2026-05-23 03:54:56,789 - optuna.study.study - INFO - Trial 127 finished with values: [0.013736668890225952, 0.01098360655737705, 0.015767719342177744] and parameters: {'n_layers': 3, 'embedding_dim': 128, 'lr': 0.0043499485856008146, 'lambda_val': 0.03315574098666407, 'batch_size': 3689, 'optimizer': 'Adam'}.
2026-05-23 03:55:02,924 - experiment_functions - INFO - Early stopping at epoch 550. Best Metrics: (0.01898944898794654, 0.010655737704918032, 0.018567198525203193)
2026-05-23 03:55:03,470 - optuna.study.study - INFO - Trial 128 finished with values: [0.01898944898794654, 0.010655737704918032, 0.018567198525203193] and parameters: {'n_layers': 3, 'embedding_dim': 32, 'lr': 0.027522393386496705, 'lambda_val': 6.824127733359171e-06, 'batch_size': 3424, 'optimizer': 'Adam'}.
2026-05-23 03:55:16,759 - optuna.study.study - INFO - Trial 129 finished with values: [0.02878588330750656, 0.01959016393442623, 0.02766844882896295] and parameters: {'n_layers': 1, 'embedding_dim': 64, 'lr': 0.00012113925642415473, 'lambda_val': 0.0009863767281582856, 'batch_size': 2127, 'optimizer': 'Adam'}.
2026-05-23 03:55:19,686 - experiment_functions - INFO - Early stopping at epoch 600. Best Metrics: (0.05278524214250162, 0.03401639344262295, 0.04924905929049327)
2026-05-23 03:55:20,274 - optuna.study.study - INFO - Trial 130 finished with values: [0.05278524214250162, 0.03401639344262295, 0.04924905929049327] and parameters: {'n_layers': 2, 'embedding_dim': 64, 'lr': 0.0029056396011724254, 'lambda_val': 1.0503895207684912e-06, 'batch_size': 2515, 'optimizer': 'Adam'}.
2026-05-23 03:55:22,886 - experiment_functions - INFO - Early stopping at epoch 550. Best Metrics: (0.09017662561369263, 0.04467213114754098, 0.07467637233824348)
2026-05-23 03:55:22,979 - optuna.study.study - INFO - Trial 131 finished with values: [0.09017662561369263, 0.04467213114754098, 0.07467637233824348] and parameters: {'n_layers': 1, 'embedding_dim': 128, 'lr': 0.00726893620558119, 'lambda_val': 8.173822349987447e-05, 'batch_size': 2515, 'optimizer': 'Adam'}.
2026-05-23 03:55:25,693 - experiment_functions - INFO - Early stopping at epoch 600. Best Metrics: (0.0917766967889692, 0.04885245901639345, 0.07623315266388023)
2026-05-23 03:55:25,796 - optuna.study.study - INFO - Trial 132 finished with values: [0.0917766967889692, 0.04885245901639345, 0.07623315266388023] and parameters: {'n_layers': 1, 'embedding_dim': 96, 'lr': 0.0029056396011724254, 'lambda_val': 6.13505476225876e-05, 'batch_size': 3317, 'optimizer': 'Adam'}.
2026-05-23 03:55:38,496 - optuna.study.study - INFO - Trial 133 finished with values: [0.004403474935657795, 0.0038524590163934434, 0.004622164578974215] and parameters: {'n_layers': 1, 'embedding_dim': 32, 'lr': 6.845164087029023e-05, 'lambda_val': 0.00015665975984625308, 'batch_size': 2314, 'optimizer': 'Adam'}.
2026-05-23 03:55:43,024 - experiment_functions - INFO - Early stopping at epoch 1200. Best Metrics: (0.10518427593136705, 0.048852459016393436, 0.08341413738142801)
2026-05-23 03:55:44,028 - optuna.study.study - INFO - Trial 134 finished with values: [0.10518427593136705, 0.048852459016393436, 0.08341413738142801] and parameters: {'n_layers': 1, 'embedding_dim': 64, 'lr': 0.0007420979429767307, 'lambda_val': 2.8437538312167664e-05, 'batch_size': 2314, 'optimizer': 'Adam'}.
2026-05-23 03:55:47,693 - experiment_functions - INFO - Early stopping at epoch 950. Best Metrics: (0.10390395972505781, 0.04844262295081967, 0.0814196954258838)
2026-05-23 03:55:47,801 - optuna.study.study - INFO - Trial 135 finished with values: [0.10390395972505781, 0.04844262295081967, 0.0814196954258838] and parameters: {'n_layers': 1, 'embedding_dim': 64, 'lr': 0.0016044647069746135, 'lambda_val': 1.6693478080315474e-06, 'batch_size': 1529, 'optimizer': 'Adam'}.
2026-05-23 03:55:53,918 - experiment_functions - INFO - Early stopping at epoch 1450. Best Metrics: (0.025092059681608145, 0.011639344262295081, 0.020244537461665026)
2026-05-23 03:55:54,011 - optuna.study.study - INFO - Trial 136 finished with values: [0.025092059681608145, 0.011639344262295081, 0.020244537461665026] and parameters: {'n_layers': 2, 'embedding_dim': 128, 'lr': 0.027856035862650546, 'lambda_val': 6.13505476225876e-05, 'batch_size': 1992, 'optimizer': 'RMSprop'}.
2026-05-23 03:56:06,799 - optuna.study.study - INFO - Trial 137 finished with values: [0.03892264177372737, 0.023770491803278688, 0.03584726965806595] and parameters: {'n_layers': 1, 'embedding_dim': 64, 'lr': 0.00012113925642415473, 'lambda_val': 0.0003938798171532122, 'batch_size': 2331, 'optimizer': 'Adam'}.
2026-05-23 03:56:09,405 - experiment_functions - INFO - Early stopping at epoch 550. Best Metrics: (0.05367125751825285, 0.02688524590163935, 0.041922559666140155)
2026-05-23 03:56:09,488 - optuna.study.study - INFO - Trial 138 finished with values: [0.05367125751825285, 0.02688524590163935, 0.041922559666140155] and parameters: {'n_layers': 1, 'embedding_dim': 96, 'lr': 0.006682771802508509, 'lambda_val': 0.0017795542900466829, 'batch_size': 2784, 'optimizer': 'RMSprop'}.
2026-05-23 03:56:12,125 - experiment_functions - INFO - Early stopping at epoch 550. Best Metrics: (0.09850064860143615, 0.04918032786885246, 0.081054909355391)
2026-05-23 03:56:12,233 - optuna.study.study - INFO - Trial 139 finished with values: [0.09850064860143615, 0.04918032786885246, 0.081054909355391] and parameters: {'n_layers': 1, 'embedding_dim': 128, 'lr': 0.00726893620558119, 'lambda_val': 1.8084571105268367e-05, 'batch_size': 2670, 'optimizer': 'Adam'}.
2026-05-23 03:56:28,110 - optuna.study.study - INFO - Trial 140 finished with values: [0.026824314438261703, 0.018442622950819672, 0.02547503770819377] and parameters: {'n_layers': 2, 'embedding_dim': 128, 'lr': 7.429060060163502e-05, 'lambda_val': 0.0074300178381333975, 'batch_size': 3115, 'optimizer': 'RMSprop'}.
2026-05-23 03:56:32,126 - experiment_functions - INFO - Early stopping at epoch 1000. Best Metrics: (0.05898336657828301, 0.03352459016393443, 0.04986041543721846)
2026-05-23 03:56:32,475 - optuna.study.study - INFO - Trial 141 finished with values: [0.05898336657828301, 0.03352459016393443, 0.04986041543721846] and parameters: {'n_layers': 2, 'embedding_dim': 64, 'lr': 0.0005201459519511334, 'lambda_val': 0.0074300178381333975, 'batch_size': 1534, 'optimizer': 'Adam'}.
2026-05-23 03:56:35,776 - experiment_functions - INFO - Early stopping at epoch 850. Best Metrics: (0.09867077487670203, 0.04860655737704918, 0.07771039769083835)
2026-05-23 03:56:35,876 - optuna.study.study - INFO - Trial 142 finished with values: [0.09867077487670203, 0.04860655737704918, 0.07771039769083835] and parameters: {'n_layers': 1, 'embedding_dim': 64, 'lr': 0.0029056396011724254, 'lambda_val': 6.13505476225876e-05, 'batch_size': 541, 'optimizer': 'Adam'}.
2026-05-23 03:56:39,348 - experiment_functions - INFO - Early stopping at epoch 650. Best Metrics: (0.038880437451684215, 0.024754098360655737, 0.033933412092793505)
2026-05-23 03:56:39,433 - optuna.study.study - INFO - Trial 143 finished with values: [0.038880437451684215, 0.024754098360655737, 0.033933412092793505] and parameters: {'n_layers': 3, 'embedding_dim': 96, 'lr': 0.0008908588265458165, 'lambda_val': 0.0009863767281582856, 'batch_size': 3317, 'optimizer': 'Adam'}.
2026-05-23 03:56:42,572 - experiment_functions - INFO - Early stopping at epoch 700. Best Metrics: (0.04672039034994689, 0.029262295081967215, 0.04222230508416776)
2026-05-23 03:56:43,633 - optuna.study.study - INFO - Trial 144 finished with values: [0.04672039034994689, 0.029262295081967215, 0.04222230508416776] and parameters: {'n_layers': 3, 'embedding_dim': 32, 'lr': 0.0014877260116219874, 'lambda_val': 6.2109274589487925e-06, 'batch_size': 1335, 'optimizer': 'Adam'}.
2026-05-23 03:56:47,316 - experiment_functions - INFO - Early stopping at epoch 500. Best Metrics: (0.021469194580305283, 0.009754098360655737, 0.017188731064240414)
2026-05-23 03:56:48,682 - optuna.study.study - INFO - Trial 145 finished with values: [0.021469194580305283, 0.009754098360655737, 0.017188731064240414] and parameters: {'n_layers': 3, 'embedding_dim': 96, 'lr': 0.0212737369368371, 'lambda_val': 0.019274562156610407, 'batch_size': 618, 'optimizer': 'RMSprop'}.
2026-05-23 03:56:52,580 - experiment_functions - INFO - Early stopping at epoch 700. Best Metrics: (0.020641252616030364, 0.011393442622950821, 0.016670341292409328)
2026-05-23 03:56:52,681 - optuna.study.study - INFO - Trial 146 finished with values: [0.020641252616030364, 0.011393442622950821, 0.016670341292409328] and parameters: {'n_layers': 4, 'embedding_dim': 128, 'lr': 0.0029056396011724254, 'lambda_val': 0.00015302736237202981, 'batch_size': 1353, 'optimizer': 'RMSprop'}.
2026-05-23 03:57:07,541 - optuna.study.study - INFO - Trial 147 finished with values: [0.026436899407306536, 0.018032786885245903, 0.02517464450801539] and parameters: {'n_layers': 3, 'embedding_dim': 96, 'lr': 7.429060060163502e-05, 'lambda_val': 4.112104521892171e-06, 'batch_size': 618, 'optimizer': 'Adam'}.
2026-05-23 03:57:10,123 - experiment_functions - INFO - Early stopping at epoch 700. Best Metrics: (0.04523543519865068, 0.02426229508196721, 0.037589546479695764)
2026-05-23 03:57:10,207 - optuna.study.study - INFO - Trial 148 finished with values: [0.04523543519865068, 0.02426229508196721, 0.037589546479695764] and parameters: {'n_layers': 1, 'embedding_dim': 64, 'lr': 0.00726893620558119, 'lambda_val': 0.0017795542900466829, 'batch_size': 2005, 'optimizer': 'RMSprop'}.
2026-05-23 03:57:21,352 - optuna.study.study - INFO - Trial 149 finished with values: [0.08085219107098295, 0.046311475409836066, 0.06872745325971466] and parameters: {'n_layers': 1, 'embedding_dim': 32, 'lr': 0.00026503485300845536, 'lambda_val': 0.005013716564296358, 'batch_size': 2384, 'optimizer': 'Adam'}.
2026-05-23 03:57:23,624 - experiment_functions - INFO - Early stopping at epoch 500. Best Metrics: (0.0018744195240754289, 0.0013114754098360656, 0.0016988329789827021)
2026-05-23 03:57:23,726 - optuna.study.study - INFO - Trial 150 finished with values: [0.0018744195240754289, 0.0013114754098360656, 0.0016988329789827021] and parameters: {'n_layers': 1, 'embedding_dim': 64, 'lr': 0.006682771802508509, 'lambda_val': 2.8437538312167664e-05, 'batch_size': 2314, 'optimizer': 'SGD'}.
2026-05-23 03:57:37,619 - optuna.study.study - INFO - Trial 151 finished with values: [0.06964966632999883, 0.0389344262295082, 0.06316304797000155] and parameters: {'n_layers': 4, 'embedding_dim': 32, 'lr': 0.000233346029650438, 'lambda_val': 2.0700677762543618e-06, 'batch_size': 1170, 'optimizer': 'RMSprop'}.
2026-05-23 03:57:40,820 - experiment_functions - INFO - Early stopping at epoch 800. Best Metrics: (0.11428837682925465, 0.054098360655737705, 0.09162280734259214)
2026-05-23 03:57:41,298 - optuna.study.study - INFO - Trial 152 finished with values: [0.11428837682925465, 0.054098360655737705, 0.09162280734259214] and parameters: {'n_layers': 1, 'embedding_dim': 64, 'lr': 0.0016044647069746135, 'lambda_val': 6.13505476225876e-05, 'batch_size': 3317, 'optimizer': 'Adam'}.
2026-05-23 03:57:44,139 - experiment_functions - INFO - Early stopping at epoch 600. Best Metrics: (0.09763808824565835, 0.04672131147540984, 0.08478893041004953)
2026-05-23 03:57:44,248 - optuna.study.study - INFO - Trial 153 finished with values: [0.09763808824565835, 0.04672131147540984, 0.08478893041004953] and parameters: {'n_layers': 1, 'embedding_dim': 256, 'lr': 0.004599382237810887, 'lambda_val': 2.0700677762543618e-06, 'batch_size': 583, 'optimizer': 'Adam'}.
2026-05-23 03:57:47,613 - experiment_functions - INFO - Early stopping at epoch 850. Best Metrics: (0.018080290104866416, 0.01040983606557377, 0.01626500698559862)
2026-05-23 03:57:47,938 - optuna.study.study - INFO - Trial 154 finished with values: [0.018080290104866416, 0.01040983606557377, 0.01626500698559862] and parameters: {'n_layers': 3, 'embedding_dim': 32, 'lr': 0.03471681951281512, 'lambda_val': 0.005013716564296358, 'batch_size': 2589, 'optimizer': 'Adam'}.
2026-05-23 03:58:03,852 - experiment_functions - INFO - Early stopping at epoch 3700. Best Metrics: (0.060452085459060986, 0.03401639344262295, 0.05044966888423094)
2026-05-23 03:58:04,739 - optuna.study.study - INFO - Trial 155 finished with values: [0.060452085459060986, 0.03401639344262295, 0.05044966888423094] and parameters: {'n_layers': 1, 'embedding_dim': 32, 'lr': 0.028950674653766096, 'lambda_val': 0.005013716564296358, 'batch_size': 2606, 'optimizer': 'Adam'}.
2026-05-23 03:58:20,048 - experiment_functions - INFO - Early stopping at epoch 3700. Best Metrics: (0.035459074455241026, 0.0239344262295082, 0.031869915893979466)
2026-05-23 03:58:20,660 - optuna.study.study - INFO - Trial 156 finished with values: [0.035459074455241026, 0.0239344262295082, 0.031869915893979466] and parameters: {'n_layers': 3, 'embedding_dim': 128, 'lr': 0.0001451959463810353, 'lambda_val': 0.0074300178381333975, 'batch_size': 2314, 'optimizer': 'Adam'}.
2026-05-23 03:58:38,851 - optuna.study.study - INFO - Trial 157 finished with values: [0.05651645601533633, 0.03098360655737705, 0.050559771664749245] and parameters: {'n_layers': 2, 'embedding_dim': 256, 'lr': 9.478213509524595e-05, 'lambda_val': 2.2085450512136348e-05, 'batch_size': 2670, 'optimizer': 'Adam'}.
2026-05-23 03:58:41,947 - experiment_functions - INFO - Early stopping at epoch 750. Best Metrics: (0.05654314295363586, 0.03278688524590164, 0.04829213537209353)
2026-05-23 03:58:42,204 - optuna.study.study - INFO - Trial 158 finished with values: [0.05654314295363586, 0.03278688524590164, 0.04829213537209353] and parameters: {'n_layers': 2, 'embedding_dim': 96, 'lr': 0.0007420979429767307, 'lambda_val': 6.13505476225876e-05, 'batch_size': 2314, 'optimizer': 'RMSprop'}.
2026-05-23 03:58:45,009 - experiment_functions - INFO - Early stopping at epoch 600. Best Metrics: (0.04860431057614758, 0.02942622950819672, 0.0450321432226256)
2026-05-23 03:58:45,082 - optuna.study.study - INFO - Trial 159 finished with values: [0.04860431057614758, 0.02942622950819672, 0.0450321432226256] and parameters: {'n_layers': 2, 'embedding_dim': 32, 'lr': 0.0030781774757417286, 'lambda_val': 2.0700677762543618e-06, 'batch_size': 3542, 'optimizer': 'Adam'}.
2026-05-23 03:58:48,257 - experiment_functions - INFO - Early stopping at epoch 700. Best Metrics: (0.04832958001302264, 0.0289344262295082, 0.045048070467676046)
2026-05-23 03:58:48,678 - optuna.study.study - INFO - Trial 160 finished with values: [0.04832958001302264, 0.0289344262295082, 0.045048070467676046] and parameters: {'n_layers': 2, 'embedding_dim': 64, 'lr': 0.0008664316840199177, 'lambda_val': 0.0074300178381333975, 'batch_size': 2314, 'optimizer': 'Adam'}.
2026-05-23 03:58:51,260 - experiment_functions - INFO - Early stopping at epoch 550. Best Metrics: (0.06602240714273012, 0.037950819672131146, 0.05658692615854407)
