2026-05-23 02:55:45,415 - optuna.study.study - INFO - Trial 195 finished with values: [0.030472315478626607, 0.02163934426229508, 0.03070312858509764] and parameters: {'n_layers': 2, 'embedding_dim': 128, 'lr': 0.00466372845018428, 'lambda_val': 0.007024459859123817, 'batch_size': 792, 'optimizer': 'Adam'}.
2026-05-23 02:56:01,528 - experiment_functions - INFO - Early stopping at epoch 3500. Best Metrics: (0.03789086630203209, 0.028934426229508193, 0.03839580604036342)
2026-05-23 02:56:01,819 - optuna.study.study - INFO - Trial 196 finished with values: [0.03789086630203209, 0.028934426229508193, 0.03839580604036342] and parameters: {'n_layers': 3, 'embedding_dim': 96, 'lr': 0.00019324235493803607, 'lambda_val': 2.1146074643297403e-05, 'batch_size': 2701, 'optimizer': 'Adam'}.
2026-05-23 02:56:04,844 - experiment_functions - INFO - Early stopping at epoch 550. Best Metrics: (0.03722698629556881, 0.02540983606557377, 0.03450907841040619)
2026-05-23 02:56:05,073 - optuna.study.study - INFO - Trial 197 finished with values: [0.03722698629556881, 0.02540983606557377, 0.03450907841040619] and parameters: {'n_layers': 2, 'embedding_dim': 128, 'lr': 0.004434110743664845, 'lambda_val': 0.00023185127305384867, 'batch_size': 808, 'optimizer': 'Adam'}.
2026-05-23 02:56:07,906 - experiment_functions - INFO - Early stopping at epoch 550. Best Metrics: (0.04794585620310776, 0.03401639344262296, 0.04652254140735499)
2026-05-23 02:56:07,994 - optuna.study.study - INFO - Trial 198 finished with values: [0.04794585620310776, 0.03401639344262296, 0.04652254140735499] and parameters: {'n_layers': 2, 'embedding_dim': 64, 'lr': 0.0056420762452804776, 'lambda_val': 0.0027428171281445477, 'batch_size': 1222, 'optimizer': 'Adam'}.
2026-05-23 02:56:10,976 - experiment_functions - INFO - Early stopping at epoch 550. Best Metrics: (0.06280152974802468, 0.04065573770491803, 0.058986113872457786)
2026-05-23 02:56:11,546 - optuna.study.study - INFO - Trial 199 finished with values: [0.06280152974802468, 0.04065573770491803, 0.058986113872457786] and parameters: {'n_layers': 1, 'embedding_dim': 256, 'lr': 0.00466372845018428, 'lambda_val': 2.1146074643297403e-05, 'batch_size': 1269, 'optimizer': 'Adam'}.
2026-05-23 02:56:16,239 - experiment_functions - INFO - Early stopping at epoch 1150. Best Metrics: (0.06395906363660128, 0.04516393442622951, 0.06421006306182)
2026-05-23 02:56:16,567 - optuna.study.study - INFO - Trial 200 finished with values: [0.06395906363660128, 0.04516393442622951, 0.06421006306182] and parameters: {'n_layers': 1, 'embedding_dim': 96, 'lr': 0.0005134970540789423, 'lambda_val': 0.00023185127305384867, 'batch_size': 3937, 'optimizer': 'Adam'}.
2026-05-23 02:56:26,434 - experiment_functions - INFO - Early stopping at epoch 2650. Best Metrics: (0.055416015999814855, 0.04344262295081967, 0.05841354869099073)
2026-05-23 02:56:26,520 - optuna.study.study - INFO - Trial 201 finished with values: [0.055416015999814855, 0.04344262295081967, 0.05841354869099073] and parameters: {'n_layers': 1, 'embedding_dim': 128, 'lr': 0.0002738093623313198, 'lambda_val': 0.00023185127305384867, 'batch_size': 3937, 'optimizer': 'Adam'}.
2026-05-23 02:56:29,209 - experiment_functions - INFO - Early stopping at epoch 600. Best Metrics: (0.06157926519472439, 0.04024590163934426, 0.05832128725116202)
2026-05-23 02:56:29,335 - optuna.study.study - INFO - Trial 202 finished with values: [0.06157926519472439, 0.04024590163934426, 0.05832128725116202] and parameters: {'n_layers': 1, 'embedding_dim': 64, 'lr': 0.00466372845018428, 'lambda_val': 2.2233828874401383e-06, 'batch_size': 2607, 'optimizer': 'Adam'}.
2026-05-23 02:56:34,539 - experiment_functions - INFO - Early stopping at epoch 550. Best Metrics: (0.058242392834562874, 0.03704918032786886, 0.05443028644946372)
2026-05-23 02:56:34,972 - optuna.study.study - INFO - Trial 203 finished with values: [0.058242392834562874, 0.03704918032786886, 0.05443028644946372] and parameters: {'n_layers': 1, 'embedding_dim': 64, 'lr': 0.0056420762452804776, 'lambda_val': 0.0035064867017704023, 'batch_size': 1651, 'optimizer': 'Adam'}.
2026-05-23 02:56:43,255 - experiment_functions - INFO - Early stopping at epoch 2150. Best Metrics: (0.06979290347738323, 0.04950819672131147, 0.0702759873898042)
2026-05-23 02:56:43,940 - optuna.study.study - INFO - Trial 204 finished with values: [0.06979290347738323, 0.04950819672131147, 0.0702759873898042] and parameters: {'n_layers': 1, 'embedding_dim': 64, 'lr': 0.0005134970540789423, 'lambda_val': 0.0009810927157913494, 'batch_size': 1222, 'optimizer': 'RMSprop'}.
2026-05-23 02:56:50,510 - experiment_functions - INFO - Early stopping at epoch 600. Best Metrics: (0.041805039666437296, 0.0330327868852459, 0.04592298340052202)
2026-05-23 02:56:51,432 - optuna.study.study - INFO - Trial 205 finished with values: [0.041805039666437296, 0.0330327868852459, 0.04592298340052202] and parameters: {'n_layers': 1, 'embedding_dim': 128, 'lr': 0.00466372845018428, 'lambda_val': 0.007024459859123817, 'batch_size': 1103, 'optimizer': 'Adam'}.
2026-05-23 02:56:56,479 - experiment_functions - INFO - Early stopping at epoch 1300. Best Metrics: (0.05449184456142723, 0.03819672131147541, 0.05477196740726736)
2026-05-23 02:56:57,394 - optuna.study.study - INFO - Trial 206 finished with values: [0.05449184456142723, 0.03819672131147541, 0.05477196740726736] and parameters: {'n_layers': 1, 'embedding_dim': 96, 'lr': 0.009161214218902355, 'lambda_val': 0.007352147641655774, 'batch_size': 3577, 'optimizer': 'RMSprop'}.
2026-05-23 02:57:09,411 - experiment_functions - INFO - Early stopping at epoch 2400. Best Metrics: (0.07276139029501916, 0.04491803278688524, 0.06924716347337158)
2026-05-23 02:57:09,492 - optuna.study.study - INFO - Trial 207 finished with values: [0.07276139029501916, 0.04491803278688524, 0.06924716347337158] and parameters: {'n_layers': 2, 'embedding_dim': 256, 'lr': 0.00019324235493803607, 'lambda_val': 8.60783053151504e-05, 'batch_size': 1084, 'optimizer': 'RMSprop'}.
2026-05-23 02:57:14,909 - experiment_functions - INFO - Early stopping at epoch 1450. Best Metrics: (0.05702011661064712, 0.04114754098360656, 0.05723433946949563)
2026-05-23 02:57:15,014 - optuna.study.study - INFO - Trial 208 finished with values: [0.05702011661064712, 0.04114754098360656, 0.05723433946949563] and parameters: {'n_layers': 1, 'embedding_dim': 32, 'lr': 0.0005134970540789423, 'lambda_val': 0.004212470249457581, 'batch_size': 2427, 'optimizer': 'RMSprop'}.
2026-05-23 02:57:26,945 - optuna.study.study - INFO - Trial 209 finished with values: [0.05726830055960315, 0.04008196721311476, 0.054642228068576784] and parameters: {'n_layers': 1, 'embedding_dim': 32, 'lr': 0.0002738093623313198, 'lambda_val': 0.013489522394415601, 'batch_size': 584, 'optimizer': 'Adam'}.
2026-05-23 02:57:31,948 - experiment_functions - INFO - Early stopping at epoch 800. Best Metrics: (0.05218009744725765, 0.037950819672131146, 0.05267109898976565)
2026-05-23 02:57:33,167 - optuna.study.study - INFO - Trial 210 finished with values: [0.05218009744725765, 0.037950819672131146, 0.05267109898976565] and parameters: {'n_layers': 1, 'embedding_dim': 128, 'lr': 0.001459413805808463, 'lambda_val': 0.0009810927157913494, 'batch_size': 2427, 'optimizer': 'RMSprop'}.
2026-05-23 02:57:46,410 - experiment_functions - INFO - Early stopping at epoch 3650. Best Metrics: (0.0661598956247979, 0.04549180327868853, 0.06732371367278212)
2026-05-23 02:57:46,503 - optuna.study.study - INFO - Trial 211 finished with values: [0.0661598956247979, 0.04549180327868853, 0.06732371367278212] and parameters: {'n_layers': 1, 'embedding_dim': 128, 'lr': 0.0002738093623313198, 'lambda_val': 0.00023185127305384867, 'batch_size': 3937, 'optimizer': 'Adam'}.
2026-05-23 02:57:50,778 - experiment_functions - INFO - Early stopping at epoch 950. Best Metrics: (0.07134195529774537, 0.03860655737704918, 0.0652980042133123)
2026-05-23 02:57:51,233 - optuna.study.study - INFO - Trial 212 finished with values: [0.07134195529774537, 0.03860655737704918, 0.0652980042133123] and parameters: {'n_layers': 1, 'embedding_dim': 256, 'lr': 0.0021815076478240193, 'lambda_val': 0.00023185127305384867, 'batch_size': 1222, 'optimizer': 'Adam'}.
2026-05-23 02:57:57,670 - experiment_functions - INFO - Early stopping at epoch 1800. Best Metrics: (0.060046502620070455, 0.04360655737704918, 0.06388862805960503)
2026-05-23 02:57:57,747 - optuna.study.study - INFO - Trial 213 finished with values: [0.060046502620070455, 0.04360655737704918, 0.06388862805960503] and parameters: {'n_layers': 1, 'embedding_dim': 64, 'lr': 0.0005134970540789423, 'lambda_val': 0.0009810927157913494, 'batch_size': 2427, 'optimizer': 'RMSprop'}.
2026-05-23 02:58:08,846 - experiment_functions - INFO - Early stopping at epoch 2700. Best Metrics: (0.05482642444120366, 0.038442622950819676, 0.054477938277835966)
2026-05-23 02:58:10,016 - optuna.study.study - INFO - Trial 214 finished with values: [0.05482642444120366, 0.038442622950819676, 0.054477938277835966] and parameters: {'n_layers': 2, 'embedding_dim': 128, 'lr': 0.00016298601179134825, 'lambda_val': 0.008198149930508243, 'batch_size': 1040, 'optimizer': 'RMSprop'}.
2026-05-23 02:58:12,408 - experiment_functions - INFO - Early stopping at epoch 500. Best Metrics: (0.0010513848550397695, 0.0018032786885245904, 0.0017760292824692827)
2026-05-23 02:58:12,506 - optuna.study.study - INFO - Trial 215 finished with values: [0.0010513848550397695, 0.0018032786885245904, 0.0017760292824692827] and parameters: {'n_layers': 1, 'embedding_dim': 32, 'lr': 1.9480623309133223e-05, 'lambda_val': 0.005469691175731185, 'batch_size': 3064, 'optimizer': 'RMSprop'}.
2026-05-23 02:58:17,457 - experiment_functions - INFO - Early stopping at epoch 1250. Best Metrics: (0.061889274469158165, 0.044754098360655734, 0.06089892426690191)
2026-05-23 02:58:18,689 - optuna.study.study - INFO - Trial 216 finished with values: [0.061889274469158165, 0.044754098360655734, 0.06089892426690191] and parameters: {'n_layers': 1, 'embedding_dim': 128, 'lr': 0.0005134970540789423, 'lambda_val': 0.013489522394415601, 'batch_size': 1787, 'optimizer': 'Adam'}.
2026-05-23 02:58:21,476 - experiment_functions - INFO - Early stopping at epoch 550. Best Metrics: (0.058379270470330355, 0.041721311475409834, 0.05881798250091914)
2026-05-23 02:58:21,616 - optuna.study.study - INFO - Trial 217 finished with values: [0.058379270470330355, 0.041721311475409834, 0.05881798250091914] and parameters: {'n_layers': 1, 'embedding_dim': 128, 'lr': 0.00466372845018428, 'lambda_val': 0.0011797503400601253, 'batch_size': 1195, 'optimizer': 'Adam'}.
2026-05-23 02:58:31,232 - experiment_functions - INFO - Early stopping at epoch 1850. Best Metrics: (0.04825933976831458, 0.035983606557377056, 0.04919237015248644)
2026-05-23 02:58:31,409 - optuna.study.study - INFO - Trial 218 finished with values: [0.04825933976831458, 0.035983606557377056, 0.04919237015248644] and parameters: {'n_layers': 2, 'embedding_dim': 256, 'lr': 0.00015087698888573533, 'lambda_val': 0.008198149930508243, 'batch_size': 1930, 'optimizer': 'RMSprop'}.
2026-05-23 02:58:35,831 - experiment_functions - INFO - Early stopping at epoch 1250. Best Metrics: (0.061620327167704755, 0.04401639344262295, 0.06083761724289538)
2026-05-23 02:58:35,917 - optuna.study.study - INFO - Trial 219 finished with values: [0.061620327167704755, 0.04401639344262295, 0.06083761724289538] and parameters: {'n_layers': 1, 'embedding_dim': 64, 'lr': 0.0005134970540789423, 'lambda_val': 8.689122223949433e-06, 'batch_size': 2701, 'optimizer': 'RMSprop'}.
2026-05-23 02:58:46,567 - experiment_functions - INFO - Early stopping at epoch 1550. Best Metrics: (0.06443203845887628, 0.043852459016393446, 0.06674653939580921)
2026-05-23 02:58:46,639 - optuna.study.study - INFO - Trial 220 finished with values: [0.06443203845887628, 0.043852459016393446, 0.06674653939580921] and parameters: {'n_layers': 1, 'embedding_dim': 256, 'lr': 0.0003465182892109986, 'lambda_val': 0.00017445053981747112, 'batch_size': 2773, 'optimizer': 'Adam'}.
2026-05-23 02:58:49,987 - experiment_functions - INFO - Early stopping at epoch 750. Best Metrics: (0.05635817894763493, 0.04262295081967213, 0.06087716253426732)
2026-05-23 02:58:50,372 - optuna.study.study - INFO - Trial 221 finished with values: [0.05635817894763493, 0.04262295081967213, 0.06087716253426732] and parameters: {'n_layers': 1, 'embedding_dim': 64, 'lr': 0.0013028688223409228, 'lambda_val': 0.0027428171281445477, 'batch_size': 745, 'optimizer': 'RMSprop'}.
2026-05-23 02:58:53,337 - experiment_functions - INFO - Early stopping at epoch 550. Best Metrics: (0.05499800555599924, 0.038114754098360654, 0.05414682018319994)
2026-05-23 02:58:53,443 - optuna.study.study - INFO - Trial 222 finished with values: [0.05499800555599924, 0.038114754098360654, 0.05414682018319994] and parameters: {'n_layers': 1, 'embedding_dim': 256, 'lr': 0.00466372845018428, 'lambda_val': 2.1146074643297403e-05, 'batch_size': 1269, 'optimizer': 'Adam'}.
2026-05-23 02:59:01,542 - experiment_functions - INFO - Early stopping at epoch 1900. Best Metrics: (0.05383903442284102, 0.03557377049180328, 0.05070608738630005)
2026-05-23 02:59:01,660 - optuna.study.study - INFO - Trial 223 finished with values: [0.05383903442284102, 0.03557377049180328, 0.05070608738630005] and parameters: {'n_layers': 3, 'embedding_dim': 64, 'lr': 0.0002738093623313198, 'lambda_val': 8.689122223949433e-06, 'batch_size': 1084, 'optimizer': 'RMSprop'}.
2026-05-23 02:59:04,103 - experiment_functions - INFO - Early stopping at epoch 550. Best Metrics: (0.004165225553871743, 0.0027868852459016396, 0.003751830141439572)
2026-05-23 02:59:04,338 - optuna.study.study - INFO - Trial 224 finished with values: [0.004165225553871743, 0.0027868852459016396, 0.003751830141439572] and parameters: {'n_layers': 1, 'embedding_dim': 32, 'lr': 4.777185766184631e-05, 'lambda_val': 0.00010574161158144353, 'batch_size': 1091, 'optimizer': 'Adam'}.
2026-05-23 02:59:09,052 - experiment_functions - INFO - Early stopping at epoch 1050. Best Metrics: (0.06406253896464947, 0.04237704918032787, 0.06448112691971612)
2026-05-23 02:59:09,626 - optuna.study.study - INFO - Trial 225 finished with values: [0.06406253896464947, 0.04237704918032787, 0.06448112691971612] and parameters: {'n_layers': 1, 'embedding_dim': 256, 'lr': 0.0005134970540789423, 'lambda_val': 0.0006934432893870002, 'batch_size': 1651, 'optimizer': 'RMSprop'}.
2026-05-23 02:59:13,635 - experiment_functions - INFO - Early stopping at epoch 900. Best Metrics: (0.06268959024208046, 0.04491803278688524, 0.060880779887030584)
2026-05-23 02:59:13,885 - optuna.study.study - INFO - Trial 226 finished with values: [0.06268959024208046, 0.04491803278688524, 0.060880779887030584] and parameters: {'n_layers': 1, 'embedding_dim': 64, 'lr': 0.0013555052564010479, 'lambda_val': 2.2233828874401383e-06, 'batch_size': 3466, 'optimizer': 'Adam'}.
2026-05-23 02:59:17,028 - experiment_functions - INFO - Early stopping at epoch 600. Best Metrics: (0.037714974691973935, 0.0269672131147541, 0.036285136424847916)
2026-05-23 02:59:17,110 - optuna.study.study - INFO - Trial 227 finished with values: [0.037714974691973935, 0.0269672131147541, 0.036285136424847916] and parameters: {'n_layers': 2, 'embedding_dim': 96, 'lr': 0.0013555052564010479, 'lambda_val': 6.501058820242015e-05, 'batch_size': 2607, 'optimizer': 'RMSprop'}.
2026-05-23 02:59:22,827 - experiment_functions - INFO - Early stopping at epoch 1600. Best Metrics: (0.0025456014043300484, 0.002377049180327869, 0.0033489012676294378)
2026-05-23 02:59:22,989 - optuna.study.study - INFO - Trial 228 finished with values: [0.0025456014043300484, 0.002377049180327869, 0.0033489012676294378] and parameters: {'n_layers': 1, 'embedding_dim': 128, 'lr': 2.416990041959857e-05, 'lambda_val': 8.60783053151504e-05, 'batch_size': 808, 'optimizer': 'Adam'}.
2026-05-23 02:59:26,438 - experiment_functions - INFO - Early stopping at epoch 500. Best Metrics: (0.002087059779617648, 0.0013114754098360656, 0.0020472705843688904)
2026-05-23 02:59:26,861 - optuna.study.study - INFO - Trial 229 finished with values: [0.002087059779617648, 0.0013114754098360656, 0.0020472705843688904] and parameters: {'n_layers': 3, 'embedding_dim': 128, 'lr': 1.24280750604269e-05, 'lambda_val': 0.056531768367696356, 'batch_size': 808, 'optimizer': 'SGD'}.
2026-05-23 02:59:30,634 - experiment_functions - INFO - Early stopping at epoch 550. Best Metrics: (0.05818772978361265, 0.04155737704918033, 0.06255916678612582)
2026-05-23 02:59:30,734 - optuna.study.study - INFO - Trial 230 finished with values: [0.05818772978361265, 0.04155737704918033, 0.06255916678612582] and parameters: {'n_layers': 1, 'embedding_dim': 128, 'lr': 0.007526325741077799, 'lambda_val': 0.0001408586097439621, 'batch_size': 1651, 'optimizer': 'Adam'}.
2026-05-23 02:59:36,179 - experiment_functions - INFO - Early stopping at epoch 1050. Best Metrics: (0.05569158466475277, 0.03590163934426229, 0.051647835871469996)
2026-05-23 02:59:36,801 - optuna.study.study - INFO - Trial 231 finished with values: [0.05569158466475277, 0.03590163934426229, 0.051647835871469996] and parameters: {'n_layers': 2, 'embedding_dim': 128, 'lr': 0.0005134970540789423, 'lambda_val': 8.689122223949433e-06, 'batch_size': 2498, 'optimizer': 'Adam'}.
2026-05-23 02:59:40,117 - experiment_functions - INFO - Early stopping at epoch 750. Best Metrics: (0.02571074508834814, 0.017540983606557377, 0.025074645538001192)
2026-05-23 02:59:40,617 - optuna.study.study - INFO - Trial 232 finished with values: [0.02571074508834814, 0.017540983606557377, 0.025074645538001192] and parameters: {'n_layers': 1, 'embedding_dim': 128, 'lr': 0.026832159294620916, 'lambda_val': 2.262285689814337e-06, 'batch_size': 808, 'optimizer': 'Adam'}.
2026-05-23 02:59:56,016 - optuna.study.study - INFO - Trial 233 finished with values: [0.04076675532569648, 0.029016393442622957, 0.04136270144243356] and parameters: {'n_layers': 2, 'embedding_dim': 64, 'lr': 0.00016298601179134825, 'lambda_val': 8.689122223949433e-06, 'batch_size': 2498, 'optimizer': 'RMSprop'}.
2026-05-23 03:00:04,407 - experiment_functions - INFO - Early stopping at epoch 2550. Best Metrics: (0.07125174570796251, 0.04762295081967213, 0.06985594449505565)
2026-05-23 03:00:04,499 - optuna.study.study - INFO - Trial 234 finished with values: [0.07125174570796251, 0.04762295081967213, 0.06985594449505565] and parameters: {'n_layers': 1, 'embedding_dim': 64, 'lr': 0.00033929418945457667, 'lambda_val': 2.2233828874401383e-06, 'batch_size': 2773, 'optimizer': 'RMSprop'}.
2026-05-23 03:00:10,609 - experiment_functions - INFO - Early stopping at epoch 2050. Best Metrics: (0.06431709966905004, 0.04483606557377049, 0.0636342986903022)
2026-05-23 03:00:10,766 - optuna.study.study - INFO - Trial 235 finished with values: [0.06431709966905004, 0.04483606557377049, 0.0636342986903022] and parameters: {'n_layers': 1, 'embedding_dim': 32, 'lr': 0.0005134970540789423, 'lambda_val': 0.007024459859123817, 'batch_size': 1651, 'optimizer': 'Adam'}.
2026-05-23 03:00:15,655 - experiment_functions - INFO - Early stopping at epoch 1250. Best Metrics: (0.05670380946658438, 0.04237704918032787, 0.05965006766348655)
2026-05-23 03:00:16,032 - optuna.study.study - INFO - Trial 236 finished with values: [0.05670380946658438, 0.04237704918032787, 0.05965006766348655] and parameters: {'n_layers': 1, 'embedding_dim': 256, 'lr': 0.0005134970540789423, 'lambda_val': 0.004212470249457581, 'batch_size': 1414, 'optimizer': 'RMSprop'}.
2026-05-23 03:00:18,966 - experiment_functions - INFO - Early stopping at epoch 950. Best Metrics: (0.024634016663142227, 0.01614754098360656, 0.024821155207598665)
2026-05-23 03:00:19,962 - optuna.study.study - INFO - Trial 237 finished with values: [0.024634016663142227, 0.01614754098360656, 0.024821155207598665] and parameters: {'n_layers': 1, 'embedding_dim': 64, 'lr': 0.041001394399531335, 'lambda_val': 0.00010574161158144353, 'batch_size': 1091, 'optimizer': 'Adam'}.
2026-05-23 03:00:24,459 - experiment_functions - INFO - Early stopping at epoch 1450. Best Metrics: (0.06493454385068163, 0.04344262295081967, 0.06515429309416919)
2026-05-23 03:00:24,533 - optuna.study.study - INFO - Trial 238 finished with values: [0.06493454385068163, 0.04344262295081967, 0.06515429309416919] and parameters: {'n_layers': 1, 'embedding_dim': 64, 'lr': 0.0005134970540789423, 'lambda_val': 0.006439135351806826, 'batch_size': 2427, 'optimizer': 'Adam'}.
2026-05-23 03:00:28,751 - experiment_functions - INFO - Early stopping at epoch 1400. Best Metrics: (0.0492718480411881, 0.04008196721311475, 0.053227732478922915)
2026-05-23 03:00:29,286 - optuna.study.study - INFO - Trial 239 finished with values: [0.0492718480411881, 0.04008196721311475, 0.053227732478922915] and parameters: {'n_layers': 1, 'embedding_dim': 32, 'lr': 0.0005134970540789423, 'lambda_val': 0.0009810927157913494, 'batch_size': 2427, 'optimizer': 'Adam'}.
2026-05-23 03:00:32,522 - experiment_functions - INFO - Early stopping at epoch 550. Best Metrics: (0.02846083509536298, 0.015983606557377048, 0.023702381493908492)
2026-05-23 03:00:33,215 - optuna.study.study - INFO - Trial 240 finished with values: [0.02846083509536298, 0.015983606557377048, 0.023702381493908492] and parameters: {'n_layers': 3, 'embedding_dim': 128, 'lr': 0.006742154854441702, 'lambda_val': 8.60783053151504e-05, 'batch_size': 3771, 'optimizer': 'RMSprop'}.
2026-05-23 03:00:42,634 - experiment_functions - INFO - Early stopping at epoch 2350. Best Metrics: (0.06808266878946105, 0.047213114754098354, 0.06796863827948216)
