2026-05-23 00:27:32,066 - optuna.study.study - INFO - Trial 111 finished with values: [0.02981860140805802, 0.01557377049180328, 0.023230167432619506] and parameters: {'n_layers': 4, 'embedding_dim': 32, 'lr': 0.005832819514590744, 'lambda_val': 0.000258841521491552, 'batch_size': 623, 'optimizer': 'Adam'}.
2026-05-23 00:27:38,605 - experiment_functions - INFO - Early stopping at epoch 800. Best Metrics: (0.021801807137367193, 0.014262295081967212, 0.019858956297376433)
2026-05-23 00:27:38,768 - optuna.study.study - INFO - Trial 112 finished with values: [0.021801807137367193, 0.014262295081967212, 0.019858956297376433] and parameters: {'n_layers': 1, 'embedding_dim': 32, 'lr': 0.002551066135037047, 'lambda_val': 0.0003800855573649775, 'batch_size': 2450, 'optimizer': 'Adam'}.
2026-05-23 00:27:51,508 - experiment_functions - INFO - Early stopping at epoch 3450. Best Metrics: (0.005729085827507893, 0.0036885245901639345, 0.004784352895432044)
2026-05-23 00:27:51,600 - optuna.study.study - INFO - Trial 113 finished with values: [0.005729085827507893, 0.0036885245901639345, 0.004784352895432044] and parameters: {'n_layers': 1, 'embedding_dim': 96, 'lr': 7.522553242348437e-05, 'lambda_val': 5.790863900505623e-06, 'batch_size': 1980, 'optimizer': 'Adam'}.
2026-05-23 00:27:56,808 - experiment_functions - INFO - Early stopping at epoch 1050. Best Metrics: (0.024348011389168724, 0.015491803278688524, 0.022575488034234547)
2026-05-23 00:27:56,903 - optuna.study.study - INFO - Trial 114 finished with values: [0.024348011389168724, 0.015491803278688524, 0.022575488034234547] and parameters: {'n_layers': 3, 'embedding_dim': 64, 'lr': 0.0003844191318387395, 'lambda_val': 0.002538361115161492, 'batch_size': 3695, 'optimizer': 'Adam'}.
2026-05-23 00:27:59,772 - experiment_functions - INFO - Early stopping at epoch 600. Best Metrics: (0.016432441150936318, 0.010655737704918032, 0.013758221198943226)
2026-05-23 00:28:00,925 - optuna.study.study - INFO - Trial 115 finished with values: [0.016432441150936318, 0.010655737704918032, 0.013758221198943226] and parameters: {'n_layers': 1, 'embedding_dim': 64, 'lr': 0.01250859324335198, 'lambda_val': 0.000258841521491552, 'batch_size': 1566, 'optimizer': 'RMSprop'}.
2026-05-23 00:28:03,797 - experiment_functions - INFO - Early stopping at epoch 550. Best Metrics: (0.02057201468532411, 0.013114754098360656, 0.01957946456397201)
2026-05-23 00:28:03,939 - optuna.study.study - INFO - Trial 116 finished with values: [0.02057201468532411, 0.013114754098360656, 0.01957946456397201] and parameters: {'n_layers': 2, 'embedding_dim': 64, 'lr': 0.021553285767180342, 'lambda_val': 1.7207712053457044e-06, 'batch_size': 1280, 'optimizer': 'Adam'}.
2026-05-23 00:28:10,484 - experiment_functions - INFO - Early stopping at epoch 1350. Best Metrics: (0.030485826246256804, 0.01778688524590164, 0.02515738181286999)
2026-05-23 00:28:10,785 - optuna.study.study - INFO - Trial 117 finished with values: [0.030485826246256804, 0.01778688524590164, 0.02515738181286999] and parameters: {'n_layers': 2, 'embedding_dim': 256, 'lr': 0.00029826529867114525, 'lambda_val': 2.9099669967589168e-06, 'batch_size': 3695, 'optimizer': 'Adam'}.
2026-05-23 00:28:13,727 - experiment_functions - INFO - Early stopping at epoch 550. Best Metrics: (0.012539832776248571, 0.007950819672131149, 0.011020078035339716)
2026-05-23 00:28:13,809 - optuna.study.study - INFO - Trial 118 finished with values: [0.012539832776248571, 0.007950819672131149, 0.011020078035339716] and parameters: {'n_layers': 2, 'embedding_dim': 256, 'lr': 0.03069077245569986, 'lambda_val': 6.986110078025384e-06, 'batch_size': 1773, 'optimizer': 'RMSprop'}.
2026-05-23 00:28:29,100 - optuna.study.study - INFO - Trial 119 finished with values: [0.026479152403511057, 0.015491803278688524, 0.024183278451039323] and parameters: {'n_layers': 1, 'embedding_dim': 96, 'lr': 0.00022079369433681775, 'lambda_val': 6.986110078025384e-06, 'batch_size': 2197, 'optimizer': 'Adam'}.
2026-05-23 00:28:39,137 - experiment_functions - INFO - Early stopping at epoch 2600. Best Metrics: (0.01623912893639039, 0.011557377049180329, 0.01624969706713539)
2026-05-23 00:28:40,078 - optuna.study.study - INFO - Trial 120 finished with values: [0.01623912893639039, 0.011557377049180329, 0.01624969706713539] and parameters: {'n_layers': 1, 'embedding_dim': 96, 'lr': 0.06284452055867416, 'lambda_val': 0.0018676998356325317, 'batch_size': 1566, 'optimizer': 'Adam'}.
2026-05-23 00:28:49,229 - experiment_functions - INFO - Early stopping at epoch 750. Best Metrics: (0.030877750015339142, 0.019344262295081967, 0.026050847920489725)
2026-05-23 00:28:49,866 - optuna.study.study - INFO - Trial 121 finished with values: [0.030877750015339142, 0.019344262295081967, 0.026050847920489725] and parameters: {'n_layers': 3, 'embedding_dim': 64, 'lr': 0.0011286476195635738, 'lambda_val': 0.0021335803209076563, 'batch_size': 1861, 'optimizer': 'Adam'}.
2026-05-23 00:28:52,864 - experiment_functions - INFO - Early stopping at epoch 550. Best Metrics: (0.009122699401743085, 0.00778688524590164, 0.010604045237805323)
2026-05-23 00:28:52,958 - optuna.study.study - INFO - Trial 122 finished with values: [0.009122699401743085, 0.00778688524590164, 0.010604045237805323] and parameters: {'n_layers': 2, 'embedding_dim': 128, 'lr': 0.09022084681370063, 'lambda_val': 1.0895590255719957e-05, 'batch_size': 3533, 'optimizer': 'Adam'}.
2026-05-23 00:28:59,651 - experiment_functions - INFO - Early stopping at epoch 1500. Best Metrics: (0.008225204719532513, 0.007295081967213115, 0.009987836871599149)
2026-05-23 00:28:59,732 - optuna.study.study - INFO - Trial 123 finished with values: [0.008225204719532513, 0.007295081967213115, 0.009987836871599149] and parameters: {'n_layers': 3, 'embedding_dim': 32, 'lr': 0.03707024061293308, 'lambda_val': 7.591109531033929e-05, 'batch_size': 2834, 'optimizer': 'RMSprop'}.
2026-05-23 00:29:02,683 - experiment_functions - INFO - Early stopping at epoch 650. Best Metrics: (0.029779166335027238, 0.017377049180327873, 0.027062971246817485)
2026-05-23 00:29:02,779 - optuna.study.study - INFO - Trial 124 finished with values: [0.029779166335027238, 0.017377049180327873, 0.027062971246817485] and parameters: {'n_layers': 2, 'embedding_dim': 256, 'lr': 0.0007184162715631311, 'lambda_val': 0.00551038486085562, 'batch_size': 1457, 'optimizer': 'RMSprop'}.
2026-05-23 00:29:13,415 - optuna.study.study - INFO - Trial 125 finished with values: [0.03340458728143681, 0.01852459016393443, 0.030568728163684222] and parameters: {'n_layers': 2, 'embedding_dim': 64, 'lr': 0.0002242398424095658, 'lambda_val': 5.790863900505623e-06, 'batch_size': 1735, 'optimizer': 'Adam'}.
2026-05-23 00:29:17,901 - experiment_functions - INFO - Early stopping at epoch 1800. Best Metrics: (0.029273781131658422, 0.018114754098360657, 0.024453996711155092)
2026-05-23 00:29:18,733 - optuna.study.study - INFO - Trial 126 finished with values: [0.029273781131658422, 0.018114754098360657, 0.024453996711155092] and parameters: {'n_layers': 3, 'embedding_dim': 32, 'lr': 0.0003566717415961628, 'lambda_val': 0.006734268474296521, 'batch_size': 987, 'optimizer': 'Adam'}.
2026-05-23 00:29:21,004 - experiment_functions - INFO - Early stopping at epoch 550. Best Metrics: (0.021145324584163287, 0.015163934426229509, 0.023201745311465682)
2026-05-23 00:29:21,135 - optuna.study.study - INFO - Trial 127 finished with values: [0.021145324584163287, 0.015163934426229509, 0.023201745311465682] and parameters: {'n_layers': 1, 'embedding_dim': 256, 'lr': 0.006215487236112131, 'lambda_val': 0.002823733504284557, 'batch_size': 1921, 'optimizer': 'Adam'}.
2026-05-23 00:29:23,785 - experiment_functions - INFO - Early stopping at epoch 900. Best Metrics: (0.030145610032558605, 0.018688524590163937, 0.02674561516933451)
2026-05-23 00:29:23,867 - optuna.study.study - INFO - Trial 128 finished with values: [0.030145610032558605, 0.018688524590163937, 0.02674561516933451] and parameters: {'n_layers': 1, 'embedding_dim': 96, 'lr': 0.0014120698261668326, 'lambda_val': 0.0002603879699437796, 'batch_size': 2231, 'optimizer': 'Adam'}.
2026-05-23 00:29:25,880 - experiment_functions - INFO - Early stopping at epoch 500. Best Metrics: (0.004701071822358419, 0.0018852459016393442, 0.0031566046569669166)
2026-05-23 00:29:25,976 - optuna.study.study - INFO - Trial 129 finished with values: [0.004701071822358419, 0.0018852459016393442, 0.0031566046569669166] and parameters: {'n_layers': 2, 'embedding_dim': 128, 'lr': 0.00021190783377947846, 'lambda_val': 2.9099669967589168e-06, 'batch_size': 3649, 'optimizer': 'SGD'}.
2026-05-23 00:29:28,434 - experiment_functions - INFO - Early stopping at epoch 750. Best Metrics: (0.02712899612944334, 0.017131147540983608, 0.025217649446550607)
2026-05-23 00:29:28,521 - optuna.study.study - INFO - Trial 130 finished with values: [0.02712899612944334, 0.017131147540983608, 0.025217649446550607] and parameters: {'n_layers': 2, 'embedding_dim': 96, 'lr': 0.0007184162715631311, 'lambda_val': 0.001981990620864252, 'batch_size': 2007, 'optimizer': 'RMSprop'}.
2026-05-23 00:29:30,665 - experiment_functions - INFO - Early stopping at epoch 550. Best Metrics: (0.018227391298117512, 0.010655737704918034, 0.01483363348191762)
2026-05-23 00:29:30,740 - optuna.study.study - INFO - Trial 131 finished with values: [0.018227391298117512, 0.010655737704918034, 0.01483363348191762] and parameters: {'n_layers': 3, 'embedding_dim': 96, 'lr': 0.0029335455314602995, 'lambda_val': 0.0021335803209076563, 'batch_size': 1507, 'optimizer': 'RMSprop'}.
2026-05-23 00:29:35,798 - experiment_functions - INFO - Early stopping at epoch 500. Best Metrics: (0.0037722926474647134, 0.002131147540983607, 0.003009709200169941)
2026-05-23 00:29:36,758 - optuna.study.study - INFO - Trial 132 finished with values: [0.0037722926474647134, 0.002131147540983607, 0.003009709200169941] and parameters: {'n_layers': 3, 'embedding_dim': 64, 'lr': 2.974715269306701e-05, 'lambda_val': 8.819162328566226e-05, 'batch_size': 1833, 'optimizer': 'Adam'}.
2026-05-23 00:29:51,664 - optuna.study.study - INFO - Trial 133 finished with values: [0.03595875070084664, 0.019508196721311474, 0.02949681947161221] and parameters: {'n_layers': 2, 'embedding_dim': 96, 'lr': 0.0002242398424095658, 'lambda_val': 1.7207712053457044e-06, 'batch_size': 987, 'optimizer': 'Adam'}.
2026-05-23 00:29:54,634 - experiment_functions - INFO - Early stopping at epoch 1000. Best Metrics: (0.03389951517406115, 0.019508196721311478, 0.029499525791205114)
2026-05-23 00:29:56,058 - optuna.study.study - INFO - Trial 134 finished with values: [0.03389951517406115, 0.019508196721311478, 0.029499525791205114] and parameters: {'n_layers': 2, 'embedding_dim': 96, 'lr': 0.000568575874483035, 'lambda_val': 0.001981990620864252, 'batch_size': 1457, 'optimizer': 'RMSprop'}.
2026-05-23 00:29:58,768 - experiment_functions - INFO - Early stopping at epoch 600. Best Metrics: (0.029890062246546945, 0.017295081967213115, 0.02632815994792712)
2026-05-23 00:29:58,868 - optuna.study.study - INFO - Trial 135 finished with values: [0.029890062246546945, 0.017295081967213115, 0.02632815994792712] and parameters: {'n_layers': 2, 'embedding_dim': 256, 'lr': 0.0011286476195635738, 'lambda_val': 7.591109531033929e-05, 'batch_size': 1280, 'optimizer': 'RMSprop'}.
2026-05-23 00:30:10,820 - optuna.study.study - INFO - Trial 136 finished with values: [0.010183226548259079, 0.008114754098360656, 0.011336301614856409] and parameters: {'n_layers': 1, 'embedding_dim': 96, 'lr': 0.0001509563476447725, 'lambda_val': 4.416597544825473e-05, 'batch_size': 1235, 'optimizer': 'Adam'}.
2026-05-23 00:30:13,498 - experiment_functions - INFO - Early stopping at epoch 600. Best Metrics: (0.01681942405875302, 0.010901639344262295, 0.014912472728857004)
2026-05-23 00:30:13,586 - optuna.study.study - INFO - Trial 137 finished with values: [0.01681942405875302, 0.010901639344262295, 0.014912472728857004] and parameters: {'n_layers': 3, 'embedding_dim': 128, 'lr': 0.005375583079687442, 'lambda_val': 8.819162328566226e-05, 'batch_size': 2230, 'optimizer': 'RMSprop'}.
2026-05-23 00:30:16,733 - experiment_functions - INFO - Early stopping at epoch 850. Best Metrics: (0.02946030760598206, 0.018852459016393444, 0.02631293370403638)
2026-05-23 00:30:16,816 - optuna.study.study - INFO - Trial 138 finished with values: [0.02946030760598206, 0.018852459016393444, 0.02631293370403638] and parameters: {'n_layers': 2, 'embedding_dim': 96, 'lr': 0.0007184162715631311, 'lambda_val': 0.001981990620864252, 'batch_size': 984, 'optimizer': 'RMSprop'}.
2026-05-23 00:30:19,880 - experiment_functions - INFO - Early stopping at epoch 550. Best Metrics: (0.025666974714485067, 0.015163934426229509, 0.022630514048765007)
2026-05-23 00:30:20,546 - optuna.study.study - INFO - Trial 139 finished with values: [0.025666974714485067, 0.015163934426229509, 0.022630514048765007] and parameters: {'n_layers': 4, 'embedding_dim': 256, 'lr': 0.0007184162715631311, 'lambda_val': 0.001981990620864252, 'batch_size': 1280, 'optimizer': 'RMSprop'}.
2026-05-23 00:30:23,032 - experiment_functions - INFO - Early stopping at epoch 550. Best Metrics: (0.021806158821374974, 0.012459016393442622, 0.020145160152867738)
2026-05-23 00:30:23,207 - optuna.study.study - INFO - Trial 140 finished with values: [0.021806158821374974, 0.012459016393442622, 0.020145160152867738] and parameters: {'n_layers': 3, 'embedding_dim': 128, 'lr': 0.0029672352594358334, 'lambda_val': 6.986110078025384e-06, 'batch_size': 1763, 'optimizer': 'RMSprop'}.
2026-05-23 00:30:25,574 - experiment_functions - INFO - Early stopping at epoch 550. Best Metrics: (0.027056443512769094, 0.016639344262295082, 0.023685704645010033)
2026-05-23 00:30:25,675 - optuna.study.study - INFO - Trial 141 finished with values: [0.027056443512769094, 0.016639344262295082, 0.023685704645010033] and parameters: {'n_layers': 2, 'embedding_dim': 96, 'lr': 0.005832819514590744, 'lambda_val': 0.000258841521491552, 'batch_size': 2343, 'optimizer': 'Adam'}.
2026-05-23 00:30:28,094 - experiment_functions - INFO - Early stopping at epoch 550. Best Metrics: (0.02419744756446675, 0.015491803278688524, 0.02379768842512819)
2026-05-23 00:30:28,225 - optuna.study.study - INFO - Trial 142 finished with values: [0.02419744756446675, 0.015491803278688524, 0.02379768842512819] and parameters: {'n_layers': 3, 'embedding_dim': 64, 'lr': 0.005832819514590744, 'lambda_val': 0.004449782111627119, 'batch_size': 623, 'optimizer': 'Adam'}.
2026-05-23 00:30:39,751 - optuna.study.study - INFO - Trial 143 finished with values: [0.0097124066423509, 0.00598360655737705, 0.008847307101740715] and parameters: {'n_layers': 2, 'embedding_dim': 96, 'lr': 6.393891307921091e-05, 'lambda_val': 8.125328548048469e-05, 'batch_size': 2230, 'optimizer': 'RMSprop'}.
2026-05-23 00:30:46,188 - experiment_functions - INFO - Early stopping at epoch 1600. Best Metrics: (0.03345976630872511, 0.018114754098360657, 0.028379234926111822)
2026-05-23 00:30:46,863 - optuna.study.study - INFO - Trial 144 finished with values: [0.03345976630872511, 0.018114754098360657, 0.028379234926111822] and parameters: {'n_layers': 2, 'embedding_dim': 256, 'lr': 0.00029826529867114525, 'lambda_val': 2.9099669967589168e-06, 'batch_size': 3649, 'optimizer': 'Adam'}.
2026-05-23 00:30:49,778 - experiment_functions - INFO - Early stopping at epoch 600. Best Metrics: (0.03225656732819575, 0.017704918032786888, 0.029121167621388767)
2026-05-23 00:30:49,876 - optuna.study.study - INFO - Trial 145 finished with values: [0.03225656732819575, 0.017704918032786888, 0.029121167621388767] and parameters: {'n_layers': 2, 'embedding_dim': 256, 'lr': 0.0009422878098805214, 'lambda_val': 0.003265600459695188, 'batch_size': 3148, 'optimizer': 'RMSprop'}.
2026-05-23 00:30:52,158 - experiment_functions - INFO - Early stopping at epoch 550. Best Metrics: (0.020855259151810364, 0.011147540983606558, 0.01656729837169105)
2026-05-23 00:30:52,245 - optuna.study.study - INFO - Trial 146 finished with values: [0.020855259151810364, 0.011147540983606558, 0.01656729837169105] and parameters: {'n_layers': 2, 'embedding_dim': 32, 'lr': 0.005375583079687442, 'lambda_val': 8.819162328566226e-05, 'batch_size': 4007, 'optimizer': 'RMSprop'}.
2026-05-23 00:31:03,689 - optuna.study.study - INFO - Trial 147 finished with values: [0.011216170096610132, 0.00860655737704918, 0.010759361158784375] and parameters: {'n_layers': 2, 'embedding_dim': 96, 'lr': 0.00012367270854891647, 'lambda_val': 0.033428884361528834, 'batch_size': 1369, 'optimizer': 'RMSprop'}.
2026-05-23 00:31:08,048 - experiment_functions - INFO - Early stopping at epoch 1250. Best Metrics: (0.027970716438142966, 0.016393442622950824, 0.02477174243230231)
2026-05-23 00:31:08,353 - optuna.study.study - INFO - Trial 148 finished with values: [0.027970716438142966, 0.016393442622950824, 0.02477174243230231] and parameters: {'n_layers': 3, 'embedding_dim': 64, 'lr': 0.0003566717415961628, 'lambda_val': 0.0030204840190239295, 'batch_size': 1369, 'optimizer': 'Adam'}.
2026-05-23 00:31:10,676 - experiment_functions - INFO - Early stopping at epoch 500. Best Metrics: (0.0015227237116426616, 0.001967213114754099, 0.002093009228436858)
2026-05-23 00:31:10,776 - optuna.study.study - INFO - Trial 149 finished with values: [0.0015227237116426616, 0.001967213114754099, 0.002093009228436858] and parameters: {'n_layers': 2, 'embedding_dim': 256, 'lr': 0.00029826529867114525, 'lambda_val': 2.9099669967589168e-06, 'batch_size': 1861, 'optimizer': 'SGD'}.
2026-05-23 00:31:13,639 - experiment_functions - INFO - Early stopping at epoch 750. Best Metrics: (0.038467168274394635, 0.019098360655737705, 0.03023024468475306)
2026-05-23 00:31:13,728 - optuna.study.study - INFO - Trial 150 finished with values: [0.038467168274394635, 0.019098360655737705, 0.03023024468475306] and parameters: {'n_layers': 1, 'embedding_dim': 64, 'lr': 0.0029672352594358334, 'lambda_val': 0.00011624026828970741, 'batch_size': 1369, 'optimizer': 'Adam'}.
2026-05-23 00:31:25,833 - optuna.study.study - INFO - Trial 151 finished with values: [0.027016415840978646, 0.013360655737704919, 0.021773001176321555] and parameters: {'n_layers': 2, 'embedding_dim': 32, 'lr': 0.00022079369433681775, 'lambda_val': 7.591109531033929e-05, 'batch_size': 2834, 'optimizer': 'RMSprop'}.
2026-05-23 00:31:27,981 - experiment_functions - INFO - Early stopping at epoch 500. Best Metrics: (0.001095967018612822, 0.0013114754098360656, 0.0012843180166739658)
2026-05-23 00:31:28,065 - optuna.study.study - INFO - Trial 152 finished with values: [0.001095967018612822, 0.0013114754098360656, 0.0012843180166739658] and parameters: {'n_layers': 1, 'embedding_dim': 32, 'lr': 0.00029826529867114525, 'lambda_val': 2.9099669967589168e-06, 'batch_size': 2802, 'optimizer': 'SGD'}.
2026-05-23 00:31:37,553 - experiment_functions - INFO - Early stopping at epoch 3000. Best Metrics: (0.033767549689300035, 0.017704918032786888, 0.02700853224247453)
2026-05-23 00:31:38,570 - optuna.study.study - INFO - Trial 153 finished with values: [0.033767549689300035, 0.017704918032786888, 0.02700853224247453] and parameters: {'n_layers': 1, 'embedding_dim': 256, 'lr': 0.00029826529867114525, 'lambda_val': 2.9099669967589168e-06, 'batch_size': 1369, 'optimizer': 'Adam'}.
2026-05-23 00:31:41,397 - experiment_functions - INFO - Early stopping at epoch 600. Best Metrics: (0.0316561733551553, 0.018032786885245903, 0.025846606525658088)
2026-05-23 00:31:41,489 - optuna.study.study - INFO - Trial 154 finished with values: [0.0316561733551553, 0.018032786885245903, 0.025846606525658088] and parameters: {'n_layers': 2, 'embedding_dim': 256, 'lr': 0.0011286476195635738, 'lambda_val': 2.9099669967589168e-06, 'batch_size': 1280, 'optimizer': 'RMSprop'}.
2026-05-23 00:31:43,937 - experiment_functions - INFO - Early stopping at epoch 550. Best Metrics: (0.03210564954766495, 0.018032786885245903, 0.02731361956602518)
2026-05-23 00:31:44,024 - optuna.study.study - INFO - Trial 155 finished with values: [0.03210564954766495, 0.018032786885245903, 0.02731361956602518] and parameters: {'n_layers': 3, 'embedding_dim': 128, 'lr': 0.0011286476195635738, 'lambda_val': 0.0010220113588320242, 'batch_size': 1280, 'optimizer': 'RMSprop'}.
2026-05-23 00:31:55,685 - optuna.study.study - INFO - Trial 156 finished with values: [0.020814018760083146, 0.013852459016393445, 0.01887591084936677] and parameters: {'n_layers': 1, 'embedding_dim': 64, 'lr': 0.00022079369433681775, 'lambda_val': 5.790863900505623e-06, 'batch_size': 2834, 'optimizer': 'RMSprop'}.
2026-05-23 00:31:58,377 - experiment_functions - INFO - Early stopping at epoch 500. Best Metrics: (0.0024023530456103712, 0.0018032786885245904, 0.0028022215266278)
2026-05-23 00:31:58,474 - optuna.study.study - INFO - Trial 157 finished with values: [0.0024023530456103712, 0.0018032786885245904, 0.0028022215266278] and parameters: {'n_layers': 3, 'embedding_dim': 256, 'lr': 0.0009422878098805214, 'lambda_val': 0.0021335803209076563, 'batch_size': 3107, 'optimizer': 'SGD'}.
2026-05-23 00:32:05,431 - experiment_functions - INFO - Early stopping at epoch 1850. Best Metrics: (0.03385221867877313, 0.018360655737704918, 0.026203327530712736)
2026-05-23 00:32:06,032 - optuna.study.study - INFO - Trial 158 finished with values: [0.03385221867877313, 0.018360655737704918, 0.026203327530712736] and parameters: {'n_layers': 2, 'embedding_dim': 256, 'lr': 0.00029826529867114525, 'lambda_val': 2.9099669967589168e-06, 'batch_size': 1735, 'optimizer': 'Adam'}.
2026-05-23 00:32:13,545 - experiment_functions - INFO - Early stopping at epoch 2350. Best Metrics: (0.0295486197221393, 0.019590163934426228, 0.027717826735823663)
