2026-05-23 04:41:41,009 - optuna.study.study - INFO - Trial 241 finished with values: [0.09362506426619945, 0.04975409836065574, 0.08031379111838377] and parameters: {'n_layers': 1, 'embedding_dim': 64, 'lr': 0.0006640426930867159, 'lambda_val': 0.006639299505918974, 'batch_size': 2002, 'optimizer': 'RMSprop'}.
2026-05-23 04:41:43,629 - experiment_functions - INFO - Early stopping at epoch 600. Best Metrics: (0.04966680170192087, 0.029098360655737704, 0.04484362977493368)
2026-05-23 04:41:43,755 - optuna.study.study - INFO - Trial 242 finished with values: [0.04966680170192087, 0.029098360655737704, 0.04484362977493368] and parameters: {'n_layers': 2, 'embedding_dim': 64, 'lr': 0.0033458070209590996, 'lambda_val': 0.0004769034760402413, 'batch_size': 3269, 'optimizer': 'Adam'}.
2026-05-23 04:41:49,964 - experiment_functions - INFO - Early stopping at epoch 1250. Best Metrics: (0.08336380898342959, 0.04180327868852459, 0.06944097635221806)
2026-05-23 04:41:50,219 - optuna.study.study - INFO - Trial 243 finished with values: [0.08336380898342959, 0.04180327868852459, 0.06944097635221806] and parameters: {'n_layers': 2, 'embedding_dim': 256, 'lr': 0.0005076161055190746, 'lambda_val': 1.3792344289538332e-06, 'batch_size': 1477, 'optimizer': 'Adam'}.
2026-05-23 04:41:58,466 - experiment_functions - INFO - Early stopping at epoch 1550. Best Metrics: (0.049720781050047284, 0.027049180327868853, 0.04482598461298185)
2026-05-23 04:41:58,556 - optuna.study.study - INFO - Trial 244 finished with values: [0.049720781050047284, 0.027049180327868853, 0.04482598461298185] and parameters: {'n_layers': 4, 'embedding_dim': 128, 'lr': 0.0002758788994373932, 'lambda_val': 5.716195116201499e-06, 'batch_size': 1720, 'optimizer': 'RMSprop'}.
2026-05-23 04:42:13,311 - optuna.study.study - INFO - Trial 245 finished with values: [0.08252244959318943, 0.040983606557377046, 0.0663702612577759] and parameters: {'n_layers': 2, 'embedding_dim': 64, 'lr': 0.0002758788994373932, 'lambda_val': 0.00010447269915261112, 'batch_size': 1427, 'optimizer': 'Adam'}.
2026-05-23 04:42:26,553 - optuna.study.study - INFO - Trial 246 finished with values: [0.10902509192260698, 0.055901639344262295, 0.09324866134649981] and parameters: {'n_layers': 1, 'embedding_dim': 128, 'lr': 0.0003054746060910338, 'lambda_val': 0.002225291349266682, 'batch_size': 1254, 'optimizer': 'RMSprop'}.
2026-05-23 04:42:29,213 - experiment_functions - INFO - Early stopping at epoch 500. Best Metrics: (0.0015653726638831487, 0.0020491803278688526, 0.0024894311593602427)
2026-05-23 04:42:29,297 - optuna.study.study - INFO - Trial 247 finished with values: [0.0015653726638831487, 0.0020491803278688526, 0.0024894311593602427] and parameters: {'n_layers': 1, 'embedding_dim': 256, 'lr': 4.159185309568091e-05, 'lambda_val': 1.8513831213284574e-05, 'batch_size': 2240, 'optimizer': 'SGD'}.
2026-05-23 04:42:38,620 - experiment_functions - INFO - Early stopping at epoch 2400. Best Metrics: (0.06813034171747583, 0.039098360655737706, 0.05906608761231704)
2026-05-23 04:42:38,694 - optuna.study.study - INFO - Trial 248 finished with values: [0.06813034171747583, 0.039098360655737706, 0.05906608761231704] and parameters: {'n_layers': 3, 'embedding_dim': 64, 'lr': 0.0003054746060910338, 'lambda_val': 0.00044044195678744806, 'batch_size': 944, 'optimizer': 'RMSprop'}.
2026-05-23 04:42:57,414 - optuna.study.study - INFO - Trial 249 finished with values: [0.061996253800054316, 0.03713114754098361, 0.0566156937909641] and parameters: {'n_layers': 2, 'embedding_dim': 256, 'lr': 0.00011746916425690735, 'lambda_val': 1.4811025229652691e-05, 'batch_size': 827, 'optimizer': 'Adam'}.
2026-05-23 04:43:00,278 - experiment_functions - INFO - Early stopping at epoch 600. Best Metrics: (0.05457728993075487, 0.0330327868852459, 0.05120642893770115)
2026-05-23 04:43:00,943 - optuna.study.study - INFO - Trial 250 finished with values: [0.05457728993075487, 0.0330327868852459, 0.05120642893770115] and parameters: {'n_layers': 1, 'embedding_dim': 128, 'lr': 0.002554787797213266, 'lambda_val': 0.006639299505918974, 'batch_size': 1505, 'optimizer': 'RMSprop'}.
2026-05-23 04:43:11,823 - experiment_functions - INFO - Early stopping at epoch 1450. Best Metrics: (0.1077426809208616, 0.051557377049180335, 0.08565530130412281)
2026-05-23 04:43:12,218 - optuna.study.study - INFO - Trial 251 finished with values: [0.1077426809208616, 0.051557377049180335, 0.08565530130412281] and parameters: {'n_layers': 1, 'embedding_dim': 64, 'lr': 0.0006640426930867159, 'lambda_val': 0.00010447269915261112, 'batch_size': 3040, 'optimizer': 'Adam'}.
2026-05-23 04:43:27,690 - optuna.study.study - INFO - Trial 252 finished with values: [0.09139528724954166, 0.04827868852459016, 0.07916555587529535] and parameters: {'n_layers': 1, 'embedding_dim': 64, 'lr': 0.0002758788994373932, 'lambda_val': 6.087322477774668e-05, 'batch_size': 1505, 'optimizer': 'RMSprop'}.
2026-05-23 04:43:32,643 - experiment_functions - INFO - Early stopping at epoch 1400. Best Metrics: (0.09625354741025247, 0.052213114754098365, 0.08220940790886755)
2026-05-23 04:43:32,718 - optuna.study.study - INFO - Trial 253 finished with values: [0.09625354741025247, 0.052213114754098365, 0.08220940790886755] and parameters: {'n_layers': 1, 'embedding_dim': 64, 'lr': 0.0006640426930867159, 'lambda_val': 0.00010447269915261112, 'batch_size': 1505, 'optimizer': 'RMSprop'}.
2026-05-23 04:43:34,906 - experiment_functions - INFO - Early stopping at epoch 500. Best Metrics: (0.0010459692840802317, 0.0012295081967213116, 0.0013164689086841883)
2026-05-23 04:43:35,031 - optuna.study.study - INFO - Trial 254 finished with values: [0.0010459692840802317, 0.0012295081967213116, 0.0013164689086841883] and parameters: {'n_layers': 1, 'embedding_dim': 64, 'lr': 0.00466856942146688, 'lambda_val': 0.0004769034760402413, 'batch_size': 1659, 'optimizer': 'SGD'}.
2026-05-23 04:43:49,155 - optuna.study.study - INFO - Trial 255 finished with values: [0.09657214952565128, 0.0501639344262295, 0.08434546057514292] and parameters: {'n_layers': 1, 'embedding_dim': 128, 'lr': 0.0003054746060910338, 'lambda_val': 1.7275127487421405e-06, 'batch_size': 601, 'optimizer': 'Adam'}.
2026-05-23 04:43:51,876 - experiment_functions - INFO - Early stopping at epoch 600. Best Metrics: (0.04662259912716791, 0.0239344262295082, 0.03630696497967459)
2026-05-23 04:43:52,319 - optuna.study.study - INFO - Trial 256 finished with values: [0.04662259912716791, 0.0239344262295082, 0.03630696497967459] and parameters: {'n_layers': 1, 'embedding_dim': 64, 'lr': 0.008779305126116667, 'lambda_val': 0.00062453091272787, 'batch_size': 3135, 'optimizer': 'RMSprop'}.
2026-05-23 04:43:57,792 - experiment_functions - INFO - Early stopping at epoch 950. Best Metrics: (0.04572152533707851, 0.02418032786885246, 0.04331863700031635)
2026-05-23 04:43:58,021 - optuna.study.study - INFO - Trial 257 finished with values: [0.04572152533707851, 0.02418032786885246, 0.04331863700031635] and parameters: {'n_layers': 4, 'embedding_dim': 64, 'lr': 0.0005076161055190746, 'lambda_val': 1.5250659263577613e-05, 'batch_size': 3135, 'optimizer': 'RMSprop'}.
2026-05-23 04:44:00,326 - experiment_functions - INFO - Early stopping at epoch 500. Best Metrics: (0.001067877846568124, 0.0012295081967213116, 0.001757265276642739)
2026-05-23 04:44:00,415 - optuna.study.study - INFO - Trial 258 finished with values: [0.001067877846568124, 0.0012295081967213116, 0.001757265276642739] and parameters: {'n_layers': 1, 'embedding_dim': 64, 'lr': 0.0002758788994373932, 'lambda_val': 0.0004769034760402413, 'batch_size': 1477, 'optimizer': 'SGD'}.
2026-05-23 04:44:04,203 - experiment_functions - INFO - Early stopping at epoch 1000. Best Metrics: (0.10389312486703839, 0.05073770491803278, 0.08760615904487568)
2026-05-23 04:44:04,389 - optuna.study.study - INFO - Trial 259 finished with values: [0.10389312486703839, 0.05073770491803278, 0.08760615904487568] and parameters: {'n_layers': 1, 'embedding_dim': 64, 'lr': 0.0012715072595827332, 'lambda_val': 0.00062453091272787, 'batch_size': 2240, 'optimizer': 'Adam'}.
2026-05-23 04:44:16,931 - optuna.study.study - INFO - Trial 260 finished with values: [0.02569746824574887, 0.01573770491803279, 0.025561177056743392] and parameters: {'n_layers': 1, 'embedding_dim': 64, 'lr': 8.38509108449789e-05, 'lambda_val': 0.00044044195678744806, 'batch_size': 3135, 'optimizer': 'Adam'}.
2026-05-23 04:44:23,576 - experiment_functions - INFO - Early stopping at epoch 1650. Best Metrics: (0.0030918353886383127, 0.001967213114754099, 0.002677970882373647)
2026-05-23 04:44:24,613 - optuna.study.study - INFO - Trial 261 finished with values: [0.0030918353886383127, 0.001967213114754099, 0.002677970882373647] and parameters: {'n_layers': 1, 'embedding_dim': 256, 'lr': 3.169432286824276e-05, 'lambda_val': 0.001092384612961102, 'batch_size': 1505, 'optimizer': 'Adam'}.
2026-05-23 04:44:26,825 - experiment_functions - INFO - Early stopping at epoch 500. Best Metrics: (0.0008296961063798883, 0.001639344262295082, 0.001882869595167605)
2026-05-23 04:44:26,908 - optuna.study.study - INFO - Trial 262 finished with values: [0.0008296961063798883, 0.001639344262295082, 0.001882869595167605] and parameters: {'n_layers': 1, 'embedding_dim': 32, 'lr': 0.0012715072595827332, 'lambda_val': 0.00062453091272787, 'batch_size': 2240, 'optimizer': 'SGD'}.
2026-05-23 04:44:30,866 - experiment_functions - INFO - Early stopping at epoch 1050. Best Metrics: (0.07506362943683477, 0.04663934426229509, 0.0719671145158861)
2026-05-23 04:44:30,945 - optuna.study.study - INFO - Trial 263 finished with values: [0.07506362943683477, 0.04663934426229509, 0.0719671145158861] and parameters: {'n_layers': 1, 'embedding_dim': 64, 'lr': 0.0006640426930867159, 'lambda_val': 7.550133611899926e-06, 'batch_size': 3135, 'optimizer': 'RMSprop'}.
2026-05-23 04:44:51,034 - optuna.study.study - INFO - Trial 264 finished with values: [0.03176082798967274, 0.02, 0.028674054336969707] and parameters: {'n_layers': 4, 'embedding_dim': 64, 'lr': 0.00015009122104833628, 'lambda_val': 0.006639299505918974, 'batch_size': 2002, 'optimizer': 'RMSprop'}.
2026-05-23 04:44:56,378 - experiment_functions - INFO - Early stopping at epoch 1000. Best Metrics: (0.05746216133525677, 0.03262295081967213, 0.05236986123452746)
2026-05-23 04:44:56,532 - optuna.study.study - INFO - Trial 265 finished with values: [0.05746216133525677, 0.03262295081967213, 0.05236986123452746] and parameters: {'n_layers': 2, 'embedding_dim': 256, 'lr': 0.0003054746060910338, 'lambda_val': 0.006639299505918974, 'batch_size': 2240, 'optimizer': 'Adam'}.
2026-05-23 04:45:00,889 - experiment_functions - INFO - Early stopping at epoch 600. Best Metrics: (0.03177851668425945, 0.020245901639344262, 0.027967661625832068)
2026-05-23 04:45:02,255 - optuna.study.study - INFO - Trial 266 finished with values: [0.03177851668425945, 0.020245901639344262, 0.027967661625832068] and parameters: {'n_layers': 4, 'embedding_dim': 256, 'lr': 0.0006640426930867159, 'lambda_val': 0.001092384612961102, 'batch_size': 2002, 'optimizer': 'RMSprop'}.
2026-05-23 04:45:11,892 - experiment_functions - INFO - Early stopping at epoch 3450. Best Metrics: (0.09017569678442143, 0.047459016393442625, 0.07625219688873697)
2026-05-23 04:45:12,418 - optuna.study.study - INFO - Trial 267 finished with values: [0.09017569678442143, 0.047459016393442625, 0.07625219688873697] and parameters: {'n_layers': 1, 'embedding_dim': 64, 'lr': 0.0002758788994373932, 'lambda_val': 0.001092384612961102, 'batch_size': 3601, 'optimizer': 'RMSprop'}.
2026-05-23 04:45:18,252 - experiment_functions - INFO - Early stopping at epoch 1650. Best Metrics: (0.087365172827238, 0.047786885245901634, 0.07506550837419389)
2026-05-23 04:45:18,389 - optuna.study.study - INFO - Trial 268 finished with values: [0.087365172827238, 0.047786885245901634, 0.07506550837419389] and parameters: {'n_layers': 1, 'embedding_dim': 64, 'lr': 0.0006640426930867159, 'lambda_val': 0.00062453091272787, 'batch_size': 2183, 'optimizer': 'Adam'}.
2026-05-23 04:45:29,915 - optuna.study.study - INFO - Trial 269 finished with values: [0.0894320296108577, 0.045163934426229506, 0.07736011431925185] and parameters: {'n_layers': 1, 'embedding_dim': 64, 'lr': 0.0002433821756193056, 'lambda_val': 0.00062453091272787, 'batch_size': 1828, 'optimizer': 'Adam'}.
2026-05-23 04:45:34,383 - experiment_functions - INFO - Early stopping at epoch 1100. Best Metrics: (0.10910498006631547, 0.05204918032786885, 0.08489877179970454)
2026-05-23 04:45:34,474 - optuna.study.study - INFO - Trial 270 finished with values: [0.10910498006631547, 0.05204918032786885, 0.08489877179970454] and parameters: {'n_layers': 1, 'embedding_dim': 256, 'lr': 0.0012715072595827332, 'lambda_val': 2.7363643565033925e-05, 'batch_size': 601, 'optimizer': 'Adam'}.
2026-05-23 04:45:45,673 - experiment_functions - INFO - Early stopping at epoch 3050. Best Metrics: (0.08185699159390301, 0.04614754098360656, 0.07472008702225885)
2026-05-23 04:45:46,416 - optuna.study.study - INFO - Trial 271 finished with values: [0.08185699159390301, 0.04614754098360656, 0.07472008702225885] and parameters: {'n_layers': 1, 'embedding_dim': 32, 'lr': 0.0005076161055190746, 'lambda_val': 0.00044044195678744806, 'batch_size': 2183, 'optimizer': 'Adam'}.
2026-05-23 04:45:56,956 - experiment_functions - INFO - Early stopping at epoch 1450. Best Metrics: (0.07941442139368739, 0.04122950819672131, 0.06746722043770853)
2026-05-23 04:45:57,369 - optuna.study.study - INFO - Trial 272 finished with values: [0.07941442139368739, 0.04122950819672131, 0.06746722043770853] and parameters: {'n_layers': 2, 'embedding_dim': 128, 'lr': 0.00039831203487280473, 'lambda_val': 0.002225291349266682, 'batch_size': 849, 'optimizer': 'RMSprop'}.
2026-05-23 04:46:01,857 - experiment_functions - INFO - Early stopping at epoch 1450. Best Metrics: (0.057187489125863064, 0.03483606557377049, 0.05262650921938967)
2026-05-23 04:46:02,639 - optuna.study.study - INFO - Trial 273 finished with values: [0.057187489125863064, 0.03483606557377049, 0.05262650921938967] and parameters: {'n_layers': 2, 'embedding_dim': 32, 'lr': 0.0005076161055190746, 'lambda_val': 1.3792344289538332e-06, 'batch_size': 2183, 'optimizer': 'RMSprop'}.
2026-05-23 04:46:05,577 - experiment_functions - INFO - Early stopping at epoch 750. Best Metrics: (0.0022755842239363332, 0.002377049180327869, 0.002871059926473688)
2026-05-23 04:46:05,665 - optuna.study.study - INFO - Trial 274 finished with values: [0.0022755842239363332, 0.002377049180327869, 0.002871059926473688] and parameters: {'n_layers': 1, 'embedding_dim': 64, 'lr': 4.000719191886286e-05, 'lambda_val': 0.00062453091272787, 'batch_size': 1505, 'optimizer': 'Adam'}.
2026-05-23 04:46:08,174 - experiment_functions - INFO - Early stopping at epoch 500. Best Metrics: (0.0020136070718003436, 0.002295081967213115, 0.002434072769893817)
2026-05-23 04:46:08,266 - optuna.study.study - INFO - Trial 275 finished with values: [0.0020136070718003436, 0.002295081967213115, 0.002434072769893817] and parameters: {'n_layers': 2, 'embedding_dim': 32, 'lr': 0.0005076161055190746, 'lambda_val': 1.3792344289538332e-06, 'batch_size': 3135, 'optimizer': 'SGD'}.
2026-05-23 04:46:10,933 - experiment_functions - INFO - Early stopping at epoch 600. Best Metrics: (0.09895443537396693, 0.04885245901639344, 0.08042013027082015)
2026-05-23 04:46:11,033 - optuna.study.study - INFO - Trial 276 finished with values: [0.09895443537396693, 0.04885245901639344, 0.08042013027082015] and parameters: {'n_layers': 1, 'embedding_dim': 64, 'lr': 0.00466856942146688, 'lambda_val': 0.0004769034760402413, 'batch_size': 3135, 'optimizer': 'Adam'}.
2026-05-23 04:46:16,366 - experiment_functions - INFO - Early stopping at epoch 850. Best Metrics: (0.049063544552481235, 0.0269672131147541, 0.04239867646561676)
2026-05-23 04:46:16,462 - optuna.study.study - INFO - Trial 277 finished with values: [0.049063544552481235, 0.0269672131147541, 0.04239867646561676] and parameters: {'n_layers': 3, 'embedding_dim': 256, 'lr': 0.0003054746060910338, 'lambda_val': 0.002225291349266682, 'batch_size': 2002, 'optimizer': 'RMSprop'}.
2026-05-23 04:46:29,890 - experiment_functions - INFO - Early stopping at epoch 3750. Best Metrics: (0.11433179316066747, 0.0569672131147541, 0.09544314239238229)
2026-05-23 04:46:30,010 - optuna.study.study - INFO - Trial 278 finished with values: [0.11433179316066747, 0.0569672131147541, 0.09544314239238229] and parameters: {'n_layers': 1, 'embedding_dim': 256, 'lr': 0.0002758788994373932, 'lambda_val': 0.001092384612961102, 'batch_size': 1505, 'optimizer': 'RMSprop'}.
2026-05-23 04:46:33,658 - experiment_functions - INFO - Early stopping at epoch 1000. Best Metrics: (0.08279064839945312, 0.04409836065573771, 0.06950485012040337)
2026-05-23 04:46:34,955 - optuna.study.study - INFO - Trial 279 finished with values: [0.08279064839945312, 0.04409836065573771, 0.06950485012040337] and parameters: {'n_layers': 1, 'embedding_dim': 96, 'lr': 0.0006640426930867159, 'lambda_val': 0.0002794201622830738, 'batch_size': 3576, 'optimizer': 'RMSprop'}.
2026-05-23 04:46:47,634 - optuna.study.study - INFO - Trial 280 finished with values: [0.0716287352778875, 0.04311475409836065, 0.0650504776628794] and parameters: {'n_layers': 1, 'embedding_dim': 64, 'lr': 0.0002433821756193056, 'lambda_val': 0.0002794201622830738, 'batch_size': 1477, 'optimizer': 'Adam'}.
2026-05-23 04:47:00,521 - experiment_functions - INFO - Early stopping at epoch 2000. Best Metrics: (0.10838510259240204, 0.05434426229508196, 0.09350160796597418)
2026-05-23 04:47:00,605 - optuna.study.study - INFO - Trial 281 finished with values: [0.10838510259240204, 0.05434426229508196, 0.09350160796597418] and parameters: {'n_layers': 1, 'embedding_dim': 128, 'lr': 0.0003054746060910338, 'lambda_val': 0.002225291349266682, 'batch_size': 3576, 'optimizer': 'RMSprop'}.
2026-05-23 04:47:07,035 - experiment_functions - INFO - Early stopping at epoch 1750. Best Metrics: (0.07811781324317708, 0.04221311475409836, 0.07158092596944397)
2026-05-23 04:47:07,118 - optuna.study.study - INFO - Trial 282 finished with values: [0.07811781324317708, 0.04221311475409836, 0.07158092596944397] and parameters: {'n_layers': 2, 'embedding_dim': 64, 'lr': 0.0005076161055190746, 'lambda_val': 1.5250659263577613e-05, 'batch_size': 1477, 'optimizer': 'Adam'}.
2026-05-23 04:47:12,507 - experiment_functions - INFO - Early stopping at epoch 1000. Best Metrics: (0.08716059413430162, 0.04286885245901639, 0.07148975711475092)
2026-05-23 04:47:13,041 - optuna.study.study - INFO - Trial 283 finished with values: [0.08716059413430162, 0.04286885245901639, 0.07148975711475092] and parameters: {'n_layers': 2, 'embedding_dim': 256, 'lr': 0.0005076161055190746, 'lambda_val': 1.3792344289538332e-06, 'batch_size': 2002, 'optimizer': 'Adam'}.
2026-05-23 04:47:25,235 - optuna.study.study - INFO - Trial 284 finished with values: [0.08970915488455082, 0.04434426229508196, 0.07230669862142934] and parameters: {'n_layers': 1, 'embedding_dim': 64, 'lr': 0.00021023628201933924, 'lambda_val': 0.006639299505918974, 'batch_size': 1505, 'optimizer': 'RMSprop'}.
2026-05-23 04:47:27,547 - experiment_functions - INFO - Early stopping at epoch 500. Best Metrics: (0.001281982506695581, 0.001639344262295082, 0.0019654070882631903)
2026-05-23 04:47:27,637 - optuna.study.study - INFO - Trial 285 finished with values: [0.001281982506695581, 0.001639344262295082, 0.0019654070882631903] and parameters: {'n_layers': 1, 'embedding_dim': 64, 'lr': 3.309019010166129e-05, 'lambda_val': 0.018452296499432322, 'batch_size': 3576, 'optimizer': 'Adam'}.
2026-05-23 04:47:30,828 - experiment_functions - INFO - Early stopping at epoch 600. Best Metrics: (0.06526082237776834, 0.030819672131147544, 0.04866082452800176)
2026-05-23 04:47:30,911 - optuna.study.study - INFO - Trial 286 finished with values: [0.06526082237776834, 0.030819672131147544, 0.04866082452800176] and parameters: {'n_layers': 1, 'embedding_dim': 256, 'lr': 0.00466856942146688, 'lambda_val': 0.00062453091272787, 'batch_size': 3135, 'optimizer': 'RMSprop'}.
2026-05-23 04:47:34,804 - experiment_functions - INFO - Early stopping at epoch 800. Best Metrics: (0.09125440311934166, 0.04549180327868853, 0.08081715262872435)
2026-05-23 04:47:35,630 - optuna.study.study - INFO - Trial 287 finished with values: [0.09125440311934166, 0.04549180327868853, 0.08081715262872435] and parameters: {'n_layers': 1, 'embedding_dim': 256, 'lr': 0.0013819282781088852, 'lambda_val': 8.780584753439128e-06, 'batch_size': 1118, 'optimizer': 'Adam'}.
2026-05-23 04:47:45,866 - experiment_functions - INFO - Early stopping at epoch 2900. Best Metrics: (0.08441407782913696, 0.04344262295081967, 0.07192200556080658)
2026-05-23 04:47:46,495 - optuna.study.study - INFO - Trial 288 finished with values: [0.08441407782913696, 0.04344262295081967, 0.07192200556080658] and parameters: {'n_layers': 2, 'embedding_dim': 64, 'lr': 0.0002758788994373932, 'lambda_val': 5.539118393629575e-06, 'batch_size': 1505, 'optimizer': 'RMSprop'}.
2026-05-23 04:47:52,193 - experiment_functions - INFO - Early stopping at epoch 1700. Best Metrics: (0.043908866985805685, 0.025081967213114755, 0.040600191488808654)
2026-05-23 04:47:52,274 - optuna.study.study - INFO - Trial 289 finished with values: [0.043908866985805685, 0.025081967213114755, 0.040600191488808654] and parameters: {'n_layers': 1, 'embedding_dim': 64, 'lr': 0.00466856942146688, 'lambda_val': 0.006639299505918974, 'batch_size': 846, 'optimizer': 'RMSprop'}.
