2026-05-23 06:05:33,232 - optuna.study.study - INFO - Trial 105 finished with values: [0.011496712091441728, 0.013114754098360656, 0.018721356471150002] and parameters: {'n_layers': 1, 'embedding_dim': 32, 'lr': 0.0009699915116782758, 'lambda_val': 1.2684111432161195e-05, 'batch_size': 3670, 'optimizer': 'Adam'}.
2026-05-23 06:05:35,540 - experiment_functions - INFO - Early stopping at epoch 550. Best Metrics: (0.006377721008566911, 0.008852459016393444, 0.008900487104164677)
2026-05-23 06:05:35,625 - optuna.study.study - INFO - Trial 106 finished with values: [0.006377721008566911, 0.008852459016393444, 0.008900487104164677] and parameters: {'n_layers': 1, 'embedding_dim': 32, 'lr': 0.014958588920169108, 'lambda_val': 0.00034042279429205883, 'batch_size': 2282, 'optimizer': 'Adam'}.
2026-05-23 06:05:38,203 - experiment_functions - INFO - Early stopping at epoch 550. Best Metrics: (0.0021090538623228755, 0.0013934426229508198, 0.001721866478335586)
2026-05-23 06:05:38,340 - optuna.study.study - INFO - Trial 107 finished with values: [0.0021090538623228755, 0.0013934426229508198, 0.001721866478335586] and parameters: {'n_layers': 3, 'embedding_dim': 64, 'lr': 0.0002508736427382596, 'lambda_val': 0.04114156919115699, 'batch_size': 3726, 'optimizer': 'Adam'}.
2026-05-23 06:05:41,348 - experiment_functions - INFO - Early stopping at epoch 800. Best Metrics: (0.002444403071628657, 0.0027868852459016396, 0.003175184159829068)
2026-05-23 06:05:41,486 - optuna.study.study - INFO - Trial 108 finished with values: [0.002444403071628657, 0.0027868852459016396, 0.003175184159829068] and parameters: {'n_layers': 1, 'embedding_dim': 64, 'lr': 1.4416000448728074e-05, 'lambda_val': 1.90692593503121e-05, 'batch_size': 1888, 'optimizer': 'Adam'}.
2026-05-23 06:05:43,707 - experiment_functions - INFO - Early stopping at epoch 500. Best Metrics: (0.0014660172866734498, 0.0012295081967213116, 0.0015319359056461177)
2026-05-23 06:05:43,797 - optuna.study.study - INFO - Trial 109 finished with values: [0.0014660172866734498, 0.0012295081967213116, 0.0015319359056461177] and parameters: {'n_layers': 2, 'embedding_dim': 64, 'lr': 1.194088775511757e-05, 'lambda_val': 2.9405199459966574e-06, 'batch_size': 1993, 'optimizer': 'SGD'}.
2026-05-23 06:05:46,628 - experiment_functions - INFO - Early stopping at epoch 700. Best Metrics: (0.007402387940187278, 0.010573770491803278, 0.012786164982815283)
2026-05-23 06:05:46,765 - optuna.study.study - INFO - Trial 110 finished with values: [0.007402387940187278, 0.010573770491803278, 0.012786164982815283] and parameters: {'n_layers': 1, 'embedding_dim': 96, 'lr': 0.014958588920169108, 'lambda_val': 0.0013550316116179714, 'batch_size': 2799, 'optimizer': 'RMSprop'}.
2026-05-23 06:05:52,044 - experiment_functions - INFO - Early stopping at epoch 1600. Best Metrics: (0.005171480228280846, 0.007950819672131149, 0.009187095164642368)
2026-05-23 06:05:52,266 - optuna.study.study - INFO - Trial 111 finished with values: [0.005171480228280846, 0.007950819672131149, 0.009187095164642368] and parameters: {'n_layers': 1, 'embedding_dim': 64, 'lr': 0.0004278261152456948, 'lambda_val': 0.056091222361864104, 'batch_size': 3694, 'optimizer': 'Adam'}.
2026-05-23 06:06:04,652 - experiment_functions - INFO - Early stopping at epoch 3350. Best Metrics: (0.02208175356854374, 0.02213114754098361, 0.028720373227021995)
2026-05-23 06:06:05,527 - optuna.study.study - INFO - Trial 112 finished with values: [0.02208175356854374, 0.02213114754098361, 0.028720373227021995] and parameters: {'n_layers': 1, 'embedding_dim': 256, 'lr': 0.00016882222048828941, 'lambda_val': 1.643232822744187e-06, 'batch_size': 1059, 'optimizer': 'RMSprop'}.
2026-05-23 06:06:18,882 - optuna.study.study - INFO - Trial 113 finished with values: [0.014971499868784849, 0.013934426229508197, 0.017209551377273213] and parameters: {'n_layers': 3, 'embedding_dim': 64, 'lr': 0.00012869980734826536, 'lambda_val': 1.1371570226930704e-05, 'batch_size': 809, 'optimizer': 'RMSprop'}.
2026-05-23 06:06:21,602 - experiment_functions - INFO - Early stopping at epoch 700. Best Metrics: (0.005451137844375616, 0.007540983606557377, 0.009122034008523636)
2026-05-23 06:06:21,691 - optuna.study.study - INFO - Trial 114 finished with values: [0.005451137844375616, 0.007540983606557377, 0.009122034008523636] and parameters: {'n_layers': 2, 'embedding_dim': 32, 'lr': 0.0009699915116782758, 'lambda_val': 0.005501300014684501, 'batch_size': 3814, 'optimizer': 'Adam'}.
2026-05-23 06:06:29,716 - experiment_functions - INFO - Early stopping at epoch 2650. Best Metrics: (0.011091732286398545, 0.010245901639344262, 0.013025436904536761)
2026-05-23 06:06:29,774 - optuna.study.study - INFO - Trial 115 finished with values: [0.011091732286398545, 0.010245901639344262, 0.013025436904536761] and parameters: {'n_layers': 1, 'embedding_dim': 32, 'lr': 0.00011765782983091902, 'lambda_val': 0.00022615849293998648, 'batch_size': 3670, 'optimizer': 'RMSprop'}.
2026-05-23 06:06:42,808 - optuna.study.study - INFO - Trial 116 finished with values: [0.01080757504766189, 0.013606557377049182, 0.016708345933168143] and parameters: {'n_layers': 4, 'embedding_dim': 64, 'lr': 0.00012869980734826536, 'lambda_val': 0.002206220255221525, 'batch_size': 669, 'optimizer': 'RMSprop'}.
2026-05-23 06:06:45,339 - experiment_functions - INFO - Early stopping at epoch 600. Best Metrics: (0.010540168772929771, 0.01, 0.013060635177133339)
2026-05-23 06:06:45,473 - optuna.study.study - INFO - Trial 117 finished with values: [0.010540168772929771, 0.01, 0.013060635177133339] and parameters: {'n_layers': 2, 'embedding_dim': 96, 'lr': 0.0007855341580113746, 'lambda_val': 0.0003409353796005995, 'batch_size': 1073, 'optimizer': 'RMSprop'}.
2026-05-23 06:06:50,750 - experiment_functions - INFO - Early stopping at epoch 1550. Best Metrics: (0.005471684818848861, 0.007622950819672132, 0.008088116709880428)
2026-05-23 06:06:52,119 - optuna.study.study - INFO - Trial 118 finished with values: [0.005471684818848861, 0.007622950819672132, 0.008088116709880428] and parameters: {'n_layers': 3, 'embedding_dim': 64, 'lr': 0.0002508736427382596, 'lambda_val': 1.1371570226930704e-05, 'batch_size': 1360, 'optimizer': 'Adam'}.
2026-05-23 06:06:53,835 - experiment_functions - INFO - Early stopping at epoch 500. Best Metrics: (0.0024968519021488188, 0.0030327868852459017, 0.003287290227447033)
2026-05-23 06:06:53,916 - optuna.study.study - INFO - Trial 119 finished with values: [0.0024968519021488188, 0.0030327868852459017, 0.003287290227447033] and parameters: {'n_layers': 2, 'embedding_dim': 32, 'lr': 0.014991415365741289, 'lambda_val': 0.00034042279429205883, 'batch_size': 3670, 'optimizer': 'RMSprop'}.
2026-05-23 06:06:56,118 - experiment_functions - INFO - Early stopping at epoch 500. Best Metrics: (0.0008100032749637906, 0.0009836065573770494, 0.0009842975058823797)
2026-05-23 06:06:56,250 - optuna.study.study - INFO - Trial 120 finished with values: [0.0008100032749637906, 0.0009836065573770494, 0.0009842975058823797] and parameters: {'n_layers': 1, 'embedding_dim': 32, 'lr': 0.0014868423202414264, 'lambda_val': 0.056091222361864104, 'batch_size': 3694, 'optimizer': 'SGD'}.
2026-05-23 06:06:59,381 - experiment_functions - INFO - Early stopping at epoch 600. Best Metrics: (0.0071767510238296695, 0.00860655737704918, 0.009973761487034069)
2026-05-23 06:07:00,279 - optuna.study.study - INFO - Trial 121 finished with values: [0.0071767510238296695, 0.00860655737704918, 0.009973761487034069] and parameters: {'n_layers': 2, 'embedding_dim': 256, 'lr': 0.0004278261152456948, 'lambda_val': 0.0003409353796005995, 'batch_size': 3694, 'optimizer': 'RMSprop'}.
2026-05-23 06:07:03,173 - experiment_functions - INFO - Early stopping at epoch 550. Best Metrics: (0.0045806570080560455, 0.005163934426229508, 0.006044400717928046)
2026-05-23 06:07:03,284 - optuna.study.study - INFO - Trial 122 finished with values: [0.0045806570080560455, 0.005163934426229508, 0.006044400717928046] and parameters: {'n_layers': 2, 'embedding_dim': 256, 'lr': 0.0012169182947165634, 'lambda_val': 0.004205532178120714, 'batch_size': 3102, 'optimizer': 'RMSprop'}.
2026-05-23 06:07:09,953 - experiment_functions - INFO - Early stopping at epoch 2250. Best Metrics: (0.003399983353133793, 0.0027868852459016396, 0.0033293337066856135)
2026-05-23 06:07:10,042 - optuna.study.study - INFO - Trial 123 finished with values: [0.003399983353133793, 0.0027868852459016396, 0.0033293337066856135] and parameters: {'n_layers': 2, 'embedding_dim': 32, 'lr': 0.01837949443771539, 'lambda_val': 0.00043313110721109564, 'batch_size': 685, 'optimizer': 'RMSprop'}.
2026-05-23 06:07:21,349 - experiment_functions - INFO - Early stopping at epoch 2900. Best Metrics: (0.007228061779194438, 0.010573770491803278, 0.013409029693632188)
2026-05-23 06:07:21,863 - optuna.study.study - INFO - Trial 124 finished with values: [0.007228061779194438, 0.010573770491803278, 0.013409029693632188] and parameters: {'n_layers': 1, 'embedding_dim': 256, 'lr': 0.059429223534384505, 'lambda_val': 0.00027930861690939925, 'batch_size': 3425, 'optimizer': 'Adam'}.
2026-05-23 06:07:24,355 - experiment_functions - INFO - Early stopping at epoch 650. Best Metrics: (0.0038601651469924564, 0.004508196721311476, 0.006023519375163719)
2026-05-23 06:07:24,424 - optuna.study.study - INFO - Trial 125 finished with values: [0.0038601651469924564, 0.004508196721311476, 0.006023519375163719] and parameters: {'n_layers': 1, 'embedding_dim': 96, 'lr': 0.09388280516514556, 'lambda_val': 1.0739564606939635e-05, 'batch_size': 1480, 'optimizer': 'RMSprop'}.
2026-05-23 06:07:26,451 - experiment_functions - INFO - Early stopping at epoch 500. Best Metrics: (0.003977634720014515, 0.003934426229508198, 0.005369534493957946)
2026-05-23 06:07:26,547 - optuna.study.study - INFO - Trial 126 finished with values: [0.003977634720014515, 0.003934426229508198, 0.005369534493957946] and parameters: {'n_layers': 2, 'embedding_dim': 32, 'lr': 0.06601862631338007, 'lambda_val': 2.1457367365677017e-06, 'batch_size': 2024, 'optimizer': 'RMSprop'}.
2026-05-23 06:07:29,103 - experiment_functions - INFO - Early stopping at epoch 500. Best Metrics: (0.0008681040901401356, 0.0010655737704918034, 0.0013164388405339908)
2026-05-23 06:07:29,179 - optuna.study.study - INFO - Trial 127 finished with values: [0.0008681040901401356, 0.0010655737704918034, 0.0013164388405339908] and parameters: {'n_layers': 2, 'embedding_dim': 64, 'lr': 0.014958588920169108, 'lambda_val': 0.002206220255221525, 'batch_size': 4016, 'optimizer': 'Adam'}.
2026-05-23 06:07:32,361 - experiment_functions - INFO - Early stopping at epoch 850. Best Metrics: (0.014506722318840868, 0.015655737704918033, 0.018259645529699137)
2026-05-23 06:07:32,508 - optuna.study.study - INFO - Trial 128 finished with values: [0.014506722318840868, 0.015655737704918033, 0.018259645529699137] and parameters: {'n_layers': 1, 'embedding_dim': 64, 'lr': 0.00048792308917982896, 'lambda_val': 1.1371570226930704e-05, 'batch_size': 1489, 'optimizer': 'Adam'}.
2026-05-23 06:07:35,038 - experiment_functions - INFO - Early stopping at epoch 500. Best Metrics: (0.0026181373600442197, 0.0018032786885245904, 0.00219945700083766)
2026-05-23 06:07:35,196 - optuna.study.study - INFO - Trial 129 finished with values: [0.0026181373600442197, 0.0018032786885245904, 0.00219945700083766] and parameters: {'n_layers': 3, 'embedding_dim': 96, 'lr': 0.0030931675338147935, 'lambda_val': 1.1371570226930704e-05, 'batch_size': 2899, 'optimizer': 'RMSprop'}.
2026-05-23 06:07:43,834 - experiment_functions - INFO - Early stopping at epoch 2900. Best Metrics: (0.00853331272565933, 0.010983606557377049, 0.014171731177036887)
2026-05-23 06:07:43,925 - optuna.study.study - INFO - Trial 130 finished with values: [0.00853331272565933, 0.010983606557377049, 0.014171731177036887] and parameters: {'n_layers': 1, 'embedding_dim': 96, 'lr': 0.014958588920169108, 'lambda_val': 0.00027930861690939925, 'batch_size': 1356, 'optimizer': 'Adam'}.
2026-05-23 06:07:46,297 - experiment_functions - INFO - Early stopping at epoch 650. Best Metrics: (0.006065536850654138, 0.007704918032786886, 0.008446652262912918)
2026-05-23 06:07:46,441 - optuna.study.study - INFO - Trial 131 finished with values: [0.006065536850654138, 0.007704918032786886, 0.008446652262912918] and parameters: {'n_layers': 2, 'embedding_dim': 64, 'lr': 0.0009350408589784744, 'lambda_val': 0.002206220255221525, 'batch_size': 2282, 'optimizer': 'Adam'}.
2026-05-23 06:07:58,497 - optuna.study.study - INFO - Trial 132 finished with values: [0.0029246973101511456, 0.002622950819672131, 0.003835247011973592] and parameters: {'n_layers': 2, 'embedding_dim': 32, 'lr': 6.380088278428048e-05, 'lambda_val': 2.2013911134283336e-06, 'batch_size': 3670, 'optimizer': 'RMSprop'}.
2026-05-23 06:08:00,498 - experiment_functions - INFO - Early stopping at epoch 500. Best Metrics: (0.002311192661918439, 0.0012295081967213116, 0.0015596957007110287)
2026-05-23 06:08:00,571 - optuna.study.study - INFO - Trial 133 finished with values: [0.002311192661918439, 0.0012295081967213116, 0.0015596957007110287] and parameters: {'n_layers': 1, 'embedding_dim': 96, 'lr': 4.001121509302567e-05, 'lambda_val': 0.0013550316116179714, 'batch_size': 2799, 'optimizer': 'SGD'}.
2026-05-23 06:08:03,035 - experiment_functions - INFO - Early stopping at epoch 500. Best Metrics: (0.007763048634771636, 0.008114754098360656, 0.009549634554202999)
2026-05-23 06:08:03,099 - optuna.study.study - INFO - Trial 134 finished with values: [0.007763048634771636, 0.008114754098360656, 0.009549634554202999] and parameters: {'n_layers': 4, 'embedding_dim': 128, 'lr': 0.039541256411607204, 'lambda_val': 0.00029292236724190197, 'batch_size': 669, 'optimizer': 'RMSprop'}.
2026-05-23 06:08:06,059 - experiment_functions - INFO - Early stopping at epoch 850. Best Metrics: (0.002027119577539378, 0.0017213114754098362, 0.0020336817818940012)
2026-05-23 06:08:07,191 - optuna.study.study - INFO - Trial 135 finished with values: [0.002027119577539378, 0.0017213114754098362, 0.0020336817818940012] and parameters: {'n_layers': 1, 'embedding_dim': 96, 'lr': 0.09388280516514556, 'lambda_val': 0.027251947202207506, 'batch_size': 1480, 'optimizer': 'Adam'}.
2026-05-23 06:08:09,337 - experiment_functions - INFO - Early stopping at epoch 550. Best Metrics: (0.01585717087858815, 0.01762295081967213, 0.0227995288173305)
2026-05-23 06:08:09,407 - optuna.study.study - INFO - Trial 136 finished with values: [0.01585717087858815, 0.01762295081967213, 0.0227995288173305] and parameters: {'n_layers': 1, 'embedding_dim': 64, 'lr': 0.0012169182947165634, 'lambda_val': 1.711820466055588e-05, 'batch_size': 916, 'optimizer': 'RMSprop'}.
2026-05-23 06:08:14,824 - experiment_functions - INFO - Early stopping at epoch 1600. Best Metrics: (0.004197016775438374, 0.0025409836065573774, 0.003241823887527185)
2026-05-23 06:08:15,175 - optuna.study.study - INFO - Trial 137 finished with values: [0.004197016775438374, 0.0025409836065573774, 0.003241823887527185] and parameters: {'n_layers': 3, 'embedding_dim': 64, 'lr': 2.0426393992146028e-05, 'lambda_val': 0.00022615849293998648, 'batch_size': 1489, 'optimizer': 'Adam'}.
2026-05-23 06:08:17,405 - experiment_functions - INFO - Early stopping at epoch 500. Best Metrics: (0.003074138133952081, 0.0021311475409836068, 0.002566797312421016)
2026-05-23 06:08:17,514 - optuna.study.study - INFO - Trial 138 finished with values: [0.003074138133952081, 0.0021311475409836068, 0.002566797312421016] and parameters: {'n_layers': 4, 'embedding_dim': 96, 'lr': 1.7881257045584193e-05, 'lambda_val': 0.027251947202207506, 'batch_size': 669, 'optimizer': 'SGD'}.
2026-05-23 06:08:20,410 - experiment_functions - INFO - Early stopping at epoch 600. Best Metrics: (0.011046229070939174, 0.013032786885245902, 0.016321172169745376)
2026-05-23 06:08:20,551 - optuna.study.study - INFO - Trial 139 finished with values: [0.011046229070939174, 0.013032786885245902, 0.016321172169745376] and parameters: {'n_layers': 2, 'embedding_dim': 256, 'lr': 0.0007855341580113746, 'lambda_val': 0.0003409353796005995, 'batch_size': 894, 'optimizer': 'Adam'}.
2026-05-23 06:08:23,145 - experiment_functions - INFO - Early stopping at epoch 650. Best Metrics: (0.0018082391362267956, 0.0019672131147540984, 0.001991388930904032)
2026-05-23 06:08:23,228 - optuna.study.study - INFO - Trial 140 finished with values: [0.0018082391362267956, 0.0019672131147540984, 0.001991388930904032] and parameters: {'n_layers': 2, 'embedding_dim': 128, 'lr': 4.601430162207186e-05, 'lambda_val': 0.01536287204836458, 'batch_size': 885, 'optimizer': 'RMSprop'}.
2026-05-23 06:08:25,706 - experiment_functions - INFO - Early stopping at epoch 550. Best Metrics: (0.013188589066897622, 0.014016393442622952, 0.01773914759412046)
2026-05-23 06:08:25,848 - optuna.study.study - INFO - Trial 141 finished with values: [0.013188589066897622, 0.014016393442622952, 0.01773914759412046] and parameters: {'n_layers': 1, 'embedding_dim': 256, 'lr': 0.0007855341580113746, 'lambda_val': 0.0018518013272191423, 'batch_size': 3010, 'optimizer': 'RMSprop'}.
2026-05-23 06:08:28,597 - experiment_functions - INFO - Early stopping at epoch 550. Best Metrics: (0.014670243904098443, 0.015491803278688524, 0.019850648690381233)
2026-05-23 06:08:28,684 - optuna.study.study - INFO - Trial 142 finished with values: [0.014670243904098443, 0.015491803278688524, 0.019850648690381233] and parameters: {'n_layers': 1, 'embedding_dim': 256, 'lr': 0.0022084270117427845, 'lambda_val': 0.00012304464175487333, 'batch_size': 3111, 'optimizer': 'Adam'}.
2026-05-23 06:08:31,914 - experiment_functions - INFO - Early stopping at epoch 550. Best Metrics: (0.004593127130615132, 0.006557377049180328, 0.006960008927293713)
2026-05-23 06:08:32,023 - optuna.study.study - INFO - Trial 143 finished with values: [0.004593127130615132, 0.006557377049180328, 0.006960008927293713] and parameters: {'n_layers': 3, 'embedding_dim': 256, 'lr': 0.0022084270117427845, 'lambda_val': 1.1371570226930704e-05, 'batch_size': 3541, 'optimizer': 'Adam'}.
2026-05-23 06:08:34,376 - experiment_functions - INFO - Early stopping at epoch 500. Best Metrics: (0.004687798710466, 0.005901639344262296, 0.006779231167894707)
2026-05-23 06:08:34,468 - optuna.study.study - INFO - Trial 144 finished with values: [0.004687798710466, 0.005901639344262296, 0.006779231167894707] and parameters: {'n_layers': 3, 'embedding_dim': 64, 'lr': 0.014958588920169108, 'lambda_val': 7.181197787489371e-05, 'batch_size': 2899, 'optimizer': 'RMSprop'}.
2026-05-23 06:08:38,373 - experiment_functions - INFO - Early stopping at epoch 1100. Best Metrics: (0.0020135110896456775, 0.0015573770491803278, 0.0019029674076305298)
2026-05-23 06:08:38,453 - optuna.study.study - INFO - Trial 145 finished with values: [0.0020135110896456775, 0.0015573770491803278, 0.0019029674076305298] and parameters: {'n_layers': 1, 'embedding_dim': 96, 'lr': 0.09388280516514556, 'lambda_val': 0.00811231567759129, 'batch_size': 3241, 'optimizer': 'SGD'}.
2026-05-23 06:08:41,223 - experiment_functions - INFO - Early stopping at epoch 550. Best Metrics: (0.012359118076740123, 0.01278688524590164, 0.015632984752641663)
2026-05-23 06:08:41,352 - optuna.study.study - INFO - Trial 146 finished with values: [0.012359118076740123, 0.01278688524590164, 0.015632984752641663] and parameters: {'n_layers': 1, 'embedding_dim': 256, 'lr': 0.0007855341580113746, 'lambda_val': 0.0003409353796005995, 'batch_size': 3814, 'optimizer': 'RMSprop'}.
2026-05-23 06:08:43,555 - experiment_functions - INFO - Early stopping at epoch 500. Best Metrics: (0.0033900031886527644, 0.002049180327868853, 0.002756760048526924)
2026-05-23 06:08:43,700 - optuna.study.study - INFO - Trial 147 finished with values: [0.0033900031886527644, 0.002049180327868853, 0.002756760048526924] and parameters: {'n_layers': 1, 'embedding_dim': 96, 'lr': 4.0335648028602383e-05, 'lambda_val': 0.05655118281335753, 'batch_size': 3721, 'optimizer': 'SGD'}.
2026-05-23 06:08:47,220 - experiment_functions - INFO - Early stopping at epoch 500. Best Metrics: (0.0015181957840324656, 0.001967213114754099, 0.0023944206661440717)
2026-05-23 06:08:47,300 - optuna.study.study - INFO - Trial 148 finished with values: [0.0015181957840324656, 0.001967213114754099, 0.0023944206661440717] and parameters: {'n_layers': 4, 'embedding_dim': 256, 'lr': 0.09963122705006248, 'lambda_val': 0.027251947202207506, 'batch_size': 1073, 'optimizer': 'RMSprop'}.
2026-05-23 06:08:55,259 - experiment_functions - INFO - Early stopping at epoch 2550. Best Metrics: (0.010774536303860806, 0.011721311475409836, 0.015310867335635752)
2026-05-23 06:08:55,332 - optuna.study.study - INFO - Trial 149 finished with values: [0.010774536303860806, 0.011721311475409836, 0.015310867335635752] and parameters: {'n_layers': 2, 'embedding_dim': 64, 'lr': 0.00013647495897976545, 'lambda_val': 0.002206220255221525, 'batch_size': 2282, 'optimizer': 'Adam'}.
2026-05-23 06:08:58,250 - experiment_functions - INFO - Early stopping at epoch 600. Best Metrics: (0.009579032331562367, 0.0069672131147540985, 0.009127408531523603)
2026-05-23 06:08:58,332 - optuna.study.study - INFO - Trial 150 finished with values: [0.009579032331562367, 0.0069672131147540985, 0.009127408531523603] and parameters: {'n_layers': 3, 'embedding_dim': 96, 'lr': 0.0009699915116782758, 'lambda_val': 1.2684111432161195e-05, 'batch_size': 3670, 'optimizer': 'Adam'}.
2026-05-23 06:09:01,307 - experiment_functions - INFO - Early stopping at epoch 550. Best Metrics: (0.00707379699027928, 0.01081967213114754, 0.011821897184109767)
