2026-05-23 04:04:07,206 - optuna.study.study - INFO - Trial 209 finished with values: [0.08977196889694969, 0.04745901639344262, 0.0767144568890069] and parameters: {'n_layers': 1, 'embedding_dim': 64, 'lr': 0.00026503485300845536, 'lambda_val': 0.0009750566560695258, 'batch_size': 1170, 'optimizer': 'RMSprop'}.
2026-05-23 04:04:19,507 - optuna.study.study - INFO - Trial 210 finished with values: [0.08359909474783384, 0.04729508196721312, 0.07642346034739385] and parameters: {'n_layers': 1, 'embedding_dim': 64, 'lr': 0.00026503485300845536, 'lambda_val': 1.6693478080315474e-06, 'batch_size': 1529, 'optimizer': 'Adam'}.
2026-05-23 04:04:22,412 - experiment_functions - INFO - Early stopping at epoch 550. Best Metrics: (0.07548280002491532, 0.04139344262295082, 0.06981838972727304)
2026-05-23 04:04:23,126 - optuna.study.study - INFO - Trial 211 finished with values: [0.07548280002491532, 0.04139344262295082, 0.06981838972727304] and parameters: {'n_layers': 1, 'embedding_dim': 256, 'lr': 0.0029056396011724254, 'lambda_val': 0.0073719911572268405, 'batch_size': 3008, 'optimizer': 'Adam'}.
2026-05-23 04:04:36,615 - optuna.study.study - INFO - Trial 212 finished with values: [0.005860590532253132, 0.004672131147540984, 0.005970244632454128] and parameters: {'n_layers': 2, 'embedding_dim': 64, 'lr': 4.2544374354450906e-05, 'lambda_val': 8.391673416893658e-05, 'batch_size': 1529, 'optimizer': 'Adam'}.
2026-05-23 04:04:39,743 - experiment_functions - INFO - Early stopping at epoch 700. Best Metrics: (0.0963865685999033, 0.047459016393442625, 0.08172233157780232)
2026-05-23 04:04:40,555 - optuna.study.study - INFO - Trial 213 finished with values: [0.0963865685999033, 0.047459016393442625, 0.08172233157780232] and parameters: {'n_layers': 1, 'embedding_dim': 128, 'lr': 0.0016044647069746135, 'lambda_val': 0.0001828713741946551, 'batch_size': 2589, 'optimizer': 'Adam'}.
2026-05-23 04:04:52,423 - experiment_functions - INFO - Early stopping at epoch 3500. Best Metrics: (0.0927257144981312, 0.04901639344262296, 0.07814694163931968)
2026-05-23 04:04:52,507 - optuna.study.study - INFO - Trial 214 finished with values: [0.0927257144981312, 0.04901639344262296, 0.07814694163931968] and parameters: {'n_layers': 1, 'embedding_dim': 96, 'lr': 0.00026503485300845536, 'lambda_val': 0.005013716564296358, 'batch_size': 2515, 'optimizer': 'Adam'}.
2026-05-23 04:05:03,276 - experiment_functions - INFO - Early stopping at epoch 2400. Best Metrics: (0.08961701138925611, 0.04475409836065574, 0.079757199602763)
2026-05-23 04:05:03,443 - optuna.study.study - INFO - Trial 215 finished with values: [0.08961701138925611, 0.04475409836065574, 0.079757199602763] and parameters: {'n_layers': 3, 'embedding_dim': 128, 'lr': 0.00026503485300845536, 'lambda_val': 0.0001461310018361696, 'batch_size': 635, 'optimizer': 'RMSprop'}.
2026-05-23 04:05:10,470 - experiment_functions - INFO - Early stopping at epoch 2000. Best Metrics: (0.09813316377697676, 0.05147540983606557, 0.08474383432266416)
2026-05-23 04:05:10,609 - optuna.study.study - INFO - Trial 216 finished with values: [0.09813316377697676, 0.05147540983606557, 0.08474383432266416] and parameters: {'n_layers': 1, 'embedding_dim': 64, 'lr': 0.0005025722918895278, 'lambda_val': 6.13505476225876e-05, 'batch_size': 2515, 'optimizer': 'RMSprop'}.
2026-05-23 04:05:13,128 - experiment_functions - INFO - Early stopping at epoch 650. Best Metrics: (0.08504600972406583, 0.04868852459016393, 0.07363048577870916)
2026-05-23 04:05:13,223 - optuna.study.study - INFO - Trial 217 finished with values: [0.08504600972406583, 0.04868852459016393, 0.07363048577870916] and parameters: {'n_layers': 1, 'embedding_dim': 64, 'lr': 0.0016044647069746135, 'lambda_val': 0.01669156314627884, 'batch_size': 2314, 'optimizer': 'Adam'}.
2026-05-23 04:05:16,142 - experiment_functions - INFO - Early stopping at epoch 600. Best Metrics: (0.10014199573079542, 0.04827868852459017, 0.08215206693229696)
2026-05-23 04:05:16,731 - optuna.study.study - INFO - Trial 218 finished with values: [0.10014199573079542, 0.04827868852459017, 0.08215206693229696] and parameters: {'n_layers': 1, 'embedding_dim': 96, 'lr': 0.0029056396011724254, 'lambda_val': 4.0917763253209226e-05, 'batch_size': 3317, 'optimizer': 'Adam'}.
2026-05-23 04:05:24,674 - experiment_functions - INFO - Early stopping at epoch 550. Best Metrics: (0.10313823192268698, 0.05180327868852459, 0.08531891443891122)
2026-05-23 04:05:25,442 - optuna.study.study - INFO - Trial 219 finished with values: [0.10313823192268698, 0.05180327868852459, 0.08531891443891122] and parameters: {'n_layers': 1, 'embedding_dim': 96, 'lr': 0.00726893620558119, 'lambda_val': 2.0700677762543618e-06, 'batch_size': 3317, 'optimizer': 'Adam'}.
2026-05-23 04:05:31,446 - experiment_functions - INFO - Early stopping at epoch 550. Best Metrics: (0.08848587028687344, 0.04475409836065574, 0.07210290352339917)
2026-05-23 04:05:31,542 - optuna.study.study - INFO - Trial 220 finished with values: [0.08848587028687344, 0.04475409836065574, 0.07210290352339917] and parameters: {'n_layers': 1, 'embedding_dim': 256, 'lr': 0.00726893620558119, 'lambda_val': 1.8084571105268367e-05, 'batch_size': 2333, 'optimizer': 'Adam'}.
2026-05-23 04:05:34,392 - experiment_functions - INFO - Early stopping at epoch 600. Best Metrics: (0.09959769935937415, 0.052131147540983615, 0.08433685257417886)
2026-05-23 04:05:34,523 - optuna.study.study - INFO - Trial 221 finished with values: [0.09959769935937415, 0.052131147540983615, 0.08433685257417886] and parameters: {'n_layers': 1, 'embedding_dim': 96, 'lr': 0.0029056396011724254, 'lambda_val': 1.395072065085088e-06, 'batch_size': 2670, 'optimizer': 'Adam'}.
2026-05-23 04:05:37,366 - experiment_functions - INFO - Early stopping at epoch 650. Best Metrics: (0.0962045282175578, 0.04909836065573771, 0.08174763232882708)
2026-05-23 04:05:38,202 - optuna.study.study - INFO - Trial 222 finished with values: [0.0962045282175578, 0.04909836065573771, 0.08174763232882708] and parameters: {'n_layers': 1, 'embedding_dim': 128, 'lr': 0.0025167752834235274, 'lambda_val': 1.6190148297677295e-06, 'batch_size': 1166, 'optimizer': 'Adam'}.
2026-05-23 04:05:41,022 - experiment_functions - INFO - Early stopping at epoch 550. Best Metrics: (0.08618717464689062, 0.04475409836065574, 0.07442043250191366)
2026-05-23 04:05:41,114 - optuna.study.study - INFO - Trial 223 finished with values: [0.08618717464689062, 0.04475409836065574, 0.07442043250191366] and parameters: {'n_layers': 1, 'embedding_dim': 32, 'lr': 0.00726893620558119, 'lambda_val': 2.0700677762543618e-06, 'batch_size': 3542, 'optimizer': 'Adam'}.
2026-05-23 04:05:43,295 - experiment_functions - INFO - Early stopping at epoch 500. Best Metrics: (0.0035373308312453577, 0.0020491803278688526, 0.0034172051296421347)
2026-05-23 04:05:43,475 - optuna.study.study - INFO - Trial 224 finished with values: [0.0035373308312453577, 0.0020491803278688526, 0.0034172051296421347] and parameters: {'n_layers': 1, 'embedding_dim': 32, 'lr': 6.172781107007438e-05, 'lambda_val': 0.005013716564296358, 'batch_size': 2314, 'optimizer': 'Adam'}.
2026-05-23 04:05:47,392 - experiment_functions - INFO - Early stopping at epoch 1050. Best Metrics: (0.08403688500346986, 0.04516393442622951, 0.07628274187545966)
2026-05-23 04:05:47,476 - optuna.study.study - INFO - Trial 225 finished with values: [0.08403688500346986, 0.04516393442622951, 0.07628274187545966] and parameters: {'n_layers': 1, 'embedding_dim': 32, 'lr': 0.0006974716712164259, 'lambda_val': 0.0069119447493799025, 'batch_size': 2670, 'optimizer': 'Adam'}.
2026-05-23 04:05:50,507 - experiment_functions - INFO - Early stopping at epoch 600. Best Metrics: (0.09850126185480354, 0.04836065573770492, 0.08104394569018165)
2026-05-23 04:05:50,890 - optuna.study.study - INFO - Trial 226 finished with values: [0.09850126185480354, 0.04836065573770492, 0.08104394569018165] and parameters: {'n_layers': 1, 'embedding_dim': 256, 'lr': 0.0029056396011724254, 'lambda_val': 6.13505476225876e-05, 'batch_size': 2314, 'optimizer': 'Adam'}.
2026-05-23 04:05:54,341 - experiment_functions - INFO - Early stopping at epoch 750. Best Metrics: (0.033219621895016635, 0.020163934426229508, 0.030683196602486956)
2026-05-23 04:05:54,995 - optuna.study.study - INFO - Trial 227 finished with values: [0.033219621895016635, 0.020163934426229508, 0.030683196602486956] and parameters: {'n_layers': 2, 'embedding_dim': 128, 'lr': 0.0016044647069746135, 'lambda_val': 1.1150431230027626e-06, 'batch_size': 705, 'optimizer': 'RMSprop'}.
2026-05-23 04:05:57,950 - experiment_functions - INFO - Early stopping at epoch 550. Best Metrics: (0.09532799702821221, 0.04672131147540984, 0.07706466026972218)
2026-05-23 04:05:58,022 - optuna.study.study - INFO - Trial 228 finished with values: [0.09532799702821221, 0.04672131147540984, 0.07706466026972218] and parameters: {'n_layers': 1, 'embedding_dim': 256, 'lr': 0.006682771802508509, 'lambda_val': 1.8084571105268367e-05, 'batch_size': 3689, 'optimizer': 'Adam'}.
2026-05-23 04:06:01,556 - experiment_functions - INFO - Early stopping at epoch 750. Best Metrics: (0.10438585025427118, 0.050491803278688525, 0.08937813888551079)
2026-05-23 04:06:01,922 - optuna.study.study - INFO - Trial 229 finished with values: [0.10438585025427118, 0.050491803278688525, 0.08937813888551079] and parameters: {'n_layers': 1, 'embedding_dim': 256, 'lr': 0.0016044647069746135, 'lambda_val': 6.13505476225876e-05, 'batch_size': 1584, 'optimizer': 'Adam'}.
2026-05-23 04:06:04,913 - experiment_functions - INFO - Early stopping at epoch 550. Best Metrics: (0.07410893412660603, 0.038442622950819676, 0.06398261179562889)
2026-05-23 04:06:05,235 - optuna.study.study - INFO - Trial 230 finished with values: [0.07410893412660603, 0.038442622950819676, 0.06398261179562889] and parameters: {'n_layers': 1, 'embedding_dim': 256, 'lr': 0.006682771802508509, 'lambda_val': 0.005013716564296358, 'batch_size': 3689, 'optimizer': 'Adam'}.
2026-05-23 04:06:21,555 - optuna.study.study - INFO - Trial 231 finished with values: [0.10170928267922034, 0.05155737704918032, 0.09149914963784901] and parameters: {'n_layers': 1, 'embedding_dim': 256, 'lr': 0.000233346029650438, 'lambda_val': 2.0700677762543618e-06, 'batch_size': 1170, 'optimizer': 'RMSprop'}.
2026-05-23 04:06:34,557 - optuna.study.study - INFO - Trial 232 finished with values: [0.08953306860973355, 0.046393442622950816, 0.07438052735813992] and parameters: {'n_layers': 1, 'embedding_dim': 32, 'lr': 0.00026503485300845536, 'lambda_val': 0.005013716564296358, 'batch_size': 2384, 'optimizer': 'Adam'}.
2026-05-23 04:06:41,050 - experiment_functions - INFO - Early stopping at epoch 1500. Best Metrics: (0.051655779148308156, 0.024918032786885248, 0.041179012526728356)
2026-05-23 04:06:41,569 - optuna.study.study - INFO - Trial 233 finished with values: [0.051655779148308156, 0.024918032786885248, 0.041179012526728356] and parameters: {'n_layers': 1, 'embedding_dim': 256, 'lr': 0.0112856148976594, 'lambda_val': 6.13505476225876e-05, 'batch_size': 2515, 'optimizer': 'RMSprop'}.
2026-05-23 04:06:44,775 - experiment_functions - INFO - Early stopping at epoch 750. Best Metrics: (0.08679566790013955, 0.044426229508196725, 0.06864993367421261)
2026-05-23 04:06:45,419 - optuna.study.study - INFO - Trial 234 finished with values: [0.08679566790013955, 0.044426229508196725, 0.06864993367421261] and parameters: {'n_layers': 1, 'embedding_dim': 64, 'lr': 0.0016044647069746135, 'lambda_val': 6.13505476225876e-05, 'batch_size': 2314, 'optimizer': 'RMSprop'}.
2026-05-23 04:06:48,724 - experiment_functions - INFO - Early stopping at epoch 800. Best Metrics: (0.10622759843566407, 0.048606557377049185, 0.08416460774507833)
2026-05-23 04:06:48,834 - optuna.study.study - INFO - Trial 235 finished with values: [0.10622759843566407, 0.048606557377049185, 0.08416460774507833] and parameters: {'n_layers': 1, 'embedding_dim': 64, 'lr': 0.0016044647069746135, 'lambda_val': 6.13505476225876e-05, 'batch_size': 2314, 'optimizer': 'Adam'}.
2026-05-23 04:06:54,456 - experiment_functions - INFO - Early stopping at epoch 1450. Best Metrics: (0.11172515391107986, 0.05262295081967213, 0.09026901689537162)
2026-05-23 04:06:54,796 - optuna.study.study - INFO - Trial 236 finished with values: [0.11172515391107986, 0.05262295081967213, 0.09026901689537162] and parameters: {'n_layers': 1, 'embedding_dim': 32, 'lr': 0.0007420979429767307, 'lambda_val': 0.0017795542900466829, 'batch_size': 2314, 'optimizer': 'Adam'}.
2026-05-23 04:06:57,693 - experiment_functions - INFO - Early stopping at epoch 550. Best Metrics: (0.09387743879874477, 0.04557377049180328, 0.07508542739951912)
2026-05-23 04:06:58,286 - optuna.study.study - INFO - Trial 237 finished with values: [0.09387743879874477, 0.04557377049180328, 0.07508542739951912] and parameters: {'n_layers': 1, 'embedding_dim': 256, 'lr': 0.006682771802508509, 'lambda_val': 0.0005885991132278509, 'batch_size': 2386, 'optimizer': 'Adam'}.
2026-05-23 04:07:00,945 - experiment_functions - INFO - Early stopping at epoch 550. Best Metrics: (0.0958607657307912, 0.04598360655737706, 0.07822751605796638)
2026-05-23 04:07:01,031 - optuna.study.study - INFO - Trial 238 finished with values: [0.0958607657307912, 0.04598360655737706, 0.07822751605796638] and parameters: {'n_layers': 1, 'embedding_dim': 32, 'lr': 0.00726893620558119, 'lambda_val': 1.8084571105268367e-05, 'batch_size': 2314, 'optimizer': 'Adam'}.
2026-05-23 04:07:03,929 - experiment_functions - INFO - Early stopping at epoch 650. Best Metrics: (0.07007442356000054, 0.03581967213114754, 0.055895327606266955)
2026-05-23 04:07:04,069 - optuna.study.study - INFO - Trial 239 finished with values: [0.07007442356000054, 0.03581967213114754, 0.055895327606266955] and parameters: {'n_layers': 1, 'embedding_dim': 96, 'lr': 0.0029056396011724254, 'lambda_val': 6.13505476225876e-05, 'batch_size': 1111, 'optimizer': 'RMSprop'}.
2026-05-23 04:07:12,260 - experiment_functions - INFO - Early stopping at epoch 950. Best Metrics: (0.09850336779060892, 0.04885245901639344, 0.08365478928815459)
2026-05-23 04:07:13,548 - optuna.study.study - INFO - Trial 240 finished with values: [0.09850336779060892, 0.04885245901639344, 0.08365478928815459] and parameters: {'n_layers': 1, 'embedding_dim': 64, 'lr': 0.0016044647069746135, 'lambda_val': 1.6693478080315474e-06, 'batch_size': 1529, 'optimizer': 'Adam'}.
2026-05-23 04:07:33,102 - optuna.study.study - INFO - Trial 241 finished with values: [0.045537853074742354, 0.02557377049180328, 0.044163970761021056] and parameters: {'n_layers': 4, 'embedding_dim': 32, 'lr': 0.000233346029650438, 'lambda_val': 2.0700677762543618e-06, 'batch_size': 2933, 'optimizer': 'Adam'}.
2026-05-23 04:07:35,475 - experiment_functions - INFO - Early stopping at epoch 550. Best Metrics: (0.08283413411549617, 0.04278688524590164, 0.06719206452000244)
2026-05-23 04:07:35,559 - optuna.study.study - INFO - Trial 242 finished with values: [0.08283413411549617, 0.04278688524590164, 0.06719206452000244] and parameters: {'n_layers': 1, 'embedding_dim': 96, 'lr': 0.0029056396011724254, 'lambda_val': 6.13505476225876e-05, 'batch_size': 2314, 'optimizer': 'RMSprop'}.
2026-05-23 04:07:40,878 - experiment_functions - INFO - Early stopping at epoch 1300. Best Metrics: (0.12049107394320725, 0.055409836065573766, 0.10014065658679819)
2026-05-23 04:07:41,074 - optuna.study.study - INFO - Trial 243 finished with values: [0.12049107394320725, 0.055409836065573766, 0.10014065658679819] and parameters: {'n_layers': 1, 'embedding_dim': 256, 'lr': 0.0005201459519511334, 'lambda_val': 0.0003533912900666162, 'batch_size': 2386, 'optimizer': 'Adam'}.
2026-05-23 04:07:43,705 - experiment_functions - INFO - Early stopping at epoch 750. Best Metrics: (0.10013571902968177, 0.050491803278688525, 0.08643992808313045)
2026-05-23 04:07:43,796 - optuna.study.study - INFO - Trial 244 finished with values: [0.10013571902968177, 0.050491803278688525, 0.08643992808313045] and parameters: {'n_layers': 1, 'embedding_dim': 32, 'lr': 0.0016044647069746135, 'lambda_val': 0.005013716564296358, 'batch_size': 2314, 'optimizer': 'Adam'}.
2026-05-23 04:07:47,489 - experiment_functions - INFO - Early stopping at epoch 600. Best Metrics: (0.06359675680217264, 0.03467213114754098, 0.05604882576573107)
2026-05-23 04:07:47,564 - optuna.study.study - INFO - Trial 245 finished with values: [0.06359675680217264, 0.03467213114754098, 0.05604882576573107] and parameters: {'n_layers': 2, 'embedding_dim': 256, 'lr': 0.0016044647069746135, 'lambda_val': 9.148299075234438e-06, 'batch_size': 3317, 'optimizer': 'Adam'}.
2026-05-23 04:07:51,019 - experiment_functions - INFO - Early stopping at epoch 550. Best Metrics: (0.02270060421968975, 0.013688524590163934, 0.020150015570838425)
2026-05-23 04:07:52,295 - optuna.study.study - INFO - Trial 246 finished with values: [0.02270060421968975, 0.013688524590163934, 0.020150015570838425] and parameters: {'n_layers': 4, 'embedding_dim': 128, 'lr': 0.0029056396011724254, 'lambda_val': 1.8084571105268367e-05, 'batch_size': 2670, 'optimizer': 'RMSprop'}.
2026-05-23 04:07:54,999 - experiment_functions - INFO - Early stopping at epoch 500. Best Metrics: (0.0011097972402144005, 0.0014754098360655738, 0.001537307478355615)
2026-05-23 04:07:55,095 - optuna.study.study - INFO - Trial 247 finished with values: [0.0011097972402144005, 0.0014754098360655738, 0.001537307478355615] and parameters: {'n_layers': 1, 'embedding_dim': 256, 'lr': 2.60653982530267e-05, 'lambda_val': 0.0005885991132278509, 'batch_size': 3465, 'optimizer': 'SGD'}.
2026-05-23 04:07:58,803 - experiment_functions - INFO - Early stopping at epoch 850. Best Metrics: (0.10341263156189755, 0.05008196721311475, 0.08672715434106608)
2026-05-23 04:07:58,892 - optuna.study.study - INFO - Trial 248 finished with values: [0.10341263156189755, 0.05008196721311475, 0.08672715434106608] and parameters: {'n_layers': 1, 'embedding_dim': 96, 'lr': 0.0015660906918692206, 'lambda_val': 0.0005885991132278509, 'batch_size': 2386, 'optimizer': 'Adam'}.
2026-05-23 04:08:03,303 - experiment_functions - INFO - Early stopping at epoch 800. Best Metrics: (0.03334992059273398, 0.015983606557377048, 0.024968534082287802)
2026-05-23 04:08:03,584 - optuna.study.study - INFO - Trial 249 finished with values: [0.03334992059273398, 0.015983606557377048, 0.024968534082287802] and parameters: {'n_layers': 2, 'embedding_dim': 256, 'lr': 0.0029056396011724254, 'lambda_val': 6.13505476225876e-05, 'batch_size': 2314, 'optimizer': 'RMSprop'}.
2026-05-23 04:08:14,986 - experiment_functions - INFO - Early stopping at epoch 3400. Best Metrics: (0.10341017758185676, 0.05245901639344262, 0.09068541994102641)
2026-05-23 04:08:15,165 - optuna.study.study - INFO - Trial 250 finished with values: [0.10341017758185676, 0.05245901639344262, 0.09068541994102641] and parameters: {'n_layers': 1, 'embedding_dim': 96, 'lr': 0.00026503485300845536, 'lambda_val': 0.005013716564296358, 'batch_size': 2386, 'optimizer': 'Adam'}.
2026-05-23 04:08:17,592 - experiment_functions - INFO - Early stopping at epoch 500. Best Metrics: (0.0013733427549774706, 0.0011475409836065576, 0.0014611784971511135)
2026-05-23 04:08:17,688 - optuna.study.study - INFO - Trial 251 finished with values: [0.0013733427549774706, 0.0011475409836065576, 0.0014611784971511135] and parameters: {'n_layers': 1, 'embedding_dim': 256, 'lr': 0.0016044647069746135, 'lambda_val': 6.13505476225876e-05, 'batch_size': 2515, 'optimizer': 'SGD'}.
2026-05-23 04:08:28,555 - experiment_functions - INFO - Early stopping at epoch 1350. Best Metrics: (0.12280438409244213, 0.05360655737704918, 0.09170708162806082)
2026-05-23 04:08:29,114 - optuna.study.study - INFO - Trial 252 finished with values: [0.12280438409244213, 0.05360655737704918, 0.09170708162806082] and parameters: {'n_layers': 1, 'embedding_dim': 256, 'lr': 0.0005201459519511334, 'lambda_val': 0.0003533912900666162, 'batch_size': 2386, 'optimizer': 'Adam'}.
2026-05-23 04:08:35,587 - experiment_functions - INFO - Early stopping at epoch 550. Best Metrics: (0.06640233779777038, 0.0389344262295082, 0.05999646942246508)
2026-05-23 04:08:35,674 - optuna.study.study - INFO - Trial 253 finished with values: [0.06640233779777038, 0.0389344262295082, 0.05999646942246508] and parameters: {'n_layers': 1, 'embedding_dim': 32, 'lr': 0.00726893620558119, 'lambda_val': 8.391673416893658e-05, 'batch_size': 3542, 'optimizer': 'Adam'}.
2026-05-23 04:08:39,745 - experiment_functions - INFO - Early stopping at epoch 800. Best Metrics: (0.10868259275879233, 0.047622950819672126, 0.08607959083682797)
2026-05-23 04:08:40,033 - optuna.study.study - INFO - Trial 254 finished with values: [0.10868259275879233, 0.047622950819672126, 0.08607959083682797] and parameters: {'n_layers': 1, 'embedding_dim': 256, 'lr': 0.0015660906918692206, 'lambda_val': 6.13505476225876e-05, 'batch_size': 2314, 'optimizer': 'Adam'}.
2026-05-23 04:08:45,775 - experiment_functions - INFO - Early stopping at epoch 1400. Best Metrics: (0.019909515220925166, 0.020081967213114754, 0.02425755076004044)
2026-05-23 04:08:46,790 - optuna.study.study - INFO - Trial 255 finished with values: [0.019909515220925166, 0.020081967213114754, 0.02425755076004044] and parameters: {'n_layers': 1, 'embedding_dim': 256, 'lr': 0.0016044647069746135, 'lambda_val': 0.07350591938694677, 'batch_size': 1529, 'optimizer': 'Adam'}.
2026-05-23 04:08:49,937 - experiment_functions - INFO - Early stopping at epoch 600. Best Metrics: (0.09473921381509065, 0.046967213114754096, 0.07998751063092521)
