2026-05-23 01:01:57,688 - optuna.study.study - INFO - Trial 183 finished with values: [0.004162654911008273, 0.0034426229508196723, 0.0044968917469609725] and parameters: {'n_layers': 2, 'embedding_dim': 96, 'lr': 5.066152371344417e-05, 'lambda_val': 0.0006167459118972293, 'batch_size': 2410, 'optimizer': 'Adam'}.
2026-05-23 01:02:02,393 - experiment_functions - INFO - Early stopping at epoch 1550. Best Metrics: (0.03259102085523752, 0.017868852459016395, 0.027484697721821563)
2026-05-23 01:02:02,756 - optuna.study.study - INFO - Trial 184 finished with values: [0.03259102085523752, 0.017868852459016395, 0.027484697721821563] and parameters: {'n_layers': 2, 'embedding_dim': 128, 'lr': 0.00037164008089034755, 'lambda_val': 6.335945209609284e-06, 'batch_size': 2410, 'optimizer': 'Adam'}.
2026-05-23 01:02:06,946 - experiment_functions - INFO - Early stopping at epoch 900. Best Metrics: (0.0021447438446472507, 0.001967213114754099, 0.0030739672763011286)
2026-05-23 01:02:07,142 - optuna.study.study - INFO - Trial 185 finished with values: [0.0021447438446472507, 0.001967213114754099, 0.0030739672763011286] and parameters: {'n_layers': 4, 'embedding_dim': 256, 'lr': 0.07042681019552254, 'lambda_val': 1.6272236642036505e-05, 'batch_size': 1254, 'optimizer': 'SGD'}.
2026-05-23 01:02:09,693 - experiment_functions - INFO - Early stopping at epoch 800. Best Metrics: (0.030264464670833966, 0.017459016393442627, 0.027710804287683008)
2026-05-23 01:02:09,792 - optuna.study.study - INFO - Trial 186 finished with values: [0.030264464670833966, 0.017459016393442627, 0.027710804287683008] and parameters: {'n_layers': 3, 'embedding_dim': 64, 'lr': 0.0008732317857197807, 'lambda_val': 0.0003391336234513702, 'batch_size': 1588, 'optimizer': 'Adam'}.
2026-05-23 01:02:17,400 - experiment_functions - INFO - Early stopping at epoch 1050. Best Metrics: (0.030073300141886156, 0.019344262295081967, 0.026963009555868726)
2026-05-23 01:02:18,264 - optuna.study.study - INFO - Trial 187 finished with values: [0.030073300141886156, 0.019344262295081967, 0.026963009555868726] and parameters: {'n_layers': 1, 'embedding_dim': 256, 'lr': 0.0006241453841646659, 'lambda_val': 0.006616376079935662, 'batch_size': 1085, 'optimizer': 'RMSprop'}.
2026-05-23 01:02:24,030 - experiment_functions - INFO - Early stopping at epoch 1150. Best Metrics: (0.03331025828559103, 0.018688524590163937, 0.026442204524364032)
2026-05-23 01:02:24,124 - optuna.study.study - INFO - Trial 188 finished with values: [0.03331025828559103, 0.018688524590163937, 0.026442204524364032] and parameters: {'n_layers': 3, 'embedding_dim': 96, 'lr': 0.00034335523469639003, 'lambda_val': 0.0007172417291421626, 'batch_size': 1304, 'optimizer': 'Adam'}.
2026-05-23 01:02:26,384 - experiment_functions - INFO - Early stopping at epoch 550. Best Metrics: (0.03020939748439981, 0.016721311475409836, 0.024445216549193693)
2026-05-23 01:02:26,482 - optuna.study.study - INFO - Trial 189 finished with values: [0.03020939748439981, 0.016721311475409836, 0.024445216549193693] and parameters: {'n_layers': 3, 'embedding_dim': 128, 'lr': 0.0012673220264025206, 'lambda_val': 0.001494639523123646, 'batch_size': 903, 'optimizer': 'RMSprop'}.
2026-05-23 01:02:28,837 - experiment_functions - INFO - Early stopping at epoch 750. Best Metrics: (0.02917855911565428, 0.018114754098360657, 0.028149189785281633)
2026-05-23 01:02:28,928 - optuna.study.study - INFO - Trial 190 finished with values: [0.02917855911565428, 0.018114754098360657, 0.028149189785281633] and parameters: {'n_layers': 1, 'embedding_dim': 96, 'lr': 0.0018845351019360292, 'lambda_val': 5.5532012635423735e-06, 'batch_size': 1468, 'optimizer': 'RMSprop'}.
2026-05-23 01:02:31,901 - experiment_functions - INFO - Early stopping at epoch 750. Best Metrics: (0.031396799351992855, 0.01639344262295082, 0.02575205573425449)
2026-05-23 01:02:32,013 - optuna.study.study - INFO - Trial 191 finished with values: [0.031396799351992855, 0.01639344262295082, 0.02575205573425449] and parameters: {'n_layers': 3, 'embedding_dim': 128, 'lr': 0.0008732317857197807, 'lambda_val': 0.00020972208651910077, 'batch_size': 3011, 'optimizer': 'Adam'}.
2026-05-23 01:02:34,653 - experiment_functions - INFO - Early stopping at epoch 700. Best Metrics: (0.030167294735510622, 0.016475409836065574, 0.02532858150345242)
2026-05-23 01:02:34,730 - optuna.study.study - INFO - Trial 192 finished with values: [0.030167294735510622, 0.016475409836065574, 0.02532858150345242] and parameters: {'n_layers': 3, 'embedding_dim': 128, 'lr': 0.0012673220264025206, 'lambda_val': 2.2056555212075114e-05, 'batch_size': 1639, 'optimizer': 'Adam'}.
2026-05-23 01:02:36,581 - experiment_functions - INFO - Early stopping at epoch 500. Best Metrics: (0.0018920215195229713, 0.0014754098360655738, 0.0014953995691563827)
2026-05-23 01:02:36,678 - optuna.study.study - INFO - Trial 193 finished with values: [0.0018920215195229713, 0.0014754098360655738, 0.0014953995691563827] and parameters: {'n_layers': 2, 'embedding_dim': 64, 'lr': 0.0007586035361839872, 'lambda_val': 0.00053956191152972, 'batch_size': 2410, 'optimizer': 'SGD'}.
2026-05-23 01:02:45,848 - optuna.study.study - INFO - Trial 194 finished with values: [0.022695002578635364, 0.014426229508196723, 0.022270516532398404] and parameters: {'n_layers': 1, 'embedding_dim': 96, 'lr': 0.00020235034347458928, 'lambda_val': 0.0007172417291421626, 'batch_size': 2156, 'optimizer': 'Adam'}.
2026-05-23 01:02:49,299 - experiment_functions - INFO - Early stopping at epoch 1000. Best Metrics: (0.031687631702294744, 0.017704918032786888, 0.02845837909255878)
2026-05-23 01:02:49,403 - optuna.study.study - INFO - Trial 195 finished with values: [0.031687631702294744, 0.017704918032786888, 0.02845837909255878] and parameters: {'n_layers': 4, 'embedding_dim': 96, 'lr': 0.0006241453841646659, 'lambda_val': 5.5532012635423735e-06, 'batch_size': 939, 'optimizer': 'Adam'}.
2026-05-23 01:03:01,927 - optuna.study.study - INFO - Trial 196 finished with values: [0.0179819024602927, 0.011885245901639344, 0.01697021516359835] and parameters: {'n_layers': 2, 'embedding_dim': 128, 'lr': 0.0001298632816058999, 'lambda_val': 0.0001031838170332706, 'batch_size': 1304, 'optimizer': 'Adam'}.
2026-05-23 01:03:06,055 - experiment_functions - INFO - Early stopping at epoch 1200. Best Metrics: (0.031780738347080645, 0.01778688524590164, 0.025956280537961514)
2026-05-23 01:03:06,628 - optuna.study.study - INFO - Trial 197 finished with values: [0.031780738347080645, 0.01778688524590164, 0.025956280537961514] and parameters: {'n_layers': 3, 'embedding_dim': 96, 'lr': 0.00037164008089034755, 'lambda_val': 0.002925913642846577, 'batch_size': 903, 'optimizer': 'Adam'}.
2026-05-23 01:03:09,526 - experiment_functions - INFO - Early stopping at epoch 1000. Best Metrics: (0.038760309454538934, 0.021311475409836064, 0.030920506197356083)
2026-05-23 01:03:09,615 - optuna.study.study - INFO - Trial 198 finished with values: [0.038760309454538934, 0.021311475409836064, 0.030920506197356083] and parameters: {'n_layers': 2, 'embedding_dim': 64, 'lr': 0.0007442610977334545, 'lambda_val': 0.0005699959841252275, 'batch_size': 1254, 'optimizer': 'Adam'}.
2026-05-23 01:03:11,862 - experiment_functions - INFO - Early stopping at epoch 550. Best Metrics: (0.021871632078728862, 0.013196721311475411, 0.019824943018124666)
2026-05-23 01:03:11,987 - optuna.study.study - INFO - Trial 199 finished with values: [0.021871632078728862, 0.013196721311475411, 0.019824943018124666] and parameters: {'n_layers': 4, 'embedding_dim': 96, 'lr': 0.0012673220264025206, 'lambda_val': 0.00020972208651910077, 'batch_size': 1007, 'optimizer': 'RMSprop'}.
2026-05-23 01:03:23,468 - experiment_functions - INFO - Early stopping at epoch 1900. Best Metrics: (0.035474616655353536, 0.02057377049180328, 0.03116485858491198)
2026-05-23 01:03:24,453 - optuna.study.study - INFO - Trial 200 finished with values: [0.035474616655353536, 0.02057377049180328, 0.03116485858491198] and parameters: {'n_layers': 1, 'embedding_dim': 128, 'lr': 0.0004975305503445845, 'lambda_val': 0.003237223847988301, 'batch_size': 903, 'optimizer': 'RMSprop'}.
2026-05-23 01:03:30,395 - experiment_functions - INFO - Early stopping at epoch 1550. Best Metrics: (0.031150492848111676, 0.016885245901639347, 0.027393883290221462)
2026-05-23 01:03:30,477 - optuna.study.study - INFO - Trial 201 finished with values: [0.031150492848111676, 0.016885245901639347, 0.027393883290221462] and parameters: {'n_layers': 4, 'embedding_dim': 64, 'lr': 0.00034335523469639003, 'lambda_val': 0.0003391336234513702, 'batch_size': 1007, 'optimizer': 'Adam'}.
2026-05-23 01:03:35,057 - experiment_functions - INFO - Early stopping at epoch 1450. Best Metrics: (0.033785465208182354, 0.018852459016393444, 0.027730969232834957)
2026-05-23 01:03:35,127 - optuna.study.study - INFO - Trial 202 finished with values: [0.033785465208182354, 0.018852459016393444, 0.027730969232834957] and parameters: {'n_layers': 1, 'embedding_dim': 64, 'lr': 0.0007442610977334545, 'lambda_val': 0.0005699959841252275, 'batch_size': 1254, 'optimizer': 'Adam'}.
2026-05-23 01:03:38,440 - experiment_functions - INFO - Early stopping at epoch 900. Best Metrics: (0.03367359572740697, 0.017459016393442623, 0.027724532725529872)
2026-05-23 01:03:38,524 - optuna.study.study - INFO - Trial 203 finished with values: [0.03367359572740697, 0.017459016393442623, 0.027724532725529872] and parameters: {'n_layers': 1, 'embedding_dim': 64, 'lr': 0.0012673220264025206, 'lambda_val': 5.775336112034289e-05, 'batch_size': 1639, 'optimizer': 'Adam'}.
2026-05-23 01:03:42,435 - experiment_functions - INFO - Early stopping at epoch 1200. Best Metrics: (0.0305546427083326, 0.017704918032786888, 0.02883070722552634)
2026-05-23 01:03:43,218 - optuna.study.study - INFO - Trial 204 finished with values: [0.0305546427083326, 0.017704918032786888, 0.02883070722552634] and parameters: {'n_layers': 1, 'embedding_dim': 64, 'lr': 0.0012673220264025206, 'lambda_val': 0.0007172417291421626, 'batch_size': 903, 'optimizer': 'Adam'}.
2026-05-23 01:03:46,719 - experiment_functions - INFO - Early stopping at epoch 950. Best Metrics: (0.032937086569766905, 0.01918032786885246, 0.02688066402357523)
2026-05-23 01:03:47,322 - optuna.study.study - INFO - Trial 205 finished with values: [0.032937086569766905, 0.01918032786885246, 0.02688066402357523] and parameters: {'n_layers': 2, 'embedding_dim': 96, 'lr': 0.0007442610977334545, 'lambda_val': 0.0005699959841252275, 'batch_size': 939, 'optimizer': 'Adam'}.
2026-05-23 01:03:52,271 - experiment_functions - INFO - Early stopping at epoch 1400. Best Metrics: (0.03140803798920066, 0.01877049180327869, 0.027336700735249228)
2026-05-23 01:03:52,359 - optuna.study.study - INFO - Trial 206 finished with values: [0.03140803798920066, 0.01877049180327869, 0.027336700735249228] and parameters: {'n_layers': 3, 'embedding_dim': 96, 'lr': 0.0004975305503445845, 'lambda_val': 8.923547676789324e-05, 'batch_size': 521, 'optimizer': 'Adam'}.
2026-05-23 01:03:55,996 - experiment_functions - INFO - Early stopping at epoch 1050. Best Metrics: (0.03283579673903363, 0.018278688524590168, 0.02840100712671282)
2026-05-23 01:03:56,080 - optuna.study.study - INFO - Trial 207 finished with values: [0.03283579673903363, 0.018278688524590168, 0.02840100712671282] and parameters: {'n_layers': 1, 'embedding_dim': 96, 'lr': 0.0008732317857197807, 'lambda_val': 5.775336112034289e-05, 'batch_size': 2490, 'optimizer': 'Adam'}.
2026-05-23 01:04:00,192 - experiment_functions - INFO - Early stopping at epoch 1000. Best Metrics: (0.034669252057192, 0.018934426229508198, 0.030728258622303977)
2026-05-23 01:04:01,008 - optuna.study.study - INFO - Trial 208 finished with values: [0.034669252057192, 0.018934426229508198, 0.030728258622303977] and parameters: {'n_layers': 2, 'embedding_dim': 256, 'lr': 0.0006241453841646659, 'lambda_val': 5.228100030668519e-06, 'batch_size': 1079, 'optimizer': 'Adam'}.
2026-05-23 01:04:09,912 - experiment_functions - INFO - Early stopping at epoch 1050. Best Metrics: (0.02924803313335761, 0.019098360655737705, 0.026520486902195307)
2026-05-23 01:04:10,473 - optuna.study.study - INFO - Trial 209 finished with values: [0.02924803313335761, 0.019098360655737705, 0.026520486902195307] and parameters: {'n_layers': 1, 'embedding_dim': 64, 'lr': 0.0012673220264025206, 'lambda_val': 5.775336112034289e-05, 'batch_size': 939, 'optimizer': 'Adam'}.
2026-05-23 01:04:19,127 - experiment_functions - INFO - Early stopping at epoch 1300. Best Metrics: (0.035929487405232524, 0.018360655737704918, 0.030093471259997225)
2026-05-23 01:04:19,347 - optuna.study.study - INFO - Trial 210 finished with values: [0.035929487405232524, 0.018360655737704918, 0.030093471259997225] and parameters: {'n_layers': 1, 'embedding_dim': 96, 'lr': 0.0008732317857197807, 'lambda_val': 0.0007172417291421626, 'batch_size': 1588, 'optimizer': 'Adam'}.
2026-05-23 01:04:21,516 - experiment_functions - INFO - Early stopping at epoch 500. Best Metrics: (0.0014341007548818593, 0.001475409836065574, 0.0018924558025576312)
2026-05-23 01:04:21,604 - optuna.study.study - INFO - Trial 211 finished with values: [0.0014341007548818593, 0.001475409836065574, 0.0018924558025576312] and parameters: {'n_layers': 1, 'embedding_dim': 96, 'lr': 0.0007442610977334545, 'lambda_val': 1.2051712435160432e-05, 'batch_size': 3541, 'optimizer': 'SGD'}.
2026-05-23 01:04:26,741 - experiment_functions - INFO - Early stopping at epoch 1600. Best Metrics: (0.030594632054471223, 0.01836065573770492, 0.027897797289356187)
2026-05-23 01:04:27,227 - optuna.study.study - INFO - Trial 212 finished with values: [0.030594632054471223, 0.01836065573770492, 0.027897797289356187] and parameters: {'n_layers': 1, 'embedding_dim': 128, 'lr': 0.0006241453841646659, 'lambda_val': 0.00010898776228747154, 'batch_size': 1793, 'optimizer': 'Adam'}.
2026-05-23 01:04:33,053 - experiment_functions - INFO - Early stopping at epoch 1700. Best Metrics: (0.04210530482219227, 0.021475409836065572, 0.03439853915536026)
2026-05-23 01:04:33,300 - optuna.study.study - INFO - Trial 213 finished with values: [0.04210530482219227, 0.021475409836065572, 0.03439853915536026] and parameters: {'n_layers': 1, 'embedding_dim': 64, 'lr': 0.0006241453841646659, 'lambda_val': 0.006616376079935662, 'batch_size': 1254, 'optimizer': 'Adam'}.
2026-05-23 01:04:36,749 - experiment_functions - INFO - Early stopping at epoch 750. Best Metrics: (0.035912114771771336, 0.018442622950819675, 0.03024057128063566)
2026-05-23 01:04:36,966 - optuna.study.study - INFO - Trial 214 finished with values: [0.035912114771771336, 0.018442622950819675, 0.03024057128063566] and parameters: {'n_layers': 1, 'embedding_dim': 128, 'lr': 0.0034805464000646717, 'lambda_val': 0.0007172417291421626, 'batch_size': 971, 'optimizer': 'Adam'}.
2026-05-23 01:04:39,832 - experiment_functions - INFO - Early stopping at epoch 550. Best Metrics: (0.029525603578182895, 0.015327868852459018, 0.024866884651985225)
2026-05-23 01:04:39,914 - optuna.study.study - INFO - Trial 215 finished with values: [0.029525603578182895, 0.015327868852459018, 0.024866884651985225] and parameters: {'n_layers': 3, 'embedding_dim': 64, 'lr': 0.006713623542902461, 'lambda_val': 0.0007172417291421626, 'batch_size': 1588, 'optimizer': 'Adam'}.
2026-05-23 01:04:47,625 - experiment_functions - INFO - Early stopping at epoch 2400. Best Metrics: (0.032473502512198625, 0.018360655737704918, 0.028547527737498232)
2026-05-23 01:04:47,738 - optuna.study.study - INFO - Trial 216 finished with values: [0.032473502512198625, 0.018360655737704918, 0.028547527737498232] and parameters: {'n_layers': 1, 'embedding_dim': 96, 'lr': 0.00037164008089034755, 'lambda_val': 5.5532012635423735e-06, 'batch_size': 2490, 'optimizer': 'Adam'}.
2026-05-23 01:04:56,031 - experiment_functions - INFO - Early stopping at epoch 2600. Best Metrics: (0.032671938719006414, 0.019426229508196724, 0.02735720204281441)
2026-05-23 01:04:56,249 - optuna.study.study - INFO - Trial 217 finished with values: [0.032671938719006414, 0.019426229508196724, 0.02735720204281441] and parameters: {'n_layers': 1, 'embedding_dim': 128, 'lr': 0.0004014419530027751, 'lambda_val': 1.2051712435160432e-05, 'batch_size': 3011, 'optimizer': 'Adam'}.
2026-05-23 01:04:59,908 - experiment_functions - INFO - Early stopping at epoch 850. Best Metrics: (0.02784336269822264, 0.016475409836065574, 0.024914841706199172)
2026-05-23 01:04:59,979 - optuna.study.study - INFO - Trial 218 finished with values: [0.02784336269822264, 0.016475409836065574, 0.024914841706199172] and parameters: {'n_layers': 1, 'embedding_dim': 32, 'lr': 0.0030767169926472077, 'lambda_val': 8.923547676789324e-05, 'batch_size': 1623, 'optimizer': 'Adam'}.
2026-05-23 01:05:03,623 - experiment_functions - INFO - Early stopping at epoch 1050. Best Metrics: (0.034284579035323046, 0.01959016393442623, 0.029825002715430187)
2026-05-23 01:05:04,250 - optuna.study.study - INFO - Trial 219 finished with values: [0.034284579035323046, 0.01959016393442623, 0.029825002715430187] and parameters: {'n_layers': 1, 'embedding_dim': 128, 'lr': 0.0012673220264025206, 'lambda_val': 0.00010898776228747154, 'batch_size': 1639, 'optimizer': 'Adam'}.
2026-05-23 01:05:08,136 - experiment_functions - INFO - Early stopping at epoch 1050. Best Metrics: (0.03185191141957446, 0.01918032786885246, 0.027848362784985526)
2026-05-23 01:05:08,528 - optuna.study.study - INFO - Trial 220 finished with values: [0.03185191141957446, 0.01918032786885246, 0.027848362784985526] and parameters: {'n_layers': 3, 'embedding_dim': 64, 'lr': 0.0006241453841646659, 'lambda_val': 5.228100030668519e-06, 'batch_size': 939, 'optimizer': 'Adam'}.
2026-05-23 01:05:11,016 - experiment_functions - INFO - Early stopping at epoch 550. Best Metrics: (0.0019708379956947814, 0.001639344262295082, 0.002353663503790414)
2026-05-23 01:05:11,104 - optuna.study.study - INFO - Trial 221 finished with values: [0.0019708379956947814, 0.001639344262295082, 0.002353663503790414] and parameters: {'n_layers': 1, 'embedding_dim': 128, 'lr': 1.5538925991454077e-05, 'lambda_val': 5.775336112034289e-05, 'batch_size': 1639, 'optimizer': 'Adam'}.
2026-05-23 01:05:14,220 - experiment_functions - INFO - Early stopping at epoch 600. Best Metrics: (0.03737022735435422, 0.019098360655737702, 0.029789021120271483)
2026-05-23 01:05:14,357 - optuna.study.study - INFO - Trial 222 finished with values: [0.03737022735435422, 0.019098360655737702, 0.029789021120271483] and parameters: {'n_layers': 2, 'embedding_dim': 256, 'lr': 0.0008732317857197807, 'lambda_val': 8.923547676789324e-05, 'batch_size': 3177, 'optimizer': 'RMSprop'}.
2026-05-23 01:05:19,767 - experiment_functions - INFO - Early stopping at epoch 1500. Best Metrics: (0.02389420243908305, 0.017295081967213115, 0.0228692064729826)
2026-05-23 01:05:20,268 - optuna.study.study - INFO - Trial 223 finished with values: [0.02389420243908305, 0.017295081967213115, 0.0228692064729826] and parameters: {'n_layers': 3, 'embedding_dim': 96, 'lr': 0.00034335523469639003, 'lambda_val': 0.004686874294387785, 'batch_size': 2004, 'optimizer': 'Adam'}.
2026-05-23 01:05:25,800 - experiment_functions - INFO - Early stopping at epoch 1600. Best Metrics: (0.03075731271758443, 0.016967213114754097, 0.025228579209025218)
2026-05-23 01:05:25,890 - optuna.study.study - INFO - Trial 224 finished with values: [0.03075731271758443, 0.016967213114754097, 0.025228579209025218] and parameters: {'n_layers': 3, 'embedding_dim': 96, 'lr': 0.00034335523469639003, 'lambda_val': 0.0007172417291421626, 'batch_size': 951, 'optimizer': 'Adam'}.
2026-05-23 01:05:30,254 - experiment_functions - INFO - Early stopping at epoch 1250. Best Metrics: (0.030753052855317254, 0.017950819672131146, 0.026203904632998386)
2026-05-23 01:05:30,348 - optuna.study.study - INFO - Trial 225 finished with values: [0.030753052855317254, 0.017950819672131146, 0.026203904632998386] and parameters: {'n_layers': 1, 'embedding_dim': 128, 'lr': 0.0006241453841646659, 'lambda_val': 0.00010898776228747154, 'batch_size': 3985, 'optimizer': 'Adam'}.
2026-05-23 01:05:33,314 - experiment_functions - INFO - Early stopping at epoch 650. Best Metrics: (0.02565128005922382, 0.015983606557377048, 0.02352146077109024)
2026-05-23 01:05:34,307 - optuna.study.study - INFO - Trial 226 finished with values: [0.02565128005922382, 0.015983606557377048, 0.02352146077109024] and parameters: {'n_layers': 4, 'embedding_dim': 96, 'lr': 0.0006997302727889885, 'lambda_val': 5.228100030668519e-06, 'batch_size': 1079, 'optimizer': 'RMSprop'}.
2026-05-23 01:05:38,451 - experiment_functions - INFO - Early stopping at epoch 700. Best Metrics: (0.026088359333227777, 0.015409836065573772, 0.022294127688883187)
2026-05-23 01:05:39,747 - optuna.study.study - INFO - Trial 227 finished with values: [0.026088359333227777, 0.015409836065573772, 0.022294127688883187] and parameters: {'n_layers': 3, 'embedding_dim': 256, 'lr': 0.0007442610977334545, 'lambda_val': 0.004686874294387785, 'batch_size': 3403, 'optimizer': 'Adam'}.
2026-05-23 01:05:42,730 - experiment_functions - INFO - Early stopping at epoch 750. Best Metrics: (0.018236339141897154, 0.0119672131147541, 0.016864049619804363)
2026-05-23 01:05:42,826 - optuna.study.study - INFO - Trial 228 finished with values: [0.018236339141897154, 0.0119672131147541, 0.016864049619804363] and parameters: {'n_layers': 2, 'embedding_dim': 96, 'lr': 0.0008732317857197807, 'lambda_val': 0.03309514335613204, 'batch_size': 2861, 'optimizer': 'Adam'}.
2026-05-23 01:05:46,374 - experiment_functions - INFO - Early stopping at epoch 1000. Best Metrics: (0.033014277129529444, 0.019836065573770493, 0.029281286556883723)
