2026-05-23 06:27:30,650 - optuna.study.study - INFO - Trial 43 finished with values: [0.04295028970511865, 0.0219672131147541, 0.03590706805420572] and parameters: {'n_layers': 1, 'embedding_dim': 32, 'lr': 0.0007958391483531121, 'lambda_val': 0.001962445290785147, 'batch_size': 3522, 'optimizer': 'Adam'}.
2026-05-23 06:27:33,012 - experiment_functions - INFO - Early stopping at epoch 550. Best Metrics: (0.02183002220236457, 0.012704918032786885, 0.018771259739533083)
2026-05-23 06:27:33,106 - optuna.study.study - INFO - Trial 44 finished with values: [0.02183002220236457, 0.012704918032786885, 0.018771259739533083] and parameters: {'n_layers': 2, 'embedding_dim': 128, 'lr': 0.016055862829867446, 'lambda_val': 0.0001113007697008233, 'batch_size': 542, 'optimizer': 'Adam'}.
2026-05-23 06:27:35,627 - experiment_functions - INFO - Early stopping at epoch 500. Best Metrics: (0.00144432481404252, 0.0010655737704918034, 0.0013415272506293882)
2026-05-23 06:27:35,794 - optuna.study.study - INFO - Trial 45 finished with values: [0.00144432481404252, 0.0010655737704918034, 0.0013415272506293882] and parameters: {'n_layers': 4, 'embedding_dim': 64, 'lr': 2.1907091997348804e-05, 'lambda_val': 1.255276364035186e-06, 'batch_size': 4081, 'optimizer': 'SGD'}.
2026-05-23 06:27:38,069 - experiment_functions - INFO - Early stopping at epoch 500. Best Metrics: (0.003960480852222491, 0.002295081967213115, 0.0036076790579376338)
2026-05-23 06:27:38,210 - optuna.study.study - INFO - Trial 46 finished with values: [0.003960480852222491, 0.002295081967213115, 0.0036076790579376338] and parameters: {'n_layers': 2, 'embedding_dim': 96, 'lr': 5.455369202879794e-05, 'lambda_val': 0.019875096772089606, 'batch_size': 1762, 'optimizer': 'SGD'}.
2026-05-23 06:27:40,538 - experiment_functions - INFO - Early stopping at epoch 550. Best Metrics: (0.0448709619214237, 0.022213114754098363, 0.03386206090149293)
2026-05-23 06:27:40,687 - optuna.study.study - INFO - Trial 47 finished with values: [0.0448709619214237, 0.022213114754098363, 0.03386206090149293] and parameters: {'n_layers': 2, 'embedding_dim': 128, 'lr': 0.005575586908390307, 'lambda_val': 2.2332391286564103e-05, 'batch_size': 2289, 'optimizer': 'Adam'}.
2026-05-23 06:27:43,501 - experiment_functions - INFO - Early stopping at epoch 750. Best Metrics: (0.0015235607219342964, 0.0018032786885245904, 0.0019897632645575706)
2026-05-23 06:27:43,585 - optuna.study.study - INFO - Trial 48 finished with values: [0.0015235607219342964, 0.0018032786885245904, 0.0019897632645575706] and parameters: {'n_layers': 3, 'embedding_dim': 128, 'lr': 1.4928636159858114e-05, 'lambda_val': 0.029237778274219983, 'batch_size': 2284, 'optimizer': 'RMSprop'}.
2026-05-23 06:27:46,999 - experiment_functions - INFO - Early stopping at epoch 1000. Best Metrics: (0.010940630514072408, 0.0072131147540983615, 0.008794615251683688)
2026-05-23 06:27:47,068 - optuna.study.study - INFO - Trial 49 finished with values: [0.010940630514072408, 0.0072131147540983615, 0.008794615251683688] and parameters: {'n_layers': 3, 'embedding_dim': 96, 'lr': 0.029359450332429586, 'lambda_val': 0.014341404304443264, 'batch_size': 2509, 'optimizer': 'Adam'}.
2026-05-23 06:28:00,109 - optuna.study.study - INFO - Trial 50 finished with values: [0.02978152809801059, 0.015655737704918033, 0.022843840651531944] and parameters: {'n_layers': 4, 'embedding_dim': 128, 'lr': 8.981382437399417e-05, 'lambda_val': 0.0001113007697008233, 'batch_size': 542, 'optimizer': 'Adam'}.
2026-05-23 06:28:04,878 - experiment_functions - INFO - Early stopping at epoch 950. Best Metrics: (0.03529733028868863, 0.01877049180327869, 0.02732037421714197)
2026-05-23 06:28:04,957 - optuna.study.study - INFO - Trial 51 finished with values: [0.03529733028868863, 0.01877049180327869, 0.02732037421714197] and parameters: {'n_layers': 3, 'embedding_dim': 256, 'lr': 0.0002779300422306739, 'lambda_val': 6.689493347784772e-06, 'batch_size': 2551, 'optimizer': 'RMSprop'}.
2026-05-23 06:28:09,142 - experiment_functions - INFO - Early stopping at epoch 1000. Best Metrics: (0.020405269386783637, 0.0119672131147541, 0.017616104188327434)
2026-05-23 06:28:09,226 - optuna.study.study - INFO - Trial 52 finished with values: [0.020405269386783637, 0.0119672131147541, 0.017616104188327434] and parameters: {'n_layers': 2, 'embedding_dim': 256, 'lr': 0.004418626896496276, 'lambda_val': 0.0015968336491314992, 'batch_size': 1555, 'optimizer': 'RMSprop'}.
2026-05-23 06:28:12,423 - experiment_functions - INFO - Early stopping at epoch 850. Best Metrics: (0.015168118762928812, 0.007868852459016395, 0.012367123663936889)
2026-05-23 06:28:13,079 - optuna.study.study - INFO - Trial 53 finished with values: [0.015168118762928812, 0.007868852459016395, 0.012367123663936889] and parameters: {'n_layers': 3, 'embedding_dim': 64, 'lr': 0.016320210842073777, 'lambda_val': 3.6543758813358244e-05, 'batch_size': 2109, 'optimizer': 'Adam'}.
2026-05-23 06:28:17,960 - experiment_functions - INFO - Early stopping at epoch 1250. Best Metrics: (0.04227502231531034, 0.023770491803278688, 0.03668039799842418)
2026-05-23 06:28:18,292 - optuna.study.study - INFO - Trial 54 finished with values: [0.04227502231531034, 0.023770491803278688, 0.03668039799842418] and parameters: {'n_layers': 3, 'embedding_dim': 96, 'lr': 0.0003566130628047912, 'lambda_val': 2.1070395102311856e-06, 'batch_size': 2413, 'optimizer': 'Adam'}.
2026-05-23 06:28:21,283 - experiment_functions - INFO - Early stopping at epoch 700. Best Metrics: (0.05141982812877209, 0.025491803278688524, 0.041452179118014916)
2026-05-23 06:28:21,367 - optuna.study.study - INFO - Trial 55 finished with values: [0.05141982812877209, 0.025491803278688524, 0.041452179118014916] and parameters: {'n_layers': 1, 'embedding_dim': 256, 'lr': 0.0017722025353666335, 'lambda_val': 4.470892478605119e-05, 'batch_size': 1555, 'optimizer': 'Adam'}.
2026-05-23 06:28:27,110 - experiment_functions - INFO - Early stopping at epoch 500. Best Metrics: (0.0006184791085774209, 0.0009016393442622952, 0.0011524415593363404)
2026-05-23 06:28:27,847 - optuna.study.study - INFO - Trial 56 finished with values: [0.0006184791085774209, 0.0009016393442622952, 0.0011524415593363404] and parameters: {'n_layers': 1, 'embedding_dim': 64, 'lr': 8.981382437399417e-05, 'lambda_val': 0.043481245710212134, 'batch_size': 3383, 'optimizer': 'SGD'}.
2026-05-23 06:28:38,964 - experiment_functions - INFO - Early stopping at epoch 2050. Best Metrics: (0.0019089960883881675, 0.001967213114754099, 0.002815074385542394)
2026-05-23 06:28:39,185 - optuna.study.study - INFO - Trial 57 finished with values: [0.0019089960883881675, 0.001967213114754099, 0.002815074385542394] and parameters: {'n_layers': 3, 'embedding_dim': 64, 'lr': 1.4511575894668017e-05, 'lambda_val': 8.426971232182995e-05, 'batch_size': 2109, 'optimizer': 'Adam'}.
2026-05-23 06:28:40,968 - experiment_functions - INFO - Early stopping at epoch 500. Best Metrics: (0.0015805522317879426, 0.001475409836065574, 0.0018839530165174643)
2026-05-23 06:28:41,100 - optuna.study.study - INFO - Trial 58 finished with values: [0.0015805522317879426, 0.001475409836065574, 0.0018839530165174643] and parameters: {'n_layers': 1, 'embedding_dim': 64, 'lr': 0.0001681912395064878, 'lambda_val': 0.045648551437508594, 'batch_size': 1555, 'optimizer': 'SGD'}.
2026-05-23 06:28:43,463 - experiment_functions - INFO - Early stopping at epoch 550. Best Metrics: (0.02959319283913585, 0.015901639344262298, 0.02605872013732937)
2026-05-23 06:28:43,549 - optuna.study.study - INFO - Trial 59 finished with values: [0.02959319283913585, 0.015901639344262298, 0.02605872013732937] and parameters: {'n_layers': 1, 'embedding_dim': 96, 'lr': 0.029359450332429586, 'lambda_val': 6.689493347784772e-06, 'batch_size': 1405, 'optimizer': 'Adam'}.
2026-05-23 06:28:50,891 - experiment_functions - INFO - Early stopping at epoch 2200. Best Metrics: (0.03207220865368496, 0.017459016393442623, 0.026155787326163128)
2026-05-23 06:28:51,106 - optuna.study.study - INFO - Trial 60 finished with values: [0.03207220865368496, 0.017459016393442623, 0.026155787326163128] and parameters: {'n_layers': 1, 'embedding_dim': 64, 'lr': 0.048413276973233305, 'lambda_val': 0.013840432502784892, 'batch_size': 3624, 'optimizer': 'Adam'}.
2026-05-23 06:29:04,533 - optuna.study.study - INFO - Trial 61 finished with values: [0.04550458306369763, 0.02237704918032787, 0.03904500118473684] and parameters: {'n_layers': 2, 'embedding_dim': 128, 'lr': 0.0001681912395064878, 'lambda_val': 1.3238653697855508e-06, 'batch_size': 2489, 'optimizer': 'RMSprop'}.
2026-05-23 06:29:08,996 - experiment_functions - INFO - Early stopping at epoch 1200. Best Metrics: (0.0036116532419560405, 0.0018032786885245904, 0.003418305307426582)
2026-05-23 06:29:09,102 - optuna.study.study - INFO - Trial 62 finished with values: [0.0036116532419560405, 0.0018032786885245904, 0.003418305307426582] and parameters: {'n_layers': 2, 'embedding_dim': 128, 'lr': 2.4525019799682178e-05, 'lambda_val': 3.8964278872552114e-05, 'batch_size': 2824, 'optimizer': 'Adam'}.
2026-05-23 06:29:12,650 - experiment_functions - INFO - Early stopping at epoch 950. Best Metrics: (0.0018890080242865122, 0.001639344262295082, 0.0024783229479678264)
2026-05-23 06:29:13,823 - optuna.study.study - INFO - Trial 63 finished with values: [0.0018890080242865122, 0.001639344262295082, 0.0024783229479678264] and parameters: {'n_layers': 2, 'embedding_dim': 128, 'lr': 1.4928636159858114e-05, 'lambda_val': 0.029237778274219983, 'batch_size': 916, 'optimizer': 'RMSprop'}.
2026-05-23 06:29:17,617 - experiment_functions - INFO - Early stopping at epoch 1000. Best Metrics: (0.012033974348077427, 0.009016393442622951, 0.012960153854354423)
2026-05-23 06:29:18,638 - optuna.study.study - INFO - Trial 64 finished with values: [0.012033974348077427, 0.009016393442622951, 0.012960153854354423] and parameters: {'n_layers': 1, 'embedding_dim': 256, 'lr': 0.08713770899067318, 'lambda_val': 4.470892478605119e-05, 'batch_size': 1555, 'optimizer': 'Adam'}.
2026-05-23 06:29:21,814 - experiment_functions - INFO - Early stopping at epoch 750. Best Metrics: (0.03869188088184631, 0.01991803278688525, 0.030133198625590482)
2026-05-23 06:29:21,883 - optuna.study.study - INFO - Trial 65 finished with values: [0.03869188088184631, 0.01991803278688525, 0.030133198625590482] and parameters: {'n_layers': 3, 'embedding_dim': 96, 'lr': 0.0008759436093290035, 'lambda_val': 0.0018827383963552864, 'batch_size': 2085, 'optimizer': 'Adam'}.
2026-05-23 06:29:25,431 - experiment_functions - INFO - Early stopping at epoch 800. Best Metrics: (0.04059401757943115, 0.022295081967213116, 0.033507896422963424)
2026-05-23 06:29:25,577 - optuna.study.study - INFO - Trial 66 finished with values: [0.04059401757943115, 0.022295081967213116, 0.033507896422963424] and parameters: {'n_layers': 2, 'embedding_dim': 256, 'lr': 0.0004152932764115524, 'lambda_val': 0.0015968336491314992, 'batch_size': 2094, 'optimizer': 'RMSprop'}.
2026-05-23 06:29:31,485 - experiment_functions - INFO - Early stopping at epoch 750. Best Metrics: (0.009493016188721906, 0.0069672131147540985, 0.009657171784103517)
2026-05-23 06:29:32,157 - optuna.study.study - INFO - Trial 67 finished with values: [0.009493016188721906, 0.0069672131147540985, 0.009657171784103517] and parameters: {'n_layers': 4, 'embedding_dim': 128, 'lr': 0.0003566130628047912, 'lambda_val': 0.04473436801113999, 'batch_size': 2413, 'optimizer': 'RMSprop'}.
2026-05-23 06:29:40,476 - experiment_functions - INFO - Early stopping at epoch 550. Best Metrics: (0.018524403301544916, 0.01237704918032787, 0.018064124882558253)
2026-05-23 06:29:41,115 - optuna.study.study - INFO - Trial 68 finished with values: [0.018524403301544916, 0.01237704918032787, 0.018064124882558253] and parameters: {'n_layers': 2, 'embedding_dim': 128, 'lr': 0.016055862829867446, 'lambda_val': 0.0001113007697008233, 'batch_size': 542, 'optimizer': 'Adam'}.
2026-05-23 06:29:46,625 - experiment_functions - INFO - Early stopping at epoch 1150. Best Metrics: (0.01463762713592147, 0.008360655737704918, 0.012811856493463187)
2026-05-23 06:29:46,709 - optuna.study.study - INFO - Trial 69 finished with values: [0.01463762713592147, 0.008360655737704918, 0.012811856493463187] and parameters: {'n_layers': 3, 'embedding_dim': 96, 'lr': 0.029359450332429586, 'lambda_val': 8.18222862106426e-05, 'batch_size': 2509, 'optimizer': 'Adam'}.
2026-05-23 06:29:51,011 - experiment_functions - INFO - Early stopping at epoch 1000. Best Metrics: (0.04887105645365935, 0.025901639344262296, 0.042091130350247676)
2026-05-23 06:29:51,498 - optuna.study.study - INFO - Trial 70 finished with values: [0.04887105645365935, 0.025901639344262296, 0.042091130350247676] and parameters: {'n_layers': 1, 'embedding_dim': 256, 'lr': 0.0008759436093290035, 'lambda_val': 4.470892478605119e-05, 'batch_size': 1555, 'optimizer': 'Adam'}.
2026-05-23 06:29:53,912 - experiment_functions - INFO - Early stopping at epoch 550. Best Metrics: (0.012035367020341548, 0.007131147540983606, 0.01030995437977001)
2026-05-23 06:29:54,008 - optuna.study.study - INFO - Trial 71 finished with values: [0.012035367020341548, 0.007131147540983606, 0.01030995437977001] and parameters: {'n_layers': 2, 'embedding_dim': 128, 'lr': 0.06136195989867191, 'lambda_val': 3.2328485230063465e-06, 'batch_size': 1510, 'optimizer': 'Adam'}.
2026-05-23 06:30:00,035 - experiment_functions - INFO - Early stopping at epoch 1750. Best Metrics: (0.0175429857304001, 0.012540983606557378, 0.016365561280779345)
2026-05-23 06:30:01,179 - optuna.study.study - INFO - Trial 72 finished with values: [0.0175429857304001, 0.012540983606557378, 0.016365561280779345] and parameters: {'n_layers': 2, 'embedding_dim': 32, 'lr': 0.06136195989867191, 'lambda_val': 0.0010960072481100915, 'batch_size': 2659, 'optimizer': 'Adam'}.
2026-05-23 06:30:04,937 - experiment_functions - INFO - Early stopping at epoch 1000. Best Metrics: (0.005308275779264128, 0.0057377049180327875, 0.007597521362234651)
2026-05-23 06:30:05,964 - optuna.study.study - INFO - Trial 73 finished with values: [0.005308275779264128, 0.0057377049180327875, 0.007597521362234651] and parameters: {'n_layers': 2, 'embedding_dim': 32, 'lr': 0.006511379953096499, 'lambda_val': 0.07032486646002754, 'batch_size': 2546, 'optimizer': 'Adam'}.
2026-05-23 06:30:11,649 - experiment_functions - INFO - Early stopping at epoch 1550. Best Metrics: (0.012119880082331651, 0.007868852459016395, 0.010291461694473073)
2026-05-23 06:30:11,971 - optuna.study.study - INFO - Trial 74 finished with values: [0.012119880082331651, 0.007868852459016395, 0.010291461694473073] and parameters: {'n_layers': 4, 'embedding_dim': 64, 'lr': 0.06546984660095233, 'lambda_val': 0.0001113007697008233, 'batch_size': 2109, 'optimizer': 'Adam'}.
2026-05-23 06:30:16,630 - experiment_functions - INFO - Early stopping at epoch 1400. Best Metrics: (0.05104556067167939, 0.023278688524590162, 0.03967623480835065)
2026-05-23 06:30:17,863 - optuna.study.study - INFO - Trial 75 finished with values: [0.05104556067167939, 0.023278688524590162, 0.03967623480835065] and parameters: {'n_layers': 1, 'embedding_dim': 32, 'lr': 0.000664690953252874, 'lambda_val': 0.0018827383963552864, 'batch_size': 3522, 'optimizer': 'Adam'}.
2026-05-23 06:30:20,127 - experiment_functions - INFO - Early stopping at epoch 500. Best Metrics: (0.0010251405595218584, 0.0014754098360655738, 0.0016815931116745133)
2026-05-23 06:30:21,140 - optuna.study.study - INFO - Trial 76 finished with values: [0.0010251405595218584, 0.0014754098360655738, 0.0016815931116745133] and parameters: {'n_layers': 1, 'embedding_dim': 256, 'lr': 6.850762248123774e-05, 'lambda_val': 0.0005103737914204569, 'batch_size': 3383, 'optimizer': 'SGD'}.
2026-05-23 06:30:24,150 - experiment_functions - INFO - Early stopping at epoch 750. Best Metrics: (0.048832017654439015, 0.022213114754098363, 0.03874612925108146)
2026-05-23 06:30:24,219 - optuna.study.study - INFO - Trial 77 finished with values: [0.048832017654439015, 0.022213114754098363, 0.03874612925108146] and parameters: {'n_layers': 1, 'embedding_dim': 128, 'lr': 0.0016352707212588652, 'lambda_val': 0.000103341905197294, 'batch_size': 3647, 'optimizer': 'Adam'}.
2026-05-23 06:30:36,578 - optuna.study.study - INFO - Trial 78 finished with values: [0.03777654243967982, 0.020491803278688523, 0.030717929354346446] and parameters: {'n_layers': 3, 'embedding_dim': 32, 'lr': 0.0003566130628047912, 'lambda_val': 2.388546090615206e-05, 'batch_size': 941, 'optimizer': 'Adam'}.
2026-05-23 06:30:40,899 - experiment_functions - INFO - Early stopping at epoch 500. Best Metrics: (0.003398621254994958, 0.001639344262295082, 0.0032647272247501745)
2026-05-23 06:30:41,315 - optuna.study.study - INFO - Trial 79 finished with values: [0.003398621254994958, 0.001639344262295082, 0.0032647272247501745] and parameters: {'n_layers': 2, 'embedding_dim': 32, 'lr': 0.005575586908390307, 'lambda_val': 1.0124028722173646e-06, 'batch_size': 752, 'optimizer': 'SGD'}.
2026-05-23 06:30:48,742 - experiment_functions - INFO - Early stopping at epoch 550. Best Metrics: (0.022604974865581794, 0.014508196721311479, 0.019835015459493836)
2026-05-23 06:30:49,260 - optuna.study.study - INFO - Trial 80 finished with values: [0.022604974865581794, 0.014508196721311479, 0.019835015459493836] and parameters: {'n_layers': 2, 'embedding_dim': 32, 'lr': 0.016055862829867446, 'lambda_val': 3.2328485230063465e-06, 'batch_size': 542, 'optimizer': 'Adam'}.
2026-05-23 06:31:03,766 - optuna.study.study - INFO - Trial 81 finished with values: [0.004486894859047107, 0.0042622950819672135, 0.005747193007704258] and parameters: {'n_layers': 2, 'embedding_dim': 96, 'lr': 4.2308586940121026e-05, 'lambda_val': 6.689493347784772e-06, 'batch_size': 2546, 'optimizer': 'Adam'}.
2026-05-23 06:31:07,552 - experiment_functions - INFO - Early stopping at epoch 950. Best Metrics: (0.031562443810099414, 0.017540983606557377, 0.027219210462377023)
2026-05-23 06:31:07,762 - optuna.study.study - INFO - Trial 82 finished with values: [0.031562443810099414, 0.017540983606557377, 0.027219210462377023] and parameters: {'n_layers': 3, 'embedding_dim': 32, 'lr': 0.0007958391483531121, 'lambda_val': 1.3238653697855508e-06, 'batch_size': 3522, 'optimizer': 'Adam'}.
2026-05-23 06:31:23,413 - optuna.study.study - INFO - Trial 83 finished with values: [0.020312293488505755, 0.013852459016393441, 0.020361166097561043] and parameters: {'n_layers': 4, 'embedding_dim': 128, 'lr': 8.981382437399417e-05, 'lambda_val': 0.0005103737914204569, 'batch_size': 3478, 'optimizer': 'Adam'}.
2026-05-23 06:31:27,339 - experiment_functions - INFO - Early stopping at epoch 900. Best Metrics: (0.04448942535195566, 0.02262295081967213, 0.03706248575512365)
2026-05-23 06:31:27,432 - optuna.study.study - INFO - Trial 84 finished with values: [0.04448942535195566, 0.02262295081967213, 0.03706248575512365] and parameters: {'n_layers': 2, 'embedding_dim': 256, 'lr': 0.000664690953252874, 'lambda_val': 0.0018827383963552864, 'batch_size': 642, 'optimizer': 'Adam'}.
2026-05-23 06:31:30,477 - experiment_functions - INFO - Early stopping at epoch 500. Best Metrics: (0.002512640739053846, 0.0013114754098360656, 0.002510668341415262)
2026-05-23 06:31:30,845 - optuna.study.study - INFO - Trial 85 finished with values: [0.002512640739053846, 0.0013114754098360656, 0.002510668341415262] and parameters: {'n_layers': 4, 'embedding_dim': 256, 'lr': 8.981382437399417e-05, 'lambda_val': 0.0005103737914204569, 'batch_size': 3383, 'optimizer': 'SGD'}.
2026-05-23 06:31:35,603 - experiment_functions - INFO - Early stopping at epoch 1300. Best Metrics: (0.039436927539495924, 0.019918032786885247, 0.035122294599159574)
2026-05-23 06:31:36,099 - optuna.study.study - INFO - Trial 86 finished with values: [0.039436927539495924, 0.019918032786885247, 0.035122294599159574] and parameters: {'n_layers': 3, 'embedding_dim': 32, 'lr': 0.000664690953252874, 'lambda_val': 2.8054741806304403e-06, 'batch_size': 2991, 'optimizer': 'Adam'}.
2026-05-23 06:31:44,616 - experiment_functions - INFO - Early stopping at epoch 3100. Best Metrics: (0.05266484890732835, 0.025081967213114755, 0.04190339825443521)
2026-05-23 06:31:44,705 - optuna.study.study - INFO - Trial 87 finished with values: [0.05266484890732835, 0.025081967213114755, 0.04190339825443521] and parameters: {'n_layers': 1, 'embedding_dim': 96, 'lr': 0.000664690953252874, 'lambda_val': 0.0018827383963552864, 'batch_size': 724, 'optimizer': 'Adam'}.
2026-05-23 06:31:46,759 - experiment_functions - INFO - Early stopping at epoch 550. Best Metrics: (0.038291485793477034, 0.020081967213114754, 0.0316044306773973)
2026-05-23 06:31:47,138 - optuna.study.study - INFO - Trial 88 finished with values: [0.038291485793477034, 0.020081967213114754, 0.0316044306773973] and parameters: {'n_layers': 1, 'embedding_dim': 96, 'lr': 0.013868600017201397, 'lambda_val': 3.822612857526585e-06, 'batch_size': 941, 'optimizer': 'Adam'}.
2026-05-23 06:31:51,933 - experiment_functions - INFO - Early stopping at epoch 600. Best Metrics: (0.02033739686642754, 0.01377049180327869, 0.020082801491276166)
2026-05-23 06:31:52,265 - optuna.study.study - INFO - Trial 89 finished with values: [0.02033739686642754, 0.01377049180327869, 0.020082801491276166] and parameters: {'n_layers': 3, 'embedding_dim': 64, 'lr': 0.0014308085114682584, 'lambda_val': 1.0018000488570144e-06, 'batch_size': 3209, 'optimizer': 'Adam'}.
2026-05-23 06:32:05,260 - experiment_functions - INFO - Early stopping at epoch 2200. Best Metrics: (0.006728886180039636, 0.005327868852459016, 0.0063048569895749204)
