2026-05-23 01:17:32,264 - optuna.study.study - INFO - Trial 68 finished with values: [0.003893399118308827, 0.004426229508196722, 0.0055093782281244045] and parameters: {'n_layers': 4, 'embedding_dim': 64, 'lr': 0.0181553252436734, 'lambda_val': 0.0472767292805195, 'batch_size': 3684, 'optimizer': 'RMSprop'}.
2026-05-23 01:17:36,692 - experiment_functions - INFO - Early stopping at epoch 950. Best Metrics: (0.03269032613721569, 0.01909836065573771, 0.02733932444077097)
2026-05-23 01:17:36,793 - optuna.study.study - INFO - Trial 69 finished with values: [0.03269032613721569, 0.01909836065573771, 0.02733932444077097] and parameters: {'n_layers': 3, 'embedding_dim': 96, 'lr': 0.0006071804751429957, 'lambda_val': 7.202525708659488e-05, 'batch_size': 1088, 'optimizer': 'RMSprop'}.
2026-05-23 01:17:39,113 - experiment_functions - INFO - Early stopping at epoch 550. Best Metrics: (0.016906858135680106, 0.009918032786885246, 0.013726790418054295)
2026-05-23 01:17:39,215 - optuna.study.study - INFO - Trial 70 finished with values: [0.016906858135680106, 0.009918032786885246, 0.013726790418054295] and parameters: {'n_layers': 2, 'embedding_dim': 64, 'lr': 0.010275728897055822, 'lambda_val': 1.150702232586112e-06, 'batch_size': 2134, 'optimizer': 'RMSprop'}.
2026-05-23 01:17:41,681 - experiment_functions - INFO - Early stopping at epoch 550. Best Metrics: (0.025814383024488085, 0.015081967213114757, 0.02367326237253861)
2026-05-23 01:17:41,770 - optuna.study.study - INFO - Trial 71 finished with values: [0.025814383024488085, 0.015081967213114757, 0.02367326237253861] and parameters: {'n_layers': 1, 'embedding_dim': 96, 'lr': 0.0033679369179454638, 'lambda_val': 0.0004948769403467439, 'batch_size': 3882, 'optimizer': 'RMSprop'}.
2026-05-23 01:17:45,129 - experiment_functions - INFO - Early stopping at epoch 800. Best Metrics: (0.007055218111832492, 0.0051639344262295085, 0.007404750854469131)
2026-05-23 01:17:46,982 - optuna.study.study - INFO - Trial 72 finished with values: [0.007055218111832492, 0.0051639344262295085, 0.007404750854469131] and parameters: {'n_layers': 4, 'embedding_dim': 32, 'lr': 0.01906241459999901, 'lambda_val': 0.00623041921481539, 'batch_size': 3122, 'optimizer': 'RMSprop'}.
2026-05-23 01:18:01,215 - experiment_functions - INFO - Early stopping at epoch 3450. Best Metrics: (0.016617359054593057, 0.011557377049180327, 0.01593630100730833)
2026-05-23 01:18:01,575 - optuna.study.study - INFO - Trial 73 finished with values: [0.016617359054593057, 0.011557377049180327, 0.01593630100730833] and parameters: {'n_layers': 3, 'embedding_dim': 256, 'lr': 6.470304829805458e-05, 'lambda_val': 5.171882167091852e-06, 'batch_size': 2913, 'optimizer': 'Adam'}.
2026-05-23 01:18:06,254 - experiment_functions - INFO - Early stopping at epoch 1450. Best Metrics: (0.0123898490738279, 0.010983606557377049, 0.014623047444685133)
2026-05-23 01:18:06,332 - optuna.study.study - INFO - Trial 74 finished with values: [0.0123898490738279, 0.010983606557377049, 0.014623047444685133] and parameters: {'n_layers': 1, 'embedding_dim': 32, 'lr': 0.0054017846217753514, 'lambda_val': 0.06839725671798878, 'batch_size': 2846, 'optimizer': 'Adam'}.
2026-05-23 01:18:08,870 - experiment_functions - INFO - Early stopping at epoch 500. Best Metrics: (0.0028422467267490564, 0.0014754098360655738, 0.0023553805495318213)
2026-05-23 01:18:08,965 - optuna.study.study - INFO - Trial 75 finished with values: [0.0028422467267490564, 0.0014754098360655738, 0.0023553805495318213] and parameters: {'n_layers': 1, 'embedding_dim': 64, 'lr': 0.024055272907309386, 'lambda_val': 0.0001067945767074503, 'batch_size': 2646, 'optimizer': 'SGD'}.
2026-05-23 01:18:16,185 - experiment_functions - INFO - Early stopping at epoch 2400. Best Metrics: (0.0019433190513648733, 0.002213114754098361, 0.002575303098452383)
2026-05-23 01:18:16,276 - optuna.study.study - INFO - Trial 76 finished with values: [0.0019433190513648733, 0.002213114754098361, 0.002575303098452383] and parameters: {'n_layers': 3, 'embedding_dim': 32, 'lr': 3.4215225017251126e-05, 'lambda_val': 4.064611678585387e-05, 'batch_size': 2236, 'optimizer': 'Adam'}.
2026-05-23 01:18:22,238 - experiment_functions - INFO - Early stopping at epoch 1900. Best Metrics: (0.030412120401109098, 0.01819672131147541, 0.026485669244424456)
2026-05-23 01:18:22,363 - optuna.study.study - INFO - Trial 77 finished with values: [0.030412120401109098, 0.01819672131147541, 0.026485669244424456] and parameters: {'n_layers': 1, 'embedding_dim': 64, 'lr': 0.0006335857209731445, 'lambda_val': 0.002510988429844692, 'batch_size': 3712, 'optimizer': 'Adam'}.
2026-05-23 01:18:40,576 - optuna.study.study - INFO - Trial 78 finished with values: [0.01830909509252539, 0.013196721311475411, 0.01810877581167299] and parameters: {'n_layers': 4, 'embedding_dim': 256, 'lr': 6.470304829805458e-05, 'lambda_val': 0.000580358493379218, 'batch_size': 2913, 'optimizer': 'Adam'}.
2026-05-23 01:18:43,212 - experiment_functions - INFO - Early stopping at epoch 650. Best Metrics: (0.01998422254869719, 0.011639344262295081, 0.017619494537162415)
2026-05-23 01:18:44,412 - optuna.study.study - INFO - Trial 79 finished with values: [0.01998422254869719, 0.011639344262295081, 0.017619494537162415] and parameters: {'n_layers': 1, 'embedding_dim': 128, 'lr': 0.017022768569889442, 'lambda_val': 0.0017477008748793728, 'batch_size': 1609, 'optimizer': 'RMSprop'}.
2026-05-23 01:18:46,588 - experiment_functions - INFO - Early stopping at epoch 500. Best Metrics: (0.002924882200706956, 0.0020491803278688526, 0.0025341268957735697)
2026-05-23 01:18:46,672 - optuna.study.study - INFO - Trial 80 finished with values: [0.002924882200706956, 0.0020491803278688526, 0.0025341268957735697] and parameters: {'n_layers': 2, 'embedding_dim': 64, 'lr': 1.17578383030161e-05, 'lambda_val': 0.013339937076514785, 'batch_size': 3122, 'optimizer': 'SGD'}.
2026-05-23 01:18:49,629 - experiment_functions - INFO - Early stopping at epoch 800. Best Metrics: (0.01183968463729753, 0.00877049180327869, 0.012120292523709582)
2026-05-23 01:18:49,740 - optuna.study.study - INFO - Trial 81 finished with values: [0.01183968463729753, 0.00877049180327869, 0.012120292523709582] and parameters: {'n_layers': 1, 'embedding_dim': 96, 'lr': 0.03855804534172472, 'lambda_val': 0.00024184218144733123, 'batch_size': 1319, 'optimizer': 'RMSprop'}.
2026-05-23 01:18:52,117 - experiment_functions - INFO - Early stopping at epoch 550. Best Metrics: (0.028887431850957768, 0.01573770491803279, 0.024898060348116282)
2026-05-23 01:18:52,241 - optuna.study.study - INFO - Trial 82 finished with values: [0.028887431850957768, 0.01573770491803279, 0.024898060348116282] and parameters: {'n_layers': 3, 'embedding_dim': 32, 'lr': 0.010275728897055822, 'lambda_val': 4.064611678585387e-05, 'batch_size': 1031, 'optimizer': 'Adam'}.
2026-05-23 01:18:54,431 - experiment_functions - INFO - Early stopping at epoch 500. Best Metrics: (0.0011296394984323286, 0.0013114754098360656, 0.001398410031452269)
2026-05-23 01:18:54,512 - optuna.study.study - INFO - Trial 83 finished with values: [0.0011296394984323286, 0.0013114754098360656, 0.001398410031452269] and parameters: {'n_layers': 1, 'embedding_dim': 64, 'lr': 0.00736079824955284, 'lambda_val': 0.00048767792259203, 'batch_size': 3054, 'optimizer': 'SGD'}.
2026-05-23 01:18:57,033 - experiment_functions - INFO - Early stopping at epoch 550. Best Metrics: (0.01621517148428025, 0.01040983606557377, 0.0146722898269059)
2026-05-23 01:18:57,133 - optuna.study.study - INFO - Trial 84 finished with values: [0.01621517148428025, 0.01040983606557377, 0.0146722898269059] and parameters: {'n_layers': 2, 'embedding_dim': 64, 'lr': 0.012518042433364582, 'lambda_val': 1.8703886629471356e-05, 'batch_size': 4030, 'optimizer': 'RMSprop'}.
2026-05-23 01:18:59,850 - experiment_functions - INFO - Early stopping at epoch 650. Best Metrics: (0.024808443884524904, 0.015245901639344264, 0.021605020590564475)
2026-05-23 01:18:59,972 - optuna.study.study - INFO - Trial 85 finished with values: [0.024808443884524904, 0.015245901639344264, 0.021605020590564475] and parameters: {'n_layers': 2, 'embedding_dim': 64, 'lr': 0.0014902400429312995, 'lambda_val': 0.010949527724278119, 'batch_size': 1031, 'optimizer': 'RMSprop'}.
2026-05-23 01:19:03,065 - experiment_functions - INFO - Early stopping at epoch 750. Best Metrics: (0.005452589712332613, 0.005, 0.0066575444951141125)
2026-05-23 01:19:03,154 - optuna.study.study - INFO - Trial 86 finished with values: [0.005452589712332613, 0.005, 0.0066575444951141125] and parameters: {'n_layers': 3, 'embedding_dim': 64, 'lr': 0.0181553252436734, 'lambda_val': 0.0472767292805195, 'batch_size': 3684, 'optimizer': 'RMSprop'}.
2026-05-23 01:19:05,695 - experiment_functions - INFO - Early stopping at epoch 500. Best Metrics: (0.01266618138015387, 0.007049180327868854, 0.010620906820629092)
2026-05-23 01:19:05,774 - optuna.study.study - INFO - Trial 87 finished with values: [0.01266618138015387, 0.007049180327868854, 0.010620906820629092] and parameters: {'n_layers': 4, 'embedding_dim': 96, 'lr': 0.08338835440209422, 'lambda_val': 0.0003520982341206958, 'batch_size': 3153, 'optimizer': 'RMSprop'}.
2026-05-23 01:19:08,615 - experiment_functions - INFO - Early stopping at epoch 600. Best Metrics: (0.039003235599088006, 0.019344262295081967, 0.03261320357788292)
2026-05-23 01:19:09,360 - optuna.study.study - INFO - Trial 88 finished with values: [0.039003235599088006, 0.019344262295081967, 0.03261320357788292] and parameters: {'n_layers': 2, 'embedding_dim': 32, 'lr': 0.0054017846217753514, 'lambda_val': 1.150702232586112e-06, 'batch_size': 542, 'optimizer': 'Adam'}.
2026-05-23 01:19:21,407 - optuna.study.study - INFO - Trial 89 finished with values: [0.02005545587289501, 0.01221311475409836, 0.018964205331937496] and parameters: {'n_layers': 1, 'embedding_dim': 128, 'lr': 0.00014789833189629128, 'lambda_val': 3.0220683903863306e-06, 'batch_size': 2913, 'optimizer': 'Adam'}.
2026-05-23 01:19:23,869 - experiment_functions - INFO - Early stopping at epoch 600. Best Metrics: (0.009763704031055021, 0.0072131147540983615, 0.009934613002675292)
2026-05-23 01:19:24,751 - optuna.study.study - INFO - Trial 90 finished with values: [0.009763704031055021, 0.0072131147540983615, 0.009934613002675292] and parameters: {'n_layers': 4, 'embedding_dim': 32, 'lr': 0.03606888769549845, 'lambda_val': 1.8703886629471356e-05, 'batch_size': 1817, 'optimizer': 'RMSprop'}.
2026-05-23 01:19:27,141 - experiment_functions - INFO - Early stopping at epoch 500. Best Metrics: (0.0021385189221292526, 0.0017213114754098366, 0.002636284542841836)
2026-05-23 01:19:27,228 - optuna.study.study - INFO - Trial 91 finished with values: [0.0021385189221292526, 0.0017213114754098366, 0.002636284542841836] and parameters: {'n_layers': 3, 'embedding_dim': 128, 'lr': 0.00038224063503956276, 'lambda_val': 0.0167977279246446, 'batch_size': 3827, 'optimizer': 'SGD'}.
2026-05-23 01:19:30,023 - experiment_functions - INFO - Early stopping at epoch 700. Best Metrics: (0.027954784680807764, 0.018114754098360657, 0.027933987595690515)
2026-05-23 01:19:30,517 - optuna.study.study - INFO - Trial 92 finished with values: [0.027954784680807764, 0.018114754098360657, 0.027933987595690515] and parameters: {'n_layers': 3, 'embedding_dim': 64, 'lr': 0.0006237069115447143, 'lambda_val': 1.150702232586112e-06, 'batch_size': 1031, 'optimizer': 'RMSprop'}.
2026-05-23 01:19:35,469 - experiment_functions - INFO - Early stopping at epoch 1550. Best Metrics: (0.009321918663518875, 0.007950819672131147, 0.010149464133662845)
2026-05-23 01:19:35,572 - optuna.study.study - INFO - Trial 93 finished with values: [0.009321918663518875, 0.007950819672131147, 0.010149464133662845] and parameters: {'n_layers': 3, 'embedding_dim': 32, 'lr': 0.08338835440209422, 'lambda_val': 4.064611678585387e-05, 'batch_size': 2236, 'optimizer': 'RMSprop'}.
2026-05-23 01:19:38,224 - experiment_functions - INFO - Early stopping at epoch 500. Best Metrics: (0.003709442750465163, 0.0022950819672131148, 0.0031576837670010743)
2026-05-23 01:19:38,320 - optuna.study.study - INFO - Trial 94 finished with values: [0.003709442750465163, 0.0022950819672131148, 0.0031576837670010743] and parameters: {'n_layers': 3, 'embedding_dim': 256, 'lr': 8.443425266491583e-05, 'lambda_val': 0.018866653244521227, 'batch_size': 587, 'optimizer': 'SGD'}.
2026-05-23 01:19:40,730 - experiment_functions - INFO - Early stopping at epoch 550. Best Metrics: (0.024394560683461256, 0.016967213114754097, 0.024300749070025725)
2026-05-23 01:19:40,819 - optuna.study.study - INFO - Trial 95 finished with values: [0.024394560683461256, 0.016967213114754097, 0.024300749070025725] and parameters: {'n_layers': 1, 'embedding_dim': 96, 'lr': 0.015685338333062435, 'lambda_val': 0.0003520982341206958, 'batch_size': 3153, 'optimizer': 'Adam'}.
2026-05-23 01:19:44,360 - experiment_functions - INFO - Early stopping at epoch 750. Best Metrics: (0.006830669563296017, 0.0060655737704918035, 0.008422398178291416)
2026-05-23 01:19:45,663 - optuna.study.study - INFO - Trial 96 finished with values: [0.006830669563296017, 0.0060655737704918035, 0.008422398178291416] and parameters: {'n_layers': 4, 'embedding_dim': 64, 'lr': 0.011220080609702499, 'lambda_val': 0.015280698226488912, 'batch_size': 2134, 'optimizer': 'Adam'}.
2026-05-23 01:20:03,120 - optuna.study.study - INFO - Trial 97 finished with values: [0.0033841038647956694, 0.0033606557377049177, 0.004541248534338283] and parameters: {'n_layers': 4, 'embedding_dim': 256, 'lr': 1.8581424323945843e-05, 'lambda_val': 0.0034929486601176984, 'batch_size': 2846, 'optimizer': 'RMSprop'}.
2026-05-23 01:20:05,517 - experiment_functions - INFO - Early stopping at epoch 500. Best Metrics: (0.002887340276066932, 0.001967213114754099, 0.0038488850739938464)
2026-05-23 01:20:05,644 - optuna.study.study - INFO - Trial 98 finished with values: [0.002887340276066932, 0.001967213114754099, 0.0038488850739938464] and parameters: {'n_layers': 4, 'embedding_dim': 32, 'lr': 0.0181553252436734, 'lambda_val': 1.0842844538926253e-06, 'batch_size': 3684, 'optimizer': 'SGD'}.
2026-05-23 01:20:08,017 - experiment_functions - INFO - Early stopping at epoch 550. Best Metrics: (0.02190096724261454, 0.013278688524590163, 0.017812675695983445)
2026-05-23 01:20:08,108 - optuna.study.study - INFO - Trial 99 finished with values: [0.02190096724261454, 0.013278688524590163, 0.017812675695983445] and parameters: {'n_layers': 2, 'embedding_dim': 64, 'lr': 0.012518042433364582, 'lambda_val': 1.8703886629471356e-05, 'batch_size': 3122, 'optimizer': 'Adam'}.
2026-05-23 01:20:16,506 - experiment_functions - INFO - Early stopping at epoch 3800. Best Metrics: (0.03172856973565257, 0.018032786885245903, 0.026305908403583916)
2026-05-23 01:20:16,604 - optuna.study.study - INFO - Trial 100 finished with values: [0.03172856973565257, 0.018032786885245903, 0.026305908403583916] and parameters: {'n_layers': 1, 'embedding_dim': 32, 'lr': 0.000496802361339361, 'lambda_val': 0.0009657244544246451, 'batch_size': 1987, 'optimizer': 'Adam'}.
2026-05-23 01:20:25,987 - experiment_functions - INFO - Early stopping at epoch 3800. Best Metrics: (0.007938539474661395, 0.00598360655737705, 0.007729237454859032)
2026-05-23 01:20:26,603 - optuna.study.study - INFO - Trial 101 finished with values: [0.007938539474661395, 0.00598360655737705, 0.007729237454859032] and parameters: {'n_layers': 3, 'embedding_dim': 64, 'lr': 6.470304829805458e-05, 'lambda_val': 0.002510988429844692, 'batch_size': 2913, 'optimizer': 'Adam'}.
2026-05-23 01:20:30,055 - experiment_functions - INFO - Early stopping at epoch 1200. Best Metrics: (0.03246147712323526, 0.017704918032786888, 0.027297871344883488)
2026-05-23 01:20:30,151 - optuna.study.study - INFO - Trial 102 finished with values: [0.03246147712323526, 0.017704918032786888, 0.027297871344883488] and parameters: {'n_layers': 2, 'embedding_dim': 64, 'lr': 0.00034576666338528985, 'lambda_val': 1.150702232586112e-06, 'batch_size': 3538, 'optimizer': 'Adam'}.
2026-05-23 01:20:32,498 - experiment_functions - INFO - Early stopping at epoch 750. Best Metrics: (0.011587255760871657, 0.008032786885245903, 0.01174314984173328)
2026-05-23 01:20:32,920 - optuna.study.study - INFO - Trial 103 finished with values: [0.011587255760871657, 0.008032786885245903, 0.01174314984173328] and parameters: {'n_layers': 1, 'embedding_dim': 96, 'lr': 0.08346387466653912, 'lambda_val': 2.185196333765497e-06, 'batch_size': 2668, 'optimizer': 'RMSprop'}.
2026-05-23 01:20:39,812 - experiment_functions - INFO - Early stopping at epoch 1400. Best Metrics: (0.023470533856949784, 0.015163934426229509, 0.020996409264181365)
2026-05-23 01:20:40,219 - optuna.study.study - INFO - Trial 104 finished with values: [0.023470533856949784, 0.015163934426229509, 0.020996409264181365] and parameters: {'n_layers': 4, 'embedding_dim': 256, 'lr': 0.00014789833189629128, 'lambda_val': 0.00021481591111836083, 'batch_size': 2913, 'optimizer': 'RMSprop'}.
2026-05-23 01:20:42,351 - experiment_functions - INFO - Early stopping at epoch 600. Best Metrics: (0.016637027419510262, 0.010655737704918032, 0.01707357119494837)
2026-05-23 01:20:42,435 - optuna.study.study - INFO - Trial 105 finished with values: [0.016637027419510262, 0.010655737704918032, 0.01707357119494837] and parameters: {'n_layers': 1, 'embedding_dim': 32, 'lr': 0.015685338333062435, 'lambda_val': 0.0003520982341206958, 'batch_size': 3018, 'optimizer': 'Adam'}.
2026-05-23 01:20:44,770 - experiment_functions - INFO - Early stopping at epoch 800. Best Metrics: (0.002382756014815066, 0.0015573770491803282, 0.0019369306876271912)
2026-05-23 01:20:44,956 - optuna.study.study - INFO - Trial 106 finished with values: [0.002382756014815066, 0.0015573770491803282, 0.0019369306876271912] and parameters: {'n_layers': 2, 'embedding_dim': 32, 'lr': 0.012518042433364582, 'lambda_val': 0.0022066978836799613, 'batch_size': 1589, 'optimizer': 'SGD'}.
2026-05-23 01:20:55,215 - optuna.study.study - INFO - Trial 107 finished with values: [0.018264505418509835, 0.012704918032786885, 0.019440687966700527] and parameters: {'n_layers': 1, 'embedding_dim': 128, 'lr': 0.00014789833189629128, 'lambda_val': 3.0220683903863306e-06, 'batch_size': 2913, 'optimizer': 'RMSprop'}.
2026-05-23 01:20:58,159 - experiment_functions - INFO - Early stopping at epoch 550. Best Metrics: (0.02234721966027817, 0.015081967213114753, 0.02080705882413729)
2026-05-23 01:20:58,240 - optuna.study.study - INFO - Trial 108 finished with values: [0.02234721966027817, 0.015081967213114753, 0.02080705882413729] and parameters: {'n_layers': 1, 'embedding_dim': 64, 'lr': 0.01491993466802033, 'lambda_val': 2.185196333765497e-06, 'batch_size': 2668, 'optimizer': 'RMSprop'}.
2026-05-23 01:21:01,172 - experiment_functions - INFO - Early stopping at epoch 700. Best Metrics: (0.011719857166619782, 0.008524590163934427, 0.011967603013136765)
2026-05-23 01:21:01,263 - optuna.study.study - INFO - Trial 109 finished with values: [0.011719857166619782, 0.008524590163934427, 0.011967603013136765] and parameters: {'n_layers': 3, 'embedding_dim': 64, 'lr': 0.01491993466802033, 'lambda_val': 4.064611678585387e-05, 'batch_size': 2668, 'optimizer': 'RMSprop'}.
2026-05-23 01:21:03,602 - experiment_functions - INFO - Early stopping at epoch 550. Best Metrics: (0.025282810114361186, 0.015901639344262294, 0.024587069707984206)
2026-05-23 01:21:03,768 - optuna.study.study - INFO - Trial 110 finished with values: [0.025282810114361186, 0.015901639344262294, 0.024587069707984206] and parameters: {'n_layers': 1, 'embedding_dim': 96, 'lr': 0.00736079824955284, 'lambda_val': 7.202525708659488e-05, 'batch_size': 2030, 'optimizer': 'Adam'}.
2026-05-23 01:21:07,542 - experiment_functions - INFO - Early stopping at epoch 1100. Best Metrics: (0.027787843251385252, 0.017868852459016395, 0.025286637193978917)
2026-05-23 01:21:07,897 - optuna.study.study - INFO - Trial 111 finished with values: [0.027787843251385252, 0.017868852459016395, 0.025286637193978917] and parameters: {'n_layers': 2, 'embedding_dim': 96, 'lr': 0.0006071804751429957, 'lambda_val': 7.202525708659488e-05, 'batch_size': 1031, 'optimizer': 'RMSprop'}.
2026-05-23 01:21:11,757 - experiment_functions - INFO - Early stopping at epoch 1150. Best Metrics: (0.005407038261038095, 0.0060655737704918035, 0.006899608124888863)
2026-05-23 01:21:12,082 - optuna.study.study - INFO - Trial 112 finished with values: [0.005407038261038095, 0.0060655737704918035, 0.006899608124888863] and parameters: {'n_layers': 2, 'embedding_dim': 32, 'lr': 0.0054017846217753514, 'lambda_val': 0.06839725671798878, 'batch_size': 1987, 'optimizer': 'RMSprop'}.
2026-05-23 01:21:18,177 - experiment_functions - INFO - Early stopping at epoch 1950. Best Metrics: (0.015319187616884332, 0.012950819672131148, 0.01619275029065272)
2026-05-23 01:21:18,314 - optuna.study.study - INFO - Trial 113 finished with values: [0.015319187616884332, 0.012950819672131148, 0.01619275029065272] and parameters: {'n_layers': 1, 'embedding_dim': 64, 'lr': 0.017022768569889442, 'lambda_val': 0.0017477008748793728, 'batch_size': 1031, 'optimizer': 'RMSprop'}.
2026-05-23 01:21:20,607 - experiment_functions - INFO - Early stopping at epoch 550. Best Metrics: (0.019216682882528795, 0.01344262295081967, 0.01789343515185355)
2026-05-23 01:21:20,702 - optuna.study.study - INFO - Trial 114 finished with values: [0.019216682882528795, 0.01344262295081967, 0.01789343515185355] and parameters: {'n_layers': 1, 'embedding_dim': 64, 'lr': 0.0181553252436734, 'lambda_val': 1.1392246379015404e-05, 'batch_size': 2668, 'optimizer': 'Adam'}.
2026-05-23 01:21:23,896 - experiment_functions - INFO - Early stopping at epoch 850. Best Metrics: (0.01938054261394329, 0.014098360655737708, 0.018630203721767453)
