2026-05-23 05:26:11,447 - optuna.study.study - INFO - Trial 26 finished with values: [0.029275071211847883, 0.017950819672131146, 0.026918296101469636] and parameters: {'n_layers': 2, 'embedding_dim': 128, 'lr': 6.920314910446582e-05, 'lambda_val': 1.3277522347276125e-05, 'batch_size': 1976, 'optimizer': 'Adam'}.
2026-05-23 05:26:13,766 - experiment_functions - INFO - Early stopping at epoch 700. Best Metrics: (0.0503177366563096, 0.03483606557377049, 0.04402558207479774)
2026-05-23 05:26:14,192 - optuna.study.study - INFO - Trial 27 finished with values: [0.0503177366563096, 0.03483606557377049, 0.04402558207479774] and parameters: {'n_layers': 1, 'embedding_dim': 32, 'lr': 0.001288815314225091, 'lambda_val': 0.03086324296076535, 'batch_size': 2011, 'optimizer': 'Adam'}.
2026-05-23 05:26:16,072 - experiment_functions - INFO - Early stopping at epoch 500. Best Metrics: (0.001711622652771364, 0.0018852459016393446, 0.0021371317415509066)
2026-05-23 05:26:16,194 - optuna.study.study - INFO - Trial 28 finished with values: [0.001711622652771364, 0.0018852459016393446, 0.0021371317415509066] and parameters: {'n_layers': 1, 'embedding_dim': 96, 'lr': 0.0007566503916062895, 'lambda_val': 2.320840417989672e-05, 'batch_size': 3405, 'optimizer': 'SGD'}.
2026-05-23 05:26:29,466 - optuna.study.study - INFO - Trial 29 finished with values: [0.017200190186957304, 0.013770491803278686, 0.01741924312117873] and parameters: {'n_layers': 4, 'embedding_dim': 32, 'lr': 0.0001412322481953086, 'lambda_val': 0.06576273625887245, 'batch_size': 1858, 'optimizer': 'RMSprop'}.
2026-05-23 05:26:31,797 - experiment_functions - INFO - Early stopping at epoch 500. Best Metrics: (0.0035010213825432037, 0.0018032786885245904, 0.0027517733991544073)
2026-05-23 05:26:31,883 - optuna.study.study - INFO - Trial 30 finished with values: [0.0035010213825432037, 0.0018032786885245904, 0.0027517733991544073] and parameters: {'n_layers': 2, 'embedding_dim': 128, 'lr': 8.954053877477798e-05, 'lambda_val': 1.9398438435357633e-05, 'batch_size': 1056, 'optimizer': 'SGD'}.
2026-05-23 05:26:40,738 - experiment_functions - INFO - Early stopping at epoch 600. Best Metrics: (0.05054913229159338, 0.029262295081967215, 0.04520735939846586)
2026-05-23 05:26:41,471 - optuna.study.study - INFO - Trial 31 finished with values: [0.05054913229159338, 0.029262295081967215, 0.04520735939846586] and parameters: {'n_layers': 3, 'embedding_dim': 128, 'lr': 0.001257701414193144, 'lambda_val': 0.0005805183270689483, 'batch_size': 827, 'optimizer': 'Adam'}.
2026-05-23 05:26:50,570 - experiment_functions - INFO - Early stopping at epoch 1050. Best Metrics: (0.08548590506452966, 0.043196721311475415, 0.07166383784467764)
2026-05-23 05:26:51,425 - optuna.study.study - INFO - Trial 32 finished with values: [0.08548590506452966, 0.043196721311475415, 0.07166383784467764] and parameters: {'n_layers': 1, 'embedding_dim': 96, 'lr': 0.0014897144525931195, 'lambda_val': 1.916622569179001e-06, 'batch_size': 568, 'optimizer': 'RMSprop'}.
2026-05-23 05:26:56,459 - experiment_functions - INFO - Early stopping at epoch 850. Best Metrics: (0.03551058949150902, 0.02245901639344262, 0.03193460380540269)
2026-05-23 05:26:57,174 - optuna.study.study - INFO - Trial 33 finished with values: [0.03551058949150902, 0.02245901639344262, 0.03193460380540269] and parameters: {'n_layers': 4, 'embedding_dim': 128, 'lr': 0.0003646245687775073, 'lambda_val': 0.0006740293287734596, 'batch_size': 3830, 'optimizer': 'RMSprop'}.
2026-05-23 05:27:04,319 - experiment_functions - INFO - Early stopping at epoch 1500. Best Metrics: (0.01904483733541979, 0.008852459016393444, 0.014787778901346528)
2026-05-23 05:27:05,047 - optuna.study.study - INFO - Trial 34 finished with values: [0.01904483733541979, 0.008852459016393444, 0.014787778901346528] and parameters: {'n_layers': 4, 'embedding_dim': 32, 'lr': 0.012849109517633149, 'lambda_val': 0.0008155225898951439, 'batch_size': 1015, 'optimizer': 'Adam'}.
2026-05-23 05:27:07,480 - experiment_functions - INFO - Early stopping at epoch 500. Best Metrics: (0.004011265655971167, 0.0018032786885245904, 0.002803851791320647)
2026-05-23 05:27:07,574 - optuna.study.study - INFO - Trial 35 finished with values: [0.004011265655971167, 0.0018032786885245904, 0.002803851791320647] and parameters: {'n_layers': 1, 'embedding_dim': 64, 'lr': 1.1478761902863217e-05, 'lambda_val': 0.0069847889480541886, 'batch_size': 4096, 'optimizer': 'SGD'}.
2026-05-23 05:27:10,522 - experiment_functions - INFO - Early stopping at epoch 650. Best Metrics: (0.014810903256338727, 0.01377049180327869, 0.01571028759725991)
2026-05-23 05:27:10,605 - optuna.study.study - INFO - Trial 36 finished with values: [0.014810903256338727, 0.01377049180327869, 0.01571028759725991] and parameters: {'n_layers': 2, 'embedding_dim': 32, 'lr': 0.0016684449289508187, 'lambda_val': 0.0906573916658605, 'batch_size': 2580, 'optimizer': 'Adam'}.
2026-05-23 05:27:13,215 - experiment_functions - INFO - Early stopping at epoch 500. Best Metrics: (0.002253365268999311, 0.001639344262295082, 0.0021860417031082232)
2026-05-23 05:27:13,304 - optuna.study.study - INFO - Trial 37 finished with values: [0.002253365268999311, 0.001639344262295082, 0.0021860417031082232] and parameters: {'n_layers': 1, 'embedding_dim': 256, 'lr': 1.693864270670899e-05, 'lambda_val': 0.00038165634443967347, 'batch_size': 3048, 'optimizer': 'SGD'}.
2026-05-23 05:27:16,228 - experiment_functions - INFO - Early stopping at epoch 550. Best Metrics: (0.05097327677452531, 0.030163934426229506, 0.044771778682754046)
2026-05-23 05:27:16,314 - optuna.study.study - INFO - Trial 38 finished with values: [0.05097327677452531, 0.030163934426229506, 0.044771778682754046] and parameters: {'n_layers': 2, 'embedding_dim': 96, 'lr': 0.0027639393129429376, 'lambda_val': 0.009869894388059158, 'batch_size': 1892, 'optimizer': 'Adam'}.
2026-05-23 05:27:29,498 - optuna.study.study - INFO - Trial 39 finished with values: [0.06771232677590709, 0.038688524590163934, 0.062298256848678] and parameters: {'n_layers': 1, 'embedding_dim': 96, 'lr': 0.00015653541413289526, 'lambda_val': 0.0022842764195591505, 'batch_size': 3001, 'optimizer': 'RMSprop'}.
2026-05-23 05:27:33,264 - experiment_functions - INFO - Early stopping at epoch 900. Best Metrics: (0.03334167245393783, 0.01418032786885246, 0.02254542611732449)
2026-05-23 05:27:33,735 - optuna.study.study - INFO - Trial 40 finished with values: [0.03334167245393783, 0.01418032786885246, 0.02254542611732449] and parameters: {'n_layers': 2, 'embedding_dim': 64, 'lr': 0.008982393972037851, 'lambda_val': 0.0001780270767671239, 'batch_size': 3057, 'optimizer': 'RMSprop'}.
2026-05-23 05:27:41,579 - experiment_functions - INFO - Early stopping at epoch 500. Best Metrics: (0.0030260904667387977, 0.002540983606557377, 0.0034018675742117643)
2026-05-23 05:27:41,968 - optuna.study.study - INFO - Trial 41 finished with values: [0.0030260904667387977, 0.002540983606557377, 0.0034018675742117643] and parameters: {'n_layers': 1, 'embedding_dim': 96, 'lr': 0.014426889872672013, 'lambda_val': 4.22249296545306e-06, 'batch_size': 1555, 'optimizer': 'SGD'}.
2026-05-23 05:27:45,240 - experiment_functions - INFO - Early stopping at epoch 500. Best Metrics: (0.0004654029655298145, 0.0013934426229508198, 0.001064483182058163)
2026-05-23 05:27:45,336 - optuna.study.study - INFO - Trial 42 finished with values: [0.0004654029655298145, 0.0013934426229508198, 0.001064483182058163] and parameters: {'n_layers': 4, 'embedding_dim': 96, 'lr': 0.00020483067512107187, 'lambda_val': 9.655831900704675e-05, 'batch_size': 898, 'optimizer': 'SGD'}.
2026-05-23 05:27:57,889 - optuna.study.study - INFO - Trial 43 finished with values: [0.023531394900447637, 0.013196721311475411, 0.019987432061226915] and parameters: {'n_layers': 2, 'embedding_dim': 32, 'lr': 0.00010087308294325385, 'lambda_val': 0.000750074454420214, 'batch_size': 661, 'optimizer': 'RMSprop'}.
2026-05-23 05:28:01,599 - experiment_functions - INFO - Early stopping at epoch 500. Best Metrics: (0.02284265852117391, 0.013606557377049178, 0.022618029252291717)
2026-05-23 05:28:02,314 - optuna.study.study - INFO - Trial 44 finished with values: [0.02284265852117391, 0.013606557377049178, 0.022618029252291717] and parameters: {'n_layers': 3, 'embedding_dim': 256, 'lr': 0.04737727445304164, 'lambda_val': 1.5020668090190421e-06, 'batch_size': 3105, 'optimizer': 'RMSprop'}.
2026-05-23 05:28:05,950 - experiment_functions - INFO - Early stopping at epoch 500. Best Metrics: (0.028151702335769933, 0.015901639344262298, 0.025521152891387636)
2026-05-23 05:28:06,470 - optuna.study.study - INFO - Trial 45 finished with values: [0.028151702335769933, 0.015901639344262298, 0.025521152891387636] and parameters: {'n_layers': 3, 'embedding_dim': 256, 'lr': 0.08400525594029656, 'lambda_val': 2.9981041724889837e-06, 'batch_size': 2143, 'optimizer': 'RMSprop'}.
2026-05-23 05:28:09,050 - experiment_functions - INFO - Early stopping at epoch 500. Best Metrics: (0.0028378264388326676, 0.0015573770491803278, 0.002121425231401938)
2026-05-23 05:28:09,153 - optuna.study.study - INFO - Trial 46 finished with values: [0.0028378264388326676, 0.0015573770491803278, 0.002121425231401938] and parameters: {'n_layers': 2, 'embedding_dim': 96, 'lr': 0.0055123764180910985, 'lambda_val': 0.03192919921207198, 'batch_size': 2248, 'optimizer': 'SGD'}.
2026-05-23 05:28:14,147 - experiment_functions - INFO - Early stopping at epoch 1150. Best Metrics: (0.03346135927814777, 0.014918032786885246, 0.024496671377897593)
2026-05-23 05:28:14,290 - optuna.study.study - INFO - Trial 47 finished with values: [0.03346135927814777, 0.014918032786885246, 0.024496671377897593] and parameters: {'n_layers': 2, 'embedding_dim': 96, 'lr': 0.013660345711285361, 'lambda_val': 0.000664429487393602, 'batch_size': 3879, 'optimizer': 'Adam'}.
2026-05-23 05:28:16,793 - experiment_functions - INFO - Early stopping at epoch 500. Best Metrics: (0.001262161720092585, 0.0013934426229508198, 0.0015326501552916348)
2026-05-23 05:28:16,879 - optuna.study.study - INFO - Trial 48 finished with values: [0.001262161720092585, 0.0013934426229508198, 0.0015326501552916348] and parameters: {'n_layers': 2, 'embedding_dim': 128, 'lr': 0.0040832717045014965, 'lambda_val': 3.996647087301295e-06, 'batch_size': 765, 'optimizer': 'SGD'}.
2026-05-23 05:28:33,938 - optuna.study.study - INFO - Trial 49 finished with values: [0.024942258085095464, 0.017377049180327873, 0.024371537958665767] and parameters: {'n_layers': 3, 'embedding_dim': 96, 'lr': 7.009153249193758e-05, 'lambda_val': 0.00010160063225891465, 'batch_size': 2211, 'optimizer': 'Adam'}.
2026-05-23 05:28:38,098 - experiment_functions - INFO - Early stopping at epoch 500. Best Metrics: (0.010114147847275158, 0.005901639344262295, 0.00938138844354611)
2026-05-23 05:28:38,667 - optuna.study.study - INFO - Trial 50 finished with values: [0.010114147847275158, 0.005901639344262295, 0.00938138844354611] and parameters: {'n_layers': 4, 'embedding_dim': 256, 'lr': 0.06764412470126958, 'lambda_val': 0.0016872549049523802, 'batch_size': 827, 'optimizer': 'Adam'}.
2026-05-23 05:28:52,929 - experiment_functions - INFO - Early stopping at epoch 2400. Best Metrics: (0.03007225607223282, 0.014672131147540983, 0.025048914372647155)
2026-05-23 05:28:53,093 - optuna.study.study - INFO - Trial 51 finished with values: [0.03007225607223282, 0.014672131147540983, 0.025048914372647155] and parameters: {'n_layers': 3, 'embedding_dim': 256, 'lr': 0.008982393972037851, 'lambda_val': 0.0001780270767671239, 'batch_size': 3057, 'optimizer': 'Adam'}.
2026-05-23 05:28:58,097 - experiment_functions - INFO - Early stopping at epoch 900. Best Metrics: (0.008515535635773817, 0.0072950819672131136, 0.009342655578774664)
2026-05-23 05:28:58,870 - optuna.study.study - INFO - Trial 52 finished with values: [0.008515535635773817, 0.0072950819672131136, 0.009342655578774664] and parameters: {'n_layers': 2, 'embedding_dim': 256, 'lr': 0.006312777493233292, 'lambda_val': 0.08898694657160705, 'batch_size': 3057, 'optimizer': 'RMSprop'}.
2026-05-23 05:29:01,279 - experiment_functions - INFO - Early stopping at epoch 500. Best Metrics: (0.002338966420903625, 0.0018852459016393442, 0.0028297179820636334)
2026-05-23 05:29:01,375 - optuna.study.study - INFO - Trial 53 finished with values: [0.002338966420903625, 0.0018852459016393442, 0.0028297179820636334] and parameters: {'n_layers': 1, 'embedding_dim': 256, 'lr': 0.0026271984480321668, 'lambda_val': 0.0016872549049523802, 'batch_size': 1442, 'optimizer': 'SGD'}.
2026-05-23 05:29:23,526 - optuna.study.study - INFO - Trial 54 finished with values: [0.012225033012020518, 0.008688524590163936, 0.013923436304736539] and parameters: {'n_layers': 3, 'embedding_dim': 256, 'lr': 3.435957120246227e-05, 'lambda_val': 6.166182403013613e-06, 'batch_size': 1631, 'optimizer': 'RMSprop'}.
2026-05-23 05:29:35,207 - experiment_functions - INFO - Early stopping at epoch 3600. Best Metrics: (0.11589104275188214, 0.05639344262295083, 0.09984548564378216)
2026-05-23 05:29:35,306 - optuna.study.study - INFO - Trial 55 finished with values: [0.11589104275188214, 0.05639344262295083, 0.09984548564378216] and parameters: {'n_layers': 1, 'embedding_dim': 128, 'lr': 0.000360608106860257, 'lambda_val': 6.19406847114503e-05, 'batch_size': 1321, 'optimizer': 'RMSprop'}.
2026-05-23 05:29:37,726 - experiment_functions - INFO - Early stopping at epoch 550. Best Metrics: (0.015866910656003846, 0.01377049180327869, 0.017186189166998194)
2026-05-23 05:29:38,736 - optuna.study.study - INFO - Trial 56 finished with values: [0.015866910656003846, 0.01377049180327869, 0.017186189166998194] and parameters: {'n_layers': 2, 'embedding_dim': 32, 'lr': 0.006832650701048396, 'lambda_val': 0.06794962569788122, 'batch_size': 2612, 'optimizer': 'Adam'}.
2026-05-23 05:29:46,789 - experiment_functions - INFO - Early stopping at epoch 1400. Best Metrics: (0.07626729399828301, 0.042540983606557385, 0.06579580681671279)
2026-05-23 05:29:47,062 - optuna.study.study - INFO - Trial 57 finished with values: [0.07626729399828301, 0.042540983606557385, 0.06579580681671279] and parameters: {'n_layers': 2, 'embedding_dim': 128, 'lr': 0.0003614258129820434, 'lambda_val': 1.3277522347276125e-05, 'batch_size': 1976, 'optimizer': 'Adam'}.
2026-05-23 05:29:57,582 - optuna.study.study - INFO - Trial 58 finished with values: [0.0039292251035239695, 0.0020491803278688526, 0.0026720993678505] and parameters: {'n_layers': 1, 'embedding_dim': 64, 'lr': 3.435957120246227e-05, 'lambda_val': 6.166182403013613e-06, 'batch_size': 2161, 'optimizer': 'RMSprop'}.
2026-05-23 05:30:07,086 - experiment_functions - INFO - Early stopping at epoch 1950. Best Metrics: (0.04702545967842133, 0.020491803278688523, 0.036802159659702224)
2026-05-23 05:30:07,171 - optuna.study.study - INFO - Trial 59 finished with values: [0.04702545967842133, 0.020491803278688523, 0.036802159659702224] and parameters: {'n_layers': 2, 'embedding_dim': 256, 'lr': 0.0087991751940927, 'lambda_val': 0.00045534797562752613, 'batch_size': 3604, 'optimizer': 'RMSprop'}.
2026-05-23 05:30:12,263 - experiment_functions - INFO - Early stopping at epoch 1300. Best Metrics: (0.029048833840393612, 0.013360655737704919, 0.021841114786955898)
2026-05-23 05:30:12,512 - optuna.study.study - INFO - Trial 60 finished with values: [0.029048833840393612, 0.013360655737704919, 0.021841114786955898] and parameters: {'n_layers': 2, 'embedding_dim': 64, 'lr': 0.008982393972037851, 'lambda_val': 0.00013338361174833875, 'batch_size': 1794, 'optimizer': 'RMSprop'}.
2026-05-23 05:30:15,071 - experiment_functions - INFO - Early stopping at epoch 500. Best Metrics: (0.002776455641514448, 0.001475409836065574, 0.00247065018754405)
2026-05-23 05:30:15,166 - optuna.study.study - INFO - Trial 61 finished with values: [0.002776455641514448, 0.001475409836065574, 0.00247065018754405] and parameters: {'n_layers': 2, 'embedding_dim': 96, 'lr': 6.920314910446582e-05, 'lambda_val': 0.000664429487393602, 'batch_size': 1976, 'optimizer': 'SGD'}.
2026-05-23 05:30:18,255 - experiment_functions - INFO - Early stopping at epoch 650. Best Metrics: (0.06746476330516413, 0.03737704918032787, 0.060434970828363466)
2026-05-23 05:30:18,386 - optuna.study.study - INFO - Trial 62 finished with values: [0.06746476330516413, 0.03737704918032787, 0.060434970828363466] and parameters: {'n_layers': 2, 'embedding_dim': 96, 'lr': 0.001288815314225091, 'lambda_val': 5.0126150958077e-05, 'batch_size': 1476, 'optimizer': 'Adam'}.
2026-05-23 05:30:20,760 - experiment_functions - INFO - Early stopping at epoch 550. Best Metrics: (0.026849321169032155, 0.013196721311475411, 0.022666658065028166)
2026-05-23 05:30:20,865 - optuna.study.study - INFO - Trial 63 finished with values: [0.026849321169032155, 0.013196721311475411, 0.022666658065028166] and parameters: {'n_layers': 2, 'embedding_dim': 64, 'lr': 0.008982393972037851, 'lambda_val': 0.0001780270767671239, 'batch_size': 780, 'optimizer': 'RMSprop'}.
2026-05-23 05:30:34,903 - experiment_functions - INFO - Early stopping at epoch 3950. Best Metrics: (0.006235020788949495, 0.005245901639344262, 0.006171853908229544)
2026-05-23 05:30:35,867 - optuna.study.study - INFO - Trial 64 finished with values: [0.006235020788949495, 0.005245901639344262, 0.006171853908229544] and parameters: {'n_layers': 4, 'embedding_dim': 32, 'lr': 3.621212385184791e-05, 'lambda_val': 0.0003396935209744395, 'batch_size': 2590, 'optimizer': 'Adam'}.
2026-05-23 05:30:43,329 - experiment_functions - INFO - Early stopping at epoch 550. Best Metrics: (0.10267086575855176, 0.05204918032786885, 0.08758021957979396)
2026-05-23 05:30:44,825 - optuna.study.study - INFO - Trial 65 finished with values: [0.10267086575855176, 0.05204918032786885, 0.08758021957979396] and parameters: {'n_layers': 1, 'embedding_dim': 32, 'lr': 0.00889050274911736, 'lambda_val': 0.0005387179014417885, 'batch_size': 1631, 'optimizer': 'Adam'}.
2026-05-23 05:30:50,999 - experiment_functions - INFO - Early stopping at epoch 550. Best Metrics: (0.032713185011998866, 0.01975409836065574, 0.03126064656503933)
2026-05-23 05:30:51,106 - optuna.study.study - INFO - Trial 66 finished with values: [0.032713185011998866, 0.01975409836065574, 0.03126064656503933] and parameters: {'n_layers': 4, 'embedding_dim': 64, 'lr': 0.004748827105127406, 'lambda_val': 9.6014648956156e-06, 'batch_size': 1015, 'optimizer': 'Adam'}.
2026-05-23 05:30:54,332 - experiment_functions - INFO - Early stopping at epoch 700. Best Metrics: (0.05475194497673833, 0.025573770491803278, 0.04368419382556316)
2026-05-23 05:30:54,485 - optuna.study.study - INFO - Trial 67 finished with values: [0.05475194497673833, 0.025573770491803278, 0.04368419382556316] and parameters: {'n_layers': 1, 'embedding_dim': 256, 'lr': 0.0087991751940927, 'lambda_val': 6.19406847114503e-05, 'batch_size': 3604, 'optimizer': 'RMSprop'}.
2026-05-23 05:30:57,427 - experiment_functions - INFO - Early stopping at epoch 500. Best Metrics: (0.0019885912027405744, 0.001639344262295082, 0.0021408115949438956)
2026-05-23 05:30:57,505 - optuna.study.study - INFO - Trial 68 finished with values: [0.0019885912027405744, 0.001639344262295082, 0.0021408115949438956] and parameters: {'n_layers': 4, 'embedding_dim': 96, 'lr': 0.0027639393129429376, 'lambda_val': 0.009869894388059158, 'batch_size': 2427, 'optimizer': 'SGD'}.
2026-05-23 05:31:00,268 - experiment_functions - INFO - Early stopping at epoch 500. Best Metrics: (0.0020161113912178993, 0.0018852459016393446, 0.0022675401571997777)
2026-05-23 05:31:00,923 - optuna.study.study - INFO - Trial 69 finished with values: [0.0020161113912178993, 0.0018852459016393446, 0.0022675401571997777] and parameters: {'n_layers': 4, 'embedding_dim': 64, 'lr': 1.693864270670899e-05, 'lambda_val': 0.015066959435532682, 'batch_size': 3048, 'optimizer': 'SGD'}.
2026-05-23 05:31:04,278 - experiment_functions - INFO - Early stopping at epoch 500. Best Metrics: (0.0038098172571651096, 0.002213114754098361, 0.0030083980736954853)
2026-05-23 05:31:04,368 - optuna.study.study - INFO - Trial 70 finished with values: [0.0038098172571651096, 0.002213114754098361, 0.0030083980736954853] and parameters: {'n_layers': 3, 'embedding_dim': 256, 'lr': 6.682572529727744e-05, 'lambda_val': 0.022292817207198976, 'batch_size': 957, 'optimizer': 'SGD'}.
2026-05-23 05:31:07,798 - experiment_functions - INFO - Early stopping at epoch 550. Best Metrics: (0.05441088621067482, 0.025655737704918035, 0.04278862471618841)
2026-05-23 05:31:08,472 - optuna.study.study - INFO - Trial 71 finished with values: [0.05441088621067482, 0.025655737704918035, 0.04278862471618841] and parameters: {'n_layers': 2, 'embedding_dim': 256, 'lr': 0.006312777493233292, 'lambda_val': 0.00013338361174833875, 'batch_size': 2612, 'optimizer': 'Adam'}.
2026-05-23 05:31:22,258 - optuna.study.study - INFO - Trial 72 finished with values: [0.07119956846748636, 0.039180327868852456, 0.062497117769185] and parameters: {'n_layers': 1, 'embedding_dim': 96, 'lr': 0.00015653541413289526, 'lambda_val': 0.0022842764195591505, 'batch_size': 3001, 'optimizer': 'RMSprop'}.
2026-05-23 05:31:26,124 - experiment_functions - INFO - Early stopping at epoch 550. Best Metrics: (0.06391954582267693, 0.035081967213114754, 0.051950707494809734)
2026-05-23 05:31:26,747 - optuna.study.study - INFO - Trial 73 finished with values: [0.06391954582267693, 0.035081967213114754, 0.051950707494809734] and parameters: {'n_layers': 2, 'embedding_dim': 256, 'lr': 0.0026271984480321668, 'lambda_val': 0.0016872549049523802, 'batch_size': 1844, 'optimizer': 'Adam'}.
2026-05-23 05:31:29,499 - experiment_functions - INFO - Early stopping at epoch 500. Best Metrics: (0.002699894355234894, 0.001967213114754099, 0.002390688010257974)
