2026-05-23 02:24:52,170 - optuna.study.study - INFO - Trial 215 finished with values: [0.036563951164077735, 0.01852459016393443, 0.028556356507138204] and parameters: {'n_layers': 3, 'embedding_dim': 64, 'lr': 0.0010193114088728706, 'lambda_val': 0.0005428353674897035, 'batch_size': 1698, 'optimizer': 'Adam'}.
2026-05-23 02:25:00,386 - experiment_functions - INFO - Early stopping at epoch 2850. Best Metrics: (0.03479096670799028, 0.018278688524590164, 0.029293207152393273)
2026-05-23 02:25:01,268 - optuna.study.study - INFO - Trial 216 finished with values: [0.03479096670799028, 0.018278688524590164, 0.029293207152393273] and parameters: {'n_layers': 1, 'embedding_dim': 64, 'lr': 0.0004474461075792833, 'lambda_val': 0.0015620530681847225, 'batch_size': 1373, 'optimizer': 'RMSprop'}.
2026-05-23 02:25:08,630 - experiment_functions - INFO - Early stopping at epoch 2350. Best Metrics: (0.03654013301695329, 0.021311475409836064, 0.030328265791260134)
2026-05-23 02:25:08,714 - optuna.study.study - INFO - Trial 217 finished with values: [0.03654013301695329, 0.021311475409836064, 0.030328265791260134] and parameters: {'n_layers': 2, 'embedding_dim': 64, 'lr': 0.0004474461075792833, 'lambda_val': 8.858691676718628e-05, 'batch_size': 664, 'optimizer': 'RMSprop'}.
2026-05-23 02:25:15,676 - experiment_functions - INFO - Early stopping at epoch 2300. Best Metrics: (0.028685632109965314, 0.01762295081967213, 0.0252939351889619)
2026-05-23 02:25:15,768 - optuna.study.study - INFO - Trial 218 finished with values: [0.028685632109965314, 0.01762295081967213, 0.0252939351889619] and parameters: {'n_layers': 1, 'embedding_dim': 96, 'lr': 0.0004474461075792833, 'lambda_val': 0.0003977734214389728, 'batch_size': 1698, 'optimizer': 'RMSprop'}.
2026-05-23 02:25:18,754 - experiment_functions - INFO - Early stopping at epoch 700. Best Metrics: (0.02585209492502655, 0.013442622950819674, 0.01856983219523466)
2026-05-23 02:25:19,620 - optuna.study.study - INFO - Trial 219 finished with values: [0.02585209492502655, 0.013442622950819674, 0.01856983219523466] and parameters: {'n_layers': 4, 'embedding_dim': 128, 'lr': 0.0011164422280390935, 'lambda_val': 0.0003977734214389728, 'batch_size': 1943, 'optimizer': 'Adam'}.
2026-05-23 02:25:30,801 - experiment_functions - INFO - Early stopping at epoch 3700. Best Metrics: (0.029273821508333252, 0.01721311475409836, 0.024467706546563255)
2026-05-23 02:25:31,328 - optuna.study.study - INFO - Trial 220 finished with values: [0.029273821508333252, 0.01721311475409836, 0.024467706546563255] and parameters: {'n_layers': 3, 'embedding_dim': 64, 'lr': 0.0001642455197684349, 'lambda_val': 8.858691676718628e-05, 'batch_size': 1997, 'optimizer': 'Adam'}.
2026-05-23 02:25:33,723 - experiment_functions - INFO - Early stopping at epoch 500. Best Metrics: (0.002572348094514154, 0.001639344262295082, 0.0025280167134692955)
2026-05-23 02:25:33,872 - optuna.study.study - INFO - Trial 221 finished with values: [0.002572348094514154, 0.001639344262295082, 0.0025280167134692955] and parameters: {'n_layers': 3, 'embedding_dim': 64, 'lr': 0.0010193114088728706, 'lambda_val': 1.8731629011795012e-06, 'batch_size': 3017, 'optimizer': 'SGD'}.
2026-05-23 02:25:36,693 - experiment_functions - INFO - Early stopping at epoch 700. Best Metrics: (0.02965320562180007, 0.017459016393442623, 0.025394999918204205)
2026-05-23 02:25:36,809 - optuna.study.study - INFO - Trial 222 finished with values: [0.02965320562180007, 0.017459016393442623, 0.025394999918204205] and parameters: {'n_layers': 3, 'embedding_dim': 64, 'lr': 0.0010193114088728706, 'lambda_val': 0.003734260471985348, 'batch_size': 2068, 'optimizer': 'Adam'}.
2026-05-23 02:25:41,392 - experiment_functions - INFO - Early stopping at epoch 1300. Best Metrics: (0.02786394430665434, 0.01762295081967213, 0.02606100247007062)
2026-05-23 02:25:42,272 - optuna.study.study - INFO - Trial 223 finished with values: [0.02786394430665434, 0.01762295081967213, 0.02606100247007062] and parameters: {'n_layers': 1, 'embedding_dim': 128, 'lr': 0.0004474461075792833, 'lambda_val': 0.0015620530681847225, 'batch_size': 2886, 'optimizer': 'RMSprop'}.
2026-05-23 02:25:52,547 - experiment_functions - INFO - Early stopping at epoch 3250. Best Metrics: (0.004021180175877127, 0.0036885245901639345, 0.00570569126117597)
2026-05-23 02:25:53,190 - optuna.study.study - INFO - Trial 224 finished with values: [0.004021180175877127, 0.0036885245901639345, 0.00570569126117597] and parameters: {'n_layers': 2, 'embedding_dim': 128, 'lr': 4.077544612055446e-05, 'lambda_val': 0.0004959813913081047, 'batch_size': 3213, 'optimizer': 'Adam'}.
2026-05-23 02:25:56,247 - experiment_functions - INFO - Early stopping at epoch 750. Best Metrics: (0.036887782539463586, 0.019344262295081967, 0.0317991623694809)
2026-05-23 02:25:56,530 - optuna.study.study - INFO - Trial 225 finished with values: [0.036887782539463586, 0.019344262295081967, 0.0317991623694809] and parameters: {'n_layers': 1, 'embedding_dim': 128, 'lr': 0.0009933779564808808, 'lambda_val': 0.0005428353674897035, 'batch_size': 2886, 'optimizer': 'RMSprop'}.
2026-05-23 02:26:00,357 - experiment_functions - INFO - Early stopping at epoch 1000. Best Metrics: (0.027572838704017017, 0.016721311475409836, 0.0239075944248738)
2026-05-23 02:26:00,467 - optuna.study.study - INFO - Trial 226 finished with values: [0.027572838704017017, 0.016721311475409836, 0.0239075944248738] and parameters: {'n_layers': 3, 'embedding_dim': 128, 'lr': 0.0004474461075792833, 'lambda_val': 8.858691676718628e-05, 'batch_size': 2022, 'optimizer': 'RMSprop'}.
2026-05-23 02:26:06,319 - experiment_functions - INFO - Early stopping at epoch 700. Best Metrics: (0.02929170286171061, 0.016639344262295082, 0.02528548585138175)
2026-05-23 02:26:06,933 - optuna.study.study - INFO - Trial 227 finished with values: [0.02929170286171061, 0.016639344262295082, 0.02528548585138175] and parameters: {'n_layers': 4, 'embedding_dim': 64, 'lr': 0.0010682175784251788, 'lambda_val': 8.858691676718628e-05, 'batch_size': 1226, 'optimizer': 'Adam'}.
2026-05-23 02:26:16,196 - experiment_functions - INFO - Early stopping at epoch 800. Best Metrics: (0.027148525438362207, 0.01672131147540984, 0.024052768307683624)
2026-05-23 02:26:16,674 - optuna.study.study - INFO - Trial 228 finished with values: [0.027148525438362207, 0.01672131147540984, 0.024052768307683624] and parameters: {'n_layers': 4, 'embedding_dim': 256, 'lr': 0.0004474461075792833, 'lambda_val': 8.858691676718628e-05, 'batch_size': 1226, 'optimizer': 'Adam'}.
2026-05-23 02:26:24,295 - experiment_functions - INFO - Early stopping at epoch 2000. Best Metrics: (0.027890583571967876, 0.016885245901639347, 0.024056146243047045)
2026-05-23 02:26:24,465 - optuna.study.study - INFO - Trial 229 finished with values: [0.027890583571967876, 0.016885245901639347, 0.024056146243047045] and parameters: {'n_layers': 2, 'embedding_dim': 96, 'lr': 0.0003432142400602671, 'lambda_val': 8.858691676718628e-05, 'batch_size': 2834, 'optimizer': 'Adam'}.
2026-05-23 02:26:27,791 - experiment_functions - INFO - Early stopping at epoch 950. Best Metrics: (0.03554963183857687, 0.019590163934426228, 0.03165041058842268)
2026-05-23 02:26:28,118 - optuna.study.study - INFO - Trial 230 finished with values: [0.03554963183857687, 0.019590163934426228, 0.03165041058842268] and parameters: {'n_layers': 1, 'embedding_dim': 96, 'lr': 0.0020135118692985172, 'lambda_val': 8.858691676718628e-05, 'batch_size': 664, 'optimizer': 'Adam'}.
2026-05-23 02:26:32,646 - experiment_functions - INFO - Early stopping at epoch 1350. Best Metrics: (0.027098189555992653, 0.018032786885245903, 0.024905728950891406)
2026-05-23 02:26:32,794 - optuna.study.study - INFO - Trial 231 finished with values: [0.027098189555992653, 0.018032786885245903, 0.024905728950891406] and parameters: {'n_layers': 1, 'embedding_dim': 64, 'lr': 0.0004474461075792833, 'lambda_val': 0.01576185866290203, 'batch_size': 2886, 'optimizer': 'Adam'}.
2026-05-23 02:26:35,476 - experiment_functions - INFO - Early stopping at epoch 700. Best Metrics: (0.029158100873827524, 0.01762295081967213, 0.025279469819999515)
2026-05-23 02:26:35,581 - optuna.study.study - INFO - Trial 232 finished with values: [0.029158100873827524, 0.01762295081967213, 0.025279469819999515] and parameters: {'n_layers': 1, 'embedding_dim': 96, 'lr': 0.0020135118692985172, 'lambda_val': 0.01576185866290203, 'batch_size': 1693, 'optimizer': 'Adam'}.
2026-05-23 02:26:37,999 - experiment_functions - INFO - Early stopping at epoch 600. Best Metrics: (0.021928159271680722, 0.015000000000000003, 0.02070746956188921)
2026-05-23 02:26:38,081 - optuna.study.study - INFO - Trial 233 finished with values: [0.021928159271680722, 0.015000000000000003, 0.02070746956188921] and parameters: {'n_layers': 3, 'embedding_dim': 64, 'lr': 0.0011164422280390935, 'lambda_val': 0.0022810455766457114, 'batch_size': 1698, 'optimizer': 'RMSprop'}.
2026-05-23 02:26:40,541 - experiment_functions - INFO - Early stopping at epoch 550. Best Metrics: (0.023897914424613264, 0.015245901639344264, 0.02027608042730172)
2026-05-23 02:26:40,706 - optuna.study.study - INFO - Trial 234 finished with values: [0.023897914424613264, 0.015245901639344264, 0.02027608042730172] and parameters: {'n_layers': 3, 'embedding_dim': 128, 'lr': 0.0011164422280390935, 'lambda_val': 0.003734260471985348, 'batch_size': 1933, 'optimizer': 'RMSprop'}.
2026-05-23 02:26:44,764 - experiment_functions - INFO - Early stopping at epoch 1200. Best Metrics: (0.033958404827897526, 0.019672131147540985, 0.031037571011380136)
2026-05-23 02:26:45,816 - optuna.study.study - INFO - Trial 235 finished with values: [0.033958404827897526, 0.019672131147540985, 0.031037571011380136] and parameters: {'n_layers': 1, 'embedding_dim': 64, 'lr': 0.0010151510446538632, 'lambda_val': 1.4377891682865886e-06, 'batch_size': 2886, 'optimizer': 'Adam'}.
2026-05-23 02:26:48,777 - experiment_functions - INFO - Early stopping at epoch 700. Best Metrics: (0.032909806257600115, 0.017950819672131146, 0.026845852409328314)
2026-05-23 02:26:48,868 - optuna.study.study - INFO - Trial 236 finished with values: [0.032909806257600115, 0.017950819672131146, 0.026845852409328314] and parameters: {'n_layers': 3, 'embedding_dim': 64, 'lr': 0.0011164422280390935, 'lambda_val': 0.003734260471985348, 'batch_size': 1698, 'optimizer': 'Adam'}.
2026-05-23 02:26:51,690 - experiment_functions - INFO - Early stopping at epoch 700. Best Metrics: (0.026084920221674687, 0.016475409836065574, 0.02327811184511764)
2026-05-23 02:26:51,771 - optuna.study.study - INFO - Trial 237 finished with values: [0.026084920221674687, 0.016475409836065574, 0.02327811184511764] and parameters: {'n_layers': 3, 'embedding_dim': 64, 'lr': 0.0010193114088728706, 'lambda_val': 0.0038475852967126147, 'batch_size': 2886, 'optimizer': 'Adam'}.
2026-05-23 02:26:55,949 - experiment_functions - INFO - Early stopping at epoch 1200. Best Metrics: (0.03246413854852918, 0.018852459016393444, 0.029686527931520042)
2026-05-23 02:26:56,619 - optuna.study.study - INFO - Trial 238 finished with values: [0.03246413854852918, 0.018852459016393444, 0.029686527931520042] and parameters: {'n_layers': 3, 'embedding_dim': 96, 'lr': 0.0004474461075792833, 'lambda_val': 8.858691676718628e-05, 'batch_size': 664, 'optimizer': 'Adam'}.
2026-05-23 02:27:00,969 - experiment_functions - INFO - Early stopping at epoch 1300. Best Metrics: (0.03332410047101334, 0.01918032786885246, 0.030954571276038276)
2026-05-23 02:27:01,554 - optuna.study.study - INFO - Trial 239 finished with values: [0.03332410047101334, 0.01918032786885246, 0.030954571276038276] and parameters: {'n_layers': 1, 'embedding_dim': 64, 'lr': 0.0010193114088728706, 'lambda_val': 1.6012413972032166e-05, 'batch_size': 664, 'optimizer': 'Adam'}.
2026-05-23 02:27:04,178 - experiment_functions - INFO - Early stopping at epoch 600. Best Metrics: (0.032161940690472, 0.016475409836065574, 0.026864444482689768)
2026-05-23 02:27:04,243 - optuna.study.study - INFO - Trial 240 finished with values: [0.032161940690472, 0.016475409836065574, 0.026864444482689768] and parameters: {'n_layers': 3, 'embedding_dim': 96, 'lr': 0.002360716254783437, 'lambda_val': 1.6012413972032166e-05, 'batch_size': 2886, 'optimizer': 'Adam'}.
2026-05-23 02:27:07,971 - experiment_functions - INFO - Early stopping at epoch 950. Best Metrics: (0.002978353848788899, 0.003688524590163935, 0.004771233917025668)
2026-05-23 02:27:08,057 - optuna.study.study - INFO - Trial 241 finished with values: [0.002978353848788899, 0.003688524590163935, 0.004771233917025668] and parameters: {'n_layers': 3, 'embedding_dim': 96, 'lr': 0.030190787362741844, 'lambda_val': 0.0936370756097437, 'batch_size': 2477, 'optimizer': 'RMSprop'}.
2026-05-23 02:27:11,140 - experiment_functions - INFO - Early stopping at epoch 800. Best Metrics: (0.02625624743163212, 0.017295081967213115, 0.02420877417824091)
2026-05-23 02:27:11,237 - optuna.study.study - INFO - Trial 242 finished with values: [0.02625624743163212, 0.017295081967213115, 0.02420877417824091] and parameters: {'n_layers': 1, 'embedding_dim': 128, 'lr': 0.0010682175784251788, 'lambda_val': 0.01576185866290203, 'batch_size': 2926, 'optimizer': 'Adam'}.
2026-05-23 02:27:15,438 - experiment_functions - INFO - Early stopping at epoch 1150. Best Metrics: (0.03282297662022703, 0.01819672131147541, 0.029818113469125076)
2026-05-23 02:27:16,392 - optuna.study.study - INFO - Trial 243 finished with values: [0.03282297662022703, 0.01819672131147541, 0.029818113469125076] and parameters: {'n_layers': 1, 'embedding_dim': 256, 'lr': 0.0010193114088728706, 'lambda_val': 1.8731629011795012e-06, 'batch_size': 1698, 'optimizer': 'Adam'}.
2026-05-23 02:27:27,994 - optuna.study.study - INFO - Trial 244 finished with values: [0.004902514643971133, 0.003934426229508198, 0.0057728275434037815] and parameters: {'n_layers': 1, 'embedding_dim': 96, 'lr': 8.072602692681973e-05, 'lambda_val': 0.004527702692625318, 'batch_size': 1698, 'optimizer': 'RMSprop'}.
2026-05-23 02:27:33,928 - experiment_functions - INFO - Early stopping at epoch 1800. Best Metrics: (0.03076021193187378, 0.018934426229508198, 0.026585639338102998)
2026-05-23 02:27:34,636 - optuna.study.study - INFO - Trial 245 finished with values: [0.03076021193187378, 0.018934426229508198, 0.026585639338102998] and parameters: {'n_layers': 1, 'embedding_dim': 64, 'lr': 0.0005030249027858599, 'lambda_val': 0.0003977734214389728, 'batch_size': 3213, 'optimizer': 'Adam'}.
2026-05-23 02:27:37,216 - experiment_functions - INFO - Early stopping at epoch 550. Best Metrics: (0.012953574987730738, 0.008524590163934429, 0.0120134738622195)
2026-05-23 02:27:37,302 - optuna.study.study - INFO - Trial 246 finished with values: [0.012953574987730738, 0.008524590163934429, 0.0120134738622195] and parameters: {'n_layers': 2, 'embedding_dim': 128, 'lr': 0.0424320351032378, 'lambda_val': 7.3050833305021745e-06, 'batch_size': 2461, 'optimizer': 'Adam'}.
2026-05-23 02:27:39,999 - experiment_functions - INFO - Early stopping at epoch 650. Best Metrics: (0.0318721574225031, 0.015983606557377048, 0.02615277958202183)
2026-05-23 02:27:40,080 - optuna.study.study - INFO - Trial 247 finished with values: [0.0318721574225031, 0.015983606557377048, 0.02615277958202183] and parameters: {'n_layers': 1, 'embedding_dim': 32, 'lr': 0.0020135118692985172, 'lambda_val': 1.8731629011795012e-06, 'batch_size': 3300, 'optimizer': 'RMSprop'}.
2026-05-23 02:27:42,855 - experiment_functions - INFO - Early stopping at epoch 700. Best Metrics: (0.03307687028184168, 0.01901639344262295, 0.02773691509924827)
2026-05-23 02:27:42,946 - optuna.study.study - INFO - Trial 248 finished with values: [0.03307687028184168, 0.01901639344262295, 0.02773691509924827] and parameters: {'n_layers': 1, 'embedding_dim': 32, 'lr': 0.0020135118692985172, 'lambda_val': 1.8731629011795012e-06, 'batch_size': 1698, 'optimizer': 'RMSprop'}.
2026-05-23 02:27:45,864 - experiment_functions - INFO - Early stopping at epoch 800. Best Metrics: (0.026764227608756717, 0.016311475409836063, 0.024702623669637214)
2026-05-23 02:27:45,945 - optuna.study.study - INFO - Trial 249 finished with values: [0.026764227608756717, 0.016311475409836063, 0.024702623669637214] and parameters: {'n_layers': 1, 'embedding_dim': 64, 'lr': 0.0010682175784251788, 'lambda_val': 0.01576185866290203, 'batch_size': 1594, 'optimizer': 'RMSprop'}.
2026-05-23 02:27:48,755 - experiment_functions - INFO - Early stopping at epoch 700. Best Metrics: (0.00955386915821813, 0.008360655737704918, 0.009304561493364678)
2026-05-23 02:27:48,854 - optuna.study.study - INFO - Trial 250 finished with values: [0.00955386915821813, 0.008360655737704918, 0.009304561493364678] and parameters: {'n_layers': 4, 'embedding_dim': 64, 'lr': 0.0010193114088728706, 'lambda_val': 0.051120700026720055, 'batch_size': 664, 'optimizer': 'Adam'}.
2026-05-23 02:27:52,794 - experiment_functions - INFO - Early stopping at epoch 1200. Best Metrics: (0.037032543006682274, 0.02, 0.033696844866379506)
2026-05-23 02:27:52,876 - optuna.study.study - INFO - Trial 251 finished with values: [0.037032543006682274, 0.02, 0.033696844866379506] and parameters: {'n_layers': 1, 'embedding_dim': 64, 'lr': 0.0010193114088728706, 'lambda_val': 0.003734260471985348, 'batch_size': 984, 'optimizer': 'Adam'}.
2026-05-23 02:27:58,902 - experiment_functions - INFO - Early stopping at epoch 750. Best Metrics: (0.03195645021100701, 0.018770491803278687, 0.027907877929919556)
2026-05-23 02:27:59,922 - optuna.study.study - INFO - Trial 252 finished with values: [0.03195645021100701, 0.018770491803278687, 0.027907877929919556] and parameters: {'n_layers': 3, 'embedding_dim': 64, 'lr': 0.0010487356802824795, 'lambda_val': 1.4377891682865886e-06, 'batch_size': 2886, 'optimizer': 'Adam'}.
2026-05-23 02:28:08,091 - experiment_functions - INFO - Early stopping at epoch 1050. Best Metrics: (0.039344433875110045, 0.021065573770491806, 0.03320860407254209)
2026-05-23 02:28:09,394 - optuna.study.study - INFO - Trial 253 finished with values: [0.039344433875110045, 0.021065573770491806, 0.03320860407254209] and parameters: {'n_layers': 1, 'embedding_dim': 32, 'lr': 0.0020135118692985172, 'lambda_val': 1.8731629011795012e-06, 'batch_size': 664, 'optimizer': 'Adam'}.
2026-05-23 02:28:12,809 - experiment_functions - INFO - Early stopping at epoch 750. Best Metrics: (0.011543139417219007, 0.006475409836065574, 0.00874306986302841)
2026-05-23 02:28:12,901 - optuna.study.study - INFO - Trial 254 finished with values: [0.011543139417219007, 0.006475409836065574, 0.00874306986302841] and parameters: {'n_layers': 3, 'embedding_dim': 96, 'lr': 0.011461383719355525, 'lambda_val': 0.003734260471985348, 'batch_size': 2477, 'optimizer': 'RMSprop'}.
2026-05-23 02:28:15,361 - experiment_functions - INFO - Early stopping at epoch 550. Best Metrics: (0.023790023890159863, 0.014098360655737704, 0.020034743774446685)
2026-05-23 02:28:15,479 - optuna.study.study - INFO - Trial 255 finished with values: [0.023790023890159863, 0.014098360655737704, 0.020034743774446685] and parameters: {'n_layers': 4, 'embedding_dim': 128, 'lr': 0.0011164422280390935, 'lambda_val': 2.3395021329481247e-05, 'batch_size': 1698, 'optimizer': 'RMSprop'}.
2026-05-23 02:28:19,658 - experiment_functions - INFO - Early stopping at epoch 1150. Best Metrics: (0.026013654361101042, 0.01581967213114754, 0.023247101255379574)
2026-05-23 02:28:20,325 - optuna.study.study - INFO - Trial 256 finished with values: [0.026013654361101042, 0.01581967213114754, 0.023247101255379574] and parameters: {'n_layers': 3, 'embedding_dim': 64, 'lr': 0.0004474461075792833, 'lambda_val': 0.00022414772563954268, 'batch_size': 2834, 'optimizer': 'Adam'}.
2026-05-23 02:28:23,060 - experiment_functions - INFO - Early stopping at epoch 600. Best Metrics: (0.021046856309202923, 0.014016393442622952, 0.019726601086640757)
2026-05-23 02:28:23,146 - optuna.study.study - INFO - Trial 257 finished with values: [0.021046856309202923, 0.014016393442622952, 0.019726601086640757] and parameters: {'n_layers': 3, 'embedding_dim': 128, 'lr': 0.0010193114088728706, 'lambda_val': 0.00576692598344647, 'batch_size': 3684, 'optimizer': 'RMSprop'}.
2026-05-23 02:28:25,223 - experiment_functions - INFO - Early stopping at epoch 500. Best Metrics: (0.002332973927655516, 0.0012295081967213116, 0.0017519890303341102)
2026-05-23 02:28:25,304 - optuna.study.study - INFO - Trial 258 finished with values: [0.002332973927655516, 0.0012295081967213116, 0.0017519890303341102] and parameters: {'n_layers': 1, 'embedding_dim': 32, 'lr': 0.0009933779564808808, 'lambda_val': 0.0001348402175281296, 'batch_size': 2886, 'optimizer': 'SGD'}.
2026-05-23 02:28:28,407 - experiment_functions - INFO - Early stopping at epoch 700. Best Metrics: (0.03676962636266472, 0.018852459016393444, 0.030573662101674642)
2026-05-23 02:28:28,734 - optuna.study.study - INFO - Trial 259 finished with values: [0.03676962636266472, 0.018852459016393444, 0.030573662101674642] and parameters: {'n_layers': 3, 'embedding_dim': 128, 'lr': 0.0011164422280390935, 'lambda_val': 7.190227350587644e-06, 'batch_size': 664, 'optimizer': 'Adam'}.
2026-05-23 02:28:31,817 - experiment_functions - INFO - Early stopping at epoch 1000. Best Metrics: (0.03815855668238095, 0.018852459016393444, 0.03171760902107922)
2026-05-23 02:28:31,910 - optuna.study.study - INFO - Trial 260 finished with values: [0.03815855668238095, 0.018852459016393444, 0.03171760902107922] and parameters: {'n_layers': 1, 'embedding_dim': 64, 'lr': 0.0010193114088728706, 'lambda_val': 0.0005428353674897035, 'batch_size': 1698, 'optimizer': 'Adam'}.
