2026-05-23 06:09:01,396 - optuna.study.study - INFO - Trial 151 finished with values: [0.00707379699027928, 0.01081967213114754, 0.011821897184109767] and parameters: {'n_layers': 1, 'embedding_dim': 96, 'lr': 0.0022084270117427845, 'lambda_val': 0.025677684912546586, 'batch_size': 2799, 'optimizer': 'Adam'}.
2026-05-23 06:09:06,813 - experiment_functions - INFO - Early stopping at epoch 1350. Best Metrics: (0.007445378272528868, 0.010737704918032788, 0.012951382813687082)
2026-05-23 06:09:06,901 - optuna.study.study - INFO - Trial 152 finished with values: [0.007445378272528868, 0.010737704918032788, 0.012951382813687082] and parameters: {'n_layers': 1, 'embedding_dim': 256, 'lr': 0.011644283247743916, 'lambda_val': 1.643232822744187e-06, 'batch_size': 2799, 'optimizer': 'RMSprop'}.
2026-05-23 06:09:09,433 - experiment_functions - INFO - Early stopping at epoch 650. Best Metrics: (0.005173836643646174, 0.008278688524590166, 0.008226144342638497)
2026-05-23 06:09:09,567 - optuna.study.study - INFO - Trial 153 finished with values: [0.005173836643646174, 0.008278688524590166, 0.008226144342638497] and parameters: {'n_layers': 2, 'embedding_dim': 32, 'lr': 0.0009699915116782758, 'lambda_val': 0.005501300014684501, 'batch_size': 1718, 'optimizer': 'Adam'}.
2026-05-23 06:09:12,283 - experiment_functions - INFO - Early stopping at epoch 650. Best Metrics: (0.016314687702349482, 0.014754098360655738, 0.020699041288991072)
2026-05-23 06:09:12,364 - optuna.study.study - INFO - Trial 154 finished with values: [0.016314687702349482, 0.014754098360655738, 0.020699041288991072] and parameters: {'n_layers': 1, 'embedding_dim': 128, 'lr': 0.0007855341580113746, 'lambda_val': 0.00018535716709622545, 'batch_size': 3814, 'optimizer': 'Adam'}.
2026-05-23 06:09:15,088 - experiment_functions - INFO - Early stopping at epoch 750. Best Metrics: (0.015902902414735316, 0.016475409836065574, 0.020255042670882743)
2026-05-23 06:09:15,184 - optuna.study.study - INFO - Trial 155 finished with values: [0.015902902414735316, 0.016475409836065574, 0.020255042670882743] and parameters: {'n_layers': 1, 'embedding_dim': 64, 'lr': 0.0007855341580113746, 'lambda_val': 0.0018518013272191423, 'batch_size': 916, 'optimizer': 'Adam'}.
2026-05-23 06:09:18,101 - experiment_functions - INFO - Early stopping at epoch 650. Best Metrics: (0.006637518556881548, 0.008032786885245903, 0.010110630532402581)
2026-05-23 06:09:18,571 - optuna.study.study - INFO - Trial 156 finished with values: [0.006637518556881548, 0.008032786885245903, 0.010110630532402581] and parameters: {'n_layers': 3, 'embedding_dim': 128, 'lr': 0.0007855341580113746, 'lambda_val': 0.00811231567759129, 'batch_size': 1139, 'optimizer': 'Adam'}.
2026-05-23 06:09:27,427 - experiment_functions - INFO - Early stopping at epoch 900. Best Metrics: (0.001469803324140613, 0.0021311475409836068, 0.0021218240977178204)
2026-05-23 06:09:28,090 - optuna.study.study - INFO - Trial 157 finished with values: [0.001469803324140613, 0.0021311475409836068, 0.0021218240977178204] and parameters: {'n_layers': 2, 'embedding_dim': 64, 'lr': 0.00034122242598680385, 'lambda_val': 0.08780967629928296, 'batch_size': 3342, 'optimizer': 'Adam'}.
2026-05-23 06:09:34,218 - experiment_functions - INFO - Early stopping at epoch 1000. Best Metrics: (0.0022251513777270288, 0.0013934426229508196, 0.002189102005489393)
2026-05-23 06:09:34,375 - optuna.study.study - INFO - Trial 158 finished with values: [0.0022251513777270288, 0.0013934426229508196, 0.002189102005489393] and parameters: {'n_layers': 4, 'embedding_dim': 256, 'lr': 0.039541256411607204, 'lambda_val': 2.8465536361795723e-05, 'batch_size': 669, 'optimizer': 'SGD'}.
2026-05-23 06:09:37,416 - experiment_functions - INFO - Early stopping at epoch 550. Best Metrics: (0.005952118080250603, 0.00778688524590164, 0.008387937566509926)
2026-05-23 06:09:37,510 - optuna.study.study - INFO - Trial 159 finished with values: [0.005952118080250603, 0.00778688524590164, 0.008387937566509926] and parameters: {'n_layers': 2, 'embedding_dim': 256, 'lr': 0.0012169182947165634, 'lambda_val': 1.90692593503121e-05, 'batch_size': 1888, 'optimizer': 'RMSprop'}.
2026-05-23 06:09:50,621 - optuna.study.study - INFO - Trial 160 finished with values: [0.011797210564018763, 0.010901639344262295, 0.013779919655931108] and parameters: {'n_layers': 4, 'embedding_dim': 64, 'lr': 0.00012869980734826536, 'lambda_val': 0.002206220255221525, 'batch_size': 835, 'optimizer': 'RMSprop'}.
2026-05-23 06:09:53,693 - experiment_functions - INFO - Early stopping at epoch 800. Best Metrics: (0.013427266234549174, 0.016147540983606556, 0.019894126619289163)
2026-05-23 06:09:54,215 - optuna.study.study - INFO - Trial 161 finished with values: [0.013427266234549174, 0.016147540983606556, 0.019894126619289163] and parameters: {'n_layers': 1, 'embedding_dim': 128, 'lr': 0.00036854228595864275, 'lambda_val': 0.00034042279429205883, 'batch_size': 2799, 'optimizer': 'Adam'}.
2026-05-23 06:09:57,084 - experiment_functions - INFO - Early stopping at epoch 700. Best Metrics: (0.004832591028470235, 0.006557377049180328, 0.008584233417521974)
2026-05-23 06:09:57,265 - optuna.study.study - INFO - Trial 162 finished with values: [0.004832591028470235, 0.006557377049180328, 0.008584233417521974] and parameters: {'n_layers': 1, 'embedding_dim': 96, 'lr': 0.059429223534384505, 'lambda_val': 1.8197648589991412e-05, 'batch_size': 1888, 'optimizer': 'Adam'}.
2026-05-23 06:10:00,067 - experiment_functions - INFO - Early stopping at epoch 550. Best Metrics: (0.00935875316786819, 0.010245901639344262, 0.013837458728256105)
2026-05-23 06:10:00,157 - optuna.study.study - INFO - Trial 163 finished with values: [0.00935875316786819, 0.010245901639344262, 0.013837458728256105] and parameters: {'n_layers': 2, 'embedding_dim': 256, 'lr': 0.0007855341580113746, 'lambda_val': 1.9839277344351104e-06, 'batch_size': 894, 'optimizer': 'RMSprop'}.
2026-05-23 06:10:02,815 - experiment_functions - INFO - Early stopping at epoch 700. Best Metrics: (0.004419685649092698, 0.005737704918032787, 0.006557517189851892)
2026-05-23 06:10:02,906 - optuna.study.study - INFO - Trial 164 finished with values: [0.004419685649092698, 0.005737704918032787, 0.006557517189851892] and parameters: {'n_layers': 1, 'embedding_dim': 96, 'lr': 0.059429223534384505, 'lambda_val': 0.00027930861690939925, 'batch_size': 1888, 'optimizer': 'Adam'}.
2026-05-23 06:10:05,870 - experiment_functions - INFO - Early stopping at epoch 800. Best Metrics: (0.01421564927498661, 0.015327868852459018, 0.020305455455443627)
2026-05-23 06:10:05,958 - optuna.study.study - INFO - Trial 165 finished with values: [0.01421564927498661, 0.015327868852459018, 0.020305455455443627] and parameters: {'n_layers': 1, 'embedding_dim': 96, 'lr': 0.0004278261152456948, 'lambda_val': 1.643232822744187e-06, 'batch_size': 3091, 'optimizer': 'RMSprop'}.
2026-05-23 06:10:08,846 - experiment_functions - INFO - Early stopping at epoch 500. Best Metrics: (0.0007231186981693307, 0.0012295081967213116, 0.0015973431918681216)
2026-05-23 06:10:08,932 - optuna.study.study - INFO - Trial 166 finished with values: [0.0007231186981693307, 0.0012295081967213116, 0.0015973431918681216] and parameters: {'n_layers': 3, 'embedding_dim': 256, 'lr': 0.01837949443771539, 'lambda_val': 0.00043313110721109564, 'batch_size': 685, 'optimizer': 'Adam'}.
2026-05-23 06:10:12,696 - experiment_functions - INFO - Early stopping at epoch 1000. Best Metrics: (0.008421236091449907, 0.009918032786885246, 0.011290723192880511)
2026-05-23 06:10:12,774 - optuna.study.study - INFO - Trial 167 finished with values: [0.008421236091449907, 0.009918032786885246, 0.011290723192880511] and parameters: {'n_layers': 2, 'embedding_dim': 64, 'lr': 0.00034122242598680385, 'lambda_val': 1.1371570226930704e-05, 'batch_size': 2282, 'optimizer': 'Adam'}.
2026-05-23 06:10:15,517 - experiment_functions - INFO - Early stopping at epoch 650. Best Metrics: (0.00783304345329452, 0.008360655737704918, 0.009156071920943393)
2026-05-23 06:10:15,611 - optuna.study.study - INFO - Trial 168 finished with values: [0.00783304345329452, 0.008360655737704918, 0.009156071920943393] and parameters: {'n_layers': 2, 'embedding_dim': 32, 'lr': 0.0009699915116782758, 'lambda_val': 0.0003409353796005995, 'batch_size': 3814, 'optimizer': 'Adam'}.
2026-05-23 06:10:28,610 - optuna.study.study - INFO - Trial 169 finished with values: [0.008088784096934355, 0.010819672131147541, 0.012366783183307617] and parameters: {'n_layers': 3, 'embedding_dim': 64, 'lr': 0.00012869980734826536, 'lambda_val': 0.00034042279429205883, 'batch_size': 2282, 'optimizer': 'RMSprop'}.
2026-05-23 06:10:31,559 - experiment_functions - INFO - Early stopping at epoch 650. Best Metrics: (0.013780336455643914, 0.01418032786885246, 0.017141439473021852)
2026-05-23 06:10:31,652 - optuna.study.study - INFO - Trial 170 finished with values: [0.013780336455643914, 0.01418032786885246, 0.017141439473021852] and parameters: {'n_layers': 1, 'embedding_dim': 256, 'lr': 0.0007855341580113746, 'lambda_val': 1.2684111432161195e-05, 'batch_size': 3670, 'optimizer': 'Adam'}.
2026-05-23 06:10:34,186 - experiment_functions - INFO - Early stopping at epoch 500. Best Metrics: (0.0034023856105669143, 0.002377049180327869, 0.003231337915020986)
2026-05-23 06:10:34,274 - optuna.study.study - INFO - Trial 171 finished with values: [0.0034023856105669143, 0.002377049180327869, 0.003231337915020986] and parameters: {'n_layers': 4, 'embedding_dim': 128, 'lr': 0.006809776468399633, 'lambda_val': 1.1371570226930704e-05, 'batch_size': 809, 'optimizer': 'RMSprop'}.
2026-05-23 06:10:36,941 - experiment_functions - INFO - Early stopping at epoch 650. Best Metrics: (0.008724466694843353, 0.009344262295081968, 0.010057891321130635)
2026-05-23 06:10:37,076 - optuna.study.study - INFO - Trial 172 finished with values: [0.008724466694843353, 0.009344262295081968, 0.010057891321130635] and parameters: {'n_layers': 2, 'embedding_dim': 96, 'lr': 0.0007855341580113746, 'lambda_val': 0.00027930861690939925, 'batch_size': 1888, 'optimizer': 'Adam'}.
2026-05-23 06:10:42,227 - experiment_functions - INFO - Early stopping at epoch 500. Best Metrics: (0.002557625846338895, 0.0010655737704918036, 0.0020822885727626687)
2026-05-23 06:10:42,904 - optuna.study.study - INFO - Trial 173 finished with values: [0.002557625846338895, 0.0010655737704918036, 0.0020822885727626687] and parameters: {'n_layers': 2, 'embedding_dim': 64, 'lr': 0.00013647495897976545, 'lambda_val': 1.643232822744187e-06, 'batch_size': 1093, 'optimizer': 'SGD'}.
2026-05-23 06:10:51,004 - experiment_functions - INFO - Early stopping at epoch 550. Best Metrics: (0.015875204321895573, 0.015655737704918033, 0.021219446790943685)
2026-05-23 06:10:51,618 - optuna.study.study - INFO - Trial 174 finished with values: [0.015875204321895573, 0.015655737704918033, 0.021219446790943685] and parameters: {'n_layers': 1, 'embedding_dim': 256, 'lr': 0.0007855341580113746, 'lambda_val': 0.0018518013272191423, 'batch_size': 1073, 'optimizer': 'RMSprop'}.
2026-05-23 06:10:55,264 - experiment_functions - INFO - Early stopping at epoch 700. Best Metrics: (0.004423488922010525, 0.00639344262295082, 0.007471403538128324)
2026-05-23 06:10:55,669 - optuna.study.study - INFO - Trial 175 finished with values: [0.004423488922010525, 0.00639344262295082, 0.007471403538128324] and parameters: {'n_layers': 3, 'embedding_dim': 96, 'lr': 0.0004278261152456948, 'lambda_val': 0.005501300014684501, 'batch_size': 3249, 'optimizer': 'RMSprop'}.
2026-05-23 06:11:07,839 - optuna.study.study - INFO - Trial 176 finished with values: [0.01778075737221164, 0.01819672131147541, 0.02446993133382738] and parameters: {'n_layers': 1, 'embedding_dim': 128, 'lr': 0.00012869980734826536, 'lambda_val': 0.00029292236724190197, 'batch_size': 669, 'optimizer': 'RMSprop'}.
2026-05-23 06:11:23,050 - optuna.study.study - INFO - Trial 177 finished with values: [0.01410100345968609, 0.014016393442622952, 0.01707006773989428] and parameters: {'n_layers': 3, 'embedding_dim': 128, 'lr': 0.00012869980734826536, 'lambda_val': 1.1371570226930704e-05, 'batch_size': 2899, 'optimizer': 'RMSprop'}.
2026-05-23 06:11:25,371 - experiment_functions - INFO - Early stopping at epoch 600. Best Metrics: (0.015117377864126234, 0.014098360655737708, 0.01853747048660766)
2026-05-23 06:11:25,450 - optuna.study.study - INFO - Trial 178 finished with values: [0.015117377864126234, 0.014098360655737708, 0.01853747048660766] and parameters: {'n_layers': 1, 'embedding_dim': 64, 'lr': 0.0012169182947165634, 'lambda_val': 0.007897636732099256, 'batch_size': 1489, 'optimizer': 'Adam'}.
2026-05-23 06:11:28,666 - experiment_functions - INFO - Early stopping at epoch 650. Best Metrics: (0.011301367576371851, 0.013360655737704919, 0.014742986638054038)
2026-05-23 06:11:29,218 - optuna.study.study - INFO - Trial 179 finished with values: [0.011301367576371851, 0.013360655737704919, 0.014742986638054038] and parameters: {'n_layers': 2, 'embedding_dim': 256, 'lr': 0.0007855341580113746, 'lambda_val': 0.0003409353796005995, 'batch_size': 894, 'optimizer': 'Adam'}.
2026-05-23 06:11:31,979 - experiment_functions - INFO - Early stopping at epoch 650. Best Metrics: (0.01744574267356849, 0.018278688524590164, 0.023681146368984538)
2026-05-23 06:11:32,083 - optuna.study.study - INFO - Trial 180 finished with values: [0.01744574267356849, 0.018278688524590164, 0.023681146368984538] and parameters: {'n_layers': 1, 'embedding_dim': 96, 'lr': 0.001181661214584453, 'lambda_val': 0.00022615849293998648, 'batch_size': 1356, 'optimizer': 'Adam'}.
2026-05-23 06:11:34,889 - experiment_functions - INFO - Early stopping at epoch 700. Best Metrics: (0.018796614425201242, 0.019508196721311478, 0.027114457544127248)
2026-05-23 06:11:35,025 - optuna.study.study - INFO - Trial 181 finished with values: [0.018796614425201242, 0.019508196721311478, 0.027114457544127248] and parameters: {'n_layers': 1, 'embedding_dim': 64, 'lr': 0.0012169182947165634, 'lambda_val': 1.90692593503121e-05, 'batch_size': 1356, 'optimizer': 'Adam'}.
2026-05-23 06:11:40,036 - experiment_functions - INFO - Early stopping at epoch 1500. Best Metrics: (0.008358822828328045, 0.010081967213114754, 0.011539057545763603)
2026-05-23 06:11:40,115 - optuna.study.study - INFO - Trial 182 finished with values: [0.008358822828328045, 0.010081967213114754, 0.011539057545763603] and parameters: {'n_layers': 1, 'embedding_dim': 128, 'lr': 0.014958588920169108, 'lambda_val': 0.00027930861690939925, 'batch_size': 1356, 'optimizer': 'Adam'}.
2026-05-23 06:11:42,725 - experiment_functions - INFO - Early stopping at epoch 650. Best Metrics: (0.010540823523774891, 0.012950819672131148, 0.015257594980695278)
2026-05-23 06:11:42,814 - optuna.study.study - INFO - Trial 183 finished with values: [0.010540823523774891, 0.012950819672131148, 0.015257594980695278] and parameters: {'n_layers': 2, 'embedding_dim': 64, 'lr': 0.0009699915116782758, 'lambda_val': 0.0001753264208600962, 'batch_size': 596, 'optimizer': 'Adam'}.
2026-05-23 06:11:45,123 - experiment_functions - INFO - Early stopping at epoch 550. Best Metrics: (0.010323932740378418, 0.011147540983606558, 0.014540061172215771)
2026-05-23 06:11:45,225 - optuna.study.study - INFO - Trial 184 finished with values: [0.010323932740378418, 0.011147540983606558, 0.014540061172215771] and parameters: {'n_layers': 2, 'embedding_dim': 64, 'lr': 0.0009350408589784744, 'lambda_val': 0.002206220255221525, 'batch_size': 669, 'optimizer': 'RMSprop'}.
2026-05-23 06:11:52,118 - experiment_functions - INFO - Early stopping at epoch 500. Best Metrics: (0.0029709454665863668, 0.001967213114754099, 0.0025513792756983937)
2026-05-23 06:11:52,587 - optuna.study.study - INFO - Trial 185 finished with values: [0.0029709454665863668, 0.001967213114754099, 0.0025513792756983937] and parameters: {'n_layers': 2, 'embedding_dim': 256, 'lr': 6.380088278428048e-05, 'lambda_val': 0.0018518013272191423, 'batch_size': 3358, 'optimizer': 'SGD'}.
2026-05-23 06:12:00,796 - experiment_functions - INFO - Early stopping at epoch 550. Best Metrics: (0.016608354589057805, 0.017704918032786888, 0.022054997150697635)
2026-05-23 06:12:00,903 - optuna.study.study - INFO - Trial 186 finished with values: [0.016608354589057805, 0.017704918032786888, 0.022054997150697635] and parameters: {'n_layers': 1, 'embedding_dim': 96, 'lr': 0.0012169182947165634, 'lambda_val': 1.711820466055588e-05, 'batch_size': 916, 'optimizer': 'RMSprop'}.
2026-05-23 06:12:03,343 - experiment_functions - INFO - Early stopping at epoch 600. Best Metrics: (0.01340958729417149, 0.012868852459016396, 0.017798020096228592)
2026-05-23 06:12:03,435 - optuna.study.study - INFO - Trial 187 finished with values: [0.01340958729417149, 0.012868852459016396, 0.017798020096228592] and parameters: {'n_layers': 2, 'embedding_dim': 64, 'lr': 0.0012169182947165634, 'lambda_val': 1.711820466055588e-05, 'batch_size': 916, 'optimizer': 'Adam'}.
2026-05-23 06:12:06,547 - experiment_functions - INFO - Early stopping at epoch 500. Best Metrics: (0.0016289087580097805, 0.001967213114754099, 0.0022692147450459467)
2026-05-23 06:12:06,759 - optuna.study.study - INFO - Trial 188 finished with values: [0.0016289087580097805, 0.001967213114754099, 0.0022692147450459467] and parameters: {'n_layers': 4, 'embedding_dim': 256, 'lr': 0.0022084270117427845, 'lambda_val': 0.0003409353796005995, 'batch_size': 3102, 'optimizer': 'RMSprop'}.
2026-05-23 06:12:19,771 - optuna.study.study - INFO - Trial 189 finished with values: [0.013928252790677593, 0.013114754098360656, 0.016838793653485506] and parameters: {'n_layers': 2, 'embedding_dim': 32, 'lr': 0.00011765782983091902, 'lambda_val': 0.00022615849293998648, 'batch_size': 790, 'optimizer': 'Adam'}.
2026-05-23 06:12:22,470 - experiment_functions - INFO - Early stopping at epoch 550. Best Metrics: (0.0074907741938685865, 0.010901639344262295, 0.012238006732887293)
2026-05-23 06:12:22,558 - optuna.study.study - INFO - Trial 190 finished with values: [0.0074907741938685865, 0.010901639344262295, 0.012238006732887293] and parameters: {'n_layers': 2, 'embedding_dim': 256, 'lr': 0.0007855341580113746, 'lambda_val': 0.0026446314463370807, 'batch_size': 894, 'optimizer': 'RMSprop'}.
2026-05-23 06:12:35,363 - experiment_functions - INFO - Early stopping at epoch 3300. Best Metrics: (0.014801095128357257, 0.016967213114754097, 0.02192764638588312)
2026-05-23 06:12:35,829 - optuna.study.study - INFO - Trial 191 finished with values: [0.014801095128357257, 0.016967213114754097, 0.02192764638588312] and parameters: {'n_layers': 1, 'embedding_dim': 256, 'lr': 0.00011765782983091902, 'lambda_val': 1.1371570226930704e-05, 'batch_size': 3670, 'optimizer': 'RMSprop'}.
2026-05-23 06:12:38,189 - experiment_functions - INFO - Early stopping at epoch 550. Best Metrics: (0.007864357652026832, 0.010409836065573769, 0.010983888178051043)
2026-05-23 06:12:38,286 - optuna.study.study - INFO - Trial 192 finished with values: [0.007864357652026832, 0.010409836065573769, 0.010983888178051043] and parameters: {'n_layers': 1, 'embedding_dim': 32, 'lr': 0.014958588920169108, 'lambda_val': 0.002206220255221525, 'batch_size': 669, 'optimizer': 'Adam'}.
2026-05-23 06:12:40,472 - experiment_functions - INFO - Early stopping at epoch 500. Best Metrics: (0.0022129935914575083, 0.0010655737704918034, 0.0020564876355631517)
2026-05-23 06:12:40,564 - optuna.study.study - INFO - Trial 193 finished with values: [0.0022129935914575083, 0.0010655737704918034, 0.0020564876355631517] and parameters: {'n_layers': 2, 'embedding_dim': 64, 'lr': 0.00819927581881303, 'lambda_val': 0.04114156919115699, 'batch_size': 3249, 'optimizer': 'Adam'}.
2026-05-23 06:12:43,065 - experiment_functions - INFO - Early stopping at epoch 600. Best Metrics: (0.008180880909040114, 0.006311475409836066, 0.008124037014463204)
2026-05-23 06:12:43,163 - optuna.study.study - INFO - Trial 194 finished with values: [0.008180880909040114, 0.006311475409836066, 0.008124037014463204] and parameters: {'n_layers': 3, 'embedding_dim': 32, 'lr': 0.001890263218393761, 'lambda_val': 8.827132755589773e-05, 'batch_size': 3249, 'optimizer': 'Adam'}.
2026-05-23 06:12:56,583 - optuna.study.study - INFO - Trial 195 finished with values: [0.008759205812466538, 0.010327868852459017, 0.011994370431610592] and parameters: {'n_layers': 4, 'embedding_dim': 96, 'lr': 0.00012869980734826536, 'lambda_val': 0.002206220255221525, 'batch_size': 2282, 'optimizer': 'RMSprop'}.
2026-05-23 06:13:02,669 - experiment_functions - INFO - Early stopping at epoch 1800. Best Metrics: (0.005496529292936098, 0.007704918032786886, 0.00953600524607432)
2026-05-23 06:13:03,549 - optuna.study.study - INFO - Trial 196 finished with values: [0.005496529292936098, 0.007704918032786886, 0.00953600524607432] and parameters: {'n_layers': 1, 'embedding_dim': 256, 'lr': 0.02788278556619577, 'lambda_val': 1.643232822744187e-06, 'batch_size': 1888, 'optimizer': 'RMSprop'}.
2026-05-23 06:13:11,515 - experiment_functions - INFO - Early stopping at epoch 500. Best Metrics: (0.0020260732846648687, 0.0015573770491803278, 0.002147944245904431)
2026-05-23 06:13:11,996 - optuna.study.study - INFO - Trial 197 finished with values: [0.0020260732846648687, 0.0015573770491803278, 0.002147944245904431] and parameters: {'n_layers': 4, 'embedding_dim': 64, 'lr': 0.00560258761243953, 'lambda_val': 1.643232822744187e-06, 'batch_size': 916, 'optimizer': 'RMSprop'}.
2026-05-23 06:13:31,663 - optuna.study.study - INFO - Trial 198 finished with values: [0.011724341224002795, 0.010655737704918032, 0.013003060919812386] and parameters: {'n_layers': 4, 'embedding_dim': 128, 'lr': 0.00012869980734826536, 'lambda_val': 0.00029292236724190197, 'batch_size': 3539, 'optimizer': 'RMSprop'}.
2026-05-23 06:13:33,873 - experiment_functions - INFO - Early stopping at epoch 500. Best Metrics: (0.0034144391510696355, 0.0018032786885245904, 0.002454508021449097)
