2026-05-23 00:22:36,631 - optuna.study.study - INFO - Trial 65 finished with values: [0.02609844205453975, 0.01614754098360656, 0.02741092259025895] and parameters: {'n_layers': 3, 'embedding_dim': 128, 'lr': 0.0011286476195635738, 'lambda_val': 6.986110078025384e-06, 'batch_size': 1280, 'optimizer': 'RMSprop'}.
2026-05-23 00:22:39,592 - experiment_functions - INFO - Early stopping at epoch 550. Best Metrics: (0.01777224538428627, 0.011721311475409835, 0.01584203677304675)
2026-05-23 00:22:40,076 - optuna.study.study - INFO - Trial 66 finished with values: [0.01777224538428627, 0.011721311475409835, 0.01584203677304675] and parameters: {'n_layers': 2, 'embedding_dim': 128, 'lr': 0.014270907040346172, 'lambda_val': 6.707954107556364e-05, 'batch_size': 3030, 'optimizer': 'Adam'}.
2026-05-23 00:22:44,109 - experiment_functions - INFO - Early stopping at epoch 800. Best Metrics: (0.011910284225339065, 0.008278688524590166, 0.011388618313487578)
2026-05-23 00:22:44,212 - optuna.study.study - INFO - Trial 67 finished with values: [0.011910284225339065, 0.008278688524590166, 0.011388618313487578] and parameters: {'n_layers': 2, 'embedding_dim': 96, 'lr': 0.012934053566204652, 'lambda_val': 0.0021335803209076563, 'batch_size': 1701, 'optimizer': 'RMSprop'}.
2026-05-23 00:22:46,955 - experiment_functions - INFO - Early stopping at epoch 500. Best Metrics: (0.0029927162312528566, 0.0018032786885245904, 0.0022631837580715593)
2026-05-23 00:22:47,072 - optuna.study.study - INFO - Trial 68 finished with values: [0.0029927162312528566, 0.0018032786885245904, 0.0022631837580715593] and parameters: {'n_layers': 3, 'embedding_dim': 128, 'lr': 0.012006631762219378, 'lambda_val': 0.00018431800351595626, 'batch_size': 3770, 'optimizer': 'SGD'}.
2026-05-23 00:22:58,178 - experiment_functions - INFO - Early stopping at epoch 2950. Best Metrics: (0.0340990965566939, 0.01918032786885246, 0.028686241180177395)
2026-05-23 00:22:58,526 - optuna.study.study - INFO - Trial 69 finished with values: [0.0340990965566939, 0.01918032786885246, 0.028686241180177395] and parameters: {'n_layers': 1, 'embedding_dim': 96, 'lr': 0.0003566717415961628, 'lambda_val': 4.416597544825473e-05, 'batch_size': 1369, 'optimizer': 'RMSprop'}.
2026-05-23 00:23:01,264 - experiment_functions - INFO - Early stopping at epoch 500. Best Metrics: (0.0008947355188146619, 0.0011475409836065576, 0.0010870347439485514)
2026-05-23 00:23:01,358 - optuna.study.study - INFO - Trial 70 finished with values: [0.0008947355188146619, 0.0011475409836065576, 0.0010870347439485514] and parameters: {'n_layers': 2, 'embedding_dim': 256, 'lr': 0.0011286476195635738, 'lambda_val': 0.001981990620864252, 'batch_size': 1457, 'optimizer': 'SGD'}.
2026-05-23 00:23:06,454 - experiment_functions - INFO - Early stopping at epoch 1250. Best Metrics: (0.012703113326047498, 0.008278688524590166, 0.013108386892232348)
2026-05-23 00:23:07,761 - optuna.study.study - INFO - Trial 71 finished with values: [0.012703113326047498, 0.008278688524590166, 0.013108386892232348] and parameters: {'n_layers': 1, 'embedding_dim': 128, 'lr': 0.040006560361531496, 'lambda_val': 0.0680444570611836, 'batch_size': 1422, 'optimizer': 'Adam'}.
2026-05-23 00:23:22,308 - experiment_functions - INFO - Early stopping at epoch 3850. Best Metrics: (0.03149895225106538, 0.018278688524590168, 0.029101078040523247)
2026-05-23 00:23:23,030 - optuna.study.study - INFO - Trial 72 finished with values: [0.03149895225106538, 0.018278688524590168, 0.029101078040523247] and parameters: {'n_layers': 2, 'embedding_dim': 64, 'lr': 0.0002242398424095658, 'lambda_val': 1.7207712053457044e-06, 'batch_size': 984, 'optimizer': 'Adam'}.
2026-05-23 00:23:26,230 - experiment_functions - INFO - Early stopping at epoch 500. Best Metrics: (0.004416430961752912, 0.0018032786885245904, 0.0026911229828686135)
2026-05-23 00:23:26,914 - optuna.study.study - INFO - Trial 73 finished with values: [0.004416430961752912, 0.0018032786885245904, 0.0026911229828686135] and parameters: {'n_layers': 4, 'embedding_dim': 256, 'lr': 0.011351372667191655, 'lambda_val': 1.0895590255719957e-05, 'batch_size': 3533, 'optimizer': 'SGD'}.
2026-05-23 00:23:30,028 - experiment_functions - INFO - Early stopping at epoch 600. Best Metrics: (0.026048532258306032, 0.01721311475409836, 0.023189680688940617)
2026-05-23 00:23:30,127 - optuna.study.study - INFO - Trial 74 finished with values: [0.026048532258306032, 0.01721311475409836, 0.023189680688940617] and parameters: {'n_layers': 1, 'embedding_dim': 256, 'lr': 0.0009422878098805214, 'lambda_val': 0.026381604483490407, 'batch_size': 3148, 'optimizer': 'RMSprop'}.
2026-05-23 00:23:33,009 - experiment_functions - INFO - Early stopping at epoch 550. Best Metrics: (0.012803293180232683, 0.009262295081967215, 0.012648590908775513)
2026-05-23 00:23:33,591 - optuna.study.study - INFO - Trial 75 finished with values: [0.012803293180232683, 0.009262295081967215, 0.012648590908775513] and parameters: {'n_layers': 1, 'embedding_dim': 128, 'lr': 0.09022084681370063, 'lambda_val': 1.0895590255719957e-05, 'batch_size': 3533, 'optimizer': 'Adam'}.
2026-05-23 00:23:39,679 - experiment_functions - INFO - Early stopping at epoch 1400. Best Metrics: (0.008843331808201418, 0.0060655737704918035, 0.00885037446569512)
2026-05-23 00:23:40,088 - optuna.study.study - INFO - Trial 76 finished with values: [0.008843331808201418, 0.0060655737704918035, 0.00885037446569512] and parameters: {'n_layers': 4, 'embedding_dim': 64, 'lr': 0.011351372667191655, 'lambda_val': 0.006734268474296521, 'batch_size': 1547, 'optimizer': 'Adam'}.
2026-05-23 00:23:42,960 - experiment_functions - INFO - Early stopping at epoch 600. Best Metrics: (0.0230619702864476, 0.015245901639344264, 0.02260382057045798)
2026-05-23 00:23:44,430 - optuna.study.study - INFO - Trial 77 finished with values: [0.0230619702864476, 0.015245901639344264, 0.02260382057045798] and parameters: {'n_layers': 1, 'embedding_dim': 96, 'lr': 0.01250859324335198, 'lambda_val': 6.986110078025384e-06, 'batch_size': 2197, 'optimizer': 'Adam'}.
2026-05-23 00:23:53,921 - experiment_functions - INFO - Early stopping at epoch 1200. Best Metrics: (0.03213780060948037, 0.018606557377049183, 0.02830887993709415)
2026-05-23 00:23:54,404 - optuna.study.study - INFO - Trial 78 finished with values: [0.03213780060948037, 0.018606557377049183, 0.02830887993709415] and parameters: {'n_layers': 2, 'embedding_dim': 256, 'lr': 0.00022079369433681775, 'lambda_val': 0.00551038486085562, 'batch_size': 3264, 'optimizer': 'RMSprop'}.
2026-05-23 00:24:06,354 - experiment_functions - INFO - Early stopping at epoch 1600. Best Metrics: (0.013061135510537789, 0.0069672131147540985, 0.010477093732407336)
2026-05-23 00:24:06,444 - optuna.study.study - INFO - Trial 79 finished with values: [0.013061135510537789, 0.0069672131147540985, 0.010477093732407336] and parameters: {'n_layers': 3, 'embedding_dim': 128, 'lr': 0.01250859324335198, 'lambda_val': 0.00845707298217131, 'batch_size': 1566, 'optimizer': 'Adam'}.
2026-05-23 00:24:09,550 - experiment_functions - INFO - Early stopping at epoch 650. Best Metrics: (0.015705474838403958, 0.012049180327868851, 0.015425469588636945)
2026-05-23 00:24:09,632 - optuna.study.study - INFO - Trial 80 finished with values: [0.015705474838403958, 0.012049180327868851, 0.015425469588636945] and parameters: {'n_layers': 2, 'embedding_dim': 96, 'lr': 0.0014120698261668326, 'lambda_val': 0.033428884361528834, 'batch_size': 2231, 'optimizer': 'Adam'}.
2026-05-23 00:24:12,221 - experiment_functions - INFO - Early stopping at epoch 500. Best Metrics: (0.001228167573574595, 0.0013114754098360656, 0.0015336084635198051)
2026-05-23 00:24:12,302 - optuna.study.study - INFO - Trial 81 finished with values: [0.001228167573574595, 0.0013114754098360656, 0.0015336084635198051] and parameters: {'n_layers': 1, 'embedding_dim': 128, 'lr': 0.00044563604340819415, 'lambda_val': 1.4845157433564723e-06, 'batch_size': 647, 'optimizer': 'SGD'}.
2026-05-23 00:24:15,073 - experiment_functions - INFO - Early stopping at epoch 500. Best Metrics: (0.0016270708088309094, 0.0013934426229508198, 0.0014880713122419305)
2026-05-23 00:24:15,168 - optuna.study.study - INFO - Trial 82 finished with values: [0.0016270708088309094, 0.0013934426229508198, 0.0014880713122419305] and parameters: {'n_layers': 2, 'embedding_dim': 256, 'lr': 2.060579680841633e-05, 'lambda_val': 0.003265600459695188, 'batch_size': 3785, 'optimizer': 'SGD'}.
2026-05-23 00:24:29,897 - experiment_functions - INFO - Early stopping at epoch 3650. Best Metrics: (0.039682930727779724, 0.02180327868852459, 0.033513177232116526)
2026-05-23 00:24:30,366 - optuna.study.study - INFO - Trial 83 finished with values: [0.039682930727779724, 0.02180327868852459, 0.033513177232116526] and parameters: {'n_layers': 2, 'embedding_dim': 96, 'lr': 0.00022079369433681775, 'lambda_val': 5.790863900505623e-06, 'batch_size': 2834, 'optimizer': 'RMSprop'}.
2026-05-23 00:24:43,641 - optuna.study.study - INFO - Trial 84 finished with values: [0.0057104975868078845, 0.0038524590163934434, 0.005438142202358282] and parameters: {'n_layers': 4, 'embedding_dim': 32, 'lr': 5.2140602563647875e-05, 'lambda_val': 6.707954107556364e-05, 'batch_size': 1465, 'optimizer': 'RMSprop'}.
2026-05-23 00:24:48,900 - experiment_functions - INFO - Early stopping at epoch 1250. Best Metrics: (0.0313621183075417, 0.017950819672131146, 0.028213905178802772)
2026-05-23 00:24:49,150 - optuna.study.study - INFO - Trial 85 finished with values: [0.0313621183075417, 0.017950819672131146, 0.028213905178802772] and parameters: {'n_layers': 2, 'embedding_dim': 256, 'lr': 0.00029826529867114525, 'lambda_val': 2.9099669967589168e-06, 'batch_size': 3649, 'optimizer': 'Adam'}.
2026-05-23 00:24:51,478 - experiment_functions - INFO - Early stopping at epoch 550. Best Metrics: (0.019496016466513093, 0.012540983606557378, 0.017598734685804737)
2026-05-23 00:24:51,562 - optuna.study.study - INFO - Trial 86 finished with values: [0.019496016466513093, 0.012540983606557378, 0.017598734685804737] and parameters: {'n_layers': 2, 'embedding_dim': 32, 'lr': 0.005375583079687442, 'lambda_val': 8.819162328566226e-05, 'batch_size': 2230, 'optimizer': 'RMSprop'}.
2026-05-23 00:24:58,936 - experiment_functions - INFO - Early stopping at epoch 2500. Best Metrics: (0.002515137271734251, 0.002377049180327869, 0.003030338650120045)
2026-05-23 00:24:59,033 - optuna.study.study - INFO - Trial 87 finished with values: [0.002515137271734251, 0.002377049180327869, 0.003030338650120045] and parameters: {'n_layers': 3, 'embedding_dim': 32, 'lr': 5.2140602563647875e-05, 'lambda_val': 6.707954107556364e-05, 'batch_size': 1280, 'optimizer': 'RMSprop'}.
2026-05-23 00:25:10,751 - experiment_functions - INFO - Early stopping at epoch 3550. Best Metrics: (0.0027973999691408838, 0.0025409836065573774, 0.002803137004177578)
2026-05-23 00:25:10,860 - optuna.study.study - INFO - Trial 88 finished with values: [0.0027973999691408838, 0.0025409836065573774, 0.002803137004177578] and parameters: {'n_layers': 2, 'embedding_dim': 64, 'lr': 2.060579680841633e-05, 'lambda_val': 6.986110078025384e-06, 'batch_size': 2231, 'optimizer': 'Adam'}.
2026-05-23 00:25:13,909 - experiment_functions - INFO - Early stopping at epoch 650. Best Metrics: (0.03040455536452122, 0.01778688524590164, 0.027633602648985706)
2026-05-23 00:25:14,124 - optuna.study.study - INFO - Trial 89 finished with values: [0.03040455536452122, 0.01778688524590164, 0.027633602648985706] and parameters: {'n_layers': 1, 'embedding_dim': 64, 'lr': 0.005832819514590744, 'lambda_val': 0.000258841521491552, 'batch_size': 623, 'optimizer': 'Adam'}.
2026-05-23 00:25:18,030 - experiment_functions - INFO - Early stopping at epoch 650. Best Metrics: (0.028641693613519936, 0.016885245901639347, 0.025592657309230316)
2026-05-23 00:25:18,134 - optuna.study.study - INFO - Trial 90 finished with values: [0.028641693613519936, 0.016885245901639347, 0.025592657309230316] and parameters: {'n_layers': 3, 'embedding_dim': 256, 'lr': 0.0009422878098805214, 'lambda_val': 5.2378227280827334e-06, 'batch_size': 3107, 'optimizer': 'Adam'}.
2026-05-23 00:25:21,283 - experiment_functions - INFO - Early stopping at epoch 600. Best Metrics: (0.02390875626959493, 0.014754098360655738, 0.02203757736886115)
2026-05-23 00:25:21,381 - optuna.study.study - INFO - Trial 91 finished with values: [0.02390875626959493, 0.014754098360655738, 0.02203757736886115] and parameters: {'n_layers': 3, 'embedding_dim': 64, 'lr': 0.0029672352594358334, 'lambda_val': 4.951551807707882e-06, 'batch_size': 1566, 'optimizer': 'Adam'}.
2026-05-23 00:25:24,049 - experiment_functions - INFO - Early stopping at epoch 500. Best Metrics: (0.0015299601480101162, 0.0018032786885245904, 0.0021009797321991574)
2026-05-23 00:25:24,185 - optuna.study.study - INFO - Trial 92 finished with values: [0.0015299601480101162, 0.0018032786885245904, 0.0021009797321991574] and parameters: {'n_layers': 3, 'embedding_dim': 96, 'lr': 0.014076733709420296, 'lambda_val': 7.129111943074598e-05, 'batch_size': 2098, 'optimizer': 'SGD'}.
2026-05-23 00:25:26,675 - experiment_functions - INFO - Early stopping at epoch 500. Best Metrics: (0.0010721853485808335, 0.0013114754098360656, 0.001543448391512568)
2026-05-23 00:25:26,771 - optuna.study.study - INFO - Trial 93 finished with values: [0.0010721853485808335, 0.0013114754098360656, 0.001543448391512568] and parameters: {'n_layers': 1, 'embedding_dim': 64, 'lr': 0.00013260137439328586, 'lambda_val': 1.694673606976005e-05, 'batch_size': 647, 'optimizer': 'SGD'}.
2026-05-23 00:25:30,088 - experiment_functions - INFO - Early stopping at epoch 650. Best Metrics: (0.02226747088326397, 0.016311475409836063, 0.02256184194951533)
2026-05-23 00:25:30,179 - optuna.study.study - INFO - Trial 94 finished with values: [0.02226747088326397, 0.016311475409836063, 0.02256184194951533] and parameters: {'n_layers': 1, 'embedding_dim': 96, 'lr': 0.0029335455314602995, 'lambda_val': 0.0002603879699437796, 'batch_size': 2778, 'optimizer': 'Adam'}.
2026-05-23 00:25:33,694 - experiment_functions - INFO - Early stopping at epoch 650. Best Metrics: (0.01655731499247973, 0.012131147540983607, 0.015240102267072439)
2026-05-23 00:25:33,791 - optuna.study.study - INFO - Trial 95 finished with values: [0.01655731499247973, 0.012131147540983607, 0.015240102267072439] and parameters: {'n_layers': 3, 'embedding_dim': 128, 'lr': 0.00044563604340819415, 'lambda_val': 0.023545362557091012, 'batch_size': 3834, 'optimizer': 'RMSprop'}.
2026-05-23 00:25:47,492 - experiment_functions - INFO - Early stopping at epoch 3450. Best Metrics: (0.02621055530470395, 0.015409836065573772, 0.022425773673335668)
2026-05-23 00:25:47,584 - optuna.study.study - INFO - Trial 96 finished with values: [0.02621055530470395, 0.015409836065573772, 0.022425773673335668] and parameters: {'n_layers': 3, 'embedding_dim': 32, 'lr': 0.0003016753023443771, 'lambda_val': 8.819162328566226e-05, 'batch_size': 2230, 'optimizer': 'Adam'}.
2026-05-23 00:25:50,317 - experiment_functions - INFO - Early stopping at epoch 500. Best Metrics: (0.0016931884227995076, 0.001639344262295082, 0.002013286297561576)
2026-05-23 00:25:50,399 - optuna.study.study - INFO - Trial 97 finished with values: [0.0016931884227995076, 0.001639344262295082, 0.002013286297561576] and parameters: {'n_layers': 2, 'embedding_dim': 256, 'lr': 7.633899003856614e-05, 'lambda_val': 0.0680444570611836, 'batch_size': 1422, 'optimizer': 'Adam'}.
2026-05-23 00:25:53,169 - experiment_functions - INFO - Early stopping at epoch 500. Best Metrics: (0.001809457031484024, 0.0017213114754098362, 0.0022453379911925183)
2026-05-23 00:25:53,255 - optuna.study.study - INFO - Trial 98 finished with values: [0.001809457031484024, 0.0017213114754098362, 0.0022453379911925183] and parameters: {'n_layers': 2, 'embedding_dim': 128, 'lr': 0.005832819514590744, 'lambda_val': 0.000258841521491552, 'batch_size': 3929, 'optimizer': 'SGD'}.
2026-05-23 00:26:07,462 - experiment_functions - INFO - Early stopping at epoch 3700. Best Metrics: (0.009758385615236878, 0.0060655737704918035, 0.00892494457329248)
2026-05-23 00:26:08,390 - optuna.study.study - INFO - Trial 99 finished with values: [0.009758385615236878, 0.0060655737704918035, 0.00892494457329248] and parameters: {'n_layers': 2, 'embedding_dim': 96, 'lr': 7.633899003856614e-05, 'lambda_val': 0.003265600459695188, 'batch_size': 1617, 'optimizer': 'Adam'}.
2026-05-23 00:26:24,115 - optuna.study.study - INFO - Trial 100 finished with values: [0.029431874618453185, 0.01778688524590164, 0.024877381941013483] and parameters: {'n_layers': 1, 'embedding_dim': 96, 'lr': 0.0003566717415961628, 'lambda_val': 0.00011624026828970741, 'batch_size': 987, 'optimizer': 'Adam'}.
2026-05-23 00:26:31,987 - experiment_functions - INFO - Early stopping at epoch 550. Best Metrics: (0.019488679789546232, 0.011393442622950821, 0.014895425011726441)
2026-05-23 00:26:32,565 - optuna.study.study - INFO - Trial 101 finished with values: [0.019488679789546232, 0.011393442622950821, 0.014895425011726441] and parameters: {'n_layers': 2, 'embedding_dim': 32, 'lr': 0.005375583079687442, 'lambda_val': 8.819162328566226e-05, 'batch_size': 2230, 'optimizer': 'RMSprop'}.
2026-05-23 00:26:40,972 - experiment_functions - INFO - Early stopping at epoch 850. Best Metrics: (0.0361313237148619, 0.018688524590163937, 0.031121520803715632)
2026-05-23 00:26:41,098 - optuna.study.study - INFO - Trial 102 finished with values: [0.0361313237148619, 0.018688524590163937, 0.031121520803715632] and parameters: {'n_layers': 2, 'embedding_dim': 256, 'lr': 0.0007184162715631311, 'lambda_val': 0.001981990620864252, 'batch_size': 1457, 'optimizer': 'Adam'}.
2026-05-23 00:26:47,549 - experiment_functions - INFO - Early stopping at epoch 1550. Best Metrics: (0.014446667916780767, 0.011803278688524592, 0.014706514180128858)
2026-05-23 00:26:47,683 - optuna.study.study - INFO - Trial 103 finished with values: [0.014446667916780767, 0.011803278688524592, 0.014706514180128858] and parameters: {'n_layers': 1, 'embedding_dim': 96, 'lr': 0.06364609861820024, 'lambda_val': 0.001981990620864252, 'batch_size': 2197, 'optimizer': 'Adam'}.
2026-05-23 00:26:57,621 - experiment_functions - INFO - Early stopping at epoch 2250. Best Metrics: (0.015370312149097317, 0.008524590163934427, 0.013030006844478475)
2026-05-23 00:26:57,723 - optuna.study.study - INFO - Trial 104 finished with values: [0.015370312149097317, 0.008524590163934427, 0.013030006844478475] and parameters: {'n_layers': 3, 'embedding_dim': 64, 'lr': 0.0509468914012654, 'lambda_val': 2.9099669967589168e-06, 'batch_size': 3649, 'optimizer': 'Adam'}.
2026-05-23 00:27:00,448 - experiment_functions - INFO - Early stopping at epoch 500. Best Metrics: (0.0010505238105211407, 0.0013114754098360656, 0.0012515079103720351)
2026-05-23 00:27:00,534 - optuna.study.study - INFO - Trial 105 finished with values: [0.0010505238105211407, 0.0013114754098360656, 0.0012515079103720351] and parameters: {'n_layers': 2, 'embedding_dim': 96, 'lr': 0.0005513489459732522, 'lambda_val': 0.003265600459695188, 'batch_size': 2834, 'optimizer': 'SGD'}.
2026-05-23 00:27:03,647 - experiment_functions - INFO - Early stopping at epoch 600. Best Metrics: (0.028428594187529497, 0.015655737704918033, 0.023803589291760137)
2026-05-23 00:27:04,973 - optuna.study.study - INFO - Trial 106 finished with values: [0.028428594187529497, 0.015655737704918033, 0.023803589291760137] and parameters: {'n_layers': 3, 'embedding_dim': 32, 'lr': 0.005832819514590744, 'lambda_val': 8.819162328566226e-05, 'batch_size': 623, 'optimizer': 'Adam'}.
2026-05-23 00:27:18,841 - experiment_functions - INFO - Early stopping at epoch 3600. Best Metrics: (0.03290591490703942, 0.018934426229508198, 0.030729284119568472)
2026-05-23 00:27:19,418 - optuna.study.study - INFO - Trial 107 finished with values: [0.03290591490703942, 0.018934426229508198, 0.030729284119568472] and parameters: {'n_layers': 2, 'embedding_dim': 64, 'lr': 0.00022079369433681775, 'lambda_val': 0.00551038486085562, 'batch_size': 1675, 'optimizer': 'RMSprop'}.
2026-05-23 00:27:22,757 - experiment_functions - INFO - Early stopping at epoch 600. Best Metrics: (0.02574502074762569, 0.016311475409836063, 0.023404737939937068)
2026-05-23 00:27:22,853 - optuna.study.study - INFO - Trial 108 finished with values: [0.02574502074762569, 0.016311475409836063, 0.023404737939937068] and parameters: {'n_layers': 2, 'embedding_dim': 256, 'lr': 0.0009422878098805214, 'lambda_val': 0.0021335803209076563, 'batch_size': 2834, 'optimizer': 'RMSprop'}.
2026-05-23 00:27:25,556 - experiment_functions - INFO - Early stopping at epoch 500. Best Metrics: (0.0013027686554207359, 0.0013934426229508198, 0.001592171635721848)
2026-05-23 00:27:25,653 - optuna.study.study - INFO - Trial 109 finished with values: [0.0013027686554207359, 0.0013934426229508198, 0.001592171635721848] and parameters: {'n_layers': 3, 'embedding_dim': 64, 'lr': 0.0011286476195635738, 'lambda_val': 1.5015895024479218e-05, 'batch_size': 2935, 'optimizer': 'SGD'}.
2026-05-23 00:27:28,950 - experiment_functions - INFO - Early stopping at epoch 600. Best Metrics: (0.03094897669447397, 0.01573770491803279, 0.026090754760262094)
2026-05-23 00:27:29,044 - optuna.study.study - INFO - Trial 110 finished with values: [0.03094897669447397, 0.01573770491803279, 0.026090754760262094] and parameters: {'n_layers': 3, 'embedding_dim': 64, 'lr': 0.0029672352594358334, 'lambda_val': 4.951551807707882e-06, 'batch_size': 3107, 'optimizer': 'Adam'}.
2026-05-23 00:27:31,939 - experiment_functions - INFO - Early stopping at epoch 550. Best Metrics: (0.02981860140805802, 0.01557377049180328, 0.023230167432619506)
