2026-05-23 01:45:15,208 - optuna.study.study - INFO - Trial 92 finished with values: [0.005028860031882043, 0.00459016393442623, 0.0073359739272777155] and parameters: {'n_layers': 4, 'embedding_dim': 96, 'lr': 0.05607188434869406, 'lambda_val': 0.0012209206673371394, 'batch_size': 764, 'optimizer': 'Adam'}.
2026-05-23 01:45:17,354 - experiment_functions - INFO - Early stopping at epoch 500. Best Metrics: (0.0013564194674346016, 0.0012295081967213116, 0.0020409796032572814)
2026-05-23 01:45:17,435 - optuna.study.study - INFO - Trial 93 finished with values: [0.0013564194674346016, 0.0012295081967213116, 0.0020409796032572814] and parameters: {'n_layers': 1, 'embedding_dim': 64, 'lr': 0.0013488534539100193, 'lambda_val': 0.0006161160999015657, 'batch_size': 2885, 'optimizer': 'SGD'}.
2026-05-23 01:45:20,240 - experiment_functions - INFO - Early stopping at epoch 750. Best Metrics: (0.0014204981953927557, 0.001475409836065574, 0.001346184150992453)
2026-05-23 01:45:20,333 - optuna.study.study - INFO - Trial 94 finished with values: [0.0014204981953927557, 0.001475409836065574, 0.001346184150992453] and parameters: {'n_layers': 4, 'embedding_dim': 32, 'lr': 1.051930343645746e-05, 'lambda_val': 0.00028698928719198935, 'batch_size': 819, 'optimizer': 'RMSprop'}.
2026-05-23 01:45:22,946 - experiment_functions - INFO - Early stopping at epoch 650. Best Metrics: (0.011105110822202469, 0.00819672131147541, 0.011510359418639007)
2026-05-23 01:45:23,046 - optuna.study.study - INFO - Trial 95 finished with values: [0.011105110822202469, 0.00819672131147541, 0.011510359418639007] and parameters: {'n_layers': 3, 'embedding_dim': 96, 'lr': 0.06616524932729737, 'lambda_val': 6.3998980027240765e-06, 'batch_size': 1004, 'optimizer': 'RMSprop'}.
2026-05-23 01:45:28,355 - experiment_functions - INFO - Early stopping at epoch 1750. Best Metrics: (0.002954568546490832, 0.0018032786885245904, 0.0028301787777130195)
2026-05-23 01:45:28,989 - optuna.study.study - INFO - Trial 96 finished with values: [0.002954568546490832, 0.0018032786885245904, 0.0028301787777130195] and parameters: {'n_layers': 2, 'embedding_dim': 64, 'lr': 1.051930343645746e-05, 'lambda_val': 6.417074591182245e-06, 'batch_size': 819, 'optimizer': 'RMSprop'}.
2026-05-23 01:45:45,728 - optuna.study.study - INFO - Trial 97 finished with values: [0.037999894922142, 0.021065573770491806, 0.03331299231965468] and parameters: {'n_layers': 3, 'embedding_dim': 256, 'lr': 0.00012667151006330983, 'lambda_val': 0.0029444127697785846, 'batch_size': 833, 'optimizer': 'Adam'}.
2026-05-23 01:45:57,079 - optuna.study.study - INFO - Trial 98 finished with values: [0.016653534397010412, 0.010327868852459017, 0.016910803042694943] and parameters: {'n_layers': 1, 'embedding_dim': 32, 'lr': 0.0002669734398444981, 'lambda_val': 2.093095368912283e-06, 'batch_size': 728, 'optimizer': 'RMSprop'}.
2026-05-23 01:46:09,296 - optuna.study.study - INFO - Trial 99 finished with values: [0.01947919867490512, 0.013196721311475411, 0.018813066921093812] and parameters: {'n_layers': 3, 'embedding_dim': 32, 'lr': 0.000302020510284504, 'lambda_val': 0.0005985360677675016, 'batch_size': 3166, 'optimizer': 'Adam'}.
2026-05-23 01:46:12,505 - experiment_functions - INFO - Early stopping at epoch 550. Best Metrics: (0.013129975801339872, 0.008934426229508198, 0.013007980707204)
2026-05-23 01:46:12,599 - optuna.study.study - INFO - Trial 100 finished with values: [0.013129975801339872, 0.008934426229508198, 0.013007980707204] and parameters: {'n_layers': 4, 'embedding_dim': 256, 'lr': 0.0015293939939349619, 'lambda_val': 0.0022435114946451214, 'batch_size': 2515, 'optimizer': 'RMSprop'}.
2026-05-23 01:46:24,087 - optuna.study.study - INFO - Trial 101 finished with values: [0.020048481022583827, 0.012131147540983607, 0.02061095616472661] and parameters: {'n_layers': 1, 'embedding_dim': 64, 'lr': 0.000171992203307018, 'lambda_val': 1.3414170243992366e-05, 'batch_size': 3696, 'optimizer': 'RMSprop'}.
2026-05-23 01:46:26,658 - experiment_functions - INFO - Early stopping at epoch 550. Best Metrics: (0.02756466910241675, 0.01557377049180328, 0.022341964688301956)
2026-05-23 01:46:27,191 - optuna.study.study - INFO - Trial 102 finished with values: [0.02756466910241675, 0.01557377049180328, 0.022341964688301956] and parameters: {'n_layers': 3, 'embedding_dim': 128, 'lr': 0.0013488534539100193, 'lambda_val': 7.337492410061229e-06, 'batch_size': 1725, 'optimizer': 'RMSprop'}.
2026-05-23 01:46:38,745 - experiment_functions - INFO - Early stopping at epoch 3800. Best Metrics: (0.02555689309066421, 0.013934426229508197, 0.021765950452575684)
2026-05-23 01:46:39,259 - optuna.study.study - INFO - Trial 103 finished with values: [0.02555689309066421, 0.013934426229508197, 0.021765950452575684] and parameters: {'n_layers': 3, 'embedding_dim': 32, 'lr': 0.00018537483068886885, 'lambda_val': 1.276982343137876e-06, 'batch_size': 2912, 'optimizer': 'Adam'}.
2026-05-23 01:46:43,062 - experiment_functions - INFO - Early stopping at epoch 1150. Best Metrics: (0.0361714324796981, 0.020655737704918034, 0.030959076453897474)
2026-05-23 01:46:44,100 - optuna.study.study - INFO - Trial 104 finished with values: [0.0361714324796981, 0.020655737704918034, 0.030959076453897474] and parameters: {'n_layers': 1, 'embedding_dim': 64, 'lr': 0.0013488534539100193, 'lambda_val': 2.2024563054207274e-05, 'batch_size': 733, 'optimizer': 'Adam'}.
2026-05-23 01:46:46,642 - experiment_functions - INFO - Early stopping at epoch 500. Best Metrics: (0.002297507968096594, 0.0018032786885245904, 0.0027288783604661106)
2026-05-23 01:46:46,722 - optuna.study.study - INFO - Trial 105 finished with values: [0.002297507968096594, 0.0018032786885245904, 0.0027288783604661106] and parameters: {'n_layers': 1, 'embedding_dim': 64, 'lr': 0.0013488534539100193, 'lambda_val': 3.63818553585295e-05, 'batch_size': 3863, 'optimizer': 'SGD'}.
2026-05-23 01:46:49,559 - experiment_functions - INFO - Early stopping at epoch 750. Best Metrics: (0.02952589534032896, 0.015983606557377048, 0.026274447204561444)
2026-05-23 01:46:49,649 - optuna.study.study - INFO - Trial 106 finished with values: [0.02952589534032896, 0.015983606557377048, 0.026274447204561444] and parameters: {'n_layers': 1, 'embedding_dim': 64, 'lr': 0.0014494764650589468, 'lambda_val': 0.0005795183242806687, 'batch_size': 3696, 'optimizer': 'RMSprop'}.
2026-05-23 01:46:51,937 - experiment_functions - INFO - Early stopping at epoch 500. Best Metrics: (0.0019333183726465703, 0.001557377049180328, 0.002129097738465102)
2026-05-23 01:46:52,027 - optuna.study.study - INFO - Trial 107 finished with values: [0.0019333183726465703, 0.001557377049180328, 0.002129097738465102] and parameters: {'n_layers': 3, 'embedding_dim': 96, 'lr': 0.00021939815862505926, 'lambda_val': 0.012826080211321403, 'batch_size': 3861, 'optimizer': 'SGD'}.
2026-05-23 01:47:04,602 - optuna.study.study - INFO - Trial 108 finished with values: [0.004271934892698748, 0.003114754098360656, 0.003969770644307101] and parameters: {'n_layers': 2, 'embedding_dim': 128, 'lr': 6.377126890544737e-05, 'lambda_val': 2.8432891896341922e-06, 'batch_size': 733, 'optimizer': 'Adam'}.
2026-05-23 01:47:07,621 - experiment_functions - INFO - Early stopping at epoch 800. Best Metrics: (0.02782238077512227, 0.01639344262295082, 0.02671025714639298)
2026-05-23 01:47:07,721 - optuna.study.study - INFO - Trial 109 finished with values: [0.02782238077512227, 0.01639344262295082, 0.02671025714639298] and parameters: {'n_layers': 1, 'embedding_dim': 32, 'lr': 0.0021679791502810398, 'lambda_val': 0.0005795183242806687, 'batch_size': 3696, 'optimizer': 'Adam'}.
2026-05-23 01:47:10,024 - experiment_functions - INFO - Early stopping at epoch 600. Best Metrics: (0.02915261571402857, 0.015983606557377048, 0.025166180355234862)
2026-05-23 01:47:10,111 - optuna.study.study - INFO - Trial 110 finished with values: [0.02915261571402857, 0.015983606557377048, 0.025166180355234862] and parameters: {'n_layers': 1, 'embedding_dim': 32, 'lr': 0.004412673482764488, 'lambda_val': 2.093095368912283e-06, 'batch_size': 1056, 'optimizer': 'RMSprop'}.
2026-05-23 01:47:12,621 - experiment_functions - INFO - Early stopping at epoch 600. Best Metrics: (0.03159457196258118, 0.01418032786885246, 0.024095476197739336)
2026-05-23 01:47:12,712 - optuna.study.study - INFO - Trial 111 finished with values: [0.03159457196258118, 0.01418032786885246, 0.024095476197739336] and parameters: {'n_layers': 3, 'embedding_dim': 32, 'lr': 0.002966327242338245, 'lambda_val': 1.2922176688378956e-05, 'batch_size': 2912, 'optimizer': 'Adam'}.
2026-05-23 01:47:15,292 - experiment_functions - INFO - Early stopping at epoch 600. Best Metrics: (0.029005620928192418, 0.016721311475409836, 0.02440475709938353)
2026-05-23 01:47:15,388 - optuna.study.study - INFO - Trial 112 finished with values: [0.029005620928192418, 0.016721311475409836, 0.02440475709938353] and parameters: {'n_layers': 3, 'embedding_dim': 128, 'lr': 0.0022564826852050435, 'lambda_val': 3.7205125829824535e-06, 'batch_size': 1493, 'optimizer': 'Adam'}.
2026-05-23 01:47:30,287 - optuna.study.study - INFO - Trial 113 finished with values: [0.02585611951049326, 0.015245901639344264, 0.02220425879425931] and parameters: {'n_layers': 2, 'embedding_dim': 256, 'lr': 0.00012667151006330983, 'lambda_val': 1.901210707193677e-05, 'batch_size': 3801, 'optimizer': 'Adam'}.
2026-05-23 01:47:33,270 - experiment_functions - INFO - Early stopping at epoch 800. Best Metrics: (0.011313640076771058, 0.006721311475409835, 0.010555662679632295)
2026-05-23 01:47:34,686 - optuna.study.study - INFO - Trial 114 finished with values: [0.011313640076771058, 0.006721311475409835, 0.010555662679632295] and parameters: {'n_layers': 2, 'embedding_dim': 64, 'lr': 0.09925750767589613, 'lambda_val': 4.65660992458361e-06, 'batch_size': 3696, 'optimizer': 'RMSprop'}.
2026-05-23 01:47:46,251 - experiment_functions - INFO - Early stopping at epoch 3600. Best Metrics: (0.027565616549491023, 0.0169672131147541, 0.025346854202828832)
2026-05-23 01:47:46,695 - optuna.study.study - INFO - Trial 115 finished with values: [0.027565616549491023, 0.0169672131147541, 0.025346854202828832] and parameters: {'n_layers': 2, 'embedding_dim': 128, 'lr': 0.00019017292293356, 'lambda_val': 1.901210707193677e-05, 'batch_size': 3801, 'optimizer': 'Adam'}.
2026-05-23 01:47:49,699 - experiment_functions - INFO - Early stopping at epoch 550. Best Metrics: (0.0263713939529177, 0.015491803278688524, 0.023869253421078686)
2026-05-23 01:47:49,800 - optuna.study.study - INFO - Trial 116 finished with values: [0.0263713939529177, 0.015491803278688524, 0.023869253421078686] and parameters: {'n_layers': 3, 'embedding_dim': 128, 'lr': 0.009455185494500208, 'lambda_val': 7.337492410061229e-06, 'batch_size': 733, 'optimizer': 'Adam'}.
2026-05-23 01:47:52,162 - experiment_functions - INFO - Early stopping at epoch 550. Best Metrics: (0.02207247629571043, 0.016475409836065574, 0.023278703881861738)
2026-05-23 01:47:52,329 - optuna.study.study - INFO - Trial 117 finished with values: [0.02207247629571043, 0.016475409836065574, 0.023278703881861738] and parameters: {'n_layers': 1, 'embedding_dim': 128, 'lr': 0.016630265747118476, 'lambda_val': 9.51579131949383e-06, 'batch_size': 2893, 'optimizer': 'Adam'}.
2026-05-23 01:47:56,638 - experiment_functions - INFO - Early stopping at epoch 900. Best Metrics: (0.03117440961161716, 0.01901639344262295, 0.028394988986137897)
2026-05-23 01:47:57,076 - optuna.study.study - INFO - Trial 118 finished with values: [0.03117440961161716, 0.01901639344262295, 0.028394988986137897] and parameters: {'n_layers': 1, 'embedding_dim': 128, 'lr': 0.0018860187490457373, 'lambda_val': 0.0017105841747060543, 'batch_size': 728, 'optimizer': 'Adam'}.
2026-05-23 01:48:00,566 - experiment_functions - INFO - Early stopping at epoch 600. Best Metrics: (0.027493302431011696, 0.015901639344262298, 0.025180025316841628)
2026-05-23 01:48:00,645 - optuna.study.study - INFO - Trial 119 finished with values: [0.027493302431011696, 0.015901639344262298, 0.025180025316841628] and parameters: {'n_layers': 2, 'embedding_dim': 256, 'lr': 0.0015293939939349619, 'lambda_val': 0.0022435114946451214, 'batch_size': 3801, 'optimizer': 'Adam'}.
2026-05-23 01:48:13,662 - experiment_functions - INFO - Early stopping at epoch 3250. Best Metrics: (0.030801138922807246, 0.01762295081967213, 0.026618006416460185)
2026-05-23 01:48:14,047 - optuna.study.study - INFO - Trial 120 finished with values: [0.030801138922807246, 0.01762295081967213, 0.026618006416460185] and parameters: {'n_layers': 3, 'embedding_dim': 256, 'lr': 0.00012667151006330983, 'lambda_val': 3.7205125829824535e-06, 'batch_size': 2578, 'optimizer': 'RMSprop'}.
2026-05-23 01:48:27,003 - experiment_functions - INFO - Early stopping at epoch 3550. Best Metrics: (0.03183691782705542, 0.018688524590163937, 0.030153680599520474)
2026-05-23 01:48:27,088 - optuna.study.study - INFO - Trial 121 finished with values: [0.03183691782705542, 0.018688524590163937, 0.030153680599520474] and parameters: {'n_layers': 2, 'embedding_dim': 256, 'lr': 0.0002669734398444981, 'lambda_val': 1.901210707193677e-05, 'batch_size': 833, 'optimizer': 'Adam'}.
2026-05-23 01:48:29,307 - experiment_functions - INFO - Early stopping at epoch 550. Best Metrics: (0.021757101309384942, 0.010983606557377049, 0.01740673451353143)
2026-05-23 01:48:29,400 - optuna.study.study - INFO - Trial 122 finished with values: [0.021757101309384942, 0.010983606557377049, 0.01740673451353143] and parameters: {'n_layers': 3, 'embedding_dim': 32, 'lr': 0.0182126248618702, 'lambda_val': 9.51579131949383e-06, 'batch_size': 902, 'optimizer': 'Adam'}.
2026-05-23 01:48:35,751 - experiment_functions - INFO - Early stopping at epoch 1850. Best Metrics: (0.027602756974415037, 0.0169672131147541, 0.02386059893310612)
2026-05-23 01:48:37,185 - optuna.study.study - INFO - Trial 123 finished with values: [0.027602756974415037, 0.0169672131147541, 0.02386059893310612] and parameters: {'n_layers': 3, 'embedding_dim': 64, 'lr': 0.0002669734398444981, 'lambda_val': 1.0513368525584661e-05, 'batch_size': 3696, 'optimizer': 'RMSprop'}.
2026-05-23 01:48:40,704 - experiment_functions - INFO - Early stopping at epoch 750. Best Metrics: (0.029286366005900916, 0.01778688524590164, 0.027500499263597974)
2026-05-23 01:48:41,806 - optuna.study.study - INFO - Trial 124 finished with values: [0.029286366005900916, 0.01778688524590164, 0.027500499263597974] and parameters: {'n_layers': 1, 'embedding_dim': 128, 'lr': 0.0029857692762471034, 'lambda_val': 2.2024563054207274e-05, 'batch_size': 733, 'optimizer': 'Adam'}.
2026-05-23 01:48:44,222 - experiment_functions - INFO - Early stopping at epoch 550. Best Metrics: (0.025847099200243293, 0.014672131147540986, 0.020157525989507888)
2026-05-23 01:48:44,305 - optuna.study.study - INFO - Trial 125 finished with values: [0.025847099200243293, 0.014672131147540986, 0.020157525989507888] and parameters: {'n_layers': 3, 'embedding_dim': 64, 'lr': 0.0018860187490457373, 'lambda_val': 1.1323751698585685e-06, 'batch_size': 3736, 'optimizer': 'RMSprop'}.
2026-05-23 01:48:57,031 - optuna.study.study - INFO - Trial 126 finished with values: [0.023879596206405063, 0.013934426229508197, 0.020721368825128487] and parameters: {'n_layers': 2, 'embedding_dim': 128, 'lr': 0.00012489769900364984, 'lambda_val': 6.143416262245802e-05, 'batch_size': 2893, 'optimizer': 'Adam'}.
2026-05-23 01:48:59,638 - experiment_functions - INFO - Early stopping at epoch 550. Best Metrics: (0.026619409115938096, 0.017131147540983608, 0.024232790688222906)
2026-05-23 01:48:59,729 - optuna.study.study - INFO - Trial 127 finished with values: [0.026619409115938096, 0.017131147540983608, 0.024232790688222906] and parameters: {'n_layers': 2, 'embedding_dim': 256, 'lr': 0.004412673482764488, 'lambda_val': 0.0029444127697785846, 'batch_size': 1056, 'optimizer': 'Adam'}.
2026-05-23 01:49:12,377 - optuna.study.study - INFO - Trial 128 finished with values: [0.01639528952054212, 0.010491803278688525, 0.01600498620644178] and parameters: {'n_layers': 1, 'embedding_dim': 256, 'lr': 0.00012667151006330983, 'lambda_val': 1.7522042434772404e-06, 'batch_size': 1510, 'optimizer': 'Adam'}.
2026-05-23 01:49:14,775 - experiment_functions - INFO - Early stopping at epoch 500. Best Metrics: (0.0015440103389429167, 0.0011475409836065576, 0.001534296237010706)
2026-05-23 01:49:14,864 - optuna.study.study - INFO - Trial 129 finished with values: [0.0015440103389429167, 0.0011475409836065576, 0.001534296237010706] and parameters: {'n_layers': 3, 'embedding_dim': 128, 'lr': 1.1719725249980582e-05, 'lambda_val': 7.337492410061229e-06, 'batch_size': 833, 'optimizer': 'SGD'}.
2026-05-23 01:49:23,353 - experiment_functions - INFO - Early stopping at epoch 2400. Best Metrics: (0.03049558020029808, 0.016721311475409836, 0.0278762715425534)
2026-05-23 01:49:23,522 - optuna.study.study - INFO - Trial 130 finished with values: [0.03049558020029808, 0.016721311475409836, 0.0278762715425534] and parameters: {'n_layers': 3, 'embedding_dim': 128, 'lr': 0.00019017292293356, 'lambda_val': 2.093095368912283e-06, 'batch_size': 3863, 'optimizer': 'Adam'}.
2026-05-23 01:49:26,150 - experiment_functions - INFO - Early stopping at epoch 550. Best Metrics: (0.022301864827674607, 0.014672131147540983, 0.022243628049560482)
2026-05-23 01:49:26,253 - optuna.study.study - INFO - Trial 131 finished with values: [0.022301864827674607, 0.014672131147540983, 0.022243628049560482] and parameters: {'n_layers': 2, 'embedding_dim': 256, 'lr': 0.004412673482764488, 'lambda_val': 0.0033582080301553614, 'batch_size': 670, 'optimizer': 'Adam'}.
2026-05-23 01:49:28,931 - experiment_functions - INFO - Early stopping at epoch 600. Best Metrics: (0.030173319392492425, 0.01639344262295082, 0.025567793289440928)
2026-05-23 01:49:29,022 - optuna.study.study - INFO - Trial 132 finished with values: [0.030173319392492425, 0.01639344262295082, 0.025567793289440928] and parameters: {'n_layers': 1, 'embedding_dim': 256, 'lr': 0.004412673482764488, 'lambda_val': 0.0029444127697785846, 'batch_size': 1056, 'optimizer': 'Adam'}.
2026-05-23 01:49:31,107 - experiment_functions - INFO - Early stopping at epoch 500. Best Metrics: (0.0015326176078537263, 0.0017213114754098366, 0.0023918741531481404)
2026-05-23 01:49:31,211 - optuna.study.study - INFO - Trial 133 finished with values: [0.0015326176078537263, 0.0017213114754098366, 0.0023918741531481404] and parameters: {'n_layers': 1, 'embedding_dim': 64, 'lr': 0.014145589328272088, 'lambda_val': 0.002050857292803853, 'batch_size': 658, 'optimizer': 'SGD'}.
2026-05-23 01:49:42,199 - experiment_functions - INFO - Early stopping at epoch 3350. Best Metrics: (0.023061376550055936, 0.016311475409836063, 0.023027429614866254)
2026-05-23 01:49:42,289 - optuna.study.study - INFO - Trial 134 finished with values: [0.023061376550055936, 0.016311475409836063, 0.023027429614866254] and parameters: {'n_layers': 3, 'embedding_dim': 96, 'lr': 0.000171992203307018, 'lambda_val': 0.0017105841747060543, 'batch_size': 3738, 'optimizer': 'Adam'}.
2026-05-23 01:49:44,883 - experiment_functions - INFO - Early stopping at epoch 500. Best Metrics: (0.002080661894994388, 0.0013934426229508196, 0.0018637118927848934)
2026-05-23 01:49:44,971 - optuna.study.study - INFO - Trial 135 finished with values: [0.002080661894994388, 0.0013934426229508196, 0.0018637118927848934] and parameters: {'n_layers': 2, 'embedding_dim': 128, 'lr': 2.598024728325829e-05, 'lambda_val': 0.0029444127697785846, 'batch_size': 3738, 'optimizer': 'SGD'}.
2026-05-23 01:49:47,316 - experiment_functions - INFO - Early stopping at epoch 550. Best Metrics: (0.020274900104637547, 0.0169672131147541, 0.02368993423060932)
2026-05-23 01:49:47,404 - optuna.study.study - INFO - Trial 136 finished with values: [0.020274900104637547, 0.0169672131147541, 0.02368993423060932] and parameters: {'n_layers': 1, 'embedding_dim': 128, 'lr': 0.016630265747118476, 'lambda_val': 2.93627524432445e-06, 'batch_size': 2893, 'optimizer': 'Adam'}.
2026-05-23 01:49:50,326 - experiment_functions - INFO - Early stopping at epoch 800. Best Metrics: (0.027839626420401477, 0.016065573770491805, 0.02442059444138508)
2026-05-23 01:49:51,108 - optuna.study.study - INFO - Trial 137 finished with values: [0.027839626420401477, 0.016065573770491805, 0.02442059444138508] and parameters: {'n_layers': 1, 'embedding_dim': 32, 'lr': 0.0021679791502810398, 'lambda_val': 0.001138541292442641, 'batch_size': 2080, 'optimizer': 'Adam'}.
2026-05-23 01:49:53,551 - experiment_functions - INFO - Early stopping at epoch 500. Best Metrics: (0.0025150817412439574, 0.001475409836065574, 0.0022015274725470176)
2026-05-23 01:49:53,641 - optuna.study.study - INFO - Trial 138 finished with values: [0.0025150817412439574, 0.001475409836065574, 0.0022015274725470176] and parameters: {'n_layers': 4, 'embedding_dim': 32, 'lr': 0.0018860187490457373, 'lambda_val': 5.152619492402854e-06, 'batch_size': 2515, 'optimizer': 'SGD'}.
2026-05-23 01:49:56,043 - experiment_functions - INFO - Early stopping at epoch 550. Best Metrics: (0.010576956319170317, 0.006639344262295083, 0.008539512208589214)
2026-05-23 01:49:56,129 - optuna.study.study - INFO - Trial 139 finished with values: [0.010576956319170317, 0.006639344262295083, 0.008539512208589214] and parameters: {'n_layers': 3, 'embedding_dim': 32, 'lr': 0.016630265747118476, 'lambda_val': 0.0017105841747060543, 'batch_size': 2748, 'optimizer': 'Adam'}.
2026-05-23 01:50:00,995 - experiment_functions - INFO - Early stopping at epoch 1000. Best Metrics: (0.030995914147957822, 0.01901639344262295, 0.029420296686139866)
