2026-05-23 01:41:02,169 - optuna.study.study - INFO - Trial 45 finished with values: [0.008111885669179484, 0.0069672131147540985, 0.008634463525430031] and parameters: {'n_layers': 4, 'embedding_dim': 96, 'lr': 0.011039877072000846, 'lambda_val': 7.912318709910659e-06, 'batch_size': 1674, 'optimizer': 'Adam'}.
2026-05-23 01:41:14,115 - experiment_functions - INFO - Early stopping at epoch 3850. Best Metrics: (0.023406620159776462, 0.01581967213114754, 0.023763438262167796)
2026-05-23 01:41:15,239 - optuna.study.study - INFO - Trial 46 finished with values: [0.023406620159776462, 0.01581967213114754, 0.023763438262167796] and parameters: {'n_layers': 3, 'embedding_dim': 128, 'lr': 0.00012489769900364984, 'lambda_val': 0.0033582080301553614, 'batch_size': 2893, 'optimizer': 'Adam'}.
2026-05-23 01:41:26,677 - optuna.study.study - INFO - Trial 47 finished with values: [0.02828095566597429, 0.017295081967213115, 0.023275583731492782] and parameters: {'n_layers': 3, 'embedding_dim': 32, 'lr': 0.0002669734398444981, 'lambda_val': 2.093095368912283e-06, 'batch_size': 3863, 'optimizer': 'Adam'}.
2026-05-23 01:41:29,379 - experiment_functions - INFO - Early stopping at epoch 750. Best Metrics: (0.018347119089211092, 0.011229508196721312, 0.0163842405712136)
2026-05-23 01:41:29,481 - optuna.study.study - INFO - Trial 48 finished with values: [0.018347119089211092, 0.011229508196721312, 0.0163842405712136] and parameters: {'n_layers': 3, 'embedding_dim': 96, 'lr': 0.014145589328272088, 'lambda_val': 3.5527193904659975e-05, 'batch_size': 658, 'optimizer': 'RMSprop'}.
2026-05-23 01:41:33,320 - experiment_functions - INFO - Early stopping at epoch 1300. Best Metrics: (0.014030950256102983, 0.008852459016393444, 0.011374078206312643)
2026-05-23 01:41:33,422 - optuna.study.study - INFO - Trial 49 finished with values: [0.014030950256102983, 0.008852459016393444, 0.011374078206312643] and parameters: {'n_layers': 4, 'embedding_dim': 32, 'lr': 0.03915443954540846, 'lambda_val': 3.303350326782547e-05, 'batch_size': 3840, 'optimizer': 'RMSprop'}.
2026-05-23 01:41:44,802 - optuna.study.study - INFO - Trial 50 finished with values: [0.00916082298293012, 0.0069672131147540985, 0.009446406808017022] and parameters: {'n_layers': 1, 'embedding_dim': 256, 'lr': 0.0001019807450449115, 'lambda_val': 7.337492410061229e-06, 'batch_size': 1048, 'optimizer': 'Adam'}.
2026-05-23 01:41:55,388 - optuna.study.study - INFO - Trial 51 finished with values: [0.021322672838105388, 0.012950819672131148, 0.020026800379492435] and parameters: {'n_layers': 1, 'embedding_dim': 64, 'lr': 0.00019017292293356, 'lambda_val': 2.8432891896341922e-06, 'batch_size': 2692, 'optimizer': 'Adam'}.
2026-05-23 01:41:57,774 - experiment_functions - INFO - Early stopping at epoch 600. Best Metrics: (0.0014762800587641305, 0.0013114754098360656, 0.0012217129153550854)
2026-05-23 01:41:57,870 - optuna.study.study - INFO - Trial 52 finished with values: [0.0014762800587641305, 0.0013114754098360656, 0.0012217129153550854] and parameters: {'n_layers': 3, 'embedding_dim': 96, 'lr': 0.03915443954540846, 'lambda_val': 3.303350326782547e-05, 'batch_size': 3840, 'optimizer': 'SGD'}.
2026-05-23 01:42:00,906 - experiment_functions - INFO - Early stopping at epoch 800. Best Metrics: (0.011746840663305764, 0.009754098360655737, 0.012837240421637128)
2026-05-23 01:42:01,004 - optuna.study.study - INFO - Trial 53 finished with values: [0.011746840663305764, 0.009754098360655737, 0.012837240421637128] and parameters: {'n_layers': 1, 'embedding_dim': 128, 'lr': 0.05607188434869406, 'lambda_val': 9.51579131949383e-06, 'batch_size': 902, 'optimizer': 'Adam'}.
2026-05-23 01:42:03,309 - experiment_functions - INFO - Early stopping at epoch 500. Best Metrics: (0.0018684822519629291, 0.0009836065573770494, 0.0011382632048089647)
2026-05-23 01:42:03,449 - optuna.study.study - INFO - Trial 54 finished with values: [0.0018684822519629291, 0.0009836065573770494, 0.0011382632048089647] and parameters: {'n_layers': 4, 'embedding_dim': 128, 'lr': 0.0018860187490457373, 'lambda_val': 0.0012603554083774884, 'batch_size': 3736, 'optimizer': 'SGD'}.
2026-05-23 01:42:06,106 - experiment_functions - INFO - Early stopping at epoch 800. Best Metrics: (0.03460499189712028, 0.02139344262295082, 0.03481107668163265)
2026-05-23 01:42:06,196 - optuna.study.study - INFO - Trial 55 finished with values: [0.03460499189712028, 0.02139344262295082, 0.03481107668163265] and parameters: {'n_layers': 1, 'embedding_dim': 128, 'lr': 0.0013488534539100193, 'lambda_val': 7.337492410061229e-06, 'batch_size': 733, 'optimizer': 'RMSprop'}.
2026-05-23 01:42:10,666 - experiment_functions - INFO - Early stopping at epoch 1650. Best Metrics: (0.002884557272304503, 0.0015573770491803278, 0.0022002282587564393)
2026-05-23 01:42:10,763 - optuna.study.study - INFO - Trial 56 finished with values: [0.002884557272304503, 0.0015573770491803278, 0.0022002282587564393] and parameters: {'n_layers': 2, 'embedding_dim': 96, 'lr': 1.1882399685564556e-05, 'lambda_val': 1.6409067079928013e-05, 'batch_size': 1124, 'optimizer': 'Adam'}.
2026-05-23 01:42:23,049 - optuna.study.study - INFO - Trial 57 finished with values: [0.01912183806798783, 0.013934426229508197, 0.018553998362158486] and parameters: {'n_layers': 3, 'embedding_dim': 128, 'lr': 0.00012667151006330983, 'lambda_val': 0.004048394957907183, 'batch_size': 1291, 'optimizer': 'Adam'}.
2026-05-23 01:42:26,290 - experiment_functions - INFO - Early stopping at epoch 900. Best Metrics: (0.024314903308388088, 0.01418032786885246, 0.024452235391625707)
2026-05-23 01:42:26,371 - optuna.study.study - INFO - Trial 58 finished with values: [0.024314903308388088, 0.01418032786885246, 0.024452235391625707] and parameters: {'n_layers': 3, 'embedding_dim': 32, 'lr': 0.0006696996604664924, 'lambda_val': 1.276982343137876e-06, 'batch_size': 3166, 'optimizer': 'RMSprop'}.
2026-05-23 01:42:29,383 - experiment_functions - INFO - Early stopping at epoch 1100. Best Metrics: (0.041500931722872086, 0.020081967213114754, 0.0321681318679799)
2026-05-23 01:42:29,477 - optuna.study.study - INFO - Trial 59 finished with values: [0.041500931722872086, 0.020081967213114754, 0.0321681318679799] and parameters: {'n_layers': 1, 'embedding_dim': 64, 'lr': 0.0013488534539100193, 'lambda_val': 0.001138541292442641, 'batch_size': 733, 'optimizer': 'Adam'}.
2026-05-23 01:42:31,988 - experiment_functions - INFO - Early stopping at epoch 550. Best Metrics: (0.007780860115225118, 0.005245901639344262, 0.006757786719910071)
2026-05-23 01:42:32,090 - optuna.study.study - INFO - Trial 60 finished with values: [0.007780860115225118, 0.005245901639344262, 0.006757786719910071] and parameters: {'n_layers': 4, 'embedding_dim': 32, 'lr': 0.014145589328272088, 'lambda_val': 3.303350326782547e-05, 'batch_size': 3840, 'optimizer': 'Adam'}.
2026-05-23 01:42:35,731 - experiment_functions - INFO - Early stopping at epoch 550. Best Metrics: (0.017861751384540898, 0.010737704918032786, 0.015880988824433128)
2026-05-23 01:42:35,817 - optuna.study.study - INFO - Trial 61 finished with values: [0.017861751384540898, 0.010737704918032786, 0.015880988824433128] and parameters: {'n_layers': 3, 'embedding_dim': 128, 'lr': 0.0022564826852050435, 'lambda_val': 0.0006161160999015657, 'batch_size': 2885, 'optimizer': 'RMSprop'}.
2026-05-23 01:42:48,910 - experiment_functions - INFO - Early stopping at epoch 3950. Best Metrics: (0.028172897168796566, 0.016639344262295082, 0.022646285372790797)
2026-05-23 01:42:49,011 - optuna.study.study - INFO - Trial 62 finished with values: [0.028172897168796566, 0.016639344262295082, 0.022646285372790797] and parameters: {'n_layers': 3, 'embedding_dim': 128, 'lr': 0.00012489769900364984, 'lambda_val': 0.0033582080301553614, 'batch_size': 2893, 'optimizer': 'Adam'}.
2026-05-23 01:42:51,245 - experiment_functions - INFO - Early stopping at epoch 550. Best Metrics: (0.019339595093888894, 0.011639344262295083, 0.01686773973497725)
2026-05-23 01:42:52,271 - optuna.study.study - INFO - Trial 63 finished with values: [0.019339595093888894, 0.011639344262295083, 0.01686773973497725] and parameters: {'n_layers': 1, 'embedding_dim': 128, 'lr': 0.015197561832328042, 'lambda_val': 7.337492410061229e-06, 'batch_size': 1048, 'optimizer': 'RMSprop'}.
2026-05-23 01:42:55,466 - experiment_functions - INFO - Early stopping at epoch 550. Best Metrics: (0.02938797244059276, 0.016065573770491805, 0.02465518292325806)
2026-05-23 01:42:55,560 - optuna.study.study - INFO - Trial 64 finished with values: [0.02938797244059276, 0.016065573770491805, 0.02465518292325806] and parameters: {'n_layers': 2, 'embedding_dim': 128, 'lr': 0.0018860187490457373, 'lambda_val': 0.0017105841747060543, 'batch_size': 3736, 'optimizer': 'RMSprop'}.
2026-05-23 01:42:58,002 - experiment_functions - INFO - Early stopping at epoch 550. Best Metrics: (0.01668477848653239, 0.009672131147540983, 0.015070414533658772)
2026-05-23 01:42:59,122 - optuna.study.study - INFO - Trial 65 finished with values: [0.01668477848653239, 0.009672131147540983, 0.015070414533658772] and parameters: {'n_layers': 3, 'embedding_dim': 96, 'lr': 0.01148659924395743, 'lambda_val': 6.3998980027240765e-06, 'batch_size': 2245, 'optimizer': 'RMSprop'}.
2026-05-23 01:43:01,746 - experiment_functions - INFO - Early stopping at epoch 600. Best Metrics: (0.010173250977816108, 0.0069672131147540985, 0.01069312319839602)
2026-05-23 01:43:03,040 - optuna.study.study - INFO - Trial 66 finished with values: [0.010173250977816108, 0.0069672131147540985, 0.01069312319839602] and parameters: {'n_layers': 4, 'embedding_dim': 96, 'lr': 0.05607188434869406, 'lambda_val': 1.4508587425405414e-05, 'batch_size': 1517, 'optimizer': 'RMSprop'}.
2026-05-23 01:43:11,600 - experiment_functions - INFO - Early stopping at epoch 3000. Best Metrics: (0.002906167038548706, 0.0028688524590163938, 0.004538202099587522)
2026-05-23 01:43:12,838 - optuna.study.study - INFO - Trial 67 finished with values: [0.002906167038548706, 0.0028688524590163938, 0.004538202099587522] and parameters: {'n_layers': 1, 'embedding_dim': 64, 'lr': 5.7356019292423966e-05, 'lambda_val': 0.0005795183242806687, 'batch_size': 3696, 'optimizer': 'RMSprop'}.
2026-05-23 01:43:15,513 - experiment_functions - INFO - Early stopping at epoch 700. Best Metrics: (0.01847967688134772, 0.012131147540983607, 0.01794029396196571)
2026-05-23 01:43:15,603 - optuna.study.study - INFO - Trial 68 finished with values: [0.01847967688134772, 0.012131147540983607, 0.01794029396196571] and parameters: {'n_layers': 1, 'embedding_dim': 96, 'lr': 0.014145589328272088, 'lambda_val': 3.5527193904659975e-05, 'batch_size': 3905, 'optimizer': 'RMSprop'}.
2026-05-23 01:43:25,204 - experiment_functions - INFO - Early stopping at epoch 3300. Best Metrics: (0.0029256278971604007, 0.0027049180327868854, 0.003262751133612124)
2026-05-23 01:43:25,402 - optuna.study.study - INFO - Trial 69 finished with values: [0.0029256278971604007, 0.0027049180327868854, 0.003262751133612124] and parameters: {'n_layers': 2, 'embedding_dim': 32, 'lr': 5.0130001272096357e-05, 'lambda_val': 0.00016721284221200204, 'batch_size': 3749, 'optimizer': 'Adam'}.
2026-05-23 01:43:28,284 - experiment_functions - INFO - Early stopping at epoch 750. Best Metrics: (0.029343323295366288, 0.017459016393442623, 0.025493725715983694)
2026-05-23 01:43:28,382 - optuna.study.study - INFO - Trial 70 finished with values: [0.029343323295366288, 0.017459016393442623, 0.025493725715983694] and parameters: {'n_layers': 1, 'embedding_dim': 64, 'lr': 0.0014494764650589468, 'lambda_val': 0.0005795183242806687, 'batch_size': 3696, 'optimizer': 'RMSprop'}.
2026-05-23 01:43:34,809 - experiment_functions - INFO - Early stopping at epoch 2050. Best Metrics: (0.01316288192052529, 0.007950819672131149, 0.011183017790828044)
2026-05-23 01:43:35,374 - optuna.study.study - INFO - Trial 71 finished with values: [0.01316288192052529, 0.007950819672131149, 0.011183017790828044] and parameters: {'n_layers': 3, 'embedding_dim': 64, 'lr': 0.018609581650602815, 'lambda_val': 4.75474570432114e-06, 'batch_size': 2068, 'optimizer': 'Adam'}.
2026-05-23 01:43:38,135 - experiment_functions - INFO - Early stopping at epoch 750. Best Metrics: (0.001322213482283354, 0.0013934426229508198, 0.0013983678903994724)
2026-05-23 01:43:38,220 - optuna.study.study - INFO - Trial 72 finished with values: [0.001322213482283354, 0.0013934426229508198, 0.0013983678903994724] and parameters: {'n_layers': 2, 'embedding_dim': 64, 'lr': 1.3008210553089148e-05, 'lambda_val': 0.011699672946137418, 'batch_size': 764, 'optimizer': 'Adam'}.
2026-05-23 01:43:40,767 - experiment_functions - INFO - Early stopping at epoch 600. Best Metrics: (0.026637895207390763, 0.015081967213114757, 0.023172292232701952)
2026-05-23 01:43:40,842 - optuna.study.study - INFO - Trial 73 finished with values: [0.026637895207390763, 0.015081967213114757, 0.023172292232701952] and parameters: {'n_layers': 2, 'embedding_dim': 64, 'lr': 0.0014494764650589468, 'lambda_val': 6.143416262245802e-05, 'batch_size': 3696, 'optimizer': 'RMSprop'}.
2026-05-23 01:43:51,657 - experiment_functions - INFO - Early stopping at epoch 3750. Best Metrics: (0.0018692766218486095, 0.002049180327868853, 0.002341080419384726)
2026-05-23 01:43:51,756 - optuna.study.study - INFO - Trial 74 finished with values: [0.0018692766218486095, 0.002049180327868853, 0.002341080419384726] and parameters: {'n_layers': 2, 'embedding_dim': 96, 'lr': 3.462745060329417e-05, 'lambda_val': 1.6409067079928013e-05, 'batch_size': 2252, 'optimizer': 'Adam'}.
2026-05-23 01:44:03,078 - optuna.study.study - INFO - Trial 75 finished with values: [0.017514356803242863, 0.010737704918032788, 0.017095445646009746] and parameters: {'n_layers': 2, 'embedding_dim': 32, 'lr': 0.00018537483068886885, 'lambda_val': 0.0029444127697785846, 'batch_size': 833, 'optimizer': 'Adam'}.
2026-05-23 01:44:05,516 - experiment_functions - INFO - Early stopping at epoch 550. Best Metrics: (0.025623951817939725, 0.01459016393442623, 0.020996838397060336)
2026-05-23 01:44:05,593 - optuna.study.study - INFO - Trial 76 finished with values: [0.025623951817939725, 0.01459016393442623, 0.020996838397060336] and parameters: {'n_layers': 2, 'embedding_dim': 96, 'lr': 0.0022564826852050435, 'lambda_val': 3.7205125829824535e-06, 'batch_size': 3861, 'optimizer': 'RMSprop'}.
2026-05-23 01:44:11,127 - experiment_functions - INFO - Early stopping at epoch 1550. Best Metrics: (0.031311878511258655, 0.017540983606557377, 0.02931801094772215)
2026-05-23 01:44:11,805 - optuna.study.study - INFO - Trial 77 finished with values: [0.031311878511258655, 0.017540983606557377, 0.02931801094772215] and parameters: {'n_layers': 1, 'embedding_dim': 256, 'lr': 0.00036519209261400785, 'lambda_val': 0.00038573936819964353, 'batch_size': 3166, 'optimizer': 'RMSprop'}.
2026-05-23 01:44:14,030 - experiment_functions - INFO - Early stopping at epoch 500. Best Metrics: (0.002450341928647673, 0.0013114754098360656, 0.0017195572998683429)
2026-05-23 01:44:14,127 - optuna.study.study - INFO - Trial 78 finished with values: [0.002450341928647673, 0.0013114754098360656, 0.0017195572998683429] and parameters: {'n_layers': 3, 'embedding_dim': 64, 'lr': 0.034233573938468376, 'lambda_val': 9.51579131949383e-06, 'batch_size': 3905, 'optimizer': 'SGD'}.
2026-05-23 01:44:16,651 - experiment_functions - INFO - Early stopping at epoch 700. Best Metrics: (0.0034872799946981414, 0.0018852459016393442, 0.002815303297860692)
2026-05-23 01:44:16,749 - optuna.study.study - INFO - Trial 79 finished with values: [0.0034872799946981414, 0.0018852459016393442, 0.002815303297860692] and parameters: {'n_layers': 1, 'embedding_dim': 128, 'lr': 0.0014494764650589468, 'lambda_val': 3.7205125829824535e-06, 'batch_size': 728, 'optimizer': 'SGD'}.
2026-05-23 01:44:19,165 - experiment_functions - INFO - Early stopping at epoch 500. Best Metrics: (0.0011525417720696935, 0.0018032786885245904, 0.001722390928820979)
2026-05-23 01:44:19,248 - optuna.study.study - INFO - Trial 80 finished with values: [0.0011525417720696935, 0.0018032786885245904, 0.001722390928820979] and parameters: {'n_layers': 4, 'embedding_dim': 128, 'lr': 0.00012489769900364984, 'lambda_val': 0.0033582080301553614, 'batch_size': 841, 'optimizer': 'SGD'}.
2026-05-23 01:44:22,503 - experiment_functions - INFO - Early stopping at epoch 900. Best Metrics: (0.03853821120430629, 0.02057377049180328, 0.03351274945405273)
2026-05-23 01:44:22,588 - optuna.study.study - INFO - Trial 81 finished with values: [0.03853821120430629, 0.02057377049180328, 0.03351274945405273] and parameters: {'n_layers': 1, 'embedding_dim': 128, 'lr': 0.0022564826852050435, 'lambda_val': 3.7205125829824535e-06, 'batch_size': 728, 'optimizer': 'Adam'}.
2026-05-23 01:44:26,229 - experiment_functions - INFO - Early stopping at epoch 1000. Best Metrics: (0.022386577862416417, 0.01278688524590164, 0.01829316689065908)
2026-05-23 01:44:26,575 - optuna.study.study - INFO - Trial 82 finished with values: [0.022386577862416417, 0.01278688524590164, 0.01829316689065908] and parameters: {'n_layers': 3, 'embedding_dim': 32, 'lr': 0.0006111868479200038, 'lambda_val': 0.0017105841747060543, 'batch_size': 2893, 'optimizer': 'Adam'}.
2026-05-23 01:44:29,263 - experiment_functions - INFO - Early stopping at epoch 550. Best Metrics: (0.03235700121927493, 0.018934426229508198, 0.02780044239818994)
2026-05-23 01:44:29,622 - optuna.study.study - INFO - Trial 83 finished with values: [0.03235700121927493, 0.018934426229508198, 0.02780044239818994] and parameters: {'n_layers': 2, 'embedding_dim': 256, 'lr': 0.004412673482764488, 'lambda_val': 0.0029444127697785846, 'batch_size': 1056, 'optimizer': 'Adam'}.
2026-05-23 01:44:32,436 - experiment_functions - INFO - Early stopping at epoch 550. Best Metrics: (0.017930219048059592, 0.010245901639344262, 0.01414795681659113)
2026-05-23 01:44:32,622 - optuna.study.study - INFO - Trial 84 finished with values: [0.017930219048059592, 0.010245901639344262, 0.01414795681659113] and parameters: {'n_layers': 3, 'embedding_dim': 96, 'lr': 0.014145589328272088, 'lambda_val': 3.5527193904659975e-05, 'batch_size': 902, 'optimizer': 'Adam'}.
2026-05-23 01:44:35,219 - experiment_functions - INFO - Early stopping at epoch 550. Best Metrics: (0.01168843150194492, 0.006803278688524591, 0.009946808779397636)
2026-05-23 01:44:35,316 - optuna.study.study - INFO - Trial 85 finished with values: [0.01168843150194492, 0.006803278688524591, 0.009946808779397636] and parameters: {'n_layers': 3, 'embedding_dim': 128, 'lr': 0.03831974283319575, 'lambda_val': 3.7205125829824535e-06, 'batch_size': 3584, 'optimizer': 'Adam'}.
2026-05-23 01:44:40,566 - experiment_functions - INFO - Early stopping at epoch 1550. Best Metrics: (0.02937394066418776, 0.018032786885245903, 0.026356154540584743)
2026-05-23 01:44:40,670 - optuna.study.study - INFO - Trial 86 finished with values: [0.02937394066418776, 0.018032786885245903, 0.026356154540584743] and parameters: {'n_layers': 2, 'embedding_dim': 96, 'lr': 0.0002669734398444981, 'lambda_val': 1.901210707193677e-05, 'batch_size': 3801, 'optimizer': 'Adam'}.
2026-05-23 01:44:42,976 - experiment_functions - INFO - Early stopping at epoch 550. Best Metrics: (0.019028132692926133, 0.01237704918032787, 0.018319706782705586)
2026-05-23 01:44:43,980 - optuna.study.study - INFO - Trial 87 finished with values: [0.019028132692926133, 0.01237704918032787, 0.018319706782705586] and parameters: {'n_layers': 1, 'embedding_dim': 32, 'lr': 0.034233573938468376, 'lambda_val': 0.00028698928719198935, 'batch_size': 3905, 'optimizer': 'Adam'}.
2026-05-23 01:44:47,503 - experiment_functions - INFO - Early stopping at epoch 900. Best Metrics: (0.012743156264894764, 0.008278688524590166, 0.011738506057011742)
2026-05-23 01:44:47,590 - optuna.study.study - INFO - Trial 88 finished with values: [0.012743156264894764, 0.008278688524590166, 0.011738506057011742] and parameters: {'n_layers': 2, 'embedding_dim': 128, 'lr': 0.03831974283319575, 'lambda_val': 0.0005795183242806687, 'batch_size': 3696, 'optimizer': 'RMSprop'}.
2026-05-23 01:44:49,978 - experiment_functions - INFO - Early stopping at epoch 550. Best Metrics: (0.012538536295999478, 0.009344262295081968, 0.011638225552166759)
2026-05-23 01:44:50,068 - optuna.study.study - INFO - Trial 89 finished with values: [0.012538536295999478, 0.009344262295081968, 0.011638225552166759] and parameters: {'n_layers': 3, 'embedding_dim': 128, 'lr': 0.01148659924395743, 'lambda_val': 0.0029444127697785846, 'batch_size': 833, 'optimizer': 'Adam'}.
2026-05-23 01:45:01,963 - optuna.study.study - INFO - Trial 90 finished with values: [0.0025892219589246693, 0.002950819672131148, 0.003500443518573204] and parameters: {'n_layers': 3, 'embedding_dim': 96, 'lr': 4.3246218222629636e-05, 'lambda_val': 7.032468787159558e-05, 'batch_size': 1770, 'optimizer': 'RMSprop'}.
2026-05-23 01:45:11,372 - experiment_functions - INFO - Early stopping at epoch 2700. Best Metrics: (0.022403884213187314, 0.014508196721311475, 0.020143973221687615)
2026-05-23 01:45:12,214 - optuna.study.study - INFO - Trial 91 finished with values: [0.022403884213187314, 0.014508196721311475, 0.020143973221687615] and parameters: {'n_layers': 3, 'embedding_dim': 128, 'lr': 0.00012667151006330983, 'lambda_val': 0.012826080211321403, 'batch_size': 3584, 'optimizer': 'Adam'}.
2026-05-23 01:45:14,555 - experiment_functions - INFO - Early stopping at epoch 500. Best Metrics: (0.005028860031882043, 0.00459016393442623, 0.0073359739272777155)
