2026-05-22 23:57:20,939 - optuna.study.study - INFO - Trial 135 finished with values: [0.010003245915106653, 0.012049180327868853, 0.014888751704550873] and parameters: {'n_layers': 3, 'embedding_dim': 64, 'lr': 0.02143903136401803, 'lambda_val': 0.0003143503113741062, 'batch_size': 3969, 'optimizer': 'Adam'}.
2026-05-22 23:57:26,835 - experiment_functions - INFO - Early stopping at epoch 1350. Best Metrics: (0.012195783876016126, 0.011803278688524592, 0.017319830392207507)
2026-05-22 23:57:27,707 - optuna.study.study - INFO - Trial 136 finished with values: [0.012195783876016126, 0.011803278688524592, 0.017319830392207507] and parameters: {'n_layers': 2, 'embedding_dim': 32, 'lr': 0.016757203845338013, 'lambda_val': 0.00023986489473645103, 'batch_size': 3526, 'optimizer': 'Adam'}.
2026-05-22 23:57:44,023 - experiment_functions - INFO - Early stopping at epoch 2400. Best Metrics: (0.01708859900391185, 0.01581967213114754, 0.02163579901798287)
2026-05-22 23:57:44,529 - optuna.study.study - INFO - Trial 137 finished with values: [0.01708859900391185, 0.01581967213114754, 0.02163579901798287] and parameters: {'n_layers': 3, 'embedding_dim': 256, 'lr': 0.006178111746348912, 'lambda_val': 4.890741275615565e-05, 'batch_size': 3526, 'optimizer': 'RMSprop'}.
2026-05-22 23:58:01,555 - experiment_functions - INFO - Early stopping at epoch 3950. Best Metrics: (0.004586376711174616, 0.0069672131147540985, 0.00794604757141458)
2026-05-22 23:58:01,671 - optuna.study.study - INFO - Trial 138 finished with values: [0.004586376711174616, 0.0069672131147540985, 0.00794604757141458] and parameters: {'n_layers': 4, 'embedding_dim': 96, 'lr': 3.328770811653986e-05, 'lambda_val': 0.00023986489473645103, 'batch_size': 2851, 'optimizer': 'Adam'}.
2026-05-22 23:58:05,885 - experiment_functions - INFO - Early stopping at epoch 900. Best Metrics: (0.005185162267554474, 0.00778688524590164, 0.008519265236287854)
2026-05-22 23:58:06,025 - optuna.study.study - INFO - Trial 139 finished with values: [0.005185162267554474, 0.00778688524590164, 0.008519265236287854] and parameters: {'n_layers': 2, 'embedding_dim': 32, 'lr': 0.008919635780751861, 'lambda_val': 0.0007844384959792041, 'batch_size': 2552, 'optimizer': 'Adam'}.
2026-05-22 23:58:15,276 - experiment_functions - INFO - Early stopping at epoch 2200. Best Metrics: (0.009750266166099671, 0.011639344262295081, 0.014183528142271641)
2026-05-22 23:58:15,419 - optuna.study.study - INFO - Trial 140 finished with values: [0.009750266166099671, 0.011639344262295081, 0.014183528142271641] and parameters: {'n_layers': 2, 'embedding_dim': 96, 'lr': 0.02773153918226887, 'lambda_val': 0.0006106302283455917, 'batch_size': 2393, 'optimizer': 'Adam'}.
2026-05-22 23:58:18,585 - experiment_functions - INFO - Early stopping at epoch 600. Best Metrics: (0.005865509218454444, 0.008688524590163935, 0.00939279647718398)
2026-05-22 23:58:19,016 - optuna.study.study - INFO - Trial 141 finished with values: [0.005865509218454444, 0.008688524590163935, 0.00939279647718398] and parameters: {'n_layers': 4, 'embedding_dim': 96, 'lr': 0.00038603420377640905, 'lambda_val': 9.729046499667907e-06, 'batch_size': 759, 'optimizer': 'Adam'}.
2026-05-22 23:58:29,156 - experiment_functions - INFO - Early stopping at epoch 2450. Best Metrics: (0.009128376461029009, 0.0130327868852459, 0.015658154973334722)
2026-05-22 23:58:29,440 - optuna.study.study - INFO - Trial 142 finished with values: [0.009128376461029009, 0.0130327868852459, 0.015658154973334722] and parameters: {'n_layers': 2, 'embedding_dim': 128, 'lr': 0.006178111746348912, 'lambda_val': 1.6125850011814465e-06, 'batch_size': 2552, 'optimizer': 'RMSprop'}.
2026-05-22 23:58:36,458 - experiment_functions - INFO - Early stopping at epoch 1500. Best Metrics: (0.014296344988584715, 0.01278688524590164, 0.018540920955990855)
2026-05-22 23:58:36,539 - optuna.study.study - INFO - Trial 143 finished with values: [0.014296344988584715, 0.01278688524590164, 0.018540920955990855] and parameters: {'n_layers': 4, 'embedding_dim': 64, 'lr': 0.01852608372473555, 'lambda_val': 1.0988779505731458e-05, 'batch_size': 2919, 'optimizer': 'Adam'}.
2026-05-22 23:58:40,559 - experiment_functions - INFO - Early stopping at epoch 800. Best Metrics: (0.011000318156535842, 0.01377049180327869, 0.016123159131022115)
2026-05-22 23:58:40,699 - optuna.study.study - INFO - Trial 144 finished with values: [0.011000318156535842, 0.01377049180327869, 0.016123159131022115] and parameters: {'n_layers': 2, 'embedding_dim': 64, 'lr': 0.0602894258387779, 'lambda_val': 3.7696639076813204e-06, 'batch_size': 3969, 'optimizer': 'Adam'}.
2026-05-22 23:58:47,513 - experiment_functions - INFO - Early stopping at epoch 900. Best Metrics: (0.008504358497433149, 0.010901639344262295, 0.013159476846259774)
2026-05-22 23:58:47,746 - optuna.study.study - INFO - Trial 145 finished with values: [0.008504358497433149, 0.010901639344262295, 0.013159476846259774] and parameters: {'n_layers': 2, 'embedding_dim': 96, 'lr': 0.0602894258387779, 'lambda_val': 0.0005183974282222809, 'batch_size': 1815, 'optimizer': 'Adam'}.
2026-05-22 23:58:50,720 - experiment_functions - INFO - Early stopping at epoch 550. Best Metrics: (0.004477096652720587, 0.005737704918032787, 0.007372764736202639)
2026-05-22 23:58:50,811 - optuna.study.study - INFO - Trial 146 finished with values: [0.004477096652720587, 0.005737704918032787, 0.007372764736202639] and parameters: {'n_layers': 2, 'embedding_dim': 32, 'lr': 0.016757203845338013, 'lambda_val': 0.015888794129512725, 'batch_size': 2505, 'optimizer': 'Adam'}.
2026-05-22 23:58:55,623 - experiment_functions - INFO - Early stopping at epoch 1000. Best Metrics: (0.002649045783699788, 0.001967213114754099, 0.002302740643571234)
2026-05-22 23:58:55,717 - optuna.study.study - INFO - Trial 147 finished with values: [0.002649045783699788, 0.001967213114754099, 0.002302740643571234] and parameters: {'n_layers': 4, 'embedding_dim': 64, 'lr': 0.02773153918226887, 'lambda_val': 0.0007844384959792041, 'batch_size': 2919, 'optimizer': 'SGD'}.
2026-05-22 23:59:12,899 - optuna.study.study - INFO - Trial 148 finished with values: [0.014400905520073556, 0.013196721311475411, 0.019080998047086146] and parameters: {'n_layers': 4, 'embedding_dim': 32, 'lr': 0.016757203845338013, 'lambda_val': 2.590190399307384e-06, 'batch_size': 2489, 'optimizer': 'RMSprop'}.
2026-05-22 23:59:16,021 - experiment_functions - INFO - Early stopping at epoch 550. Best Metrics: (0.016660819068438856, 0.012459016393442622, 0.017006044162829505)
2026-05-22 23:59:16,114 - optuna.study.study - INFO - Trial 149 finished with values: [0.016660819068438856, 0.012459016393442622, 0.017006044162829505] and parameters: {'n_layers': 3, 'embedding_dim': 256, 'lr': 0.06796687548548233, 'lambda_val': 3.7696639076813204e-06, 'batch_size': 3239, 'optimizer': 'Adam'}.
2026-05-22 23:59:21,548 - experiment_functions - INFO - Early stopping at epoch 1150. Best Metrics: (0.01202193325645692, 0.014344262295081968, 0.018992195138673326)
2026-05-22 23:59:21,646 - optuna.study.study - INFO - Trial 150 finished with values: [0.01202193325645692, 0.014344262295081968, 0.018992195138673326] and parameters: {'n_layers': 2, 'embedding_dim': 256, 'lr': 0.006178111746348912, 'lambda_val': 1.5257841801841251e-06, 'batch_size': 3526, 'optimizer': 'RMSprop'}.
2026-05-22 23:59:27,343 - experiment_functions - INFO - Early stopping at epoch 1150. Best Metrics: (0.015437256143037535, 0.012049180327868855, 0.01751459465822866)
2026-05-22 23:59:27,432 - optuna.study.study - INFO - Trial 151 finished with values: [0.015437256143037535, 0.012049180327868855, 0.01751459465822866] and parameters: {'n_layers': 4, 'embedding_dim': 256, 'lr': 0.032125088922163904, 'lambda_val': 4.890741275615565e-05, 'batch_size': 2123, 'optimizer': 'RMSprop'}.
2026-05-22 23:59:31,324 - experiment_functions - INFO - Early stopping at epoch 650. Best Metrics: (0.009601653097858645, 0.008278688524590166, 0.011745575965202336)
2026-05-22 23:59:31,984 - optuna.study.study - INFO - Trial 152 finished with values: [0.009601653097858645, 0.008278688524590166, 0.011745575965202336] and parameters: {'n_layers': 4, 'embedding_dim': 32, 'lr': 0.00025936530841656286, 'lambda_val': 3.7696639076813204e-06, 'batch_size': 1462, 'optimizer': 'RMSprop'}.
2026-05-22 23:59:34,577 - experiment_functions - INFO - Early stopping at epoch 500. Best Metrics: (0.007313662234625093, 0.006639344262295082, 0.008512392191360353)
2026-05-22 23:59:34,702 - optuna.study.study - INFO - Trial 153 finished with values: [0.007313662234625093, 0.006639344262295082, 0.008512392191360353] and parameters: {'n_layers': 2, 'embedding_dim': 96, 'lr': 0.006178111746348912, 'lambda_val': 0.0028012017793271654, 'batch_size': 1815, 'optimizer': 'RMSprop'}.
2026-05-22 23:59:43,302 - experiment_functions - INFO - Early stopping at epoch 1550. Best Metrics: (0.02113222309557237, 0.015081967213114753, 0.022385565138626894)
2026-05-22 23:59:43,383 - optuna.study.study - INFO - Trial 154 finished with values: [0.02113222309557237, 0.015081967213114753, 0.022385565138626894] and parameters: {'n_layers': 4, 'embedding_dim': 32, 'lr': 0.032125088922163904, 'lambda_val': 9.956828255961624e-05, 'batch_size': 2552, 'optimizer': 'RMSprop'}.
2026-05-22 23:59:50,309 - experiment_functions - INFO - Early stopping at epoch 1500. Best Metrics: (0.0031180770969230134, 0.002704918032786885, 0.003602500056650534)
2026-05-22 23:59:50,633 - optuna.study.study - INFO - Trial 155 finished with values: [0.0031180770969230134, 0.002704918032786885, 0.003602500056650534] and parameters: {'n_layers': 4, 'embedding_dim': 32, 'lr': 2.43049183930667e-05, 'lambda_val': 2.0926872137727736e-06, 'batch_size': 2919, 'optimizer': 'Adam'}.
2026-05-22 23:59:55,640 - experiment_functions - INFO - Early stopping at epoch 1000. Best Metrics: (0.010002294907810802, 0.008114754098360658, 0.009503043169199796)
2026-05-22 23:59:56,032 - optuna.study.study - INFO - Trial 156 finished with values: [0.010002294907810802, 0.008114754098360658, 0.009503043169199796] and parameters: {'n_layers': 4, 'embedding_dim': 32, 'lr': 0.000256256720478359, 'lambda_val': 3.6825405372336213e-06, 'batch_size': 3526, 'optimizer': 'Adam'}.
2026-05-23 00:00:06,852 - experiment_functions - INFO - Early stopping at epoch 2450. Best Metrics: (0.015561250921941536, 0.013196721311475408, 0.017445291472743034)
2026-05-23 00:00:07,213 - optuna.study.study - INFO - Trial 157 finished with values: [0.015561250921941536, 0.013196721311475408, 0.017445291472743034] and parameters: {'n_layers': 4, 'embedding_dim': 32, 'lr': 0.02143903136401803, 'lambda_val': 0.0003143503113741062, 'batch_size': 3977, 'optimizer': 'Adam'}.
2026-05-23 00:00:13,951 - experiment_functions - INFO - Early stopping at epoch 1500. Best Metrics: (0.015241702126543374, 0.01557377049180328, 0.020500584872384885)
2026-05-23 00:00:14,219 - optuna.study.study - INFO - Trial 158 finished with values: [0.015241702126543374, 0.01557377049180328, 0.020500584872384885] and parameters: {'n_layers': 3, 'embedding_dim': 128, 'lr': 0.012476072772677116, 'lambda_val': 1.0988779505731458e-05, 'batch_size': 2919, 'optimizer': 'RMSprop'}.
2026-05-23 00:00:26,872 - experiment_functions - INFO - Early stopping at epoch 3800. Best Metrics: (0.013211866662802614, 0.013688524590163937, 0.01722708913519962)
2026-05-23 00:00:26,984 - optuna.study.study - INFO - Trial 159 finished with values: [0.013211866662802614, 0.013688524590163937, 0.01722708913519962] and parameters: {'n_layers': 2, 'embedding_dim': 32, 'lr': 0.018337233363976534, 'lambda_val': 1.5257841801841251e-06, 'batch_size': 1657, 'optimizer': 'Adam'}.
2026-05-23 00:00:30,454 - experiment_functions - INFO - Early stopping at epoch 600. Best Metrics: (0.005025655863448132, 0.006721311475409837, 0.007844596766312847)
2026-05-23 00:00:30,822 - optuna.study.study - INFO - Trial 160 finished with values: [0.005025655863448132, 0.006721311475409837, 0.007844596766312847] and parameters: {'n_layers': 4, 'embedding_dim': 256, 'lr': 0.02143903136401803, 'lambda_val': 0.0014282889362088225, 'batch_size': 1845, 'optimizer': 'Adam'}.
2026-05-23 00:00:33,888 - experiment_functions - INFO - Early stopping at epoch 550. Best Metrics: (0.005702007018581239, 0.007622950819672132, 0.00877538716662943)
2026-05-23 00:00:33,982 - optuna.study.study - INFO - Trial 161 finished with values: [0.005702007018581239, 0.007622950819672132, 0.00877538716662943] and parameters: {'n_layers': 4, 'embedding_dim': 64, 'lr': 0.0034872026493997328, 'lambda_val': 3.141355282427041e-06, 'batch_size': 2919, 'optimizer': 'Adam'}.
2026-05-23 00:00:40,607 - experiment_functions - INFO - Early stopping at epoch 1500. Best Metrics: (0.008989498861688504, 0.010081967213114754, 0.012554536994545635)
2026-05-23 00:00:40,705 - optuna.study.study - INFO - Trial 162 finished with values: [0.008989498861688504, 0.010081967213114754, 0.012554536994545635] and parameters: {'n_layers': 3, 'embedding_dim': 96, 'lr': 0.02773153918226887, 'lambda_val': 0.0006106302283455917, 'batch_size': 2919, 'optimizer': 'Adam'}.
2026-05-23 00:00:43,523 - experiment_functions - INFO - Early stopping at epoch 550. Best Metrics: (0.006863967680352313, 0.007459016393442623, 0.010113503617378844)
2026-05-23 00:00:44,369 - optuna.study.study - INFO - Trial 163 finished with values: [0.006863967680352313, 0.007459016393442623, 0.010113503617378844] and parameters: {'n_layers': 3, 'embedding_dim': 64, 'lr': 0.0034872026493997328, 'lambda_val': 9.956828255961624e-05, 'batch_size': 1449, 'optimizer': 'Adam'}.
2026-05-23 00:00:47,536 - experiment_functions - INFO - Early stopping at epoch 550. Best Metrics: (0.008747584775119496, 0.008852459016393444, 0.01073299285091871)
2026-05-23 00:00:48,213 - optuna.study.study - INFO - Trial 164 finished with values: [0.008747584775119496, 0.008852459016393444, 0.01073299285091871] and parameters: {'n_layers': 4, 'embedding_dim': 64, 'lr': 0.0034872026493997328, 'lambda_val': 9.956828255961624e-05, 'batch_size': 3969, 'optimizer': 'Adam'}.
2026-05-23 00:00:50,980 - experiment_functions - INFO - Early stopping at epoch 500. Best Metrics: (0.0022953874100507567, 0.0017213114754098362, 0.002715565656084982)
2026-05-23 00:00:51,073 - optuna.study.study - INFO - Trial 165 finished with values: [0.0022953874100507567, 0.0017213114754098362, 0.002715565656084982] and parameters: {'n_layers': 4, 'embedding_dim': 64, 'lr': 0.01852608372473555, 'lambda_val': 1.0988779505731458e-05, 'batch_size': 1012, 'optimizer': 'SGD'}.
2026-05-23 00:00:55,790 - experiment_functions - INFO - Early stopping at epoch 950. Best Metrics: (0.004068152984194193, 0.0069672131147540985, 0.007776134164410718)
2026-05-23 00:00:55,878 - optuna.study.study - INFO - Trial 166 finished with values: [0.004068152984194193, 0.0069672131147540985, 0.007776134164410718] and parameters: {'n_layers': 4, 'embedding_dim': 32, 'lr': 0.012476072772677116, 'lambda_val': 7.367374344877376e-05, 'batch_size': 2505, 'optimizer': 'Adam'}.
2026-05-23 00:01:09,488 - experiment_functions - INFO - Early stopping at epoch 3300. Best Metrics: (0.018429182416054554, 0.016475409836065574, 0.021382847409947586)
2026-05-23 00:01:09,571 - optuna.study.study - INFO - Trial 167 finished with values: [0.018429182416054554, 0.016475409836065574, 0.021382847409947586] and parameters: {'n_layers': 3, 'embedding_dim': 32, 'lr': 0.06796687548548233, 'lambda_val': 0.00010360674255217468, 'batch_size': 2505, 'optimizer': 'Adam'}.
2026-05-23 00:01:15,268 - experiment_functions - INFO - Early stopping at epoch 1150. Best Metrics: (0.01225960722456657, 0.009426229508196722, 0.013911110947540625)
2026-05-23 00:01:15,354 - optuna.study.study - INFO - Trial 168 finished with values: [0.01225960722456657, 0.009426229508196722, 0.013911110947540625] and parameters: {'n_layers': 4, 'embedding_dim': 64, 'lr': 0.032125088922163904, 'lambda_val': 2.590190399307384e-06, 'batch_size': 2123, 'optimizer': 'RMSprop'}.
2026-05-23 00:01:17,958 - experiment_functions - INFO - Early stopping at epoch 500. Best Metrics: (0.009738283520047325, 0.011065573770491803, 0.01449968253469062)
2026-05-23 00:01:18,045 - optuna.study.study - INFO - Trial 169 finished with values: [0.009738283520047325, 0.011065573770491803, 0.01449968253469062] and parameters: {'n_layers': 2, 'embedding_dim': 128, 'lr': 0.032125088922163904, 'lambda_val': 0.00010422468651869774, 'batch_size': 1657, 'optimizer': 'RMSprop'}.
2026-05-23 00:01:21,043 - experiment_functions - INFO - Early stopping at epoch 550. Best Metrics: (0.008460970148266323, 0.009098360655737705, 0.010181860923615758)
2026-05-23 00:01:21,136 - optuna.study.study - INFO - Trial 170 finished with values: [0.008460970148266323, 0.009098360655737705, 0.010181860923615758] and parameters: {'n_layers': 4, 'embedding_dim': 96, 'lr': 0.0034872026493997328, 'lambda_val': 0.0005183974282222809, 'batch_size': 1815, 'optimizer': 'Adam'}.
2026-05-23 00:01:28,443 - experiment_functions - INFO - Early stopping at epoch 1500. Best Metrics: (0.015420516995095999, 0.01639344262295082, 0.02020575522471623)
2026-05-23 00:01:28,578 - optuna.study.study - INFO - Trial 171 finished with values: [0.015420516995095999, 0.01639344262295082, 0.02020575522471623] and parameters: {'n_layers': 3, 'embedding_dim': 256, 'lr': 0.02143903136401803, 'lambda_val': 4.890741275615565e-05, 'batch_size': 3969, 'optimizer': 'Adam'}.
2026-05-23 00:01:35,233 - experiment_functions - INFO - Early stopping at epoch 1550. Best Metrics: (0.013222138720911042, 0.012950819672131148, 0.0181756304509411)
2026-05-23 00:01:35,297 - optuna.study.study - INFO - Trial 172 finished with values: [0.013222138720911042, 0.012950819672131148, 0.0181756304509411] and parameters: {'n_layers': 3, 'embedding_dim': 96, 'lr': 0.016757203845338013, 'lambda_val': 8.019970575757968e-05, 'batch_size': 1557, 'optimizer': 'Adam'}.
2026-05-23 00:01:38,179 - experiment_functions - INFO - Early stopping at epoch 550. Best Metrics: (0.005211935849698098, 0.008442622950819673, 0.009620226671242604)
2026-05-23 00:01:38,761 - optuna.study.study - INFO - Trial 173 finished with values: [0.005211935849698098, 0.008442622950819673, 0.009620226671242604] and parameters: {'n_layers': 3, 'embedding_dim': 96, 'lr': 0.0006693247579890929, 'lambda_val': 5.7691148409924975e-05, 'batch_size': 1657, 'optimizer': 'RMSprop'}.
2026-05-23 00:01:42,010 - experiment_functions - INFO - Early stopping at epoch 650. Best Metrics: (0.009985680389677102, 0.009672131147540983, 0.010771355885235558)
2026-05-23 00:01:42,106 - optuna.study.study - INFO - Trial 174 finished with values: [0.009985680389677102, 0.009672131147540983, 0.010771355885235558] and parameters: {'n_layers': 3, 'embedding_dim': 96, 'lr': 0.0006693247579890929, 'lambda_val': 5.7691148409924975e-05, 'batch_size': 1137, 'optimizer': 'Adam'}.
2026-05-23 00:01:47,497 - experiment_functions - INFO - Early stopping at epoch 1200. Best Metrics: (0.016425980082999947, 0.016475409836065574, 0.02187172878413985)
2026-05-23 00:01:47,929 - optuna.study.study - INFO - Trial 175 finished with values: [0.016425980082999947, 0.016475409836065574, 0.02187172878413985] and parameters: {'n_layers': 3, 'embedding_dim': 32, 'lr': 0.032125088922163904, 'lambda_val': 7.367374344877376e-05, 'batch_size': 2552, 'optimizer': 'RMSprop'}.
2026-05-23 00:02:00,028 - experiment_functions - INFO - Early stopping at epoch 2700. Best Metrics: (0.013403024993194804, 0.015081967213114753, 0.01913004164754714)
2026-05-23 00:02:00,115 - optuna.study.study - INFO - Trial 176 finished with values: [0.013403024993194804, 0.015081967213114753, 0.01913004164754714] and parameters: {'n_layers': 4, 'embedding_dim': 96, 'lr': 0.02143903136401803, 'lambda_val': 2.590190399307384e-06, 'batch_size': 3969, 'optimizer': 'Adam'}.
2026-05-23 00:02:18,500 - optuna.study.study - INFO - Trial 177 finished with values: [0.017399813185914437, 0.015163934426229509, 0.021007424958225142] and parameters: {'n_layers': 4, 'embedding_dim': 96, 'lr': 0.012476072772677116, 'lambda_val': 1.0988779505731458e-05, 'batch_size': 2919, 'optimizer': 'Adam'}.
2026-05-23 00:02:22,804 - experiment_functions - INFO - Early stopping at epoch 850. Best Metrics: (0.0015227071640526444, 0.0015573770491803282, 0.0019657271697600134)
2026-05-23 00:02:23,150 - optuna.study.study - INFO - Trial 178 finished with values: [0.0015227071640526444, 0.0015573770491803282, 0.0019657271697600134] and parameters: {'n_layers': 4, 'embedding_dim': 96, 'lr': 0.016757203845338013, 'lambda_val': 0.0003143503113741062, 'batch_size': 2919, 'optimizer': 'SGD'}.
2026-05-23 00:02:25,890 - experiment_functions - INFO - Early stopping at epoch 500. Best Metrics: (0.008902419667072411, 0.010409836065573769, 0.012114722134429375)
2026-05-23 00:02:25,995 - optuna.study.study - INFO - Trial 179 finished with values: [0.008902419667072411, 0.010409836065573769, 0.012114722134429375] and parameters: {'n_layers': 3, 'embedding_dim': 128, 'lr': 0.016757203845338013, 'lambda_val': 0.0007830038524875585, 'batch_size': 3526, 'optimizer': 'RMSprop'}.
2026-05-23 00:02:30,578 - experiment_functions - INFO - Early stopping at epoch 1050. Best Metrics: (0.001857824979265169, 0.0015573770491803278, 0.0014139674477254651)
2026-05-23 00:02:30,889 - optuna.study.study - INFO - Trial 180 finished with values: [0.001857824979265169, 0.0015573770491803278, 0.0014139674477254651] and parameters: {'n_layers': 2, 'embedding_dim': 32, 'lr': 0.032125088922163904, 'lambda_val': 0.0013159219485092877, 'batch_size': 2552, 'optimizer': 'SGD'}.
2026-05-23 00:02:34,274 - experiment_functions - INFO - Early stopping at epoch 600. Best Metrics: (0.013324322573853343, 0.011557377049180327, 0.015371098535970278)
