2026-05-23 03:20:39,975 - optuna.study.study - INFO - Trial 128 finished with values: [0.03978906621352424, 0.022213114754098363, 0.03330961874559363] and parameters: {'n_layers': 4, 'embedding_dim': 128, 'lr': 0.000293040961262534, 'lambda_val': 2.27009302283491e-06, 'batch_size': 3527, 'optimizer': 'RMSprop'}.
2026-05-23 03:20:43,170 - experiment_functions - INFO - Early stopping at epoch 750. Best Metrics: (0.03763219154626857, 0.023524590163934427, 0.03418288578975262)
2026-05-23 03:20:43,967 - optuna.study.study - INFO - Trial 129 finished with values: [0.03763219154626857, 0.023524590163934427, 0.03418288578975262] and parameters: {'n_layers': 3, 'embedding_dim': 32, 'lr': 0.0013687926891068503, 'lambda_val': 0.0014266932760477375, 'batch_size': 2637, 'optimizer': 'Adam'}.
2026-05-23 03:20:47,965 - experiment_functions - INFO - Early stopping at epoch 550. Best Metrics: (0.03399645266337778, 0.021557377049180333, 0.029700175408579926)
2026-05-23 03:20:48,737 - optuna.study.study - INFO - Trial 130 finished with values: [0.03399645266337778, 0.021557377049180333, 0.029700175408579926] and parameters: {'n_layers': 4, 'embedding_dim': 256, 'lr': 0.0019040849385408827, 'lambda_val': 1.5503036430323852e-06, 'batch_size': 832, 'optimizer': 'Adam'}.
2026-05-23 03:21:05,317 - experiment_functions - INFO - Early stopping at epoch 3100. Best Metrics: (0.013029738186197957, 0.012295081967213115, 0.013924991358594575)
2026-05-23 03:21:05,498 - optuna.study.study - INFO - Trial 131 finished with values: [0.013029738186197957, 0.012295081967213115, 0.013924991358594575] and parameters: {'n_layers': 2, 'embedding_dim': 128, 'lr': 0.001917913774554907, 'lambda_val': 0.08435118404967043, 'batch_size': 2913, 'optimizer': 'RMSprop'}.
2026-05-23 03:21:10,757 - experiment_functions - INFO - Early stopping at epoch 1400. Best Metrics: (0.0497968053908585, 0.029262295081967215, 0.045092562533008744)
2026-05-23 03:21:11,169 - optuna.study.study - INFO - Trial 132 finished with values: [0.0497968053908585, 0.029262295081967215, 0.045092562533008744] and parameters: {'n_layers': 4, 'embedding_dim': 32, 'lr': 0.0004969264317801683, 'lambda_val': 1.9953918103416195e-06, 'batch_size': 1128, 'optimizer': 'Adam'}.
2026-05-23 03:21:22,723 - optuna.study.study - INFO - Trial 133 finished with values: [0.08149229922526058, 0.043196721311475415, 0.0697212976454077] and parameters: {'n_layers': 1, 'embedding_dim': 32, 'lr': 0.000293040961262534, 'lambda_val': 0.00018385882411773826, 'batch_size': 2913, 'optimizer': 'Adam'}.
2026-05-23 03:21:25,615 - experiment_functions - INFO - Early stopping at epoch 650. Best Metrics: (0.008430699253552833, 0.00778688524590164, 0.01116246583862281)
2026-05-23 03:21:25,702 - optuna.study.study - INFO - Trial 134 finished with values: [0.008430699253552833, 0.00778688524590164, 0.01116246583862281] and parameters: {'n_layers': 1, 'embedding_dim': 64, 'lr': 0.09007314227288755, 'lambda_val': 5.750080096786803e-05, 'batch_size': 832, 'optimizer': 'RMSprop'}.
2026-05-23 03:21:39,609 - optuna.study.study - INFO - Trial 135 finished with values: [0.050668122770883554, 0.03237704918032787, 0.04726821097167862] and parameters: {'n_layers': 2, 'embedding_dim': 32, 'lr': 0.00021523829821246926, 'lambda_val': 0.01027925869693631, 'batch_size': 1702, 'optimizer': 'RMSprop'}.
2026-05-23 03:21:42,504 - experiment_functions - INFO - Early stopping at epoch 650. Best Metrics: (0.08498962695692533, 0.04598360655737705, 0.07277438829845576)
2026-05-23 03:21:42,599 - optuna.study.study - INFO - Trial 136 finished with values: [0.08498962695692533, 0.04598360655737705, 0.07277438829845576] and parameters: {'n_layers': 1, 'embedding_dim': 32, 'lr': 0.0031305185360713038, 'lambda_val': 8.70357449478779e-06, 'batch_size': 2924, 'optimizer': 'Adam'}.
2026-05-23 03:21:48,283 - experiment_functions - INFO - Early stopping at epoch 1450. Best Metrics: (0.058179306957081164, 0.03590163934426229, 0.05381286509146741)
2026-05-23 03:21:48,419 - optuna.study.study - INFO - Trial 137 finished with values: [0.058179306957081164, 0.03590163934426229, 0.05381286509146741] and parameters: {'n_layers': 3, 'embedding_dim': 32, 'lr': 0.0004969264317801683, 'lambda_val': 1.3950838562790373e-06, 'batch_size': 1809, 'optimizer': 'RMSprop'}.
2026-05-23 03:21:52,958 - experiment_functions - INFO - Early stopping at epoch 1300. Best Metrics: (0.016365337652993646, 0.011557377049180327, 0.01632862943734977)
2026-05-23 03:21:53,120 - optuna.study.study - INFO - Trial 138 finished with values: [0.016365337652993646, 0.011557377049180327, 0.01632862943734977] and parameters: {'n_layers': 1, 'embedding_dim': 96, 'lr': 0.06524143930040716, 'lambda_val': 2.121128043837593e-05, 'batch_size': 955, 'optimizer': 'RMSprop'}.
2026-05-23 03:21:59,194 - experiment_functions - INFO - Early stopping at epoch 1400. Best Metrics: (0.08120366029536268, 0.04180327868852459, 0.06870439473183823)
2026-05-23 03:21:59,518 - optuna.study.study - INFO - Trial 139 finished with values: [0.08120366029536268, 0.04180327868852459, 0.06870439473183823] and parameters: {'n_layers': 2, 'embedding_dim': 128, 'lr': 0.0004969264317801683, 'lambda_val': 0.0006383294603067735, 'batch_size': 1109, 'optimizer': 'Adam'}.
2026-05-23 03:22:02,518 - experiment_functions - INFO - Early stopping at epoch 550. Best Metrics: (0.062397798171266186, 0.032704918032786884, 0.05526531549095432)
2026-05-23 03:22:02,596 - optuna.study.study - INFO - Trial 140 finished with values: [0.062397798171266186, 0.032704918032786884, 0.05526531549095432] and parameters: {'n_layers': 2, 'embedding_dim': 32, 'lr': 0.005792015834107535, 'lambda_val': 8.029603261406284e-05, 'batch_size': 3009, 'optimizer': 'Adam'}.
2026-05-23 03:22:09,818 - experiment_functions - INFO - Early stopping at epoch 1700. Best Metrics: (0.060539905411743165, 0.032049180327868854, 0.05246847410321278)
2026-05-23 03:22:10,894 - optuna.study.study - INFO - Trial 141 finished with values: [0.060539905411743165, 0.032049180327868854, 0.05246847410321278] and parameters: {'n_layers': 3, 'embedding_dim': 64, 'lr': 0.0003085416137069091, 'lambda_val': 8.029603261406284e-05, 'batch_size': 3128, 'optimizer': 'RMSprop'}.
2026-05-23 03:22:26,525 - optuna.study.study - INFO - Trial 142 finished with values: [0.05110190177093388, 0.029344262295081965, 0.04446306240156628] and parameters: {'n_layers': 4, 'embedding_dim': 32, 'lr': 0.000293040961262534, 'lambda_val': 2.27009302283491e-06, 'batch_size': 1355, 'optimizer': 'Adam'}.
2026-05-23 03:22:29,309 - experiment_functions - INFO - Early stopping at epoch 600. Best Metrics: (0.04097449547608196, 0.023032786885245904, 0.03428320536996205)
2026-05-23 03:22:29,566 - optuna.study.study - INFO - Trial 143 finished with values: [0.04097449547608196, 0.023032786885245904, 0.03428320536996205] and parameters: {'n_layers': 2, 'embedding_dim': 32, 'lr': 0.0019040849385408827, 'lambda_val': 0.01064953114724862, 'batch_size': 2528, 'optimizer': 'Adam'}.
2026-05-23 03:22:32,731 - experiment_functions - INFO - Early stopping at epoch 600. Best Metrics: (0.02923305712164461, 0.016885245901639347, 0.026624993214413067)
2026-05-23 03:22:32,843 - optuna.study.study - INFO - Trial 144 finished with values: [0.02923305712164461, 0.016885245901639347, 0.026624993214413067] and parameters: {'n_layers': 4, 'embedding_dim': 32, 'lr': 0.0031305185360713038, 'lambda_val': 8.70357449478779e-06, 'batch_size': 1809, 'optimizer': 'Adam'}.
2026-05-23 03:22:38,842 - experiment_functions - INFO - Early stopping at epoch 1050. Best Metrics: (0.021540607763335128, 0.012540983606557378, 0.01868036516873441)
2026-05-23 03:22:39,615 - optuna.study.study - INFO - Trial 145 finished with values: [0.021540607763335128, 0.012540983606557378, 0.01868036516873441] and parameters: {'n_layers': 4, 'embedding_dim': 128, 'lr': 0.0019040849385408827, 'lambda_val': 0.0005365242793466337, 'batch_size': 3013, 'optimizer': 'RMSprop'}.
2026-05-23 03:22:49,028 - experiment_functions - INFO - Early stopping at epoch 2200. Best Metrics: (0.059566313585846596, 0.031229508196721312, 0.04894554801273544)
2026-05-23 03:22:49,100 - optuna.study.study - INFO - Trial 146 finished with values: [0.059566313585846596, 0.031229508196721312, 0.04894554801273544] and parameters: {'n_layers': 4, 'embedding_dim': 64, 'lr': 0.0003085416137069091, 'lambda_val': 8.029603261406284e-05, 'batch_size': 1128, 'optimizer': 'RMSprop'}.
2026-05-23 03:22:51,692 - experiment_functions - INFO - Early stopping at epoch 550. Best Metrics: (0.08698847344288758, 0.043852459016393446, 0.06956818555387652)
2026-05-23 03:22:51,787 - optuna.study.study - INFO - Trial 147 finished with values: [0.08698847344288758, 0.043852459016393446, 0.06956818555387652] and parameters: {'n_layers': 1, 'embedding_dim': 96, 'lr': 0.001917913774554907, 'lambda_val': 0.0009470480230293182, 'batch_size': 3274, 'optimizer': 'RMSprop'}.
2026-05-23 03:22:54,723 - experiment_functions - INFO - Early stopping at epoch 500. Best Metrics: (0.001498910399846316, 0.0019672131147540984, 0.0020955065066115804)
2026-05-23 03:22:55,347 - optuna.study.study - INFO - Trial 148 finished with values: [0.001498910399846316, 0.0019672131147540984, 0.0020955065066115804] and parameters: {'n_layers': 2, 'embedding_dim': 256, 'lr': 2.3946114088616413e-05, 'lambda_val': 0.0006383294603067735, 'batch_size': 3288, 'optimizer': 'SGD'}.
2026-05-23 03:23:05,790 - experiment_functions - INFO - Early stopping at epoch 2250. Best Metrics: (0.04637624518474551, 0.02975409836065574, 0.04012910527532315)
2026-05-23 03:23:06,193 - optuna.study.study - INFO - Trial 149 finished with values: [0.04637624518474551, 0.02975409836065574, 0.04012910527532315] and parameters: {'n_layers': 3, 'embedding_dim': 64, 'lr': 0.00021579874779967007, 'lambda_val': 0.003792790860273115, 'batch_size': 3522, 'optimizer': 'RMSprop'}.
2026-05-23 03:23:09,018 - experiment_functions - INFO - Early stopping at epoch 650. Best Metrics: (0.09283349992453042, 0.0471311475409836, 0.07850784890513035)
2026-05-23 03:23:09,110 - optuna.study.study - INFO - Trial 150 finished with values: [0.09283349992453042, 0.0471311475409836, 0.07850784890513035] and parameters: {'n_layers': 1, 'embedding_dim': 32, 'lr': 0.0031305185360713038, 'lambda_val': 0.0021605260106213964, 'batch_size': 2924, 'optimizer': 'Adam'}.
2026-05-23 03:23:11,751 - experiment_functions - INFO - Early stopping at epoch 550. Best Metrics: (0.057607593282557025, 0.033196721311475406, 0.04909053148242822)
2026-05-23 03:23:11,839 - optuna.study.study - INFO - Trial 151 finished with values: [0.057607593282557025, 0.033196721311475406, 0.04909053148242822] and parameters: {'n_layers': 1, 'embedding_dim': 96, 'lr': 0.001917913774554907, 'lambda_val': 0.0120910902010848, 'batch_size': 3274, 'optimizer': 'RMSprop'}.
2026-05-23 03:23:17,740 - experiment_functions - INFO - Early stopping at epoch 1650. Best Metrics: (0.08232497246137119, 0.04344262295081967, 0.07239894283289718)
2026-05-23 03:23:18,203 - optuna.study.study - INFO - Trial 152 finished with values: [0.08232497246137119, 0.04344262295081967, 0.07239894283289718] and parameters: {'n_layers': 2, 'embedding_dim': 32, 'lr': 0.0005051991365347398, 'lambda_val': 1.3835148346636437e-06, 'batch_size': 1809, 'optimizer': 'RMSprop'}.
2026-05-23 03:23:20,641 - experiment_functions - INFO - Early stopping at epoch 500. Best Metrics: (0.0025702773793465487, 0.001967213114754099, 0.002830764837284704)
2026-05-23 03:23:20,734 - optuna.study.study - INFO - Trial 153 finished with values: [0.0025702773793465487, 0.001967213114754099, 0.002830764837284704] and parameters: {'n_layers': 3, 'embedding_dim': 32, 'lr': 0.0005051991365347398, 'lambda_val': 0.0407690333605584, 'batch_size': 1921, 'optimizer': 'SGD'}.
2026-05-23 03:23:22,895 - experiment_functions - INFO - Early stopping at epoch 500. Best Metrics: (0.0009733921604596286, 0.0013114754098360656, 0.0014954255388714155)
2026-05-23 03:23:23,034 - optuna.study.study - INFO - Trial 154 finished with values: [0.0009733921604596286, 0.0013114754098360656, 0.0014954255388714155] and parameters: {'n_layers': 2, 'embedding_dim': 32, 'lr': 0.0031305185360713038, 'lambda_val': 8.70357449478779e-06, 'batch_size': 2725, 'optimizer': 'SGD'}.
2026-05-23 03:23:26,049 - experiment_functions - INFO - Early stopping at epoch 600. Best Metrics: (0.02939370584965282, 0.01877049180327869, 0.029101688235288376)
2026-05-23 03:23:26,914 - optuna.study.study - INFO - Trial 155 finished with values: [0.02939370584965282, 0.01877049180327869, 0.029101688235288376] and parameters: {'n_layers': 3, 'embedding_dim': 32, 'lr': 0.0031305185360713038, 'lambda_val': 0.0005365242793466337, 'batch_size': 3009, 'optimizer': 'Adam'}.
2026-05-23 03:23:39,022 - experiment_functions - INFO - Early stopping at epoch 3900. Best Metrics: (0.08288908514387204, 0.047540983606557376, 0.07448590525849516)
2026-05-23 03:23:39,119 - optuna.study.study - INFO - Trial 156 finished with values: [0.08288908514387204, 0.047540983606557376, 0.07448590525849516] and parameters: {'n_layers': 1, 'embedding_dim': 96, 'lr': 0.00021523829821246926, 'lambda_val': 0.005672765240199157, 'batch_size': 1702, 'optimizer': 'RMSprop'}.
2026-05-23 03:23:41,563 - experiment_functions - INFO - Early stopping at epoch 550. Best Metrics: (0.06472457019151187, 0.030737704918032786, 0.0510534150112685)
2026-05-23 03:23:41,651 - optuna.study.study - INFO - Trial 157 finished with values: [0.06472457019151187, 0.030737704918032786, 0.0510534150112685] and parameters: {'n_layers': 1, 'embedding_dim': 64, 'lr': 0.019713086703053932, 'lambda_val': 0.00011132011432528227, 'batch_size': 1921, 'optimizer': 'Adam'}.
2026-05-23 03:23:48,901 - experiment_functions - INFO - Early stopping at epoch 2000. Best Metrics: (0.10520840828049843, 0.05262295081967213, 0.08889751563889733)
2026-05-23 03:23:48,986 - optuna.study.study - INFO - Trial 158 finished with values: [0.10520840828049843, 0.05262295081967213, 0.08889751563889733] and parameters: {'n_layers': 1, 'embedding_dim': 128, 'lr': 0.000293040961262534, 'lambda_val': 0.003966779220729784, 'batch_size': 3009, 'optimizer': 'Adam'}.
2026-05-23 03:23:54,799 - experiment_functions - INFO - Early stopping at epoch 1650. Best Metrics: (0.08687796142903917, 0.04614754098360656, 0.0795864288020954)
2026-05-23 03:23:55,105 - optuna.study.study - INFO - Trial 159 finished with values: [0.08687796142903917, 0.04614754098360656, 0.0795864288020954] and parameters: {'n_layers': 1, 'embedding_dim': 128, 'lr': 0.000293040961262534, 'lambda_val': 0.005672765240199157, 'batch_size': 3527, 'optimizer': 'Adam'}.
2026-05-23 03:23:59,633 - experiment_functions - INFO - Early stopping at epoch 850. Best Metrics: (0.014321215013389298, 0.011885245901639344, 0.015762806610581527)
2026-05-23 03:23:59,727 - optuna.study.study - INFO - Trial 160 finished with values: [0.014321215013389298, 0.011885245901639344, 0.015762806610581527] and parameters: {'n_layers': 4, 'embedding_dim': 128, 'lr': 0.000293040961262534, 'lambda_val': 0.028299411735441895, 'batch_size': 2924, 'optimizer': 'Adam'}.
2026-05-23 03:24:05,646 - experiment_functions - INFO - Early stopping at epoch 1150. Best Metrics: (0.07340131384264686, 0.041065573770491796, 0.06636457191631553)
2026-05-23 03:24:06,201 - optuna.study.study - INFO - Trial 161 finished with values: [0.07340131384264686, 0.041065573770491796, 0.06636457191631553] and parameters: {'n_layers': 2, 'embedding_dim': 256, 'lr': 0.0002908317152318147, 'lambda_val': 0.00016240162344732882, 'batch_size': 3009, 'optimizer': 'RMSprop'}.
2026-05-23 03:24:13,559 - experiment_functions - INFO - Early stopping at epoch 2000. Best Metrics: (0.12106666731041321, 0.05672131147540984, 0.09978838035584328)
2026-05-23 03:24:14,671 - optuna.study.study - INFO - Trial 162 finished with values: [0.12106666731041321, 0.05672131147540984, 0.09978838035584328] and parameters: {'n_layers': 1, 'embedding_dim': 256, 'lr': 0.0003084507924491364, 'lambda_val': 8.029603261406284e-05, 'batch_size': 1921, 'optimizer': 'RMSprop'}.
2026-05-23 03:24:17,115 - experiment_functions - INFO - Early stopping at epoch 600. Best Metrics: (0.10522867178953552, 0.05049180327868852, 0.08139395348350942)
2026-05-23 03:24:17,211 - optuna.study.study - INFO - Trial 163 finished with values: [0.10522867178953552, 0.05049180327868852, 0.08139395348350942] and parameters: {'n_layers': 1, 'embedding_dim': 96, 'lr': 0.0031305185360713038, 'lambda_val': 8.70357449478779e-06, 'batch_size': 2924, 'optimizer': 'Adam'}.
2026-05-23 03:24:21,590 - experiment_functions - INFO - Early stopping at epoch 1350. Best Metrics: (0.053542387912239225, 0.032540983606557376, 0.05278943225231043)
2026-05-23 03:24:21,938 - optuna.study.study - INFO - Trial 164 finished with values: [0.053542387912239225, 0.032540983606557376, 0.05278943225231043] and parameters: {'n_layers': 2, 'embedding_dim': 32, 'lr': 0.0004969264317801683, 'lambda_val': 0.001406127343986641, 'batch_size': 1809, 'optimizer': 'RMSprop'}.
2026-05-23 03:24:24,342 - experiment_functions - INFO - Early stopping at epoch 600. Best Metrics: (0.08882187449766682, 0.04418032786885246, 0.07594694376328909)
2026-05-23 03:24:24,420 - optuna.study.study - INFO - Trial 165 finished with values: [0.08882187449766682, 0.04418032786885246, 0.07594694376328909] and parameters: {'n_layers': 1, 'embedding_dim': 32, 'lr': 0.0031305185360713038, 'lambda_val': 2.27009302283491e-06, 'batch_size': 2924, 'optimizer': 'Adam'}.
2026-05-23 03:24:26,817 - experiment_functions - INFO - Early stopping at epoch 500. Best Metrics: (0.0025486430117523193, 0.002213114754098361, 0.0028256090750726276)
2026-05-23 03:24:26,951 - optuna.study.study - INFO - Trial 166 finished with values: [0.0025486430117523193, 0.002213114754098361, 0.0028256090750726276] and parameters: {'n_layers': 2, 'embedding_dim': 32, 'lr': 0.005792015834107535, 'lambda_val': 0.00018385882411773826, 'batch_size': 3009, 'optimizer': 'SGD'}.
2026-05-23 03:24:33,199 - experiment_functions - INFO - Early stopping at epoch 1600. Best Metrics: (0.06564212927348692, 0.038606557377049176, 0.05723160249949858)
2026-05-23 03:24:34,210 - optuna.study.study - INFO - Trial 167 finished with values: [0.06564212927348692, 0.038606557377049176, 0.05723160249949858] and parameters: {'n_layers': 2, 'embedding_dim': 32, 'lr': 0.0005051991365347398, 'lambda_val': 0.00012928174782861758, 'batch_size': 1828, 'optimizer': 'RMSprop'}.
2026-05-23 03:24:36,917 - experiment_functions - INFO - Early stopping at epoch 550. Best Metrics: (0.031365741373302884, 0.013278688524590167, 0.024043047705099685)
2026-05-23 03:24:37,011 - optuna.study.study - INFO - Trial 168 finished with values: [0.031365741373302884, 0.013278688524590167, 0.024043047705099685] and parameters: {'n_layers': 2, 'embedding_dim': 128, 'lr': 0.01850168493182266, 'lambda_val': 2.27009302283491e-06, 'batch_size': 984, 'optimizer': 'Adam'}.
2026-05-23 03:24:45,404 - experiment_functions - INFO - Early stopping at epoch 2600. Best Metrics: (0.10960074488091812, 0.0530327868852459, 0.09216807395502663)
2026-05-23 03:24:45,768 - optuna.study.study - INFO - Trial 169 finished with values: [0.10960074488091812, 0.0530327868852459, 0.09216807395502663] and parameters: {'n_layers': 1, 'embedding_dim': 64, 'lr': 0.0005051991365347398, 'lambda_val': 0.00012928174782861758, 'batch_size': 1214, 'optimizer': 'RMSprop'}.
2026-05-23 03:24:52,044 - experiment_functions - INFO - Early stopping at epoch 1750. Best Metrics: (0.07955939535709457, 0.04188524590163934, 0.07189274392296535)
2026-05-23 03:24:52,307 - optuna.study.study - INFO - Trial 170 finished with values: [0.07955939535709457, 0.04188524590163934, 0.07189274392296535] and parameters: {'n_layers': 2, 'embedding_dim': 32, 'lr': 0.0004969264317801683, 'lambda_val': 0.001406127343986641, 'batch_size': 1921, 'optimizer': 'RMSprop'}.
2026-05-23 03:25:07,277 - experiment_functions - INFO - Early stopping at epoch 3900. Best Metrics: (0.0021281250411478913, 0.0018852459016393442, 0.0021593648217857887)
2026-05-23 03:25:07,413 - optuna.study.study - INFO - Trial 171 finished with values: [0.0021281250411478913, 0.0018852459016393442, 0.0021593648217857887] and parameters: {'n_layers': 1, 'embedding_dim': 256, 'lr': 2.305735366975945e-05, 'lambda_val': 0.00012928174782861758, 'batch_size': 3903, 'optimizer': 'RMSprop'}.
2026-05-23 03:25:17,974 - experiment_functions - INFO - Early stopping at epoch 2600. Best Metrics: (0.045048949620851736, 0.02663934426229508, 0.037385379758179654)
2026-05-23 03:25:18,745 - optuna.study.study - INFO - Trial 172 finished with values: [0.045048949620851736, 0.02663934426229508, 0.037385379758179654] and parameters: {'n_layers': 3, 'embedding_dim': 64, 'lr': 0.0003085416137069091, 'lambda_val': 8.029603261406284e-05, 'batch_size': 3009, 'optimizer': 'Adam'}.
2026-05-23 03:25:28,443 - experiment_functions - INFO - Early stopping at epoch 950. Best Metrics: (0.05057259355659118, 0.026967213114754102, 0.04220120813011171)
2026-05-23 03:25:29,260 - optuna.study.study - INFO - Trial 173 finished with values: [0.05057259355659118, 0.026967213114754102, 0.04220120813011171] and parameters: {'n_layers': 3, 'embedding_dim': 32, 'lr': 0.0013687926891068503, 'lambda_val': 8.70357449478779e-06, 'batch_size': 1809, 'optimizer': 'Adam'}.
2026-05-23 03:25:41,178 - experiment_functions - INFO - Early stopping at epoch 3800. Best Metrics: (0.08491333723263855, 0.045737704918032786, 0.0719961669976267)
2026-05-23 03:25:41,864 - optuna.study.study - INFO - Trial 174 finished with values: [0.08491333723263855, 0.045737704918032786, 0.0719961669976267] and parameters: {'n_layers': 1, 'embedding_dim': 32, 'lr': 0.000293040961262534, 'lambda_val': 0.00018385882411773826, 'batch_size': 2913, 'optimizer': 'Adam'}.
2026-05-23 03:25:47,478 - experiment_functions - INFO - Early stopping at epoch 1950. Best Metrics: (0.06523188086669751, 0.03991803278688525, 0.06116961327340727)
