2026-05-23 04:25:35,884 - optuna.study.study - INFO - Trial 99 finished with values: [0.03155645881075887, 0.013196721311475408, 0.023885824989412698] and parameters: {'n_layers': 2, 'embedding_dim': 64, 'lr': 0.02990805822010038, 'lambda_val': 0.00037894592886494253, 'batch_size': 2370, 'optimizer': 'RMSprop'}.
2026-05-23 04:25:39,629 - experiment_functions - INFO - Early stopping at epoch 650. Best Metrics: (0.05243489772054983, 0.028934426229508193, 0.04614402757537371)
2026-05-23 04:25:40,700 - optuna.study.study - INFO - Trial 100 finished with values: [0.05243489772054983, 0.028934426229508193, 0.04614402757537371] and parameters: {'n_layers': 2, 'embedding_dim': 256, 'lr': 0.0004803146544874298, 'lambda_val': 0.0060103019678805995, 'batch_size': 2183, 'optimizer': 'RMSprop'}.
2026-05-23 04:25:44,327 - experiment_functions - INFO - Early stopping at epoch 550. Best Metrics: (0.030584404414753418, 0.01836065573770492, 0.0249181750471946)
2026-05-23 04:25:44,832 - optuna.study.study - INFO - Trial 101 finished with values: [0.030584404414753418, 0.01836065573770492, 0.0249181750471946] and parameters: {'n_layers': 4, 'embedding_dim': 128, 'lr': 0.00466856942146688, 'lambda_val': 5.716195116201499e-06, 'batch_size': 1720, 'optimizer': 'Adam'}.
2026-05-23 04:25:51,092 - experiment_functions - INFO - Early stopping at epoch 1400. Best Metrics: (0.0825027185097328, 0.04262295081967213, 0.06871339922126617)
2026-05-23 04:25:51,252 - optuna.study.study - INFO - Trial 102 finished with values: [0.0825027185097328, 0.04262295081967213, 0.06871339922126617] and parameters: {'n_layers': 2, 'embedding_dim': 64, 'lr': 0.0005076161055190746, 'lambda_val': 1.5250659263577613e-05, 'batch_size': 1477, 'optimizer': 'Adam'}.
2026-05-23 04:25:57,136 - experiment_functions - INFO - Early stopping at epoch 800. Best Metrics: (0.04709282474038022, 0.02377049180327869, 0.039866578768552506)
2026-05-23 04:25:58,145 - optuna.study.study - INFO - Trial 103 finished with values: [0.04709282474038022, 0.02377049180327869, 0.039866578768552506] and parameters: {'n_layers': 4, 'embedding_dim': 256, 'lr': 0.00039831203487280473, 'lambda_val': 4.5174002812526645e-05, 'batch_size': 2002, 'optimizer': 'RMSprop'}.
2026-05-23 04:26:10,032 - experiment_functions - INFO - Early stopping at epoch 3150. Best Metrics: (0.11055669208818433, 0.052868852459016395, 0.09192339199676253)
2026-05-23 04:26:10,115 - optuna.study.study - INFO - Trial 104 finished with values: [0.11055669208818433, 0.052868852459016395, 0.09192339199676253] and parameters: {'n_layers': 1, 'embedding_dim': 256, 'lr': 0.0003054746060910338, 'lambda_val': 0.0009962507800702286, 'batch_size': 601, 'optimizer': 'RMSprop'}.
2026-05-23 04:26:14,993 - experiment_functions - INFO - Early stopping at epoch 1250. Best Metrics: (0.0683598133818611, 0.03770491803278689, 0.060307224128928374)
2026-05-23 04:26:15,734 - optuna.study.study - INFO - Trial 105 finished with values: [0.0683598133818611, 0.03770491803278689, 0.060307224128928374] and parameters: {'n_layers': 2, 'embedding_dim': 64, 'lr': 0.0004803146544874298, 'lambda_val': 0.00037894592886494253, 'batch_size': 2183, 'optimizer': 'RMSprop'}.
2026-05-23 04:26:19,828 - experiment_functions - INFO - Early stopping at epoch 850. Best Metrics: (0.108793863059578, 0.05131147540983607, 0.08931774156233892)
2026-05-23 04:26:19,938 - optuna.study.study - INFO - Trial 106 finished with values: [0.108793863059578, 0.05131147540983607, 0.08931774156233892] and parameters: {'n_layers': 1, 'embedding_dim': 256, 'lr': 0.0012715072595827332, 'lambda_val': 0.00062453091272787, 'batch_size': 2240, 'optimizer': 'Adam'}.
2026-05-23 04:26:23,601 - experiment_functions - INFO - Early stopping at epoch 750. Best Metrics: (0.0666536957382775, 0.03647540983606557, 0.059346052712017046)
2026-05-23 04:26:24,124 - optuna.study.study - INFO - Trial 107 finished with values: [0.0666536957382775, 0.03647540983606557, 0.059346052712017046] and parameters: {'n_layers': 2, 'embedding_dim': 96, 'lr': 0.0010602693611052227, 'lambda_val': 1.374096848370064e-06, 'batch_size': 3562, 'optimizer': 'Adam'}.
2026-05-23 04:26:29,680 - experiment_functions - INFO - Early stopping at epoch 1500. Best Metrics: (0.060353077450298075, 0.03639344262295082, 0.060268952457948576)
2026-05-23 04:26:30,682 - optuna.study.study - INFO - Trial 108 finished with values: [0.060353077450298075, 0.03639344262295082, 0.060268952457948576] and parameters: {'n_layers': 2, 'embedding_dim': 64, 'lr': 0.0005076161055190746, 'lambda_val': 1.5250659263577613e-05, 'batch_size': 1477, 'optimizer': 'Adam'}.
2026-05-23 04:26:46,604 - optuna.study.study - INFO - Trial 109 finished with values: [0.029113082231859603, 0.017049180327868854, 0.026874883272683652] and parameters: {'n_layers': 2, 'embedding_dim': 128, 'lr': 6.847385781600246e-05, 'lambda_val': 4.043398626155609e-05, 'batch_size': 2902, 'optimizer': 'RMSprop'}.
2026-05-23 04:26:48,828 - experiment_functions - INFO - Early stopping at epoch 500. Best Metrics: (0.0015062066703078164, 0.0014754098360655738, 0.001883093674312325)
2026-05-23 04:26:48,918 - optuna.study.study - INFO - Trial 110 finished with values: [0.0015062066703078164, 0.0014754098360655738, 0.001883093674312325] and parameters: {'n_layers': 2, 'embedding_dim': 64, 'lr': 0.02553831304260938, 'lambda_val': 0.0038546327658745766, 'batch_size': 2324, 'optimizer': 'SGD'}.
2026-05-23 04:26:53,272 - experiment_functions - INFO - Early stopping at epoch 800. Best Metrics: (0.03077851815684783, 0.015655737704918033, 0.025419016277351433)
2026-05-23 04:26:53,347 - optuna.study.study - INFO - Trial 111 finished with values: [0.03077851815684783, 0.015655737704918033, 0.025419016277351433] and parameters: {'n_layers': 3, 'embedding_dim': 128, 'lr': 0.002000405672242202, 'lambda_val': 4.043398626155609e-05, 'batch_size': 2409, 'optimizer': 'RMSprop'}.
2026-05-23 04:27:00,527 - experiment_functions - INFO - Early stopping at epoch 2000. Best Metrics: (0.03696252767473369, 0.01975409836065574, 0.029944158221051592)
2026-05-23 04:27:00,612 - optuna.study.study - INFO - Trial 112 finished with values: [0.03696252767473369, 0.01975409836065574, 0.029944158221051592] and parameters: {'n_layers': 2, 'embedding_dim': 64, 'lr': 0.0406369613134867, 'lambda_val': 0.002018128655848671, 'batch_size': 3562, 'optimizer': 'Adam'}.
2026-05-23 04:27:04,915 - experiment_functions - INFO - Early stopping at epoch 500. Best Metrics: (0.021727789774323988, 0.014262295081967215, 0.022143258935249887)
2026-05-23 04:27:04,993 - optuna.study.study - INFO - Trial 113 finished with values: [0.021727789774323988, 0.014262295081967215, 0.022143258935249887] and parameters: {'n_layers': 4, 'embedding_dim': 256, 'lr': 0.01729355128210771, 'lambda_val': 1.4811025229652691e-05, 'batch_size': 2103, 'optimizer': 'RMSprop'}.
2026-05-23 04:27:07,801 - experiment_functions - INFO - Early stopping at epoch 700. Best Metrics: (0.043384916298488306, 0.028442622950819674, 0.03819725133446688)
2026-05-23 04:27:07,920 - optuna.study.study - INFO - Trial 114 finished with values: [0.043384916298488306, 0.028442622950819674, 0.03819725133446688] and parameters: {'n_layers': 2, 'embedding_dim': 32, 'lr': 0.0010602693611052227, 'lambda_val': 0.002225291349266682, 'batch_size': 2987, 'optimizer': 'RMSprop'}.
2026-05-23 04:27:11,284 - experiment_functions - INFO - Early stopping at epoch 600. Best Metrics: (0.036080956501076844, 0.02155737704918033, 0.031662597296078066)
2026-05-23 04:27:11,375 - optuna.study.study - INFO - Trial 115 finished with values: [0.036080956501076844, 0.02155737704918033, 0.031662597296078066] and parameters: {'n_layers': 3, 'embedding_dim': 128, 'lr': 0.0011639497848050708, 'lambda_val': 0.0003830295511690824, 'batch_size': 1200, 'optimizer': 'RMSprop'}.
2026-05-23 04:27:13,996 - experiment_functions - INFO - Early stopping at epoch 500. Best Metrics: (0.0019262926490574202, 0.002295081967213115, 0.0030034437713878474)
2026-05-23 04:27:14,098 - optuna.study.study - INFO - Trial 116 finished with values: [0.0019262926490574202, 0.002295081967213115, 0.0030034437713878474] and parameters: {'n_layers': 2, 'embedding_dim': 128, 'lr': 0.0399895421175634, 'lambda_val': 0.006639299505918974, 'batch_size': 944, 'optimizer': 'SGD'}.
2026-05-23 04:27:19,634 - experiment_functions - INFO - Early stopping at epoch 1350. Best Metrics: (0.08937847857067208, 0.04581967213114754, 0.07833351852992294)
2026-05-23 04:27:20,540 - optuna.study.study - INFO - Trial 117 finished with values: [0.08937847857067208, 0.04581967213114754, 0.07833351852992294] and parameters: {'n_layers': 2, 'embedding_dim': 96, 'lr': 0.0005216893769116646, 'lambda_val': 0.001092384612961102, 'batch_size': 601, 'optimizer': 'RMSprop'}.
2026-05-23 04:27:23,162 - experiment_functions - INFO - Early stopping at epoch 550. Best Metrics: (0.04141470750143034, 0.02540983606557377, 0.035190865884193276)
2026-05-23 04:27:23,251 - optuna.study.study - INFO - Trial 118 finished with values: [0.04141470750143034, 0.02540983606557377, 0.035190865884193276] and parameters: {'n_layers': 2, 'embedding_dim': 64, 'lr': 0.0011639497848050708, 'lambda_val': 0.009427137842512492, 'batch_size': 2370, 'optimizer': 'RMSprop'}.
2026-05-23 04:27:25,921 - experiment_functions - INFO - Early stopping at epoch 500. Best Metrics: (0.010406698826438918, 0.005819672131147541, 0.008696880160041415)
2026-05-23 04:27:25,997 - optuna.study.study - INFO - Trial 119 finished with values: [0.010406698826438918, 0.005819672131147541, 0.008696880160041415] and parameters: {'n_layers': 2, 'embedding_dim': 128, 'lr': 0.09106756518072165, 'lambda_val': 0.0003830295511690824, 'batch_size': 1720, 'optimizer': 'RMSprop'}.
2026-05-23 04:27:28,910 - experiment_functions - INFO - Early stopping at epoch 600. Best Metrics: (0.03320874963136287, 0.014016393442622952, 0.022565412628380892)
2026-05-23 04:27:28,988 - optuna.study.study - INFO - Trial 120 finished with values: [0.03320874963136287, 0.014016393442622952, 0.022565412628380892] and parameters: {'n_layers': 2, 'embedding_dim': 64, 'lr': 0.01729355128210771, 'lambda_val': 1.2446105732390675e-05, 'batch_size': 3576, 'optimizer': 'Adam'}.
2026-05-23 04:27:42,552 - experiment_functions - INFO - Early stopping at epoch 3600. Best Metrics: (0.04896933383309462, 0.02754098360655738, 0.040863439024104414)
2026-05-23 04:27:42,627 - optuna.study.study - INFO - Trial 121 finished with values: [0.04896933383309462, 0.02754098360655738, 0.040863439024104414] and parameters: {'n_layers': 3, 'embedding_dim': 32, 'lr': 0.00030210764029141594, 'lambda_val': 0.0011674275547394154, 'batch_size': 3576, 'optimizer': 'Adam'}.
2026-05-23 04:27:47,481 - experiment_functions - INFO - Early stopping at epoch 1150. Best Metrics: (0.05414253070163859, 0.031967213114754096, 0.0468907127012728)
2026-05-23 04:27:47,661 - optuna.study.study - INFO - Trial 122 finished with values: [0.05414253070163859, 0.031967213114754096, 0.0468907127012728] and parameters: {'n_layers': 2, 'embedding_dim': 64, 'lr': 0.0005076161055190746, 'lambda_val': 1.5250659263577613e-05, 'batch_size': 3576, 'optimizer': 'Adam'}.
2026-05-23 04:27:52,911 - experiment_functions - INFO - Early stopping at epoch 500. Best Metrics: (0.0025526899261335625, 0.002213114754098361, 0.0031903943950242464)
2026-05-23 04:27:53,646 - optuna.study.study - INFO - Trial 123 finished with values: [0.0025526899261335625, 0.002213114754098361, 0.0031903943950242464] and parameters: {'n_layers': 2, 'embedding_dim': 64, 'lr': 0.0011639497848050708, 'lambda_val': 0.00037894592886494253, 'batch_size': 604, 'optimizer': 'SGD'}.
2026-05-23 04:28:01,403 - experiment_functions - INFO - Early stopping at epoch 500. Best Metrics: (0.002571473244103203, 0.0018852459016393442, 0.0027642194771885756)
2026-05-23 04:28:01,841 - optuna.study.study - INFO - Trial 124 finished with values: [0.002571473244103203, 0.0018852459016393442, 0.0027642194771885756] and parameters: {'n_layers': 1, 'embedding_dim': 256, 'lr': 2.7071006154469677e-05, 'lambda_val': 0.014740079559979705, 'batch_size': 1427, 'optimizer': 'RMSprop'}.
2026-05-23 04:28:08,279 - experiment_functions - INFO - Early stopping at epoch 950. Best Metrics: (0.0610963907012891, 0.036721311475409836, 0.05712951613455668)
2026-05-23 04:28:08,449 - optuna.study.study - INFO - Trial 125 finished with values: [0.0610963907012891, 0.036721311475409836, 0.05712951613455668] and parameters: {'n_layers': 2, 'embedding_dim': 256, 'lr': 0.0003054746060910338, 'lambda_val': 0.0002794201622830738, 'batch_size': 4093, 'optimizer': 'RMSprop'}.
2026-05-23 04:28:14,043 - experiment_functions - INFO - Early stopping at epoch 1350. Best Metrics: (0.03403036432179268, 0.017131147540983604, 0.02853610423039114)
2026-05-23 04:28:14,134 - optuna.study.study - INFO - Trial 126 finished with values: [0.03403036432179268, 0.017131147540983604, 0.02853610423039114] and parameters: {'n_layers': 2, 'embedding_dim': 64, 'lr': 0.02990805822010038, 'lambda_val': 0.001092384612961102, 'batch_size': 3562, 'optimizer': 'RMSprop'}.
2026-05-23 04:28:17,026 - experiment_functions - INFO - Early stopping at epoch 500. Best Metrics: (0.018461850048289836, 0.009098360655737705, 0.015804840077013157)
2026-05-23 04:28:17,266 - optuna.study.study - INFO - Trial 127 finished with values: [0.018461850048289836, 0.009098360655737705, 0.015804840077013157] and parameters: {'n_layers': 3, 'embedding_dim': 64, 'lr': 0.09106756518072165, 'lambda_val': 0.00010447269915261112, 'batch_size': 2324, 'optimizer': 'RMSprop'}.
2026-05-23 04:28:19,964 - experiment_functions - INFO - Early stopping at epoch 500. Best Metrics: (0.0015222584882202818, 0.0014754098360655738, 0.0017753263190409803)
2026-05-23 04:28:20,045 - optuna.study.study - INFO - Trial 128 finished with values: [0.0015222584882202818, 0.0014754098360655738, 0.0017753263190409803] and parameters: {'n_layers': 1, 'embedding_dim': 256, 'lr': 0.01729355128210771, 'lambda_val': 0.0060103019678805995, 'batch_size': 3576, 'optimizer': 'SGD'}.
2026-05-23 04:28:32,827 - optuna.study.study - INFO - Trial 129 finished with values: [0.014372340943696674, 0.011639344262295081, 0.017138964285172927] and parameters: {'n_layers': 1, 'embedding_dim': 64, 'lr': 7.466128919882156e-05, 'lambda_val': 0.006639299505918974, 'batch_size': 3576, 'optimizer': 'RMSprop'}.
2026-05-23 04:28:40,313 - experiment_functions - INFO - Early stopping at epoch 1750. Best Metrics: (0.011139387723415654, 0.011885245901639344, 0.014417951377758436)
2026-05-23 04:28:40,446 - optuna.study.study - INFO - Trial 130 finished with values: [0.011139387723415654, 0.011885245901639344, 0.014417951377758436] and parameters: {'n_layers': 3, 'embedding_dim': 96, 'lr': 0.001134436508843411, 'lambda_val': 0.025100460027309673, 'batch_size': 695, 'optimizer': 'RMSprop'}.
2026-05-23 04:28:43,552 - experiment_functions - INFO - Early stopping at epoch 650. Best Metrics: (0.022971170899241836, 0.00959016393442623, 0.01777286876167449)
2026-05-23 04:28:43,649 - optuna.study.study - INFO - Trial 131 finished with values: [0.022971170899241836, 0.00959016393442623, 0.01777286876167449] and parameters: {'n_layers': 2, 'embedding_dim': 96, 'lr': 0.02990805822010038, 'lambda_val': 2.221537862074406e-05, 'batch_size': 3488, 'optimizer': 'RMSprop'}.
2026-05-23 04:28:58,604 - experiment_functions - INFO - Early stopping at epoch 3800. Best Metrics: (0.029076256793471915, 0.017868852459016395, 0.02571839962042299)
2026-05-23 04:28:58,683 - optuna.study.study - INFO - Trial 132 finished with values: [0.029076256793471915, 0.017868852459016395, 0.02571839962042299] and parameters: {'n_layers': 4, 'embedding_dim': 64, 'lr': 0.00017970143388914436, 'lambda_val': 0.001092384612961102, 'batch_size': 3821, 'optimizer': 'Adam'}.
2026-05-23 04:29:01,125 - experiment_functions - INFO - Early stopping at epoch 550. Best Metrics: (0.04974859134028975, 0.032049180327868854, 0.04586973076963813)
2026-05-23 04:29:01,201 - optuna.study.study - INFO - Trial 133 finished with values: [0.04974859134028975, 0.032049180327868854, 0.04586973076963813] and parameters: {'n_layers': 2, 'embedding_dim': 64, 'lr': 0.004473575507756899, 'lambda_val': 0.0006976990437379927, 'batch_size': 3562, 'optimizer': 'Adam'}.
2026-05-23 04:29:03,980 - experiment_functions - INFO - Early stopping at epoch 550. Best Metrics: (0.02799013588940426, 0.01557377049180328, 0.0232288578037258)
2026-05-23 04:29:04,067 - optuna.study.study - INFO - Trial 134 finished with values: [0.02799013588940426, 0.01557377049180328, 0.0232288578037258] and parameters: {'n_layers': 4, 'embedding_dim': 64, 'lr': 0.00466856942146688, 'lambda_val': 1.374096848370064e-06, 'batch_size': 1764, 'optimizer': 'Adam'}.
2026-05-23 04:29:13,963 - experiment_functions - INFO - Early stopping at epoch 2150. Best Metrics: (0.028390169379503925, 0.01819672131147541, 0.026675296261543108)
2026-05-23 04:29:14,478 - optuna.study.study - INFO - Trial 135 finished with values: [0.028390169379503925, 0.01819672131147541, 0.026675296261543108] and parameters: {'n_layers': 2, 'embedding_dim': 256, 'lr': 0.0399895421175634, 'lambda_val': 0.006639299505918974, 'batch_size': 2370, 'optimizer': 'RMSprop'}.
2026-05-23 04:29:26,778 - optuna.study.study - INFO - Trial 136 finished with values: [0.023420326323220244, 0.014836065573770494, 0.024666484945914818] and parameters: {'n_layers': 2, 'embedding_dim': 64, 'lr': 7.466128919882156e-05, 'lambda_val': 0.00010447269915261112, 'batch_size': 3576, 'optimizer': 'RMSprop'}.
2026-05-23 04:29:43,473 - optuna.study.study - INFO - Trial 137 finished with values: [0.003872297806235841, 0.003852459016393443, 0.004628111196972679] and parameters: {'n_layers': 4, 'embedding_dim': 64, 'lr': 3.1044941866706985e-05, 'lambda_val': 0.001092384612961102, 'batch_size': 604, 'optimizer': 'Adam'}.
2026-05-23 04:29:48,943 - experiment_functions - INFO - Early stopping at epoch 500. Best Metrics: (0.027902004778598718, 0.007131147540983606, 0.01991774574109663)
2026-05-23 04:29:49,679 - optuna.study.study - INFO - Trial 138 finished with values: [0.027902004778598718, 0.007131147540983606, 0.01991774574109663] and parameters: {'n_layers': 3, 'embedding_dim': 256, 'lr': 0.0406369613134867, 'lambda_val': 0.05124641221929621, 'batch_size': 1379, 'optimizer': 'RMSprop'}.
2026-05-23 04:29:53,740 - experiment_functions - INFO - Early stopping at epoch 600. Best Metrics: (0.09438914888734673, 0.043934426229508196, 0.07522430160921867)
2026-05-23 04:29:53,827 - optuna.study.study - INFO - Trial 139 finished with values: [0.09438914888734673, 0.043934426229508196, 0.07522430160921867] and parameters: {'n_layers': 1, 'embedding_dim': 64, 'lr': 0.00466856942146688, 'lambda_val': 0.0004769034760402413, 'batch_size': 3135, 'optimizer': 'Adam'}.
2026-05-23 04:29:56,450 - experiment_functions - INFO - Early stopping at epoch 550. Best Metrics: (0.030147760708261893, 0.020901639344262295, 0.02765736132888337)
2026-05-23 04:29:56,532 - optuna.study.study - INFO - Trial 140 finished with values: [0.030147760708261893, 0.020901639344262295, 0.02765736132888337] and parameters: {'n_layers': 3, 'embedding_dim': 64, 'lr': 0.0016605661328321164, 'lambda_val': 0.00062453091272787, 'batch_size': 3188, 'optimizer': 'RMSprop'}.
2026-05-23 04:30:01,714 - experiment_functions - INFO - Early stopping at epoch 1350. Best Metrics: (0.058029740952240345, 0.03172131147540984, 0.0508439637439501)
2026-05-23 04:30:01,879 - optuna.study.study - INFO - Trial 141 finished with values: [0.058029740952240345, 0.03172131147540984, 0.0508439637439501] and parameters: {'n_layers': 4, 'embedding_dim': 32, 'lr': 0.0004803146544874298, 'lambda_val': 2.5817364532829402e-05, 'batch_size': 1427, 'optimizer': 'RMSprop'}.
2026-05-23 04:30:05,381 - experiment_functions - INFO - Early stopping at epoch 800. Best Metrics: (0.0750563260353207, 0.04, 0.06523753788084746)
2026-05-23 04:30:05,509 - optuna.study.study - INFO - Trial 142 finished with values: [0.0750563260353207, 0.04, 0.06523753788084746] and parameters: {'n_layers': 2, 'embedding_dim': 128, 'lr': 0.0006640426930867159, 'lambda_val': 0.0002794201622830738, 'batch_size': 2002, 'optimizer': 'RMSprop'}.
2026-05-23 04:30:08,205 - experiment_functions - INFO - Early stopping at epoch 550. Best Metrics: (0.018735715230770503, 0.01180327868852459, 0.017923435511334226)
2026-05-23 04:30:08,280 - optuna.study.study - INFO - Trial 143 finished with values: [0.018735715230770503, 0.01180327868852459, 0.017923435511334226] and parameters: {'n_layers': 1, 'embedding_dim': 256, 'lr': 0.05778814932837328, 'lambda_val': 0.0011674275547394154, 'batch_size': 2288, 'optimizer': 'Adam'}.
2026-05-23 04:30:24,192 - experiment_functions - INFO - Early stopping at epoch 3600. Best Metrics: (0.05176965788268504, 0.023114754098360654, 0.03940891787112036)
2026-05-23 04:30:24,290 - optuna.study.study - INFO - Trial 144 finished with values: [0.05176965788268504, 0.023114754098360654, 0.03940891787112036] and parameters: {'n_layers': 2, 'embedding_dim': 256, 'lr': 0.0406369613134867, 'lambda_val': 0.0006753060981377928, 'batch_size': 2240, 'optimizer': 'Adam'}.
2026-05-23 04:30:27,092 - experiment_functions - INFO - Early stopping at epoch 550. Best Metrics: (0.052717685839892475, 0.0269672131147541, 0.04150876065439925)
2026-05-23 04:30:28,326 - optuna.study.study - INFO - Trial 145 finished with values: [0.052717685839892475, 0.0269672131147541, 0.04150876065439925] and parameters: {'n_layers': 1, 'embedding_dim': 256, 'lr': 0.01729355128210771, 'lambda_val': 0.00010447269915261112, 'batch_size': 982, 'optimizer': 'Adam'}.
2026-05-23 04:30:32,457 - experiment_functions - INFO - Early stopping at epoch 1150. Best Metrics: (0.06419535701897701, 0.038688524590163934, 0.05909729244549085)
