2026-05-23 00:58:17,982 - optuna.study.study - INFO - Trial 137 finished with values: [0.027498397332143844, 0.016229508196721313, 0.02380827474221212] and parameters: {'n_layers': 1, 'embedding_dim': 32, 'lr': 0.0004373431878704552, 'lambda_val': 0.00030576887852059177, 'batch_size': 3082, 'optimizer': 'Adam'}.
2026-05-23 00:58:21,396 - experiment_functions - INFO - Early stopping at epoch 600. Best Metrics: (0.01651307600203406, 0.012540983606557378, 0.015925196876303307)
2026-05-23 00:58:21,477 - optuna.study.study - INFO - Trial 138 finished with values: [0.01651307600203406, 0.012540983606557378, 0.015925196876303307] and parameters: {'n_layers': 4, 'embedding_dim': 256, 'lr': 0.0004908910385795771, 'lambda_val': 0.006616376079935662, 'batch_size': 2979, 'optimizer': 'RMSprop'}.
2026-05-23 00:58:26,010 - experiment_functions - INFO - Early stopping at epoch 1300. Best Metrics: (0.034560336571633654, 0.018852459016393444, 0.030423760169723993)
2026-05-23 00:58:26,493 - optuna.study.study - INFO - Trial 139 finished with values: [0.034560336571633654, 0.018852459016393444, 0.030423760169723993] and parameters: {'n_layers': 3, 'embedding_dim': 96, 'lr': 0.00037164008089034755, 'lambda_val': 0.0007172417291421626, 'batch_size': 903, 'optimizer': 'Adam'}.
2026-05-23 00:58:29,582 - experiment_functions - INFO - Early stopping at epoch 700. Best Metrics: (0.010930732904701824, 0.008852459016393444, 0.011713780849148116)
2026-05-23 00:58:30,452 - optuna.study.study - INFO - Trial 140 finished with values: [0.010930732904701824, 0.008852459016393444, 0.011713780849148116] and parameters: {'n_layers': 4, 'embedding_dim': 96, 'lr': 0.0004908910385795771, 'lambda_val': 0.021707008087328228, 'batch_size': 2979, 'optimizer': 'Adam'}.
2026-05-23 00:58:38,611 - experiment_functions - INFO - Early stopping at epoch 2800. Best Metrics: (0.0383439731585414, 0.021967213114754098, 0.03320582978503323)
2026-05-23 00:58:38,697 - optuna.study.study - INFO - Trial 141 finished with values: [0.0383439731585414, 0.021967213114754098, 0.03320582978503323] and parameters: {'n_layers': 1, 'embedding_dim': 128, 'lr': 0.0004975305503445845, 'lambda_val': 8.923547676789324e-05, 'batch_size': 521, 'optimizer': 'RMSprop'}.
2026-05-23 00:58:43,829 - experiment_functions - INFO - Early stopping at epoch 600. Best Metrics: (0.02541124546847715, 0.014836065573770494, 0.022022576231629183)
2026-05-23 00:58:43,927 - optuna.study.study - INFO - Trial 142 finished with values: [0.02541124546847715, 0.014836065573770494, 0.022022576231629183] and parameters: {'n_layers': 3, 'embedding_dim': 32, 'lr': 0.0030767169926472077, 'lambda_val': 0.0015316223250778048, 'batch_size': 1525, 'optimizer': 'Adam'}.
2026-05-23 00:58:47,178 - experiment_functions - INFO - Early stopping at epoch 850. Best Metrics: (0.02709544526827572, 0.014918032786885247, 0.024401960421592178)
2026-05-23 00:58:48,141 - optuna.study.study - INFO - Trial 143 finished with values: [0.02709544526827572, 0.014918032786885247, 0.024401960421592178] and parameters: {'n_layers': 4, 'embedding_dim': 64, 'lr': 0.0004373431878704552, 'lambda_val': 0.004686874294387785, 'batch_size': 2156, 'optimizer': 'RMSprop'}.
2026-05-23 00:58:51,322 - experiment_functions - INFO - Early stopping at epoch 800. Best Metrics: (0.019732940693365484, 0.01418032786885246, 0.018381250798586064)
2026-05-23 00:58:51,757 - optuna.study.study - INFO - Trial 144 finished with values: [0.019732940693365484, 0.01418032786885246, 0.018381250798586064] and parameters: {'n_layers': 4, 'embedding_dim': 96, 'lr': 0.000534396994429506, 'lambda_val': 0.011470733297102229, 'batch_size': 1492, 'optimizer': 'Adam'}.
2026-05-23 00:58:55,023 - experiment_functions - INFO - Early stopping at epoch 900. Best Metrics: (0.040259920205793075, 0.01991803278688525, 0.031080336839338127)
2026-05-23 00:58:55,114 - optuna.study.study - INFO - Trial 145 finished with values: [0.040259920205793075, 0.01991803278688525, 0.031080336839338127] and parameters: {'n_layers': 2, 'embedding_dim': 96, 'lr': 0.0007586035361839872, 'lambda_val': 0.0006167459118972293, 'batch_size': 861, 'optimizer': 'Adam'}.
2026-05-23 00:58:58,142 - experiment_functions - INFO - Early stopping at epoch 550. Best Metrics: (0.025017814338191315, 0.015327868852459016, 0.022348913235406147)
2026-05-23 00:58:58,234 - optuna.study.study - INFO - Trial 146 finished with values: [0.025017814338191315, 0.015327868852459016, 0.022348913235406147] and parameters: {'n_layers': 4, 'embedding_dim': 128, 'lr': 0.004218807542385418, 'lambda_val': 0.0006167459118972293, 'batch_size': 1639, 'optimizer': 'Adam'}.
2026-05-23 00:59:01,089 - experiment_functions - INFO - Early stopping at epoch 700. Best Metrics: (0.026656228825789312, 0.014754098360655738, 0.022500997763063732)
2026-05-23 00:59:01,237 - optuna.study.study - INFO - Trial 147 finished with values: [0.026656228825789312, 0.014754098360655738, 0.022500997763063732] and parameters: {'n_layers': 4, 'embedding_dim': 32, 'lr': 0.0017367055415770025, 'lambda_val': 3.5741302842402904e-05, 'batch_size': 1353, 'optimizer': 'Adam'}.
2026-05-23 00:59:04,737 - experiment_functions - INFO - Early stopping at epoch 900. Best Metrics: (0.03430629566227207, 0.0169672131147541, 0.028226896540167048)
2026-05-23 00:59:04,853 - optuna.study.study - INFO - Trial 148 finished with values: [0.03430629566227207, 0.0169672131147541, 0.028226896540167048] and parameters: {'n_layers': 3, 'embedding_dim': 64, 'lr': 0.0007586035361839872, 'lambda_val': 6.335945209609284e-06, 'batch_size': 2156, 'optimizer': 'Adam'}.
2026-05-23 00:59:08,243 - experiment_functions - INFO - Early stopping at epoch 950. Best Metrics: (0.03336992067011587, 0.017540983606557377, 0.026968482395026402)
2026-05-23 00:59:08,352 - optuna.study.study - INFO - Trial 149 finished with values: [0.03336992067011587, 0.017540983606557377, 0.026968482395026402] and parameters: {'n_layers': 1, 'embedding_dim': 96, 'lr': 0.0030767169926472077, 'lambda_val': 8.923547676789324e-05, 'batch_size': 1623, 'optimizer': 'Adam'}.
2026-05-23 00:59:20,124 - experiment_functions - INFO - Early stopping at epoch 3950. Best Metrics: (0.02751790399439424, 0.018114754098360657, 0.026511861240507383)
2026-05-23 00:59:20,249 - optuna.study.study - INFO - Trial 150 finished with values: [0.02751790399439424, 0.018114754098360657, 0.026511861240507383] and parameters: {'n_layers': 1, 'embedding_dim': 96, 'lr': 0.0004014419530027751, 'lambda_val': 0.00010898776228747154, 'batch_size': 2831, 'optimizer': 'Adam'}.
2026-05-23 00:59:24,529 - experiment_functions - INFO - Early stopping at epoch 1300. Best Metrics: (0.034077765308137616, 0.020737704918032788, 0.03104395133982647)
2026-05-23 00:59:25,154 - optuna.study.study - INFO - Trial 151 finished with values: [0.034077765308137616, 0.020737704918032788, 0.03104395133982647] and parameters: {'n_layers': 1, 'embedding_dim': 128, 'lr': 0.0006241453841646659, 'lambda_val': 0.00010898776228747154, 'batch_size': 1254, 'optimizer': 'Adam'}.
2026-05-23 00:59:30,199 - experiment_functions - INFO - Early stopping at epoch 1600. Best Metrics: (0.034770539019474744, 0.019590163934426228, 0.02982806408641971)
2026-05-23 00:59:30,283 - optuna.study.study - INFO - Trial 152 finished with values: [0.034770539019474744, 0.019590163934426228, 0.02982806408641971] and parameters: {'n_layers': 1, 'embedding_dim': 128, 'lr': 0.0006241453841646659, 'lambda_val': 0.00010898776228747154, 'batch_size': 1428, 'optimizer': 'Adam'}.
2026-05-23 00:59:33,253 - experiment_functions - INFO - Early stopping at epoch 750. Best Metrics: (0.009749517756174554, 0.006639344262295083, 0.009318765538958664)
2026-05-23 00:59:33,338 - optuna.study.study - INFO - Trial 153 finished with values: [0.009749517756174554, 0.006639344262295083, 0.009318765538958664] and parameters: {'n_layers': 3, 'embedding_dim': 96, 'lr': 0.03971113056161353, 'lambda_val': 5.228100030668519e-06, 'batch_size': 1079, 'optimizer': 'Adam'}.
2026-05-23 00:59:44,764 - experiment_functions - INFO - Early stopping at epoch 3850. Best Metrics: (0.041639680372552446, 0.02360655737704918, 0.03768570774062961)
2026-05-23 00:59:45,638 - optuna.study.study - INFO - Trial 154 finished with values: [0.041639680372552446, 0.02360655737704918, 0.03768570774062961] and parameters: {'n_layers': 1, 'embedding_dim': 128, 'lr': 0.0004975305503445845, 'lambda_val': 0.0007172417291421626, 'batch_size': 521, 'optimizer': 'Adam'}.
2026-05-23 00:59:48,896 - experiment_functions - INFO - Early stopping at epoch 800. Best Metrics: (0.03330892183843741, 0.019262295081967213, 0.027761200354043815)
2026-05-23 00:59:49,978 - optuna.study.study - INFO - Trial 155 finished with values: [0.03330892183843741, 0.019262295081967213, 0.027761200354043815] and parameters: {'n_layers': 3, 'embedding_dim': 128, 'lr': 0.0007586035361839872, 'lambda_val': 6.335945209609284e-06, 'batch_size': 2156, 'optimizer': 'Adam'}.
2026-05-23 00:59:52,367 - experiment_functions - INFO - Early stopping at epoch 600. Best Metrics: (0.02993598187052216, 0.017377049180327873, 0.02676979587592555)
2026-05-23 00:59:53,301 - optuna.study.study - INFO - Trial 156 finished with values: [0.02993598187052216, 0.017377049180327873, 0.02676979587592555] and parameters: {'n_layers': 1, 'embedding_dim': 96, 'lr': 0.004702358633304699, 'lambda_val': 8.923547676789324e-05, 'batch_size': 1623, 'optimizer': 'Adam'}.
2026-05-23 01:00:05,568 - optuna.study.study - INFO - Trial 157 finished with values: [0.027672495655082754, 0.01762295081967213, 0.026413550981841404] and parameters: {'n_layers': 1, 'embedding_dim': 64, 'lr': 0.00037164008089034755, 'lambda_val': 5.5532012635423735e-06, 'batch_size': 1079, 'optimizer': 'Adam'}.
2026-05-23 01:00:08,301 - experiment_functions - INFO - Early stopping at epoch 700. Best Metrics: (0.03164368599738274, 0.01704918032786885, 0.02738966992481919)
2026-05-23 01:00:08,388 - optuna.study.study - INFO - Trial 158 finished with values: [0.03164368599738274, 0.01704918032786885, 0.02738966992481919] and parameters: {'n_layers': 2, 'embedding_dim': 64, 'lr': 0.00208644616811878, 'lambda_val': 0.00053956191152972, 'batch_size': 1468, 'optimizer': 'Adam'}.
2026-05-23 01:00:10,986 - experiment_functions - INFO - Early stopping at epoch 850. Best Metrics: (0.034729944161257804, 0.02, 0.02914846552890522)
2026-05-23 01:00:11,088 - optuna.study.study - INFO - Trial 159 finished with values: [0.034729944161257804, 0.02, 0.02914846552890522] and parameters: {'n_layers': 2, 'embedding_dim': 64, 'lr': 0.0007586035361839872, 'lambda_val': 0.004686874294387785, 'batch_size': 2156, 'optimizer': 'Adam'}.
2026-05-23 01:00:14,169 - experiment_functions - INFO - Early stopping at epoch 1050. Best Metrics: (0.0404833616710758, 0.02278688524590164, 0.03439882312142692)
2026-05-23 01:00:15,557 - optuna.study.study - INFO - Trial 160 finished with values: [0.0404833616710758, 0.02278688524590164, 0.03439882312142692] and parameters: {'n_layers': 3, 'embedding_dim': 64, 'lr': 0.0006241453841646659, 'lambda_val': 5.5532012635423735e-06, 'batch_size': 939, 'optimizer': 'Adam'}.
2026-05-23 01:00:18,204 - experiment_functions - INFO - Early stopping at epoch 650. Best Metrics: (0.029657466595611203, 0.014918032786885247, 0.024162326161432254)
2026-05-23 01:00:18,294 - optuna.study.study - INFO - Trial 161 finished with values: [0.029657466595611203, 0.014918032786885247, 0.024162326161432254] and parameters: {'n_layers': 4, 'embedding_dim': 128, 'lr': 0.0008732317857197807, 'lambda_val': 0.004662435394613103, 'batch_size': 939, 'optimizer': 'Adam'}.
2026-05-23 01:00:20,545 - experiment_functions - INFO - Early stopping at epoch 600. Best Metrics: (0.02475888847536507, 0.014426229508196723, 0.021475513916142646)
2026-05-23 01:00:20,639 - optuna.study.study - INFO - Trial 162 finished with values: [0.02475888847536507, 0.014426229508196723, 0.021475513916142646] and parameters: {'n_layers': 3, 'embedding_dim': 64, 'lr': 0.0021135494885504793, 'lambda_val': 5.228100030668519e-06, 'batch_size': 3659, 'optimizer': 'Adam'}.
2026-05-23 01:00:25,550 - experiment_functions - INFO - Early stopping at epoch 1450. Best Metrics: (0.029228988603741297, 0.015983606557377048, 0.022688042046583975)
2026-05-23 01:00:26,535 - optuna.study.study - INFO - Trial 163 finished with values: [0.029228988603741297, 0.015983606557377048, 0.022688042046583975] and parameters: {'n_layers': 3, 'embedding_dim': 96, 'lr': 0.00034335523469639003, 'lambda_val': 1.2051712435160432e-05, 'batch_size': 2831, 'optimizer': 'Adam'}.
2026-05-23 01:00:29,629 - experiment_functions - INFO - Early stopping at epoch 1050. Best Metrics: (0.035044888360925314, 0.019262295081967213, 0.029761413204152633)
2026-05-23 01:00:30,356 - optuna.study.study - INFO - Trial 164 finished with values: [0.035044888360925314, 0.019262295081967213, 0.029761413204152633] and parameters: {'n_layers': 2, 'embedding_dim': 64, 'lr': 0.0007586035361839872, 'lambda_val': 6.335945209609284e-06, 'batch_size': 2156, 'optimizer': 'Adam'}.
2026-05-23 01:00:33,117 - experiment_functions - INFO - Early stopping at epoch 700. Best Metrics: (0.024542786821027708, 0.014426229508196723, 0.021274359860372474)
2026-05-23 01:00:33,203 - optuna.study.study - INFO - Trial 165 finished with values: [0.024542786821027708, 0.014426229508196723, 0.021274359860372474] and parameters: {'n_layers': 4, 'embedding_dim': 96, 'lr': 0.0008732317857197807, 'lambda_val': 5.472243143002854e-05, 'batch_size': 3011, 'optimizer': 'Adam'}.
2026-05-23 01:00:36,945 - experiment_functions - INFO - Early stopping at epoch 1100. Best Metrics: (0.02567048249707402, 0.015163934426229509, 0.023092532634003904)
2026-05-23 01:00:38,860 - optuna.study.study - INFO - Trial 166 finished with values: [0.02567048249707402, 0.015163934426229509, 0.023092532634003904] and parameters: {'n_layers': 1, 'embedding_dim': 32, 'lr': 0.0012673220264025206, 'lambda_val': 5.775336112034289e-05, 'batch_size': 1639, 'optimizer': 'Adam'}.
2026-05-23 01:00:42,483 - experiment_functions - INFO - Early stopping at epoch 800. Best Metrics: (0.034656893391020294, 0.01959016393442623, 0.031023215462064397)
2026-05-23 01:00:43,859 - optuna.study.study - INFO - Trial 167 finished with values: [0.034656893391020294, 0.01959016393442623, 0.031023215462064397] and parameters: {'n_layers': 2, 'embedding_dim': 256, 'lr': 0.0007442610977334545, 'lambda_val': 0.004686874294387785, 'batch_size': 2004, 'optimizer': 'Adam'}.
2026-05-23 01:00:46,236 - experiment_functions - INFO - Early stopping at epoch 550. Best Metrics: (0.027365716834297452, 0.015983606557377048, 0.024347759123977294)
2026-05-23 01:00:46,326 - optuna.study.study - INFO - Trial 168 finished with values: [0.027365716834297452, 0.015983606557377048, 0.024347759123977294] and parameters: {'n_layers': 4, 'embedding_dim': 128, 'lr': 0.0030767169926472077, 'lambda_val': 6.335945209609284e-06, 'batch_size': 1864, 'optimizer': 'Adam'}.
2026-05-23 01:00:50,514 - experiment_functions - INFO - Early stopping at epoch 1600. Best Metrics: (0.028593099937547852, 0.01795081967213115, 0.028657871084692803)
2026-05-23 01:00:50,601 - optuna.study.study - INFO - Trial 169 finished with values: [0.028593099937547852, 0.01795081967213115, 0.028657871084692803] and parameters: {'n_layers': 1, 'embedding_dim': 96, 'lr': 0.0007586035361839872, 'lambda_val': 8.923547676789324e-05, 'batch_size': 1623, 'optimizer': 'Adam'}.
2026-05-23 01:00:55,322 - experiment_functions - INFO - Early stopping at epoch 1500. Best Metrics: (0.028069983498572947, 0.018934426229508198, 0.02596083605606349)
2026-05-23 01:00:56,092 - optuna.study.study - INFO - Trial 170 finished with values: [0.028069983498572947, 0.018934426229508198, 0.02596083605606349] and parameters: {'n_layers': 1, 'embedding_dim': 256, 'lr': 0.0006241453841646659, 'lambda_val': 0.006616376079935662, 'batch_size': 1254, 'optimizer': 'Adam'}.
2026-05-23 01:00:59,609 - experiment_functions - INFO - Early stopping at epoch 750. Best Metrics: (0.028216089608497634, 0.017295081967213115, 0.027591883313062063)
2026-05-23 01:00:59,709 - optuna.study.study - INFO - Trial 171 finished with values: [0.028216089608497634, 0.017295081967213115, 0.027591883313062063] and parameters: {'n_layers': 1, 'embedding_dim': 256, 'lr': 0.002823327203965183, 'lambda_val': 8.923547676789324e-05, 'batch_size': 1254, 'optimizer': 'Adam'}.
2026-05-23 01:01:03,355 - experiment_functions - INFO - Early stopping at epoch 850. Best Metrics: (0.03110627394967238, 0.01877049180327869, 0.02635471023370264)
2026-05-23 01:01:03,608 - optuna.study.study - INFO - Trial 172 finished with values: [0.03110627394967238, 0.01877049180327869, 0.02635471023370264] and parameters: {'n_layers': 2, 'embedding_dim': 256, 'lr': 0.0007442610977334545, 'lambda_val': 0.004686874294387785, 'batch_size': 1254, 'optimizer': 'Adam'}.
2026-05-23 01:01:06,857 - experiment_functions - INFO - Early stopping at epoch 1050. Best Metrics: (0.002349865867819418, 0.001639344262295082, 0.0019944303967402498)
2026-05-23 01:01:06,953 - optuna.study.study - INFO - Trial 173 finished with values: [0.002349865867819418, 0.001639344262295082, 0.0019944303967402498] and parameters: {'n_layers': 3, 'embedding_dim': 96, 'lr': 1.3573646204311998e-05, 'lambda_val': 5.228100030668519e-06, 'batch_size': 1079, 'optimizer': 'Adam'}.
2026-05-23 01:01:09,686 - experiment_functions - INFO - Early stopping at epoch 1000. Best Metrics: (0.032776977539234406, 0.018360655737704918, 0.028834631392924335)
2026-05-23 01:01:09,774 - optuna.study.study - INFO - Trial 174 finished with values: [0.032776977539234406, 0.018360655737704918, 0.028834631392924335] and parameters: {'n_layers': 1, 'embedding_dim': 64, 'lr': 0.0012673220264025206, 'lambda_val': 5.775336112034289e-05, 'batch_size': 1639, 'optimizer': 'Adam'}.
2026-05-23 01:01:14,150 - experiment_functions - INFO - Early stopping at epoch 800. Best Metrics: (0.027583530903880334, 0.016721311475409836, 0.02561771066898188)
2026-05-23 01:01:15,253 - optuna.study.study - INFO - Trial 175 finished with values: [0.027583530903880334, 0.016721311475409836, 0.02561771066898188] and parameters: {'n_layers': 2, 'embedding_dim': 256, 'lr': 0.0007442610977334545, 'lambda_val': 5.228100030668519e-06, 'batch_size': 2156, 'optimizer': 'Adam'}.
2026-05-23 01:01:26,348 - experiment_functions - INFO - Early stopping at epoch 2250. Best Metrics: (0.03237712410214209, 0.019262295081967213, 0.03041029779920514)
2026-05-23 01:01:26,438 - optuna.study.study - INFO - Trial 176 finished with values: [0.03237712410214209, 0.019262295081967213, 0.03041029779920514] and parameters: {'n_layers': 1, 'embedding_dim': 96, 'lr': 0.00037164008089034755, 'lambda_val': 5.775336112034289e-05, 'batch_size': 2490, 'optimizer': 'Adam'}.
2026-05-23 01:01:28,553 - experiment_functions - INFO - Early stopping at epoch 550. Best Metrics: (0.025048667088973846, 0.015983606557377048, 0.024764773200312375)
2026-05-23 01:01:28,651 - optuna.study.study - INFO - Trial 177 finished with values: [0.025048667088973846, 0.015983606557377048, 0.024764773200312375] and parameters: {'n_layers': 3, 'embedding_dim': 96, 'lr': 0.0012673220264025206, 'lambda_val': 0.004662435394613103, 'batch_size': 939, 'optimizer': 'RMSprop'}.
2026-05-23 01:01:31,166 - experiment_functions - INFO - Early stopping at epoch 650. Best Metrics: (0.036043267303104747, 0.018688524590163937, 0.030426130919476203)
2026-05-23 01:01:31,317 - optuna.study.study - INFO - Trial 178 finished with values: [0.036043267303104747, 0.018688524590163937, 0.030426130919476203] and parameters: {'n_layers': 3, 'embedding_dim': 96, 'lr': 0.0008732317857197807, 'lambda_val': 0.0007172417291421626, 'batch_size': 2861, 'optimizer': 'RMSprop'}.
2026-05-23 01:01:34,980 - experiment_functions - INFO - Early stopping at epoch 1400. Best Metrics: (0.03204874056865284, 0.019672131147540985, 0.027283056364169486)
2026-05-23 01:01:35,209 - optuna.study.study - INFO - Trial 179 finished with values: [0.03204874056865284, 0.019672131147540985, 0.027283056364169486] and parameters: {'n_layers': 1, 'embedding_dim': 64, 'lr': 0.0012673220264025206, 'lambda_val': 0.0007172417291421626, 'batch_size': 903, 'optimizer': 'Adam'}.
2026-05-23 01:01:38,929 - experiment_functions - INFO - Early stopping at epoch 650. Best Metrics: (0.026120756864688927, 0.015983606557377048, 0.025588958390764426)
2026-05-23 01:01:40,224 - optuna.study.study - INFO - Trial 180 finished with values: [0.026120756864688927, 0.015983606557377048, 0.025588958390764426] and parameters: {'n_layers': 4, 'embedding_dim': 256, 'lr': 0.0007442610977334545, 'lambda_val': 0.004662435394613103, 'batch_size': 1864, 'optimizer': 'Adam'}.
2026-05-23 01:01:43,501 - experiment_functions - INFO - Early stopping at epoch 800. Best Metrics: (0.028304063503140905, 0.018606557377049183, 0.026926409380410177)
2026-05-23 01:01:43,602 - optuna.study.study - INFO - Trial 181 finished with values: [0.028304063503140905, 0.018606557377049183, 0.026926409380410177] and parameters: {'n_layers': 2, 'embedding_dim': 256, 'lr': 0.0007442610977334545, 'lambda_val': 0.0007172417291421626, 'batch_size': 1485, 'optimizer': 'Adam'}.
2026-05-23 01:01:50,112 - experiment_functions - INFO - Early stopping at epoch 2550. Best Metrics: (0.02831137864340431, 0.01762295081967213, 0.026802203966091478)
2026-05-23 01:01:51,232 - optuna.study.study - INFO - Trial 182 finished with values: [0.02831137864340431, 0.01762295081967213, 0.026802203966091478] and parameters: {'n_layers': 1, 'embedding_dim': 96, 'lr': 0.0004014419530027751, 'lambda_val': 0.00012943647560972012, 'batch_size': 2831, 'optimizer': 'Adam'}.
2026-05-23 01:01:57,528 - experiment_functions - INFO - Early stopping at epoch 2400. Best Metrics: (0.004162654911008273, 0.0034426229508196723, 0.0044968917469609725)
