2026-05-23 01:13:28,781 - optuna.study.study - INFO - Trial 21 finished with values: [0.01109979834916202, 0.006885245901639345, 0.009440095071388297] and parameters: {'n_layers': 2, 'embedding_dim': 256, 'lr': 6.470304829805458e-05, 'lambda_val': 3.0220683903863306e-06, 'batch_size': 2913, 'optimizer': 'Adam'}.
2026-05-23 01:13:31,278 - experiment_functions - INFO - Early stopping at epoch 550. Best Metrics: (0.005078413430792359, 0.003934426229508197, 0.005732511023088178)
2026-05-23 01:13:31,378 - optuna.study.study - INFO - Trial 22 finished with values: [0.005078413430792359, 0.003934426229508197, 0.005732511023088178] and parameters: {'n_layers': 4, 'embedding_dim': 96, 'lr': 0.00763346650655157, 'lambda_val': 0.04546749429761899, 'batch_size': 1625, 'optimizer': 'Adam'}.
2026-05-23 01:13:37,323 - experiment_functions - INFO - Early stopping at epoch 950. Best Metrics: (0.0033695387917752513, 0.0018852459016393442, 0.002633647899737342)
2026-05-23 01:13:37,605 - optuna.study.study - INFO - Trial 23 finished with values: [0.0033695387917752513, 0.0018852459016393442, 0.002633647899737342] and parameters: {'n_layers': 1, 'embedding_dim': 256, 'lr': 0.017006778525979056, 'lambda_val': 0.009053897056525585, 'batch_size': 587, 'optimizer': 'SGD'}.
2026-05-23 01:13:40,107 - experiment_functions - INFO - Early stopping at epoch 600. Best Metrics: (0.020316610341149625, 0.012704918032786887, 0.018904249585119184)
2026-05-23 01:13:40,194 - optuna.study.study - INFO - Trial 24 finished with values: [0.020316610341149625, 0.012704918032786887, 0.018904249585119184] and parameters: {'n_layers': 1, 'embedding_dim': 64, 'lr': 0.01491993466802033, 'lambda_val': 2.185196333765497e-06, 'batch_size': 2668, 'optimizer': 'RMSprop'}.
2026-05-23 01:13:45,646 - experiment_functions - INFO - Early stopping at epoch 1600. Best Metrics: (0.033708021905664985, 0.01745901639344262, 0.026258357744967615)
2026-05-23 01:13:46,276 - optuna.study.study - INFO - Trial 25 finished with values: [0.033708021905664985, 0.01745901639344262, 0.026258357744967615] and parameters: {'n_layers': 1, 'embedding_dim': 96, 'lr': 0.0006071804751429957, 'lambda_val': 7.202525708659488e-05, 'batch_size': 2030, 'optimizer': 'RMSprop'}.
2026-05-23 01:13:50,703 - experiment_functions - INFO - Early stopping at epoch 1350. Best Metrics: (0.0016006728224227276, 0.0015573770491803282, 0.002043928403207117)
2026-05-23 01:13:52,085 - optuna.study.study - INFO - Trial 26 finished with values: [0.0016006728224227276, 0.0015573770491803282, 0.002043928403207117] and parameters: {'n_layers': 1, 'embedding_dim': 96, 'lr': 3.5886358524656776e-05, 'lambda_val': 0.0010773523307735997, 'batch_size': 2648, 'optimizer': 'RMSprop'}.
2026-05-23 01:13:54,961 - experiment_functions - INFO - Early stopping at epoch 500. Best Metrics: (0.010351636564537206, 0.006803278688524591, 0.009480053576324782)
2026-05-23 01:13:56,091 - optuna.study.study - INFO - Trial 27 finished with values: [0.010351636564537206, 0.006803278688524591, 0.009480053576324782] and parameters: {'n_layers': 4, 'embedding_dim': 256, 'lr': 0.014788946508654328, 'lambda_val': 0.00021481591111836083, 'batch_size': 2351, 'optimizer': 'RMSprop'}.
2026-05-23 01:14:07,564 - optuna.study.study - INFO - Trial 28 finished with values: [0.0061814513240342, 0.0042622950819672135, 0.006558153484817379] and parameters: {'n_layers': 1, 'embedding_dim': 32, 'lr': 7.821256854176811e-05, 'lambda_val': 0.001169871510365941, 'batch_size': 2846, 'optimizer': 'RMSprop'}.
2026-05-23 01:14:09,814 - experiment_functions - INFO - Early stopping at epoch 500. Best Metrics: (0.002887340276066932, 0.001967213114754099, 0.0038488850739938464)
2026-05-23 01:14:09,898 - optuna.study.study - INFO - Trial 29 finished with values: [0.002887340276066932, 0.001967213114754099, 0.0038488850739938464] and parameters: {'n_layers': 4, 'embedding_dim': 32, 'lr': 0.01906241459999901, 'lambda_val': 0.00623041921481539, 'batch_size': 567, 'optimizer': 'SGD'}.
2026-05-23 01:14:23,046 - optuna.study.study - INFO - Trial 30 finished with values: [0.016171409966090452, 0.009262295081967215, 0.012626552979523394] and parameters: {'n_layers': 3, 'embedding_dim': 96, 'lr': 6.787719237393545e-05, 'lambda_val': 0.0010020188325183545, 'batch_size': 3811, 'optimizer': 'Adam'}.
2026-05-23 01:14:40,320 - optuna.study.study - INFO - Trial 31 finished with values: [0.0038188032579577888, 0.0027868852459016396, 0.003730481599071561] and parameters: {'n_layers': 4, 'embedding_dim': 256, 'lr': 1.8581424323945843e-05, 'lambda_val': 0.0034929486601176984, 'batch_size': 1943, 'optimizer': 'RMSprop'}.
2026-05-23 01:14:42,447 - experiment_functions - INFO - Early stopping at epoch 500. Best Metrics: (0.0016980761506457036, 0.0011475409836065576, 0.0015659878965180386)
2026-05-23 01:14:42,543 - optuna.study.study - INFO - Trial 32 finished with values: [0.0016980761506457036, 0.0011475409836065576, 0.0015659878965180386] and parameters: {'n_layers': 1, 'embedding_dim': 96, 'lr': 2.7508337810595802e-05, 'lambda_val': 0.029042101843299153, 'batch_size': 3213, 'optimizer': 'SGD'}.
2026-05-23 01:14:44,851 - experiment_functions - INFO - Early stopping at epoch 500. Best Metrics: (0.002142196923156366, 0.0015573770491803282, 0.001956645016247798)
2026-05-23 01:14:44,943 - optuna.study.study - INFO - Trial 33 finished with values: [0.002142196923156366, 0.0015573770491803282, 0.001956645016247798] and parameters: {'n_layers': 3, 'embedding_dim': 128, 'lr': 0.00038224063503956276, 'lambda_val': 5.171882167091852e-06, 'batch_size': 3827, 'optimizer': 'SGD'}.
2026-05-23 01:14:47,239 - experiment_functions - INFO - Early stopping at epoch 550. Best Metrics: (0.028648507787380526, 0.01655737704918033, 0.02462898633782592)
2026-05-23 01:14:47,325 - optuna.study.study - INFO - Trial 34 finished with values: [0.028648507787380526, 0.01655737704918033, 0.02462898633782592] and parameters: {'n_layers': 2, 'embedding_dim': 64, 'lr': 0.010275728897055822, 'lambda_val': 1.150702232586112e-06, 'batch_size': 1031, 'optimizer': 'Adam'}.
2026-05-23 01:14:49,600 - experiment_functions - INFO - Early stopping at epoch 500. Best Metrics: (0.001014930740719683, 0.0011475409836065574, 0.0010408420841994948)
2026-05-23 01:14:49,693 - optuna.study.study - INFO - Trial 35 finished with values: [0.001014930740719683, 0.0011475409836065574, 0.0010408420841994948] and parameters: {'n_layers': 2, 'embedding_dim': 96, 'lr': 5.844663538694063e-05, 'lambda_val': 0.00010127659569885537, 'batch_size': 1409, 'optimizer': 'SGD'}.
2026-05-23 01:14:52,623 - experiment_functions - INFO - Early stopping at epoch 700. Best Metrics: (0.009187180868398528, 0.00639344262295082, 0.008006374863631581)
2026-05-23 01:14:52,694 - optuna.study.study - INFO - Trial 36 finished with values: [0.009187180868398528, 0.00639344262295082, 0.008006374863631581] and parameters: {'n_layers': 4, 'embedding_dim': 96, 'lr': 0.03855804534172472, 'lambda_val': 0.0004948769403467439, 'batch_size': 1319, 'optimizer': 'Adam'}.
2026-05-23 01:14:57,827 - experiment_functions - INFO - Early stopping at epoch 1400. Best Metrics: (0.013980330965719257, 0.008524590163934429, 0.011242594718868293)
2026-05-23 01:14:58,216 - optuna.study.study - INFO - Trial 37 finished with values: [0.013980330965719257, 0.008524590163934429, 0.011242594718868293] and parameters: {'n_layers': 3, 'embedding_dim': 64, 'lr': 0.020530939277008692, 'lambda_val': 3.525317735317933e-05, 'batch_size': 3937, 'optimizer': 'Adam'}.
2026-05-23 01:15:03,343 - experiment_functions - INFO - Early stopping at epoch 1700. Best Metrics: (0.01841681234167679, 0.01278688524590164, 0.01737191447408852)
2026-05-23 01:15:03,470 - optuna.study.study - INFO - Trial 38 finished with values: [0.01841681234167679, 0.01278688524590164, 0.01737191447408852] and parameters: {'n_layers': 1, 'embedding_dim': 32, 'lr': 0.017022768569889442, 'lambda_val': 4.477419176425064e-06, 'batch_size': 1609, 'optimizer': 'RMSprop'}.
2026-05-23 01:15:05,816 - experiment_functions - INFO - Early stopping at epoch 500. Best Metrics: (0.000789826767258887, 0.0011475409836065576, 0.0010315504375600444)
2026-05-23 01:15:06,405 - optuna.study.study - INFO - Trial 39 finished with values: [0.000789826767258887, 0.0011475409836065576, 0.0010315504375600444] and parameters: {'n_layers': 2, 'embedding_dim': 256, 'lr': 9.34439659882915e-05, 'lambda_val': 0.011088864941733606, 'batch_size': 1476, 'optimizer': 'SGD'}.
2026-05-23 01:15:18,897 - optuna.study.study - INFO - Trial 40 finished with values: [0.009431576889769854, 0.0069672131147540985, 0.009719659170714797] and parameters: {'n_layers': 3, 'embedding_dim': 64, 'lr': 8.443425266491583e-05, 'lambda_val': 0.018866653244521227, 'batch_size': 997, 'optimizer': 'RMSprop'}.
2026-05-23 01:15:22,931 - experiment_functions - INFO - Early stopping at epoch 1200. Best Metrics: (0.01398149631294299, 0.009918032786885246, 0.013755503892777339)
2026-05-23 01:15:23,022 - optuna.study.study - INFO - Trial 41 finished with values: [0.01398149631294299, 0.009918032786885246, 0.013755503892777339] and parameters: {'n_layers': 3, 'embedding_dim': 32, 'lr': 0.027106166148146822, 'lambda_val': 4.064611678585387e-05, 'batch_size': 2236, 'optimizer': 'RMSprop'}.
2026-05-23 01:15:25,030 - experiment_functions - INFO - Early stopping at epoch 500. Best Metrics: (0.003487053791811977, 0.0015573770491803278, 0.0023484849768440584)
2026-05-23 01:15:25,112 - optuna.study.study - INFO - Trial 42 finished with values: [0.003487053791811977, 0.0015573770491803278, 0.0023484849768440584] and parameters: {'n_layers': 1, 'embedding_dim': 32, 'lr': 0.000496802361339361, 'lambda_val': 0.0022066978836799613, 'batch_size': 1987, 'optimizer': 'SGD'}.
2026-05-23 01:15:27,475 - experiment_functions - INFO - Early stopping at epoch 500. Best Metrics: (0.0023080782053322368, 0.0014754098360655738, 0.0021788080470749593)
2026-05-23 01:15:27,561 - optuna.study.study - INFO - Trial 43 finished with values: [0.0023080782053322368, 0.0014754098360655738, 0.0021788080470749593] and parameters: {'n_layers': 3, 'embedding_dim': 128, 'lr': 0.0002401129588138294, 'lambda_val': 0.0014660101148162913, 'batch_size': 3838, 'optimizer': 'SGD'}.
2026-05-23 01:15:45,611 - optuna.study.study - INFO - Trial 44 finished with values: [0.008873082242833216, 0.006147540983606558, 0.008192026190556784] and parameters: {'n_layers': 4, 'embedding_dim': 256, 'lr': 3.4215225017251126e-05, 'lambda_val': 0.000580358493379218, 'batch_size': 3857, 'optimizer': 'Adam'}.
2026-05-23 01:15:48,032 - experiment_functions - INFO - Early stopping at epoch 550. Best Metrics: (0.003321857040971007, 0.0015573770491803278, 0.0023345460642004577)
2026-05-23 01:15:48,160 - optuna.study.study - INFO - Trial 45 finished with values: [0.003321857040971007, 0.0015573770491803278, 0.0023345460642004577] and parameters: {'n_layers': 1, 'embedding_dim': 128, 'lr': 3.863074876498971e-05, 'lambda_val': 2.329570970771113e-06, 'batch_size': 3050, 'optimizer': 'Adam'}.
2026-05-23 01:15:50,380 - experiment_functions - INFO - Early stopping at epoch 500. Best Metrics: (0.002659128499067598, 0.0021311475409836068, 0.0028741166314472607)
2026-05-23 01:15:50,835 - optuna.study.study - INFO - Trial 46 finished with values: [0.002659128499067598, 0.0021311475409836068, 0.0028741166314472607] and parameters: {'n_layers': 4, 'embedding_dim': 64, 'lr': 1.3023897197968055e-05, 'lambda_val': 0.001674206490814925, 'batch_size': 1175, 'optimizer': 'SGD'}.
2026-05-23 01:15:53,627 - experiment_functions - INFO - Early stopping at epoch 500. Best Metrics: (0.0022361896411600655, 0.001475409836065574, 0.0018198939996981567)
2026-05-23 01:15:53,718 - optuna.study.study - INFO - Trial 47 finished with values: [0.0022361896411600655, 0.001475409836065574, 0.0018198939996981567] and parameters: {'n_layers': 4, 'embedding_dim': 32, 'lr': 0.0029488624901885074, 'lambda_val': 0.0005939396550831904, 'batch_size': 1817, 'optimizer': 'SGD'}.
2026-05-23 01:15:56,156 - experiment_functions - INFO - Early stopping at epoch 500. Best Metrics: (0.0019346396467339628, 0.0018852459016393442, 0.0022197919986036603)
2026-05-23 01:15:56,279 - optuna.study.study - INFO - Trial 48 finished with values: [0.0019346396467339628, 0.0018852459016393442, 0.0022197919986036603] and parameters: {'n_layers': 4, 'embedding_dim': 96, 'lr': 0.00035358560039150866, 'lambda_val': 0.00016491913085498022, 'batch_size': 3574, 'optimizer': 'SGD'}.
2026-05-23 01:16:00,111 - experiment_functions - INFO - Early stopping at epoch 900. Best Metrics: (0.007845934517428437, 0.005901639344262295, 0.008934728812992478)
2026-05-23 01:16:00,978 - optuna.study.study - INFO - Trial 49 finished with values: [0.007845934517428437, 0.005901639344262295, 0.008934728812992478] and parameters: {'n_layers': 3, 'embedding_dim': 96, 'lr': 0.0006237069115447143, 'lambda_val': 0.08449400800894759, 'batch_size': 2134, 'optimizer': 'RMSprop'}.
2026-05-23 01:16:08,221 - experiment_functions - INFO - Early stopping at epoch 2450. Best Metrics: (0.03085650782287342, 0.017295081967213115, 0.026402626985021802)
2026-05-23 01:16:09,086 - optuna.study.study - INFO - Trial 50 finished with values: [0.03085650782287342, 0.017295081967213115, 0.026402626985021802] and parameters: {'n_layers': 1, 'embedding_dim': 32, 'lr': 0.000496802361339361, 'lambda_val': 0.0022066978836799613, 'batch_size': 1987, 'optimizer': 'Adam'}.
2026-05-23 01:16:11,555 - experiment_functions - INFO - Early stopping at epoch 600. Best Metrics: (0.031126403079830053, 0.016065573770491805, 0.024323832074471228)
2026-05-23 01:16:11,642 - optuna.study.study - INFO - Trial 51 finished with values: [0.031126403079830053, 0.016065573770491805, 0.024323832074471228] and parameters: {'n_layers': 1, 'embedding_dim': 96, 'lr': 0.00736079824955284, 'lambda_val': 7.202525708659488e-05, 'batch_size': 2030, 'optimizer': 'Adam'}.
2026-05-23 01:16:14,237 - experiment_functions - INFO - Early stopping at epoch 650. Best Metrics: (0.01818515258131415, 0.012540983606557378, 0.017862060449733617)
2026-05-23 01:16:14,357 - optuna.study.study - INFO - Trial 52 finished with values: [0.01818515258131415, 0.012540983606557378, 0.017862060449733617] and parameters: {'n_layers': 1, 'embedding_dim': 128, 'lr': 0.017022768569889442, 'lambda_val': 4.477419176425064e-06, 'batch_size': 1609, 'optimizer': 'RMSprop'}.
2026-05-23 01:16:20,705 - experiment_functions - INFO - Early stopping at epoch 1550. Best Metrics: (0.0076927231906526216, 0.00598360655737705, 0.008319784825726314)
2026-05-23 01:16:20,945 - optuna.study.study - INFO - Trial 53 finished with values: [0.0076927231906526216, 0.00598360655737705, 0.008319784825726314] and parameters: {'n_layers': 2, 'embedding_dim': 64, 'lr': 0.006136698942876551, 'lambda_val': 0.019329947758474065, 'batch_size': 2846, 'optimizer': 'RMSprop'}.
2026-05-23 01:16:23,918 - experiment_functions - INFO - Early stopping at epoch 500. Best Metrics: (0.003910438950737056, 0.002540983606557377, 0.0034801853820664247)
2026-05-23 01:16:25,722 - optuna.study.study - INFO - Trial 54 finished with values: [0.003910438950737056, 0.002540983606557377, 0.0034801853820664247] and parameters: {'n_layers': 4, 'embedding_dim': 64, 'lr': 0.00035358560039150866, 'lambda_val': 3.7159455962709016e-06, 'batch_size': 3763, 'optimizer': 'SGD'}.
2026-05-23 01:16:41,650 - optuna.study.study - INFO - Trial 55 finished with values: [0.007180567430107554, 0.005, 0.006600549515327297] and parameters: {'n_layers': 2, 'embedding_dim': 256, 'lr': 5.371261341390484e-05, 'lambda_val': 3.529029906313647e-05, 'batch_size': 3811, 'optimizer': 'Adam'}.
2026-05-23 01:16:48,136 - experiment_functions - INFO - Early stopping at epoch 1550. Best Metrics: (0.011181838667866562, 0.007704918032786886, 0.011327093083527522)
2026-05-23 01:16:48,248 - optuna.study.study - INFO - Trial 56 finished with values: [0.011181838667866562, 0.007704918032786886, 0.011327093083527522] and parameters: {'n_layers': 1, 'embedding_dim': 96, 'lr': 0.01491993466802033, 'lambda_val': 0.08449400800894759, 'batch_size': 2668, 'optimizer': 'RMSprop'}.
2026-05-23 01:16:51,628 - experiment_functions - INFO - Early stopping at epoch 750. Best Metrics: (0.005197727383142668, 0.0036065573770491808, 0.005205934708895803)
2026-05-23 01:16:51,724 - optuna.study.study - INFO - Trial 57 finished with values: [0.005197727383142668, 0.0036065573770491808, 0.005205934708895803] and parameters: {'n_layers': 4, 'embedding_dim': 96, 'lr': 0.004562830809034575, 'lambda_val': 0.08449400800894759, 'batch_size': 2134, 'optimizer': 'RMSprop'}.
2026-05-23 01:16:54,194 - experiment_functions - INFO - Early stopping at epoch 500. Best Metrics: (0.002861079192002465, 0.0018852459016393442, 0.0027320993891783033)
2026-05-23 01:16:54,755 - optuna.study.study - INFO - Trial 58 finished with values: [0.002861079192002465, 0.0018852459016393442, 0.0027320993891783033] and parameters: {'n_layers': 3, 'embedding_dim': 128, 'lr': 0.00035358560039150866, 'lambda_val': 0.00016491913085498022, 'batch_size': 3574, 'optimizer': 'SGD'}.
2026-05-23 01:16:56,910 - experiment_functions - INFO - Early stopping at epoch 500. Best Metrics: (0.0024858903369491454, 0.002213114754098361, 0.002466373727363583)
2026-05-23 01:16:57,012 - optuna.study.study - INFO - Trial 59 finished with values: [0.0024858903369491454, 0.002213114754098361, 0.002466373727363583] and parameters: {'n_layers': 2, 'embedding_dim': 64, 'lr': 0.0005864091804749678, 'lambda_val': 0.00037952021171484574, 'batch_size': 3763, 'optimizer': 'SGD'}.
2026-05-23 01:17:02,074 - experiment_functions - INFO - Early stopping at epoch 1350. Best Metrics: (0.009864594124846233, 0.006721311475409835, 0.009797707133029467)
2026-05-23 01:17:03,335 - optuna.study.study - INFO - Trial 60 finished with values: [0.009864594124846233, 0.006721311475409835, 0.009797707133029467] and parameters: {'n_layers': 4, 'embedding_dim': 64, 'lr': 0.0181553252436734, 'lambda_val': 1.1392246379015404e-05, 'batch_size': 3937, 'optimizer': 'Adam'}.
2026-05-23 01:17:06,521 - experiment_functions - INFO - Early stopping at epoch 850. Best Metrics: (0.009849136517961356, 0.007377049180327869, 0.010555739182115897)
2026-05-23 01:17:06,620 - optuna.study.study - INFO - Trial 61 finished with values: [0.009849136517961356, 0.007377049180327869, 0.010555739182115897] and parameters: {'n_layers': 2, 'embedding_dim': 32, 'lr': 0.03788718493482174, 'lambda_val': 0.0014660101148162913, 'batch_size': 3838, 'optimizer': 'RMSprop'}.
2026-05-23 01:17:09,836 - experiment_functions - INFO - Early stopping at epoch 700. Best Metrics: (0.006729000935141748, 0.0054918032786885245, 0.007543067897854104)
2026-05-23 01:17:09,909 - optuna.study.study - INFO - Trial 62 finished with values: [0.006729000935141748, 0.0054918032786885245, 0.007543067897854104] and parameters: {'n_layers': 2, 'embedding_dim': 256, 'lr': 0.0181553252436734, 'lambda_val': 0.0472767292805195, 'batch_size': 2953, 'optimizer': 'RMSprop'}.
2026-05-23 01:17:12,916 - experiment_functions - INFO - Early stopping at epoch 500. Best Metrics: (0.0018904436454870728, 0.001639344262295082, 0.001872467830088213)
2026-05-23 01:17:13,017 - optuna.study.study - INFO - Trial 63 finished with values: [0.0018904436454870728, 0.001639344262295082, 0.001872467830088213] and parameters: {'n_layers': 1, 'embedding_dim': 32, 'lr': 0.0014902400429312995, 'lambda_val': 0.010949527724278119, 'batch_size': 2440, 'optimizer': 'SGD'}.
2026-05-23 01:17:16,062 - experiment_functions - INFO - Early stopping at epoch 800. Best Metrics: (0.016102112765479654, 0.010573770491803278, 0.015562480637394287)
2026-05-23 01:17:16,156 - optuna.study.study - INFO - Trial 64 finished with values: [0.016102112765479654, 0.010573770491803278, 0.015562480637394287] and parameters: {'n_layers': 1, 'embedding_dim': 64, 'lr': 0.024055272907309386, 'lambda_val': 2.185196333765497e-06, 'batch_size': 2668, 'optimizer': 'RMSprop'}.
2026-05-23 01:17:19,533 - experiment_functions - INFO - Early stopping at epoch 900. Best Metrics: (0.029659830987209965, 0.01672131147540984, 0.02566037526397823)
2026-05-23 01:17:20,765 - optuna.study.study - INFO - Trial 65 finished with values: [0.029659830987209965, 0.01672131147540984, 0.02566037526397823] and parameters: {'n_layers': 3, 'embedding_dim': 96, 'lr': 0.0006071804751429957, 'lambda_val': 4.709336823209938e-05, 'batch_size': 2030, 'optimizer': 'RMSprop'}.
2026-05-23 01:17:24,745 - experiment_functions - INFO - Early stopping at epoch 1050. Best Metrics: (0.004613378851467874, 0.003852459016393443, 0.005770757936060663)
2026-05-23 01:17:24,939 - optuna.study.study - INFO - Trial 66 finished with values: [0.004613378851467874, 0.003852459016393443, 0.005770757936060663] and parameters: {'n_layers': 3, 'embedding_dim': 32, 'lr': 0.02917036398747882, 'lambda_val': 0.06839725671798878, 'batch_size': 3018, 'optimizer': 'Adam'}.
2026-05-23 01:17:28,249 - experiment_functions - INFO - Early stopping at epoch 500. Best Metrics: (0.007197841049775741, 0.005245901639344262, 0.00773358516725801)
2026-05-23 01:17:28,339 - optuna.study.study - INFO - Trial 67 finished with values: [0.007197841049775741, 0.005245901639344262, 0.00773358516725801] and parameters: {'n_layers': 4, 'embedding_dim': 256, 'lr': 0.04858483877276336, 'lambda_val': 0.015280698226488912, 'batch_size': 1943, 'optimizer': 'RMSprop'}.
2026-05-23 01:17:31,635 - experiment_functions - INFO - Early stopping at epoch 800. Best Metrics: (0.003893399118308827, 0.004426229508196722, 0.0055093782281244045)
