2026-05-23 01:24:31,892 - optuna.study.study - INFO - Trial 161 finished with values: [0.022411976609214908, 0.015491803278688524, 0.021677555858135817] and parameters: {'n_layers': 2, 'embedding_dim': 96, 'lr': 0.0014902400429312995, 'lambda_val': 0.010949527724278119, 'batch_size': 2030, 'optimizer': 'RMSprop'}.
2026-05-23 01:24:34,316 - experiment_functions - INFO - Early stopping at epoch 550. Best Metrics: (0.020858070210721457, 0.013278688524590167, 0.02119757418935703)
2026-05-23 01:24:34,456 - optuna.study.study - INFO - Trial 162 finished with values: [0.020858070210721457, 0.013278688524590167, 0.02119757418935703] and parameters: {'n_layers': 1, 'embedding_dim': 64, 'lr': 0.010275728897055822, 'lambda_val': 0.00012261737938750884, 'batch_size': 1088, 'optimizer': 'RMSprop'}.
2026-05-23 01:24:38,264 - experiment_functions - INFO - Early stopping at epoch 900. Best Metrics: (0.032477674914338714, 0.018032786885245903, 0.025697155682684318)
2026-05-23 01:24:38,334 - optuna.study.study - INFO - Trial 163 finished with values: [0.032477674914338714, 0.018032786885245903, 0.025697155682684318] and parameters: {'n_layers': 2, 'embedding_dim': 96, 'lr': 0.0006071804751429957, 'lambda_val': 1.770202893112185e-05, 'batch_size': 2030, 'optimizer': 'RMSprop'}.
2026-05-23 01:24:43,611 - experiment_functions - INFO - Early stopping at epoch 1650. Best Metrics: (0.04241432270779675, 0.022295081967213116, 0.03352752341972517)
2026-05-23 01:24:43,701 - optuna.study.study - INFO - Trial 164 finished with values: [0.04241432270779675, 0.022295081967213116, 0.03352752341972517] and parameters: {'n_layers': 2, 'embedding_dim': 32, 'lr': 0.0006237069115447143, 'lambda_val': 1.150702232586112e-06, 'batch_size': 1031, 'optimizer': 'RMSprop'}.
2026-05-23 01:25:00,250 - optuna.study.study - INFO - Trial 165 finished with values: [0.0027249579358175377, 0.0027868852459016396, 0.003585631424198965] and parameters: {'n_layers': 2, 'embedding_dim': 64, 'lr': 1.7789867019158944e-05, 'lambda_val': 1.8703886629471356e-05, 'batch_size': 3122, 'optimizer': 'Adam'}.
2026-05-23 01:25:03,164 - experiment_functions - INFO - Early stopping at epoch 550. Best Metrics: (0.026271101930046434, 0.015491803278688524, 0.02446748472629436)
2026-05-23 01:25:03,308 - optuna.study.study - INFO - Trial 166 finished with values: [0.026271101930046434, 0.015491803278688524, 0.02446748472629436] and parameters: {'n_layers': 3, 'embedding_dim': 32, 'lr': 0.0054017846217753514, 'lambda_val': 1.150702232586112e-06, 'batch_size': 1031, 'optimizer': 'Adam'}.
2026-05-23 01:25:09,048 - experiment_functions - INFO - Early stopping at epoch 1350. Best Metrics: (0.01344681294386892, 0.008442622950819673, 0.011472268235775946)
2026-05-23 01:25:10,059 - optuna.study.study - INFO - Trial 167 finished with values: [0.01344681294386892, 0.008442622950819673, 0.011472268235775946] and parameters: {'n_layers': 3, 'embedding_dim': 32, 'lr': 0.01491993466802033, 'lambda_val': 7.202525708659488e-05, 'batch_size': 1088, 'optimizer': 'RMSprop'}.
2026-05-23 01:25:15,029 - experiment_functions - INFO - Early stopping at epoch 1000. Best Metrics: (0.02636447943297378, 0.01655737704918033, 0.024765008676761763)
2026-05-23 01:25:15,679 - optuna.study.study - INFO - Trial 168 finished with values: [0.02636447943297378, 0.01655737704918033, 0.024765008676761763] and parameters: {'n_layers': 2, 'embedding_dim': 96, 'lr': 0.0006071804751429957, 'lambda_val': 7.202525708659488e-05, 'batch_size': 4030, 'optimizer': 'Adam'}.
2026-05-23 01:25:20,168 - experiment_functions - INFO - Early stopping at epoch 1400. Best Metrics: (0.03237964690619572, 0.01778688524590164, 0.029908264851035486)
2026-05-23 01:25:21,023 - optuna.study.study - INFO - Trial 169 finished with values: [0.03237964690619572, 0.01778688524590164, 0.029908264851035486] and parameters: {'n_layers': 1, 'embedding_dim': 96, 'lr': 0.000496802361339361, 'lambda_val': 0.0009657244544246451, 'batch_size': 1861, 'optimizer': 'RMSprop'}.
2026-05-23 01:25:24,519 - experiment_functions - INFO - Early stopping at epoch 900. Best Metrics: (0.022264930982500614, 0.01557377049180328, 0.022091353778762677)
2026-05-23 01:25:24,899 - optuna.study.study - INFO - Trial 170 finished with values: [0.022264930982500614, 0.01557377049180328, 0.022091353778762677] and parameters: {'n_layers': 3, 'embedding_dim': 64, 'lr': 0.0006071804751429957, 'lambda_val': 4.709336823209938e-05, 'batch_size': 3143, 'optimizer': 'Adam'}.
2026-05-23 01:25:30,298 - experiment_functions - INFO - Early stopping at epoch 1400. Best Metrics: (0.02926451574824264, 0.017213114754098365, 0.026273269001576904)
2026-05-23 01:25:30,563 - optuna.study.study - INFO - Trial 171 finished with values: [0.02926451574824264, 0.017213114754098365, 0.026273269001576904] and parameters: {'n_layers': 3, 'embedding_dim': 96, 'lr': 0.0002939047449078427, 'lambda_val': 1.150702232586112e-06, 'batch_size': 1002, 'optimizer': 'RMSprop'}.
2026-05-23 01:25:34,587 - experiment_functions - INFO - Early stopping at epoch 1150. Best Metrics: (0.03669737352303626, 0.019590163934426228, 0.031364741799441244)
2026-05-23 01:25:34,682 - optuna.study.study - INFO - Trial 172 finished with values: [0.03669737352303626, 0.019590163934426228, 0.031364741799441244] and parameters: {'n_layers': 2, 'embedding_dim': 96, 'lr': 0.0006071804751429957, 'lambda_val': 0.0015604142770877156, 'batch_size': 1031, 'optimizer': 'Adam'}.
2026-05-23 01:25:41,610 - experiment_functions - INFO - Early stopping at epoch 2400. Best Metrics: (0.032819025396219594, 0.018032786885245903, 0.028730353544048376)
2026-05-23 01:25:41,700 - optuna.study.study - INFO - Trial 173 finished with values: [0.032819025396219594, 0.018032786885245903, 0.028730353544048376] and parameters: {'n_layers': 1, 'embedding_dim': 64, 'lr': 0.0006335857209731445, 'lambda_val': 1.150702232586112e-06, 'batch_size': 1031, 'optimizer': 'Adam'}.
2026-05-23 01:25:44,323 - experiment_functions - INFO - Early stopping at epoch 650. Best Metrics: (0.02242020487619158, 0.012540983606557378, 0.01685389572361192)
2026-05-23 01:25:44,420 - optuna.study.study - INFO - Trial 174 finished with values: [0.02242020487619158, 0.012540983606557378, 0.01685389572361192] and parameters: {'n_layers': 2, 'embedding_dim': 96, 'lr': 0.010275728897055822, 'lambda_val': 0.0004948769403467439, 'batch_size': 2069, 'optimizer': 'RMSprop'}.
2026-05-23 01:25:56,666 - optuna.study.study - INFO - Trial 175 finished with values: [0.014311961401858246, 0.010245901639344262, 0.014430255495988784] and parameters: {'n_layers': 3, 'embedding_dim': 32, 'lr': 0.00014789833189629128, 'lambda_val': 4.709336823209938e-05, 'batch_size': 2913, 'optimizer': 'RMSprop'}.
2026-05-23 01:25:59,335 - experiment_functions - INFO - Early stopping at epoch 700. Best Metrics: (0.02228185465930103, 0.016147540983606556, 0.02225490483735411)
2026-05-23 01:25:59,426 - optuna.study.study - INFO - Trial 176 finished with values: [0.02228185465930103, 0.016147540983606556, 0.02225490483735411] and parameters: {'n_layers': 1, 'embedding_dim': 64, 'lr': 0.007430893518915307, 'lambda_val': 0.0009657244544246451, 'batch_size': 638, 'optimizer': 'RMSprop'}.
2026-05-23 01:26:01,763 - experiment_functions - INFO - Early stopping at epoch 550. Best Metrics: (0.027290574789379324, 0.015081967213114753, 0.024557818523343516)
2026-05-23 01:26:01,879 - optuna.study.study - INFO - Trial 177 finished with values: [0.027290574789379324, 0.015081967213114753, 0.024557818523343516] and parameters: {'n_layers': 1, 'embedding_dim': 96, 'lr': 0.0181553252436734, 'lambda_val': 1.1392246379015404e-05, 'batch_size': 2934, 'optimizer': 'Adam'}.
2026-05-23 01:26:04,131 - experiment_functions - INFO - Early stopping at epoch 550. Best Metrics: (0.025948831778207917, 0.01721311475409836, 0.024579307784117484)
2026-05-23 01:26:04,212 - optuna.study.study - INFO - Trial 178 finished with values: [0.025948831778207917, 0.01721311475409836, 0.024579307784117484] and parameters: {'n_layers': 1, 'embedding_dim': 96, 'lr': 0.0033679369179454638, 'lambda_val': 0.0004948769403467439, 'batch_size': 3882, 'optimizer': 'RMSprop'}.
2026-05-23 01:26:07,078 - experiment_functions - INFO - Early stopping at epoch 600. Best Metrics: (0.023567189308884923, 0.015000000000000001, 0.021495038577260858)
2026-05-23 01:26:07,225 - optuna.study.study - INFO - Trial 179 finished with values: [0.023567189308884923, 0.015000000000000001, 0.021495038577260858] and parameters: {'n_layers': 1, 'embedding_dim': 96, 'lr': 0.0033679369179454638, 'lambda_val': 0.019329947758474065, 'batch_size': 1596, 'optimizer': 'Adam'}.
2026-05-23 01:26:09,651 - experiment_functions - INFO - Early stopping at epoch 600. Best Metrics: (0.02961764558955044, 0.01778688524590164, 0.026860815202154352)
2026-05-23 01:26:09,741 - optuna.study.study - INFO - Trial 180 finished with values: [0.02961764558955044, 0.01778688524590164, 0.026860815202154352] and parameters: {'n_layers': 1, 'embedding_dim': 64, 'lr': 0.0033679369179454638, 'lambda_val': 0.0004948769403467439, 'batch_size': 1156, 'optimizer': 'RMSprop'}.
2026-05-23 01:26:12,108 - experiment_functions - INFO - Early stopping at epoch 550. Best Metrics: (0.022480604689524772, 0.013852459016393441, 0.019657911640749346)
2026-05-23 01:26:12,196 - optuna.study.study - INFO - Trial 181 finished with values: [0.022480604689524772, 0.013852459016393441, 0.019657911640749346] and parameters: {'n_layers': 2, 'embedding_dim': 64, 'lr': 0.0054017846217753514, 'lambda_val': 1.150702232586112e-06, 'batch_size': 3143, 'optimizer': 'Adam'}.
2026-05-23 01:26:22,926 - experiment_functions - INFO - Early stopping at epoch 3850. Best Metrics: (0.02938298783472089, 0.01762295081967213, 0.026388016036961337)
2026-05-23 01:26:23,100 - optuna.study.study - INFO - Trial 182 finished with values: [0.02938298783472089, 0.01762295081967213, 0.026388016036961337] and parameters: {'n_layers': 1, 'embedding_dim': 32, 'lr': 0.000496802361339361, 'lambda_val': 0.00014297366550674857, 'batch_size': 638, 'optimizer': 'Adam'}.
2026-05-23 01:26:25,972 - experiment_functions - INFO - Early stopping at epoch 600. Best Metrics: (0.029816465339766483, 0.016967213114754097, 0.025644231912471737)
2026-05-23 01:26:26,068 - optuna.study.study - INFO - Trial 183 finished with values: [0.029816465339766483, 0.016967213114754097, 0.025644231912471737] and parameters: {'n_layers': 1, 'embedding_dim': 32, 'lr': 0.0054017846217753514, 'lambda_val': 1.150702232586112e-06, 'batch_size': 4030, 'optimizer': 'Adam'}.
2026-05-23 01:26:29,646 - experiment_functions - INFO - Early stopping at epoch 950. Best Metrics: (0.03326696548186545, 0.01672131147540984, 0.027340698566050124)
2026-05-23 01:26:29,968 - optuna.study.study - INFO - Trial 184 finished with values: [0.03326696548186545, 0.01672131147540984, 0.027340698566050124] and parameters: {'n_layers': 3, 'embedding_dim': 96, 'lr': 0.000496802361339361, 'lambda_val': 0.0009657244544246451, 'batch_size': 1285, 'optimizer': 'RMSprop'}.
2026-05-23 01:26:32,357 - experiment_functions - INFO - Early stopping at epoch 550. Best Metrics: (0.020496845161528728, 0.012540983606557378, 0.018996426596149023)
2026-05-23 01:26:32,454 - optuna.study.study - INFO - Trial 185 finished with values: [0.020496845161528728, 0.012540983606557378, 0.018996426596149023] and parameters: {'n_layers': 2, 'embedding_dim': 32, 'lr': 0.010275728897055822, 'lambda_val': 7.202525708659488e-05, 'batch_size': 1031, 'optimizer': 'Adam'}.
2026-05-23 01:26:34,783 - experiment_functions - INFO - Early stopping at epoch 550. Best Metrics: (0.02468054558432231, 0.015245901639344264, 0.02205040166424213)
2026-05-23 01:26:34,875 - optuna.study.study - INFO - Trial 186 finished with values: [0.02468054558432231, 0.015245901639344264, 0.02205040166424213] and parameters: {'n_layers': 2, 'embedding_dim': 64, 'lr': 0.010275728897055822, 'lambda_val': 6.392625329460114e-05, 'batch_size': 823, 'optimizer': 'Adam'}.
2026-05-23 01:26:40,851 - experiment_functions - INFO - Early stopping at epoch 1900. Best Metrics: (0.03470846436474889, 0.018770491803278694, 0.029479346347659727)
2026-05-23 01:26:41,041 - optuna.study.study - INFO - Trial 187 finished with values: [0.03470846436474889, 0.018770491803278694, 0.029479346347659727] and parameters: {'n_layers': 2, 'embedding_dim': 64, 'lr': 0.00037298587418552697, 'lambda_val': 7.202525708659488e-05, 'batch_size': 2030, 'optimizer': 'RMSprop'}.
2026-05-23 01:26:44,670 - experiment_functions - INFO - Early stopping at epoch 950. Best Metrics: (0.02611006287090734, 0.014344262295081968, 0.023104588747445864)
2026-05-23 01:26:44,750 - optuna.study.study - INFO - Trial 188 finished with values: [0.02611006287090734, 0.014344262295081968, 0.023104588747445864] and parameters: {'n_layers': 3, 'embedding_dim': 32, 'lr': 0.0006237069115447143, 'lambda_val': 4.709336823209938e-05, 'batch_size': 2534, 'optimizer': 'RMSprop'}.
2026-05-23 01:26:48,312 - experiment_functions - INFO - Early stopping at epoch 550. Best Metrics: (0.025443499561147397, 0.01557377049180328, 0.023241970388521868)
2026-05-23 01:26:48,400 - optuna.study.study - INFO - Trial 189 finished with values: [0.025443499561147397, 0.01557377049180328, 0.023241970388521868] and parameters: {'n_layers': 2, 'embedding_dim': 96, 'lr': 0.0054017846217753514, 'lambda_val': 1.150702232586112e-06, 'batch_size': 2846, 'optimizer': 'Adam'}.
2026-05-23 01:26:50,767 - experiment_functions - INFO - Early stopping at epoch 550. Best Metrics: (0.023590553360608967, 0.01418032786885246, 0.020442689949198643)
2026-05-23 01:26:50,872 - optuna.study.study - INFO - Trial 190 finished with values: [0.023590553360608967, 0.01418032786885246, 0.020442689949198643] and parameters: {'n_layers': 1, 'embedding_dim': 64, 'lr': 0.00736079824955284, 'lambda_val': 3.0220683903863306e-06, 'batch_size': 3712, 'optimizer': 'RMSprop'}.
2026-05-23 01:26:54,025 - experiment_functions - INFO - Early stopping at epoch 850. Best Metrics: (0.01599872383851917, 0.008688524590163936, 0.013150527712195884)
2026-05-23 01:26:54,413 - optuna.study.study - INFO - Trial 191 finished with values: [0.01599872383851917, 0.008688524590163936, 0.013150527712195884] and parameters: {'n_layers': 3, 'embedding_dim': 32, 'lr': 0.017022768569889442, 'lambda_val': 4.477419176425064e-06, 'batch_size': 1609, 'optimizer': 'RMSprop'}.
2026-05-23 01:26:56,694 - experiment_functions - INFO - Early stopping at epoch 550. Best Metrics: (0.017657633246117695, 0.011639344262295083, 0.018370036210842208)
2026-05-23 01:26:56,803 - optuna.study.study - INFO - Trial 192 finished with values: [0.017657633246117695, 0.011639344262295083, 0.018370036210842208] and parameters: {'n_layers': 1, 'embedding_dim': 32, 'lr': 0.010275728897055822, 'lambda_val': 4.064611678585387e-05, 'batch_size': 1031, 'optimizer': 'RMSprop'}.
2026-05-23 01:27:01,358 - experiment_functions - INFO - Early stopping at epoch 1000. Best Metrics: (0.016581413118342686, 0.011639344262295083, 0.0164839198813221)
2026-05-23 01:27:01,452 - optuna.study.study - INFO - Trial 193 finished with values: [0.016581413118342686, 0.011639344262295083, 0.0164839198813221] and parameters: {'n_layers': 1, 'embedding_dim': 256, 'lr': 0.014479554663251128, 'lambda_val': 0.0022066978836799613, 'batch_size': 2913, 'optimizer': 'RMSprop'}.
2026-05-23 01:27:04,408 - experiment_functions - INFO - Early stopping at epoch 700. Best Metrics: (0.026150386553940943, 0.016311475409836067, 0.024856443219017272)
2026-05-23 01:27:04,886 - optuna.study.study - INFO - Trial 194 finished with values: [0.026150386553940943, 0.016311475409836067, 0.024856443219017272] and parameters: {'n_layers': 4, 'embedding_dim': 96, 'lr': 0.0006237069115447143, 'lambda_val': 0.0003059902601152104, 'batch_size': 1088, 'optimizer': 'RMSprop'}.
2026-05-23 01:27:09,005 - experiment_functions - INFO - Early stopping at epoch 1000. Best Metrics: (0.03134274785770445, 0.017868852459016395, 0.027437487416206906)
2026-05-23 01:27:09,308 - optuna.study.study - INFO - Trial 195 finished with values: [0.03134274785770445, 0.017868852459016395, 0.027437487416206906] and parameters: {'n_layers': 3, 'embedding_dim': 96, 'lr': 0.0004599021655017754, 'lambda_val': 0.0004948769403467439, 'batch_size': 2030, 'optimizer': 'RMSprop'}.
2026-05-23 01:27:11,979 - experiment_functions - INFO - Early stopping at epoch 600. Best Metrics: (0.020878332540183262, 0.014098360655737704, 0.020116858341769645)
2026-05-23 01:27:12,065 - optuna.study.study - INFO - Trial 196 finished with values: [0.020878332540183262, 0.014098360655737704, 0.020116858341769645] and parameters: {'n_layers': 1, 'embedding_dim': 96, 'lr': 0.00736079824955284, 'lambda_val': 0.0004260724446025466, 'batch_size': 2030, 'optimizer': 'Adam'}.
2026-05-23 01:27:15,967 - experiment_functions - INFO - Early stopping at epoch 1050. Best Metrics: (0.03237358476445487, 0.01680327868852459, 0.026436111452483438)
2026-05-23 01:27:16,281 - optuna.study.study - INFO - Trial 197 finished with values: [0.03237358476445487, 0.01680327868852459, 0.026436111452483438] and parameters: {'n_layers': 3, 'embedding_dim': 96, 'lr': 0.0006071804751429957, 'lambda_val': 4.709336823209938e-05, 'batch_size': 2030, 'optimizer': 'Adam'}.
2026-05-23 01:27:22,291 - experiment_functions - INFO - Early stopping at epoch 1800. Best Metrics: (0.03464204849138224, 0.01918032786885246, 0.026866208335297678)
2026-05-23 01:27:23,265 - optuna.study.study - INFO - Trial 198 finished with values: [0.03464204849138224, 0.01918032786885246, 0.026866208335297678] and parameters: {'n_layers': 3, 'embedding_dim': 96, 'lr': 0.0002386554512236704, 'lambda_val': 0.00016867595805103173, 'batch_size': 2030, 'optimizer': 'RMSprop'}.
2026-05-23 01:27:25,570 - experiment_functions - INFO - Early stopping at epoch 600. Best Metrics: (0.02972820423292033, 0.015901639344262298, 0.023949445039218236)
2026-05-23 01:27:25,664 - optuna.study.study - INFO - Trial 199 finished with values: [0.02972820423292033, 0.015901639344262298, 0.023949445039218236] and parameters: {'n_layers': 1, 'embedding_dim': 32, 'lr': 0.010275728897055822, 'lambda_val': 0.0009657244544246451, 'batch_size': 1031, 'optimizer': 'Adam'}.
2026-05-23 01:27:30,400 - experiment_functions - INFO - Early stopping at epoch 1000. Best Metrics: (0.029202084122267897, 0.01721311475409836, 0.023766702151363277)
2026-05-23 01:27:30,610 - optuna.study.study - INFO - Trial 200 finished with values: [0.029202084122267897, 0.01721311475409836, 0.023766702151363277] and parameters: {'n_layers': 3, 'embedding_dim': 96, 'lr': 0.000496802361339361, 'lambda_val': 0.0009657244544246451, 'batch_size': 1088, 'optimizer': 'RMSprop'}.
2026-05-23 01:27:42,000 - experiment_functions - INFO - Early stopping at epoch 3700. Best Metrics: (0.003843855963634393, 0.002459016393442623, 0.003055687681060815)
2026-05-23 01:27:42,127 - optuna.study.study - INFO - Trial 201 finished with values: [0.003843855963634393, 0.002459016393442623, 0.003055687681060815] and parameters: {'n_layers': 1, 'embedding_dim': 32, 'lr': 4.255613762202101e-05, 'lambda_val': 1.150702232586112e-06, 'batch_size': 1031, 'optimizer': 'Adam'}.
2026-05-23 01:27:49,665 - experiment_functions - INFO - Early stopping at epoch 2500. Best Metrics: (0.038950407907678536, 0.020409836065573773, 0.03499292435660111)
2026-05-23 01:27:49,752 - optuna.study.study - INFO - Trial 202 finished with values: [0.038950407907678536, 0.020409836065573773, 0.03499292435660111] and parameters: {'n_layers': 1, 'embedding_dim': 32, 'lr': 0.000496802361339361, 'lambda_val': 7.202525708659488e-05, 'batch_size': 1031, 'optimizer': 'RMSprop'}.
2026-05-23 01:27:52,330 - experiment_functions - INFO - Early stopping at epoch 600. Best Metrics: (0.026755164339997244, 0.014836065573770494, 0.023819606298001592)
2026-05-23 01:27:52,848 - optuna.study.study - INFO - Trial 203 finished with values: [0.026755164339997244, 0.014836065573770494, 0.023819606298001592] and parameters: {'n_layers': 4, 'embedding_dim': 32, 'lr': 0.0054017846217753514, 'lambda_val': 1.150702232586112e-06, 'batch_size': 542, 'optimizer': 'Adam'}.
2026-05-23 01:28:03,369 - experiment_functions - INFO - Early stopping at epoch 3750. Best Metrics: (0.03427930204854175, 0.018114754098360657, 0.029948665051527094)
2026-05-23 01:28:04,623 - optuna.study.study - INFO - Trial 204 finished with values: [0.03427930204854175, 0.018114754098360657, 0.029948665051527094] and parameters: {'n_layers': 1, 'embedding_dim': 32, 'lr': 0.0005346818701204757, 'lambda_val': 1.150702232586112e-06, 'batch_size': 1031, 'optimizer': 'RMSprop'}.
2026-05-23 01:28:10,393 - experiment_functions - INFO - Early stopping at epoch 1800. Best Metrics: (0.03137371099946549, 0.01819672131147541, 0.02691545857793616)
2026-05-23 01:28:10,818 - optuna.study.study - INFO - Trial 205 finished with values: [0.03137371099946549, 0.01819672131147541, 0.02691545857793616] and parameters: {'n_layers': 1, 'embedding_dim': 64, 'lr': 0.0006071804751429957, 'lambda_val': 7.202525708659488e-05, 'batch_size': 4030, 'optimizer': 'Adam'}.
2026-05-23 01:28:16,075 - experiment_functions - INFO - Early stopping at epoch 1600. Best Metrics: (0.03593045465027316, 0.02057377049180328, 0.0296095145826516)
2026-05-23 01:28:16,164 - optuna.study.study - INFO - Trial 206 finished with values: [0.03593045465027316, 0.02057377049180328, 0.0296095145826516] and parameters: {'n_layers': 3, 'embedding_dim': 32, 'lr': 0.0006071804751429957, 'lambda_val': 3.599619235549841e-05, 'batch_size': 638, 'optimizer': 'Adam'}.
2026-05-23 01:28:22,486 - experiment_functions - INFO - Early stopping at epoch 2100. Best Metrics: (0.028209922768752733, 0.018032786885245903, 0.02454990177441114)
