2026-05-23 03:15:27,158 - optuna.study.study - INFO - Trial 81 finished with values: [0.002542847072329671, 0.0017213114754098362, 0.0028824714965367273] and parameters: {'n_layers': 2, 'embedding_dim': 32, 'lr': 0.0004969264317801683, 'lambda_val': 0.03322464541117807, 'batch_size': 1809, 'optimizer': 'SGD'}.
2026-05-23 03:15:30,336 - experiment_functions - INFO - Early stopping at epoch 500. Best Metrics: (0.0032016092568439495, 0.002049180327868853, 0.003253576184559499)
2026-05-23 03:15:31,122 - optuna.study.study - INFO - Trial 82 finished with values: [0.0032016092568439495, 0.002049180327868853, 0.003253576184559499] and parameters: {'n_layers': 3, 'embedding_dim': 128, 'lr': 0.006343661696405227, 'lambda_val': 0.00018385882411773826, 'batch_size': 1080, 'optimizer': 'SGD'}.
2026-05-23 03:15:49,098 - optuna.study.study - INFO - Trial 83 finished with values: [0.010515762488678892, 0.00778688524590164, 0.010331462770740901] and parameters: {'n_layers': 4, 'embedding_dim': 96, 'lr': 4.5283111815717906e-05, 'lambda_val': 5.425911743955223e-06, 'batch_size': 2096, 'optimizer': 'RMSprop'}.
2026-05-23 03:15:57,510 - experiment_functions - INFO - Early stopping at epoch 1550. Best Metrics: (0.03460759328918695, 0.019508196721311478, 0.028932386174357096)
2026-05-23 03:15:57,606 - optuna.study.study - INFO - Trial 84 finished with values: [0.03460759328918695, 0.019508196721311478, 0.028932386174357096] and parameters: {'n_layers': 4, 'embedding_dim': 128, 'lr': 0.000293040961262534, 'lambda_val': 2.27009302283491e-06, 'batch_size': 3527, 'optimizer': 'Adam'}.
2026-05-23 03:16:02,959 - experiment_functions - INFO - Early stopping at epoch 1000. Best Metrics: (0.021473462251251994, 0.008114754098360656, 0.015065541358323407)
2026-05-23 03:16:03,150 - optuna.study.study - INFO - Trial 85 finished with values: [0.021473462251251994, 0.008114754098360656, 0.015065541358323407] and parameters: {'n_layers': 4, 'embedding_dim': 96, 'lr': 0.017937765861601472, 'lambda_val': 1.241330855394676e-06, 'batch_size': 3936, 'optimizer': 'Adam'}.
2026-05-23 03:16:19,820 - optuna.study.study - INFO - Trial 86 finished with values: [0.01504166360997664, 0.010573770491803278, 0.014787349439961132] and parameters: {'n_layers': 4, 'embedding_dim': 64, 'lr': 5.795056258182954e-05, 'lambda_val': 5.425911743955223e-06, 'batch_size': 1197, 'optimizer': 'RMSprop'}.
2026-05-23 03:16:23,278 - experiment_functions - INFO - Early stopping at epoch 700. Best Metrics: (0.022075341851653614, 0.009918032786885246, 0.017388597043913562)
2026-05-23 03:16:23,794 - optuna.study.study - INFO - Trial 87 finished with values: [0.022075341851653614, 0.009918032786885246, 0.017388597043913562] and parameters: {'n_layers': 3, 'embedding_dim': 64, 'lr': 0.01556870865298979, 'lambda_val': 0.00011132011432528227, 'batch_size': 3340, 'optimizer': 'Adam'}.
2026-05-23 03:16:26,640 - experiment_functions - INFO - Early stopping at epoch 650. Best Metrics: (0.0030999688608237173, 0.0020491803278688526, 0.0026518726606414777)
2026-05-23 03:16:26,730 - optuna.study.study - INFO - Trial 88 finished with values: [0.0030999688608237173, 0.0020491803278688526, 0.0026518726606414777] and parameters: {'n_layers': 1, 'embedding_dim': 64, 'lr': 2.3197664199856527e-05, 'lambda_val': 0.002545728812763417, 'batch_size': 2435, 'optimizer': 'RMSprop'}.
2026-05-23 03:16:29,762 - experiment_functions - INFO - Early stopping at epoch 600. Best Metrics: (0.06803870597990289, 0.03762295081967213, 0.0558405376770676)
2026-05-23 03:16:30,367 - optuna.study.study - INFO - Trial 89 finished with values: [0.06803870597990289, 0.03762295081967213, 0.0558405376770676] and parameters: {'n_layers': 2, 'embedding_dim': 128, 'lr': 0.001917913774554907, 'lambda_val': 1.0249946065915615e-06, 'batch_size': 1828, 'optimizer': 'Adam'}.
2026-05-23 03:16:33,047 - experiment_functions - INFO - Early stopping at epoch 500. Best Metrics: (0.001877904434412327, 0.0017213114754098366, 0.001993483623825289)
2026-05-23 03:16:33,158 - optuna.study.study - INFO - Trial 90 finished with values: [0.001877904434412327, 0.0017213114754098366, 0.001993483623825289] and parameters: {'n_layers': 3, 'embedding_dim': 64, 'lr': 0.09007314227288755, 'lambda_val': 0.07730525157801574, 'batch_size': 832, 'optimizer': 'SGD'}.
2026-05-23 03:16:45,233 - experiment_functions - INFO - Early stopping at epoch 3200. Best Metrics: (0.04720386792698818, 0.03114754098360656, 0.04297978897947012)
2026-05-23 03:16:45,314 - optuna.study.study - INFO - Trial 91 finished with values: [0.04720386792698818, 0.03114754098360656, 0.04297978897947012] and parameters: {'n_layers': 1, 'embedding_dim': 256, 'lr': 0.05127434843395431, 'lambda_val': 0.021930849416017365, 'batch_size': 1091, 'optimizer': 'RMSprop'}.
2026-05-23 03:16:50,320 - experiment_functions - INFO - Early stopping at epoch 1050. Best Metrics: (0.012024014409563695, 0.010081967213114754, 0.01337808103388788)
2026-05-23 03:16:51,345 - optuna.study.study - INFO - Trial 92 finished with values: [0.012024014409563695, 0.010081967213114754, 0.01337808103388788] and parameters: {'n_layers': 3, 'embedding_dim': 96, 'lr': 0.05127434843395431, 'lambda_val': 0.019304912964587643, 'batch_size': 3013, 'optimizer': 'RMSprop'}.
2026-05-23 03:16:56,449 - experiment_functions - INFO - Early stopping at epoch 1650. Best Metrics: (0.016761160174635307, 0.019344262295081967, 0.02384642762101774)
2026-05-23 03:16:56,917 - optuna.study.study - INFO - Trial 93 finished with values: [0.016761160174635307, 0.019344262295081967, 0.02384642762101774] and parameters: {'n_layers': 1, 'embedding_dim': 32, 'lr': 0.006343661696405227, 'lambda_val': 0.0858467956200004, 'batch_size': 2059, 'optimizer': 'RMSprop'}.
2026-05-23 03:17:01,013 - experiment_functions - INFO - Early stopping at epoch 1000. Best Metrics: (0.008033742709095243, 0.010327868852459015, 0.012423457215482379)
2026-05-23 03:17:01,185 - optuna.study.study - INFO - Trial 94 finished with values: [0.008033742709095243, 0.010327868852459015, 0.012423457215482379] and parameters: {'n_layers': 3, 'embedding_dim': 32, 'lr': 0.006343661696405227, 'lambda_val': 0.05160895275945638, 'batch_size': 3009, 'optimizer': 'Adam'}.
2026-05-23 03:17:06,111 - experiment_functions - INFO - Early stopping at epoch 1300. Best Metrics: (0.006229868640363512, 0.006311475409836065, 0.006905739877967249)
2026-05-23 03:17:06,331 - optuna.study.study - INFO - Trial 95 finished with values: [0.006229868640363512, 0.006311475409836065, 0.006905739877967249] and parameters: {'n_layers': 3, 'embedding_dim': 32, 'lr': 0.0013687926891068503, 'lambda_val': 0.07730525157801574, 'batch_size': 832, 'optimizer': 'RMSprop'}.
2026-05-23 03:17:09,087 - experiment_functions - INFO - Early stopping at epoch 650. Best Metrics: (0.04577617174269121, 0.025, 0.038201344124941736)
2026-05-23 03:17:09,173 - optuna.study.study - INFO - Trial 96 finished with values: [0.04577617174269121, 0.025, 0.038201344124941736] and parameters: {'n_layers': 2, 'embedding_dim': 32, 'lr': 0.0019040849385408827, 'lambda_val': 0.0005365242793466337, 'batch_size': 832, 'optimizer': 'RMSprop'}.
2026-05-23 03:17:22,683 - experiment_functions - INFO - Early stopping at epoch 3850. Best Metrics: (0.0019052762366046608, 0.002131147540983607, 0.002363447071918982)
2026-05-23 03:17:23,468 - optuna.study.study - INFO - Trial 97 finished with values: [0.0019052762366046608, 0.002131147540983607, 0.002363447071918982] and parameters: {'n_layers': 3, 'embedding_dim': 64, 'lr': 1.6049130448487822e-05, 'lambda_val': 8.029603261406284e-05, 'batch_size': 3903, 'optimizer': 'RMSprop'}.
2026-05-23 03:17:30,798 - experiment_functions - INFO - Early stopping at epoch 500. Best Metrics: (0.01597455085801341, 0.01, 0.015312273639284443)
2026-05-23 03:17:31,987 - optuna.study.study - INFO - Trial 98 finished with values: [0.01597455085801341, 0.01, 0.015312273639284443] and parameters: {'n_layers': 4, 'embedding_dim': 256, 'lr': 0.007933290135699793, 'lambda_val': 0.0022196356459980807, 'batch_size': 593, 'optimizer': 'RMSprop'}.
2026-05-23 03:17:41,603 - experiment_functions - INFO - Early stopping at epoch 750. Best Metrics: (0.016457004867908787, 0.008442622950819673, 0.014483580374166196)
2026-05-23 03:17:42,556 - optuna.study.study - INFO - Trial 99 finished with values: [0.016457004867908787, 0.008442622950819673, 0.014483580374166196] and parameters: {'n_layers': 4, 'embedding_dim': 128, 'lr': 0.010567524986873161, 'lambda_val': 1.2910852092027151e-06, 'batch_size': 3527, 'optimizer': 'Adam'}.
2026-05-23 03:17:54,788 - optuna.study.study - INFO - Trial 100 finished with values: [0.0268806904036697, 0.01737704918032787, 0.02552427299194922] and parameters: {'n_layers': 2, 'embedding_dim': 32, 'lr': 9.519375347266739e-05, 'lambda_val': 0.0004597279946537714, 'batch_size': 1841, 'optimizer': 'RMSprop'}.
2026-05-23 03:17:57,877 - experiment_functions - INFO - Early stopping at epoch 700. Best Metrics: (0.05636385981567883, 0.02918032786885246, 0.04438720519740499)
2026-05-23 03:17:59,371 - optuna.study.study - INFO - Trial 101 finished with values: [0.05636385981567883, 0.02918032786885246, 0.04438720519740499] and parameters: {'n_layers': 3, 'embedding_dim': 32, 'lr': 0.0013687926891068503, 'lambda_val': 8.70357449478779e-06, 'batch_size': 1462, 'optimizer': 'Adam'}.
2026-05-23 03:18:02,556 - experiment_functions - INFO - Early stopping at epoch 600. Best Metrics: (0.025701385369810762, 0.016721311475409836, 0.022372035598438915)
2026-05-23 03:18:02,642 - optuna.study.study - INFO - Trial 102 finished with values: [0.025701385369810762, 0.016721311475409836, 0.022372035598438915] and parameters: {'n_layers': 4, 'embedding_dim': 32, 'lr': 0.003117844926683785, 'lambda_val': 6.331462681832426e-06, 'batch_size': 2682, 'optimizer': 'Adam'}.
2026-05-23 03:18:08,695 - experiment_functions - INFO - Early stopping at epoch 1900. Best Metrics: (0.05309473093019541, 0.03475409836065573, 0.0501956728734214)
2026-05-23 03:18:09,496 - optuna.study.study - INFO - Trial 103 finished with values: [0.05309473093019541, 0.03475409836065573, 0.0501956728734214] and parameters: {'n_layers': 1, 'embedding_dim': 32, 'lr': 0.000293040961262534, 'lambda_val': 0.028299411735441895, 'batch_size': 2924, 'optimizer': 'Adam'}.
2026-05-23 03:18:13,066 - experiment_functions - INFO - Early stopping at epoch 600. Best Metrics: (0.06979779961110874, 0.03631147540983607, 0.059542762283658776)
2026-05-23 03:18:13,149 - optuna.study.study - INFO - Trial 104 finished with values: [0.06979779961110874, 0.03631147540983607, 0.059542762283658776] and parameters: {'n_layers': 2, 'embedding_dim': 256, 'lr': 0.001917913774554907, 'lambda_val': 0.00016240162344732882, 'batch_size': 1828, 'optimizer': 'Adam'}.
2026-05-23 03:18:30,639 - optuna.study.study - INFO - Trial 105 finished with values: [0.041999655551320604, 0.023032786885245904, 0.037068414845099804] and parameters: {'n_layers': 4, 'embedding_dim': 64, 'lr': 0.0001622460266658152, 'lambda_val': 0.0001079507216356108, 'batch_size': 3903, 'optimizer': 'Adam'}.
2026-05-23 03:18:34,277 - experiment_functions - INFO - Early stopping at epoch 650. Best Metrics: (0.009856341837918496, 0.008278688524590166, 0.010442257641167232)
2026-05-23 03:18:34,475 - optuna.study.study - INFO - Trial 106 finished with values: [0.009856341837918496, 0.008278688524590166, 0.010442257641167232] and parameters: {'n_layers': 4, 'embedding_dim': 64, 'lr': 0.0005051991365347398, 'lambda_val': 0.08435118404967043, 'batch_size': 2913, 'optimizer': 'RMSprop'}.
2026-05-23 03:18:40,235 - experiment_functions - INFO - Early stopping at epoch 1050. Best Metrics: (0.03156934438594637, 0.01975409836065574, 0.026334086024329476)
2026-05-23 03:18:41,102 - optuna.study.study - INFO - Trial 107 finished with values: [0.03156934438594637, 0.01975409836065574, 0.026334086024329476] and parameters: {'n_layers': 4, 'embedding_dim': 96, 'lr': 0.0003085416137069091, 'lambda_val': 0.003966779220729784, 'batch_size': 3009, 'optimizer': 'RMSprop'}.
2026-05-23 03:18:45,473 - experiment_functions - INFO - Early stopping at epoch 1150. Best Metrics: (0.0883557890490621, 0.046967213114754096, 0.07355413739649541)
2026-05-23 03:18:46,238 - optuna.study.study - INFO - Trial 108 finished with values: [0.0883557890490621, 0.046967213114754096, 0.07355413739649541] and parameters: {'n_layers': 1, 'embedding_dim': 32, 'lr': 0.0007646684933610155, 'lambda_val': 0.0021605260106213964, 'batch_size': 3903, 'optimizer': 'Adam'}.
2026-05-23 03:18:50,451 - experiment_functions - INFO - Early stopping at epoch 1450. Best Metrics: (0.04073582375583087, 0.026475409836065573, 0.03876073568542172)
2026-05-23 03:18:51,096 - optuna.study.study - INFO - Trial 109 finished with values: [0.04073582375583087, 0.026475409836065573, 0.03876073568542172] and parameters: {'n_layers': 1, 'embedding_dim': 32, 'lr': 0.0031305185360713038, 'lambda_val': 0.021930849416017365, 'batch_size': 1091, 'optimizer': 'RMSprop'}.
2026-05-23 03:18:54,496 - experiment_functions - INFO - Early stopping at epoch 600. Best Metrics: (0.018529977218809245, 0.016147540983606552, 0.0200532600640759)
2026-05-23 03:18:55,585 - optuna.study.study - INFO - Trial 110 finished with values: [0.018529977218809245, 0.016147540983606552, 0.0200532600640759] and parameters: {'n_layers': 3, 'embedding_dim': 64, 'lr': 0.0013687926891068503, 'lambda_val': 0.019304912964587643, 'batch_size': 2395, 'optimizer': 'Adam'}.
2026-05-23 03:19:00,610 - experiment_functions - INFO - Early stopping at epoch 1150. Best Metrics: (0.12131228705315801, 0.05565573770491804, 0.09436324524021455)
2026-05-23 03:19:00,940 - optuna.study.study - INFO - Trial 111 finished with values: [0.12131228705315801, 0.05565573770491804, 0.09436324524021455] and parameters: {'n_layers': 1, 'embedding_dim': 256, 'lr': 0.0005051991365347398, 'lambda_val': 0.00011132011432528227, 'batch_size': 1921, 'optimizer': 'RMSprop'}.
2026-05-23 03:19:10,238 - experiment_functions - INFO - Early stopping at epoch 2900. Best Metrics: (0.045082641943180915, 0.018360655737704918, 0.03504254756447536)
2026-05-23 03:19:10,326 - optuna.study.study - INFO - Trial 112 finished with values: [0.045082641943180915, 0.018360655737704918, 0.03504254756447536] and parameters: {'n_layers': 1, 'embedding_dim': 64, 'lr': 0.09651208636117108, 'lambda_val': 0.0006383294603067735, 'batch_size': 2528, 'optimizer': 'Adam'}.
2026-05-23 03:19:16,006 - experiment_functions - INFO - Early stopping at epoch 1700. Best Metrics: (0.0836959695854273, 0.04770491803278689, 0.07511028176163895)
2026-05-23 03:19:16,329 - optuna.study.study - INFO - Trial 113 finished with values: [0.0836959695854273, 0.04770491803278689, 0.07511028176163895] and parameters: {'n_layers': 1, 'embedding_dim': 64, 'lr': 0.0005051991365347398, 'lambda_val': 0.00018385882411773826, 'batch_size': 3013, 'optimizer': 'Adam'}.
2026-05-23 03:19:19,349 - experiment_functions - INFO - Early stopping at epoch 500. Best Metrics: (0.022825940353058426, 0.013524590163934426, 0.02092688247234241)
2026-05-23 03:19:19,451 - optuna.study.study - INFO - Trial 114 finished with values: [0.022825940353058426, 0.013524590163934426, 0.02092688247234241] and parameters: {'n_layers': 4, 'embedding_dim': 96, 'lr': 0.05127434843395431, 'lambda_val': 8.029603261406284e-05, 'batch_size': 3013, 'optimizer': 'RMSprop'}.
2026-05-23 03:19:25,802 - experiment_functions - INFO - Early stopping at epoch 1750. Best Metrics: (0.09650868640566071, 0.052868852459016395, 0.08290733667318752)
2026-05-23 03:19:25,874 - optuna.study.study - INFO - Trial 115 finished with values: [0.09650868640566071, 0.052868852459016395, 0.08290733667318752] and parameters: {'n_layers': 1, 'embedding_dim': 128, 'lr': 0.000293040961262534, 'lambda_val': 0.003966779220729784, 'batch_size': 3009, 'optimizer': 'RMSprop'}.
2026-05-23 03:19:28,341 - experiment_functions - INFO - Early stopping at epoch 550. Best Metrics: (0.06898116167952616, 0.038524590163934426, 0.059138128126696395)
2026-05-23 03:19:28,472 - optuna.study.study - INFO - Trial 116 finished with values: [0.06898116167952616, 0.038524590163934426, 0.059138128126696395] and parameters: {'n_layers': 1, 'embedding_dim': 32, 'lr': 0.0031305185360713038, 'lambda_val': 0.003966779220729784, 'batch_size': 3009, 'optimizer': 'RMSprop'}.
2026-05-23 03:19:33,154 - experiment_functions - INFO - Early stopping at epoch 550. Best Metrics: (0.058371540042971085, 0.03237704918032787, 0.052782682798147504)
2026-05-23 03:19:33,675 - optuna.study.study - INFO - Trial 117 finished with values: [0.058371540042971085, 0.03237704918032787, 0.052782682798147504] and parameters: {'n_layers': 1, 'embedding_dim': 96, 'lr': 0.006527724949170866, 'lambda_val': 0.003792790860273115, 'batch_size': 554, 'optimizer': 'Adam'}.
2026-05-23 03:19:41,827 - experiment_functions - INFO - Early stopping at epoch 700. Best Metrics: (0.022523115786865583, 0.013360655737704919, 0.01974778587169882)
2026-05-23 03:19:42,387 - optuna.study.study - INFO - Trial 118 finished with values: [0.022523115786865583, 0.013360655737704919, 0.01974778587169882] and parameters: {'n_layers': 1, 'embedding_dim': 32, 'lr': 0.06524143930040716, 'lambda_val': 1.4791571272387938e-06, 'batch_size': 955, 'optimizer': 'Adam'}.
2026-05-23 03:19:47,567 - experiment_functions - INFO - Early stopping at epoch 500. Best Metrics: (0.0020354151583369187, 0.0013934426229508198, 0.0016468969885738123)
2026-05-23 03:19:47,661 - optuna.study.study - INFO - Trial 119 finished with values: [0.0020354151583369187, 0.0013934426229508198, 0.0016468969885738123] and parameters: {'n_layers': 1, 'embedding_dim': 128, 'lr': 0.000293040961262534, 'lambda_val': 0.028299411735441895, 'batch_size': 2913, 'optimizer': 'SGD'}.
2026-05-23 03:19:50,084 - experiment_functions - INFO - Early stopping at epoch 550. Best Metrics: (0.07138579691999619, 0.035737704918032784, 0.05841758446608511)
2026-05-23 03:19:50,187 - optuna.study.study - INFO - Trial 120 finished with values: [0.07138579691999619, 0.035737704918032784, 0.05841758446608511] and parameters: {'n_layers': 1, 'embedding_dim': 32, 'lr': 0.017768633999709002, 'lambda_val': 0.001440371353379977, 'batch_size': 3009, 'optimizer': 'Adam'}.
2026-05-23 03:19:52,611 - experiment_functions - INFO - Early stopping at epoch 550. Best Metrics: (0.04997379392884922, 0.02688524590163934, 0.039865923669847855)
2026-05-23 03:19:52,751 - optuna.study.study - INFO - Trial 121 finished with values: [0.04997379392884922, 0.02688524590163934, 0.039865923669847855] and parameters: {'n_layers': 1, 'embedding_dim': 96, 'lr': 0.013065444776149824, 'lambda_val': 0.005672765240199157, 'batch_size': 593, 'optimizer': 'Adam'}.
2026-05-23 03:19:55,578 - experiment_functions - INFO - Early stopping at epoch 600. Best Metrics: (0.020662110264315272, 0.016639344262295082, 0.02495344882854993)
2026-05-23 03:19:55,659 - optuna.study.study - INFO - Trial 122 finished with values: [0.020662110264315272, 0.016639344262295082, 0.02495344882854993] and parameters: {'n_layers': 3, 'embedding_dim': 32, 'lr': 0.0019040849385408827, 'lambda_val': 0.03657315686063518, 'batch_size': 3009, 'optimizer': 'Adam'}.
2026-05-23 03:19:58,235 - experiment_functions - INFO - Early stopping at epoch 500. Best Metrics: (0.0012961107269000417, 0.0015573770491803278, 0.0018627639423343923)
2026-05-23 03:19:58,324 - optuna.study.study - INFO - Trial 123 finished with values: [0.0012961107269000417, 0.0015573770491803278, 0.0018627639423343923] and parameters: {'n_layers': 2, 'embedding_dim': 128, 'lr': 2.7947288353984725e-05, 'lambda_val': 1.0249946065915615e-06, 'batch_size': 1828, 'optimizer': 'SGD'}.
2026-05-23 03:20:05,978 - experiment_functions - INFO - Early stopping at epoch 1550. Best Metrics: (0.03920889939592861, 0.023442622950819673, 0.033347038634506755)
2026-05-23 03:20:06,075 - optuna.study.study - INFO - Trial 124 finished with values: [0.03920889939592861, 0.023442622950819673, 0.033347038634506755] and parameters: {'n_layers': 4, 'embedding_dim': 64, 'lr': 0.000293040961262534, 'lambda_val': 0.0002663905641068114, 'batch_size': 3527, 'optimizer': 'RMSprop'}.
2026-05-23 03:20:11,907 - experiment_functions - INFO - Early stopping at epoch 1600. Best Metrics: (0.07603355076832627, 0.040983606557377046, 0.0611500029656045)
2026-05-23 03:20:12,553 - optuna.study.study - INFO - Trial 125 finished with values: [0.07603355076832627, 0.040983606557377046, 0.0611500029656045] and parameters: {'n_layers': 2, 'embedding_dim': 32, 'lr': 0.0004969264317801683, 'lambda_val': 1.3835148346636437e-06, 'batch_size': 1809, 'optimizer': 'RMSprop'}.
2026-05-23 03:20:17,798 - experiment_functions - INFO - Early stopping at epoch 1450. Best Metrics: (0.10114025174589333, 0.05188524590163935, 0.08623143618690608)
2026-05-23 03:20:18,092 - optuna.study.study - INFO - Trial 126 finished with values: [0.10114025174589333, 0.05188524590163935, 0.08623143618690608] and parameters: {'n_layers': 1, 'embedding_dim': 64, 'lr': 0.0005051991365347398, 'lambda_val': 0.00012928174782861758, 'batch_size': 2913, 'optimizer': 'RMSprop'}.
2026-05-23 03:20:32,684 - optuna.study.study - INFO - Trial 127 finished with values: [0.025793897586460383, 0.020081967213114754, 0.02547432405645916] and parameters: {'n_layers': 2, 'embedding_dim': 64, 'lr': 9.734028869358855e-05, 'lambda_val': 3.6084877322949617e-06, 'batch_size': 3903, 'optimizer': 'Adam'}.
2026-05-23 03:20:38,729 - experiment_functions - INFO - Early stopping at epoch 1100. Best Metrics: (0.03978906621352424, 0.022213114754098363, 0.03330961874559363)
