2026-05-23 05:16:21,069 - optuna.study.study - INFO - Trial 232 finished with values: [0.07020418705523941, 0.03647540983606557, 0.05839769015892602] and parameters: {'n_layers': 1, 'embedding_dim': 128, 'lr': 0.000145468795718925, 'lambda_val': 1.0714207904263719e-06, 'batch_size': 2871, 'optimizer': 'RMSprop'}.
2026-05-23 05:16:24,894 - experiment_functions - INFO - Early stopping at epoch 700. Best Metrics: (0.017792950949462913, 0.013688524590163937, 0.018022706507352697)
2026-05-23 05:16:25,017 - optuna.study.study - INFO - Trial 233 finished with values: [0.017792950949462913, 0.013688524590163937, 0.018022706507352697] and parameters: {'n_layers': 2, 'embedding_dim': 256, 'lr': 0.0005663247330896729, 'lambda_val': 0.055016791019889065, 'batch_size': 2871, 'optimizer': 'Adam'}.
2026-05-23 05:16:27,237 - experiment_functions - INFO - Early stopping at epoch 500. Best Metrics: (0.0020611668995746575, 0.002459016393442623, 0.0025959301818396824)
2026-05-23 05:16:27,336 - optuna.study.study - INFO - Trial 234 finished with values: [0.0020611668995746575, 0.002459016393442623, 0.0025959301818396824] and parameters: {'n_layers': 1, 'embedding_dim': 128, 'lr': 0.000145468795718925, 'lambda_val': 0.00619655064381492, 'batch_size': 514, 'optimizer': 'Adam'}.
2026-05-23 05:16:38,529 - optuna.study.study - INFO - Trial 235 finished with values: [0.06366211387419085, 0.03549180327868852, 0.055315618632422375] and parameters: {'n_layers': 1, 'embedding_dim': 64, 'lr': 0.00017559923823258955, 'lambda_val': 0.0003464722773423699, 'batch_size': 3424, 'optimizer': 'Adam'}.
2026-05-23 05:16:41,038 - experiment_functions - INFO - Early stopping at epoch 500. Best Metrics: (0.0009941744625256632, 0.001475409836065574, 0.0018745989802768353)
2026-05-23 05:16:41,161 - optuna.study.study - INFO - Trial 236 finished with values: [0.0009941744625256632, 0.001475409836065574, 0.0018745989802768353] and parameters: {'n_layers': 1, 'embedding_dim': 256, 'lr': 0.001814498584431129, 'lambda_val': 1.2812058992559844e-06, 'batch_size': 1834, 'optimizer': 'SGD'}.
2026-05-23 05:16:43,577 - experiment_functions - INFO - Early stopping at epoch 650. Best Metrics: (0.09455761773408926, 0.0489344262295082, 0.08226198157628567)
2026-05-23 05:16:43,662 - optuna.study.study - INFO - Trial 237 finished with values: [0.09455761773408926, 0.0489344262295082, 0.08226198157628567] and parameters: {'n_layers': 1, 'embedding_dim': 64, 'lr': 0.0027034335159540246, 'lambda_val': 4.006717999944042e-05, 'batch_size': 1655, 'optimizer': 'Adam'}.
2026-05-23 05:16:52,707 - experiment_functions - INFO - Early stopping at epoch 3650. Best Metrics: (0.003483004236338648, 0.002377049180327869, 0.0035306572327182526)
2026-05-23 05:16:52,894 - optuna.study.study - INFO - Trial 238 finished with values: [0.003483004236338648, 0.002377049180327869, 0.0035306572327182526] and parameters: {'n_layers': 1, 'embedding_dim': 64, 'lr': 5.119233714797839e-05, 'lambda_val': 4.006717999944042e-05, 'batch_size': 948, 'optimizer': 'Adam'}.
2026-05-23 05:16:55,627 - experiment_functions - INFO - Early stopping at epoch 550. Best Metrics: (0.07183436594677262, 0.0410655737704918, 0.061906695409327354)
2026-05-23 05:16:55,792 - optuna.study.study - INFO - Trial 239 finished with values: [0.07183436594677262, 0.0410655737704918, 0.061906695409327354] and parameters: {'n_layers': 1, 'embedding_dim': 64, 'lr': 0.0032256937887088586, 'lambda_val': 1.2213470032695958e-05, 'batch_size': 3864, 'optimizer': 'RMSprop'}.
2026-05-23 05:16:58,357 - experiment_functions - INFO - Early stopping at epoch 600. Best Metrics: (0.06176369218875738, 0.03680327868852459, 0.05743304536877033)
2026-05-23 05:16:58,491 - optuna.study.study - INFO - Trial 240 finished with values: [0.06176369218875738, 0.03680327868852459, 0.05743304536877033] and parameters: {'n_layers': 1, 'embedding_dim': 32, 'lr': 0.0032256937887088586, 'lambda_val': 0.021857441898757924, 'batch_size': 2244, 'optimizer': 'Adam'}.
2026-05-23 05:17:01,369 - experiment_functions - INFO - Early stopping at epoch 600. Best Metrics: (0.07871035839668312, 0.04024590163934426, 0.06557573297305956)
2026-05-23 05:17:01,456 - optuna.study.study - INFO - Trial 241 finished with values: [0.07871035839668312, 0.04024590163934426, 0.06557573297305956] and parameters: {'n_layers': 1, 'embedding_dim': 128, 'lr': 0.0027034335159540246, 'lambda_val': 0.0010473675830108427, 'batch_size': 2385, 'optimizer': 'RMSprop'}.
2026-05-23 05:17:04,880 - experiment_functions - INFO - Early stopping at epoch 550. Best Metrics: (0.041141003684796895, 0.024262295081967214, 0.03408653427679916)
2026-05-23 05:17:04,968 - optuna.study.study - INFO - Trial 242 finished with values: [0.041141003684796895, 0.024262295081967214, 0.03408653427679916] and parameters: {'n_layers': 3, 'embedding_dim': 128, 'lr': 0.0027034335159540246, 'lambda_val': 0.0010473675830108427, 'batch_size': 2385, 'optimizer': 'Adam'}.
2026-05-23 05:17:08,084 - experiment_functions - INFO - Early stopping at epoch 600. Best Metrics: (0.11528390114720467, 0.055901639344262295, 0.0931482822262242)
2026-05-23 05:17:08,695 - optuna.study.study - INFO - Trial 243 finished with values: [0.11528390114720467, 0.055901639344262295, 0.0931482822262242] and parameters: {'n_layers': 1, 'embedding_dim': 256, 'lr': 0.0027034335159540246, 'lambda_val': 1.5569069768383745e-06, 'batch_size': 2385, 'optimizer': 'Adam'}.
2026-05-23 05:17:17,612 - experiment_functions - INFO - Early stopping at epoch 600. Best Metrics: (0.09565724620947745, 0.04827868852459017, 0.08152615027639737)
2026-05-23 05:17:18,178 - optuna.study.study - INFO - Trial 244 finished with values: [0.09565724620947745, 0.04827868852459017, 0.08152615027639737] and parameters: {'n_layers': 1, 'embedding_dim': 96, 'lr': 0.0032256937887088586, 'lambda_val': 0.00017447576354645447, 'batch_size': 3699, 'optimizer': 'Adam'}.
2026-05-23 05:17:26,018 - experiment_functions - INFO - Early stopping at epoch 950. Best Metrics: (0.011048478704675601, 0.009508196721311476, 0.0121663430837227)
2026-05-23 05:17:26,509 - optuna.study.study - INFO - Trial 245 finished with values: [0.011048478704675601, 0.009508196721311476, 0.0121663430837227] and parameters: {'n_layers': 4, 'embedding_dim': 128, 'lr': 0.0027034335159540246, 'lambda_val': 0.021857441898757924, 'batch_size': 3864, 'optimizer': 'Adam'}.
2026-05-23 05:17:29,621 - experiment_functions - INFO - Early stopping at epoch 600. Best Metrics: (0.10319179596402747, 0.04860655737704918, 0.0791780265690334)
2026-05-23 05:17:29,711 - optuna.study.study - INFO - Trial 246 finished with values: [0.10319179596402747, 0.04860655737704918, 0.0791780265690334] and parameters: {'n_layers': 1, 'embedding_dim': 256, 'lr': 0.0027034335159540246, 'lambda_val': 0.0022074927841841977, 'batch_size': 3648, 'optimizer': 'Adam'}.
2026-05-23 05:17:32,602 - experiment_functions - INFO - Early stopping at epoch 600. Best Metrics: (0.06554963571350773, 0.034344262295081966, 0.05592444587474415)
2026-05-23 05:17:32,702 - optuna.study.study - INFO - Trial 247 finished with values: [0.06554963571350773, 0.034344262295081966, 0.05592444587474415] and parameters: {'n_layers': 2, 'embedding_dim': 32, 'lr': 0.0032256937887088586, 'lambda_val': 4.006717999944042e-05, 'batch_size': 3699, 'optimizer': 'Adam'}.
2026-05-23 05:17:48,988 - optuna.study.study - INFO - Trial 248 finished with values: [0.06345716982229387, 0.036639344262295086, 0.055530569853489954] and parameters: {'n_layers': 1, 'embedding_dim': 256, 'lr': 0.0001133136055371541, 'lambda_val': 1.2213470032695958e-05, 'batch_size': 3648, 'optimizer': 'RMSprop'}.
2026-05-23 05:17:59,700 - experiment_functions - INFO - Early stopping at epoch 3250. Best Metrics: (0.09705200785303561, 0.05122950819672131, 0.08348548653897916)
2026-05-23 05:18:00,856 - optuna.study.study - INFO - Trial 249 finished with values: [0.09705200785303561, 0.05122950819672131, 0.08348548653897916] and parameters: {'n_layers': 1, 'embedding_dim': 32, 'lr': 0.000498408569398285, 'lambda_val': 4.006717999944042e-05, 'batch_size': 2784, 'optimizer': 'Adam'}.
2026-05-23 05:18:03,773 - experiment_functions - INFO - Early stopping at epoch 600. Best Metrics: (0.1037005332976439, 0.048196721311475406, 0.08008612736725804)
2026-05-23 05:18:03,856 - optuna.study.study - INFO - Trial 250 finished with values: [0.1037005332976439, 0.048196721311475406, 0.08008612736725804] and parameters: {'n_layers': 1, 'embedding_dim': 96, 'lr': 0.0027034335159540246, 'lambda_val': 0.00017447576354645447, 'batch_size': 3699, 'optimizer': 'Adam'}.
2026-05-23 05:18:17,097 - optuna.study.study - INFO - Trial 251 finished with values: [0.09968273571065962, 0.051639344262295085, 0.08526951483163932] and parameters: {'n_layers': 1, 'embedding_dim': 32, 'lr': 0.000498408569398285, 'lambda_val': 6.509910298202351e-05, 'batch_size': 514, 'optimizer': 'RMSprop'}.
2026-05-23 05:18:25,684 - experiment_functions - INFO - Early stopping at epoch 650. Best Metrics: (0.10153600451901562, 0.04934426229508197, 0.08417871158272175)
2026-05-23 05:18:26,054 - optuna.study.study - INFO - Trial 252 finished with values: [0.10153600451901562, 0.04934426229508197, 0.08417871158272175] and parameters: {'n_layers': 1, 'embedding_dim': 256, 'lr': 0.0027034335159540246, 'lambda_val': 2.7554943772348907e-05, 'batch_size': 1389, 'optimizer': 'Adam'}.
2026-05-23 05:18:32,039 - experiment_functions - INFO - Early stopping at epoch 650. Best Metrics: (0.07971120438749708, 0.04499999999999999, 0.06865557517790769)
2026-05-23 05:18:32,775 - optuna.study.study - INFO - Trial 253 finished with values: [0.07971120438749708, 0.04499999999999999, 0.06865557517790769] and parameters: {'n_layers': 1, 'embedding_dim': 32, 'lr': 0.0032256937887088586, 'lambda_val': 2.6112469187203954e-06, 'batch_size': 1291, 'optimizer': 'Adam'}.
2026-05-23 05:18:35,659 - experiment_functions - INFO - Early stopping at epoch 600. Best Metrics: (0.08817912741930271, 0.04590163934426229, 0.07534601908446818)
2026-05-23 05:18:35,748 - optuna.study.study - INFO - Trial 254 finished with values: [0.08817912741930271, 0.04590163934426229, 0.07534601908446818] and parameters: {'n_layers': 1, 'embedding_dim': 32, 'lr': 0.0032256937887088586, 'lambda_val': 3.5614573447749906e-05, 'batch_size': 3699, 'optimizer': 'Adam'}.
2026-05-23 05:18:40,052 - experiment_functions - INFO - Early stopping at epoch 700. Best Metrics: (0.03327544130218481, 0.020163934426229508, 0.02957746331111913)
2026-05-23 05:18:40,122 - optuna.study.study - INFO - Trial 255 finished with values: [0.03327544130218481, 0.020163934426229508, 0.02957746331111913] and parameters: {'n_layers': 4, 'embedding_dim': 128, 'lr': 0.000498408569398285, 'lambda_val': 3.5614573447749906e-05, 'batch_size': 3864, 'optimizer': 'RMSprop'}.
2026-05-23 05:18:47,058 - experiment_functions - INFO - Early stopping at epoch 1850. Best Metrics: (0.11943604506188149, 0.0569672131147541, 0.09313593069319523)
2026-05-23 05:18:48,073 - optuna.study.study - INFO - Trial 256 finished with values: [0.11943604506188149, 0.0569672131147541, 0.09313593069319523] and parameters: {'n_layers': 1, 'embedding_dim': 128, 'lr': 0.000498408569398285, 'lambda_val': 0.0010473675830108427, 'batch_size': 2385, 'optimizer': 'Adam'}.
2026-05-23 05:18:55,090 - experiment_functions - INFO - Early stopping at epoch 700. Best Metrics: (0.11334681355560884, 0.048196721311475406, 0.08739507427470958)
2026-05-23 05:18:55,773 - optuna.study.study - INFO - Trial 257 finished with values: [0.11334681355560884, 0.048196721311475406, 0.08739507427470958] and parameters: {'n_layers': 1, 'embedding_dim': 256, 'lr': 0.0027034335159540246, 'lambda_val': 4.006717999944042e-05, 'batch_size': 1699, 'optimizer': 'Adam'}.
2026-05-23 05:19:16,698 - optuna.study.study - INFO - Trial 258 finished with values: [0.007404275382023217, 0.005245901639344262, 0.007469280488567436] and parameters: {'n_layers': 3, 'embedding_dim': 64, 'lr': 3.553387332884134e-05, 'lambda_val': 0.001047860017743232, 'batch_size': 2871, 'optimizer': 'RMSprop'}.
2026-05-23 05:19:19,912 - experiment_functions - INFO - Early stopping at epoch 500. Best Metrics: (0.001054408847780661, 0.0017213114754098362, 0.0020485500176329633)
2026-05-23 05:19:21,094 - optuna.study.study - INFO - Trial 259 finished with values: [0.001054408847780661, 0.0017213114754098362, 0.0020485500176329633] and parameters: {'n_layers': 4, 'embedding_dim': 96, 'lr': 0.0005663247330896729, 'lambda_val': 4.006717999944042e-05, 'batch_size': 2871, 'optimizer': 'SGD'}.
2026-05-23 05:19:23,912 - experiment_functions - INFO - Early stopping at epoch 550. Best Metrics: (0.028623089258646487, 0.01680327868852459, 0.025345696576194853)
2026-05-23 05:19:24,080 - optuna.study.study - INFO - Trial 260 finished with values: [0.028623089258646487, 0.01680327868852459, 0.025345696576194853] and parameters: {'n_layers': 1, 'embedding_dim': 256, 'lr': 0.039615701960620336, 'lambda_val': 1.5569069768383745e-06, 'batch_size': 2385, 'optimizer': 'Adam'}.
2026-05-23 05:19:26,769 - experiment_functions - INFO - Early stopping at epoch 550. Best Metrics: (0.09759549892047019, 0.04704918032786886, 0.07930935373645102)
2026-05-23 05:19:26,857 - optuna.study.study - INFO - Trial 261 finished with values: [0.09759549892047019, 0.04704918032786886, 0.07930935373645102] and parameters: {'n_layers': 1, 'embedding_dim': 128, 'lr': 0.007500361823223764, 'lambda_val': 4.915768160138094e-05, 'batch_size': 1834, 'optimizer': 'Adam'}.
2026-05-23 05:19:29,611 - experiment_functions - INFO - Early stopping at epoch 600. Best Metrics: (0.10368851515168183, 0.05131147540983607, 0.08576316073607107)
2026-05-23 05:19:29,778 - optuna.study.study - INFO - Trial 262 finished with values: [0.10368851515168183, 0.05131147540983607, 0.08576316073607107] and parameters: {'n_layers': 1, 'embedding_dim': 128, 'lr': 0.0027034335159540246, 'lambda_val': 0.00619655064381492, 'batch_size': 3864, 'optimizer': 'Adam'}.
2026-05-23 05:19:32,826 - experiment_functions - INFO - Early stopping at epoch 750. Best Metrics: (0.11046285584055926, 0.04950819672131148, 0.08965642594817665)
2026-05-23 05:19:32,942 - optuna.study.study - INFO - Trial 263 finished with values: [0.11046285584055926, 0.04950819672131148, 0.08965642594817665] and parameters: {'n_layers': 1, 'embedding_dim': 64, 'lr': 0.0027034335159540246, 'lambda_val': 0.0003464722773423699, 'batch_size': 837, 'optimizer': 'Adam'}.
2026-05-23 05:19:35,943 - experiment_functions - INFO - Early stopping at epoch 550. Best Metrics: (0.046548161087820054, 0.023770491803278688, 0.03649325796528057)
2026-05-23 05:19:36,029 - optuna.study.study - INFO - Trial 264 finished with values: [0.046548161087820054, 0.023770491803278688, 0.03649325796528057] and parameters: {'n_layers': 2, 'embedding_dim': 128, 'lr': 0.00339188356309059, 'lambda_val': 4.915768160138094e-05, 'batch_size': 3864, 'optimizer': 'RMSprop'}.
2026-05-23 05:19:48,726 - optuna.study.study - INFO - Trial 265 finished with values: [0.04335693581459676, 0.025737704918032785, 0.039683417905294595] and parameters: {'n_layers': 1, 'embedding_dim': 32, 'lr': 0.000145468795718925, 'lambda_val': 1.1170687175787287e-06, 'batch_size': 2784, 'optimizer': 'RMSprop'}.
2026-05-23 05:19:51,582 - experiment_functions - INFO - Early stopping at epoch 600. Best Metrics: (0.10106857970382196, 0.051557377049180335, 0.0850403054057187)
2026-05-23 05:19:51,686 - optuna.study.study - INFO - Trial 266 finished with values: [0.10106857970382196, 0.051557377049180335, 0.0850403054057187] and parameters: {'n_layers': 1, 'embedding_dim': 128, 'lr': 0.0027034335159540246, 'lambda_val': 2.7554943772348907e-05, 'batch_size': 3864, 'optimizer': 'Adam'}.
2026-05-23 05:19:58,131 - experiment_functions - INFO - Early stopping at epoch 550. Best Metrics: (0.03420036547198584, 0.01639344262295082, 0.027951623033506602)
2026-05-23 05:19:58,480 - optuna.study.study - INFO - Trial 267 finished with values: [0.03420036547198584, 0.01639344262295082, 0.027951623033506602] and parameters: {'n_layers': 3, 'embedding_dim': 256, 'lr': 0.0032256937887088586, 'lambda_val': 1.2213470032695958e-05, 'batch_size': 3709, 'optimizer': 'RMSprop'}.
2026-05-23 05:20:01,544 - experiment_functions - INFO - Early stopping at epoch 700. Best Metrics: (0.09941825986611837, 0.04721311475409836, 0.07985385009950391)
2026-05-23 05:20:01,638 - optuna.study.study - INFO - Trial 268 finished with values: [0.09941825986611837, 0.04721311475409836, 0.07985385009950391] and parameters: {'n_layers': 1, 'embedding_dim': 64, 'lr': 0.0027034335159540246, 'lambda_val': 4.006717999944042e-05, 'batch_size': 3699, 'optimizer': 'Adam'}.
2026-05-23 05:20:04,461 - experiment_functions - INFO - Early stopping at epoch 550. Best Metrics: (0.043127582248812364, 0.022950819672131147, 0.03748065609489639)
2026-05-23 05:20:04,603 - optuna.study.study - INFO - Trial 269 finished with values: [0.043127582248812364, 0.022950819672131147, 0.03748065609489639] and parameters: {'n_layers': 1, 'embedding_dim': 256, 'lr': 0.022144748640984254, 'lambda_val': 1.5569069768383745e-06, 'batch_size': 2385, 'optimizer': 'Adam'}.
2026-05-23 05:20:06,829 - experiment_functions - INFO - Early stopping at epoch 500. Best Metrics: (0.0014206629129257429, 0.0010655737704918034, 0.0012926629409425402)
2026-05-23 05:20:06,959 - optuna.study.study - INFO - Trial 270 finished with values: [0.0014206629129257429, 0.0010655737704918034, 0.0012926629409425402] and parameters: {'n_layers': 1, 'embedding_dim': 32, 'lr': 0.000498408569398285, 'lambda_val': 0.0022074927841841977, 'batch_size': 3648, 'optimizer': 'SGD'}.
2026-05-23 05:20:09,503 - experiment_functions - INFO - Early stopping at epoch 600. Best Metrics: (0.0942926086468554, 0.046311475409836066, 0.07830153971331566)
2026-05-23 05:20:09,593 - optuna.study.study - INFO - Trial 271 finished with values: [0.0942926086468554, 0.046311475409836066, 0.07830153971331566] and parameters: {'n_layers': 1, 'embedding_dim': 128, 'lr': 0.0027034335159540246, 'lambda_val': 0.0001289768275020442, 'batch_size': 3945, 'optimizer': 'Adam'}.
2026-05-23 05:20:17,442 - experiment_functions - INFO - Early stopping at epoch 2900. Best Metrics: (0.09817260156733185, 0.05032786885245902, 0.085155569493427)
2026-05-23 05:20:17,515 - optuna.study.study - INFO - Trial 272 finished with values: [0.09817260156733185, 0.05032786885245902, 0.085155569493427] and parameters: {'n_layers': 1, 'embedding_dim': 32, 'lr': 0.000498408569398285, 'lambda_val': 4.915768160138094e-05, 'batch_size': 3864, 'optimizer': 'Adam'}.
2026-05-23 05:20:19,811 - experiment_functions - INFO - Early stopping at epoch 550. Best Metrics: (0.021497494044390015, 0.012622950819672131, 0.019304705895123214)
2026-05-23 05:20:19,949 - optuna.study.study - INFO - Trial 273 finished with values: [0.021497494044390015, 0.012622950819672131, 0.019304705895123214] and parameters: {'n_layers': 1, 'embedding_dim': 128, 'lr': 0.07744739812498702, 'lambda_val': 3.5614573447749906e-05, 'batch_size': 2819, 'optimizer': 'Adam'}.
2026-05-23 05:20:22,877 - experiment_functions - INFO - Early stopping at epoch 650. Best Metrics: (0.09903001542101739, 0.0489344262295082, 0.07863330842087854)
2026-05-23 05:20:22,963 - optuna.study.study - INFO - Trial 274 finished with values: [0.09903001542101739, 0.0489344262295082, 0.07863330842087854] and parameters: {'n_layers': 1, 'embedding_dim': 128, 'lr': 0.001814498584431129, 'lambda_val': 0.00011374857041945478, 'batch_size': 1834, 'optimizer': 'RMSprop'}.
2026-05-23 05:20:37,967 - optuna.study.study - INFO - Trial 275 finished with values: [0.07234522909767047, 0.03959016393442623, 0.06266189919804599] and parameters: {'n_layers': 1, 'embedding_dim': 256, 'lr': 0.000145468795718925, 'lambda_val': 0.017043310610477345, 'batch_size': 1291, 'optimizer': 'RMSprop'}.
2026-05-23 05:20:39,934 - experiment_functions - INFO - Early stopping at epoch 500. Best Metrics: (0.0026117759091225413, 0.0018852459016393446, 0.0026766543654100157)
2026-05-23 05:20:40,036 - optuna.study.study - INFO - Trial 276 finished with values: [0.0026117759091225413, 0.0018852459016393446, 0.0026766543654100157] and parameters: {'n_layers': 1, 'embedding_dim': 32, 'lr': 0.000498408569398285, 'lambda_val': 4.006717999944042e-05, 'batch_size': 3648, 'optimizer': 'SGD'}.
2026-05-23 05:20:52,149 - optuna.study.study - INFO - Trial 277 finished with values: [0.08195407994543055, 0.042131147540983606, 0.06870348001771735] and parameters: {'n_layers': 1, 'embedding_dim': 128, 'lr': 0.00019262259007340505, 'lambda_val': 2.7554943772348907e-05, 'batch_size': 1182, 'optimizer': 'Adam'}.
2026-05-23 05:21:07,853 - optuna.study.study - INFO - Trial 278 finished with values: [0.049622596578898844, 0.02918032786885246, 0.04512191536466838] and parameters: {'n_layers': 3, 'embedding_dim': 64, 'lr': 0.0002020925528856493, 'lambda_val': 0.0003464722773423699, 'batch_size': 3648, 'optimizer': 'Adam'}.
2026-05-23 05:21:12,375 - experiment_functions - INFO - Early stopping at epoch 1250. Best Metrics: (0.10544018247599064, 0.052950819672131146, 0.08652706011973509)
2026-05-23 05:21:13,130 - optuna.study.study - INFO - Trial 279 finished with values: [0.10544018247599064, 0.052950819672131146, 0.08652706011973509] and parameters: {'n_layers': 1, 'embedding_dim': 128, 'lr': 0.0005663247330896729, 'lambda_val': 4.006717999944042e-05, 'batch_size': 2871, 'optimizer': 'Adam'}.
2026-05-23 05:21:15,853 - experiment_functions - INFO - Early stopping at epoch 750. Best Metrics: (0.08563699279046325, 0.04114754098360656, 0.06892389666164242)
