2026-05-23 03:36:45,525 - optuna.study.study - INFO - Trial 270 finished with values: [0.04945616966109169, 0.029016393442622943, 0.04311304120109769] and parameters: {'n_layers': 3, 'embedding_dim': 32, 'lr': 0.000293040961262534, 'lambda_val': 0.003966779220729784, 'batch_size': 1660, 'optimizer': 'Adam'}.
2026-05-23 03:36:53,222 - experiment_functions - INFO - Early stopping at epoch 2250. Best Metrics: (0.1278934566483595, 0.05754098360655738, 0.10214618143321158)
2026-05-23 03:36:53,304 - optuna.study.study - INFO - Trial 271 finished with values: [0.1278934566483595, 0.05754098360655738, 0.10214618143321158] and parameters: {'n_layers': 1, 'embedding_dim': 128, 'lr': 0.0005051991365347398, 'lambda_val': 0.00012928174782861758, 'batch_size': 1510, 'optimizer': 'RMSprop'}.
2026-05-23 03:37:04,395 - experiment_functions - INFO - Early stopping at epoch 3500. Best Metrics: (0.10080541485197157, 0.05090163934426229, 0.091472921007027)
2026-05-23 03:37:04,691 - optuna.study.study - INFO - Trial 272 finished with values: [0.10080541485197157, 0.05090163934426229, 0.091472921007027] and parameters: {'n_layers': 1, 'embedding_dim': 96, 'lr': 0.000293040961262534, 'lambda_val': 0.00012928174782861758, 'batch_size': 1921, 'optimizer': 'Adam'}.
2026-05-23 03:37:11,036 - experiment_functions - INFO - Early stopping at epoch 1950. Best Metrics: (0.078825304001704, 0.04590163934426229, 0.07030012779683224)
2026-05-23 03:37:11,522 - optuna.study.study - INFO - Trial 273 finished with values: [0.078825304001704, 0.04590163934426229, 0.07030012779683224] and parameters: {'n_layers': 1, 'embedding_dim': 32, 'lr': 0.0005051991365347398, 'lambda_val': 8.474115370818157e-05, 'batch_size': 1440, 'optimizer': 'Adam'}.
2026-05-23 03:37:21,028 - experiment_functions - INFO - Early stopping at epoch 3000. Best Metrics: (0.09512235020910009, 0.04819672131147541, 0.0773875771428806)
2026-05-23 03:37:21,570 - optuna.study.study - INFO - Trial 274 finished with values: [0.09512235020910009, 0.04819672131147541, 0.0773875771428806] and parameters: {'n_layers': 1, 'embedding_dim': 64, 'lr': 0.000293040961262534, 'lambda_val': 0.00023466167328982035, 'batch_size': 3009, 'optimizer': 'Adam'}.
2026-05-23 03:37:24,027 - experiment_functions - INFO - Early stopping at epoch 650. Best Metrics: (0.09929201629186042, 0.04868852459016394, 0.08358821120197352)
2026-05-23 03:37:24,139 - optuna.study.study - INFO - Trial 275 finished with values: [0.09929201629186042, 0.04868852459016394, 0.08358821120197352] and parameters: {'n_layers': 1, 'embedding_dim': 64, 'lr': 0.0019040849385408827, 'lambda_val': 0.00012928174782861758, 'batch_size': 2403, 'optimizer': 'Adam'}.
2026-05-23 03:37:26,848 - experiment_functions - INFO - Early stopping at epoch 600. Best Metrics: (0.07287259733186614, 0.04049180327868853, 0.05888828471735806)
2026-05-23 03:37:27,988 - optuna.study.study - INFO - Trial 276 finished with values: [0.07287259733186614, 0.04049180327868853, 0.05888828471735806] and parameters: {'n_layers': 1, 'embedding_dim': 256, 'lr': 0.001917913774554907, 'lambda_val': 0.02226499327915508, 'batch_size': 2228, 'optimizer': 'Adam'}.
2026-05-23 03:37:33,039 - experiment_functions - INFO - Early stopping at epoch 1400. Best Metrics: (0.09438036650975534, 0.04959016393442623, 0.08001470852441452)
2026-05-23 03:37:33,412 - optuna.study.study - INFO - Trial 277 finished with values: [0.09438036650975534, 0.04959016393442623, 0.08001470852441452] and parameters: {'n_layers': 1, 'embedding_dim': 64, 'lr': 0.0005051991365347398, 'lambda_val': 0.00011132011432528227, 'batch_size': 2913, 'optimizer': 'RMSprop'}.
2026-05-23 03:37:36,716 - experiment_functions - INFO - Early stopping at epoch 650. Best Metrics: (0.11621162950502123, 0.05352459016393443, 0.08903865261563819)
2026-05-23 03:37:36,804 - optuna.study.study - INFO - Trial 278 finished with values: [0.11621162950502123, 0.05352459016393443, 0.08903865261563819] and parameters: {'n_layers': 1, 'embedding_dim': 128, 'lr': 0.001917913774554907, 'lambda_val': 0.0006383294603067735, 'batch_size': 3527, 'optimizer': 'Adam'}.
2026-05-23 03:37:49,030 - optuna.study.study - INFO - Trial 279 finished with values: [0.09184897861683812, 0.05032786885245902, 0.07922560870136212] and parameters: {'n_layers': 1, 'embedding_dim': 64, 'lr': 0.000293040961262534, 'lambda_val': 0.00012928174782861758, 'batch_size': 1355, 'optimizer': 'Adam'}.
2026-05-23 03:37:56,603 - experiment_functions - INFO - Early stopping at epoch 2150. Best Metrics: (0.11478427044282144, 0.05327868852459016, 0.09390035594600205)
2026-05-23 03:37:56,691 - optuna.study.study - INFO - Trial 280 finished with values: [0.11478427044282144, 0.05327868852459016, 0.09390035594600205] and parameters: {'n_layers': 1, 'embedding_dim': 128, 'lr': 0.0005051991365347398, 'lambda_val': 0.00012928174782861758, 'batch_size': 1510, 'optimizer': 'Adam'}.
2026-05-23 03:38:08,675 - optuna.study.study - INFO - Trial 281 finished with values: [0.08824450161694837, 0.04491803278688524, 0.07438167745024704] and parameters: {'n_layers': 1, 'embedding_dim': 32, 'lr': 0.0003084507924491364, 'lambda_val': 8.029603261406284e-05, 'batch_size': 1921, 'optimizer': 'RMSprop'}.
2026-05-23 03:38:11,203 - experiment_functions - INFO - Early stopping at epoch 500. Best Metrics: (0.0021914909623002954, 0.001639344262295082, 0.0021865253977814483)
2026-05-23 03:38:11,339 - optuna.study.study - INFO - Trial 282 finished with values: [0.0021914909623002954, 0.001639344262295082, 0.0021865253977814483] and parameters: {'n_layers': 1, 'embedding_dim': 256, 'lr': 0.0005051991365347398, 'lambda_val': 0.00012928174782861758, 'batch_size': 1921, 'optimizer': 'SGD'}.
2026-05-23 03:38:14,057 - experiment_functions - INFO - Early stopping at epoch 650. Best Metrics: (0.0763481423861526, 0.04426229508196721, 0.06707748323447953)
2026-05-23 03:38:14,216 - optuna.study.study - INFO - Trial 283 finished with values: [0.0763481423861526, 0.04426229508196721, 0.06707748323447953] and parameters: {'n_layers': 1, 'embedding_dim': 32, 'lr': 0.0031305185360713038, 'lambda_val': 8.70357449478779e-06, 'batch_size': 2924, 'optimizer': 'Adam'}.
2026-05-23 03:38:18,713 - experiment_functions - INFO - Early stopping at epoch 1000. Best Metrics: (0.09730494644849119, 0.04959016393442623, 0.08285825083345569)
2026-05-23 03:38:18,820 - optuna.study.study - INFO - Trial 284 finished with values: [0.09730494644849119, 0.04959016393442623, 0.08285825083345569] and parameters: {'n_layers': 1, 'embedding_dim': 256, 'lr': 0.0005051991365347398, 'lambda_val': 0.002280697451629513, 'batch_size': 3013, 'optimizer': 'RMSprop'}.
2026-05-23 03:38:25,266 - experiment_functions - INFO - Early stopping at epoch 1300. Best Metrics: (0.04989939345609902, 0.027786885245901644, 0.04568976823931263)
2026-05-23 03:38:25,725 - optuna.study.study - INFO - Trial 285 finished with values: [0.04989939345609902, 0.027786885245901644, 0.04568976823931263] and parameters: {'n_layers': 3, 'embedding_dim': 64, 'lr': 0.0005051991365347398, 'lambda_val': 0.00012928174782861758, 'batch_size': 2924, 'optimizer': 'Adam'}.
2026-05-23 03:38:28,887 - experiment_functions - INFO - Early stopping at epoch 700. Best Metrics: (0.10770969119101594, 0.05073770491803279, 0.08272367963017296)
2026-05-23 03:38:28,969 - optuna.study.study - INFO - Trial 286 finished with values: [0.10770969119101594, 0.05073770491803279, 0.08272367963017296] and parameters: {'n_layers': 1, 'embedding_dim': 128, 'lr': 0.001917913774554907, 'lambda_val': 2.27009302283491e-06, 'batch_size': 3527, 'optimizer': 'Adam'}.
2026-05-23 03:38:37,490 - experiment_functions - INFO - Early stopping at epoch 1200. Best Metrics: (0.108383149455645, 0.053442622950819675, 0.09102641528385234)
2026-05-23 03:38:38,638 - optuna.study.study - INFO - Trial 287 finished with values: [0.108383149455645, 0.053442622950819675, 0.09102641528385234] and parameters: {'n_layers': 1, 'embedding_dim': 128, 'lr': 0.0004969264317801683, 'lambda_val': 0.00018385882411773826, 'batch_size': 3009, 'optimizer': 'RMSprop'}.
2026-05-23 03:38:40,939 - experiment_functions - INFO - Early stopping at epoch 500. Best Metrics: (0.0013093939974704932, 0.0012295081967213116, 0.0014529572223160694)
2026-05-23 03:38:41,140 - optuna.study.study - INFO - Trial 288 finished with values: [0.0013093939974704932, 0.0012295081967213116, 0.0014529572223160694] and parameters: {'n_layers': 1, 'embedding_dim': 128, 'lr': 0.0005051991365347398, 'lambda_val': 0.00012928174782861758, 'batch_size': 2898, 'optimizer': 'SGD'}.
2026-05-23 03:38:44,759 - experiment_functions - INFO - Early stopping at epoch 650. Best Metrics: (0.11281955246046442, 0.0519672131147541, 0.09288047079444518)
2026-05-23 03:38:44,851 - optuna.study.study - INFO - Trial 289 finished with values: [0.11281955246046442, 0.0519672131147541, 0.09288047079444518] and parameters: {'n_layers': 1, 'embedding_dim': 256, 'lr': 0.001917913774554907, 'lambda_val': 8.029603261406284e-05, 'batch_size': 3527, 'optimizer': 'Adam'}.
2026-05-23 03:38:50,786 - experiment_functions - INFO - Early stopping at epoch 1250. Best Metrics: (0.11399203219471811, 0.054098360655737705, 0.0949028703857343)
2026-05-23 03:38:51,243 - optuna.study.study - INFO - Trial 290 finished with values: [0.11399203219471811, 0.054098360655737705, 0.0949028703857343] and parameters: {'n_layers': 1, 'embedding_dim': 256, 'lr': 0.0005051991365347398, 'lambda_val': 0.00012928174782861758, 'batch_size': 3013, 'optimizer': 'Adam'}.
2026-05-23 03:38:55,389 - experiment_functions - INFO - Early stopping at epoch 1100. Best Metrics: (0.09248750516736381, 0.0462295081967213, 0.08128631922475832)
2026-05-23 03:38:55,648 - optuna.study.study - INFO - Trial 291 finished with values: [0.09248750516736381, 0.0462295081967213, 0.08128631922475832] and parameters: {'n_layers': 1, 'embedding_dim': 32, 'lr': 0.0019040849385408827, 'lambda_val': 1.9953918103416195e-06, 'batch_size': 1362, 'optimizer': 'Adam'}.
2026-05-23 03:39:03,442 - experiment_functions - INFO - Early stopping at epoch 2150. Best Metrics: (0.06469917136844068, 0.036721311475409836, 0.056501934817822806)
2026-05-23 03:39:03,536 - optuna.study.study - INFO - Trial 292 finished with values: [0.06469917136844068, 0.036721311475409836, 0.056501934817822806] and parameters: {'n_layers': 2, 'embedding_dim': 64, 'lr': 0.000293040961262534, 'lambda_val': 0.003966779220729784, 'batch_size': 1355, 'optimizer': 'Adam'}.
2026-05-23 03:39:08,356 - experiment_functions - INFO - Early stopping at epoch 1350. Best Metrics: (0.10894465315623543, 0.05622950819672132, 0.09732120824952128)
2026-05-23 03:39:08,479 - optuna.study.study - INFO - Trial 293 finished with values: [0.10894465315623543, 0.05622950819672132, 0.09732120824952128] and parameters: {'n_layers': 1, 'embedding_dim': 64, 'lr': 0.0005051991365347398, 'lambda_val': 0.003966779220729784, 'batch_size': 1660, 'optimizer': 'Adam'}.
2026-05-23 03:39:14,005 - experiment_functions - INFO - Early stopping at epoch 1300. Best Metrics: (0.09978353750969368, 0.048196721311475406, 0.08327708794939888)
2026-05-23 03:39:14,315 - optuna.study.study - INFO - Trial 294 finished with values: [0.09978353750969368, 0.048196721311475406, 0.08327708794939888] and parameters: {'n_layers': 1, 'embedding_dim': 256, 'lr': 0.0005051991365347398, 'lambda_val': 1.0937204014553017e-05, 'batch_size': 1921, 'optimizer': 'RMSprop'}.
2026-05-23 03:39:21,561 - experiment_functions - INFO - Early stopping at epoch 2100. Best Metrics: (0.029251438723897773, 0.013688524590163934, 0.022187054466299042)
2026-05-23 03:39:21,661 - optuna.study.study - INFO - Trial 295 finished with values: [0.029251438723897773, 0.013688524590163934, 0.022187054466299042] and parameters: {'n_layers': 1, 'embedding_dim': 32, 'lr': 0.051712403251660786, 'lambda_val': 0.00018385882411773826, 'batch_size': 4091, 'optimizer': 'RMSprop'}.
2026-05-23 03:39:30,703 - experiment_functions - INFO - Early stopping at epoch 2900. Best Metrics: (0.09952733552042616, 0.04950819672131148, 0.08653839949284552)
2026-05-23 03:39:30,798 - optuna.study.study - INFO - Trial 296 finished with values: [0.09952733552042616, 0.04950819672131148, 0.08653839949284552] and parameters: {'n_layers': 1, 'embedding_dim': 32, 'lr': 0.0005051991365347398, 'lambda_val': 0.0006383294603067735, 'batch_size': 1128, 'optimizer': 'Adam'}.
2026-05-23 03:39:43,452 - optuna.study.study - INFO - Trial 297 finished with values: [0.11166023588032746, 0.05754098360655739, 0.09366990146187847] and parameters: {'n_layers': 1, 'embedding_dim': 64, 'lr': 0.0005051991365347398, 'lambda_val': 2.2919931334748333e-06, 'batch_size': 1214, 'optimizer': 'Adam'}.
2026-05-23 03:39:49,619 - experiment_functions - INFO - Early stopping at epoch 1400. Best Metrics: (0.06573057754278017, 0.031475409836065574, 0.05208410164640592)
2026-05-23 03:39:50,190 - optuna.study.study - INFO - Trial 298 finished with values: [0.06573057754278017, 0.031475409836065574, 0.05208410164640592] and parameters: {'n_layers': 1, 'embedding_dim': 256, 'lr': 0.00753126673401026, 'lambda_val': 0.0006383294603067735, 'batch_size': 4016, 'optimizer': 'RMSprop'}.
2026-05-23 03:39:58,097 - experiment_functions - INFO - Early stopping at epoch 850. Best Metrics: (0.030058508779089825, 0.01836065573770492, 0.030046782142930415)
2026-05-23 03:39:58,609 - optuna.study.study - INFO - Trial 299 finished with values: [0.030058508779089825, 0.01836065573770492, 0.030046782142930415] and parameters: {'n_layers': 4, 'embedding_dim': 256, 'lr': 0.000293040961262534, 'lambda_val': 0.003966779220729784, 'batch_size': 2913, 'optimizer': 'Adam'}.
2026-05-23 03:39:58,625 - root - INFO - Selected Trial 271 based on Max NDCG: 0.1021
2026-05-23 03:39:58,625 - root - INFO - Associated Recall: 0.1279
2026-05-23 03:39:58,625 - experiment_functions - INFO - Training the best model ... for e_100K_1c1dcs_rand1
2026-05-23 03:40:04,226 - experiment_functions - INFO - Early stopping at epoch 1800. Best Metrics: (0.10811813211210881, 0.05245901639344262, 0.09225885081768477)
2026-05-23 03:40:04,335 - root - INFO -   **** Training e_100K_1c1dcs_rand2
2026-05-23 03:40:04,351 - root - INFO -   **** Getting 65267/81200 random edges
2026-05-23 03:40:04,459 - optuna.storages._rdb.storage - INFO - A new study created in RDB with name: Study_e_100K_1c1dcs_rand2
2026-05-23 03:40:07,689 - experiment_functions - INFO - Early stopping at epoch 550. Best Metrics: (0.02170793264218947, 0.01557377049180328, 0.0209299701245289)
2026-05-23 03:40:07,778 - optuna.study.study - INFO - Trial 0 finished with values: [0.02170793264218947, 0.01557377049180328, 0.0209299701245289] and parameters: {'n_layers': 4, 'embedding_dim': 96, 'lr': 0.0010504175483841457, 'lambda_val': 0.0013113203544047312, 'batch_size': 3317, 'optimizer': 'RMSprop'}.
2026-05-23 03:40:25,018 - optuna.study.study - INFO - Trial 1 finished with values: [0.007401490313623453, 0.005245901639344262, 0.00785793283704229] and parameters: {'n_layers': 3, 'embedding_dim': 96, 'lr': 2.947704151578636e-05, 'lambda_val': 1.8596671905520733e-05, 'batch_size': 2574, 'optimizer': 'Adam'}.
2026-05-23 03:40:30,218 - experiment_functions - INFO - Early stopping at epoch 1250. Best Metrics: (0.06089584057420526, 0.035573770491803276, 0.05157061650052095)
2026-05-23 03:40:30,331 - optuna.study.study - INFO - Trial 2 finished with values: [0.06089584057420526, 0.035573770491803276, 0.05157061650052095] and parameters: {'n_layers': 3, 'embedding_dim': 32, 'lr': 0.0005025722918895278, 'lambda_val': 6.2109274589487925e-06, 'batch_size': 1335, 'optimizer': 'RMSprop'}.
2026-05-23 03:40:45,419 - optuna.study.study - INFO - Trial 3 finished with values: [0.03100696228002047, 0.020327868852459016, 0.028480200885695996] and parameters: {'n_layers': 2, 'embedding_dim': 96, 'lr': 7.429060060163502e-05, 'lambda_val': 1.6693478080315474e-06, 'batch_size': 2387, 'optimizer': 'Adam'}.
2026-05-23 03:40:48,894 - experiment_functions - INFO - Early stopping at epoch 500. Best Metrics: (0.0004663879312567913, 0.0009836065573770492, 0.0010292080871067766)
2026-05-23 03:40:48,986 - optuna.study.study - INFO - Trial 4 finished with values: [0.0004663879312567913, 0.0009836065573770492, 0.0010292080871067766] and parameters: {'n_layers': 3, 'embedding_dim': 256, 'lr': 0.0001719986850103418, 'lambda_val': 6.612195885210274e-05, 'batch_size': 850, 'optimizer': 'SGD'}.
2026-05-23 03:40:51,240 - experiment_functions - INFO - Early stopping at epoch 500. Best Metrics: (0.001832301235117443, 0.0018852459016393442, 0.0020459359753006554)
2026-05-23 03:40:51,407 - optuna.study.study - INFO - Trial 5 finished with values: [0.001832301235117443, 0.0018852459016393442, 0.0020459359753006554] and parameters: {'n_layers': 3, 'embedding_dim': 64, 'lr': 0.00012165500874138025, 'lambda_val': 0.028793639213701008, 'batch_size': 733, 'optimizer': 'SGD'}.
2026-05-23 03:41:01,927 - experiment_functions - INFO - Early stopping at epoch 900. Best Metrics: (0.01891926968243542, 0.008442622950819673, 0.013851031089493036)
2026-05-23 03:41:02,978 - optuna.study.study - INFO - Trial 6 finished with values: [0.01891926968243542, 0.008442622950819673, 0.013851031089493036] and parameters: {'n_layers': 4, 'embedding_dim': 96, 'lr': 0.013214768588208766, 'lambda_val': 9.031610003618857e-05, 'batch_size': 2606, 'optimizer': 'Adam'}.
2026-05-23 03:41:09,709 - experiment_functions - INFO - Early stopping at epoch 500. Best Metrics: (0.0026491140204337343, 0.0014754098360655738, 0.0020252200760509775)
2026-05-23 03:41:09,926 - optuna.study.study - INFO - Trial 7 finished with values: [0.0026491140204337343, 0.0014754098360655738, 0.0020252200760509775] and parameters: {'n_layers': 4, 'embedding_dim': 64, 'lr': 0.04758735133648432, 'lambda_val': 6.949625189993516e-05, 'batch_size': 2057, 'optimizer': 'SGD'}.
2026-05-23 03:41:14,570 - experiment_functions - INFO - Early stopping at epoch 500. Best Metrics: (0.002421968611973832, 0.001475409836065574, 0.002064132727542385)
2026-05-23 03:41:14,943 - optuna.study.study - INFO - Trial 8 finished with values: [0.002421968611973832, 0.001475409836065574, 0.002064132727542385] and parameters: {'n_layers': 4, 'embedding_dim': 256, 'lr': 0.0028599839321251067, 'lambda_val': 1.948982514176025e-06, 'batch_size': 1145, 'optimizer': 'SGD'}.
2026-05-23 03:41:17,289 - experiment_functions - INFO - Early stopping at epoch 500. Best Metrics: (0.0024051712336643416, 0.0018852459016393442, 0.0021719326493296973)
2026-05-23 03:41:17,394 - optuna.study.study - INFO - Trial 9 finished with values: [0.0024051712336643416, 0.0018852459016393442, 0.0021719326493296973] and parameters: {'n_layers': 1, 'embedding_dim': 64, 'lr': 8.289805712737858e-05, 'lambda_val': 0.000826940797500259, 'batch_size': 1321, 'optimizer': 'SGD'}.
2026-05-23 03:41:31,630 - optuna.study.study - INFO - Trial 10 finished with values: [0.055829665939612264, 0.030655737704918033, 0.04836270025139205] and parameters: {'n_layers': 3, 'embedding_dim': 32, 'lr': 0.000233346029650438, 'lambda_val': 0.0009750566560695258, 'batch_size': 1170, 'optimizer': 'Adam'}.
2026-05-23 03:41:41,132 - experiment_functions - INFO - Early stopping at epoch 1350. Best Metrics: (0.016923617263197716, 0.010409836065573769, 0.014422987598301878)
2026-05-23 03:41:41,747 - optuna.study.study - INFO - Trial 11 finished with values: [0.016923617263197716, 0.010409836065573769, 0.014422987598301878] and parameters: {'n_layers': 4, 'embedding_dim': 256, 'lr': 0.011997581390738117, 'lambda_val': 0.004192541776887513, 'batch_size': 4011, 'optimizer': 'Adam'}.
2026-05-23 03:41:54,373 - optuna.study.study - INFO - Trial 12 finished with values: [0.04396383847763415, 0.026967213114754102, 0.043058226350273565] and parameters: {'n_layers': 1, 'embedding_dim': 64, 'lr': 0.00012113925642415473, 'lambda_val': 0.0009863767281582856, 'batch_size': 2331, 'optimizer': 'Adam'}.
2026-05-23 03:41:56,473 - experiment_functions - INFO - Early stopping at epoch 500. Best Metrics: (0.001679036329179353, 0.0017213114754098362, 0.0020554175743593326)
2026-05-23 03:41:56,566 - optuna.study.study - INFO - Trial 13 finished with values: [0.001679036329179353, 0.0017213114754098362, 0.0020554175743593326] and parameters: {'n_layers': 1, 'embedding_dim': 32, 'lr': 0.00551054870011119, 'lambda_val': 7.669781484712707e-05, 'batch_size': 3349, 'optimizer': 'SGD'}.
2026-05-23 03:41:59,148 - experiment_functions - INFO - Early stopping at epoch 500. Best Metrics: (0.003049266640157328, 0.002295081967213115, 0.0027948260718043045)
2026-05-23 03:41:59,242 - optuna.study.study - INFO - Trial 14 finished with values: [0.003049266640157328, 0.002295081967213115, 0.0027948260718043045] and parameters: {'n_layers': 3, 'embedding_dim': 64, 'lr': 0.0009246024377470603, 'lambda_val': 0.04273606177827789, 'batch_size': 3615, 'optimizer': 'SGD'}.
2026-05-23 03:42:06,739 - experiment_functions - INFO - Early stopping at epoch 2500. Best Metrics: (0.0027325076339523666, 0.0021311475409836068, 0.00262625730361021)
2026-05-23 03:42:06,831 - optuna.study.study - INFO - Trial 15 finished with values: [0.0027325076339523666, 0.0021311475409836068, 0.00262625730361021] and parameters: {'n_layers': 1, 'embedding_dim': 32, 'lr': 1.1059497546843142e-05, 'lambda_val': 9.517365946545563e-06, 'batch_size': 2255, 'optimizer': 'Adam'}.
2026-05-23 03:42:09,338 - experiment_functions - INFO - Early stopping at epoch 550. Best Metrics: (0.07173468502622889, 0.03860655737704919, 0.06083391055703301)
2026-05-23 03:42:09,982 - optuna.study.study - INFO - Trial 16 finished with values: [0.07173468502622889, 0.03860655737704919, 0.06083391055703301] and parameters: {'n_layers': 1, 'embedding_dim': 64, 'lr': 0.0029056396011724254, 'lambda_val': 6.13505476225876e-05, 'batch_size': 2515, 'optimizer': 'RMSprop'}.
2026-05-23 03:42:14,340 - experiment_functions - INFO - Early stopping at epoch 550. Best Metrics: (0.042855431534565155, 0.023606557377049184, 0.03557579319478166)
