2026-05-23 00:18:57,222 - optuna.study.study - INFO - Trial 19 finished with values: [0.0031406659748567174, 0.0018852459016393442, 0.0024938395418192642] and parameters: {'n_layers': 2, 'embedding_dim': 64, 'lr': 2.060579680841633e-05, 'lambda_val': 0.0006774375843564255, 'batch_size': 2231, 'optimizer': 'SGD'}.
2026-05-23 00:18:59,414 - experiment_functions - INFO - Early stopping at epoch 500. Best Metrics: (0.0033009817650394295, 0.002459016393442623, 0.003998524903151639)
2026-05-23 00:18:59,545 - optuna.study.study - INFO - Trial 20 finished with values: [0.0033009817650394295, 0.002459016393442623, 0.003998524903151639] and parameters: {'n_layers': 4, 'embedding_dim': 32, 'lr': 0.015885638491217054, 'lambda_val': 0.0004508564452666277, 'batch_size': 2402, 'optimizer': 'SGD'}.
2026-05-23 00:19:05,323 - experiment_functions - INFO - Early stopping at epoch 1750. Best Metrics: (0.037413332769343284, 0.02098360655737705, 0.0324764319908264)
2026-05-23 00:19:05,694 - optuna.study.study - INFO - Trial 21 finished with values: [0.037413332769343284, 0.02098360655737705, 0.0324764319908264] and parameters: {'n_layers': 2, 'embedding_dim': 96, 'lr': 0.00022079369433681775, 'lambda_val': 0.00551038486085562, 'batch_size': 2834, 'optimizer': 'RMSprop'}.
2026-05-23 00:19:08,547 - experiment_functions - INFO - Early stopping at epoch 500. Best Metrics: (0.0025704964441378765, 0.002540983606557377, 0.0028288598188145058)
2026-05-23 00:19:08,627 - optuna.study.study - INFO - Trial 22 finished with values: [0.0025704964441378765, 0.002540983606557377, 0.0028288598188145058] and parameters: {'n_layers': 2, 'embedding_dim': 256, 'lr': 1.2610349058583873e-05, 'lambda_val': 4.951551807707882e-06, 'batch_size': 2624, 'optimizer': 'SGD'}.
2026-05-23 00:19:11,081 - experiment_functions - INFO - Early stopping at epoch 500. Best Metrics: (0.0014341967562295, 0.0013114754098360658, 0.0016261387381872854)
2026-05-23 00:19:11,161 - optuna.study.study - INFO - Trial 23 finished with values: [0.0014341967562295, 0.0013114754098360658, 0.0016261387381872854] and parameters: {'n_layers': 2, 'embedding_dim': 256, 'lr': 0.001299063071619584, 'lambda_val': 2.0395641111336252e-06, 'batch_size': 2901, 'optimizer': 'SGD'}.
2026-05-23 00:19:13,262 - experiment_functions - INFO - Early stopping at epoch 500. Best Metrics: (0.002519913295095145, 0.002377049180327869, 0.0029395447606973915)
2026-05-23 00:19:13,341 - optuna.study.study - INFO - Trial 24 finished with values: [0.002519913295095145, 0.002377049180327869, 0.0029395447606973915] and parameters: {'n_layers': 2, 'embedding_dim': 32, 'lr': 0.00015373619630486518, 'lambda_val': 2.9030505687769275e-05, 'batch_size': 987, 'optimizer': 'SGD'}.
2026-05-23 00:19:15,499 - experiment_functions - INFO - Early stopping at epoch 500. Best Metrics: (0.0018242348003024737, 0.0015573770491803278, 0.0020529124965910682)
2026-05-23 00:19:15,589 - optuna.study.study - INFO - Trial 25 finished with values: [0.0018242348003024737, 0.0015573770491803278, 0.0020529124965910682] and parameters: {'n_layers': 3, 'embedding_dim': 32, 'lr': 0.0007720163950548322, 'lambda_val': 2.2409003630251666e-05, 'batch_size': 4038, 'optimizer': 'SGD'}.
2026-05-23 00:19:18,709 - experiment_functions - INFO - Early stopping at epoch 900. Best Metrics: (0.0023519715554431975, 0.0018852459016393442, 0.002736966175585559)
2026-05-23 00:19:19,604 - optuna.study.study - INFO - Trial 26 finished with values: [0.0023519715554431975, 0.0018852459016393442, 0.002736966175585559] and parameters: {'n_layers': 2, 'embedding_dim': 96, 'lr': 0.025144159639992416, 'lambda_val': 0.007934444101871127, 'batch_size': 1589, 'optimizer': 'SGD'}.
2026-05-23 00:19:24,671 - experiment_functions - INFO - Early stopping at epoch 500. Best Metrics: (0.0018787704275651706, 0.002377049180327869, 0.0025027768293566562)
2026-05-23 00:19:25,157 - optuna.study.study - INFO - Trial 27 finished with values: [0.0018787704275651706, 0.002377049180327869, 0.0025027768293566562] and parameters: {'n_layers': 1, 'embedding_dim': 128, 'lr': 0.00044563604340819415, 'lambda_val': 0.023545362557091012, 'batch_size': 647, 'optimizer': 'SGD'}.
2026-05-23 00:19:33,497 - experiment_functions - INFO - Early stopping at epoch 700. Best Metrics: (0.013475542649901863, 0.01221311475409836, 0.014344244640247722)
2026-05-23 00:19:34,116 - optuna.study.study - INFO - Trial 28 finished with values: [0.013475542649901863, 0.01221311475409836, 0.014344244640247722] and parameters: {'n_layers': 2, 'embedding_dim': 96, 'lr': 0.0014120698261668326, 'lambda_val': 0.033428884361528834, 'batch_size': 669, 'optimizer': 'Adam'}.
2026-05-23 00:19:40,146 - experiment_functions - INFO - Early stopping at epoch 1000. Best Metrics: (0.020532718652412477, 0.012868852459016394, 0.019628350492465026)
2026-05-23 00:19:40,939 - optuna.study.study - INFO - Trial 29 finished with values: [0.020532718652412477, 0.012868852459016394, 0.019628350492465026] and parameters: {'n_layers': 4, 'embedding_dim': 256, 'lr': 0.00029826529867114525, 'lambda_val': 2.9099669967589168e-06, 'batch_size': 3649, 'optimizer': 'Adam'}.
2026-05-23 00:19:43,757 - experiment_functions - INFO - Early stopping at epoch 600. Best Metrics: (0.03715659228441938, 0.018934426229508198, 0.030198905339164302)
2026-05-23 00:19:43,898 - optuna.study.study - INFO - Trial 30 finished with values: [0.03715659228441938, 0.018934426229508198, 0.030198905339164302] and parameters: {'n_layers': 2, 'embedding_dim': 256, 'lr': 0.0009422878098805214, 'lambda_val': 0.0021335803209076563, 'batch_size': 1861, 'optimizer': 'RMSprop'}.
2026-05-23 00:19:47,259 - experiment_functions - INFO - Early stopping at epoch 800. Best Metrics: (0.018999680144577258, 0.013688524590163937, 0.01837615494093538)
2026-05-23 00:19:47,444 - optuna.study.study - INFO - Trial 31 finished with values: [0.018999680144577258, 0.013688524590163937, 0.01837615494093538] and parameters: {'n_layers': 1, 'embedding_dim': 128, 'lr': 0.0010744659567170868, 'lambda_val': 0.0680444570611836, 'batch_size': 1422, 'optimizer': 'Adam'}.
2026-05-23 00:19:50,990 - experiment_functions - INFO - Early stopping at epoch 1000. Best Metrics: (0.001313636628292286, 0.0018032786885245904, 0.0017920319289444597)
2026-05-23 00:19:51,338 - optuna.study.study - INFO - Trial 32 finished with values: [0.001313636628292286, 0.0018032786885245904, 0.0017920319289444597] and parameters: {'n_layers': 3, 'embedding_dim': 32, 'lr': 1.8041103593581876e-05, 'lambda_val': 0.0004345044038597418, 'batch_size': 792, 'optimizer': 'Adam'}.
2026-05-23 00:19:53,730 - experiment_functions - INFO - Early stopping at epoch 500. Best Metrics: (0.001225341099211654, 0.0014754098360655738, 0.0016585783278021099)
2026-05-23 00:19:53,817 - optuna.study.study - INFO - Trial 33 finished with values: [0.001225341099211654, 0.0014754098360655738, 0.0016585783278021099] and parameters: {'n_layers': 3, 'embedding_dim': 128, 'lr': 0.012006631762219378, 'lambda_val': 1.1518981944312e-05, 'batch_size': 3770, 'optimizer': 'SGD'}.
2026-05-23 00:19:56,228 - experiment_functions - INFO - Early stopping at epoch 500. Best Metrics: (0.001215262653788888, 0.0019672131147540984, 0.0019449718955868573)
2026-05-23 00:19:56,319 - optuna.study.study - INFO - Trial 34 finished with values: [0.001215262653788888, 0.0019672131147540984, 0.0019449718955868573] and parameters: {'n_layers': 4, 'embedding_dim': 96, 'lr': 0.011611521210997035, 'lambda_val': 0.0008951012674439531, 'batch_size': 2470, 'optimizer': 'SGD'}.
2026-05-23 00:20:05,181 - experiment_functions - INFO - Early stopping at epoch 3050. Best Metrics: (0.005013427133719845, 0.002377049180327869, 0.0036427265833549423)
2026-05-23 00:20:05,276 - optuna.study.study - INFO - Trial 35 finished with values: [0.005013427133719845, 0.002377049180327869, 0.0036427265833549423] and parameters: {'n_layers': 1, 'embedding_dim': 32, 'lr': 3.0043364422134417e-05, 'lambda_val': 4.220763556526369e-05, 'batch_size': 2908, 'optimizer': 'Adam'}.
2026-05-23 00:20:17,085 - optuna.study.study - INFO - Trial 36 finished with values: [0.0017580688081713666, 0.0017213114754098362, 0.0019157990741556284] and parameters: {'n_layers': 3, 'embedding_dim': 64, 'lr': 2.6993162882503753e-05, 'lambda_val': 1.7207712053457044e-06, 'batch_size': 984, 'optimizer': 'Adam'}.
2026-05-23 00:20:19,520 - experiment_functions - INFO - Early stopping at epoch 550. Best Metrics: (0.018818001505722638, 0.009918032786885246, 0.015889442150604127)
2026-05-23 00:20:19,650 - optuna.study.study - INFO - Trial 37 finished with values: [0.018818001505722638, 0.009918032786885246, 0.015889442150604127] and parameters: {'n_layers': 3, 'embedding_dim': 128, 'lr': 0.005005836104485835, 'lambda_val': 2.3106429734806373e-06, 'batch_size': 1339, 'optimizer': 'RMSprop'}.
2026-05-23 00:20:22,763 - experiment_functions - INFO - Early stopping at epoch 700. Best Metrics: (0.029577813452552018, 0.017049180327868854, 0.028240091465904074)
2026-05-23 00:20:22,908 - optuna.study.study - INFO - Trial 38 finished with values: [0.029577813452552018, 0.017049180327868854, 0.028240091465904074] and parameters: {'n_layers': 2, 'embedding_dim': 256, 'lr': 0.0007184162715631311, 'lambda_val': 0.001981990620864252, 'batch_size': 1457, 'optimizer': 'RMSprop'}.
2026-05-23 00:20:25,594 - experiment_functions - INFO - Early stopping at epoch 550. Best Metrics: (0.025519890766138316, 0.016065573770491805, 0.02356983495837947)
2026-05-23 00:20:25,675 - optuna.study.study - INFO - Trial 39 finished with values: [0.025519890766138316, 0.016065573770491805, 0.02356983495837947] and parameters: {'n_layers': 2, 'embedding_dim': 256, 'lr': 0.006215487236112131, 'lambda_val': 0.002823733504284557, 'batch_size': 1921, 'optimizer': 'Adam'}.
2026-05-23 00:20:28,606 - experiment_functions - INFO - Early stopping at epoch 500. Best Metrics: (0.003684884744218693, 0.002213114754098361, 0.0036070161157322972)
2026-05-23 00:20:28,712 - optuna.study.study - INFO - Trial 40 finished with values: [0.003684884744218693, 0.002213114754098361, 0.0036070161157322972] and parameters: {'n_layers': 4, 'embedding_dim': 256, 'lr': 0.011351372667191655, 'lambda_val': 1.0895590255719957e-05, 'batch_size': 3533, 'optimizer': 'SGD'}.
2026-05-23 00:20:31,202 - experiment_functions - INFO - Early stopping at epoch 600. Best Metrics: (0.03619097321588413, 0.01975409836065574, 0.031225912335458458)
2026-05-23 00:20:31,290 - optuna.study.study - INFO - Trial 41 finished with values: [0.03619097321588413, 0.01975409836065574, 0.031225912335458458] and parameters: {'n_layers': 3, 'embedding_dim': 64, 'lr': 0.0029335455314602995, 'lambda_val': 0.0002603879699437796, 'batch_size': 1833, 'optimizer': 'Adam'}.
2026-05-23 00:20:33,540 - experiment_functions - INFO - Early stopping at epoch 500. Best Metrics: (0.001604507331525033, 0.0013114754098360656, 0.0016180369653316256)
2026-05-23 00:20:33,638 - optuna.study.study - INFO - Trial 42 finished with values: [0.001604507331525033, 0.0013114754098360656, 0.0016180369653316256] and parameters: {'n_layers': 4, 'embedding_dim': 96, 'lr': 0.00797689580959641, 'lambda_val': 0.0007350610201505196, 'batch_size': 1758, 'optimizer': 'SGD'}.
2026-05-23 00:20:35,958 - experiment_functions - INFO - Early stopping at epoch 550. Best Metrics: (0.013829969409937238, 0.00959016393442623, 0.01275642181389733)
2026-05-23 00:20:36,051 - optuna.study.study - INFO - Trial 43 finished with values: [0.013829969409937238, 0.00959016393442623, 0.01275642181389733] and parameters: {'n_layers': 3, 'embedding_dim': 64, 'lr': 0.012934053566204652, 'lambda_val': 0.0005924739906941611, 'batch_size': 1701, 'optimizer': 'RMSprop'}.
2026-05-23 00:20:40,564 - experiment_functions - INFO - Early stopping at epoch 500. Best Metrics: (0.0009268004279063639, 0.0009836065573770492, 0.0010160273705351525)
2026-05-23 00:20:41,244 - optuna.study.study - INFO - Trial 44 finished with values: [0.0009268004279063639, 0.0009836065573770492, 0.0010160273705351525] and parameters: {'n_layers': 2, 'embedding_dim': 256, 'lr': 2.4133279830802448e-05, 'lambda_val': 1.4273593243101675e-05, 'batch_size': 2183, 'optimizer': 'SGD'}.
2026-05-23 00:20:49,363 - experiment_functions - INFO - Early stopping at epoch 500. Best Metrics: (0.002509511011923337, 0.0020491803278688526, 0.0025008755551069787)
2026-05-23 00:20:49,697 - optuna.study.study - INFO - Trial 45 finished with values: [0.002509511011923337, 0.0020491803278688526, 0.0025008755551069787] and parameters: {'n_layers': 2, 'embedding_dim': 96, 'lr': 0.003852559446499297, 'lambda_val': 1.7296387291554016e-05, 'batch_size': 2346, 'optimizer': 'SGD'}.
2026-05-23 00:20:53,053 - experiment_functions - INFO - Early stopping at epoch 550. Best Metrics: (0.01871731896612396, 0.010163934426229508, 0.014798991357620674)
2026-05-23 00:20:53,139 - optuna.study.study - INFO - Trial 46 finished with values: [0.01871731896612396, 0.010163934426229508, 0.014798991357620674] and parameters: {'n_layers': 3, 'embedding_dim': 64, 'lr': 0.01250859324335198, 'lambda_val': 6.986110078025384e-06, 'batch_size': 1566, 'optimizer': 'Adam'}.
2026-05-23 00:20:55,558 - experiment_functions - INFO - Early stopping at epoch 500. Best Metrics: (0.0008664627914847416, 0.0013114754098360656, 0.0015893738929782842)
2026-05-23 00:20:55,652 - optuna.study.study - INFO - Trial 47 finished with values: [0.0008664627914847416, 0.0013114754098360656, 0.0015893738929782842] and parameters: {'n_layers': 3, 'embedding_dim': 96, 'lr': 3.7563849364159286e-05, 'lambda_val': 0.030022855553747632, 'batch_size': 2625, 'optimizer': 'RMSprop'}.
2026-05-23 00:20:58,255 - experiment_functions - INFO - Early stopping at epoch 650. Best Metrics: (0.030677999931061198, 0.01762295081967213, 0.02670462505624543)
2026-05-23 00:20:58,353 - optuna.study.study - INFO - Trial 48 finished with values: [0.030677999931061198, 0.01762295081967213, 0.02670462505624543] and parameters: {'n_layers': 1, 'embedding_dim': 64, 'lr': 0.0016072373570504854, 'lambda_val': 9.354031522850019e-05, 'batch_size': 4039, 'optimizer': 'RMSprop'}.
2026-05-23 00:21:10,853 - optuna.study.study - INFO - Trial 49 finished with values: [0.00911382754097975, 0.006311475409836066, 0.008077433871978184] and parameters: {'n_layers': 2, 'embedding_dim': 96, 'lr': 7.633899003856614e-05, 'lambda_val': 0.00041097337079039527, 'batch_size': 3805, 'optimizer': 'Adam'}.
2026-05-23 00:21:14,091 - experiment_functions - INFO - Early stopping at epoch 850. Best Metrics: (0.0024210254195063184, 0.0013934426229508198, 0.0020402079094505145)
2026-05-23 00:21:14,198 - optuna.study.study - INFO - Trial 50 finished with values: [0.0024210254195063184, 0.0013934426229508198, 0.0020402079094505145] and parameters: {'n_layers': 3, 'embedding_dim': 32, 'lr': 0.09593429906843143, 'lambda_val': 0.004655126099253904, 'batch_size': 3848, 'optimizer': 'SGD'}.
2026-05-23 00:21:16,633 - experiment_functions - INFO - Early stopping at epoch 550. Best Metrics: (0.020294910313894864, 0.011475409836065573, 0.015823554034729428)
2026-05-23 00:21:16,733 - optuna.study.study - INFO - Trial 51 finished with values: [0.020294910313894864, 0.011475409836065573, 0.015823554034729428] and parameters: {'n_layers': 3, 'embedding_dim': 32, 'lr': 0.0029335455314602995, 'lambda_val': 0.0002603879699437796, 'batch_size': 2450, 'optimizer': 'RMSprop'}.
2026-05-23 00:21:20,795 - experiment_functions - INFO - Early stopping at epoch 1100. Best Metrics: (0.006453315780621483, 0.0060655737704918035, 0.007601493205079006)
2026-05-23 00:21:21,000 - optuna.study.study - INFO - Trial 52 finished with values: [0.006453315780621483, 0.0060655737704918035, 0.007601493205079006] and parameters: {'n_layers': 3, 'embedding_dim': 128, 'lr': 0.014076733709420296, 'lambda_val': 0.062270696592229356, 'batch_size': 2098, 'optimizer': 'Adam'}.
2026-05-23 00:21:24,101 - experiment_functions - INFO - Early stopping at epoch 550. Best Metrics: (0.020052789386570125, 0.011147540983606558, 0.01728399371318903)
2026-05-23 00:21:24,460 - optuna.study.study - INFO - Trial 53 finished with values: [0.020052789386570125, 0.011147540983606558, 0.01728399371318903] and parameters: {'n_layers': 4, 'embedding_dim': 256, 'lr': 0.005832819514590744, 'lambda_val': 0.002823733504284557, 'batch_size': 623, 'optimizer': 'Adam'}.
2026-05-23 00:21:27,460 - experiment_functions - INFO - Early stopping at epoch 700. Best Metrics: (0.021292702669038387, 0.01344262295081967, 0.019080172827734457)
2026-05-23 00:21:28,812 - optuna.study.study - INFO - Trial 54 finished with values: [0.021292702669038387, 0.01344262295081967, 0.019080172827734457] and parameters: {'n_layers': 3, 'embedding_dim': 32, 'lr': 0.0013882664669042468, 'lambda_val': 5.790863900505623e-06, 'batch_size': 2778, 'optimizer': 'Adam'}.
2026-05-23 00:21:32,351 - experiment_functions - INFO - Early stopping at epoch 950. Best Metrics: (0.0037952222077470253, 0.002704918032786885, 0.003785670352272173)
2026-05-23 00:21:32,562 - optuna.study.study - INFO - Trial 55 finished with values: [0.0037952222077470253, 0.002704918032786885, 0.003785670352272173] and parameters: {'n_layers': 2, 'embedding_dim': 32, 'lr': 3.0043364422134417e-05, 'lambda_val': 4.220763556526369e-05, 'batch_size': 2908, 'optimizer': 'Adam'}.
2026-05-23 00:21:34,683 - experiment_functions - INFO - Early stopping at epoch 500. Best Metrics: (0.003643345581884339, 0.0018032786885245904, 0.002491429680990692)
2026-05-23 00:21:34,808 - optuna.study.study - INFO - Trial 56 finished with values: [0.003643345581884339, 0.0018032786885245904, 0.002491429680990692] and parameters: {'n_layers': 2, 'embedding_dim': 64, 'lr': 7.691410396457882e-05, 'lambda_val': 0.0006774375843564255, 'batch_size': 2231, 'optimizer': 'SGD'}.
2026-05-23 00:21:38,358 - experiment_functions - INFO - Early stopping at epoch 550. Best Metrics: (0.014821773131692856, 0.007950819672131149, 0.012340513779006568)
2026-05-23 00:21:39,145 - optuna.study.study - INFO - Trial 57 finished with values: [0.014821773131692856, 0.007950819672131149, 0.012340513779006568] and parameters: {'n_layers': 3, 'embedding_dim': 64, 'lr': 0.01250859324335198, 'lambda_val': 1.4253981643535276e-05, 'batch_size': 4084, 'optimizer': 'Adam'}.
2026-05-23 00:21:50,793 - experiment_functions - INFO - Early stopping at epoch 1800. Best Metrics: (0.0014889958312822083, 0.0012295081967213116, 0.0014846531020470503)
2026-05-23 00:21:50,876 - optuna.study.study - INFO - Trial 58 finished with values: [0.0014889958312822083, 0.0012295081967213116, 0.0014846531020470503] and parameters: {'n_layers': 4, 'embedding_dim': 96, 'lr': 0.03480782942431075, 'lambda_val': 0.0008951012674439531, 'batch_size': 1155, 'optimizer': 'SGD'}.
2026-05-23 00:22:03,709 - optuna.study.study - INFO - Trial 59 finished with values: [0.0323481317752875, 0.019262295081967213, 0.028778960504272085] and parameters: {'n_layers': 2, 'embedding_dim': 32, 'lr': 0.0003566717415961628, 'lambda_val': 0.00011624026828970741, 'batch_size': 987, 'optimizer': 'Adam'}.
2026-05-23 00:22:07,283 - experiment_functions - INFO - Early stopping at epoch 700. Best Metrics: (0.03369548212780527, 0.019344262295081967, 0.029437983097280056)
2026-05-23 00:22:08,282 - optuna.study.study - INFO - Trial 60 finished with values: [0.03369548212780527, 0.019344262295081967, 0.029437983097280056] and parameters: {'n_layers': 2, 'embedding_dim': 256, 'lr': 0.0007184162715631311, 'lambda_val': 2.0395641111336252e-06, 'batch_size': 1457, 'optimizer': 'RMSprop'}.
2026-05-23 00:22:11,500 - experiment_functions - INFO - Early stopping at epoch 600. Best Metrics: (0.013076668474716738, 0.009672131147540983, 0.012470469143156217)
2026-05-23 00:22:12,005 - optuna.study.study - INFO - Trial 61 finished with values: [0.013076668474716738, 0.009672131147540983, 0.012470469143156217] and parameters: {'n_layers': 2, 'embedding_dim': 256, 'lr': 0.005832819514590744, 'lambda_val': 0.003265600459695188, 'batch_size': 1603, 'optimizer': 'RMSprop'}.
2026-05-23 00:22:22,415 - experiment_functions - INFO - Early stopping at epoch 2700. Best Metrics: (0.02784584335377542, 0.01622950819672131, 0.024215324218490743)
2026-05-23 00:22:23,304 - optuna.study.study - INFO - Trial 62 finished with values: [0.02784584335377542, 0.01622950819672131, 0.024215324218490743] and parameters: {'n_layers': 2, 'embedding_dim': 32, 'lr': 0.0003566717415961628, 'lambda_val': 8.819162328566226e-05, 'batch_size': 1369, 'optimizer': 'RMSprop'}.
2026-05-23 00:22:29,400 - experiment_functions - INFO - Early stopping at epoch 1350. Best Metrics: (0.023352056557309715, 0.014262295081967215, 0.020652341306365642)
2026-05-23 00:22:29,495 - optuna.study.study - INFO - Trial 63 finished with values: [0.023352056557309715, 0.014262295081967215, 0.020652341306365642] and parameters: {'n_layers': 4, 'embedding_dim': 96, 'lr': 0.00029826529867114525, 'lambda_val': 0.0021335803209076563, 'batch_size': 1861, 'optimizer': 'Adam'}.
2026-05-23 00:22:33,001 - experiment_functions - INFO - Early stopping at epoch 700. Best Metrics: (0.030230863233530296, 0.01721311475409836, 0.025450086930313982)
2026-05-23 00:22:33,085 - optuna.study.study - INFO - Trial 64 finished with values: [0.030230863233530296, 0.01721311475409836, 0.025450086930313982] and parameters: {'n_layers': 3, 'embedding_dim': 64, 'lr': 0.0011286476195635738, 'lambda_val': 0.006734268474296521, 'batch_size': 1280, 'optimizer': 'Adam'}.
2026-05-23 00:22:36,188 - experiment_functions - INFO - Early stopping at epoch 600. Best Metrics: (0.02609844205453975, 0.01614754098360656, 0.02741092259025895)
