2026-05-23 05:53:07,478 - optuna.study.study - INFO - Trial 267 finished with values: [0.009871820881791882, 0.008114754098360656, 0.010243290031273843] and parameters: {'n_layers': 4, 'embedding_dim': 32, 'lr': 4.86165552527291e-05, 'lambda_val': 0.0006851631779644081, 'batch_size': 1631, 'optimizer': 'Adam'}.
2026-05-23 05:53:21,613 - experiment_functions - INFO - Early stopping at epoch 3700. Best Metrics: (0.11445323301611925, 0.05557377049180327, 0.09557019654424193)
2026-05-23 05:53:21,993 - optuna.study.study - INFO - Trial 268 finished with values: [0.11445323301611925, 0.05557377049180327, 0.09557019654424193] and parameters: {'n_layers': 1, 'embedding_dim': 256, 'lr': 0.000360608106860257, 'lambda_val': 6.19406847114503e-05, 'batch_size': 1321, 'optimizer': 'RMSprop'}.
2026-05-23 05:53:39,842 - optuna.study.study - INFO - Trial 269 finished with values: [0.10937167430052203, 0.05606557377049181, 0.09350076377349334] and parameters: {'n_layers': 1, 'embedding_dim': 96, 'lr': 0.000360608106860257, 'lambda_val': 0.0016872549049523802, 'batch_size': 1631, 'optimizer': 'Adam'}.
2026-05-23 05:53:45,354 - experiment_functions - INFO - Early stopping at epoch 1300. Best Metrics: (0.0714096476097562, 0.040409836065573766, 0.06229266016467161)
2026-05-23 05:53:45,446 - optuna.study.study - INFO - Trial 270 finished with values: [0.0714096476097562, 0.040409836065573766, 0.06229266016467161] and parameters: {'n_layers': 2, 'embedding_dim': 96, 'lr': 0.000360608106860257, 'lambda_val': 0.00013338361174833875, 'batch_size': 1321, 'optimizer': 'RMSprop'}.
2026-05-23 05:53:57,435 - optuna.study.study - INFO - Trial 271 finished with values: [0.005353622499331961, 0.004016393442622951, 0.004908041859629948] and parameters: {'n_layers': 1, 'embedding_dim': 64, 'lr': 6.58170473616923e-05, 'lambda_val': 0.0006591181316301599, 'batch_size': 1631, 'optimizer': 'Adam'}.
2026-05-23 05:54:00,331 - experiment_functions - INFO - Early stopping at epoch 550. Best Metrics: (0.0671878314461876, 0.039098360655737706, 0.059602903256602585)
2026-05-23 05:54:00,411 - optuna.study.study - INFO - Trial 272 finished with values: [0.0671878314461876, 0.039098360655737706, 0.059602903256602585] and parameters: {'n_layers': 1, 'embedding_dim': 256, 'lr': 0.006832650701048396, 'lambda_val': 0.006058589904744792, 'batch_size': 1503, 'optimizer': 'Adam'}.
2026-05-23 05:54:08,231 - experiment_functions - INFO - Early stopping at epoch 2250. Best Metrics: (0.1134210252486291, 0.054262295081967206, 0.09337898709424547)
2026-05-23 05:54:08,330 - optuna.study.study - INFO - Trial 273 finished with values: [0.1134210252486291, 0.054262295081967206, 0.09337898709424547] and parameters: {'n_layers': 1, 'embedding_dim': 128, 'lr': 0.000360608106860257, 'lambda_val': 6.19406847114503e-05, 'batch_size': 1576, 'optimizer': 'RMSprop'}.
2026-05-23 05:54:14,914 - experiment_functions - INFO - Early stopping at epoch 1250. Best Metrics: (0.08374060189488246, 0.04377049180327869, 0.07419202673238469)
2026-05-23 05:54:15,054 - optuna.study.study - INFO - Trial 274 finished with values: [0.08374060189488246, 0.04377049180327869, 0.07419202673238469] and parameters: {'n_layers': 2, 'embedding_dim': 256, 'lr': 0.000360608106860257, 'lambda_val': 0.00013338361174833875, 'batch_size': 568, 'optimizer': 'RMSprop'}.
2026-05-23 05:54:28,179 - experiment_functions - INFO - Early stopping at epoch 3950. Best Metrics: (0.11547817117884043, 0.058032786885245914, 0.09899703993835278)
2026-05-23 05:54:28,265 - optuna.study.study - INFO - Trial 275 finished with values: [0.11547817117884043, 0.058032786885245914, 0.09899703993835278] and parameters: {'n_layers': 1, 'embedding_dim': 128, 'lr': 0.000360608106860257, 'lambda_val': 0.00016785947403210068, 'batch_size': 1321, 'optimizer': 'RMSprop'}.
2026-05-23 05:54:32,102 - experiment_functions - INFO - Early stopping at epoch 950. Best Metrics: (0.0014829169363555627, 0.002213114754098361, 0.0027987841313241806)
2026-05-23 05:54:32,194 - optuna.study.study - INFO - Trial 276 finished with values: [0.0014829169363555627, 0.002213114754098361, 0.0027987841313241806] and parameters: {'n_layers': 1, 'embedding_dim': 128, 'lr': 2.2532890811576475e-05, 'lambda_val': 1.7408384781052897e-06, 'batch_size': 1321, 'optimizer': 'RMSprop'}.
2026-05-23 05:54:42,301 - experiment_functions - INFO - Early stopping at epoch 3350. Best Metrics: (0.09060441260570452, 0.04909836065573771, 0.0799332730772502)
2026-05-23 05:54:42,521 - optuna.study.study - INFO - Trial 277 finished with values: [0.09060441260570452, 0.04909836065573771, 0.0799332730772502] and parameters: {'n_layers': 1, 'embedding_dim': 32, 'lr': 0.000360608106860257, 'lambda_val': 6.19406847114503e-05, 'batch_size': 1321, 'optimizer': 'Adam'}.
2026-05-23 05:54:54,052 - optuna.study.study - INFO - Trial 278 finished with values: [0.07953223794624982, 0.04721311475409836, 0.07138703309679335] and parameters: {'n_layers': 1, 'embedding_dim': 32, 'lr': 0.000360608106860257, 'lambda_val': 0.00013338361174833875, 'batch_size': 568, 'optimizer': 'Adam'}.
2026-05-23 05:54:56,465 - experiment_functions - INFO - Early stopping at epoch 550. Best Metrics: (0.09806534938527914, 0.0471311475409836, 0.0829838151268726)
2026-05-23 05:54:56,596 - optuna.study.study - INFO - Trial 279 finished with values: [0.09806534938527914, 0.0471311475409836, 0.0829838151268726] and parameters: {'n_layers': 1, 'embedding_dim': 96, 'lr': 0.004748827105127406, 'lambda_val': 0.0006591181316301599, 'batch_size': 2590, 'optimizer': 'Adam'}.
2026-05-23 05:55:02,612 - experiment_functions - INFO - Early stopping at epoch 1600. Best Metrics: (0.12594470210987999, 0.05795081967213115, 0.10053185051865904)
2026-05-23 05:55:03,351 - optuna.study.study - INFO - Trial 280 finished with values: [0.12594470210987999, 0.05795081967213115, 0.10053185051865904] and parameters: {'n_layers': 1, 'embedding_dim': 256, 'lr': 0.0003614258129820434, 'lambda_val': 0.002389697052100668, 'batch_size': 1321, 'optimizer': 'RMSprop'}.
2026-05-23 05:55:11,189 - experiment_functions - INFO - Early stopping at epoch 2700. Best Metrics: (0.06975752242620412, 0.04, 0.06593929127869845)
2026-05-23 05:55:11,261 - optuna.study.study - INFO - Trial 281 finished with values: [0.06975752242620412, 0.04, 0.06593929127869845] and parameters: {'n_layers': 2, 'embedding_dim': 32, 'lr': 0.000360608106860257, 'lambda_val': 0.0016208673244223802, 'batch_size': 2183, 'optimizer': 'Adam'}.
2026-05-23 05:55:14,171 - experiment_functions - INFO - Early stopping at epoch 800. Best Metrics: (0.0021630960170141646, 0.002049180327868853, 0.0029645093194390552)
2026-05-23 05:55:14,302 - optuna.study.study - INFO - Trial 282 finished with values: [0.0021630960170141646, 0.002049180327868853, 0.0029645093194390552] and parameters: {'n_layers': 1, 'embedding_dim': 128, 'lr': 1.1997517802238457e-05, 'lambda_val': 2.691057746425052e-06, 'batch_size': 918, 'optimizer': 'Adam'}.
2026-05-23 05:55:17,351 - experiment_functions - INFO - Early stopping at epoch 600. Best Metrics: (0.06954722952560045, 0.036147540983606556, 0.06087681032240152)
2026-05-23 05:55:18,240 - optuna.study.study - INFO - Trial 283 finished with values: [0.06954722952560045, 0.036147540983606556, 0.06087681032240152] and parameters: {'n_layers': 2, 'embedding_dim': 128, 'lr': 0.002829083470420686, 'lambda_val': 6.19406847114503e-05, 'batch_size': 568, 'optimizer': 'Adam'}.
2026-05-23 05:55:20,619 - experiment_functions - INFO - Early stopping at epoch 650. Best Metrics: (0.07503025503351055, 0.040901639344262296, 0.06835400214220044)
2026-05-23 05:55:20,706 - optuna.study.study - INFO - Trial 284 finished with values: [0.07503025503351055, 0.040901639344262296, 0.06835400214220044] and parameters: {'n_layers': 1, 'embedding_dim': 32, 'lr': 0.0026271984480321668, 'lambda_val': 1.916622569179001e-06, 'batch_size': 1844, 'optimizer': 'RMSprop'}.
2026-05-23 05:55:25,547 - experiment_functions - INFO - Early stopping at epoch 500. Best Metrics: (0.0013743946800535902, 0.0013934426229508198, 0.001546802868542217)
2026-05-23 05:55:26,479 - optuna.study.study - INFO - Trial 285 finished with values: [0.0013743946800535902, 0.0013934426229508198, 0.001546802868542217] and parameters: {'n_layers': 1, 'embedding_dim': 256, 'lr': 0.0002812932486282281, 'lambda_val': 0.00013338361174833875, 'batch_size': 3477, 'optimizer': 'SGD'}.
2026-05-23 05:55:44,466 - optuna.study.study - INFO - Trial 286 finished with values: [0.09719964664422757, 0.05254098360655739, 0.08697458708140755] and parameters: {'n_layers': 1, 'embedding_dim': 64, 'lr': 0.000360608106860257, 'lambda_val': 6.19406847114503e-05, 'batch_size': 1976, 'optimizer': 'RMSprop'}.
2026-05-23 05:55:47,781 - experiment_functions - INFO - Early stopping at epoch 800. Best Metrics: (0.08799113687657698, 0.046885245901639346, 0.07294460195935301)
2026-05-23 05:55:47,867 - optuna.study.study - INFO - Trial 287 finished with values: [0.08799113687657698, 0.046885245901639346, 0.07294460195935301] and parameters: {'n_layers': 1, 'embedding_dim': 128, 'lr': 0.0014897144525931195, 'lambda_val': 1.916622569179001e-06, 'batch_size': 568, 'optimizer': 'RMSprop'}.
2026-05-23 05:55:50,915 - experiment_functions - INFO - Early stopping at epoch 750. Best Metrics: (0.002669357243042834, 0.0022950819672131148, 0.003454666038083737)
2026-05-23 05:55:51,000 - optuna.study.study - INFO - Trial 288 finished with values: [0.002669357243042834, 0.0022950819672131148, 0.003454666038083737] and parameters: {'n_layers': 1, 'embedding_dim': 96, 'lr': 1.9631084421417362e-05, 'lambda_val': 0.00013338361174833875, 'batch_size': 568, 'optimizer': 'Adam'}.
2026-05-23 05:55:53,754 - experiment_functions - INFO - Early stopping at epoch 650. Best Metrics: (0.08515654786280398, 0.044754098360655734, 0.07195411431770708)
2026-05-23 05:55:53,848 - optuna.study.study - INFO - Trial 289 finished with values: [0.08515654786280398, 0.044754098360655734, 0.07195411431770708] and parameters: {'n_layers': 1, 'embedding_dim': 32, 'lr': 0.0026271984480321668, 'lambda_val': 0.0016872549049523802, 'batch_size': 1632, 'optimizer': 'Adam'}.
2026-05-23 05:55:56,100 - experiment_functions - INFO - Early stopping at epoch 550. Best Metrics: (0.037892560876222496, 0.020655737704918034, 0.03277218751019965)
2026-05-23 05:55:56,204 - optuna.study.study - INFO - Trial 290 finished with values: [0.037892560876222496, 0.020655737704918034, 0.03277218751019965] and parameters: {'n_layers': 1, 'embedding_dim': 32, 'lr': 0.013455042943822236, 'lambda_val': 6.19406847114503e-05, 'batch_size': 1976, 'optimizer': 'RMSprop'}.
2026-05-23 05:56:00,133 - experiment_functions - INFO - Early stopping at epoch 850. Best Metrics: (0.0016555775261724176, 0.0018032786885245904, 0.0021863542640407924)
2026-05-23 05:56:00,594 - optuna.study.study - INFO - Trial 291 finished with values: [0.0016555775261724176, 0.0018032786885245904, 0.0021863542640407924] and parameters: {'n_layers': 1, 'embedding_dim': 256, 'lr': 1.6372252849655515e-05, 'lambda_val': 1.7408384781052897e-06, 'batch_size': 3281, 'optimizer': 'RMSprop'}.
2026-05-23 05:56:03,349 - experiment_functions - INFO - Early stopping at epoch 550. Best Metrics: (0.048328967423225185, 0.02442622950819672, 0.036968968073116476)
2026-05-23 05:56:03,490 - optuna.study.study - INFO - Trial 292 finished with values: [0.048328967423225185, 0.02442622950819672, 0.036968968073116476] and parameters: {'n_layers': 1, 'embedding_dim': 64, 'lr': 0.00889050274911736, 'lambda_val': 0.0006655087284319826, 'batch_size': 3257, 'optimizer': 'RMSprop'}.
2026-05-23 05:56:07,462 - experiment_functions - INFO - Early stopping at epoch 1000. Best Metrics: (0.025426871205951104, 0.01557377049180328, 0.024489200472414093)
2026-05-23 05:56:07,778 - optuna.study.study - INFO - Trial 293 finished with values: [0.025426871205951104, 0.01557377049180328, 0.024489200472414093] and parameters: {'n_layers': 1, 'embedding_dim': 128, 'lr': 0.03694214616793761, 'lambda_val': 6.19406847114503e-05, 'batch_size': 1976, 'optimizer': 'RMSprop'}.
2026-05-23 05:56:16,161 - experiment_functions - INFO - Early stopping at epoch 2050. Best Metrics: (0.12249380609769739, 0.056721311475409826, 0.09987342196639967)
2026-05-23 05:56:16,232 - optuna.study.study - INFO - Trial 294 finished with values: [0.12249380609769739, 0.056721311475409826, 0.09987342196639967] and parameters: {'n_layers': 1, 'embedding_dim': 256, 'lr': 0.0003614258129820434, 'lambda_val': 6.19406847114503e-05, 'batch_size': 1794, 'optimizer': 'RMSprop'}.
2026-05-23 05:56:19,202 - experiment_functions - INFO - Early stopping at epoch 600. Best Metrics: (0.07311317799148365, 0.03901639344262295, 0.06646619580142603)
2026-05-23 05:56:19,295 - optuna.study.study - INFO - Trial 295 finished with values: [0.07311317799148365, 0.03901639344262295, 0.06646619580142603] and parameters: {'n_layers': 1, 'embedding_dim': 32, 'lr': 0.006312777493233292, 'lambda_val': 0.002389697052100668, 'batch_size': 925, 'optimizer': 'Adam'}.
2026-05-23 05:56:31,203 - experiment_functions - INFO - Early stopping at epoch 3150. Best Metrics: (0.11214698490769812, 0.056639344262295076, 0.09426754618550338)
2026-05-23 05:56:31,289 - optuna.study.study - INFO - Trial 296 finished with values: [0.11214698490769812, 0.056639344262295076, 0.09426754618550338] and parameters: {'n_layers': 1, 'embedding_dim': 256, 'lr': 0.0003614258129820434, 'lambda_val': 2.691057746425052e-06, 'batch_size': 568, 'optimizer': 'RMSprop'}.
2026-05-23 05:56:47,760 - optuna.study.study - INFO - Trial 297 finished with values: [0.09596888932911406, 0.04860655737704918, 0.07886232976445956] and parameters: {'n_layers': 2, 'embedding_dim': 128, 'lr': 0.000360608106860257, 'lambda_val': 5.5245223326803967e-05, 'batch_size': 568, 'optimizer': 'Adam'}.
2026-05-23 05:56:50,190 - experiment_functions - INFO - Early stopping at epoch 500. Best Metrics: (0.0016263779629970435, 0.0009016393442622952, 0.0010567337978663798)
2026-05-23 05:56:50,271 - optuna.study.study - INFO - Trial 298 finished with values: [0.0016263779629970435, 0.0009016393442622952, 0.0010567337978663798] and parameters: {'n_layers': 1, 'embedding_dim': 96, 'lr': 0.0087991751940927, 'lambda_val': 0.0016208673244223802, 'batch_size': 3100, 'optimizer': 'SGD'}.
2026-05-23 05:56:58,549 - experiment_functions - INFO - Early stopping at epoch 2500. Best Metrics: (0.08978234159940711, 0.0489344262295082, 0.07706712166116567)
2026-05-23 05:56:58,640 - optuna.study.study - INFO - Trial 299 finished with values: [0.08978234159940711, 0.0489344262295082, 0.07706712166116567] and parameters: {'n_layers': 1, 'embedding_dim': 64, 'lr': 0.0003614258129820434, 'lambda_val': 3.093986933167993e-05, 'batch_size': 2283, 'optimizer': 'Adam'}.
2026-05-23 05:56:58,656 - root - INFO - Selected Trial 253 based on Max NDCG: 0.1039
2026-05-23 05:56:58,656 - root - INFO - Associated Recall: 0.1280
2026-05-23 05:56:58,656 - experiment_functions - INFO - Training the best model ... for e_100K_1c1dcs_rand5
2026-05-23 05:57:04,696 - experiment_functions - INFO - Early stopping at epoch 1950. Best Metrics: (0.11321217331655527, 0.05606557377049181, 0.0949328996856287)
2026-05-23 05:57:04,808 - root - INFO - **** Training e_100K_1c2dcs
2026-05-23 05:57:04,808 - root - INFO -   ** 2-Dominant stats:
2026-05-23 05:57:04,808 - root - INFO -   ** Finding the dominant set:
2026-05-23 05:57:29,847 - root - INFO -   ** Getting the trainable edges:
2026-05-23 05:57:29,853 - helper_functions - INFO -      Number of nodes: 4003
2026-05-23 05:57:29,853 - helper_functions - INFO -      Ratio: 0.3873621056706019
2026-05-23 05:57:29,853 - helper_functions - INFO -      Number of unique users: 324
2026-05-23 05:57:29,853 - helper_functions - INFO -      Number of unique items: 3679
2026-05-23 05:57:29,853 - helper_functions - INFO -      Total dominant set edge: 13252
2026-05-23 05:57:29,853 - helper_functions - INFO -      Trainable edges: 10601.6
2026-05-23 05:57:29,856 - root - INFO -   **** Getting 13252 dominant set edges
2026-05-23 05:57:29,971 - optuna.storages._rdb.storage - INFO - A new study created in RDB with name: Study_e_100K_1c2dcs_strict
2026-05-23 05:57:33,243 - experiment_functions - INFO - Early stopping at epoch 850. Best Metrics: (0.004635744303122363, 0.007459016393442624, 0.00794869860641441)
2026-05-23 05:57:34,032 - optuna.study.study - INFO - Trial 0 finished with values: [0.004635744303122363, 0.007459016393442624, 0.00794869860641441] and parameters: {'n_layers': 1, 'embedding_dim': 64, 'lr': 0.0004278261152456948, 'lambda_val': 0.056091222361864104, 'batch_size': 3694, 'optimizer': 'Adam'}.
2026-05-23 05:57:36,507 - experiment_functions - INFO - Early stopping at epoch 500. Best Metrics: (0.0008706959793049952, 0.0013934426229508198, 0.0013151488768184784)
2026-05-23 05:57:36,651 - optuna.study.study - INFO - Trial 1 finished with values: [0.0008706959793049952, 0.0013934426229508198, 0.0013151488768184784] and parameters: {'n_layers': 4, 'embedding_dim': 96, 'lr': 0.0001261402598473239, 'lambda_val': 1.8464356064367715e-06, 'batch_size': 2012, 'optimizer': 'SGD'}.
2026-05-23 05:57:39,110 - experiment_functions - INFO - Early stopping at epoch 500. Best Metrics: (0.0007268934851828131, 0.0009016393442622952, 0.0012648194629146093)
2026-05-23 05:57:39,196 - optuna.study.study - INFO - Trial 2 finished with values: [0.0007268934851828131, 0.0009016393442622952, 0.0012648194629146093] and parameters: {'n_layers': 4, 'embedding_dim': 96, 'lr': 0.09184220685712571, 'lambda_val': 0.010376239999492543, 'batch_size': 1065, 'optimizer': 'Adam'}.
2026-05-23 05:57:41,496 - experiment_functions - INFO - Early stopping at epoch 500. Best Metrics: (0.0026732582183061435, 0.0017213114754098362, 0.002546498974504306)
2026-05-23 05:57:41,585 - optuna.study.study - INFO - Trial 3 finished with values: [0.0026732582183061435, 0.0017213114754098362, 0.002546498974504306] and parameters: {'n_layers': 4, 'embedding_dim': 32, 'lr': 5.558951612286882e-05, 'lambda_val': 0.004070149229762474, 'batch_size': 967, 'optimizer': 'SGD'}.
2026-05-23 05:57:44,004 - experiment_functions - INFO - Early stopping at epoch 500. Best Metrics: (0.0025934605580524585, 0.001967213114754099, 0.0022549259799602914)
2026-05-23 05:57:44,095 - optuna.study.study - INFO - Trial 4 finished with values: [0.0025934605580524585, 0.001967213114754099, 0.0022549259799602914] and parameters: {'n_layers': 3, 'embedding_dim': 32, 'lr': 0.001890263218393761, 'lambda_val': 0.0011044576132309863, 'batch_size': 3249, 'optimizer': 'SGD'}.
2026-05-23 05:57:46,258 - experiment_functions - INFO - Early stopping at epoch 500. Best Metrics: (0.0006990976497428956, 0.0013114754098360656, 0.0012487435902170624)
2026-05-23 05:57:46,344 - optuna.study.study - INFO - Trial 5 finished with values: [0.0006990976497428956, 0.0013114754098360656, 0.0012487435902170624] and parameters: {'n_layers': 1, 'embedding_dim': 64, 'lr': 1.6908002539363483e-05, 'lambda_val': 0.0009917323245238463, 'batch_size': 1078, 'optimizer': 'RMSprop'}.
2026-05-23 05:57:49,166 - experiment_functions - INFO - Early stopping at epoch 500. Best Metrics: (0.002205175269747559, 0.001967213114754099, 0.0025461252511112756)
2026-05-23 05:57:49,265 - optuna.study.study - INFO - Trial 6 finished with values: [0.002205175269747559, 0.001967213114754099, 0.0025461252511112756] and parameters: {'n_layers': 3, 'embedding_dim': 256, 'lr': 0.0014868423202414264, 'lambda_val': 4.409435461756805e-05, 'batch_size': 3335, 'optimizer': 'SGD'}.
2026-05-23 05:57:51,768 - experiment_functions - INFO - Early stopping at epoch 500. Best Metrics: (0.001882784801209864, 0.0014754098360655738, 0.00181858925862753)
2026-05-23 05:57:51,864 - optuna.study.study - INFO - Trial 7 finished with values: [0.001882784801209864, 0.0014754098360655738, 0.00181858925862753] and parameters: {'n_layers': 2, 'embedding_dim': 64, 'lr': 0.0012169182947165634, 'lambda_val': 0.009727287409697284, 'batch_size': 2765, 'optimizer': 'SGD'}.
2026-05-23 05:57:57,408 - experiment_functions - INFO - Early stopping at epoch 950. Best Metrics: (0.0028208353088219817, 0.001967213114754099, 0.002789055440103837)
2026-05-23 05:57:58,146 - optuna.study.study - INFO - Trial 8 finished with values: [0.0028208353088219817, 0.001967213114754099, 0.002789055440103837] and parameters: {'n_layers': 1, 'embedding_dim': 32, 'lr': 0.07452194871664979, 'lambda_val': 0.00012304464175487333, 'batch_size': 3111, 'optimizer': 'SGD'}.
2026-05-23 05:58:17,322 - optuna.study.study - INFO - Trial 9 finished with values: [0.012363077815667225, 0.013852459016393441, 0.01843018716622118] and parameters: {'n_layers': 4, 'embedding_dim': 128, 'lr': 0.00012869980734826536, 'lambda_val': 0.00029292236724190197, 'batch_size': 669, 'optimizer': 'RMSprop'}.
2026-05-23 05:58:19,686 - experiment_functions - INFO - Early stopping at epoch 500. Best Metrics: (0.0012009079354693088, 0.0009836065573770494, 0.0014601522489414)
2026-05-23 05:58:19,766 - optuna.study.study - INFO - Trial 10 finished with values: [0.0012009079354693088, 0.0009836065573770494, 0.0014601522489414] and parameters: {'n_layers': 4, 'embedding_dim': 32, 'lr': 0.02025042949704668, 'lambda_val': 0.00046205926528786217, 'batch_size': 4084, 'optimizer': 'Adam'}.
2026-05-23 05:58:21,917 - experiment_functions - INFO - Early stopping at epoch 500. Best Metrics: (0.0019697838019986248, 0.001639344262295082, 0.0021806897106010346)
2026-05-23 05:58:22,000 - optuna.study.study - INFO - Trial 11 finished with values: [0.0019697838019986248, 0.001639344262295082, 0.0021806897106010346] and parameters: {'n_layers': 2, 'embedding_dim': 64, 'lr': 2.0873496128578238e-05, 'lambda_val': 8.827132755589773e-05, 'batch_size': 2712, 'optimizer': 'Adam'}.
2026-05-23 05:58:24,712 - experiment_functions - INFO - Early stopping at epoch 500. Best Metrics: (0.0019580411202389067, 0.0019672131147540984, 0.0019222591571695763)
