2026-05-20 06:06:39,607 - optuna.study.study - INFO - Trial 76 finished with value: 0.07733127789412689 and parameters: {'n_layers': 1, 'embedding_dim': 128, 'lr': 0.0022541496124975427, 'lambda_val': 1.6740912054038934e-05, 'batch_size': 2065, 'optimizer': 'Adam'}. Best is trial 9 with value: 0.08229338784389838.
2026-05-20 06:06:48,791 - experiment_functions - INFO - Early stopping at epoch 550. Best Recall: 0.0374
2026-05-20 06:06:48,881 - optuna.study.study - INFO - Trial 77 finished with value: 0.03736758040818826 and parameters: {'n_layers': 2, 'embedding_dim': 128, 'lr': 0.001760495551102483, 'lambda_val': 6.764161277332894e-06, 'batch_size': 1047, 'optimizer': 'RMSprop'}. Best is trial 9 with value: 0.08229338784389838.
2026-05-20 06:06:58,279 - experiment_functions - INFO - Early stopping at epoch 600. Best Recall: 0.0695
2026-05-20 06:06:58,412 - optuna.study.study - INFO - Trial 78 finished with value: 0.06948097021506845 and parameters: {'n_layers': 1, 'embedding_dim': 128, 'lr': 0.0046491393396222635, 'lambda_val': 3.608866228215374e-05, 'batch_size': 1504, 'optimizer': 'Adam'}. Best is trial 9 with value: 0.08229338784389838.
2026-05-20 06:07:09,187 - experiment_functions - INFO - Early stopping at epoch 700. Best Recall: 0.0763
2026-05-20 06:07:09,277 - optuna.study.study - INFO - Trial 79 finished with value: 0.07628524414563251 and parameters: {'n_layers': 1, 'embedding_dim': 128, 'lr': 0.001427979038104636, 'lambda_val': 2.3526487068113407e-06, 'batch_size': 1771, 'optimizer': 'Adam'}. Best is trial 9 with value: 0.08229338784389838.
2026-05-20 06:07:17,988 - experiment_functions - INFO - Early stopping at epoch 550. Best Recall: 0.0679
2026-05-20 06:07:18,067 - optuna.study.study - INFO - Trial 80 finished with value: 0.06790507013132199 and parameters: {'n_layers': 1, 'embedding_dim': 96, 'lr': 0.01180470770712797, 'lambda_val': 1.4110166048343055e-05, 'batch_size': 1903, 'optimizer': 'Adam'}. Best is trial 9 with value: 0.08229338784389838.
2026-05-20 06:07:27,168 - experiment_functions - INFO - Early stopping at epoch 600. Best Recall: 0.0797
2026-05-20 06:07:27,324 - optuna.study.study - INFO - Trial 81 finished with value: 0.07972376350592553 and parameters: {'n_layers': 1, 'embedding_dim': 128, 'lr': 0.0029145244631231157, 'lambda_val': 8.579784551944116e-06, 'batch_size': 2212, 'optimizer': 'Adam'}. Best is trial 9 with value: 0.08229338784389838.
2026-05-20 06:07:36,502 - experiment_functions - INFO - Early stopping at epoch 600. Best Recall: 0.0771
2026-05-20 06:07:36,591 - optuna.study.study - INFO - Trial 82 finished with value: 0.07705285839911703 and parameters: {'n_layers': 1, 'embedding_dim': 128, 'lr': 0.003045416605080939, 'lambda_val': 7.912763001606849e-06, 'batch_size': 2323, 'optimizer': 'Adam'}. Best is trial 9 with value: 0.08229338784389838.
2026-05-20 06:07:45,495 - experiment_functions - INFO - Early stopping at epoch 550. Best Recall: 0.0695
2026-05-20 06:07:45,801 - optuna.study.study - INFO - Trial 83 finished with value: 0.06951933993044532 and parameters: {'n_layers': 1, 'embedding_dim': 128, 'lr': 0.005622006603828787, 'lambda_val': 8.68027634117278e-06, 'batch_size': 2490, 'optimizer': 'Adam'}. Best is trial 9 with value: 0.08229338784389838.
2026-05-20 06:08:02,718 - optuna.study._optimize - INFO - Trial 84 pruned. 
2026-05-20 06:08:15,476 - experiment_functions - INFO - Early stopping at epoch 850. Best Recall: 0.0766
2026-05-20 06:08:15,566 - optuna.study.study - INFO - Trial 85 finished with value: 0.07662703719069093 and parameters: {'n_layers': 1, 'embedding_dim': 128, 'lr': 0.0007660410321688316, 'lambda_val': 2.099742332973152e-05, 'batch_size': 2028, 'optimizer': 'Adam'}. Best is trial 9 with value: 0.08229338784389838.
2026-05-20 06:08:26,499 - experiment_functions - INFO - Early stopping at epoch 750. Best Recall: 0.0630
2026-05-20 06:08:27,021 - optuna.study.study - INFO - Trial 86 finished with value: 0.06297181469970185 and parameters: {'n_layers': 1, 'embedding_dim': 32, 'lr': 0.0014527486844964892, 'lambda_val': 2.4111781258291708e-06, 'batch_size': 2765, 'optimizer': 'Adam'}. Best is trial 9 with value: 0.08229338784389838.
2026-05-20 06:08:37,299 - experiment_functions - INFO - Early stopping at epoch 700. Best Recall: 0.0798
2026-05-20 06:08:37,389 - optuna.study.study - INFO - Trial 87 finished with value: 0.07984720943375666 and parameters: {'n_layers': 1, 'embedding_dim': 64, 'lr': 0.0012211340779453323, 'lambda_val': 0.0001467256950969197, 'batch_size': 2248, 'optimizer': 'Adam'}. Best is trial 9 with value: 0.08229338784389838.
2026-05-20 06:08:52,809 - experiment_functions - INFO - Early stopping at epoch 500. Best Recall: 0.0048
2026-05-20 06:08:52,889 - optuna.study.study - INFO - Trial 88 finished with value: 0.004798739874775855 and parameters: {'n_layers': 1, 'embedding_dim': 64, 'lr': 0.0012164072294674803, 'lambda_val': 0.0001703677148939095, 'batch_size': 2611, 'optimizer': 'SGD'}. Best is trial 9 with value: 0.08229338784389838.
2026-05-20 06:09:03,246 - experiment_functions - INFO - Early stopping at epoch 650. Best Recall: 0.0846
2026-05-20 06:09:03,337 - optuna.study.study - INFO - Trial 89 finished with value: 0.08459424154465081 and parameters: {'n_layers': 1, 'embedding_dim': 64, 'lr': 0.001970702625354657, 'lambda_val': 0.00012256254889685887, 'batch_size': 2345, 'optimizer': 'Adam'}. Best is trial 89 with value: 0.08459424154465081.
2026-05-20 06:09:12,074 - experiment_functions - INFO - Early stopping at epoch 550. Best Recall: 0.0616
2026-05-20 06:09:12,154 - optuna.study.study - INFO - Trial 90 finished with value: 0.061640372903848446 and parameters: {'n_layers': 1, 'embedding_dim': 64, 'lr': 0.002087039453599193, 'lambda_val': 4.1153804373762534e-05, 'batch_size': 2483, 'optimizer': 'RMSprop'}. Best is trial 89 with value: 0.08459424154465081.
2026-05-20 06:09:21,243 - experiment_functions - INFO - Early stopping at epoch 600. Best Recall: 0.0710
2026-05-20 06:09:21,332 - optuna.study.study - INFO - Trial 91 finished with value: 0.07104417264457202 and parameters: {'n_layers': 1, 'embedding_dim': 64, 'lr': 0.0026353820291278008, 'lambda_val': 0.0001293525662274334, 'batch_size': 2331, 'optimizer': 'Adam'}. Best is trial 89 with value: 0.08459424154465081.
2026-05-20 06:09:31,908 - experiment_functions - INFO - Early stopping at epoch 700. Best Recall: 0.0820
2026-05-20 06:09:31,999 - optuna.study.study - INFO - Trial 92 finished with value: 0.08201310595439565 and parameters: {'n_layers': 1, 'embedding_dim': 64, 'lr': 0.0012351699478781945, 'lambda_val': 0.00023162772312732629, 'batch_size': 2249, 'optimizer': 'Adam'}. Best is trial 89 with value: 0.08459424154465081.
2026-05-20 06:09:45,973 - experiment_functions - INFO - Early stopping at epoch 900. Best Recall: 0.0842
2026-05-20 06:09:46,311 - optuna.study.study - INFO - Trial 93 finished with value: 0.08418246012027834 and parameters: {'n_layers': 1, 'embedding_dim': 64, 'lr': 0.0007817613249623882, 'lambda_val': 0.00022894844829869637, 'batch_size': 2087, 'optimizer': 'Adam'}. Best is trial 89 with value: 0.08459424154465081.
2026-05-20 06:09:59,736 - experiment_functions - INFO - Early stopping at epoch 900. Best Recall: 0.0779
2026-05-20 06:09:59,837 - optuna.study.study - INFO - Trial 94 finished with value: 0.0778515382127498 and parameters: {'n_layers': 1, 'embedding_dim': 64, 'lr': 0.0007103421929455305, 'lambda_val': 0.0002341484161955351, 'batch_size': 2092, 'optimizer': 'Adam'}. Best is trial 89 with value: 0.08459424154465081.
2026-05-20 06:10:14,807 - experiment_functions - INFO - Early stopping at epoch 1000. Best Recall: 0.0756
2026-05-20 06:10:14,897 - optuna.study.study - INFO - Trial 95 finished with value: 0.07563575375629349 and parameters: {'n_layers': 1, 'embedding_dim': 64, 'lr': 0.000561535287670893, 'lambda_val': 9.5261983548498e-05, 'batch_size': 2663, 'optimizer': 'Adam'}. Best is trial 89 with value: 0.08459424154465081.
2026-05-20 06:10:26,586 - experiment_functions - INFO - Early stopping at epoch 800. Best Recall: 0.0802
2026-05-20 06:10:27,096 - optuna.study.study - INFO - Trial 96 finished with value: 0.08020534675948032 and parameters: {'n_layers': 1, 'embedding_dim': 64, 'lr': 0.0009559611930955067, 'lambda_val': 0.00048392757649758187, 'batch_size': 2415, 'optimizer': 'Adam'}. Best is trial 89 with value: 0.08459424154465081.
2026-05-20 06:10:38,260 - experiment_functions - INFO - Early stopping at epoch 750. Best Recall: 0.0713
2026-05-20 06:10:38,363 - optuna.study.study - INFO - Trial 97 finished with value: 0.0713041127480889 and parameters: {'n_layers': 1, 'embedding_dim': 64, 'lr': 0.000896181226902151, 'lambda_val': 0.0012863623936691393, 'batch_size': 2401, 'optimizer': 'Adam'}. Best is trial 89 with value: 0.08459424154465081.
2026-05-20 06:10:49,627 - experiment_functions - INFO - Early stopping at epoch 750. Best Recall: 0.0713
2026-05-20 06:10:49,717 - optuna.study.study - INFO - Trial 98 finished with value: 0.0713213698253883 and parameters: {'n_layers': 1, 'embedding_dim': 64, 'lr': 0.0010715190519517334, 'lambda_val': 0.0008203307770423102, 'batch_size': 2533, 'optimizer': 'Adam'}. Best is trial 89 with value: 0.08459424154465081.
2026-05-20 06:11:08,945 - experiment_functions - INFO - Early stopping at epoch 650. Best Recall: 0.0763
2026-05-20 06:11:09,045 - optuna.study.study - INFO - Trial 99 finished with value: 0.07632747137062489 and parameters: {'n_layers': 1, 'embedding_dim': 64, 'lr': 0.0016820547476566136, 'lambda_val': 0.0005289328002014309, 'batch_size': 2335, 'optimizer': 'Adam'}. Best is trial 89 with value: 0.08459424154465081.
2026-05-20 06:11:33,105 - experiment_functions - INFO - Early stopping at epoch 1650. Best Recall: 0.0739
2026-05-20 06:11:33,227 - optuna.study.study - INFO - Trial 100 finished with value: 0.07387298941415074 and parameters: {'n_layers': 1, 'embedding_dim': 64, 'lr': 0.0003166741990125774, 'lambda_val': 0.0019220495058425964, 'batch_size': 2783, 'optimizer': 'Adam'}. Best is trial 89 with value: 0.08459424154465081.
2026-05-20 06:11:52,670 - experiment_functions - INFO - Early stopping at epoch 1350. Best Recall: 0.0800
2026-05-20 06:11:52,761 - optuna.study.study - INFO - Trial 101 finished with value: 0.07999752470122679 and parameters: {'n_layers': 1, 'embedding_dim': 64, 'lr': 0.0004019777477775436, 'lambda_val': 0.00034384617010012537, 'batch_size': 2113, 'optimizer': 'Adam'}. Best is trial 89 with value: 0.08459424154465081.
2026-05-20 06:12:11,362 - experiment_functions - INFO - Early stopping at epoch 1300. Best Recall: 0.0763
2026-05-20 06:12:11,451 - optuna.study.study - INFO - Trial 102 finished with value: 0.07629177479774782 and parameters: {'n_layers': 1, 'embedding_dim': 64, 'lr': 0.0004032273033339247, 'lambda_val': 0.00021780097181145198, 'batch_size': 2145, 'optimizer': 'Adam'}. Best is trial 89 with value: 0.08459424154465081.
2026-05-20 06:12:25,761 - experiment_functions - INFO - Early stopping at epoch 1000. Best Recall: 0.0718
2026-05-20 06:12:25,851 - optuna.study.study - INFO - Trial 103 finished with value: 0.07179253027369346 and parameters: {'n_layers': 1, 'embedding_dim': 64, 'lr': 0.000548924144088187, 'lambda_val': 0.0003318656956745827, 'batch_size': 2429, 'optimizer': 'Adam'}. Best is trial 89 with value: 0.08459424154465081.
2026-05-20 06:12:46,249 - experiment_functions - INFO - Early stopping at epoch 950. Best Recall: 0.0773
2026-05-20 06:12:47,015 - optuna.study.study - INFO - Trial 104 finished with value: 0.07734729498662403 and parameters: {'n_layers': 1, 'embedding_dim': 64, 'lr': 0.0007611280626630938, 'lambda_val': 0.00011417023692017621, 'batch_size': 1958, 'optimizer': 'Adam'}. Best is trial 89 with value: 0.08459424154465081.
2026-05-20 06:12:58,980 - experiment_functions - INFO - Early stopping at epoch 650. Best Recall: 0.0828
2026-05-20 06:12:59,070 - optuna.study.study - INFO - Trial 105 finished with value: 0.08282401111284757 and parameters: {'n_layers': 1, 'embedding_dim': 64, 'lr': 0.001915509008363426, 'lambda_val': 0.000457659612148385, 'batch_size': 2229, 'optimizer': 'Adam'}. Best is trial 89 with value: 0.08459424154465081.
2026-05-20 06:13:06,396 - experiment_functions - INFO - Early stopping at epoch 500. Best Recall: 0.0056
2026-05-20 06:13:06,486 - optuna.study.study - INFO - Trial 106 finished with value: 0.005595290630311381 and parameters: {'n_layers': 1, 'embedding_dim': 64, 'lr': 0.0013267591796246312, 'lambda_val': 0.0005342828947732333, 'batch_size': 2273, 'optimizer': 'SGD'}. Best is trial 89 with value: 0.08459424154465081.
2026-05-20 06:13:16,142 - experiment_functions - INFO - Early stopping at epoch 650. Best Recall: 0.0744
2026-05-20 06:13:16,232 - optuna.study.study - INFO - Trial 107 finished with value: 0.07440088566250774 and parameters: {'n_layers': 1, 'embedding_dim': 64, 'lr': 0.0017264238606261495, 'lambda_val': 0.0001904315288504811, 'batch_size': 2341, 'optimizer': 'Adam'}. Best is trial 89 with value: 0.08459424154465081.
2026-05-20 06:13:26,265 - experiment_functions - INFO - Early stopping at epoch 650. Best Recall: 0.0742
2026-05-20 06:13:26,411 - optuna.study.study - INFO - Trial 108 finished with value: 0.07422789344017698 and parameters: {'n_layers': 1, 'embedding_dim': 64, 'lr': 0.0020440336908036125, 'lambda_val': 0.0007267700164661069, 'batch_size': 2694, 'optimizer': 'Adam'}. Best is trial 89 with value: 0.08459424154465081.
2026-05-20 06:13:37,764 - experiment_functions - INFO - Early stopping at epoch 750. Best Recall: 0.0774
2026-05-20 06:13:37,855 - optuna.study.study - INFO - Trial 109 finished with value: 0.07738164696211171 and parameters: {'n_layers': 1, 'embedding_dim': 96, 'lr': 0.0008972882271683812, 'lambda_val': 0.00042810444790885633, 'batch_size': 2608, 'optimizer': 'Adam'}. Best is trial 89 with value: 0.08459424154465081.
2026-05-20 06:13:51,797 - optuna.study._optimize - INFO - Trial 110 pruned. 
2026-05-20 06:14:05,864 - optuna.study._optimize - INFO - Trial 111 pruned. 
2026-05-20 06:14:22,429 - experiment_functions - INFO - Early stopping at epoch 1200. Best Recall: 0.0813
2026-05-20 06:14:22,518 - optuna.study.study - INFO - Trial 112 finished with value: 0.08131387122445934 and parameters: {'n_layers': 1, 'embedding_dim': 64, 'lr': 0.0004457813136241459, 'lambda_val': 0.0009416843982434578, 'batch_size': 2239, 'optimizer': 'Adam'}. Best is trial 89 with value: 0.08459424154465081.
2026-05-20 06:14:33,154 - experiment_functions - INFO - Early stopping at epoch 750. Best Recall: 0.0721
2026-05-20 06:14:33,244 - optuna.study.study - INFO - Trial 113 finished with value: 0.07214682824364527 and parameters: {'n_layers': 1, 'embedding_dim': 64, 'lr': 0.0010179489707717664, 'lambda_val': 0.0010867424906874177, 'batch_size': 2453, 'optimizer': 'Adam'}. Best is trial 89 with value: 0.08459424154465081.
2026-05-20 06:14:42,694 - experiment_functions - INFO - Early stopping at epoch 650. Best Recall: 0.0731
2026-05-20 06:14:42,819 - optuna.study.study - INFO - Trial 114 finished with value: 0.0730507035292374 and parameters: {'n_layers': 1, 'embedding_dim': 32, 'lr': 0.0024144148674463445, 'lambda_val': 0.0004886773923485248, 'batch_size': 2239, 'optimizer': 'Adam'}. Best is trial 89 with value: 0.08459424154465081.
2026-05-20 06:15:07,204 - experiment_functions - INFO - Early stopping at epoch 1100. Best Recall: 0.0751
2026-05-20 06:15:07,294 - optuna.study.study - INFO - Trial 115 finished with value: 0.07508938327293752 and parameters: {'n_layers': 1, 'embedding_dim': 64, 'lr': 0.0004742819284287108, 'lambda_val': 0.001018787678844763, 'batch_size': 2179, 'optimizer': 'Adam'}. Best is trial 89 with value: 0.08459424154465081.
2026-05-20 06:15:20,068 - experiment_functions - INFO - Early stopping at epoch 800. Best Recall: 0.0758
2026-05-20 06:15:20,158 - optuna.study.study - INFO - Trial 116 finished with value: 0.07575907210362798 and parameters: {'n_layers': 1, 'embedding_dim': 256, 'lr': 0.0007492226986206735, 'lambda_val': 0.0006095160367718751, 'batch_size': 2400, 'optimizer': 'Adam'}. Best is trial 89 with value: 0.08459424154465081.
2026-05-20 06:15:33,944 - experiment_functions - INFO - Early stopping at epoch 950. Best Recall: 0.0727
2026-05-20 06:15:34,034 - optuna.study.study - INFO - Trial 117 finished with value: 0.07265516573338868 and parameters: {'n_layers': 1, 'embedding_dim': 64, 'lr': 0.0006140816202736208, 'lambda_val': 0.00354984359110074, 'batch_size': 2295, 'optimizer': 'Adam'}. Best is trial 89 with value: 0.08459424154465081.
2026-05-20 06:15:43,690 - experiment_functions - INFO - Early stopping at epoch 650. Best Recall: 0.0712
2026-05-20 06:15:43,779 - optuna.study.study - INFO - Trial 118 finished with value: 0.07117675460061233 and parameters: {'n_layers': 1, 'embedding_dim': 64, 'lr': 0.00153310066363821, 'lambda_val': 0.0008675508842184162, 'batch_size': 2526, 'optimizer': 'Adam'}. Best is trial 89 with value: 0.08459424154465081.
2026-05-20 06:15:54,093 - experiment_functions - INFO - Early stopping at epoch 650. Best Recall: 0.0733
2026-05-20 06:15:54,183 - optuna.study.study - INFO - Trial 119 finished with value: 0.07329779441891202 and parameters: {'n_layers': 1, 'embedding_dim': 256, 'lr': 0.0019181245234117473, 'lambda_val': 0.0016242475711337242, 'batch_size': 1984, 'optimizer': 'Adam'}. Best is trial 89 with value: 0.08459424154465081.
2026-05-20 06:16:03,153 - experiment_functions - INFO - Early stopping at epoch 600. Best Recall: 0.0784
2026-05-20 06:16:03,253 - optuna.study.study - INFO - Trial 120 finished with value: 0.07839655857280736 and parameters: {'n_layers': 1, 'embedding_dim': 64, 'lr': 0.0033881382970775927, 'lambda_val': 0.00022247403389739077, 'batch_size': 2220, 'optimizer': 'Adam'}. Best is trial 89 with value: 0.08459424154465081.
2026-05-20 06:16:23,238 - experiment_functions - INFO - Early stopping at epoch 1400. Best Recall: 0.0756
2026-05-20 06:16:23,407 - optuna.study.study - INFO - Trial 121 finished with value: 0.07557512277068658 and parameters: {'n_layers': 1, 'embedding_dim': 64, 'lr': 0.00038318521631118524, 'lambda_val': 0.00028832578212644, 'batch_size': 2116, 'optimizer': 'Adam'}. Best is trial 89 with value: 0.08459424154465081.
2026-05-20 06:16:34,484 - experiment_functions - INFO - Early stopping at epoch 750. Best Recall: 0.0851
2026-05-20 06:16:34,576 - optuna.study.study - INFO - Trial 122 finished with value: 0.08511865658067046 and parameters: {'n_layers': 1, 'embedding_dim': 64, 'lr': 0.0011236892462375048, 'lambda_val': 0.00038280417126887337, 'batch_size': 2358, 'optimizer': 'Adam'}. Best is trial 122 with value: 0.08511865658067046.
2026-05-20 06:16:46,593 - experiment_functions - INFO - Early stopping at epoch 750. Best Recall: 0.0812
2026-05-20 06:16:46,728 - optuna.study.study - INFO - Trial 123 finished with value: 0.08123199248816862 and parameters: {'n_layers': 1, 'embedding_dim': 64, 'lr': 0.0011072055061843275, 'lambda_val': 0.00043622113457662175, 'batch_size': 2360, 'optimizer': 'Adam'}. Best is trial 122 with value: 0.08511865658067046.
2026-05-20 06:16:58,351 - experiment_functions - INFO - Early stopping at epoch 750. Best Recall: 0.0763
2026-05-20 06:16:58,440 - optuna.study.study - INFO - Trial 124 finished with value: 0.07625949290186294 and parameters: {'n_layers': 1, 'embedding_dim': 64, 'lr': 0.0011958416597501716, 'lambda_val': 0.0001647574609206043, 'batch_size': 2298, 'optimizer': 'Adam'}. Best is trial 122 with value: 0.08511865658067046.
2026-05-20 06:17:07,678 - experiment_functions - INFO - Early stopping at epoch 600. Best Recall: 0.0765
2026-05-20 06:17:07,757 - optuna.study.study - INFO - Trial 125 finished with value: 0.07646117788838376 and parameters: {'n_layers': 1, 'embedding_dim': 96, 'lr': 0.002598216592912957, 'lambda_val': 0.0003815885899867181, 'batch_size': 2358, 'optimizer': 'Adam'}. Best is trial 122 with value: 0.08511865658067046.
2026-05-20 06:17:17,439 - experiment_functions - INFO - Early stopping at epoch 700. Best Recall: 0.0055
2026-05-20 06:17:17,528 - optuna.study.study - INFO - Trial 126 finished with value: 0.005452509487563044 and parameters: {'n_layers': 1, 'embedding_dim': 64, 'lr': 1.2636071614797103e-05, 'lambda_val': 0.0006777239188363007, 'batch_size': 2497, 'optimizer': 'Adam'}. Best is trial 122 with value: 0.08511865658067046.
2026-05-20 06:17:26,564 - experiment_functions - INFO - Early stopping at epoch 550. Best Recall: 0.0644
2026-05-20 06:17:26,654 - optuna.study.study - INFO - Trial 127 finished with value: 0.0643792748840625 and parameters: {'n_layers': 1, 'embedding_dim': 256, 'lr': 0.004483539513625877, 'lambda_val': 0.0026803388367535688, 'batch_size': 1075, 'optimizer': 'Adam'}. Best is trial 122 with value: 0.08511865658067046.
2026-05-20 06:17:33,871 - experiment_functions - INFO - Early stopping at epoch 500. Best Recall: 0.0048
2026-05-20 06:17:34,236 - optuna.study.study - INFO - Trial 128 finished with value: 0.004788849599693468 and parameters: {'n_layers': 1, 'embedding_dim': 32, 'lr': 0.0013383321043431199, 'lambda_val': 0.00012760477819928975, 'batch_size': 1822, 'optimizer': 'SGD'}. Best is trial 122 with value: 0.08511865658067046.
2026-05-20 06:17:44,685 - experiment_functions - INFO - Early stopping at epoch 650. Best Recall: 0.0725
2026-05-20 06:17:44,774 - optuna.study.study - INFO - Trial 129 finished with value: 0.07252066322939475 and parameters: {'n_layers': 1, 'embedding_dim': 64, 'lr': 0.002219844138777998, 'lambda_val': 0.00019979643948512575, 'batch_size': 2029, 'optimizer': 'Adam'}. Best is trial 122 with value: 0.08511865658067046.
2026-05-20 06:17:54,780 - experiment_functions - INFO - Early stopping at epoch 600. Best Recall: 0.0505
