2026-05-20 00:17:12,683 - optuna.study.study - INFO - Trial 25 finished with value: 0.0051807047465850155 and parameters: {'n_layers': 2, 'embedding_dim': 256, 'lr': 0.001375504671807144, 'lambda_val': 0.0004651036588891638, 'batch_size': 1638, 'optimizer': 'SGD'}. Best is trial 23 with value: 0.026090444651601846.
2026-05-20 00:17:24,349 - experiment_functions - INFO - Early stopping at epoch 850. Best Recall: 0.0052
2026-05-20 00:17:24,427 - optuna.study.study - INFO - Trial 26 finished with value: 0.005189716941865633 and parameters: {'n_layers': 1, 'embedding_dim': 256, 'lr': 3.6584161789091904e-05, 'lambda_val': 0.0036625654532098768, 'batch_size': 791, 'optimizer': 'Adam'}. Best is trial 23 with value: 0.026090444651601846.
2026-05-20 00:17:32,271 - experiment_functions - INFO - Early stopping at epoch 550. Best Recall: 0.0209
2026-05-20 00:17:32,362 - optuna.study.study - INFO - Trial 27 finished with value: 0.020903777157101722 and parameters: {'n_layers': 2, 'embedding_dim': 256, 'lr': 0.0012061861826884416, 'lambda_val': 0.002106151506686237, 'batch_size': 1218, 'optimizer': 'Adam'}. Best is trial 23 with value: 0.026090444651601846.
2026-05-20 00:17:45,691 - optuna.study._optimize - INFO - Trial 28 pruned. 
2026-05-20 00:18:01,098 - experiment_functions - INFO - Early stopping at epoch 1150. Best Recall: 0.0266
2026-05-20 00:18:01,188 - optuna.study.study - INFO - Trial 29 finished with value: 0.02663440909153695 and parameters: {'n_layers': 1, 'embedding_dim': 256, 'lr': 0.0004571632935040404, 'lambda_val': 5.859304548495896e-06, 'batch_size': 1016, 'optimizer': 'Adam'}. Best is trial 29 with value: 0.02663440909153695.
2026-05-20 00:18:08,295 - experiment_functions - INFO - Early stopping at epoch 500. Best Recall: 0.0057
2026-05-20 00:18:08,393 - optuna.study.study - INFO - Trial 30 finished with value: 0.005664028261413262 and parameters: {'n_layers': 1, 'embedding_dim': 256, 'lr': 0.00038284205669908525, 'lambda_val': 7.0219442341188775e-06, 'batch_size': 1225, 'optimizer': 'SGD'}. Best is trial 29 with value: 0.02663440909153695.
2026-05-20 00:18:19,418 - experiment_functions - INFO - Early stopping at epoch 800. Best Recall: 0.0271
2026-05-20 00:18:19,519 - optuna.study.study - INFO - Trial 31 finished with value: 0.027145168755111266 and parameters: {'n_layers': 1, 'embedding_dim': 256, 'lr': 0.0006123567950621453, 'lambda_val': 5.2779483100365813e-05, 'batch_size': 948, 'optimizer': 'Adam'}. Best is trial 31 with value: 0.027145168755111266.
2026-05-20 00:18:29,946 - experiment_functions - INFO - Early stopping at epoch 750. Best Recall: 0.0261
2026-05-20 00:18:30,045 - optuna.study.study - INFO - Trial 32 finished with value: 0.02612014983089216 and parameters: {'n_layers': 1, 'embedding_dim': 256, 'lr': 0.0006307445234992025, 'lambda_val': 4.3729382871464e-05, 'batch_size': 1613, 'optimizer': 'Adam'}. Best is trial 31 with value: 0.027145168755111266.
2026-05-20 00:18:40,949 - experiment_functions - INFO - Early stopping at epoch 750. Best Recall: 0.0257
2026-05-20 00:18:41,038 - optuna.study.study - INFO - Trial 33 finished with value: 0.025673600218019833 and parameters: {'n_layers': 1, 'embedding_dim': 256, 'lr': 0.0007156622696024331, 'lambda_val': 4.5303380578580264e-05, 'batch_size': 1537, 'optimizer': 'Adam'}. Best is trial 31 with value: 0.027145168755111266.
2026-05-20 00:18:48,949 - experiment_functions - INFO - Early stopping at epoch 550. Best Recall: 0.0247
2026-05-20 00:18:49,059 - optuna.study.study - INFO - Trial 34 finished with value: 0.02471604660158979 and parameters: {'n_layers': 1, 'embedding_dim': 256, 'lr': 0.002094055785133343, 'lambda_val': 4.1505444282209216e-06, 'batch_size': 1724, 'optimizer': 'Adam'}. Best is trial 31 with value: 0.027145168755111266.
2026-05-20 00:19:06,660 - experiment_functions - INFO - Early stopping at epoch 1350. Best Recall: 0.0273
2026-05-20 00:19:06,757 - optuna.study.study - INFO - Trial 35 finished with value: 0.027270384207374515 and parameters: {'n_layers': 1, 'embedding_dim': 256, 'lr': 0.0003973748010317229, 'lambda_val': 2.411303267670809e-06, 'batch_size': 625, 'optimizer': 'Adam'}. Best is trial 35 with value: 0.027270384207374515.
2026-05-20 00:19:18,727 - experiment_functions - INFO - Early stopping at epoch 850. Best Recall: 0.0271
2026-05-20 00:19:18,847 - optuna.study.study - INFO - Trial 36 finished with value: 0.02712601607316195 and parameters: {'n_layers': 1, 'embedding_dim': 256, 'lr': 0.0006956399540069129, 'lambda_val': 1.1104963555139472e-06, 'batch_size': 532, 'optimizer': 'RMSprop'}. Best is trial 35 with value: 0.027270384207374515.
2026-05-20 00:19:55,677 - experiment_functions - INFO - Early stopping at epoch 3000. Best Recall: 0.0309
2026-05-20 00:19:55,784 - optuna.study.study - INFO - Trial 37 finished with value: 0.030943974763693986 and parameters: {'n_layers': 1, 'embedding_dim': 32, 'lr': 0.0003738343727253439, 'lambda_val': 1.1756455219138224e-06, 'batch_size': 532, 'optimizer': 'RMSprop'}. Best is trial 37 with value: 0.030943974763693986.
2026-05-20 00:20:52,795 - optuna.study.study - INFO - Trial 38 finished with value: 0.03034990830315366 and parameters: {'n_layers': 1, 'embedding_dim': 32, 'lr': 0.0002972258920845796, 'lambda_val': 1.8972920107936485e-06, 'batch_size': 566, 'optimizer': 'RMSprop'}. Best is trial 37 with value: 0.030943974763693986.
2026-05-20 00:21:35,932 - experiment_functions - INFO - Early stopping at epoch 3650. Best Recall: 0.0305
2026-05-20 00:21:36,022 - optuna.study.study - INFO - Trial 39 finished with value: 0.03050919853575996 and parameters: {'n_layers': 1, 'embedding_dim': 32, 'lr': 0.00033735669061700166, 'lambda_val': 2.2661908940057825e-06, 'batch_size': 755, 'optimizer': 'RMSprop'}. Best is trial 37 with value: 0.030943974763693986.
2026-05-20 00:21:53,267 - optuna.study._optimize - INFO - Trial 40 pruned. 
2026-05-20 00:22:05,584 - optuna.study._optimize - INFO - Trial 41 pruned. 
2026-05-20 00:22:23,107 - optuna.study._optimize - INFO - Trial 42 pruned. 
2026-05-20 00:22:39,239 - optuna.study._optimize - INFO - Trial 43 pruned. 
2026-05-20 00:22:46,797 - experiment_functions - INFO - Early stopping at epoch 550. Best Recall: 0.0262
2026-05-20 00:22:46,876 - optuna.study.study - INFO - Trial 44 finished with value: 0.026243331844440675 and parameters: {'n_layers': 1, 'embedding_dim': 32, 'lr': 0.0018454758870425983, 'lambda_val': 4.313335461214651e-06, 'batch_size': 891, 'optimizer': 'RMSprop'}. Best is trial 37 with value: 0.030943974763693986.
2026-05-20 00:22:53,801 - experiment_functions - INFO - Early stopping at epoch 500. Best Recall: 0.0061
2026-05-20 00:22:53,891 - optuna.study.study - INFO - Trial 45 finished with value: 0.006071139239935045 and parameters: {'n_layers': 1, 'embedding_dim': 32, 'lr': 4.2784473585302555e-05, 'lambda_val': 1.3316333182855269e-05, 'batch_size': 3969, 'optimizer': 'RMSprop'}. Best is trial 37 with value: 0.030943974763693986.
2026-05-20 00:23:06,820 - optuna.study._optimize - INFO - Trial 46 pruned. 
2026-05-20 00:23:20,381 - optuna.study._optimize - INFO - Trial 47 pruned. 
2026-05-20 00:23:38,450 - optuna.study._optimize - INFO - Trial 48 pruned. 
2026-05-20 00:23:45,657 - experiment_functions - INFO - Early stopping at epoch 500. Best Recall: 0.0047
2026-05-20 00:23:45,747 - optuna.study.study - INFO - Trial 49 finished with value: 0.004672359420222975 and parameters: {'n_layers': 4, 'embedding_dim': 64, 'lr': 0.0034599414708616585, 'lambda_val': 3.013805642301533e-06, 'batch_size': 944, 'optimizer': 'RMSprop'}. Best is trial 37 with value: 0.030943974763693986.
2026-05-20 00:24:17,947 - experiment_functions - INFO - Early stopping at epoch 2550. Best Recall: 0.0303
2026-05-20 00:24:18,047 - optuna.study.study - INFO - Trial 50 finished with value: 0.03029334006119583 and parameters: {'n_layers': 1, 'embedding_dim': 32, 'lr': 0.0005029554478324645, 'lambda_val': 1.0410887614730562e-05, 'batch_size': 512, 'optimizer': 'RMSprop'}. Best is trial 37 with value: 0.030943974763693986.
2026-05-20 00:24:36,667 - optuna.study._optimize - INFO - Trial 51 pruned. 
2026-05-20 00:25:00,455 - experiment_functions - INFO - Early stopping at epoch 1950. Best Recall: 0.0306
2026-05-20 00:25:00,565 - optuna.study.study - INFO - Trial 52 finished with value: 0.030557791211559174 and parameters: {'n_layers': 1, 'embedding_dim': 32, 'lr': 0.0005223984008927951, 'lambda_val': 3.0080386570616304e-05, 'batch_size': 683, 'optimizer': 'RMSprop'}. Best is trial 37 with value: 0.030943974763693986.
2026-05-20 00:25:13,549 - optuna.study._optimize - INFO - Trial 53 pruned. 
2026-05-20 00:25:30,382 - optuna.study._optimize - INFO - Trial 54 pruned. 
2026-05-20 00:25:48,334 - optuna.study._optimize - INFO - Trial 55 pruned. 
2026-05-20 00:25:56,207 - experiment_functions - INFO - Early stopping at epoch 550. Best Recall: 0.0073
2026-05-20 00:25:56,286 - optuna.study.study - INFO - Trial 56 finished with value: 0.007307907816319289 and parameters: {'n_layers': 1, 'embedding_dim': 32, 'lr': 0.0025852967762502134, 'lambda_val': 1.3435870934092938e-06, 'batch_size': 3502, 'optimizer': 'RMSprop'}. Best is trial 37 with value: 0.030943974763693986.
2026-05-20 00:26:05,050 - experiment_functions - INFO - Early stopping at epoch 600. Best Recall: 0.0247
2026-05-20 00:26:05,151 - optuna.study.study - INFO - Trial 57 finished with value: 0.024698898210758463 and parameters: {'n_layers': 1, 'embedding_dim': 128, 'lr': 0.0008607775260361323, 'lambda_val': 5.684169290835155e-06, 'batch_size': 2485, 'optimizer': 'RMSprop'}. Best is trial 37 with value: 0.030943974763693986.
2026-05-20 00:26:22,698 - optuna.study._optimize - INFO - Trial 58 pruned. 
2026-05-20 00:26:36,821 - optuna.study._optimize - INFO - Trial 59 pruned. 
2026-05-20 00:26:43,962 - experiment_functions - INFO - Early stopping at epoch 500. Best Recall: 0.0051
2026-05-20 00:26:44,052 - optuna.study.study - INFO - Trial 60 finished with value: 0.0051237745514882286 and parameters: {'n_layers': 1, 'embedding_dim': 32, 'lr': 0.0005042893267699385, 'lambda_val': 0.03142987232324769, 'batch_size': 831, 'optimizer': 'SGD'}. Best is trial 37 with value: 0.030943974763693986.
2026-05-20 00:27:02,048 - optuna.study._optimize - INFO - Trial 61 pruned. 
2026-05-20 00:27:20,960 - optuna.study._optimize - INFO - Trial 62 pruned. 
2026-05-20 00:27:40,613 - experiment_functions - INFO - Early stopping at epoch 1100. Best Recall: 0.0289
2026-05-20 00:27:41,386 - optuna.study.study - INFO - Trial 63 finished with value: 0.028886875829993705 and parameters: {'n_layers': 1, 'embedding_dim': 128, 'lr': 0.0006331761544879393, 'lambda_val': 1.6909484986369206e-06, 'batch_size': 517, 'optimizer': 'RMSprop'}. Best is trial 37 with value: 0.030943974763693986.
2026-05-20 00:27:55,065 - experiment_functions - INFO - Early stopping at epoch 550. Best Recall: 0.0254
2026-05-20 00:27:55,187 - optuna.study.study - INFO - Trial 64 finished with value: 0.025415609830601125 and parameters: {'n_layers': 1, 'embedding_dim': 128, 'lr': 0.001411130688948899, 'lambda_val': 1.8445734373367242e-06, 'batch_size': 531, 'optimizer': 'RMSprop'}. Best is trial 37 with value: 0.030943974763693986.
2026-05-20 00:28:02,657 - experiment_functions - INFO - Early stopping at epoch 500. Best Recall: 0.0066
2026-05-20 00:28:02,747 - optuna.study.study - INFO - Trial 65 finished with value: 0.006589514028369856 and parameters: {'n_layers': 1, 'embedding_dim': 128, 'lr': 0.09577828985673595, 'lambda_val': 4.937511807394893e-06, 'batch_size': 842, 'optimizer': 'RMSprop'}. Best is trial 37 with value: 0.030943974763693986.
2026-05-20 00:28:20,581 - optuna.study._optimize - INFO - Trial 66 pruned. 
2026-05-20 00:28:34,895 - optuna.study._optimize - INFO - Trial 67 pruned. 
2026-05-20 00:28:42,427 - experiment_functions - INFO - Early stopping at epoch 500. Best Recall: 0.0048
2026-05-20 00:28:42,527 - optuna.study.study - INFO - Trial 68 finished with value: 0.0047543907626640585 and parameters: {'n_layers': 1, 'embedding_dim': 96, 'lr': 0.0010322294279468426, 'lambda_val': 1.630974288302374e-06, 'batch_size': 786, 'optimizer': 'SGD'}. Best is trial 37 with value: 0.030943974763693986.
2026-05-20 00:28:49,753 - experiment_functions - INFO - Early stopping at epoch 500. Best Recall: 0.0047
2026-05-20 00:28:49,854 - optuna.study.study - INFO - Trial 69 finished with value: 0.004698839496252019 and parameters: {'n_layers': 2, 'embedding_dim': 32, 'lr': 0.02851289118472601, 'lambda_val': 2.9871508674108742e-06, 'batch_size': 618, 'optimizer': 'RMSprop'}. Best is trial 37 with value: 0.030943974763693986.
2026-05-20 00:28:58,998 - experiment_functions - INFO - Early stopping at epoch 650. Best Recall: 0.0258
2026-05-20 00:28:59,089 - optuna.study.study - INFO - Trial 70 finished with value: 0.025761816572271803 and parameters: {'n_layers': 1, 'embedding_dim': 64, 'lr': 0.0007504064109702278, 'lambda_val': 8.752277521880612e-06, 'batch_size': 1947, 'optimizer': 'RMSprop'}. Best is trial 37 with value: 0.030943974763693986.
2026-05-20 00:29:15,938 - optuna.study._optimize - INFO - Trial 71 pruned. 
2026-05-20 00:29:32,457 - optuna.study._optimize - INFO - Trial 72 pruned. 
2026-05-20 00:29:45,753 - optuna.study._optimize - INFO - Trial 73 pruned. 
2026-05-20 00:29:52,876 - experiment_functions - INFO - Early stopping at epoch 500. Best Recall: 0.0045
2026-05-20 00:29:52,975 - optuna.study.study - INFO - Trial 74 finished with value: 0.004498386486169705 and parameters: {'n_layers': 1, 'embedding_dim': 32, 'lr': 0.0004579288735526801, 'lambda_val': 3.167323677024146e-05, 'batch_size': 903, 'optimizer': 'SGD'}. Best is trial 37 with value: 0.030943974763693986.
2026-05-20 00:30:09,689 - optuna.study._optimize - INFO - Trial 75 pruned. 
2026-05-20 00:30:18,666 - experiment_functions - INFO - Early stopping at epoch 600. Best Recall: 0.0108
2026-05-20 00:30:18,756 - optuna.study.study - INFO - Trial 76 finished with value: 0.010822979830259963 and parameters: {'n_layers': 4, 'embedding_dim': 96, 'lr': 0.0005763309079009771, 'lambda_val': 0.0001942859911277389, 'batch_size': 517, 'optimizer': 'RMSprop'}. Best is trial 37 with value: 0.030943974763693986.
2026-05-20 00:30:27,511 - experiment_functions - INFO - Early stopping at epoch 600. Best Recall: 0.0252
2026-05-20 00:30:27,602 - optuna.study.study - INFO - Trial 77 finished with value: 0.02516396956987581 and parameters: {'n_layers': 1, 'embedding_dim': 256, 'lr': 0.0017388720766822084, 'lambda_val': 6.301089956695188e-06, 'batch_size': 1040, 'optimizer': 'Adam'}. Best is trial 37 with value: 0.030943974763693986.
2026-05-20 00:30:36,370 - experiment_functions - INFO - Early stopping at epoch 600. Best Recall: 0.0245
2026-05-20 00:30:36,505 - optuna.study.study - INFO - Trial 78 finished with value: 0.024503411239353796 and parameters: {'n_layers': 1, 'embedding_dim': 32, 'lr': 0.0011596317928845264, 'lambda_val': 2.2431278534363633e-06, 'batch_size': 1169, 'optimizer': 'RMSprop'}. Best is trial 37 with value: 0.030943974763693986.
2026-05-20 00:30:50,169 - optuna.study._optimize - INFO - Trial 79 pruned. 
2026-05-20 00:30:59,296 - experiment_functions - INFO - Early stopping at epoch 550. Best Recall: 0.0195
2026-05-20 00:30:59,404 - optuna.study.study - INFO - Trial 80 finished with value: 0.01949742450743153 and parameters: {'n_layers': 2, 'embedding_dim': 256, 'lr': 0.0008228557740530696, 'lambda_val': 1.4157357472511792e-06, 'batch_size': 624, 'optimizer': 'RMSprop'}. Best is trial 37 with value: 0.030943974763693986.
2026-05-20 00:31:10,705 - experiment_functions - INFO - Early stopping at epoch 800. Best Recall: 0.0264
2026-05-20 00:31:10,794 - optuna.study.study - INFO - Trial 81 finished with value: 0.026392100149761368 and parameters: {'n_layers': 1, 'embedding_dim': 256, 'lr': 0.0006883503650847855, 'lambda_val': 1.0958218235854027e-06, 'batch_size': 512, 'optimizer': 'RMSprop'}. Best is trial 37 with value: 0.030943974763693986.
2026-05-20 00:31:27,682 - optuna.study._optimize - INFO - Trial 82 pruned. 
2026-05-20 00:31:49,306 - optuna.study._optimize - INFO - Trial 83 pruned. 
2026-05-20 00:32:03,615 - experiment_functions - INFO - Early stopping at epoch 1050. Best Recall: 0.0274
2026-05-20 00:32:03,705 - optuna.study.study - INFO - Trial 84 finished with value: 0.02738070498116719 and parameters: {'n_layers': 1, 'embedding_dim': 256, 'lr': 0.0005990747967808456, 'lambda_val': 1.0747477445058518e-05, 'batch_size': 580, 'optimizer': 'RMSprop'}. Best is trial 37 with value: 0.030943974763693986.
2026-05-20 00:32:21,283 - optuna.study._optimize - INFO - Trial 85 pruned. 
2026-05-20 00:32:34,016 - optuna.study._optimize - INFO - Trial 86 pruned. 
2026-05-20 00:32:46,333 - experiment_functions - INFO - Early stopping at epoch 950. Best Recall: 0.0268
2026-05-20 00:32:46,423 - optuna.study.study - INFO - Trial 87 finished with value: 0.02675624369410084 and parameters: {'n_layers': 1, 'embedding_dim': 64, 'lr': 0.0005680896547652508, 'lambda_val': 1.9088064584593035e-05, 'batch_size': 963, 'optimizer': 'Adam'}. Best is trial 37 with value: 0.030943974763693986.
2026-05-20 00:32:55,020 - experiment_functions - INFO - Early stopping at epoch 600. Best Recall: 0.0219
2026-05-20 00:32:55,110 - optuna.study.study - INFO - Trial 88 finished with value: 0.021918858563687662 and parameters: {'n_layers': 1, 'embedding_dim': 32, 'lr': 0.0010400425922993592, 'lambda_val': 6.953675533920826e-06, 'batch_size': 2772, 'optimizer': 'RMSprop'}. Best is trial 37 with value: 0.030943974763693986.
2026-05-20 00:33:02,676 - experiment_functions - INFO - Early stopping at epoch 500. Best Recall: 0.0055
2026-05-20 00:33:02,863 - optuna.study.study - INFO - Trial 89 finished with value: 0.005487208081370339 and parameters: {'n_layers': 3, 'embedding_dim': 256, 'lr': 0.0004498822859950973, 'lambda_val': 4.965567977253082e-06, 'batch_size': 1115, 'optimizer': 'SGD'}. Best is trial 37 with value: 0.030943974763693986.
2026-05-20 00:33:09,635 - experiment_functions - INFO - Early stopping at epoch 500. Best Recall: 0.0038
2026-05-20 00:33:09,726 - optuna.study.study - INFO - Trial 90 finished with value: 0.0038368772658559547 and parameters: {'n_layers': 1, 'embedding_dim': 32, 'lr': 0.010728590719756619, 'lambda_val': 8.334485998806681e-05, 'batch_size': 847, 'optimizer': 'RMSprop'}. Best is trial 37 with value: 0.030943974763693986.
2026-05-20 00:33:19,978 - experiment_functions - INFO - Early stopping at epoch 750. Best Recall: 0.0269
2026-05-20 00:33:20,078 - optuna.study.study - INFO - Trial 91 finished with value: 0.026858825831357805 and parameters: {'n_layers': 1, 'embedding_dim': 256, 'lr': 0.0006400365312833566, 'lambda_val': 0.00013618469192496987, 'batch_size': 603, 'optimizer': 'RMSprop'}. Best is trial 37 with value: 0.030943974763693986.
2026-05-20 00:33:31,083 - experiment_functions - INFO - Early stopping at epoch 750. Best Recall: 0.0271
2026-05-20 00:33:31,184 - optuna.study.study - INFO - Trial 92 finished with value: 0.027130268426431344 and parameters: {'n_layers': 1, 'embedding_dim': 256, 'lr': 0.0007780633819196352, 'lambda_val': 2.0663344080181565e-06, 'batch_size': 695, 'optimizer': 'RMSprop'}. Best is trial 37 with value: 0.030943974763693986.
2026-05-20 00:33:40,223 - experiment_functions - INFO - Early stopping at epoch 650. Best Recall: 0.0251
2026-05-20 00:33:40,312 - optuna.study.study - INFO - Trial 93 finished with value: 0.02507356977651471 and parameters: {'n_layers': 1, 'embedding_dim': 256, 'lr': 0.0008140700971274147, 'lambda_val': 0.0003070336474874666, 'batch_size': 690, 'optimizer': 'RMSprop'}. Best is trial 37 with value: 0.030943974763693986.
2026-05-20 00:33:48,080 - experiment_functions - INFO - Early stopping at epoch 550. Best Recall: 0.0234
2026-05-20 00:33:48,208 - optuna.study.study - INFO - Trial 94 finished with value: 0.02340563340325238 and parameters: {'n_layers': 1, 'embedding_dim': 256, 'lr': 0.0015275962759174685, 'lambda_val': 1.8176176295347186e-06, 'batch_size': 797, 'optimizer': 'RMSprop'}. Best is trial 37 with value: 0.030943974763693986.
2026-05-20 00:34:06,491 - optuna.study._optimize - INFO - Trial 95 pruned. 
2026-05-20 00:34:15,422 - experiment_functions - INFO - Early stopping at epoch 650. Best Recall: 0.0274
2026-05-20 00:34:15,512 - optuna.study.study - INFO - Trial 96 finished with value: 0.027395951722724216 and parameters: {'n_layers': 1, 'embedding_dim': 32, 'lr': 0.002166252621555664, 'lambda_val': 2.6593723828488874e-06, 'batch_size': 681, 'optimizer': 'Adam'}. Best is trial 37 with value: 0.030943974763693986.
2026-05-20 00:34:29,364 - optuna.study._optimize - INFO - Trial 97 pruned. 
2026-05-20 00:34:38,518 - experiment_functions - INFO - Early stopping at epoch 650. Best Recall: 0.0281
2026-05-20 00:34:38,618 - optuna.study.study - INFO - Trial 98 finished with value: 0.02814896603266469 and parameters: {'n_layers': 1, 'embedding_dim': 32, 'lr': 0.0023680197873060657, 'lambda_val': 2.39566215241549e-06, 'batch_size': 752, 'optimizer': 'Adam'}. Best is trial 37 with value: 0.030943974763693986.
2026-05-20 00:34:46,827 - experiment_functions - INFO - Early stopping at epoch 600. Best Recall: 0.0279
2026-05-20 00:34:46,926 - optuna.study.study - INFO - Trial 99 finished with value: 0.027920450813378336 and parameters: {'n_layers': 1, 'embedding_dim': 32, 'lr': 0.0028179378044623877, 'lambda_val': 2.4736126084922607e-06, 'batch_size': 757, 'optimizer': 'Adam'}. Best is trial 37 with value: 0.030943974763693986.
2026-05-20 00:34:54,145 - experiment_functions - INFO - Early stopping at epoch 550. Best Recall: 0.0266
