2026-05-20 07:52:57,547 - optuna.study.study - INFO - Trial 48 finished with value: 0.0047819570027017545 and parameters: {'n_layers': 4, 'embedding_dim': 128, 'lr': 0.0034037479116029463, 'lambda_val': 0.002475989707209052, 'batch_size': 861, 'optimizer': 'RMSprop'}. Best is trial 13 with value: 0.059658272796593706.
2026-05-20 07:53:10,505 - optuna.study._optimize - INFO - Trial 49 pruned. 
2026-05-20 07:53:35,066 - experiment_functions - INFO - Early stopping at epoch 1900. Best Recall: 0.0534
2026-05-20 07:53:35,167 - optuna.study.study - INFO - Trial 50 finished with value: 0.05339496047279455 and parameters: {'n_layers': 1, 'embedding_dim': 128, 'lr': 0.00017396687698966766, 'lambda_val': 0.0010187408281291525, 'batch_size': 1574, 'optimizer': 'Adam'}. Best is trial 13 with value: 0.059658272796593706.
2026-05-20 07:53:45,454 - experiment_functions - INFO - Early stopping at epoch 750. Best Recall: 0.0573
2026-05-20 07:53:45,532 - optuna.study.study - INFO - Trial 51 finished with value: 0.05725927029456903 and parameters: {'n_layers': 1, 'embedding_dim': 128, 'lr': 0.0006696263531651722, 'lambda_val': 0.00033380140207895433, 'batch_size': 1308, 'optimizer': 'Adam'}. Best is trial 13 with value: 0.059658272796593706.
2026-05-20 07:54:02,524 - experiment_functions - INFO - Early stopping at epoch 1250. Best Recall: 0.0586
2026-05-20 07:54:02,614 - optuna.study.study - INFO - Trial 52 finished with value: 0.05861323064198653 and parameters: {'n_layers': 1, 'embedding_dim': 128, 'lr': 0.00030763515322457724, 'lambda_val': 0.00019586536230623244, 'batch_size': 667, 'optimizer': 'Adam'}. Best is trial 13 with value: 0.059658272796593706.
2026-05-20 07:54:11,780 - experiment_functions - INFO - Early stopping at epoch 650. Best Recall: 0.0583
2026-05-20 07:54:11,858 - optuna.study.study - INFO - Trial 53 finished with value: 0.058257941275196914 and parameters: {'n_layers': 1, 'embedding_dim': 128, 'lr': 0.0014951245316767421, 'lambda_val': 0.00024920284064089713, 'batch_size': 995, 'optimizer': 'Adam'}. Best is trial 13 with value: 0.059658272796593706.
2026-05-20 07:54:24,794 - optuna.study._optimize - INFO - Trial 54 pruned. 
2026-05-20 07:54:32,581 - experiment_functions - INFO - Early stopping at epoch 550. Best Recall: 0.0605
2026-05-20 07:54:32,670 - optuna.study.study - INFO - Trial 55 finished with value: 0.0605065726098669 and parameters: {'n_layers': 1, 'embedding_dim': 64, 'lr': 0.004764187243772577, 'lambda_val': 9.43664535634689e-05, 'batch_size': 782, 'optimizer': 'Adam'}. Best is trial 55 with value: 0.0605065726098669.
2026-05-20 07:54:40,100 - experiment_functions - INFO - Early stopping at epoch 500. Best Recall: 0.0051
2026-05-20 07:54:40,199 - optuna.study.study - INFO - Trial 56 finished with value: 0.005104338140167793 and parameters: {'n_layers': 2, 'embedding_dim': 64, 'lr': 0.005121441369210445, 'lambda_val': 7.963129174808455e-05, 'batch_size': 782, 'optimizer': 'RMSprop'}. Best is trial 55 with value: 0.0605065726098669.
2026-05-20 07:54:48,124 - experiment_functions - INFO - Early stopping at epoch 550. Best Recall: 0.0492
2026-05-20 07:54:48,231 - optuna.study.study - INFO - Trial 57 finished with value: 0.049164604485844296 and parameters: {'n_layers': 1, 'embedding_dim': 64, 'lr': 0.009856892150854326, 'lambda_val': 2.165336380880648e-05, 'batch_size': 517, 'optimizer': 'Adam'}. Best is trial 55 with value: 0.0605065726098669.
2026-05-20 07:54:56,143 - experiment_functions - INFO - Early stopping at epoch 550. Best Recall: 0.0351
2026-05-20 07:54:56,252 - optuna.study.study - INFO - Trial 58 finished with value: 0.03514753612820981 and parameters: {'n_layers': 1, 'embedding_dim': 64, 'lr': 0.002637294578489, 'lambda_val': 7.595559886070182e-06, 'batch_size': 993, 'optimizer': 'RMSprop'}. Best is trial 55 with value: 0.0605065726098669.
2026-05-20 07:55:03,971 - experiment_functions - INFO - Early stopping at epoch 550. Best Recall: 0.0500
2026-05-20 07:55:04,061 - optuna.study.study - INFO - Trial 59 finished with value: 0.05001520228714241 and parameters: {'n_layers': 2, 'embedding_dim': 64, 'lr': 0.003969136309627603, 'lambda_val': 3.80935886028273e-05, 'batch_size': 791, 'optimizer': 'Adam'}. Best is trial 55 with value: 0.0605065726098669.
2026-05-20 07:55:11,561 - experiment_functions - INFO - Early stopping at epoch 500. Best Recall: 0.0043
2026-05-20 07:55:11,763 - optuna.study.study - INFO - Trial 60 finished with value: 0.004315299057080928 and parameters: {'n_layers': 1, 'embedding_dim': 96, 'lr': 0.018175397547783332, 'lambda_val': 0.00010395161650055904, 'batch_size': 910, 'optimizer': 'RMSprop'}. Best is trial 55 with value: 0.0605065726098669.
2026-05-20 07:55:19,252 - experiment_functions - INFO - Early stopping at epoch 550. Best Recall: 0.0510
2026-05-20 07:55:19,341 - optuna.study.study - INFO - Trial 61 finished with value: 0.05096396077105497 and parameters: {'n_layers': 1, 'embedding_dim': 128, 'lr': 0.006811745492673899, 'lambda_val': 0.00025671873868169867, 'batch_size': 1126, 'optimizer': 'Adam'}. Best is trial 55 with value: 0.0605065726098669.
2026-05-20 07:55:31,016 - experiment_functions - INFO - Early stopping at epoch 850. Best Recall: 0.0577
2026-05-20 07:55:31,141 - optuna.study.study - INFO - Trial 62 finished with value: 0.05774539355464529 and parameters: {'n_layers': 1, 'embedding_dim': 128, 'lr': 0.000466110117767163, 'lambda_val': 6.593086362583194e-05, 'batch_size': 1328, 'optimizer': 'Adam'}. Best is trial 55 with value: 0.0605065726098669.
2026-05-20 07:55:39,972 - experiment_functions - INFO - Early stopping at epoch 600. Best Recall: 0.0583
2026-05-20 07:55:40,062 - optuna.study.study - INFO - Trial 63 finished with value: 0.05833327964644298 and parameters: {'n_layers': 1, 'embedding_dim': 128, 'lr': 0.0021424873885543595, 'lambda_val': 0.0005188515794129909, 'batch_size': 634, 'optimizer': 'Adam'}. Best is trial 55 with value: 0.0605065726098669.
2026-05-20 07:55:55,166 - experiment_functions - INFO - Early stopping at epoch 1100. Best Recall: 0.0530
2026-05-20 07:55:55,266 - optuna.study.study - INFO - Trial 64 finished with value: 0.053042255933317545 and parameters: {'n_layers': 1, 'embedding_dim': 256, 'lr': 0.0002629491084506851, 'lambda_val': 0.00014410345378471326, 'batch_size': 1559, 'optimizer': 'Adam'}. Best is trial 55 with value: 0.0605065726098669.
2026-05-20 07:56:04,901 - experiment_functions - INFO - Early stopping at epoch 500. Best Recall: 0.0054
2026-05-20 07:56:05,678 - optuna.study.study - INFO - Trial 65 finished with value: 0.005427450407769303 and parameters: {'n_layers': 1, 'embedding_dim': 128, 'lr': 0.001192054803435574, 'lambda_val': 2.122399812364181e-06, 'batch_size': 997, 'optimizer': 'SGD'}. Best is trial 55 with value: 0.0605065726098669.
2026-05-20 07:56:21,949 - experiment_functions - INFO - Early stopping at epoch 750. Best Recall: 0.0588
2026-05-20 07:56:22,050 - optuna.study.study - INFO - Trial 66 finished with value: 0.05878628889942271 and parameters: {'n_layers': 1, 'embedding_dim': 96, 'lr': 0.0008014852703457281, 'lambda_val': 4.9469199306309626e-05, 'batch_size': 831, 'optimizer': 'Adam'}. Best is trial 55 with value: 0.0605065726098669.
2026-05-20 07:56:35,457 - optuna.study._optimize - INFO - Trial 67 pruned. 
2026-05-20 07:56:43,204 - experiment_functions - INFO - Early stopping at epoch 550. Best Recall: 0.0285
2026-05-20 07:56:43,293 - optuna.study.study - INFO - Trial 68 finished with value: 0.028475656550011882 and parameters: {'n_layers': 3, 'embedding_dim': 96, 'lr': 0.003913019762749656, 'lambda_val': 3.195131597208814e-05, 'batch_size': 776, 'optimizer': 'Adam'}. Best is trial 55 with value: 0.0605065726098669.
2026-05-20 07:56:56,402 - optuna.study._optimize - INFO - Trial 69 pruned. 
2026-05-20 07:57:13,366 - optuna.study._optimize - INFO - Trial 70 pruned. 
2026-05-20 07:57:23,060 - experiment_functions - INFO - Early stopping at epoch 700. Best Recall: 0.0573
2026-05-20 07:57:23,193 - optuna.study.study - INFO - Trial 71 finished with value: 0.057282994762015815 and parameters: {'n_layers': 1, 'embedding_dim': 64, 'lr': 0.000834979665557003, 'lambda_val': 0.00010885964693010932, 'batch_size': 1219, 'optimizer': 'Adam'}. Best is trial 55 with value: 0.0605065726098669.
2026-05-20 07:57:33,439 - experiment_functions - INFO - Early stopping at epoch 750. Best Recall: 0.0491
2026-05-20 07:57:33,539 - optuna.study.study - INFO - Trial 72 finished with value: 0.04912205273478689 and parameters: {'n_layers': 1, 'embedding_dim': 96, 'lr': 0.0005737942896710597, 'lambda_val': 0.000212003627652324, 'batch_size': 3263, 'optimizer': 'Adam'}. Best is trial 55 with value: 0.0605065726098669.
2026-05-20 07:57:46,813 - optuna.study._optimize - INFO - Trial 73 pruned. 
2026-05-20 07:57:57,141 - experiment_functions - INFO - Early stopping at epoch 750. Best Recall: 0.0605
2026-05-20 07:57:57,289 - optuna.study.study - INFO - Trial 74 finished with value: 0.06051849676418247 and parameters: {'n_layers': 1, 'embedding_dim': 32, 'lr': 0.0011982730732012215, 'lambda_val': 0.00031062595429148777, 'batch_size': 697, 'optimizer': 'Adam'}. Best is trial 74 with value: 0.06051849676418247.
2026-05-20 07:58:05,893 - experiment_functions - INFO - Early stopping at epoch 600. Best Recall: 0.0574
2026-05-20 07:58:05,971 - optuna.study.study - INFO - Trial 75 finished with value: 0.05739771638218796 and parameters: {'n_layers': 1, 'embedding_dim': 32, 'lr': 0.002559942458432334, 'lambda_val': 0.00013537204720102087, 'batch_size': 694, 'optimizer': 'Adam'}. Best is trial 74 with value: 0.06051849676418247.
2026-05-20 07:58:15,325 - experiment_functions - INFO - Early stopping at epoch 650. Best Recall: 0.0510
2026-05-20 07:58:15,458 - optuna.study.study - INFO - Trial 76 finished with value: 0.05104422273371042 and parameters: {'n_layers': 1, 'embedding_dim': 32, 'lr': 0.0013709251084513677, 'lambda_val': 0.0004185562747438778, 'batch_size': 921, 'optimizer': 'RMSprop'}. Best is trial 74 with value: 0.06051849676418247.
2026-05-20 07:58:23,435 - experiment_functions - INFO - Early stopping at epoch 600. Best Recall: 0.0052
2026-05-20 07:58:23,524 - optuna.study.study - INFO - Trial 77 finished with value: 0.005218095508165879 and parameters: {'n_layers': 1, 'embedding_dim': 32, 'lr': 2.3384509239085967e-05, 'lambda_val': 2.4768014211170104e-05, 'batch_size': 611, 'optimizer': 'Adam'}. Best is trial 74 with value: 0.06051849676418247.
2026-05-20 07:58:30,428 - experiment_functions - INFO - Early stopping at epoch 500. Best Recall: 0.0052
2026-05-20 07:58:30,517 - optuna.study.study - INFO - Trial 78 finished with value: 0.005190672345555284 and parameters: {'n_layers': 1, 'embedding_dim': 32, 'lr': 0.006574671303838632, 'lambda_val': 5.2806217640847295e-05, 'batch_size': 1018, 'optimizer': 'SGD'}. Best is trial 74 with value: 0.06051849676418247.
2026-05-20 07:58:50,679 - experiment_functions - INFO - Early stopping at epoch 750. Best Recall: 0.0487
2026-05-20 07:58:51,457 - optuna.study.study - INFO - Trial 79 finished with value: 0.04866531432839192 and parameters: {'n_layers': 2, 'embedding_dim': 256, 'lr': 0.00036034126682227, 'lambda_val': 0.0008392351111866872, 'batch_size': 785, 'optimizer': 'RMSprop'}. Best is trial 74 with value: 0.06051849676418247.
2026-05-20 07:58:59,904 - experiment_functions - INFO - Early stopping at epoch 600. Best Recall: 0.0569
2026-05-20 07:59:00,005 - optuna.study.study - INFO - Trial 80 finished with value: 0.05685331272981706 and parameters: {'n_layers': 1, 'embedding_dim': 96, 'lr': 0.0021850876816911875, 'lambda_val': 0.0003096280382275489, 'batch_size': 851, 'optimizer': 'Adam'}. Best is trial 74 with value: 0.06051849676418247.
2026-05-20 07:59:08,983 - experiment_functions - INFO - Early stopping at epoch 650. Best Recall: 0.0572
2026-05-20 07:59:09,073 - optuna.study.study - INFO - Trial 81 finished with value: 0.05724524100384368 and parameters: {'n_layers': 1, 'embedding_dim': 128, 'lr': 0.0009622211653349633, 'lambda_val': 0.0006122579894299274, 'batch_size': 1161, 'optimizer': 'Adam'}. Best is trial 74 with value: 0.06051849676418247.
2026-05-20 07:59:19,150 - experiment_functions - INFO - Early stopping at epoch 750. Best Recall: 0.0597
2026-05-20 07:59:19,239 - optuna.study.study - INFO - Trial 82 finished with value: 0.05972213948478434 and parameters: {'n_layers': 1, 'embedding_dim': 128, 'lr': 0.0007776596640985118, 'lambda_val': 0.0013880331014955347, 'batch_size': 697, 'optimizer': 'Adam'}. Best is trial 74 with value: 0.06051849676418247.
2026-05-20 08:00:03,237 - experiment_functions - INFO - Early stopping at epoch 3650. Best Recall: 0.0602
2026-05-20 08:00:03,380 - optuna.study.study - INFO - Trial 83 finished with value: 0.06024973329309854 and parameters: {'n_layers': 1, 'embedding_dim': 128, 'lr': 0.00016984584722030355, 'lambda_val': 0.0013364058027790008, 'batch_size': 580, 'optimizer': 'Adam'}. Best is trial 74 with value: 0.06051849676418247.
2026-05-20 08:00:30,647 - optuna.study._optimize - INFO - Trial 84 pruned. 
2026-05-20 08:00:51,307 - experiment_functions - INFO - Early stopping at epoch 1600. Best Recall: 0.0575
2026-05-20 08:00:51,453 - optuna.study.study - INFO - Trial 85 finished with value: 0.05747608904781111 and parameters: {'n_layers': 1, 'embedding_dim': 128, 'lr': 0.0002415745072894834, 'lambda_val': 0.0013967361143448944, 'batch_size': 601, 'optimizer': 'Adam'}. Best is trial 74 with value: 0.06051849676418247.
2026-05-20 08:01:04,031 - optuna.study._optimize - INFO - Trial 86 pruned. 
2026-05-20 08:01:12,401 - experiment_functions - INFO - Early stopping at epoch 600. Best Recall: 0.0586
2026-05-20 08:01:12,490 - optuna.study.study - INFO - Trial 87 finished with value: 0.05859056658943206 and parameters: {'n_layers': 1, 'embedding_dim': 128, 'lr': 0.0017660818711237346, 'lambda_val': 0.0014024138252017983, 'batch_size': 573, 'optimizer': 'Adam'}. Best is trial 74 with value: 0.06051849676418247.
2026-05-20 08:01:26,279 - optuna.study._optimize - INFO - Trial 88 pruned. 
2026-05-20 08:01:34,391 - experiment_functions - INFO - Early stopping at epoch 550. Best Recall: 0.0579
2026-05-20 08:01:34,481 - optuna.study.study - INFO - Trial 89 finished with value: 0.05786052577254414 and parameters: {'n_layers': 1, 'embedding_dim': 128, 'lr': 0.0035440264305937968, 'lambda_val': 0.0004579283169262506, 'batch_size': 513, 'optimizer': 'Adam'}. Best is trial 74 with value: 0.06051849676418247.
2026-05-20 08:01:47,877 - optuna.study._optimize - INFO - Trial 90 pruned. 
2026-05-20 08:01:58,369 - experiment_functions - INFO - Early stopping at epoch 750. Best Recall: 0.0574
2026-05-20 08:01:58,459 - optuna.study.study - INFO - Trial 91 finished with value: 0.05741673288244604 and parameters: {'n_layers': 1, 'embedding_dim': 128, 'lr': 0.0007343154096335471, 'lambda_val': 0.0007002235999206861, 'batch_size': 831, 'optimizer': 'Adam'}. Best is trial 74 with value: 0.06051849676418247.
2026-05-20 08:02:11,866 - experiment_functions - INFO - Early stopping at epoch 950. Best Recall: 0.0604
2026-05-20 08:02:11,954 - optuna.study.study - INFO - Trial 92 finished with value: 0.06044156086412782 and parameters: {'n_layers': 1, 'embedding_dim': 128, 'lr': 0.0005281158839978074, 'lambda_val': 0.0001723797923133119, 'batch_size': 651, 'optimizer': 'Adam'}. Best is trial 74 with value: 0.06051849676418247.
2026-05-20 08:02:22,547 - experiment_functions - INFO - Early stopping at epoch 750. Best Recall: 0.0536
2026-05-20 08:02:22,642 - optuna.study.study - INFO - Trial 93 finished with value: 0.05356763338362204 and parameters: {'n_layers': 1, 'embedding_dim': 128, 'lr': 0.0005418367038215383, 'lambda_val': 0.0010861412465299747, 'batch_size': 3025, 'optimizer': 'Adam'}. Best is trial 74 with value: 0.06051849676418247.
2026-05-20 08:02:31,710 - experiment_functions - INFO - Early stopping at epoch 600. Best Recall: 0.0308
2026-05-20 08:02:31,818 - optuna.study.study - INFO - Trial 94 finished with value: 0.030824935237323377 and parameters: {'n_layers': 1, 'embedding_dim': 128, 'lr': 0.0011893595803394298, 'lambda_val': 0.008667012554354675, 'batch_size': 4087, 'optimizer': 'Adam'}. Best is trial 74 with value: 0.06051849676418247.
2026-05-20 08:02:49,659 - experiment_functions - INFO - Early stopping at epoch 1300. Best Recall: 0.0600
2026-05-20 08:02:49,778 - optuna.study.study - INFO - Trial 95 finished with value: 0.059968747049420526 and parameters: {'n_layers': 1, 'embedding_dim': 128, 'lr': 0.0002969002910365992, 'lambda_val': 0.00032515241518248837, 'batch_size': 641, 'optimizer': 'Adam'}. Best is trial 74 with value: 0.06051849676418247.
2026-05-20 08:03:03,267 - experiment_functions - INFO - Early stopping at epoch 950. Best Recall: 0.0588
2026-05-20 08:03:03,385 - optuna.study.study - INFO - Trial 96 finished with value: 0.05883137651211901 and parameters: {'n_layers': 1, 'embedding_dim': 128, 'lr': 0.0004287428600196743, 'lambda_val': 0.00027846508923767523, 'batch_size': 661, 'optimizer': 'Adam'}. Best is trial 74 with value: 0.06051849676418247.
2026-05-20 08:03:23,261 - experiment_functions - INFO - Early stopping at epoch 1450. Best Recall: 0.0588
2026-05-20 08:03:23,360 - optuna.study.study - INFO - Trial 97 finished with value: 0.05883904910914778 and parameters: {'n_layers': 1, 'embedding_dim': 128, 'lr': 0.0002760901551601554, 'lambda_val': 0.00018891123068488094, 'batch_size': 600, 'optimizer': 'Adam'}. Best is trial 74 with value: 0.06051849676418247.
2026-05-20 08:03:41,554 - optuna.study._optimize - INFO - Trial 98 pruned. 
2026-05-20 08:03:56,491 - experiment_functions - INFO - Early stopping at epoch 1150. Best Recall: 0.0584
2026-05-20 08:03:56,569 - optuna.study.study - INFO - Trial 99 finished with value: 0.05835159681638349 and parameters: {'n_layers': 1, 'embedding_dim': 64, 'lr': 0.0003298234299682479, 'lambda_val': 1.0151045972359204e-06, 'batch_size': 1074, 'optimizer': 'Adam'}. Best is trial 74 with value: 0.06051849676418247.
2026-05-20 08:04:04,973 - experiment_functions - INFO - Early stopping at epoch 550. Best Recall: 0.0147
2026-05-20 08:04:05,071 - optuna.study.study - INFO - Trial 100 finished with value: 0.014678571714085811 and parameters: {'n_layers': 3, 'embedding_dim': 128, 'lr': 0.002921366861646639, 'lambda_val': 0.002931555694223966, 'batch_size': 934, 'optimizer': 'Adam'}. Best is trial 74 with value: 0.06051849676418247.
2026-05-20 08:04:12,389 - experiment_functions - INFO - Early stopping at epoch 500. Best Recall: 0.0052
2026-05-20 08:04:12,523 - optuna.study.study - INFO - Trial 101 finished with value: 0.005179896404308837 and parameters: {'n_layers': 1, 'embedding_dim': 128, 'lr': 0.0001571307596741167, 'lambda_val': 9.31912854946863e-05, 'batch_size': 693, 'optimizer': 'SGD'}. Best is trial 74 with value: 0.06051849676418247.
2026-05-20 08:04:34,213 - experiment_functions - INFO - Early stopping at epoch 1650. Best Recall: 0.0584
2026-05-20 08:04:34,291 - optuna.study.study - INFO - Trial 102 finished with value: 0.05840167371255797 and parameters: {'n_layers': 1, 'embedding_dim': 128, 'lr': 0.00022321518579717004, 'lambda_val': 0.00015561826913869421, 'batch_size': 771, 'optimizer': 'Adam'}. Best is trial 74 with value: 0.06051849676418247.
2026-05-20 08:04:47,344 - optuna.study._optimize - INFO - Trial 103 pruned. 
2026-05-20 08:05:05,523 - optuna.study._optimize - INFO - Trial 104 pruned. 
2026-05-20 08:05:16,572 - experiment_functions - INFO - Early stopping at epoch 550. Best Recall: 0.0591
2026-05-20 08:05:16,715 - optuna.study.study - INFO - Trial 105 finished with value: 0.05907820590657523 and parameters: {'n_layers': 1, 'embedding_dim': 256, 'lr': 0.004462262367060842, 'lambda_val': 0.0001238539189868818, 'batch_size': 885, 'optimizer': 'Adam'}. Best is trial 74 with value: 0.06051849676418247.
2026-05-20 08:05:25,361 - experiment_functions - INFO - Early stopping at epoch 550. Best Recall: 0.0568
2026-05-20 08:05:25,460 - optuna.study.study - INFO - Trial 106 finished with value: 0.0567894553652251 and parameters: {'n_layers': 1, 'embedding_dim': 256, 'lr': 0.0045138418674795094, 'lambda_val': 0.0002100973855334773, 'batch_size': 909, 'optimizer': 'Adam'}. Best is trial 74 with value: 0.06051849676418247.
2026-05-20 08:05:34,415 - experiment_functions - INFO - Early stopping at epoch 650. Best Recall: 0.0560
2026-05-20 08:05:34,505 - optuna.study.study - INFO - Trial 107 finished with value: 0.05603455029080688 and parameters: {'n_layers': 1, 'embedding_dim': 32, 'lr': 0.001781013383875636, 'lambda_val': 0.00012090627754094647, 'batch_size': 1020, 'optimizer': 'Adam'}. Best is trial 74 with value: 0.06051849676418247.
2026-05-20 08:05:42,251 - experiment_functions - INFO - Early stopping at epoch 550. Best Recall: 0.0058
2026-05-20 08:05:42,385 - optuna.study.study - INFO - Trial 108 finished with value: 0.005750827752322367 and parameters: {'n_layers': 2, 'embedding_dim': 256, 'lr': 0.007347292987155367, 'lambda_val': 0.0004358273487826045, 'batch_size': 817, 'optimizer': 'Adam'}. Best is trial 74 with value: 0.06051849676418247.
2026-05-20 08:05:53,530 - experiment_functions - INFO - Early stopping at epoch 800. Best Recall: 0.0589
2026-05-20 08:05:53,609 - optuna.study.study - INFO - Trial 109 finished with value: 0.05891545066854846 and parameters: {'n_layers': 1, 'embedding_dim': 256, 'lr': 0.0004935956208660741, 'lambda_val': 0.0011223001644603285, 'batch_size': 703, 'optimizer': 'Adam'}. Best is trial 74 with value: 0.06051849676418247.
2026-05-20 08:06:01,752 - experiment_functions - INFO - Early stopping at epoch 550. Best Recall: 0.0485
