2026-05-19 21:41:35,269 - root - INFO - **** Training e_1M_full
2026-05-19 21:41:37,437 - helper_functions - INFO - Users: 6040, Items: 3883
2026-05-19 21:41:40,576 - helper_functions - INFO - Edge index: torch.Size([2, 1000209])
2026-05-19 21:41:40,576 - root - INFO - **** Generating the graph:
2026-05-19 21:41:41,457 - helper_functions - INFO - Number of unique users: 6040
2026-05-19 21:41:41,466 - helper_functions - INFO - Number of unique items: 3706
2026-05-19 21:41:41,466 - helper_functions - INFO - Number of nodes: 9746
2026-05-19 21:41:41,470 - helper_functions - INFO - Number of edges: 1000209
2026-05-19 21:41:44,411 - optuna.storages._rdb.storage - INFO - A new study created in RDB with name: Study_e_1M_full
2026-05-19 21:43:01,108 - optuna.study.study - INFO - Trial 0 finished with value: 0.019848868771018303 and parameters: {'n_layers': 2, 'embedding_dim': 128, 'lr': 0.0001000840878114702, 'lambda_val': 6.843611078303188e-06, 'batch_size': 1047, 'optimizer': 'RMSprop'}. Best is trial 0 with value: 0.019848868771018303.
2026-05-19 21:43:20,867 - experiment_functions - INFO - Early stopping at epoch 1250. Best Recall: 0.0043
2026-05-19 21:43:20,966 - optuna.study.study - INFO - Trial 1 finished with value: 0.004334972483767298 and parameters: {'n_layers': 3, 'embedding_dim': 32, 'lr': 1.4203524330527641e-05, 'lambda_val': 1.4096384173649756e-06, 'batch_size': 3180, 'optimizer': 'Adam'}. Best is trial 0 with value: 0.019848868771018303.
2026-05-19 21:44:27,258 - optuna.study.study - INFO - Trial 2 finished with value: 0.0211346263978817 and parameters: {'n_layers': 2, 'embedding_dim': 96, 'lr': 7.484581795462278e-05, 'lambda_val': 0.0005790285884533018, 'batch_size': 3249, 'optimizer': 'RMSprop'}. Best is trial 2 with value: 0.0211346263978817.
2026-05-19 21:44:43,940 - experiment_functions - INFO - Early stopping at epoch 950. Best Recall: 0.0092
2026-05-19 21:44:44,041 - optuna.study.study - INFO - Trial 3 finished with value: 0.009169549765268905 and parameters: {'n_layers': 2, 'embedding_dim': 96, 'lr': 0.02585556274741509, 'lambda_val': 0.029548338623558434, 'batch_size': 784, 'optimizer': 'Adam'}. Best is trial 2 with value: 0.0211346263978817.
2026-05-19 21:44:52,944 - experiment_functions - INFO - Early stopping at epoch 500. Best Recall: 0.0053
2026-05-19 21:44:53,046 - optuna.study.study - INFO - Trial 4 finished with value: 0.005348793870172268 and parameters: {'n_layers': 2, 'embedding_dim': 64, 'lr': 0.0009465848106993404, 'lambda_val': 3.1162214628094185e-05, 'batch_size': 3343, 'optimizer': 'SGD'}. Best is trial 2 with value: 0.0211346263978817.
2026-05-19 21:45:09,892 - experiment_functions - INFO - Early stopping at epoch 800. Best Recall: 0.0315
2026-05-19 21:45:09,995 - optuna.study.study - INFO - Trial 5 finished with value: 0.03153424006457588 and parameters: {'n_layers': 4, 'embedding_dim': 64, 'lr': 0.0004397500899304751, 'lambda_val': 0.00010951835764914366, 'batch_size': 4055, 'optimizer': 'Adam'}. Best is trial 5 with value: 0.03153424006457588.
2026-05-19 21:45:19,834 - experiment_functions - INFO - Early stopping at epoch 500. Best Recall: 0.0054
2026-05-19 21:45:19,936 - optuna.study.study - INFO - Trial 6 finished with value: 0.0053890194527925995 and parameters: {'n_layers': 2, 'embedding_dim': 128, 'lr': 6.0742729062519315e-05, 'lambda_val': 6.962690389758867e-05, 'batch_size': 3711, 'optimizer': 'SGD'}. Best is trial 5 with value: 0.03153424006457588.
2026-05-19 21:46:29,867 - experiment_functions - INFO - Early stopping at epoch 3300. Best Recall: 0.0596
2026-05-19 21:46:29,972 - optuna.study.study - INFO - Trial 7 finished with value: 0.0595987838330115 and parameters: {'n_layers': 1, 'embedding_dim': 256, 'lr': 0.00802480522796383, 'lambda_val': 0.0001845944514349513, 'batch_size': 3221, 'optimizer': 'RMSprop'}. Best is trial 7 with value: 0.0595987838330115.
2026-05-19 21:46:37,928 - experiment_functions - INFO - Early stopping at epoch 500. Best Recall: 0.0051
2026-05-19 21:46:38,020 - optuna.study.study - INFO - Trial 8 finished with value: 0.005096623134118286 and parameters: {'n_layers': 1, 'embedding_dim': 64, 'lr': 0.03837468507824652, 'lambda_val': 9.479437961687173e-06, 'batch_size': 2567, 'optimizer': 'SGD'}. Best is trial 7 with value: 0.0595987838330115.
2026-05-19 21:46:49,246 - experiment_functions - INFO - Early stopping at epoch 500. Best Recall: 0.0056
2026-05-19 21:46:49,399 - optuna.study.study - INFO - Trial 9 finished with value: 0.005574237919480775 and parameters: {'n_layers': 2, 'embedding_dim': 256, 'lr': 0.00018451974723714533, 'lambda_val': 2.0324362802733233e-06, 'batch_size': 2833, 'optimizer': 'SGD'}. Best is trial 7 with value: 0.0595987838330115.
2026-05-19 21:47:25,404 - experiment_functions - INFO - Early stopping at epoch 1950. Best Recall: 0.0550
2026-05-19 21:47:25,505 - optuna.study.study - INFO - Trial 10 finished with value: 0.0549906113885728 and parameters: {'n_layers': 1, 'embedding_dim': 256, 'lr': 0.006014328468812868, 'lambda_val': 0.0016251222199135176, 'batch_size': 1883, 'optimizer': 'RMSprop'}. Best is trial 7 with value: 0.0595987838330115.
2026-05-19 21:48:16,582 - experiment_functions - INFO - Early stopping at epoch 2700. Best Recall: 0.0566
2026-05-19 21:48:16,673 - optuna.study.study - INFO - Trial 11 finished with value: 0.05660818894335773 and parameters: {'n_layers': 1, 'embedding_dim': 256, 'lr': 0.005467357437931438, 'lambda_val': 0.00175868015629025, 'batch_size': 1857, 'optimizer': 'RMSprop'}. Best is trial 7 with value: 0.0595987838330115.
2026-05-19 21:48:40,890 - optuna.study._optimize - INFO - Trial 12 pruned. 
2026-05-19 21:49:08,284 - optuna.study._optimize - INFO - Trial 13 pruned. 
2026-05-19 21:49:23,537 - experiment_functions - INFO - Early stopping at epoch 500. Best Recall: 0.0426
2026-05-19 21:49:23,617 - optuna.study.study - INFO - Trial 14 finished with value: 0.042578215167576594 and parameters: {'n_layers': 3, 'embedding_dim': 256, 'lr': 0.07712114123007781, 'lambda_val': 0.00041356933494184956, 'batch_size': 1275, 'optimizer': 'RMSprop'}. Best is trial 7 with value: 0.0595987838330115.
2026-05-19 21:49:32,234 - experiment_functions - INFO - Early stopping at epoch 550. Best Recall: 0.0457
2026-05-19 21:49:32,383 - optuna.study.study - INFO - Trial 15 finished with value: 0.04570645630225368 and parameters: {'n_layers': 1, 'embedding_dim': 32, 'lr': 0.0021136115297699844, 'lambda_val': 0.06075801441573741, 'batch_size': 2347, 'optimizer': 'RMSprop'}. Best is trial 7 with value: 0.0595987838330115.
2026-05-19 21:50:07,447 - optuna.study._optimize - INFO - Trial 16 pruned. 
2026-05-19 21:50:19,916 - experiment_functions - INFO - Early stopping at epoch 550. Best Recall: 0.0565
2026-05-19 21:50:20,019 - optuna.study.study - INFO - Trial 17 finished with value: 0.0564583443140625 and parameters: {'n_layers': 1, 'embedding_dim': 256, 'lr': 0.0017799448940967358, 'lambda_val': 0.00016381400834647312, 'batch_size': 2759, 'optimizer': 'RMSprop'}. Best is trial 7 with value: 0.0595987838330115.
2026-05-19 21:50:55,239 - optuna.study._optimize - INFO - Trial 18 pruned. 
2026-05-19 21:51:13,623 - optuna.study._optimize - INFO - Trial 19 pruned. 
2026-05-19 21:52:11,245 - experiment_functions - INFO - Early stopping at epoch 3450. Best Recall: 0.0613
2026-05-19 21:52:11,340 - optuna.study.study - INFO - Trial 20 finished with value: 0.06133108028599763 and parameters: {'n_layers': 1, 'embedding_dim': 96, 'lr': 0.0032243113827390055, 'lambda_val': 4.645973377597635e-05, 'batch_size': 4083, 'optimizer': 'RMSprop'}. Best is trial 20 with value: 0.06133108028599763.
2026-05-19 21:52:59,811 - experiment_functions - INFO - Early stopping at epoch 3000. Best Recall: 0.0603
2026-05-19 21:52:59,903 - optuna.study.study - INFO - Trial 21 finished with value: 0.06027240559297134 and parameters: {'n_layers': 1, 'embedding_dim': 96, 'lr': 0.0032825916332859407, 'lambda_val': 2.6254254307825686e-05, 'batch_size': 4009, 'optimizer': 'RMSprop'}. Best is trial 20 with value: 0.06133108028599763.
2026-05-19 21:53:11,393 - experiment_functions - INFO - Early stopping at epoch 650. Best Recall: 0.0640
2026-05-19 21:53:11,509 - optuna.study.study - INFO - Trial 22 finished with value: 0.06396677209864934 and parameters: {'n_layers': 1, 'embedding_dim': 96, 'lr': 0.0009410415698572454, 'lambda_val': 3.309797817991235e-05, 'batch_size': 4032, 'optimizer': 'RMSprop'}. Best is trial 22 with value: 0.06396677209864934.
2026-05-19 21:53:27,060 - experiment_functions - INFO - Early stopping at epoch 850. Best Recall: 0.0623
2026-05-19 21:53:27,162 - optuna.study.study - INFO - Trial 23 finished with value: 0.06230089035194995 and parameters: {'n_layers': 1, 'embedding_dim': 96, 'lr': 0.0006127084929513744, 'lambda_val': 2.3672654286816722e-05, 'batch_size': 4067, 'optimizer': 'RMSprop'}. Best is trial 22 with value: 0.06396677209864934.
2026-05-19 21:53:38,308 - experiment_functions - INFO - Early stopping at epoch 600. Best Recall: 0.0530
2026-05-19 21:53:38,410 - optuna.study.study - INFO - Trial 24 finished with value: 0.05297188783909752 and parameters: {'n_layers': 2, 'embedding_dim': 96, 'lr': 0.0007223518712854985, 'lambda_val': 6.14416317258001e-06, 'batch_size': 3733, 'optimizer': 'RMSprop'}. Best is trial 22 with value: 0.06396677209864934.
2026-05-19 21:53:55,480 - optuna.study._optimize - INFO - Trial 25 pruned. 
2026-05-19 21:54:11,326 - experiment_functions - INFO - Early stopping at epoch 800. Best Recall: 0.0518
2026-05-19 21:54:11,466 - optuna.study.study - INFO - Trial 26 finished with value: 0.05182926687709396 and parameters: {'n_layers': 2, 'embedding_dim': 96, 'lr': 0.00037609319132721365, 'lambda_val': 1.2318967139157438e-05, 'batch_size': 4063, 'optimizer': 'RMSprop'}. Best is trial 22 with value: 0.06396677209864934.
2026-05-19 21:54:21,424 - experiment_functions - INFO - Early stopping at epoch 550. Best Recall: 0.0667
2026-05-19 21:54:21,530 - optuna.study.study - INFO - Trial 27 finished with value: 0.06665207914985044 and parameters: {'n_layers': 1, 'embedding_dim': 96, 'lr': 0.0015332905055480497, 'lambda_val': 3.6609414607834305e-06, 'batch_size': 3509, 'optimizer': 'RMSprop'}. Best is trial 27 with value: 0.06665207914985044.
2026-05-19 21:54:34,143 - experiment_functions - INFO - Early stopping at epoch 600. Best Recall: 0.0448
2026-05-19 21:54:34,278 - optuna.study.study - INFO - Trial 28 finished with value: 0.04476638185641692 and parameters: {'n_layers': 3, 'embedding_dim': 96, 'lr': 0.0012534741553292099, 'lambda_val': 2.819383078588233e-06, 'batch_size': 3562, 'optimizer': 'Adam'}. Best is trial 27 with value: 0.06665207914985044.
2026-05-19 21:54:43,377 - experiment_functions - INFO - Early stopping at epoch 500. Best Recall: 0.0049
2026-05-19 21:54:43,547 - optuna.study.study - INFO - Trial 29 finished with value: 0.004922925270958838 and parameters: {'n_layers': 2, 'embedding_dim': 96, 'lr': 0.0005595838408644485, 'lambda_val': 4.046431998438956e-06, 'batch_size': 2968, 'optimizer': 'SGD'}. Best is trial 27 with value: 0.06665207914985044.
2026-05-19 21:54:52,920 - experiment_functions - INFO - Early stopping at epoch 600. Best Recall: 0.0050
2026-05-19 21:54:53,021 - optuna.study.study - INFO - Trial 30 finished with value: 0.00504278035753553 and parameters: {'n_layers': 1, 'embedding_dim': 96, 'lr': 3.26867581192268e-05, 'lambda_val': 1.4745289535354603e-05, 'batch_size': 3807, 'optimizer': 'RMSprop'}. Best is trial 27 with value: 0.06665207914985044.
2026-05-19 21:55:03,209 - experiment_functions - INFO - Early stopping at epoch 550. Best Recall: 0.0374
2026-05-19 21:55:03,310 - optuna.study.study - INFO - Trial 31 finished with value: 0.037373565461698864 and parameters: {'n_layers': 1, 'embedding_dim': 96, 'lr': 0.0025394556441905246, 'lambda_val': 5.683617105420781e-05, 'batch_size': 3465, 'optimizer': 'RMSprop'}. Best is trial 27 with value: 0.06665207914985044.
2026-05-19 21:55:19,984 - optuna.study._optimize - INFO - Trial 32 pruned. 
2026-05-19 21:55:33,789 - experiment_functions - INFO - Early stopping at epoch 650. Best Recall: 0.0586
2026-05-19 21:55:33,930 - optuna.study.study - INFO - Trial 33 finished with value: 0.05857510084336733 and parameters: {'n_layers': 1, 'embedding_dim': 32, 'lr': 0.0013005125860685166, 'lambda_val': 1.2313567071061355e-06, 'batch_size': 3506, 'optimizer': 'RMSprop'}. Best is trial 27 with value: 0.06665207914985044.
2026-05-19 21:55:57,663 - optuna.study._optimize - INFO - Trial 34 pruned. 
2026-05-19 21:56:11,243 - experiment_functions - INFO - Early stopping at epoch 700. Best Recall: 0.0611
2026-05-19 21:56:11,334 - optuna.study.study - INFO - Trial 35 finished with value: 0.061126861918873863 and parameters: {'n_layers': 2, 'embedding_dim': 96, 'lr': 0.0008692285245689984, 'lambda_val': 5.230755199213814e-05, 'batch_size': 3062, 'optimizer': 'Adam'}. Best is trial 27 with value: 0.06665207914985044.
2026-05-19 21:56:28,808 - optuna.study._optimize - INFO - Trial 36 pruned. 
2026-05-19 21:57:13,144 - experiment_functions - INFO - Early stopping at epoch 2450. Best Recall: 0.0751
2026-05-19 21:57:13,236 - optuna.study.study - INFO - Trial 37 finished with value: 0.07508370903069492 and parameters: {'n_layers': 1, 'embedding_dim': 128, 'lr': 0.0002982882395631575, 'lambda_val': 8.889027355834453e-06, 'batch_size': 3363, 'optimizer': 'RMSprop'}. Best is trial 37 with value: 0.07508370903069492.
2026-05-19 21:57:24,352 - experiment_functions - INFO - Early stopping at epoch 700. Best Recall: 0.0046
2026-05-19 21:57:24,478 - optuna.study.study - INFO - Trial 38 finished with value: 0.004626420252733519 and parameters: {'n_layers': 1, 'embedding_dim': 128, 'lr': 1.0081340094450663e-05, 'lambda_val': 2.538413439115852e-06, 'batch_size': 3360, 'optimizer': 'Adam'}. Best is trial 37 with value: 0.07508370903069492.
2026-05-19 21:57:34,069 - experiment_functions - INFO - Early stopping at epoch 500. Best Recall: 0.0052
2026-05-19 21:57:34,173 - optuna.study.study - INFO - Trial 39 finished with value: 0.005182093111741136 and parameters: {'n_layers': 2, 'embedding_dim': 128, 'lr': 0.0002953714686009263, 'lambda_val': 1.0566646896592867e-06, 'batch_size': 3195, 'optimizer': 'SGD'}. Best is trial 37 with value: 0.07508370903069492.
2026-05-19 21:57:53,871 - optuna.study._optimize - INFO - Trial 40 pruned. 
2026-05-19 21:58:08,348 - experiment_functions - INFO - Early stopping at epoch 850. Best Recall: 0.0677
2026-05-19 21:58:08,484 - optuna.study.study - INFO - Trial 41 finished with value: 0.06768011393616445 and parameters: {'n_layers': 1, 'embedding_dim': 64, 'lr': 0.0006193572189570673, 'lambda_val': 8.960178842087326e-06, 'batch_size': 3840, 'optimizer': 'RMSprop'}. Best is trial 37 with value: 0.07508370903069492.
2026-05-19 21:58:24,674 - experiment_functions - INFO - Early stopping at epoch 1000. Best Recall: 0.0649
2026-05-19 21:58:24,765 - optuna.study.study - INFO - Trial 42 finished with value: 0.06494045777063882 and parameters: {'n_layers': 1, 'embedding_dim': 64, 'lr': 0.000543808859838576, 'lambda_val': 8.568108418991206e-06, 'batch_size': 3838, 'optimizer': 'RMSprop'}. Best is trial 37 with value: 0.07508370903069492.
2026-05-19 21:58:51,381 - experiment_functions - INFO - Early stopping at epoch 1600. Best Recall: 0.0705
2026-05-19 21:58:51,482 - optuna.study.study - INFO - Trial 43 finished with value: 0.07046136245675087 and parameters: {'n_layers': 1, 'embedding_dim': 64, 'lr': 0.0004353184941844625, 'lambda_val': 8.724852453002567e-06, 'batch_size': 3400, 'optimizer': 'RMSprop'}. Best is trial 37 with value: 0.07508370903069492.
2026-05-19 21:59:06,488 - optuna.study._optimize - INFO - Trial 44 pruned. 
2026-05-19 21:59:16,484 - experiment_functions - INFO - Early stopping at epoch 500. Best Recall: 0.0057
2026-05-19 21:59:16,574 - optuna.study.study - INFO - Trial 45 finished with value: 0.00572064945687646 and parameters: {'n_layers': 1, 'embedding_dim': 64, 'lr': 0.000408840258105154, 'lambda_val': 5.557138088763356e-06, 'batch_size': 3131, 'optimizer': 'SGD'}. Best is trial 37 with value: 0.07508370903069492.
2026-05-19 21:59:36,032 - optuna.study._optimize - INFO - Trial 46 pruned. 
2026-05-19 21:59:47,428 - experiment_functions - INFO - Early stopping at epoch 600. Best Recall: 0.0647
2026-05-19 21:59:47,519 - optuna.study.study - INFO - Trial 47 finished with value: 0.06468362263411699 and parameters: {'n_layers': 1, 'embedding_dim': 64, 'lr': 0.0015306529144991704, 'lambda_val': 1.6443002943023817e-06, 'batch_size': 2577, 'optimizer': 'RMSprop'}. Best is trial 37 with value: 0.07508370903069492.
2026-05-19 22:00:52,481 - optuna.study.study - INFO - Trial 48 finished with value: 0.07237696244786607 and parameters: {'n_layers': 1, 'embedding_dim': 64, 'lr': 0.000290026636612429, 'lambda_val': 1.0609359361694217e-05, 'batch_size': 3335, 'optimizer': 'RMSprop'}. Best is trial 37 with value: 0.07508370903069492.
2026-05-19 22:01:11,459 - experiment_functions - INFO - Early stopping at epoch 1100. Best Recall: 0.0589
2026-05-19 22:01:11,563 - optuna.study.study - INFO - Trial 49 finished with value: 0.058940679215774026 and parameters: {'n_layers': 2, 'embedding_dim': 64, 'lr': 0.00033707088232272223, 'lambda_val': 1.3092432986394107e-05, 'batch_size': 3289, 'optimizer': 'RMSprop'}. Best is trial 37 with value: 0.07508370903069492.
2026-05-19 22:01:20,621 - experiment_functions - INFO - Early stopping at epoch 500. Best Recall: 0.0049
2026-05-19 22:01:20,757 - optuna.study.study - INFO - Trial 50 finished with value: 0.0049206636972843765 and parameters: {'n_layers': 1, 'embedding_dim': 64, 'lr': 4.557254268991671e-05, 'lambda_val': 3.1850012962483154e-06, 'batch_size': 2737, 'optimizer': 'SGD'}. Best is trial 37 with value: 0.07508370903069492.
2026-05-19 22:01:39,530 - experiment_functions - INFO - Early stopping at epoch 1150. Best Recall: 0.0730
2026-05-19 22:01:39,621 - optuna.study.study - INFO - Trial 51 finished with value: 0.07295467247984341 and parameters: {'n_layers': 1, 'embedding_dim': 64, 'lr': 0.0005197080473494652, 'lambda_val': 1.0018016936781318e-05, 'batch_size': 3418, 'optimizer': 'RMSprop'}. Best is trial 37 with value: 0.07508370903069492.
2026-05-19 22:01:57,398 - optuna.study._optimize - INFO - Trial 52 pruned. 
2026-05-19 22:02:20,559 - experiment_functions - INFO - Early stopping at epoch 1350. Best Recall: 0.0732
2026-05-19 22:02:20,649 - optuna.study.study - INFO - Trial 53 finished with value: 0.07319452567828844 and parameters: {'n_layers': 1, 'embedding_dim': 64, 'lr': 0.0004686054187348819, 'lambda_val': 2.23002345634996e-06, 'batch_size': 3482, 'optimizer': 'RMSprop'}. Best is trial 37 with value: 0.07508370903069492.
2026-05-19 22:03:25,608 - optuna.study.study - INFO - Trial 54 finished with value: 0.07773501796130158 and parameters: {'n_layers': 1, 'embedding_dim': 64, 'lr': 0.0002965882498485035, 'lambda_val': 2.0081156100220864e-06, 'batch_size': 3127, 'optimizer': 'RMSprop'}. Best is trial 54 with value: 0.07773501796130158.
2026-05-19 22:03:40,519 - optuna.study._optimize - INFO - Trial 55 pruned. 
2026-05-19 22:03:57,597 - optuna.study._optimize - INFO - Trial 56 pruned. 
2026-05-19 22:04:14,662 - optuna.study._optimize - INFO - Trial 57 pruned. 
2026-05-19 22:04:33,821 - optuna.study._optimize - INFO - Trial 58 pruned. 
2026-05-19 22:04:57,585 - experiment_functions - INFO - Early stopping at epoch 1450. Best Recall: 0.0725
2026-05-19 22:04:57,731 - optuna.study.study - INFO - Trial 59 finished with value: 0.07246903218226815 and parameters: {'n_layers': 1, 'embedding_dim': 64, 'lr': 0.00044731735110066143, 'lambda_val': 5.026827757023638e-06, 'batch_size': 3429, 'optimizer': 'RMSprop'}. Best is trial 54 with value: 0.07773501796130158.
2026-05-19 22:05:09,892 - experiment_functions - INFO - Early stopping at epoch 700. Best Recall: 0.0674
2026-05-19 22:05:09,981 - optuna.study.study - INFO - Trial 60 finished with value: 0.06736309245431862 and parameters: {'n_layers': 1, 'embedding_dim': 128, 'lr': 0.0008481337425917288, 'lambda_val': 4.940385179556289e-06, 'batch_size': 2873, 'optimizer': 'RMSprop'}. Best is trial 54 with value: 0.07773501796130158.
2026-05-19 22:05:35,150 - experiment_functions - INFO - Early stopping at epoch 1350. Best Recall: 0.0709
2026-05-19 22:05:35,285 - optuna.study.study - INFO - Trial 61 finished with value: 0.07085377132727239 and parameters: {'n_layers': 1, 'embedding_dim': 64, 'lr': 0.00044341763181532953, 'lambda_val': 1.2748205656665672e-05, 'batch_size': 3635, 'optimizer': 'RMSprop'}. Best is trial 54 with value: 0.07773501796130158.
2026-05-19 22:05:50,448 - optuna.study._optimize - INFO - Trial 62 pruned. 
2026-05-19 22:06:14,301 - experiment_functions - INFO - Early stopping at epoch 1500. Best Recall: 0.0769
2026-05-19 22:06:14,404 - optuna.study.study - INFO - Trial 63 finished with value: 0.07692345350105939 and parameters: {'n_layers': 1, 'embedding_dim': 64, 'lr': 0.0004454865539427936, 'lambda_val': 2.490070152547682e-06, 'batch_size': 3600, 'optimizer': 'RMSprop'}. Best is trial 54 with value: 0.07773501796130158.
2026-05-19 22:06:24,746 - experiment_functions - INFO - Early stopping at epoch 650. Best Recall: 0.0676
2026-05-19 22:06:24,836 - optuna.study.study - INFO - Trial 64 finished with value: 0.06762597732913841 and parameters: {'n_layers': 1, 'embedding_dim': 64, 'lr': 0.0010023777324682866, 'lambda_val': 1.0261799206613138e-06, 'batch_size': 3096, 'optimizer': 'RMSprop'}. Best is trial 54 with value: 0.07773501796130158.
2026-05-19 22:06:41,487 - optuna.study._optimize - INFO - Trial 65 pruned. 
2026-05-19 22:06:56,261 - optuna.study._optimize - INFO - Trial 66 pruned. 
2026-05-19 22:07:20,501 - experiment_functions - INFO - Early stopping at epoch 1350. Best Recall: 0.0803
