2026-05-20 04:16:08,325 - optuna.study._optimize - INFO - Trial 18 pruned. 
2026-05-20 04:16:16,215 - experiment_functions - INFO - Early stopping at epoch 500. Best Recall: 0.0050
2026-05-20 04:16:16,304 - optuna.study.study - INFO - Trial 19 finished with value: 0.004998558862197025 and parameters: {'n_layers': 1, 'embedding_dim': 128, 'lr': 8.939587451125088e-05, 'lambda_val': 0.08843626643097838, 'batch_size': 3562, 'optimizer': 'SGD'}. Best is trial 9 with value: 0.03625390958337897.
2026-05-20 04:16:23,692 - experiment_functions - INFO - Early stopping at epoch 500. Best Recall: 0.0048
2026-05-20 04:16:23,782 - optuna.study.study - INFO - Trial 20 finished with value: 0.004782442002832731 and parameters: {'n_layers': 2, 'embedding_dim': 64, 'lr': 0.0015350131209350484, 'lambda_val': 0.0018840702742682802, 'batch_size': 3465, 'optimizer': 'RMSprop'}. Best is trial 9 with value: 0.03625390958337897.
2026-05-20 04:16:35,447 - experiment_functions - INFO - Early stopping at epoch 750. Best Recall: 0.0174
2026-05-20 04:16:35,592 - optuna.study.study - INFO - Trial 21 finished with value: 0.017381948437947457 and parameters: {'n_layers': 3, 'embedding_dim': 256, 'lr': 0.00039934902559757534, 'lambda_val': 0.00019581688713524054, 'batch_size': 2817, 'optimizer': 'RMSprop'}. Best is trial 9 with value: 0.03625390958337897.
2026-05-20 04:16:43,439 - experiment_functions - INFO - Early stopping at epoch 500. Best Recall: 0.0072
2026-05-20 04:16:43,530 - optuna.study.study - INFO - Trial 22 finished with value: 0.0071685532263850195 and parameters: {'n_layers': 2, 'embedding_dim': 256, 'lr': 0.00454328371091764, 'lambda_val': 0.0010845052257115642, 'batch_size': 3759, 'optimizer': 'RMSprop'}. Best is trial 9 with value: 0.03625390958337897.
2026-05-20 04:16:57,787 - optuna.study._optimize - INFO - Trial 23 pruned. 
2026-05-20 04:17:06,276 - experiment_functions - INFO - Early stopping at epoch 550. Best Recall: 0.0070
2026-05-20 04:17:06,366 - optuna.study.study - INFO - Trial 24 finished with value: 0.006990073322967973 and parameters: {'n_layers': 2, 'embedding_dim': 256, 'lr': 0.0007967036340321842, 'lambda_val': 0.0034015173503649694, 'batch_size': 3303, 'optimizer': 'RMSprop'}. Best is trial 9 with value: 0.03625390958337897.
2026-05-20 04:17:13,788 - experiment_functions - INFO - Early stopping at epoch 500. Best Recall: 0.0027
2026-05-20 04:17:13,923 - optuna.study.study - INFO - Trial 25 finished with value: 0.0027030061615853315 and parameters: {'n_layers': 3, 'embedding_dim': 32, 'lr': 0.008564248590183374, 'lambda_val': 0.012070178671791453, 'batch_size': 2870, 'optimizer': 'RMSprop'}. Best is trial 9 with value: 0.03625390958337897.
2026-05-20 04:17:34,724 - experiment_functions - INFO - Early stopping at epoch 1450. Best Recall: 0.0419
2026-05-20 04:17:34,816 - optuna.study.study - INFO - Trial 26 finished with value: 0.04190055903435297 and parameters: {'n_layers': 1, 'embedding_dim': 256, 'lr': 0.00016936284279706371, 'lambda_val': 0.000499438570439094, 'batch_size': 3819, 'optimizer': 'RMSprop'}. Best is trial 26 with value: 0.04190055903435297.
2026-05-20 04:17:52,977 - experiment_functions - INFO - Early stopping at epoch 1300. Best Recall: 0.0395
2026-05-20 04:17:53,088 - optuna.study.study - INFO - Trial 27 finished with value: 0.03952765518154551 and parameters: {'n_layers': 1, 'embedding_dim': 256, 'lr': 0.0001837723486087532, 'lambda_val': 0.0007135341697441221, 'batch_size': 3677, 'optimizer': 'RMSprop'}. Best is trial 26 with value: 0.04190055903435297.
2026-05-20 04:18:09,497 - experiment_functions - INFO - Early stopping at epoch 1100. Best Recall: 0.0395
2026-05-20 04:18:09,585 - optuna.study.study - INFO - Trial 28 finished with value: 0.03950704617756654 and parameters: {'n_layers': 1, 'embedding_dim': 256, 'lr': 0.00030259745363947954, 'lambda_val': 5.799467733838689e-06, 'batch_size': 3765, 'optimizer': 'Adam'}. Best is trial 26 with value: 0.04190055903435297.
2026-05-20 04:18:26,933 - experiment_functions - INFO - Early stopping at epoch 1300. Best Recall: 0.0380
2026-05-20 04:18:27,025 - optuna.study.study - INFO - Trial 29 finished with value: 0.038001373689055436 and parameters: {'n_layers': 1, 'embedding_dim': 256, 'lr': 0.0002644769056373607, 'lambda_val': 4.74145211348853e-06, 'batch_size': 3735, 'optimizer': 'Adam'}. Best is trial 26 with value: 0.04190055903435297.
2026-05-20 04:18:39,689 - optuna.study._optimize - INFO - Trial 30 pruned. 
2026-05-20 04:19:02,855 - experiment_functions - INFO - Early stopping at epoch 1700. Best Recall: 0.0393
2026-05-20 04:19:02,952 - optuna.study.study - INFO - Trial 31 finished with value: 0.039310433740928706 and parameters: {'n_layers': 1, 'embedding_dim': 256, 'lr': 0.00021961772611312413, 'lambda_val': 1.5395775774149535e-06, 'batch_size': 3703, 'optimizer': 'Adam'}. Best is trial 26 with value: 0.04190055903435297.
2026-05-20 04:19:10,437 - experiment_functions - INFO - Early stopping at epoch 500. Best Recall: 0.0053
2026-05-20 04:19:10,536 - optuna.study.study - INFO - Trial 32 finished with value: 0.00528757620553645 and parameters: {'n_layers': 1, 'embedding_dim': 256, 'lr': 1.0306337479001193e-05, 'lambda_val': 1.1568101762089797e-06, 'batch_size': 3429, 'optimizer': 'Adam'}. Best is trial 26 with value: 0.04190055903435297.
2026-05-20 04:19:24,215 - experiment_functions - INFO - Early stopping at epoch 950. Best Recall: 0.0397
2026-05-20 04:19:24,350 - optuna.study.study - INFO - Trial 33 finished with value: 0.039705435882606326 and parameters: {'n_layers': 1, 'embedding_dim': 128, 'lr': 0.0004701240180817068, 'lambda_val': 1.1126120316124131e-06, 'batch_size': 3699, 'optimizer': 'Adam'}. Best is trial 26 with value: 0.04190055903435297.
2026-05-20 04:19:38,314 - experiment_functions - INFO - Early stopping at epoch 1050. Best Recall: 0.0404
2026-05-20 04:19:38,405 - optuna.study.study - INFO - Trial 34 finished with value: 0.040444003819347 and parameters: {'n_layers': 1, 'embedding_dim': 128, 'lr': 0.0003591581047797667, 'lambda_val': 5.773783813866126e-06, 'batch_size': 4096, 'optimizer': 'Adam'}. Best is trial 26 with value: 0.04190055903435297.
2026-05-20 04:19:49,403 - experiment_functions - INFO - Early stopping at epoch 800. Best Recall: 0.0366
2026-05-20 04:19:49,502 - optuna.study.study - INFO - Trial 35 finished with value: 0.036649000205822756 and parameters: {'n_layers': 1, 'embedding_dim': 128, 'lr': 0.0004700106211112862, 'lambda_val': 1.4316546726437433e-05, 'batch_size': 4024, 'optimizer': 'Adam'}. Best is trial 26 with value: 0.04190055903435297.
2026-05-20 04:19:57,031 - experiment_functions - INFO - Early stopping at epoch 500. Best Recall: 0.0050
2026-05-20 04:19:57,142 - optuna.study.study - INFO - Trial 36 finished with value: 0.005001580763960275 and parameters: {'n_layers': 2, 'embedding_dim': 128, 'lr': 0.00011873626858531348, 'lambda_val': 4.2604474544117564e-05, 'batch_size': 3898, 'optimizer': 'SGD'}. Best is trial 26 with value: 0.04190055903435297.
2026-05-20 04:20:05,541 - experiment_functions - INFO - Early stopping at epoch 550. Best Recall: 0.0395
2026-05-20 04:20:05,649 - optuna.study.study - INFO - Trial 37 finished with value: 0.03954131101242142 and parameters: {'n_layers': 1, 'embedding_dim': 128, 'lr': 0.0022483442958029704, 'lambda_val': 3.350867662774322e-06, 'batch_size': 3325, 'optimizer': 'Adam'}. Best is trial 26 with value: 0.04190055903435297.
2026-05-20 04:20:14,247 - experiment_functions - INFO - Early stopping at epoch 600. Best Recall: 0.0420
2026-05-20 04:20:14,404 - optuna.study.study - INFO - Trial 38 finished with value: 0.042012648552464726 and parameters: {'n_layers': 1, 'embedding_dim': 128, 'lr': 0.0018740701463101056, 'lambda_val': 2.60171523101019e-06, 'batch_size': 1715, 'optimizer': 'Adam'}. Best is trial 38 with value: 0.042012648552464726.
2026-05-20 04:20:22,038 - experiment_functions - INFO - Early stopping at epoch 550. Best Recall: 0.0317
2026-05-20 04:20:22,139 - optuna.study.study - INFO - Trial 39 finished with value: 0.03170974284553504 and parameters: {'n_layers': 2, 'embedding_dim': 128, 'lr': 0.0016922350102434281, 'lambda_val': 9.016396491203632e-06, 'batch_size': 1940, 'optimizer': 'Adam'}. Best is trial 38 with value: 0.042012648552464726.
2026-05-20 04:20:33,237 - experiment_functions - INFO - Early stopping at epoch 800. Best Recall: 0.0418
2026-05-20 04:20:33,327 - optuna.study.study - INFO - Trial 40 finished with value: 0.04182285516192557 and parameters: {'n_layers': 1, 'embedding_dim': 128, 'lr': 0.0006661162086675969, 'lambda_val': 2.346399585193546e-06, 'batch_size': 1520, 'optimizer': 'Adam'}. Best is trial 38 with value: 0.042012648552464726.
2026-05-20 04:20:44,604 - experiment_functions - INFO - Early stopping at epoch 850. Best Recall: 0.0420
2026-05-20 04:20:44,694 - optuna.study.study - INFO - Trial 41 finished with value: 0.04199558163879337 and parameters: {'n_layers': 1, 'embedding_dim': 128, 'lr': 0.0006717835493300496, 'lambda_val': 2.146223268922116e-06, 'batch_size': 1542, 'optimizer': 'Adam'}. Best is trial 38 with value: 0.042012648552464726.
2026-05-20 04:20:54,473 - experiment_functions - INFO - Early stopping at epoch 750. Best Recall: 0.0409
2026-05-20 04:20:54,562 - optuna.study.study - INFO - Trial 42 finished with value: 0.04090321397301495 and parameters: {'n_layers': 1, 'embedding_dim': 128, 'lr': 0.0008719702007762558, 'lambda_val': 2.3308940823853897e-06, 'batch_size': 1492, 'optimizer': 'Adam'}. Best is trial 38 with value: 0.042012648552464726.
2026-05-20 04:21:01,932 - experiment_functions - INFO - Early stopping at epoch 550. Best Recall: 0.0423
2026-05-20 04:21:02,081 - optuna.study.study - INFO - Trial 43 finished with value: 0.04229479700317 and parameters: {'n_layers': 1, 'embedding_dim': 96, 'lr': 0.003781254550948561, 'lambda_val': 1.9960500233888922e-06, 'batch_size': 1518, 'optimizer': 'Adam'}. Best is trial 43 with value: 0.04229479700317.
2026-05-20 04:21:10,736 - experiment_functions - INFO - Early stopping at epoch 550. Best Recall: 0.0065
2026-05-20 04:21:10,834 - optuna.study.study - INFO - Trial 44 finished with value: 0.006470799335845493 and parameters: {'n_layers': 4, 'embedding_dim': 96, 'lr': 0.0036307829208051313, 'lambda_val': 1.8637365129070282e-06, 'batch_size': 1532, 'optimizer': 'Adam'}. Best is trial 43 with value: 0.04229479700317.
2026-05-20 04:21:18,376 - experiment_functions - INFO - Early stopping at epoch 550. Best Recall: 0.0373
2026-05-20 04:21:18,479 - optuna.study.study - INFO - Trial 45 finished with value: 0.03732442481473687 and parameters: {'n_layers': 1, 'embedding_dim': 96, 'lr': 0.008442258359397064, 'lambda_val': 2.3477052131884004e-05, 'batch_size': 1176, 'optimizer': 'Adam'}. Best is trial 43 with value: 0.04229479700317.
2026-05-20 04:21:25,519 - experiment_functions - INFO - Early stopping at epoch 500. Best Recall: 0.0053
2026-05-20 04:21:25,627 - optuna.study.study - INFO - Trial 46 finished with value: 0.00532325467027062 and parameters: {'n_layers': 1, 'embedding_dim': 96, 'lr': 0.0011955348785094955, 'lambda_val': 2.7180309085384342e-06, 'batch_size': 1760, 'optimizer': 'SGD'}. Best is trial 43 with value: 0.04229479700317.
2026-05-20 04:21:32,581 - experiment_functions - INFO - Early stopping at epoch 500. Best Recall: 0.0049
2026-05-20 04:21:32,672 - optuna.study.study - INFO - Trial 47 finished with value: 0.004943013490090701 and parameters: {'n_layers': 2, 'embedding_dim': 96, 'lr': 0.019088968213931825, 'lambda_val': 3.5686124601075227e-06, 'batch_size': 1115, 'optimizer': 'Adam'}. Best is trial 43 with value: 0.04229479700317.
2026-05-20 04:21:41,093 - experiment_functions - INFO - Early stopping at epoch 600. Best Recall: 0.0434
2026-05-20 04:21:41,183 - optuna.study.study - INFO - Trial 48 finished with value: 0.043373614937474804 and parameters: {'n_layers': 1, 'embedding_dim': 128, 'lr': 0.002976560863253911, 'lambda_val': 0.00010959812790222436, 'batch_size': 882, 'optimizer': 'Adam'}. Best is trial 48 with value: 0.043373614937474804.
2026-05-20 04:21:48,620 - experiment_functions - INFO - Early stopping at epoch 550. Best Recall: 0.0375
2026-05-20 04:21:48,714 - optuna.study.study - INFO - Trial 49 finished with value: 0.037529982787561623 and parameters: {'n_layers': 2, 'embedding_dim': 64, 'lr': 0.002811455981794628, 'lambda_val': 0.00012651320059572346, 'batch_size': 625, 'optimizer': 'Adam'}. Best is trial 48 with value: 0.043373614937474804.
2026-05-20 04:21:56,013 - experiment_functions - INFO - Early stopping at epoch 550. Best Recall: 0.0428
2026-05-20 04:21:56,112 - optuna.study.study - INFO - Trial 50 finished with value: 0.042837881858426206 and parameters: {'n_layers': 1, 'embedding_dim': 96, 'lr': 0.006176691271820393, 'lambda_val': 6.365081948576999e-05, 'batch_size': 1034, 'optimizer': 'Adam'}. Best is trial 48 with value: 0.043373614937474804.
2026-05-20 04:22:03,431 - experiment_functions - INFO - Early stopping at epoch 550. Best Recall: 0.0387
2026-05-20 04:22:03,523 - optuna.study.study - INFO - Trial 51 finished with value: 0.03869992498103322 and parameters: {'n_layers': 1, 'embedding_dim': 96, 'lr': 0.00655469813121055, 'lambda_val': 7.962099143996669e-05, 'batch_size': 1019, 'optimizer': 'Adam'}. Best is trial 48 with value: 0.043373614937474804.
2026-05-20 04:22:11,083 - experiment_functions - INFO - Early stopping at epoch 550. Best Recall: 0.0266
2026-05-20 04:22:11,175 - optuna.study.study - INFO - Trial 52 finished with value: 0.026628325752037614 and parameters: {'n_layers': 1, 'embedding_dim': 96, 'lr': 0.015379186396831333, 'lambda_val': 3.0837097523360125e-05, 'batch_size': 853, 'optimizer': 'Adam'}. Best is trial 48 with value: 0.043373614937474804.
2026-05-20 04:22:18,409 - experiment_functions - INFO - Early stopping at epoch 550. Best Recall: 0.0409
2026-05-20 04:22:18,500 - optuna.study.study - INFO - Trial 53 finished with value: 0.04090074568994702 and parameters: {'n_layers': 1, 'embedding_dim': 96, 'lr': 0.004064599664658751, 'lambda_val': 0.00013187927864456795, 'batch_size': 1324, 'optimizer': 'Adam'}. Best is trial 48 with value: 0.043373614937474804.
2026-05-20 04:22:26,423 - experiment_functions - INFO - Early stopping at epoch 600. Best Recall: 0.0411
2026-05-20 04:22:26,526 - optuna.study.study - INFO - Trial 54 finished with value: 0.04107100010949395 and parameters: {'n_layers': 1, 'embedding_dim': 128, 'lr': 0.002348401211870121, 'lambda_val': 5.799303701991208e-05, 'batch_size': 1771, 'optimizer': 'Adam'}. Best is trial 48 with value: 0.043373614937474804.
2026-05-20 04:22:33,042 - experiment_functions - INFO - Early stopping at epoch 500. Best Recall: 0.0048
2026-05-20 04:22:33,143 - optuna.study.study - INFO - Trial 55 finished with value: 0.0048166862123908945 and parameters: {'n_layers': 1, 'embedding_dim': 96, 'lr': 0.005899648750862187, 'lambda_val': 0.00033359886482092326, 'batch_size': 1312, 'optimizer': 'SGD'}. Best is trial 48 with value: 0.043373614937474804.
2026-05-20 04:22:40,584 - experiment_functions - INFO - Early stopping at epoch 500. Best Recall: 0.0057
2026-05-20 04:22:40,685 - optuna.study.study - INFO - Trial 56 finished with value: 0.005690014023300748 and parameters: {'n_layers': 1, 'embedding_dim': 128, 'lr': 0.03795902318632202, 'lambda_val': 0.00021063886423939703, 'batch_size': 2016, 'optimizer': 'Adam'}. Best is trial 48 with value: 0.043373614937474804.
2026-05-20 04:22:49,502 - experiment_functions - INFO - Early stopping at epoch 650. Best Recall: 0.0437
2026-05-20 04:22:49,607 - optuna.study.study - INFO - Trial 57 finished with value: 0.04366997983398876 and parameters: {'n_layers': 1, 'embedding_dim': 64, 'lr': 0.0017957983798859783, 'lambda_val': 1.6872068682486707e-05, 'batch_size': 934, 'optimizer': 'Adam'}. Best is trial 57 with value: 0.04366997983398876.
2026-05-20 04:22:58,820 - experiment_functions - INFO - Early stopping at epoch 700. Best Recall: 0.0448
2026-05-20 04:22:58,913 - optuna.study.study - INFO - Trial 58 finished with value: 0.04480849008971031 and parameters: {'n_layers': 1, 'embedding_dim': 64, 'lr': 0.0018235137269396087, 'lambda_val': 1.6759509686188545e-05, 'batch_size': 552, 'optimizer': 'Adam'}. Best is trial 58 with value: 0.04480849008971031.
2026-05-20 04:23:07,091 - experiment_functions - INFO - Early stopping at epoch 600. Best Recall: 0.0372
2026-05-20 04:23:07,179 - optuna.study.study - INFO - Trial 59 finished with value: 0.0372189578676341 and parameters: {'n_layers': 2, 'embedding_dim': 64, 'lr': 0.0016371502807273194, 'lambda_val': 1.6758927135069578e-05, 'batch_size': 569, 'optimizer': 'Adam'}. Best is trial 58 with value: 0.04480849008971031.
2026-05-20 04:23:15,829 - experiment_functions - INFO - Early stopping at epoch 600. Best Recall: 0.0442
2026-05-20 04:23:15,929 - optuna.study.study - INFO - Trial 60 finished with value: 0.04424272477182212 and parameters: {'n_layers': 1, 'embedding_dim': 64, 'lr': 0.0028195368888097217, 'lambda_val': 8.581023655851276e-06, 'batch_size': 864, 'optimizer': 'Adam'}. Best is trial 58 with value: 0.04480849008971031.
2026-05-20 04:23:24,010 - experiment_functions - INFO - Early stopping at epoch 600. Best Recall: 0.0431
2026-05-20 04:23:24,109 - optuna.study.study - INFO - Trial 61 finished with value: 0.043122037527912965 and parameters: {'n_layers': 1, 'embedding_dim': 64, 'lr': 0.0034199334964145445, 'lambda_val': 1.4841927747756994e-05, 'batch_size': 810, 'optimizer': 'Adam'}. Best is trial 58 with value: 0.04480849008971031.
2026-05-20 04:23:32,399 - experiment_functions - INFO - Early stopping at epoch 600. Best Recall: 0.0436
2026-05-20 04:23:32,586 - optuna.study.study - INFO - Trial 62 finished with value: 0.043646389259784396 and parameters: {'n_layers': 1, 'embedding_dim': 64, 'lr': 0.003294784441190194, 'lambda_val': 8.697054032074559e-06, 'batch_size': 780, 'optimizer': 'Adam'}. Best is trial 58 with value: 0.04480849008971031.
2026-05-20 04:23:40,785 - experiment_functions - INFO - Early stopping at epoch 550. Best Recall: 0.0356
2026-05-20 04:23:40,904 - optuna.study.study - INFO - Trial 63 finished with value: 0.035551422390174746 and parameters: {'n_layers': 1, 'embedding_dim': 64, 'lr': 0.010128187072847347, 'lambda_val': 9.744900683003803e-06, 'batch_size': 760, 'optimizer': 'Adam'}. Best is trial 58 with value: 0.04480849008971031.
2026-05-20 04:23:50,172 - experiment_functions - INFO - Early stopping at epoch 700. Best Recall: 0.0439
2026-05-20 04:23:50,262 - optuna.study.study - INFO - Trial 64 finished with value: 0.04392273733699997 and parameters: {'n_layers': 1, 'embedding_dim': 64, 'lr': 0.0011452965499810916, 'lambda_val': 1.7548702588526382e-05, 'batch_size': 944, 'optimizer': 'Adam'}. Best is trial 58 with value: 0.04480849008971031.
2026-05-20 04:24:01,340 - experiment_functions - INFO - Early stopping at epoch 850. Best Recall: 0.0449
2026-05-20 04:24:01,435 - optuna.study.study - INFO - Trial 65 finished with value: 0.04485143606600341 and parameters: {'n_layers': 1, 'embedding_dim': 64, 'lr': 0.0010376473763041314, 'lambda_val': 1.8615788675744877e-05, 'batch_size': 871, 'optimizer': 'Adam'}. Best is trial 65 with value: 0.04485143606600341.
2026-05-20 04:24:10,851 - experiment_functions - INFO - Early stopping at epoch 700. Best Recall: 0.0447
2026-05-20 04:24:10,941 - optuna.study.study - INFO - Trial 66 finished with value: 0.044693228057284935 and parameters: {'n_layers': 1, 'embedding_dim': 64, 'lr': 0.0012343884545234155, 'lambda_val': 2.7035083156704468e-05, 'batch_size': 932, 'optimizer': 'Adam'}. Best is trial 65 with value: 0.04485143606600341.
2026-05-20 04:24:22,843 - experiment_functions - INFO - Early stopping at epoch 900. Best Recall: 0.0457
2026-05-20 04:24:22,937 - optuna.study.study - INFO - Trial 67 finished with value: 0.04569868096657098 and parameters: {'n_layers': 1, 'embedding_dim': 64, 'lr': 0.0010397311522989566, 'lambda_val': 2.092965938161775e-05, 'batch_size': 711, 'optimizer': 'Adam'}. Best is trial 67 with value: 0.04569868096657098.
2026-05-20 04:24:29,772 - experiment_functions - INFO - Early stopping at epoch 500. Best Recall: 0.0048
2026-05-20 04:24:29,883 - optuna.study.study - INFO - Trial 68 finished with value: 0.004791832090124384 and parameters: {'n_layers': 1, 'embedding_dim': 64, 'lr': 0.0011280247106313255, 'lambda_val': 2.380476929644864e-05, 'batch_size': 671, 'optimizer': 'SGD'}. Best is trial 67 with value: 0.04569868096657098.
2026-05-20 04:24:38,940 - experiment_functions - INFO - Early stopping at epoch 650. Best Recall: 0.0413
2026-05-20 04:24:39,039 - optuna.study.study - INFO - Trial 69 finished with value: 0.04130932522492396 and parameters: {'n_layers': 2, 'embedding_dim': 64, 'lr': 0.0011613713940553314, 'lambda_val': 3.254988893329625e-05, 'batch_size': 517, 'optimizer': 'Adam'}. Best is trial 67 with value: 0.04569868096657098.
2026-05-20 04:24:49,496 - experiment_functions - INFO - Early stopping at epoch 750. Best Recall: 0.0443
2026-05-20 04:24:49,604 - optuna.study.study - INFO - Trial 70 finished with value: 0.04434611336252158 and parameters: {'n_layers': 1, 'embedding_dim': 64, 'lr': 0.0008668528569332492, 'lambda_val': 1.7003696078575974e-05, 'batch_size': 996, 'optimizer': 'Adam'}. Best is trial 67 with value: 0.04569868096657098.
2026-05-20 04:25:02,832 - experiment_functions - INFO - Early stopping at epoch 1000. Best Recall: 0.0437
2026-05-20 04:25:03,011 - optuna.study.study - INFO - Trial 71 finished with value: 0.043732184029707674 and parameters: {'n_layers': 1, 'embedding_dim': 64, 'lr': 0.0009950041913321488, 'lambda_val': 1.588848076529263e-05, 'batch_size': 964, 'optimizer': 'Adam'}. Best is trial 67 with value: 0.04569868096657098.
2026-05-20 04:25:15,543 - experiment_functions - INFO - Early stopping at epoch 950. Best Recall: 0.0457
