2026-05-20 09:57:52,600 - optuna.study.study - INFO - Trial 181 finished with value: 0.0895300614814044 and parameters: {'n_layers': 1, 'embedding_dim': 96, 'lr': 0.0007797414419545109, 'lambda_val': 9.585388130016456e-06, 'batch_size': 937, 'optimizer': 'Adam'}. Best is trial 156 with value: 0.09382427367571183.
2026-05-20 09:58:06,460 - experiment_functions - INFO - Early stopping at epoch 950. Best Recall: 0.0922
2026-05-20 09:58:06,559 - optuna.study.study - INFO - Trial 182 finished with value: 0.09219412557244241 and parameters: {'n_layers': 1, 'embedding_dim': 64, 'lr': 0.0009550480470863415, 'lambda_val': 7.822643206288906e-06, 'batch_size': 1222, 'optimizer': 'Adam'}. Best is trial 156 with value: 0.09382427367571183.
2026-05-20 09:58:21,261 - experiment_functions - INFO - Early stopping at epoch 950. Best Recall: 0.0889
2026-05-20 09:58:21,397 - optuna.study.study - INFO - Trial 183 finished with value: 0.0889225497488439 and parameters: {'n_layers': 1, 'embedding_dim': 64, 'lr': 0.0009808337362455489, 'lambda_val': 1.1281965977671012e-05, 'batch_size': 1224, 'optimizer': 'Adam'}. Best is trial 156 with value: 0.09382427367571183.
2026-05-20 09:58:44,872 - experiment_functions - INFO - Early stopping at epoch 1000. Best Recall: 0.0917
2026-05-20 09:58:44,962 - optuna.study.study - INFO - Trial 184 finished with value: 0.09171199496937289 and parameters: {'n_layers': 1, 'embedding_dim': 64, 'lr': 0.0008906069241899001, 'lambda_val': 7.296310306108591e-06, 'batch_size': 1286, 'optimizer': 'Adam'}. Best is trial 156 with value: 0.09382427367571183.
2026-05-20 09:58:59,303 - experiment_functions - INFO - Early stopping at epoch 1000. Best Recall: 0.0890
2026-05-20 09:58:59,393 - optuna.study.study - INFO - Trial 185 finished with value: 0.08902917476260314 and parameters: {'n_layers': 1, 'embedding_dim': 64, 'lr': 0.0007229559173214774, 'lambda_val': 7.208116607973184e-06, 'batch_size': 1312, 'optimizer': 'Adam'}. Best is trial 156 with value: 0.09382427367571183.
2026-05-20 09:59:13,469 - experiment_functions - INFO - Early stopping at epoch 950. Best Recall: 0.0903
2026-05-20 09:59:13,557 - optuna.study.study - INFO - Trial 186 finished with value: 0.09032278220877107 and parameters: {'n_layers': 1, 'embedding_dim': 64, 'lr': 0.000848642557890197, 'lambda_val': 6.948977550646321e-06, 'batch_size': 1250, 'optimizer': 'Adam'}. Best is trial 156 with value: 0.09382427367571183.
2026-05-20 09:59:33,150 - experiment_functions - INFO - Early stopping at epoch 1400. Best Recall: 0.0889
2026-05-20 09:59:33,239 - optuna.study.study - INFO - Trial 187 finished with value: 0.08887356956458499 and parameters: {'n_layers': 1, 'embedding_dim': 32, 'lr': 0.0006120583966788956, 'lambda_val': 5.062401381835617e-06, 'batch_size': 1159, 'optimizer': 'Adam'}. Best is trial 156 with value: 0.09382427367571183.
2026-05-20 09:59:48,934 - experiment_functions - INFO - Early stopping at epoch 1050. Best Recall: 0.0905
2026-05-20 09:59:49,023 - optuna.study.study - INFO - Trial 188 finished with value: 0.09046348313516338 and parameters: {'n_layers': 1, 'embedding_dim': 64, 'lr': 0.0009630326875687361, 'lambda_val': 3.798963044016967e-06, 'batch_size': 781, 'optimizer': 'Adam'}. Best is trial 156 with value: 0.09382427367571183.
2026-05-20 10:00:02,351 - experiment_functions - INFO - Early stopping at epoch 900. Best Recall: 0.0887
2026-05-20 10:00:02,450 - optuna.study.study - INFO - Trial 189 finished with value: 0.08866371765846265 and parameters: {'n_layers': 1, 'embedding_dim': 64, 'lr': 0.00114319010900593, 'lambda_val': 8.61574267614018e-06, 'batch_size': 1161, 'optimizer': 'Adam'}. Best is trial 156 with value: 0.09382427367571183.
2026-05-20 10:00:18,269 - experiment_functions - INFO - Early stopping at epoch 1100. Best Recall: 0.0910
2026-05-20 10:00:18,379 - optuna.study.study - INFO - Trial 190 finished with value: 0.09096421697237787 and parameters: {'n_layers': 1, 'embedding_dim': 64, 'lr': 0.000718556276880389, 'lambda_val': 1.221218623385215e-05, 'batch_size': 1329, 'optimizer': 'Adam'}. Best is trial 156 with value: 0.09382427367571183.
2026-05-20 10:00:38,985 - experiment_functions - INFO - Early stopping at epoch 800. Best Recall: 0.0871
2026-05-20 10:00:39,525 - optuna.study.study - INFO - Trial 191 finished with value: 0.08714565968897967 and parameters: {'n_layers': 1, 'embedding_dim': 64, 'lr': 0.0013356968068560478, 'lambda_val': 1.4840129590813216e-05, 'batch_size': 1080, 'optimizer': 'Adam'}. Best is trial 156 with value: 0.09382427367571183.
2026-05-20 10:00:51,507 - experiment_functions - INFO - Early stopping at epoch 800. Best Recall: 0.0894
2026-05-20 10:00:51,597 - optuna.study.study - INFO - Trial 192 finished with value: 0.08944495329331961 and parameters: {'n_layers': 1, 'embedding_dim': 64, 'lr': 0.0011666670320441036, 'lambda_val': 9.866257657109055e-06, 'batch_size': 1022, 'optimizer': 'Adam'}. Best is trial 156 with value: 0.09382427367571183.
2026-05-20 10:01:06,971 - experiment_functions - INFO - Early stopping at epoch 1050. Best Recall: 0.0873
2026-05-20 10:01:07,070 - optuna.study.study - INFO - Trial 193 finished with value: 0.0872672542735789 and parameters: {'n_layers': 1, 'embedding_dim': 64, 'lr': 0.0008766602245474663, 'lambda_val': 6.787999381672492e-06, 'batch_size': 949, 'optimizer': 'Adam'}. Best is trial 156 with value: 0.09382427367571183.
2026-05-20 10:01:32,038 - experiment_functions - INFO - Early stopping at epoch 1700. Best Recall: 0.0923
2026-05-20 10:01:32,162 - optuna.study.study - INFO - Trial 194 finished with value: 0.09234942574277331 and parameters: {'n_layers': 1, 'embedding_dim': 64, 'lr': 0.0005692578409125541, 'lambda_val': 1.7540324064949874e-05, 'batch_size': 865, 'optimizer': 'Adam'}. Best is trial 156 with value: 0.09382427367571183.
2026-05-20 10:02:05,910 - experiment_functions - INFO - Early stopping at epoch 2350. Best Recall: 0.0922
2026-05-20 10:02:05,999 - optuna.study.study - INFO - Trial 195 finished with value: 0.09219114126932837 and parameters: {'n_layers': 1, 'embedding_dim': 64, 'lr': 0.0005547439444451745, 'lambda_val': 1.7392587046317128e-05, 'batch_size': 662, 'optimizer': 'Adam'}. Best is trial 156 with value: 0.09382427367571183.
2026-05-20 10:02:27,727 - experiment_functions - INFO - Early stopping at epoch 1550. Best Recall: 0.0920
2026-05-20 10:02:27,815 - optuna.study.study - INFO - Trial 196 finished with value: 0.0919516885488466 and parameters: {'n_layers': 1, 'embedding_dim': 64, 'lr': 0.0005808721659542239, 'lambda_val': 1.7914875073643726e-05, 'batch_size': 837, 'optimizer': 'Adam'}. Best is trial 156 with value: 0.09382427367571183.
2026-05-20 10:02:51,373 - experiment_functions - INFO - Early stopping at epoch 1650. Best Recall: 0.0913
2026-05-20 10:02:51,464 - optuna.study.study - INFO - Trial 197 finished with value: 0.09133026717356624 and parameters: {'n_layers': 1, 'embedding_dim': 64, 'lr': 0.0006120261943855894, 'lambda_val': 1.7770585220561733e-05, 'batch_size': 835, 'optimizer': 'Adam'}. Best is trial 156 with value: 0.09382427367571183.
2026-05-20 10:03:17,339 - experiment_functions - INFO - Early stopping at epoch 1850. Best Recall: 0.0904
2026-05-20 10:03:17,427 - optuna.study.study - INFO - Trial 198 finished with value: 0.09044938412584437 and parameters: {'n_layers': 1, 'embedding_dim': 64, 'lr': 0.0005359610763459248, 'lambda_val': 1.231130339473491e-05, 'batch_size': 767, 'optimizer': 'Adam'}. Best is trial 156 with value: 0.09382427367571183.
2026-05-20 10:03:37,983 - experiment_functions - INFO - Early stopping at epoch 1400. Best Recall: 0.0918
2026-05-20 10:03:38,072 - optuna.study.study - INFO - Trial 199 finished with value: 0.09184084771749287 and parameters: {'n_layers': 1, 'embedding_dim': 64, 'lr': 0.0007327531383116511, 'lambda_val': 1.7565553691491262e-05, 'batch_size': 659, 'optimizer': 'Adam'}. Best is trial 156 with value: 0.09382427367571183.
2026-05-20 10:04:07,921 - experiment_functions - INFO - Early stopping at epoch 2150. Best Recall: 0.0954
2026-05-20 10:04:08,000 - optuna.study.study - INFO - Trial 200 finished with value: 0.09544172882356812 and parameters: {'n_layers': 1, 'embedding_dim': 64, 'lr': 0.0005646110368373352, 'lambda_val': 1.7744095966494728e-05, 'batch_size': 649, 'optimizer': 'Adam'}. Best is trial 200 with value: 0.09544172882356812.
2026-05-20 10:04:53,758 - experiment_functions - INFO - Early stopping at epoch 3300. Best Recall: 0.0946
2026-05-20 10:04:53,847 - optuna.study.study - INFO - Trial 201 finished with value: 0.09460298209748186 and parameters: {'n_layers': 1, 'embedding_dim': 64, 'lr': 0.0005761254584209567, 'lambda_val': 1.8814693099319826e-05, 'batch_size': 664, 'optimizer': 'Adam'}. Best is trial 200 with value: 0.09544172882356812.
2026-05-20 10:05:24,417 - experiment_functions - INFO - Early stopping at epoch 2100. Best Recall: 0.0914
2026-05-20 10:05:24,496 - optuna.study.study - INFO - Trial 202 finished with value: 0.09143265508897938 and parameters: {'n_layers': 1, 'embedding_dim': 64, 'lr': 0.0005648868918910957, 'lambda_val': 1.6538246529294713e-05, 'batch_size': 646, 'optimizer': 'Adam'}. Best is trial 200 with value: 0.09544172882356812.
2026-05-20 10:05:47,186 - experiment_functions - INFO - Early stopping at epoch 1550. Best Recall: 0.0932
2026-05-20 10:05:47,951 - optuna.study.study - INFO - Trial 203 finished with value: 0.09322226509931351 and parameters: {'n_layers': 1, 'embedding_dim': 64, 'lr': 0.0007126148534791177, 'lambda_val': 2.0089679253378147e-05, 'batch_size': 701, 'optimizer': 'Adam'}. Best is trial 200 with value: 0.09544172882356812.
2026-05-20 10:06:04,907 - optuna.study._optimize - INFO - Trial 204 pruned. 
2026-05-20 10:06:23,452 - optuna.study._optimize - INFO - Trial 205 pruned. 
2026-05-20 10:06:49,189 - experiment_functions - INFO - Early stopping at epoch 1650. Best Recall: 0.0914
2026-05-20 10:06:49,323 - optuna.study.study - INFO - Trial 206 finished with value: 0.09140594627388664 and parameters: {'n_layers': 1, 'embedding_dim': 64, 'lr': 0.0006976679373781531, 'lambda_val': 2.0456140733857096e-05, 'batch_size': 668, 'optimizer': 'Adam'}. Best is trial 200 with value: 0.09544172882356812.
2026-05-20 10:07:23,951 - experiment_functions - INFO - Early stopping at epoch 2400. Best Recall: 0.0946
2026-05-20 10:07:24,030 - optuna.study.study - INFO - Trial 207 finished with value: 0.09460889241301587 and parameters: {'n_layers': 1, 'embedding_dim': 64, 'lr': 0.0005787566431723443, 'lambda_val': 1.2845894862918054e-05, 'batch_size': 627, 'optimizer': 'Adam'}. Best is trial 200 with value: 0.09544172882356812.
2026-05-20 10:08:06,540 - experiment_functions - INFO - Early stopping at epoch 2650. Best Recall: 0.0925
2026-05-20 10:08:06,630 - optuna.study.study - INFO - Trial 208 finished with value: 0.09250295326983353 and parameters: {'n_layers': 1, 'embedding_dim': 64, 'lr': 0.0005297621275494922, 'lambda_val': 1.3667603981811094e-05, 'batch_size': 621, 'optimizer': 'Adam'}. Best is trial 200 with value: 0.09544172882356812.
2026-05-20 10:08:51,943 - experiment_functions - INFO - Early stopping at epoch 3150. Best Recall: 0.0929
2026-05-20 10:08:52,022 - optuna.study.study - INFO - Trial 209 finished with value: 0.09288495606340302 and parameters: {'n_layers': 1, 'embedding_dim': 64, 'lr': 0.0005269058402134429, 'lambda_val': 1.2989493456685925e-05, 'batch_size': 608, 'optimizer': 'Adam'}. Best is trial 200 with value: 0.09544172882356812.
2026-05-20 10:09:19,870 - experiment_functions - INFO - Early stopping at epoch 1900. Best Recall: 0.0962
2026-05-20 10:09:19,974 - optuna.study.study - INFO - Trial 210 finished with value: 0.09618519750628236 and parameters: {'n_layers': 1, 'embedding_dim': 64, 'lr': 0.000539333637698036, 'lambda_val': 1.1717855771441554e-05, 'batch_size': 608, 'optimizer': 'RMSprop'}. Best is trial 210 with value: 0.09618519750628236.
2026-05-20 10:09:43,371 - optuna.study._optimize - INFO - Trial 211 pruned. 
2026-05-20 10:10:09,178 - experiment_functions - INFO - Early stopping at epoch 1350. Best Recall: 0.0922
2026-05-20 10:10:09,311 - optuna.study.study - INFO - Trial 212 finished with value: 0.09218273964452427 and parameters: {'n_layers': 1, 'embedding_dim': 128, 'lr': 0.000577568226226452, 'lambda_val': 9.827937348595279e-06, 'batch_size': 632, 'optimizer': 'RMSprop'}. Best is trial 210 with value: 0.09618519750628236.
2026-05-20 10:10:37,380 - experiment_functions - INFO - Early stopping at epoch 1900. Best Recall: 0.0937
2026-05-20 10:10:37,469 - optuna.study.study - INFO - Trial 213 finished with value: 0.09367962796349394 and parameters: {'n_layers': 1, 'embedding_dim': 128, 'lr': 0.00048747680970810653, 'lambda_val': 9.568995260755875e-06, 'batch_size': 623, 'optimizer': 'RMSprop'}. Best is trial 210 with value: 0.09618519750628236.
2026-05-20 10:11:10,417 - experiment_functions - INFO - Early stopping at epoch 1900. Best Recall: 0.0962
2026-05-20 10:11:10,506 - optuna.study.study - INFO - Trial 214 finished with value: 0.0961682189079101 and parameters: {'n_layers': 1, 'embedding_dim': 128, 'lr': 0.0004884936934308054, 'lambda_val': 1.2436366658478753e-05, 'batch_size': 596, 'optimizer': 'RMSprop'}. Best is trial 210 with value: 0.09618519750628236.
2026-05-20 10:11:25,317 - optuna.study._optimize - INFO - Trial 215 pruned. 
2026-05-20 10:12:08,716 - experiment_functions - INFO - Early stopping at epoch 2800. Best Recall: 0.0959
2026-05-20 10:12:08,805 - optuna.study.study - INFO - Trial 216 finished with value: 0.09589912739980529 and parameters: {'n_layers': 1, 'embedding_dim': 128, 'lr': 0.0004600746171130565, 'lambda_val': 1.2942719584317668e-05, 'batch_size': 597, 'optimizer': 'RMSprop'}. Best is trial 210 with value: 0.09618519750628236.
2026-05-20 10:12:48,895 - experiment_functions - INFO - Early stopping at epoch 2450. Best Recall: 0.0950
2026-05-20 10:12:48,983 - optuna.study.study - INFO - Trial 217 finished with value: 0.0949613535546464 and parameters: {'n_layers': 1, 'embedding_dim': 128, 'lr': 0.00046703722991673523, 'lambda_val': 1.2128032849960138e-05, 'batch_size': 603, 'optimizer': 'RMSprop'}. Best is trial 210 with value: 0.09618519750628236.
2026-05-20 10:13:40,350 - experiment_functions - INFO - Early stopping at epoch 3100. Best Recall: 0.0942
2026-05-20 10:13:41,116 - optuna.study.study - INFO - Trial 218 finished with value: 0.09419760195884756 and parameters: {'n_layers': 1, 'embedding_dim': 128, 'lr': 0.0004573170317955606, 'lambda_val': 1.2646573164076917e-05, 'batch_size': 599, 'optimizer': 'RMSprop'}. Best is trial 210 with value: 0.09618519750628236.
2026-05-20 10:14:18,485 - experiment_functions - INFO - Early stopping at epoch 2550. Best Recall: 0.0969
2026-05-20 10:14:18,586 - optuna.study.study - INFO - Trial 219 finished with value: 0.096892020610884 and parameters: {'n_layers': 1, 'embedding_dim': 128, 'lr': 0.0004875672210145436, 'lambda_val': 1.2347044397346184e-05, 'batch_size': 590, 'optimizer': 'RMSprop'}. Best is trial 219 with value: 0.096892020610884.
2026-05-20 10:14:33,490 - optuna.study._optimize - INFO - Trial 220 pruned. 
2026-05-20 10:15:21,871 - experiment_functions - INFO - Early stopping at epoch 2900. Best Recall: 0.0958
2026-05-20 10:15:22,436 - optuna.study.study - INFO - Trial 221 finished with value: 0.09579960053632772 and parameters: {'n_layers': 1, 'embedding_dim': 128, 'lr': 0.0004635917642811461, 'lambda_val': 1.3358943041416438e-05, 'batch_size': 517, 'optimizer': 'RMSprop'}. Best is trial 219 with value: 0.096892020610884.
2026-05-20 10:16:20,799 - optuna.study.study - INFO - Trial 222 finished with value: 0.09433352421699435 and parameters: {'n_layers': 1, 'embedding_dim': 128, 'lr': 0.00044904771955211765, 'lambda_val': 1.2229304141385021e-05, 'batch_size': 533, 'optimizer': 'RMSprop'}. Best is trial 219 with value: 0.096892020610884.
2026-05-20 10:16:55,452 - experiment_functions - INFO - Early stopping at epoch 2350. Best Recall: 0.0950
2026-05-20 10:16:55,530 - optuna.study.study - INFO - Trial 223 finished with value: 0.09503874473117856 and parameters: {'n_layers': 1, 'embedding_dim': 128, 'lr': 0.0004619277783725992, 'lambda_val': 1.2225305491254823e-05, 'batch_size': 536, 'optimizer': 'RMSprop'}. Best is trial 219 with value: 0.096892020610884.
2026-05-20 10:17:10,805 - optuna.study._optimize - INFO - Trial 224 pruned. 
2026-05-20 10:17:56,609 - experiment_functions - INFO - Early stopping at epoch 2600. Best Recall: 0.0969
2026-05-20 10:17:56,700 - optuna.study.study - INFO - Trial 225 finished with value: 0.0968936457107815 and parameters: {'n_layers': 1, 'embedding_dim': 128, 'lr': 0.00044918347858496297, 'lambda_val': 9.393452981639028e-06, 'batch_size': 516, 'optimizer': 'RMSprop'}. Best is trial 225 with value: 0.0968936457107815.
2026-05-20 10:18:45,647 - experiment_functions - INFO - Early stopping at epoch 3400. Best Recall: 0.0971
2026-05-20 10:18:45,738 - optuna.study.study - INFO - Trial 226 finished with value: 0.09714850998063855 and parameters: {'n_layers': 1, 'embedding_dim': 128, 'lr': 0.00043126390422654047, 'lambda_val': 9.150736176854454e-06, 'batch_size': 589, 'optimizer': 'RMSprop'}. Best is trial 226 with value: 0.09714850998063855.
2026-05-20 10:19:24,510 - experiment_functions - INFO - Early stopping at epoch 2650. Best Recall: 0.0943
2026-05-20 10:19:24,653 - optuna.study.study - INFO - Trial 227 finished with value: 0.09428955863072369 and parameters: {'n_layers': 1, 'embedding_dim': 128, 'lr': 0.00043479771180424137, 'lambda_val': 8.948107746931565e-06, 'batch_size': 589, 'optimizer': 'RMSprop'}. Best is trial 226 with value: 0.09714850998063855.
2026-05-20 10:20:02,436 - experiment_functions - INFO - Early stopping at epoch 2550. Best Recall: 0.0951
2026-05-20 10:20:02,525 - optuna.study.study - INFO - Trial 228 finished with value: 0.09507926929323071 and parameters: {'n_layers': 1, 'embedding_dim': 128, 'lr': 0.00043798793775198097, 'lambda_val': 8.680115380183189e-06, 'batch_size': 531, 'optimizer': 'RMSprop'}. Best is trial 226 with value: 0.09714850998063855.
2026-05-20 10:20:50,832 - experiment_functions - INFO - Early stopping at epoch 3200. Best Recall: 0.0953
2026-05-20 10:20:50,965 - optuna.study.study - INFO - Trial 229 finished with value: 0.09525331182102806 and parameters: {'n_layers': 1, 'embedding_dim': 128, 'lr': 0.00043258633042009737, 'lambda_val': 9.335126154914251e-06, 'batch_size': 513, 'optimizer': 'RMSprop'}. Best is trial 226 with value: 0.09714850998063855.
2026-05-20 10:21:13,771 - optuna.study._optimize - INFO - Trial 230 pruned. 
2026-05-20 10:21:32,616 - optuna.study._optimize - INFO - Trial 231 pruned. 
2026-05-20 10:22:10,704 - experiment_functions - INFO - Early stopping at epoch 2650. Best Recall: 0.0939
2026-05-20 10:22:10,809 - optuna.study.study - INFO - Trial 232 finished with value: 0.09390764021261948 and parameters: {'n_layers': 1, 'embedding_dim': 128, 'lr': 0.0004452271709786212, 'lambda_val': 6.018808093694819e-06, 'batch_size': 597, 'optimizer': 'RMSprop'}. Best is trial 226 with value: 0.09714850998063855.
2026-05-20 10:22:26,058 - optuna.study._optimize - INFO - Trial 233 pruned. 
2026-05-20 10:22:59,584 - experiment_functions - INFO - Early stopping at epoch 2100. Best Recall: 0.0937
2026-05-20 10:23:00,349 - optuna.study.study - INFO - Trial 234 finished with value: 0.09370536608566996 and parameters: {'n_layers': 1, 'embedding_dim': 128, 'lr': 0.00044178547258178576, 'lambda_val': 6.039434848709155e-06, 'batch_size': 719, 'optimizer': 'RMSprop'}. Best is trial 226 with value: 0.09714850998063855.
2026-05-20 10:23:36,727 - experiment_functions - INFO - Early stopping at epoch 2050. Best Recall: 0.0944
2026-05-20 10:23:36,806 - optuna.study.study - INFO - Trial 235 finished with value: 0.09435787110179873 and parameters: {'n_layers': 1, 'embedding_dim': 128, 'lr': 0.0004681561746533759, 'lambda_val': 5.945150523898718e-06, 'batch_size': 590, 'optimizer': 'RMSprop'}. Best is trial 226 with value: 0.09714850998063855.
2026-05-20 10:24:05,046 - optuna.study._optimize - INFO - Trial 236 pruned. 
2026-05-20 10:24:20,001 - optuna.study._optimize - INFO - Trial 237 pruned. 
2026-05-20 10:24:58,681 - experiment_functions - INFO - Early stopping at epoch 2600. Best Recall: 0.0958
2026-05-20 10:24:58,771 - optuna.study.study - INFO - Trial 238 finished with value: 0.09582401833386564 and parameters: {'n_layers': 1, 'embedding_dim': 128, 'lr': 0.0004659649463950129, 'lambda_val': 9.499300498233769e-06, 'batch_size': 512, 'optimizer': 'RMSprop'}. Best is trial 226 with value: 0.09714850998063855.
2026-05-20 10:25:40,573 - experiment_functions - INFO - Early stopping at epoch 2900. Best Recall: 0.0965
2026-05-20 10:25:40,651 - optuna.study.study - INFO - Trial 239 finished with value: 0.09645695254198118 and parameters: {'n_layers': 1, 'embedding_dim': 128, 'lr': 0.00045413186217125787, 'lambda_val': 9.041184679051749e-06, 'batch_size': 519, 'optimizer': 'RMSprop'}. Best is trial 226 with value: 0.09714850998063855.
2026-05-20 10:25:55,669 - optuna.study._optimize - INFO - Trial 240 pruned. 
2026-05-20 10:26:23,028 - optuna.study._optimize - INFO - Trial 241 pruned. 
2026-05-20 10:26:37,918 - optuna.study._optimize - INFO - Trial 242 pruned. 
2026-05-20 10:27:21,850 - experiment_functions - INFO - Early stopping at epoch 3000. Best Recall: 0.0973
2026-05-20 10:27:21,989 - optuna.study.study - INFO - Trial 243 finished with value: 0.0972734812008288 and parameters: {'n_layers': 1, 'embedding_dim': 128, 'lr': 0.0004391119941890253, 'lambda_val': 9.505517174634277e-06, 'batch_size': 580, 'optimizer': 'RMSprop'}. Best is trial 243 with value: 0.0972734812008288.
2026-05-20 10:28:20,226 - optuna.study.study - INFO - Trial 244 finished with value: 0.09639813119152389 and parameters: {'n_layers': 1, 'embedding_dim': 128, 'lr': 0.0004188721634744414, 'lambda_val': 8.022557296036029e-06, 'batch_size': 515, 'optimizer': 'RMSprop'}. Best is trial 243 with value: 0.0972734812008288.
