2026-05-20 06:57:26,700 - optuna.study.study - INFO - Trial 297 finished with value: 0.08502856265068043 and parameters: {'n_layers': 1, 'embedding_dim': 32, 'lr': 0.0010037785249255508, 'lambda_val': 0.0016948202077325116, 'batch_size': 713, 'optimizer': 'Adam'}. Best is trial 285 with value: 0.08959664764408455.
2026-05-20 06:57:41,466 - experiment_functions - INFO - Early stopping at epoch 1000. Best Recall: 0.0864
2026-05-20 06:57:41,555 - optuna.study.study - INFO - Trial 298 finished with value: 0.086388539764476 and parameters: {'n_layers': 1, 'embedding_dim': 32, 'lr': 0.0009723993559525541, 'lambda_val': 0.0026715155943300324, 'batch_size': 895, 'optimizer': 'Adam'}. Best is trial 285 with value: 0.08959664764408455.
2026-05-20 06:57:55,615 - experiment_functions - INFO - Early stopping at epoch 900. Best Recall: 0.0873
2026-05-20 06:57:56,380 - optuna.study.study - INFO - Trial 299 finished with value: 0.08727898790260005 and parameters: {'n_layers': 1, 'embedding_dim': 32, 'lr': 0.0009943018438454197, 'lambda_val': 0.0030513729725205464, 'batch_size': 912, 'optimizer': 'Adam'}. Best is trial 285 with value: 0.08959664764408455.
2026-05-20 06:57:56,382 - experiment_functions - INFO - Training the best model ... for e_1M_1c2dcs
2026-05-20 06:58:06,518 - experiment_functions - INFO - Early stopping at epoch 850. Best Recall: 0.0878
2026-05-20 06:58:07,641 - root - INFO -   **** Training e_1M_1c2dcs_rand1
2026-05-20 06:58:07,700 - root - INFO -   **** Getting 202263/805443 random edges
2026-05-20 06:58:07,760 - experiment_functions - INFO - Training the best model ... for e_1M_1c2dcs_rand1
2026-05-20 06:58:19,507 - experiment_functions - INFO - Early stopping at epoch 1100. Best Recall: 0.0668
2026-05-20 06:58:20,410 - root - INFO -   **** Training e_1M_1c2dcs_rand2
2026-05-20 06:58:20,469 - root - INFO -   **** Getting 202263/805443 random edges
2026-05-20 06:58:20,528 - experiment_functions - INFO - Training the best model ... for e_1M_1c2dcs_rand2
2026-05-20 06:58:31,879 - experiment_functions - INFO - Early stopping at epoch 1050. Best Recall: 0.0618
2026-05-20 06:58:32,782 - root - INFO -   **** Training e_1M_1c2dcs_rand3
2026-05-20 06:58:32,842 - root - INFO -   **** Getting 202263/805443 random edges
2026-05-20 06:58:32,901 - experiment_functions - INFO - Training the best model ... for e_1M_1c2dcs_rand3
2026-05-20 06:58:43,136 - experiment_functions - INFO - Early stopping at epoch 950. Best Recall: 0.0681
2026-05-20 06:58:44,035 - root - INFO -   **** Training e_1M_1c2dcs_rand4
2026-05-20 06:58:44,093 - root - INFO -   **** Getting 202263/805443 random edges
2026-05-20 06:58:44,147 - experiment_functions - INFO - Training the best model ... for e_1M_1c2dcs_rand4
2026-05-20 06:58:54,391 - experiment_functions - INFO - Early stopping at epoch 950. Best Recall: 0.0718
2026-05-20 06:58:55,480 - root - INFO -   **** Training e_1M_1c2dcs_rand5
2026-05-20 06:58:55,538 - root - INFO -   **** Getting 202263/805443 random edges
2026-05-20 06:58:55,597 - experiment_functions - INFO - Training the best model ... for e_1M_1c2dcs_rand5
2026-05-20 06:59:06,208 - experiment_functions - INFO - Early stopping at epoch 1000. Best Recall: 0.0621
2026-05-20 06:59:07,105 - root - INFO - **** Training e_1M_1c3dcs
2026-05-20 06:59:07,105 - root - INFO -   ** 3-Dominant stats:
2026-05-20 06:59:07,105 - root - INFO -   ** Finding the dominant set:
2026-05-20 07:40:05,640 - root - INFO -   ** Getting the trainable edges:
2026-05-20 07:40:05,655 - helper_functions - INFO -      Number of nodes: 4781
2026-05-20 07:40:05,655 - helper_functions - INFO -      Ratio: 0.4905602298378822
2026-05-20 07:40:05,655 - helper_functions - INFO -      Number of unique users: 3174
2026-05-20 07:40:05,655 - helper_functions - INFO -      Number of unique items: 1607
2026-05-20 07:40:05,655 - helper_functions - INFO -      Total dominant set edge: 28653
2026-05-20 07:40:05,655 - helper_functions - INFO -      Trainable edges: 22922.4
2026-05-20 07:40:05,685 - root - INFO -   **** Getting 28653 dominant set edges
2026-05-20 07:40:05,806 - optuna.storages._rdb.storage - INFO - A new study created in RDB with name: Study_e_1M_1c3dcs_strict
2026-05-20 07:40:18,873 - experiment_functions - INFO - Early stopping at epoch 950. Best Recall: 0.0056
2026-05-20 07:40:19,008 - optuna.study.study - INFO - Trial 0 finished with value: 0.0056056457866071946 and parameters: {'n_layers': 2, 'embedding_dim': 256, 'lr': 0.03303695909719353, 'lambda_val': 0.005173415658717513, 'batch_size': 2124, 'optimizer': 'SGD'}. Best is trial 0 with value: 0.0056056457866071946.
2026-05-20 07:40:40,486 - experiment_functions - INFO - Early stopping at epoch 1600. Best Recall: 0.0050
2026-05-20 07:40:40,587 - optuna.study.study - INFO - Trial 1 finished with value: 0.004992910185245008 and parameters: {'n_layers': 4, 'embedding_dim': 64, 'lr': 1.2805424344007205e-05, 'lambda_val': 0.035650401864590016, 'batch_size': 3181, 'optimizer': 'RMSprop'}. Best is trial 0 with value: 0.0056056457866071946.
2026-05-20 07:40:48,052 - experiment_functions - INFO - Early stopping at epoch 500. Best Recall: 0.0046
2026-05-20 07:40:48,142 - optuna.study.study - INFO - Trial 2 finished with value: 0.004586969766190358 and parameters: {'n_layers': 3, 'embedding_dim': 32, 'lr': 0.0030749876144398826, 'lambda_val': 0.014075126279486915, 'batch_size': 4042, 'optimizer': 'Adam'}. Best is trial 0 with value: 0.0056056457866071946.
2026-05-20 07:40:55,237 - experiment_functions - INFO - Early stopping at epoch 500. Best Recall: 0.0054
2026-05-20 07:40:55,327 - optuna.study.study - INFO - Trial 3 finished with value: 0.005389006677469031 and parameters: {'n_layers': 2, 'embedding_dim': 32, 'lr': 0.09523773073059592, 'lambda_val': 2.7279522716696847e-06, 'batch_size': 2607, 'optimizer': 'SGD'}. Best is trial 0 with value: 0.0056056457866071946.
2026-05-20 07:41:09,195 - experiment_functions - INFO - Early stopping at epoch 500. Best Recall: 0.0057
2026-05-20 07:41:09,961 - optuna.study.study - INFO - Trial 4 finished with value: 0.005668980195323364 and parameters: {'n_layers': 3, 'embedding_dim': 32, 'lr': 0.004997846876595677, 'lambda_val': 0.006615280588531156, 'batch_size': 3324, 'optimizer': 'Adam'}. Best is trial 4 with value: 0.005668980195323364.
2026-05-20 07:41:18,200 - experiment_functions - INFO - Early stopping at epoch 500. Best Recall: 0.0052
2026-05-20 07:41:18,289 - optuna.study.study - INFO - Trial 5 finished with value: 0.0052019957180058675 and parameters: {'n_layers': 2, 'embedding_dim': 64, 'lr': 0.08585121343185197, 'lambda_val': 2.9934616678403755e-05, 'batch_size': 1208, 'optimizer': 'SGD'}. Best is trial 4 with value: 0.005668980195323364.
2026-05-20 07:41:26,891 - experiment_functions - INFO - Early stopping at epoch 550. Best Recall: 0.0097
2026-05-20 07:41:26,980 - optuna.study.study - INFO - Trial 6 finished with value: 0.009690558209404513 and parameters: {'n_layers': 4, 'embedding_dim': 96, 'lr': 0.0007683344357733008, 'lambda_val': 0.000987300498748645, 'batch_size': 3869, 'optimizer': 'RMSprop'}. Best is trial 6 with value: 0.009690558209404513.
2026-05-20 07:42:16,700 - optuna.study.study - INFO - Trial 7 finished with value: 0.014652001205845483 and parameters: {'n_layers': 1, 'embedding_dim': 64, 'lr': 6.678098823451818e-05, 'lambda_val': 0.004611966147934588, 'batch_size': 3627, 'optimizer': 'RMSprop'}. Best is trial 7 with value: 0.014652001205845483.
2026-05-20 07:42:23,733 - experiment_functions - INFO - Early stopping at epoch 500. Best Recall: 0.0055
2026-05-20 07:42:23,867 - optuna.study.study - INFO - Trial 8 finished with value: 0.005515964192845046 and parameters: {'n_layers': 2, 'embedding_dim': 32, 'lr': 2.2543319506413874e-05, 'lambda_val': 0.0015304092792827546, 'batch_size': 3949, 'optimizer': 'SGD'}. Best is trial 7 with value: 0.014652001205845483.
2026-05-20 07:42:32,212 - experiment_functions - INFO - Early stopping at epoch 600. Best Recall: 0.0096
2026-05-20 07:42:32,301 - optuna.study.study - INFO - Trial 9 finished with value: 0.00963240451983462 and parameters: {'n_layers': 1, 'embedding_dim': 64, 'lr': 0.0004177652050440261, 'lambda_val': 0.033583514465830196, 'batch_size': 3475, 'optimizer': 'RMSprop'}. Best is trial 7 with value: 0.014652001205845483.
2026-05-20 07:43:21,886 - optuna.study.study - INFO - Trial 10 finished with value: 0.030133545677613283 and parameters: {'n_layers': 1, 'embedding_dim': 128, 'lr': 7.403212783318608e-05, 'lambda_val': 0.00011994856282508779, 'batch_size': 994, 'optimizer': 'RMSprop'}. Best is trial 10 with value: 0.030133545677613283.
2026-05-20 07:44:19,427 - optuna.study.study - INFO - Trial 11 finished with value: 0.026575042832708968 and parameters: {'n_layers': 1, 'embedding_dim': 128, 'lr': 8.164139299355781e-05, 'lambda_val': 6.854212564025427e-05, 'batch_size': 734, 'optimizer': 'RMSprop'}. Best is trial 10 with value: 0.030133545677613283.
2026-05-20 07:45:08,790 - optuna.study.study - INFO - Trial 12 finished with value: 0.05887259253497146 and parameters: {'n_layers': 1, 'embedding_dim': 128, 'lr': 0.00014790555824388256, 'lambda_val': 8.032345513506607e-05, 'batch_size': 594, 'optimizer': 'RMSprop'}. Best is trial 12 with value: 0.05887259253497146.
2026-05-20 07:46:07,412 - optuna.study.study - INFO - Trial 13 finished with value: 0.059658272796593706 and parameters: {'n_layers': 1, 'embedding_dim': 128, 'lr': 0.0001402269847878447, 'lambda_val': 0.00010259567487006661, 'batch_size': 531, 'optimizer': 'RMSprop'}. Best is trial 13 with value: 0.059658272796593706.
2026-05-20 07:46:26,148 - experiment_functions - INFO - Early stopping at epoch 1450. Best Recall: 0.0546
2026-05-20 07:46:26,238 - optuna.study.study - INFO - Trial 14 finished with value: 0.05459066611395273 and parameters: {'n_layers': 1, 'embedding_dim': 128, 'lr': 0.00025667646260394843, 'lambda_val': 1.0304320909115663e-05, 'batch_size': 1625, 'optimizer': 'RMSprop'}. Best is trial 13 with value: 0.059658272796593706.
2026-05-20 07:46:34,458 - experiment_functions - INFO - Early stopping at epoch 600. Best Recall: 0.0557
2026-05-20 07:46:34,526 - optuna.study.study - INFO - Trial 15 finished with value: 0.05571634232281733 and parameters: {'n_layers': 1, 'embedding_dim': 128, 'lr': 0.0026150289905735344, 'lambda_val': 0.00036866234332665775, 'batch_size': 560, 'optimizer': 'Adam'}. Best is trial 13 with value: 0.059658272796593706.
2026-05-20 07:47:05,995 - experiment_functions - INFO - Early stopping at epoch 1600. Best Recall: 0.0502
2026-05-20 07:47:06,096 - optuna.study.study - INFO - Trial 16 finished with value: 0.05016577388516762 and parameters: {'n_layers': 3, 'embedding_dim': 128, 'lr': 0.0002104661313216432, 'lambda_val': 1.761543253599331e-06, 'batch_size': 1472, 'optimizer': 'RMSprop'}. Best is trial 13 with value: 0.059658272796593706.
2026-05-20 07:47:18,825 - optuna.study._optimize - INFO - Trial 17 pruned. 
2026-05-20 07:47:26,959 - experiment_functions - INFO - Early stopping at epoch 550. Best Recall: 0.0510
2026-05-20 07:47:27,048 - optuna.study.study - INFO - Trial 18 finished with value: 0.05095234027703896 and parameters: {'n_layers': 1, 'embedding_dim': 256, 'lr': 0.0011241648009149253, 'lambda_val': 0.00024266033947958603, 'batch_size': 942, 'optimizer': 'RMSprop'}. Best is trial 13 with value: 0.059658272796593706.
2026-05-20 07:47:51,589 - experiment_functions - INFO - Early stopping at epoch 1850. Best Recall: 0.0454
2026-05-20 07:47:51,711 - optuna.study.study - INFO - Trial 19 finished with value: 0.04536687295681269 and parameters: {'n_layers': 2, 'embedding_dim': 128, 'lr': 0.00019439988712243822, 'lambda_val': 2.937283696698628e-05, 'batch_size': 1752, 'optimizer': 'Adam'}. Best is trial 13 with value: 0.059658272796593706.
2026-05-20 07:48:04,656 - optuna.study._optimize - INFO - Trial 20 pruned. 
2026-05-20 07:48:12,469 - experiment_functions - INFO - Early stopping at epoch 550. Best Recall: 0.0587
2026-05-20 07:48:12,547 - optuna.study.study - INFO - Trial 21 finished with value: 0.05869889544783389 and parameters: {'n_layers': 1, 'embedding_dim': 128, 'lr': 0.0031978883640200926, 'lambda_val': 0.00037670250322132634, 'batch_size': 548, 'optimizer': 'Adam'}. Best is trial 13 with value: 0.059658272796593706.
2026-05-20 07:48:20,315 - experiment_functions - INFO - Early stopping at epoch 550. Best Recall: 0.0409
2026-05-20 07:48:20,393 - optuna.study.study - INFO - Trial 22 finished with value: 0.040879762916905156 and parameters: {'n_layers': 1, 'embedding_dim': 128, 'lr': 0.010695248062808478, 'lambda_val': 8.493709215223729e-05, 'batch_size': 557, 'optimizer': 'Adam'}. Best is trial 13 with value: 0.059658272796593706.
2026-05-20 07:48:30,269 - experiment_functions - INFO - Early stopping at epoch 700. Best Recall: 0.0587
2026-05-20 07:48:30,358 - optuna.study.study - INFO - Trial 23 finished with value: 0.05872637858575807 and parameters: {'n_layers': 1, 'embedding_dim': 128, 'lr': 0.0008699608957414366, 'lambda_val': 0.00024547650762494306, 'batch_size': 1245, 'optimizer': 'Adam'}. Best is trial 13 with value: 0.059658272796593706.
2026-05-20 07:48:39,519 - experiment_functions - INFO - Early stopping at epoch 650. Best Recall: 0.0461
2026-05-20 07:48:39,609 - optuna.study.study - INFO - Trial 24 finished with value: 0.046099930969903266 and parameters: {'n_layers': 2, 'embedding_dim': 128, 'lr': 0.0009064204890475009, 'lambda_val': 2.657689542313692e-05, 'batch_size': 1270, 'optimizer': 'Adam'}. Best is trial 13 with value: 0.059658272796593706.
2026-05-20 07:48:50,842 - experiment_functions - INFO - Early stopping at epoch 800. Best Recall: 0.0568
2026-05-20 07:48:50,940 - optuna.study.study - INFO - Trial 25 finished with value: 0.056754715693890935 and parameters: {'n_layers': 1, 'embedding_dim': 256, 'lr': 0.0005025731355295682, 'lambda_val': 0.00016272962985413916, 'batch_size': 932, 'optimizer': 'Adam'}. Best is trial 13 with value: 0.059658272796593706.
2026-05-20 07:49:41,840 - optuna.study.study - INFO - Trial 26 finished with value: 0.059533053910720474 and parameters: {'n_layers': 2, 'embedding_dim': 96, 'lr': 0.0001284432569560353, 'lambda_val': 9.061742312420015e-06, 'batch_size': 1227, 'optimizer': 'RMSprop'}. Best is trial 13 with value: 0.059658272796593706.
2026-05-20 07:49:56,170 - optuna.study._optimize - INFO - Trial 27 pruned. 
2026-05-20 07:50:03,064 - experiment_functions - INFO - Early stopping at epoch 500. Best Recall: 0.0052
2026-05-20 07:50:03,152 - optuna.study.study - INFO - Trial 28 finished with value: 0.005223408524610774 and parameters: {'n_layers': 2, 'embedding_dim': 96, 'lr': 3.458865247504471e-05, 'lambda_val': 1.4113593406553986e-05, 'batch_size': 1726, 'optimizer': 'RMSprop'}. Best is trial 13 with value: 0.059658272796593706.
2026-05-20 07:50:10,188 - experiment_functions - INFO - Early stopping at epoch 500. Best Recall: 0.0052
2026-05-20 07:50:10,322 - optuna.study.study - INFO - Trial 29 finished with value: 0.005201891666153555 and parameters: {'n_layers': 2, 'embedding_dim': 96, 'lr': 0.00014798375595293257, 'lambda_val': 6.184590404965308e-05, 'batch_size': 2045, 'optimizer': 'SGD'}. Best is trial 13 with value: 0.059658272796593706.
2026-05-20 07:50:22,146 - experiment_functions - INFO - Early stopping at epoch 750. Best Recall: 0.0500
2026-05-20 07:50:22,244 - optuna.study.study - INFO - Trial 30 finished with value: 0.050025125643584405 and parameters: {'n_layers': 2, 'embedding_dim': 256, 'lr': 0.00037954609335239263, 'lambda_val': 1.2680490030436486e-06, 'batch_size': 1077, 'optimizer': 'RMSprop'}. Best is trial 13 with value: 0.059658272796593706.
2026-05-20 07:50:30,194 - experiment_functions - INFO - Early stopping at epoch 550. Best Recall: 0.0525
2026-05-20 07:50:30,286 - optuna.study.study - INFO - Trial 31 finished with value: 0.0525156091478091 and parameters: {'n_layers': 1, 'embedding_dim': 128, 'lr': 0.001099145406131731, 'lambda_val': 4.243874198954892e-05, 'batch_size': 1401, 'optimizer': 'RMSprop'}. Best is trial 13 with value: 0.059658272796593706.
2026-05-20 07:50:37,208 - experiment_functions - INFO - Early stopping at epoch 500. Best Recall: 0.0054
2026-05-20 07:50:37,309 - optuna.study.study - INFO - Trial 32 finished with value: 0.0054072038539106256 and parameters: {'n_layers': 1, 'embedding_dim': 96, 'lr': 1.9744627863920654e-05, 'lambda_val': 4.506887857720725e-06, 'batch_size': 725, 'optimizer': 'RMSprop'}. Best is trial 13 with value: 0.059658272796593706.
2026-05-20 07:50:45,460 - experiment_functions - INFO - Early stopping at epoch 600. Best Recall: 0.0563
2026-05-20 07:50:45,538 - optuna.study.study - INFO - Trial 33 finished with value: 0.056323264548532245 and parameters: {'n_layers': 1, 'embedding_dim': 128, 'lr': 0.0017715343496236854, 'lambda_val': 0.002194782608531186, 'batch_size': 1168, 'optimizer': 'Adam'}. Best is trial 13 with value: 0.059658272796593706.
2026-05-20 07:50:53,684 - experiment_functions - INFO - Early stopping at epoch 500. Best Recall: 0.0053
2026-05-20 07:50:53,783 - optuna.study.study - INFO - Trial 34 finished with value: 0.005290592613629166 and parameters: {'n_layers': 4, 'embedding_dim': 128, 'lr': 0.010296454422093548, 'lambda_val': 0.00018497974974481259, 'batch_size': 2555, 'optimizer': 'SGD'}. Best is trial 13 with value: 0.059658272796593706.
2026-05-20 07:51:09,106 - optuna.study._optimize - INFO - Trial 35 pruned. 
2026-05-20 07:51:22,030 - optuna.study._optimize - INFO - Trial 36 pruned. 
2026-05-20 07:51:29,177 - experiment_functions - INFO - Early stopping at epoch 500. Best Recall: 0.0051
2026-05-20 07:51:29,255 - optuna.study.study - INFO - Trial 37 finished with value: 0.00505706611531859 and parameters: {'n_layers': 1, 'embedding_dim': 64, 'lr': 0.0006322467004215173, 'lambda_val': 0.07735623565705539, 'batch_size': 2378, 'optimizer': 'RMSprop'}. Best is trial 13 with value: 0.059658272796593706.
2026-05-20 07:51:36,004 - experiment_functions - INFO - Early stopping at epoch 500. Best Recall: 0.0054
2026-05-20 07:51:36,092 - optuna.study.study - INFO - Trial 38 finished with value: 0.0054202587408058375 and parameters: {'n_layers': 1, 'embedding_dim': 128, 'lr': 3.3877504032858895e-05, 'lambda_val': 3.561477251855489e-06, 'batch_size': 757, 'optimizer': 'SGD'}. Best is trial 13 with value: 0.059658272796593706.
2026-05-20 07:51:49,057 - optuna.study._optimize - INFO - Trial 39 pruned. 
2026-05-20 07:51:56,386 - experiment_functions - INFO - Early stopping at epoch 500. Best Recall: 0.0070
2026-05-20 07:51:56,464 - optuna.study.study - INFO - Trial 40 finished with value: 0.00699546448333361 and parameters: {'n_layers': 3, 'embedding_dim': 256, 'lr': 0.040079081370704275, 'lambda_val': 4.7534789675830405e-05, 'batch_size': 1233, 'optimizer': 'Adam'}. Best is trial 13 with value: 0.059658272796593706.
2026-05-20 07:52:04,406 - experiment_functions - INFO - Early stopping at epoch 550. Best Recall: 0.0596
2026-05-20 07:52:04,505 - optuna.study.study - INFO - Trial 41 finished with value: 0.05959892605220134 and parameters: {'n_layers': 1, 'embedding_dim': 128, 'lr': 0.0036929528093977504, 'lambda_val': 0.0003565590990867956, 'batch_size': 542, 'optimizer': 'Adam'}. Best is trial 13 with value: 0.059658272796593706.
2026-05-20 07:52:12,067 - experiment_functions - INFO - Early stopping at epoch 550. Best Recall: 0.0551
2026-05-20 07:52:12,157 - optuna.study.study - INFO - Trial 42 finished with value: 0.05509842944306348 and parameters: {'n_layers': 1, 'embedding_dim': 128, 'lr': 0.0065824831618408524, 'lambda_val': 0.001408240026815404, 'batch_size': 660, 'optimizer': 'Adam'}. Best is trial 13 with value: 0.059658272796593706.
2026-05-20 07:52:20,172 - experiment_functions - INFO - Early stopping at epoch 600. Best Recall: 0.0590
2026-05-20 07:52:20,232 - optuna.study.study - INFO - Trial 43 finished with value: 0.05902574742900569 and parameters: {'n_layers': 1, 'embedding_dim': 128, 'lr': 0.002019097265522872, 'lambda_val': 0.00038023634745562254, 'batch_size': 930, 'optimizer': 'Adam'}. Best is trial 13 with value: 0.059658272796593706.
2026-05-20 07:52:27,564 - experiment_functions - INFO - Early stopping at epoch 600. Best Recall: 0.0585
2026-05-20 07:52:27,634 - optuna.study.study - INFO - Trial 44 finished with value: 0.05848538024218582 and parameters: {'n_layers': 1, 'embedding_dim': 64, 'lr': 0.0015426119052456262, 'lambda_val': 0.003680769456590381, 'batch_size': 882, 'optimizer': 'Adam'}. Best is trial 13 with value: 0.059658272796593706.
2026-05-20 07:52:34,156 - experiment_functions - INFO - Early stopping at epoch 500. Best Recall: 0.0055
2026-05-20 07:52:34,225 - optuna.study.study - INFO - Trial 45 finished with value: 0.005541378221123612 and parameters: {'n_layers': 1, 'embedding_dim': 128, 'lr': 0.005077529687465994, 'lambda_val': 0.0005455144420039139, 'batch_size': 1077, 'optimizer': 'RMSprop'}. Best is trial 13 with value: 0.059658272796593706.
2026-05-20 07:52:41,182 - experiment_functions - INFO - Early stopping at epoch 500. Best Recall: 0.0051
2026-05-20 07:52:41,272 - optuna.study.study - INFO - Trial 46 finished with value: 0.005083970797597468 and parameters: {'n_layers': 1, 'embedding_dim': 128, 'lr': 0.016118360063442166, 'lambda_val': 0.00014057425068271227, 'batch_size': 723, 'optimizer': 'SGD'}. Best is trial 13 with value: 0.059658272796593706.
2026-05-20 07:52:49,597 - experiment_functions - INFO - Early stopping at epoch 550. Best Recall: 0.0385
2026-05-20 07:52:49,667 - optuna.study.study - INFO - Trial 47 finished with value: 0.03848970181291657 and parameters: {'n_layers': 2, 'embedding_dim': 96, 'lr': 0.0021031241138089836, 'lambda_val': 0.01055694961959962, 'batch_size': 513, 'optimizer': 'Adam'}. Best is trial 13 with value: 0.059658272796593706.
2026-05-20 07:52:57,447 - experiment_functions - INFO - Early stopping at epoch 500. Best Recall: 0.0048
