2026-05-19 22:07:20,591 - optuna.study.study - INFO - Trial 67 finished with value: 0.0803340006000126 and parameters: {'n_layers': 1, 'embedding_dim': 128, 'lr': 0.0004791648399375376, 'lambda_val': 1.4176836777361127e-06, 'batch_size': 2074, 'optimizer': 'RMSprop'}. Best is trial 67 with value: 0.0803340006000126.
2026-05-19 22:07:39,505 - experiment_functions - INFO - Early stopping at epoch 1100. Best Recall: 0.0781
2026-05-19 22:07:39,583 - optuna.study.study - INFO - Trial 68 finished with value: 0.07813817926162271 and parameters: {'n_layers': 1, 'embedding_dim': 128, 'lr': 0.0005292975058922474, 'lambda_val': 1.6857019350121612e-06, 'batch_size': 2088, 'optimizer': 'RMSprop'}. Best is trial 67 with value: 0.0803340006000126.
2026-05-19 22:07:47,788 - experiment_functions - INFO - Early stopping at epoch 500. Best Recall: 0.0049
2026-05-19 22:07:47,956 - optuna.study.study - INFO - Trial 69 finished with value: 0.004880891031440259 and parameters: {'n_layers': 1, 'embedding_dim': 128, 'lr': 0.001167877155379611, 'lambda_val': 1.3942891299014567e-06, 'batch_size': 2052, 'optimizer': 'SGD'}. Best is trial 67 with value: 0.0803340006000126.
2026-05-19 22:08:08,156 - experiment_functions - INFO - Early stopping at epoch 1150. Best Recall: 0.0790
2026-05-19 22:08:08,246 - optuna.study.study - INFO - Trial 70 finished with value: 0.07899370570207911 and parameters: {'n_layers': 1, 'embedding_dim': 128, 'lr': 0.0006703140382603332, 'lambda_val': 1.9063379416881016e-06, 'batch_size': 1689, 'optimizer': 'Adam'}. Best is trial 67 with value: 0.0803340006000126.
2026-05-19 22:08:26,503 - experiment_functions - INFO - Early stopping at epoch 1100. Best Recall: 0.0768
2026-05-19 22:08:26,593 - optuna.study.study - INFO - Trial 71 finished with value: 0.076754862970553 and parameters: {'n_layers': 1, 'embedding_dim': 128, 'lr': 0.0007215483470107658, 'lambda_val': 1.768049482889642e-06, 'batch_size': 1721, 'optimizer': 'Adam'}. Best is trial 67 with value: 0.0803340006000126.
2026-05-19 22:08:45,436 - experiment_functions - INFO - Early stopping at epoch 1050. Best Recall: 0.0782
2026-05-19 22:08:45,527 - optuna.study.study - INFO - Trial 72 finished with value: 0.07824000338025905 and parameters: {'n_layers': 1, 'embedding_dim': 128, 'lr': 0.0008213515661024362, 'lambda_val': 1.7129216883310826e-06, 'batch_size': 1651, 'optimizer': 'Adam'}. Best is trial 67 with value: 0.0803340006000126.
2026-05-19 22:09:04,322 - experiment_functions - INFO - Early stopping at epoch 1150. Best Recall: 0.0824
2026-05-19 22:09:04,459 - optuna.study.study - INFO - Trial 73 finished with value: 0.08243534473841134 and parameters: {'n_layers': 1, 'embedding_dim': 128, 'lr': 0.0007316204992691144, 'lambda_val': 3.366184401052786e-06, 'batch_size': 1457, 'optimizer': 'Adam'}. Best is trial 73 with value: 0.08243534473841134.
2026-05-19 22:09:25,726 - experiment_functions - INFO - Early stopping at epoch 1150. Best Recall: 0.0807
2026-05-19 22:09:25,816 - optuna.study.study - INFO - Trial 74 finished with value: 0.08069440514425542 and parameters: {'n_layers': 1, 'embedding_dim': 128, 'lr': 0.0007322533351984229, 'lambda_val': 1.5700184834897625e-06, 'batch_size': 1600, 'optimizer': 'Adam'}. Best is trial 73 with value: 0.08243534473841134.
2026-05-19 22:09:45,732 - experiment_functions - INFO - Early stopping at epoch 1150. Best Recall: 0.0800
2026-05-19 22:09:45,833 - optuna.study.study - INFO - Trial 75 finished with value: 0.0800128468830111 and parameters: {'n_layers': 1, 'embedding_dim': 128, 'lr': 0.0007235115570049369, 'lambda_val': 1.448338206072458e-06, 'batch_size': 1487, 'optimizer': 'Adam'}. Best is trial 73 with value: 0.08243534473841134.
2026-05-19 22:09:58,626 - experiment_functions - INFO - Early stopping at epoch 550. Best Recall: 0.0341
2026-05-19 22:09:58,715 - optuna.study.study - INFO - Trial 76 finished with value: 0.03411253687766544 and parameters: {'n_layers': 4, 'embedding_dim': 128, 'lr': 0.0020039530563783817, 'lambda_val': 1.3079103923469737e-06, 'batch_size': 1515, 'optimizer': 'Adam'}. Best is trial 73 with value: 0.08243534473841134.
2026-05-19 22:10:21,340 - experiment_functions - INFO - Early stopping at epoch 1250. Best Recall: 0.0796
2026-05-19 22:10:21,475 - optuna.study.study - INFO - Trial 77 finished with value: 0.07960078828273078 and parameters: {'n_layers': 1, 'embedding_dim': 128, 'lr': 0.0007525498016040318, 'lambda_val': 1.0361135944404517e-06, 'batch_size': 1228, 'optimizer': 'Adam'}. Best is trial 73 with value: 0.08243534473841134.
2026-05-19 22:10:44,761 - experiment_functions - INFO - Early stopping at epoch 1350. Best Recall: 0.0826
2026-05-19 22:10:44,855 - optuna.study.study - INFO - Trial 78 finished with value: 0.0825951617489096 and parameters: {'n_layers': 1, 'embedding_dim': 128, 'lr': 0.0006897918009840428, 'lambda_val': 1.0809960178170255e-06, 'batch_size': 1096, 'optimizer': 'Adam'}. Best is trial 78 with value: 0.0825951617489096.
2026-05-19 22:10:55,392 - experiment_functions - INFO - Early stopping at epoch 550. Best Recall: 0.0719
2026-05-19 22:10:55,596 - optuna.study.study - INFO - Trial 79 finished with value: 0.0719488000462713 and parameters: {'n_layers': 2, 'embedding_dim': 128, 'lr': 0.004504396250519361, 'lambda_val': 1.082392240887436e-06, 'batch_size': 963, 'optimizer': 'Adam'}. Best is trial 78 with value: 0.0825951617489096.
2026-05-19 22:11:11,565 - experiment_functions - INFO - Early stopping at epoch 950. Best Recall: 0.0773
2026-05-19 22:11:11,656 - optuna.study.study - INFO - Trial 80 finished with value: 0.0772691948059427 and parameters: {'n_layers': 1, 'embedding_dim': 128, 'lr': 0.0010757635286346432, 'lambda_val': 3.1593669774879856e-06, 'batch_size': 1291, 'optimizer': 'Adam'}. Best is trial 78 with value: 0.0825951617489096.
2026-05-19 22:11:36,938 - experiment_functions - INFO - Early stopping at epoch 1200. Best Recall: 0.0772
2026-05-19 22:11:37,027 - optuna.study.study - INFO - Trial 81 finished with value: 0.07718365631028754 and parameters: {'n_layers': 1, 'embedding_dim': 128, 'lr': 0.0007288783241305862, 'lambda_val': 1.5521188840701034e-06, 'batch_size': 1647, 'optimizer': 'Adam'}. Best is trial 78 with value: 0.0825951617489096.
2026-05-19 22:11:59,486 - experiment_functions - INFO - Early stopping at epoch 1200. Best Recall: 0.0885
2026-05-19 22:11:59,646 - optuna.study.study - INFO - Trial 82 finished with value: 0.08854803385288794 and parameters: {'n_layers': 1, 'embedding_dim': 128, 'lr': 0.0007679420643003609, 'lambda_val': 1.3354734617059608e-06, 'batch_size': 1174, 'optimizer': 'Adam'}. Best is trial 82 with value: 0.08854803385288794.
2026-05-19 22:12:12,516 - experiment_functions - INFO - Early stopping at epoch 750. Best Recall: 0.0820
2026-05-19 22:12:12,606 - optuna.study.study - INFO - Trial 83 finished with value: 0.0820103904328052 and parameters: {'n_layers': 1, 'embedding_dim': 128, 'lr': 0.0017741260731651278, 'lambda_val': 1.0082217064215119e-06, 'batch_size': 1112, 'optimizer': 'Adam'}. Best is trial 82 with value: 0.08854803385288794.
2026-05-19 22:12:28,955 - experiment_functions - INFO - Early stopping at epoch 800. Best Recall: 0.0749
2026-05-19 22:12:29,044 - optuna.study.study - INFO - Trial 84 finished with value: 0.07486242702832006 and parameters: {'n_layers': 1, 'embedding_dim': 128, 'lr': 0.0015834717471682467, 'lambda_val': 1.03698981759903e-06, 'batch_size': 1107, 'optimizer': 'Adam'}. Best is trial 82 with value: 0.08854803385288794.
2026-05-19 22:12:40,821 - experiment_functions - INFO - Early stopping at epoch 650. Best Recall: 0.0703
2026-05-19 22:12:40,920 - optuna.study.study - INFO - Trial 85 finished with value: 0.07032895162399527 and parameters: {'n_layers': 1, 'embedding_dim': 128, 'lr': 0.0021942261544741766, 'lambda_val': 0.0008379599394435203, 'batch_size': 1292, 'optimizer': 'Adam'}. Best is trial 82 with value: 0.08854803385288794.
2026-05-19 22:13:14,352 - experiment_functions - INFO - Early stopping at epoch 1900. Best Recall: 0.0838
2026-05-19 22:13:14,486 - optuna.study.study - INFO - Trial 86 finished with value: 0.08384852500126269 and parameters: {'n_layers': 1, 'embedding_dim': 128, 'lr': 0.0006501221129348077, 'lambda_val': 3.2083288265719785e-06, 'batch_size': 840, 'optimizer': 'Adam'}. Best is trial 82 with value: 0.08854803385288794.
2026-05-19 22:13:32,721 - experiment_functions - INFO - Early stopping at epoch 900. Best Recall: 0.0795
2026-05-19 22:13:32,811 - optuna.study.study - INFO - Trial 87 finished with value: 0.07948703512343436 and parameters: {'n_layers': 1, 'embedding_dim': 128, 'lr': 0.0013327675972610972, 'lambda_val': 3.466762951038407e-06, 'batch_size': 737, 'optimizer': 'Adam'}. Best is trial 82 with value: 0.08854803385288794.
2026-05-19 22:13:47,402 - experiment_functions - INFO - Early stopping at epoch 750. Best Recall: 0.0690
2026-05-19 22:13:47,494 - optuna.study.study - INFO - Trial 88 finished with value: 0.06900414561859586 and parameters: {'n_layers': 2, 'embedding_dim': 128, 'lr': 0.0009771978765883043, 'lambda_val': 1.3384257824383892e-06, 'batch_size': 1084, 'optimizer': 'Adam'}. Best is trial 82 with value: 0.08854803385288794.
2026-05-19 22:14:02,598 - experiment_functions - INFO - Early stopping at epoch 750. Best Recall: 0.0820
2026-05-19 22:14:02,670 - optuna.study.study - INFO - Trial 89 finished with value: 0.08195992956054325 and parameters: {'n_layers': 1, 'embedding_dim': 128, 'lr': 0.0017333746860917335, 'lambda_val': 2.8898425124156673e-06, 'batch_size': 1202, 'optimizer': 'Adam'}. Best is trial 82 with value: 0.08854803385288794.
2026-05-19 22:14:15,154 - experiment_functions - INFO - Early stopping at epoch 600. Best Recall: 0.0747
2026-05-19 22:14:15,245 - optuna.study.study - INFO - Trial 90 finished with value: 0.07472616860496285 and parameters: {'n_layers': 1, 'embedding_dim': 128, 'lr': 0.0037128146380601998, 'lambda_val': 6.915242500413225e-06, 'batch_size': 923, 'optimizer': 'Adam'}. Best is trial 82 with value: 0.08854803385288794.
2026-05-19 22:14:29,234 - experiment_functions - INFO - Early stopping at epoch 700. Best Recall: 0.0806
2026-05-19 22:14:29,325 - optuna.study.study - INFO - Trial 91 finished with value: 0.08056423973786679 and parameters: {'n_layers': 1, 'embedding_dim': 128, 'lr': 0.0018891535489544457, 'lambda_val': 2.5489943492562887e-06, 'batch_size': 1407, 'optimizer': 'Adam'}. Best is trial 82 with value: 0.08854803385288794.
2026-05-19 22:14:41,900 - experiment_functions - INFO - Early stopping at epoch 700. Best Recall: 0.0813
2026-05-19 22:14:41,989 - optuna.study.study - INFO - Trial 92 finished with value: 0.081326021301964 and parameters: {'n_layers': 1, 'embedding_dim': 128, 'lr': 0.0018940666196485812, 'lambda_val': 2.68992259191452e-06, 'batch_size': 1413, 'optimizer': 'Adam'}. Best is trial 82 with value: 0.08854803385288794.
2026-05-19 22:14:53,736 - experiment_functions - INFO - Early stopping at epoch 650. Best Recall: 0.0783
2026-05-19 22:14:53,837 - optuna.study.study - INFO - Trial 93 finished with value: 0.07833944561687844 and parameters: {'n_layers': 1, 'embedding_dim': 128, 'lr': 0.002782466923274263, 'lambda_val': 2.6760866902214876e-06, 'batch_size': 1369, 'optimizer': 'Adam'}. Best is trial 82 with value: 0.08854803385288794.
2026-05-19 22:15:09,615 - experiment_functions - INFO - Early stopping at epoch 850. Best Recall: 0.0831
2026-05-19 22:15:09,705 - optuna.study.study - INFO - Trial 94 finished with value: 0.08313909361613203 and parameters: {'n_layers': 1, 'embedding_dim': 128, 'lr': 0.001557571136895881, 'lambda_val': 2.9111588117262985e-06, 'batch_size': 737, 'optimizer': 'Adam'}. Best is trial 82 with value: 0.08854803385288794.
2026-05-19 22:15:19,374 - experiment_functions - INFO - Early stopping at epoch 550. Best Recall: 0.0666
2026-05-19 22:15:19,464 - optuna.study.study - INFO - Trial 95 finished with value: 0.0666324826660897 and parameters: {'n_layers': 1, 'embedding_dim': 128, 'lr': 0.009153160708135004, 'lambda_val': 3.604801166134592e-06, 'batch_size': 674, 'optimizer': 'Adam'}. Best is trial 82 with value: 0.08854803385288794.
2026-05-19 22:15:31,506 - experiment_functions - INFO - Early stopping at epoch 700. Best Recall: 0.0756
2026-05-19 22:15:31,596 - optuna.study.study - INFO - Trial 96 finished with value: 0.07560448393544124 and parameters: {'n_layers': 1, 'embedding_dim': 128, 'lr': 0.0023399772214944456, 'lambda_val': 6.264046264651382e-06, 'batch_size': 1172, 'optimizer': 'Adam'}. Best is trial 82 with value: 0.08854803385288794.
2026-05-19 22:15:49,861 - experiment_functions - INFO - Early stopping at epoch 850. Best Recall: 0.0448
2026-05-19 22:15:50,006 - optuna.study.study - INFO - Trial 97 finished with value: 0.044794407887893774 and parameters: {'n_layers': 1, 'embedding_dim': 32, 'lr': 0.001953190522049032, 'lambda_val': 0.0902897502324883, 'batch_size': 883, 'optimizer': 'Adam'}. Best is trial 82 with value: 0.08854803385288794.
2026-05-19 22:16:04,842 - experiment_functions - INFO - Early stopping at epoch 850. Best Recall: 0.0792
2026-05-19 22:16:04,931 - optuna.study.study - INFO - Trial 98 finished with value: 0.07919125225017254 and parameters: {'n_layers': 1, 'embedding_dim': 128, 'lr': 0.0013664815441719082, 'lambda_val': 2.953821965637964e-06, 'batch_size': 1008, 'optimizer': 'Adam'}. Best is trial 82 with value: 0.08854803385288794.
2026-05-19 22:16:16,848 - experiment_functions - INFO - Early stopping at epoch 700. Best Recall: 0.0725
2026-05-19 22:16:16,928 - optuna.study.study - INFO - Trial 99 finished with value: 0.07247969482064093 and parameters: {'n_layers': 1, 'embedding_dim': 128, 'lr': 0.001752215500436372, 'lambda_val': 0.01687233477124511, 'batch_size': 856, 'optimizer': 'Adam'}. Best is trial 82 with value: 0.08854803385288794.
2026-05-19 22:16:28,558 - experiment_functions - INFO - Early stopping at epoch 650. Best Recall: 0.0721
2026-05-19 22:16:28,648 - optuna.study.study - INFO - Trial 100 finished with value: 0.07207022674934642 and parameters: {'n_layers': 1, 'embedding_dim': 128, 'lr': 0.0032307649048566012, 'lambda_val': 4.274050744134845e-06, 'batch_size': 599, 'optimizer': 'Adam'}. Best is trial 82 with value: 0.08854803385288794.
2026-05-19 22:16:39,091 - experiment_functions - INFO - Early stopping at epoch 600. Best Recall: 0.0773
2026-05-19 22:16:39,190 - optuna.study.study - INFO - Trial 101 finished with value: 0.07729508736677715 and parameters: {'n_layers': 1, 'embedding_dim': 128, 'lr': 0.0039531264586694145, 'lambda_val': 2.2329574330654643e-06, 'batch_size': 1379, 'optimizer': 'Adam'}. Best is trial 82 with value: 0.08854803385288794.
2026-05-19 22:16:59,744 - experiment_functions - INFO - Early stopping at epoch 1000. Best Recall: 0.0818
2026-05-19 22:16:59,834 - optuna.study.study - INFO - Trial 102 finished with value: 0.08181693039200034 and parameters: {'n_layers': 1, 'embedding_dim': 128, 'lr': 0.001080950955182004, 'lambda_val': 2.85211722915202e-06, 'batch_size': 1165, 'optimizer': 'Adam'}. Best is trial 82 with value: 0.08854803385288794.
2026-05-19 22:17:09,554 - experiment_functions - INFO - Early stopping at epoch 550. Best Recall: 0.0709
2026-05-19 22:17:09,860 - optuna.study.study - INFO - Trial 103 finished with value: 0.07088449095367336 and parameters: {'n_layers': 1, 'embedding_dim': 128, 'lr': 0.007036583898817621, 'lambda_val': 2.9101576235054794e-06, 'batch_size': 1147, 'optimizer': 'Adam'}. Best is trial 82 with value: 0.08854803385288794.
2026-05-19 22:17:30,256 - experiment_functions - INFO - Early stopping at epoch 950. Best Recall: 0.0749
2026-05-19 22:17:30,336 - optuna.study.study - INFO - Trial 104 finished with value: 0.0748699203679985 and parameters: {'n_layers': 1, 'embedding_dim': 256, 'lr': 0.001090923920790907, 'lambda_val': 4.255449158382347e-06, 'batch_size': 811, 'optimizer': 'Adam'}. Best is trial 82 with value: 0.08854803385288794.
2026-05-19 22:17:43,948 - experiment_functions - INFO - Early stopping at epoch 800. Best Recall: 0.0775
2026-05-19 22:17:44,038 - optuna.study.study - INFO - Trial 105 finished with value: 0.0775445487788508 and parameters: {'n_layers': 1, 'embedding_dim': 128, 'lr': 0.0015405326672168693, 'lambda_val': 5.920954193107387e-06, 'batch_size': 1018, 'optimizer': 'Adam'}. Best is trial 82 with value: 0.08854803385288794.
2026-05-19 22:17:58,786 - experiment_functions - INFO - Early stopping at epoch 650. Best Recall: 0.0757
2026-05-19 22:17:58,875 - optuna.study.study - INFO - Trial 106 finished with value: 0.07571233563247522 and parameters: {'n_layers': 1, 'embedding_dim': 128, 'lr': 0.002604278536368934, 'lambda_val': 2.197748253580241e-06, 'batch_size': 1403, 'optimizer': 'Adam'}. Best is trial 82 with value: 0.08854803385288794.
2026-05-19 22:18:13,155 - experiment_functions - INFO - Early stopping at epoch 850. Best Recall: 0.0820
2026-05-19 22:18:13,235 - optuna.study.study - INFO - Trial 107 finished with value: 0.08203726189668051 and parameters: {'n_layers': 1, 'embedding_dim': 128, 'lr': 0.0011957300720841578, 'lambda_val': 3.696226131589454e-06, 'batch_size': 1578, 'optimizer': 'Adam'}. Best is trial 82 with value: 0.08854803385288794.
2026-05-19 22:18:28,134 - experiment_functions - INFO - Early stopping at epoch 800. Best Recall: 0.0816
2026-05-19 22:18:28,236 - optuna.study.study - INFO - Trial 108 finished with value: 0.08158824780762797 and parameters: {'n_layers': 1, 'embedding_dim': 128, 'lr': 0.0012386175485295898, 'lambda_val': 6.782771224728683e-06, 'batch_size': 1563, 'optimizer': 'Adam'}. Best is trial 82 with value: 0.08854803385288794.
2026-05-19 22:18:41,999 - experiment_functions - INFO - Early stopping at epoch 650. Best Recall: 0.0525
2026-05-19 22:18:42,089 - optuna.study.study - INFO - Trial 109 finished with value: 0.052505124235833284 and parameters: {'n_layers': 3, 'embedding_dim': 128, 'lr': 0.0009044352099418348, 'lambda_val': 0.0032475906344328434, 'batch_size': 1206, 'optimizer': 'Adam'}. Best is trial 82 with value: 0.08854803385288794.
2026-05-19 22:18:56,233 - experiment_functions - INFO - Early stopping at epoch 900. Best Recall: 0.0786
2026-05-19 22:18:56,334 - optuna.study.study - INFO - Trial 110 finished with value: 0.07859970749056563 and parameters: {'n_layers': 1, 'embedding_dim': 32, 'lr': 0.0012462586365878272, 'lambda_val': 4.6955814320822486e-06, 'batch_size': 1547, 'optimizer': 'Adam'}. Best is trial 82 with value: 0.08854803385288794.
2026-05-19 22:19:11,653 - experiment_functions - INFO - Early stopping at epoch 750. Best Recall: 0.0791
2026-05-19 22:19:11,856 - optuna.study.study - INFO - Trial 111 finished with value: 0.07913186354839723 and parameters: {'n_layers': 1, 'embedding_dim': 128, 'lr': 0.0014530018642873227, 'lambda_val': 7.178243514990948e-06, 'batch_size': 1590, 'optimizer': 'Adam'}. Best is trial 82 with value: 0.08854803385288794.
2026-05-19 22:19:39,626 - experiment_functions - INFO - Early stopping at epoch 1600. Best Recall: 0.0815
2026-05-19 22:19:39,716 - optuna.study.study - INFO - Trial 112 finished with value: 0.08152714736661386 and parameters: {'n_layers': 1, 'embedding_dim': 128, 'lr': 0.0006002725367703937, 'lambda_val': 3.574996811368833e-06, 'batch_size': 1277, 'optimizer': 'Adam'}. Best is trial 82 with value: 0.08854803385288794.
2026-05-19 22:19:56,353 - optuna.study._optimize - INFO - Trial 113 pruned. 
2026-05-19 22:20:26,101 - experiment_functions - INFO - Early stopping at epoch 1800. Best Recall: 0.0822
2026-05-19 22:20:26,201 - optuna.study.study - INFO - Trial 114 finished with value: 0.0821681308612587 and parameters: {'n_layers': 1, 'embedding_dim': 128, 'lr': 0.0005737483949940484, 'lambda_val': 2.982986093852423e-06, 'batch_size': 1229, 'optimizer': 'Adam'}. Best is trial 82 with value: 0.08854803385288794.
2026-05-19 22:21:03,384 - experiment_functions - INFO - Early stopping at epoch 1900. Best Recall: 0.0849
2026-05-19 22:21:03,474 - optuna.study.study - INFO - Trial 115 finished with value: 0.08485577623968561 and parameters: {'n_layers': 1, 'embedding_dim': 128, 'lr': 0.0006148879055599564, 'lambda_val': 5.398933855167873e-06, 'batch_size': 1066, 'optimizer': 'Adam'}. Best is trial 82 with value: 0.08854803385288794.
2026-05-19 22:21:19,905 - experiment_functions - INFO - Early stopping at epoch 950. Best Recall: 0.0808
2026-05-19 22:21:19,996 - optuna.study.study - INFO - Trial 116 finished with value: 0.08080202900863129 and parameters: {'n_layers': 1, 'embedding_dim': 128, 'lr': 0.0009392908049516849, 'lambda_val': 5.448701838913366e-06, 'batch_size': 1790, 'optimizer': 'Adam'}. Best is trial 82 with value: 0.08854803385288794.
2026-05-19 22:22:26,052 - optuna.study.study - INFO - Trial 117 finished with value: 0.09307670313944087 and parameters: {'n_layers': 1, 'embedding_dim': 128, 'lr': 0.0005661669492578052, 'lambda_val': 2.0237201064773095e-06, 'batch_size': 704, 'optimizer': 'Adam'}. Best is trial 117 with value: 0.09307670313944087.
2026-05-19 22:23:12,246 - experiment_functions - INFO - Early stopping at epoch 2000. Best Recall: 0.0835
2026-05-19 22:23:12,355 - optuna.study.study - INFO - Trial 118 finished with value: 0.08353585710033626 and parameters: {'n_layers': 1, 'embedding_dim': 256, 'lr': 0.0006365984681436782, 'lambda_val': 1.953208361132447e-06, 'batch_size': 547, 'optimizer': 'Adam'}. Best is trial 117 with value: 0.09307670313944087.
2026-05-19 22:23:30,756 - optuna.study._optimize - INFO - Trial 119 pruned. 
2026-05-19 22:23:48,908 - optuna.study._optimize - INFO - Trial 120 pruned. 
2026-05-19 22:24:19,936 - experiment_functions - INFO - Early stopping at epoch 1700. Best Recall: 0.0836
