2026-05-20 09:21:04,503 - optuna.study.study - INFO - Trial 59 finished with value: 0.0750924188768941 and parameters: {'n_layers': 2, 'embedding_dim': 256, 'lr': 0.0009669640275666935, 'lambda_val': 0.00016215602323292467, 'batch_size': 3735, 'optimizer': 'Adam'}. Best is trial 53 with value: 0.08819616671886281.
2026-05-20 09:21:19,311 - experiment_functions - INFO - Early stopping at epoch 950. Best Recall: 0.0842
2026-05-20 09:21:19,379 - optuna.study.study - INFO - Trial 60 finished with value: 0.08419350776335836 and parameters: {'n_layers': 1, 'embedding_dim': 256, 'lr': 0.00046553463331768717, 'lambda_val': 0.00028114445408504614, 'batch_size': 3125, 'optimizer': 'Adam'}. Best is trial 53 with value: 0.08819616671886281.
2026-05-20 09:21:31,330 - experiment_functions - INFO - Early stopping at epoch 750. Best Recall: 0.0845
2026-05-20 09:21:31,409 - optuna.study.study - INFO - Trial 61 finished with value: 0.08448563775117078 and parameters: {'n_layers': 1, 'embedding_dim': 256, 'lr': 0.0007894582482523904, 'lambda_val': 0.0012346648499427704, 'batch_size': 3538, 'optimizer': 'Adam'}. Best is trial 53 with value: 0.08819616671886281.
2026-05-20 09:21:40,879 - experiment_functions - INFO - Early stopping at epoch 550. Best Recall: 0.0818
2026-05-20 09:21:40,982 - optuna.study.study - INFO - Trial 62 finished with value: 0.08175099497482564 and parameters: {'n_layers': 1, 'embedding_dim': 256, 'lr': 0.0052687071395658, 'lambda_val': 0.0003048243830673036, 'batch_size': 3819, 'optimizer': 'Adam'}. Best is trial 53 with value: 0.08819616671886281.
2026-05-20 09:21:50,670 - experiment_functions - INFO - Early stopping at epoch 600. Best Recall: 0.0878
2026-05-20 09:21:50,805 - optuna.study.study - INFO - Trial 63 finished with value: 0.08775381684382452 and parameters: {'n_layers': 1, 'embedding_dim': 256, 'lr': 0.0017918642907128605, 'lambda_val': 0.0005430854566520997, 'batch_size': 3643, 'optimizer': 'Adam'}. Best is trial 53 with value: 0.08819616671886281.
2026-05-20 09:22:00,493 - experiment_functions - INFO - Early stopping at epoch 600. Best Recall: 0.0833
2026-05-20 09:22:00,573 - optuna.study.study - INFO - Trial 64 finished with value: 0.08334206382873689 and parameters: {'n_layers': 1, 'embedding_dim': 256, 'lr': 0.0018043290174529734, 'lambda_val': 0.0005311184875526694, 'batch_size': 3644, 'optimizer': 'Adam'}. Best is trial 53 with value: 0.08819616671886281.
2026-05-20 09:22:11,816 - experiment_functions - INFO - Early stopping at epoch 650. Best Recall: 0.0835
2026-05-20 09:22:11,962 - optuna.study.study - INFO - Trial 65 finished with value: 0.08352344042415562 and parameters: {'n_layers': 1, 'embedding_dim': 256, 'lr': 0.0013890652451064443, 'lambda_val': 8.592279209880974e-05, 'batch_size': 3423, 'optimizer': 'Adam'}. Best is trial 53 with value: 0.08819616671886281.
2026-05-20 09:22:26,286 - optuna.study._optimize - INFO - Trial 66 pruned. 
2026-05-20 09:22:36,084 - experiment_functions - INFO - Early stopping at epoch 650. Best Recall: 0.0774
2026-05-20 09:22:36,176 - optuna.study.study - INFO - Trial 67 finished with value: 0.0774016667385586 and parameters: {'n_layers': 1, 'embedding_dim': 32, 'lr': 0.002254446039300927, 'lambda_val': 0.00011728109931590682, 'batch_size': 3420, 'optimizer': 'Adam'}. Best is trial 53 with value: 0.08819616671886281.
2026-05-20 09:22:46,908 - experiment_functions - INFO - Early stopping at epoch 600. Best Recall: 0.0621
2026-05-20 09:22:46,998 - optuna.study.study - INFO - Trial 68 finished with value: 0.062116082947404616 and parameters: {'n_layers': 2, 'embedding_dim': 256, 'lr': 0.00113147414632661, 'lambda_val': 0.01115165971534948, 'batch_size': 2992, 'optimizer': 'Adam'}. Best is trial 53 with value: 0.08819616671886281.
2026-05-20 09:23:01,722 - optuna.study._optimize - INFO - Trial 69 pruned. 
2026-05-20 09:23:14,470 - experiment_functions - INFO - Early stopping at epoch 850. Best Recall: 0.0900
2026-05-20 09:23:14,553 - optuna.study.study - INFO - Trial 70 finished with value: 0.08999374681903885 and parameters: {'n_layers': 1, 'embedding_dim': 64, 'lr': 0.0009012138223365537, 'lambda_val': 6.587966529583453e-05, 'batch_size': 1990, 'optimizer': 'Adam'}. Best is trial 70 with value: 0.08999374681903885.
2026-05-20 09:23:28,725 - experiment_functions - INFO - Early stopping at epoch 950. Best Recall: 0.0861
2026-05-20 09:23:28,827 - optuna.study.study - INFO - Trial 71 finished with value: 0.08608372750225983 and parameters: {'n_layers': 1, 'embedding_dim': 64, 'lr': 0.0007403199105774344, 'lambda_val': 7.65331351999965e-05, 'batch_size': 2026, 'optimizer': 'Adam'}. Best is trial 70 with value: 0.08999374681903885.
2026-05-20 09:23:41,980 - experiment_functions - INFO - Early stopping at epoch 850. Best Recall: 0.0857
2026-05-20 09:23:42,071 - optuna.study.study - INFO - Trial 72 finished with value: 0.08567289775955375 and parameters: {'n_layers': 1, 'embedding_dim': 64, 'lr': 0.0008305556773681384, 'lambda_val': 3.921787483321464e-05, 'batch_size': 1949, 'optimizer': 'Adam'}. Best is trial 70 with value: 0.08999374681903885.
2026-05-20 09:23:58,572 - experiment_functions - INFO - Early stopping at epoch 1150. Best Recall: 0.0852
2026-05-20 09:23:58,662 - optuna.study.study - INFO - Trial 73 finished with value: 0.0852044630941104 and parameters: {'n_layers': 1, 'embedding_dim': 64, 'lr': 0.0005432073629516446, 'lambda_val': 6.82311435994406e-05, 'batch_size': 2105, 'optimizer': 'Adam'}. Best is trial 70 with value: 0.08999374681903885.
2026-05-20 09:24:08,611 - experiment_functions - INFO - Early stopping at epoch 600. Best Recall: 0.0351
2026-05-20 09:24:08,692 - optuna.study.study - INFO - Trial 74 finished with value: 0.03514992020848827 and parameters: {'n_layers': 4, 'embedding_dim': 64, 'lr': 0.0017417944088007947, 'lambda_val': 0.0003643090646590713, 'batch_size': 2263, 'optimizer': 'Adam'}. Best is trial 70 with value: 0.08999374681903885.
2026-05-20 09:24:23,352 - experiment_functions - INFO - Early stopping at epoch 950. Best Recall: 0.0892
2026-05-20 09:24:23,454 - optuna.study.study - INFO - Trial 75 finished with value: 0.08916715415693299 and parameters: {'n_layers': 1, 'embedding_dim': 64, 'lr': 0.0007307856527743649, 'lambda_val': 0.00011070765402955505, 'batch_size': 1756, 'optimizer': 'Adam'}. Best is trial 70 with value: 0.08999374681903885.
2026-05-20 09:25:12,428 - experiment_functions - INFO - Early stopping at epoch 2650. Best Recall: 0.0905
2026-05-20 09:25:12,755 - optuna.study.study - INFO - Trial 76 finished with value: 0.09051422137432154 and parameters: {'n_layers': 1, 'embedding_dim': 256, 'lr': 0.0002523629509121617, 'lambda_val': 0.0001643971690324781, 'batch_size': 1575, 'optimizer': 'Adam'}. Best is trial 76 with value: 0.09051422137432154.
2026-05-20 09:25:24,816 - experiment_functions - INFO - Early stopping at epoch 750. Best Recall: 0.0890
2026-05-20 09:25:24,917 - optuna.study.study - INFO - Trial 77 finished with value: 0.08898737127885052 and parameters: {'n_layers': 1, 'embedding_dim': 256, 'lr': 0.0010674237866983873, 'lambda_val': 0.0001460914565870885, 'batch_size': 1806, 'optimizer': 'Adam'}. Best is trial 76 with value: 0.09051422137432154.
2026-05-20 09:26:14,935 - experiment_functions - INFO - Early stopping at epoch 3100. Best Recall: 0.0898
2026-05-20 09:26:16,194 - optuna.study.study - INFO - Trial 78 finished with value: 0.08976628485823128 and parameters: {'n_layers': 1, 'embedding_dim': 256, 'lr': 0.0002463870849918904, 'lambda_val': 0.0001224363642246035, 'batch_size': 1771, 'optimizer': 'Adam'}. Best is trial 76 with value: 0.09051422137432154.
2026-05-20 09:26:35,093 - optuna.study._optimize - INFO - Trial 79 pruned. 
2026-05-20 09:26:49,854 - optuna.study._optimize - INFO - Trial 80 pruned. 
2026-05-20 09:27:02,148 - experiment_functions - INFO - Early stopping at epoch 750. Best Recall: 0.0856
2026-05-20 09:27:02,239 - optuna.study.study - INFO - Trial 81 finished with value: 0.08557137742277338 and parameters: {'n_layers': 1, 'embedding_dim': 256, 'lr': 0.0010874434975562783, 'lambda_val': 0.0005477521445027031, 'batch_size': 1766, 'optimizer': 'Adam'}. Best is trial 76 with value: 0.09051422137432154.
2026-05-20 09:27:12,254 - experiment_functions - INFO - Early stopping at epoch 600. Best Recall: 0.0875
2026-05-20 09:27:12,334 - optuna.study.study - INFO - Trial 82 finished with value: 0.08750649160591785 and parameters: {'n_layers': 1, 'embedding_dim': 256, 'lr': 0.002500174263454551, 'lambda_val': 0.00023691709969823514, 'batch_size': 1511, 'optimizer': 'Adam'}. Best is trial 76 with value: 0.09051422137432154.
2026-05-20 09:28:11,908 - experiment_functions - INFO - Early stopping at epoch 3850. Best Recall: 0.0917
2026-05-20 09:28:12,010 - optuna.study.study - INFO - Trial 83 finished with value: 0.09168112592426221 and parameters: {'n_layers': 1, 'embedding_dim': 256, 'lr': 0.00024981739664942484, 'lambda_val': 0.00021596775394943025, 'batch_size': 1525, 'optimizer': 'Adam'}. Best is trial 83 with value: 0.09168112592426221.
2026-05-20 09:28:27,748 - optuna.study._optimize - INFO - Trial 84 pruned. 
2026-05-20 09:28:35,679 - experiment_functions - INFO - Early stopping at epoch 500. Best Recall: 0.0052
2026-05-20 09:28:35,771 - optuna.study.study - INFO - Trial 85 finished with value: 0.005245184270178478 and parameters: {'n_layers': 1, 'embedding_dim': 256, 'lr': 0.0003978075922406122, 'lambda_val': 0.0001720234983092539, 'batch_size': 1259, 'optimizer': 'SGD'}. Best is trial 83 with value: 0.09168112592426221.
2026-05-20 09:29:15,534 - experiment_functions - INFO - Early stopping at epoch 2350. Best Recall: 0.0893
2026-05-20 09:29:15,646 - optuna.study.study - INFO - Trial 86 finished with value: 0.08934697900037959 and parameters: {'n_layers': 1, 'embedding_dim': 256, 'lr': 0.0002661611315172753, 'lambda_val': 0.00011528752261215225, 'batch_size': 1826, 'optimizer': 'Adam'}. Best is trial 83 with value: 0.09168112592426221.
2026-05-20 09:29:45,962 - experiment_functions - INFO - Early stopping at epoch 1900. Best Recall: 0.0891
2026-05-20 09:29:46,097 - optuna.study.study - INFO - Trial 87 finished with value: 0.08907532980733272 and parameters: {'n_layers': 1, 'embedding_dim': 256, 'lr': 0.0002911878663266011, 'lambda_val': 0.00010720349402371642, 'batch_size': 1801, 'optimizer': 'Adam'}. Best is trial 83 with value: 0.09168112592426221.
2026-05-20 09:30:06,241 - optuna.study._optimize - INFO - Trial 88 pruned. 
2026-05-20 09:30:59,595 - experiment_functions - INFO - Early stopping at epoch 2900. Best Recall: 0.0916
2026-05-20 09:30:59,675 - optuna.study.study - INFO - Trial 89 finished with value: 0.09162694511916337 and parameters: {'n_layers': 1, 'embedding_dim': 256, 'lr': 0.00028807882053546384, 'lambda_val': 3.7602989763746985e-05, 'batch_size': 1555, 'optimizer': 'Adam'}. Best is trial 83 with value: 0.09168112592426221.
2026-05-20 09:31:14,838 - optuna.study._optimize - INFO - Trial 90 pruned. 
2026-05-20 09:31:45,667 - experiment_functions - INFO - Early stopping at epoch 1950. Best Recall: 0.0900
2026-05-20 09:31:45,799 - optuna.study.study - INFO - Trial 91 finished with value: 0.09002195618718459 and parameters: {'n_layers': 1, 'embedding_dim': 256, 'lr': 0.00029336354496090723, 'lambda_val': 0.00010909930492183077, 'batch_size': 1846, 'optimizer': 'Adam'}. Best is trial 83 with value: 0.09168112592426221.
2026-05-20 09:32:03,927 - optuna.study._optimize - INFO - Trial 92 pruned. 
2026-05-20 09:32:31,044 - optuna.study._optimize - INFO - Trial 93 pruned. 
2026-05-20 09:32:45,867 - optuna.study._optimize - INFO - Trial 94 pruned. 
2026-05-20 09:33:09,403 - experiment_functions - INFO - Early stopping at epoch 1450. Best Recall: 0.0876
2026-05-20 09:33:09,482 - optuna.study.study - INFO - Trial 95 finished with value: 0.08757437117978423 and parameters: {'n_layers': 1, 'embedding_dim': 256, 'lr': 0.00036960220764397603, 'lambda_val': 0.0002052651019681716, 'batch_size': 1604, 'optimizer': 'Adam'}. Best is trial 83 with value: 0.09168112592426221.
2026-05-20 09:33:33,483 - optuna.study._optimize - INFO - Trial 96 pruned. 
2026-05-20 09:33:41,736 - experiment_functions - INFO - Early stopping at epoch 500. Best Recall: 0.0053
2026-05-20 09:33:41,815 - optuna.study.study - INFO - Trial 97 finished with value: 0.005256689847867561 and parameters: {'n_layers': 1, 'embedding_dim': 32, 'lr': 0.0002731136340651067, 'lambda_val': 0.0001074550511558995, 'batch_size': 1425, 'optimizer': 'SGD'}. Best is trial 83 with value: 0.09168112592426221.
2026-05-20 09:33:57,575 - optuna.study._optimize - INFO - Trial 98 pruned. 
2026-05-20 09:34:12,926 - optuna.study._optimize - INFO - Trial 99 pruned. 
2026-05-20 09:34:31,365 - experiment_functions - INFO - Early stopping at epoch 1150. Best Recall: 0.0886
2026-05-20 09:34:31,522 - optuna.study.study - INFO - Trial 100 finished with value: 0.08859611178763782 and parameters: {'n_layers': 1, 'embedding_dim': 256, 'lr': 0.0004508138741379805, 'lambda_val': 0.0003929632465304269, 'batch_size': 1700, 'optimizer': 'Adam'}. Best is trial 83 with value: 0.09168112592426221.
2026-05-20 09:34:46,650 - experiment_functions - INFO - Early stopping at epoch 900. Best Recall: 0.0893
2026-05-20 09:34:46,785 - optuna.study.study - INFO - Trial 101 finished with value: 0.0893062685133336 and parameters: {'n_layers': 1, 'embedding_dim': 256, 'lr': 0.0006825447638193569, 'lambda_val': 0.0004186279821988745, 'batch_size': 1737, 'optimizer': 'Adam'}. Best is trial 83 with value: 0.09168112592426221.
2026-05-20 09:35:03,147 - experiment_functions - INFO - Early stopping at epoch 900. Best Recall: 0.0855
2026-05-20 09:35:03,924 - optuna.study.study - INFO - Trial 102 finished with value: 0.08552271587972633 and parameters: {'n_layers': 1, 'embedding_dim': 256, 'lr': 0.0006682866861336131, 'lambda_val': 0.0002138747684375795, 'batch_size': 1522, 'optimizer': 'Adam'}. Best is trial 83 with value: 0.09168112592426221.
2026-05-20 09:35:34,377 - optuna.study._optimize - INFO - Trial 103 pruned. 
2026-05-20 09:35:49,608 - optuna.study._optimize - INFO - Trial 104 pruned. 
2026-05-20 09:36:10,520 - experiment_functions - INFO - Early stopping at epoch 1300. Best Recall: 0.0886
2026-05-20 09:36:10,630 - optuna.study.study - INFO - Trial 105 finished with value: 0.08863291001870856 and parameters: {'n_layers': 1, 'embedding_dim': 256, 'lr': 0.00037507751550096714, 'lambda_val': 5.9714171713256e-05, 'batch_size': 1818, 'optimizer': 'Adam'}. Best is trial 83 with value: 0.09168112592426221.
2026-05-20 09:36:28,977 - experiment_functions - INFO - Early stopping at epoch 1150. Best Recall: 0.0883
2026-05-20 09:36:29,045 - optuna.study.study - INFO - Trial 106 finished with value: 0.0883451356267671 and parameters: {'n_layers': 1, 'embedding_dim': 256, 'lr': 0.0005390286168255943, 'lambda_val': 0.00010665588345327203, 'batch_size': 1361, 'optimizer': 'Adam'}. Best is trial 83 with value: 0.09168112592426221.
2026-05-20 09:36:50,313 - optuna.study._optimize - INFO - Trial 107 pruned. 
2026-05-20 09:37:05,605 - experiment_functions - INFO - Early stopping at epoch 950. Best Recall: 0.0868
2026-05-20 09:37:05,752 - optuna.study.study - INFO - Trial 108 finished with value: 0.08677040020836521 and parameters: {'n_layers': 1, 'embedding_dim': 256, 'lr': 0.0006720294773552338, 'lambda_val': 0.00017743257242538532, 'batch_size': 1576, 'optimizer': 'Adam'}. Best is trial 83 with value: 0.09168112592426221.
2026-05-20 09:37:19,473 - optuna.study._optimize - INFO - Trial 109 pruned. 
2026-05-20 09:37:34,426 - optuna.study._optimize - INFO - Trial 110 pruned. 
2026-05-20 09:37:55,646 - experiment_functions - INFO - Early stopping at epoch 1350. Best Recall: 0.0876
2026-05-20 09:37:55,738 - optuna.study.study - INFO - Trial 111 finished with value: 0.08764081180199938 and parameters: {'n_layers': 1, 'embedding_dim': 256, 'lr': 0.000353340228439335, 'lambda_val': 5.8061550683806794e-05, 'batch_size': 1835, 'optimizer': 'Adam'}. Best is trial 83 with value: 0.09168112592426221.
2026-05-20 09:38:14,288 - experiment_functions - INFO - Early stopping at epoch 1200. Best Recall: 0.0892
2026-05-20 09:38:14,423 - optuna.study.study - INFO - Trial 112 finished with value: 0.08923208372312925 and parameters: {'n_layers': 1, 'embedding_dim': 256, 'lr': 0.0004406860213564863, 'lambda_val': 4.312992738652798e-05, 'batch_size': 1742, 'optimizer': 'Adam'}. Best is trial 83 with value: 0.09168112592426221.
2026-05-20 09:38:32,081 - experiment_functions - INFO - Early stopping at epoch 1150. Best Recall: 0.0905
2026-05-20 09:38:32,151 - optuna.study.study - INFO - Trial 113 finished with value: 0.09053670813885964 and parameters: {'n_layers': 1, 'embedding_dim': 256, 'lr': 0.0004548960766303296, 'lambda_val': 4.5601511754527954e-05, 'batch_size': 1745, 'optimizer': 'Adam'}. Best is trial 83 with value: 0.09168112592426221.
2026-05-20 09:38:57,449 - experiment_functions - INFO - Early stopping at epoch 1200. Best Recall: 0.0901
2026-05-20 09:38:57,529 - optuna.study.study - INFO - Trial 114 finished with value: 0.09008079731912744 and parameters: {'n_layers': 1, 'embedding_dim': 256, 'lr': 0.00047480508100323176, 'lambda_val': 4.511174847696791e-05, 'batch_size': 1713, 'optimizer': 'Adam'}. Best is trial 83 with value: 0.09168112592426221.
2026-05-20 09:39:17,642 - experiment_functions - INFO - Early stopping at epoch 1450. Best Recall: 0.0925
2026-05-20 09:39:17,734 - optuna.study.study - INFO - Trial 115 finished with value: 0.09253947425969536 and parameters: {'n_layers': 1, 'embedding_dim': 64, 'lr': 0.00047814575862533033, 'lambda_val': 4.3596926496656034e-05, 'batch_size': 1472, 'optimizer': 'Adam'}. Best is trial 115 with value: 0.09253947425969536.
2026-05-20 09:39:38,874 - experiment_functions - INFO - Early stopping at epoch 1100. Best Recall: 0.0907
2026-05-20 09:39:38,964 - optuna.study.study - INFO - Trial 116 finished with value: 0.09066837463514839 and parameters: {'n_layers': 1, 'embedding_dim': 256, 'lr': 0.0005108933646292269, 'lambda_val': 4.2412278789800605e-05, 'batch_size': 1482, 'optimizer': 'Adam'}. Best is trial 115 with value: 0.09253947425969536.
2026-05-20 09:39:46,562 - experiment_functions - INFO - Early stopping at epoch 500. Best Recall: 0.0055
2026-05-20 09:39:46,665 - optuna.study.study - INFO - Trial 117 finished with value: 0.0055483713508606425 and parameters: {'n_layers': 1, 'embedding_dim': 256, 'lr': 0.0005328984314221998, 'lambda_val': 2.3362565961898445e-05, 'batch_size': 1272, 'optimizer': 'SGD'}. Best is trial 115 with value: 0.09253947425969536.
2026-05-20 09:40:12,633 - experiment_functions - INFO - Early stopping at epoch 1850. Best Recall: 0.0917
2026-05-20 09:40:12,724 - optuna.study.study - INFO - Trial 118 finished with value: 0.09168452207186954 and parameters: {'n_layers': 1, 'embedding_dim': 64, 'lr': 0.00045259282093078915, 'lambda_val': 1.4034656622039058e-05, 'batch_size': 1467, 'optimizer': 'Adam'}. Best is trial 115 with value: 0.09253947425969536.
2026-05-20 09:40:26,904 - optuna.study._optimize - INFO - Trial 119 pruned. 
2026-05-20 09:40:54,451 - experiment_functions - INFO - Early stopping at epoch 1550. Best Recall: 0.0898
2026-05-20 09:40:54,602 - optuna.study.study - INFO - Trial 120 finished with value: 0.08977294796574423 and parameters: {'n_layers': 1, 'embedding_dim': 64, 'lr': 0.00043450285387939614, 'lambda_val': 3.745375817151137e-05, 'batch_size': 1461, 'optimizer': 'Adam'}. Best is trial 115 with value: 0.09253947425969536.
2026-05-20 09:41:26,074 - experiment_functions - INFO - Early stopping at epoch 2200. Best Recall: 0.0911
2026-05-20 09:41:26,165 - optuna.study.study - INFO - Trial 121 finished with value: 0.09109365686691785 and parameters: {'n_layers': 1, 'embedding_dim': 64, 'lr': 0.0004138207489531901, 'lambda_val': 3.37173470911553e-05, 'batch_size': 1476, 'optimizer': 'Adam'}. Best is trial 115 with value: 0.09253947425969536.
2026-05-20 09:41:49,528 - experiment_functions - INFO - Early stopping at epoch 1550. Best Recall: 0.0910
2026-05-20 09:41:49,607 - optuna.study.study - INFO - Trial 122 finished with value: 0.09100517795013427 and parameters: {'n_layers': 1, 'embedding_dim': 64, 'lr': 0.0004639291194422528, 'lambda_val': 3.222094970958032e-05, 'batch_size': 1475, 'optimizer': 'Adam'}. Best is trial 115 with value: 0.09253947425969536.
2026-05-20 09:42:18,412 - optuna.study._optimize - INFO - Trial 123 pruned. 
2026-05-20 09:42:43,852 - experiment_functions - INFO - Early stopping at epoch 1800. Best Recall: 0.0922
2026-05-20 09:42:43,970 - optuna.study.study - INFO - Trial 124 finished with value: 0.09220633799700394 and parameters: {'n_layers': 1, 'embedding_dim': 64, 'lr': 0.00042083265079221504, 'lambda_val': 1.3789249371175671e-05, 'batch_size': 1444, 'optimizer': 'Adam'}. Best is trial 115 with value: 0.09253947425969536.
2026-05-20 09:43:02,748 - experiment_functions - INFO - Early stopping at epoch 1350. Best Recall: 0.0871
2026-05-20 09:43:02,849 - optuna.study.study - INFO - Trial 125 finished with value: 0.0871380828412257 and parameters: {'n_layers': 1, 'embedding_dim': 64, 'lr': 0.0005277272394637257, 'lambda_val': 1.4218785020995603e-05, 'batch_size': 1327, 'optimizer': 'Adam'}. Best is trial 115 with value: 0.09253947425969536.
2026-05-20 09:43:16,422 - experiment_functions - INFO - Early stopping at epoch 900. Best Recall: 0.0932
2026-05-20 09:43:16,512 - optuna.study.study - INFO - Trial 126 finished with value: 0.09322681497767364 and parameters: {'n_layers': 1, 'embedding_dim': 64, 'lr': 0.0009024454811000014, 'lambda_val': 1.918151913275582e-05, 'batch_size': 1597, 'optimizer': 'Adam'}. Best is trial 126 with value: 0.09322681497767364.
2026-05-20 09:43:32,012 - experiment_functions - INFO - Early stopping at epoch 1100. Best Recall: 0.0891
