2026-05-20 00:34:54,224 - optuna.study.study - INFO - Trial 100 finished with value: 0.026634314715380324 and parameters: {'n_layers': 1, 'embedding_dim': 32, 'lr': 0.004311273317128647, 'lambda_val': 1.3166744378265205e-06, 'batch_size': 758, 'optimizer': 'Adam'}. Best is trial 37 with value: 0.030943974763693986.
2026-05-20 00:35:02,237 - experiment_functions - INFO - Early stopping at epoch 600. Best Recall: 0.0283
2026-05-20 00:35:02,339 - optuna.study.study - INFO - Trial 101 finished with value: 0.028296344583576803 and parameters: {'n_layers': 1, 'embedding_dim': 32, 'lr': 0.0026169710796759894, 'lambda_val': 2.3911605413776153e-06, 'batch_size': 659, 'optimizer': 'Adam'}. Best is trial 37 with value: 0.030943974763693986.
2026-05-20 00:35:10,994 - experiment_functions - INFO - Early stopping at epoch 600. Best Recall: 0.0279
2026-05-20 00:35:11,095 - optuna.study.study - INFO - Trial 102 finished with value: 0.02791298225571006 and parameters: {'n_layers': 1, 'embedding_dim': 32, 'lr': 0.002671892897328298, 'lambda_val': 2.6200085069087097e-06, 'batch_size': 866, 'optimizer': 'Adam'}. Best is trial 37 with value: 0.030943974763693986.
2026-05-20 00:35:19,143 - experiment_functions - INFO - Early stopping at epoch 600. Best Recall: 0.0239
2026-05-20 00:35:19,243 - optuna.study.study - INFO - Trial 103 finished with value: 0.02389300982225255 and parameters: {'n_layers': 1, 'embedding_dim': 32, 'lr': 0.0023506322271043246, 'lambda_val': 2.61644508629419e-06, 'batch_size': 858, 'optimizer': 'Adam'}. Best is trial 37 with value: 0.030943974763693986.
2026-05-20 00:35:26,645 - experiment_functions - INFO - Early stopping at epoch 550. Best Recall: 0.0263
2026-05-20 00:35:26,744 - optuna.study.study - INFO - Trial 104 finished with value: 0.026254404325966336 and parameters: {'n_layers': 1, 'embedding_dim': 32, 'lr': 0.005764780039798008, 'lambda_val': 3.9826864378291375e-06, 'batch_size': 1034, 'optimizer': 'Adam'}. Best is trial 37 with value: 0.030943974763693986.
2026-05-20 00:35:34,103 - experiment_functions - INFO - Early stopping at epoch 550. Best Recall: 0.0272
2026-05-20 00:35:34,223 - optuna.study.study - INFO - Trial 105 finished with value: 0.02717054074405442 and parameters: {'n_layers': 1, 'embedding_dim': 32, 'lr': 0.004874093544221278, 'lambda_val': 5.552935424116984e-06, 'batch_size': 678, 'optimizer': 'Adam'}. Best is trial 37 with value: 0.030943974763693986.
2026-05-20 00:35:43,145 - experiment_functions - INFO - Early stopping at epoch 600. Best Recall: 0.0277
2026-05-20 00:35:43,235 - optuna.study.study - INFO - Trial 106 finished with value: 0.02771151042989587 and parameters: {'n_layers': 1, 'embedding_dim': 32, 'lr': 0.002824511529659862, 'lambda_val': 1.960086837273777e-06, 'batch_size': 769, 'optimizer': 'Adam'}. Best is trial 37 with value: 0.030943974763693986.
2026-05-20 00:35:50,758 - experiment_functions - INFO - Early stopping at epoch 550. Best Recall: 0.0219
2026-05-20 00:35:50,848 - optuna.study.study - INFO - Trial 107 finished with value: 0.021887697604599313 and parameters: {'n_layers': 1, 'embedding_dim': 32, 'lr': 0.0031252901175321543, 'lambda_val': 1.3988963866411257e-06, 'batch_size': 2195, 'optimizer': 'Adam'}. Best is trial 37 with value: 0.030943974763693986.
2026-05-20 00:35:58,311 - experiment_functions - INFO - Early stopping at epoch 550. Best Recall: 0.0259
2026-05-20 00:35:58,401 - optuna.study.study - INFO - Trial 108 finished with value: 0.025858458203177025 and parameters: {'n_layers': 1, 'embedding_dim': 32, 'lr': 0.007150230069444822, 'lambda_val': 2.144234629484401e-06, 'batch_size': 804, 'optimizer': 'Adam'}. Best is trial 37 with value: 0.030943974763693986.
2026-05-20 00:36:05,909 - experiment_functions - INFO - Early stopping at epoch 550. Best Recall: 0.0263
2026-05-20 00:36:06,009 - optuna.study.study - INFO - Trial 109 finished with value: 0.026308774301267213 and parameters: {'n_layers': 1, 'embedding_dim': 32, 'lr': 0.0038662227510023114, 'lambda_val': 3.534104750980165e-06, 'batch_size': 978, 'optimizer': 'Adam'}. Best is trial 37 with value: 0.030943974763693986.
2026-05-20 00:36:15,197 - experiment_functions - INFO - Early stopping at epoch 650. Best Recall: 0.0284
2026-05-20 00:36:15,297 - optuna.study.study - INFO - Trial 110 finished with value: 0.028370498257601823 and parameters: {'n_layers': 1, 'embedding_dim': 32, 'lr': 0.0026332360812127845, 'lambda_val': 1.769311699782965e-06, 'batch_size': 515, 'optimizer': 'Adam'}. Best is trial 37 with value: 0.030943974763693986.
2026-05-20 00:36:24,873 - experiment_functions - INFO - Early stopping at epoch 700. Best Recall: 0.0286
2026-05-20 00:36:24,982 - optuna.study.study - INFO - Trial 111 finished with value: 0.028628566760580704 and parameters: {'n_layers': 1, 'embedding_dim': 32, 'lr': 0.001722382344520495, 'lambda_val': 1.7910087483542864e-06, 'batch_size': 546, 'optimizer': 'Adam'}. Best is trial 37 with value: 0.030943974763693986.
2026-05-20 00:36:35,024 - experiment_functions - INFO - Early stopping at epoch 700. Best Recall: 0.0290
2026-05-20 00:36:35,114 - optuna.study.study - INFO - Trial 112 finished with value: 0.029039172520992557 and parameters: {'n_layers': 1, 'embedding_dim': 32, 'lr': 0.0018578980311613562, 'lambda_val': 1.6471358998593922e-06, 'batch_size': 567, 'optimizer': 'Adam'}. Best is trial 37 with value: 0.030943974763693986.
2026-05-20 00:36:45,515 - experiment_functions - INFO - Early stopping at epoch 750. Best Recall: 0.0289
2026-05-20 00:36:45,605 - optuna.study.study - INFO - Trial 113 finished with value: 0.028850309000025047 and parameters: {'n_layers': 1, 'embedding_dim': 32, 'lr': 0.0019446242137178503, 'lambda_val': 1.3202733175960865e-06, 'batch_size': 517, 'optimizer': 'Adam'}. Best is trial 37 with value: 0.030943974763693986.
2026-05-20 00:36:54,996 - experiment_functions - INFO - Early stopping at epoch 700. Best Recall: 0.0281
2026-05-20 00:36:55,096 - optuna.study.study - INFO - Trial 114 finished with value: 0.028089966197422968 and parameters: {'n_layers': 1, 'embedding_dim': 32, 'lr': 0.001724203177504898, 'lambda_val': 1.3015751317159502e-06, 'batch_size': 514, 'optimizer': 'Adam'}. Best is trial 37 with value: 0.030943974763693986.
2026-05-20 00:37:04,475 - experiment_functions - INFO - Early stopping at epoch 650. Best Recall: 0.0281
2026-05-20 00:37:04,565 - optuna.study.study - INFO - Trial 115 finished with value: 0.028064039645342223 and parameters: {'n_layers': 1, 'embedding_dim': 32, 'lr': 0.002044729946676878, 'lambda_val': 1.5603957826340229e-06, 'batch_size': 580, 'optimizer': 'Adam'}. Best is trial 37 with value: 0.030943974763693986.
2026-05-20 00:37:14,950 - experiment_functions - INFO - Early stopping at epoch 750. Best Recall: 0.0290
2026-05-20 00:37:15,048 - optuna.study.study - INFO - Trial 116 finished with value: 0.029007998810135223 and parameters: {'n_layers': 1, 'embedding_dim': 32, 'lr': 0.0013849294228019345, 'lambda_val': 1.0145013373367721e-06, 'batch_size': 641, 'optimizer': 'Adam'}. Best is trial 37 with value: 0.030943974763693986.
2026-05-20 00:37:24,584 - experiment_functions - INFO - Early stopping at epoch 700. Best Recall: 0.0285
2026-05-20 00:37:24,682 - optuna.study.study - INFO - Trial 117 finished with value: 0.028522764698739423 and parameters: {'n_layers': 1, 'embedding_dim': 32, 'lr': 0.0014072604681231852, 'lambda_val': 1.0327112004529484e-06, 'batch_size': 641, 'optimizer': 'Adam'}. Best is trial 37 with value: 0.030943974763693986.
2026-05-20 00:37:33,739 - experiment_functions - INFO - Early stopping at epoch 650. Best Recall: 0.0183
2026-05-20 00:37:33,892 - optuna.study.study - INFO - Trial 118 finished with value: 0.01828817966813222 and parameters: {'n_layers': 3, 'embedding_dim': 32, 'lr': 0.0014152909927026471, 'lambda_val': 1.169623726608687e-06, 'batch_size': 569, 'optimizer': 'Adam'}. Best is trial 37 with value: 0.030943974763693986.
2026-05-20 00:37:45,771 - experiment_functions - INFO - Early stopping at epoch 900. Best Recall: 0.0286
2026-05-20 00:37:45,872 - optuna.study.study - INFO - Trial 119 finished with value: 0.02855576330446498 and parameters: {'n_layers': 1, 'embedding_dim': 32, 'lr': 0.001224623660382791, 'lambda_val': 1.707560745186865e-06, 'batch_size': 640, 'optimizer': 'Adam'}. Best is trial 37 with value: 0.030943974763693986.
2026-05-20 00:37:53,119 - experiment_functions - INFO - Early stopping at epoch 500. Best Recall: 0.0052
2026-05-20 00:37:53,208 - optuna.study.study - INFO - Trial 120 finished with value: 0.005240811955562694 and parameters: {'n_layers': 1, 'embedding_dim': 32, 'lr': 0.0011734670494757912, 'lambda_val': 1.061195168967564e-06, 'batch_size': 639, 'optimizer': 'SGD'}. Best is trial 37 with value: 0.030943974763693986.
2026-05-20 00:38:02,437 - experiment_functions - INFO - Early stopping at epoch 700. Best Recall: 0.0291
2026-05-20 00:38:02,527 - optuna.study.study - INFO - Trial 121 finished with value: 0.029139321865903622 and parameters: {'n_layers': 1, 'embedding_dim': 32, 'lr': 0.001709828657906705, 'lambda_val': 1.3251764354617475e-06, 'batch_size': 566, 'optimizer': 'Adam'}. Best is trial 37 with value: 0.030943974763693986.
2026-05-20 00:38:12,620 - experiment_functions - INFO - Early stopping at epoch 750. Best Recall: 0.0285
2026-05-20 00:38:12,719 - optuna.study.study - INFO - Trial 122 finished with value: 0.02852612673961521 and parameters: {'n_layers': 1, 'embedding_dim': 32, 'lr': 0.0013077842751408812, 'lambda_val': 1.5467796652261546e-06, 'batch_size': 590, 'optimizer': 'Adam'}. Best is trial 37 with value: 0.030943974763693986.
2026-05-20 00:38:26,213 - experiment_functions - INFO - Early stopping at epoch 1000. Best Recall: 0.0290
2026-05-20 00:38:26,309 - optuna.study.study - INFO - Trial 123 finished with value: 0.029015010752595684 and parameters: {'n_layers': 1, 'embedding_dim': 32, 'lr': 0.0009840287591531588, 'lambda_val': 1.5288824346001753e-06, 'batch_size': 569, 'optimizer': 'Adam'}. Best is trial 37 with value: 0.030943974763693986.
2026-05-20 00:38:37,309 - experiment_functions - INFO - Early stopping at epoch 800. Best Recall: 0.0276
2026-05-20 00:38:37,387 - optuna.study.study - INFO - Trial 124 finished with value: 0.027595895833113976 and parameters: {'n_layers': 1, 'embedding_dim': 128, 'lr': 0.0009189299238143145, 'lambda_val': 1.8248587213803593e-06, 'batch_size': 561, 'optimizer': 'Adam'}. Best is trial 37 with value: 0.030943974763693986.
2026-05-20 00:38:46,533 - experiment_functions - INFO - Early stopping at epoch 700. Best Recall: 0.0282
2026-05-20 00:38:46,661 - optuna.study.study - INFO - Trial 125 finished with value: 0.028233424856836466 and parameters: {'n_layers': 1, 'embedding_dim': 32, 'lr': 0.0018598367478633963, 'lambda_val': 1.4073594299767264e-06, 'batch_size': 703, 'optimizer': 'Adam'}. Best is trial 37 with value: 0.030943974763693986.
2026-05-20 00:38:59,474 - optuna.study._optimize - INFO - Trial 126 pruned. 
2026-05-20 00:39:10,738 - experiment_functions - INFO - Early stopping at epoch 850. Best Recall: 0.0276
2026-05-20 00:39:10,881 - optuna.study.study - INFO - Trial 127 finished with value: 0.02760099123164044 and parameters: {'n_layers': 1, 'embedding_dim': 96, 'lr': 0.0010599902026553832, 'lambda_val': 1.7234782900333681e-06, 'batch_size': 633, 'optimizer': 'Adam'}. Best is trial 37 with value: 0.030943974763693986.
2026-05-20 00:39:18,937 - experiment_functions - INFO - Early stopping at epoch 600. Best Recall: 0.0170
2026-05-20 00:39:19,024 - optuna.study.study - INFO - Trial 128 finished with value: 0.017028349956298695 and parameters: {'n_layers': 1, 'embedding_dim': 32, 'lr': 0.0016907068128076818, 'lambda_val': 0.009039414258852166, 'batch_size': 3175, 'optimizer': 'Adam'}. Best is trial 37 with value: 0.030943974763693986.
2026-05-20 00:39:30,506 - experiment_functions - INFO - Early stopping at epoch 850. Best Recall: 0.0282
2026-05-20 00:39:30,597 - optuna.study.study - INFO - Trial 129 finished with value: 0.02823918743975046 and parameters: {'n_layers': 1, 'embedding_dim': 32, 'lr': 0.001168164049979529, 'lambda_val': 3.366323747700907e-06, 'batch_size': 713, 'optimizer': 'Adam'}. Best is trial 37 with value: 0.030943974763693986.
2026-05-20 00:39:43,756 - experiment_functions - INFO - Early stopping at epoch 1000. Best Recall: 0.0297
2026-05-20 00:39:43,902 - optuna.study.study - INFO - Trial 130 finished with value: 0.02971508973857407 and parameters: {'n_layers': 1, 'embedding_dim': 32, 'lr': 0.0009237219979449666, 'lambda_val': 1.3106946826445442e-06, 'batch_size': 516, 'optimizer': 'RMSprop'}. Best is trial 37 with value: 0.030943974763693986.
2026-05-20 00:39:58,034 - experiment_functions - INFO - Early stopping at epoch 1100. Best Recall: 0.0304
2026-05-20 00:39:58,143 - optuna.study.study - INFO - Trial 131 finished with value: 0.030430358520448987 and parameters: {'n_layers': 1, 'embedding_dim': 32, 'lr': 0.0009668960855382876, 'lambda_val': 1.3881586526785075e-06, 'batch_size': 571, 'optimizer': 'RMSprop'}. Best is trial 37 with value: 0.030943974763693986.
2026-05-20 00:40:15,247 - optuna.study._optimize - INFO - Trial 132 pruned. 
2026-05-20 00:40:42,004 - experiment_functions - INFO - Early stopping at epoch 2200. Best Recall: 0.0304
2026-05-20 00:40:42,094 - optuna.study.study - INFO - Trial 133 finished with value: 0.030372963643619872 and parameters: {'n_layers': 1, 'embedding_dim': 32, 'lr': 0.0005013112234018776, 'lambda_val': 1.254807458794659e-06, 'batch_size': 563, 'optimizer': 'RMSprop'}. Best is trial 37 with value: 0.030943974763693986.
2026-05-20 00:41:00,169 - optuna.study._optimize - INFO - Trial 134 pruned. 
2026-05-20 00:41:23,184 - experiment_functions - INFO - Early stopping at epoch 1850. Best Recall: 0.0303
2026-05-20 00:41:23,283 - optuna.study.study - INFO - Trial 135 finished with value: 0.030342580914078942 and parameters: {'n_layers': 1, 'embedding_dim': 32, 'lr': 0.0005083201200627782, 'lambda_val': 1.2924806017263523e-06, 'batch_size': 675, 'optimizer': 'RMSprop'}. Best is trial 37 with value: 0.030943974763693986.
2026-05-20 00:41:36,709 - optuna.study._optimize - INFO - Trial 136 pruned. 
2026-05-20 00:41:50,067 - experiment_functions - INFO - Early stopping at epoch 1050. Best Recall: 0.0302
2026-05-20 00:41:50,155 - optuna.study.study - INFO - Trial 137 finished with value: 0.030193298888866734 and parameters: {'n_layers': 1, 'embedding_dim': 32, 'lr': 0.0007379174054322927, 'lambda_val': 1.0053558354735466e-06, 'batch_size': 706, 'optimizer': 'RMSprop'}. Best is trial 37 with value: 0.030943974763693986.
2026-05-20 00:42:05,093 - experiment_functions - INFO - Early stopping at epoch 1150. Best Recall: 0.0295
2026-05-20 00:42:05,171 - optuna.study.study - INFO - Trial 138 finished with value: 0.02949843241668602 and parameters: {'n_layers': 1, 'embedding_dim': 32, 'lr': 0.0007306384961840972, 'lambda_val': 1.257317904738047e-06, 'batch_size': 888, 'optimizer': 'RMSprop'}. Best is trial 37 with value: 0.030943974763693986.
2026-05-20 00:42:20,463 - optuna.study._optimize - INFO - Trial 139 pruned. 
2026-05-20 00:42:33,446 - optuna.study._optimize - INFO - Trial 140 pruned. 
2026-05-20 00:42:56,095 - experiment_functions - INFO - Early stopping at epoch 1800. Best Recall: 0.0303
2026-05-20 00:42:56,196 - optuna.study.study - INFO - Trial 141 finished with value: 0.030318229169053485 and parameters: {'n_layers': 1, 'embedding_dim': 32, 'lr': 0.0005661333022751098, 'lambda_val': 1.2181110481748228e-06, 'batch_size': 657, 'optimizer': 'RMSprop'}. Best is trial 37 with value: 0.030943974763693986.
2026-05-20 00:43:22,210 - experiment_functions - INFO - Early stopping at epoch 2050. Best Recall: 0.0304
2026-05-20 00:43:22,300 - optuna.study.study - INFO - Trial 142 finished with value: 0.030373926116588592 and parameters: {'n_layers': 1, 'embedding_dim': 32, 'lr': 0.0005617927843827106, 'lambda_val': 1.266086554448447e-06, 'batch_size': 710, 'optimizer': 'RMSprop'}. Best is trial 37 with value: 0.030943974763693986.
2026-05-20 00:43:39,068 - optuna.study._optimize - INFO - Trial 143 pruned. 
2026-05-20 00:43:55,960 - optuna.study._optimize - INFO - Trial 144 pruned. 
2026-05-20 00:44:09,376 - optuna.study._optimize - INFO - Trial 145 pruned. 
2026-05-20 00:44:30,613 - experiment_functions - INFO - Early stopping at epoch 1650. Best Recall: 0.0304
2026-05-20 00:44:30,712 - optuna.study.study - INFO - Trial 146 finished with value: 0.030430614777325168 and parameters: {'n_layers': 1, 'embedding_dim': 32, 'lr': 0.0005459675168175529, 'lambda_val': 2.1604365648413923e-06, 'batch_size': 661, 'optimizer': 'RMSprop'}. Best is trial 37 with value: 0.030943974763693986.
2026-05-20 00:44:44,787 - optuna.study._optimize - INFO - Trial 147 pruned. 
2026-05-20 00:44:58,944 - optuna.study._optimize - INFO - Trial 148 pruned. 
2026-05-20 00:45:12,057 - optuna.study._optimize - INFO - Trial 149 pruned. 
2026-05-20 00:45:28,853 - optuna.study._optimize - INFO - Trial 150 pruned. 
2026-05-20 00:45:35,887 - experiment_functions - INFO - Early stopping at epoch 500. Best Recall: 0.0059
2026-05-20 00:45:36,000 - optuna.study.study - INFO - Trial 151 finished with value: 0.005866749493674056 and parameters: {'n_layers': 1, 'embedding_dim': 32, 'lr': 0.0006360631102914779, 'lambda_val': 0.06272534373875902, 'batch_size': 628, 'optimizer': 'RMSprop'}. Best is trial 37 with value: 0.030943974763693986.
2026-05-20 00:45:52,868 - optuna.study._optimize - INFO - Trial 152 pruned. 
2026-05-20 00:46:19,735 - experiment_functions - INFO - Early stopping at epoch 2150. Best Recall: 0.0306
2026-05-20 00:46:19,824 - optuna.study.study - INFO - Trial 153 finished with value: 0.030553201152167257 and parameters: {'n_layers': 1, 'embedding_dim': 32, 'lr': 0.0005363686828654061, 'lambda_val': 1.942386811856766e-06, 'batch_size': 607, 'optimizer': 'RMSprop'}. Best is trial 37 with value: 0.030943974763693986.
2026-05-20 00:46:43,652 - experiment_functions - INFO - Early stopping at epoch 1850. Best Recall: 0.0303
2026-05-20 00:46:43,740 - optuna.study.study - INFO - Trial 154 finished with value: 0.030300115757342653 and parameters: {'n_layers': 1, 'embedding_dim': 32, 'lr': 0.0005091705633140037, 'lambda_val': 2.1640584909145645e-06, 'batch_size': 661, 'optimizer': 'RMSprop'}. Best is trial 37 with value: 0.030943974763693986.
2026-05-20 00:47:08,355 - optuna.study._optimize - INFO - Trial 155 pruned. 
2026-05-20 00:47:22,230 - optuna.study._optimize - INFO - Trial 156 pruned. 
2026-05-20 00:47:35,127 - optuna.study._optimize - INFO - Trial 157 pruned. 
2026-05-20 00:47:48,719 - optuna.study._optimize - INFO - Trial 158 pruned. 
2026-05-20 00:47:58,892 - experiment_functions - INFO - Early stopping at epoch 700. Best Recall: 0.0175
2026-05-20 00:47:59,000 - optuna.study.study - INFO - Trial 159 finished with value: 0.01745910331995457 and parameters: {'n_layers': 1, 'embedding_dim': 32, 'lr': 0.000680015184205766, 'lambda_val': 1.799759529105752e-06, 'batch_size': 3642, 'optimizer': 'RMSprop'}. Best is trial 37 with value: 0.030943974763693986.
2026-05-20 00:48:19,815 - experiment_functions - INFO - Early stopping at epoch 1650. Best Recall: 0.0305
2026-05-20 00:48:19,904 - optuna.study.study - INFO - Trial 160 finished with value: 0.03047540261157729 and parameters: {'n_layers': 1, 'embedding_dim': 32, 'lr': 0.0005649282085956294, 'lambda_val': 1.2249351416816957e-06, 'batch_size': 616, 'optimizer': 'RMSprop'}. Best is trial 37 with value: 0.030943974763693986.
2026-05-20 00:48:41,577 - experiment_functions - INFO - Early stopping at epoch 1650. Best Recall: 0.0305
2026-05-20 00:48:41,666 - optuna.study.study - INFO - Trial 161 finished with value: 0.030543663185739027 and parameters: {'n_layers': 1, 'embedding_dim': 32, 'lr': 0.0005670499960650089, 'lambda_val': 1.0006207963073826e-06, 'batch_size': 629, 'optimizer': 'RMSprop'}. Best is trial 37 with value: 0.030943974763693986.
2026-05-20 00:48:55,201 - optuna.study._optimize - INFO - Trial 162 pruned. 
2026-05-20 00:49:08,340 - optuna.study._optimize - INFO - Trial 163 pruned. 
2026-05-20 00:49:21,292 - optuna.study._optimize - INFO - Trial 164 pruned. 
2026-05-20 00:49:47,182 - experiment_functions - INFO - Early stopping at epoch 2100. Best Recall: 0.0305
2026-05-20 00:49:47,272 - optuna.study.study - INFO - Trial 165 finished with value: 0.030545900118156187 and parameters: {'n_layers': 1, 'embedding_dim': 32, 'lr': 0.00045041655635643014, 'lambda_val': 2.6414561767993356e-06, 'batch_size': 593, 'optimizer': 'RMSprop'}. Best is trial 37 with value: 0.030943974763693986.
2026-05-20 00:50:00,417 - optuna.study._optimize - INFO - Trial 166 pruned. 
2026-05-20 00:50:13,408 - optuna.study._optimize - INFO - Trial 167 pruned. 
2026-05-20 00:50:37,384 - experiment_functions - INFO - Early stopping at epoch 1850. Best Recall: 0.0307
2026-05-20 00:50:37,486 - optuna.study.study - INFO - Trial 168 finished with value: 0.03067518334759271 and parameters: {'n_layers': 1, 'embedding_dim': 32, 'lr': 0.0004947365191019901, 'lambda_val': 1.9543514347714713e-06, 'batch_size': 607, 'optimizer': 'RMSprop'}. Best is trial 37 with value: 0.030943974763693986.
2026-05-20 00:50:51,430 - optuna.study._optimize - INFO - Trial 169 pruned. 
2026-05-20 00:51:05,034 - optuna.study._optimize - INFO - Trial 170 pruned. 
2026-05-20 00:51:18,837 - optuna.study._optimize - INFO - Trial 171 pruned. 
2026-05-20 00:51:32,429 - optuna.study._optimize - INFO - Trial 172 pruned. 
2026-05-20 00:51:47,159 - optuna.study._optimize - INFO - Trial 173 pruned. 
2026-05-20 00:51:57,772 - experiment_functions - INFO - Early stopping at epoch 800. Best Recall: 0.0190
2026-05-20 00:51:57,861 - optuna.study.study - INFO - Trial 174 finished with value: 0.01903470631770969 and parameters: {'n_layers': 1, 'embedding_dim': 32, 'lr': 0.0004999050787586545, 'lambda_val': 1.00405755861149e-06, 'batch_size': 4030, 'optimizer': 'RMSprop'}. Best is trial 37 with value: 0.030943974763693986.
