2026-05-20 04:53:25,459 - optuna.study.study - INFO - Trial 153 finished with value: 0.047628020505505894 and parameters: {'n_layers': 1, 'embedding_dim': 32, 'lr': 0.0004553240231247559, 'lambda_val': 4.178321459996971e-06, 'batch_size': 827, 'optimizer': 'RMSprop'}. Best is trial 124 with value: 0.04800981997752097.
2026-05-20 04:53:49,879 - experiment_functions - INFO - Early stopping at epoch 1850. Best Recall: 0.0475
2026-05-20 04:53:49,972 - optuna.study.study - INFO - Trial 154 finished with value: 0.04748801164787671 and parameters: {'n_layers': 1, 'embedding_dim': 32, 'lr': 0.00046958348335535735, 'lambda_val': 6.1251787609637815e-06, 'batch_size': 794, 'optimizer': 'RMSprop'}. Best is trial 124 with value: 0.04800981997752097.
2026-05-20 04:54:20,601 - experiment_functions - INFO - Early stopping at epoch 2400. Best Recall: 0.0474
2026-05-20 04:54:20,750 - optuna.study.study - INFO - Trial 155 finished with value: 0.04738057611006549 and parameters: {'n_layers': 1, 'embedding_dim': 32, 'lr': 0.00039701692111311144, 'lambda_val': 7.574714774503031e-06, 'batch_size': 745, 'optimizer': 'RMSprop'}. Best is trial 124 with value: 0.04800981997752097.
2026-05-20 04:55:01,077 - experiment_functions - INFO - Early stopping at epoch 3200. Best Recall: 0.0475
2026-05-20 04:55:01,225 - optuna.study.study - INFO - Trial 156 finished with value: 0.04752870359001794 and parameters: {'n_layers': 1, 'embedding_dim': 32, 'lr': 0.0003239753803077282, 'lambda_val': 7.556837794022012e-06, 'batch_size': 752, 'optimizer': 'RMSprop'}. Best is trial 124 with value: 0.04800981997752097.
2026-05-20 04:55:14,890 - optuna.study._optimize - INFO - Trial 157 pruned. 
2026-05-20 04:55:49,536 - experiment_functions - INFO - Early stopping at epoch 2650. Best Recall: 0.0476
2026-05-20 04:55:49,626 - optuna.study.study - INFO - Trial 158 finished with value: 0.047592288983375884 and parameters: {'n_layers': 1, 'embedding_dim': 32, 'lr': 0.0004610787619919995, 'lambda_val': 1.2986393721156862e-05, 'batch_size': 750, 'optimizer': 'RMSprop'}. Best is trial 124 with value: 0.04800981997752097.
2026-05-20 04:56:15,181 - experiment_functions - INFO - Early stopping at epoch 1950. Best Recall: 0.0477
2026-05-20 04:56:15,284 - optuna.study.study - INFO - Trial 159 finished with value: 0.04768560270931675 and parameters: {'n_layers': 1, 'embedding_dim': 32, 'lr': 0.000487940878336738, 'lambda_val': 1.2101002800385706e-05, 'batch_size': 757, 'optimizer': 'RMSprop'}. Best is trial 124 with value: 0.04800981997752097.
2026-05-20 04:56:28,916 - optuna.study._optimize - INFO - Trial 160 pruned. 
2026-05-20 04:56:57,945 - experiment_functions - INFO - Early stopping at epoch 2300. Best Recall: 0.0476
2026-05-20 04:56:58,037 - optuna.study.study - INFO - Trial 161 finished with value: 0.04759208734931435 and parameters: {'n_layers': 1, 'embedding_dim': 32, 'lr': 0.0004760461354024464, 'lambda_val': 1.3100413593993236e-05, 'batch_size': 864, 'optimizer': 'RMSprop'}. Best is trial 124 with value: 0.04800981997752097.
2026-05-20 04:57:23,862 - experiment_functions - INFO - Early stopping at epoch 2000. Best Recall: 0.0476
2026-05-20 04:57:23,963 - optuna.study.study - INFO - Trial 162 finished with value: 0.04760945152090021 and parameters: {'n_layers': 1, 'embedding_dim': 32, 'lr': 0.000439636646128545, 'lambda_val': 8.979704061353724e-06, 'batch_size': 757, 'optimizer': 'RMSprop'}. Best is trial 124 with value: 0.04800981997752097.
2026-05-20 04:58:03,387 - experiment_functions - INFO - Early stopping at epoch 3150. Best Recall: 0.0477
2026-05-20 04:58:03,480 - optuna.study.study - INFO - Trial 163 finished with value: 0.04774816662433266 and parameters: {'n_layers': 1, 'embedding_dim': 32, 'lr': 0.0004452474952187977, 'lambda_val': 1.3371918460495705e-05, 'batch_size': 733, 'optimizer': 'RMSprop'}. Best is trial 124 with value: 0.04800981997752097.
2026-05-20 04:58:36,437 - experiment_functions - INFO - Early stopping at epoch 2550. Best Recall: 0.0475
2026-05-20 04:58:36,539 - optuna.study.study - INFO - Trial 164 finished with value: 0.04745896314673144 and parameters: {'n_layers': 1, 'embedding_dim': 32, 'lr': 0.0004948545955043673, 'lambda_val': 2.248559709178571e-05, 'batch_size': 716, 'optimizer': 'RMSprop'}. Best is trial 124 with value: 0.04800981997752097.
2026-05-20 04:59:06,828 - experiment_functions - INFO - Early stopping at epoch 2100. Best Recall: 0.0473
2026-05-20 04:59:07,594 - optuna.study.study - INFO - Trial 165 finished with value: 0.04732758439655817 and parameters: {'n_layers': 1, 'embedding_dim': 32, 'lr': 0.00047471805523603537, 'lambda_val': 1.0787288593428282e-05, 'batch_size': 713, 'optimizer': 'RMSprop'}. Best is trial 124 with value: 0.04800981997752097.
2026-05-20 04:59:26,042 - optuna.study._optimize - INFO - Trial 166 pruned. 
2026-05-20 04:59:39,645 - optuna.study._optimize - INFO - Trial 167 pruned. 
2026-05-20 05:00:14,536 - experiment_functions - INFO - Early stopping at epoch 1950. Best Recall: 0.0473
2026-05-20 05:00:14,618 - optuna.study.study - INFO - Trial 168 finished with value: 0.047288719493471035 and parameters: {'n_layers': 1, 'embedding_dim': 32, 'lr': 0.0004934075873479799, 'lambda_val': 1.4460269164915827e-05, 'batch_size': 751, 'optimizer': 'RMSprop'}. Best is trial 124 with value: 0.04800981997752097.
2026-05-20 05:00:30,157 - optuna.study._optimize - INFO - Trial 169 pruned. 
2026-05-20 05:00:41,512 - experiment_functions - INFO - Early stopping at epoch 850. Best Recall: 0.0043
2026-05-20 05:00:41,605 - optuna.study.study - INFO - Trial 170 finished with value: 0.004327035672944168 and parameters: {'n_layers': 1, 'embedding_dim': 32, 'lr': 2.0263440381414073e-05, 'lambda_val': 9.867295792151239e-06, 'batch_size': 755, 'optimizer': 'RMSprop'}. Best is trial 124 with value: 0.04800981997752097.
2026-05-20 05:01:03,886 - optuna.study._optimize - INFO - Trial 171 pruned. 
2026-05-20 05:01:17,582 - optuna.study._optimize - INFO - Trial 172 pruned. 
2026-05-20 05:02:06,187 - experiment_functions - INFO - Early stopping at epoch 3850. Best Recall: 0.0477
2026-05-20 05:02:06,246 - optuna.study.study - INFO - Trial 173 finished with value: 0.04766324765503695 and parameters: {'n_layers': 1, 'embedding_dim': 32, 'lr': 0.0003382143231520299, 'lambda_val': 7.504628825746287e-06, 'batch_size': 672, 'optimizer': 'RMSprop'}. Best is trial 124 with value: 0.04800981997752097.
2026-05-20 05:02:19,308 - optuna.study._optimize - INFO - Trial 174 pruned. 
2026-05-20 05:02:33,500 - optuna.study._optimize - INFO - Trial 175 pruned. 
2026-05-20 05:03:22,193 - experiment_functions - INFO - Early stopping at epoch 3750. Best Recall: 0.0480
2026-05-20 05:03:22,330 - optuna.study.study - INFO - Trial 176 finished with value: 0.048013714249716434 and parameters: {'n_layers': 1, 'embedding_dim': 32, 'lr': 0.0003405141148751032, 'lambda_val': 1.0404745083695775e-05, 'batch_size': 793, 'optimizer': 'RMSprop'}. Best is trial 176 with value: 0.048013714249716434.
2026-05-20 05:03:45,298 - optuna.study._optimize - INFO - Trial 177 pruned. 
2026-05-20 05:03:59,070 - optuna.study._optimize - INFO - Trial 178 pruned. 
2026-05-20 05:04:12,682 - optuna.study._optimize - INFO - Trial 179 pruned. 
2026-05-20 05:04:25,866 - optuna.study._optimize - INFO - Trial 180 pruned. 
2026-05-20 05:04:52,078 - experiment_functions - INFO - Early stopping at epoch 2050. Best Recall: 0.0475
2026-05-20 05:04:52,160 - optuna.study.study - INFO - Trial 181 finished with value: 0.04751640279410582 and parameters: {'n_layers': 1, 'embedding_dim': 32, 'lr': 0.00047428147569900586, 'lambda_val': 1.0244944767973688e-05, 'batch_size': 682, 'optimizer': 'RMSprop'}. Best is trial 176 with value: 0.048013714249716434.
2026-05-20 05:05:04,989 - optuna.study._optimize - INFO - Trial 182 pruned. 
2026-05-20 05:05:44,197 - experiment_functions - INFO - Early stopping at epoch 3100. Best Recall: 0.0478
2026-05-20 05:05:44,333 - optuna.study.study - INFO - Trial 183 finished with value: 0.04776389203337335 and parameters: {'n_layers': 1, 'embedding_dim': 32, 'lr': 0.0004163037072099871, 'lambda_val': 7.1768198872431335e-06, 'batch_size': 766, 'optimizer': 'RMSprop'}. Best is trial 176 with value: 0.048013714249716434.
2026-05-20 05:05:57,594 - optuna.study._optimize - INFO - Trial 184 pruned. 
2026-05-20 05:06:31,913 - experiment_functions - INFO - Early stopping at epoch 2750. Best Recall: 0.0480
2026-05-20 05:06:32,006 - optuna.study.study - INFO - Trial 185 finished with value: 0.0480342785012347 and parameters: {'n_layers': 1, 'embedding_dim': 32, 'lr': 0.0005173071377248391, 'lambda_val': 3.825380645081265e-05, 'batch_size': 670, 'optimizer': 'RMSprop'}. Best is trial 185 with value: 0.0480342785012347.
2026-05-20 05:06:54,526 - experiment_functions - INFO - Early stopping at epoch 1650. Best Recall: 0.0473
2026-05-20 05:06:54,651 - optuna.study.study - INFO - Trial 186 finished with value: 0.04734567223018359 and parameters: {'n_layers': 1, 'embedding_dim': 32, 'lr': 0.0006701055271325742, 'lambda_val': 9.992511623450942e-06, 'batch_size': 660, 'optimizer': 'RMSprop'}. Best is trial 185 with value: 0.0480342785012347.
2026-05-20 05:07:01,777 - experiment_functions - INFO - Early stopping at epoch 500. Best Recall: 0.0052
2026-05-20 05:07:02,122 - optuna.study.study - INFO - Trial 187 finished with value: 0.005165863214705556 and parameters: {'n_layers': 1, 'embedding_dim': 32, 'lr': 0.00035150169166348934, 'lambda_val': 4.417736535065198e-05, 'batch_size': 560, 'optimizer': 'SGD'}. Best is trial 185 with value: 0.0480342785012347.
2026-05-20 05:07:19,224 - optuna.study._optimize - INFO - Trial 188 pruned. 
2026-05-20 05:07:37,653 - optuna.study._optimize - INFO - Trial 189 pruned. 
2026-05-20 05:07:56,216 - optuna.study._optimize - INFO - Trial 190 pruned. 
2026-05-20 05:08:32,066 - optuna.study._optimize - INFO - Trial 191 pruned. 
2026-05-20 05:09:04,917 - experiment_functions - INFO - Early stopping at epoch 2550. Best Recall: 0.0478
2026-05-20 05:09:05,008 - optuna.study.study - INFO - Trial 192 finished with value: 0.04776663995433036 and parameters: {'n_layers': 1, 'embedding_dim': 32, 'lr': 0.00046639660329481645, 'lambda_val': 1.3430144433424061e-05, 'batch_size': 740, 'optimizer': 'RMSprop'}. Best is trial 185 with value: 0.0480342785012347.
2026-05-20 05:09:18,646 - optuna.study._optimize - INFO - Trial 193 pruned. 
2026-05-20 05:09:33,047 - optuna.study._optimize - INFO - Trial 194 pruned. 
2026-05-20 05:09:59,347 - experiment_functions - INFO - Early stopping at epoch 1500. Best Recall: 0.0473
2026-05-20 05:10:00,150 - optuna.study.study - INFO - Trial 195 finished with value: 0.04734716591986576 and parameters: {'n_layers': 1, 'embedding_dim': 32, 'lr': 0.0006152285455930638, 'lambda_val': 0.0001609368442000444, 'batch_size': 628, 'optimizer': 'RMSprop'}. Best is trial 185 with value: 0.0480342785012347.
2026-05-20 05:10:14,092 - optuna.study._optimize - INFO - Trial 196 pruned. 
2026-05-20 05:11:10,003 - experiment_functions - INFO - Early stopping at epoch 3600. Best Recall: 0.0479
2026-05-20 05:11:10,095 - optuna.study.study - INFO - Trial 197 finished with value: 0.04792390364918514 and parameters: {'n_layers': 1, 'embedding_dim': 32, 'lr': 0.00039260281116060703, 'lambda_val': 4.395476296115512e-06, 'batch_size': 559, 'optimizer': 'RMSprop'}. Best is trial 185 with value: 0.0480342785012347.
2026-05-20 05:11:54,357 - experiment_functions - INFO - Early stopping at epoch 3450. Best Recall: 0.0486
2026-05-20 05:11:54,460 - optuna.study.study - INFO - Trial 198 finished with value: 0.04862970054600969 and parameters: {'n_layers': 1, 'embedding_dim': 32, 'lr': 0.0003747543018842537, 'lambda_val': 4.326423557792398e-06, 'batch_size': 591, 'optimizer': 'RMSprop'}. Best is trial 198 with value: 0.04862970054600969.
2026-05-20 05:12:07,683 - optuna.study._optimize - INFO - Trial 199 pruned. 
2026-05-20 05:12:28,106 - optuna.study._optimize - INFO - Trial 200 pruned. 
2026-05-20 05:12:41,416 - optuna.study._optimize - INFO - Trial 201 pruned. 
2026-05-20 05:13:01,808 - optuna.study._optimize - INFO - Trial 202 pruned. 
2026-05-20 05:13:22,227 - optuna.study._optimize - INFO - Trial 203 pruned. 
2026-05-20 05:13:35,648 - optuna.study._optimize - INFO - Trial 204 pruned. 
2026-05-20 05:13:49,244 - optuna.study._optimize - INFO - Trial 205 pruned. 
2026-05-20 05:14:06,482 - optuna.study._optimize - INFO - Trial 206 pruned. 
2026-05-20 05:14:33,192 - experiment_functions - INFO - Early stopping at epoch 2050. Best Recall: 0.0475
2026-05-20 05:14:33,282 - optuna.study.study - INFO - Trial 207 finished with value: 0.047547653288262416 and parameters: {'n_layers': 1, 'embedding_dim': 32, 'lr': 0.0005243321076813678, 'lambda_val': 4.1498016462826675e-06, 'batch_size': 581, 'optimizer': 'RMSprop'}. Best is trial 198 with value: 0.04862970054600969.
2026-05-20 05:14:53,237 - optuna.study._optimize - INFO - Trial 208 pruned. 
2026-05-20 05:15:13,663 - optuna.study._optimize - INFO - Trial 209 pruned. 
2026-05-20 05:15:32,581 - experiment_functions - INFO - Early stopping at epoch 1400. Best Recall: 0.0471
2026-05-20 05:15:32,715 - optuna.study.study - INFO - Trial 210 finished with value: 0.047101668593587255 and parameters: {'n_layers': 1, 'embedding_dim': 32, 'lr': 0.0006248036503236218, 'lambda_val': 1.7469534645201492e-05, 'batch_size': 671, 'optimizer': 'RMSprop'}. Best is trial 198 with value: 0.04862970054600969.
2026-05-20 05:15:46,981 - optuna.study._optimize - INFO - Trial 211 pruned. 
2026-05-20 05:16:01,049 - optuna.study._optimize - INFO - Trial 212 pruned. 
2026-05-20 05:16:14,844 - optuna.study._optimize - INFO - Trial 213 pruned. 
2026-05-20 05:17:02,480 - experiment_functions - INFO - Early stopping at epoch 3750. Best Recall: 0.0483
2026-05-20 05:17:02,559 - optuna.study.study - INFO - Trial 214 finished with value: 0.0483398624007847 and parameters: {'n_layers': 1, 'embedding_dim': 32, 'lr': 0.0004530294801009794, 'lambda_val': 8.506051512093698e-06, 'batch_size': 595, 'optimizer': 'RMSprop'}. Best is trial 198 with value: 0.04862970054600969.
2026-05-20 05:17:17,285 - optuna.study._optimize - INFO - Trial 215 pruned. 
2026-05-20 05:17:24,203 - experiment_functions - INFO - Early stopping at epoch 500. Best Recall: 0.0048
2026-05-20 05:17:24,304 - optuna.study.study - INFO - Trial 216 finished with value: 0.0048380917459061494 and parameters: {'n_layers': 1, 'embedding_dim': 32, 'lr': 0.0005397269686230935, 'lambda_val': 1.3354060625888124e-05, 'batch_size': 516, 'optimizer': 'SGD'}. Best is trial 198 with value: 0.04862970054600969.
2026-05-20 05:18:06,159 - experiment_functions - INFO - Early stopping at epoch 3250. Best Recall: 0.0481
2026-05-20 05:18:06,260 - optuna.study.study - INFO - Trial 217 finished with value: 0.04814324581891911 and parameters: {'n_layers': 1, 'embedding_dim': 32, 'lr': 0.0004347201364340478, 'lambda_val': 7.712121306376402e-06, 'batch_size': 592, 'optimizer': 'RMSprop'}. Best is trial 198 with value: 0.04862970054600969.
2026-05-20 05:18:49,948 - experiment_functions - INFO - Early stopping at epoch 2750. Best Recall: 0.0477
2026-05-20 05:18:50,052 - optuna.study.study - INFO - Trial 218 finished with value: 0.04765129442172069 and parameters: {'n_layers': 1, 'embedding_dim': 32, 'lr': 0.0004050743030574513, 'lambda_val': 6.976758179910984e-06, 'batch_size': 616, 'optimizer': 'RMSprop'}. Best is trial 198 with value: 0.04862970054600969.
2026-05-20 05:19:03,733 - optuna.study._optimize - INFO - Trial 219 pruned. 
2026-05-20 05:19:26,430 - experiment_functions - INFO - Early stopping at epoch 1700. Best Recall: 0.0480
2026-05-20 05:19:26,725 - optuna.study.study - INFO - Trial 220 finished with value: 0.047997829721957985 and parameters: {'n_layers': 1, 'embedding_dim': 32, 'lr': 0.0006594309382853017, 'lambda_val': 6.8127331528083566e-06, 'batch_size': 565, 'optimizer': 'RMSprop'}. Best is trial 198 with value: 0.04862970054600969.
2026-05-20 05:19:40,341 - optuna.study._optimize - INFO - Trial 221 pruned. 
2026-05-20 05:20:02,471 - experiment_functions - INFO - Early stopping at epoch 1700. Best Recall: 0.0477
2026-05-20 05:20:02,572 - optuna.study.study - INFO - Trial 222 finished with value: 0.04771273486571983 and parameters: {'n_layers': 1, 'embedding_dim': 32, 'lr': 0.0005575326069840402, 'lambda_val': 8.96520113579566e-06, 'batch_size': 572, 'optimizer': 'RMSprop'}. Best is trial 198 with value: 0.04862970054600969.
2026-05-20 05:20:21,276 - experiment_functions - INFO - Early stopping at epoch 1400. Best Recall: 0.0474
2026-05-20 05:20:21,355 - optuna.study.study - INFO - Trial 223 finished with value: 0.047446128927746384 and parameters: {'n_layers': 1, 'embedding_dim': 32, 'lr': 0.0007819177868361193, 'lambda_val': 5.246392870732125e-06, 'batch_size': 581, 'optimizer': 'RMSprop'}. Best is trial 198 with value: 0.04862970054600969.
2026-05-20 05:20:46,141 - experiment_functions - INFO - Early stopping at epoch 1950. Best Recall: 0.0479
2026-05-20 05:20:46,242 - optuna.study.study - INFO - Trial 224 finished with value: 0.047877507619888245 and parameters: {'n_layers': 1, 'embedding_dim': 32, 'lr': 0.0005807092572399646, 'lambda_val': 9.947550159862516e-06, 'batch_size': 512, 'optimizer': 'RMSprop'}. Best is trial 198 with value: 0.04862970054600969.
2026-05-20 05:21:12,601 - experiment_functions - INFO - Early stopping at epoch 2000. Best Recall: 0.0484
2026-05-20 05:21:12,691 - optuna.study.study - INFO - Trial 225 finished with value: 0.048363263936697744 and parameters: {'n_layers': 1, 'embedding_dim': 32, 'lr': 0.0006368353491889325, 'lambda_val': 8.9944112758466e-06, 'batch_size': 547, 'optimizer': 'RMSprop'}. Best is trial 198 with value: 0.04862970054600969.
2026-05-20 05:21:25,018 - experiment_functions - INFO - Early stopping at epoch 850. Best Recall: 0.0448
2026-05-20 05:21:25,290 - optuna.study.study - INFO - Trial 226 finished with value: 0.04476633127104736 and parameters: {'n_layers': 1, 'embedding_dim': 256, 'lr': 0.0007154750478514119, 'lambda_val': 1.179752483149455e-05, 'batch_size': 543, 'optimizer': 'RMSprop'}. Best is trial 198 with value: 0.04862970054600969.
2026-05-20 05:21:54,772 - experiment_functions - INFO - Early stopping at epoch 2250. Best Recall: 0.0477
2026-05-20 05:21:54,873 - optuna.study.study - INFO - Trial 227 finished with value: 0.047705756480322395 and parameters: {'n_layers': 1, 'embedding_dim': 32, 'lr': 0.000609235507258779, 'lambda_val': 8.631297558949603e-06, 'batch_size': 523, 'optimizer': 'RMSprop'}. Best is trial 198 with value: 0.04862970054600969.
2026-05-20 05:22:06,171 - experiment_functions - INFO - Early stopping at epoch 800. Best Recall: 0.0446
2026-05-20 05:22:06,262 - optuna.study.study - INFO - Trial 228 finished with value: 0.044596836308464824 and parameters: {'n_layers': 1, 'embedding_dim': 128, 'lr': 0.000869373923904589, 'lambda_val': 8.751695404043775e-06, 'batch_size': 556, 'optimizer': 'RMSprop'}. Best is trial 198 with value: 0.04862970054600969.
2026-05-20 05:22:37,661 - experiment_functions - INFO - Early stopping at epoch 1650. Best Recall: 0.0476
2026-05-20 05:22:37,740 - optuna.study.study - INFO - Trial 229 finished with value: 0.04758816561453262 and parameters: {'n_layers': 1, 'embedding_dim': 32, 'lr': 0.0006019619824101485, 'lambda_val': 9.398215845573987e-06, 'batch_size': 526, 'optimizer': 'RMSprop'}. Best is trial 198 with value: 0.04862970054600969.
2026-05-20 05:22:52,508 - optuna.study._optimize - INFO - Trial 230 pruned. 
2026-05-20 05:23:38,469 - experiment_functions - INFO - Early stopping at epoch 2800. Best Recall: 0.0476
2026-05-20 05:23:38,559 - optuna.study.study - INFO - Trial 231 finished with value: 0.047648264450490044 and parameters: {'n_layers': 1, 'embedding_dim': 32, 'lr': 0.00041602945606892253, 'lambda_val': 1.3923606529699109e-05, 'batch_size': 645, 'optimizer': 'RMSprop'}. Best is trial 198 with value: 0.04862970054600969.
2026-05-20 05:24:20,584 - experiment_functions - INFO - Early stopping at epoch 3300. Best Recall: 0.0482
2026-05-20 05:24:20,673 - optuna.study.study - INFO - Trial 232 finished with value: 0.04823446347895111 and parameters: {'n_layers': 1, 'embedding_dim': 32, 'lr': 0.0004103034375674864, 'lambda_val': 1.0401337383881872e-05, 'batch_size': 518, 'optimizer': 'RMSprop'}. Best is trial 198 with value: 0.04862970054600969.
2026-05-20 05:24:27,730 - experiment_functions - INFO - Early stopping at epoch 500. Best Recall: 0.0046
2026-05-20 05:24:27,832 - optuna.study.study - INFO - Trial 233 finished with value: 0.004645902817748876 and parameters: {'n_layers': 1, 'embedding_dim': 32, 'lr': 0.05367605398943116, 'lambda_val': 6.796217540369549e-06, 'batch_size': 517, 'optimizer': 'RMSprop'}. Best is trial 198 with value: 0.04862970054600969.
2026-05-20 05:24:41,524 - optuna.study._optimize - INFO - Trial 234 pruned. 
2026-05-20 05:25:06,677 - experiment_functions - INFO - Early stopping at epoch 1950. Best Recall: 0.0476
2026-05-20 05:25:06,768 - optuna.study.study - INFO - Trial 235 finished with value: 0.04762400559314808 and parameters: {'n_layers': 1, 'embedding_dim': 32, 'lr': 0.0006236326284398395, 'lambda_val': 1.0907078110940712e-05, 'batch_size': 513, 'optimizer': 'RMSprop'}. Best is trial 198 with value: 0.04862970054600969.
2026-05-20 05:25:25,030 - optuna.study._optimize - INFO - Trial 236 pruned. 
2026-05-20 05:25:45,160 - experiment_functions - INFO - Early stopping at epoch 1550. Best Recall: 0.0475
2026-05-20 05:25:45,295 - optuna.study.study - INFO - Trial 237 finished with value: 0.047533356911077136 and parameters: {'n_layers': 1, 'embedding_dim': 32, 'lr': 0.0006262423429664515, 'lambda_val': 1.042694164206423e-05, 'batch_size': 595, 'optimizer': 'RMSprop'}. Best is trial 198 with value: 0.04862970054600969.
2026-05-20 05:26:14,001 - experiment_functions - INFO - Early stopping at epoch 2250. Best Recall: 0.0481
