2026-05-20 01:24:11,591 - optuna.study.study - INFO - Trial 1 finished with value: 0.024748929051458906 and parameters: {'n_layers': 1, 'embedding_dim': 64, 'lr': 0.014825874765314606, 'lambda_val': 0.03499559849252326, 'batch_size': 2993, 'optimizer': 'Adam'}. Best is trial 1 with value: 0.024748929051458906.
2026-05-20 01:24:20,883 - experiment_functions - INFO - Early stopping at epoch 500. Best Recall: 0.0054
2026-05-20 01:24:21,647 - optuna.study.study - INFO - Trial 2 finished with value: 0.00539298273752845 and parameters: {'n_layers': 1, 'embedding_dim': 256, 'lr': 2.595926118114184e-05, 'lambda_val': 0.031744688864033234, 'batch_size': 1177, 'optimizer': 'RMSprop'}. Best is trial 1 with value: 0.024748929051458906.
2026-05-20 01:25:26,219 - optuna.study.study - INFO - Trial 3 finished with value: 0.007265518220760418 and parameters: {'n_layers': 3, 'embedding_dim': 96, 'lr': 3.311015952345367e-05, 'lambda_val': 1.296506172501824e-05, 'batch_size': 1859, 'optimizer': 'RMSprop'}. Best is trial 1 with value: 0.024748929051458906.
2026-05-20 01:25:45,726 - experiment_functions - INFO - Early stopping at epoch 1000. Best Recall: 0.0400
2026-05-20 01:25:45,809 - optuna.study.study - INFO - Trial 4 finished with value: 0.04001955580076026 and parameters: {'n_layers': 4, 'embedding_dim': 256, 'lr': 0.00600583813403925, 'lambda_val': 0.00048438334397459356, 'batch_size': 1939, 'optimizer': 'RMSprop'}. Best is trial 4 with value: 0.04001955580076026.
2026-05-20 01:25:53,040 - experiment_functions - INFO - Early stopping at epoch 500. Best Recall: 0.0058
2026-05-20 01:25:53,140 - optuna.study.study - INFO - Trial 5 finished with value: 0.005824795749931276 and parameters: {'n_layers': 1, 'embedding_dim': 64, 'lr': 4.79933352211134e-05, 'lambda_val': 0.0015062651945447034, 'batch_size': 3993, 'optimizer': 'Adam'}. Best is trial 4 with value: 0.04001955580076026.
2026-05-20 01:26:01,002 - experiment_functions - INFO - Early stopping at epoch 500. Best Recall: 0.0053
2026-05-20 01:26:01,139 - optuna.study.study - INFO - Trial 6 finished with value: 0.0052839304744327405 and parameters: {'n_layers': 3, 'embedding_dim': 96, 'lr': 0.0009514252892078593, 'lambda_val': 0.0995222553137116, 'batch_size': 1221, 'optimizer': 'SGD'}. Best is trial 4 with value: 0.04001955580076026.
2026-05-20 01:26:31,858 - experiment_functions - INFO - Early stopping at epoch 2050. Best Recall: 0.0458
2026-05-20 01:26:31,966 - optuna.study.study - INFO - Trial 7 finished with value: 0.04579876345690196 and parameters: {'n_layers': 2, 'embedding_dim': 128, 'lr': 0.00016661035125341254, 'lambda_val': 1.18496882250038e-05, 'batch_size': 4042, 'optimizer': 'Adam'}. Best is trial 7 with value: 0.04579876345690196.
2026-05-20 01:26:53,972 - optuna.study._optimize - INFO - Trial 8 pruned. 
2026-05-20 01:27:05,618 - experiment_functions - INFO - Early stopping at epoch 700. Best Recall: 0.0054
2026-05-20 01:27:05,719 - optuna.study.study - INFO - Trial 9 finished with value: 0.005448646660421909 and parameters: {'n_layers': 1, 'embedding_dim': 96, 'lr': 2.857912857733122e-05, 'lambda_val': 2.614524840331088e-06, 'batch_size': 2689, 'optimizer': 'RMSprop'}. Best is trial 7 with value: 0.04579876345690196.
2026-05-20 01:27:23,156 - experiment_functions - INFO - Early stopping at epoch 1250. Best Recall: 0.0382
2026-05-20 01:27:23,303 - optuna.study.study - INFO - Trial 10 finished with value: 0.038208160332482866 and parameters: {'n_layers': 2, 'embedding_dim': 32, 'lr': 0.00032471896057613056, 'lambda_val': 3.542474234682854e-05, 'batch_size': 4024, 'optimizer': 'Adam'}. Best is trial 7 with value: 0.04579876345690196.
2026-05-20 01:27:41,227 - optuna.study._optimize - INFO - Trial 11 pruned. 
2026-05-20 01:27:51,316 - experiment_functions - INFO - Early stopping at epoch 550. Best Recall: 0.0591
2026-05-20 01:27:51,412 - optuna.study.study - INFO - Trial 12 finished with value: 0.05906928444475848 and parameters: {'n_layers': 2, 'embedding_dim': 256, 'lr': 0.003487472861092147, 'lambda_val': 1.4231622178908051e-06, 'batch_size': 2471, 'optimizer': 'Adam'}. Best is trial 12 with value: 0.05906928444475848.
2026-05-20 01:28:01,046 - experiment_functions - INFO - Early stopping at epoch 600. Best Recall: 0.0543
2026-05-20 01:28:01,204 - optuna.study.study - INFO - Trial 13 finished with value: 0.05434887027305742 and parameters: {'n_layers': 2, 'embedding_dim': 128, 'lr': 0.0016911694050897297, 'lambda_val': 1.0018002919043673e-06, 'batch_size': 3511, 'optimizer': 'Adam'}. Best is trial 12 with value: 0.05906928444475848.
2026-05-20 01:28:11,292 - experiment_functions - INFO - Early stopping at epoch 650. Best Recall: 0.0479
2026-05-20 01:28:11,383 - optuna.study.study - INFO - Trial 14 finished with value: 0.047926884989763836 and parameters: {'n_layers': 2, 'embedding_dim': 32, 'lr': 0.0017754253083734537, 'lambda_val': 1.6608534099294873e-06, 'batch_size': 3358, 'optimizer': 'Adam'}. Best is trial 12 with value: 0.05906928444475848.
2026-05-20 01:28:23,412 - experiment_functions - INFO - Early stopping at epoch 600. Best Recall: 0.0407
2026-05-20 01:28:23,525 - optuna.study.study - INFO - Trial 15 finished with value: 0.040695252741039654 and parameters: {'n_layers': 3, 'embedding_dim': 256, 'lr': 0.0013989434938288157, 'lambda_val': 1.1511785454950396e-06, 'batch_size': 2459, 'optimizer': 'Adam'}. Best is trial 12 with value: 0.05906928444475848.
2026-05-20 01:28:37,977 - experiment_functions - INFO - Early stopping at epoch 950. Best Recall: 0.0056
2026-05-20 01:28:38,113 - optuna.study.study - INFO - Trial 16 finished with value: 0.005564267635200102 and parameters: {'n_layers': 2, 'embedding_dim': 128, 'lr': 0.028482920730242382, 'lambda_val': 7.305251843272476e-06, 'batch_size': 3387, 'optimizer': 'SGD'}. Best is trial 12 with value: 0.05906928444475848.
2026-05-20 01:29:01,045 - experiment_functions - INFO - Early stopping at epoch 1500. Best Recall: 0.0576
2026-05-20 01:29:01,181 - optuna.study.study - INFO - Trial 17 finished with value: 0.057573136065441566 and parameters: {'n_layers': 2, 'embedding_dim': 128, 'lr': 0.004628410935646559, 'lambda_val': 6.229381073131117e-05, 'batch_size': 2968, 'optimizer': 'Adam'}. Best is trial 12 with value: 0.05906928444475848.
2026-05-20 01:29:44,069 - experiment_functions - INFO - Early stopping at epoch 2400. Best Recall: 0.0464
2026-05-20 01:29:44,206 - optuna.study.study - INFO - Trial 18 finished with value: 0.046406850672583114 and parameters: {'n_layers': 3, 'embedding_dim': 256, 'lr': 0.006218129978824795, 'lambda_val': 9.100349640961937e-05, 'batch_size': 2802, 'optimizer': 'Adam'}. Best is trial 12 with value: 0.05906928444475848.
2026-05-20 01:30:02,349 - optuna.study._optimize - INFO - Trial 19 pruned. 
2026-05-20 01:30:10,269 - experiment_functions - INFO - Early stopping at epoch 500. Best Recall: 0.0054
2026-05-20 01:30:10,372 - optuna.study.study - INFO - Trial 20 finished with value: 0.005357795384413628 and parameters: {'n_layers': 3, 'embedding_dim': 64, 'lr': 0.0006864664765570722, 'lambda_val': 0.0030172850669851867, 'batch_size': 1481, 'optimizer': 'SGD'}. Best is trial 12 with value: 0.05906928444475848.
2026-05-20 01:30:19,315 - experiment_functions - INFO - Early stopping at epoch 550. Best Recall: 0.0527
2026-05-20 01:30:19,452 - optuna.study.study - INFO - Trial 21 finished with value: 0.0527162007863504 and parameters: {'n_layers': 2, 'embedding_dim': 128, 'lr': 0.002598156255558451, 'lambda_val': 4.941806819598059e-06, 'batch_size': 3053, 'optimizer': 'Adam'}. Best is trial 12 with value: 0.05906928444475848.
2026-05-20 01:30:48,923 - experiment_functions - INFO - Early stopping at epoch 2000. Best Recall: 0.0605
2026-05-20 01:30:49,017 - optuna.study.study - INFO - Trial 22 finished with value: 0.0604764395447979 and parameters: {'n_layers': 2, 'embedding_dim': 128, 'lr': 0.0032211991362016052, 'lambda_val': 1.0874674477387058e-06, 'batch_size': 3604, 'optimizer': 'Adam'}. Best is trial 22 with value: 0.0604764395447979.
2026-05-20 01:30:57,769 - experiment_functions - INFO - Early stopping at epoch 550. Best Recall: 0.0548
2026-05-20 01:30:57,915 - optuna.study.study - INFO - Trial 23 finished with value: 0.05477253198386249 and parameters: {'n_layers': 2, 'embedding_dim': 128, 'lr': 0.0036252994654982665, 'lambda_val': 2.105100461878972e-05, 'batch_size': 3743, 'optimizer': 'Adam'}. Best is trial 22 with value: 0.0604764395447979.
2026-05-20 01:31:06,751 - experiment_functions - INFO - Early stopping at epoch 550. Best Recall: 0.0263
2026-05-20 01:31:06,898 - optuna.study.study - INFO - Trial 24 finished with value: 0.026264950959320632 and parameters: {'n_layers': 2, 'embedding_dim': 128, 'lr': 0.07101173595674713, 'lambda_val': 3.620505247448423e-06, 'batch_size': 2444, 'optimizer': 'Adam'}. Best is trial 22 with value: 0.0604764395447979.
2026-05-20 01:31:25,519 - optuna.study._optimize - INFO - Trial 25 pruned. 
2026-05-20 01:31:38,227 - experiment_functions - INFO - Early stopping at epoch 800. Best Recall: 0.0492
2026-05-20 01:31:38,319 - optuna.study.study - INFO - Trial 26 finished with value: 0.049237498832289416 and parameters: {'n_layers': 2, 'embedding_dim': 128, 'lr': 0.0005661397912143691, 'lambda_val': 4.154334238236916e-06, 'batch_size': 2675, 'optimizer': 'Adam'}. Best is trial 22 with value: 0.0604764395447979.
2026-05-20 01:31:47,508 - experiment_functions - INFO - Early stopping at epoch 600. Best Recall: 0.0670
2026-05-20 01:31:47,591 - optuna.study.study - INFO - Trial 27 finished with value: 0.06703932618536035 and parameters: {'n_layers': 1, 'embedding_dim': 128, 'lr': 0.003992445233468801, 'lambda_val': 0.0010262522117779655, 'batch_size': 3609, 'optimizer': 'Adam'}. Best is trial 27 with value: 0.06703932618536035.
2026-05-20 01:32:44,697 - optuna.study.study - INFO - Trial 28 finished with value: 0.061376117167172804 and parameters: {'n_layers': 1, 'embedding_dim': 256, 'lr': 0.030980501254982175, 'lambda_val': 0.000824742560653354, 'batch_size': 3736, 'optimizer': 'Adam'}. Best is trial 27 with value: 0.06703932618536035.
2026-05-20 01:32:52,543 - experiment_functions - INFO - Early stopping at epoch 500. Best Recall: 0.0054
2026-05-20 01:32:52,633 - optuna.study.study - INFO - Trial 29 finished with value: 0.005416743695765219 and parameters: {'n_layers': 1, 'embedding_dim': 256, 'lr': 0.040011248383786835, 'lambda_val': 0.0005945719569624234, 'batch_size': 3635, 'optimizer': 'SGD'}. Best is trial 27 with value: 0.06703932618536035.
2026-05-20 01:33:00,319 - experiment_functions - INFO - Early stopping at epoch 500. Best Recall: 0.0052
2026-05-20 01:33:00,420 - optuna.study.study - INFO - Trial 30 finished with value: 0.005227088429935584 and parameters: {'n_layers': 1, 'embedding_dim': 96, 'lr': 0.09317693078708719, 'lambda_val': 0.0010857918639942748, 'batch_size': 601, 'optimizer': 'SGD'}. Best is trial 27 with value: 0.06703932618536035.
2026-05-20 01:34:07,302 - optuna.study.study - INFO - Trial 31 finished with value: 0.05909191600080898 and parameters: {'n_layers': 1, 'embedding_dim': 256, 'lr': 0.01004024283577538, 'lambda_val': 0.005500189125028307, 'batch_size': 3748, 'optimizer': 'Adam'}. Best is trial 27 with value: 0.06703932618536035.
2026-05-20 01:34:43,876 - optuna.study._optimize - INFO - Trial 32 pruned. 
2026-05-20 01:35:00,605 - optuna.study._optimize - INFO - Trial 33 pruned. 
2026-05-20 01:35:08,938 - experiment_functions - INFO - Early stopping at epoch 550. Best Recall: 0.0450
2026-05-20 01:35:09,036 - optuna.study.study - INFO - Trial 34 finished with value: 0.045046714826852206 and parameters: {'n_layers': 1, 'embedding_dim': 64, 'lr': 0.009189323322911896, 'lambda_val': 0.014684454367489889, 'batch_size': 3778, 'optimizer': 'Adam'}. Best is trial 27 with value: 0.06703932618536035.
2026-05-20 01:35:24,584 - optuna.study._optimize - INFO - Trial 35 pruned. 
2026-05-20 01:35:39,208 - optuna.study._optimize - INFO - Trial 36 pruned. 
2026-05-20 01:35:48,095 - experiment_functions - INFO - Early stopping at epoch 600. Best Recall: 0.0344
2026-05-20 01:35:48,203 - optuna.study.study - INFO - Trial 37 finished with value: 0.03443105722356521 and parameters: {'n_layers': 1, 'embedding_dim': 64, 'lr': 0.03781723345982082, 'lambda_val': 0.0008155120091580948, 'batch_size': 3842, 'optimizer': 'Adam'}. Best is trial 27 with value: 0.06703932618536035.
2026-05-20 01:36:02,107 - optuna.study._optimize - INFO - Trial 38 pruned. 
2026-05-20 01:36:10,640 - experiment_functions - INFO - Early stopping at epoch 550. Best Recall: 0.0277
2026-05-20 01:36:10,750 - optuna.study.study - INFO - Trial 39 finished with value: 0.02772204604412673 and parameters: {'n_layers': 1, 'embedding_dim': 128, 'lr': 0.007026670070493403, 'lambda_val': 0.02584684297642492, 'batch_size': 3882, 'optimizer': 'Adam'}. Best is trial 27 with value: 0.06703932618536035.
2026-05-20 01:36:20,116 - experiment_functions - INFO - Early stopping at epoch 600. Best Recall: 0.0681
2026-05-20 01:36:20,209 - optuna.study.study - INFO - Trial 40 finished with value: 0.0681009008905252 and parameters: {'n_layers': 1, 'embedding_dim': 96, 'lr': 0.0022998282767243603, 'lambda_val': 0.00033162176728868147, 'batch_size': 3604, 'optimizer': 'Adam'}. Best is trial 40 with value: 0.0681009008905252.
2026-05-20 01:36:29,655 - experiment_functions - INFO - Early stopping at epoch 650. Best Recall: 0.0716
2026-05-20 01:36:29,760 - optuna.study.study - INFO - Trial 41 finished with value: 0.0715750620521963 and parameters: {'n_layers': 1, 'embedding_dim': 96, 'lr': 0.002356034469114546, 'lambda_val': 0.00018088025131525478, 'batch_size': 3596, 'optimizer': 'Adam'}. Best is trial 41 with value: 0.0715750620521963.
2026-05-20 01:36:39,392 - experiment_functions - INFO - Early stopping at epoch 600. Best Recall: 0.0698
2026-05-20 01:36:39,494 - optuna.study.study - INFO - Trial 42 finished with value: 0.06975668055692785 and parameters: {'n_layers': 1, 'embedding_dim': 96, 'lr': 0.0024020037389297978, 'lambda_val': 0.0004723455170680178, 'batch_size': 3561, 'optimizer': 'Adam'}. Best is trial 41 with value: 0.0715750620521963.
2026-05-20 01:36:53,413 - experiment_functions - INFO - Early stopping at epoch 950. Best Recall: 0.0668
2026-05-20 01:36:53,513 - optuna.study.study - INFO - Trial 43 finished with value: 0.06683017420754431 and parameters: {'n_layers': 1, 'embedding_dim': 96, 'lr': 0.0010114604863286079, 'lambda_val': 0.00034062580561333396, 'batch_size': 3521, 'optimizer': 'Adam'}. Best is trial 41 with value: 0.0715750620521963.
2026-05-20 01:37:04,514 - experiment_functions - INFO - Early stopping at epoch 700. Best Recall: 0.0713
2026-05-20 01:37:04,604 - optuna.study.study - INFO - Trial 44 finished with value: 0.0712954394175232 and parameters: {'n_layers': 1, 'embedding_dim': 96, 'lr': 0.0010617057222662577, 'lambda_val': 0.00033175733919229184, 'batch_size': 2928, 'optimizer': 'Adam'}. Best is trial 41 with value: 0.0715750620521963.
2026-05-20 01:37:47,604 - experiment_functions - INFO - Early stopping at epoch 3100. Best Recall: 0.0629
2026-05-20 01:37:47,739 - optuna.study.study - INFO - Trial 45 finished with value: 0.0629089737002669 and parameters: {'n_layers': 1, 'embedding_dim': 96, 'lr': 0.00031784941347840016, 'lambda_val': 0.00018128723790479862, 'batch_size': 2961, 'optimizer': 'RMSprop'}. Best is trial 41 with value: 0.0715750620521963.
2026-05-20 01:37:57,483 - experiment_functions - INFO - Early stopping at epoch 650. Best Recall: 0.0689
2026-05-20 01:37:57,618 - optuna.study.study - INFO - Trial 46 finished with value: 0.06893285633589469 and parameters: {'n_layers': 1, 'embedding_dim': 96, 'lr': 0.0023732686637037118, 'lambda_val': 0.00044796214771185836, 'batch_size': 2782, 'optimizer': 'Adam'}. Best is trial 41 with value: 0.0715750620521963.
2026-05-20 01:38:17,335 - experiment_functions - INFO - Early stopping at epoch 1400. Best Recall: 0.0641
2026-05-20 01:38:17,425 - optuna.study.study - INFO - Trial 47 finished with value: 0.06413269029152918 and parameters: {'n_layers': 1, 'embedding_dim': 96, 'lr': 0.0007153988657190537, 'lambda_val': 0.00046186773301019326, 'batch_size': 2771, 'optimizer': 'Adam'}. Best is trial 41 with value: 0.0715750620521963.
2026-05-20 01:38:24,668 - experiment_functions - INFO - Early stopping at epoch 500. Best Recall: 0.0057
2026-05-20 01:38:24,758 - optuna.study.study - INFO - Trial 48 finished with value: 0.005686835569601748 and parameters: {'n_layers': 1, 'embedding_dim': 96, 'lr': 0.0018696399578864364, 'lambda_val': 0.00012373775853445772, 'batch_size': 3201, 'optimizer': 'SGD'}. Best is trial 41 with value: 0.0715750620521963.
2026-05-20 01:38:39,155 - experiment_functions - INFO - Early stopping at epoch 1000. Best Recall: 0.0682
2026-05-20 01:38:39,256 - optuna.study.study - INFO - Trial 49 finished with value: 0.06815046924114938 and parameters: {'n_layers': 1, 'embedding_dim': 96, 'lr': 0.0012274364263547652, 'lambda_val': 0.0003579267705527005, 'batch_size': 2183, 'optimizer': 'Adam'}. Best is trial 41 with value: 0.0715750620521963.
2026-05-20 01:38:50,837 - experiment_functions - INFO - Early stopping at epoch 750. Best Recall: 0.0660
2026-05-20 01:38:50,938 - optuna.study.study - INFO - Trial 50 finished with value: 0.06598719315396517 and parameters: {'n_layers': 1, 'embedding_dim': 96, 'lr': 0.0011906166921866422, 'lambda_val': 0.00023649774389577656, 'batch_size': 2176, 'optimizer': 'Adam'}. Best is trial 41 with value: 0.0715750620521963.
2026-05-20 01:39:10,288 - experiment_functions - INFO - Early stopping at epoch 1350. Best Recall: 0.0656
2026-05-20 01:39:10,422 - optuna.study.study - INFO - Trial 51 finished with value: 0.06555845096682697 and parameters: {'n_layers': 1, 'embedding_dim': 96, 'lr': 0.0004282384784819864, 'lambda_val': 0.00035884671473147026, 'batch_size': 1890, 'optimizer': 'Adam'}. Best is trial 41 with value: 0.0715750620521963.
2026-05-20 01:39:20,412 - experiment_functions - INFO - Early stopping at epoch 650. Best Recall: 0.0685
2026-05-20 01:39:20,536 - optuna.study.study - INFO - Trial 52 finished with value: 0.06846666953371461 and parameters: {'n_layers': 1, 'embedding_dim': 96, 'lr': 0.002431795669799849, 'lambda_val': 0.00015049746218152258, 'batch_size': 2607, 'optimizer': 'Adam'}. Best is trial 41 with value: 0.0715750620521963.
2026-05-20 01:39:35,044 - optuna.study._optimize - INFO - Trial 53 pruned. 
2026-05-20 01:39:58,480 - experiment_functions - INFO - Early stopping at epoch 1650. Best Recall: 0.0704
2026-05-20 01:39:58,728 - optuna.study.study - INFO - Trial 54 finished with value: 0.07035173694567691 and parameters: {'n_layers': 1, 'embedding_dim': 96, 'lr': 0.0008895132950072849, 'lambda_val': 6.310487759788263e-05, 'batch_size': 2086, 'optimizer': 'Adam'}. Best is trial 41 with value: 0.0715750620521963.
2026-05-20 01:40:24,738 - experiment_functions - INFO - Early stopping at epoch 1800. Best Recall: 0.0724
2026-05-20 01:40:24,841 - optuna.study.study - INFO - Trial 55 finished with value: 0.0724392199869154 and parameters: {'n_layers': 1, 'embedding_dim': 96, 'lr': 0.0008376299018153147, 'lambda_val': 3.0465331177331985e-05, 'batch_size': 1629, 'optimizer': 'Adam'}. Best is trial 55 with value: 0.0724392199869154.
2026-05-20 01:40:34,534 - experiment_functions - INFO - Early stopping at epoch 550. Best Recall: 0.0325
2026-05-20 01:40:34,625 - optuna.study.study - INFO - Trial 56 finished with value: 0.03246786376809878 and parameters: {'n_layers': 4, 'embedding_dim': 96, 'lr': 0.0009049515921938625, 'lambda_val': 2.1678072703386668e-05, 'batch_size': 1737, 'optimizer': 'RMSprop'}. Best is trial 55 with value: 0.0724392199869154.
2026-05-20 01:40:48,534 - optuna.study._optimize - INFO - Trial 57 pruned. 
2026-05-20 01:41:49,435 - experiment_functions - INFO - Early stopping at epoch 3750. Best Recall: 0.0718
2026-05-20 01:41:49,580 - optuna.study.study - INFO - Trial 58 finished with value: 0.07181932571251365 and parameters: {'n_layers': 1, 'embedding_dim': 96, 'lr': 0.0005394355225797009, 'lambda_val': 2.5893264332303775e-05, 'batch_size': 1671, 'optimizer': 'Adam'}. Best is trial 55 with value: 0.0724392199869154.
2026-05-20 01:42:04,149 - optuna.study._optimize - INFO - Trial 59 pruned. 
2026-05-20 01:42:12,218 - experiment_functions - INFO - Early stopping at epoch 500. Best Recall: 0.0056
2026-05-20 01:42:12,309 - optuna.study.study - INFO - Trial 60 finished with value: 0.00557963878970974 and parameters: {'n_layers': 2, 'embedding_dim': 96, 'lr': 0.0004418588554881174, 'lambda_val': 3.514504076541809e-05, 'batch_size': 1364, 'optimizer': 'SGD'}. Best is trial 55 with value: 0.0724392199869154.
2026-05-20 01:42:32,059 - experiment_functions - INFO - Early stopping at epoch 700. Best Recall: 0.0721
2026-05-20 01:42:32,395 - optuna.study.study - INFO - Trial 61 finished with value: 0.07211330566714537 and parameters: {'n_layers': 1, 'embedding_dim': 96, 'lr': 0.001487880353073122, 'lambda_val': 6.320766974801178e-05, 'batch_size': 1120, 'optimizer': 'Adam'}. Best is trial 55 with value: 0.0724392199869154.
2026-05-20 01:42:48,506 - experiment_functions - INFO - Early stopping at epoch 1100. Best Recall: 0.0746
2026-05-20 01:42:48,608 - optuna.study.study - INFO - Trial 62 finished with value: 0.07461260157090262 and parameters: {'n_layers': 1, 'embedding_dim': 96, 'lr': 0.0007083993740345393, 'lambda_val': 3.898237073442945e-05, 'batch_size': 969, 'optimizer': 'Adam'}. Best is trial 62 with value: 0.07461260157090262.
2026-05-20 01:43:42,888 - experiment_functions - INFO - Early stopping at epoch 3850. Best Recall: 0.0747
