2026-05-19 22:24:20,026 - optuna.study.study - INFO - Trial 121 finished with value: 0.08359501215144814 and parameters: {'n_layers': 1, 'embedding_dim': 256, 'lr': 0.0005830457575608596, 'lambda_val': 1.859545896652017e-06, 'batch_size': 1040, 'optimizer': 'Adam'}. Best is trial 117 with value: 0.09307670313944087.
2026-05-19 22:25:01,080 - experiment_functions - INFO - Early stopping at epoch 2250. Best Recall: 0.0820
2026-05-19 22:25:01,170 - optuna.study.study - INFO - Trial 122 finished with value: 0.08201000579638754 and parameters: {'n_layers': 1, 'embedding_dim': 256, 'lr': 0.0005769583795881251, 'lambda_val': 1.8781331995322396e-06, 'batch_size': 665, 'optimizer': 'Adam'}. Best is trial 117 with value: 0.09307670313944087.
2026-05-19 22:25:50,845 - experiment_functions - INFO - Early stopping at epoch 2250. Best Recall: 0.0845
2026-05-19 22:25:50,978 - optuna.study.study - INFO - Trial 123 finished with value: 0.0845463362680493 and parameters: {'n_layers': 1, 'embedding_dim': 256, 'lr': 0.0005972758717341669, 'lambda_val': 1.7555293310062345e-06, 'batch_size': 631, 'optimizer': 'Adam'}. Best is trial 117 with value: 0.09307670313944087.
2026-05-19 22:26:19,463 - experiment_functions - INFO - Early stopping at epoch 1550. Best Recall: 0.0833
2026-05-19 22:26:19,563 - optuna.study.study - INFO - Trial 124 finished with value: 0.08331550190322262 and parameters: {'n_layers': 1, 'embedding_dim': 256, 'lr': 0.0006648892689282306, 'lambda_val': 1.3751560877130108e-06, 'batch_size': 792, 'optimizer': 'Adam'}. Best is trial 117 with value: 0.09307670313944087.
2026-05-19 22:26:48,478 - experiment_functions - INFO - Early stopping at epoch 1550. Best Recall: 0.0810
2026-05-19 22:26:48,567 - optuna.study.study - INFO - Trial 125 finished with value: 0.08101025047821739 and parameters: {'n_layers': 1, 'embedding_dim': 256, 'lr': 0.0006565119461163346, 'lambda_val': 1.80755473022486e-06, 'batch_size': 801, 'optimizer': 'Adam'}. Best is trial 117 with value: 0.09307670313944087.
2026-05-19 22:26:58,088 - experiment_functions - INFO - Early stopping at epoch 500. Best Recall: 0.0054
2026-05-19 22:26:58,190 - optuna.study.study - INFO - Trial 126 finished with value: 0.005427214536907001 and parameters: {'n_layers': 1, 'embedding_dim': 256, 'lr': 0.00041426368795057894, 'lambda_val': 1.2360946793587241e-06, 'batch_size': 609, 'optimizer': 'SGD'}. Best is trial 117 with value: 0.09307670313944087.
2026-05-19 22:27:34,080 - experiment_functions - INFO - Early stopping at epoch 1450. Best Recall: 0.0767
2026-05-19 22:27:34,169 - optuna.study.study - INFO - Trial 127 finished with value: 0.0767263471202093 and parameters: {'n_layers': 1, 'embedding_dim': 256, 'lr': 0.0006205094442439133, 'lambda_val': 1.5634814045747443e-06, 'batch_size': 954, 'optimizer': 'Adam'}. Best is trial 117 with value: 0.09307670313944087.
2026-05-19 22:27:58,045 - experiment_functions - INFO - Early stopping at epoch 1250. Best Recall: 0.0830
2026-05-19 22:27:58,145 - optuna.study.study - INFO - Trial 128 finished with value: 0.08301286077034434 and parameters: {'n_layers': 1, 'embedding_dim': 256, 'lr': 0.0008526340095389762, 'lambda_val': 2.217287871920893e-06, 'batch_size': 756, 'optimizer': 'Adam'}. Best is trial 117 with value: 0.09307670313944087.
2026-05-19 22:28:20,544 - experiment_functions - INFO - Early stopping at epoch 1200. Best Recall: 0.0841
2026-05-19 22:28:20,664 - optuna.study.study - INFO - Trial 129 finished with value: 0.08411265609501635 and parameters: {'n_layers': 1, 'embedding_dim': 256, 'lr': 0.0008425355048355907, 'lambda_val': 2.2487213746753665e-06, 'batch_size': 763, 'optimizer': 'Adam'}. Best is trial 117 with value: 0.09307670313944087.
2026-05-19 22:28:45,202 - experiment_functions - INFO - Early stopping at epoch 1300. Best Recall: 0.0784
2026-05-19 22:28:45,291 - optuna.study.study - INFO - Trial 130 finished with value: 0.07843951246882144 and parameters: {'n_layers': 1, 'embedding_dim': 256, 'lr': 0.0008197459872851064, 'lambda_val': 2.2197937350481417e-06, 'batch_size': 722, 'optimizer': 'Adam'}. Best is trial 117 with value: 0.09307670313944087.
2026-05-19 22:29:03,395 - optuna.study._optimize - INFO - Trial 131 pruned. 
2026-05-19 22:29:30,626 - experiment_functions - INFO - Early stopping at epoch 1450. Best Recall: 0.0777
2026-05-19 22:29:30,724 - optuna.study.study - INFO - Trial 132 finished with value: 0.07768384021454157 and parameters: {'n_layers': 1, 'embedding_dim': 256, 'lr': 0.0007966657390456977, 'lambda_val': 1.8462027586476993e-06, 'batch_size': 539, 'optimizer': 'Adam'}. Best is trial 117 with value: 0.09307670313944087.
2026-05-19 22:29:48,969 - optuna.study._optimize - INFO - Trial 133 pruned. 
2026-05-19 22:30:26,760 - experiment_functions - INFO - Early stopping at epoch 2050. Best Recall: 0.0793
2026-05-19 22:30:26,849 - optuna.study.study - INFO - Trial 134 finished with value: 0.07932586787289597 and parameters: {'n_layers': 1, 'embedding_dim': 256, 'lr': 0.0005949612243164799, 'lambda_val': 1.5501941859707044e-06, 'batch_size': 666, 'optimizer': 'Adam'}. Best is trial 117 with value: 0.09307670313944087.
2026-05-19 22:30:44,761 - optuna.study._optimize - INFO - Trial 135 pruned. 
2026-05-19 22:31:04,181 - experiment_functions - INFO - Early stopping at epoch 1050. Best Recall: 0.0768
2026-05-19 22:31:04,251 - optuna.study.study - INFO - Trial 136 finished with value: 0.07683136629841375 and parameters: {'n_layers': 1, 'embedding_dim': 256, 'lr': 0.0009469315376403785, 'lambda_val': 1.2715187844597578e-06, 'batch_size': 959, 'optimizer': 'Adam'}. Best is trial 117 with value: 0.09307670313944087.
2026-05-19 22:31:30,803 - experiment_functions - INFO - Early stopping at epoch 1500. Best Recall: 0.0802
2026-05-19 22:31:30,907 - optuna.study.study - INFO - Trial 137 finished with value: 0.0801973627394809 and parameters: {'n_layers': 1, 'embedding_dim': 256, 'lr': 0.0007067318846412869, 'lambda_val': 3.149187446783103e-06, 'batch_size': 631, 'optimizer': 'Adam'}. Best is trial 117 with value: 0.09307670313944087.
2026-05-19 22:31:48,740 - optuna.study._optimize - INFO - Trial 138 pruned. 
2026-05-19 22:32:06,271 - optuna.study._optimize - INFO - Trial 139 pruned. 
2026-05-19 22:32:19,448 - experiment_functions - INFO - Early stopping at epoch 500. Best Recall: 0.0051
2026-05-19 22:32:19,527 - optuna.study.study - INFO - Trial 140 finished with value: 0.0050830796450302 and parameters: {'n_layers': 3, 'embedding_dim': 256, 'lr': 0.0008616197057836328, 'lambda_val': 2.373581206391121e-06, 'batch_size': 848, 'optimizer': 'SGD'}. Best is trial 117 with value: 0.09307670313944087.
2026-05-19 22:32:39,023 - experiment_functions - INFO - Early stopping at epoch 1000. Best Recall: 0.0779
2026-05-19 22:32:39,112 - optuna.study.study - INFO - Trial 141 finished with value: 0.07789331452005961 and parameters: {'n_layers': 1, 'embedding_dim': 256, 'lr': 0.001040021238591819, 'lambda_val': 3.7554577314038454e-06, 'batch_size': 900, 'optimizer': 'Adam'}. Best is trial 117 with value: 0.09307670313944087.
2026-05-19 22:33:05,240 - experiment_functions - INFO - Early stopping at epoch 1400. Best Recall: 0.0769
2026-05-19 22:33:05,343 - optuna.study.study - INFO - Trial 142 finished with value: 0.07690096355571027 and parameters: {'n_layers': 1, 'embedding_dim': 256, 'lr': 0.000631355122737504, 'lambda_val': 3.422277503539867e-06, 'batch_size': 1057, 'optimizer': 'Adam'}. Best is trial 117 with value: 0.09307670313944087.
2026-05-19 22:33:16,871 - experiment_functions - INFO - Early stopping at epoch 600. Best Recall: 0.0238
2026-05-19 22:33:16,971 - optuna.study.study - INFO - Trial 143 finished with value: 0.023762527908482566 and parameters: {'n_layers': 1, 'embedding_dim': 256, 'lr': 0.028180645069126778, 'lambda_val': 1.5672593910239678e-06, 'batch_size': 703, 'optimizer': 'Adam'}. Best is trial 117 with value: 0.09307670313944087.
2026-05-19 22:33:48,766 - experiment_functions - INFO - Early stopping at epoch 2050. Best Recall: 0.0976
2026-05-19 22:33:48,868 - optuna.study.study - INFO - Trial 144 finished with value: 0.09755815166188506 and parameters: {'n_layers': 1, 'embedding_dim': 32, 'lr': 0.0008284423380440983, 'lambda_val': 2.711407432527964e-06, 'batch_size': 795, 'optimizer': 'Adam'}. Best is trial 144 with value: 0.09755815166188506.
2026-05-19 22:34:03,312 - optuna.study._optimize - INFO - Trial 145 pruned. 
2026-05-19 22:34:29,056 - experiment_functions - INFO - Early stopping at epoch 1700. Best Recall: 0.0892
2026-05-19 22:34:29,145 - optuna.study.study - INFO - Trial 146 finished with value: 0.08918255995691429 and parameters: {'n_layers': 1, 'embedding_dim': 32, 'lr': 0.0007953479372575208, 'lambda_val': 1.137562020396046e-06, 'batch_size': 1001, 'optimizer': 'Adam'}. Best is trial 144 with value: 0.09755815166188506.
2026-05-19 22:35:01,821 - experiment_functions - INFO - Early stopping at epoch 2150. Best Recall: 0.0877
2026-05-19 22:35:01,957 - optuna.study.study - INFO - Trial 147 finished with value: 0.08770693446769681 and parameters: {'n_layers': 1, 'embedding_dim': 32, 'lr': 0.0007412372696358849, 'lambda_val': 1.0119916787516258e-06, 'batch_size': 925, 'optimizer': 'Adam'}. Best is trial 144 with value: 0.09755815166188506.
2026-05-19 22:35:28,524 - experiment_functions - INFO - Early stopping at epoch 1700. Best Recall: 0.0865
2026-05-19 22:35:28,634 - optuna.study.study - INFO - Trial 148 finished with value: 0.0865451640998355 and parameters: {'n_layers': 1, 'embedding_dim': 32, 'lr': 0.0008292784919927733, 'lambda_val': 1.163248798249912e-06, 'batch_size': 1003, 'optimizer': 'Adam'}. Best is trial 144 with value: 0.09755815166188506.
2026-05-19 22:35:53,173 - experiment_functions - INFO - Early stopping at epoch 1600. Best Recall: 0.0877
2026-05-19 22:35:53,284 - optuna.study.study - INFO - Trial 149 finished with value: 0.08768076466654247 and parameters: {'n_layers': 1, 'embedding_dim': 32, 'lr': 0.0008903699508767467, 'lambda_val': 1.1931838011164241e-06, 'batch_size': 908, 'optimizer': 'Adam'}. Best is trial 144 with value: 0.09755815166188506.
2026-05-19 22:36:10,801 - experiment_functions - INFO - Early stopping at epoch 1150. Best Recall: 0.0905
2026-05-19 22:36:10,926 - optuna.study.study - INFO - Trial 150 finished with value: 0.09045461454776554 and parameters: {'n_layers': 1, 'embedding_dim': 32, 'lr': 0.0011098794089485831, 'lambda_val': 1.0229664932451765e-06, 'batch_size': 992, 'optimizer': 'Adam'}. Best is trial 144 with value: 0.09755815166188506.
2026-05-19 22:36:28,703 - experiment_functions - INFO - Early stopping at epoch 1200. Best Recall: 0.0858
2026-05-19 22:36:28,846 - optuna.study.study - INFO - Trial 151 finished with value: 0.08584602271717594 and parameters: {'n_layers': 1, 'embedding_dim': 32, 'lr': 0.001060811468389907, 'lambda_val': 1.0609751774031321e-06, 'batch_size': 999, 'optimizer': 'Adam'}. Best is trial 144 with value: 0.09755815166188506.
2026-05-19 22:36:48,294 - experiment_functions - INFO - Early stopping at epoch 1300. Best Recall: 0.0874
2026-05-19 22:36:48,427 - optuna.study.study - INFO - Trial 152 finished with value: 0.08741716113576231 and parameters: {'n_layers': 1, 'embedding_dim': 32, 'lr': 0.001026971742406056, 'lambda_val': 1.0047828479730014e-06, 'batch_size': 993, 'optimizer': 'Adam'}. Best is trial 144 with value: 0.09755815166188506.
2026-05-19 22:37:06,628 - experiment_functions - INFO - Early stopping at epoch 1200. Best Recall: 0.0880
2026-05-19 22:37:06,706 - optuna.study.study - INFO - Trial 153 finished with value: 0.08803526755154366 and parameters: {'n_layers': 1, 'embedding_dim': 32, 'lr': 0.0010504205750739484, 'lambda_val': 1.01975974816002e-06, 'batch_size': 984, 'optimizer': 'Adam'}. Best is trial 144 with value: 0.09755815166188506.
2026-05-19 22:37:25,128 - experiment_functions - INFO - Early stopping at epoch 1250. Best Recall: 0.0828
2026-05-19 22:37:25,228 - optuna.study.study - INFO - Trial 154 finished with value: 0.08276345915541859 and parameters: {'n_layers': 1, 'embedding_dim': 32, 'lr': 0.0010474284227066876, 'lambda_val': 1.0419536491568818e-06, 'batch_size': 1004, 'optimizer': 'Adam'}. Best is trial 144 with value: 0.09755815166188506.
2026-05-19 22:37:41,874 - experiment_functions - INFO - Early stopping at epoch 1100. Best Recall: 0.0824
2026-05-19 22:37:41,964 - optuna.study.study - INFO - Trial 155 finished with value: 0.08240594143467775 and parameters: {'n_layers': 1, 'embedding_dim': 32, 'lr': 0.0012008848828523769, 'lambda_val': 1.038566508864542e-06, 'batch_size': 953, 'optimizer': 'Adam'}. Best is trial 144 with value: 0.09755815166188506.
2026-05-19 22:37:50,244 - experiment_functions - INFO - Early stopping at epoch 550. Best Recall: 0.0126
2026-05-19 22:37:50,335 - optuna.study.study - INFO - Trial 156 finished with value: 0.01257256217205706 and parameters: {'n_layers': 1, 'embedding_dim': 32, 'lr': 0.09889955293237568, 'lambda_val': 1.2386199906445728e-06, 'batch_size': 892, 'optimizer': 'Adam'}. Best is trial 144 with value: 0.09755815166188506.
2026-05-19 22:38:09,768 - experiment_functions - INFO - Early stopping at epoch 1300. Best Recall: 0.0905
2026-05-19 22:38:09,945 - optuna.study.study - INFO - Trial 157 finished with value: 0.09053774848046905 and parameters: {'n_layers': 1, 'embedding_dim': 32, 'lr': 0.0009323571026157803, 'lambda_val': 1.026108844005463e-06, 'batch_size': 1047, 'optimizer': 'Adam'}. Best is trial 144 with value: 0.09755815166188506.
2026-05-19 22:38:30,436 - experiment_functions - INFO - Early stopping at epoch 1350. Best Recall: 0.0875
2026-05-19 22:38:30,557 - optuna.study.study - INFO - Trial 158 finished with value: 0.08748489732287604 and parameters: {'n_layers': 1, 'embedding_dim': 32, 'lr': 0.0009286380942854362, 'lambda_val': 1.0026416110705655e-06, 'batch_size': 934, 'optimizer': 'Adam'}. Best is trial 144 with value: 0.09755815166188506.
2026-05-19 22:38:51,821 - experiment_functions - INFO - Early stopping at epoch 1450. Best Recall: 0.0889
2026-05-19 22:38:51,910 - optuna.study.study - INFO - Trial 159 finished with value: 0.0888883294789472 and parameters: {'n_layers': 1, 'embedding_dim': 32, 'lr': 0.0009138359343189683, 'lambda_val': 1.06308353024789e-06, 'batch_size': 957, 'optimizer': 'Adam'}. Best is trial 144 with value: 0.09755815166188506.
2026-05-19 22:39:08,396 - experiment_functions - INFO - Early stopping at epoch 1050. Best Recall: 0.0800
2026-05-19 22:39:08,563 - optuna.study.study - INFO - Trial 160 finished with value: 0.07999819304054318 and parameters: {'n_layers': 1, 'embedding_dim': 32, 'lr': 0.001313879247116072, 'lambda_val': 1.0099449152987295e-06, 'batch_size': 1098, 'optimizer': 'Adam'}. Best is trial 144 with value: 0.09755815166188506.
2026-05-19 22:39:28,075 - experiment_functions - INFO - Early stopping at epoch 1300. Best Recall: 0.0870
2026-05-19 22:39:28,195 - optuna.study.study - INFO - Trial 161 finished with value: 0.08695500518949316 and parameters: {'n_layers': 1, 'embedding_dim': 32, 'lr': 0.0009610316263420574, 'lambda_val': 1.2474935011116071e-06, 'batch_size': 975, 'optimizer': 'Adam'}. Best is trial 144 with value: 0.09755815166188506.
2026-05-19 22:39:48,570 - experiment_functions - INFO - Early stopping at epoch 1300. Best Recall: 0.0938
2026-05-19 22:39:48,671 - optuna.study.study - INFO - Trial 162 finished with value: 0.09382175983785596 and parameters: {'n_layers': 1, 'embedding_dim': 32, 'lr': 0.0010066938986687613, 'lambda_val': 1.2856853958141305e-06, 'batch_size': 976, 'optimizer': 'Adam'}. Best is trial 144 with value: 0.09755815166188506.
2026-05-19 22:40:07,892 - experiment_functions - INFO - Early stopping at epoch 1300. Best Recall: 0.0923
2026-05-19 22:40:08,004 - optuna.study.study - INFO - Trial 163 finished with value: 0.09232118228920548 and parameters: {'n_layers': 1, 'embedding_dim': 32, 'lr': 0.0009832767284144945, 'lambda_val': 1.2656558401785689e-06, 'batch_size': 988, 'optimizer': 'Adam'}. Best is trial 144 with value: 0.09755815166188506.
2026-05-19 22:40:27,208 - experiment_functions - INFO - Early stopping at epoch 1250. Best Recall: 0.0892
2026-05-19 22:40:27,316 - optuna.study.study - INFO - Trial 164 finished with value: 0.08919436906481729 and parameters: {'n_layers': 1, 'embedding_dim': 32, 'lr': 0.0010041366329233184, 'lambda_val': 1.2924247254743682e-06, 'batch_size': 949, 'optimizer': 'Adam'}. Best is trial 144 with value: 0.09755815166188506.
2026-05-19 22:40:47,869 - experiment_functions - INFO - Early stopping at epoch 1300. Best Recall: 0.0877
2026-05-19 22:40:47,968 - optuna.study.study - INFO - Trial 165 finished with value: 0.08769189717458808 and parameters: {'n_layers': 1, 'embedding_dim': 32, 'lr': 0.0009691845882668459, 'lambda_val': 1.3369269533605386e-06, 'batch_size': 915, 'optimizer': 'Adam'}. Best is trial 144 with value: 0.09755815166188506.
2026-05-19 22:41:02,390 - experiment_functions - INFO - Early stopping at epoch 950. Best Recall: 0.0882
2026-05-19 22:41:02,481 - optuna.study.study - INFO - Trial 166 finished with value: 0.08818630544171158 and parameters: {'n_layers': 1, 'embedding_dim': 32, 'lr': 0.001323350053987789, 'lambda_val': 1.3804415011079353e-06, 'batch_size': 905, 'optimizer': 'Adam'}. Best is trial 144 with value: 0.09755815166188506.
2026-05-19 22:41:17,029 - experiment_functions - INFO - Early stopping at epoch 950. Best Recall: 0.0861
2026-05-19 22:41:17,173 - optuna.study.study - INFO - Trial 167 finished with value: 0.08608454986410363 and parameters: {'n_layers': 1, 'embedding_dim': 32, 'lr': 0.0014167013470790454, 'lambda_val': 1.3632816575239456e-06, 'batch_size': 879, 'optimizer': 'Adam'}. Best is trial 144 with value: 0.09755815166188506.
2026-05-19 22:41:24,900 - experiment_functions - INFO - Early stopping at epoch 500. Best Recall: 0.0063
2026-05-19 22:41:25,019 - optuna.study.study - INFO - Trial 168 finished with value: 0.006282407641718792 and parameters: {'n_layers': 1, 'embedding_dim': 32, 'lr': 0.0011930312742973001, 'lambda_val': 1.4826602211927987e-06, 'batch_size': 927, 'optimizer': 'SGD'}. Best is trial 144 with value: 0.09755815166188506.
2026-05-19 22:41:39,658 - experiment_functions - INFO - Early stopping at epoch 950. Best Recall: 0.0855
2026-05-19 22:41:39,803 - optuna.study.study - INFO - Trial 169 finished with value: 0.08546981951173796 and parameters: {'n_layers': 1, 'embedding_dim': 32, 'lr': 0.001446455745662723, 'lambda_val': 1.4391386877990449e-06, 'batch_size': 916, 'optimizer': 'Adam'}. Best is trial 144 with value: 0.09755815166188506.
2026-05-19 22:41:53,529 - experiment_functions - INFO - Early stopping at epoch 750. Best Recall: 0.0377
2026-05-19 22:41:53,716 - optuna.study.study - INFO - Trial 170 finished with value: 0.03774653961945596 and parameters: {'n_layers': 4, 'embedding_dim': 32, 'lr': 0.0010106688275273359, 'lambda_val': 1.0221196303427495e-06, 'batch_size': 1170, 'optimizer': 'Adam'}. Best is trial 144 with value: 0.09755815166188506.
2026-05-19 22:42:14,634 - experiment_functions - INFO - Early stopping at epoch 1350. Best Recall: 0.0850
2026-05-19 22:42:14,726 - optuna.study.study - INFO - Trial 171 finished with value: 0.08501834033530735 and parameters: {'n_layers': 1, 'embedding_dim': 32, 'lr': 0.0009914166655391066, 'lambda_val': 1.2564544157697637e-06, 'batch_size': 966, 'optimizer': 'Adam'}. Best is trial 144 with value: 0.09755815166188506.
2026-05-19 22:42:36,789 - experiment_functions - INFO - Early stopping at epoch 1500. Best Recall: 0.0832
2026-05-19 22:42:36,879 - optuna.study.study - INFO - Trial 172 finished with value: 0.0831636162427697 and parameters: {'n_layers': 1, 'embedding_dim': 32, 'lr': 0.0008565061084347914, 'lambda_val': 1.0012352115836504e-06, 'batch_size': 1082, 'optimizer': 'Adam'}. Best is trial 144 with value: 0.09755815166188506.
2026-05-19 22:42:52,987 - experiment_functions - INFO - Early stopping at epoch 1050. Best Recall: 0.0874
2026-05-19 22:42:53,077 - optuna.study.study - INFO - Trial 173 finished with value: 0.08739350658646461 and parameters: {'n_layers': 1, 'embedding_dim': 32, 'lr': 0.0012927420175445853, 'lambda_val': 1.5157748405604372e-06, 'batch_size': 857, 'optimizer': 'Adam'}. Best is trial 144 with value: 0.09755815166188506.
2026-05-19 22:43:07,277 - experiment_functions - INFO - Early stopping at epoch 900. Best Recall: 0.0856
2026-05-19 22:43:07,365 - optuna.study.study - INFO - Trial 174 finished with value: 0.0856096788173157 and parameters: {'n_layers': 1, 'embedding_dim': 32, 'lr': 0.001658083450068069, 'lambda_val': 1.6157981882162857e-06, 'batch_size': 843, 'optimizer': 'Adam'}. Best is trial 144 with value: 0.09755815166188506.
2026-05-19 22:43:15,083 - experiment_functions - INFO - Early stopping at epoch 500. Best Recall: 0.0055
2026-05-19 22:43:15,183 - optuna.study.study - INFO - Trial 175 finished with value: 0.005464181134074952 and parameters: {'n_layers': 1, 'embedding_dim': 32, 'lr': 2.015862430201447e-05, 'lambda_val': 1.4388272582092788e-06, 'batch_size': 1126, 'optimizer': 'Adam'}. Best is trial 144 with value: 0.09755815166188506.
2026-05-19 22:43:33,542 - experiment_functions - INFO - Early stopping at epoch 1150. Best Recall: 0.0841
2026-05-19 22:43:33,651 - optuna.study.study - INFO - Trial 176 finished with value: 0.08411203732598532 and parameters: {'n_layers': 1, 'embedding_dim': 32, 'lr': 0.0011559919936438557, 'lambda_val': 1.6500828623840576e-06, 'batch_size': 891, 'optimizer': 'Adam'}. Best is trial 144 with value: 0.09755815166188506.
2026-05-19 22:43:48,792 - experiment_functions - INFO - Early stopping at epoch 1000. Best Recall: 0.0919
