2026-05-19 22:43:48,882 - optuna.study.study - INFO - Trial 177 finished with value: 0.0918645211797228 and parameters: {'n_layers': 1, 'embedding_dim': 32, 'lr': 0.001384867272206857, 'lambda_val': 1.2572782205015271e-06, 'batch_size': 835, 'optimizer': 'Adam'}. Best is trial 144 with value: 0.09755815166188506.
2026-05-19 22:44:00,351 - experiment_functions - INFO - Early stopping at epoch 750. Best Recall: 0.0754
2026-05-19 22:44:00,496 - optuna.study.study - INFO - Trial 178 finished with value: 0.07543650285436782 and parameters: {'n_layers': 1, 'embedding_dim': 32, 'lr': 0.002211340904370845, 'lambda_val': 1.27480904676053e-06, 'batch_size': 1040, 'optimizer': 'Adam'}. Best is trial 144 with value: 0.09755815166188506.
2026-05-19 22:44:35,666 - experiment_functions - INFO - Early stopping at epoch 2350. Best Recall: 0.0854
2026-05-19 22:44:35,797 - optuna.study.study - INFO - Trial 179 finished with value: 0.0853947529676308 and parameters: {'n_layers': 1, 'embedding_dim': 32, 'lr': 0.0007801171424784712, 'lambda_val': 1.0066568537577067e-06, 'batch_size': 939, 'optimizer': 'Adam'}. Best is trial 144 with value: 0.09755815166188506.
2026-05-19 22:44:50,935 - experiment_functions - INFO - Early stopping at epoch 950. Best Recall: 0.0868
2026-05-19 22:44:51,068 - optuna.study.study - INFO - Trial 180 finished with value: 0.08676299933118874 and parameters: {'n_layers': 1, 'embedding_dim': 32, 'lr': 0.0015935654456432017, 'lambda_val': 1.2594070660643484e-06, 'batch_size': 827, 'optimizer': 'Adam'}. Best is trial 144 with value: 0.09755815166188506.
2026-05-19 22:45:08,455 - experiment_functions - INFO - Early stopping at epoch 1100. Best Recall: 0.0889
2026-05-19 22:45:08,544 - optuna.study.study - INFO - Trial 181 finished with value: 0.08893839689752588 and parameters: {'n_layers': 1, 'embedding_dim': 32, 'lr': 0.0012876290106688618, 'lambda_val': 1.810460427685443e-06, 'batch_size': 882, 'optimizer': 'Adam'}. Best is trial 144 with value: 0.09755815166188506.
2026-05-19 22:45:25,304 - experiment_functions - INFO - Early stopping at epoch 1100. Best Recall: 0.0872
2026-05-19 22:45:25,403 - optuna.study.study - INFO - Trial 182 finished with value: 0.08720698405799218 and parameters: {'n_layers': 1, 'embedding_dim': 32, 'lr': 0.0011213608827590118, 'lambda_val': 1.758175931375302e-06, 'batch_size': 987, 'optimizer': 'Adam'}. Best is trial 144 with value: 0.09755815166188506.
2026-05-19 22:45:47,551 - experiment_functions - INFO - Early stopping at epoch 1450. Best Recall: 0.0831
2026-05-19 22:45:47,658 - optuna.study.study - INFO - Trial 183 finished with value: 0.08311606003220738 and parameters: {'n_layers': 1, 'embedding_dim': 32, 'lr': 0.0009658178620947572, 'lambda_val': 1.235267571477495e-06, 'batch_size': 918, 'optimizer': 'Adam'}. Best is trial 144 with value: 0.09755815166188506.
2026-05-19 22:46:00,238 - experiment_functions - INFO - Early stopping at epoch 800. Best Recall: 0.0790
2026-05-19 22:46:00,374 - optuna.study.study - INFO - Trial 184 finished with value: 0.07903935582967346 and parameters: {'n_layers': 1, 'embedding_dim': 32, 'lr': 0.0013804498095645022, 'lambda_val': 1.7799864706184024e-06, 'batch_size': 2398, 'optimizer': 'Adam'}. Best is trial 144 with value: 0.09755815166188506.
2026-05-19 22:46:26,061 - experiment_functions - INFO - Early stopping at epoch 1750. Best Recall: 0.0874
2026-05-19 22:46:26,139 - optuna.study.study - INFO - Trial 185 finished with value: 0.08740325095904518 and parameters: {'n_layers': 1, 'embedding_dim': 32, 'lr': 0.000780147954703146, 'lambda_val': 1.4360503109563e-06, 'batch_size': 1058, 'optimizer': 'Adam'}. Best is trial 144 with value: 0.09755815166188506.
2026-05-19 22:46:41,089 - experiment_functions - INFO - Early stopping at epoch 1000. Best Recall: 0.0860
2026-05-19 22:46:41,179 - optuna.study.study - INFO - Trial 186 finished with value: 0.08601534582638708 and parameters: {'n_layers': 1, 'embedding_dim': 32, 'lr': 0.001218057527593669, 'lambda_val': 1.010437974235362e-06, 'batch_size': 1148, 'optimizer': 'Adam'}. Best is trial 144 with value: 0.09755815166188506.
2026-05-19 22:47:17,997 - experiment_functions - INFO - Early stopping at epoch 2350. Best Recall: 0.0941
2026-05-19 22:47:18,098 - optuna.study.study - INFO - Trial 187 finished with value: 0.09409659872346035 and parameters: {'n_layers': 1, 'embedding_dim': 32, 'lr': 0.0007591839871857256, 'lambda_val': 0.00014842904737813657, 'batch_size': 806, 'optimizer': 'Adam'}. Best is trial 144 with value: 0.09755815166188506.
2026-05-19 22:47:46,052 - experiment_functions - INFO - Early stopping at epoch 1800. Best Recall: 0.0852
2026-05-19 22:47:46,153 - optuna.study.study - INFO - Trial 188 finished with value: 0.08523060454538631 and parameters: {'n_layers': 1, 'embedding_dim': 32, 'lr': 0.0008027680160098531, 'lambda_val': 2.033646233092095e-06, 'batch_size': 819, 'optimizer': 'Adam'}. Best is trial 144 with value: 0.09755815166188506.
2026-05-19 22:48:10,416 - experiment_functions - INFO - Early stopping at epoch 1550. Best Recall: 0.0908
2026-05-19 22:48:10,516 - optuna.study.study - INFO - Trial 189 finished with value: 0.09081760641841417 and parameters: {'n_layers': 1, 'embedding_dim': 32, 'lr': 0.0009107453103050178, 'lambda_val': 0.0067702912489224, 'batch_size': 739, 'optimizer': 'Adam'}. Best is trial 144 with value: 0.09755815166188506.
2026-05-19 22:49:13,658 - optuna.study.study - INFO - Trial 190 finished with value: 0.09448898282476259 and parameters: {'n_layers': 1, 'embedding_dim': 32, 'lr': 0.000736527842522625, 'lambda_val': 4.089725845929026e-05, 'batch_size': 717, 'optimizer': 'Adam'}. Best is trial 144 with value: 0.09755815166188506.
2026-05-19 22:50:12,097 - experiment_functions - INFO - Early stopping at epoch 3700. Best Recall: 0.0954
2026-05-19 22:50:12,200 - optuna.study.study - INFO - Trial 191 finished with value: 0.0954408321300207 and parameters: {'n_layers': 1, 'embedding_dim': 32, 'lr': 0.0007612910465087921, 'lambda_val': 0.00016856479416191392, 'batch_size': 692, 'optimizer': 'Adam'}. Best is trial 144 with value: 0.09755815166188506.
2026-05-19 22:51:14,198 - optuna.study.study - INFO - Trial 192 finished with value: 0.09474416016209766 and parameters: {'n_layers': 1, 'embedding_dim': 32, 'lr': 0.0007376539995859885, 'lambda_val': 0.0001532469797035713, 'batch_size': 693, 'optimizer': 'Adam'}. Best is trial 144 with value: 0.09755815166188506.
2026-05-19 22:51:29,641 - optuna.study._optimize - INFO - Trial 193 pruned. 
2026-05-19 22:52:30,354 - optuna.study.study - INFO - Trial 194 finished with value: 0.09452949222553575 and parameters: {'n_layers': 1, 'embedding_dim': 32, 'lr': 0.0007384534832112287, 'lambda_val': 0.00013840510789297686, 'batch_size': 683, 'optimizer': 'Adam'}. Best is trial 144 with value: 0.09755815166188506.
2026-05-19 22:52:45,782 - optuna.study._optimize - INFO - Trial 195 pruned. 
2026-05-19 22:53:00,865 - optuna.study._optimize - INFO - Trial 196 pruned. 
2026-05-19 22:53:20,265 - experiment_functions - INFO - Early stopping at epoch 1200. Best Recall: 0.0880
2026-05-19 22:53:20,365 - optuna.study.study - INFO - Trial 197 finished with value: 0.08796132605457067 and parameters: {'n_layers': 1, 'embedding_dim': 32, 'lr': 0.001290267056709767, 'lambda_val': 0.0003219457273201106, 'batch_size': 579, 'optimizer': 'Adam'}. Best is trial 144 with value: 0.09755815166188506.
2026-05-19 22:53:35,215 - experiment_functions - INFO - Early stopping at epoch 900. Best Recall: 0.0865
2026-05-19 22:53:35,311 - optuna.study.study - INFO - Trial 198 finished with value: 0.08652937135579838 and parameters: {'n_layers': 1, 'embedding_dim': 32, 'lr': 0.0017960361533546285, 'lambda_val': 6.61781431090971e-05, 'batch_size': 644, 'optimizer': 'Adam'}. Best is trial 144 with value: 0.09755815166188506.
2026-05-19 22:53:43,026 - experiment_functions - INFO - Early stopping at epoch 500. Best Recall: 0.0053
2026-05-19 22:53:43,107 - optuna.study.study - INFO - Trial 199 finished with value: 0.005336087523436941 and parameters: {'n_layers': 1, 'embedding_dim': 32, 'lr': 0.0011158974554596399, 'lambda_val': 3.895825233265037e-05, 'batch_size': 766, 'optimizer': 'SGD'}. Best is trial 144 with value: 0.09755815166188506.
2026-05-19 22:54:27,672 - experiment_functions - INFO - Early stopping at epoch 2850. Best Recall: 0.0928
2026-05-19 22:54:27,762 - optuna.study.study - INFO - Trial 200 finished with value: 0.0928272444866031 and parameters: {'n_layers': 1, 'embedding_dim': 32, 'lr': 0.0008334055000418054, 'lambda_val': 8.574055743164746e-05, 'batch_size': 691, 'optimizer': 'Adam'}. Best is trial 144 with value: 0.09755815166188506.
2026-05-19 22:55:15,127 - experiment_functions - INFO - Early stopping at epoch 3050. Best Recall: 0.0948
2026-05-19 22:55:15,205 - optuna.study.study - INFO - Trial 201 finished with value: 0.09476498984740123 and parameters: {'n_layers': 1, 'embedding_dim': 32, 'lr': 0.0008179626038032633, 'lambda_val': 0.0002211069817372424, 'batch_size': 681, 'optimizer': 'Adam'}. Best is trial 144 with value: 0.09755815166188506.
2026-05-19 22:55:31,086 - optuna.study._optimize - INFO - Trial 202 pruned. 
2026-05-19 22:56:04,927 - experiment_functions - INFO - Early stopping at epoch 2100. Best Recall: 0.0959
2026-05-19 22:56:05,051 - optuna.study.study - INFO - Trial 203 finished with value: 0.09593948325433801 and parameters: {'n_layers': 1, 'embedding_dim': 32, 'lr': 0.0008623714994853495, 'lambda_val': 0.00012527689970591533, 'batch_size': 774, 'optimizer': 'Adam'}. Best is trial 144 with value: 0.09755815166188506.
2026-05-19 22:56:51,102 - experiment_functions - INFO - Early stopping at epoch 2950. Best Recall: 0.0940
2026-05-19 22:56:51,192 - optuna.study.study - INFO - Trial 204 finished with value: 0.093994478602887 and parameters: {'n_layers': 1, 'embedding_dim': 32, 'lr': 0.0008433818809471859, 'lambda_val': 0.00013245694071780805, 'batch_size': 641, 'optimizer': 'Adam'}. Best is trial 144 with value: 0.09755815166188506.
2026-05-19 22:57:45,480 - optuna.study._optimize - INFO - Trial 205 pruned. 
2026-05-19 22:58:00,427 - optuna.study._optimize - INFO - Trial 206 pruned. 
2026-05-19 22:58:16,105 - optuna.study._optimize - INFO - Trial 207 pruned. 
2026-05-19 22:58:42,551 - experiment_functions - INFO - Early stopping at epoch 1650. Best Recall: 0.0903
2026-05-19 22:58:42,652 - optuna.study.study - INFO - Trial 208 finished with value: 0.09030171513539736 and parameters: {'n_layers': 1, 'embedding_dim': 32, 'lr': 0.0009101313221092045, 'lambda_val': 0.00019691856925033892, 'batch_size': 791, 'optimizer': 'Adam'}. Best is trial 144 with value: 0.09755815166188506.
2026-05-19 22:58:57,971 - optuna.study._optimize - INFO - Trial 209 pruned. 
2026-05-19 22:59:41,329 - optuna.study._optimize - INFO - Trial 210 pruned. 
2026-05-19 23:00:13,063 - experiment_functions - INFO - Early stopping at epoch 2000. Best Recall: 0.0914
2026-05-19 23:00:13,161 - optuna.study.study - INFO - Trial 211 finished with value: 0.09138475654332398 and parameters: {'n_layers': 1, 'embedding_dim': 32, 'lr': 0.0008727224266104402, 'lambda_val': 0.00023874915862025998, 'batch_size': 703, 'optimizer': 'Adam'}. Best is trial 144 with value: 0.09755815166188506.
2026-05-19 23:00:28,793 - optuna.study._optimize - INFO - Trial 212 pruned. 
2026-05-19 23:01:00,277 - experiment_functions - INFO - Early stopping at epoch 1950. Best Recall: 0.0923
2026-05-19 23:01:00,379 - optuna.study.study - INFO - Trial 213 finished with value: 0.0923470036436283 and parameters: {'n_layers': 1, 'embedding_dim': 32, 'lr': 0.0008759172158169659, 'lambda_val': 0.00019001608024120763, 'batch_size': 756, 'optimizer': 'Adam'}. Best is trial 144 with value: 0.09755815166188506.
2026-05-19 23:01:42,892 - experiment_functions - INFO - Early stopping at epoch 2750. Best Recall: 0.0978
2026-05-19 23:01:42,999 - optuna.study.study - INFO - Trial 214 finished with value: 0.09780120887468562 and parameters: {'n_layers': 1, 'embedding_dim': 32, 'lr': 0.000843757837376434, 'lambda_val': 0.00019595231678636772, 'batch_size': 607, 'optimizer': 'Adam'}. Best is trial 214 with value: 0.09780120887468562.
2026-05-19 23:02:19,930 - experiment_functions - INFO - Early stopping at epoch 2300. Best Recall: 0.0927
2026-05-19 23:02:20,029 - optuna.study.study - INFO - Trial 215 finished with value: 0.09270127856439282 and parameters: {'n_layers': 1, 'embedding_dim': 32, 'lr': 0.000889350641233757, 'lambda_val': 0.000191568670342289, 'batch_size': 590, 'optimizer': 'Adam'}. Best is trial 214 with value: 0.09780120887468562.
2026-05-19 23:02:36,060 - optuna.study._optimize - INFO - Trial 216 pruned. 
2026-05-19 23:03:06,702 - experiment_functions - INFO - Early stopping at epoch 2050. Best Recall: 0.0940
2026-05-19 23:03:06,791 - optuna.study.study - INFO - Trial 217 finished with value: 0.09396945950402116 and parameters: {'n_layers': 1, 'embedding_dim': 32, 'lr': 0.0008669839479044429, 'lambda_val': 0.00031189896253422205, 'batch_size': 582, 'optimizer': 'Adam'}. Best is trial 214 with value: 0.09780120887468562.
2026-05-19 23:03:21,100 - optuna.study._optimize - INFO - Trial 218 pruned. 
2026-05-19 23:04:15,556 - experiment_functions - INFO - Early stopping at epoch 3700. Best Recall: 0.0952
2026-05-19 23:04:15,690 - optuna.study.study - INFO - Trial 219 finished with value: 0.0952178891945554 and parameters: {'n_layers': 1, 'embedding_dim': 32, 'lr': 0.0008404308858075353, 'lambda_val': 0.0003046462273817668, 'batch_size': 512, 'optimizer': 'Adam'}. Best is trial 214 with value: 0.09780120887468562.
2026-05-19 23:04:32,534 - optuna.study._optimize - INFO - Trial 220 pruned. 
2026-05-19 23:05:00,002 - experiment_functions - INFO - Early stopping at epoch 1800. Best Recall: 0.0921
2026-05-19 23:05:00,180 - optuna.study.study - INFO - Trial 221 finished with value: 0.09209470583042552 and parameters: {'n_layers': 1, 'embedding_dim': 32, 'lr': 0.0008899909137930176, 'lambda_val': 0.00027470905609847806, 'batch_size': 598, 'optimizer': 'Adam'}. Best is trial 214 with value: 0.09780120887468562.
2026-05-19 23:05:15,223 - optuna.study._optimize - INFO - Trial 222 pruned. 
2026-05-19 23:05:45,793 - experiment_functions - INFO - Early stopping at epoch 2050. Best Recall: 0.0953
2026-05-19 23:05:45,884 - optuna.study.study - INFO - Trial 223 finished with value: 0.09533149429987395 and parameters: {'n_layers': 1, 'embedding_dim': 32, 'lr': 0.0008834773091409076, 'lambda_val': 0.0007341110905348126, 'batch_size': 687, 'optimizer': 'Adam'}. Best is trial 214 with value: 0.09780120887468562.
2026-05-19 23:06:22,808 - experiment_functions - INFO - Early stopping at epoch 2500. Best Recall: 0.0956
2026-05-19 23:06:22,897 - optuna.study.study - INFO - Trial 224 finished with value: 0.09557695616920894 and parameters: {'n_layers': 1, 'embedding_dim': 32, 'lr': 0.0007920643238151786, 'lambda_val': 0.0007226681025083218, 'batch_size': 684, 'optimizer': 'Adam'}. Best is trial 214 with value: 0.09780120887468562.
2026-05-19 23:06:36,992 - optuna.study._optimize - INFO - Trial 225 pruned. 
2026-05-19 23:06:51,273 - optuna.study._optimize - INFO - Trial 226 pruned. 
2026-05-19 23:07:47,908 - experiment_functions - INFO - Early stopping at epoch 3700. Best Recall: 0.0955
2026-05-19 23:07:48,683 - optuna.study.study - INFO - Trial 227 finished with value: 0.09550365512205142 and parameters: {'n_layers': 1, 'embedding_dim': 32, 'lr': 0.0007707622580400945, 'lambda_val': 0.0006503558559789698, 'batch_size': 581, 'optimizer': 'Adam'}. Best is trial 214 with value: 0.09780120887468562.
2026-05-19 23:08:11,359 - optuna.study._optimize - INFO - Trial 228 pruned. 
2026-05-19 23:08:25,741 - optuna.study._optimize - INFO - Trial 229 pruned. 
2026-05-19 23:08:41,092 - optuna.study._optimize - INFO - Trial 230 pruned. 
2026-05-19 23:09:06,627 - experiment_functions - INFO - Early stopping at epoch 1700. Best Recall: 0.0933
2026-05-19 23:09:06,716 - optuna.study.study - INFO - Trial 231 finished with value: 0.09329179624033757 and parameters: {'n_layers': 1, 'embedding_dim': 32, 'lr': 0.0008823107705134636, 'lambda_val': 0.0011971290040372594, 'batch_size': 688, 'optimizer': 'Adam'}. Best is trial 214 with value: 0.09780120887468562.
2026-05-19 23:09:28,115 - experiment_functions - INFO - Early stopping at epoch 1450. Best Recall: 0.0968
2026-05-19 23:09:28,250 - optuna.study.study - INFO - Trial 232 finished with value: 0.09680245018116163 and parameters: {'n_layers': 1, 'embedding_dim': 32, 'lr': 0.0010561572216560224, 'lambda_val': 0.0011255935290717005, 'batch_size': 680, 'optimizer': 'Adam'}. Best is trial 214 with value: 0.09780120887468562.
2026-05-19 23:09:47,536 - experiment_functions - INFO - Early stopping at epoch 1300. Best Recall: 0.0873
2026-05-19 23:09:47,637 - optuna.study.study - INFO - Trial 233 finished with value: 0.08726513703217247 and parameters: {'n_layers': 1, 'embedding_dim': 32, 'lr': 0.0010902954489093062, 'lambda_val': 0.0016736911789064454, 'batch_size': 683, 'optimizer': 'Adam'}. Best is trial 214 with value: 0.09780120887468562.
2026-05-19 23:10:02,392 - optuna.study._optimize - INFO - Trial 234 pruned. 
2026-05-19 23:10:16,983 - optuna.study._optimize - INFO - Trial 235 pruned. 
2026-05-19 23:10:35,599 - experiment_functions - INFO - Early stopping at epoch 1100. Best Recall: 0.0856
2026-05-19 23:10:35,719 - optuna.study.study - INFO - Trial 236 finished with value: 0.08563700891871812 and parameters: {'n_layers': 1, 'embedding_dim': 96, 'lr': 0.0010035066353703355, 'lambda_val': 0.0006304864942211865, 'batch_size': 715, 'optimizer': 'Adam'}. Best is trial 214 with value: 0.09780120887468562.
2026-05-19 23:11:14,636 - optuna.study._optimize - INFO - Trial 237 pruned. 
2026-05-19 23:11:29,721 - optuna.study._optimize - INFO - Trial 238 pruned. 
2026-05-19 23:11:37,174 - experiment_functions - INFO - Early stopping at epoch 500. Best Recall: 0.0055
2026-05-19 23:11:37,275 - optuna.study.study - INFO - Trial 239 finished with value: 0.005453696053426949 and parameters: {'n_layers': 1, 'embedding_dim': 32, 'lr': 0.0008807902020895481, 'lambda_val': 0.0001209761021324869, 'batch_size': 647, 'optimizer': 'SGD'}. Best is trial 214 with value: 0.09780120887468562.
2026-05-19 23:11:56,696 - experiment_functions - INFO - Early stopping at epoch 1300. Best Recall: 0.0859
2026-05-19 23:11:57,279 - optuna.study.study - INFO - Trial 240 finished with value: 0.08585074789427301 and parameters: {'n_layers': 1, 'embedding_dim': 32, 'lr': 0.0010689602774894406, 'lambda_val': 0.0006605389762984499, 'batch_size': 690, 'optimizer': 'Adam'}. Best is trial 214 with value: 0.09780120887468562.
2026-05-19 23:12:36,175 - optuna.study._optimize - INFO - Trial 241 pruned. 
2026-05-19 23:12:57,285 - experiment_functions - INFO - Early stopping at epoch 1400. Best Recall: 0.0860
2026-05-19 23:12:57,384 - optuna.study.study - INFO - Trial 242 finished with value: 0.08599246014511269 and parameters: {'n_layers': 1, 'embedding_dim': 32, 'lr': 0.0010691624482310085, 'lambda_val': 0.0023721142710135816, 'batch_size': 573, 'optimizer': 'Adam'}. Best is trial 214 with value: 0.09780120887468562.
2026-05-19 23:13:11,084 - experiment_functions - INFO - Early stopping at epoch 800. Best Recall: 0.0608
2026-05-19 23:13:11,183 - optuna.study.study - INFO - Trial 243 finished with value: 0.06078535953099757 and parameters: {'n_layers': 3, 'embedding_dim': 32, 'lr': 0.0008876577487565393, 'lambda_val': 0.0001871866690880161, 'batch_size': 777, 'optimizer': 'Adam'}. Best is trial 214 with value: 0.09780120887468562.
2026-05-19 23:13:25,980 - optuna.study._optimize - INFO - Trial 244 pruned. 
2026-05-19 23:13:44,710 - experiment_functions - INFO - Early stopping at epoch 1200. Best Recall: 0.0967
2026-05-19 23:13:44,876 - optuna.study.study - INFO - Trial 245 finished with value: 0.09665265197379075 and parameters: {'n_layers': 1, 'embedding_dim': 32, 'lr': 0.0011838486431778846, 'lambda_val': 0.00028494635343722226, 'batch_size': 725, 'optimizer': 'Adam'}. Best is trial 214 with value: 0.09780120887468562.
2026-05-19 23:14:05,000 - experiment_functions - INFO - Early stopping at epoch 1350. Best Recall: 0.0896
2026-05-19 23:14:05,146 - optuna.study.study - INFO - Trial 246 finished with value: 0.08959967687462686 and parameters: {'n_layers': 1, 'embedding_dim': 32, 'lr': 0.0011625984055627428, 'lambda_val': 0.00034930556219648116, 'batch_size': 522, 'optimizer': 'Adam'}. Best is trial 214 with value: 0.09780120887468562.
2026-05-19 23:14:20,498 - optuna.study._optimize - INFO - Trial 247 pruned. 
2026-05-19 23:14:46,716 - experiment_functions - INFO - Early stopping at epoch 1750. Best Recall: 0.0928
2026-05-19 23:14:46,795 - optuna.study.study - INFO - Trial 248 finished with value: 0.09276145196981285 and parameters: {'n_layers': 1, 'embedding_dim': 32, 'lr': 0.0009275611905822256, 'lambda_val': 0.0004812312344622527, 'batch_size': 638, 'optimizer': 'Adam'}. Best is trial 214 with value: 0.09780120887468562.
2026-05-19 23:15:08,812 - experiment_functions - INFO - Early stopping at epoch 1450. Best Recall: 0.0921
2026-05-19 23:15:08,980 - optuna.study.study - INFO - Trial 249 finished with value: 0.09213378000603828 and parameters: {'n_layers': 1, 'embedding_dim': 32, 'lr': 0.0009953420893116759, 'lambda_val': 0.00044436226906028936, 'batch_size': 673, 'optimizer': 'Adam'}. Best is trial 214 with value: 0.09780120887468562.
2026-05-19 23:15:23,024 - optuna.study._optimize - INFO - Trial 250 pruned. 
2026-05-19 23:15:38,020 - optuna.study._optimize - INFO - Trial 251 pruned. 
2026-05-19 23:16:04,721 - experiment_functions - INFO - Early stopping at epoch 1100. Best Recall: 0.0912
2026-05-19 23:16:04,830 - optuna.study.study - INFO - Trial 252 finished with value: 0.09117391119648521 and parameters: {'n_layers': 1, 'embedding_dim': 32, 'lr': 0.0011979912250942928, 'lambda_val': 0.001341915836099407, 'batch_size': 753, 'optimizer': 'Adam'}. Best is trial 214 with value: 0.09780120887468562.
