2026-05-20 04:25:15,637 - optuna.study.study - INFO - Trial 72 finished with value: 0.0457187566212614 and parameters: {'n_layers': 1, 'embedding_dim': 64, 'lr': 0.0009162052198006621, 'lambda_val': 7.530059746171354e-06, 'batch_size': 670, 'optimizer': 'Adam'}. Best is trial 72 with value: 0.0457187566212614.
2026-05-20 04:25:25,116 - experiment_functions - INFO - Early stopping at epoch 700. Best Recall: 0.0448
2026-05-20 04:25:25,214 - optuna.study.study - INFO - Trial 73 finished with value: 0.04482018845434597 and parameters: {'n_layers': 1, 'embedding_dim': 64, 'lr': 0.0013628408088784015, 'lambda_val': 6.6792335299471644e-06, 'batch_size': 660, 'optimizer': 'Adam'}. Best is trial 72 with value: 0.0457187566212614.
2026-05-20 04:25:58,118 - experiment_functions - INFO - Early stopping at epoch 2650. Best Recall: 0.0458
2026-05-20 04:25:58,230 - optuna.study.study - INFO - Trial 74 finished with value: 0.04581897690474457 and parameters: {'n_layers': 1, 'embedding_dim': 64, 'lr': 0.0004684995008765364, 'lambda_val': 7.075853453275322e-06, 'batch_size': 667, 'optimizer': 'Adam'}. Best is trial 74 with value: 0.04581897690474457.
2026-05-20 04:26:10,827 - experiment_functions - INFO - Early stopping at epoch 900. Best Recall: 0.0188
2026-05-20 04:26:10,918 - optuna.study.study - INFO - Trial 75 finished with value: 0.018772162314216183 and parameters: {'n_layers': 4, 'embedding_dim': 64, 'lr': 0.0005303317778988424, 'lambda_val': 5.812489450423556e-06, 'batch_size': 736, 'optimizer': 'Adam'}. Best is trial 74 with value: 0.04581897690474457.
2026-05-20 04:26:25,860 - experiment_functions - INFO - Early stopping at epoch 1200. Best Recall: 0.0461
2026-05-20 04:26:25,952 - optuna.study.study - INFO - Trial 76 finished with value: 0.04614941089937034 and parameters: {'n_layers': 1, 'embedding_dim': 64, 'lr': 0.0008018450763252267, 'lambda_val': 4.211778943320274e-06, 'batch_size': 636, 'optimizer': 'Adam'}. Best is trial 76 with value: 0.04614941089937034.
2026-05-20 04:27:10,442 - experiment_functions - INFO - Early stopping at epoch 3550. Best Recall: 0.0462
2026-05-20 04:27:10,549 - optuna.study.study - INFO - Trial 77 finished with value: 0.04617186493212921 and parameters: {'n_layers': 1, 'embedding_dim': 64, 'lr': 0.0003544813053620831, 'lambda_val': 4.64213333832874e-06, 'batch_size': 658, 'optimizer': 'Adam'}. Best is trial 77 with value: 0.04617186493212921.
2026-05-20 04:27:32,948 - optuna.study._optimize - INFO - Trial 78 pruned. 
2026-05-20 04:27:54,685 - optuna.study._optimize - INFO - Trial 79 pruned. 
2026-05-20 04:28:11,320 - experiment_functions - INFO - Early stopping at epoch 1250. Best Recall: 0.0454
2026-05-20 04:28:11,454 - optuna.study.study - INFO - Trial 80 finished with value: 0.0454091408776984 and parameters: {'n_layers': 1, 'embedding_dim': 64, 'lr': 0.0006936747180802804, 'lambda_val': 1.2000439404839644e-05, 'batch_size': 694, 'optimizer': 'Adam'}. Best is trial 77 with value: 0.04617186493212921.
2026-05-20 04:28:44,531 - experiment_functions - INFO - Early stopping at epoch 2700. Best Recall: 0.0459
2026-05-20 04:28:44,640 - optuna.study.study - INFO - Trial 81 finished with value: 0.04592515333834349 and parameters: {'n_layers': 1, 'embedding_dim': 64, 'lr': 0.0004175005124417569, 'lambda_val': 4.811876623292777e-06, 'batch_size': 711, 'optimizer': 'Adam'}. Best is trial 77 with value: 0.04617186493212921.
2026-05-20 04:29:01,603 - experiment_functions - INFO - Early stopping at epoch 1300. Best Recall: 0.0448
2026-05-20 04:29:01,703 - optuna.study.study - INFO - Trial 82 finished with value: 0.04484155526334839 and parameters: {'n_layers': 1, 'embedding_dim': 64, 'lr': 0.0006735001147321094, 'lambda_val': 1.1733567597915733e-05, 'batch_size': 729, 'optimizer': 'Adam'}. Best is trial 77 with value: 0.04617186493212921.
2026-05-20 04:29:15,860 - experiment_functions - INFO - Early stopping at epoch 1100. Best Recall: 0.0456
2026-05-20 04:29:15,969 - optuna.study.study - INFO - Trial 83 finished with value: 0.04556844513683476 and parameters: {'n_layers': 1, 'embedding_dim': 64, 'lr': 0.0006853406929169965, 'lambda_val': 1.1500922203549726e-05, 'batch_size': 712, 'optimizer': 'Adam'}. Best is trial 77 with value: 0.04617186493212921.
2026-05-20 04:29:35,376 - optuna.study._optimize - INFO - Trial 84 pruned. 
2026-05-20 04:29:48,187 - experiment_functions - INFO - Early stopping at epoch 1000. Best Recall: 0.0436
2026-05-20 04:29:48,274 - optuna.study.study - INFO - Trial 85 finished with value: 0.04356787943555272 and parameters: {'n_layers': 1, 'embedding_dim': 64, 'lr': 0.0005897091649419956, 'lambda_val': 3.3084553491582693e-06, 'batch_size': 1271, 'optimizer': 'Adam'}. Best is trial 77 with value: 0.04617186493212921.
2026-05-20 04:29:55,105 - experiment_functions - INFO - Early stopping at epoch 500. Best Recall: 0.0048
2026-05-20 04:29:55,194 - optuna.study.study - INFO - Trial 86 finished with value: 0.004767420102745157 and parameters: {'n_layers': 1, 'embedding_dim': 64, 'lr': 0.0003049301693914054, 'lambda_val': 6.778140804859052e-06, 'batch_size': 716, 'optimizer': 'SGD'}. Best is trial 77 with value: 0.04617186493212921.
2026-05-20 04:30:12,096 - experiment_functions - INFO - Early stopping at epoch 1300. Best Recall: 0.0461
2026-05-20 04:30:12,195 - optuna.study.study - INFO - Trial 87 finished with value: 0.046051554082399415 and parameters: {'n_layers': 1, 'embedding_dim': 64, 'lr': 0.0007562788705760472, 'lambda_val': 1.0786296862715159e-05, 'batch_size': 618, 'optimizer': 'Adam'}. Best is trial 77 with value: 0.04617186493212921.
2026-05-20 04:30:28,254 - experiment_functions - INFO - Early stopping at epoch 1250. Best Recall: 0.0460
2026-05-20 04:30:28,344 - optuna.study.study - INFO - Trial 88 finished with value: 0.045996254523502436 and parameters: {'n_layers': 1, 'embedding_dim': 64, 'lr': 0.0007405269521053239, 'lambda_val': 1.5193826055435782e-06, 'batch_size': 598, 'optimizer': 'Adam'}. Best is trial 77 with value: 0.04617186493212921.
2026-05-20 04:31:02,921 - experiment_functions - INFO - Early stopping at epoch 2850. Best Recall: 0.0462
2026-05-20 04:31:03,014 - optuna.study.study - INFO - Trial 89 finished with value: 0.04619897404995165 and parameters: {'n_layers': 1, 'embedding_dim': 64, 'lr': 0.0003971223781197992, 'lambda_val': 1.4985852864371922e-06, 'batch_size': 512, 'optimizer': 'Adam'}. Best is trial 89 with value: 0.04619897404995165.
2026-05-20 04:31:15,930 - optuna.study._optimize - INFO - Trial 90 pruned. 
2026-05-20 04:31:33,943 - experiment_functions - INFO - Early stopping at epoch 1450. Best Recall: 0.0461
2026-05-20 04:31:34,044 - optuna.study.study - INFO - Trial 91 finished with value: 0.04612267891310209 and parameters: {'n_layers': 1, 'embedding_dim': 64, 'lr': 0.0005021109266214005, 'lambda_val': 1.7430762159140086e-06, 'batch_size': 604, 'optimizer': 'Adam'}. Best is trial 89 with value: 0.04619897404995165.
2026-05-20 04:32:03,383 - experiment_functions - INFO - Early stopping at epoch 2450. Best Recall: 0.0462
2026-05-20 04:32:03,594 - optuna.study.study - INFO - Trial 92 finished with value: 0.046246629430762534 and parameters: {'n_layers': 1, 'embedding_dim': 64, 'lr': 0.0005272241426219294, 'lambda_val': 1.3522813706789614e-06, 'batch_size': 602, 'optimizer': 'Adam'}. Best is trial 92 with value: 0.046246629430762534.
2026-05-20 04:32:21,819 - optuna.study._optimize - INFO - Trial 93 pruned. 
2026-05-20 04:32:35,051 - optuna.study._optimize - INFO - Trial 94 pruned. 
2026-05-20 04:33:25,386 - optuna.study.study - INFO - Trial 95 finished with value: 0.04635033042688343 and parameters: {'n_layers': 1, 'embedding_dim': 64, 'lr': 0.000360975235002567, 'lambda_val': 1.7582750991595414e-06, 'batch_size': 608, 'optimizer': 'Adam'}. Best is trial 95 with value: 0.04635033042688343.
2026-05-20 04:33:39,896 - optuna.study._optimize - INFO - Trial 96 pruned. 
2026-05-20 04:33:53,898 - optuna.study._optimize - INFO - Trial 97 pruned. 
2026-05-20 04:34:08,067 - optuna.study._optimize - INFO - Trial 98 pruned. 
2026-05-20 04:34:15,748 - experiment_functions - INFO - Early stopping at epoch 500. Best Recall: 0.0046
2026-05-20 04:34:15,838 - optuna.study.study - INFO - Trial 99 finished with value: 0.004641268775066244 and parameters: {'n_layers': 3, 'embedding_dim': 64, 'lr': 0.00038175128888122374, 'lambda_val': 1.0590330162524241e-06, 'batch_size': 817, 'optimizer': 'SGD'}. Best is trial 95 with value: 0.04635033042688343.
2026-05-20 04:34:27,320 - experiment_functions - INFO - Early stopping at epoch 800. Best Recall: 0.0351
2026-05-20 04:34:27,410 - optuna.study.study - INFO - Trial 100 finished with value: 0.035093039330659284 and parameters: {'n_layers': 2, 'embedding_dim': 64, 'lr': 0.0005591560789824871, 'lambda_val': 1.7771007226346053e-06, 'batch_size': 1088, 'optimizer': 'Adam'}. Best is trial 95 with value: 0.04635033042688343.
2026-05-20 04:34:43,842 - optuna.study._optimize - INFO - Trial 101 pruned. 
2026-05-20 04:35:00,102 - optuna.study._optimize - INFO - Trial 102 pruned. 
2026-05-20 04:35:13,861 - optuna.study._optimize - INFO - Trial 103 pruned. 
2026-05-20 04:35:33,067 - optuna.study._optimize - INFO - Trial 104 pruned. 
2026-05-20 04:35:47,248 - optuna.study._optimize - INFO - Trial 105 pruned. 
2026-05-20 04:36:08,001 - experiment_functions - INFO - Early stopping at epoch 1450. Best Recall: 0.0465
2026-05-20 04:36:08,168 - optuna.study.study - INFO - Trial 106 finished with value: 0.04652650287245331 and parameters: {'n_layers': 1, 'embedding_dim': 64, 'lr': 0.0005287385977585193, 'lambda_val': 4.965291424366303e-06, 'batch_size': 653, 'optimizer': 'RMSprop'}. Best is trial 106 with value: 0.04652650287245331.
2026-05-20 04:36:39,085 - experiment_functions - INFO - Early stopping at epoch 2300. Best Recall: 0.0461
2026-05-20 04:36:39,185 - optuna.study.study - INFO - Trial 107 finished with value: 0.04609349653522861 and parameters: {'n_layers': 1, 'embedding_dim': 64, 'lr': 0.0005356819326209492, 'lambda_val': 4.740464397860902e-06, 'batch_size': 611, 'optimizer': 'RMSprop'}. Best is trial 106 with value: 0.04652650287245331.
2026-05-20 04:37:02,536 - experiment_functions - INFO - Early stopping at epoch 1700. Best Recall: 0.0461
2026-05-20 04:37:02,627 - optuna.study.study - INFO - Trial 108 finished with value: 0.04614402134084766 and parameters: {'n_layers': 1, 'embedding_dim': 64, 'lr': 0.0005348067282158532, 'lambda_val': 4.393462435794773e-06, 'batch_size': 770, 'optimizer': 'RMSprop'}. Best is trial 106 with value: 0.04652650287245331.
2026-05-20 04:37:19,999 - experiment_functions - INFO - Early stopping at epoch 1250. Best Recall: 0.0464
2026-05-20 04:37:20,099 - optuna.study.study - INFO - Trial 109 finished with value: 0.04639220205446282 and parameters: {'n_layers': 1, 'embedding_dim': 64, 'lr': 0.000532046784021011, 'lambda_val': 2.7935182033328396e-06, 'batch_size': 807, 'optimizer': 'RMSprop'}. Best is trial 106 with value: 0.04652650287245331.
2026-05-20 04:37:41,403 - experiment_functions - INFO - Early stopping at epoch 1500. Best Recall: 0.0473
2026-05-20 04:37:41,559 - optuna.study.study - INFO - Trial 110 finished with value: 0.047276272056161625 and parameters: {'n_layers': 1, 'embedding_dim': 32, 'lr': 0.0005578590065610093, 'lambda_val': 5.222432435124281e-06, 'batch_size': 875, 'optimizer': 'RMSprop'}. Best is trial 110 with value: 0.047276272056161625.
2026-05-20 04:38:03,959 - experiment_functions - INFO - Early stopping at epoch 1600. Best Recall: 0.0473
2026-05-20 04:38:04,059 - optuna.study.study - INFO - Trial 111 finished with value: 0.04725107159088788 and parameters: {'n_layers': 1, 'embedding_dim': 32, 'lr': 0.0005674830712434262, 'lambda_val': 4.950320900869065e-06, 'batch_size': 820, 'optimizer': 'RMSprop'}. Best is trial 110 with value: 0.047276272056161625.
2026-05-20 04:38:27,401 - experiment_functions - INFO - Early stopping at epoch 1650. Best Recall: 0.0476
2026-05-20 04:38:27,549 - optuna.study.study - INFO - Trial 112 finished with value: 0.0475524059075818 and parameters: {'n_layers': 1, 'embedding_dim': 32, 'lr': 0.0005623758185636371, 'lambda_val': 5.164345700581003e-06, 'batch_size': 841, 'optimizer': 'RMSprop'}. Best is trial 112 with value: 0.0475524059075818.
2026-05-20 04:38:41,174 - optuna.study._optimize - INFO - Trial 113 pruned. 
2026-05-20 04:38:54,558 - optuna.study._optimize - INFO - Trial 114 pruned. 
2026-05-20 04:39:13,569 - optuna.study._optimize - INFO - Trial 115 pruned. 
2026-05-20 04:39:26,665 - optuna.study._optimize - INFO - Trial 116 pruned. 
2026-05-20 04:40:16,862 - optuna.study.study - INFO - Trial 117 finished with value: 0.04702934622121983 and parameters: {'n_layers': 1, 'embedding_dim': 32, 'lr': 0.0003798587957275163, 'lambda_val': 2.79760991369022e-06, 'batch_size': 767, 'optimizer': 'RMSprop'}. Best is trial 112 with value: 0.0475524059075818.
2026-05-20 04:40:59,211 - experiment_functions - INFO - Early stopping at epoch 3350. Best Recall: 0.0473
2026-05-20 04:40:59,311 - optuna.study.study - INFO - Trial 118 finished with value: 0.04732340180079272 and parameters: {'n_layers': 1, 'embedding_dim': 32, 'lr': 0.00038160634009843335, 'lambda_val': 2.713220609578899e-06, 'batch_size': 987, 'optimizer': 'RMSprop'}. Best is trial 112 with value: 0.0475524059075818.
2026-05-20 04:41:12,385 - optuna.study._optimize - INFO - Trial 119 pruned. 
2026-05-20 04:41:24,828 - optuna.study._optimize - INFO - Trial 120 pruned. 
2026-05-20 04:42:12,621 - optuna.study.study - INFO - Trial 121 finished with value: 0.04749035611525582 and parameters: {'n_layers': 1, 'embedding_dim': 32, 'lr': 0.00036143489259474925, 'lambda_val': 3.3703682202616394e-06, 'batch_size': 805, 'optimizer': 'RMSprop'}. Best is trial 112 with value: 0.0475524059075818.
2026-05-20 04:42:53,295 - experiment_functions - INFO - Early stopping at epoch 3400. Best Recall: 0.0472
2026-05-20 04:42:53,386 - optuna.study.study - INFO - Trial 122 finished with value: 0.04724483340500843 and parameters: {'n_layers': 1, 'embedding_dim': 32, 'lr': 0.00037588784645896595, 'lambda_val': 3.340367996174694e-06, 'batch_size': 837, 'optimizer': 'RMSprop'}. Best is trial 112 with value: 0.0475524059075818.
2026-05-20 04:43:06,639 - optuna.study._optimize - INFO - Trial 123 pruned. 
2026-05-20 04:43:55,082 - optuna.study.study - INFO - Trial 124 finished with value: 0.04800981997752097 and parameters: {'n_layers': 1, 'embedding_dim': 32, 'lr': 0.0003239778077210516, 'lambda_val': 3.1699974204631336e-06, 'batch_size': 851, 'optimizer': 'RMSprop'}. Best is trial 124 with value: 0.04800981997752097.
2026-05-20 04:44:21,796 - experiment_functions - INFO - Early stopping at epoch 2150. Best Recall: 0.0471
2026-05-20 04:44:21,904 - optuna.study.study - INFO - Trial 125 finished with value: 0.04714194525615442 and parameters: {'n_layers': 1, 'embedding_dim': 32, 'lr': 0.00041028617572516423, 'lambda_val': 3.06907286077362e-06, 'batch_size': 1143, 'optimizer': 'RMSprop'}. Best is trial 124 with value: 0.04800981997752097.
2026-05-20 04:44:35,972 - optuna.study._optimize - INFO - Trial 126 pruned. 
2026-05-20 04:44:49,161 - optuna.study._optimize - INFO - Trial 127 pruned. 
2026-05-20 04:45:02,268 - optuna.study._optimize - INFO - Trial 128 pruned. 
2026-05-20 04:45:33,502 - experiment_functions - INFO - Early stopping at epoch 2500. Best Recall: 0.0470
2026-05-20 04:45:33,647 - optuna.study.study - INFO - Trial 129 finished with value: 0.04699123195579711 and parameters: {'n_layers': 1, 'embedding_dim': 32, 'lr': 0.00041887529939562215, 'lambda_val': 3.5908799472813915e-06, 'batch_size': 810, 'optimizer': 'RMSprop'}. Best is trial 124 with value: 0.04800981997752097.
2026-05-20 04:45:46,972 - optuna.study._optimize - INFO - Trial 130 pruned. 
2026-05-20 04:45:57,876 - experiment_functions - INFO - Early stopping at epoch 850. Best Recall: 0.0279
2026-05-20 04:45:57,975 - optuna.study.study - INFO - Trial 131 finished with value: 0.027879479303564787 and parameters: {'n_layers': 1, 'embedding_dim': 32, 'lr': 0.00042866060634418285, 'lambda_val': 0.02196009951032828, 'batch_size': 816, 'optimizer': 'RMSprop'}. Best is trial 124 with value: 0.04800981997752097.
2026-05-20 04:46:17,432 - experiment_functions - INFO - Early stopping at epoch 1500. Best Recall: 0.0469
2026-05-20 04:46:17,530 - optuna.study.study - INFO - Trial 132 finished with value: 0.046896125046564326 and parameters: {'n_layers': 1, 'embedding_dim': 32, 'lr': 0.0006241147412142383, 'lambda_val': 2.8922076168203816e-06, 'batch_size': 967, 'optimizer': 'RMSprop'}. Best is trial 124 with value: 0.04800981997752097.
2026-05-20 04:46:31,062 - optuna.study._optimize - INFO - Trial 133 pruned. 
2026-05-20 04:46:51,892 - experiment_functions - INFO - Early stopping at epoch 1650. Best Recall: 0.0466
2026-05-20 04:46:51,993 - optuna.study.study - INFO - Trial 134 finished with value: 0.04659463523361436 and parameters: {'n_layers': 1, 'embedding_dim': 32, 'lr': 0.0006314505513532904, 'lambda_val': 3.5574325338955016e-06, 'batch_size': 958, 'optimizer': 'RMSprop'}. Best is trial 124 with value: 0.04800981997752097.
2026-05-20 04:47:21,750 - experiment_functions - INFO - Early stopping at epoch 2250. Best Recall: 0.0470
2026-05-20 04:47:21,849 - optuna.study.study - INFO - Trial 135 finished with value: 0.04697136399438199 and parameters: {'n_layers': 1, 'embedding_dim': 32, 'lr': 0.0006046082392199655, 'lambda_val': 5.6088113347057405e-06, 'batch_size': 972, 'optimizer': 'RMSprop'}. Best is trial 124 with value: 0.04800981997752097.
2026-05-20 04:47:44,114 - experiment_functions - INFO - Early stopping at epoch 1750. Best Recall: 0.0465
2026-05-20 04:47:44,433 - optuna.study.study - INFO - Trial 136 finished with value: 0.04649764906664943 and parameters: {'n_layers': 1, 'embedding_dim': 32, 'lr': 0.0006147075374223707, 'lambda_val': 6.250453438707302e-06, 'batch_size': 942, 'optimizer': 'RMSprop'}. Best is trial 124 with value: 0.04800981997752097.
2026-05-20 04:47:56,784 - experiment_functions - INFO - Early stopping at epoch 900. Best Recall: 0.0454
2026-05-20 04:47:56,893 - optuna.study.study - INFO - Trial 137 finished with value: 0.04536024668534515 and parameters: {'n_layers': 1, 'embedding_dim': 32, 'lr': 0.0008710702394804889, 'lambda_val': 3.7916422257675012e-06, 'batch_size': 1191, 'optimizer': 'RMSprop'}. Best is trial 124 with value: 0.04800981997752097.
2026-05-20 04:48:11,004 - optuna.study._optimize - INFO - Trial 138 pruned. 
2026-05-20 04:48:23,908 - experiment_functions - INFO - Early stopping at epoch 900. Best Recall: 0.0441
2026-05-20 04:48:24,023 - optuna.study.study - INFO - Trial 139 finished with value: 0.044141431505432156 and parameters: {'n_layers': 1, 'embedding_dim': 32, 'lr': 0.0013823304803048165, 'lambda_val': 7.974763374714156e-06, 'batch_size': 974, 'optimizer': 'RMSprop'}. Best is trial 124 with value: 0.04800981997752097.
2026-05-20 04:48:53,069 - experiment_functions - INFO - Early stopping at epoch 2300. Best Recall: 0.0473
2026-05-20 04:48:53,171 - optuna.study.study - INFO - Trial 140 finished with value: 0.047324401520265826 and parameters: {'n_layers': 1, 'embedding_dim': 32, 'lr': 0.00044254384850873706, 'lambda_val': 3.545191404130801e-06, 'batch_size': 1115, 'optimizer': 'RMSprop'}. Best is trial 124 with value: 0.04800981997752097.
2026-05-20 04:49:33,459 - experiment_functions - INFO - Early stopping at epoch 3100. Best Recall: 0.0475
2026-05-20 04:49:33,574 - optuna.study.study - INFO - Trial 141 finished with value: 0.04752454689346078 and parameters: {'n_layers': 1, 'embedding_dim': 32, 'lr': 0.0004448800755949731, 'lambda_val': 3.0133234159413593e-06, 'batch_size': 883, 'optimizer': 'RMSprop'}. Best is trial 124 with value: 0.04800981997752097.
2026-05-20 04:49:51,781 - optuna.study._optimize - INFO - Trial 142 pruned. 
2026-05-20 04:50:01,077 - experiment_functions - INFO - Early stopping at epoch 700. Best Recall: 0.0367
2026-05-20 04:50:01,180 - optuna.study.study - INFO - Trial 143 finished with value: 0.036748992502087054 and parameters: {'n_layers': 1, 'embedding_dim': 32, 'lr': 0.0006553649054357344, 'lambda_val': 0.010022010051007802, 'batch_size': 909, 'optimizer': 'RMSprop'}. Best is trial 124 with value: 0.04800981997752097.
2026-05-20 04:50:19,360 - optuna.study._optimize - INFO - Trial 144 pruned. 
2026-05-20 04:50:33,148 - optuna.study._optimize - INFO - Trial 145 pruned. 
2026-05-20 04:50:45,812 - optuna.study._optimize - INFO - Trial 146 pruned. 
2026-05-20 04:50:59,074 - optuna.study._optimize - INFO - Trial 147 pruned. 
2026-05-20 04:51:13,244 - optuna.study._optimize - INFO - Trial 148 pruned. 
2026-05-20 04:51:31,480 - optuna.study._optimize - INFO - Trial 149 pruned. 
2026-05-20 04:51:45,154 - optuna.study._optimize - INFO - Trial 150 pruned. 
2026-05-20 04:52:16,391 - experiment_functions - INFO - Early stopping at epoch 2450. Best Recall: 0.0479
2026-05-20 04:52:16,536 - optuna.study.study - INFO - Trial 151 finished with value: 0.04785834300038837 and parameters: {'n_layers': 1, 'embedding_dim': 32, 'lr': 0.00047718553710398014, 'lambda_val': 5.058290551415531e-06, 'batch_size': 758, 'optimizer': 'RMSprop'}. Best is trial 124 with value: 0.04800981997752097.
2026-05-20 04:52:47,723 - experiment_functions - INFO - Early stopping at epoch 2400. Best Recall: 0.0477
2026-05-20 04:52:47,817 - optuna.study.study - INFO - Trial 152 finished with value: 0.04769545102392657 and parameters: {'n_layers': 1, 'embedding_dim': 32, 'lr': 0.00046838687624340964, 'lambda_val': 3.6452785463698328e-06, 'batch_size': 770, 'optimizer': 'RMSprop'}. Best is trial 124 with value: 0.04800981997752097.
2026-05-20 04:53:25,355 - experiment_functions - INFO - Early stopping at epoch 2950. Best Recall: 0.0476
