2026-05-20 10:28:46,310 - optuna.study._optimize - INFO - Trial 245 pruned. 
2026-05-20 10:29:01,267 - optuna.study._optimize - INFO - Trial 246 pruned. 
2026-05-20 10:29:16,163 - optuna.study._optimize - INFO - Trial 247 pruned. 
2026-05-20 10:30:09,918 - experiment_functions - INFO - Early stopping at epoch 3150. Best Recall: 0.0954
2026-05-20 10:30:10,030 - optuna.study.study - INFO - Trial 248 finished with value: 0.09543534660351113 and parameters: {'n_layers': 1, 'embedding_dim': 128, 'lr': 0.00045204930707915046, 'lambda_val': 1.045622051524324e-05, 'batch_size': 516, 'optimizer': 'RMSprop'}. Best is trial 243 with value: 0.0972734812008288.
2026-05-20 10:30:43,299 - optuna.study._optimize - INFO - Trial 249 pruned. 
2026-05-20 10:31:02,557 - optuna.study._optimize - INFO - Trial 250 pruned. 
2026-05-20 10:31:38,780 - optuna.study._optimize - INFO - Trial 251 pruned. 
2026-05-20 10:31:54,947 - optuna.study._optimize - INFO - Trial 252 pruned. 
2026-05-20 10:32:11,981 - optuna.study._optimize - INFO - Trial 253 pruned. 
2026-05-20 10:32:28,647 - experiment_functions - INFO - Early stopping at epoch 900. Best Recall: 0.0850
2026-05-20 10:32:28,791 - optuna.study.study - INFO - Trial 254 finished with value: 0.08504798928825562 and parameters: {'n_layers': 2, 'embedding_dim': 128, 'lr': 0.0004819699859044203, 'lambda_val': 5.061824477193781e-06, 'batch_size': 599, 'optimizer': 'RMSprop'}. Best is trial 243 with value: 0.0972734812008288.
2026-05-20 10:32:43,697 - optuna.study._optimize - INFO - Trial 255 pruned. 
2026-05-20 10:32:58,506 - optuna.study._optimize - INFO - Trial 256 pruned. 
2026-05-20 10:33:14,397 - optuna.study._optimize - INFO - Trial 257 pruned. 
2026-05-20 10:33:55,585 - experiment_functions - INFO - Early stopping at epoch 2350. Best Recall: 0.0958
2026-05-20 10:33:55,675 - optuna.study.study - INFO - Trial 258 finished with value: 0.09582067753576677 and parameters: {'n_layers': 1, 'embedding_dim': 128, 'lr': 0.0004934983287962362, 'lambda_val': 1.2035225428489333e-05, 'batch_size': 518, 'optimizer': 'RMSprop'}. Best is trial 243 with value: 0.0972734812008288.
2026-05-20 10:34:26,682 - experiment_functions - INFO - Early stopping at epoch 2000. Best Recall: 0.0945
2026-05-20 10:34:26,762 - optuna.study.study - INFO - Trial 259 finished with value: 0.09445542103006524 and parameters: {'n_layers': 1, 'embedding_dim': 128, 'lr': 0.0004876392670132959, 'lambda_val': 1.1650354722666503e-05, 'batch_size': 573, 'optimizer': 'RMSprop'}. Best is trial 243 with value: 0.0972734812008288.
2026-05-20 10:34:58,045 - experiment_functions - INFO - Early stopping at epoch 2050. Best Recall: 0.0959
2026-05-20 10:34:58,123 - optuna.study.study - INFO - Trial 260 finished with value: 0.09593992869139258 and parameters: {'n_layers': 1, 'embedding_dim': 128, 'lr': 0.000529304135001814, 'lambda_val': 1.2147762331808976e-05, 'batch_size': 513, 'optimizer': 'RMSprop'}. Best is trial 243 with value: 0.0972734812008288.
2026-05-20 10:35:22,612 - experiment_functions - INFO - Early stopping at epoch 1550. Best Recall: 0.0929
2026-05-20 10:35:22,735 - optuna.study.study - INFO - Trial 261 finished with value: 0.09286186500561498 and parameters: {'n_layers': 1, 'embedding_dim': 128, 'lr': 0.0005658408456950066, 'lambda_val': 9.73756509814015e-06, 'batch_size': 535, 'optimizer': 'RMSprop'}. Best is trial 243 with value: 0.0972734812008288.
2026-05-20 10:35:36,331 - optuna.study._optimize - INFO - Trial 262 pruned. 
2026-05-20 10:36:10,087 - experiment_functions - INFO - Early stopping at epoch 2100. Best Recall: 0.0953
2026-05-20 10:36:10,250 - optuna.study.study - INFO - Trial 263 finished with value: 0.09528809239679574 and parameters: {'n_layers': 1, 'embedding_dim': 128, 'lr': 0.0005034918273267942, 'lambda_val': 1.4250975386511996e-05, 'batch_size': 673, 'optimizer': 'RMSprop'}. Best is trial 243 with value: 0.0972734812008288.
2026-05-20 10:36:45,629 - experiment_functions - INFO - Early stopping at epoch 2050. Best Recall: 0.0936
2026-05-20 10:36:45,707 - optuna.study.study - INFO - Trial 264 finished with value: 0.09359724127727996 and parameters: {'n_layers': 1, 'embedding_dim': 128, 'lr': 0.0005104051999423524, 'lambda_val': 1.3221896454900073e-05, 'batch_size': 701, 'optimizer': 'RMSprop'}. Best is trial 243 with value: 0.0972734812008288.
2026-05-20 10:37:04,689 - optuna.study._optimize - INFO - Trial 265 pruned. 
2026-05-20 10:37:23,103 - experiment_functions - INFO - Early stopping at epoch 950. Best Recall: 0.0639
2026-05-20 10:37:23,264 - optuna.study.study - INFO - Trial 266 finished with value: 0.06391930657283748 and parameters: {'n_layers': 4, 'embedding_dim': 128, 'lr': 0.00035031702508080945, 'lambda_val': 1.0979770901539413e-05, 'batch_size': 516, 'optimizer': 'RMSprop'}. Best is trial 243 with value: 0.0972734812008288.
2026-05-20 10:37:49,261 - optuna.study._optimize - INFO - Trial 267 pruned. 
2026-05-20 10:38:09,955 - optuna.study._optimize - INFO - Trial 268 pruned. 
2026-05-20 10:38:24,662 - optuna.study._optimize - INFO - Trial 269 pruned. 
2026-05-20 10:38:43,511 - experiment_functions - INFO - Early stopping at epoch 1200. Best Recall: 0.0920
2026-05-20 10:38:43,600 - optuna.study.study - INFO - Trial 270 finished with value: 0.09204926433263108 and parameters: {'n_layers': 1, 'embedding_dim': 128, 'lr': 0.0005763317110167683, 'lambda_val': 1.329543610938061e-05, 'batch_size': 718, 'optimizer': 'RMSprop'}. Best is trial 243 with value: 0.0972734812008288.
2026-05-20 10:38:56,853 - experiment_functions - INFO - Early stopping at epoch 700. Best Recall: 0.0616
2026-05-20 10:38:56,942 - optuna.study.study - INFO - Trial 271 finished with value: 0.06162492637669947 and parameters: {'n_layers': 3, 'embedding_dim': 128, 'lr': 0.0005073754856165894, 'lambda_val': 7.683676192896116e-06, 'batch_size': 631, 'optimizer': 'RMSprop'}. Best is trial 243 with value: 0.0972734812008288.
2026-05-20 10:39:11,516 - optuna.study._optimize - INFO - Trial 272 pruned. 
2026-05-20 10:39:34,368 - experiment_functions - INFO - Early stopping at epoch 1500. Best Recall: 0.0925
2026-05-20 10:39:34,457 - optuna.study.study - INFO - Trial 273 finished with value: 0.09247406012642213 and parameters: {'n_layers': 1, 'embedding_dim': 128, 'lr': 0.0006219428297096523, 'lambda_val': 1.0646592746229008e-05, 'batch_size': 516, 'optimizer': 'RMSprop'}. Best is trial 243 with value: 0.0972734812008288.
2026-05-20 10:39:49,233 - optuna.study._optimize - INFO - Trial 274 pruned. 
2026-05-20 10:40:11,513 - optuna.study._optimize - INFO - Trial 275 pruned. 
2026-05-20 10:40:30,501 - optuna.study._optimize - INFO - Trial 276 pruned. 
2026-05-20 10:40:46,333 - experiment_functions - INFO - Early stopping at epoch 1050. Best Recall: 0.0926
2026-05-20 10:40:46,423 - optuna.study.study - INFO - Trial 277 finished with value: 0.09263278703324718 and parameters: {'n_layers': 1, 'embedding_dim': 128, 'lr': 0.000615115508417601, 'lambda_val': 6.713345102604185e-06, 'batch_size': 698, 'optimizer': 'RMSprop'}. Best is trial 243 with value: 0.0972734812008288.
2026-05-20 10:41:02,166 - optuna.study._optimize - INFO - Trial 278 pruned. 
2026-05-20 10:41:46,327 - experiment_functions - INFO - Early stopping at epoch 2800. Best Recall: 0.0965
2026-05-20 10:41:46,415 - optuna.study.study - INFO - Trial 279 finished with value: 0.09652835573451174 and parameters: {'n_layers': 1, 'embedding_dim': 128, 'lr': 0.0004908847632407836, 'lambda_val': 1.1026476913849857e-05, 'batch_size': 515, 'optimizer': 'RMSprop'}. Best is trial 243 with value: 0.0972734812008288.
2026-05-20 10:42:14,305 - experiment_functions - INFO - Early stopping at epoch 1900. Best Recall: 0.0955
2026-05-20 10:42:14,384 - optuna.study.study - INFO - Trial 280 finished with value: 0.09551230053600392 and parameters: {'n_layers': 1, 'embedding_dim': 128, 'lr': 0.0005296731342263739, 'lambda_val': 8.674264539868442e-06, 'batch_size': 512, 'optimizer': 'RMSprop'}. Best is trial 243 with value: 0.0972734812008288.
2026-05-20 10:42:38,605 - experiment_functions - INFO - Early stopping at epoch 1450. Best Recall: 0.0928
2026-05-20 10:42:38,738 - optuna.study.study - INFO - Trial 281 finished with value: 0.09279602531046542 and parameters: {'n_layers': 1, 'embedding_dim': 128, 'lr': 0.0006125462447398808, 'lambda_val': 1.0444667701321384e-05, 'batch_size': 521, 'optimizer': 'RMSprop'}. Best is trial 243 with value: 0.0972734812008288.
2026-05-20 10:43:05,310 - experiment_functions - INFO - Early stopping at epoch 1700. Best Recall: 0.0935
2026-05-20 10:43:05,446 - optuna.study.study - INFO - Trial 282 finished with value: 0.09345645977928796 and parameters: {'n_layers': 1, 'embedding_dim': 128, 'lr': 0.0005406406445717455, 'lambda_val': 8.339804322719247e-06, 'batch_size': 660, 'optimizer': 'RMSprop'}. Best is trial 243 with value: 0.0972734812008288.
2026-05-20 10:43:19,494 - optuna.study._optimize - INFO - Trial 283 pruned. 
2026-05-20 10:43:34,293 - optuna.study._optimize - INFO - Trial 284 pruned. 
2026-05-20 10:43:47,241 - experiment_functions - INFO - Early stopping at epoch 750. Best Recall: 0.0831
2026-05-20 10:43:47,320 - optuna.study.study - INFO - Trial 285 finished with value: 0.08309477664665713 and parameters: {'n_layers': 2, 'embedding_dim': 128, 'lr': 0.0005168416000772677, 'lambda_val': 8.489394464485249e-06, 'batch_size': 733, 'optimizer': 'RMSprop'}. Best is trial 243 with value: 0.0972734812008288.
2026-05-20 10:44:06,085 - experiment_functions - INFO - Early stopping at epoch 1250. Best Recall: 0.0921
2026-05-20 10:44:06,163 - optuna.study.study - INFO - Trial 286 finished with value: 0.0920821832740696 and parameters: {'n_layers': 1, 'embedding_dim': 128, 'lr': 0.0006537613882120335, 'lambda_val': 1.4984144632554266e-05, 'batch_size': 512, 'optimizer': 'RMSprop'}. Best is trial 243 with value: 0.0972734812008288.
2026-05-20 10:44:55,389 - experiment_functions - INFO - Early stopping at epoch 3250. Best Recall: 0.0959
2026-05-20 10:44:55,477 - optuna.study.study - INFO - Trial 287 finished with value: 0.09586583456753199 and parameters: {'n_layers': 1, 'embedding_dim': 128, 'lr': 0.00042905442087799327, 'lambda_val': 1.1098310056508879e-05, 'batch_size': 636, 'optimizer': 'RMSprop'}. Best is trial 243 with value: 0.0972734812008288.
2026-05-20 10:45:44,108 - experiment_functions - INFO - Early stopping at epoch 3200. Best Recall: 0.0959
2026-05-20 10:45:44,185 - optuna.study.study - INFO - Trial 288 finished with value: 0.09594877609089113 and parameters: {'n_layers': 1, 'embedding_dim': 128, 'lr': 0.0004087905206396746, 'lambda_val': 7.327927083421822e-06, 'batch_size': 689, 'optimizer': 'RMSprop'}. Best is trial 243 with value: 0.0972734812008288.
2026-05-20 10:45:59,350 - optuna.study._optimize - INFO - Trial 289 pruned. 
2026-05-20 10:46:44,130 - experiment_functions - INFO - Early stopping at epoch 3050. Best Recall: 0.0973
2026-05-20 10:46:44,220 - optuna.study.study - INFO - Trial 290 finished with value: 0.09727941435534457 and parameters: {'n_layers': 1, 'embedding_dim': 128, 'lr': 0.00039307263660629915, 'lambda_val': 4.736814271712106e-06, 'batch_size': 704, 'optimizer': 'RMSprop'}. Best is trial 290 with value: 0.09727941435534457.
2026-05-20 10:47:01,432 - optuna.study._optimize - INFO - Trial 291 pruned. 
2026-05-20 10:47:16,104 - optuna.study._optimize - INFO - Trial 292 pruned. 
2026-05-20 10:47:31,141 - optuna.study._optimize - INFO - Trial 293 pruned. 
2026-05-20 10:48:10,597 - experiment_functions - INFO - Early stopping at epoch 2600. Best Recall: 0.0948
2026-05-20 10:48:10,699 - optuna.study.study - INFO - Trial 294 finished with value: 0.0947670545907697 and parameters: {'n_layers': 1, 'embedding_dim': 128, 'lr': 0.0004216013278988854, 'lambda_val': 5.50948641206335e-06, 'batch_size': 639, 'optimizer': 'RMSprop'}. Best is trial 290 with value: 0.09727941435534457.
2026-05-20 10:48:30,688 - optuna.study._optimize - INFO - Trial 295 pruned. 
2026-05-20 10:48:46,050 - optuna.study._optimize - INFO - Trial 296 pruned. 
2026-05-20 10:49:17,434 - experiment_functions - INFO - Early stopping at epoch 2100. Best Recall: 0.0959
2026-05-20 10:49:18,723 - optuna.study.study - INFO - Trial 297 finished with value: 0.0959024720999157 and parameters: {'n_layers': 1, 'embedding_dim': 128, 'lr': 0.0004466519159912719, 'lambda_val': 9.747847225977908e-06, 'batch_size': 675, 'optimizer': 'RMSprop'}. Best is trial 290 with value: 0.09727941435534457.
2026-05-20 10:49:34,863 - optuna.study._optimize - INFO - Trial 298 pruned. 
2026-05-20 10:49:56,904 - optuna.study._optimize - INFO - Trial 299 pruned. 
2026-05-20 10:49:56,905 - experiment_functions - INFO - Training the best model ... for e_1M_1c3dcs
2026-05-20 10:50:33,279 - experiment_functions - INFO - Early stopping at epoch 2950. Best Recall: 0.0939
2026-05-20 10:50:34,440 - root - INFO -   **** Training e_1M_1c3dcs_rand1
2026-05-20 10:50:34,506 - root - INFO -   **** Getting 221091/805443 random edges
2026-05-20 10:50:34,575 - experiment_functions - INFO - Training the best model ... for e_1M_1c3dcs_rand1
2026-05-20 10:51:20,844 - root - INFO -   **** Training e_1M_1c3dcs_rand2
2026-05-20 10:51:20,907 - root - INFO -   **** Getting 221091/805443 random edges
2026-05-20 10:51:20,973 - experiment_functions - INFO - Training the best model ... for e_1M_1c3dcs_rand2
2026-05-20 10:52:07,213 - root - INFO -   **** Training e_1M_1c3dcs_rand3
2026-05-20 10:52:07,274 - root - INFO -   **** Getting 221091/805443 random edges
2026-05-20 10:52:07,335 - experiment_functions - INFO - Training the best model ... for e_1M_1c3dcs_rand3
2026-05-20 10:52:53,529 - root - INFO -   **** Training e_1M_1c3dcs_rand4
2026-05-20 10:52:53,589 - root - INFO -   **** Getting 221091/805443 random edges
2026-05-20 10:52:53,651 - experiment_functions - INFO - Training the best model ... for e_1M_1c3dcs_rand4
2026-05-20 10:53:39,772 - root - INFO -   **** Training e_1M_1c3dcs_rand5
2026-05-20 10:53:39,833 - root - INFO -   **** Getting 221091/805443 random edges
2026-05-20 10:53:39,894 - experiment_functions - INFO - Training the best model ... for e_1M_1c3dcs_rand5
