2026-05-20 08:30:46,008 - optuna.study.study - INFO - Trial 183 finished with value: 0.05864242949504906 and parameters: {'n_layers': 1, 'embedding_dim': 128, 'lr': 0.000346821375087808, 'lambda_val': 3.560271522615691e-06, 'batch_size': 699, 'optimizer': 'RMSprop'}. Best is trial 157 with value: 0.06390748000357267.
2026-05-20 08:31:24,873 - experiment_functions - INFO - Early stopping at epoch 3000. Best Recall: 0.0621
2026-05-20 08:31:24,962 - optuna.study.study - INFO - Trial 184 finished with value: 0.06208674818798384 and parameters: {'n_layers': 1, 'embedding_dim': 128, 'lr': 0.00023898443063133837, 'lambda_val': 2.7616405985529825e-06, 'batch_size': 577, 'optimizer': 'RMSprop'}. Best is trial 157 with value: 0.06390748000357267.
2026-05-20 08:31:38,586 - optuna.study._optimize - INFO - Trial 185 pruned. 
2026-05-20 08:31:52,003 - optuna.study._optimize - INFO - Trial 186 pruned. 
2026-05-20 08:32:05,187 - optuna.study._optimize - INFO - Trial 187 pruned. 
2026-05-20 08:32:27,115 - optuna.study._optimize - INFO - Trial 188 pruned. 
2026-05-20 08:32:40,813 - experiment_functions - INFO - Early stopping at epoch 1000. Best Recall: 0.0599
2026-05-20 08:32:40,902 - optuna.study.study - INFO - Trial 189 finished with value: 0.05989864903422261 and parameters: {'n_layers': 1, 'embedding_dim': 128, 'lr': 0.0003217648896208776, 'lambda_val': 3.4465850658311508e-06, 'batch_size': 571, 'optimizer': 'RMSprop'}. Best is trial 157 with value: 0.06390748000357267.
2026-05-20 08:32:54,425 - optuna.study._optimize - INFO - Trial 190 pruned. 
2026-05-20 08:33:14,889 - experiment_functions - INFO - Early stopping at epoch 1600. Best Recall: 0.0616
2026-05-20 08:33:14,966 - optuna.study.study - INFO - Trial 191 finished with value: 0.0615683814750949 and parameters: {'n_layers': 1, 'embedding_dim': 128, 'lr': 0.0002546771601751023, 'lambda_val': 1.339863660107026e-06, 'batch_size': 720, 'optimizer': 'RMSprop'}. Best is trial 157 with value: 0.06390748000357267.
2026-05-20 08:33:34,885 - optuna.study._optimize - INFO - Trial 192 pruned. 
2026-05-20 08:33:48,255 - optuna.study._optimize - INFO - Trial 193 pruned. 
2026-05-20 08:34:00,605 - experiment_functions - INFO - Early stopping at epoch 900. Best Recall: 0.0574
2026-05-20 08:34:00,683 - optuna.study.study - INFO - Trial 194 finished with value: 0.05737772644868526 and parameters: {'n_layers': 1, 'embedding_dim': 128, 'lr': 0.00040880019041046394, 'lambda_val': 4.063897676652063e-06, 'batch_size': 802, 'optimizer': 'RMSprop'}. Best is trial 157 with value: 0.06390748000357267.
2026-05-20 08:34:14,656 - optuna.study._optimize - INFO - Trial 195 pruned. 
2026-05-20 08:34:27,863 - optuna.study._optimize - INFO - Trial 196 pruned. 
2026-05-20 08:34:41,748 - optuna.study._optimize - INFO - Trial 197 pruned. 
2026-05-20 08:34:55,953 - optuna.study._optimize - INFO - Trial 198 pruned. 
2026-05-20 08:35:09,026 - optuna.study._optimize - INFO - Trial 199 pruned. 
2026-05-20 08:35:23,411 - experiment_functions - INFO - Early stopping at epoch 1050. Best Recall: 0.0596
2026-05-20 08:35:23,500 - optuna.study.study - INFO - Trial 200 finished with value: 0.059638888936246394 and parameters: {'n_layers': 1, 'embedding_dim': 128, 'lr': 0.0003616892932384492, 'lambda_val': 1.9610323747311185e-06, 'batch_size': 617, 'optimizer': 'RMSprop'}. Best is trial 157 with value: 0.06390748000357267.
2026-05-20 08:35:45,072 - experiment_functions - INFO - Early stopping at epoch 1700. Best Recall: 0.0611
2026-05-20 08:35:45,161 - optuna.study.study - INFO - Trial 201 finished with value: 0.06114781002009328 and parameters: {'n_layers': 1, 'embedding_dim': 128, 'lr': 0.0002529180615994001, 'lambda_val': 1.475873487380767e-06, 'batch_size': 728, 'optimizer': 'RMSprop'}. Best is trial 157 with value: 0.06390748000357267.
2026-05-20 08:36:04,630 - experiment_functions - INFO - Early stopping at epoch 1500. Best Recall: 0.0604
2026-05-20 08:36:04,721 - optuna.study.study - INFO - Trial 202 finished with value: 0.06039925854288229 and parameters: {'n_layers': 1, 'embedding_dim': 128, 'lr': 0.00024713969624228096, 'lambda_val': 1.3282540147279559e-06, 'batch_size': 775, 'optimizer': 'RMSprop'}. Best is trial 157 with value: 0.06390748000357267.
2026-05-20 08:36:19,503 - optuna.study._optimize - INFO - Trial 203 pruned. 
2026-05-20 08:36:34,239 - optuna.study._optimize - INFO - Trial 204 pruned. 
2026-05-20 08:36:47,954 - optuna.study._optimize - INFO - Trial 205 pruned. 
2026-05-20 08:37:01,346 - optuna.study._optimize - INFO - Trial 206 pruned. 
2026-05-20 08:37:17,782 - experiment_functions - INFO - Early stopping at epoch 750. Best Recall: 0.0571
2026-05-20 08:37:18,542 - optuna.study.study - INFO - Trial 207 finished with value: 0.05714027871724291 and parameters: {'n_layers': 1, 'embedding_dim': 128, 'lr': 0.00046350651694805693, 'lambda_val': 5.0440019578861605e-06, 'batch_size': 588, 'optimizer': 'RMSprop'}. Best is trial 157 with value: 0.06390748000357267.
2026-05-20 08:37:35,957 - optuna.study._optimize - INFO - Trial 208 pruned. 
2026-05-20 08:37:48,986 - optuna.study._optimize - INFO - Trial 209 pruned. 
2026-05-20 08:37:55,952 - experiment_functions - INFO - Early stopping at epoch 500. Best Recall: 0.0050
2026-05-20 08:37:56,041 - optuna.study.study - INFO - Trial 210 finished with value: 0.005013761640115538 and parameters: {'n_layers': 1, 'embedding_dim': 64, 'lr': 0.00030047790412634525, 'lambda_val': 8.403147869482628e-06, 'batch_size': 665, 'optimizer': 'SGD'}. Best is trial 157 with value: 0.06390748000357267.
2026-05-20 08:38:15,440 - experiment_functions - INFO - Early stopping at epoch 1450. Best Recall: 0.0612
2026-05-20 08:38:15,518 - optuna.study.study - INFO - Trial 211 finished with value: 0.0611852009545165 and parameters: {'n_layers': 1, 'embedding_dim': 128, 'lr': 0.00025350843277812204, 'lambda_val': 1.4648682398794532e-06, 'batch_size': 720, 'optimizer': 'RMSprop'}. Best is trial 157 with value: 0.06390748000357267.
2026-05-20 08:38:29,137 - optuna.study._optimize - INFO - Trial 212 pruned. 
2026-05-20 08:38:42,877 - experiment_functions - INFO - Early stopping at epoch 1000. Best Recall: 0.0600
2026-05-20 08:38:42,985 - optuna.study.study - INFO - Trial 213 finished with value: 0.060000843166989545 and parameters: {'n_layers': 1, 'embedding_dim': 128, 'lr': 0.00036534526048350737, 'lambda_val': 1.8633206263458942e-06, 'batch_size': 823, 'optimizer': 'RMSprop'}. Best is trial 157 with value: 0.06390748000357267.
2026-05-20 08:38:56,819 - optuna.study._optimize - INFO - Trial 214 pruned. 
2026-05-20 08:39:17,282 - experiment_functions - INFO - Early stopping at epoch 1550. Best Recall: 0.0620
2026-05-20 08:39:17,415 - optuna.study.study - INFO - Trial 215 finished with value: 0.061951859806044784 and parameters: {'n_layers': 1, 'embedding_dim': 128, 'lr': 0.00026594826485814037, 'lambda_val': 2.6334757669207725e-06, 'batch_size': 656, 'optimizer': 'RMSprop'}. Best is trial 157 with value: 0.06390748000357267.
2026-05-20 08:39:38,616 - experiment_functions - INFO - Early stopping at epoch 1600. Best Recall: 0.0618
2026-05-20 08:39:38,705 - optuna.study.study - INFO - Trial 216 finished with value: 0.06178513261371239 and parameters: {'n_layers': 1, 'embedding_dim': 128, 'lr': 0.0002537100612318253, 'lambda_val': 4.446564658701466e-06, 'batch_size': 603, 'optimizer': 'RMSprop'}. Best is trial 157 with value: 0.06390748000357267.
2026-05-20 08:40:00,235 - experiment_functions - INFO - Early stopping at epoch 1600. Best Recall: 0.0604
2026-05-20 08:40:00,312 - optuna.study.study - INFO - Trial 217 finished with value: 0.06039100095921998 and parameters: {'n_layers': 1, 'embedding_dim': 128, 'lr': 0.00026405485600836456, 'lambda_val': 3.184586432480818e-06, 'batch_size': 590, 'optimizer': 'RMSprop'}. Best is trial 157 with value: 0.06390748000357267.
2026-05-20 08:40:35,913 - experiment_functions - INFO - Early stopping at epoch 2750. Best Recall: 0.0634
2026-05-20 08:40:35,992 - optuna.study.study - INFO - Trial 218 finished with value: 0.0633793776822729 and parameters: {'n_layers': 1, 'embedding_dim': 128, 'lr': 0.000208407988968352, 'lambda_val': 4.535006726696789e-06, 'batch_size': 635, 'optimizer': 'RMSprop'}. Best is trial 157 with value: 0.06390748000357267.
2026-05-20 08:41:14,960 - experiment_functions - INFO - Early stopping at epoch 3050. Best Recall: 0.0617
2026-05-20 08:41:15,049 - optuna.study.study - INFO - Trial 219 finished with value: 0.06173321145047651 and parameters: {'n_layers': 1, 'embedding_dim': 128, 'lr': 0.00021217604635024375, 'lambda_val': 6.657623489570825e-06, 'batch_size': 521, 'optimizer': 'RMSprop'}. Best is trial 157 with value: 0.06390748000357267.
2026-05-20 08:41:28,190 - optuna.study._optimize - INFO - Trial 220 pruned. 
2026-05-20 08:41:46,015 - optuna.study._optimize - INFO - Trial 221 pruned. 
2026-05-20 08:42:03,250 - optuna.study._optimize - INFO - Trial 222 pruned. 
2026-05-20 08:42:16,556 - optuna.study._optimize - INFO - Trial 223 pruned. 
2026-05-20 08:42:43,963 - experiment_functions - INFO - Early stopping at epoch 2100. Best Recall: 0.0627
2026-05-20 08:42:44,174 - optuna.study.study - INFO - Trial 224 finished with value: 0.06271481009387361 and parameters: {'n_layers': 1, 'embedding_dim': 128, 'lr': 0.0002534873873985574, 'lambda_val': 5.6410368510980845e-06, 'batch_size': 532, 'optimizer': 'RMSprop'}. Best is trial 157 with value: 0.06390748000357267.
2026-05-20 08:43:28,187 - experiment_functions - INFO - Early stopping at epoch 2650. Best Recall: 0.0630
2026-05-20 08:43:28,277 - optuna.study.study - INFO - Trial 225 finished with value: 0.06300562869402891 and parameters: {'n_layers': 1, 'embedding_dim': 128, 'lr': 0.00021073601360753914, 'lambda_val': 5.935966678811341e-06, 'batch_size': 520, 'optimizer': 'RMSprop'}. Best is trial 157 with value: 0.06390748000357267.
2026-05-20 08:43:41,845 - optuna.study._optimize - INFO - Trial 226 pruned. 
2026-05-20 08:43:59,496 - optuna.study._optimize - INFO - Trial 227 pruned. 
2026-05-20 08:44:18,087 - optuna.study._optimize - INFO - Trial 228 pruned. 
2026-05-20 08:44:30,862 - optuna.study._optimize - INFO - Trial 229 pruned. 
2026-05-20 08:44:44,428 - optuna.study._optimize - INFO - Trial 230 pruned. 
2026-05-20 08:45:05,135 - optuna.study._optimize - INFO - Trial 231 pruned. 
2026-05-20 08:45:18,407 - optuna.study._optimize - INFO - Trial 232 pruned. 
2026-05-20 08:45:35,907 - experiment_functions - INFO - Early stopping at epoch 1300. Best Recall: 0.0606
2026-05-20 08:45:36,039 - optuna.study.study - INFO - Trial 233 finished with value: 0.06058152376550341 and parameters: {'n_layers': 1, 'embedding_dim': 128, 'lr': 0.00030989430853389766, 'lambda_val': 3.65678629726471e-06, 'batch_size': 651, 'optimizer': 'RMSprop'}. Best is trial 157 with value: 0.06390748000357267.
2026-05-20 08:45:54,252 - optuna.study._optimize - INFO - Trial 234 pruned. 
2026-05-20 08:46:07,758 - optuna.study._optimize - INFO - Trial 235 pruned. 
2026-05-20 08:46:21,429 - optuna.study._optimize - INFO - Trial 236 pruned. 
2026-05-20 08:46:44,600 - experiment_functions - INFO - Early stopping at epoch 1200. Best Recall: 0.0610
2026-05-20 08:46:44,670 - optuna.study.study - INFO - Trial 237 finished with value: 0.060987067751259304 and parameters: {'n_layers': 1, 'embedding_dim': 128, 'lr': 0.00028456354115170536, 'lambda_val': 5.890650523282235e-06, 'batch_size': 750, 'optimizer': 'RMSprop'}. Best is trial 157 with value: 0.06390748000357267.
2026-05-20 08:46:57,739 - optuna.study._optimize - INFO - Trial 238 pruned. 
2026-05-20 08:47:19,828 - optuna.study._optimize - INFO - Trial 239 pruned. 
2026-05-20 08:47:31,124 - experiment_functions - INFO - Early stopping at epoch 850. Best Recall: 0.0586
2026-05-20 08:47:31,217 - optuna.study.study - INFO - Trial 240 finished with value: 0.058607868945717255 and parameters: {'n_layers': 1, 'embedding_dim': 128, 'lr': 0.0004041324762025603, 'lambda_val': 7.570340510791513e-06, 'batch_size': 763, 'optimizer': 'RMSprop'}. Best is trial 157 with value: 0.06390748000357267.
2026-05-20 08:47:49,565 - experiment_functions - INFO - Early stopping at epoch 1350. Best Recall: 0.0607
2026-05-20 08:47:49,657 - optuna.study.study - INFO - Trial 241 finished with value: 0.060738165812863856 and parameters: {'n_layers': 1, 'embedding_dim': 128, 'lr': 0.0002675405760127773, 'lambda_val': 1.190698333516897e-06, 'batch_size': 720, 'optimizer': 'RMSprop'}. Best is trial 157 with value: 0.06390748000357267.
2026-05-20 08:48:03,605 - optuna.study._optimize - INFO - Trial 242 pruned. 
2026-05-20 08:48:17,084 - optuna.study._optimize - INFO - Trial 243 pruned. 
2026-05-20 08:48:24,196 - experiment_functions - INFO - Early stopping at epoch 500. Best Recall: 0.0053
2026-05-20 08:48:24,287 - optuna.study.study - INFO - Trial 244 finished with value: 0.005342273396734394 and parameters: {'n_layers': 1, 'embedding_dim': 128, 'lr': 0.00031555926005487513, 'lambda_val': 0.07717079233316107, 'batch_size': 2187, 'optimizer': 'RMSprop'}. Best is trial 157 with value: 0.06390748000357267.
2026-05-20 08:48:31,354 - experiment_functions - INFO - Early stopping at epoch 500. Best Recall: 0.0050
2026-05-20 08:48:31,446 - optuna.study.study - INFO - Trial 245 finished with value: 0.005049390206752058 and parameters: {'n_layers': 1, 'embedding_dim': 128, 'lr': 0.00016528991318641654, 'lambda_val': 1.0051036504958398e-06, 'batch_size': 710, 'optimizer': 'SGD'}. Best is trial 157 with value: 0.06390748000357267.
2026-05-20 08:48:45,183 - optuna.study._optimize - INFO - Trial 246 pruned. 
2026-05-20 08:48:58,535 - optuna.study._optimize - INFO - Trial 247 pruned. 
2026-05-20 08:49:12,290 - optuna.study._optimize - INFO - Trial 248 pruned. 
2026-05-20 08:49:25,750 - optuna.study._optimize - INFO - Trial 249 pruned. 
2026-05-20 08:49:48,050 - optuna.study._optimize - INFO - Trial 250 pruned. 
2026-05-20 08:50:04,743 - experiment_functions - INFO - Early stopping at epoch 1200. Best Recall: 0.0623
2026-05-20 08:50:04,824 - optuna.study.study - INFO - Trial 251 finished with value: 0.062251231489698196 and parameters: {'n_layers': 1, 'embedding_dim': 128, 'lr': 0.00035731765706735084, 'lambda_val': 3.3770083366715605e-06, 'batch_size': 512, 'optimizer': 'RMSprop'}. Best is trial 157 with value: 0.06390748000357267.
2026-05-20 08:50:17,924 - experiment_functions - INFO - Early stopping at epoch 950. Best Recall: 0.0595
2026-05-20 08:50:17,995 - optuna.study.study - INFO - Trial 252 finished with value: 0.05950410982722966 and parameters: {'n_layers': 1, 'embedding_dim': 96, 'lr': 0.0003715255504710152, 'lambda_val': 3.331682410950027e-06, 'batch_size': 577, 'optimizer': 'RMSprop'}. Best is trial 157 with value: 0.06390748000357267.
2026-05-20 08:50:32,450 - optuna.study._optimize - INFO - Trial 253 pruned. 
2026-05-20 08:50:48,688 - optuna.study._optimize - INFO - Trial 254 pruned. 
2026-05-20 08:51:11,455 - optuna.study._optimize - INFO - Trial 255 pruned. 
2026-05-20 08:51:23,628 - experiment_functions - INFO - Early stopping at epoch 850. Best Recall: 0.0587
2026-05-20 08:51:23,720 - optuna.study.study - INFO - Trial 256 finished with value: 0.05872250731028224 and parameters: {'n_layers': 1, 'embedding_dim': 128, 'lr': 0.00045446785732522287, 'lambda_val': 3.747366447332079e-06, 'batch_size': 637, 'optimizer': 'RMSprop'}. Best is trial 157 with value: 0.06390748000357267.
2026-05-20 08:51:48,658 - optuna.study._optimize - INFO - Trial 257 pruned. 
2026-05-20 08:52:03,084 - optuna.study._optimize - INFO - Trial 258 pruned. 
2026-05-20 08:52:17,708 - optuna.study._optimize - INFO - Trial 259 pruned. 
2026-05-20 08:52:31,369 - optuna.study._optimize - INFO - Trial 260 pruned. 
2026-05-20 08:52:45,704 - optuna.study._optimize - INFO - Trial 261 pruned. 
2026-05-20 08:52:59,186 - optuna.study._optimize - INFO - Trial 262 pruned. 
2026-05-20 08:53:14,305 - optuna.study._optimize - INFO - Trial 263 pruned. 
2026-05-20 08:53:30,018 - optuna.study._optimize - INFO - Trial 264 pruned. 
2026-05-20 08:53:46,683 - experiment_functions - INFO - Early stopping at epoch 900. Best Recall: 0.0573
2026-05-20 08:53:47,415 - optuna.study.study - INFO - Trial 265 finished with value: 0.05725052167418858 and parameters: {'n_layers': 1, 'embedding_dim': 128, 'lr': 0.0003773702820971829, 'lambda_val': 5.709242322852388e-06, 'batch_size': 598, 'optimizer': 'RMSprop'}. Best is trial 157 with value: 0.06390748000357267.
2026-05-20 08:53:54,430 - experiment_functions - INFO - Early stopping at epoch 500. Best Recall: 0.0043
2026-05-20 08:53:54,534 - optuna.study.study - INFO - Trial 266 finished with value: 0.004341089425458401 and parameters: {'n_layers': 1, 'embedding_dim': 128, 'lr': 0.00014629737887390885, 'lambda_val': 8.456292632996263e-06, 'batch_size': 727, 'optimizer': 'SGD'}. Best is trial 157 with value: 0.06390748000357267.
2026-05-20 08:54:08,160 - optuna.study._optimize - INFO - Trial 267 pruned. 
2026-05-20 08:54:22,971 - optuna.study._optimize - INFO - Trial 268 pruned. 
2026-05-20 08:54:40,464 - experiment_functions - INFO - Early stopping at epoch 800. Best Recall: 0.0586
2026-05-20 08:54:40,544 - optuna.study.study - INFO - Trial 269 finished with value: 0.05860687032423757 and parameters: {'n_layers': 1, 'embedding_dim': 128, 'lr': 0.0005188737295791281, 'lambda_val': 4.7300063375584065e-06, 'batch_size': 514, 'optimizer': 'RMSprop'}. Best is trial 157 with value: 0.06390748000357267.
2026-05-20 08:55:29,187 - experiment_functions - INFO - Early stopping at epoch 3750. Best Recall: 0.0625
2026-05-20 08:55:29,279 - optuna.study.study - INFO - Trial 270 finished with value: 0.062482516460479975 and parameters: {'n_layers': 1, 'embedding_dim': 128, 'lr': 0.00019952465142851283, 'lambda_val': 3.1828215077091843e-06, 'batch_size': 640, 'optimizer': 'RMSprop'}. Best is trial 157 with value: 0.06390748000357267.
2026-05-20 08:55:42,342 - optuna.study._optimize - INFO - Trial 271 pruned. 
2026-05-20 08:55:56,350 - optuna.study._optimize - INFO - Trial 272 pruned. 
2026-05-20 08:56:22,048 - optuna.study._optimize - INFO - Trial 273 pruned. 
2026-05-20 08:57:09,077 - experiment_functions - INFO - Early stopping at epoch 3150. Best Recall: 0.0625
2026-05-20 08:57:09,212 - optuna.study.study - INFO - Trial 274 finished with value: 0.06251193639077214 and parameters: {'n_layers': 1, 'embedding_dim': 128, 'lr': 0.0002011067473481707, 'lambda_val': 2.544486277149851e-06, 'batch_size': 745, 'optimizer': 'RMSprop'}. Best is trial 157 with value: 0.06390748000357267.
2026-05-20 08:57:23,056 - optuna.study._optimize - INFO - Trial 275 pruned. 
2026-05-20 08:57:37,205 - optuna.study._optimize - INFO - Trial 276 pruned. 
2026-05-20 08:57:50,550 - optuna.study._optimize - INFO - Trial 277 pruned. 
2026-05-20 08:58:14,330 - optuna.study._optimize - INFO - Trial 278 pruned. 
2026-05-20 08:58:27,454 - optuna.study._optimize - INFO - Trial 279 pruned. 
2026-05-20 08:58:40,806 - optuna.study._optimize - INFO - Trial 280 pruned. 
2026-05-20 08:58:49,887 - experiment_functions - INFO - Early stopping at epoch 600. Best Recall: 0.0056
2026-05-20 08:58:49,979 - optuna.study.study - INFO - Trial 281 finished with value: 0.005625777585604511 and parameters: {'n_layers': 1, 'embedding_dim': 128, 'lr': 1.471431506253426e-05, 'lambda_val': 2.7916438259473243e-06, 'batch_size': 746, 'optimizer': 'RMSprop'}. Best is trial 157 with value: 0.06390748000357267.
2026-05-20 08:59:05,574 - optuna.study._optimize - INFO - Trial 282 pruned. 
2026-05-20 08:59:25,759 - optuna.study._optimize - INFO - Trial 283 pruned. 
2026-05-20 08:59:39,709 - optuna.study._optimize - INFO - Trial 284 pruned. 
2026-05-20 08:59:53,526 - optuna.study._optimize - INFO - Trial 285 pruned. 
2026-05-20 09:00:07,606 - optuna.study._optimize - INFO - Trial 286 pruned. 
2026-05-20 09:00:22,725 - optuna.study._optimize - INFO - Trial 287 pruned. 
2026-05-20 09:00:36,012 - experiment_functions - INFO - Early stopping at epoch 500. Best Recall: 0.0054
2026-05-20 09:00:36,781 - optuna.study.study - INFO - Trial 288 finished with value: 0.005435554876423804 and parameters: {'n_layers': 1, 'embedding_dim': 128, 'lr': 0.0003335045380991954, 'lambda_val': 3.6855381703901894e-06, 'batch_size': 627, 'optimizer': 'SGD'}. Best is trial 157 with value: 0.06390748000357267.
2026-05-20 09:00:53,280 - optuna.study._optimize - INFO - Trial 289 pruned. 
2026-05-20 09:01:06,858 - optuna.study._optimize - INFO - Trial 290 pruned. 
2026-05-20 09:01:19,115 - experiment_functions - INFO - Early stopping at epoch 900. Best Recall: 0.0605
2026-05-20 09:01:19,243 - optuna.study.study - INFO - Trial 291 finished with value: 0.060486860356692145 and parameters: {'n_layers': 1, 'embedding_dim': 128, 'lr': 0.0004210735135803625, 'lambda_val': 2.9206740544672627e-06, 'batch_size': 574, 'optimizer': 'RMSprop'}. Best is trial 157 with value: 0.06390748000357267.
2026-05-20 09:01:42,729 - optuna.study._optimize - INFO - Trial 292 pruned. 
2026-05-20 09:01:56,793 - optuna.study._optimize - INFO - Trial 293 pruned. 
2026-05-20 09:02:10,499 - optuna.study._optimize - INFO - Trial 294 pruned. 
2026-05-20 09:02:23,741 - optuna.study._optimize - INFO - Trial 295 pruned. 
2026-05-20 09:02:37,546 - optuna.study._optimize - INFO - Trial 296 pruned. 
2026-05-20 09:02:49,957 - experiment_functions - INFO - Early stopping at epoch 900. Best Recall: 0.0565
2026-05-20 09:02:50,060 - optuna.study.study - INFO - Trial 297 finished with value: 0.056530755716431604 and parameters: {'n_layers': 1, 'embedding_dim': 128, 'lr': 0.0003405865494910946, 'lambda_val': 2.4008681594856963e-06, 'batch_size': 778, 'optimizer': 'RMSprop'}. Best is trial 157 with value: 0.06390748000357267.
2026-05-20 09:03:06,041 - optuna.study._optimize - INFO - Trial 298 pruned. 
