2026-05-20 06:46:30,587 - optuna.study.study - INFO - Trial 243 finished with value: 0.08288216500125682 and parameters: {'n_layers': 1, 'embedding_dim': 96, 'lr': 0.0016362720861367087, 'lambda_val': 0.0005110410863215237, 'batch_size': 573, 'optimizer': 'Adam'}. Best is trial 233 with value: 0.08806254815838281.
2026-05-20 06:46:46,453 - experiment_functions - INFO - Early stopping at epoch 1100. Best Recall: 0.0812
2026-05-20 06:46:46,587 - optuna.study.study - INFO - Trial 244 finished with value: 0.08122919079095034 and parameters: {'n_layers': 1, 'embedding_dim': 96, 'lr': 0.0008135824481887977, 'lambda_val': 0.0006154933106225978, 'batch_size': 812, 'optimizer': 'Adam'}. Best is trial 233 with value: 0.08806254815838281.
2026-05-20 06:46:59,221 - experiment_functions - INFO - Early stopping at epoch 800. Best Recall: 0.0806
2026-05-20 06:46:59,354 - optuna.study.study - INFO - Trial 245 finished with value: 0.08061293279784217 and parameters: {'n_layers': 1, 'embedding_dim': 96, 'lr': 0.0014543258622445286, 'lambda_val': 0.0004048816207161401, 'batch_size': 688, 'optimizer': 'Adam'}. Best is trial 233 with value: 0.08806254815838281.
2026-05-20 06:47:12,215 - experiment_functions - INFO - Early stopping at epoch 850. Best Recall: 0.0824
2026-05-20 06:47:12,304 - optuna.study.study - INFO - Trial 246 finished with value: 0.08235927159350792 and parameters: {'n_layers': 1, 'embedding_dim': 96, 'lr': 0.0011233610364541086, 'lambda_val': 0.0008449103524222648, 'batch_size': 743, 'optimizer': 'Adam'}. Best is trial 233 with value: 0.08806254815838281.
2026-05-20 06:47:28,207 - experiment_functions - INFO - Early stopping at epoch 1100. Best Recall: 0.0882
2026-05-20 06:47:28,289 - optuna.study.study - INFO - Trial 247 finished with value: 0.08823877032029015 and parameters: {'n_layers': 1, 'embedding_dim': 96, 'lr': 0.0008981573511903246, 'lambda_val': 0.00046265234421437134, 'batch_size': 602, 'optimizer': 'Adam'}. Best is trial 247 with value: 0.08823877032029015.
2026-05-20 06:47:44,576 - experiment_functions - INFO - Early stopping at epoch 1100. Best Recall: 0.0879
2026-05-20 06:47:44,666 - optuna.study.study - INFO - Trial 248 finished with value: 0.08787024256080288 and parameters: {'n_layers': 1, 'embedding_dim': 96, 'lr': 0.0008317975527823767, 'lambda_val': 0.0006412601014006248, 'batch_size': 651, 'optimizer': 'Adam'}. Best is trial 247 with value: 0.08823877032029015.
2026-05-20 06:47:54,306 - experiment_functions - INFO - Early stopping at epoch 600. Best Recall: 0.0618
2026-05-20 06:47:54,395 - optuna.study.study - INFO - Trial 249 finished with value: 0.06175192532022978 and parameters: {'n_layers': 2, 'embedding_dim': 96, 'lr': 0.0008687269397445875, 'lambda_val': 0.0007087838056720953, 'batch_size': 661, 'optimizer': 'RMSprop'}. Best is trial 247 with value: 0.08823877032029015.
2026-05-20 06:48:12,160 - experiment_functions - INFO - Early stopping at epoch 1250. Best Recall: 0.0825
2026-05-20 06:48:12,260 - optuna.study.study - INFO - Trial 250 finished with value: 0.08245247627416791 and parameters: {'n_layers': 1, 'embedding_dim': 96, 'lr': 0.0007821951940372182, 'lambda_val': 0.0010090918490141293, 'batch_size': 569, 'optimizer': 'Adam'}. Best is trial 247 with value: 0.08823877032029015.
2026-05-20 06:48:24,895 - experiment_functions - INFO - Early stopping at epoch 800. Best Recall: 0.0768
2026-05-20 06:48:24,994 - optuna.study.study - INFO - Trial 251 finished with value: 0.0767633934980481 and parameters: {'n_layers': 1, 'embedding_dim': 96, 'lr': 0.0009800459417682096, 'lambda_val': 0.0006058791611044312, 'batch_size': 1473, 'optimizer': 'Adam'}. Best is trial 247 with value: 0.08823877032029015.
2026-05-20 06:48:38,140 - experiment_functions - INFO - Early stopping at epoch 900. Best Recall: 0.0836
2026-05-20 06:48:38,219 - optuna.study.study - INFO - Trial 252 finished with value: 0.08359398388493211 and parameters: {'n_layers': 1, 'embedding_dim': 96, 'lr': 0.0011353452240236458, 'lambda_val': 0.0003756720488893689, 'batch_size': 631, 'optimizer': 'Adam'}. Best is trial 247 with value: 0.08823877032029015.
2026-05-20 06:48:50,857 - experiment_functions - INFO - Early stopping at epoch 850. Best Recall: 0.0831
2026-05-20 06:48:50,958 - optuna.study.study - INFO - Trial 253 finished with value: 0.08309480081244736 and parameters: {'n_layers': 1, 'embedding_dim': 96, 'lr': 0.001189787926898475, 'lambda_val': 0.0008170164609618844, 'batch_size': 662, 'optimizer': 'Adam'}. Best is trial 247 with value: 0.08823877032029015.
2026-05-20 06:49:02,259 - experiment_functions - INFO - Early stopping at epoch 750. Best Recall: 0.0864
2026-05-20 06:49:02,769 - optuna.study.study - INFO - Trial 254 finished with value: 0.0864470886996269 and parameters: {'n_layers': 1, 'embedding_dim': 96, 'lr': 0.0016466515275694723, 'lambda_val': 0.0003685290697568931, 'batch_size': 761, 'optimizer': 'Adam'}. Best is trial 247 with value: 0.08823877032029015.
2026-05-20 06:49:13,899 - experiment_functions - INFO - Early stopping at epoch 750. Best Recall: 0.0811
2026-05-20 06:49:13,966 - optuna.study.study - INFO - Trial 255 finished with value: 0.08114877954590301 and parameters: {'n_layers': 1, 'embedding_dim': 96, 'lr': 0.0016306885714470335, 'lambda_val': 0.0005912332999331018, 'batch_size': 860, 'optimizer': 'Adam'}. Best is trial 247 with value: 0.08823877032029015.
2026-05-20 06:49:25,087 - experiment_functions - INFO - Early stopping at epoch 750. Best Recall: 0.0824
2026-05-20 06:49:25,175 - optuna.study.study - INFO - Trial 256 finished with value: 0.0823531932817194 and parameters: {'n_layers': 1, 'embedding_dim': 32, 'lr': 0.0018300614542787847, 'lambda_val': 0.0005076107817384245, 'batch_size': 739, 'optimizer': 'Adam'}. Best is trial 247 with value: 0.08823877032029015.
2026-05-20 06:49:34,919 - experiment_functions - INFO - Early stopping at epoch 650. Best Recall: 0.0854
2026-05-20 06:49:35,009 - optuna.study.study - INFO - Trial 257 finished with value: 0.0853953222567316 and parameters: {'n_layers': 1, 'embedding_dim': 96, 'lr': 0.0023790107840551936, 'lambda_val': 0.0003399998339393911, 'batch_size': 824, 'optimizer': 'Adam'}. Best is trial 247 with value: 0.08823877032029015.
2026-05-20 06:49:45,359 - experiment_functions - INFO - Early stopping at epoch 650. Best Recall: 0.0756
2026-05-20 06:49:45,449 - optuna.study.study - INFO - Trial 258 finished with value: 0.07556819538228479 and parameters: {'n_layers': 1, 'embedding_dim': 96, 'lr': 0.0026653615373032824, 'lambda_val': 0.000331718257523882, 'batch_size': 917, 'optimizer': 'Adam'}. Best is trial 247 with value: 0.08823877032029015.
2026-05-20 06:49:55,368 - experiment_functions - INFO - Early stopping at epoch 650. Best Recall: 0.0853
2026-05-20 06:49:55,447 - optuna.study.study - INFO - Trial 259 finished with value: 0.08534331595129038 and parameters: {'n_layers': 1, 'embedding_dim': 96, 'lr': 0.0024811178675959397, 'lambda_val': 0.0002370994917715863, 'batch_size': 965, 'optimizer': 'Adam'}. Best is trial 247 with value: 0.08823877032029015.
2026-05-20 06:50:08,225 - experiment_functions - INFO - Early stopping at epoch 650. Best Recall: 0.0857
2026-05-20 06:50:08,359 - optuna.study.study - INFO - Trial 260 finished with value: 0.08570063221292547 and parameters: {'n_layers': 1, 'embedding_dim': 96, 'lr': 0.0025043763709952207, 'lambda_val': 0.0004224757360871139, 'batch_size': 966, 'optimizer': 'Adam'}. Best is trial 247 with value: 0.08823877032029015.
2026-05-20 06:50:18,235 - experiment_functions - INFO - Early stopping at epoch 650. Best Recall: 0.0836
2026-05-20 06:50:18,324 - optuna.study.study - INFO - Trial 261 finished with value: 0.0835849677196939 and parameters: {'n_layers': 1, 'embedding_dim': 96, 'lr': 0.0023128494549193206, 'lambda_val': 0.0003286586638475274, 'batch_size': 966, 'optimizer': 'Adam'}. Best is trial 247 with value: 0.08823877032029015.
2026-05-20 06:50:28,376 - experiment_functions - INFO - Early stopping at epoch 650. Best Recall: 0.0784
2026-05-20 06:50:28,465 - optuna.study.study - INFO - Trial 262 finished with value: 0.07839486602858146 and parameters: {'n_layers': 1, 'embedding_dim': 96, 'lr': 0.0022476865994918494, 'lambda_val': 0.00021310811909723955, 'batch_size': 1067, 'optimizer': 'Adam'}. Best is trial 247 with value: 0.08823877032029015.
2026-05-20 06:50:38,287 - experiment_functions - INFO - Early stopping at epoch 650. Best Recall: 0.0738
2026-05-20 06:50:38,386 - optuna.study.study - INFO - Trial 263 finished with value: 0.0738410926200605 and parameters: {'n_layers': 1, 'embedding_dim': 96, 'lr': 0.002926364350472987, 'lambda_val': 0.0004412754476331842, 'batch_size': 990, 'optimizer': 'Adam'}. Best is trial 247 with value: 0.08823877032029015.
2026-05-20 06:50:48,064 - experiment_functions - INFO - Early stopping at epoch 600. Best Recall: 0.0753
2026-05-20 06:50:48,155 - optuna.study.study - INFO - Trial 264 finished with value: 0.07525976781782336 and parameters: {'n_layers': 1, 'embedding_dim': 96, 'lr': 0.0031758194014629934, 'lambda_val': 0.0007346702114830364, 'batch_size': 850, 'optimizer': 'Adam'}. Best is trial 247 with value: 0.08823877032029015.
2026-05-20 06:50:58,151 - experiment_functions - INFO - Early stopping at epoch 650. Best Recall: 0.0840
2026-05-20 06:50:58,273 - optuna.study.study - INFO - Trial 265 finished with value: 0.08398690412245667 and parameters: {'n_layers': 1, 'embedding_dim': 96, 'lr': 0.002143746690151257, 'lambda_val': 0.00036898706889755296, 'batch_size': 948, 'optimizer': 'Adam'}. Best is trial 247 with value: 0.08823877032029015.
2026-05-20 06:51:07,884 - experiment_functions - INFO - Early stopping at epoch 650. Best Recall: 0.0783
2026-05-20 06:51:07,963 - optuna.study.study - INFO - Trial 266 finished with value: 0.07833353724955959 and parameters: {'n_layers': 1, 'embedding_dim': 96, 'lr': 0.002558724221628979, 'lambda_val': 0.00026174278205466395, 'batch_size': 1036, 'optimizer': 'Adam'}. Best is trial 247 with value: 0.08823877032029015.
2026-05-20 06:51:16,990 - experiment_functions - INFO - Early stopping at epoch 500. Best Recall: 0.0045
2026-05-20 06:51:17,068 - optuna.study.study - INFO - Trial 267 finished with value: 0.00454338948153753 and parameters: {'n_layers': 1, 'embedding_dim': 96, 'lr': 0.0019122590317262474, 'lambda_val': 0.0011425254610941992, 'batch_size': 830, 'optimizer': 'SGD'}. Best is trial 247 with value: 0.08823877032029015.
2026-05-20 06:51:38,160 - experiment_functions - INFO - Early stopping at epoch 750. Best Recall: 0.0801
2026-05-20 06:51:38,240 - optuna.study.study - INFO - Trial 268 finished with value: 0.08012050044394858 and parameters: {'n_layers': 1, 'embedding_dim': 96, 'lr': 0.0016144111421331666, 'lambda_val': 0.000506885880354343, 'batch_size': 931, 'optimizer': 'Adam'}. Best is trial 247 with value: 0.08823877032029015.
2026-05-20 06:51:48,815 - experiment_functions - INFO - Early stopping at epoch 700. Best Recall: 0.0792
2026-05-20 06:51:48,915 - optuna.study.study - INFO - Trial 269 finished with value: 0.07923211849704162 and parameters: {'n_layers': 1, 'embedding_dim': 96, 'lr': 0.0018371408164041174, 'lambda_val': 0.0001697716127866196, 'batch_size': 805, 'optimizer': 'Adam'}. Best is trial 247 with value: 0.08823877032029015.
2026-05-20 06:51:58,108 - experiment_functions - INFO - Early stopping at epoch 600. Best Recall: 0.0873
2026-05-20 06:51:58,253 - optuna.study.study - INFO - Trial 270 finished with value: 0.08733803424922698 and parameters: {'n_layers': 1, 'embedding_dim': 96, 'lr': 0.0036276824241711016, 'lambda_val': 0.0005420672309567453, 'batch_size': 891, 'optimizer': 'Adam'}. Best is trial 247 with value: 0.08823877032029015.
2026-05-20 06:52:07,796 - experiment_functions - INFO - Early stopping at epoch 550. Best Recall: 0.0525
2026-05-20 06:52:07,887 - optuna.study.study - INFO - Trial 271 finished with value: 0.05246954949256049 and parameters: {'n_layers': 3, 'embedding_dim': 96, 'lr': 0.00400842420180226, 'lambda_val': 0.0006954041912318839, 'batch_size': 882, 'optimizer': 'Adam'}. Best is trial 247 with value: 0.08823877032029015.
2026-05-20 06:52:21,705 - optuna.study._optimize - INFO - Trial 272 pruned. 
2026-05-20 06:52:31,725 - experiment_functions - INFO - Early stopping at epoch 650. Best Recall: 0.0804
2026-05-20 06:52:31,827 - optuna.study.study - INFO - Trial 273 finished with value: 0.08041944926433695 and parameters: {'n_layers': 1, 'embedding_dim': 96, 'lr': 0.0021887041048071626, 'lambda_val': 0.0005316649826019225, 'batch_size': 950, 'optimizer': 'Adam'}. Best is trial 247 with value: 0.08823877032029015.
2026-05-20 06:52:41,828 - experiment_functions - INFO - Early stopping at epoch 550. Best Recall: 0.0420
2026-05-20 06:52:41,929 - optuna.study.study - INFO - Trial 274 finished with value: 0.0420215895762875 and parameters: {'n_layers': 4, 'embedding_dim': 96, 'lr': 0.002489168923232766, 'lambda_val': 0.0006064163773534624, 'batch_size': 1048, 'optimizer': 'Adam'}. Best is trial 247 with value: 0.08823877032029015.
2026-05-20 06:52:53,674 - experiment_functions - INFO - Early stopping at epoch 650. Best Recall: 0.0824
2026-05-20 06:52:53,850 - optuna.study.study - INFO - Trial 275 finished with value: 0.08236974950070039 and parameters: {'n_layers': 1, 'embedding_dim': 96, 'lr': 0.002919407555502192, 'lambda_val': 0.0004495158783088115, 'batch_size': 796, 'optimizer': 'Adam'}. Best is trial 247 with value: 0.08823877032029015.
2026-05-20 06:53:05,154 - experiment_functions - INFO - Early stopping at epoch 750. Best Recall: 0.0821
2026-05-20 06:53:05,243 - optuna.study.study - INFO - Trial 276 finished with value: 0.08207187810751268 and parameters: {'n_layers': 1, 'embedding_dim': 96, 'lr': 0.0014637933978063186, 'lambda_val': 0.0010066112645659361, 'batch_size': 855, 'optimizer': 'Adam'}. Best is trial 247 with value: 0.08823877032029015.
2026-05-20 06:53:15,698 - experiment_functions - INFO - Early stopping at epoch 700. Best Recall: 0.0840
2026-05-20 06:53:15,787 - optuna.study.study - INFO - Trial 277 finished with value: 0.08402711099922121 and parameters: {'n_layers': 1, 'embedding_dim': 96, 'lr': 0.001882380741884402, 'lambda_val': 0.0003099734649900659, 'batch_size': 1257, 'optimizer': 'Adam'}. Best is trial 247 with value: 0.08823877032029015.
2026-05-20 06:53:26,774 - experiment_functions - INFO - Early stopping at epoch 700. Best Recall: 0.0861
2026-05-20 06:53:26,918 - optuna.study.study - INFO - Trial 278 finished with value: 0.08607773394212992 and parameters: {'n_layers': 1, 'embedding_dim': 32, 'lr': 0.002411652819760803, 'lambda_val': 0.0007743370462960069, 'batch_size': 765, 'optimizer': 'Adam'}. Best is trial 247 with value: 0.08823877032029015.
2026-05-20 06:53:35,762 - experiment_functions - INFO - Early stopping at epoch 600. Best Recall: 0.0755
2026-05-20 06:53:35,885 - optuna.study.study - INFO - Trial 279 finished with value: 0.07550937624972448 and parameters: {'n_layers': 1, 'embedding_dim': 32, 'lr': 0.003759692172981186, 'lambda_val': 0.0012703276476604848, 'batch_size': 791, 'optimizer': 'Adam'}. Best is trial 247 with value: 0.08823877032029015.
2026-05-20 06:53:45,598 - experiment_functions - INFO - Early stopping at epoch 650. Best Recall: 0.0780
2026-05-20 06:53:45,677 - optuna.study.study - INFO - Trial 280 finished with value: 0.07799084723564606 and parameters: {'n_layers': 1, 'embedding_dim': 32, 'lr': 0.002736047230786721, 'lambda_val': 0.0007029172327823162, 'batch_size': 920, 'optimizer': 'Adam'}. Best is trial 247 with value: 0.08823877032029015.
2026-05-20 06:53:57,762 - experiment_functions - INFO - Early stopping at epoch 700. Best Recall: 0.0784
2026-05-20 06:53:57,906 - optuna.study.study - INFO - Trial 281 finished with value: 0.07844617144316822 and parameters: {'n_layers': 1, 'embedding_dim': 32, 'lr': 0.002308349412085711, 'lambda_val': 0.0009384055150622602, 'batch_size': 743, 'optimizer': 'Adam'}. Best is trial 247 with value: 0.08823877032029015.
2026-05-20 06:54:12,863 - experiment_functions - INFO - Early stopping at epoch 800. Best Recall: 0.0878
2026-05-20 06:54:13,009 - optuna.study.study - INFO - Trial 282 finished with value: 0.08783037012155191 and parameters: {'n_layers': 1, 'embedding_dim': 32, 'lr': 0.0017003619621070447, 'lambda_val': 0.0007614916904267033, 'batch_size': 845, 'optimizer': 'Adam'}. Best is trial 247 with value: 0.08823877032029015.
2026-05-20 06:54:22,346 - experiment_functions - INFO - Early stopping at epoch 650. Best Recall: 0.0789
2026-05-20 06:54:22,447 - optuna.study.study - INFO - Trial 283 finished with value: 0.07885495688064824 and parameters: {'n_layers': 1, 'embedding_dim': 32, 'lr': 0.0033233895762346095, 'lambda_val': 0.0014107085931025565, 'batch_size': 871, 'optimizer': 'Adam'}. Best is trial 247 with value: 0.08823877032029015.
2026-05-20 06:54:33,477 - experiment_functions - INFO - Early stopping at epoch 750. Best Recall: 0.0773
2026-05-20 06:54:33,567 - optuna.study.study - INFO - Trial 284 finished with value: 0.07733054265953068 and parameters: {'n_layers': 1, 'embedding_dim': 32, 'lr': 0.002072786248055356, 'lambda_val': 0.0008461364006294724, 'batch_size': 760, 'optimizer': 'Adam'}. Best is trial 247 with value: 0.08823877032029015.
2026-05-20 06:54:46,259 - experiment_functions - INFO - Early stopping at epoch 850. Best Recall: 0.0896
2026-05-20 06:54:46,797 - optuna.study.study - INFO - Trial 285 finished with value: 0.08959664764408455 and parameters: {'n_layers': 1, 'embedding_dim': 32, 'lr': 0.00146747932643885, 'lambda_val': 0.0007489930825884691, 'batch_size': 841, 'optimizer': 'Adam'}. Best is trial 285 with value: 0.08959664764408455.
2026-05-20 06:54:59,531 - experiment_functions - INFO - Early stopping at epoch 850. Best Recall: 0.0818
2026-05-20 06:54:59,631 - optuna.study.study - INFO - Trial 286 finished with value: 0.08177042676521105 and parameters: {'n_layers': 1, 'embedding_dim': 32, 'lr': 0.0014007734527498451, 'lambda_val': 0.0007414447806083391, 'batch_size': 836, 'optimizer': 'Adam'}. Best is trial 285 with value: 0.08959664764408455.
2026-05-20 06:55:12,061 - experiment_functions - INFO - Early stopping at epoch 850. Best Recall: 0.0850
2026-05-20 06:55:12,139 - optuna.study.study - INFO - Trial 287 finished with value: 0.0850006389159678 and parameters: {'n_layers': 1, 'embedding_dim': 32, 'lr': 0.001389859943801634, 'lambda_val': 0.001087499909773717, 'batch_size': 782, 'optimizer': 'Adam'}. Best is trial 285 with value: 0.08959664764408455.
2026-05-20 06:55:24,425 - experiment_functions - INFO - Early stopping at epoch 850. Best Recall: 0.0807
2026-05-20 06:55:24,516 - optuna.study.study - INFO - Trial 288 finished with value: 0.08070687953062673 and parameters: {'n_layers': 1, 'embedding_dim': 32, 'lr': 0.0013872520408819105, 'lambda_val': 0.001858124068764515, 'batch_size': 799, 'optimizer': 'Adam'}. Best is trial 285 with value: 0.08959664764408455.
2026-05-20 06:55:36,268 - experiment_functions - INFO - Early stopping at epoch 750. Best Recall: 0.0853
2026-05-20 06:55:36,358 - optuna.study.study - INFO - Trial 289 finished with value: 0.08526450956538664 and parameters: {'n_layers': 1, 'embedding_dim': 32, 'lr': 0.0016439615589309733, 'lambda_val': 0.0012556334749951892, 'batch_size': 897, 'optimizer': 'Adam'}. Best is trial 285 with value: 0.08959664764408455.
2026-05-20 06:55:43,660 - experiment_functions - INFO - Early stopping at epoch 500. Best Recall: 0.0056
2026-05-20 06:55:43,739 - optuna.study.study - INFO - Trial 290 finished with value: 0.005627515812066108 and parameters: {'n_layers': 1, 'embedding_dim': 32, 'lr': 0.0016091222530827632, 'lambda_val': 0.0012784955066412857, 'batch_size': 890, 'optimizer': 'SGD'}. Best is trial 285 with value: 0.08959664764408455.
2026-05-20 06:55:56,864 - experiment_functions - INFO - Early stopping at epoch 900. Best Recall: 0.0805
2026-05-20 06:55:57,007 - optuna.study.study - INFO - Trial 291 finished with value: 0.08052840619584253 and parameters: {'n_layers': 1, 'embedding_dim': 32, 'lr': 0.0013599018143440667, 'lambda_val': 0.0009718014547953203, 'batch_size': 751, 'optimizer': 'Adam'}. Best is trial 285 with value: 0.08959664764408455.
2026-05-20 06:56:12,194 - experiment_functions - INFO - Early stopping at epoch 1000. Best Recall: 0.0870
2026-05-20 06:56:12,327 - optuna.study.study - INFO - Trial 292 finished with value: 0.08696136782490838 and parameters: {'n_layers': 1, 'embedding_dim': 32, 'lr': 0.001062576920555522, 'lambda_val': 0.0017413864310880202, 'batch_size': 842, 'optimizer': 'Adam'}. Best is trial 285 with value: 0.08959664764408455.
2026-05-20 06:56:28,493 - experiment_functions - INFO - Early stopping at epoch 1050. Best Recall: 0.0823
2026-05-20 06:56:28,592 - optuna.study.study - INFO - Trial 293 finished with value: 0.08226782102275185 and parameters: {'n_layers': 1, 'embedding_dim': 32, 'lr': 0.000967837593084611, 'lambda_val': 0.002092683306847814, 'batch_size': 859, 'optimizer': 'Adam'}. Best is trial 285 with value: 0.08959664764408455.
2026-05-20 06:56:42,415 - experiment_functions - INFO - Early stopping at epoch 900. Best Recall: 0.0786
2026-05-20 06:56:42,560 - optuna.study.study - INFO - Trial 294 finished with value: 0.07858021558350418 and parameters: {'n_layers': 1, 'embedding_dim': 32, 'lr': 0.0012020435330502256, 'lambda_val': 0.0012349880853329113, 'batch_size': 817, 'optimizer': 'Adam'}. Best is trial 285 with value: 0.08959664764408455.
2026-05-20 06:56:57,103 - optuna.study._optimize - INFO - Trial 295 pruned. 
2026-05-20 06:57:10,714 - optuna.study._optimize - INFO - Trial 296 pruned. 
2026-05-20 06:57:26,609 - experiment_functions - INFO - Early stopping at epoch 1050. Best Recall: 0.0850
