2026-05-20 00:52:10,887 - optuna.study._optimize - INFO - Trial 175 pruned. 
2026-05-20 00:52:25,662 - optuna.study._optimize - INFO - Trial 176 pruned. 
2026-05-20 00:52:38,939 - optuna.study._optimize - INFO - Trial 177 pruned. 
2026-05-20 00:52:54,117 - optuna.study._optimize - INFO - Trial 178 pruned. 
2026-05-20 00:53:08,332 - optuna.study._optimize - INFO - Trial 179 pruned. 
2026-05-20 00:53:21,039 - optuna.study._optimize - INFO - Trial 180 pruned. 
2026-05-20 00:53:34,475 - optuna.study._optimize - INFO - Trial 181 pruned. 
2026-05-20 00:53:58,835 - experiment_functions - INFO - Early stopping at epoch 1950. Best Recall: 0.0304
2026-05-20 00:53:58,938 - optuna.study.study - INFO - Trial 182 finished with value: 0.030442510235171503 and parameters: {'n_layers': 1, 'embedding_dim': 32, 'lr': 0.0006634954934940447, 'lambda_val': 1.5583204102202397e-06, 'batch_size': 521, 'optimizer': 'RMSprop'}. Best is trial 37 with value: 0.030943974763693986.
2026-05-20 00:54:13,843 - optuna.study._optimize - INFO - Trial 183 pruned. 
2026-05-20 00:54:26,907 - optuna.study._optimize - INFO - Trial 184 pruned. 
2026-05-20 00:54:40,178 - optuna.study._optimize - INFO - Trial 185 pruned. 
2026-05-20 00:54:56,058 - optuna.study._optimize - INFO - Trial 186 pruned. 
2026-05-20 00:55:08,806 - optuna.study._optimize - INFO - Trial 187 pruned. 
2026-05-20 00:55:22,422 - optuna.study._optimize - INFO - Trial 188 pruned. 
2026-05-20 00:55:36,721 - optuna.study._optimize - INFO - Trial 189 pruned. 
2026-05-20 00:55:43,648 - experiment_functions - INFO - Early stopping at epoch 500. Best Recall: 0.0047
2026-05-20 00:55:43,740 - optuna.study.study - INFO - Trial 190 finished with value: 0.004660705678816749 and parameters: {'n_layers': 1, 'embedding_dim': 32, 'lr': 0.00034467758573486257, 'lambda_val': 1.1896410255819735e-06, 'batch_size': 583, 'optimizer': 'SGD'}. Best is trial 37 with value: 0.030943974763693986.
2026-05-20 00:55:58,360 - optuna.study._optimize - INFO - Trial 191 pruned. 
2026-05-20 00:56:17,168 - experiment_functions - INFO - Early stopping at epoch 1450. Best Recall: 0.0308
2026-05-20 00:56:17,271 - optuna.study.study - INFO - Trial 192 finished with value: 0.030772631347789643 and parameters: {'n_layers': 1, 'embedding_dim': 32, 'lr': 0.0007260624100639453, 'lambda_val': 1.0270379031188263e-06, 'batch_size': 513, 'optimizer': 'RMSprop'}. Best is trial 37 with value: 0.030943974763693986.
2026-05-20 00:56:32,074 - optuna.study._optimize - INFO - Trial 193 pruned. 
2026-05-20 00:56:46,967 - optuna.study._optimize - INFO - Trial 194 pruned. 
2026-05-20 00:56:59,788 - optuna.study._optimize - INFO - Trial 195 pruned. 
2026-05-20 00:57:14,969 - optuna.study._optimize - INFO - Trial 196 pruned. 
2026-05-20 00:57:27,912 - optuna.study._optimize - INFO - Trial 197 pruned. 
2026-05-20 00:57:41,248 - optuna.study._optimize - INFO - Trial 198 pruned. 
2026-05-20 00:57:54,997 - optuna.study._optimize - INFO - Trial 199 pruned. 
2026-05-20 00:58:08,315 - optuna.study._optimize - INFO - Trial 200 pruned. 
2026-05-20 00:58:21,336 - optuna.study._optimize - INFO - Trial 201 pruned. 
2026-05-20 00:58:43,432 - experiment_functions - INFO - Early stopping at epoch 1750. Best Recall: 0.0307
2026-05-20 00:58:43,536 - optuna.study.study - INFO - Trial 202 finished with value: 0.0306971896676831 and parameters: {'n_layers': 1, 'embedding_dim': 32, 'lr': 0.0007482779188401392, 'lambda_val': 1.4350606651920264e-06, 'batch_size': 650, 'optimizer': 'RMSprop'}. Best is trial 37 with value: 0.030943974763693986.
2026-05-20 00:58:56,431 - optuna.study._optimize - INFO - Trial 203 pruned. 
2026-05-20 00:59:10,229 - optuna.study._optimize - INFO - Trial 204 pruned. 
2026-05-20 00:59:25,446 - optuna.study._optimize - INFO - Trial 205 pruned. 
2026-05-20 00:59:38,565 - optuna.study._optimize - INFO - Trial 206 pruned. 
2026-05-20 00:59:52,056 - optuna.study._optimize - INFO - Trial 207 pruned. 
2026-05-20 01:00:04,930 - optuna.study._optimize - INFO - Trial 208 pruned. 
2026-05-20 01:00:33,925 - experiment_functions - INFO - Early stopping at epoch 2250. Best Recall: 0.0306
2026-05-20 01:00:34,107 - optuna.study.study - INFO - Trial 209 finished with value: 0.030618000545394236 and parameters: {'n_layers': 1, 'embedding_dim': 32, 'lr': 0.0005361894497795822, 'lambda_val': 1.8689595652228334e-06, 'batch_size': 581, 'optimizer': 'RMSprop'}. Best is trial 37 with value: 0.030943974763693986.
2026-05-20 01:00:47,231 - optuna.study._optimize - INFO - Trial 210 pruned. 
2026-05-20 01:01:01,427 - optuna.study._optimize - INFO - Trial 211 pruned. 
2026-05-20 01:01:15,229 - optuna.study._optimize - INFO - Trial 212 pruned. 
2026-05-20 01:01:28,634 - optuna.study._optimize - INFO - Trial 213 pruned. 
2026-05-20 01:01:44,424 - optuna.study._optimize - INFO - Trial 214 pruned. 
2026-05-20 01:01:57,246 - optuna.study._optimize - INFO - Trial 215 pruned. 
2026-05-20 01:02:07,745 - experiment_functions - INFO - Early stopping at epoch 800. Best Recall: 0.0289
2026-05-20 01:02:07,838 - optuna.study.study - INFO - Trial 216 finished with value: 0.02888851735211981 and parameters: {'n_layers': 1, 'embedding_dim': 32, 'lr': 0.0010553280529853714, 'lambda_val': 2.1823143911285716e-06, 'batch_size': 622, 'optimizer': 'RMSprop'}. Best is trial 37 with value: 0.030943974763693986.
2026-05-20 01:02:21,421 - optuna.study._optimize - INFO - Trial 217 pruned. 
2026-05-20 01:02:34,408 - optuna.study._optimize - INFO - Trial 218 pruned. 
2026-05-20 01:02:47,854 - optuna.study._optimize - INFO - Trial 219 pruned. 
2026-05-20 01:03:01,532 - optuna.study._optimize - INFO - Trial 220 pruned. 
2026-05-20 01:03:15,243 - optuna.study._optimize - INFO - Trial 221 pruned. 
2026-05-20 01:03:34,711 - optuna.study._optimize - INFO - Trial 222 pruned. 
2026-05-20 01:03:48,189 - optuna.study._optimize - INFO - Trial 223 pruned. 
2026-05-20 01:03:54,986 - experiment_functions - INFO - Early stopping at epoch 500. Best Recall: 0.0049
2026-05-20 01:03:55,079 - optuna.study.study - INFO - Trial 224 finished with value: 0.004879782472970256 and parameters: {'n_layers': 1, 'embedding_dim': 32, 'lr': 0.0005482981187977057, 'lambda_val': 0.00219820965007349, 'batch_size': 591, 'optimizer': 'SGD'}. Best is trial 37 with value: 0.030943974763693986.
2026-05-20 01:04:08,653 - optuna.study._optimize - INFO - Trial 225 pruned. 
2026-05-20 01:04:22,054 - optuna.study._optimize - INFO - Trial 226 pruned. 
2026-05-20 01:04:34,472 - experiment_functions - INFO - Early stopping at epoch 900. Best Recall: 0.0299
2026-05-20 01:04:34,588 - optuna.study.study - INFO - Trial 227 finished with value: 0.02990060871313028 and parameters: {'n_layers': 1, 'embedding_dim': 32, 'lr': 0.0008635213811656605, 'lambda_val': 1.4900779086922716e-06, 'batch_size': 720, 'optimizer': 'RMSprop'}. Best is trial 37 with value: 0.030943974763693986.
2026-05-20 01:04:51,192 - optuna.study._optimize - INFO - Trial 228 pruned. 
2026-05-20 01:05:04,051 - optuna.study._optimize - INFO - Trial 229 pruned. 
2026-05-20 01:05:20,039 - optuna.study._optimize - INFO - Trial 230 pruned. 
2026-05-20 01:05:33,682 - optuna.study._optimize - INFO - Trial 231 pruned. 
2026-05-20 01:05:44,485 - experiment_functions - INFO - Early stopping at epoch 800. Best Recall: 0.0286
2026-05-20 01:05:44,650 - optuna.study.study - INFO - Trial 232 finished with value: 0.028644172335449435 and parameters: {'n_layers': 1, 'embedding_dim': 32, 'lr': 0.0010919658528685627, 'lambda_val': 1.2869089202398868e-06, 'batch_size': 636, 'optimizer': 'RMSprop'}. Best is trial 37 with value: 0.030943974763693986.
2026-05-20 01:05:58,564 - optuna.study._optimize - INFO - Trial 233 pruned. 
2026-05-20 01:06:12,480 - optuna.study._optimize - INFO - Trial 234 pruned. 
2026-05-20 01:06:26,604 - optuna.study._optimize - INFO - Trial 235 pruned. 
2026-05-20 01:06:40,492 - optuna.study._optimize - INFO - Trial 236 pruned. 
2026-05-20 01:06:53,727 - optuna.study._optimize - INFO - Trial 237 pruned. 
2026-05-20 01:07:11,243 - experiment_functions - INFO - Early stopping at epoch 1350. Best Recall: 0.0309
2026-05-20 01:07:11,335 - optuna.study.study - INFO - Trial 238 finished with value: 0.030934748786401307 and parameters: {'n_layers': 1, 'embedding_dim': 32, 'lr': 0.0006398334313932572, 'lambda_val': 2.0830311897287653e-06, 'batch_size': 512, 'optimizer': 'RMSprop'}. Best is trial 37 with value: 0.030943974763693986.
2026-05-20 01:07:38,691 - experiment_functions - INFO - Early stopping at epoch 2200. Best Recall: 0.0308
2026-05-20 01:07:38,806 - optuna.study.study - INFO - Trial 239 finished with value: 0.03081645489145349 and parameters: {'n_layers': 1, 'embedding_dim': 32, 'lr': 0.0004156545863489539, 'lambda_val': 2.3930545040395477e-06, 'batch_size': 652, 'optimizer': 'RMSprop'}. Best is trial 37 with value: 0.030943974763693986.
2026-05-20 01:07:52,988 - optuna.study._optimize - INFO - Trial 240 pruned. 
2026-05-20 01:08:16,903 - experiment_functions - INFO - Early stopping at epoch 1900. Best Recall: 0.0312
2026-05-20 01:08:17,010 - optuna.study.study - INFO - Trial 241 finished with value: 0.03121229047829421 and parameters: {'n_layers': 1, 'embedding_dim': 32, 'lr': 0.0004957662613774472, 'lambda_val': 2.1868721964609906e-06, 'batch_size': 513, 'optimizer': 'RMSprop'}. Best is trial 241 with value: 0.03121229047829421.
2026-05-20 01:08:32,962 - optuna.study._optimize - INFO - Trial 242 pruned. 
2026-05-20 01:08:47,948 - optuna.study._optimize - INFO - Trial 243 pruned. 
2026-05-20 01:09:12,680 - experiment_functions - INFO - Early stopping at epoch 2000. Best Recall: 0.0305
2026-05-20 01:09:12,784 - optuna.study.study - INFO - Trial 244 finished with value: 0.030481872228130785 and parameters: {'n_layers': 1, 'embedding_dim': 32, 'lr': 0.00043243303038240945, 'lambda_val': 2.454980875793229e-06, 'batch_size': 512, 'optimizer': 'RMSprop'}. Best is trial 241 with value: 0.03121229047829421.
2026-05-20 01:09:26,381 - optuna.study._optimize - INFO - Trial 245 pruned. 
2026-05-20 01:09:39,591 - optuna.study._optimize - INFO - Trial 246 pruned. 
2026-05-20 01:09:53,311 - optuna.study._optimize - INFO - Trial 247 pruned. 
2026-05-20 01:10:26,458 - experiment_functions - INFO - Early stopping at epoch 2700. Best Recall: 0.0306
2026-05-20 01:10:26,574 - optuna.study.study - INFO - Trial 248 finished with value: 0.030644192502727655 and parameters: {'n_layers': 1, 'embedding_dim': 32, 'lr': 0.0004647182279880579, 'lambda_val': 3.0401542866702852e-06, 'batch_size': 648, 'optimizer': 'RMSprop'}. Best is trial 241 with value: 0.03121229047829421.
2026-05-20 01:10:41,125 - optuna.study._optimize - INFO - Trial 249 pruned. 
2026-05-20 01:10:54,396 - optuna.study._optimize - INFO - Trial 250 pruned. 
2026-05-20 01:11:07,338 - experiment_functions - INFO - Early stopping at epoch 950. Best Recall: 0.0282
2026-05-20 01:11:07,441 - optuna.study.study - INFO - Trial 251 finished with value: 0.028195745101271458 and parameters: {'n_layers': 1, 'embedding_dim': 128, 'lr': 0.0006158417728573789, 'lambda_val': 1.9763138335258297e-06, 'batch_size': 657, 'optimizer': 'RMSprop'}. Best is trial 241 with value: 0.03121229047829421.
2026-05-20 01:11:20,819 - optuna.study._optimize - INFO - Trial 252 pruned. 
2026-05-20 01:11:34,060 - optuna.study._optimize - INFO - Trial 253 pruned. 
2026-05-20 01:11:48,688 - optuna.study._optimize - INFO - Trial 254 pruned. 
2026-05-20 01:11:55,851 - experiment_functions - INFO - Early stopping at epoch 500. Best Recall: 0.0057
2026-05-20 01:11:55,954 - optuna.study.study - INFO - Trial 255 finished with value: 0.005702813773936633 and parameters: {'n_layers': 1, 'embedding_dim': 32, 'lr': 0.00040128059721636594, 'lambda_val': 2.4572557381568315e-06, 'batch_size': 581, 'optimizer': 'SGD'}. Best is trial 241 with value: 0.03121229047829421.
2026-05-20 01:12:09,786 - optuna.study._optimize - INFO - Trial 256 pruned. 
2026-05-20 01:12:23,949 - optuna.study._optimize - INFO - Trial 257 pruned. 
2026-05-20 01:12:37,610 - optuna.study._optimize - INFO - Trial 258 pruned. 
2026-05-20 01:12:59,782 - optuna.study._optimize - INFO - Trial 259 pruned. 
2026-05-20 01:13:13,300 - optuna.study._optimize - INFO - Trial 260 pruned. 
2026-05-20 01:13:26,449 - optuna.study._optimize - INFO - Trial 261 pruned. 
2026-05-20 01:13:40,113 - optuna.study._optimize - INFO - Trial 262 pruned. 
2026-05-20 01:14:12,298 - experiment_functions - INFO - Early stopping at epoch 1850. Best Recall: 0.0305
2026-05-20 01:14:12,389 - optuna.study.study - INFO - Trial 263 finished with value: 0.030465725106673055 and parameters: {'n_layers': 1, 'embedding_dim': 32, 'lr': 0.0006684919753507072, 'lambda_val': 2.201224617297853e-06, 'batch_size': 512, 'optimizer': 'RMSprop'}. Best is trial 241 with value: 0.03121229047829421.
2026-05-20 01:14:34,472 - experiment_functions - INFO - Early stopping at epoch 1750. Best Recall: 0.0314
2026-05-20 01:14:34,573 - optuna.study.study - INFO - Trial 264 finished with value: 0.031420010681249416 and parameters: {'n_layers': 1, 'embedding_dim': 32, 'lr': 0.0007028236273820696, 'lambda_val': 2.473575536290199e-06, 'batch_size': 513, 'optimizer': 'RMSprop'}. Best is trial 264 with value: 0.031420010681249416.
2026-05-20 01:14:47,186 - optuna.study._optimize - INFO - Trial 265 pruned. 
2026-05-20 01:15:17,093 - experiment_functions - INFO - Early stopping at epoch 2500. Best Recall: 0.0306
2026-05-20 01:15:17,195 - optuna.study.study - INFO - Trial 266 finished with value: 0.030646453522213967 and parameters: {'n_layers': 1, 'embedding_dim': 32, 'lr': 0.0007334437064371323, 'lambda_val': 2.74431452718408e-06, 'batch_size': 513, 'optimizer': 'RMSprop'}. Best is trial 264 with value: 0.031420010681249416.
2026-05-20 01:15:29,412 - optuna.study._optimize - INFO - Trial 267 pruned. 
2026-05-20 01:15:42,120 - optuna.study._optimize - INFO - Trial 268 pruned. 
2026-05-20 01:15:55,290 - optuna.study._optimize - INFO - Trial 269 pruned. 
2026-05-20 01:16:08,885 - optuna.study._optimize - INFO - Trial 270 pruned. 
2026-05-20 01:16:48,154 - experiment_functions - INFO - Early stopping at epoch 2250. Best Recall: 0.0308
2026-05-20 01:16:48,476 - optuna.study.study - INFO - Trial 271 finished with value: 0.030815999018103057 and parameters: {'n_layers': 1, 'embedding_dim': 32, 'lr': 0.0005759261874941792, 'lambda_val': 3.7381125568148e-06, 'batch_size': 580, 'optimizer': 'RMSprop'}. Best is trial 264 with value: 0.031420010681249416.
2026-05-20 01:17:02,195 - optuna.study._optimize - INFO - Trial 272 pruned. 
2026-05-20 01:17:10,916 - experiment_functions - INFO - Early stopping at epoch 500. Best Recall: 0.0059
2026-05-20 01:17:11,017 - optuna.study.study - INFO - Trial 273 finished with value: 0.005892339119949648 and parameters: {'n_layers': 1, 'embedding_dim': 32, 'lr': 0.03492314354314271, 'lambda_val': 3.7905719709255757e-06, 'batch_size': 3411, 'optimizer': 'RMSprop'}. Best is trial 264 with value: 0.031420010681249416.
2026-05-20 01:17:25,005 - optuna.study._optimize - INFO - Trial 274 pruned. 
2026-05-20 01:17:32,697 - experiment_functions - INFO - Early stopping at epoch 550. Best Recall: 0.0213
2026-05-20 01:17:32,788 - optuna.study.study - INFO - Trial 275 finished with value: 0.021297089000426334 and parameters: {'n_layers': 2, 'embedding_dim': 32, 'lr': 0.0009551109888865935, 'lambda_val': 0.0002742295570504639, 'batch_size': 1604, 'optimizer': 'RMSprop'}. Best is trial 264 with value: 0.031420010681249416.
2026-05-20 01:17:40,112 - experiment_functions - INFO - Early stopping at epoch 500. Best Recall: 0.0058
2026-05-20 01:17:40,225 - optuna.study.study - INFO - Trial 276 finished with value: 0.005750777012223654 and parameters: {'n_layers': 1, 'embedding_dim': 32, 'lr': 0.0005973601077130212, 'lambda_val': 3.1543703532718715e-06, 'batch_size': 582, 'optimizer': 'SGD'}. Best is trial 264 with value: 0.031420010681249416.
2026-05-20 01:18:20,095 - experiment_functions - INFO - Early stopping at epoch 2300. Best Recall: 0.0310
2026-05-20 01:18:20,187 - optuna.study.study - INFO - Trial 277 finished with value: 0.031027763195292327 and parameters: {'n_layers': 1, 'embedding_dim': 32, 'lr': 0.00044933106784575237, 'lambda_val': 2.4207737882473154e-06, 'batch_size': 518, 'optimizer': 'RMSprop'}. Best is trial 264 with value: 0.031420010681249416.
2026-05-20 01:18:33,010 - experiment_functions - INFO - Early stopping at epoch 950. Best Recall: 0.0288
2026-05-20 01:18:33,099 - optuna.study.study - INFO - Trial 278 finished with value: 0.02881260903758811 and parameters: {'n_layers': 1, 'embedding_dim': 128, 'lr': 0.00041306526953174133, 'lambda_val': 6.113913109195511e-06, 'batch_size': 617, 'optimizer': 'RMSprop'}. Best is trial 264 with value: 0.031420010681249416.
2026-05-20 01:18:45,336 - experiment_functions - INFO - Early stopping at epoch 900. Best Recall: 0.0299
2026-05-20 01:18:45,440 - optuna.study.study - INFO - Trial 279 finished with value: 0.02991611932331482 and parameters: {'n_layers': 1, 'embedding_dim': 32, 'lr': 0.001155461230119968, 'lambda_val': 2.6432039934922383e-06, 'batch_size': 523, 'optimizer': 'RMSprop'}. Best is trial 264 with value: 0.031420010681249416.
2026-05-20 01:18:58,508 - optuna.study._optimize - INFO - Trial 280 pruned. 
2026-05-20 01:19:11,960 - optuna.study._optimize - INFO - Trial 281 pruned. 
2026-05-20 01:19:25,398 - optuna.study._optimize - INFO - Trial 282 pruned. 
2026-05-20 01:19:39,087 - optuna.study._optimize - INFO - Trial 283 pruned. 
2026-05-20 01:19:53,088 - optuna.study._optimize - INFO - Trial 284 pruned. 
2026-05-20 01:20:06,029 - optuna.study._optimize - INFO - Trial 285 pruned. 
2026-05-20 01:20:32,277 - experiment_functions - INFO - Early stopping at epoch 2050. Best Recall: 0.0310
2026-05-20 01:20:32,378 - optuna.study.study - INFO - Trial 286 finished with value: 0.0310259099227778 and parameters: {'n_layers': 1, 'embedding_dim': 32, 'lr': 0.0005429485090492118, 'lambda_val': 4.4206989859918645e-06, 'batch_size': 659, 'optimizer': 'RMSprop'}. Best is trial 264 with value: 0.031420010681249416.
2026-05-20 01:20:45,808 - optuna.study._optimize - INFO - Trial 287 pruned. 
2026-05-20 01:20:58,884 - optuna.study._optimize - INFO - Trial 288 pruned. 
2026-05-20 01:21:12,501 - optuna.study._optimize - INFO - Trial 289 pruned. 
2026-05-20 01:21:25,501 - optuna.study._optimize - INFO - Trial 290 pruned. 
2026-05-20 01:21:38,480 - optuna.study._optimize - INFO - Trial 291 pruned. 
2026-05-20 01:21:51,904 - optuna.study._optimize - INFO - Trial 292 pruned. 
2026-05-20 01:22:05,073 - optuna.study._optimize - INFO - Trial 293 pruned. 
2026-05-20 01:22:11,993 - experiment_functions - INFO - Early stopping at epoch 500. Best Recall: 0.0045
2026-05-20 01:22:12,094 - optuna.study.study - INFO - Trial 294 finished with value: 0.004461638320750967 and parameters: {'n_layers': 1, 'embedding_dim': 32, 'lr': 3.823959206360135e-05, 'lambda_val': 5.199363364155738e-06, 'batch_size': 751, 'optimizer': 'RMSprop'}. Best is trial 264 with value: 0.031420010681249416.
2026-05-20 01:22:28,477 - experiment_functions - INFO - Early stopping at epoch 1200. Best Recall: 0.0305
2026-05-20 01:22:28,585 - optuna.study.study - INFO - Trial 295 finished with value: 0.03053031884302179 and parameters: {'n_layers': 1, 'embedding_dim': 32, 'lr': 0.0008174882945182642, 'lambda_val': 3.5066737825674843e-06, 'batch_size': 634, 'optimizer': 'RMSprop'}. Best is trial 264 with value: 0.031420010681249416.
2026-05-20 01:22:41,767 - optuna.study._optimize - INFO - Trial 296 pruned. 
2026-05-20 01:22:53,837 - experiment_functions - INFO - Early stopping at epoch 900. Best Recall: 0.0288
2026-05-20 01:22:53,926 - optuna.study.study - INFO - Trial 297 finished with value: 0.028847761539978447 and parameters: {'n_layers': 1, 'embedding_dim': 32, 'lr': 0.0008259852804863063, 'lambda_val': 4.005983469537559e-06, 'batch_size': 827, 'optimizer': 'RMSprop'}. Best is trial 264 with value: 0.031420010681249416.
2026-05-20 01:23:07,130 - optuna.study._optimize - INFO - Trial 298 pruned. 
2026-05-20 01:23:20,113 - optuna.study._optimize - INFO - Trial 299 pruned. 
2026-05-20 01:23:20,114 - experiment_functions - INFO - Training the best model ... for e_1M_1c1dcs_strict
2026-05-20 01:23:33,154 - experiment_functions - INFO - Early stopping at epoch 1300. Best Recall: 0.0303
2026-05-20 01:23:33,928 - root - INFO -   ** Getting the trainable edges:
2026-05-20 01:23:33,949 - helper_functions - INFO -      Number of nodes: 4740
2026-05-20 01:23:33,950 - helper_functions - INFO -      Ratio: 0.4863533757438949
2026-05-20 01:23:33,950 - helper_functions - INFO -      Number of unique users: 3156
2026-05-20 01:23:33,950 - helper_functions - INFO -      Number of unique items: 1584
2026-05-20 01:23:33,950 - helper_functions - INFO -      Total dominant set edge: 234063
2026-05-20 01:23:33,950 - helper_functions - INFO -      Trainable edges: 187250.40000000002
2026-05-20 01:23:34,020 - root - INFO -   **** Getting 234063 dominant set edges
2026-05-20 01:23:34,151 - optuna.storages._rdb.storage - INFO - A new study created in RDB with name: Study_e_1M_1c1dcs
2026-05-20 01:23:42,115 - experiment_functions - INFO - Early stopping at epoch 500. Best Recall: 0.0055
2026-05-20 01:23:42,225 - optuna.study.study - INFO - Trial 0 finished with value: 0.0055234581973947865 and parameters: {'n_layers': 1, 'embedding_dim': 256, 'lr': 0.00023792170504027707, 'lambda_val': 0.0003938168403248559, 'batch_size': 596, 'optimizer': 'SGD'}. Best is trial 0 with value: 0.0055234581973947865.
2026-05-20 01:24:11,496 - experiment_functions - INFO - Early stopping at epoch 2300. Best Recall: 0.0247
