2026-05-20 05:26:14,119 - optuna.study.study - INFO - Trial 238 finished with value: 0.04808638613933664 and parameters: {'n_layers': 1, 'embedding_dim': 32, 'lr': 0.0005774254196824239, 'lambda_val': 1.103663565370046e-05, 'batch_size': 512, 'optimizer': 'RMSprop'}. Best is trial 198 with value: 0.04862970054600969.
2026-05-20 05:26:45,412 - experiment_functions - INFO - Early stopping at epoch 2400. Best Recall: 0.0478
2026-05-20 05:26:45,558 - optuna.study.study - INFO - Trial 239 finished with value: 0.04778291583818621 and parameters: {'n_layers': 1, 'embedding_dim': 32, 'lr': 0.0005467868583503099, 'lambda_val': 6.363001560844553e-06, 'batch_size': 604, 'optimizer': 'RMSprop'}. Best is trial 198 with value: 0.04862970054600969.
2026-05-20 05:27:01,709 - optuna.study._optimize - INFO - Trial 240 pruned. 
2026-05-20 05:27:37,299 - experiment_functions - INFO - Early stopping at epoch 2750. Best Recall: 0.0482
2026-05-20 05:27:37,443 - optuna.study.study - INFO - Trial 241 finished with value: 0.048224110980680454 and parameters: {'n_layers': 1, 'embedding_dim': 32, 'lr': 0.0004224159673831736, 'lambda_val': 0.00046961273753988496, 'batch_size': 583, 'optimizer': 'RMSprop'}. Best is trial 198 with value: 0.04862970054600969.
2026-05-20 05:28:18,522 - experiment_functions - INFO - Early stopping at epoch 3200. Best Recall: 0.0483
2026-05-20 05:28:18,646 - optuna.study.study - INFO - Trial 242 finished with value: 0.04826663763140932 and parameters: {'n_layers': 1, 'embedding_dim': 32, 'lr': 0.0003870553050082184, 'lambda_val': 8.109582274780033e-06, 'batch_size': 605, 'optimizer': 'RMSprop'}. Best is trial 198 with value: 0.04862970054600969.
2026-05-20 05:28:36,319 - optuna.study._optimize - INFO - Trial 243 pruned. 
2026-05-20 05:28:57,225 - optuna.study._optimize - INFO - Trial 244 pruned. 
2026-05-20 05:29:10,626 - optuna.study._optimize - INFO - Trial 245 pruned. 
2026-05-20 05:29:57,747 - experiment_functions - INFO - Early stopping at epoch 3750. Best Recall: 0.0482
2026-05-20 05:29:57,836 - optuna.study.study - INFO - Trial 246 finished with value: 0.04819048560761042 and parameters: {'n_layers': 1, 'embedding_dim': 32, 'lr': 0.0003904478413096992, 'lambda_val': 0.00037039351307543235, 'batch_size': 519, 'optimizer': 'RMSprop'}. Best is trial 198 with value: 0.04862970054600969.
2026-05-20 05:30:11,855 - optuna.study._optimize - INFO - Trial 247 pruned. 
2026-05-20 05:30:28,049 - optuna.study._optimize - INFO - Trial 248 pruned. 
2026-05-20 05:30:41,867 - optuna.study._optimize - INFO - Trial 249 pruned. 
2026-05-20 05:30:48,705 - experiment_functions - INFO - Early stopping at epoch 500. Best Recall: 0.0056
2026-05-20 05:30:48,807 - optuna.study.study - INFO - Trial 250 finished with value: 0.005605616286823808 and parameters: {'n_layers': 1, 'embedding_dim': 32, 'lr': 0.0006949010423473005, 'lambda_val': 1.0474816241327327e-05, 'batch_size': 689, 'optimizer': 'SGD'}. Best is trial 198 with value: 0.04862970054600969.
2026-05-20 05:31:02,523 - optuna.study._optimize - INFO - Trial 251 pruned. 
2026-05-20 05:31:15,947 - optuna.study._optimize - INFO - Trial 252 pruned. 
2026-05-20 05:31:29,702 - optuna.study._optimize - INFO - Trial 253 pruned. 
2026-05-20 05:31:43,041 - optuna.study._optimize - INFO - Trial 254 pruned. 
2026-05-20 05:31:56,420 - optuna.study._optimize - INFO - Trial 255 pruned. 
2026-05-20 05:32:12,262 - optuna.study._optimize - INFO - Trial 256 pruned. 
2026-05-20 05:32:45,711 - experiment_functions - INFO - Early stopping at epoch 2550. Best Recall: 0.0483
2026-05-20 05:32:45,801 - optuna.study.study - INFO - Trial 257 finished with value: 0.048258796852136354 and parameters: {'n_layers': 1, 'embedding_dim': 32, 'lr': 0.0005485338226262616, 'lambda_val': 1.1565194324270771e-05, 'batch_size': 581, 'optimizer': 'RMSprop'}. Best is trial 198 with value: 0.04862970054600969.
2026-05-20 05:33:12,365 - experiment_functions - INFO - Early stopping at epoch 2050. Best Recall: 0.0478
2026-05-20 05:33:12,435 - optuna.study.study - INFO - Trial 258 finished with value: 0.047759780547596796 and parameters: {'n_layers': 1, 'embedding_dim': 32, 'lr': 0.0007315663090177413, 'lambda_val': 1.1979410336620627e-05, 'batch_size': 572, 'optimizer': 'RMSprop'}. Best is trial 198 with value: 0.04862970054600969.
2026-05-20 05:33:30,493 - optuna.study._optimize - INFO - Trial 259 pruned. 
2026-05-20 05:33:41,084 - experiment_functions - INFO - Early stopping at epoch 750. Best Recall: 0.0433
2026-05-20 05:33:41,176 - optuna.study.study - INFO - Trial 260 finished with value: 0.04332458063722962 and parameters: {'n_layers': 1, 'embedding_dim': 256, 'lr': 0.0007237768862645851, 'lambda_val': 9.662350304973426e-06, 'batch_size': 580, 'optimizer': 'RMSprop'}. Best is trial 198 with value: 0.04862970054600969.
2026-05-20 05:33:55,572 - optuna.study._optimize - INFO - Trial 261 pruned. 
2026-05-20 05:34:10,787 - optuna.study._optimize - INFO - Trial 262 pruned. 
2026-05-20 05:34:22,457 - experiment_functions - INFO - Early stopping at epoch 850. Best Recall: 0.0456
2026-05-20 05:34:22,559 - optuna.study.study - INFO - Trial 263 finished with value: 0.045637312704011876 and parameters: {'n_layers': 1, 'embedding_dim': 128, 'lr': 0.0007360192663909535, 'lambda_val': 1.727377328159126e-05, 'batch_size': 530, 'optimizer': 'RMSprop'}. Best is trial 198 with value: 0.04862970054600969.
2026-05-20 05:34:34,966 - experiment_functions - INFO - Early stopping at epoch 950. Best Recall: 0.0457
2026-05-20 05:34:35,046 - optuna.study.study - INFO - Trial 264 finished with value: 0.04574117568806221 and parameters: {'n_layers': 1, 'embedding_dim': 32, 'lr': 0.0005614235504088839, 'lambda_val': 0.00365204788274633, 'batch_size': 712, 'optimizer': 'RMSprop'}. Best is trial 198 with value: 0.04862970054600969.
2026-05-20 05:34:50,593 - optuna.study._optimize - INFO - Trial 265 pruned. 
2026-05-20 05:35:17,601 - experiment_functions - INFO - Early stopping at epoch 2100. Best Recall: 0.0478
2026-05-20 05:35:17,737 - optuna.study.study - INFO - Trial 266 finished with value: 0.04778694142883232 and parameters: {'n_layers': 1, 'embedding_dim': 32, 'lr': 0.0005566292364822565, 'lambda_val': 5.3683744934082375e-06, 'batch_size': 629, 'optimizer': 'RMSprop'}. Best is trial 198 with value: 0.04862970054600969.
2026-05-20 05:35:37,064 - experiment_functions - INFO - Early stopping at epoch 1500. Best Recall: 0.0477
2026-05-20 05:35:37,164 - optuna.study.study - INFO - Trial 267 finished with value: 0.04765109950833937 and parameters: {'n_layers': 1, 'embedding_dim': 32, 'lr': 0.0005483683599414337, 'lambda_val': 5.602714400459928e-06, 'batch_size': 625, 'optimizer': 'RMSprop'}. Best is trial 198 with value: 0.04862970054600969.
2026-05-20 05:35:52,845 - optuna.study._optimize - INFO - Trial 268 pruned. 
2026-05-20 05:36:17,878 - experiment_functions - INFO - Early stopping at epoch 1950. Best Recall: 0.0476
2026-05-20 05:36:17,979 - optuna.study.study - INFO - Trial 269 finished with value: 0.04762008557547381 and parameters: {'n_layers': 1, 'embedding_dim': 32, 'lr': 0.0006165931670562806, 'lambda_val': 5.420137345775168e-06, 'batch_size': 669, 'optimizer': 'RMSprop'}. Best is trial 198 with value: 0.04862970054600969.
2026-05-20 05:37:02,426 - experiment_functions - INFO - Early stopping at epoch 3550. Best Recall: 0.0481
2026-05-20 05:37:02,515 - optuna.study.study - INFO - Trial 270 finished with value: 0.04809013476079271 and parameters: {'n_layers': 1, 'embedding_dim': 32, 'lr': 0.00040757035213148435, 'lambda_val': 1.1415643082380296e-05, 'batch_size': 594, 'optimizer': 'RMSprop'}. Best is trial 198 with value: 0.04862970054600969.
2026-05-20 05:37:16,558 - optuna.study._optimize - INFO - Trial 271 pruned. 
2026-05-20 05:37:24,178 - experiment_functions - INFO - Early stopping at epoch 500. Best Recall: 0.0050
2026-05-20 05:37:24,259 - optuna.study.study - INFO - Trial 272 finished with value: 0.005041268476355119 and parameters: {'n_layers': 1, 'embedding_dim': 32, 'lr': 0.0003922403176991123, 'lambda_val': 1.65847514339532e-05, 'batch_size': 698, 'optimizer': 'SGD'}. Best is trial 198 with value: 0.04862970054600969.
2026-05-20 05:37:59,200 - experiment_functions - INFO - Early stopping at epoch 2750. Best Recall: 0.0479
2026-05-20 05:37:59,301 - optuna.study.study - INFO - Trial 273 finished with value: 0.04789437799438768 and parameters: {'n_layers': 1, 'embedding_dim': 32, 'lr': 0.0004933434934435148, 'lambda_val': 6.647804343484451e-06, 'batch_size': 605, 'optimizer': 'RMSprop'}. Best is trial 198 with value: 0.04862970054600969.
2026-05-20 05:38:41,392 - experiment_functions - INFO - Early stopping at epoch 2600. Best Recall: 0.0477
2026-05-20 05:38:41,482 - optuna.study.study - INFO - Trial 274 finished with value: 0.04774850270814504 and parameters: {'n_layers': 1, 'embedding_dim': 32, 'lr': 0.0004572141202345248, 'lambda_val': 6.483031688633428e-06, 'batch_size': 638, 'optimizer': 'RMSprop'}. Best is trial 198 with value: 0.04862970054600969.
2026-05-20 05:38:54,849 - optuna.study._optimize - INFO - Trial 275 pruned. 
2026-05-20 05:39:07,945 - optuna.study._optimize - INFO - Trial 276 pruned. 
2026-05-20 05:39:22,144 - optuna.study._optimize - INFO - Trial 277 pruned. 
2026-05-20 05:39:35,842 - optuna.study._optimize - INFO - Trial 278 pruned. 
2026-05-20 05:39:42,761 - experiment_functions - INFO - Early stopping at epoch 500. Best Recall: 0.0053
2026-05-20 05:39:42,852 - optuna.study.study - INFO - Trial 279 finished with value: 0.005264783682399615 and parameters: {'n_layers': 1, 'embedding_dim': 32, 'lr': 6.038366536486483e-05, 'lambda_val': 5.12903585143532e-06, 'batch_size': 514, 'optimizer': 'RMSprop'}. Best is trial 198 with value: 0.04862970054600969.
2026-05-20 05:39:55,992 - optuna.study._optimize - INFO - Trial 280 pruned. 
2026-05-20 05:40:31,989 - experiment_functions - INFO - Early stopping at epoch 2850. Best Recall: 0.0479
2026-05-20 05:40:32,068 - optuna.study.study - INFO - Trial 281 finished with value: 0.047945629197130676 and parameters: {'n_layers': 1, 'embedding_dim': 32, 'lr': 0.0004983706691630109, 'lambda_val': 4.646587302763752e-06, 'batch_size': 648, 'optimizer': 'RMSprop'}. Best is trial 198 with value: 0.04862970054600969.
2026-05-20 05:40:38,998 - experiment_functions - INFO - Early stopping at epoch 500. Best Recall: 0.0046
2026-05-20 05:40:39,088 - optuna.study.study - INFO - Trial 282 finished with value: 0.004604595169117438 and parameters: {'n_layers': 1, 'embedding_dim': 32, 'lr': 0.0007150041254894619, 'lambda_val': 0.09905537971660255, 'batch_size': 719, 'optimizer': 'RMSprop'}. Best is trial 198 with value: 0.04862970054600969.
2026-05-20 05:40:59,924 - optuna.study._optimize - INFO - Trial 283 pruned. 
2026-05-20 05:41:20,821 - optuna.study._optimize - INFO - Trial 284 pruned. 
2026-05-20 05:41:33,925 - experiment_functions - INFO - Early stopping at epoch 950. Best Recall: 0.0439
2026-05-20 05:41:34,059 - optuna.study.study - INFO - Trial 285 finished with value: 0.043914934903466984 and parameters: {'n_layers': 1, 'embedding_dim': 256, 'lr': 0.0003910747563200166, 'lambda_val': 0.0005350702692000159, 'batch_size': 583, 'optimizer': 'RMSprop'}. Best is trial 198 with value: 0.04862970054600969.
2026-05-20 05:41:56,554 - experiment_functions - INFO - Early stopping at epoch 1700. Best Recall: 0.0479
2026-05-20 05:41:56,632 - optuna.study.study - INFO - Trial 286 finished with value: 0.04794449505489073 and parameters: {'n_layers': 1, 'embedding_dim': 32, 'lr': 0.000549733146880125, 'lambda_val': 1.0020088735470873e-05, 'batch_size': 697, 'optimizer': 'RMSprop'}. Best is trial 198 with value: 0.04862970054600969.
2026-05-20 05:42:10,377 - optuna.study._optimize - INFO - Trial 287 pruned. 
2026-05-20 05:42:55,324 - experiment_functions - INFO - Early stopping at epoch 2700. Best Recall: 0.0480
2026-05-20 05:42:55,457 - optuna.study.study - INFO - Trial 288 finished with value: 0.04797934075554292 and parameters: {'n_layers': 1, 'embedding_dim': 32, 'lr': 0.00039921900916322614, 'lambda_val': 9.955278472883542e-06, 'batch_size': 696, 'optimizer': 'RMSprop'}. Best is trial 198 with value: 0.04862970054600969.
2026-05-20 05:43:09,156 - optuna.study._optimize - INFO - Trial 289 pruned. 
2026-05-20 05:43:23,454 - optuna.study._optimize - INFO - Trial 290 pruned. 
2026-05-20 05:43:55,622 - experiment_functions - INFO - Early stopping at epoch 2100. Best Recall: 0.0480
2026-05-20 05:43:56,383 - optuna.study.study - INFO - Trial 291 finished with value: 0.04804412008828422 and parameters: {'n_layers': 1, 'embedding_dim': 32, 'lr': 0.0005047098489600672, 'lambda_val': 5.6879567330906e-06, 'batch_size': 632, 'optimizer': 'RMSprop'}. Best is trial 198 with value: 0.04862970054600969.
2026-05-20 05:44:14,486 - optuna.study._optimize - INFO - Trial 292 pruned. 
2026-05-20 05:44:48,756 - experiment_functions - INFO - Early stopping at epoch 2750. Best Recall: 0.0481
2026-05-20 05:44:48,833 - optuna.study.study - INFO - Trial 293 finished with value: 0.04811656498285678 and parameters: {'n_layers': 1, 'embedding_dim': 32, 'lr': 0.0005189716054529749, 'lambda_val': 4.032927974619894e-06, 'batch_size': 601, 'optimizer': 'RMSprop'}. Best is trial 198 with value: 0.04862970054600969.
2026-05-20 05:45:02,603 - optuna.study._optimize - INFO - Trial 294 pruned. 
2026-05-20 05:45:15,798 - optuna.study._optimize - INFO - Trial 295 pruned. 
2026-05-20 05:45:23,058 - experiment_functions - INFO - Early stopping at epoch 500. Best Recall: 0.0049
2026-05-20 05:45:23,215 - optuna.study.study - INFO - Trial 296 finished with value: 0.004920285945943364 and parameters: {'n_layers': 1, 'embedding_dim': 32, 'lr': 0.00023966888167296067, 'lambda_val': 3.826484404426522e-06, 'batch_size': 603, 'optimizer': 'SGD'}. Best is trial 198 with value: 0.04862970054600969.
2026-05-20 05:45:55,267 - experiment_functions - INFO - Early stopping at epoch 2550. Best Recall: 0.0478
2026-05-20 05:45:55,390 - optuna.study.study - INFO - Trial 297 finished with value: 0.047787575396766285 and parameters: {'n_layers': 1, 'embedding_dim': 32, 'lr': 0.0004976584854668264, 'lambda_val': 5.010564466544545e-06, 'batch_size': 638, 'optimizer': 'RMSprop'}. Best is trial 198 with value: 0.04862970054600969.
2026-05-20 05:46:08,590 - optuna.study._optimize - INFO - Trial 298 pruned. 
2026-05-20 05:46:22,663 - optuna.study._optimize - INFO - Trial 299 pruned. 
2026-05-20 05:46:22,664 - experiment_functions - INFO - Training the best model ... for e_1M_1c2dcs_strict
2026-05-20 05:46:53,985 - experiment_functions - INFO - Early stopping at epoch 3050. Best Recall: 0.0474
2026-05-20 05:46:54,809 - root - INFO -   ** Getting the trainable edges:
2026-05-20 05:46:54,829 - helper_functions - INFO -      Number of nodes: 4753
2026-05-20 05:46:54,829 - helper_functions - INFO -      Ratio: 0.48768725631028115
2026-05-20 05:46:54,830 - helper_functions - INFO -      Number of unique users: 3162
2026-05-20 05:46:54,830 - helper_functions - INFO -      Number of unique items: 1591
2026-05-20 05:46:54,830 - helper_functions - INFO -      Total dominant set edge: 249067
2026-05-20 05:46:54,830 - helper_functions - INFO -      Trainable edges: 199253.6
2026-05-20 05:46:54,895 - root - INFO -   **** Getting 249067 dominant set edges
2026-05-20 05:46:56,074 - optuna.storages._rdb.storage - INFO - A new study created in RDB with name: Study_e_1M_1c2dcs
2026-05-20 05:47:27,729 - experiment_functions - INFO - Early stopping at epoch 1350. Best Recall: 0.0324
2026-05-20 05:47:27,820 - optuna.study.study - INFO - Trial 0 finished with value: 0.03240033117065637 and parameters: {'n_layers': 4, 'embedding_dim': 64, 'lr': 0.021420727604801106, 'lambda_val': 2.2360337212539334e-06, 'batch_size': 1159, 'optimizer': 'Adam'}. Best is trial 0 with value: 0.03240033117065637.
2026-05-20 05:48:27,946 - optuna.study.study - INFO - Trial 1 finished with value: 0.06434497425169697 and parameters: {'n_layers': 2, 'embedding_dim': 32, 'lr': 0.0002325718540557919, 'lambda_val': 4.19211668934582e-06, 'batch_size': 1545, 'optimizer': 'Adam'}. Best is trial 1 with value: 0.06434497425169697.
2026-05-20 05:48:44,607 - experiment_functions - INFO - Early stopping at epoch 1000. Best Recall: 0.0704
2026-05-20 05:48:44,655 - optuna.study.study - INFO - Trial 2 finished with value: 0.07043403085328187 and parameters: {'n_layers': 2, 'embedding_dim': 96, 'lr': 0.0003486321873866954, 'lambda_val': 2.563627856378285e-05, 'batch_size': 1780, 'optimizer': 'Adam'}. Best is trial 2 with value: 0.07043403085328187.
2026-05-20 05:49:40,671 - optuna.study.study - INFO - Trial 3 finished with value: 0.01815020116785237 and parameters: {'n_layers': 4, 'embedding_dim': 32, 'lr': 0.006029977541878792, 'lambda_val': 0.008036545020092344, 'batch_size': 2540, 'optimizer': 'RMSprop'}. Best is trial 2 with value: 0.07043403085328187.
2026-05-20 05:50:40,448 - optuna.study.study - INFO - Trial 4 finished with value: 0.039952631117560866 and parameters: {'n_layers': 3, 'embedding_dim': 32, 'lr': 0.00018921047694687025, 'lambda_val': 0.00021520669452199738, 'batch_size': 3632, 'optimizer': 'Adam'}. Best is trial 2 with value: 0.07043403085328187.
2026-05-20 05:50:47,532 - experiment_functions - INFO - Early stopping at epoch 500. Best Recall: 0.0052
2026-05-20 05:50:47,623 - optuna.study.study - INFO - Trial 5 finished with value: 0.005240237253152266 and parameters: {'n_layers': 1, 'embedding_dim': 96, 'lr': 5.1360024315165986e-05, 'lambda_val': 7.705654004486766e-06, 'batch_size': 912, 'optimizer': 'RMSprop'}. Best is trial 2 with value: 0.07043403085328187.
2026-05-20 05:51:31,884 - experiment_functions - INFO - Early stopping at epoch 2450. Best Recall: 0.0417
2026-05-20 05:51:31,953 - optuna.study.study - INFO - Trial 6 finished with value: 0.04174031525654869 and parameters: {'n_layers': 4, 'embedding_dim': 32, 'lr': 0.005435064789258487, 'lambda_val': 7.032899431349742e-05, 'batch_size': 4019, 'optimizer': 'RMSprop'}. Best is trial 2 with value: 0.07043403085328187.
2026-05-20 05:51:47,834 - optuna.study._optimize - INFO - Trial 7 pruned. 
2026-05-20 05:52:01,685 - experiment_functions - INFO - Early stopping at epoch 850. Best Recall: 0.0347
2026-05-20 05:52:01,851 - optuna.study.study - INFO - Trial 8 finished with value: 0.034709167784317124 and parameters: {'n_layers': 3, 'embedding_dim': 96, 'lr': 0.00029631203127689895, 'lambda_val': 0.02310940851172179, 'batch_size': 2885, 'optimizer': 'RMSprop'}. Best is trial 2 with value: 0.07043403085328187.
2026-05-20 05:52:26,057 - experiment_functions - INFO - Early stopping at epoch 1000. Best Recall: 0.0823
2026-05-20 05:52:26,150 - optuna.study.study - INFO - Trial 9 finished with value: 0.08229338784389838 and parameters: {'n_layers': 1, 'embedding_dim': 128, 'lr': 0.000746271917335899, 'lambda_val': 0.0015022321216390168, 'batch_size': 964, 'optimizer': 'Adam'}. Best is trial 9 with value: 0.08229338784389838.
2026-05-20 05:52:34,137 - experiment_functions - INFO - Early stopping at epoch 500. Best Recall: 0.0050
2026-05-20 05:52:34,228 - optuna.study.study - INFO - Trial 10 finished with value: 0.004983306777563901 and parameters: {'n_layers': 1, 'embedding_dim': 128, 'lr': 1.1043981633072085e-05, 'lambda_val': 0.0021086245746744807, 'batch_size': 587, 'optimizer': 'SGD'}. Best is trial 9 with value: 0.08229338784389838.
2026-05-20 05:52:44,986 - experiment_functions - INFO - Early stopping at epoch 600. Best Recall: 0.0724
2026-05-20 05:52:45,097 - optuna.study.study - INFO - Trial 11 finished with value: 0.07241321407955341 and parameters: {'n_layers': 2, 'embedding_dim': 256, 'lr': 0.0012161913077760576, 'lambda_val': 0.001164654975188141, 'batch_size': 1748, 'optimizer': 'Adam'}. Best is trial 9 with value: 0.08229338784389838.
2026-05-20 05:52:56,487 - experiment_functions - INFO - Early stopping at epoch 700. Best Recall: 0.0733
2026-05-20 05:52:56,587 - optuna.study.study - INFO - Trial 12 finished with value: 0.07331772859890848 and parameters: {'n_layers': 1, 'embedding_dim': 256, 'lr': 0.0014875541715959287, 'lambda_val': 0.0014635301688454491, 'batch_size': 1956, 'optimizer': 'Adam'}. Best is trial 9 with value: 0.08229338784389838.
2026-05-20 05:53:04,003 - experiment_functions - INFO - Early stopping at epoch 500. Best Recall: 0.0047
2026-05-20 05:53:04,093 - optuna.study.study - INFO - Trial 13 finished with value: 0.0046910509536697105 and parameters: {'n_layers': 1, 'embedding_dim': 128, 'lr': 0.0014585737762326531, 'lambda_val': 0.060334223524056915, 'batch_size': 2160, 'optimizer': 'SGD'}. Best is trial 9 with value: 0.08229338784389838.
2026-05-20 05:53:13,240 - experiment_functions - INFO - Early stopping at epoch 550. Best Recall: 0.0194
2026-05-20 05:53:13,319 - optuna.study.study - INFO - Trial 14 finished with value: 0.019419447504328734 and parameters: {'n_layers': 1, 'embedding_dim': 256, 'lr': 0.05176948264706716, 'lambda_val': 0.0015502214509042307, 'batch_size': 1273, 'optimizer': 'Adam'}. Best is trial 9 with value: 0.08229338784389838.
2026-05-20 05:53:22,315 - experiment_functions - INFO - Early stopping at epoch 550. Best Recall: 0.0666
2026-05-20 05:53:22,404 - optuna.study.study - INFO - Trial 15 finished with value: 0.0665528951365396 and parameters: {'n_layers': 2, 'embedding_dim': 128, 'lr': 0.0042585598699244505, 'lambda_val': 0.000332081899713341, 'batch_size': 2263, 'optimizer': 'Adam'}. Best is trial 9 with value: 0.08229338784389838.
2026-05-20 05:53:30,370 - experiment_functions - INFO - Early stopping at epoch 500. Best Recall: 0.0058
2026-05-20 05:53:30,469 - optuna.study.study - INFO - Trial 16 finished with value: 0.005753221807317437 and parameters: {'n_layers': 1, 'embedding_dim': 256, 'lr': 0.0008897424662367533, 'lambda_val': 0.00684647621077895, 'batch_size': 632, 'optimizer': 'SGD'}. Best is trial 9 with value: 0.08229338784389838.
2026-05-20 05:53:38,905 - experiment_functions - INFO - Early stopping at epoch 550. Best Recall: 0.0494
