2026-05-20 06:36:18,720 - optuna.study.study - INFO - Trial 191 finished with value: 0.08538019458624269 and parameters: {'n_layers': 1, 'embedding_dim': 96, 'lr': 0.0012213112339151458, 'lambda_val': 0.0005580831029153827, 'batch_size': 784, 'optimizer': 'Adam'}. Best is trial 191 with value: 0.08538019458624269.
2026-05-20 06:36:31,034 - experiment_functions - INFO - Early stopping at epoch 800. Best Recall: 0.0861
2026-05-20 06:36:31,124 - optuna.study.study - INFO - Trial 192 finished with value: 0.08607669627838585 and parameters: {'n_layers': 1, 'embedding_dim': 96, 'lr': 0.0013677161566821023, 'lambda_val': 0.0006163601607789588, 'batch_size': 810, 'optimizer': 'Adam'}. Best is trial 192 with value: 0.08607669627838585.
2026-05-20 06:36:43,086 - experiment_functions - INFO - Early stopping at epoch 800. Best Recall: 0.0829
2026-05-20 06:36:43,302 - optuna.study.study - INFO - Trial 193 finished with value: 0.08290629544386281 and parameters: {'n_layers': 1, 'embedding_dim': 96, 'lr': 0.0012297578135524354, 'lambda_val': 0.0006295074673869884, 'batch_size': 796, 'optimizer': 'Adam'}. Best is trial 192 with value: 0.08607669627838585.
2026-05-20 06:36:55,864 - experiment_functions - INFO - Early stopping at epoch 800. Best Recall: 0.0824
2026-05-20 06:36:55,998 - optuna.study.study - INFO - Trial 194 finished with value: 0.08241407466143208 and parameters: {'n_layers': 1, 'embedding_dim': 96, 'lr': 0.0013222625534954526, 'lambda_val': 0.0005540465910688447, 'batch_size': 815, 'optimizer': 'Adam'}. Best is trial 192 with value: 0.08607669627838585.
2026-05-20 06:37:07,896 - experiment_functions - INFO - Early stopping at epoch 750. Best Recall: 0.0821
2026-05-20 06:37:08,031 - optuna.study.study - INFO - Trial 195 finished with value: 0.08212120138829755 and parameters: {'n_layers': 1, 'embedding_dim': 96, 'lr': 0.0014629226555499014, 'lambda_val': 0.0006573511194961932, 'batch_size': 910, 'optimizer': 'Adam'}. Best is trial 192 with value: 0.08607669627838585.
2026-05-20 06:37:20,724 - experiment_functions - INFO - Early stopping at epoch 850. Best Recall: 0.0780
2026-05-20 06:37:20,803 - optuna.study.study - INFO - Trial 196 finished with value: 0.07795076383422338 and parameters: {'n_layers': 1, 'embedding_dim': 96, 'lr': 0.0010655681497261107, 'lambda_val': 0.0007160901323626123, 'batch_size': 854, 'optimizer': 'Adam'}. Best is trial 192 with value: 0.08607669627838585.
2026-05-20 06:37:28,185 - experiment_functions - INFO - Early stopping at epoch 500. Best Recall: 0.0052
2026-05-20 06:37:28,275 - optuna.study.study - INFO - Trial 197 finished with value: 0.0052277680378835035 and parameters: {'n_layers': 1, 'embedding_dim': 96, 'lr': 0.001329606877701612, 'lambda_val': 0.0005480820127349755, 'batch_size': 772, 'optimizer': 'SGD'}. Best is trial 192 with value: 0.08607669627838585.
2026-05-20 06:37:39,153 - experiment_functions - INFO - Early stopping at epoch 700. Best Recall: 0.0844
2026-05-20 06:37:39,296 - optuna.study.study - INFO - Trial 198 finished with value: 0.08442828602100372 and parameters: {'n_layers': 1, 'embedding_dim': 96, 'lr': 0.001743031514540767, 'lambda_val': 0.00045595675040714136, 'batch_size': 998, 'optimizer': 'Adam'}. Best is trial 192 with value: 0.08607669627838585.
2026-05-20 06:37:50,639 - experiment_functions - INFO - Early stopping at epoch 700. Best Recall: 0.0846
2026-05-20 06:37:50,727 - optuna.study.study - INFO - Trial 199 finished with value: 0.08464535799920873 and parameters: {'n_layers': 1, 'embedding_dim': 96, 'lr': 0.0017940654141388266, 'lambda_val': 0.0004626776196840312, 'batch_size': 1033, 'optimizer': 'Adam'}. Best is trial 192 with value: 0.08607669627838585.
2026-05-20 06:38:01,228 - experiment_functions - INFO - Early stopping at epoch 700. Best Recall: 0.0821
2026-05-20 06:38:01,329 - optuna.study.study - INFO - Trial 200 finished with value: 0.08214463445393165 and parameters: {'n_layers': 1, 'embedding_dim': 96, 'lr': 0.0017693654509783852, 'lambda_val': 0.00044797910576763905, 'batch_size': 1009, 'optimizer': 'Adam'}. Best is trial 192 with value: 0.08607669627838585.
2026-05-20 06:38:12,537 - experiment_functions - INFO - Early stopping at epoch 750. Best Recall: 0.0798
2026-05-20 06:38:12,627 - optuna.study.study - INFO - Trial 201 finished with value: 0.0797885981699898 and parameters: {'n_layers': 1, 'embedding_dim': 96, 'lr': 0.0015969853695277632, 'lambda_val': 0.0003293211134890472, 'batch_size': 1090, 'optimizer': 'Adam'}. Best is trial 192 with value: 0.08607669627838585.
2026-05-20 06:38:23,853 - experiment_functions - INFO - Early stopping at epoch 700. Best Recall: 0.0829
2026-05-20 06:38:23,952 - optuna.study.study - INFO - Trial 202 finished with value: 0.08290803263097317 and parameters: {'n_layers': 1, 'embedding_dim': 96, 'lr': 0.0018404583029991545, 'lambda_val': 0.000464031793220263, 'batch_size': 733, 'optimizer': 'Adam'}. Best is trial 192 with value: 0.08607669627838585.
2026-05-20 06:38:34,768 - experiment_functions - INFO - Early stopping at epoch 700. Best Recall: 0.0862
2026-05-20 06:38:34,869 - optuna.study.study - INFO - Trial 203 finished with value: 0.08617706393145354 and parameters: {'n_layers': 1, 'embedding_dim': 96, 'lr': 0.002082140965684289, 'lambda_val': 0.0003973686330260163, 'batch_size': 721, 'optimizer': 'Adam'}. Best is trial 203 with value: 0.08617706393145354.
2026-05-20 06:38:48,229 - experiment_functions - INFO - Early stopping at epoch 900. Best Recall: 0.0772
2026-05-20 06:38:48,330 - optuna.study.study - INFO - Trial 204 finished with value: 0.07720249819961651 and parameters: {'n_layers': 1, 'embedding_dim': 96, 'lr': 0.0010354935047270834, 'lambda_val': 0.0003724888314868682, 'batch_size': 923, 'optimizer': 'Adam'}. Best is trial 203 with value: 0.08617706393145354.
2026-05-20 06:38:58,438 - experiment_functions - INFO - Early stopping at epoch 650. Best Recall: 0.0811
2026-05-20 06:38:58,731 - optuna.study.study - INFO - Trial 205 finished with value: 0.08112379048540845 and parameters: {'n_layers': 1, 'embedding_dim': 96, 'lr': 0.002072297863949089, 'lambda_val': 0.00031169619189680273, 'batch_size': 1117, 'optimizer': 'Adam'}. Best is trial 203 with value: 0.08617706393145354.
2026-05-20 06:39:11,004 - experiment_functions - INFO - Early stopping at epoch 800. Best Recall: 0.0858
2026-05-20 06:39:11,138 - optuna.study.study - INFO - Trial 206 finished with value: 0.0857751165468259 and parameters: {'n_layers': 1, 'embedding_dim': 96, 'lr': 0.0015121211127937422, 'lambda_val': 0.00048465108394386163, 'batch_size': 673, 'optimizer': 'Adam'}. Best is trial 203 with value: 0.08617706393145354.
2026-05-20 06:39:22,433 - experiment_functions - INFO - Early stopping at epoch 750. Best Recall: 0.0879
2026-05-20 06:39:22,515 - optuna.study.study - INFO - Trial 207 finished with value: 0.08790061885146223 and parameters: {'n_layers': 1, 'embedding_dim': 96, 'lr': 0.0015272933159822216, 'lambda_val': 0.0004628000710086229, 'batch_size': 692, 'optimizer': 'Adam'}. Best is trial 207 with value: 0.08790061885146223.
2026-05-20 06:39:32,036 - experiment_functions - INFO - Early stopping at epoch 600. Best Recall: 0.0691
2026-05-20 06:39:32,181 - optuna.study.study - INFO - Trial 208 finished with value: 0.06912665062127704 and parameters: {'n_layers': 1, 'embedding_dim': 96, 'lr': 0.001533626222534612, 'lambda_val': 0.00044933879043701134, 'batch_size': 659, 'optimizer': 'RMSprop'}. Best is trial 207 with value: 0.08790061885146223.
2026-05-20 06:39:42,244 - experiment_functions - INFO - Early stopping at epoch 650. Best Recall: 0.0773
2026-05-20 06:39:42,323 - optuna.study.study - INFO - Trial 209 finished with value: 0.07734577751860917 and parameters: {'n_layers': 1, 'embedding_dim': 96, 'lr': 0.0022799248317798646, 'lambda_val': 0.0002660286642654491, 'batch_size': 862, 'optimizer': 'Adam'}. Best is trial 207 with value: 0.08790061885146223.
2026-05-20 06:39:52,556 - experiment_functions - INFO - Early stopping at epoch 700. Best Recall: 0.0787
2026-05-20 06:39:52,634 - optuna.study.study - INFO - Trial 210 finished with value: 0.07866869259797994 and parameters: {'n_layers': 1, 'embedding_dim': 96, 'lr': 0.0018226453880104863, 'lambda_val': 0.0007753546151792709, 'batch_size': 1331, 'optimizer': 'Adam'}. Best is trial 207 with value: 0.08790061885146223.
2026-05-20 06:40:03,879 - experiment_functions - INFO - Early stopping at epoch 750. Best Recall: 0.0841
2026-05-20 06:40:03,980 - optuna.study.study - INFO - Trial 211 finished with value: 0.08406858775694757 and parameters: {'n_layers': 1, 'embedding_dim': 96, 'lr': 0.0015061089179037508, 'lambda_val': 0.0003841778484150791, 'batch_size': 723, 'optimizer': 'Adam'}. Best is trial 207 with value: 0.08790061885146223.
2026-05-20 06:40:15,199 - experiment_functions - INFO - Early stopping at epoch 750. Best Recall: 0.0797
2026-05-20 06:40:15,299 - optuna.study.study - INFO - Trial 212 finished with value: 0.07972628444939323 and parameters: {'n_layers': 1, 'embedding_dim': 96, 'lr': 0.0015427811338612973, 'lambda_val': 0.00038098886081233907, 'batch_size': 681, 'optimizer': 'Adam'}. Best is trial 207 with value: 0.08790061885146223.
2026-05-20 06:40:28,218 - experiment_functions - INFO - Early stopping at epoch 900. Best Recall: 0.0832
2026-05-20 06:40:28,308 - optuna.study.study - INFO - Trial 213 finished with value: 0.08316743991876008 and parameters: {'n_layers': 1, 'embedding_dim': 96, 'lr': 0.00117691364907882, 'lambda_val': 0.0005091144845832229, 'batch_size': 574, 'optimizer': 'Adam'}. Best is trial 207 with value: 0.08790061885146223.
2026-05-20 06:40:38,784 - experiment_functions - INFO - Early stopping at epoch 700. Best Recall: 0.0833
2026-05-20 06:40:38,862 - optuna.study.study - INFO - Trial 214 finished with value: 0.08330880923751788 and parameters: {'n_layers': 1, 'embedding_dim': 96, 'lr': 0.0019994256361384817, 'lambda_val': 0.0002992273299048671, 'batch_size': 749, 'optimizer': 'Adam'}. Best is trial 207 with value: 0.08790061885146223.
2026-05-20 06:40:49,271 - experiment_functions - INFO - Early stopping at epoch 700. Best Recall: 0.0815
2026-05-20 06:40:49,360 - optuna.study.study - INFO - Trial 215 finished with value: 0.08145297976086584 and parameters: {'n_layers': 1, 'embedding_dim': 96, 'lr': 0.0019741051559687443, 'lambda_val': 0.00029206260628982097, 'batch_size': 981, 'optimizer': 'Adam'}. Best is trial 207 with value: 0.08790061885146223.
2026-05-20 06:40:59,224 - experiment_functions - INFO - Early stopping at epoch 650. Best Recall: 0.0744
2026-05-20 06:40:59,359 - optuna.study.study - INFO - Trial 216 finished with value: 0.07439847539428973 and parameters: {'n_layers': 1, 'embedding_dim': 96, 'lr': 0.002482887689503664, 'lambda_val': 0.00047140344807967407, 'batch_size': 773, 'optimizer': 'Adam'}. Best is trial 207 with value: 0.08790061885146223.
2026-05-20 06:41:10,279 - experiment_functions - INFO - Early stopping at epoch 750. Best Recall: 0.0825
2026-05-20 06:41:10,369 - optuna.study.study - INFO - Trial 217 finished with value: 0.08253783834938269 and parameters: {'n_layers': 1, 'embedding_dim': 96, 'lr': 0.0015540008825000206, 'lambda_val': 0.0002312768852546343, 'batch_size': 713, 'optimizer': 'Adam'}. Best is trial 207 with value: 0.08790061885146223.
2026-05-20 06:41:20,712 - experiment_functions - INFO - Early stopping at epoch 700. Best Recall: 0.0812
2026-05-20 06:41:20,847 - optuna.study.study - INFO - Trial 218 finished with value: 0.08115628416578581 and parameters: {'n_layers': 1, 'embedding_dim': 96, 'lr': 0.001986103388449143, 'lambda_val': 0.00033968374506840456, 'batch_size': 821, 'optimizer': 'Adam'}. Best is trial 207 with value: 0.08790061885146223.
2026-05-20 06:41:33,314 - experiment_functions - INFO - Early stopping at epoch 800. Best Recall: 0.0847
2026-05-20 06:41:33,403 - optuna.study.study - INFO - Trial 219 finished with value: 0.08474575516825171 and parameters: {'n_layers': 1, 'embedding_dim': 96, 'lr': 0.001362234413414694, 'lambda_val': 0.0007670164772909804, 'batch_size': 739, 'optimizer': 'Adam'}. Best is trial 207 with value: 0.08790061885146223.
2026-05-20 06:41:44,768 - experiment_functions - INFO - Early stopping at epoch 750. Best Recall: 0.0787
2026-05-20 06:41:44,868 - optuna.study.study - INFO - Trial 220 finished with value: 0.07868998147757778 and parameters: {'n_layers': 1, 'embedding_dim': 96, 'lr': 0.0014088991265196267, 'lambda_val': 0.0006592333931252122, 'batch_size': 908, 'optimizer': 'Adam'}. Best is trial 207 with value: 0.08790061885146223.
2026-05-20 06:41:58,132 - experiment_functions - INFO - Early stopping at epoch 900. Best Recall: 0.0825
2026-05-20 06:41:58,244 - optuna.study.study - INFO - Trial 221 finished with value: 0.08245383035761335 and parameters: {'n_layers': 1, 'embedding_dim': 96, 'lr': 0.0011984515542823103, 'lambda_val': 0.0004201640967609192, 'batch_size': 701, 'optimizer': 'Adam'}. Best is trial 207 with value: 0.08790061885146223.
2026-05-20 06:42:10,125 - experiment_functions - INFO - Early stopping at epoch 750. Best Recall: 0.0793
2026-05-20 06:42:10,216 - optuna.study.study - INFO - Trial 222 finished with value: 0.07929874400428781 and parameters: {'n_layers': 1, 'embedding_dim': 96, 'lr': 0.0017216898840973194, 'lambda_val': 0.0008370323469860129, 'batch_size': 778, 'optimizer': 'Adam'}. Best is trial 207 with value: 0.08790061885146223.
2026-05-20 06:42:22,323 - experiment_functions - INFO - Early stopping at epoch 800. Best Recall: 0.0812
2026-05-20 06:42:22,469 - optuna.study.study - INFO - Trial 223 finished with value: 0.08116400430644273 and parameters: {'n_layers': 1, 'embedding_dim': 96, 'lr': 0.0013726182356409919, 'lambda_val': 0.0005158785147912798, 'batch_size': 606, 'optimizer': 'Adam'}. Best is trial 207 with value: 0.08790061885146223.
2026-05-20 06:42:32,932 - experiment_functions - INFO - Early stopping at epoch 700. Best Recall: 0.0801
2026-05-20 06:42:33,021 - optuna.study.study - INFO - Trial 224 finished with value: 0.08009240716901089 and parameters: {'n_layers': 1, 'embedding_dim': 96, 'lr': 0.002181322694101076, 'lambda_val': 0.0003601744107359711, 'batch_size': 664, 'optimizer': 'Adam'}. Best is trial 207 with value: 0.08790061885146223.
2026-05-20 06:42:47,133 - experiment_functions - INFO - Early stopping at epoch 950. Best Recall: 0.0865
2026-05-20 06:42:47,236 - optuna.study.study - INFO - Trial 225 finished with value: 0.08653345651240482 and parameters: {'n_layers': 1, 'embedding_dim': 96, 'lr': 0.0009936357795104758, 'lambda_val': 0.0007395772194659206, 'batch_size': 750, 'optimizer': 'Adam'}. Best is trial 207 with value: 0.08790061885146223.
2026-05-20 06:42:59,995 - experiment_functions - INFO - Early stopping at epoch 850. Best Recall: 0.0776
2026-05-20 06:43:00,063 - optuna.study.study - INFO - Trial 226 finished with value: 0.07756829193267639 and parameters: {'n_layers': 1, 'embedding_dim': 96, 'lr': 0.0010608024850035718, 'lambda_val': 0.0008736976663583687, 'batch_size': 882, 'optimizer': 'Adam'}. Best is trial 207 with value: 0.08790061885146223.
2026-05-20 06:43:14,900 - experiment_functions - INFO - Early stopping at epoch 1000. Best Recall: 0.0815
2026-05-20 06:43:14,978 - optuna.study.study - INFO - Trial 227 finished with value: 0.0814774804293154 and parameters: {'n_layers': 1, 'embedding_dim': 96, 'lr': 0.0009301304992220425, 'lambda_val': 0.0006990953751334003, 'batch_size': 752, 'optimizer': 'Adam'}. Best is trial 207 with value: 0.08790061885146223.
2026-05-20 06:43:26,259 - experiment_functions - INFO - Early stopping at epoch 750. Best Recall: 0.0809
2026-05-20 06:43:26,339 - optuna.study.study - INFO - Trial 228 finished with value: 0.08086943180750168 and parameters: {'n_layers': 1, 'embedding_dim': 96, 'lr': 0.0016009686234548658, 'lambda_val': 0.000579198504109755, 'batch_size': 845, 'optimizer': 'Adam'}. Best is trial 207 with value: 0.08790061885146223.
2026-05-20 06:43:35,270 - experiment_functions - INFO - Early stopping at epoch 600. Best Recall: 0.0753
2026-05-20 06:43:35,348 - optuna.study.study - INFO - Trial 229 finished with value: 0.07532352610943147 and parameters: {'n_layers': 1, 'embedding_dim': 96, 'lr': 0.0027726036049301396, 'lambda_val': 0.0004356179320915139, 'batch_size': 1010, 'optimizer': 'Adam'}. Best is trial 207 with value: 0.08790061885146223.
2026-05-20 06:43:47,742 - experiment_functions - INFO - Early stopping at epoch 800. Best Recall: 0.0829
2026-05-20 06:43:47,831 - optuna.study.study - INFO - Trial 230 finished with value: 0.08291756579979223 and parameters: {'n_layers': 1, 'embedding_dim': 96, 'lr': 0.0012754578101411246, 'lambda_val': 0.0007801275396115563, 'batch_size': 740, 'optimizer': 'Adam'}. Best is trial 207 with value: 0.08790061885146223.
2026-05-20 06:44:01,924 - experiment_functions - INFO - Early stopping at epoch 950. Best Recall: 0.0817
2026-05-20 06:44:02,084 - optuna.study.study - INFO - Trial 231 finished with value: 0.08173604691908308 and parameters: {'n_layers': 1, 'embedding_dim': 96, 'lr': 0.0010530826271635564, 'lambda_val': 0.00029405078622153267, 'batch_size': 597, 'optimizer': 'Adam'}. Best is trial 207 with value: 0.08790061885146223.
2026-05-20 06:44:12,799 - experiment_functions - INFO - Early stopping at epoch 700. Best Recall: 0.0830
2026-05-20 06:44:12,934 - optuna.study.study - INFO - Trial 232 finished with value: 0.0830146683139257 and parameters: {'n_layers': 1, 'embedding_dim': 96, 'lr': 0.001835012703168519, 'lambda_val': 0.0005170424976248519, 'batch_size': 663, 'optimizer': 'Adam'}. Best is trial 207 with value: 0.08790061885146223.
2026-05-20 06:44:25,905 - experiment_functions - INFO - Early stopping at epoch 850. Best Recall: 0.0881
2026-05-20 06:44:25,995 - optuna.study.study - INFO - Trial 233 finished with value: 0.08806254815838281 and parameters: {'n_layers': 1, 'embedding_dim': 96, 'lr': 0.0013439049946625367, 'lambda_val': 0.0003924661273326569, 'batch_size': 587, 'optimizer': 'Adam'}. Best is trial 233 with value: 0.08806254815838281.
2026-05-20 06:44:37,956 - experiment_functions - INFO - Early stopping at epoch 800. Best Recall: 0.0826
2026-05-20 06:44:38,046 - optuna.study.study - INFO - Trial 234 finished with value: 0.08256301801857674 and parameters: {'n_layers': 1, 'embedding_dim': 96, 'lr': 0.0014372864136617432, 'lambda_val': 0.00041346710147935984, 'batch_size': 807, 'optimizer': 'Adam'}. Best is trial 233 with value: 0.08806254815838281.
2026-05-20 06:44:51,251 - experiment_functions - INFO - Early stopping at epoch 900. Best Recall: 0.0836
2026-05-20 06:44:51,396 - optuna.study.study - INFO - Trial 235 finished with value: 0.08364042683611224 and parameters: {'n_layers': 1, 'embedding_dim': 96, 'lr': 0.001105888075761386, 'lambda_val': 0.00062534305977139, 'batch_size': 668, 'optimizer': 'Adam'}. Best is trial 233 with value: 0.08806254815838281.
2026-05-20 06:45:05,056 - experiment_functions - INFO - Early stopping at epoch 900. Best Recall: 0.0800
2026-05-20 06:45:05,145 - optuna.study.study - INFO - Trial 236 finished with value: 0.07995864677462164 and parameters: {'n_layers': 1, 'embedding_dim': 96, 'lr': 0.0011664725783641814, 'lambda_val': 0.0006569747255456554, 'batch_size': 611, 'optimizer': 'Adam'}. Best is trial 233 with value: 0.08806254815838281.
2026-05-20 06:45:19,206 - experiment_functions - INFO - Early stopping at epoch 950. Best Recall: 0.0869
2026-05-20 06:45:19,284 - optuna.study.study - INFO - Trial 237 finished with value: 0.08692596797192717 and parameters: {'n_layers': 1, 'embedding_dim': 96, 'lr': 0.0009326511384511227, 'lambda_val': 0.0009516973850078834, 'batch_size': 676, 'optimizer': 'Adam'}. Best is trial 233 with value: 0.08806254815838281.
2026-05-20 06:45:33,056 - experiment_functions - INFO - Early stopping at epoch 950. Best Recall: 0.0817
2026-05-20 06:45:33,125 - optuna.study.study - INFO - Trial 238 finished with value: 0.08166350532607997 and parameters: {'n_layers': 1, 'embedding_dim': 96, 'lr': 0.0009606102674401895, 'lambda_val': 0.0009114003001101347, 'batch_size': 698, 'optimizer': 'Adam'}. Best is trial 233 with value: 0.08806254815838281.
2026-05-20 06:45:45,251 - experiment_functions - INFO - Early stopping at epoch 800. Best Recall: 0.0831
2026-05-20 06:45:45,329 - optuna.study.study - INFO - Trial 239 finished with value: 0.08310899365973405 and parameters: {'n_layers': 1, 'embedding_dim': 96, 'lr': 0.0011982956101926287, 'lambda_val': 0.0007006139014061605, 'batch_size': 1167, 'optimizer': 'Adam'}. Best is trial 233 with value: 0.08806254815838281.
2026-05-20 06:45:52,787 - experiment_functions - INFO - Early stopping at epoch 500. Best Recall: 0.0055
2026-05-20 06:45:52,865 - optuna.study.study - INFO - Trial 240 finished with value: 0.005480564018975105 and parameters: {'n_layers': 1, 'embedding_dim': 96, 'lr': 0.0009204714261218585, 'lambda_val': 0.001005033829412348, 'batch_size': 905, 'optimizer': 'SGD'}. Best is trial 233 with value: 0.08806254815838281.
2026-05-20 06:46:05,592 - experiment_functions - INFO - Early stopping at epoch 850. Best Recall: 0.0826
2026-05-20 06:46:05,693 - optuna.study.study - INFO - Trial 241 finished with value: 0.08264332199289888 and parameters: {'n_layers': 1, 'embedding_dim': 96, 'lr': 0.0013139875664672173, 'lambda_val': 0.000541937242710772, 'batch_size': 606, 'optimizer': 'Adam'}. Best is trial 233 with value: 0.08806254815838281.
2026-05-20 06:46:17,888 - experiment_functions - INFO - Early stopping at epoch 850. Best Recall: 0.0640
2026-05-20 06:46:17,987 - optuna.study.study - INFO - Trial 242 finished with value: 0.06395052295037813 and parameters: {'n_layers': 1, 'embedding_dim': 96, 'lr': 0.0010322321671876475, 'lambda_val': 0.025913560970415164, 'batch_size': 673, 'optimizer': 'Adam'}. Best is trial 233 with value: 0.08806254815838281.
2026-05-20 06:46:30,488 - experiment_functions - INFO - Early stopping at epoch 800. Best Recall: 0.0829
