2026-05-20 02:03:29,740 - optuna.study.study - INFO - Trial 130 finished with value: 0.08113016126104478 and parameters: {'n_layers': 1, 'embedding_dim': 256, 'lr': 0.0009562133638882059, 'lambda_val': 2.3955886429802373e-05, 'batch_size': 521, 'optimizer': 'Adam'}. Best is trial 127 with value: 0.08309325616297107.
2026-05-20 02:04:14,885 - experiment_functions - INFO - Early stopping at epoch 2900. Best Recall: 0.0809
2026-05-20 02:04:14,975 - optuna.study.study - INFO - Trial 131 finished with value: 0.0808804472444859 and parameters: {'n_layers': 1, 'embedding_dim': 256, 'lr': 0.0009738200866322981, 'lambda_val': 2.211835423413154e-05, 'batch_size': 521, 'optimizer': 'Adam'}. Best is trial 127 with value: 0.08309325616297107.
2026-05-20 02:04:58,017 - experiment_functions - INFO - Early stopping at epoch 2700. Best Recall: 0.0861
2026-05-20 02:04:58,133 - optuna.study.study - INFO - Trial 132 finished with value: 0.08609908414024027 and parameters: {'n_layers': 1, 'embedding_dim': 256, 'lr': 0.0009738219231010343, 'lambda_val': 1.430944915173581e-05, 'batch_size': 671, 'optimizer': 'Adam'}. Best is trial 132 with value: 0.08609908414024027.
2026-05-20 02:05:11,032 - experiment_functions - INFO - Early stopping at epoch 750. Best Recall: 0.0694
2026-05-20 02:05:11,131 - optuna.study.study - INFO - Trial 133 finished with value: 0.06940760575775115 and parameters: {'n_layers': 1, 'embedding_dim': 256, 'lr': 0.0017613327009444845, 'lambda_val': 1.5679157001499092e-05, 'batch_size': 517, 'optimizer': 'Adam'}. Best is trial 132 with value: 0.08609908414024027.
2026-05-20 02:05:44,692 - experiment_functions - INFO - Early stopping at epoch 2100. Best Recall: 0.0796
2026-05-20 02:05:44,793 - optuna.study.study - INFO - Trial 134 finished with value: 0.07955862896831202 and parameters: {'n_layers': 1, 'embedding_dim': 256, 'lr': 0.000990718135791888, 'lambda_val': 1.2287098359893124e-05, 'batch_size': 660, 'optimizer': 'Adam'}. Best is trial 132 with value: 0.08609908414024027.
2026-05-20 02:06:17,663 - experiment_functions - INFO - Early stopping at epoch 2100. Best Recall: 0.0787
2026-05-20 02:06:17,777 - optuna.study.study - INFO - Trial 135 finished with value: 0.07870826315945012 and parameters: {'n_layers': 1, 'embedding_dim': 256, 'lr': 0.0009935439926104322, 'lambda_val': 1.0020718659495768e-05, 'batch_size': 671, 'optimizer': 'Adam'}. Best is trial 132 with value: 0.08609908414024027.
2026-05-20 02:06:32,086 - experiment_functions - INFO - Early stopping at epoch 850. Best Recall: 0.0719
2026-05-20 02:06:32,175 - optuna.study.study - INFO - Trial 136 finished with value: 0.07193303700806895 and parameters: {'n_layers': 1, 'embedding_dim': 256, 'lr': 0.0016324729660728884, 'lambda_val': 1.0309425499463718e-05, 'batch_size': 674, 'optimizer': 'Adam'}. Best is trial 132 with value: 0.08609908414024027.
2026-05-20 02:07:08,358 - experiment_functions - INFO - Early stopping at epoch 2300. Best Recall: 0.0742
2026-05-20 02:07:08,459 - optuna.study.study - INFO - Trial 137 finished with value: 0.07418241782801414 and parameters: {'n_layers': 1, 'embedding_dim': 256, 'lr': 0.0010017113449540434, 'lambda_val': 7.360919346160626e-06, 'batch_size': 727, 'optimizer': 'Adam'}. Best is trial 132 with value: 0.08609908414024027.
2026-05-20 02:07:21,761 - experiment_functions - INFO - Early stopping at epoch 750. Best Recall: 0.0669
2026-05-20 02:07:21,862 - optuna.study.study - INFO - Trial 138 finished with value: 0.06691120833068391 and parameters: {'n_layers': 1, 'embedding_dim': 256, 'lr': 0.0011479818010787807, 'lambda_val': 1.2894987966373263e-05, 'batch_size': 520, 'optimizer': 'RMSprop'}. Best is trial 132 with value: 0.08609908414024027.
2026-05-20 02:07:47,763 - experiment_functions - INFO - Early stopping at epoch 1600. Best Recall: 0.0739
2026-05-20 02:07:47,888 - optuna.study.study - INFO - Trial 139 finished with value: 0.07392070496048019 and parameters: {'n_layers': 1, 'embedding_dim': 256, 'lr': 0.0014710258836051855, 'lambda_val': 5.684733298976923e-06, 'batch_size': 671, 'optimizer': 'Adam'}. Best is trial 132 with value: 0.08609908414024027.
2026-05-20 02:07:56,022 - experiment_functions - INFO - Early stopping at epoch 500. Best Recall: 0.0055
2026-05-20 02:07:56,158 - optuna.study.study - INFO - Trial 140 finished with value: 0.005460980241847351 and parameters: {'n_layers': 1, 'embedding_dim': 256, 'lr': 0.0020573961609227707, 'lambda_val': 9.069940532619803e-06, 'batch_size': 600, 'optimizer': 'SGD'}. Best is trial 132 with value: 0.08609908414024027.
2026-05-20 02:08:28,728 - experiment_functions - INFO - Early stopping at epoch 2050. Best Recall: 0.0806
2026-05-20 02:08:28,827 - optuna.study.study - INFO - Trial 141 finished with value: 0.08056726951867761 and parameters: {'n_layers': 1, 'embedding_dim': 256, 'lr': 0.0009120422787766747, 'lambda_val': 2.790571475537796e-05, 'batch_size': 772, 'optimizer': 'Adam'}. Best is trial 132 with value: 0.08609908414024027.
2026-05-20 02:09:02,537 - experiment_functions - INFO - Early stopping at epoch 2050. Best Recall: 0.0807
2026-05-20 02:09:02,941 - optuna.study.study - INFO - Trial 142 finished with value: 0.08065949011543623 and parameters: {'n_layers': 1, 'embedding_dim': 256, 'lr': 0.0009067493546340841, 'lambda_val': 2.8522558572812016e-05, 'batch_size': 773, 'optimizer': 'Adam'}. Best is trial 132 with value: 0.08609908414024027.
2026-05-20 02:09:31,574 - experiment_functions - INFO - Early stopping at epoch 1750. Best Recall: 0.0770
2026-05-20 02:09:31,666 - optuna.study.study - INFO - Trial 143 finished with value: 0.077021556857129 and parameters: {'n_layers': 1, 'embedding_dim': 256, 'lr': 0.0009632142894623115, 'lambda_val': 2.709786999311038e-05, 'batch_size': 749, 'optimizer': 'Adam'}. Best is trial 132 with value: 0.08609908414024027.
2026-05-20 02:09:48,427 - optuna.study._optimize - INFO - Trial 144 pruned. 
2026-05-20 02:10:04,799 - experiment_functions - INFO - Early stopping at epoch 1000. Best Recall: 0.0735
2026-05-20 02:10:04,910 - optuna.study.study - INFO - Trial 145 finished with value: 0.07353340968349681 and parameters: {'n_layers': 1, 'embedding_dim': 256, 'lr': 0.0009400789851648787, 'lambda_val': 2.565942016976048e-05, 'batch_size': 579, 'optimizer': 'Adam'}. Best is trial 132 with value: 0.08609908414024027.
2026-05-20 02:10:24,054 - experiment_functions - INFO - Early stopping at epoch 1200. Best Recall: 0.0751
2026-05-20 02:10:24,144 - optuna.study.study - INFO - Trial 146 finished with value: 0.07512902579785642 and parameters: {'n_layers': 1, 'embedding_dim': 256, 'lr': 0.0013782791715622172, 'lambda_val': 1.6394400011765342e-05, 'batch_size': 896, 'optimizer': 'Adam'}. Best is trial 132 with value: 0.08609908414024027.
2026-05-20 02:10:48,844 - experiment_functions - INFO - Early stopping at epoch 1550. Best Recall: 0.0752
2026-05-20 02:10:48,933 - optuna.study.study - INFO - Trial 147 finished with value: 0.0752076126662774 and parameters: {'n_layers': 1, 'embedding_dim': 256, 'lr': 0.0005059966213281667, 'lambda_val': 1.1271371620315417e-05, 'batch_size': 814, 'optimizer': 'Adam'}. Best is trial 132 with value: 0.08609908414024027.
2026-05-20 02:11:50,240 - optuna.study.study - INFO - Trial 148 finished with value: 0.07985658072149131 and parameters: {'n_layers': 1, 'embedding_dim': 256, 'lr': 0.0012049389491115836, 'lambda_val': 3.059817316304302e-05, 'batch_size': 787, 'optimizer': 'Adam'}. Best is trial 132 with value: 0.08609908414024027.
2026-05-20 02:12:03,863 - experiment_functions - INFO - Early stopping at epoch 800. Best Recall: 0.0731
2026-05-20 02:12:03,953 - optuna.study.study - INFO - Trial 149 finished with value: 0.07314742383027945 and parameters: {'n_layers': 1, 'embedding_dim': 256, 'lr': 0.0011240640795075938, 'lambda_val': 3.358255604586713e-05, 'batch_size': 772, 'optimizer': 'Adam'}. Best is trial 132 with value: 0.08609908414024027.
2026-05-20 02:12:52,661 - experiment_functions - INFO - Early stopping at epoch 3100. Best Recall: 0.0807
2026-05-20 02:12:52,772 - optuna.study.study - INFO - Trial 150 finished with value: 0.08066782961052843 and parameters: {'n_layers': 1, 'embedding_dim': 256, 'lr': 0.0008549386008301976, 'lambda_val': 2.3636491780529797e-05, 'batch_size': 901, 'optimizer': 'Adam'}. Best is trial 132 with value: 0.08609908414024027.
2026-05-20 02:13:36,550 - experiment_functions - INFO - Early stopping at epoch 2750. Best Recall: 0.0836
2026-05-20 02:13:36,649 - optuna.study.study - INFO - Trial 151 finished with value: 0.0836235374490725 and parameters: {'n_layers': 1, 'embedding_dim': 256, 'lr': 0.0008648931315074086, 'lambda_val': 2.2181428317807654e-05, 'batch_size': 878, 'optimizer': 'Adam'}. Best is trial 132 with value: 0.08609908414024027.
2026-05-20 02:14:16,172 - experiment_functions - INFO - Early stopping at epoch 2450. Best Recall: 0.0811
2026-05-20 02:14:16,281 - optuna.study.study - INFO - Trial 152 finished with value: 0.08112861247073924 and parameters: {'n_layers': 1, 'embedding_dim': 256, 'lr': 0.0007109862771149328, 'lambda_val': 2.170965038235346e-05, 'batch_size': 906, 'optimizer': 'Adam'}. Best is trial 132 with value: 0.08609908414024027.
2026-05-20 02:14:32,510 - optuna.study._optimize - INFO - Trial 153 pruned. 
2026-05-20 02:14:40,733 - experiment_functions - INFO - Early stopping at epoch 500. Best Recall: 0.0053
2026-05-20 02:14:40,835 - optuna.study.study - INFO - Trial 154 finished with value: 0.005339265831859189 and parameters: {'n_layers': 1, 'embedding_dim': 256, 'lr': 1.0582290618960808e-05, 'lambda_val': 3.0435332974940737e-05, 'batch_size': 918, 'optimizer': 'Adam'}. Best is trial 132 with value: 0.08609908414024027.
2026-05-20 02:15:05,965 - optuna.study._optimize - INFO - Trial 155 pruned. 
2026-05-20 02:15:22,159 - optuna.study._optimize - INFO - Trial 156 pruned. 
2026-05-20 02:15:38,260 - optuna.study._optimize - INFO - Trial 157 pruned. 
2026-05-20 02:16:18,989 - experiment_functions - INFO - Early stopping at epoch 2600. Best Recall: 0.0814
2026-05-20 02:16:19,090 - optuna.study.study - INFO - Trial 158 finished with value: 0.08142569615117175 and parameters: {'n_layers': 1, 'embedding_dim': 256, 'lr': 0.00081178637649074, 'lambda_val': 1.8993802353165644e-05, 'batch_size': 985, 'optimizer': 'Adam'}. Best is trial 132 with value: 0.08609908414024027.
2026-05-20 02:16:45,569 - experiment_functions - INFO - Early stopping at epoch 1600. Best Recall: 0.0797
2026-05-20 02:16:45,681 - optuna.study.study - INFO - Trial 159 finished with value: 0.07971753118335824 and parameters: {'n_layers': 1, 'embedding_dim': 256, 'lr': 0.0011881448486146648, 'lambda_val': 1.9891627197968593e-05, 'batch_size': 2401, 'optimizer': 'Adam'}. Best is trial 132 with value: 0.08609908414024027.
2026-05-20 02:17:20,948 - experiment_functions - INFO - Early stopping at epoch 2100. Best Recall: 0.0832
2026-05-20 02:17:21,092 - optuna.study.study - INFO - Trial 160 finished with value: 0.08320293977277274 and parameters: {'n_layers': 1, 'embedding_dim': 256, 'lr': 0.0016694708743722679, 'lambda_val': 2.1894101209393094e-05, 'batch_size': 2344, 'optimizer': 'Adam'}. Best is trial 132 with value: 0.08609908414024027.
2026-05-20 02:18:14,861 - experiment_functions - INFO - Early stopping at epoch 3500. Best Recall: 0.0846
2026-05-20 02:18:14,951 - optuna.study.study - INFO - Trial 161 finished with value: 0.0846288089448175 and parameters: {'n_layers': 1, 'embedding_dim': 256, 'lr': 0.0017479962412517642, 'lambda_val': 1.9229322021834045e-05, 'batch_size': 2404, 'optimizer': 'Adam'}. Best is trial 132 with value: 0.08609908414024027.
2026-05-20 02:18:40,161 - experiment_functions - INFO - Early stopping at epoch 1600. Best Recall: 0.0799
2026-05-20 02:18:40,261 - optuna.study.study - INFO - Trial 162 finished with value: 0.07988110742663791 and parameters: {'n_layers': 1, 'embedding_dim': 256, 'lr': 0.0024363223635451552, 'lambda_val': 1.9188292097954836e-05, 'batch_size': 2363, 'optimizer': 'Adam'}. Best is trial 132 with value: 0.08609908414024027.
2026-05-20 02:19:23,155 - experiment_functions - INFO - Early stopping at epoch 2150. Best Recall: 0.0788
2026-05-20 02:19:23,686 - optuna.study.study - INFO - Trial 163 finished with value: 0.07884150068703764 and parameters: {'n_layers': 1, 'embedding_dim': 256, 'lr': 0.003168998131540504, 'lambda_val': 2.479716208101056e-05, 'batch_size': 2381, 'optimizer': 'Adam'}. Best is trial 132 with value: 0.08609908414024027.
2026-05-20 02:20:16,034 - experiment_functions - INFO - Early stopping at epoch 3400. Best Recall: 0.0832
2026-05-20 02:20:16,157 - optuna.study.study - INFO - Trial 164 finished with value: 0.0831603939992984 and parameters: {'n_layers': 1, 'embedding_dim': 256, 'lr': 0.0016689198871084724, 'lambda_val': 1.8791848764464945e-05, 'batch_size': 2514, 'optimizer': 'Adam'}. Best is trial 132 with value: 0.08609908414024027.
2026-05-20 02:20:25,685 - experiment_functions - INFO - Early stopping at epoch 550. Best Recall: 0.0739
2026-05-20 02:20:25,774 - optuna.study.study - INFO - Trial 165 finished with value: 0.07393415972391768 and parameters: {'n_layers': 1, 'embedding_dim': 256, 'lr': 0.004538690929982709, 'lambda_val': 3.990657908676049e-05, 'batch_size': 2531, 'optimizer': 'Adam'}. Best is trial 132 with value: 0.08609908414024027.
2026-05-20 02:20:36,160 - experiment_functions - INFO - Early stopping at epoch 650. Best Recall: 0.0762
2026-05-20 02:20:36,292 - optuna.study.study - INFO - Trial 166 finished with value: 0.07620740136331199 and parameters: {'n_layers': 1, 'embedding_dim': 256, 'lr': 0.0020145034428015757, 'lambda_val': 1.938738014114141e-05, 'batch_size': 2306, 'optimizer': 'Adam'}. Best is trial 132 with value: 0.08609908414024027.
2026-05-20 02:21:09,220 - experiment_functions - INFO - Early stopping at epoch 2200. Best Recall: 0.0803
2026-05-20 02:21:09,318 - optuna.study.study - INFO - Trial 167 finished with value: 0.08027434993329302 and parameters: {'n_layers': 1, 'embedding_dim': 256, 'lr': 0.0025792314062126516, 'lambda_val': 2.9248713051640694e-05, 'batch_size': 2608, 'optimizer': 'Adam'}. Best is trial 132 with value: 0.08609908414024027.
2026-05-20 02:21:33,154 - experiment_functions - INFO - Early stopping at epoch 1600. Best Recall: 0.0822
2026-05-20 02:21:33,245 - optuna.study.study - INFO - Trial 168 finished with value: 0.0822333567187109 and parameters: {'n_layers': 1, 'embedding_dim': 256, 'lr': 0.002520050073880724, 'lambda_val': 5.385809875617336e-05, 'batch_size': 2643, 'optimizer': 'Adam'}. Best is trial 132 with value: 0.08609908414024027.
2026-05-20 02:21:43,640 - experiment_functions - INFO - Early stopping at epoch 550. Best Recall: 0.0418
2026-05-20 02:21:43,719 - optuna.study.study - INFO - Trial 169 finished with value: 0.04183764682044267 and parameters: {'n_layers': 3, 'embedding_dim': 256, 'lr': 0.002588210103971696, 'lambda_val': 4.979720957986982e-05, 'batch_size': 2867, 'optimizer': 'Adam'}. Best is trial 132 with value: 0.08609908414024027.
2026-05-20 02:21:53,896 - experiment_functions - INFO - Early stopping at epoch 600. Best Recall: 0.0753
2026-05-20 02:21:53,997 - optuna.study.study - INFO - Trial 170 finished with value: 0.07532653026036183 and parameters: {'n_layers': 1, 'embedding_dim': 256, 'lr': 0.0035974739129088743, 'lambda_val': 7.273134674356589e-05, 'batch_size': 2690, 'optimizer': 'Adam'}. Best is trial 132 with value: 0.08609908414024027.
2026-05-20 02:22:47,777 - experiment_functions - INFO - Early stopping at epoch 3050. Best Recall: 0.0836
2026-05-20 02:22:47,885 - optuna.study.study - INFO - Trial 171 finished with value: 0.08359458876168352 and parameters: {'n_layers': 1, 'embedding_dim': 256, 'lr': 0.0021953956020910963, 'lambda_val': 2.46144635941314e-05, 'batch_size': 2536, 'optimizer': 'Adam'}. Best is trial 132 with value: 0.08609908414024027.
2026-05-20 02:23:17,564 - experiment_functions - INFO - Early stopping at epoch 2000. Best Recall: 0.0808
2026-05-20 02:23:17,643 - optuna.study.study - INFO - Trial 172 finished with value: 0.08075323222860105 and parameters: {'n_layers': 1, 'embedding_dim': 256, 'lr': 0.0028270053964110247, 'lambda_val': 2.5754057876324712e-05, 'batch_size': 2500, 'optimizer': 'Adam'}. Best is trial 132 with value: 0.08609908414024027.
2026-05-20 02:23:49,340 - experiment_functions - INFO - Early stopping at epoch 2150. Best Recall: 0.0816
2026-05-20 02:23:49,449 - optuna.study.study - INFO - Trial 173 finished with value: 0.08158006142638484 and parameters: {'n_layers': 1, 'embedding_dim': 256, 'lr': 0.0016822646881509316, 'lambda_val': 2.3811242406226774e-05, 'batch_size': 2486, 'optimizer': 'Adam'}. Best is trial 132 with value: 0.08609908414024027.
2026-05-20 02:24:44,516 - experiment_functions - INFO - Early stopping at epoch 3800. Best Recall: 0.0837
2026-05-20 02:24:44,605 - optuna.study.study - INFO - Trial 174 finished with value: 0.0836607304437238 and parameters: {'n_layers': 1, 'embedding_dim': 256, 'lr': 0.0017671562989804992, 'lambda_val': 2.532117277069572e-05, 'batch_size': 2513, 'optimizer': 'Adam'}. Best is trial 132 with value: 0.08609908414024027.
2026-05-20 02:25:09,750 - optuna.study._optimize - INFO - Trial 175 pruned. 
2026-05-20 02:25:18,358 - experiment_functions - INFO - Early stopping at epoch 500. Best Recall: 0.0053
2026-05-20 02:25:18,468 - optuna.study.study - INFO - Trial 176 finished with value: 0.005338551276406901 and parameters: {'n_layers': 1, 'embedding_dim': 256, 'lr': 0.0016920447781399951, 'lambda_val': 3.982514113282861e-05, 'batch_size': 2632, 'optimizer': 'SGD'}. Best is trial 132 with value: 0.08609908414024027.
2026-05-20 02:25:51,694 - experiment_functions - INFO - Early stopping at epoch 2300. Best Recall: 0.0802
2026-05-20 02:25:51,782 - optuna.study.study - INFO - Trial 177 finished with value: 0.08020697643442348 and parameters: {'n_layers': 1, 'embedding_dim': 256, 'lr': 0.0016018918021846885, 'lambda_val': 1.8063122867041553e-05, 'batch_size': 2475, 'optimizer': 'RMSprop'}. Best is trial 132 with value: 0.08609908414024027.
2026-05-20 02:26:14,844 - optuna.study._optimize - INFO - Trial 178 pruned. 
2026-05-20 02:26:45,018 - experiment_functions - INFO - Early stopping at epoch 2050. Best Recall: 0.0852
2026-05-20 02:26:45,097 - optuna.study.study - INFO - Trial 179 finished with value: 0.08522184229875346 and parameters: {'n_layers': 1, 'embedding_dim': 256, 'lr': 0.0020882797427554316, 'lambda_val': 3.7809722822400496e-05, 'batch_size': 2754, 'optimizer': 'Adam'}. Best is trial 132 with value: 0.08609908414024027.
2026-05-20 02:27:15,237 - experiment_functions - INFO - Early stopping at epoch 1750. Best Recall: 0.0807
2026-05-20 02:27:15,326 - optuna.study.study - INFO - Trial 180 finished with value: 0.08071118051273181 and parameters: {'n_layers': 1, 'embedding_dim': 256, 'lr': 0.0027265392956635527, 'lambda_val': 3.4914037806911374e-05, 'batch_size': 2680, 'optimizer': 'Adam'}. Best is trial 132 with value: 0.08609908414024027.
2026-05-20 02:27:25,343 - experiment_functions - INFO - Early stopping at epoch 600. Best Recall: 0.0773
2026-05-20 02:27:25,489 - optuna.study.study - INFO - Trial 181 finished with value: 0.07734359969732052 and parameters: {'n_layers': 1, 'embedding_dim': 256, 'lr': 0.0028442023413589555, 'lambda_val': 3.8826440853142976e-05, 'batch_size': 2698, 'optimizer': 'Adam'}. Best is trial 132 with value: 0.08609908414024027.
2026-05-20 02:27:57,991 - experiment_functions - INFO - Early stopping at epoch 1950. Best Recall: 0.0834
2026-05-20 02:27:58,081 - optuna.study.study - INFO - Trial 182 finished with value: 0.08337397931319838 and parameters: {'n_layers': 1, 'embedding_dim': 256, 'lr': 0.002119788018948603, 'lambda_val': 1.9856532540256194e-05, 'batch_size': 2524, 'optimizer': 'Adam'}. Best is trial 132 with value: 0.08609908414024027.
2026-05-20 02:28:33,843 - experiment_functions - INFO - Early stopping at epoch 2250. Best Recall: 0.0855
2026-05-20 02:28:33,921 - optuna.study.study - INFO - Trial 183 finished with value: 0.08549212031132143 and parameters: {'n_layers': 1, 'embedding_dim': 256, 'lr': 0.0022352777831182724, 'lambda_val': 1.696328154798083e-05, 'batch_size': 2736, 'optimizer': 'Adam'}. Best is trial 132 with value: 0.08609908414024027.
2026-05-20 02:29:37,557 - optuna.study.study - INFO - Trial 184 finished with value: 0.08185543010968918 and parameters: {'n_layers': 1, 'embedding_dim': 256, 'lr': 0.0021056323851032315, 'lambda_val': 1.73679665805282e-05, 'batch_size': 2801, 'optimizer': 'Adam'}. Best is trial 132 with value: 0.08609908414024027.
2026-05-20 02:30:12,599 - experiment_functions - INFO - Early stopping at epoch 1950. Best Recall: 0.0841
2026-05-20 02:30:12,709 - optuna.study.study - INFO - Trial 185 finished with value: 0.08405559902267931 and parameters: {'n_layers': 1, 'embedding_dim': 256, 'lr': 0.0021234382852458778, 'lambda_val': 1.6647179889823766e-05, 'batch_size': 2827, 'optimizer': 'Adam'}. Best is trial 132 with value: 0.08609908414024027.
2026-05-20 02:31:07,628 - experiment_functions - INFO - Early stopping at epoch 3050. Best Recall: 0.0811
2026-05-20 02:31:07,719 - optuna.study.study - INFO - Trial 186 finished with value: 0.08107375228845459 and parameters: {'n_layers': 1, 'embedding_dim': 256, 'lr': 0.0021425978569220546, 'lambda_val': 1.743694191197585e-05, 'batch_size': 2823, 'optimizer': 'Adam'}. Best is trial 132 with value: 0.08609908414024027.
2026-05-20 02:31:58,919 - experiment_functions - INFO - Early stopping at epoch 2650. Best Recall: 0.0836
2026-05-20 02:31:59,008 - optuna.study.study - INFO - Trial 187 finished with value: 0.08358753436597843 and parameters: {'n_layers': 1, 'embedding_dim': 256, 'lr': 0.00224316313268095, 'lambda_val': 1.361089129598705e-05, 'batch_size': 2820, 'optimizer': 'Adam'}. Best is trial 132 with value: 0.08609908414024027.
