2026-05-19 23:16:19,549 - optuna.study._optimize - INFO - Trial 253 pruned. 
2026-05-19 23:16:45,323 - experiment_functions - INFO - Early stopping at epoch 1700. Best Recall: 0.0931
2026-05-19 23:16:45,420 - optuna.study.study - INFO - Trial 254 finished with value: 0.0930996342956752 and parameters: {'n_layers': 1, 'embedding_dim': 32, 'lr': 0.0009370891660047808, 'lambda_val': 0.0007545026679594614, 'batch_size': 572, 'optimizer': 'Adam'}. Best is trial 214 with value: 0.09780120887468562.
2026-05-19 23:17:01,019 - optuna.study._optimize - INFO - Trial 255 pruned. 
2026-05-19 23:17:43,228 - experiment_functions - INFO - Early stopping at epoch 2750. Best Recall: 0.0992
2026-05-19 23:17:43,332 - optuna.study.study - INFO - Trial 256 finished with value: 0.09920686227980569 and parameters: {'n_layers': 1, 'embedding_dim': 32, 'lr': 0.0008239945480794106, 'lambda_val': 0.0007673676159145175, 'batch_size': 590, 'optimizer': 'Adam'}. Best is trial 256 with value: 0.09920686227980569.
2026-05-19 23:17:58,032 - optuna.study._optimize - INFO - Trial 257 pruned. 
2026-05-19 23:18:15,114 - optuna.study._optimize - INFO - Trial 258 pruned. 
2026-05-19 23:18:44,179 - experiment_functions - INFO - Early stopping at epoch 1400. Best Recall: 0.0894
2026-05-19 23:18:44,303 - optuna.study.study - INFO - Trial 259 finished with value: 0.0894318809024204 and parameters: {'n_layers': 1, 'embedding_dim': 32, 'lr': 0.0010895600258350607, 'lambda_val': 0.0009981575889319314, 'batch_size': 653, 'optimizer': 'Adam'}. Best is trial 256 with value: 0.09920686227980569.
2026-05-19 23:18:58,250 - optuna.study._optimize - INFO - Trial 260 pruned. 
2026-05-19 23:19:23,019 - experiment_functions - INFO - Early stopping at epoch 1500. Best Recall: 0.0899
2026-05-19 23:19:23,119 - optuna.study.study - INFO - Trial 261 finished with value: 0.08990814031496866 and parameters: {'n_layers': 1, 'embedding_dim': 96, 'lr': 0.0009209701313089189, 'lambda_val': 0.0006207318351119286, 'batch_size': 592, 'optimizer': 'Adam'}. Best is trial 256 with value: 0.09920686227980569.
2026-05-19 23:19:38,186 - optuna.study._optimize - INFO - Trial 262 pruned. 
2026-05-19 23:19:53,151 - optuna.study._optimize - INFO - Trial 263 pruned. 
2026-05-19 23:20:09,129 - optuna.study._optimize - INFO - Trial 264 pruned. 
2026-05-19 23:20:25,122 - experiment_functions - INFO - Early stopping at epoch 1050. Best Recall: 0.0938
2026-05-19 23:20:25,223 - optuna.study.study - INFO - Trial 265 finished with value: 0.09383694901422532 and parameters: {'n_layers': 1, 'embedding_dim': 32, 'lr': 0.0013519272778583647, 'lambda_val': 0.00039590866464297894, 'batch_size': 714, 'optimizer': 'Adam'}. Best is trial 256 with value: 0.09920686227980569.
2026-05-19 23:20:32,998 - experiment_functions - INFO - Early stopping at epoch 500. Best Recall: 0.0052
2026-05-19 23:20:33,087 - optuna.study.study - INFO - Trial 266 finished with value: 0.005228826692497133 and parameters: {'n_layers': 1, 'embedding_dim': 32, 'lr': 0.0012712716423835867, 'lambda_val': 0.0003633002806921281, 'batch_size': 727, 'optimizer': 'SGD'}. Best is trial 256 with value: 0.09920686227980569.
2026-05-19 23:20:48,590 - experiment_functions - INFO - Early stopping at epoch 1000. Best Recall: 0.0828
2026-05-19 23:20:48,868 - optuna.study.study - INFO - Trial 267 finished with value: 0.0827850717337856 and parameters: {'n_layers': 1, 'embedding_dim': 32, 'lr': 0.001435189126164792, 'lambda_val': 2.7960191999075736e-05, 'batch_size': 800, 'optimizer': 'Adam'}. Best is trial 256 with value: 0.09920686227980569.
2026-05-19 23:21:19,534 - optuna.study._optimize - INFO - Trial 268 pruned. 
2026-05-19 23:21:38,418 - experiment_functions - INFO - Early stopping at epoch 1250. Best Recall: 0.0886
2026-05-19 23:21:38,507 - optuna.study.study - INFO - Trial 269 finished with value: 0.08858353882019755 and parameters: {'n_layers': 1, 'embedding_dim': 32, 'lr': 0.0011678295212797993, 'lambda_val': 0.00013937137751204078, 'batch_size': 645, 'optimizer': 'Adam'}. Best is trial 256 with value: 0.09920686227980569.
2026-05-19 23:21:53,130 - optuna.study._optimize - INFO - Trial 270 pruned. 
2026-05-19 23:22:08,905 - experiment_functions - INFO - Early stopping at epoch 1000. Best Recall: 0.0889
2026-05-19 23:22:09,005 - optuna.study.study - INFO - Trial 271 finished with value: 0.08887792672996718 and parameters: {'n_layers': 1, 'embedding_dim': 32, 'lr': 0.0015176040302042773, 'lambda_val': 0.00030205233470581935, 'batch_size': 579, 'optimizer': 'Adam'}. Best is trial 256 with value: 0.09920686227980569.
2026-05-19 23:22:23,937 - optuna.study._optimize - INFO - Trial 272 pruned. 
2026-05-19 23:22:44,554 - experiment_functions - INFO - Early stopping at epoch 1300. Best Recall: 0.0920
2026-05-19 23:22:44,707 - optuna.study.study - INFO - Trial 273 finished with value: 0.09202469352079636 and parameters: {'n_layers': 1, 'embedding_dim': 32, 'lr': 0.0009994328278917883, 'lambda_val': 0.0014843972675336794, 'batch_size': 821, 'optimizer': 'Adam'}. Best is trial 256 with value: 0.09920686227980569.
2026-05-19 23:22:59,611 - optuna.study._optimize - INFO - Trial 274 pruned. 
2026-05-19 23:23:17,398 - optuna.study._optimize - INFO - Trial 275 pruned. 
2026-05-19 23:23:43,008 - optuna.study._optimize - INFO - Trial 276 pruned. 
2026-05-19 23:24:20,176 - experiment_functions - INFO - Early stopping at epoch 2550. Best Recall: 0.0974
2026-05-19 23:24:20,267 - optuna.study.study - INFO - Trial 277 finished with value: 0.09743267862632275 and parameters: {'n_layers': 1, 'embedding_dim': 32, 'lr': 0.0007585281192705169, 'lambda_val': 0.002014314194612594, 'batch_size': 654, 'optimizer': 'Adam'}. Best is trial 256 with value: 0.09920686227980569.
2026-05-19 23:24:35,348 - optuna.study._optimize - INFO - Trial 278 pruned. 
2026-05-19 23:24:49,704 - optuna.study._optimize - INFO - Trial 279 pruned. 
2026-05-19 23:25:07,520 - experiment_functions - INFO - Early stopping at epoch 1150. Best Recall: 0.0894
2026-05-19 23:25:07,609 - optuna.study.study - INFO - Trial 280 finished with value: 0.0893778033869591 and parameters: {'n_layers': 1, 'embedding_dim': 32, 'lr': 0.0012352160534129404, 'lambda_val': 0.0002321005121618893, 'batch_size': 638, 'optimizer': 'Adam'}. Best is trial 256 with value: 0.09920686227980569.
2026-05-19 23:25:22,453 - optuna.study._optimize - INFO - Trial 281 pruned. 
2026-05-19 23:25:37,064 - optuna.study._optimize - INFO - Trial 282 pruned. 
2026-05-19 23:25:59,089 - experiment_functions - INFO - Early stopping at epoch 1450. Best Recall: 0.0899
2026-05-19 23:25:59,189 - optuna.study.study - INFO - Trial 283 finished with value: 0.08994522151674969 and parameters: {'n_layers': 1, 'embedding_dim': 32, 'lr': 0.0010368642943156042, 'lambda_val': 0.00015440332987469644, 'batch_size': 701, 'optimizer': 'Adam'}. Best is trial 256 with value: 0.09920686227980569.
2026-05-19 23:26:14,166 - optuna.study._optimize - INFO - Trial 284 pruned. 
2026-05-19 23:26:30,873 - optuna.study._optimize - INFO - Trial 285 pruned. 
2026-05-19 23:26:43,555 - experiment_functions - INFO - Early stopping at epoch 800. Best Recall: 0.0756
2026-05-19 23:26:43,692 - optuna.study.study - INFO - Trial 286 finished with value: 0.07559001437923757 and parameters: {'n_layers': 1, 'embedding_dim': 32, 'lr': 0.0015743408444018, 'lambda_val': 0.00023764863151989839, 'batch_size': 1980, 'optimizer': 'Adam'}. Best is trial 256 with value: 0.09920686227980569.
2026-05-19 23:26:50,979 - experiment_functions - INFO - Early stopping at epoch 500. Best Recall: 0.0055
2026-05-19 23:26:51,069 - optuna.study.study - INFO - Trial 287 finished with value: 0.005543106618422314 and parameters: {'n_layers': 1, 'embedding_dim': 32, 'lr': 0.0009217915148720413, 'lambda_val': 0.0006535663495257879, 'batch_size': 711, 'optimizer': 'SGD'}. Best is trial 256 with value: 0.09920686227980569.
2026-05-19 23:27:04,437 - experiment_functions - INFO - Early stopping at epoch 800. Best Recall: 0.0843
2026-05-19 23:27:04,537 - optuna.study.study - INFO - Trial 288 finished with value: 0.08433085025081824 and parameters: {'n_layers': 2, 'embedding_dim': 32, 'lr': 0.0012542380146693304, 'lambda_val': 8.018144655958655e-05, 'batch_size': 563, 'optimizer': 'Adam'}. Best is trial 256 with value: 0.09920686227980569.
2026-05-19 23:27:19,034 - optuna.study._optimize - INFO - Trial 289 pruned. 
2026-05-19 23:27:42,878 - optuna.study._optimize - INFO - Trial 290 pruned. 
2026-05-19 23:27:57,096 - optuna.study._optimize - INFO - Trial 291 pruned. 
2026-05-19 23:28:15,633 - experiment_functions - INFO - Early stopping at epoch 1250. Best Recall: 0.0882
2026-05-19 23:28:15,721 - optuna.study.study - INFO - Trial 292 finished with value: 0.0882110887366822 and parameters: {'n_layers': 1, 'embedding_dim': 32, 'lr': 0.0010406897485371023, 'lambda_val': 0.003911118665104949, 'batch_size': 666, 'optimizer': 'Adam'}. Best is trial 256 with value: 0.09920686227980569.
2026-05-19 23:28:30,462 - optuna.study._optimize - INFO - Trial 293 pruned. 
2026-05-19 23:28:45,701 - optuna.study._optimize - INFO - Trial 294 pruned. 
2026-05-19 23:29:37,323 - optuna.study._optimize - INFO - Trial 295 pruned. 
2026-05-19 23:30:01,632 - experiment_functions - INFO - Early stopping at epoch 1600. Best Recall: 0.0931
2026-05-19 23:30:01,722 - optuna.study.study - INFO - Trial 296 finished with value: 0.09312187412701306 and parameters: {'n_layers': 1, 'embedding_dim': 32, 'lr': 0.0011143674037321501, 'lambda_val': 5.9932732692740106e-05, 'batch_size': 582, 'optimizer': 'Adam'}. Best is trial 256 with value: 0.09920686227980569.
2026-05-19 23:30:19,357 - experiment_functions - INFO - Early stopping at epoch 1100. Best Recall: 0.0910
2026-05-19 23:30:19,503 - optuna.study.study - INFO - Trial 297 finished with value: 0.09099225634851603 and parameters: {'n_layers': 1, 'embedding_dim': 32, 'lr': 0.0013697221501791847, 'lambda_val': 0.0011794730751033431, 'batch_size': 590, 'optimizer': 'Adam'}. Best is trial 256 with value: 0.09920686227980569.
2026-05-19 23:30:42,805 - experiment_functions - INFO - Early stopping at epoch 1500. Best Recall: 0.0909
2026-05-19 23:30:42,895 - optuna.study.study - INFO - Trial 298 finished with value: 0.09089412558981586 and parameters: {'n_layers': 1, 'embedding_dim': 32, 'lr': 0.0011206353297613875, 'lambda_val': 0.0006845536124671435, 'batch_size': 598, 'optimizer': 'Adam'}. Best is trial 256 with value: 0.09920686227980569.
2026-05-19 23:31:00,785 - experiment_functions - INFO - Early stopping at epoch 1100. Best Recall: 0.0925
2026-05-19 23:31:00,875 - optuna.study.study - INFO - Trial 299 finished with value: 0.092469202465982 and parameters: {'n_layers': 1, 'embedding_dim': 32, 'lr': 0.0015376779669287251, 'lambda_val': 6.295735429152685e-05, 'batch_size': 572, 'optimizer': 'Adam'}. Best is trial 256 with value: 0.09920686227980569.
2026-05-19 23:31:00,877 - experiment_functions - INFO - Training the best model ... for e_1M_full
2026-05-19 23:31:30,380 - experiment_functions - INFO - Early stopping at epoch 2300. Best Recall: 0.0943
2026-05-19 23:31:31,326 - root - INFO - **** Training e_1M_1c1dcs
2026-05-19 23:31:31,326 - root - INFO -   ** 1-Dominant stats:
2026-05-19 23:31:31,326 - root - INFO -   ** Finding the dominant set:
2026-05-20 00:11:21,156 - root - INFO -   ** Getting the trainable edges:
2026-05-20 00:11:21,172 - helper_functions - INFO -      Number of nodes: 4740
2026-05-20 00:11:21,172 - helper_functions - INFO -      Ratio: 0.4863533757438949
2026-05-20 00:11:21,172 - helper_functions - INFO -      Number of unique users: 3156
2026-05-20 00:11:21,172 - helper_functions - INFO -      Number of unique items: 1584
2026-05-20 00:11:21,172 - helper_functions - INFO -      Total dominant set edge: 14614
2026-05-20 00:11:21,172 - helper_functions - INFO -      Trainable edges: 11691.2
2026-05-20 00:11:21,214 - root - INFO -   **** Getting 14614 dominant set edges
2026-05-20 00:11:21,324 - optuna.storages._rdb.storage - INFO - A new study created in RDB with name: Study_e_1M_1c1dcs_strict
2026-05-20 00:11:31,117 - experiment_functions - INFO - Early stopping at epoch 750. Best Recall: 0.0228
2026-05-20 00:11:31,217 - optuna.study.study - INFO - Trial 0 finished with value: 0.022759277337973602 and parameters: {'n_layers': 2, 'embedding_dim': 32, 'lr': 0.0007103507124476485, 'lambda_val': 3.06960679630161e-05, 'batch_size': 1124, 'optimizer': 'Adam'}. Best is trial 0 with value: 0.022759277337973602.
2026-05-20 00:11:46,480 - experiment_functions - INFO - Early stopping at epoch 1250. Best Recall: 0.0049
2026-05-20 00:11:46,592 - optuna.study.study - INFO - Trial 1 finished with value: 0.0049353249658835915 and parameters: {'n_layers': 1, 'embedding_dim': 64, 'lr': 1.889644089712686e-05, 'lambda_val': 0.09378432763049818, 'batch_size': 1736, 'optimizer': 'RMSprop'}. Best is trial 0 with value: 0.022759277337973602.
2026-05-20 00:12:02,393 - experiment_functions - INFO - Early stopping at epoch 500. Best Recall: 0.0053
2026-05-20 00:12:02,668 - optuna.study.study - INFO - Trial 2 finished with value: 0.005278822003483211 and parameters: {'n_layers': 1, 'embedding_dim': 32, 'lr': 0.00033931973530554137, 'lambda_val': 0.08159947617715643, 'batch_size': 3199, 'optimizer': 'RMSprop'}. Best is trial 0 with value: 0.022759277337973602.
2026-05-20 00:12:10,367 - experiment_functions - INFO - Early stopping at epoch 500. Best Recall: 0.0057
2026-05-20 00:12:10,466 - optuna.study.study - INFO - Trial 3 finished with value: 0.005675704876462799 and parameters: {'n_layers': 1, 'embedding_dim': 256, 'lr': 6.870303603322165e-05, 'lambda_val': 6.133898776832708e-05, 'batch_size': 1849, 'optimizer': 'SGD'}. Best is trial 0 with value: 0.022759277337973602.
2026-05-20 00:12:17,531 - experiment_functions - INFO - Early stopping at epoch 500. Best Recall: 0.0052
2026-05-20 00:12:17,622 - optuna.study.study - INFO - Trial 4 finished with value: 0.005213420450802378 and parameters: {'n_layers': 1, 'embedding_dim': 32, 'lr': 0.0015502186708795794, 'lambda_val': 0.019406394221866408, 'batch_size': 3318, 'optimizer': 'RMSprop'}. Best is trial 0 with value: 0.022759277337973602.
2026-05-20 00:12:24,567 - experiment_functions - INFO - Early stopping at epoch 500. Best Recall: 0.0118
2026-05-20 00:12:24,659 - optuna.study.study - INFO - Trial 5 finished with value: 0.011768730178177537 and parameters: {'n_layers': 3, 'embedding_dim': 32, 'lr': 0.07164070575596554, 'lambda_val': 0.00021484661408043498, 'batch_size': 2459, 'optimizer': 'RMSprop'}. Best is trial 0 with value: 0.022759277337973602.
2026-05-20 00:12:31,504 - experiment_functions - INFO - Early stopping at epoch 500. Best Recall: 0.0049
2026-05-20 00:12:31,617 - optuna.study.study - INFO - Trial 6 finished with value: 0.004901333432587414 and parameters: {'n_layers': 3, 'embedding_dim': 64, 'lr': 2.3188543396588365e-05, 'lambda_val': 0.004432092242126761, 'batch_size': 892, 'optimizer': 'RMSprop'}. Best is trial 0 with value: 0.022759277337973602.
2026-05-20 00:12:43,905 - experiment_functions - INFO - Early stopping at epoch 500. Best Recall: 0.0047
2026-05-20 00:12:44,667 - optuna.study.study - INFO - Trial 7 finished with value: 0.004702967630855858 and parameters: {'n_layers': 4, 'embedding_dim': 128, 'lr': 1.0762867271551217e-05, 'lambda_val': 0.018243951167914895, 'batch_size': 3771, 'optimizer': 'RMSprop'}. Best is trial 0 with value: 0.022759277337973602.
2026-05-20 00:12:56,614 - experiment_functions - INFO - Early stopping at epoch 500. Best Recall: 0.0039
2026-05-20 00:12:56,705 - optuna.study.study - INFO - Trial 8 finished with value: 0.003919218821670286 and parameters: {'n_layers': 2, 'embedding_dim': 32, 'lr': 0.04455283019332054, 'lambda_val': 0.004781231105891843, 'batch_size': 3338, 'optimizer': 'Adam'}. Best is trial 0 with value: 0.022759277337973602.
2026-05-20 00:13:06,247 - experiment_functions - INFO - Early stopping at epoch 700. Best Recall: 0.0131
2026-05-20 00:13:06,338 - optuna.study.study - INFO - Trial 9 finished with value: 0.013086102806394311 and parameters: {'n_layers': 3, 'embedding_dim': 64, 'lr': 0.0006656069550711846, 'lambda_val': 2.3383526464486646e-05, 'batch_size': 2785, 'optimizer': 'Adam'}. Best is trial 0 with value: 0.022759277337973602.
2026-05-20 00:13:13,862 - experiment_functions - INFO - Early stopping at epoch 550. Best Recall: 0.0124
2026-05-20 00:13:13,961 - optuna.study.study - INFO - Trial 10 finished with value: 0.012432147598369494 and parameters: {'n_layers': 2, 'embedding_dim': 96, 'lr': 0.006513515608196267, 'lambda_val': 1.0432767649862882e-06, 'batch_size': 536, 'optimizer': 'Adam'}. Best is trial 0 with value: 0.022759277337973602.
2026-05-20 00:13:24,316 - experiment_functions - INFO - Early stopping at epoch 700. Best Recall: 0.0093
2026-05-20 00:13:24,463 - optuna.study.study - INFO - Trial 11 finished with value: 0.009328654282917487 and parameters: {'n_layers': 4, 'embedding_dim': 64, 'lr': 0.0005004533864459514, 'lambda_val': 1.1077535152104567e-05, 'batch_size': 2596, 'optimizer': 'Adam'}. Best is trial 0 with value: 0.022759277337973602.
2026-05-20 00:13:33,863 - experiment_functions - INFO - Early stopping at epoch 550. Best Recall: 0.0137
2026-05-20 00:13:34,638 - optuna.study.study - INFO - Trial 12 finished with value: 0.013727922597797123 and parameters: {'n_layers': 3, 'embedding_dim': 128, 'lr': 0.003051251307031886, 'lambda_val': 1.915172434301832e-05, 'batch_size': 1396, 'optimizer': 'Adam'}. Best is trial 0 with value: 0.022759277337973602.
2026-05-20 00:13:48,832 - experiment_functions - INFO - Early stopping at epoch 550. Best Recall: 0.0057
2026-05-20 00:13:48,922 - optuna.study.study - INFO - Trial 13 finished with value: 0.005743797095114956 and parameters: {'n_layers': 2, 'embedding_dim': 128, 'lr': 0.005787028523873719, 'lambda_val': 2.8653452245261303e-06, 'batch_size': 1392, 'optimizer': 'Adam'}. Best is trial 0 with value: 0.022759277337973602.
2026-05-20 00:13:56,326 - experiment_functions - INFO - Early stopping at epoch 500. Best Recall: 0.0058
2026-05-20 00:13:56,437 - optuna.study.study - INFO - Trial 14 finished with value: 0.005750750578532209 and parameters: {'n_layers': 3, 'embedding_dim': 128, 'lr': 0.0033255570064001047, 'lambda_val': 0.00023355968489170256, 'batch_size': 1093, 'optimizer': 'SGD'}. Best is trial 0 with value: 0.022759277337973602.
2026-05-20 00:14:14,282 - experiment_functions - INFO - Early stopping at epoch 1250. Best Recall: 0.0208
2026-05-20 00:14:14,390 - optuna.study.study - INFO - Trial 15 finished with value: 0.020775966926937426 and parameters: {'n_layers': 2, 'embedding_dim': 256, 'lr': 0.00016873961690972564, 'lambda_val': 1.874975178192486e-05, 'batch_size': 1940, 'optimizer': 'Adam'}. Best is trial 0 with value: 0.022759277337973602.
2026-05-20 00:15:07,765 - optuna.study.study - INFO - Trial 16 finished with value: 0.023715626139453848 and parameters: {'n_layers': 2, 'embedding_dim': 256, 'lr': 9.663343540147123e-05, 'lambda_val': 0.000690614241937921, 'batch_size': 2087, 'optimizer': 'Adam'}. Best is trial 16 with value: 0.023715626139453848.
2026-05-20 00:15:15,136 - experiment_functions - INFO - Early stopping at epoch 500. Best Recall: 0.0048
2026-05-20 00:15:15,235 - optuna.study.study - INFO - Trial 17 finished with value: 0.0048428744094217565 and parameters: {'n_layers': 2, 'embedding_dim': 256, 'lr': 9.296878228500768e-05, 'lambda_val': 0.0008791218934312445, 'batch_size': 2189, 'optimizer': 'SGD'}. Best is trial 16 with value: 0.023715626139453848.
2026-05-20 00:15:22,400 - experiment_functions - INFO - Early stopping at epoch 500. Best Recall: 0.0047
2026-05-20 00:15:22,511 - optuna.study.study - INFO - Trial 18 finished with value: 0.004676167775498498 and parameters: {'n_layers': 2, 'embedding_dim': 96, 'lr': 0.01825281643333932, 'lambda_val': 0.0010031585966471111, 'batch_size': 1446, 'optimizer': 'Adam'}. Best is trial 16 with value: 0.023715626139453848.
2026-05-20 00:15:35,867 - optuna.study._optimize - INFO - Trial 19 pruned. 
2026-05-20 00:15:48,402 - experiment_functions - INFO - Early stopping at epoch 900. Best Recall: 0.0225
2026-05-20 00:15:48,570 - optuna.study.study - INFO - Trial 20 finished with value: 0.022509120362235922 and parameters: {'n_layers': 2, 'embedding_dim': 256, 'lr': 0.00025253461482114815, 'lambda_val': 0.0015145407126715342, 'batch_size': 1080, 'optimizer': 'Adam'}. Best is trial 16 with value: 0.023715626139453848.
2026-05-20 00:16:05,993 - experiment_functions - INFO - Early stopping at epoch 1250. Best Recall: 0.0252
2026-05-20 00:16:06,095 - optuna.study.study - INFO - Trial 21 finished with value: 0.025175906491101904 and parameters: {'n_layers': 2, 'embedding_dim': 256, 'lr': 0.00021512851138997724, 'lambda_val': 0.0006677759647612824, 'batch_size': 984, 'optimizer': 'Adam'}. Best is trial 21 with value: 0.025175906491101904.
2026-05-20 00:16:15,003 - experiment_functions - INFO - Early stopping at epoch 600. Best Recall: 0.0247
2026-05-20 00:16:15,113 - optuna.study.study - INFO - Trial 22 finished with value: 0.024747277921347136 and parameters: {'n_layers': 2, 'embedding_dim': 256, 'lr': 0.0011795330814662964, 'lambda_val': 0.00010732286020417383, 'batch_size': 936, 'optimizer': 'Adam'}. Best is trial 21 with value: 0.025175906491101904.
2026-05-20 00:16:50,472 - experiment_functions - INFO - Early stopping at epoch 2650. Best Recall: 0.0261
2026-05-20 00:16:50,612 - optuna.study.study - INFO - Trial 23 finished with value: 0.026090444651601846 and parameters: {'n_layers': 2, 'embedding_dim': 256, 'lr': 0.00017020986435260416, 'lambda_val': 0.00042871191493373367, 'batch_size': 806, 'optimizer': 'Adam'}. Best is trial 23 with value: 0.026090444651601846.
2026-05-20 00:17:04,952 - optuna.study._optimize - INFO - Trial 24 pruned. 
2026-05-20 00:17:12,591 - experiment_functions - INFO - Early stopping at epoch 500. Best Recall: 0.0052
