2026-05-20 06:17:54,882 - optuna.study.study - INFO - Trial 130 finished with value: 0.050511378432181446 and parameters: {'n_layers': 3, 'embedding_dim': 64, 'lr': 0.0016522424829144761, 'lambda_val': 0.00010848027039186937, 'batch_size': 2193, 'optimizer': 'Adam'}. Best is trial 122 with value: 0.08511865658067046.
2026-05-20 06:18:07,277 - experiment_functions - INFO - Early stopping at epoch 800. Best Recall: 0.0748
2026-05-20 06:18:07,423 - optuna.study.study - INFO - Trial 131 finished with value: 0.0747813565772669 and parameters: {'n_layers': 1, 'embedding_dim': 64, 'lr': 0.0009107926118786142, 'lambda_val': 0.0004589573260494283, 'batch_size': 2437, 'optimizer': 'Adam'}. Best is trial 122 with value: 0.08511865658067046.
2026-05-20 06:18:18,765 - experiment_functions - INFO - Early stopping at epoch 750. Best Recall: 0.0775
2026-05-20 06:18:18,856 - optuna.study.study - INFO - Trial 132 finished with value: 0.07751466218419731 and parameters: {'n_layers': 1, 'embedding_dim': 64, 'lr': 0.0010889869043086207, 'lambda_val': 0.00032965946698023475, 'batch_size': 2371, 'optimizer': 'Adam'}. Best is trial 122 with value: 0.08511865658067046.
2026-05-20 06:18:32,901 - experiment_functions - INFO - Early stopping at epoch 850. Best Recall: 0.0690
2026-05-20 06:18:33,678 - optuna.study.study - INFO - Trial 133 finished with value: 0.06901269511016775 and parameters: {'n_layers': 1, 'embedding_dim': 64, 'lr': 0.000713013466536761, 'lambda_val': 0.0002650310207621596, 'batch_size': 2582, 'optimizer': 'Adam'}. Best is trial 122 with value: 0.08511865658067046.
2026-05-20 06:18:54,751 - experiment_functions - INFO - Early stopping at epoch 850. Best Recall: 0.0768
2026-05-20 06:18:54,884 - optuna.study.study - INFO - Trial 134 finished with value: 0.07677475633240229 and parameters: {'n_layers': 1, 'embedding_dim': 64, 'lr': 0.0008322973103952856, 'lambda_val': 0.0006947713792462964, 'batch_size': 2262, 'optimizer': 'Adam'}. Best is trial 122 with value: 0.08511865658067046.
2026-05-20 06:19:18,154 - experiment_functions - INFO - Early stopping at epoch 1500. Best Recall: 0.0835
2026-05-20 06:19:18,244 - optuna.study.study - INFO - Trial 135 finished with value: 0.08353976235131862 and parameters: {'n_layers': 1, 'embedding_dim': 256, 'lr': 0.0006039007535830242, 'lambda_val': 0.0003716276893203946, 'batch_size': 530, 'optimizer': 'Adam'}. Best is trial 122 with value: 0.08511865658067046.
2026-05-20 06:19:38,128 - experiment_functions - INFO - Early stopping at epoch 1250. Best Recall: 0.0811
2026-05-20 06:19:38,218 - optuna.study.study - INFO - Trial 136 finished with value: 0.08108880753680892 and parameters: {'n_layers': 1, 'embedding_dim': 256, 'lr': 0.0005909573875212996, 'lambda_val': 0.0004024061505522181, 'batch_size': 715, 'optimizer': 'Adam'}. Best is trial 122 with value: 0.08511865658067046.
2026-05-20 06:20:05,203 - experiment_functions - INFO - Early stopping at epoch 1700. Best Recall: 0.0818
2026-05-20 06:20:05,292 - optuna.study.study - INFO - Trial 137 finished with value: 0.08176332419554456 and parameters: {'n_layers': 1, 'embedding_dim': 256, 'lr': 0.0005265890143021791, 'lambda_val': 0.0003857734796589005, 'batch_size': 515, 'optimizer': 'Adam'}. Best is trial 122 with value: 0.08511865658067046.
2026-05-20 06:20:29,617 - experiment_functions - INFO - Early stopping at epoch 1550. Best Recall: 0.0798
2026-05-20 06:20:29,717 - optuna.study.study - INFO - Trial 138 finished with value: 0.07984121416524391 and parameters: {'n_layers': 1, 'embedding_dim': 256, 'lr': 0.00046808357427175433, 'lambda_val': 0.001407756732654258, 'batch_size': 538, 'optimizer': 'RMSprop'}. Best is trial 122 with value: 0.08511865658067046.
2026-05-20 06:20:50,352 - experiment_functions - INFO - Early stopping at epoch 1300. Best Recall: 0.0831
2026-05-20 06:20:50,486 - optuna.study.study - INFO - Trial 139 finished with value: 0.08312774609958509 and parameters: {'n_layers': 1, 'embedding_dim': 256, 'lr': 0.0005639296232511946, 'lambda_val': 0.0003895562999392, 'batch_size': 733, 'optimizer': 'Adam'}. Best is trial 122 with value: 0.08511865658067046.
2026-05-20 06:21:05,855 - optuna.study._optimize - INFO - Trial 140 pruned. 
2026-05-20 06:21:25,841 - experiment_functions - INFO - Early stopping at epoch 1250. Best Recall: 0.0822
2026-05-20 06:21:25,930 - optuna.study.study - INFO - Trial 141 finished with value: 0.0822426622984855 and parameters: {'n_layers': 1, 'embedding_dim': 256, 'lr': 0.0005980742176066934, 'lambda_val': 0.0003910620414302391, 'batch_size': 706, 'optimizer': 'Adam'}. Best is trial 122 with value: 0.08511865658067046.
2026-05-20 06:21:43,428 - experiment_functions - INFO - Early stopping at epoch 1100. Best Recall: 0.0802
2026-05-20 06:21:43,573 - optuna.study.study - INFO - Trial 142 finished with value: 0.08019746995456206 and parameters: {'n_layers': 1, 'embedding_dim': 256, 'lr': 0.0006425400858968689, 'lambda_val': 0.0005684045156435632, 'batch_size': 814, 'optimizer': 'Adam'}. Best is trial 122 with value: 0.08511865658067046.
2026-05-20 06:21:59,217 - optuna.study._optimize - INFO - Trial 143 pruned. 
2026-05-20 06:22:29,969 - experiment_functions - INFO - Early stopping at epoch 2000. Best Recall: 0.0832
2026-05-20 06:22:30,058 - optuna.study.study - INFO - Trial 144 finished with value: 0.0832185411745743 and parameters: {'n_layers': 1, 'embedding_dim': 256, 'lr': 0.0004967172358358472, 'lambda_val': 0.00022790166630467804, 'batch_size': 515, 'optimizer': 'Adam'}. Best is trial 122 with value: 0.08511865658067046.
2026-05-20 06:22:56,754 - experiment_functions - INFO - Early stopping at epoch 1700. Best Recall: 0.0803
2026-05-20 06:22:56,887 - optuna.study.study - INFO - Trial 145 finished with value: 0.08033326005227917 and parameters: {'n_layers': 1, 'embedding_dim': 256, 'lr': 0.0005046097752357913, 'lambda_val': 0.00022477681312413282, 'batch_size': 586, 'optimizer': 'Adam'}. Best is trial 122 with value: 0.08511865658067046.
2026-05-20 06:23:12,589 - optuna.study._optimize - INFO - Trial 146 pruned. 
2026-05-20 06:23:30,888 - experiment_functions - INFO - Early stopping at epoch 1150. Best Recall: 0.0810
2026-05-20 06:23:30,977 - optuna.study.study - INFO - Trial 147 finished with value: 0.08102081688361436 and parameters: {'n_layers': 1, 'embedding_dim': 256, 'lr': 0.0006483633887689356, 'lambda_val': 8.502387304117874e-05, 'batch_size': 718, 'optimizer': 'Adam'}. Best is trial 122 with value: 0.08511865658067046.
2026-05-20 06:23:46,934 - optuna.study._optimize - INFO - Trial 148 pruned. 
2026-05-20 06:24:09,556 - experiment_functions - INFO - Early stopping at epoch 1450. Best Recall: 0.0809
2026-05-20 06:24:09,700 - optuna.study.study - INFO - Trial 149 finished with value: 0.0809137515092669 and parameters: {'n_layers': 1, 'embedding_dim': 256, 'lr': 0.0005169478080374999, 'lambda_val': 0.0001482826248250873, 'batch_size': 804, 'optimizer': 'Adam'}. Best is trial 122 with value: 0.08511865658067046.
2026-05-20 06:24:26,652 - experiment_functions - INFO - Early stopping at epoch 1050. Best Recall: 0.0790
2026-05-20 06:24:26,742 - optuna.study.study - INFO - Trial 150 finished with value: 0.07900182181024598 and parameters: {'n_layers': 1, 'embedding_dim': 256, 'lr': 0.0007721189032288683, 'lambda_val': 0.00022324503504329382, 'batch_size': 649, 'optimizer': 'Adam'}. Best is trial 122 with value: 0.08511865658067046.
2026-05-20 06:24:41,703 - optuna.study._optimize - INFO - Trial 151 pruned. 
2026-05-20 06:24:57,174 - optuna.study._optimize - INFO - Trial 152 pruned. 
2026-05-20 06:25:11,555 - experiment_functions - INFO - Early stopping at epoch 800. Best Recall: 0.0784
2026-05-20 06:25:11,690 - optuna.study.study - INFO - Trial 153 finished with value: 0.07837167280825623 and parameters: {'n_layers': 1, 'embedding_dim': 256, 'lr': 0.001166992447205144, 'lambda_val': 0.0007671556812909733, 'batch_size': 938, 'optimizer': 'Adam'}. Best is trial 122 with value: 0.08511865658067046.
2026-05-20 06:25:29,294 - experiment_functions - INFO - Early stopping at epoch 1100. Best Recall: 0.0816
2026-05-20 06:25:29,385 - optuna.study.study - INFO - Trial 154 finished with value: 0.08164359108715682 and parameters: {'n_layers': 1, 'embedding_dim': 256, 'lr': 0.0006640585751561549, 'lambda_val': 0.0004720905554818683, 'batch_size': 739, 'optimizer': 'Adam'}. Best is trial 122 with value: 0.08511865658067046.
2026-05-20 06:25:49,412 - experiment_functions - INFO - Early stopping at epoch 1250. Best Recall: 0.0789
2026-05-20 06:25:49,515 - optuna.study.study - INFO - Trial 155 finished with value: 0.07888841503201609 and parameters: {'n_layers': 1, 'embedding_dim': 256, 'lr': 0.0005794921576954674, 'lambda_val': 0.0005567489127487765, 'batch_size': 723, 'optimizer': 'Adam'}. Best is trial 122 with value: 0.08511865658067046.
2026-05-20 06:26:03,415 - experiment_functions - INFO - Early stopping at epoch 850. Best Recall: 0.0803
2026-05-20 06:26:03,504 - optuna.study.study - INFO - Trial 156 finished with value: 0.08029777404686639 and parameters: {'n_layers': 1, 'embedding_dim': 256, 'lr': 0.0009513257651033379, 'lambda_val': 0.00018298671264745724, 'batch_size': 856, 'optimizer': 'Adam'}. Best is trial 122 with value: 0.08511865658067046.
2026-05-20 06:26:22,424 - experiment_functions - INFO - Early stopping at epoch 1200. Best Recall: 0.0838
2026-05-20 06:26:22,502 - optuna.study.study - INFO - Trial 157 finished with value: 0.08380122532374522 and parameters: {'n_layers': 1, 'embedding_dim': 256, 'lr': 0.0007361836913724694, 'lambda_val': 0.00042377200980441503, 'batch_size': 516, 'optimizer': 'Adam'}. Best is trial 122 with value: 0.08511865658067046.
2026-05-20 06:26:30,463 - experiment_functions - INFO - Early stopping at epoch 500. Best Recall: 0.0052
2026-05-20 06:26:30,599 - optuna.study.study - INFO - Trial 158 finished with value: 0.005239793020299467 and parameters: {'n_layers': 1, 'embedding_dim': 256, 'lr': 0.0007286541126379066, 'lambda_val': 0.00026509599359921123, 'batch_size': 767, 'optimizer': 'SGD'}. Best is trial 122 with value: 0.08511865658067046.
2026-05-20 06:26:56,201 - experiment_functions - INFO - Early stopping at epoch 1600. Best Recall: 0.0828
2026-05-20 06:26:56,334 - optuna.study.study - INFO - Trial 159 finished with value: 0.08282515447923994 and parameters: {'n_layers': 1, 'embedding_dim': 256, 'lr': 0.0005390289130002285, 'lambda_val': 0.0011700029745266957, 'batch_size': 524, 'optimizer': 'Adam'}. Best is trial 122 with value: 0.08511865658067046.
2026-05-20 06:27:15,809 - experiment_functions - INFO - Early stopping at epoch 1250. Best Recall: 0.0785
2026-05-20 06:27:15,898 - optuna.study.study - INFO - Trial 160 finished with value: 0.07848329883734696 and parameters: {'n_layers': 1, 'embedding_dim': 256, 'lr': 0.000664694382237314, 'lambda_val': 0.0018343778085951024, 'batch_size': 521, 'optimizer': 'Adam'}. Best is trial 122 with value: 0.08511865658067046.
2026-05-20 06:27:48,002 - experiment_functions - INFO - Early stopping at epoch 2050. Best Recall: 0.0826
2026-05-20 06:27:48,091 - optuna.study.study - INFO - Trial 161 finished with value: 0.08255532651815077 and parameters: {'n_layers': 1, 'embedding_dim': 256, 'lr': 0.0004377608815360035, 'lambda_val': 0.0011654425134441557, 'batch_size': 660, 'optimizer': 'Adam'}. Best is trial 122 with value: 0.08511865658067046.
2026-05-20 06:28:09,466 - experiment_functions - INFO - Early stopping at epoch 1350. Best Recall: 0.0786
2026-05-20 06:28:09,619 - optuna.study.study - INFO - Trial 162 finished with value: 0.07863675812969759 and parameters: {'n_layers': 1, 'embedding_dim': 256, 'lr': 0.0005453951385279526, 'lambda_val': 0.002399085979765694, 'batch_size': 682, 'optimizer': 'Adam'}. Best is trial 122 with value: 0.08511865658067046.
2026-05-20 06:28:25,196 - optuna.study._optimize - INFO - Trial 163 pruned. 
2026-05-20 06:28:42,185 - experiment_functions - INFO - Early stopping at epoch 1050. Best Recall: 0.0805
2026-05-20 06:28:42,264 - optuna.study.study - INFO - Trial 164 finished with value: 0.08054332485761455 and parameters: {'n_layers': 1, 'embedding_dim': 256, 'lr': 0.00082743865783693, 'lambda_val': 0.001101353421904875, 'batch_size': 572, 'optimizer': 'Adam'}. Best is trial 122 with value: 0.08511865658067046.
2026-05-20 06:28:57,557 - optuna.study._optimize - INFO - Trial 165 pruned. 
2026-05-20 06:29:16,301 - experiment_functions - INFO - Early stopping at epoch 1200. Best Recall: 0.0808
2026-05-20 06:29:16,400 - optuna.study.study - INFO - Trial 166 finished with value: 0.08076779245149295 and parameters: {'n_layers': 1, 'embedding_dim': 256, 'lr': 0.0005412629328141582, 'lambda_val': 0.004745255669965742, 'batch_size': 756, 'optimizer': 'Adam'}. Best is trial 122 with value: 0.08511865658067046.
2026-05-20 06:29:31,729 - optuna.study._optimize - INFO - Trial 167 pruned. 
2026-05-20 06:29:53,613 - experiment_functions - INFO - Early stopping at epoch 1400. Best Recall: 0.0796
2026-05-20 06:29:53,740 - optuna.study.study - INFO - Trial 168 finished with value: 0.07955618695782309 and parameters: {'n_layers': 1, 'embedding_dim': 256, 'lr': 0.0006557152732881433, 'lambda_val': 0.00014147464123168683, 'batch_size': 516, 'optimizer': 'Adam'}. Best is trial 122 with value: 0.08511865658067046.
2026-05-20 06:30:14,214 - optuna.study._optimize - INFO - Trial 169 pruned. 
2026-05-20 06:30:28,929 - experiment_functions - INFO - Early stopping at epoch 900. Best Recall: 0.0793
2026-05-20 06:30:29,029 - optuna.study.study - INFO - Trial 170 finished with value: 0.07927970477713871 and parameters: {'n_layers': 1, 'embedding_dim': 256, 'lr': 0.000980796109654654, 'lambda_val': 0.0005142274418259602, 'batch_size': 631, 'optimizer': 'Adam'}. Best is trial 122 with value: 0.08511865658067046.
2026-05-20 06:30:44,597 - experiment_functions - INFO - Early stopping at epoch 800. Best Recall: 0.0594
2026-05-20 06:30:44,697 - optuna.study.study - INFO - Trial 171 finished with value: 0.05939499674906148 and parameters: {'n_layers': 3, 'embedding_dim': 256, 'lr': 0.00042489852557330384, 'lambda_val': 0.0008230195081559725, 'batch_size': 959, 'optimizer': 'Adam'}. Best is trial 122 with value: 0.08511865658067046.
2026-05-20 06:31:13,787 - experiment_functions - INFO - Early stopping at epoch 1900. Best Recall: 0.0834
2026-05-20 06:31:13,920 - optuna.study.study - INFO - Trial 172 finished with value: 0.08337325568187777 and parameters: {'n_layers': 1, 'embedding_dim': 256, 'lr': 0.00047719987075249, 'lambda_val': 0.0004735808623574067, 'batch_size': 589, 'optimizer': 'Adam'}. Best is trial 122 with value: 0.08511865658067046.
2026-05-20 06:31:39,037 - experiment_functions - INFO - Early stopping at epoch 1600. Best Recall: 0.0808
2026-05-20 06:31:39,126 - optuna.study.study - INFO - Trial 173 finished with value: 0.08084899772990457 and parameters: {'n_layers': 1, 'embedding_dim': 256, 'lr': 0.000493449129422647, 'lambda_val': 0.00028087315767893914, 'batch_size': 569, 'optimizer': 'Adam'}. Best is trial 122 with value: 0.08511865658067046.
2026-05-20 06:31:57,190 - experiment_functions - INFO - Early stopping at epoch 1150. Best Recall: 0.0810
2026-05-20 06:31:57,281 - optuna.study.study - INFO - Trial 174 finished with value: 0.08104253414159034 and parameters: {'n_layers': 1, 'embedding_dim': 256, 'lr': 0.0007342765435152062, 'lambda_val': 0.0004476695569491548, 'batch_size': 705, 'optimizer': 'Adam'}. Best is trial 122 with value: 0.08511865658067046.
2026-05-20 06:32:12,584 - optuna.study._optimize - INFO - Trial 175 pruned. 
2026-05-20 06:32:33,127 - experiment_functions - INFO - Early stopping at epoch 1350. Best Recall: 0.0832
2026-05-20 06:32:33,256 - optuna.study.study - INFO - Trial 176 finished with value: 0.08319048908139139 and parameters: {'n_layers': 1, 'embedding_dim': 256, 'lr': 0.0006106691032272859, 'lambda_val': 0.00011070540600288494, 'batch_size': 512, 'optimizer': 'Adam'}. Best is trial 122 with value: 0.08511865658067046.
2026-05-20 06:32:50,627 - experiment_functions - INFO - Early stopping at epoch 1100. Best Recall: 0.0846
2026-05-20 06:32:50,716 - optuna.study.study - INFO - Trial 177 finished with value: 0.08459579287983754 and parameters: {'n_layers': 1, 'embedding_dim': 256, 'lr': 0.0007893932033445193, 'lambda_val': 0.0006429076880406454, 'batch_size': 518, 'optimizer': 'Adam'}. Best is trial 122 with value: 0.08511865658067046.
2026-05-20 06:33:07,127 - experiment_functions - INFO - Early stopping at epoch 1050. Best Recall: 0.0848
2026-05-20 06:33:07,226 - optuna.study.study - INFO - Trial 178 finished with value: 0.08479247785995596 and parameters: {'n_layers': 1, 'embedding_dim': 256, 'lr': 0.0008479370555706533, 'lambda_val': 0.0005746707880028253, 'batch_size': 513, 'optimizer': 'Adam'}. Best is trial 122 with value: 0.08511865658067046.
2026-05-20 06:33:23,905 - experiment_functions - INFO - Early stopping at epoch 1050. Best Recall: 0.0829
2026-05-20 06:33:23,992 - optuna.study.study - INFO - Trial 179 finished with value: 0.08293257684922917 and parameters: {'n_layers': 1, 'embedding_dim': 256, 'lr': 0.0008214040721616072, 'lambda_val': 0.0005691175902648342, 'batch_size': 607, 'optimizer': 'Adam'}. Best is trial 122 with value: 0.08511865658067046.
2026-05-20 06:33:39,576 - experiment_functions - INFO - Early stopping at epoch 950. Best Recall: 0.0760
2026-05-20 06:33:39,677 - optuna.study.study - INFO - Trial 180 finished with value: 0.0760012593903684 and parameters: {'n_layers': 1, 'embedding_dim': 256, 'lr': 0.0009211502671251517, 'lambda_val': 0.0007281246823194477, 'batch_size': 616, 'optimizer': 'Adam'}. Best is trial 122 with value: 0.08511865658067046.
2026-05-20 06:33:54,873 - experiment_functions - INFO - Early stopping at epoch 950. Best Recall: 0.0800
2026-05-20 06:33:54,963 - optuna.study.study - INFO - Trial 181 finished with value: 0.07995883679274893 and parameters: {'n_layers': 1, 'embedding_dim': 256, 'lr': 0.0008391216918122573, 'lambda_val': 0.0013959760350980923, 'batch_size': 657, 'optimizer': 'Adam'}. Best is trial 122 with value: 0.08511865658067046.
2026-05-20 06:34:09,363 - experiment_functions - INFO - Early stopping at epoch 900. Best Recall: 0.0780
2026-05-20 06:34:09,451 - optuna.study.study - INFO - Trial 182 finished with value: 0.07795688532243983 and parameters: {'n_layers': 1, 'embedding_dim': 256, 'lr': 0.001063856350001333, 'lambda_val': 0.0005635866790180814, 'batch_size': 523, 'optimizer': 'Adam'}. Best is trial 122 with value: 0.08511865658067046.
2026-05-20 06:34:29,021 - experiment_functions - INFO - Early stopping at epoch 1200. Best Recall: 0.0788
2026-05-20 06:34:29,785 - optuna.study.study - INFO - Trial 183 finished with value: 0.07876946831881006 and parameters: {'n_layers': 1, 'embedding_dim': 256, 'lr': 0.0006175932542382937, 'lambda_val': 0.0006430564901015236, 'batch_size': 611, 'optimizer': 'Adam'}. Best is trial 122 with value: 0.08511865658067046.
2026-05-20 06:34:54,520 - experiment_functions - INFO - Early stopping at epoch 1050. Best Recall: 0.0805
2026-05-20 06:34:54,620 - optuna.study.study - INFO - Trial 184 finished with value: 0.0804596222406796 and parameters: {'n_layers': 1, 'embedding_dim': 256, 'lr': 0.0007974209110308889, 'lambda_val': 0.001026109711454707, 'batch_size': 513, 'optimizer': 'Adam'}. Best is trial 122 with value: 0.08511865658067046.
2026-05-20 06:35:07,315 - experiment_functions - INFO - Early stopping at epoch 850. Best Recall: 0.0838
2026-05-20 06:35:07,624 - optuna.study.study - INFO - Trial 185 finished with value: 0.08378281745464161 and parameters: {'n_layers': 1, 'embedding_dim': 96, 'lr': 0.0012557901566466665, 'lambda_val': 0.0002658600008865028, 'batch_size': 691, 'optimizer': 'Adam'}. Best is trial 122 with value: 0.08511865658067046.
2026-05-20 06:35:19,708 - experiment_functions - INFO - Early stopping at epoch 800. Best Recall: 0.0835
2026-05-20 06:35:19,787 - optuna.study.study - INFO - Trial 186 finished with value: 0.08352760007461436 and parameters: {'n_layers': 1, 'embedding_dim': 96, 'lr': 0.0013388213768467591, 'lambda_val': 0.0004751319329493501, 'batch_size': 785, 'optimizer': 'Adam'}. Best is trial 122 with value: 0.08511865658067046.
2026-05-20 06:35:31,040 - experiment_functions - INFO - Early stopping at epoch 750. Best Recall: 0.0848
2026-05-20 06:35:31,118 - optuna.study.study - INFO - Trial 187 finished with value: 0.08484279253203598 and parameters: {'n_layers': 1, 'embedding_dim': 96, 'lr': 0.0014735779213689872, 'lambda_val': 0.0005991814982255898, 'batch_size': 829, 'optimizer': 'Adam'}. Best is trial 122 with value: 0.08511865658067046.
2026-05-20 06:35:41,936 - experiment_functions - INFO - Early stopping at epoch 700. Best Recall: 0.0804
2026-05-20 06:35:42,026 - optuna.study.study - INFO - Trial 188 finished with value: 0.08035662385093167 and parameters: {'n_layers': 1, 'embedding_dim': 96, 'lr': 0.0016417118531016955, 'lambda_val': 0.0008464359604220882, 'batch_size': 871, 'optimizer': 'Adam'}. Best is trial 122 with value: 0.08511865658067046.
2026-05-20 06:35:54,341 - experiment_functions - INFO - Early stopping at epoch 800. Best Recall: 0.0849
2026-05-20 06:35:54,431 - optuna.study.study - INFO - Trial 189 finished with value: 0.08492994632842016 and parameters: {'n_layers': 1, 'embedding_dim': 96, 'lr': 0.001342030099905022, 'lambda_val': 0.0006642830567182421, 'batch_size': 827, 'optimizer': 'Adam'}. Best is trial 122 with value: 0.08511865658067046.
2026-05-20 06:36:06,482 - experiment_functions - INFO - Early stopping at epoch 800. Best Recall: 0.0828
2026-05-20 06:36:06,560 - optuna.study.study - INFO - Trial 190 finished with value: 0.0828484825528598 and parameters: {'n_layers': 1, 'embedding_dim': 96, 'lr': 0.0013145836348602603, 'lambda_val': 0.0006018349803467238, 'batch_size': 796, 'optimizer': 'Adam'}. Best is trial 122 with value: 0.08511865658067046.
2026-05-20 06:36:18,640 - experiment_functions - INFO - Early stopping at epoch 800. Best Recall: 0.0854
