2026-05-20 03:11:06,082 - optuna.study.study - INFO - Trial 257 finished with value: 0.08484224150948319 and parameters: {'n_layers': 1, 'embedding_dim': 256, 'lr': 0.0014860162926245923, 'lambda_val': 5.640290019735303e-06, 'batch_size': 3208, 'optimizer': 'Adam'}. Best is trial 236 with value: 0.08684913267554159.
2026-05-20 03:11:43,862 - experiment_functions - INFO - Early stopping at epoch 2200. Best Recall: 0.0843
2026-05-20 03:11:43,951 - optuna.study.study - INFO - Trial 258 finished with value: 0.08430796605686082 and parameters: {'n_layers': 1, 'embedding_dim': 256, 'lr': 0.0014055828907830854, 'lambda_val': 5.812809398485012e-06, 'batch_size': 3233, 'optimizer': 'Adam'}. Best is trial 236 with value: 0.08684913267554159.
2026-05-20 03:12:01,095 - optuna.study._optimize - INFO - Trial 259 pruned. 
2026-05-20 03:12:17,776 - optuna.study._optimize - INFO - Trial 260 pruned. 
2026-05-20 03:12:34,683 - optuna.study._optimize - INFO - Trial 261 pruned. 
2026-05-20 03:13:01,120 - optuna.study._optimize - INFO - Trial 262 pruned. 
2026-05-20 03:13:29,027 - experiment_functions - INFO - Early stopping at epoch 1600. Best Recall: 0.0832
2026-05-20 03:13:29,127 - optuna.study.study - INFO - Trial 263 finished with value: 0.08316318229946985 and parameters: {'n_layers': 1, 'embedding_dim': 256, 'lr': 0.0018678493679014625, 'lambda_val': 3.8255453715981615e-06, 'batch_size': 3210, 'optimizer': 'Adam'}. Best is trial 236 with value: 0.08684913267554159.
2026-05-20 03:14:15,653 - experiment_functions - INFO - Early stopping at epoch 2900. Best Recall: 0.0837
2026-05-20 03:14:15,786 - optuna.study.study - INFO - Trial 264 finished with value: 0.08369703683687976 and parameters: {'n_layers': 1, 'embedding_dim': 256, 'lr': 0.0012488509729490962, 'lambda_val': 2.9395361668333878e-06, 'batch_size': 3164, 'optimizer': 'Adam'}. Best is trial 236 with value: 0.08684913267554159.
2026-05-20 03:14:40,995 - optuna.study._optimize - INFO - Trial 265 pruned. 
2026-05-20 03:14:58,178 - optuna.study._optimize - INFO - Trial 266 pruned. 
2026-05-20 03:15:09,782 - experiment_functions - INFO - Early stopping at epoch 550. Best Recall: 0.0420
2026-05-20 03:15:09,872 - optuna.study.study - INFO - Trial 267 finished with value: 0.04203265759061101 and parameters: {'n_layers': 3, 'embedding_dim': 256, 'lr': 0.0025475515141294676, 'lambda_val': 6.886404869630734e-06, 'batch_size': 2712, 'optimizer': 'Adam'}. Best is trial 236 with value: 0.08684913267554159.
2026-05-20 03:15:21,971 - experiment_functions - INFO - Early stopping at epoch 750. Best Recall: 0.0712
2026-05-20 03:15:22,105 - optuna.study.study - INFO - Trial 268 finished with value: 0.0712215065415074 and parameters: {'n_layers': 1, 'embedding_dim': 128, 'lr': 0.0018764885509259487, 'lambda_val': 2.290394917366555e-06, 'batch_size': 3272, 'optimizer': 'Adam'}. Best is trial 236 with value: 0.08684913267554159.
2026-05-20 03:15:34,797 - experiment_functions - INFO - Early stopping at epoch 700. Best Recall: 0.0763
2026-05-20 03:15:34,941 - optuna.study.study - INFO - Trial 269 finished with value: 0.07629765569519645 and parameters: {'n_layers': 1, 'embedding_dim': 256, 'lr': 0.0015438445093244014, 'lambda_val': 3.851403056454222e-06, 'batch_size': 3026, 'optimizer': 'Adam'}. Best is trial 236 with value: 0.08684913267554159.
2026-05-20 03:15:50,376 - experiment_functions - INFO - Early stopping at epoch 850. Best Recall: 0.0790
2026-05-20 03:15:50,511 - optuna.study.study - INFO - Trial 270 finished with value: 0.07897045302036836 and parameters: {'n_layers': 1, 'embedding_dim': 256, 'lr': 0.0012390578939947424, 'lambda_val': 6.769174423854794e-06, 'batch_size': 3169, 'optimizer': 'Adam'}. Best is trial 236 with value: 0.08684913267554159.
2026-05-20 03:16:21,541 - experiment_functions - INFO - Early stopping at epoch 1850. Best Recall: 0.0822
2026-05-20 03:16:22,230 - optuna.study.study - INFO - Trial 271 finished with value: 0.08223108033105758 and parameters: {'n_layers': 1, 'embedding_dim': 256, 'lr': 0.0019375226499378864, 'lambda_val': 5.627104989477794e-06, 'batch_size': 3114, 'optimizer': 'Adam'}. Best is trial 236 with value: 0.08684913267554159.
2026-05-20 03:17:09,185 - experiment_functions - INFO - Early stopping at epoch 3000. Best Recall: 0.0838
2026-05-20 03:17:09,318 - optuna.study.study - INFO - Trial 272 finished with value: 0.08379239243043156 and parameters: {'n_layers': 1, 'embedding_dim': 256, 'lr': 0.0014400439843103203, 'lambda_val': 2.98288061163256e-06, 'batch_size': 2946, 'optimizer': 'Adam'}. Best is trial 236 with value: 0.08684913267554159.
2026-05-20 03:17:26,394 - optuna.study._optimize - INFO - Trial 273 pruned. 
2026-05-20 03:17:56,050 - experiment_functions - INFO - Early stopping at epoch 1850. Best Recall: 0.0817
2026-05-20 03:17:56,184 - optuna.study.study - INFO - Trial 274 finished with value: 0.08173320359578015 and parameters: {'n_layers': 1, 'embedding_dim': 256, 'lr': 0.0024961701721905134, 'lambda_val': 3.6579620158097304e-06, 'batch_size': 3399, 'optimizer': 'Adam'}. Best is trial 236 with value: 0.08684913267554159.
2026-05-20 03:18:14,345 - optuna.study._optimize - INFO - Trial 275 pruned. 
2026-05-20 03:18:22,660 - experiment_functions - INFO - Early stopping at epoch 500. Best Recall: 0.0051
2026-05-20 03:18:22,729 - optuna.study.study - INFO - Trial 276 finished with value: 0.005146884590433882 and parameters: {'n_layers': 1, 'embedding_dim': 256, 'lr': 0.0013119366545197844, 'lambda_val': 6.112987090699851e-06, 'batch_size': 2860, 'optimizer': 'SGD'}. Best is trial 236 with value: 0.08684913267554159.
2026-05-20 03:18:48,463 - experiment_functions - INFO - Early stopping at epoch 1600. Best Recall: 0.0822
2026-05-20 03:18:49,228 - optuna.study.study - INFO - Trial 277 finished with value: 0.08219531743781155 and parameters: {'n_layers': 1, 'embedding_dim': 256, 'lr': 0.002072706430065388, 'lambda_val': 2.4929239100959455e-06, 'batch_size': 3254, 'optimizer': 'Adam'}. Best is trial 236 with value: 0.08684913267554159.
2026-05-20 03:19:12,456 - optuna.study._optimize - INFO - Trial 278 pruned. 
2026-05-20 03:19:28,087 - optuna.study._optimize - INFO - Trial 279 pruned. 
2026-05-20 03:20:09,401 - experiment_functions - INFO - Early stopping at epoch 2150. Best Recall: 0.0833
2026-05-20 03:20:10,175 - optuna.study.study - INFO - Trial 280 finished with value: 0.0832523072377396 and parameters: {'n_layers': 1, 'embedding_dim': 256, 'lr': 0.0016871576547703635, 'lambda_val': 3.4052328343942073e-06, 'batch_size': 3070, 'optimizer': 'Adam'}. Best is trial 236 with value: 0.08684913267554159.
2026-05-20 03:20:58,355 - optuna.study._optimize - INFO - Trial 281 pruned. 
2026-05-20 03:21:08,702 - experiment_functions - INFO - Early stopping at epoch 600. Best Recall: 0.0730
2026-05-20 03:21:08,836 - optuna.study.study - INFO - Trial 282 finished with value: 0.07300417757512863 and parameters: {'n_layers': 1, 'embedding_dim': 256, 'lr': 0.0022765352241821673, 'lambda_val': 0.0046676878830474245, 'batch_size': 2896, 'optimizer': 'Adam'}. Best is trial 236 with value: 0.08684913267554159.
2026-05-20 03:21:25,430 - optuna.study._optimize - INFO - Trial 283 pruned. 
2026-05-20 03:21:48,670 - optuna.study._optimize - INFO - Trial 284 pruned. 
2026-05-20 03:22:33,962 - experiment_functions - INFO - Early stopping at epoch 2650. Best Recall: 0.0847
2026-05-20 03:22:34,105 - optuna.study.study - INFO - Trial 285 finished with value: 0.08467740684506399 and parameters: {'n_layers': 1, 'embedding_dim': 256, 'lr': 0.0019049756672840062, 'lambda_val': 4.704410174068777e-06, 'batch_size': 2805, 'optimizer': 'Adam'}. Best is trial 236 with value: 0.08684913267554159.
2026-05-20 03:22:55,195 - optuna.study._optimize - INFO - Trial 286 pruned. 
2026-05-20 03:23:15,189 - optuna.study._optimize - INFO - Trial 287 pruned. 
2026-05-20 03:23:43,324 - experiment_functions - INFO - Early stopping at epoch 1750. Best Recall: 0.0850
2026-05-20 03:23:43,480 - optuna.study.study - INFO - Trial 288 finished with value: 0.08501840991785561 and parameters: {'n_layers': 1, 'embedding_dim': 256, 'lr': 0.0016712434111737552, 'lambda_val': 3.338911232242405e-06, 'batch_size': 2939, 'optimizer': 'Adam'}. Best is trial 236 with value: 0.08684913267554159.
2026-05-20 03:24:06,128 - optuna.study._optimize - INFO - Trial 289 pruned. 
2026-05-20 03:24:25,600 - optuna.study._optimize - INFO - Trial 290 pruned. 
2026-05-20 03:24:40,975 - optuna.study._optimize - INFO - Trial 291 pruned. 
2026-05-20 03:25:06,356 - experiment_functions - INFO - Early stopping at epoch 1450. Best Recall: 0.0816
2026-05-20 03:25:06,445 - optuna.study.study - INFO - Trial 292 finished with value: 0.08163257998093304 and parameters: {'n_layers': 1, 'embedding_dim': 256, 'lr': 0.0016856957398635002, 'lambda_val': 5.0747801908312235e-06, 'batch_size': 2983, 'optimizer': 'Adam'}. Best is trial 236 with value: 0.08684913267554159.
2026-05-20 03:25:18,271 - experiment_functions - INFO - Early stopping at epoch 550. Best Recall: 0.0396
2026-05-20 03:25:18,359 - optuna.study.study - INFO - Trial 293 finished with value: 0.03956391782470401 and parameters: {'n_layers': 4, 'embedding_dim': 256, 'lr': 0.0020633401370100334, 'lambda_val': 3.2717930982268468e-06, 'batch_size': 1590, 'optimizer': 'Adam'}. Best is trial 236 with value: 0.08684913267554159.
2026-05-20 03:25:30,260 - experiment_functions - INFO - Early stopping at epoch 700. Best Recall: 0.0713
2026-05-20 03:25:30,350 - optuna.study.study - INFO - Trial 294 finished with value: 0.07126696941224615 and parameters: {'n_layers': 1, 'embedding_dim': 256, 'lr': 0.0016162319269926032, 'lambda_val': 0.0017675718385274269, 'batch_size': 2839, 'optimizer': 'Adam'}. Best is trial 236 with value: 0.08684913267554159.
2026-05-20 03:26:25,746 - experiment_functions - INFO - Early stopping at epoch 3200. Best Recall: 0.0836
2026-05-20 03:26:26,509 - optuna.study.study - INFO - Trial 295 finished with value: 0.08361997856651925 and parameters: {'n_layers': 1, 'embedding_dim': 256, 'lr': 0.0022988985866811596, 'lambda_val': 6.0351533038146e-06, 'batch_size': 2745, 'optimizer': 'Adam'}. Best is trial 236 with value: 0.08684913267554159.
2026-05-20 03:26:48,618 - optuna.study._optimize - INFO - Trial 296 pruned. 
2026-05-20 03:27:22,589 - experiment_functions - INFO - Early stopping at epoch 2050. Best Recall: 0.0838
2026-05-20 03:27:22,723 - optuna.study.study - INFO - Trial 297 finished with value: 0.083756144825619 and parameters: {'n_layers': 1, 'embedding_dim': 256, 'lr': 0.0014434281803938098, 'lambda_val': 7.601474574959603e-06, 'batch_size': 2905, 'optimizer': 'Adam'}. Best is trial 236 with value: 0.08684913267554159.
2026-05-20 03:27:39,370 - experiment_functions - INFO - Early stopping at epoch 900. Best Recall: 0.0763
2026-05-20 03:27:39,582 - optuna.study.study - INFO - Trial 298 finished with value: 0.07633509502851576 and parameters: {'n_layers': 1, 'embedding_dim': 256, 'lr': 0.0011278207800705677, 'lambda_val': 2.040108708118426e-06, 'batch_size': 3034, 'optimizer': 'Adam'}. Best is trial 236 with value: 0.08684913267554159.
2026-05-20 03:28:18,065 - experiment_functions - INFO - Early stopping at epoch 2300. Best Recall: 0.0836
2026-05-20 03:28:18,175 - optuna.study.study - INFO - Trial 299 finished with value: 0.08360904317090914 and parameters: {'n_layers': 1, 'embedding_dim': 256, 'lr': 0.001669682136655371, 'lambda_val': 3.177623579686174e-06, 'batch_size': 3686, 'optimizer': 'Adam'}. Best is trial 236 with value: 0.08684913267554159.
2026-05-20 03:28:18,176 - experiment_functions - INFO - Training the best model ... for e_1M_1c1dcs
2026-05-20 03:29:07,306 - root - INFO -   **** Training e_1M_1c1dcs_rand1
2026-05-20 03:29:07,360 - root - INFO -   **** Getting 190231/805443 random edges
2026-05-20 03:29:07,414 - experiment_functions - INFO - Training the best model ... for e_1M_1c1dcs_rand1
2026-05-20 03:29:15,833 - experiment_functions - INFO - Early stopping at epoch 700. Best Recall: 0.0565
2026-05-20 03:29:16,887 - root - INFO -   **** Training e_1M_1c1dcs_rand2
2026-05-20 03:29:16,942 - root - INFO -   **** Getting 190231/805443 random edges
2026-05-20 03:29:16,998 - experiment_functions - INFO - Training the best model ... for e_1M_1c1dcs_rand2
2026-05-20 03:29:25,575 - experiment_functions - INFO - Early stopping at epoch 700. Best Recall: 0.0552
2026-05-20 03:29:26,436 - root - INFO -   **** Training e_1M_1c1dcs_rand3
2026-05-20 03:29:26,491 - root - INFO -   **** Getting 190231/805443 random edges
2026-05-20 03:29:26,543 - experiment_functions - INFO - Training the best model ... for e_1M_1c1dcs_rand3
2026-05-20 03:29:35,106 - experiment_functions - INFO - Early stopping at epoch 700. Best Recall: 0.0547
2026-05-20 03:29:35,972 - root - INFO -   **** Training e_1M_1c1dcs_rand4
2026-05-20 03:29:36,028 - root - INFO -   **** Getting 190231/805443 random edges
2026-05-20 03:29:36,086 - experiment_functions - INFO - Training the best model ... for e_1M_1c1dcs_rand4
2026-05-20 03:29:44,661 - experiment_functions - INFO - Early stopping at epoch 700. Best Recall: 0.0545
2026-05-20 03:29:45,534 - root - INFO -   **** Training e_1M_1c1dcs_rand5
2026-05-20 03:29:45,590 - root - INFO -   **** Getting 190231/805443 random edges
2026-05-20 03:29:45,644 - experiment_functions - INFO - Training the best model ... for e_1M_1c1dcs_rand5
2026-05-20 03:29:54,203 - experiment_functions - INFO - Early stopping at epoch 700. Best Recall: 0.0577
2026-05-20 03:29:55,072 - root - INFO - **** Training e_1M_1c2dcs
2026-05-20 03:29:55,072 - root - INFO -   ** 2-Dominant stats:
2026-05-20 03:29:55,072 - root - INFO -   ** Finding the dominant set:
2026-05-20 04:12:02,712 - root - INFO -   ** Getting the trainable edges:
2026-05-20 04:12:02,733 - helper_functions - INFO -      Number of nodes: 4753
2026-05-20 04:12:02,733 - helper_functions - INFO -      Ratio: 0.48768725631028115
2026-05-20 04:12:02,733 - helper_functions - INFO -      Number of unique users: 3162
2026-05-20 04:12:02,733 - helper_functions - INFO -      Number of unique items: 1591
2026-05-20 04:12:02,733 - helper_functions - INFO -      Total dominant set edge: 20467
2026-05-20 04:12:02,733 - helper_functions - INFO -      Trainable edges: 16373.6
2026-05-20 04:12:02,770 - root - INFO -   **** Getting 20467 dominant set edges
2026-05-20 04:12:02,874 - optuna.storages._rdb.storage - INFO - A new study created in RDB with name: Study_e_1M_1c2dcs_strict
2026-05-20 04:12:11,828 - experiment_functions - INFO - Early stopping at epoch 550. Best Recall: 0.0048
2026-05-20 04:12:11,921 - optuna.study.study - INFO - Trial 0 finished with value: 0.004775500634244268 and parameters: {'n_layers': 3, 'embedding_dim': 256, 'lr': 1.4628852791244806e-05, 'lambda_val': 1.4889719215589764e-05, 'batch_size': 1849, 'optimizer': 'Adam'}. Best is trial 0 with value: 0.004775500634244268.
2026-05-20 04:12:19,150 - experiment_functions - INFO - Early stopping at epoch 500. Best Recall: 0.0051
2026-05-20 04:12:19,241 - optuna.study.study - INFO - Trial 1 finished with value: 0.005058744476864427 and parameters: {'n_layers': 1, 'embedding_dim': 128, 'lr': 0.012481439432715789, 'lambda_val': 0.0014358637414733594, 'batch_size': 2127, 'optimizer': 'RMSprop'}. Best is trial 1 with value: 0.005058744476864427.
2026-05-20 04:12:27,017 - experiment_functions - INFO - Early stopping at epoch 550. Best Recall: 0.0051
2026-05-20 04:12:27,107 - optuna.study.study - INFO - Trial 2 finished with value: 0.005055296697447789 and parameters: {'n_layers': 1, 'embedding_dim': 96, 'lr': 0.03475685440882514, 'lambda_val': 0.026852189650753918, 'batch_size': 1923, 'optimizer': 'SGD'}. Best is trial 1 with value: 0.005058744476864427.
2026-05-20 04:12:34,879 - experiment_functions - INFO - Early stopping at epoch 500. Best Recall: 0.0052
2026-05-20 04:12:34,982 - optuna.study.study - INFO - Trial 3 finished with value: 0.005194532782172242 and parameters: {'n_layers': 4, 'embedding_dim': 96, 'lr': 0.0003712494404068414, 'lambda_val': 0.00687286361049, 'batch_size': 1192, 'optimizer': 'SGD'}. Best is trial 3 with value: 0.005194532782172242.
2026-05-20 04:12:43,924 - experiment_functions - INFO - Early stopping at epoch 500. Best Recall: 0.0343
2026-05-20 04:12:44,073 - optuna.study.study - INFO - Trial 4 finished with value: 0.034279448980397635 and parameters: {'n_layers': 4, 'embedding_dim': 256, 'lr': 0.01296738615876489, 'lambda_val': 2.323536083469749e-05, 'batch_size': 3914, 'optimizer': 'RMSprop'}. Best is trial 4 with value: 0.034279448980397635.
2026-05-20 04:12:59,724 - experiment_functions - INFO - Early stopping at epoch 500. Best Recall: 0.0052
2026-05-20 04:13:00,500 - optuna.study.study - INFO - Trial 5 finished with value: 0.005160955941985264 and parameters: {'n_layers': 2, 'embedding_dim': 32, 'lr': 0.004766723300706875, 'lambda_val': 9.779101842959749e-05, 'batch_size': 2223, 'optimizer': 'RMSprop'}. Best is trial 4 with value: 0.034279448980397635.
2026-05-20 04:13:09,341 - experiment_functions - INFO - Early stopping at epoch 500. Best Recall: 0.0023
2026-05-20 04:13:09,441 - optuna.study.study - INFO - Trial 6 finished with value: 0.002304970591540502 and parameters: {'n_layers': 4, 'embedding_dim': 256, 'lr': 0.030066635111535, 'lambda_val': 0.007351452217094469, 'batch_size': 1491, 'optimizer': 'RMSprop'}. Best is trial 4 with value: 0.034279448980397635.
2026-05-20 04:13:16,941 - experiment_functions - INFO - Early stopping at epoch 500. Best Recall: 0.0047
2026-05-20 04:13:17,109 - optuna.study.study - INFO - Trial 7 finished with value: 0.004717238151998201 and parameters: {'n_layers': 2, 'embedding_dim': 96, 'lr': 0.001332074153540734, 'lambda_val': 0.021864469055538162, 'batch_size': 3177, 'optimizer': 'RMSprop'}. Best is trial 4 with value: 0.034279448980397635.
2026-05-20 04:13:24,732 - experiment_functions - INFO - Early stopping at epoch 500. Best Recall: 0.0053
2026-05-20 04:13:24,832 - optuna.study.study - INFO - Trial 8 finished with value: 0.005301101595045165 and parameters: {'n_layers': 1, 'embedding_dim': 64, 'lr': 1.9194982198312926e-05, 'lambda_val': 0.001933897000648867, 'batch_size': 792, 'optimizer': 'SGD'}. Best is trial 4 with value: 0.034279448980397635.
2026-05-20 04:13:33,147 - experiment_functions - INFO - Early stopping at epoch 550. Best Recall: 0.0363
2026-05-20 04:13:33,249 - optuna.study.study - INFO - Trial 9 finished with value: 0.03625390958337897 and parameters: {'n_layers': 1, 'embedding_dim': 256, 'lr': 0.0009151990551689132, 'lambda_val': 0.0010884010092269234, 'batch_size': 3060, 'optimizer': 'RMSprop'}. Best is trial 9 with value: 0.03625390958337897.
2026-05-20 04:14:27,345 - optuna.study.study - INFO - Trial 10 finished with value: 0.027657844851871942 and parameters: {'n_layers': 2, 'embedding_dim': 64, 'lr': 0.00014754586189214382, 'lambda_val': 2.774937022551325e-06, 'batch_size': 3155, 'optimizer': 'Adam'}. Best is trial 9 with value: 0.03625390958337897.
2026-05-20 04:14:42,732 - experiment_functions - INFO - Early stopping at epoch 500. Best Recall: 0.0059
2026-05-20 04:14:42,840 - optuna.study.study - INFO - Trial 11 finished with value: 0.0059459945462088165 and parameters: {'n_layers': 3, 'embedding_dim': 256, 'lr': 0.0026568751510860464, 'lambda_val': 8.071800598338535e-05, 'batch_size': 4052, 'optimizer': 'RMSprop'}. Best is trial 9 with value: 0.03625390958337897.
2026-05-20 04:14:51,003 - experiment_functions - INFO - Early stopping at epoch 500. Best Recall: 0.0350
2026-05-20 04:14:51,557 - optuna.study.study - INFO - Trial 12 finished with value: 0.03503676199984011 and parameters: {'n_layers': 3, 'embedding_dim': 256, 'lr': 0.08734846386648065, 'lambda_val': 0.0003361609569719316, 'batch_size': 4054, 'optimizer': 'RMSprop'}. Best is trial 9 with value: 0.03625390958337897.
2026-05-20 04:15:06,013 - experiment_functions - INFO - Early stopping at epoch 950. Best Recall: 0.0223
2026-05-20 04:15:06,146 - optuna.study.study - INFO - Trial 13 finished with value: 0.022307798373287006 and parameters: {'n_layers': 3, 'embedding_dim': 256, 'lr': 0.0002056871247157803, 'lambda_val': 0.0006365379474285005, 'batch_size': 3051, 'optimizer': 'RMSprop'}. Best is trial 9 with value: 0.03625390958337897.
2026-05-20 04:15:13,647 - experiment_functions - INFO - Early stopping at epoch 500. Best Recall: 0.0082
2026-05-20 04:15:13,747 - optuna.study.study - INFO - Trial 14 finished with value: 0.00820619478635213 and parameters: {'n_layers': 2, 'embedding_dim': 32, 'lr': 0.07035976445886173, 'lambda_val': 0.00022296204936668717, 'batch_size': 3553, 'optimizer': 'RMSprop'}. Best is trial 9 with value: 0.03625390958337897.
2026-05-20 04:15:24,354 - experiment_functions - INFO - Early stopping at epoch 700. Best Recall: 0.0162
2026-05-20 04:15:24,481 - optuna.study.study - INFO - Trial 15 finished with value: 0.016173588850701377 and parameters: {'n_layers': 3, 'embedding_dim': 128, 'lr': 0.0006007243617605572, 'lambda_val': 0.0004797526771867016, 'batch_size': 2608, 'optimizer': 'Adam'}. Best is trial 9 with value: 0.03625390958337897.
2026-05-20 04:15:44,309 - experiment_functions - INFO - Early stopping at epoch 1350. Best Recall: 0.0362
2026-05-20 04:15:44,496 - optuna.study.study - INFO - Trial 16 finished with value: 0.03620628719376217 and parameters: {'n_layers': 1, 'embedding_dim': 256, 'lr': 0.00013308381915586918, 'lambda_val': 0.0031031024179687876, 'batch_size': 2701, 'optimizer': 'RMSprop'}. Best is trial 9 with value: 0.03625390958337897.
2026-05-20 04:15:54,098 - experiment_functions - INFO - Early stopping at epoch 650. Best Recall: 0.0052
2026-05-20 04:15:54,188 - optuna.study.study - INFO - Trial 17 finished with value: 0.005181247948840197 and parameters: {'n_layers': 1, 'embedding_dim': 256, 'lr': 3.047645921619241e-05, 'lambda_val': 0.05136389405794858, 'batch_size': 2545, 'optimizer': 'RMSprop'}. Best is trial 9 with value: 0.03625390958337897.
