2026-05-20 08:06:01,831 - optuna.study.study - INFO - Trial 110 finished with value: 0.048492592463242536 and parameters: {'n_layers': 1, 'embedding_dim': 256, 'lr': 0.008309136280495885, 'lambda_val': 0.0005260175739664454, 'batch_size': 899, 'optimizer': 'Adam'}. Best is trial 74 with value: 0.06051849676418247.
2026-05-20 08:06:15,740 - experiment_functions - INFO - Early stopping at epoch 850. Best Recall: 0.0579
2026-05-20 08:06:16,504 - optuna.study.study - INFO - Trial 111 finished with value: 0.057857801762916855 and parameters: {'n_layers': 1, 'embedding_dim': 256, 'lr': 0.0004805608421714646, 'lambda_val': 0.0011797028608376127, 'batch_size': 677, 'optimizer': 'Adam'}. Best is trial 74 with value: 0.06051849676418247.
2026-05-20 08:06:34,610 - experiment_functions - INFO - Early stopping at epoch 800. Best Recall: 0.0329
2026-05-20 08:06:34,689 - optuna.study.study - INFO - Trial 112 finished with value: 0.03292483814142938 and parameters: {'n_layers': 1, 'embedding_dim': 256, 'lr': 0.00037610282225390343, 'lambda_val': 0.019220440789010616, 'batch_size': 761, 'optimizer': 'Adam'}. Best is trial 74 with value: 0.06051849676418247.
2026-05-20 08:06:42,776 - experiment_functions - INFO - Early stopping at epoch 550. Best Recall: 0.0512
2026-05-20 08:06:42,855 - optuna.study.study - INFO - Trial 113 finished with value: 0.05123803528726125 and parameters: {'n_layers': 1, 'embedding_dim': 256, 'lr': 0.005301232828972882, 'lambda_val': 0.0017310204555674286, 'batch_size': 665, 'optimizer': 'Adam'}. Best is trial 74 with value: 0.06051849676418247.
2026-05-20 08:06:53,835 - experiment_functions - INFO - Early stopping at epoch 800. Best Recall: 0.0565
2026-05-20 08:06:53,925 - optuna.study.study - INFO - Trial 114 finished with value: 0.05645977959034744 and parameters: {'n_layers': 1, 'embedding_dim': 256, 'lr': 0.0006463266620216485, 'lambda_val': 0.0007890311185953249, 'batch_size': 551, 'optimizer': 'Adam'}. Best is trial 74 with value: 0.06051849676418247.
2026-05-20 08:07:03,896 - experiment_functions - INFO - Early stopping at epoch 700. Best Recall: 0.0584
2026-05-20 08:07:03,995 - optuna.study.study - INFO - Trial 115 finished with value: 0.05841918236131585 and parameters: {'n_layers': 1, 'embedding_dim': 256, 'lr': 0.0009544270400214424, 'lambda_val': 0.0001665036758635374, 'batch_size': 746, 'optimizer': 'Adam'}. Best is trial 74 with value: 0.06051849676418247.
2026-05-20 08:07:12,453 - experiment_functions - INFO - Early stopping at epoch 600. Best Recall: 0.0582
2026-05-20 08:07:12,554 - optuna.study.study - INFO - Trial 116 finished with value: 0.058193962902770444 and parameters: {'n_layers': 1, 'embedding_dim': 64, 'lr': 0.0023880786649481092, 'lambda_val': 0.0002629135281660464, 'batch_size': 846, 'optimizer': 'Adam'}. Best is trial 74 with value: 0.06051849676418247.
2026-05-20 08:07:22,031 - experiment_functions - INFO - Early stopping at epoch 650. Best Recall: 0.0573
2026-05-20 08:07:22,110 - optuna.study.study - INFO - Trial 117 finished with value: 0.05733356127408568 and parameters: {'n_layers': 1, 'embedding_dim': 32, 'lr': 0.0013817739291588672, 'lambda_val': 3.707921894776401e-05, 'batch_size': 1917, 'optimizer': 'Adam'}. Best is trial 74 with value: 0.06051849676418247.
2026-05-20 08:07:29,034 - experiment_functions - INFO - Early stopping at epoch 500. Best Recall: 0.0050
2026-05-20 08:07:29,124 - optuna.study.study - INFO - Trial 118 finished with value: 0.005028966899784475 and parameters: {'n_layers': 1, 'embedding_dim': 256, 'lr': 0.01491334958007161, 'lambda_val': 0.0010133766401078975, 'batch_size': 1047, 'optimizer': 'Adam'}. Best is trial 74 with value: 0.06051849676418247.
2026-05-20 08:07:36,303 - experiment_functions - INFO - Early stopping at epoch 500. Best Recall: 0.0053
2026-05-20 08:07:36,403 - optuna.study.study - INFO - Trial 119 finished with value: 0.005299273249419399 and parameters: {'n_layers': 3, 'embedding_dim': 128, 'lr': 0.0029013933380669515, 'lambda_val': 0.00022874577653627195, 'batch_size': 1157, 'optimizer': 'SGD'}. Best is trial 74 with value: 0.06051849676418247.
2026-05-20 08:07:46,963 - experiment_functions - INFO - Early stopping at epoch 750. Best Recall: 0.0560
2026-05-20 08:07:47,062 - optuna.study.study - INFO - Trial 120 finished with value: 0.056007729374628744 and parameters: {'n_layers': 1, 'embedding_dim': 128, 'lr': 0.0006103120685128839, 'lambda_val': 0.00455866988729956, 'batch_size': 513, 'optimizer': 'Adam'}. Best is trial 74 with value: 0.06051849676418247.
2026-05-20 08:08:07,725 - experiment_functions - INFO - Early stopping at epoch 1550. Best Recall: 0.0589
2026-05-20 08:08:07,833 - optuna.study.study - INFO - Trial 121 finished with value: 0.05891050575400445 and parameters: {'n_layers': 1, 'embedding_dim': 128, 'lr': 0.0002722140370022432, 'lambda_val': 8.002405780202885e-05, 'batch_size': 601, 'optimizer': 'RMSprop'}. Best is trial 74 with value: 0.06051849676418247.
2026-05-20 08:08:22,188 - experiment_functions - INFO - Early stopping at epoch 1100. Best Recall: 0.0584
2026-05-20 08:08:22,277 - optuna.study.study - INFO - Trial 122 finished with value: 0.05838582506314152 and parameters: {'n_layers': 1, 'embedding_dim': 128, 'lr': 0.00030699178438158605, 'lambda_val': 0.0001151032854180916, 'batch_size': 597, 'optimizer': 'RMSprop'}. Best is trial 74 with value: 0.06051849676418247.
2026-05-20 08:08:58,330 - experiment_functions - INFO - Early stopping at epoch 2950. Best Recall: 0.0621
2026-05-20 08:08:58,430 - optuna.study.study - INFO - Trial 123 finished with value: 0.06206358742241647 and parameters: {'n_layers': 1, 'embedding_dim': 128, 'lr': 0.0001995688507217101, 'lambda_val': 8.543546934670699e-05, 'batch_size': 656, 'optimizer': 'RMSprop'}. Best is trial 123 with value: 0.06206358742241647.
2026-05-20 08:09:39,979 - experiment_functions - INFO - Early stopping at epoch 3300. Best Recall: 0.0602
2026-05-20 08:09:40,057 - optuna.study.study - INFO - Trial 124 finished with value: 0.060243758164477725 and parameters: {'n_layers': 1, 'embedding_dim': 128, 'lr': 0.00017693201340437874, 'lambda_val': 5.477530082493343e-06, 'batch_size': 731, 'optimizer': 'Adam'}. Best is trial 123 with value: 0.06206358742241647.
2026-05-20 08:10:14,234 - experiment_functions - INFO - Early stopping at epoch 2600. Best Recall: 0.0617
2026-05-20 08:10:14,334 - optuna.study.study - INFO - Trial 125 finished with value: 0.06174283450763346 and parameters: {'n_layers': 1, 'embedding_dim': 128, 'lr': 0.00020058638306039728, 'lambda_val': 6.737058735293147e-06, 'batch_size': 794, 'optimizer': 'RMSprop'}. Best is trial 123 with value: 0.06206358742241647.
2026-05-20 08:10:57,421 - experiment_functions - INFO - Early stopping at epoch 3250. Best Recall: 0.0617
2026-05-20 08:10:57,511 - optuna.study.study - INFO - Trial 126 finished with value: 0.06166325355260795 and parameters: {'n_layers': 1, 'embedding_dim': 128, 'lr': 0.00018392540287088394, 'lambda_val': 6.2939566783649975e-06, 'batch_size': 798, 'optimizer': 'RMSprop'}. Best is trial 123 with value: 0.06206358742241647.
2026-05-20 08:11:46,837 - experiment_functions - INFO - Early stopping at epoch 3800. Best Recall: 0.0614
2026-05-20 08:11:46,925 - optuna.study.study - INFO - Trial 127 finished with value: 0.061365923665114355 and parameters: {'n_layers': 1, 'embedding_dim': 128, 'lr': 0.00017258882397144942, 'lambda_val': 5.168871168802905e-06, 'batch_size': 785, 'optimizer': 'RMSprop'}. Best is trial 123 with value: 0.06206358742241647.
2026-05-20 08:12:24,713 - experiment_functions - INFO - Early stopping at epoch 2950. Best Recall: 0.0607
2026-05-20 08:12:24,847 - optuna.study.study - INFO - Trial 128 finished with value: 0.06074981689449893 and parameters: {'n_layers': 1, 'embedding_dim': 128, 'lr': 0.00017761169775440438, 'lambda_val': 4.823072571901435e-06, 'batch_size': 799, 'optimizer': 'RMSprop'}. Best is trial 123 with value: 0.06206358742241647.
2026-05-20 08:13:00,299 - experiment_functions - INFO - Early stopping at epoch 2750. Best Recall: 0.0619
2026-05-20 08:13:00,368 - optuna.study.study - INFO - Trial 129 finished with value: 0.061866349782225945 and parameters: {'n_layers': 1, 'embedding_dim': 128, 'lr': 0.00018030506010271365, 'lambda_val': 5.680457133002888e-06, 'batch_size': 788, 'optimizer': 'RMSprop'}. Best is trial 123 with value: 0.06206358742241647.
2026-05-20 08:13:25,082 - optuna.study._optimize - INFO - Trial 130 pruned. 
2026-05-20 08:14:18,281 - experiment_functions - INFO - Early stopping at epoch 3550. Best Recall: 0.0624
2026-05-20 08:14:18,361 - optuna.study.study - INFO - Trial 131 finished with value: 0.0624473128221679 and parameters: {'n_layers': 1, 'embedding_dim': 128, 'lr': 0.00017389580506032543, 'lambda_val': 2.583237018382667e-06, 'batch_size': 813, 'optimizer': 'RMSprop'}. Best is trial 131 with value: 0.0624473128221679.
2026-05-20 08:14:31,832 - optuna.study._optimize - INFO - Trial 132 pruned. 
2026-05-20 08:14:56,584 - experiment_functions - INFO - Early stopping at epoch 1800. Best Recall: 0.0605
2026-05-20 08:14:56,650 - optuna.study.study - INFO - Trial 133 finished with value: 0.06052550051655168 and parameters: {'n_layers': 1, 'embedding_dim': 128, 'lr': 0.00022280820166537, 'lambda_val': 6.0733758102944145e-06, 'batch_size': 973, 'optimizer': 'RMSprop'}. Best is trial 131 with value: 0.0624473128221679.
2026-05-20 08:15:19,165 - optuna.study._optimize - INFO - Trial 134 pruned. 
2026-05-20 08:15:41,197 - optuna.study._optimize - INFO - Trial 135 pruned. 
2026-05-20 08:16:11,959 - experiment_functions - INFO - Early stopping at epoch 2300. Best Recall: 0.0623
2026-05-20 08:16:12,093 - optuna.study.study - INFO - Trial 136 finished with value: 0.062257843326006035 and parameters: {'n_layers': 1, 'embedding_dim': 128, 'lr': 0.00018516510967670527, 'lambda_val': 2.6236857032633975e-06, 'batch_size': 804, 'optimizer': 'RMSprop'}. Best is trial 131 with value: 0.0624473128221679.
2026-05-20 08:16:25,998 - optuna.study._optimize - INFO - Trial 137 pruned. 
2026-05-20 08:16:55,181 - optuna.study._optimize - INFO - Trial 138 pruned. 
2026-05-20 08:17:12,083 - optuna.study._optimize - INFO - Trial 139 pruned. 
2026-05-20 08:17:26,016 - optuna.study._optimize - INFO - Trial 140 pruned. 
2026-05-20 08:17:39,336 - optuna.study._optimize - INFO - Trial 141 pruned. 
2026-05-20 08:17:55,820 - experiment_functions - INFO - Early stopping at epoch 1200. Best Recall: 0.0608
2026-05-20 08:17:55,920 - optuna.study.study - INFO - Trial 142 finished with value: 0.060790025979644106 and parameters: {'n_layers': 1, 'embedding_dim': 128, 'lr': 0.0002769552927290331, 'lambda_val': 3.154523349311122e-06, 'batch_size': 720, 'optimizer': 'RMSprop'}. Best is trial 131 with value: 0.0624473128221679.
2026-05-20 08:18:12,970 - experiment_functions - INFO - Early stopping at epoch 500. Best Recall: 0.0047
2026-05-20 08:18:13,114 - optuna.study.study - INFO - Trial 143 finished with value: 0.004697632018975733 and parameters: {'n_layers': 1, 'embedding_dim': 128, 'lr': 0.06235290681810183, 'lambda_val': 3.1499798398991705e-06, 'batch_size': 915, 'optimizer': 'RMSprop'}. Best is trial 131 with value: 0.0624473128221679.
2026-05-20 08:18:26,873 - optuna.study._optimize - INFO - Trial 144 pruned. 
2026-05-20 08:18:51,305 - experiment_functions - INFO - Early stopping at epoch 1800. Best Recall: 0.0605
2026-05-20 08:18:51,393 - optuna.study.study - INFO - Trial 145 finished with value: 0.06045784098580199 and parameters: {'n_layers': 1, 'embedding_dim': 128, 'lr': 0.00023873350711108197, 'lambda_val': 9.327054967542795e-06, 'batch_size': 722, 'optimizer': 'RMSprop'}. Best is trial 131 with value: 0.0624473128221679.
2026-05-20 08:19:03,504 - experiment_functions - INFO - Early stopping at epoch 850. Best Recall: 0.0584
2026-05-20 08:19:03,594 - optuna.study.study - INFO - Trial 146 finished with value: 0.05841965991194507 and parameters: {'n_layers': 1, 'embedding_dim': 128, 'lr': 0.0003992501782754856, 'lambda_val': 9.210321578259125e-06, 'batch_size': 692, 'optimizer': 'RMSprop'}. Best is trial 131 with value: 0.0624473128221679.
2026-05-20 08:19:23,658 - experiment_functions - INFO - Early stopping at epoch 1500. Best Recall: 0.0600
2026-05-20 08:19:23,756 - optuna.study.study - INFO - Trial 147 finished with value: 0.05997590011490971 and parameters: {'n_layers': 1, 'embedding_dim': 128, 'lr': 0.00026363972123370826, 'lambda_val': 3.4059218607584553e-06, 'batch_size': 808, 'optimizer': 'RMSprop'}. Best is trial 131 with value: 0.0624473128221679.
2026-05-20 08:19:45,551 - optuna.study._optimize - INFO - Trial 148 pruned. 
2026-05-20 08:19:58,498 - optuna.study._optimize - INFO - Trial 149 pruned. 
2026-05-20 08:20:16,995 - experiment_functions - INFO - Early stopping at epoch 1050. Best Recall: 0.0606
2026-05-20 08:20:17,095 - optuna.study.study - INFO - Trial 150 finished with value: 0.060590993896416825 and parameters: {'n_layers': 1, 'embedding_dim': 128, 'lr': 0.0003398859997392439, 'lambda_val': 4.5836158411324436e-06, 'batch_size': 734, 'optimizer': 'RMSprop'}. Best is trial 131 with value: 0.0624473128221679.
2026-05-20 08:20:31,802 - experiment_functions - INFO - Early stopping at epoch 1100. Best Recall: 0.0591
2026-05-20 08:20:31,902 - optuna.study.study - INFO - Trial 151 finished with value: 0.05914559438754901 and parameters: {'n_layers': 1, 'embedding_dim': 128, 'lr': 0.00035169161578474254, 'lambda_val': 5.305171732866418e-06, 'batch_size': 752, 'optimizer': 'RMSprop'}. Best is trial 131 with value: 0.0624473128221679.
2026-05-20 08:21:10,151 - experiment_functions - INFO - Early stopping at epoch 2450. Best Recall: 0.0629
2026-05-20 08:21:10,252 - optuna.study.study - INFO - Trial 152 finished with value: 0.06287856272338997 and parameters: {'n_layers': 1, 'embedding_dim': 128, 'lr': 0.00023509916197253218, 'lambda_val': 4.335151883570224e-06, 'batch_size': 652, 'optimizer': 'RMSprop'}. Best is trial 152 with value: 0.06287856272338997.
2026-05-20 08:21:34,160 - experiment_functions - INFO - Early stopping at epoch 1800. Best Recall: 0.0618
2026-05-20 08:21:34,249 - optuna.study.study - INFO - Trial 153 finished with value: 0.061834115909872873 and parameters: {'n_layers': 1, 'embedding_dim': 128, 'lr': 0.00023798745207013593, 'lambda_val': 1.4092411457118798e-06, 'batch_size': 657, 'optimizer': 'RMSprop'}. Best is trial 152 with value: 0.06287856272338997.
2026-05-20 08:21:58,134 - experiment_functions - INFO - Early stopping at epoch 1550. Best Recall: 0.0612
2026-05-20 08:21:58,223 - optuna.study.study - INFO - Trial 154 finished with value: 0.061221765329440965 and parameters: {'n_layers': 1, 'embedding_dim': 128, 'lr': 0.0002488434717585707, 'lambda_val': 1.2525124166127244e-06, 'batch_size': 731, 'optimizer': 'RMSprop'}. Best is trial 152 with value: 0.06287856272338997.
2026-05-20 08:22:20,013 - experiment_functions - INFO - Early stopping at epoch 1650. Best Recall: 0.0601
2026-05-20 08:22:20,091 - optuna.study.study - INFO - Trial 155 finished with value: 0.06007655196673459 and parameters: {'n_layers': 1, 'embedding_dim': 128, 'lr': 0.00024873314608413037, 'lambda_val': 1.2901192302047978e-06, 'batch_size': 890, 'optimizer': 'RMSprop'}. Best is trial 152 with value: 0.06287856272338997.
2026-05-20 08:22:42,069 - optuna.study._optimize - INFO - Trial 156 pruned. 
2026-05-20 08:23:19,709 - experiment_functions - INFO - Early stopping at epoch 2800. Best Recall: 0.0639
2026-05-20 08:23:19,802 - optuna.study.study - INFO - Trial 157 finished with value: 0.06390748000357267 and parameters: {'n_layers': 1, 'embedding_dim': 32, 'lr': 0.0003159580768453235, 'lambda_val': 4.283260278497107e-06, 'batch_size': 806, 'optimizer': 'RMSprop'}. Best is trial 157 with value: 0.06390748000357267.
2026-05-20 08:23:33,158 - optuna.study._optimize - INFO - Trial 158 pruned. 
2026-05-20 08:23:46,544 - optuna.study._optimize - INFO - Trial 159 pruned. 
2026-05-20 08:23:59,989 - optuna.study._optimize - INFO - Trial 160 pruned. 
2026-05-20 08:24:13,302 - optuna.study._optimize - INFO - Trial 161 pruned. 
2026-05-20 08:24:24,494 - experiment_functions - INFO - Early stopping at epoch 800. Best Recall: 0.0597
2026-05-20 08:24:24,561 - optuna.study.study - INFO - Trial 162 finished with value: 0.05970347640737833 and parameters: {'n_layers': 1, 'embedding_dim': 128, 'lr': 0.00038546731501965437, 'lambda_val': 3.7894721748404997e-06, 'batch_size': 931, 'optimizer': 'RMSprop'}. Best is trial 157 with value: 0.06390748000357267.
2026-05-20 08:24:39,140 - optuna.study._optimize - INFO - Trial 163 pruned. 
2026-05-20 08:24:52,904 - optuna.study._optimize - INFO - Trial 164 pruned. 
2026-05-20 08:25:06,331 - optuna.study._optimize - INFO - Trial 165 pruned. 
2026-05-20 08:25:29,033 - experiment_functions - INFO - Early stopping at epoch 1750. Best Recall: 0.0628
2026-05-20 08:25:29,121 - optuna.study.study - INFO - Trial 166 finished with value: 0.06278757815116358 and parameters: {'n_layers': 1, 'embedding_dim': 64, 'lr': 0.0003169599542382101, 'lambda_val': 4.929288759902036e-06, 'batch_size': 639, 'optimizer': 'RMSprop'}. Best is trial 157 with value: 0.06390748000357267.
2026-05-20 08:25:51,100 - experiment_functions - INFO - Early stopping at epoch 1650. Best Recall: 0.0612
2026-05-20 08:25:51,189 - optuna.study.study - INFO - Trial 167 finished with value: 0.061160679978465006 and parameters: {'n_layers': 1, 'embedding_dim': 128, 'lr': 0.0003062393996252213, 'lambda_val': 4.301277940250095e-06, 'batch_size': 594, 'optimizer': 'RMSprop'}. Best is trial 157 with value: 0.06390748000357267.
2026-05-20 08:26:10,817 - experiment_functions - INFO - Early stopping at epoch 1500. Best Recall: 0.0605
2026-05-20 08:26:10,906 - optuna.study.study - INFO - Trial 168 finished with value: 0.06052780048352681 and parameters: {'n_layers': 1, 'embedding_dim': 128, 'lr': 0.0002885930014194581, 'lambda_val': 4.472105554669523e-06, 'batch_size': 588, 'optimizer': 'RMSprop'}. Best is trial 157 with value: 0.06390748000357267.
2026-05-20 08:26:33,509 - optuna.study._optimize - INFO - Trial 169 pruned. 
2026-05-20 08:26:44,585 - experiment_functions - INFO - Early stopping at epoch 800. Best Recall: 0.0580
2026-05-20 08:26:45,373 - optuna.study.study - INFO - Trial 170 finished with value: 0.05803899030241664 and parameters: {'n_layers': 1, 'embedding_dim': 128, 'lr': 0.00040875233290461405, 'lambda_val': 4.79279207716388e-06, 'batch_size': 631, 'optimizer': 'RMSprop'}. Best is trial 157 with value: 0.06390748000357267.
2026-05-20 08:27:09,729 - experiment_functions - INFO - Early stopping at epoch 1850. Best Recall: 0.0625
2026-05-20 08:27:10,015 - optuna.study.study - INFO - Trial 171 finished with value: 0.06245711617977184 and parameters: {'n_layers': 1, 'embedding_dim': 128, 'lr': 0.0002549188555964335, 'lambda_val': 7.0686131881103256e-06, 'batch_size': 515, 'optimizer': 'RMSprop'}. Best is trial 157 with value: 0.06390748000357267.
2026-05-20 08:27:35,538 - experiment_functions - INFO - Early stopping at epoch 1950. Best Recall: 0.0622
2026-05-20 08:27:35,639 - optuna.study.study - INFO - Trial 172 finished with value: 0.06219955146675635 and parameters: {'n_layers': 1, 'embedding_dim': 128, 'lr': 0.0002813482955245522, 'lambda_val': 7.819947646897725e-06, 'batch_size': 595, 'optimizer': 'RMSprop'}. Best is trial 157 with value: 0.06390748000357267.
2026-05-20 08:27:56,753 - optuna.study._optimize - INFO - Trial 173 pruned. 
2026-05-20 08:28:10,586 - experiment_functions - INFO - Early stopping at epoch 1000. Best Recall: 0.0607
2026-05-20 08:28:10,675 - optuna.study.study - INFO - Trial 174 finished with value: 0.06071103198616775 and parameters: {'n_layers': 1, 'embedding_dim': 128, 'lr': 0.0003350598942641014, 'lambda_val': 2.312265107045375e-06, 'batch_size': 682, 'optimizer': 'RMSprop'}. Best is trial 157 with value: 0.06390748000357267.
2026-05-20 08:28:31,500 - experiment_functions - INFO - Early stopping at epoch 1600. Best Recall: 0.0602
2026-05-20 08:28:31,599 - optuna.study.study - INFO - Trial 175 finished with value: 0.06022980631232627 and parameters: {'n_layers': 1, 'embedding_dim': 128, 'lr': 0.00027210826496548804, 'lambda_val': 2.4691449133685893e-06, 'batch_size': 638, 'optimizer': 'RMSprop'}. Best is trial 157 with value: 0.06390748000357267.
2026-05-20 08:28:45,832 - optuna.study._optimize - INFO - Trial 176 pruned. 
2026-05-20 08:28:58,218 - experiment_functions - INFO - Early stopping at epoch 900. Best Recall: 0.0599
2026-05-20 08:28:58,307 - optuna.study.study - INFO - Trial 177 finished with value: 0.05991422256144727 and parameters: {'n_layers': 1, 'embedding_dim': 128, 'lr': 0.0004456577154047091, 'lambda_val': 2.957629908383514e-06, 'batch_size': 522, 'optimizer': 'RMSprop'}. Best is trial 157 with value: 0.06390748000357267.
2026-05-20 08:29:11,460 - optuna.study._optimize - INFO - Trial 178 pruned. 
2026-05-20 08:29:32,160 - optuna.study._optimize - INFO - Trial 179 pruned. 
2026-05-20 08:29:49,304 - experiment_functions - INFO - Early stopping at epoch 1300. Best Recall: 0.0607
2026-05-20 08:29:49,401 - optuna.study.study - INFO - Trial 180 finished with value: 0.0606747652007886 and parameters: {'n_layers': 1, 'embedding_dim': 128, 'lr': 0.000253503089751719, 'lambda_val': 1.5007898736914363e-06, 'batch_size': 707, 'optimizer': 'RMSprop'}. Best is trial 157 with value: 0.06390748000357267.
2026-05-20 08:30:09,217 - experiment_functions - INFO - Early stopping at epoch 1450. Best Recall: 0.0602
2026-05-20 08:30:09,323 - optuna.study.study - INFO - Trial 181 finished with value: 0.06016121748772273 and parameters: {'n_layers': 1, 'embedding_dim': 128, 'lr': 0.00027842856634380264, 'lambda_val': 1.2239292111620681e-06, 'batch_size': 685, 'optimizer': 'RMSprop'}. Best is trial 157 with value: 0.06390748000357267.
2026-05-20 08:30:30,414 - optuna.study._optimize - INFO - Trial 182 pruned. 
2026-05-20 08:30:45,873 - experiment_functions - INFO - Early stopping at epoch 950. Best Recall: 0.0586
