2026-05-20 02:32:19,576 - optuna.study._optimize - INFO - Trial 188 pruned. 
2026-05-20 02:33:00,143 - experiment_functions - INFO - Early stopping at epoch 2500. Best Recall: 0.0826
2026-05-20 02:33:00,287 - optuna.study.study - INFO - Trial 189 finished with value: 0.0826224796629533 and parameters: {'n_layers': 1, 'embedding_dim': 256, 'lr': 0.00185112857607354, 'lambda_val': 1.4558867218798243e-05, 'batch_size': 2565, 'optimizer': 'Adam'}. Best is trial 132 with value: 0.08609908414024027.
2026-05-20 02:33:44,579 - experiment_functions - INFO - Early stopping at epoch 2750. Best Recall: 0.0816
2026-05-20 02:33:44,715 - optuna.study.study - INFO - Trial 190 finished with value: 0.08159894191569833 and parameters: {'n_layers': 1, 'embedding_dim': 256, 'lr': 0.002199555599891564, 'lambda_val': 1.4430951431371907e-05, 'batch_size': 2910, 'optimizer': 'Adam'}. Best is trial 132 with value: 0.08609908414024027.
2026-05-20 02:34:21,847 - experiment_functions - INFO - Early stopping at epoch 2300. Best Recall: 0.0830
2026-05-20 02:34:21,982 - optuna.study.study - INFO - Trial 191 finished with value: 0.08298482765590166 and parameters: {'n_layers': 1, 'embedding_dim': 256, 'lr': 0.0022091123115196495, 'lambda_val': 1.3440713843405548e-05, 'batch_size': 2994, 'optimizer': 'Adam'}. Best is trial 132 with value: 0.08609908414024027.
2026-05-20 02:34:52,503 - experiment_functions - INFO - Early stopping at epoch 1900. Best Recall: 0.0827
2026-05-20 02:34:52,604 - optuna.study.study - INFO - Trial 192 finished with value: 0.08265985306977178 and parameters: {'n_layers': 1, 'embedding_dim': 256, 'lr': 0.0020270146273399106, 'lambda_val': 1.2256998270690562e-05, 'batch_size': 3012, 'optimizer': 'Adam'}. Best is trial 132 with value: 0.08609908414024027.
2026-05-20 02:35:14,213 - experiment_functions - INFO - Early stopping at epoch 1300. Best Recall: 0.0809
2026-05-20 02:35:14,348 - optuna.study.study - INFO - Trial 193 finished with value: 0.0809347072566594 and parameters: {'n_layers': 1, 'embedding_dim': 256, 'lr': 0.0023765248841402208, 'lambda_val': 1.1937184225492862e-05, 'batch_size': 3035, 'optimizer': 'Adam'}. Best is trial 132 with value: 0.08609908414024027.
2026-05-20 02:35:50,554 - experiment_functions - INFO - Early stopping at epoch 2050. Best Recall: 0.0832
2026-05-20 02:35:50,654 - optuna.study.study - INFO - Trial 194 finished with value: 0.08322915599493312 and parameters: {'n_layers': 1, 'embedding_dim': 256, 'lr': 0.00206450737916763, 'lambda_val': 1.4040086709701205e-05, 'batch_size': 2932, 'optimizer': 'Adam'}. Best is trial 132 with value: 0.08609908414024027.
2026-05-20 02:36:23,370 - experiment_functions - INFO - Early stopping at epoch 2050. Best Recall: 0.0816
2026-05-20 02:36:23,461 - optuna.study.study - INFO - Trial 195 finished with value: 0.08156702412909399 and parameters: {'n_layers': 1, 'embedding_dim': 256, 'lr': 0.0021017772380224975, 'lambda_val': 9.942163691545779e-06, 'batch_size': 3155, 'optimizer': 'Adam'}. Best is trial 132 with value: 0.08609908414024027.
2026-05-20 02:37:03,451 - experiment_functions - INFO - Early stopping at epoch 2550. Best Recall: 0.0840
2026-05-20 02:37:03,552 - optuna.study.study - INFO - Trial 196 finished with value: 0.08397131028562842 and parameters: {'n_layers': 1, 'embedding_dim': 256, 'lr': 0.0019134656076319739, 'lambda_val': 1.3574213242516983e-05, 'batch_size': 2958, 'optimizer': 'Adam'}. Best is trial 132 with value: 0.08609908414024027.
2026-05-20 02:37:59,563 - experiment_functions - INFO - Early stopping at epoch 3150. Best Recall: 0.0835
2026-05-20 02:37:59,653 - optuna.study.study - INFO - Trial 197 finished with value: 0.08346135104721512 and parameters: {'n_layers': 1, 'embedding_dim': 256, 'lr': 0.0018487679250503528, 'lambda_val': 7.87168834978099e-06, 'batch_size': 3092, 'optimizer': 'Adam'}. Best is trial 132 with value: 0.08609908414024027.
2026-05-20 02:38:49,226 - experiment_functions - INFO - Early stopping at epoch 2500. Best Recall: 0.0841
2026-05-20 02:38:49,360 - optuna.study.study - INFO - Trial 198 finished with value: 0.08405177816905367 and parameters: {'n_layers': 1, 'embedding_dim': 256, 'lr': 0.0018067763703643817, 'lambda_val': 8.599833339761416e-06, 'batch_size': 3010, 'optimizer': 'Adam'}. Best is trial 132 with value: 0.08609908414024027.
2026-05-20 02:39:19,557 - experiment_functions - INFO - Early stopping at epoch 1950. Best Recall: 0.0829
2026-05-20 02:39:19,655 - optuna.study.study - INFO - Trial 199 finished with value: 0.08294680426968576 and parameters: {'n_layers': 1, 'embedding_dim': 256, 'lr': 0.0017940554605434368, 'lambda_val': 8.819039305733274e-06, 'batch_size': 3004, 'optimizer': 'Adam'}. Best is trial 132 with value: 0.08609908414024027.
2026-05-20 02:39:56,910 - experiment_functions - INFO - Early stopping at epoch 2200. Best Recall: 0.0824
2026-05-20 02:39:57,001 - optuna.study.study - INFO - Trial 200 finished with value: 0.08242143306136576 and parameters: {'n_layers': 1, 'embedding_dim': 256, 'lr': 0.0017953734867483305, 'lambda_val': 8.25476379590014e-06, 'batch_size': 3021, 'optimizer': 'Adam'}. Best is trial 132 with value: 0.08609908414024027.
2026-05-20 02:40:45,743 - experiment_functions - INFO - Early stopping at epoch 3150. Best Recall: 0.0846
2026-05-20 02:40:45,834 - optuna.study.study - INFO - Trial 201 finished with value: 0.0846335434828866 and parameters: {'n_layers': 1, 'embedding_dim': 256, 'lr': 0.0017760233211607456, 'lambda_val': 1.096956546442239e-05, 'batch_size': 3108, 'optimizer': 'Adam'}. Best is trial 132 with value: 0.08609908414024027.
2026-05-20 02:41:37,757 - experiment_functions - INFO - Early stopping at epoch 3200. Best Recall: 0.0841
2026-05-20 02:41:37,858 - optuna.study.study - INFO - Trial 202 finished with value: 0.08411790736726817 and parameters: {'n_layers': 1, 'embedding_dim': 256, 'lr': 0.001497112877831865, 'lambda_val': 7.0081716819377554e-06, 'batch_size': 3257, 'optimizer': 'Adam'}. Best is trial 132 with value: 0.08609908414024027.
2026-05-20 02:42:16,244 - experiment_functions - INFO - Early stopping at epoch 2250. Best Recall: 0.0839
2026-05-20 02:42:16,378 - optuna.study.study - INFO - Trial 203 finished with value: 0.08392530230636731 and parameters: {'n_layers': 1, 'embedding_dim': 256, 'lr': 0.001431766811841198, 'lambda_val': 8.47679446379203e-06, 'batch_size': 3102, 'optimizer': 'Adam'}. Best is trial 132 with value: 0.08609908414024027.
2026-05-20 02:42:51,917 - experiment_functions - INFO - Early stopping at epoch 2200. Best Recall: 0.0837
2026-05-20 02:42:52,684 - optuna.study.study - INFO - Trial 204 finished with value: 0.08365788855332656 and parameters: {'n_layers': 1, 'embedding_dim': 256, 'lr': 0.0014222007748876378, 'lambda_val': 1.0247897646815313e-05, 'batch_size': 3081, 'optimizer': 'Adam'}. Best is trial 132 with value: 0.08609908414024027.
2026-05-20 02:43:25,214 - optuna.study._optimize - INFO - Trial 205 pruned. 
2026-05-20 02:43:57,561 - experiment_functions - INFO - Early stopping at epoch 2100. Best Recall: 0.0826
2026-05-20 02:43:57,650 - optuna.study.study - INFO - Trial 206 finished with value: 0.08259419173799719 and parameters: {'n_layers': 1, 'embedding_dim': 256, 'lr': 0.0014084903000374969, 'lambda_val': 6.876634512230508e-06, 'batch_size': 3187, 'optimizer': 'Adam'}. Best is trial 132 with value: 0.08609908414024027.
2026-05-20 02:44:23,127 - optuna.study._optimize - INFO - Trial 207 pruned. 
2026-05-20 02:44:34,466 - experiment_functions - INFO - Early stopping at epoch 700. Best Recall: 0.0696
2026-05-20 02:44:34,557 - optuna.study.study - INFO - Trial 208 finished with value: 0.06960376757786395 and parameters: {'n_layers': 1, 'embedding_dim': 128, 'lr': 0.0014645732717197477, 'lambda_val': 7.086243887320493e-06, 'batch_size': 3229, 'optimizer': 'Adam'}. Best is trial 132 with value: 0.08609908414024027.
2026-05-20 02:44:51,205 - optuna.study._optimize - INFO - Trial 209 pruned. 
2026-05-20 02:45:31,277 - experiment_functions - INFO - Early stopping at epoch 2500. Best Recall: 0.0841
2026-05-20 02:45:31,420 - optuna.study.study - INFO - Trial 210 finished with value: 0.08405398468052878 and parameters: {'n_layers': 1, 'embedding_dim': 256, 'lr': 0.0013251415724386559, 'lambda_val': 1.0366094517956828e-05, 'batch_size': 2899, 'optimizer': 'Adam'}. Best is trial 132 with value: 0.08609908414024027.
2026-05-20 02:46:05,515 - experiment_functions - INFO - Early stopping at epoch 2100. Best Recall: 0.0835
2026-05-20 02:46:05,648 - optuna.study.study - INFO - Trial 211 finished with value: 0.08348706565906866 and parameters: {'n_layers': 1, 'embedding_dim': 256, 'lr': 0.0016961646046694716, 'lambda_val': 1.1259211834092834e-05, 'batch_size': 2923, 'optimizer': 'Adam'}. Best is trial 132 with value: 0.08609908414024027.
2026-05-20 02:46:44,380 - experiment_functions - INFO - Early stopping at epoch 2450. Best Recall: 0.0847
2026-05-20 02:46:44,514 - optuna.study.study - INFO - Trial 212 finished with value: 0.0846576999182136 and parameters: {'n_layers': 1, 'embedding_dim': 256, 'lr': 0.0017783980241413149, 'lambda_val': 6.7037674808080735e-06, 'batch_size': 2894, 'optimizer': 'Adam'}. Best is trial 132 with value: 0.08609908414024027.
2026-05-20 02:47:17,521 - experiment_functions - INFO - Early stopping at epoch 2100. Best Recall: 0.0822
2026-05-20 02:47:17,609 - optuna.study.study - INFO - Trial 213 finished with value: 0.08218770813603198 and parameters: {'n_layers': 1, 'embedding_dim': 256, 'lr': 0.0018349105113237758, 'lambda_val': 7.582064287914518e-06, 'batch_size': 2891, 'optimizer': 'Adam'}. Best is trial 132 with value: 0.08609908414024027.
2026-05-20 02:47:53,763 - experiment_functions - INFO - Early stopping at epoch 1950. Best Recall: 0.0815
2026-05-20 02:47:53,852 - optuna.study.study - INFO - Trial 214 finished with value: 0.08150385835124285 and parameters: {'n_layers': 1, 'embedding_dim': 256, 'lr': 0.0013428403042186694, 'lambda_val': 6.55027497158625e-06, 'batch_size': 3109, 'optimizer': 'Adam'}. Best is trial 132 with value: 0.08609908414024027.
2026-05-20 02:48:18,646 - experiment_functions - INFO - Early stopping at epoch 1450. Best Recall: 0.0801
2026-05-20 02:48:18,735 - optuna.study.study - INFO - Trial 215 finished with value: 0.08006554127952314 and parameters: {'n_layers': 1, 'embedding_dim': 256, 'lr': 0.0023456114931118465, 'lambda_val': 1.1167384005420132e-05, 'batch_size': 2890, 'optimizer': 'Adam'}. Best is trial 132 with value: 0.08609908414024027.
2026-05-20 02:48:43,961 - experiment_functions - INFO - Early stopping at epoch 1550. Best Recall: 0.0808
2026-05-20 02:48:44,195 - optuna.study.study - INFO - Trial 216 finished with value: 0.08084296202432877 and parameters: {'n_layers': 1, 'embedding_dim': 256, 'lr': 0.0018435900066419183, 'lambda_val': 1.0104945874258062e-05, 'batch_size': 2918, 'optimizer': 'Adam'}. Best is trial 132 with value: 0.08609908414024027.
2026-05-20 02:48:57,201 - experiment_functions - INFO - Early stopping at epoch 500. Best Recall: 0.0052
2026-05-20 02:48:57,335 - optuna.study.study - INFO - Trial 217 finished with value: 0.005153422769431395 and parameters: {'n_layers': 1, 'embedding_dim': 256, 'lr': 0.003270884040547575, 'lambda_val': 4.72927877468553e-06, 'batch_size': 2760, 'optimizer': 'SGD'}. Best is trial 132 with value: 0.08609908414024027.
2026-05-20 02:49:45,881 - experiment_functions - INFO - Early stopping at epoch 2850. Best Recall: 0.0852
2026-05-20 02:49:46,014 - optuna.study.study - INFO - Trial 218 finished with value: 0.0852170087993784 and parameters: {'n_layers': 1, 'embedding_dim': 256, 'lr': 0.0014225368940116924, 'lambda_val': 5.909342031069559e-06, 'batch_size': 3080, 'optimizer': 'Adam'}. Best is trial 132 with value: 0.08609908414024027.
2026-05-20 02:50:02,500 - experiment_functions - INFO - Early stopping at epoch 850. Best Recall: 0.0760
2026-05-20 02:50:02,668 - optuna.study.study - INFO - Trial 219 finished with value: 0.0760396137772305 and parameters: {'n_layers': 1, 'embedding_dim': 256, 'lr': 0.0012751396196117144, 'lambda_val': 5.925599683261607e-06, 'batch_size': 3070, 'optimizer': 'Adam'}. Best is trial 132 with value: 0.08609908414024027.
2026-05-20 02:50:59,682 - experiment_functions - INFO - Early stopping at epoch 2950. Best Recall: 0.0855
2026-05-20 02:50:59,826 - optuna.study.study - INFO - Trial 220 finished with value: 0.08548394368846468 and parameters: {'n_layers': 1, 'embedding_dim': 256, 'lr': 0.0014843457488585175, 'lambda_val': 4.19295080632994e-06, 'batch_size': 2841, 'optimizer': 'Adam'}. Best is trial 132 with value: 0.08609908414024027.
2026-05-20 02:51:25,271 - optuna.study._optimize - INFO - Trial 221 pruned. 
2026-05-20 02:51:52,583 - experiment_functions - INFO - Early stopping at epoch 1650. Best Recall: 0.0815
2026-05-20 02:51:52,716 - optuna.study.study - INFO - Trial 222 finished with value: 0.08147858515622274 and parameters: {'n_layers': 1, 'embedding_dim': 256, 'lr': 0.002205352200525816, 'lambda_val': 6.172643029878669e-06, 'batch_size': 2950, 'optimizer': 'Adam'}. Best is trial 132 with value: 0.08609908414024027.
2026-05-20 02:52:29,621 - experiment_functions - INFO - Early stopping at epoch 1950. Best Recall: 0.0813
2026-05-20 02:52:30,393 - optuna.study.study - INFO - Trial 223 finished with value: 0.08134169379818607 and parameters: {'n_layers': 1, 'embedding_dim': 256, 'lr': 0.0025656212416127738, 'lambda_val': 8.24246501271707e-06, 'batch_size': 3294, 'optimizer': 'Adam'}. Best is trial 132 with value: 0.08609908414024027.
2026-05-20 02:53:10,967 - experiment_functions - INFO - Early stopping at epoch 2300. Best Recall: 0.0845
2026-05-20 02:53:11,100 - optuna.study.study - INFO - Trial 224 finished with value: 0.08453433039926274 and parameters: {'n_layers': 1, 'embedding_dim': 256, 'lr': 0.001325661248831646, 'lambda_val': 3.735202271011677e-06, 'batch_size': 3129, 'optimizer': 'Adam'}. Best is trial 132 with value: 0.08609908414024027.
2026-05-20 02:54:10,623 - experiment_functions - INFO - Early stopping at epoch 3750. Best Recall: 0.0839
2026-05-20 02:54:10,767 - optuna.study.study - INFO - Trial 225 finished with value: 0.08392747830757985 and parameters: {'n_layers': 1, 'embedding_dim': 256, 'lr': 0.0012910893571351474, 'lambda_val': 2.4715823647067488e-06, 'batch_size': 3128, 'optimizer': 'Adam'}. Best is trial 132 with value: 0.08609908414024027.
2026-05-20 02:54:30,195 - optuna.study._optimize - INFO - Trial 226 pruned. 
2026-05-20 02:55:26,697 - experiment_functions - INFO - Early stopping at epoch 3600. Best Recall: 0.0841
2026-05-20 02:55:26,865 - optuna.study.study - INFO - Trial 227 finished with value: 0.0841034428966083 and parameters: {'n_layers': 1, 'embedding_dim': 256, 'lr': 0.0012489173764360648, 'lambda_val': 2.3922388811104735e-06, 'batch_size': 3098, 'optimizer': 'Adam'}. Best is trial 132 with value: 0.08609908414024027.
2026-05-20 02:55:43,901 - optuna.study._optimize - INFO - Trial 228 pruned. 
2026-05-20 02:56:04,889 - optuna.study._optimize - INFO - Trial 229 pruned. 
2026-05-20 02:56:42,263 - optuna.study._optimize - INFO - Trial 230 pruned. 
2026-05-20 02:57:09,400 - optuna.study._optimize - INFO - Trial 231 pruned. 
2026-05-20 02:57:45,365 - experiment_functions - INFO - Early stopping at epoch 2250. Best Recall: 0.0835
2026-05-20 02:57:45,509 - optuna.study.study - INFO - Trial 232 finished with value: 0.08351587736854742 and parameters: {'n_layers': 1, 'embedding_dim': 256, 'lr': 0.0017242149582662807, 'lambda_val': 3.5885603593504354e-06, 'batch_size': 2760, 'optimizer': 'Adam'}. Best is trial 132 with value: 0.08609908414024027.
2026-05-20 02:57:58,751 - experiment_functions - INFO - Early stopping at epoch 800. Best Recall: 0.0776
2026-05-20 02:57:58,884 - optuna.study.study - INFO - Trial 233 finished with value: 0.0775967055482599 and parameters: {'n_layers': 1, 'embedding_dim': 256, 'lr': 0.0016183078015653168, 'lambda_val': 2.853433803074079e-06, 'batch_size': 2754, 'optimizer': 'Adam'}. Best is trial 132 with value: 0.08609908414024027.
2026-05-20 02:59:06,382 - experiment_functions - INFO - Early stopping at epoch 3950. Best Recall: 0.0856
2026-05-20 02:59:06,515 - optuna.study.study - INFO - Trial 234 finished with value: 0.0855881333662706 and parameters: {'n_layers': 1, 'embedding_dim': 256, 'lr': 0.0012031311637172185, 'lambda_val': 5.023553348965652e-06, 'batch_size': 2864, 'optimizer': 'Adam'}. Best is trial 132 with value: 0.08609908414024027.
2026-05-20 02:59:33,473 - optuna.study._optimize - INFO - Trial 235 pruned. 
2026-05-20 03:00:47,679 - optuna.study.study - INFO - Trial 236 finished with value: 0.08684913267554159 and parameters: {'n_layers': 1, 'embedding_dim': 256, 'lr': 0.0013743987556427157, 'lambda_val': 4.233002285436342e-06, 'batch_size': 2791, 'optimizer': 'Adam'}. Best is trial 236 with value: 0.08684913267554159.
2026-05-20 03:01:03,755 - optuna.study._optimize - INFO - Trial 237 pruned. 
2026-05-20 03:01:44,676 - optuna.study._optimize - INFO - Trial 238 pruned. 
2026-05-20 03:02:53,756 - optuna.study.study - INFO - Trial 239 finished with value: 0.08536240004609015 and parameters: {'n_layers': 1, 'embedding_dim': 256, 'lr': 0.0013774851576767542, 'lambda_val': 3.183165041037616e-06, 'batch_size': 3001, 'optimizer': 'Adam'}. Best is trial 236 with value: 0.08684913267554159.
2026-05-20 03:03:08,036 - experiment_functions - INFO - Early stopping at epoch 750. Best Recall: 0.0687
2026-05-20 03:03:08,126 - optuna.study.study - INFO - Trial 240 finished with value: 0.06867029618016242 and parameters: {'n_layers': 1, 'embedding_dim': 128, 'lr': 0.001347214340318783, 'lambda_val': 2.833300188745949e-06, 'batch_size': 3188, 'optimizer': 'Adam'}. Best is trial 236 with value: 0.08684913267554159.
2026-05-20 03:03:24,994 - optuna.study._optimize - INFO - Trial 241 pruned. 
2026-05-20 03:04:09,345 - experiment_functions - INFO - Early stopping at epoch 2750. Best Recall: 0.0841
2026-05-20 03:04:09,490 - optuna.study.study - INFO - Trial 242 finished with value: 0.0841140505700154 and parameters: {'n_layers': 1, 'embedding_dim': 256, 'lr': 0.0014120342046405122, 'lambda_val': 4.732350619282694e-06, 'batch_size': 3070, 'optimizer': 'Adam'}. Best is trial 236 with value: 0.08684913267554159.
2026-05-20 03:04:26,035 - optuna.study._optimize - INFO - Trial 243 pruned. 
2026-05-20 03:05:12,970 - experiment_functions - INFO - Early stopping at epoch 3000. Best Recall: 0.0850
2026-05-20 03:05:13,115 - optuna.study.study - INFO - Trial 244 finished with value: 0.08496454268605931 and parameters: {'n_layers': 1, 'embedding_dim': 256, 'lr': 0.0013901511382893082, 'lambda_val': 2.260703404116545e-06, 'batch_size': 3390, 'optimizer': 'Adam'}. Best is trial 236 with value: 0.08684913267554159.
2026-05-20 03:05:48,132 - experiment_functions - INFO - Early stopping at epoch 2200. Best Recall: 0.0834
2026-05-20 03:05:48,255 - optuna.study.study - INFO - Trial 245 finished with value: 0.08341450766021263 and parameters: {'n_layers': 1, 'embedding_dim': 256, 'lr': 0.0014134345747860363, 'lambda_val': 2.0507245339973704e-06, 'batch_size': 3466, 'optimizer': 'Adam'}. Best is trial 236 with value: 0.08684913267554159.
2026-05-20 03:06:07,164 - optuna.study._optimize - INFO - Trial 246 pruned. 
2026-05-20 03:06:32,193 - optuna.study._optimize - INFO - Trial 247 pruned. 
2026-05-20 03:07:03,831 - experiment_functions - INFO - Early stopping at epoch 1950. Best Recall: 0.0837
2026-05-20 03:07:03,920 - optuna.study.study - INFO - Trial 248 finished with value: 0.0837049892781655 and parameters: {'n_layers': 1, 'embedding_dim': 256, 'lr': 0.0014658683199820844, 'lambda_val': 1.5989737758866778e-06, 'batch_size': 3080, 'optimizer': 'Adam'}. Best is trial 236 with value: 0.08684913267554159.
2026-05-20 03:07:55,023 - experiment_functions - INFO - Early stopping at epoch 3200. Best Recall: 0.0832
2026-05-20 03:07:55,158 - optuna.study.study - INFO - Trial 249 finished with value: 0.08321606607451995 and parameters: {'n_layers': 1, 'embedding_dim': 256, 'lr': 0.0015031975380476537, 'lambda_val': 1.2857978663808717e-06, 'batch_size': 3089, 'optimizer': 'Adam'}. Best is trial 236 with value: 0.08684913267554159.
2026-05-20 03:08:26,118 - experiment_functions - INFO - Early stopping at epoch 1900. Best Recall: 0.0842
2026-05-20 03:08:26,273 - optuna.study.study - INFO - Trial 250 finished with value: 0.08418449598819899 and parameters: {'n_layers': 1, 'embedding_dim': 256, 'lr': 0.001491211300735138, 'lambda_val': 1.718168139269225e-06, 'batch_size': 3171, 'optimizer': 'Adam'}. Best is trial 236 with value: 0.08684913267554159.
2026-05-20 03:09:01,103 - optuna.study._optimize - INFO - Trial 251 pruned. 
2026-05-20 03:09:18,056 - optuna.study._optimize - INFO - Trial 252 pruned. 
2026-05-20 03:09:29,353 - experiment_functions - INFO - Early stopping at epoch 600. Best Recall: 0.0591
2026-05-20 03:09:29,498 - optuna.study.study - INFO - Trial 253 finished with value: 0.05906788926820074 and parameters: {'n_layers': 2, 'embedding_dim': 256, 'lr': 0.0015502248923645377, 'lambda_val': 1.8912378979504444e-06, 'batch_size': 3160, 'optimizer': 'Adam'}. Best is trial 236 with value: 0.08684913267554159.
2026-05-20 03:09:41,758 - experiment_functions - INFO - Early stopping at epoch 500. Best Recall: 0.0054
2026-05-20 03:09:41,935 - optuna.study.study - INFO - Trial 254 finished with value: 0.0054403281499803315 and parameters: {'n_layers': 1, 'embedding_dim': 256, 'lr': 0.001890696924379077, 'lambda_val': 3.1092598837453745e-06, 'batch_size': 3038, 'optimizer': 'SGD'}. Best is trial 236 with value: 0.08684913267554159.
2026-05-20 03:10:07,648 - optuna.study._optimize - INFO - Trial 255 pruned. 
2026-05-20 03:10:24,598 - optuna.study._optimize - INFO - Trial 256 pruned. 
2026-05-20 03:11:05,929 - experiment_functions - INFO - Early stopping at epoch 2600. Best Recall: 0.0848
