2026-05-20 09:03:19,680 - optuna.study._optimize - INFO - Trial 299 pruned. 
2026-05-20 09:03:19,682 - experiment_functions - INFO - Training the best model ... for e_1M_1c3dcs_strict
2026-05-20 09:03:51,296 - experiment_functions - INFO - Early stopping at epoch 3000. Best Recall: 0.0609
2026-05-20 09:03:52,140 - root - INFO -   ** Getting the trainable edges:
2026-05-20 09:03:52,159 - helper_functions - INFO -      Number of nodes: 4781
2026-05-20 09:03:52,159 - helper_functions - INFO -      Ratio: 0.4905602298378822
2026-05-20 09:03:52,159 - helper_functions - INFO -      Number of unique users: 3174
2026-05-20 09:03:52,159 - helper_functions - INFO -      Number of unique items: 1607
2026-05-20 09:03:52,159 - helper_functions - INFO -      Total dominant set edge: 272498
2026-05-20 09:03:52,159 - helper_functions - INFO -      Trainable edges: 217998.40000000002
2026-05-20 09:03:52,217 - root - INFO -   **** Getting 272498 dominant set edges
2026-05-20 09:03:52,341 - optuna.storages._rdb.storage - INFO - A new study created in RDB with name: Study_e_1M_1c3dcs
2026-05-20 09:04:02,593 - experiment_functions - INFO - Early stopping at epoch 500. Best Recall: 0.0055
2026-05-20 09:04:02,687 - optuna.study.study - INFO - Trial 0 finished with value: 0.005462237428071002 and parameters: {'n_layers': 2, 'embedding_dim': 64, 'lr': 0.002810731673262633, 'lambda_val': 0.00035098960604977776, 'batch_size': 2042, 'optimizer': 'SGD'}. Best is trial 0 with value: 0.005462237428071002.
2026-05-20 09:04:13,053 - experiment_functions - INFO - Early stopping at epoch 500. Best Recall: 0.0051
2026-05-20 09:04:14,506 - optuna.study.study - INFO - Trial 1 finished with value: 0.0051016838674751205 and parameters: {'n_layers': 3, 'embedding_dim': 32, 'lr': 6.050096443330202e-05, 'lambda_val': 0.015060788089170284, 'batch_size': 2008, 'optimizer': 'SGD'}. Best is trial 0 with value: 0.005462237428071002.
2026-05-20 09:04:24,169 - experiment_functions - INFO - Early stopping at epoch 500. Best Recall: 0.0052
2026-05-20 09:04:24,317 - optuna.study.study - INFO - Trial 2 finished with value: 0.005203026086329392 and parameters: {'n_layers': 2, 'embedding_dim': 96, 'lr': 0.04253937342337959, 'lambda_val': 0.024650317772231724, 'batch_size': 2056, 'optimizer': 'SGD'}. Best is trial 0 with value: 0.005462237428071002.
2026-05-20 09:04:35,433 - experiment_functions - INFO - Early stopping at epoch 650. Best Recall: 0.0515
2026-05-20 09:04:35,538 - optuna.study.study - INFO - Trial 3 finished with value: 0.051549149284943724 and parameters: {'n_layers': 3, 'embedding_dim': 96, 'lr': 0.0006311565410168246, 'lambda_val': 0.00043428351999674086, 'batch_size': 3896, 'optimizer': 'Adam'}. Best is trial 3 with value: 0.051549149284943724.
2026-05-20 09:05:45,345 - optuna.study.study - INFO - Trial 4 finished with value: 0.025127803380979186 and parameters: {'n_layers': 3, 'embedding_dim': 256, 'lr': 4.235560597138499e-05, 'lambda_val': 4.5126945298213365e-05, 'batch_size': 3744, 'optimizer': 'Adam'}. Best is trial 3 with value: 0.051549149284943724.
2026-05-20 09:05:52,692 - experiment_functions - INFO - Early stopping at epoch 500. Best Recall: 0.0050
2026-05-20 09:05:52,795 - optuna.study.study - INFO - Trial 5 finished with value: 0.004979516041156798 and parameters: {'n_layers': 2, 'embedding_dim': 32, 'lr': 0.005022226571479209, 'lambda_val': 0.0002839873199381179, 'batch_size': 1256, 'optimizer': 'SGD'}. Best is trial 3 with value: 0.051549149284943724.
2026-05-20 09:06:13,066 - optuna.study._optimize - INFO - Trial 6 pruned. 
2026-05-20 09:06:20,940 - experiment_functions - INFO - Early stopping at epoch 550. Best Recall: 0.0806
2026-05-20 09:06:21,046 - optuna.study.study - INFO - Trial 7 finished with value: 0.08057944821012755 and parameters: {'n_layers': 1, 'embedding_dim': 32, 'lr': 0.004271931048008021, 'lambda_val': 0.0185199165883136, 'batch_size': 3464, 'optimizer': 'Adam'}. Best is trial 7 with value: 0.08057944821012755.
2026-05-20 09:06:33,156 - experiment_functions - INFO - Early stopping at epoch 700. Best Recall: 0.0320
2026-05-20 09:06:33,260 - optuna.study.study - INFO - Trial 8 finished with value: 0.031991019277429984 and parameters: {'n_layers': 2, 'embedding_dim': 256, 'lr': 0.030791431211032127, 'lambda_val': 4.845760453483903e-06, 'batch_size': 1421, 'optimizer': 'Adam'}. Best is trial 7 with value: 0.08057944821012755.
2026-05-20 09:06:44,668 - experiment_functions - INFO - Early stopping at epoch 600. Best Recall: 0.0310
2026-05-20 09:06:45,434 - optuna.study.study - INFO - Trial 9 finished with value: 0.031038217694049717 and parameters: {'n_layers': 1, 'embedding_dim': 96, 'lr': 0.0348694800021023, 'lambda_val': 0.0006510459139758922, 'batch_size': 1317, 'optimizer': 'Adam'}. Best is trial 7 with value: 0.08057944821012755.
2026-05-20 09:07:11,440 - experiment_functions - INFO - Early stopping at epoch 1300. Best Recall: 0.0447
2026-05-20 09:07:11,542 - optuna.study.study - INFO - Trial 10 finished with value: 0.0447182427038547 and parameters: {'n_layers': 1, 'embedding_dim': 128, 'lr': 0.0004205654818121281, 'lambda_val': 0.09426450875645279, 'batch_size': 2964, 'optimizer': 'RMSprop'}. Best is trial 7 with value: 0.08057944821012755.
2026-05-20 09:07:24,350 - experiment_functions - INFO - Early stopping at epoch 800. Best Recall: 0.0305
2026-05-20 09:07:24,497 - optuna.study.study - INFO - Trial 11 finished with value: 0.030518927896496486 and parameters: {'n_layers': 4, 'embedding_dim': 32, 'lr': 0.0006010687596314113, 'lambda_val': 0.003248489653991484, 'batch_size': 3976, 'optimizer': 'Adam'}. Best is trial 7 with value: 0.08057944821012755.
2026-05-20 09:08:04,507 - experiment_functions - INFO - Early stopping at epoch 2600. Best Recall: 0.0338
2026-05-20 09:08:04,589 - optuna.study.study - INFO - Trial 12 finished with value: 0.03381279947832533 and parameters: {'n_layers': 3, 'embedding_dim': 96, 'lr': 0.004091226198558786, 'lambda_val': 0.0042388364855747976, 'batch_size': 3208, 'optimizer': 'RMSprop'}. Best is trial 7 with value: 0.08057944821012755.
2026-05-20 09:09:02,539 - optuna.study.study - INFO - Trial 13 finished with value: 0.0849430949254179 and parameters: {'n_layers': 1, 'embedding_dim': 128, 'lr': 0.00020480759736785258, 'lambda_val': 5.293649873804179e-05, 'batch_size': 3358, 'optimizer': 'Adam'}. Best is trial 13 with value: 0.0849430949254179.
2026-05-20 09:10:09,847 - optuna.study.study - INFO - Trial 14 finished with value: 0.08388682534853074 and parameters: {'n_layers': 1, 'embedding_dim': 128, 'lr': 0.00016757639398014854, 'lambda_val': 5.066603507021105e-05, 'batch_size': 2965, 'optimizer': 'Adam'}. Best is trial 13 with value: 0.0849430949254179.
2026-05-20 09:10:21,062 - experiment_functions - INFO - Early stopping at epoch 800. Best Recall: 0.0050
2026-05-20 09:10:21,142 - optuna.study.study - INFO - Trial 15 finished with value: 0.005009761816637642 and parameters: {'n_layers': 1, 'embedding_dim': 128, 'lr': 1.0021506511239441e-05, 'lambda_val': 3.1645491963822185e-05, 'batch_size': 2767, 'optimizer': 'Adam'}. Best is trial 13 with value: 0.0849430949254179.
2026-05-20 09:10:59,144 - optuna.study._optimize - INFO - Trial 16 pruned. 
2026-05-20 09:12:05,220 - optuna.study.study - INFO - Trial 17 finished with value: 0.08461306171033765 and parameters: {'n_layers': 1, 'embedding_dim': 128, 'lr': 0.0001779897413219914, 'lambda_val': 5.1746294301854414e-05, 'batch_size': 3297, 'optimizer': 'Adam'}. Best is trial 13 with value: 0.0849430949254179.
2026-05-20 09:12:20,329 - optuna.study._optimize - INFO - Trial 18 pruned. 
2026-05-20 09:12:38,814 - optuna.study._optimize - INFO - Trial 19 pruned. 
2026-05-20 09:12:47,777 - experiment_functions - INFO - Early stopping at epoch 550. Best Recall: 0.0711
2026-05-20 09:12:47,880 - optuna.study.study - INFO - Trial 20 finished with value: 0.07106260480491401 and parameters: {'n_layers': 2, 'embedding_dim': 128, 'lr': 0.0021247122894211753, 'lambda_val': 0.0016373266643716947, 'batch_size': 3350, 'optimizer': 'Adam'}. Best is trial 13 with value: 0.0849430949254179.
2026-05-20 09:13:02,580 - optuna.study._optimize - INFO - Trial 21 pruned. 
2026-05-20 09:13:16,370 - optuna.study._optimize - INFO - Trial 22 pruned. 
2026-05-20 09:13:43,301 - experiment_functions - INFO - Early stopping at epoch 1250. Best Recall: 0.0786
2026-05-20 09:13:43,394 - optuna.study.study - INFO - Trial 23 finished with value: 0.0786290059462488 and parameters: {'n_layers': 1, 'embedding_dim': 128, 'lr': 0.0003158074719383493, 'lambda_val': 0.0001294979049489027, 'batch_size': 3707, 'optimizer': 'Adam'}. Best is trial 13 with value: 0.0849430949254179.
2026-05-20 09:13:53,905 - experiment_functions - INFO - Early stopping at epoch 650. Best Recall: 0.0848
2026-05-20 09:13:54,050 - optuna.study.study - INFO - Trial 24 finished with value: 0.0847944640814289 and parameters: {'n_layers': 1, 'embedding_dim': 128, 'lr': 0.0013602503896094878, 'lambda_val': 1.056838385603525e-05, 'batch_size': 2714, 'optimizer': 'Adam'}. Best is trial 13 with value: 0.0849430949254179.
2026-05-20 09:14:04,160 - experiment_functions - INFO - Early stopping at epoch 600. Best Recall: 0.0766
2026-05-20 09:14:04,253 - optuna.study.study - INFO - Trial 25 finished with value: 0.07655525442426377 and parameters: {'n_layers': 2, 'embedding_dim': 128, 'lr': 0.001182576405167889, 'lambda_val': 6.3694205557238156e-06, 'batch_size': 2634, 'optimizer': 'Adam'}. Best is trial 13 with value: 0.0849430949254179.
2026-05-20 09:14:14,796 - experiment_functions - INFO - Early stopping at epoch 700. Best Recall: 0.0874
2026-05-20 09:14:14,904 - optuna.study.study - INFO - Trial 26 finished with value: 0.08741883134200491 and parameters: {'n_layers': 1, 'embedding_dim': 64, 'lr': 0.0013065902547784159, 'lambda_val': 1.5796762327771278e-06, 'batch_size': 2278, 'optimizer': 'Adam'}. Best is trial 26 with value: 0.08741883134200491.
2026-05-20 09:14:39,869 - optuna.study._optimize - INFO - Trial 27 pruned. 
2026-05-20 09:14:48,988 - experiment_functions - INFO - Early stopping at epoch 600. Best Recall: 0.0860
2026-05-20 09:14:49,069 - optuna.study.study - INFO - Trial 28 finished with value: 0.086006263460698 and parameters: {'n_layers': 1, 'embedding_dim': 64, 'lr': 0.0012405491827774194, 'lambda_val': 1.7707609078663119e-06, 'batch_size': 1636, 'optimizer': 'RMSprop'}. Best is trial 26 with value: 0.08741883134200491.
2026-05-20 09:15:04,871 - optuna.study._optimize - INFO - Trial 29 pruned. 
2026-05-20 09:15:13,447 - experiment_functions - INFO - Early stopping at epoch 550. Best Recall: 0.0681
2026-05-20 09:15:13,559 - optuna.study.study - INFO - Trial 30 finished with value: 0.0681061576741319 and parameters: {'n_layers': 1, 'embedding_dim': 64, 'lr': 0.0023769367810621096, 'lambda_val': 2.291931312982672e-06, 'batch_size': 932, 'optimizer': 'RMSprop'}. Best is trial 26 with value: 0.08741883134200491.
2026-05-20 09:15:22,530 - experiment_functions - INFO - Early stopping at epoch 600. Best Recall: 0.0773
2026-05-20 09:15:22,675 - optuna.study.study - INFO - Trial 31 finished with value: 0.07730437799780399 and parameters: {'n_layers': 1, 'embedding_dim': 64, 'lr': 0.001208163538527353, 'lambda_val': 1.2311911154329606e-05, 'batch_size': 2114, 'optimizer': 'RMSprop'}. Best is trial 26 with value: 0.08741883134200491.
2026-05-20 09:15:29,685 - experiment_functions - INFO - Early stopping at epoch 500. Best Recall: 0.0056
2026-05-20 09:15:29,787 - optuna.study.study - INFO - Trial 32 finished with value: 0.0055989296569486915 and parameters: {'n_layers': 1, 'embedding_dim': 64, 'lr': 0.0015299009645212797, 'lambda_val': 9.14745904657735e-06, 'batch_size': 1688, 'optimizer': 'SGD'}. Best is trial 26 with value: 0.08741883134200491.
2026-05-20 09:15:36,841 - experiment_functions - INFO - Early stopping at epoch 500. Best Recall: 0.0050
2026-05-20 09:15:36,932 - optuna.study.study - INFO - Trial 33 finished with value: 0.004964455965944483 and parameters: {'n_layers': 1, 'embedding_dim': 64, 'lr': 0.0009292948097782697, 'lambda_val': 2.2268713495912294e-06, 'batch_size': 1901, 'optimizer': 'SGD'}. Best is trial 26 with value: 0.08741883134200491.
2026-05-20 09:15:54,471 - experiment_functions - INFO - Early stopping at epoch 1150. Best Recall: 0.0712
2026-05-20 09:15:54,551 - optuna.study.study - INFO - Trial 34 finished with value: 0.07124932824961581 and parameters: {'n_layers': 2, 'embedding_dim': 64, 'lr': 0.00031880440764614737, 'lambda_val': 2.2050982361358347e-05, 'batch_size': 2394, 'optimizer': 'RMSprop'}. Best is trial 26 with value: 0.08741883134200491.
2026-05-20 09:16:01,606 - experiment_functions - INFO - Early stopping at epoch 500. Best Recall: 0.0049
2026-05-20 09:16:01,686 - optuna.study.study - INFO - Trial 35 finished with value: 0.004941106340646797 and parameters: {'n_layers': 1, 'embedding_dim': 64, 'lr': 0.0005954417496548008, 'lambda_val': 2.467804500542375e-06, 'batch_size': 1890, 'optimizer': 'SGD'}. Best is trial 26 with value: 0.08741883134200491.
2026-05-20 09:16:18,009 - optuna.study._optimize - INFO - Trial 36 pruned. 
2026-05-20 09:16:26,890 - experiment_functions - INFO - Early stopping at epoch 550. Best Recall: 0.0210
2026-05-20 09:16:26,991 - optuna.study.study - INFO - Trial 37 finished with value: 0.021048744292274 and parameters: {'n_layers': 3, 'embedding_dim': 64, 'lr': 0.08046376027999443, 'lambda_val': 7.632286022755555e-06, 'batch_size': 1087, 'optimizer': 'Adam'}. Best is trial 26 with value: 0.08741883134200491.
2026-05-20 09:16:34,233 - experiment_functions - INFO - Early stopping at epoch 500. Best Recall: 0.0057
2026-05-20 09:16:34,322 - optuna.study.study - INFO - Trial 38 finished with value: 0.005708232145894783 and parameters: {'n_layers': 1, 'embedding_dim': 32, 'lr': 0.015929753804037244, 'lambda_val': 2.6662141789553036e-05, 'batch_size': 1675, 'optimizer': 'SGD'}. Best is trial 26 with value: 0.08741883134200491.
2026-05-20 09:16:50,008 - optuna.study._optimize - INFO - Trial 39 pruned. 
2026-05-20 09:17:02,280 - experiment_functions - INFO - Early stopping at epoch 600. Best Recall: 0.0404
2026-05-20 09:17:02,359 - optuna.study.study - INFO - Trial 40 finished with value: 0.04044934136736929 and parameters: {'n_layers': 4, 'embedding_dim': 256, 'lr': 0.00078778595937886, 'lambda_val': 3.8378610786630716e-06, 'batch_size': 3705, 'optimizer': 'Adam'}. Best is trial 26 with value: 0.08741883134200491.
2026-05-20 09:17:13,201 - experiment_functions - INFO - Early stopping at epoch 650. Best Recall: 0.0845
2026-05-20 09:17:13,281 - optuna.study.study - INFO - Trial 41 finished with value: 0.08448189192747682 and parameters: {'n_layers': 1, 'embedding_dim': 128, 'lr': 0.0016693988703310643, 'lambda_val': 5.0783017968086774e-05, 'batch_size': 3210, 'optimizer': 'Adam'}. Best is trial 26 with value: 0.08741883134200491.
2026-05-20 09:17:22,588 - experiment_functions - INFO - Early stopping at epoch 600. Best Recall: 0.0761
2026-05-20 09:17:22,668 - optuna.study.study - INFO - Trial 42 finished with value: 0.07609049765296723 and parameters: {'n_layers': 1, 'embedding_dim': 128, 'lr': 0.0032938592388824664, 'lambda_val': 0.00041448372369581963, 'batch_size': 3503, 'optimizer': 'Adam'}. Best is trial 26 with value: 0.08741883134200491.
2026-05-20 09:17:34,548 - experiment_functions - INFO - Early stopping at epoch 850. Best Recall: 0.0050
2026-05-20 09:17:34,617 - optuna.study.study - INFO - Trial 43 finished with value: 0.005007312297213891 and parameters: {'n_layers': 1, 'embedding_dim': 128, 'lr': 3.093557138351755e-05, 'lambda_val': 1.912989842875805e-06, 'batch_size': 2852, 'optimizer': 'Adam'}. Best is trial 26 with value: 0.08741883134200491.
2026-05-20 09:17:57,929 - experiment_functions - INFO - Early stopping at epoch 1200. Best Recall: 0.0736
2026-05-20 09:17:58,697 - optuna.study.study - INFO - Trial 44 finished with value: 0.07360364378076284 and parameters: {'n_layers': 1, 'embedding_dim': 32, 'lr': 0.0004476387681941265, 'lambda_val': 6.260085567215198e-06, 'batch_size': 2508, 'optimizer': 'Adam'}. Best is trial 26 with value: 0.08741883134200491.
2026-05-20 09:18:19,437 - experiment_functions - INFO - Early stopping at epoch 1100. Best Recall: 0.0754
2026-05-20 09:18:19,527 - optuna.study.study - INFO - Trial 45 finished with value: 0.07537217142165942 and parameters: {'n_layers': 2, 'embedding_dim': 128, 'lr': 0.00023455835657889824, 'lambda_val': 0.0008523059653016018, 'batch_size': 3295, 'optimizer': 'Adam'}. Best is trial 26 with value: 0.08741883134200491.
2026-05-20 09:18:27,748 - experiment_functions - INFO - Early stopping at epoch 550. Best Recall: 0.0869
2026-05-20 09:18:27,819 - optuna.study.study - INFO - Trial 46 finished with value: 0.08690047257643478 and parameters: {'n_layers': 1, 'embedding_dim': 96, 'lr': 0.005289339887967986, 'lambda_val': 6.658872763896778e-05, 'batch_size': 4088, 'optimizer': 'Adam'}. Best is trial 26 with value: 0.08741883134200491.
2026-05-20 09:18:48,141 - experiment_functions - INFO - Early stopping at epoch 1200. Best Recall: 0.0638
2026-05-20 09:18:48,907 - optuna.study.study - INFO - Trial 47 finished with value: 0.06381425835006144 and parameters: {'n_layers': 1, 'embedding_dim': 96, 'lr': 0.004392757860858008, 'lambda_val': 3.3072011533471814e-05, 'batch_size': 4040, 'optimizer': 'RMSprop'}. Best is trial 26 with value: 0.08741883134200491.
2026-05-20 09:19:05,267 - experiment_functions - INFO - Early stopping at epoch 750. Best Recall: 0.0515
2026-05-20 09:19:05,315 - optuna.study.study - INFO - Trial 48 finished with value: 0.051545906531156246 and parameters: {'n_layers': 1, 'embedding_dim': 96, 'lr': 0.01882857611714099, 'lambda_val': 0.00018704353145183072, 'batch_size': 3873, 'optimizer': 'Adam'}. Best is trial 26 with value: 0.08741883134200491.
2026-05-20 09:19:13,576 - experiment_functions - INFO - Early stopping at epoch 550. Best Recall: 0.0560
2026-05-20 09:19:13,668 - optuna.study.study - INFO - Trial 49 finished with value: 0.05601710501102965 and parameters: {'n_layers': 2, 'embedding_dim': 96, 'lr': 0.006886189441170536, 'lambda_val': 7.412365112179347e-05, 'batch_size': 715, 'optimizer': 'Adam'}. Best is trial 26 with value: 0.08741883134200491.
2026-05-20 09:19:20,756 - experiment_functions - INFO - Early stopping at epoch 500. Best Recall: 0.0047
2026-05-20 09:19:20,847 - optuna.study.study - INFO - Trial 50 finished with value: 0.00467610859025393 and parameters: {'n_layers': 1, 'embedding_dim': 96, 'lr': 0.0032548011950010564, 'lambda_val': 1.7876659841611624e-05, 'batch_size': 3805, 'optimizer': 'SGD'}. Best is trial 26 with value: 0.08741883134200491.
2026-05-20 09:19:34,765 - experiment_functions - INFO - Early stopping at epoch 900. Best Recall: 0.0864
2026-05-20 09:19:34,846 - optuna.study.study - INFO - Trial 51 finished with value: 0.08638276739631616 and parameters: {'n_layers': 1, 'embedding_dim': 128, 'lr': 0.0005225795489345858, 'lambda_val': 5.277576825907768e-05, 'batch_size': 3615, 'optimizer': 'Adam'}. Best is trial 26 with value: 0.08741883134200491.
2026-05-20 09:19:48,377 - experiment_functions - INFO - Early stopping at epoch 850. Best Recall: 0.0845
2026-05-20 09:19:48,478 - optuna.study.study - INFO - Trial 52 finished with value: 0.0844950752011165 and parameters: {'n_layers': 1, 'embedding_dim': 96, 'lr': 0.0006158470046734997, 'lambda_val': 1.0493947257620502e-05, 'batch_size': 4076, 'optimizer': 'Adam'}. Best is trial 26 with value: 0.08741883134200491.
2026-05-20 09:19:58,527 - experiment_functions - INFO - Early stopping at epoch 600. Best Recall: 0.0882
2026-05-20 09:19:58,619 - optuna.study.study - INFO - Trial 53 finished with value: 0.08819616671886281 and parameters: {'n_layers': 1, 'embedding_dim': 256, 'lr': 0.0019414154207519519, 'lambda_val': 0.00016141404382554519, 'batch_size': 3591, 'optimizer': 'Adam'}. Best is trial 53 with value: 0.08819616671886281.
2026-05-20 09:20:08,583 - experiment_functions - INFO - Early stopping at epoch 600. Best Recall: 0.0851
2026-05-20 09:20:08,685 - optuna.study.study - INFO - Trial 54 finished with value: 0.08505100798441062 and parameters: {'n_layers': 1, 'embedding_dim': 256, 'lr': 0.0021262869784500066, 'lambda_val': 0.0006950003763746358, 'batch_size': 3928, 'optimizer': 'Adam'}. Best is trial 53 with value: 0.08819616671886281.
2026-05-20 09:20:17,834 - experiment_functions - INFO - Early stopping at epoch 550. Best Recall: 0.0852
2026-05-20 09:20:17,924 - optuna.study.study - INFO - Trial 55 finished with value: 0.08515690983646577 and parameters: {'n_layers': 1, 'embedding_dim': 256, 'lr': 0.005617729629763669, 'lambda_val': 0.0008281035282745352, 'batch_size': 3547, 'optimizer': 'Adam'}. Best is trial 53 with value: 0.08819616671886281.
2026-05-20 09:20:26,743 - experiment_functions - INFO - Early stopping at epoch 550. Best Recall: 0.0718
2026-05-20 09:20:26,834 - optuna.study.study - INFO - Trial 56 finished with value: 0.07181277497143837 and parameters: {'n_layers': 1, 'embedding_dim': 256, 'lr': 0.005522300538886361, 'lambda_val': 0.004819089302424497, 'batch_size': 3601, 'optimizer': 'Adam'}. Best is trial 53 with value: 0.08819616671886281.
2026-05-20 09:20:41,750 - optuna.study._optimize - INFO - Trial 57 pruned. 
2026-05-20 09:20:53,545 - experiment_functions - INFO - Early stopping at epoch 700. Best Recall: 0.0879
2026-05-20 09:20:53,625 - optuna.study.study - INFO - Trial 58 finished with value: 0.0879389179411988 and parameters: {'n_layers': 1, 'embedding_dim': 256, 'lr': 0.0008865445589772804, 'lambda_val': 0.00030491564033023383, 'batch_size': 3577, 'optimizer': 'Adam'}. Best is trial 53 with value: 0.08819616671886281.
2026-05-20 09:21:04,402 - experiment_functions - INFO - Early stopping at epoch 600. Best Recall: 0.0751
