2026-05-20 01:43:43,029 - optuna.study.study - INFO - Trial 63 finished with value: 0.07466079993292488 and parameters: {'n_layers': 1, 'embedding_dim': 96, 'lr': 0.0007712929725596519, 'lambda_val': 8.608847838398801e-06, 'batch_size': 842, 'optimizer': 'Adam'}. Best is trial 63 with value: 0.07466079993292488.
2026-05-20 01:44:02,598 - experiment_functions - INFO - Early stopping at epoch 1350. Best Recall: 0.0715
2026-05-20 01:44:02,697 - optuna.study.study - INFO - Trial 64 finished with value: 0.07154504952389266 and parameters: {'n_layers': 1, 'embedding_dim': 96, 'lr': 0.0005685917926673618, 'lambda_val': 1.0021892378292962e-05, 'batch_size': 899, 'optimizer': 'Adam'}. Best is trial 63 with value: 0.07466079993292488.
2026-05-20 01:44:33,073 - experiment_functions - INFO - Early stopping at epoch 2150. Best Recall: 0.0729
2026-05-20 01:44:33,173 - optuna.study.study - INFO - Trial 65 finished with value: 0.07286016189176527 and parameters: {'n_layers': 1, 'embedding_dim': 96, 'lr': 0.000446840477090865, 'lambda_val': 1.3733302937651239e-05, 'batch_size': 877, 'optimizer': 'Adam'}. Best is trial 63 with value: 0.07466079993292488.
2026-05-20 01:44:46,760 - optuna.study._optimize - INFO - Trial 66 pruned. 
2026-05-20 01:44:58,517 - experiment_functions - INFO - Early stopping at epoch 800. Best Recall: 0.0721
2026-05-20 01:44:58,608 - optuna.study.study - INFO - Trial 67 finished with value: 0.07206240001822822 and parameters: {'n_layers': 1, 'embedding_dim': 32, 'lr': 0.0015272414056913858, 'lambda_val': 1.4969088185072538e-05, 'batch_size': 785, 'optimizer': 'Adam'}. Best is trial 63 with value: 0.07466079993292488.
2026-05-20 01:45:12,729 - optuna.study._optimize - INFO - Trial 68 pruned. 
2026-05-20 01:45:36,552 - experiment_functions - INFO - Early stopping at epoch 1750. Best Recall: 0.0676
2026-05-20 01:45:36,686 - optuna.study.study - INFO - Trial 69 finished with value: 0.06763210682059319 and parameters: {'n_layers': 1, 'embedding_dim': 32, 'lr': 0.00046191094786493704, 'lambda_val': 6.045743254876976e-06, 'batch_size': 1142, 'optimizer': 'Adam'}. Best is trial 63 with value: 0.07466079993292488.
2026-05-20 01:45:48,918 - experiment_functions - INFO - Early stopping at epoch 850. Best Recall: 0.0732
2026-05-20 01:45:49,010 - optuna.study.study - INFO - Trial 70 finished with value: 0.07315108299737451 and parameters: {'n_layers': 1, 'embedding_dim': 64, 'lr': 0.0014546767933406417, 'lambda_val': 3.0643558250795706e-05, 'batch_size': 546, 'optimizer': 'Adam'}. Best is trial 63 with value: 0.07466079993292488.
2026-05-20 01:46:01,600 - experiment_functions - INFO - Early stopping at epoch 850. Best Recall: 0.0719
2026-05-20 01:46:01,748 - optuna.study.study - INFO - Trial 71 finished with value: 0.07194716687654724 and parameters: {'n_layers': 1, 'embedding_dim': 64, 'lr': 0.0016446204669697778, 'lambda_val': 3.053117937531082e-05, 'batch_size': 517, 'optimizer': 'Adam'}. Best is trial 63 with value: 0.07466079993292488.
2026-05-20 01:46:14,313 - experiment_functions - INFO - Early stopping at epoch 800. Best Recall: 0.0785
2026-05-20 01:46:14,452 - optuna.study.study - INFO - Trial 72 finished with value: 0.07853061589029046 and parameters: {'n_layers': 1, 'embedding_dim': 64, 'lr': 0.0014656670394672421, 'lambda_val': 1.3299714391249666e-05, 'batch_size': 568, 'optimizer': 'Adam'}. Best is trial 72 with value: 0.07853061589029046.
2026-05-20 01:46:28,389 - experiment_functions - INFO - Early stopping at epoch 950. Best Recall: 0.0696
2026-05-20 01:46:28,467 - optuna.study.study - INFO - Trial 73 finished with value: 0.06958515285122585 and parameters: {'n_layers': 1, 'embedding_dim': 64, 'lr': 0.0015087198649165689, 'lambda_val': 1.2486410570947493e-05, 'batch_size': 833, 'optimizer': 'Adam'}. Best is trial 72 with value: 0.07853061589029046.
2026-05-20 01:46:37,713 - experiment_functions - INFO - Early stopping at epoch 600. Best Recall: 0.0686
2026-05-20 01:46:37,793 - optuna.study.study - INFO - Trial 74 finished with value: 0.06861586989034707 and parameters: {'n_layers': 1, 'embedding_dim': 64, 'lr': 0.004663595989617802, 'lambda_val': 2.1971641915886114e-06, 'batch_size': 688, 'optimizer': 'Adam'}. Best is trial 72 with value: 0.07853061589029046.
2026-05-20 01:46:53,125 - experiment_functions - INFO - Early stopping at epoch 1000. Best Recall: 0.0755
2026-05-20 01:46:53,271 - optuna.study.study - INFO - Trial 75 finished with value: 0.07553294955465907 and parameters: {'n_layers': 1, 'embedding_dim': 64, 'lr': 0.0007859105666748038, 'lambda_val': 4.845215509806907e-05, 'batch_size': 974, 'optimizer': 'Adam'}. Best is trial 72 with value: 0.07853061589029046.
2026-05-20 01:47:01,304 - experiment_functions - INFO - Early stopping at epoch 500. Best Recall: 0.0055
2026-05-20 01:47:01,394 - optuna.study.study - INFO - Trial 76 finished with value: 0.005539546756395116 and parameters: {'n_layers': 1, 'embedding_dim': 64, 'lr': 0.0007526974930749387, 'lambda_val': 4.9235820233281475e-05, 'batch_size': 975, 'optimizer': 'SGD'}. Best is trial 72 with value: 0.07853061589029046.
2026-05-20 01:47:13,782 - experiment_functions - INFO - Early stopping at epoch 800. Best Recall: 0.0512
2026-05-20 01:47:13,873 - optuna.study.study - INFO - Trial 77 finished with value: 0.051246948944724376 and parameters: {'n_layers': 2, 'embedding_dim': 64, 'lr': 0.0007189588797936158, 'lambda_val': 8.92476510751711e-05, 'batch_size': 1292, 'optimizer': 'RMSprop'}. Best is trial 72 with value: 0.07853061589029046.
2026-05-20 01:47:23,916 - experiment_functions - INFO - Early stopping at epoch 650. Best Recall: 0.0704
2026-05-20 01:47:24,052 - optuna.study.study - INFO - Trial 78 finished with value: 0.07039605684933326 and parameters: {'n_layers': 1, 'embedding_dim': 64, 'lr': 0.003156328234296553, 'lambda_val': 4.3634813426311384e-05, 'batch_size': 987, 'optimizer': 'Adam'}. Best is trial 72 with value: 0.07853061589029046.
2026-05-20 01:47:40,370 - optuna.study._optimize - INFO - Trial 79 pruned. 
2026-05-20 01:47:51,781 - experiment_functions - INFO - Early stopping at epoch 750. Best Recall: 0.0713
2026-05-20 01:47:51,872 - optuna.study.study - INFO - Trial 80 finished with value: 0.07131870212774383 and parameters: {'n_layers': 1, 'embedding_dim': 64, 'lr': 0.0012445062649713565, 'lambda_val': 3.3575071713935102e-06, 'batch_size': 1217, 'optimizer': 'Adam'}. Best is trial 72 with value: 0.07853061589029046.
2026-05-20 01:48:03,012 - experiment_functions - INFO - Early stopping at epoch 750. Best Recall: 0.0798
2026-05-20 01:48:03,118 - optuna.study.study - INFO - Trial 81 finished with value: 0.07979191012431888 and parameters: {'n_layers': 1, 'embedding_dim': 32, 'lr': 0.0016847813117969643, 'lambda_val': 1.5141566584053528e-05, 'batch_size': 840, 'optimizer': 'Adam'}. Best is trial 81 with value: 0.07979191012431888.
2026-05-20 01:48:19,262 - experiment_functions - INFO - Early stopping at epoch 1100. Best Recall: 0.0683
2026-05-20 01:48:19,352 - optuna.study.study - INFO - Trial 82 finished with value: 0.06827379367321544 and parameters: {'n_layers': 1, 'embedding_dim': 32, 'lr': 0.0008555056382744934, 'lambda_val': 1.0079241089821915e-05, 'batch_size': 1099, 'optimizer': 'Adam'}. Best is trial 81 with value: 0.07979191012431888.
2026-05-20 01:48:46,402 - experiment_functions - INFO - Early stopping at epoch 1900. Best Recall: 0.0809
2026-05-20 01:48:46,507 - optuna.study.study - INFO - Trial 83 finished with value: 0.08090337871089973 and parameters: {'n_layers': 1, 'embedding_dim': 64, 'lr': 0.0005769072543663128, 'lambda_val': 1.7561430897282004e-05, 'batch_size': 513, 'optimizer': 'Adam'}. Best is trial 83 with value: 0.08090337871089973.
2026-05-20 01:49:01,440 - optuna.study._optimize - INFO - Trial 84 pruned. 
2026-05-20 01:49:25,203 - experiment_functions - INFO - Early stopping at epoch 1650. Best Recall: 0.0788
2026-05-20 01:49:25,304 - optuna.study.study - INFO - Trial 85 finished with value: 0.07882260095217017 and parameters: {'n_layers': 1, 'embedding_dim': 64, 'lr': 0.0005343671677220784, 'lambda_val': 5.304818318818218e-06, 'batch_size': 917, 'optimizer': 'Adam'}. Best is trial 83 with value: 0.08090337871089973.
2026-05-20 01:49:47,789 - experiment_functions - INFO - Early stopping at epoch 1600. Best Recall: 0.0735
2026-05-20 01:49:47,878 - optuna.study.study - INFO - Trial 86 finished with value: 0.07346055658852527 and parameters: {'n_layers': 1, 'embedding_dim': 64, 'lr': 0.0005915923807372332, 'lambda_val': 5.197435762874218e-06, 'batch_size': 882, 'optimizer': 'Adam'}. Best is trial 83 with value: 0.08090337871089973.
2026-05-20 01:50:08,034 - experiment_functions - INFO - Early stopping at epoch 1450. Best Recall: 0.0806
2026-05-20 01:50:08,177 - optuna.study.study - INFO - Trial 87 finished with value: 0.0805533151838632 and parameters: {'n_layers': 1, 'embedding_dim': 64, 'lr': 0.0005791325071737355, 'lambda_val': 5.6834782848128445e-06, 'batch_size': 716, 'optimizer': 'Adam'}. Best is trial 83 with value: 0.08090337871089973.
2026-05-20 01:50:28,854 - experiment_functions - INFO - Early stopping at epoch 1450. Best Recall: 0.0779
2026-05-20 01:50:28,954 - optuna.study.study - INFO - Trial 88 finished with value: 0.07793851985488684 and parameters: {'n_layers': 1, 'embedding_dim': 64, 'lr': 0.0005790704701106939, 'lambda_val': 4.893129325020081e-06, 'batch_size': 703, 'optimizer': 'Adam'}. Best is trial 83 with value: 0.08090337871089973.
2026-05-20 01:50:42,587 - optuna.study._optimize - INFO - Trial 89 pruned. 
2026-05-20 01:50:56,860 - optuna.study._optimize - INFO - Trial 90 pruned. 
2026-05-20 01:51:19,289 - experiment_functions - INFO - Early stopping at epoch 1550. Best Recall: 0.0724
2026-05-20 01:51:19,400 - optuna.study.study - INFO - Trial 91 finished with value: 0.07239919470732041 and parameters: {'n_layers': 1, 'embedding_dim': 64, 'lr': 0.0006091212710441136, 'lambda_val': 5.624183196985329e-06, 'batch_size': 655, 'optimizer': 'Adam'}. Best is trial 83 with value: 0.08090337871089973.
2026-05-20 01:51:42,242 - experiment_functions - INFO - Early stopping at epoch 1650. Best Recall: 0.0694
2026-05-20 01:51:42,340 - optuna.study.study - INFO - Trial 92 finished with value: 0.06944285732782846 and parameters: {'n_layers': 1, 'embedding_dim': 64, 'lr': 0.0005825141295213139, 'lambda_val': 4.589611416202294e-06, 'batch_size': 794, 'optimizer': 'Adam'}. Best is trial 83 with value: 0.08090337871089973.
2026-05-20 01:51:59,311 - optuna.study._optimize - INFO - Trial 93 pruned. 
2026-05-20 01:52:12,083 - experiment_functions - INFO - Early stopping at epoch 900. Best Recall: 0.0707
2026-05-20 01:52:12,174 - optuna.study.study - INFO - Trial 94 finished with value: 0.0706853295096627 and parameters: {'n_layers': 1, 'embedding_dim': 64, 'lr': 0.0011126684062553857, 'lambda_val': 7.830078525792962e-06, 'batch_size': 731, 'optimizer': 'Adam'}. Best is trial 83 with value: 0.08090337871089973.
2026-05-20 01:52:23,024 - experiment_functions - INFO - Early stopping at epoch 750. Best Recall: 0.0718
2026-05-20 01:52:23,160 - optuna.study.study - INFO - Trial 95 finished with value: 0.07176844137291187 and parameters: {'n_layers': 1, 'embedding_dim': 64, 'lr': 0.0018419955551418682, 'lambda_val': 8.682623153170862e-06, 'batch_size': 595, 'optimizer': 'Adam'}. Best is trial 83 with value: 0.08090337871089973.
2026-05-20 01:52:50,042 - experiment_functions - INFO - Early stopping at epoch 1950. Best Recall: 0.0728
2026-05-20 01:52:50,132 - optuna.study.study - INFO - Trial 96 finished with value: 0.07278153772129635 and parameters: {'n_layers': 1, 'embedding_dim': 64, 'lr': 0.0005052384824820672, 'lambda_val': 3.87943958101311e-06, 'batch_size': 1008, 'optimizer': 'Adam'}. Best is trial 83 with value: 0.08090337871089973.
2026-05-20 01:52:57,081 - experiment_functions - INFO - Early stopping at epoch 500. Best Recall: 0.0054
2026-05-20 01:52:57,181 - optuna.study.study - INFO - Trial 97 finished with value: 0.005433746886657962 and parameters: {'n_layers': 1, 'embedding_dim': 64, 'lr': 0.0006798617314900399, 'lambda_val': 1.146755661077231e-05, 'batch_size': 858, 'optimizer': 'SGD'}. Best is trial 83 with value: 0.08090337871089973.
2026-05-20 01:53:12,173 - experiment_functions - INFO - Early stopping at epoch 1000. Best Recall: 0.0713
2026-05-20 01:53:12,316 - optuna.study.study - INFO - Trial 98 finished with value: 0.07129824766190306 and parameters: {'n_layers': 1, 'embedding_dim': 64, 'lr': 0.0009972000665836196, 'lambda_val': 2.5075214468546954e-06, 'batch_size': 742, 'optimizer': 'Adam'}. Best is trial 83 with value: 0.08090337871089973.
2026-05-20 01:53:25,896 - optuna.study._optimize - INFO - Trial 99 pruned. 
2026-05-20 01:53:50,720 - experiment_functions - INFO - Early stopping at epoch 1800. Best Recall: 0.0755
2026-05-20 01:53:50,821 - optuna.study.study - INFO - Trial 100 finished with value: 0.07551372997802781 and parameters: {'n_layers': 1, 'embedding_dim': 32, 'lr': 0.0006440530354712908, 'lambda_val': 1.8295730180370222e-05, 'batch_size': 605, 'optimizer': 'Adam'}. Best is trial 83 with value: 0.08090337871089973.
2026-05-20 01:54:12,674 - experiment_functions - INFO - Early stopping at epoch 1600. Best Recall: 0.0751
2026-05-20 01:54:12,809 - optuna.study.study - INFO - Trial 101 finished with value: 0.07511552066991824 and parameters: {'n_layers': 1, 'embedding_dim': 64, 'lr': 0.0006301964521829214, 'lambda_val': 2.1929735624001258e-05, 'batch_size': 601, 'optimizer': 'Adam'}. Best is trial 83 with value: 0.08090337871089973.
2026-05-20 01:54:34,112 - experiment_functions - INFO - Early stopping at epoch 1550. Best Recall: 0.0741
2026-05-20 01:54:34,222 - optuna.study.study - INFO - Trial 102 finished with value: 0.07413132629475244 and parameters: {'n_layers': 1, 'embedding_dim': 32, 'lr': 0.0008060272362717644, 'lambda_val': 1.970564641605936e-05, 'batch_size': 629, 'optimizer': 'Adam'}. Best is trial 83 with value: 0.08090337871089973.
2026-05-20 01:54:47,736 - optuna.study._optimize - INFO - Trial 103 pruned. 
2026-05-20 01:55:01,225 - experiment_functions - INFO - Early stopping at epoch 950. Best Recall: 0.0718
2026-05-20 01:55:01,317 - optuna.study.study - INFO - Trial 104 finished with value: 0.07180452743192543 and parameters: {'n_layers': 1, 'embedding_dim': 32, 'lr': 0.0010448109367302905, 'lambda_val': 2.518333219043404e-05, 'batch_size': 789, 'optimizer': 'Adam'}. Best is trial 83 with value: 0.08090337871089973.
2026-05-20 01:55:14,710 - optuna.study._optimize - INFO - Trial 105 pruned. 
2026-05-20 01:55:28,280 - optuna.study._optimize - INFO - Trial 106 pruned. 
2026-05-20 01:55:38,489 - experiment_functions - INFO - Early stopping at epoch 700. Best Recall: 0.0702
2026-05-20 01:55:38,588 - optuna.study.study - INFO - Trial 107 finished with value: 0.07023650221061832 and parameters: {'n_layers': 1, 'embedding_dim': 64, 'lr': 0.0019291117868451316, 'lambda_val': 7.174142214290126e-06, 'batch_size': 806, 'optimizer': 'Adam'}. Best is trial 83 with value: 0.08090337871089973.
2026-05-20 01:55:54,294 - optuna.study._optimize - INFO - Trial 108 pruned. 
2026-05-20 01:56:06,320 - experiment_functions - INFO - Early stopping at epoch 850. Best Recall: 0.0265
2026-05-20 01:56:06,429 - optuna.study.study - INFO - Trial 109 finished with value: 0.02645115180365419 and parameters: {'n_layers': 1, 'embedding_dim': 64, 'lr': 0.0012720216690126494, 'lambda_val': 0.08926813196120767, 'batch_size': 1187, 'optimizer': 'Adam'}. Best is trial 83 with value: 0.08090337871089973.
2026-05-20 01:56:26,367 - experiment_functions - INFO - Early stopping at epoch 1450. Best Recall: 0.0735
2026-05-20 01:56:26,501 - optuna.study.study - INFO - Trial 110 finished with value: 0.07353793525607104 and parameters: {'n_layers': 1, 'embedding_dim': 64, 'lr': 0.0006386074076075595, 'lambda_val': 2.6796746983756038e-05, 'batch_size': 942, 'optimizer': 'Adam'}. Best is trial 83 with value: 0.08090337871089973.
2026-05-20 01:56:41,041 - optuna.study._optimize - INFO - Trial 111 pruned. 
2026-05-20 01:56:54,252 - optuna.study._optimize - INFO - Trial 112 pruned. 
2026-05-20 01:57:10,470 - experiment_functions - INFO - Early stopping at epoch 1200. Best Recall: 0.0732
2026-05-20 01:57:10,540 - optuna.study.study - INFO - Trial 113 finished with value: 0.07321564620676504 and parameters: {'n_layers': 1, 'embedding_dim': 32, 'lr': 0.0008496980678933577, 'lambda_val': 3.718712643391897e-05, 'batch_size': 715, 'optimizer': 'Adam'}. Best is trial 83 with value: 0.08090337871089973.
2026-05-20 01:57:23,934 - optuna.study._optimize - INFO - Trial 114 pruned. 
2026-05-20 01:58:19,679 - optuna.study.study - INFO - Trial 115 finished with value: 0.07539964411630198 and parameters: {'n_layers': 1, 'embedding_dim': 32, 'lr': 0.0009624182489058499, 'lambda_val': 5.433558883633627e-05, 'batch_size': 834, 'optimizer': 'Adam'}. Best is trial 83 with value: 0.08090337871089973.
2026-05-20 01:58:28,988 - experiment_functions - INFO - Early stopping at epoch 550. Best Recall: 0.0532
2026-05-20 01:58:29,097 - optuna.study.study - INFO - Trial 116 finished with value: 0.053166907768968596 and parameters: {'n_layers': 1, 'embedding_dim': 64, 'lr': 0.002859107011240137, 'lambda_val': 4.914987596850984e-05, 'batch_size': 850, 'optimizer': 'RMSprop'}. Best is trial 83 with value: 0.08090337871089973.
2026-05-20 01:58:36,924 - experiment_functions - INFO - Early stopping at epoch 500. Best Recall: 0.0054
2026-05-20 01:58:37,033 - optuna.study.study - INFO - Trial 117 finished with value: 0.005390328619511744 and parameters: {'n_layers': 1, 'embedding_dim': 32, 'lr': 0.00103305025866751, 'lambda_val': 8.91555737385669e-06, 'batch_size': 1035, 'optimizer': 'SGD'}. Best is trial 83 with value: 0.08090337871089973.
2026-05-20 01:58:49,096 - experiment_functions - INFO - Early stopping at epoch 800. Best Recall: 0.0721
2026-05-20 01:58:49,198 - optuna.study.study - INFO - Trial 118 finished with value: 0.07213638567614357 and parameters: {'n_layers': 1, 'embedding_dim': 64, 'lr': 0.0013807135491542292, 'lambda_val': 0.00010069454404841078, 'batch_size': 742, 'optimizer': 'Adam'}. Best is trial 83 with value: 0.08090337871089973.
2026-05-20 01:59:08,578 - experiment_functions - INFO - Early stopping at epoch 1350. Best Recall: 0.0714
2026-05-20 01:59:08,696 - optuna.study.study - INFO - Trial 119 finished with value: 0.07140709398745311 and parameters: {'n_layers': 1, 'embedding_dim': 128, 'lr': 0.0006592839962329388, 'lambda_val': 7.067456525112254e-05, 'batch_size': 803, 'optimizer': 'Adam'}. Best is trial 83 with value: 0.08090337871089973.
2026-05-20 01:59:18,691 - experiment_functions - INFO - Early stopping at epoch 700. Best Recall: 0.0703
2026-05-20 01:59:18,783 - optuna.study.study - INFO - Trial 120 finished with value: 0.07030777473715782 and parameters: {'n_layers': 1, 'embedding_dim': 64, 'lr': 0.0021071328910577565, 'lambda_val': 3.0577516180148678e-06, 'batch_size': 949, 'optimizer': 'Adam'}. Best is trial 83 with value: 0.08090337871089973.
2026-05-20 01:59:40,749 - experiment_functions - INFO - Early stopping at epoch 1550. Best Recall: 0.0739
2026-05-20 01:59:40,885 - optuna.study.study - INFO - Trial 121 finished with value: 0.07393500413087246 and parameters: {'n_layers': 1, 'embedding_dim': 32, 'lr': 0.0007957128314028587, 'lambda_val': 3.351333065049969e-05, 'batch_size': 623, 'optimizer': 'Adam'}. Best is trial 83 with value: 0.08090337871089973.
2026-05-20 01:59:55,142 - experiment_functions - INFO - Early stopping at epoch 900. Best Recall: 0.0732
2026-05-20 01:59:55,284 - optuna.study.study - INFO - Trial 122 finished with value: 0.07318204356320165 and parameters: {'n_layers': 1, 'embedding_dim': 32, 'lr': 0.001160012577482391, 'lambda_val': 2.3507651490014826e-05, 'batch_size': 1272, 'optimizer': 'Adam'}. Best is trial 83 with value: 0.08090337871089973.
2026-05-20 02:00:29,316 - experiment_functions - INFO - Early stopping at epoch 2400. Best Recall: 0.0791
2026-05-20 02:00:29,607 - optuna.study.study - INFO - Trial 123 finished with value: 0.07908241786295175 and parameters: {'n_layers': 1, 'embedding_dim': 32, 'lr': 0.0005549445179271305, 'lambda_val': 1.5004383486632563e-05, 'batch_size': 658, 'optimizer': 'Adam'}. Best is trial 83 with value: 0.08090337871089973.
2026-05-20 02:00:43,366 - optuna.study._optimize - INFO - Trial 124 pruned. 
2026-05-20 02:00:58,129 - optuna.study._optimize - INFO - Trial 125 pruned. 
2026-05-20 02:01:13,087 - optuna.study._optimize - INFO - Trial 126 pruned. 
2026-05-20 02:01:50,348 - experiment_functions - INFO - Early stopping at epoch 2400. Best Recall: 0.0831
2026-05-20 02:01:50,441 - optuna.study.study - INFO - Trial 127 finished with value: 0.08309325616297107 and parameters: {'n_layers': 1, 'embedding_dim': 256, 'lr': 0.001003438204573544, 'lambda_val': 1.5722541202042653e-05, 'batch_size': 795, 'optimizer': 'Adam'}. Best is trial 127 with value: 0.08309325616297107.
2026-05-20 02:02:29,082 - experiment_functions - INFO - Early stopping at epoch 2450. Best Recall: 0.0786
2026-05-20 02:02:29,182 - optuna.study.study - INFO - Trial 128 finished with value: 0.07863750729301214 and parameters: {'n_layers': 1, 'embedding_dim': 256, 'lr': 0.0009374653605893189, 'lambda_val': 1.541537267443125e-05, 'batch_size': 748, 'optimizer': 'Adam'}. Best is trial 127 with value: 0.08309325616297107.
2026-05-20 02:02:48,801 - experiment_functions - INFO - Early stopping at epoch 1250. Best Recall: 0.0740
2026-05-20 02:02:48,969 - optuna.study.study - INFO - Trial 129 finished with value: 0.07397616144599721 and parameters: {'n_layers': 1, 'embedding_dim': 256, 'lr': 0.001311504151492589, 'lambda_val': 1.5754778284035467e-05, 'batch_size': 772, 'optimizer': 'Adam'}. Best is trial 127 with value: 0.08309325616297107.
2026-05-20 02:03:29,641 - experiment_functions - INFO - Early stopping at epoch 2600. Best Recall: 0.0811
