2026-05-20 09:43:32,146 - optuna.study.study - INFO - Trial 127 finished with value: 0.08905084244565635 and parameters: {'n_layers': 1, 'embedding_dim': 64, 'lr': 0.0006225031780102072, 'lambda_val': 8.763668422213015e-06, 'batch_size': 1588, 'optimizer': 'Adam'}. Best is trial 126 with value: 0.09322681497767364.
2026-05-20 09:43:55,220 - experiment_functions - INFO - Early stopping at epoch 950. Best Recall: 0.0687
2026-05-20 09:43:55,300 - optuna.study.study - INFO - Trial 128 finished with value: 0.06872406627489133 and parameters: {'n_layers': 3, 'embedding_dim': 64, 'lr': 0.0003632276809242374, 'lambda_val': 1.1317978615519568e-05, 'batch_size': 986, 'optimizer': 'Adam'}. Best is trial 126 with value: 0.09322681497767364.
2026-05-20 09:44:09,510 - optuna.study._optimize - INFO - Trial 129 pruned. 
2026-05-20 09:44:30,731 - experiment_functions - INFO - Early stopping at epoch 1500. Best Recall: 0.0904
2026-05-20 09:44:30,809 - optuna.study.study - INFO - Trial 130 finished with value: 0.09042992355476262 and parameters: {'n_layers': 1, 'embedding_dim': 64, 'lr': 0.0004114681441048206, 'lambda_val': 6.124761673083247e-06, 'batch_size': 1654, 'optimizer': 'Adam'}. Best is trial 126 with value: 0.09322681497767364.
2026-05-20 09:44:45,386 - optuna.study._optimize - INFO - Trial 131 pruned. 
2026-05-20 09:45:17,565 - experiment_functions - INFO - Early stopping at epoch 2250. Best Recall: 0.0914
2026-05-20 09:45:17,666 - optuna.study.study - INFO - Trial 132 finished with value: 0.09139258763698817 and parameters: {'n_layers': 1, 'embedding_dim': 64, 'lr': 0.00039738939882269655, 'lambda_val': 2.7341411756032917e-05, 'batch_size': 1401, 'optimizer': 'Adam'}. Best is trial 126 with value: 0.09322681497767364.
2026-05-20 09:45:46,590 - optuna.study._optimize - INFO - Trial 133 pruned. 
2026-05-20 09:46:04,476 - experiment_functions - INFO - Early stopping at epoch 1250. Best Recall: 0.0888
2026-05-20 09:46:04,555 - optuna.study.study - INFO - Trial 134 finished with value: 0.08884154574638486 and parameters: {'n_layers': 1, 'embedding_dim': 64, 'lr': 0.0005284884506836548, 'lambda_val': 5.100473569038248e-06, 'batch_size': 1550, 'optimizer': 'Adam'}. Best is trial 126 with value: 0.09322681497767364.
2026-05-20 09:46:19,941 - experiment_functions - INFO - Early stopping at epoch 1000. Best Recall: 0.0907
2026-05-20 09:46:20,019 - optuna.study.study - INFO - Trial 135 finished with value: 0.0906980851399201 and parameters: {'n_layers': 1, 'embedding_dim': 64, 'lr': 0.0007884552002298917, 'lambda_val': 1.571754968913461e-05, 'batch_size': 1200, 'optimizer': 'Adam'}. Best is trial 126 with value: 0.09322681497767364.
2026-05-20 09:46:31,015 - experiment_functions - INFO - Early stopping at epoch 650. Best Recall: 0.0526
2026-05-20 09:46:31,104 - optuna.study.study - INFO - Trial 136 finished with value: 0.052586243478075625 and parameters: {'n_layers': 4, 'embedding_dim': 64, 'lr': 0.0007875585556170223, 'lambda_val': 1.3146114075223018e-05, 'batch_size': 1018, 'optimizer': 'Adam'}. Best is trial 126 with value: 0.09322681497767364.
2026-05-20 09:46:44,337 - experiment_functions - INFO - Early stopping at epoch 900. Best Recall: 0.0935
2026-05-20 09:46:44,430 - optuna.study.study - INFO - Trial 137 finished with value: 0.09351700221570117 and parameters: {'n_layers': 1, 'embedding_dim': 64, 'lr': 0.0008971398458482193, 'lambda_val': 1.840496003633292e-05, 'batch_size': 1277, 'optimizer': 'Adam'}. Best is trial 137 with value: 0.09351700221570117.
2026-05-20 09:46:58,722 - experiment_functions - INFO - Early stopping at epoch 950. Best Recall: 0.0926
2026-05-20 09:46:58,845 - optuna.study.study - INFO - Trial 138 finished with value: 0.09260262913940251 and parameters: {'n_layers': 1, 'embedding_dim': 64, 'lr': 0.0009752234666973943, 'lambda_val': 1.7997129678691726e-05, 'batch_size': 1224, 'optimizer': 'Adam'}. Best is trial 137 with value: 0.09351700221570117.
2026-05-20 09:47:11,866 - experiment_functions - INFO - Early stopping at epoch 850. Best Recall: 0.0918
2026-05-20 09:47:11,945 - optuna.study.study - INFO - Trial 139 finished with value: 0.09177744993017578 and parameters: {'n_layers': 1, 'embedding_dim': 64, 'lr': 0.0009878111668595287, 'lambda_val': 1.7295152189881038e-05, 'batch_size': 1182, 'optimizer': 'Adam'}. Best is trial 137 with value: 0.09351700221570117.
2026-05-20 09:47:19,271 - experiment_functions - INFO - Early stopping at epoch 500. Best Recall: 0.0044
2026-05-20 09:47:19,351 - optuna.study.study - INFO - Trial 140 finished with value: 0.004422372068280971 and parameters: {'n_layers': 1, 'embedding_dim': 64, 'lr': 0.0009187363083578616, 'lambda_val': 1.6534043988011765e-05, 'batch_size': 802, 'optimizer': 'SGD'}. Best is trial 137 with value: 0.09351700221570117.
2026-05-20 09:47:38,380 - experiment_functions - INFO - Early stopping at epoch 750. Best Recall: 0.0893
2026-05-20 09:47:39,143 - optuna.study.study - INFO - Trial 141 finished with value: 0.0892850194421953 and parameters: {'n_layers': 1, 'embedding_dim': 64, 'lr': 0.0014708451615099817, 'lambda_val': 2.3316818795981868e-05, 'batch_size': 1290, 'optimizer': 'Adam'}. Best is trial 137 with value: 0.09351700221570117.
2026-05-20 09:47:53,423 - experiment_functions - INFO - Early stopping at epoch 850. Best Recall: 0.0900
2026-05-20 09:47:53,502 - optuna.study.study - INFO - Trial 142 finished with value: 0.090003359817664 and parameters: {'n_layers': 1, 'embedding_dim': 64, 'lr': 0.0010339023521954694, 'lambda_val': 8.393139529413535e-06, 'batch_size': 1235, 'optimizer': 'Adam'}. Best is trial 137 with value: 0.09351700221570117.
2026-05-20 09:48:05,688 - experiment_functions - INFO - Early stopping at epoch 800. Best Recall: 0.0867
2026-05-20 09:48:05,790 - optuna.study.study - INFO - Trial 143 finished with value: 0.08672579813070376 and parameters: {'n_layers': 1, 'embedding_dim': 64, 'lr': 0.0012447053554243215, 'lambda_val': 1.9948569965796937e-05, 'batch_size': 1178, 'optimizer': 'Adam'}. Best is trial 137 with value: 0.09351700221570117.
2026-05-20 09:48:25,759 - experiment_functions - INFO - Early stopping at epoch 1200. Best Recall: 0.0884
2026-05-20 09:48:26,540 - optuna.study.study - INFO - Trial 144 finished with value: 0.08837407116619736 and parameters: {'n_layers': 1, 'embedding_dim': 64, 'lr': 0.0006441869466574893, 'lambda_val': 3.252917729028786e-05, 'batch_size': 1328, 'optimizer': 'Adam'}. Best is trial 137 with value: 0.09351700221570117.
2026-05-20 09:48:49,976 - experiment_functions - INFO - Early stopping at epoch 1050. Best Recall: 0.0918
2026-05-20 09:48:50,066 - optuna.study.study - INFO - Trial 145 finished with value: 0.0917987538541835 and parameters: {'n_layers': 1, 'embedding_dim': 64, 'lr': 0.0008259637751487797, 'lambda_val': 1.1671619487608596e-05, 'batch_size': 1070, 'optimizer': 'Adam'}. Best is trial 137 with value: 0.09351700221570117.
2026-05-20 09:49:02,919 - experiment_functions - INFO - Early stopping at epoch 850. Best Recall: 0.0848
2026-05-20 09:49:03,008 - optuna.study.study - INFO - Trial 146 finished with value: 0.08478195996876549 and parameters: {'n_layers': 1, 'embedding_dim': 64, 'lr': 0.0008488648640937533, 'lambda_val': 1.102435343693018e-05, 'batch_size': 1086, 'optimizer': 'RMSprop'}. Best is trial 137 with value: 0.09351700221570117.
2026-05-20 09:49:22,585 - experiment_functions - INFO - Early stopping at epoch 1350. Best Recall: 0.0896
2026-05-20 09:49:22,665 - optuna.study.study - INFO - Trial 147 finished with value: 0.08963196670436144 and parameters: {'n_layers': 1, 'embedding_dim': 64, 'lr': 0.0006033350326005309, 'lambda_val': 1.4830342880800606e-05, 'batch_size': 921, 'optimizer': 'Adam'}. Best is trial 137 with value: 0.09351700221570117.
2026-05-20 09:49:34,796 - experiment_functions - INFO - Early stopping at epoch 800. Best Recall: 0.0916
2026-05-20 09:49:34,898 - optuna.study.study - INFO - Trial 148 finished with value: 0.09164054696811341 and parameters: {'n_layers': 1, 'embedding_dim': 64, 'lr': 0.0012804197532905062, 'lambda_val': 2.8281864582254316e-05, 'batch_size': 1057, 'optimizer': 'Adam'}. Best is trial 137 with value: 0.09351700221570117.
2026-05-20 09:49:49,273 - experiment_functions - INFO - Early stopping at epoch 800. Best Recall: 0.0908
2026-05-20 09:49:49,939 - optuna.study.study - INFO - Trial 149 finished with value: 0.0907974088930638 and parameters: {'n_layers': 1, 'embedding_dim': 64, 'lr': 0.001390921550377605, 'lambda_val': 1.8741512960766863e-05, 'batch_size': 842, 'optimizer': 'Adam'}. Best is trial 137 with value: 0.09351700221570117.
2026-05-20 09:50:08,156 - experiment_functions - INFO - Early stopping at epoch 800. Best Recall: 0.0911
2026-05-20 09:50:08,246 - optuna.study.study - INFO - Trial 150 finished with value: 0.09106535500918699 and parameters: {'n_layers': 1, 'embedding_dim': 64, 'lr': 0.0014495222669236316, 'lambda_val': 2.6095203366188195e-05, 'batch_size': 837, 'optimizer': 'Adam'}. Best is trial 137 with value: 0.09351700221570117.
2026-05-20 09:50:21,499 - experiment_functions - INFO - Early stopping at epoch 850. Best Recall: 0.0915
2026-05-20 09:50:21,598 - optuna.study.study - INFO - Trial 151 finished with value: 0.09148328986498312 and parameters: {'n_layers': 1, 'embedding_dim': 64, 'lr': 0.0014199573293493418, 'lambda_val': 2.5658562632510454e-05, 'batch_size': 573, 'optimizer': 'Adam'}. Best is trial 137 with value: 0.09351700221570117.
2026-05-20 09:50:36,311 - experiment_functions - INFO - Early stopping at epoch 950. Best Recall: 0.0909
2026-05-20 09:50:36,410 - optuna.study.study - INFO - Trial 152 finished with value: 0.09091572173033893 and parameters: {'n_layers': 1, 'embedding_dim': 64, 'lr': 0.0012049894109425396, 'lambda_val': 2.708571637696325e-05, 'batch_size': 607, 'optimizer': 'Adam'}. Best is trial 137 with value: 0.09351700221570117.
2026-05-20 09:50:50,747 - experiment_functions - INFO - Early stopping at epoch 800. Best Recall: 0.0913
2026-05-20 09:50:51,528 - optuna.study.study - INFO - Trial 153 finished with value: 0.09130977061437227 and parameters: {'n_layers': 1, 'embedding_dim': 64, 'lr': 0.0016862810351358812, 'lambda_val': 2.2664168024594894e-05, 'batch_size': 572, 'optimizer': 'Adam'}. Best is trial 137 with value: 0.09351700221570117.
2026-05-20 09:51:07,992 - experiment_functions - INFO - Early stopping at epoch 800. Best Recall: 0.0897
2026-05-20 09:51:08,083 - optuna.study.study - INFO - Trial 154 finished with value: 0.08973477609444118 and parameters: {'n_layers': 1, 'embedding_dim': 64, 'lr': 0.0016037184748860505, 'lambda_val': 1.0276695964268256e-05, 'batch_size': 583, 'optimizer': 'Adam'}. Best is trial 137 with value: 0.09351700221570117.
2026-05-20 09:51:18,804 - experiment_functions - INFO - Early stopping at epoch 700. Best Recall: 0.0898
2026-05-20 09:51:18,926 - optuna.study.study - INFO - Trial 155 finished with value: 0.08984652712512947 and parameters: {'n_layers': 1, 'embedding_dim': 64, 'lr': 0.0025532583812373838, 'lambda_val': 1.2562533699170475e-05, 'batch_size': 659, 'optimizer': 'Adam'}. Best is trial 137 with value: 0.09351700221570117.
2026-05-20 09:51:30,392 - experiment_functions - INFO - Early stopping at epoch 750. Best Recall: 0.0938
2026-05-20 09:51:30,541 - optuna.study.study - INFO - Trial 156 finished with value: 0.09382427367571183 and parameters: {'n_layers': 1, 'embedding_dim': 64, 'lr': 0.0018311842313219783, 'lambda_val': 2.1994726846816563e-05, 'batch_size': 761, 'optimizer': 'Adam'}. Best is trial 156 with value: 0.09382427367571183.
2026-05-20 09:51:51,980 - experiment_functions - INFO - Early stopping at epoch 950. Best Recall: 0.0909
2026-05-20 09:51:52,992 - optuna.study.study - INFO - Trial 157 finished with value: 0.09093737902941733 and parameters: {'n_layers': 1, 'embedding_dim': 64, 'lr': 0.0010205466115761831, 'lambda_val': 7.48711708181376e-06, 'batch_size': 1068, 'optimizer': 'Adam'}. Best is trial 156 with value: 0.09382427367571183.
2026-05-20 09:52:07,211 - experiment_functions - INFO - Early stopping at epoch 850. Best Recall: 0.0881
2026-05-20 09:52:07,350 - optuna.study.study - INFO - Trial 158 finished with value: 0.08807214452576938 and parameters: {'n_layers': 1, 'embedding_dim': 64, 'lr': 0.0016752466401968643, 'lambda_val': 2.129237172073276e-05, 'batch_size': 530, 'optimizer': 'Adam'}. Best is trial 156 with value: 0.09382427367571183.
2026-05-20 09:52:17,927 - experiment_functions - INFO - Early stopping at epoch 700. Best Recall: 0.0895
2026-05-20 09:52:18,017 - optuna.study.study - INFO - Trial 159 finished with value: 0.08945805391124538 and parameters: {'n_layers': 1, 'embedding_dim': 64, 'lr': 0.002037676518568331, 'lambda_val': 1.7430162570549068e-05, 'batch_size': 681, 'optimizer': 'Adam'}. Best is trial 156 with value: 0.09382427367571183.
2026-05-20 09:52:32,267 - experiment_functions - INFO - Early stopping at epoch 950. Best Recall: 0.0907
2026-05-20 09:52:32,356 - optuna.study.study - INFO - Trial 160 finished with value: 0.09071351074445318 and parameters: {'n_layers': 1, 'embedding_dim': 64, 'lr': 0.0011345699833444581, 'lambda_val': 1.3117717138315621e-05, 'batch_size': 904, 'optimizer': 'Adam'}. Best is trial 156 with value: 0.09382427367571183.
2026-05-20 09:52:42,676 - experiment_functions - INFO - Early stopping at epoch 650. Best Recall: 0.0909
2026-05-20 09:52:42,767 - optuna.study.study - INFO - Trial 161 finished with value: 0.09093471180613247 and parameters: {'n_layers': 1, 'embedding_dim': 64, 'lr': 0.002837778896425777, 'lambda_val': 2.5456350015463094e-05, 'batch_size': 735, 'optimizer': 'Adam'}. Best is trial 156 with value: 0.09382427367571183.
2026-05-20 09:52:55,670 - experiment_functions - INFO - Early stopping at epoch 850. Best Recall: 0.0883
2026-05-20 09:52:55,759 - optuna.study.study - INFO - Trial 162 finished with value: 0.08828126010463834 and parameters: {'n_layers': 1, 'embedding_dim': 64, 'lr': 0.0014366471754347144, 'lambda_val': 2.217351443872548e-05, 'batch_size': 787, 'optimizer': 'Adam'}. Best is trial 156 with value: 0.09382427367571183.
2026-05-20 09:53:06,099 - experiment_functions - INFO - Early stopping at epoch 700. Best Recall: 0.0904
2026-05-20 09:53:06,199 - optuna.study.study - INFO - Trial 163 finished with value: 0.0904020108885519 and parameters: {'n_layers': 1, 'embedding_dim': 64, 'lr': 0.002089213835702228, 'lambda_val': 2.9285753198389382e-05, 'batch_size': 884, 'optimizer': 'Adam'}. Best is trial 156 with value: 0.09382427367571183.
2026-05-20 09:53:20,606 - experiment_functions - INFO - Early stopping at epoch 950. Best Recall: 0.0918
2026-05-20 09:53:20,708 - optuna.study.study - INFO - Trial 164 finished with value: 0.09184250079290548 and parameters: {'n_layers': 1, 'embedding_dim': 64, 'lr': 0.0009568235832350567, 'lambda_val': 1.7434928478106593e-05, 'batch_size': 1008, 'optimizer': 'Adam'}. Best is trial 156 with value: 0.09382427367571183.
2026-05-20 09:53:35,895 - experiment_functions - INFO - Early stopping at epoch 1050. Best Recall: 0.0931
2026-05-20 09:53:36,028 - optuna.study.study - INFO - Trial 165 finished with value: 0.09308786149427838 and parameters: {'n_layers': 1, 'embedding_dim': 64, 'lr': 0.0009083164633036299, 'lambda_val': 1.9377791053309497e-05, 'batch_size': 1011, 'optimizer': 'Adam'}. Best is trial 156 with value: 0.09382427367571183.
2026-05-20 09:53:50,015 - experiment_functions - INFO - Early stopping at epoch 950. Best Recall: 0.0889
2026-05-20 09:53:50,116 - optuna.study.study - INFO - Trial 166 finished with value: 0.08886045290537095 and parameters: {'n_layers': 1, 'embedding_dim': 64, 'lr': 0.0009646648341639206, 'lambda_val': 9.306136918708015e-06, 'batch_size': 1047, 'optimizer': 'Adam'}. Best is trial 156 with value: 0.09382427367571183.
2026-05-20 09:54:03,437 - experiment_functions - INFO - Early stopping at epoch 850. Best Recall: 0.0913
2026-05-20 09:54:03,536 - optuna.study.study - INFO - Trial 167 finished with value: 0.09128021323632228 and parameters: {'n_layers': 1, 'embedding_dim': 64, 'lr': 0.0012173214201260862, 'lambda_val': 1.5607443604658786e-05, 'batch_size': 1015, 'optimizer': 'Adam'}. Best is trial 156 with value: 0.09382427367571183.
2026-05-20 09:54:21,201 - experiment_functions - INFO - Early stopping at epoch 1100. Best Recall: 0.0911
2026-05-20 09:54:21,322 - optuna.study.study - INFO - Trial 168 finished with value: 0.09109071585228362 and parameters: {'n_layers': 1, 'embedding_dim': 64, 'lr': 0.0007845068982819677, 'lambda_val': 1.9459452510066115e-05, 'batch_size': 1138, 'optimizer': 'Adam'}. Best is trial 156 with value: 0.09382427367571183.
2026-05-20 09:54:36,345 - experiment_functions - INFO - Early stopping at epoch 1000. Best Recall: 0.0927
2026-05-20 09:54:36,425 - optuna.study.study - INFO - Trial 169 finished with value: 0.09265167298672623 and parameters: {'n_layers': 1, 'embedding_dim': 64, 'lr': 0.0009301580351154286, 'lambda_val': 1.2412904859668795e-05, 'batch_size': 948, 'optimizer': 'Adam'}. Best is trial 156 with value: 0.09382427367571183.
2026-05-20 09:54:43,596 - experiment_functions - INFO - Early stopping at epoch 500. Best Recall: 0.0051
2026-05-20 09:54:43,686 - optuna.study.study - INFO - Trial 170 finished with value: 0.005140075923323524 and parameters: {'n_layers': 1, 'embedding_dim': 64, 'lr': 0.0008650890277256042, 'lambda_val': 1.4406181857820351e-05, 'batch_size': 973, 'optimizer': 'SGD'}. Best is trial 156 with value: 0.09382427367571183.
2026-05-20 09:55:00,037 - experiment_functions - INFO - Early stopping at epoch 1000. Best Recall: 0.0918
2026-05-20 09:55:00,803 - optuna.study.study - INFO - Trial 171 finished with value: 0.09179877542115833 and parameters: {'n_layers': 1, 'embedding_dim': 64, 'lr': 0.0010324365232757364, 'lambda_val': 7.551715127838544e-06, 'batch_size': 752, 'optimizer': 'Adam'}. Best is trial 156 with value: 0.09382427367571183.
2026-05-20 09:55:20,649 - experiment_functions - INFO - Early stopping at epoch 1100. Best Recall: 0.0937
2026-05-20 09:55:20,771 - optuna.study.study - INFO - Trial 172 finished with value: 0.0936830598502867 and parameters: {'n_layers': 1, 'embedding_dim': 64, 'lr': 0.0008797350052066944, 'lambda_val': 1.1047710956427188e-05, 'batch_size': 731, 'optimizer': 'Adam'}. Best is trial 156 with value: 0.09382427367571183.
2026-05-20 09:55:36,225 - experiment_functions - INFO - Early stopping at epoch 1050. Best Recall: 0.0876
2026-05-20 09:55:36,303 - optuna.study.study - INFO - Trial 173 finished with value: 0.08759253706715515 and parameters: {'n_layers': 1, 'embedding_dim': 64, 'lr': 0.0010189632083582585, 'lambda_val': 2.973549015223052e-06, 'batch_size': 747, 'optimizer': 'Adam'}. Best is trial 156 with value: 0.09382427367571183.
2026-05-20 09:56:01,261 - experiment_functions - INFO - Early stopping at epoch 1200. Best Recall: 0.0929
2026-05-20 09:56:02,028 - optuna.study.study - INFO - Trial 174 finished with value: 0.09292013077869204 and parameters: {'n_layers': 1, 'embedding_dim': 64, 'lr': 0.0007171001004868452, 'lambda_val': 7.685621729356822e-06, 'batch_size': 965, 'optimizer': 'Adam'}. Best is trial 156 with value: 0.09382427367571183.
2026-05-20 09:56:21,434 - experiment_functions - INFO - Early stopping at epoch 1200. Best Recall: 0.0925
2026-05-20 09:56:21,525 - optuna.study.study - INFO - Trial 175 finished with value: 0.0925185327285345 and parameters: {'n_layers': 1, 'embedding_dim': 64, 'lr': 0.0006851994476272706, 'lambda_val': 4.214471912564598e-06, 'batch_size': 975, 'optimizer': 'Adam'}. Best is trial 156 with value: 0.09382427367571183.
2026-05-20 09:56:36,067 - experiment_functions - INFO - Early stopping at epoch 1000. Best Recall: 0.0909
2026-05-20 09:56:36,145 - optuna.study.study - INFO - Trial 176 finished with value: 0.09086584670562589 and parameters: {'n_layers': 1, 'embedding_dim': 64, 'lr': 0.0007130466954039157, 'lambda_val': 4.335360115772818e-06, 'batch_size': 990, 'optimizer': 'RMSprop'}. Best is trial 156 with value: 0.09382427367571183.
2026-05-20 09:56:50,082 - experiment_functions - INFO - Early stopping at epoch 950. Best Recall: 0.0876
2026-05-20 09:56:50,173 - optuna.study.study - INFO - Trial 177 finished with value: 0.08764181789761309 and parameters: {'n_layers': 1, 'embedding_dim': 64, 'lr': 0.0009230379662788692, 'lambda_val': 8.20779107318926e-06, 'batch_size': 916, 'optimizer': 'Adam'}. Best is trial 156 with value: 0.09382427367571183.
2026-05-20 09:57:02,856 - experiment_functions - INFO - Early stopping at epoch 750. Best Recall: 0.0704
2026-05-20 09:57:03,127 - optuna.study.study - INFO - Trial 178 finished with value: 0.07042813761631302 and parameters: {'n_layers': 3, 'embedding_dim': 64, 'lr': 0.0006756308269654673, 'lambda_val': 1.0961892492311631e-05, 'batch_size': 1124, 'optimizer': 'Adam'}. Best is trial 156 with value: 0.09382427367571183.
2026-05-20 09:57:16,512 - experiment_functions - INFO - Early stopping at epoch 900. Best Recall: 0.0914
2026-05-20 09:57:16,614 - optuna.study.study - INFO - Trial 179 finished with value: 0.0914415366684365 and parameters: {'n_layers': 1, 'embedding_dim': 64, 'lr': 0.0011359632790880557, 'lambda_val': 5.5841021681288336e-06, 'batch_size': 845, 'optimizer': 'Adam'}. Best is trial 156 with value: 0.09382427367571183.
2026-05-20 09:57:35,842 - experiment_functions - INFO - Early stopping at epoch 1350. Best Recall: 0.0891
2026-05-20 09:57:35,931 - optuna.study.study - INFO - Trial 180 finished with value: 0.08910707124745659 and parameters: {'n_layers': 1, 'embedding_dim': 64, 'lr': 0.0006122197192312491, 'lambda_val': 3.4626661266894027e-06, 'batch_size': 1061, 'optimizer': 'Adam'}. Best is trial 156 with value: 0.09382427367571183.
2026-05-20 09:57:52,457 - experiment_functions - INFO - Early stopping at epoch 1150. Best Recall: 0.0895
