2026-05-20 05:53:39,039 - optuna.study.study - INFO - Trial 17 finished with value: 0.04943828983677778 and parameters: {'n_layers': 1, 'embedding_dim': 64, 'lr': 0.014906367767130106, 'lambda_val': 0.00037664673300206926, 'batch_size': 1998, 'optimizer': 'Adam'}. Best is trial 9 with value: 0.08229338784389838.
2026-05-20 05:53:50,237 - experiment_functions - INFO - Early stopping at epoch 550. Best Recall: 0.0300
2026-05-20 05:53:50,339 - optuna.study.study - INFO - Trial 18 finished with value: 0.030017343416191954 and parameters: {'n_layers': 3, 'embedding_dim': 256, 'lr': 0.0023429279026575198, 'lambda_val': 0.008042196610190535, 'batch_size': 2655, 'optimizer': 'Adam'}. Best is trial 9 with value: 0.08229338784389838.
2026-05-20 05:54:03,156 - experiment_functions - INFO - Early stopping at epoch 800. Best Recall: 0.0722
2026-05-20 05:54:03,291 - optuna.study.study - INFO - Trial 19 finished with value: 0.07218725845490548 and parameters: {'n_layers': 2, 'embedding_dim': 128, 'lr': 0.0006671040048575236, 'lambda_val': 8.698067806655817e-05, 'batch_size': 1202, 'optimizer': 'Adam'}. Best is trial 9 with value: 0.08229338784389838.
2026-05-20 05:54:18,659 - experiment_functions - INFO - Early stopping at epoch 500. Best Recall: 0.0058
2026-05-20 05:54:19,433 - optuna.study.study - INFO - Trial 20 finished with value: 0.005785719444750292 and parameters: {'n_layers': 1, 'embedding_dim': 128, 'lr': 0.09929635205079783, 'lambda_val': 0.08540497693063184, 'batch_size': 1395, 'optimizer': 'SGD'}. Best is trial 9 with value: 0.08229338784389838.
2026-05-20 05:54:30,601 - experiment_functions - INFO - Early stopping at epoch 600. Best Recall: 0.0566
2026-05-20 05:54:30,691 - optuna.study.study - INFO - Trial 21 finished with value: 0.05664986013797203 and parameters: {'n_layers': 2, 'embedding_dim': 256, 'lr': 0.0020986983759155795, 'lambda_val': 0.0014347228448848373, 'batch_size': 1794, 'optimizer': 'Adam'}. Best is trial 9 with value: 0.08229338784389838.
2026-05-20 05:54:43,148 - experiment_functions - INFO - Early stopping at epoch 700. Best Recall: 0.0691
2026-05-20 05:54:43,238 - optuna.study.study - INFO - Trial 22 finished with value: 0.06908800471117123 and parameters: {'n_layers': 2, 'embedding_dim': 256, 'lr': 0.0006342552930609938, 'lambda_val': 0.0008636135658046405, 'batch_size': 1649, 'optimizer': 'Adam'}. Best is trial 9 with value: 0.08229338784389838.
2026-05-20 05:54:57,173 - experiment_functions - INFO - Early stopping at epoch 550. Best Recall: 0.0491
2026-05-20 05:54:57,274 - optuna.study.study - INFO - Trial 23 finished with value: 0.049125863747787435 and parameters: {'n_layers': 1, 'embedding_dim': 256, 'lr': 0.010829374140260499, 'lambda_val': 0.003393257936363256, 'batch_size': 1063, 'optimizer': 'Adam'}. Best is trial 9 with value: 0.08229338784389838.
2026-05-20 05:55:13,443 - optuna.study._optimize - INFO - Trial 24 pruned. 
2026-05-20 05:55:24,498 - experiment_functions - INFO - Early stopping at epoch 700. Best Recall: 0.0537
2026-05-20 05:55:24,588 - optuna.study.study - INFO - Trial 25 finished with value: 0.05365992746813355 and parameters: {'n_layers': 1, 'embedding_dim': 256, 'lr': 0.0018072446797778184, 'lambda_val': 0.023484455184695018, 'batch_size': 880, 'optimizer': 'Adam'}. Best is trial 9 with value: 0.08229338784389838.
2026-05-20 05:55:39,534 - experiment_functions - INFO - Early stopping at epoch 950. Best Recall: 0.0458
2026-05-20 05:55:39,625 - optuna.study.study - INFO - Trial 26 finished with value: 0.045803815824143605 and parameters: {'n_layers': 3, 'embedding_dim': 64, 'lr': 0.0004766842942173965, 'lambda_val': 0.00012882525808577484, 'batch_size': 2514, 'optimizer': 'Adam'}. Best is trial 9 with value: 0.08229338784389838.
2026-05-20 05:55:57,293 - experiment_functions - INFO - Early stopping at epoch 550. Best Recall: 0.0720
2026-05-20 05:55:57,627 - optuna.study.study - INFO - Trial 27 finished with value: 0.07201709369370593 and parameters: {'n_layers': 2, 'embedding_dim': 128, 'lr': 0.003586393001327423, 'lambda_val': 0.002970022134067788, 'batch_size': 1507, 'optimizer': 'Adam'}. Best is trial 9 with value: 0.08229338784389838.
2026-05-20 05:56:08,323 - experiment_functions - INFO - Early stopping at epoch 650. Best Recall: 0.0779
2026-05-20 05:56:08,424 - optuna.study.study - INFO - Trial 28 finished with value: 0.07793597817342399 and parameters: {'n_layers': 1, 'embedding_dim': 256, 'lr': 0.0011718049651137487, 'lambda_val': 0.0006101709955518265, 'batch_size': 2959, 'optimizer': 'Adam'}. Best is trial 9 with value: 0.08229338784389838.
2026-05-20 05:56:16,104 - experiment_functions - INFO - Early stopping at epoch 500. Best Recall: 0.0050
2026-05-20 05:56:16,194 - optuna.study.study - INFO - Trial 29 finished with value: 0.004977672463613015 and parameters: {'n_layers': 1, 'embedding_dim': 64, 'lr': 2.4544445978123518e-05, 'lambda_val': 3.695688422443357e-05, 'batch_size': 3251, 'optimizer': 'SGD'}. Best is trial 9 with value: 0.08229338784389838.
2026-05-20 05:57:18,323 - optuna.study.study - INFO - Trial 30 finished with value: 0.076347574530971 and parameters: {'n_layers': 1, 'embedding_dim': 256, 'lr': 0.00016565901206642871, 'lambda_val': 0.00046264671000321826, 'batch_size': 3123, 'optimizer': 'Adam'}. Best is trial 9 with value: 0.08229338784389838.
2026-05-20 05:57:33,429 - optuna.study._optimize - INFO - Trial 31 pruned. 
2026-05-20 05:57:55,968 - experiment_functions - INFO - Early stopping at epoch 950. Best Recall: 0.0758
2026-05-20 05:57:56,047 - optuna.study.study - INFO - Trial 32 finished with value: 0.07576867035139978 and parameters: {'n_layers': 1, 'embedding_dim': 256, 'lr': 0.0004488895877886644, 'lambda_val': 0.00019747161947221385, 'batch_size': 2937, 'optimizer': 'Adam'}. Best is trial 9 with value: 0.08229338784389838.
2026-05-20 05:58:18,433 - experiment_functions - INFO - Early stopping at epoch 1450. Best Recall: 0.0722
2026-05-20 05:58:18,601 - optuna.study.study - INFO - Trial 33 finished with value: 0.07222747116053206 and parameters: {'n_layers': 1, 'embedding_dim': 256, 'lr': 0.0003002026078523127, 'lambda_val': 0.00017770924259271885, 'batch_size': 2896, 'optimizer': 'Adam'}. Best is trial 9 with value: 0.08229338784389838.
2026-05-20 05:58:32,381 - optuna.study._optimize - INFO - Trial 34 pruned. 
2026-05-20 05:58:47,371 - optuna.study._optimize - INFO - Trial 35 pruned. 
2026-05-20 05:59:02,469 - experiment_functions - INFO - Early stopping at epoch 1000. Best Recall: 0.0681
2026-05-20 05:59:02,564 - optuna.study.study - INFO - Trial 36 finished with value: 0.06810754177356836 and parameters: {'n_layers': 1, 'embedding_dim': 128, 'lr': 0.0004994329717398172, 'lambda_val': 1.1097320777569065e-05, 'batch_size': 2954, 'optimizer': 'Adam'}. Best is trial 9 with value: 0.08229338784389838.
2026-05-20 05:59:38,147 - experiment_functions - INFO - Early stopping at epoch 1800. Best Recall: 0.0731
2026-05-20 05:59:38,247 - optuna.study.study - INFO - Trial 37 finished with value: 0.07305712396320804 and parameters: {'n_layers': 1, 'embedding_dim': 256, 'lr': 0.00019766457419295475, 'lambda_val': 0.00041255070105152057, 'batch_size': 3821, 'optimizer': 'RMSprop'}. Best is trial 9 with value: 0.08229338784389838.
2026-05-20 05:59:49,934 - experiment_functions - INFO - Early stopping at epoch 750. Best Recall: 0.0571
2026-05-20 05:59:50,023 - optuna.study.study - INFO - Trial 38 finished with value: 0.05706090530396982 and parameters: {'n_layers': 2, 'embedding_dim': 32, 'lr': 0.0008741393882485481, 'lambda_val': 0.0001679127385129883, 'batch_size': 2673, 'optimizer': 'Adam'}. Best is trial 9 with value: 0.08229338784389838.
2026-05-20 06:00:22,863 - experiment_functions - INFO - Early stopping at epoch 2250. Best Recall: 0.0701
2026-05-20 06:00:22,963 - optuna.study.study - INFO - Trial 39 finished with value: 0.07011766749196398 and parameters: {'n_layers': 1, 'embedding_dim': 96, 'lr': 0.00038344060978623586, 'lambda_val': 0.0002564887860926825, 'batch_size': 3418, 'optimizer': 'RMSprop'}. Best is trial 9 with value: 0.08229338784389838.
2026-05-20 06:00:36,544 - optuna.study._optimize - INFO - Trial 40 pruned. 
2026-05-20 06:00:46,462 - experiment_functions - INFO - Early stopping at epoch 600. Best Recall: 0.0657
2026-05-20 06:00:46,562 - optuna.study.study - INFO - Trial 41 finished with value: 0.0657255083713374 and parameters: {'n_layers': 1, 'embedding_dim': 256, 'lr': 0.0029811151837137225, 'lambda_val': 0.004645289124278209, 'batch_size': 2454, 'optimizer': 'Adam'}. Best is trial 9 with value: 0.08229338784389838.
2026-05-20 06:00:55,815 - experiment_functions - INFO - Early stopping at epoch 550. Best Recall: 0.0719
2026-05-20 06:00:55,895 - optuna.study.study - INFO - Trial 42 finished with value: 0.07188082494450859 and parameters: {'n_layers': 1, 'embedding_dim': 256, 'lr': 0.0076717790501969856, 'lambda_val': 0.0005668337144547942, 'batch_size': 2732, 'optimizer': 'Adam'}. Best is trial 9 with value: 0.08229338784389838.
2026-05-20 06:01:06,695 - experiment_functions - INFO - Early stopping at epoch 650. Best Recall: 0.0725
2026-05-20 06:01:06,774 - optuna.study.study - INFO - Trial 43 finished with value: 0.07252600534045502 and parameters: {'n_layers': 1, 'embedding_dim': 256, 'lr': 0.0010769346707441764, 'lambda_val': 0.0010658694862863726, 'batch_size': 3298, 'optimizer': 'Adam'}. Best is trial 9 with value: 0.08229338784389838.
2026-05-20 06:01:20,998 - optuna.study._optimize - INFO - Trial 44 pruned. 
2026-05-20 06:01:39,820 - optuna.study._optimize - INFO - Trial 45 pruned. 
2026-05-20 06:01:50,135 - experiment_functions - INFO - Early stopping at epoch 650. Best Recall: 0.0674
2026-05-20 06:01:50,235 - optuna.study.study - INFO - Trial 46 finished with value: 0.0674249151011155 and parameters: {'n_layers': 1, 'embedding_dim': 128, 'lr': 0.0015589298746331343, 'lambda_val': 0.013404207448902205, 'batch_size': 2386, 'optimizer': 'Adam'}. Best is trial 9 with value: 0.08229338784389838.
2026-05-20 06:01:58,960 - experiment_functions - INFO - Early stopping at epoch 500. Best Recall: 0.0057
2026-05-20 06:01:59,039 - optuna.study.study - INFO - Trial 47 finished with value: 0.005705966379770419 and parameters: {'n_layers': 2, 'embedding_dim': 256, 'lr': 0.0005934484085929961, 'lambda_val': 0.0016047338537726616, 'batch_size': 2827, 'optimizer': 'SGD'}. Best is trial 9 with value: 0.08229338784389838.
2026-05-20 06:02:09,304 - experiment_functions - INFO - Early stopping at epoch 600. Best Recall: 0.0319
2026-05-20 06:02:09,394 - optuna.study.study - INFO - Trial 48 finished with value: 0.03189064815452978 and parameters: {'n_layers': 4, 'embedding_dim': 96, 'lr': 0.0009249721301617216, 'lambda_val': 0.0008846839637747461, 'batch_size': 3959, 'optimizer': 'Adam'}. Best is trial 9 with value: 0.08229338784389838.
2026-05-20 06:02:18,151 - experiment_functions - INFO - Early stopping at epoch 550. Best Recall: 0.0805
2026-05-20 06:02:18,240 - optuna.study.study - INFO - Trial 49 finished with value: 0.08054680624542691 and parameters: {'n_layers': 1, 'embedding_dim': 256, 'lr': 0.005344695627320354, 'lambda_val': 0.000293617291483673, 'batch_size': 2157, 'optimizer': 'Adam'}. Best is trial 9 with value: 0.08229338784389838.
2026-05-20 06:02:28,508 - experiment_functions - INFO - Early stopping at epoch 700. Best Recall: 0.0417
2026-05-20 06:02:28,587 - optuna.study.study - INFO - Trial 50 finished with value: 0.0417227545759183 and parameters: {'n_layers': 1, 'embedding_dim': 32, 'lr': 0.02556648585293048, 'lambda_val': 8.968054420472415e-05, 'batch_size': 3425, 'optimizer': 'Adam'}. Best is trial 9 with value: 0.08229338784389838.
2026-05-20 06:02:37,687 - experiment_functions - INFO - Early stopping at epoch 550. Best Recall: 0.0820
2026-05-20 06:02:37,777 - optuna.study.study - INFO - Trial 51 finished with value: 0.08200107989468974 and parameters: {'n_layers': 1, 'embedding_dim': 256, 'lr': 0.004986190141290537, 'lambda_val': 0.00026926913772587903, 'batch_size': 2149, 'optimizer': 'Adam'}. Best is trial 9 with value: 0.08229338784389838.
2026-05-20 06:02:46,723 - experiment_functions - INFO - Early stopping at epoch 550. Best Recall: 0.0784
2026-05-20 06:02:46,824 - optuna.study.study - INFO - Trial 52 finished with value: 0.07839839675606387 and parameters: {'n_layers': 1, 'embedding_dim': 256, 'lr': 0.006717403720742466, 'lambda_val': 0.00036243624775303884, 'batch_size': 2257, 'optimizer': 'Adam'}. Best is trial 9 with value: 0.08229338784389838.
2026-05-20 06:02:55,614 - experiment_functions - INFO - Early stopping at epoch 550. Best Recall: 0.0636
2026-05-20 06:02:56,123 - optuna.study.study - INFO - Trial 53 finished with value: 0.06355788396087701 and parameters: {'n_layers': 1, 'embedding_dim': 256, 'lr': 0.010650227616940042, 'lambda_val': 0.00041732220832855913, 'batch_size': 2230, 'optimizer': 'Adam'}. Best is trial 9 with value: 0.08229338784389838.
2026-05-20 06:03:04,916 - experiment_functions - INFO - Early stopping at epoch 550. Best Recall: 0.0771
2026-05-20 06:03:05,006 - optuna.study.study - INFO - Trial 54 finished with value: 0.07710514664178447 and parameters: {'n_layers': 1, 'embedding_dim': 256, 'lr': 0.006482839599085991, 'lambda_val': 0.0002556178997733484, 'batch_size': 1850, 'optimizer': 'Adam'}. Best is trial 9 with value: 0.08229338784389838.
2026-05-20 06:03:13,631 - experiment_functions - INFO - Early stopping at epoch 550. Best Recall: 0.0782
2026-05-20 06:03:13,719 - optuna.study.study - INFO - Trial 55 finished with value: 0.07819592790281361 and parameters: {'n_layers': 1, 'embedding_dim': 128, 'lr': 0.0050942638787852875, 'lambda_val': 0.0002872365485631673, 'batch_size': 1894, 'optimizer': 'Adam'}. Best is trial 9 with value: 0.08229338784389838.
2026-05-20 06:03:29,202 - optuna.study._optimize - INFO - Trial 56 pruned. 
2026-05-20 06:03:40,848 - experiment_functions - INFO - Early stopping at epoch 800. Best Recall: 0.0049
2026-05-20 06:03:40,949 - optuna.study.study - INFO - Trial 57 finished with value: 0.004875717353095153 and parameters: {'n_layers': 1, 'embedding_dim': 128, 'lr': 0.023299541131425815, 'lambda_val': 5.2204971166978e-05, 'batch_size': 2113, 'optimizer': 'SGD'}. Best is trial 9 with value: 0.08229338784389838.
2026-05-20 06:03:50,277 - experiment_functions - INFO - Early stopping at epoch 600. Best Recall: 0.0815
2026-05-20 06:03:50,362 - optuna.study.study - INFO - Trial 58 finished with value: 0.08153483554337258 and parameters: {'n_layers': 1, 'embedding_dim': 128, 'lr': 0.0027545477837399223, 'lambda_val': 0.00012107496871631982, 'batch_size': 2343, 'optimizer': 'Adam'}. Best is trial 9 with value: 0.08229338784389838.
2026-05-20 06:03:59,744 - experiment_functions - INFO - Early stopping at epoch 600. Best Recall: 0.0805
2026-05-20 06:03:59,824 - optuna.study.study - INFO - Trial 59 finished with value: 0.0804895342791601 and parameters: {'n_layers': 1, 'embedding_dim': 128, 'lr': 0.0030896595701872, 'lambda_val': 2.319936197037605e-05, 'batch_size': 2358, 'optimizer': 'Adam'}. Best is trial 9 with value: 0.08229338784389838.
2026-05-20 06:04:08,872 - experiment_functions - INFO - Early stopping at epoch 550. Best Recall: 0.0664
2026-05-20 06:04:08,962 - optuna.study.study - INFO - Trial 60 finished with value: 0.06642399149936856 and parameters: {'n_layers': 2, 'embedding_dim': 128, 'lr': 0.0027252940992893346, 'lambda_val': 5.991034679388183e-06, 'batch_size': 2376, 'optimizer': 'Adam'}. Best is trial 9 with value: 0.08229338784389838.
2026-05-20 06:04:18,037 - experiment_functions - INFO - Early stopping at epoch 550. Best Recall: 0.0734
2026-05-20 06:04:18,139 - optuna.study.study - INFO - Trial 61 finished with value: 0.07335333246767822 and parameters: {'n_layers': 1, 'embedding_dim': 128, 'lr': 0.009039800159565153, 'lambda_val': 2.8865159722310324e-05, 'batch_size': 2575, 'optimizer': 'Adam'}. Best is trial 9 with value: 0.08229338784389838.
2026-05-20 06:04:26,563 - experiment_functions - INFO - Early stopping at epoch 550. Best Recall: 0.0799
2026-05-20 06:04:26,653 - optuna.study.study - INFO - Trial 62 finished with value: 0.07985970455499179 and parameters: {'n_layers': 1, 'embedding_dim': 128, 'lr': 0.005431588155408203, 'lambda_val': 1.2043743400647338e-05, 'batch_size': 1892, 'optimizer': 'Adam'}. Best is trial 9 with value: 0.08229338784389838.
2026-05-20 06:04:35,028 - experiment_functions - INFO - Early stopping at epoch 550. Best Recall: 0.0509
2026-05-20 06:04:35,117 - optuna.study.study - INFO - Trial 63 finished with value: 0.0509234308247834 and parameters: {'n_layers': 1, 'embedding_dim': 128, 'lr': 0.014081863888452385, 'lambda_val': 1.5779423081040002e-05, 'batch_size': 1701, 'optimizer': 'Adam'}. Best is trial 9 with value: 0.08229338784389838.
2026-05-20 06:04:44,334 - experiment_functions - INFO - Early stopping at epoch 600. Best Recall: 0.0781
2026-05-20 06:04:44,424 - optuna.study.study - INFO - Trial 64 finished with value: 0.07806523854749055 and parameters: {'n_layers': 1, 'embedding_dim': 128, 'lr': 0.0031322593458735885, 'lambda_val': 1.0033593798454733e-06, 'batch_size': 2048, 'optimizer': 'Adam'}. Best is trial 9 with value: 0.08229338784389838.
2026-05-20 06:04:57,004 - experiment_functions - INFO - Early stopping at epoch 850. Best Recall: 0.0502
2026-05-20 06:04:57,104 - optuna.study.study - INFO - Trial 65 finished with value: 0.05020876325728535 and parameters: {'n_layers': 1, 'embedding_dim': 128, 'lr': 0.016461033404795572, 'lambda_val': 1.2022965141546315e-05, 'batch_size': 2296, 'optimizer': 'Adam'}. Best is trial 9 with value: 0.08229338784389838.
2026-05-20 06:05:07,325 - experiment_functions - INFO - Early stopping at epoch 650. Best Recall: 0.0779
2026-05-20 06:05:07,404 - optuna.study.study - INFO - Trial 66 finished with value: 0.07786904942331489 and parameters: {'n_layers': 1, 'embedding_dim': 128, 'lr': 0.001995562786964659, 'lambda_val': 9.782037226687388e-05, 'batch_size': 1611, 'optimizer': 'Adam'}. Best is trial 9 with value: 0.08229338784389838.
2026-05-20 06:05:16,506 - experiment_functions - INFO - Early stopping at epoch 600. Best Recall: 0.0752
2026-05-20 06:05:16,596 - optuna.study.study - INFO - Trial 67 finished with value: 0.07516368468952316 and parameters: {'n_layers': 1, 'embedding_dim': 128, 'lr': 0.004291730708461291, 'lambda_val': 3.3590841641904222e-06, 'batch_size': 1385, 'optimizer': 'Adam'}. Best is trial 9 with value: 0.08229338784389838.
2026-05-20 06:05:25,116 - experiment_functions - INFO - Early stopping at epoch 500. Best Recall: 0.0051
2026-05-20 06:05:25,207 - optuna.study.study - INFO - Trial 68 finished with value: 0.005142727766376041 and parameters: {'n_layers': 3, 'embedding_dim': 128, 'lr': 0.005847282083700151, 'lambda_val': 6.0442411042108724e-05, 'batch_size': 902, 'optimizer': 'SGD'}. Best is trial 9 with value: 0.08229338784389838.
2026-05-20 06:05:34,149 - experiment_functions - INFO - Early stopping at epoch 600. Best Recall: 0.0729
2026-05-20 06:05:34,249 - optuna.study.study - INFO - Trial 69 finished with value: 0.0729129022277501 and parameters: {'n_layers': 1, 'embedding_dim': 128, 'lr': 0.0035656754812724454, 'lambda_val': 2.1728839847696765e-05, 'batch_size': 2181, 'optimizer': 'Adam'}. Best is trial 9 with value: 0.08229338784389838.
2026-05-20 06:05:43,605 - experiment_functions - INFO - Early stopping at epoch 650. Best Recall: 0.0251
2026-05-20 06:05:43,696 - optuna.study.study - INFO - Trial 70 finished with value: 0.02506497979396902 and parameters: {'n_layers': 1, 'embedding_dim': 64, 'lr': 0.04055237181741855, 'lambda_val': 7.568592971846128e-05, 'batch_size': 695, 'optimizer': 'Adam'}. Best is trial 9 with value: 0.08229338784389838.
2026-05-20 06:05:52,275 - experiment_functions - INFO - Early stopping at epoch 550. Best Recall: 0.0785
2026-05-20 06:05:52,364 - optuna.study.study - INFO - Trial 71 finished with value: 0.07854589879383934 and parameters: {'n_layers': 1, 'embedding_dim': 128, 'lr': 0.007261889423423678, 'lambda_val': 6.357022175584729e-06, 'batch_size': 1870, 'optimizer': 'Adam'}. Best is trial 9 with value: 0.08229338784389838.
2026-05-20 06:06:01,546 - experiment_functions - INFO - Early stopping at epoch 550. Best Recall: 0.0752
2026-05-20 06:06:01,636 - optuna.study.study - INFO - Trial 72 finished with value: 0.07517249691027833 and parameters: {'n_layers': 1, 'embedding_dim': 128, 'lr': 0.008370033216501104, 'lambda_val': 5.151770406907855e-06, 'batch_size': 1972, 'optimizer': 'Adam'}. Best is trial 9 with value: 0.08229338784389838.
2026-05-20 06:06:11,267 - experiment_functions - INFO - Early stopping at epoch 600. Best Recall: 0.0811
2026-05-20 06:06:11,357 - optuna.study.study - INFO - Trial 73 finished with value: 0.0811391738882366 and parameters: {'n_layers': 1, 'embedding_dim': 128, 'lr': 0.002356073439169497, 'lambda_val': 8.289129992771257e-06, 'batch_size': 2345, 'optimizer': 'Adam'}. Best is trial 9 with value: 0.08229338784389838.
2026-05-20 06:06:20,789 - experiment_functions - INFO - Early stopping at epoch 600. Best Recall: 0.0783
2026-05-20 06:06:20,890 - optuna.study.study - INFO - Trial 74 finished with value: 0.07826286323079615 and parameters: {'n_layers': 1, 'embedding_dim': 128, 'lr': 0.002451896805499678, 'lambda_val': 9.794370364765444e-06, 'batch_size': 2556, 'optimizer': 'Adam'}. Best is trial 9 with value: 0.08229338784389838.
2026-05-20 06:06:30,012 - experiment_functions - INFO - Early stopping at epoch 600. Best Recall: 0.0728
2026-05-20 06:06:30,092 - optuna.study.study - INFO - Trial 75 finished with value: 0.07275216310420438 and parameters: {'n_layers': 1, 'embedding_dim': 128, 'lr': 0.0037025539953375913, 'lambda_val': 3.6626358863938113e-06, 'batch_size': 2418, 'optimizer': 'Adam'}. Best is trial 9 with value: 0.08229338784389838.
2026-05-20 06:06:39,483 - experiment_functions - INFO - Early stopping at epoch 600. Best Recall: 0.0773
