2026-05-10 03:08:02,863 - optuna.study._optimize - INFO - Trial 56 pruned. 
2026-05-10 03:08:04,181 - optuna.study._optimize - INFO - Trial 57 pruned. 
2026-05-10 03:08:07,283 - optuna.study._optimize - INFO - Trial 58 pruned. 
2026-05-10 03:08:08,657 - optuna.study._optimize - INFO - Trial 59 pruned. 
2026-05-10 03:08:10,161 - optuna.study._optimize - INFO - Trial 60 pruned. 
2026-05-10 03:09:24,657 - optuna.study.study - INFO - Trial 61 finished with value: 0.03668823419752104 and parameters: {'n_layers': 2, 'embedding_dim': 256, 'lr': 0.00806052772840444, 'lambda_val': 3.307887444549615e-05, 'batch_size': 1038, 'optimizer': 'RMSprop'}. Best is trial 1 with value: 0.06395544987133146.
2026-05-10 03:09:26,039 - optuna.study._optimize - INFO - Trial 62 pruned. 
2026-05-10 03:09:27,380 - optuna.study._optimize - INFO - Trial 63 pruned. 
2026-05-10 03:09:33,136 - optuna.study._optimize - INFO - Trial 64 pruned. 
2026-05-10 03:09:35,443 - optuna.study._optimize - INFO - Trial 65 pruned. 
2026-05-10 03:09:38,204 - optuna.study._optimize - INFO - Trial 66 pruned. 
2026-05-10 03:09:39,732 - optuna.study._optimize - INFO - Trial 67 pruned. 
2026-05-10 03:10:53,213 - optuna.study.study - INFO - Trial 68 finished with value: 0.03004358055307789 and parameters: {'n_layers': 2, 'embedding_dim': 256, 'lr': 0.00942193870881495, 'lambda_val': 2.7320740688407768e-06, 'batch_size': 1584, 'optimizer': 'RMSprop'}. Best is trial 1 with value: 0.06395544987133146.
2026-05-10 03:10:54,596 - optuna.study._optimize - INFO - Trial 69 pruned. 
2026-05-10 03:10:56,119 - optuna.study._optimize - INFO - Trial 70 pruned. 
2026-05-10 03:12:20,252 - optuna.study.study - INFO - Trial 71 finished with value: 0.03973083402343887 and parameters: {'n_layers': 2, 'embedding_dim': 256, 'lr': 0.01032321769281285, 'lambda_val': 5.5860501108024844e-05, 'batch_size': 832, 'optimizer': 'RMSprop'}. Best is trial 1 with value: 0.06395544987133146.
2026-05-10 03:12:21,768 - optuna.study._optimize - INFO - Trial 72 pruned. 
2026-05-10 03:13:38,427 - optuna.study.study - INFO - Trial 73 finished with value: 0.0432203912397143 and parameters: {'n_layers': 2, 'embedding_dim': 256, 'lr': 0.008540335834475674, 'lambda_val': 8.73165941183811e-05, 'batch_size': 885, 'optimizer': 'RMSprop'}. Best is trial 1 with value: 0.06395544987133146.
2026-05-10 03:14:54,703 - optuna.study.study - INFO - Trial 74 finished with value: 0.03781306056450974 and parameters: {'n_layers': 2, 'embedding_dim': 256, 'lr': 0.0068224023283647356, 'lambda_val': 7.886732265201513e-05, 'batch_size': 2938, 'optimizer': 'RMSprop'}. Best is trial 1 with value: 0.06395544987133146.
2026-05-10 03:14:56,175 - optuna.study._optimize - INFO - Trial 75 pruned. 
2026-05-10 03:14:57,648 - optuna.study._optimize - INFO - Trial 76 pruned. 
2026-05-10 03:15:00,016 - optuna.study._optimize - INFO - Trial 77 pruned. 
2026-05-10 03:15:01,500 - optuna.study._optimize - INFO - Trial 78 pruned. 
2026-05-10 03:15:02,939 - optuna.study._optimize - INFO - Trial 79 pruned. 
2026-05-10 03:15:04,471 - optuna.study._optimize - INFO - Trial 80 pruned. 
2026-05-10 03:15:07,451 - optuna.study._optimize - INFO - Trial 81 pruned. 
2026-05-10 03:16:21,441 - optuna.study.study - INFO - Trial 82 finished with value: 0.038056409997492005 and parameters: {'n_layers': 2, 'embedding_dim': 256, 'lr': 0.009331863949080445, 'lambda_val': 5.6777477814707575e-05, 'batch_size': 1009, 'optimizer': 'RMSprop'}. Best is trial 1 with value: 0.06395544987133146.
2026-05-10 03:16:22,734 - optuna.study._optimize - INFO - Trial 83 pruned. 
2026-05-10 03:16:25,053 - optuna.study._optimize - INFO - Trial 84 pruned. 
2026-05-10 03:16:28,172 - optuna.study._optimize - INFO - Trial 85 pruned. 
2026-05-10 03:17:42,704 - optuna.study.study - INFO - Trial 86 finished with value: 0.030795767569206964 and parameters: {'n_layers': 2, 'embedding_dim': 256, 'lr': 0.008664787405969904, 'lambda_val': 3.2971562801004896e-05, 'batch_size': 3797, 'optimizer': 'RMSprop'}. Best is trial 1 with value: 0.06395544987133146.
2026-05-10 03:17:45,908 - optuna.study._optimize - INFO - Trial 87 pruned. 
2026-05-10 03:17:47,757 - optuna.study._optimize - INFO - Trial 88 pruned. 
2026-05-10 03:17:49,086 - optuna.study._optimize - INFO - Trial 89 pruned. 
2026-05-10 03:17:50,569 - optuna.study._optimize - INFO - Trial 90 pruned. 
2026-05-10 03:19:06,410 - optuna.study.study - INFO - Trial 91 finished with value: 0.03651710458875198 and parameters: {'n_layers': 2, 'embedding_dim': 256, 'lr': 0.010900295912655684, 'lambda_val': 4.511534125852163e-05, 'batch_size': 878, 'optimizer': 'RMSprop'}. Best is trial 1 with value: 0.06395544987133146.
2026-05-10 03:19:07,837 - optuna.study._optimize - INFO - Trial 92 pruned. 
2026-05-10 03:19:10,703 - optuna.study._optimize - INFO - Trial 93 pruned. 
2026-05-10 03:20:25,263 - optuna.study.study - INFO - Trial 94 finished with value: 0.039786923483728906 and parameters: {'n_layers': 2, 'embedding_dim': 256, 'lr': 0.00758802817820262, 'lambda_val': 1.1381519133050154e-06, 'batch_size': 806, 'optimizer': 'RMSprop'}. Best is trial 1 with value: 0.06395544987133146.
2026-05-10 03:20:26,678 - optuna.study._optimize - INFO - Trial 95 pruned. 
2026-05-10 03:20:29,440 - optuna.study._optimize - INFO - Trial 96 pruned. 
2026-05-10 03:20:30,879 - optuna.study._optimize - INFO - Trial 97 pruned. 
2026-05-10 03:20:32,396 - optuna.study._optimize - INFO - Trial 98 pruned. 
2026-05-10 03:20:34,013 - optuna.study._optimize - INFO - Trial 99 pruned. 
2026-05-10 03:21:26,757 - root - INFO -   **** Training e_1M_1c1dcs_rand1
2026-05-10 03:21:26,809 - root - INFO -   **** Getting 167284/669182 random edges
2026-05-10 03:21:26,969 - optuna.storages._rdb.storage - INFO - A new study created in RDB with name: Study_e_1M_1c1dcs_rand1
2026-05-10 03:22:10,784 - optuna.study.study - INFO - Trial 0 finished with value: 0.017263354250494974 and parameters: {'n_layers': 1, 'embedding_dim': 32, 'lr': 5.450025375709239e-05, 'lambda_val': 0.0029571495606000578, 'batch_size': 1457, 'optimizer': 'RMSprop'}. Best is trial 0 with value: 0.017263354250494974.
2026-05-10 03:23:06,938 - optuna.study.study - INFO - Trial 1 finished with value: 0.015263648584102795 and parameters: {'n_layers': 1, 'embedding_dim': 256, 'lr': 0.04464299851977305, 'lambda_val': 0.0003199483443314085, 'batch_size': 2941, 'optimizer': 'RMSprop'}. Best is trial 0 with value: 0.017263354250494974.
2026-05-10 03:24:27,207 - optuna.study.study - INFO - Trial 2 finished with value: 0.01351719232605328 and parameters: {'n_layers': 3, 'embedding_dim': 256, 'lr': 0.02421186824449164, 'lambda_val': 9.343083331907224e-05, 'batch_size': 1547, 'optimizer': 'RMSprop'}. Best is trial 0 with value: 0.017263354250494974.
2026-05-10 03:25:13,404 - optuna.study.study - INFO - Trial 3 finished with value: 0.016276009829375774 and parameters: {'n_layers': 2, 'embedding_dim': 32, 'lr': 0.0029280747930804855, 'lambda_val': 0.00845236498059947, 'batch_size': 1005, 'optimizer': 'Adam'}. Best is trial 0 with value: 0.017263354250494974.
2026-05-10 03:26:09,421 - optuna.study.study - INFO - Trial 4 finished with value: 0.005919253948424434 and parameters: {'n_layers': 4, 'embedding_dim': 64, 'lr': 2.207559358992066e-05, 'lambda_val': 0.0007344808096517489, 'batch_size': 3273, 'optimizer': 'SGD'}. Best is trial 0 with value: 0.017263354250494974.
2026-05-10 03:26:10,715 - optuna.study._optimize - INFO - Trial 5 pruned. 
2026-05-10 03:26:12,277 - optuna.study._optimize - INFO - Trial 6 pruned. 
2026-05-10 03:26:15,004 - optuna.study._optimize - INFO - Trial 7 pruned. 
2026-05-10 03:26:16,388 - optuna.study._optimize - INFO - Trial 8 pruned. 
2026-05-10 03:26:17,848 - optuna.study._optimize - INFO - Trial 9 pruned. 
2026-05-10 03:26:19,407 - optuna.study._optimize - INFO - Trial 10 pruned. 
2026-05-10 03:26:20,867 - optuna.study._optimize - INFO - Trial 11 pruned. 
2026-05-10 03:27:09,861 - optuna.study.study - INFO - Trial 12 finished with value: 0.024211974686548517 and parameters: {'n_layers': 2, 'embedding_dim': 32, 'lr': 0.002513282187978692, 'lambda_val': 0.003845970925822165, 'batch_size': 4036, 'optimizer': 'Adam'}. Best is trial 12 with value: 0.024211974686548517.
2026-05-10 03:27:11,219 - optuna.study._optimize - INFO - Trial 13 pruned. 
2026-05-10 03:27:12,669 - optuna.study._optimize - INFO - Trial 14 pruned. 
2026-05-10 03:27:14,120 - optuna.study._optimize - INFO - Trial 15 pruned. 
2026-05-10 03:27:15,460 - optuna.study._optimize - INFO - Trial 16 pruned. 
2026-05-10 03:27:16,921 - optuna.study._optimize - INFO - Trial 17 pruned. 
2026-05-10 03:27:18,381 - optuna.study._optimize - INFO - Trial 18 pruned. 
2026-05-10 03:27:19,895 - optuna.study._optimize - INFO - Trial 19 pruned. 
2026-05-10 03:27:21,787 - optuna.study._optimize - INFO - Trial 20 pruned. 
2026-05-10 03:27:23,229 - optuna.study._optimize - INFO - Trial 21 pruned. 
2026-05-10 03:27:24,612 - optuna.study._optimize - INFO - Trial 22 pruned. 
2026-05-10 03:27:26,346 - optuna.study._optimize - INFO - Trial 23 pruned. 
2026-05-10 03:27:27,892 - optuna.study._optimize - INFO - Trial 24 pruned. 
2026-05-10 03:27:29,427 - optuna.study._optimize - INFO - Trial 25 pruned. 
2026-05-10 03:27:31,050 - optuna.study._optimize - INFO - Trial 26 pruned. 
2026-05-10 03:27:32,717 - optuna.study._optimize - INFO - Trial 27 pruned. 
2026-05-10 03:27:34,644 - optuna.study._optimize - INFO - Trial 28 pruned. 
2026-05-10 03:27:36,492 - optuna.study._optimize - INFO - Trial 29 pruned. 
2026-05-10 03:27:39,071 - optuna.study._optimize - INFO - Trial 30 pruned. 
2026-05-10 03:28:35,954 - optuna.study.study - INFO - Trial 31 finished with value: 0.017896691150881373 and parameters: {'n_layers': 1, 'embedding_dim': 256, 'lr': 0.023642202810979104, 'lambda_val': 0.0005434127205331934, 'batch_size': 2913, 'optimizer': 'RMSprop'}. Best is trial 12 with value: 0.024211974686548517.
2026-05-10 03:28:38,835 - optuna.study._optimize - INFO - Trial 32 pruned. 
2026-05-10 03:28:41,458 - optuna.study._optimize - INFO - Trial 33 pruned. 
2026-05-10 03:28:44,661 - optuna.study._optimize - INFO - Trial 34 pruned. 
2026-05-10 03:29:54,681 - optuna.study.study - INFO - Trial 35 finished with value: 0.017565246130796273 and parameters: {'n_layers': 2, 'embedding_dim': 256, 'lr': 0.0071639103168539804, 'lambda_val': 8.525214413547712e-05, 'batch_size': 3013, 'optimizer': 'RMSprop'}. Best is trial 12 with value: 0.024211974686548517.
2026-05-10 03:31:03,345 - optuna.study.study - INFO - Trial 36 finished with value: 0.015853284914324237 and parameters: {'n_layers': 2, 'embedding_dim': 256, 'lr': 0.00758642683660158, 'lambda_val': 6.295924480992615e-05, 'batch_size': 3130, 'optimizer': 'RMSprop'}. Best is trial 12 with value: 0.024211974686548517.
2026-05-10 03:31:04,795 - optuna.study._optimize - INFO - Trial 37 pruned. 
2026-05-10 03:31:08,020 - optuna.study._optimize - INFO - Trial 38 pruned. 
2026-05-10 03:32:32,618 - optuna.study.study - INFO - Trial 39 finished with value: 0.012096789255508568 and parameters: {'n_layers': 3, 'embedding_dim': 256, 'lr': 0.01552238825745196, 'lambda_val': 3.981067104553949e-06, 'batch_size': 3052, 'optimizer': 'RMSprop'}. Best is trial 12 with value: 0.024211974686548517.
2026-05-10 03:32:33,945 - optuna.study._optimize - INFO - Trial 40 pruned. 
2026-05-10 03:32:35,584 - optuna.study._optimize - INFO - Trial 41 pruned. 
2026-05-10 03:32:37,001 - optuna.study._optimize - INFO - Trial 42 pruned. 
2026-05-10 03:32:38,309 - optuna.study._optimize - INFO - Trial 43 pruned. 
2026-05-10 03:32:39,715 - optuna.study._optimize - INFO - Trial 44 pruned. 
2026-05-10 03:32:41,332 - optuna.study._optimize - INFO - Trial 45 pruned. 
2026-05-10 03:32:42,749 - optuna.study._optimize - INFO - Trial 46 pruned. 
2026-05-10 03:32:44,330 - optuna.study._optimize - INFO - Trial 47 pruned. 
2026-05-10 03:32:45,723 - optuna.study._optimize - INFO - Trial 48 pruned. 
2026-05-10 03:32:47,326 - optuna.study._optimize - INFO - Trial 49 pruned. 
2026-05-10 03:32:49,196 - optuna.study._optimize - INFO - Trial 50 pruned. 
2026-05-10 03:33:58,015 - optuna.study.study - INFO - Trial 51 finished with value: 0.015530633290184462 and parameters: {'n_layers': 2, 'embedding_dim': 256, 'lr': 0.008430696248019055, 'lambda_val': 6.851062952146063e-05, 'batch_size': 3159, 'optimizer': 'RMSprop'}. Best is trial 12 with value: 0.024211974686548517.
2026-05-10 03:35:07,255 - optuna.study.study - INFO - Trial 52 finished with value: 0.013746165370353473 and parameters: {'n_layers': 2, 'embedding_dim': 256, 'lr': 0.01178078201941306, 'lambda_val': 3.8289854324254175e-05, 'batch_size': 3483, 'optimizer': 'RMSprop'}. Best is trial 12 with value: 0.024211974686548517.
2026-05-10 03:35:09,019 - optuna.study._optimize - INFO - Trial 53 pruned. 
2026-05-10 03:35:10,415 - optuna.study._optimize - INFO - Trial 54 pruned. 
2026-05-10 03:35:11,865 - optuna.study._optimize - INFO - Trial 55 pruned. 
2026-05-10 03:35:13,327 - optuna.study._optimize - INFO - Trial 56 pruned. 
2026-05-10 03:35:15,331 - optuna.study._optimize - INFO - Trial 57 pruned. 
2026-05-10 03:35:16,791 - optuna.study._optimize - INFO - Trial 58 pruned. 
2026-05-10 03:35:18,339 - optuna.study._optimize - INFO - Trial 59 pruned. 
2026-05-10 03:35:19,711 - optuna.study._optimize - INFO - Trial 60 pruned. 
2026-05-10 03:35:21,184 - optuna.study._optimize - INFO - Trial 61 pruned. 
2026-05-10 03:35:22,646 - optuna.study._optimize - INFO - Trial 62 pruned. 
2026-05-10 03:35:24,141 - optuna.study._optimize - INFO - Trial 63 pruned. 
2026-05-10 03:35:27,002 - optuna.study._optimize - INFO - Trial 64 pruned. 
2026-05-10 03:35:28,646 - optuna.study._optimize - INFO - Trial 65 pruned. 
2026-05-10 03:35:30,511 - optuna.study._optimize - INFO - Trial 66 pruned. 
2026-05-10 03:35:31,873 - optuna.study._optimize - INFO - Trial 67 pruned. 
2026-05-10 03:35:33,346 - optuna.study._optimize - INFO - Trial 68 pruned. 
2026-05-10 03:35:35,554 - optuna.study._optimize - INFO - Trial 69 pruned. 
2026-05-10 03:35:37,002 - optuna.study._optimize - INFO - Trial 70 pruned. 
2026-05-10 03:35:38,650 - optuna.study._optimize - INFO - Trial 71 pruned. 
2026-05-10 03:35:41,221 - optuna.study._optimize - INFO - Trial 72 pruned. 
2026-05-10 03:35:43,736 - optuna.study._optimize - INFO - Trial 73 pruned. 
2026-05-10 03:35:45,353 - optuna.study._optimize - INFO - Trial 74 pruned. 
2026-05-10 03:35:46,820 - optuna.study._optimize - INFO - Trial 75 pruned. 
2026-05-10 03:35:48,281 - optuna.study._optimize - INFO - Trial 76 pruned. 
2026-05-10 03:35:49,578 - optuna.study._optimize - INFO - Trial 77 pruned. 
2026-05-10 03:35:50,962 - optuna.study._optimize - INFO - Trial 78 pruned. 
2026-05-10 03:35:52,404 - optuna.study._optimize - INFO - Trial 79 pruned. 
2026-05-10 03:35:53,865 - optuna.study._optimize - INFO - Trial 80 pruned. 
2026-05-10 03:37:03,082 - optuna.study.study - INFO - Trial 81 finished with value: 0.013815861018864228 and parameters: {'n_layers': 2, 'embedding_dim': 256, 'lr': 0.012111315514720004, 'lambda_val': 3.2809556792287024e-05, 'batch_size': 3466, 'optimizer': 'RMSprop'}. Best is trial 12 with value: 0.024211974686548517.
2026-05-10 03:37:04,486 - optuna.study._optimize - INFO - Trial 82 pruned. 
2026-05-10 03:38:13,909 - optuna.study.study - INFO - Trial 83 finished with value: 0.014627540139023792 and parameters: {'n_layers': 2, 'embedding_dim': 256, 'lr': 0.012321490546092537, 'lambda_val': 7.029933576492316e-05, 'batch_size': 3227, 'optimizer': 'RMSprop'}. Best is trial 12 with value: 0.024211974686548517.
2026-05-10 03:38:15,324 - optuna.study._optimize - INFO - Trial 84 pruned. 
2026-05-10 03:39:25,178 - optuna.study.study - INFO - Trial 85 finished with value: 0.022417176056662543 and parameters: {'n_layers': 2, 'embedding_dim': 256, 'lr': 0.014793665199126697, 'lambda_val': 0.0007887720914314557, 'batch_size': 2985, 'optimizer': 'RMSprop'}. Best is trial 12 with value: 0.024211974686548517.
2026-05-10 03:39:26,650 - optuna.study._optimize - INFO - Trial 86 pruned. 
2026-05-10 03:39:28,023 - optuna.study._optimize - INFO - Trial 87 pruned. 
2026-05-10 03:40:37,923 - optuna.study.study - INFO - Trial 88 finished with value: 0.02877512565193728 and parameters: {'n_layers': 2, 'embedding_dim': 256, 'lr': 0.01594243311234559, 'lambda_val': 0.00253945564195761, 'batch_size': 2837, 'optimizer': 'RMSprop'}. Best is trial 88 with value: 0.02877512565193728.
2026-05-10 03:40:39,553 - optuna.study._optimize - INFO - Trial 89 pruned. 
2026-05-10 03:40:40,915 - optuna.study._optimize - INFO - Trial 90 pruned. 
2026-05-10 03:40:42,322 - optuna.study._optimize - INFO - Trial 91 pruned. 
2026-05-10 03:40:45,530 - optuna.study._optimize - INFO - Trial 92 pruned. 
2026-05-10 03:40:46,881 - optuna.study._optimize - INFO - Trial 93 pruned. 
2026-05-10 03:40:48,343 - optuna.study._optimize - INFO - Trial 94 pruned. 
2026-05-10 03:40:49,739 - optuna.study._optimize - INFO - Trial 95 pruned. 
2026-05-10 03:40:52,671 - optuna.study._optimize - INFO - Trial 96 pruned. 
2026-05-10 03:42:04,191 - optuna.study.study - INFO - Trial 97 finished with value: 0.02820664086266234 and parameters: {'n_layers': 2, 'embedding_dim': 256, 'lr': 0.010710055319982223, 'lambda_val': 0.002328990499492912, 'batch_size': 2581, 'optimizer': 'RMSprop'}. Best is trial 88 with value: 0.02877512565193728.
2026-05-10 03:42:06,901 - optuna.study._optimize - INFO - Trial 98 pruned. 
2026-05-10 03:42:08,272 - optuna.study._optimize - INFO - Trial 99 pruned. 
2026-05-10 03:43:11,707 - root - INFO -   **** Training e_1M_1c1dcs_rand2
2026-05-10 03:43:11,763 - root - INFO -   **** Getting 167284/669182 random edges
2026-05-10 03:43:11,918 - optuna.storages._rdb.storage - INFO - A new study created in RDB with name: Study_e_1M_1c1dcs_rand2
2026-05-10 03:43:54,572 - optuna.study.study - INFO - Trial 0 finished with value: 0.0062089340027908805 and parameters: {'n_layers': 1, 'embedding_dim': 32, 'lr': 0.03617092349181651, 'lambda_val': 6.776196545582872e-05, 'batch_size': 1459, 'optimizer': 'SGD'}. Best is trial 0 with value: 0.0062089340027908805.
2026-05-10 03:44:50,456 - optuna.study.study - INFO - Trial 1 finished with value: 0.005097622497880393 and parameters: {'n_layers': 4, 'embedding_dim': 64, 'lr': 0.0316151047972259, 'lambda_val': 0.00026235935249522625, 'batch_size': 3687, 'optimizer': 'SGD'}. Best is trial 0 with value: 0.0062089340027908805.
2026-05-10 03:45:54,725 - optuna.study.study - INFO - Trial 2 finished with value: 0.03205646854175209 and parameters: {'n_layers': 4, 'embedding_dim': 96, 'lr': 5.421768039843184e-05, 'lambda_val': 0.00014478028584620918, 'batch_size': 2111, 'optimizer': 'RMSprop'}. Best is trial 2 with value: 0.03205646854175209.
2026-05-10 03:47:27,473 - optuna.study.study - INFO - Trial 3 finished with value: 0.009384736274852177 and parameters: {'n_layers': 4, 'embedding_dim': 256, 'lr': 0.0453866489658452, 'lambda_val': 1.7004892833756022e-06, 'batch_size': 1144, 'optimizer': 'Adam'}. Best is trial 2 with value: 0.03205646854175209.
2026-05-10 03:48:32,824 - optuna.study.study - INFO - Trial 4 finished with value: 0.02217676168631253 and parameters: {'n_layers': 4, 'embedding_dim': 96, 'lr': 0.0031522924143698597, 'lambda_val': 9.565835890004695e-05, 'batch_size': 3061, 'optimizer': 'Adam'}. Best is trial 2 with value: 0.03205646854175209.
2026-05-10 03:48:34,093 - optuna.study._optimize - INFO - Trial 5 pruned. 
2026-05-10 03:48:35,465 - optuna.study._optimize - INFO - Trial 6 pruned. 
2026-05-10 03:49:40,635 - optuna.study.study - INFO - Trial 7 finished with value: 0.01619389662844341 and parameters: {'n_layers': 4, 'embedding_dim': 96, 'lr': 0.011857389497863666, 'lambda_val': 0.000118350698932636, 'batch_size': 1437, 'optimizer': 'Adam'}. Best is trial 2 with value: 0.03205646854175209.
2026-05-10 03:50:50,420 - optuna.study.study - INFO - Trial 8 finished with value: 0.013005020063268414 and parameters: {'n_layers': 4, 'embedding_dim': 128, 'lr': 0.013261017628983431, 'lambda_val': 8.543824583381129e-06, 'batch_size': 3416, 'optimizer': 'RMSprop'}. Best is trial 2 with value: 0.03205646854175209.
2026-05-10 03:50:51,745 - optuna.study._optimize - INFO - Trial 9 pruned. 
2026-05-10 03:50:53,121 - optuna.study._optimize - INFO - Trial 10 pruned. 
2026-05-10 03:51:50,920 - optuna.study.study - INFO - Trial 11 finished with value: 0.009038954118093941 and parameters: {'n_layers': 3, 'embedding_dim': 96, 'lr': 0.0003382613661520485, 'lambda_val': 0.0013512177194136305, 'batch_size': 3016, 'optimizer': 'RMSprop'}. Best is trial 2 with value: 0.03205646854175209.
2026-05-10 03:52:43,984 - optuna.study.study - INFO - Trial 12 finished with value: 0.02851678217082182 and parameters: {'n_layers': 2, 'embedding_dim': 96, 'lr': 0.0010924150543603374, 'lambda_val': 2.794127630715996e-05, 'batch_size': 2863, 'optimizer': 'RMSprop'}. Best is trial 2 with value: 0.03205646854175209.
2026-05-10 03:52:45,243 - optuna.study._optimize - INFO - Trial 13 pruned. 
2026-05-10 03:52:46,658 - optuna.study._optimize - INFO - Trial 14 pruned. 
2026-05-10 03:52:48,494 - optuna.study._optimize - INFO - Trial 15 pruned. 
2026-05-10 03:52:49,820 - optuna.study._optimize - INFO - Trial 16 pruned. 
2026-05-10 03:52:51,246 - optuna.study._optimize - INFO - Trial 17 pruned. 
2026-05-10 03:52:52,694 - optuna.study._optimize - INFO - Trial 18 pruned. 
2026-05-10 03:53:44,075 - optuna.study.study - INFO - Trial 19 finished with value: 0.020223503501031262 and parameters: {'n_layers': 2, 'embedding_dim': 64, 'lr': 0.00452769928510929, 'lambda_val': 0.00046270753917607616, 'batch_size': 3032, 'optimizer': 'RMSprop'}. Best is trial 2 with value: 0.03205646854175209.
2026-05-10 03:53:45,400 - optuna.study._optimize - INFO - Trial 20 pruned. 
2026-05-10 03:53:46,705 - optuna.study._optimize - INFO - Trial 21 pruned. 
2026-05-10 03:53:48,075 - optuna.study._optimize - INFO - Trial 22 pruned. 
2026-05-10 03:53:49,369 - optuna.study._optimize - INFO - Trial 23 pruned. 
