2026-05-10 07:20:02,768 - optuna.study._optimize - INFO - Trial 88 pruned. 
2026-05-10 07:20:04,066 - optuna.study._optimize - INFO - Trial 89 pruned. 
2026-05-10 07:20:05,316 - optuna.study._optimize - INFO - Trial 90 pruned. 
2026-05-10 07:20:54,486 - optuna.study.study - INFO - Trial 91 finished with value: 0.019922758020778846 and parameters: {'n_layers': 1, 'embedding_dim': 128, 'lr': 0.006906291606078446, 'lambda_val': 1.8725484929762622e-06, 'batch_size': 1447, 'optimizer': 'RMSprop'}. Best is trial 3 with value: 0.03809994705635219.
2026-05-10 07:20:56,655 - optuna.study._optimize - INFO - Trial 92 pruned. 
2026-05-10 07:20:57,960 - optuna.study._optimize - INFO - Trial 93 pruned. 
2026-05-10 07:20:59,295 - optuna.study._optimize - INFO - Trial 94 pruned. 
2026-05-10 07:21:00,665 - optuna.study._optimize - INFO - Trial 95 pruned. 
2026-05-10 07:21:03,449 - optuna.study._optimize - INFO - Trial 96 pruned. 
2026-05-10 07:21:05,620 - optuna.study._optimize - INFO - Trial 97 pruned. 
2026-05-10 07:21:07,268 - optuna.study._optimize - INFO - Trial 98 pruned. 
2026-05-10 07:21:09,561 - optuna.study._optimize - INFO - Trial 99 pruned. 
2026-05-10 07:22:02,273 - root - INFO -   **** Training e_1M_1c2dcs_rand3
2026-05-10 07:22:02,335 - root - INFO -   **** Getting 188411/669182 random edges
2026-05-10 07:22:02,495 - optuna.storages._rdb.storage - INFO - A new study created in RDB with name: Study_e_1M_1c2dcs_rand3
2026-05-10 07:23:23,454 - optuna.study.study - INFO - Trial 0 finished with value: 0.004897715901794431 and parameters: {'n_layers': 3, 'embedding_dim': 256, 'lr': 7.045041642221277e-05, 'lambda_val': 3.2144687474101707e-06, 'batch_size': 769, 'optimizer': 'SGD'}. Best is trial 0 with value: 0.004897715901794431.
2026-05-10 07:24:09,652 - optuna.study.study - INFO - Trial 1 finished with value: 0.004408147642643996 and parameters: {'n_layers': 1, 'embedding_dim': 96, 'lr': 0.055685708533392816, 'lambda_val': 0.0021795781207566527, 'batch_size': 2602, 'optimizer': 'SGD'}. Best is trial 0 with value: 0.004897715901794431.
2026-05-10 07:25:47,273 - optuna.study.study - INFO - Trial 2 finished with value: 0.006305501869612723 and parameters: {'n_layers': 4, 'embedding_dim': 256, 'lr': 0.0002902633450525863, 'lambda_val': 0.0280672955618002, 'batch_size': 2688, 'optimizer': 'RMSprop'}. Best is trial 2 with value: 0.006305501869612723.
2026-05-10 07:26:47,833 - optuna.study.study - INFO - Trial 3 finished with value: 0.03249933438226753 and parameters: {'n_layers': 2, 'embedding_dim': 128, 'lr': 0.001546529646425626, 'lambda_val': 4.299290876955521e-05, 'batch_size': 2799, 'optimizer': 'Adam'}. Best is trial 3 with value: 0.03249933438226753.
2026-05-10 07:27:47,162 - optuna.study.study - INFO - Trial 4 finished with value: 0.01327676801306042 and parameters: {'n_layers': 3, 'embedding_dim': 96, 'lr': 0.015159100108114444, 'lambda_val': 4.827017436771392e-06, 'batch_size': 2482, 'optimizer': 'RMSprop'}. Best is trial 3 with value: 0.03249933438226753.
2026-05-10 07:27:48,378 - optuna.study._optimize - INFO - Trial 5 pruned. 
2026-05-10 07:27:49,628 - optuna.study._optimize - INFO - Trial 6 pruned. 
2026-05-10 07:27:51,309 - optuna.study._optimize - INFO - Trial 7 pruned. 
2026-05-10 07:27:52,648 - optuna.study._optimize - INFO - Trial 8 pruned. 
2026-05-10 07:27:54,043 - optuna.study._optimize - INFO - Trial 9 pruned. 
2026-05-10 07:28:45,216 - optuna.study.study - INFO - Trial 10 finished with value: 0.02836305407215149 and parameters: {'n_layers': 1, 'embedding_dim': 128, 'lr': 0.002436883480572726, 'lambda_val': 0.00018804561463048376, 'batch_size': 4062, 'optimizer': 'Adam'}. Best is trial 3 with value: 0.03249933438226753.
2026-05-10 07:28:46,576 - optuna.study._optimize - INFO - Trial 11 pruned. 
2026-05-10 07:28:47,849 - optuna.study._optimize - INFO - Trial 12 pruned. 
2026-05-10 07:28:49,142 - optuna.study._optimize - INFO - Trial 13 pruned. 
2026-05-10 07:28:50,448 - optuna.study._optimize - INFO - Trial 14 pruned. 
2026-05-10 07:29:42,258 - optuna.study.study - INFO - Trial 15 finished with value: 0.03904985714407922 and parameters: {'n_layers': 1, 'embedding_dim': 128, 'lr': 0.0009697712390848824, 'lambda_val': 1.637958391028737e-05, 'batch_size': 3189, 'optimizer': 'Adam'}. Best is trial 15 with value: 0.03904985714407922.
2026-05-10 07:29:43,549 - optuna.study._optimize - INFO - Trial 16 pruned. 
2026-05-10 07:30:33,896 - optuna.study.study - INFO - Trial 17 finished with value: 0.015154818024192239 and parameters: {'n_layers': 1, 'embedding_dim': 128, 'lr': 0.00965691933782594, 'lambda_val': 1.3093513857017878e-05, 'batch_size': 3056, 'optimizer': 'RMSprop'}. Best is trial 15 with value: 0.03904985714407922.
2026-05-10 07:30:35,112 - optuna.study._optimize - INFO - Trial 18 pruned. 
2026-05-10 07:30:36,329 - optuna.study._optimize - INFO - Trial 19 pruned. 
2026-05-10 07:30:37,701 - optuna.study._optimize - INFO - Trial 20 pruned. 
2026-05-10 07:30:39,194 - optuna.study._optimize - INFO - Trial 21 pruned. 
2026-05-10 07:30:40,478 - optuna.study._optimize - INFO - Trial 22 pruned. 
2026-05-10 07:30:41,858 - optuna.study._optimize - INFO - Trial 23 pruned. 
2026-05-10 07:30:43,367 - optuna.study._optimize - INFO - Trial 24 pruned. 
2026-05-10 07:30:44,720 - optuna.study._optimize - INFO - Trial 25 pruned. 
2026-05-10 07:30:46,561 - optuna.study._optimize - INFO - Trial 26 pruned. 
2026-05-10 07:30:47,970 - optuna.study._optimize - INFO - Trial 27 pruned. 
2026-05-10 07:30:49,346 - optuna.study._optimize - INFO - Trial 28 pruned. 
2026-05-10 07:30:50,848 - optuna.study._optimize - INFO - Trial 29 pruned. 
2026-05-10 07:30:52,251 - optuna.study._optimize - INFO - Trial 30 pruned. 
2026-05-10 07:31:41,803 - optuna.study.study - INFO - Trial 31 finished with value: 0.018327510813121294 and parameters: {'n_layers': 1, 'embedding_dim': 128, 'lr': 0.007655553163178455, 'lambda_val': 1.4792092219045094e-05, 'batch_size': 3062, 'optimizer': 'RMSprop'}. Best is trial 15 with value: 0.03904985714407922.
2026-05-10 07:31:44,017 - optuna.study._optimize - INFO - Trial 32 pruned. 
2026-05-10 07:31:46,374 - optuna.study._optimize - INFO - Trial 33 pruned. 
2026-05-10 07:31:48,799 - optuna.study._optimize - INFO - Trial 34 pruned. 
2026-05-10 07:32:38,836 - optuna.study.study - INFO - Trial 35 finished with value: 0.019974663364726794 and parameters: {'n_layers': 1, 'embedding_dim': 128, 'lr': 0.0064265639173418775, 'lambda_val': 4.28764824228268e-06, 'batch_size': 3017, 'optimizer': 'RMSprop'}. Best is trial 15 with value: 0.03904985714407922.
2026-05-10 07:32:40,041 - optuna.study._optimize - INFO - Trial 36 pruned. 
2026-05-10 07:32:41,291 - optuna.study._optimize - INFO - Trial 37 pruned. 
2026-05-10 07:32:42,609 - optuna.study._optimize - INFO - Trial 38 pruned. 
2026-05-10 07:32:44,922 - optuna.study._optimize - INFO - Trial 39 pruned. 
2026-05-10 07:32:47,126 - optuna.study._optimize - INFO - Trial 40 pruned. 
2026-05-10 07:33:37,635 - optuna.study.study - INFO - Trial 41 finished with value: 0.0211773681952472 and parameters: {'n_layers': 1, 'embedding_dim': 128, 'lr': 0.0054186071824381225, 'lambda_val': 1.119055843493122e-05, 'batch_size': 3046, 'optimizer': 'RMSprop'}. Best is trial 15 with value: 0.03904985714407922.
2026-05-10 07:34:27,738 - optuna.study.study - INFO - Trial 42 finished with value: 0.019875460501370193 and parameters: {'n_layers': 1, 'embedding_dim': 128, 'lr': 0.0061308709049967295, 'lambda_val': 6.334071688504059e-06, 'batch_size': 3223, 'optimizer': 'RMSprop'}. Best is trial 15 with value: 0.03904985714407922.
2026-05-10 07:34:28,975 - optuna.study._optimize - INFO - Trial 43 pruned. 
2026-05-10 07:34:30,225 - optuna.study._optimize - INFO - Trial 44 pruned. 
2026-05-10 07:34:31,643 - optuna.study._optimize - INFO - Trial 45 pruned. 
2026-05-10 07:34:33,025 - optuna.study._optimize - INFO - Trial 46 pruned. 
2026-05-10 07:34:34,370 - optuna.study._optimize - INFO - Trial 47 pruned. 
2026-05-10 07:34:36,442 - optuna.study._optimize - INFO - Trial 48 pruned. 
2026-05-10 07:34:37,796 - optuna.study._optimize - INFO - Trial 49 pruned. 
2026-05-10 07:34:39,092 - optuna.study._optimize - INFO - Trial 50 pruned. 
2026-05-10 07:35:29,387 - optuna.study.study - INFO - Trial 51 finished with value: 0.02016077064858403 and parameters: {'n_layers': 1, 'embedding_dim': 128, 'lr': 0.00542295174773404, 'lambda_val': 6.8258789507842985e-06, 'batch_size': 3186, 'optimizer': 'RMSprop'}. Best is trial 15 with value: 0.03904985714407922.
2026-05-10 07:35:31,688 - optuna.study._optimize - INFO - Trial 52 pruned. 
2026-05-10 07:35:33,028 - optuna.study._optimize - INFO - Trial 53 pruned. 
2026-05-10 07:36:22,362 - optuna.study.study - INFO - Trial 54 finished with value: 0.021531049904259192 and parameters: {'n_layers': 1, 'embedding_dim': 128, 'lr': 0.004877012407803149, 'lambda_val': 1.71263112221916e-05, 'batch_size': 3168, 'optimizer': 'RMSprop'}. Best is trial 15 with value: 0.03904985714407922.
2026-05-10 07:37:12,834 - optuna.study.study - INFO - Trial 55 finished with value: 0.021193083094183513 and parameters: {'n_layers': 1, 'embedding_dim': 128, 'lr': 0.004769971617873582, 'lambda_val': 1.7856898890800383e-05, 'batch_size': 3199, 'optimizer': 'RMSprop'}. Best is trial 15 with value: 0.03904985714407922.
2026-05-10 07:37:14,160 - optuna.study._optimize - INFO - Trial 56 pruned. 
2026-05-10 07:37:15,377 - optuna.study._optimize - INFO - Trial 57 pruned. 
2026-05-10 07:37:17,080 - optuna.study._optimize - INFO - Trial 58 pruned. 
2026-05-10 07:37:18,287 - optuna.study._optimize - INFO - Trial 59 pruned. 
2026-05-10 07:37:19,657 - optuna.study._optimize - INFO - Trial 60 pruned. 
2026-05-10 07:38:10,685 - optuna.study.study - INFO - Trial 61 finished with value: 0.020959721139937906 and parameters: {'n_layers': 1, 'embedding_dim': 128, 'lr': 0.004622448808136399, 'lambda_val': 1.1811675465237065e-05, 'batch_size': 3166, 'optimizer': 'RMSprop'}. Best is trial 15 with value: 0.03904985714407922.
2026-05-10 07:38:12,309 - optuna.study._optimize - INFO - Trial 62 pruned. 
2026-05-10 07:38:13,658 - optuna.study._optimize - INFO - Trial 63 pruned. 
2026-05-10 07:38:16,937 - optuna.study._optimize - INFO - Trial 64 pruned. 
2026-05-10 07:38:19,130 - optuna.study._optimize - INFO - Trial 65 pruned. 
2026-05-10 07:38:20,563 - optuna.study._optimize - INFO - Trial 66 pruned. 
2026-05-10 07:38:21,830 - optuna.study._optimize - INFO - Trial 67 pruned. 
2026-05-10 07:38:23,115 - optuna.study._optimize - INFO - Trial 68 pruned. 
2026-05-10 07:38:24,601 - optuna.study._optimize - INFO - Trial 69 pruned. 
2026-05-10 07:38:26,320 - optuna.study._optimize - INFO - Trial 70 pruned. 
2026-05-10 07:38:27,695 - optuna.study._optimize - INFO - Trial 71 pruned. 
2026-05-10 07:38:29,151 - optuna.study._optimize - INFO - Trial 72 pruned. 
2026-05-10 07:38:31,446 - optuna.study._optimize - INFO - Trial 73 pruned. 
2026-05-10 07:38:32,993 - optuna.study._optimize - INFO - Trial 74 pruned. 
2026-05-10 07:38:34,474 - optuna.study._optimize - INFO - Trial 75 pruned. 
2026-05-10 07:38:36,074 - optuna.study._optimize - INFO - Trial 76 pruned. 
2026-05-10 07:38:37,445 - optuna.study._optimize - INFO - Trial 77 pruned. 
2026-05-10 07:38:38,850 - optuna.study._optimize - INFO - Trial 78 pruned. 
2026-05-10 07:38:40,543 - optuna.study._optimize - INFO - Trial 79 pruned. 
2026-05-10 07:38:41,860 - optuna.study._optimize - INFO - Trial 80 pruned. 
2026-05-10 07:38:43,232 - optuna.study._optimize - INFO - Trial 81 pruned. 
2026-05-10 07:38:44,685 - optuna.study._optimize - INFO - Trial 82 pruned. 
2026-05-10 07:38:46,161 - optuna.study._optimize - INFO - Trial 83 pruned. 
2026-05-10 07:38:47,482 - optuna.study._optimize - INFO - Trial 84 pruned. 
2026-05-10 07:38:49,853 - optuna.study._optimize - INFO - Trial 85 pruned. 
2026-05-10 07:38:51,252 - optuna.study._optimize - INFO - Trial 86 pruned. 
2026-05-10 07:38:52,573 - optuna.study._optimize - INFO - Trial 87 pruned. 
2026-05-10 07:38:54,551 - optuna.study._optimize - INFO - Trial 88 pruned. 
2026-05-10 07:38:56,057 - optuna.study._optimize - INFO - Trial 89 pruned. 
2026-05-10 07:38:57,453 - optuna.study._optimize - INFO - Trial 90 pruned. 
2026-05-10 07:38:58,781 - optuna.study._optimize - INFO - Trial 91 pruned. 
2026-05-10 07:39:00,009 - optuna.study._optimize - INFO - Trial 92 pruned. 
2026-05-10 07:39:01,353 - optuna.study._optimize - INFO - Trial 93 pruned. 
2026-05-10 07:39:02,613 - optuna.study._optimize - INFO - Trial 94 pruned. 
2026-05-10 07:39:03,948 - optuna.study._optimize - INFO - Trial 95 pruned. 
2026-05-10 07:39:05,715 - optuna.study._optimize - INFO - Trial 96 pruned. 
2026-05-10 07:39:07,031 - optuna.study._optimize - INFO - Trial 97 pruned. 
2026-05-10 07:39:08,303 - optuna.study._optimize - INFO - Trial 98 pruned. 
2026-05-10 07:39:09,609 - optuna.study._optimize - INFO - Trial 99 pruned. 
2026-05-10 07:40:01,469 - root - INFO -   **** Training e_1M_1c2dcs_rand4
2026-05-10 07:40:01,527 - root - INFO -   **** Getting 188411/669182 random edges
2026-05-10 07:40:01,659 - optuna.storages._rdb.storage - INFO - A new study created in RDB with name: Study_e_1M_1c2dcs_rand4
2026-05-10 07:41:11,143 - optuna.study.study - INFO - Trial 0 finished with value: 0.007108029460293688 and parameters: {'n_layers': 4, 'embedding_dim': 128, 'lr': 0.0026789844028926486, 'lambda_val': 0.05215484626248407, 'batch_size': 2121, 'optimizer': 'RMSprop'}. Best is trial 0 with value: 0.007108029460293688.
2026-05-10 07:42:35,553 - optuna.study.study - INFO - Trial 1 finished with value: 0.0069333650242153705 and parameters: {'n_layers': 3, 'embedding_dim': 256, 'lr': 0.001949543302955841, 'lambda_val': 0.05959181490765053, 'batch_size': 3508, 'optimizer': 'RMSprop'}. Best is trial 0 with value: 0.007108029460293688.
2026-05-10 07:43:27,194 - optuna.study.study - INFO - Trial 2 finished with value: 0.005112974100140656 and parameters: {'n_layers': 4, 'embedding_dim': 32, 'lr': 0.0002643677015892359, 'lambda_val': 9.420020810327646e-06, 'batch_size': 3133, 'optimizer': 'SGD'}. Best is trial 0 with value: 0.007108029460293688.
2026-05-10 07:44:12,177 - optuna.study.study - INFO - Trial 3 finished with value: 0.01756104099358757 and parameters: {'n_layers': 1, 'embedding_dim': 64, 'lr': 0.069015297146752, 'lambda_val': 0.02844275911590932, 'batch_size': 549, 'optimizer': 'Adam'}. Best is trial 3 with value: 0.01756104099358757.
2026-05-10 07:45:03,968 - optuna.study.study - INFO - Trial 4 finished with value: 0.03758379179434917 and parameters: {'n_layers': 1, 'embedding_dim': 128, 'lr': 0.0005459967639048098, 'lambda_val': 0.00012172626271932662, 'batch_size': 4085, 'optimizer': 'RMSprop'}. Best is trial 4 with value: 0.03758379179434917.
2026-05-10 07:45:06,313 - optuna.study._optimize - INFO - Trial 5 pruned. 
2026-05-10 07:45:08,616 - optuna.study._optimize - INFO - Trial 6 pruned. 
2026-05-10 07:46:32,585 - optuna.study.study - INFO - Trial 7 finished with value: 0.008926430169832708 and parameters: {'n_layers': 3, 'embedding_dim': 256, 'lr': 0.00011421461189043619, 'lambda_val': 5.256807729652327e-06, 'batch_size': 2247, 'optimizer': 'RMSprop'}. Best is trial 4 with value: 0.03758379179434917.
2026-05-10 07:46:33,778 - optuna.study._optimize - INFO - Trial 8 pruned. 
2026-05-10 07:46:35,050 - optuna.study._optimize - INFO - Trial 9 pruned. 
2026-05-10 07:46:37,784 - optuna.study._optimize - INFO - Trial 10 pruned. 
2026-05-10 07:46:42,770 - optuna.study._optimize - INFO - Trial 11 pruned. 
2026-05-10 07:47:29,740 - optuna.study.study - INFO - Trial 12 finished with value: 0.021259128869634523 and parameters: {'n_layers': 1, 'embedding_dim': 96, 'lr': 0.007530261830961185, 'lambda_val': 0.00035441587547066803, 'batch_size': 1065, 'optimizer': 'Adam'}. Best is trial 4 with value: 0.03758379179434917.
2026-05-10 07:48:21,713 - optuna.study.study - INFO - Trial 13 finished with value: 0.017842892783859168 and parameters: {'n_layers': 2, 'embedding_dim': 96, 'lr': 0.010585717671060228, 'lambda_val': 0.0003024109260502678, 'batch_size': 1296, 'optimizer': 'Adam'}. Best is trial 4 with value: 0.03758379179434917.
2026-05-10 07:49:08,444 - optuna.study.study - INFO - Trial 14 finished with value: 0.02585287083887635 and parameters: {'n_layers': 1, 'embedding_dim': 96, 'lr': 0.004345807257653386, 'lambda_val': 0.000397008614487994, 'batch_size': 1333, 'optimizer': 'Adam'}. Best is trial 4 with value: 0.03758379179434917.
2026-05-10 07:49:58,525 - optuna.study.study - INFO - Trial 15 finished with value: 0.012140191816894528 and parameters: {'n_layers': 2, 'embedding_dim': 32, 'lr': 0.0005647607617212918, 'lambda_val': 0.00016664970739495337, 'batch_size': 2838, 'optimizer': 'RMSprop'}. Best is trial 4 with value: 0.03758379179434917.
2026-05-10 07:49:59,763 - optuna.study._optimize - INFO - Trial 16 pruned. 
2026-05-10 07:50:47,581 - optuna.study.study - INFO - Trial 17 finished with value: 0.024005955302071103 and parameters: {'n_layers': 1, 'embedding_dim': 96, 'lr': 0.003815726070582102, 'lambda_val': 0.0007233356466485793, 'batch_size': 4081, 'optimizer': 'RMSprop'}. Best is trial 4 with value: 0.03758379179434917.
2026-05-10 07:50:50,301 - optuna.study._optimize - INFO - Trial 18 pruned. 
2026-05-10 07:50:52,650 - optuna.study._optimize - INFO - Trial 19 pruned. 
2026-05-10 07:50:53,922 - optuna.study._optimize - INFO - Trial 20 pruned. 
2026-05-10 07:51:42,159 - optuna.study.study - INFO - Trial 21 finished with value: 0.024401830931427625 and parameters: {'n_layers': 1, 'embedding_dim': 96, 'lr': 0.0031815272594627768, 'lambda_val': 0.0007044928755873469, 'batch_size': 4077, 'optimizer': 'RMSprop'}. Best is trial 4 with value: 0.03758379179434917.
2026-05-10 07:52:29,955 - optuna.study.study - INFO - Trial 22 finished with value: 0.023463213727189586 and parameters: {'n_layers': 1, 'embedding_dim': 96, 'lr': 0.004110410171109713, 'lambda_val': 0.00011228859497336248, 'batch_size': 3630, 'optimizer': 'RMSprop'}. Best is trial 4 with value: 0.03758379179434917.
2026-05-10 07:52:31,321 - optuna.study._optimize - INFO - Trial 23 pruned. 
2026-05-10 07:52:35,005 - optuna.study._optimize - INFO - Trial 24 pruned. 
2026-05-10 07:52:36,240 - optuna.study._optimize - INFO - Trial 25 pruned. 
2026-05-10 07:53:38,204 - optuna.study.study - INFO - Trial 26 finished with value: 0.013507542491188868 and parameters: {'n_layers': 2, 'embedding_dim': 128, 'lr': 0.0002357944637286899, 'lambda_val': 1.9716024056638692e-05, 'batch_size': 2634, 'optimizer': 'RMSprop'}. Best is trial 4 with value: 0.03758379179434917.
2026-05-10 07:53:39,426 - optuna.study._optimize - INFO - Trial 27 pruned. 
2026-05-10 07:53:42,200 - optuna.study._optimize - INFO - Trial 28 pruned. 
2026-05-10 07:53:43,479 - optuna.study._optimize - INFO - Trial 29 pruned. 
2026-05-10 07:53:44,802 - optuna.study._optimize - INFO - Trial 30 pruned. 
2026-05-10 07:53:46,097 - optuna.study._optimize - INFO - Trial 31 pruned. 
2026-05-10 07:53:48,449 - optuna.study._optimize - INFO - Trial 32 pruned. 
2026-05-10 07:53:49,817 - optuna.study._optimize - INFO - Trial 33 pruned. 
2026-05-10 07:53:51,286 - optuna.study._optimize - INFO - Trial 34 pruned. 
2026-05-10 07:53:53,638 - optuna.study._optimize - INFO - Trial 35 pruned. 
2026-05-10 07:53:57,378 - optuna.study._optimize - INFO - Trial 36 pruned. 
2026-05-10 07:53:58,701 - optuna.study._optimize - INFO - Trial 37 pruned. 
2026-05-10 07:54:01,152 - optuna.study._optimize - INFO - Trial 38 pruned. 
2026-05-10 07:55:00,049 - optuna.study.study - INFO - Trial 39 finished with value: 0.00920226015306314 and parameters: {'n_layers': 3, 'embedding_dim': 96, 'lr': 0.00028970306447531304, 'lambda_val': 6.113016216582778e-05, 'batch_size': 3910, 'optimizer': 'RMSprop'}. Best is trial 4 with value: 0.03758379179434917.
2026-05-10 07:55:02,413 - optuna.study._optimize - INFO - Trial 40 pruned. 
2026-05-10 07:55:50,854 - optuna.study.study - INFO - Trial 41 finished with value: 0.02156035802057037 and parameters: {'n_layers': 1, 'embedding_dim': 96, 'lr': 0.004436489612594604, 'lambda_val': 0.00010693555812027415, 'batch_size': 3636, 'optimizer': 'RMSprop'}. Best is trial 4 with value: 0.03758379179434917.
2026-05-10 07:55:55,177 - optuna.study._optimize - INFO - Trial 42 pruned. 
2026-05-10 07:56:43,981 - optuna.study.study - INFO - Trial 43 finished with value: 0.022946970492528328 and parameters: {'n_layers': 1, 'embedding_dim': 96, 'lr': 0.004157663609616683, 'lambda_val': 0.0005014230449396498, 'batch_size': 4092, 'optimizer': 'RMSprop'}. Best is trial 4 with value: 0.03758379179434917.
2026-05-10 07:56:46,178 - optuna.study._optimize - INFO - Trial 44 pruned. 
2026-05-10 07:56:48,420 - optuna.study._optimize - INFO - Trial 45 pruned. 
2026-05-10 07:56:51,040 - optuna.study._optimize - INFO - Trial 46 pruned. 
2026-05-10 07:56:52,285 - optuna.study._optimize - INFO - Trial 47 pruned. 
2026-05-10 07:56:54,539 - optuna.study._optimize - INFO - Trial 48 pruned. 
2026-05-10 07:56:55,829 - optuna.study._optimize - INFO - Trial 49 pruned. 
2026-05-10 07:56:57,175 - optuna.study._optimize - INFO - Trial 50 pruned. 
2026-05-10 07:57:01,258 - optuna.study._optimize - INFO - Trial 51 pruned. 
2026-05-10 07:57:02,727 - optuna.study._optimize - INFO - Trial 52 pruned. 
2026-05-10 07:57:05,012 - optuna.study._optimize - INFO - Trial 53 pruned. 
2026-05-10 07:57:54,936 - optuna.study.study - INFO - Trial 54 finished with value: 0.02542988375254046 and parameters: {'n_layers': 1, 'embedding_dim': 96, 'lr': 0.0033691143472524493, 'lambda_val': 0.0008911695404338168, 'batch_size': 3800, 'optimizer': 'RMSprop'}. Best is trial 4 with value: 0.03758379179434917.
2026-05-10 07:57:57,184 - optuna.study._optimize - INFO - Trial 55 pruned. 
2026-05-10 07:57:59,481 - optuna.study._optimize - INFO - Trial 56 pruned. 
2026-05-10 07:58:01,158 - optuna.study._optimize - INFO - Trial 57 pruned. 
2026-05-10 07:58:03,401 - optuna.study._optimize - INFO - Trial 58 pruned. 
