2026-05-10 09:02:36,639 - optuna.study.study - INFO - Trial 52 finished with value: 0.017530586438712845 and parameters: {'n_layers': 4, 'embedding_dim': 32, 'lr': 0.000974898739631935, 'lambda_val': 1.0868027353731476e-06, 'batch_size': 862, 'optimizer': 'Adam'}. Best is trial 4 with value: 0.07926662377529249.
2026-05-10 09:02:37,866 - optuna.study._optimize - INFO - Trial 53 pruned. 
2026-05-10 09:02:39,484 - optuna.study._optimize - INFO - Trial 54 pruned. 
2026-05-10 09:02:42,598 - optuna.study._optimize - INFO - Trial 55 pruned. 
2026-05-10 09:02:43,894 - optuna.study._optimize - INFO - Trial 56 pruned. 
2026-05-10 09:02:45,234 - optuna.study._optimize - INFO - Trial 57 pruned. 
2026-05-10 09:02:46,640 - optuna.study._optimize - INFO - Trial 58 pruned. 
2026-05-10 09:02:47,955 - optuna.study._optimize - INFO - Trial 59 pruned. 
2026-05-10 09:02:49,493 - optuna.study._optimize - INFO - Trial 60 pruned. 
2026-05-10 09:02:50,964 - optuna.study._optimize - INFO - Trial 61 pruned. 
2026-05-10 09:02:52,490 - optuna.study._optimize - INFO - Trial 62 pruned. 
2026-05-10 09:02:53,981 - optuna.study._optimize - INFO - Trial 63 pruned. 
2026-05-10 09:02:56,002 - optuna.study._optimize - INFO - Trial 64 pruned. 
2026-05-10 09:02:57,730 - optuna.study._optimize - INFO - Trial 65 pruned. 
2026-05-10 09:02:59,136 - optuna.study._optimize - INFO - Trial 66 pruned. 
2026-05-10 09:03:00,432 - optuna.study._optimize - INFO - Trial 67 pruned. 
2026-05-10 09:03:01,744 - optuna.study._optimize - INFO - Trial 68 pruned. 
2026-05-10 09:03:03,134 - optuna.study._optimize - INFO - Trial 69 pruned. 
2026-05-10 09:03:04,584 - optuna.study._optimize - INFO - Trial 70 pruned. 
2026-05-10 09:03:07,337 - optuna.study._optimize - INFO - Trial 71 pruned. 
2026-05-10 09:03:08,752 - optuna.study._optimize - INFO - Trial 72 pruned. 
2026-05-10 09:03:10,510 - optuna.study._optimize - INFO - Trial 73 pruned. 
2026-05-10 09:03:11,937 - optuna.study._optimize - INFO - Trial 74 pruned. 
2026-05-10 09:03:13,346 - optuna.study._optimize - INFO - Trial 75 pruned. 
2026-05-10 09:03:14,836 - optuna.study._optimize - INFO - Trial 76 pruned. 
2026-05-10 09:03:16,416 - optuna.study._optimize - INFO - Trial 77 pruned. 
2026-05-10 09:03:17,853 - optuna.study._optimize - INFO - Trial 78 pruned. 
2026-05-10 09:03:19,105 - optuna.study._optimize - INFO - Trial 79 pruned. 
2026-05-10 09:03:20,434 - optuna.study._optimize - INFO - Trial 80 pruned. 
2026-05-10 09:03:22,697 - optuna.study._optimize - INFO - Trial 81 pruned. 
2026-05-10 09:03:25,435 - optuna.study._optimize - INFO - Trial 82 pruned. 
2026-05-10 09:03:26,985 - optuna.study._optimize - INFO - Trial 83 pruned. 
2026-05-10 09:03:28,389 - optuna.study._optimize - INFO - Trial 84 pruned. 
2026-05-10 09:03:29,783 - optuna.study._optimize - INFO - Trial 85 pruned. 
2026-05-10 09:03:31,198 - optuna.study._optimize - INFO - Trial 86 pruned. 
2026-05-10 09:04:35,604 - optuna.study.study - INFO - Trial 87 finished with value: 0.046189457894257685 and parameters: {'n_layers': 1, 'embedding_dim': 256, 'lr': 0.003992440771423103, 'lambda_val': 2.573309885435408e-05, 'batch_size': 2621, 'optimizer': 'Adam'}. Best is trial 4 with value: 0.07926662377529249.
2026-05-10 09:04:36,965 - optuna.study._optimize - INFO - Trial 88 pruned. 
2026-05-10 09:04:38,305 - optuna.study._optimize - INFO - Trial 89 pruned. 
2026-05-10 09:04:39,601 - optuna.study._optimize - INFO - Trial 90 pruned. 
2026-05-10 09:04:40,819 - optuna.study._optimize - INFO - Trial 91 pruned. 
2026-05-10 09:04:42,094 - optuna.study._optimize - INFO - Trial 92 pruned. 
2026-05-10 09:04:43,378 - optuna.study._optimize - INFO - Trial 93 pruned. 
2026-05-10 09:04:45,170 - optuna.study._optimize - INFO - Trial 94 pruned. 
2026-05-10 09:04:47,522 - optuna.study._optimize - INFO - Trial 95 pruned. 
2026-05-10 09:04:48,904 - optuna.study._optimize - INFO - Trial 96 pruned. 
2026-05-10 09:04:50,397 - optuna.study._optimize - INFO - Trial 97 pruned. 
2026-05-10 09:04:51,823 - optuna.study._optimize - INFO - Trial 98 pruned. 
2026-05-10 09:04:54,560 - optuna.study._optimize - INFO - Trial 99 pruned. 
2026-05-10 09:05:43,875 - root - INFO -   **** Training e_1M_1c3dcs_rand1
2026-05-10 09:05:43,938 - root - INFO -   **** Getting 212879/669182 random edges
2026-05-10 09:05:44,093 - optuna.storages._rdb.storage - INFO - A new study created in RDB with name: Study_e_1M_1c3dcs_rand1
2026-05-10 09:06:51,866 - optuna.study.study - INFO - Trial 0 finished with value: 0.009521001877639901 and parameters: {'n_layers': 4, 'embedding_dim': 96, 'lr': 9.442365072677474e-05, 'lambda_val': 0.0005534274185584176, 'batch_size': 2852, 'optimizer': 'Adam'}. Best is trial 0 with value: 0.009521001877639901.
2026-05-10 09:07:59,704 - optuna.study.study - INFO - Trial 1 finished with value: 0.006311502551122184 and parameters: {'n_layers': 4, 'embedding_dim': 96, 'lr': 0.0001533188306350413, 'lambda_val': 0.0214456738263406, 'batch_size': 2515, 'optimizer': 'Adam'}. Best is trial 0 with value: 0.009521001877639901.
2026-05-10 09:09:08,149 - optuna.study.study - INFO - Trial 2 finished with value: 0.01174665577244706 and parameters: {'n_layers': 4, 'embedding_dim': 96, 'lr': 0.0005834533853111522, 'lambda_val': 4.4941771357266454e-05, 'batch_size': 3761, 'optimizer': 'Adam'}. Best is trial 2 with value: 0.01174665577244706.
2026-05-10 09:09:56,017 - optuna.study.study - INFO - Trial 3 finished with value: 0.004547750442665112 and parameters: {'n_layers': 3, 'embedding_dim': 32, 'lr': 0.000390018318979784, 'lambda_val': 0.0043971616171201615, 'batch_size': 2031, 'optimizer': 'SGD'}. Best is trial 2 with value: 0.01174665577244706.
2026-05-10 09:10:49,766 - optuna.study.study - INFO - Trial 4 finished with value: 0.005177595000111967 and parameters: {'n_layers': 4, 'embedding_dim': 32, 'lr': 3.3042265993741166e-05, 'lambda_val': 0.03583846607794838, 'batch_size': 2349, 'optimizer': 'SGD'}. Best is trial 2 with value: 0.01174665577244706.
2026-05-10 09:10:53,381 - optuna.study._optimize - INFO - Trial 5 pruned. 
2026-05-10 09:10:54,656 - optuna.study._optimize - INFO - Trial 6 pruned. 
2026-05-10 09:11:59,939 - optuna.study.study - INFO - Trial 7 finished with value: 0.019775550451122503 and parameters: {'n_layers': 3, 'embedding_dim': 128, 'lr': 0.034604994200570706, 'lambda_val': 0.0003217715385586484, 'batch_size': 1452, 'optimizer': 'RMSprop'}. Best is trial 7 with value: 0.019775550451122503.
2026-05-10 09:12:02,145 - optuna.study._optimize - INFO - Trial 8 pruned. 
2026-05-10 09:12:03,518 - optuna.study._optimize - INFO - Trial 9 pruned. 
2026-05-10 09:12:07,677 - optuna.study._optimize - INFO - Trial 10 pruned. 
2026-05-10 09:13:35,424 - optuna.study.study - INFO - Trial 11 finished with value: 0.0221635042669418 and parameters: {'n_layers': 3, 'embedding_dim': 256, 'lr': 0.006310050762227252, 'lambda_val': 3.2727112313408235e-05, 'batch_size': 1580, 'optimizer': 'RMSprop'}. Best is trial 11 with value: 0.0221635042669418.
2026-05-10 09:15:02,689 - optuna.study.study - INFO - Trial 12 finished with value: 0.02074588241009019 and parameters: {'n_layers': 3, 'embedding_dim': 256, 'lr': 0.007351139282916851, 'lambda_val': 2.410842571233987e-05, 'batch_size': 1676, 'optimizer': 'RMSprop'}. Best is trial 11 with value: 0.0221635042669418.
2026-05-10 09:16:30,973 - optuna.study.study - INFO - Trial 13 finished with value: 0.024284379117105 and parameters: {'n_layers': 3, 'embedding_dim': 256, 'lr': 0.00466091304818241, 'lambda_val': 9.124854177401622e-06, 'batch_size': 1694, 'optimizer': 'RMSprop'}. Best is trial 13 with value: 0.024284379117105.
2026-05-10 09:16:36,494 - optuna.study._optimize - INFO - Trial 14 pruned. 
2026-05-10 09:18:06,151 - optuna.study.study - INFO - Trial 15 finished with value: 0.01553359155867281 and parameters: {'n_layers': 3, 'embedding_dim': 256, 'lr': 0.011246687369543368, 'lambda_val': 9.278869007006227e-06, 'batch_size': 1863, 'optimizer': 'RMSprop'}. Best is trial 13 with value: 0.024284379117105.
2026-05-10 09:18:07,423 - optuna.study._optimize - INFO - Trial 16 pruned. 
2026-05-10 09:18:08,752 - optuna.study._optimize - INFO - Trial 17 pruned. 
2026-05-10 09:18:10,104 - optuna.study._optimize - INFO - Trial 18 pruned. 
2026-05-10 09:18:15,937 - optuna.study._optimize - INFO - Trial 19 pruned. 
2026-05-10 09:18:18,985 - optuna.study._optimize - INFO - Trial 20 pruned. 
2026-05-10 09:19:47,038 - optuna.study.study - INFO - Trial 21 finished with value: 0.019170534954707594 and parameters: {'n_layers': 3, 'embedding_dim': 256, 'lr': 0.008525322627109077, 'lambda_val': 2.9395171160607737e-05, 'batch_size': 1655, 'optimizer': 'RMSprop'}. Best is trial 13 with value: 0.024284379117105.
2026-05-10 09:19:50,118 - optuna.study._optimize - INFO - Trial 22 pruned. 
2026-05-10 09:19:51,414 - optuna.study._optimize - INFO - Trial 23 pruned. 
2026-05-10 09:21:04,595 - optuna.study.study - INFO - Trial 24 finished with value: 0.015973019684144718 and parameters: {'n_layers': 2, 'embedding_dim': 256, 'lr': 0.012184502926982846, 'lambda_val': 2.132736979029833e-05, 'batch_size': 2007, 'optimizer': 'RMSprop'}. Best is trial 13 with value: 0.024284379117105.
2026-05-10 09:21:07,144 - optuna.study._optimize - INFO - Trial 25 pruned. 
2026-05-10 09:22:50,792 - optuna.study.study - INFO - Trial 26 finished with value: 0.02102828898255854 and parameters: {'n_layers': 4, 'embedding_dim': 256, 'lr': 0.007354045950180639, 'lambda_val': 2.0140214707573566e-06, 'batch_size': 2228, 'optimizer': 'RMSprop'}. Best is trial 13 with value: 0.024284379117105.
2026-05-10 09:22:52,041 - optuna.study._optimize - INFO - Trial 27 pruned. 
2026-05-10 09:22:53,470 - optuna.study._optimize - INFO - Trial 28 pruned. 
2026-05-10 09:22:54,943 - optuna.study._optimize - INFO - Trial 29 pruned. 
2026-05-10 09:22:56,516 - optuna.study._optimize - INFO - Trial 30 pruned. 
2026-05-10 09:22:57,988 - optuna.study._optimize - INFO - Trial 31 pruned. 
2026-05-10 09:23:05,447 - optuna.study._optimize - INFO - Trial 32 pruned. 
2026-05-10 09:23:06,731 - optuna.study._optimize - INFO - Trial 33 pruned. 
2026-05-10 09:24:50,253 - optuna.study.study - INFO - Trial 34 finished with value: 0.018703845289872546 and parameters: {'n_layers': 4, 'embedding_dim': 256, 'lr': 0.015162726195214063, 'lambda_val': 4.867078231399273e-05, 'batch_size': 955, 'optimizer': 'RMSprop'}. Best is trial 13 with value: 0.024284379117105.
2026-05-10 09:24:51,636 - optuna.study._optimize - INFO - Trial 35 pruned. 
2026-05-10 09:24:52,877 - optuna.study._optimize - INFO - Trial 36 pruned. 
2026-05-10 09:24:54,239 - optuna.study._optimize - INFO - Trial 37 pruned. 
2026-05-10 09:24:55,546 - optuna.study._optimize - INFO - Trial 38 pruned. 
2026-05-10 09:24:56,886 - optuna.study._optimize - INFO - Trial 39 pruned. 
2026-05-10 09:24:58,280 - optuna.study._optimize - INFO - Trial 40 pruned. 
2026-05-10 09:25:01,304 - optuna.study._optimize - INFO - Trial 41 pruned. 
2026-05-10 09:25:04,529 - optuna.study._optimize - INFO - Trial 42 pruned. 
2026-05-10 09:25:07,753 - optuna.study._optimize - INFO - Trial 43 pruned. 
2026-05-10 09:25:10,432 - optuna.study._optimize - INFO - Trial 44 pruned. 
2026-05-10 09:25:11,849 - optuna.study._optimize - INFO - Trial 45 pruned. 
2026-05-10 09:25:13,131 - optuna.study._optimize - INFO - Trial 46 pruned. 
2026-05-10 09:25:14,535 - optuna.study._optimize - INFO - Trial 47 pruned. 
2026-05-10 09:25:15,907 - optuna.study._optimize - INFO - Trial 48 pruned. 
2026-05-10 09:25:17,123 - optuna.study._optimize - INFO - Trial 49 pruned. 
2026-05-10 09:25:18,870 - optuna.study._optimize - INFO - Trial 50 pruned. 
2026-05-10 09:25:20,297 - optuna.study._optimize - INFO - Trial 51 pruned. 
2026-05-10 09:25:25,468 - optuna.study._optimize - INFO - Trial 52 pruned. 
2026-05-10 09:25:26,762 - optuna.study._optimize - INFO - Trial 53 pruned. 
2026-05-10 09:25:28,259 - optuna.study._optimize - INFO - Trial 54 pruned. 
2026-05-10 09:25:31,402 - optuna.study._optimize - INFO - Trial 55 pruned. 
2026-05-10 09:25:32,868 - optuna.study._optimize - INFO - Trial 56 pruned. 
2026-05-10 09:25:34,194 - optuna.study._optimize - INFO - Trial 57 pruned. 
2026-05-10 09:25:35,566 - optuna.study._optimize - INFO - Trial 58 pruned. 
2026-05-10 09:25:38,378 - optuna.study._optimize - INFO - Trial 59 pruned. 
2026-05-10 09:25:39,697 - optuna.study._optimize - INFO - Trial 60 pruned. 
2026-05-10 09:27:21,149 - optuna.study.study - INFO - Trial 61 finished with value: 0.021245671546685056 and parameters: {'n_layers': 4, 'embedding_dim': 256, 'lr': 0.014159190683437031, 'lambda_val': 4.890068288288186e-05, 'batch_size': 828, 'optimizer': 'RMSprop'}. Best is trial 13 with value: 0.024284379117105.
2026-05-10 09:27:22,949 - optuna.study._optimize - INFO - Trial 62 pruned. 
2026-05-10 09:27:28,872 - optuna.study._optimize - INFO - Trial 63 pruned. 
2026-05-10 09:27:32,160 - optuna.study._optimize - INFO - Trial 64 pruned. 
2026-05-10 09:29:15,718 - optuna.study.study - INFO - Trial 65 finished with value: 0.018955840163651223 and parameters: {'n_layers': 4, 'embedding_dim': 256, 'lr': 0.012941012911357071, 'lambda_val': 5.4461220026090615e-05, 'batch_size': 1663, 'optimizer': 'RMSprop'}. Best is trial 13 with value: 0.024284379117105.
2026-05-10 09:29:16,962 - optuna.study._optimize - INFO - Trial 66 pruned. 
2026-05-10 09:29:18,289 - optuna.study._optimize - INFO - Trial 67 pruned. 
2026-05-10 09:29:19,605 - optuna.study._optimize - INFO - Trial 68 pruned. 
2026-05-10 09:29:23,604 - optuna.study._optimize - INFO - Trial 69 pruned. 
2026-05-10 09:29:24,932 - optuna.study._optimize - INFO - Trial 70 pruned. 
2026-05-10 09:31:08,941 - optuna.study.study - INFO - Trial 71 finished with value: 0.019011570693549428 and parameters: {'n_layers': 4, 'embedding_dim': 256, 'lr': 0.013052636750869092, 'lambda_val': 4.8354560134897515e-05, 'batch_size': 1662, 'optimizer': 'RMSprop'}. Best is trial 13 with value: 0.024284379117105.
2026-05-10 09:31:12,204 - optuna.study._optimize - INFO - Trial 72 pruned. 
2026-05-10 09:31:15,524 - optuna.study._optimize - INFO - Trial 73 pruned. 
2026-05-10 09:31:19,398 - optuna.study._optimize - INFO - Trial 74 pruned. 
2026-05-10 09:31:23,942 - optuna.study._optimize - INFO - Trial 75 pruned. 
2026-05-10 09:33:12,542 - optuna.study.study - INFO - Trial 76 finished with value: 0.016513266003072943 and parameters: {'n_layers': 4, 'embedding_dim': 256, 'lr': 0.014972850962088153, 'lambda_val': 1.3616338205275165e-05, 'batch_size': 2456, 'optimizer': 'RMSprop'}. Best is trial 13 with value: 0.024284379117105.
2026-05-10 09:33:13,889 - optuna.study._optimize - INFO - Trial 77 pruned. 
2026-05-10 09:33:15,625 - optuna.study._optimize - INFO - Trial 78 pruned. 
2026-05-10 09:33:18,979 - optuna.study._optimize - INFO - Trial 79 pruned. 
2026-05-10 09:33:20,206 - optuna.study._optimize - INFO - Trial 80 pruned. 
2026-05-10 09:35:03,385 - optuna.study.study - INFO - Trial 81 finished with value: 0.018706627021464632 and parameters: {'n_layers': 4, 'embedding_dim': 256, 'lr': 0.01283990649989674, 'lambda_val': 2.9306245727595176e-05, 'batch_size': 1710, 'optimizer': 'RMSprop'}. Best is trial 13 with value: 0.024284379117105.
2026-05-10 09:35:08,812 - optuna.study._optimize - INFO - Trial 82 pruned. 
2026-05-10 09:35:10,062 - optuna.study._optimize - INFO - Trial 83 pruned. 
2026-05-10 09:35:13,472 - optuna.study._optimize - INFO - Trial 84 pruned. 
2026-05-10 09:35:16,516 - optuna.study._optimize - INFO - Trial 85 pruned. 
2026-05-10 09:35:17,832 - optuna.study._optimize - INFO - Trial 86 pruned. 
2026-05-10 09:35:22,649 - optuna.study._optimize - INFO - Trial 87 pruned. 
2026-05-10 09:35:25,948 - optuna.study._optimize - INFO - Trial 88 pruned. 
2026-05-10 09:35:29,025 - optuna.study._optimize - INFO - Trial 89 pruned. 
2026-05-10 09:35:31,317 - optuna.study._optimize - INFO - Trial 90 pruned. 
2026-05-10 09:37:13,557 - optuna.study.study - INFO - Trial 91 finished with value: 0.0182258480084422 and parameters: {'n_layers': 4, 'embedding_dim': 256, 'lr': 0.013519626587904269, 'lambda_val': 4.599497224882072e-05, 'batch_size': 1727, 'optimizer': 'RMSprop'}. Best is trial 13 with value: 0.024284379117105.
2026-05-10 09:37:17,273 - optuna.study._optimize - INFO - Trial 92 pruned. 
2026-05-10 09:37:18,755 - optuna.study._optimize - INFO - Trial 93 pruned. 
2026-05-10 09:37:22,125 - optuna.study._optimize - INFO - Trial 94 pruned. 
2026-05-10 09:37:23,430 - optuna.study._optimize - INFO - Trial 95 pruned. 
2026-05-10 09:37:24,801 - optuna.study._optimize - INFO - Trial 96 pruned. 
2026-05-10 09:37:27,447 - optuna.study._optimize - INFO - Trial 97 pruned. 
2026-05-10 09:37:29,972 - optuna.study._optimize - INFO - Trial 98 pruned. 
2026-05-10 09:37:31,255 - optuna.study._optimize - INFO - Trial 99 pruned. 
2026-05-10 09:38:53,141 - root - INFO -   **** Training e_1M_1c3dcs_rand2
2026-05-10 09:38:53,205 - root - INFO -   **** Getting 212879/669182 random edges
2026-05-10 09:38:53,531 - optuna.storages._rdb.storage - INFO - A new study created in RDB with name: Study_e_1M_1c3dcs_rand2
2026-05-10 09:39:42,099 - optuna.study.study - INFO - Trial 0 finished with value: 0.005152303487073069 and parameters: {'n_layers': 1, 'embedding_dim': 128, 'lr': 0.023086562618797914, 'lambda_val': 7.569586743489216e-06, 'batch_size': 2861, 'optimizer': 'SGD'}. Best is trial 0 with value: 0.005152303487073069.
2026-05-10 09:40:43,873 - optuna.study.study - INFO - Trial 1 finished with value: 0.026779450876579392 and parameters: {'n_layers': 3, 'embedding_dim': 96, 'lr': 0.002937779167819419, 'lambda_val': 0.0008096543331430669, 'batch_size': 3844, 'optimizer': 'RMSprop'}. Best is trial 1 with value: 0.026779450876579392.
2026-05-10 09:41:31,961 - optuna.study.study - INFO - Trial 2 finished with value: 0.005161304375524832 and parameters: {'n_layers': 3, 'embedding_dim': 32, 'lr': 0.001025841181577953, 'lambda_val': 2.430954949193568e-05, 'batch_size': 1123, 'optimizer': 'SGD'}. Best is trial 1 with value: 0.026779450876579392.
2026-05-10 09:42:24,362 - optuna.study.study - INFO - Trial 3 finished with value: 0.0076112566955448295 and parameters: {'n_layers': 2, 'embedding_dim': 96, 'lr': 1.4639253348767736e-05, 'lambda_val': 1.591889654396501e-06, 'batch_size': 2238, 'optimizer': 'Adam'}. Best is trial 1 with value: 0.026779450876579392.
2026-05-10 09:43:23,721 - optuna.study.study - INFO - Trial 4 finished with value: 0.004921291251126241 and parameters: {'n_layers': 3, 'embedding_dim': 96, 'lr': 0.0020630261965184564, 'lambda_val': 0.024233847674172942, 'batch_size': 2320, 'optimizer': 'SGD'}. Best is trial 1 with value: 0.026779450876579392.
2026-05-10 09:43:26,395 - optuna.study._optimize - INFO - Trial 5 pruned. 
2026-05-10 09:44:32,940 - optuna.study.study - INFO - Trial 6 finished with value: 0.008385778585995193 and parameters: {'n_layers': 3, 'embedding_dim': 128, 'lr': 7.894404614113653e-05, 'lambda_val': 0.026458401154977045, 'batch_size': 3334, 'optimizer': 'RMSprop'}. Best is trial 1 with value: 0.026779450876579392.
2026-05-10 09:45:19,534 - optuna.study.study - INFO - Trial 7 finished with value: 0.03432859317597454 and parameters: {'n_layers': 1, 'embedding_dim': 64, 'lr': 0.025958608348950255, 'lambda_val': 0.010024258625633956, 'batch_size': 1442, 'optimizer': 'RMSprop'}. Best is trial 7 with value: 0.03432859317597454.
2026-05-10 09:45:20,857 - optuna.study._optimize - INFO - Trial 8 pruned. 
2026-05-10 09:46:10,472 - optuna.study.study - INFO - Trial 9 finished with value: 0.008913153633092058 and parameters: {'n_layers': 3, 'embedding_dim': 32, 'lr': 0.0005160142955146718, 'lambda_val': 0.00017646675410571612, 'batch_size': 1812, 'optimizer': 'Adam'}. Best is trial 7 with value: 0.03432859317597454.
2026-05-10 09:46:56,635 - optuna.study.study - INFO - Trial 10 finished with value: 0.02491271545487102 and parameters: {'n_layers': 1, 'embedding_dim': 64, 'lr': 0.08834380834600403, 'lambda_val': 0.00186647123244254, 'batch_size': 1436, 'optimizer': 'RMSprop'}. Best is trial 7 with value: 0.03432859317597454.
2026-05-10 09:47:57,596 - optuna.study.study - INFO - Trial 11 finished with value: 0.024453232161521437 and parameters: {'n_layers': 4, 'embedding_dim': 64, 'lr': 0.007958935103656882, 'lambda_val': 0.0019093623682530634, 'batch_size': 3918, 'optimizer': 'RMSprop'}. Best is trial 7 with value: 0.03432859317597454.
2026-05-10 09:48:54,082 - optuna.study.study - INFO - Trial 12 finished with value: 0.03168249814168204 and parameters: {'n_layers': 2, 'embedding_dim': 96, 'lr': 0.005797914073177521, 'lambda_val': 0.0027508118858195663, 'batch_size': 3781, 'optimizer': 'RMSprop'}. Best is trial 7 with value: 0.03432859317597454.
2026-05-10 09:49:53,906 - optuna.study.study - INFO - Trial 13 finished with value: 0.03701360689243537 and parameters: {'n_layers': 1, 'embedding_dim': 256, 'lr': 0.021985970300332947, 'lambda_val': 0.005434706275695073, 'batch_size': 815, 'optimizer': 'RMSprop'}. Best is trial 13 with value: 0.03701360689243537.
2026-05-10 09:49:56,294 - optuna.study._optimize - INFO - Trial 14 pruned. 
2026-05-10 09:49:57,588 - optuna.study._optimize - INFO - Trial 15 pruned. 
2026-05-10 09:50:03,330 - optuna.study._optimize - INFO - Trial 16 pruned. 
2026-05-10 09:50:55,119 - optuna.study.study - INFO - Trial 17 finished with value: 0.027026946062429676 and parameters: {'n_layers': 2, 'embedding_dim': 64, 'lr': 0.03390403834467885, 'lambda_val': 0.006996124688481763, 'batch_size': 998, 'optimizer': 'RMSprop'}. Best is trial 13 with value: 0.03701360689243537.
2026-05-10 09:51:42,035 - optuna.study.study - INFO - Trial 18 finished with value: 0.02747081034842341 and parameters: {'n_layers': 1, 'embedding_dim': 64, 'lr': 0.004187509743529438, 'lambda_val': 0.0006712538936604591, 'batch_size': 1985, 'optimizer': 'RMSprop'}. Best is trial 13 with value: 0.03701360689243537.
2026-05-10 09:51:44,016 - optuna.study._optimize - INFO - Trial 19 pruned. 
