2026-05-10 03:54:54,843 - optuna.study.study - INFO - Trial 24 finished with value: 0.006282920325525826 and parameters: {'n_layers': 4, 'embedding_dim': 96, 'lr': 0.00022900416031753303, 'lambda_val': 0.00010741808289899909, 'batch_size': 3306, 'optimizer': 'RMSprop'}. Best is trial 2 with value: 0.03205646854175209.
2026-05-10 03:54:56,367 - optuna.study._optimize - INFO - Trial 25 pruned. 
2026-05-10 03:54:58,825 - optuna.study._optimize - INFO - Trial 26 pruned. 
2026-05-10 03:55:00,193 - optuna.study._optimize - INFO - Trial 27 pruned. 
2026-05-10 03:55:01,745 - optuna.study._optimize - INFO - Trial 28 pruned. 
2026-05-10 03:55:03,409 - optuna.study._optimize - INFO - Trial 29 pruned. 
2026-05-10 03:55:04,901 - optuna.study._optimize - INFO - Trial 30 pruned. 
2026-05-10 03:55:56,077 - optuna.study.study - INFO - Trial 31 finished with value: 0.019467055219019563 and parameters: {'n_layers': 2, 'embedding_dim': 64, 'lr': 0.005866394397069521, 'lambda_val': 0.0005520928978432217, 'batch_size': 3149, 'optimizer': 'RMSprop'}. Best is trial 2 with value: 0.03205646854175209.
2026-05-10 03:56:02,330 - optuna.study._optimize - INFO - Trial 32 pruned. 
2026-05-10 03:56:51,404 - optuna.study.study - INFO - Trial 33 finished with value: 0.020589374605608775 and parameters: {'n_layers': 2, 'embedding_dim': 64, 'lr': 0.005268987983410388, 'lambda_val': 0.000640074963830696, 'batch_size': 2881, 'optimizer': 'RMSprop'}. Best is trial 2 with value: 0.03205646854175209.
2026-05-10 03:56:53,005 - optuna.study._optimize - INFO - Trial 34 pruned. 
2026-05-10 03:56:54,774 - optuna.study._optimize - INFO - Trial 35 pruned. 
2026-05-10 03:58:02,848 - optuna.study.study - INFO - Trial 36 finished with value: 0.01761427707554651 and parameters: {'n_layers': 2, 'embedding_dim': 256, 'lr': 0.008418103714438758, 'lambda_val': 0.00011479801831699184, 'batch_size': 2260, 'optimizer': 'RMSprop'}. Best is trial 2 with value: 0.03205646854175209.
2026-05-10 03:58:04,183 - optuna.study._optimize - INFO - Trial 37 pruned. 
2026-05-10 03:58:05,765 - optuna.study._optimize - INFO - Trial 38 pruned. 
2026-05-10 03:58:08,611 - optuna.study._optimize - INFO - Trial 39 pruned. 
2026-05-10 03:58:10,114 - optuna.study._optimize - INFO - Trial 40 pruned. 
2026-05-10 03:58:59,233 - optuna.study.study - INFO - Trial 41 finished with value: 0.018401269872831007 and parameters: {'n_layers': 2, 'embedding_dim': 64, 'lr': 0.0068636785221807065, 'lambda_val': 0.00046299172473139854, 'batch_size': 2886, 'optimizer': 'RMSprop'}. Best is trial 2 with value: 0.03205646854175209.
2026-05-10 03:59:00,879 - optuna.study._optimize - INFO - Trial 42 pruned. 
2026-05-10 03:59:02,221 - optuna.study._optimize - INFO - Trial 43 pruned. 
2026-05-10 03:59:03,504 - optuna.study._optimize - INFO - Trial 44 pruned. 
2026-05-10 04:00:12,856 - optuna.study.study - INFO - Trial 45 finished with value: 0.027326947262088494 and parameters: {'n_layers': 2, 'embedding_dim': 256, 'lr': 0.0004824109697359365, 'lambda_val': 8.525697739261783e-05, 'batch_size': 2577, 'optimizer': 'RMSprop'}. Best is trial 2 with value: 0.03205646854175209.
2026-05-10 04:00:14,303 - optuna.study._optimize - INFO - Trial 46 pruned. 
2026-05-10 04:00:15,563 - optuna.study._optimize - INFO - Trial 47 pruned. 
2026-05-10 04:00:17,100 - optuna.study._optimize - INFO - Trial 48 pruned. 
2026-05-10 04:00:18,438 - optuna.study._optimize - INFO - Trial 49 pruned. 
2026-05-10 04:00:19,687 - optuna.study._optimize - INFO - Trial 50 pruned. 
2026-05-10 04:00:22,102 - optuna.study._optimize - INFO - Trial 51 pruned. 
2026-05-10 04:01:12,264 - optuna.study.study - INFO - Trial 52 finished with value: 0.01877014018482788 and parameters: {'n_layers': 2, 'embedding_dim': 64, 'lr': 0.01375970316512941, 'lambda_val': 0.0009167404267211237, 'batch_size': 2968, 'optimizer': 'RMSprop'}. Best is trial 2 with value: 0.03205646854175209.
2026-05-10 04:01:14,377 - optuna.study._optimize - INFO - Trial 53 pruned. 
2026-05-10 04:01:15,720 - optuna.study._optimize - INFO - Trial 54 pruned. 
2026-05-10 04:01:17,058 - optuna.study._optimize - INFO - Trial 55 pruned. 
2026-05-10 04:02:08,823 - optuna.study.study - INFO - Trial 56 finished with value: 0.01990260003238285 and parameters: {'n_layers': 2, 'embedding_dim': 96, 'lr': 0.009439718974992338, 'lambda_val': 0.0002640635954288402, 'batch_size': 1155, 'optimizer': 'RMSprop'}. Best is trial 2 with value: 0.03205646854175209.
2026-05-10 04:02:11,136 - optuna.study._optimize - INFO - Trial 57 pruned. 
2026-05-10 04:02:12,385 - optuna.study._optimize - INFO - Trial 58 pruned. 
2026-05-10 04:02:13,678 - optuna.study._optimize - INFO - Trial 59 pruned. 
2026-05-10 04:03:00,554 - optuna.study.study - INFO - Trial 60 finished with value: 0.019803492941939282 and parameters: {'n_layers': 1, 'embedding_dim': 96, 'lr': 0.004602663983539387, 'lambda_val': 2.5900846317229733e-05, 'batch_size': 2218, 'optimizer': 'RMSprop'}. Best is trial 2 with value: 0.03205646854175209.
2026-05-10 04:03:02,757 - optuna.study._optimize - INFO - Trial 61 pruned. 
2026-05-10 04:03:54,391 - optuna.study.study - INFO - Trial 62 finished with value: 0.020361197681538382 and parameters: {'n_layers': 2, 'embedding_dim': 96, 'lr': 0.009167409165258888, 'lambda_val': 0.000131438656099015, 'batch_size': 810, 'optimizer': 'RMSprop'}. Best is trial 2 with value: 0.03205646854175209.
2026-05-10 04:03:57,592 - optuna.study._optimize - INFO - Trial 63 pruned. 
2026-05-10 04:03:58,869 - optuna.study._optimize - INFO - Trial 64 pruned. 
2026-05-10 04:04:01,127 - optuna.study._optimize - INFO - Trial 65 pruned. 
2026-05-10 04:04:02,410 - optuna.study._optimize - INFO - Trial 66 pruned. 
2026-05-10 04:04:04,173 - optuna.study._optimize - INFO - Trial 67 pruned. 
2026-05-10 04:04:05,599 - optuna.study._optimize - INFO - Trial 68 pruned. 
2026-05-10 04:04:07,036 - optuna.study._optimize - INFO - Trial 69 pruned. 
2026-05-10 04:04:08,617 - optuna.study._optimize - INFO - Trial 70 pruned. 
2026-05-10 04:05:00,242 - optuna.study.study - INFO - Trial 71 finished with value: 0.019368853927405835 and parameters: {'n_layers': 2, 'embedding_dim': 96, 'lr': 0.010905579969880444, 'lambda_val': 0.00035997028210090604, 'batch_size': 1142, 'optimizer': 'RMSprop'}. Best is trial 2 with value: 0.03205646854175209.
2026-05-10 04:05:02,515 - optuna.study._optimize - INFO - Trial 72 pruned. 
2026-05-10 04:05:04,730 - optuna.study._optimize - INFO - Trial 73 pruned. 
2026-05-10 04:05:07,089 - optuna.study._optimize - INFO - Trial 74 pruned. 
2026-05-10 04:05:08,394 - optuna.study._optimize - INFO - Trial 75 pruned. 
2026-05-10 04:05:09,719 - optuna.study._optimize - INFO - Trial 76 pruned. 
2026-05-10 04:05:12,269 - optuna.study._optimize - INFO - Trial 77 pruned. 
2026-05-10 04:05:13,707 - optuna.study._optimize - INFO - Trial 78 pruned. 
2026-05-10 04:05:15,542 - optuna.study._optimize - INFO - Trial 79 pruned. 
2026-05-10 04:05:17,044 - optuna.study._optimize - INFO - Trial 80 pruned. 
2026-05-10 04:05:18,582 - optuna.study._optimize - INFO - Trial 81 pruned. 
2026-05-10 04:06:05,469 - optuna.study.study - INFO - Trial 82 finished with value: 0.016700158282605907 and parameters: {'n_layers': 1, 'embedding_dim': 96, 'lr': 0.008993521376794801, 'lambda_val': 2.0409010520430847e-05, 'batch_size': 2169, 'optimizer': 'RMSprop'}. Best is trial 2 with value: 0.03205646854175209.
2026-05-10 04:06:06,772 - optuna.study._optimize - INFO - Trial 83 pruned. 
2026-05-10 04:06:09,318 - optuna.study._optimize - INFO - Trial 84 pruned. 
2026-05-10 04:06:10,678 - optuna.study._optimize - INFO - Trial 85 pruned. 
2026-05-10 04:06:11,982 - optuna.study._optimize - INFO - Trial 86 pruned. 
2026-05-10 04:06:13,233 - optuna.study._optimize - INFO - Trial 87 pruned. 
2026-05-10 04:06:14,559 - optuna.study._optimize - INFO - Trial 88 pruned. 
2026-05-10 04:06:15,885 - optuna.study._optimize - INFO - Trial 89 pruned. 
2026-05-10 04:06:17,311 - optuna.study._optimize - INFO - Trial 90 pruned. 
2026-05-10 04:06:20,140 - optuna.study._optimize - INFO - Trial 91 pruned. 
2026-05-10 04:06:21,568 - optuna.study._optimize - INFO - Trial 92 pruned. 
2026-05-10 04:06:24,015 - optuna.study._optimize - INFO - Trial 93 pruned. 
2026-05-10 04:06:25,437 - optuna.study._optimize - INFO - Trial 94 pruned. 
2026-05-10 04:06:26,735 - optuna.study._optimize - INFO - Trial 95 pruned. 
2026-05-10 04:06:28,073 - optuna.study._optimize - INFO - Trial 96 pruned. 
2026-05-10 04:07:24,120 - optuna.study.study - INFO - Trial 97 finished with value: 0.01691939445226818 and parameters: {'n_layers': 2, 'embedding_dim': 128, 'lr': 0.0074582441821969625, 'lambda_val': 0.000177453703941627, 'batch_size': 2745, 'optimizer': 'RMSprop'}. Best is trial 2 with value: 0.03205646854175209.
2026-05-10 04:07:26,061 - optuna.study._optimize - INFO - Trial 98 pruned. 
2026-05-10 04:07:27,400 - optuna.study._optimize - INFO - Trial 99 pruned. 
2026-05-10 04:08:24,617 - root - INFO -   **** Training e_1M_1c1dcs_rand3
2026-05-10 04:08:24,672 - root - INFO -   **** Getting 167284/669182 random edges
2026-05-10 04:08:24,815 - optuna.storages._rdb.storage - INFO - A new study created in RDB with name: Study_e_1M_1c1dcs_rand3
2026-05-10 04:09:21,400 - optuna.study.study - INFO - Trial 0 finished with value: 0.03270814386773587 and parameters: {'n_layers': 1, 'embedding_dim': 256, 'lr': 0.0001811800290363686, 'lambda_val': 5.935017851527186e-06, 'batch_size': 1431, 'optimizer': 'Adam'}. Best is trial 0 with value: 0.03270814386773587.
2026-05-10 04:10:55,518 - optuna.study.study - INFO - Trial 1 finished with value: 0.022474579061395415 and parameters: {'n_layers': 4, 'embedding_dim': 256, 'lr': 0.0722311276579127, 'lambda_val': 0.0016399546621586698, 'batch_size': 1294, 'optimizer': 'Adam'}. Best is trial 0 with value: 0.03270814386773587.
2026-05-10 04:11:58,621 - optuna.study.study - INFO - Trial 2 finished with value: 0.011033371870682894 and parameters: {'n_layers': 4, 'embedding_dim': 96, 'lr': 0.028436062045880593, 'lambda_val': 9.574456290128599e-06, 'batch_size': 3008, 'optimizer': 'Adam'}. Best is trial 0 with value: 0.03270814386773587.
2026-05-10 04:12:45,454 - optuna.study.study - INFO - Trial 3 finished with value: 0.019268197535206227 and parameters: {'n_layers': 3, 'embedding_dim': 32, 'lr': 2.088832959303496e-05, 'lambda_val': 2.2869706693302604e-06, 'batch_size': 2131, 'optimizer': 'Adam'}. Best is trial 0 with value: 0.03270814386773587.
2026-05-10 04:13:54,970 - optuna.study.study - INFO - Trial 4 finished with value: 0.011729405308189365 and parameters: {'n_layers': 2, 'embedding_dim': 256, 'lr': 0.007177210757084221, 'lambda_val': 0.028847480239400675, 'batch_size': 3862, 'optimizer': 'Adam'}. Best is trial 0 with value: 0.03270814386773587.
2026-05-10 04:13:57,243 - optuna.study._optimize - INFO - Trial 5 pruned. 
2026-05-10 04:14:49,515 - optuna.study.study - INFO - Trial 6 finished with value: 0.02678621287880872 and parameters: {'n_layers': 2, 'embedding_dim': 96, 'lr': 0.0019273394463266058, 'lambda_val': 2.3552182244558227e-06, 'batch_size': 2836, 'optimizer': 'RMSprop'}. Best is trial 0 with value: 0.03270814386773587.
2026-05-10 04:14:51,517 - optuna.study._optimize - INFO - Trial 7 pruned. 
2026-05-10 04:15:31,083 - optuna.study._optimize - INFO - Trial 8 pruned. 
2026-05-10 04:15:32,399 - optuna.study._optimize - INFO - Trial 9 pruned. 
2026-05-10 04:15:33,738 - optuna.study._optimize - INFO - Trial 10 pruned. 
2026-05-10 04:16:26,587 - optuna.study.study - INFO - Trial 11 finished with value: 0.03002731276793092 and parameters: {'n_layers': 2, 'embedding_dim': 96, 'lr': 0.0013216554226551213, 'lambda_val': 6.81564592039635e-05, 'batch_size': 2798, 'optimizer': 'RMSprop'}. Best is trial 0 with value: 0.03270814386773587.
2026-05-10 04:17:21,991 - optuna.study.study - INFO - Trial 12 finished with value: 0.02029197799538398 and parameters: {'n_layers': 2, 'embedding_dim': 128, 'lr': 0.0004103793366328281, 'lambda_val': 5.8386990644768785e-05, 'batch_size': 2739, 'optimizer': 'RMSprop'}. Best is trial 0 with value: 0.03270814386773587.
2026-05-10 04:17:23,410 - optuna.study._optimize - INFO - Trial 13 pruned. 
2026-05-10 04:17:24,958 - optuna.study._optimize - INFO - Trial 14 pruned. 
2026-05-10 04:17:26,295 - optuna.study._optimize - INFO - Trial 15 pruned. 
2026-05-10 04:17:27,611 - optuna.study._optimize - INFO - Trial 16 pruned. 
2026-05-10 04:17:29,093 - optuna.study._optimize - INFO - Trial 17 pruned. 
2026-05-10 04:18:18,678 - optuna.study.study - INFO - Trial 18 finished with value: 0.01780624220323746 and parameters: {'n_layers': 1, 'embedding_dim': 128, 'lr': 0.007787966690896479, 'lambda_val': 3.806327775308154e-05, 'batch_size': 3268, 'optimizer': 'RMSprop'}. Best is trial 0 with value: 0.03270814386773587.
2026-05-10 04:18:20,108 - optuna.study._optimize - INFO - Trial 19 pruned. 
2026-05-10 04:18:21,368 - optuna.study._optimize - INFO - Trial 20 pruned. 
2026-05-10 04:19:14,229 - optuna.study.study - INFO - Trial 21 finished with value: 0.0281837332300575 and parameters: {'n_layers': 2, 'embedding_dim': 96, 'lr': 0.0021316322364158123, 'lambda_val': 3.6271030345513386e-06, 'batch_size': 2652, 'optimizer': 'RMSprop'}. Best is trial 0 with value: 0.03270814386773587.
2026-05-10 04:20:05,166 - optuna.study.study - INFO - Trial 22 finished with value: 0.022597497425205726 and parameters: {'n_layers': 2, 'embedding_dim': 96, 'lr': 0.003717840922855007, 'lambda_val': 5.216632939986631e-06, 'batch_size': 2185, 'optimizer': 'RMSprop'}. Best is trial 0 with value: 0.03270814386773587.
2026-05-10 04:20:06,479 - optuna.study._optimize - INFO - Trial 23 pruned. 
2026-05-10 04:20:16,441 - optuna.study._optimize - INFO - Trial 24 pruned. 
2026-05-10 04:20:19,418 - optuna.study._optimize - INFO - Trial 25 pruned. 
2026-05-10 04:20:20,755 - optuna.study._optimize - INFO - Trial 26 pruned. 
2026-05-10 04:20:22,049 - optuna.study._optimize - INFO - Trial 27 pruned. 
2026-05-10 04:20:23,509 - optuna.study._optimize - INFO - Trial 28 pruned. 
2026-05-10 04:20:24,806 - optuna.study._optimize - INFO - Trial 29 pruned. 
2026-05-10 04:20:26,133 - optuna.study._optimize - INFO - Trial 30 pruned. 
2026-05-10 04:20:27,841 - optuna.study._optimize - INFO - Trial 31 pruned. 
2026-05-10 04:20:30,234 - optuna.study._optimize - INFO - Trial 32 pruned. 
2026-05-10 04:20:32,883 - optuna.study._optimize - INFO - Trial 33 pruned. 
2026-05-10 04:21:25,645 - optuna.study.study - INFO - Trial 34 finished with value: 0.02889784966274725 and parameters: {'n_layers': 2, 'embedding_dim': 96, 'lr': 0.002106597670860183, 'lambda_val': 1.0970523075707756e-05, 'batch_size': 2332, 'optimizer': 'RMSprop'}. Best is trial 0 with value: 0.03270814386773587.
2026-05-10 04:21:28,247 - optuna.study._optimize - INFO - Trial 35 pruned. 
2026-05-10 04:22:19,150 - optuna.study.study - INFO - Trial 36 finished with value: 0.026908667386866453 and parameters: {'n_layers': 2, 'embedding_dim': 96, 'lr': 0.0027492198362332834, 'lambda_val': 4.325845474467451e-05, 'batch_size': 2014, 'optimizer': 'RMSprop'}. Best is trial 0 with value: 0.03270814386773587.
2026-05-10 04:22:20,384 - optuna.study._optimize - INFO - Trial 37 pruned. 
2026-05-10 04:23:03,997 - optuna.study.study - INFO - Trial 38 finished with value: 0.02050711026587007 and parameters: {'n_layers': 1, 'embedding_dim': 96, 'lr': 0.005872436173518255, 'lambda_val': 3.9012905564998725e-06, 'batch_size': 1930, 'optimizer': 'RMSprop'}. Best is trial 0 with value: 0.03270814386773587.
2026-05-10 04:23:05,267 - optuna.study._optimize - INFO - Trial 39 pruned. 
2026-05-10 04:23:06,469 - optuna.study._optimize - INFO - Trial 40 pruned. 
2026-05-10 04:23:08,109 - optuna.study._optimize - INFO - Trial 41 pruned. 
2026-05-10 04:23:09,318 - optuna.study._optimize - INFO - Trial 42 pruned. 
2026-05-10 04:23:26,588 - optuna.study._optimize - INFO - Trial 43 pruned. 
2026-05-10 04:23:27,841 - optuna.study._optimize - INFO - Trial 44 pruned. 
2026-05-10 04:23:29,049 - optuna.study._optimize - INFO - Trial 45 pruned. 
2026-05-10 04:24:34,528 - optuna.study.study - INFO - Trial 46 finished with value: 0.02279604707683289 and parameters: {'n_layers': 2, 'embedding_dim': 256, 'lr': 0.004926295797451732, 'lambda_val': 7.671344718817737e-06, 'batch_size': 967, 'optimizer': 'RMSprop'}. Best is trial 0 with value: 0.03270814386773587.
2026-05-10 04:24:35,868 - optuna.study._optimize - INFO - Trial 47 pruned. 
2026-05-10 04:24:37,221 - optuna.study._optimize - INFO - Trial 48 pruned. 
2026-05-10 04:24:39,460 - optuna.study._optimize - INFO - Trial 49 pruned. 
2026-05-10 04:24:41,589 - optuna.study._optimize - INFO - Trial 50 pruned. 
2026-05-10 04:24:43,332 - optuna.study._optimize - INFO - Trial 51 pruned. 
2026-05-10 04:24:45,560 - optuna.study._optimize - INFO - Trial 52 pruned. 
2026-05-10 04:24:46,813 - optuna.study._optimize - INFO - Trial 53 pruned. 
2026-05-10 04:25:58,878 - optuna.study.study - INFO - Trial 54 finished with value: 0.01498230762500364 and parameters: {'n_layers': 2, 'embedding_dim': 256, 'lr': 0.009313744309046893, 'lambda_val': 1.8342870015214025e-06, 'batch_size': 2273, 'optimizer': 'RMSprop'}. Best is trial 0 with value: 0.03270814386773587.
2026-05-10 04:26:51,544 - optuna.study.study - INFO - Trial 55 finished with value: 0.01852821810591895 and parameters: {'n_layers': 2, 'embedding_dim': 96, 'lr': 0.0046277648739192654, 'lambda_val': 4.873126000041479e-06, 'batch_size': 3491, 'optimizer': 'RMSprop'}. Best is trial 0 with value: 0.03270814386773587.
2026-05-10 04:26:53,732 - optuna.study._optimize - INFO - Trial 56 pruned. 
2026-05-10 04:27:47,103 - optuna.study.study - INFO - Trial 57 finished with value: 0.02964250987598838 and parameters: {'n_layers': 2, 'embedding_dim': 96, 'lr': 0.0014470546863466483, 'lambda_val': 8.67147325433495e-06, 'batch_size': 2532, 'optimizer': 'Adam'}. Best is trial 0 with value: 0.03270814386773587.
2026-05-10 04:27:48,508 - optuna.study._optimize - INFO - Trial 58 pruned. 
2026-05-10 04:27:49,805 - optuna.study._optimize - INFO - Trial 59 pruned. 
2026-05-10 04:27:51,058 - optuna.study._optimize - INFO - Trial 60 pruned. 
2026-05-10 04:27:52,579 - optuna.study._optimize - INFO - Trial 61 pruned. 
2026-05-10 04:28:43,727 - optuna.study.study - INFO - Trial 62 finished with value: 0.02916451184692183 and parameters: {'n_layers': 2, 'embedding_dim': 96, 'lr': 0.001069135008887623, 'lambda_val': 6.095299568134545e-06, 'batch_size': 2750, 'optimizer': 'Adam'}. Best is trial 0 with value: 0.03270814386773587.
2026-05-10 04:28:45,151 - optuna.study._optimize - INFO - Trial 63 pruned. 
2026-05-10 04:28:46,402 - optuna.study._optimize - INFO - Trial 64 pruned. 
2026-05-10 04:28:48,174 - optuna.study._optimize - INFO - Trial 65 pruned. 
2026-05-10 04:28:49,600 - optuna.study._optimize - INFO - Trial 66 pruned. 
2026-05-10 04:28:51,014 - optuna.study._optimize - INFO - Trial 67 pruned. 
2026-05-10 04:28:52,486 - optuna.study._optimize - INFO - Trial 68 pruned. 
2026-05-10 04:28:53,900 - optuna.study._optimize - INFO - Trial 69 pruned. 
2026-05-10 04:28:55,401 - optuna.study._optimize - INFO - Trial 70 pruned. 
2026-05-10 04:28:56,754 - optuna.study._optimize - INFO - Trial 71 pruned. 
2026-05-10 04:28:58,246 - optuna.study._optimize - INFO - Trial 72 pruned. 
2026-05-10 04:28:59,752 - optuna.study._optimize - INFO - Trial 73 pruned. 
2026-05-10 04:29:01,402 - optuna.study._optimize - INFO - Trial 74 pruned. 
2026-05-10 04:29:53,601 - optuna.study.study - INFO - Trial 75 finished with value: 0.01755501005066688 and parameters: {'n_layers': 2, 'embedding_dim': 96, 'lr': 0.006001579346468639, 'lambda_val': 1.0618128824052761e-05, 'batch_size': 2384, 'optimizer': 'RMSprop'}. Best is trial 0 with value: 0.03270814386773587.
2026-05-10 04:29:54,908 - optuna.study._optimize - INFO - Trial 76 pruned. 
2026-05-10 04:29:56,703 - optuna.study._optimize - INFO - Trial 77 pruned. 
2026-05-10 04:29:58,033 - optuna.study._optimize - INFO - Trial 78 pruned. 
2026-05-10 04:29:59,386 - optuna.study._optimize - INFO - Trial 79 pruned. 
2026-05-10 04:30:00,627 - optuna.study._optimize - INFO - Trial 80 pruned. 
2026-05-10 04:31:07,589 - optuna.study.study - INFO - Trial 81 finished with value: 0.02513218165692552 and parameters: {'n_layers': 2, 'embedding_dim': 256, 'lr': 0.004557511327790912, 'lambda_val': 8.423315534786317e-06, 'batch_size': 854, 'optimizer': 'RMSprop'}. Best is trial 0 with value: 0.03270814386773587.
2026-05-10 04:31:10,697 - optuna.study._optimize - INFO - Trial 82 pruned. 
2026-05-10 04:31:12,007 - optuna.study._optimize - INFO - Trial 83 pruned. 
2026-05-10 04:32:21,075 - optuna.study.study - INFO - Trial 84 finished with value: 0.018209252814105303 and parameters: {'n_layers': 2, 'embedding_dim': 256, 'lr': 0.008053335482453124, 'lambda_val': 1.5229466791274702e-05, 'batch_size': 1134, 'optimizer': 'RMSprop'}. Best is trial 0 with value: 0.03270814386773587.
2026-05-10 04:32:22,393 - optuna.study._optimize - INFO - Trial 85 pruned. 
2026-05-10 04:32:23,755 - optuna.study._optimize - INFO - Trial 86 pruned. 
2026-05-10 04:32:24,997 - optuna.study._optimize - INFO - Trial 87 pruned. 
2026-05-10 04:32:26,383 - optuna.study._optimize - INFO - Trial 88 pruned. 
2026-05-10 04:32:27,657 - optuna.study._optimize - INFO - Trial 89 pruned. 
2026-05-10 04:32:28,954 - optuna.study._optimize - INFO - Trial 90 pruned. 
2026-05-10 04:33:36,633 - optuna.study.study - INFO - Trial 91 finished with value: 0.024890774053857676 and parameters: {'n_layers': 2, 'embedding_dim': 256, 'lr': 0.004659253648376931, 'lambda_val': 6.501344664257314e-06, 'batch_size': 1006, 'optimizer': 'RMSprop'}. Best is trial 0 with value: 0.03270814386773587.
2026-05-10 04:33:37,929 - optuna.study._optimize - INFO - Trial 92 pruned. 
