2026-05-10 06:40:41,128 - optuna.study.study - INFO - Trial 10 finished with value: 0.02583812214529656 and parameters: {'n_layers': 3, 'embedding_dim': 96, 'lr': 0.01116418594180238, 'lambda_val': 0.003447926105729766, 'batch_size': 624, 'optimizer': 'RMSprop'}. Best is trial 4 with value: 0.03010522144537456.
2026-05-10 06:41:39,270 - optuna.study.study - INFO - Trial 11 finished with value: 0.025466528875632458 and parameters: {'n_layers': 3, 'embedding_dim': 96, 'lr': 0.01151892376929079, 'lambda_val': 0.0034358977721062455, 'batch_size': 575, 'optimizer': 'RMSprop'}. Best is trial 4 with value: 0.03010522144537456.
2026-05-10 06:42:38,298 - optuna.study.study - INFO - Trial 12 finished with value: 0.025332202339833843 and parameters: {'n_layers': 3, 'embedding_dim': 96, 'lr': 0.09762450967898584, 'lambda_val': 0.0030785437884207054, 'batch_size': 1173, 'optimizer': 'RMSprop'}. Best is trial 4 with value: 0.03010522144537456.
2026-05-10 06:42:39,724 - optuna.study._optimize - INFO - Trial 13 pruned. 
2026-05-10 06:42:41,041 - optuna.study._optimize - INFO - Trial 14 pruned. 
2026-05-10 06:42:42,271 - optuna.study._optimize - INFO - Trial 15 pruned. 
2026-05-10 06:42:43,964 - optuna.study._optimize - INFO - Trial 16 pruned. 
2026-05-10 06:43:06,002 - optuna.study._optimize - INFO - Trial 17 pruned. 
2026-05-10 06:43:07,265 - optuna.study._optimize - INFO - Trial 18 pruned. 
2026-05-10 06:43:08,560 - optuna.study._optimize - INFO - Trial 19 pruned. 
2026-05-10 06:43:09,965 - optuna.study._optimize - INFO - Trial 20 pruned. 
2026-05-10 06:44:09,328 - optuna.study.study - INFO - Trial 21 finished with value: 0.024397429003596555 and parameters: {'n_layers': 3, 'embedding_dim': 96, 'lr': 0.008687189832060075, 'lambda_val': 0.0034429683788077684, 'batch_size': 521, 'optimizer': 'RMSprop'}. Best is trial 4 with value: 0.03010522144537456.
2026-05-10 06:45:08,267 - optuna.study.study - INFO - Trial 22 finished with value: 0.02581882465791072 and parameters: {'n_layers': 3, 'embedding_dim': 96, 'lr': 0.015361549443590897, 'lambda_val': 0.0015297552789363179, 'batch_size': 845, 'optimizer': 'RMSprop'}. Best is trial 4 with value: 0.03010522144537456.
2026-05-10 06:46:13,629 - optuna.study.study - INFO - Trial 23 finished with value: 0.0262437471741572 and parameters: {'n_layers': 4, 'embedding_dim': 96, 'lr': 0.02804319885931571, 'lambda_val': 0.0011019659072438173, 'batch_size': 774, 'optimizer': 'RMSprop'}. Best is trial 4 with value: 0.03010522144537456.
2026-05-10 06:46:27,221 - optuna.study._optimize - INFO - Trial 24 pruned. 
2026-05-10 06:46:28,638 - optuna.study._optimize - INFO - Trial 25 pruned. 
2026-05-10 06:46:51,179 - optuna.study._optimize - INFO - Trial 26 pruned. 
2026-05-10 06:46:52,485 - optuna.study._optimize - INFO - Trial 27 pruned. 
2026-05-10 06:46:53,759 - optuna.study._optimize - INFO - Trial 28 pruned. 
2026-05-10 06:46:55,065 - optuna.study._optimize - INFO - Trial 29 pruned. 
2026-05-10 06:46:56,769 - optuna.study._optimize - INFO - Trial 30 pruned. 
2026-05-10 06:47:55,370 - optuna.study.study - INFO - Trial 31 finished with value: 0.027270755155815663 and parameters: {'n_layers': 3, 'embedding_dim': 96, 'lr': 0.017927343102558873, 'lambda_val': 0.001579174123273186, 'batch_size': 845, 'optimizer': 'RMSprop'}. Best is trial 4 with value: 0.03010522144537456.
2026-05-10 06:48:54,313 - optuna.study.study - INFO - Trial 32 finished with value: 0.0271980249200601 and parameters: {'n_layers': 3, 'embedding_dim': 96, 'lr': 0.019536190482526902, 'lambda_val': 0.002054539623456184, 'batch_size': 695, 'optimizer': 'RMSprop'}. Best is trial 4 with value: 0.03010522144537456.
2026-05-10 06:48:55,650 - optuna.study._optimize - INFO - Trial 33 pruned. 
2026-05-10 06:49:00,529 - optuna.study._optimize - INFO - Trial 34 pruned. 
2026-05-10 06:49:13,302 - optuna.study._optimize - INFO - Trial 35 pruned. 
2026-05-10 06:49:15,095 - optuna.study._optimize - INFO - Trial 36 pruned. 
2026-05-10 06:49:16,335 - optuna.study._optimize - INFO - Trial 37 pruned. 
2026-05-10 06:49:17,796 - optuna.study._optimize - INFO - Trial 38 pruned. 
2026-05-10 06:49:19,147 - optuna.study._optimize - INFO - Trial 39 pruned. 
2026-05-10 06:49:20,387 - optuna.study._optimize - INFO - Trial 40 pruned. 
2026-05-10 06:50:18,577 - optuna.study.study - INFO - Trial 41 finished with value: 0.02583935591580093 and parameters: {'n_layers': 3, 'embedding_dim': 96, 'lr': 0.014368679320122271, 'lambda_val': 0.0023548772438382794, 'batch_size': 633, 'optimizer': 'RMSprop'}. Best is trial 4 with value: 0.03010522144537456.
2026-05-10 06:50:46,833 - optuna.study._optimize - INFO - Trial 42 pruned. 
2026-05-10 06:51:45,407 - optuna.study.study - INFO - Trial 43 finished with value: 0.026532038710546678 and parameters: {'n_layers': 3, 'embedding_dim': 96, 'lr': 0.01432962658501615, 'lambda_val': 0.002190112507533805, 'batch_size': 966, 'optimizer': 'RMSprop'}. Best is trial 4 with value: 0.03010522144537456.
2026-05-10 06:51:49,082 - optuna.study._optimize - INFO - Trial 44 pruned. 
2026-05-10 06:51:50,553 - optuna.study._optimize - INFO - Trial 45 pruned. 
2026-05-10 06:51:51,885 - optuna.study._optimize - INFO - Trial 46 pruned. 
2026-05-10 06:51:55,607 - optuna.study._optimize - INFO - Trial 47 pruned. 
2026-05-10 06:51:57,153 - optuna.study._optimize - INFO - Trial 48 pruned. 
2026-05-10 06:52:05,907 - optuna.study._optimize - INFO - Trial 49 pruned. 
2026-05-10 06:52:07,212 - optuna.study._optimize - INFO - Trial 50 pruned. 
2026-05-10 06:53:06,636 - optuna.study.study - INFO - Trial 51 finished with value: 0.027386975791601927 and parameters: {'n_layers': 3, 'embedding_dim': 96, 'lr': 0.014050878585546716, 'lambda_val': 0.002186857493824805, 'batch_size': 639, 'optimizer': 'RMSprop'}. Best is trial 4 with value: 0.03010522144537456.
2026-05-10 06:53:13,541 - optuna.study._optimize - INFO - Trial 52 pruned. 
2026-05-10 06:53:14,836 - optuna.study._optimize - INFO - Trial 53 pruned. 
2026-05-10 06:53:16,229 - optuna.study._optimize - INFO - Trial 54 pruned. 
2026-05-10 06:53:17,458 - optuna.study._optimize - INFO - Trial 55 pruned. 
2026-05-10 06:53:18,862 - optuna.study._optimize - INFO - Trial 56 pruned. 
2026-05-10 06:53:20,101 - optuna.study._optimize - INFO - Trial 57 pruned. 
2026-05-10 06:53:27,109 - optuna.study._optimize - INFO - Trial 58 pruned. 
2026-05-10 06:53:28,812 - optuna.study._optimize - INFO - Trial 59 pruned. 
2026-05-10 06:53:30,107 - optuna.study._optimize - INFO - Trial 60 pruned. 
2026-05-10 06:53:32,719 - optuna.study._optimize - INFO - Trial 61 pruned. 
2026-05-10 06:53:34,135 - optuna.study._optimize - INFO - Trial 62 pruned. 
2026-05-10 06:53:44,517 - optuna.study._optimize - INFO - Trial 63 pruned. 
2026-05-10 06:53:45,889 - optuna.study._optimize - INFO - Trial 64 pruned. 
2026-05-10 06:53:47,150 - optuna.study._optimize - INFO - Trial 65 pruned. 
2026-05-10 06:53:48,433 - optuna.study._optimize - INFO - Trial 66 pruned. 
2026-05-10 06:54:07,163 - optuna.study._optimize - INFO - Trial 67 pruned. 
2026-05-10 06:54:08,469 - optuna.study._optimize - INFO - Trial 68 pruned. 
2026-05-10 06:54:09,719 - optuna.study._optimize - INFO - Trial 69 pruned. 
2026-05-10 06:54:11,028 - optuna.study._optimize - INFO - Trial 70 pruned. 
2026-05-10 06:54:15,293 - optuna.study._optimize - INFO - Trial 71 pruned. 
2026-05-10 06:55:14,043 - optuna.study.study - INFO - Trial 72 finished with value: 0.028034388086659978 and parameters: {'n_layers': 3, 'embedding_dim': 96, 'lr': 0.016632086020930466, 'lambda_val': 0.0017634932221536291, 'batch_size': 843, 'optimizer': 'RMSprop'}. Best is trial 4 with value: 0.03010522144537456.
2026-05-10 06:56:14,054 - optuna.study.study - INFO - Trial 73 finished with value: 0.027231787275933582 and parameters: {'n_layers': 3, 'embedding_dim': 96, 'lr': 0.01609858720943387, 'lambda_val': 0.0017730348762419591, 'batch_size': 852, 'optimizer': 'RMSprop'}. Best is trial 4 with value: 0.03010522144537456.
2026-05-10 06:56:24,490 - optuna.study._optimize - INFO - Trial 74 pruned. 
2026-05-10 06:56:26,627 - optuna.study._optimize - INFO - Trial 75 pruned. 
2026-05-10 06:56:27,976 - optuna.study._optimize - INFO - Trial 76 pruned. 
2026-05-10 06:56:46,680 - optuna.study._optimize - INFO - Trial 77 pruned. 
2026-05-10 06:56:48,074 - optuna.study._optimize - INFO - Trial 78 pruned. 
2026-05-10 06:56:49,335 - optuna.study._optimize - INFO - Trial 79 pruned. 
2026-05-10 06:56:53,921 - optuna.study._optimize - INFO - Trial 80 pruned. 
2026-05-10 06:56:55,205 - optuna.study._optimize - INFO - Trial 81 pruned. 
2026-05-10 06:56:56,676 - optuna.study._optimize - INFO - Trial 82 pruned. 
2026-05-10 06:57:00,142 - optuna.study._optimize - INFO - Trial 83 pruned. 
2026-05-10 06:57:01,414 - optuna.study._optimize - INFO - Trial 84 pruned. 
2026-05-10 06:57:02,709 - optuna.study._optimize - INFO - Trial 85 pruned. 
2026-05-10 06:57:04,634 - optuna.study._optimize - INFO - Trial 86 pruned. 
2026-05-10 06:57:08,171 - optuna.study._optimize - INFO - Trial 87 pruned. 
2026-05-10 06:57:11,914 - optuna.study._optimize - INFO - Trial 88 pruned. 
2026-05-10 06:57:13,264 - optuna.study._optimize - INFO - Trial 89 pruned. 
2026-05-10 06:57:14,548 - optuna.study._optimize - INFO - Trial 90 pruned. 
2026-05-10 06:57:15,891 - optuna.study._optimize - INFO - Trial 91 pruned. 
2026-05-10 06:57:18,460 - optuna.study._optimize - INFO - Trial 92 pruned. 
2026-05-10 06:57:21,993 - optuna.study._optimize - INFO - Trial 93 pruned. 
2026-05-10 06:57:24,772 - optuna.study._optimize - INFO - Trial 94 pruned. 
2026-05-10 06:57:26,181 - optuna.study._optimize - INFO - Trial 95 pruned. 
2026-05-10 06:57:28,573 - optuna.study._optimize - INFO - Trial 96 pruned. 
2026-05-10 06:57:33,609 - optuna.study._optimize - INFO - Trial 97 pruned. 
2026-05-10 06:57:35,006 - optuna.study._optimize - INFO - Trial 98 pruned. 
2026-05-10 06:57:36,287 - optuna.study._optimize - INFO - Trial 99 pruned. 
2026-05-10 06:58:26,920 - root - INFO -   **** Training e_1M_1c2dcs_rand2
2026-05-10 06:58:26,979 - root - INFO -   **** Getting 188411/669182 random edges
2026-05-10 06:58:27,130 - optuna.storages._rdb.storage - INFO - A new study created in RDB with name: Study_e_1M_1c2dcs_rand2
2026-05-10 06:59:18,142 - optuna.study.study - INFO - Trial 0 finished with value: 0.016731949714215842 and parameters: {'n_layers': 3, 'embedding_dim': 32, 'lr': 0.05147663951041838, 'lambda_val': 0.0007668696625627615, 'batch_size': 2588, 'optimizer': 'Adam'}. Best is trial 0 with value: 0.016731949714215842.
2026-05-10 07:00:28,959 - optuna.study.study - INFO - Trial 1 finished with value: 0.012660304727665177 and parameters: {'n_layers': 4, 'embedding_dim': 128, 'lr': 0.0009966867109312367, 'lambda_val': 0.00085474103511687, 'batch_size': 702, 'optimizer': 'Adam'}. Best is trial 0 with value: 0.016731949714215842.
2026-05-10 07:01:16,397 - optuna.study.study - INFO - Trial 2 finished with value: 0.005696896059047466 and parameters: {'n_layers': 1, 'embedding_dim': 128, 'lr': 0.0015517459807102944, 'lambda_val': 1.8664931445443361e-06, 'batch_size': 1533, 'optimizer': 'SGD'}. Best is trial 0 with value: 0.016731949714215842.
2026-05-10 07:02:14,610 - optuna.study.study - INFO - Trial 3 finished with value: 0.03809994705635219 and parameters: {'n_layers': 1, 'embedding_dim': 256, 'lr': 4.4337389800696115e-05, 'lambda_val': 2.0735243008846295e-06, 'batch_size': 2680, 'optimizer': 'Adam'}. Best is trial 3 with value: 0.03809994705635219.
2026-05-10 07:03:22,293 - optuna.study.study - INFO - Trial 4 finished with value: 0.016741011072542288 and parameters: {'n_layers': 4, 'embedding_dim': 96, 'lr': 1.2984532702594062e-05, 'lambda_val': 0.001254510067001105, 'batch_size': 2918, 'optimizer': 'Adam'}. Best is trial 3 with value: 0.03809994705635219.
2026-05-10 07:04:13,428 - optuna.study.study - INFO - Trial 5 finished with value: 0.01600468372087102 and parameters: {'n_layers': 1, 'embedding_dim': 96, 'lr': 0.014464188128403497, 'lambda_val': 1.1427811243804739e-06, 'batch_size': 978, 'optimizer': 'RMSprop'}. Best is trial 3 with value: 0.03809994705635219.
2026-05-10 07:04:14,748 - optuna.study._optimize - INFO - Trial 6 pruned. 
2026-05-10 07:04:48,665 - optuna.study._optimize - INFO - Trial 7 pruned. 
2026-05-10 07:05:23,385 - optuna.study._optimize - INFO - Trial 8 pruned. 
2026-05-10 07:05:24,769 - optuna.study._optimize - INFO - Trial 9 pruned. 
2026-05-10 07:05:26,929 - optuna.study._optimize - INFO - Trial 10 pruned. 
2026-05-10 07:05:28,224 - optuna.study._optimize - INFO - Trial 11 pruned. 
2026-05-10 07:05:30,629 - optuna.study._optimize - INFO - Trial 12 pruned. 
2026-05-10 07:05:32,017 - optuna.study._optimize - INFO - Trial 13 pruned. 
2026-05-10 07:05:33,426 - optuna.study._optimize - INFO - Trial 14 pruned. 
2026-05-10 07:05:34,992 - optuna.study._optimize - INFO - Trial 15 pruned. 
2026-05-10 07:05:36,361 - optuna.study._optimize - INFO - Trial 16 pruned. 
2026-05-10 07:05:37,639 - optuna.study._optimize - INFO - Trial 17 pruned. 
2026-05-10 07:05:38,999 - optuna.study._optimize - INFO - Trial 18 pruned. 
2026-05-10 07:05:43,258 - optuna.study._optimize - INFO - Trial 19 pruned. 
2026-05-10 07:05:47,344 - optuna.study._optimize - INFO - Trial 20 pruned. 
2026-05-10 07:05:49,180 - optuna.study._optimize - INFO - Trial 21 pruned. 
2026-05-10 07:06:44,072 - optuna.study.study - INFO - Trial 22 finished with value: 0.012811146465525733 and parameters: {'n_layers': 3, 'embedding_dim': 32, 'lr': 0.022521693345238864, 'lambda_val': 0.00032900551356854706, 'batch_size': 1842, 'optimizer': 'Adam'}. Best is trial 3 with value: 0.03809994705635219.
2026-05-10 07:06:45,369 - optuna.study._optimize - INFO - Trial 23 pruned. 
2026-05-10 07:06:46,700 - optuna.study._optimize - INFO - Trial 24 pruned. 
2026-05-10 07:06:48,110 - optuna.study._optimize - INFO - Trial 25 pruned. 
2026-05-10 07:06:49,491 - optuna.study._optimize - INFO - Trial 26 pruned. 
2026-05-10 07:06:52,413 - optuna.study._optimize - INFO - Trial 27 pruned. 
2026-05-10 07:06:53,674 - optuna.study._optimize - INFO - Trial 28 pruned. 
2026-05-10 07:06:55,018 - optuna.study._optimize - INFO - Trial 29 pruned. 
2026-05-10 07:06:56,367 - optuna.study._optimize - INFO - Trial 30 pruned. 
2026-05-10 07:07:46,479 - optuna.study.study - INFO - Trial 31 finished with value: 0.016901194395898392 and parameters: {'n_layers': 1, 'embedding_dim': 96, 'lr': 0.013365021127883387, 'lambda_val': 1.4988981961509785e-06, 'batch_size': 614, 'optimizer': 'RMSprop'}. Best is trial 3 with value: 0.03809994705635219.
2026-05-10 07:07:49,017 - optuna.study._optimize - INFO - Trial 32 pruned. 
2026-05-10 07:08:38,056 - optuna.study.study - INFO - Trial 33 finished with value: 0.018656876211304147 and parameters: {'n_layers': 1, 'embedding_dim': 96, 'lr': 0.012144819968721042, 'lambda_val': 3.785611764830918e-06, 'batch_size': 541, 'optimizer': 'RMSprop'}. Best is trial 3 with value: 0.03809994705635219.
2026-05-10 07:09:32,012 - optuna.study.study - INFO - Trial 34 finished with value: 0.021440903261527824 and parameters: {'n_layers': 1, 'embedding_dim': 96, 'lr': 0.008755483093757834, 'lambda_val': 3.1719786997999652e-06, 'batch_size': 516, 'optimizer': 'RMSprop'}. Best is trial 3 with value: 0.03809994705635219.
2026-05-10 07:10:22,014 - optuna.study.study - INFO - Trial 35 finished with value: 0.02166704525668417 and parameters: {'n_layers': 1, 'embedding_dim': 96, 'lr': 0.008608301067407361, 'lambda_val': 3.685334556787921e-06, 'batch_size': 525, 'optimizer': 'RMSprop'}. Best is trial 3 with value: 0.03809994705635219.
2026-05-10 07:11:17,134 - optuna.study.study - INFO - Trial 36 finished with value: 0.02151713433162444 and parameters: {'n_layers': 1, 'embedding_dim': 96, 'lr': 0.006987457794100053, 'lambda_val': 4.082278907211745e-06, 'batch_size': 1212, 'optimizer': 'RMSprop'}. Best is trial 3 with value: 0.03809994705635219.
2026-05-10 07:12:07,354 - optuna.study.study - INFO - Trial 37 finished with value: 0.022037211597014137 and parameters: {'n_layers': 1, 'embedding_dim': 128, 'lr': 0.005520569594467049, 'lambda_val': 1.0093232939310954e-05, 'batch_size': 1129, 'optimizer': 'RMSprop'}. Best is trial 3 with value: 0.03809994705635219.
2026-05-10 07:12:08,823 - optuna.study._optimize - INFO - Trial 38 pruned. 
2026-05-10 07:13:01,649 - optuna.study.study - INFO - Trial 39 finished with value: 0.02202736474430545 and parameters: {'n_layers': 1, 'embedding_dim': 128, 'lr': 0.005799958889832756, 'lambda_val': 1.5551909125348466e-05, 'batch_size': 1259, 'optimizer': 'RMSprop'}. Best is trial 3 with value: 0.03809994705635219.
2026-05-10 07:13:02,968 - optuna.study._optimize - INFO - Trial 40 pruned. 
2026-05-10 07:13:04,377 - optuna.study._optimize - INFO - Trial 41 pruned. 
2026-05-10 07:13:58,473 - optuna.study.study - INFO - Trial 42 finished with value: 0.018761364001765417 and parameters: {'n_layers': 1, 'embedding_dim': 128, 'lr': 0.007260262053498113, 'lambda_val': 1.8651619377576875e-06, 'batch_size': 1399, 'optimizer': 'RMSprop'}. Best is trial 3 with value: 0.03809994705635219.
2026-05-10 07:14:05,631 - optuna.study._optimize - INFO - Trial 43 pruned. 
2026-05-10 07:14:06,937 - optuna.study._optimize - INFO - Trial 44 pruned. 
2026-05-10 07:14:08,276 - optuna.study._optimize - INFO - Trial 45 pruned. 
2026-05-10 07:14:10,512 - optuna.study._optimize - INFO - Trial 46 pruned. 
2026-05-10 07:14:11,835 - optuna.study._optimize - INFO - Trial 47 pruned. 
2026-05-10 07:14:14,613 - optuna.study._optimize - INFO - Trial 48 pruned. 
2026-05-10 07:14:16,151 - optuna.study._optimize - INFO - Trial 49 pruned. 
2026-05-10 07:14:17,899 - optuna.study._optimize - INFO - Trial 50 pruned. 
2026-05-10 07:14:20,235 - optuna.study._optimize - INFO - Trial 51 pruned. 
2026-05-10 07:15:06,907 - optuna.study.study - INFO - Trial 52 finished with value: 0.019362386967004323 and parameters: {'n_layers': 1, 'embedding_dim': 96, 'lr': 0.009344466584906104, 'lambda_val': 2.9564163513815937e-06, 'batch_size': 954, 'optimizer': 'RMSprop'}. Best is trial 3 with value: 0.03809994705635219.
2026-05-10 07:15:09,475 - optuna.study._optimize - INFO - Trial 53 pruned. 
2026-05-10 07:15:10,813 - optuna.study._optimize - INFO - Trial 54 pruned. 
2026-05-10 07:15:12,152 - optuna.study._optimize - INFO - Trial 55 pruned. 
2026-05-10 07:15:13,500 - optuna.study._optimize - INFO - Trial 56 pruned. 
2026-05-10 07:15:14,898 - optuna.study._optimize - INFO - Trial 57 pruned. 
2026-05-10 07:15:17,418 - optuna.study._optimize - INFO - Trial 58 pruned. 
2026-05-10 07:15:18,614 - optuna.study._optimize - INFO - Trial 59 pruned. 
2026-05-10 07:15:19,986 - optuna.study._optimize - INFO - Trial 60 pruned. 
2026-05-10 07:16:06,740 - optuna.study.study - INFO - Trial 61 finished with value: 0.017509625934995287 and parameters: {'n_layers': 1, 'embedding_dim': 96, 'lr': 0.009959576275971962, 'lambda_val': 2.771407438105343e-06, 'batch_size': 1007, 'optimizer': 'RMSprop'}. Best is trial 3 with value: 0.03809994705635219.
2026-05-10 07:16:53,724 - optuna.study.study - INFO - Trial 62 finished with value: 0.019560776446846406 and parameters: {'n_layers': 1, 'embedding_dim': 96, 'lr': 0.00996607695366895, 'lambda_val': 1.8277724467914412e-05, 'batch_size': 904, 'optimizer': 'RMSprop'}. Best is trial 3 with value: 0.03809994705635219.
2026-05-10 07:16:55,331 - optuna.study._optimize - INFO - Trial 63 pruned. 
2026-05-10 07:16:57,659 - optuna.study._optimize - INFO - Trial 64 pruned. 
2026-05-10 07:16:59,122 - optuna.study._optimize - INFO - Trial 65 pruned. 
2026-05-10 07:17:00,668 - optuna.study._optimize - INFO - Trial 66 pruned. 
2026-05-10 07:17:02,999 - optuna.study._optimize - INFO - Trial 67 pruned. 
2026-05-10 07:17:04,714 - optuna.study._optimize - INFO - Trial 68 pruned. 
2026-05-10 07:17:06,053 - optuna.study._optimize - INFO - Trial 69 pruned. 
2026-05-10 07:17:08,873 - optuna.study._optimize - INFO - Trial 70 pruned. 
2026-05-10 07:17:57,208 - optuna.study.study - INFO - Trial 71 finished with value: 0.018626978558037938 and parameters: {'n_layers': 1, 'embedding_dim': 96, 'lr': 0.009954461406208986, 'lambda_val': 3.094244683409285e-06, 'batch_size': 923, 'optimizer': 'RMSprop'}. Best is trial 3 with value: 0.03809994705635219.
2026-05-10 07:17:59,532 - optuna.study._optimize - INFO - Trial 72 pruned. 
2026-05-10 07:18:00,741 - optuna.study._optimize - INFO - Trial 73 pruned. 
2026-05-10 07:18:04,020 - optuna.study._optimize - INFO - Trial 74 pruned. 
2026-05-10 07:18:06,477 - optuna.study._optimize - INFO - Trial 75 pruned. 
2026-05-10 07:18:07,794 - optuna.study._optimize - INFO - Trial 76 pruned. 
2026-05-10 07:18:09,133 - optuna.study._optimize - INFO - Trial 77 pruned. 
2026-05-10 07:18:10,454 - optuna.study._optimize - INFO - Trial 78 pruned. 
2026-05-10 07:18:11,682 - optuna.study._optimize - INFO - Trial 79 pruned. 
2026-05-10 07:18:14,587 - optuna.study._optimize - INFO - Trial 80 pruned. 
2026-05-10 07:19:03,484 - optuna.study.study - INFO - Trial 81 finished with value: 0.01929186872665639 and parameters: {'n_layers': 1, 'embedding_dim': 128, 'lr': 0.007747077953466624, 'lambda_val': 1.6187368158227763e-06, 'batch_size': 1428, 'optimizer': 'RMSprop'}. Best is trial 3 with value: 0.03809994705635219.
2026-05-10 07:19:52,501 - optuna.study.study - INFO - Trial 82 finished with value: 0.018435221745425372 and parameters: {'n_layers': 1, 'embedding_dim': 128, 'lr': 0.00855895129785372, 'lambda_val': 2.093111792459019e-06, 'batch_size': 1116, 'optimizer': 'RMSprop'}. Best is trial 3 with value: 0.03809994705635219.
2026-05-10 07:19:54,652 - optuna.study._optimize - INFO - Trial 83 pruned. 
2026-05-10 07:19:56,944 - optuna.study._optimize - INFO - Trial 84 pruned. 
2026-05-10 07:19:58,498 - optuna.study._optimize - INFO - Trial 85 pruned. 
2026-05-10 07:20:00,223 - optuna.study._optimize - INFO - Trial 86 pruned. 
2026-05-10 07:20:01,573 - optuna.study._optimize - INFO - Trial 87 pruned. 
