2026-05-10 01:27:53,024 - root - INFO - **** Training e_1M_full
2026-05-10 01:27:55,147 - helper_functions - INFO - Users: 6040, Items: 3883
2026-05-10 01:27:58,207 - helper_functions - INFO - Edge index: torch.Size([2, 836478])
2026-05-10 01:27:58,207 - root - INFO - **** Generating the graph:
2026-05-10 01:27:58,934 - helper_functions - INFO - Number of unique users: 6039
2026-05-10 01:27:58,941 - helper_functions - INFO - Number of unique items: 3628
2026-05-10 01:27:58,941 - helper_functions - INFO - Number of nodes: 9667
2026-05-10 01:27:58,945 - helper_functions - INFO - Number of edges: 836478
2026-05-10 01:28:02,715 - optuna.storages._rdb.storage - INFO - A new study created in RDB with name: Study_e_1M_full
2026-05-10 01:29:18,678 - optuna.study.study - INFO - Trial 0 finished with value: 0.004900020420689477 and parameters: {'n_layers': 2, 'embedding_dim': 96, 'lr': 0.05193571537034841, 'lambda_val': 0.00047221379830362885, 'batch_size': 1500, 'optimizer': 'SGD'}. Best is trial 0 with value: 0.004900020420689477.
2026-05-10 01:30:52,550 - optuna.study.study - INFO - Trial 1 finished with value: 0.022912942090162598 and parameters: {'n_layers': 2, 'embedding_dim': 128, 'lr': 0.00046755353851904777, 'lambda_val': 0.0004911286752198971, 'batch_size': 3188, 'optimizer': 'RMSprop'}. Best is trial 1 with value: 0.022912942090162598.
2026-05-10 01:32:18,916 - optuna.study.study - INFO - Trial 2 finished with value: 0.047921444858286484 and parameters: {'n_layers': 1, 'embedding_dim': 256, 'lr': 0.025734582129422433, 'lambda_val': 0.0006256860888150163, 'batch_size': 1901, 'optimizer': 'Adam'}. Best is trial 2 with value: 0.047921444858286484.
2026-05-10 01:33:26,086 - optuna.study.study - INFO - Trial 3 finished with value: 0.005461983697426472 and parameters: {'n_layers': 3, 'embedding_dim': 32, 'lr': 7.325261110579766e-05, 'lambda_val': 0.013961760835821244, 'batch_size': 1564, 'optimizer': 'SGD'}. Best is trial 2 with value: 0.047921444858286484.
2026-05-10 01:36:51,079 - optuna.study.study - INFO - Trial 4 finished with value: 0.03794099315184489 and parameters: {'n_layers': 4, 'embedding_dim': 256, 'lr': 0.003951396005869826, 'lambda_val': 7.682258976421998e-05, 'batch_size': 2607, 'optimizer': 'Adam'}. Best is trial 2 with value: 0.047921444858286484.
2026-05-10 01:36:52,461 - optuna.study._optimize - INFO - Trial 5 pruned. 
2026-05-10 01:37:54,459 - optuna.study.study - INFO - Trial 6 finished with value: 0.026587377931557125 and parameters: {'n_layers': 1, 'embedding_dim': 96, 'lr': 0.02655486624491988, 'lambda_val': 4.912490551127025e-05, 'batch_size': 1113, 'optimizer': 'RMSprop'}. Best is trial 2 with value: 0.047921444858286484.
2026-05-10 01:37:55,681 - optuna.study._optimize - INFO - Trial 7 pruned. 
2026-05-10 01:37:56,949 - optuna.study._optimize - INFO - Trial 8 pruned. 
2026-05-10 01:38:00,265 - optuna.study._optimize - INFO - Trial 9 pruned. 
2026-05-10 01:38:03,326 - optuna.study._optimize - INFO - Trial 10 pruned. 
2026-05-10 01:38:08,613 - optuna.study._optimize - INFO - Trial 11 pruned. 
2026-05-10 01:38:09,992 - optuna.study._optimize - INFO - Trial 12 pruned. 
2026-05-10 01:40:28,179 - optuna.study.study - INFO - Trial 13 finished with value: 0.05433872876009612 and parameters: {'n_layers': 2, 'embedding_dim': 256, 'lr': 0.002656481392326511, 'lambda_val': 2.0131478338868844e-05, 'batch_size': 2944, 'optimizer': 'Adam'}. Best is trial 13 with value: 0.05433872876009612.
2026-05-10 01:40:29,631 - optuna.study._optimize - INFO - Trial 14 pruned. 
2026-05-10 01:40:30,844 - optuna.study._optimize - INFO - Trial 15 pruned. 
2026-05-10 01:41:14,319 - optuna.study._optimize - INFO - Trial 16 pruned. 
2026-05-10 01:41:15,720 - optuna.study._optimize - INFO - Trial 17 pruned. 
2026-05-10 01:43:30,022 - optuna.study.study - INFO - Trial 18 finished with value: 0.05013015485063128 and parameters: {'n_layers': 2, 'embedding_dim': 256, 'lr': 0.00954154329980923, 'lambda_val': 0.0001278983448960368, 'batch_size': 2103, 'optimizer': 'RMSprop'}. Best is trial 13 with value: 0.05433872876009612.
2026-05-10 01:43:31,355 - optuna.study._optimize - INFO - Trial 19 pruned. 
2026-05-10 01:43:33,808 - optuna.study._optimize - INFO - Trial 20 pruned. 
2026-05-10 01:44:59,502 - optuna.study.study - INFO - Trial 21 finished with value: 0.06869832331344183 and parameters: {'n_layers': 1, 'embedding_dim': 256, 'lr': 0.022157795219346153, 'lambda_val': 0.0021175731921011984, 'batch_size': 1890, 'optimizer': 'RMSprop'}. Best is trial 21 with value: 0.06869832331344183.
2026-05-10 01:45:00,787 - optuna.study._optimize - INFO - Trial 22 pruned. 
2026-05-10 01:47:16,221 - optuna.study.study - INFO - Trial 23 finished with value: 0.05056072642839936 and parameters: {'n_layers': 2, 'embedding_dim': 256, 'lr': 0.008466541619399246, 'lambda_val': 2.7722756695419167e-05, 'batch_size': 2345, 'optimizer': 'RMSprop'}. Best is trial 21 with value: 0.06869832331344183.
2026-05-10 01:47:19,192 - optuna.study._optimize - INFO - Trial 24 pruned. 
2026-05-10 01:47:22,143 - optuna.study._optimize - INFO - Trial 25 pruned. 
2026-05-10 01:47:25,193 - optuna.study._optimize - INFO - Trial 26 pruned. 
2026-05-10 01:47:26,594 - optuna.study._optimize - INFO - Trial 27 pruned. 
2026-05-10 01:49:43,709 - optuna.study.study - INFO - Trial 28 finished with value: 0.05802842267101146 and parameters: {'n_layers': 2, 'embedding_dim': 256, 'lr': 0.014717021251793687, 'lambda_val': 0.001286549134930237, 'batch_size': 1742, 'optimizer': 'RMSprop'}. Best is trial 21 with value: 0.06869832331344183.
2026-05-10 01:49:44,952 - optuna.study._optimize - INFO - Trial 29 pruned. 
2026-05-10 01:49:47,516 - optuna.study._optimize - INFO - Trial 30 pruned. 
2026-05-10 01:51:59,784 - optuna.study.study - INFO - Trial 31 finished with value: 0.055155123121648685 and parameters: {'n_layers': 2, 'embedding_dim': 256, 'lr': 0.01221164447935153, 'lambda_val': 0.0002812580134231497, 'batch_size': 1801, 'optimizer': 'RMSprop'}. Best is trial 21 with value: 0.06869832331344183.
2026-05-10 01:54:15,750 - optuna.study.study - INFO - Trial 32 finished with value: 0.05724212165682846 and parameters: {'n_layers': 2, 'embedding_dim': 256, 'lr': 0.01401925782210305, 'lambda_val': 0.000329256118407692, 'batch_size': 1693, 'optimizer': 'RMSprop'}. Best is trial 21 with value: 0.06869832331344183.
2026-05-10 01:54:20,469 - optuna.study._optimize - INFO - Trial 33 pruned. 
2026-05-10 01:54:23,623 - optuna.study._optimize - INFO - Trial 34 pruned. 
2026-05-10 01:54:41,803 - optuna.study._optimize - INFO - Trial 35 pruned. 
2026-05-10 01:54:50,022 - optuna.study._optimize - INFO - Trial 36 pruned. 
2026-05-10 01:54:51,379 - optuna.study._optimize - INFO - Trial 37 pruned. 
2026-05-10 01:54:54,208 - optuna.study._optimize - INFO - Trial 38 pruned. 
2026-05-10 01:54:55,531 - optuna.study._optimize - INFO - Trial 39 pruned. 
2026-05-10 01:54:57,374 - optuna.study._optimize - INFO - Trial 40 pruned. 
2026-05-10 01:54:58,741 - optuna.study._optimize - INFO - Trial 41 pruned. 
2026-05-10 01:57:17,634 - optuna.study.study - INFO - Trial 42 finished with value: 0.06096918720949613 and parameters: {'n_layers': 2, 'embedding_dim': 256, 'lr': 0.014862058447380432, 'lambda_val': 0.0007458283983904003, 'batch_size': 2130, 'optimizer': 'RMSprop'}. Best is trial 21 with value: 0.06869832331344183.
2026-05-10 01:59:32,491 - optuna.study.study - INFO - Trial 43 finished with value: 0.062095959969930656 and parameters: {'n_layers': 2, 'embedding_dim': 256, 'lr': 0.012935306749093827, 'lambda_val': 0.0006568411766912584, 'batch_size': 2002, 'optimizer': 'RMSprop'}. Best is trial 21 with value: 0.06869832331344183.
2026-05-10 01:59:35,408 - optuna.study._optimize - INFO - Trial 44 pruned. 
2026-05-10 01:59:40,397 - optuna.study._optimize - INFO - Trial 45 pruned. 
2026-05-10 01:59:41,753 - optuna.study._optimize - INFO - Trial 46 pruned. 
2026-05-10 01:59:47,513 - optuna.study._optimize - INFO - Trial 47 pruned. 
2026-05-10 01:59:48,917 - optuna.study._optimize - INFO - Trial 48 pruned. 
2026-05-10 01:59:52,056 - optuna.study._optimize - INFO - Trial 49 pruned. 
2026-05-10 01:59:53,394 - optuna.study._optimize - INFO - Trial 50 pruned. 
2026-05-10 02:00:45,181 - optuna.study._optimize - INFO - Trial 51 pruned. 
2026-05-10 02:02:57,293 - optuna.study.study - INFO - Trial 52 finished with value: 0.06170300290367407 and parameters: {'n_layers': 2, 'embedding_dim': 256, 'lr': 0.013169244410250311, 'lambda_val': 0.0008433119972386631, 'batch_size': 1529, 'optimizer': 'RMSprop'}. Best is trial 21 with value: 0.06869832331344183.
2026-05-10 02:03:01,254 - optuna.study._optimize - INFO - Trial 53 pruned. 
2026-05-10 02:03:02,698 - optuna.study._optimize - INFO - Trial 54 pruned. 
2026-05-10 02:03:13,733 - optuna.study._optimize - INFO - Trial 55 pruned. 
2026-05-10 02:03:17,723 - optuna.study._optimize - INFO - Trial 56 pruned. 
2026-05-10 02:03:21,883 - optuna.study._optimize - INFO - Trial 57 pruned. 
2026-05-10 02:04:08,885 - optuna.study._optimize - INFO - Trial 58 pruned. 
2026-05-10 02:04:10,163 - optuna.study._optimize - INFO - Trial 59 pruned. 
2026-05-10 02:04:11,663 - optuna.study._optimize - INFO - Trial 60 pruned. 
2026-05-10 02:04:53,164 - optuna.study._optimize - INFO - Trial 61 pruned. 
2026-05-10 02:04:57,148 - optuna.study._optimize - INFO - Trial 62 pruned. 
2026-05-10 02:07:18,724 - optuna.study.study - INFO - Trial 63 finished with value: 0.058642288141139566 and parameters: {'n_layers': 2, 'embedding_dim': 256, 'lr': 0.010230540965315935, 'lambda_val': 0.00032505311743178593, 'batch_size': 1848, 'optimizer': 'RMSprop'}. Best is trial 21 with value: 0.06869832331344183.
2026-05-10 02:07:20,024 - optuna.study._optimize - INFO - Trial 64 pruned. 
2026-05-10 02:07:21,390 - optuna.study._optimize - INFO - Trial 65 pruned. 
2026-05-10 02:07:25,042 - optuna.study._optimize - INFO - Trial 66 pruned. 
2026-05-10 02:07:28,716 - optuna.study._optimize - INFO - Trial 67 pruned. 
2026-05-10 02:07:31,755 - optuna.study._optimize - INFO - Trial 68 pruned. 
2026-05-10 02:07:33,521 - optuna.study._optimize - INFO - Trial 69 pruned. 
2026-05-10 02:07:35,036 - optuna.study._optimize - INFO - Trial 70 pruned. 
2026-05-10 02:07:58,120 - optuna.study._optimize - INFO - Trial 71 pruned. 
2026-05-10 02:10:16,646 - optuna.study.study - INFO - Trial 72 finished with value: 0.05785308498989108 and parameters: {'n_layers': 2, 'embedding_dim': 256, 'lr': 0.01096625828659497, 'lambda_val': 0.0002689063975953998, 'batch_size': 2060, 'optimizer': 'RMSprop'}. Best is trial 21 with value: 0.06869832331344183.
2026-05-10 02:12:29,123 - optuna.study.study - INFO - Trial 73 finished with value: 0.05973275885897822 and parameters: {'n_layers': 2, 'embedding_dim': 256, 'lr': 0.008427909137907169, 'lambda_val': 0.0005743087867745999, 'batch_size': 2245, 'optimizer': 'RMSprop'}. Best is trial 21 with value: 0.06869832331344183.
2026-05-10 02:12:30,588 - optuna.study._optimize - INFO - Trial 74 pruned. 
2026-05-10 02:12:31,922 - optuna.study._optimize - INFO - Trial 75 pruned. 
2026-05-10 02:12:33,234 - optuna.study._optimize - INFO - Trial 76 pruned. 
2026-05-10 02:12:34,557 - optuna.study._optimize - INFO - Trial 77 pruned. 
2026-05-10 02:12:36,057 - optuna.study._optimize - INFO - Trial 78 pruned. 
2026-05-10 02:12:37,540 - optuna.study._optimize - INFO - Trial 79 pruned. 
2026-05-10 02:12:39,427 - optuna.study._optimize - INFO - Trial 80 pruned. 
2026-05-10 02:12:45,294 - optuna.study._optimize - INFO - Trial 81 pruned. 
2026-05-10 02:12:49,317 - optuna.study._optimize - INFO - Trial 82 pruned. 
2026-05-10 02:12:53,086 - optuna.study._optimize - INFO - Trial 83 pruned. 
2026-05-10 02:12:55,649 - optuna.study._optimize - INFO - Trial 84 pruned. 
2026-05-10 02:12:57,105 - optuna.study._optimize - INFO - Trial 85 pruned. 
2026-05-10 02:13:01,453 - optuna.study._optimize - INFO - Trial 86 pruned. 
2026-05-10 02:13:03,020 - optuna.study._optimize - INFO - Trial 87 pruned. 
2026-05-10 02:13:04,631 - optuna.study._optimize - INFO - Trial 88 pruned. 
2026-05-10 02:13:06,185 - optuna.study._optimize - INFO - Trial 89 pruned. 
2026-05-10 02:13:07,597 - optuna.study._optimize - INFO - Trial 90 pruned. 
2026-05-10 02:13:14,323 - optuna.study._optimize - INFO - Trial 91 pruned. 
2026-05-10 02:13:21,495 - optuna.study._optimize - INFO - Trial 92 pruned. 
2026-05-10 02:13:26,149 - optuna.study._optimize - INFO - Trial 93 pruned. 
2026-05-10 02:13:48,063 - optuna.study._optimize - INFO - Trial 94 pruned. 
2026-05-10 02:13:49,541 - optuna.study._optimize - INFO - Trial 95 pruned. 
2026-05-10 02:13:54,033 - optuna.study._optimize - INFO - Trial 96 pruned. 
2026-05-10 02:13:57,028 - optuna.study._optimize - INFO - Trial 97 pruned. 
2026-05-10 02:14:06,263 - optuna.study._optimize - INFO - Trial 98 pruned. 
2026-05-10 02:14:10,164 - optuna.study._optimize - INFO - Trial 99 pruned. 
2026-05-10 02:15:29,044 - root - INFO - **** Training e_1M_1c1dcs
2026-05-10 02:15:29,044 - root - INFO -   ** 1-Dominant stats:
2026-05-10 02:15:29,044 - root - INFO -   ** Finding the dominant set:
2026-05-10 02:48:39,230 - root - INFO -   ** Getting the trainable edges:
2026-05-10 02:48:39,247 - helper_functions - INFO -      Number of nodes: 4553
2026-05-10 02:48:39,247 - helper_functions - INFO -      Ratio: 0.4709837591807179
2026-05-10 02:48:39,247 - helper_functions - INFO -      Number of unique users: 2947
2026-05-10 02:48:39,247 - helper_functions - INFO -      Number of unique items: 1606
2026-05-10 02:48:39,247 - helper_functions - INFO -      Total dominant set edge: 209076
2026-05-10 02:48:39,247 - helper_functions - INFO -      Trainable edges: 167260.80000000002
2026-05-10 02:48:39,326 - root - INFO -   **** Getting 209076 dominant set edges
2026-05-10 02:48:39,473 - optuna.storages._rdb.storage - INFO - A new study created in RDB with name: Study_e_1M_1c1dcs
2026-05-10 02:50:05,963 - optuna.study.study - INFO - Trial 0 finished with value: 0.008290778097573564 and parameters: {'n_layers': 3, 'embedding_dim': 256, 'lr': 0.0019118130589788017, 'lambda_val': 0.04483780144397969, 'batch_size': 835, 'optimizer': 'Adam'}. Best is trial 0 with value: 0.008290778097573564.
2026-05-10 02:51:04,513 - optuna.study.study - INFO - Trial 1 finished with value: 0.06395544987133146 and parameters: {'n_layers': 1, 'embedding_dim': 256, 'lr': 0.0017064243947338825, 'lambda_val': 4.6775409147793504e-06, 'batch_size': 660, 'optimizer': 'RMSprop'}. Best is trial 1 with value: 0.06395544987133146.
2026-05-10 02:51:50,705 - optuna.study.study - INFO - Trial 2 finished with value: 0.006808025811104267 and parameters: {'n_layers': 1, 'embedding_dim': 64, 'lr': 2.0460431445943253e-05, 'lambda_val': 0.0014090219067156168, 'batch_size': 1635, 'optimizer': 'RMSprop'}. Best is trial 1 with value: 0.06395544987133146.
2026-05-10 02:52:37,996 - optuna.study.study - INFO - Trial 3 finished with value: 0.0284254291144747 and parameters: {'n_layers': 1, 'embedding_dim': 32, 'lr': 0.0081839544726064, 'lambda_val': 5.460011388414481e-05, 'batch_size': 3974, 'optimizer': 'Adam'}. Best is trial 1 with value: 0.06395544987133146.
2026-05-10 02:53:23,583 - optuna.study.study - INFO - Trial 4 finished with value: 0.005564273154363937 and parameters: {'n_layers': 1, 'embedding_dim': 32, 'lr': 0.022174411135819642, 'lambda_val': 0.00015903222434655187, 'batch_size': 3714, 'optimizer': 'SGD'}. Best is trial 1 with value: 0.06395544987133146.
2026-05-10 02:53:24,971 - optuna.study._optimize - INFO - Trial 5 pruned. 
2026-05-10 02:53:26,327 - optuna.study._optimize - INFO - Trial 6 pruned. 
2026-05-10 02:53:29,260 - optuna.study._optimize - INFO - Trial 7 pruned. 
2026-05-10 02:53:30,672 - optuna.study._optimize - INFO - Trial 8 pruned. 
2026-05-10 02:53:31,983 - optuna.study._optimize - INFO - Trial 9 pruned. 
2026-05-10 02:54:43,526 - optuna.study.study - INFO - Trial 10 finished with value: 0.012128043053711766 and parameters: {'n_layers': 2, 'embedding_dim': 256, 'lr': 0.08284413478028008, 'lambda_val': 1.6177911848330736e-06, 'batch_size': 550, 'optimizer': 'RMSprop'}. Best is trial 1 with value: 0.06395544987133146.
2026-05-10 02:54:45,279 - optuna.study._optimize - INFO - Trial 11 pruned. 
2026-05-10 02:55:44,981 - optuna.study.study - INFO - Trial 12 finished with value: 0.020583605037548625 and parameters: {'n_layers': 1, 'embedding_dim': 256, 'lr': 0.011515171571451143, 'lambda_val': 3.3095693031937607e-06, 'batch_size': 3068, 'optimizer': 'RMSprop'}. Best is trial 1 with value: 0.06395544987133146.
2026-05-10 02:55:47,309 - optuna.study._optimize - INFO - Trial 13 pruned. 
2026-05-10 02:56:42,235 - optuna.study.study - INFO - Trial 14 finished with value: 0.02923370736240106 and parameters: {'n_layers': 2, 'embedding_dim': 64, 'lr': 0.011283314828965491, 'lambda_val': 7.736258986774953e-05, 'batch_size': 3277, 'optimizer': 'RMSprop'}. Best is trial 1 with value: 0.06395544987133146.
2026-05-10 02:56:43,560 - optuna.study._optimize - INFO - Trial 15 pruned. 
2026-05-10 02:56:46,476 - optuna.study._optimize - INFO - Trial 16 pruned. 
2026-05-10 02:56:48,886 - optuna.study._optimize - INFO - Trial 17 pruned. 
2026-05-10 02:57:41,827 - optuna.study.study - INFO - Trial 18 finished with value: 0.04003709620195175 and parameters: {'n_layers': 2, 'embedding_dim': 64, 'lr': 0.008129386436022568, 'lambda_val': 3.954233444178343e-05, 'batch_size': 942, 'optimizer': 'RMSprop'}. Best is trial 1 with value: 0.06395544987133146.
2026-05-10 02:57:43,192 - optuna.study._optimize - INFO - Trial 19 pruned. 
2026-05-10 02:57:44,852 - optuna.study._optimize - INFO - Trial 20 pruned. 
2026-05-10 02:57:48,468 - optuna.study._optimize - INFO - Trial 21 pruned. 
2026-05-10 02:57:50,854 - optuna.study._optimize - INFO - Trial 22 pruned. 
2026-05-10 02:58:47,188 - optuna.study.study - INFO - Trial 23 finished with value: 0.029125619730098043 and parameters: {'n_layers': 2, 'embedding_dim': 64, 'lr': 0.0095862192335456, 'lambda_val': 3.2935630822074565e-05, 'batch_size': 2609, 'optimizer': 'RMSprop'}. Best is trial 1 with value: 0.06395544987133146.
2026-05-10 02:58:48,565 - optuna.study._optimize - INFO - Trial 24 pruned. 
2026-05-10 02:58:49,921 - optuna.study._optimize - INFO - Trial 25 pruned. 
2026-05-10 02:58:52,330 - optuna.study._optimize - INFO - Trial 26 pruned. 
2026-05-10 03:00:06,947 - optuna.study.study - INFO - Trial 27 finished with value: 0.053430247304332816 and parameters: {'n_layers': 2, 'embedding_dim': 256, 'lr': 0.006320520662503036, 'lambda_val': 0.00047279427659267017, 'batch_size': 678, 'optimizer': 'RMSprop'}. Best is trial 1 with value: 0.06395544987133146.
2026-05-10 03:00:08,214 - optuna.study._optimize - INFO - Trial 28 pruned. 
2026-05-10 03:00:09,619 - optuna.study._optimize - INFO - Trial 29 pruned. 
2026-05-10 03:00:11,009 - optuna.study._optimize - INFO - Trial 30 pruned. 
2026-05-10 03:00:15,233 - optuna.study._optimize - INFO - Trial 31 pruned. 
2026-05-10 03:00:16,578 - optuna.study._optimize - INFO - Trial 32 pruned. 
2026-05-10 03:01:29,647 - optuna.study.study - INFO - Trial 33 finished with value: 0.049366245763162286 and parameters: {'n_layers': 2, 'embedding_dim': 256, 'lr': 0.006608503047100651, 'lambda_val': 7.861977591365176e-05, 'batch_size': 581, 'optimizer': 'RMSprop'}. Best is trial 1 with value: 0.06395544987133146.
2026-05-10 03:01:30,957 - optuna.study._optimize - INFO - Trial 34 pruned. 
2026-05-10 03:01:32,258 - optuna.study._optimize - INFO - Trial 35 pruned. 
2026-05-10 03:01:33,648 - optuna.study._optimize - INFO - Trial 36 pruned. 
2026-05-10 03:03:17,690 - optuna.study.study - INFO - Trial 37 finished with value: 0.04304689286815436 and parameters: {'n_layers': 4, 'embedding_dim': 256, 'lr': 0.007342114166064334, 'lambda_val': 8.179667001828403e-05, 'batch_size': 875, 'optimizer': 'RMSprop'}. Best is trial 1 with value: 0.06395544987133146.
2026-05-10 03:03:19,269 - optuna.study._optimize - INFO - Trial 38 pruned. 
2026-05-10 03:03:20,626 - optuna.study._optimize - INFO - Trial 39 pruned. 
2026-05-10 03:03:24,056 - optuna.study._optimize - INFO - Trial 40 pruned. 
2026-05-10 03:05:10,522 - optuna.study.study - INFO - Trial 41 finished with value: 0.0442632941903681 and parameters: {'n_layers': 4, 'embedding_dim': 256, 'lr': 0.007992160949439261, 'lambda_val': 7.42841086012119e-05, 'batch_size': 956, 'optimizer': 'RMSprop'}. Best is trial 1 with value: 0.06395544987133146.
2026-05-10 03:05:12,047 - optuna.study._optimize - INFO - Trial 42 pruned. 
2026-05-10 03:05:15,648 - optuna.study._optimize - INFO - Trial 43 pruned. 
2026-05-10 03:05:17,033 - optuna.study._optimize - INFO - Trial 44 pruned. 
2026-05-10 03:05:19,545 - optuna.study._optimize - INFO - Trial 45 pruned. 
2026-05-10 03:05:20,863 - optuna.study._optimize - INFO - Trial 46 pruned. 
2026-05-10 03:05:22,280 - optuna.study._optimize - INFO - Trial 47 pruned. 
2026-05-10 03:05:23,747 - optuna.study._optimize - INFO - Trial 48 pruned. 
2026-05-10 03:05:25,353 - optuna.study._optimize - INFO - Trial 49 pruned. 
2026-05-10 03:05:27,577 - optuna.study._optimize - INFO - Trial 50 pruned. 
2026-05-10 03:06:40,923 - optuna.study.study - INFO - Trial 51 finished with value: 0.04003047067850037 and parameters: {'n_layers': 2, 'embedding_dim': 256, 'lr': 0.007806515228656163, 'lambda_val': 2.9266543310214724e-05, 'batch_size': 1045, 'optimizer': 'RMSprop'}. Best is trial 1 with value: 0.06395544987133146.
2026-05-10 03:07:54,065 - optuna.study.study - INFO - Trial 52 finished with value: 0.03925319813207294 and parameters: {'n_layers': 2, 'embedding_dim': 256, 'lr': 0.009912436913487267, 'lambda_val': 5.228716600019957e-05, 'batch_size': 837, 'optimizer': 'RMSprop'}. Best is trial 1 with value: 0.06395544987133146.
2026-05-10 03:07:55,425 - optuna.study._optimize - INFO - Trial 53 pruned. 
2026-05-10 03:07:57,899 - optuna.study._optimize - INFO - Trial 54 pruned. 
2026-05-10 03:08:01,057 - optuna.study._optimize - INFO - Trial 55 pruned. 
