2026-05-10 10:30:24,833 - optuna.study._optimize - INFO - Trial 99 pruned. 
2026-05-10 10:31:18,706 - root - INFO -   **** Training e_1M_1c3dcs_rand4
2026-05-10 10:31:18,767 - root - INFO -   **** Getting 212879/669182 random edges
2026-05-10 10:31:20,024 - optuna.storages._rdb.storage - INFO - A new study created in RDB with name: Study_e_1M_1c3dcs_rand4
2026-05-10 10:32:11,264 - optuna.study.study - INFO - Trial 0 finished with value: 0.021169622846096234 and parameters: {'n_layers': 2, 'embedding_dim': 64, 'lr': 0.006431345127286315, 'lambda_val': 7.271891673480413e-06, 'batch_size': 2601, 'optimizer': 'RMSprop'}. Best is trial 0 with value: 0.021169622846096234.
2026-05-10 10:33:07,312 - optuna.study.study - INFO - Trial 1 finished with value: 0.005493354132420395 and parameters: {'n_layers': 2, 'embedding_dim': 128, 'lr': 0.0027726622851203114, 'lambda_val': 2.6656793338284328e-05, 'batch_size': 3567, 'optimizer': 'SGD'}. Best is trial 0 with value: 0.021169622846096234.
2026-05-10 10:34:20,337 - optuna.study.study - INFO - Trial 2 finished with value: 0.006124453989162264 and parameters: {'n_layers': 4, 'embedding_dim': 128, 'lr': 0.001528479486099364, 'lambda_val': 0.01204520569643708, 'batch_size': 2436, 'optimizer': 'RMSprop'}. Best is trial 0 with value: 0.021169622846096234.
2026-05-10 10:35:19,399 - optuna.study.study - INFO - Trial 3 finished with value: 0.03011674761486922 and parameters: {'n_layers': 1, 'embedding_dim': 256, 'lr': 0.00021504511085354756, 'lambda_val': 4.204561763963388e-05, 'batch_size': 2741, 'optimizer': 'RMSprop'}. Best is trial 3 with value: 0.03011674761486922.
2026-05-10 10:36:12,522 - optuna.study.study - INFO - Trial 4 finished with value: 0.017788465706374275 and parameters: {'n_layers': 4, 'embedding_dim': 32, 'lr': 0.00012007367136940399, 'lambda_val': 0.000973030386749878, 'batch_size': 1811, 'optimizer': 'RMSprop'}. Best is trial 3 with value: 0.03011674761486922.
2026-05-10 10:36:13,707 - optuna.study._optimize - INFO - Trial 5 pruned. 
2026-05-10 10:36:16,212 - optuna.study._optimize - INFO - Trial 6 pruned. 
2026-05-10 10:36:17,973 - optuna.study._optimize - INFO - Trial 7 pruned. 
2026-05-10 10:36:20,400 - optuna.study._optimize - INFO - Trial 8 pruned. 
2026-05-10 10:36:21,575 - optuna.study._optimize - INFO - Trial 9 pruned. 
2026-05-10 10:36:22,828 - optuna.study._optimize - INFO - Trial 10 pruned. 
2026-05-10 10:36:29,080 - optuna.study._optimize - INFO - Trial 11 pruned. 
2026-05-10 10:36:30,398 - optuna.study._optimize - INFO - Trial 12 pruned. 
2026-05-10 10:36:34,788 - optuna.study._optimize - INFO - Trial 13 pruned. 
2026-05-10 10:36:36,097 - optuna.study._optimize - INFO - Trial 14 pruned. 
2026-05-10 10:36:39,522 - optuna.study._optimize - INFO - Trial 15 pruned. 
2026-05-10 10:36:40,775 - optuna.study._optimize - INFO - Trial 16 pruned. 
2026-05-10 10:37:39,314 - optuna.study.study - INFO - Trial 17 finished with value: 0.021045504387773615 and parameters: {'n_layers': 1, 'embedding_dim': 256, 'lr': 0.00526780554828704, 'lambda_val': 6.653827061528993e-06, 'batch_size': 2612, 'optimizer': 'RMSprop'}. Best is trial 3 with value: 0.03011674761486922.
2026-05-10 10:37:43,726 - optuna.study._optimize - INFO - Trial 18 pruned. 
2026-05-10 10:37:44,934 - optuna.study._optimize - INFO - Trial 19 pruned. 
2026-05-10 10:37:46,264 - optuna.study._optimize - INFO - Trial 20 pruned. 
2026-05-10 10:38:44,904 - optuna.study.study - INFO - Trial 21 finished with value: 0.018195641987188246 and parameters: {'n_layers': 1, 'embedding_dim': 256, 'lr': 0.006506411088015258, 'lambda_val': 6.352261738887482e-06, 'batch_size': 2563, 'optimizer': 'RMSprop'}. Best is trial 3 with value: 0.03011674761486922.
2026-05-10 10:38:46,679 - optuna.study._optimize - INFO - Trial 22 pruned. 
2026-05-10 10:38:52,498 - optuna.study._optimize - INFO - Trial 23 pruned. 
2026-05-10 10:38:57,268 - optuna.study._optimize - INFO - Trial 24 pruned. 
2026-05-10 10:38:58,665 - optuna.study._optimize - INFO - Trial 25 pruned. 
2026-05-10 10:38:59,917 - optuna.study._optimize - INFO - Trial 26 pruned. 
2026-05-10 10:39:03,420 - optuna.study._optimize - INFO - Trial 27 pruned. 
2026-05-10 10:39:06,179 - optuna.study._optimize - INFO - Trial 28 pruned. 
2026-05-10 10:39:07,883 - optuna.study._optimize - INFO - Trial 29 pruned. 
2026-05-10 10:39:09,201 - optuna.study._optimize - INFO - Trial 30 pruned. 
2026-05-10 10:40:07,698 - optuna.study.study - INFO - Trial 31 finished with value: 0.01887323238454445 and parameters: {'n_layers': 1, 'embedding_dim': 256, 'lr': 0.006419172835717782, 'lambda_val': 5.81839994063196e-06, 'batch_size': 2464, 'optimizer': 'RMSprop'}. Best is trial 3 with value: 0.03011674761486922.
2026-05-10 10:40:08,914 - optuna.study._optimize - INFO - Trial 32 pruned. 
2026-05-10 10:40:12,981 - optuna.study._optimize - INFO - Trial 33 pruned. 
2026-05-10 10:40:15,821 - optuna.study._optimize - INFO - Trial 34 pruned. 
2026-05-10 10:40:17,139 - optuna.study._optimize - INFO - Trial 35 pruned. 
2026-05-10 10:41:15,100 - optuna.study.study - INFO - Trial 36 finished with value: 0.01983810713494102 and parameters: {'n_layers': 1, 'embedding_dim': 256, 'lr': 0.006269433789381257, 'lambda_val': 8.597042690181238e-06, 'batch_size': 1732, 'optimizer': 'RMSprop'}. Best is trial 3 with value: 0.03011674761486922.
2026-05-10 10:41:16,404 - optuna.study._optimize - INFO - Trial 37 pruned. 
2026-05-10 10:41:17,695 - optuna.study._optimize - INFO - Trial 38 pruned. 
2026-05-10 10:41:19,046 - optuna.study._optimize - INFO - Trial 39 pruned. 
2026-05-10 10:41:20,332 - optuna.study._optimize - INFO - Trial 40 pruned. 
2026-05-10 10:42:21,238 - optuna.study.study - INFO - Trial 41 finished with value: 0.019480710124610712 and parameters: {'n_layers': 1, 'embedding_dim': 256, 'lr': 0.006320886057544816, 'lambda_val': 6.703707466209151e-06, 'batch_size': 2342, 'optimizer': 'RMSprop'}. Best is trial 3 with value: 0.03011674761486922.
2026-05-10 10:42:23,806 - optuna.study._optimize - INFO - Trial 42 pruned. 
2026-05-10 10:43:22,329 - optuna.study.study - INFO - Trial 43 finished with value: 0.02380075275276108 and parameters: {'n_layers': 1, 'embedding_dim': 256, 'lr': 0.004717993716353172, 'lambda_val': 8.955570918893736e-06, 'batch_size': 1831, 'optimizer': 'RMSprop'}. Best is trial 3 with value: 0.03011674761486922.
2026-05-10 10:43:24,742 - optuna.study._optimize - INFO - Trial 44 pruned. 
2026-05-10 10:43:27,004 - optuna.study._optimize - INFO - Trial 45 pruned. 
2026-05-10 10:43:29,684 - optuna.study._optimize - INFO - Trial 46 pruned. 
2026-05-10 10:43:30,937 - optuna.study._optimize - INFO - Trial 47 pruned. 
2026-05-10 10:43:32,244 - optuna.study._optimize - INFO - Trial 48 pruned. 
2026-05-10 10:43:34,749 - optuna.study._optimize - INFO - Trial 49 pruned. 
2026-05-10 10:43:36,241 - optuna.study._optimize - INFO - Trial 50 pruned. 
2026-05-10 10:43:38,991 - optuna.study._optimize - INFO - Trial 51 pruned. 
2026-05-10 10:43:40,443 - optuna.study._optimize - INFO - Trial 52 pruned. 
2026-05-10 10:43:42,946 - optuna.study._optimize - INFO - Trial 53 pruned. 
2026-05-10 10:43:45,329 - optuna.study._optimize - INFO - Trial 54 pruned. 
2026-05-10 10:43:46,570 - optuna.study._optimize - INFO - Trial 55 pruned. 
2026-05-10 10:43:47,860 - optuna.study._optimize - INFO - Trial 56 pruned. 
2026-05-10 10:43:49,189 - optuna.study._optimize - INFO - Trial 57 pruned. 
2026-05-10 10:43:50,496 - optuna.study._optimize - INFO - Trial 58 pruned. 
2026-05-10 10:43:52,346 - optuna.study._optimize - INFO - Trial 59 pruned. 
2026-05-10 10:43:54,617 - optuna.study._optimize - INFO - Trial 60 pruned. 
2026-05-10 10:44:55,477 - optuna.study.study - INFO - Trial 61 finished with value: 0.021835817313500046 and parameters: {'n_layers': 1, 'embedding_dim': 256, 'lr': 0.005897805000800999, 'lambda_val': 5.932554296469701e-06, 'batch_size': 2591, 'optimizer': 'RMSprop'}. Best is trial 3 with value: 0.03011674761486922.
2026-05-10 10:44:58,467 - optuna.study._optimize - INFO - Trial 62 pruned. 
2026-05-10 10:44:59,751 - optuna.study._optimize - INFO - Trial 63 pruned. 
2026-05-10 10:45:58,845 - optuna.study.study - INFO - Trial 64 finished with value: 0.021739115051274436 and parameters: {'n_layers': 1, 'embedding_dim': 256, 'lr': 0.005056601567545515, 'lambda_val': 4.895388826258484e-06, 'batch_size': 2734, 'optimizer': 'RMSprop'}. Best is trial 3 with value: 0.03011674761486922.
2026-05-10 10:46:02,257 - optuna.study._optimize - INFO - Trial 65 pruned. 
2026-05-10 10:47:01,211 - optuna.study.study - INFO - Trial 66 finished with value: 0.021185367230005605 and parameters: {'n_layers': 1, 'embedding_dim': 256, 'lr': 0.004873703893862992, 'lambda_val': 4.161226312393253e-06, 'batch_size': 2958, 'optimizer': 'RMSprop'}. Best is trial 3 with value: 0.03011674761486922.
2026-05-10 10:47:03,551 - optuna.study._optimize - INFO - Trial 67 pruned. 
2026-05-10 10:47:05,051 - optuna.study._optimize - INFO - Trial 68 pruned. 
2026-05-10 10:47:08,167 - optuna.study._optimize - INFO - Trial 69 pruned. 
2026-05-10 10:47:09,431 - optuna.study._optimize - INFO - Trial 70 pruned. 
2026-05-10 10:47:13,076 - optuna.study._optimize - INFO - Trial 71 pruned. 
2026-05-10 10:47:15,581 - optuna.study._optimize - INFO - Trial 72 pruned. 
2026-05-10 10:47:16,926 - optuna.study._optimize - INFO - Trial 73 pruned. 
2026-05-10 10:47:18,410 - optuna.study._optimize - INFO - Trial 74 pruned. 
2026-05-10 10:47:20,803 - optuna.study._optimize - INFO - Trial 75 pruned. 
2026-05-10 10:47:22,089 - optuna.study._optimize - INFO - Trial 76 pruned. 
2026-05-10 10:47:26,143 - optuna.study._optimize - INFO - Trial 77 pruned. 
2026-05-10 10:47:27,407 - optuna.study._optimize - INFO - Trial 78 pruned. 
2026-05-10 10:47:29,921 - optuna.study._optimize - INFO - Trial 79 pruned. 
2026-05-10 10:47:31,305 - optuna.study._optimize - INFO - Trial 80 pruned. 
2026-05-10 10:47:32,646 - optuna.study._optimize - INFO - Trial 81 pruned. 
2026-05-10 10:47:33,986 - optuna.study._optimize - INFO - Trial 82 pruned. 
2026-05-10 10:47:36,380 - optuna.study._optimize - INFO - Trial 83 pruned. 
2026-05-10 10:47:38,896 - optuna.study._optimize - INFO - Trial 84 pruned. 
2026-05-10 10:48:39,766 - optuna.study.study - INFO - Trial 85 finished with value: 0.02426700007010533 and parameters: {'n_layers': 1, 'embedding_dim': 256, 'lr': 0.0042820773497840555, 'lambda_val': 1.6682783217939994e-05, 'batch_size': 2793, 'optimizer': 'RMSprop'}. Best is trial 3 with value: 0.03011674761486922.
2026-05-10 10:48:41,039 - optuna.study._optimize - INFO - Trial 86 pruned. 
2026-05-10 10:48:43,558 - optuna.study._optimize - INFO - Trial 87 pruned. 
2026-05-10 10:48:45,331 - optuna.study._optimize - INFO - Trial 88 pruned. 
2026-05-10 10:48:46,671 - optuna.study._optimize - INFO - Trial 89 pruned. 
2026-05-10 10:48:47,945 - optuna.study._optimize - INFO - Trial 90 pruned. 
2026-05-10 10:48:49,323 - optuna.study._optimize - INFO - Trial 91 pruned. 
2026-05-10 10:48:50,585 - optuna.study._optimize - INFO - Trial 92 pruned. 
2026-05-10 10:48:53,214 - optuna.study._optimize - INFO - Trial 93 pruned. 
2026-05-10 10:48:55,792 - optuna.study._optimize - INFO - Trial 94 pruned. 
2026-05-10 10:48:57,841 - optuna.study._optimize - INFO - Trial 95 pruned. 
2026-05-10 10:49:57,506 - optuna.study.study - INFO - Trial 96 finished with value: 0.019798589189885318 and parameters: {'n_layers': 1, 'embedding_dim': 256, 'lr': 0.006174573075754811, 'lambda_val': 1.512383332031915e-05, 'batch_size': 2599, 'optimizer': 'RMSprop'}. Best is trial 3 with value: 0.03011674761486922.
2026-05-10 10:49:58,900 - optuna.study._optimize - INFO - Trial 97 pruned. 
2026-05-10 10:50:00,219 - optuna.study._optimize - INFO - Trial 98 pruned. 
2026-05-10 10:50:01,481 - optuna.study._optimize - INFO - Trial 99 pruned. 
2026-05-10 10:50:55,935 - root - INFO -   **** Training e_1M_1c3dcs_rand5
2026-05-10 10:50:56,001 - root - INFO -   **** Getting 212879/669182 random edges
2026-05-10 10:50:56,302 - optuna.storages._rdb.storage - INFO - A new study created in RDB with name: Study_e_1M_1c3dcs_rand5
2026-05-10 10:51:55,809 - optuna.study.study - INFO - Trial 0 finished with value: 0.005762677151349977 and parameters: {'n_layers': 3, 'embedding_dim': 96, 'lr': 0.01939176010610862, 'lambda_val': 3.221171809474802e-05, 'batch_size': 3926, 'optimizer': 'SGD'}. Best is trial 0 with value: 0.005762677151349977.
2026-05-10 10:53:02,377 - optuna.study.study - INFO - Trial 1 finished with value: 0.021396761210388703 and parameters: {'n_layers': 3, 'embedding_dim': 128, 'lr': 1.7528864210714214e-05, 'lambda_val': 0.00048638669353233296, 'batch_size': 2334, 'optimizer': 'Adam'}. Best is trial 1 with value: 0.021396761210388703.
2026-05-10 10:54:29,477 - optuna.study.study - INFO - Trial 2 finished with value: 0.008733958058124889 and parameters: {'n_layers': 3, 'embedding_dim': 256, 'lr': 0.05690601690426259, 'lambda_val': 1.1788809515630113e-05, 'batch_size': 2044, 'optimizer': 'Adam'}. Best is trial 1 with value: 0.021396761210388703.
2026-05-10 10:55:20,691 - optuna.study.study - INFO - Trial 3 finished with value: 0.02307353097459698 and parameters: {'n_layers': 3, 'embedding_dim': 32, 'lr': 0.002235725321290831, 'lambda_val': 2.0442750778432938e-05, 'batch_size': 3543, 'optimizer': 'RMSprop'}. Best is trial 3 with value: 0.02307353097459698.
2026-05-10 10:56:35,246 - optuna.study.study - INFO - Trial 4 finished with value: 0.011568325846781621 and parameters: {'n_layers': 2, 'embedding_dim': 256, 'lr': 0.00427373018599088, 'lambda_val': 0.02738398324045466, 'batch_size': 3323, 'optimizer': 'Adam'}. Best is trial 3 with value: 0.02307353097459698.
2026-05-10 10:56:36,453 - optuna.study._optimize - INFO - Trial 5 pruned. 
2026-05-10 10:56:37,706 - optuna.study._optimize - INFO - Trial 6 pruned. 
2026-05-10 10:56:40,365 - optuna.study._optimize - INFO - Trial 7 pruned. 
2026-05-10 10:56:41,595 - optuna.study._optimize - INFO - Trial 8 pruned. 
2026-05-10 10:56:43,970 - optuna.study._optimize - INFO - Trial 9 pruned. 
2026-05-10 10:57:37,768 - optuna.study.study - INFO - Trial 10 finished with value: 0.006028642215396466 and parameters: {'n_layers': 4, 'embedding_dim': 32, 'lr': 0.00035187493187793095, 'lambda_val': 1.5288962839229583e-06, 'batch_size': 2755, 'optimizer': 'RMSprop'}. Best is trial 3 with value: 0.02307353097459698.
2026-05-10 10:57:39,018 - optuna.study._optimize - INFO - Trial 11 pruned. 
2026-05-10 10:57:41,291 - optuna.study._optimize - INFO - Trial 12 pruned. 
2026-05-10 10:57:42,642 - optuna.study._optimize - INFO - Trial 13 pruned. 
2026-05-10 10:57:44,094 - optuna.study._optimize - INFO - Trial 14 pruned. 
2026-05-10 10:57:45,530 - optuna.study._optimize - INFO - Trial 15 pruned. 
2026-05-10 10:57:46,937 - optuna.study._optimize - INFO - Trial 16 pruned. 
2026-05-10 10:57:48,417 - optuna.study._optimize - INFO - Trial 17 pruned. 
2026-05-10 10:57:50,067 - optuna.study._optimize - INFO - Trial 18 pruned. 
2026-05-10 10:57:51,412 - optuna.study._optimize - INFO - Trial 19 pruned. 
2026-05-10 10:57:52,686 - optuna.study._optimize - INFO - Trial 20 pruned. 
2026-05-10 10:57:54,061 - optuna.study._optimize - INFO - Trial 21 pruned. 
2026-05-10 10:57:55,366 - optuna.study._optimize - INFO - Trial 22 pruned. 
2026-05-10 10:57:56,674 - optuna.study._optimize - INFO - Trial 23 pruned. 
2026-05-10 10:57:58,014 - optuna.study._optimize - INFO - Trial 24 pruned. 
2026-05-10 10:57:59,387 - optuna.study._optimize - INFO - Trial 25 pruned. 
2026-05-10 10:58:00,662 - optuna.study._optimize - INFO - Trial 26 pruned. 
2026-05-10 10:58:02,470 - optuna.study._optimize - INFO - Trial 27 pruned. 
2026-05-10 10:58:03,883 - optuna.study._optimize - INFO - Trial 28 pruned. 
2026-05-10 10:58:05,373 - optuna.study._optimize - INFO - Trial 29 pruned. 
2026-05-10 10:58:06,731 - optuna.study._optimize - INFO - Trial 30 pruned. 
2026-05-10 10:59:35,502 - optuna.study.study - INFO - Trial 31 finished with value: 0.010142461394167829 and parameters: {'n_layers': 3, 'embedding_dim': 256, 'lr': 0.04044243883312528, 'lambda_val': 1.3102603225388702e-05, 'batch_size': 2310, 'optimizer': 'Adam'}. Best is trial 3 with value: 0.02307353097459698.
2026-05-10 10:59:41,929 - optuna.study._optimize - INFO - Trial 32 pruned. 
2026-05-10 11:01:10,739 - optuna.study.study - INFO - Trial 33 finished with value: 0.014085489080672862 and parameters: {'n_layers': 3, 'embedding_dim': 256, 'lr': 0.024666152335016095, 'lambda_val': 5.384532390413428e-06, 'batch_size': 2091, 'optimizer': 'Adam'}. Best is trial 3 with value: 0.02307353097459698.
2026-05-10 11:01:12,011 - optuna.study._optimize - INFO - Trial 34 pruned. 
2026-05-10 11:02:20,449 - optuna.study.study - INFO - Trial 35 finished with value: 0.011740228609709536 and parameters: {'n_layers': 4, 'embedding_dim': 96, 'lr': 0.02308716961271276, 'lambda_val': 7.500704519931924e-06, 'batch_size': 2531, 'optimizer': 'Adam'}. Best is trial 3 with value: 0.02307353097459698.
2026-05-10 11:03:28,639 - optuna.study.study - INFO - Trial 36 finished with value: 0.013138502243676787 and parameters: {'n_layers': 4, 'embedding_dim': 96, 'lr': 0.022191512588248623, 'lambda_val': 6.6704248311768364e-06, 'batch_size': 2564, 'optimizer': 'Adam'}. Best is trial 3 with value: 0.02307353097459698.
2026-05-10 11:04:34,939 - optuna.study.study - INFO - Trial 37 finished with value: 0.011819454582350397 and parameters: {'n_layers': 4, 'embedding_dim': 96, 'lr': 0.06045903419828507, 'lambda_val': 3.4966049392246644e-05, 'batch_size': 2101, 'optimizer': 'Adam'}. Best is trial 3 with value: 0.02307353097459698.
2026-05-10 11:04:37,518 - optuna.study._optimize - INFO - Trial 38 pruned. 
2026-05-10 11:05:44,173 - optuna.study.study - INFO - Trial 39 finished with value: 0.01394380869912201 and parameters: {'n_layers': 4, 'embedding_dim': 96, 'lr': 0.03672893890569318, 'lambda_val': 6.245596451156535e-05, 'batch_size': 1760, 'optimizer': 'RMSprop'}. Best is trial 3 with value: 0.02307353097459698.
2026-05-10 11:06:57,745 - optuna.study.study - INFO - Trial 40 finished with value: 0.016656561603593835 and parameters: {'n_layers': 4, 'embedding_dim': 128, 'lr': 0.032744052797796484, 'lambda_val': 6.942663639843541e-05, 'batch_size': 1002, 'optimizer': 'RMSprop'}. Best is trial 3 with value: 0.02307353097459698.
2026-05-10 11:08:11,377 - optuna.study.study - INFO - Trial 41 finished with value: 0.015568863863091252 and parameters: {'n_layers': 4, 'embedding_dim': 128, 'lr': 0.042645828649141446, 'lambda_val': 5.1489522759443475e-05, 'batch_size': 519, 'optimizer': 'RMSprop'}. Best is trial 3 with value: 0.02307353097459698.
2026-05-10 11:09:25,637 - optuna.study.study - INFO - Trial 42 finished with value: 0.021032045494438083 and parameters: {'n_layers': 4, 'embedding_dim': 128, 'lr': 0.04859163471585241, 'lambda_val': 0.0001955189631784548, 'batch_size': 529, 'optimizer': 'RMSprop'}. Best is trial 3 with value: 0.02307353097459698.
2026-05-10 11:10:38,829 - optuna.study.study - INFO - Trial 43 finished with value: 0.019987838607097644 and parameters: {'n_layers': 4, 'embedding_dim': 128, 'lr': 0.0577553726688537, 'lambda_val': 0.0001881883565517066, 'batch_size': 575, 'optimizer': 'RMSprop'}. Best is trial 3 with value: 0.02307353097459698.
2026-05-10 11:11:52,587 - optuna.study.study - INFO - Trial 44 finished with value: 0.019643814597181505 and parameters: {'n_layers': 4, 'embedding_dim': 128, 'lr': 0.07020830978038763, 'lambda_val': 0.00021855501688930104, 'batch_size': 861, 'optimizer': 'RMSprop'}. Best is trial 3 with value: 0.02307353097459698.
2026-05-10 11:13:09,292 - optuna.study.study - INFO - Trial 45 finished with value: 0.027023940726041674 and parameters: {'n_layers': 4, 'embedding_dim': 128, 'lr': 0.07195680564324397, 'lambda_val': 0.0005903344222653915, 'batch_size': 537, 'optimizer': 'RMSprop'}. Best is trial 45 with value: 0.027023940726041674.
2026-05-10 11:13:10,485 - optuna.study._optimize - INFO - Trial 46 pruned. 
2026-05-10 11:14:25,476 - optuna.study.study - INFO - Trial 47 finished with value: 0.02517678601983835 and parameters: {'n_layers': 4, 'embedding_dim': 128, 'lr': 0.0994217605399599, 'lambda_val': 0.0005914153770037288, 'batch_size': 1149, 'optimizer': 'RMSprop'}. Best is trial 45 with value: 0.027023940726041674.
2026-05-10 11:14:26,903 - optuna.study._optimize - INFO - Trial 48 pruned. 
2026-05-10 11:15:41,336 - optuna.study.study - INFO - Trial 49 finished with value: 0.025798572752173548 and parameters: {'n_layers': 4, 'embedding_dim': 128, 'lr': 0.09697160172934248, 'lambda_val': 0.0013245042403825004, 'batch_size': 726, 'optimizer': 'RMSprop'}. Best is trial 45 with value: 0.027023940726041674.
2026-05-10 11:16:47,257 - optuna.study.study - INFO - Trial 50 finished with value: 0.02795778962203033 and parameters: {'n_layers': 3, 'embedding_dim': 128, 'lr': 0.09620289076126147, 'lambda_val': 0.0014625351971937325, 'batch_size': 756, 'optimizer': 'RMSprop'}. Best is trial 50 with value: 0.02795778962203033.
2026-05-10 11:17:55,505 - optuna.study.study - INFO - Trial 51 finished with value: 0.027169837899598946 and parameters: {'n_layers': 3, 'embedding_dim': 128, 'lr': 0.0886461934800367, 'lambda_val': 0.001415981165516545, 'batch_size': 765, 'optimizer': 'RMSprop'}. Best is trial 50 with value: 0.02795778962203033.
2026-05-10 11:18:57,752 - optuna.study.study - INFO - Trial 52 finished with value: 0.028332801156331498 and parameters: {'n_layers': 3, 'embedding_dim': 128, 'lr': 0.08730889346308314, 'lambda_val': 0.001647242738517073, 'batch_size': 842, 'optimizer': 'RMSprop'}. Best is trial 52 with value: 0.028332801156331498.
2026-05-10 11:20:04,177 - optuna.study.study - INFO - Trial 53 finished with value: 0.03021362956077028 and parameters: {'n_layers': 3, 'embedding_dim': 128, 'lr': 0.07895645104105763, 'lambda_val': 0.0013895082766379179, 'batch_size': 747, 'optimizer': 'RMSprop'}. Best is trial 53 with value: 0.03021362956077028.
