2026-05-10 11:21:09,846 - optuna.study.study - INFO - Trial 54 finished with value: 0.027276527468055176 and parameters: {'n_layers': 3, 'embedding_dim': 128, 'lr': 0.06593659189233986, 'lambda_val': 0.001427717272997179, 'batch_size': 716, 'optimizer': 'RMSprop'}. Best is trial 53 with value: 0.03021362956077028.
2026-05-10 11:22:15,489 - optuna.study.study - INFO - Trial 55 finished with value: 0.027600757183963757 and parameters: {'n_layers': 3, 'embedding_dim': 128, 'lr': 0.05655443957426423, 'lambda_val': 0.003448883380325932, 'batch_size': 744, 'optimizer': 'RMSprop'}. Best is trial 53 with value: 0.03021362956077028.
2026-05-10 11:22:16,838 - optuna.study._optimize - INFO - Trial 56 pruned. 
2026-05-10 11:22:18,235 - optuna.study._optimize - INFO - Trial 57 pruned. 
2026-05-10 11:22:19,805 - optuna.study._optimize - INFO - Trial 58 pruned. 
2026-05-10 11:23:25,937 - optuna.study.study - INFO - Trial 59 finished with value: 0.026212932458002353 and parameters: {'n_layers': 3, 'embedding_dim': 128, 'lr': 0.0663193050926463, 'lambda_val': 0.003087195997053331, 'batch_size': 872, 'optimizer': 'RMSprop'}. Best is trial 53 with value: 0.03021362956077028.
2026-05-10 11:23:27,299 - optuna.study._optimize - INFO - Trial 60 pruned. 
2026-05-10 11:24:33,753 - optuna.study.study - INFO - Trial 61 finished with value: 0.028125519643621706 and parameters: {'n_layers': 3, 'embedding_dim': 128, 'lr': 0.07471947581082251, 'lambda_val': 0.0018326667934019036, 'batch_size': 681, 'optimizer': 'RMSprop'}. Best is trial 53 with value: 0.03021362956077028.
2026-05-10 11:24:34,981 - optuna.study._optimize - INFO - Trial 62 pruned. 
2026-05-10 11:24:36,276 - optuna.study._optimize - INFO - Trial 63 pruned. 
2026-05-10 11:24:37,916 - optuna.study._optimize - INFO - Trial 64 pruned. 
2026-05-10 11:24:39,397 - optuna.study._optimize - INFO - Trial 65 pruned. 
2026-05-10 11:24:40,759 - optuna.study._optimize - INFO - Trial 66 pruned. 
2026-05-10 11:24:42,097 - optuna.study._optimize - INFO - Trial 67 pruned. 
2026-05-10 11:24:43,540 - optuna.study._optimize - INFO - Trial 68 pruned. 
2026-05-10 11:24:44,896 - optuna.study._optimize - INFO - Trial 69 pruned. 
2026-05-10 11:24:46,472 - optuna.study._optimize - INFO - Trial 70 pruned. 
2026-05-10 11:25:52,649 - optuna.study.study - INFO - Trial 71 finished with value: 0.024950991635964193 and parameters: {'n_layers': 3, 'embedding_dim': 128, 'lr': 0.07005400527498139, 'lambda_val': 0.0007263822220388271, 'batch_size': 645, 'optimizer': 'RMSprop'}. Best is trial 53 with value: 0.03021362956077028.
2026-05-10 11:25:53,942 - optuna.study._optimize - INFO - Trial 72 pruned. 
2026-05-10 11:25:55,282 - optuna.study._optimize - INFO - Trial 73 pruned. 
2026-05-10 11:25:56,677 - optuna.study._optimize - INFO - Trial 74 pruned. 
2026-05-10 11:25:58,308 - optuna.study._optimize - INFO - Trial 75 pruned. 
2026-05-10 11:26:00,068 - optuna.study._optimize - INFO - Trial 76 pruned. 
2026-05-10 11:26:01,272 - optuna.study._optimize - INFO - Trial 77 pruned. 
2026-05-10 11:26:02,728 - optuna.study._optimize - INFO - Trial 78 pruned. 
2026-05-10 11:26:04,138 - optuna.study._optimize - INFO - Trial 79 pruned. 
2026-05-10 11:26:05,560 - optuna.study._optimize - INFO - Trial 80 pruned. 
2026-05-10 11:26:07,070 - optuna.study._optimize - INFO - Trial 81 pruned. 
2026-05-10 11:26:08,515 - optuna.study._optimize - INFO - Trial 82 pruned. 
2026-05-10 11:26:09,954 - optuna.study._optimize - INFO - Trial 83 pruned. 
2026-05-10 11:26:11,338 - optuna.study._optimize - INFO - Trial 84 pruned. 
2026-05-10 11:26:13,197 - optuna.study._optimize - INFO - Trial 85 pruned. 
2026-05-10 11:26:14,713 - optuna.study._optimize - INFO - Trial 86 pruned. 
2026-05-10 11:26:16,042 - optuna.study._optimize - INFO - Trial 87 pruned. 
2026-05-10 11:26:17,410 - optuna.study._optimize - INFO - Trial 88 pruned. 
2026-05-10 11:26:18,931 - optuna.study._optimize - INFO - Trial 89 pruned. 
2026-05-10 11:27:25,586 - optuna.study.study - INFO - Trial 90 finished with value: 0.026385850568613985 and parameters: {'n_layers': 3, 'embedding_dim': 128, 'lr': 0.03408662545157644, 'lambda_val': 0.0006949195871179249, 'batch_size': 567, 'optimizer': 'RMSprop'}. Best is trial 53 with value: 0.03021362956077028.
2026-05-10 11:27:26,802 - optuna.study._optimize - INFO - Trial 91 pruned. 
2026-05-10 11:28:32,386 - optuna.study.study - INFO - Trial 92 finished with value: 0.030550297432971052 and parameters: {'n_layers': 3, 'embedding_dim': 128, 'lr': 0.0609768919293542, 'lambda_val': 0.0013511951768364282, 'batch_size': 513, 'optimizer': 'RMSprop'}. Best is trial 92 with value: 0.030550297432971052.
2026-05-10 11:29:40,234 - optuna.study.study - INFO - Trial 93 finished with value: 0.030094693861892046 and parameters: {'n_layers': 3, 'embedding_dim': 128, 'lr': 0.033340294596482946, 'lambda_val': 0.001245863265356186, 'batch_size': 531, 'optimizer': 'RMSprop'}. Best is trial 92 with value: 0.030550297432971052.
2026-05-10 11:30:45,882 - optuna.study.study - INFO - Trial 94 finished with value: 0.026997735618424314 and parameters: {'n_layers': 3, 'embedding_dim': 128, 'lr': 0.0848692763869316, 'lambda_val': 0.0013499816215453565, 'batch_size': 512, 'optimizer': 'RMSprop'}. Best is trial 92 with value: 0.030550297432971052.
2026-05-10 11:30:47,287 - optuna.study._optimize - INFO - Trial 95 pruned. 
2026-05-10 11:30:48,759 - optuna.study._optimize - INFO - Trial 96 pruned. 
2026-05-10 11:30:50,066 - optuna.study._optimize - INFO - Trial 97 pruned. 
2026-05-10 11:30:51,493 - optuna.study._optimize - INFO - Trial 98 pruned. 
2026-05-10 11:30:52,733 - optuna.study._optimize - INFO - Trial 99 pruned. 
