2026-05-10 05:09:41,193 - optuna.study.study - INFO - Trial 61 finished with value: 0.01760384282431019 and parameters: {'n_layers': 2, 'embedding_dim': 96, 'lr': 0.009475482669772016, 'lambda_val': 6.8170151114674084e-06, 'batch_size': 925, 'optimizer': 'RMSprop'}. Best is trial 45 with value: 0.0250981236979396.
2026-05-10 05:09:42,410 - optuna.study._optimize - INFO - Trial 62 pruned. 
2026-05-10 05:09:44,693 - optuna.study._optimize - INFO - Trial 63 pruned. 
2026-05-10 05:09:47,053 - optuna.study._optimize - INFO - Trial 64 pruned. 
2026-05-10 05:09:48,328 - optuna.study._optimize - INFO - Trial 65 pruned. 
2026-05-10 05:09:51,506 - optuna.study._optimize - INFO - Trial 66 pruned. 
2026-05-10 05:09:52,803 - optuna.study._optimize - INFO - Trial 67 pruned. 
2026-05-10 05:09:54,232 - optuna.study._optimize - INFO - Trial 68 pruned. 
2026-05-10 05:09:56,392 - optuna.study._optimize - INFO - Trial 69 pruned. 
2026-05-10 05:09:57,678 - optuna.study._optimize - INFO - Trial 70 pruned. 
2026-05-10 05:10:00,118 - optuna.study._optimize - INFO - Trial 71 pruned. 
2026-05-10 05:10:04,242 - optuna.study._optimize - INFO - Trial 72 pruned. 
2026-05-10 05:10:05,632 - optuna.study._optimize - INFO - Trial 73 pruned. 
2026-05-10 05:10:08,427 - optuna.study._optimize - INFO - Trial 74 pruned. 
2026-05-10 05:10:10,875 - optuna.study._optimize - INFO - Trial 75 pruned. 
2026-05-10 05:10:12,150 - optuna.study._optimize - INFO - Trial 76 pruned. 
2026-05-10 05:10:13,567 - optuna.study._optimize - INFO - Trial 77 pruned. 
2026-05-10 05:10:15,750 - optuna.study._optimize - INFO - Trial 78 pruned. 
2026-05-10 05:10:17,081 - optuna.study._optimize - INFO - Trial 79 pruned. 
2026-05-10 05:10:18,376 - optuna.study._optimize - INFO - Trial 80 pruned. 
2026-05-10 05:11:08,439 - optuna.study.study - INFO - Trial 81 finished with value: 0.01794491748164191 and parameters: {'n_layers': 2, 'embedding_dim': 96, 'lr': 0.010770517798267203, 'lambda_val': 9.591254467992969e-05, 'batch_size': 1131, 'optimizer': 'RMSprop'}. Best is trial 45 with value: 0.0250981236979396.
2026-05-10 05:11:12,628 - optuna.study._optimize - INFO - Trial 82 pruned. 
2026-05-10 05:12:04,257 - optuna.study.study - INFO - Trial 83 finished with value: 0.01901666115130192 and parameters: {'n_layers': 2, 'embedding_dim': 96, 'lr': 0.011293558226577634, 'lambda_val': 7.224860168042997e-05, 'batch_size': 823, 'optimizer': 'RMSprop'}. Best is trial 45 with value: 0.0250981236979396.
2026-05-10 05:12:06,521 - optuna.study._optimize - INFO - Trial 84 pruned. 
2026-05-10 05:12:07,817 - optuna.study._optimize - INFO - Trial 85 pruned. 
2026-05-10 05:13:02,480 - optuna.study.study - INFO - Trial 86 finished with value: 0.01856762448523214 and parameters: {'n_layers': 2, 'embedding_dim': 128, 'lr': 0.012754689263156923, 'lambda_val': 0.00019208858792100746, 'batch_size': 800, 'optimizer': 'RMSprop'}. Best is trial 45 with value: 0.0250981236979396.
2026-05-10 05:13:04,916 - optuna.study._optimize - INFO - Trial 87 pruned. 
2026-05-10 05:13:09,482 - optuna.study._optimize - INFO - Trial 88 pruned. 
2026-05-10 05:13:10,780 - optuna.study._optimize - INFO - Trial 89 pruned. 
2026-05-10 05:13:12,214 - optuna.study._optimize - INFO - Trial 90 pruned. 
2026-05-10 05:13:14,556 - optuna.study._optimize - INFO - Trial 91 pruned. 
2026-05-10 05:13:17,285 - optuna.study._optimize - INFO - Trial 92 pruned. 
2026-05-10 05:13:19,704 - optuna.study._optimize - INFO - Trial 93 pruned. 
2026-05-10 05:14:14,148 - optuna.study.study - INFO - Trial 94 finished with value: 0.018662395061805226 and parameters: {'n_layers': 2, 'embedding_dim': 128, 'lr': 0.00803727795300018, 'lambda_val': 0.00016059074288010867, 'batch_size': 2010, 'optimizer': 'RMSprop'}. Best is trial 45 with value: 0.0250981236979396.
2026-05-10 05:14:15,896 - optuna.study._optimize - INFO - Trial 95 pruned. 
2026-05-10 05:14:17,468 - optuna.study._optimize - INFO - Trial 96 pruned. 
2026-05-10 05:14:18,754 - optuna.study._optimize - INFO - Trial 97 pruned. 
2026-05-10 05:14:20,054 - optuna.study._optimize - INFO - Trial 98 pruned. 
2026-05-10 05:14:21,318 - optuna.study._optimize - INFO - Trial 99 pruned. 
2026-05-10 05:15:10,913 - root - INFO - **** Training e_1M_1c2dcs
2026-05-10 05:15:10,913 - root - INFO -   ** 2-Dominant stats:
2026-05-10 05:15:10,913 - root - INFO -   ** Finding the dominant set:
2026-05-10 05:48:41,699 - root - INFO -   ** Getting the trainable edges:
2026-05-10 05:48:41,718 - helper_functions - INFO -      Number of nodes: 4583
2026-05-10 05:48:41,718 - helper_functions - INFO -      Ratio: 0.4740871004448122
2026-05-10 05:48:41,719 - helper_functions - INFO -      Number of unique users: 2957
2026-05-10 05:48:41,719 - helper_functions - INFO -      Number of unique items: 1626
2026-05-10 05:48:41,719 - helper_functions - INFO -      Total dominant set edge: 235573
2026-05-10 05:48:41,719 - helper_functions - INFO -      Trainable edges: 188458.40000000002
2026-05-10 05:48:41,802 - root - INFO -   **** Getting 235573 dominant set edges
2026-05-10 05:48:41,946 - optuna.storages._rdb.storage - INFO - A new study created in RDB with name: Study_e_1M_1c2dcs
2026-05-10 05:49:43,462 - optuna.study.study - INFO - Trial 0 finished with value: 0.004863168439576914 and parameters: {'n_layers': 3, 'embedding_dim': 64, 'lr': 0.00834757794298532, 'lambda_val': 0.07545054114832271, 'batch_size': 2845, 'optimizer': 'SGD'}. Best is trial 0 with value: 0.004863168439576914.
2026-05-10 05:50:30,872 - optuna.study.study - INFO - Trial 1 finished with value: 0.006060990516202321 and parameters: {'n_layers': 1, 'embedding_dim': 64, 'lr': 1.0655153511419782e-05, 'lambda_val': 4.356547924622748e-05, 'batch_size': 2525, 'optimizer': 'SGD'}. Best is trial 1 with value: 0.006060990516202321.
2026-05-10 05:51:33,696 - optuna.study.study - INFO - Trial 2 finished with value: 0.0076997888413912275 and parameters: {'n_layers': 3, 'embedding_dim': 64, 'lr': 0.045955157641533496, 'lambda_val': 0.020759780791877087, 'batch_size': 2732, 'optimizer': 'Adam'}. Best is trial 2 with value: 0.0076997888413912275.
2026-05-10 05:52:39,918 - optuna.study.study - INFO - Trial 3 finished with value: 0.02082998506975593 and parameters: {'n_layers': 3, 'embedding_dim': 32, 'lr': 0.00017305026114417793, 'lambda_val': 0.008181053619413004, 'batch_size': 2318, 'optimizer': 'RMSprop'}. Best is trial 3 with value: 0.02082998506975593.
2026-05-10 05:53:43,927 - optuna.study.study - INFO - Trial 4 finished with value: 0.04673139294903048 and parameters: {'n_layers': 2, 'embedding_dim': 128, 'lr': 0.0018525931208548067, 'lambda_val': 6.253073248221469e-06, 'batch_size': 3712, 'optimizer': 'RMSprop'}. Best is trial 4 with value: 0.04673139294903048.
2026-05-10 05:53:45,629 - optuna.study._optimize - INFO - Trial 5 pruned. 
2026-05-10 05:53:46,969 - optuna.study._optimize - INFO - Trial 6 pruned. 
2026-05-10 05:53:48,199 - optuna.study._optimize - INFO - Trial 7 pruned. 
2026-05-10 05:53:49,451 - optuna.study._optimize - INFO - Trial 8 pruned. 
2026-05-10 05:53:50,747 - optuna.study._optimize - INFO - Trial 9 pruned. 
2026-05-10 05:53:52,033 - optuna.study._optimize - INFO - Trial 10 pruned. 
2026-05-10 05:53:54,822 - optuna.study._optimize - INFO - Trial 11 pruned. 
2026-05-10 05:53:58,992 - optuna.study._optimize - INFO - Trial 12 pruned. 
2026-05-10 05:54:00,810 - optuna.study._optimize - INFO - Trial 13 pruned. 
2026-05-10 05:54:02,311 - optuna.study._optimize - INFO - Trial 14 pruned. 
2026-05-10 05:54:03,790 - optuna.study._optimize - INFO - Trial 15 pruned. 
2026-05-10 05:54:05,248 - optuna.study._optimize - INFO - Trial 16 pruned. 
2026-05-10 05:54:06,567 - optuna.study._optimize - INFO - Trial 17 pruned. 
2026-05-10 05:54:07,785 - optuna.study._optimize - INFO - Trial 18 pruned. 
2026-05-10 05:54:09,070 - optuna.study._optimize - INFO - Trial 19 pruned. 
2026-05-10 05:54:10,455 - optuna.study._optimize - INFO - Trial 20 pruned. 
2026-05-10 05:54:11,762 - optuna.study._optimize - INFO - Trial 21 pruned. 
2026-05-10 05:54:13,380 - optuna.study._optimize - INFO - Trial 22 pruned. 
2026-05-10 05:54:14,775 - optuna.study._optimize - INFO - Trial 23 pruned. 
2026-05-10 05:54:16,142 - optuna.study._optimize - INFO - Trial 24 pruned. 
2026-05-10 05:54:18,650 - optuna.study._optimize - INFO - Trial 25 pruned. 
2026-05-10 05:54:20,071 - optuna.study._optimize - INFO - Trial 26 pruned. 
2026-05-10 05:54:21,474 - optuna.study._optimize - INFO - Trial 27 pruned. 
2026-05-10 05:54:22,967 - optuna.study._optimize - INFO - Trial 28 pruned. 
2026-05-10 05:55:40,996 - optuna.study.study - INFO - Trial 29 finished with value: 0.014435406522928686 and parameters: {'n_layers': 3, 'embedding_dim': 128, 'lr': 0.035608856126431485, 'lambda_val': 4.322399346207205e-06, 'batch_size': 2781, 'optimizer': 'Adam'}. Best is trial 4 with value: 0.04673139294903048.
2026-05-10 05:55:42,289 - optuna.study._optimize - INFO - Trial 30 pruned. 
2026-05-10 05:56:58,007 - optuna.study.study - INFO - Trial 31 finished with value: 0.011547460358251967 and parameters: {'n_layers': 3, 'embedding_dim': 128, 'lr': 0.04762454298684269, 'lambda_val': 2.8032416166023623e-06, 'batch_size': 2733, 'optimizer': 'Adam'}. Best is trial 4 with value: 0.04673139294903048.
2026-05-10 05:58:09,431 - optuna.study.study - INFO - Trial 32 finished with value: 0.011819734895586277 and parameters: {'n_layers': 3, 'embedding_dim': 128, 'lr': 0.04307234315841351, 'lambda_val': 1.949669307835074e-06, 'batch_size': 2303, 'optimizer': 'Adam'}. Best is trial 4 with value: 0.04673139294903048.
2026-05-10 05:58:10,806 - optuna.study._optimize - INFO - Trial 33 pruned. 
2026-05-10 05:58:13,664 - optuna.study._optimize - INFO - Trial 34 pruned. 
2026-05-10 05:58:14,937 - optuna.study._optimize - INFO - Trial 35 pruned. 
2026-05-10 05:58:16,254 - optuna.study._optimize - INFO - Trial 36 pruned. 
2026-05-10 05:58:17,506 - optuna.study._optimize - INFO - Trial 37 pruned. 
2026-05-10 05:58:20,241 - optuna.study._optimize - INFO - Trial 38 pruned. 
2026-05-10 05:58:21,580 - optuna.study._optimize - INFO - Trial 39 pruned. 
2026-05-10 06:00:00,178 - optuna.study.study - INFO - Trial 40 finished with value: 0.026553752405856598 and parameters: {'n_layers': 3, 'embedding_dim': 256, 'lr': 0.011459145073533065, 'lambda_val': 1.1460350948517678e-06, 'batch_size': 1602, 'optimizer': 'RMSprop'}. Best is trial 4 with value: 0.04673139294903048.
2026-05-10 06:01:39,303 - optuna.study.study - INFO - Trial 41 finished with value: 0.02375291804084904 and parameters: {'n_layers': 3, 'embedding_dim': 256, 'lr': 0.01415943525046894, 'lambda_val': 1.1286870728865822e-06, 'batch_size': 1629, 'optimizer': 'RMSprop'}. Best is trial 4 with value: 0.04673139294903048.
2026-05-10 06:03:09,457 - optuna.study.study - INFO - Trial 42 finished with value: 0.025685892084848776 and parameters: {'n_layers': 3, 'embedding_dim': 256, 'lr': 0.011913614533893412, 'lambda_val': 1.2742354905912728e-06, 'batch_size': 1582, 'optimizer': 'RMSprop'}. Best is trial 4 with value: 0.04673139294903048.
2026-05-10 06:04:51,252 - optuna.study.study - INFO - Trial 43 finished with value: 0.02980308879423953 and parameters: {'n_layers': 3, 'embedding_dim': 256, 'lr': 0.011499862561987957, 'lambda_val': 1.4375605699911486e-06, 'batch_size': 881, 'optimizer': 'RMSprop'}. Best is trial 4 with value: 0.04673139294903048.
2026-05-10 06:06:21,553 - optuna.study.study - INFO - Trial 44 finished with value: 0.032217760440118474 and parameters: {'n_layers': 3, 'embedding_dim': 256, 'lr': 0.01039573372824164, 'lambda_val': 1.1252911868268448e-06, 'batch_size': 719, 'optimizer': 'RMSprop'}. Best is trial 4 with value: 0.04673139294903048.
2026-05-10 06:07:51,529 - optuna.study.study - INFO - Trial 45 finished with value: 0.035541393863970316 and parameters: {'n_layers': 3, 'embedding_dim': 256, 'lr': 0.00959390626780095, 'lambda_val': 2.6838735736993485e-06, 'batch_size': 554, 'optimizer': 'RMSprop'}. Best is trial 4 with value: 0.04673139294903048.
2026-05-10 06:07:52,768 - optuna.study._optimize - INFO - Trial 46 pruned. 
2026-05-10 06:09:23,316 - optuna.study.study - INFO - Trial 47 finished with value: 0.036815283012922 and parameters: {'n_layers': 3, 'embedding_dim': 256, 'lr': 0.008191371199373163, 'lambda_val': 2.515831785173081e-06, 'batch_size': 757, 'optimizer': 'RMSprop'}. Best is trial 4 with value: 0.04673139294903048.
2026-05-10 06:10:38,288 - optuna.study.study - INFO - Trial 48 finished with value: 0.03828145022039199 and parameters: {'n_layers': 2, 'embedding_dim': 256, 'lr': 0.007914697166581766, 'lambda_val': 9.722520977351016e-06, 'batch_size': 803, 'optimizer': 'RMSprop'}. Best is trial 4 with value: 0.04673139294903048.
2026-05-10 06:10:39,616 - optuna.study._optimize - INFO - Trial 49 pruned. 
2026-05-10 06:10:40,834 - optuna.study._optimize - INFO - Trial 50 pruned. 
2026-05-10 06:10:42,627 - optuna.study._optimize - INFO - Trial 51 pruned. 
2026-05-10 06:10:48,457 - optuna.study._optimize - INFO - Trial 52 pruned. 
2026-05-10 06:10:49,697 - optuna.study._optimize - INFO - Trial 53 pruned. 
2026-05-10 06:10:51,026 - optuna.study._optimize - INFO - Trial 54 pruned. 
2026-05-10 06:10:52,321 - optuna.study._optimize - INFO - Trial 55 pruned. 
2026-05-10 06:10:53,643 - optuna.study._optimize - INFO - Trial 56 pruned. 
2026-05-10 06:12:23,730 - optuna.study.study - INFO - Trial 57 finished with value: 0.036360706741462495 and parameters: {'n_layers': 3, 'embedding_dim': 256, 'lr': 0.007988079290583277, 'lambda_val': 1.578835371909095e-05, 'batch_size': 1148, 'optimizer': 'RMSprop'}. Best is trial 4 with value: 0.04673139294903048.
2026-05-10 06:12:24,990 - optuna.study._optimize - INFO - Trial 58 pruned. 
2026-05-10 06:12:28,102 - optuna.study._optimize - INFO - Trial 59 pruned. 
2026-05-10 06:14:15,609 - optuna.study.study - INFO - Trial 60 finished with value: 0.035421467324482286 and parameters: {'n_layers': 4, 'embedding_dim': 256, 'lr': 0.008858034094375196, 'lambda_val': 1.4079121054041098e-05, 'batch_size': 1217, 'optimizer': 'RMSprop'}. Best is trial 4 with value: 0.04673139294903048.
2026-05-10 06:14:16,914 - optuna.study._optimize - INFO - Trial 61 pruned. 
2026-05-10 06:16:07,768 - optuna.study.study - INFO - Trial 62 finished with value: 0.037099156881346705 and parameters: {'n_layers': 4, 'embedding_dim': 256, 'lr': 0.00871811708509548, 'lambda_val': 6.7757475373947726e-06, 'batch_size': 1106, 'optimizer': 'RMSprop'}. Best is trial 4 with value: 0.04673139294903048.
2026-05-10 06:17:55,975 - optuna.study.study - INFO - Trial 63 finished with value: 0.037240802349138936 and parameters: {'n_layers': 4, 'embedding_dim': 256, 'lr': 0.008715909070448337, 'lambda_val': 6.742911676179259e-06, 'batch_size': 1326, 'optimizer': 'RMSprop'}. Best is trial 4 with value: 0.04673139294903048.
2026-05-10 06:17:57,283 - optuna.study._optimize - INFO - Trial 64 pruned. 
2026-05-10 06:18:02,775 - optuna.study._optimize - INFO - Trial 65 pruned. 
2026-05-10 06:19:52,219 - optuna.study.study - INFO - Trial 66 finished with value: 0.03646471081602338 and parameters: {'n_layers': 4, 'embedding_dim': 256, 'lr': 0.007718594826129297, 'lambda_val': 9.574269909137477e-06, 'batch_size': 1417, 'optimizer': 'RMSprop'}. Best is trial 4 with value: 0.04673139294903048.
2026-05-10 06:19:53,528 - optuna.study._optimize - INFO - Trial 67 pruned. 
2026-05-10 06:19:54,779 - optuna.study._optimize - INFO - Trial 68 pruned. 
2026-05-10 06:19:56,075 - optuna.study._optimize - INFO - Trial 69 pruned. 
2026-05-10 06:19:59,529 - optuna.study._optimize - INFO - Trial 70 pruned. 
2026-05-10 06:21:48,013 - optuna.study.study - INFO - Trial 71 finished with value: 0.04078050411143113 and parameters: {'n_layers': 4, 'embedding_dim': 256, 'lr': 0.008451656695776744, 'lambda_val': 5.425740140101432e-06, 'batch_size': 806, 'optimizer': 'RMSprop'}. Best is trial 4 with value: 0.04673139294903048.
2026-05-10 06:21:51,354 - optuna.study._optimize - INFO - Trial 72 pruned. 
2026-05-10 06:21:52,771 - optuna.study._optimize - INFO - Trial 73 pruned. 
2026-05-10 06:21:56,436 - optuna.study._optimize - INFO - Trial 74 pruned. 
2026-05-10 06:21:57,698 - optuna.study._optimize - INFO - Trial 75 pruned. 
2026-05-10 06:22:01,196 - optuna.study._optimize - INFO - Trial 76 pruned. 
2026-05-10 06:22:02,989 - optuna.study._optimize - INFO - Trial 77 pruned. 
2026-05-10 06:22:04,295 - optuna.study._optimize - INFO - Trial 78 pruned. 
2026-05-10 06:22:05,646 - optuna.study._optimize - INFO - Trial 79 pruned. 
2026-05-10 06:23:55,478 - optuna.study.study - INFO - Trial 80 finished with value: 0.0241084636161734 and parameters: {'n_layers': 4, 'embedding_dim': 256, 'lr': 0.014499780228673782, 'lambda_val': 8.002746965409416e-06, 'batch_size': 3684, 'optimizer': 'RMSprop'}. Best is trial 4 with value: 0.04673139294903048.
2026-05-10 06:23:56,783 - optuna.study._optimize - INFO - Trial 81 pruned. 
2026-05-10 06:23:58,238 - optuna.study._optimize - INFO - Trial 82 pruned. 
2026-05-10 06:23:59,798 - optuna.study._optimize - INFO - Trial 83 pruned. 
2026-05-10 06:25:58,821 - optuna.study.study - INFO - Trial 84 finished with value: 0.0334312307577837 and parameters: {'n_layers': 4, 'embedding_dim': 256, 'lr': 0.009464562806718502, 'lambda_val': 2.355648074630612e-06, 'batch_size': 1498, 'optimizer': 'RMSprop'}. Best is trial 4 with value: 0.04673139294903048.
2026-05-10 06:26:03,839 - optuna.study._optimize - INFO - Trial 85 pruned. 
2026-05-10 06:26:05,245 - optuna.study._optimize - INFO - Trial 86 pruned. 
2026-05-10 06:27:54,673 - optuna.study.study - INFO - Trial 87 finished with value: 0.028749612841221222 and parameters: {'n_layers': 4, 'embedding_dim': 256, 'lr': 0.017380952085912903, 'lambda_val': 1.5445878439579098e-06, 'batch_size': 766, 'optimizer': 'RMSprop'}. Best is trial 4 with value: 0.04673139294903048.
2026-05-10 06:27:55,944 - optuna.study._optimize - INFO - Trial 88 pruned. 
2026-05-10 06:29:27,667 - optuna.study.study - INFO - Trial 89 finished with value: 0.028714240255013523 and parameters: {'n_layers': 3, 'embedding_dim': 256, 'lr': 0.008624749740018554, 'lambda_val': 3.5432685499270035e-05, 'batch_size': 4060, 'optimizer': 'RMSprop'}. Best is trial 4 with value: 0.04673139294903048.
2026-05-10 06:29:28,905 - optuna.study._optimize - INFO - Trial 90 pruned. 
2026-05-10 06:31:15,547 - optuna.study.study - INFO - Trial 91 finished with value: 0.0364453889396488 and parameters: {'n_layers': 4, 'embedding_dim': 256, 'lr': 0.008988955834658831, 'lambda_val': 1.4260612666100355e-05, 'batch_size': 1282, 'optimizer': 'RMSprop'}. Best is trial 4 with value: 0.04673139294903048.
2026-05-10 06:31:16,785 - optuna.study._optimize - INFO - Trial 92 pruned. 
2026-05-10 06:33:03,684 - optuna.study.study - INFO - Trial 93 finished with value: 0.0290788614051205 and parameters: {'n_layers': 4, 'embedding_dim': 256, 'lr': 0.012967353307703194, 'lambda_val': 8.875336401145928e-06, 'batch_size': 1353, 'optimizer': 'RMSprop'}. Best is trial 4 with value: 0.04673139294903048.
2026-05-10 06:33:07,052 - optuna.study._optimize - INFO - Trial 94 pruned. 
2026-05-10 06:33:08,680 - optuna.study._optimize - INFO - Trial 95 pruned. 
2026-05-10 06:33:11,806 - optuna.study._optimize - INFO - Trial 96 pruned. 
2026-05-10 06:33:13,080 - optuna.study._optimize - INFO - Trial 97 pruned. 
2026-05-10 06:33:16,972 - optuna.study._optimize - INFO - Trial 98 pruned. 
2026-05-10 06:33:18,699 - optuna.study._optimize - INFO - Trial 99 pruned. 
2026-05-10 06:34:15,307 - root - INFO -   **** Training e_1M_1c2dcs_rand1
2026-05-10 06:34:15,370 - root - INFO -   **** Getting 188411/669182 random edges
2026-05-10 06:34:15,537 - optuna.storages._rdb.storage - INFO - A new study created in RDB with name: Study_e_1M_1c2dcs_rand1
2026-05-10 06:35:13,648 - optuna.study.study - INFO - Trial 0 finished with value: 0.011426886944539444 and parameters: {'n_layers': 4, 'embedding_dim': 64, 'lr': 0.001042597846056695, 'lambda_val': 0.00015505485089303708, 'batch_size': 2610, 'optimizer': 'RMSprop'}. Best is trial 0 with value: 0.011426886944539444.
2026-05-10 06:36:18,412 - optuna.study.study - INFO - Trial 1 finished with value: 0.014168626881285297 and parameters: {'n_layers': 3, 'embedding_dim': 128, 'lr': 0.013888221131676898, 'lambda_val': 0.011354472355152322, 'batch_size': 3256, 'optimizer': 'RMSprop'}. Best is trial 1 with value: 0.014168626881285297.
2026-05-10 06:37:03,171 - optuna.study.study - INFO - Trial 2 finished with value: 0.005326145521375249 and parameters: {'n_layers': 1, 'embedding_dim': 64, 'lr': 1.1386402629554169e-05, 'lambda_val': 2.854184914243126e-05, 'batch_size': 3630, 'optimizer': 'SGD'}. Best is trial 1 with value: 0.014168626881285297.
2026-05-10 06:37:47,902 - optuna.study.study - INFO - Trial 3 finished with value: 0.005112434949568213 and parameters: {'n_layers': 1, 'embedding_dim': 64, 'lr': 2.9641545274619886e-05, 'lambda_val': 2.0690340303565766e-05, 'batch_size': 2909, 'optimizer': 'SGD'}. Best is trial 1 with value: 0.014168626881285297.
2026-05-10 06:38:44,615 - optuna.study.study - INFO - Trial 4 finished with value: 0.03010522144537456 and parameters: {'n_layers': 2, 'embedding_dim': 128, 'lr': 0.03613078597167189, 'lambda_val': 0.0034794362402148877, 'batch_size': 1889, 'optimizer': 'RMSprop'}. Best is trial 4 with value: 0.03010522144537456.
2026-05-10 06:38:45,829 - optuna.study._optimize - INFO - Trial 5 pruned. 
2026-05-10 06:39:37,664 - optuna.study._optimize - INFO - Trial 6 pruned. 
2026-05-10 06:39:38,926 - optuna.study._optimize - INFO - Trial 7 pruned. 
2026-05-10 06:39:40,177 - optuna.study._optimize - INFO - Trial 8 pruned. 
2026-05-10 06:39:42,492 - optuna.study._optimize - INFO - Trial 9 pruned. 
