2026-05-10 09:51:48,335 - optuna.study._optimize - INFO - Trial 20 pruned. 
2026-05-10 09:52:43,689 - optuna.study.study - INFO - Trial 21 finished with value: 0.03150053581335577 and parameters: {'n_layers': 2, 'embedding_dim': 96, 'lr': 0.005785377438378287, 'lambda_val': 0.003107598236237286, 'batch_size': 3448, 'optimizer': 'RMSprop'}. Best is trial 13 with value: 0.03701360689243537.
2026-05-10 09:53:37,535 - optuna.study.study - INFO - Trial 22 finished with value: 0.028388072504618632 and parameters: {'n_layers': 2, 'embedding_dim': 96, 'lr': 0.011060773594947651, 'lambda_val': 0.0007021477034038676, 'batch_size': 792, 'optimizer': 'RMSprop'}. Best is trial 13 with value: 0.03701360689243537.
2026-05-10 09:53:38,915 - optuna.study._optimize - INFO - Trial 23 pruned. 
2026-05-10 09:53:40,275 - optuna.study._optimize - INFO - Trial 24 pruned. 
2026-05-10 09:53:42,689 - optuna.study._optimize - INFO - Trial 25 pruned. 
2026-05-10 09:53:44,359 - optuna.study._optimize - INFO - Trial 26 pruned. 
2026-05-10 09:54:33,300 - optuna.study.study - INFO - Trial 27 finished with value: 0.03585227224735534 and parameters: {'n_layers': 1, 'embedding_dim': 96, 'lr': 0.008970643539494044, 'lambda_val': 0.003945118399902475, 'batch_size': 1324, 'optimizer': 'RMSprop'}. Best is trial 13 with value: 0.03701360689243537.
2026-05-10 09:54:34,548 - optuna.study._optimize - INFO - Trial 28 pruned. 
2026-05-10 09:54:36,119 - optuna.study._optimize - INFO - Trial 29 pruned. 
2026-05-10 09:54:37,512 - optuna.study._optimize - INFO - Trial 30 pruned. 
2026-05-10 09:54:38,788 - optuna.study._optimize - INFO - Trial 31 pruned. 
2026-05-10 09:54:40,227 - optuna.study._optimize - INFO - Trial 32 pruned. 
2026-05-10 09:54:41,840 - optuna.study._optimize - INFO - Trial 33 pruned. 
2026-05-10 09:54:44,154 - optuna.study._optimize - INFO - Trial 34 pruned. 
2026-05-10 09:55:00,178 - optuna.study._optimize - INFO - Trial 35 pruned. 
2026-05-10 09:55:02,070 - optuna.study._optimize - INFO - Trial 36 pruned. 
2026-05-10 09:55:03,403 - optuna.study._optimize - INFO - Trial 37 pruned. 
2026-05-10 09:55:04,709 - optuna.study._optimize - INFO - Trial 38 pruned. 
2026-05-10 09:55:06,145 - optuna.study._optimize - INFO - Trial 39 pruned. 
2026-05-10 09:55:09,312 - optuna.study._optimize - INFO - Trial 40 pruned. 
2026-05-10 09:55:53,969 - optuna.study._optimize - INFO - Trial 41 pruned. 
2026-05-10 09:55:55,208 - optuna.study._optimize - INFO - Trial 42 pruned. 
2026-05-10 09:55:56,490 - optuna.study._optimize - INFO - Trial 43 pruned. 
2026-05-10 09:55:57,818 - optuna.study._optimize - INFO - Trial 44 pruned. 
2026-05-10 09:56:13,418 - optuna.study._optimize - INFO - Trial 45 pruned. 
2026-05-10 09:56:14,866 - optuna.study._optimize - INFO - Trial 46 pruned. 
2026-05-10 09:56:16,337 - optuna.study._optimize - INFO - Trial 47 pruned. 
2026-05-10 09:56:18,017 - optuna.study._optimize - INFO - Trial 48 pruned. 
2026-05-10 09:56:20,255 - optuna.study._optimize - INFO - Trial 49 pruned. 
2026-05-10 09:56:21,570 - optuna.study._optimize - INFO - Trial 50 pruned. 
2026-05-10 09:56:55,582 - optuna.study._optimize - INFO - Trial 51 pruned. 
2026-05-10 09:56:56,898 - optuna.study._optimize - INFO - Trial 52 pruned. 
2026-05-10 09:56:58,789 - optuna.study._optimize - INFO - Trial 53 pruned. 
2026-05-10 09:57:08,828 - optuna.study._optimize - INFO - Trial 54 pruned. 
2026-05-10 09:57:17,646 - optuna.study._optimize - INFO - Trial 55 pruned. 
2026-05-10 09:57:34,800 - optuna.study._optimize - INFO - Trial 56 pruned. 
2026-05-10 09:57:36,671 - optuna.study._optimize - INFO - Trial 57 pruned. 
2026-05-10 09:57:38,057 - optuna.study._optimize - INFO - Trial 58 pruned. 
2026-05-10 09:57:39,804 - optuna.study._optimize - INFO - Trial 59 pruned. 
2026-05-10 09:58:34,098 - optuna.study.study - INFO - Trial 60 finished with value: 0.031414704155820906 and parameters: {'n_layers': 2, 'embedding_dim': 96, 'lr': 0.023740729914656533, 'lambda_val': 0.0017350705504249368, 'batch_size': 1137, 'optimizer': 'RMSprop'}. Best is trial 13 with value: 0.03701360689243537.
2026-05-10 09:59:28,580 - optuna.study.study - INFO - Trial 61 finished with value: 0.031071535027890142 and parameters: {'n_layers': 2, 'embedding_dim': 96, 'lr': 0.029211139868067566, 'lambda_val': 0.0017662669827857981, 'batch_size': 1125, 'optimizer': 'RMSprop'}. Best is trial 13 with value: 0.03701360689243537.
2026-05-10 09:59:30,981 - optuna.study._optimize - INFO - Trial 62 pruned. 
2026-05-10 09:59:34,394 - optuna.study._optimize - INFO - Trial 63 pruned. 
2026-05-10 09:59:37,139 - optuna.study._optimize - INFO - Trial 64 pruned. 
2026-05-10 10:00:32,109 - optuna.study.study - INFO - Trial 65 finished with value: 0.033691630184074485 and parameters: {'n_layers': 2, 'embedding_dim': 96, 'lr': 0.018052377257762982, 'lambda_val': 0.00283125257375724, 'batch_size': 947, 'optimizer': 'RMSprop'}. Best is trial 13 with value: 0.03701360689243537.
2026-05-10 10:01:20,971 - optuna.study.study - INFO - Trial 66 finished with value: 0.033900379619979076 and parameters: {'n_layers': 1, 'embedding_dim': 96, 'lr': 0.017284207829882235, 'lambda_val': 0.0030078179599758005, 'batch_size': 1352, 'optimizer': 'RMSprop'}. Best is trial 13 with value: 0.03701360689243537.
2026-05-10 10:02:07,858 - optuna.study.study - INFO - Trial 67 finished with value: 0.031968698267671555 and parameters: {'n_layers': 1, 'embedding_dim': 64, 'lr': 0.016312601244807753, 'lambda_val': 0.0030593099360618258, 'batch_size': 1355, 'optimizer': 'RMSprop'}. Best is trial 13 with value: 0.03701360689243537.
2026-05-10 10:02:09,293 - optuna.study._optimize - INFO - Trial 68 pruned. 
2026-05-10 10:02:10,664 - optuna.study._optimize - INFO - Trial 69 pruned. 
2026-05-10 10:02:12,112 - optuna.study._optimize - INFO - Trial 70 pruned. 
2026-05-10 10:02:13,571 - optuna.study._optimize - INFO - Trial 71 pruned. 
2026-05-10 10:03:07,434 - optuna.study.study - INFO - Trial 72 finished with value: 0.034840475669919505 and parameters: {'n_layers': 1, 'embedding_dim': 128, 'lr': 0.012455029142385344, 'lambda_val': 0.002893711304204156, 'batch_size': 1272, 'optimizer': 'RMSprop'}. Best is trial 13 with value: 0.03701360689243537.
2026-05-10 10:03:08,692 - optuna.study._optimize - INFO - Trial 73 pruned. 
2026-05-10 10:03:11,873 - optuna.study._optimize - INFO - Trial 74 pruned. 
2026-05-10 10:03:13,277 - optuna.study._optimize - INFO - Trial 75 pruned. 
2026-05-10 10:03:15,559 - optuna.study._optimize - INFO - Trial 76 pruned. 
2026-05-10 10:03:19,652 - optuna.study._optimize - INFO - Trial 77 pruned. 
2026-05-10 10:03:22,310 - optuna.study._optimize - INFO - Trial 78 pruned. 
2026-05-10 10:03:24,480 - optuna.study._optimize - INFO - Trial 79 pruned. 
2026-05-10 10:03:25,815 - optuna.study._optimize - INFO - Trial 80 pruned. 
2026-05-10 10:03:27,222 - optuna.study._optimize - INFO - Trial 81 pruned. 
2026-05-10 10:03:28,462 - optuna.study._optimize - INFO - Trial 82 pruned. 
2026-05-10 10:03:29,776 - optuna.study._optimize - INFO - Trial 83 pruned. 
2026-05-10 10:03:40,908 - optuna.study._optimize - INFO - Trial 84 pruned. 
2026-05-10 10:04:32,336 - optuna.study.study - INFO - Trial 85 finished with value: 0.03494314133910293 and parameters: {'n_layers': 1, 'embedding_dim': 96, 'lr': 0.009378571366808067, 'lambda_val': 0.003488940900982219, 'batch_size': 1219, 'optimizer': 'RMSprop'}. Best is trial 13 with value: 0.03701360689243537.
2026-05-10 10:04:34,239 - optuna.study._optimize - INFO - Trial 86 pruned. 
2026-05-10 10:04:36,457 - optuna.study._optimize - INFO - Trial 87 pruned. 
2026-05-10 10:04:37,753 - optuna.study._optimize - INFO - Trial 88 pruned. 
2026-05-10 10:04:41,068 - optuna.study._optimize - INFO - Trial 89 pruned. 
2026-05-10 10:05:32,776 - optuna.study.study - INFO - Trial 90 finished with value: 0.0357539904030097 and parameters: {'n_layers': 1, 'embedding_dim': 96, 'lr': 0.011223125216998413, 'lambda_val': 0.003315533967518027, 'batch_size': 1053, 'optimizer': 'RMSprop'}. Best is trial 13 with value: 0.03701360689243537.
2026-05-10 10:06:24,274 - optuna.study.study - INFO - Trial 91 finished with value: 0.03532295645894443 and parameters: {'n_layers': 1, 'embedding_dim': 96, 'lr': 0.011150238019141183, 'lambda_val': 0.0037035601228795193, 'batch_size': 798, 'optimizer': 'RMSprop'}. Best is trial 13 with value: 0.03701360689243537.
2026-05-10 10:06:26,579 - optuna.study._optimize - INFO - Trial 92 pruned. 
2026-05-10 10:06:27,876 - optuna.study._optimize - INFO - Trial 93 pruned. 
2026-05-10 10:06:30,280 - optuna.study._optimize - INFO - Trial 94 pruned. 
2026-05-10 10:06:32,420 - optuna.study._optimize - INFO - Trial 95 pruned. 
2026-05-10 10:06:55,401 - optuna.study._optimize - INFO - Trial 96 pruned. 
2026-05-10 10:06:56,715 - optuna.study._optimize - INFO - Trial 97 pruned. 
2026-05-10 10:06:58,010 - optuna.study._optimize - INFO - Trial 98 pruned. 
2026-05-10 10:06:59,296 - optuna.study._optimize - INFO - Trial 99 pruned. 
2026-05-10 10:07:52,311 - root - INFO -   **** Training e_1M_1c3dcs_rand3
2026-05-10 10:07:52,376 - root - INFO -   **** Getting 212879/669182 random edges
2026-05-10 10:07:53,243 - optuna.storages._rdb.storage - INFO - A new study created in RDB with name: Study_e_1M_1c3dcs_rand3
2026-05-10 10:08:49,728 - optuna.study.study - INFO - Trial 0 finished with value: 0.005637786328763447 and parameters: {'n_layers': 1, 'embedding_dim': 256, 'lr': 0.0006764899940543462, 'lambda_val': 0.011469632654395741, 'batch_size': 3668, 'optimizer': 'SGD'}. Best is trial 0 with value: 0.005637786328763447.
2026-05-10 10:09:34,681 - optuna.study.study - INFO - Trial 1 finished with value: 0.004524917281007398 and parameters: {'n_layers': 2, 'embedding_dim': 32, 'lr': 0.039989682682551105, 'lambda_val': 5.008167430369028e-05, 'batch_size': 585, 'optimizer': 'SGD'}. Best is trial 0 with value: 0.005637786328763447.
2026-05-10 10:10:42,493 - optuna.study.study - INFO - Trial 2 finished with value: 0.020220349500510087 and parameters: {'n_layers': 4, 'embedding_dim': 96, 'lr': 0.0015567660105589853, 'lambda_val': 3.0537109861972565e-06, 'batch_size': 2328, 'optimizer': 'Adam'}. Best is trial 2 with value: 0.020220349500510087.
2026-05-10 10:11:49,272 - optuna.study.study - INFO - Trial 3 finished with value: 0.018482534765550753 and parameters: {'n_layers': 3, 'embedding_dim': 128, 'lr': 0.04096054179102521, 'lambda_val': 0.006570245333555164, 'batch_size': 658, 'optimizer': 'Adam'}. Best is trial 2 with value: 0.020220349500510087.
2026-05-10 10:12:49,608 - optuna.study.study - INFO - Trial 4 finished with value: 0.007364257796825423 and parameters: {'n_layers': 3, 'embedding_dim': 96, 'lr': 0.0001261597632482238, 'lambda_val': 0.03855263849696039, 'batch_size': 1769, 'optimizer': 'Adam'}. Best is trial 2 with value: 0.020220349500510087.
2026-05-10 10:13:55,634 - optuna.study.study - INFO - Trial 5 finished with value: 0.015593820088505971 and parameters: {'n_layers': 4, 'embedding_dim': 96, 'lr': 0.03494241184570343, 'lambda_val': 0.006555606980912587, 'batch_size': 1350, 'optimizer': 'RMSprop'}. Best is trial 2 with value: 0.020220349500510087.
2026-05-10 10:13:58,325 - optuna.study._optimize - INFO - Trial 6 pruned. 
2026-05-10 10:14:45,129 - optuna.study.study - INFO - Trial 7 finished with value: 0.037375755615835275 and parameters: {'n_layers': 1, 'embedding_dim': 32, 'lr': 0.0022619435930960954, 'lambda_val': 1.7183785247497147e-05, 'batch_size': 1307, 'optimizer': 'Adam'}. Best is trial 7 with value: 0.037375755615835275.
2026-05-10 10:14:47,200 - optuna.study._optimize - INFO - Trial 8 pruned. 
2026-05-10 10:14:49,361 - optuna.study._optimize - INFO - Trial 9 pruned. 
2026-05-10 10:14:50,756 - optuna.study._optimize - INFO - Trial 10 pruned. 
2026-05-10 10:14:53,670 - optuna.study._optimize - INFO - Trial 11 pruned. 
2026-05-10 10:14:55,920 - optuna.study._optimize - INFO - Trial 12 pruned. 
2026-05-10 10:15:55,692 - optuna.study.study - INFO - Trial 13 finished with value: 0.04565790558453687 and parameters: {'n_layers': 1, 'embedding_dim': 256, 'lr': 0.0007184453141974395, 'lambda_val': 0.000324309939455476, 'batch_size': 1306, 'optimizer': 'Adam'}. Best is trial 13 with value: 0.04565790558453687.
2026-05-10 10:15:56,942 - optuna.study._optimize - INFO - Trial 14 pruned. 
2026-05-10 10:16:54,694 - optuna.study.study - INFO - Trial 15 finished with value: 0.024977745632786548 and parameters: {'n_layers': 1, 'embedding_dim': 256, 'lr': 0.0058999309112234425, 'lambda_val': 0.00022862620213097925, 'batch_size': 1035, 'optimizer': 'RMSprop'}. Best is trial 13 with value: 0.04565790558453687.
2026-05-10 10:16:55,912 - optuna.study._optimize - INFO - Trial 16 pruned. 
2026-05-10 10:16:58,283 - optuna.study._optimize - INFO - Trial 17 pruned. 
2026-05-10 10:16:59,580 - optuna.study._optimize - INFO - Trial 18 pruned. 
2026-05-10 10:17:45,859 - optuna.study.study - INFO - Trial 19 finished with value: 0.018079400967862293 and parameters: {'n_layers': 2, 'embedding_dim': 32, 'lr': 0.011544185307998056, 'lambda_val': 1.7691829994804565e-05, 'batch_size': 1415, 'optimizer': 'RMSprop'}. Best is trial 13 with value: 0.04565790558453687.
2026-05-10 10:17:47,207 - optuna.study._optimize - INFO - Trial 20 pruned. 
2026-05-10 10:18:44,878 - optuna.study.study - INFO - Trial 21 finished with value: 0.022419634732327283 and parameters: {'n_layers': 1, 'embedding_dim': 256, 'lr': 0.008304776299499512, 'lambda_val': 0.00017964727161155165, 'batch_size': 867, 'optimizer': 'RMSprop'}. Best is trial 13 with value: 0.04565790558453687.
2026-05-10 10:18:47,182 - optuna.study._optimize - INFO - Trial 22 pruned. 
2026-05-10 10:18:48,439 - optuna.study._optimize - INFO - Trial 23 pruned. 
2026-05-10 10:18:49,802 - optuna.study._optimize - INFO - Trial 24 pruned. 
2026-05-10 10:19:35,547 - optuna.study.study - INFO - Trial 25 finished with value: 0.02189170095718011 and parameters: {'n_layers': 1, 'embedding_dim': 64, 'lr': 0.006412864575616493, 'lambda_val': 2.9550988535003946e-05, 'batch_size': 1355, 'optimizer': 'RMSprop'}. Best is trial 13 with value: 0.04565790558453687.
2026-05-10 10:19:37,075 - optuna.study._optimize - INFO - Trial 26 pruned. 
2026-05-10 10:19:38,404 - optuna.study._optimize - INFO - Trial 27 pruned. 
2026-05-10 10:19:39,713 - optuna.study._optimize - INFO - Trial 28 pruned. 
2026-05-10 10:19:42,095 - optuna.study._optimize - INFO - Trial 29 pruned. 
2026-05-10 10:19:43,712 - optuna.study._optimize - INFO - Trial 30 pruned. 
2026-05-10 10:19:51,572 - optuna.study._optimize - INFO - Trial 31 pruned. 
2026-05-10 10:19:57,490 - optuna.study._optimize - INFO - Trial 32 pruned. 
2026-05-10 10:20:55,862 - optuna.study.study - INFO - Trial 33 finished with value: 0.033376302124493856 and parameters: {'n_layers': 1, 'embedding_dim': 256, 'lr': 0.0024767816527693797, 'lambda_val': 0.00011780118061862683, 'batch_size': 1306, 'optimizer': 'RMSprop'}. Best is trial 13 with value: 0.04565790558453687.
2026-05-10 10:20:57,079 - optuna.study._optimize - INFO - Trial 34 pruned. 
2026-05-10 10:20:58,387 - optuna.study._optimize - INFO - Trial 35 pruned. 
2026-05-10 10:20:59,739 - optuna.study._optimize - INFO - Trial 36 pruned. 
2026-05-10 10:21:01,025 - optuna.study._optimize - INFO - Trial 37 pruned. 
2026-05-10 10:21:02,444 - optuna.study._optimize - INFO - Trial 38 pruned. 
2026-05-10 10:21:03,829 - optuna.study._optimize - INFO - Trial 39 pruned. 
2026-05-10 10:21:10,134 - optuna.study._optimize - INFO - Trial 40 pruned. 
2026-05-10 10:22:08,885 - optuna.study.study - INFO - Trial 41 finished with value: 0.025310003422564474 and parameters: {'n_layers': 1, 'embedding_dim': 256, 'lr': 0.005528094586292102, 'lambda_val': 0.0001616557348163183, 'batch_size': 952, 'optimizer': 'RMSprop'}. Best is trial 13 with value: 0.04565790558453687.
2026-05-10 10:22:10,126 - optuna.study._optimize - INFO - Trial 42 pruned. 
2026-05-10 10:22:11,637 - optuna.study._optimize - INFO - Trial 43 pruned. 
2026-05-10 10:23:03,980 - optuna.study.study - INFO - Trial 44 finished with value: 0.03501935577910662 and parameters: {'n_layers': 1, 'embedding_dim': 96, 'lr': 0.0022216404240748295, 'lambda_val': 0.00015340556670789308, 'batch_size': 1682, 'optimizer': 'RMSprop'}. Best is trial 13 with value: 0.04565790558453687.
2026-05-10 10:23:05,211 - optuna.study._optimize - INFO - Trial 45 pruned. 
2026-05-10 10:23:06,507 - optuna.study._optimize - INFO - Trial 46 pruned. 
2026-05-10 10:23:08,030 - optuna.study._optimize - INFO - Trial 47 pruned. 
2026-05-10 10:23:09,489 - optuna.study._optimize - INFO - Trial 48 pruned. 
2026-05-10 10:23:10,805 - optuna.study._optimize - INFO - Trial 49 pruned. 
2026-05-10 10:23:12,079 - optuna.study._optimize - INFO - Trial 50 pruned. 
2026-05-10 10:24:10,040 - optuna.study.study - INFO - Trial 51 finished with value: 0.02360344812744162 and parameters: {'n_layers': 1, 'embedding_dim': 256, 'lr': 0.0056933621331680785, 'lambda_val': 0.00023997631726328222, 'batch_size': 996, 'optimizer': 'RMSprop'}. Best is trial 13 with value: 0.04565790558453687.
2026-05-10 10:24:11,258 - optuna.study._optimize - INFO - Trial 52 pruned. 
2026-05-10 10:24:12,499 - optuna.study._optimize - INFO - Trial 53 pruned. 
2026-05-10 10:24:14,662 - optuna.study._optimize - INFO - Trial 54 pruned. 
2026-05-10 10:24:16,047 - optuna.study._optimize - INFO - Trial 55 pruned. 
2026-05-10 10:24:17,287 - optuna.study._optimize - INFO - Trial 56 pruned. 
2026-05-10 10:25:15,298 - optuna.study.study - INFO - Trial 57 finished with value: 0.0232033684756638 and parameters: {'n_layers': 1, 'embedding_dim': 256, 'lr': 0.00528626045021693, 'lambda_val': 2.5967460489123247e-05, 'batch_size': 730, 'optimizer': 'RMSprop'}. Best is trial 13 with value: 0.04565790558453687.
2026-05-10 10:25:17,581 - optuna.study._optimize - INFO - Trial 58 pruned. 
2026-05-10 10:25:18,910 - optuna.study._optimize - INFO - Trial 59 pruned. 
2026-05-10 10:25:20,173 - optuna.study._optimize - INFO - Trial 60 pruned. 
2026-05-10 10:25:21,537 - optuna.study._optimize - INFO - Trial 61 pruned. 
2026-05-10 10:25:25,072 - optuna.study._optimize - INFO - Trial 62 pruned. 
2026-05-10 10:25:26,801 - optuna.study._optimize - INFO - Trial 63 pruned. 
2026-05-10 10:25:28,075 - optuna.study._optimize - INFO - Trial 64 pruned. 
2026-05-10 10:25:29,317 - optuna.study._optimize - INFO - Trial 65 pruned. 
2026-05-10 10:25:30,625 - optuna.study._optimize - INFO - Trial 66 pruned. 
2026-05-10 10:25:31,943 - optuna.study._optimize - INFO - Trial 67 pruned. 
2026-05-10 10:25:34,182 - optuna.study._optimize - INFO - Trial 68 pruned. 
2026-05-10 10:25:35,509 - optuna.study._optimize - INFO - Trial 69 pruned. 
2026-05-10 10:26:34,264 - optuna.study.study - INFO - Trial 70 finished with value: 0.023741709806021888 and parameters: {'n_layers': 1, 'embedding_dim': 256, 'lr': 0.007189937370103211, 'lambda_val': 0.0004762287451907257, 'batch_size': 1959, 'optimizer': 'RMSprop'}. Best is trial 13 with value: 0.04565790558453687.
2026-05-10 10:26:36,857 - optuna.study._optimize - INFO - Trial 71 pruned. 
2026-05-10 10:26:43,818 - optuna.study._optimize - INFO - Trial 72 pruned. 
2026-05-10 10:26:45,147 - optuna.study._optimize - INFO - Trial 73 pruned. 
2026-05-10 10:26:46,832 - optuna.study._optimize - INFO - Trial 74 pruned. 
2026-05-10 10:26:48,075 - optuna.study._optimize - INFO - Trial 75 pruned. 
2026-05-10 10:26:50,535 - optuna.study._optimize - INFO - Trial 76 pruned. 
2026-05-10 10:26:51,833 - optuna.study._optimize - INFO - Trial 77 pruned. 
2026-05-10 10:26:53,974 - optuna.study._optimize - INFO - Trial 78 pruned. 
2026-05-10 10:26:55,184 - optuna.study._optimize - INFO - Trial 79 pruned. 
2026-05-10 10:26:56,414 - optuna.study._optimize - INFO - Trial 80 pruned. 
2026-05-10 10:27:54,630 - optuna.study.study - INFO - Trial 81 finished with value: 0.02326070149765208 and parameters: {'n_layers': 1, 'embedding_dim': 256, 'lr': 0.0052969988738721125, 'lambda_val': 1.7666558213977944e-05, 'batch_size': 714, 'optimizer': 'RMSprop'}. Best is trial 13 with value: 0.04565790558453687.
2026-05-10 10:27:57,866 - optuna.study._optimize - INFO - Trial 82 pruned. 
2026-05-10 10:28:03,085 - optuna.study._optimize - INFO - Trial 83 pruned. 
2026-05-10 10:28:04,449 - optuna.study._optimize - INFO - Trial 84 pruned. 
2026-05-10 10:28:05,921 - optuna.study._optimize - INFO - Trial 85 pruned. 
2026-05-10 10:28:08,593 - optuna.study._optimize - INFO - Trial 86 pruned. 
2026-05-10 10:28:11,011 - optuna.study._optimize - INFO - Trial 87 pruned. 
2026-05-10 10:28:12,274 - optuna.study._optimize - INFO - Trial 88 pruned. 
2026-05-10 10:28:13,638 - optuna.study._optimize - INFO - Trial 89 pruned. 
2026-05-10 10:29:15,530 - optuna.study.study - INFO - Trial 90 finished with value: 0.021550158123069724 and parameters: {'n_layers': 1, 'embedding_dim': 256, 'lr': 0.005982661275627663, 'lambda_val': 6.440966606079091e-05, 'batch_size': 1714, 'optimizer': 'RMSprop'}. Best is trial 13 with value: 0.04565790558453687.
2026-05-10 10:30:12,894 - optuna.study.study - INFO - Trial 91 finished with value: 0.02474906322013896 and parameters: {'n_layers': 1, 'embedding_dim': 256, 'lr': 0.005832611972926664, 'lambda_val': 2.802582481805098e-05, 'batch_size': 744, 'optimizer': 'RMSprop'}. Best is trial 13 with value: 0.04565790558453687.
2026-05-10 10:30:14,521 - optuna.study._optimize - INFO - Trial 92 pruned. 
2026-05-10 10:30:16,904 - optuna.study._optimize - INFO - Trial 93 pruned. 
2026-05-10 10:30:18,222 - optuna.study._optimize - INFO - Trial 94 pruned. 
2026-05-10 10:30:19,530 - optuna.study._optimize - INFO - Trial 95 pruned. 
2026-05-10 10:30:20,860 - optuna.study._optimize - INFO - Trial 96 pruned. 
2026-05-10 10:30:22,124 - optuna.study._optimize - INFO - Trial 97 pruned. 
2026-05-10 10:30:23,477 - optuna.study._optimize - INFO - Trial 98 pruned. 
