2026-05-10 04:34:45,968 - optuna.study.study - INFO - Trial 93 finished with value: 0.0212892581705812 and parameters: {'n_layers': 2, 'embedding_dim': 256, 'lr': 0.007113686712124172, 'lambda_val': 9.650243602576646e-06, 'batch_size': 855, 'optimizer': 'RMSprop'}. Best is trial 0 with value: 0.03270814386773587.
2026-05-10 04:35:53,677 - optuna.study.study - INFO - Trial 94 finished with value: 0.01306859956574479 and parameters: {'n_layers': 2, 'embedding_dim': 256, 'lr': 0.011359763415406938, 'lambda_val': 1.714722993406487e-05, 'batch_size': 2589, 'optimizer': 'RMSprop'}. Best is trial 0 with value: 0.03270814386773587.
2026-05-10 04:35:54,950 - optuna.study._optimize - INFO - Trial 95 pruned. 
2026-05-10 04:35:56,279 - optuna.study._optimize - INFO - Trial 96 pruned. 
2026-05-10 04:35:57,609 - optuna.study._optimize - INFO - Trial 97 pruned. 
2026-05-10 04:35:59,094 - optuna.study._optimize - INFO - Trial 98 pruned. 
2026-05-10 04:36:00,447 - optuna.study._optimize - INFO - Trial 99 pruned. 
2026-05-10 04:36:50,813 - root - INFO -   **** Training e_1M_1c1dcs_rand4
2026-05-10 04:36:50,870 - root - INFO -   **** Getting 167284/669182 random edges
2026-05-10 04:36:51,248 - optuna.storages._rdb.storage - INFO - A new study created in RDB with name: Study_e_1M_1c1dcs_rand4
2026-05-10 04:37:32,477 - optuna.study.study - INFO - Trial 0 finished with value: 0.01851282482749604 and parameters: {'n_layers': 1, 'embedding_dim': 32, 'lr': 0.09904122295929242, 'lambda_val': 0.0021523822116919092, 'batch_size': 2343, 'optimizer': 'Adam'}. Best is trial 0 with value: 0.01851282482749604.
2026-05-10 04:38:10,772 - optuna.study.study - INFO - Trial 1 finished with value: 0.0038928054590966423 and parameters: {'n_layers': 1, 'embedding_dim': 64, 'lr': 3.244567546786456e-05, 'lambda_val': 0.0002841947479148877, 'batch_size': 1334, 'optimizer': 'SGD'}. Best is trial 0 with value: 0.01851282482749604.
2026-05-10 04:38:56,466 - optuna.study.study - INFO - Trial 2 finished with value: 0.012048806408761837 and parameters: {'n_layers': 2, 'embedding_dim': 64, 'lr': 0.0003175101264562813, 'lambda_val': 3.1264308755368136e-06, 'batch_size': 2986, 'optimizer': 'RMSprop'}. Best is trial 0 with value: 0.01851282482749604.
2026-05-10 04:39:41,083 - optuna.study.study - INFO - Trial 3 finished with value: 0.005101433379774204 and parameters: {'n_layers': 2, 'embedding_dim': 96, 'lr': 0.0001458786131498109, 'lambda_val': 0.02300610172009379, 'batch_size': 644, 'optimizer': 'SGD'}. Best is trial 0 with value: 0.01851282482749604.
2026-05-10 04:40:35,902 - optuna.study.study - INFO - Trial 4 finished with value: 0.026537301336730212 and parameters: {'n_layers': 2, 'embedding_dim': 128, 'lr': 0.010346547233859082, 'lambda_val': 0.006906899606277714, 'batch_size': 2488, 'optimizer': 'Adam'}. Best is trial 4 with value: 0.026537301336730212.
2026-05-10 04:40:38,115 - optuna.study._optimize - INFO - Trial 5 pruned. 
2026-05-10 04:41:19,706 - optuna.study.study - INFO - Trial 6 finished with value: 0.02447007640748849 and parameters: {'n_layers': 1, 'embedding_dim': 32, 'lr': 0.0006527974132329361, 'lambda_val': 0.0001400575915213661, 'batch_size': 712, 'optimizer': 'RMSprop'}. Best is trial 4 with value: 0.026537301336730212.
2026-05-10 04:41:20,999 - optuna.study._optimize - INFO - Trial 7 pruned. 
2026-05-10 04:41:22,279 - optuna.study._optimize - INFO - Trial 8 pruned. 
2026-05-10 04:41:23,679 - optuna.study._optimize - INFO - Trial 9 pruned. 
2026-05-10 04:41:25,054 - optuna.study._optimize - INFO - Trial 10 pruned. 
2026-05-10 04:41:26,826 - optuna.study._optimize - INFO - Trial 11 pruned. 
2026-05-10 04:41:28,134 - optuna.study._optimize - INFO - Trial 12 pruned. 
2026-05-10 04:41:29,563 - optuna.study._optimize - INFO - Trial 13 pruned. 
2026-05-10 04:41:31,834 - optuna.study._optimize - INFO - Trial 14 pruned. 
2026-05-10 04:41:34,138 - optuna.study._optimize - INFO - Trial 15 pruned. 
2026-05-10 04:41:35,489 - optuna.study._optimize - INFO - Trial 16 pruned. 
2026-05-10 04:41:36,842 - optuna.study._optimize - INFO - Trial 17 pruned. 
2026-05-10 04:41:38,139 - optuna.study._optimize - INFO - Trial 18 pruned. 
2026-05-10 04:41:39,495 - optuna.study._optimize - INFO - Trial 19 pruned. 
2026-05-10 04:42:36,108 - optuna.study.study - INFO - Trial 20 finished with value: 0.026443443882425477 and parameters: {'n_layers': 1, 'embedding_dim': 256, 'lr': 0.0032489881140678875, 'lambda_val': 1.2081635186505939e-05, 'batch_size': 2528, 'optimizer': 'Adam'}. Best is trial 4 with value: 0.026537301336730212.
2026-05-10 04:42:37,481 - optuna.study._optimize - INFO - Trial 21 pruned. 
2026-05-10 04:42:38,733 - optuna.study._optimize - INFO - Trial 22 pruned. 
2026-05-10 04:42:40,584 - optuna.study._optimize - INFO - Trial 23 pruned. 
2026-05-10 04:42:41,892 - optuna.study._optimize - INFO - Trial 24 pruned. 
2026-05-10 04:42:45,201 - optuna.study._optimize - INFO - Trial 25 pruned. 
2026-05-10 04:42:46,628 - optuna.study._optimize - INFO - Trial 26 pruned. 
2026-05-10 04:42:48,064 - optuna.study._optimize - INFO - Trial 27 pruned. 
2026-05-10 04:42:49,534 - optuna.study._optimize - INFO - Trial 28 pruned. 
2026-05-10 04:42:50,847 - optuna.study._optimize - INFO - Trial 29 pruned. 
2026-05-10 04:42:52,167 - optuna.study._optimize - INFO - Trial 30 pruned. 
2026-05-10 04:42:53,508 - optuna.study._optimize - INFO - Trial 31 pruned. 
2026-05-10 04:42:55,335 - optuna.study._optimize - INFO - Trial 32 pruned. 
2026-05-10 04:42:56,680 - optuna.study._optimize - INFO - Trial 33 pruned. 
2026-05-10 04:42:58,005 - optuna.study._optimize - INFO - Trial 34 pruned. 
2026-05-10 04:42:59,374 - optuna.study._optimize - INFO - Trial 35 pruned. 
2026-05-10 04:43:00,820 - optuna.study._optimize - INFO - Trial 36 pruned. 
2026-05-10 04:43:03,088 - optuna.study._optimize - INFO - Trial 37 pruned. 
2026-05-10 04:43:04,523 - optuna.study._optimize - INFO - Trial 38 pruned. 
2026-05-10 04:43:06,021 - optuna.study._optimize - INFO - Trial 39 pruned. 
2026-05-10 04:43:07,904 - optuna.study._optimize - INFO - Trial 40 pruned. 
2026-05-10 04:43:09,382 - optuna.study._optimize - INFO - Trial 41 pruned. 
2026-05-10 04:43:10,793 - optuna.study._optimize - INFO - Trial 42 pruned. 
2026-05-10 04:43:12,078 - optuna.study._optimize - INFO - Trial 43 pruned. 
2026-05-10 04:43:13,397 - optuna.study._optimize - INFO - Trial 44 pruned. 
2026-05-10 04:43:14,771 - optuna.study._optimize - INFO - Trial 45 pruned. 
2026-05-10 04:43:16,123 - optuna.study._optimize - INFO - Trial 46 pruned. 
2026-05-10 04:43:17,602 - optuna.study._optimize - INFO - Trial 47 pruned. 
2026-05-10 04:43:19,015 - optuna.study._optimize - INFO - Trial 48 pruned. 
2026-05-10 04:43:21,534 - optuna.study._optimize - INFO - Trial 49 pruned. 
2026-05-10 04:43:22,908 - optuna.study._optimize - INFO - Trial 50 pruned. 
2026-05-10 04:43:25,092 - optuna.study._optimize - INFO - Trial 51 pruned. 
2026-05-10 04:43:26,422 - optuna.study._optimize - INFO - Trial 52 pruned. 
2026-05-10 04:43:27,687 - optuna.study._optimize - INFO - Trial 53 pruned. 
2026-05-10 04:43:29,721 - optuna.study._optimize - INFO - Trial 54 pruned. 
2026-05-10 04:43:31,028 - optuna.study._optimize - INFO - Trial 55 pruned. 
2026-05-10 04:43:32,313 - optuna.study._optimize - INFO - Trial 56 pruned. 
2026-05-10 04:43:33,627 - optuna.study._optimize - INFO - Trial 57 pruned. 
2026-05-10 04:43:35,265 - optuna.study._optimize - INFO - Trial 58 pruned. 
2026-05-10 04:43:36,497 - optuna.study._optimize - INFO - Trial 59 pruned. 
2026-05-10 04:43:37,881 - optuna.study._optimize - INFO - Trial 60 pruned. 
2026-05-10 04:43:39,177 - optuna.study._optimize - INFO - Trial 61 pruned. 
2026-05-10 04:43:41,285 - optuna.study._optimize - INFO - Trial 62 pruned. 
2026-05-10 04:43:42,693 - optuna.study._optimize - INFO - Trial 63 pruned. 
2026-05-10 04:43:44,041 - optuna.study._optimize - INFO - Trial 64 pruned. 
2026-05-10 04:43:45,336 - optuna.study._optimize - INFO - Trial 65 pruned. 
2026-05-10 04:43:47,031 - optuna.study._optimize - INFO - Trial 66 pruned. 
2026-05-10 04:43:48,328 - optuna.study._optimize - INFO - Trial 67 pruned. 
2026-05-10 04:44:33,673 - optuna.study.study - INFO - Trial 68 finished with value: 0.01827681531567203 and parameters: {'n_layers': 1, 'embedding_dim': 128, 'lr': 0.009195147679583212, 'lambda_val': 0.0005614800194270379, 'batch_size': 3055, 'optimizer': 'RMSprop'}. Best is trial 4 with value: 0.026537301336730212.
2026-05-10 04:45:19,138 - optuna.study.study - INFO - Trial 69 finished with value: 0.017436417133592372 and parameters: {'n_layers': 1, 'embedding_dim': 128, 'lr': 0.007939607796895627, 'lambda_val': 0.0005075432145011481, 'batch_size': 3052, 'optimizer': 'RMSprop'}. Best is trial 4 with value: 0.026537301336730212.
2026-05-10 04:46:05,156 - optuna.study.study - INFO - Trial 70 finished with value: 0.01814089436416397 and parameters: {'n_layers': 1, 'embedding_dim': 128, 'lr': 0.009101087227479347, 'lambda_val': 0.0006006603093404036, 'batch_size': 3299, 'optimizer': 'RMSprop'}. Best is trial 4 with value: 0.026537301336730212.
2026-05-10 04:46:08,416 - optuna.study._optimize - INFO - Trial 71 pruned. 
2026-05-10 04:46:55,177 - optuna.study.study - INFO - Trial 72 finished with value: 0.020637409528839898 and parameters: {'n_layers': 1, 'embedding_dim': 128, 'lr': 0.005061437054723574, 'lambda_val': 0.0004491341474610613, 'batch_size': 3312, 'optimizer': 'RMSprop'}. Best is trial 4 with value: 0.026537301336730212.
2026-05-10 04:47:41,326 - optuna.study.study - INFO - Trial 73 finished with value: 0.021844997108771143 and parameters: {'n_layers': 1, 'embedding_dim': 128, 'lr': 0.0053442023022850765, 'lambda_val': 0.0009187927573628758, 'batch_size': 3137, 'optimizer': 'RMSprop'}. Best is trial 4 with value: 0.026537301336730212.
2026-05-10 04:47:42,556 - optuna.study._optimize - INFO - Trial 74 pruned. 
2026-05-10 04:47:44,317 - optuna.study._optimize - INFO - Trial 75 pruned. 
2026-05-10 04:47:46,600 - optuna.study._optimize - INFO - Trial 76 pruned. 
2026-05-10 04:47:47,964 - optuna.study._optimize - INFO - Trial 77 pruned. 
2026-05-10 04:47:49,327 - optuna.study._optimize - INFO - Trial 78 pruned. 
2026-05-10 04:47:51,464 - optuna.study._optimize - INFO - Trial 79 pruned. 
2026-05-10 04:47:53,713 - optuna.study._optimize - INFO - Trial 80 pruned. 
2026-05-10 04:47:55,070 - optuna.study._optimize - INFO - Trial 81 pruned. 
2026-05-10 04:47:57,734 - optuna.study._optimize - INFO - Trial 82 pruned. 
2026-05-10 04:47:59,568 - optuna.study._optimize - INFO - Trial 83 pruned. 
2026-05-10 04:48:45,276 - optuna.study.study - INFO - Trial 84 finished with value: 0.021083896192613902 and parameters: {'n_layers': 1, 'embedding_dim': 128, 'lr': 0.004649373433708534, 'lambda_val': 0.00020987203142235026, 'batch_size': 3485, 'optimizer': 'RMSprop'}. Best is trial 4 with value: 0.026537301336730212.
2026-05-10 04:48:46,615 - optuna.study._optimize - INFO - Trial 85 pruned. 
2026-05-10 04:48:48,401 - optuna.study._optimize - INFO - Trial 86 pruned. 
2026-05-10 04:48:49,697 - optuna.study._optimize - INFO - Trial 87 pruned. 
2026-05-10 04:48:51,893 - optuna.study._optimize - INFO - Trial 88 pruned. 
2026-05-10 04:48:53,155 - optuna.study._optimize - INFO - Trial 89 pruned. 
2026-05-10 04:48:55,361 - optuna.study._optimize - INFO - Trial 90 pruned. 
2026-05-10 04:49:41,075 - optuna.study.study - INFO - Trial 91 finished with value: 0.01778696184098294 and parameters: {'n_layers': 1, 'embedding_dim': 128, 'lr': 0.008250590569673285, 'lambda_val': 0.00047123750232861615, 'batch_size': 3062, 'optimizer': 'RMSprop'}. Best is trial 4 with value: 0.026537301336730212.
2026-05-10 04:49:42,437 - optuna.study._optimize - INFO - Trial 92 pruned. 
2026-05-10 04:49:44,764 - optuna.study._optimize - INFO - Trial 93 pruned. 
2026-05-10 04:49:47,021 - optuna.study._optimize - INFO - Trial 94 pruned. 
2026-05-10 04:49:48,238 - optuna.study._optimize - INFO - Trial 95 pruned. 
2026-05-10 04:49:50,447 - optuna.study._optimize - INFO - Trial 96 pruned. 
2026-05-10 04:49:51,815 - optuna.study._optimize - INFO - Trial 97 pruned. 
2026-05-10 04:49:53,605 - optuna.study._optimize - INFO - Trial 98 pruned. 
2026-05-10 04:49:54,958 - optuna.study._optimize - INFO - Trial 99 pruned. 
2026-05-10 04:50:44,564 - root - INFO -   **** Training e_1M_1c1dcs_rand5
2026-05-10 04:50:44,616 - root - INFO -   **** Getting 167284/669182 random edges
2026-05-10 04:50:44,752 - optuna.storages._rdb.storage - INFO - A new study created in RDB with name: Study_e_1M_1c1dcs_rand5
2026-05-10 04:52:00,659 - optuna.study.study - INFO - Trial 0 finished with value: 0.005403279971902388 and parameters: {'n_layers': 3, 'embedding_dim': 256, 'lr': 0.021573388761213314, 'lambda_val': 1.6853007482433758e-06, 'batch_size': 1357, 'optimizer': 'SGD'}. Best is trial 0 with value: 0.005403279971902388.
2026-05-10 04:53:07,542 - optuna.study.study - INFO - Trial 1 finished with value: 0.0054871200606765305 and parameters: {'n_layers': 4, 'embedding_dim': 128, 'lr': 0.00010484316595790414, 'lambda_val': 0.019367729732674692, 'batch_size': 666, 'optimizer': 'SGD'}. Best is trial 1 with value: 0.0054871200606765305.
2026-05-10 04:53:58,762 - optuna.study.study - INFO - Trial 2 finished with value: 0.014232210289449326 and parameters: {'n_layers': 3, 'embedding_dim': 64, 'lr': 0.0007871736840760954, 'lambda_val': 6.3151534360357196e-06, 'batch_size': 2425, 'optimizer': 'Adam'}. Best is trial 2 with value: 0.014232210289449326.
2026-05-10 04:54:41,246 - optuna.study.study - INFO - Trial 3 finished with value: 0.005017241564073617 and parameters: {'n_layers': 1, 'embedding_dim': 96, 'lr': 5.725929712984453e-05, 'lambda_val': 0.00022965030666141477, 'batch_size': 3511, 'optimizer': 'SGD'}. Best is trial 2 with value: 0.014232210289449326.
2026-05-10 04:56:00,027 - optuna.study.study - INFO - Trial 4 finished with value: 0.005787999483722199 and parameters: {'n_layers': 3, 'embedding_dim': 256, 'lr': 0.016530528852408785, 'lambda_val': 0.008780954369641924, 'batch_size': 3683, 'optimizer': 'SGD'}. Best is trial 2 with value: 0.014232210289449326.
2026-05-10 04:56:01,344 - optuna.study._optimize - INFO - Trial 5 pruned. 
2026-05-10 04:56:02,707 - optuna.study._optimize - INFO - Trial 6 pruned. 
2026-05-10 04:56:04,412 - optuna.study._optimize - INFO - Trial 7 pruned. 
2026-05-10 04:56:05,724 - optuna.study._optimize - INFO - Trial 8 pruned. 
2026-05-10 04:56:06,976 - optuna.study._optimize - INFO - Trial 9 pruned. 
2026-05-10 04:56:55,179 - optuna.study.study - INFO - Trial 10 finished with value: 0.006890852623463015 and parameters: {'n_layers': 2, 'embedding_dim': 64, 'lr': 1.1265547598960847e-05, 'lambda_val': 2.832108828762903e-05, 'batch_size': 2566, 'optimizer': 'RMSprop'}. Best is trial 2 with value: 0.014232210289449326.
2026-05-10 04:56:56,473 - optuna.study._optimize - INFO - Trial 11 pruned. 
2026-05-10 04:56:57,824 - optuna.study._optimize - INFO - Trial 12 pruned. 
2026-05-10 04:56:59,223 - optuna.study._optimize - INFO - Trial 13 pruned. 
2026-05-10 04:57:00,549 - optuna.study._optimize - INFO - Trial 14 pruned. 
2026-05-10 04:57:01,834 - optuna.study._optimize - INFO - Trial 15 pruned. 
2026-05-10 04:57:03,036 - optuna.study._optimize - INFO - Trial 16 pruned. 
2026-05-10 04:57:52,198 - optuna.study.study - INFO - Trial 17 finished with value: 0.020063067477411163 and parameters: {'n_layers': 2, 'embedding_dim': 96, 'lr': 0.009580727902944895, 'lambda_val': 8.703899489909804e-05, 'batch_size': 894, 'optimizer': 'RMSprop'}. Best is trial 17 with value: 0.020063067477411163.
2026-05-10 04:57:53,569 - optuna.study._optimize - INFO - Trial 18 pruned. 
2026-05-10 04:58:44,701 - optuna.study.study - INFO - Trial 19 finished with value: 0.018200969785068077 and parameters: {'n_layers': 2, 'embedding_dim': 96, 'lr': 0.009261249735675622, 'lambda_val': 4.302314118748781e-06, 'batch_size': 1045, 'optimizer': 'RMSprop'}. Best is trial 17 with value: 0.020063067477411163.
2026-05-10 04:59:28,469 - optuna.study.study - INFO - Trial 20 finished with value: 0.007609860830194126 and parameters: {'n_layers': 1, 'embedding_dim': 96, 'lr': 0.09707713776247617, 'lambda_val': 5.096223472417874e-06, 'batch_size': 1062, 'optimizer': 'RMSprop'}. Best is trial 17 with value: 0.020063067477411163.
2026-05-10 05:00:19,743 - optuna.study.study - INFO - Trial 21 finished with value: 0.01887017973132172 and parameters: {'n_layers': 2, 'embedding_dim': 96, 'lr': 0.009273718100734935, 'lambda_val': 7.663086675360876e-06, 'batch_size': 944, 'optimizer': 'RMSprop'}. Best is trial 17 with value: 0.020063067477411163.
2026-05-10 05:01:10,749 - optuna.study.study - INFO - Trial 22 finished with value: 0.020210484045506936 and parameters: {'n_layers': 2, 'embedding_dim': 96, 'lr': 0.00957819161362218, 'lambda_val': 8.341890255787144e-05, 'batch_size': 930, 'optimizer': 'RMSprop'}. Best is trial 22 with value: 0.020210484045506936.
2026-05-10 05:02:01,871 - optuna.study.study - INFO - Trial 23 finished with value: 0.013862763551062675 and parameters: {'n_layers': 2, 'embedding_dim': 96, 'lr': 0.024888368828944324, 'lambda_val': 7.161024582026174e-05, 'batch_size': 936, 'optimizer': 'RMSprop'}. Best is trial 22 with value: 0.020210484045506936.
2026-05-10 05:02:03,288 - optuna.study._optimize - INFO - Trial 24 pruned. 
2026-05-10 05:02:04,595 - optuna.study._optimize - INFO - Trial 25 pruned. 
2026-05-10 05:02:05,891 - optuna.study._optimize - INFO - Trial 26 pruned. 
2026-05-10 05:02:08,282 - optuna.study._optimize - INFO - Trial 27 pruned. 
2026-05-10 05:02:54,858 - optuna.study.study - INFO - Trial 28 finished with value: 0.023878254401570854 and parameters: {'n_layers': 1, 'embedding_dim': 96, 'lr': 0.005260415989504495, 'lambda_val': 1.1738874707842934e-05, 'batch_size': 685, 'optimizer': 'RMSprop'}. Best is trial 28 with value: 0.023878254401570854.
2026-05-10 05:02:56,074 - optuna.study._optimize - INFO - Trial 29 pruned. 
2026-05-10 05:02:58,224 - optuna.study._optimize - INFO - Trial 30 pruned. 
2026-05-10 05:03:48,893 - optuna.study.study - INFO - Trial 31 finished with value: 0.019039462840338674 and parameters: {'n_layers': 2, 'embedding_dim': 96, 'lr': 0.010011936685695805, 'lambda_val': 1.192838340153544e-05, 'batch_size': 828, 'optimizer': 'RMSprop'}. Best is trial 28 with value: 0.023878254401570854.
2026-05-10 05:04:45,232 - optuna.study.study - INFO - Trial 32 finished with value: 0.016102226014979588 and parameters: {'n_layers': 3, 'embedding_dim': 96, 'lr': 0.013465466222469111, 'lambda_val': 1.2648902245613741e-05, 'batch_size': 756, 'optimizer': 'RMSprop'}. Best is trial 28 with value: 0.023878254401570854.
2026-05-10 05:04:47,557 - optuna.study._optimize - INFO - Trial 33 pruned. 
2026-05-10 05:04:48,931 - optuna.study._optimize - INFO - Trial 34 pruned. 
2026-05-10 05:05:35,524 - optuna.study.study - INFO - Trial 35 finished with value: 0.020255692635098188 and parameters: {'n_layers': 1, 'embedding_dim': 96, 'lr': 0.006954126198395543, 'lambda_val': 3.909543455994005e-05, 'batch_size': 772, 'optimizer': 'RMSprop'}. Best is trial 28 with value: 0.023878254401570854.
2026-05-10 05:05:36,785 - optuna.study._optimize - INFO - Trial 36 pruned. 
2026-05-10 05:05:38,082 - optuna.study._optimize - INFO - Trial 37 pruned. 
2026-05-10 05:05:39,367 - optuna.study._optimize - INFO - Trial 38 pruned. 
2026-05-10 05:05:40,619 - optuna.study._optimize - INFO - Trial 39 pruned. 
2026-05-10 05:05:42,847 - optuna.study._optimize - INFO - Trial 40 pruned. 
2026-05-10 05:05:45,207 - optuna.study._optimize - INFO - Trial 41 pruned. 
2026-05-10 05:05:46,526 - optuna.study._optimize - INFO - Trial 42 pruned. 
2026-05-10 05:06:38,001 - optuna.study.study - INFO - Trial 43 finished with value: 0.016454997095587974 and parameters: {'n_layers': 2, 'embedding_dim': 96, 'lr': 0.014152719538347599, 'lambda_val': 5.826513171674463e-05, 'batch_size': 883, 'optimizer': 'RMSprop'}. Best is trial 28 with value: 0.023878254401570854.
2026-05-10 05:06:39,253 - optuna.study._optimize - INFO - Trial 44 pruned. 
2026-05-10 05:07:34,414 - optuna.study.study - INFO - Trial 45 finished with value: 0.0250981236979396 and parameters: {'n_layers': 2, 'embedding_dim': 128, 'lr': 0.01136099745521618, 'lambda_val': 0.0017197505857788416, 'batch_size': 1793, 'optimizer': 'RMSprop'}. Best is trial 45 with value: 0.0250981236979396.
2026-05-10 05:07:35,882 - optuna.study._optimize - INFO - Trial 46 pruned. 
2026-05-10 05:07:38,291 - optuna.study._optimize - INFO - Trial 47 pruned. 
2026-05-10 05:07:39,588 - optuna.study._optimize - INFO - Trial 48 pruned. 
2026-05-10 05:07:40,895 - optuna.study._optimize - INFO - Trial 49 pruned. 
2026-05-10 05:07:42,320 - optuna.study._optimize - INFO - Trial 50 pruned. 
2026-05-10 05:08:34,070 - optuna.study.study - INFO - Trial 51 finished with value: 0.017692145952203055 and parameters: {'n_layers': 2, 'embedding_dim': 96, 'lr': 0.011175024957519555, 'lambda_val': 0.0001344694611607687, 'batch_size': 1065, 'optimizer': 'RMSprop'}. Best is trial 45 with value: 0.0250981236979396.
2026-05-10 05:08:35,309 - optuna.study._optimize - INFO - Trial 52 pruned. 
2026-05-10 05:08:37,603 - optuna.study._optimize - INFO - Trial 53 pruned. 
2026-05-10 05:08:39,264 - optuna.study._optimize - INFO - Trial 54 pruned. 
2026-05-10 05:08:40,549 - optuna.study._optimize - INFO - Trial 55 pruned. 
2026-05-10 05:08:42,866 - optuna.study._optimize - INFO - Trial 56 pruned. 
2026-05-10 05:08:44,290 - optuna.study._optimize - INFO - Trial 57 pruned. 
2026-05-10 05:08:45,979 - optuna.study._optimize - INFO - Trial 58 pruned. 
2026-05-10 05:08:47,358 - optuna.study._optimize - INFO - Trial 59 pruned. 
2026-05-10 05:08:49,711 - optuna.study._optimize - INFO - Trial 60 pruned. 
