2026-05-10 07:58:04,736 - optuna.study._optimize - INFO - Trial 59 pruned. 
2026-05-10 07:58:07,204 - optuna.study._optimize - INFO - Trial 60 pruned. 
2026-05-10 07:58:08,605 - optuna.study._optimize - INFO - Trial 61 pruned. 
2026-05-10 07:58:13,054 - optuna.study._optimize - INFO - Trial 62 pruned. 
2026-05-10 07:58:16,275 - optuna.study._optimize - INFO - Trial 63 pruned. 
2026-05-10 07:58:20,335 - optuna.study._optimize - INFO - Trial 64 pruned. 
2026-05-10 07:58:22,954 - optuna.study._optimize - INFO - Trial 65 pruned. 
2026-05-10 07:58:24,281 - optuna.study._optimize - INFO - Trial 66 pruned. 
2026-05-10 07:58:26,491 - optuna.study._optimize - INFO - Trial 67 pruned. 
2026-05-10 07:58:27,704 - optuna.study._optimize - INFO - Trial 68 pruned. 
2026-05-10 07:58:31,055 - optuna.study._optimize - INFO - Trial 69 pruned. 
2026-05-10 07:58:36,551 - optuna.study._optimize - INFO - Trial 70 pruned. 
2026-05-10 07:58:37,862 - optuna.study._optimize - INFO - Trial 71 pruned. 
2026-05-10 07:58:39,279 - optuna.study._optimize - INFO - Trial 72 pruned. 
2026-05-10 07:58:44,283 - optuna.study._optimize - INFO - Trial 73 pruned. 
2026-05-10 07:59:31,927 - optuna.study.study - INFO - Trial 74 finished with value: 0.03837671705053677 and parameters: {'n_layers': 1, 'embedding_dim': 96, 'lr': 0.0010323104811216092, 'lambda_val': 0.00010126854727629256, 'batch_size': 2245, 'optimizer': 'RMSprop'}. Best is trial 74 with value: 0.03837671705053677.
2026-05-10 07:59:34,411 - optuna.study._optimize - INFO - Trial 75 pruned. 
2026-05-10 07:59:36,088 - optuna.study._optimize - INFO - Trial 76 pruned. 
2026-05-10 07:59:37,333 - optuna.study._optimize - INFO - Trial 77 pruned. 
2026-05-10 07:59:38,750 - optuna.study._optimize - INFO - Trial 78 pruned. 
2026-05-10 07:59:40,926 - optuna.study._optimize - INFO - Trial 79 pruned. 
2026-05-10 07:59:42,419 - optuna.study._optimize - INFO - Trial 80 pruned. 
2026-05-10 07:59:44,666 - optuna.study._optimize - INFO - Trial 81 pruned. 
2026-05-10 07:59:47,107 - optuna.study._optimize - INFO - Trial 82 pruned. 
2026-05-10 07:59:50,392 - optuna.study._optimize - INFO - Trial 83 pruned. 
2026-05-10 07:59:52,026 - optuna.study._optimize - INFO - Trial 84 pruned. 
2026-05-10 07:59:54,330 - optuna.study._optimize - INFO - Trial 85 pruned. 
2026-05-10 07:59:55,722 - optuna.study._optimize - INFO - Trial 86 pruned. 
2026-05-10 08:00:44,080 - optuna.study.study - INFO - Trial 87 finished with value: 0.021412475511610213 and parameters: {'n_layers': 1, 'embedding_dim': 96, 'lr': 0.004460765369074068, 'lambda_val': 0.00019215165753318415, 'batch_size': 4002, 'optimizer': 'RMSprop'}. Best is trial 74 with value: 0.03837671705053677.
2026-05-10 08:00:47,872 - optuna.study._optimize - INFO - Trial 88 pruned. 
2026-05-10 08:01:35,118 - optuna.study.study - INFO - Trial 89 finished with value: 0.03231665369622159 and parameters: {'n_layers': 1, 'embedding_dim': 96, 'lr': 0.0008267542646557746, 'lambda_val': 0.000553420550590708, 'batch_size': 2016, 'optimizer': 'RMSprop'}. Best is trial 74 with value: 0.03837671705053677.
2026-05-10 08:01:36,892 - optuna.study._optimize - INFO - Trial 90 pruned. 
2026-05-10 08:01:39,538 - optuna.study._optimize - INFO - Trial 91 pruned. 
2026-05-10 08:01:41,759 - optuna.study._optimize - INFO - Trial 92 pruned. 
2026-05-10 08:01:43,070 - optuna.study._optimize - INFO - Trial 93 pruned. 
2026-05-10 08:01:44,349 - optuna.study._optimize - INFO - Trial 94 pruned. 
2026-05-10 08:02:33,938 - optuna.study.study - INFO - Trial 95 finished with value: 0.03307456496386108 and parameters: {'n_layers': 1, 'embedding_dim': 96, 'lr': 0.0014228095164022126, 'lambda_val': 0.0008206390762347266, 'batch_size': 3899, 'optimizer': 'Adam'}. Best is trial 74 with value: 0.03837671705053677.
2026-05-10 08:02:37,221 - optuna.study._optimize - INFO - Trial 96 pruned. 
2026-05-10 08:02:38,545 - optuna.study._optimize - INFO - Trial 97 pruned. 
2026-05-10 08:02:39,978 - optuna.study._optimize - INFO - Trial 98 pruned. 
2026-05-10 08:03:28,350 - optuna.study.study - INFO - Trial 99 finished with value: 0.035849501399376225 and parameters: {'n_layers': 1, 'embedding_dim': 96, 'lr': 0.0014988902962953673, 'lambda_val': 0.0017789181500591188, 'batch_size': 2038, 'optimizer': 'Adam'}. Best is trial 74 with value: 0.03837671705053677.
2026-05-10 08:04:10,720 - root - INFO -   **** Training e_1M_1c2dcs_rand5
2026-05-10 08:04:10,780 - root - INFO -   **** Getting 188411/669182 random edges
2026-05-10 08:04:10,928 - optuna.storages._rdb.storage - INFO - A new study created in RDB with name: Study_e_1M_1c2dcs_rand5
2026-05-10 08:05:07,488 - optuna.study.study - INFO - Trial 0 finished with value: 0.009022902059715933 and parameters: {'n_layers': 1, 'embedding_dim': 256, 'lr': 0.07492254144504891, 'lambda_val': 1.6685771904523167e-05, 'batch_size': 3126, 'optimizer': 'RMSprop'}. Best is trial 0 with value: 0.009022902059715933.
2026-05-10 08:06:15,166 - optuna.study.study - INFO - Trial 1 finished with value: 0.019576447884510077 and parameters: {'n_layers': 2, 'embedding_dim': 256, 'lr': 0.008699869788558062, 'lambda_val': 5.399832859384378e-06, 'batch_size': 1820, 'optimizer': 'Adam'}. Best is trial 1 with value: 0.019576447884510077.
2026-05-10 08:07:01,359 - optuna.study.study - INFO - Trial 2 finished with value: 0.006009728688985619 and parameters: {'n_layers': 3, 'embedding_dim': 32, 'lr': 0.008858366195728495, 'lambda_val': 2.0373778654718316e-05, 'batch_size': 2172, 'optimizer': 'SGD'}. Best is trial 1 with value: 0.019576447884510077.
2026-05-10 08:07:58,789 - optuna.study.study - INFO - Trial 3 finished with value: 0.01452048374309413 and parameters: {'n_layers': 3, 'embedding_dim': 96, 'lr': 0.020636794087321376, 'lambda_val': 0.00020049652452209637, 'batch_size': 1113, 'optimizer': 'Adam'}. Best is trial 1 with value: 0.019576447884510077.
2026-05-10 08:09:08,268 - optuna.study.study - INFO - Trial 4 finished with value: 0.017867559199391758 and parameters: {'n_layers': 2, 'embedding_dim': 256, 'lr': 0.00023139190595039742, 'lambda_val': 0.0005671122961361232, 'batch_size': 1536, 'optimizer': 'RMSprop'}. Best is trial 1 with value: 0.019576447884510077.
2026-05-10 08:10:01,881 - optuna.study.study - INFO - Trial 5 finished with value: 0.011554460245926048 and parameters: {'n_layers': 2, 'embedding_dim': 96, 'lr': 0.020669885454810504, 'lambda_val': 1.1867974459803265e-05, 'batch_size': 3364, 'optimizer': 'Adam'}. Best is trial 1 with value: 0.019576447884510077.
2026-05-10 08:10:03,147 - optuna.study._optimize - INFO - Trial 6 pruned. 
2026-05-10 08:10:04,481 - optuna.study._optimize - INFO - Trial 7 pruned. 
2026-05-10 08:10:05,738 - optuna.study._optimize - INFO - Trial 8 pruned. 
2026-05-10 08:10:07,061 - optuna.study._optimize - INFO - Trial 9 pruned. 
2026-05-10 08:10:08,428 - optuna.study._optimize - INFO - Trial 10 pruned. 
2026-05-10 08:10:10,468 - optuna.study._optimize - INFO - Trial 11 pruned. 
2026-05-10 08:10:11,691 - optuna.study._optimize - INFO - Trial 12 pruned. 
2026-05-10 08:10:14,830 - optuna.study._optimize - INFO - Trial 13 pruned. 
2026-05-10 08:10:16,058 - optuna.study._optimize - INFO - Trial 14 pruned. 
2026-05-10 08:10:18,224 - optuna.study._optimize - INFO - Trial 15 pruned. 
2026-05-10 08:11:15,161 - optuna.study.study - INFO - Trial 16 finished with value: 0.027478785523342774 and parameters: {'n_layers': 1, 'embedding_dim': 256, 'lr': 0.0005478044002633266, 'lambda_val': 0.006088039427973569, 'batch_size': 1202, 'optimizer': 'RMSprop'}. Best is trial 16 with value: 0.027478785523342774.
2026-05-10 08:11:16,490 - optuna.study._optimize - INFO - Trial 17 pruned. 
2026-05-10 08:11:17,819 - optuna.study._optimize - INFO - Trial 18 pruned. 
2026-05-10 08:11:19,233 - optuna.study._optimize - INFO - Trial 19 pruned. 
2026-05-10 08:11:21,425 - optuna.study._optimize - INFO - Trial 20 pruned. 
2026-05-10 08:11:22,900 - optuna.study._optimize - INFO - Trial 21 pruned. 
2026-05-10 08:11:24,201 - optuna.study._optimize - INFO - Trial 22 pruned. 
2026-05-10 08:11:25,845 - optuna.study._optimize - INFO - Trial 23 pruned. 
2026-05-10 08:11:27,157 - optuna.study._optimize - INFO - Trial 24 pruned. 
2026-05-10 08:11:28,473 - optuna.study._optimize - INFO - Trial 25 pruned. 
2026-05-10 08:11:29,719 - optuna.study._optimize - INFO - Trial 26 pruned. 
2026-05-10 08:11:31,009 - optuna.study._optimize - INFO - Trial 27 pruned. 
2026-05-10 08:11:32,278 - optuna.study._optimize - INFO - Trial 28 pruned. 
2026-05-10 08:11:33,612 - optuna.study._optimize - INFO - Trial 29 pruned. 
2026-05-10 08:11:34,869 - optuna.study._optimize - INFO - Trial 30 pruned. 
2026-05-10 08:11:36,158 - optuna.study._optimize - INFO - Trial 31 pruned. 
2026-05-10 08:11:38,012 - optuna.study._optimize - INFO - Trial 32 pruned. 
2026-05-10 08:11:40,653 - optuna.study._optimize - INFO - Trial 33 pruned. 
2026-05-10 08:11:41,900 - optuna.study._optimize - INFO - Trial 34 pruned. 
2026-05-10 08:11:43,234 - optuna.study._optimize - INFO - Trial 35 pruned. 
2026-05-10 08:11:44,517 - optuna.study._optimize - INFO - Trial 36 pruned. 
2026-05-10 08:11:45,841 - optuna.study._optimize - INFO - Trial 37 pruned. 
2026-05-10 08:11:47,229 - optuna.study._optimize - INFO - Trial 38 pruned. 
2026-05-10 08:11:48,588 - optuna.study._optimize - INFO - Trial 39 pruned. 
2026-05-10 08:11:52,055 - optuna.study._optimize - INFO - Trial 40 pruned. 
2026-05-10 08:11:53,533 - optuna.study._optimize - INFO - Trial 41 pruned. 
2026-05-10 08:12:47,235 - optuna.study.study - INFO - Trial 42 finished with value: 0.01218174889242039 and parameters: {'n_layers': 2, 'embedding_dim': 96, 'lr': 0.024541068725187406, 'lambda_val': 3.0483119712619822e-06, 'batch_size': 3533, 'optimizer': 'Adam'}. Best is trial 16 with value: 0.027478785523342774.
2026-05-10 08:12:48,545 - optuna.study._optimize - INFO - Trial 43 pruned. 
2026-05-10 08:12:50,190 - optuna.study._optimize - INFO - Trial 44 pruned. 
2026-05-10 08:12:51,568 - optuna.study._optimize - INFO - Trial 45 pruned. 
2026-05-10 08:12:52,792 - optuna.study._optimize - INFO - Trial 46 pruned. 
2026-05-10 08:12:55,723 - optuna.study._optimize - INFO - Trial 47 pruned. 
2026-05-10 08:12:57,002 - optuna.study._optimize - INFO - Trial 48 pruned. 
2026-05-10 08:12:58,413 - optuna.study._optimize - INFO - Trial 49 pruned. 
2026-05-10 08:12:59,736 - optuna.study._optimize - INFO - Trial 50 pruned. 
2026-05-10 08:13:00,993 - optuna.study._optimize - INFO - Trial 51 pruned. 
2026-05-10 08:13:02,316 - optuna.study._optimize - INFO - Trial 52 pruned. 
2026-05-10 08:13:04,159 - optuna.study._optimize - INFO - Trial 53 pruned. 
2026-05-10 08:13:06,567 - optuna.study._optimize - INFO - Trial 54 pruned. 
2026-05-10 08:13:07,846 - optuna.study._optimize - INFO - Trial 55 pruned. 
2026-05-10 08:13:10,078 - optuna.study._optimize - INFO - Trial 56 pruned. 
2026-05-10 08:13:11,457 - optuna.study._optimize - INFO - Trial 57 pruned. 
2026-05-10 08:13:12,813 - optuna.study._optimize - INFO - Trial 58 pruned. 
2026-05-10 08:13:15,686 - optuna.study._optimize - INFO - Trial 59 pruned. 
2026-05-10 08:13:16,933 - optuna.study._optimize - INFO - Trial 60 pruned. 
2026-05-10 08:13:19,783 - optuna.study._optimize - INFO - Trial 61 pruned. 
2026-05-10 08:13:22,192 - optuna.study._optimize - INFO - Trial 62 pruned. 
2026-05-10 08:13:24,656 - optuna.study._optimize - INFO - Trial 63 pruned. 
2026-05-10 08:13:27,036 - optuna.study._optimize - INFO - Trial 64 pruned. 
2026-05-10 08:13:28,431 - optuna.study._optimize - INFO - Trial 65 pruned. 
2026-05-10 08:13:29,832 - optuna.study._optimize - INFO - Trial 66 pruned. 
2026-05-10 08:14:23,930 - optuna.study.study - INFO - Trial 67 finished with value: 0.02471918682455987 and parameters: {'n_layers': 2, 'embedding_dim': 96, 'lr': 0.0007846695668331464, 'lambda_val': 4.825660951395474e-05, 'batch_size': 2807, 'optimizer': 'RMSprop'}. Best is trial 16 with value: 0.027478785523342774.
2026-05-10 08:14:25,174 - optuna.study._optimize - INFO - Trial 68 pruned. 
2026-05-10 08:14:26,701 - optuna.study._optimize - INFO - Trial 69 pruned. 
2026-05-10 08:14:27,936 - optuna.study._optimize - INFO - Trial 70 pruned. 
2026-05-10 08:14:30,481 - optuna.study._optimize - INFO - Trial 71 pruned. 
2026-05-10 08:14:31,826 - optuna.study._optimize - INFO - Trial 72 pruned. 
2026-05-10 08:14:33,547 - optuna.study._optimize - INFO - Trial 73 pruned. 
2026-05-10 08:14:34,815 - optuna.study._optimize - INFO - Trial 74 pruned. 
2026-05-10 08:14:36,106 - optuna.study._optimize - INFO - Trial 75 pruned. 
2026-05-10 08:14:37,462 - optuna.study._optimize - INFO - Trial 76 pruned. 
2026-05-10 08:14:38,937 - optuna.study._optimize - INFO - Trial 77 pruned. 
2026-05-10 08:14:40,282 - optuna.study._optimize - INFO - Trial 78 pruned. 
2026-05-10 08:14:41,561 - optuna.study._optimize - INFO - Trial 79 pruned. 
2026-05-10 08:14:44,478 - optuna.study._optimize - INFO - Trial 80 pruned. 
2026-05-10 08:14:45,724 - optuna.study._optimize - INFO - Trial 81 pruned. 
2026-05-10 08:14:47,479 - optuna.study._optimize - INFO - Trial 82 pruned. 
2026-05-10 08:14:48,749 - optuna.study._optimize - INFO - Trial 83 pruned. 
2026-05-10 08:14:50,012 - optuna.study._optimize - INFO - Trial 84 pruned. 
2026-05-10 08:14:51,319 - optuna.study._optimize - INFO - Trial 85 pruned. 
2026-05-10 08:14:52,881 - optuna.study._optimize - INFO - Trial 86 pruned. 
2026-05-10 08:14:54,198 - optuna.study._optimize - INFO - Trial 87 pruned. 
2026-05-10 08:14:55,647 - optuna.study._optimize - INFO - Trial 88 pruned. 
2026-05-10 08:14:57,062 - optuna.study._optimize - INFO - Trial 89 pruned. 
2026-05-10 08:14:58,981 - optuna.study._optimize - INFO - Trial 90 pruned. 
2026-05-10 08:15:00,368 - optuna.study._optimize - INFO - Trial 91 pruned. 
2026-05-10 08:15:02,927 - optuna.study._optimize - INFO - Trial 92 pruned. 
2026-05-10 08:15:04,462 - optuna.study._optimize - INFO - Trial 93 pruned. 
2026-05-10 08:15:05,964 - optuna.study._optimize - INFO - Trial 94 pruned. 
2026-05-10 08:15:07,445 - optuna.study._optimize - INFO - Trial 95 pruned. 
2026-05-10 08:15:10,653 - optuna.study._optimize - INFO - Trial 96 pruned. 
2026-05-10 08:15:11,905 - optuna.study._optimize - INFO - Trial 97 pruned. 
2026-05-10 08:15:13,250 - optuna.study._optimize - INFO - Trial 98 pruned. 
2026-05-10 08:15:17,161 - optuna.study._optimize - INFO - Trial 99 pruned. 
2026-05-10 08:16:07,973 - root - INFO - **** Training e_1M_1c3dcs
2026-05-10 08:16:07,973 - root - INFO -   ** 3-Dominant stats:
2026-05-10 08:16:07,973 - root - INFO -   ** Finding the dominant set:
2026-05-10 08:49:28,642 - root - INFO -   ** Getting the trainable edges:
2026-05-10 08:49:28,664 - helper_functions - INFO -      Number of nodes: 4620
2026-05-10 08:49:28,664 - helper_functions - INFO -      Ratio: 0.4779145546705286
2026-05-10 08:49:28,664 - helper_functions - INFO -      Number of unique users: 2971
2026-05-10 08:49:28,664 - helper_functions - INFO -      Number of unique items: 1649
2026-05-10 08:49:28,664 - helper_functions - INFO -      Total dominant set edge: 266017
2026-05-10 08:49:28,664 - helper_functions - INFO -      Trainable edges: 212813.6
2026-05-10 08:49:28,749 - root - INFO -   **** Getting 266017 dominant set edges
2026-05-10 08:49:28,885 - optuna.storages._rdb.storage - INFO - A new study created in RDB with name: Study_e_1M_1c3dcs
2026-05-10 08:50:20,139 - optuna.study.study - INFO - Trial 0 finished with value: 0.030142195319935877 and parameters: {'n_layers': 2, 'embedding_dim': 32, 'lr': 0.0013810244733432483, 'lambda_val': 6.932933788019301e-05, 'batch_size': 1271, 'optimizer': 'RMSprop'}. Best is trial 0 with value: 0.030142195319935877.
2026-05-10 08:51:40,223 - optuna.study.study - INFO - Trial 1 finished with value: 0.03364622409517507 and parameters: {'n_layers': 2, 'embedding_dim': 256, 'lr': 2.2476505654509766e-05, 'lambda_val': 0.03759725363784794, 'batch_size': 3155, 'optimizer': 'RMSprop'}. Best is trial 1 with value: 0.03364622409517507.
2026-05-10 08:52:36,958 - optuna.study.study - INFO - Trial 2 finished with value: 0.03912968208240279 and parameters: {'n_layers': 1, 'embedding_dim': 128, 'lr': 0.004711786746685799, 'lambda_val': 0.01408670613872106, 'batch_size': 2002, 'optimizer': 'Adam'}. Best is trial 2 with value: 0.03912968208240279.
2026-05-10 08:53:33,393 - optuna.study.study - INFO - Trial 3 finished with value: 0.009776543305636114 and parameters: {'n_layers': 2, 'embedding_dim': 96, 'lr': 0.006535301765187661, 'lambda_val': 0.0642480236375273, 'batch_size': 1026, 'optimizer': 'RMSprop'}. Best is trial 2 with value: 0.03912968208240279.
2026-05-10 08:54:28,116 - optuna.study.study - INFO - Trial 4 finished with value: 0.07926662377529249 and parameters: {'n_layers': 1, 'embedding_dim': 128, 'lr': 6.009873405154328e-05, 'lambda_val': 0.0009680081982663437, 'batch_size': 3005, 'optimizer': 'RMSprop'}. Best is trial 4 with value: 0.07926662377529249.
2026-05-10 08:54:30,569 - optuna.study._optimize - INFO - Trial 5 pruned. 
2026-05-10 08:55:16,856 - optuna.study.study - INFO - Trial 6 finished with value: 0.02958795131738403 and parameters: {'n_layers': 1, 'embedding_dim': 32, 'lr': 0.006914895940194397, 'lambda_val': 5.707968813890196e-05, 'batch_size': 2218, 'optimizer': 'RMSprop'}. Best is trial 4 with value: 0.07926662377529249.
2026-05-10 08:56:20,760 - optuna.study.study - INFO - Trial 7 finished with value: 0.03207578646588205 and parameters: {'n_layers': 4, 'embedding_dim': 32, 'lr': 0.0005188025236941902, 'lambda_val': 4.981887935094402e-06, 'batch_size': 551, 'optimizer': 'Adam'}. Best is trial 4 with value: 0.07926662377529249.
2026-05-10 08:56:22,933 - optuna.study._optimize - INFO - Trial 8 pruned. 
2026-05-10 08:56:24,219 - optuna.study._optimize - INFO - Trial 9 pruned. 
2026-05-10 08:56:26,858 - optuna.study._optimize - INFO - Trial 10 pruned. 
2026-05-10 08:56:28,154 - optuna.study._optimize - INFO - Trial 11 pruned. 
2026-05-10 08:56:29,439 - optuna.study._optimize - INFO - Trial 12 pruned. 
2026-05-10 08:56:31,031 - optuna.study._optimize - INFO - Trial 13 pruned. 
2026-05-10 08:57:24,913 - optuna.study.study - INFO - Trial 14 finished with value: 0.05208488012088776 and parameters: {'n_layers': 1, 'embedding_dim': 128, 'lr': 0.0022647609547910698, 'lambda_val': 0.0003533908764260853, 'batch_size': 3679, 'optimizer': 'Adam'}. Best is trial 4 with value: 0.07926662377529249.
2026-05-10 08:57:28,269 - optuna.study._optimize - INFO - Trial 15 pruned. 
2026-05-10 08:57:29,555 - optuna.study._optimize - INFO - Trial 16 pruned. 
2026-05-10 08:57:31,270 - optuna.study._optimize - INFO - Trial 17 pruned. 
2026-05-10 08:57:34,954 - optuna.study._optimize - INFO - Trial 18 pruned. 
2026-05-10 08:57:37,261 - optuna.study._optimize - INFO - Trial 19 pruned. 
2026-05-10 08:57:38,612 - optuna.study._optimize - INFO - Trial 20 pruned. 
2026-05-10 08:57:39,931 - optuna.study._optimize - INFO - Trial 21 pruned. 
2026-05-10 08:57:41,260 - optuna.study._optimize - INFO - Trial 22 pruned. 
2026-05-10 08:57:42,600 - optuna.study._optimize - INFO - Trial 23 pruned. 
2026-05-10 08:57:43,852 - optuna.study._optimize - INFO - Trial 24 pruned. 
2026-05-10 08:57:45,784 - optuna.study._optimize - INFO - Trial 25 pruned. 
2026-05-10 08:57:47,057 - optuna.study._optimize - INFO - Trial 26 pruned. 
2026-05-10 08:57:48,419 - optuna.study._optimize - INFO - Trial 27 pruned. 
2026-05-10 08:57:49,914 - optuna.study._optimize - INFO - Trial 28 pruned. 
2026-05-10 08:57:52,573 - optuna.study._optimize - INFO - Trial 29 pruned. 
2026-05-10 08:57:53,863 - optuna.study._optimize - INFO - Trial 30 pruned. 
2026-05-10 08:57:55,414 - optuna.study._optimize - INFO - Trial 31 pruned. 
2026-05-10 08:57:56,743 - optuna.study._optimize - INFO - Trial 32 pruned. 
2026-05-10 08:57:59,249 - optuna.study._optimize - INFO - Trial 33 pruned. 
2026-05-10 08:58:00,998 - optuna.study._optimize - INFO - Trial 34 pruned. 
2026-05-10 08:59:02,956 - optuna.study.study - INFO - Trial 35 finished with value: 0.0648660858431095 and parameters: {'n_layers': 1, 'embedding_dim': 256, 'lr': 0.0006610781908178106, 'lambda_val': 0.0001875432126956845, 'batch_size': 3751, 'optimizer': 'RMSprop'}. Best is trial 4 with value: 0.07926662377529249.
2026-05-10 08:59:04,261 - optuna.study._optimize - INFO - Trial 36 pruned. 
2026-05-10 09:00:05,712 - optuna.study.study - INFO - Trial 37 finished with value: 0.024598374312174164 and parameters: {'n_layers': 1, 'embedding_dim': 256, 'lr': 0.010303004790606621, 'lambda_val': 5.98831143295543e-05, 'batch_size': 3794, 'optimizer': 'RMSprop'}. Best is trial 4 with value: 0.07926662377529249.
2026-05-10 09:00:06,930 - optuna.study._optimize - INFO - Trial 38 pruned. 
2026-05-10 09:00:08,297 - optuna.study._optimize - INFO - Trial 39 pruned. 
2026-05-10 09:00:09,549 - optuna.study._optimize - INFO - Trial 40 pruned. 
2026-05-10 09:00:12,896 - optuna.study._optimize - INFO - Trial 41 pruned. 
2026-05-10 09:00:14,148 - optuna.study._optimize - INFO - Trial 42 pruned. 
2026-05-10 09:00:15,532 - optuna.study._optimize - INFO - Trial 43 pruned. 
2026-05-10 09:00:16,762 - optuna.study._optimize - INFO - Trial 44 pruned. 
2026-05-10 09:00:18,125 - optuna.study._optimize - INFO - Trial 45 pruned. 
2026-05-10 09:00:20,553 - optuna.study._optimize - INFO - Trial 46 pruned. 
2026-05-10 09:00:21,937 - optuna.study._optimize - INFO - Trial 47 pruned. 
2026-05-10 09:00:23,294 - optuna.study._optimize - INFO - Trial 48 pruned. 
2026-05-10 09:00:25,999 - optuna.study._optimize - INFO - Trial 49 pruned. 
2026-05-10 09:00:27,305 - optuna.study._optimize - INFO - Trial 50 pruned. 
2026-05-10 09:01:31,431 - optuna.study.study - INFO - Trial 51 finished with value: 0.033377817184138237 and parameters: {'n_layers': 4, 'embedding_dim': 32, 'lr': 0.00042858323547073456, 'lambda_val': 2.3137507031031692e-06, 'batch_size': 698, 'optimizer': 'Adam'}. Best is trial 4 with value: 0.07926662377529249.
