2026-05-13 08:42:05,802 - optuna.study.study - INFO - Trial 15 finished with value: 0.02431731475799512 and parameters: {'n_layers': 3, 'embedding_dim': 96, 'lr': 0.00037509819661561396, 'lambda_val': 0.0008190496464853684, 'batch_size': 1687, 'optimizer': 'Adam'}. Best is trial 12 with value: 0.08466266695161405.
2026-05-13 08:42:38,461 - optuna.study.study - INFO - Trial 16 finished with value: 0.05655337701027458 and parameters: {'n_layers': 1, 'embedding_dim': 256, 'lr': 0.0105620308308126, 'lambda_val': 0.0001250615456538804, 'batch_size': 725, 'optimizer': 'RMSprop'}. Best is trial 12 with value: 0.08466266695161405.
2026-05-13 08:43:23,936 - optuna.study.study - INFO - Trial 17 finished with value: 0.05345589825832765 and parameters: {'n_layers': 1, 'embedding_dim': 256, 'lr': 0.00835748587952991, 'lambda_val': 0.00010641119808634699, 'batch_size': 669, 'optimizer': 'RMSprop'}. Best is trial 12 with value: 0.08466266695161405.
2026-05-13 08:44:10,661 - optuna.study.study - INFO - Trial 18 finished with value: 0.07067038979280722 and parameters: {'n_layers': 1, 'embedding_dim': 256, 'lr': 0.00047102095470135806, 'lambda_val': 1.398072428237726e-05, 'batch_size': 947, 'optimizer': 'RMSprop'}. Best is trial 12 with value: 0.08466266695161405.
2026-05-13 08:45:00,906 - optuna.study.study - INFO - Trial 19 finished with value: 0.07377378048320347 and parameters: {'n_layers': 1, 'embedding_dim': 256, 'lr': 0.00018878189782847436, 'lambda_val': 9.855454127665851e-06, 'batch_size': 1461, 'optimizer': 'RMSprop'}. Best is trial 12 with value: 0.08466266695161405.
2026-05-13 08:45:38,117 - optuna.study.study - INFO - Trial 20 finished with value: 0.12014932646715845 and parameters: {'n_layers': 1, 'embedding_dim': 256, 'lr': 0.00010876224210705147, 'lambda_val': 1.0528833075260894e-06, 'batch_size': 1505, 'optimizer': 'RMSprop'}. Best is trial 20 with value: 0.12014932646715845.
2026-05-13 08:46:11,984 - optuna.study.study - INFO - Trial 21 finished with value: 0.1220446314813986 and parameters: {'n_layers': 1, 'embedding_dim': 256, 'lr': 0.00012769465386185716, 'lambda_val': 1.5911691579178194e-06, 'batch_size': 1579, 'optimizer': 'RMSprop'}. Best is trial 21 with value: 0.1220446314813986.
2026-05-13 08:46:16,276 - optuna.study._optimize - INFO - Trial 22 pruned. 
2026-05-13 08:46:20,550 - optuna.study._optimize - INFO - Trial 23 pruned. 
2026-05-13 08:47:10,227 - optuna.study.study - INFO - Trial 24 finished with value: 0.056752150497396084 and parameters: {'n_layers': 2, 'embedding_dim': 256, 'lr': 0.00010548214525739309, 'lambda_val': 3.3326092874194384e-06, 'batch_size': 1399, 'optimizer': 'RMSprop'}. Best is trial 21 with value: 0.1220446314813986.
2026-05-13 08:47:15,637 - optuna.study._optimize - INFO - Trial 25 pruned. 
2026-05-13 08:47:22,282 - optuna.study._optimize - INFO - Trial 26 pruned. 
2026-05-13 08:47:29,356 - optuna.study._optimize - INFO - Trial 27 pruned. 
2026-05-13 08:48:03,987 - optuna.study.study - INFO - Trial 28 finished with value: 0.049877397308048146 and parameters: {'n_layers': 1, 'embedding_dim': 96, 'lr': 0.0005074763195634201, 'lambda_val': 2.72964358708044e-05, 'batch_size': 1426, 'optimizer': 'RMSprop'}. Best is trial 21 with value: 0.1220446314813986.
2026-05-13 08:48:08,860 - optuna.study._optimize - INFO - Trial 29 pruned. 
2026-05-13 08:48:51,211 - optuna.study.study - INFO - Trial 30 finished with value: 0.020952442805079373 and parameters: {'n_layers': 3, 'embedding_dim': 32, 'lr': 0.00029160939003042806, 'lambda_val': 5.825058805663765e-06, 'batch_size': 945, 'optimizer': 'RMSprop'}. Best is trial 21 with value: 0.1220446314813986.
2026-05-13 08:49:27,749 - optuna.study.study - INFO - Trial 31 finished with value: 0.11188803401889325 and parameters: {'n_layers': 1, 'embedding_dim': 256, 'lr': 0.00013176930465216716, 'lambda_val': 9.067263673945084e-06, 'batch_size': 1477, 'optimizer': 'RMSprop'}. Best is trial 21 with value: 0.1220446314813986.
2026-05-13 08:49:32,295 - optuna.study._optimize - INFO - Trial 32 pruned. 
2026-05-13 08:50:14,696 - optuna.study.study - INFO - Trial 33 finished with value: 0.04131102974175066 and parameters: {'n_layers': 2, 'embedding_dim': 256, 'lr': 0.00012806609128727185, 'lambda_val': 3.306965916835619e-05, 'batch_size': 1910, 'optimizer': 'RMSprop'}. Best is trial 21 with value: 0.1220446314813986.
2026-05-13 08:50:18,769 - optuna.study._optimize - INFO - Trial 34 pruned. 
2026-05-13 08:50:53,588 - optuna.study.study - INFO - Trial 35 finished with value: 0.07024751372876271 and parameters: {'n_layers': 1, 'embedding_dim': 256, 'lr': 0.00027308239427053057, 'lambda_val': 2.4642218297130894e-06, 'batch_size': 2117, 'optimizer': 'Adam'}. Best is trial 21 with value: 0.1220446314813986.
2026-05-13 08:50:58,200 - optuna.study._optimize - INFO - Trial 36 pruned. 
2026-05-13 08:51:02,777 - optuna.study._optimize - INFO - Trial 37 pruned. 
2026-05-13 08:51:33,736 - optuna.study.study - INFO - Trial 38 finished with value: 0.05726596933219032 and parameters: {'n_layers': 1, 'embedding_dim': 128, 'lr': 0.0005533857306682206, 'lambda_val': 1.248964573789361e-05, 'batch_size': 2529, 'optimizer': 'Adam'}. Best is trial 21 with value: 0.1220446314813986.
2026-05-13 08:51:40,309 - optuna.study._optimize - INFO - Trial 39 pruned. 
2026-05-13 08:51:44,616 - optuna.study._optimize - INFO - Trial 40 pruned. 
2026-05-13 08:52:18,568 - optuna.study.study - INFO - Trial 41 finished with value: 0.07296066658951911 and parameters: {'n_layers': 1, 'embedding_dim': 256, 'lr': 0.00022716530706254147, 'lambda_val': 8.30907504067426e-06, 'batch_size': 1494, 'optimizer': 'RMSprop'}. Best is trial 21 with value: 0.1220446314813986.
2026-05-13 08:52:22,992 - optuna.study._optimize - INFO - Trial 42 pruned. 
2026-05-13 08:52:27,341 - optuna.study._optimize - INFO - Trial 43 pruned. 
2026-05-13 08:53:00,837 - optuna.study.study - INFO - Trial 44 finished with value: 0.09493216590695462 and parameters: {'n_layers': 1, 'embedding_dim': 256, 'lr': 0.00018890725164998572, 'lambda_val': 4.568567679116172e-06, 'batch_size': 1104, 'optimizer': 'RMSprop'}. Best is trial 21 with value: 0.1220446314813986.
2026-05-13 08:53:29,242 - optuna.study.study - INFO - Trial 45 finished with value: 0.05663366866858379 and parameters: {'n_layers': 1, 'embedding_dim': 96, 'lr': 0.0007651794995252576, 'lambda_val': 4.888842283536661e-06, 'batch_size': 700, 'optimizer': 'RMSprop'}. Best is trial 21 with value: 0.1220446314813986.
2026-05-13 08:53:33,711 - optuna.study._optimize - INFO - Trial 46 pruned. 
2026-05-13 08:53:38,346 - optuna.study._optimize - INFO - Trial 47 pruned. 
2026-05-13 08:53:42,960 - optuna.study._optimize - INFO - Trial 48 pruned. 
2026-05-13 08:54:12,186 - optuna.study.study - INFO - Trial 49 finished with value: 0.05223011456187484 and parameters: {'n_layers': 1, 'embedding_dim': 96, 'lr': 0.0028099481065644353, 'lambda_val': 0.0002395484788032055, 'batch_size': 869, 'optimizer': 'Adam'}. Best is trial 21 with value: 0.1220446314813986.
2026-05-13 08:54:18,148 - optuna.study._optimize - INFO - Trial 50 pruned. 
2026-05-13 08:54:51,832 - optuna.study.study - INFO - Trial 51 finished with value: 0.07885251770285437 and parameters: {'n_layers': 1, 'embedding_dim': 256, 'lr': 0.00019677602265189768, 'lambda_val': 1.5168626707701828e-05, 'batch_size': 1645, 'optimizer': 'RMSprop'}. Best is trial 21 with value: 0.1220446314813986.
2026-05-13 08:55:25,301 - optuna.study.study - INFO - Trial 52 finished with value: 0.10203789835850277 and parameters: {'n_layers': 1, 'embedding_dim': 256, 'lr': 0.0001315369648909166, 'lambda_val': 1.4264446122666533e-05, 'batch_size': 1624, 'optimizer': 'RMSprop'}. Best is trial 21 with value: 0.1220446314813986.
2026-05-13 08:55:29,691 - optuna.study._optimize - INFO - Trial 53 pruned. 
2026-05-13 08:55:34,456 - optuna.study._optimize - INFO - Trial 54 pruned. 
2026-05-13 08:56:08,397 - optuna.study.study - INFO - Trial 55 finished with value: 0.10906865054894904 and parameters: {'n_layers': 1, 'embedding_dim': 256, 'lr': 0.00014456234612192394, 'lambda_val': 3.8443761987136475e-06, 'batch_size': 1063, 'optimizer': 'RMSprop'}. Best is trial 21 with value: 0.1220446314813986.
2026-05-13 08:56:42,079 - optuna.study.study - INFO - Trial 56 finished with value: 0.07989084913109806 and parameters: {'n_layers': 1, 'embedding_dim': 256, 'lr': 0.0003726096847366459, 'lambda_val': 1.4341195811366098e-06, 'batch_size': 558, 'optimizer': 'RMSprop'}. Best is trial 21 with value: 0.1220446314813986.
2026-05-13 08:56:50,830 - optuna.study._optimize - INFO - Trial 57 pruned. 
2026-05-13 08:56:59,305 - optuna.study._optimize - INFO - Trial 58 pruned. 
2026-05-13 08:57:40,878 - optuna.study.study - INFO - Trial 59 finished with value: 0.0508263820896132 and parameters: {'n_layers': 2, 'embedding_dim': 256, 'lr': 0.0001398809373212261, 'lambda_val': 2.28589369670498e-06, 'batch_size': 1038, 'optimizer': 'RMSprop'}. Best is trial 21 with value: 0.1220446314813986.
2026-05-13 08:57:46,771 - optuna.study._optimize - INFO - Trial 60 pruned. 
2026-05-13 08:58:16,237 - optuna.study.study - INFO - Trial 61 finished with value: 0.08002325229097908 and parameters: {'n_layers': 1, 'embedding_dim': 96, 'lr': 0.00021856894222800063, 'lambda_val': 1.8606583017087842e-05, 'batch_size': 1640, 'optimizer': 'Adam'}. Best is trial 21 with value: 0.1220446314813986.
2026-05-13 08:58:53,500 - optuna.study.study - INFO - Trial 62 finished with value: 0.058583989204401214 and parameters: {'n_layers': 1, 'embedding_dim': 256, 'lr': 0.0007361985100899782, 'lambda_val': 1.3186429111610096e-06, 'batch_size': 1306, 'optimizer': 'RMSprop'}. Best is trial 21 with value: 0.1220446314813986.
2026-05-13 08:58:58,071 - optuna.study._optimize - INFO - Trial 63 pruned. 
2026-05-13 08:59:02,035 - optuna.study._optimize - INFO - Trial 64 pruned. 
2026-05-13 08:59:37,135 - optuna.study.study - INFO - Trial 65 finished with value: 0.07265621193087728 and parameters: {'n_layers': 1, 'embedding_dim': 256, 'lr': 0.0002726686246834787, 'lambda_val': 2.602118813177269e-06, 'batch_size': 1771, 'optimizer': 'Adam'}. Best is trial 21 with value: 0.1220446314813986.
2026-05-13 09:00:05,879 - optuna.study.study - INFO - Trial 66 finished with value: 0.06698608228716878 and parameters: {'n_layers': 1, 'embedding_dim': 96, 'lr': 0.0004055154341244975, 'lambda_val': 4.593450720445183e-06, 'batch_size': 1186, 'optimizer': 'RMSprop'}. Best is trial 21 with value: 0.1220446314813986.
2026-05-13 09:00:10,429 - optuna.study._optimize - INFO - Trial 67 pruned. 
2026-05-13 09:00:14,814 - optuna.study._optimize - INFO - Trial 68 pruned. 
2026-05-13 09:00:19,438 - optuna.study._optimize - INFO - Trial 69 pruned. 
2026-05-13 09:00:54,004 - optuna.study.study - INFO - Trial 70 finished with value: 0.06536209711864834 and parameters: {'n_layers': 1, 'embedding_dim': 256, 'lr': 0.0005840974202526939, 'lambda_val': 0.0008896052454941627, 'batch_size': 1978, 'optimizer': 'Adam'}. Best is trial 21 with value: 0.1220446314813986.
2026-05-13 09:01:23,140 - optuna.study.study - INFO - Trial 71 finished with value: 0.06814522267199564 and parameters: {'n_layers': 1, 'embedding_dim': 96, 'lr': 0.00026112662940666473, 'lambda_val': 1.975721629899138e-05, 'batch_size': 1670, 'optimizer': 'Adam'}. Best is trial 21 with value: 0.1220446314813986.
2026-05-13 09:01:53,051 - optuna.study.study - INFO - Trial 72 finished with value: 0.07965227642734418 and parameters: {'n_layers': 1, 'embedding_dim': 96, 'lr': 0.00021434091757624617, 'lambda_val': 1.6951393796099287e-05, 'batch_size': 1378, 'optimizer': 'Adam'}. Best is trial 21 with value: 0.1220446314813986.
2026-05-13 09:01:56,386 - optuna.study._optimize - INFO - Trial 73 pruned. 
2026-05-13 09:01:59,785 - optuna.study._optimize - INFO - Trial 74 pruned. 
2026-05-13 09:02:03,520 - optuna.study._optimize - INFO - Trial 75 pruned. 
2026-05-13 09:02:08,227 - optuna.study._optimize - INFO - Trial 76 pruned. 
2026-05-13 09:02:36,712 - optuna.study.study - INFO - Trial 77 finished with value: 0.05780022000750959 and parameters: {'n_layers': 1, 'embedding_dim': 64, 'lr': 0.00034820362062042436, 'lambda_val': 3.4411381059276553e-05, 'batch_size': 1602, 'optimizer': 'RMSprop'}. Best is trial 21 with value: 0.1220446314813986.
2026-05-13 09:02:41,360 - optuna.study._optimize - INFO - Trial 78 pruned. 
2026-05-13 09:02:45,523 - optuna.study._optimize - INFO - Trial 79 pruned. 
2026-05-13 09:02:52,195 - optuna.study._optimize - INFO - Trial 80 pruned. 
2026-05-13 09:03:25,924 - optuna.study.study - INFO - Trial 81 finished with value: 0.07284450541448947 and parameters: {'n_layers': 1, 'embedding_dim': 256, 'lr': 0.0004122304977777978, 'lambda_val': 1.438175591316892e-06, 'batch_size': 712, 'optimizer': 'RMSprop'}. Best is trial 21 with value: 0.1220446314813986.
2026-05-13 09:03:59,037 - optuna.study.study - INFO - Trial 82 finished with value: 0.08990364274722237 and parameters: {'n_layers': 1, 'embedding_dim': 256, 'lr': 0.00017183536237456632, 'lambda_val': 2.62422290218224e-06, 'batch_size': 1496, 'optimizer': 'RMSprop'}. Best is trial 21 with value: 0.1220446314813986.
2026-05-13 09:04:31,516 - optuna.study.study - INFO - Trial 83 finished with value: 0.10864585984223118 and parameters: {'n_layers': 1, 'embedding_dim': 256, 'lr': 0.00014429127324251504, 'lambda_val': 2.372210552823766e-06, 'batch_size': 1521, 'optimizer': 'RMSprop'}. Best is trial 21 with value: 0.1220446314813986.
2026-05-13 09:05:04,508 - optuna.study.study - INFO - Trial 84 finished with value: 0.09678102671498276 and parameters: {'n_layers': 1, 'embedding_dim': 256, 'lr': 0.00015380066524578944, 'lambda_val': 2.7489547457121687e-06, 'batch_size': 1476, 'optimizer': 'RMSprop'}. Best is trial 21 with value: 0.1220446314813986.
2026-05-13 09:05:37,990 - optuna.study.study - INFO - Trial 85 finished with value: 0.10354508959640323 and parameters: {'n_layers': 1, 'embedding_dim': 256, 'lr': 0.00015285248128652746, 'lambda_val': 2.8540893711511124e-06, 'batch_size': 1416, 'optimizer': 'RMSprop'}. Best is trial 21 with value: 0.1220446314813986.
2026-05-13 09:05:41,899 - optuna.study._optimize - INFO - Trial 86 pruned. 
2026-05-13 09:05:45,839 - optuna.study._optimize - INFO - Trial 87 pruned. 
2026-05-13 09:05:49,777 - optuna.study._optimize - INFO - Trial 88 pruned. 
2026-05-13 09:05:54,856 - optuna.study._optimize - INFO - Trial 89 pruned. 
2026-05-13 09:05:58,706 - optuna.study._optimize - INFO - Trial 90 pruned. 
2026-05-13 09:06:29,323 - optuna.study.study - INFO - Trial 91 finished with value: 0.10079368555407264 and parameters: {'n_layers': 1, 'embedding_dim': 256, 'lr': 0.00016089721132165168, 'lambda_val': 2.5693981010861624e-06, 'batch_size': 1471, 'optimizer': 'RMSprop'}. Best is trial 21 with value: 0.1220446314813986.
2026-05-13 09:07:00,897 - optuna.study.study - INFO - Trial 92 finished with value: 0.08954585108596617 and parameters: {'n_layers': 1, 'embedding_dim': 256, 'lr': 0.00015512198463913374, 'lambda_val': 1.8655337660758813e-06, 'batch_size': 1557, 'optimizer': 'RMSprop'}. Best is trial 21 with value: 0.1220446314813986.
2026-05-13 09:07:04,851 - optuna.study._optimize - INFO - Trial 93 pruned. 
2026-05-13 09:07:36,370 - optuna.study.study - INFO - Trial 94 finished with value: 0.07212370117335012 and parameters: {'n_layers': 1, 'embedding_dim': 256, 'lr': 0.00027038013285183606, 'lambda_val': 5.606438319440995e-06, 'batch_size': 1343, 'optimizer': 'RMSprop'}. Best is trial 21 with value: 0.1220446314813986.
2026-05-13 09:07:40,871 - optuna.study._optimize - INFO - Trial 95 pruned. 
2026-05-13 09:07:45,261 - optuna.study._optimize - INFO - Trial 96 pruned. 
2026-05-13 09:07:50,050 - optuna.study._optimize - INFO - Trial 97 pruned. 
2026-05-13 09:08:23,059 - optuna.study.study - INFO - Trial 98 finished with value: 0.09715222874652152 and parameters: {'n_layers': 1, 'embedding_dim': 256, 'lr': 0.00016652372104180275, 'lambda_val': 9.096101373372408e-06, 'batch_size': 1427, 'optimizer': 'RMSprop'}. Best is trial 21 with value: 0.1220446314813986.
2026-05-13 09:08:48,543 - optuna.study.study - INFO - Trial 99 finished with value: 0.05861522620147486 and parameters: {'n_layers': 1, 'embedding_dim': 128, 'lr': 0.00030142517703694426, 'lambda_val': 8.160518709668832e-06, 'batch_size': 1545, 'optimizer': 'RMSprop'}. Best is trial 21 with value: 0.1220446314813986.
2026-05-13 09:08:52,115 - optuna.study._optimize - INFO - Trial 100 pruned. 
2026-05-13 09:09:22,090 - optuna.study.study - INFO - Trial 101 finished with value: 0.08910216484395433 and parameters: {'n_layers': 1, 'embedding_dim': 256, 'lr': 0.0001942681823622357, 'lambda_val': 4.096711899998714e-06, 'batch_size': 1115, 'optimizer': 'RMSprop'}. Best is trial 21 with value: 0.1220446314813986.
2026-05-13 09:09:26,111 - optuna.study._optimize - INFO - Trial 102 pruned. 
2026-05-13 09:09:59,826 - optuna.study.study - INFO - Trial 103 finished with value: 0.0682412246421643 and parameters: {'n_layers': 1, 'embedding_dim': 256, 'lr': 0.00023154371507134257, 'lambda_val': 9.57177111376415e-06, 'batch_size': 1677, 'optimizer': 'RMSprop'}. Best is trial 21 with value: 0.1220446314813986.
2026-05-13 09:10:04,162 - optuna.study._optimize - INFO - Trial 104 pruned. 
2026-05-13 09:10:08,481 - optuna.study._optimize - INFO - Trial 105 pruned. 
2026-05-13 09:10:12,758 - optuna.study._optimize - INFO - Trial 106 pruned. 
2026-05-13 09:10:46,610 - optuna.study.study - INFO - Trial 107 finished with value: 0.09326310925342793 and parameters: {'n_layers': 1, 'embedding_dim': 256, 'lr': 0.00015803574557624948, 'lambda_val': 3.648503015874005e-06, 'batch_size': 1604, 'optimizer': 'RMSprop'}. Best is trial 21 with value: 0.1220446314813986.
2026-05-13 09:10:50,961 - optuna.study._optimize - INFO - Trial 108 pruned. 
2026-05-13 09:11:17,128 - optuna.study.study - INFO - Trial 109 finished with value: 0.04724272275281574 and parameters: {'n_layers': 1, 'embedding_dim': 64, 'lr': 0.0004525530067671482, 'lambda_val': 2.2329518251006e-06, 'batch_size': 1499, 'optimizer': 'RMSprop'}. Best is trial 21 with value: 0.1220446314813986.
2026-05-13 09:11:20,992 - optuna.study._optimize - INFO - Trial 110 pruned. 
2026-05-13 09:11:54,096 - optuna.study.study - INFO - Trial 111 finished with value: 0.08636416059894268 and parameters: {'n_layers': 1, 'embedding_dim': 256, 'lr': 0.0001698155709498497, 'lambda_val': 3.5487827753076556e-06, 'batch_size': 1613, 'optimizer': 'RMSprop'}. Best is trial 21 with value: 0.1220446314813986.
2026-05-13 09:11:58,531 - optuna.study._optimize - INFO - Trial 112 pruned. 
2026-05-13 09:12:02,911 - optuna.study._optimize - INFO - Trial 113 pruned. 
2026-05-13 09:12:37,032 - optuna.study.study - INFO - Trial 114 finished with value: 0.06138181952923643 and parameters: {'n_layers': 1, 'embedding_dim': 256, 'lr': 0.00024127606011279203, 'lambda_val': 9.541804299689815e-06, 'batch_size': 1686, 'optimizer': 'RMSprop'}. Best is trial 21 with value: 0.1220446314813986.
2026-05-13 09:12:40,665 - optuna.study._optimize - INFO - Trial 115 pruned. 
2026-05-13 09:12:45,304 - optuna.study._optimize - INFO - Trial 116 pruned. 
2026-05-13 09:13:18,968 - optuna.study.study - INFO - Trial 117 finished with value: 0.09980802077013477 and parameters: {'n_layers': 1, 'embedding_dim': 256, 'lr': 0.0001437549697839875, 'lambda_val': 1.2182089014838022e-06, 'batch_size': 1972, 'optimizer': 'RMSprop'}. Best is trial 21 with value: 0.1220446314813986.
2026-05-13 09:13:23,091 - optuna.study._optimize - INFO - Trial 118 pruned. 
2026-05-13 09:13:26,968 - optuna.study._optimize - INFO - Trial 119 pruned. 
2026-05-13 09:13:30,922 - optuna.study._optimize - INFO - Trial 120 pruned. 
2026-05-13 09:14:04,463 - optuna.study.study - INFO - Trial 121 finished with value: 0.08927360301527291 and parameters: {'n_layers': 1, 'embedding_dim': 256, 'lr': 0.00014614778938751985, 'lambda_val': 2.4909029276184055e-06, 'batch_size': 2183, 'optimizer': 'RMSprop'}. Best is trial 21 with value: 0.1220446314813986.
2026-05-13 09:14:38,607 - optuna.study.study - INFO - Trial 122 finished with value: 0.07405886462779034 and parameters: {'n_layers': 1, 'embedding_dim': 256, 'lr': 0.0001952791017316698, 'lambda_val': 3.0840569442923296e-06, 'batch_size': 1620, 'optimizer': 'RMSprop'}. Best is trial 21 with value: 0.1220446314813986.
2026-05-13 09:15:11,807 - optuna.study.study - INFO - Trial 123 finished with value: 0.096261218991042 and parameters: {'n_layers': 1, 'embedding_dim': 256, 'lr': 0.00015442330372860511, 'lambda_val': 3.902982779572967e-06, 'batch_size': 1528, 'optimizer': 'RMSprop'}. Best is trial 21 with value: 0.1220446314813986.
2026-05-13 09:15:17,931 - optuna.study._optimize - INFO - Trial 124 pruned. 
2026-05-13 09:15:22,796 - optuna.study._optimize - INFO - Trial 125 pruned. 
2026-05-13 09:15:55,874 - optuna.study.study - INFO - Trial 126 finished with value: 0.0814662196420766 and parameters: {'n_layers': 1, 'embedding_dim': 256, 'lr': 0.0003093702853687462, 'lambda_val': 1.4970377125778588e-06, 'batch_size': 1230, 'optimizer': 'RMSprop'}. Best is trial 21 with value: 0.1220446314813986.
2026-05-13 09:16:30,167 - optuna.study.study - INFO - Trial 127 finished with value: 0.07308184292874396 and parameters: {'n_layers': 1, 'embedding_dim': 256, 'lr': 0.0002541976952414555, 'lambda_val': 1.0030972482117842e-06, 'batch_size': 1506, 'optimizer': 'RMSprop'}. Best is trial 21 with value: 0.1220446314813986.
2026-05-13 09:17:03,545 - optuna.study.study - INFO - Trial 128 finished with value: 0.09449945956908132 and parameters: {'n_layers': 1, 'embedding_dim': 256, 'lr': 0.00017940824477933885, 'lambda_val': 2.4209538439914984e-06, 'batch_size': 1140, 'optimizer': 'RMSprop'}. Best is trial 21 with value: 0.1220446314813986.
2026-05-13 09:17:09,588 - optuna.study._optimize - INFO - Trial 129 pruned. 
2026-05-13 09:17:14,001 - optuna.study._optimize - INFO - Trial 130 pruned. 
2026-05-13 09:17:18,998 - optuna.study._optimize - INFO - Trial 131 pruned. 
