2026-05-13 15:58:44,106 - optuna.study.study - INFO - Trial 143 finished with value: 0.07232249619862748 and parameters: {'n_layers': 1, 'embedding_dim': 128, 'lr': 0.00019039889530285495, 'lambda_val': 4.568207360984281e-05, 'batch_size': 3218, 'optimizer': 'Adam'}. Best is trial 25 with value: 0.10727808686719892.
2026-05-13 15:59:14,761 - optuna.study.study - INFO - Trial 144 finished with value: 0.09708699847392299 and parameters: {'n_layers': 1, 'embedding_dim': 128, 'lr': 0.00014730140943102247, 'lambda_val': 1.9598819150876176e-05, 'batch_size': 2364, 'optimizer': 'Adam'}. Best is trial 25 with value: 0.10727808686719892.
2026-05-13 15:59:41,724 - optuna.study.study - INFO - Trial 145 finished with value: 0.09311791306128737 and parameters: {'n_layers': 1, 'embedding_dim': 128, 'lr': 0.0001571587291397547, 'lambda_val': 1.701358646356153e-05, 'batch_size': 2320, 'optimizer': 'Adam'}. Best is trial 25 with value: 0.10727808686719892.
2026-05-13 15:59:45,276 - optuna.study._optimize - INFO - Trial 146 pruned. 
2026-05-13 16:00:10,252 - optuna.study.study - INFO - Trial 147 finished with value: 0.07310615396174264 and parameters: {'n_layers': 1, 'embedding_dim': 64, 'lr': 0.00023132853716438032, 'lambda_val': 3.215395000374331e-05, 'batch_size': 3489, 'optimizer': 'Adam'}. Best is trial 25 with value: 0.10727808686719892.
2026-05-13 16:00:41,797 - optuna.study.study - INFO - Trial 148 finished with value: 0.07783263881390157 and parameters: {'n_layers': 1, 'embedding_dim': 128, 'lr': 0.00014040385485699288, 'lambda_val': 2.2923568927650153e-05, 'batch_size': 4094, 'optimizer': 'Adam'}. Best is trial 25 with value: 0.10727808686719892.
2026-05-13 16:00:45,741 - optuna.study._optimize - INFO - Trial 149 pruned. 
2026-05-13 16:00:49,760 - optuna.study._optimize - INFO - Trial 150 pruned. 
2026-05-13 16:00:53,811 - optuna.study._optimize - INFO - Trial 151 pruned. 
2026-05-13 16:00:58,494 - optuna.study._optimize - INFO - Trial 152 pruned. 
2026-05-13 16:01:30,802 - optuna.study.study - INFO - Trial 153 finished with value: 0.07693167994439425 and parameters: {'n_layers': 1, 'embedding_dim': 128, 'lr': 0.00017216670835657188, 'lambda_val': 3.5732384301359266e-05, 'batch_size': 2518, 'optimizer': 'Adam'}. Best is trial 25 with value: 0.10727808686719892.
2026-05-13 16:01:35,956 - optuna.study._optimize - INFO - Trial 154 pruned. 
2026-05-13 16:01:40,650 - optuna.study._optimize - INFO - Trial 155 pruned. 
2026-05-13 16:02:17,219 - optuna.study.study - INFO - Trial 156 finished with value: 0.08496632374796118 and parameters: {'n_layers': 1, 'embedding_dim': 256, 'lr': 0.0001262150520132783, 'lambda_val': 2.0994029067179337e-05, 'batch_size': 3133, 'optimizer': 'Adam'}. Best is trial 25 with value: 0.10727808686719892.
2026-05-13 16:02:21,387 - optuna.study._optimize - INFO - Trial 157 pruned. 
2026-05-13 16:02:26,395 - optuna.study._optimize - INFO - Trial 158 pruned. 
2026-05-13 16:02:30,756 - optuna.study._optimize - INFO - Trial 159 pruned. 
2026-05-13 16:02:34,996 - optuna.study._optimize - INFO - Trial 160 pruned. 
2026-05-13 16:03:06,392 - optuna.study.study - INFO - Trial 161 finished with value: 0.08230653040289672 and parameters: {'n_layers': 1, 'embedding_dim': 128, 'lr': 0.00014809733063051158, 'lambda_val': 1.7575210234538664e-05, 'batch_size': 3262, 'optimizer': 'Adam'}. Best is trial 25 with value: 0.10727808686719892.
2026-05-13 16:03:38,590 - optuna.study.study - INFO - Trial 162 finished with value: 0.08887101433314787 and parameters: {'n_layers': 1, 'embedding_dim': 128, 'lr': 0.00017079254656212673, 'lambda_val': 1.0984884130457302e-05, 'batch_size': 2319, 'optimizer': 'Adam'}. Best is trial 25 with value: 0.10727808686719892.
2026-05-13 16:03:44,840 - optuna.study._optimize - INFO - Trial 163 pruned. 
2026-05-13 16:04:16,449 - optuna.study.study - INFO - Trial 164 finished with value: 0.08185213863800535 and parameters: {'n_layers': 1, 'embedding_dim': 128, 'lr': 0.00015981586279748062, 'lambda_val': 3.918549130946865e-05, 'batch_size': 2530, 'optimizer': 'Adam'}. Best is trial 25 with value: 0.10727808686719892.
2026-05-13 16:04:21,720 - optuna.study._optimize - INFO - Trial 165 pruned. 
2026-05-13 16:04:53,619 - optuna.study.study - INFO - Trial 166 finished with value: 0.062178111447242196 and parameters: {'n_layers': 1, 'embedding_dim': 128, 'lr': 0.00021573826254044144, 'lambda_val': 1.3432191275804074e-05, 'batch_size': 2365, 'optimizer': 'Adam'}. Best is trial 25 with value: 0.10727808686719892.
2026-05-13 16:04:59,819 - optuna.study._optimize - INFO - Trial 167 pruned. 
2026-05-13 16:05:04,203 - optuna.study._optimize - INFO - Trial 168 pruned. 
2026-05-13 16:05:08,089 - optuna.study._optimize - INFO - Trial 169 pruned. 
2026-05-13 16:05:39,669 - optuna.study.study - INFO - Trial 170 finished with value: 0.07998907279970072 and parameters: {'n_layers': 1, 'embedding_dim': 128, 'lr': 0.00014846763206172102, 'lambda_val': 2.347700998899596e-05, 'batch_size': 3437, 'optimizer': 'Adam'}. Best is trial 25 with value: 0.10727808686719892.
2026-05-13 16:05:44,272 - optuna.study._optimize - INFO - Trial 171 pruned. 
2026-05-13 16:05:48,727 - optuna.study._optimize - INFO - Trial 172 pruned. 
2026-05-13 16:05:53,322 - optuna.study._optimize - INFO - Trial 173 pruned. 
2026-05-13 16:06:25,316 - optuna.study.study - INFO - Trial 174 finished with value: 0.04720633286492191 and parameters: {'n_layers': 1, 'embedding_dim': 128, 'lr': 0.0010964757512405027, 'lambda_val': 7.450891358252377e-05, 'batch_size': 3353, 'optimizer': 'Adam'}. Best is trial 25 with value: 0.10727808686719892.
2026-05-13 16:06:29,845 - optuna.study._optimize - INFO - Trial 175 pruned. 
2026-05-13 16:06:33,809 - optuna.study._optimize - INFO - Trial 176 pruned. 
2026-05-13 16:07:05,496 - optuna.study.study - INFO - Trial 177 finished with value: 0.07464166695013079 and parameters: {'n_layers': 1, 'embedding_dim': 128, 'lr': 0.00019642724869012724, 'lambda_val': 3.8569498346121296e-05, 'batch_size': 3227, 'optimizer': 'Adam'}. Best is trial 25 with value: 0.10727808686719892.
2026-05-13 16:07:10,358 - optuna.study._optimize - INFO - Trial 178 pruned. 
2026-05-13 16:07:14,563 - optuna.study._optimize - INFO - Trial 179 pruned. 
2026-05-13 16:07:18,869 - optuna.study._optimize - INFO - Trial 180 pruned. 
2026-05-13 16:08:03,777 - optuna.study.study - INFO - Trial 181 finished with value: 0.08692540021686228 and parameters: {'n_layers': 1, 'embedding_dim': 128, 'lr': 0.000181229787541671, 'lambda_val': 7.244075888521092e-06, 'batch_size': 2335, 'optimizer': 'Adam'}. Best is trial 25 with value: 0.10727808686719892.
2026-05-13 16:08:31,573 - optuna.study.study - INFO - Trial 182 finished with value: 0.08205224477388572 and parameters: {'n_layers': 1, 'embedding_dim': 128, 'lr': 0.00016389061481428377, 'lambda_val': 1.1741083287257262e-05, 'batch_size': 2167, 'optimizer': 'Adam'}. Best is trial 25 with value: 0.10727808686719892.
2026-05-13 16:09:02,056 - optuna.study.study - INFO - Trial 183 finished with value: 0.0722798716125395 and parameters: {'n_layers': 1, 'embedding_dim': 128, 'lr': 0.00024834110576856964, 'lambda_val': 9.3452954942926e-06, 'batch_size': 2257, 'optimizer': 'Adam'}. Best is trial 25 with value: 0.10727808686719892.
2026-05-13 16:09:06,604 - optuna.study._optimize - INFO - Trial 184 pruned. 
2026-05-13 16:09:10,668 - optuna.study._optimize - INFO - Trial 185 pruned. 
2026-05-13 16:09:14,742 - optuna.study._optimize - INFO - Trial 186 pruned. 
2026-05-13 16:09:45,869 - optuna.study.study - INFO - Trial 187 finished with value: 0.07771465459248804 and parameters: {'n_layers': 1, 'embedding_dim': 128, 'lr': 0.00017782948954727138, 'lambda_val': 3.340694871929179e-05, 'batch_size': 2323, 'optimizer': 'Adam'}. Best is trial 25 with value: 0.10727808686719892.
2026-05-13 16:09:50,321 - optuna.study._optimize - INFO - Trial 188 pruned. 
2026-05-13 16:09:54,461 - optuna.study._optimize - INFO - Trial 189 pruned. 
2026-05-13 16:09:58,323 - optuna.study._optimize - INFO - Trial 190 pruned. 
2026-05-13 16:10:27,794 - optuna.study.study - INFO - Trial 191 finished with value: 0.09254801594602295 and parameters: {'n_layers': 1, 'embedding_dim': 128, 'lr': 0.00016526160316873397, 'lambda_val': 6.010978041113839e-06, 'batch_size': 2048, 'optimizer': 'Adam'}. Best is trial 25 with value: 0.10727808686719892.
2026-05-13 16:10:34,557 - optuna.study._optimize - INFO - Trial 192 pruned. 
2026-05-13 16:10:38,531 - optuna.study._optimize - INFO - Trial 193 pruned. 
2026-05-13 16:11:14,974 - optuna.study.study - INFO - Trial 194 finished with value: 0.07694223562759124 and parameters: {'n_layers': 1, 'embedding_dim': 256, 'lr': 0.00015617814862294978, 'lambda_val': 3.6620995722987885e-06, 'batch_size': 3406, 'optimizer': 'Adam'}. Best is trial 25 with value: 0.10727808686719892.
2026-05-13 16:11:18,859 - optuna.study._optimize - INFO - Trial 195 pruned. 
2026-05-13 16:11:22,902 - optuna.study._optimize - INFO - Trial 196 pruned. 
2026-05-13 16:11:27,219 - optuna.study._optimize - INFO - Trial 197 pruned. 
2026-05-13 16:12:10,189 - optuna.study.study - INFO - Trial 198 finished with value: 0.060606514656832054 and parameters: {'n_layers': 1, 'embedding_dim': 128, 'lr': 0.00029045473108753035, 'lambda_val': 7.415348556211148e-05, 'batch_size': 3296, 'optimizer': 'Adam'}. Best is trial 25 with value: 0.10727808686719892.
2026-05-13 16:12:14,489 - optuna.study._optimize - INFO - Trial 199 pruned. 
2026-05-13 16:12:38,584 - root - INFO -   **** Training e_100K_1c2dcs_rand3
2026-05-13 16:12:38,594 - root - INFO -   **** Getting 54402/65410 random edges
2026-05-13 16:12:39,391 - optuna.storages._rdb.storage - INFO - A new study created in RDB with name: Study_e_100K_1c2dcs_rand3
2026-05-13 16:13:18,076 - optuna.study.study - INFO - Trial 0 finished with value: 0.02733873740552306 and parameters: {'n_layers': 3, 'embedding_dim': 96, 'lr': 0.016453443814952465, 'lambda_val': 0.002618263010923001, 'batch_size': 3671, 'optimizer': 'RMSprop'}. Best is trial 0 with value: 0.02733873740552306.
2026-05-13 16:14:00,766 - optuna.study.study - INFO - Trial 1 finished with value: 0.06847905683004012 and parameters: {'n_layers': 2, 'embedding_dim': 256, 'lr': 5.881264994710817e-05, 'lambda_val': 6.410662816081946e-06, 'batch_size': 2063, 'optimizer': 'Adam'}. Best is trial 1 with value: 0.06847905683004012.
2026-05-13 16:14:28,304 - optuna.study.study - INFO - Trial 2 finished with value: 0.0007914480090917672 and parameters: {'n_layers': 1, 'embedding_dim': 32, 'lr': 0.025040583627494034, 'lambda_val': 0.00031786975490306896, 'batch_size': 2518, 'optimizer': 'SGD'}. Best is trial 1 with value: 0.06847905683004012.
2026-05-13 16:15:09,323 - optuna.study.study - INFO - Trial 3 finished with value: 0.0017973762266297085 and parameters: {'n_layers': 4, 'embedding_dim': 96, 'lr': 0.006533577318707668, 'lambda_val': 0.09842183327912414, 'batch_size': 2819, 'optimizer': 'Adam'}. Best is trial 1 with value: 0.06847905683004012.
2026-05-13 16:15:41,247 - optuna.study.study - INFO - Trial 4 finished with value: 0.012205556375563573 and parameters: {'n_layers': 3, 'embedding_dim': 32, 'lr': 0.0442501473978219, 'lambda_val': 5.339756215854753e-06, 'batch_size': 3075, 'optimizer': 'RMSprop'}. Best is trial 1 with value: 0.06847905683004012.
2026-05-13 16:15:45,887 - optuna.study._optimize - INFO - Trial 5 pruned. 
2026-05-13 16:15:50,706 - optuna.study._optimize - INFO - Trial 6 pruned. 
2026-05-13 16:15:57,341 - optuna.study._optimize - INFO - Trial 7 pruned. 
2026-05-13 16:16:39,663 - optuna.study.study - INFO - Trial 8 finished with value: 0.017540842642135804 and parameters: {'n_layers': 3, 'embedding_dim': 96, 'lr': 0.0019126233327679948, 'lambda_val': 7.19033276854461e-06, 'batch_size': 2624, 'optimizer': 'Adam'}. Best is trial 1 with value: 0.06847905683004012.
2026-05-13 16:17:05,988 - optuna.study.study - INFO - Trial 9 finished with value: 0.04728952808920199 and parameters: {'n_layers': 1, 'embedding_dim': 32, 'lr': 0.023226143368088165, 'lambda_val': 0.0221986388181387, 'batch_size': 1108, 'optimizer': 'RMSprop'}. Best is trial 1 with value: 0.06847905683004012.
2026-05-13 16:17:12,647 - optuna.study._optimize - INFO - Trial 10 pruned. 
2026-05-13 16:17:40,872 - optuna.study.study - INFO - Trial 11 finished with value: 0.04571573773623397 and parameters: {'n_layers': 1, 'embedding_dim': 128, 'lr': 0.0004546442409216665, 'lambda_val': 0.008703192343155775, 'batch_size': 544, 'optimizer': 'RMSprop'}. Best is trial 1 with value: 0.06847905683004012.
2026-05-13 16:18:14,927 - optuna.study.study - INFO - Trial 12 finished with value: 0.09075983209871767 and parameters: {'n_layers': 1, 'embedding_dim': 256, 'lr': 0.00017740832251879633, 'lambda_val': 6.916626954586246e-05, 'batch_size': 1671, 'optimizer': 'Adam'}. Best is trial 12 with value: 0.09075983209871767.
2026-05-13 16:18:57,129 - optuna.study.study - INFO - Trial 13 finished with value: 0.04157511644562071 and parameters: {'n_layers': 2, 'embedding_dim': 256, 'lr': 0.00015977648253441754, 'lambda_val': 6.518746671942482e-05, 'batch_size': 1825, 'optimizer': 'Adam'}. Best is trial 12 with value: 0.09075983209871767.
2026-05-13 16:19:01,480 - optuna.study._optimize - INFO - Trial 14 pruned. 
2026-05-13 16:19:44,001 - optuna.study.study - INFO - Trial 15 finished with value: 0.03923233654494524 and parameters: {'n_layers': 2, 'embedding_dim': 256, 'lr': 0.0005902131513598332, 'lambda_val': 0.00022969273766855196, 'batch_size': 1237, 'optimizer': 'Adam'}. Best is trial 12 with value: 0.09075983209871767.
2026-05-13 16:19:48,139 - optuna.study._optimize - INFO - Trial 16 pruned. 
2026-05-13 16:20:21,665 - optuna.study.study - INFO - Trial 17 finished with value: 0.06298439783554349 and parameters: {'n_layers': 2, 'embedding_dim': 128, 'lr': 0.00010919094032856336, 'lambda_val': 1.585749534171731e-05, 'batch_size': 1292, 'optimizer': 'Adam'}. Best is trial 12 with value: 0.09075983209871767.
2026-05-13 16:21:01,676 - optuna.study.study - INFO - Trial 18 finished with value: 0.08218808532550088 and parameters: {'n_layers': 1, 'embedding_dim': 256, 'lr': 0.0003110579733343296, 'lambda_val': 0.00016858067771285845, 'batch_size': 708, 'optimizer': 'Adam'}. Best is trial 12 with value: 0.09075983209871767.
2026-05-13 16:21:32,568 - optuna.study.study - INFO - Trial 19 finished with value: 0.07265956262297943 and parameters: {'n_layers': 1, 'embedding_dim': 256, 'lr': 0.0011225637048991946, 'lambda_val': 0.00021948926307731326, 'batch_size': 539, 'optimizer': 'Adam'}. Best is trial 12 with value: 0.09075983209871767.
2026-05-13 16:21:36,275 - optuna.study._optimize - INFO - Trial 20 pruned. 
2026-05-13 16:22:07,994 - optuna.study.study - INFO - Trial 21 finished with value: 0.0685401482433193 and parameters: {'n_layers': 1, 'embedding_dim': 256, 'lr': 0.001240983497242064, 'lambda_val': 0.00022028089906017285, 'batch_size': 549, 'optimizer': 'Adam'}. Best is trial 12 with value: 0.09075983209871767.
2026-05-13 16:22:40,701 - optuna.study.study - INFO - Trial 22 finished with value: 0.0566442961706158 and parameters: {'n_layers': 1, 'embedding_dim': 256, 'lr': 0.0024364029573169547, 'lambda_val': 9.785351188802285e-05, 'batch_size': 830, 'optimizer': 'Adam'}. Best is trial 12 with value: 0.09075983209871767.
2026-05-13 16:23:13,833 - optuna.study.study - INFO - Trial 23 finished with value: 0.06501207425285241 and parameters: {'n_layers': 1, 'embedding_dim': 256, 'lr': 0.00029507543261082396, 'lambda_val': 0.000655782467390377, 'batch_size': 1540, 'optimizer': 'Adam'}. Best is trial 12 with value: 0.09075983209871767.
2026-05-13 16:23:47,692 - optuna.study.study - INFO - Trial 24 finished with value: 0.06325586431289693 and parameters: {'n_layers': 1, 'embedding_dim': 256, 'lr': 0.0008439823305497164, 'lambda_val': 0.0001197645844866202, 'batch_size': 794, 'optimizer': 'Adam'}. Best is trial 12 with value: 0.09075983209871767.
2026-05-13 16:23:52,460 - optuna.study._optimize - INFO - Trial 25 pruned. 
2026-05-13 16:24:17,115 - optuna.study.study - INFO - Trial 26 finished with value: 0.040015988931115756 and parameters: {'n_layers': 1, 'embedding_dim': 64, 'lr': 0.0010925027755644536, 'lambda_val': 0.0060820125917134754, 'batch_size': 727, 'optimizer': 'Adam'}. Best is trial 12 with value: 0.09075983209871767.
2026-05-13 16:24:58,714 - optuna.study.study - INFO - Trial 27 finished with value: 0.035146510819036185 and parameters: {'n_layers': 2, 'embedding_dim': 256, 'lr': 0.00026730695211058447, 'lambda_val': 0.00047966669017750473, 'batch_size': 1031, 'optimizer': 'Adam'}. Best is trial 12 with value: 0.09075983209871767.
2026-05-13 16:25:03,339 - optuna.study._optimize - INFO - Trial 28 pruned. 
2026-05-13 16:25:07,069 - optuna.study._optimize - INFO - Trial 29 pruned. 
2026-05-13 16:25:12,955 - optuna.study._optimize - INFO - Trial 30 pruned. 
2026-05-13 16:25:46,832 - optuna.study.study - INFO - Trial 31 finished with value: 0.06089634256945771 and parameters: {'n_layers': 1, 'embedding_dim': 256, 'lr': 0.001491571636460624, 'lambda_val': 0.00021588028319616715, 'batch_size': 528, 'optimizer': 'Adam'}. Best is trial 12 with value: 0.09075983209871767.
2026-05-13 16:26:20,956 - optuna.study.study - INFO - Trial 32 finished with value: 0.06855394586932757 and parameters: {'n_layers': 1, 'embedding_dim': 256, 'lr': 0.0007012648447070593, 'lambda_val': 2.8403503029702672e-05, 'batch_size': 625, 'optimizer': 'Adam'}. Best is trial 12 with value: 0.09075983209871767.
2026-05-13 16:26:56,867 - optuna.study.study - INFO - Trial 33 finished with value: 0.06664440764309962 and parameters: {'n_layers': 1, 'embedding_dim': 256, 'lr': 0.0005660123320628404, 'lambda_val': 2.0927961564925158e-05, 'batch_size': 2336, 'optimizer': 'Adam'}. Best is trial 12 with value: 0.09075983209871767.
2026-05-13 16:27:02,199 - optuna.study._optimize - INFO - Trial 34 pruned. 
2026-05-13 16:27:06,435 - optuna.study._optimize - INFO - Trial 35 pruned. 
2026-05-13 16:27:10,324 - optuna.study._optimize - INFO - Trial 36 pruned. 
2026-05-13 16:27:41,781 - optuna.study.study - INFO - Trial 37 finished with value: 0.027427871024594534 and parameters: {'n_layers': 2, 'embedding_dim': 64, 'lr': 0.0004807648079745632, 'lambda_val': 2.27429012549385e-06, 'batch_size': 963, 'optimizer': 'Adam'}. Best is trial 12 with value: 0.09075983209871767.
2026-05-13 16:27:47,516 - optuna.study._optimize - INFO - Trial 38 pruned. 
2026-05-13 16:28:16,909 - optuna.study.study - INFO - Trial 39 finished with value: 0.05060748720563493 and parameters: {'n_layers': 1, 'embedding_dim': 128, 'lr': 0.0030909327325611383, 'lambda_val': 0.00012676531650453152, 'batch_size': 2040, 'optimizer': 'Adam'}. Best is trial 12 with value: 0.09075983209871767.
2026-05-13 16:28:21,472 - optuna.study._optimize - INFO - Trial 40 pruned. 
2026-05-13 16:28:55,891 - optuna.study.study - INFO - Trial 41 finished with value: 0.06750577814451728 and parameters: {'n_layers': 1, 'embedding_dim': 256, 'lr': 0.0013278604610981264, 'lambda_val': 0.0002222095025001625, 'batch_size': 644, 'optimizer': 'Adam'}. Best is trial 12 with value: 0.09075983209871767.
2026-05-13 16:29:29,935 - optuna.study.study - INFO - Trial 42 finished with value: 0.07312059239704434 and parameters: {'n_layers': 1, 'embedding_dim': 256, 'lr': 0.0007792296958424401, 'lambda_val': 6.337596664473352e-05, 'batch_size': 524, 'optimizer': 'Adam'}. Best is trial 12 with value: 0.09075983209871767.
2026-05-13 16:30:05,177 - optuna.study.study - INFO - Trial 43 finished with value: 0.07166702927291568 and parameters: {'n_layers': 1, 'embedding_dim': 256, 'lr': 0.0007136057131056147, 'lambda_val': 7.602079253012919e-05, 'batch_size': 891, 'optimizer': 'Adam'}. Best is trial 12 with value: 0.09075983209871767.
2026-05-13 16:30:40,341 - optuna.study.study - INFO - Trial 44 finished with value: 0.07607136039020365 and parameters: {'n_layers': 1, 'embedding_dim': 256, 'lr': 0.0003440502884178569, 'lambda_val': 6.939371253940433e-05, 'batch_size': 907, 'optimizer': 'Adam'}. Best is trial 12 with value: 0.09075983209871767.
2026-05-13 16:31:09,186 - optuna.study.study - INFO - Trial 45 finished with value: 0.10669462430196822 and parameters: {'n_layers': 1, 'embedding_dim': 96, 'lr': 0.00022745706354295746, 'lambda_val': 9.29095793458058e-06, 'batch_size': 1160, 'optimizer': 'Adam'}. Best is trial 45 with value: 0.10669462430196822.
2026-05-13 16:31:13,374 - optuna.study._optimize - INFO - Trial 46 pruned. 
2026-05-13 16:31:17,838 - optuna.study._optimize - INFO - Trial 47 pruned. 
2026-05-13 16:31:47,253 - optuna.study.study - INFO - Trial 48 finished with value: 0.05990040643231969 and parameters: {'n_layers': 1, 'embedding_dim': 96, 'lr': 0.0003518676988143935, 'lambda_val': 1.2603570480235913e-05, 'batch_size': 1650, 'optimizer': 'Adam'}. Best is trial 45 with value: 0.10669462430196822.
2026-05-13 16:31:51,765 - optuna.study._optimize - INFO - Trial 49 pruned. 
2026-05-13 16:31:56,907 - optuna.study._optimize - INFO - Trial 50 pruned. 
2026-05-13 16:32:31,480 - optuna.study.study - INFO - Trial 51 finished with value: 0.07300993840997061 and parameters: {'n_layers': 1, 'embedding_dim': 256, 'lr': 0.000418151052350822, 'lambda_val': 7.724005125075837e-05, 'batch_size': 802, 'optimizer': 'Adam'}. Best is trial 45 with value: 0.10669462430196822.
2026-05-13 16:33:06,685 - optuna.study.study - INFO - Trial 52 finished with value: 0.08180382487383575 and parameters: {'n_layers': 1, 'embedding_dim': 256, 'lr': 0.0004248130409425174, 'lambda_val': 2.5227787840897715e-05, 'batch_size': 804, 'optimizer': 'Adam'}. Best is trial 45 with value: 0.10669462430196822.
2026-05-13 16:33:10,210 - optuna.study._optimize - INFO - Trial 53 pruned. 
2026-05-13 16:33:15,280 - optuna.study._optimize - INFO - Trial 54 pruned. 
2026-05-13 16:33:19,963 - optuna.study._optimize - INFO - Trial 55 pruned. 
