2026-05-13 21:47:48,697 - optuna.study.study - INFO - Trial 192 finished with value: 0.0925540861637331 and parameters: {'n_layers': 1, 'embedding_dim': 128, 'lr': 0.00023083714920287386, 'lambda_val': 3.445400281434315e-05, 'batch_size': 766, 'optimizer': 'RMSprop'}. Best is trial 126 with value: 0.11213244182873397.
2026-05-13 21:47:52,495 - optuna.study._optimize - INFO - Trial 193 pruned. 
2026-05-13 21:47:59,194 - optuna.study._optimize - INFO - Trial 194 pruned. 
2026-05-13 21:48:32,607 - optuna.study.study - INFO - Trial 195 finished with value: 0.07541922351469171 and parameters: {'n_layers': 1, 'embedding_dim': 128, 'lr': 0.00023424587670599936, 'lambda_val': 3.70658982839588e-05, 'batch_size': 879, 'optimizer': 'RMSprop'}. Best is trial 126 with value: 0.11213244182873397.
2026-05-13 21:48:36,715 - optuna.study._optimize - INFO - Trial 196 pruned. 
2026-05-13 21:48:41,389 - optuna.study._optimize - INFO - Trial 197 pruned. 
2026-05-13 21:48:45,698 - optuna.study._optimize - INFO - Trial 198 pruned. 
2026-05-13 21:49:16,069 - optuna.study.study - INFO - Trial 199 finished with value: 0.07703182393803963 and parameters: {'n_layers': 1, 'embedding_dim': 128, 'lr': 0.0003220741799430142, 'lambda_val': 0.00018573966410989292, 'batch_size': 1177, 'optimizer': 'RMSprop'}. Best is trial 126 with value: 0.11213244182873397.
2026-05-13 21:49:43,564 - root - INFO -   **** Training e_100K_1c3dcs_rand1
2026-05-13 21:49:43,575 - root - INFO -   **** Getting 56335/65410 random edges
2026-05-13 21:49:44,744 - optuna.storages._rdb.storage - INFO - A new study created in RDB with name: Study_e_100K_1c3dcs_rand1
2026-05-13 21:50:28,825 - optuna.study.study - INFO - Trial 0 finished with value: 0.07974326791385299 and parameters: {'n_layers': 2, 'embedding_dim': 256, 'lr': 4.130282050693986e-05, 'lambda_val': 0.000253217567430377, 'batch_size': 2452, 'optimizer': 'Adam'}. Best is trial 0 with value: 0.07974326791385299.
2026-05-13 21:51:01,352 - optuna.study.study - INFO - Trial 1 finished with value: 0.01975760652343103 and parameters: {'n_layers': 3, 'embedding_dim': 32, 'lr': 0.0008186834990373063, 'lambda_val': 0.0005936635448814941, 'batch_size': 845, 'optimizer': 'RMSprop'}. Best is trial 0 with value: 0.07974326791385299.
2026-05-13 21:51:30,744 - optuna.study.study - INFO - Trial 2 finished with value: 0.0030541004879653987 and parameters: {'n_layers': 2, 'embedding_dim': 64, 'lr': 0.003291438228489944, 'lambda_val': 3.0431327816206462e-05, 'batch_size': 704, 'optimizer': 'SGD'}. Best is trial 0 with value: 0.07974326791385299.
2026-05-13 21:52:11,189 - optuna.study.study - INFO - Trial 3 finished with value: 0.014461792919960057 and parameters: {'n_layers': 4, 'embedding_dim': 96, 'lr': 0.002440611272105106, 'lambda_val': 0.01914813148751071, 'batch_size': 1709, 'optimizer': 'RMSprop'}. Best is trial 0 with value: 0.07974326791385299.
2026-05-13 21:52:57,728 - optuna.study.study - INFO - Trial 4 finished with value: 0.01675752376170655 and parameters: {'n_layers': 4, 'embedding_dim': 128, 'lr': 0.0005786477928601423, 'lambda_val': 8.115305972360647e-05, 'batch_size': 3204, 'optimizer': 'Adam'}. Best is trial 0 with value: 0.07974326791385299.
2026-05-13 21:53:32,078 - optuna.study.study - INFO - Trial 5 finished with value: 0.0431734961991138 and parameters: {'n_layers': 1, 'embedding_dim': 256, 'lr': 0.05007670306151177, 'lambda_val': 0.020045020654760468, 'batch_size': 1073, 'optimizer': 'Adam'}. Best is trial 0 with value: 0.07974326791385299.
2026-05-13 21:53:36,439 - optuna.study._optimize - INFO - Trial 6 pruned. 
2026-05-13 21:54:13,590 - optuna.study.study - INFO - Trial 7 finished with value: 0.08318539837860285 and parameters: {'n_layers': 1, 'embedding_dim': 256, 'lr': 0.00014059468650152304, 'lambda_val': 0.0013225415412523056, 'batch_size': 3159, 'optimizer': 'Adam'}. Best is trial 7 with value: 0.08318539837860285.
2026-05-13 21:54:18,645 - optuna.study._optimize - INFO - Trial 8 pruned. 
2026-05-13 21:54:24,845 - optuna.study._optimize - INFO - Trial 9 pruned. 
2026-05-13 21:54:29,123 - optuna.study._optimize - INFO - Trial 10 pruned. 
2026-05-13 21:54:33,962 - optuna.study._optimize - INFO - Trial 11 pruned. 
2026-05-13 21:55:09,866 - optuna.study.study - INFO - Trial 12 finished with value: 0.08315613485606344 and parameters: {'n_layers': 1, 'embedding_dim': 256, 'lr': 0.0001343615510106667, 'lambda_val': 4.6625293588585865e-05, 'batch_size': 2386, 'optimizer': 'Adam'}. Best is trial 7 with value: 0.08318539837860285.
2026-05-13 21:55:39,475 - optuna.study.study - INFO - Trial 13 finished with value: 0.07806311256518955 and parameters: {'n_layers': 1, 'embedding_dim': 128, 'lr': 0.00021118843217776142, 'lambda_val': 1.0959791514409545e-05, 'batch_size': 1780, 'optimizer': 'Adam'}. Best is trial 7 with value: 0.08318539837860285.
2026-05-13 21:56:09,006 - optuna.study.study - INFO - Trial 14 finished with value: 0.04188805853274864 and parameters: {'n_layers': 1, 'embedding_dim': 96, 'lr': 0.006664743820953559, 'lambda_val': 6.108320131032336e-06, 'batch_size': 3218, 'optimizer': 'Adam'}. Best is trial 7 with value: 0.08318539837860285.
2026-05-13 21:56:44,707 - optuna.study.study - INFO - Trial 15 finished with value: 0.0828334408635809 and parameters: {'n_layers': 1, 'embedding_dim': 256, 'lr': 0.00014422480566328926, 'lambda_val': 6.798540537685976e-05, 'batch_size': 2876, 'optimizer': 'Adam'}. Best is trial 7 with value: 0.08318539837860285.
2026-05-13 21:56:51,046 - optuna.study._optimize - INFO - Trial 16 pruned. 
2026-05-13 21:56:56,709 - optuna.study._optimize - INFO - Trial 17 pruned. 
2026-05-13 21:57:25,682 - optuna.study.study - INFO - Trial 18 finished with value: 0.08189760839203092 and parameters: {'n_layers': 1, 'embedding_dim': 128, 'lr': 0.010212042476578727, 'lambda_val': 0.0010240422247933822, 'batch_size': 1218, 'optimizer': 'RMSprop'}. Best is trial 7 with value: 0.08318539837860285.
2026-05-13 21:57:30,192 - optuna.study._optimize - INFO - Trial 19 pruned. 
2026-05-13 21:57:34,565 - optuna.study._optimize - INFO - Trial 20 pruned. 
2026-05-13 21:58:09,620 - optuna.study.study - INFO - Trial 21 finished with value: 0.07836050234339866 and parameters: {'n_layers': 1, 'embedding_dim': 256, 'lr': 0.00015121400799208694, 'lambda_val': 6.336271586413356e-05, 'batch_size': 2855, 'optimizer': 'Adam'}. Best is trial 7 with value: 0.08318539837860285.
2026-05-13 21:58:45,376 - optuna.study.study - INFO - Trial 22 finished with value: 0.05510441403917608 and parameters: {'n_layers': 1, 'embedding_dim': 256, 'lr': 0.0014196431139835875, 'lambda_val': 3.759121486049738e-05, 'batch_size': 3488, 'optimizer': 'Adam'}. Best is trial 7 with value: 0.08318539837860285.
2026-05-13 21:58:49,537 - optuna.study._optimize - INFO - Trial 23 pruned. 
2026-05-13 21:58:53,492 - optuna.study._optimize - INFO - Trial 24 pruned. 
2026-05-13 21:59:27,769 - optuna.study.study - INFO - Trial 25 finished with value: 0.077778675603189 and parameters: {'n_layers': 1, 'embedding_dim': 256, 'lr': 0.00031392813421750814, 'lambda_val': 3.798461059235179e-06, 'batch_size': 2127, 'optimizer': 'Adam'}. Best is trial 7 with value: 0.08318539837860285.
2026-05-13 21:59:33,780 - optuna.study._optimize - INFO - Trial 26 pruned. 
2026-05-13 21:59:38,097 - optuna.study._optimize - INFO - Trial 27 pruned. 
2026-05-13 21:59:43,951 - optuna.study._optimize - INFO - Trial 28 pruned. 
2026-05-13 21:59:49,192 - optuna.study._optimize - INFO - Trial 29 pruned. 
2026-05-13 21:59:53,168 - optuna.study._optimize - INFO - Trial 30 pruned. 
2026-05-13 21:59:58,156 - optuna.study._optimize - INFO - Trial 31 pruned. 
2026-05-13 22:00:03,432 - optuna.study._optimize - INFO - Trial 32 pruned. 
2026-05-13 22:00:08,312 - optuna.study._optimize - INFO - Trial 33 pruned. 
2026-05-13 22:00:37,425 - optuna.study.study - INFO - Trial 34 finished with value: 0.05493384453356074 and parameters: {'n_layers': 1, 'embedding_dim': 128, 'lr': 0.000641538755773508, 'lambda_val': 0.0009867886077337593, 'batch_size': 2058, 'optimizer': 'RMSprop'}. Best is trial 7 with value: 0.08318539837860285.
2026-05-13 22:00:41,551 - optuna.study._optimize - INFO - Trial 35 pruned. 
2026-05-13 22:00:46,710 - optuna.study._optimize - INFO - Trial 36 pruned. 
2026-05-13 22:00:52,616 - optuna.study._optimize - INFO - Trial 37 pruned. 
2026-05-13 22:00:57,097 - optuna.study._optimize - INFO - Trial 38 pruned. 
2026-05-13 22:01:01,795 - optuna.study._optimize - INFO - Trial 39 pruned. 
2026-05-13 22:01:06,235 - optuna.study._optimize - INFO - Trial 40 pruned. 
2026-05-13 22:01:10,885 - optuna.study._optimize - INFO - Trial 41 pruned. 
2026-05-13 22:01:16,387 - optuna.study._optimize - INFO - Trial 42 pruned. 
2026-05-13 22:01:52,284 - optuna.study.study - INFO - Trial 43 finished with value: 0.06470662408687462 and parameters: {'n_layers': 1, 'embedding_dim': 256, 'lr': 0.00026692348454805497, 'lambda_val': 0.002296352481894942, 'batch_size': 2525, 'optimizer': 'Adam'}. Best is trial 7 with value: 0.08318539837860285.
2026-05-13 22:01:57,032 - optuna.study._optimize - INFO - Trial 44 pruned. 
2026-05-13 22:02:01,173 - optuna.study._optimize - INFO - Trial 45 pruned. 
2026-05-13 22:02:05,855 - optuna.study._optimize - INFO - Trial 46 pruned. 
2026-05-13 22:02:10,531 - optuna.study._optimize - INFO - Trial 47 pruned. 
2026-05-13 22:02:14,860 - optuna.study._optimize - INFO - Trial 48 pruned. 
2026-05-13 22:02:20,088 - optuna.study._optimize - INFO - Trial 49 pruned. 
2026-05-13 22:02:25,638 - optuna.study._optimize - INFO - Trial 50 pruned. 
2026-05-13 22:03:05,133 - optuna.study.study - INFO - Trial 51 finished with value: 0.08699595611344435 and parameters: {'n_layers': 1, 'embedding_dim': 256, 'lr': 0.00013717651676823706, 'lambda_val': 6.062545712297515e-05, 'batch_size': 2891, 'optimizer': 'Adam'}. Best is trial 51 with value: 0.08699595611344435.
2026-05-13 22:03:09,747 - optuna.study._optimize - INFO - Trial 52 pruned. 
2026-05-13 22:03:46,473 - optuna.study.study - INFO - Trial 53 finished with value: 0.07889455422492271 and parameters: {'n_layers': 1, 'embedding_dim': 256, 'lr': 0.00024210752853927737, 'lambda_val': 2.7829499448348507e-05, 'batch_size': 3799, 'optimizer': 'Adam'}. Best is trial 51 with value: 0.08699595611344435.
2026-05-13 22:04:22,610 - optuna.study.study - INFO - Trial 54 finished with value: 0.08289206905641607 and parameters: {'n_layers': 1, 'embedding_dim': 256, 'lr': 0.0001769302379007373, 'lambda_val': 8.66924278474626e-06, 'batch_size': 3156, 'optimizer': 'Adam'}. Best is trial 51 with value: 0.08699595611344435.
2026-05-13 22:04:59,323 - optuna.study.study - INFO - Trial 55 finished with value: 0.07717500025674842 and parameters: {'n_layers': 1, 'embedding_dim': 256, 'lr': 0.0001773525534719879, 'lambda_val': 7.776814144379356e-06, 'batch_size': 3267, 'optimizer': 'Adam'}. Best is trial 51 with value: 0.08699595611344435.
2026-05-13 22:05:03,838 - optuna.study._optimize - INFO - Trial 56 pruned. 
2026-05-13 22:05:08,644 - optuna.study._optimize - INFO - Trial 57 pruned. 
2026-05-13 22:05:13,077 - optuna.study._optimize - INFO - Trial 58 pruned. 
2026-05-13 22:05:42,777 - optuna.study.study - INFO - Trial 59 finished with value: 0.08411827497053996 and parameters: {'n_layers': 1, 'embedding_dim': 96, 'lr': 0.00016379834922838955, 'lambda_val': 0.00014597032698913354, 'batch_size': 3107, 'optimizer': 'Adam'}. Best is trial 51 with value: 0.08699595611344435.
2026-05-13 22:05:46,983 - optuna.study._optimize - INFO - Trial 60 pruned. 
2026-05-13 22:05:52,628 - optuna.study._optimize - INFO - Trial 61 pruned. 
2026-05-13 22:05:56,882 - optuna.study._optimize - INFO - Trial 62 pruned. 
2026-05-13 22:06:01,452 - optuna.study._optimize - INFO - Trial 63 pruned. 
2026-05-13 22:06:39,265 - optuna.study.study - INFO - Trial 64 finished with value: 0.06082512911835746 and parameters: {'n_layers': 1, 'embedding_dim': 256, 'lr': 0.0006767679690924834, 'lambda_val': 0.0001087047474756646, 'batch_size': 2741, 'optimizer': 'Adam'}. Best is trial 51 with value: 0.08699595611344435.
2026-05-13 22:06:43,946 - optuna.study._optimize - INFO - Trial 65 pruned. 
2026-05-13 22:06:49,055 - optuna.study._optimize - INFO - Trial 66 pruned. 
2026-05-13 22:07:20,495 - optuna.study.study - INFO - Trial 67 finished with value: 0.06234330255111629 and parameters: {'n_layers': 1, 'embedding_dim': 128, 'lr': 0.000264667895055041, 'lambda_val': 6.511734622916813e-05, 'batch_size': 2950, 'optimizer': 'Adam'}. Best is trial 51 with value: 0.08699595611344435.
2026-05-13 22:07:24,724 - optuna.study._optimize - INFO - Trial 68 pruned. 
2026-05-13 22:07:29,321 - optuna.study._optimize - INFO - Trial 69 pruned. 
2026-05-13 22:07:33,434 - optuna.study._optimize - INFO - Trial 70 pruned. 
2026-05-13 22:07:38,349 - optuna.study._optimize - INFO - Trial 71 pruned. 
2026-05-13 22:07:42,911 - optuna.study._optimize - INFO - Trial 72 pruned. 
2026-05-13 22:08:19,535 - optuna.study.study - INFO - Trial 73 finished with value: 0.06929203237262718 and parameters: {'n_layers': 1, 'embedding_dim': 256, 'lr': 0.00017383304415363095, 'lambda_val': 1.0505898112158462e-06, 'batch_size': 4016, 'optimizer': 'Adam'}. Best is trial 51 with value: 0.08699595611344435.
2026-05-13 22:08:24,460 - optuna.study._optimize - INFO - Trial 74 pruned. 
2026-05-13 22:08:30,894 - optuna.study._optimize - INFO - Trial 75 pruned. 
2026-05-13 22:08:37,454 - optuna.study._optimize - INFO - Trial 76 pruned. 
2026-05-13 22:08:42,778 - optuna.study._optimize - INFO - Trial 77 pruned. 
2026-05-13 22:08:48,912 - optuna.study._optimize - INFO - Trial 78 pruned. 
2026-05-13 22:08:53,409 - optuna.study._optimize - INFO - Trial 79 pruned. 
2026-05-13 22:08:57,928 - optuna.study._optimize - INFO - Trial 80 pruned. 
2026-05-13 22:09:34,382 - optuna.study.study - INFO - Trial 81 finished with value: 0.07534524294884226 and parameters: {'n_layers': 1, 'embedding_dim': 256, 'lr': 0.00020758341144433968, 'lambda_val': 2.6221722399245222e-05, 'batch_size': 3853, 'optimizer': 'Adam'}. Best is trial 51 with value: 0.08699595611344435.
2026-05-13 22:10:11,263 - optuna.study.study - INFO - Trial 82 finished with value: 0.06684335600542467 and parameters: {'n_layers': 1, 'embedding_dim': 256, 'lr': 0.0002443432514961856, 'lambda_val': 5.228395883764423e-05, 'batch_size': 3782, 'optimizer': 'Adam'}. Best is trial 51 with value: 0.08699595611344435.
2026-05-13 22:10:53,761 - optuna.study.study - INFO - Trial 83 finished with value: 0.07856055979132578 and parameters: {'n_layers': 1, 'embedding_dim': 256, 'lr': 0.0001544064645135691, 'lambda_val': 3.495346440277311e-05, 'batch_size': 3578, 'optimizer': 'Adam'}. Best is trial 51 with value: 0.08699595611344435.
2026-05-13 22:11:27,905 - optuna.study.study - INFO - Trial 84 finished with value: 0.0761581879159024 and parameters: {'n_layers': 1, 'embedding_dim': 256, 'lr': 0.0005241125982893956, 'lambda_val': 0.00011163305553514015, 'batch_size': 1126, 'optimizer': 'Adam'}. Best is trial 51 with value: 0.08699595611344435.
2026-05-13 22:11:32,760 - optuna.study._optimize - INFO - Trial 85 pruned. 
2026-05-13 22:11:37,374 - optuna.study._optimize - INFO - Trial 86 pruned. 
2026-05-13 22:12:17,680 - optuna.study.study - INFO - Trial 87 finished with value: 0.07214603822947277 and parameters: {'n_layers': 1, 'embedding_dim': 256, 'lr': 0.0002696463704669997, 'lambda_val': 4.6307883065273685e-05, 'batch_size': 2007, 'optimizer': 'RMSprop'}. Best is trial 51 with value: 0.08699595611344435.
2026-05-13 22:12:21,355 - optuna.study._optimize - INFO - Trial 88 pruned. 
2026-05-13 22:12:57,421 - optuna.study.study - INFO - Trial 89 finished with value: 0.07282380483292203 and parameters: {'n_layers': 1, 'embedding_dim': 256, 'lr': 0.0004082768356863765, 'lambda_val': 1.2351680311012193e-05, 'batch_size': 2627, 'optimizer': 'Adam'}. Best is trial 51 with value: 0.08699595611344435.
2026-05-13 22:13:03,704 - optuna.study._optimize - INFO - Trial 90 pruned. 
2026-05-13 22:13:40,677 - optuna.study.study - INFO - Trial 91 finished with value: 0.0871384560332929 and parameters: {'n_layers': 1, 'embedding_dim': 256, 'lr': 0.0001457207023048778, 'lambda_val': 3.249411566776835e-05, 'batch_size': 4085, 'optimizer': 'Adam'}. Best is trial 91 with value: 0.0871384560332929.
2026-05-13 22:14:18,054 - optuna.study.study - INFO - Trial 92 finished with value: 0.07940402331490394 and parameters: {'n_layers': 1, 'embedding_dim': 256, 'lr': 0.0002371407726868638, 'lambda_val': 6.65275357234245e-05, 'batch_size': 4061, 'optimizer': 'Adam'}. Best is trial 91 with value: 0.0871384560332929.
2026-05-13 22:14:55,635 - optuna.study.study - INFO - Trial 93 finished with value: 0.08272405875096003 and parameters: {'n_layers': 1, 'embedding_dim': 256, 'lr': 0.00014894435257036285, 'lambda_val': 6.693472492851487e-05, 'batch_size': 3995, 'optimizer': 'Adam'}. Best is trial 91 with value: 0.0871384560332929.
2026-05-13 22:15:00,440 - optuna.study._optimize - INFO - Trial 94 pruned. 
2026-05-13 22:15:05,313 - optuna.study._optimize - INFO - Trial 95 pruned. 
2026-05-13 22:15:09,196 - optuna.study._optimize - INFO - Trial 96 pruned. 
2026-05-13 22:15:13,353 - optuna.study._optimize - INFO - Trial 97 pruned. 
2026-05-13 22:15:49,877 - optuna.study.study - INFO - Trial 98 finished with value: 0.07459577605964263 and parameters: {'n_layers': 1, 'embedding_dim': 256, 'lr': 0.0001815287120297767, 'lambda_val': 0.0001355254064751421, 'batch_size': 3184, 'optimizer': 'Adam'}. Best is trial 91 with value: 0.0871384560332929.
2026-05-13 22:15:54,523 - optuna.study._optimize - INFO - Trial 99 pruned. 
2026-05-13 22:16:01,538 - optuna.study._optimize - INFO - Trial 100 pruned. 
2026-05-13 22:16:06,172 - optuna.study._optimize - INFO - Trial 101 pruned. 
2026-05-13 22:16:43,030 - optuna.study.study - INFO - Trial 102 finished with value: 0.08413447718290734 and parameters: {'n_layers': 1, 'embedding_dim': 256, 'lr': 0.00022104093510169978, 'lambda_val': 7.240825619177369e-05, 'batch_size': 4094, 'optimizer': 'Adam'}. Best is trial 91 with value: 0.0871384560332929.
2026-05-13 22:17:19,924 - optuna.study.study - INFO - Trial 103 finished with value: 0.07207785989158534 and parameters: {'n_layers': 1, 'embedding_dim': 256, 'lr': 0.00031532493110785577, 'lambda_val': 0.0001890781119151464, 'batch_size': 3881, 'optimizer': 'Adam'}. Best is trial 91 with value: 0.0871384560332929.
2026-05-13 22:17:56,729 - optuna.study.study - INFO - Trial 104 finished with value: 0.07022433139361044 and parameters: {'n_layers': 1, 'embedding_dim': 256, 'lr': 0.0002112204622748294, 'lambda_val': 4.264762793045323e-05, 'batch_size': 3954, 'optimizer': 'Adam'}. Best is trial 91 with value: 0.0871384560332929.
2026-05-13 22:18:00,669 - optuna.study._optimize - INFO - Trial 105 pruned. 
2026-05-13 22:18:07,563 - optuna.study._optimize - INFO - Trial 106 pruned. 
2026-05-13 22:18:18,548 - optuna.study._optimize - INFO - Trial 107 pruned. 
2026-05-13 22:18:26,985 - optuna.study._optimize - INFO - Trial 108 pruned. 
2026-05-13 22:18:31,535 - optuna.study._optimize - INFO - Trial 109 pruned. 
2026-05-13 22:18:35,779 - optuna.study._optimize - INFO - Trial 110 pruned. 
2026-05-13 22:19:13,061 - optuna.study.study - INFO - Trial 111 finished with value: 0.06605981973304827 and parameters: {'n_layers': 1, 'embedding_dim': 256, 'lr': 0.00023013110782346482, 'lambda_val': 7.70183943694228e-05, 'batch_size': 4074, 'optimizer': 'Adam'}. Best is trial 91 with value: 0.0871384560332929.
2026-05-13 22:19:17,731 - optuna.study._optimize - INFO - Trial 112 pruned. 
2026-05-13 22:19:54,572 - optuna.study.study - INFO - Trial 113 finished with value: 0.06634878455342046 and parameters: {'n_layers': 1, 'embedding_dim': 256, 'lr': 0.0002987314822445268, 'lambda_val': 9.433222672993106e-05, 'batch_size': 3875, 'optimizer': 'Adam'}. Best is trial 91 with value: 0.0871384560332929.
2026-05-13 22:20:00,568 - optuna.study._optimize - INFO - Trial 114 pruned. 
2026-05-13 22:20:35,464 - optuna.study.study - INFO - Trial 115 finished with value: 0.08165711171174644 and parameters: {'n_layers': 1, 'embedding_dim': 256, 'lr': 0.00019137198075388823, 'lambda_val': 2.162186278733619e-05, 'batch_size': 2250, 'optimizer': 'Adam'}. Best is trial 91 with value: 0.0871384560332929.
2026-05-13 22:20:39,393 - optuna.study._optimize - INFO - Trial 116 pruned. 
2026-05-13 22:21:15,703 - optuna.study.study - INFO - Trial 117 finished with value: 0.059837638926112796 and parameters: {'n_layers': 1, 'embedding_dim': 256, 'lr': 0.0004925286623283267, 'lambda_val': 5.432419533517857e-06, 'batch_size': 3159, 'optimizer': 'Adam'}. Best is trial 91 with value: 0.0871384560332929.
2026-05-13 22:21:49,778 - optuna.study.study - INFO - Trial 118 finished with value: 0.05335183327274565 and parameters: {'n_layers': 1, 'embedding_dim': 128, 'lr': 0.0006212499344246518, 'lambda_val': 1.3783198577340042e-05, 'batch_size': 2267, 'optimizer': 'RMSprop'}. Best is trial 91 with value: 0.0871384560332929.
2026-05-13 22:21:55,340 - optuna.study._optimize - INFO - Trial 119 pruned. 
2026-05-13 22:22:27,265 - optuna.study.study - INFO - Trial 120 finished with value: 0.06090861814175367 and parameters: {'n_layers': 1, 'embedding_dim': 96, 'lr': 0.00037622914889856135, 'lambda_val': 4.000335213648346e-05, 'batch_size': 2663, 'optimizer': 'Adam'}. Best is trial 91 with value: 0.0871384560332929.
2026-05-13 22:23:05,398 - optuna.study.study - INFO - Trial 121 finished with value: 0.06796229631932828 and parameters: {'n_layers': 1, 'embedding_dim': 256, 'lr': 0.0002558293226716801, 'lambda_val': 3.336442132659986e-05, 'batch_size': 2940, 'optimizer': 'Adam'}. Best is trial 91 with value: 0.0871384560332929.
2026-05-13 22:23:10,013 - optuna.study._optimize - INFO - Trial 122 pruned. 
