2026-05-14 01:32:28,675 - optuna.study.study - INFO - Trial 124 finished with value: 0.08649133798078486 and parameters: {'n_layers': 1, 'embedding_dim': 256, 'lr': 0.01099850793042439, 'lambda_val': 0.000752458957471382, 'batch_size': 3151, 'optimizer': 'RMSprop'}. Best is trial 115 with value: 0.09024865963054053.
2026-05-14 01:32:36,268 - optuna.study._optimize - INFO - Trial 125 pruned. 
2026-05-14 01:33:20,138 - optuna.study.study - INFO - Trial 126 finished with value: 0.09196675011445243 and parameters: {'n_layers': 1, 'embedding_dim': 256, 'lr': 0.011186896983499202, 'lambda_val': 0.0010448485803088642, 'batch_size': 2969, 'optimizer': 'RMSprop'}. Best is trial 126 with value: 0.09196675011445243.
2026-05-14 01:34:08,373 - optuna.study.study - INFO - Trial 127 finished with value: 0.08375084223833477 and parameters: {'n_layers': 1, 'embedding_dim': 256, 'lr': 0.010181859706067945, 'lambda_val': 0.0008102909288525772, 'batch_size': 2876, 'optimizer': 'Adam'}. Best is trial 126 with value: 0.09196675011445243.
2026-05-14 01:34:15,366 - optuna.study._optimize - INFO - Trial 128 pruned. 
2026-05-14 01:34:58,014 - optuna.study.study - INFO - Trial 129 finished with value: 0.07957574996171642 and parameters: {'n_layers': 1, 'embedding_dim': 256, 'lr': 0.008380345643269343, 'lambda_val': 0.0003771935686760356, 'batch_size': 3102, 'optimizer': 'RMSprop'}. Best is trial 126 with value: 0.09196675011445243.
2026-05-14 01:35:43,745 - optuna.study.study - INFO - Trial 130 finished with value: 0.08021117627684432 and parameters: {'n_layers': 1, 'embedding_dim': 256, 'lr': 0.011572890949996348, 'lambda_val': 0.0013351596929654056, 'batch_size': 3162, 'optimizer': 'RMSprop'}. Best is trial 126 with value: 0.09196675011445243.
2026-05-14 01:35:55,099 - optuna.study._optimize - INFO - Trial 131 pruned. 
2026-05-14 01:36:33,679 - optuna.study.study - INFO - Trial 132 finished with value: 0.08597244528288422 and parameters: {'n_layers': 1, 'embedding_dim': 256, 'lr': 0.010386426274674225, 'lambda_val': 0.0026227223489843146, 'batch_size': 2936, 'optimizer': 'RMSprop'}. Best is trial 126 with value: 0.09196675011445243.
2026-05-14 01:36:40,179 - optuna.study._optimize - INFO - Trial 133 pruned. 
2026-05-14 01:37:16,035 - optuna.study.study - INFO - Trial 134 finished with value: 0.08255082369882118 and parameters: {'n_layers': 1, 'embedding_dim': 256, 'lr': 0.012223940086227018, 'lambda_val': 0.0010860115746131542, 'batch_size': 3457, 'optimizer': 'RMSprop'}. Best is trial 126 with value: 0.09196675011445243.
2026-05-14 01:38:02,719 - optuna.study.study - INFO - Trial 135 finished with value: 0.08817603846079469 and parameters: {'n_layers': 1, 'embedding_dim': 256, 'lr': 0.008906130185771839, 'lambda_val': 0.0020781755805729424, 'batch_size': 3398, 'optimizer': 'RMSprop'}. Best is trial 126 with value: 0.09196675011445243.
2026-05-14 01:38:40,615 - optuna.study.study - INFO - Trial 136 finished with value: 0.09047467532218874 and parameters: {'n_layers': 1, 'embedding_dim': 256, 'lr': 0.007119008679997667, 'lambda_val': 0.0007883205567509891, 'batch_size': 3203, 'optimizer': 'RMSprop'}. Best is trial 126 with value: 0.09196675011445243.
2026-05-14 01:38:45,733 - optuna.study._optimize - INFO - Trial 137 pruned. 
2026-05-14 01:39:20,006 - optuna.study.study - INFO - Trial 138 finished with value: 0.08547230625369616 and parameters: {'n_layers': 1, 'embedding_dim': 256, 'lr': 0.0082418388359497, 'lambda_val': 0.0035786589062476574, 'batch_size': 3367, 'optimizer': 'RMSprop'}. Best is trial 126 with value: 0.09196675011445243.
2026-05-14 01:39:24,989 - optuna.study._optimize - INFO - Trial 139 pruned. 
2026-05-14 01:40:03,161 - optuna.study.study - INFO - Trial 140 finished with value: 0.08817271267801217 and parameters: {'n_layers': 1, 'embedding_dim': 256, 'lr': 0.00622523271981903, 'lambda_val': 0.0014298520978226572, 'batch_size': 3194, 'optimizer': 'RMSprop'}. Best is trial 126 with value: 0.09196675011445243.
2026-05-14 01:40:44,846 - optuna.study.study - INFO - Trial 141 finished with value: 0.08811824898828682 and parameters: {'n_layers': 1, 'embedding_dim': 256, 'lr': 0.005819491123972221, 'lambda_val': 0.0013490001255718788, 'batch_size': 3205, 'optimizer': 'RMSprop'}. Best is trial 126 with value: 0.09196675011445243.
2026-05-14 01:41:34,700 - optuna.study.study - INFO - Trial 142 finished with value: 0.09003787774925075 and parameters: {'n_layers': 1, 'embedding_dim': 256, 'lr': 0.005367836234803341, 'lambda_val': 0.00139159436197252, 'batch_size': 3189, 'optimizer': 'RMSprop'}. Best is trial 126 with value: 0.09196675011445243.
2026-05-14 01:42:20,501 - optuna.study.study - INFO - Trial 143 finished with value: 0.08912471366891157 and parameters: {'n_layers': 1, 'embedding_dim': 256, 'lr': 0.005171275777678047, 'lambda_val': 0.0009022873352786738, 'batch_size': 3080, 'optimizer': 'RMSprop'}. Best is trial 126 with value: 0.09196675011445243.
2026-05-14 01:43:10,664 - optuna.study.study - INFO - Trial 144 finished with value: 0.08481837856333935 and parameters: {'n_layers': 1, 'embedding_dim': 256, 'lr': 0.005260836198823321, 'lambda_val': 0.0015340398845601461, 'batch_size': 3077, 'optimizer': 'RMSprop'}. Best is trial 126 with value: 0.09196675011445243.
2026-05-14 01:44:03,204 - optuna.study.study - INFO - Trial 145 finished with value: 0.08238600074516224 and parameters: {'n_layers': 1, 'embedding_dim': 256, 'lr': 0.005905711927651101, 'lambda_val': 0.0027914343711921085, 'batch_size': 2981, 'optimizer': 'RMSprop'}. Best is trial 126 with value: 0.09196675011445243.
2026-05-14 01:44:49,224 - optuna.study.study - INFO - Trial 146 finished with value: 0.08574099241668803 and parameters: {'n_layers': 1, 'embedding_dim': 256, 'lr': 0.004754767289082858, 'lambda_val': 0.0016734924438563971, 'batch_size': 2831, 'optimizer': 'RMSprop'}. Best is trial 126 with value: 0.09196675011445243.
2026-05-14 01:45:40,862 - optuna.study.study - INFO - Trial 147 finished with value: 0.08470604154519328 and parameters: {'n_layers': 1, 'embedding_dim': 256, 'lr': 0.0073855284842940455, 'lambda_val': 0.000900261532443711, 'batch_size': 3194, 'optimizer': 'RMSprop'}. Best is trial 126 with value: 0.09196675011445243.
2026-05-14 01:46:18,643 - optuna.study.study - INFO - Trial 148 finished with value: 0.07955463874938391 and parameters: {'n_layers': 1, 'embedding_dim': 256, 'lr': 0.0063724790044880865, 'lambda_val': 0.0006171940207570599, 'batch_size': 3109, 'optimizer': 'RMSprop'}. Best is trial 126 with value: 0.09196675011445243.
2026-05-14 01:46:43,784 - optuna.study._optimize - INFO - Trial 149 pruned. 
2026-05-14 01:46:48,970 - optuna.study._optimize - INFO - Trial 150 pruned. 
2026-05-14 01:46:54,887 - optuna.study._optimize - INFO - Trial 151 pruned. 
2026-05-14 01:47:02,011 - optuna.study._optimize - INFO - Trial 152 pruned. 
2026-05-14 01:47:08,677 - optuna.study._optimize - INFO - Trial 153 pruned. 
2026-05-14 01:47:54,101 - optuna.study.study - INFO - Trial 154 finished with value: 0.08258975809530848 and parameters: {'n_layers': 1, 'embedding_dim': 256, 'lr': 0.009337439388765594, 'lambda_val': 0.0022101616878126506, 'batch_size': 3318, 'optimizer': 'RMSprop'}. Best is trial 126 with value: 0.09196675011445243.
2026-05-14 01:48:43,563 - optuna.study.study - INFO - Trial 155 finished with value: 0.08022167973714531 and parameters: {'n_layers': 1, 'embedding_dim': 256, 'lr': 0.0051958280871269346, 'lambda_val': 0.0030675875860463574, 'batch_size': 3047, 'optimizer': 'RMSprop'}. Best is trial 126 with value: 0.09196675011445243.
2026-05-14 01:48:49,430 - optuna.study._optimize - INFO - Trial 156 pruned. 
2026-05-14 01:49:36,872 - optuna.study.study - INFO - Trial 157 finished with value: 0.08671522230814434 and parameters: {'n_layers': 1, 'embedding_dim': 256, 'lr': 0.006942592803324179, 'lambda_val': 0.001397141446420176, 'batch_size': 3187, 'optimizer': 'RMSprop'}. Best is trial 126 with value: 0.09196675011445243.
2026-05-14 01:50:24,478 - optuna.study.study - INFO - Trial 158 finished with value: 0.0865432141268702 and parameters: {'n_layers': 1, 'embedding_dim': 256, 'lr': 0.009044019303169512, 'lambda_val': 0.00113505211650707, 'batch_size': 3314, 'optimizer': 'RMSprop'}. Best is trial 126 with value: 0.09196675011445243.
2026-05-14 01:50:32,300 - optuna.study._optimize - INFO - Trial 159 pruned. 
2026-05-14 01:50:40,238 - optuna.study._optimize - INFO - Trial 160 pruned. 
2026-05-14 01:51:26,776 - optuna.study.study - INFO - Trial 161 finished with value: 0.08473289751879924 and parameters: {'n_layers': 1, 'embedding_dim': 256, 'lr': 0.003921255115033934, 'lambda_val': 0.0012152007885281862, 'batch_size': 3214, 'optimizer': 'RMSprop'}. Best is trial 126 with value: 0.09196675011445243.
2026-05-14 01:52:08,582 - optuna.study.study - INFO - Trial 162 finished with value: 0.08146587399592349 and parameters: {'n_layers': 1, 'embedding_dim': 256, 'lr': 0.0033638104676929036, 'lambda_val': 0.002033578123514905, 'batch_size': 3248, 'optimizer': 'RMSprop'}. Best is trial 126 with value: 0.09196675011445243.
2026-05-14 01:52:53,496 - optuna.study.study - INFO - Trial 163 finished with value: 0.08817675650422 and parameters: {'n_layers': 1, 'embedding_dim': 256, 'lr': 0.004671751402860536, 'lambda_val': 0.0014270376168394698, 'batch_size': 3100, 'optimizer': 'RMSprop'}. Best is trial 126 with value: 0.09196675011445243.
2026-05-14 01:53:38,409 - optuna.study.study - INFO - Trial 164 finished with value: 0.07952203807423544 and parameters: {'n_layers': 1, 'embedding_dim': 256, 'lr': 0.00465996472299998, 'lambda_val': 0.0026076391030431844, 'batch_size': 3118, 'optimizer': 'RMSprop'}. Best is trial 126 with value: 0.09196675011445243.
2026-05-14 01:53:48,901 - optuna.study._optimize - INFO - Trial 165 pruned. 
2026-05-14 01:53:54,295 - optuna.study._optimize - INFO - Trial 166 pruned. 
2026-05-14 01:53:58,754 - optuna.study._optimize - INFO - Trial 167 pruned. 
2026-05-14 01:54:08,754 - optuna.study._optimize - INFO - Trial 168 pruned. 
2026-05-14 01:54:55,035 - optuna.study.study - INFO - Trial 169 finished with value: 0.08592201322072672 and parameters: {'n_layers': 1, 'embedding_dim': 256, 'lr': 0.005772422239544369, 'lambda_val': 0.0023007322574492848, 'batch_size': 3483, 'optimizer': 'RMSprop'}. Best is trial 126 with value: 0.09196675011445243.
2026-05-14 01:55:36,545 - optuna.study.study - INFO - Trial 170 finished with value: 0.08794729610824732 and parameters: {'n_layers': 1, 'embedding_dim': 256, 'lr': 0.01020062384380454, 'lambda_val': 0.0008593957600417862, 'batch_size': 3034, 'optimizer': 'RMSprop'}. Best is trial 126 with value: 0.09196675011445243.
2026-05-14 01:56:17,258 - optuna.study.study - INFO - Trial 171 finished with value: 0.09153583212352084 and parameters: {'n_layers': 1, 'embedding_dim': 256, 'lr': 0.01000740168767997, 'lambda_val': 0.0007623126337088621, 'batch_size': 2997, 'optimizer': 'RMSprop'}. Best is trial 126 with value: 0.09196675011445243.
2026-05-14 01:56:22,711 - optuna.study._optimize - INFO - Trial 172 pruned. 
2026-05-14 01:56:28,231 - optuna.study._optimize - INFO - Trial 173 pruned. 
2026-05-14 01:56:33,619 - optuna.study._optimize - INFO - Trial 174 pruned. 
2026-05-14 01:57:10,605 - optuna.study.study - INFO - Trial 175 finished with value: 0.08133126778350938 and parameters: {'n_layers': 1, 'embedding_dim': 256, 'lr': 0.004830833484741617, 'lambda_val': 0.0017060474416492944, 'batch_size': 2943, 'optimizer': 'RMSprop'}. Best is trial 126 with value: 0.09196675011445243.
2026-05-14 01:57:50,787 - optuna.study.study - INFO - Trial 176 finished with value: 0.07903050803342573 and parameters: {'n_layers': 1, 'embedding_dim': 256, 'lr': 0.006906839861029541, 'lambda_val': 0.0005686126275412721, 'batch_size': 3169, 'optimizer': 'RMSprop'}. Best is trial 126 with value: 0.09196675011445243.
2026-05-14 01:58:28,206 - optuna.study.study - INFO - Trial 177 finished with value: 0.08614308259429285 and parameters: {'n_layers': 1, 'embedding_dim': 256, 'lr': 0.009311013105026291, 'lambda_val': 0.0011049240265433372, 'batch_size': 2793, 'optimizer': 'RMSprop'}. Best is trial 126 with value: 0.09196675011445243.
2026-05-14 01:58:32,520 - optuna.study._optimize - INFO - Trial 178 pruned. 
2026-05-14 01:59:15,338 - optuna.study.study - INFO - Trial 179 finished with value: 0.08516033814778703 and parameters: {'n_layers': 1, 'embedding_dim': 256, 'lr': 0.00555314527246784, 'lambda_val': 0.00321507914229257, 'batch_size': 3109, 'optimizer': 'RMSprop'}. Best is trial 126 with value: 0.09196675011445243.
2026-05-14 01:59:20,498 - optuna.study._optimize - INFO - Trial 180 pruned. 
2026-05-14 01:59:26,766 - optuna.study._optimize - INFO - Trial 181 pruned. 
2026-05-14 01:59:38,024 - optuna.study._optimize - INFO - Trial 182 pruned. 
2026-05-14 01:59:50,423 - optuna.study._optimize - INFO - Trial 183 pruned. 
2026-05-14 01:59:55,751 - optuna.study._optimize - INFO - Trial 184 pruned. 
2026-05-14 02:00:39,075 - optuna.study.study - INFO - Trial 185 finished with value: 0.08850533083836011 and parameters: {'n_layers': 1, 'embedding_dim': 256, 'lr': 0.007512637318156479, 'lambda_val': 0.000673658973586291, 'batch_size': 3160, 'optimizer': 'RMSprop'}. Best is trial 126 with value: 0.09196675011445243.
2026-05-14 02:01:24,618 - optuna.study.study - INFO - Trial 186 finished with value: 0.08679425303091452 and parameters: {'n_layers': 1, 'embedding_dim': 256, 'lr': 0.007928655460461835, 'lambda_val': 0.0006371697522519481, 'batch_size': 2965, 'optimizer': 'Adam'}. Best is trial 126 with value: 0.09196675011445243.
2026-05-14 02:01:41,121 - optuna.study._optimize - INFO - Trial 187 pruned. 
2026-05-14 02:02:19,859 - optuna.study.study - INFO - Trial 188 finished with value: 0.08452054625614129 and parameters: {'n_layers': 1, 'embedding_dim': 256, 'lr': 0.006895164730086819, 'lambda_val': 0.0005065355956079378, 'batch_size': 1807, 'optimizer': 'RMSprop'}. Best is trial 126 with value: 0.09196675011445243.
2026-05-14 02:02:24,828 - optuna.study._optimize - INFO - Trial 189 pruned. 
2026-05-14 02:02:42,399 - optuna.study._optimize - INFO - Trial 190 pruned. 
2026-05-14 02:02:47,532 - optuna.study._optimize - INFO - Trial 191 pruned. 
2026-05-14 02:03:27,841 - optuna.study.study - INFO - Trial 192 finished with value: 0.09142147933744238 and parameters: {'n_layers': 1, 'embedding_dim': 256, 'lr': 0.00849112865567261, 'lambda_val': 0.000988223498322353, 'batch_size': 3165, 'optimizer': 'RMSprop'}. Best is trial 126 with value: 0.09196675011445243.
2026-05-14 02:04:14,690 - optuna.study.study - INFO - Trial 193 finished with value: 0.08994698441332098 and parameters: {'n_layers': 1, 'embedding_dim': 256, 'lr': 0.005500140351940978, 'lambda_val': 0.0011377161148673307, 'batch_size': 3178, 'optimizer': 'RMSprop'}. Best is trial 126 with value: 0.09196675011445243.
2026-05-14 02:04:59,175 - optuna.study.study - INFO - Trial 194 finished with value: 0.08966239552112058 and parameters: {'n_layers': 1, 'embedding_dim': 256, 'lr': 0.006091779500920799, 'lambda_val': 0.0015931104639907278, 'batch_size': 3362, 'optimizer': 'RMSprop'}. Best is trial 126 with value: 0.09196675011445243.
2026-05-14 02:05:41,725 - optuna.study.study - INFO - Trial 195 finished with value: 0.08959835017531027 and parameters: {'n_layers': 1, 'embedding_dim': 256, 'lr': 0.005945888150487768, 'lambda_val': 0.001122903433865857, 'batch_size': 3177, 'optimizer': 'RMSprop'}. Best is trial 126 with value: 0.09196675011445243.
2026-05-14 02:06:24,852 - optuna.study.study - INFO - Trial 196 finished with value: 0.08296549982643037 and parameters: {'n_layers': 1, 'embedding_dim': 256, 'lr': 0.005135790228546892, 'lambda_val': 0.0011279401374399139, 'batch_size': 3157, 'optimizer': 'RMSprop'}. Best is trial 126 with value: 0.09196675011445243.
2026-05-14 02:06:28,620 - optuna.study._optimize - INFO - Trial 197 pruned. 
2026-05-14 02:06:32,761 - optuna.study._optimize - INFO - Trial 198 pruned. 
2026-05-14 02:06:38,516 - optuna.study._optimize - INFO - Trial 199 pruned. 
2026-05-14 02:07:04,157 - root - INFO -   **** Training e_100K_1c3dcs_rand5
2026-05-14 02:07:04,170 - root - INFO -   **** Getting 56335/65410 random edges
2026-05-14 02:07:04,406 - optuna.storages._rdb.storage - INFO - A new study created in RDB with name: Study_e_100K_1c3dcs_rand5
2026-05-14 02:07:52,277 - optuna.study.study - INFO - Trial 0 finished with value: 0.028333212191091896 and parameters: {'n_layers': 2, 'embedding_dim': 96, 'lr': 2.0445639711074875e-05, 'lambda_val': 0.0002177927599935442, 'batch_size': 1877, 'optimizer': 'RMSprop'}. Best is trial 0 with value: 0.028333212191091896.
2026-05-14 02:08:36,518 - optuna.study.study - INFO - Trial 1 finished with value: 0.0034395839404838774 and parameters: {'n_layers': 2, 'embedding_dim': 128, 'lr': 0.00010996658527351011, 'lambda_val': 9.458651414673684e-06, 'batch_size': 1589, 'optimizer': 'SGD'}. Best is trial 0 with value: 0.028333212191091896.
2026-05-14 02:09:11,219 - optuna.study.study - INFO - Trial 2 finished with value: 0.0020192082301060273 and parameters: {'n_layers': 3, 'embedding_dim': 32, 'lr': 1.0212827059433307e-05, 'lambda_val': 0.00032850554941255916, 'batch_size': 3280, 'optimizer': 'SGD'}. Best is trial 0 with value: 0.028333212191091896.
2026-05-14 02:09:43,996 - optuna.study.study - INFO - Trial 3 finished with value: 0.024649478147135886 and parameters: {'n_layers': 3, 'embedding_dim': 32, 'lr': 0.09080737030406416, 'lambda_val': 8.576932276271823e-05, 'batch_size': 1069, 'optimizer': 'RMSprop'}. Best is trial 0 with value: 0.028333212191091896.
2026-05-14 02:10:25,324 - optuna.study.study - INFO - Trial 4 finished with value: 0.021135910284149788 and parameters: {'n_layers': 1, 'embedding_dim': 96, 'lr': 2.0875042667354922e-05, 'lambda_val': 0.0007784105550770943, 'batch_size': 2826, 'optimizer': 'RMSprop'}. Best is trial 0 with value: 0.028333212191091896.
2026-05-14 02:11:12,136 - optuna.study._optimize - INFO - Trial 5 pruned. 
2026-05-14 02:11:17,716 - optuna.study._optimize - INFO - Trial 6 pruned. 
2026-05-14 02:11:50,498 - optuna.study.study - INFO - Trial 7 finished with value: 0.05395132849388722 and parameters: {'n_layers': 1, 'embedding_dim': 128, 'lr': 0.0008264383237652699, 'lambda_val': 0.0005697463363122442, 'batch_size': 1868, 'optimizer': 'Adam'}. Best is trial 7 with value: 0.05395132849388722.
2026-05-14 02:12:37,538 - optuna.study.study - INFO - Trial 8 finished with value: 0.024934215152295103 and parameters: {'n_layers': 3, 'embedding_dim': 128, 'lr': 0.00022968935725220304, 'lambda_val': 9.467634537251958e-05, 'batch_size': 3075, 'optimizer': 'RMSprop'}. Best is trial 7 with value: 0.05395132849388722.
2026-05-14 02:13:15,439 - optuna.study.study - INFO - Trial 9 finished with value: 0.026966394405328924 and parameters: {'n_layers': 2, 'embedding_dim': 32, 'lr': 0.00593596387223472, 'lambda_val': 0.00035579561114723173, 'batch_size': 3204, 'optimizer': 'Adam'}. Best is trial 7 with value: 0.05395132849388722.
2026-05-14 02:13:50,209 - optuna.study.study - INFO - Trial 10 finished with value: 0.04986272509941643 and parameters: {'n_layers': 1, 'embedding_dim': 128, 'lr': 0.012929171877834109, 'lambda_val': 0.01182082050281213, 'batch_size': 831, 'optimizer': 'Adam'}. Best is trial 7 with value: 0.05395132849388722.
2026-05-14 02:14:26,571 - optuna.study.study - INFO - Trial 11 finished with value: 0.043461444323207435 and parameters: {'n_layers': 1, 'embedding_dim': 128, 'lr': 0.01330850540389129, 'lambda_val': 0.013068496274867857, 'batch_size': 719, 'optimizer': 'Adam'}. Best is trial 7 with value: 0.05395132849388722.
2026-05-14 02:15:05,843 - optuna.study.study - INFO - Trial 12 finished with value: 0.06197728861256636 and parameters: {'n_layers': 1, 'embedding_dim': 128, 'lr': 0.0014326675969603684, 'lambda_val': 0.0037022672899459995, 'batch_size': 2311, 'optimizer': 'Adam'}. Best is trial 12 with value: 0.06197728861256636.
2026-05-14 02:15:41,441 - optuna.study.study - INFO - Trial 13 finished with value: 0.0525248974373265 and parameters: {'n_layers': 1, 'embedding_dim': 128, 'lr': 0.0008719499904808618, 'lambda_val': 0.0031536552976235755, 'batch_size': 2443, 'optimizer': 'Adam'}. Best is trial 12 with value: 0.06197728861256636.
2026-05-14 02:15:55,440 - optuna.study._optimize - INFO - Trial 14 pruned. 
2026-05-14 02:16:44,043 - optuna.study.study - INFO - Trial 15 finished with value: 0.039846638734236314 and parameters: {'n_layers': 2, 'embedding_dim': 256, 'lr': 0.0022750310256702535, 'lambda_val': 0.001887106875251454, 'batch_size': 1306, 'optimizer': 'Adam'}. Best is trial 12 with value: 0.06197728861256636.
2026-05-14 02:17:37,364 - optuna.study._optimize - INFO - Trial 16 pruned. 
2026-05-14 02:18:07,769 - optuna.study.study - INFO - Trial 17 finished with value: 0.045085782311056956 and parameters: {'n_layers': 1, 'embedding_dim': 128, 'lr': 0.0038802620123290867, 'lambda_val': 1.4610368318316778e-05, 'batch_size': 1704, 'optimizer': 'Adam'}. Best is trial 12 with value: 0.06197728861256636.
2026-05-14 02:18:12,974 - optuna.study._optimize - INFO - Trial 18 pruned. 
2026-05-14 02:18:18,725 - optuna.study._optimize - INFO - Trial 19 pruned. 
2026-05-14 02:18:23,877 - optuna.study._optimize - INFO - Trial 20 pruned. 
2026-05-14 02:18:55,062 - optuna.study.study - INFO - Trial 21 finished with value: 0.052168845326843925 and parameters: {'n_layers': 1, 'embedding_dim': 128, 'lr': 0.0006958410680841509, 'lambda_val': 0.004932467420597631, 'batch_size': 2345, 'optimizer': 'Adam'}. Best is trial 12 with value: 0.06197728861256636.
2026-05-14 02:19:38,290 - optuna.study.study - INFO - Trial 22 finished with value: 0.07042866503150598 and parameters: {'n_layers': 1, 'embedding_dim': 128, 'lr': 0.0018658363859404622, 'lambda_val': 0.00345042367908885, 'batch_size': 1465, 'optimizer': 'Adam'}. Best is trial 22 with value: 0.07042866503150598.
