2026-05-13 13:30:32,028 - optuna.study._optimize - INFO - Trial 98 pruned. 
2026-05-13 13:30:36,394 - optuna.study._optimize - INFO - Trial 99 pruned. 
2026-05-13 13:31:13,036 - optuna.study.study - INFO - Trial 100 finished with value: 0.07034197189011651 and parameters: {'n_layers': 1, 'embedding_dim': 256, 'lr': 0.0003440756482648562, 'lambda_val': 3.581663674617977e-05, 'batch_size': 3174, 'optimizer': 'Adam'}. Best is trial 1 with value: 0.08987168849690128.
2026-05-13 13:31:48,407 - optuna.study.study - INFO - Trial 101 finished with value: 0.06980945360229045 and parameters: {'n_layers': 1, 'embedding_dim': 256, 'lr': 0.0004669372420894102, 'lambda_val': 5.917593520710496e-06, 'batch_size': 2977, 'optimizer': 'Adam'}. Best is trial 1 with value: 0.08987168849690128.
2026-05-13 13:31:53,441 - optuna.study._optimize - INFO - Trial 102 pruned. 
2026-05-13 13:31:58,156 - optuna.study._optimize - INFO - Trial 103 pruned. 
2026-05-13 13:32:33,869 - optuna.study.study - INFO - Trial 104 finished with value: 0.06745494912923757 and parameters: {'n_layers': 1, 'embedding_dim': 256, 'lr': 0.00036743361125404983, 'lambda_val': 1.093061336696355e-05, 'batch_size': 3390, 'optimizer': 'Adam'}. Best is trial 1 with value: 0.08987168849690128.
2026-05-13 13:32:38,571 - optuna.study._optimize - INFO - Trial 105 pruned. 
2026-05-13 13:32:42,765 - optuna.study._optimize - INFO - Trial 106 pruned. 
2026-05-13 13:32:46,727 - optuna.study._optimize - INFO - Trial 107 pruned. 
2026-05-13 13:32:52,159 - optuna.study._optimize - INFO - Trial 108 pruned. 
2026-05-13 13:33:29,158 - optuna.study.study - INFO - Trial 109 finished with value: 0.08118713971897686 and parameters: {'n_layers': 1, 'embedding_dim': 256, 'lr': 0.00029883377631027553, 'lambda_val': 3.837498365643621e-06, 'batch_size': 3085, 'optimizer': 'Adam'}. Best is trial 1 with value: 0.08987168849690128.
2026-05-13 13:33:33,251 - optuna.study._optimize - INFO - Trial 110 pruned. 
2026-05-13 13:34:11,634 - optuna.study.study - INFO - Trial 111 finished with value: 0.06585582703501129 and parameters: {'n_layers': 1, 'embedding_dim': 256, 'lr': 0.0005058195029118893, 'lambda_val': 2.0199907149480883e-06, 'batch_size': 3155, 'optimizer': 'Adam'}. Best is trial 1 with value: 0.08987168849690128.
2026-05-13 13:34:17,182 - optuna.study._optimize - INFO - Trial 112 pruned. 
2026-05-13 13:34:23,240 - optuna.study._optimize - INFO - Trial 113 pruned. 
2026-05-13 13:34:59,924 - optuna.study.study - INFO - Trial 114 finished with value: 0.07511608655493236 and parameters: {'n_layers': 1, 'embedding_dim': 256, 'lr': 0.00029082827908639795, 'lambda_val': 1.2429388523045917e-05, 'batch_size': 3686, 'optimizer': 'Adam'}. Best is trial 1 with value: 0.08987168849690128.
2026-05-13 13:35:37,600 - optuna.study.study - INFO - Trial 115 finished with value: 0.06379192208734591 and parameters: {'n_layers': 1, 'embedding_dim': 256, 'lr': 0.0004190430027812658, 'lambda_val': 2.1769735144085734e-05, 'batch_size': 3697, 'optimizer': 'Adam'}. Best is trial 1 with value: 0.08987168849690128.
2026-05-13 13:36:14,775 - optuna.study.study - INFO - Trial 116 finished with value: 0.054284997395529055 and parameters: {'n_layers': 1, 'embedding_dim': 256, 'lr': 0.000701463019418658, 'lambda_val': 1.2558397093525853e-05, 'batch_size': 3553, 'optimizer': 'Adam'}. Best is trial 1 with value: 0.08987168849690128.
2026-05-13 13:36:19,249 - optuna.study._optimize - INFO - Trial 117 pruned. 
2026-05-13 13:36:55,986 - optuna.study.study - INFO - Trial 118 finished with value: 0.07000372903426784 and parameters: {'n_layers': 1, 'embedding_dim': 256, 'lr': 0.00022937025116579284, 'lambda_val': 1.2902940478064938e-06, 'batch_size': 3787, 'optimizer': 'RMSprop'}. Best is trial 1 with value: 0.08987168849690128.
2026-05-13 13:37:00,642 - optuna.study._optimize - INFO - Trial 119 pruned. 
2026-05-13 13:37:07,061 - optuna.study._optimize - INFO - Trial 120 pruned. 
2026-05-13 13:37:11,750 - optuna.study._optimize - INFO - Trial 121 pruned. 
2026-05-13 13:37:48,121 - optuna.study.study - INFO - Trial 122 finished with value: 0.09403495675055504 and parameters: {'n_layers': 1, 'embedding_dim': 256, 'lr': 0.0001951279441560098, 'lambda_val': 2.799317073619916e-06, 'batch_size': 2217, 'optimizer': 'Adam'}. Best is trial 122 with value: 0.09403495675055504.
2026-05-13 13:37:54,110 - optuna.study._optimize - INFO - Trial 123 pruned. 
2026-05-13 13:37:58,557 - optuna.study._optimize - INFO - Trial 124 pruned. 
2026-05-13 13:38:03,321 - optuna.study._optimize - INFO - Trial 125 pruned. 
2026-05-13 13:38:08,139 - optuna.study._optimize - INFO - Trial 126 pruned. 
2026-05-13 13:38:12,279 - optuna.study._optimize - INFO - Trial 127 pruned. 
2026-05-13 13:38:16,903 - optuna.study._optimize - INFO - Trial 128 pruned. 
2026-05-13 13:38:21,848 - optuna.study._optimize - INFO - Trial 129 pruned. 
2026-05-13 13:38:27,032 - optuna.study._optimize - INFO - Trial 130 pruned. 
2026-05-13 13:39:01,515 - optuna.study.study - INFO - Trial 131 finished with value: 0.08910751530266864 and parameters: {'n_layers': 1, 'embedding_dim': 256, 'lr': 0.00032605621612571723, 'lambda_val': 7.666284451528572e-06, 'batch_size': 727, 'optimizer': 'Adam'}. Best is trial 122 with value: 0.09403495675055504.
2026-05-13 13:39:06,361 - optuna.study._optimize - INFO - Trial 132 pruned. 
2026-05-13 13:39:10,731 - optuna.study._optimize - INFO - Trial 133 pruned. 
2026-05-13 13:39:15,211 - optuna.study._optimize - INFO - Trial 134 pruned. 
2026-05-13 13:39:19,913 - optuna.study._optimize - INFO - Trial 135 pruned. 
2026-05-13 13:39:24,353 - optuna.study._optimize - INFO - Trial 136 pruned. 
2026-05-13 13:39:55,480 - optuna.study.study - INFO - Trial 137 finished with value: 0.09689788787507751 and parameters: {'n_layers': 1, 'embedding_dim': 128, 'lr': 0.0002649394823505566, 'lambda_val': 2.922532837875267e-06, 'batch_size': 1270, 'optimizer': 'Adam'}. Best is trial 137 with value: 0.09689788787507751.
2026-05-13 13:39:59,756 - optuna.study._optimize - INFO - Trial 138 pruned. 
2026-05-13 13:40:28,223 - optuna.study.study - INFO - Trial 139 finished with value: 0.07472767577740688 and parameters: {'n_layers': 1, 'embedding_dim': 64, 'lr': 0.0004729521341806042, 'lambda_val': 2.1458384119973537e-06, 'batch_size': 860, 'optimizer': 'Adam'}. Best is trial 137 with value: 0.09689788787507751.
2026-05-13 13:40:32,257 - optuna.study._optimize - INFO - Trial 140 pruned. 
2026-05-13 13:40:37,241 - optuna.study._optimize - INFO - Trial 141 pruned. 
2026-05-13 13:40:41,697 - optuna.study._optimize - INFO - Trial 142 pruned. 
2026-05-13 13:40:46,340 - optuna.study._optimize - INFO - Trial 143 pruned. 
2026-05-13 13:40:50,489 - optuna.study._optimize - INFO - Trial 144 pruned. 
2026-05-13 13:41:27,569 - optuna.study.study - INFO - Trial 145 finished with value: 0.06350380248452728 and parameters: {'n_layers': 1, 'embedding_dim': 256, 'lr': 0.000394575074380495, 'lambda_val': 3.1838937514725956e-05, 'batch_size': 3748, 'optimizer': 'Adam'}. Best is trial 137 with value: 0.09689788787507751.
2026-05-13 13:41:32,182 - optuna.study._optimize - INFO - Trial 146 pruned. 
2026-05-13 13:41:36,711 - optuna.study._optimize - INFO - Trial 147 pruned. 
2026-05-13 13:41:40,659 - optuna.study._optimize - INFO - Trial 148 pruned. 
2026-05-13 13:41:45,262 - optuna.study._optimize - INFO - Trial 149 pruned. 
2026-05-13 13:41:52,265 - optuna.study._optimize - INFO - Trial 150 pruned. 
2026-05-13 13:41:56,679 - optuna.study._optimize - INFO - Trial 151 pruned. 
2026-05-13 13:42:01,737 - optuna.study._optimize - INFO - Trial 152 pruned. 
2026-05-13 13:42:05,731 - optuna.study._optimize - INFO - Trial 153 pruned. 
2026-05-13 13:42:09,847 - optuna.study._optimize - INFO - Trial 154 pruned. 
2026-05-13 13:42:14,422 - optuna.study._optimize - INFO - Trial 155 pruned. 
2026-05-13 13:42:19,310 - optuna.study._optimize - INFO - Trial 156 pruned. 
2026-05-13 13:42:23,837 - optuna.study._optimize - INFO - Trial 157 pruned. 
2026-05-13 13:42:28,981 - optuna.study._optimize - INFO - Trial 158 pruned. 
2026-05-13 13:42:32,919 - optuna.study._optimize - INFO - Trial 159 pruned. 
2026-05-13 13:43:10,007 - optuna.study.study - INFO - Trial 160 finished with value: 0.06817262058486846 and parameters: {'n_layers': 1, 'embedding_dim': 256, 'lr': 0.0005873817998591358, 'lambda_val': 2.3790289122328166e-06, 'batch_size': 3491, 'optimizer': 'Adam'}. Best is trial 137 with value: 0.09689788787507751.
2026-05-13 13:43:47,249 - optuna.study.study - INFO - Trial 161 finished with value: 0.07416955906019561 and parameters: {'n_layers': 1, 'embedding_dim': 256, 'lr': 0.0003329249201923753, 'lambda_val': 5.120500934087343e-06, 'batch_size': 3253, 'optimizer': 'Adam'}. Best is trial 137 with value: 0.09689788787507751.
2026-05-13 13:44:22,711 - optuna.study.study - INFO - Trial 162 finished with value: 0.06668542498535703 and parameters: {'n_layers': 1, 'embedding_dim': 256, 'lr': 0.0004500609523342819, 'lambda_val': 9.77555105141669e-06, 'batch_size': 1877, 'optimizer': 'Adam'}. Best is trial 137 with value: 0.09689788787507751.
2026-05-13 13:44:27,393 - optuna.study._optimize - INFO - Trial 163 pruned. 
2026-05-13 13:44:32,480 - optuna.study._optimize - INFO - Trial 164 pruned. 
2026-05-13 13:44:36,530 - optuna.study._optimize - INFO - Trial 165 pruned. 
2026-05-13 13:44:41,198 - optuna.study._optimize - INFO - Trial 166 pruned. 
2026-05-13 13:45:18,657 - optuna.study.study - INFO - Trial 167 finished with value: 0.08240417309800767 and parameters: {'n_layers': 1, 'embedding_dim': 256, 'lr': 0.0002700338887228953, 'lambda_val': 1.2160889571069202e-05, 'batch_size': 3075, 'optimizer': 'Adam'}. Best is trial 137 with value: 0.09689788787507751.
2026-05-13 13:45:23,335 - optuna.study._optimize - INFO - Trial 168 pruned. 
2026-05-13 13:46:00,983 - optuna.study.study - INFO - Trial 169 finished with value: 0.07773438536631957 and parameters: {'n_layers': 1, 'embedding_dim': 256, 'lr': 0.0002788642218828221, 'lambda_val': 8.51079121769378e-06, 'batch_size': 2701, 'optimizer': 'Adam'}. Best is trial 137 with value: 0.09689788787507751.
2026-05-13 13:46:05,973 - optuna.study._optimize - INFO - Trial 170 pruned. 
2026-05-13 13:46:10,851 - optuna.study._optimize - INFO - Trial 171 pruned. 
2026-05-13 13:46:15,519 - optuna.study._optimize - INFO - Trial 172 pruned. 
2026-05-13 13:46:20,250 - optuna.study._optimize - INFO - Trial 173 pruned. 
2026-05-13 13:46:59,234 - optuna.study.study - INFO - Trial 174 finished with value: 0.07125569106803681 and parameters: {'n_layers': 1, 'embedding_dim': 256, 'lr': 0.0003877699324564065, 'lambda_val': 1.0151335521574647e-06, 'batch_size': 3699, 'optimizer': 'Adam'}. Best is trial 137 with value: 0.09689788787507751.
2026-05-13 13:47:03,879 - optuna.study._optimize - INFO - Trial 175 pruned. 
2026-05-13 13:47:08,484 - optuna.study._optimize - INFO - Trial 176 pruned. 
2026-05-13 13:47:12,494 - optuna.study._optimize - INFO - Trial 177 pruned. 
2026-05-13 13:47:17,251 - optuna.study._optimize - INFO - Trial 178 pruned. 
2026-05-13 13:47:54,468 - optuna.study.study - INFO - Trial 179 finished with value: 0.07010897381457934 and parameters: {'n_layers': 1, 'embedding_dim': 256, 'lr': 0.0004397612267296631, 'lambda_val': 1.5302499179124039e-06, 'batch_size': 2759, 'optimizer': 'Adam'}. Best is trial 137 with value: 0.09689788787507751.
2026-05-13 13:47:59,554 - optuna.study._optimize - INFO - Trial 180 pruned. 
2026-05-13 13:48:04,256 - optuna.study._optimize - INFO - Trial 181 pruned. 
2026-05-13 13:48:09,238 - optuna.study._optimize - INFO - Trial 182 pruned. 
2026-05-13 13:48:46,017 - optuna.study.study - INFO - Trial 183 finished with value: 0.07872475157020949 and parameters: {'n_layers': 1, 'embedding_dim': 256, 'lr': 0.00028191357731598035, 'lambda_val': 7.57119598845413e-06, 'batch_size': 3201, 'optimizer': 'Adam'}. Best is trial 137 with value: 0.09689788787507751.
2026-05-13 13:48:52,288 - optuna.study._optimize - INFO - Trial 184 pruned. 
2026-05-13 13:48:56,746 - optuna.study._optimize - INFO - Trial 185 pruned. 
2026-05-13 13:49:02,144 - optuna.study._optimize - INFO - Trial 186 pruned. 
2026-05-13 13:49:06,569 - optuna.study._optimize - INFO - Trial 187 pruned. 
2026-05-13 13:49:11,094 - optuna.study._optimize - INFO - Trial 188 pruned. 
2026-05-13 13:49:15,431 - optuna.study._optimize - INFO - Trial 189 pruned. 
2026-05-13 13:49:20,574 - optuna.study._optimize - INFO - Trial 190 pruned. 
2026-05-13 13:49:57,380 - optuna.study.study - INFO - Trial 191 finished with value: 0.07498359361622689 and parameters: {'n_layers': 1, 'embedding_dim': 256, 'lr': 0.0003490777116430323, 'lambda_val': 6.719471771399331e-06, 'batch_size': 3112, 'optimizer': 'Adam'}. Best is trial 137 with value: 0.09689788787507751.
2026-05-13 13:50:34,619 - optuna.study.study - INFO - Trial 192 finished with value: 0.06864881917893702 and parameters: {'n_layers': 1, 'embedding_dim': 256, 'lr': 0.00046272173967813724, 'lambda_val': 6.7801048637710025e-06, 'batch_size': 3199, 'optimizer': 'Adam'}. Best is trial 137 with value: 0.09689788787507751.
2026-05-13 13:51:11,710 - optuna.study.study - INFO - Trial 193 finished with value: 0.06950581476471525 and parameters: {'n_layers': 1, 'embedding_dim': 256, 'lr': 0.0003584260560042849, 'lambda_val': 9.849819359563923e-06, 'batch_size': 2933, 'optimizer': 'Adam'}. Best is trial 137 with value: 0.09689788787507751.
2026-05-13 13:51:49,408 - optuna.study.study - INFO - Trial 194 finished with value: 0.08654979765775936 and parameters: {'n_layers': 1, 'embedding_dim': 256, 'lr': 0.0002462577798272098, 'lambda_val': 7.792257089111484e-06, 'batch_size': 3067, 'optimizer': 'Adam'}. Best is trial 137 with value: 0.09689788787507751.
2026-05-13 13:51:54,231 - optuna.study._optimize - INFO - Trial 195 pruned. 
2026-05-13 13:51:59,071 - optuna.study._optimize - INFO - Trial 196 pruned. 
2026-05-13 13:52:03,729 - optuna.study._optimize - INFO - Trial 197 pruned. 
2026-05-13 13:52:44,578 - optuna.study.study - INFO - Trial 198 finished with value: 0.07504221988009617 and parameters: {'n_layers': 1, 'embedding_dim': 256, 'lr': 0.0002795386223538543, 'lambda_val': 8.792341118848796e-06, 'batch_size': 2985, 'optimizer': 'Adam'}. Best is trial 137 with value: 0.09689788787507751.
2026-05-13 13:52:49,134 - optuna.study._optimize - INFO - Trial 199 pruned. 
2026-05-13 13:53:11,705 - root - INFO -   **** Training e_100K_1c2dcs_rand1
2026-05-13 13:53:11,715 - root - INFO -   **** Getting 54402/65410 random edges
2026-05-13 13:53:12,470 - optuna.storages._rdb.storage - INFO - A new study created in RDB with name: Study_e_100K_1c2dcs_rand1
2026-05-13 13:54:03,335 - optuna.study.study - INFO - Trial 0 finished with value: 0.021946737476673576 and parameters: {'n_layers': 3, 'embedding_dim': 64, 'lr': 0.02039000400039473, 'lambda_val': 1.782137262761809e-06, 'batch_size': 1422, 'optimizer': 'Adam'}. Best is trial 0 with value: 0.021946737476673576.
2026-05-13 13:55:04,655 - optuna.study.study - INFO - Trial 1 finished with value: 0.0041152798743333075 and parameters: {'n_layers': 3, 'embedding_dim': 96, 'lr': 0.0005451887837823414, 'lambda_val': 0.08472505055604093, 'batch_size': 1831, 'optimizer': 'Adam'}. Best is trial 0 with value: 0.021946737476673576.
2026-05-13 13:55:55,043 - optuna.study.study - INFO - Trial 2 finished with value: 0.0005820348810910681 and parameters: {'n_layers': 3, 'embedding_dim': 96, 'lr': 1.7124256252421413e-05, 'lambda_val': 0.03048227950830911, 'batch_size': 1005, 'optimizer': 'SGD'}. Best is trial 0 with value: 0.021946737476673576.
2026-05-13 13:56:57,158 - optuna.study.study - INFO - Trial 3 finished with value: 0.01250801970175881 and parameters: {'n_layers': 3, 'embedding_dim': 256, 'lr': 3.549062190678443e-05, 'lambda_val': 0.06882019875436195, 'batch_size': 1943, 'optimizer': 'Adam'}. Best is trial 0 with value: 0.021946737476673576.
2026-05-13 13:57:51,171 - optuna.study.study - INFO - Trial 4 finished with value: 0.0112390876189887 and parameters: {'n_layers': 4, 'embedding_dim': 128, 'lr': 0.00011967439117969754, 'lambda_val': 0.0003392583888807625, 'batch_size': 1163, 'optimizer': 'Adam'}. Best is trial 0 with value: 0.021946737476673576.
2026-05-13 13:57:55,871 - optuna.study._optimize - INFO - Trial 5 pruned. 
2026-05-13 13:57:59,932 - optuna.study._optimize - INFO - Trial 6 pruned. 
2026-05-13 13:58:34,283 - optuna.study.study - INFO - Trial 7 finished with value: 0.009598847251819483 and parameters: {'n_layers': 4, 'embedding_dim': 32, 'lr': 0.0002412204737846217, 'lambda_val': 3.8805857271866574e-06, 'batch_size': 1608, 'optimizer': 'RMSprop'}. Best is trial 0 with value: 0.021946737476673576.
2026-05-13 13:59:05,438 - optuna.study.study - INFO - Trial 8 finished with value: 0.03060116826426294 and parameters: {'n_layers': 2, 'embedding_dim': 64, 'lr': 0.0003289530399253013, 'lambda_val': 0.0002656830132884458, 'batch_size': 1993, 'optimizer': 'Adam'}. Best is trial 8 with value: 0.03060116826426294.
2026-05-13 13:59:57,460 - optuna.study.study - INFO - Trial 9 finished with value: 0.042506027015868544 and parameters: {'n_layers': 3, 'embedding_dim': 256, 'lr': 0.00016235521068890996, 'lambda_val': 0.0011172775791095694, 'batch_size': 567, 'optimizer': 'Adam'}. Best is trial 9 with value: 0.042506027015868544.
2026-05-13 14:00:05,068 - optuna.study._optimize - INFO - Trial 10 pruned. 
2026-05-13 14:00:32,720 - optuna.study.study - INFO - Trial 11 finished with value: 0.04276769853537836 and parameters: {'n_layers': 1, 'embedding_dim': 64, 'lr': 0.005301030821509752, 'lambda_val': 6.742310043826135e-05, 'batch_size': 563, 'optimizer': 'Adam'}. Best is trial 11 with value: 0.04276769853537836.
2026-05-13 14:01:06,634 - optuna.study.study - INFO - Trial 12 finished with value: 0.05760866941348655 and parameters: {'n_layers': 1, 'embedding_dim': 256, 'lr': 0.002788612287813884, 'lambda_val': 2.8566011503994728e-05, 'batch_size': 536, 'optimizer': 'Adam'}. Best is trial 12 with value: 0.05760866941348655.
2026-05-13 14:01:33,891 - optuna.study.study - INFO - Trial 13 finished with value: 0.043359922264003495 and parameters: {'n_layers': 1, 'embedding_dim': 64, 'lr': 0.0029044503083792647, 'lambda_val': 2.569808587720709e-05, 'batch_size': 530, 'optimizer': 'RMSprop'}. Best is trial 12 with value: 0.05760866941348655.
2026-05-13 14:01:38,378 - optuna.study._optimize - INFO - Trial 14 pruned. 
2026-05-13 14:02:07,252 - optuna.study.study - INFO - Trial 15 finished with value: 0.03627183539398607 and parameters: {'n_layers': 1, 'embedding_dim': 64, 'lr': 0.0032452500518240063, 'lambda_val': 1.3707163188087795e-05, 'batch_size': 3969, 'optimizer': 'RMSprop'}. Best is trial 12 with value: 0.05760866941348655.
2026-05-13 14:02:40,474 - optuna.study.study - INFO - Trial 16 finished with value: 0.06102279008909724 and parameters: {'n_layers': 1, 'embedding_dim': 256, 'lr': 0.0016943254542106196, 'lambda_val': 3.23317867470856e-05, 'batch_size': 889, 'optimizer': 'RMSprop'}. Best is trial 16 with value: 0.06102279008909724.
2026-05-13 14:02:45,425 - optuna.study._optimize - INFO - Trial 17 pruned. 
2026-05-13 14:03:20,339 - optuna.study.study - INFO - Trial 18 finished with value: 0.06956585421812003 and parameters: {'n_layers': 1, 'embedding_dim': 256, 'lr': 0.014911592657921073, 'lambda_val': 0.004396152763085712, 'batch_size': 2583, 'optimizer': 'RMSprop'}. Best is trial 18 with value: 0.06956585421812003.
2026-05-13 14:03:24,889 - optuna.study._optimize - INFO - Trial 19 pruned. 
2026-05-13 14:03:30,281 - optuna.study._optimize - INFO - Trial 20 pruned. 
2026-05-13 14:04:05,409 - optuna.study.study - INFO - Trial 21 finished with value: 0.052671477668086726 and parameters: {'n_layers': 1, 'embedding_dim': 256, 'lr': 0.0008727653853890357, 'lambda_val': 7.749679714634479e-05, 'batch_size': 2901, 'optimizer': 'RMSprop'}. Best is trial 18 with value: 0.06956585421812003.
2026-05-13 14:04:09,827 - optuna.study._optimize - INFO - Trial 22 pruned. 
2026-05-13 14:04:43,318 - optuna.study.study - INFO - Trial 23 finished with value: 0.07440043471279896 and parameters: {'n_layers': 1, 'embedding_dim': 256, 'lr': 0.009407624062936859, 'lambda_val': 0.0003745337083075053, 'batch_size': 841, 'optimizer': 'RMSprop'}. Best is trial 23 with value: 0.07440043471279896.
2026-05-13 14:04:48,534 - optuna.study._optimize - INFO - Trial 24 pruned. 
2026-05-13 14:04:52,754 - optuna.study._optimize - INFO - Trial 25 pruned. 
2026-05-13 14:05:20,157 - optuna.study.study - INFO - Trial 26 finished with value: 0.04023955537490682 and parameters: {'n_layers': 1, 'embedding_dim': 32, 'lr': 0.0014157347070204074, 'lambda_val': 0.0008485810174009916, 'batch_size': 952, 'optimizer': 'RMSprop'}. Best is trial 23 with value: 0.07440043471279896.
2026-05-13 14:05:24,448 - optuna.study._optimize - INFO - Trial 27 pruned. 
2026-05-13 14:05:28,519 - optuna.study._optimize - INFO - Trial 28 pruned. 
2026-05-13 14:05:33,652 - optuna.study._optimize - INFO - Trial 29 pruned. 
2026-05-13 14:06:06,772 - optuna.study.study - INFO - Trial 30 finished with value: 0.05457987816010376 and parameters: {'n_layers': 1, 'embedding_dim': 256, 'lr': 0.004781357732390987, 'lambda_val': 0.00014736943079848586, 'batch_size': 1353, 'optimizer': 'RMSprop'}. Best is trial 23 with value: 0.07440043471279896.
2026-05-13 14:06:43,432 - optuna.study.study - INFO - Trial 31 finished with value: 0.0589365054001334 and parameters: {'n_layers': 1, 'embedding_dim': 256, 'lr': 0.00268466192034241, 'lambda_val': 3.909321828595767e-05, 'batch_size': 898, 'optimizer': 'Adam'}. Best is trial 23 with value: 0.07440043471279896.
2026-05-13 14:07:16,840 - optuna.study.study - INFO - Trial 32 finished with value: 0.057764053442902856 and parameters: {'n_layers': 1, 'embedding_dim': 256, 'lr': 0.0019944345030377007, 'lambda_val': 4.5227769975563695e-05, 'batch_size': 1214, 'optimizer': 'RMSprop'}. Best is trial 23 with value: 0.07440043471279896.
