2026-05-14 00:45:32,306 - optuna.study.study - INFO - Trial 14 finished with value: 0.05497755392035678 and parameters: {'n_layers': 1, 'embedding_dim': 64, 'lr': 0.0029859149233206765, 'lambda_val': 0.0006638276332565864, 'batch_size': 1952, 'optimizer': 'Adam'}. Best is trial 6 with value: 0.05689499573987879.
2026-05-14 00:46:14,672 - optuna.study.study - INFO - Trial 15 finished with value: 0.0466492817865153 and parameters: {'n_layers': 2, 'embedding_dim': 256, 'lr': 0.003512511107012351, 'lambda_val': 0.0008971576898131982, 'batch_size': 2087, 'optimizer': 'RMSprop'}. Best is trial 6 with value: 0.05689499573987879.
2026-05-14 00:46:21,042 - optuna.study._optimize - INFO - Trial 16 pruned. 
2026-05-14 00:46:50,914 - optuna.study.study - INFO - Trial 17 finished with value: 0.05543584456056615 and parameters: {'n_layers': 1, 'embedding_dim': 64, 'lr': 0.002916110744952434, 'lambda_val': 0.016195113410519886, 'batch_size': 3225, 'optimizer': 'Adam'}. Best is trial 6 with value: 0.05689499573987879.
2026-05-14 00:46:55,867 - optuna.study._optimize - INFO - Trial 18 pruned. 
2026-05-14 00:47:25,012 - optuna.study.study - INFO - Trial 19 finished with value: 0.06748736679883145 and parameters: {'n_layers': 1, 'embedding_dim': 64, 'lr': 0.029443347026779962, 'lambda_val': 0.006500313900913897, 'batch_size': 3024, 'optimizer': 'RMSprop'}. Best is trial 19 with value: 0.06748736679883145.
2026-05-14 00:47:29,471 - optuna.study._optimize - INFO - Trial 20 pruned. 
2026-05-14 00:47:59,485 - optuna.study.study - INFO - Trial 21 finished with value: 0.06080274564206286 and parameters: {'n_layers': 1, 'embedding_dim': 64, 'lr': 0.02622676622531557, 'lambda_val': 0.012933125355630747, 'batch_size': 3309, 'optimizer': 'RMSprop'}. Best is trial 19 with value: 0.06748736679883145.
2026-05-14 00:48:29,351 - optuna.study.study - INFO - Trial 22 finished with value: 0.06873641912839276 and parameters: {'n_layers': 1, 'embedding_dim': 64, 'lr': 0.02429173466397131, 'lambda_val': 0.010216959698248922, 'batch_size': 3501, 'optimizer': 'RMSprop'}. Best is trial 22 with value: 0.06873641912839276.
2026-05-14 00:48:33,557 - optuna.study._optimize - INFO - Trial 23 pruned. 
2026-05-14 00:49:03,171 - optuna.study.study - INFO - Trial 24 finished with value: 0.08427013782691392 and parameters: {'n_layers': 1, 'embedding_dim': 64, 'lr': 0.03108865940020132, 'lambda_val': 0.001512397132850312, 'batch_size': 3571, 'optimizer': 'RMSprop'}. Best is trial 24 with value: 0.08427013782691392.
2026-05-14 00:49:07,290 - optuna.study._optimize - INFO - Trial 25 pruned. 
2026-05-14 00:49:24,552 - optuna.study._optimize - INFO - Trial 26 pruned. 
2026-05-14 00:49:29,514 - optuna.study._optimize - INFO - Trial 27 pruned. 
2026-05-14 00:49:53,425 - optuna.study.study - INFO - Trial 28 finished with value: 0.07860142908093391 and parameters: {'n_layers': 1, 'embedding_dim': 64, 'lr': 0.00672427406688343, 'lambda_val': 0.004423065744042438, 'batch_size': 2966, 'optimizer': 'RMSprop'}. Best is trial 24 with value: 0.08427013782691392.
2026-05-14 00:50:29,108 - optuna.study.study - INFO - Trial 29 finished with value: 0.07491073777485167 and parameters: {'n_layers': 1, 'embedding_dim': 256, 'lr': 0.006283280089310789, 'lambda_val': 0.0002494608706435715, 'batch_size': 3644, 'optimizer': 'RMSprop'}. Best is trial 24 with value: 0.08427013782691392.
2026-05-14 00:51:05,566 - optuna.study.study - INFO - Trial 30 finished with value: 0.06190585128821665 and parameters: {'n_layers': 1, 'embedding_dim': 256, 'lr': 0.005261602419816414, 'lambda_val': 0.00018816147375103423, 'batch_size': 3688, 'optimizer': 'RMSprop'}. Best is trial 24 with value: 0.08427013782691392.
2026-05-14 00:51:41,338 - optuna.study.study - INFO - Trial 31 finished with value: 0.0731981313878839 and parameters: {'n_layers': 1, 'embedding_dim': 256, 'lr': 0.01502924105873144, 'lambda_val': 0.0002969206685241198, 'batch_size': 3592, 'optimizer': 'RMSprop'}. Best is trial 24 with value: 0.08427013782691392.
2026-05-14 00:51:58,346 - optuna.study._optimize - INFO - Trial 32 pruned. 
2026-05-14 00:52:02,932 - optuna.study._optimize - INFO - Trial 33 pruned. 
2026-05-14 00:52:39,054 - optuna.study.study - INFO - Trial 34 finished with value: 0.055874943001578324 and parameters: {'n_layers': 1, 'embedding_dim': 256, 'lr': 0.005949915232574806, 'lambda_val': 3.588426905365244e-05, 'batch_size': 3817, 'optimizer': 'RMSprop'}. Best is trial 24 with value: 0.08427013782691392.
2026-05-14 00:52:59,605 - optuna.study._optimize - INFO - Trial 35 pruned. 
2026-05-14 00:53:06,421 - optuna.study._optimize - INFO - Trial 36 pruned. 
2026-05-14 00:53:12,319 - optuna.study._optimize - INFO - Trial 37 pruned. 
2026-05-14 00:53:47,734 - optuna.study.study - INFO - Trial 38 finished with value: 0.04542397636230803 and parameters: {'n_layers': 1, 'embedding_dim': 256, 'lr': 0.006079174311044831, 'lambda_val': 1.0704966160448047e-05, 'batch_size': 3901, 'optimizer': 'RMSprop'}. Best is trial 24 with value: 0.08427013782691392.
2026-05-14 00:53:52,029 - optuna.study._optimize - INFO - Trial 39 pruned. 
2026-05-14 00:54:27,879 - optuna.study.study - INFO - Trial 40 finished with value: 0.09022137527197538 and parameters: {'n_layers': 1, 'embedding_dim': 256, 'lr': 0.018447967661176314, 'lambda_val': 0.003066788665509417, 'batch_size': 3472, 'optimizer': 'RMSprop'}. Best is trial 40 with value: 0.09022137527197538.
2026-05-14 00:55:03,577 - optuna.study.study - INFO - Trial 41 finished with value: 0.08326902806485784 and parameters: {'n_layers': 1, 'embedding_dim': 256, 'lr': 0.01623606645229969, 'lambda_val': 0.0038873841136098986, 'batch_size': 3523, 'optimizer': 'RMSprop'}. Best is trial 40 with value: 0.09022137527197538.
2026-05-14 00:55:39,276 - optuna.study.study - INFO - Trial 42 finished with value: 0.07902831755615387 and parameters: {'n_layers': 1, 'embedding_dim': 256, 'lr': 0.008935344904492874, 'lambda_val': 0.0031362065080941157, 'batch_size': 3449, 'optimizer': 'RMSprop'}. Best is trial 40 with value: 0.09022137527197538.
2026-05-14 00:56:14,867 - optuna.study.study - INFO - Trial 43 finished with value: 0.08014709633802418 and parameters: {'n_layers': 1, 'embedding_dim': 256, 'lr': 0.019083665469191286, 'lambda_val': 0.0030198903932580072, 'batch_size': 3388, 'optimizer': 'RMSprop'}. Best is trial 40 with value: 0.09022137527197538.
2026-05-14 00:56:19,947 - optuna.study._optimize - INFO - Trial 44 pruned. 
2026-05-14 00:56:24,221 - optuna.study._optimize - INFO - Trial 45 pruned. 
2026-05-14 00:56:28,728 - optuna.study._optimize - INFO - Trial 46 pruned. 
2026-05-14 00:56:32,826 - optuna.study._optimize - INFO - Trial 47 pruned. 
2026-05-14 00:56:37,343 - optuna.study._optimize - INFO - Trial 48 pruned. 
2026-05-14 00:56:41,849 - optuna.study._optimize - INFO - Trial 49 pruned. 
2026-05-14 00:56:46,631 - optuna.study._optimize - INFO - Trial 50 pruned. 
2026-05-14 00:57:21,900 - optuna.study.study - INFO - Trial 51 finished with value: 0.08448179875661535 and parameters: {'n_layers': 1, 'embedding_dim': 256, 'lr': 0.004185851813837683, 'lambda_val': 0.00346489644738951, 'batch_size': 3120, 'optimizer': 'RMSprop'}. Best is trial 40 with value: 0.09022137527197538.
2026-05-14 00:58:02,219 - optuna.study.study - INFO - Trial 52 finished with value: 0.08553372817588144 and parameters: {'n_layers': 1, 'embedding_dim': 256, 'lr': 0.00481035776308046, 'lambda_val': 0.0025317445828741472, 'batch_size': 3326, 'optimizer': 'RMSprop'}. Best is trial 40 with value: 0.09022137527197538.
2026-05-14 00:58:47,963 - optuna.study.study - INFO - Trial 53 finished with value: 0.08004491463882295 and parameters: {'n_layers': 1, 'embedding_dim': 256, 'lr': 0.004982598951253222, 'lambda_val': 0.0007182857056521099, 'batch_size': 3220, 'optimizer': 'RMSprop'}. Best is trial 40 with value: 0.09022137527197538.
2026-05-14 00:59:35,267 - optuna.study.study - INFO - Trial 54 finished with value: 0.08990869686225536 and parameters: {'n_layers': 1, 'embedding_dim': 256, 'lr': 0.004119355011431097, 'lambda_val': 0.0019768410530501238, 'batch_size': 2857, 'optimizer': 'RMSprop'}. Best is trial 40 with value: 0.09022137527197538.
2026-05-14 01:00:20,371 - optuna.study.study - INFO - Trial 55 finished with value: 0.08062548572890266 and parameters: {'n_layers': 1, 'embedding_dim': 256, 'lr': 0.003821978970958326, 'lambda_val': 0.0005299261937713257, 'batch_size': 2890, 'optimizer': 'RMSprop'}. Best is trial 40 with value: 0.09022137527197538.
2026-05-14 01:00:53,727 - optuna.study.study - INFO - Trial 56 finished with value: 0.053292864874932414 and parameters: {'n_layers': 1, 'embedding_dim': 32, 'lr': 0.0020406686502819267, 'lambda_val': 0.004923140805501523, 'batch_size': 2549, 'optimizer': 'Adam'}. Best is trial 40 with value: 0.09022137527197538.
2026-05-14 01:01:00,792 - optuna.study._optimize - INFO - Trial 57 pruned. 
2026-05-14 01:01:39,776 - optuna.study.study - INFO - Trial 58 finished with value: 0.06881811648005576 and parameters: {'n_layers': 1, 'embedding_dim': 128, 'lr': 0.001518497144955008, 'lambda_val': 0.0009962933653419263, 'batch_size': 3105, 'optimizer': 'RMSprop'}. Best is trial 40 with value: 0.09022137527197538.
2026-05-14 01:01:44,587 - optuna.study._optimize - INFO - Trial 59 pruned. 
2026-05-14 01:01:51,939 - optuna.study._optimize - INFO - Trial 60 pruned. 
2026-05-14 01:02:33,505 - optuna.study.study - INFO - Trial 61 finished with value: 0.07776822561418498 and parameters: {'n_layers': 1, 'embedding_dim': 256, 'lr': 0.002870476598527599, 'lambda_val': 0.0004906071425137893, 'batch_size': 2927, 'optimizer': 'RMSprop'}. Best is trial 40 with value: 0.09022137527197538.
2026-05-14 01:03:22,034 - optuna.study.study - INFO - Trial 62 finished with value: 0.07120622408526775 and parameters: {'n_layers': 1, 'embedding_dim': 256, 'lr': 0.003877480889316318, 'lambda_val': 0.0006710606366158348, 'batch_size': 2825, 'optimizer': 'RMSprop'}. Best is trial 40 with value: 0.09022137527197538.
2026-05-14 01:04:12,190 - optuna.study.study - INFO - Trial 63 finished with value: 0.07315601158226735 and parameters: {'n_layers': 1, 'embedding_dim': 256, 'lr': 0.0011332690033415943, 'lambda_val': 0.0018046887294099136, 'batch_size': 2595, 'optimizer': 'RMSprop'}. Best is trial 40 with value: 0.09022137527197538.
2026-05-14 01:04:57,591 - optuna.study.study - INFO - Trial 64 finished with value: 0.07268238902661033 and parameters: {'n_layers': 1, 'embedding_dim': 256, 'lr': 0.0022496208226529374, 'lambda_val': 0.0049026934225231975, 'batch_size': 3105, 'optimizer': 'RMSprop'}. Best is trial 40 with value: 0.09022137527197538.
2026-05-14 01:05:03,851 - optuna.study._optimize - INFO - Trial 65 pruned. 
2026-05-14 01:05:48,948 - optuna.study.study - INFO - Trial 66 finished with value: 0.06937949705897645 and parameters: {'n_layers': 1, 'embedding_dim': 256, 'lr': 0.000751494810182651, 'lambda_val': 0.0013054993241456215, 'batch_size': 3286, 'optimizer': 'Adam'}. Best is trial 40 with value: 0.09022137527197538.
2026-05-14 01:06:27,627 - optuna.study.study - INFO - Trial 67 finished with value: 0.06720914130896524 and parameters: {'n_layers': 1, 'embedding_dim': 96, 'lr': 0.003852836086346775, 'lambda_val': 0.0070156054165852995, 'batch_size': 1925, 'optimizer': 'RMSprop'}. Best is trial 40 with value: 0.09022137527197538.
2026-05-14 01:06:33,423 - optuna.study._optimize - INFO - Trial 68 pruned. 
2026-05-14 01:06:39,277 - optuna.study._optimize - INFO - Trial 69 pruned. 
2026-05-14 01:06:45,891 - optuna.study._optimize - INFO - Trial 70 pruned. 
2026-05-14 01:07:31,611 - optuna.study.study - INFO - Trial 71 finished with value: 0.08230486024716333 and parameters: {'n_layers': 1, 'embedding_dim': 256, 'lr': 0.017705161155990856, 'lambda_val': 0.0031595383528644637, 'batch_size': 3342, 'optimizer': 'RMSprop'}. Best is trial 40 with value: 0.09022137527197538.
2026-05-14 01:07:37,701 - optuna.study._optimize - INFO - Trial 72 pruned. 
2026-05-14 01:08:26,172 - optuna.study.study - INFO - Trial 73 finished with value: 0.08872740703495714 and parameters: {'n_layers': 1, 'embedding_dim': 256, 'lr': 0.014636277997080182, 'lambda_val': 0.0009258169363786678, 'batch_size': 3331, 'optimizer': 'RMSprop'}. Best is trial 40 with value: 0.09022137527197538.
2026-05-14 01:08:34,172 - optuna.study._optimize - INFO - Trial 74 pruned. 
2026-05-14 01:08:40,100 - optuna.study._optimize - INFO - Trial 75 pruned. 
2026-05-14 01:08:46,281 - optuna.study._optimize - INFO - Trial 76 pruned. 
2026-05-14 01:08:52,440 - optuna.study._optimize - INFO - Trial 77 pruned. 
2026-05-14 01:09:36,727 - optuna.study.study - INFO - Trial 78 finished with value: 0.08574687919480678 and parameters: {'n_layers': 1, 'embedding_dim': 128, 'lr': 0.023404043471540775, 'lambda_val': 0.0016436488981420032, 'batch_size': 3245, 'optimizer': 'RMSprop'}. Best is trial 40 with value: 0.09022137527197538.
2026-05-14 01:09:40,926 - optuna.study._optimize - INFO - Trial 79 pruned. 
2026-05-14 01:09:44,993 - optuna.study._optimize - INFO - Trial 80 pruned. 
2026-05-14 01:09:48,742 - optuna.study._optimize - INFO - Trial 81 pruned. 
2026-05-14 01:09:53,913 - optuna.study._optimize - INFO - Trial 82 pruned. 
2026-05-14 01:10:41,756 - optuna.study.study - INFO - Trial 83 finished with value: 0.08795234195430048 and parameters: {'n_layers': 1, 'embedding_dim': 256, 'lr': 0.021413036690441763, 'lambda_val': 0.0014974197967348747, 'batch_size': 3503, 'optimizer': 'RMSprop'}. Best is trial 40 with value: 0.09022137527197538.
2026-05-14 01:10:46,274 - optuna.study._optimize - INFO - Trial 84 pruned. 
2026-05-14 01:11:26,416 - optuna.study.study - INFO - Trial 85 finished with value: 0.07294134348508499 and parameters: {'n_layers': 1, 'embedding_dim': 64, 'lr': 0.01366498420099132, 'lambda_val': 0.0008268172474432704, 'batch_size': 3616, 'optimizer': 'RMSprop'}. Best is trial 40 with value: 0.09022137527197538.
2026-05-14 01:11:32,626 - optuna.study._optimize - INFO - Trial 86 pruned. 
2026-05-14 01:11:46,305 - optuna.study._optimize - INFO - Trial 87 pruned. 
2026-05-14 01:11:51,987 - optuna.study._optimize - INFO - Trial 88 pruned. 
2026-05-14 01:12:00,048 - optuna.study._optimize - INFO - Trial 89 pruned. 
2026-05-14 01:12:07,620 - optuna.study._optimize - INFO - Trial 90 pruned. 
2026-05-14 01:12:12,242 - optuna.study._optimize - INFO - Trial 91 pruned. 
2026-05-14 01:13:07,157 - optuna.study.study - INFO - Trial 92 finished with value: 0.08227545257422585 and parameters: {'n_layers': 1, 'embedding_dim': 256, 'lr': 0.015740404976073152, 'lambda_val': 0.0030390188205871665, 'batch_size': 3378, 'optimizer': 'RMSprop'}. Best is trial 40 with value: 0.09022137527197538.
2026-05-14 01:13:12,650 - optuna.study._optimize - INFO - Trial 93 pruned. 
2026-05-14 01:14:03,226 - optuna.study.study - INFO - Trial 94 finished with value: 0.07883736251812355 and parameters: {'n_layers': 1, 'embedding_dim': 256, 'lr': 0.01110146951551162, 'lambda_val': 0.00328541322492079, 'batch_size': 3624, 'optimizer': 'RMSprop'}. Best is trial 40 with value: 0.09022137527197538.
2026-05-14 01:14:45,816 - optuna.study.study - INFO - Trial 95 finished with value: 0.08855500528208377 and parameters: {'n_layers': 1, 'embedding_dim': 256, 'lr': 0.01818595250236239, 'lambda_val': 0.0016858692072546219, 'batch_size': 3520, 'optimizer': 'RMSprop'}. Best is trial 40 with value: 0.09022137527197538.
2026-05-14 01:15:25,875 - optuna.study.study - INFO - Trial 96 finished with value: 0.07740297295667277 and parameters: {'n_layers': 1, 'embedding_dim': 64, 'lr': 0.004943109150655954, 'lambda_val': 0.0018737254899170368, 'batch_size': 3537, 'optimizer': 'RMSprop'}. Best is trial 40 with value: 0.09022137527197538.
2026-05-14 01:15:31,749 - optuna.study._optimize - INFO - Trial 97 pruned. 
2026-05-14 01:15:37,657 - optuna.study._optimize - INFO - Trial 98 pruned. 
2026-05-14 01:16:31,744 - optuna.study._optimize - INFO - Trial 99 pruned. 
2026-05-14 01:16:39,435 - optuna.study._optimize - INFO - Trial 100 pruned. 
2026-05-14 01:17:35,298 - optuna.study.study - INFO - Trial 101 finished with value: 0.08881055062659171 and parameters: {'n_layers': 1, 'embedding_dim': 256, 'lr': 0.01578312341479652, 'lambda_val': 0.0024849304751962988, 'batch_size': 3331, 'optimizer': 'RMSprop'}. Best is trial 40 with value: 0.09022137527197538.
2026-05-14 01:18:30,383 - optuna.study.study - INFO - Trial 102 finished with value: 0.08597836170701273 and parameters: {'n_layers': 1, 'embedding_dim': 256, 'lr': 0.012817229732543465, 'lambda_val': 0.0019881209361498793, 'batch_size': 3439, 'optimizer': 'RMSprop'}. Best is trial 40 with value: 0.09022137527197538.
2026-05-14 01:18:37,211 - optuna.study._optimize - INFO - Trial 103 pruned. 
2026-05-14 01:19:33,195 - optuna.study.study - INFO - Trial 104 finished with value: 0.0816017016349699 and parameters: {'n_layers': 1, 'embedding_dim': 256, 'lr': 0.009211182830450698, 'lambda_val': 0.0022543305114400666, 'batch_size': 3261, 'optimizer': 'RMSprop'}. Best is trial 40 with value: 0.09022137527197538.
2026-05-14 01:20:24,012 - optuna.study.study - INFO - Trial 105 finished with value: 0.08458006304523714 and parameters: {'n_layers': 1, 'embedding_dim': 256, 'lr': 0.0033090950266891996, 'lambda_val': 0.0009572584868422728, 'batch_size': 3356, 'optimizer': 'RMSprop'}. Best is trial 40 with value: 0.09022137527197538.
2026-05-14 01:21:17,774 - optuna.study.study - INFO - Trial 106 finished with value: 0.08306457983960565 and parameters: {'n_layers': 1, 'embedding_dim': 256, 'lr': 0.004298199011844495, 'lambda_val': 0.0010198585134094489, 'batch_size': 3348, 'optimizer': 'RMSprop'}. Best is trial 40 with value: 0.09022137527197538.
2026-05-14 01:22:06,607 - optuna.study.study - INFO - Trial 107 finished with value: 0.08367674919815332 and parameters: {'n_layers': 1, 'embedding_dim': 256, 'lr': 0.007083572137501142, 'lambda_val': 0.0018412840259814328, 'batch_size': 3022, 'optimizer': 'RMSprop'}. Best is trial 40 with value: 0.09022137527197538.
2026-05-14 01:22:56,070 - optuna.study.study - INFO - Trial 108 finished with value: 0.08756702851093985 and parameters: {'n_layers': 1, 'embedding_dim': 256, 'lr': 0.0025994749412580217, 'lambda_val': 0.0013070954603238791, 'batch_size': 3237, 'optimizer': 'RMSprop'}. Best is trial 40 with value: 0.09022137527197538.
2026-05-14 01:23:16,417 - optuna.study._optimize - INFO - Trial 109 pruned. 
2026-05-14 01:23:22,702 - optuna.study._optimize - INFO - Trial 110 pruned. 
2026-05-14 01:24:05,507 - optuna.study.study - INFO - Trial 111 finished with value: 0.07604480915285684 and parameters: {'n_layers': 1, 'embedding_dim': 256, 'lr': 0.0013234207998781015, 'lambda_val': 0.0008064459507103671, 'batch_size': 3147, 'optimizer': 'RMSprop'}. Best is trial 40 with value: 0.09022137527197538.
2026-05-14 01:24:53,376 - optuna.study.study - INFO - Trial 112 finished with value: 0.08136694250447772 and parameters: {'n_layers': 1, 'embedding_dim': 256, 'lr': 0.0016770812875967882, 'lambda_val': 0.002584371376838655, 'batch_size': 3323, 'optimizer': 'RMSprop'}. Best is trial 40 with value: 0.09022137527197538.
2026-05-14 01:25:36,306 - optuna.study.study - INFO - Trial 113 finished with value: 0.08388304183262474 and parameters: {'n_layers': 1, 'embedding_dim': 256, 'lr': 0.0024173112060551223, 'lambda_val': 0.0013047901378303978, 'batch_size': 3653, 'optimizer': 'RMSprop'}. Best is trial 40 with value: 0.09022137527197538.
2026-05-14 01:26:26,857 - optuna.study.study - INFO - Trial 114 finished with value: 0.08164978170361555 and parameters: {'n_layers': 1, 'embedding_dim': 256, 'lr': 0.0034942648676125868, 'lambda_val': 0.004826602616125824, 'batch_size': 3392, 'optimizer': 'RMSprop'}. Best is trial 40 with value: 0.09022137527197538.
2026-05-14 01:27:08,116 - optuna.study.study - INFO - Trial 115 finished with value: 0.09024865963054053 and parameters: {'n_layers': 1, 'embedding_dim': 256, 'lr': 0.0059553080155939405, 'lambda_val': 0.0015659102545562528, 'batch_size': 3088, 'optimizer': 'RMSprop'}. Best is trial 115 with value: 0.09024865963054053.
2026-05-14 01:27:28,847 - optuna.study._optimize - INFO - Trial 116 pruned. 
2026-05-14 01:28:21,113 - optuna.study.study - INFO - Trial 117 finished with value: 0.08771179823885751 and parameters: {'n_layers': 1, 'embedding_dim': 256, 'lr': 0.01376554590733917, 'lambda_val': 0.0009131806217655388, 'batch_size': 3250, 'optimizer': 'RMSprop'}. Best is trial 115 with value: 0.09024865963054053.
2026-05-14 01:29:01,909 - optuna.study.study - INFO - Trial 118 finished with value: 0.08935453437173929 and parameters: {'n_layers': 1, 'embedding_dim': 256, 'lr': 0.013484927444970849, 'lambda_val': 0.0017014998841655012, 'batch_size': 3271, 'optimizer': 'RMSprop'}. Best is trial 115 with value: 0.09024865963054053.
2026-05-14 01:29:50,616 - optuna.study.study - INFO - Trial 119 finished with value: 0.08046601816565195 and parameters: {'n_layers': 1, 'embedding_dim': 96, 'lr': 0.013876676165651197, 'lambda_val': 0.0015783360177565632, 'batch_size': 3223, 'optimizer': 'RMSprop'}. Best is trial 115 with value: 0.09024865963054053.
2026-05-14 01:30:01,197 - optuna.study._optimize - INFO - Trial 120 pruned. 
2026-05-14 01:30:46,889 - optuna.study.study - INFO - Trial 121 finished with value: 0.08739611940657645 and parameters: {'n_layers': 1, 'embedding_dim': 256, 'lr': 0.008325071303092194, 'lambda_val': 0.0020111866452286954, 'batch_size': 3288, 'optimizer': 'RMSprop'}. Best is trial 115 with value: 0.09024865963054053.
2026-05-14 01:31:30,065 - optuna.study.study - INFO - Trial 122 finished with value: 0.08499935568592498 and parameters: {'n_layers': 1, 'embedding_dim': 256, 'lr': 0.00847447237936454, 'lambda_val': 0.0021035826414292995, 'batch_size': 3272, 'optimizer': 'RMSprop'}. Best is trial 115 with value: 0.09024865963054053.
2026-05-14 01:31:40,422 - optuna.study._optimize - INFO - Trial 123 pruned. 
