2026-05-13 11:13:36,931 - optuna.study.study - INFO - Trial 61 finished with value: 0.062154623416627974 and parameters: {'n_layers': 1, 'embedding_dim': 128, 'lr': 0.002999073359258534, 'lambda_val': 0.0012161052991599983, 'batch_size': 1470, 'optimizer': 'Adam'}. Best is trial 21 with value: 0.07613841966675915.
2026-05-13 11:14:04,596 - optuna.study.study - INFO - Trial 62 finished with value: 0.056976952043491236 and parameters: {'n_layers': 1, 'embedding_dim': 128, 'lr': 0.0021347094970368464, 'lambda_val': 0.0003931575568165567, 'batch_size': 1552, 'optimizer': 'Adam'}. Best is trial 21 with value: 0.07613841966675915.
2026-05-13 11:14:08,975 - optuna.study._optimize - INFO - Trial 63 pruned. 
2026-05-13 11:14:37,577 - optuna.study.study - INFO - Trial 64 finished with value: 0.06575517106260893 and parameters: {'n_layers': 1, 'embedding_dim': 128, 'lr': 0.0030567631875721385, 'lambda_val': 0.0011575993721499604, 'batch_size': 1669, 'optimizer': 'Adam'}. Best is trial 21 with value: 0.07613841966675915.
2026-05-13 11:14:41,490 - optuna.study._optimize - INFO - Trial 65 pruned. 
2026-05-13 11:15:09,191 - optuna.study.study - INFO - Trial 66 finished with value: 0.07317456704192833 and parameters: {'n_layers': 1, 'embedding_dim': 32, 'lr': 0.000274461318984895, 'lambda_val': 0.00030072563980627654, 'batch_size': 2038, 'optimizer': 'Adam'}. Best is trial 21 with value: 0.07613841966675915.
2026-05-13 11:15:37,082 - optuna.study.study - INFO - Trial 67 finished with value: 0.06096081542539861 and parameters: {'n_layers': 1, 'embedding_dim': 32, 'lr': 0.000274840894282647, 'lambda_val': 6.444986710003639e-05, 'batch_size': 2052, 'optimizer': 'Adam'}. Best is trial 21 with value: 0.07613841966675915.
2026-05-13 11:15:41,710 - optuna.study._optimize - INFO - Trial 68 pruned. 
2026-05-13 11:15:45,866 - optuna.study._optimize - INFO - Trial 69 pruned. 
2026-05-13 11:15:50,358 - optuna.study._optimize - INFO - Trial 70 pruned. 
2026-05-13 11:16:23,894 - optuna.study.study - INFO - Trial 71 finished with value: 0.0636731616984881 and parameters: {'n_layers': 1, 'embedding_dim': 256, 'lr': 0.0017452602364438955, 'lambda_val': 0.00021478956775508425, 'batch_size': 1920, 'optimizer': 'Adam'}. Best is trial 21 with value: 0.07613841966675915.
2026-05-13 11:16:52,683 - optuna.study.study - INFO - Trial 72 finished with value: 0.05435352372434255 and parameters: {'n_layers': 1, 'embedding_dim': 96, 'lr': 0.0010939104772899463, 'lambda_val': 0.0010946596872181149, 'batch_size': 2169, 'optimizer': 'Adam'}. Best is trial 21 with value: 0.07613841966675915.
2026-05-13 11:17:28,073 - optuna.study.study - INFO - Trial 73 finished with value: 0.072523662192616 and parameters: {'n_layers': 1, 'embedding_dim': 256, 'lr': 0.003364457270408202, 'lambda_val': 0.0016521520263515015, 'batch_size': 1650, 'optimizer': 'Adam'}. Best is trial 21 with value: 0.07613841966675915.
2026-05-13 11:17:32,994 - optuna.study._optimize - INFO - Trial 74 pruned. 
2026-05-13 11:17:37,783 - optuna.study._optimize - INFO - Trial 75 pruned. 
2026-05-13 11:17:41,877 - optuna.study._optimize - INFO - Trial 76 pruned. 
2026-05-13 11:17:46,192 - optuna.study._optimize - INFO - Trial 77 pruned. 
2026-05-13 11:17:50,517 - optuna.study._optimize - INFO - Trial 78 pruned. 
2026-05-13 11:18:00,195 - optuna.study._optimize - INFO - Trial 79 pruned. 
2026-05-13 11:18:11,597 - optuna.study._optimize - INFO - Trial 80 pruned. 
2026-05-13 11:18:40,405 - optuna.study.study - INFO - Trial 81 finished with value: 0.056052892267548136 and parameters: {'n_layers': 1, 'embedding_dim': 128, 'lr': 0.002698697486565047, 'lambda_val': 0.0010263646774102974, 'batch_size': 1650, 'optimizer': 'Adam'}. Best is trial 21 with value: 0.07613841966675915.
2026-05-13 11:18:44,480 - optuna.study._optimize - INFO - Trial 82 pruned. 
2026-05-13 11:19:12,443 - optuna.study.study - INFO - Trial 83 finished with value: 0.0527461053885118 and parameters: {'n_layers': 1, 'embedding_dim': 64, 'lr': 0.002203698241816125, 'lambda_val': 0.0015240426099730618, 'batch_size': 1763, 'optimizer': 'Adam'}. Best is trial 21 with value: 0.07613841966675915.
2026-05-13 11:19:46,922 - optuna.study.study - INFO - Trial 84 finished with value: 0.06977248026633794 and parameters: {'n_layers': 1, 'embedding_dim': 256, 'lr': 0.0011665952673702545, 'lambda_val': 0.0009125206752110711, 'batch_size': 3331, 'optimizer': 'Adam'}. Best is trial 21 with value: 0.07613841966675915.
2026-05-13 11:20:21,303 - optuna.study.study - INFO - Trial 85 finished with value: 0.06419109358536072 and parameters: {'n_layers': 1, 'embedding_dim': 256, 'lr': 0.0012188207197734743, 'lambda_val': 0.0004517366496662456, 'batch_size': 3327, 'optimizer': 'Adam'}. Best is trial 21 with value: 0.07613841966675915.
2026-05-13 11:21:01,058 - optuna.study.study - INFO - Trial 86 finished with value: 0.07053200505683478 and parameters: {'n_layers': 1, 'embedding_dim': 256, 'lr': 0.0016023969275649826, 'lambda_val': 0.0024934964881231374, 'batch_size': 3207, 'optimizer': 'Adam'}. Best is trial 21 with value: 0.07613841966675915.
2026-05-13 11:21:06,333 - optuna.study._optimize - INFO - Trial 87 pruned. 
2026-05-13 11:21:41,662 - optuna.study.study - INFO - Trial 88 finished with value: 0.06195593824672343 and parameters: {'n_layers': 1, 'embedding_dim': 256, 'lr': 0.0015090408248289546, 'lambda_val': 0.007962913414617826, 'batch_size': 2869, 'optimizer': 'Adam'}. Best is trial 21 with value: 0.07613841966675915.
2026-05-13 11:22:17,543 - optuna.study.study - INFO - Trial 89 finished with value: 0.07213039867044989 and parameters: {'n_layers': 1, 'embedding_dim': 256, 'lr': 0.0007869118506626238, 'lambda_val': 0.0030954531805416807, 'batch_size': 3564, 'optimizer': 'Adam'}. Best is trial 21 with value: 0.07613841966675915.
2026-05-13 11:22:21,846 - optuna.study._optimize - INFO - Trial 90 pruned. 
2026-05-13 11:22:58,818 - optuna.study.study - INFO - Trial 91 finished with value: 0.06715543664670648 and parameters: {'n_layers': 1, 'embedding_dim': 256, 'lr': 0.0007437636828737857, 'lambda_val': 0.0022171458352551045, 'batch_size': 3200, 'optimizer': 'Adam'}. Best is trial 21 with value: 0.07613841966675915.
2026-05-13 11:23:34,993 - optuna.study.study - INFO - Trial 92 finished with value: 0.07152480286396805 and parameters: {'n_layers': 1, 'embedding_dim': 256, 'lr': 0.0003523590388132805, 'lambda_val': 0.0009365543115913181, 'batch_size': 3903, 'optimizer': 'Adam'}. Best is trial 21 with value: 0.07613841966675915.
2026-05-13 11:24:10,910 - optuna.study.study - INFO - Trial 93 finished with value: 0.059380066649164315 and parameters: {'n_layers': 1, 'embedding_dim': 256, 'lr': 0.0004075742533030033, 'lambda_val': 0.005693459339931053, 'batch_size': 3851, 'optimizer': 'Adam'}. Best is trial 21 with value: 0.07613841966675915.
2026-05-13 11:24:47,387 - optuna.study.study - INFO - Trial 94 finished with value: 0.0657902527519088 and parameters: {'n_layers': 1, 'embedding_dim': 256, 'lr': 0.00026664390947073966, 'lambda_val': 0.0008047979219037936, 'batch_size': 3940, 'optimizer': 'Adam'}. Best is trial 21 with value: 0.07613841966675915.
2026-05-13 11:25:23,444 - optuna.study.study - INFO - Trial 95 finished with value: 0.06670090976346339 and parameters: {'n_layers': 1, 'embedding_dim': 256, 'lr': 0.0006103824932966092, 'lambda_val': 0.0027025334371279515, 'batch_size': 3657, 'optimizer': 'Adam'}. Best is trial 21 with value: 0.07613841966675915.
2026-05-13 11:25:53,906 - optuna.study.study - INFO - Trial 96 finished with value: 0.0679272886118235 and parameters: {'n_layers': 1, 'embedding_dim': 96, 'lr': 0.00019030082611768722, 'lambda_val': 0.001498671799059496, 'batch_size': 3429, 'optimizer': 'Adam'}. Best is trial 21 with value: 0.07613841966675915.
2026-05-13 11:26:29,968 - optuna.study.study - INFO - Trial 97 finished with value: 0.06607191961021243 and parameters: {'n_layers': 1, 'embedding_dim': 256, 'lr': 0.00031718322551636417, 'lambda_val': 0.0010042705858682689, 'batch_size': 3311, 'optimizer': 'Adam'}. Best is trial 21 with value: 0.07613841966675915.
2026-05-13 11:26:34,015 - optuna.study._optimize - INFO - Trial 98 pruned. 
2026-05-13 11:27:10,365 - optuna.study.study - INFO - Trial 99 finished with value: 0.05963506937505428 and parameters: {'n_layers': 1, 'embedding_dim': 256, 'lr': 0.0004686447513965244, 'lambda_val': 0.0008801352451417154, 'batch_size': 3617, 'optimizer': 'Adam'}. Best is trial 21 with value: 0.07613841966675915.
2026-05-13 11:27:47,098 - optuna.study.study - INFO - Trial 100 finished with value: 0.05420706597773903 and parameters: {'n_layers': 1, 'embedding_dim': 256, 'lr': 0.00021891312138686453, 'lambda_val': 0.0042603385306742335, 'batch_size': 3774, 'optimizer': 'Adam'}. Best is trial 21 with value: 0.07613841966675915.
2026-05-13 11:28:23,609 - optuna.study.study - INFO - Trial 101 finished with value: 0.05767904565426399 and parameters: {'n_layers': 1, 'embedding_dim': 256, 'lr': 0.0018220818834862793, 'lambda_val': 0.00022392917907597547, 'batch_size': 4090, 'optimizer': 'Adam'}. Best is trial 21 with value: 0.07613841966675915.
2026-05-13 11:28:59,177 - optuna.study.study - INFO - Trial 102 finished with value: 0.06633543633302147 and parameters: {'n_layers': 1, 'embedding_dim': 256, 'lr': 0.0011964194502799075, 'lambda_val': 0.0006278770721197572, 'batch_size': 3406, 'optimizer': 'Adam'}. Best is trial 21 with value: 0.07613841966675915.
2026-05-13 11:29:03,882 - optuna.study._optimize - INFO - Trial 103 pruned. 
2026-05-13 11:29:40,647 - optuna.study.study - INFO - Trial 104 finished with value: 0.06667540674025109 and parameters: {'n_layers': 1, 'embedding_dim': 256, 'lr': 0.0008936885329688884, 'lambda_val': 0.0013723124285519555, 'batch_size': 3081, 'optimizer': 'Adam'}. Best is trial 21 with value: 0.07613841966675915.
2026-05-13 11:29:44,732 - optuna.study._optimize - INFO - Trial 105 pruned. 
2026-05-13 11:30:21,109 - optuna.study.study - INFO - Trial 106 finished with value: 0.0602660119477418 and parameters: {'n_layers': 1, 'embedding_dim': 256, 'lr': 0.002438301588957606, 'lambda_val': 0.0002856581183689749, 'batch_size': 3262, 'optimizer': 'Adam'}. Best is trial 21 with value: 0.07613841966675915.
2026-05-13 11:31:09,554 - optuna.study.study - INFO - Trial 107 finished with value: 0.061624991582672595 and parameters: {'n_layers': 1, 'embedding_dim': 256, 'lr': 0.0015448463691130764, 'lambda_val': 0.00044384112075713427, 'batch_size': 2867, 'optimizer': 'Adam'}. Best is trial 21 with value: 0.07613841966675915.
2026-05-13 11:31:39,104 - optuna.study.study - INFO - Trial 108 finished with value: 0.04015088329255843 and parameters: {'n_layers': 1, 'embedding_dim': 32, 'lr': 0.00031381281579336766, 'lambda_val': 0.0030412570257525896, 'batch_size': 3472, 'optimizer': 'Adam'}. Best is trial 21 with value: 0.07613841966675915.
2026-05-13 11:31:43,444 - optuna.study._optimize - INFO - Trial 109 pruned. 
2026-05-13 11:32:19,104 - optuna.study.study - INFO - Trial 110 finished with value: 0.05856617665129358 and parameters: {'n_layers': 1, 'embedding_dim': 256, 'lr': 0.00040452704834468634, 'lambda_val': 0.007138231976925968, 'batch_size': 2641, 'optimizer': 'Adam'}. Best is trial 21 with value: 0.07613841966675915.
2026-05-13 11:32:53,777 - optuna.study.study - INFO - Trial 111 finished with value: 0.06786694712369404 and parameters: {'n_layers': 1, 'embedding_dim': 256, 'lr': 0.002059810510492827, 'lambda_val': 0.0005720591712921843, 'batch_size': 2128, 'optimizer': 'Adam'}. Best is trial 21 with value: 0.07613841966675915.
2026-05-13 11:33:27,574 - optuna.study.study - INFO - Trial 112 finished with value: 0.07487566617721081 and parameters: {'n_layers': 1, 'embedding_dim': 256, 'lr': 0.003243102761277551, 'lambda_val': 0.0018499975085315733, 'batch_size': 1532, 'optimizer': 'Adam'}. Best is trial 21 with value: 0.07613841966675915.
2026-05-13 11:34:01,715 - optuna.study.study - INFO - Trial 113 finished with value: 0.07497213867748335 and parameters: {'n_layers': 1, 'embedding_dim': 256, 'lr': 0.002567641132363148, 'lambda_val': 0.002348531196113759, 'batch_size': 1567, 'optimizer': 'Adam'}. Best is trial 21 with value: 0.07613841966675915.
2026-05-13 11:34:35,617 - optuna.study.study - INFO - Trial 114 finished with value: 0.07719992482149954 and parameters: {'n_layers': 1, 'embedding_dim': 256, 'lr': 0.0032591372430725235, 'lambda_val': 0.0024162508906757623, 'batch_size': 1431, 'optimizer': 'Adam'}. Best is trial 114 with value: 0.07719992482149954.
2026-05-13 11:34:40,133 - optuna.study._optimize - INFO - Trial 115 pruned. 
2026-05-13 11:34:44,607 - optuna.study._optimize - INFO - Trial 116 pruned. 
2026-05-13 11:34:49,522 - optuna.study._optimize - INFO - Trial 117 pruned. 
2026-05-13 11:34:55,701 - optuna.study._optimize - INFO - Trial 118 pruned. 
2026-05-13 11:34:59,963 - optuna.study._optimize - INFO - Trial 119 pruned. 
2026-05-13 11:35:04,364 - optuna.study._optimize - INFO - Trial 120 pruned. 
2026-05-13 11:35:38,613 - optuna.study.study - INFO - Trial 121 finished with value: 0.07300626829053757 and parameters: {'n_layers': 1, 'embedding_dim': 256, 'lr': 0.002404555933672508, 'lambda_val': 0.0012037357071592529, 'batch_size': 1732, 'optimizer': 'Adam'}. Best is trial 114 with value: 0.07719992482149954.
2026-05-13 11:36:12,992 - optuna.study.study - INFO - Trial 122 finished with value: 0.07129127531454628 and parameters: {'n_layers': 1, 'embedding_dim': 256, 'lr': 0.0024540014272755326, 'lambda_val': 0.0011336510995127783, 'batch_size': 1565, 'optimizer': 'Adam'}. Best is trial 114 with value: 0.07719992482149954.
2026-05-13 11:36:47,638 - optuna.study.study - INFO - Trial 123 finished with value: 0.07032222450602907 and parameters: {'n_layers': 1, 'embedding_dim': 256, 'lr': 0.001978190545903698, 'lambda_val': 0.001269391277121847, 'batch_size': 1130, 'optimizer': 'Adam'}. Best is trial 114 with value: 0.07719992482149954.
2026-05-13 11:37:21,637 - optuna.study.study - INFO - Trial 124 finished with value: 0.07764799378817347 and parameters: {'n_layers': 1, 'embedding_dim': 256, 'lr': 0.0026798693460615567, 'lambda_val': 0.0021262562163706683, 'batch_size': 1560, 'optimizer': 'Adam'}. Best is trial 124 with value: 0.07764799378817347.
2026-05-13 11:37:55,954 - optuna.study.study - INFO - Trial 125 finished with value: 0.07656514267776902 and parameters: {'n_layers': 1, 'embedding_dim': 256, 'lr': 0.0025879689641038076, 'lambda_val': 0.001987976567115116, 'batch_size': 1371, 'optimizer': 'Adam'}. Best is trial 124 with value: 0.07764799378817347.
2026-05-13 11:38:00,325 - optuna.study._optimize - INFO - Trial 126 pruned. 
2026-05-13 11:38:04,644 - optuna.study._optimize - INFO - Trial 127 pruned. 
2026-05-13 11:38:39,166 - optuna.study.study - INFO - Trial 128 finished with value: 0.07340425013526665 and parameters: {'n_layers': 1, 'embedding_dim': 256, 'lr': 0.00277223029753277, 'lambda_val': 0.0022653010241949914, 'batch_size': 1690, 'optimizer': 'Adam'}. Best is trial 124 with value: 0.07764799378817347.
2026-05-13 11:39:13,559 - optuna.study.study - INFO - Trial 129 finished with value: 0.0741454146071043 and parameters: {'n_layers': 1, 'embedding_dim': 256, 'lr': 0.0027296932303023983, 'lambda_val': 0.002276576060478019, 'batch_size': 1682, 'optimizer': 'Adam'}. Best is trial 124 with value: 0.07764799378817347.
2026-05-13 11:39:17,931 - optuna.study._optimize - INFO - Trial 130 pruned. 
2026-05-13 11:39:52,668 - optuna.study.study - INFO - Trial 131 finished with value: 0.0780784088925377 and parameters: {'n_layers': 1, 'embedding_dim': 256, 'lr': 0.0028694446859314146, 'lambda_val': 0.002465434381377355, 'batch_size': 1828, 'optimizer': 'Adam'}. Best is trial 131 with value: 0.0780784088925377.
2026-05-13 11:39:57,084 - optuna.study._optimize - INFO - Trial 132 pruned. 
2026-05-13 11:40:31,658 - optuna.study.study - INFO - Trial 133 finished with value: 0.0723549949158588 and parameters: {'n_layers': 1, 'embedding_dim': 256, 'lr': 0.0022916575581029583, 'lambda_val': 0.004231135832950762, 'batch_size': 1754, 'optimizer': 'Adam'}. Best is trial 131 with value: 0.0780784088925377.
2026-05-13 11:41:06,005 - optuna.study.study - INFO - Trial 134 finished with value: 0.06868750614908314 and parameters: {'n_layers': 1, 'embedding_dim': 256, 'lr': 0.002409891150410932, 'lambda_val': 0.004150656672510679, 'batch_size': 1973, 'optimizer': 'Adam'}. Best is trial 131 with value: 0.0780784088925377.
2026-05-13 11:41:10,898 - optuna.study._optimize - INFO - Trial 135 pruned. 
2026-05-13 11:41:45,314 - optuna.study.study - INFO - Trial 136 finished with value: 0.07104061566646935 and parameters: {'n_layers': 1, 'embedding_dim': 256, 'lr': 0.0017978723886952477, 'lambda_val': 0.0016288988466581957, 'batch_size': 1657, 'optimizer': 'Adam'}. Best is trial 131 with value: 0.0780784088925377.
2026-05-13 11:42:14,113 - optuna.study.study - INFO - Trial 137 finished with value: 0.06124918159478539 and parameters: {'n_layers': 1, 'embedding_dim': 64, 'lr': 0.003164797920050816, 'lambda_val': 0.0023594331336846057, 'batch_size': 1580, 'optimizer': 'Adam'}. Best is trial 131 with value: 0.0780784088925377.
2026-05-13 11:42:18,453 - optuna.study._optimize - INFO - Trial 138 pruned. 
2026-05-13 11:42:23,800 - optuna.study._optimize - INFO - Trial 139 pruned. 
2026-05-13 11:43:05,357 - optuna.study.study - INFO - Trial 140 finished with value: 0.0692846856371146 and parameters: {'n_layers': 1, 'embedding_dim': 256, 'lr': 0.0031404731237249565, 'lambda_val': 0.0033939125462808858, 'batch_size': 1718, 'optimizer': 'Adam'}. Best is trial 131 with value: 0.0780784088925377.
2026-05-13 11:43:39,482 - optuna.study.study - INFO - Trial 141 finished with value: 0.06690430683313875 and parameters: {'n_layers': 1, 'embedding_dim': 256, 'lr': 0.0014060432816614358, 'lambda_val': 0.003067117276361739, 'batch_size': 1771, 'optimizer': 'Adam'}. Best is trial 131 with value: 0.0780784088925377.
2026-05-13 11:44:14,351 - optuna.study.study - INFO - Trial 142 finished with value: 0.07668274463104638 and parameters: {'n_layers': 1, 'embedding_dim': 256, 'lr': 0.004547209584693708, 'lambda_val': 0.0019960543625126043, 'batch_size': 1832, 'optimizer': 'Adam'}. Best is trial 131 with value: 0.0780784088925377.
2026-05-13 11:44:18,834 - optuna.study._optimize - INFO - Trial 143 pruned. 
2026-05-13 11:44:53,089 - optuna.study.study - INFO - Trial 144 finished with value: 0.0748947984060392 and parameters: {'n_layers': 1, 'embedding_dim': 256, 'lr': 0.004029548934969006, 'lambda_val': 0.0015106631489075343, 'batch_size': 1653, 'optimizer': 'Adam'}. Best is trial 131 with value: 0.0780784088925377.
2026-05-13 11:44:57,915 - optuna.study._optimize - INFO - Trial 145 pruned. 
2026-05-13 11:45:02,577 - optuna.study._optimize - INFO - Trial 146 pruned. 
2026-05-13 11:45:36,775 - optuna.study.study - INFO - Trial 147 finished with value: 0.07068718406456997 and parameters: {'n_layers': 1, 'embedding_dim': 256, 'lr': 0.0028136025831177946, 'lambda_val': 0.0011282653700808898, 'batch_size': 1479, 'optimizer': 'Adam'}. Best is trial 131 with value: 0.0780784088925377.
2026-05-13 11:45:40,983 - optuna.study._optimize - INFO - Trial 148 pruned. 
2026-05-13 11:45:45,467 - optuna.study._optimize - INFO - Trial 149 pruned. 
2026-05-13 11:45:49,863 - optuna.study._optimize - INFO - Trial 150 pruned. 
2026-05-13 11:46:24,400 - optuna.study.study - INFO - Trial 151 finished with value: 0.07471052941789734 and parameters: {'n_layers': 1, 'embedding_dim': 256, 'lr': 0.002226785514584355, 'lambda_val': 0.004277300654356277, 'batch_size': 1832, 'optimizer': 'Adam'}. Best is trial 131 with value: 0.0780784088925377.
2026-05-13 11:46:59,040 - optuna.study.study - INFO - Trial 152 finished with value: 0.08017591355480087 and parameters: {'n_layers': 1, 'embedding_dim': 256, 'lr': 0.002634637546460215, 'lambda_val': 0.0018380495842974227, 'batch_size': 1904, 'optimizer': 'Adam'}. Best is trial 152 with value: 0.08017591355480087.
2026-05-13 11:47:03,919 - optuna.study._optimize - INFO - Trial 153 pruned. 
2026-05-13 11:47:38,030 - optuna.study.study - INFO - Trial 154 finished with value: 0.0750285976556501 and parameters: {'n_layers': 1, 'embedding_dim': 256, 'lr': 0.0019500356357841661, 'lambda_val': 0.0020649307742572976, 'batch_size': 1942, 'optimizer': 'Adam'}. Best is trial 152 with value: 0.08017591355480087.
2026-05-13 11:48:12,473 - optuna.study.study - INFO - Trial 155 finished with value: 0.07304555061852293 and parameters: {'n_layers': 1, 'embedding_dim': 256, 'lr': 0.001824271970616885, 'lambda_val': 0.003738405805840788, 'batch_size': 1951, 'optimizer': 'Adam'}. Best is trial 152 with value: 0.08017591355480087.
2026-05-13 11:48:47,351 - optuna.study.study - INFO - Trial 156 finished with value: 0.06471959947119696 and parameters: {'n_layers': 1, 'embedding_dim': 256, 'lr': 0.0013736850261193343, 'lambda_val': 0.00199709625252616, 'batch_size': 2095, 'optimizer': 'Adam'}. Best is trial 152 with value: 0.08017591355480087.
2026-05-13 11:48:51,807 - optuna.study._optimize - INFO - Trial 157 pruned. 
2026-05-13 11:49:20,161 - optuna.study.study - INFO - Trial 158 finished with value: 0.043927149057530826 and parameters: {'n_layers': 1, 'embedding_dim': 32, 'lr': 0.0020774458687120023, 'lambda_val': 0.004765739591360754, 'batch_size': 1908, 'optimizer': 'Adam'}. Best is trial 152 with value: 0.08017591355480087.
2026-05-13 11:49:54,553 - optuna.study.study - INFO - Trial 159 finished with value: 0.07617025024858956 and parameters: {'n_layers': 1, 'embedding_dim': 256, 'lr': 0.0030939217089058506, 'lambda_val': 0.0028129749884451155, 'batch_size': 2045, 'optimizer': 'Adam'}. Best is trial 152 with value: 0.08017591355480087.
2026-05-13 11:49:59,508 - optuna.study._optimize - INFO - Trial 160 pruned. 
