2026-05-13 12:54:34,653 - optuna.study.study - INFO - Trial 177 finished with value: 0.02084632315307422 and parameters: {'n_layers': 1, 'embedding_dim': 64, 'lr': 0.0001281377060389107, 'lambda_val': 1.1958805138127688e-06, 'batch_size': 768, 'optimizer': 'Adam'}. Best is trial 107 with value: 0.03265563060012234.
2026-05-13 12:55:02,055 - optuna.study.study - INFO - Trial 178 finished with value: 0.026687726039237705 and parameters: {'n_layers': 1, 'embedding_dim': 32, 'lr': 0.00011745915045023368, 'lambda_val': 2.746626914290459e-06, 'batch_size': 786, 'optimizer': 'Adam'}. Best is trial 107 with value: 0.03265563060012234.
2026-05-13 12:55:06,337 - optuna.study._optimize - INFO - Trial 179 pruned. 
2026-05-13 12:55:10,587 - optuna.study._optimize - INFO - Trial 180 pruned. 
2026-05-13 12:55:14,492 - optuna.study._optimize - INFO - Trial 181 pruned. 
2026-05-13 12:55:43,676 - optuna.study.study - INFO - Trial 182 finished with value: 0.02438002971879604 and parameters: {'n_layers': 1, 'embedding_dim': 32, 'lr': 0.00012035379783440704, 'lambda_val': 3.003200459082641e-06, 'batch_size': 749, 'optimizer': 'Adam'}. Best is trial 107 with value: 0.03265563060012234.
2026-05-13 12:55:48,024 - optuna.study._optimize - INFO - Trial 183 pruned. 
2026-05-13 12:56:16,414 - optuna.study.study - INFO - Trial 184 finished with value: 0.026976645337782008 and parameters: {'n_layers': 1, 'embedding_dim': 32, 'lr': 0.00011742276600741497, 'lambda_val': 1.6610003483660638e-06, 'batch_size': 824, 'optimizer': 'Adam'}. Best is trial 107 with value: 0.03265563060012234.
2026-05-13 12:56:20,420 - optuna.study._optimize - INFO - Trial 185 pruned. 
2026-05-13 12:56:50,587 - optuna.study.study - INFO - Trial 186 finished with value: 0.025342560721701646 and parameters: {'n_layers': 1, 'embedding_dim': 32, 'lr': 0.00012288470763072897, 'lambda_val': 1.029632807755583e-06, 'batch_size': 900, 'optimizer': 'Adam'}. Best is trial 107 with value: 0.03265563060012234.
2026-05-13 12:57:12,203 - optuna.study._optimize - INFO - Trial 187 pruned. 
2026-05-13 12:57:15,989 - optuna.study._optimize - INFO - Trial 188 pruned. 
2026-05-13 12:57:19,842 - optuna.study._optimize - INFO - Trial 189 pruned. 
2026-05-13 12:57:47,311 - optuna.study.study - INFO - Trial 190 finished with value: 0.006032317393204924 and parameters: {'n_layers': 1, 'embedding_dim': 32, 'lr': 0.00025826128741189276, 'lambda_val': 1.7412334529745262e-06, 'batch_size': 854, 'optimizer': 'Adam'}. Best is trial 107 with value: 0.03265563060012234.
2026-05-13 12:57:50,832 - optuna.study._optimize - INFO - Trial 191 pruned. 
2026-05-13 12:57:56,388 - optuna.study._optimize - INFO - Trial 192 pruned. 
2026-05-13 12:57:59,843 - optuna.study._optimize - INFO - Trial 193 pruned. 
2026-05-13 12:58:04,030 - optuna.study._optimize - INFO - Trial 194 pruned. 
2026-05-13 12:58:08,627 - optuna.study._optimize - INFO - Trial 195 pruned. 
2026-05-13 12:58:12,626 - optuna.study._optimize - INFO - Trial 196 pruned. 
2026-05-13 12:58:40,070 - optuna.study.study - INFO - Trial 197 finished with value: 0.025798796309486047 and parameters: {'n_layers': 1, 'embedding_dim': 32, 'lr': 0.00016403300691216375, 'lambda_val': 1.8662101792680167e-06, 'batch_size': 602, 'optimizer': 'Adam'}. Best is trial 107 with value: 0.03265563060012234.
2026-05-13 12:59:08,924 - optuna.study.study - INFO - Trial 198 finished with value: 0.024240916233810104 and parameters: {'n_layers': 1, 'embedding_dim': 32, 'lr': 0.00017094748362600037, 'lambda_val': 1.8789412676199688e-06, 'batch_size': 573, 'optimizer': 'Adam'}. Best is trial 107 with value: 0.03265563060012234.
2026-05-13 12:59:39,015 - optuna.study.study - INFO - Trial 199 finished with value: 0.02419327551148511 and parameters: {'n_layers': 1, 'embedding_dim': 32, 'lr': 0.00017132488345117754, 'lambda_val': 1.8607900698644864e-06, 'batch_size': 565, 'optimizer': 'Adam'}. Best is trial 107 with value: 0.03265563060012234.
2026-05-13 12:59:58,891 - root - INFO -   ** Getting the trainable edges:
2026-05-13 12:59:58,896 - helper_functions - INFO -      Number of nodes: 3657
2026-05-13 12:59:58,896 - helper_functions - INFO -      Ratio: 0.4035978368833462
2026-05-13 12:59:58,896 - helper_functions - INFO -      Number of unique users: 325
2026-05-13 12:59:58,896 - helper_functions - INFO -      Number of unique items: 3332
2026-05-13 12:59:58,896 - helper_functions - INFO -      Total dominant set edge: 67989
2026-05-13 12:59:58,896 - helper_functions - INFO -      Trainable edges: 54391.200000000004
2026-05-13 12:59:58,904 - root - INFO -   **** Getting 67989 dominant set edges
2026-05-13 12:59:59,481 - optuna.storages._rdb.storage - INFO - A new study created in RDB with name: Study_e_100K_1c2dcs
2026-05-13 13:00:49,881 - optuna.study.study - INFO - Trial 0 finished with value: 0.011227813354280998 and parameters: {'n_layers': 4, 'embedding_dim': 32, 'lr': 0.006135026406319004, 'lambda_val': 1.2094676433307128e-05, 'batch_size': 779, 'optimizer': 'RMSprop'}. Best is trial 0 with value: 0.011227813354280998.
2026-05-13 13:01:29,413 - optuna.study.study - INFO - Trial 1 finished with value: 0.08987168849690128 and parameters: {'n_layers': 1, 'embedding_dim': 128, 'lr': 6.80386585396078e-05, 'lambda_val': 6.740682513686066e-05, 'batch_size': 677, 'optimizer': 'Adam'}. Best is trial 1 with value: 0.08987168849690128.
2026-05-13 13:02:01,932 - optuna.study.study - INFO - Trial 2 finished with value: 0.0025596369814666086 and parameters: {'n_layers': 2, 'embedding_dim': 96, 'lr': 4.5816732609244174e-05, 'lambda_val': 0.039177558688213474, 'batch_size': 2001, 'optimizer': 'SGD'}. Best is trial 1 with value: 0.08987168849690128.
2026-05-13 13:02:30,092 - optuna.study.study - INFO - Trial 3 finished with value: 0.003020131749668992 and parameters: {'n_layers': 1, 'embedding_dim': 64, 'lr': 0.0003791386796475666, 'lambda_val': 0.00018619421570844632, 'batch_size': 3377, 'optimizer': 'SGD'}. Best is trial 1 with value: 0.08987168849690128.
2026-05-13 13:03:06,168 - optuna.study.study - INFO - Trial 4 finished with value: 0.014779357501221438 and parameters: {'n_layers': 4, 'embedding_dim': 32, 'lr': 0.021996312448289198, 'lambda_val': 0.0002707352063878732, 'batch_size': 1698, 'optimizer': 'RMSprop'}. Best is trial 1 with value: 0.08987168849690128.
2026-05-13 13:03:37,517 - optuna.study.study - INFO - Trial 5 finished with value: 0.06265268011079718 and parameters: {'n_layers': 1, 'embedding_dim': 64, 'lr': 5.369560613194237e-05, 'lambda_val': 3.431722227683645e-05, 'batch_size': 4063, 'optimizer': 'Adam'}. Best is trial 1 with value: 0.08987168849690128.
2026-05-13 13:03:42,071 - optuna.study._optimize - INFO - Trial 6 pruned. 
2026-05-13 13:04:12,922 - optuna.study.study - INFO - Trial 7 finished with value: 0.05718316682362166 and parameters: {'n_layers': 1, 'embedding_dim': 32, 'lr': 0.011451896278741524, 'lambda_val': 0.0049279004420771004, 'batch_size': 3400, 'optimizer': 'Adam'}. Best is trial 1 with value: 0.08987168849690128.
2026-05-13 13:04:47,874 - optuna.study.study - INFO - Trial 8 finished with value: 0.013280560461066716 and parameters: {'n_layers': 3, 'embedding_dim': 64, 'lr': 0.00018373450559542348, 'lambda_val': 5.124130156207605e-06, 'batch_size': 2013, 'optimizer': 'RMSprop'}. Best is trial 1 with value: 0.08987168849690128.
2026-05-13 13:04:52,246 - optuna.study._optimize - INFO - Trial 9 pruned. 
2026-05-13 13:05:35,231 - optuna.study.study - INFO - Trial 10 finished with value: 0.029317871071364656 and parameters: {'n_layers': 2, 'embedding_dim': 256, 'lr': 0.002110069409808251, 'lambda_val': 0.003808460894459913, 'batch_size': 534, 'optimizer': 'Adam'}. Best is trial 1 with value: 0.08987168849690128.
2026-05-13 13:05:40,255 - optuna.study._optimize - INFO - Trial 11 pruned. 
2026-05-13 13:05:48,825 - optuna.study._optimize - INFO - Trial 12 pruned. 
2026-05-13 13:06:25,715 - optuna.study.study - INFO - Trial 13 finished with value: 0.051586125631369495 and parameters: {'n_layers': 1, 'embedding_dim': 256, 'lr': 0.0008025596626859932, 'lambda_val': 3.685470707936506e-05, 'batch_size': 2643, 'optimizer': 'Adam'}. Best is trial 1 with value: 0.08987168849690128.
2026-05-13 13:06:30,152 - optuna.study._optimize - INFO - Trial 14 pruned. 
2026-05-13 13:06:59,724 - optuna.study.study - INFO - Trial 15 finished with value: 0.057862411856265276 and parameters: {'n_layers': 1, 'embedding_dim': 64, 'lr': 0.0002587479962525958, 'lambda_val': 1.7010288514771718e-06, 'batch_size': 4038, 'optimizer': 'Adam'}. Best is trial 1 with value: 0.08987168849690128.
2026-05-13 13:07:05,433 - optuna.study._optimize - INFO - Trial 16 pruned. 
2026-05-13 13:07:40,641 - optuna.study.study - INFO - Trial 17 finished with value: 0.025199528946580722 and parameters: {'n_layers': 2, 'embedding_dim': 128, 'lr': 0.0013839065784718694, 'lambda_val': 7.78779071315535e-05, 'batch_size': 1184, 'optimizer': 'Adam'}. Best is trial 1 with value: 0.08987168849690128.
2026-05-13 13:07:45,419 - optuna.study._optimize - INFO - Trial 18 pruned. 
2026-05-13 13:07:49,747 - optuna.study._optimize - INFO - Trial 19 pruned. 
2026-05-13 13:08:25,998 - optuna.study.study - INFO - Trial 20 finished with value: 0.06895669751509072 and parameters: {'n_layers': 1, 'embedding_dim': 256, 'lr': 0.000483182221823375, 'lambda_val': 9.589096473522346e-05, 'batch_size': 2346, 'optimizer': 'Adam'}. Best is trial 1 with value: 0.08987168849690128.
2026-05-13 13:09:01,395 - optuna.study.study - INFO - Trial 21 finished with value: 0.06061107288821482 and parameters: {'n_layers': 1, 'embedding_dim': 256, 'lr': 0.0007418786997242893, 'lambda_val': 0.00010617443302776218, 'batch_size': 2202, 'optimizer': 'Adam'}. Best is trial 1 with value: 0.08987168849690128.
2026-05-13 13:09:38,841 - optuna.study.study - INFO - Trial 22 finished with value: 0.05815014944179719 and parameters: {'n_layers': 1, 'embedding_dim': 256, 'lr': 0.00041840119550111166, 'lambda_val': 0.0007171495267817007, 'batch_size': 3681, 'optimizer': 'Adam'}. Best is trial 1 with value: 0.08987168849690128.
2026-05-13 13:09:43,638 - optuna.study._optimize - INFO - Trial 23 pruned. 
2026-05-13 13:09:54,019 - optuna.study._optimize - INFO - Trial 24 pruned. 
2026-05-13 13:09:59,357 - optuna.study._optimize - INFO - Trial 25 pruned. 
2026-05-13 13:10:19,159 - optuna.study._optimize - INFO - Trial 26 pruned. 
2026-05-13 13:10:56,677 - optuna.study.study - INFO - Trial 27 finished with value: 0.06672094999698341 and parameters: {'n_layers': 1, 'embedding_dim': 256, 'lr': 0.0004711866502078227, 'lambda_val': 0.0001446049187198809, 'batch_size': 3775, 'optimizer': 'Adam'}. Best is trial 1 with value: 0.08987168849690128.
2026-05-13 13:11:02,890 - optuna.study._optimize - INFO - Trial 28 pruned. 
2026-05-13 13:11:09,945 - optuna.study._optimize - INFO - Trial 29 pruned. 
2026-05-13 13:11:27,669 - optuna.study._optimize - INFO - Trial 30 pruned. 
2026-05-13 13:12:04,783 - optuna.study.study - INFO - Trial 31 finished with value: 0.07855691947874499 and parameters: {'n_layers': 1, 'embedding_dim': 256, 'lr': 0.0002182956216931022, 'lambda_val': 2.4594111229669327e-05, 'batch_size': 3741, 'optimizer': 'Adam'}. Best is trial 1 with value: 0.08987168849690128.
2026-05-13 13:12:44,946 - optuna.study.study - INFO - Trial 32 finished with value: 0.07954535901664078 and parameters: {'n_layers': 1, 'embedding_dim': 256, 'lr': 0.00022187225671425924, 'lambda_val': 1.6481676927458322e-05, 'batch_size': 3847, 'optimizer': 'Adam'}. Best is trial 1 with value: 0.08987168849690128.
2026-05-13 13:13:21,986 - optuna.study.study - INFO - Trial 33 finished with value: 0.08020730008409115 and parameters: {'n_layers': 1, 'embedding_dim': 256, 'lr': 0.00022802283010239864, 'lambda_val': 1.9461590553234595e-05, 'batch_size': 3669, 'optimizer': 'Adam'}. Best is trial 1 with value: 0.08987168849690128.
2026-05-13 13:13:26,333 - optuna.study._optimize - INFO - Trial 34 pruned. 
2026-05-13 13:13:31,139 - optuna.study._optimize - INFO - Trial 35 pruned. 
2026-05-13 13:13:35,926 - optuna.study._optimize - INFO - Trial 36 pruned. 
2026-05-13 13:13:40,103 - optuna.study._optimize - INFO - Trial 37 pruned. 
2026-05-13 13:13:47,824 - optuna.study._optimize - INFO - Trial 38 pruned. 
2026-05-13 13:14:20,108 - optuna.study.study - INFO - Trial 39 finished with value: 0.0700884996935604 and parameters: {'n_layers': 1, 'embedding_dim': 128, 'lr': 0.00025136813059516415, 'lambda_val': 2.0552006507823942e-05, 'batch_size': 3242, 'optimizer': 'Adam'}. Best is trial 1 with value: 0.08987168849690128.
2026-05-13 13:14:26,010 - optuna.study._optimize - INFO - Trial 40 pruned. 
2026-05-13 13:14:58,644 - optuna.study.study - INFO - Trial 41 finished with value: 0.07282809097051739 and parameters: {'n_layers': 1, 'embedding_dim': 128, 'lr': 0.00028557296015435234, 'lambda_val': 1.1843058541340539e-05, 'batch_size': 3324, 'optimizer': 'Adam'}. Best is trial 1 with value: 0.08987168849690128.
2026-05-13 13:15:30,910 - optuna.study.study - INFO - Trial 42 finished with value: 0.042043522579272526 and parameters: {'n_layers': 1, 'embedding_dim': 128, 'lr': 0.000788336042891346, 'lambda_val': 4.277636789060576e-06, 'batch_size': 3903, 'optimizer': 'Adam'}. Best is trial 1 with value: 0.08987168849690128.
2026-05-13 13:16:02,528 - optuna.study.study - INFO - Trial 43 finished with value: 0.07721529130233255 and parameters: {'n_layers': 1, 'embedding_dim': 128, 'lr': 0.00030425450912394245, 'lambda_val': 1.1071883170965526e-05, 'batch_size': 3298, 'optimizer': 'Adam'}. Best is trial 1 with value: 0.08987168849690128.
2026-05-13 13:16:06,588 - optuna.study._optimize - INFO - Trial 44 pruned. 
2026-05-13 13:16:10,716 - optuna.study._optimize - INFO - Trial 45 pruned. 
2026-05-13 13:16:14,871 - optuna.study._optimize - INFO - Trial 46 pruned. 
2026-05-13 13:16:45,856 - optuna.study.study - INFO - Trial 47 finished with value: 0.04582967575221726 and parameters: {'n_layers': 1, 'embedding_dim': 96, 'lr': 0.0006679569430708143, 'lambda_val': 2.2124236343132125e-05, 'batch_size': 2855, 'optimizer': 'Adam'}. Best is trial 1 with value: 0.08987168849690128.
2026-05-13 13:16:50,757 - optuna.study._optimize - INFO - Trial 48 pruned. 
2026-05-13 13:17:28,030 - optuna.study.study - INFO - Trial 49 finished with value: 0.07432913788037385 and parameters: {'n_layers': 1, 'embedding_dim': 256, 'lr': 0.0003345598055696837, 'lambda_val': 5.6473514242870945e-06, 'batch_size': 3205, 'optimizer': 'Adam'}. Best is trial 1 with value: 0.08987168849690128.
2026-05-13 13:17:33,063 - optuna.study._optimize - INFO - Trial 50 pruned. 
2026-05-13 13:18:18,607 - optuna.study.study - INFO - Trial 51 finished with value: 0.06690009779578095 and parameters: {'n_layers': 1, 'embedding_dim': 256, 'lr': 0.00032660665829638427, 'lambda_val': 5.754707688417229e-06, 'batch_size': 3264, 'optimizer': 'Adam'}. Best is trial 1 with value: 0.08987168849690128.
2026-05-13 13:18:55,462 - optuna.study.study - INFO - Trial 52 finished with value: 0.0868835988004181 and parameters: {'n_layers': 1, 'embedding_dim': 256, 'lr': 0.00017637305701755172, 'lambda_val': 3.7073243577260044e-06, 'batch_size': 3175, 'optimizer': 'Adam'}. Best is trial 1 with value: 0.08987168849690128.
2026-05-13 13:19:32,484 - optuna.study.study - INFO - Trial 53 finished with value: 0.08303010861805117 and parameters: {'n_layers': 1, 'embedding_dim': 256, 'lr': 0.00017221020599326073, 'lambda_val': 1.0196406994244991e-06, 'batch_size': 3680, 'optimizer': 'Adam'}. Best is trial 1 with value: 0.08987168849690128.
2026-05-13 13:19:37,184 - optuna.study._optimize - INFO - Trial 54 pruned. 
2026-05-13 13:19:42,612 - optuna.study._optimize - INFO - Trial 55 pruned. 
2026-05-13 13:19:47,708 - optuna.study._optimize - INFO - Trial 56 pruned. 
2026-05-13 13:19:52,430 - optuna.study._optimize - INFO - Trial 57 pruned. 
2026-05-13 13:19:57,880 - optuna.study._optimize - INFO - Trial 58 pruned. 
2026-05-13 13:20:01,874 - optuna.study._optimize - INFO - Trial 59 pruned. 
2026-05-13 13:20:07,451 - optuna.study._optimize - INFO - Trial 60 pruned. 
2026-05-13 13:20:44,608 - optuna.study.study - INFO - Trial 61 finished with value: 0.06188311620752186 and parameters: {'n_layers': 1, 'embedding_dim': 256, 'lr': 0.0005849470108100715, 'lambda_val': 1.0563845000165373e-05, 'batch_size': 3094, 'optimizer': 'Adam'}. Best is trial 1 with value: 0.08987168849690128.
2026-05-13 13:20:49,021 - optuna.study._optimize - INFO - Trial 62 pruned. 
2026-05-13 13:20:53,580 - optuna.study._optimize - INFO - Trial 63 pruned. 
2026-05-13 13:20:58,570 - optuna.study._optimize - INFO - Trial 64 pruned. 
2026-05-13 13:21:35,967 - optuna.study.study - INFO - Trial 65 finished with value: 0.08266764198137724 and parameters: {'n_layers': 1, 'embedding_dim': 256, 'lr': 0.00024008228720440294, 'lambda_val': 4.088188100350495e-06, 'batch_size': 3739, 'optimizer': 'Adam'}. Best is trial 1 with value: 0.08987168849690128.
2026-05-13 13:22:13,773 - optuna.study.study - INFO - Trial 66 finished with value: 0.08267240056628554 and parameters: {'n_layers': 1, 'embedding_dim': 256, 'lr': 0.0002233084975065445, 'lambda_val': 1.5007390649940528e-06, 'batch_size': 3734, 'optimizer': 'Adam'}. Best is trial 1 with value: 0.08987168849690128.
2026-05-13 13:22:51,194 - optuna.study.study - INFO - Trial 67 finished with value: 0.06365691302768524 and parameters: {'n_layers': 1, 'embedding_dim': 256, 'lr': 0.0005098452165155234, 'lambda_val': 1.692059575014714e-06, 'batch_size': 3577, 'optimizer': 'Adam'}. Best is trial 1 with value: 0.08987168849690128.
2026-05-13 13:23:26,009 - optuna.study.study - INFO - Trial 68 finished with value: 0.04337547252086222 and parameters: {'n_layers': 1, 'embedding_dim': 256, 'lr': 0.0010490126568142026, 'lambda_val': 4.102536262747658e-06, 'batch_size': 1004, 'optimizer': 'RMSprop'}. Best is trial 1 with value: 0.08987168849690128.
2026-05-13 13:23:30,400 - optuna.study._optimize - INFO - Trial 69 pruned. 
2026-05-13 13:23:34,475 - optuna.study._optimize - INFO - Trial 70 pruned. 
2026-05-13 13:23:41,054 - optuna.study._optimize - INFO - Trial 71 pruned. 
2026-05-13 13:24:18,952 - optuna.study.study - INFO - Trial 72 finished with value: 0.06695707857384477 and parameters: {'n_layers': 1, 'embedding_dim': 256, 'lr': 0.00036527625664237645, 'lambda_val': 2.7506347554860075e-06, 'batch_size': 4066, 'optimizer': 'Adam'}. Best is trial 1 with value: 0.08987168849690128.
2026-05-13 13:24:24,074 - optuna.study._optimize - INFO - Trial 73 pruned. 
2026-05-13 13:24:28,776 - optuna.study._optimize - INFO - Trial 74 pruned. 
2026-05-13 13:24:34,310 - optuna.study._optimize - INFO - Trial 75 pruned. 
2026-05-13 13:24:38,643 - optuna.study._optimize - INFO - Trial 76 pruned. 
2026-05-13 13:24:45,309 - optuna.study._optimize - INFO - Trial 77 pruned. 
2026-05-13 13:25:24,765 - optuna.study.study - INFO - Trial 78 finished with value: 0.07321648084077186 and parameters: {'n_layers': 1, 'embedding_dim': 256, 'lr': 0.00026628533103821323, 'lambda_val': 3.832222478334129e-05, 'batch_size': 3850, 'optimizer': 'Adam'}. Best is trial 1 with value: 0.08987168849690128.
2026-05-13 13:25:29,367 - optuna.study._optimize - INFO - Trial 79 pruned. 
2026-05-13 13:25:33,506 - optuna.study._optimize - INFO - Trial 80 pruned. 
2026-05-13 13:26:20,220 - optuna.study.study - INFO - Trial 81 finished with value: 0.07317656101796195 and parameters: {'n_layers': 1, 'embedding_dim': 128, 'lr': 0.000301205695711, 'lambda_val': 1.1654717256772045e-05, 'batch_size': 3540, 'optimizer': 'Adam'}. Best is trial 1 with value: 0.08987168849690128.
2026-05-13 13:26:57,122 - optuna.study.study - INFO - Trial 82 finished with value: 0.055954046983854755 and parameters: {'n_layers': 1, 'embedding_dim': 128, 'lr': 0.0005597737594959329, 'lambda_val': 2.439531388056445e-06, 'batch_size': 3329, 'optimizer': 'Adam'}. Best is trial 1 with value: 0.08987168849690128.
2026-05-13 13:27:34,294 - optuna.study.study - INFO - Trial 83 finished with value: 0.07951406836375598 and parameters: {'n_layers': 1, 'embedding_dim': 256, 'lr': 0.00022911197769504463, 'lambda_val': 4.273773986308668e-06, 'batch_size': 3959, 'optimizer': 'Adam'}. Best is trial 1 with value: 0.08987168849690128.
2026-05-13 13:27:39,019 - optuna.study._optimize - INFO - Trial 84 pruned. 
2026-05-13 13:27:43,739 - optuna.study._optimize - INFO - Trial 85 pruned. 
2026-05-13 13:27:49,640 - optuna.study._optimize - INFO - Trial 86 pruned. 
2026-05-13 13:28:00,387 - optuna.study._optimize - INFO - Trial 87 pruned. 
2026-05-13 13:28:07,020 - optuna.study._optimize - INFO - Trial 88 pruned. 
2026-05-13 13:28:12,643 - optuna.study._optimize - INFO - Trial 89 pruned. 
2026-05-13 13:28:20,391 - optuna.study._optimize - INFO - Trial 90 pruned. 
2026-05-13 13:28:52,691 - optuna.study.study - INFO - Trial 91 finished with value: 0.06969969592753657 and parameters: {'n_layers': 1, 'embedding_dim': 128, 'lr': 0.0003415474802740411, 'lambda_val': 7.776687177761847e-06, 'batch_size': 4089, 'optimizer': 'Adam'}. Best is trial 1 with value: 0.08987168849690128.
2026-05-13 13:28:56,921 - optuna.study._optimize - INFO - Trial 92 pruned. 
2026-05-13 13:29:01,088 - optuna.study._optimize - INFO - Trial 93 pruned. 
2026-05-13 13:29:38,279 - optuna.study.study - INFO - Trial 94 finished with value: 0.05419229836703165 and parameters: {'n_layers': 1, 'embedding_dim': 256, 'lr': 0.0008861847045158665, 'lambda_val': 0.0005233520084273188, 'batch_size': 3339, 'optimizer': 'Adam'}. Best is trial 1 with value: 0.08987168849690128.
2026-05-13 13:30:16,891 - optuna.study.study - INFO - Trial 95 finished with value: 0.05958493015683591 and parameters: {'n_layers': 1, 'embedding_dim': 256, 'lr': 0.0006467155059562906, 'lambda_val': 4.5656585938463394e-06, 'batch_size': 2931, 'optimizer': 'Adam'}. Best is trial 1 with value: 0.08987168849690128.
2026-05-13 13:30:21,720 - optuna.study._optimize - INFO - Trial 96 pruned. 
2026-05-13 13:30:26,695 - optuna.study._optimize - INFO - Trial 97 pruned. 
