2026-05-13 22:23:46,955 - optuna.study.study - INFO - Trial 123 finished with value: 0.07591329050288255 and parameters: {'n_layers': 1, 'embedding_dim': 256, 'lr': 0.00015860030491831405, 'lambda_val': 8.061386313414734e-06, 'batch_size': 3721, 'optimizer': 'Adam'}. Best is trial 91 with value: 0.0871384560332929.
2026-05-13 22:24:25,655 - optuna.study.study - INFO - Trial 124 finished with value: 0.08317643528340317 and parameters: {'n_layers': 1, 'embedding_dim': 256, 'lr': 0.00021852291976504832, 'lambda_val': 4.6985760790588254e-05, 'batch_size': 3014, 'optimizer': 'Adam'}. Best is trial 91 with value: 0.0871384560332929.
2026-05-13 22:24:30,302 - optuna.study._optimize - INFO - Trial 125 pruned. 
2026-05-13 22:24:34,708 - optuna.study._optimize - INFO - Trial 126 pruned. 
2026-05-13 22:25:10,748 - optuna.study.study - INFO - Trial 127 finished with value: 0.07849930836423875 and parameters: {'n_layers': 1, 'embedding_dim': 256, 'lr': 0.0001913303605280411, 'lambda_val': 0.0003814851821371181, 'batch_size': 3085, 'optimizer': 'Adam'}. Best is trial 91 with value: 0.0871384560332929.
2026-05-13 22:25:15,142 - optuna.study._optimize - INFO - Trial 128 pruned. 
2026-05-13 22:25:19,888 - optuna.study._optimize - INFO - Trial 129 pruned. 
2026-05-13 22:25:51,878 - optuna.study.study - INFO - Trial 130 finished with value: 0.0602185199444276 and parameters: {'n_layers': 1, 'embedding_dim': 256, 'lr': 0.00035242729560533594, 'lambda_val': 1.6112192738712805e-05, 'batch_size': 2778, 'optimizer': 'RMSprop'}. Best is trial 91 with value: 0.0871384560332929.
2026-05-13 22:26:25,432 - optuna.study.study - INFO - Trial 131 finished with value: 0.07325242248639083 and parameters: {'n_layers': 1, 'embedding_dim': 256, 'lr': 0.00025002707113249865, 'lambda_val': 7.120909685038253e-05, 'batch_size': 2906, 'optimizer': 'Adam'}. Best is trial 91 with value: 0.0871384560332929.
2026-05-13 22:27:04,724 - optuna.study.study - INFO - Trial 132 finished with value: 0.08405725338966777 and parameters: {'n_layers': 1, 'embedding_dim': 256, 'lr': 0.0002185944965845953, 'lambda_val': 5.784449135131605e-05, 'batch_size': 4034, 'optimizer': 'Adam'}. Best is trial 91 with value: 0.0871384560332929.
2026-05-13 22:27:09,239 - optuna.study._optimize - INFO - Trial 133 pruned. 
2026-05-13 22:27:46,088 - optuna.study.study - INFO - Trial 134 finished with value: 0.07266144040399532 and parameters: {'n_layers': 1, 'embedding_dim': 256, 'lr': 0.00030196106140373025, 'lambda_val': 8.692177254687827e-05, 'batch_size': 3629, 'optimizer': 'Adam'}. Best is trial 91 with value: 0.0871384560332929.
2026-05-13 22:27:53,047 - optuna.study._optimize - INFO - Trial 135 pruned. 
2026-05-13 22:27:57,426 - optuna.study._optimize - INFO - Trial 136 pruned. 
2026-05-13 22:28:02,037 - optuna.study._optimize - INFO - Trial 137 pruned. 
2026-05-13 22:28:38,835 - optuna.study.study - INFO - Trial 138 finished with value: 0.06760866341803316 and parameters: {'n_layers': 1, 'embedding_dim': 256, 'lr': 0.00042429742152455633, 'lambda_val': 2.8709058421232003e-05, 'batch_size': 3835, 'optimizer': 'Adam'}. Best is trial 91 with value: 0.0871384560332929.
2026-05-13 22:28:42,654 - optuna.study._optimize - INFO - Trial 139 pruned. 
2026-05-13 22:28:47,333 - optuna.study._optimize - INFO - Trial 140 pruned. 
2026-05-13 22:29:25,297 - optuna.study.study - INFO - Trial 141 finished with value: 0.07233600835040346 and parameters: {'n_layers': 1, 'embedding_dim': 256, 'lr': 0.00023487715545214482, 'lambda_val': 6.374104953449597e-05, 'batch_size': 4095, 'optimizer': 'Adam'}. Best is trial 91 with value: 0.0871384560332929.
2026-05-13 22:30:06,515 - optuna.study.study - INFO - Trial 142 finished with value: 0.07367647132799472 and parameters: {'n_layers': 1, 'embedding_dim': 256, 'lr': 0.0002867610724743955, 'lambda_val': 5.498579458904682e-05, 'batch_size': 4023, 'optimizer': 'Adam'}. Best is trial 91 with value: 0.0871384560332929.
2026-05-13 22:30:11,023 - optuna.study._optimize - INFO - Trial 143 pruned. 
2026-05-13 22:30:17,154 - optuna.study._optimize - INFO - Trial 144 pruned. 
2026-05-13 22:30:21,958 - optuna.study._optimize - INFO - Trial 145 pruned. 
2026-05-13 22:30:25,166 - optuna.study._optimize - INFO - Trial 146 pruned. 
2026-05-13 22:31:00,471 - optuna.study.study - INFO - Trial 147 finished with value: 0.08950108653640966 and parameters: {'n_layers': 1, 'embedding_dim': 256, 'lr': 0.0001702590530711125, 'lambda_val': 2.595291412746048e-05, 'batch_size': 3124, 'optimizer': 'Adam'}. Best is trial 147 with value: 0.08950108653640966.
2026-05-13 22:31:04,530 - optuna.study._optimize - INFO - Trial 148 pruned. 
2026-05-13 22:31:08,894 - optuna.study._optimize - INFO - Trial 149 pruned. 
2026-05-13 22:31:14,163 - optuna.study._optimize - INFO - Trial 150 pruned. 
2026-05-13 22:31:18,669 - optuna.study._optimize - INFO - Trial 151 pruned. 
2026-05-13 22:31:55,683 - optuna.study.study - INFO - Trial 152 finished with value: 0.07715984111473641 and parameters: {'n_layers': 1, 'embedding_dim': 256, 'lr': 0.00022666898410004336, 'lambda_val': 5.8378082400458516e-05, 'batch_size': 3884, 'optimizer': 'Adam'}. Best is trial 147 with value: 0.08950108653640966.
2026-05-13 22:32:00,449 - optuna.study._optimize - INFO - Trial 153 pruned. 
2026-05-13 22:32:05,068 - optuna.study._optimize - INFO - Trial 154 pruned. 
2026-05-13 22:32:12,975 - optuna.study._optimize - INFO - Trial 155 pruned. 
2026-05-13 22:32:17,642 - optuna.study._optimize - INFO - Trial 156 pruned. 
2026-05-13 22:32:22,170 - optuna.study._optimize - INFO - Trial 157 pruned. 
2026-05-13 22:32:26,675 - optuna.study._optimize - INFO - Trial 158 pruned. 
2026-05-13 22:32:31,429 - optuna.study._optimize - INFO - Trial 159 pruned. 
2026-05-13 22:32:36,163 - optuna.study._optimize - INFO - Trial 160 pruned. 
2026-05-13 22:33:13,668 - optuna.study.study - INFO - Trial 161 finished with value: 0.07066382380114156 and parameters: {'n_layers': 1, 'embedding_dim': 256, 'lr': 0.00026192616246118735, 'lambda_val': 2.4733045151758853e-05, 'batch_size': 3995, 'optimizer': 'Adam'}. Best is trial 147 with value: 0.08950108653640966.
2026-05-13 22:33:18,172 - optuna.study._optimize - INFO - Trial 162 pruned. 
2026-05-13 22:33:23,043 - optuna.study._optimize - INFO - Trial 163 pruned. 
2026-05-13 22:33:27,681 - optuna.study._optimize - INFO - Trial 164 pruned. 
2026-05-13 22:33:31,616 - optuna.study._optimize - INFO - Trial 165 pruned. 
2026-05-13 22:34:07,965 - optuna.study.study - INFO - Trial 166 finished with value: 0.08275719994166614 and parameters: {'n_layers': 1, 'embedding_dim': 256, 'lr': 0.0002300666582466029, 'lambda_val': 3.236997246245874e-06, 'batch_size': 3068, 'optimizer': 'Adam'}. Best is trial 147 with value: 0.08950108653640966.
2026-05-13 22:34:12,578 - optuna.study._optimize - INFO - Trial 167 pruned. 
2026-05-13 22:34:43,148 - optuna.study.study - INFO - Trial 168 finished with value: 0.06292862383953937 and parameters: {'n_layers': 1, 'embedding_dim': 96, 'lr': 0.00023908457600375172, 'lambda_val': 8.806493674284137e-05, 'batch_size': 3257, 'optimizer': 'Adam'}. Best is trial 147 with value: 0.08950108653640966.
2026-05-13 22:34:47,748 - optuna.study._optimize - INFO - Trial 169 pruned. 
2026-05-13 22:34:51,302 - optuna.study._optimize - INFO - Trial 170 pruned. 
2026-05-13 22:34:55,933 - optuna.study._optimize - INFO - Trial 171 pruned. 
2026-05-13 22:35:32,563 - optuna.study.study - INFO - Trial 172 finished with value: 0.08562408143295638 and parameters: {'n_layers': 1, 'embedding_dim': 256, 'lr': 0.00022739896726967605, 'lambda_val': 1.7876238853428826e-05, 'batch_size': 2983, 'optimizer': 'Adam'}. Best is trial 147 with value: 0.08950108653640966.
2026-05-13 22:36:08,995 - optuna.study.study - INFO - Trial 173 finished with value: 0.07914976423642675 and parameters: {'n_layers': 1, 'embedding_dim': 256, 'lr': 0.0002004324107186449, 'lambda_val': 5.212135881448933e-06, 'batch_size': 2939, 'optimizer': 'Adam'}. Best is trial 147 with value: 0.08950108653640966.
2026-05-13 22:36:53,724 - optuna.study.study - INFO - Trial 174 finished with value: 0.07502041146345542 and parameters: {'n_layers': 1, 'embedding_dim': 256, 'lr': 0.0002681124574220666, 'lambda_val': 1.3890301898039709e-05, 'batch_size': 3001, 'optimizer': 'Adam'}. Best is trial 147 with value: 0.08950108653640966.
2026-05-13 22:36:59,102 - optuna.study._optimize - INFO - Trial 175 pruned. 
2026-05-13 22:37:04,121 - optuna.study._optimize - INFO - Trial 176 pruned. 
2026-05-13 22:37:11,385 - optuna.study._optimize - INFO - Trial 177 pruned. 
2026-05-13 22:37:15,310 - optuna.study._optimize - INFO - Trial 178 pruned. 
2026-05-13 22:37:19,709 - optuna.study._optimize - INFO - Trial 179 pruned. 
2026-05-13 22:37:24,244 - optuna.study._optimize - INFO - Trial 180 pruned. 
2026-05-13 22:37:28,825 - optuna.study._optimize - INFO - Trial 181 pruned. 
2026-05-13 22:37:33,340 - optuna.study._optimize - INFO - Trial 182 pruned. 
2026-05-13 22:37:38,397 - optuna.study._optimize - INFO - Trial 183 pruned. 
2026-05-13 22:38:13,902 - optuna.study.study - INFO - Trial 184 finished with value: 0.06385297679052876 and parameters: {'n_layers': 1, 'embedding_dim': 256, 'lr': 0.0002807415537087288, 'lambda_val': 4.110640388394599e-06, 'batch_size': 2930, 'optimizer': 'Adam'}. Best is trial 147 with value: 0.08950108653640966.
2026-05-13 22:38:45,704 - optuna.study.study - INFO - Trial 185 finished with value: 0.0954928382261776 and parameters: {'n_layers': 1, 'embedding_dim': 256, 'lr': 0.00021557602194599213, 'lambda_val': 2.9969431817228717e-05, 'batch_size': 1534, 'optimizer': 'Adam'}. Best is trial 185 with value: 0.0954928382261776.
2026-05-13 22:38:49,210 - optuna.study._optimize - INFO - Trial 186 pruned. 
2026-05-13 22:38:53,492 - optuna.study._optimize - INFO - Trial 187 pruned. 
2026-05-13 22:39:25,391 - optuna.study.study - INFO - Trial 188 finished with value: 0.08656589015188693 and parameters: {'n_layers': 1, 'embedding_dim': 256, 'lr': 0.00023474954704510255, 'lambda_val': 4.744557992300682e-05, 'batch_size': 1806, 'optimizer': 'Adam'}. Best is trial 185 with value: 0.0954928382261776.
2026-05-13 22:39:53,205 - optuna.study.study - INFO - Trial 189 finished with value: 0.06858430891209094 and parameters: {'n_layers': 1, 'embedding_dim': 96, 'lr': 0.0003369968565941758, 'lambda_val': 2.0905512330701823e-05, 'batch_size': 1697, 'optimizer': 'Adam'}. Best is trial 185 with value: 0.0954928382261776.
2026-05-13 22:39:57,290 - optuna.study._optimize - INFO - Trial 190 pruned. 
2026-05-13 22:40:01,415 - optuna.study._optimize - INFO - Trial 191 pruned. 
2026-05-13 22:40:05,506 - optuna.study._optimize - INFO - Trial 192 pruned. 
2026-05-13 22:40:09,719 - optuna.study._optimize - INFO - Trial 193 pruned. 
2026-05-13 22:40:13,867 - optuna.study._optimize - INFO - Trial 194 pruned. 
2026-05-13 22:40:18,769 - optuna.study._optimize - INFO - Trial 195 pruned. 
2026-05-13 22:40:51,844 - optuna.study.study - INFO - Trial 196 finished with value: 0.0671314831654343 and parameters: {'n_layers': 1, 'embedding_dim': 256, 'lr': 0.00047727634979023503, 'lambda_val': 3.087825897722524e-05, 'batch_size': 1574, 'optimizer': 'Adam'}. Best is trial 185 with value: 0.0954928382261776.
2026-05-13 22:40:58,227 - optuna.study._optimize - INFO - Trial 197 pruned. 
2026-05-13 22:41:02,631 - optuna.study._optimize - INFO - Trial 198 pruned. 
2026-05-13 22:41:07,107 - optuna.study._optimize - INFO - Trial 199 pruned. 
2026-05-13 22:41:34,742 - root - INFO -   **** Training e_100K_1c3dcs_rand2
2026-05-13 22:41:34,755 - root - INFO -   **** Getting 56335/65410 random edges
2026-05-13 22:41:35,388 - optuna.storages._rdb.storage - INFO - A new study created in RDB with name: Study_e_100K_1c3dcs_rand2
2026-05-13 22:42:22,868 - optuna.study.study - INFO - Trial 0 finished with value: 0.001911914412970932 and parameters: {'n_layers': 3, 'embedding_dim': 96, 'lr': 5.7932607937451066e-05, 'lambda_val': 4.164692711334905e-06, 'batch_size': 3981, 'optimizer': 'SGD'}. Best is trial 0 with value: 0.001911914412970932.
2026-05-13 22:42:59,418 - optuna.study.study - INFO - Trial 1 finished with value: 0.0035167150106335363 and parameters: {'n_layers': 2, 'embedding_dim': 64, 'lr': 0.04331449102841531, 'lambda_val': 0.006823541214557839, 'batch_size': 2075, 'optimizer': 'SGD'}. Best is trial 1 with value: 0.0035167150106335363.
2026-05-13 22:43:40,715 - optuna.study.study - INFO - Trial 2 finished with value: 0.03475261921912233 and parameters: {'n_layers': 3, 'embedding_dim': 96, 'lr': 0.010315462081631779, 'lambda_val': 1.6839715823827075e-05, 'batch_size': 1178, 'optimizer': 'RMSprop'}. Best is trial 2 with value: 0.03475261921912233.
2026-05-13 22:44:15,557 - optuna.study.study - INFO - Trial 3 finished with value: 0.01784666063096436 and parameters: {'n_layers': 2, 'embedding_dim': 128, 'lr': 0.021236172022903104, 'lambda_val': 0.04729314594901513, 'batch_size': 3088, 'optimizer': 'RMSprop'}. Best is trial 2 with value: 0.03475261921912233.
2026-05-13 22:44:48,181 - optuna.study.study - INFO - Trial 4 finished with value: 0.000912940073562234 and parameters: {'n_layers': 3, 'embedding_dim': 32, 'lr': 5.610573405251036e-05, 'lambda_val': 4.646117482334014e-05, 'batch_size': 2619, 'optimizer': 'SGD'}. Best is trial 2 with value: 0.03475261921912233.
2026-05-13 22:44:51,800 - optuna.study._optimize - INFO - Trial 5 pruned. 
2026-05-13 22:44:56,702 - optuna.study._optimize - INFO - Trial 6 pruned. 
2026-05-13 22:45:00,914 - optuna.study._optimize - INFO - Trial 7 pruned. 
2026-05-13 22:45:38,721 - optuna.study.study - INFO - Trial 8 finished with value: 0.005240996750955872 and parameters: {'n_layers': 3, 'embedding_dim': 96, 'lr': 0.06187815092511684, 'lambda_val': 0.06941828491904822, 'batch_size': 2982, 'optimizer': 'RMSprop'}. Best is trial 2 with value: 0.03475261921912233.
2026-05-13 22:46:20,456 - optuna.study.study - INFO - Trial 9 finished with value: 0.005797343146899559 and parameters: {'n_layers': 2, 'embedding_dim': 256, 'lr': 0.009861454713359778, 'lambda_val': 0.09478344798981157, 'batch_size': 568, 'optimizer': 'RMSprop'}. Best is trial 2 with value: 0.03475261921912233.
2026-05-13 22:47:01,250 - optuna.study.study - INFO - Trial 10 finished with value: 0.014919905294164043 and parameters: {'n_layers': 4, 'embedding_dim': 96, 'lr': 0.0007318295213103571, 'lambda_val': 6.823067920158476e-05, 'batch_size': 1181, 'optimizer': 'Adam'}. Best is trial 2 with value: 0.03475261921912233.
2026-05-13 22:47:45,243 - optuna.study.study - INFO - Trial 11 finished with value: 0.018739770569400283 and parameters: {'n_layers': 4, 'embedding_dim': 128, 'lr': 0.0015855377802200161, 'lambda_val': 0.0005285636722926462, 'batch_size': 1362, 'optimizer': 'RMSprop'}. Best is trial 2 with value: 0.03475261921912233.
2026-05-13 22:48:29,561 - optuna.study.study - INFO - Trial 12 finished with value: 0.016879124696599048 and parameters: {'n_layers': 4, 'embedding_dim': 128, 'lr': 0.0013607649838813473, 'lambda_val': 0.0003451462042670349, 'batch_size': 1514, 'optimizer': 'RMSprop'}. Best is trial 2 with value: 0.03475261921912233.
2026-05-13 22:49:28,017 - optuna.study.study - INFO - Trial 13 finished with value: 0.02349177407415255 and parameters: {'n_layers': 4, 'embedding_dim': 256, 'lr': 0.0013907793120569848, 'lambda_val': 0.00043034181725961994, 'batch_size': 1429, 'optimizer': 'Adam'}. Best is trial 2 with value: 0.03475261921912233.
2026-05-13 22:50:27,519 - optuna.study.study - INFO - Trial 14 finished with value: 0.026150655418444132 and parameters: {'n_layers': 4, 'embedding_dim': 256, 'lr': 0.00037237969024654573, 'lambda_val': 1.769104902834414e-05, 'batch_size': 522, 'optimizer': 'Adam'}. Best is trial 2 with value: 0.03475261921912233.
2026-05-13 22:51:26,273 - optuna.study.study - INFO - Trial 15 finished with value: 0.03213506489194288 and parameters: {'n_layers': 4, 'embedding_dim': 256, 'lr': 0.00021236763156425088, 'lambda_val': 1.2867114669757063e-05, 'batch_size': 597, 'optimizer': 'Adam'}. Best is trial 2 with value: 0.03475261921912233.
2026-05-13 22:52:03,585 - optuna.study.study - INFO - Trial 16 finished with value: 0.028945166490199122 and parameters: {'n_layers': 3, 'embedding_dim': 96, 'lr': 0.00021753254377443386, 'lambda_val': 7.805987152749438e-06, 'batch_size': 799, 'optimizer': 'Adam'}. Best is trial 2 with value: 0.03475261921912233.
2026-05-13 22:53:02,779 - optuna.study.study - INFO - Trial 17 finished with value: 0.017610436056140214 and parameters: {'n_layers': 4, 'embedding_dim': 256, 'lr': 0.00011820075316647282, 'lambda_val': 1.0718922331292415e-06, 'batch_size': 1924, 'optimizer': 'Adam'}. Best is trial 2 with value: 0.03475261921912233.
2026-05-13 22:53:54,259 - optuna.study.study - INFO - Trial 18 finished with value: 0.030618649195530517 and parameters: {'n_layers': 3, 'embedding_dim': 256, 'lr': 0.0033201106706469592, 'lambda_val': 8.99307022922104e-05, 'batch_size': 983, 'optimizer': 'Adam'}. Best is trial 2 with value: 0.03475261921912233.
2026-05-13 22:53:58,485 - optuna.study._optimize - INFO - Trial 19 pruned. 
2026-05-13 22:54:38,936 - optuna.study.study - INFO - Trial 20 finished with value: 0.022609717957948347 and parameters: {'n_layers': 4, 'embedding_dim': 64, 'lr': 0.02485948305943493, 'lambda_val': 1.8488796100438098e-05, 'batch_size': 958, 'optimizer': 'Adam'}. Best is trial 2 with value: 0.03475261921912233.
2026-05-13 22:55:33,324 - optuna.study.study - INFO - Trial 21 finished with value: 0.0264544312292842 and parameters: {'n_layers': 3, 'embedding_dim': 256, 'lr': 0.0030025000520641993, 'lambda_val': 6.939255328851292e-05, 'batch_size': 1012, 'optimizer': 'Adam'}. Best is trial 2 with value: 0.03475261921912233.
2026-05-13 22:56:24,759 - optuna.study.study - INFO - Trial 22 finished with value: 0.027741893656277113 and parameters: {'n_layers': 3, 'embedding_dim': 256, 'lr': 0.0036014661116475027, 'lambda_val': 0.0001373290182747093, 'batch_size': 865, 'optimizer': 'Adam'}. Best is trial 2 with value: 0.03475261921912233.
2026-05-13 22:57:17,357 - optuna.study.study - INFO - Trial 23 finished with value: 0.02491586523251756 and parameters: {'n_layers': 3, 'embedding_dim': 256, 'lr': 0.0004634169235495684, 'lambda_val': 0.0019321461503522023, 'batch_size': 1194, 'optimizer': 'Adam'}. Best is trial 2 with value: 0.03475261921912233.
2026-05-13 22:57:59,151 - optuna.study.study - INFO - Trial 24 finished with value: 0.031925670374035216 and parameters: {'n_layers': 2, 'embedding_dim': 256, 'lr': 0.014574435789654998, 'lambda_val': 2.003791632619078e-05, 'batch_size': 721, 'optimizer': 'Adam'}. Best is trial 2 with value: 0.03475261921912233.
2026-05-13 22:58:03,532 - optuna.study._optimize - INFO - Trial 25 pruned. 
2026-05-13 22:58:31,799 - optuna.study.study - INFO - Trial 26 finished with value: 0.05901727744012671 and parameters: {'n_layers': 1, 'embedding_dim': 96, 'lr': 0.011751436036941905, 'lambda_val': 7.4634581576143466e-06, 'batch_size': 527, 'optimizer': 'RMSprop'}. Best is trial 26 with value: 0.05901727744012671.
2026-05-13 22:58:36,336 - optuna.study._optimize - INFO - Trial 27 pruned. 
2026-05-13 22:59:03,802 - optuna.study.study - INFO - Trial 28 finished with value: 0.02868405266165944 and parameters: {'n_layers': 1, 'embedding_dim': 96, 'lr': 0.03178803547507739, 'lambda_val': 7.582027938590036e-06, 'batch_size': 1698, 'optimizer': 'RMSprop'}. Best is trial 26 with value: 0.05901727744012671.
2026-05-13 22:59:07,531 - optuna.study._optimize - INFO - Trial 29 pruned. 
2026-05-13 22:59:49,723 - optuna.study.study - INFO - Trial 30 finished with value: 0.031129903225205084 and parameters: {'n_layers': 4, 'embedding_dim': 96, 'lr': 0.012135526441207009, 'lambda_val': 7.998660777724338e-06, 'batch_size': 1632, 'optimizer': 'RMSprop'}. Best is trial 26 with value: 0.05901727744012671.
2026-05-13 23:00:32,128 - optuna.study.study - INFO - Trial 31 finished with value: 0.033231683548705246 and parameters: {'n_layers': 2, 'embedding_dim': 256, 'lr': 0.012458593094768771, 'lambda_val': 3.11046807399429e-05, 'batch_size': 756, 'optimizer': 'Adam'}. Best is trial 26 with value: 0.05901727744012671.
2026-05-13 23:00:36,288 - optuna.study._optimize - INFO - Trial 32 pruned. 
2026-05-13 23:00:40,360 - optuna.study._optimize - INFO - Trial 33 pruned. 
2026-05-13 23:01:14,291 - optuna.study.study - INFO - Trial 34 finished with value: 0.025839637239752022 and parameters: {'n_layers': 1, 'embedding_dim': 256, 'lr': 0.02011991093422094, 'lambda_val': 8.88662139073879e-06, 'batch_size': 1930, 'optimizer': 'RMSprop'}. Best is trial 26 with value: 0.05901727744012671.
2026-05-13 23:01:18,116 - optuna.study._optimize - INFO - Trial 35 pruned. 
2026-05-13 23:01:51,972 - optuna.study.study - INFO - Trial 36 finished with value: 0.027675701239664945 and parameters: {'n_layers': 2, 'embedding_dim': 96, 'lr': 0.000640043644848694, 'lambda_val': 2.7324312424200868e-06, 'batch_size': 2343, 'optimizer': 'Adam'}. Best is trial 26 with value: 0.05901727744012671.
2026-05-13 23:02:29,367 - optuna.study.study - INFO - Trial 37 finished with value: 0.02201402853145962 and parameters: {'n_layers': 3, 'embedding_dim': 64, 'lr': 0.00025744182955218786, 'lambda_val': 3.928687488019023e-05, 'batch_size': 3723, 'optimizer': 'RMSprop'}. Best is trial 26 with value: 0.05901727744012671.
2026-05-13 23:02:33,494 - optuna.study._optimize - INFO - Trial 38 pruned. 
2026-05-13 23:03:06,034 - optuna.study.study - INFO - Trial 39 finished with value: 0.041717989004402704 and parameters: {'n_layers': 2, 'embedding_dim': 96, 'lr': 0.006524096563895797, 'lambda_val': 1.0898931219465711e-05, 'batch_size': 1127, 'optimizer': 'RMSprop'}. Best is trial 26 with value: 0.05901727744012671.
2026-05-13 23:03:10,599 - optuna.study._optimize - INFO - Trial 40 pruned. 
