2026-05-13 08:07:59,775 - optuna.study.study - INFO - Trial 99 finished with value: 0.07440863624156203 and parameters: {'n_layers': 1, 'embedding_dim': 128, 'lr': 0.0004595869352428141, 'lambda_val': 0.0007046999728570929, 'batch_size': 535, 'optimizer': 'RMSprop'}. Best is trial 34 with value: 0.1271187868674389.
2026-05-13 08:08:05,039 - optuna.study._optimize - INFO - Trial 100 pruned. 
2026-05-13 08:08:34,527 - optuna.study.study - INFO - Trial 101 finished with value: 0.0711529570003409 and parameters: {'n_layers': 1, 'embedding_dim': 256, 'lr': 0.00022649399821341866, 'lambda_val': 0.0077814395400130475, 'batch_size': 595, 'optimizer': 'RMSprop'}. Best is trial 34 with value: 0.1271187868674389.
2026-05-13 08:09:04,728 - optuna.study.study - INFO - Trial 102 finished with value: 0.09282700809369587 and parameters: {'n_layers': 1, 'embedding_dim': 256, 'lr': 0.00017525553407905163, 'lambda_val': 0.0017499163725552423, 'batch_size': 893, 'optimizer': 'RMSprop'}. Best is trial 34 with value: 0.1271187868674389.
2026-05-13 08:09:35,732 - optuna.study.study - INFO - Trial 103 finished with value: 0.06909762230314509 and parameters: {'n_layers': 1, 'embedding_dim': 256, 'lr': 0.00032639293250495027, 'lambda_val': 0.0031468848961648172, 'batch_size': 697, 'optimizer': 'RMSprop'}. Best is trial 34 with value: 0.1271187868674389.
2026-05-13 08:10:07,027 - optuna.study.study - INFO - Trial 104 finished with value: 0.1117323869620913 and parameters: {'n_layers': 1, 'embedding_dim': 256, 'lr': 0.00024135457174447953, 'lambda_val': 1.941951711433821e-05, 'batch_size': 518, 'optimizer': 'RMSprop'}. Best is trial 34 with value: 0.1271187868674389.
2026-05-13 08:10:39,020 - optuna.study.study - INFO - Trial 105 finished with value: 0.06694835529250162 and parameters: {'n_layers': 1, 'embedding_dim': 256, 'lr': 0.0008729296535468168, 'lambda_val': 1.9049514585739383e-05, 'batch_size': 532, 'optimizer': 'RMSprop'}. Best is trial 34 with value: 0.1271187868674389.
2026-05-13 08:10:43,409 - optuna.study._optimize - INFO - Trial 106 pruned. 
2026-05-13 08:11:16,915 - optuna.study.study - INFO - Trial 107 finished with value: 0.10553874217997906 and parameters: {'n_layers': 1, 'embedding_dim': 256, 'lr': 0.0002626751364194571, 'lambda_val': 1.1244411500039934e-05, 'batch_size': 512, 'optimizer': 'RMSprop'}. Best is trial 34 with value: 0.1271187868674389.
2026-05-13 08:11:48,874 - optuna.study.study - INFO - Trial 108 finished with value: 0.08016994541418687 and parameters: {'n_layers': 1, 'embedding_dim': 256, 'lr': 0.00036419142656809257, 'lambda_val': 7.739430125868994e-06, 'batch_size': 829, 'optimizer': 'RMSprop'}. Best is trial 34 with value: 0.1271187868674389.
2026-05-13 08:11:52,891 - optuna.study._optimize - INFO - Trial 109 pruned. 
2026-05-13 08:12:23,895 - optuna.study.study - INFO - Trial 110 finished with value: 0.09436875278889789 and parameters: {'n_layers': 1, 'embedding_dim': 256, 'lr': 0.0002430797633947959, 'lambda_val': 3.523431850265711e-06, 'batch_size': 735, 'optimizer': 'RMSprop'}. Best is trial 34 with value: 0.1271187868674389.
2026-05-13 08:12:28,325 - optuna.study._optimize - INFO - Trial 111 pruned. 
2026-05-13 08:12:32,011 - optuna.study._optimize - INFO - Trial 112 pruned. 
2026-05-13 08:12:36,107 - optuna.study._optimize - INFO - Trial 113 pruned. 
2026-05-13 08:12:39,625 - optuna.study._optimize - INFO - Trial 114 pruned. 
2026-05-13 08:12:44,839 - optuna.study._optimize - INFO - Trial 115 pruned. 
2026-05-13 08:12:57,098 - optuna.study._optimize - INFO - Trial 116 pruned. 
2026-05-13 08:13:02,054 - optuna.study._optimize - INFO - Trial 117 pruned. 
2026-05-13 08:13:35,953 - optuna.study.study - INFO - Trial 118 finished with value: 0.06565181333797507 and parameters: {'n_layers': 1, 'embedding_dim': 256, 'lr': 0.00028512646386558914, 'lambda_val': 1.2965415701460154e-06, 'batch_size': 1268, 'optimizer': 'RMSprop'}. Best is trial 34 with value: 0.1271187868674389.
2026-05-13 08:13:40,326 - optuna.study._optimize - INFO - Trial 119 pruned. 
2026-05-13 08:13:44,591 - optuna.study._optimize - INFO - Trial 120 pruned. 
2026-05-13 08:14:18,276 - optuna.study.study - INFO - Trial 121 finished with value: 0.10158951408753762 and parameters: {'n_layers': 1, 'embedding_dim': 256, 'lr': 0.00022223042464438337, 'lambda_val': 0.0005256541854402888, 'batch_size': 604, 'optimizer': 'RMSprop'}. Best is trial 34 with value: 0.1271187868674389.
2026-05-13 08:14:22,576 - optuna.study._optimize - INFO - Trial 122 pruned. 
2026-05-13 08:14:56,627 - optuna.study.study - INFO - Trial 123 finished with value: 0.060253880406147875 and parameters: {'n_layers': 1, 'embedding_dim': 256, 'lr': 0.0002246153160857615, 'lambda_val': 4.473893120516589e-06, 'batch_size': 3668, 'optimizer': 'RMSprop'}. Best is trial 34 with value: 0.1271187868674389.
2026-05-13 08:15:29,715 - optuna.study.study - INFO - Trial 124 finished with value: 0.07806172579450349 and parameters: {'n_layers': 1, 'embedding_dim': 256, 'lr': 0.0003508474803382885, 'lambda_val': 0.000300243730336973, 'batch_size': 584, 'optimizer': 'RMSprop'}. Best is trial 34 with value: 0.1271187868674389.
2026-05-13 08:16:01,333 - optuna.study.study - INFO - Trial 125 finished with value: 0.08631342902249618 and parameters: {'n_layers': 1, 'embedding_dim': 256, 'lr': 0.00025361220621014684, 'lambda_val': 1.3038714904018386e-05, 'batch_size': 734, 'optimizer': 'RMSprop'}. Best is trial 34 with value: 0.1271187868674389.
2026-05-13 08:16:04,944 - optuna.study._optimize - INFO - Trial 126 pruned. 
2026-05-13 08:16:09,731 - optuna.study._optimize - INFO - Trial 127 pruned. 
2026-05-13 08:16:13,504 - optuna.study._optimize - INFO - Trial 128 pruned. 
2026-05-13 08:16:17,576 - optuna.study._optimize - INFO - Trial 129 pruned. 
2026-05-13 08:16:21,467 - optuna.study._optimize - INFO - Trial 130 pruned. 
2026-05-13 08:16:54,940 - optuna.study.study - INFO - Trial 131 finished with value: 0.08335202254784053 and parameters: {'n_layers': 1, 'embedding_dim': 256, 'lr': 0.0002870029525626959, 'lambda_val': 0.0007805489687816549, 'batch_size': 621, 'optimizer': 'RMSprop'}. Best is trial 34 with value: 0.1271187868674389.
2026-05-13 08:16:59,341 - optuna.study._optimize - INFO - Trial 132 pruned. 
2026-05-13 08:17:03,612 - optuna.study._optimize - INFO - Trial 133 pruned. 
2026-05-13 08:17:36,028 - optuna.study.study - INFO - Trial 134 finished with value: 0.08299866346612325 and parameters: {'n_layers': 1, 'embedding_dim': 256, 'lr': 0.0002508004801304388, 'lambda_val': 0.002303479312207408, 'batch_size': 658, 'optimizer': 'RMSprop'}. Best is trial 34 with value: 0.1271187868674389.
2026-05-13 08:17:40,341 - optuna.study._optimize - INFO - Trial 135 pruned. 
2026-05-13 08:18:13,698 - optuna.study.study - INFO - Trial 136 finished with value: 0.07545652553402767 and parameters: {'n_layers': 1, 'embedding_dim': 256, 'lr': 0.0003566571629591284, 'lambda_val': 0.0013103951209693869, 'batch_size': 523, 'optimizer': 'RMSprop'}. Best is trial 34 with value: 0.1271187868674389.
2026-05-13 08:18:17,991 - optuna.study._optimize - INFO - Trial 137 pruned. 
2026-05-13 08:18:29,658 - optuna.study._optimize - INFO - Trial 138 pruned. 
2026-05-13 08:18:36,791 - optuna.study._optimize - INFO - Trial 139 pruned. 
2026-05-13 08:18:41,680 - optuna.study._optimize - INFO - Trial 140 pruned. 
2026-05-13 08:19:15,231 - optuna.study.study - INFO - Trial 141 finished with value: 0.09861754411289657 and parameters: {'n_layers': 1, 'embedding_dim': 256, 'lr': 0.00024113130765112805, 'lambda_val': 3.3330271309590412e-06, 'batch_size': 743, 'optimizer': 'RMSprop'}. Best is trial 34 with value: 0.1271187868674389.
2026-05-13 08:19:19,726 - optuna.study._optimize - INFO - Trial 142 pruned. 
2026-05-13 08:19:24,592 - optuna.study._optimize - INFO - Trial 143 pruned. 
2026-05-13 08:19:57,615 - optuna.study.study - INFO - Trial 144 finished with value: 0.06784428164262195 and parameters: {'n_layers': 1, 'embedding_dim': 256, 'lr': 0.00022019165254598424, 'lambda_val': 1.5860894737834932e-06, 'batch_size': 1757, 'optimizer': 'RMSprop'}. Best is trial 34 with value: 0.1271187868674389.
2026-05-13 08:20:31,041 - optuna.study.study - INFO - Trial 145 finished with value: 0.08945418538032315 and parameters: {'n_layers': 1, 'embedding_dim': 256, 'lr': 0.0004059542613294235, 'lambda_val': 5.697605003757934e-06, 'batch_size': 589, 'optimizer': 'RMSprop'}. Best is trial 34 with value: 0.1271187868674389.
2026-05-13 08:20:34,780 - optuna.study._optimize - INFO - Trial 146 pruned. 
2026-05-13 08:21:04,393 - optuna.study.study - INFO - Trial 147 finished with value: 0.09293919799031759 and parameters: {'n_layers': 1, 'embedding_dim': 128, 'lr': 0.00028162787201974185, 'lambda_val': 3.891771243008114e-06, 'batch_size': 736, 'optimizer': 'RMSprop'}. Best is trial 34 with value: 0.1271187868674389.
2026-05-13 08:21:37,854 - optuna.study.study - INFO - Trial 148 finished with value: 0.06591784224434762 and parameters: {'n_layers': 1, 'embedding_dim': 256, 'lr': 0.0007211673930407006, 'lambda_val': 2.6374168040634177e-06, 'batch_size': 1914, 'optimizer': 'RMSprop'}. Best is trial 34 with value: 0.1271187868674389.
2026-05-13 08:21:41,724 - optuna.study._optimize - INFO - Trial 149 pruned. 
2026-05-13 08:21:45,999 - optuna.study._optimize - INFO - Trial 150 pruned. 
2026-05-13 08:22:19,290 - optuna.study.study - INFO - Trial 151 finished with value: 0.09027260899118265 and parameters: {'n_layers': 1, 'embedding_dim': 256, 'lr': 0.000245557184954779, 'lambda_val': 1.3544127946540976e-06, 'batch_size': 715, 'optimizer': 'RMSprop'}. Best is trial 34 with value: 0.1271187868674389.
2026-05-13 08:22:53,807 - optuna.study.study - INFO - Trial 152 finished with value: 0.09620009072340585 and parameters: {'n_layers': 1, 'embedding_dim': 256, 'lr': 0.0002416849141040546, 'lambda_val': 2.9742144291077947e-06, 'batch_size': 765, 'optimizer': 'RMSprop'}. Best is trial 34 with value: 0.1271187868674389.
2026-05-13 08:23:25,786 - optuna.study.study - INFO - Trial 153 finished with value: 0.08372832573164976 and parameters: {'n_layers': 1, 'embedding_dim': 256, 'lr': 0.0002967462922817898, 'lambda_val': 3.135018164479487e-06, 'batch_size': 634, 'optimizer': 'RMSprop'}. Best is trial 34 with value: 0.1271187868674389.
2026-05-13 08:23:29,849 - optuna.study._optimize - INFO - Trial 154 pruned. 
2026-05-13 08:24:05,908 - optuna.study.study - INFO - Trial 155 finished with value: 0.057658163929898025 and parameters: {'n_layers': 1, 'embedding_dim': 256, 'lr': 0.00019432592346577167, 'lambda_val': 1.21703010896904e-06, 'batch_size': 3425, 'optimizer': 'RMSprop'}. Best is trial 34 with value: 0.1271187868674389.
2026-05-13 08:24:09,673 - optuna.study._optimize - INFO - Trial 156 pruned. 
2026-05-13 08:24:43,569 - optuna.study.study - INFO - Trial 157 finished with value: 0.07662421488512798 and parameters: {'n_layers': 1, 'embedding_dim': 256, 'lr': 0.0002438643516158511, 'lambda_val': 0.00013878002438300226, 'batch_size': 1644, 'optimizer': 'RMSprop'}. Best is trial 34 with value: 0.1271187868674389.
2026-05-13 08:24:48,018 - optuna.study._optimize - INFO - Trial 158 pruned. 
2026-05-13 08:25:20,957 - optuna.study.study - INFO - Trial 159 finished with value: 0.06436766023619897 and parameters: {'n_layers': 1, 'embedding_dim': 256, 'lr': 0.00031638500337811644, 'lambda_val': 1.674109961773069e-06, 'batch_size': 1580, 'optimizer': 'RMSprop'}. Best is trial 34 with value: 0.1271187868674389.
2026-05-13 08:25:24,710 - optuna.study._optimize - INFO - Trial 160 pruned. 
2026-05-13 08:25:54,755 - optuna.study.study - INFO - Trial 161 finished with value: 0.11036769339021545 and parameters: {'n_layers': 1, 'embedding_dim': 256, 'lr': 0.00022206883868397043, 'lambda_val': 4.2747564101735335e-06, 'batch_size': 730, 'optimizer': 'RMSprop'}. Best is trial 34 with value: 0.1271187868674389.
2026-05-13 08:25:58,751 - optuna.study._optimize - INFO - Trial 162 pruned. 
2026-05-13 08:26:32,287 - optuna.study.study - INFO - Trial 163 finished with value: 0.060217100530252 and parameters: {'n_layers': 1, 'embedding_dim': 256, 'lr': 0.00021894947161871014, 'lambda_val': 9.269837888060696e-06, 'batch_size': 2916, 'optimizer': 'RMSprop'}. Best is trial 34 with value: 0.1271187868674389.
2026-05-13 08:26:36,254 - optuna.study._optimize - INFO - Trial 164 pruned. 
2026-05-13 08:26:40,452 - optuna.study._optimize - INFO - Trial 165 pruned. 
2026-05-13 08:27:10,978 - optuna.study.study - INFO - Trial 166 finished with value: 0.08037823482100699 and parameters: {'n_layers': 1, 'embedding_dim': 128, 'lr': 0.0002664900743506793, 'lambda_val': 2.951238825408071e-05, 'batch_size': 1219, 'optimizer': 'RMSprop'}. Best is trial 34 with value: 0.1271187868674389.
2026-05-13 08:27:15,228 - optuna.study._optimize - INFO - Trial 167 pruned. 
2026-05-13 08:27:20,745 - optuna.study._optimize - INFO - Trial 168 pruned. 
2026-05-13 08:27:25,119 - optuna.study._optimize - INFO - Trial 169 pruned. 
2026-05-13 08:27:28,874 - optuna.study._optimize - INFO - Trial 170 pruned. 
2026-05-13 08:28:11,213 - optuna.study.study - INFO - Trial 171 finished with value: 0.0987402735192596 and parameters: {'n_layers': 1, 'embedding_dim': 256, 'lr': 0.0002465326966203577, 'lambda_val': 3.7213051179965593e-06, 'batch_size': 735, 'optimizer': 'RMSprop'}. Best is trial 34 with value: 0.1271187868674389.
2026-05-13 08:28:44,441 - optuna.study.study - INFO - Trial 172 finished with value: 0.08430980182301598 and parameters: {'n_layers': 1, 'embedding_dim': 256, 'lr': 0.00024288454433151849, 'lambda_val': 4.297170185382337e-06, 'batch_size': 939, 'optimizer': 'RMSprop'}. Best is trial 34 with value: 0.1271187868674389.
2026-05-13 08:28:48,658 - optuna.study._optimize - INFO - Trial 173 pruned. 
2026-05-13 08:29:22,620 - optuna.study.study - INFO - Trial 174 finished with value: 0.08487489816597532 and parameters: {'n_layers': 1, 'embedding_dim': 256, 'lr': 0.00028673723690837184, 'lambda_val': 4.0383757940429965e-06, 'batch_size': 622, 'optimizer': 'RMSprop'}. Best is trial 34 with value: 0.1271187868674389.
2026-05-13 08:29:27,126 - optuna.study._optimize - INFO - Trial 175 pruned. 
2026-05-13 08:29:31,869 - optuna.study._optimize - INFO - Trial 176 pruned. 
2026-05-13 08:29:35,822 - optuna.study._optimize - INFO - Trial 177 pruned. 
2026-05-13 08:29:39,776 - optuna.study._optimize - INFO - Trial 178 pruned. 
2026-05-13 08:29:43,602 - optuna.study._optimize - INFO - Trial 179 pruned. 
2026-05-13 08:29:48,059 - optuna.study._optimize - INFO - Trial 180 pruned. 
2026-05-13 08:30:22,140 - optuna.study.study - INFO - Trial 181 finished with value: 0.10516726014647802 and parameters: {'n_layers': 1, 'embedding_dim': 256, 'lr': 0.0002593647239612884, 'lambda_val': 3.203290857039367e-06, 'batch_size': 559, 'optimizer': 'RMSprop'}. Best is trial 34 with value: 0.1271187868674389.
2026-05-13 08:30:55,429 - optuna.study.study - INFO - Trial 182 finished with value: 0.08649777816097699 and parameters: {'n_layers': 1, 'embedding_dim': 256, 'lr': 0.0003900773451010474, 'lambda_val': 3.0446078802196257e-06, 'batch_size': 517, 'optimizer': 'RMSprop'}. Best is trial 34 with value: 0.1271187868674389.
2026-05-13 08:30:59,680 - optuna.study._optimize - INFO - Trial 183 pruned. 
2026-05-13 08:31:04,565 - optuna.study._optimize - INFO - Trial 184 pruned. 
2026-05-13 08:31:08,953 - optuna.study._optimize - INFO - Trial 185 pruned. 
2026-05-13 08:31:12,963 - optuna.study._optimize - INFO - Trial 186 pruned. 
2026-05-13 08:31:45,939 - optuna.study.study - INFO - Trial 187 finished with value: 0.08908554205185974 and parameters: {'n_layers': 1, 'embedding_dim': 256, 'lr': 0.00026270207063337444, 'lambda_val': 1.4462254539446424e-06, 'batch_size': 719, 'optimizer': 'RMSprop'}. Best is trial 34 with value: 0.1271187868674389.
2026-05-13 08:31:50,035 - optuna.study._optimize - INFO - Trial 188 pruned. 
2026-05-13 08:31:53,890 - optuna.study._optimize - INFO - Trial 189 pruned. 
2026-05-13 08:32:27,203 - optuna.study.study - INFO - Trial 190 finished with value: 0.06190430262595842 and parameters: {'n_layers': 1, 'embedding_dim': 256, 'lr': 0.000493169480336164, 'lambda_val': 3.7621831355460217e-06, 'batch_size': 590, 'optimizer': 'RMSprop'}. Best is trial 34 with value: 0.1271187868674389.
2026-05-13 08:33:00,506 - optuna.study.study - INFO - Trial 191 finished with value: 0.09409226839257072 and parameters: {'n_layers': 1, 'embedding_dim': 256, 'lr': 0.00023193974913608638, 'lambda_val': 2.7099165661260976e-06, 'batch_size': 745, 'optimizer': 'RMSprop'}. Best is trial 34 with value: 0.1271187868674389.
2026-05-13 08:33:34,020 - optuna.study.study - INFO - Trial 192 finished with value: 0.09865009302748913 and parameters: {'n_layers': 1, 'embedding_dim': 256, 'lr': 0.0003181588659880426, 'lambda_val': 1.9935434943929963e-06, 'batch_size': 659, 'optimizer': 'RMSprop'}. Best is trial 34 with value: 0.1271187868674389.
2026-05-13 08:34:16,580 - optuna.study.study - INFO - Trial 193 finished with value: 0.0721886592021834 and parameters: {'n_layers': 1, 'embedding_dim': 256, 'lr': 0.00032579715211109803, 'lambda_val': 2.1780716346568094e-06, 'batch_size': 653, 'optimizer': 'RMSprop'}. Best is trial 34 with value: 0.1271187868674389.
2026-05-13 08:34:20,949 - optuna.study._optimize - INFO - Trial 194 pruned. 
2026-05-13 08:34:25,937 - optuna.study._optimize - INFO - Trial 195 pruned. 
2026-05-13 08:34:29,914 - optuna.study._optimize - INFO - Trial 196 pruned. 
2026-05-13 08:35:02,609 - optuna.study.study - INFO - Trial 197 finished with value: 0.08161211055169999 and parameters: {'n_layers': 1, 'embedding_dim': 256, 'lr': 0.00027402978486271585, 'lambda_val': 2.0629157668608497e-06, 'batch_size': 897, 'optimizer': 'RMSprop'}. Best is trial 34 with value: 0.1271187868674389.
2026-05-13 08:35:06,892 - optuna.study._optimize - INFO - Trial 198 pruned. 
2026-05-13 08:35:10,702 - optuna.study._optimize - INFO - Trial 199 pruned. 
2026-05-13 08:35:32,944 - root - INFO -   **** Training e_100K_1c1dcs_rand3
2026-05-13 08:35:32,954 - root - INFO -   **** Getting 53072/65410 random edges
2026-05-13 08:35:33,773 - optuna.storages._rdb.storage - INFO - A new study created in RDB with name: Study_e_100K_1c1dcs_rand3
2026-05-13 08:36:10,101 - optuna.study.study - INFO - Trial 0 finished with value: 0.016817908447949358 and parameters: {'n_layers': 4, 'embedding_dim': 64, 'lr': 0.002810139681375607, 'lambda_val': 8.425331103944136e-06, 'batch_size': 1956, 'optimizer': 'RMSprop'}. Best is trial 0 with value: 0.016817908447949358.
2026-05-13 08:36:42,207 - optuna.study.study - INFO - Trial 1 finished with value: 0.03915274499974575 and parameters: {'n_layers': 2, 'embedding_dim': 96, 'lr': 0.0314723087607592, 'lambda_val': 0.003085000203879388, 'batch_size': 2011, 'optimizer': 'Adam'}. Best is trial 1 with value: 0.03915274499974575.
2026-05-13 08:37:14,930 - optuna.study.study - INFO - Trial 2 finished with value: 0.0019465577472648175 and parameters: {'n_layers': 2, 'embedding_dim': 128, 'lr': 0.000823691596965962, 'lambda_val': 0.001680125510474457, 'batch_size': 1227, 'optimizer': 'SGD'}. Best is trial 1 with value: 0.03915274499974575.
2026-05-13 08:37:46,843 - optuna.study.study - INFO - Trial 3 finished with value: 0.028368143681383077 and parameters: {'n_layers': 2, 'embedding_dim': 64, 'lr': 0.002798830553461171, 'lambda_val': 0.000433055883064385, 'batch_size': 2465, 'optimizer': 'Adam'}. Best is trial 1 with value: 0.03915274499974575.
2026-05-13 08:38:31,142 - optuna.study.study - INFO - Trial 4 finished with value: 0.0014274171985460844 and parameters: {'n_layers': 4, 'embedding_dim': 128, 'lr': 0.0921054244452798, 'lambda_val': 1.2546238316717886e-06, 'batch_size': 2978, 'optimizer': 'SGD'}. Best is trial 1 with value: 0.03915274499974575.
2026-05-13 08:39:02,862 - optuna.study.study - INFO - Trial 5 finished with value: 0.036756280225610415 and parameters: {'n_layers': 2, 'embedding_dim': 64, 'lr': 0.00020559410387337588, 'lambda_val': 0.00016784217106961824, 'batch_size': 1159, 'optimizer': 'Adam'}. Best is trial 1 with value: 0.03915274499974575.
2026-05-13 08:39:36,657 - optuna.study.study - INFO - Trial 6 finished with value: 0.02404734395166424 and parameters: {'n_layers': 2, 'embedding_dim': 96, 'lr': 0.0020493352544769345, 'lambda_val': 5.6890326451060865e-05, 'batch_size': 2313, 'optimizer': 'Adam'}. Best is trial 1 with value: 0.03915274499974575.
2026-05-13 08:40:11,033 - optuna.study.study - INFO - Trial 7 finished with value: 0.026273754450484813 and parameters: {'n_layers': 3, 'embedding_dim': 32, 'lr': 0.0609337484951722, 'lambda_val': 0.001532569652385297, 'batch_size': 3872, 'optimizer': 'Adam'}. Best is trial 1 with value: 0.03915274499974575.
2026-05-13 08:40:14,993 - optuna.study._optimize - INFO - Trial 8 pruned. 
2026-05-13 08:40:19,830 - optuna.study._optimize - INFO - Trial 9 pruned. 
2026-05-13 08:40:24,304 - optuna.study._optimize - INFO - Trial 10 pruned. 
2026-05-13 08:40:28,876 - optuna.study._optimize - INFO - Trial 11 pruned. 
2026-05-13 08:40:58,744 - optuna.study.study - INFO - Trial 12 finished with value: 0.08466266695161405 and parameters: {'n_layers': 1, 'embedding_dim': 96, 'lr': 0.0002259231838951389, 'lambda_val': 7.855205263602305e-05, 'batch_size': 1559, 'optimizer': 'Adam'}. Best is trial 12 with value: 0.08466266695161405.
2026-05-13 08:41:02,873 - optuna.study._optimize - INFO - Trial 13 pruned. 
2026-05-13 08:41:34,126 - optuna.study.study - INFO - Trial 14 finished with value: 0.03530946946835568 and parameters: {'n_layers': 1, 'embedding_dim': 96, 'lr': 0.012745652948366598, 'lambda_val': 4.7787765384081114e-05, 'batch_size': 2848, 'optimizer': 'Adam'}. Best is trial 12 with value: 0.08466266695161405.
