2026-05-13 21:13:59,591 - optuna.study.study - INFO - Trial 55 finished with value: 0.07559141020903924 and parameters: {'n_layers': 1, 'embedding_dim': 32, 'lr': 0.00025610021523008657, 'lambda_val': 0.0006493179885593232, 'batch_size': 980, 'optimizer': 'Adam'}. Best is trial 32 with value: 0.09772797769087545.
2026-05-13 21:14:30,213 - optuna.study.study - INFO - Trial 56 finished with value: 0.09482075250472988 and parameters: {'n_layers': 1, 'embedding_dim': 128, 'lr': 0.00015983099387374542, 'lambda_val': 0.00010868713520943937, 'batch_size': 914, 'optimizer': 'RMSprop'}. Best is trial 32 with value: 0.09772797769087545.
2026-05-13 21:14:35,787 - optuna.study._optimize - INFO - Trial 57 pruned. 
2026-05-13 21:14:39,876 - optuna.study._optimize - INFO - Trial 58 pruned. 
2026-05-13 21:14:43,761 - optuna.study._optimize - INFO - Trial 59 pruned. 
2026-05-13 21:14:47,746 - optuna.study._optimize - INFO - Trial 60 pruned. 
2026-05-13 21:14:52,272 - optuna.study._optimize - INFO - Trial 61 pruned. 
2026-05-13 21:14:56,575 - optuna.study._optimize - INFO - Trial 62 pruned. 
2026-05-13 21:15:25,733 - optuna.study.study - INFO - Trial 63 finished with value: 0.04647656042125826 and parameters: {'n_layers': 1, 'embedding_dim': 64, 'lr': 0.0008199436864707175, 'lambda_val': 0.0006433124817428529, 'batch_size': 1074, 'optimizer': 'RMSprop'}. Best is trial 32 with value: 0.09772797769087545.
2026-05-13 21:15:55,113 - optuna.study.study - INFO - Trial 64 finished with value: 0.06553010524280721 and parameters: {'n_layers': 1, 'embedding_dim': 96, 'lr': 0.00034213949672800046, 'lambda_val': 0.0008808001443972551, 'batch_size': 1293, 'optimizer': 'RMSprop'}. Best is trial 32 with value: 0.09772797769087545.
2026-05-13 21:16:24,921 - optuna.study.study - INFO - Trial 65 finished with value: 0.08677463137816578 and parameters: {'n_layers': 1, 'embedding_dim': 128, 'lr': 0.00022190833385429294, 'lambda_val': 2.1728704647010225e-05, 'batch_size': 793, 'optimizer': 'RMSprop'}. Best is trial 32 with value: 0.09772797769087545.
2026-05-13 21:16:29,013 - optuna.study._optimize - INFO - Trial 66 pruned. 
2026-05-13 21:16:37,416 - optuna.study._optimize - INFO - Trial 67 pruned. 
2026-05-13 21:16:42,652 - optuna.study._optimize - INFO - Trial 68 pruned. 
2026-05-13 21:16:47,887 - optuna.study._optimize - INFO - Trial 69 pruned. 
2026-05-13 21:16:52,294 - optuna.study._optimize - INFO - Trial 70 pruned. 
2026-05-13 21:17:23,078 - optuna.study.study - INFO - Trial 71 finished with value: 0.10625373500133882 and parameters: {'n_layers': 1, 'embedding_dim': 128, 'lr': 0.00018864826217356595, 'lambda_val': 0.00036225402520603236, 'batch_size': 795, 'optimizer': 'RMSprop'}. Best is trial 71 with value: 0.10625373500133882.
2026-05-13 21:17:27,169 - optuna.study._optimize - INFO - Trial 72 pruned. 
2026-05-13 21:17:31,483 - optuna.study._optimize - INFO - Trial 73 pruned. 
2026-05-13 21:18:03,188 - optuna.study.study - INFO - Trial 74 finished with value: 0.08914551814185909 and parameters: {'n_layers': 1, 'embedding_dim': 128, 'lr': 0.0002620125225023293, 'lambda_val': 0.0003800718041498828, 'batch_size': 979, 'optimizer': 'RMSprop'}. Best is trial 71 with value: 0.10625373500133882.
2026-05-13 21:18:41,155 - optuna.study.study - INFO - Trial 75 finished with value: 0.06141969195527778 and parameters: {'n_layers': 1, 'embedding_dim': 128, 'lr': 0.00030225980216839495, 'lambda_val': 0.00032753073404576, 'batch_size': 1015, 'optimizer': 'RMSprop'}. Best is trial 71 with value: 0.10625373500133882.
2026-05-13 21:18:46,611 - optuna.study._optimize - INFO - Trial 76 pruned. 
2026-05-13 21:19:17,536 - optuna.study.study - INFO - Trial 77 finished with value: 0.06782575910195433 and parameters: {'n_layers': 1, 'embedding_dim': 128, 'lr': 0.0007341055533048084, 'lambda_val': 3.162444783074233e-05, 'batch_size': 642, 'optimizer': 'RMSprop'}. Best is trial 71 with value: 0.10625373500133882.
2026-05-13 21:19:22,934 - optuna.study._optimize - INFO - Trial 78 pruned. 
2026-05-13 21:19:27,064 - optuna.study._optimize - INFO - Trial 79 pruned. 
2026-05-13 21:20:01,590 - optuna.study.study - INFO - Trial 80 finished with value: 0.04138243781874308 and parameters: {'n_layers': 1, 'embedding_dim': 256, 'lr': 0.0010109226226458555, 'lambda_val': 6.21699869970221e-05, 'batch_size': 522, 'optimizer': 'RMSprop'}. Best is trial 71 with value: 0.10625373500133882.
2026-05-13 21:20:05,563 - optuna.study._optimize - INFO - Trial 81 pruned. 
2026-05-13 21:20:09,683 - optuna.study._optimize - INFO - Trial 82 pruned. 
2026-05-13 21:20:15,786 - optuna.study._optimize - INFO - Trial 83 pruned. 
2026-05-13 21:20:50,799 - optuna.study.study - INFO - Trial 84 finished with value: 0.08278083040554639 and parameters: {'n_layers': 1, 'embedding_dim': 256, 'lr': 0.0003288259547283069, 'lambda_val': 0.0009636374584242356, 'batch_size': 702, 'optimizer': 'RMSprop'}. Best is trial 71 with value: 0.10625373500133882.
2026-05-13 21:20:55,086 - optuna.study._optimize - INFO - Trial 85 pruned. 
2026-05-13 21:21:00,072 - optuna.study._optimize - INFO - Trial 86 pruned. 
2026-05-13 21:21:04,532 - optuna.study._optimize - INFO - Trial 87 pruned. 
2026-05-13 21:21:35,734 - optuna.study.study - INFO - Trial 88 finished with value: 0.07070688996992941 and parameters: {'n_layers': 1, 'embedding_dim': 32, 'lr': 0.0004072651638848155, 'lambda_val': 0.00010656681914132494, 'batch_size': 1204, 'optimizer': 'RMSprop'}. Best is trial 71 with value: 0.10625373500133882.
2026-05-13 21:21:41,388 - optuna.study._optimize - INFO - Trial 89 pruned. 
2026-05-13 21:21:45,637 - optuna.study._optimize - INFO - Trial 90 pruned. 
2026-05-13 21:22:22,656 - optuna.study.study - INFO - Trial 91 finished with value: 0.08190561248819535 and parameters: {'n_layers': 1, 'embedding_dim': 256, 'lr': 0.0003422885842763605, 'lambda_val': 0.0008161039867647011, 'batch_size': 702, 'optimizer': 'RMSprop'}. Best is trial 71 with value: 0.10625373500133882.
2026-05-13 21:22:27,179 - optuna.study._optimize - INFO - Trial 92 pruned. 
2026-05-13 21:22:31,859 - optuna.study._optimize - INFO - Trial 93 pruned. 
2026-05-13 21:22:36,506 - optuna.study._optimize - INFO - Trial 94 pruned. 
2026-05-13 21:23:11,382 - optuna.study.study - INFO - Trial 95 finished with value: 0.08695298693795922 and parameters: {'n_layers': 1, 'embedding_dim': 256, 'lr': 0.0002220992474623633, 'lambda_val': 0.0007142993274945981, 'batch_size': 840, 'optimizer': 'RMSprop'}. Best is trial 71 with value: 0.10625373500133882.
2026-05-13 21:23:16,981 - optuna.study._optimize - INFO - Trial 96 pruned. 
2026-05-13 21:23:22,216 - optuna.study._optimize - INFO - Trial 97 pruned. 
2026-05-13 21:23:26,507 - optuna.study._optimize - INFO - Trial 98 pruned. 
2026-05-13 21:23:30,405 - optuna.study._optimize - INFO - Trial 99 pruned. 
2026-05-13 21:23:34,523 - optuna.study._optimize - INFO - Trial 100 pruned. 
2026-05-13 21:24:09,786 - optuna.study.study - INFO - Trial 101 finished with value: 0.08579837524560938 and parameters: {'n_layers': 1, 'embedding_dim': 256, 'lr': 0.00032291098711015586, 'lambda_val': 0.0007043295556772894, 'batch_size': 733, 'optimizer': 'RMSprop'}. Best is trial 71 with value: 0.10625373500133882.
2026-05-13 21:24:14,387 - optuna.study._optimize - INFO - Trial 102 pruned. 
2026-05-13 21:24:54,073 - optuna.study.study - INFO - Trial 103 finished with value: 0.08316037982733847 and parameters: {'n_layers': 1, 'embedding_dim': 256, 'lr': 0.00039401437824239106, 'lambda_val': 0.0005029689396773962, 'batch_size': 772, 'optimizer': 'RMSprop'}. Best is trial 71 with value: 0.10625373500133882.
2026-05-13 21:25:28,769 - optuna.study.study - INFO - Trial 104 finished with value: 0.06797921242297657 and parameters: {'n_layers': 1, 'embedding_dim': 256, 'lr': 0.0005960074020738926, 'lambda_val': 0.0003599438183162301, 'batch_size': 562, 'optimizer': 'RMSprop'}. Best is trial 71 with value: 0.10625373500133882.
2026-05-13 21:25:32,997 - optuna.study._optimize - INFO - Trial 105 pruned. 
2026-05-13 21:25:37,503 - optuna.study._optimize - INFO - Trial 106 pruned. 
2026-05-13 21:26:12,014 - optuna.study.study - INFO - Trial 107 finished with value: 0.06329779426065187 and parameters: {'n_layers': 1, 'embedding_dim': 256, 'lr': 0.00028029674357974436, 'lambda_val': 0.0007246556515785031, 'batch_size': 2090, 'optimizer': 'RMSprop'}. Best is trial 71 with value: 0.10625373500133882.
2026-05-13 21:26:16,143 - optuna.study._optimize - INFO - Trial 108 pruned. 
2026-05-13 21:26:20,274 - optuna.study._optimize - INFO - Trial 109 pruned. 
2026-05-13 21:26:24,393 - optuna.study._optimize - INFO - Trial 110 pruned. 
2026-05-13 21:26:59,569 - optuna.study.study - INFO - Trial 111 finished with value: 0.06807577852778592 and parameters: {'n_layers': 1, 'embedding_dim': 256, 'lr': 0.00048280218667642893, 'lambda_val': 0.0005182527648249943, 'batch_size': 806, 'optimizer': 'RMSprop'}. Best is trial 71 with value: 0.10625373500133882.
2026-05-13 21:27:34,155 - optuna.study.study - INFO - Trial 112 finished with value: 0.08409056199305057 and parameters: {'n_layers': 1, 'embedding_dim': 256, 'lr': 0.0003601111057051812, 'lambda_val': 0.00032652044037404947, 'batch_size': 759, 'optimizer': 'RMSprop'}. Best is trial 71 with value: 0.10625373500133882.
2026-05-13 21:27:40,860 - optuna.study._optimize - INFO - Trial 113 pruned. 
2026-05-13 21:28:15,901 - optuna.study.study - INFO - Trial 114 finished with value: 0.08424618717546889 and parameters: {'n_layers': 1, 'embedding_dim': 256, 'lr': 0.0002704573387637527, 'lambda_val': 0.000322576117953612, 'batch_size': 1027, 'optimizer': 'RMSprop'}. Best is trial 71 with value: 0.10625373500133882.
2026-05-13 21:28:51,670 - optuna.study.study - INFO - Trial 115 finished with value: 0.08703016146924629 and parameters: {'n_layers': 1, 'embedding_dim': 256, 'lr': 0.00025715571243032465, 'lambda_val': 0.0001314329311410033, 'batch_size': 1053, 'optimizer': 'RMSprop'}. Best is trial 71 with value: 0.10625373500133882.
2026-05-13 21:28:55,821 - optuna.study._optimize - INFO - Trial 116 pruned. 
2026-05-13 21:28:59,719 - optuna.study._optimize - INFO - Trial 117 pruned. 
2026-05-13 21:29:04,579 - optuna.study._optimize - INFO - Trial 118 pruned. 
2026-05-13 21:29:08,643 - optuna.study._optimize - INFO - Trial 119 pruned. 
2026-05-13 21:29:13,077 - optuna.study._optimize - INFO - Trial 120 pruned. 
2026-05-13 21:29:18,217 - optuna.study._optimize - INFO - Trial 121 pruned. 
2026-05-13 21:29:52,748 - optuna.study.study - INFO - Trial 122 finished with value: 0.08450094163619855 and parameters: {'n_layers': 1, 'embedding_dim': 256, 'lr': 0.0002679272867222003, 'lambda_val': 0.00026281772573655396, 'batch_size': 851, 'optimizer': 'RMSprop'}. Best is trial 71 with value: 0.10625373500133882.
2026-05-13 21:30:33,170 - optuna.study.study - INFO - Trial 123 finished with value: 0.10308683928191578 and parameters: {'n_layers': 1, 'embedding_dim': 256, 'lr': 0.0001941447173328224, 'lambda_val': 0.00024929496107963374, 'batch_size': 886, 'optimizer': 'RMSprop'}. Best is trial 71 with value: 0.10625373500133882.
2026-05-13 21:31:07,691 - optuna.study.study - INFO - Trial 124 finished with value: 0.09375497250943654 and parameters: {'n_layers': 1, 'embedding_dim': 256, 'lr': 0.00020936791970486908, 'lambda_val': 0.00016925414194489098, 'batch_size': 914, 'optimizer': 'RMSprop'}. Best is trial 71 with value: 0.10625373500133882.
2026-05-13 21:31:41,685 - optuna.study.study - INFO - Trial 125 finished with value: 0.09308647763379678 and parameters: {'n_layers': 1, 'embedding_dim': 256, 'lr': 0.00022142263205345375, 'lambda_val': 0.000162339710074207, 'batch_size': 901, 'optimizer': 'RMSprop'}. Best is trial 71 with value: 0.10625373500133882.
2026-05-13 21:32:14,700 - optuna.study.study - INFO - Trial 126 finished with value: 0.11213244182873397 and parameters: {'n_layers': 1, 'embedding_dim': 256, 'lr': 0.00020156036694031176, 'lambda_val': 5.4926167120701937e-05, 'batch_size': 936, 'optimizer': 'RMSprop'}. Best is trial 126 with value: 0.11213244182873397.
2026-05-13 21:32:19,067 - optuna.study._optimize - INFO - Trial 127 pruned. 
2026-05-13 21:32:23,579 - optuna.study._optimize - INFO - Trial 128 pruned. 
2026-05-13 21:32:28,004 - optuna.study._optimize - INFO - Trial 129 pruned. 
2026-05-13 21:32:32,663 - optuna.study._optimize - INFO - Trial 130 pruned. 
2026-05-13 21:33:07,795 - optuna.study.study - INFO - Trial 131 finished with value: 0.10356325108119102 and parameters: {'n_layers': 1, 'embedding_dim': 256, 'lr': 0.00021266914342551874, 'lambda_val': 2.4903692174514793e-05, 'batch_size': 817, 'optimizer': 'RMSprop'}. Best is trial 126 with value: 0.11213244182873397.
2026-05-13 21:33:12,147 - optuna.study._optimize - INFO - Trial 132 pruned. 
2026-05-13 21:33:16,823 - optuna.study._optimize - INFO - Trial 133 pruned. 
2026-05-13 21:33:50,801 - optuna.study.study - INFO - Trial 134 finished with value: 0.059196262724520374 and parameters: {'n_layers': 1, 'embedding_dim': 256, 'lr': 0.00044981223780245634, 'lambda_val': 3.847563077598654e-05, 'batch_size': 853, 'optimizer': 'RMSprop'}. Best is trial 126 with value: 0.11213244182873397.
2026-05-13 21:34:25,835 - optuna.study.study - INFO - Trial 135 finished with value: 0.0916741686380682 and parameters: {'n_layers': 1, 'embedding_dim': 256, 'lr': 0.00023566364357809042, 'lambda_val': 1.0651276622212043e-05, 'batch_size': 995, 'optimizer': 'RMSprop'}. Best is trial 126 with value: 0.11213244182873397.
2026-05-13 21:34:30,694 - optuna.study._optimize - INFO - Trial 136 pruned. 
2026-05-13 21:34:35,074 - optuna.study._optimize - INFO - Trial 137 pruned. 
2026-05-13 21:34:41,222 - optuna.study._optimize - INFO - Trial 138 pruned. 
2026-05-13 21:35:16,291 - optuna.study.study - INFO - Trial 139 finished with value: 0.09566969144639335 and parameters: {'n_layers': 1, 'embedding_dim': 256, 'lr': 0.00024666822321139963, 'lambda_val': 0.00014235567495801603, 'batch_size': 1104, 'optimizer': 'RMSprop'}. Best is trial 126 with value: 0.11213244182873397.
2026-05-13 21:35:20,726 - optuna.study._optimize - INFO - Trial 140 pruned. 
2026-05-13 21:35:25,238 - optuna.study._optimize - INFO - Trial 141 pruned. 
2026-05-13 21:35:59,620 - optuna.study.study - INFO - Trial 142 finished with value: 0.08501960516088365 and parameters: {'n_layers': 1, 'embedding_dim': 256, 'lr': 0.0002617550167068645, 'lambda_val': 2.6474193860935423e-05, 'batch_size': 1074, 'optimizer': 'RMSprop'}. Best is trial 126 with value: 0.11213244182873397.
2026-05-13 21:36:36,664 - optuna.study.study - INFO - Trial 143 finished with value: 0.08591545854409952 and parameters: {'n_layers': 1, 'embedding_dim': 256, 'lr': 0.0003040013992769236, 'lambda_val': 0.00011533363407060566, 'batch_size': 867, 'optimizer': 'RMSprop'}. Best is trial 126 with value: 0.11213244182873397.
2026-05-13 21:37:11,783 - optuna.study.study - INFO - Trial 144 finished with value: 0.10122916309657115 and parameters: {'n_layers': 1, 'embedding_dim': 256, 'lr': 0.0002337575912924063, 'lambda_val': 1.594537330791574e-05, 'batch_size': 715, 'optimizer': 'RMSprop'}. Best is trial 126 with value: 0.11213244182873397.
2026-05-13 21:37:16,080 - optuna.study._optimize - INFO - Trial 145 pruned. 
2026-05-13 21:37:20,344 - optuna.study._optimize - INFO - Trial 146 pruned. 
2026-05-13 21:37:24,269 - optuna.study._optimize - INFO - Trial 147 pruned. 
2026-05-13 21:37:58,626 - optuna.study.study - INFO - Trial 148 finished with value: 0.08118526358803281 and parameters: {'n_layers': 1, 'embedding_dim': 256, 'lr': 0.0003314554115708281, 'lambda_val': 1.01322255602516e-05, 'batch_size': 904, 'optimizer': 'RMSprop'}. Best is trial 126 with value: 0.11213244182873397.
2026-05-13 21:38:03,354 - optuna.study._optimize - INFO - Trial 149 pruned. 
2026-05-13 21:38:07,176 - optuna.study._optimize - INFO - Trial 150 pruned. 
2026-05-13 21:38:42,163 - optuna.study.study - INFO - Trial 151 finished with value: 0.09814597876416704 and parameters: {'n_layers': 1, 'embedding_dim': 256, 'lr': 0.0002443715766523657, 'lambda_val': 6.872085010477639e-06, 'batch_size': 1004, 'optimizer': 'RMSprop'}. Best is trial 126 with value: 0.11213244182873397.
2026-05-13 21:38:46,503 - optuna.study._optimize - INFO - Trial 152 pruned. 
2026-05-13 21:38:50,868 - optuna.study._optimize - INFO - Trial 153 pruned. 
2026-05-13 21:38:55,878 - optuna.study._optimize - INFO - Trial 154 pruned. 
2026-05-13 21:39:29,988 - optuna.study.study - INFO - Trial 155 finished with value: 0.07271367092863802 and parameters: {'n_layers': 1, 'embedding_dim': 256, 'lr': 0.0003982706194755474, 'lambda_val': 0.0002066859122099842, 'batch_size': 913, 'optimizer': 'RMSprop'}. Best is trial 126 with value: 0.11213244182873397.
2026-05-13 21:39:34,378 - optuna.study._optimize - INFO - Trial 156 pruned. 
2026-05-13 21:39:38,688 - optuna.study._optimize - INFO - Trial 157 pruned. 
2026-05-13 21:39:44,252 - optuna.study._optimize - INFO - Trial 158 pruned. 
2026-05-13 21:40:19,306 - optuna.study.study - INFO - Trial 159 finished with value: 0.08463870022679708 and parameters: {'n_layers': 1, 'embedding_dim': 256, 'lr': 0.00028859909422807164, 'lambda_val': 0.00024258568101372983, 'batch_size': 846, 'optimizer': 'RMSprop'}. Best is trial 126 with value: 0.11213244182873397.
2026-05-13 21:40:23,540 - optuna.study._optimize - INFO - Trial 160 pruned. 
2026-05-13 21:41:00,543 - optuna.study.study - INFO - Trial 161 finished with value: 0.0821144748265485 and parameters: {'n_layers': 1, 'embedding_dim': 256, 'lr': 0.0002358840992706331, 'lambda_val': 0.00013442279215890993, 'batch_size': 1091, 'optimizer': 'RMSprop'}. Best is trial 126 with value: 0.11213244182873397.
2026-05-13 21:41:37,211 - optuna.study.study - INFO - Trial 162 finished with value: 0.08340424054122815 and parameters: {'n_layers': 1, 'embedding_dim': 256, 'lr': 0.0003042230159163068, 'lambda_val': 2.4744713007678482e-05, 'batch_size': 947, 'optimizer': 'RMSprop'}. Best is trial 126 with value: 0.11213244182873397.
2026-05-13 21:41:41,643 - optuna.study._optimize - INFO - Trial 163 pruned. 
2026-05-13 21:41:47,951 - optuna.study._optimize - INFO - Trial 164 pruned. 
2026-05-13 21:42:23,292 - optuna.study.study - INFO - Trial 165 finished with value: 0.08176852201034383 and parameters: {'n_layers': 1, 'embedding_dim': 256, 'lr': 0.00038213885719725704, 'lambda_val': 1.1567059888676134e-05, 'batch_size': 888, 'optimizer': 'RMSprop'}. Best is trial 126 with value: 0.11213244182873397.
2026-05-13 21:42:27,732 - optuna.study._optimize - INFO - Trial 166 pruned. 
2026-05-13 21:42:32,067 - optuna.study._optimize - INFO - Trial 167 pruned. 
2026-05-13 21:42:36,360 - optuna.study._optimize - INFO - Trial 168 pruned. 
2026-05-13 21:43:09,958 - optuna.study.study - INFO - Trial 169 finished with value: 0.08627792533229744 and parameters: {'n_layers': 1, 'embedding_dim': 256, 'lr': 0.00027329405346633763, 'lambda_val': 0.00019572201351773615, 'batch_size': 969, 'optimizer': 'RMSprop'}. Best is trial 126 with value: 0.11213244182873397.
2026-05-13 21:43:39,759 - optuna.study.study - INFO - Trial 170 finished with value: 0.07778556093322678 and parameters: {'n_layers': 1, 'embedding_dim': 128, 'lr': 0.00033566063091041863, 'lambda_val': 3.14937457250268e-05, 'batch_size': 1233, 'optimizer': 'RMSprop'}. Best is trial 126 with value: 0.11213244182873397.
2026-05-13 21:43:44,733 - optuna.study._optimize - INFO - Trial 171 pruned. 
2026-05-13 21:43:50,787 - optuna.study._optimize - INFO - Trial 172 pruned. 
2026-05-13 21:43:57,374 - optuna.study._optimize - INFO - Trial 173 pruned. 
2026-05-13 21:44:01,831 - optuna.study._optimize - INFO - Trial 174 pruned. 
2026-05-13 21:44:07,344 - optuna.study._optimize - INFO - Trial 175 pruned. 
2026-05-13 21:44:11,253 - optuna.study._optimize - INFO - Trial 176 pruned. 
2026-05-13 21:44:46,358 - optuna.study.study - INFO - Trial 177 finished with value: 0.06841519220418306 and parameters: {'n_layers': 1, 'embedding_dim': 256, 'lr': 0.0004417799692163996, 'lambda_val': 9.86599374044649e-05, 'batch_size': 1046, 'optimizer': 'RMSprop'}. Best is trial 126 with value: 0.11213244182873397.
2026-05-13 21:44:51,101 - optuna.study._optimize - INFO - Trial 178 pruned. 
2026-05-13 21:44:56,961 - optuna.study._optimize - INFO - Trial 179 pruned. 
2026-05-13 21:45:01,723 - optuna.study._optimize - INFO - Trial 180 pruned. 
2026-05-13 21:45:30,798 - optuna.study.study - INFO - Trial 181 finished with value: 0.09889829995150404 and parameters: {'n_layers': 1, 'embedding_dim': 128, 'lr': 0.00021796784358498687, 'lambda_val': 9.031823441488158e-06, 'batch_size': 774, 'optimizer': 'RMSprop'}. Best is trial 126 with value: 0.11213244182873397.
2026-05-13 21:45:36,785 - optuna.study._optimize - INFO - Trial 182 pruned. 
2026-05-13 21:45:40,645 - optuna.study._optimize - INFO - Trial 183 pruned. 
2026-05-13 21:46:09,476 - optuna.study.study - INFO - Trial 184 finished with value: 0.08221213883303614 and parameters: {'n_layers': 1, 'embedding_dim': 128, 'lr': 0.00033972872622245584, 'lambda_val': 8.199623928322465e-06, 'batch_size': 992, 'optimizer': 'RMSprop'}. Best is trial 126 with value: 0.11213244182873397.
2026-05-13 21:46:13,988 - optuna.study._optimize - INFO - Trial 185 pruned. 
2026-05-13 21:46:18,544 - optuna.study._optimize - INFO - Trial 186 pruned. 
2026-05-13 21:46:22,410 - optuna.study._optimize - INFO - Trial 187 pruned. 
2026-05-13 21:46:31,477 - optuna.study._optimize - INFO - Trial 188 pruned. 
2026-05-13 21:46:36,017 - optuna.study._optimize - INFO - Trial 189 pruned. 
2026-05-13 21:47:13,609 - optuna.study.study - INFO - Trial 190 finished with value: 0.08154515282374634 and parameters: {'n_layers': 1, 'embedding_dim': 256, 'lr': 0.0002718563189029972, 'lambda_val': 0.0013708563219187256, 'batch_size': 926, 'optimizer': 'RMSprop'}. Best is trial 126 with value: 0.11213244182873397.
2026-05-13 21:47:18,010 - optuna.study._optimize - INFO - Trial 191 pruned. 
