2026-05-13 23:37:16,413 - optuna.study.study - INFO - Trial 142 finished with value: 0.08376665562626943 and parameters: {'n_layers': 1, 'embedding_dim': 128, 'lr': 0.000107444096563482, 'lambda_val': 5.666996993147064e-05, 'batch_size': 3947, 'optimizer': 'RMSprop'}. Best is trial 64 with value: 0.12286954628740858.
2026-05-13 23:37:47,683 - optuna.study.study - INFO - Trial 143 finished with value: 0.07581544915639889 and parameters: {'n_layers': 1, 'embedding_dim': 128, 'lr': 0.00014593987794826472, 'lambda_val': 1.929709980572419e-05, 'batch_size': 3884, 'optimizer': 'RMSprop'}. Best is trial 64 with value: 0.12286954628740858.
2026-05-13 23:37:58,881 - optuna.study._optimize - INFO - Trial 144 pruned. 
2026-05-13 23:38:33,200 - optuna.study.study - INFO - Trial 145 finished with value: 0.0448278670489434 and parameters: {'n_layers': 1, 'embedding_dim': 128, 'lr': 0.00021704391803062696, 'lambda_val': 2.8514126817746414e-05, 'batch_size': 3720, 'optimizer': 'RMSprop'}. Best is trial 64 with value: 0.12286954628740858.
2026-05-13 23:38:37,717 - optuna.study._optimize - INFO - Trial 146 pruned. 
2026-05-13 23:38:42,107 - optuna.study._optimize - INFO - Trial 147 pruned. 
2026-05-13 23:39:12,916 - optuna.study.study - INFO - Trial 148 finished with value: 0.09828955231988462 and parameters: {'n_layers': 1, 'embedding_dim': 128, 'lr': 0.00011753874036554956, 'lambda_val': 3.7589414933873e-05, 'batch_size': 3633, 'optimizer': 'RMSprop'}. Best is trial 64 with value: 0.12286954628740858.
2026-05-13 23:39:46,813 - optuna.study.study - INFO - Trial 149 finished with value: 0.0835864113415289 and parameters: {'n_layers': 1, 'embedding_dim': 128, 'lr': 0.00013327314464218074, 'lambda_val': 3.3556100126455496e-05, 'batch_size': 3393, 'optimizer': 'Adam'}. Best is trial 64 with value: 0.12286954628740858.
2026-05-13 23:40:15,988 - optuna.study.study - INFO - Trial 150 finished with value: 0.07562756071861197 and parameters: {'n_layers': 1, 'embedding_dim': 64, 'lr': 0.0001649118653485116, 'lambda_val': 2.3647583479339152e-06, 'batch_size': 3493, 'optimizer': 'RMSprop'}. Best is trial 64 with value: 0.12286954628740858.
2026-05-13 23:40:46,509 - optuna.study.study - INFO - Trial 151 finished with value: 0.09169819782422808 and parameters: {'n_layers': 1, 'embedding_dim': 128, 'lr': 0.00011363340579541705, 'lambda_val': 4.7066757951320833e-05, 'batch_size': 3591, 'optimizer': 'RMSprop'}. Best is trial 64 with value: 0.12286954628740858.
2026-05-13 23:40:50,983 - optuna.study._optimize - INFO - Trial 152 pruned. 
2026-05-13 23:40:55,075 - optuna.study._optimize - INFO - Trial 153 pruned. 
2026-05-13 23:40:59,222 - optuna.study._optimize - INFO - Trial 154 pruned. 
2026-05-13 23:41:06,062 - optuna.study._optimize - INFO - Trial 155 pruned. 
2026-05-13 23:41:10,004 - optuna.study._optimize - INFO - Trial 156 pruned. 
2026-05-13 23:41:14,308 - optuna.study._optimize - INFO - Trial 157 pruned. 
2026-05-13 23:41:18,446 - optuna.study._optimize - INFO - Trial 158 pruned. 
2026-05-13 23:41:22,391 - optuna.study._optimize - INFO - Trial 159 pruned. 
2026-05-13 23:41:54,189 - optuna.study.study - INFO - Trial 160 finished with value: 0.06553413446712156 and parameters: {'n_layers': 1, 'embedding_dim': 128, 'lr': 0.00014756551435201275, 'lambda_val': 2.671697094503909e-05, 'batch_size': 4096, 'optimizer': 'RMSprop'}. Best is trial 64 with value: 0.12286954628740858.
2026-05-13 23:41:58,356 - optuna.study._optimize - INFO - Trial 161 pruned. 
2026-05-13 23:42:02,363 - optuna.study._optimize - INFO - Trial 162 pruned. 
2026-05-13 23:42:35,121 - optuna.study.study - INFO - Trial 163 finished with value: 0.0919617925646243 and parameters: {'n_layers': 1, 'embedding_dim': 128, 'lr': 0.00010850881748338182, 'lambda_val': 3.154545901747734e-06, 'batch_size': 3958, 'optimizer': 'RMSprop'}. Best is trial 64 with value: 0.12286954628740858.
2026-05-13 23:43:06,752 - optuna.study.study - INFO - Trial 164 finished with value: 0.06298945296802058 and parameters: {'n_layers': 1, 'embedding_dim': 128, 'lr': 0.0001856607515271093, 'lambda_val': 4.045554830831624e-06, 'batch_size': 3837, 'optimizer': 'RMSprop'}. Best is trial 64 with value: 0.12286954628740858.
2026-05-13 23:43:37,597 - optuna.study.study - INFO - Trial 165 finished with value: 0.08387326851612556 and parameters: {'n_layers': 1, 'embedding_dim': 128, 'lr': 0.00013081475334696322, 'lambda_val': 8.429141505725069e-05, 'batch_size': 4020, 'optimizer': 'RMSprop'}. Best is trial 64 with value: 0.12286954628740858.
2026-05-13 23:43:41,711 - optuna.study._optimize - INFO - Trial 166 pruned. 
2026-05-13 23:43:46,247 - optuna.study._optimize - INFO - Trial 167 pruned. 
2026-05-13 23:44:17,652 - optuna.study.study - INFO - Trial 168 finished with value: 0.0937443579776525 and parameters: {'n_layers': 1, 'embedding_dim': 128, 'lr': 0.00011537895836025291, 'lambda_val': 8.399963454764196e-06, 'batch_size': 3738, 'optimizer': 'RMSprop'}. Best is trial 64 with value: 0.12286954628740858.
2026-05-13 23:44:25,834 - optuna.study._optimize - INFO - Trial 169 pruned. 
2026-05-13 23:45:01,246 - optuna.study.study - INFO - Trial 170 finished with value: 0.09645961609311068 and parameters: {'n_layers': 1, 'embedding_dim': 256, 'lr': 9.532302820888463e-05, 'lambda_val': 4.457219840045912e-06, 'batch_size': 3430, 'optimizer': 'RMSprop'}. Best is trial 64 with value: 0.12286954628740858.
2026-05-13 23:45:36,987 - optuna.study.study - INFO - Trial 171 finished with value: 0.10297009921095021 and parameters: {'n_layers': 1, 'embedding_dim': 256, 'lr': 9.80944642585129e-05, 'lambda_val': 6.734431852124972e-06, 'batch_size': 3389, 'optimizer': 'RMSprop'}. Best is trial 64 with value: 0.12286954628740858.
2026-05-13 23:45:41,203 - optuna.study._optimize - INFO - Trial 172 pruned. 
2026-05-13 23:46:16,524 - optuna.study.study - INFO - Trial 173 finished with value: 0.09297673701184803 and parameters: {'n_layers': 1, 'embedding_dim': 256, 'lr': 9.867203883945998e-05, 'lambda_val': 4.877276498074765e-06, 'batch_size': 3368, 'optimizer': 'RMSprop'}. Best is trial 64 with value: 0.12286954628740858.
2026-05-13 23:46:51,877 - optuna.study.study - INFO - Trial 174 finished with value: 0.0685774037995696 and parameters: {'n_layers': 1, 'embedding_dim': 256, 'lr': 0.0001460992794285458, 'lambda_val': 0.00031168665061467865, 'batch_size': 3291, 'optimizer': 'RMSprop'}. Best is trial 64 with value: 0.12286954628740858.
2026-05-13 23:46:56,367 - optuna.study._optimize - INFO - Trial 175 pruned. 
2026-05-13 23:47:31,857 - optuna.study.study - INFO - Trial 176 finished with value: 0.08061379300598605 and parameters: {'n_layers': 1, 'embedding_dim': 256, 'lr': 0.00012349196541077827, 'lambda_val': 1.1577515484913263e-06, 'batch_size': 3466, 'optimizer': 'RMSprop'}. Best is trial 64 with value: 0.12286954628740858.
2026-05-13 23:47:36,607 - optuna.study._optimize - INFO - Trial 177 pruned. 
2026-05-13 23:47:42,760 - optuna.study._optimize - INFO - Trial 178 pruned. 
2026-05-13 23:48:18,194 - optuna.study.study - INFO - Trial 179 finished with value: 0.0733928741653419 and parameters: {'n_layers': 1, 'embedding_dim': 256, 'lr': 0.00016785852494193744, 'lambda_val': 4.579476680994434e-05, 'batch_size': 4035, 'optimizer': 'RMSprop'}. Best is trial 64 with value: 0.12286954628740858.
2026-05-13 23:48:22,564 - optuna.study._optimize - INFO - Trial 180 pruned. 
2026-05-13 23:48:26,784 - optuna.study._optimize - INFO - Trial 181 pruned. 
2026-05-13 23:48:57,852 - optuna.study.study - INFO - Trial 182 finished with value: 0.08691011600979327 and parameters: {'n_layers': 1, 'embedding_dim': 128, 'lr': 0.00011949337799020438, 'lambda_val': 4.373002487972706e-06, 'batch_size': 3659, 'optimizer': 'RMSprop'}. Best is trial 64 with value: 0.12286954628740858.
2026-05-13 23:49:02,205 - optuna.study._optimize - INFO - Trial 183 pruned. 
2026-05-13 23:49:06,395 - optuna.study._optimize - INFO - Trial 184 pruned. 
2026-05-13 23:49:38,554 - optuna.study.study - INFO - Trial 185 finished with value: 0.08769530836093532 and parameters: {'n_layers': 1, 'embedding_dim': 128, 'lr': 0.0001389716614815788, 'lambda_val': 8.434048406281412e-06, 'batch_size': 3821, 'optimizer': 'RMSprop'}. Best is trial 64 with value: 0.12286954628740858.
2026-05-13 23:49:42,927 - optuna.study._optimize - INFO - Trial 186 pruned. 
2026-05-13 23:50:20,794 - optuna.study.study - INFO - Trial 187 finished with value: 0.1143105165685253 and parameters: {'n_layers': 1, 'embedding_dim': 256, 'lr': 8.532110920248369e-05, 'lambda_val': 2.679806154240018e-06, 'batch_size': 3890, 'optimizer': 'RMSprop'}. Best is trial 64 with value: 0.12286954628740858.
2026-05-13 23:50:25,332 - optuna.study._optimize - INFO - Trial 188 pruned. 
2026-05-13 23:50:29,674 - optuna.study._optimize - INFO - Trial 189 pruned. 
2026-05-13 23:50:34,689 - optuna.study._optimize - INFO - Trial 190 pruned. 
2026-05-13 23:50:39,595 - optuna.study._optimize - INFO - Trial 191 pruned. 
2026-05-13 23:50:43,926 - optuna.study._optimize - INFO - Trial 192 pruned. 
2026-05-13 23:50:48,041 - optuna.study._optimize - INFO - Trial 193 pruned. 
2026-05-13 23:51:24,295 - optuna.study.study - INFO - Trial 194 finished with value: 0.07880261981991818 and parameters: {'n_layers': 1, 'embedding_dim': 256, 'lr': 0.00013457895602305854, 'lambda_val': 0.0011221746062021769, 'batch_size': 3950, 'optimizer': 'RMSprop'}. Best is trial 64 with value: 0.12286954628740858.
2026-05-13 23:51:55,867 - optuna.study.study - INFO - Trial 195 finished with value: 0.10297138521558172 and parameters: {'n_layers': 1, 'embedding_dim': 128, 'lr': 0.00010550151835447026, 'lambda_val': 5.8132763319192764e-05, 'batch_size': 3712, 'optimizer': 'RMSprop'}. Best is trial 64 with value: 0.12286954628740858.
2026-05-13 23:52:00,215 - optuna.study._optimize - INFO - Trial 196 pruned. 
2026-05-13 23:52:04,715 - optuna.study._optimize - INFO - Trial 197 pruned. 
2026-05-13 23:52:38,114 - optuna.study.study - INFO - Trial 198 finished with value: 0.10063001190851738 and parameters: {'n_layers': 1, 'embedding_dim': 128, 'lr': 0.00010318195767972956, 'lambda_val': 9.257816900943402e-05, 'batch_size': 3640, 'optimizer': 'RMSprop'}. Best is trial 64 with value: 0.12286954628740858.
2026-05-13 23:52:42,211 - optuna.study._optimize - INFO - Trial 199 pruned. 
2026-05-13 23:53:05,597 - root - INFO -   **** Training e_100K_1c3dcs_rand3
2026-05-13 23:53:05,608 - root - INFO -   **** Getting 56335/65410 random edges
2026-05-13 23:53:05,708 - optuna.storages._rdb.storage - INFO - A new study created in RDB with name: Study_e_100K_1c3dcs_rand3
2026-05-13 23:53:51,501 - optuna.study.study - INFO - Trial 0 finished with value: 0.08315360249196248 and parameters: {'n_layers': 1, 'embedding_dim': 256, 'lr': 3.212911330456818e-05, 'lambda_val': 0.013454590558194214, 'batch_size': 2940, 'optimizer': 'RMSprop'}. Best is trial 0 with value: 0.08315360249196248.
2026-05-13 23:54:59,752 - optuna.study.study - INFO - Trial 1 finished with value: 0.027418162622250046 and parameters: {'n_layers': 2, 'embedding_dim': 256, 'lr': 0.01746472885702237, 'lambda_val': 1.5303834071773482e-06, 'batch_size': 1495, 'optimizer': 'RMSprop'}. Best is trial 0 with value: 0.08315360249196248.
2026-05-13 23:55:45,729 - optuna.study.study - INFO - Trial 2 finished with value: 0.07145246855335625 and parameters: {'n_layers': 1, 'embedding_dim': 64, 'lr': 0.004692635896322616, 'lambda_val': 0.004284528997520789, 'batch_size': 3533, 'optimizer': 'Adam'}. Best is trial 0 with value: 0.08315360249196248.
2026-05-13 23:56:26,105 - optuna.study.study - INFO - Trial 3 finished with value: 0.08220048508097348 and parameters: {'n_layers': 1, 'embedding_dim': 128, 'lr': 0.004851985304245645, 'lambda_val': 0.002720302431921993, 'batch_size': 2744, 'optimizer': 'RMSprop'}. Best is trial 0 with value: 0.08315360249196248.
2026-05-13 23:57:19,853 - optuna.study.study - INFO - Trial 4 finished with value: 0.02936261801219969 and parameters: {'n_layers': 3, 'embedding_dim': 256, 'lr': 0.0016430008165603232, 'lambda_val': 6.39741444856357e-06, 'batch_size': 590, 'optimizer': 'RMSprop'}. Best is trial 0 with value: 0.08315360249196248.
2026-05-13 23:57:41,981 - optuna.study._optimize - INFO - Trial 5 pruned. 
2026-05-13 23:57:50,180 - optuna.study._optimize - INFO - Trial 6 pruned. 
2026-05-13 23:57:55,151 - optuna.study._optimize - INFO - Trial 7 pruned. 
2026-05-13 23:58:01,210 - optuna.study._optimize - INFO - Trial 8 pruned. 
2026-05-13 23:58:09,664 - optuna.study._optimize - INFO - Trial 9 pruned. 
2026-05-13 23:58:15,262 - optuna.study._optimize - INFO - Trial 10 pruned. 
2026-05-13 23:58:21,893 - optuna.study._optimize - INFO - Trial 11 pruned. 
2026-05-13 23:58:57,209 - optuna.study.study - INFO - Trial 12 finished with value: 0.04974313358990723 and parameters: {'n_layers': 1, 'embedding_dim': 128, 'lr': 0.0002276979037847198, 'lambda_val': 0.008765555841339022, 'batch_size': 1752, 'optimizer': 'RMSprop'}. Best is trial 0 with value: 0.08315360249196248.
2026-05-13 23:59:31,989 - optuna.study.study - INFO - Trial 13 finished with value: 0.05206000821502387 and parameters: {'n_layers': 1, 'embedding_dim': 96, 'lr': 0.0014743503933078164, 'lambda_val': 0.00019735255443275332, 'batch_size': 3371, 'optimizer': 'RMSprop'}. Best is trial 0 with value: 0.08315360249196248.
2026-05-13 23:59:36,318 - optuna.study._optimize - INFO - Trial 14 pruned. 
2026-05-13 23:59:40,282 - optuna.study._optimize - INFO - Trial 15 pruned. 
2026-05-13 23:59:46,407 - optuna.study._optimize - INFO - Trial 16 pruned. 
2026-05-13 23:59:51,203 - optuna.study._optimize - INFO - Trial 17 pruned. 
2026-05-13 23:59:55,345 - optuna.study._optimize - INFO - Trial 18 pruned. 
2026-05-14 00:00:00,023 - optuna.study._optimize - INFO - Trial 19 pruned. 
2026-05-14 00:00:29,699 - optuna.study.study - INFO - Trial 20 finished with value: 0.041933349824310975 and parameters: {'n_layers': 1, 'embedding_dim': 32, 'lr': 0.0007219980686676804, 'lambda_val': 0.00040340519872598653, 'batch_size': 1934, 'optimizer': 'RMSprop'}. Best is trial 0 with value: 0.08315360249196248.
2026-05-14 00:00:34,388 - optuna.study._optimize - INFO - Trial 21 pruned. 
2026-05-14 00:00:38,198 - optuna.study._optimize - INFO - Trial 22 pruned. 
2026-05-14 00:01:08,031 - optuna.study.study - INFO - Trial 23 finished with value: 0.08216930380864605 and parameters: {'n_layers': 1, 'embedding_dim': 64, 'lr': 0.010128448104834108, 'lambda_val': 0.0025735223075152103, 'batch_size': 3333, 'optimizer': 'Adam'}. Best is trial 0 with value: 0.08315360249196248.
2026-05-14 00:01:12,724 - optuna.study._optimize - INFO - Trial 24 pruned. 
2026-05-14 00:01:17,036 - optuna.study._optimize - INFO - Trial 25 pruned. 
2026-05-14 00:01:20,792 - optuna.study._optimize - INFO - Trial 26 pruned. 
2026-05-14 00:02:03,442 - optuna.study.study - INFO - Trial 27 finished with value: 0.03748003455114649 and parameters: {'n_layers': 1, 'embedding_dim': 64, 'lr': 0.0021465084843705078, 'lambda_val': 6.559058330671281e-05, 'batch_size': 4068, 'optimizer': 'RMSprop'}. Best is trial 0 with value: 0.08315360249196248.
2026-05-14 00:02:08,345 - optuna.study._optimize - INFO - Trial 28 pruned. 
2026-05-14 00:02:13,438 - optuna.study._optimize - INFO - Trial 29 pruned. 
2026-05-14 00:02:18,951 - optuna.study._optimize - INFO - Trial 30 pruned. 
2026-05-14 00:02:48,809 - optuna.study.study - INFO - Trial 31 finished with value: 0.07865849535544797 and parameters: {'n_layers': 1, 'embedding_dim': 64, 'lr': 0.0068129522233193966, 'lambda_val': 0.003980309460355666, 'batch_size': 3515, 'optimizer': 'Adam'}. Best is trial 0 with value: 0.08315360249196248.
2026-05-14 00:02:52,013 - optuna.study._optimize - INFO - Trial 32 pruned. 
2026-05-14 00:03:19,689 - optuna.study.study - INFO - Trial 33 finished with value: 0.07045253464884488 and parameters: {'n_layers': 1, 'embedding_dim': 64, 'lr': 0.0022871914252624134, 'lambda_val': 0.00213684617592257, 'batch_size': 3348, 'optimizer': 'Adam'}. Best is trial 0 with value: 0.08315360249196248.
2026-05-14 00:03:23,046 - optuna.study._optimize - INFO - Trial 34 pruned. 
2026-05-14 00:03:57,102 - optuna.study.study - INFO - Trial 35 finished with value: 0.06831986651371245 and parameters: {'n_layers': 1, 'embedding_dim': 256, 'lr': 0.0010711431372380077, 'lambda_val': 0.00625311732372454, 'batch_size': 3170, 'optimizer': 'Adam'}. Best is trial 0 with value: 0.08315360249196248.
2026-05-14 00:04:01,036 - optuna.study._optimize - INFO - Trial 36 pruned. 
2026-05-14 00:04:05,016 - optuna.study._optimize - INFO - Trial 37 pruned. 
2026-05-14 00:04:09,250 - optuna.study._optimize - INFO - Trial 38 pruned. 
2026-05-14 00:04:13,539 - optuna.study._optimize - INFO - Trial 39 pruned. 
2026-05-14 00:04:17,508 - optuna.study._optimize - INFO - Trial 40 pruned. 
2026-05-14 00:04:23,055 - optuna.study._optimize - INFO - Trial 41 pruned. 
2026-05-14 00:04:57,857 - optuna.study.study - INFO - Trial 42 finished with value: 0.06675695771875062 and parameters: {'n_layers': 1, 'embedding_dim': 64, 'lr': 0.0032303156252919316, 'lambda_val': 0.0034399751030324034, 'batch_size': 3175, 'optimizer': 'Adam'}. Best is trial 0 with value: 0.08315360249196248.
2026-05-14 00:05:29,097 - optuna.study.study - INFO - Trial 43 finished with value: 0.05009297938325088 and parameters: {'n_layers': 1, 'embedding_dim': 64, 'lr': 0.001051617818253857, 'lambda_val': 0.0009311629864847839, 'batch_size': 2778, 'optimizer': 'Adam'}. Best is trial 0 with value: 0.08315360249196248.
2026-05-14 00:05:58,500 - optuna.study.study - INFO - Trial 44 finished with value: 0.04405500686867335 and parameters: {'n_layers': 1, 'embedding_dim': 64, 'lr': 0.0015987333715859011, 'lambda_val': 9.622482303180077e-05, 'batch_size': 2430, 'optimizer': 'RMSprop'}. Best is trial 0 with value: 0.08315360249196248.
2026-05-14 00:06:03,195 - optuna.study._optimize - INFO - Trial 45 pruned. 
2026-05-14 00:06:47,739 - optuna.study.study - INFO - Trial 46 finished with value: 0.029625969509018985 and parameters: {'n_layers': 2, 'embedding_dim': 256, 'lr': 0.0003270695204069839, 'lambda_val': 2.0864330587960163e-05, 'batch_size': 3462, 'optimizer': 'RMSprop'}. Best is trial 0 with value: 0.08315360249196248.
2026-05-14 00:06:52,571 - optuna.study._optimize - INFO - Trial 47 pruned. 
2026-05-14 00:06:56,900 - optuna.study._optimize - INFO - Trial 48 pruned. 
2026-05-14 00:07:01,757 - optuna.study._optimize - INFO - Trial 49 pruned. 
2026-05-14 00:07:33,646 - optuna.study.study - INFO - Trial 50 finished with value: 0.07986578517601771 and parameters: {'n_layers': 1, 'embedding_dim': 128, 'lr': 0.02157523783014909, 'lambda_val': 0.002632957502063496, 'batch_size': 2080, 'optimizer': 'RMSprop'}. Best is trial 0 with value: 0.08315360249196248.
2026-05-14 00:07:37,713 - optuna.study._optimize - INFO - Trial 51 pruned. 
2026-05-14 00:07:41,832 - optuna.study._optimize - INFO - Trial 52 pruned. 
2026-05-14 00:08:13,445 - optuna.study.study - INFO - Trial 53 finished with value: 0.07292947039041119 and parameters: {'n_layers': 1, 'embedding_dim': 128, 'lr': 0.005964839353016679, 'lambda_val': 0.0007224121485702449, 'batch_size': 2818, 'optimizer': 'RMSprop'}. Best is trial 0 with value: 0.08315360249196248.
2026-05-14 00:08:45,133 - optuna.study.study - INFO - Trial 54 finished with value: 0.07847309461921796 and parameters: {'n_layers': 1, 'embedding_dim': 128, 'lr': 0.011905321301193405, 'lambda_val': 0.0007729884737171124, 'batch_size': 2585, 'optimizer': 'RMSprop'}. Best is trial 0 with value: 0.08315360249196248.
2026-05-14 00:09:17,458 - optuna.study.study - INFO - Trial 55 finished with value: 0.08183365506857622 and parameters: {'n_layers': 1, 'embedding_dim': 128, 'lr': 0.012501485571869735, 'lambda_val': 0.0013236104857147599, 'batch_size': 2555, 'optimizer': 'RMSprop'}. Best is trial 0 with value: 0.08315360249196248.
2026-05-14 00:09:49,327 - optuna.study.study - INFO - Trial 56 finished with value: 0.0770467571458073 and parameters: {'n_layers': 1, 'embedding_dim': 128, 'lr': 0.01831185820478422, 'lambda_val': 0.002204224614837422, 'batch_size': 2460, 'optimizer': 'RMSprop'}. Best is trial 0 with value: 0.08315360249196248.
2026-05-14 00:09:53,579 - optuna.study._optimize - INFO - Trial 57 pruned. 
2026-05-14 00:09:58,021 - optuna.study._optimize - INFO - Trial 58 pruned. 
2026-05-14 00:10:02,075 - optuna.study._optimize - INFO - Trial 59 pruned. 
2026-05-14 00:10:07,323 - optuna.study._optimize - INFO - Trial 60 pruned. 
2026-05-14 00:10:39,784 - optuna.study.study - INFO - Trial 61 finished with value: 0.08530549393724854 and parameters: {'n_layers': 1, 'embedding_dim': 128, 'lr': 0.012028596517437047, 'lambda_val': 0.0009167918784518556, 'batch_size': 2583, 'optimizer': 'RMSprop'}. Best is trial 61 with value: 0.08530549393724854.
2026-05-14 00:10:47,112 - optuna.study._optimize - INFO - Trial 62 pruned. 
2026-05-14 00:10:51,471 - optuna.study._optimize - INFO - Trial 63 pruned. 
2026-05-14 00:11:23,212 - optuna.study.study - INFO - Trial 64 finished with value: 0.08511367274185322 and parameters: {'n_layers': 1, 'embedding_dim': 128, 'lr': 0.009423063521756474, 'lambda_val': 0.0011830361307225046, 'batch_size': 3010, 'optimizer': 'RMSprop'}. Best is trial 61 with value: 0.08530549393724854.
2026-05-14 00:11:54,499 - optuna.study.study - INFO - Trial 65 finished with value: 0.0836536544941781 and parameters: {'n_layers': 1, 'embedding_dim': 128, 'lr': 0.010723569053514974, 'lambda_val': 0.001339720195928876, 'batch_size': 3043, 'optimizer': 'RMSprop'}. Best is trial 61 with value: 0.08530549393724854.
2026-05-14 00:12:26,686 - optuna.study.study - INFO - Trial 66 finished with value: 0.07895434429459722 and parameters: {'n_layers': 1, 'embedding_dim': 128, 'lr': 0.008681582454979964, 'lambda_val': 0.001102760055900883, 'batch_size': 3001, 'optimizer': 'RMSprop'}. Best is trial 61 with value: 0.08530549393724854.
2026-05-14 00:12:31,181 - optuna.study._optimize - INFO - Trial 67 pruned. 
