2026-05-13 11:50:34,133 - optuna.study.study - INFO - Trial 161 finished with value: 0.07723224324935563 and parameters: {'n_layers': 1, 'embedding_dim': 256, 'lr': 0.003077075805523351, 'lambda_val': 0.0017780807643150548, 'batch_size': 2003, 'optimizer': 'Adam'}. Best is trial 152 with value: 0.08017591355480087.
2026-05-13 11:51:08,912 - optuna.study.study - INFO - Trial 162 finished with value: 0.08002871513323692 and parameters: {'n_layers': 1, 'embedding_dim': 256, 'lr': 0.0028871373353290004, 'lambda_val': 0.0017603641600477072, 'batch_size': 2267, 'optimizer': 'Adam'}. Best is trial 152 with value: 0.08017591355480087.
2026-05-13 11:51:43,838 - optuna.study.study - INFO - Trial 163 finished with value: 0.07594891960734106 and parameters: {'n_layers': 1, 'embedding_dim': 256, 'lr': 0.003322160027922167, 'lambda_val': 0.0016786514181278446, 'batch_size': 2056, 'optimizer': 'Adam'}. Best is trial 152 with value: 0.08017591355480087.
2026-05-13 11:52:18,607 - optuna.study.study - INFO - Trial 164 finished with value: 0.08020663652010113 and parameters: {'n_layers': 1, 'embedding_dim': 256, 'lr': 0.003194652890450287, 'lambda_val': 0.0015590031781894786, 'batch_size': 2299, 'optimizer': 'Adam'}. Best is trial 164 with value: 0.08020663652010113.
2026-05-13 11:52:53,619 - optuna.study.study - INFO - Trial 165 finished with value: 0.07600961131019297 and parameters: {'n_layers': 1, 'embedding_dim': 256, 'lr': 0.0034725723996660296, 'lambda_val': 0.0015562745834878625, 'batch_size': 2282, 'optimizer': 'Adam'}. Best is trial 164 with value: 0.08020663652010113.
2026-05-13 11:52:57,969 - optuna.study._optimize - INFO - Trial 166 pruned. 
2026-05-13 11:53:33,566 - optuna.study.study - INFO - Trial 167 finished with value: 0.07548922663474306 and parameters: {'n_layers': 1, 'embedding_dim': 256, 'lr': 0.003682671963397245, 'lambda_val': 0.0010178435336800856, 'batch_size': 2472, 'optimizer': 'Adam'}. Best is trial 164 with value: 0.08020663652010113.
2026-05-13 11:54:09,731 - optuna.study.study - INFO - Trial 168 finished with value: 0.07179392541630353 and parameters: {'n_layers': 1, 'embedding_dim': 256, 'lr': 0.0037955727729930915, 'lambda_val': 0.001024210731371729, 'batch_size': 2508, 'optimizer': 'Adam'}. Best is trial 164 with value: 0.08020663652010113.
2026-05-13 11:54:16,583 - optuna.study._optimize - INFO - Trial 169 pruned. 
2026-05-13 11:54:20,551 - optuna.study._optimize - INFO - Trial 170 pruned. 
2026-05-13 11:54:25,303 - optuna.study._optimize - INFO - Trial 171 pruned. 
2026-05-13 11:54:59,372 - optuna.study.study - INFO - Trial 172 finished with value: 0.07114007682468187 and parameters: {'n_layers': 1, 'embedding_dim': 256, 'lr': 0.004123082741595336, 'lambda_val': 0.0018240019852383768, 'batch_size': 2122, 'optimizer': 'Adam'}. Best is trial 164 with value: 0.08020663652010113.
2026-05-13 11:55:33,718 - optuna.study.study - INFO - Trial 173 finished with value: 0.07700182581967559 and parameters: {'n_layers': 1, 'embedding_dim': 256, 'lr': 0.0032060079692202963, 'lambda_val': 0.0015018387221825814, 'batch_size': 2050, 'optimizer': 'Adam'}. Best is trial 164 with value: 0.08020663652010113.
2026-05-13 11:56:09,455 - optuna.study.study - INFO - Trial 174 finished with value: 0.07152717086602295 and parameters: {'n_layers': 1, 'embedding_dim': 256, 'lr': 0.003163126254785024, 'lambda_val': 0.0011943504710852804, 'batch_size': 2189, 'optimizer': 'Adam'}. Best is trial 164 with value: 0.08020663652010113.
2026-05-13 11:56:44,382 - optuna.study.study - INFO - Trial 175 finished with value: 0.07036194556739268 and parameters: {'n_layers': 1, 'embedding_dim': 256, 'lr': 0.0015938388198509811, 'lambda_val': 0.002952698671500229, 'batch_size': 2344, 'optimizer': 'Adam'}. Best is trial 164 with value: 0.08020663652010113.
2026-05-13 11:57:18,734 - optuna.study.study - INFO - Trial 176 finished with value: 0.07119409809912261 and parameters: {'n_layers': 1, 'embedding_dim': 256, 'lr': 0.002624301459608173, 'lambda_val': 0.0017697369354258408, 'batch_size': 2061, 'optimizer': 'Adam'}. Best is trial 164 with value: 0.08020663652010113.
2026-05-13 11:57:23,328 - optuna.study._optimize - INFO - Trial 177 pruned. 
2026-05-13 11:57:58,886 - optuna.study.study - INFO - Trial 178 finished with value: 0.07075072021733544 and parameters: {'n_layers': 1, 'embedding_dim': 256, 'lr': 0.0019759397611418964, 'lambda_val': 0.0025533416996018775, 'batch_size': 2004, 'optimizer': 'Adam'}. Best is trial 164 with value: 0.08020663652010113.
2026-05-13 11:58:33,716 - optuna.study.study - INFO - Trial 179 finished with value: 0.07805017043710956 and parameters: {'n_layers': 1, 'embedding_dim': 256, 'lr': 0.003042325327153479, 'lambda_val': 0.0014828588782639708, 'batch_size': 2247, 'optimizer': 'Adam'}. Best is trial 164 with value: 0.08020663652010113.
2026-05-13 11:59:08,165 - optuna.study.study - INFO - Trial 180 finished with value: 0.06981271946839726 and parameters: {'n_layers': 1, 'embedding_dim': 256, 'lr': 0.0023314909029305227, 'lambda_val': 0.0009239278108599408, 'batch_size': 2268, 'optimizer': 'Adam'}. Best is trial 164 with value: 0.08020663652010113.
2026-05-13 11:59:12,323 - optuna.study._optimize - INFO - Trial 181 pruned. 
2026-05-13 11:59:46,677 - optuna.study.study - INFO - Trial 182 finished with value: 0.07418433946908659 and parameters: {'n_layers': 1, 'embedding_dim': 256, 'lr': 0.0027506189726269393, 'lambda_val': 0.001973508474661219, 'batch_size': 2072, 'optimizer': 'Adam'}. Best is trial 164 with value: 0.08020663652010113.
2026-05-13 11:59:52,465 - optuna.study._optimize - INFO - Trial 183 pruned. 
2026-05-13 12:00:26,901 - optuna.study.study - INFO - Trial 184 finished with value: 0.07623075992925747 and parameters: {'n_layers': 1, 'embedding_dim': 256, 'lr': 0.0035836576340910345, 'lambda_val': 0.001296363190071541, 'batch_size': 1967, 'optimizer': 'Adam'}. Best is trial 164 with value: 0.08020663652010113.
2026-05-13 12:01:01,222 - optuna.study.study - INFO - Trial 185 finished with value: 0.07137769682626459 and parameters: {'n_layers': 1, 'embedding_dim': 256, 'lr': 0.003331856697607025, 'lambda_val': 0.0012972152184108948, 'batch_size': 1940, 'optimizer': 'Adam'}. Best is trial 164 with value: 0.08020663652010113.
2026-05-13 12:01:07,209 - optuna.study._optimize - INFO - Trial 186 pruned. 
2026-05-13 12:01:41,764 - optuna.study.study - INFO - Trial 187 finished with value: 0.07823015711978253 and parameters: {'n_layers': 1, 'embedding_dim': 256, 'lr': 0.0028781088150822646, 'lambda_val': 0.001891492295750116, 'batch_size': 2003, 'optimizer': 'Adam'}. Best is trial 164 with value: 0.08020663652010113.
2026-05-13 12:02:17,130 - optuna.study.study - INFO - Trial 188 finished with value: 0.07641183666847748 and parameters: {'n_layers': 1, 'embedding_dim': 256, 'lr': 0.0029741474289245386, 'lambda_val': 0.0015180090641630302, 'batch_size': 2029, 'optimizer': 'Adam'}. Best is trial 164 with value: 0.08020663652010113.
2026-05-13 12:02:52,430 - optuna.study.study - INFO - Trial 189 finished with value: 0.07603319185727411 and parameters: {'n_layers': 1, 'embedding_dim': 256, 'lr': 0.0030178756488915813, 'lambda_val': 0.0011035109174141477, 'batch_size': 2016, 'optimizer': 'Adam'}. Best is trial 164 with value: 0.08020663652010113.
2026-05-13 12:03:27,077 - optuna.study.study - INFO - Trial 190 finished with value: 0.076654196641678 and parameters: {'n_layers': 1, 'embedding_dim': 256, 'lr': 0.0029020253628776987, 'lambda_val': 0.001475913131941191, 'batch_size': 2006, 'optimizer': 'Adam'}. Best is trial 164 with value: 0.08020663652010113.
2026-05-13 12:04:02,490 - optuna.study.study - INFO - Trial 191 finished with value: 0.08149356388719138 and parameters: {'n_layers': 1, 'embedding_dim': 256, 'lr': 0.00303070856634719, 'lambda_val': 0.0014756349048881423, 'batch_size': 1992, 'optimizer': 'Adam'}. Best is trial 191 with value: 0.08149356388719138.
2026-05-13 12:04:37,048 - optuna.study.study - INFO - Trial 192 finished with value: 0.07110735691070456 and parameters: {'n_layers': 1, 'embedding_dim': 256, 'lr': 0.0028691879790851893, 'lambda_val': 0.0014015826146726298, 'batch_size': 2013, 'optimizer': 'Adam'}. Best is trial 191 with value: 0.08149356388719138.
2026-05-13 12:05:11,299 - optuna.study.study - INFO - Trial 193 finished with value: 0.07543734749661561 and parameters: {'n_layers': 1, 'embedding_dim': 256, 'lr': 0.004373996073347664, 'lambda_val': 0.0012691023499655852, 'batch_size': 2084, 'optimizer': 'Adam'}. Best is trial 191 with value: 0.08149356388719138.
2026-05-13 12:05:45,947 - optuna.study.study - INFO - Trial 194 finished with value: 0.07473729079472372 and parameters: {'n_layers': 1, 'embedding_dim': 256, 'lr': 0.002896004079596511, 'lambda_val': 0.0008052909862940334, 'batch_size': 1992, 'optimizer': 'Adam'}. Best is trial 191 with value: 0.08149356388719138.
2026-05-13 12:06:20,502 - optuna.study.study - INFO - Trial 195 finished with value: 0.07422357762687194 and parameters: {'n_layers': 1, 'embedding_dim': 256, 'lr': 0.0037215455300398203, 'lambda_val': 0.0017549303322972594, 'batch_size': 2160, 'optimizer': 'Adam'}. Best is trial 191 with value: 0.08149356388719138.
2026-05-13 12:06:54,738 - optuna.study.study - INFO - Trial 196 finished with value: 0.07013367388989766 and parameters: {'n_layers': 1, 'embedding_dim': 256, 'lr': 0.002384563500586751, 'lambda_val': 0.0011754976733835073, 'batch_size': 2122, 'optimizer': 'Adam'}. Best is trial 191 with value: 0.08149356388719138.
2026-05-13 12:07:24,737 - optuna.study.study - INFO - Trial 197 finished with value: 0.06473481178232111 and parameters: {'n_layers': 1, 'embedding_dim': 96, 'lr': 0.002829060194194225, 'lambda_val': 0.0014297125553497244, 'batch_size': 1902, 'optimizer': 'Adam'}. Best is trial 191 with value: 0.08149356388719138.
2026-05-13 12:07:59,407 - optuna.study.study - INFO - Trial 198 finished with value: 0.076053722704818 and parameters: {'n_layers': 1, 'embedding_dim': 256, 'lr': 0.00492715546220811, 'lambda_val': 0.0019349911273548771, 'batch_size': 2304, 'optimizer': 'Adam'}. Best is trial 191 with value: 0.08149356388719138.
2026-05-13 12:08:03,896 - optuna.study._optimize - INFO - Trial 199 pruned. 
2026-05-13 12:08:31,323 - root - INFO - **** Training e_100K_1c2dcs
2026-05-13 12:08:31,323 - root - INFO -   ** 2-Dominant stats:
2026-05-13 12:08:31,323 - root - INFO -   ** Finding the dominant set:
2026-05-13 12:08:49,373 - root - INFO -   ** Getting the trainable edges:
2026-05-13 12:08:49,378 - helper_functions - INFO -      Number of nodes: 3657
2026-05-13 12:08:49,378 - helper_functions - INFO -      Ratio: 0.4035978368833462
2026-05-13 12:08:49,378 - helper_functions - INFO -      Number of unique users: 325
2026-05-13 12:08:49,378 - helper_functions - INFO -      Number of unique items: 3332
2026-05-13 12:08:49,378 - helper_functions - INFO -      Total dominant set edge: 11366
2026-05-13 12:08:49,378 - helper_functions - INFO -      Trainable edges: 9092.800000000001
2026-05-13 12:08:49,381 - root - INFO -   **** Getting 11366 dominant set edges
2026-05-13 12:08:49,511 - optuna.storages._rdb.storage - INFO - A new study created in RDB with name: Study_e_100K_1c2dcs_strict
2026-05-13 12:09:29,461 - optuna.study.study - INFO - Trial 0 finished with value: 0.004000977912663934 and parameters: {'n_layers': 3, 'embedding_dim': 32, 'lr': 0.036568662195479454, 'lambda_val': 3.0085625564360404e-05, 'batch_size': 3304, 'optimizer': 'SGD'}. Best is trial 0 with value: 0.004000977912663934.
2026-05-13 12:10:04,388 - optuna.study.study - INFO - Trial 1 finished with value: 0.0051923359194076075 and parameters: {'n_layers': 3, 'embedding_dim': 96, 'lr': 0.06086227792608741, 'lambda_val': 9.49118118464729e-06, 'batch_size': 3452, 'optimizer': 'Adam'}. Best is trial 1 with value: 0.0051923359194076075.
2026-05-13 12:10:45,585 - optuna.study.study - INFO - Trial 2 finished with value: 0.01036979372867089 and parameters: {'n_layers': 1, 'embedding_dim': 256, 'lr': 0.006630546442607741, 'lambda_val': 4.796616072534923e-05, 'batch_size': 2980, 'optimizer': 'Adam'}. Best is trial 2 with value: 0.01036979372867089.
2026-05-13 12:11:10,538 - optuna.study.study - INFO - Trial 3 finished with value: 0.0021403722279244794 and parameters: {'n_layers': 1, 'embedding_dim': 64, 'lr': 0.07086353893008042, 'lambda_val': 7.509449132394975e-06, 'batch_size': 1453, 'optimizer': 'RMSprop'}. Best is trial 2 with value: 0.01036979372867089.
2026-05-13 12:11:41,420 - optuna.study.study - INFO - Trial 4 finished with value: 0.0 and parameters: {'n_layers': 2, 'embedding_dim': 256, 'lr': 0.0008636492139935398, 'lambda_val': 0.016551322053043046, 'batch_size': 1091, 'optimizer': 'Adam'}. Best is trial 2 with value: 0.01036979372867089.
2026-05-13 12:11:46,035 - optuna.study._optimize - INFO - Trial 5 pruned. 
2026-05-13 12:11:49,689 - optuna.study._optimize - INFO - Trial 6 pruned. 
2026-05-13 12:11:52,780 - optuna.study._optimize - INFO - Trial 7 pruned. 
2026-05-13 12:11:55,761 - optuna.study._optimize - INFO - Trial 8 pruned. 
2026-05-13 12:12:00,200 - optuna.study._optimize - INFO - Trial 9 pruned. 
2026-05-13 12:12:30,437 - optuna.study.study - INFO - Trial 10 finished with value: 0.015816246478266894 and parameters: {'n_layers': 1, 'embedding_dim': 256, 'lr': 1.7199129455500982e-05, 'lambda_val': 1.1712394808791401e-06, 'batch_size': 3815, 'optimizer': 'Adam'}. Best is trial 10 with value: 0.015816246478266894.
2026-05-13 12:12:34,423 - optuna.study._optimize - INFO - Trial 11 pruned. 
2026-05-13 12:12:38,696 - optuna.study._optimize - INFO - Trial 12 pruned. 
2026-05-13 12:13:14,271 - optuna.study.study - INFO - Trial 13 finished with value: 0.005551543570975525 and parameters: {'n_layers': 2, 'embedding_dim': 256, 'lr': 7.734360575257203e-05, 'lambda_val': 5.463002806145698e-05, 'batch_size': 3097, 'optimizer': 'Adam'}. Best is trial 10 with value: 0.015816246478266894.
2026-05-13 12:13:17,327 - optuna.study._optimize - INFO - Trial 14 pruned. 
2026-05-13 12:13:42,485 - optuna.study.study - INFO - Trial 15 finished with value: 0.0047027266765674956 and parameters: {'n_layers': 2, 'embedding_dim': 96, 'lr': 0.000159352188613071, 'lambda_val': 6.51025141979181e-06, 'batch_size': 2918, 'optimizer': 'Adam'}. Best is trial 10 with value: 0.015816246478266894.
2026-05-13 12:13:47,414 - optuna.study._optimize - INFO - Trial 16 pruned. 
2026-05-13 12:14:15,791 - optuna.study.study - INFO - Trial 17 finished with value: 0.007916547540489574 and parameters: {'n_layers': 1, 'embedding_dim': 256, 'lr': 0.00020579245953022865, 'lambda_val': 7.599850627996846e-05, 'batch_size': 2897, 'optimizer': 'Adam'}. Best is trial 10 with value: 0.015816246478266894.
2026-05-13 12:14:49,162 - optuna.study.study - INFO - Trial 18 finished with value: 0.01769105684792597 and parameters: {'n_layers': 2, 'embedding_dim': 256, 'lr': 3.6604214639790395e-05, 'lambda_val': 1.138338381280741e-06, 'batch_size': 3662, 'optimizer': 'RMSprop'}. Best is trial 18 with value: 0.01769105684792597.
2026-05-13 12:15:15,136 - optuna.study.study - INFO - Trial 19 finished with value: 0.021850334151434444 and parameters: {'n_layers': 2, 'embedding_dim': 96, 'lr': 4.556605864969118e-05, 'lambda_val': 2.6921464759932526e-06, 'batch_size': 3671, 'optimizer': 'RMSprop'}. Best is trial 19 with value: 0.021850334151434444.
2026-05-13 12:15:18,684 - optuna.study._optimize - INFO - Trial 20 pruned. 
2026-05-13 12:15:22,295 - optuna.study._optimize - INFO - Trial 21 pruned. 
2026-05-13 12:15:26,276 - optuna.study._optimize - INFO - Trial 22 pruned. 
2026-05-13 12:15:54,484 - optuna.study.study - INFO - Trial 23 finished with value: 0.0044617195644333285 and parameters: {'n_layers': 2, 'embedding_dim': 128, 'lr': 0.00011523398740520653, 'lambda_val': 1.8345938812938503e-05, 'batch_size': 4057, 'optimizer': 'RMSprop'}. Best is trial 19 with value: 0.021850334151434444.
2026-05-13 12:16:19,710 - optuna.study.study - INFO - Trial 24 finished with value: 0.0024858467989028105 and parameters: {'n_layers': 3, 'embedding_dim': 64, 'lr': 0.0004430310291290928, 'lambda_val': 3.3190846189095618e-06, 'batch_size': 3216, 'optimizer': 'RMSprop'}. Best is trial 19 with value: 0.021850334151434444.
2026-05-13 12:16:46,632 - optuna.study.study - INFO - Trial 25 finished with value: 0.006409728215186267 and parameters: {'n_layers': 2, 'embedding_dim': 96, 'lr': 6.626357979148958e-05, 'lambda_val': 1.5368869420241563e-05, 'batch_size': 3566, 'optimizer': 'RMSprop'}. Best is trial 19 with value: 0.021850334151434444.
2026-05-13 12:16:51,026 - optuna.study._optimize - INFO - Trial 26 pruned. 
2026-05-13 12:16:55,228 - optuna.study._optimize - INFO - Trial 27 pruned. 
2026-05-13 12:17:01,142 - optuna.study._optimize - INFO - Trial 28 pruned. 
2026-05-13 12:17:04,416 - optuna.study._optimize - INFO - Trial 29 pruned. 
2026-05-13 12:17:27,615 - optuna.study.study - INFO - Trial 30 finished with value: 0.012947983220253142 and parameters: {'n_layers': 1, 'embedding_dim': 64, 'lr': 8.897209066078497e-05, 'lambda_val': 2.411926395557604e-06, 'batch_size': 3749, 'optimizer': 'RMSprop'}. Best is trial 19 with value: 0.021850334151434444.
2026-05-13 12:17:50,975 - optuna.study.study - INFO - Trial 31 finished with value: 0.016115748977242023 and parameters: {'n_layers': 1, 'embedding_dim': 64, 'lr': 8.026802860377753e-05, 'lambda_val': 2.1267183674677872e-06, 'batch_size': 3817, 'optimizer': 'RMSprop'}. Best is trial 19 with value: 0.021850334151434444.
2026-05-13 12:17:58,655 - optuna.study._optimize - INFO - Trial 32 pruned. 
2026-05-13 12:18:25,685 - optuna.study.study - INFO - Trial 33 finished with value: 0.005808133992005028 and parameters: {'n_layers': 1, 'embedding_dim': 64, 'lr': 0.0003999204397465178, 'lambda_val': 1.045069810681873e-06, 'batch_size': 3501, 'optimizer': 'RMSprop'}. Best is trial 19 with value: 0.021850334151434444.
2026-05-13 12:18:28,985 - optuna.study._optimize - INFO - Trial 34 pruned. 
2026-05-13 12:19:03,869 - optuna.study.study - INFO - Trial 35 finished with value: 0.0045869336057903325 and parameters: {'n_layers': 2, 'embedding_dim': 256, 'lr': 0.00011852608006200513, 'lambda_val': 2.6154935026135506e-06, 'batch_size': 3871, 'optimizer': 'RMSprop'}. Best is trial 19 with value: 0.021850334151434444.
2026-05-13 12:19:08,075 - optuna.study._optimize - INFO - Trial 36 pruned. 
2026-05-13 12:19:11,333 - optuna.study._optimize - INFO - Trial 37 pruned. 
2026-05-13 12:19:14,420 - optuna.study._optimize - INFO - Trial 38 pruned. 
2026-05-13 12:19:18,257 - optuna.study._optimize - INFO - Trial 39 pruned. 
2026-05-13 12:19:47,328 - optuna.study.study - INFO - Trial 40 finished with value: 0.0 and parameters: {'n_layers': 3, 'embedding_dim': 64, 'lr': 0.0003471034835843565, 'lambda_val': 0.0048047778259456865, 'batch_size': 3379, 'optimizer': 'RMSprop'}. Best is trial 19 with value: 0.021850334151434444.
2026-05-13 12:20:15,507 - optuna.study.study - INFO - Trial 41 finished with value: 0.0065989400262348175 and parameters: {'n_layers': 1, 'embedding_dim': 64, 'lr': 0.00011599753581824048, 'lambda_val': 2.631872826942434e-06, 'batch_size': 3710, 'optimizer': 'RMSprop'}. Best is trial 19 with value: 0.021850334151434444.
2026-05-13 12:20:44,886 - optuna.study.study - INFO - Trial 42 finished with value: 0.017644544293824255 and parameters: {'n_layers': 1, 'embedding_dim': 64, 'lr': 8.502368744648278e-05, 'lambda_val': 1.9895705086115456e-06, 'batch_size': 3733, 'optimizer': 'RMSprop'}. Best is trial 19 with value: 0.021850334151434444.
2026-05-13 12:20:48,828 - optuna.study._optimize - INFO - Trial 43 pruned. 
2026-05-13 12:21:16,502 - optuna.study.study - INFO - Trial 44 finished with value: 0.005879155459746715 and parameters: {'n_layers': 1, 'embedding_dim': 64, 'lr': 0.0001597344006074195, 'lambda_val': 1.8702572744922891e-06, 'batch_size': 3050, 'optimizer': 'Adam'}. Best is trial 19 with value: 0.021850334151434444.
2026-05-13 12:21:21,748 - optuna.study._optimize - INFO - Trial 45 pruned. 
2026-05-13 12:21:26,100 - optuna.study._optimize - INFO - Trial 46 pruned. 
2026-05-13 12:21:30,192 - optuna.study._optimize - INFO - Trial 47 pruned. 
2026-05-13 12:22:03,523 - optuna.study.study - INFO - Trial 48 finished with value: 0.004922573843650597 and parameters: {'n_layers': 1, 'embedding_dim': 256, 'lr': 8.40416214819852e-05, 'lambda_val': 2.76913230246587e-05, 'batch_size': 3818, 'optimizer': 'Adam'}. Best is trial 19 with value: 0.021850334151434444.
2026-05-13 12:22:07,945 - optuna.study._optimize - INFO - Trial 49 pruned. 
2026-05-13 12:22:38,409 - optuna.study.study - INFO - Trial 50 finished with value: 0.013445296485246021 and parameters: {'n_layers': 2, 'embedding_dim': 96, 'lr': 6.93049254194849e-05, 'lambda_val': 4.503480438445694e-06, 'batch_size': 817, 'optimizer': 'Adam'}. Best is trial 19 with value: 0.021850334151434444.
2026-05-13 12:23:10,253 - optuna.study.study - INFO - Trial 51 finished with value: 0.004457706029946375 and parameters: {'n_layers': 2, 'embedding_dim': 96, 'lr': 0.00019146186685472182, 'lambda_val': 4.4954619168503185e-06, 'batch_size': 2385, 'optimizer': 'Adam'}. Best is trial 19 with value: 0.021850334151434444.
2026-05-13 12:23:39,652 - optuna.study.study - INFO - Trial 52 finished with value: 0.014064688762837589 and parameters: {'n_layers': 2, 'embedding_dim': 96, 'lr': 6.854524615667126e-05, 'lambda_val': 1.6688331008280334e-06, 'batch_size': 829, 'optimizer': 'Adam'}. Best is trial 19 with value: 0.021850334151434444.
2026-05-13 12:23:43,707 - optuna.study._optimize - INFO - Trial 53 pruned. 
2026-05-13 12:23:47,987 - optuna.study._optimize - INFO - Trial 54 pruned. 
2026-05-13 12:23:53,218 - optuna.study._optimize - INFO - Trial 55 pruned. 
2026-05-13 12:23:57,387 - optuna.study._optimize - INFO - Trial 56 pruned. 
2026-05-13 12:24:01,841 - optuna.study._optimize - INFO - Trial 57 pruned. 
2026-05-13 12:24:06,092 - optuna.study._optimize - INFO - Trial 58 pruned. 
