2026-05-13 06:58:20,710 - optuna.study.study - INFO - Trial 83 finished with value: 0.07246703406710561 and parameters: {'n_layers': 1, 'embedding_dim': 256, 'lr': 0.0009389197040094541, 'lambda_val': 1.739853063380307e-06, 'batch_size': 544, 'optimizer': 'Adam'}. Best is trial 68 with value: 0.11287022865576848.
2026-05-13 06:58:55,151 - optuna.study.study - INFO - Trial 84 finished with value: 0.11337088505495453 and parameters: {'n_layers': 1, 'embedding_dim': 256, 'lr': 0.00023489915934011288, 'lambda_val': 2.513501338230451e-06, 'batch_size': 525, 'optimizer': 'Adam'}. Best is trial 84 with value: 0.11337088505495453.
2026-05-13 06:59:28,398 - optuna.study.study - INFO - Trial 85 finished with value: 0.13274009769970152 and parameters: {'n_layers': 1, 'embedding_dim': 256, 'lr': 0.0001418153715816697, 'lambda_val': 1.7644607008847917e-06, 'batch_size': 778, 'optimizer': 'Adam'}. Best is trial 85 with value: 0.13274009769970152.
2026-05-13 07:00:01,596 - optuna.study.study - INFO - Trial 86 finished with value: 0.13385339811938296 and parameters: {'n_layers': 1, 'embedding_dim': 256, 'lr': 0.0001513778952053646, 'lambda_val': 1.778916061687785e-06, 'batch_size': 771, 'optimizer': 'Adam'}. Best is trial 86 with value: 0.13385339811938296.
2026-05-13 07:00:05,498 - optuna.study._optimize - INFO - Trial 87 pruned. 
2026-05-13 07:00:38,731 - optuna.study.study - INFO - Trial 88 finished with value: 0.10678331785316005 and parameters: {'n_layers': 1, 'embedding_dim': 256, 'lr': 0.0001549986112415349, 'lambda_val': 2.8834472275222328e-06, 'batch_size': 1248, 'optimizer': 'Adam'}. Best is trial 86 with value: 0.13385339811938296.
2026-05-13 07:00:42,312 - optuna.study._optimize - INFO - Trial 89 pruned. 
2026-05-13 07:00:46,556 - optuna.study._optimize - INFO - Trial 90 pruned. 
2026-05-13 07:00:52,989 - optuna.study._optimize - INFO - Trial 91 pruned. 
2026-05-13 07:01:26,794 - optuna.study.study - INFO - Trial 92 finished with value: 0.1257071081899517 and parameters: {'n_layers': 1, 'embedding_dim': 256, 'lr': 0.00018712799749134946, 'lambda_val': 1.0104085991267634e-06, 'batch_size': 608, 'optimizer': 'Adam'}. Best is trial 86 with value: 0.13385339811938296.
2026-05-13 07:02:01,117 - optuna.study.study - INFO - Trial 93 finished with value: 0.11318668963203711 and parameters: {'n_layers': 1, 'embedding_dim': 256, 'lr': 0.00020618605302441558, 'lambda_val': 1.3814627462572788e-06, 'batch_size': 895, 'optimizer': 'Adam'}. Best is trial 86 with value: 0.13385339811938296.
2026-05-13 07:02:04,713 - optuna.study._optimize - INFO - Trial 94 pruned. 
2026-05-13 07:02:37,551 - optuna.study.study - INFO - Trial 95 finished with value: 0.0706845856005951 and parameters: {'n_layers': 1, 'embedding_dim': 256, 'lr': 0.0004256401447169187, 'lambda_val': 1.3371481520530084e-06, 'batch_size': 1273, 'optimizer': 'Adam'}. Best is trial 86 with value: 0.13385339811938296.
2026-05-13 07:02:42,274 - optuna.study._optimize - INFO - Trial 96 pruned. 
2026-05-13 07:03:15,543 - optuna.study.study - INFO - Trial 97 finished with value: 0.10045674432920791 and parameters: {'n_layers': 1, 'embedding_dim': 256, 'lr': 0.00021777436741221424, 'lambda_val': 1.378155229432976e-06, 'batch_size': 872, 'optimizer': 'Adam'}. Best is trial 86 with value: 0.13385339811938296.
2026-05-13 07:03:19,770 - optuna.study._optimize - INFO - Trial 98 pruned. 
2026-05-13 07:03:24,086 - optuna.study._optimize - INFO - Trial 99 pruned. 
2026-05-13 07:03:28,315 - optuna.study._optimize - INFO - Trial 100 pruned. 
2026-05-13 07:04:01,966 - optuna.study.study - INFO - Trial 101 finished with value: 0.10227738881111323 and parameters: {'n_layers': 1, 'embedding_dim': 256, 'lr': 0.00021888282313229992, 'lambda_val': 1.3593293658081596e-06, 'batch_size': 855, 'optimizer': 'Adam'}. Best is trial 86 with value: 0.13385339811938296.
2026-05-13 07:04:34,559 - optuna.study.study - INFO - Trial 102 finished with value: 0.0770124012804121 and parameters: {'n_layers': 1, 'embedding_dim': 256, 'lr': 0.00042403795942810054, 'lambda_val': 1.970181059362392e-06, 'batch_size': 622, 'optimizer': 'Adam'}. Best is trial 86 with value: 0.13385339811938296.
2026-05-13 07:05:08,912 - optuna.study.study - INFO - Trial 103 finished with value: 0.0901934424488456 and parameters: {'n_layers': 1, 'embedding_dim': 256, 'lr': 0.00019778357615340674, 'lambda_val': 1.2701023838009344e-06, 'batch_size': 1441, 'optimizer': 'Adam'}. Best is trial 86 with value: 0.13385339811938296.
2026-05-13 07:05:13,027 - optuna.study._optimize - INFO - Trial 104 pruned. 
2026-05-13 07:05:17,266 - optuna.study._optimize - INFO - Trial 105 pruned. 
2026-05-13 07:05:51,207 - optuna.study.study - INFO - Trial 106 finished with value: 0.12760778020643984 and parameters: {'n_layers': 1, 'embedding_dim': 256, 'lr': 0.0001742333123275553, 'lambda_val': 1.6382557236030545e-06, 'batch_size': 624, 'optimizer': 'Adam'}. Best is trial 86 with value: 0.13385339811938296.
2026-05-13 07:05:55,554 - optuna.study._optimize - INFO - Trial 107 pruned. 
2026-05-13 07:05:59,417 - optuna.study._optimize - INFO - Trial 108 pruned. 
2026-05-13 07:06:03,296 - optuna.study._optimize - INFO - Trial 109 pruned. 
2026-05-13 07:06:07,267 - optuna.study._optimize - INFO - Trial 110 pruned. 
2026-05-13 07:06:39,996 - optuna.study.study - INFO - Trial 111 finished with value: 0.10655341094511618 and parameters: {'n_layers': 1, 'embedding_dim': 256, 'lr': 0.0002222392525765417, 'lambda_val': 1.6847010682443565e-06, 'batch_size': 732, 'optimizer': 'Adam'}. Best is trial 86 with value: 0.13385339811938296.
2026-05-13 07:07:12,896 - optuna.study.study - INFO - Trial 112 finished with value: 0.11141325479694363 and parameters: {'n_layers': 1, 'embedding_dim': 256, 'lr': 0.00020959236182197357, 'lambda_val': 2.274924476012779e-06, 'batch_size': 724, 'optimizer': 'Adam'}. Best is trial 86 with value: 0.13385339811938296.
2026-05-13 07:07:45,622 - optuna.study.study - INFO - Trial 113 finished with value: 0.12032464253970361 and parameters: {'n_layers': 1, 'embedding_dim': 256, 'lr': 0.00016731394048984734, 'lambda_val': 2.1812801330690645e-06, 'batch_size': 729, 'optimizer': 'Adam'}. Best is trial 86 with value: 0.13385339811938296.
2026-05-13 07:08:18,821 - optuna.study.study - INFO - Trial 114 finished with value: 0.07790686834483282 and parameters: {'n_layers': 1, 'embedding_dim': 256, 'lr': 0.0004103003771990026, 'lambda_val': 2.7081087385872497e-06, 'batch_size': 658, 'optimizer': 'Adam'}. Best is trial 86 with value: 0.13385339811938296.
2026-05-13 07:08:48,712 - optuna.study.study - INFO - Trial 115 finished with value: 0.108445918222571 and parameters: {'n_layers': 1, 'embedding_dim': 256, 'lr': 0.00017381973846165703, 'lambda_val': 5.986326509479055e-06, 'batch_size': 959, 'optimizer': 'Adam'}. Best is trial 86 with value: 0.13385339811938296.
2026-05-13 07:09:21,427 - optuna.study.study - INFO - Trial 116 finished with value: 0.11276809156698551 and parameters: {'n_layers': 1, 'embedding_dim': 256, 'lr': 0.00018385294032360322, 'lambda_val': 5.844552284977461e-06, 'batch_size': 973, 'optimizer': 'Adam'}. Best is trial 86 with value: 0.13385339811938296.
2026-05-13 07:09:25,519 - optuna.study._optimize - INFO - Trial 117 pruned. 
2026-05-13 07:09:58,540 - optuna.study.study - INFO - Trial 118 finished with value: 0.10730692433402728 and parameters: {'n_layers': 1, 'embedding_dim': 256, 'lr': 0.00018395592767160148, 'lambda_val': 6.0503637791641615e-06, 'batch_size': 1096, 'optimizer': 'Adam'}. Best is trial 86 with value: 0.13385339811938296.
2026-05-13 07:10:02,461 - optuna.study._optimize - INFO - Trial 119 pruned. 
2026-05-13 07:10:06,469 - optuna.study._optimize - INFO - Trial 120 pruned. 
2026-05-13 07:10:40,680 - optuna.study.study - INFO - Trial 121 finished with value: 0.09838427790278091 and parameters: {'n_layers': 1, 'embedding_dim': 256, 'lr': 0.000192761333076978, 'lambda_val': 2.24717896726649e-06, 'batch_size': 806, 'optimizer': 'Adam'}. Best is trial 86 with value: 0.13385339811938296.
2026-05-13 07:10:44,787 - optuna.study._optimize - INFO - Trial 122 pruned. 
2026-05-13 07:11:18,283 - optuna.study.study - INFO - Trial 123 finished with value: 0.08995115046584813 and parameters: {'n_layers': 1, 'embedding_dim': 256, 'lr': 0.0003828485978661344, 'lambda_val': 1.0086502686782157e-06, 'batch_size': 715, 'optimizer': 'Adam'}. Best is trial 86 with value: 0.13385339811938296.
2026-05-13 07:11:52,433 - optuna.study.study - INFO - Trial 124 finished with value: 0.07231108130043323 and parameters: {'n_layers': 1, 'embedding_dim': 256, 'lr': 0.0005836260590078789, 'lambda_val': 7.681318572785146e-06, 'batch_size': 592, 'optimizer': 'Adam'}. Best is trial 86 with value: 0.13385339811938296.
2026-05-13 07:12:20,965 - optuna.study.study - INFO - Trial 125 finished with value: 0.09570553801465712 and parameters: {'n_layers': 1, 'embedding_dim': 128, 'lr': 0.0002700125876290265, 'lambda_val': 5.575085578618154e-06, 'batch_size': 687, 'optimizer': 'Adam'}. Best is trial 86 with value: 0.13385339811938296.
2026-05-13 07:12:53,346 - optuna.study.study - INFO - Trial 126 finished with value: 0.1244214505081949 and parameters: {'n_layers': 1, 'embedding_dim': 256, 'lr': 0.0001785046147873897, 'lambda_val': 1.6620467950760118e-06, 'batch_size': 799, 'optimizer': 'Adam'}. Best is trial 86 with value: 0.13385339811938296.
2026-05-13 07:13:25,629 - optuna.study.study - INFO - Trial 127 finished with value: 0.14463190499745765 and parameters: {'n_layers': 1, 'embedding_dim': 256, 'lr': 0.0001597874632199272, 'lambda_val': 1.2388982469486158e-06, 'batch_size': 801, 'optimizer': 'Adam'}. Best is trial 127 with value: 0.14463190499745765.
2026-05-13 07:13:29,560 - optuna.study._optimize - INFO - Trial 128 pruned. 
2026-05-13 07:13:33,481 - optuna.study._optimize - INFO - Trial 129 pruned. 
2026-05-13 07:13:36,938 - optuna.study._optimize - INFO - Trial 130 pruned. 
2026-05-13 07:14:09,982 - optuna.study.study - INFO - Trial 131 finished with value: 0.11163171034120317 and parameters: {'n_layers': 1, 'embedding_dim': 256, 'lr': 0.00016917430123601174, 'lambda_val': 1.5210947390153804e-06, 'batch_size': 947, 'optimizer': 'Adam'}. Best is trial 127 with value: 0.14463190499745765.
2026-05-13 07:14:14,252 - optuna.study._optimize - INFO - Trial 132 pruned. 
2026-05-13 07:14:48,106 - optuna.study.study - INFO - Trial 133 finished with value: 0.09038946781562283 and parameters: {'n_layers': 1, 'embedding_dim': 256, 'lr': 0.00021219751250348118, 'lambda_val': 1.234806250625954e-06, 'batch_size': 1060, 'optimizer': 'Adam'}. Best is trial 127 with value: 0.14463190499745765.
2026-05-13 07:14:52,093 - optuna.study._optimize - INFO - Trial 134 pruned. 
2026-05-13 07:15:25,692 - optuna.study.study - INFO - Trial 135 finished with value: 0.11100790694541221 and parameters: {'n_layers': 1, 'embedding_dim': 256, 'lr': 0.0002064829829998345, 'lambda_val': 2.028538687954933e-06, 'batch_size': 735, 'optimizer': 'Adam'}. Best is trial 127 with value: 0.14463190499745765.
2026-05-13 07:15:29,969 - optuna.study._optimize - INFO - Trial 136 pruned. 
2026-05-13 07:15:34,056 - optuna.study._optimize - INFO - Trial 137 pruned. 
2026-05-13 07:16:06,582 - optuna.study.study - INFO - Trial 138 finished with value: 0.09249175149631275 and parameters: {'n_layers': 1, 'embedding_dim': 256, 'lr': 0.00021164111870760022, 'lambda_val': 2.6350857895363527e-06, 'batch_size': 1202, 'optimizer': 'Adam'}. Best is trial 127 with value: 0.14463190499745765.
2026-05-13 07:16:10,585 - optuna.study._optimize - INFO - Trial 139 pruned. 
2026-05-13 07:16:14,585 - optuna.study._optimize - INFO - Trial 140 pruned. 
2026-05-13 07:16:46,235 - optuna.study.study - INFO - Trial 141 finished with value: 0.09315662487583609 and parameters: {'n_layers': 1, 'embedding_dim': 256, 'lr': 0.0002702342499542129, 'lambda_val': 4.279101996836613e-06, 'batch_size': 580, 'optimizer': 'Adam'}. Best is trial 127 with value: 0.14463190499745765.
2026-05-13 07:16:53,130 - optuna.study._optimize - INFO - Trial 142 pruned. 
2026-05-13 07:17:25,659 - optuna.study.study - INFO - Trial 143 finished with value: 0.08535152964066918 and parameters: {'n_layers': 1, 'embedding_dim': 256, 'lr': 0.0003033819111955688, 'lambda_val': 1.2552640038596555e-06, 'batch_size': 817, 'optimizer': 'Adam'}. Best is trial 127 with value: 0.14463190499745765.
2026-05-13 07:17:56,972 - optuna.study.study - INFO - Trial 144 finished with value: 0.08127631972932768 and parameters: {'n_layers': 1, 'embedding_dim': 256, 'lr': 0.0003776240273167593, 'lambda_val': 1.5894572262147307e-06, 'batch_size': 514, 'optimizer': 'Adam'}. Best is trial 127 with value: 0.14463190499745765.
2026-05-13 07:18:00,849 - optuna.study._optimize - INFO - Trial 145 pruned. 
2026-05-13 07:18:34,215 - optuna.study.study - INFO - Trial 146 finished with value: 0.1183992728324966 and parameters: {'n_layers': 1, 'embedding_dim': 256, 'lr': 0.00019464581637467168, 'lambda_val': 3.2607180962978697e-06, 'batch_size': 750, 'optimizer': 'Adam'}. Best is trial 127 with value: 0.14463190499745765.
2026-05-13 07:18:38,291 - optuna.study._optimize - INFO - Trial 147 pruned. 
2026-05-13 07:18:42,369 - optuna.study._optimize - INFO - Trial 148 pruned. 
2026-05-13 07:18:45,927 - optuna.study._optimize - INFO - Trial 149 pruned. 
2026-05-13 07:18:50,100 - optuna.study._optimize - INFO - Trial 150 pruned. 
2026-05-13 07:19:19,398 - optuna.study.study - INFO - Trial 151 finished with value: 0.07904929123086638 and parameters: {'n_layers': 1, 'embedding_dim': 256, 'lr': 0.0004864475054224587, 'lambda_val': 4.932003364424975e-06, 'batch_size': 599, 'optimizer': 'Adam'}. Best is trial 127 with value: 0.14463190499745765.
2026-05-13 07:19:50,194 - optuna.study.study - INFO - Trial 152 finished with value: 0.10302099154010287 and parameters: {'n_layers': 1, 'embedding_dim': 256, 'lr': 0.0002440584303288763, 'lambda_val': 1.4543730032124793e-06, 'batch_size': 663, 'optimizer': 'Adam'}. Best is trial 127 with value: 0.14463190499745765.
2026-05-13 07:19:54,011 - optuna.study._optimize - INFO - Trial 153 pruned. 
2026-05-13 07:20:30,021 - optuna.study.study - INFO - Trial 154 finished with value: 0.06681755533762719 and parameters: {'n_layers': 1, 'embedding_dim': 256, 'lr': 0.00029496735459467316, 'lambda_val': 2.2647745293442987e-06, 'batch_size': 3897, 'optimizer': 'Adam'}. Best is trial 127 with value: 0.14463190499745765.
2026-05-13 07:20:34,742 - optuna.study._optimize - INFO - Trial 155 pruned. 
2026-05-13 07:21:08,718 - optuna.study.study - INFO - Trial 156 finished with value: 0.10429140185597209 and parameters: {'n_layers': 1, 'embedding_dim': 256, 'lr': 0.00022076986730654, 'lambda_val': 1.268978255219663e-06, 'batch_size': 850, 'optimizer': 'Adam'}. Best is trial 127 with value: 0.14463190499745765.
2026-05-13 07:21:41,668 - optuna.study.study - INFO - Trial 157 finished with value: 0.0890611048680655 and parameters: {'n_layers': 1, 'embedding_dim': 256, 'lr': 0.0003614802082819279, 'lambda_val': 1.0111199462167656e-06, 'batch_size': 578, 'optimizer': 'Adam'}. Best is trial 127 with value: 0.14463190499745765.
2026-05-13 07:21:44,919 - optuna.study._optimize - INFO - Trial 158 pruned. 
2026-05-13 07:22:17,522 - optuna.study.study - INFO - Trial 159 finished with value: 0.11633972724871741 and parameters: {'n_layers': 1, 'embedding_dim': 256, 'lr': 0.0002594820153345641, 'lambda_val': 3.181342170796728e-06, 'batch_size': 668, 'optimizer': 'Adam'}. Best is trial 127 with value: 0.14463190499745765.
2026-05-13 07:22:51,264 - optuna.study.study - INFO - Trial 160 finished with value: 0.10751452212253743 and parameters: {'n_layers': 1, 'embedding_dim': 256, 'lr': 0.00017409099312344924, 'lambda_val': 3.0240932787868266e-06, 'batch_size': 1063, 'optimizer': 'Adam'}. Best is trial 127 with value: 0.14463190499745765.
2026-05-13 07:23:25,199 - optuna.study.study - INFO - Trial 161 finished with value: 0.10220468821426665 and parameters: {'n_layers': 1, 'embedding_dim': 256, 'lr': 0.0002501273728218568, 'lambda_val': 2.3908651184368684e-06, 'batch_size': 666, 'optimizer': 'Adam'}. Best is trial 127 with value: 0.14463190499745765.
2026-05-13 07:23:58,544 - optuna.study.study - INFO - Trial 162 finished with value: 0.08655116222875237 and parameters: {'n_layers': 1, 'embedding_dim': 256, 'lr': 0.0002925369071686471, 'lambda_val': 1.7526403216502272e-06, 'batch_size': 729, 'optimizer': 'Adam'}. Best is trial 127 with value: 0.14463190499745765.
2026-05-13 07:24:05,069 - optuna.study._optimize - INFO - Trial 163 pruned. 
2026-05-13 07:24:09,261 - optuna.study._optimize - INFO - Trial 164 pruned. 
2026-05-13 07:24:13,368 - optuna.study._optimize - INFO - Trial 165 pruned. 
2026-05-13 07:24:17,408 - optuna.study._optimize - INFO - Trial 166 pruned. 
2026-05-13 07:24:50,953 - optuna.study.study - INFO - Trial 167 finished with value: 0.12096200517398739 and parameters: {'n_layers': 1, 'embedding_dim': 256, 'lr': 0.00021598570248617093, 'lambda_val': 7.173271865376168e-06, 'batch_size': 580, 'optimizer': 'Adam'}. Best is trial 127 with value: 0.14463190499745765.
2026-05-13 07:25:24,058 - optuna.study.study - INFO - Trial 168 finished with value: 0.09165744532470352 and parameters: {'n_layers': 1, 'embedding_dim': 256, 'lr': 0.0002079332962316055, 'lambda_val': 9.592441753136318e-06, 'batch_size': 881, 'optimizer': 'Adam'}. Best is trial 127 with value: 0.14463190499745765.
2026-05-13 07:25:28,101 - optuna.study._optimize - INFO - Trial 169 pruned. 
2026-05-13 07:25:32,423 - optuna.study._optimize - INFO - Trial 170 pruned. 
2026-05-13 07:26:03,553 - optuna.study.study - INFO - Trial 171 finished with value: 0.10826102443907473 and parameters: {'n_layers': 1, 'embedding_dim': 256, 'lr': 0.0002633453951551936, 'lambda_val': 7.56764706432142e-06, 'batch_size': 584, 'optimizer': 'Adam'}. Best is trial 127 with value: 0.14463190499745765.
2026-05-13 07:26:07,761 - optuna.study._optimize - INFO - Trial 172 pruned. 
2026-05-13 07:26:40,759 - optuna.study.study - INFO - Trial 173 finished with value: 0.0823173018722829 and parameters: {'n_layers': 1, 'embedding_dim': 256, 'lr': 0.0003203013042353822, 'lambda_val': 2.2228978434394253e-06, 'batch_size': 1651, 'optimizer': 'Adam'}. Best is trial 127 with value: 0.14463190499745765.
2026-05-13 07:26:45,481 - optuna.study._optimize - INFO - Trial 174 pruned. 
2026-05-13 07:27:18,439 - optuna.study.study - INFO - Trial 175 finished with value: 0.10754932744470685 and parameters: {'n_layers': 1, 'embedding_dim': 256, 'lr': 0.00023995612439478513, 'lambda_val': 5.322993031518349e-06, 'batch_size': 512, 'optimizer': 'Adam'}. Best is trial 127 with value: 0.14463190499745765.
2026-05-13 07:27:22,363 - optuna.study._optimize - INFO - Trial 176 pruned. 
2026-05-13 07:27:25,661 - optuna.study._optimize - INFO - Trial 177 pruned. 
2026-05-13 07:27:58,759 - optuna.study.study - INFO - Trial 178 finished with value: 0.07469750823143244 and parameters: {'n_layers': 1, 'embedding_dim': 256, 'lr': 0.00044752410117023894, 'lambda_val': 1.2168714266200042e-06, 'batch_size': 720, 'optimizer': 'Adam'}. Best is trial 127 with value: 0.14463190499745765.
2026-05-13 07:28:32,506 - optuna.study.study - INFO - Trial 179 finished with value: 0.08592343434957182 and parameters: {'n_layers': 1, 'embedding_dim': 256, 'lr': 0.0002814209272120905, 'lambda_val': 2.887024600456595e-06, 'batch_size': 846, 'optimizer': 'Adam'}. Best is trial 127 with value: 0.14463190499745765.
2026-05-13 07:29:05,867 - optuna.study.study - INFO - Trial 180 finished with value: 0.11129942172835341 and parameters: {'n_layers': 1, 'embedding_dim': 256, 'lr': 0.000229968698054159, 'lambda_val': 1.5698862963135517e-06, 'batch_size': 618, 'optimizer': 'Adam'}. Best is trial 127 with value: 0.14463190499745765.
2026-05-13 07:29:35,794 - optuna.study.study - INFO - Trial 181 finished with value: 0.10827328416088737 and parameters: {'n_layers': 1, 'embedding_dim': 256, 'lr': 0.00021589231883834627, 'lambda_val': 1.5677992093742433e-06, 'batch_size': 602, 'optimizer': 'Adam'}. Best is trial 127 with value: 0.14463190499745765.
2026-05-13 07:30:08,708 - optuna.study.study - INFO - Trial 182 finished with value: 0.08703184933300322 and parameters: {'n_layers': 1, 'embedding_dim': 256, 'lr': 0.0003675774694771261, 'lambda_val': 2.299063960659291e-06, 'batch_size': 664, 'optimizer': 'Adam'}. Best is trial 127 with value: 0.14463190499745765.
2026-05-13 07:30:12,618 - optuna.study._optimize - INFO - Trial 183 pruned. 
2026-05-13 07:30:45,675 - optuna.study.study - INFO - Trial 184 finished with value: 0.095549295290126 and parameters: {'n_layers': 1, 'embedding_dim': 256, 'lr': 0.0002463509244947526, 'lambda_val': 1.0096325299958776e-06, 'batch_size': 745, 'optimizer': 'Adam'}. Best is trial 127 with value: 0.14463190499745765.
2026-05-13 07:30:49,187 - optuna.study._optimize - INFO - Trial 185 pruned. 
2026-05-13 07:31:25,442 - optuna.study.study - INFO - Trial 186 finished with value: 0.10379687887590795 and parameters: {'n_layers': 1, 'embedding_dim': 256, 'lr': 0.00018046087388156587, 'lambda_val': 1.4967739537272505e-06, 'batch_size': 923, 'optimizer': 'Adam'}. Best is trial 127 with value: 0.14463190499745765.
2026-05-13 07:31:56,801 - optuna.study.study - INFO - Trial 187 finished with value: 0.08855367651673461 and parameters: {'n_layers': 1, 'embedding_dim': 256, 'lr': 0.00031330720607375265, 'lambda_val': 2.4848143180147714e-06, 'batch_size': 676, 'optimizer': 'Adam'}. Best is trial 127 with value: 0.14463190499745765.
2026-05-13 07:32:01,633 - optuna.study._optimize - INFO - Trial 188 pruned. 
2026-05-13 07:32:05,915 - optuna.study._optimize - INFO - Trial 189 pruned. 
2026-05-13 07:32:09,298 - optuna.study._optimize - INFO - Trial 190 pruned. 
2026-05-13 07:32:13,668 - optuna.study._optimize - INFO - Trial 191 pruned. 
