2026-05-13 06:16:22,975 - optuna.study.study - INFO - Trial 197 finished with value: 0.09051809194917008 and parameters: {'n_layers': 1, 'embedding_dim': 256, 'lr': 0.0003661191946425738, 'lambda_val': 1.575180550727586e-05, 'batch_size': 686, 'optimizer': 'RMSprop'}. Best is trial 44 with value: 0.10435506491845455.
2026-05-13 06:17:00,815 - optuna.study.study - INFO - Trial 198 finished with value: 0.08060764664007575 and parameters: {'n_layers': 1, 'embedding_dim': 256, 'lr': 0.0003982670539801404, 'lambda_val': 2.0756826046839813e-05, 'batch_size': 671, 'optimizer': 'RMSprop'}. Best is trial 44 with value: 0.10435506491845455.
2026-05-13 06:17:36,548 - optuna.study.study - INFO - Trial 199 finished with value: 0.08922500762886162 and parameters: {'n_layers': 1, 'embedding_dim': 256, 'lr': 0.00034894737046697535, 'lambda_val': 1.5542778375013605e-05, 'batch_size': 587, 'optimizer': 'RMSprop'}. Best is trial 44 with value: 0.10435506491845455.
2026-05-13 06:18:04,233 - root - INFO -   **** Training e_100K_1c1dcs_rand1
2026-05-13 06:18:04,243 - root - INFO -   **** Getting 53072/65410 random edges
2026-05-13 06:18:04,932 - optuna.storages._rdb.storage - INFO - A new study created in RDB with name: Study_e_100K_1c1dcs_rand1
2026-05-13 06:18:54,087 - optuna.study.study - INFO - Trial 0 finished with value: 0.017459455575314663 and parameters: {'n_layers': 4, 'embedding_dim': 128, 'lr': 0.0003138982895474386, 'lambda_val': 0.0004427787997279446, 'batch_size': 3401, 'optimizer': 'Adam'}. Best is trial 0 with value: 0.017459455575314663.
2026-05-13 06:19:30,133 - optuna.study.study - INFO - Trial 1 finished with value: 0.0018428866289256314 and parameters: {'n_layers': 1, 'embedding_dim': 128, 'lr': 0.0002101937663458299, 'lambda_val': 2.8422073855590555e-05, 'batch_size': 1285, 'optimizer': 'SGD'}. Best is trial 0 with value: 0.017459455575314663.
2026-05-13 06:20:21,083 - optuna.study.study - INFO - Trial 2 finished with value: 0.0011587016114030027 and parameters: {'n_layers': 2, 'embedding_dim': 96, 'lr': 0.0010900150562529343, 'lambda_val': 0.013857803753582865, 'batch_size': 3797, 'optimizer': 'SGD'}. Best is trial 0 with value: 0.017459455575314663.
2026-05-13 06:21:12,878 - optuna.study.study - INFO - Trial 3 finished with value: 0.018466382742863524 and parameters: {'n_layers': 3, 'embedding_dim': 96, 'lr': 0.00045084140397040926, 'lambda_val': 0.00026472482599336716, 'batch_size': 2080, 'optimizer': 'Adam'}. Best is trial 3 with value: 0.018466382742863524.
2026-05-13 06:21:58,311 - optuna.study.study - INFO - Trial 4 finished with value: 0.034922289003558316 and parameters: {'n_layers': 1, 'embedding_dim': 32, 'lr': 2.7945940212777792e-05, 'lambda_val': 0.004066165208101953, 'batch_size': 3725, 'optimizer': 'Adam'}. Best is trial 4 with value: 0.034922289003558316.
2026-05-13 06:22:41,160 - optuna.study.study - INFO - Trial 5 finished with value: 0.031887907172480134 and parameters: {'n_layers': 1, 'embedding_dim': 256, 'lr': 0.0016066816699716038, 'lambda_val': 0.05292128737407537, 'batch_size': 543, 'optimizer': 'Adam'}. Best is trial 4 with value: 0.034922289003558316.
2026-05-13 06:23:29,794 - optuna.study.study - INFO - Trial 6 finished with value: 0.017516364013982166 and parameters: {'n_layers': 4, 'embedding_dim': 96, 'lr': 0.0007317986826140111, 'lambda_val': 0.0004645917565247455, 'batch_size': 625, 'optimizer': 'Adam'}. Best is trial 4 with value: 0.034922289003558316.
2026-05-13 06:23:33,536 - optuna.study._optimize - INFO - Trial 7 pruned. 
2026-05-13 06:23:38,506 - optuna.study._optimize - INFO - Trial 8 pruned. 
2026-05-13 06:23:42,839 - optuna.study._optimize - INFO - Trial 9 pruned. 
2026-05-13 06:23:47,389 - optuna.study._optimize - INFO - Trial 10 pruned. 
2026-05-13 06:24:03,974 - optuna.study._optimize - INFO - Trial 11 pruned. 
2026-05-13 06:24:50,481 - optuna.study.study - INFO - Trial 12 finished with value: 0.034224769405995295 and parameters: {'n_layers': 2, 'embedding_dim': 256, 'lr': 0.006619236407257306, 'lambda_val': 0.005536467093741559, 'batch_size': 4004, 'optimizer': 'RMSprop'}. Best is trial 4 with value: 0.034922289003558316.
2026-05-13 06:25:20,152 - optuna.study.study - INFO - Trial 13 finished with value: 0.03232419431021187 and parameters: {'n_layers': 2, 'embedding_dim': 32, 'lr': 0.011380449353104507, 'lambda_val': 0.0035980611937050364, 'batch_size': 4013, 'optimizer': 'RMSprop'}. Best is trial 4 with value: 0.034922289003558316.
2026-05-13 06:25:50,169 - optuna.study.study - INFO - Trial 14 finished with value: 0.027582842428795797 and parameters: {'n_layers': 2, 'embedding_dim': 32, 'lr': 0.006964917776886414, 'lambda_val': 0.0034209401532988943, 'batch_size': 3503, 'optimizer': 'RMSprop'}. Best is trial 4 with value: 0.034922289003558316.
2026-05-13 06:26:48,378 - optuna.study.study - INFO - Trial 15 finished with value: 0.013029939227483682 and parameters: {'n_layers': 3, 'embedding_dim': 256, 'lr': 5.666225585208241e-05, 'lambda_val': 0.010988482503681375, 'batch_size': 4071, 'optimizer': 'RMSprop'}. Best is trial 4 with value: 0.034922289003558316.
2026-05-13 06:27:17,923 - optuna.study.study - INFO - Trial 16 finished with value: 0.08045626043022923 and parameters: {'n_layers': 1, 'embedding_dim': 64, 'lr': 0.024365524212639333, 'lambda_val': 0.0010972820961299716, 'batch_size': 3284, 'optimizer': 'RMSprop'}. Best is trial 16 with value: 0.08045626043022923.
2026-05-13 06:27:46,692 - optuna.study.study - INFO - Trial 17 finished with value: 0.03939052378771334 and parameters: {'n_layers': 1, 'embedding_dim': 64, 'lr': 0.06106692624619652, 'lambda_val': 0.00010121977109541039, 'batch_size': 3168, 'optimizer': 'RMSprop'}. Best is trial 16 with value: 0.08045626043022923.
2026-05-13 06:28:16,061 - optuna.study.study - INFO - Trial 18 finished with value: 0.039409971045289566 and parameters: {'n_layers': 1, 'embedding_dim': 64, 'lr': 0.0784032800819394, 'lambda_val': 6.184433157757091e-05, 'batch_size': 3128, 'optimizer': 'RMSprop'}. Best is trial 16 with value: 0.08045626043022923.
2026-05-13 06:28:56,286 - optuna.study.study - INFO - Trial 19 finished with value: 0.03227771250823803 and parameters: {'n_layers': 1, 'embedding_dim': 64, 'lr': 0.0306815641534532, 'lambda_val': 4.1363539242216084e-06, 'batch_size': 2342, 'optimizer': 'RMSprop'}. Best is trial 16 with value: 0.08045626043022923.
2026-05-13 06:29:25,995 - optuna.study.study - INFO - Trial 20 finished with value: 0.041066242045547784 and parameters: {'n_layers': 2, 'embedding_dim': 64, 'lr': 0.030344484372427892, 'lambda_val': 0.0010406765792859286, 'batch_size': 2645, 'optimizer': 'RMSprop'}. Best is trial 16 with value: 0.08045626043022923.
2026-05-13 06:29:58,399 - optuna.study.study - INFO - Trial 21 finished with value: 0.0434904520848521 and parameters: {'n_layers': 2, 'embedding_dim': 64, 'lr': 0.025938862838821006, 'lambda_val': 0.0008027181518176703, 'batch_size': 2699, 'optimizer': 'RMSprop'}. Best is trial 16 with value: 0.08045626043022923.
2026-05-13 06:30:30,067 - optuna.study.study - INFO - Trial 22 finished with value: 0.04268112253715481 and parameters: {'n_layers': 2, 'embedding_dim': 64, 'lr': 0.01982009496102196, 'lambda_val': 0.0008958507911515596, 'batch_size': 2780, 'optimizer': 'RMSprop'}. Best is trial 16 with value: 0.08045626043022923.
2026-05-13 06:30:35,310 - optuna.study._optimize - INFO - Trial 23 pruned. 
2026-05-13 06:31:20,122 - optuna.study.study - INFO - Trial 24 finished with value: 0.04686717218813859 and parameters: {'n_layers': 2, 'embedding_dim': 64, 'lr': 0.020848183162361044, 'lambda_val': 0.0010848219789451007, 'batch_size': 2863, 'optimizer': 'RMSprop'}. Best is trial 16 with value: 0.08045626043022923.
2026-05-13 06:31:53,518 - optuna.study.study - INFO - Trial 25 finished with value: 0.02966725836339361 and parameters: {'n_layers': 2, 'embedding_dim': 64, 'lr': 0.002907207519816645, 'lambda_val': 0.00024999058383453666, 'batch_size': 3325, 'optimizer': 'RMSprop'}. Best is trial 16 with value: 0.08045626043022923.
2026-05-13 06:32:28,144 - optuna.study.study - INFO - Trial 26 finished with value: 0.031925362614263056 and parameters: {'n_layers': 3, 'embedding_dim': 64, 'lr': 0.02008712219991248, 'lambda_val': 0.00012313791014119908, 'batch_size': 2065, 'optimizer': 'RMSprop'}. Best is trial 16 with value: 0.08045626043022923.
2026-05-13 06:33:00,511 - optuna.study.study - INFO - Trial 27 finished with value: 0.03843462570640121 and parameters: {'n_layers': 2, 'embedding_dim': 64, 'lr': 0.0420819271979196, 'lambda_val': 0.001424690668692605, 'batch_size': 3033, 'optimizer': 'RMSprop'}. Best is trial 16 with value: 0.08045626043022923.
2026-05-13 06:33:04,816 - optuna.study._optimize - INFO - Trial 28 pruned. 
2026-05-13 06:33:10,638 - optuna.study._optimize - INFO - Trial 29 pruned. 
2026-05-13 06:33:15,088 - optuna.study._optimize - INFO - Trial 30 pruned. 
2026-05-13 06:33:47,199 - optuna.study.study - INFO - Trial 31 finished with value: 0.047617913042585475 and parameters: {'n_layers': 2, 'embedding_dim': 64, 'lr': 0.018489509026703276, 'lambda_val': 0.0009447696539682395, 'batch_size': 2664, 'optimizer': 'RMSprop'}. Best is trial 16 with value: 0.08045626043022923.
2026-05-13 06:34:26,208 - optuna.study.study - INFO - Trial 32 finished with value: 0.04643845156225252 and parameters: {'n_layers': 2, 'embedding_dim': 64, 'lr': 0.04134941860746946, 'lambda_val': 0.0016536171782847637, 'batch_size': 2638, 'optimizer': 'RMSprop'}. Best is trial 16 with value: 0.08045626043022923.
2026-05-13 06:34:56,288 - optuna.study.study - INFO - Trial 33 finished with value: 0.041503943207650426 and parameters: {'n_layers': 2, 'embedding_dim': 64, 'lr': 0.05518143026573697, 'lambda_val': 0.0017491075148264236, 'batch_size': 1742, 'optimizer': 'RMSprop'}. Best is trial 16 with value: 0.08045626043022923.
2026-05-13 06:35:00,890 - optuna.study._optimize - INFO - Trial 34 pruned. 
2026-05-13 06:35:05,053 - optuna.study._optimize - INFO - Trial 35 pruned. 
2026-05-13 06:35:09,707 - optuna.study._optimize - INFO - Trial 36 pruned. 
2026-05-13 06:35:50,748 - optuna.study.study - INFO - Trial 37 finished with value: 0.0614964246175742 and parameters: {'n_layers': 1, 'embedding_dim': 96, 'lr': 0.015507763231545948, 'lambda_val': 0.0001992833721308321, 'batch_size': 2525, 'optimizer': 'RMSprop'}. Best is trial 16 with value: 0.08045626043022923.
2026-05-13 06:35:54,732 - optuna.study._optimize - INFO - Trial 38 pruned. 
2026-05-13 06:36:22,352 - optuna.study.study - INFO - Trial 39 finished with value: 0.046294717751214 and parameters: {'n_layers': 1, 'embedding_dim': 96, 'lr': 0.004888180248269252, 'lambda_val': 0.00012486499790516272, 'batch_size': 1852, 'optimizer': 'Adam'}. Best is trial 16 with value: 0.08045626043022923.
2026-05-13 06:36:55,816 - optuna.study.study - INFO - Trial 40 finished with value: 0.04605323863437821 and parameters: {'n_layers': 1, 'embedding_dim': 96, 'lr': 0.001181624637231835, 'lambda_val': 1.3024358632212903e-05, 'batch_size': 2311, 'optimizer': 'RMSprop'}. Best is trial 16 with value: 0.08045626043022923.
2026-05-13 06:37:06,760 - optuna.study._optimize - INFO - Trial 41 pruned. 
2026-05-13 06:37:53,106 - optuna.study.study - INFO - Trial 42 finished with value: 0.04276610397693075 and parameters: {'n_layers': 2, 'embedding_dim': 96, 'lr': 0.020134677763136072, 'lambda_val': 0.0021278165006537782, 'batch_size': 1290, 'optimizer': 'RMSprop'}. Best is trial 16 with value: 0.08045626043022923.
2026-05-13 06:38:39,873 - optuna.study.study - INFO - Trial 43 finished with value: 0.04277307674756528 and parameters: {'n_layers': 2, 'embedding_dim': 128, 'lr': 0.009605379006742045, 'lambda_val': 0.00019323637443740153, 'batch_size': 2476, 'optimizer': 'RMSprop'}. Best is trial 16 with value: 0.08045626043022923.
2026-05-13 06:38:44,545 - optuna.study._optimize - INFO - Trial 44 pruned. 
2026-05-13 06:39:03,917 - optuna.study._optimize - INFO - Trial 45 pruned. 
2026-05-13 06:40:30,651 - optuna.study.study - INFO - Trial 46 finished with value: 0.016281503486571636 and parameters: {'n_layers': 4, 'embedding_dim': 256, 'lr': 0.03722518912705234, 'lambda_val': 0.0023729636768476323, 'batch_size': 3768, 'optimizer': 'RMSprop'}. Best is trial 16 with value: 0.08045626043022923.
2026-05-13 06:40:35,972 - optuna.study._optimize - INFO - Trial 47 pruned. 
2026-05-13 06:40:52,650 - optuna.study._optimize - INFO - Trial 48 pruned. 
2026-05-13 06:40:56,721 - optuna.study._optimize - INFO - Trial 49 pruned. 
2026-05-13 06:41:00,727 - optuna.study._optimize - INFO - Trial 50 pruned. 
2026-05-13 06:41:26,545 - optuna.study.study - INFO - Trial 51 finished with value: 0.04467936344745213 and parameters: {'n_layers': 1, 'embedding_dim': 96, 'lr': 0.006086011234487483, 'lambda_val': 0.00016208030815317574, 'batch_size': 1912, 'optimizer': 'Adam'}. Best is trial 16 with value: 0.08045626043022923.
2026-05-13 06:41:51,235 - optuna.study.study - INFO - Trial 52 finished with value: 0.04555405886393596 and parameters: {'n_layers': 1, 'embedding_dim': 96, 'lr': 0.004213869604801716, 'lambda_val': 7.02612243285747e-05, 'batch_size': 1746, 'optimizer': 'Adam'}. Best is trial 16 with value: 0.08045626043022923.
2026-05-13 06:42:15,727 - optuna.study.study - INFO - Trial 53 finished with value: 0.035413664621214994 and parameters: {'n_layers': 1, 'embedding_dim': 96, 'lr': 0.025519837468410866, 'lambda_val': 4.297221992634845e-05, 'batch_size': 1477, 'optimizer': 'Adam'}. Best is trial 16 with value: 0.08045626043022923.
2026-05-13 06:42:42,287 - optuna.study.study - INFO - Trial 54 finished with value: 0.05333411379469756 and parameters: {'n_layers': 1, 'embedding_dim': 96, 'lr': 0.00458351165292763, 'lambda_val': 0.0004036681304613564, 'batch_size': 896, 'optimizer': 'Adam'}. Best is trial 16 with value: 0.08045626043022923.
2026-05-13 06:43:23,691 - optuna.study.study - INFO - Trial 55 finished with value: 0.05112708313078347 and parameters: {'n_layers': 2, 'embedding_dim': 256, 'lr': 0.015756055759753463, 'lambda_val': 0.00038200949860979125, 'batch_size': 827, 'optimizer': 'Adam'}. Best is trial 16 with value: 0.08045626043022923.
2026-05-13 06:43:56,971 - optuna.study.study - INFO - Trial 56 finished with value: 0.06716303518469133 and parameters: {'n_layers': 1, 'embedding_dim': 256, 'lr': 0.016272547414316378, 'lambda_val': 0.00028723108508393283, 'batch_size': 948, 'optimizer': 'Adam'}. Best is trial 16 with value: 0.08045626043022923.
2026-05-13 06:44:31,003 - optuna.study.study - INFO - Trial 57 finished with value: 0.06632601415950842 and parameters: {'n_layers': 1, 'embedding_dim': 256, 'lr': 0.014591943745582472, 'lambda_val': 0.00039214448111940113, 'batch_size': 816, 'optimizer': 'Adam'}. Best is trial 16 with value: 0.08045626043022923.
2026-05-13 06:45:06,478 - optuna.study.study - INFO - Trial 58 finished with value: 0.06261994956303062 and parameters: {'n_layers': 1, 'embedding_dim': 256, 'lr': 0.0030097025740497556, 'lambda_val': 0.00032591797669038417, 'batch_size': 850, 'optimizer': 'Adam'}. Best is trial 16 with value: 0.08045626043022923.
2026-05-13 06:45:40,814 - optuna.study.study - INFO - Trial 59 finished with value: 0.0660444604387206 and parameters: {'n_layers': 1, 'embedding_dim': 256, 'lr': 0.0024130989918730817, 'lambda_val': 0.000182490357677794, 'batch_size': 801, 'optimizer': 'Adam'}. Best is trial 16 with value: 0.08045626043022923.
2026-05-13 06:46:21,120 - optuna.study.study - INFO - Trial 60 finished with value: 0.06776437509463797 and parameters: {'n_layers': 1, 'embedding_dim': 256, 'lr': 0.0016572586531708898, 'lambda_val': 0.00021171736037340898, 'batch_size': 973, 'optimizer': 'Adam'}. Best is trial 16 with value: 0.08045626043022923.
2026-05-13 06:46:56,795 - optuna.study.study - INFO - Trial 61 finished with value: 0.06956488240814725 and parameters: {'n_layers': 1, 'embedding_dim': 256, 'lr': 0.0006921931530518412, 'lambda_val': 0.00020288225028472964, 'batch_size': 1033, 'optimizer': 'Adam'}. Best is trial 16 with value: 0.08045626043022923.
2026-05-13 06:47:38,709 - optuna.study.study - INFO - Trial 62 finished with value: 0.07039063937930184 and parameters: {'n_layers': 1, 'embedding_dim': 256, 'lr': 0.000662374425194399, 'lambda_val': 8.588155393815506e-05, 'batch_size': 1021, 'optimizer': 'Adam'}. Best is trial 16 with value: 0.08045626043022923.
2026-05-13 06:48:12,598 - optuna.study.study - INFO - Trial 63 finished with value: 0.07323604751175353 and parameters: {'n_layers': 1, 'embedding_dim': 256, 'lr': 0.0005198743661671882, 'lambda_val': 9.225016618338051e-05, 'batch_size': 1032, 'optimizer': 'Adam'}. Best is trial 16 with value: 0.08045626043022923.
2026-05-13 06:48:47,531 - optuna.study.study - INFO - Trial 64 finished with value: 0.0789864923859616 and parameters: {'n_layers': 1, 'embedding_dim': 256, 'lr': 0.00033527704831223093, 'lambda_val': 3.706444041333165e-05, 'batch_size': 1123, 'optimizer': 'Adam'}. Best is trial 16 with value: 0.08045626043022923.
2026-05-13 06:49:21,548 - optuna.study.study - INFO - Trial 65 finished with value: 0.065264978319525 and parameters: {'n_layers': 1, 'embedding_dim': 256, 'lr': 0.0005516234582010941, 'lambda_val': 3.579591972676641e-05, 'batch_size': 1119, 'optimizer': 'Adam'}. Best is trial 16 with value: 0.08045626043022923.
2026-05-13 06:49:59,887 - optuna.study.study - INFO - Trial 66 finished with value: 0.0884031985320836 and parameters: {'n_layers': 1, 'embedding_dim': 256, 'lr': 0.00025065664166375824, 'lambda_val': 1.0039074643874855e-05, 'batch_size': 1039, 'optimizer': 'Adam'}. Best is trial 66 with value: 0.0884031985320836.
2026-05-13 06:50:31,201 - optuna.study.study - INFO - Trial 67 finished with value: 0.09090913797038978 and parameters: {'n_layers': 1, 'embedding_dim': 256, 'lr': 0.00032268543466892327, 'lambda_val': 4.257091818525584e-06, 'batch_size': 525, 'optimizer': 'Adam'}. Best is trial 67 with value: 0.09090913797038978.
2026-05-13 06:51:11,622 - optuna.study.study - INFO - Trial 68 finished with value: 0.11287022865576848 and parameters: {'n_layers': 1, 'embedding_dim': 256, 'lr': 0.00026817886093038036, 'lambda_val': 5.128718614074358e-06, 'batch_size': 543, 'optimizer': 'Adam'}. Best is trial 68 with value: 0.11287022865576848.
2026-05-13 06:51:42,482 - optuna.study.study - INFO - Trial 69 finished with value: 0.09466587008825139 and parameters: {'n_layers': 1, 'embedding_dim': 256, 'lr': 0.00027545374589340536, 'lambda_val': 5.153253418467469e-06, 'batch_size': 516, 'optimizer': 'Adam'}. Best is trial 68 with value: 0.11287022865576848.
2026-05-13 06:51:46,883 - optuna.study._optimize - INFO - Trial 70 pruned. 
2026-05-13 06:52:19,456 - optuna.study.study - INFO - Trial 71 finished with value: 0.08166768878617948 and parameters: {'n_layers': 1, 'embedding_dim': 256, 'lr': 0.00033797098990515746, 'lambda_val': 4.877758488021809e-06, 'batch_size': 678, 'optimizer': 'Adam'}. Best is trial 68 with value: 0.11287022865576848.
2026-05-13 06:52:53,839 - optuna.study.study - INFO - Trial 72 finished with value: 0.08518775212259608 and parameters: {'n_layers': 1, 'embedding_dim': 256, 'lr': 0.0003321856919156646, 'lambda_val': 4.811987408607262e-06, 'batch_size': 703, 'optimizer': 'Adam'}. Best is trial 68 with value: 0.11287022865576848.
2026-05-13 06:53:30,097 - optuna.study.study - INFO - Trial 73 finished with value: 0.08274565891337327 and parameters: {'n_layers': 1, 'embedding_dim': 256, 'lr': 0.00033234825233049075, 'lambda_val': 4.039456573485319e-06, 'batch_size': 677, 'optimizer': 'Adam'}. Best is trial 68 with value: 0.11287022865576848.
2026-05-13 06:53:34,313 - optuna.study._optimize - INFO - Trial 74 pruned. 
2026-05-13 06:54:09,037 - optuna.study.study - INFO - Trial 75 finished with value: 0.09138893792680661 and parameters: {'n_layers': 1, 'embedding_dim': 256, 'lr': 0.0003061657561167729, 'lambda_val': 7.195841886385679e-06, 'batch_size': 689, 'optimizer': 'Adam'}. Best is trial 68 with value: 0.11287022865576848.
2026-05-13 06:54:42,833 - optuna.study.study - INFO - Trial 76 finished with value: 0.08456804133553993 and parameters: {'n_layers': 1, 'embedding_dim': 256, 'lr': 0.0003073606845144984, 'lambda_val': 7.31004958129883e-06, 'batch_size': 684, 'optimizer': 'Adam'}. Best is trial 68 with value: 0.11287022865576848.
2026-05-13 06:55:17,262 - optuna.study.study - INFO - Trial 77 finished with value: 0.10890695071938568 and parameters: {'n_layers': 1, 'embedding_dim': 256, 'lr': 0.0002516852250368305, 'lambda_val': 7.789162399461286e-06, 'batch_size': 512, 'optimizer': 'Adam'}. Best is trial 68 with value: 0.11287022865576848.
2026-05-13 06:55:51,841 - optuna.study.study - INFO - Trial 78 finished with value: 0.09269762212264197 and parameters: {'n_layers': 1, 'embedding_dim': 256, 'lr': 0.0002612925572235747, 'lambda_val': 8.764303974384737e-06, 'batch_size': 518, 'optimizer': 'Adam'}. Best is trial 68 with value: 0.11287022865576848.
2026-05-13 06:55:56,316 - optuna.study._optimize - INFO - Trial 79 pruned. 
2026-05-13 06:56:31,149 - optuna.study.study - INFO - Trial 80 finished with value: 0.10804494027770806 and parameters: {'n_layers': 1, 'embedding_dim': 256, 'lr': 0.00025631226055132023, 'lambda_val': 1.8837898960718517e-06, 'batch_size': 554, 'optimizer': 'Adam'}. Best is trial 68 with value: 0.11287022865576848.
2026-05-13 06:57:05,313 - optuna.study.study - INFO - Trial 81 finished with value: 0.09789168781419301 and parameters: {'n_layers': 1, 'embedding_dim': 256, 'lr': 0.00024982002793520915, 'lambda_val': 2.0012855022436392e-06, 'batch_size': 529, 'optimizer': 'Adam'}. Best is trial 68 with value: 0.11287022865576848.
2026-05-13 06:57:38,758 - optuna.study.study - INFO - Trial 82 finished with value: 0.10067867763459908 and parameters: {'n_layers': 1, 'embedding_dim': 256, 'lr': 0.00024826569827442473, 'lambda_val': 1.7694349334673489e-06, 'batch_size': 532, 'optimizer': 'Adam'}. Best is trial 68 with value: 0.11287022865576848.
