2026-05-13 12:24:09,914 - optuna.study._optimize - INFO - Trial 59 pruned. 
2026-05-13 12:24:14,206 - optuna.study._optimize - INFO - Trial 60 pruned. 
2026-05-13 12:24:18,768 - optuna.study._optimize - INFO - Trial 61 pruned. 
2026-05-13 12:24:47,502 - optuna.study.study - INFO - Trial 62 finished with value: 0.0061455096778363265 and parameters: {'n_layers': 2, 'embedding_dim': 96, 'lr': 0.0001483915659395962, 'lambda_val': 3.3450180189845145e-06, 'batch_size': 920, 'optimizer': 'Adam'}. Best is trial 19 with value: 0.021850334151434444.
2026-05-13 12:24:52,168 - optuna.study._optimize - INFO - Trial 63 pruned. 
2026-05-13 12:24:56,835 - optuna.study._optimize - INFO - Trial 64 pruned. 
2026-05-13 12:25:00,814 - optuna.study._optimize - INFO - Trial 65 pruned. 
2026-05-13 12:25:04,679 - optuna.study._optimize - INFO - Trial 66 pruned. 
2026-05-13 12:25:08,247 - optuna.study._optimize - INFO - Trial 67 pruned. 
2026-05-13 12:25:12,112 - optuna.study._optimize - INFO - Trial 68 pruned. 
2026-05-13 12:25:17,598 - optuna.study._optimize - INFO - Trial 69 pruned. 
2026-05-13 12:25:21,944 - optuna.study._optimize - INFO - Trial 70 pruned. 
2026-05-13 12:25:51,355 - optuna.study.study - INFO - Trial 71 finished with value: 0.006327067824344316 and parameters: {'n_layers': 1, 'embedding_dim': 64, 'lr': 0.00013268889950140598, 'lambda_val': 2.454140803489532e-06, 'batch_size': 3843, 'optimizer': 'RMSprop'}. Best is trial 19 with value: 0.021850334151434444.
2026-05-13 12:25:57,032 - optuna.study._optimize - INFO - Trial 72 pruned. 
2026-05-13 12:26:00,637 - optuna.study._optimize - INFO - Trial 73 pruned. 
2026-05-13 12:26:30,561 - optuna.study.study - INFO - Trial 74 finished with value: 0.005258182166830143 and parameters: {'n_layers': 1, 'embedding_dim': 64, 'lr': 0.000560437106459903, 'lambda_val': 1.4809166740983492e-06, 'batch_size': 3978, 'optimizer': 'RMSprop'}. Best is trial 19 with value: 0.021850334151434444.
2026-05-13 12:27:00,830 - optuna.study.study - INFO - Trial 75 finished with value: 0.004692204641686075 and parameters: {'n_layers': 1, 'embedding_dim': 64, 'lr': 0.0001865531426273123, 'lambda_val': 5.7002087372806405e-06, 'batch_size': 3796, 'optimizer': 'RMSprop'}. Best is trial 19 with value: 0.021850334151434444.
2026-05-13 12:27:36,795 - optuna.study.study - INFO - Trial 76 finished with value: 0.006477728129892414 and parameters: {'n_layers': 2, 'embedding_dim': 256, 'lr': 0.00027352578494752966, 'lambda_val': 3.2243766469171916e-06, 'batch_size': 3476, 'optimizer': 'RMSprop'}. Best is trial 19 with value: 0.021850334151434444.
2026-05-13 12:27:40,781 - optuna.study._optimize - INFO - Trial 77 pruned. 
2026-05-13 12:27:45,082 - optuna.study._optimize - INFO - Trial 78 pruned. 
2026-05-13 12:27:49,649 - optuna.study._optimize - INFO - Trial 79 pruned. 
2026-05-13 12:27:53,776 - optuna.study._optimize - INFO - Trial 80 pruned. 
2026-05-13 12:27:58,100 - optuna.study._optimize - INFO - Trial 81 pruned. 
2026-05-13 12:28:02,849 - optuna.study._optimize - INFO - Trial 82 pruned. 
2026-05-13 12:28:08,027 - optuna.study._optimize - INFO - Trial 83 pruned. 
2026-05-13 12:28:40,810 - optuna.study.study - INFO - Trial 84 finished with value: 0.005918063778519287 and parameters: {'n_layers': 1, 'embedding_dim': 256, 'lr': 9.205108494549427e-05, 'lambda_val': 0.0004419423468966423, 'batch_size': 3206, 'optimizer': 'Adam'}. Best is trial 19 with value: 0.021850334151434444.
2026-05-13 12:28:45,064 - optuna.study._optimize - INFO - Trial 85 pruned. 
2026-05-13 12:28:49,389 - optuna.study._optimize - INFO - Trial 86 pruned. 
2026-05-13 12:28:54,276 - optuna.study._optimize - INFO - Trial 87 pruned. 
2026-05-13 12:28:58,599 - optuna.study._optimize - INFO - Trial 88 pruned. 
2026-05-13 12:29:03,281 - optuna.study._optimize - INFO - Trial 89 pruned. 
2026-05-13 12:29:07,435 - optuna.study._optimize - INFO - Trial 90 pruned. 
2026-05-13 12:29:40,442 - optuna.study.study - INFO - Trial 91 finished with value: 0.005753134139101887 and parameters: {'n_layers': 1, 'embedding_dim': 256, 'lr': 0.00019120955221136208, 'lambda_val': 9.124663159709522e-05, 'batch_size': 2837, 'optimizer': 'Adam'}. Best is trial 19 with value: 0.021850334151434444.
2026-05-13 12:29:44,599 - optuna.study._optimize - INFO - Trial 92 pruned. 
2026-05-13 12:30:18,479 - optuna.study.study - INFO - Trial 93 finished with value: 0.005743615735641816 and parameters: {'n_layers': 1, 'embedding_dim': 256, 'lr': 0.00012819984017326485, 'lambda_val': 5.322831703877459e-05, 'batch_size': 3704, 'optimizer': 'Adam'}. Best is trial 19 with value: 0.021850334151434444.
2026-05-13 12:30:51,642 - optuna.study.study - INFO - Trial 94 finished with value: 0.005798354441219463 and parameters: {'n_layers': 1, 'embedding_dim': 256, 'lr': 5.5271527808338105e-05, 'lambda_val': 0.000675766150993663, 'batch_size': 3651, 'optimizer': 'Adam'}. Best is trial 19 with value: 0.021850334151434444.
2026-05-13 12:30:56,181 - optuna.study._optimize - INFO - Trial 95 pruned. 
2026-05-13 12:31:24,756 - optuna.study.study - INFO - Trial 96 finished with value: 0.009812145171770537 and parameters: {'n_layers': 1, 'embedding_dim': 96, 'lr': 0.00010558065597341831, 'lambda_val': 3.7544755981804976e-06, 'batch_size': 1824, 'optimizer': 'Adam'}. Best is trial 19 with value: 0.021850334151434444.
2026-05-13 12:32:03,247 - optuna.study.study - INFO - Trial 97 finished with value: 0.016852930274776454 and parameters: {'n_layers': 1, 'embedding_dim': 96, 'lr': 6.87662715346095e-05, 'lambda_val': 3.976686822682015e-06, 'batch_size': 1872, 'optimizer': 'Adam'}. Best is trial 19 with value: 0.021850334151434444.
2026-05-13 12:32:33,680 - optuna.study.study - INFO - Trial 98 finished with value: 0.005285734099713298 and parameters: {'n_layers': 2, 'embedding_dim': 96, 'lr': 8.057433719118499e-05, 'lambda_val': 2.571837469076578e-06, 'batch_size': 3363, 'optimizer': 'RMSprop'}. Best is trial 19 with value: 0.021850334151434444.
2026-05-13 12:32:37,432 - optuna.study._optimize - INFO - Trial 99 pruned. 
2026-05-13 12:33:05,240 - optuna.study.study - INFO - Trial 100 finished with value: 0.005815745557795838 and parameters: {'n_layers': 1, 'embedding_dim': 96, 'lr': 0.00014361646253701203, 'lambda_val': 2.36579428798054e-05, 'batch_size': 1947, 'optimizer': 'Adam'}. Best is trial 19 with value: 0.021850334151434444.
2026-05-13 12:33:32,433 - optuna.study.study - INFO - Trial 101 finished with value: 0.011227399100046873 and parameters: {'n_layers': 1, 'embedding_dim': 96, 'lr': 0.00010397149855764799, 'lambda_val': 3.956006434133265e-06, 'batch_size': 1717, 'optimizer': 'Adam'}. Best is trial 19 with value: 0.021850334151434444.
2026-05-13 12:33:36,822 - optuna.study._optimize - INFO - Trial 102 pruned. 
2026-05-13 12:34:05,235 - optuna.study.study - INFO - Trial 103 finished with value: 0.009411149579873834 and parameters: {'n_layers': 1, 'embedding_dim': 96, 'lr': 0.00010573924183152751, 'lambda_val': 3.926336843061465e-06, 'batch_size': 1561, 'optimizer': 'Adam'}. Best is trial 19 with value: 0.021850334151434444.
2026-05-13 12:34:08,798 - optuna.study._optimize - INFO - Trial 104 pruned. 
2026-05-13 12:34:12,853 - optuna.study._optimize - INFO - Trial 105 pruned. 
2026-05-13 12:34:17,494 - optuna.study._optimize - INFO - Trial 106 pruned. 
2026-05-13 12:34:45,609 - optuna.study.study - INFO - Trial 107 finished with value: 0.03265563060012234 and parameters: {'n_layers': 1, 'embedding_dim': 96, 'lr': 7.989218728984719e-05, 'lambda_val': 4.880584125149629e-06, 'batch_size': 639, 'optimizer': 'Adam'}. Best is trial 107 with value: 0.03265563060012234.
2026-05-13 12:35:13,848 - optuna.study.study - INFO - Trial 108 finished with value: 0.00903204542272167 and parameters: {'n_layers': 1, 'embedding_dim': 96, 'lr': 0.00016754598379132709, 'lambda_val': 6.723976329453099e-06, 'batch_size': 634, 'optimizer': 'Adam'}. Best is trial 107 with value: 0.03265563060012234.
2026-05-13 12:35:17,387 - optuna.study._optimize - INFO - Trial 109 pruned. 
2026-05-13 12:35:47,050 - optuna.study.study - INFO - Trial 110 finished with value: 0.004895314237692859 and parameters: {'n_layers': 2, 'embedding_dim': 96, 'lr': 0.00024100107516693118, 'lambda_val': 2.4002345349586063e-06, 'batch_size': 1123, 'optimizer': 'RMSprop'}. Best is trial 107 with value: 0.03265563060012234.
2026-05-13 12:36:14,580 - optuna.study.study - INFO - Trial 111 finished with value: 0.0258179719716779 and parameters: {'n_layers': 1, 'embedding_dim': 96, 'lr': 8.630529755412867e-05, 'lambda_val': 1.2060354960571042e-05, 'batch_size': 716, 'optimizer': 'Adam'}. Best is trial 107 with value: 0.03265563060012234.
2026-05-13 12:36:18,532 - optuna.study._optimize - INFO - Trial 112 pruned. 
2026-05-13 12:36:22,769 - optuna.study._optimize - INFO - Trial 113 pruned. 
2026-05-13 12:36:52,160 - optuna.study.study - INFO - Trial 114 finished with value: 0.022693460967201772 and parameters: {'n_layers': 1, 'embedding_dim': 96, 'lr': 0.00011807553712163831, 'lambda_val': 1.6356606592523133e-06, 'batch_size': 624, 'optimizer': 'Adam'}. Best is trial 107 with value: 0.03265563060012234.
2026-05-13 12:36:56,616 - optuna.study._optimize - INFO - Trial 115 pruned. 
2026-05-13 12:37:00,747 - optuna.study._optimize - INFO - Trial 116 pruned. 
2026-05-13 12:37:04,902 - optuna.study._optimize - INFO - Trial 117 pruned. 
2026-05-13 12:37:09,032 - optuna.study._optimize - INFO - Trial 118 pruned. 
2026-05-13 12:37:37,794 - optuna.study.study - INFO - Trial 119 finished with value: 0.007625326809152944 and parameters: {'n_layers': 4, 'embedding_dim': 96, 'lr': 0.00012642432862981193, 'lambda_val': 2.6194100489202097e-06, 'batch_size': 774, 'optimizer': 'RMSprop'}. Best is trial 107 with value: 0.03265563060012234.
2026-05-13 12:38:03,926 - optuna.study.study - INFO - Trial 120 finished with value: 0.02998252354263807 and parameters: {'n_layers': 1, 'embedding_dim': 64, 'lr': 9.189120597908531e-05, 'lambda_val': 1.5445810026165065e-06, 'batch_size': 1213, 'optimizer': 'Adam'}. Best is trial 107 with value: 0.03265563060012234.
2026-05-13 12:38:32,397 - optuna.study.study - INFO - Trial 121 finished with value: 0.030128356039414887 and parameters: {'n_layers': 1, 'embedding_dim': 64, 'lr': 9.668568870606183e-05, 'lambda_val': 1.728409465158165e-06, 'batch_size': 863, 'optimizer': 'Adam'}. Best is trial 107 with value: 0.03265563060012234.
2026-05-13 12:39:00,098 - optuna.study.study - INFO - Trial 122 finished with value: 0.00651871739873933 and parameters: {'n_layers': 1, 'embedding_dim': 64, 'lr': 0.00015518164007978318, 'lambda_val': 1.5226860540676537e-06, 'batch_size': 1249, 'optimizer': 'Adam'}. Best is trial 107 with value: 0.03265563060012234.
2026-05-13 12:39:04,010 - optuna.study._optimize - INFO - Trial 123 pruned. 
2026-05-13 12:39:32,447 - optuna.study.study - INFO - Trial 124 finished with value: 0.02651287494343987 and parameters: {'n_layers': 1, 'embedding_dim': 64, 'lr': 0.00011623479738645606, 'lambda_val': 1.9566482518376955e-06, 'batch_size': 860, 'optimizer': 'Adam'}. Best is trial 107 with value: 0.03265563060012234.
2026-05-13 12:40:02,731 - optuna.study.study - INFO - Trial 125 finished with value: 0.010232814339334928 and parameters: {'n_layers': 1, 'embedding_dim': 64, 'lr': 0.0002152415780515688, 'lambda_val': 1.751536258510224e-06, 'batch_size': 724, 'optimizer': 'Adam'}. Best is trial 107 with value: 0.03265563060012234.
2026-05-13 12:40:06,434 - optuna.study._optimize - INFO - Trial 126 pruned. 
2026-05-13 12:40:33,727 - optuna.study.study - INFO - Trial 127 finished with value: 0.020935593874005544 and parameters: {'n_layers': 1, 'embedding_dim': 64, 'lr': 0.00011830579908812592, 'lambda_val': 3.0759867323448026e-06, 'batch_size': 873, 'optimizer': 'Adam'}. Best is trial 107 with value: 0.03265563060012234.
2026-05-13 12:41:02,744 - optuna.study.study - INFO - Trial 128 finished with value: 0.018007439981038334 and parameters: {'n_layers': 1, 'embedding_dim': 64, 'lr': 0.00012106117587701227, 'lambda_val': 2.0757557291119086e-06, 'batch_size': 875, 'optimizer': 'Adam'}. Best is trial 107 with value: 0.03265563060012234.
2026-05-13 12:41:29,756 - optuna.study.study - INFO - Trial 129 finished with value: 0.013613516079838826 and parameters: {'n_layers': 1, 'embedding_dim': 64, 'lr': 0.00012855325092355965, 'lambda_val': 3.094001131750622e-06, 'batch_size': 1059, 'optimizer': 'Adam'}. Best is trial 107 with value: 0.03265563060012234.
2026-05-13 12:41:57,401 - optuna.study.study - INFO - Trial 130 finished with value: 0.006147548968091492 and parameters: {'n_layers': 1, 'embedding_dim': 64, 'lr': 0.0003425910613231457, 'lambda_val': 2.285861210940029e-06, 'batch_size': 871, 'optimizer': 'Adam'}. Best is trial 107 with value: 0.03265563060012234.
2026-05-13 12:42:24,032 - optuna.study.study - INFO - Trial 131 finished with value: 0.020667193499677664 and parameters: {'n_layers': 1, 'embedding_dim': 64, 'lr': 0.000124177182247289, 'lambda_val': 1.955865250941696e-06, 'batch_size': 718, 'optimizer': 'Adam'}. Best is trial 107 with value: 0.03265563060012234.
2026-05-13 12:42:52,249 - optuna.study.study - INFO - Trial 132 finished with value: 0.01730353499335087 and parameters: {'n_layers': 1, 'embedding_dim': 64, 'lr': 0.0001543119815246464, 'lambda_val': 2.698320888360501e-06, 'batch_size': 674, 'optimizer': 'Adam'}. Best is trial 107 with value: 0.03265563060012234.
2026-05-13 12:43:20,747 - optuna.study.study - INFO - Trial 133 finished with value: 0.014010813134318354 and parameters: {'n_layers': 1, 'embedding_dim': 64, 'lr': 0.00016701057675013034, 'lambda_val': 3.401997735269701e-06, 'batch_size': 700, 'optimizer': 'Adam'}. Best is trial 107 with value: 0.03265563060012234.
2026-05-13 12:43:25,053 - optuna.study._optimize - INFO - Trial 134 pruned. 
2026-05-13 12:43:52,155 - optuna.study.study - INFO - Trial 135 finished with value: 0.027593992937397494 and parameters: {'n_layers': 1, 'embedding_dim': 64, 'lr': 0.0001259114358949875, 'lambda_val': 1.3535961145089268e-06, 'batch_size': 733, 'optimizer': 'Adam'}. Best is trial 107 with value: 0.03265563060012234.
2026-05-13 12:44:20,183 - optuna.study.study - INFO - Trial 136 finished with value: 0.005883364053447505 and parameters: {'n_layers': 1, 'embedding_dim': 64, 'lr': 0.00026982501852769507, 'lambda_val': 1.3837309289265178e-06, 'batch_size': 634, 'optimizer': 'Adam'}. Best is trial 107 with value: 0.03265563060012234.
2026-05-13 12:44:47,424 - optuna.study.study - INFO - Trial 137 finished with value: 0.022030987722057492 and parameters: {'n_layers': 1, 'embedding_dim': 64, 'lr': 0.00012579308436791407, 'lambda_val': 2.8055275088275346e-06, 'batch_size': 744, 'optimizer': 'Adam'}. Best is trial 107 with value: 0.03265563060012234.
2026-05-13 12:45:15,507 - optuna.study.study - INFO - Trial 138 finished with value: 0.005055739208643831 and parameters: {'n_layers': 1, 'embedding_dim': 64, 'lr': 0.00019834743324073463, 'lambda_val': 1.6786049323340478e-06, 'batch_size': 756, 'optimizer': 'Adam'}. Best is trial 107 with value: 0.03265563060012234.
2026-05-13 12:45:43,207 - optuna.study.study - INFO - Trial 139 finished with value: 0.016386788637077012 and parameters: {'n_layers': 1, 'embedding_dim': 64, 'lr': 0.00013896233018611897, 'lambda_val': 1.3626519235088037e-06, 'batch_size': 860, 'optimizer': 'Adam'}. Best is trial 107 with value: 0.03265563060012234.
2026-05-13 12:46:10,734 - optuna.study.study - INFO - Trial 140 finished with value: 0.015475431380728022 and parameters: {'n_layers': 1, 'embedding_dim': 64, 'lr': 0.00012163198135730891, 'lambda_val': 1.0070936844746845e-06, 'batch_size': 909, 'optimizer': 'Adam'}. Best is trial 107 with value: 0.03265563060012234.
2026-05-13 12:46:40,396 - optuna.study.study - INFO - Trial 141 finished with value: 0.021478312269196304 and parameters: {'n_layers': 1, 'embedding_dim': 64, 'lr': 0.0001561525245768901, 'lambda_val': 2.670166844474403e-06, 'batch_size': 582, 'optimizer': 'Adam'}. Best is trial 107 with value: 0.03265563060012234.
2026-05-13 12:46:44,469 - optuna.study._optimize - INFO - Trial 142 pruned. 
2026-05-13 12:47:12,168 - optuna.study.study - INFO - Trial 143 finished with value: 0.01607655420651901 and parameters: {'n_layers': 1, 'embedding_dim': 64, 'lr': 0.00011591472541284758, 'lambda_val': 2.2276323808424062e-06, 'batch_size': 971, 'optimizer': 'Adam'}. Best is trial 107 with value: 0.03265563060012234.
2026-05-13 12:47:40,314 - optuna.study.study - INFO - Trial 144 finished with value: 0.008225404255396248 and parameters: {'n_layers': 1, 'embedding_dim': 64, 'lr': 0.0001936529256748281, 'lambda_val': 2.8501915717648054e-06, 'batch_size': 735, 'optimizer': 'Adam'}. Best is trial 107 with value: 0.03265563060012234.
2026-05-13 12:47:45,690 - optuna.study._optimize - INFO - Trial 145 pruned. 
2026-05-13 12:48:23,275 - optuna.study.study - INFO - Trial 146 finished with value: 0.006067500405188003 and parameters: {'n_layers': 1, 'embedding_dim': 64, 'lr': 0.0003261876638473285, 'lambda_val': 1.303306772114216e-06, 'batch_size': 645, 'optimizer': 'Adam'}. Best is trial 107 with value: 0.03265563060012234.
2026-05-13 12:48:26,960 - optuna.study._optimize - INFO - Trial 147 pruned. 
2026-05-13 12:48:30,922 - optuna.study._optimize - INFO - Trial 148 pruned. 
2026-05-13 12:48:34,248 - optuna.study._optimize - INFO - Trial 149 pruned. 
2026-05-13 12:48:54,546 - optuna.study.study - INFO - Trial 150 finished with value: 0.008201078236138068 and parameters: {'n_layers': 1, 'embedding_dim': 64, 'lr': 0.00022895406319099217, 'lambda_val': 2.2974335049091236e-06, 'batch_size': 513, 'optimizer': 'Adam'}. Best is trial 107 with value: 0.03265563060012234.
2026-05-13 12:49:30,565 - optuna.study.study - INFO - Trial 151 finished with value: 0.014963492524806058 and parameters: {'n_layers': 1, 'embedding_dim': 64, 'lr': 0.0001595403442178016, 'lambda_val': 2.6815545663855055e-06, 'batch_size': 668, 'optimizer': 'Adam'}. Best is trial 107 with value: 0.03265563060012234.
2026-05-13 12:49:34,360 - optuna.study._optimize - INFO - Trial 152 pruned. 
2026-05-13 12:49:39,125 - optuna.study._optimize - INFO - Trial 153 pruned. 
2026-05-13 12:50:06,214 - optuna.study.study - INFO - Trial 154 finished with value: 0.011358208461080732 and parameters: {'n_layers': 1, 'embedding_dim': 64, 'lr': 0.00012802727669079523, 'lambda_val': 3.5929176006842902e-06, 'batch_size': 935, 'optimizer': 'Adam'}. Best is trial 107 with value: 0.03265563060012234.
2026-05-13 12:50:09,832 - optuna.study._optimize - INFO - Trial 155 pruned. 
2026-05-13 12:50:13,613 - optuna.study._optimize - INFO - Trial 156 pruned. 
2026-05-13 12:50:40,190 - optuna.study.study - INFO - Trial 157 finished with value: 0.009605222776282864 and parameters: {'n_layers': 1, 'embedding_dim': 64, 'lr': 0.0001297277495405379, 'lambda_val': 2.6197952419084423e-06, 'batch_size': 1172, 'optimizer': 'Adam'}. Best is trial 107 with value: 0.03265563060012234.
2026-05-13 12:50:44,042 - optuna.study._optimize - INFO - Trial 158 pruned. 
2026-05-13 12:51:11,011 - optuna.study.study - INFO - Trial 159 finished with value: 0.005979288501065508 and parameters: {'n_layers': 1, 'embedding_dim': 64, 'lr': 0.00018297883647074245, 'lambda_val': 4.480432323517579e-06, 'batch_size': 881, 'optimizer': 'Adam'}. Best is trial 107 with value: 0.03265563060012234.
2026-05-13 12:51:14,373 - optuna.study._optimize - INFO - Trial 160 pruned. 
2026-05-13 12:51:17,515 - optuna.study._optimize - INFO - Trial 161 pruned. 
2026-05-13 12:51:20,785 - optuna.study._optimize - INFO - Trial 162 pruned. 
2026-05-13 12:51:24,703 - optuna.study._optimize - INFO - Trial 163 pruned. 
2026-05-13 12:51:29,173 - optuna.study._optimize - INFO - Trial 164 pruned. 
2026-05-13 12:51:33,237 - optuna.study._optimize - INFO - Trial 165 pruned. 
2026-05-13 12:52:01,089 - optuna.study.study - INFO - Trial 166 finished with value: 0.014131055988908165 and parameters: {'n_layers': 1, 'embedding_dim': 64, 'lr': 0.00014775841115351006, 'lambda_val': 2.3409701970189883e-06, 'batch_size': 822, 'optimizer': 'Adam'}. Best is trial 107 with value: 0.03265563060012234.
2026-05-13 12:52:05,155 - optuna.study._optimize - INFO - Trial 167 pruned. 
2026-05-13 12:52:08,934 - optuna.study._optimize - INFO - Trial 168 pruned. 
2026-05-13 12:52:12,014 - optuna.study._optimize - INFO - Trial 169 pruned. 
2026-05-13 12:52:15,170 - optuna.study._optimize - INFO - Trial 170 pruned. 
2026-05-13 12:52:37,558 - optuna.study.study - INFO - Trial 171 finished with value: 0.016830751584671955 and parameters: {'n_layers': 1, 'embedding_dim': 64, 'lr': 0.0001392610123146579, 'lambda_val': 1.337867695214269e-06, 'batch_size': 1041, 'optimizer': 'Adam'}. Best is trial 107 with value: 0.03265563060012234.
2026-05-13 12:53:01,963 - optuna.study.study - INFO - Trial 172 finished with value: 0.012941759217299587 and parameters: {'n_layers': 1, 'embedding_dim': 64, 'lr': 0.0001385786687168012, 'lambda_val': 1.3205047609405515e-06, 'batch_size': 1089, 'optimizer': 'Adam'}. Best is trial 107 with value: 0.03265563060012234.
2026-05-13 12:53:06,179 - optuna.study._optimize - INFO - Trial 173 pruned. 
2026-05-13 12:53:33,309 - optuna.study.study - INFO - Trial 174 finished with value: 0.007980876851594487 and parameters: {'n_layers': 1, 'embedding_dim': 64, 'lr': 0.00021838971292763138, 'lambda_val': 1.5458730964875324e-06, 'batch_size': 861, 'optimizer': 'Adam'}. Best is trial 107 with value: 0.03265563060012234.
2026-05-13 12:53:37,424 - optuna.study._optimize - INFO - Trial 175 pruned. 
2026-05-13 12:54:05,542 - optuna.study.study - INFO - Trial 176 finished with value: 0.005399146755784841 and parameters: {'n_layers': 1, 'embedding_dim': 96, 'lr': 0.0001536908975662852, 'lambda_val': 1.8279532511840243e-06, 'batch_size': 945, 'optimizer': 'Adam'}. Best is trial 107 with value: 0.03265563060012234.
