2026-05-13 04:35:23,907 - optuna.study._optimize - INFO - Trial 7 pruned. 
2026-05-13 04:35:27,916 - optuna.study._optimize - INFO - Trial 8 pruned. 
2026-05-13 04:35:31,759 - optuna.study._optimize - INFO - Trial 9 pruned. 
2026-05-13 04:35:59,657 - optuna.study.study - INFO - Trial 10 finished with value: 0.00914590654849327 and parameters: {'n_layers': 3, 'embedding_dim': 64, 'lr': 0.0016470977082075043, 'lambda_val': 1.0376070838655512e-06, 'batch_size': 591, 'optimizer': 'RMSprop'}. Best is trial 10 with value: 0.00914590654849327.
2026-05-13 04:36:27,313 - optuna.study.study - INFO - Trial 11 finished with value: 0.010978213853263188 and parameters: {'n_layers': 3, 'embedding_dim': 64, 'lr': 0.0028487262852766124, 'lambda_val': 1.8609150793666048e-06, 'batch_size': 535, 'optimizer': 'RMSprop'}. Best is trial 11 with value: 0.010978213853263188.
2026-05-13 04:37:05,152 - optuna.study.study - INFO - Trial 12 finished with value: 0.013046522071222571 and parameters: {'n_layers': 3, 'embedding_dim': 64, 'lr': 0.0040237261872220105, 'lambda_val': 1.1456605063853375e-06, 'batch_size': 525, 'optimizer': 'RMSprop'}. Best is trial 12 with value: 0.013046522071222571.
2026-05-13 04:37:33,372 - optuna.study.study - INFO - Trial 13 finished with value: 0.018896863533724464 and parameters: {'n_layers': 3, 'embedding_dim': 64, 'lr': 0.004685150526992946, 'lambda_val': 1.0462838597039158e-06, 'batch_size': 3987, 'optimizer': 'RMSprop'}. Best is trial 13 with value: 0.018896863533724464.
2026-05-13 04:38:19,350 - optuna.study.study - INFO - Trial 14 finished with value: 0.019136113956903913 and parameters: {'n_layers': 3, 'embedding_dim': 64, 'lr': 0.0052868178596658455, 'lambda_val': 9.195216267926648e-06, 'batch_size': 3918, 'optimizer': 'RMSprop'}. Best is trial 14 with value: 0.019136113956903913.
2026-05-13 04:38:47,567 - optuna.study.study - INFO - Trial 15 finished with value: 0.020003535403399803 and parameters: {'n_layers': 3, 'embedding_dim': 64, 'lr': 0.0075099099241469885, 'lambda_val': 1.0009820260522757e-05, 'batch_size': 4004, 'optimizer': 'RMSprop'}. Best is trial 15 with value: 0.020003535403399803.
2026-05-13 04:39:21,287 - optuna.study.study - INFO - Trial 16 finished with value: 0.01702432268096708 and parameters: {'n_layers': 4, 'embedding_dim': 64, 'lr': 0.010801857759853753, 'lambda_val': 1.3827057879105032e-05, 'batch_size': 3934, 'optimizer': 'RMSprop'}. Best is trial 15 with value: 0.020003535403399803.
2026-05-13 04:39:50,809 - optuna.study.study - INFO - Trial 17 finished with value: 0.014027605117182297 and parameters: {'n_layers': 3, 'embedding_dim': 64, 'lr': 0.009575517491456275, 'lambda_val': 1.0040829733970877e-05, 'batch_size': 3612, 'optimizer': 'RMSprop'}. Best is trial 15 with value: 0.020003535403399803.
2026-05-13 04:40:21,914 - optuna.study.study - INFO - Trial 18 finished with value: 0.02115200701776889 and parameters: {'n_layers': 4, 'embedding_dim': 128, 'lr': 0.057645405480060474, 'lambda_val': 5.582987154894076e-05, 'batch_size': 3383, 'optimizer': 'RMSprop'}. Best is trial 18 with value: 0.02115200701776889.
2026-05-13 04:40:52,338 - optuna.study.study - INFO - Trial 19 finished with value: 0.021017216204000273 and parameters: {'n_layers': 4, 'embedding_dim': 128, 'lr': 0.08278909395499472, 'lambda_val': 7.766467640323264e-05, 'batch_size': 3408, 'optimizer': 'RMSprop'}. Best is trial 18 with value: 0.02115200701776889.
2026-05-13 04:41:24,186 - optuna.study.study - INFO - Trial 20 finished with value: 0.020648931655999535 and parameters: {'n_layers': 4, 'embedding_dim': 128, 'lr': 0.09362071540656274, 'lambda_val': 8.652887590259268e-05, 'batch_size': 3322, 'optimizer': 'RMSprop'}. Best is trial 18 with value: 0.02115200701776889.
2026-05-13 04:41:55,731 - optuna.study.study - INFO - Trial 21 finished with value: 0.021800540820319847 and parameters: {'n_layers': 4, 'embedding_dim': 128, 'lr': 0.09657573665234885, 'lambda_val': 0.00010896292410443466, 'batch_size': 3323, 'optimizer': 'RMSprop'}. Best is trial 21 with value: 0.021800540820319847.
2026-05-13 04:42:24,292 - optuna.study.study - INFO - Trial 22 finished with value: 0.023544135629212152 and parameters: {'n_layers': 4, 'embedding_dim': 128, 'lr': 0.07955886410317226, 'lambda_val': 4.35705382752797e-05, 'batch_size': 3155, 'optimizer': 'RMSprop'}. Best is trial 22 with value: 0.023544135629212152.
2026-05-13 04:42:31,236 - optuna.study._optimize - INFO - Trial 23 pruned. 
2026-05-13 04:43:12,287 - optuna.study.study - INFO - Trial 24 finished with value: 0.02142220986265384 and parameters: {'n_layers': 4, 'embedding_dim': 128, 'lr': 0.039665335289790264, 'lambda_val': 3.6535585182362116e-05, 'batch_size': 3019, 'optimizer': 'RMSprop'}. Best is trial 22 with value: 0.023544135629212152.
2026-05-13 04:43:44,944 - optuna.study.study - INFO - Trial 25 finished with value: 0.018021172980250414 and parameters: {'n_layers': 4, 'embedding_dim': 128, 'lr': 0.018867958515649583, 'lambda_val': 2.6404706106486103e-05, 'batch_size': 2968, 'optimizer': 'RMSprop'}. Best is trial 22 with value: 0.023544135629212152.
2026-05-13 04:44:19,805 - optuna.study.study - INFO - Trial 26 finished with value: 0.021056973464189208 and parameters: {'n_layers': 4, 'embedding_dim': 128, 'lr': 0.03388456151325545, 'lambda_val': 0.0001631706809523744, 'batch_size': 2273, 'optimizer': 'RMSprop'}. Best is trial 22 with value: 0.023544135629212152.
2026-05-13 04:44:48,813 - optuna.study.study - INFO - Trial 27 finished with value: 0.01185299420135013 and parameters: {'n_layers': 4, 'embedding_dim': 128, 'lr': 0.01462988610006887, 'lambda_val': 3.516621569113837e-06, 'batch_size': 3654, 'optimizer': 'RMSprop'}. Best is trial 22 with value: 0.023544135629212152.
2026-05-13 04:44:55,620 - optuna.study._optimize - INFO - Trial 28 pruned. 
2026-05-13 04:45:01,880 - optuna.study._optimize - INFO - Trial 29 pruned. 
2026-05-13 04:45:06,224 - optuna.study._optimize - INFO - Trial 30 pruned. 
2026-05-13 04:45:36,387 - optuna.study.study - INFO - Trial 31 finished with value: 0.02237823571673982 and parameters: {'n_layers': 4, 'embedding_dim': 128, 'lr': 0.05590908549425387, 'lambda_val': 5.002192209035446e-05, 'batch_size': 3441, 'optimizer': 'RMSprop'}. Best is trial 22 with value: 0.023544135629212152.
2026-05-13 04:46:04,396 - optuna.study.study - INFO - Trial 32 finished with value: 0.023738057712891638 and parameters: {'n_layers': 4, 'embedding_dim': 128, 'lr': 0.04902006504631653, 'lambda_val': 9.49447699346186e-05, 'batch_size': 2807, 'optimizer': 'RMSprop'}. Best is trial 32 with value: 0.023738057712891638.
2026-05-13 04:46:37,405 - optuna.study.study - INFO - Trial 33 finished with value: 0.02607182766801434 and parameters: {'n_layers': 4, 'embedding_dim': 128, 'lr': 0.05847230055722291, 'lambda_val': 0.00013904936937315194, 'batch_size': 2670, 'optimizer': 'RMSprop'}. Best is trial 33 with value: 0.02607182766801434.
2026-05-13 04:46:41,721 - optuna.study._optimize - INFO - Trial 34 pruned. 
2026-05-13 04:46:45,321 - optuna.study._optimize - INFO - Trial 35 pruned. 
2026-05-13 04:46:49,798 - optuna.study._optimize - INFO - Trial 36 pruned. 
2026-05-13 04:46:54,418 - optuna.study._optimize - INFO - Trial 37 pruned. 
2026-05-13 04:46:58,416 - optuna.study._optimize - INFO - Trial 38 pruned. 
2026-05-13 04:47:02,173 - optuna.study._optimize - INFO - Trial 39 pruned. 
2026-05-13 04:47:08,437 - optuna.study._optimize - INFO - Trial 40 pruned. 
2026-05-13 04:47:45,079 - optuna.study.study - INFO - Trial 41 finished with value: 0.021487199109965587 and parameters: {'n_layers': 4, 'embedding_dim': 128, 'lr': 0.06503179435599428, 'lambda_val': 0.00011974045132318205, 'batch_size': 3520, 'optimizer': 'RMSprop'}. Best is trial 33 with value: 0.02607182766801434.
2026-05-13 04:48:13,276 - optuna.study.study - INFO - Trial 42 finished with value: 0.02119902979282108 and parameters: {'n_layers': 4, 'embedding_dim': 128, 'lr': 0.09130398212914125, 'lambda_val': 9.485016054976677e-05, 'batch_size': 3236, 'optimizer': 'RMSprop'}. Best is trial 33 with value: 0.02607182766801434.
2026-05-13 04:48:19,298 - optuna.study._optimize - INFO - Trial 43 pruned. 
2026-05-13 04:48:23,318 - optuna.study._optimize - INFO - Trial 44 pruned. 
2026-05-13 04:48:57,661 - optuna.study.study - INFO - Trial 45 finished with value: 0.01955034664013324 and parameters: {'n_layers': 4, 'embedding_dim': 128, 'lr': 0.0631494969308774, 'lambda_val': 5.068617385862008e-05, 'batch_size': 3783, 'optimizer': 'Adam'}. Best is trial 33 with value: 0.02607182766801434.
2026-05-13 04:49:01,646 - optuna.study._optimize - INFO - Trial 46 pruned. 
2026-05-13 04:49:05,788 - optuna.study._optimize - INFO - Trial 47 pruned. 
2026-05-13 04:49:10,351 - optuna.study._optimize - INFO - Trial 48 pruned. 
2026-05-13 04:49:49,585 - optuna.study.study - INFO - Trial 49 finished with value: 0.022507347596976698 and parameters: {'n_layers': 4, 'embedding_dim': 256, 'lr': 0.008022410535398686, 'lambda_val': 0.00012440509238783587, 'batch_size': 3805, 'optimizer': 'RMSprop'}. Best is trial 33 with value: 0.02607182766801434.
2026-05-13 04:49:54,102 - optuna.study._optimize - INFO - Trial 50 pruned. 
2026-05-13 04:50:33,251 - optuna.study.study - INFO - Trial 51 finished with value: 0.022321630879223463 and parameters: {'n_layers': 4, 'embedding_dim': 256, 'lr': 0.024238822435826247, 'lambda_val': 0.0001231206225233059, 'batch_size': 3796, 'optimizer': 'RMSprop'}. Best is trial 33 with value: 0.02607182766801434.
2026-05-13 04:50:41,519 - optuna.study._optimize - INFO - Trial 52 pruned. 
2026-05-13 04:51:16,990 - optuna.study.study - INFO - Trial 53 finished with value: 0.025317045499687538 and parameters: {'n_layers': 4, 'embedding_dim': 256, 'lr': 0.025951830821402906, 'lambda_val': 5.5785929391688455e-05, 'batch_size': 3794, 'optimizer': 'RMSprop'}. Best is trial 33 with value: 0.02607182766801434.
2026-05-13 04:51:24,661 - optuna.study._optimize - INFO - Trial 54 pruned. 
2026-05-13 04:51:28,133 - optuna.study._optimize - INFO - Trial 55 pruned. 
2026-05-13 04:51:32,373 - optuna.study._optimize - INFO - Trial 56 pruned. 
2026-05-13 04:51:57,474 - optuna.study.study - INFO - Trial 57 finished with value: 0.02439911170956839 and parameters: {'n_layers': 4, 'embedding_dim': 96, 'lr': 0.04187422490907118, 'lambda_val': 6.635136714862237e-05, 'batch_size': 932, 'optimizer': 'RMSprop'}. Best is trial 33 with value: 0.02607182766801434.
2026-05-13 04:52:23,776 - optuna.study.study - INFO - Trial 58 finished with value: 0.02312786023198418 and parameters: {'n_layers': 4, 'embedding_dim': 96, 'lr': 0.02058730180349932, 'lambda_val': 8.01639311421278e-05, 'batch_size': 833, 'optimizer': 'RMSprop'}. Best is trial 33 with value: 0.02607182766801434.
2026-05-13 04:52:39,322 - optuna.study._optimize - INFO - Trial 59 pruned. 
2026-05-13 04:52:42,590 - optuna.study._optimize - INFO - Trial 60 pruned. 
2026-05-13 04:53:07,711 - optuna.study.study - INFO - Trial 61 finished with value: 0.024859199017292156 and parameters: {'n_layers': 4, 'embedding_dim': 96, 'lr': 0.04045474833370291, 'lambda_val': 7.432035011083736e-05, 'batch_size': 1369, 'optimizer': 'RMSprop'}. Best is trial 33 with value: 0.02607182766801434.
2026-05-13 04:53:32,082 - optuna.study.study - INFO - Trial 62 finished with value: 0.023488015875643295 and parameters: {'n_layers': 4, 'embedding_dim': 96, 'lr': 0.041371946055227295, 'lambda_val': 6.498102809511179e-05, 'batch_size': 1397, 'optimizer': 'RMSprop'}. Best is trial 33 with value: 0.02607182766801434.
2026-05-13 04:53:37,737 - optuna.study._optimize - INFO - Trial 63 pruned. 
2026-05-13 04:53:41,131 - optuna.study._optimize - INFO - Trial 64 pruned. 
2026-05-13 04:53:44,510 - optuna.study._optimize - INFO - Trial 65 pruned. 
2026-05-13 04:53:48,261 - optuna.study._optimize - INFO - Trial 66 pruned. 
2026-05-13 04:53:51,975 - optuna.study._optimize - INFO - Trial 67 pruned. 
2026-05-13 04:53:55,625 - optuna.study._optimize - INFO - Trial 68 pruned. 
2026-05-13 04:53:58,884 - optuna.study._optimize - INFO - Trial 69 pruned. 
2026-05-13 04:54:02,320 - optuna.study._optimize - INFO - Trial 70 pruned. 
2026-05-13 04:54:37,081 - optuna.study.study - INFO - Trial 71 finished with value: 0.024106650823683327 and parameters: {'n_layers': 4, 'embedding_dim': 96, 'lr': 0.02071298973936065, 'lambda_val': 7.575409171785166e-05, 'batch_size': 729, 'optimizer': 'RMSprop'}. Best is trial 33 with value: 0.02607182766801434.
2026-05-13 04:55:00,999 - optuna.study.study - INFO - Trial 72 finished with value: 0.02317179769550033 and parameters: {'n_layers': 4, 'embedding_dim': 96, 'lr': 0.0365227354364508, 'lambda_val': 5.3815901700969336e-05, 'batch_size': 1180, 'optimizer': 'RMSprop'}. Best is trial 33 with value: 0.02607182766801434.
2026-05-13 04:55:04,049 - optuna.study._optimize - INFO - Trial 73 pruned. 
2026-05-13 04:55:07,597 - optuna.study._optimize - INFO - Trial 74 pruned. 
2026-05-13 04:55:10,622 - optuna.study._optimize - INFO - Trial 75 pruned. 
2026-05-13 04:55:14,112 - optuna.study._optimize - INFO - Trial 76 pruned. 
2026-05-13 04:55:47,050 - optuna.study.study - INFO - Trial 77 finished with value: 0.019794252153036578 and parameters: {'n_layers': 4, 'embedding_dim': 64, 'lr': 0.02402182270467994, 'lambda_val': 2.189214455861839e-05, 'batch_size': 2430, 'optimizer': 'RMSprop'}. Best is trial 33 with value: 0.02607182766801434.
2026-05-13 04:55:51,157 - optuna.study._optimize - INFO - Trial 78 pruned. 
2026-05-13 04:55:55,591 - optuna.study._optimize - INFO - Trial 79 pruned. 
2026-05-13 04:55:59,489 - optuna.study._optimize - INFO - Trial 80 pruned. 
2026-05-13 04:56:28,992 - optuna.study.study - INFO - Trial 81 finished with value: 0.02270033948533287 and parameters: {'n_layers': 4, 'embedding_dim': 96, 'lr': 0.03336037604414118, 'lambda_val': 5.1841565466473214e-05, 'batch_size': 1202, 'optimizer': 'RMSprop'}. Best is trial 33 with value: 0.02607182766801434.
2026-05-13 04:56:32,270 - optuna.study._optimize - INFO - Trial 82 pruned. 
2026-05-13 04:56:35,762 - optuna.study._optimize - INFO - Trial 83 pruned. 
2026-05-13 04:56:39,158 - optuna.study._optimize - INFO - Trial 84 pruned. 
2026-05-13 04:57:00,092 - optuna.study.study - INFO - Trial 85 finished with value: 0.021008765406268625 and parameters: {'n_layers': 4, 'embedding_dim': 32, 'lr': 0.02273145426013414, 'lambda_val': 0.000190021022147312, 'batch_size': 1364, 'optimizer': 'RMSprop'}. Best is trial 33 with value: 0.02607182766801434.
2026-05-13 04:57:04,143 - optuna.study._optimize - INFO - Trial 86 pruned. 
2026-05-13 04:57:08,522 - optuna.study._optimize - INFO - Trial 87 pruned. 
2026-05-13 04:57:38,797 - optuna.study.study - INFO - Trial 88 finished with value: 0.023436410163433556 and parameters: {'n_layers': 4, 'embedding_dim': 64, 'lr': 0.04266150411328044, 'lambda_val': 0.0001301144246338524, 'batch_size': 1739, 'optimizer': 'RMSprop'}. Best is trial 33 with value: 0.02607182766801434.
2026-05-13 04:57:42,902 - optuna.study._optimize - INFO - Trial 89 pruned. 
2026-05-13 04:58:12,972 - optuna.study.study - INFO - Trial 90 finished with value: 0.025009701492120163 and parameters: {'n_layers': 4, 'embedding_dim': 64, 'lr': 0.016722836884370457, 'lambda_val': 9.977759182822262e-05, 'batch_size': 2938, 'optimizer': 'RMSprop'}. Best is trial 33 with value: 0.02607182766801434.
2026-05-13 04:58:40,393 - optuna.study.study - INFO - Trial 91 finished with value: 0.02512340307349371 and parameters: {'n_layers': 4, 'embedding_dim': 64, 'lr': 0.01077692835561755, 'lambda_val': 9.072713235715707e-05, 'batch_size': 1798, 'optimizer': 'RMSprop'}. Best is trial 33 with value: 0.02607182766801434.
2026-05-13 04:59:10,759 - optuna.study.study - INFO - Trial 92 finished with value: 0.023932030651213753 and parameters: {'n_layers': 4, 'embedding_dim': 64, 'lr': 0.010967665497683436, 'lambda_val': 9.609977672972144e-05, 'batch_size': 2986, 'optimizer': 'RMSprop'}. Best is trial 33 with value: 0.02607182766801434.
2026-05-13 04:59:38,950 - optuna.study.study - INFO - Trial 93 finished with value: 0.0257234197499004 and parameters: {'n_layers': 4, 'embedding_dim': 64, 'lr': 0.016681952403132923, 'lambda_val': 9.836112894717358e-05, 'batch_size': 2932, 'optimizer': 'RMSprop'}. Best is trial 33 with value: 0.02607182766801434.
2026-05-13 05:00:05,533 - optuna.study.study - INFO - Trial 94 finished with value: 0.024673793515231097 and parameters: {'n_layers': 4, 'embedding_dim': 64, 'lr': 0.010545823898487598, 'lambda_val': 9.748006297046251e-05, 'batch_size': 2923, 'optimizer': 'RMSprop'}. Best is trial 33 with value: 0.02607182766801434.
2026-05-13 05:00:31,674 - optuna.study.study - INFO - Trial 95 finished with value: 0.02364394284719958 and parameters: {'n_layers': 4, 'embedding_dim': 64, 'lr': 0.011063005148202913, 'lambda_val': 9.813618000730389e-05, 'batch_size': 3298, 'optimizer': 'RMSprop'}. Best is trial 33 with value: 0.02607182766801434.
2026-05-13 05:00:35,066 - optuna.study._optimize - INFO - Trial 96 pruned. 
2026-05-13 05:00:39,386 - optuna.study._optimize - INFO - Trial 97 pruned. 
2026-05-13 05:00:42,568 - optuna.study._optimize - INFO - Trial 98 pruned. 
2026-05-13 05:00:45,908 - optuna.study._optimize - INFO - Trial 99 pruned. 
2026-05-13 05:01:12,961 - optuna.study.study - INFO - Trial 100 finished with value: 0.02489548382954106 and parameters: {'n_layers': 4, 'embedding_dim': 64, 'lr': 0.013093943448002687, 'lambda_val': 0.00011274801729117487, 'batch_size': 3058, 'optimizer': 'RMSprop'}. Best is trial 33 with value: 0.02607182766801434.
2026-05-13 05:01:41,156 - optuna.study.study - INFO - Trial 101 finished with value: 0.025121226169544424 and parameters: {'n_layers': 4, 'embedding_dim': 64, 'lr': 0.007021743805807905, 'lambda_val': 8.075182216397124e-05, 'batch_size': 3043, 'optimizer': 'RMSprop'}. Best is trial 33 with value: 0.02607182766801434.
2026-05-13 05:02:08,828 - optuna.study.study - INFO - Trial 102 finished with value: 0.024596824006163108 and parameters: {'n_layers': 4, 'embedding_dim': 64, 'lr': 0.007555039082679549, 'lambda_val': 7.789383791035501e-05, 'batch_size': 3047, 'optimizer': 'RMSprop'}. Best is trial 33 with value: 0.02607182766801434.
2026-05-13 05:02:12,825 - optuna.study._optimize - INFO - Trial 103 pruned. 
2026-05-13 05:02:41,582 - optuna.study.study - INFO - Trial 104 finished with value: 0.02491448568123267 and parameters: {'n_layers': 4, 'embedding_dim': 64, 'lr': 0.013381697807825638, 'lambda_val': 0.00013175870166407251, 'batch_size': 2859, 'optimizer': 'RMSprop'}. Best is trial 33 with value: 0.02607182766801434.
2026-05-13 05:02:45,236 - optuna.study._optimize - INFO - Trial 105 pruned. 
2026-05-13 05:02:48,680 - optuna.study._optimize - INFO - Trial 106 pruned. 
2026-05-13 05:02:52,556 - optuna.study._optimize - INFO - Trial 107 pruned. 
2026-05-13 05:03:22,358 - optuna.study.study - INFO - Trial 108 finished with value: 0.027753918148894535 and parameters: {'n_layers': 4, 'embedding_dim': 64, 'lr': 0.004912179158847086, 'lambda_val': 0.00012076463975516337, 'batch_size': 2922, 'optimizer': 'RMSprop'}. Best is trial 108 with value: 0.027753918148894535.
2026-05-13 05:03:26,936 - optuna.study._optimize - INFO - Trial 109 pruned. 
2026-05-13 05:03:30,941 - optuna.study._optimize - INFO - Trial 110 pruned. 
2026-05-13 05:04:01,924 - optuna.study.study - INFO - Trial 111 finished with value: 0.021794068711171375 and parameters: {'n_layers': 4, 'embedding_dim': 64, 'lr': 0.006769038544771558, 'lambda_val': 8.208863158330409e-05, 'batch_size': 3216, 'optimizer': 'RMSprop'}. Best is trial 108 with value: 0.027753918148894535.
2026-05-13 05:04:33,609 - optuna.study.study - INFO - Trial 112 finished with value: 0.02432946833809406 and parameters: {'n_layers': 4, 'embedding_dim': 64, 'lr': 0.007998636905507148, 'lambda_val': 0.00011269684615921844, 'batch_size': 3078, 'optimizer': 'RMSprop'}. Best is trial 108 with value: 0.027753918148894535.
2026-05-13 05:04:37,338 - optuna.study._optimize - INFO - Trial 113 pruned. 
2026-05-13 05:04:42,091 - optuna.study._optimize - INFO - Trial 114 pruned. 
2026-05-13 05:04:46,903 - optuna.study._optimize - INFO - Trial 115 pruned. 
2026-05-13 05:04:51,143 - optuna.study._optimize - INFO - Trial 116 pruned. 
2026-05-13 05:05:22,256 - optuna.study.study - INFO - Trial 117 finished with value: 0.023381344649894432 and parameters: {'n_layers': 4, 'embedding_dim': 64, 'lr': 0.013590759062725645, 'lambda_val': 6.07039273960956e-05, 'batch_size': 2905, 'optimizer': 'RMSprop'}. Best is trial 108 with value: 0.027753918148894535.
2026-05-13 05:05:54,077 - optuna.study.study - INFO - Trial 118 finished with value: 0.02510604505958958 and parameters: {'n_layers': 4, 'embedding_dim': 64, 'lr': 0.009703977177234176, 'lambda_val': 0.00011606274566075446, 'batch_size': 3013, 'optimizer': 'RMSprop'}. Best is trial 108 with value: 0.027753918148894535.
2026-05-13 05:05:58,708 - optuna.study._optimize - INFO - Trial 119 pruned. 
2026-05-13 05:06:03,695 - optuna.study._optimize - INFO - Trial 120 pruned. 
2026-05-13 05:06:35,308 - optuna.study.study - INFO - Trial 121 finished with value: 0.023630442008662073 and parameters: {'n_layers': 4, 'embedding_dim': 64, 'lr': 0.006768731843330736, 'lambda_val': 0.00017757002674824373, 'batch_size': 3014, 'optimizer': 'RMSprop'}. Best is trial 108 with value: 0.027753918148894535.
2026-05-13 05:07:05,878 - optuna.study.study - INFO - Trial 122 finished with value: 0.023705147465605227 and parameters: {'n_layers': 4, 'embedding_dim': 64, 'lr': 0.013299725592786296, 'lambda_val': 7.913914270015999e-05, 'batch_size': 2150, 'optimizer': 'RMSprop'}. Best is trial 108 with value: 0.027753918148894535.
2026-05-13 05:07:09,956 - optuna.study._optimize - INFO - Trial 123 pruned. 
2026-05-13 05:07:14,423 - optuna.study._optimize - INFO - Trial 124 pruned. 
2026-05-13 05:07:18,929 - optuna.study._optimize - INFO - Trial 125 pruned. 
