2026-05-13 14:07:20,681 - optuna.study._optimize - INFO - Trial 33 pruned. 
2026-05-13 14:07:25,018 - optuna.study._optimize - INFO - Trial 34 pruned. 
2026-05-13 14:07:54,121 - optuna.study.study - INFO - Trial 35 finished with value: 0.055011171951689475 and parameters: {'n_layers': 1, 'embedding_dim': 96, 'lr': 0.0009509878914461889, 'lambda_val': 5.368154703317225e-06, 'batch_size': 1123, 'optimizer': 'Adam'}. Best is trial 23 with value: 0.07440043471279896.
2026-05-13 14:07:59,123 - optuna.study._optimize - INFO - Trial 36 pruned. 
2026-05-13 14:08:04,308 - optuna.study._optimize - INFO - Trial 37 pruned. 
2026-05-13 14:08:08,651 - optuna.study._optimize - INFO - Trial 38 pruned. 
2026-05-13 14:08:13,928 - optuna.study._optimize - INFO - Trial 39 pruned. 
2026-05-13 14:08:18,402 - optuna.study._optimize - INFO - Trial 40 pruned. 
2026-05-13 14:08:51,467 - optuna.study.study - INFO - Trial 41 finished with value: 0.05795001338714129 and parameters: {'n_layers': 1, 'embedding_dim': 256, 'lr': 0.001735724912231, 'lambda_val': 4.033005248414947e-05, 'batch_size': 1238, 'optimizer': 'RMSprop'}. Best is trial 23 with value: 0.07440043471279896.
2026-05-13 14:09:28,356 - optuna.study.study - INFO - Trial 42 finished with value: 0.052220946734651295 and parameters: {'n_layers': 1, 'embedding_dim': 256, 'lr': 0.0013339389100102052, 'lambda_val': 2.8592518321976357e-06, 'batch_size': 752, 'optimizer': 'RMSprop'}. Best is trial 23 with value: 0.07440043471279896.
2026-05-13 14:10:02,108 - optuna.study.study - INFO - Trial 43 finished with value: 0.0596594023030706 and parameters: {'n_layers': 1, 'embedding_dim': 256, 'lr': 0.002258538728849599, 'lambda_val': 3.46297659171136e-05, 'batch_size': 1232, 'optimizer': 'RMSprop'}. Best is trial 23 with value: 0.07440043471279896.
2026-05-13 14:10:10,763 - optuna.study._optimize - INFO - Trial 44 pruned. 
2026-05-13 14:10:44,944 - optuna.study.study - INFO - Trial 45 finished with value: 0.041502239261595096 and parameters: {'n_layers': 1, 'embedding_dim': 256, 'lr': 0.0075319252405829295, 'lambda_val': 2.0382894636901513e-05, 'batch_size': 1989, 'optimizer': 'Adam'}. Best is trial 23 with value: 0.07440043471279896.
2026-05-13 14:10:49,374 - optuna.study._optimize - INFO - Trial 46 pruned. 
2026-05-13 14:10:54,232 - optuna.study._optimize - INFO - Trial 47 pruned. 
2026-05-13 14:10:59,607 - optuna.study._optimize - INFO - Trial 48 pruned. 
2026-05-13 14:11:03,746 - optuna.study._optimize - INFO - Trial 49 pruned. 
2026-05-13 14:11:43,027 - optuna.study.study - INFO - Trial 50 finished with value: 0.04524874104111366 and parameters: {'n_layers': 1, 'embedding_dim': 96, 'lr': 0.0007639432917384044, 'lambda_val': 5.828545764142249e-06, 'batch_size': 1133, 'optimizer': 'RMSprop'}. Best is trial 23 with value: 0.07440043471279896.
2026-05-13 14:12:15,686 - optuna.study.study - INFO - Trial 51 finished with value: 0.053673453814703447 and parameters: {'n_layers': 1, 'embedding_dim': 256, 'lr': 0.002112992231115155, 'lambda_val': 3.7452453776464084e-05, 'batch_size': 1277, 'optimizer': 'RMSprop'}. Best is trial 23 with value: 0.07440043471279896.
2026-05-13 14:12:47,634 - optuna.study.study - INFO - Trial 52 finished with value: 0.05523047457123323 and parameters: {'n_layers': 1, 'embedding_dim': 256, 'lr': 0.0012338191334434066, 'lambda_val': 2.6871447831750986e-05, 'batch_size': 893, 'optimizer': 'RMSprop'}. Best is trial 23 with value: 0.07440043471279896.
2026-05-13 14:13:20,669 - optuna.study.study - INFO - Trial 53 finished with value: 0.061625143754828 and parameters: {'n_layers': 1, 'embedding_dim': 256, 'lr': 0.0034057240880578724, 'lambda_val': 6.695535376548613e-05, 'batch_size': 670, 'optimizer': 'RMSprop'}. Best is trial 23 with value: 0.07440043471279896.
2026-05-13 14:13:54,341 - optuna.study.study - INFO - Trial 54 finished with value: 0.071181388347846 and parameters: {'n_layers': 1, 'embedding_dim': 256, 'lr': 0.0033187145124289447, 'lambda_val': 0.0001543967472361439, 'batch_size': 678, 'optimizer': 'RMSprop'}. Best is trial 23 with value: 0.07440043471279896.
2026-05-13 14:14:27,179 - optuna.study.study - INFO - Trial 55 finished with value: 0.06249039495547783 and parameters: {'n_layers': 1, 'embedding_dim': 256, 'lr': 0.0038148187476971917, 'lambda_val': 0.00013532222393815277, 'batch_size': 569, 'optimizer': 'RMSprop'}. Best is trial 23 with value: 0.07440043471279896.
2026-05-13 14:14:31,352 - optuna.study._optimize - INFO - Trial 56 pruned. 
2026-05-13 14:15:04,577 - optuna.study.study - INFO - Trial 57 finished with value: 0.06502541751842408 and parameters: {'n_layers': 1, 'embedding_dim': 256, 'lr': 0.003873032331571432, 'lambda_val': 0.00024697542688472524, 'batch_size': 589, 'optimizer': 'RMSprop'}. Best is trial 23 with value: 0.07440043471279896.
2026-05-13 14:15:13,811 - optuna.study._optimize - INFO - Trial 58 pruned. 
2026-05-13 14:15:20,654 - optuna.study._optimize - INFO - Trial 59 pruned. 
2026-05-13 14:15:25,800 - optuna.study._optimize - INFO - Trial 60 pruned. 
2026-05-13 14:15:59,352 - optuna.study.study - INFO - Trial 61 finished with value: 0.0498426243758559 and parameters: {'n_layers': 1, 'embedding_dim': 256, 'lr': 0.0073085372109636774, 'lambda_val': 6.917206738297986e-05, 'batch_size': 1037, 'optimizer': 'RMSprop'}. Best is trial 23 with value: 0.07440043471279896.
2026-05-13 14:16:32,351 - optuna.study.study - INFO - Trial 62 finished with value: 0.07752848989504055 and parameters: {'n_layers': 1, 'embedding_dim': 256, 'lr': 0.0038376625590215868, 'lambda_val': 0.0007398728663048637, 'batch_size': 808, 'optimizer': 'RMSprop'}. Best is trial 62 with value: 0.07752848989504055.
2026-05-13 14:17:06,063 - optuna.study.study - INFO - Trial 63 finished with value: 0.08090770525677303 and parameters: {'n_layers': 1, 'embedding_dim': 256, 'lr': 0.0034402605619143147, 'lambda_val': 0.002341532202274991, 'batch_size': 701, 'optimizer': 'RMSprop'}. Best is trial 63 with value: 0.08090770525677303.
2026-05-13 14:17:10,540 - optuna.study._optimize - INFO - Trial 64 pruned. 
2026-05-13 14:17:45,944 - optuna.study.study - INFO - Trial 65 finished with value: 0.07827064627583909 and parameters: {'n_layers': 1, 'embedding_dim': 256, 'lr': 0.00834664206444498, 'lambda_val': 0.002054223000130392, 'batch_size': 2693, 'optimizer': 'RMSprop'}. Best is trial 63 with value: 0.08090770525677303.
2026-05-13 14:17:50,818 - optuna.study._optimize - INFO - Trial 66 pruned. 
2026-05-13 14:18:38,715 - optuna.study.study - INFO - Trial 67 finished with value: 0.07830075514956225 and parameters: {'n_layers': 1, 'embedding_dim': 256, 'lr': 0.008751171835736272, 'lambda_val': 0.0007555829205839925, 'batch_size': 2995, 'optimizer': 'RMSprop'}. Best is trial 63 with value: 0.08090770525677303.
2026-05-13 14:18:44,088 - optuna.study._optimize - INFO - Trial 68 pruned. 
2026-05-13 14:19:13,703 - optuna.study.study - INFO - Trial 69 finished with value: 0.07049818766036137 and parameters: {'n_layers': 1, 'embedding_dim': 64, 'lr': 0.00828025245052384, 'lambda_val': 0.0030039660751354177, 'batch_size': 3033, 'optimizer': 'RMSprop'}. Best is trial 63 with value: 0.08090770525677303.
2026-05-13 14:19:17,918 - optuna.study._optimize - INFO - Trial 70 pruned. 
2026-05-13 14:19:48,569 - optuna.study.study - INFO - Trial 71 finished with value: 0.077907527050704 and parameters: {'n_layers': 1, 'embedding_dim': 64, 'lr': 0.013694229299003258, 'lambda_val': 0.003593224930283468, 'batch_size': 3019, 'optimizer': 'RMSprop'}. Best is trial 63 with value: 0.08090770525677303.
2026-05-13 14:20:18,328 - optuna.study.study - INFO - Trial 72 finished with value: 0.07618377606786818 and parameters: {'n_layers': 1, 'embedding_dim': 64, 'lr': 0.006122490856624921, 'lambda_val': 0.0029364955124027664, 'batch_size': 3057, 'optimizer': 'RMSprop'}. Best is trial 63 with value: 0.08090770525677303.
2026-05-13 14:20:23,265 - optuna.study._optimize - INFO - Trial 73 pruned. 
2026-05-13 14:20:52,145 - optuna.study.study - INFO - Trial 74 finished with value: 0.07733533746195231 and parameters: {'n_layers': 1, 'embedding_dim': 64, 'lr': 0.012328546022341761, 'lambda_val': 0.0013966162431926492, 'batch_size': 3031, 'optimizer': 'RMSprop'}. Best is trial 63 with value: 0.08090770525677303.
2026-05-13 14:20:56,108 - optuna.study._optimize - INFO - Trial 75 pruned. 
2026-05-13 14:21:00,637 - optuna.study._optimize - INFO - Trial 76 pruned. 
2026-05-13 14:21:05,398 - optuna.study._optimize - INFO - Trial 77 pruned. 
2026-05-13 14:21:09,462 - optuna.study._optimize - INFO - Trial 78 pruned. 
2026-05-13 14:21:13,538 - optuna.study._optimize - INFO - Trial 79 pruned. 
2026-05-13 14:21:17,647 - optuna.study._optimize - INFO - Trial 80 pruned. 
2026-05-13 14:21:46,042 - optuna.study.study - INFO - Trial 81 finished with value: 0.07148445733859793 and parameters: {'n_layers': 1, 'embedding_dim': 64, 'lr': 0.009959966781940348, 'lambda_val': 0.0029429806350320634, 'batch_size': 2889, 'optimizer': 'RMSprop'}. Best is trial 63 with value: 0.08090770525677303.
2026-05-13 14:21:50,194 - optuna.study._optimize - INFO - Trial 82 pruned. 
2026-05-13 14:21:54,403 - optuna.study._optimize - INFO - Trial 83 pruned. 
2026-05-13 14:21:58,923 - optuna.study._optimize - INFO - Trial 84 pruned. 
2026-05-13 14:22:02,733 - optuna.study._optimize - INFO - Trial 85 pruned. 
2026-05-13 14:22:07,362 - optuna.study._optimize - INFO - Trial 86 pruned. 
2026-05-13 14:22:11,595 - optuna.study._optimize - INFO - Trial 87 pruned. 
2026-05-13 14:22:15,949 - optuna.study._optimize - INFO - Trial 88 pruned. 
2026-05-13 14:22:20,589 - optuna.study._optimize - INFO - Trial 89 pruned. 
2026-05-13 14:22:25,167 - optuna.study._optimize - INFO - Trial 90 pruned. 
2026-05-13 14:23:00,106 - optuna.study.study - INFO - Trial 91 finished with value: 0.07735060110442907 and parameters: {'n_layers': 1, 'embedding_dim': 256, 'lr': 0.007139723750250328, 'lambda_val': 0.0038434066661516024, 'batch_size': 3516, 'optimizer': 'RMSprop'}. Best is trial 63 with value: 0.08090770525677303.
2026-05-13 14:23:35,840 - optuna.study.study - INFO - Trial 92 finished with value: 0.07945959938781584 and parameters: {'n_layers': 1, 'embedding_dim': 256, 'lr': 0.006891471390498037, 'lambda_val': 0.0034714145031301655, 'batch_size': 3526, 'optimizer': 'RMSprop'}. Best is trial 63 with value: 0.08090770525677303.
2026-05-13 14:24:11,529 - optuna.study.study - INFO - Trial 93 finished with value: 0.07828803762642808 and parameters: {'n_layers': 1, 'embedding_dim': 256, 'lr': 0.006705413636723074, 'lambda_val': 0.003753289997170282, 'batch_size': 3538, 'optimizer': 'RMSprop'}. Best is trial 63 with value: 0.08090770525677303.
2026-05-13 14:24:47,334 - optuna.study.study - INFO - Trial 94 finished with value: 0.08340705306090467 and parameters: {'n_layers': 1, 'embedding_dim': 256, 'lr': 0.006753377534782888, 'lambda_val': 0.00395197185301496, 'batch_size': 3674, 'optimizer': 'RMSprop'}. Best is trial 94 with value: 0.08340705306090467.
2026-05-13 14:25:22,359 - optuna.study.study - INFO - Trial 95 finished with value: 0.07226408507830007 and parameters: {'n_layers': 1, 'embedding_dim': 256, 'lr': 0.004473259218789251, 'lambda_val': 0.003990248456528501, 'batch_size': 3550, 'optimizer': 'RMSprop'}. Best is trial 94 with value: 0.08340705306090467.
2026-05-13 14:25:26,800 - optuna.study._optimize - INFO - Trial 96 pruned. 
2026-05-13 14:25:31,786 - optuna.study._optimize - INFO - Trial 97 pruned. 
2026-05-13 14:26:07,589 - optuna.study.study - INFO - Trial 98 finished with value: 0.07698004331495283 and parameters: {'n_layers': 1, 'embedding_dim': 256, 'lr': 0.002764368299431189, 'lambda_val': 0.003973485476553186, 'batch_size': 3822, 'optimizer': 'RMSprop'}. Best is trial 94 with value: 0.08340705306090467.
2026-05-13 14:26:43,241 - optuna.study.study - INFO - Trial 99 finished with value: 0.07890711379129214 and parameters: {'n_layers': 1, 'embedding_dim': 256, 'lr': 0.004927861082059995, 'lambda_val': 0.0013106233827854745, 'batch_size': 3540, 'optimizer': 'RMSprop'}. Best is trial 94 with value: 0.08340705306090467.
2026-05-13 14:26:47,545 - optuna.study._optimize - INFO - Trial 100 pruned. 
2026-05-13 14:27:23,284 - optuna.study.study - INFO - Trial 101 finished with value: 0.0811488813954933 and parameters: {'n_layers': 1, 'embedding_dim': 256, 'lr': 0.0067902395326762365, 'lambda_val': 0.001164314422277282, 'batch_size': 4064, 'optimizer': 'RMSprop'}. Best is trial 94 with value: 0.08340705306090467.
2026-05-13 14:27:27,855 - optuna.study._optimize - INFO - Trial 102 pruned. 
2026-05-13 14:28:04,226 - optuna.study.study - INFO - Trial 103 finished with value: 0.07889525727215656 and parameters: {'n_layers': 1, 'embedding_dim': 256, 'lr': 0.007413843693899001, 'lambda_val': 0.00099830807955249, 'batch_size': 3432, 'optimizer': 'RMSprop'}. Best is trial 94 with value: 0.08340705306090467.
2026-05-13 14:28:39,983 - optuna.study.study - INFO - Trial 104 finished with value: 0.08122620888811219 and parameters: {'n_layers': 1, 'embedding_dim': 256, 'lr': 0.004184788323052842, 'lambda_val': 0.0010639312382630447, 'batch_size': 4081, 'optimizer': 'RMSprop'}. Best is trial 94 with value: 0.08340705306090467.
2026-05-13 14:29:15,881 - optuna.study.study - INFO - Trial 105 finished with value: 0.07967673853442114 and parameters: {'n_layers': 1, 'embedding_dim': 256, 'lr': 0.008534255632465518, 'lambda_val': 0.0010154479284422756, 'batch_size': 4092, 'optimizer': 'RMSprop'}. Best is trial 94 with value: 0.08340705306090467.
2026-05-13 14:29:52,268 - optuna.study.study - INFO - Trial 106 finished with value: 0.0837737998008057 and parameters: {'n_layers': 1, 'embedding_dim': 256, 'lr': 0.005222045973492776, 'lambda_val': 0.0010140303199100106, 'batch_size': 3675, 'optimizer': 'RMSprop'}. Best is trial 106 with value: 0.0837737998008057.
2026-05-13 14:29:58,431 - optuna.study._optimize - INFO - Trial 107 pruned. 
2026-05-13 14:30:35,571 - optuna.study.study - INFO - Trial 108 finished with value: 0.07181197938308671 and parameters: {'n_layers': 1, 'embedding_dim': 256, 'lr': 0.00241324198762301, 'lambda_val': 0.0005813150827110834, 'batch_size': 4095, 'optimizer': 'Adam'}. Best is trial 106 with value: 0.0837737998008057.
2026-05-13 14:31:11,739 - optuna.study.study - INFO - Trial 109 finished with value: 0.0689518890773183 and parameters: {'n_layers': 1, 'embedding_dim': 256, 'lr': 0.0031282375905961352, 'lambda_val': 0.0003031818966683769, 'batch_size': 3948, 'optimizer': 'RMSprop'}. Best is trial 106 with value: 0.0837737998008057.
2026-05-13 14:31:47,981 - optuna.study.study - INFO - Trial 110 finished with value: 0.07841059433912098 and parameters: {'n_layers': 1, 'embedding_dim': 256, 'lr': 0.004399592207227902, 'lambda_val': 0.0009197537716504216, 'batch_size': 3661, 'optimizer': 'RMSprop'}. Best is trial 106 with value: 0.0837737998008057.
2026-05-13 14:32:23,887 - optuna.study.study - INFO - Trial 111 finished with value: 0.07739155256224159 and parameters: {'n_layers': 1, 'embedding_dim': 256, 'lr': 0.00533726251023698, 'lambda_val': 0.0009004684606322494, 'batch_size': 3676, 'optimizer': 'RMSprop'}. Best is trial 106 with value: 0.0837737998008057.
2026-05-13 14:33:00,078 - optuna.study.study - INFO - Trial 112 finished with value: 0.07906532808661794 and parameters: {'n_layers': 1, 'embedding_dim': 256, 'lr': 0.004161630104093263, 'lambda_val': 0.00046338408255162104, 'batch_size': 3440, 'optimizer': 'RMSprop'}. Best is trial 106 with value: 0.0837737998008057.
2026-05-13 14:33:36,717 - optuna.study.study - INFO - Trial 113 finished with value: 0.0764447906519268 and parameters: {'n_layers': 1, 'embedding_dim': 256, 'lr': 0.004743978342278418, 'lambda_val': 0.00039765091221709243, 'batch_size': 3945, 'optimizer': 'RMSprop'}. Best is trial 106 with value: 0.0837737998008057.
2026-05-13 14:34:12,382 - optuna.study.study - INFO - Trial 114 finished with value: 0.08128346832974262 and parameters: {'n_layers': 1, 'embedding_dim': 256, 'lr': 0.004019805658246641, 'lambda_val': 0.0011993115028410936, 'batch_size': 3427, 'optimizer': 'RMSprop'}. Best is trial 106 with value: 0.0837737998008057.
2026-05-13 14:34:48,126 - optuna.study.study - INFO - Trial 115 finished with value: 0.07984518852621937 and parameters: {'n_layers': 1, 'embedding_dim': 256, 'lr': 0.004274760257255423, 'lambda_val': 0.0011613973314316052, 'batch_size': 3419, 'optimizer': 'RMSprop'}. Best is trial 106 with value: 0.0837737998008057.
2026-05-13 14:35:24,518 - optuna.study.study - INFO - Trial 116 finished with value: 0.07204291755828779 and parameters: {'n_layers': 1, 'embedding_dim': 256, 'lr': 0.0011122877027493435, 'lambda_val': 0.0011809245545909613, 'batch_size': 3833, 'optimizer': 'RMSprop'}. Best is trial 106 with value: 0.0837737998008057.
2026-05-13 14:36:00,213 - optuna.study.study - INFO - Trial 117 finished with value: 0.07032445675618786 and parameters: {'n_layers': 1, 'embedding_dim': 256, 'lr': 0.0030491805459087807, 'lambda_val': 0.0004675701772897875, 'batch_size': 3430, 'optimizer': 'RMSprop'}. Best is trial 106 with value: 0.0837737998008057.
2026-05-13 14:36:35,341 - optuna.study.study - INFO - Trial 118 finished with value: 0.07598120250849366 and parameters: {'n_layers': 1, 'embedding_dim': 256, 'lr': 0.004091650998559297, 'lambda_val': 0.0013795116926659896, 'batch_size': 3449, 'optimizer': 'RMSprop'}. Best is trial 106 with value: 0.0837737998008057.
2026-05-13 14:37:11,177 - optuna.study.study - INFO - Trial 119 finished with value: 0.0809733277587977 and parameters: {'n_layers': 1, 'embedding_dim': 256, 'lr': 0.002424459121067629, 'lambda_val': 0.0018005505845712579, 'batch_size': 4028, 'optimizer': 'RMSprop'}. Best is trial 106 with value: 0.0837737998008057.
2026-05-13 14:37:47,002 - optuna.study.study - INFO - Trial 120 finished with value: 0.07737563545188048 and parameters: {'n_layers': 1, 'embedding_dim': 256, 'lr': 0.0015080501378227714, 'lambda_val': 0.0024533523624459593, 'batch_size': 3904, 'optimizer': 'RMSprop'}. Best is trial 106 with value: 0.0837737998008057.
2026-05-13 14:38:22,590 - optuna.study.study - INFO - Trial 121 finished with value: 0.080861209762278 and parameters: {'n_layers': 1, 'embedding_dim': 256, 'lr': 0.0034664808335366677, 'lambda_val': 0.001768674485080738, 'batch_size': 4009, 'optimizer': 'RMSprop'}. Best is trial 106 with value: 0.0837737998008057.
2026-05-13 14:38:27,504 - optuna.study._optimize - INFO - Trial 122 pruned. 
2026-05-13 14:39:07,835 - optuna.study.study - INFO - Trial 123 finished with value: 0.07979389061120402 and parameters: {'n_layers': 1, 'embedding_dim': 256, 'lr': 0.0032963537194155364, 'lambda_val': 0.0016780360001656433, 'batch_size': 4019, 'optimizer': 'RMSprop'}. Best is trial 106 with value: 0.0837737998008057.
2026-05-13 14:39:43,415 - optuna.study.study - INFO - Trial 124 finished with value: 0.07236265044875469 and parameters: {'n_layers': 1, 'embedding_dim': 256, 'lr': 0.0017488014939683052, 'lambda_val': 0.0006216339095105188, 'batch_size': 4032, 'optimizer': 'RMSprop'}. Best is trial 106 with value: 0.0837737998008057.
2026-05-13 14:40:19,005 - optuna.study.study - INFO - Trial 125 finished with value: 0.07817322693896221 and parameters: {'n_layers': 1, 'embedding_dim': 256, 'lr': 0.0033396803855958376, 'lambda_val': 0.0019011479127842483, 'batch_size': 3872, 'optimizer': 'RMSprop'}. Best is trial 106 with value: 0.0837737998008057.
2026-05-13 14:40:54,687 - optuna.study.study - INFO - Trial 126 finished with value: 0.08119175959522655 and parameters: {'n_layers': 1, 'embedding_dim': 256, 'lr': 0.0023373493526065194, 'lambda_val': 0.0015663759895993285, 'batch_size': 4020, 'optimizer': 'RMSprop'}. Best is trial 106 with value: 0.0837737998008057.
2026-05-13 14:40:59,112 - optuna.study._optimize - INFO - Trial 127 pruned. 
2026-05-13 14:41:03,805 - optuna.study._optimize - INFO - Trial 128 pruned. 
2026-05-13 14:41:10,810 - optuna.study._optimize - INFO - Trial 129 pruned. 
2026-05-13 14:41:41,993 - optuna.study.study - INFO - Trial 130 finished with value: 0.07560993060180478 and parameters: {'n_layers': 1, 'embedding_dim': 128, 'lr': 0.002614747929334011, 'lambda_val': 0.0011762942815078555, 'batch_size': 3914, 'optimizer': 'RMSprop'}. Best is trial 106 with value: 0.0837737998008057.
2026-05-13 14:42:17,337 - optuna.study.study - INFO - Trial 131 finished with value: 0.0814643249119103 and parameters: {'n_layers': 1, 'embedding_dim': 256, 'lr': 0.004018015834890464, 'lambda_val': 0.0008031441191238472, 'batch_size': 3624, 'optimizer': 'RMSprop'}. Best is trial 106 with value: 0.0837737998008057.
2026-05-13 14:42:53,773 - optuna.study.study - INFO - Trial 132 finished with value: 0.07626474987990549 and parameters: {'n_layers': 1, 'embedding_dim': 256, 'lr': 0.0036133158887216867, 'lambda_val': 0.0008054468569754738, 'batch_size': 3757, 'optimizer': 'RMSprop'}. Best is trial 106 with value: 0.0837737998008057.
2026-05-13 14:42:58,516 - optuna.study._optimize - INFO - Trial 133 pruned. 
2026-05-13 14:43:34,432 - optuna.study.study - INFO - Trial 134 finished with value: 0.07725381943924015 and parameters: {'n_layers': 1, 'embedding_dim': 256, 'lr': 0.0021380968200365204, 'lambda_val': 0.0021604423734757384, 'batch_size': 3643, 'optimizer': 'RMSprop'}. Best is trial 106 with value: 0.0837737998008057.
2026-05-13 14:44:10,712 - optuna.study.study - INFO - Trial 135 finished with value: 0.07489455983396524 and parameters: {'n_layers': 1, 'embedding_dim': 256, 'lr': 0.006066791773274528, 'lambda_val': 0.0010538201693245746, 'batch_size': 4031, 'optimizer': 'RMSprop'}. Best is trial 106 with value: 0.0837737998008057.
2026-05-13 14:44:14,543 - optuna.study._optimize - INFO - Trial 136 pruned. 
