2026-05-13 20:09:47,904 - optuna.study.study - INFO - Trial 79 finished with value: 0.014379630163778308 and parameters: {'n_layers': 3, 'embedding_dim': 32, 'lr': 0.00010439417219061615, 'lambda_val': 0.0010728138806935404, 'batch_size': 1937, 'optimizer': 'RMSprop'}. Best is trial 58 with value: 0.03164714554410689.
2026-05-13 20:09:51,547 - optuna.study._optimize - INFO - Trial 80 pruned. 
2026-05-13 20:09:55,762 - optuna.study._optimize - INFO - Trial 81 pruned. 
2026-05-13 20:09:59,469 - optuna.study._optimize - INFO - Trial 82 pruned. 
2026-05-13 20:10:32,679 - optuna.study.study - INFO - Trial 83 finished with value: 0.0036479458980987296 and parameters: {'n_layers': 3, 'embedding_dim': 128, 'lr': 0.00015129052680913359, 'lambda_val': 0.001054241284178677, 'batch_size': 2305, 'optimizer': 'RMSprop'}. Best is trial 58 with value: 0.03164714554410689.
2026-05-13 20:10:36,628 - optuna.study._optimize - INFO - Trial 84 pruned. 
2026-05-13 20:11:00,281 - optuna.study.study - INFO - Trial 85 finished with value: 0.011704229675436903 and parameters: {'n_layers': 1, 'embedding_dim': 64, 'lr': 0.005168097088897477, 'lambda_val': 0.0002462791333929947, 'batch_size': 1678, 'optimizer': 'RMSprop'}. Best is trial 58 with value: 0.03164714554410689.
2026-05-13 20:11:26,313 - optuna.study.study - INFO - Trial 86 finished with value: 0.013529526902726673 and parameters: {'n_layers': 1, 'embedding_dim': 96, 'lr': 0.006197760894940055, 'lambda_val': 0.0007934645026365642, 'batch_size': 2074, 'optimizer': 'RMSprop'}. Best is trial 58 with value: 0.03164714554410689.
2026-05-13 20:11:48,048 - optuna.study.study - INFO - Trial 87 finished with value: 0.011196546682520398 and parameters: {'n_layers': 1, 'embedding_dim': 32, 'lr': 0.009028179664314035, 'lambda_val': 0.002617588858902386, 'batch_size': 2061, 'optimizer': 'RMSprop'}. Best is trial 58 with value: 0.03164714554410689.
2026-05-13 20:12:17,852 - optuna.study.study - INFO - Trial 88 finished with value: 0.009537626189589556 and parameters: {'n_layers': 1, 'embedding_dim': 256, 'lr': 0.00010243001188835375, 'lambda_val': 0.0008438141889439573, 'batch_size': 1887, 'optimizer': 'RMSprop'}. Best is trial 58 with value: 0.03164714554410689.
2026-05-13 20:12:21,745 - optuna.study._optimize - INFO - Trial 89 pruned. 
2026-05-13 20:12:59,766 - optuna.study.study - INFO - Trial 90 finished with value: 0.01338809416516387 and parameters: {'n_layers': 1, 'embedding_dim': 256, 'lr': 0.012395141049240076, 'lambda_val': 0.0006327128855333057, 'batch_size': 1984, 'optimizer': 'RMSprop'}. Best is trial 58 with value: 0.03164714554410689.
2026-05-13 20:13:04,223 - optuna.study._optimize - INFO - Trial 91 pruned. 
2026-05-13 20:13:33,458 - optuna.study.study - INFO - Trial 92 finished with value: 0.013161181730483144 and parameters: {'n_layers': 1, 'embedding_dim': 256, 'lr': 0.011878021648005848, 'lambda_val': 0.0003680250472630361, 'batch_size': 1750, 'optimizer': 'RMSprop'}. Best is trial 58 with value: 0.03164714554410689.
2026-05-13 20:14:03,000 - optuna.study.study - INFO - Trial 93 finished with value: 0.01283481193234877 and parameters: {'n_layers': 1, 'embedding_dim': 256, 'lr': 0.015818158696429104, 'lambda_val': 0.00031149582102174767, 'batch_size': 1774, 'optimizer': 'RMSprop'}. Best is trial 58 with value: 0.03164714554410689.
2026-05-13 20:14:06,745 - optuna.study._optimize - INFO - Trial 94 pruned. 
2026-05-13 20:14:38,702 - optuna.study.study - INFO - Trial 95 finished with value: 0.011798659711609842 and parameters: {'n_layers': 1, 'embedding_dim': 256, 'lr': 0.01258800381205485, 'lambda_val': 0.00031249603364514667, 'batch_size': 3886, 'optimizer': 'RMSprop'}. Best is trial 58 with value: 0.03164714554410689.
2026-05-13 20:15:07,525 - optuna.study.study - INFO - Trial 96 finished with value: 0.012354856711696524 and parameters: {'n_layers': 1, 'embedding_dim': 256, 'lr': 0.01534795010957229, 'lambda_val': 0.00020959596298893287, 'batch_size': 2098, 'optimizer': 'RMSprop'}. Best is trial 58 with value: 0.03164714554410689.
2026-05-13 20:15:39,661 - optuna.study.study - INFO - Trial 97 finished with value: 0.010753301104788358 and parameters: {'n_layers': 1, 'embedding_dim': 256, 'lr': 0.010639961817112718, 'lambda_val': 0.00013950973953023797, 'batch_size': 2383, 'optimizer': 'RMSprop'}. Best is trial 58 with value: 0.03164714554410689.
2026-05-13 20:15:43,864 - optuna.study._optimize - INFO - Trial 98 pruned. 
2026-05-13 20:15:48,808 - optuna.study._optimize - INFO - Trial 99 pruned. 
2026-05-13 20:16:18,530 - optuna.study.study - INFO - Trial 100 finished with value: 0.014891065087372587 and parameters: {'n_layers': 1, 'embedding_dim': 256, 'lr': 0.01592396108768962, 'lambda_val': 0.0004501215856076531, 'batch_size': 2282, 'optimizer': 'RMSprop'}. Best is trial 58 with value: 0.03164714554410689.
2026-05-13 20:16:24,633 - optuna.study._optimize - INFO - Trial 101 pruned. 
2026-05-13 20:16:28,459 - optuna.study._optimize - INFO - Trial 102 pruned. 
2026-05-13 20:16:32,019 - optuna.study._optimize - INFO - Trial 103 pruned. 
2026-05-13 20:16:35,920 - optuna.study._optimize - INFO - Trial 104 pruned. 
2026-05-13 20:17:06,196 - optuna.study.study - INFO - Trial 105 finished with value: 0.01818916935041048 and parameters: {'n_layers': 1, 'embedding_dim': 256, 'lr': 7.307593460586542e-05, 'lambda_val': 0.00026987916801227043, 'batch_size': 1878, 'optimizer': 'RMSprop'}. Best is trial 58 with value: 0.03164714554410689.
2026-05-13 20:17:11,496 - optuna.study._optimize - INFO - Trial 106 pruned. 
2026-05-13 20:17:15,280 - optuna.study._optimize - INFO - Trial 107 pruned. 
2026-05-13 20:17:38,801 - optuna.study.study - INFO - Trial 108 finished with value: 0.032269988463037344 and parameters: {'n_layers': 1, 'embedding_dim': 96, 'lr': 7.531303861511496e-05, 'lambda_val': 0.0006470561535758777, 'batch_size': 1970, 'optimizer': 'RMSprop'}. Best is trial 108 with value: 0.032269988463037344.
2026-05-13 20:17:42,273 - optuna.study._optimize - INFO - Trial 109 pruned. 
2026-05-13 20:17:45,305 - optuna.study._optimize - INFO - Trial 110 pruned. 
2026-05-13 20:18:08,968 - optuna.study.study - INFO - Trial 111 finished with value: 0.035437831707625496 and parameters: {'n_layers': 1, 'embedding_dim': 96, 'lr': 8.122646613265148e-05, 'lambda_val': 0.0006899408965596129, 'batch_size': 1994, 'optimizer': 'RMSprop'}. Best is trial 111 with value: 0.035437831707625496.
2026-05-13 20:18:40,209 - optuna.study.study - INFO - Trial 112 finished with value: 0.030083667301336287 and parameters: {'n_layers': 1, 'embedding_dim': 96, 'lr': 7.345701268115837e-05, 'lambda_val': 0.0012068110193827345, 'batch_size': 1986, 'optimizer': 'RMSprop'}. Best is trial 111 with value: 0.035437831707625496.
2026-05-13 20:19:04,749 - optuna.study.study - INFO - Trial 113 finished with value: 0.029758482350214905 and parameters: {'n_layers': 1, 'embedding_dim': 96, 'lr': 7.673984465068286e-05, 'lambda_val': 0.0007214997170073249, 'batch_size': 1987, 'optimizer': 'RMSprop'}. Best is trial 111 with value: 0.035437831707625496.
2026-05-13 20:19:41,045 - optuna.study.study - INFO - Trial 114 finished with value: 0.02617985788098134 and parameters: {'n_layers': 1, 'embedding_dim': 96, 'lr': 7.39958322356815e-05, 'lambda_val': 0.0010596522386764943, 'batch_size': 2006, 'optimizer': 'RMSprop'}. Best is trial 111 with value: 0.035437831707625496.
2026-05-13 20:20:04,617 - optuna.study.study - INFO - Trial 115 finished with value: 0.021854177259066923 and parameters: {'n_layers': 1, 'embedding_dim': 96, 'lr': 7.944147868221027e-05, 'lambda_val': 0.001013170994882964, 'batch_size': 2186, 'optimizer': 'RMSprop'}. Best is trial 111 with value: 0.035437831707625496.
2026-05-13 20:20:33,709 - optuna.study.study - INFO - Trial 116 finished with value: 0.01308268935348832 and parameters: {'n_layers': 1, 'embedding_dim': 96, 'lr': 7.872032099619927e-05, 'lambda_val': 0.0017456400367947935, 'batch_size': 2152, 'optimizer': 'Adam'}. Best is trial 111 with value: 0.035437831707625496.
2026-05-13 20:21:01,091 - optuna.study.study - INFO - Trial 117 finished with value: 0.005805558481678663 and parameters: {'n_layers': 1, 'embedding_dim': 96, 'lr': 0.00012031120535389679, 'lambda_val': 0.0037808355546626966, 'batch_size': 2195, 'optimizer': 'RMSprop'}. Best is trial 111 with value: 0.035437831707625496.
2026-05-13 20:21:25,076 - optuna.study.study - INFO - Trial 118 finished with value: 0.005705467642685588 and parameters: {'n_layers': 1, 'embedding_dim': 96, 'lr': 0.00016274647817299598, 'lambda_val': 0.0011480399305706668, 'batch_size': 2329, 'optimizer': 'RMSprop'}. Best is trial 111 with value: 0.035437831707625496.
2026-05-13 20:21:29,091 - optuna.study._optimize - INFO - Trial 119 pruned. 
2026-05-13 20:21:53,780 - optuna.study.study - INFO - Trial 120 finished with value: 0.004982338590823816 and parameters: {'n_layers': 2, 'embedding_dim': 96, 'lr': 0.0002453387969930281, 'lambda_val': 1.065380843105557e-05, 'batch_size': 2007, 'optimizer': 'RMSprop'}. Best is trial 111 with value: 0.035437831707625496.
2026-05-13 20:21:57,152 - optuna.study._optimize - INFO - Trial 121 pruned. 
2026-05-13 20:22:23,865 - optuna.study.study - INFO - Trial 122 finished with value: 0.010946218419627002 and parameters: {'n_layers': 1, 'embedding_dim': 96, 'lr': 9.976127047058413e-05, 'lambda_val': 0.0016230864145600266, 'batch_size': 1862, 'optimizer': 'RMSprop'}. Best is trial 111 with value: 0.035437831707625496.
2026-05-13 20:22:26,961 - optuna.study._optimize - INFO - Trial 123 pruned. 
2026-05-13 20:22:50,517 - optuna.study.study - INFO - Trial 124 finished with value: 0.006903041534515194 and parameters: {'n_layers': 1, 'embedding_dim': 96, 'lr': 0.00012248132709527073, 'lambda_val': 0.001088006631344584, 'batch_size': 2228, 'optimizer': 'RMSprop'}. Best is trial 111 with value: 0.035437831707625496.
2026-05-13 20:23:16,777 - optuna.study.study - INFO - Trial 125 finished with value: 0.02243419544778799 and parameters: {'n_layers': 1, 'embedding_dim': 96, 'lr': 8.821155637280746e-05, 'lambda_val': 0.0007639602952346295, 'batch_size': 1947, 'optimizer': 'RMSprop'}. Best is trial 111 with value: 0.035437831707625496.
2026-05-13 20:23:20,194 - optuna.study._optimize - INFO - Trial 126 pruned. 
2026-05-13 20:23:44,698 - optuna.study.study - INFO - Trial 127 finished with value: 0.03210667218202094 and parameters: {'n_layers': 1, 'embedding_dim': 96, 'lr': 8.00470620406522e-05, 'lambda_val': 4.096650534608553e-06, 'batch_size': 2000, 'optimizer': 'RMSprop'}. Best is trial 111 with value: 0.035437831707625496.
2026-05-13 20:24:11,539 - optuna.study.study - INFO - Trial 128 finished with value: 0.02704130643160239 and parameters: {'n_layers': 1, 'embedding_dim': 96, 'lr': 8.594321187159663e-05, 'lambda_val': 3.1022197571286547e-06, 'batch_size': 1997, 'optimizer': 'RMSprop'}. Best is trial 111 with value: 0.035437831707625496.
2026-05-13 20:24:15,212 - optuna.study._optimize - INFO - Trial 129 pruned. 
2026-05-13 20:24:43,764 - optuna.study.study - INFO - Trial 130 finished with value: 0.02408855128802851 and parameters: {'n_layers': 1, 'embedding_dim': 96, 'lr': 8.437075857536686e-05, 'lambda_val': 4.632693241835637e-06, 'batch_size': 2355, 'optimizer': 'RMSprop'}. Best is trial 111 with value: 0.035437831707625496.
2026-05-13 20:25:11,456 - optuna.study.study - INFO - Trial 131 finished with value: 0.032828509145045204 and parameters: {'n_layers': 1, 'embedding_dim': 96, 'lr': 8.341222519609103e-05, 'lambda_val': 4.732619472475691e-06, 'batch_size': 2164, 'optimizer': 'RMSprop'}. Best is trial 111 with value: 0.035437831707625496.
2026-05-13 20:25:40,438 - optuna.study.study - INFO - Trial 132 finished with value: 0.026590062099196773 and parameters: {'n_layers': 1, 'embedding_dim': 96, 'lr': 8.334694412171912e-05, 'lambda_val': 4.289809760192461e-06, 'batch_size': 1975, 'optimizer': 'RMSprop'}. Best is trial 111 with value: 0.035437831707625496.
2026-05-13 20:26:11,352 - optuna.study.study - INFO - Trial 133 finished with value: 0.006357457690441111 and parameters: {'n_layers': 1, 'embedding_dim': 96, 'lr': 0.00013976865489715608, 'lambda_val': 4.260666784196846e-06, 'batch_size': 2126, 'optimizer': 'RMSprop'}. Best is trial 111 with value: 0.035437831707625496.
2026-05-13 20:26:36,584 - optuna.study.study - INFO - Trial 134 finished with value: 0.025218980569637547 and parameters: {'n_layers': 1, 'embedding_dim': 96, 'lr': 8.753170350058027e-05, 'lambda_val': 3.65021249614151e-06, 'batch_size': 2006, 'optimizer': 'RMSprop'}. Best is trial 111 with value: 0.035437831707625496.
2026-05-13 20:27:06,255 - optuna.study.study - INFO - Trial 135 finished with value: 0.022894579482811272 and parameters: {'n_layers': 1, 'embedding_dim': 96, 'lr': 8.935214119288171e-05, 'lambda_val': 8.231513113362686e-06, 'batch_size': 2012, 'optimizer': 'RMSprop'}. Best is trial 111 with value: 0.035437831707625496.
2026-05-13 20:27:36,317 - optuna.study.study - INFO - Trial 136 finished with value: 0.00764563126686812 and parameters: {'n_layers': 1, 'embedding_dim': 96, 'lr': 0.00018419771401245478, 'lambda_val': 4.70735828439344e-06, 'batch_size': 2017, 'optimizer': 'RMSprop'}. Best is trial 111 with value: 0.035437831707625496.
2026-05-13 20:28:04,803 - optuna.study.study - INFO - Trial 137 finished with value: 0.03188088673902918 and parameters: {'n_layers': 1, 'embedding_dim': 96, 'lr': 8.533649962040411e-05, 'lambda_val': 6.189679889248561e-06, 'batch_size': 1978, 'optimizer': 'RMSprop'}. Best is trial 111 with value: 0.035437831707625496.
2026-05-13 20:28:08,397 - optuna.study._optimize - INFO - Trial 138 pruned. 
2026-05-13 20:28:36,056 - optuna.study.study - INFO - Trial 139 finished with value: 0.03490856974631619 and parameters: {'n_layers': 1, 'embedding_dim': 96, 'lr': 0.0001095739722861187, 'lambda_val': 8.266860587514113e-06, 'batch_size': 786, 'optimizer': 'RMSprop'}. Best is trial 111 with value: 0.035437831707625496.
2026-05-13 20:29:05,202 - optuna.study.study - INFO - Trial 140 finished with value: 0.008775402086525682 and parameters: {'n_layers': 1, 'embedding_dim': 96, 'lr': 0.00011213024801127392, 'lambda_val': 5.856944260690698e-06, 'batch_size': 3574, 'optimizer': 'Adam'}. Best is trial 111 with value: 0.035437831707625496.
2026-05-13 20:29:09,017 - optuna.study._optimize - INFO - Trial 141 pruned. 
2026-05-13 20:29:12,989 - optuna.study._optimize - INFO - Trial 142 pruned. 
2026-05-13 20:29:40,568 - optuna.study.study - INFO - Trial 143 finished with value: 0.017173262657048424 and parameters: {'n_layers': 1, 'embedding_dim': 96, 'lr': 8.908638570005919e-05, 'lambda_val': 1.5257924216245432e-06, 'batch_size': 2953, 'optimizer': 'RMSprop'}. Best is trial 111 with value: 0.035437831707625496.
2026-05-13 20:29:44,030 - optuna.study._optimize - INFO - Trial 144 pruned. 
2026-05-13 20:30:09,033 - optuna.study.study - INFO - Trial 145 finished with value: 0.008192424669391463 and parameters: {'n_layers': 1, 'embedding_dim': 96, 'lr': 0.00012988414744086576, 'lambda_val': 6.0685667219416166e-06, 'batch_size': 2529, 'optimizer': 'RMSprop'}. Best is trial 111 with value: 0.035437831707625496.
2026-05-13 20:30:34,989 - optuna.study.study - INFO - Trial 146 finished with value: 0.039181203080980234 and parameters: {'n_layers': 1, 'embedding_dim': 96, 'lr': 9.039147787629846e-05, 'lambda_val': 2.9825661293680967e-06, 'batch_size': 1066, 'optimizer': 'RMSprop'}. Best is trial 146 with value: 0.039181203080980234.
2026-05-13 20:30:57,986 - optuna.study.study - INFO - Trial 147 finished with value: 0.013689962662484558 and parameters: {'n_layers': 1, 'embedding_dim': 96, 'lr': 0.00016989784077815523, 'lambda_val': 1.3054146502838856e-05, 'batch_size': 1182, 'optimizer': 'RMSprop'}. Best is trial 146 with value: 0.039181203080980234.
2026-05-13 20:31:20,727 - optuna.study.study - INFO - Trial 148 finished with value: 0.03477677792053174 and parameters: {'n_layers': 1, 'embedding_dim': 96, 'lr': 0.00010623739004674838, 'lambda_val': 2.8953706959423673e-06, 'batch_size': 999, 'optimizer': 'RMSprop'}. Best is trial 146 with value: 0.039181203080980234.
2026-05-13 20:31:45,117 - optuna.study.study - INFO - Trial 149 finished with value: 0.04357399784748842 and parameters: {'n_layers': 1, 'embedding_dim': 96, 'lr': 0.0001094065555688638, 'lambda_val': 3.009761444331011e-06, 'batch_size': 599, 'optimizer': 'RMSprop'}. Best is trial 149 with value: 0.04357399784748842.
2026-05-13 20:32:09,382 - optuna.study.study - INFO - Trial 150 finished with value: 0.009250009827370015 and parameters: {'n_layers': 1, 'embedding_dim': 96, 'lr': 0.00023310574003570277, 'lambda_val': 2.865935997682907e-06, 'batch_size': 1001, 'optimizer': 'RMSprop'}. Best is trial 149 with value: 0.04357399784748842.
2026-05-13 20:32:35,991 - optuna.study.study - INFO - Trial 151 finished with value: 0.03707313034527629 and parameters: {'n_layers': 1, 'embedding_dim': 96, 'lr': 0.00011428266599527325, 'lambda_val': 1.794025488066004e-06, 'batch_size': 658, 'optimizer': 'RMSprop'}. Best is trial 149 with value: 0.04357399784748842.
2026-05-13 20:33:04,102 - optuna.study.study - INFO - Trial 152 finished with value: 0.03512027556848222 and parameters: {'n_layers': 1, 'embedding_dim': 96, 'lr': 0.0001433723863376969, 'lambda_val': 1.926639446918456e-06, 'batch_size': 705, 'optimizer': 'RMSprop'}. Best is trial 149 with value: 0.04357399784748842.
2026-05-13 20:33:29,740 - optuna.study.study - INFO - Trial 153 finished with value: 0.042472628965419285 and parameters: {'n_layers': 1, 'embedding_dim': 96, 'lr': 0.00010963803828743771, 'lambda_val': 1.731299426969381e-06, 'batch_size': 721, 'optimizer': 'RMSprop'}. Best is trial 149 with value: 0.04357399784748842.
2026-05-13 20:33:55,439 - optuna.study.study - INFO - Trial 154 finished with value: 0.04226503209093252 and parameters: {'n_layers': 1, 'embedding_dim': 96, 'lr': 0.00011000402235569, 'lambda_val': 1.7390639123789373e-06, 'batch_size': 728, 'optimizer': 'RMSprop'}. Best is trial 149 with value: 0.04357399784748842.
2026-05-13 20:34:21,534 - optuna.study.study - INFO - Trial 155 finished with value: 0.02908570803297397 and parameters: {'n_layers': 1, 'embedding_dim': 96, 'lr': 0.00014232859414833532, 'lambda_val': 1.2418724467488158e-06, 'batch_size': 730, 'optimizer': 'RMSprop'}. Best is trial 149 with value: 0.04357399784748842.
2026-05-13 20:34:46,860 - optuna.study.study - INFO - Trial 156 finished with value: 0.04491812896364409 and parameters: {'n_layers': 1, 'embedding_dim': 96, 'lr': 0.000108743949959121, 'lambda_val': 1.7179673296141157e-06, 'batch_size': 643, 'optimizer': 'RMSprop'}. Best is trial 156 with value: 0.04491812896364409.
2026-05-13 20:34:50,334 - optuna.study._optimize - INFO - Trial 157 pruned. 
2026-05-13 20:35:17,268 - optuna.study.study - INFO - Trial 158 finished with value: 0.03596581435175276 and parameters: {'n_layers': 1, 'embedding_dim': 64, 'lr': 0.00011305472492147893, 'lambda_val': 1.5009748509429829e-06, 'batch_size': 834, 'optimizer': 'RMSprop'}. Best is trial 156 with value: 0.04491812896364409.
2026-05-13 20:35:50,359 - optuna.study.study - INFO - Trial 159 finished with value: 0.016426938327355717 and parameters: {'n_layers': 1, 'embedding_dim': 64, 'lr': 0.0001999377182368695, 'lambda_val': 1.2427075322430783e-06, 'batch_size': 915, 'optimizer': 'RMSprop'}. Best is trial 156 with value: 0.04491812896364409.
2026-05-13 20:36:17,921 - optuna.study.study - INFO - Trial 160 finished with value: 0.010127206619297793 and parameters: {'n_layers': 1, 'embedding_dim': 64, 'lr': 0.00031222484032217984, 'lambda_val': 1.7589023362124234e-06, 'batch_size': 817, 'optimizer': 'RMSprop'}. Best is trial 156 with value: 0.04491812896364409.
2026-05-13 20:36:45,071 - optuna.study.study - INFO - Trial 161 finished with value: 0.043005132812592384 and parameters: {'n_layers': 1, 'embedding_dim': 64, 'lr': 0.00011146340333628824, 'lambda_val': 2.434356377654255e-06, 'batch_size': 668, 'optimizer': 'RMSprop'}. Best is trial 156 with value: 0.04491812896364409.
2026-05-13 20:37:11,592 - optuna.study.study - INFO - Trial 162 finished with value: 0.038809607402011705 and parameters: {'n_layers': 1, 'embedding_dim': 64, 'lr': 0.00011163485836806267, 'lambda_val': 2.3688160915762523e-06, 'batch_size': 669, 'optimizer': 'RMSprop'}. Best is trial 156 with value: 0.04491812896364409.
2026-05-13 20:37:32,484 - optuna.study.study - INFO - Trial 163 finished with value: 0.04148423045948896 and parameters: {'n_layers': 1, 'embedding_dim': 64, 'lr': 0.00014033272292578787, 'lambda_val': 2.435453247142891e-06, 'batch_size': 647, 'optimizer': 'RMSprop'}. Best is trial 156 with value: 0.04491812896364409.
2026-05-13 20:38:02,152 - optuna.study.study - INFO - Trial 164 finished with value: 0.04036314492874238 and parameters: {'n_layers': 1, 'embedding_dim': 64, 'lr': 0.00014452381184313091, 'lambda_val': 2.385073624919286e-06, 'batch_size': 645, 'optimizer': 'RMSprop'}. Best is trial 156 with value: 0.04491812896364409.
2026-05-13 20:38:28,355 - optuna.study.study - INFO - Trial 165 finished with value: 0.03801418901107111 and parameters: {'n_layers': 1, 'embedding_dim': 64, 'lr': 0.0001575899634242443, 'lambda_val': 1.3596877301947492e-06, 'batch_size': 664, 'optimizer': 'RMSprop'}. Best is trial 156 with value: 0.04491812896364409.
2026-05-13 20:38:52,846 - optuna.study.study - INFO - Trial 166 finished with value: 0.03727522201963112 and parameters: {'n_layers': 1, 'embedding_dim': 64, 'lr': 0.0001669170092180787, 'lambda_val': 2.3758463788962672e-06, 'batch_size': 638, 'optimizer': 'RMSprop'}. Best is trial 156 with value: 0.04491812896364409.
2026-05-13 20:39:15,976 - optuna.study.study - INFO - Trial 167 finished with value: 0.03893674399847101 and parameters: {'n_layers': 1, 'embedding_dim': 64, 'lr': 0.00016290838303990523, 'lambda_val': 2.3804200746112836e-06, 'batch_size': 642, 'optimizer': 'RMSprop'}. Best is trial 156 with value: 0.04491812896364409.
