2026-05-13 03:54:59,894 - optuna.study._optimize - INFO - Trial 116 pruned. 
2026-05-13 03:55:37,020 - optuna.study.study - INFO - Trial 117 finished with value: 0.09068841305945127 and parameters: {'n_layers': 1, 'embedding_dim': 256, 'lr': 0.008227665628660667, 'lambda_val': 0.0012735907117213804, 'batch_size': 2844, 'optimizer': 'RMSprop'}. Best is trial 98 with value: 0.09760244586234676.
2026-05-13 03:55:44,007 - optuna.study._optimize - INFO - Trial 118 pruned. 
2026-05-13 03:56:23,853 - optuna.study.study - INFO - Trial 119 finished with value: 0.08760018905254668 and parameters: {'n_layers': 1, 'embedding_dim': 256, 'lr': 0.003324096813539267, 'lambda_val': 0.0009642080479240126, 'batch_size': 2806, 'optimizer': 'RMSprop'}. Best is trial 98 with value: 0.09760244586234676.
2026-05-13 03:56:33,253 - optuna.study._optimize - INFO - Trial 120 pruned. 
2026-05-13 03:57:15,547 - optuna.study.study - INFO - Trial 121 finished with value: 0.08864298108451446 and parameters: {'n_layers': 1, 'embedding_dim': 256, 'lr': 0.006958348644905198, 'lambda_val': 0.001831848531157262, 'batch_size': 3149, 'optimizer': 'RMSprop'}. Best is trial 98 with value: 0.09760244586234676.
2026-05-13 03:57:55,687 - optuna.study.study - INFO - Trial 122 finished with value: 0.09284739340932856 and parameters: {'n_layers': 1, 'embedding_dim': 256, 'lr': 0.0043968612196867655, 'lambda_val': 0.001462916358203134, 'batch_size': 3034, 'optimizer': 'RMSprop'}. Best is trial 98 with value: 0.09760244586234676.
2026-05-13 03:58:33,015 - optuna.study.study - INFO - Trial 123 finished with value: 0.097753126892127 and parameters: {'n_layers': 1, 'embedding_dim': 256, 'lr': 0.004280913395373511, 'lambda_val': 0.001262440944835284, 'batch_size': 3022, 'optimizer': 'RMSprop'}. Best is trial 123 with value: 0.097753126892127.
2026-05-13 03:58:39,300 - optuna.study._optimize - INFO - Trial 124 pruned. 
2026-05-13 03:59:23,367 - optuna.study.study - INFO - Trial 125 finished with value: 0.09082026299606918 and parameters: {'n_layers': 1, 'embedding_dim': 256, 'lr': 0.004021469453904799, 'lambda_val': 0.0007002931565963184, 'batch_size': 3026, 'optimizer': 'RMSprop'}. Best is trial 123 with value: 0.097753126892127.
2026-05-13 04:00:01,245 - optuna.study.study - INFO - Trial 126 finished with value: 0.08675651509622383 and parameters: {'n_layers': 1, 'embedding_dim': 256, 'lr': 0.0028212094449449983, 'lambda_val': 0.0009150815118803283, 'batch_size': 2724, 'optimizer': 'RMSprop'}. Best is trial 123 with value: 0.097753126892127.
2026-05-13 04:00:40,080 - optuna.study.study - INFO - Trial 127 finished with value: 0.09397325028248271 and parameters: {'n_layers': 1, 'embedding_dim': 256, 'lr': 0.005507316085616537, 'lambda_val': 0.0014862273370478216, 'batch_size': 3293, 'optimizer': 'RMSprop'}. Best is trial 123 with value: 0.097753126892127.
2026-05-13 04:01:17,080 - optuna.study.study - INFO - Trial 128 finished with value: 0.091745617072794 and parameters: {'n_layers': 1, 'embedding_dim': 256, 'lr': 0.005857806162690602, 'lambda_val': 0.0005544117762961093, 'batch_size': 2065, 'optimizer': 'RMSprop'}. Best is trial 123 with value: 0.097753126892127.
2026-05-13 04:01:21,787 - optuna.study._optimize - INFO - Trial 129 pruned. 
2026-05-13 04:01:52,041 - optuna.study.study - INFO - Trial 130 finished with value: 0.057431365699665886 and parameters: {'n_layers': 1, 'embedding_dim': 64, 'lr': 0.002046053524386314, 'lambda_val': 0.001109531973483009, 'batch_size': 2565, 'optimizer': 'RMSprop'}. Best is trial 123 with value: 0.097753126892127.
2026-05-13 04:02:33,747 - optuna.study.study - INFO - Trial 131 finished with value: 0.09448246706337428 and parameters: {'n_layers': 1, 'embedding_dim': 256, 'lr': 0.005872763178646283, 'lambda_val': 0.0014917042893705648, 'batch_size': 3289, 'optimizer': 'RMSprop'}. Best is trial 123 with value: 0.097753126892127.
2026-05-13 04:03:12,622 - optuna.study.study - INFO - Trial 132 finished with value: 0.09140240932852928 and parameters: {'n_layers': 1, 'embedding_dim': 256, 'lr': 0.008186693407201582, 'lambda_val': 0.002134025312949219, 'batch_size': 3315, 'optimizer': 'RMSprop'}. Best is trial 123 with value: 0.097753126892127.
2026-05-13 04:03:49,922 - optuna.study.study - INFO - Trial 133 finished with value: 0.09362164291500259 and parameters: {'n_layers': 1, 'embedding_dim': 256, 'lr': 0.006413127294229513, 'lambda_val': 0.0015003133598090793, 'batch_size': 2808, 'optimizer': 'RMSprop'}. Best is trial 123 with value: 0.097753126892127.
2026-05-13 04:04:28,074 - optuna.study.study - INFO - Trial 134 finished with value: 0.08756458231301603 and parameters: {'n_layers': 1, 'embedding_dim': 256, 'lr': 0.005630173524554372, 'lambda_val': 0.0008319705963716949, 'batch_size': 2853, 'optimizer': 'RMSprop'}. Best is trial 123 with value: 0.097753126892127.
2026-05-13 04:05:11,208 - optuna.study.study - INFO - Trial 135 finished with value: 0.09167531731490824 and parameters: {'n_layers': 1, 'embedding_dim': 256, 'lr': 0.003415946042228982, 'lambda_val': 0.0014099791951809187, 'batch_size': 2763, 'optimizer': 'RMSprop'}. Best is trial 123 with value: 0.097753126892127.
2026-05-13 04:05:54,124 - optuna.study.study - INFO - Trial 136 finished with value: 0.0887827355531098 and parameters: {'n_layers': 1, 'embedding_dim': 256, 'lr': 0.006838583332912826, 'lambda_val': 0.0006744885699432029, 'batch_size': 2908, 'optimizer': 'RMSprop'}. Best is trial 123 with value: 0.097753126892127.
2026-05-13 04:06:36,454 - optuna.study.study - INFO - Trial 137 finished with value: 0.09187706772073499 and parameters: {'n_layers': 1, 'embedding_dim': 256, 'lr': 0.005498506591347412, 'lambda_val': 0.0018931321593479325, 'batch_size': 3259, 'optimizer': 'RMSprop'}. Best is trial 123 with value: 0.097753126892127.
2026-05-13 04:07:15,136 - optuna.study.study - INFO - Trial 138 finished with value: 0.09144655156990014 and parameters: {'n_layers': 1, 'embedding_dim': 256, 'lr': 0.003728137039155671, 'lambda_val': 0.0010552259640064698, 'batch_size': 2713, 'optimizer': 'RMSprop'}. Best is trial 123 with value: 0.097753126892127.
2026-05-13 04:07:57,884 - optuna.study.study - INFO - Trial 139 finished with value: 0.09462311606816615 and parameters: {'n_layers': 1, 'embedding_dim': 256, 'lr': 0.002721606549261998, 'lambda_val': 0.0016298877088592714, 'batch_size': 2819, 'optimizer': 'RMSprop'}. Best is trial 123 with value: 0.097753126892127.
2026-05-13 04:08:35,141 - optuna.study.study - INFO - Trial 140 finished with value: 0.09566933938696599 and parameters: {'n_layers': 1, 'embedding_dim': 256, 'lr': 0.0026785482781709583, 'lambda_val': 0.0022520375036511977, 'batch_size': 2807, 'optimizer': 'RMSprop'}. Best is trial 123 with value: 0.097753126892127.
2026-05-13 04:09:12,121 - optuna.study.study - INFO - Trial 141 finished with value: 0.09084826981506766 and parameters: {'n_layers': 1, 'embedding_dim': 256, 'lr': 0.004709478103237331, 'lambda_val': 0.0029431983849665154, 'batch_size': 2831, 'optimizer': 'RMSprop'}. Best is trial 123 with value: 0.097753126892127.
2026-05-13 04:09:16,755 - optuna.study._optimize - INFO - Trial 142 pruned. 
2026-05-13 04:09:53,260 - optuna.study.study - INFO - Trial 143 finished with value: 0.0921238629883759 and parameters: {'n_layers': 1, 'embedding_dim': 256, 'lr': 0.002447820824287099, 'lambda_val': 0.0015903943204364952, 'batch_size': 3074, 'optimizer': 'RMSprop'}. Best is trial 123 with value: 0.097753126892127.
2026-05-13 04:10:37,536 - optuna.study.study - INFO - Trial 144 finished with value: 0.09126720445272825 and parameters: {'n_layers': 1, 'embedding_dim': 256, 'lr': 0.0028940672752602744, 'lambda_val': 0.001203705656599581, 'batch_size': 2770, 'optimizer': 'RMSprop'}. Best is trial 123 with value: 0.097753126892127.
2026-05-13 04:10:42,312 - optuna.study._optimize - INFO - Trial 145 pruned. 
2026-05-13 04:11:17,590 - optuna.study.study - INFO - Trial 146 finished with value: 0.08799437821276623 and parameters: {'n_layers': 1, 'embedding_dim': 256, 'lr': 0.00733072200777307, 'lambda_val': 0.0017386069229170078, 'batch_size': 2988, 'optimizer': 'RMSprop'}. Best is trial 123 with value: 0.097753126892127.
2026-05-13 04:11:51,975 - optuna.study.study - INFO - Trial 147 finished with value: 0.09346539091354752 and parameters: {'n_layers': 1, 'embedding_dim': 256, 'lr': 0.003363373882526228, 'lambda_val': 0.003313030919383735, 'batch_size': 3123, 'optimizer': 'RMSprop'}. Best is trial 123 with value: 0.097753126892127.
2026-05-13 04:12:35,185 - optuna.study.study - INFO - Trial 148 finished with value: 0.07550811123806846 and parameters: {'n_layers': 1, 'embedding_dim': 256, 'lr': 0.0010834044378084664, 'lambda_val': 0.000581477221837437, 'batch_size': 2828, 'optimizer': 'RMSprop'}. Best is trial 123 with value: 0.097753126892127.
2026-05-13 04:12:39,512 - optuna.study._optimize - INFO - Trial 149 pruned. 
2026-05-13 04:12:44,147 - optuna.study._optimize - INFO - Trial 150 pruned. 
2026-05-13 04:13:17,645 - optuna.study.study - INFO - Trial 151 finished with value: 0.09026015947419898 and parameters: {'n_layers': 1, 'embedding_dim': 256, 'lr': 0.0035573737953999503, 'lambda_val': 0.003089527642253543, 'batch_size': 3123, 'optimizer': 'RMSprop'}. Best is trial 123 with value: 0.097753126892127.
2026-05-13 04:13:28,372 - optuna.study._optimize - INFO - Trial 152 pruned. 
2026-05-13 04:14:03,888 - optuna.study.study - INFO - Trial 153 finished with value: 0.0896742111609749 and parameters: {'n_layers': 1, 'embedding_dim': 256, 'lr': 0.004604020183134677, 'lambda_val': 0.0022733075638966577, 'batch_size': 2929, 'optimizer': 'RMSprop'}. Best is trial 123 with value: 0.097753126892127.
2026-05-13 04:14:08,867 - optuna.study._optimize - INFO - Trial 154 pruned. 
2026-05-13 04:14:12,883 - optuna.study._optimize - INFO - Trial 155 pruned. 
2026-05-13 04:14:17,010 - optuna.study._optimize - INFO - Trial 156 pruned. 
2026-05-13 04:14:50,285 - optuna.study.study - INFO - Trial 157 finished with value: 0.0921940617460168 and parameters: {'n_layers': 1, 'embedding_dim': 256, 'lr': 0.010711640003714676, 'lambda_val': 0.0011920046171721502, 'batch_size': 3327, 'optimizer': 'RMSprop'}. Best is trial 123 with value: 0.097753126892127.
2026-05-13 04:15:36,457 - optuna.study.study - INFO - Trial 158 finished with value: 0.09192089972044747 and parameters: {'n_layers': 1, 'embedding_dim': 256, 'lr': 0.008307368150853344, 'lambda_val': 0.0026413555363069747, 'batch_size': 2902, 'optimizer': 'RMSprop'}. Best is trial 123 with value: 0.097753126892127.
2026-05-13 04:16:11,797 - optuna.study.study - INFO - Trial 159 finished with value: 0.09077285982758482 and parameters: {'n_layers': 1, 'embedding_dim': 256, 'lr': 0.0033510469377947966, 'lambda_val': 0.0020053499931454574, 'batch_size': 2447, 'optimizer': 'RMSprop'}. Best is trial 123 with value: 0.097753126892127.
2026-05-13 04:16:16,903 - optuna.study._optimize - INFO - Trial 160 pruned. 
2026-05-13 04:16:23,398 - optuna.study._optimize - INFO - Trial 161 pruned. 
2026-05-13 04:16:27,591 - optuna.study._optimize - INFO - Trial 162 pruned. 
2026-05-13 04:17:03,008 - optuna.study.study - INFO - Trial 163 finished with value: 0.08790072184753375 and parameters: {'n_layers': 1, 'embedding_dim': 256, 'lr': 0.0015828187563996516, 'lambda_val': 0.001580783612431684, 'batch_size': 2636, 'optimizer': 'RMSprop'}. Best is trial 123 with value: 0.097753126892127.
2026-05-13 04:17:40,687 - optuna.study.study - INFO - Trial 164 finished with value: 0.08945943440329582 and parameters: {'n_layers': 1, 'embedding_dim': 256, 'lr': 0.004425192455072101, 'lambda_val': 0.0008590309941101806, 'batch_size': 2831, 'optimizer': 'RMSprop'}. Best is trial 123 with value: 0.097753126892127.
2026-05-13 04:17:44,934 - optuna.study._optimize - INFO - Trial 165 pruned. 
2026-05-13 04:18:19,991 - optuna.study.study - INFO - Trial 166 finished with value: 0.08486707373911553 and parameters: {'n_layers': 1, 'embedding_dim': 256, 'lr': 0.0031038631467700984, 'lambda_val': 0.0005948358824533757, 'batch_size': 3198, 'optimizer': 'RMSprop'}. Best is trial 123 with value: 0.097753126892127.
2026-05-13 04:18:30,451 - optuna.study._optimize - INFO - Trial 167 pruned. 
2026-05-13 04:18:38,015 - optuna.study._optimize - INFO - Trial 168 pruned. 
2026-05-13 04:19:13,964 - optuna.study.study - INFO - Trial 169 finished with value: 0.09695978881328439 and parameters: {'n_layers': 1, 'embedding_dim': 256, 'lr': 0.004253670979164265, 'lambda_val': 0.0017005849125812996, 'batch_size': 2897, 'optimizer': 'RMSprop'}. Best is trial 123 with value: 0.097753126892127.
2026-05-13 04:19:50,036 - optuna.study.study - INFO - Trial 170 finished with value: 0.09042732346072896 and parameters: {'n_layers': 1, 'embedding_dim': 256, 'lr': 0.004037912814439956, 'lambda_val': 0.0019870125857303846, 'batch_size': 2949, 'optimizer': 'RMSprop'}. Best is trial 123 with value: 0.097753126892127.
2026-05-13 04:19:58,585 - optuna.study._optimize - INFO - Trial 171 pruned. 
2026-05-13 04:20:37,458 - optuna.study.study - INFO - Trial 172 finished with value: 0.09005840726663739 and parameters: {'n_layers': 1, 'embedding_dim': 256, 'lr': 0.006420370309923977, 'lambda_val': 0.0011014898340469623, 'batch_size': 2877, 'optimizer': 'RMSprop'}. Best is trial 123 with value: 0.097753126892127.
2026-05-13 04:21:20,684 - optuna.study.study - INFO - Trial 173 finished with value: 0.09099622887592693 and parameters: {'n_layers': 1, 'embedding_dim': 256, 'lr': 0.003891491986642755, 'lambda_val': 0.001628122967815652, 'batch_size': 2821, 'optimizer': 'RMSprop'}. Best is trial 123 with value: 0.097753126892127.
2026-05-13 04:21:56,933 - optuna.study.study - INFO - Trial 174 finished with value: 0.09734887213025134 and parameters: {'n_layers': 1, 'embedding_dim': 256, 'lr': 0.007269292825385016, 'lambda_val': 0.0006737022752969924, 'batch_size': 3141, 'optimizer': 'RMSprop'}. Best is trial 123 with value: 0.097753126892127.
2026-05-13 04:22:03,858 - optuna.study._optimize - INFO - Trial 175 pruned. 
2026-05-13 04:22:08,449 - optuna.study._optimize - INFO - Trial 176 pruned. 
2026-05-13 04:22:12,985 - optuna.study._optimize - INFO - Trial 177 pruned. 
2026-05-13 04:22:40,463 - optuna.study._optimize - INFO - Trial 178 pruned. 
2026-05-13 04:23:13,530 - optuna.study.study - INFO - Trial 179 finished with value: 0.05739347390872001 and parameters: {'n_layers': 1, 'embedding_dim': 96, 'lr': 0.0008654256847830586, 'lambda_val': 0.0007099741720602892, 'batch_size': 3289, 'optimizer': 'RMSprop'}. Best is trial 123 with value: 0.097753126892127.
2026-05-13 04:23:22,414 - optuna.study._optimize - INFO - Trial 180 pruned. 
2026-05-13 04:23:26,795 - optuna.study._optimize - INFO - Trial 181 pruned. 
2026-05-13 04:24:03,281 - optuna.study.study - INFO - Trial 182 finished with value: 0.08704012790643792 and parameters: {'n_layers': 1, 'embedding_dim': 256, 'lr': 0.008780346530888902, 'lambda_val': 0.002428054776889004, 'batch_size': 2719, 'optimizer': 'RMSprop'}. Best is trial 123 with value: 0.097753126892127.
2026-05-13 04:24:07,981 - optuna.study._optimize - INFO - Trial 183 pruned. 
2026-05-13 04:24:11,875 - optuna.study._optimize - INFO - Trial 184 pruned. 
2026-05-13 04:24:48,180 - optuna.study.study - INFO - Trial 185 finished with value: 0.0951436451693499 and parameters: {'n_layers': 1, 'embedding_dim': 256, 'lr': 0.004357052364130329, 'lambda_val': 0.0010142195645548675, 'batch_size': 3196, 'optimizer': 'RMSprop'}. Best is trial 123 with value: 0.097753126892127.
2026-05-13 04:25:24,618 - optuna.study.study - INFO - Trial 186 finished with value: 0.08682084280098089 and parameters: {'n_layers': 1, 'embedding_dim': 256, 'lr': 0.004284825996443487, 'lambda_val': 0.00103598599076659, 'batch_size': 3171, 'optimizer': 'RMSprop'}. Best is trial 123 with value: 0.097753126892127.
2026-05-13 04:25:29,124 - optuna.study._optimize - INFO - Trial 187 pruned. 
2026-05-13 04:25:36,478 - optuna.study._optimize - INFO - Trial 188 pruned. 
2026-05-13 04:26:12,607 - optuna.study.study - INFO - Trial 189 finished with value: 0.09779522836240749 and parameters: {'n_layers': 1, 'embedding_dim': 256, 'lr': 0.004913218198761512, 'lambda_val': 0.0012649900917890233, 'batch_size': 3041, 'optimizer': 'RMSprop'}. Best is trial 189 with value: 0.09779522836240749.
2026-05-13 04:26:48,985 - optuna.study.study - INFO - Trial 190 finished with value: 0.09681963348189077 and parameters: {'n_layers': 1, 'embedding_dim': 256, 'lr': 0.005362691946856705, 'lambda_val': 0.0012772511498584224, 'batch_size': 3036, 'optimizer': 'RMSprop'}. Best is trial 189 with value: 0.09779522836240749.
2026-05-13 04:27:23,890 - optuna.study.study - INFO - Trial 191 finished with value: 0.09050294020239272 and parameters: {'n_layers': 1, 'embedding_dim': 256, 'lr': 0.005102464756119149, 'lambda_val': 0.0012323694234815316, 'batch_size': 3053, 'optimizer': 'RMSprop'}. Best is trial 189 with value: 0.09779522836240749.
2026-05-13 04:27:58,981 - optuna.study.study - INFO - Trial 192 finished with value: 0.09630937278238079 and parameters: {'n_layers': 1, 'embedding_dim': 256, 'lr': 0.005879148474650209, 'lambda_val': 0.0010119508231954144, 'batch_size': 3006, 'optimizer': 'RMSprop'}. Best is trial 189 with value: 0.09779522836240749.
2026-05-13 04:28:05,526 - optuna.study._optimize - INFO - Trial 193 pruned. 
2026-05-13 04:28:41,782 - optuna.study.study - INFO - Trial 194 finished with value: 0.09154282672850862 and parameters: {'n_layers': 1, 'embedding_dim': 256, 'lr': 0.004507293093774433, 'lambda_val': 0.0010278078145642476, 'batch_size': 2878, 'optimizer': 'RMSprop'}. Best is trial 189 with value: 0.09779522836240749.
2026-05-13 04:29:17,397 - optuna.study.study - INFO - Trial 195 finished with value: 0.09603874803892141 and parameters: {'n_layers': 1, 'embedding_dim': 256, 'lr': 0.007916006108186446, 'lambda_val': 0.0006126654906502528, 'batch_size': 3217, 'optimizer': 'RMSprop'}. Best is trial 189 with value: 0.09779522836240749.
2026-05-13 04:29:52,727 - optuna.study.study - INFO - Trial 196 finished with value: 0.08823835591489573 and parameters: {'n_layers': 1, 'embedding_dim': 256, 'lr': 0.007617094540722121, 'lambda_val': 0.0005893097934899852, 'batch_size': 3209, 'optimizer': 'RMSprop'}. Best is trial 189 with value: 0.09779522836240749.
2026-05-13 04:30:28,522 - optuna.study.study - INFO - Trial 197 finished with value: 0.09429533254537201 and parameters: {'n_layers': 1, 'embedding_dim': 256, 'lr': 0.005750665816013461, 'lambda_val': 0.0006893499138942097, 'batch_size': 3089, 'optimizer': 'RMSprop'}. Best is trial 189 with value: 0.09779522836240749.
2026-05-13 04:30:33,166 - optuna.study._optimize - INFO - Trial 198 pruned. 
2026-05-13 04:31:09,926 - optuna.study.study - INFO - Trial 199 finished with value: 0.09605786539293318 and parameters: {'n_layers': 1, 'embedding_dim': 256, 'lr': 0.004349773085500724, 'lambda_val': 0.0007812172051057693, 'batch_size': 3020, 'optimizer': 'RMSprop'}. Best is trial 189 with value: 0.09779522836240749.
2026-05-13 04:31:40,795 - root - INFO - **** Training e_100K_1c1dcs
2026-05-13 04:31:40,795 - root - INFO -   ** 1-Dominant stats:
2026-05-13 04:31:40,795 - root - INFO -   ** Finding the dominant set:
2026-05-13 04:31:55,388 - root - INFO -   ** Getting the trainable edges:
2026-05-13 04:31:55,391 - helper_functions - INFO -      Number of nodes: 547
2026-05-13 04:31:55,391 - helper_functions - INFO -      Ratio: 0.06036861273590111
2026-05-13 04:31:55,391 - helper_functions - INFO -      Number of unique users: 320
2026-05-13 04:31:55,391 - helper_functions - INFO -      Number of unique items: 227
2026-05-13 04:31:55,391 - helper_functions - INFO -      Total dominant set edge: 8057
2026-05-13 04:31:55,392 - helper_functions - INFO -      Trainable edges: 6445.6
2026-05-13 04:31:55,396 - root - INFO -   **** Getting 8057 dominant set edges
2026-05-13 04:31:56,264 - optuna.storages._rdb.storage - INFO - A new study created in RDB with name: Study_e_100K_1c1dcs_strict
2026-05-13 04:32:26,329 - optuna.study.study - INFO - Trial 0 finished with value: 0.0014669197650392523 and parameters: {'n_layers': 2, 'embedding_dim': 128, 'lr': 0.00032327633729015707, 'lambda_val': 0.0072816840139681505, 'batch_size': 2875, 'optimizer': 'SGD'}. Best is trial 0 with value: 0.0014669197650392523.
2026-05-13 04:32:58,881 - optuna.study.study - INFO - Trial 1 finished with value: 0.007296486287029457 and parameters: {'n_layers': 2, 'embedding_dim': 64, 'lr': 2.1969933533947928e-05, 'lambda_val': 0.0037547053985911806, 'batch_size': 1220, 'optimizer': 'Adam'}. Best is trial 1 with value: 0.007296486287029457.
2026-05-13 04:33:49,292 - optuna.study.study - INFO - Trial 2 finished with value: 0.006880707425182386 and parameters: {'n_layers': 4, 'embedding_dim': 32, 'lr': 0.00014008033702733047, 'lambda_val': 0.00018401891083347856, 'batch_size': 2551, 'optimizer': 'Adam'}. Best is trial 1 with value: 0.007296486287029457.
2026-05-13 04:34:16,860 - optuna.study.study - INFO - Trial 3 finished with value: 0.005691940606533354 and parameters: {'n_layers': 4, 'embedding_dim': 32, 'lr': 0.029625524117141377, 'lambda_val': 0.0011162009427478565, 'batch_size': 1607, 'optimizer': 'Adam'}. Best is trial 1 with value: 0.007296486287029457.
2026-05-13 04:34:46,790 - optuna.study.study - INFO - Trial 4 finished with value: 0.0021540990568182923 and parameters: {'n_layers': 2, 'embedding_dim': 128, 'lr': 0.01948847253945788, 'lambda_val': 4.047730593013063e-05, 'batch_size': 1296, 'optimizer': 'SGD'}. Best is trial 1 with value: 0.007296486287029457.
2026-05-13 04:34:50,689 - optuna.study._optimize - INFO - Trial 5 pruned. 
2026-05-13 04:35:17,512 - optuna.study.study - INFO - Trial 6 finished with value: 0.0056488042466345005 and parameters: {'n_layers': 1, 'embedding_dim': 96, 'lr': 0.00012729931114320326, 'lambda_val': 0.006766079139296548, 'batch_size': 1982, 'optimizer': 'Adam'}. Best is trial 1 with value: 0.007296486287029457.
