2026-05-13 09:17:52,340 - optuna.study.study - INFO - Trial 132 finished with value: 0.1106203591092513 and parameters: {'n_layers': 1, 'embedding_dim': 256, 'lr': 0.0001631406690951733, 'lambda_val': 2.133643156836957e-06, 'batch_size': 1142, 'optimizer': 'RMSprop'}. Best is trial 21 with value: 0.1220446314813986.
2026-05-13 09:18:02,340 - optuna.study._optimize - INFO - Trial 133 pruned. 
2026-05-13 09:18:09,755 - optuna.study._optimize - INFO - Trial 134 pruned. 
2026-05-13 09:18:14,340 - optuna.study._optimize - INFO - Trial 135 pruned. 
2026-05-13 09:18:18,410 - optuna.study._optimize - INFO - Trial 136 pruned. 
2026-05-13 09:18:22,751 - optuna.study._optimize - INFO - Trial 137 pruned. 
2026-05-13 09:18:56,692 - optuna.study.study - INFO - Trial 138 finished with value: 0.07128872820267226 and parameters: {'n_layers': 1, 'embedding_dim': 256, 'lr': 0.00022173118377706173, 'lambda_val': 4.84273529213202e-06, 'batch_size': 1787, 'optimizer': 'RMSprop'}. Best is trial 21 with value: 0.1220446314813986.
2026-05-13 09:19:01,003 - optuna.study._optimize - INFO - Trial 139 pruned. 
2026-05-13 09:19:05,758 - optuna.study._optimize - INFO - Trial 140 pruned. 
2026-05-13 09:19:38,934 - optuna.study.study - INFO - Trial 141 finished with value: 0.08712236231385936 and parameters: {'n_layers': 1, 'embedding_dim': 256, 'lr': 0.00018836747661359372, 'lambda_val': 2.3001388784477916e-06, 'batch_size': 1405, 'optimizer': 'RMSprop'}. Best is trial 21 with value: 0.1220446314813986.
2026-05-13 09:19:42,716 - optuna.study._optimize - INFO - Trial 142 pruned. 
2026-05-13 09:19:46,513 - optuna.study._optimize - INFO - Trial 143 pruned. 
2026-05-13 09:19:50,631 - optuna.study._optimize - INFO - Trial 144 pruned. 
2026-05-13 09:20:23,377 - optuna.study.study - INFO - Trial 145 finished with value: 0.10894955966728088 and parameters: {'n_layers': 1, 'embedding_dim': 256, 'lr': 0.00018883868555762533, 'lambda_val': 1.5826361705337328e-06, 'batch_size': 797, 'optimizer': 'RMSprop'}. Best is trial 21 with value: 0.1220446314813986.
2026-05-13 09:20:27,844 - optuna.study._optimize - INFO - Trial 146 pruned. 
2026-05-13 09:20:32,792 - optuna.study._optimize - INFO - Trial 147 pruned. 
2026-05-13 09:20:39,467 - optuna.study._optimize - INFO - Trial 148 pruned. 
2026-05-13 09:21:13,281 - optuna.study.study - INFO - Trial 149 finished with value: 0.09991270847676426 and parameters: {'n_layers': 1, 'embedding_dim': 256, 'lr': 0.00021543677712256717, 'lambda_val': 1.5657197994302799e-06, 'batch_size': 784, 'optimizer': 'RMSprop'}. Best is trial 21 with value: 0.1220446314813986.
2026-05-13 09:21:46,561 - optuna.study.study - INFO - Trial 150 finished with value: 0.10739812088210879 and parameters: {'n_layers': 1, 'embedding_dim': 256, 'lr': 0.00021525217733315915, 'lambda_val': 1.4622819550754127e-06, 'batch_size': 621, 'optimizer': 'RMSprop'}. Best is trial 21 with value: 0.1220446314813986.
2026-05-13 09:21:51,028 - optuna.study._optimize - INFO - Trial 151 pruned. 
2026-05-13 09:21:55,721 - optuna.study._optimize - INFO - Trial 152 pruned. 
2026-05-13 09:21:59,704 - optuna.study._optimize - INFO - Trial 153 pruned. 
2026-05-13 09:22:03,643 - optuna.study._optimize - INFO - Trial 154 pruned. 
2026-05-13 09:22:35,387 - optuna.study.study - INFO - Trial 155 finished with value: 0.1085520793431779 and parameters: {'n_layers': 1, 'embedding_dim': 256, 'lr': 0.0002274949400122387, 'lambda_val': 2.033318432731928e-06, 'batch_size': 619, 'optimizer': 'RMSprop'}. Best is trial 21 with value: 0.1220446314813986.
2026-05-13 09:23:08,019 - optuna.study.study - INFO - Trial 156 finished with value: 0.11396759611635283 and parameters: {'n_layers': 1, 'embedding_dim': 256, 'lr': 0.00022696705100023345, 'lambda_val': 1.9340949656849757e-06, 'batch_size': 524, 'optimizer': 'RMSprop'}. Best is trial 21 with value: 0.1220446314813986.
2026-05-13 09:23:13,099 - optuna.study._optimize - INFO - Trial 157 pruned. 
2026-05-13 09:23:45,545 - optuna.study.study - INFO - Trial 158 finished with value: 0.080196734374243 and parameters: {'n_layers': 1, 'embedding_dim': 256, 'lr': 0.0002849562596075416, 'lambda_val': 2.094296255722511e-06, 'batch_size': 650, 'optimizer': 'RMSprop'}. Best is trial 21 with value: 0.1220446314813986.
2026-05-13 09:24:24,562 - optuna.study.study - INFO - Trial 159 finished with value: 0.06956045038627878 and parameters: {'n_layers': 1, 'embedding_dim': 256, 'lr': 0.0005599924079421814, 'lambda_val': 1.3805108693001513e-06, 'batch_size': 752, 'optimizer': 'RMSprop'}. Best is trial 21 with value: 0.1220446314813986.
2026-05-13 09:24:29,650 - optuna.study._optimize - INFO - Trial 160 pruned. 
2026-05-13 09:24:34,229 - optuna.study._optimize - INFO - Trial 161 pruned. 
2026-05-13 09:24:38,956 - optuna.study._optimize - INFO - Trial 162 pruned. 
2026-05-13 09:24:43,176 - optuna.study._optimize - INFO - Trial 163 pruned. 
2026-05-13 09:25:15,002 - optuna.study.study - INFO - Trial 164 finished with value: 0.08545377671452553 and parameters: {'n_layers': 1, 'embedding_dim': 256, 'lr': 0.0002147265387603439, 'lambda_val': 3.0815144935007773e-06, 'batch_size': 855, 'optimizer': 'RMSprop'}. Best is trial 21 with value: 0.1220446314813986.
2026-05-13 09:25:19,347 - optuna.study._optimize - INFO - Trial 165 pruned. 
2026-05-13 09:25:55,511 - optuna.study.study - INFO - Trial 166 finished with value: 0.08925256762382326 and parameters: {'n_layers': 1, 'embedding_dim': 256, 'lr': 0.000263017573067859, 'lambda_val': 1.2615459371951731e-06, 'batch_size': 933, 'optimizer': 'RMSprop'}. Best is trial 21 with value: 0.1220446314813986.
2026-05-13 09:26:29,140 - optuna.study.study - INFO - Trial 167 finished with value: 0.08464156128458626 and parameters: {'n_layers': 1, 'embedding_dim': 256, 'lr': 0.0004091530531824078, 'lambda_val': 1.6932528308301678e-06, 'batch_size': 787, 'optimizer': 'RMSprop'}. Best is trial 21 with value: 0.1220446314813986.
2026-05-13 09:26:33,081 - optuna.study._optimize - INFO - Trial 168 pruned. 
2026-05-13 09:26:37,456 - optuna.study._optimize - INFO - Trial 169 pruned. 
2026-05-13 09:26:42,349 - optuna.study._optimize - INFO - Trial 170 pruned. 
2026-05-13 09:26:46,690 - optuna.study._optimize - INFO - Trial 171 pruned. 
2026-05-13 09:27:20,179 - optuna.study.study - INFO - Trial 172 finished with value: 0.06917151460929463 and parameters: {'n_layers': 1, 'embedding_dim': 256, 'lr': 0.00020086623315392679, 'lambda_val': 3.444779911607821e-06, 'batch_size': 1652, 'optimizer': 'RMSprop'}. Best is trial 21 with value: 0.1220446314813986.
2026-05-13 09:27:25,412 - optuna.study._optimize - INFO - Trial 173 pruned. 
2026-05-13 09:28:00,802 - optuna.study.study - INFO - Trial 174 finished with value: 0.07596964109593801 and parameters: {'n_layers': 1, 'embedding_dim': 256, 'lr': 0.0001770108328022018, 'lambda_val': 3.1651891455649986e-06, 'batch_size': 2602, 'optimizer': 'RMSprop'}. Best is trial 21 with value: 0.1220446314813986.
2026-05-13 09:28:05,699 - optuna.study._optimize - INFO - Trial 175 pruned. 
2026-05-13 09:28:39,084 - optuna.study.study - INFO - Trial 176 finished with value: 0.06595791112077763 and parameters: {'n_layers': 1, 'embedding_dim': 256, 'lr': 0.0003056927927963715, 'lambda_val': 2.106674416306202e-06, 'batch_size': 1366, 'optimizer': 'RMSprop'}. Best is trial 21 with value: 0.1220446314813986.
2026-05-13 09:29:13,274 - optuna.study.study - INFO - Trial 177 finished with value: 0.0733089195404719 and parameters: {'n_layers': 1, 'embedding_dim': 256, 'lr': 0.00024502783867606066, 'lambda_val': 2.6559628551702503e-06, 'batch_size': 1425, 'optimizer': 'RMSprop'}. Best is trial 21 with value: 0.1220446314813986.
2026-05-13 09:29:17,241 - optuna.study._optimize - INFO - Trial 178 pruned. 
2026-05-13 09:29:23,197 - optuna.study._optimize - INFO - Trial 179 pruned. 
2026-05-13 09:29:29,800 - optuna.study._optimize - INFO - Trial 180 pruned. 
2026-05-13 09:29:34,130 - optuna.study._optimize - INFO - Trial 181 pruned. 
2026-05-13 09:29:38,393 - optuna.study._optimize - INFO - Trial 182 pruned. 
2026-05-13 09:29:42,737 - optuna.study._optimize - INFO - Trial 183 pruned. 
2026-05-13 09:29:47,044 - optuna.study._optimize - INFO - Trial 184 pruned. 
2026-05-13 09:29:51,173 - optuna.study._optimize - INFO - Trial 185 pruned. 
2026-05-13 09:29:56,206 - optuna.study._optimize - INFO - Trial 186 pruned. 
2026-05-13 09:30:00,576 - optuna.study._optimize - INFO - Trial 187 pruned. 
2026-05-13 09:30:05,012 - optuna.study._optimize - INFO - Trial 188 pruned. 
2026-05-13 09:30:38,590 - optuna.study.study - INFO - Trial 189 finished with value: 0.062235174576577124 and parameters: {'n_layers': 1, 'embedding_dim': 256, 'lr': 0.00030977317190546735, 'lambda_val': 5.7872019001807636e-06, 'batch_size': 1367, 'optimizer': 'RMSprop'}. Best is trial 21 with value: 0.1220446314813986.
2026-05-13 09:30:42,828 - optuna.study._optimize - INFO - Trial 190 pruned. 
2026-05-13 09:31:16,643 - optuna.study.study - INFO - Trial 191 finished with value: 0.10030876031420491 and parameters: {'n_layers': 1, 'embedding_dim': 256, 'lr': 0.0001791719983736916, 'lambda_val': 2.5365299596756394e-06, 'batch_size': 1109, 'optimizer': 'RMSprop'}. Best is trial 21 with value: 0.1220446314813986.
2026-05-13 09:31:49,714 - optuna.study.study - INFO - Trial 192 finished with value: 0.09421724767197626 and parameters: {'n_layers': 1, 'embedding_dim': 256, 'lr': 0.00021695248637621715, 'lambda_val': 1.9266221284395742e-06, 'batch_size': 1097, 'optimizer': 'RMSprop'}. Best is trial 21 with value: 0.1220446314813986.
2026-05-13 09:31:54,057 - optuna.study._optimize - INFO - Trial 193 pruned. 
2026-05-13 09:31:58,817 - optuna.study._optimize - INFO - Trial 194 pruned. 
2026-05-13 09:32:31,966 - optuna.study.study - INFO - Trial 195 finished with value: 0.08224462621433924 and parameters: {'n_layers': 1, 'embedding_dim': 256, 'lr': 0.0002587933412680752, 'lambda_val': 2.17013447175253e-06, 'batch_size': 1459, 'optimizer': 'RMSprop'}. Best is trial 21 with value: 0.1220446314813986.
2026-05-13 09:32:36,592 - optuna.study._optimize - INFO - Trial 196 pruned. 
2026-05-13 09:32:40,600 - optuna.study._optimize - INFO - Trial 197 pruned. 
2026-05-13 09:32:44,966 - optuna.study._optimize - INFO - Trial 198 pruned. 
2026-05-13 09:32:49,273 - optuna.study._optimize - INFO - Trial 199 pruned. 
2026-05-13 09:33:16,211 - root - INFO -   **** Training e_100K_1c1dcs_rand4
2026-05-13 09:33:16,221 - root - INFO -   **** Getting 53072/65410 random edges
2026-05-13 09:33:16,538 - optuna.storages._rdb.storage - INFO - A new study created in RDB with name: Study_e_100K_1c1dcs_rand4
2026-05-13 09:33:54,588 - optuna.study.study - INFO - Trial 0 finished with value: 0.01590111228130343 and parameters: {'n_layers': 4, 'embedding_dim': 64, 'lr': 0.003229590075404506, 'lambda_val': 0.0002573623562083429, 'batch_size': 2795, 'optimizer': 'Adam'}. Best is trial 0 with value: 0.01590111228130343.
2026-05-13 09:34:35,745 - optuna.study.study - INFO - Trial 1 finished with value: 0.036618997384613966 and parameters: {'n_layers': 1, 'embedding_dim': 128, 'lr': 0.037239920882663285, 'lambda_val': 0.03235272444586453, 'batch_size': 1181, 'optimizer': 'RMSprop'}. Best is trial 1 with value: 0.036618997384613966.
2026-05-13 09:35:07,524 - optuna.study.study - INFO - Trial 2 finished with value: 0.03429146581329651 and parameters: {'n_layers': 2, 'embedding_dim': 96, 'lr': 0.0003672919430933193, 'lambda_val': 5.9563325847862775e-06, 'batch_size': 612, 'optimizer': 'Adam'}. Best is trial 1 with value: 0.036618997384613966.
2026-05-13 09:35:40,913 - optuna.study.study - INFO - Trial 3 finished with value: 0.02093828953591245 and parameters: {'n_layers': 3, 'embedding_dim': 64, 'lr': 0.0012076626481877122, 'lambda_val': 0.0016630746725520948, 'batch_size': 688, 'optimizer': 'RMSprop'}. Best is trial 1 with value: 0.036618997384613966.
2026-05-13 09:36:14,764 - optuna.study.study - INFO - Trial 4 finished with value: 0.0015123600281178942 and parameters: {'n_layers': 3, 'embedding_dim': 32, 'lr': 3.517999853729509e-05, 'lambda_val': 0.09681626873132117, 'batch_size': 3053, 'optimizer': 'SGD'}. Best is trial 1 with value: 0.036618997384613966.
2026-05-13 09:36:51,028 - optuna.study.study - INFO - Trial 5 finished with value: 0.027273743100366624 and parameters: {'n_layers': 4, 'embedding_dim': 32, 'lr': 0.0001229323108508982, 'lambda_val': 1.5779208891017652e-05, 'batch_size': 3394, 'optimizer': 'RMSprop'}. Best is trial 1 with value: 0.036618997384613966.
2026-05-13 09:37:29,370 - optuna.study.study - INFO - Trial 6 finished with value: 0.03765285403347368 and parameters: {'n_layers': 3, 'embedding_dim': 128, 'lr': 0.011675683376473246, 'lambda_val': 0.00011337071732051261, 'batch_size': 1333, 'optimizer': 'RMSprop'}. Best is trial 6 with value: 0.03765285403347368.
2026-05-13 09:37:34,853 - optuna.study._optimize - INFO - Trial 7 pruned. 
2026-05-13 09:37:40,558 - optuna.study._optimize - INFO - Trial 8 pruned. 
2026-05-13 09:38:24,565 - optuna.study.study - INFO - Trial 9 finished with value: 0.04539850745257645 and parameters: {'n_layers': 2, 'embedding_dim': 256, 'lr': 0.003249134211982966, 'lambda_val': 0.0010737851054797441, 'batch_size': 3779, 'optimizer': 'RMSprop'}. Best is trial 9 with value: 0.04539850745257645.
2026-05-13 09:38:29,322 - optuna.study._optimize - INFO - Trial 10 pruned. 
2026-05-13 09:39:08,150 - optuna.study.study - INFO - Trial 11 finished with value: 0.03870184982719013 and parameters: {'n_layers': 3, 'embedding_dim': 128, 'lr': 0.01236896433777286, 'lambda_val': 7.852120287418184e-05, 'batch_size': 1892, 'optimizer': 'RMSprop'}. Best is trial 9 with value: 0.04539850745257645.
2026-05-13 09:39:49,823 - optuna.study.study - INFO - Trial 12 finished with value: 0.031262921151196006 and parameters: {'n_layers': 2, 'embedding_dim': 256, 'lr': 0.0009234483405347894, 'lambda_val': 3.424763480237271e-05, 'batch_size': 1908, 'optimizer': 'RMSprop'}. Best is trial 9 with value: 0.04539850745257645.
2026-05-13 09:39:56,156 - optuna.study._optimize - INFO - Trial 13 pruned. 
2026-05-13 09:40:00,280 - optuna.study._optimize - INFO - Trial 14 pruned. 
2026-05-13 09:40:07,957 - optuna.study._optimize - INFO - Trial 15 pruned. 
2026-05-13 09:40:51,051 - optuna.study.study - INFO - Trial 16 finished with value: 0.044151011941520595 and parameters: {'n_layers': 2, 'embedding_dim': 256, 'lr': 0.012745498744383663, 'lambda_val': 0.0009488723383523093, 'batch_size': 3461, 'optimizer': 'RMSprop'}. Best is trial 9 with value: 0.04539850745257645.
2026-05-13 09:40:56,803 - optuna.study._optimize - INFO - Trial 17 pruned. 
2026-05-13 09:41:01,260 - optuna.study._optimize - INFO - Trial 18 pruned. 
2026-05-13 09:41:44,787 - optuna.study.study - INFO - Trial 19 finished with value: 0.036687328551739305 and parameters: {'n_layers': 2, 'embedding_dim': 256, 'lr': 0.000870574920237402, 'lambda_val': 0.00038629355245310096, 'batch_size': 3693, 'optimizer': 'Adam'}. Best is trial 9 with value: 0.04539850745257645.
2026-05-13 09:42:20,191 - optuna.study.study - INFO - Trial 20 finished with value: 0.08342088780344908 and parameters: {'n_layers': 1, 'embedding_dim': 256, 'lr': 0.005784652075243105, 'lambda_val': 0.002547289644317642, 'batch_size': 2994, 'optimizer': 'RMSprop'}. Best is trial 20 with value: 0.08342088780344908.
2026-05-13 09:42:56,317 - optuna.study.study - INFO - Trial 21 finished with value: 0.07906308443146445 and parameters: {'n_layers': 1, 'embedding_dim': 256, 'lr': 0.005761937270149027, 'lambda_val': 0.0034271458858417085, 'batch_size': 3007, 'optimizer': 'RMSprop'}. Best is trial 20 with value: 0.08342088780344908.
2026-05-13 09:43:31,563 - optuna.study.study - INFO - Trial 22 finished with value: 0.07771032589808739 and parameters: {'n_layers': 1, 'embedding_dim': 256, 'lr': 0.005250515283794527, 'lambda_val': 0.004238945502218512, 'batch_size': 2957, 'optimizer': 'RMSprop'}. Best is trial 20 with value: 0.08342088780344908.
2026-05-13 09:44:07,041 - optuna.study.study - INFO - Trial 23 finished with value: 0.06740642039789894 and parameters: {'n_layers': 1, 'embedding_dim': 256, 'lr': 0.0053823439600196275, 'lambda_val': 0.004980470408663484, 'batch_size': 2877, 'optimizer': 'RMSprop'}. Best is trial 20 with value: 0.08342088780344908.
2026-05-13 09:44:14,895 - optuna.study._optimize - INFO - Trial 24 pruned. 
2026-05-13 09:44:49,735 - optuna.study.study - INFO - Trial 25 finished with value: 0.07530923942971483 and parameters: {'n_layers': 1, 'embedding_dim': 256, 'lr': 0.001784433844565745, 'lambda_val': 0.0030065231639573526, 'batch_size': 2623, 'optimizer': 'RMSprop'}. Best is trial 20 with value: 0.08342088780344908.
2026-05-13 09:44:53,506 - optuna.study._optimize - INFO - Trial 26 pruned. 
2026-05-13 09:45:24,339 - optuna.study.study - INFO - Trial 27 finished with value: 0.042773976805474824 and parameters: {'n_layers': 1, 'embedding_dim': 96, 'lr': 0.00046196276824543564, 'lambda_val': 0.0031602261380316177, 'batch_size': 2803, 'optimizer': 'RMSprop'}. Best is trial 20 with value: 0.08342088780344908.
2026-05-13 09:45:28,540 - optuna.study._optimize - INFO - Trial 28 pruned. 
2026-05-13 09:45:58,421 - optuna.study.study - INFO - Trial 29 finished with value: 0.04362591602090649 and parameters: {'n_layers': 1, 'embedding_dim': 64, 'lr': 0.00241780971618594, 'lambda_val': 0.00046674727856835745, 'batch_size': 2633, 'optimizer': 'Adam'}. Best is trial 20 with value: 0.08342088780344908.
2026-05-13 09:46:35,011 - optuna.study.study - INFO - Trial 30 finished with value: 0.08039670927703335 and parameters: {'n_layers': 1, 'embedding_dim': 256, 'lr': 0.0041172943795715075, 'lambda_val': 0.002800568786021216, 'batch_size': 2927, 'optimizer': 'Adam'}. Best is trial 20 with value: 0.08342088780344908.
2026-05-13 09:47:11,805 - optuna.study.study - INFO - Trial 31 finished with value: 0.08009875288995601 and parameters: {'n_layers': 1, 'embedding_dim': 256, 'lr': 0.005056583193481456, 'lambda_val': 0.002598251186357066, 'batch_size': 2886, 'optimizer': 'Adam'}. Best is trial 20 with value: 0.08342088780344908.
2026-05-13 09:47:47,239 - optuna.study.study - INFO - Trial 32 finished with value: 0.06254492993125903 and parameters: {'n_layers': 1, 'embedding_dim': 256, 'lr': 0.001453871295031497, 'lambda_val': 0.00020140804751768605, 'batch_size': 2756, 'optimizer': 'Adam'}. Best is trial 20 with value: 0.08342088780344908.
2026-05-13 09:48:23,434 - optuna.study.study - INFO - Trial 33 finished with value: 0.07475948933604196 and parameters: {'n_layers': 1, 'embedding_dim': 256, 'lr': 0.003482608116412996, 'lambda_val': 0.0007629383529587239, 'batch_size': 3249, 'optimizer': 'Adam'}. Best is trial 20 with value: 0.08342088780344908.
2026-05-13 09:48:27,939 - optuna.study._optimize - INFO - Trial 34 pruned. 
2026-05-13 09:49:04,925 - optuna.study.study - INFO - Trial 35 finished with value: 0.07415267496554227 and parameters: {'n_layers': 1, 'embedding_dim': 256, 'lr': 0.017455539694275865, 'lambda_val': 0.002407869528656418, 'batch_size': 3510, 'optimizer': 'Adam'}. Best is trial 20 with value: 0.08342088780344908.
2026-05-13 09:49:09,551 - optuna.study._optimize - INFO - Trial 36 pruned. 
2026-05-13 09:49:40,086 - optuna.study.study - INFO - Trial 37 finished with value: 0.04184562000555952 and parameters: {'n_layers': 1, 'embedding_dim': 64, 'lr': 0.0005014886469391765, 'lambda_val': 0.0020242891356903026, 'batch_size': 3154, 'optimizer': 'Adam'}. Best is trial 20 with value: 0.08342088780344908.
2026-05-13 09:49:45,584 - optuna.study._optimize - INFO - Trial 38 pruned. 
2026-05-13 09:49:49,767 - optuna.study._optimize - INFO - Trial 39 pruned. 
2026-05-13 09:49:56,603 - optuna.study._optimize - INFO - Trial 40 pruned. 
2026-05-13 09:50:32,117 - optuna.study.study - INFO - Trial 41 finished with value: 0.06967874944277899 and parameters: {'n_layers': 1, 'embedding_dim': 256, 'lr': 0.004585408773066907, 'lambda_val': 0.004718125464218184, 'batch_size': 2975, 'optimizer': 'RMSprop'}. Best is trial 20 with value: 0.08342088780344908.
2026-05-13 09:50:37,459 - optuna.study._optimize - INFO - Trial 42 pruned. 
2026-05-13 09:50:41,829 - optuna.study._optimize - INFO - Trial 43 pruned. 
2026-05-13 09:51:17,950 - optuna.study.study - INFO - Trial 44 finished with value: 0.07496542530096562 and parameters: {'n_layers': 1, 'embedding_dim': 256, 'lr': 0.009875247469162463, 'lambda_val': 0.0035082619439929493, 'batch_size': 2732, 'optimizer': 'Adam'}. Best is trial 20 with value: 0.08342088780344908.
2026-05-13 09:51:22,266 - optuna.study._optimize - INFO - Trial 45 pruned. 
2026-05-13 09:51:26,783 - optuna.study._optimize - INFO - Trial 46 pruned. 
2026-05-13 09:51:57,814 - optuna.study.study - INFO - Trial 47 finished with value: 0.07980935503185471 and parameters: {'n_layers': 1, 'embedding_dim': 128, 'lr': 0.005612664961084607, 'lambda_val': 0.0013437310956974267, 'batch_size': 3272, 'optimizer': 'RMSprop'}. Best is trial 20 with value: 0.08342088780344908.
2026-05-13 09:52:03,196 - optuna.study._optimize - INFO - Trial 48 pruned. 
2026-05-13 09:52:08,458 - optuna.study._optimize - INFO - Trial 49 pruned. 
2026-05-13 09:52:12,988 - optuna.study._optimize - INFO - Trial 50 pruned. 
2026-05-13 09:52:45,959 - optuna.study.study - INFO - Trial 51 finished with value: 0.07286272225348049 and parameters: {'n_layers': 1, 'embedding_dim': 128, 'lr': 0.005550300244195566, 'lambda_val': 0.004304565681346179, 'batch_size': 3131, 'optimizer': 'RMSprop'}. Best is trial 20 with value: 0.08342088780344908.
2026-05-13 09:53:18,653 - optuna.study.study - INFO - Trial 52 finished with value: 0.03931195359741125 and parameters: {'n_layers': 1, 'embedding_dim': 32, 'lr': 0.0016722383316600707, 'lambda_val': 0.0018141370795226664, 'batch_size': 3326, 'optimizer': 'RMSprop'}. Best is trial 20 with value: 0.08342088780344908.
2026-05-13 09:53:23,616 - optuna.study._optimize - INFO - Trial 53 pruned. 
