2026-05-13 10:34:03,437 - optuna.study.study - INFO - Trial 164 finished with value: 0.07762732809690483 and parameters: {'n_layers': 1, 'embedding_dim': 256, 'lr': 0.010202842179022373, 'lambda_val': 0.0006809585895676831, 'batch_size': 2730, 'optimizer': 'RMSprop'}. Best is trial 112 with value: 0.08779861477383034.
2026-05-13 10:34:43,420 - optuna.study.study - INFO - Trial 165 finished with value: 0.0846013303090566 and parameters: {'n_layers': 1, 'embedding_dim': 256, 'lr': 0.005277110668770144, 'lambda_val': 0.0010931016546096002, 'batch_size': 3110, 'optimizer': 'RMSprop'}. Best is trial 112 with value: 0.08779861477383034.
2026-05-13 10:35:22,612 - optuna.study.study - INFO - Trial 166 finished with value: 0.08318882019248136 and parameters: {'n_layers': 1, 'embedding_dim': 256, 'lr': 0.007599860208687478, 'lambda_val': 0.0016012740509782032, 'batch_size': 3128, 'optimizer': 'RMSprop'}. Best is trial 112 with value: 0.08779861477383034.
2026-05-13 10:35:59,544 - optuna.study.study - INFO - Trial 167 finished with value: 0.0831549154795618 and parameters: {'n_layers': 1, 'embedding_dim': 256, 'lr': 0.004806581220634991, 'lambda_val': 0.0020747927151937924, 'batch_size': 3204, 'optimizer': 'RMSprop'}. Best is trial 112 with value: 0.08779861477383034.
2026-05-13 10:36:43,753 - optuna.study.study - INFO - Trial 168 finished with value: 0.08156068220402043 and parameters: {'n_layers': 1, 'embedding_dim': 256, 'lr': 0.009073612680326854, 'lambda_val': 0.0011601324876420842, 'batch_size': 2871, 'optimizer': 'RMSprop'}. Best is trial 112 with value: 0.08779861477383034.
2026-05-13 10:37:21,884 - optuna.study.study - INFO - Trial 169 finished with value: 0.08444439355141085 and parameters: {'n_layers': 1, 'embedding_dim': 256, 'lr': 0.00401412703717656, 'lambda_val': 0.0008100920163167766, 'batch_size': 3076, 'optimizer': 'RMSprop'}. Best is trial 112 with value: 0.08779861477383034.
2026-05-13 10:37:26,312 - optuna.study._optimize - INFO - Trial 170 pruned. 
2026-05-13 10:38:13,787 - optuna.study.study - INFO - Trial 171 finished with value: 0.08104585693159085 and parameters: {'n_layers': 1, 'embedding_dim': 256, 'lr': 0.003929218402425534, 'lambda_val': 0.0008646688828250745, 'batch_size': 3298, 'optimizer': 'RMSprop'}. Best is trial 112 with value: 0.08779861477383034.
2026-05-13 10:38:57,697 - optuna.study.study - INFO - Trial 172 finished with value: 0.08629441251679514 and parameters: {'n_layers': 1, 'embedding_dim': 256, 'lr': 0.0035594248948870263, 'lambda_val': 0.001440048618326122, 'batch_size': 2939, 'optimizer': 'RMSprop'}. Best is trial 112 with value: 0.08779861477383034.
2026-05-13 10:39:34,664 - optuna.study.study - INFO - Trial 173 finished with value: 0.08106226245546304 and parameters: {'n_layers': 1, 'embedding_dim': 256, 'lr': 0.003393624136039145, 'lambda_val': 0.0014461144838333008, 'batch_size': 3149, 'optimizer': 'RMSprop'}. Best is trial 112 with value: 0.08779861477383034.
2026-05-13 10:40:15,058 - optuna.study.study - INFO - Trial 174 finished with value: 0.08036541797812895 and parameters: {'n_layers': 1, 'embedding_dim': 256, 'lr': 0.006825145397424581, 'lambda_val': 0.0006513958988805712, 'batch_size': 2967, 'optimizer': 'RMSprop'}. Best is trial 112 with value: 0.08779861477383034.
2026-05-13 10:40:51,757 - optuna.study.study - INFO - Trial 175 finished with value: 0.08455784058878024 and parameters: {'n_layers': 1, 'embedding_dim': 256, 'lr': 0.0037980117321088423, 'lambda_val': 0.001140200152588785, 'batch_size': 2807, 'optimizer': 'RMSprop'}. Best is trial 112 with value: 0.08779861477383034.
2026-05-13 10:41:29,033 - optuna.study.study - INFO - Trial 176 finished with value: 0.07877370127760705 and parameters: {'n_layers': 1, 'embedding_dim': 256, 'lr': 0.01216206741542336, 'lambda_val': 0.0011828928897516825, 'batch_size': 3098, 'optimizer': 'RMSprop'}. Best is trial 112 with value: 0.08779861477383034.
2026-05-13 10:41:33,984 - optuna.study._optimize - INFO - Trial 177 pruned. 
2026-05-13 10:42:08,660 - optuna.study.study - INFO - Trial 178 finished with value: 0.0824912420891126 and parameters: {'n_layers': 1, 'embedding_dim': 256, 'lr': 0.0034592965631317124, 'lambda_val': 0.0013607154384506356, 'batch_size': 3237, 'optimizer': 'RMSprop'}. Best is trial 112 with value: 0.08779861477383034.
2026-05-13 10:42:14,339 - optuna.study._optimize - INFO - Trial 179 pruned. 
2026-05-13 10:43:02,514 - optuna.study.study - INFO - Trial 180 finished with value: 0.06688044428260474 and parameters: {'n_layers': 1, 'embedding_dim': 256, 'lr': 0.00016945661897783493, 'lambda_val': 0.0005854759407599846, 'batch_size': 3022, 'optimizer': 'RMSprop'}. Best is trial 112 with value: 0.08779861477383034.
2026-05-13 10:43:37,027 - optuna.study.study - INFO - Trial 181 finished with value: 0.08236311084726283 and parameters: {'n_layers': 1, 'embedding_dim': 256, 'lr': 0.004184621928036539, 'lambda_val': 0.00101207674350585, 'batch_size': 2756, 'optimizer': 'RMSprop'}. Best is trial 112 with value: 0.08779861477383034.
2026-05-13 10:43:48,102 - optuna.study._optimize - INFO - Trial 182 pruned. 
2026-05-13 10:44:22,833 - optuna.study.study - INFO - Trial 183 finished with value: 0.08689265924501186 and parameters: {'n_layers': 1, 'embedding_dim': 256, 'lr': 0.004502050994283441, 'lambda_val': 0.001542328627121525, 'batch_size': 2819, 'optimizer': 'RMSprop'}. Best is trial 112 with value: 0.08779861477383034.
2026-05-13 10:44:57,526 - optuna.study.study - INFO - Trial 184 finished with value: 0.08199236033417752 and parameters: {'n_layers': 1, 'embedding_dim': 256, 'lr': 0.004754991394740353, 'lambda_val': 0.0016371517883258563, 'batch_size': 2892, 'optimizer': 'RMSprop'}. Best is trial 112 with value: 0.08779861477383034.
2026-05-13 10:45:02,045 - optuna.study._optimize - INFO - Trial 185 pruned. 
2026-05-13 10:45:37,388 - optuna.study.study - INFO - Trial 186 finished with value: 0.08559830805318168 and parameters: {'n_layers': 1, 'embedding_dim': 256, 'lr': 0.005371794003616557, 'lambda_val': 0.0012684999644257912, 'batch_size': 3025, 'optimizer': 'RMSprop'}. Best is trial 112 with value: 0.08779861477383034.
2026-05-13 10:46:11,989 - optuna.study.study - INFO - Trial 187 finished with value: 0.08626629585876966 and parameters: {'n_layers': 1, 'embedding_dim': 256, 'lr': 0.005749009574444447, 'lambda_val': 0.001358075435167261, 'batch_size': 3029, 'optimizer': 'RMSprop'}. Best is trial 112 with value: 0.08779861477383034.
2026-05-13 10:46:16,445 - optuna.study._optimize - INFO - Trial 188 pruned. 
2026-05-13 10:46:51,127 - optuna.study.study - INFO - Trial 189 finished with value: 0.08838748373551984 and parameters: {'n_layers': 1, 'embedding_dim': 256, 'lr': 0.006461810213575793, 'lambda_val': 0.0011024958321344544, 'batch_size': 3191, 'optimizer': 'RMSprop'}. Best is trial 189 with value: 0.08838748373551984.
2026-05-13 10:47:34,618 - optuna.study.study - INFO - Trial 190 finished with value: 0.08924665673620237 and parameters: {'n_layers': 1, 'embedding_dim': 256, 'lr': 0.006440431081815033, 'lambda_val': 0.0011263024570354583, 'batch_size': 3326, 'optimizer': 'RMSprop'}. Best is trial 190 with value: 0.08924665673620237.
2026-05-13 10:48:10,701 - optuna.study.study - INFO - Trial 191 finished with value: 0.08714568220214138 and parameters: {'n_layers': 1, 'embedding_dim': 256, 'lr': 0.0065202452913280555, 'lambda_val': 0.001165706759589578, 'batch_size': 3353, 'optimizer': 'RMSprop'}. Best is trial 190 with value: 0.08924665673620237.
2026-05-13 10:48:46,525 - optuna.study.study - INFO - Trial 192 finished with value: 0.08454276960754258 and parameters: {'n_layers': 1, 'embedding_dim': 256, 'lr': 0.005843546039911861, 'lambda_val': 0.0011152187770916806, 'batch_size': 3217, 'optimizer': 'RMSprop'}. Best is trial 190 with value: 0.08924665673620237.
2026-05-13 10:49:21,561 - optuna.study.study - INFO - Trial 193 finished with value: 0.08508602841751237 and parameters: {'n_layers': 1, 'embedding_dim': 256, 'lr': 0.006641831059638845, 'lambda_val': 0.0015254225440480512, 'batch_size': 3003, 'optimizer': 'RMSprop'}. Best is trial 190 with value: 0.08924665673620237.
2026-05-13 10:49:56,846 - optuna.study.study - INFO - Trial 194 finished with value: 0.0784873804937609 and parameters: {'n_layers': 1, 'embedding_dim': 256, 'lr': 0.006735105730794024, 'lambda_val': 0.002336237446893408, 'batch_size': 3328, 'optimizer': 'RMSprop'}. Best is trial 190 with value: 0.08924665673620237.
2026-05-13 10:50:32,807 - optuna.study.study - INFO - Trial 195 finished with value: 0.08474765479548224 and parameters: {'n_layers': 1, 'embedding_dim': 256, 'lr': 0.007562287042192234, 'lambda_val': 0.0015003758826680521, 'batch_size': 3462, 'optimizer': 'RMSprop'}. Best is trial 190 with value: 0.08924665673620237.
2026-05-13 10:50:37,142 - optuna.study._optimize - INFO - Trial 196 pruned. 
2026-05-13 10:51:12,475 - optuna.study.study - INFO - Trial 197 finished with value: 0.08597873308787746 and parameters: {'n_layers': 1, 'embedding_dim': 256, 'lr': 0.0067600509181813895, 'lambda_val': 0.0015388549629371646, 'batch_size': 3192, 'optimizer': 'RMSprop'}. Best is trial 190 with value: 0.08924665673620237.
2026-05-13 10:51:19,672 - optuna.study._optimize - INFO - Trial 198 pruned. 
2026-05-13 10:51:33,837 - optuna.study._optimize - INFO - Trial 199 pruned. 
2026-05-13 10:52:02,365 - root - INFO -   **** Training e_100K_1c1dcs_rand5
2026-05-13 10:52:02,377 - root - INFO -   **** Getting 53072/65410 random edges
2026-05-13 10:52:02,677 - optuna.storages._rdb.storage - INFO - A new study created in RDB with name: Study_e_100K_1c1dcs_rand5
2026-05-13 10:52:35,084 - optuna.study.study - INFO - Trial 0 finished with value: 0.0031313770056481363 and parameters: {'n_layers': 3, 'embedding_dim': 32, 'lr': 6.779935254651061e-05, 'lambda_val': 0.09016409591516579, 'batch_size': 1646, 'optimizer': 'SGD'}. Best is trial 0 with value: 0.0031313770056481363.
2026-05-13 10:53:22,087 - optuna.study.study - INFO - Trial 1 finished with value: 0.003635857476169406 and parameters: {'n_layers': 4, 'embedding_dim': 32, 'lr': 0.08268124510850808, 'lambda_val': 3.1046774926477098e-06, 'batch_size': 755, 'optimizer': 'SGD'}. Best is trial 1 with value: 0.003635857476169406.
2026-05-13 10:53:57,663 - optuna.study.study - INFO - Trial 2 finished with value: 0.03325105489575319 and parameters: {'n_layers': 2, 'embedding_dim': 128, 'lr': 0.006260040002427551, 'lambda_val': 1.6413207485553038e-05, 'batch_size': 3999, 'optimizer': 'Adam'}. Best is trial 2 with value: 0.03325105489575319.
2026-05-13 10:54:28,485 - optuna.study.study - INFO - Trial 3 finished with value: 0.02473837024470947 and parameters: {'n_layers': 1, 'embedding_dim': 96, 'lr': 7.606703442558439e-05, 'lambda_val': 0.06148798638335378, 'batch_size': 3558, 'optimizer': 'RMSprop'}. Best is trial 2 with value: 0.03325105489575319.
2026-05-13 10:55:00,432 - optuna.study.study - INFO - Trial 4 finished with value: 0.029974552938741985 and parameters: {'n_layers': 2, 'embedding_dim': 96, 'lr': 2.5498260859027852e-05, 'lambda_val': 0.0021143697837190637, 'batch_size': 866, 'optimizer': 'Adam'}. Best is trial 2 with value: 0.03325105489575319.
2026-05-13 10:55:41,192 - optuna.study.study - INFO - Trial 5 finished with value: 0.018380203746407985 and parameters: {'n_layers': 2, 'embedding_dim': 256, 'lr': 0.05062940980779144, 'lambda_val': 0.026264570296951645, 'batch_size': 514, 'optimizer': 'RMSprop'}. Best is trial 2 with value: 0.03325105489575319.
2026-05-13 10:55:50,665 - optuna.study._optimize - INFO - Trial 6 pruned. 
2026-05-13 10:55:55,808 - optuna.study._optimize - INFO - Trial 7 pruned. 
2026-05-13 10:56:00,023 - optuna.study._optimize - INFO - Trial 8 pruned. 
2026-05-13 10:56:06,488 - optuna.study._optimize - INFO - Trial 9 pruned. 
2026-05-13 10:56:36,583 - optuna.study.study - INFO - Trial 10 finished with value: 0.05490897345946103 and parameters: {'n_layers': 1, 'embedding_dim': 128, 'lr': 0.0007073075864830289, 'lambda_val': 0.00012090218874298724, 'batch_size': 2078, 'optimizer': 'Adam'}. Best is trial 10 with value: 0.05490897345946103.
2026-05-13 10:57:06,506 - optuna.study.study - INFO - Trial 11 finished with value: 0.052873033936981714 and parameters: {'n_layers': 1, 'embedding_dim': 128, 'lr': 0.0009252301684735635, 'lambda_val': 0.00011276632687112302, 'batch_size': 2238, 'optimizer': 'Adam'}. Best is trial 10 with value: 0.05490897345946103.
2026-05-13 10:57:36,111 - optuna.study.study - INFO - Trial 12 finished with value: 0.051766198419811095 and parameters: {'n_layers': 1, 'embedding_dim': 128, 'lr': 0.0006346216211294204, 'lambda_val': 0.000255160229233745, 'batch_size': 2092, 'optimizer': 'Adam'}. Best is trial 10 with value: 0.05490897345946103.
2026-05-13 10:58:14,023 - optuna.study.study - INFO - Trial 13 finished with value: 0.057031210602938955 and parameters: {'n_layers': 1, 'embedding_dim': 128, 'lr': 0.00037900063561587124, 'lambda_val': 0.0003437915879682798, 'batch_size': 2229, 'optimizer': 'Adam'}. Best is trial 13 with value: 0.057031210602938955.
2026-05-13 10:59:00,930 - optuna.study.study - INFO - Trial 14 finished with value: 0.06991274616189817 and parameters: {'n_layers': 1, 'embedding_dim': 128, 'lr': 0.00025980715918695173, 'lambda_val': 0.0016275447615315848, 'batch_size': 1747, 'optimizer': 'Adam'}. Best is trial 14 with value: 0.06991274616189817.
2026-05-13 10:59:56,594 - optuna.study.study - INFO - Trial 15 finished with value: 0.021197905953630754 and parameters: {'n_layers': 3, 'embedding_dim': 128, 'lr': 0.0001949505712267634, 'lambda_val': 0.002111956594510204, 'batch_size': 1425, 'optimizer': 'Adam'}. Best is trial 14 with value: 0.06991274616189817.
2026-05-13 11:00:33,222 - optuna.study.study - INFO - Trial 16 finished with value: 0.07493518901799509 and parameters: {'n_layers': 1, 'embedding_dim': 128, 'lr': 0.004123820815307057, 'lambda_val': 0.0014703808161704583, 'batch_size': 2906, 'optimizer': 'Adam'}. Best is trial 16 with value: 0.07493518901799509.
2026-05-13 11:00:38,794 - optuna.study._optimize - INFO - Trial 17 pruned. 
2026-05-13 11:00:43,496 - optuna.study._optimize - INFO - Trial 18 pruned. 
2026-05-13 11:00:47,446 - optuna.study._optimize - INFO - Trial 19 pruned. 
2026-05-13 11:01:22,315 - optuna.study.study - INFO - Trial 20 finished with value: 0.06916163619387848 and parameters: {'n_layers': 1, 'embedding_dim': 256, 'lr': 0.0021561999115542216, 'lambda_val': 0.0006759613715548346, 'batch_size': 1710, 'optimizer': 'Adam'}. Best is trial 16 with value: 0.07493518901799509.
2026-05-13 11:01:58,197 - optuna.study.study - INFO - Trial 21 finished with value: 0.07613841966675915 and parameters: {'n_layers': 1, 'embedding_dim': 256, 'lr': 0.0020702325849477525, 'lambda_val': 0.0007236563551867272, 'batch_size': 1758, 'optimizer': 'Adam'}. Best is trial 21 with value: 0.07613841966675915.
2026-05-13 11:02:02,631 - optuna.study._optimize - INFO - Trial 22 pruned. 
2026-05-13 11:02:45,070 - optuna.study.study - INFO - Trial 23 finished with value: 0.034819779126017934 and parameters: {'n_layers': 2, 'embedding_dim': 256, 'lr': 0.000229964962865404, 'lambda_val': 0.0009716243791671959, 'batch_size': 1240, 'optimizer': 'Adam'}. Best is trial 21 with value: 0.07613841966675915.
2026-05-13 11:03:14,973 - optuna.study.study - INFO - Trial 24 finished with value: 0.028544627296299262 and parameters: {'n_layers': 1, 'embedding_dim': 32, 'lr': 0.0018448435410057563, 'lambda_val': 6.187929815582019e-05, 'batch_size': 2607, 'optimizer': 'Adam'}. Best is trial 21 with value: 0.07613841966675915.
2026-05-13 11:03:51,104 - optuna.study.study - INFO - Trial 25 finished with value: 0.07172260257682554 and parameters: {'n_layers': 1, 'embedding_dim': 256, 'lr': 0.0001450935386449947, 'lambda_val': 0.00040999600272126113, 'batch_size': 3207, 'optimizer': 'Adam'}. Best is trial 21 with value: 0.07613841966675915.
2026-05-13 11:03:56,411 - optuna.study._optimize - INFO - Trial 26 pruned. 
2026-05-13 11:04:01,025 - optuna.study._optimize - INFO - Trial 27 pruned. 
2026-05-13 11:04:06,224 - optuna.study._optimize - INFO - Trial 28 pruned. 
2026-05-13 11:04:10,571 - optuna.study._optimize - INFO - Trial 29 pruned. 
2026-05-13 11:04:14,890 - optuna.study._optimize - INFO - Trial 30 pruned. 
2026-05-13 11:04:44,151 - optuna.study.study - INFO - Trial 31 finished with value: 0.05613498933914953 and parameters: {'n_layers': 1, 'embedding_dim': 128, 'lr': 0.00047068887826667513, 'lambda_val': 0.0018090326793511744, 'batch_size': 1924, 'optimizer': 'Adam'}. Best is trial 21 with value: 0.07613841966675915.
2026-05-13 11:04:47,883 - optuna.study._optimize - INFO - Trial 32 pruned. 
2026-05-13 11:05:20,147 - optuna.study.study - INFO - Trial 33 finished with value: 0.04104742616108488 and parameters: {'n_layers': 1, 'embedding_dim': 128, 'lr': 0.00023082029358784435, 'lambda_val': 0.01565158606883651, 'batch_size': 3086, 'optimizer': 'Adam'}. Best is trial 21 with value: 0.07613841966675915.
2026-05-13 11:05:24,831 - optuna.study._optimize - INFO - Trial 34 pruned. 
2026-05-13 11:05:56,695 - optuna.study.study - INFO - Trial 35 finished with value: 0.02875791947171403 and parameters: {'n_layers': 2, 'embedding_dim': 96, 'lr': 0.0003366764104098683, 'lambda_val': 2.242972019296286e-06, 'batch_size': 1095, 'optimizer': 'Adam'}. Best is trial 21 with value: 0.07613841966675915.
2026-05-13 11:06:00,664 - optuna.study._optimize - INFO - Trial 36 pruned. 
2026-05-13 11:06:35,692 - optuna.study.study - INFO - Trial 37 finished with value: 0.0637067430844737 and parameters: {'n_layers': 1, 'embedding_dim': 256, 'lr': 0.0013195275423641033, 'lambda_val': 0.0005532161165642085, 'batch_size': 3479, 'optimizer': 'RMSprop'}. Best is trial 21 with value: 0.07613841966675915.
2026-05-13 11:06:39,928 - optuna.study._optimize - INFO - Trial 38 pruned. 
2026-05-13 11:06:44,168 - optuna.study._optimize - INFO - Trial 39 pruned. 
2026-05-13 11:06:48,534 - optuna.study._optimize - INFO - Trial 40 pruned. 
2026-05-13 11:07:22,265 - optuna.study.study - INFO - Trial 41 finished with value: 0.06976033603578226 and parameters: {'n_layers': 1, 'embedding_dim': 256, 'lr': 0.002599580798686546, 'lambda_val': 0.0004248919147833302, 'batch_size': 1796, 'optimizer': 'Adam'}. Best is trial 21 with value: 0.07613841966675915.
2026-05-13 11:07:56,295 - optuna.study.study - INFO - Trial 42 finished with value: 0.06371181262965445 and parameters: {'n_layers': 1, 'embedding_dim': 256, 'lr': 0.0028937061159148704, 'lambda_val': 0.00038254840908877796, 'batch_size': 1820, 'optimizer': 'Adam'}. Best is trial 21 with value: 0.07613841966675915.
2026-05-13 11:08:30,416 - optuna.study.study - INFO - Trial 43 finished with value: 0.05887741338407572 and parameters: {'n_layers': 1, 'embedding_dim': 256, 'lr': 0.001056644783760148, 'lambda_val': 7.769707006077784e-05, 'batch_size': 2005, 'optimizer': 'Adam'}. Best is trial 21 with value: 0.07613841966675915.
2026-05-13 11:09:05,529 - optuna.study.study - INFO - Trial 44 finished with value: 0.05925743972636765 and parameters: {'n_layers': 1, 'embedding_dim': 256, 'lr': 0.0006520846467075558, 'lambda_val': 0.0017088964924866928, 'batch_size': 2406, 'optimizer': 'Adam'}. Best is trial 21 with value: 0.07613841966675915.
2026-05-13 11:09:09,300 - optuna.study._optimize - INFO - Trial 45 pruned. 
2026-05-13 11:09:13,564 - optuna.study._optimize - INFO - Trial 46 pruned. 
2026-05-13 11:09:17,270 - optuna.study._optimize - INFO - Trial 47 pruned. 
2026-05-13 11:09:21,419 - optuna.study._optimize - INFO - Trial 48 pruned. 
2026-05-13 11:09:25,612 - optuna.study._optimize - INFO - Trial 49 pruned. 
2026-05-13 11:09:55,287 - optuna.study.study - INFO - Trial 50 finished with value: 0.06392649558119934 and parameters: {'n_layers': 1, 'embedding_dim': 128, 'lr': 0.002855104773068862, 'lambda_val': 0.0012402994888676344, 'batch_size': 1498, 'optimizer': 'Adam'}. Best is trial 21 with value: 0.07613841966675915.
2026-05-13 11:10:29,434 - optuna.study.study - INFO - Trial 51 finished with value: 0.0626606407001246 and parameters: {'n_layers': 1, 'embedding_dim': 256, 'lr': 0.0009381697544416331, 'lambda_val': 0.0008030993316589672, 'batch_size': 1738, 'optimizer': 'Adam'}. Best is trial 21 with value: 0.07613841966675915.
2026-05-13 11:10:33,747 - optuna.study._optimize - INFO - Trial 52 pruned. 
2026-05-13 11:11:07,654 - optuna.study.study - INFO - Trial 53 finished with value: 0.05374092284124831 and parameters: {'n_layers': 1, 'embedding_dim': 256, 'lr': 0.002201833728174488, 'lambda_val': 0.00011300624340048233, 'batch_size': 1366, 'optimizer': 'Adam'}. Best is trial 21 with value: 0.07613841966675915.
2026-05-13 11:11:12,237 - optuna.study._optimize - INFO - Trial 54 pruned. 
2026-05-13 11:11:46,166 - optuna.study.study - INFO - Trial 55 finished with value: 0.06122181223576746 and parameters: {'n_layers': 1, 'embedding_dim': 256, 'lr': 0.0003603985577047284, 'lambda_val': 0.00410031339022919, 'batch_size': 1612, 'optimizer': 'Adam'}. Best is trial 21 with value: 0.07613841966675915.
2026-05-13 11:11:50,512 - optuna.study._optimize - INFO - Trial 56 pruned. 
2026-05-13 11:11:57,325 - optuna.study._optimize - INFO - Trial 57 pruned. 
2026-05-13 11:12:32,756 - optuna.study.study - INFO - Trial 58 finished with value: 0.062228460698470815 and parameters: {'n_layers': 1, 'embedding_dim': 256, 'lr': 0.001475665144492209, 'lambda_val': 0.0005610211945295672, 'batch_size': 2704, 'optimizer': 'Adam'}. Best is trial 21 with value: 0.07613841966675915.
2026-05-13 11:13:03,454 - optuna.study.study - INFO - Trial 59 finished with value: 0.026400913649859133 and parameters: {'n_layers': 2, 'embedding_dim': 64, 'lr': 0.0008920138559394992, 'lambda_val': 0.002148314528133851, 'batch_size': 1101, 'optimizer': 'Adam'}. Best is trial 21 with value: 0.07613841966675915.
2026-05-13 11:13:07,258 - optuna.study._optimize - INFO - Trial 60 pruned. 
