2026-05-13 19:36:55,784 - optuna.study._optimize - INFO - Trial 183 pruned. 
2026-05-13 19:36:59,646 - optuna.study._optimize - INFO - Trial 184 pruned. 
2026-05-13 19:37:28,833 - optuna.study.study - INFO - Trial 185 finished with value: 0.1308058771240408 and parameters: {'n_layers': 1, 'embedding_dim': 128, 'lr': 0.00017545418190767443, 'lambda_val': 5.1759538143469824e-06, 'batch_size': 912, 'optimizer': 'RMSprop'}. Best is trial 185 with value: 0.1308058771240408.
2026-05-13 19:37:32,899 - optuna.study._optimize - INFO - Trial 186 pruned. 
2026-05-13 19:37:36,375 - optuna.study._optimize - INFO - Trial 187 pruned. 
2026-05-13 19:37:40,248 - optuna.study._optimize - INFO - Trial 188 pruned. 
2026-05-13 19:38:09,821 - optuna.study.study - INFO - Trial 189 finished with value: 0.08920762184834978 and parameters: {'n_layers': 1, 'embedding_dim': 128, 'lr': 0.00028681725184856655, 'lambda_val': 8.944190710236888e-06, 'batch_size': 585, 'optimizer': 'RMSprop'}. Best is trial 185 with value: 0.1308058771240408.
2026-05-13 19:38:13,484 - optuna.study._optimize - INFO - Trial 190 pruned. 
2026-05-13 19:38:40,200 - optuna.study.study - INFO - Trial 191 finished with value: 0.09679540788512758 and parameters: {'n_layers': 1, 'embedding_dim': 128, 'lr': 0.00021789962912756525, 'lambda_val': 1.5554413565519247e-05, 'batch_size': 895, 'optimizer': 'RMSprop'}. Best is trial 185 with value: 0.1308058771240408.
2026-05-13 19:38:44,160 - optuna.study._optimize - INFO - Trial 192 pruned. 
2026-05-13 19:39:12,892 - optuna.study.study - INFO - Trial 193 finished with value: 0.07047195573441559 and parameters: {'n_layers': 1, 'embedding_dim': 128, 'lr': 0.00033950399749423365, 'lambda_val': 8.034472156666192e-06, 'batch_size': 799, 'optimizer': 'RMSprop'}. Best is trial 185 with value: 0.1308058771240408.
2026-05-13 19:39:42,456 - optuna.study.study - INFO - Trial 194 finished with value: 0.09183680244816268 and parameters: {'n_layers': 1, 'embedding_dim': 128, 'lr': 0.000225923382022684, 'lambda_val': 3.3945955732985452e-06, 'batch_size': 1127, 'optimizer': 'RMSprop'}. Best is trial 185 with value: 0.1308058771240408.
2026-05-13 19:39:46,598 - optuna.study._optimize - INFO - Trial 195 pruned. 
2026-05-13 19:40:16,838 - optuna.study.study - INFO - Trial 196 finished with value: 0.09724773368775856 and parameters: {'n_layers': 1, 'embedding_dim': 128, 'lr': 0.00026057292767824643, 'lambda_val': 2.9672295121258862e-05, 'batch_size': 736, 'optimizer': 'RMSprop'}. Best is trial 185 with value: 0.1308058771240408.
2026-05-13 19:40:46,196 - optuna.study.study - INFO - Trial 197 finished with value: 0.12183471715255194 and parameters: {'n_layers': 1, 'embedding_dim': 128, 'lr': 0.00020000536527079487, 'lambda_val': 1.712450305017283e-05, 'batch_size': 645, 'optimizer': 'RMSprop'}. Best is trial 185 with value: 0.1308058771240408.
2026-05-13 19:41:15,705 - optuna.study.study - INFO - Trial 198 finished with value: 0.14004818528767723 and parameters: {'n_layers': 1, 'embedding_dim': 128, 'lr': 0.00018033497842104239, 'lambda_val': 5.1621450234575075e-06, 'batch_size': 567, 'optimizer': 'RMSprop'}. Best is trial 198 with value: 0.14004818528767723.
2026-05-13 19:41:19,830 - optuna.study._optimize - INFO - Trial 199 pruned. 
2026-05-13 19:41:42,272 - root - INFO - **** Training e_100K_1c3dcs
2026-05-13 19:41:42,272 - root - INFO -   ** 3-Dominant stats:
2026-05-13 19:41:42,272 - root - INFO -   ** Finding the dominant set:
2026-05-13 19:42:02,340 - root - INFO -   ** Getting the trainable edges:
2026-05-13 19:42:02,344 - helper_functions - INFO -      Number of nodes: 4883
2026-05-13 19:42:02,344 - helper_functions - INFO -      Ratio: 0.5389029908398631
2026-05-13 19:42:02,344 - helper_functions - INFO -      Number of unique users: 343
2026-05-13 19:42:02,344 - helper_functions - INFO -      Number of unique items: 4540
2026-05-13 19:42:02,344 - helper_functions - INFO -      Total dominant set edge: 15830
2026-05-13 19:42:02,344 - helper_functions - INFO -      Trainable edges: 12664.0
2026-05-13 19:42:02,348 - root - INFO -   **** Getting 15830 dominant set edges
2026-05-13 19:42:02,456 - optuna.storages._rdb.storage - INFO - A new study created in RDB with name: Study_e_100K_1c3dcs_strict
2026-05-13 19:42:48,343 - optuna.study.study - INFO - Trial 0 finished with value: 0.008331288677623802 and parameters: {'n_layers': 2, 'embedding_dim': 256, 'lr': 1.3172245026337853e-05, 'lambda_val': 8.215807283606743e-05, 'batch_size': 3130, 'optimizer': 'RMSprop'}. Best is trial 0 with value: 0.008331288677623802.
2026-05-13 19:43:27,655 - optuna.study.study - INFO - Trial 1 finished with value: 0.0025450653202086643 and parameters: {'n_layers': 4, 'embedding_dim': 32, 'lr': 0.0009907398285668996, 'lambda_val': 0.0001612844091772522, 'batch_size': 3323, 'optimizer': 'SGD'}. Best is trial 0 with value: 0.008331288677623802.
2026-05-13 19:43:59,292 - optuna.study.study - INFO - Trial 2 finished with value: 0.0004489391271544418 and parameters: {'n_layers': 4, 'embedding_dim': 96, 'lr': 0.0008903110085101419, 'lambda_val': 9.397874444497802e-06, 'batch_size': 3247, 'optimizer': 'Adam'}. Best is trial 0 with value: 0.008331288677623802.
2026-05-13 19:44:23,766 - optuna.study.study - INFO - Trial 3 finished with value: 0.0013434418518376466 and parameters: {'n_layers': 1, 'embedding_dim': 64, 'lr': 0.0005379766598643088, 'lambda_val': 0.02461197652458126, 'batch_size': 1983, 'optimizer': 'SGD'}. Best is trial 0 with value: 0.008331288677623802.
2026-05-13 19:44:52,175 - optuna.study.study - INFO - Trial 4 finished with value: 0.001255422263627555 and parameters: {'n_layers': 1, 'embedding_dim': 128, 'lr': 6.432724494422365e-05, 'lambda_val': 2.761776429419131e-06, 'batch_size': 1881, 'optimizer': 'SGD'}. Best is trial 0 with value: 0.008331288677623802.
2026-05-13 19:45:40,988 - optuna.study.study - INFO - Trial 5 finished with value: 0.0068551064552843256 and parameters: {'n_layers': 4, 'embedding_dim': 256, 'lr': 0.026919850524908133, 'lambda_val': 3.2715851835540674e-06, 'batch_size': 3914, 'optimizer': 'Adam'}. Best is trial 0 with value: 0.008331288677623802.
2026-05-13 19:46:15,192 - optuna.study.study - INFO - Trial 6 finished with value: 0.00879197828240662 and parameters: {'n_layers': 1, 'embedding_dim': 256, 'lr': 0.0003660830829583697, 'lambda_val': 9.577438489641718e-06, 'batch_size': 3799, 'optimizer': 'Adam'}. Best is trial 6 with value: 0.00879197828240662.
2026-05-13 19:46:52,899 - optuna.study.study - INFO - Trial 7 finished with value: 0.002966597605544057 and parameters: {'n_layers': 4, 'embedding_dim': 128, 'lr': 8.44583163470115e-05, 'lambda_val': 0.00039829656950315695, 'batch_size': 3968, 'optimizer': 'SGD'}. Best is trial 6 with value: 0.00879197828240662.
2026-05-13 19:47:20,132 - optuna.study.study - INFO - Trial 8 finished with value: 0.009660009275546983 and parameters: {'n_layers': 1, 'embedding_dim': 128, 'lr': 0.010652653379879348, 'lambda_val': 1.1428862849766457e-05, 'batch_size': 625, 'optimizer': 'RMSprop'}. Best is trial 8 with value: 0.009660009275546983.
2026-05-13 19:47:58,293 - optuna.study.study - INFO - Trial 9 finished with value: 0.020461809987605474 and parameters: {'n_layers': 3, 'embedding_dim': 256, 'lr': 2.1336188921546406e-05, 'lambda_val': 3.0703912524347167e-06, 'batch_size': 1992, 'optimizer': 'RMSprop'}. Best is trial 9 with value: 0.020461809987605474.
2026-05-13 19:48:01,999 - optuna.study._optimize - INFO - Trial 10 pruned. 
2026-05-13 19:48:36,741 - optuna.study.study - INFO - Trial 11 finished with value: 0.00846076587883842 and parameters: {'n_layers': 2, 'embedding_dim': 128, 'lr': 0.011977340057449383, 'lambda_val': 3.1064414441441905e-05, 'batch_size': 546, 'optimizer': 'RMSprop'}. Best is trial 9 with value: 0.020461809987605474.
2026-05-13 19:49:09,489 - optuna.study.study - INFO - Trial 12 finished with value: 0.006470384359529392 and parameters: {'n_layers': 3, 'embedding_dim': 96, 'lr': 0.00768966749515591, 'lambda_val': 1.0190666882119782e-06, 'batch_size': 1291, 'optimizer': 'RMSprop'}. Best is trial 9 with value: 0.020461809987605474.
2026-05-13 19:49:37,976 - optuna.study.study - INFO - Trial 13 finished with value: 0.001920623922703927 and parameters: {'n_layers': 2, 'embedding_dim': 64, 'lr': 0.09432157185130544, 'lambda_val': 0.0009381839179831791, 'batch_size': 2517, 'optimizer': 'RMSprop'}. Best is trial 9 with value: 0.020461809987605474.
2026-05-13 19:49:59,076 - optuna.study._optimize - INFO - Trial 14 pruned. 
2026-05-13 19:50:27,122 - optuna.study.study - INFO - Trial 15 finished with value: 0.005518286254459516 and parameters: {'n_layers': 2, 'embedding_dim': 128, 'lr': 0.0030620221722439593, 'lambda_val': 1.5407293365213056e-06, 'batch_size': 1363, 'optimizer': 'RMSprop'}. Best is trial 9 with value: 0.020461809987605474.
2026-05-13 19:51:02,218 - optuna.study.study - INFO - Trial 16 finished with value: 0.004261634562922568 and parameters: {'n_layers': 3, 'embedding_dim': 128, 'lr': 0.00011810782303441334, 'lambda_val': 9.722592769465596e-06, 'batch_size': 2619, 'optimizer': 'RMSprop'}. Best is trial 9 with value: 0.020461809987605474.
2026-05-13 19:51:34,168 - optuna.study.study - INFO - Trial 17 finished with value: 0.007465279412079796 and parameters: {'n_layers': 1, 'embedding_dim': 256, 'lr': 0.031856520608906036, 'lambda_val': 3.1838821084556014e-05, 'batch_size': 1836, 'optimizer': 'RMSprop'}. Best is trial 9 with value: 0.020461809987605474.
2026-05-13 19:51:37,819 - optuna.study._optimize - INFO - Trial 18 pruned. 
2026-05-13 19:51:46,966 - optuna.study._optimize - INFO - Trial 19 pruned. 
2026-05-13 19:52:13,258 - optuna.study.study - INFO - Trial 20 finished with value: 0.0033281731264982036 and parameters: {'n_layers': 1, 'embedding_dim': 32, 'lr': 0.000300363205862707, 'lambda_val': 0.07522521245479928, 'batch_size': 2800, 'optimizer': 'RMSprop'}. Best is trial 9 with value: 0.020461809987605474.
2026-05-13 19:52:50,233 - optuna.study.study - INFO - Trial 21 finished with value: 0.008901194655718044 and parameters: {'n_layers': 1, 'embedding_dim': 256, 'lr': 0.00031096234173375465, 'lambda_val': 1.4469756143980324e-05, 'batch_size': 3672, 'optimizer': 'Adam'}. Best is trial 9 with value: 0.020461809987605474.
2026-05-13 19:52:53,871 - optuna.study._optimize - INFO - Trial 22 pruned. 
2026-05-13 19:53:30,559 - optuna.study.study - INFO - Trial 23 finished with value: 0.005769941217133353 and parameters: {'n_layers': 2, 'embedding_dim': 256, 'lr': 0.00013465009296946678, 'lambda_val': 1.736195130068108e-05, 'batch_size': 3504, 'optimizer': 'Adam'}. Best is trial 9 with value: 0.020461809987605474.
2026-05-13 19:53:34,986 - optuna.study._optimize - INFO - Trial 24 pruned. 
2026-05-13 19:54:05,265 - optuna.study.study - INFO - Trial 25 finished with value: 0.006217056663397913 and parameters: {'n_layers': 2, 'embedding_dim': 128, 'lr': 0.00018798940638582468, 'lambda_val': 0.00034310998414503405, 'batch_size': 2334, 'optimizer': 'Adam'}. Best is trial 9 with value: 0.020461809987605474.
2026-05-13 19:54:11,003 - optuna.study._optimize - INFO - Trial 26 pruned. 
2026-05-13 19:54:39,787 - optuna.study.study - INFO - Trial 27 finished with value: 0.012372331190790781 and parameters: {'n_layers': 1, 'embedding_dim': 256, 'lr': 0.00586270709978782, 'lambda_val': 0.0014313660681541, 'batch_size': 1583, 'optimizer': 'RMSprop'}. Best is trial 9 with value: 0.020461809987605474.
2026-05-13 19:54:43,305 - optuna.study._optimize - INFO - Trial 28 pruned. 
2026-05-13 19:55:10,559 - optuna.study.study - INFO - Trial 29 finished with value: 0.009791011727844126 and parameters: {'n_layers': 1, 'embedding_dim': 256, 'lr': 0.017988235288889567, 'lambda_val': 0.0066550745524396925, 'batch_size': 1710, 'optimizer': 'RMSprop'}. Best is trial 9 with value: 0.020461809987605474.
2026-05-13 19:55:16,512 - optuna.study._optimize - INFO - Trial 30 pruned. 
2026-05-13 19:55:44,803 - optuna.study.study - INFO - Trial 31 finished with value: 0.008460130138178824 and parameters: {'n_layers': 1, 'embedding_dim': 256, 'lr': 0.015063515999180831, 'lambda_val': 0.008665544341189435, 'batch_size': 2184, 'optimizer': 'RMSprop'}. Best is trial 9 with value: 0.020461809987605474.
2026-05-13 19:55:48,944 - optuna.study._optimize - INFO - Trial 32 pruned. 
2026-05-13 19:56:18,417 - optuna.study.study - INFO - Trial 33 finished with value: 0.013331454134824814 and parameters: {'n_layers': 1, 'embedding_dim': 256, 'lr': 0.006595024621547881, 'lambda_val': 0.0006102531314109243, 'batch_size': 1747, 'optimizer': 'RMSprop'}. Best is trial 9 with value: 0.020461809987605474.
2026-05-13 19:56:22,256 - optuna.study._optimize - INFO - Trial 34 pruned. 
2026-05-13 19:56:52,375 - optuna.study.study - INFO - Trial 35 finished with value: 0.011103449598836105 and parameters: {'n_layers': 1, 'embedding_dim': 256, 'lr': 0.00124697942454347, 'lambda_val': 0.0006842190878920497, 'batch_size': 2019, 'optimizer': 'RMSprop'}. Best is trial 9 with value: 0.020461809987605474.
2026-05-13 19:57:26,605 - optuna.study.study - INFO - Trial 36 finished with value: 0.00035599602078195414 and parameters: {'n_layers': 4, 'embedding_dim': 32, 'lr': 0.0011930525801273557, 'lambda_val': 0.0006035247523085525, 'batch_size': 2024, 'optimizer': 'RMSprop'}. Best is trial 9 with value: 0.020461809987605474.
2026-05-13 19:57:30,964 - optuna.study._optimize - INFO - Trial 37 pruned. 
2026-05-13 19:57:35,041 - optuna.study._optimize - INFO - Trial 38 pruned. 
2026-05-13 19:57:38,719 - optuna.study._optimize - INFO - Trial 39 pruned. 
2026-05-13 19:57:45,046 - optuna.study._optimize - INFO - Trial 40 pruned. 
2026-05-13 19:58:15,421 - optuna.study.study - INFO - Trial 41 finished with value: 0.008653900695695896 and parameters: {'n_layers': 1, 'embedding_dim': 256, 'lr': 0.022029375076108294, 'lambda_val': 0.005152695056337324, 'batch_size': 1648, 'optimizer': 'RMSprop'}. Best is trial 9 with value: 0.020461809987605474.
2026-05-13 19:58:45,506 - optuna.study.study - INFO - Trial 42 finished with value: 0.011735415980052654 and parameters: {'n_layers': 1, 'embedding_dim': 256, 'lr': 0.0514462299986641, 'lambda_val': 0.0017768328072314276, 'batch_size': 2174, 'optimizer': 'RMSprop'}. Best is trial 9 with value: 0.020461809987605474.
2026-05-13 19:58:49,344 - optuna.study._optimize - INFO - Trial 43 pruned. 
2026-05-13 19:59:21,369 - optuna.study.study - INFO - Trial 44 finished with value: 0.01046558017757782 and parameters: {'n_layers': 1, 'embedding_dim': 256, 'lr': 0.04895566716482822, 'lambda_val': 0.001842579320770429, 'batch_size': 2523, 'optimizer': 'RMSprop'}. Best is trial 9 with value: 0.020461809987605474.
2026-05-13 19:59:51,954 - optuna.study.study - INFO - Trial 45 finished with value: 0.009667693798505997 and parameters: {'n_layers': 1, 'embedding_dim': 256, 'lr': 0.0008049691933764566, 'lambda_val': 0.003256951881269969, 'batch_size': 1921, 'optimizer': 'RMSprop'}. Best is trial 9 with value: 0.020461809987605474.
2026-05-13 20:00:02,663 - optuna.study._optimize - INFO - Trial 46 pruned. 
2026-05-13 20:00:34,890 - optuna.study.study - INFO - Trial 47 finished with value: 0.011728168279358492 and parameters: {'n_layers': 1, 'embedding_dim': 256, 'lr': 0.005615518318675206, 'lambda_val': 0.00024922127241010445, 'batch_size': 2197, 'optimizer': 'RMSprop'}. Best is trial 9 with value: 0.020461809987605474.
2026-05-13 20:00:43,819 - optuna.study._optimize - INFO - Trial 48 pruned. 
2026-05-13 20:01:12,655 - optuna.study.study - INFO - Trial 49 finished with value: 0.011634627030128453 and parameters: {'n_layers': 1, 'embedding_dim': 96, 'lr': 0.013941885660106715, 'lambda_val': 0.0003255940662962136, 'batch_size': 3024, 'optimizer': 'RMSprop'}. Best is trial 9 with value: 0.020461809987605474.
2026-05-13 20:01:17,412 - optuna.study._optimize - INFO - Trial 50 pruned. 
2026-05-13 20:01:45,181 - optuna.study.study - INFO - Trial 51 finished with value: 0.011104257814490145 and parameters: {'n_layers': 1, 'embedding_dim': 96, 'lr': 0.0101916993530622, 'lambda_val': 0.0002630504630129646, 'batch_size': 2948, 'optimizer': 'RMSprop'}. Best is trial 9 with value: 0.020461809987605474.
2026-05-13 20:02:14,278 - optuna.study.study - INFO - Trial 52 finished with value: 0.010586649466272646 and parameters: {'n_layers': 1, 'embedding_dim': 96, 'lr': 0.014902839177078738, 'lambda_val': 0.00010493506159596468, 'batch_size': 3090, 'optimizer': 'RMSprop'}. Best is trial 9 with value: 0.020461809987605474.
2026-05-13 20:02:43,385 - optuna.study.study - INFO - Trial 53 finished with value: 0.013340750813019274 and parameters: {'n_layers': 1, 'embedding_dim': 96, 'lr': 0.0037622144570391637, 'lambda_val': 0.0003596984949727265, 'batch_size': 2705, 'optimizer': 'RMSprop'}. Best is trial 9 with value: 0.020461809987605474.
2026-05-13 20:03:11,958 - optuna.study.study - INFO - Trial 54 finished with value: 0.009808619283292084 and parameters: {'n_layers': 1, 'embedding_dim': 96, 'lr': 0.00320169130666964, 'lambda_val': 0.0029998144316045767, 'batch_size': 2476, 'optimizer': 'RMSprop'}. Best is trial 9 with value: 0.020461809987605474.
2026-05-13 20:03:17,230 - optuna.study._optimize - INFO - Trial 55 pruned. 
2026-05-13 20:03:45,536 - optuna.study.study - INFO - Trial 56 finished with value: 0.011959678534201993 and parameters: {'n_layers': 1, 'embedding_dim': 96, 'lr': 0.0025893658256224395, 'lambda_val': 6.416991987798448e-05, 'batch_size': 2630, 'optimizer': 'RMSprop'}. Best is trial 9 with value: 0.020461809987605474.
2026-05-13 20:03:49,929 - optuna.study._optimize - INFO - Trial 57 pruned. 
2026-05-13 20:04:18,495 - optuna.study.study - INFO - Trial 58 finished with value: 0.03164714554410689 and parameters: {'n_layers': 1, 'embedding_dim': 96, 'lr': 6.391966519684145e-05, 'lambda_val': 4.944038720777318e-06, 'batch_size': 3282, 'optimizer': 'RMSprop'}. Best is trial 58 with value: 0.03164714554410689.
2026-05-13 20:04:22,232 - optuna.study._optimize - INFO - Trial 59 pruned. 
2026-05-13 20:04:26,801 - optuna.study._optimize - INFO - Trial 60 pruned. 
2026-05-13 20:04:31,016 - optuna.study._optimize - INFO - Trial 61 pruned. 
2026-05-13 20:04:34,799 - optuna.study._optimize - INFO - Trial 62 pruned. 
2026-05-13 20:05:00,977 - optuna.study.study - INFO - Trial 63 finished with value: 0.009880997219656636 and parameters: {'n_layers': 1, 'embedding_dim': 96, 'lr': 0.0029677728209373333, 'lambda_val': 2.8667520479592665e-06, 'batch_size': 2608, 'optimizer': 'RMSprop'}. Best is trial 58 with value: 0.03164714554410689.
2026-05-13 20:05:05,272 - optuna.study._optimize - INFO - Trial 64 pruned. 
2026-05-13 20:05:09,923 - optuna.study._optimize - INFO - Trial 65 pruned. 
2026-05-13 20:05:13,917 - optuna.study._optimize - INFO - Trial 66 pruned. 
2026-05-13 20:05:17,679 - optuna.study._optimize - INFO - Trial 67 pruned. 
2026-05-13 20:05:43,879 - optuna.study.study - INFO - Trial 68 finished with value: 0.011747038188561707 and parameters: {'n_layers': 1, 'embedding_dim': 128, 'lr': 0.0017513073940818426, 'lambda_val': 0.00077664239158103, 'batch_size': 1535, 'optimizer': 'RMSprop'}. Best is trial 58 with value: 0.03164714554410689.
2026-05-13 20:06:10,706 - optuna.study.study - INFO - Trial 69 finished with value: 0.009473217354362639 and parameters: {'n_layers': 1, 'embedding_dim': 128, 'lr': 0.0004539509826228096, 'lambda_val': 0.0007520130116381423, 'batch_size': 1358, 'optimizer': 'RMSprop'}. Best is trial 58 with value: 0.03164714554410689.
2026-05-13 20:06:37,910 - optuna.study.study - INFO - Trial 70 finished with value: 0.008998822368215061 and parameters: {'n_layers': 1, 'embedding_dim': 128, 'lr': 0.0015096289041913013, 'lambda_val': 1.567910057658493e-05, 'batch_size': 1616, 'optimizer': 'RMSprop'}. Best is trial 58 with value: 0.03164714554410689.
2026-05-13 20:07:03,990 - optuna.study.study - INFO - Trial 71 finished with value: 0.005385948742394058 and parameters: {'n_layers': 1, 'embedding_dim': 128, 'lr': 0.00021903466574305297, 'lambda_val': 0.001313991527493117, 'batch_size': 1562, 'optimizer': 'RMSprop'}. Best is trial 58 with value: 0.03164714554410689.
2026-05-13 20:07:30,386 - optuna.study.study - INFO - Trial 72 finished with value: 0.012232839797534749 and parameters: {'n_layers': 1, 'embedding_dim': 128, 'lr': 0.007422830966488679, 'lambda_val': 0.0014560805630776039, 'batch_size': 1942, 'optimizer': 'RMSprop'}. Best is trial 58 with value: 0.03164714554410689.
2026-05-13 20:07:57,348 - optuna.study.study - INFO - Trial 73 finished with value: 0.013677985259876804 and parameters: {'n_layers': 1, 'embedding_dim': 128, 'lr': 0.006897637348417759, 'lambda_val': 0.0004730419686555259, 'batch_size': 1911, 'optimizer': 'RMSprop'}. Best is trial 58 with value: 0.03164714554410689.
2026-05-13 20:08:24,207 - optuna.study.study - INFO - Trial 74 finished with value: 0.011166651371579605 and parameters: {'n_layers': 1, 'embedding_dim': 128, 'lr': 0.007446912256258272, 'lambda_val': 0.00017063216354831155, 'batch_size': 1920, 'optimizer': 'RMSprop'}. Best is trial 58 with value: 0.03164714554410689.
2026-05-13 20:08:52,424 - optuna.study.study - INFO - Trial 75 finished with value: 0.010683558056409232 and parameters: {'n_layers': 1, 'embedding_dim': 128, 'lr': 0.003687736938014792, 'lambda_val': 2.0466675959451373e-06, 'batch_size': 3316, 'optimizer': 'RMSprop'}. Best is trial 58 with value: 0.03164714554410689.
2026-05-13 20:08:57,290 - optuna.study._optimize - INFO - Trial 76 pruned. 
2026-05-13 20:09:21,957 - optuna.study.study - INFO - Trial 77 finished with value: 0.010127327906288855 and parameters: {'n_layers': 1, 'embedding_dim': 128, 'lr': 0.011917049602176459, 'lambda_val': 1.011365010455202e-06, 'batch_size': 1721, 'optimizer': 'RMSprop'}. Best is trial 58 with value: 0.03164714554410689.
2026-05-13 20:09:26,037 - optuna.study._optimize - INFO - Trial 78 pruned. 
