2026-05-13 18:23:12,737 - optuna.study._optimize - INFO - Trial 189 pruned. 
2026-05-13 18:23:17,631 - optuna.study._optimize - INFO - Trial 190 pruned. 
2026-05-13 18:23:21,973 - optuna.study._optimize - INFO - Trial 191 pruned. 
2026-05-13 18:23:26,336 - optuna.study._optimize - INFO - Trial 192 pruned. 
2026-05-13 18:24:00,810 - optuna.study.study - INFO - Trial 193 finished with value: 0.07192188960036143 and parameters: {'n_layers': 1, 'embedding_dim': 256, 'lr': 0.00020849276815617602, 'lambda_val': 0.0005123162793215542, 'batch_size': 1790, 'optimizer': 'Adam'}. Best is trial 77 with value: 0.10185378846839062.
2026-05-13 18:24:05,128 - optuna.study._optimize - INFO - Trial 194 pruned. 
2026-05-13 18:24:09,316 - optuna.study._optimize - INFO - Trial 195 pruned. 
2026-05-13 18:24:43,159 - optuna.study.study - INFO - Trial 196 finished with value: 0.07712752527318283 and parameters: {'n_layers': 1, 'embedding_dim': 256, 'lr': 0.00027008090505406264, 'lambda_val': 3.1536342838856884e-05, 'batch_size': 2337, 'optimizer': 'Adam'}. Best is trial 77 with value: 0.10185378846839062.
2026-05-13 18:24:47,576 - optuna.study._optimize - INFO - Trial 197 pruned. 
2026-05-13 18:24:52,040 - optuna.study._optimize - INFO - Trial 198 pruned. 
2026-05-13 18:24:55,844 - optuna.study._optimize - INFO - Trial 199 pruned. 
2026-05-13 18:25:22,406 - root - INFO -   **** Training e_100K_1c2dcs_rand5
2026-05-13 18:25:22,417 - root - INFO -   **** Getting 54402/65410 random edges
2026-05-13 18:25:23,449 - optuna.storages._rdb.storage - INFO - A new study created in RDB with name: Study_e_100K_1c2dcs_rand5
2026-05-13 18:26:06,476 - optuna.study.study - INFO - Trial 0 finished with value: 0.003467185032192942 and parameters: {'n_layers': 4, 'embedding_dim': 64, 'lr': 2.4180842814800178e-05, 'lambda_val': 9.635877321977553e-06, 'batch_size': 1393, 'optimizer': 'SGD'}. Best is trial 0 with value: 0.003467185032192942.
2026-05-13 18:27:06,408 - optuna.study.study - INFO - Trial 1 finished with value: 0.03916296031655962 and parameters: {'n_layers': 3, 'embedding_dim': 256, 'lr': 0.09517187189672988, 'lambda_val': 0.0004359895860039594, 'batch_size': 3217, 'optimizer': 'Adam'}. Best is trial 1 with value: 0.03916296031655962.
2026-05-13 18:28:06,690 - optuna.study.study - INFO - Trial 2 finished with value: 0.016919626096487343 and parameters: {'n_layers': 4, 'embedding_dim': 256, 'lr': 0.0004621278649620568, 'lambda_val': 0.0024180136920443165, 'batch_size': 3468, 'optimizer': 'RMSprop'}. Best is trial 1 with value: 0.03916296031655962.
2026-05-13 18:28:39,933 - optuna.study.study - INFO - Trial 3 finished with value: 0.03329019013437323 and parameters: {'n_layers': 2, 'embedding_dim': 64, 'lr': 0.0001247531648422175, 'lambda_val': 1.5126538840996618e-06, 'batch_size': 2329, 'optimizer': 'Adam'}. Best is trial 1 with value: 0.03916296031655962.
2026-05-13 18:29:14,731 - optuna.study.study - INFO - Trial 4 finished with value: 0.01602435733966496 and parameters: {'n_layers': 4, 'embedding_dim': 32, 'lr': 0.0016837580798948245, 'lambda_val': 0.005736666111552579, 'batch_size': 544, 'optimizer': 'Adam'}. Best is trial 1 with value: 0.03916296031655962.
2026-05-13 18:29:19,735 - optuna.study._optimize - INFO - Trial 5 pruned. 
2026-05-13 18:29:48,532 - optuna.study.study - INFO - Trial 6 finished with value: 0.03167269506031032 and parameters: {'n_layers': 2, 'embedding_dim': 64, 'lr': 0.00031697718828524875, 'lambda_val': 6.353561235150603e-05, 'batch_size': 1536, 'optimizer': 'Adam'}. Best is trial 1 with value: 0.03916296031655962.
2026-05-13 18:30:07,661 - optuna.study._optimize - INFO - Trial 7 pruned. 
2026-05-13 18:30:46,891 - optuna.study.study - INFO - Trial 8 finished with value: 0.027647648033202295 and parameters: {'n_layers': 4, 'embedding_dim': 64, 'lr': 0.010104055407276182, 'lambda_val': 1.626363532457874e-05, 'batch_size': 2497, 'optimizer': 'RMSprop'}. Best is trial 1 with value: 0.03916296031655962.
2026-05-13 18:30:52,359 - optuna.study._optimize - INFO - Trial 9 pruned. 
2026-05-13 18:30:56,604 - optuna.study._optimize - INFO - Trial 10 pruned. 
2026-05-13 18:31:01,819 - optuna.study._optimize - INFO - Trial 11 pruned. 
2026-05-13 18:31:09,816 - optuna.study._optimize - INFO - Trial 12 pruned. 
2026-05-13 18:31:41,920 - optuna.study.study - INFO - Trial 13 finished with value: 0.06668608850437034 and parameters: {'n_layers': 2, 'embedding_dim': 96, 'lr': 6.587812321740885e-05, 'lambda_val': 0.0006037890547076333, 'batch_size': 2044, 'optimizer': 'Adam'}. Best is trial 13 with value: 0.06668608850437034.
2026-05-13 18:31:46,517 - optuna.study._optimize - INFO - Trial 14 pruned. 
2026-05-13 18:32:17,131 - optuna.study.study - INFO - Trial 15 finished with value: 0.046761580074681605 and parameters: {'n_layers': 2, 'embedding_dim': 96, 'lr': 0.00923987375181417, 'lambda_val': 0.001659939759034277, 'batch_size': 1692, 'optimizer': 'Adam'}. Best is trial 13 with value: 0.06668608850437034.
2026-05-13 18:32:21,672 - optuna.study._optimize - INFO - Trial 16 pruned. 
2026-05-13 18:32:47,707 - optuna.study.study - INFO - Trial 17 finished with value: 0.0736652974018627 and parameters: {'n_layers': 1, 'embedding_dim': 96, 'lr': 0.016713030036334495, 'lambda_val': 0.002077756383262649, 'batch_size': 915, 'optimizer': 'Adam'}. Best is trial 17 with value: 0.0736652974018627.
2026-05-13 18:32:50,752 - optuna.study._optimize - INFO - Trial 18 pruned. 
2026-05-13 18:32:53,791 - optuna.study._optimize - INFO - Trial 19 pruned. 
2026-05-13 18:33:20,314 - optuna.study.study - INFO - Trial 20 finished with value: 0.06982542458084859 and parameters: {'n_layers': 1, 'embedding_dim': 96, 'lr': 0.027239428039516775, 'lambda_val': 0.0016430103289977137, 'batch_size': 554, 'optimizer': 'Adam'}. Best is trial 17 with value: 0.0736652974018627.
2026-05-13 18:33:25,881 - optuna.study._optimize - INFO - Trial 21 pruned. 
2026-05-13 18:33:53,865 - optuna.study.study - INFO - Trial 22 finished with value: 0.05141143702657231 and parameters: {'n_layers': 1, 'embedding_dim': 96, 'lr': 0.02541439982727344, 'lambda_val': 0.00784881563186742, 'batch_size': 894, 'optimizer': 'Adam'}. Best is trial 17 with value: 0.0736652974018627.
2026-05-13 18:34:21,376 - optuna.study.study - INFO - Trial 23 finished with value: 0.047746208741713696 and parameters: {'n_layers': 1, 'embedding_dim': 96, 'lr': 0.004488360751689174, 'lambda_val': 0.0001692840697496794, 'batch_size': 1277, 'optimizer': 'Adam'}. Best is trial 17 with value: 0.0736652974018627.
2026-05-13 18:34:27,542 - optuna.study._optimize - INFO - Trial 24 pruned. 
2026-05-13 18:34:56,799 - optuna.study.study - INFO - Trial 25 finished with value: 0.0774226612652942 and parameters: {'n_layers': 1, 'embedding_dim': 96, 'lr': 0.03245563903606558, 'lambda_val': 0.001044355058011212, 'batch_size': 1956, 'optimizer': 'Adam'}. Best is trial 25 with value: 0.0774226612652942.
2026-05-13 18:35:25,372 - optuna.study.study - INFO - Trial 26 finished with value: 0.059602559770500184 and parameters: {'n_layers': 1, 'embedding_dim': 32, 'lr': 0.03622253236506779, 'lambda_val': 0.00408937501562668, 'batch_size': 1003, 'optimizer': 'Adam'}. Best is trial 25 with value: 0.0774226612652942.
2026-05-13 18:35:29,259 - optuna.study._optimize - INFO - Trial 27 pruned. 
2026-05-13 18:35:33,147 - optuna.study._optimize - INFO - Trial 28 pruned. 
2026-05-13 18:36:01,722 - optuna.study.study - INFO - Trial 29 finished with value: 0.04743324020046716 and parameters: {'n_layers': 1, 'embedding_dim': 96, 'lr': 0.00828047677714356, 'lambda_val': 3.791968111744702e-05, 'batch_size': 1249, 'optimizer': 'RMSprop'}. Best is trial 25 with value: 0.0774226612652942.
2026-05-13 18:36:05,840 - optuna.study._optimize - INFO - Trial 30 pruned. 
2026-05-13 18:36:10,183 - optuna.study._optimize - INFO - Trial 31 pruned. 
2026-05-13 18:36:38,676 - optuna.study.study - INFO - Trial 32 finished with value: 0.07559026458187802 and parameters: {'n_layers': 1, 'embedding_dim': 96, 'lr': 0.018823782234340013, 'lambda_val': 0.0010512397533840384, 'batch_size': 2196, 'optimizer': 'Adam'}. Best is trial 25 with value: 0.0774226612652942.
2026-05-13 18:37:12,127 - optuna.study.study - INFO - Trial 33 finished with value: 0.0779423085315916 and parameters: {'n_layers': 1, 'embedding_dim': 96, 'lr': 0.017550765531922342, 'lambda_val': 0.0011090704052061776, 'batch_size': 1680, 'optimizer': 'Adam'}. Best is trial 33 with value: 0.0779423085315916.
2026-05-13 18:37:41,005 - optuna.study.study - INFO - Trial 34 finished with value: 0.05556589637925716 and parameters: {'n_layers': 1, 'embedding_dim': 64, 'lr': 0.013594954887012642, 'lambda_val': 0.00029133184600457567, 'batch_size': 2283, 'optimizer': 'Adam'}. Best is trial 33 with value: 0.0779423085315916.
2026-05-13 18:38:15,506 - optuna.study.study - INFO - Trial 35 finished with value: 0.07725534304822075 and parameters: {'n_layers': 1, 'embedding_dim': 256, 'lr': 0.006193301297609676, 'lambda_val': 0.0039771011998343715, 'batch_size': 1720, 'optimizer': 'Adam'}. Best is trial 33 with value: 0.0779423085315916.
2026-05-13 18:38:50,328 - optuna.study.study - INFO - Trial 36 finished with value: 0.07501868615364683 and parameters: {'n_layers': 1, 'embedding_dim': 256, 'lr': 0.00220810479660592, 'lambda_val': 0.004167379401520089, 'batch_size': 1677, 'optimizer': 'Adam'}. Best is trial 33 with value: 0.0779423085315916.
2026-05-13 18:39:26,366 - optuna.study.study - INFO - Trial 37 finished with value: 0.06343309466599072 and parameters: {'n_layers': 1, 'embedding_dim': 256, 'lr': 0.006510016122469537, 'lambda_val': 0.0003166872899276651, 'batch_size': 2384, 'optimizer': 'Adam'}. Best is trial 33 with value: 0.0779423085315916.
2026-05-13 18:39:32,954 - optuna.study._optimize - INFO - Trial 38 pruned. 
2026-05-13 18:39:37,417 - optuna.study._optimize - INFO - Trial 39 pruned. 
2026-05-13 18:39:44,858 - optuna.study._optimize - INFO - Trial 40 pruned. 
2026-05-13 18:40:19,908 - optuna.study.study - INFO - Trial 41 finished with value: 0.06665783583377048 and parameters: {'n_layers': 1, 'embedding_dim': 256, 'lr': 0.001132319188934876, 'lambda_val': 0.004647063230291435, 'batch_size': 1617, 'optimizer': 'Adam'}. Best is trial 33 with value: 0.0779423085315916.
2026-05-13 18:40:55,525 - optuna.study.study - INFO - Trial 42 finished with value: 0.08232190069644964 and parameters: {'n_layers': 1, 'embedding_dim': 256, 'lr': 0.002906408845818375, 'lambda_val': 0.0011366789404906312, 'batch_size': 1856, 'optimizer': 'Adam'}. Best is trial 42 with value: 0.08232190069644964.
2026-05-13 18:41:27,109 - optuna.study.study - INFO - Trial 43 finished with value: 0.07247118625231641 and parameters: {'n_layers': 1, 'embedding_dim': 256, 'lr': 0.0026332862562916557, 'lambda_val': 0.0009437743025763236, 'batch_size': 2190, 'optimizer': 'Adam'}. Best is trial 42 with value: 0.08232190069644964.
2026-05-13 18:42:00,022 - optuna.study.study - INFO - Trial 44 finished with value: 0.06309623392815825 and parameters: {'n_layers': 1, 'embedding_dim': 256, 'lr': 0.002920945535655629, 'lambda_val': 0.0004597759426772192, 'batch_size': 1835, 'optimizer': 'Adam'}. Best is trial 42 with value: 0.08232190069644964.
2026-05-13 18:42:25,929 - optuna.study.study - INFO - Trial 45 finished with value: 0.0754754913568505 and parameters: {'n_layers': 1, 'embedding_dim': 64, 'lr': 0.011015804360164872, 'lambda_val': 0.00286846039138399, 'batch_size': 2796, 'optimizer': 'Adam'}. Best is trial 42 with value: 0.08232190069644964.
2026-05-13 18:42:31,054 - optuna.study._optimize - INFO - Trial 46 pruned. 
2026-05-13 18:42:38,653 - optuna.study._optimize - INFO - Trial 47 pruned. 
2026-05-13 18:42:42,763 - optuna.study._optimize - INFO - Trial 48 pruned. 
2026-05-13 18:43:25,440 - optuna.study.study - INFO - Trial 49 finished with value: 0.03305767638216744 and parameters: {'n_layers': 2, 'embedding_dim': 256, 'lr': 0.00037458172665445977, 'lambda_val': 0.0004723844675935742, 'batch_size': 2126, 'optimizer': 'Adam'}. Best is trial 42 with value: 0.08232190069644964.
2026-05-13 18:43:29,966 - optuna.study._optimize - INFO - Trial 50 pruned. 
2026-05-13 18:44:00,387 - optuna.study.study - INFO - Trial 51 finished with value: 0.07061798397693488 and parameters: {'n_layers': 1, 'embedding_dim': 64, 'lr': 0.009545542414085654, 'lambda_val': 0.0028174002785619503, 'batch_size': 2849, 'optimizer': 'Adam'}. Best is trial 42 with value: 0.08232190069644964.
2026-05-13 18:44:28,662 - optuna.study.study - INFO - Trial 52 finished with value: 0.07302967789769955 and parameters: {'n_layers': 1, 'embedding_dim': 64, 'lr': 0.012218348994729957, 'lambda_val': 0.0023311899619459387, 'batch_size': 2907, 'optimizer': 'Adam'}. Best is trial 42 with value: 0.08232190069644964.
2026-05-13 18:44:32,737 - optuna.study._optimize - INFO - Trial 53 pruned. 
2026-05-13 18:45:00,081 - optuna.study.study - INFO - Trial 54 finished with value: 0.05278978816587897 and parameters: {'n_layers': 1, 'embedding_dim': 64, 'lr': 0.0016862324016518884, 'lambda_val': 0.0012458949179882225, 'batch_size': 3203, 'optimizer': 'Adam'}. Best is trial 42 with value: 0.08232190069644964.
2026-05-13 18:45:06,116 - optuna.study._optimize - INFO - Trial 55 pruned. 
2026-05-13 18:45:10,291 - optuna.study._optimize - INFO - Trial 56 pruned. 
2026-05-13 18:45:14,854 - optuna.study._optimize - INFO - Trial 57 pruned. 
2026-05-13 18:45:18,743 - optuna.study._optimize - INFO - Trial 58 pruned. 
2026-05-13 18:45:23,276 - optuna.study._optimize - INFO - Trial 59 pruned. 
2026-05-13 18:45:28,517 - optuna.study._optimize - INFO - Trial 60 pruned. 
2026-05-13 18:45:33,192 - optuna.study._optimize - INFO - Trial 61 pruned. 
2026-05-13 18:45:37,748 - optuna.study._optimize - INFO - Trial 62 pruned. 
2026-05-13 18:46:20,324 - optuna.study.study - INFO - Trial 63 finished with value: 0.06698196562181549 and parameters: {'n_layers': 1, 'embedding_dim': 256, 'lr': 0.001784960835225612, 'lambda_val': 0.00037647034890512447, 'batch_size': 1598, 'optimizer': 'Adam'}. Best is trial 42 with value: 0.08232190069644964.
2026-05-13 18:46:24,901 - optuna.study._optimize - INFO - Trial 64 pruned. 
2026-05-13 18:46:54,201 - optuna.study.study - INFO - Trial 65 finished with value: 0.04747503765481714 and parameters: {'n_layers': 1, 'embedding_dim': 96, 'lr': 0.0011113235315077792, 'lambda_val': 0.001354700609593199, 'batch_size': 1922, 'optimizer': 'Adam'}. Best is trial 42 with value: 0.08232190069644964.
2026-05-13 18:46:57,810 - optuna.study._optimize - INFO - Trial 66 pruned. 
2026-05-13 18:47:32,849 - optuna.study.study - INFO - Trial 67 finished with value: 0.07543383004353675 and parameters: {'n_layers': 1, 'embedding_dim': 256, 'lr': 0.010661783001629415, 'lambda_val': 0.004822555610014371, 'batch_size': 2225, 'optimizer': 'Adam'}. Best is trial 42 with value: 0.08232190069644964.
2026-05-13 18:47:36,515 - optuna.study._optimize - INFO - Trial 68 pruned. 
2026-05-13 18:47:40,764 - optuna.study._optimize - INFO - Trial 69 pruned. 
2026-05-13 18:47:45,356 - optuna.study._optimize - INFO - Trial 70 pruned. 
2026-05-13 18:48:20,317 - optuna.study.study - INFO - Trial 71 finished with value: 0.07596462045604323 and parameters: {'n_layers': 1, 'embedding_dim': 256, 'lr': 0.007246467364535964, 'lambda_val': 0.0029574984616703697, 'batch_size': 2083, 'optimizer': 'Adam'}. Best is trial 42 with value: 0.08232190069644964.
2026-05-13 18:49:01,634 - optuna.study.study - INFO - Trial 72 finished with value: 0.08042060857228764 and parameters: {'n_layers': 1, 'embedding_dim': 256, 'lr': 0.006183683967291584, 'lambda_val': 0.0030820319933040296, 'batch_size': 2068, 'optimizer': 'Adam'}. Best is trial 42 with value: 0.08232190069644964.
2026-05-13 18:49:39,511 - optuna.study.study - INFO - Trial 73 finished with value: 0.08210603992312196 and parameters: {'n_layers': 1, 'embedding_dim': 256, 'lr': 0.006572953646456361, 'lambda_val': 0.001905560274267504, 'batch_size': 2010, 'optimizer': 'Adam'}. Best is trial 42 with value: 0.08232190069644964.
2026-05-13 18:50:14,427 - optuna.study.study - INFO - Trial 74 finished with value: 0.08321332274597126 and parameters: {'n_layers': 1, 'embedding_dim': 256, 'lr': 0.005743305893334965, 'lambda_val': 0.0017197122608816483, 'batch_size': 2050, 'optimizer': 'Adam'}. Best is trial 74 with value: 0.08321332274597126.
2026-05-13 18:50:49,107 - optuna.study.study - INFO - Trial 75 finished with value: 0.0797466315993368 and parameters: {'n_layers': 1, 'embedding_dim': 256, 'lr': 0.006235844552539987, 'lambda_val': 0.0018232687885801253, 'batch_size': 2048, 'optimizer': 'Adam'}. Best is trial 74 with value: 0.08321332274597126.
2026-05-13 18:51:26,971 - optuna.study.study - INFO - Trial 76 finished with value: 0.0813777175199621 and parameters: {'n_layers': 1, 'embedding_dim': 256, 'lr': 0.003715714605969478, 'lambda_val': 0.001888374644399111, 'batch_size': 1865, 'optimizer': 'Adam'}. Best is trial 74 with value: 0.08321332274597126.
2026-05-13 18:52:13,009 - optuna.study.study - INFO - Trial 77 finished with value: 0.08242833303185934 and parameters: {'n_layers': 1, 'embedding_dim': 256, 'lr': 0.0052097630412855, 'lambda_val': 0.0018076652868646717, 'batch_size': 2010, 'optimizer': 'RMSprop'}. Best is trial 74 with value: 0.08321332274597126.
2026-05-13 18:52:20,636 - optuna.study._optimize - INFO - Trial 78 pruned. 
2026-05-13 18:53:05,792 - optuna.study.study - INFO - Trial 79 finished with value: 0.08319899389396031 and parameters: {'n_layers': 1, 'embedding_dim': 256, 'lr': 0.0029920121861316687, 'lambda_val': 0.0018891532093347758, 'batch_size': 1876, 'optimizer': 'RMSprop'}. Best is trial 74 with value: 0.08321332274597126.
2026-05-13 18:53:46,567 - optuna.study.study - INFO - Trial 80 finished with value: 0.08435181021023357 and parameters: {'n_layers': 1, 'embedding_dim': 256, 'lr': 0.004473207374253799, 'lambda_val': 0.0017203621160538146, 'batch_size': 1844, 'optimizer': 'RMSprop'}. Best is trial 80 with value: 0.08435181021023357.
2026-05-13 18:54:29,183 - optuna.study.study - INFO - Trial 81 finished with value: 0.08247998032672958 and parameters: {'n_layers': 1, 'embedding_dim': 256, 'lr': 0.003245895147996872, 'lambda_val': 0.0019014613799433044, 'batch_size': 1899, 'optimizer': 'RMSprop'}. Best is trial 80 with value: 0.08435181021023357.
2026-05-13 18:55:14,277 - optuna.study.study - INFO - Trial 82 finished with value: 0.07421038509248395 and parameters: {'n_layers': 1, 'embedding_dim': 256, 'lr': 0.002947965376715675, 'lambda_val': 0.0007028943907864463, 'batch_size': 1838, 'optimizer': 'RMSprop'}. Best is trial 80 with value: 0.08435181021023357.
2026-05-13 18:55:53,058 - optuna.study.study - INFO - Trial 83 finished with value: 0.08423246579671809 and parameters: {'n_layers': 1, 'embedding_dim': 256, 'lr': 0.0042230705800028355, 'lambda_val': 0.0021375273790420644, 'batch_size': 1806, 'optimizer': 'RMSprop'}. Best is trial 80 with value: 0.08435181021023357.
2026-05-13 18:57:07,673 - optuna.study.study - INFO - Trial 84 finished with value: 0.0683475267788606 and parameters: {'n_layers': 1, 'embedding_dim': 256, 'lr': 0.0013078188998642461, 'lambda_val': 0.0015223053565993616, 'batch_size': 1847, 'optimizer': 'RMSprop'}. Best is trial 80 with value: 0.08435181021023357.
2026-05-13 18:57:52,855 - optuna.study.study - INFO - Trial 85 finished with value: 0.08358945549345438 and parameters: {'n_layers': 1, 'embedding_dim': 256, 'lr': 0.0032377035416521305, 'lambda_val': 0.0019465218163553077, 'batch_size': 1570, 'optimizer': 'RMSprop'}. Best is trial 80 with value: 0.08435181021023357.
2026-05-13 18:58:46,116 - optuna.study.study - INFO - Trial 86 finished with value: 0.0769709896860818 and parameters: {'n_layers': 1, 'embedding_dim': 256, 'lr': 0.0022426118230236504, 'lambda_val': 0.0009136541123421318, 'batch_size': 1369, 'optimizer': 'RMSprop'}. Best is trial 80 with value: 0.08435181021023357.
2026-05-13 18:59:24,742 - optuna.study.study - INFO - Trial 87 finished with value: 0.08486166748328945 and parameters: {'n_layers': 1, 'embedding_dim': 256, 'lr': 0.004501104991419102, 'lambda_val': 0.0023123013461680214, 'batch_size': 1530, 'optimizer': 'RMSprop'}. Best is trial 87 with value: 0.08486166748328945.
2026-05-13 18:59:31,063 - optuna.study._optimize - INFO - Trial 88 pruned. 
2026-05-13 19:00:13,438 - optuna.study.study - INFO - Trial 89 finished with value: 0.06349413369453784 and parameters: {'n_layers': 1, 'embedding_dim': 256, 'lr': 0.0007144330376173733, 'lambda_val': 0.0024916088139270275, 'batch_size': 1517, 'optimizer': 'RMSprop'}. Best is trial 87 with value: 0.08486166748328945.
2026-05-13 19:00:54,973 - optuna.study.study - INFO - Trial 90 finished with value: 0.07746029407213138 and parameters: {'n_layers': 1, 'embedding_dim': 256, 'lr': 0.0045774904188791085, 'lambda_val': 0.0004970191321140764, 'batch_size': 1604, 'optimizer': 'RMSprop'}. Best is trial 87 with value: 0.08486166748328945.
2026-05-13 19:01:35,401 - optuna.study.study - INFO - Trial 91 finished with value: 0.07804073891433057 and parameters: {'n_layers': 1, 'embedding_dim': 256, 'lr': 0.003044389503602101, 'lambda_val': 0.002284968269937125, 'batch_size': 1778, 'optimizer': 'RMSprop'}. Best is trial 87 with value: 0.08486166748328945.
2026-05-13 19:02:13,606 - optuna.study.study - INFO - Trial 92 finished with value: 0.08478196745798283 and parameters: {'n_layers': 1, 'embedding_dim': 256, 'lr': 0.00504217841757418, 'lambda_val': 0.0012173944647206265, 'batch_size': 1954, 'optimizer': 'RMSprop'}. Best is trial 87 with value: 0.08486166748328945.
2026-05-13 19:02:55,398 - optuna.study.study - INFO - Trial 93 finished with value: 0.08260380224821672 and parameters: {'n_layers': 1, 'embedding_dim': 256, 'lr': 0.0046066847638152825, 'lambda_val': 0.0011582197897566234, 'batch_size': 1456, 'optimizer': 'RMSprop'}. Best is trial 87 with value: 0.08486166748328945.
