2026-05-13 16:33:49,356 - optuna.study.study - INFO - Trial 56 finished with value: 0.061850676447901494 and parameters: {'n_layers': 1, 'embedding_dim': 128, 'lr': 0.0003326208151773371, 'lambda_val': 0.00015598851838397555, 'batch_size': 1177, 'optimizer': 'RMSprop'}. Best is trial 45 with value: 0.10669462430196822.
2026-05-13 16:33:54,113 - optuna.study._optimize - INFO - Trial 57 pruned. 
2026-05-13 16:33:58,584 - optuna.study._optimize - INFO - Trial 58 pruned. 
2026-05-13 16:34:04,072 - optuna.study._optimize - INFO - Trial 59 pruned. 
2026-05-13 16:34:08,045 - optuna.study._optimize - INFO - Trial 60 pruned. 
2026-05-13 16:34:42,469 - optuna.study.study - INFO - Trial 61 finished with value: 0.08232782051230628 and parameters: {'n_layers': 1, 'embedding_dim': 256, 'lr': 0.0003920830546103905, 'lambda_val': 7.43358686510294e-05, 'batch_size': 788, 'optimizer': 'Adam'}. Best is trial 45 with value: 0.10669462430196822.
2026-05-13 16:35:16,670 - optuna.study.study - INFO - Trial 62 finished with value: 0.075245569624265 and parameters: {'n_layers': 1, 'embedding_dim': 256, 'lr': 0.00040413096315860425, 'lambda_val': 0.00014892712239813748, 'batch_size': 679, 'optimizer': 'Adam'}. Best is trial 45 with value: 0.10669462430196822.
2026-05-13 16:35:50,968 - optuna.study.study - INFO - Trial 63 finished with value: 0.07611975425549589 and parameters: {'n_layers': 1, 'embedding_dim': 256, 'lr': 0.0003584352720254928, 'lambda_val': 0.0003380566456790482, 'batch_size': 1008, 'optimizer': 'Adam'}. Best is trial 45 with value: 0.10669462430196822.
2026-05-13 16:36:25,063 - optuna.study.study - INFO - Trial 64 finished with value: 0.07017437492767999 and parameters: {'n_layers': 1, 'embedding_dim': 256, 'lr': 0.00029371963462994697, 'lambda_val': 0.000927256404666006, 'batch_size': 989, 'optimizer': 'Adam'}. Best is trial 45 with value: 0.10669462430196822.
2026-05-13 16:36:30,248 - optuna.study._optimize - INFO - Trial 65 pruned. 
2026-05-13 16:37:05,869 - optuna.study.study - INFO - Trial 66 finished with value: 0.06585021886333768 and parameters: {'n_layers': 1, 'embedding_dim': 256, 'lr': 0.0005917641780770295, 'lambda_val': 0.00033830947892102406, 'batch_size': 1270, 'optimizer': 'Adam'}. Best is trial 45 with value: 0.10669462430196822.
2026-05-13 16:37:41,858 - optuna.study.study - INFO - Trial 67 finished with value: 0.06127537352982623 and parameters: {'n_layers': 1, 'embedding_dim': 256, 'lr': 0.0018538893463148484, 'lambda_val': 8.837159420441548e-06, 'batch_size': 2371, 'optimizer': 'Adam'}. Best is trial 45 with value: 0.10669462430196822.
2026-05-13 16:38:16,990 - optuna.study.study - INFO - Trial 68 finished with value: 0.07384362818139129 and parameters: {'n_layers': 1, 'embedding_dim': 256, 'lr': 0.00027558454529102164, 'lambda_val': 0.00045699196171253807, 'batch_size': 1745, 'optimizer': 'Adam'}. Best is trial 45 with value: 0.10669462430196822.
2026-05-13 16:38:21,444 - optuna.study._optimize - INFO - Trial 69 pruned. 
2026-05-13 16:38:51,593 - optuna.study.study - INFO - Trial 70 finished with value: 0.04910884148157498 and parameters: {'n_layers': 1, 'embedding_dim': 96, 'lr': 0.0003926280058081838, 'lambda_val': 4.422802923779452e-06, 'batch_size': 2787, 'optimizer': 'RMSprop'}. Best is trial 45 with value: 0.10669462430196822.
2026-05-13 16:39:25,535 - optuna.study.study - INFO - Trial 71 finished with value: 0.08361956343484492 and parameters: {'n_layers': 1, 'embedding_dim': 256, 'lr': 0.0003885611113856201, 'lambda_val': 0.00015087238936258558, 'batch_size': 674, 'optimizer': 'Adam'}. Best is trial 45 with value: 0.10669462430196822.
2026-05-13 16:40:07,509 - optuna.study.study - INFO - Trial 72 finished with value: 0.06746052692036104 and parameters: {'n_layers': 1, 'embedding_dim': 256, 'lr': 0.0005944869651422208, 'lambda_val': 8.339683409085948e-05, 'batch_size': 776, 'optimizer': 'Adam'}. Best is trial 45 with value: 0.10669462430196822.
2026-05-13 16:40:43,439 - optuna.study.study - INFO - Trial 73 finished with value: 0.08237837942497618 and parameters: {'n_layers': 1, 'embedding_dim': 256, 'lr': 0.00027508052975377034, 'lambda_val': 0.00010977688095333639, 'batch_size': 1064, 'optimizer': 'Adam'}. Best is trial 45 with value: 0.10669462430196822.
2026-05-13 16:41:17,920 - optuna.study.study - INFO - Trial 74 finished with value: 0.09780683673341194 and parameters: {'n_layers': 1, 'embedding_dim': 256, 'lr': 0.00021490093882177698, 'lambda_val': 0.0003306557881337255, 'batch_size': 1088, 'optimizer': 'Adam'}. Best is trial 45 with value: 0.10669462430196822.
2026-05-13 16:41:23,018 - optuna.study._optimize - INFO - Trial 75 pruned. 
2026-05-13 16:41:26,714 - optuna.study._optimize - INFO - Trial 76 pruned. 
2026-05-13 16:41:33,539 - optuna.study._optimize - INFO - Trial 77 pruned. 
2026-05-13 16:41:37,588 - optuna.study._optimize - INFO - Trial 78 pruned. 
2026-05-13 16:42:09,821 - optuna.study.study - INFO - Trial 79 finished with value: 0.06073562735025919 and parameters: {'n_layers': 1, 'embedding_dim': 256, 'lr': 0.0009400078948144143, 'lambda_val': 1.91578842774961e-05, 'batch_size': 743, 'optimizer': 'Adam'}. Best is trial 45 with value: 0.10669462430196822.
2026-05-13 16:42:13,144 - optuna.study._optimize - INFO - Trial 80 pruned. 
2026-05-13 16:42:52,120 - optuna.study.study - INFO - Trial 81 finished with value: 0.06806938504303633 and parameters: {'n_layers': 1, 'embedding_dim': 256, 'lr': 0.0004585940785641675, 'lambda_val': 0.0003245160935828351, 'batch_size': 992, 'optimizer': 'Adam'}. Best is trial 45 with value: 0.10669462430196822.
2026-05-13 16:43:26,857 - optuna.study.study - INFO - Trial 82 finished with value: 0.06756782072600999 and parameters: {'n_layers': 1, 'embedding_dim': 256, 'lr': 0.0006730178265924415, 'lambda_val': 0.0001413093616119392, 'batch_size': 1098, 'optimizer': 'Adam'}. Best is trial 45 with value: 0.10669462430196822.
2026-05-13 16:43:31,269 - optuna.study._optimize - INFO - Trial 83 pruned. 
2026-05-13 16:44:05,659 - optuna.study.study - INFO - Trial 84 finished with value: 0.09186349458581641 and parameters: {'n_layers': 1, 'embedding_dim': 256, 'lr': 0.0003204918811439403, 'lambda_val': 4.212199401862482e-05, 'batch_size': 600, 'optimizer': 'Adam'}. Best is trial 45 with value: 0.10669462430196822.
2026-05-13 16:44:10,684 - optuna.study._optimize - INFO - Trial 85 pruned. 
2026-05-13 16:44:15,742 - optuna.study._optimize - INFO - Trial 86 pruned. 
2026-05-13 16:44:50,421 - optuna.study.study - INFO - Trial 87 finished with value: 0.06684228055560328 and parameters: {'n_layers': 1, 'embedding_dim': 256, 'lr': 0.0004771098434549497, 'lambda_val': 0.00010918455025127333, 'batch_size': 756, 'optimizer': 'Adam'}. Best is trial 45 with value: 0.10669462430196822.
2026-05-13 16:44:54,867 - optuna.study._optimize - INFO - Trial 88 pruned. 
2026-05-13 16:45:24,949 - optuna.study.study - INFO - Trial 89 finished with value: 0.06857869512256343 and parameters: {'n_layers': 1, 'embedding_dim': 128, 'lr': 0.00029057080319128153, 'lambda_val': 2.461223949414655e-05, 'batch_size': 1635, 'optimizer': 'RMSprop'}. Best is trial 45 with value: 0.10669462430196822.
2026-05-13 16:45:59,836 - optuna.study.study - INFO - Trial 90 finished with value: 0.06611217730756515 and parameters: {'n_layers': 1, 'embedding_dim': 256, 'lr': 0.0011340970871044848, 'lambda_val': 5.110220348345888e-05, 'batch_size': 689, 'optimizer': 'Adam'}. Best is trial 45 with value: 0.10669462430196822.
2026-05-13 16:46:06,045 - optuna.study._optimize - INFO - Trial 91 pruned. 
2026-05-13 16:46:12,936 - optuna.study._optimize - INFO - Trial 92 pruned. 
2026-05-13 16:46:47,133 - optuna.study.study - INFO - Trial 93 finished with value: 0.08046385200650269 and parameters: {'n_layers': 1, 'embedding_dim': 256, 'lr': 0.00024020019891005174, 'lambda_val': 0.0003738891315190884, 'batch_size': 1072, 'optimizer': 'Adam'}. Best is trial 45 with value: 0.10669462430196822.
2026-05-13 16:46:52,060 - optuna.study._optimize - INFO - Trial 94 pruned. 
2026-05-13 16:46:56,220 - optuna.study._optimize - INFO - Trial 95 pruned. 
2026-05-13 16:47:24,188 - optuna.study.study - INFO - Trial 96 finished with value: 0.05444457133855042 and parameters: {'n_layers': 1, 'embedding_dim': 96, 'lr': 0.0005320153977577341, 'lambda_val': 0.00012105361258498825, 'batch_size': 901, 'optimizer': 'Adam'}. Best is trial 45 with value: 0.10669462430196822.
2026-05-13 16:47:29,010 - optuna.study._optimize - INFO - Trial 97 pruned. 
2026-05-13 16:47:33,236 - optuna.study._optimize - INFO - Trial 98 pruned. 
2026-05-13 16:47:38,458 - optuna.study._optimize - INFO - Trial 99 pruned. 
2026-05-13 16:48:10,686 - optuna.study.study - INFO - Trial 100 finished with value: 0.07246235680183864 and parameters: {'n_layers': 1, 'embedding_dim': 256, 'lr': 0.00032167331919088316, 'lambda_val': 2.8927305273849035e-05, 'batch_size': 1384, 'optimizer': 'Adam'}. Best is trial 45 with value: 0.10669462430196822.
2026-05-13 16:48:44,531 - optuna.study.study - INFO - Trial 101 finished with value: 0.06764981633397478 and parameters: {'n_layers': 1, 'embedding_dim': 256, 'lr': 0.0006874219019374152, 'lambda_val': 0.00037037283775477115, 'batch_size': 1186, 'optimizer': 'Adam'}. Best is trial 45 with value: 0.10669462430196822.
2026-05-13 16:48:49,395 - optuna.study._optimize - INFO - Trial 102 pruned. 
2026-05-13 16:49:23,598 - optuna.study.study - INFO - Trial 103 finished with value: 0.07259468695618383 and parameters: {'n_layers': 1, 'embedding_dim': 256, 'lr': 0.0003935095441917448, 'lambda_val': 0.00042769911726119855, 'batch_size': 1294, 'optimizer': 'Adam'}. Best is trial 45 with value: 0.10669462430196822.
2026-05-13 16:49:27,936 - optuna.study._optimize - INFO - Trial 104 pruned. 
2026-05-13 16:49:32,095 - optuna.study._optimize - INFO - Trial 105 pruned. 
2026-05-13 16:50:06,496 - optuna.study.study - INFO - Trial 106 finished with value: 0.06284337851903407 and parameters: {'n_layers': 1, 'embedding_dim': 256, 'lr': 0.0008456617607449982, 'lambda_val': 0.00027450280049624664, 'batch_size': 868, 'optimizer': 'Adam'}. Best is trial 45 with value: 0.10669462430196822.
2026-05-13 16:50:11,073 - optuna.study._optimize - INFO - Trial 107 pruned. 
2026-05-13 16:50:15,409 - optuna.study._optimize - INFO - Trial 108 pruned. 
2026-05-13 16:50:49,614 - optuna.study.study - INFO - Trial 109 finished with value: 0.07360758900555694 and parameters: {'n_layers': 1, 'embedding_dim': 256, 'lr': 0.00026044857388871073, 'lambda_val': 0.0012852330920731288, 'batch_size': 793, 'optimizer': 'Adam'}. Best is trial 45 with value: 0.10669462430196822.
2026-05-13 16:51:26,405 - optuna.study.study - INFO - Trial 110 finished with value: 0.06657499382005684 and parameters: {'n_layers': 1, 'embedding_dim': 256, 'lr': 0.000555158134221697, 'lambda_val': 7.266295414671346e-06, 'batch_size': 3921, 'optimizer': 'Adam'}. Best is trial 45 with value: 0.10669462430196822.
2026-05-13 16:51:59,030 - optuna.study.study - INFO - Trial 111 finished with value: 0.07968853522417269 and parameters: {'n_layers': 1, 'embedding_dim': 256, 'lr': 0.0003215332623416403, 'lambda_val': 6.48366941576023e-05, 'batch_size': 916, 'optimizer': 'Adam'}. Best is trial 45 with value: 0.10669462430196822.
2026-05-13 16:52:31,437 - optuna.study.study - INFO - Trial 112 finished with value: 0.0871838183322321 and parameters: {'n_layers': 1, 'embedding_dim': 256, 'lr': 0.000328409792390726, 'lambda_val': 4.8832234032554007e-05, 'batch_size': 922, 'optimizer': 'Adam'}. Best is trial 45 with value: 0.10669462430196822.
2026-05-13 16:53:04,003 - optuna.study.study - INFO - Trial 113 finished with value: 0.07934812670837145 and parameters: {'n_layers': 1, 'embedding_dim': 256, 'lr': 0.00030799263981522916, 'lambda_val': 3.1809699887423393e-05, 'batch_size': 1136, 'optimizer': 'Adam'}. Best is trial 45 with value: 0.10669462430196822.
2026-05-13 16:53:37,073 - optuna.study.study - INFO - Trial 114 finished with value: 0.07882244263573887 and parameters: {'n_layers': 1, 'embedding_dim': 256, 'lr': 0.0004501470324658844, 'lambda_val': 5.83808328456791e-05, 'batch_size': 915, 'optimizer': 'Adam'}. Best is trial 45 with value: 0.10669462430196822.
2026-05-13 16:53:41,564 - optuna.study._optimize - INFO - Trial 115 pruned. 
2026-05-13 16:53:45,413 - optuna.study._optimize - INFO - Trial 116 pruned. 
2026-05-13 16:53:49,678 - optuna.study._optimize - INFO - Trial 117 pruned. 
2026-05-13 16:54:23,687 - optuna.study.study - INFO - Trial 118 finished with value: 0.06609297049293052 and parameters: {'n_layers': 1, 'embedding_dim': 256, 'lr': 0.0006173832318104195, 'lambda_val': 8.811174443147837e-05, 'batch_size': 749, 'optimizer': 'Adam'}. Best is trial 45 with value: 0.10669462430196822.
2026-05-13 16:54:28,432 - optuna.study._optimize - INFO - Trial 119 pruned. 
2026-05-13 16:55:03,305 - optuna.study.study - INFO - Trial 120 finished with value: 0.07365586249885482 and parameters: {'n_layers': 1, 'embedding_dim': 256, 'lr': 0.0003927934958414873, 'lambda_val': 3.5943482021511706e-05, 'batch_size': 1472, 'optimizer': 'Adam'}. Best is trial 45 with value: 0.10669462430196822.
2026-05-13 16:55:38,197 - optuna.study.study - INFO - Trial 121 finished with value: 0.08198681705954146 and parameters: {'n_layers': 1, 'embedding_dim': 256, 'lr': 0.0002781969710360897, 'lambda_val': 1.088324846913905e-05, 'batch_size': 1096, 'optimizer': 'Adam'}. Best is trial 45 with value: 0.10669462430196822.
2026-05-13 16:55:44,345 - optuna.study._optimize - INFO - Trial 122 pruned. 
2026-05-13 16:56:18,926 - optuna.study.study - INFO - Trial 123 finished with value: 0.07843398547322583 and parameters: {'n_layers': 1, 'embedding_dim': 256, 'lr': 0.000257388086388479, 'lambda_val': 6.662984079657355e-05, 'batch_size': 1097, 'optimizer': 'Adam'}. Best is trial 45 with value: 0.10669462430196822.
2026-05-13 16:56:23,337 - optuna.study._optimize - INFO - Trial 124 pruned. 
2026-05-13 16:56:58,572 - optuna.study.study - INFO - Trial 125 finished with value: 0.07198948091790011 and parameters: {'n_layers': 1, 'embedding_dim': 256, 'lr': 0.00045624583115244784, 'lambda_val': 1.406801155924015e-06, 'batch_size': 1309, 'optimizer': 'Adam'}. Best is trial 45 with value: 0.10669462430196822.
2026-05-13 16:57:03,652 - optuna.study._optimize - INFO - Trial 126 pruned. 
2026-05-13 16:57:08,575 - optuna.study._optimize - INFO - Trial 127 pruned. 
2026-05-13 16:57:15,422 - optuna.study._optimize - INFO - Trial 128 pruned. 
2026-05-13 16:57:43,910 - optuna.study.study - INFO - Trial 129 finished with value: 0.061071888634696356 and parameters: {'n_layers': 1, 'embedding_dim': 64, 'lr': 0.0003644282134595029, 'lambda_val': 0.00012563509097608344, 'batch_size': 1050, 'optimizer': 'RMSprop'}. Best is trial 45 with value: 0.10669462430196822.
2026-05-13 16:57:48,887 - optuna.study._optimize - INFO - Trial 130 pruned. 
2026-05-13 16:58:23,962 - optuna.study.study - INFO - Trial 131 finished with value: 0.08177935544473634 and parameters: {'n_layers': 1, 'embedding_dim': 256, 'lr': 0.0003052203369676966, 'lambda_val': 3.211757774870107e-05, 'batch_size': 1134, 'optimizer': 'Adam'}. Best is trial 45 with value: 0.10669462430196822.
2026-05-13 16:58:58,677 - optuna.study.study - INFO - Trial 132 finished with value: 0.07363500944133179 and parameters: {'n_layers': 1, 'embedding_dim': 256, 'lr': 0.0005143388301998669, 'lambda_val': 1.3476045388928379e-05, 'batch_size': 1234, 'optimizer': 'Adam'}. Best is trial 45 with value: 0.10669462430196822.
2026-05-13 16:59:33,830 - optuna.study.study - INFO - Trial 133 finished with value: 0.07842711637742242 and parameters: {'n_layers': 1, 'embedding_dim': 256, 'lr': 0.0003257677836809459, 'lambda_val': 5.3810607386407434e-05, 'batch_size': 1383, 'optimizer': 'Adam'}. Best is trial 45 with value: 0.10669462430196822.
2026-05-13 17:00:10,430 - optuna.study.study - INFO - Trial 134 finished with value: 0.07849726921451067 and parameters: {'n_layers': 1, 'embedding_dim': 256, 'lr': 0.0002941560052169409, 'lambda_val': 2.7009909635776166e-05, 'batch_size': 938, 'optimizer': 'Adam'}. Best is trial 45 with value: 0.10669462430196822.
2026-05-13 17:00:14,898 - optuna.study._optimize - INFO - Trial 135 pruned. 
2026-05-13 17:00:18,527 - optuna.study._optimize - INFO - Trial 136 pruned. 
2026-05-13 17:00:51,138 - optuna.study.study - INFO - Trial 137 finished with value: 0.07771922317601916 and parameters: {'n_layers': 1, 'embedding_dim': 256, 'lr': 0.0003763937011295336, 'lambda_val': 9.521377982605254e-05, 'batch_size': 1031, 'optimizer': 'Adam'}. Best is trial 45 with value: 0.10669462430196822.
2026-05-13 17:00:55,695 - optuna.study._optimize - INFO - Trial 138 pruned. 
2026-05-13 17:00:59,964 - optuna.study._optimize - INFO - Trial 139 pruned. 
2026-05-13 17:01:34,599 - optuna.study.study - INFO - Trial 140 finished with value: 0.06936458610612631 and parameters: {'n_layers': 1, 'embedding_dim': 256, 'lr': 0.0004745624332005807, 'lambda_val': 1.657446348360292e-05, 'batch_size': 1129, 'optimizer': 'Adam'}. Best is trial 45 with value: 0.10669462430196822.
2026-05-13 17:02:09,403 - optuna.study.study - INFO - Trial 141 finished with value: 0.08196263298477098 and parameters: {'n_layers': 1, 'embedding_dim': 256, 'lr': 0.0003015429276063432, 'lambda_val': 2.181323767325538e-05, 'batch_size': 1158, 'optimizer': 'Adam'}. Best is trial 45 with value: 0.10669462430196822.
2026-05-13 17:02:52,242 - optuna.study.study - INFO - Trial 142 finished with value: 0.08117646759347254 and parameters: {'n_layers': 1, 'embedding_dim': 256, 'lr': 0.0002699826366977974, 'lambda_val': 9.543782998441637e-06, 'batch_size': 1198, 'optimizer': 'Adam'}. Best is trial 45 with value: 0.10669462430196822.
2026-05-13 17:03:26,290 - optuna.study.study - INFO - Trial 143 finished with value: 0.08979237340494202 and parameters: {'n_layers': 1, 'embedding_dim': 256, 'lr': 0.00023871917519169457, 'lambda_val': 1.3179937096885236e-05, 'batch_size': 1198, 'optimizer': 'Adam'}. Best is trial 45 with value: 0.10669462430196822.
2026-05-13 17:04:08,163 - optuna.study.study - INFO - Trial 144 finished with value: 0.0744864039640061 and parameters: {'n_layers': 1, 'embedding_dim': 256, 'lr': 0.0002821835677444086, 'lambda_val': 1.0285280704262595e-05, 'batch_size': 1312, 'optimizer': 'Adam'}. Best is trial 45 with value: 0.10669462430196822.
2026-05-13 17:04:12,833 - optuna.study._optimize - INFO - Trial 145 pruned. 
2026-05-13 17:04:45,662 - optuna.study.study - INFO - Trial 146 finished with value: 0.07519405058272342 and parameters: {'n_layers': 1, 'embedding_dim': 256, 'lr': 0.0003962740485824537, 'lambda_val': 1.3649690588604068e-05, 'batch_size': 1271, 'optimizer': 'Adam'}. Best is trial 45 with value: 0.10669462430196822.
2026-05-13 17:04:50,510 - optuna.study._optimize - INFO - Trial 147 pruned. 
2026-05-13 17:04:55,006 - optuna.study._optimize - INFO - Trial 148 pruned. 
2026-05-13 17:05:29,642 - optuna.study.study - INFO - Trial 149 finished with value: 0.07132043982039561 and parameters: {'n_layers': 1, 'embedding_dim': 256, 'lr': 0.0005950279927536392, 'lambda_val': 7.1241546855004094e-06, 'batch_size': 1194, 'optimizer': 'Adam'}. Best is trial 45 with value: 0.10669462430196822.
2026-05-13 17:05:58,624 - optuna.study.study - INFO - Trial 150 finished with value: 0.05979934367825907 and parameters: {'n_layers': 1, 'embedding_dim': 96, 'lr': 0.0002875493100973112, 'lambda_val': 2.4485293194031662e-05, 'batch_size': 1755, 'optimizer': 'Adam'}. Best is trial 45 with value: 0.10669462430196822.
2026-05-13 17:06:03,223 - optuna.study._optimize - INFO - Trial 151 pruned. 
2026-05-13 17:06:08,161 - optuna.study._optimize - INFO - Trial 152 pruned. 
2026-05-13 17:06:42,320 - optuna.study.study - INFO - Trial 153 finished with value: 0.08509379253973251 and parameters: {'n_layers': 1, 'embedding_dim': 256, 'lr': 0.00033522488575699196, 'lambda_val': 2.9506927793509106e-05, 'batch_size': 992, 'optimizer': 'Adam'}. Best is trial 45 with value: 0.10669462430196822.
2026-05-13 17:07:17,418 - optuna.study.study - INFO - Trial 154 finished with value: 0.08353505489718269 and parameters: {'n_layers': 1, 'embedding_dim': 256, 'lr': 0.00035351227416289524, 'lambda_val': 3.1803720876499173e-05, 'batch_size': 975, 'optimizer': 'Adam'}. Best is trial 45 with value: 0.10669462430196822.
2026-05-13 17:07:52,362 - optuna.study.study - INFO - Trial 155 finished with value: 0.07929778725043767 and parameters: {'n_layers': 1, 'embedding_dim': 256, 'lr': 0.0003658681471792245, 'lambda_val': 3.054430741734496e-05, 'batch_size': 790, 'optimizer': 'Adam'}. Best is trial 45 with value: 0.10669462430196822.
2026-05-13 17:08:27,348 - optuna.study.study - INFO - Trial 156 finished with value: 0.08248377415346983 and parameters: {'n_layers': 1, 'embedding_dim': 256, 'lr': 0.0005077868763417868, 'lambda_val': 4.527673665359983e-05, 'batch_size': 886, 'optimizer': 'Adam'}. Best is trial 45 with value: 0.10669462430196822.
2026-05-13 17:09:04,146 - optuna.study.study - INFO - Trial 157 finished with value: 0.07708499462815728 and parameters: {'n_layers': 1, 'embedding_dim': 256, 'lr': 0.0004997367931984512, 'lambda_val': 4.308596630986947e-05, 'batch_size': 969, 'optimizer': 'Adam'}. Best is trial 45 with value: 0.10669462430196822.
2026-05-13 17:09:37,805 - optuna.study.study - INFO - Trial 158 finished with value: 0.07089424926079017 and parameters: {'n_layers': 1, 'embedding_dim': 256, 'lr': 0.0004379136033963859, 'lambda_val': 4.6246712579172335e-05, 'batch_size': 688, 'optimizer': 'RMSprop'}. Best is trial 45 with value: 0.10669462430196822.
2026-05-13 17:10:10,292 - optuna.study.study - INFO - Trial 159 finished with value: 0.06559857259071694 and parameters: {'n_layers': 1, 'embedding_dim': 256, 'lr': 0.000912127735497083, 'lambda_val': 5.562163359878123e-05, 'batch_size': 867, 'optimizer': 'Adam'}. Best is trial 45 with value: 0.10669462430196822.
2026-05-13 17:10:16,273 - optuna.study._optimize - INFO - Trial 160 pruned. 
