2026-05-13 05:43:28,487 - optuna.study.study - INFO - Trial 51 finished with value: 0.09879374330197016 and parameters: {'n_layers': 1, 'embedding_dim': 256, 'lr': 0.000270288630763684, 'lambda_val': 1.823510445581898e-05, 'batch_size': 520, 'optimizer': 'Adam'}. Best is trial 44 with value: 0.10435506491845455.
2026-05-13 05:44:03,396 - optuna.study.study - INFO - Trial 52 finished with value: 0.09707634758488468 and parameters: {'n_layers': 1, 'embedding_dim': 256, 'lr': 0.00022903735900644233, 'lambda_val': 3.3180571608334547e-06, 'batch_size': 660, 'optimizer': 'Adam'}. Best is trial 44 with value: 0.10435506491845455.
2026-05-13 05:44:07,548 - optuna.study._optimize - INFO - Trial 53 pruned. 
2026-05-13 05:44:12,074 - optuna.study._optimize - INFO - Trial 54 pruned. 
2026-05-13 05:44:16,676 - optuna.study._optimize - INFO - Trial 55 pruned. 
2026-05-13 05:44:21,030 - optuna.study._optimize - INFO - Trial 56 pruned. 
2026-05-13 05:44:24,896 - optuna.study._optimize - INFO - Trial 57 pruned. 
2026-05-13 05:45:00,062 - optuna.study.study - INFO - Trial 58 finished with value: 0.0661664983165579 and parameters: {'n_layers': 1, 'embedding_dim': 256, 'lr': 0.0004604697528249436, 'lambda_val': 3.2680499317617566e-05, 'batch_size': 1104, 'optimizer': 'Adam'}. Best is trial 44 with value: 0.10435506491845455.
2026-05-13 05:45:05,431 - optuna.study._optimize - INFO - Trial 59 pruned. 
2026-05-13 05:45:10,568 - optuna.study._optimize - INFO - Trial 60 pruned. 
2026-05-13 05:45:44,041 - optuna.study.study - INFO - Trial 61 finished with value: 0.08844675971720097 and parameters: {'n_layers': 1, 'embedding_dim': 256, 'lr': 0.00032466355062152135, 'lambda_val': 5.151805956285522e-06, 'batch_size': 594, 'optimizer': 'Adam'}. Best is trial 44 with value: 0.10435506491845455.
2026-05-13 05:45:48,517 - optuna.study._optimize - INFO - Trial 62 pruned. 
2026-05-13 05:46:23,281 - optuna.study.study - INFO - Trial 63 finished with value: 0.07397918452522032 and parameters: {'n_layers': 1, 'embedding_dim': 256, 'lr': 0.00038551384845435596, 'lambda_val': 1.5131211768785047e-05, 'batch_size': 656, 'optimizer': 'Adam'}. Best is trial 44 with value: 0.10435506491845455.
2026-05-13 05:46:27,742 - optuna.study._optimize - INFO - Trial 64 pruned. 
2026-05-13 05:46:32,692 - optuna.study._optimize - INFO - Trial 65 pruned. 
2026-05-13 05:46:37,189 - optuna.study._optimize - INFO - Trial 66 pruned. 
2026-05-13 05:47:16,004 - optuna.study.study - INFO - Trial 67 finished with value: 0.07274376501396028 and parameters: {'n_layers': 1, 'embedding_dim': 256, 'lr': 0.0004884431078310545, 'lambda_val': 4.2653973572078e-06, 'batch_size': 935, 'optimizer': 'Adam'}. Best is trial 44 with value: 0.10435506491845455.
2026-05-13 05:47:24,014 - optuna.study._optimize - INFO - Trial 68 pruned. 
2026-05-13 05:47:28,355 - optuna.study._optimize - INFO - Trial 69 pruned. 
2026-05-13 05:48:02,932 - optuna.study.study - INFO - Trial 70 finished with value: 0.0637299851816618 and parameters: {'n_layers': 1, 'embedding_dim': 256, 'lr': 0.0011211719739440441, 'lambda_val': 5.981042850082238e-05, 'batch_size': 1245, 'optimizer': 'Adam'}. Best is trial 44 with value: 0.10435506491845455.
2026-05-13 05:48:07,408 - optuna.study._optimize - INFO - Trial 71 pruned. 
2026-05-13 05:48:11,759 - optuna.study._optimize - INFO - Trial 72 pruned. 
2026-05-13 05:48:45,875 - optuna.study.study - INFO - Trial 73 finished with value: 0.0681488224551998 and parameters: {'n_layers': 1, 'embedding_dim': 256, 'lr': 0.0007147153712401835, 'lambda_val': 3.543535942696004e-05, 'batch_size': 516, 'optimizer': 'Adam'}. Best is trial 44 with value: 0.10435506491845455.
2026-05-13 05:49:20,198 - optuna.study.study - INFO - Trial 74 finished with value: 0.10183225968781447 and parameters: {'n_layers': 1, 'embedding_dim': 256, 'lr': 0.00034771097576380644, 'lambda_val': 1.2974167553684175e-05, 'batch_size': 740, 'optimizer': 'Adam'}. Best is trial 44 with value: 0.10435506491845455.
2026-05-13 05:49:25,860 - optuna.study._optimize - INFO - Trial 75 pruned. 
2026-05-13 05:49:29,516 - optuna.study._optimize - INFO - Trial 76 pruned. 
2026-05-13 05:50:03,750 - optuna.study.study - INFO - Trial 77 finished with value: 0.08737793735366624 and parameters: {'n_layers': 1, 'embedding_dim': 256, 'lr': 0.0002411181872384025, 'lambda_val': 2.1392444142901e-05, 'batch_size': 1039, 'optimizer': 'Adam'}. Best is trial 44 with value: 0.10435506491845455.
2026-05-13 05:50:08,442 - optuna.study._optimize - INFO - Trial 78 pruned. 
2026-05-13 05:50:15,293 - optuna.study._optimize - INFO - Trial 79 pruned. 
2026-05-13 05:50:44,636 - optuna.study.study - INFO - Trial 80 finished with value: 0.07898808888483208 and parameters: {'n_layers': 1, 'embedding_dim': 128, 'lr': 0.0002648980918037798, 'lambda_val': 1.2636829277350233e-06, 'batch_size': 953, 'optimizer': 'Adam'}. Best is trial 44 with value: 0.10435506491845455.
2026-05-13 05:51:19,319 - optuna.study.study - INFO - Trial 81 finished with value: 0.07624375099683549 and parameters: {'n_layers': 1, 'embedding_dim': 256, 'lr': 0.0004105078114500605, 'lambda_val': 8.711374858688392e-06, 'batch_size': 698, 'optimizer': 'Adam'}. Best is trial 44 with value: 0.10435506491845455.
2026-05-13 05:51:23,434 - optuna.study._optimize - INFO - Trial 82 pruned. 
2026-05-13 05:51:55,188 - optuna.study.study - INFO - Trial 83 finished with value: 0.08134457430189908 and parameters: {'n_layers': 1, 'embedding_dim': 256, 'lr': 0.0003252992528396275, 'lambda_val': 3.9218269377593714e-05, 'batch_size': 1048, 'optimizer': 'Adam'}. Best is trial 44 with value: 0.10435506491845455.
2026-05-13 05:51:59,284 - optuna.study._optimize - INFO - Trial 84 pruned. 
2026-05-13 05:52:03,402 - optuna.study._optimize - INFO - Trial 85 pruned. 
2026-05-13 05:52:35,311 - optuna.study.study - INFO - Trial 86 finished with value: 0.06587773342909034 and parameters: {'n_layers': 1, 'embedding_dim': 256, 'lr': 0.0008536418332712973, 'lambda_val': 5.839564790364399e-06, 'batch_size': 925, 'optimizer': 'Adam'}. Best is trial 44 with value: 0.10435506491845455.
2026-05-13 05:52:39,307 - optuna.study._optimize - INFO - Trial 87 pruned. 
2026-05-13 05:52:43,785 - optuna.study._optimize - INFO - Trial 88 pruned. 
2026-05-13 05:53:16,905 - optuna.study.study - INFO - Trial 89 finished with value: 0.07472114102779259 and parameters: {'n_layers': 1, 'embedding_dim': 256, 'lr': 0.0005475242615991478, 'lambda_val': 3.529811370193609e-06, 'batch_size': 601, 'optimizer': 'Adam'}. Best is trial 44 with value: 0.10435506491845455.
2026-05-13 05:53:20,978 - optuna.study._optimize - INFO - Trial 90 pruned. 
2026-05-13 05:53:53,018 - optuna.study.study - INFO - Trial 91 finished with value: 0.0973971686582541 and parameters: {'n_layers': 1, 'embedding_dim': 256, 'lr': 0.00033298934845158216, 'lambda_val': 8.744234193380185e-06, 'batch_size': 603, 'optimizer': 'Adam'}. Best is trial 44 with value: 0.10435506491845455.
2026-05-13 05:53:57,512 - optuna.study._optimize - INFO - Trial 92 pruned. 
2026-05-13 05:54:02,361 - optuna.study._optimize - INFO - Trial 93 pruned. 
2026-05-13 05:54:07,980 - optuna.study._optimize - INFO - Trial 94 pruned. 
2026-05-13 05:54:12,662 - optuna.study._optimize - INFO - Trial 95 pruned. 
2026-05-13 05:54:16,339 - optuna.study._optimize - INFO - Trial 96 pruned. 
2026-05-13 05:54:20,227 - optuna.study._optimize - INFO - Trial 97 pruned. 
2026-05-13 05:54:24,798 - optuna.study._optimize - INFO - Trial 98 pruned. 
2026-05-13 05:54:30,788 - optuna.study._optimize - INFO - Trial 99 pruned. 
2026-05-13 05:54:34,716 - optuna.study._optimize - INFO - Trial 100 pruned. 
2026-05-13 05:54:38,985 - optuna.study._optimize - INFO - Trial 101 pruned. 
2026-05-13 05:54:43,560 - optuna.study._optimize - INFO - Trial 102 pruned. 
2026-05-13 05:55:18,807 - optuna.study.study - INFO - Trial 103 finished with value: 0.07144445019100357 and parameters: {'n_layers': 1, 'embedding_dim': 256, 'lr': 0.0005965545004636252, 'lambda_val': 4.453021675897051e-06, 'batch_size': 653, 'optimizer': 'Adam'}. Best is trial 44 with value: 0.10435506491845455.
2026-05-13 05:55:23,195 - optuna.study._optimize - INFO - Trial 104 pruned. 
2026-05-13 05:55:27,579 - optuna.study._optimize - INFO - Trial 105 pruned. 
2026-05-13 05:55:31,853 - optuna.study._optimize - INFO - Trial 106 pruned. 
2026-05-13 05:55:36,614 - optuna.study._optimize - INFO - Trial 107 pruned. 
2026-05-13 05:55:40,668 - optuna.study._optimize - INFO - Trial 108 pruned. 
2026-05-13 05:56:15,851 - optuna.study.study - INFO - Trial 109 finished with value: 0.07153579284389425 and parameters: {'n_layers': 1, 'embedding_dim': 256, 'lr': 0.0004714529476700408, 'lambda_val': 1.1881082872635942e-05, 'batch_size': 994, 'optimizer': 'Adam'}. Best is trial 44 with value: 0.10435506491845455.
2026-05-13 05:56:49,697 - optuna.study.study - INFO - Trial 110 finished with value: 0.06316251395146334 and parameters: {'n_layers': 1, 'embedding_dim': 256, 'lr': 0.0007283547429366452, 'lambda_val': 1.6557734606598327e-06, 'batch_size': 856, 'optimizer': 'Adam'}. Best is trial 44 with value: 0.10435506491845455.
2026-05-13 05:56:54,091 - optuna.study._optimize - INFO - Trial 111 pruned. 
2026-05-13 05:56:59,007 - optuna.study._optimize - INFO - Trial 112 pruned. 
2026-05-13 05:57:35,304 - optuna.study.study - INFO - Trial 113 finished with value: 0.07080133941094792 and parameters: {'n_layers': 1, 'embedding_dim': 256, 'lr': 0.00037998612533478776, 'lambda_val': 4.924622425009079e-06, 'batch_size': 2421, 'optimizer': 'Adam'}. Best is trial 44 with value: 0.10435506491845455.
2026-05-13 05:57:39,557 - optuna.study._optimize - INFO - Trial 114 pruned. 
2026-05-13 05:57:44,516 - optuna.study._optimize - INFO - Trial 115 pruned. 
2026-05-13 05:57:48,746 - optuna.study._optimize - INFO - Trial 116 pruned. 
2026-05-13 05:57:52,323 - optuna.study._optimize - INFO - Trial 117 pruned. 
2026-05-13 05:58:21,220 - optuna.study.study - INFO - Trial 118 finished with value: 0.07334427316025267 and parameters: {'n_layers': 1, 'embedding_dim': 96, 'lr': 0.000435778424409084, 'lambda_val': 9.203176478899014e-05, 'batch_size': 617, 'optimizer': 'Adam'}. Best is trial 44 with value: 0.10435506491845455.
2026-05-13 05:58:25,605 - optuna.study._optimize - INFO - Trial 119 pruned. 
2026-05-13 05:59:00,231 - optuna.study.study - INFO - Trial 120 finished with value: 0.07368633217461283 and parameters: {'n_layers': 1, 'embedding_dim': 256, 'lr': 0.0006598996294383297, 'lambda_val': 5.8660979380364304e-06, 'batch_size': 707, 'optimizer': 'Adam'}. Best is trial 44 with value: 0.10435506491845455.
2026-05-13 05:59:04,251 - optuna.study._optimize - INFO - Trial 121 pruned. 
2026-05-13 05:59:08,363 - optuna.study._optimize - INFO - Trial 122 pruned. 
2026-05-13 05:59:12,457 - optuna.study._optimize - INFO - Trial 123 pruned. 
2026-05-13 05:59:16,447 - optuna.study._optimize - INFO - Trial 124 pruned. 
2026-05-13 05:59:20,632 - optuna.study._optimize - INFO - Trial 125 pruned. 
2026-05-13 05:59:50,466 - optuna.study.study - INFO - Trial 126 finished with value: 0.07566241398292471 and parameters: {'n_layers': 1, 'embedding_dim': 128, 'lr': 0.0004574733092555026, 'lambda_val': 4.4058786753524393e-05, 'batch_size': 512, 'optimizer': 'RMSprop'}. Best is trial 44 with value: 0.10435506491845455.
2026-05-13 05:59:54,900 - optuna.study._optimize - INFO - Trial 127 pruned. 
2026-05-13 05:59:58,868 - optuna.study._optimize - INFO - Trial 128 pruned. 
2026-05-13 06:00:05,022 - optuna.study._optimize - INFO - Trial 129 pruned. 
2026-05-13 06:00:09,658 - optuna.study._optimize - INFO - Trial 130 pruned. 
2026-05-13 06:00:43,209 - optuna.study.study - INFO - Trial 131 finished with value: 0.08226675662254518 and parameters: {'n_layers': 1, 'embedding_dim': 256, 'lr': 0.0005278795318867535, 'lambda_val': 4.340048872533829e-05, 'batch_size': 839, 'optimizer': 'RMSprop'}. Best is trial 44 with value: 0.10435506491845455.
2026-05-13 06:00:50,658 - optuna.study._optimize - INFO - Trial 132 pruned. 
2026-05-13 06:01:23,743 - optuna.study.study - INFO - Trial 133 finished with value: 0.08523597585285217 and parameters: {'n_layers': 1, 'embedding_dim': 256, 'lr': 0.000298136609077682, 'lambda_val': 3.0264863541216148e-05, 'batch_size': 707, 'optimizer': 'RMSprop'}. Best is trial 44 with value: 0.10435506491845455.
2026-05-13 06:01:58,061 - optuna.study.study - INFO - Trial 134 finished with value: 0.08814176305701253 and parameters: {'n_layers': 1, 'embedding_dim': 256, 'lr': 0.0002590123397923474, 'lambda_val': 3.0503569827726545e-05, 'batch_size': 689, 'optimizer': 'RMSprop'}. Best is trial 44 with value: 0.10435506491845455.
2026-05-13 06:02:02,864 - optuna.study._optimize - INFO - Trial 135 pruned. 
2026-05-13 06:02:33,430 - optuna.study.study - INFO - Trial 136 finished with value: 0.0889093885453598 and parameters: {'n_layers': 1, 'embedding_dim': 256, 'lr': 0.00026887980438769466, 'lambda_val': 1.4297830653339371e-05, 'batch_size': 701, 'optimizer': 'RMSprop'}. Best is trial 44 with value: 0.10435506491845455.
2026-05-13 06:02:36,547 - optuna.study._optimize - INFO - Trial 137 pruned. 
2026-05-13 06:02:45,038 - optuna.study._optimize - INFO - Trial 138 pruned. 
2026-05-13 06:02:54,343 - optuna.study._optimize - INFO - Trial 139 pruned. 
2026-05-13 06:03:28,282 - optuna.study.study - INFO - Trial 140 finished with value: 0.07967181599239978 and parameters: {'n_layers': 1, 'embedding_dim': 256, 'lr': 0.00040912833254521953, 'lambda_val': 1.9290528090844207e-05, 'batch_size': 768, 'optimizer': 'RMSprop'}. Best is trial 44 with value: 0.10435506491845455.
2026-05-13 06:04:02,048 - optuna.study.study - INFO - Trial 141 finished with value: 0.09291266493490558 and parameters: {'n_layers': 1, 'embedding_dim': 256, 'lr': 0.00026825050817582514, 'lambda_val': 1.573936547095484e-05, 'batch_size': 642, 'optimizer': 'RMSprop'}. Best is trial 44 with value: 0.10435506491845455.
2026-05-13 06:04:36,431 - optuna.study.study - INFO - Trial 142 finished with value: 0.09616343272339414 and parameters: {'n_layers': 1, 'embedding_dim': 256, 'lr': 0.00029273841773175746, 'lambda_val': 7.731026444366261e-06, 'batch_size': 670, 'optimizer': 'RMSprop'}. Best is trial 44 with value: 0.10435506491845455.
2026-05-13 06:05:10,463 - optuna.study.study - INFO - Trial 143 finished with value: 0.09993024488086352 and parameters: {'n_layers': 1, 'embedding_dim': 256, 'lr': 0.00020156764223891707, 'lambda_val': 1.4825107037772566e-05, 'batch_size': 635, 'optimizer': 'RMSprop'}. Best is trial 44 with value: 0.10435506491845455.
2026-05-13 06:05:44,243 - optuna.study.study - INFO - Trial 144 finished with value: 0.0936379955658667 and parameters: {'n_layers': 1, 'embedding_dim': 256, 'lr': 0.00021009684958708867, 'lambda_val': 1.225892090212521e-05, 'batch_size': 654, 'optimizer': 'RMSprop'}. Best is trial 44 with value: 0.10435506491845455.
2026-05-13 06:05:51,667 - optuna.study._optimize - INFO - Trial 145 pruned. 
2026-05-13 06:05:55,853 - optuna.study._optimize - INFO - Trial 146 pruned. 
2026-05-13 06:06:35,100 - optuna.study.study - INFO - Trial 147 finished with value: 0.07317066903835742 and parameters: {'n_layers': 1, 'embedding_dim': 256, 'lr': 0.00022606549008090163, 'lambda_val': 2.3433770445759095e-05, 'batch_size': 2863, 'optimizer': 'RMSprop'}. Best is trial 44 with value: 0.10435506491845455.
2026-05-13 06:06:43,993 - optuna.study._optimize - INFO - Trial 148 pruned. 
2026-05-13 06:06:47,238 - optuna.study._optimize - INFO - Trial 149 pruned. 
2026-05-13 06:06:50,594 - optuna.study._optimize - INFO - Trial 150 pruned. 
2026-05-13 06:07:25,217 - optuna.study.study - INFO - Trial 151 finished with value: 0.10221164577491942 and parameters: {'n_layers': 1, 'embedding_dim': 256, 'lr': 0.0002822077156554451, 'lambda_val': 5.720409631371078e-06, 'batch_size': 514, 'optimizer': 'RMSprop'}. Best is trial 44 with value: 0.10435506491845455.
2026-05-13 06:07:29,577 - optuna.study._optimize - INFO - Trial 152 pruned. 
2026-05-13 06:08:03,588 - optuna.study.study - INFO - Trial 153 finished with value: 0.09527182426463464 and parameters: {'n_layers': 1, 'embedding_dim': 256, 'lr': 0.00027941211524545623, 'lambda_val': 6.635623438364812e-06, 'batch_size': 644, 'optimizer': 'RMSprop'}. Best is trial 44 with value: 0.10435506491845455.
2026-05-13 06:08:07,938 - optuna.study._optimize - INFO - Trial 154 pruned. 
2026-05-13 06:08:12,322 - optuna.study._optimize - INFO - Trial 155 pruned. 
2026-05-13 06:08:47,135 - optuna.study.study - INFO - Trial 156 finished with value: 0.08907457893778092 and parameters: {'n_layers': 1, 'embedding_dim': 256, 'lr': 0.0002456598164409051, 'lambda_val': 8.68063854056592e-06, 'batch_size': 789, 'optimizer': 'RMSprop'}. Best is trial 44 with value: 0.10435506491845455.
2026-05-13 06:08:51,616 - optuna.study._optimize - INFO - Trial 157 pruned. 
2026-05-13 06:08:56,116 - optuna.study._optimize - INFO - Trial 158 pruned. 
2026-05-13 06:09:00,594 - optuna.study._optimize - INFO - Trial 159 pruned. 
2026-05-13 06:09:04,538 - optuna.study._optimize - INFO - Trial 160 pruned. 
2026-05-13 06:09:38,681 - optuna.study.study - INFO - Trial 161 finished with value: 0.0890620321263285 and parameters: {'n_layers': 1, 'embedding_dim': 256, 'lr': 0.000269134638162404, 'lambda_val': 1.2820164949696845e-05, 'batch_size': 904, 'optimizer': 'RMSprop'}. Best is trial 44 with value: 0.10435506491845455.
2026-05-13 06:09:43,164 - optuna.study._optimize - INFO - Trial 162 pruned. 
2026-05-13 06:09:47,969 - optuna.study._optimize - INFO - Trial 163 pruned. 
2026-05-13 06:09:53,119 - optuna.study._optimize - INFO - Trial 164 pruned. 
2026-05-13 06:09:57,437 - optuna.study._optimize - INFO - Trial 165 pruned. 
2026-05-13 06:10:02,121 - optuna.study._optimize - INFO - Trial 166 pruned. 
2026-05-13 06:10:06,540 - optuna.study._optimize - INFO - Trial 167 pruned. 
2026-05-13 06:10:10,897 - optuna.study._optimize - INFO - Trial 168 pruned. 
2026-05-13 06:10:15,558 - optuna.study._optimize - INFO - Trial 169 pruned. 
2026-05-13 06:10:49,731 - optuna.study.study - INFO - Trial 170 finished with value: 0.09049383073777094 and parameters: {'n_layers': 1, 'embedding_dim': 256, 'lr': 0.000252224342415046, 'lambda_val': 7.443147924440684e-06, 'batch_size': 617, 'optimizer': 'RMSprop'}. Best is trial 44 with value: 0.10435506491845455.
2026-05-13 06:10:54,345 - optuna.study._optimize - INFO - Trial 171 pruned. 
2026-05-13 06:11:28,212 - optuna.study.study - INFO - Trial 172 finished with value: 0.0922473337851308 and parameters: {'n_layers': 1, 'embedding_dim': 256, 'lr': 0.000274837428784246, 'lambda_val': 1.0323958189885147e-05, 'batch_size': 523, 'optimizer': 'RMSprop'}. Best is trial 44 with value: 0.10435506491845455.
2026-05-13 06:11:32,450 - optuna.study._optimize - INFO - Trial 173 pruned. 
2026-05-13 06:11:37,887 - optuna.study._optimize - INFO - Trial 174 pruned. 
2026-05-13 06:11:42,228 - optuna.study._optimize - INFO - Trial 175 pruned. 
2026-05-13 06:11:46,125 - optuna.study._optimize - INFO - Trial 176 pruned. 
2026-05-13 06:11:50,597 - optuna.study._optimize - INFO - Trial 177 pruned. 
2026-05-13 06:12:32,774 - optuna.study.study - INFO - Trial 178 finished with value: 0.10065641265893933 and parameters: {'n_layers': 1, 'embedding_dim': 256, 'lr': 0.00026637184546926085, 'lambda_val': 1.2889381711458421e-05, 'batch_size': 514, 'optimizer': 'RMSprop'}. Best is trial 44 with value: 0.10435506491845455.
2026-05-13 06:13:06,626 - optuna.study.study - INFO - Trial 179 finished with value: 0.09577090563706481 and parameters: {'n_layers': 1, 'embedding_dim': 256, 'lr': 0.00025510517657359433, 'lambda_val': 1.2925574311602262e-05, 'batch_size': 657, 'optimizer': 'RMSprop'}. Best is trial 44 with value: 0.10435506491845455.
2026-05-13 06:13:10,875 - optuna.study._optimize - INFO - Trial 180 pruned. 
2026-05-13 06:13:15,303 - optuna.study._optimize - INFO - Trial 181 pruned. 
2026-05-13 06:13:19,698 - optuna.study._optimize - INFO - Trial 182 pruned. 
2026-05-13 06:13:24,175 - optuna.study._optimize - INFO - Trial 183 pruned. 
2026-05-13 06:13:28,508 - optuna.study._optimize - INFO - Trial 184 pruned. 
2026-05-13 06:13:33,418 - optuna.study._optimize - INFO - Trial 185 pruned. 
2026-05-13 06:13:37,684 - optuna.study._optimize - INFO - Trial 186 pruned. 
2026-05-13 06:13:41,393 - optuna.study._optimize - INFO - Trial 187 pruned. 
2026-05-13 06:14:14,171 - optuna.study.study - INFO - Trial 188 finished with value: 0.09938529814876579 and parameters: {'n_layers': 1, 'embedding_dim': 256, 'lr': 0.00023868418799951428, 'lambda_val': 9.76925274474387e-06, 'batch_size': 632, 'optimizer': 'RMSprop'}. Best is trial 44 with value: 0.10435506491845455.
2026-05-13 06:14:17,873 - optuna.study._optimize - INFO - Trial 189 pruned. 
2026-05-13 06:14:51,978 - optuna.study.study - INFO - Trial 190 finished with value: 0.10308941744178503 and parameters: {'n_layers': 1, 'embedding_dim': 256, 'lr': 0.00023837772792611566, 'lambda_val': 9.217559216728656e-06, 'batch_size': 563, 'optimizer': 'RMSprop'}. Best is trial 44 with value: 0.10435506491845455.
2026-05-13 06:14:56,294 - optuna.study._optimize - INFO - Trial 191 pruned. 
2026-05-13 06:15:00,528 - optuna.study._optimize - INFO - Trial 192 pruned. 
2026-05-13 06:15:35,211 - optuna.study.study - INFO - Trial 193 finished with value: 0.08571626231874475 and parameters: {'n_layers': 1, 'embedding_dim': 256, 'lr': 0.0003180528601259206, 'lambda_val': 7.199014827717981e-06, 'batch_size': 647, 'optimizer': 'RMSprop'}. Best is trial 44 with value: 0.10435506491845455.
2026-05-13 06:15:39,638 - optuna.study._optimize - INFO - Trial 194 pruned. 
2026-05-13 06:15:44,154 - optuna.study._optimize - INFO - Trial 195 pruned. 
2026-05-13 06:15:48,742 - optuna.study._optimize - INFO - Trial 196 pruned. 
