2026-05-14 00:12:35,409 - optuna.study._optimize - INFO - Trial 68 pruned. 
2026-05-14 00:12:41,211 - optuna.study._optimize - INFO - Trial 69 pruned. 
2026-05-14 00:12:46,640 - optuna.study._optimize - INFO - Trial 70 pruned. 
2026-05-14 00:13:18,027 - optuna.study.study - INFO - Trial 71 finished with value: 0.08351106411303373 and parameters: {'n_layers': 1, 'embedding_dim': 128, 'lr': 0.018272079059301664, 'lambda_val': 0.001388696272598607, 'batch_size': 2312, 'optimizer': 'RMSprop'}. Best is trial 61 with value: 0.08530549393724854.
2026-05-14 00:13:25,815 - optuna.study._optimize - INFO - Trial 72 pruned. 
2026-05-14 00:13:57,795 - optuna.study.study - INFO - Trial 73 finished with value: 0.07887800014205468 and parameters: {'n_layers': 1, 'embedding_dim': 128, 'lr': 0.004919540400903359, 'lambda_val': 0.001454556105139259, 'batch_size': 2616, 'optimizer': 'RMSprop'}. Best is trial 61 with value: 0.08530549393724854.
2026-05-14 00:14:01,647 - optuna.study._optimize - INFO - Trial 74 pruned. 
2026-05-14 00:14:05,679 - optuna.study._optimize - INFO - Trial 75 pruned. 
2026-05-14 00:14:25,549 - optuna.study._optimize - INFO - Trial 76 pruned. 
2026-05-14 00:14:56,422 - optuna.study.study - INFO - Trial 77 finished with value: 0.08194520353759256 and parameters: {'n_layers': 1, 'embedding_dim': 128, 'lr': 0.017361918028913282, 'lambda_val': 0.0012297744993494907, 'batch_size': 3018, 'optimizer': 'RMSprop'}. Best is trial 61 with value: 0.08530549393724854.
2026-05-14 00:15:02,005 - optuna.study._optimize - INFO - Trial 78 pruned. 
2026-05-14 00:15:06,651 - optuna.study._optimize - INFO - Trial 79 pruned. 
2026-05-14 00:15:10,597 - optuna.study._optimize - INFO - Trial 80 pruned. 
2026-05-14 00:15:42,497 - optuna.study.study - INFO - Trial 81 finished with value: 0.08610615789518983 and parameters: {'n_layers': 1, 'embedding_dim': 128, 'lr': 0.0136358928162396, 'lambda_val': 0.001184781691500105, 'batch_size': 2997, 'optimizer': 'RMSprop'}. Best is trial 81 with value: 0.08610615789518983.
2026-05-14 00:16:13,795 - optuna.study.study - INFO - Trial 82 finished with value: 0.08053926243601758 and parameters: {'n_layers': 1, 'embedding_dim': 128, 'lr': 0.008517785288169634, 'lambda_val': 0.0010806667874047387, 'batch_size': 3001, 'optimizer': 'RMSprop'}. Best is trial 81 with value: 0.08610615789518983.
2026-05-14 00:16:18,421 - optuna.study._optimize - INFO - Trial 83 pruned. 
2026-05-14 00:16:22,774 - optuna.study._optimize - INFO - Trial 84 pruned. 
2026-05-14 00:16:54,547 - optuna.study._optimize - INFO - Trial 85 pruned. 
2026-05-14 00:16:59,048 - optuna.study._optimize - INFO - Trial 86 pruned. 
2026-05-14 00:17:03,034 - optuna.study._optimize - INFO - Trial 87 pruned. 
2026-05-14 00:17:10,640 - optuna.study._optimize - INFO - Trial 88 pruned. 
2026-05-14 00:17:16,182 - optuna.study._optimize - INFO - Trial 89 pruned. 
2026-05-14 00:17:48,475 - optuna.study.study - INFO - Trial 90 finished with value: 0.04367709723020527 and parameters: {'n_layers': 1, 'embedding_dim': 128, 'lr': 0.00014319198912795083, 'lambda_val': 0.012969046867733033, 'batch_size': 3424, 'optimizer': 'RMSprop'}. Best is trial 81 with value: 0.08610615789518983.
2026-05-14 00:18:34,610 - optuna.study.study - INFO - Trial 91 finished with value: 0.08280333358486315 and parameters: {'n_layers': 1, 'embedding_dim': 128, 'lr': 0.012812533937414416, 'lambda_val': 0.0015429662506674915, 'batch_size': 2503, 'optimizer': 'RMSprop'}. Best is trial 81 with value: 0.08610615789518983.
2026-05-14 00:18:38,617 - optuna.study._optimize - INFO - Trial 92 pruned. 
2026-05-14 00:19:10,381 - optuna.study.study - INFO - Trial 93 finished with value: 0.07990418147229231 and parameters: {'n_layers': 1, 'embedding_dim': 128, 'lr': 0.007591195344290927, 'lambda_val': 0.00131385567366655, 'batch_size': 2388, 'optimizer': 'RMSprop'}. Best is trial 81 with value: 0.08610615789518983.
2026-05-14 00:19:41,584 - optuna.study.study - INFO - Trial 94 finished with value: 0.08547885071007422 and parameters: {'n_layers': 1, 'embedding_dim': 128, 'lr': 0.01276915072678223, 'lambda_val': 0.001745550626583056, 'batch_size': 2845, 'optimizer': 'RMSprop'}. Best is trial 81 with value: 0.08610615789518983.
2026-05-14 00:20:13,290 - optuna.study.study - INFO - Trial 95 finished with value: 0.08389547014498695 and parameters: {'n_layers': 1, 'embedding_dim': 128, 'lr': 0.011552929443790673, 'lambda_val': 0.0023549772076829983, 'batch_size': 2642, 'optimizer': 'RMSprop'}. Best is trial 81 with value: 0.08610615789518983.
2026-05-14 00:20:43,666 - optuna.study.study - INFO - Trial 96 finished with value: 0.08623746598490506 and parameters: {'n_layers': 1, 'embedding_dim': 128, 'lr': 0.013795468364493623, 'lambda_val': 0.0020378222768771444, 'batch_size': 2247, 'optimizer': 'RMSprop'}. Best is trial 96 with value: 0.08623746598490506.
2026-05-14 00:20:47,717 - optuna.study._optimize - INFO - Trial 97 pruned. 
2026-05-14 00:21:18,963 - optuna.study.study - INFO - Trial 98 finished with value: 0.08810286072786497 and parameters: {'n_layers': 1, 'embedding_dim': 128, 'lr': 0.012507759419405053, 'lambda_val': 0.0017363877544925225, 'batch_size': 2840, 'optimizer': 'RMSprop'}. Best is trial 98 with value: 0.08810286072786497.
2026-05-14 00:21:23,412 - optuna.study._optimize - INFO - Trial 99 pruned. 
2026-05-14 00:21:27,829 - optuna.study._optimize - INFO - Trial 100 pruned. 
2026-05-14 00:21:58,273 - optuna.study.study - INFO - Trial 101 finished with value: 0.09153790586425585 and parameters: {'n_layers': 1, 'embedding_dim': 128, 'lr': 0.013477713846080638, 'lambda_val': 0.0016512381883818513, 'batch_size': 2249, 'optimizer': 'RMSprop'}. Best is trial 101 with value: 0.09153790586425585.
2026-05-14 00:22:28,392 - optuna.study.study - INFO - Trial 102 finished with value: 0.0849674697396746 and parameters: {'n_layers': 1, 'embedding_dim': 128, 'lr': 0.006055516664262634, 'lambda_val': 0.0025601315221149418, 'batch_size': 2229, 'optimizer': 'RMSprop'}. Best is trial 101 with value: 0.09153790586425585.
2026-05-14 00:22:58,550 - optuna.study.study - INFO - Trial 103 finished with value: 0.08220148966895391 and parameters: {'n_layers': 1, 'embedding_dim': 128, 'lr': 0.013913330153017055, 'lambda_val': 0.002455661429082943, 'batch_size': 2109, 'optimizer': 'RMSprop'}. Best is trial 101 with value: 0.09153790586425585.
2026-05-14 00:23:28,715 - optuna.study.study - INFO - Trial 104 finished with value: 0.08243615682843333 and parameters: {'n_layers': 1, 'embedding_dim': 128, 'lr': 0.006816332198089615, 'lambda_val': 0.0016874380257466686, 'batch_size': 1938, 'optimizer': 'RMSprop'}. Best is trial 101 with value: 0.09153790586425585.
2026-05-14 00:23:32,929 - optuna.study._optimize - INFO - Trial 105 pruned. 
2026-05-14 00:23:37,214 - optuna.study._optimize - INFO - Trial 106 pruned. 
2026-05-14 00:23:44,737 - optuna.study._optimize - INFO - Trial 107 pruned. 
2026-05-14 00:24:16,390 - optuna.study.study - INFO - Trial 108 finished with value: 0.08447353920321238 and parameters: {'n_layers': 1, 'embedding_dim': 128, 'lr': 0.008640300533718606, 'lambda_val': 0.00321874863349029, 'batch_size': 2732, 'optimizer': 'RMSprop'}. Best is trial 101 with value: 0.09153790586425585.
2026-05-14 00:24:20,594 - optuna.study._optimize - INFO - Trial 109 pruned. 
2026-05-14 00:24:24,932 - optuna.study._optimize - INFO - Trial 110 pruned. 
2026-05-14 00:24:55,938 - optuna.study.study - INFO - Trial 111 finished with value: 0.08105462634323164 and parameters: {'n_layers': 1, 'embedding_dim': 128, 'lr': 0.010219257509781162, 'lambda_val': 0.0017961159587459327, 'batch_size': 2629, 'optimizer': 'RMSprop'}. Best is trial 101 with value: 0.09153790586425585.
2026-05-14 00:24:59,978 - optuna.study._optimize - INFO - Trial 112 pruned. 
2026-05-14 00:25:05,454 - optuna.study._optimize - INFO - Trial 113 pruned. 
2026-05-14 00:25:09,647 - optuna.study._optimize - INFO - Trial 114 pruned. 
2026-05-14 00:25:13,962 - optuna.study._optimize - INFO - Trial 115 pruned. 
2026-05-14 00:25:18,132 - optuna.study._optimize - INFO - Trial 116 pruned. 
2026-05-14 00:25:24,082 - optuna.study._optimize - INFO - Trial 117 pruned. 
2026-05-14 00:25:28,487 - optuna.study._optimize - INFO - Trial 118 pruned. 
2026-05-14 00:25:32,722 - optuna.study._optimize - INFO - Trial 119 pruned. 
2026-05-14 00:25:36,942 - optuna.study._optimize - INFO - Trial 120 pruned. 
2026-05-14 00:25:41,470 - optuna.study._optimize - INFO - Trial 121 pruned. 
2026-05-14 00:26:15,530 - optuna.study.study - INFO - Trial 122 finished with value: 0.05369379462509159 and parameters: {'n_layers': 1, 'embedding_dim': 128, 'lr': 0.00038309455949329946, 'lambda_val': 0.0021638356114648876, 'batch_size': 2691, 'optimizer': 'RMSprop'}. Best is trial 101 with value: 0.09153790586425585.
2026-05-14 00:26:21,404 - optuna.study._optimize - INFO - Trial 123 pruned. 
2026-05-14 00:26:26,122 - optuna.study._optimize - INFO - Trial 124 pruned. 
2026-05-14 00:26:57,902 - optuna.study.study - INFO - Trial 125 finished with value: 0.07961380848745225 and parameters: {'n_layers': 1, 'embedding_dim': 128, 'lr': 0.007857848815564714, 'lambda_val': 0.002928871591040432, 'batch_size': 3021, 'optimizer': 'RMSprop'}. Best is trial 101 with value: 0.09153790586425585.
2026-05-14 00:27:01,765 - optuna.study._optimize - INFO - Trial 126 pruned. 
2026-05-14 00:27:16,891 - optuna.study._optimize - INFO - Trial 127 pruned. 
2026-05-14 00:27:21,115 - optuna.study._optimize - INFO - Trial 128 pruned. 
2026-05-14 00:27:25,587 - optuna.study._optimize - INFO - Trial 129 pruned. 
2026-05-14 00:27:29,640 - optuna.study._optimize - INFO - Trial 130 pruned. 
2026-05-14 00:28:00,292 - optuna.study.study - INFO - Trial 131 finished with value: 0.08222090771926567 and parameters: {'n_layers': 1, 'embedding_dim': 128, 'lr': 0.013259732643691591, 'lambda_val': 0.001300641037668746, 'batch_size': 2515, 'optimizer': 'RMSprop'}. Best is trial 101 with value: 0.09153790586425585.
2026-05-14 00:28:04,829 - optuna.study._optimize - INFO - Trial 132 pruned. 
2026-05-14 00:28:08,970 - optuna.study._optimize - INFO - Trial 133 pruned. 
2026-05-14 00:28:13,111 - optuna.study._optimize - INFO - Trial 134 pruned. 
2026-05-14 00:28:17,607 - optuna.study._optimize - INFO - Trial 135 pruned. 
2026-05-14 00:28:21,635 - optuna.study._optimize - INFO - Trial 136 pruned. 
2026-05-14 00:28:26,138 - optuna.study._optimize - INFO - Trial 137 pruned. 
2026-05-14 00:28:30,334 - optuna.study._optimize - INFO - Trial 138 pruned. 
2026-05-14 00:28:34,396 - optuna.study._optimize - INFO - Trial 139 pruned. 
2026-05-14 00:28:38,746 - optuna.study._optimize - INFO - Trial 140 pruned. 
2026-05-14 00:28:56,144 - optuna.study._optimize - INFO - Trial 141 pruned. 
2026-05-14 00:29:27,771 - optuna.study.study - INFO - Trial 142 finished with value: 0.08876611004053099 and parameters: {'n_layers': 1, 'embedding_dim': 128, 'lr': 0.006829419723818855, 'lambda_val': 0.001791585423437903, 'batch_size': 2952, 'optimizer': 'RMSprop'}. Best is trial 101 with value: 0.09153790586425585.
2026-05-14 00:29:58,521 - optuna.study.study - INFO - Trial 143 finished with value: 0.08113749536589974 and parameters: {'n_layers': 1, 'embedding_dim': 128, 'lr': 0.010499737336877686, 'lambda_val': 0.0024969161386875728, 'batch_size': 2956, 'optimizer': 'RMSprop'}. Best is trial 101 with value: 0.09153790586425585.
2026-05-14 00:30:02,650 - optuna.study._optimize - INFO - Trial 144 pruned. 
2026-05-14 00:30:06,426 - optuna.study._optimize - INFO - Trial 145 pruned. 
2026-05-14 00:30:10,258 - optuna.study._optimize - INFO - Trial 146 pruned. 
2026-05-14 00:30:37,854 - optuna.study.study - INFO - Trial 147 finished with value: 0.08908076941484706 and parameters: {'n_layers': 1, 'embedding_dim': 128, 'lr': 0.013077895490724979, 'lambda_val': 0.0021352252329046475, 'batch_size': 2540, 'optimizer': 'RMSprop'}. Best is trial 101 with value: 0.09153790586425585.
2026-05-14 00:30:41,869 - optuna.study._optimize - INFO - Trial 148 pruned. 
2026-05-14 00:30:45,538 - optuna.study._optimize - INFO - Trial 149 pruned. 
2026-05-14 00:30:50,445 - optuna.study._optimize - INFO - Trial 150 pruned. 
2026-05-14 00:30:54,461 - optuna.study._optimize - INFO - Trial 151 pruned. 
2026-05-14 00:30:57,956 - optuna.study._optimize - INFO - Trial 152 pruned. 
2026-05-14 00:31:01,601 - optuna.study._optimize - INFO - Trial 153 pruned. 
2026-05-14 00:31:05,854 - optuna.study._optimize - INFO - Trial 154 pruned. 
2026-05-14 00:31:11,998 - optuna.study._optimize - INFO - Trial 155 pruned. 
2026-05-14 00:31:42,800 - optuna.study.study - INFO - Trial 156 finished with value: 0.08347178477190184 and parameters: {'n_layers': 1, 'embedding_dim': 128, 'lr': 0.006672166945966375, 'lambda_val': 0.0019209099030506316, 'batch_size': 2586, 'optimizer': 'RMSprop'}. Best is trial 101 with value: 0.09153790586425585.
2026-05-14 00:32:13,895 - optuna.study.study - INFO - Trial 157 finished with value: 0.081005399904763 and parameters: {'n_layers': 1, 'embedding_dim': 128, 'lr': 0.006571981807047158, 'lambda_val': 0.002133959063787512, 'batch_size': 2589, 'optimizer': 'RMSprop'}. Best is trial 101 with value: 0.09153790586425585.
2026-05-14 00:32:18,276 - optuna.study._optimize - INFO - Trial 158 pruned. 
2026-05-14 00:32:22,711 - optuna.study._optimize - INFO - Trial 159 pruned. 
2026-05-14 00:32:33,906 - optuna.study._optimize - INFO - Trial 160 pruned. 
2026-05-14 00:33:05,422 - optuna.study.study - INFO - Trial 161 finished with value: 0.0853701576378506 and parameters: {'n_layers': 1, 'embedding_dim': 128, 'lr': 0.01080813483999, 'lambda_val': 0.001545351354202422, 'batch_size': 2532, 'optimizer': 'RMSprop'}. Best is trial 101 with value: 0.09153790586425585.
2026-05-14 00:33:37,386 - optuna.study.study - INFO - Trial 162 finished with value: 0.08616274289546319 and parameters: {'n_layers': 1, 'embedding_dim': 128, 'lr': 0.010238843220544261, 'lambda_val': 0.0016483667564080205, 'batch_size': 2361, 'optimizer': 'RMSprop'}. Best is trial 101 with value: 0.09153790586425585.
2026-05-14 00:33:41,715 - optuna.study._optimize - INFO - Trial 163 pruned. 
2026-05-14 00:34:13,179 - optuna.study.study - INFO - Trial 164 finished with value: 0.08436596644480981 and parameters: {'n_layers': 1, 'embedding_dim': 128, 'lr': 0.01113024594374923, 'lambda_val': 0.0014226514775313552, 'batch_size': 2367, 'optimizer': 'RMSprop'}. Best is trial 101 with value: 0.09153790586425585.
2026-05-14 00:34:44,325 - optuna.study.study - INFO - Trial 165 finished with value: 0.08406034074055299 and parameters: {'n_layers': 1, 'embedding_dim': 128, 'lr': 0.010867676683369376, 'lambda_val': 0.0014696944661237697, 'batch_size': 2395, 'optimizer': 'RMSprop'}. Best is trial 101 with value: 0.09153790586425585.
2026-05-14 00:34:48,345 - optuna.study._optimize - INFO - Trial 166 pruned. 
2026-05-14 00:34:54,515 - optuna.study._optimize - INFO - Trial 167 pruned. 
2026-05-14 00:34:58,602 - optuna.study._optimize - INFO - Trial 168 pruned. 
2026-05-14 00:35:06,502 - optuna.study._optimize - INFO - Trial 169 pruned. 
2026-05-14 00:35:10,739 - optuna.study._optimize - INFO - Trial 170 pruned. 
2026-05-14 00:35:14,728 - optuna.study._optimize - INFO - Trial 171 pruned. 
2026-05-14 00:35:22,011 - optuna.study._optimize - INFO - Trial 172 pruned. 
2026-05-14 00:35:26,109 - optuna.study._optimize - INFO - Trial 173 pruned. 
2026-05-14 00:35:30,616 - optuna.study._optimize - INFO - Trial 174 pruned. 
2026-05-14 00:35:34,619 - optuna.study._optimize - INFO - Trial 175 pruned. 
2026-05-14 00:35:38,644 - optuna.study._optimize - INFO - Trial 176 pruned. 
2026-05-14 00:36:10,148 - optuna.study.study - INFO - Trial 177 finished with value: 0.08689845699734394 and parameters: {'n_layers': 1, 'embedding_dim': 128, 'lr': 0.007466612550730424, 'lambda_val': 0.0017234268048641932, 'batch_size': 2651, 'optimizer': 'RMSprop'}. Best is trial 101 with value: 0.09153790586425585.
2026-05-14 00:36:14,614 - optuna.study._optimize - INFO - Trial 178 pruned. 
2026-05-14 00:36:18,855 - optuna.study._optimize - INFO - Trial 179 pruned. 
2026-05-14 00:36:23,097 - optuna.study._optimize - INFO - Trial 180 pruned. 
2026-05-14 00:36:54,550 - optuna.study.study - INFO - Trial 181 finished with value: 0.08330015323880206 and parameters: {'n_layers': 1, 'embedding_dim': 128, 'lr': 0.01139059827174891, 'lambda_val': 0.0012519867103148103, 'batch_size': 2386, 'optimizer': 'RMSprop'}. Best is trial 101 with value: 0.09153790586425585.
2026-05-14 00:36:58,514 - optuna.study._optimize - INFO - Trial 182 pruned. 
2026-05-14 00:37:03,208 - optuna.study._optimize - INFO - Trial 183 pruned. 
2026-05-14 00:37:08,495 - optuna.study._optimize - INFO - Trial 184 pruned. 
2026-05-14 00:37:13,052 - optuna.study._optimize - INFO - Trial 185 pruned. 
2026-05-14 00:37:17,437 - optuna.study._optimize - INFO - Trial 186 pruned. 
2026-05-14 00:37:22,024 - optuna.study._optimize - INFO - Trial 187 pruned. 
2026-05-14 00:37:25,631 - optuna.study._optimize - INFO - Trial 188 pruned. 
2026-05-14 00:37:29,566 - optuna.study._optimize - INFO - Trial 189 pruned. 
2026-05-14 00:37:34,899 - optuna.study._optimize - INFO - Trial 190 pruned. 
2026-05-14 00:37:39,428 - optuna.study._optimize - INFO - Trial 191 pruned. 
2026-05-14 00:37:43,814 - optuna.study._optimize - INFO - Trial 192 pruned. 
2026-05-14 00:37:48,211 - optuna.study._optimize - INFO - Trial 193 pruned. 
2026-05-14 00:37:52,220 - optuna.study._optimize - INFO - Trial 194 pruned. 
2026-05-14 00:37:56,375 - optuna.study._optimize - INFO - Trial 195 pruned. 
2026-05-14 00:38:00,629 - optuna.study._optimize - INFO - Trial 196 pruned. 
2026-05-14 00:38:04,910 - optuna.study._optimize - INFO - Trial 197 pruned. 
2026-05-14 00:38:09,112 - optuna.study._optimize - INFO - Trial 198 pruned. 
2026-05-14 00:38:13,602 - optuna.study._optimize - INFO - Trial 199 pruned. 
2026-05-14 00:38:36,316 - root - INFO -   **** Training e_100K_1c3dcs_rand4
2026-05-14 00:38:36,327 - root - INFO -   **** Getting 56335/65410 random edges
2026-05-14 00:38:36,634 - optuna.storages._rdb.storage - INFO - A new study created in RDB with name: Study_e_100K_1c3dcs_rand4
2026-05-14 00:39:09,394 - optuna.study.study - INFO - Trial 0 finished with value: 0.047777991829789375 and parameters: {'n_layers': 1, 'embedding_dim': 32, 'lr': 0.026830293791969047, 'lambda_val': 0.0001893797470024978, 'batch_size': 3836, 'optimizer': 'RMSprop'}. Best is trial 0 with value: 0.047777991829789375.
2026-05-14 00:40:00,480 - optuna.study.study - INFO - Trial 1 finished with value: 0.0026875578488248144 and parameters: {'n_layers': 3, 'embedding_dim': 256, 'lr': 0.06087857593475237, 'lambda_val': 0.0020275211805990314, 'batch_size': 2855, 'optimizer': 'SGD'}. Best is trial 0 with value: 0.047777991829789375.
2026-05-14 00:40:34,897 - optuna.study.study - INFO - Trial 2 finished with value: 0.017671718000145196 and parameters: {'n_layers': 3, 'embedding_dim': 32, 'lr': 3.360369458719152e-05, 'lambda_val': 0.0018006730400987336, 'batch_size': 3900, 'optimizer': 'Adam'}. Best is trial 0 with value: 0.047777991829789375.
2026-05-14 00:41:08,491 - optuna.study.study - INFO - Trial 3 finished with value: 0.0015698121327487225 and parameters: {'n_layers': 4, 'embedding_dim': 32, 'lr': 0.008118506224804593, 'lambda_val': 0.00333283285685293, 'batch_size': 558, 'optimizer': 'SGD'}. Best is trial 0 with value: 0.047777991829789375.
2026-05-14 00:41:40,291 - optuna.study.study - INFO - Trial 4 finished with value: 0.0017403348610540268 and parameters: {'n_layers': 3, 'embedding_dim': 32, 'lr': 0.0009307450320570264, 'lambda_val': 2.02370286120961e-06, 'batch_size': 948, 'optimizer': 'SGD'}. Best is trial 0 with value: 0.047777991829789375.
2026-05-14 00:42:09,261 - optuna.study.study - INFO - Trial 5 finished with value: 0.05495128549807488 and parameters: {'n_layers': 1, 'embedding_dim': 64, 'lr': 0.000729287674097184, 'lambda_val': 0.0004221363448137569, 'batch_size': 945, 'optimizer': 'Adam'}. Best is trial 5 with value: 0.05495128549807488.
2026-05-14 00:42:38,596 - optuna.study.study - INFO - Trial 6 finished with value: 0.05689499573987879 and parameters: {'n_layers': 1, 'embedding_dim': 96, 'lr': 0.001851608869383669, 'lambda_val': 0.008388240124968417, 'batch_size': 1407, 'optimizer': 'RMSprop'}. Best is trial 6 with value: 0.05689499573987879.
2026-05-14 00:43:15,385 - optuna.study.study - INFO - Trial 7 finished with value: 0.03406833499222964 and parameters: {'n_layers': 3, 'embedding_dim': 96, 'lr': 0.010015000622461218, 'lambda_val': 0.00017159427650341997, 'batch_size': 730, 'optimizer': 'Adam'}. Best is trial 6 with value: 0.05689499573987879.
2026-05-14 00:43:19,085 - optuna.study._optimize - INFO - Trial 8 pruned. 
2026-05-14 00:43:23,674 - optuna.study._optimize - INFO - Trial 9 pruned. 
2026-05-14 00:43:28,159 - optuna.study._optimize - INFO - Trial 10 pruned. 
2026-05-14 00:43:59,676 - optuna.study.study - INFO - Trial 11 finished with value: 0.030774422793333898 and parameters: {'n_layers': 2, 'embedding_dim': 64, 'lr': 0.0009788133281865518, 'lambda_val': 1.1122294554363242e-05, 'batch_size': 1204, 'optimizer': 'RMSprop'}. Best is trial 6 with value: 0.05689499573987879.
2026-05-14 00:44:30,166 - optuna.study.study - INFO - Trial 12 finished with value: 0.020628612025911295 and parameters: {'n_layers': 1, 'embedding_dim': 64, 'lr': 0.00025309088137785, 'lambda_val': 0.05098444851466336, 'batch_size': 2717, 'optimizer': 'Adam'}. Best is trial 6 with value: 0.05689499573987879.
2026-05-14 00:45:03,891 - optuna.study.study - INFO - Trial 13 finished with value: 0.02028944395961547 and parameters: {'n_layers': 2, 'embedding_dim': 96, 'lr': 0.00020223615914997492, 'lambda_val': 0.006754165496864792, 'batch_size': 1426, 'optimizer': 'RMSprop'}. Best is trial 6 with value: 0.05689499573987879.
