2026-05-13 19:03:29,426 - optuna.study.study - INFO - Trial 94 finished with value: 0.08283325339779811 and parameters: {'n_layers': 1, 'embedding_dim': 256, 'lr': 0.004918466238530048, 'lambda_val': 0.003595112390063195, 'batch_size': 1448, 'optimizer': 'RMSprop'}. Best is trial 87 with value: 0.08486166748328945.
2026-05-13 19:03:33,688 - optuna.study._optimize - INFO - Trial 95 pruned. 
2026-05-13 19:04:06,824 - optuna.study.study - INFO - Trial 96 finished with value: 0.08494733790071028 and parameters: {'n_layers': 1, 'embedding_dim': 256, 'lr': 0.004201991364117342, 'lambda_val': 0.001438942810360582, 'batch_size': 1298, 'optimizer': 'RMSprop'}. Best is trial 96 with value: 0.08494733790071028.
2026-05-13 19:04:10,989 - optuna.study._optimize - INFO - Trial 97 pruned. 
2026-05-13 19:04:44,392 - optuna.study.study - INFO - Trial 98 finished with value: 0.07889912401844247 and parameters: {'n_layers': 1, 'embedding_dim': 256, 'lr': 0.0025602014874666168, 'lambda_val': 0.0014284998743216237, 'batch_size': 1058, 'optimizer': 'RMSprop'}. Best is trial 96 with value: 0.08494733790071028.
2026-05-13 19:04:49,162 - optuna.study._optimize - INFO - Trial 99 pruned. 
2026-05-13 19:04:53,579 - optuna.study._optimize - INFO - Trial 100 pruned. 
2026-05-13 19:05:28,092 - optuna.study.study - INFO - Trial 101 finished with value: 0.08092741462870635 and parameters: {'n_layers': 1, 'embedding_dim': 256, 'lr': 0.003493300673494829, 'lambda_val': 0.0035442209367064206, 'batch_size': 1442, 'optimizer': 'RMSprop'}. Best is trial 96 with value: 0.08494733790071028.
2026-05-13 19:06:01,089 - optuna.study.study - INFO - Trial 102 finished with value: 0.09184189949385436 and parameters: {'n_layers': 1, 'embedding_dim': 256, 'lr': 0.008017727251329057, 'lambda_val': 0.0009450321448432738, 'batch_size': 1597, 'optimizer': 'RMSprop'}. Best is trial 102 with value: 0.09184189949385436.
2026-05-13 19:06:41,618 - optuna.study.study - INFO - Trial 103 finished with value: 0.08182130177446532 and parameters: {'n_layers': 1, 'embedding_dim': 256, 'lr': 0.007990135080755838, 'lambda_val': 0.000834591975217543, 'batch_size': 1543, 'optimizer': 'RMSprop'}. Best is trial 102 with value: 0.09184189949385436.
2026-05-13 19:06:55,488 - optuna.study._optimize - INFO - Trial 104 pruned. 
2026-05-13 19:07:27,053 - optuna.study.study - INFO - Trial 105 finished with value: 0.0835050228501653 and parameters: {'n_layers': 1, 'embedding_dim': 256, 'lr': 0.005553880696089497, 'lambda_val': 0.001096015112013878, 'batch_size': 1664, 'optimizer': 'RMSprop'}. Best is trial 102 with value: 0.09184189949385436.
2026-05-13 19:07:32,979 - optuna.study._optimize - INFO - Trial 106 pruned. 
2026-05-13 19:08:04,175 - optuna.study.study - INFO - Trial 107 finished with value: 0.08392928166602222 and parameters: {'n_layers': 1, 'embedding_dim': 256, 'lr': 0.005411274132399745, 'lambda_val': 0.0024932881517265534, 'batch_size': 1784, 'optimizer': 'RMSprop'}. Best is trial 102 with value: 0.09184189949385436.
2026-05-13 19:08:36,915 - optuna.study.study - INFO - Trial 108 finished with value: 0.08777177806632022 and parameters: {'n_layers': 1, 'embedding_dim': 256, 'lr': 0.005772562765326377, 'lambda_val': 0.001407540637958467, 'batch_size': 1787, 'optimizer': 'RMSprop'}. Best is trial 102 with value: 0.09184189949385436.
2026-05-13 19:08:40,791 - optuna.study._optimize - INFO - Trial 109 pruned. 
2026-05-13 19:09:14,837 - optuna.study.study - INFO - Trial 110 finished with value: 0.08472856654082334 and parameters: {'n_layers': 1, 'embedding_dim': 256, 'lr': 0.00017050194528995415, 'lambda_val': 0.001382722625465967, 'batch_size': 1656, 'optimizer': 'RMSprop'}. Best is trial 102 with value: 0.09184189949385436.
2026-05-13 19:09:48,732 - optuna.study.study - INFO - Trial 111 finished with value: 0.08776099070626674 and parameters: {'n_layers': 1, 'embedding_dim': 256, 'lr': 0.005990157251723808, 'lambda_val': 0.0014696030821409823, 'batch_size': 1682, 'optimizer': 'RMSprop'}. Best is trial 102 with value: 0.09184189949385436.
2026-05-13 19:10:22,288 - optuna.study.study - INFO - Trial 112 finished with value: 0.06039323531533262 and parameters: {'n_layers': 1, 'embedding_dim': 256, 'lr': 0.00018990494886931612, 'lambda_val': 0.0014569572832631747, 'batch_size': 1652, 'optimizer': 'RMSprop'}. Best is trial 102 with value: 0.09184189949385436.
2026-05-13 19:10:54,812 - optuna.study.study - INFO - Trial 113 finished with value: 0.10714132484426218 and parameters: {'n_layers': 1, 'embedding_dim': 256, 'lr': 0.00011732568031027821, 'lambda_val': 0.000986834499706078, 'batch_size': 1541, 'optimizer': 'RMSprop'}. Best is trial 113 with value: 0.10714132484426218.
2026-05-13 19:10:59,286 - optuna.study._optimize - INFO - Trial 114 pruned. 
2026-05-13 19:11:04,254 - optuna.study._optimize - INFO - Trial 115 pruned. 
2026-05-13 19:11:33,826 - optuna.study.study - INFO - Trial 116 finished with value: 0.10848587534131236 and parameters: {'n_layers': 1, 'embedding_dim': 128, 'lr': 0.00014339273872079742, 'lambda_val': 0.0005934174818378209, 'batch_size': 1577, 'optimizer': 'RMSprop'}. Best is trial 116 with value: 0.10848587534131236.
2026-05-13 19:12:03,403 - optuna.study.study - INFO - Trial 117 finished with value: 0.08579590194388936 and parameters: {'n_layers': 1, 'embedding_dim': 128, 'lr': 0.00017083442965345767, 'lambda_val': 0.0006183456649298241, 'batch_size': 1790, 'optimizer': 'RMSprop'}. Best is trial 116 with value: 0.10848587534131236.
2026-05-13 19:12:33,341 - optuna.study.study - INFO - Trial 118 finished with value: 0.08270725468385735 and parameters: {'n_layers': 1, 'embedding_dim': 128, 'lr': 0.00021530321124780933, 'lambda_val': 0.0003923631669097605, 'batch_size': 1318, 'optimizer': 'RMSprop'}. Best is trial 116 with value: 0.10848587534131236.
2026-05-13 19:12:37,219 - optuna.study._optimize - INFO - Trial 119 pruned. 
2026-05-13 19:13:11,265 - optuna.study.study - INFO - Trial 120 finished with value: 0.10748588045648778 and parameters: {'n_layers': 1, 'embedding_dim': 256, 'lr': 0.00015350993449031211, 'lambda_val': 0.0005822047103544624, 'batch_size': 1157, 'optimizer': 'RMSprop'}. Best is trial 116 with value: 0.10848587534131236.
2026-05-13 19:13:52,814 - optuna.study.study - INFO - Trial 121 finished with value: 0.10559991177498734 and parameters: {'n_layers': 1, 'embedding_dim': 128, 'lr': 0.0001568996214830471, 'lambda_val': 0.0006789185557519778, 'batch_size': 1224, 'optimizer': 'RMSprop'}. Best is trial 116 with value: 0.10848587534131236.
2026-05-13 19:14:22,186 - optuna.study.study - INFO - Trial 122 finished with value: 0.12625597394350613 and parameters: {'n_layers': 1, 'embedding_dim': 128, 'lr': 0.00015348346499832142, 'lambda_val': 0.00030480092867860915, 'batch_size': 1155, 'optimizer': 'RMSprop'}. Best is trial 122 with value: 0.12625597394350613.
2026-05-13 19:14:51,147 - optuna.study.study - INFO - Trial 123 finished with value: 0.1265739150514742 and parameters: {'n_layers': 1, 'embedding_dim': 128, 'lr': 0.0001541184389187012, 'lambda_val': 0.00014645218979592235, 'batch_size': 1167, 'optimizer': 'RMSprop'}. Best is trial 123 with value: 0.1265739150514742.
2026-05-13 19:15:20,461 - optuna.study.study - INFO - Trial 124 finished with value: 0.07729000211954376 and parameters: {'n_layers': 1, 'embedding_dim': 128, 'lr': 0.000269402067431158, 'lambda_val': 0.0003051106395799352, 'batch_size': 1188, 'optimizer': 'RMSprop'}. Best is trial 123 with value: 0.1265739150514742.
2026-05-13 19:15:26,900 - optuna.study._optimize - INFO - Trial 125 pruned. 
2026-05-13 19:15:36,205 - optuna.study._optimize - INFO - Trial 126 pruned. 
2026-05-13 19:16:05,079 - optuna.study.study - INFO - Trial 127 finished with value: 0.06713796825971377 and parameters: {'n_layers': 1, 'embedding_dim': 128, 'lr': 0.0004162533257513828, 'lambda_val': 3.064553918074856e-05, 'batch_size': 707, 'optimizer': 'RMSprop'}. Best is trial 123 with value: 0.1265739150514742.
2026-05-13 19:16:35,109 - optuna.study.study - INFO - Trial 128 finished with value: 0.07866246896864974 and parameters: {'n_layers': 1, 'embedding_dim': 128, 'lr': 0.0002644814175659151, 'lambda_val': 0.0005780668619570973, 'batch_size': 946, 'optimizer': 'RMSprop'}. Best is trial 123 with value: 0.1265739150514742.
2026-05-13 19:16:38,740 - optuna.study._optimize - INFO - Trial 129 pruned. 
2026-05-13 19:16:43,101 - optuna.study._optimize - INFO - Trial 130 pruned. 
2026-05-13 19:17:14,274 - optuna.study.study - INFO - Trial 131 finished with value: 0.11504429910594911 and parameters: {'n_layers': 1, 'embedding_dim': 128, 'lr': 0.00015588554164681705, 'lambda_val': 0.0008050033084811347, 'batch_size': 1288, 'optimizer': 'RMSprop'}. Best is trial 123 with value: 0.1265739150514742.
2026-05-13 19:17:17,993 - optuna.study._optimize - INFO - Trial 132 pruned. 
2026-05-13 19:17:46,367 - optuna.study.study - INFO - Trial 133 finished with value: 0.06645811373872434 and parameters: {'n_layers': 1, 'embedding_dim': 128, 'lr': 0.0003208966305555462, 'lambda_val': 0.00019831022914095373, 'batch_size': 1281, 'optimizer': 'RMSprop'}. Best is trial 123 with value: 0.1265739150514742.
2026-05-13 19:17:50,059 - optuna.study._optimize - INFO - Trial 134 pruned. 
2026-05-13 19:17:53,956 - optuna.study._optimize - INFO - Trial 135 pruned. 
2026-05-13 19:18:23,740 - optuna.study.study - INFO - Trial 136 finished with value: 0.0868815035769759 and parameters: {'n_layers': 1, 'embedding_dim': 128, 'lr': 0.0001980782650573769, 'lambda_val': 0.0005738913566442807, 'batch_size': 1291, 'optimizer': 'RMSprop'}. Best is trial 123 with value: 0.1265739150514742.
2026-05-13 19:19:01,277 - optuna.study.study - INFO - Trial 137 finished with value: 0.12433513323939754 and parameters: {'n_layers': 1, 'embedding_dim': 128, 'lr': 0.0001377982063402541, 'lambda_val': 0.0004439426749214433, 'batch_size': 1288, 'optimizer': 'RMSprop'}. Best is trial 123 with value: 0.1265739150514742.
2026-05-13 19:19:31,897 - optuna.study.study - INFO - Trial 138 finished with value: 0.08606907993083611 and parameters: {'n_layers': 1, 'embedding_dim': 128, 'lr': 0.00021186683885104633, 'lambda_val': 5.415790331860193e-05, 'batch_size': 1306, 'optimizer': 'RMSprop'}. Best is trial 123 with value: 0.1265739150514742.
2026-05-13 19:20:02,400 - optuna.study.study - INFO - Trial 139 finished with value: 0.11880961382971669 and parameters: {'n_layers': 1, 'embedding_dim': 128, 'lr': 0.00020306183154854832, 'lambda_val': 2.5205909218456943e-05, 'batch_size': 1005, 'optimizer': 'RMSprop'}. Best is trial 123 with value: 0.1265739150514742.
2026-05-13 19:20:33,481 - optuna.study.study - INFO - Trial 140 finished with value: 0.10973334900427241 and parameters: {'n_layers': 1, 'embedding_dim': 128, 'lr': 0.00021835135642185482, 'lambda_val': 1.1893852567100219e-05, 'batch_size': 839, 'optimizer': 'RMSprop'}. Best is trial 123 with value: 0.1265739150514742.
2026-05-13 19:21:03,162 - optuna.study.study - INFO - Trial 141 finished with value: 0.11345916073334644 and parameters: {'n_layers': 1, 'embedding_dim': 128, 'lr': 0.00021405533957669228, 'lambda_val': 1.1708929165961296e-05, 'batch_size': 825, 'optimizer': 'RMSprop'}. Best is trial 123 with value: 0.1265739150514742.
2026-05-13 19:21:09,048 - optuna.study._optimize - INFO - Trial 142 pruned. 
2026-05-13 19:21:37,974 - optuna.study.study - INFO - Trial 143 finished with value: 0.1022160190094175 and parameters: {'n_layers': 1, 'embedding_dim': 128, 'lr': 0.0002533864684119128, 'lambda_val': 4.142064100830208e-06, 'batch_size': 794, 'optimizer': 'RMSprop'}. Best is trial 123 with value: 0.1265739150514742.
2026-05-13 19:22:06,821 - optuna.study.study - INFO - Trial 144 finished with value: 0.10162052710082739 and parameters: {'n_layers': 1, 'embedding_dim': 128, 'lr': 0.0002485089805531215, 'lambda_val': 3.5790206030609663e-06, 'batch_size': 865, 'optimizer': 'RMSprop'}. Best is trial 123 with value: 0.1265739150514742.
2026-05-13 19:22:34,492 - optuna.study.study - INFO - Trial 145 finished with value: 0.06999276256126169 and parameters: {'n_layers': 1, 'embedding_dim': 128, 'lr': 0.00029363281260924443, 'lambda_val': 2.6821039493858777e-06, 'batch_size': 854, 'optimizer': 'RMSprop'}. Best is trial 123 with value: 0.1265739150514742.
2026-05-13 19:23:05,566 - optuna.study.study - INFO - Trial 146 finished with value: 0.10909481913811064 and parameters: {'n_layers': 1, 'embedding_dim': 128, 'lr': 0.00024074612770292898, 'lambda_val': 4.354254955120362e-06, 'batch_size': 757, 'optimizer': 'RMSprop'}. Best is trial 123 with value: 0.1265739150514742.
2026-05-13 19:23:39,096 - optuna.study.study - INFO - Trial 147 finished with value: 0.10557070277979945 and parameters: {'n_layers': 1, 'embedding_dim': 128, 'lr': 0.00023863900739928923, 'lambda_val': 8.986265126569313e-06, 'batch_size': 773, 'optimizer': 'RMSprop'}. Best is trial 123 with value: 0.1265739150514742.
2026-05-13 19:24:07,946 - optuna.study.study - INFO - Trial 148 finished with value: 0.05928646263879529 and parameters: {'n_layers': 1, 'embedding_dim': 128, 'lr': 0.0005091750225764748, 'lambda_val': 5.020719966491777e-06, 'batch_size': 777, 'optimizer': 'RMSprop'}. Best is trial 123 with value: 0.1265739150514742.
2026-05-13 19:24:37,160 - optuna.study.study - INFO - Trial 149 finished with value: 0.1253529593356891 and parameters: {'n_layers': 1, 'embedding_dim': 128, 'lr': 0.00023128915504493382, 'lambda_val': 1.3657815155926015e-05, 'batch_size': 525, 'optimizer': 'RMSprop'}. Best is trial 123 with value: 0.1265739150514742.
2026-05-13 19:24:41,267 - optuna.study._optimize - INFO - Trial 150 pruned. 
2026-05-13 19:25:06,947 - optuna.study.study - INFO - Trial 151 finished with value: 0.10505846422703477 and parameters: {'n_layers': 1, 'embedding_dim': 128, 'lr': 0.0002509629074970151, 'lambda_val': 6.359324541903054e-06, 'batch_size': 606, 'optimizer': 'RMSprop'}. Best is trial 123 with value: 0.1265739150514742.
2026-05-13 19:25:31,969 - optuna.study.study - INFO - Trial 152 finished with value: 0.12697212399097862 and parameters: {'n_layers': 1, 'embedding_dim': 128, 'lr': 0.00023210210537450674, 'lambda_val': 8.640394681897337e-06, 'batch_size': 562, 'optimizer': 'RMSprop'}. Best is trial 152 with value: 0.12697212399097862.
2026-05-13 19:25:35,703 - optuna.study._optimize - INFO - Trial 153 pruned. 
2026-05-13 19:25:39,192 - optuna.study._optimize - INFO - Trial 154 pruned. 
2026-05-13 19:25:42,735 - optuna.study._optimize - INFO - Trial 155 pruned. 
2026-05-13 19:26:10,744 - optuna.study.study - INFO - Trial 156 finished with value: 0.12383143260041346 and parameters: {'n_layers': 1, 'embedding_dim': 128, 'lr': 0.00022086538710239684, 'lambda_val': 6.655437812979554e-06, 'batch_size': 642, 'optimizer': 'RMSprop'}. Best is trial 152 with value: 0.12697212399097862.
2026-05-13 19:26:26,900 - optuna.study._optimize - INFO - Trial 157 pruned. 
2026-05-13 19:26:58,272 - optuna.study.study - INFO - Trial 158 finished with value: 0.0586472040452041 and parameters: {'n_layers': 1, 'embedding_dim': 128, 'lr': 0.0006244230368545233, 'lambda_val': 1.1215316414568182e-05, 'batch_size': 750, 'optimizer': 'RMSprop'}. Best is trial 152 with value: 0.12697212399097862.
2026-05-13 19:27:28,739 - optuna.study.study - INFO - Trial 159 finished with value: 0.10868437424364595 and parameters: {'n_layers': 1, 'embedding_dim': 128, 'lr': 0.00019353632560332, 'lambda_val': 5.965365097105306e-06, 'batch_size': 1029, 'optimizer': 'RMSprop'}. Best is trial 152 with value: 0.12697212399097862.
2026-05-13 19:27:57,438 - optuna.study.study - INFO - Trial 160 finished with value: 0.11878796378194188 and parameters: {'n_layers': 1, 'embedding_dim': 128, 'lr': 0.0001776638747888823, 'lambda_val': 6.658737754897244e-06, 'batch_size': 1022, 'optimizer': 'RMSprop'}. Best is trial 152 with value: 0.12697212399097862.
2026-05-13 19:28:23,080 - optuna.study.study - INFO - Trial 161 finished with value: 0.12065703372836946 and parameters: {'n_layers': 1, 'embedding_dim': 128, 'lr': 0.00018563924188693214, 'lambda_val': 6.7967313979472555e-06, 'batch_size': 1013, 'optimizer': 'RMSprop'}. Best is trial 152 with value: 0.12697212399097862.
2026-05-13 19:28:50,771 - optuna.study.study - INFO - Trial 162 finished with value: 0.11877238559964756 and parameters: {'n_layers': 1, 'embedding_dim': 128, 'lr': 0.00018490799717693903, 'lambda_val': 7.685178782688732e-06, 'batch_size': 957, 'optimizer': 'RMSprop'}. Best is trial 152 with value: 0.12697212399097862.
2026-05-13 19:29:18,716 - optuna.study.study - INFO - Trial 163 finished with value: 0.10253130282817882 and parameters: {'n_layers': 1, 'embedding_dim': 128, 'lr': 0.00019581472833080492, 'lambda_val': 6.433019313068766e-06, 'batch_size': 998, 'optimizer': 'RMSprop'}. Best is trial 152 with value: 0.12697212399097862.
2026-05-13 19:29:48,007 - optuna.study.study - INFO - Trial 164 finished with value: 0.0620837278587806 and parameters: {'n_layers': 1, 'embedding_dim': 128, 'lr': 0.0003361718635609134, 'lambda_val': 1.2256552278108233e-05, 'batch_size': 1084, 'optimizer': 'RMSprop'}. Best is trial 152 with value: 0.12697212399097862.
2026-05-13 19:30:17,045 - optuna.study.study - INFO - Trial 165 finished with value: 0.10823715276525751 and parameters: {'n_layers': 1, 'embedding_dim': 128, 'lr': 0.0001864654982098118, 'lambda_val': 5.721535197275953e-06, 'batch_size': 913, 'optimizer': 'RMSprop'}. Best is trial 152 with value: 0.12697212399097862.
2026-05-13 19:30:46,738 - optuna.study.study - INFO - Trial 166 finished with value: 0.11740756766039383 and parameters: {'n_layers': 1, 'embedding_dim': 128, 'lr': 0.0001832073714646293, 'lambda_val': 2.1438847365838027e-05, 'batch_size': 913, 'optimizer': 'RMSprop'}. Best is trial 152 with value: 0.12697212399097862.
2026-05-13 19:31:15,186 - optuna.study.study - INFO - Trial 167 finished with value: 0.06570487198273525 and parameters: {'n_layers': 1, 'embedding_dim': 128, 'lr': 0.00045271806887813986, 'lambda_val': 2.4397930366773622e-05, 'batch_size': 966, 'optimizer': 'RMSprop'}. Best is trial 152 with value: 0.12697212399097862.
2026-05-13 19:31:45,722 - optuna.study.study - INFO - Trial 168 finished with value: 0.1251977259119666 and parameters: {'n_layers': 1, 'embedding_dim': 128, 'lr': 0.00021551819579335163, 'lambda_val': 7.681914373658632e-06, 'batch_size': 679, 'optimizer': 'RMSprop'}. Best is trial 152 with value: 0.12697212399097862.
2026-05-13 19:32:12,891 - optuna.study.study - INFO - Trial 169 finished with value: 0.11493103780252034 and parameters: {'n_layers': 1, 'embedding_dim': 128, 'lr': 0.0002202990351411485, 'lambda_val': 7.680230040806304e-06, 'batch_size': 828, 'optimizer': 'RMSprop'}. Best is trial 152 with value: 0.12697212399097862.
2026-05-13 19:32:39,598 - optuna.study.study - INFO - Trial 170 finished with value: 0.12936359834156722 and parameters: {'n_layers': 1, 'embedding_dim': 128, 'lr': 0.00021757424653365506, 'lambda_val': 7.352493556792165e-06, 'batch_size': 666, 'optimizer': 'RMSprop'}. Best is trial 170 with value: 0.12936359834156722.
2026-05-13 19:33:06,746 - optuna.study.study - INFO - Trial 171 finished with value: 0.08766372253954638 and parameters: {'n_layers': 1, 'embedding_dim': 128, 'lr': 0.00030944008560101116, 'lambda_val': 7.659400800781065e-06, 'batch_size': 669, 'optimizer': 'RMSprop'}. Best is trial 170 with value: 0.12936359834156722.
2026-05-13 19:33:33,674 - optuna.study.study - INFO - Trial 172 finished with value: 0.0889974899645666 and parameters: {'n_layers': 1, 'embedding_dim': 128, 'lr': 0.00022802425391800057, 'lambda_val': 4.236214329994683e-06, 'batch_size': 826, 'optimizer': 'RMSprop'}. Best is trial 170 with value: 0.12936359834156722.
2026-05-13 19:34:05,192 - optuna.study.study - INFO - Trial 173 finished with value: 0.06636555719420675 and parameters: {'n_layers': 1, 'embedding_dim': 128, 'lr': 0.0003932219513455399, 'lambda_val': 2.0607880000660972e-05, 'batch_size': 715, 'optimizer': 'RMSprop'}. Best is trial 170 with value: 0.12936359834156722.
2026-05-13 19:34:33,954 - optuna.study.study - INFO - Trial 174 finished with value: 0.07952560259649918 and parameters: {'n_layers': 1, 'embedding_dim': 128, 'lr': 0.0002872844515871145, 'lambda_val': 1.4049721230808189e-05, 'batch_size': 644, 'optimizer': 'RMSprop'}. Best is trial 170 with value: 0.12936359834156722.
2026-05-13 19:35:03,914 - optuna.study.study - INFO - Trial 175 finished with value: 0.12555324147456914 and parameters: {'n_layers': 1, 'embedding_dim': 128, 'lr': 0.0002193422422073327, 'lambda_val': 7.573288976307075e-06, 'batch_size': 532, 'optimizer': 'RMSprop'}. Best is trial 170 with value: 0.12936359834156722.
2026-05-13 19:35:07,982 - optuna.study._optimize - INFO - Trial 176 pruned. 
2026-05-13 19:35:39,415 - optuna.study.study - INFO - Trial 177 finished with value: 0.11720282235105069 and parameters: {'n_layers': 1, 'embedding_dim': 128, 'lr': 0.00018159011223090851, 'lambda_val': 1.1447937053965493e-05, 'batch_size': 911, 'optimizer': 'RMSprop'}. Best is trial 170 with value: 0.12936359834156722.
2026-05-13 19:35:42,990 - optuna.study._optimize - INFO - Trial 178 pruned. 
2026-05-13 19:35:46,962 - optuna.study._optimize - INFO - Trial 179 pruned. 
2026-05-13 19:35:50,737 - optuna.study._optimize - INFO - Trial 180 pruned. 
2026-05-13 19:36:20,504 - optuna.study.study - INFO - Trial 181 finished with value: 0.10969365370385718 and parameters: {'n_layers': 1, 'embedding_dim': 128, 'lr': 0.0002116975685888284, 'lambda_val': 1.1603749644149643e-05, 'batch_size': 822, 'optimizer': 'RMSprop'}. Best is trial 170 with value: 0.12936359834156722.
2026-05-13 19:36:50,409 - optuna.study.study - INFO - Trial 182 finished with value: 0.1140311236337686 and parameters: {'n_layers': 1, 'embedding_dim': 128, 'lr': 0.00017610962673610047, 'lambda_val': 9.460826073967303e-06, 'batch_size': 988, 'optimizer': 'RMSprop'}. Best is trial 170 with value: 0.12936359834156722.
