2026-05-13 14:44:50,396 - optuna.study.study - INFO - Trial 137 finished with value: 0.07442806077786286 and parameters: {'n_layers': 1, 'embedding_dim': 256, 'lr': 0.001460350763970732, 'lambda_val': 0.0013580797147510668, 'batch_size': 3298, 'optimizer': 'RMSprop'}. Best is trial 106 with value: 0.0837737998008057.
2026-05-13 14:45:26,031 - optuna.study.study - INFO - Trial 138 finished with value: 0.07506215499573762 and parameters: {'n_layers': 1, 'embedding_dim': 256, 'lr': 0.0036871677536959952, 'lambda_val': 0.0005876046245694474, 'batch_size': 3971, 'optimizer': 'RMSprop'}. Best is trial 106 with value: 0.0837737998008057.
2026-05-13 14:46:02,416 - optuna.study.study - INFO - Trial 139 finished with value: 0.08045472317018473 and parameters: {'n_layers': 1, 'embedding_dim': 256, 'lr': 0.005827125891882441, 'lambda_val': 0.0023412881772781904, 'batch_size': 4092, 'optimizer': 'RMSprop'}. Best is trial 106 with value: 0.0837737998008057.
2026-05-13 14:46:39,285 - optuna.study.study - INFO - Trial 140 finished with value: 0.07916711929534649 and parameters: {'n_layers': 1, 'embedding_dim': 256, 'lr': 0.005436233304871955, 'lambda_val': 0.0016189438648231576, 'batch_size': 4095, 'optimizer': 'RMSprop'}. Best is trial 106 with value: 0.0837737998008057.
2026-05-13 14:47:15,298 - optuna.study.study - INFO - Trial 141 finished with value: 0.08030377828729321 and parameters: {'n_layers': 1, 'embedding_dim': 256, 'lr': 0.004294762652873614, 'lambda_val': 0.0021393627856906667, 'batch_size': 3786, 'optimizer': 'RMSprop'}. Best is trial 106 with value: 0.0837737998008057.
2026-05-13 14:47:51,483 - optuna.study.study - INFO - Trial 142 finished with value: 0.08277141208818463 and parameters: {'n_layers': 1, 'embedding_dim': 256, 'lr': 0.0042023893985983825, 'lambda_val': 0.00220209102791038, 'batch_size': 3904, 'optimizer': 'RMSprop'}. Best is trial 106 with value: 0.0837737998008057.
2026-05-13 14:48:27,811 - optuna.study.study - INFO - Trial 143 finished with value: 0.07952464635555946 and parameters: {'n_layers': 1, 'embedding_dim': 256, 'lr': 0.0030624007651668967, 'lambda_val': 0.0022660559351219043, 'batch_size': 3886, 'optimizer': 'RMSprop'}. Best is trial 106 with value: 0.0837737998008057.
2026-05-13 14:49:03,591 - optuna.study.study - INFO - Trial 144 finished with value: 0.07739761867161832 and parameters: {'n_layers': 1, 'embedding_dim': 256, 'lr': 0.004265224658735718, 'lambda_val': 0.0029201426504670293, 'batch_size': 3777, 'optimizer': 'RMSprop'}. Best is trial 106 with value: 0.0837737998008057.
2026-05-13 14:49:39,805 - optuna.study.study - INFO - Trial 145 finished with value: 0.0795333216927362 and parameters: {'n_layers': 1, 'embedding_dim': 256, 'lr': 0.0024360517386009185, 'lambda_val': 0.0020179879324162477, 'batch_size': 3814, 'optimizer': 'RMSprop'}. Best is trial 106 with value: 0.0837737998008057.
2026-05-13 14:50:15,928 - optuna.study.study - INFO - Trial 146 finished with value: 0.07789284026721269 and parameters: {'n_layers': 1, 'embedding_dim': 256, 'lr': 0.0017241429722829984, 'lambda_val': 0.0014982256539687983, 'batch_size': 3997, 'optimizer': 'RMSprop'}. Best is trial 106 with value: 0.0837737998008057.
2026-05-13 14:50:51,887 - optuna.study.study - INFO - Trial 147 finished with value: 0.07367445529501476 and parameters: {'n_layers': 1, 'embedding_dim': 256, 'lr': 0.003928602264303057, 'lambda_val': 0.0007683242137323503, 'batch_size': 3607, 'optimizer': 'RMSprop'}. Best is trial 106 with value: 0.0837737998008057.
2026-05-13 14:50:56,315 - optuna.study._optimize - INFO - Trial 148 pruned. 
2026-05-13 14:51:32,380 - optuna.study.study - INFO - Trial 149 finished with value: 0.08254747436100916 and parameters: {'n_layers': 1, 'embedding_dim': 256, 'lr': 0.0031082972087976943, 'lambda_val': 0.002450893409885655, 'batch_size': 3902, 'optimizer': 'RMSprop'}. Best is trial 106 with value: 0.0837737998008057.
2026-05-13 14:51:36,995 - optuna.study._optimize - INFO - Trial 150 pruned. 
2026-05-13 14:52:13,491 - optuna.study.study - INFO - Trial 151 finished with value: 0.08250959241003054 and parameters: {'n_layers': 1, 'embedding_dim': 256, 'lr': 0.003123835070788144, 'lambda_val': 0.00319589269609962, 'batch_size': 3933, 'optimizer': 'RMSprop'}. Best is trial 106 with value: 0.0837737998008057.
2026-05-13 14:52:18,864 - optuna.study._optimize - INFO - Trial 152 pruned. 
2026-05-13 14:52:55,330 - optuna.study.study - INFO - Trial 153 finished with value: 0.08411445830273562 and parameters: {'n_layers': 1, 'embedding_dim': 256, 'lr': 0.005605276339134066, 'lambda_val': 0.003490693534125919, 'batch_size': 3929, 'optimizer': 'RMSprop'}. Best is trial 153 with value: 0.08411445830273562.
2026-05-13 14:53:32,043 - optuna.study.study - INFO - Trial 154 finished with value: 0.07933318340118119 and parameters: {'n_layers': 1, 'embedding_dim': 256, 'lr': 0.005410187753893904, 'lambda_val': 0.003258935310297883, 'batch_size': 3937, 'optimizer': 'RMSprop'}. Best is trial 153 with value: 0.08411445830273562.
2026-05-13 14:53:38,028 - optuna.study._optimize - INFO - Trial 155 pruned. 
2026-05-13 14:54:13,589 - optuna.study.study - INFO - Trial 156 finished with value: 0.07842408860845633 and parameters: {'n_layers': 1, 'embedding_dim': 256, 'lr': 0.0031232999129946646, 'lambda_val': 0.002716814667945668, 'batch_size': 3960, 'optimizer': 'RMSprop'}. Best is trial 153 with value: 0.08411445830273562.
2026-05-13 14:54:17,727 - optuna.study._optimize - INFO - Trial 157 pruned. 
2026-05-13 14:54:54,166 - optuna.study.study - INFO - Trial 158 finished with value: 0.07850600206031795 and parameters: {'n_layers': 1, 'embedding_dim': 256, 'lr': 0.0036972476162771693, 'lambda_val': 0.003397798484572013, 'batch_size': 3723, 'optimizer': 'Adam'}. Best is trial 153 with value: 0.08411445830273562.
2026-05-13 14:54:58,691 - optuna.study._optimize - INFO - Trial 159 pruned. 
2026-05-13 14:55:13,049 - optuna.study._optimize - INFO - Trial 160 pruned. 
2026-05-13 14:55:49,161 - optuna.study.study - INFO - Trial 161 finished with value: 0.08396974564997436 and parameters: {'n_layers': 1, 'embedding_dim': 256, 'lr': 0.00445218521609586, 'lambda_val': 0.002581858966877877, 'batch_size': 4091, 'optimizer': 'RMSprop'}. Best is trial 153 with value: 0.08411445830273562.
2026-05-13 14:56:24,930 - optuna.study.study - INFO - Trial 162 finished with value: 0.0788296451371214 and parameters: {'n_layers': 1, 'embedding_dim': 256, 'lr': 0.004129310489915997, 'lambda_val': 0.002524681658679335, 'batch_size': 4095, 'optimizer': 'RMSprop'}. Best is trial 153 with value: 0.08411445830273562.
2026-05-13 14:57:01,177 - optuna.study.study - INFO - Trial 163 finished with value: 0.07628034630397527 and parameters: {'n_layers': 1, 'embedding_dim': 256, 'lr': 0.0027855953111408905, 'lambda_val': 0.004363276404759645, 'batch_size': 3973, 'optimizer': 'RMSprop'}. Best is trial 153 with value: 0.08411445830273562.
2026-05-13 14:57:05,726 - optuna.study._optimize - INFO - Trial 164 pruned. 
2026-05-13 14:57:42,192 - optuna.study.study - INFO - Trial 165 finished with value: 0.07912167650396293 and parameters: {'n_layers': 1, 'embedding_dim': 256, 'lr': 0.003325964912845099, 'lambda_val': 0.0020050221393652307, 'batch_size': 4038, 'optimizer': 'RMSprop'}. Best is trial 153 with value: 0.08411445830273562.
2026-05-13 14:58:19,340 - optuna.study.study - INFO - Trial 166 finished with value: 0.07747203372851161 and parameters: {'n_layers': 1, 'embedding_dim': 256, 'lr': 0.008125264854317337, 'lambda_val': 0.0027266465208610584, 'batch_size': 3902, 'optimizer': 'RMSprop'}. Best is trial 153 with value: 0.08411445830273562.
2026-05-13 14:58:54,973 - optuna.study.study - INFO - Trial 167 finished with value: 0.07966102113210827 and parameters: {'n_layers': 1, 'embedding_dim': 256, 'lr': 0.004252189585171496, 'lambda_val': 0.00336853695002554, 'batch_size': 3600, 'optimizer': 'RMSprop'}. Best is trial 153 with value: 0.08411445830273562.
2026-05-13 14:59:30,740 - optuna.study.study - INFO - Trial 168 finished with value: 0.07692059791297266 and parameters: {'n_layers': 1, 'embedding_dim': 256, 'lr': 0.0051572967335786835, 'lambda_val': 0.0014294034789274221, 'batch_size': 4008, 'optimizer': 'RMSprop'}. Best is trial 153 with value: 0.08411445830273562.
2026-05-13 14:59:42,997 - optuna.study._optimize - INFO - Trial 169 pruned. 
2026-05-13 14:59:49,449 - optuna.study._optimize - INFO - Trial 170 pruned. 
2026-05-13 15:00:25,274 - optuna.study.study - INFO - Trial 171 finished with value: 0.08103005402343659 and parameters: {'n_layers': 1, 'embedding_dim': 256, 'lr': 0.004172088402076408, 'lambda_val': 0.0011501593368363797, 'batch_size': 3831, 'optimizer': 'RMSprop'}. Best is trial 153 with value: 0.08411445830273562.
2026-05-13 15:01:01,021 - optuna.study.study - INFO - Trial 172 finished with value: 0.08249639294958143 and parameters: {'n_layers': 1, 'embedding_dim': 256, 'lr': 0.006636699519104344, 'lambda_val': 0.0012059743863386788, 'batch_size': 3868, 'optimizer': 'RMSprop'}. Best is trial 153 with value: 0.08411445830273562.
2026-05-13 15:01:37,832 - optuna.study.study - INFO - Trial 173 finished with value: 0.07821424793095368 and parameters: {'n_layers': 1, 'embedding_dim': 256, 'lr': 0.006546852918385393, 'lambda_val': 0.0012633126595719066, 'batch_size': 3882, 'optimizer': 'RMSprop'}. Best is trial 153 with value: 0.08411445830273562.
2026-05-13 15:02:13,685 - optuna.study.study - INFO - Trial 174 finished with value: 0.07842133022809848 and parameters: {'n_layers': 1, 'embedding_dim': 256, 'lr': 0.007698001211096384, 'lambda_val': 0.0009869826625963415, 'batch_size': 3995, 'optimizer': 'RMSprop'}. Best is trial 153 with value: 0.08411445830273562.
2026-05-13 15:02:49,720 - optuna.study.study - INFO - Trial 175 finished with value: 0.07921954801242563 and parameters: {'n_layers': 1, 'embedding_dim': 256, 'lr': 0.0035322560196395744, 'lambda_val': 0.000776042699663974, 'batch_size': 3843, 'optimizer': 'RMSprop'}. Best is trial 153 with value: 0.08411445830273562.
2026-05-13 15:03:26,250 - optuna.study.study - INFO - Trial 176 finished with value: 0.08470077766098785 and parameters: {'n_layers': 1, 'embedding_dim': 256, 'lr': 0.005210415588747923, 'lambda_val': 0.0015376679067144257, 'batch_size': 3940, 'optimizer': 'RMSprop'}. Best is trial 176 with value: 0.08470077766098785.
2026-05-13 15:04:03,012 - optuna.study.study - INFO - Trial 177 finished with value: 0.07698698366124733 and parameters: {'n_layers': 1, 'embedding_dim': 256, 'lr': 0.002761446049829303, 'lambda_val': 0.0015527955691408606, 'batch_size': 3693, 'optimizer': 'RMSprop'}. Best is trial 176 with value: 0.08470077766098785.
2026-05-13 15:04:38,822 - optuna.study.study - INFO - Trial 178 finished with value: 0.08147251097986694 and parameters: {'n_layers': 1, 'embedding_dim': 256, 'lr': 0.004934967250414367, 'lambda_val': 0.0011082918466261004, 'batch_size': 3924, 'optimizer': 'RMSprop'}. Best is trial 176 with value: 0.08470077766098785.
2026-05-13 15:04:43,238 - optuna.study._optimize - INFO - Trial 179 pruned. 
2026-05-13 15:05:18,827 - optuna.study.study - INFO - Trial 180 finished with value: 0.07813529227757521 and parameters: {'n_layers': 1, 'embedding_dim': 256, 'lr': 0.004881944045245131, 'lambda_val': 0.0012306977277954055, 'batch_size': 3836, 'optimizer': 'RMSprop'}. Best is trial 176 with value: 0.08470077766098785.
2026-05-13 15:05:24,122 - optuna.study._optimize - INFO - Trial 181 pruned. 
2026-05-13 15:06:00,840 - optuna.study.study - INFO - Trial 182 finished with value: 0.0763229937579021 and parameters: {'n_layers': 1, 'embedding_dim': 256, 'lr': 0.006640356264880815, 'lambda_val': 0.0015954879933917077, 'batch_size': 4009, 'optimizer': 'RMSprop'}. Best is trial 176 with value: 0.08470077766098785.
2026-05-13 15:06:35,007 - optuna.study.study - INFO - Trial 183 finished with value: 0.08390217750784472 and parameters: {'n_layers': 1, 'embedding_dim': 256, 'lr': 0.005208125105042894, 'lambda_val': 0.0008743499911159697, 'batch_size': 2214, 'optimizer': 'RMSprop'}. Best is trial 176 with value: 0.08470077766098785.
2026-05-13 15:07:10,559 - optuna.study.study - INFO - Trial 184 finished with value: 0.07799595487368965 and parameters: {'n_layers': 1, 'embedding_dim': 256, 'lr': 0.005221861282271632, 'lambda_val': 0.0008929766461736073, 'batch_size': 3731, 'optimizer': 'RMSprop'}. Best is trial 176 with value: 0.08470077766098785.
2026-05-13 15:07:15,116 - optuna.study._optimize - INFO - Trial 185 pruned. 
2026-05-13 15:07:50,779 - optuna.study.study - INFO - Trial 186 finished with value: 0.07852321559088055 and parameters: {'n_layers': 1, 'embedding_dim': 256, 'lr': 0.006912379323033583, 'lambda_val': 0.0011425156978253034, 'batch_size': 3893, 'optimizer': 'RMSprop'}. Best is trial 176 with value: 0.08470077766098785.
2026-05-13 15:08:00,680 - optuna.study._optimize - INFO - Trial 187 pruned. 
2026-05-13 15:08:36,278 - optuna.study.study - INFO - Trial 188 finished with value: 0.07625362737830495 and parameters: {'n_layers': 1, 'embedding_dim': 256, 'lr': 0.0032042958906908117, 'lambda_val': 0.0014057035808853887, 'batch_size': 3815, 'optimizer': 'RMSprop'}. Best is trial 176 with value: 0.08470077766098785.
2026-05-13 15:09:12,105 - optuna.study.study - INFO - Trial 189 finished with value: 0.0649533033979781 and parameters: {'n_layers': 1, 'embedding_dim': 256, 'lr': 0.00036279560175453006, 'lambda_val': 0.0010909414579061622, 'batch_size': 3943, 'optimizer': 'RMSprop'}. Best is trial 176 with value: 0.08470077766098785.
2026-05-13 15:09:16,139 - optuna.study._optimize - INFO - Trial 190 pruned. 
2026-05-13 15:09:52,206 - optuna.study.study - INFO - Trial 191 finished with value: 0.07841172461532255 and parameters: {'n_layers': 1, 'embedding_dim': 256, 'lr': 0.003793064353203311, 'lambda_val': 0.001754799014613502, 'batch_size': 4020, 'optimizer': 'RMSprop'}. Best is trial 176 with value: 0.08470077766098785.
2026-05-13 15:09:56,657 - optuna.study._optimize - INFO - Trial 192 pruned. 
2026-05-13 15:10:01,224 - optuna.study._optimize - INFO - Trial 193 pruned. 
2026-05-13 15:10:05,970 - optuna.study._optimize - INFO - Trial 194 pruned. 
2026-05-13 15:10:42,341 - optuna.study.study - INFO - Trial 195 finished with value: 0.0784168897135009 and parameters: {'n_layers': 1, 'embedding_dim': 256, 'lr': 0.00343969724936702, 'lambda_val': 0.002214288560227413, 'batch_size': 4020, 'optimizer': 'RMSprop'}. Best is trial 176 with value: 0.08470077766098785.
2026-05-13 15:10:47,102 - optuna.study._optimize - INFO - Trial 196 pruned. 
2026-05-13 15:10:51,219 - optuna.study._optimize - INFO - Trial 197 pruned. 
2026-05-13 15:11:27,986 - optuna.study.study - INFO - Trial 198 finished with value: 0.07816122786210157 and parameters: {'n_layers': 1, 'embedding_dim': 256, 'lr': 0.0018708850869458866, 'lambda_val': 0.0018264153548303238, 'batch_size': 3984, 'optimizer': 'RMSprop'}. Best is trial 176 with value: 0.08470077766098785.
2026-05-13 15:12:04,364 - optuna.study.study - INFO - Trial 199 finished with value: 0.07787176840308116 and parameters: {'n_layers': 1, 'embedding_dim': 256, 'lr': 0.003306734353287067, 'lambda_val': 0.0013063254200114847, 'batch_size': 3931, 'optimizer': 'RMSprop'}. Best is trial 176 with value: 0.08470077766098785.
2026-05-13 15:12:33,318 - root - INFO -   **** Training e_100K_1c2dcs_rand2
2026-05-13 15:12:33,330 - root - INFO -   **** Getting 54402/65410 random edges
2026-05-13 15:12:33,685 - optuna.storages._rdb.storage - INFO - A new study created in RDB with name: Study_e_100K_1c2dcs_rand2
2026-05-13 15:13:27,227 - optuna.study.study - INFO - Trial 0 finished with value: 0.004016827272264369 and parameters: {'n_layers': 4, 'embedding_dim': 96, 'lr': 0.00023790911409133806, 'lambda_val': 0.003052413342703402, 'batch_size': 3714, 'optimizer': 'SGD'}. Best is trial 0 with value: 0.004016827272264369.
2026-05-13 15:14:13,445 - optuna.study.study - INFO - Trial 1 finished with value: 0.029393770257773174 and parameters: {'n_layers': 3, 'embedding_dim': 32, 'lr': 0.05961246314631628, 'lambda_val': 9.145944366592008e-05, 'batch_size': 660, 'optimizer': 'RMSprop'}. Best is trial 1 with value: 0.029393770257773174.
2026-05-13 15:15:14,291 - optuna.study.study - INFO - Trial 2 finished with value: 0.0029099282555285723 and parameters: {'n_layers': 4, 'embedding_dim': 256, 'lr': 0.002441898178641375, 'lambda_val': 0.001346256202830235, 'batch_size': 1776, 'optimizer': 'SGD'}. Best is trial 1 with value: 0.029393770257773174.
2026-05-13 15:15:50,482 - optuna.study.study - INFO - Trial 3 finished with value: 0.0013187571945532325 and parameters: {'n_layers': 4, 'embedding_dim': 32, 'lr': 0.0016551196379578055, 'lambda_val': 0.00043379693178288524, 'batch_size': 2726, 'optimizer': 'SGD'}. Best is trial 1 with value: 0.029393770257773174.
2026-05-13 15:16:28,297 - optuna.study.study - INFO - Trial 4 finished with value: 0.005660811425582552 and parameters: {'n_layers': 4, 'embedding_dim': 32, 'lr': 1.202818356429961e-05, 'lambda_val': 1.5674002093389894e-05, 'batch_size': 3194, 'optimizer': 'RMSprop'}. Best is trial 1 with value: 0.029393770257773174.
2026-05-13 15:17:10,131 - optuna.study.study - INFO - Trial 5 finished with value: 0.03671766590793217 and parameters: {'n_layers': 2, 'embedding_dim': 32, 'lr': 0.022231205694237026, 'lambda_val': 0.0010635941655530595, 'batch_size': 556, 'optimizer': 'RMSprop'}. Best is trial 5 with value: 0.03671766590793217.
2026-05-13 15:17:49,580 - optuna.study.study - INFO - Trial 6 finished with value: 0.03169759292426896 and parameters: {'n_layers': 3, 'embedding_dim': 64, 'lr': 0.03185334401599537, 'lambda_val': 0.000304826190923087, 'batch_size': 2735, 'optimizer': 'Adam'}. Best is trial 5 with value: 0.03671766590793217.
2026-05-13 15:17:53,223 - optuna.study._optimize - INFO - Trial 7 pruned. 
2026-05-13 15:17:58,372 - optuna.study._optimize - INFO - Trial 8 pruned. 
2026-05-13 15:18:02,941 - optuna.study._optimize - INFO - Trial 9 pruned. 
2026-05-13 15:18:37,699 - optuna.study.study - INFO - Trial 10 finished with value: 0.048901187906238174 and parameters: {'n_layers': 1, 'embedding_dim': 256, 'lr': 0.006437659655399654, 'lambda_val': 0.020904129550187025, 'batch_size': 1230, 'optimizer': 'RMSprop'}. Best is trial 10 with value: 0.048901187906238174.
2026-05-13 15:19:11,556 - optuna.study.study - INFO - Trial 11 finished with value: 0.05187463002815756 and parameters: {'n_layers': 1, 'embedding_dim': 256, 'lr': 0.007595039023086383, 'lambda_val': 0.021738279297752332, 'batch_size': 1218, 'optimizer': 'RMSprop'}. Best is trial 11 with value: 0.05187463002815756.
2026-05-13 15:19:45,078 - optuna.study.study - INFO - Trial 12 finished with value: 0.04259649758919605 and parameters: {'n_layers': 1, 'embedding_dim': 256, 'lr': 0.0048449024708962785, 'lambda_val': 0.028040025857114806, 'batch_size': 1338, 'optimizer': 'RMSprop'}. Best is trial 11 with value: 0.05187463002815756.
2026-05-13 15:20:18,768 - optuna.study.study - INFO - Trial 13 finished with value: 0.052054702970575975 and parameters: {'n_layers': 1, 'embedding_dim': 256, 'lr': 0.008104863459240667, 'lambda_val': 0.01258485931879169, 'batch_size': 1365, 'optimizer': 'RMSprop'}. Best is trial 13 with value: 0.052054702970575975.
2026-05-13 15:21:01,612 - optuna.study.study - INFO - Trial 14 finished with value: 0.027080772818935894 and parameters: {'n_layers': 2, 'embedding_dim': 256, 'lr': 0.00045089247132665174, 'lambda_val': 0.008407974248642447, 'batch_size': 1637, 'optimizer': 'Adam'}. Best is trial 13 with value: 0.052054702970575975.
2026-05-13 15:21:35,803 - optuna.study.study - INFO - Trial 15 finished with value: 0.053600651026726655 and parameters: {'n_layers': 1, 'embedding_dim': 256, 'lr': 0.00791719894882659, 'lambda_val': 1.676984968542278e-06, 'batch_size': 2298, 'optimizer': 'RMSprop'}. Best is trial 15 with value: 0.053600651026726655.
2026-05-13 15:22:10,161 - optuna.study.study - INFO - Trial 16 finished with value: 0.02992432238833891 and parameters: {'n_layers': 2, 'embedding_dim': 128, 'lr': 0.0010026462750783534, 'lambda_val': 1.2342322561273972e-06, 'batch_size': 2278, 'optimizer': 'RMSprop'}. Best is trial 15 with value: 0.053600651026726655.
2026-05-13 15:22:14,407 - optuna.study._optimize - INFO - Trial 17 pruned. 
2026-05-13 15:22:51,232 - optuna.study.study - INFO - Trial 18 finished with value: 0.05623731965612732 and parameters: {'n_layers': 1, 'embedding_dim': 256, 'lr': 0.009183180451126621, 'lambda_val': 7.574718503941464e-05, 'batch_size': 2928, 'optimizer': 'Adam'}. Best is trial 18 with value: 0.05623731965612732.
2026-05-13 15:22:57,480 - optuna.study._optimize - INFO - Trial 19 pruned. 
2026-05-13 15:23:41,789 - optuna.study.study - INFO - Trial 20 finished with value: 0.04000595721094166 and parameters: {'n_layers': 2, 'embedding_dim': 256, 'lr': 0.014159475290018594, 'lambda_val': 6.537495196528129e-05, 'batch_size': 2963, 'optimizer': 'Adam'}. Best is trial 18 with value: 0.05623731965612732.
2026-05-13 15:24:18,043 - optuna.study.study - INFO - Trial 21 finished with value: 0.05737414766212938 and parameters: {'n_layers': 1, 'embedding_dim': 256, 'lr': 0.008882222873428002, 'lambda_val': 8.69754686064649e-05, 'batch_size': 2319, 'optimizer': 'Adam'}. Best is trial 21 with value: 0.05737414766212938.
2026-05-13 15:24:22,506 - optuna.study._optimize - INFO - Trial 22 pruned. 
2026-05-13 15:24:59,613 - optuna.study.study - INFO - Trial 23 finished with value: 0.06555746546790052 and parameters: {'n_layers': 1, 'embedding_dim': 256, 'lr': 0.0008273326280390691, 'lambda_val': 4.224057056083588e-06, 'batch_size': 2574, 'optimizer': 'Adam'}. Best is trial 23 with value: 0.06555746546790052.
