2026-05-13 03:15:59,509 - root - INFO - **** Training e_100K_full
2026-05-13 03:15:59,532 - helper_functions - INFO - Users: 610, Items: 9742
2026-05-13 03:15:59,662 - helper_functions - INFO - Edge index: torch.Size([2, 81763])
2026-05-13 03:15:59,662 - root - INFO - **** Generating the graph:
2026-05-13 03:15:59,728 - helper_functions - INFO - Number of unique users: 609
2026-05-13 03:15:59,729 - helper_functions - INFO - Number of unique items: 8452
2026-05-13 03:15:59,729 - helper_functions - INFO - Number of nodes: 9061
2026-05-13 03:15:59,731 - helper_functions - INFO - Number of edges: 81763
2026-05-13 03:16:01,825 - optuna.storages._rdb.storage - INFO - A new study created in RDB with name: Study_e_100K_full
2026-05-13 03:16:27,963 - optuna.study.study - INFO - Trial 0 finished with value: 0.07930989030781173 and parameters: {'n_layers': 1, 'embedding_dim': 96, 'lr': 0.049359047470557, 'lambda_val': 0.0036304307441874014, 'batch_size': 1594, 'optimizer': 'RMSprop'}. Best is trial 0 with value: 0.07930989030781173.
2026-05-13 03:17:01,570 - optuna.study.study - INFO - Trial 1 finished with value: 0.049628899623992286 and parameters: {'n_layers': 2, 'embedding_dim': 128, 'lr': 0.008376005650152106, 'lambda_val': 0.0004481186090372136, 'batch_size': 1573, 'optimizer': 'Adam'}. Best is trial 0 with value: 0.07930989030781173.
2026-05-13 03:17:32,346 - optuna.study.study - INFO - Trial 2 finished with value: 0.03052619354948984 and parameters: {'n_layers': 2, 'embedding_dim': 64, 'lr': 0.024242140237373887, 'lambda_val': 6.612705635017582e-06, 'batch_size': 620, 'optimizer': 'Adam'}. Best is trial 0 with value: 0.07930989030781173.
2026-05-13 03:18:06,120 - optuna.study.study - INFO - Trial 3 finished with value: 0.003716901338428716 and parameters: {'n_layers': 1, 'embedding_dim': 256, 'lr': 1.896760539803327e-05, 'lambda_val': 0.0004042341437686111, 'batch_size': 2717, 'optimizer': 'SGD'}. Best is trial 0 with value: 0.07930989030781173.
2026-05-13 03:19:00,645 - optuna.study.study - INFO - Trial 4 finished with value: 0.06194125064048756 and parameters: {'n_layers': 4, 'embedding_dim': 128, 'lr': 5.148263672346044e-05, 'lambda_val': 1.218050857160634e-06, 'batch_size': 1568, 'optimizer': 'RMSprop'}. Best is trial 0 with value: 0.07930989030781173.
2026-05-13 03:19:06,813 - optuna.study._optimize - INFO - Trial 5 pruned. 
2026-05-13 03:19:11,080 - optuna.study._optimize - INFO - Trial 6 pruned. 
2026-05-13 03:19:18,056 - optuna.study._optimize - INFO - Trial 7 pruned. 
2026-05-13 03:19:22,954 - optuna.study._optimize - INFO - Trial 8 pruned. 
2026-05-13 03:19:43,877 - optuna.study._optimize - INFO - Trial 9 pruned. 
2026-05-13 03:19:48,829 - optuna.study._optimize - INFO - Trial 10 pruned. 
2026-05-13 03:19:54,445 - optuna.study._optimize - INFO - Trial 11 pruned. 
2026-05-13 03:20:26,475 - optuna.study._optimize - INFO - Trial 12 pruned. 
2026-05-13 03:20:32,180 - optuna.study._optimize - INFO - Trial 13 pruned. 
2026-05-13 03:20:37,243 - optuna.study._optimize - INFO - Trial 14 pruned. 
2026-05-13 03:20:41,244 - optuna.study._optimize - INFO - Trial 15 pruned. 
2026-05-13 03:20:50,298 - optuna.study._optimize - INFO - Trial 16 pruned. 
2026-05-13 03:21:32,643 - optuna.study.study - INFO - Trial 17 finished with value: 0.03453581868368005 and parameters: {'n_layers': 1, 'embedding_dim': 96, 'lr': 0.0002509578367985957, 'lambda_val': 0.019189002427682476, 'batch_size': 3170, 'optimizer': 'RMSprop'}. Best is trial 0 with value: 0.07930989030781173.
2026-05-13 03:21:37,709 - optuna.study._optimize - INFO - Trial 18 pruned. 
2026-05-13 03:21:41,789 - optuna.study._optimize - INFO - Trial 19 pruned. 
2026-05-13 03:22:16,024 - optuna.study.study - INFO - Trial 20 finished with value: 0.013498879428171956 and parameters: {'n_layers': 4, 'embedding_dim': 32, 'lr': 0.000372474658069074, 'lambda_val': 0.00018003468424082335, 'batch_size': 1741, 'optimizer': 'RMSprop'}. Best is trial 0 with value: 0.07930989030781173.
2026-05-13 03:22:19,981 - optuna.study._optimize - INFO - Trial 21 pruned. 
2026-05-13 03:22:55,636 - optuna.study.study - INFO - Trial 22 finished with value: 0.07832174045332758 and parameters: {'n_layers': 1, 'embedding_dim': 128, 'lr': 0.042996564888745814, 'lambda_val': 0.0011316354475550652, 'batch_size': 1886, 'optimizer': 'Adam'}. Best is trial 0 with value: 0.07930989030781173.
2026-05-13 03:23:25,971 - optuna.study.study - INFO - Trial 23 finished with value: 0.08695319385376853 and parameters: {'n_layers': 1, 'embedding_dim': 128, 'lr': 0.04002713018769148, 'lambda_val': 0.001461827752640327, 'batch_size': 1937, 'optimizer': 'Adam'}. Best is trial 23 with value: 0.08695319385376853.
2026-05-13 03:23:56,382 - optuna.study.study - INFO - Trial 24 finished with value: 0.0932340954776268 and parameters: {'n_layers': 1, 'embedding_dim': 128, 'lr': 0.04274306928041263, 'lambda_val': 0.001474252041969083, 'batch_size': 2038, 'optimizer': 'Adam'}. Best is trial 24 with value: 0.0932340954776268.
2026-05-13 03:24:00,482 - optuna.study._optimize - INFO - Trial 25 pruned. 
2026-05-13 03:24:30,103 - optuna.study.study - INFO - Trial 26 finished with value: 0.07984489541590128 and parameters: {'n_layers': 1, 'embedding_dim': 96, 'lr': 0.05578834859207996, 'lambda_val': 0.002784894834873106, 'batch_size': 2007, 'optimizer': 'Adam'}. Best is trial 24 with value: 0.0932340954776268.
2026-05-13 03:24:41,543 - optuna.study._optimize - INFO - Trial 27 pruned. 
2026-05-13 03:25:11,882 - optuna.study.study - INFO - Trial 28 finished with value: 0.08335143333568629 and parameters: {'n_layers': 1, 'embedding_dim': 128, 'lr': 0.004708346257433123, 'lambda_val': 0.001023227867193783, 'batch_size': 2153, 'optimizer': 'Adam'}. Best is trial 24 with value: 0.0932340954776268.
2026-05-13 03:25:43,433 - optuna.study.study - INFO - Trial 29 finished with value: 0.06482212613607358 and parameters: {'n_layers': 1, 'embedding_dim': 128, 'lr': 0.003589097419886015, 'lambda_val': 0.00018707106323761255, 'batch_size': 2314, 'optimizer': 'Adam'}. Best is trial 24 with value: 0.0932340954776268.
2026-05-13 03:26:12,926 - optuna.study.study - INFO - Trial 30 finished with value: 0.08356009600861733 and parameters: {'n_layers': 1, 'embedding_dim': 128, 'lr': 0.004909125659458297, 'lambda_val': 0.0010264903004178567, 'batch_size': 2288, 'optimizer': 'Adam'}. Best is trial 24 with value: 0.0932340954776268.
2026-05-13 03:26:42,079 - optuna.study.study - INFO - Trial 31 finished with value: 0.08229127182775466 and parameters: {'n_layers': 1, 'embedding_dim': 128, 'lr': 0.006633979039892971, 'lambda_val': 0.0009316549848436089, 'batch_size': 2266, 'optimizer': 'Adam'}. Best is trial 24 with value: 0.0932340954776268.
2026-05-13 03:27:13,032 - optuna.study.study - INFO - Trial 32 finished with value: 0.05428098064237068 and parameters: {'n_layers': 1, 'embedding_dim': 128, 'lr': 0.0021841154109930572, 'lambda_val': 0.0002683151688249401, 'batch_size': 2631, 'optimizer': 'Adam'}. Best is trial 24 with value: 0.0932340954776268.
2026-05-13 03:27:25,874 - optuna.study._optimize - INFO - Trial 33 pruned. 
2026-05-13 03:27:33,840 - optuna.study._optimize - INFO - Trial 34 pruned. 
2026-05-13 03:28:04,423 - optuna.study.study - INFO - Trial 35 finished with value: 0.07776291395389805 and parameters: {'n_layers': 1, 'embedding_dim': 128, 'lr': 0.005555870108508883, 'lambda_val': 0.000663931527667934, 'batch_size': 1763, 'optimizer': 'Adam'}. Best is trial 24 with value: 0.0932340954776268.
2026-05-13 03:28:08,644 - optuna.study._optimize - INFO - Trial 36 pruned. 
2026-05-13 03:28:38,591 - optuna.study._optimize - INFO - Trial 37 pruned. 
2026-05-13 03:28:44,782 - optuna.study._optimize - INFO - Trial 38 pruned. 
2026-05-13 03:28:49,976 - optuna.study._optimize - INFO - Trial 39 pruned. 
2026-05-13 03:28:53,662 - optuna.study._optimize - INFO - Trial 40 pruned. 
2026-05-13 03:29:26,301 - optuna.study.study - INFO - Trial 41 finished with value: 0.0870138098294085 and parameters: {'n_layers': 1, 'embedding_dim': 128, 'lr': 0.005329489674995619, 'lambda_val': 0.0011089053788938253, 'batch_size': 2331, 'optimizer': 'Adam'}. Best is trial 24 with value: 0.0932340954776268.
2026-05-13 03:30:03,118 - optuna.study.study - INFO - Trial 42 finished with value: 0.08049868000850348 and parameters: {'n_layers': 1, 'embedding_dim': 128, 'lr': 0.004422372919430505, 'lambda_val': 0.001421935878958212, 'batch_size': 1703, 'optimizer': 'Adam'}. Best is trial 24 with value: 0.0932340954776268.
2026-05-13 03:30:06,586 - optuna.study._optimize - INFO - Trial 43 pruned. 
2026-05-13 03:30:35,096 - optuna.study.study - INFO - Trial 44 finished with value: 0.0780305286548722 and parameters: {'n_layers': 1, 'embedding_dim': 128, 'lr': 0.008905838780220693, 'lambda_val': 0.004372820086663052, 'batch_size': 1992, 'optimizer': 'Adam'}. Best is trial 24 with value: 0.0932340954776268.
2026-05-13 03:30:38,886 - optuna.study._optimize - INFO - Trial 45 pruned. 
2026-05-13 03:30:44,281 - optuna.study._optimize - INFO - Trial 46 pruned. 
2026-05-13 03:30:47,692 - optuna.study._optimize - INFO - Trial 47 pruned. 
2026-05-13 03:31:21,834 - optuna.study._optimize - INFO - Trial 48 pruned. 
2026-05-13 03:32:02,904 - optuna.study.study - INFO - Trial 49 finished with value: 0.09092538791150369 and parameters: {'n_layers': 1, 'embedding_dim': 128, 'lr': 0.004904031035350366, 'lambda_val': 0.0017469748850404037, 'batch_size': 3100, 'optimizer': 'Adam'}. Best is trial 24 with value: 0.0932340954776268.
2026-05-13 03:32:07,237 - optuna.study._optimize - INFO - Trial 50 pruned. 
2026-05-13 03:32:38,535 - optuna.study.study - INFO - Trial 51 finished with value: 0.08669403944783671 and parameters: {'n_layers': 1, 'embedding_dim': 128, 'lr': 0.004808630188035844, 'lambda_val': 0.0021685415057272643, 'batch_size': 3622, 'optimizer': 'Adam'}. Best is trial 24 with value: 0.0932340954776268.
2026-05-13 03:33:12,506 - optuna.study.study - INFO - Trial 52 finished with value: 0.08670670120097966 and parameters: {'n_layers': 1, 'embedding_dim': 128, 'lr': 0.002473943789905152, 'lambda_val': 0.002279941319902334, 'batch_size': 3586, 'optimizer': 'Adam'}. Best is trial 24 with value: 0.0932340954776268.
2026-05-13 03:33:43,526 - optuna.study.study - INFO - Trial 53 finished with value: 0.08718438645426438 and parameters: {'n_layers': 1, 'embedding_dim': 128, 'lr': 0.003078709426845512, 'lambda_val': 0.0017615367263369766, 'batch_size': 3852, 'optimizer': 'Adam'}. Best is trial 24 with value: 0.0932340954776268.
2026-05-13 03:34:12,322 - optuna.study._optimize - INFO - Trial 54 pruned. 
2026-05-13 03:34:27,504 - optuna.study._optimize - INFO - Trial 55 pruned. 
2026-05-13 03:34:31,689 - optuna.study._optimize - INFO - Trial 56 pruned. 
2026-05-13 03:34:36,169 - optuna.study._optimize - INFO - Trial 57 pruned. 
2026-05-13 03:34:41,070 - optuna.study._optimize - INFO - Trial 58 pruned. 
2026-05-13 03:34:49,308 - optuna.study._optimize - INFO - Trial 59 pruned. 
2026-05-13 03:35:20,964 - optuna.study.study - INFO - Trial 60 finished with value: 0.08304945422615445 and parameters: {'n_layers': 1, 'embedding_dim': 128, 'lr': 0.0134813456009463, 'lambda_val': 0.0006246000594328481, 'batch_size': 3845, 'optimizer': 'Adam'}. Best is trial 24 with value: 0.0932340954776268.
2026-05-13 03:35:52,292 - optuna.study.study - INFO - Trial 61 finished with value: 0.0862690060503327 and parameters: {'n_layers': 1, 'embedding_dim': 128, 'lr': 0.0038118187358911, 'lambda_val': 0.0029258388232478697, 'batch_size': 3608, 'optimizer': 'Adam'}. Best is trial 24 with value: 0.0932340954776268.
2026-05-13 03:36:23,607 - optuna.study.study - INFO - Trial 62 finished with value: 0.08584690643997703 and parameters: {'n_layers': 1, 'embedding_dim': 128, 'lr': 0.00300602773857988, 'lambda_val': 0.0020064550998930048, 'batch_size': 4028, 'optimizer': 'Adam'}. Best is trial 24 with value: 0.0932340954776268.
2026-05-13 03:36:32,842 - optuna.study._optimize - INFO - Trial 63 pruned. 
2026-05-13 03:37:03,935 - optuna.study._optimize - INFO - Trial 64 pruned. 
2026-05-13 03:37:08,030 - optuna.study._optimize - INFO - Trial 65 pruned. 
2026-05-13 03:37:42,241 - optuna.study.study - INFO - Trial 66 finished with value: 0.06839691270633722 and parameters: {'n_layers': 1, 'embedding_dim': 128, 'lr': 0.00024068222947087322, 'lambda_val': 0.0007989936833814902, 'batch_size': 3948, 'optimizer': 'Adam'}. Best is trial 24 with value: 0.0932340954776268.
2026-05-13 03:38:15,773 - optuna.study.study - INFO - Trial 67 finished with value: 0.08668854849848212 and parameters: {'n_layers': 1, 'embedding_dim': 128, 'lr': 0.009171184417647029, 'lambda_val': 0.002728030997219223, 'batch_size': 3053, 'optimizer': 'Adam'}. Best is trial 24 with value: 0.0932340954776268.
2026-05-13 03:38:43,916 - optuna.study.study - INFO - Trial 68 finished with value: 0.041303513041120295 and parameters: {'n_layers': 1, 'embedding_dim': 32, 'lr': 0.0013365553193271085, 'lambda_val': 0.0013792372749584913, 'batch_size': 3385, 'optimizer': 'RMSprop'}. Best is trial 24 with value: 0.0932340954776268.
2026-05-13 03:38:48,075 - optuna.study._optimize - INFO - Trial 69 pruned. 
2026-05-13 03:38:52,679 - optuna.study._optimize - INFO - Trial 70 pruned. 
2026-05-13 03:39:25,837 - optuna.study.study - INFO - Trial 71 finished with value: 0.08697409369975281 and parameters: {'n_layers': 1, 'embedding_dim': 128, 'lr': 0.00895374788969947, 'lambda_val': 0.0037989595578688043, 'batch_size': 3566, 'optimizer': 'Adam'}. Best is trial 24 with value: 0.0932340954776268.
2026-05-13 03:39:59,207 - optuna.study.study - INFO - Trial 72 finished with value: 0.08570808869234894 and parameters: {'n_layers': 1, 'embedding_dim': 128, 'lr': 0.006709048939842147, 'lambda_val': 0.0022033605045322173, 'batch_size': 3556, 'optimizer': 'Adam'}. Best is trial 24 with value: 0.0932340954776268.
2026-05-13 03:40:34,521 - optuna.study.study - INFO - Trial 73 finished with value: 0.08688416070418986 and parameters: {'n_layers': 1, 'embedding_dim': 128, 'lr': 0.003946294865085038, 'lambda_val': 0.00367793768679989, 'batch_size': 3840, 'optimizer': 'Adam'}. Best is trial 24 with value: 0.0932340954776268.
2026-05-13 03:41:07,790 - optuna.study.study - INFO - Trial 74 finished with value: 0.08651492176332215 and parameters: {'n_layers': 1, 'embedding_dim': 128, 'lr': 0.002480328448188167, 'lambda_val': 0.0036383528061944095, 'batch_size': 3871, 'optimizer': 'Adam'}. Best is trial 24 with value: 0.0932340954776268.
2026-05-13 03:41:11,982 - optuna.study._optimize - INFO - Trial 75 pruned. 
2026-05-13 03:41:40,674 - optuna.study._optimize - INFO - Trial 76 pruned. 
2026-05-13 03:41:45,918 - optuna.study._optimize - INFO - Trial 77 pruned. 
2026-05-13 03:41:50,232 - optuna.study._optimize - INFO - Trial 78 pruned. 
2026-05-13 03:41:54,049 - optuna.study._optimize - INFO - Trial 79 pruned. 
2026-05-13 03:42:00,736 - optuna.study._optimize - INFO - Trial 80 pruned. 
2026-05-13 03:42:37,241 - optuna.study.study - INFO - Trial 81 finished with value: 0.08805570122005613 and parameters: {'n_layers': 1, 'embedding_dim': 128, 'lr': 0.005132331927618477, 'lambda_val': 0.0015363133785065894, 'batch_size': 3663, 'optimizer': 'Adam'}. Best is trial 24 with value: 0.0932340954776268.
2026-05-13 03:43:06,534 - optuna.study.study - INFO - Trial 82 finished with value: 0.09312072372454566 and parameters: {'n_layers': 1, 'embedding_dim': 128, 'lr': 0.008612638340617379, 'lambda_val': 0.0015019706208225158, 'batch_size': 3508, 'optimizer': 'Adam'}. Best is trial 24 with value: 0.0932340954776268.
2026-05-13 03:43:12,402 - optuna.study._optimize - INFO - Trial 83 pruned. 
2026-05-13 03:43:40,849 - optuna.study.study - INFO - Trial 84 finished with value: 0.09353836628612025 and parameters: {'n_layers': 1, 'embedding_dim': 128, 'lr': 0.014526023787091408, 'lambda_val': 0.0015910139566037854, 'batch_size': 3807, 'optimizer': 'Adam'}. Best is trial 84 with value: 0.09353836628612025.
2026-05-13 03:43:44,432 - optuna.study._optimize - INFO - Trial 85 pruned. 
2026-05-13 03:43:48,205 - optuna.study._optimize - INFO - Trial 86 pruned. 
2026-05-13 03:44:18,387 - optuna.study.study - INFO - Trial 87 finished with value: 0.09422031361396285 and parameters: {'n_layers': 1, 'embedding_dim': 128, 'lr': 0.005682420344144511, 'lambda_val': 0.0010882775425155667, 'batch_size': 3230, 'optimizer': 'Adam'}. Best is trial 87 with value: 0.09422031361396285.
2026-05-13 03:44:48,493 - optuna.study._optimize - INFO - Trial 88 pruned. 
2026-05-13 03:44:52,084 - optuna.study._optimize - INFO - Trial 89 pruned. 
2026-05-13 03:44:55,336 - optuna.study._optimize - INFO - Trial 90 pruned. 
2026-05-13 03:45:27,612 - optuna.study.study - INFO - Trial 91 finished with value: 0.09472711543828619 and parameters: {'n_layers': 1, 'embedding_dim': 128, 'lr': 0.006037747250273472, 'lambda_val': 0.0018063548959665803, 'batch_size': 2955, 'optimizer': 'Adam'}. Best is trial 91 with value: 0.09472711543828619.
2026-05-13 03:46:00,013 - optuna.study.study - INFO - Trial 92 finished with value: 0.08501009751391789 and parameters: {'n_layers': 1, 'embedding_dim': 128, 'lr': 0.006174530676547968, 'lambda_val': 0.001734185895224952, 'batch_size': 2899, 'optimizer': 'Adam'}. Best is trial 91 with value: 0.09472711543828619.
2026-05-13 03:46:33,076 - optuna.study.study - INFO - Trial 93 finished with value: 0.09156209060039369 and parameters: {'n_layers': 1, 'embedding_dim': 128, 'lr': 0.009714219048369192, 'lambda_val': 0.002879448528605442, 'batch_size': 3209, 'optimizer': 'Adam'}. Best is trial 91 with value: 0.09472711543828619.
2026-05-13 03:46:37,699 - optuna.study._optimize - INFO - Trial 94 pruned. 
2026-05-13 03:46:41,727 - optuna.study._optimize - INFO - Trial 95 pruned. 
2026-05-13 03:46:47,202 - optuna.study._optimize - INFO - Trial 96 pruned. 
2026-05-13 03:46:51,680 - optuna.study._optimize - INFO - Trial 97 pruned. 
2026-05-13 03:47:30,168 - optuna.study.study - INFO - Trial 98 finished with value: 0.09760244586234676 and parameters: {'n_layers': 1, 'embedding_dim': 256, 'lr': 0.004946704488671896, 'lambda_val': 0.0006632787432330968, 'batch_size': 2822, 'optimizer': 'RMSprop'}. Best is trial 98 with value: 0.09760244586234676.
2026-05-13 03:48:08,453 - optuna.study.study - INFO - Trial 99 finished with value: 0.09444325165296008 and parameters: {'n_layers': 1, 'embedding_dim': 256, 'lr': 0.007193720462250785, 'lambda_val': 0.0006487827710935426, 'batch_size': 2753, 'optimizer': 'RMSprop'}. Best is trial 98 with value: 0.09760244586234676.
2026-05-13 03:48:13,330 - optuna.study._optimize - INFO - Trial 100 pruned. 
2026-05-13 03:48:49,997 - optuna.study.study - INFO - Trial 101 finished with value: 0.09474029997758016 and parameters: {'n_layers': 1, 'embedding_dim': 256, 'lr': 0.0031046049920642905, 'lambda_val': 0.0008397599172990923, 'batch_size': 2786, 'optimizer': 'RMSprop'}. Best is trial 98 with value: 0.09760244586234676.
2026-05-13 03:49:28,634 - optuna.study.study - INFO - Trial 102 finished with value: 0.08707022576148435 and parameters: {'n_layers': 1, 'embedding_dim': 256, 'lr': 0.007343037199175023, 'lambda_val': 0.0003768746999037536, 'batch_size': 2771, 'optimizer': 'RMSprop'}. Best is trial 98 with value: 0.09760244586234676.
2026-05-13 03:50:06,218 - optuna.study.study - INFO - Trial 103 finished with value: 0.08117961629381627 and parameters: {'n_layers': 1, 'embedding_dim': 256, 'lr': 0.005095249670476067, 'lambda_val': 0.00021331116817720685, 'batch_size': 2700, 'optimizer': 'RMSprop'}. Best is trial 98 with value: 0.09760244586234676.
2026-05-13 03:50:48,604 - optuna.study.study - INFO - Trial 104 finished with value: 0.0951657897879389 and parameters: {'n_layers': 1, 'embedding_dim': 256, 'lr': 0.010077059675065218, 'lambda_val': 0.0006373668937115366, 'batch_size': 2921, 'optimizer': 'RMSprop'}. Best is trial 98 with value: 0.09760244586234676.
2026-05-13 03:50:57,696 - optuna.study._optimize - INFO - Trial 105 pruned. 
2026-05-13 03:51:02,354 - optuna.study._optimize - INFO - Trial 106 pruned. 
2026-05-13 03:51:09,752 - optuna.study._optimize - INFO - Trial 107 pruned. 
2026-05-13 03:51:47,713 - optuna.study.study - INFO - Trial 108 finished with value: 0.09028574435322992 and parameters: {'n_layers': 1, 'embedding_dim': 256, 'lr': 0.0074061045930185225, 'lambda_val': 0.0008099531330258095, 'batch_size': 2869, 'optimizer': 'RMSprop'}. Best is trial 98 with value: 0.09760244586234676.
2026-05-13 03:51:52,424 - optuna.study._optimize - INFO - Trial 109 pruned. 
2026-05-13 03:52:35,051 - optuna.study.study - INFO - Trial 110 finished with value: 0.0856466676711328 and parameters: {'n_layers': 1, 'embedding_dim': 256, 'lr': 0.004194884425873312, 'lambda_val': 0.0005014910830658373, 'batch_size': 3121, 'optimizer': 'RMSprop'}. Best is trial 98 with value: 0.09760244586234676.
2026-05-13 03:53:12,474 - optuna.study.study - INFO - Trial 111 finished with value: 0.0945164513473331 and parameters: {'n_layers': 1, 'embedding_dim': 256, 'lr': 0.007182071311526003, 'lambda_val': 0.0008953371765774405, 'batch_size': 2878, 'optimizer': 'RMSprop'}. Best is trial 98 with value: 0.09760244586234676.
2026-05-13 03:53:48,120 - optuna.study.study - INFO - Trial 112 finished with value: 0.08994221873735332 and parameters: {'n_layers': 1, 'embedding_dim': 256, 'lr': 0.009228624697381038, 'lambda_val': 0.0008693215853736033, 'batch_size': 2936, 'optimizer': 'RMSprop'}. Best is trial 98 with value: 0.09760244586234676.
2026-05-13 03:54:03,990 - optuna.study._optimize - INFO - Trial 113 pruned. 
2026-05-13 03:54:08,670 - optuna.study._optimize - INFO - Trial 114 pruned. 
2026-05-13 03:54:46,046 - optuna.study.study - INFO - Trial 115 finished with value: 0.09551127045534522 and parameters: {'n_layers': 1, 'embedding_dim': 256, 'lr': 0.008193391148061831, 'lambda_val': 0.001238757525702295, 'batch_size': 2829, 'optimizer': 'RMSprop'}. Best is trial 98 with value: 0.09760244586234676.
