2026-05-13 20:39:38,675 - optuna.study.study - INFO - Trial 168 finished with value: 0.035893111306615974 and parameters: {'n_layers': 1, 'embedding_dim': 64, 'lr': 0.00016509350561832192, 'lambda_val': 1.2150462158883862e-06, 'batch_size': 639, 'optimizer': 'RMSprop'}. Best is trial 156 with value: 0.04491812896364409.
2026-05-13 20:40:05,486 - optuna.study.study - INFO - Trial 169 finished with value: 0.041386263773102144 and parameters: {'n_layers': 1, 'embedding_dim': 64, 'lr': 0.00015580941890910461, 'lambda_val': 1.2786306228842431e-06, 'batch_size': 644, 'optimizer': 'RMSprop'}. Best is trial 156 with value: 0.04491812896364409.
2026-05-13 20:40:31,385 - optuna.study.study - INFO - Trial 170 finished with value: 0.031722579347492806 and parameters: {'n_layers': 1, 'embedding_dim': 64, 'lr': 0.00018657816079444873, 'lambda_val': 1.2334235414019051e-06, 'batch_size': 632, 'optimizer': 'RMSprop'}. Best is trial 156 with value: 0.04491812896364409.
2026-05-13 20:40:57,490 - optuna.study.study - INFO - Trial 171 finished with value: 0.008299060264607267 and parameters: {'n_layers': 1, 'embedding_dim': 64, 'lr': 0.0002644904371035319, 'lambda_val': 2.3468892051930643e-06, 'batch_size': 704, 'optimizer': 'RMSprop'}. Best is trial 156 with value: 0.04491812896364409.
2026-05-13 20:41:27,696 - optuna.study.study - INFO - Trial 172 finished with value: 0.03614834175276255 and parameters: {'n_layers': 1, 'embedding_dim': 64, 'lr': 0.00015862791102964793, 'lambda_val': 1.5960098367360936e-06, 'batch_size': 566, 'optimizer': 'RMSprop'}. Best is trial 156 with value: 0.04491812896364409.
2026-05-13 20:41:55,332 - optuna.study.study - INFO - Trial 173 finished with value: 0.037174106684966304 and parameters: {'n_layers': 1, 'embedding_dim': 64, 'lr': 0.00016116602984646682, 'lambda_val': 1.5555360846980828e-06, 'batch_size': 577, 'optimizer': 'RMSprop'}. Best is trial 156 with value: 0.04491812896364409.
2026-05-13 20:42:17,683 - optuna.study.study - INFO - Trial 174 finished with value: 0.04248511891893783 and parameters: {'n_layers': 1, 'embedding_dim': 64, 'lr': 0.0001627071350561008, 'lambda_val': 1.449537791833086e-06, 'batch_size': 568, 'optimizer': 'RMSprop'}. Best is trial 156 with value: 0.04491812896364409.
2026-05-13 20:42:42,892 - optuna.study.study - INFO - Trial 175 finished with value: 0.011858562353652034 and parameters: {'n_layers': 1, 'embedding_dim': 64, 'lr': 0.0003813921003702006, 'lambda_val': 1.5685018485182031e-06, 'batch_size': 514, 'optimizer': 'RMSprop'}. Best is trial 156 with value: 0.04491812896364409.
2026-05-13 20:43:11,014 - optuna.study.study - INFO - Trial 176 finished with value: 0.014993107997538786 and parameters: {'n_layers': 1, 'embedding_dim': 64, 'lr': 0.00021138656007660693, 'lambda_val': 1.5834326315799752e-06, 'batch_size': 846, 'optimizer': 'RMSprop'}. Best is trial 156 with value: 0.04491812896364409.
2026-05-13 20:43:38,986 - optuna.study.study - INFO - Trial 177 finished with value: 0.039193731757391354 and parameters: {'n_layers': 1, 'embedding_dim': 64, 'lr': 0.0001325144281028988, 'lambda_val': 2.2539765243224133e-06, 'batch_size': 587, 'optimizer': 'Adam'}. Best is trial 156 with value: 0.04491812896364409.
2026-05-13 20:44:07,103 - optuna.study.study - INFO - Trial 178 finished with value: 0.03078062522666576 and parameters: {'n_layers': 1, 'embedding_dim': 64, 'lr': 0.00015915654198657027, 'lambda_val': 2.3291221157197206e-06, 'batch_size': 590, 'optimizer': 'Adam'}. Best is trial 156 with value: 0.04491812896364409.
2026-05-13 20:44:34,213 - optuna.study.study - INFO - Trial 179 finished with value: 0.029278740004837295 and parameters: {'n_layers': 1, 'embedding_dim': 64, 'lr': 0.00013699111745394375, 'lambda_val': 1.1351929082974789e-06, 'batch_size': 581, 'optimizer': 'Adam'}. Best is trial 156 with value: 0.04491812896364409.
2026-05-13 20:45:01,336 - optuna.study.study - INFO - Trial 180 finished with value: 0.029703687267515294 and parameters: {'n_layers': 1, 'embedding_dim': 64, 'lr': 0.00017966125879368018, 'lambda_val': 2.4035466868113132e-06, 'batch_size': 684, 'optimizer': 'Adam'}. Best is trial 156 with value: 0.04491812896364409.
2026-05-13 20:45:28,394 - optuna.study.study - INFO - Trial 181 finished with value: 0.04221384624044826 and parameters: {'n_layers': 1, 'embedding_dim': 64, 'lr': 0.0001358091438664898, 'lambda_val': 1.7693459795597475e-06, 'batch_size': 568, 'optimizer': 'RMSprop'}. Best is trial 156 with value: 0.04491812896364409.
2026-05-13 20:45:49,063 - optuna.study.study - INFO - Trial 182 finished with value: 0.011129350308317333 and parameters: {'n_layers': 1, 'embedding_dim': 64, 'lr': 0.0002836381266506192, 'lambda_val': 1.9018605826481233e-06, 'batch_size': 545, 'optimizer': 'Adam'}. Best is trial 156 with value: 0.04491812896364409.
2026-05-13 20:46:18,118 - optuna.study.study - INFO - Trial 183 finished with value: 0.030837293070260594 and parameters: {'n_layers': 1, 'embedding_dim': 64, 'lr': 0.00012946184838295965, 'lambda_val': 1.007804014165811e-06, 'batch_size': 661, 'optimizer': 'Adam'}. Best is trial 156 with value: 0.04491812896364409.
2026-05-13 20:46:46,348 - optuna.study.study - INFO - Trial 184 finished with value: 0.02813915775447093 and parameters: {'n_layers': 1, 'embedding_dim': 64, 'lr': 0.00023180709191853826, 'lambda_val': 1.7366678696177378e-06, 'batch_size': 515, 'optimizer': 'RMSprop'}. Best is trial 156 with value: 0.04491812896364409.
2026-05-13 20:47:22,668 - optuna.study.study - INFO - Trial 185 finished with value: 0.03279920430749187 and parameters: {'n_layers': 1, 'embedding_dim': 64, 'lr': 0.00015576212973566957, 'lambda_val': 2.7279035779317895e-06, 'batch_size': 752, 'optimizer': 'RMSprop'}. Best is trial 156 with value: 0.04491812896364409.
2026-05-13 20:47:59,341 - optuna.study.study - INFO - Trial 186 finished with value: 0.040851115377998175 and parameters: {'n_layers': 1, 'embedding_dim': 64, 'lr': 0.0001288978146233293, 'lambda_val': 1.4459576969613539e-06, 'batch_size': 618, 'optimizer': 'RMSprop'}. Best is trial 156 with value: 0.04491812896364409.
2026-05-13 20:48:24,312 - optuna.study.study - INFO - Trial 187 finished with value: 0.03814086703472252 and parameters: {'n_layers': 1, 'embedding_dim': 64, 'lr': 0.00013209529449987884, 'lambda_val': 1.9625414559183713e-06, 'batch_size': 630, 'optimizer': 'RMSprop'}. Best is trial 156 with value: 0.04491812896364409.
2026-05-13 20:48:27,280 - optuna.study._optimize - INFO - Trial 188 pruned. 
2026-05-13 20:48:53,694 - optuna.study.study - INFO - Trial 189 finished with value: 0.04146069962921812 and parameters: {'n_layers': 1, 'embedding_dim': 64, 'lr': 0.0001357848654334671, 'lambda_val': 1.3546318962771305e-06, 'batch_size': 614, 'optimizer': 'RMSprop'}. Best is trial 156 with value: 0.04491812896364409.
2026-05-13 20:49:20,892 - optuna.study.study - INFO - Trial 190 finished with value: 0.03309391425380894 and parameters: {'n_layers': 1, 'embedding_dim': 64, 'lr': 0.00013264156809141976, 'lambda_val': 3.0633256362621175e-06, 'batch_size': 878, 'optimizer': 'RMSprop'}. Best is trial 156 with value: 0.04491812896364409.
2026-05-13 20:49:47,411 - optuna.study.study - INFO - Trial 191 finished with value: 0.03816753465775927 and parameters: {'n_layers': 1, 'embedding_dim': 64, 'lr': 0.00013305851155770294, 'lambda_val': 1.2887265571306598e-06, 'batch_size': 602, 'optimizer': 'RMSprop'}. Best is trial 156 with value: 0.04491812896364409.
2026-05-13 20:50:14,902 - optuna.study.study - INFO - Trial 192 finished with value: 0.04151611682963731 and parameters: {'n_layers': 1, 'embedding_dim': 64, 'lr': 0.00012846276071444757, 'lambda_val': 1.3406112829381576e-06, 'batch_size': 707, 'optimizer': 'RMSprop'}. Best is trial 156 with value: 0.04491812896364409.
2026-05-13 20:50:46,570 - optuna.study.study - INFO - Trial 193 finished with value: 0.040664646844288214 and parameters: {'n_layers': 1, 'embedding_dim': 64, 'lr': 0.00012415476471556194, 'lambda_val': 1.0120965478928482e-06, 'batch_size': 727, 'optimizer': 'RMSprop'}. Best is trial 156 with value: 0.04491812896364409.
2026-05-13 20:51:13,287 - optuna.study.study - INFO - Trial 194 finished with value: 0.04065512092634357 and parameters: {'n_layers': 1, 'embedding_dim': 64, 'lr': 0.00012430335486847792, 'lambda_val': 1.082520612585322e-06, 'batch_size': 776, 'optimizer': 'RMSprop'}. Best is trial 156 with value: 0.04491812896364409.
2026-05-13 20:51:39,411 - optuna.study.study - INFO - Trial 195 finished with value: 0.04394569099709747 and parameters: {'n_layers': 1, 'embedding_dim': 64, 'lr': 0.00010255605850969953, 'lambda_val': 1.0733870254325653e-06, 'batch_size': 734, 'optimizer': 'RMSprop'}. Best is trial 156 with value: 0.04491812896364409.
2026-05-13 20:52:04,977 - optuna.study.study - INFO - Trial 196 finished with value: 0.045778532458303656 and parameters: {'n_layers': 1, 'embedding_dim': 64, 'lr': 0.00010049477675932628, 'lambda_val': 1.0209836072806434e-06, 'batch_size': 729, 'optimizer': 'RMSprop'}. Best is trial 196 with value: 0.045778532458303656.
2026-05-13 20:52:09,415 - optuna.study._optimize - INFO - Trial 197 pruned. 
2026-05-13 20:52:13,159 - optuna.study._optimize - INFO - Trial 198 pruned. 
2026-05-13 20:52:39,942 - optuna.study.study - INFO - Trial 199 finished with value: 0.03180420410262282 and parameters: {'n_layers': 1, 'embedding_dim': 64, 'lr': 0.00012581506412264227, 'lambda_val': 1.3457593602654108e-06, 'batch_size': 803, 'optimizer': 'Adam'}. Best is trial 196 with value: 0.045778532458303656.
2026-05-13 20:52:59,370 - root - INFO -   ** Getting the trainable edges:
2026-05-13 20:52:59,375 - helper_functions - INFO -      Number of nodes: 4883
2026-05-13 20:52:59,375 - helper_functions - INFO -      Ratio: 0.5389029908398631
2026-05-13 20:52:59,375 - helper_functions - INFO -      Number of unique users: 343
2026-05-13 20:52:59,375 - helper_functions - INFO -      Number of unique items: 4540
2026-05-13 20:52:59,375 - helper_functions - INFO -      Total dominant set edge: 70473
2026-05-13 20:52:59,375 - helper_functions - INFO -      Trainable edges: 56378.4
2026-05-13 20:52:59,383 - root - INFO -   **** Getting 70473 dominant set edges
2026-05-13 20:52:59,505 - optuna.storages._rdb.storage - INFO - A new study created in RDB with name: Study_e_100K_1c3dcs
2026-05-13 20:53:38,429 - optuna.study.study - INFO - Trial 0 finished with value: 0.015654847011790127 and parameters: {'n_layers': 4, 'embedding_dim': 64, 'lr': 0.0017523975273909687, 'lambda_val': 0.012326111446875152, 'batch_size': 2188, 'optimizer': 'RMSprop'}. Best is trial 0 with value: 0.015654847011790127.
2026-05-13 20:54:23,246 - optuna.study.study - INFO - Trial 1 finished with value: 0.011819657490671787 and parameters: {'n_layers': 4, 'embedding_dim': 96, 'lr': 0.0014035613504632797, 'lambda_val': 2.1713152614595624e-05, 'batch_size': 3790, 'optimizer': 'Adam'}. Best is trial 0 with value: 0.015654847011790127.
2026-05-13 20:55:10,023 - optuna.study.study - INFO - Trial 2 finished with value: 0.0030684355191687804 and parameters: {'n_layers': 4, 'embedding_dim': 128, 'lr': 0.07580634858332172, 'lambda_val': 0.0020266523650757933, 'batch_size': 1109, 'optimizer': 'SGD'}. Best is trial 0 with value: 0.015654847011790127.
2026-05-13 20:55:37,114 - optuna.study.study - INFO - Trial 3 finished with value: 0.0015758987164973157 and parameters: {'n_layers': 1, 'embedding_dim': 128, 'lr': 6.400853701699839e-05, 'lambda_val': 6.24659115723669e-06, 'batch_size': 1334, 'optimizer': 'SGD'}. Best is trial 0 with value: 0.015654847011790127.
2026-05-13 20:56:06,231 - optuna.study.study - INFO - Trial 4 finished with value: 0.002009487433383801 and parameters: {'n_layers': 1, 'embedding_dim': 96, 'lr': 5.2455371186763575e-05, 'lambda_val': 0.00587605766863971, 'batch_size': 2774, 'optimizer': 'SGD'}. Best is trial 0 with value: 0.015654847011790127.
2026-05-13 20:56:11,134 - optuna.study._optimize - INFO - Trial 5 pruned. 
2026-05-13 20:56:15,711 - optuna.study._optimize - INFO - Trial 6 pruned. 
2026-05-13 20:56:53,073 - optuna.study.study - INFO - Trial 7 finished with value: 0.02837624662567157 and parameters: {'n_layers': 2, 'embedding_dim': 128, 'lr': 0.004562128105704662, 'lambda_val': 0.001502483493534161, 'batch_size': 1610, 'optimizer': 'Adam'}. Best is trial 7 with value: 0.02837624662567157.
2026-05-13 20:57:30,351 - optuna.study.study - INFO - Trial 8 finished with value: 0.010650228222300339 and parameters: {'n_layers': 4, 'embedding_dim': 32, 'lr': 0.008052944035143162, 'lambda_val': 2.8552042044203183e-06, 'batch_size': 2877, 'optimizer': 'Adam'}. Best is trial 7 with value: 0.02837624662567157.
2026-05-13 20:57:35,342 - optuna.study._optimize - INFO - Trial 9 pruned. 
2026-05-13 20:58:19,104 - optuna.study.study - INFO - Trial 10 finished with value: 0.03171409078431788 and parameters: {'n_layers': 2, 'embedding_dim': 256, 'lr': 0.00029782691585972996, 'lambda_val': 0.00010460986708115738, 'batch_size': 624, 'optimizer': 'Adam'}. Best is trial 10 with value: 0.03171409078431788.
2026-05-13 20:59:02,877 - optuna.study.study - INFO - Trial 11 finished with value: 0.05104587802642686 and parameters: {'n_layers': 2, 'embedding_dim': 256, 'lr': 0.00015618039370319994, 'lambda_val': 7.50330144197865e-05, 'batch_size': 522, 'optimizer': 'Adam'}. Best is trial 11 with value: 0.05104587802642686.
2026-05-13 20:59:46,159 - optuna.study.study - INFO - Trial 12 finished with value: 0.043864701353241116 and parameters: {'n_layers': 2, 'embedding_dim': 256, 'lr': 0.00025074899509189893, 'lambda_val': 0.00015323784819816922, 'batch_size': 521, 'optimizer': 'Adam'}. Best is trial 11 with value: 0.05104587802642686.
2026-05-13 21:00:39,270 - optuna.study.study - INFO - Trial 13 finished with value: 0.03058359433452154 and parameters: {'n_layers': 3, 'embedding_dim': 256, 'lr': 0.00029124405521970334, 'lambda_val': 6.393360696446042e-05, 'batch_size': 573, 'optimizer': 'Adam'}. Best is trial 11 with value: 0.05104587802642686.
2026-05-13 21:01:32,638 - optuna.study.study - INFO - Trial 14 finished with value: 0.023009172530428154 and parameters: {'n_layers': 3, 'embedding_dim': 256, 'lr': 0.00026112025172260597, 'lambda_val': 0.00027101597563189157, 'batch_size': 1130, 'optimizer': 'Adam'}. Best is trial 11 with value: 0.05104587802642686.
2026-05-13 21:01:37,972 - optuna.study._optimize - INFO - Trial 15 pruned. 
2026-05-13 21:02:13,422 - optuna.study.study - INFO - Trial 16 finished with value: 0.09357222138001613 and parameters: {'n_layers': 1, 'embedding_dim': 256, 'lr': 0.00014068294229963596, 'lambda_val': 0.0004156698276211701, 'batch_size': 741, 'optimizer': 'RMSprop'}. Best is trial 16 with value: 0.09357222138001613.
2026-05-13 21:02:17,749 - optuna.study._optimize - INFO - Trial 17 pruned. 
2026-05-13 21:02:52,290 - optuna.study.study - INFO - Trial 18 finished with value: 0.05719341663057725 and parameters: {'n_layers': 1, 'embedding_dim': 256, 'lr': 0.000553150264499095, 'lambda_val': 1.3259236815496471e-05, 'batch_size': 1716, 'optimizer': 'RMSprop'}. Best is trial 16 with value: 0.09357222138001613.
2026-05-13 21:02:56,930 - optuna.study._optimize - INFO - Trial 19 pruned. 
2026-05-13 21:03:26,127 - optuna.study.study - INFO - Trial 20 finished with value: 0.033261911989435775 and parameters: {'n_layers': 1, 'embedding_dim': 32, 'lr': 0.0007730966120205277, 'lambda_val': 1.2910068775746674e-05, 'batch_size': 2629, 'optimizer': 'RMSprop'}. Best is trial 16 with value: 0.09357222138001613.
2026-05-13 21:04:01,550 - optuna.study.study - INFO - Trial 21 finished with value: 0.059773439973987534 and parameters: {'n_layers': 1, 'embedding_dim': 256, 'lr': 0.0005965903837746956, 'lambda_val': 5.163313743470024e-05, 'batch_size': 919, 'optimizer': 'RMSprop'}. Best is trial 16 with value: 0.09357222138001613.
2026-05-13 21:04:45,039 - optuna.study.study - INFO - Trial 22 finished with value: 0.04226430557863727 and parameters: {'n_layers': 1, 'embedding_dim': 256, 'lr': 0.0006429546138141969, 'lambda_val': 1.3251321656822912e-05, 'batch_size': 1894, 'optimizer': 'RMSprop'}. Best is trial 16 with value: 0.09357222138001613.
2026-05-13 21:05:26,965 - optuna.study.study - INFO - Trial 23 finished with value: 0.04145441826129692 and parameters: {'n_layers': 1, 'embedding_dim': 256, 'lr': 0.004307297919401408, 'lambda_val': 3.5256930247190696e-05, 'batch_size': 880, 'optimizer': 'RMSprop'}. Best is trial 16 with value: 0.09357222138001613.
2026-05-13 21:06:06,318 - optuna.study.study - INFO - Trial 24 finished with value: 0.07155557172355746 and parameters: {'n_layers': 1, 'embedding_dim': 256, 'lr': 0.00042680457830245624, 'lambda_val': 0.0003282013642042596, 'batch_size': 1408, 'optimizer': 'RMSprop'}. Best is trial 16 with value: 0.09357222138001613.
2026-05-13 21:06:11,608 - optuna.study._optimize - INFO - Trial 25 pruned. 
2026-05-13 21:06:21,819 - optuna.study._optimize - INFO - Trial 26 pruned. 
2026-05-13 21:06:58,473 - optuna.study.study - INFO - Trial 27 finished with value: 0.06936818507244659 and parameters: {'n_layers': 1, 'embedding_dim': 256, 'lr': 0.003194014315577968, 'lambda_val': 0.0009113950134155641, 'batch_size': 1354, 'optimizer': 'RMSprop'}. Best is trial 16 with value: 0.09357222138001613.
2026-05-13 21:07:04,172 - optuna.study._optimize - INFO - Trial 28 pruned. 
2026-05-13 21:07:07,805 - optuna.study._optimize - INFO - Trial 29 pruned. 
2026-05-13 21:07:13,561 - optuna.study._optimize - INFO - Trial 30 pruned. 
2026-05-13 21:07:47,385 - optuna.study.study - INFO - Trial 31 finished with value: 0.045157853799410064 and parameters: {'n_layers': 1, 'embedding_dim': 256, 'lr': 0.00100008645063887, 'lambda_val': 0.0002035507112269003, 'batch_size': 815, 'optimizer': 'RMSprop'}. Best is trial 16 with value: 0.09357222138001613.
2026-05-13 21:08:21,725 - optuna.study.study - INFO - Trial 32 finished with value: 0.09772797769087545 and parameters: {'n_layers': 1, 'embedding_dim': 256, 'lr': 0.00014423460046792224, 'lambda_val': 0.0005032368321638477, 'batch_size': 1182, 'optimizer': 'RMSprop'}. Best is trial 32 with value: 0.09772797769087545.
2026-05-13 21:08:50,591 - optuna.study.study - INFO - Trial 33 finished with value: 0.08485009954796445 and parameters: {'n_layers': 1, 'embedding_dim': 96, 'lr': 0.00014927763849499818, 'lambda_val': 0.000553135289943047, 'batch_size': 1181, 'optimizer': 'RMSprop'}. Best is trial 32 with value: 0.09772797769087545.
2026-05-13 21:08:54,366 - optuna.study._optimize - INFO - Trial 34 pruned. 
2026-05-13 21:08:59,736 - optuna.study._optimize - INFO - Trial 35 pruned. 
2026-05-13 21:09:03,469 - optuna.study._optimize - INFO - Trial 36 pruned. 
2026-05-13 21:09:07,361 - optuna.study._optimize - INFO - Trial 37 pruned. 
2026-05-13 21:09:11,617 - optuna.study._optimize - INFO - Trial 38 pruned. 
2026-05-13 21:09:41,120 - optuna.study.study - INFO - Trial 39 finished with value: 0.0805995629596044 and parameters: {'n_layers': 1, 'embedding_dim': 96, 'lr': 0.00019098424520727676, 'lambda_val': 0.0013712280222659536, 'batch_size': 751, 'optimizer': 'RMSprop'}. Best is trial 32 with value: 0.09772797769087545.
2026-05-13 21:09:45,622 - optuna.study._optimize - INFO - Trial 40 pruned. 
2026-05-13 21:10:14,800 - optuna.study.study - INFO - Trial 41 finished with value: 0.06887761825425512 and parameters: {'n_layers': 1, 'embedding_dim': 96, 'lr': 0.0004017399034561628, 'lambda_val': 0.0001358572772840937, 'batch_size': 702, 'optimizer': 'RMSprop'}. Best is trial 32 with value: 0.09772797769087545.
2026-05-13 21:10:43,382 - optuna.study.study - INFO - Trial 42 finished with value: 0.04976800039692409 and parameters: {'n_layers': 1, 'embedding_dim': 96, 'lr': 0.0013315567056502247, 'lambda_val': 0.001535382341341145, 'batch_size': 1088, 'optimizer': 'RMSprop'}. Best is trial 32 with value: 0.09772797769087545.
2026-05-13 21:10:47,677 - optuna.study._optimize - INFO - Trial 43 pruned. 
2026-05-13 21:10:51,562 - optuna.study._optimize - INFO - Trial 44 pruned. 
2026-05-13 21:11:23,679 - optuna.study.study - INFO - Trial 45 finished with value: 0.07958953541573345 and parameters: {'n_layers': 1, 'embedding_dim': 128, 'lr': 0.0004030200645367191, 'lambda_val': 0.0012323353691937647, 'batch_size': 738, 'optimizer': 'RMSprop'}. Best is trial 32 with value: 0.09772797769087545.
2026-05-13 21:11:55,917 - optuna.study.study - INFO - Trial 46 finished with value: 0.07493917912871506 and parameters: {'n_layers': 1, 'embedding_dim': 128, 'lr': 0.00023685772172784934, 'lambda_val': 0.0013562318702511538, 'batch_size': 741, 'optimizer': 'RMSprop'}. Best is trial 32 with value: 0.09772797769087545.
2026-05-13 21:12:00,518 - optuna.study._optimize - INFO - Trial 47 pruned. 
2026-05-13 21:12:05,164 - optuna.study._optimize - INFO - Trial 48 pruned. 
2026-05-13 21:12:10,408 - optuna.study._optimize - INFO - Trial 49 pruned. 
2026-05-13 21:12:14,701 - optuna.study._optimize - INFO - Trial 50 pruned. 
2026-05-13 21:12:45,156 - optuna.study.study - INFO - Trial 51 finished with value: 0.09055396751311628 and parameters: {'n_layers': 1, 'embedding_dim': 128, 'lr': 0.00019874973370599596, 'lambda_val': 0.0010675915263203132, 'batch_size': 773, 'optimizer': 'RMSprop'}. Best is trial 32 with value: 0.09772797769087545.
2026-05-13 21:12:49,284 - optuna.study._optimize - INFO - Trial 52 pruned. 
2026-05-13 21:12:58,452 - optuna.study._optimize - INFO - Trial 53 pruned. 
2026-05-13 21:13:30,838 - optuna.study.study - INFO - Trial 54 finished with value: 0.08988714771161703 and parameters: {'n_layers': 1, 'embedding_dim': 128, 'lr': 0.00019228596649563655, 'lambda_val': 0.0006525887596213131, 'batch_size': 1000, 'optimizer': 'RMSprop'}. Best is trial 32 with value: 0.09772797769087545.
