2026-05-13 17:47:50,480 - optuna.study._optimize - INFO - Trial 63 pruned. 
2026-05-13 17:48:26,769 - optuna.study.study - INFO - Trial 64 finished with value: 0.09502071183431109 and parameters: {'n_layers': 1, 'embedding_dim': 256, 'lr': 0.00012784811445635513, 'lambda_val': 1.5073764904806638e-05, 'batch_size': 2363, 'optimizer': 'Adam'}. Best is trial 64 with value: 0.09502071183431109.
2026-05-13 17:48:31,097 - optuna.study._optimize - INFO - Trial 65 pruned. 
2026-05-13 17:48:35,615 - optuna.study._optimize - INFO - Trial 66 pruned. 
2026-05-13 17:49:10,345 - optuna.study.study - INFO - Trial 67 finished with value: 0.07273045976764955 and parameters: {'n_layers': 1, 'embedding_dim': 256, 'lr': 0.00020546081507140558, 'lambda_val': 1.3248642799226913e-05, 'batch_size': 2110, 'optimizer': 'Adam'}. Best is trial 64 with value: 0.09502071183431109.
2026-05-13 17:49:45,888 - optuna.study.study - INFO - Trial 68 finished with value: 0.0706816998362662 and parameters: {'n_layers': 1, 'embedding_dim': 256, 'lr': 0.00018301896378187832, 'lambda_val': 1.0666936988788767e-05, 'batch_size': 2556, 'optimizer': 'Adam'}. Best is trial 64 with value: 0.09502071183431109.
2026-05-13 17:49:50,426 - optuna.study._optimize - INFO - Trial 69 pruned. 
2026-05-13 17:49:56,103 - optuna.study._optimize - INFO - Trial 70 pruned. 
2026-05-13 17:50:31,073 - optuna.study.study - INFO - Trial 71 finished with value: 0.08025236704065192 and parameters: {'n_layers': 1, 'embedding_dim': 256, 'lr': 0.00019648401954792754, 'lambda_val': 4.15034129020744e-05, 'batch_size': 2136, 'optimizer': 'Adam'}. Best is trial 64 with value: 0.09502071183431109.
2026-05-13 17:50:35,777 - optuna.study._optimize - INFO - Trial 72 pruned. 
2026-05-13 17:51:07,746 - optuna.study.study - INFO - Trial 73 finished with value: 0.08448088323437435 and parameters: {'n_layers': 1, 'embedding_dim': 256, 'lr': 0.00019670154602390008, 'lambda_val': 1.7713638318999493e-05, 'batch_size': 1881, 'optimizer': 'Adam'}. Best is trial 64 with value: 0.09502071183431109.
2026-05-13 17:51:11,910 - optuna.study._optimize - INFO - Trial 74 pruned. 
2026-05-13 17:51:44,384 - optuna.study.study - INFO - Trial 75 finished with value: 0.0670542538939648 and parameters: {'n_layers': 1, 'embedding_dim': 256, 'lr': 0.00035520027232808165, 'lambda_val': 8.612951341269807e-05, 'batch_size': 1997, 'optimizer': 'Adam'}. Best is trial 64 with value: 0.09502071183431109.
2026-05-13 17:52:16,484 - optuna.study.study - INFO - Trial 76 finished with value: 0.10025150451681919 and parameters: {'n_layers': 1, 'embedding_dim': 256, 'lr': 0.00015109815949065943, 'lambda_val': 3.2549377962672664e-05, 'batch_size': 1591, 'optimizer': 'Adam'}. Best is trial 76 with value: 0.10025150451681919.
2026-05-13 17:52:49,479 - optuna.study.study - INFO - Trial 77 finished with value: 0.10185378846839062 and parameters: {'n_layers': 1, 'embedding_dim': 256, 'lr': 0.000159905832008752, 'lambda_val': 1.1260920551920433e-05, 'batch_size': 1580, 'optimizer': 'Adam'}. Best is trial 77 with value: 0.10185378846839062.
2026-05-13 17:52:53,286 - optuna.study._optimize - INFO - Trial 78 pruned. 
2026-05-13 17:53:00,092 - optuna.study._optimize - INFO - Trial 79 pruned. 
2026-05-13 17:53:04,213 - optuna.study._optimize - INFO - Trial 80 pruned. 
2026-05-13 17:53:38,775 - optuna.study.study - INFO - Trial 81 finished with value: 0.09017717059446642 and parameters: {'n_layers': 1, 'embedding_dim': 256, 'lr': 0.00017899823645369545, 'lambda_val': 3.8106576250689836e-05, 'batch_size': 1832, 'optimizer': 'Adam'}. Best is trial 77 with value: 0.10185378846839062.
2026-05-13 17:54:13,874 - optuna.study.study - INFO - Trial 82 finished with value: 0.09360687559604126 and parameters: {'n_layers': 1, 'embedding_dim': 256, 'lr': 0.00017637707483115253, 'lambda_val': 9.987454421270332e-06, 'batch_size': 1780, 'optimizer': 'Adam'}. Best is trial 77 with value: 0.10185378846839062.
2026-05-13 17:54:48,268 - optuna.study.study - INFO - Trial 83 finished with value: 0.09732386018724799 and parameters: {'n_layers': 1, 'embedding_dim': 256, 'lr': 0.0001535863174958825, 'lambda_val': 1.1215781229304365e-05, 'batch_size': 1799, 'optimizer': 'Adam'}. Best is trial 77 with value: 0.10185378846839062.
2026-05-13 17:54:52,585 - optuna.study._optimize - INFO - Trial 84 pruned. 
2026-05-13 17:54:57,025 - optuna.study._optimize - INFO - Trial 85 pruned. 
2026-05-13 17:55:01,785 - optuna.study._optimize - INFO - Trial 86 pruned. 
2026-05-13 17:55:48,574 - optuna.study.study - INFO - Trial 87 finished with value: 0.08331071505071892 and parameters: {'n_layers': 1, 'embedding_dim': 256, 'lr': 0.0002606981486804951, 'lambda_val': 3.3304538530708876e-05, 'batch_size': 1598, 'optimizer': 'Adam'}. Best is trial 77 with value: 0.10185378846839062.
2026-05-13 17:56:29,447 - optuna.study.study - INFO - Trial 88 finished with value: 0.06422689689737453 and parameters: {'n_layers': 1, 'embedding_dim': 128, 'lr': 0.0003037333631761184, 'lambda_val': 1.4685201056820006e-05, 'batch_size': 1695, 'optimizer': 'Adam'}. Best is trial 77 with value: 0.10185378846839062.
2026-05-13 17:56:34,704 - optuna.study._optimize - INFO - Trial 89 pruned. 
2026-05-13 17:56:41,643 - optuna.study._optimize - INFO - Trial 90 pruned. 
2026-05-13 17:57:13,732 - optuna.study.study - INFO - Trial 91 finished with value: 0.0835103634876281 and parameters: {'n_layers': 1, 'embedding_dim': 256, 'lr': 0.00016622282239536716, 'lambda_val': 5.371316579147588e-06, 'batch_size': 1931, 'optimizer': 'Adam'}. Best is trial 77 with value: 0.10185378846839062.
2026-05-13 17:57:47,543 - optuna.study.study - INFO - Trial 92 finished with value: 0.07966703859062334 and parameters: {'n_layers': 1, 'embedding_dim': 256, 'lr': 0.00022267286194043448, 'lambda_val': 2.078081188745966e-05, 'batch_size': 1852, 'optimizer': 'Adam'}. Best is trial 77 with value: 0.10185378846839062.
2026-05-13 17:57:52,037 - optuna.study._optimize - INFO - Trial 93 pruned. 
2026-05-13 17:57:56,444 - optuna.study._optimize - INFO - Trial 94 pruned. 
2026-05-13 17:58:01,058 - optuna.study._optimize - INFO - Trial 95 pruned. 
2026-05-13 17:58:38,145 - optuna.study.study - INFO - Trial 96 finished with value: 0.07207085483452133 and parameters: {'n_layers': 1, 'embedding_dim': 256, 'lr': 0.00023272360174303198, 'lambda_val': 2.4674923814273222e-05, 'batch_size': 4007, 'optimizer': 'Adam'}. Best is trial 77 with value: 0.10185378846839062.
2026-05-13 17:58:42,042 - optuna.study._optimize - INFO - Trial 97 pruned. 
2026-05-13 17:59:17,046 - optuna.study.study - INFO - Trial 98 finished with value: 0.06902483242099092 and parameters: {'n_layers': 1, 'embedding_dim': 256, 'lr': 0.00043341310821523626, 'lambda_val': 3.5984844715134646e-05, 'batch_size': 1145, 'optimizer': 'Adam'}. Best is trial 77 with value: 0.10185378846839062.
2026-05-13 17:59:20,799 - optuna.study._optimize - INFO - Trial 99 pruned. 
2026-05-13 17:59:55,445 - optuna.study.study - INFO - Trial 100 finished with value: 0.07996258583388459 and parameters: {'n_layers': 1, 'embedding_dim': 256, 'lr': 0.00030867916403303636, 'lambda_val': 5.5545986114824716e-05, 'batch_size': 1581, 'optimizer': 'Adam'}. Best is trial 77 with value: 0.10185378846839062.
2026-05-13 17:59:59,884 - optuna.study._optimize - INFO - Trial 101 pruned. 
2026-05-13 18:00:34,020 - optuna.study.study - INFO - Trial 102 finished with value: 0.09162559686604262 and parameters: {'n_layers': 1, 'embedding_dim': 256, 'lr': 0.00016987765614851549, 'lambda_val': 3.8843988717963264e-06, 'batch_size': 1933, 'optimizer': 'Adam'}. Best is trial 77 with value: 0.10185378846839062.
2026-05-13 18:01:08,817 - optuna.study.study - INFO - Trial 103 finished with value: 0.07465544189372286 and parameters: {'n_layers': 1, 'embedding_dim': 256, 'lr': 0.00021681497661093295, 'lambda_val': 2.907624036763288e-06, 'batch_size': 1736, 'optimizer': 'Adam'}. Best is trial 77 with value: 0.10185378846839062.
2026-05-13 18:01:13,333 - optuna.study._optimize - INFO - Trial 104 pruned. 
2026-05-13 18:01:18,392 - optuna.study._optimize - INFO - Trial 105 pruned. 
2026-05-13 18:01:22,765 - optuna.study._optimize - INFO - Trial 106 pruned. 
2026-05-13 18:01:57,056 - optuna.study.study - INFO - Trial 107 finished with value: 0.06693365331376981 and parameters: {'n_layers': 1, 'embedding_dim': 256, 'lr': 0.0002782155628790398, 'lambda_val': 0.00039639160501968583, 'batch_size': 2269, 'optimizer': 'Adam'}. Best is trial 77 with value: 0.10185378846839062.
2026-05-13 18:02:01,571 - optuna.study._optimize - INFO - Trial 108 pruned. 
2026-05-13 18:02:36,767 - optuna.study.study - INFO - Trial 109 finished with value: 0.0755301866587913 and parameters: {'n_layers': 1, 'embedding_dim': 256, 'lr': 0.00036067066498792334, 'lambda_val': 1.2811632591227536e-05, 'batch_size': 1858, 'optimizer': 'Adam'}. Best is trial 77 with value: 0.10185378846839062.
2026-05-13 18:02:41,669 - optuna.study._optimize - INFO - Trial 110 pruned. 
2026-05-13 18:03:15,751 - optuna.study.study - INFO - Trial 111 finished with value: 0.08371778617536396 and parameters: {'n_layers': 1, 'embedding_dim': 256, 'lr': 0.00016385446144803314, 'lambda_val': 5.0317553273988205e-06, 'batch_size': 1941, 'optimizer': 'Adam'}. Best is trial 77 with value: 0.10185378846839062.
2026-05-13 18:03:19,857 - optuna.study._optimize - INFO - Trial 112 pruned. 
2026-05-13 18:03:51,481 - optuna.study.study - INFO - Trial 113 finished with value: 0.09175799338736071 and parameters: {'n_layers': 1, 'embedding_dim': 256, 'lr': 0.00016373433692517053, 'lambda_val': 0.0005206578578643824, 'batch_size': 1810, 'optimizer': 'Adam'}. Best is trial 77 with value: 0.10185378846839062.
2026-05-13 18:04:23,823 - optuna.study.study - INFO - Trial 114 finished with value: 0.08328573328321899 and parameters: {'n_layers': 1, 'embedding_dim': 256, 'lr': 0.00019829579506749703, 'lambda_val': 0.0007477221686251049, 'batch_size': 1795, 'optimizer': 'Adam'}. Best is trial 77 with value: 0.10185378846839062.
2026-05-13 18:04:57,934 - optuna.study.study - INFO - Trial 115 finished with value: 0.06762534196964894 and parameters: {'n_layers': 1, 'embedding_dim': 256, 'lr': 0.00023882198802421876, 'lambda_val': 0.0005857109850729289, 'batch_size': 2190, 'optimizer': 'Adam'}. Best is trial 77 with value: 0.10185378846839062.
2026-05-13 18:05:02,085 - optuna.study._optimize - INFO - Trial 116 pruned. 
2026-05-13 18:05:06,226 - optuna.study._optimize - INFO - Trial 117 pruned. 
2026-05-13 18:05:10,003 - optuna.study._optimize - INFO - Trial 118 pruned. 
2026-05-13 18:05:14,022 - optuna.study._optimize - INFO - Trial 119 pruned. 
2026-05-13 18:05:17,590 - optuna.study._optimize - INFO - Trial 120 pruned. 
2026-05-13 18:05:51,361 - optuna.study.study - INFO - Trial 121 finished with value: 0.08677140150163055 and parameters: {'n_layers': 1, 'embedding_dim': 256, 'lr': 0.00017145618639780028, 'lambda_val': 5.7328145706945235e-06, 'batch_size': 1911, 'optimizer': 'Adam'}. Best is trial 77 with value: 0.10185378846839062.
2026-05-13 18:06:26,280 - optuna.study.study - INFO - Trial 122 finished with value: 0.0722799228180241 and parameters: {'n_layers': 1, 'embedding_dim': 256, 'lr': 0.0002239532340990895, 'lambda_val': 1.7365951801881448e-05, 'batch_size': 2113, 'optimizer': 'Adam'}. Best is trial 77 with value: 0.10185378846839062.
2026-05-13 18:07:01,159 - optuna.study.study - INFO - Trial 123 finished with value: 0.09053347315062663 and parameters: {'n_layers': 1, 'embedding_dim': 256, 'lr': 0.000181363824799198, 'lambda_val': 3.530566659827539e-06, 'batch_size': 1708, 'optimizer': 'Adam'}. Best is trial 77 with value: 0.10185378846839062.
2026-05-13 18:07:05,665 - optuna.study._optimize - INFO - Trial 124 pruned. 
2026-05-13 18:07:10,061 - optuna.study._optimize - INFO - Trial 125 pruned. 
2026-05-13 18:07:14,433 - optuna.study._optimize - INFO - Trial 126 pruned. 
2026-05-13 18:07:18,923 - optuna.study._optimize - INFO - Trial 127 pruned. 
2026-05-13 18:07:54,064 - optuna.study.study - INFO - Trial 128 finished with value: 0.07235450398588772 and parameters: {'n_layers': 1, 'embedding_dim': 256, 'lr': 0.0005184437754370667, 'lambda_val': 0.001471195417411794, 'batch_size': 2015, 'optimizer': 'Adam'}. Best is trial 77 with value: 0.10185378846839062.
2026-05-13 18:07:58,155 - optuna.study._optimize - INFO - Trial 129 pruned. 
2026-05-13 18:08:36,565 - optuna.study.study - INFO - Trial 130 finished with value: 0.06963502091424918 and parameters: {'n_layers': 1, 'embedding_dim': 256, 'lr': 0.0003614389085530551, 'lambda_val': 1.2456419940360553e-06, 'batch_size': 2223, 'optimizer': 'Adam'}. Best is trial 77 with value: 0.10185378846839062.
2026-05-13 18:09:16,481 - optuna.study.study - INFO - Trial 131 finished with value: 0.07319141055150084 and parameters: {'n_layers': 1, 'embedding_dim': 256, 'lr': 0.00020017502350841508, 'lambda_val': 6.228559651375241e-06, 'batch_size': 1886, 'optimizer': 'Adam'}. Best is trial 77 with value: 0.10185378846839062.
2026-05-13 18:09:53,029 - optuna.study.study - INFO - Trial 132 finished with value: 0.07542692408229465 and parameters: {'n_layers': 1, 'embedding_dim': 256, 'lr': 0.0002665510852455608, 'lambda_val': 8.129816716907951e-06, 'batch_size': 1818, 'optimizer': 'Adam'}. Best is trial 77 with value: 0.10185378846839062.
2026-05-13 18:09:57,809 - optuna.study._optimize - INFO - Trial 133 pruned. 
2026-05-13 18:10:32,337 - optuna.study.study - INFO - Trial 134 finished with value: 0.08085554720654595 and parameters: {'n_layers': 1, 'embedding_dim': 256, 'lr': 0.00017426446430655749, 'lambda_val': 3.672162322034606e-05, 'batch_size': 2144, 'optimizer': 'Adam'}. Best is trial 77 with value: 0.10185378846839062.
2026-05-13 18:11:06,838 - optuna.study.study - INFO - Trial 135 finished with value: 0.0791620385444188 and parameters: {'n_layers': 1, 'embedding_dim': 256, 'lr': 0.000224446167746316, 'lambda_val': 1.1056997835559121e-05, 'batch_size': 1922, 'optimizer': 'Adam'}. Best is trial 77 with value: 0.10185378846839062.
2026-05-13 18:11:10,768 - optuna.study._optimize - INFO - Trial 136 pruned. 
2026-05-13 18:11:15,175 - optuna.study._optimize - INFO - Trial 137 pruned. 
2026-05-13 18:11:48,489 - optuna.study.study - INFO - Trial 138 finished with value: 0.06278086619342776 and parameters: {'n_layers': 1, 'embedding_dim': 256, 'lr': 0.0003141929313508607, 'lambda_val': 6.05014852050213e-06, 'batch_size': 1843, 'optimizer': 'RMSprop'}. Best is trial 77 with value: 0.10185378846839062.
2026-05-13 18:11:55,063 - optuna.study._optimize - INFO - Trial 139 pruned. 
2026-05-13 18:11:59,107 - optuna.study._optimize - INFO - Trial 140 pruned. 
2026-05-13 18:12:03,691 - optuna.study._optimize - INFO - Trial 141 pruned. 
2026-05-13 18:12:08,208 - optuna.study._optimize - INFO - Trial 142 pruned. 
2026-05-13 18:12:43,526 - optuna.study.study - INFO - Trial 143 finished with value: 0.08120875236015093 and parameters: {'n_layers': 1, 'embedding_dim': 256, 'lr': 0.00020958691778730267, 'lambda_val': 1.8783122648489678e-05, 'batch_size': 1656, 'optimizer': 'Adam'}. Best is trial 77 with value: 0.10185378846839062.
2026-05-13 18:13:18,125 - optuna.study.study - INFO - Trial 144 finished with value: 0.07062556085964357 and parameters: {'n_layers': 1, 'embedding_dim': 256, 'lr': 0.00025885957032914704, 'lambda_val': 1.0377058999972845e-05, 'batch_size': 1877, 'optimizer': 'Adam'}. Best is trial 77 with value: 0.10185378846839062.
2026-05-13 18:13:22,796 - optuna.study._optimize - INFO - Trial 145 pruned. 
2026-05-13 18:13:27,246 - optuna.study._optimize - INFO - Trial 146 pruned. 
2026-05-13 18:13:31,763 - optuna.study._optimize - INFO - Trial 147 pruned. 
2026-05-13 18:14:08,553 - optuna.study.study - INFO - Trial 148 finished with value: 0.0945381504599675 and parameters: {'n_layers': 1, 'embedding_dim': 256, 'lr': 0.0001951239285727196, 'lambda_val': 3.3095886271476607e-06, 'batch_size': 1709, 'optimizer': 'Adam'}. Best is trial 77 with value: 0.10185378846839062.
2026-05-13 18:14:18,519 - optuna.study._optimize - INFO - Trial 149 pruned. 
2026-05-13 18:14:24,396 - optuna.study._optimize - INFO - Trial 150 pruned. 
2026-05-13 18:14:59,817 - optuna.study.study - INFO - Trial 151 finished with value: 0.0832682544028635 and parameters: {'n_layers': 1, 'embedding_dim': 256, 'lr': 0.0001943224088144562, 'lambda_val': 4.466653496271385e-06, 'batch_size': 1600, 'optimizer': 'Adam'}. Best is trial 77 with value: 0.10185378846839062.
2026-05-13 18:15:04,277 - optuna.study._optimize - INFO - Trial 152 pruned. 
2026-05-13 18:15:09,325 - optuna.study._optimize - INFO - Trial 153 pruned. 
2026-05-13 18:15:13,809 - optuna.study._optimize - INFO - Trial 154 pruned. 
2026-05-13 18:15:18,249 - optuna.study._optimize - INFO - Trial 155 pruned. 
2026-05-13 18:15:53,651 - optuna.study.study - INFO - Trial 156 finished with value: 0.07187411435461168 and parameters: {'n_layers': 1, 'embedding_dim': 256, 'lr': 0.0002820622516194173, 'lambda_val': 0.0008308953553148693, 'batch_size': 1796, 'optimizer': 'Adam'}. Best is trial 77 with value: 0.10185378846839062.
2026-05-13 18:15:58,222 - optuna.study._optimize - INFO - Trial 157 pruned. 
2026-05-13 18:16:02,772 - optuna.study._optimize - INFO - Trial 158 pruned. 
2026-05-13 18:16:06,615 - optuna.study._optimize - INFO - Trial 159 pruned. 
2026-05-13 18:16:11,143 - optuna.study._optimize - INFO - Trial 160 pruned. 
2026-05-13 18:16:15,901 - optuna.study._optimize - INFO - Trial 161 pruned. 
2026-05-13 18:16:20,562 - optuna.study._optimize - INFO - Trial 162 pruned. 
2026-05-13 18:16:25,219 - optuna.study._optimize - INFO - Trial 163 pruned. 
2026-05-13 18:17:00,939 - optuna.study.study - INFO - Trial 164 finished with value: 0.07110184406241327 and parameters: {'n_layers': 1, 'embedding_dim': 256, 'lr': 0.00026329159852902763, 'lambda_val': 1.881187631088749e-05, 'batch_size': 2118, 'optimizer': 'Adam'}. Best is trial 77 with value: 0.10185378846839062.
2026-05-13 18:17:05,338 - optuna.study._optimize - INFO - Trial 165 pruned. 
2026-05-13 18:17:10,910 - optuna.study._optimize - INFO - Trial 166 pruned. 
2026-05-13 18:17:40,399 - optuna.study.study - INFO - Trial 167 finished with value: 0.08898777516074029 and parameters: {'n_layers': 1, 'embedding_dim': 128, 'lr': 0.00022028865180676404, 'lambda_val': 1.4255036655031276e-05, 'batch_size': 1519, 'optimizer': 'RMSprop'}. Best is trial 77 with value: 0.10185378846839062.
2026-05-13 18:18:09,232 - optuna.study.study - INFO - Trial 168 finished with value: 0.05879195470824472 and parameters: {'n_layers': 1, 'embedding_dim': 128, 'lr': 0.00034048916827257364, 'lambda_val': 2.6145216144405354e-05, 'batch_size': 1525, 'optimizer': 'RMSprop'}. Best is trial 77 with value: 0.10185378846839062.
2026-05-13 18:18:16,623 - optuna.study._optimize - INFO - Trial 169 pruned. 
2026-05-13 18:18:26,290 - optuna.study._optimize - INFO - Trial 170 pruned. 
2026-05-13 18:18:30,455 - optuna.study._optimize - INFO - Trial 171 pruned. 
2026-05-13 18:19:03,225 - optuna.study.study - INFO - Trial 172 finished with value: 0.07412753508582359 and parameters: {'n_layers': 1, 'embedding_dim': 256, 'lr': 0.00024165994587414336, 'lambda_val': 1.0392318383677697e-05, 'batch_size': 1712, 'optimizer': 'RMSprop'}. Best is trial 77 with value: 0.10185378846839062.
2026-05-13 18:19:07,696 - optuna.study._optimize - INFO - Trial 173 pruned. 
2026-05-13 18:19:11,948 - optuna.study._optimize - INFO - Trial 174 pruned. 
2026-05-13 18:19:16,366 - optuna.study._optimize - INFO - Trial 175 pruned. 
2026-05-13 18:19:20,456 - optuna.study._optimize - INFO - Trial 176 pruned. 
2026-05-13 18:19:24,841 - optuna.study._optimize - INFO - Trial 177 pruned. 
2026-05-13 18:19:31,111 - optuna.study._optimize - INFO - Trial 178 pruned. 
2026-05-13 18:20:04,696 - optuna.study.study - INFO - Trial 179 finished with value: 0.08699705645321085 and parameters: {'n_layers': 1, 'embedding_dim': 256, 'lr': 0.00018436961065588825, 'lambda_val': 6.525856458335941e-05, 'batch_size': 1586, 'optimizer': 'Adam'}. Best is trial 77 with value: 0.10185378846839062.
2026-05-13 18:20:08,482 - optuna.study._optimize - INFO - Trial 180 pruned. 
2026-05-13 18:20:42,003 - optuna.study.study - INFO - Trial 181 finished with value: 0.08695974937509279 and parameters: {'n_layers': 1, 'embedding_dim': 256, 'lr': 0.00022918356432908855, 'lambda_val': 2.8524680497139005e-05, 'batch_size': 1697, 'optimizer': 'Adam'}. Best is trial 77 with value: 0.10185378846839062.
2026-05-13 18:21:16,416 - optuna.study.study - INFO - Trial 182 finished with value: 0.07247427871258162 and parameters: {'n_layers': 1, 'embedding_dim': 256, 'lr': 0.00023438961418141284, 'lambda_val': 3.2508798693213455e-05, 'batch_size': 1685, 'optimizer': 'Adam'}. Best is trial 77 with value: 0.10185378846839062.
2026-05-13 18:21:20,745 - optuna.study._optimize - INFO - Trial 183 pruned. 
2026-05-13 18:21:25,186 - optuna.study._optimize - INFO - Trial 184 pruned. 
2026-05-13 18:21:57,473 - optuna.study.study - INFO - Trial 185 finished with value: 0.0863607847401659 and parameters: {'n_layers': 1, 'embedding_dim': 256, 'lr': 0.0002501151165747692, 'lambda_val': 7.339849310636258e-05, 'batch_size': 1729, 'optimizer': 'Adam'}. Best is trial 77 with value: 0.10185378846839062.
2026-05-13 18:22:03,139 - optuna.study._optimize - INFO - Trial 186 pruned. 
2026-05-13 18:22:35,410 - optuna.study.study - INFO - Trial 187 finished with value: 0.07903095176450384 and parameters: {'n_layers': 1, 'embedding_dim': 256, 'lr': 0.00032982299981913163, 'lambda_val': 6.884595067282762e-05, 'batch_size': 1582, 'optimizer': 'Adam'}. Best is trial 77 with value: 0.10185378846839062.
2026-05-13 18:23:08,697 - optuna.study.study - INFO - Trial 188 finished with value: 0.07843179370847729 and parameters: {'n_layers': 1, 'embedding_dim': 256, 'lr': 0.00019861885624669672, 'lambda_val': 7.720134616497392e-05, 'batch_size': 1661, 'optimizer': 'RMSprop'}. Best is trial 77 with value: 0.10185378846839062.
