2026-05-13 23:03:42,848 - optuna.study.study - INFO - Trial 41 finished with value: 0.02479710451201424 and parameters: {'n_layers': 2, 'embedding_dim': 96, 'lr': 0.02031745824190968, 'lambda_val': 1.1232154017611165e-05, 'batch_size': 1122, 'optimizer': 'RMSprop'}. Best is trial 26 with value: 0.05901727744012671.
2026-05-13 23:04:14,659 - optuna.study.study - INFO - Trial 42 finished with value: 0.034653741330236264 and parameters: {'n_layers': 2, 'embedding_dim': 96, 'lr': 0.013059114871340174, 'lambda_val': 5.179342715082311e-06, 'batch_size': 658, 'optimizer': 'RMSprop'}. Best is trial 26 with value: 0.05901727744012671.
2026-05-13 23:04:46,280 - optuna.study.study - INFO - Trial 43 finished with value: 0.03518897200087109 and parameters: {'n_layers': 2, 'embedding_dim': 96, 'lr': 0.00548241043622825, 'lambda_val': 5.187861901487637e-06, 'batch_size': 1353, 'optimizer': 'RMSprop'}. Best is trial 26 with value: 0.05901727744012671.
2026-05-13 23:05:18,292 - optuna.study.study - INFO - Trial 44 finished with value: 0.03485655195256255 and parameters: {'n_layers': 2, 'embedding_dim': 96, 'lr': 0.0054001374525385944, 'lambda_val': 4.7822905991627195e-06, 'batch_size': 1359, 'optimizer': 'RMSprop'}. Best is trial 26 with value: 0.05901727744012671.
2026-05-13 23:05:49,362 - optuna.study.study - INFO - Trial 45 finished with value: 0.03190163985922587 and parameters: {'n_layers': 2, 'embedding_dim': 96, 'lr': 0.004817318980979362, 'lambda_val': 1.951410520840617e-06, 'batch_size': 1371, 'optimizer': 'RMSprop'}. Best is trial 26 with value: 0.05901727744012671.
2026-05-13 23:05:53,945 - optuna.study._optimize - INFO - Trial 46 pruned. 
2026-05-13 23:06:23,019 - optuna.study.study - INFO - Trial 47 finished with value: 0.047979527721292665 and parameters: {'n_layers': 1, 'embedding_dim': 96, 'lr': 0.0018933711004445993, 'lambda_val': 2.046822501494179e-06, 'batch_size': 2175, 'optimizer': 'RMSprop'}. Best is trial 26 with value: 0.05901727744012671.
2026-05-13 23:06:51,129 - optuna.study.study - INFO - Trial 48 finished with value: 0.03646449068546599 and parameters: {'n_layers': 1, 'embedding_dim': 96, 'lr': 0.0018495069481414723, 'lambda_val': 1.3656047713328451e-06, 'batch_size': 2149, 'optimizer': 'RMSprop'}. Best is trial 26 with value: 0.05901727744012671.
2026-05-13 23:07:21,479 - optuna.study.study - INFO - Trial 49 finished with value: 0.046372939476460345 and parameters: {'n_layers': 1, 'embedding_dim': 96, 'lr': 0.0008808739876395828, 'lambda_val': 1.4300097650781566e-06, 'batch_size': 2085, 'optimizer': 'RMSprop'}. Best is trial 26 with value: 0.05901727744012671.
2026-05-13 23:07:49,670 - optuna.study.study - INFO - Trial 50 finished with value: 0.042026307522059464 and parameters: {'n_layers': 1, 'embedding_dim': 96, 'lr': 0.0009701583038060185, 'lambda_val': 1.3858981949168824e-06, 'batch_size': 2083, 'optimizer': 'RMSprop'}. Best is trial 26 with value: 0.05901727744012671.
2026-05-13 23:08:17,814 - optuna.study.study - INFO - Trial 51 finished with value: 0.045185862416665556 and parameters: {'n_layers': 1, 'embedding_dim': 96, 'lr': 0.0009877613410646908, 'lambda_val': 1.253867508943716e-06, 'batch_size': 2138, 'optimizer': 'RMSprop'}. Best is trial 26 with value: 0.05901727744012671.
2026-05-13 23:08:46,956 - optuna.study.study - INFO - Trial 52 finished with value: 0.04910860727868341 and parameters: {'n_layers': 1, 'embedding_dim': 96, 'lr': 0.0011593643153388858, 'lambda_val': 1.4281567794335025e-06, 'batch_size': 2559, 'optimizer': 'RMSprop'}. Best is trial 26 with value: 0.05901727744012671.
2026-05-13 23:09:17,222 - optuna.study.study - INFO - Trial 53 finished with value: 0.040890096741209296 and parameters: {'n_layers': 1, 'embedding_dim': 96, 'lr': 0.0010206885849831408, 'lambda_val': 1.559908071777194e-06, 'batch_size': 2646, 'optimizer': 'RMSprop'}. Best is trial 26 with value: 0.05901727744012671.
2026-05-13 23:09:49,731 - optuna.study.study - INFO - Trial 54 finished with value: 0.049249163855010415 and parameters: {'n_layers': 1, 'embedding_dim': 96, 'lr': 0.0010517005841740954, 'lambda_val': 1.0316189215303177e-06, 'batch_size': 2569, 'optimizer': 'RMSprop'}. Best is trial 26 with value: 0.05901727744012671.
2026-05-13 23:10:19,717 - optuna.study.study - INFO - Trial 55 finished with value: 0.046266565933927355 and parameters: {'n_layers': 1, 'embedding_dim': 96, 'lr': 0.000558844237233297, 'lambda_val': 1.0545508470269847e-06, 'batch_size': 2820, 'optimizer': 'RMSprop'}. Best is trial 26 with value: 0.05901727744012671.
2026-05-13 23:10:50,082 - optuna.study.study - INFO - Trial 56 finished with value: 0.05529856586108138 and parameters: {'n_layers': 1, 'embedding_dim': 128, 'lr': 0.0004930404680333673, 'lambda_val': 3.026839019179026e-06, 'batch_size': 2843, 'optimizer': 'RMSprop'}. Best is trial 26 with value: 0.05901727744012671.
2026-05-13 23:11:20,928 - optuna.study.study - INFO - Trial 57 finished with value: 0.04903853988583944 and parameters: {'n_layers': 1, 'embedding_dim': 128, 'lr': 0.00040301569869668406, 'lambda_val': 2.992744490827163e-06, 'batch_size': 3289, 'optimizer': 'RMSprop'}. Best is trial 26 with value: 0.05901727744012671.
2026-05-13 23:11:52,563 - optuna.study.study - INFO - Trial 58 finished with value: 0.048184692524065396 and parameters: {'n_layers': 1, 'embedding_dim': 128, 'lr': 0.0003273400769004071, 'lambda_val': 3.1146233677509946e-06, 'batch_size': 3332, 'optimizer': 'RMSprop'}. Best is trial 26 with value: 0.05901727744012671.
2026-05-13 23:12:23,096 - optuna.study.study - INFO - Trial 59 finished with value: 0.0491588184899525 and parameters: {'n_layers': 1, 'embedding_dim': 128, 'lr': 0.00030216988075719875, 'lambda_val': 3.0411350149770865e-06, 'batch_size': 3440, 'optimizer': 'RMSprop'}. Best is trial 26 with value: 0.05901727744012671.
2026-05-13 23:12:27,829 - optuna.study._optimize - INFO - Trial 60 pruned. 
2026-05-13 23:12:58,760 - optuna.study.study - INFO - Trial 61 finished with value: 0.0566309183318517 and parameters: {'n_layers': 1, 'embedding_dim': 128, 'lr': 0.0003319373163035522, 'lambda_val': 2.623157115946608e-06, 'batch_size': 3334, 'optimizer': 'RMSprop'}. Best is trial 26 with value: 0.05901727744012671.
2026-05-13 23:13:31,653 - optuna.study.study - INFO - Trial 62 finished with value: 0.040367982951692055 and parameters: {'n_layers': 1, 'embedding_dim': 128, 'lr': 0.00040205156449121, 'lambda_val': 1.943331023101491e-06, 'batch_size': 3320, 'optimizer': 'RMSprop'}. Best is trial 26 with value: 0.05901727744012671.
2026-05-13 23:14:03,381 - optuna.study.study - INFO - Trial 63 finished with value: 0.112899931989243 and parameters: {'n_layers': 1, 'embedding_dim': 128, 'lr': 8.442890270734349e-05, 'lambda_val': 2.523658051619008e-06, 'batch_size': 3582, 'optimizer': 'RMSprop'}. Best is trial 63 with value: 0.112899931989243.
2026-05-13 23:14:36,580 - optuna.study.study - INFO - Trial 64 finished with value: 0.12286954628740858 and parameters: {'n_layers': 1, 'embedding_dim': 128, 'lr': 8.233980017307523e-05, 'lambda_val': 1.0380331747508984e-06, 'batch_size': 3825, 'optimizer': 'RMSprop'}. Best is trial 64 with value: 0.12286954628740858.
2026-05-13 23:14:40,826 - optuna.study._optimize - INFO - Trial 65 pruned. 
2026-05-13 23:15:12,197 - optuna.study.study - INFO - Trial 66 finished with value: 0.11172454256679192 and parameters: {'n_layers': 1, 'embedding_dim': 128, 'lr': 8.389927889681182e-05, 'lambda_val': 6.77123875938085e-06, 'batch_size': 3518, 'optimizer': 'RMSprop'}. Best is trial 64 with value: 0.12286954628740858.
2026-05-13 23:15:45,259 - optuna.study.study - INFO - Trial 67 finished with value: 0.11630875078692368 and parameters: {'n_layers': 1, 'embedding_dim': 128, 'lr': 8.211154153095329e-05, 'lambda_val': 5.96995721914359e-06, 'batch_size': 3586, 'optimizer': 'RMSprop'}. Best is trial 64 with value: 0.12286954628740858.
2026-05-13 23:15:48,909 - optuna.study._optimize - INFO - Trial 68 pruned. 
2026-05-13 23:15:52,600 - optuna.study._optimize - INFO - Trial 69 pruned. 
2026-05-13 23:16:24,106 - optuna.study.study - INFO - Trial 70 finished with value: 0.06625174625478195 and parameters: {'n_layers': 1, 'embedding_dim': 128, 'lr': 0.00017531506974135847, 'lambda_val': 2.3336183291637186e-05, 'batch_size': 3849, 'optimizer': 'RMSprop'}. Best is trial 64 with value: 0.12286954628740858.
2026-05-13 23:16:55,392 - optuna.study.study - INFO - Trial 71 finished with value: 0.09405057496575842 and parameters: {'n_layers': 1, 'embedding_dim': 128, 'lr': 0.00010174322634208965, 'lambda_val': 3.938016814846901e-06, 'batch_size': 3812, 'optimizer': 'RMSprop'}. Best is trial 64 with value: 0.12286954628740858.
2026-05-13 23:17:27,009 - optuna.study.study - INFO - Trial 72 finished with value: 0.060497137604056776 and parameters: {'n_layers': 1, 'embedding_dim': 128, 'lr': 0.0001659461768550309, 'lambda_val': 7.138054119423544e-06, 'batch_size': 3845, 'optimizer': 'RMSprop'}. Best is trial 64 with value: 0.12286954628740858.
2026-05-13 23:18:02,686 - optuna.study.study - INFO - Trial 73 finished with value: 0.10066055821043916 and parameters: {'n_layers': 1, 'embedding_dim': 128, 'lr': 9.410827902388042e-05, 'lambda_val': 2.5633676434781794e-05, 'batch_size': 3875, 'optimizer': 'RMSprop'}. Best is trial 64 with value: 0.12286954628740858.
2026-05-13 23:18:41,299 - optuna.study.study - INFO - Trial 74 finished with value: 0.10015815707658679 and parameters: {'n_layers': 1, 'embedding_dim': 128, 'lr': 9.715520684934599e-05, 'lambda_val': 5.550171762870643e-05, 'batch_size': 4091, 'optimizer': 'RMSprop'}. Best is trial 64 with value: 0.12286954628740858.
2026-05-13 23:19:12,525 - optuna.study.study - INFO - Trial 75 finished with value: 0.09422463414619037 and parameters: {'n_layers': 1, 'embedding_dim': 128, 'lr': 9.771658030373274e-05, 'lambda_val': 6.185222875558036e-05, 'batch_size': 4087, 'optimizer': 'RMSprop'}. Best is trial 64 with value: 0.12286954628740858.
2026-05-13 23:19:16,650 - optuna.study._optimize - INFO - Trial 76 pruned. 
2026-05-13 23:19:48,146 - optuna.study.study - INFO - Trial 77 finished with value: 0.07931473807458195 and parameters: {'n_layers': 1, 'embedding_dim': 128, 'lr': 0.00010199043298685041, 'lambda_val': 4.9183589004665665e-05, 'batch_size': 4092, 'optimizer': 'RMSprop'}. Best is trial 64 with value: 0.12286954628740858.
2026-05-13 23:19:52,944 - optuna.study._optimize - INFO - Trial 78 pruned. 
2026-05-13 23:19:57,352 - optuna.study._optimize - INFO - Trial 79 pruned. 
2026-05-13 23:20:29,177 - optuna.study.study - INFO - Trial 80 finished with value: 0.10029323562592349 and parameters: {'n_layers': 1, 'embedding_dim': 128, 'lr': 0.00010724162754768409, 'lambda_val': 0.00021878570706026522, 'batch_size': 3554, 'optimizer': 'RMSprop'}. Best is trial 64 with value: 0.12286954628740858.
2026-05-13 23:21:00,317 - optuna.study.study - INFO - Trial 81 finished with value: 0.11949807626796899 and parameters: {'n_layers': 1, 'embedding_dim': 128, 'lr': 9.535680003668416e-05, 'lambda_val': 0.000730033603130508, 'batch_size': 3577, 'optimizer': 'RMSprop'}. Best is trial 64 with value: 0.12286954628740858.
2026-05-13 23:21:04,307 - optuna.study._optimize - INFO - Trial 82 pruned. 
2026-05-13 23:21:08,771 - optuna.study._optimize - INFO - Trial 83 pruned. 
2026-05-13 23:21:12,788 - optuna.study._optimize - INFO - Trial 84 pruned. 
2026-05-13 23:21:44,237 - optuna.study.study - INFO - Trial 85 finished with value: 0.07956959835086655 and parameters: {'n_layers': 1, 'embedding_dim': 128, 'lr': 0.00012688721496210075, 'lambda_val': 0.0005255885750830687, 'batch_size': 3542, 'optimizer': 'RMSprop'}. Best is trial 64 with value: 0.12286954628740858.
2026-05-13 23:21:48,873 - optuna.study._optimize - INFO - Trial 86 pruned. 
2026-05-13 23:21:53,210 - optuna.study._optimize - INFO - Trial 87 pruned. 
2026-05-13 23:21:57,303 - optuna.study._optimize - INFO - Trial 88 pruned. 
2026-05-13 23:22:01,364 - optuna.study._optimize - INFO - Trial 89 pruned. 
2026-05-13 23:22:32,438 - optuna.study.study - INFO - Trial 90 finished with value: 0.09337120216828394 and parameters: {'n_layers': 1, 'embedding_dim': 128, 'lr': 0.00010920372563383352, 'lambda_val': 8.831957832781015e-05, 'batch_size': 3759, 'optimizer': 'RMSprop'}. Best is trial 64 with value: 0.12286954628740858.
2026-05-13 23:22:36,812 - optuna.study._optimize - INFO - Trial 91 pruned. 
2026-05-13 23:23:13,138 - optuna.study.study - INFO - Trial 92 finished with value: 0.07111415411625052 and parameters: {'n_layers': 1, 'embedding_dim': 128, 'lr': 0.00014460474546906896, 'lambda_val': 0.00012773269497017676, 'batch_size': 3790, 'optimizer': 'RMSprop'}. Best is trial 64 with value: 0.12286954628740858.
2026-05-13 23:23:47,376 - optuna.study.study - INFO - Trial 93 finished with value: 0.10520054601673647 and parameters: {'n_layers': 1, 'embedding_dim': 128, 'lr': 9.84600001876496e-05, 'lambda_val': 2.786902386579407e-05, 'batch_size': 3612, 'optimizer': 'RMSprop'}. Best is trial 64 with value: 0.12286954628740858.
2026-05-13 23:24:18,379 - optuna.study.study - INFO - Trial 94 finished with value: 0.06434249642042174 and parameters: {'n_layers': 1, 'embedding_dim': 128, 'lr': 0.0001902769600775241, 'lambda_val': 4.229606208910532e-05, 'batch_size': 3616, 'optimizer': 'RMSprop'}. Best is trial 64 with value: 0.12286954628740858.
2026-05-13 23:24:22,870 - optuna.study._optimize - INFO - Trial 95 pruned. 
2026-05-13 23:24:27,085 - optuna.study._optimize - INFO - Trial 96 pruned. 
2026-05-13 23:24:31,068 - optuna.study._optimize - INFO - Trial 97 pruned. 
2026-05-13 23:25:02,416 - optuna.study.study - INFO - Trial 98 finished with value: 0.10276670231424824 and parameters: {'n_layers': 1, 'embedding_dim': 128, 'lr': 9.46228900931728e-05, 'lambda_val': 9.558381936484458e-05, 'batch_size': 4007, 'optimizer': 'RMSprop'}. Best is trial 64 with value: 0.12286954628740858.
2026-05-13 23:25:33,578 - optuna.study.study - INFO - Trial 99 finished with value: 0.08378426333181925 and parameters: {'n_layers': 1, 'embedding_dim': 128, 'lr': 0.0001266779530331961, 'lambda_val': 0.00010038270319202231, 'batch_size': 3704, 'optimizer': 'RMSprop'}. Best is trial 64 with value: 0.12286954628740858.
2026-05-13 23:25:37,740 - optuna.study._optimize - INFO - Trial 100 pruned. 
2026-05-13 23:26:09,006 - optuna.study.study - INFO - Trial 101 finished with value: 0.10640395345169526 and parameters: {'n_layers': 1, 'embedding_dim': 128, 'lr': 9.406392934128092e-05, 'lambda_val': 0.00015396810716224394, 'batch_size': 4095, 'optimizer': 'RMSprop'}. Best is trial 64 with value: 0.12286954628740858.
2026-05-13 23:26:13,097 - optuna.study._optimize - INFO - Trial 102 pruned. 
2026-05-13 23:26:17,834 - optuna.study._optimize - INFO - Trial 103 pruned. 
2026-05-13 23:26:50,069 - optuna.study.study - INFO - Trial 104 finished with value: 0.05544416050194531 and parameters: {'n_layers': 1, 'embedding_dim': 128, 'lr': 0.0002384777315556448, 'lambda_val': 0.0004994972895791218, 'batch_size': 4006, 'optimizer': 'RMSprop'}. Best is trial 64 with value: 0.12286954628740858.
2026-05-13 23:27:21,805 - optuna.study.study - INFO - Trial 105 finished with value: 0.08351371707234381 and parameters: {'n_layers': 1, 'embedding_dim': 128, 'lr': 0.00011671657477035962, 'lambda_val': 0.0006922389013850893, 'batch_size': 3772, 'optimizer': 'RMSprop'}. Best is trial 64 with value: 0.12286954628740858.
2026-05-13 23:27:54,111 - optuna.study.study - INFO - Trial 106 finished with value: 0.08764760488378372 and parameters: {'n_layers': 1, 'embedding_dim': 128, 'lr': 0.0001473092148507756, 'lambda_val': 9.630935316784525e-06, 'batch_size': 3414, 'optimizer': 'Adam'}. Best is trial 64 with value: 0.12286954628740858.
2026-05-13 23:27:58,114 - optuna.study._optimize - INFO - Trial 107 pruned. 
2026-05-13 23:28:02,042 - optuna.study._optimize - INFO - Trial 108 pruned. 
2026-05-13 23:28:06,302 - optuna.study._optimize - INFO - Trial 109 pruned. 
2026-05-13 23:28:39,237 - optuna.study.study - INFO - Trial 110 finished with value: 0.049591535684084226 and parameters: {'n_layers': 1, 'embedding_dim': 128, 'lr': 0.0002771135948900529, 'lambda_val': 0.0003495961625349108, 'batch_size': 3846, 'optimizer': 'RMSprop'}. Best is trial 64 with value: 0.12286954628740858.
2026-05-13 23:29:10,615 - optuna.study.study - INFO - Trial 111 finished with value: 0.09583628352149401 and parameters: {'n_layers': 1, 'embedding_dim': 128, 'lr': 0.00010508926647779881, 'lambda_val': 7.093768073637606e-05, 'batch_size': 4053, 'optimizer': 'RMSprop'}. Best is trial 64 with value: 0.12286954628740858.
2026-05-13 23:29:41,753 - optuna.study.study - INFO - Trial 112 finished with value: 0.054429927372544824 and parameters: {'n_layers': 1, 'embedding_dim': 128, 'lr': 0.00019299608369041172, 'lambda_val': 7.661042865707964e-05, 'batch_size': 3994, 'optimizer': 'RMSprop'}. Best is trial 64 with value: 0.12286954628740858.
2026-05-13 23:29:46,089 - optuna.study._optimize - INFO - Trial 113 pruned. 
2026-05-13 23:30:16,179 - optuna.study.study - INFO - Trial 114 finished with value: 0.0819575300792123 and parameters: {'n_layers': 1, 'embedding_dim': 128, 'lr': 0.0001180776059334505, 'lambda_val': 0.00014623190653412612, 'batch_size': 3899, 'optimizer': 'RMSprop'}. Best is trial 64 with value: 0.12286954628740858.
2026-05-13 23:30:20,885 - optuna.study._optimize - INFO - Trial 115 pruned. 
2026-05-13 23:30:25,353 - optuna.study._optimize - INFO - Trial 116 pruned. 
2026-05-13 23:30:29,712 - optuna.study._optimize - INFO - Trial 117 pruned. 
2026-05-13 23:31:00,457 - optuna.study.study - INFO - Trial 118 finished with value: 0.06101009820836107 and parameters: {'n_layers': 1, 'embedding_dim': 128, 'lr': 0.00017060052761570476, 'lambda_val': 1.6948072333869453e-06, 'batch_size': 3957, 'optimizer': 'RMSprop'}. Best is trial 64 with value: 0.12286954628740858.
2026-05-13 23:31:37,817 - optuna.study.study - INFO - Trial 119 finished with value: 0.07776013154122023 and parameters: {'n_layers': 1, 'embedding_dim': 128, 'lr': 0.00013743996680199352, 'lambda_val': 1.403120644070576e-05, 'batch_size': 3777, 'optimizer': 'RMSprop'}. Best is trial 64 with value: 0.12286954628740858.
2026-05-13 23:31:42,467 - optuna.study._optimize - INFO - Trial 120 pruned. 
2026-05-13 23:32:13,225 - optuna.study.study - INFO - Trial 121 finished with value: 0.1097742831771874 and parameters: {'n_layers': 1, 'embedding_dim': 128, 'lr': 0.00010096255188549137, 'lambda_val': 5.8454419946371066e-05, 'batch_size': 4019, 'optimizer': 'RMSprop'}. Best is trial 64 with value: 0.12286954628740858.
2026-05-13 23:32:17,449 - optuna.study._optimize - INFO - Trial 122 pruned. 
2026-05-13 23:32:49,246 - optuna.study.study - INFO - Trial 123 finished with value: 0.08416678151591016 and parameters: {'n_layers': 1, 'embedding_dim': 128, 'lr': 0.00011464617229888915, 'lambda_val': 7.111372455045346e-05, 'batch_size': 3904, 'optimizer': 'RMSprop'}. Best is trial 64 with value: 0.12286954628740858.
2026-05-13 23:32:53,349 - optuna.study._optimize - INFO - Trial 124 pruned. 
2026-05-13 23:32:57,377 - optuna.study._optimize - INFO - Trial 125 pruned. 
2026-05-13 23:33:01,637 - optuna.study._optimize - INFO - Trial 126 pruned. 
2026-05-13 23:33:31,898 - optuna.study.study - INFO - Trial 127 finished with value: 0.060125742395274934 and parameters: {'n_layers': 1, 'embedding_dim': 128, 'lr': 0.00019697656910540282, 'lambda_val': 2.9581311586291538e-05, 'batch_size': 4039, 'optimizer': 'RMSprop'}. Best is trial 64 with value: 0.12286954628740858.
2026-05-13 23:34:02,535 - optuna.study.study - INFO - Trial 128 finished with value: 0.07327001402866398 and parameters: {'n_layers': 1, 'embedding_dim': 128, 'lr': 0.000145373954304856, 'lambda_val': 4.0254470245022845e-06, 'batch_size': 3484, 'optimizer': 'RMSprop'}. Best is trial 64 with value: 0.12286954628740858.
2026-05-13 23:34:06,416 - optuna.study._optimize - INFO - Trial 129 pruned. 
2026-05-13 23:34:10,755 - optuna.study._optimize - INFO - Trial 130 pruned. 
2026-05-13 23:34:41,724 - optuna.study.study - INFO - Trial 131 finished with value: 0.08811742263241033 and parameters: {'n_layers': 1, 'embedding_dim': 128, 'lr': 0.00012059760510135571, 'lambda_val': 8.659049206024122e-05, 'batch_size': 4093, 'optimizer': 'RMSprop'}. Best is trial 64 with value: 0.12286954628740858.
2026-05-13 23:34:45,783 - optuna.study._optimize - INFO - Trial 132 pruned. 
2026-05-13 23:34:49,993 - optuna.study._optimize - INFO - Trial 133 pruned. 
2026-05-13 23:34:53,993 - optuna.study._optimize - INFO - Trial 134 pruned. 
2026-05-13 23:35:25,006 - optuna.study.study - INFO - Trial 135 finished with value: 0.06793439615804311 and parameters: {'n_layers': 1, 'embedding_dim': 128, 'lr': 0.0001665566346732003, 'lambda_val': 2.205278179994005e-05, 'batch_size': 3946, 'optimizer': 'RMSprop'}. Best is trial 64 with value: 0.12286954628740858.
2026-05-13 23:35:56,616 - optuna.study.study - INFO - Trial 136 finished with value: 0.10249033706492691 and parameters: {'n_layers': 1, 'embedding_dim': 128, 'lr': 0.0001048717169474285, 'lambda_val': 6.988382645296948e-05, 'batch_size': 3792, 'optimizer': 'RMSprop'}. Best is trial 64 with value: 0.12286954628740858.
2026-05-13 23:36:27,591 - optuna.study.study - INFO - Trial 137 finished with value: 0.07781970690375717 and parameters: {'n_layers': 1, 'embedding_dim': 128, 'lr': 0.00013168849295568585, 'lambda_val': 0.00014249065590948216, 'batch_size': 3773, 'optimizer': 'RMSprop'}. Best is trial 64 with value: 0.12286954628740858.
2026-05-13 23:36:31,936 - optuna.study._optimize - INFO - Trial 138 pruned. 
2026-05-13 23:36:36,201 - optuna.study._optimize - INFO - Trial 139 pruned. 
2026-05-13 23:36:40,890 - optuna.study._optimize - INFO - Trial 140 pruned. 
2026-05-13 23:36:44,895 - optuna.study._optimize - INFO - Trial 141 pruned. 
