2026-05-13 07:32:46,899 - optuna.study.study - INFO - Trial 192 finished with value: 0.10128817239267207 and parameters: {'n_layers': 1, 'embedding_dim': 256, 'lr': 0.000189250422930625, 'lambda_val': 8.608101144165728e-06, 'batch_size': 1002, 'optimizer': 'Adam'}. Best is trial 127 with value: 0.14463190499745765.
2026-05-13 07:32:51,335 - optuna.study._optimize - INFO - Trial 193 pruned. 
2026-05-13 07:32:55,682 - optuna.study._optimize - INFO - Trial 194 pruned. 
2026-05-13 07:33:28,736 - optuna.study.study - INFO - Trial 195 finished with value: 0.11627755998446598 and parameters: {'n_layers': 1, 'embedding_dim': 256, 'lr': 0.00018885055117288173, 'lambda_val': 1.3388176766607795e-06, 'batch_size': 843, 'optimizer': 'Adam'}. Best is trial 127 with value: 0.14463190499745765.
2026-05-13 07:33:32,845 - optuna.study._optimize - INFO - Trial 196 pruned. 
2026-05-13 07:34:06,638 - optuna.study.study - INFO - Trial 197 finished with value: 0.0936512321116814 and parameters: {'n_layers': 1, 'embedding_dim': 256, 'lr': 0.00028342733031879125, 'lambda_val': 2.1210709363892027e-06, 'batch_size': 761, 'optimizer': 'Adam'}. Best is trial 127 with value: 0.14463190499745765.
2026-05-13 07:34:13,326 - optuna.study._optimize - INFO - Trial 198 pruned. 
2026-05-13 07:34:46,468 - optuna.study.study - INFO - Trial 199 finished with value: 0.09586398827740167 and parameters: {'n_layers': 1, 'embedding_dim': 256, 'lr': 0.0002082315086035542, 'lambda_val': 1.126771036754042e-06, 'batch_size': 896, 'optimizer': 'Adam'}. Best is trial 127 with value: 0.14463190499745765.
2026-05-13 07:35:13,834 - root - INFO -   **** Training e_100K_1c1dcs_rand2
2026-05-13 07:35:13,844 - root - INFO -   **** Getting 53072/65410 random edges
2026-05-13 07:35:14,886 - optuna.storages._rdb.storage - INFO - A new study created in RDB with name: Study_e_100K_1c1dcs_rand2
2026-05-13 07:36:00,059 - optuna.study.study - INFO - Trial 0 finished with value: 0.012503981690680703 and parameters: {'n_layers': 4, 'embedding_dim': 32, 'lr': 0.036625626569112626, 'lambda_val': 1.3396063581073024e-06, 'batch_size': 3450, 'optimizer': 'RMSprop'}. Best is trial 0 with value: 0.012503981690680703.
2026-05-13 07:36:51,648 - optuna.study.study - INFO - Trial 1 finished with value: 0.016813286101742157 and parameters: {'n_layers': 4, 'embedding_dim': 96, 'lr': 3.533768520176224e-05, 'lambda_val': 0.017561744704894335, 'batch_size': 2554, 'optimizer': 'Adam'}. Best is trial 1 with value: 0.016813286101742157.
2026-05-13 07:37:19,685 - optuna.study.study - INFO - Trial 2 finished with value: 0.0031852551508373124 and parameters: {'n_layers': 1, 'embedding_dim': 96, 'lr': 0.0001243265267153063, 'lambda_val': 9.415063606927863e-05, 'batch_size': 2111, 'optimizer': 'SGD'}. Best is trial 1 with value: 0.016813286101742157.
2026-05-13 07:38:15,129 - optuna.study.study - INFO - Trial 3 finished with value: 0.002184905840225799 and parameters: {'n_layers': 4, 'embedding_dim': 256, 'lr': 7.843186821852439e-05, 'lambda_val': 1.1432526517903237e-06, 'batch_size': 590, 'optimizer': 'SGD'}. Best is trial 1 with value: 0.016813286101742157.
2026-05-13 07:38:49,888 - optuna.study.study - INFO - Trial 4 finished with value: 0.0018688549547528758 and parameters: {'n_layers': 1, 'embedding_dim': 128, 'lr': 0.021071673068706668, 'lambda_val': 2.1381576610764496e-06, 'batch_size': 3220, 'optimizer': 'SGD'}. Best is trial 1 with value: 0.016813286101742157.
2026-05-13 07:38:53,771 - optuna.study._optimize - INFO - Trial 5 pruned. 
2026-05-13 07:38:57,516 - optuna.study._optimize - INFO - Trial 6 pruned. 
2026-05-13 07:39:33,038 - optuna.study.study - INFO - Trial 7 finished with value: 0.04928815811063323 and parameters: {'n_layers': 1, 'embedding_dim': 256, 'lr': 0.00889605960842862, 'lambda_val': 0.0128567371539795, 'batch_size': 2454, 'optimizer': 'Adam'}. Best is trial 7 with value: 0.04928815811063323.
2026-05-13 07:40:07,953 - optuna.study.study - INFO - Trial 8 finished with value: 0.015688914687908218 and parameters: {'n_layers': 3, 'embedding_dim': 64, 'lr': 0.005530491399529545, 'lambda_val': 0.029400742959573692, 'batch_size': 3350, 'optimizer': 'RMSprop'}. Best is trial 7 with value: 0.04928815811063323.
2026-05-13 07:40:13,031 - optuna.study._optimize - INFO - Trial 9 pruned. 
2026-05-13 07:40:58,915 - optuna.study.study - INFO - Trial 10 finished with value: 0.035919441168517995 and parameters: {'n_layers': 2, 'embedding_dim': 256, 'lr': 0.0009269111605286092, 'lambda_val': 0.00045981840216370785, 'batch_size': 1270, 'optimizer': 'Adam'}. Best is trial 7 with value: 0.04928815811063323.
2026-05-13 07:41:39,081 - optuna.study.study - INFO - Trial 11 finished with value: 0.03834940505344028 and parameters: {'n_layers': 2, 'embedding_dim': 256, 'lr': 0.0009925751239773413, 'lambda_val': 0.0006463547386380636, 'batch_size': 1379, 'optimizer': 'Adam'}. Best is trial 7 with value: 0.04928815811063323.
2026-05-13 07:42:18,860 - optuna.study.study - INFO - Trial 12 finished with value: 0.04106528339347272 and parameters: {'n_layers': 2, 'embedding_dim': 256, 'lr': 0.0017144795743538898, 'lambda_val': 0.00044632237602208036, 'batch_size': 1528, 'optimizer': 'Adam'}. Best is trial 7 with value: 0.04928815811063323.
2026-05-13 07:43:09,733 - optuna.study.study - INFO - Trial 13 finished with value: 0.02829737052897811 and parameters: {'n_layers': 3, 'embedding_dim': 256, 'lr': 0.0029031269050179974, 'lambda_val': 1.6167124532335324e-05, 'batch_size': 2736, 'optimizer': 'Adam'}. Best is trial 7 with value: 0.04928815811063323.
2026-05-13 07:43:43,459 - optuna.study.study - INFO - Trial 14 finished with value: 0.027589758581933323 and parameters: {'n_layers': 2, 'embedding_dim': 128, 'lr': 0.0003300107074616621, 'lambda_val': 0.002129911439618065, 'batch_size': 1593, 'optimizer': 'Adam'}. Best is trial 7 with value: 0.04928815811063323.
2026-05-13 07:43:47,496 - optuna.study._optimize - INFO - Trial 15 pruned. 
2026-05-13 07:43:51,628 - optuna.study._optimize - INFO - Trial 16 pruned. 
2026-05-13 07:44:32,305 - optuna.study.study - INFO - Trial 17 finished with value: 0.04095562876876902 and parameters: {'n_layers': 2, 'embedding_dim': 256, 'lr': 0.002160549065483707, 'lambda_val': 0.002055246198419062, 'batch_size': 2183, 'optimizer': 'Adam'}. Best is trial 7 with value: 0.04928815811063323.
2026-05-13 07:45:15,253 - optuna.study.study - INFO - Trial 18 finished with value: 0.07613313066835668 and parameters: {'n_layers': 1, 'embedding_dim': 256, 'lr': 0.0005041384326122119, 'lambda_val': 8.678120074544613e-05, 'batch_size': 961, 'optimizer': 'Adam'}. Best is trial 18 with value: 0.07613313066835668.
2026-05-13 07:45:55,664 - optuna.study.study - INFO - Trial 19 finished with value: 0.0906816241408904 and parameters: {'n_layers': 1, 'embedding_dim': 256, 'lr': 0.00030968088852549315, 'lambda_val': 1.3138655864582139e-05, 'batch_size': 903, 'optimizer': 'Adam'}. Best is trial 19 with value: 0.0906816241408904.
2026-05-13 07:46:23,837 - optuna.study.study - INFO - Trial 20 finished with value: 0.07384168350895773 and parameters: {'n_layers': 1, 'embedding_dim': 128, 'lr': 0.00031386480030728134, 'lambda_val': 1.5694771560658218e-05, 'batch_size': 1040, 'optimizer': 'RMSprop'}. Best is trial 19 with value: 0.0906816241408904.
2026-05-13 07:46:51,308 - optuna.study.study - INFO - Trial 21 finished with value: 0.06389816760164145 and parameters: {'n_layers': 1, 'embedding_dim': 128, 'lr': 0.00038190936284423225, 'lambda_val': 9.299114514611295e-06, 'batch_size': 987, 'optimizer': 'RMSprop'}. Best is trial 19 with value: 0.0906816241408904.
2026-05-13 07:47:18,561 - optuna.study.study - INFO - Trial 22 finished with value: 0.08790754400986524 and parameters: {'n_layers': 1, 'embedding_dim': 128, 'lr': 0.0002667882852683453, 'lambda_val': 2.6668114363814195e-05, 'batch_size': 997, 'optimizer': 'RMSprop'}. Best is trial 19 with value: 0.0906816241408904.
2026-05-13 07:47:22,100 - optuna.study._optimize - INFO - Trial 23 pruned. 
2026-05-13 07:47:54,239 - optuna.study.study - INFO - Trial 24 finished with value: 0.07290883812596527 and parameters: {'n_layers': 1, 'embedding_dim': 64, 'lr': 0.0005225562761002857, 'lambda_val': 6.700986300174821e-06, 'batch_size': 522, 'optimizer': 'RMSprop'}. Best is trial 19 with value: 0.0906816241408904.
2026-05-13 07:47:58,912 - optuna.study._optimize - INFO - Trial 25 pruned. 
2026-05-13 07:48:02,807 - optuna.study._optimize - INFO - Trial 26 pruned. 
2026-05-13 07:48:44,948 - optuna.study.study - INFO - Trial 27 finished with value: 0.04228552774606769 and parameters: {'n_layers': 2, 'embedding_dim': 256, 'lr': 0.00018714809119561504, 'lambda_val': 3.151574171785605e-05, 'batch_size': 817, 'optimizer': 'Adam'}. Best is trial 19 with value: 0.0906816241408904.
2026-05-13 07:49:18,083 - optuna.study.study - INFO - Trial 28 finished with value: 0.06300315219059148 and parameters: {'n_layers': 1, 'embedding_dim': 256, 'lr': 0.0007861936341520887, 'lambda_val': 0.00017700730153211847, 'batch_size': 1878, 'optimizer': 'Adam'}. Best is trial 19 with value: 0.0906816241408904.
2026-05-13 07:49:43,682 - optuna.study.study - INFO - Trial 29 finished with value: 0.05656051898961461 and parameters: {'n_layers': 3, 'embedding_dim': 32, 'lr': 0.00021639354785201953, 'lambda_val': 0.0002126438799117814, 'batch_size': 1144, 'optimizer': 'RMSprop'}. Best is trial 19 with value: 0.0906816241408904.
2026-05-13 07:49:47,138 - optuna.study._optimize - INFO - Trial 30 pruned. 
2026-05-13 07:50:14,899 - optuna.study.study - INFO - Trial 31 finished with value: 0.06404015973042608 and parameters: {'n_layers': 1, 'embedding_dim': 128, 'lr': 0.00046398293253205975, 'lambda_val': 2.253606659605181e-05, 'batch_size': 1024, 'optimizer': 'RMSprop'}. Best is trial 19 with value: 0.0906816241408904.
2026-05-13 07:50:42,868 - optuna.study.study - INFO - Trial 32 finished with value: 0.08947228904081711 and parameters: {'n_layers': 1, 'embedding_dim': 128, 'lr': 0.00021561433152564088, 'lambda_val': 1.1086306028490923e-05, 'batch_size': 1393, 'optimizer': 'RMSprop'}. Best is trial 19 with value: 0.0906816241408904.
2026-05-13 07:51:11,188 - optuna.study.study - INFO - Trial 33 finished with value: 0.09637621512551688 and parameters: {'n_layers': 1, 'embedding_dim': 128, 'lr': 0.0001554242935585215, 'lambda_val': 4.514444777121061e-05, 'batch_size': 1460, 'optimizer': 'RMSprop'}. Best is trial 33 with value: 0.09637621512551688.
2026-05-13 07:51:39,089 - optuna.study.study - INFO - Trial 34 finished with value: 0.1271187868674389 and parameters: {'n_layers': 1, 'embedding_dim': 128, 'lr': 0.00014242924519195432, 'lambda_val': 1.0215708815659196e-05, 'batch_size': 1404, 'optimizer': 'RMSprop'}. Best is trial 34 with value: 0.1271187868674389.
2026-05-13 07:51:43,975 - optuna.study._optimize - INFO - Trial 35 pruned. 
2026-05-13 07:52:11,066 - optuna.study.study - INFO - Trial 36 finished with value: 0.11127743987106237 and parameters: {'n_layers': 1, 'embedding_dim': 128, 'lr': 0.00015161717472157138, 'lambda_val': 1.5958390794218739e-06, 'batch_size': 1697, 'optimizer': 'RMSprop'}. Best is trial 34 with value: 0.1271187868674389.
2026-05-13 07:52:14,417 - optuna.study._optimize - INFO - Trial 37 pruned. 
2026-05-13 07:52:46,578 - optuna.study.study - INFO - Trial 38 finished with value: 0.036932606281755626 and parameters: {'n_layers': 2, 'embedding_dim': 128, 'lr': 0.00012879034642599357, 'lambda_val': 3.3415663361161005e-06, 'batch_size': 1654, 'optimizer': 'RMSprop'}. Best is trial 34 with value: 0.1271187868674389.
2026-05-13 07:52:49,906 - optuna.study._optimize - INFO - Trial 39 pruned. 
2026-05-13 07:52:53,585 - optuna.study._optimize - INFO - Trial 40 pruned. 
2026-05-13 07:53:23,377 - optuna.study.study - INFO - Trial 41 finished with value: 0.11095957483296416 and parameters: {'n_layers': 1, 'embedding_dim': 128, 'lr': 0.00016395020055446635, 'lambda_val': 2.057988309044253e-06, 'batch_size': 1388, 'optimizer': 'RMSprop'}. Best is trial 34 with value: 0.1271187868674389.
2026-05-13 07:53:53,117 - optuna.study.study - INFO - Trial 42 finished with value: 0.10566840825376728 and parameters: {'n_layers': 1, 'embedding_dim': 128, 'lr': 0.00016287767544191276, 'lambda_val': 2.042465711472825e-06, 'batch_size': 1801, 'optimizer': 'RMSprop'}. Best is trial 34 with value: 0.1271187868674389.
2026-05-13 07:53:57,131 - optuna.study._optimize - INFO - Trial 43 pruned. 
2026-05-13 07:54:26,487 - optuna.study.study - INFO - Trial 44 finished with value: 0.09696285519442242 and parameters: {'n_layers': 1, 'embedding_dim': 128, 'lr': 0.00014246440801518148, 'lambda_val': 1.0461425406356571e-06, 'batch_size': 1970, 'optimizer': 'RMSprop'}. Best is trial 34 with value: 0.1271187868674389.
2026-05-13 07:54:30,606 - optuna.study._optimize - INFO - Trial 45 pruned. 
2026-05-13 07:54:34,887 - optuna.study._optimize - INFO - Trial 46 pruned. 
2026-05-13 07:54:38,925 - optuna.study._optimize - INFO - Trial 47 pruned. 
2026-05-13 07:54:44,707 - optuna.study._optimize - INFO - Trial 48 pruned. 
2026-05-13 07:54:48,397 - optuna.study._optimize - INFO - Trial 49 pruned. 
2026-05-13 07:55:19,232 - optuna.study.study - INFO - Trial 50 finished with value: 0.07811748772864602 and parameters: {'n_layers': 1, 'embedding_dim': 128, 'lr': 0.00015885579491876204, 'lambda_val': 2.728803346994855e-06, 'batch_size': 2404, 'optimizer': 'RMSprop'}. Best is trial 34 with value: 0.1271187868674389.
2026-05-13 07:55:23,910 - optuna.study._optimize - INFO - Trial 51 pruned. 
2026-05-13 07:55:28,972 - optuna.study._optimize - INFO - Trial 52 pruned. 
2026-05-13 07:55:56,654 - optuna.study.study - INFO - Trial 53 finished with value: 0.04567450609871759 and parameters: {'n_layers': 1, 'embedding_dim': 128, 'lr': 0.001236435936893805, 'lambda_val': 1.6875366757552255e-06, 'batch_size': 1308, 'optimizer': 'RMSprop'}. Best is trial 34 with value: 0.1271187868674389.
2026-05-13 07:55:59,713 - optuna.study._optimize - INFO - Trial 54 pruned. 
2026-05-13 07:56:21,792 - optuna.study.study - INFO - Trial 55 finished with value: 0.06582560282673958 and parameters: {'n_layers': 1, 'embedding_dim': 96, 'lr': 0.0002583454483495339, 'lambda_val': 8.3044960413161e-06, 'batch_size': 1663, 'optimizer': 'RMSprop'}. Best is trial 34 with value: 0.1271187868674389.
2026-05-13 07:56:26,247 - optuna.study._optimize - INFO - Trial 56 pruned. 
2026-05-13 07:56:30,440 - optuna.study._optimize - INFO - Trial 57 pruned. 
2026-05-13 07:56:34,899 - optuna.study._optimize - INFO - Trial 58 pruned. 
2026-05-13 07:56:39,034 - optuna.study._optimize - INFO - Trial 59 pruned. 
2026-05-13 07:56:43,049 - optuna.study._optimize - INFO - Trial 60 pruned. 
2026-05-13 07:57:15,753 - optuna.study.study - INFO - Trial 61 finished with value: 0.07269465614648356 and parameters: {'n_layers': 1, 'embedding_dim': 256, 'lr': 0.00027357566201025935, 'lambda_val': 1.4123188453022053e-05, 'batch_size': 1333, 'optimizer': 'Adam'}. Best is trial 34 with value: 0.1271187868674389.
2026-05-13 07:57:51,131 - optuna.study.study - INFO - Trial 62 finished with value: 0.10131996623465535 and parameters: {'n_layers': 1, 'embedding_dim': 256, 'lr': 0.00021201464972965585, 'lambda_val': 5.8504810108573554e-05, 'batch_size': 753, 'optimizer': 'RMSprop'}. Best is trial 34 with value: 0.1271187868674389.
2026-05-13 07:58:19,782 - optuna.study.study - INFO - Trial 63 finished with value: 0.11175947708015899 and parameters: {'n_layers': 1, 'embedding_dim': 128, 'lr': 0.00021676962224922782, 'lambda_val': 0.00020497246901718865, 'batch_size': 785, 'optimizer': 'RMSprop'}. Best is trial 34 with value: 0.1271187868674389.
2026-05-13 07:58:53,636 - optuna.study.study - INFO - Trial 64 finished with value: 0.10476817833612705 and parameters: {'n_layers': 1, 'embedding_dim': 256, 'lr': 0.000214922880204222, 'lambda_val': 0.0010854543042344495, 'batch_size': 631, 'optimizer': 'RMSprop'}. Best is trial 34 with value: 0.1271187868674389.
2026-05-13 07:59:26,387 - optuna.study.study - INFO - Trial 65 finished with value: 0.06889771648110302 and parameters: {'n_layers': 1, 'embedding_dim': 256, 'lr': 0.0004123692403158438, 'lambda_val': 0.0008546774901480047, 'batch_size': 691, 'optimizer': 'RMSprop'}. Best is trial 34 with value: 0.1271187868674389.
2026-05-13 07:59:58,553 - optuna.study.study - INFO - Trial 66 finished with value: 0.06898812329063106 and parameters: {'n_layers': 1, 'embedding_dim': 256, 'lr': 0.0012766535254232654, 'lambda_val': 0.0009112199658786778, 'batch_size': 661, 'optimizer': 'RMSprop'}. Best is trial 34 with value: 0.1271187868674389.
2026-05-13 08:00:06,202 - optuna.study._optimize - INFO - Trial 67 pruned. 
2026-05-13 08:00:43,909 - optuna.study.study - INFO - Trial 68 finished with value: 0.09546941376184186 and parameters: {'n_layers': 1, 'embedding_dim': 256, 'lr': 0.00021253318567560073, 'lambda_val': 0.0022731928372115877, 'batch_size': 568, 'optimizer': 'RMSprop'}. Best is trial 34 with value: 0.1271187868674389.
2026-05-13 08:00:47,928 - optuna.study._optimize - INFO - Trial 69 pruned. 
2026-05-13 08:00:52,053 - optuna.study._optimize - INFO - Trial 70 pruned. 
2026-05-13 08:01:20,189 - optuna.study.study - INFO - Trial 71 finished with value: 0.06103987913668472 and parameters: {'n_layers': 1, 'embedding_dim': 128, 'lr': 0.00022973670246354813, 'lambda_val': 0.005392241628621931, 'batch_size': 1087, 'optimizer': 'RMSprop'}. Best is trial 34 with value: 0.1271187868674389.
2026-05-13 08:01:51,520 - optuna.study.study - INFO - Trial 72 finished with value: 0.07873394355077659 and parameters: {'n_layers': 1, 'embedding_dim': 128, 'lr': 0.00033338099917872867, 'lambda_val': 0.00010833600057619641, 'batch_size': 882, 'optimizer': 'RMSprop'}. Best is trial 34 with value: 0.1271187868674389.
2026-05-13 08:01:55,635 - optuna.study._optimize - INFO - Trial 73 pruned. 
2026-05-13 08:02:22,813 - optuna.study.study - INFO - Trial 74 finished with value: 0.0493717436281049 and parameters: {'n_layers': 1, 'embedding_dim': 96, 'lr': 0.0005186673106435908, 'lambda_val': 6.376902198122623e-05, 'batch_size': 1249, 'optimizer': 'RMSprop'}. Best is trial 34 with value: 0.1271187868674389.
2026-05-13 08:02:26,208 - optuna.study._optimize - INFO - Trial 75 pruned. 
2026-05-13 08:02:29,869 - optuna.study._optimize - INFO - Trial 76 pruned. 
2026-05-13 08:02:38,650 - optuna.study._optimize - INFO - Trial 77 pruned. 
2026-05-13 08:03:11,279 - optuna.study.study - INFO - Trial 78 finished with value: 0.049942655094239216 and parameters: {'n_layers': 1, 'embedding_dim': 128, 'lr': 0.00031250911610972723, 'lambda_val': 2.1185384952828472e-05, 'batch_size': 2131, 'optimizer': 'RMSprop'}. Best is trial 34 with value: 0.1271187868674389.
2026-05-13 08:03:15,542 - optuna.study._optimize - INFO - Trial 79 pruned. 
2026-05-13 08:03:20,942 - optuna.study._optimize - INFO - Trial 80 pruned. 
2026-05-13 08:03:24,429 - optuna.study._optimize - INFO - Trial 81 pruned. 
2026-05-13 08:03:53,094 - optuna.study.study - INFO - Trial 82 finished with value: 0.06177481523032332 and parameters: {'n_layers': 1, 'embedding_dim': 128, 'lr': 0.00026124466758466316, 'lambda_val': 3.2440875269525966e-05, 'batch_size': 1672, 'optimizer': 'RMSprop'}. Best is trial 34 with value: 0.1271187868674389.
2026-05-13 08:03:56,843 - optuna.study._optimize - INFO - Trial 83 pruned. 
2026-05-13 08:04:00,649 - optuna.study._optimize - INFO - Trial 84 pruned. 
2026-05-13 08:04:04,163 - optuna.study._optimize - INFO - Trial 85 pruned. 
2026-05-13 08:04:08,167 - optuna.study._optimize - INFO - Trial 86 pruned. 
2026-05-13 08:04:12,001 - optuna.study._optimize - INFO - Trial 87 pruned. 
2026-05-13 08:04:15,923 - optuna.study._optimize - INFO - Trial 88 pruned. 
2026-05-13 08:04:19,658 - optuna.study._optimize - INFO - Trial 89 pruned. 
2026-05-13 08:04:46,966 - optuna.study.study - INFO - Trial 90 finished with value: 0.05637084629814543 and parameters: {'n_layers': 1, 'embedding_dim': 128, 'lr': 0.000401150571109122, 'lambda_val': 2.2896145191661242e-06, 'batch_size': 1604, 'optimizer': 'RMSprop'}. Best is trial 34 with value: 0.1271187868674389.
2026-05-13 08:05:18,043 - optuna.study.study - INFO - Trial 91 finished with value: 0.06867068360903472 and parameters: {'n_layers': 1, 'embedding_dim': 256, 'lr': 0.0002319430142999899, 'lambda_val': 0.00614577129226725, 'batch_size': 590, 'optimizer': 'RMSprop'}. Best is trial 34 with value: 0.1271187868674389.
2026-05-13 08:05:50,116 - optuna.study.study - INFO - Trial 92 finished with value: 0.09976563774923033 and parameters: {'n_layers': 1, 'embedding_dim': 256, 'lr': 0.00021249793420499176, 'lambda_val': 0.0020092688013913893, 'batch_size': 515, 'optimizer': 'RMSprop'}. Best is trial 34 with value: 0.1271187868674389.
2026-05-13 08:05:54,296 - optuna.study._optimize - INFO - Trial 93 pruned. 
2026-05-13 08:06:27,980 - optuna.study.study - INFO - Trial 94 finished with value: 0.07568344352775642 and parameters: {'n_layers': 1, 'embedding_dim': 256, 'lr': 0.0002934494032690895, 'lambda_val': 1.4507059028012667e-06, 'batch_size': 959, 'optimizer': 'RMSprop'}. Best is trial 34 with value: 0.1271187868674389.
2026-05-13 08:07:02,194 - optuna.study.study - INFO - Trial 95 finished with value: 0.07897434134350113 and parameters: {'n_layers': 1, 'embedding_dim': 256, 'lr': 0.00014382084642014484, 'lambda_val': 0.0016884524423865827, 'batch_size': 2348, 'optimizer': 'RMSprop'}. Best is trial 34 with value: 0.1271187868674389.
2026-05-13 08:07:05,540 - optuna.study._optimize - INFO - Trial 96 pruned. 
2026-05-13 08:07:31,415 - optuna.study.study - INFO - Trial 97 finished with value: 0.05165247667703557 and parameters: {'n_layers': 1, 'embedding_dim': 128, 'lr': 0.0006023666902473889, 'lambda_val': 0.0030260085088280025, 'batch_size': 644, 'optimizer': 'RMSprop'}. Best is trial 34 with value: 0.1271187868674389.
2026-05-13 08:07:36,247 - optuna.study._optimize - INFO - Trial 98 pruned. 
