2026-05-14 02:20:07,405 - optuna.study.study - INFO - Trial 23 finished with value: 0.04139506860843344 and parameters: {'n_layers': 1, 'embedding_dim': 128, 'lr': 0.005991155074894206, 'lambda_val': 0.025756759006112386, 'batch_size': 1337, 'optimizer': 'Adam'}. Best is trial 22 with value: 0.07042866503150598.
2026-05-14 02:20:36,267 - optuna.study.study - INFO - Trial 24 finished with value: 0.05827513308082801 and parameters: {'n_layers': 1, 'embedding_dim': 128, 'lr': 0.0018061579257322613, 'lambda_val': 0.006936456477250983, 'batch_size': 1566, 'optimizer': 'Adam'}. Best is trial 22 with value: 0.07042866503150598.
2026-05-14 02:20:40,426 - optuna.study._optimize - INFO - Trial 25 pruned. 
2026-05-14 02:21:08,708 - optuna.study.study - INFO - Trial 26 finished with value: 0.0736009269002137 and parameters: {'n_layers': 1, 'embedding_dim': 128, 'lr': 0.010972298682811753, 'lambda_val': 0.0014538415633243342, 'batch_size': 983, 'optimizer': 'Adam'}. Best is trial 26 with value: 0.0736009269002137.
2026-05-14 02:21:12,732 - optuna.study._optimize - INFO - Trial 27 pruned. 
2026-05-14 02:21:16,184 - optuna.study._optimize - INFO - Trial 28 pruned. 
2026-05-14 02:21:20,088 - optuna.study._optimize - INFO - Trial 29 pruned. 
2026-05-14 02:21:47,071 - optuna.study.study - INFO - Trial 30 finished with value: 0.056031582251529384 and parameters: {'n_layers': 1, 'embedding_dim': 32, 'lr': 0.004115958220015789, 'lambda_val': 0.0019636733347234113, 'batch_size': 1949, 'optimizer': 'RMSprop'}. Best is trial 26 with value: 0.0736009269002137.
2026-05-14 02:22:17,294 - optuna.study.study - INFO - Trial 31 finished with value: 0.05790018426379713 and parameters: {'n_layers': 1, 'embedding_dim': 128, 'lr': 0.0013989116774096655, 'lambda_val': 0.007854406387023971, 'batch_size': 1311, 'optimizer': 'Adam'}. Best is trial 26 with value: 0.0736009269002137.
2026-05-14 02:22:47,040 - optuna.study.study - INFO - Trial 32 finished with value: 0.07195950594704041 and parameters: {'n_layers': 1, 'embedding_dim': 128, 'lr': 0.003126030306332076, 'lambda_val': 0.003695001029073584, 'batch_size': 1717, 'optimizer': 'Adam'}. Best is trial 26 with value: 0.0736009269002137.
2026-05-14 02:23:20,097 - optuna.study.study - INFO - Trial 33 finished with value: 0.06290916151144922 and parameters: {'n_layers': 1, 'embedding_dim': 128, 'lr': 0.009655168349952968, 'lambda_val': 0.0006162580508022022, 'batch_size': 1770, 'optimizer': 'Adam'}. Best is trial 26 with value: 0.0736009269002137.
2026-05-14 02:23:24,764 - optuna.study._optimize - INFO - Trial 34 pruned. 
2026-05-14 02:23:29,017 - optuna.study._optimize - INFO - Trial 35 pruned. 
2026-05-14 02:23:33,243 - optuna.study._optimize - INFO - Trial 36 pruned. 
2026-05-14 02:24:00,172 - optuna.study.study - INFO - Trial 37 finished with value: 0.0400931165040641 and parameters: {'n_layers': 1, 'embedding_dim': 32, 'lr': 0.0034671902352753515, 'lambda_val': 0.000795569456813987, 'batch_size': 1771, 'optimizer': 'Adam'}. Best is trial 26 with value: 0.0736009269002137.
2026-05-14 02:24:04,370 - optuna.study._optimize - INFO - Trial 38 pruned. 
2026-05-14 02:24:33,471 - optuna.study.study - INFO - Trial 39 finished with value: 0.07429806462915031 and parameters: {'n_layers': 1, 'embedding_dim': 128, 'lr': 0.008670478670341437, 'lambda_val': 0.0014959061451158735, 'batch_size': 1429, 'optimizer': 'Adam'}. Best is trial 39 with value: 0.07429806462915031.
2026-05-14 02:24:38,747 - optuna.study._optimize - INFO - Trial 40 pruned. 
2026-05-14 02:25:07,689 - optuna.study.study - INFO - Trial 41 finished with value: 0.0767997164996952 and parameters: {'n_layers': 1, 'embedding_dim': 128, 'lr': 0.008846567265108914, 'lambda_val': 0.0023526299184731796, 'batch_size': 1167, 'optimizer': 'Adam'}. Best is trial 41 with value: 0.0767997164996952.
2026-05-14 02:25:36,660 - optuna.study.study - INFO - Trial 42 finished with value: 0.07147598815067932 and parameters: {'n_layers': 1, 'embedding_dim': 128, 'lr': 0.006449395103882611, 'lambda_val': 0.002242259068342845, 'batch_size': 1170, 'optimizer': 'Adam'}. Best is trial 41 with value: 0.0767997164996952.
2026-05-14 02:25:41,186 - optuna.study._optimize - INFO - Trial 43 pruned. 
2026-05-14 02:25:45,445 - optuna.study._optimize - INFO - Trial 44 pruned. 
2026-05-14 02:25:49,919 - optuna.study._optimize - INFO - Trial 45 pruned. 
2026-05-14 02:25:53,924 - optuna.study._optimize - INFO - Trial 46 pruned. 
2026-05-14 02:25:57,794 - optuna.study._optimize - INFO - Trial 47 pruned. 
2026-05-14 02:26:02,643 - optuna.study._optimize - INFO - Trial 48 pruned. 
2026-05-14 02:26:07,002 - optuna.study._optimize - INFO - Trial 49 pruned. 
2026-05-14 02:26:44,981 - optuna.study.study - INFO - Trial 50 finished with value: 0.07760722494181171 and parameters: {'n_layers': 1, 'embedding_dim': 256, 'lr': 0.0027606770952605824, 'lambda_val': 0.003962607220119074, 'batch_size': 733, 'optimizer': 'Adam'}. Best is trial 50 with value: 0.07760722494181171.
2026-05-14 02:27:18,674 - optuna.study.study - INFO - Trial 51 finished with value: 0.06605803973829998 and parameters: {'n_layers': 1, 'embedding_dim': 256, 'lr': 0.0026644370758035526, 'lambda_val': 0.004526669438438408, 'batch_size': 707, 'optimizer': 'Adam'}. Best is trial 50 with value: 0.07760722494181171.
2026-05-14 02:27:22,955 - optuna.study._optimize - INFO - Trial 52 pruned. 
2026-05-14 02:27:57,201 - optuna.study.study - INFO - Trial 53 finished with value: 0.07721412999750893 and parameters: {'n_layers': 1, 'embedding_dim': 256, 'lr': 0.005229077197579412, 'lambda_val': 0.002242282588882979, 'batch_size': 927, 'optimizer': 'Adam'}. Best is trial 50 with value: 0.07760722494181171.
2026-05-14 02:28:01,631 - optuna.study._optimize - INFO - Trial 54 pruned. 
2026-05-14 02:28:35,595 - optuna.study.study - INFO - Trial 55 finished with value: 0.0701700334309928 and parameters: {'n_layers': 1, 'embedding_dim': 256, 'lr': 0.004418549789043233, 'lambda_val': 0.0012999356216865934, 'batch_size': 960, 'optimizer': 'Adam'}. Best is trial 50 with value: 0.07760722494181171.
2026-05-14 02:28:39,719 - optuna.study._optimize - INFO - Trial 56 pruned. 
2026-05-14 02:29:13,532 - optuna.study.study - INFO - Trial 57 finished with value: 0.053732561981046534 and parameters: {'n_layers': 1, 'embedding_dim': 256, 'lr': 0.0013538409269863389, 'lambda_val': 1.067418645054275e-06, 'batch_size': 1392, 'optimizer': 'Adam'}. Best is trial 50 with value: 0.07760722494181171.
2026-05-14 02:29:49,009 - optuna.study.study - INFO - Trial 58 finished with value: 0.07250051582078318 and parameters: {'n_layers': 1, 'embedding_dim': 256, 'lr': 0.002678399650099848, 'lambda_val': 0.004926345130826152, 'batch_size': 1610, 'optimizer': 'Adam'}. Best is trial 50 with value: 0.07760722494181171.
2026-05-14 02:30:31,278 - optuna.study.study - INFO - Trial 59 finished with value: 0.03084562675206132 and parameters: {'n_layers': 2, 'embedding_dim': 256, 'lr': 0.0004776825171208709, 'lambda_val': 0.005572420727120074, 'batch_size': 1259, 'optimizer': 'Adam'}. Best is trial 50 with value: 0.07760722494181171.
2026-05-14 02:31:14,018 - optuna.study.study - INFO - Trial 60 finished with value: 0.06805075700723912 and parameters: {'n_layers': 1, 'embedding_dim': 256, 'lr': 0.00949711997236565, 'lambda_val': 0.00032111211998309, 'batch_size': 1625, 'optimizer': 'Adam'}. Best is trial 50 with value: 0.07760722494181171.
2026-05-14 02:31:50,554 - optuna.study.study - INFO - Trial 61 finished with value: 0.07446193279371345 and parameters: {'n_layers': 1, 'embedding_dim': 256, 'lr': 0.003157029196498222, 'lambda_val': 0.0033096046596820155, 'batch_size': 1592, 'optimizer': 'Adam'}. Best is trial 50 with value: 0.07760722494181171.
2026-05-14 02:32:24,208 - optuna.study.study - INFO - Trial 62 finished with value: 0.07183045719929827 and parameters: {'n_layers': 1, 'embedding_dim': 256, 'lr': 0.0046145566969250885, 'lambda_val': 0.0014889104567661216, 'batch_size': 1009, 'optimizer': 'Adam'}. Best is trial 50 with value: 0.07760722494181171.
2026-05-14 02:32:58,709 - optuna.study.study - INFO - Trial 63 finished with value: 0.07735254563440999 and parameters: {'n_layers': 1, 'embedding_dim': 256, 'lr': 0.0021573313021046475, 'lambda_val': 0.0027606713926923636, 'batch_size': 1606, 'optimizer': 'Adam'}. Best is trial 50 with value: 0.07760722494181171.
2026-05-14 02:33:03,132 - optuna.study._optimize - INFO - Trial 64 pruned. 
2026-05-14 02:33:07,712 - optuna.study._optimize - INFO - Trial 65 pruned. 
2026-05-14 02:33:41,718 - optuna.study.study - INFO - Trial 66 finished with value: 0.06189789430423159 and parameters: {'n_layers': 1, 'embedding_dim': 256, 'lr': 0.0017311762279592407, 'lambda_val': 0.007181193005580356, 'batch_size': 1413, 'optimizer': 'Adam'}. Best is trial 50 with value: 0.07760722494181171.
2026-05-14 02:34:09,978 - optuna.study.study - INFO - Trial 67 finished with value: 0.05405615944436751 and parameters: {'n_layers': 1, 'embedding_dim': 96, 'lr': 0.0053801257292996, 'lambda_val': 0.000604637470368852, 'batch_size': 1225, 'optimizer': 'Adam'}. Best is trial 50 with value: 0.07760722494181171.
2026-05-14 02:34:43,209 - optuna.study.study - INFO - Trial 68 finished with value: 0.05922583423142335 and parameters: {'n_layers': 1, 'embedding_dim': 256, 'lr': 0.0006340522020977907, 'lambda_val': 0.001078590492863658, 'batch_size': 747, 'optimizer': 'RMSprop'}. Best is trial 50 with value: 0.07760722494181171.
2026-05-14 02:34:47,604 - optuna.study._optimize - INFO - Trial 69 pruned. 
2026-05-14 02:34:52,002 - optuna.study._optimize - INFO - Trial 70 pruned. 
2026-05-14 02:35:26,200 - optuna.study.study - INFO - Trial 71 finished with value: 0.07357847872513305 and parameters: {'n_layers': 1, 'embedding_dim': 256, 'lr': 0.0026461023679976363, 'lambda_val': 0.0029350241007417227, 'batch_size': 1470, 'optimizer': 'Adam'}. Best is trial 50 with value: 0.07760722494181171.
2026-05-14 02:36:59,257 - optuna.study.study - INFO - Trial 72 finished with value: 0.0752357474273508 and parameters: {'n_layers': 1, 'embedding_dim': 256, 'lr': 0.002513843783832701, 'lambda_val': 0.003040889601962235, 'batch_size': 1544, 'optimizer': 'Adam'}. Best is trial 50 with value: 0.07760722494181171.
2026-05-14 02:37:47,513 - optuna.study.study - INFO - Trial 73 finished with value: 0.057156265798613326 and parameters: {'n_layers': 1, 'embedding_dim': 256, 'lr': 0.0014495929223087229, 'lambda_val': 0.009080348201646772, 'batch_size': 1548, 'optimizer': 'Adam'}. Best is trial 50 with value: 0.07760722494181171.
2026-05-14 02:38:21,183 - optuna.study.study - INFO - Trial 74 finished with value: 0.07990173648620325 and parameters: {'n_layers': 1, 'embedding_dim': 256, 'lr': 0.00782444088092365, 'lambda_val': 0.0038188368869317667, 'batch_size': 1377, 'optimizer': 'Adam'}. Best is trial 74 with value: 0.07990173648620325.
2026-05-14 02:38:59,447 - optuna.study.study - INFO - Trial 75 finished with value: 0.06683025864935947 and parameters: {'n_layers': 1, 'embedding_dim': 256, 'lr': 0.0011178299333884812, 'lambda_val': 0.003254169720232432, 'batch_size': 1341, 'optimizer': 'Adam'}. Best is trial 74 with value: 0.07990173648620325.
2026-05-14 02:39:05,423 - optuna.study._optimize - INFO - Trial 76 pruned. 
2026-05-14 02:39:09,425 - optuna.study._optimize - INFO - Trial 77 pruned. 
2026-05-14 02:39:14,038 - optuna.study._optimize - INFO - Trial 78 pruned. 
2026-05-14 02:39:56,260 - optuna.study.study - INFO - Trial 79 finished with value: 0.08059849778498555 and parameters: {'n_layers': 1, 'embedding_dim': 256, 'lr': 0.00210944069619418, 'lambda_val': 0.002104416177307709, 'batch_size': 2662, 'optimizer': 'Adam'}. Best is trial 79 with value: 0.08059849778498555.
2026-05-14 02:40:03,380 - optuna.study._optimize - INFO - Trial 80 pruned. 
2026-05-14 02:40:39,163 - optuna.study.study - INFO - Trial 81 finished with value: 0.07289105974953718 and parameters: {'n_layers': 1, 'embedding_dim': 256, 'lr': 0.0030797078999141134, 'lambda_val': 0.0042711523633366935, 'batch_size': 2971, 'optimizer': 'Adam'}. Best is trial 79 with value: 0.08059849778498555.
2026-05-14 02:41:12,600 - optuna.study.study - INFO - Trial 82 finished with value: 0.0718416109971021 and parameters: {'n_layers': 1, 'embedding_dim': 256, 'lr': 0.004918614072570443, 'lambda_val': 0.0007521200448320066, 'batch_size': 2532, 'optimizer': 'Adam'}. Best is trial 79 with value: 0.08059849778498555.
2026-05-14 02:41:45,964 - optuna.study.study - INFO - Trial 83 finished with value: 0.07499322544230642 and parameters: {'n_layers': 1, 'embedding_dim': 256, 'lr': 0.007194732593929218, 'lambda_val': 0.002078103771821388, 'batch_size': 1193, 'optimizer': 'Adam'}. Best is trial 79 with value: 0.08059849778498555.
2026-05-14 02:42:20,613 - optuna.study.study - INFO - Trial 84 finished with value: 0.071788729325079 and parameters: {'n_layers': 1, 'embedding_dim': 256, 'lr': 0.0038860243134888153, 'lambda_val': 0.003588626492173875, 'batch_size': 2258, 'optimizer': 'Adam'}. Best is trial 79 with value: 0.08059849778498555.
2026-05-14 02:42:57,638 - optuna.study.study - INFO - Trial 85 finished with value: 0.06684062732762967 and parameters: {'n_layers': 1, 'embedding_dim': 256, 'lr': 0.0011903789353921055, 'lambda_val': 0.0020140721379566136, 'batch_size': 1069, 'optimizer': 'Adam'}. Best is trial 79 with value: 0.08059849778498555.
2026-05-14 02:43:31,319 - optuna.study.study - INFO - Trial 86 finished with value: 0.07131672951206808 and parameters: {'n_layers': 1, 'embedding_dim': 256, 'lr': 0.0022959655234414916, 'lambda_val': 0.001056609265793058, 'batch_size': 1189, 'optimizer': 'RMSprop'}. Best is trial 79 with value: 0.08059849778498555.
2026-05-14 02:43:35,735 - optuna.study._optimize - INFO - Trial 87 pruned. 
2026-05-14 02:43:39,667 - optuna.study._optimize - INFO - Trial 88 pruned. 
2026-05-14 02:44:14,797 - optuna.study.study - INFO - Trial 89 finished with value: 0.07647974910984075 and parameters: {'n_layers': 1, 'embedding_dim': 256, 'lr': 0.011027261960056713, 'lambda_val': 0.0017766157107318155, 'batch_size': 2684, 'optimizer': 'Adam'}. Best is trial 79 with value: 0.08059849778498555.
2026-05-14 02:44:19,951 - optuna.study._optimize - INFO - Trial 90 pruned. 
2026-05-14 02:44:24,766 - optuna.study._optimize - INFO - Trial 91 pruned. 
2026-05-14 02:44:59,169 - optuna.study.study - INFO - Trial 92 finished with value: 0.07780290648542482 and parameters: {'n_layers': 1, 'embedding_dim': 256, 'lr': 0.006957670383804707, 'lambda_val': 0.0008979888113682453, 'batch_size': 2435, 'optimizer': 'Adam'}. Best is trial 79 with value: 0.08059849778498555.
2026-05-14 02:45:34,460 - optuna.study.study - INFO - Trial 93 finished with value: 0.07283505215162259 and parameters: {'n_layers': 1, 'embedding_dim': 256, 'lr': 0.011442178057936434, 'lambda_val': 0.0009274299587243252, 'batch_size': 2528, 'optimizer': 'Adam'}. Best is trial 79 with value: 0.08059849778498555.
2026-05-14 02:45:39,547 - optuna.study._optimize - INFO - Trial 94 pruned. 
2026-05-14 02:46:14,899 - optuna.study.study - INFO - Trial 95 finished with value: 0.07777927250765544 and parameters: {'n_layers': 1, 'embedding_dim': 256, 'lr': 0.007445550482163, 'lambda_val': 0.0012329594244764122, 'batch_size': 2767, 'optimizer': 'Adam'}. Best is trial 79 with value: 0.08059849778498555.
2026-05-14 02:46:38,438 - optuna.study._optimize - INFO - Trial 96 pruned. 
2026-05-14 02:46:43,138 - optuna.study._optimize - INFO - Trial 97 pruned. 
2026-05-14 02:46:47,155 - optuna.study._optimize - INFO - Trial 98 pruned. 
2026-05-14 02:47:15,794 - optuna.study._optimize - INFO - Trial 99 pruned. 
2026-05-14 02:47:49,083 - optuna.study.study - INFO - Trial 100 finished with value: 0.08031737083604 and parameters: {'n_layers': 1, 'embedding_dim': 256, 'lr': 0.009698046372093145, 'lambda_val': 0.0016965523165998451, 'batch_size': 3093, 'optimizer': 'RMSprop'}. Best is trial 79 with value: 0.08059849778498555.
2026-05-14 02:48:22,999 - optuna.study.study - INFO - Trial 101 finished with value: 0.07512225533272976 and parameters: {'n_layers': 1, 'embedding_dim': 256, 'lr': 0.00859184835719986, 'lambda_val': 0.0018064268465683767, 'batch_size': 3147, 'optimizer': 'RMSprop'}. Best is trial 79 with value: 0.08059849778498555.
2026-05-14 02:48:58,322 - optuna.study.study - INFO - Trial 102 finished with value: 0.08329158840380183 and parameters: {'n_layers': 1, 'embedding_dim': 256, 'lr': 0.009878650800960174, 'lambda_val': 0.001291853313120976, 'batch_size': 2829, 'optimizer': 'RMSprop'}. Best is trial 102 with value: 0.08329158840380183.
2026-05-14 02:49:33,420 - optuna.study.study - INFO - Trial 103 finished with value: 0.07884316116240916 and parameters: {'n_layers': 1, 'embedding_dim': 256, 'lr': 0.01063826021050421, 'lambda_val': 0.0015452526801944919, 'batch_size': 2931, 'optimizer': 'RMSprop'}. Best is trial 102 with value: 0.08329158840380183.
2026-05-14 02:49:48,688 - optuna.study._optimize - INFO - Trial 104 pruned. 
2026-05-14 02:49:53,163 - optuna.study._optimize - INFO - Trial 105 pruned. 
2026-05-14 02:50:23,630 - optuna.study.study - INFO - Trial 106 finished with value: 0.07508364647940298 and parameters: {'n_layers': 1, 'embedding_dim': 96, 'lr': 0.016929745846213186, 'lambda_val': 0.0013875013653460088, 'batch_size': 2899, 'optimizer': 'RMSprop'}. Best is trial 102 with value: 0.08329158840380183.
2026-05-14 02:50:28,232 - optuna.study._optimize - INFO - Trial 107 pruned. 
2026-05-14 02:51:02,422 - optuna.study.study - INFO - Trial 108 finished with value: 0.08177917260028232 and parameters: {'n_layers': 1, 'embedding_dim': 256, 'lr': 0.005486805721198493, 'lambda_val': 0.002426113514752859, 'batch_size': 3371, 'optimizer': 'RMSprop'}. Best is trial 102 with value: 0.08329158840380183.
2026-05-14 02:51:37,516 - optuna.study.study - INFO - Trial 109 finished with value: 0.07440948093219173 and parameters: {'n_layers': 1, 'embedding_dim': 256, 'lr': 0.005449752443650666, 'lambda_val': 0.0003811879154860999, 'batch_size': 3110, 'optimizer': 'RMSprop'}. Best is trial 102 with value: 0.08329158840380183.
2026-05-14 02:52:12,669 - optuna.study.study - INFO - Trial 110 finished with value: 0.07280350944276182 and parameters: {'n_layers': 1, 'embedding_dim': 256, 'lr': 0.003658784262696338, 'lambda_val': 0.0006814135410733331, 'batch_size': 3350, 'optimizer': 'RMSprop'}. Best is trial 102 with value: 0.08329158840380183.
2026-05-14 02:52:50,747 - optuna.study.study - INFO - Trial 111 finished with value: 0.07867965995080606 and parameters: {'n_layers': 1, 'embedding_dim': 256, 'lr': 0.00689740910583568, 'lambda_val': 0.0024543335054979863, 'batch_size': 3454, 'optimizer': 'RMSprop'}. Best is trial 102 with value: 0.08329158840380183.
2026-05-14 02:53:24,999 - optuna.study.study - INFO - Trial 112 finished with value: 0.08410177668587294 and parameters: {'n_layers': 1, 'embedding_dim': 256, 'lr': 0.00713811485836667, 'lambda_val': 0.0013208067257468414, 'batch_size': 3615, 'optimizer': 'RMSprop'}. Best is trial 112 with value: 0.08410177668587294.
2026-05-14 02:53:59,073 - optuna.study.study - INFO - Trial 113 finished with value: 0.0738581596734249 and parameters: {'n_layers': 1, 'embedding_dim': 256, 'lr': 0.00701783838420924, 'lambda_val': 0.0011055122451990398, 'batch_size': 3537, 'optimizer': 'RMSprop'}. Best is trial 112 with value: 0.08410177668587294.
2026-05-14 02:54:33,263 - optuna.study.study - INFO - Trial 114 finished with value: 0.08081333259850128 and parameters: {'n_layers': 1, 'embedding_dim': 256, 'lr': 0.010603915672809803, 'lambda_val': 0.001419575414354167, 'batch_size': 3631, 'optimizer': 'RMSprop'}. Best is trial 112 with value: 0.08410177668587294.
2026-05-14 02:55:08,532 - optuna.study.study - INFO - Trial 115 finished with value: 0.08170113524637984 and parameters: {'n_layers': 1, 'embedding_dim': 256, 'lr': 0.010218763743858607, 'lambda_val': 0.0015322311946902958, 'batch_size': 3671, 'optimizer': 'RMSprop'}. Best is trial 112 with value: 0.08410177668587294.
2026-05-14 02:55:42,483 - optuna.study.study - INFO - Trial 116 finished with value: 0.07947626394065398 and parameters: {'n_layers': 1, 'embedding_dim': 256, 'lr': 0.010494932454311486, 'lambda_val': 0.0013278640279246012, 'batch_size': 3745, 'optimizer': 'RMSprop'}. Best is trial 112 with value: 0.08410177668587294.
2026-05-14 02:56:17,655 - optuna.study.study - INFO - Trial 117 finished with value: 0.07955406700328228 and parameters: {'n_layers': 1, 'embedding_dim': 256, 'lr': 0.011191742683741852, 'lambda_val': 0.0015143801744805332, 'batch_size': 3521, 'optimizer': 'RMSprop'}. Best is trial 112 with value: 0.08410177668587294.
2026-05-14 02:56:53,874 - optuna.study.study - INFO - Trial 118 finished with value: 0.07667077219606641 and parameters: {'n_layers': 1, 'embedding_dim': 256, 'lr': 0.013326108411150204, 'lambda_val': 0.0015776087598593713, 'batch_size': 3797, 'optimizer': 'RMSprop'}. Best is trial 112 with value: 0.08410177668587294.
2026-05-14 02:57:29,206 - optuna.study.study - INFO - Trial 119 finished with value: 0.07907000720131047 and parameters: {'n_layers': 1, 'embedding_dim': 256, 'lr': 0.010021243376222011, 'lambda_val': 0.0013129525225817277, 'batch_size': 3577, 'optimizer': 'RMSprop'}. Best is trial 112 with value: 0.08410177668587294.
2026-05-14 02:57:35,303 - optuna.study._optimize - INFO - Trial 120 pruned. 
2026-05-14 02:58:12,897 - optuna.study.study - INFO - Trial 121 finished with value: 0.07737582449544435 and parameters: {'n_layers': 1, 'embedding_dim': 256, 'lr': 0.011063346399903933, 'lambda_val': 0.00061155578949797, 'batch_size': 3451, 'optimizer': 'RMSprop'}. Best is trial 112 with value: 0.08410177668587294.
2026-05-14 02:58:48,171 - optuna.study.study - INFO - Trial 122 finished with value: 0.07131198391979719 and parameters: {'n_layers': 1, 'embedding_dim': 256, 'lr': 0.01798706250800538, 'lambda_val': 0.002320680552664782, 'batch_size': 3684, 'optimizer': 'RMSprop'}. Best is trial 112 with value: 0.08410177668587294.
