2026-05-13 15:25:43,521 - optuna.study.study - INFO - Trial 24 finished with value: 0.03494403308932833 and parameters: {'n_layers': 2, 'embedding_dim': 256, 'lr': 0.0005123692239201562, 'lambda_val': 0.00019944736594918104, 'batch_size': 2578, 'optimizer': 'Adam'}. Best is trial 23 with value: 0.06555746546790052.
2026-05-13 15:26:16,422 - optuna.study.study - INFO - Trial 25 finished with value: 0.10727808686719892 and parameters: {'n_layers': 1, 'embedding_dim': 128, 'lr': 9.384168467229284e-05, 'lambda_val': 2.8675230732805433e-05, 'batch_size': 3554, 'optimizer': 'Adam'}. Best is trial 25 with value: 0.10727808686719892.
2026-05-13 15:26:20,946 - optuna.study._optimize - INFO - Trial 26 pruned. 
2026-05-13 15:26:28,382 - optuna.study._optimize - INFO - Trial 27 pruned. 
2026-05-13 15:27:04,604 - optuna.study.study - INFO - Trial 28 finished with value: 0.07818876208022994 and parameters: {'n_layers': 1, 'embedding_dim': 128, 'lr': 0.00013899282824848127, 'lambda_val': 2.9077926063785917e-05, 'batch_size': 3277, 'optimizer': 'Adam'}. Best is trial 25 with value: 0.10727808686719892.
2026-05-13 15:27:41,577 - optuna.study.study - INFO - Trial 29 finished with value: 0.039548773745975846 and parameters: {'n_layers': 2, 'embedding_dim': 128, 'lr': 0.00012401819162750015, 'lambda_val': 4.107476212566346e-06, 'batch_size': 3957, 'optimizer': 'Adam'}. Best is trial 25 with value: 0.10727808686719892.
2026-05-13 15:28:12,010 - optuna.study.study - INFO - Trial 30 finished with value: 0.052278064050723265 and parameters: {'n_layers': 1, 'embedding_dim': 96, 'lr': 0.00042204822014651897, 'lambda_val': 2.7453192954861724e-05, 'batch_size': 3740, 'optimizer': 'Adam'}. Best is trial 25 with value: 0.10727808686719892.
2026-05-13 15:28:43,008 - optuna.study.study - INFO - Trial 31 finished with value: 0.09943813524620156 and parameters: {'n_layers': 1, 'embedding_dim': 128, 'lr': 0.00010688249995374678, 'lambda_val': 9.163525113964432e-06, 'batch_size': 3321, 'optimizer': 'Adam'}. Best is trial 25 with value: 0.10727808686719892.
2026-05-13 15:28:47,574 - optuna.study._optimize - INFO - Trial 32 pruned. 
2026-05-13 15:29:19,390 - optuna.study.study - INFO - Trial 33 finished with value: 0.1053338558218733 and parameters: {'n_layers': 1, 'embedding_dim': 128, 'lr': 0.00011448517133421968, 'lambda_val': 3.288597168536203e-05, 'batch_size': 3342, 'optimizer': 'Adam'}. Best is trial 25 with value: 0.10727808686719892.
2026-05-13 15:29:51,379 - optuna.study.study - INFO - Trial 34 finished with value: 0.09701875976864996 and parameters: {'n_layers': 1, 'embedding_dim': 128, 'lr': 9.90959998829713e-05, 'lambda_val': 4.377483624955134e-05, 'batch_size': 3851, 'optimizer': 'Adam'}. Best is trial 25 with value: 0.10727808686719892.
2026-05-13 15:29:55,454 - optuna.study._optimize - INFO - Trial 35 pruned. 
2026-05-13 15:30:03,658 - optuna.study._optimize - INFO - Trial 36 pruned. 
2026-05-13 15:30:08,785 - optuna.study._optimize - INFO - Trial 37 pruned. 
2026-05-13 15:30:12,856 - optuna.study._optimize - INFO - Trial 38 pruned. 
2026-05-13 15:30:43,177 - optuna.study.study - INFO - Trial 39 finished with value: 0.04609132906009733 and parameters: {'n_layers': 1, 'embedding_dim': 64, 'lr': 0.0002694278156610148, 'lambda_val': 0.0008142992245619644, 'batch_size': 3122, 'optimizer': 'Adam'}. Best is trial 25 with value: 0.10727808686719892.
2026-05-13 15:30:48,567 - optuna.study._optimize - INFO - Trial 40 pruned. 
2026-05-13 15:31:19,799 - optuna.study.study - INFO - Trial 41 finished with value: 0.07045512686253559 and parameters: {'n_layers': 1, 'embedding_dim': 128, 'lr': 0.00017297110674745574, 'lambda_val': 1.2719607951526167e-05, 'batch_size': 3371, 'optimizer': 'Adam'}. Best is trial 25 with value: 0.10727808686719892.
2026-05-13 15:31:52,298 - optuna.study.study - INFO - Trial 42 finished with value: 0.08000238275322706 and parameters: {'n_layers': 1, 'embedding_dim': 128, 'lr': 0.00013754306243326638, 'lambda_val': 0.00014790660214384827, 'batch_size': 3667, 'optimizer': 'Adam'}. Best is trial 25 with value: 0.10727808686719892.
2026-05-13 15:31:56,362 - optuna.study._optimize - INFO - Trial 43 pruned. 
2026-05-13 15:32:00,349 - optuna.study._optimize - INFO - Trial 44 pruned. 
2026-05-13 15:32:06,380 - optuna.study._optimize - INFO - Trial 45 pruned. 
2026-05-13 15:32:10,843 - optuna.study._optimize - INFO - Trial 46 pruned. 
2026-05-13 15:32:14,903 - optuna.study._optimize - INFO - Trial 47 pruned. 
2026-05-13 15:32:19,459 - optuna.study._optimize - INFO - Trial 48 pruned. 
2026-05-13 15:32:51,507 - optuna.study.study - INFO - Trial 49 finished with value: 0.053660433308235694 and parameters: {'n_layers': 1, 'embedding_dim': 128, 'lr': 0.00031072495116819696, 'lambda_val': 2.1957459166036267e-06, 'batch_size': 4069, 'optimizer': 'Adam'}. Best is trial 25 with value: 0.10727808686719892.
2026-05-13 15:33:27,524 - optuna.study.study - INFO - Trial 50 finished with value: 0.028923731561391403 and parameters: {'n_layers': 2, 'embedding_dim': 128, 'lr': 0.0007279011593142674, 'lambda_val': 6.501602818992241e-06, 'batch_size': 2823, 'optimizer': 'Adam'}. Best is trial 25 with value: 0.10727808686719892.
2026-05-13 15:33:58,782 - optuna.study.study - INFO - Trial 51 finished with value: 0.0849709627269037 and parameters: {'n_layers': 1, 'embedding_dim': 128, 'lr': 0.00013497032788683657, 'lambda_val': 2.722497751375669e-05, 'batch_size': 3270, 'optimizer': 'Adam'}. Best is trial 25 with value: 0.10727808686719892.
2026-05-13 15:34:30,275 - optuna.study.study - INFO - Trial 52 finished with value: 0.10162907885050364 and parameters: {'n_layers': 1, 'embedding_dim': 128, 'lr': 0.00011461352504016776, 'lambda_val': 4.939041818664685e-05, 'batch_size': 3086, 'optimizer': 'Adam'}. Best is trial 25 with value: 0.10727808686719892.
2026-05-13 15:34:34,542 - optuna.study._optimize - INFO - Trial 53 pruned. 
2026-05-13 15:34:39,014 - optuna.study._optimize - INFO - Trial 54 pruned. 
2026-05-13 15:35:09,897 - optuna.study.study - INFO - Trial 55 finished with value: 0.09987867133643756 and parameters: {'n_layers': 1, 'embedding_dim': 128, 'lr': 0.00012566267388425037, 'lambda_val': 6.579904389263208e-06, 'batch_size': 2795, 'optimizer': 'Adam'}. Best is trial 25 with value: 0.10727808686719892.
2026-05-13 15:35:14,292 - optuna.study._optimize - INFO - Trial 56 pruned. 
2026-05-13 15:35:18,333 - optuna.study._optimize - INFO - Trial 57 pruned. 
2026-05-13 15:35:47,493 - optuna.study.study - INFO - Trial 58 finished with value: 0.05048822862984091 and parameters: {'n_layers': 1, 'embedding_dim': 96, 'lr': 0.0003791909334579924, 'lambda_val': 6.3067556309611474e-06, 'batch_size': 2932, 'optimizer': 'Adam'}. Best is trial 25 with value: 0.10727808686719892.
2026-05-13 15:36:17,562 - optuna.study.study - INFO - Trial 59 finished with value: 0.06712139771421202 and parameters: {'n_layers': 1, 'embedding_dim': 128, 'lr': 0.00023184932609948114, 'lambda_val': 7.536137960886109e-06, 'batch_size': 3513, 'optimizer': 'Adam'}. Best is trial 25 with value: 0.10727808686719892.
2026-05-13 15:36:21,816 - optuna.study._optimize - INFO - Trial 60 pruned. 
2026-05-13 15:36:53,652 - optuna.study.study - INFO - Trial 61 finished with value: 0.09443554139185649 and parameters: {'n_layers': 1, 'embedding_dim': 128, 'lr': 0.00012012901633215267, 'lambda_val': 2.5169991145823105e-05, 'batch_size': 3267, 'optimizer': 'Adam'}. Best is trial 25 with value: 0.10727808686719892.
2026-05-13 15:37:25,094 - optuna.study.study - INFO - Trial 62 finished with value: 0.06513772782504387 and parameters: {'n_layers': 1, 'embedding_dim': 128, 'lr': 0.00018487971378863154, 'lambda_val': 5.7173464070785777e-05, 'batch_size': 3384, 'optimizer': 'Adam'}. Best is trial 25 with value: 0.10727808686719892.
2026-05-13 15:37:56,591 - optuna.study.study - INFO - Trial 63 finished with value: 0.0983325653775525 and parameters: {'n_layers': 1, 'embedding_dim': 128, 'lr': 0.00012386891498369565, 'lambda_val': 0.00010139456281887543, 'batch_size': 2820, 'optimizer': 'Adam'}. Best is trial 25 with value: 0.10727808686719892.
2026-05-13 15:38:00,797 - optuna.study._optimize - INFO - Trial 64 pruned. 
2026-05-13 15:38:33,099 - optuna.study.study - INFO - Trial 65 finished with value: 0.06107884942545939 and parameters: {'n_layers': 1, 'embedding_dim': 128, 'lr': 0.0005984547181704663, 'lambda_val': 9.831538783422465e-05, 'batch_size': 2816, 'optimizer': 'Adam'}. Best is trial 25 with value: 0.10727808686719892.
2026-05-13 15:38:37,256 - optuna.study._optimize - INFO - Trial 66 pruned. 
2026-05-13 15:38:42,375 - optuna.study._optimize - INFO - Trial 67 pruned. 
2026-05-13 15:39:16,685 - optuna.study.study - INFO - Trial 68 finished with value: 0.03195782150195625 and parameters: {'n_layers': 2, 'embedding_dim': 128, 'lr': 0.0003353713282291839, 'lambda_val': 3.63784586829321e-05, 'batch_size': 2082, 'optimizer': 'Adam'}. Best is trial 25 with value: 0.10727808686719892.
2026-05-13 15:39:48,455 - optuna.study.study - INFO - Trial 69 finished with value: 0.07940472439791386 and parameters: {'n_layers': 1, 'embedding_dim': 128, 'lr': 0.00016558250411313316, 'lambda_val': 1.840132675861007e-05, 'batch_size': 2891, 'optimizer': 'Adam'}. Best is trial 25 with value: 0.10727808686719892.
2026-05-13 15:39:52,329 - optuna.study._optimize - INFO - Trial 70 pruned. 
2026-05-13 15:40:23,652 - optuna.study.study - INFO - Trial 71 finished with value: 0.10118231958106483 and parameters: {'n_layers': 1, 'embedding_dim': 128, 'lr': 0.0001113514712094215, 'lambda_val': 2.686174425533344e-05, 'batch_size': 3213, 'optimizer': 'Adam'}. Best is trial 25 with value: 0.10727808686719892.
2026-05-13 15:40:55,254 - optuna.study.study - INFO - Trial 72 finished with value: 0.0553789205831622 and parameters: {'n_layers': 1, 'embedding_dim': 128, 'lr': 0.00022957311350990924, 'lambda_val': 1.4913284109493247e-05, 'batch_size': 3129, 'optimizer': 'Adam'}. Best is trial 25 with value: 0.10727808686719892.
2026-05-13 15:40:59,483 - optuna.study._optimize - INFO - Trial 73 pruned. 
2026-05-13 15:41:03,915 - optuna.study._optimize - INFO - Trial 74 pruned. 
2026-05-13 15:41:09,728 - optuna.study._optimize - INFO - Trial 75 pruned. 
2026-05-13 15:41:39,679 - optuna.study.study - INFO - Trial 76 finished with value: 0.08218556286522971 and parameters: {'n_layers': 1, 'embedding_dim': 64, 'lr': 0.0001728827749586768, 'lambda_val': 5.346917999124475e-05, 'batch_size': 3023, 'optimizer': 'Adam'}. Best is trial 25 with value: 0.10727808686719892.
2026-05-13 15:41:44,049 - optuna.study._optimize - INFO - Trial 77 pruned. 
2026-05-13 15:41:48,003 - optuna.study._optimize - INFO - Trial 78 pruned. 
2026-05-13 15:42:20,352 - optuna.study.study - INFO - Trial 79 finished with value: 0.0753569324201838 and parameters: {'n_layers': 1, 'embedding_dim': 128, 'lr': 0.00015823629071787108, 'lambda_val': 0.00011713249692756948, 'batch_size': 3774, 'optimizer': 'Adam'}. Best is trial 25 with value: 0.10727808686719892.
2026-05-13 15:42:24,279 - optuna.study._optimize - INFO - Trial 80 pruned. 
2026-05-13 15:42:56,259 - optuna.study.study - INFO - Trial 81 finished with value: 0.10120259898214082 and parameters: {'n_layers': 1, 'embedding_dim': 128, 'lr': 0.00011180884073463021, 'lambda_val': 3.115515267914553e-05, 'batch_size': 3226, 'optimizer': 'Adam'}. Best is trial 25 with value: 0.10727808686719892.
2026-05-13 15:43:28,009 - optuna.study.study - INFO - Trial 82 finished with value: 0.09894239129504463 and parameters: {'n_layers': 1, 'embedding_dim': 128, 'lr': 0.00011323882457034819, 'lambda_val': 8.450088399136837e-05, 'batch_size': 3451, 'optimizer': 'Adam'}. Best is trial 25 with value: 0.10727808686719892.
2026-05-13 15:43:59,587 - optuna.study.study - INFO - Trial 83 finished with value: 0.08315235134731971 and parameters: {'n_layers': 1, 'embedding_dim': 128, 'lr': 0.00013345058448513623, 'lambda_val': 7.940173338068048e-05, 'batch_size': 3446, 'optimizer': 'Adam'}. Best is trial 25 with value: 0.10727808686719892.
2026-05-13 15:44:03,837 - optuna.study._optimize - INFO - Trial 84 pruned. 
2026-05-13 15:44:36,222 - optuna.study.study - INFO - Trial 85 finished with value: 0.06432713471866001 and parameters: {'n_layers': 1, 'embedding_dim': 128, 'lr': 0.00022158820404708993, 'lambda_val': 6.15724422191968e-05, 'batch_size': 2849, 'optimizer': 'Adam'}. Best is trial 25 with value: 0.10727808686719892.
2026-05-13 15:44:40,741 - optuna.study._optimize - INFO - Trial 86 pruned. 
2026-05-13 15:44:46,613 - optuna.study._optimize - INFO - Trial 87 pruned. 
2026-05-13 15:44:51,484 - optuna.study._optimize - INFO - Trial 88 pruned. 
2026-05-13 15:44:55,514 - optuna.study._optimize - INFO - Trial 89 pruned. 
2026-05-13 15:45:00,438 - optuna.study._optimize - INFO - Trial 90 pruned. 
2026-05-13 15:45:04,523 - optuna.study._optimize - INFO - Trial 91 pruned. 
2026-05-13 15:45:35,747 - optuna.study.study - INFO - Trial 92 finished with value: 0.08089067385861828 and parameters: {'n_layers': 1, 'embedding_dim': 128, 'lr': 0.00015187713023535188, 'lambda_val': 8.043248555128877e-05, 'batch_size': 3104, 'optimizer': 'Adam'}. Best is trial 25 with value: 0.10727808686719892.
2026-05-13 15:45:40,053 - optuna.study._optimize - INFO - Trial 93 pruned. 
2026-05-13 15:46:12,940 - optuna.study.study - INFO - Trial 94 finished with value: 0.08678210436768213 and parameters: {'n_layers': 1, 'embedding_dim': 128, 'lr': 0.00011753759067888513, 'lambda_val': 0.00011589700131019005, 'batch_size': 3724, 'optimizer': 'Adam'}. Best is trial 25 with value: 0.10727808686719892.
2026-05-13 15:46:16,797 - optuna.study._optimize - INFO - Trial 95 pruned. 
2026-05-13 15:46:48,116 - optuna.study.study - INFO - Trial 96 finished with value: 0.06454241094928814 and parameters: {'n_layers': 1, 'embedding_dim': 128, 'lr': 0.00019400537445230456, 'lambda_val': 3.3900501873495237e-06, 'batch_size': 3992, 'optimizer': 'Adam'}. Best is trial 25 with value: 0.10727808686719892.
2026-05-13 15:46:52,541 - optuna.study._optimize - INFO - Trial 97 pruned. 
2026-05-13 15:47:23,911 - optuna.study.study - INFO - Trial 98 finished with value: 0.04814796489676046 and parameters: {'n_layers': 1, 'embedding_dim': 128, 'lr': 0.00031143509002621434, 'lambda_val': 9.833167097221416e-06, 'batch_size': 3371, 'optimizer': 'RMSprop'}. Best is trial 25 with value: 0.10727808686719892.
2026-05-13 15:47:28,090 - optuna.study._optimize - INFO - Trial 99 pruned. 
2026-05-13 15:47:32,645 - optuna.study._optimize - INFO - Trial 100 pruned. 
2026-05-13 15:47:37,474 - optuna.study._optimize - INFO - Trial 101 pruned. 
2026-05-13 15:47:41,760 - optuna.study._optimize - INFO - Trial 102 pruned. 
2026-05-13 15:47:46,892 - optuna.study._optimize - INFO - Trial 103 pruned. 
2026-05-13 15:48:22,898 - optuna.study.study - INFO - Trial 104 finished with value: 0.0659500119193013 and parameters: {'n_layers': 1, 'embedding_dim': 256, 'lr': 0.00019201055329197896, 'lambda_val': 5.9111422932937455e-05, 'batch_size': 3657, 'optimizer': 'Adam'}. Best is trial 25 with value: 0.10727808686719892.
2026-05-13 15:48:27,016 - optuna.study._optimize - INFO - Trial 105 pruned. 
2026-05-13 15:48:31,135 - optuna.study._optimize - INFO - Trial 106 pruned. 
2026-05-13 15:49:02,579 - optuna.study.study - INFO - Trial 107 finished with value: 0.058415006737866704 and parameters: {'n_layers': 1, 'embedding_dim': 128, 'lr': 0.0002491006551946094, 'lambda_val': 7.085660447537661e-06, 'batch_size': 3157, 'optimizer': 'Adam'}. Best is trial 25 with value: 0.10727808686719892.
2026-05-13 15:49:34,478 - optuna.study.study - INFO - Trial 108 finished with value: 0.08094708098555224 and parameters: {'n_layers': 1, 'embedding_dim': 128, 'lr': 0.00015057885526750898, 'lambda_val': 9.691836419550357e-05, 'batch_size': 3468, 'optimizer': 'Adam'}. Best is trial 25 with value: 0.10727808686719892.
2026-05-13 15:49:38,582 - optuna.study._optimize - INFO - Trial 109 pruned. 
2026-05-13 15:49:43,722 - optuna.study._optimize - INFO - Trial 110 pruned. 
2026-05-13 15:50:15,438 - optuna.study.study - INFO - Trial 111 finished with value: 0.09498200146533994 and parameters: {'n_layers': 1, 'embedding_dim': 128, 'lr': 0.00011857259652583028, 'lambda_val': 0.00011696477309283962, 'batch_size': 3738, 'optimizer': 'Adam'}. Best is trial 25 with value: 0.10727808686719892.
2026-05-13 15:50:47,482 - optuna.study.study - INFO - Trial 112 finished with value: 0.054612198031688486 and parameters: {'n_layers': 1, 'embedding_dim': 128, 'lr': 0.0001968576039439978, 'lambda_val': 0.00023201617268228406, 'batch_size': 3922, 'optimizer': 'Adam'}. Best is trial 25 with value: 0.10727808686719892.
2026-05-13 15:51:18,592 - optuna.study.study - INFO - Trial 113 finished with value: 0.09022296615171321 and parameters: {'n_layers': 1, 'embedding_dim': 128, 'lr': 0.00012264531478820812, 'lambda_val': 7.561056005951245e-05, 'batch_size': 3325, 'optimizer': 'Adam'}. Best is trial 25 with value: 0.10727808686719892.
2026-05-13 15:51:23,111 - optuna.study._optimize - INFO - Trial 114 pruned. 
2026-05-13 15:51:56,098 - optuna.study.study - INFO - Trial 115 finished with value: 0.08572703364360501 and parameters: {'n_layers': 1, 'embedding_dim': 128, 'lr': 0.00016179161113800852, 'lambda_val': 0.00012283114221266417, 'batch_size': 2637, 'optimizer': 'Adam'}. Best is trial 25 with value: 0.10727808686719892.
2026-05-13 15:52:26,209 - optuna.study.study - INFO - Trial 116 finished with value: 0.053343807859181386 and parameters: {'n_layers': 1, 'embedding_dim': 96, 'lr': 0.00037628252533437905, 'lambda_val': 6.619625009628762e-05, 'batch_size': 3570, 'optimizer': 'Adam'}. Best is trial 25 with value: 0.10727808686719892.
2026-05-13 15:52:30,502 - optuna.study._optimize - INFO - Trial 117 pruned. 
2026-05-13 15:52:35,390 - optuna.study._optimize - INFO - Trial 118 pruned. 
2026-05-13 15:52:39,548 - optuna.study._optimize - INFO - Trial 119 pruned. 
2026-05-13 15:53:08,389 - optuna.study.study - INFO - Trial 120 finished with value: 0.09683046200819896 and parameters: {'n_layers': 1, 'embedding_dim': 128, 'lr': 0.00013963038231294694, 'lambda_val': 9.497936592549081e-05, 'batch_size': 3145, 'optimizer': 'Adam'}. Best is trial 25 with value: 0.10727808686719892.
2026-05-13 15:53:35,455 - optuna.study.study - INFO - Trial 121 finished with value: 0.08249653182564491 and parameters: {'n_layers': 1, 'embedding_dim': 128, 'lr': 0.00014478573330129428, 'lambda_val': 9.513850071387228e-05, 'batch_size': 3168, 'optimizer': 'Adam'}. Best is trial 25 with value: 0.10727808686719892.
2026-05-13 15:53:39,245 - optuna.study._optimize - INFO - Trial 122 pruned. 
2026-05-13 15:54:09,047 - optuna.study.study - INFO - Trial 123 finished with value: 0.10458919181969566 and parameters: {'n_layers': 1, 'embedding_dim': 128, 'lr': 0.00012089864147736318, 'lambda_val': 5.630734630930004e-05, 'batch_size': 3337, 'optimizer': 'Adam'}. Best is trial 25 with value: 0.10727808686719892.
2026-05-13 15:54:13,051 - optuna.study._optimize - INFO - Trial 124 pruned. 
2026-05-13 15:54:44,351 - optuna.study.study - INFO - Trial 125 finished with value: 0.06604428698439718 and parameters: {'n_layers': 1, 'embedding_dim': 128, 'lr': 0.00017226984340552607, 'lambda_val': 0.00013439002622162087, 'batch_size': 3871, 'optimizer': 'Adam'}. Best is trial 25 with value: 0.10727808686719892.
2026-05-13 15:54:49,518 - optuna.study._optimize - INFO - Trial 126 pruned. 
2026-05-13 15:54:54,089 - optuna.study._optimize - INFO - Trial 127 pruned. 
2026-05-13 15:55:25,433 - optuna.study.study - INFO - Trial 128 finished with value: 0.0789325291917163 and parameters: {'n_layers': 1, 'embedding_dim': 128, 'lr': 0.00013680165181845642, 'lambda_val': 0.0004191532040384478, 'batch_size': 3388, 'optimizer': 'Adam'}. Best is trial 25 with value: 0.10727808686719892.
2026-05-13 15:55:31,052 - optuna.study._optimize - INFO - Trial 129 pruned. 
2026-05-13 15:55:36,340 - optuna.study._optimize - INFO - Trial 130 pruned. 
2026-05-13 15:55:40,293 - optuna.study._optimize - INFO - Trial 131 pruned. 
2026-05-13 15:55:44,322 - optuna.study._optimize - INFO - Trial 132 pruned. 
2026-05-13 15:56:13,881 - optuna.study.study - INFO - Trial 133 finished with value: 0.09502606233748784 and parameters: {'n_layers': 1, 'embedding_dim': 128, 'lr': 0.00015551913080372987, 'lambda_val': 1.1589429506115256e-05, 'batch_size': 2184, 'optimizer': 'Adam'}. Best is trial 25 with value: 0.10727808686719892.
2026-05-13 15:56:43,244 - optuna.study.study - INFO - Trial 134 finished with value: 0.08819330628375 and parameters: {'n_layers': 1, 'embedding_dim': 128, 'lr': 0.0001637589290612947, 'lambda_val': 4.644700802676079e-06, 'batch_size': 2130, 'optimizer': 'Adam'}. Best is trial 25 with value: 0.10727808686719892.
2026-05-13 15:56:47,917 - optuna.study._optimize - INFO - Trial 135 pruned. 
2026-05-13 15:56:51,903 - optuna.study._optimize - INFO - Trial 136 pruned. 
2026-05-13 15:56:56,782 - optuna.study._optimize - INFO - Trial 137 pruned. 
2026-05-13 15:57:26,460 - optuna.study.study - INFO - Trial 138 finished with value: 0.05050415730926852 and parameters: {'n_layers': 1, 'embedding_dim': 128, 'lr': 0.0019387226807838413, 'lambda_val': 6.60884766329864e-05, 'batch_size': 2232, 'optimizer': 'Adam'}. Best is trial 25 with value: 0.10727808686719892.
2026-05-13 15:57:59,502 - optuna.study.study - INFO - Trial 139 finished with value: 0.05928705415801112 and parameters: {'n_layers': 1, 'embedding_dim': 128, 'lr': 0.0002833831445824149, 'lambda_val': 1.3707986086085502e-05, 'batch_size': 2953, 'optimizer': 'Adam'}. Best is trial 25 with value: 0.10727808686719892.
2026-05-13 15:58:04,523 - optuna.study._optimize - INFO - Trial 140 pruned. 
2026-05-13 15:58:08,498 - optuna.study._optimize - INFO - Trial 141 pruned. 
2026-05-13 15:58:12,836 - optuna.study._optimize - INFO - Trial 142 pruned. 
