2026-05-13 05:07:57,023 - optuna.study.study - INFO - Trial 126 finished with value: 0.021479496072109503 and parameters: {'n_layers': 4, 'embedding_dim': 256, 'lr': 0.01421476799277986, 'lambda_val': 5.829334119861962e-05, 'batch_size': 2648, 'optimizer': 'RMSprop'}. Best is trial 108 with value: 0.027753918148894535.
2026-05-13 05:08:01,395 - optuna.study._optimize - INFO - Trial 127 pruned. 
2026-05-13 05:08:44,593 - optuna.study.study - INFO - Trial 128 finished with value: 0.02154318911835154 and parameters: {'n_layers': 4, 'embedding_dim': 64, 'lr': 0.01899844202181334, 'lambda_val': 7.15893765413619e-05, 'batch_size': 3106, 'optimizer': 'RMSprop'}. Best is trial 108 with value: 0.027753918148894535.
2026-05-13 05:08:48,915 - optuna.study._optimize - INFO - Trial 129 pruned. 
2026-05-13 05:09:17,090 - optuna.study.study - INFO - Trial 130 finished with value: 0.023469026704418066 and parameters: {'n_layers': 4, 'embedding_dim': 64, 'lr': 0.010188076079278638, 'lambda_val': 0.00019509455738183262, 'batch_size': 2374, 'optimizer': 'RMSprop'}. Best is trial 108 with value: 0.027753918148894535.
2026-05-13 05:09:24,176 - optuna.study._optimize - INFO - Trial 131 pruned. 
2026-05-13 05:09:48,725 - optuna.study._optimize - INFO - Trial 132 pruned. 
2026-05-13 05:10:20,484 - optuna.study.study - INFO - Trial 133 finished with value: 0.020522180379140345 and parameters: {'n_layers': 4, 'embedding_dim': 32, 'lr': 0.015703603600928196, 'lambda_val': 3.3328633175892004e-05, 'batch_size': 3003, 'optimizer': 'RMSprop'}. Best is trial 108 with value: 0.027753918148894535.
2026-05-13 05:10:47,916 - optuna.study.study - INFO - Trial 134 finished with value: 0.023631571837410218 and parameters: {'n_layers': 4, 'embedding_dim': 64, 'lr': 0.011594601959655573, 'lambda_val': 4.835529348790042e-05, 'batch_size': 1832, 'optimizer': 'RMSprop'}. Best is trial 108 with value: 0.027753918148894535.
2026-05-13 05:11:18,926 - optuna.study.study - INFO - Trial 135 finished with value: 0.023359823720842735 and parameters: {'n_layers': 4, 'embedding_dim': 64, 'lr': 0.02872750243025708, 'lambda_val': 0.00010129824313819624, 'batch_size': 2851, 'optimizer': 'RMSprop'}. Best is trial 108 with value: 0.027753918148894535.
2026-05-13 05:11:49,756 - optuna.study.study - INFO - Trial 136 finished with value: 0.02465172606088788 and parameters: {'n_layers': 4, 'embedding_dim': 64, 'lr': 0.004810196874510423, 'lambda_val': 0.00013415620517762117, 'batch_size': 3086, 'optimizer': 'RMSprop'}. Best is trial 108 with value: 0.027753918148894535.
2026-05-13 05:11:53,799 - optuna.study._optimize - INFO - Trial 137 pruned. 
2026-05-13 05:11:57,896 - optuna.study._optimize - INFO - Trial 138 pruned. 
2026-05-13 05:12:02,060 - optuna.study._optimize - INFO - Trial 139 pruned. 
2026-05-13 05:12:06,528 - optuna.study._optimize - INFO - Trial 140 pruned. 
2026-05-13 05:12:09,851 - optuna.study._optimize - INFO - Trial 141 pruned. 
2026-05-13 05:12:28,238 - optuna.study._optimize - INFO - Trial 142 pruned. 
2026-05-13 05:12:31,948 - optuna.study._optimize - INFO - Trial 143 pruned. 
2026-05-13 05:12:58,759 - optuna.study.study - INFO - Trial 144 finished with value: 0.02380629420127085 and parameters: {'n_layers': 4, 'embedding_dim': 64, 'lr': 0.011793923855887442, 'lambda_val': 7.376525636589592e-05, 'batch_size': 3162, 'optimizer': 'RMSprop'}. Best is trial 108 with value: 0.027753918148894535.
2026-05-13 05:13:30,611 - optuna.study.study - INFO - Trial 145 finished with value: 0.019391137561409345 and parameters: {'n_layers': 4, 'embedding_dim': 64, 'lr': 0.015761922409399606, 'lambda_val': 3.818563065202314e-05, 'batch_size': 3080, 'optimizer': 'RMSprop'}. Best is trial 108 with value: 0.027753918148894535.
2026-05-13 05:14:00,493 - optuna.study.study - INFO - Trial 146 finished with value: 0.021634167049602908 and parameters: {'n_layers': 4, 'embedding_dim': 64, 'lr': 0.02523267261925085, 'lambda_val': 0.00015555646629113185, 'batch_size': 2919, 'optimizer': 'RMSprop'}. Best is trial 108 with value: 0.027753918148894535.
2026-05-13 05:14:05,514 - optuna.study._optimize - INFO - Trial 147 pruned. 
2026-05-13 05:14:09,554 - optuna.study._optimize - INFO - Trial 148 pruned. 
2026-05-13 05:14:16,795 - optuna.study._optimize - INFO - Trial 149 pruned. 
2026-05-13 05:14:21,409 - optuna.study._optimize - INFO - Trial 150 pruned. 
2026-05-13 05:14:25,408 - optuna.study._optimize - INFO - Trial 151 pruned. 
2026-05-13 05:14:55,454 - optuna.study.study - INFO - Trial 152 finished with value: 0.027191733246295032 and parameters: {'n_layers': 4, 'embedding_dim': 64, 'lr': 0.00513359971988436, 'lambda_val': 8.084898258452867e-05, 'batch_size': 2513, 'optimizer': 'RMSprop'}. Best is trial 108 with value: 0.027753918148894535.
2026-05-13 05:14:59,558 - optuna.study._optimize - INFO - Trial 153 pruned. 
2026-05-13 05:15:03,633 - optuna.study._optimize - INFO - Trial 154 pruned. 
2026-05-13 05:15:07,646 - optuna.study._optimize - INFO - Trial 155 pruned. 
2026-05-13 05:15:38,403 - optuna.study.study - INFO - Trial 156 finished with value: 0.025886576994156696 and parameters: {'n_layers': 4, 'embedding_dim': 64, 'lr': 0.017640811073969177, 'lambda_val': 0.0001335837579408744, 'batch_size': 2651, 'optimizer': 'RMSprop'}. Best is trial 108 with value: 0.027753918148894535.
2026-05-13 05:15:42,554 - optuna.study._optimize - INFO - Trial 157 pruned. 
2026-05-13 05:16:15,364 - optuna.study.study - INFO - Trial 158 finished with value: 0.02571380076162954 and parameters: {'n_layers': 4, 'embedding_dim': 64, 'lr': 0.006287040209077979, 'lambda_val': 0.00012724432353632467, 'batch_size': 2663, 'optimizer': 'RMSprop'}. Best is trial 108 with value: 0.027753918148894535.
2026-05-13 05:16:19,184 - optuna.study._optimize - INFO - Trial 159 pruned. 
2026-05-13 05:16:23,294 - optuna.study._optimize - INFO - Trial 160 pruned. 
2026-05-13 05:16:28,710 - optuna.study._optimize - INFO - Trial 161 pruned. 
2026-05-13 05:16:32,581 - optuna.study._optimize - INFO - Trial 162 pruned. 
2026-05-13 05:16:37,070 - optuna.study._optimize - INFO - Trial 163 pruned. 
2026-05-13 05:17:09,133 - optuna.study.study - INFO - Trial 164 finished with value: 0.02254216784556578 and parameters: {'n_layers': 4, 'embedding_dim': 64, 'lr': 0.010187515826224736, 'lambda_val': 7.200746440910301e-05, 'batch_size': 2758, 'optimizer': 'RMSprop'}. Best is trial 108 with value: 0.027753918148894535.
2026-05-13 05:17:13,207 - optuna.study._optimize - INFO - Trial 165 pruned. 
2026-05-13 05:17:17,260 - optuna.study._optimize - INFO - Trial 166 pruned. 
2026-05-13 05:17:21,556 - optuna.study._optimize - INFO - Trial 167 pruned. 
2026-05-13 05:17:40,347 - optuna.study._optimize - INFO - Trial 168 pruned. 
2026-05-13 05:17:44,542 - optuna.study._optimize - INFO - Trial 169 pruned. 
2026-05-13 05:18:29,789 - optuna.study.study - INFO - Trial 170 finished with value: 0.02312753794423512 and parameters: {'n_layers': 4, 'embedding_dim': 256, 'lr': 0.005088852060645911, 'lambda_val': 7.621538440955185e-05, 'batch_size': 3003, 'optimizer': 'RMSprop'}. Best is trial 108 with value: 0.027753918148894535.
2026-05-13 05:19:01,364 - optuna.study._optimize - INFO - Trial 171 pruned. 
2026-05-13 05:19:05,516 - optuna.study._optimize - INFO - Trial 172 pruned. 
2026-05-13 05:19:09,967 - optuna.study._optimize - INFO - Trial 173 pruned. 
2026-05-13 05:19:14,131 - optuna.study._optimize - INFO - Trial 174 pruned. 
2026-05-13 05:19:17,951 - optuna.study._optimize - INFO - Trial 175 pruned. 
2026-05-13 05:19:21,975 - optuna.study._optimize - INFO - Trial 176 pruned. 
2026-05-13 05:19:54,479 - optuna.study.study - INFO - Trial 177 finished with value: 0.020752020327997275 and parameters: {'n_layers': 4, 'embedding_dim': 128, 'lr': 0.007373764439829085, 'lambda_val': 8.167306439272949e-05, 'batch_size': 2800, 'optimizer': 'RMSprop'}. Best is trial 108 with value: 0.027753918148894535.
2026-05-13 05:19:58,322 - optuna.study._optimize - INFO - Trial 178 pruned. 
2026-05-13 05:20:02,143 - optuna.study._optimize - INFO - Trial 179 pruned. 
2026-05-13 05:20:06,100 - optuna.study._optimize - INFO - Trial 180 pruned. 
2026-05-13 05:20:11,197 - optuna.study._optimize - INFO - Trial 181 pruned. 
2026-05-13 05:20:15,218 - optuna.study._optimize - INFO - Trial 182 pruned. 
2026-05-13 05:20:19,262 - optuna.study._optimize - INFO - Trial 183 pruned. 
2026-05-13 05:20:23,835 - optuna.study._optimize - INFO - Trial 184 pruned. 
2026-05-13 05:20:27,884 - optuna.study._optimize - INFO - Trial 185 pruned. 
2026-05-13 05:21:03,923 - optuna.study.study - INFO - Trial 186 finished with value: 0.02441320390262136 and parameters: {'n_layers': 4, 'embedding_dim': 64, 'lr': 0.005814975829699559, 'lambda_val': 0.00013168178442861343, 'batch_size': 2905, 'optimizer': 'RMSprop'}. Best is trial 108 with value: 0.027753918148894535.
2026-05-13 05:21:08,053 - optuna.study._optimize - INFO - Trial 187 pruned. 
2026-05-13 05:21:12,409 - optuna.study._optimize - INFO - Trial 188 pruned. 
2026-05-13 05:21:17,394 - optuna.study._optimize - INFO - Trial 189 pruned. 
2026-05-13 05:21:49,070 - optuna.study.study - INFO - Trial 190 finished with value: 0.02288505692228884 and parameters: {'n_layers': 4, 'embedding_dim': 64, 'lr': 0.015689022944817242, 'lambda_val': 8.882837316641687e-05, 'batch_size': 2755, 'optimizer': 'RMSprop'}. Best is trial 108 with value: 0.027753918148894535.
2026-05-13 05:22:21,399 - optuna.study.study - INFO - Trial 191 finished with value: 0.023825494713760616 and parameters: {'n_layers': 4, 'embedding_dim': 64, 'lr': 0.007640873214762325, 'lambda_val': 0.00011645340924812189, 'batch_size': 2973, 'optimizer': 'RMSprop'}. Best is trial 108 with value: 0.027753918148894535.
2026-05-13 05:22:25,121 - optuna.study._optimize - INFO - Trial 192 pruned. 
2026-05-13 05:22:28,981 - optuna.study._optimize - INFO - Trial 193 pruned. 
2026-05-13 05:22:33,139 - optuna.study._optimize - INFO - Trial 194 pruned. 
2026-05-13 05:22:37,353 - optuna.study._optimize - INFO - Trial 195 pruned. 
2026-05-13 05:23:09,036 - optuna.study.study - INFO - Trial 196 finished with value: 0.022793643503667423 and parameters: {'n_layers': 4, 'embedding_dim': 128, 'lr': 0.013234329825048432, 'lambda_val': 5.308817013117772e-05, 'batch_size': 2925, 'optimizer': 'RMSprop'}. Best is trial 108 with value: 0.027753918148894535.
2026-05-13 05:23:12,763 - optuna.study._optimize - INFO - Trial 197 pruned. 
2026-05-13 05:23:16,502 - optuna.study._optimize - INFO - Trial 198 pruned. 
2026-05-13 05:23:48,167 - optuna.study.study - INFO - Trial 199 finished with value: 0.02864979927571029 and parameters: {'n_layers': 4, 'embedding_dim': 64, 'lr': 0.0070623224232624375, 'lambda_val': 6.590030786095158e-05, 'batch_size': 2819, 'optimizer': 'RMSprop'}. Best is trial 199 with value: 0.02864979927571029.
2026-05-13 05:24:05,419 - root - INFO -   ** Getting the trainable edges:
2026-05-13 05:24:05,423 - helper_functions - INFO -      Number of nodes: 547
2026-05-13 05:24:05,423 - helper_functions - INFO -      Ratio: 0.06036861273590111
2026-05-13 05:24:05,423 - helper_functions - INFO -      Number of unique users: 320
2026-05-13 05:24:05,423 - helper_functions - INFO -      Number of unique items: 227
2026-05-13 05:24:05,423 - helper_functions - INFO -      Total dominant set edge: 66391
2026-05-13 05:24:05,423 - helper_functions - INFO -      Trainable edges: 53112.8
2026-05-13 05:24:05,431 - root - INFO -   **** Getting 66391 dominant set edges
2026-05-13 05:24:06,868 - optuna.storages._rdb.storage - INFO - A new study created in RDB with name: Study_e_100K_1c1dcs
2026-05-13 05:24:50,876 - optuna.study.study - INFO - Trial 0 finished with value: 0.024016074870442727 and parameters: {'n_layers': 2, 'embedding_dim': 128, 'lr': 0.0029848374265500645, 'lambda_val': 1.834542013409196e-06, 'batch_size': 1023, 'optimizer': 'RMSprop'}. Best is trial 0 with value: 0.024016074870442727.
2026-05-13 05:26:00,239 - optuna.study.study - INFO - Trial 1 finished with value: 0.021129583091900585 and parameters: {'n_layers': 3, 'embedding_dim': 128, 'lr': 0.0006408987801241318, 'lambda_val': 1.6512460944069414e-06, 'batch_size': 2571, 'optimizer': 'Adam'}. Best is trial 0 with value: 0.024016074870442727.
2026-05-13 05:26:33,943 - optuna.study.study - INFO - Trial 2 finished with value: 0.05991282298083671 and parameters: {'n_layers': 1, 'embedding_dim': 128, 'lr': 0.001969368544283728, 'lambda_val': 0.005919150128642661, 'batch_size': 4035, 'optimizer': 'RMSprop'}. Best is trial 2 with value: 0.05991282298083671.
2026-05-13 05:27:05,357 - optuna.study.study - INFO - Trial 3 finished with value: 0.0020125627374689313 and parameters: {'n_layers': 2, 'embedding_dim': 32, 'lr': 1.5238793073699676e-05, 'lambda_val': 0.001703952060078878, 'batch_size': 2698, 'optimizer': 'SGD'}. Best is trial 2 with value: 0.05991282298083671.
2026-05-13 05:27:56,533 - optuna.study.study - INFO - Trial 4 finished with value: 0.012493735135883305 and parameters: {'n_layers': 3, 'embedding_dim': 256, 'lr': 1.135575429480046e-05, 'lambda_val': 0.003380753606169322, 'batch_size': 1051, 'optimizer': 'RMSprop'}. Best is trial 2 with value: 0.05991282298083671.
2026-05-13 05:28:01,426 - optuna.study._optimize - INFO - Trial 5 pruned. 
2026-05-13 05:28:07,448 - optuna.study._optimize - INFO - Trial 6 pruned. 
2026-05-13 05:28:12,408 - optuna.study._optimize - INFO - Trial 7 pruned. 
2026-05-13 05:28:16,772 - optuna.study._optimize - INFO - Trial 8 pruned. 
2026-05-13 05:28:22,109 - optuna.study._optimize - INFO - Trial 9 pruned. 
2026-05-13 05:28:52,067 - optuna.study.study - INFO - Trial 10 finished with value: 0.05324832010093472 and parameters: {'n_layers': 1, 'embedding_dim': 96, 'lr': 0.09007909319637378, 'lambda_val': 0.00021681711420606334, 'batch_size': 4016, 'optimizer': 'RMSprop'}. Best is trial 2 with value: 0.05991282298083671.
2026-05-13 05:29:23,112 - optuna.study.study - INFO - Trial 11 finished with value: 0.04781745230790316 and parameters: {'n_layers': 1, 'embedding_dim': 96, 'lr': 0.09773461034507241, 'lambda_val': 0.00016117843936018535, 'batch_size': 3986, 'optimizer': 'RMSprop'}. Best is trial 2 with value: 0.05991282298083671.
2026-05-13 05:30:04,391 - optuna.study.study - INFO - Trial 12 finished with value: 0.06312996718748592 and parameters: {'n_layers': 1, 'embedding_dim': 96, 'lr': 0.018573243969002978, 'lambda_val': 0.0003088223411635756, 'batch_size': 4093, 'optimizer': 'RMSprop'}. Best is trial 12 with value: 0.06312996718748592.
2026-05-13 05:30:34,107 - optuna.study.study - INFO - Trial 13 finished with value: 0.06540335821566495 and parameters: {'n_layers': 1, 'embedding_dim': 96, 'lr': 0.009236354904325571, 'lambda_val': 0.0009981254316188373, 'batch_size': 3408, 'optimizer': 'RMSprop'}. Best is trial 13 with value: 0.06540335821566495.
2026-05-13 05:30:58,867 - optuna.study._optimize - INFO - Trial 14 pruned. 
2026-05-13 05:31:39,956 - optuna.study.study - INFO - Trial 15 finished with value: 0.06508988115009512 and parameters: {'n_layers': 1, 'embedding_dim': 96, 'lr': 0.013690750574908943, 'lambda_val': 0.0009210179310480878, 'batch_size': 3413, 'optimizer': 'Adam'}. Best is trial 13 with value: 0.06540335821566495.
2026-05-13 05:31:44,926 - optuna.study._optimize - INFO - Trial 16 pruned. 
2026-05-13 05:32:15,210 - optuna.study.study - INFO - Trial 17 finished with value: 0.06513025598619009 and parameters: {'n_layers': 1, 'embedding_dim': 96, 'lr': 0.00010728846967891514, 'lambda_val': 0.0008492579965979054, 'batch_size': 3565, 'optimizer': 'Adam'}. Best is trial 13 with value: 0.06540335821566495.
2026-05-13 05:32:44,145 - optuna.study.study - INFO - Trial 18 finished with value: 0.07203362778094169 and parameters: {'n_layers': 1, 'embedding_dim': 96, 'lr': 0.00011057296431450817, 'lambda_val': 5.296457916011044e-05, 'batch_size': 3598, 'optimizer': 'Adam'}. Best is trial 18 with value: 0.07203362778094169.
2026-05-13 05:32:54,624 - optuna.study._optimize - INFO - Trial 19 pruned. 
2026-05-13 05:33:29,089 - optuna.study.study - INFO - Trial 20 finished with value: 0.08476221914255828 and parameters: {'n_layers': 1, 'embedding_dim': 256, 'lr': 0.00034156652559272176, 'lambda_val': 1.9660357944566855e-05, 'batch_size': 574, 'optimizer': 'Adam'}. Best is trial 20 with value: 0.08476221914255828.
2026-05-13 05:33:33,333 - optuna.study._optimize - INFO - Trial 21 pruned. 
2026-05-13 05:34:06,751 - optuna.study.study - INFO - Trial 22 finished with value: 0.08939254957612576 and parameters: {'n_layers': 1, 'embedding_dim': 256, 'lr': 0.00028763651957401995, 'lambda_val': 4.7769762631469744e-05, 'batch_size': 653, 'optimizer': 'Adam'}. Best is trial 22 with value: 0.08939254957612576.
2026-05-13 05:34:49,488 - optuna.study.study - INFO - Trial 23 finished with value: 0.04291227148138682 and parameters: {'n_layers': 2, 'embedding_dim': 256, 'lr': 0.00025920828485276613, 'lambda_val': 4.918894752659093e-05, 'batch_size': 521, 'optimizer': 'Adam'}. Best is trial 22 with value: 0.08939254957612576.
2026-05-13 05:35:23,629 - optuna.study.study - INFO - Trial 24 finished with value: 0.07750063795351014 and parameters: {'n_layers': 1, 'embedding_dim': 256, 'lr': 0.00038776780009229864, 'lambda_val': 1.1085952352717759e-05, 'batch_size': 537, 'optimizer': 'Adam'}. Best is trial 22 with value: 0.08939254957612576.
2026-05-13 05:35:56,637 - optuna.study.study - INFO - Trial 25 finished with value: 0.08587212039236354 and parameters: {'n_layers': 1, 'embedding_dim': 256, 'lr': 0.00038007507356644765, 'lambda_val': 8.902104333874677e-06, 'batch_size': 537, 'optimizer': 'Adam'}. Best is trial 22 with value: 0.08939254957612576.
2026-05-13 05:36:02,651 - optuna.study._optimize - INFO - Trial 26 pruned. 
2026-05-13 05:36:06,981 - optuna.study._optimize - INFO - Trial 27 pruned. 
2026-05-13 05:36:13,137 - optuna.study._optimize - INFO - Trial 28 pruned. 
2026-05-13 05:36:17,390 - optuna.study._optimize - INFO - Trial 29 pruned. 
2026-05-13 05:36:23,122 - optuna.study._optimize - INFO - Trial 30 pruned. 
2026-05-13 05:36:57,433 - optuna.study.study - INFO - Trial 31 finished with value: 0.08607226983447282 and parameters: {'n_layers': 1, 'embedding_dim': 256, 'lr': 0.00041638355083733656, 'lambda_val': 1.6043926826783258e-05, 'batch_size': 542, 'optimizer': 'Adam'}. Best is trial 22 with value: 0.08939254957612576.
2026-05-13 05:37:31,856 - optuna.study.study - INFO - Trial 32 finished with value: 0.07403292852776117 and parameters: {'n_layers': 1, 'embedding_dim': 256, 'lr': 0.0006267906505394406, 'lambda_val': 1.0262240517853736e-05, 'batch_size': 1018, 'optimizer': 'Adam'}. Best is trial 22 with value: 0.08939254957612576.
2026-05-13 05:37:35,721 - optuna.study._optimize - INFO - Trial 33 pruned. 
2026-05-13 05:38:10,580 - optuna.study.study - INFO - Trial 34 finished with value: 0.07032545460268544 and parameters: {'n_layers': 1, 'embedding_dim': 256, 'lr': 0.0005716581754179369, 'lambda_val': 8.094308889000187e-05, 'batch_size': 1392, 'optimizer': 'Adam'}. Best is trial 22 with value: 0.08939254957612576.
2026-05-13 05:38:38,525 - optuna.study.study - INFO - Trial 35 finished with value: 0.03441959174339257 and parameters: {'n_layers': 1, 'embedding_dim': 32, 'lr': 0.0017313222425696247, 'lambda_val': 2.715241062877976e-06, 'batch_size': 979, 'optimizer': 'Adam'}. Best is trial 22 with value: 0.08939254957612576.
2026-05-13 05:38:42,558 - optuna.study._optimize - INFO - Trial 36 pruned. 
2026-05-13 05:38:47,695 - optuna.study._optimize - INFO - Trial 37 pruned. 
2026-05-13 05:38:53,663 - optuna.study._optimize - INFO - Trial 38 pruned. 
2026-05-13 05:39:28,376 - optuna.study.study - INFO - Trial 39 finished with value: 0.059935978191183764 and parameters: {'n_layers': 1, 'embedding_dim': 256, 'lr': 0.0008605030063607229, 'lambda_val': 1.8870397992941274e-05, 'batch_size': 1963, 'optimizer': 'Adam'}. Best is trial 22 with value: 0.08939254957612576.
2026-05-13 05:39:31,925 - optuna.study._optimize - INFO - Trial 40 pruned. 
2026-05-13 05:40:06,854 - optuna.study.study - INFO - Trial 41 finished with value: 0.08483647901645315 and parameters: {'n_layers': 1, 'embedding_dim': 256, 'lr': 0.0003278891725698351, 'lambda_val': 7.562871144006037e-06, 'batch_size': 532, 'optimizer': 'Adam'}. Best is trial 22 with value: 0.08939254957612576.
2026-05-13 05:40:41,445 - optuna.study.study - INFO - Trial 42 finished with value: 0.07552247931126198 and parameters: {'n_layers': 1, 'embedding_dim': 256, 'lr': 0.0004233573498195855, 'lambda_val': 2.6588009343407494e-05, 'batch_size': 880, 'optimizer': 'Adam'}. Best is trial 22 with value: 0.08939254957612576.
2026-05-13 05:40:45,067 - optuna.study._optimize - INFO - Trial 43 pruned. 
2026-05-13 05:41:19,369 - optuna.study.study - INFO - Trial 44 finished with value: 0.10435506491845455 and parameters: {'n_layers': 1, 'embedding_dim': 256, 'lr': 0.00023884512203392114, 'lambda_val': 7.713092068294609e-06, 'batch_size': 888, 'optimizer': 'Adam'}. Best is trial 44 with value: 0.10435506491845455.
2026-05-13 05:41:27,346 - optuna.study._optimize - INFO - Trial 45 pruned. 
2026-05-13 05:41:37,873 - optuna.study._optimize - INFO - Trial 46 pruned. 
2026-05-13 05:41:44,239 - optuna.study._optimize - INFO - Trial 47 pruned. 
2026-05-13 05:42:16,618 - optuna.study.study - INFO - Trial 48 finished with value: 0.0647538395809503 and parameters: {'n_layers': 1, 'embedding_dim': 256, 'lr': 0.0009972744736628195, 'lambda_val': 1.3740981569601414e-05, 'batch_size': 1747, 'optimizer': 'Adam'}. Best is trial 44 with value: 0.10435506491845455.
2026-05-13 05:42:21,596 - optuna.study._optimize - INFO - Trial 49 pruned. 
2026-05-13 05:42:53,979 - optuna.study.study - INFO - Trial 50 finished with value: 0.07942439653869313 and parameters: {'n_layers': 1, 'embedding_dim': 256, 'lr': 0.0005251817026379351, 'lambda_val': 4.3488997520162975e-05, 'batch_size': 852, 'optimizer': 'RMSprop'}. Best is trial 44 with value: 0.10435506491845455.
