2026-05-13 17:10:20,537 - optuna.study._optimize - INFO - Trial 161 pruned. 
2026-05-13 17:10:51,990 - optuna.study.study - INFO - Trial 162 finished with value: 0.08855646451000909 and parameters: {'n_layers': 1, 'embedding_dim': 256, 'lr': 0.0004195524096406342, 'lambda_val': 2.066449912517052e-05, 'batch_size': 900, 'optimizer': 'Adam'}. Best is trial 45 with value: 0.10669462430196822.
2026-05-13 17:11:24,883 - optuna.study.study - INFO - Trial 163 finished with value: 0.06667592954153033 and parameters: {'n_layers': 1, 'embedding_dim': 256, 'lr': 0.00042151017224029684, 'lambda_val': 2.0977073514267782e-05, 'batch_size': 889, 'optimizer': 'Adam'}. Best is trial 45 with value: 0.10669462430196822.
2026-05-13 17:11:58,557 - optuna.study.study - INFO - Trial 164 finished with value: 0.07189316233602155 and parameters: {'n_layers': 1, 'embedding_dim': 256, 'lr': 0.0007077614887059568, 'lambda_val': 1.7396351926407498e-05, 'batch_size': 799, 'optimizer': 'Adam'}. Best is trial 45 with value: 0.10669462430196822.
2026-05-13 17:12:29,485 - optuna.study.study - INFO - Trial 165 finished with value: 0.07622002898964046 and parameters: {'n_layers': 1, 'embedding_dim': 256, 'lr': 0.0003676429578243047, 'lambda_val': 4.1058639535709e-05, 'batch_size': 662, 'optimizer': 'Adam'}. Best is trial 45 with value: 0.10669462430196822.
2026-05-13 17:13:02,221 - optuna.study.study - INFO - Trial 166 finished with value: 0.0716399642864069 and parameters: {'n_layers': 1, 'embedding_dim': 256, 'lr': 0.0005046038499419636, 'lambda_val': 8.022195997879106e-05, 'batch_size': 952, 'optimizer': 'Adam'}. Best is trial 45 with value: 0.10669462430196822.
2026-05-13 17:13:07,047 - optuna.study._optimize - INFO - Trial 167 pruned. 
2026-05-13 17:13:37,505 - optuna.study.study - INFO - Trial 168 finished with value: 0.08777426502680293 and parameters: {'n_layers': 1, 'embedding_dim': 256, 'lr': 0.00032573764371677714, 'lambda_val': 1.7896234344356985e-05, 'batch_size': 732, 'optimizer': 'Adam'}. Best is trial 45 with value: 0.10669462430196822.
2026-05-13 17:13:41,077 - optuna.study._optimize - INFO - Trial 169 pruned. 
2026-05-13 17:14:12,542 - optuna.study.study - INFO - Trial 170 finished with value: 0.08781786212360645 and parameters: {'n_layers': 1, 'embedding_dim': 256, 'lr': 0.000330982886916727, 'lambda_val': 5.871107201505867e-05, 'batch_size': 567, 'optimizer': 'Adam'}. Best is trial 45 with value: 0.10669462430196822.
2026-05-13 17:14:17,128 - optuna.study._optimize - INFO - Trial 171 pruned. 
2026-05-13 17:14:21,863 - optuna.study._optimize - INFO - Trial 172 pruned. 
2026-05-13 17:14:26,389 - optuna.study._optimize - INFO - Trial 173 pruned. 
2026-05-13 17:15:00,282 - optuna.study.study - INFO - Trial 174 finished with value: 0.07639607433890808 and parameters: {'n_layers': 1, 'embedding_dim': 256, 'lr': 0.0003741282762108152, 'lambda_val': 3.794480125659389e-05, 'batch_size': 733, 'optimizer': 'Adam'}. Best is trial 45 with value: 0.10669462430196822.
2026-05-13 17:15:06,984 - optuna.study._optimize - INFO - Trial 175 pruned. 
2026-05-13 17:15:40,124 - optuna.study.study - INFO - Trial 176 finished with value: 0.07168474054656165 and parameters: {'n_layers': 1, 'embedding_dim': 256, 'lr': 0.00041000039875732847, 'lambda_val': 2.7474124386882818e-05, 'batch_size': 847, 'optimizer': 'Adam'}. Best is trial 45 with value: 0.10669462430196822.
2026-05-13 17:15:45,302 - optuna.study._optimize - INFO - Trial 177 pruned. 
2026-05-13 17:16:13,007 - optuna.study.study - INFO - Trial 178 finished with value: 0.05384716386466471 and parameters: {'n_layers': 1, 'embedding_dim': 128, 'lr': 0.00033523220904352704, 'lambda_val': 0.00010372018616640554, 'batch_size': 2166, 'optimizer': 'Adam'}. Best is trial 45 with value: 0.10669462430196822.
2026-05-13 17:16:17,925 - optuna.study._optimize - INFO - Trial 179 pruned. 
2026-05-13 17:16:22,223 - optuna.study._optimize - INFO - Trial 180 pruned. 
2026-05-13 17:16:54,890 - optuna.study.study - INFO - Trial 181 finished with value: 0.07195619493496966 and parameters: {'n_layers': 1, 'embedding_dim': 256, 'lr': 0.0004713518827082554, 'lambda_val': 2.75366663716636e-05, 'batch_size': 829, 'optimizer': 'Adam'}. Best is trial 45 with value: 0.10669462430196822.
2026-05-13 17:16:59,905 - optuna.study._optimize - INFO - Trial 182 pruned. 
2026-05-13 17:17:36,404 - optuna.study.study - INFO - Trial 183 finished with value: 0.08443073281504761 and parameters: {'n_layers': 1, 'embedding_dim': 256, 'lr': 0.00041962500889794095, 'lambda_val': 1.428333706968509e-05, 'batch_size': 954, 'optimizer': 'Adam'}. Best is trial 45 with value: 0.10669462430196822.
2026-05-13 17:18:11,495 - optuna.study.study - INFO - Trial 184 finished with value: 0.07847916723161089 and parameters: {'n_layers': 1, 'embedding_dim': 256, 'lr': 0.00034854815222152175, 'lambda_val': 1.2568490675770676e-05, 'batch_size': 1125, 'optimizer': 'Adam'}. Best is trial 45 with value: 0.10669462430196822.
2026-05-13 17:18:53,403 - optuna.study.study - INFO - Trial 185 finished with value: 0.0737759426378385 and parameters: {'n_layers': 1, 'embedding_dim': 256, 'lr': 0.00043262614611296025, 'lambda_val': 1.7411654365091524e-05, 'batch_size': 952, 'optimizer': 'Adam'}. Best is trial 45 with value: 0.10669462430196822.
2026-05-13 17:18:57,496 - optuna.study._optimize - INFO - Trial 186 pruned. 
2026-05-13 17:19:29,358 - optuna.study.study - INFO - Trial 187 finished with value: 0.07120123157079303 and parameters: {'n_layers': 1, 'embedding_dim': 256, 'lr': 0.0005984239352438705, 'lambda_val': 5.741317077620721e-06, 'batch_size': 632, 'optimizer': 'Adam'}. Best is trial 45 with value: 0.10669462430196822.
2026-05-13 17:20:04,834 - optuna.study.study - INFO - Trial 188 finished with value: 0.0863888193399424 and parameters: {'n_layers': 1, 'embedding_dim': 256, 'lr': 0.00032118219568367086, 'lambda_val': 2.149055444441725e-05, 'batch_size': 1020, 'optimizer': 'Adam'}. Best is trial 45 with value: 0.10669462430196822.
2026-05-13 17:20:39,443 - optuna.study.study - INFO - Trial 189 finished with value: 0.07670616294182166 and parameters: {'n_layers': 1, 'embedding_dim': 256, 'lr': 0.00037596720970753156, 'lambda_val': 7.650138630934434e-05, 'batch_size': 1027, 'optimizer': 'Adam'}. Best is trial 45 with value: 0.10669462430196822.
2026-05-13 17:20:43,015 - optuna.study._optimize - INFO - Trial 190 pruned. 
2026-05-13 17:21:17,606 - optuna.study.study - INFO - Trial 191 finished with value: 0.0753368472159049 and parameters: {'n_layers': 1, 'embedding_dim': 256, 'lr': 0.0003165772517081976, 'lambda_val': 2.2236140544317017e-05, 'batch_size': 1101, 'optimizer': 'Adam'}. Best is trial 45 with value: 0.10669462430196822.
2026-05-13 17:21:22,080 - optuna.study._optimize - INFO - Trial 192 pruned. 
2026-05-13 17:21:57,645 - optuna.study.study - INFO - Trial 193 finished with value: 0.0812638321194893 and parameters: {'n_layers': 1, 'embedding_dim': 256, 'lr': 0.00030128225570335963, 'lambda_val': 2.8747157541343805e-05, 'batch_size': 899, 'optimizer': 'Adam'}. Best is trial 45 with value: 0.10669462430196822.
2026-05-13 17:22:30,787 - optuna.study.study - INFO - Trial 194 finished with value: 0.08340457934384629 and parameters: {'n_layers': 1, 'embedding_dim': 256, 'lr': 0.0004285736137053557, 'lambda_val': 1.0916282731152855e-05, 'batch_size': 1170, 'optimizer': 'Adam'}. Best is trial 45 with value: 0.10669462430196822.
2026-05-13 17:23:05,359 - optuna.study.study - INFO - Trial 195 finished with value: 0.08785350821863895 and parameters: {'n_layers': 1, 'embedding_dim': 256, 'lr': 0.0004301544643722375, 'lambda_val': 1.183810989474187e-05, 'batch_size': 1040, 'optimizer': 'Adam'}. Best is trial 45 with value: 0.10669462430196822.
2026-05-13 17:23:41,221 - optuna.study.study - INFO - Trial 196 finished with value: 0.07315792328270364 and parameters: {'n_layers': 1, 'embedding_dim': 256, 'lr': 0.00043957042158743843, 'lambda_val': 0.00025303509588450523, 'batch_size': 1034, 'optimizer': 'Adam'}. Best is trial 45 with value: 0.10669462430196822.
2026-05-13 17:24:15,943 - optuna.study.study - INFO - Trial 197 finished with value: 0.07658229477742343 and parameters: {'n_layers': 1, 'embedding_dim': 256, 'lr': 0.0005172781787203297, 'lambda_val': 6.135174224730704e-05, 'batch_size': 945, 'optimizer': 'Adam'}. Best is trial 45 with value: 0.10669462430196822.
2026-05-13 17:24:50,749 - optuna.study.study - INFO - Trial 198 finished with value: 0.07591705889394615 and parameters: {'n_layers': 1, 'embedding_dim': 256, 'lr': 0.0006592983405132257, 'lambda_val': 1.3975100875765937e-05, 'batch_size': 698, 'optimizer': 'Adam'}. Best is trial 45 with value: 0.10669462430196822.
2026-05-13 17:24:54,644 - optuna.study._optimize - INFO - Trial 199 pruned. 
2026-05-13 17:25:16,355 - root - INFO -   **** Training e_100K_1c2dcs_rand4
2026-05-13 17:25:16,366 - root - INFO -   **** Getting 54402/65410 random edges
2026-05-13 17:25:17,264 - optuna.storages._rdb.storage - INFO - A new study created in RDB with name: Study_e_100K_1c2dcs_rand4
2026-05-13 17:26:13,943 - optuna.study.study - INFO - Trial 0 finished with value: 0.016552140253080227 and parameters: {'n_layers': 3, 'embedding_dim': 256, 'lr': 0.04102668790239933, 'lambda_val': 0.028695185007699475, 'batch_size': 3654, 'optimizer': 'Adam'}. Best is trial 0 with value: 0.016552140253080227.
2026-05-13 17:26:50,494 - optuna.study.study - INFO - Trial 1 finished with value: 0.012362993309683058 and parameters: {'n_layers': 2, 'embedding_dim': 96, 'lr': 2.0923088962550342e-05, 'lambda_val': 2.3824357967116547e-06, 'batch_size': 590, 'optimizer': 'RMSprop'}. Best is trial 0 with value: 0.016552140253080227.
2026-05-13 17:27:41,097 - optuna.study.study - INFO - Trial 2 finished with value: 0.03790312746629456 and parameters: {'n_layers': 3, 'embedding_dim': 96, 'lr': 0.04263507392327775, 'lambda_val': 0.0001727865426275741, 'batch_size': 3029, 'optimizer': 'RMSprop'}. Best is trial 2 with value: 0.03790312746629456.
2026-05-13 17:28:30,362 - optuna.study.study - INFO - Trial 3 finished with value: 0.013238012536692044 and parameters: {'n_layers': 3, 'embedding_dim': 96, 'lr': 0.0008799610265350817, 'lambda_val': 4.0814043741621334e-05, 'batch_size': 1425, 'optimizer': 'RMSprop'}. Best is trial 2 with value: 0.03790312746629456.
2026-05-13 17:28:58,210 - optuna.study.study - INFO - Trial 4 finished with value: 0.001999944140643824 and parameters: {'n_layers': 1, 'embedding_dim': 64, 'lr': 7.744226612087848e-05, 'lambda_val': 0.0015974236060379138, 'batch_size': 1426, 'optimizer': 'SGD'}. Best is trial 2 with value: 0.03790312746629456.
2026-05-13 17:29:34,597 - optuna.study.study - INFO - Trial 5 finished with value: 0.06567081627820555 and parameters: {'n_layers': 1, 'embedding_dim': 256, 'lr': 0.0002943983752282499, 'lambda_val': 2.7272297354405574e-06, 'batch_size': 2979, 'optimizer': 'Adam'}. Best is trial 5 with value: 0.06567081627820555.
2026-05-13 17:29:38,556 - optuna.study._optimize - INFO - Trial 6 pruned. 
2026-05-13 17:29:42,350 - optuna.study._optimize - INFO - Trial 7 pruned. 
2026-05-13 17:29:47,311 - optuna.study._optimize - INFO - Trial 8 pruned. 
2026-05-13 17:30:26,193 - optuna.study.study - INFO - Trial 9 finished with value: 0.008717136325748389 and parameters: {'n_layers': 4, 'embedding_dim': 64, 'lr': 0.00023160341466319775, 'lambda_val': 1.6307787872472836e-06, 'batch_size': 2875, 'optimizer': 'Adam'}. Best is trial 5 with value: 0.06567081627820555.
2026-05-13 17:30:57,222 - optuna.study.study - INFO - Trial 10 finished with value: 0.05224036265405993 and parameters: {'n_layers': 1, 'embedding_dim': 128, 'lr': 0.0064675331245494, 'lambda_val': 2.4461033663663466e-05, 'batch_size': 2340, 'optimizer': 'Adam'}. Best is trial 5 with value: 0.06567081627820555.
2026-05-13 17:31:28,759 - optuna.study.study - INFO - Trial 11 finished with value: 0.05080593790771745 and parameters: {'n_layers': 1, 'embedding_dim': 128, 'lr': 0.004448983845090095, 'lambda_val': 2.2845826493134672e-05, 'batch_size': 2306, 'optimizer': 'Adam'}. Best is trial 5 with value: 0.06567081627820555.
2026-05-13 17:32:00,789 - optuna.study.study - INFO - Trial 12 finished with value: 0.059386529484523456 and parameters: {'n_layers': 1, 'embedding_dim': 128, 'lr': 0.006877702533122986, 'lambda_val': 0.00017189315046158221, 'batch_size': 2407, 'optimizer': 'Adam'}. Best is trial 5 with value: 0.06567081627820555.
2026-05-13 17:32:36,427 - optuna.study.study - INFO - Trial 13 finished with value: 0.06508545896989004 and parameters: {'n_layers': 1, 'embedding_dim': 256, 'lr': 0.0005122074917128241, 'lambda_val': 0.0005072124168908281, 'batch_size': 2969, 'optimizer': 'Adam'}. Best is trial 5 with value: 0.06567081627820555.
2026-05-13 17:33:29,885 - optuna.study.study - INFO - Trial 14 finished with value: 0.03564510351158068 and parameters: {'n_layers': 2, 'embedding_dim': 256, 'lr': 0.0003632279559483331, 'lambda_val': 0.0014306215049585392, 'batch_size': 3177, 'optimizer': 'Adam'}. Best is trial 5 with value: 0.06567081627820555.
2026-05-13 17:33:37,077 - optuna.study._optimize - INFO - Trial 15 pruned. 
2026-05-13 17:34:10,852 - optuna.study.study - INFO - Trial 16 finished with value: 0.0730485529789031 and parameters: {'n_layers': 1, 'embedding_dim': 256, 'lr': 0.0011854988960735171, 'lambda_val': 0.0004922684544353064, 'batch_size': 1863, 'optimizer': 'Adam'}. Best is trial 16 with value: 0.0730485529789031.
2026-05-13 17:34:16,074 - optuna.study._optimize - INFO - Trial 17 pruned. 
2026-05-13 17:34:19,796 - optuna.study._optimize - INFO - Trial 18 pruned. 
2026-05-13 17:34:25,099 - optuna.study._optimize - INFO - Trial 19 pruned. 
2026-05-13 17:34:29,913 - optuna.study._optimize - INFO - Trial 20 pruned. 
2026-05-13 17:35:06,546 - optuna.study.study - INFO - Trial 21 finished with value: 0.06236800314215768 and parameters: {'n_layers': 1, 'embedding_dim': 256, 'lr': 0.0003697459820776235, 'lambda_val': 0.0005940743512524959, 'batch_size': 3363, 'optimizer': 'Adam'}. Best is trial 16 with value: 0.0730485529789031.
2026-05-13 17:35:42,769 - optuna.study.study - INFO - Trial 22 finished with value: 0.06520858214457337 and parameters: {'n_layers': 1, 'embedding_dim': 256, 'lr': 0.0011970002612809148, 'lambda_val': 6.190968202414271e-05, 'batch_size': 2679, 'optimizer': 'Adam'}. Best is trial 16 with value: 0.0730485529789031.
2026-05-13 17:36:17,183 - optuna.study.study - INFO - Trial 23 finished with value: 0.06381398720625323 and parameters: {'n_layers': 1, 'embedding_dim': 256, 'lr': 0.0013819008170446445, 'lambda_val': 7.4603022789653325e-06, 'batch_size': 1909, 'optimizer': 'Adam'}. Best is trial 16 with value: 0.0730485529789031.
2026-05-13 17:36:22,526 - optuna.study._optimize - INFO - Trial 24 pruned. 
2026-05-13 17:36:55,774 - optuna.study.study - INFO - Trial 25 finished with value: 0.07958711270107847 and parameters: {'n_layers': 1, 'embedding_dim': 256, 'lr': 0.00018641091818215506, 'lambda_val': 2.915973124200776e-06, 'batch_size': 2021, 'optimizer': 'Adam'}. Best is trial 25 with value: 0.07958711270107847.
2026-05-13 17:37:25,470 - optuna.study.study - INFO - Trial 26 finished with value: 0.0429922052818017 and parameters: {'n_layers': 2, 'embedding_dim': 32, 'lr': 0.00018675814820633198, 'lambda_val': 4.053659046912494e-06, 'batch_size': 2017, 'optimizer': 'Adam'}. Best is trial 25 with value: 0.07958711270107847.
2026-05-13 17:37:30,086 - optuna.study._optimize - INFO - Trial 27 pruned. 
2026-05-13 17:37:35,588 - optuna.study._optimize - INFO - Trial 28 pruned. 
2026-05-13 17:37:41,189 - optuna.study._optimize - INFO - Trial 29 pruned. 
2026-05-13 17:37:45,708 - optuna.study._optimize - INFO - Trial 30 pruned. 
2026-05-13 17:38:20,511 - optuna.study.study - INFO - Trial 31 finished with value: 0.0610844091209731 and parameters: {'n_layers': 1, 'embedding_dim': 256, 'lr': 0.0024015570783772963, 'lambda_val': 5.854361223095721e-05, 'batch_size': 2713, 'optimizer': 'Adam'}. Best is trial 25 with value: 0.07958711270107847.
2026-05-13 17:38:56,719 - optuna.study.study - INFO - Trial 32 finished with value: 0.06425482319452655 and parameters: {'n_layers': 1, 'embedding_dim': 256, 'lr': 0.0008076861941223053, 'lambda_val': 1.0961036574001907e-06, 'batch_size': 2465, 'optimizer': 'Adam'}. Best is trial 25 with value: 0.07958711270107847.
2026-05-13 17:39:01,113 - optuna.study._optimize - INFO - Trial 33 pruned. 
2026-05-13 17:39:29,316 - optuna.study.study - INFO - Trial 34 finished with value: 0.06592271311281592 and parameters: {'n_layers': 1, 'embedding_dim': 96, 'lr': 0.0002646471329663662, 'lambda_val': 0.0002959423695656532, 'batch_size': 1706, 'optimizer': 'RMSprop'}. Best is trial 25 with value: 0.07958711270107847.
2026-05-13 17:40:01,234 - optuna.study.study - INFO - Trial 35 finished with value: 0.025312139682319313 and parameters: {'n_layers': 2, 'embedding_dim': 96, 'lr': 0.00024077138728246684, 'lambda_val': 0.0002632486168114417, 'batch_size': 1789, 'optimizer': 'RMSprop'}. Best is trial 25 with value: 0.07958711270107847.
2026-05-13 17:40:05,619 - optuna.study._optimize - INFO - Trial 36 pruned. 
2026-05-13 17:40:09,960 - optuna.study._optimize - INFO - Trial 37 pruned. 
2026-05-13 17:40:14,599 - optuna.study._optimize - INFO - Trial 38 pruned. 
2026-05-13 17:40:18,443 - optuna.study._optimize - INFO - Trial 39 pruned. 
2026-05-13 17:40:22,917 - optuna.study._optimize - INFO - Trial 40 pruned. 
2026-05-13 17:40:53,200 - optuna.study.study - INFO - Trial 41 finished with value: 0.04987262486645051 and parameters: {'n_layers': 1, 'embedding_dim': 64, 'lr': 0.0011072718161500312, 'lambda_val': 0.0009417412194623104, 'batch_size': 2824, 'optimizer': 'Adam'}. Best is trial 25 with value: 0.07958711270107847.
2026-05-13 17:41:22,570 - optuna.study.study - INFO - Trial 42 finished with value: 0.05299322677955925 and parameters: {'n_layers': 1, 'embedding_dim': 32, 'lr': 0.0003247271081795351, 'lambda_val': 0.00024054483972129717, 'batch_size': 3207, 'optimizer': 'RMSprop'}. Best is trial 25 with value: 0.07958711270107847.
2026-05-13 17:41:26,445 - optuna.study._optimize - INFO - Trial 43 pruned. 
2026-05-13 17:42:05,010 - optuna.study.study - INFO - Trial 44 finished with value: 0.05293742913557857 and parameters: {'n_layers': 1, 'embedding_dim': 96, 'lr': 0.0006670763215075122, 'lambda_val': 9.377146457923026e-05, 'batch_size': 2565, 'optimizer': 'Adam'}. Best is trial 25 with value: 0.07958711270107847.
2026-05-13 17:42:41,982 - optuna.study.study - INFO - Trial 45 finished with value: 0.06611229469663857 and parameters: {'n_layers': 1, 'embedding_dim': 256, 'lr': 0.0015717372958148216, 'lambda_val': 0.00015206333820854304, 'batch_size': 2225, 'optimizer': 'Adam'}. Best is trial 25 with value: 0.07958711270107847.
2026-05-13 17:42:45,766 - optuna.study._optimize - INFO - Trial 46 pruned. 
2026-05-13 17:43:21,038 - optuna.study.study - INFO - Trial 47 finished with value: 0.08894463563139286 and parameters: {'n_layers': 1, 'embedding_dim': 256, 'lr': 0.00016962250239492535, 'lambda_val': 0.00044531473552144257, 'batch_size': 2221, 'optimizer': 'Adam'}. Best is trial 47 with value: 0.08894463563139286.
2026-05-13 17:43:25,432 - optuna.study._optimize - INFO - Trial 48 pruned. 
2026-05-13 17:43:30,281 - optuna.study._optimize - INFO - Trial 49 pruned. 
2026-05-13 17:43:34,943 - optuna.study._optimize - INFO - Trial 50 pruned. 
2026-05-13 17:44:08,699 - optuna.study.study - INFO - Trial 51 finished with value: 0.07025643314650687 and parameters: {'n_layers': 1, 'embedding_dim': 256, 'lr': 0.0014755358751685262, 'lambda_val': 0.0002978061430001786, 'batch_size': 2414, 'optimizer': 'Adam'}. Best is trial 47 with value: 0.08894463563139286.
2026-05-13 17:44:13,315 - optuna.study._optimize - INFO - Trial 52 pruned. 
2026-05-13 17:44:17,821 - optuna.study._optimize - INFO - Trial 53 pruned. 
2026-05-13 17:44:51,450 - optuna.study.study - INFO - Trial 54 finished with value: 0.05964010745560898 and parameters: {'n_layers': 1, 'embedding_dim': 256, 'lr': 0.00044244858974553216, 'lambda_val': 0.0008416694113904677, 'batch_size': 1874, 'optimizer': 'Adam'}. Best is trial 47 with value: 0.08894463563139286.
2026-05-13 17:45:16,295 - optuna.study.study - INFO - Trial 55 finished with value: 0.042081176389977486 and parameters: {'n_layers': 1, 'embedding_dim': 32, 'lr': 0.001594385524907852, 'lambda_val': 0.00042508500050443256, 'batch_size': 2242, 'optimizer': 'Adam'}. Best is trial 47 with value: 0.08894463563139286.
2026-05-13 17:45:21,519 - optuna.study._optimize - INFO - Trial 56 pruned. 
2026-05-13 17:45:51,604 - optuna.study.study - INFO - Trial 57 finished with value: 0.05929576591412397 and parameters: {'n_layers': 1, 'embedding_dim': 96, 'lr': 0.00026624857985748377, 'lambda_val': 0.002306653796644809, 'batch_size': 2491, 'optimizer': 'Adam'}. Best is trial 47 with value: 0.08894463563139286.
2026-05-13 17:45:55,789 - optuna.study._optimize - INFO - Trial 58 pruned. 
2026-05-13 17:46:00,351 - optuna.study._optimize - INFO - Trial 59 pruned. 
2026-05-13 17:46:35,539 - optuna.study.study - INFO - Trial 60 finished with value: 0.07233581751627619 and parameters: {'n_layers': 1, 'embedding_dim': 256, 'lr': 0.00061285895129249, 'lambda_val': 2.8471582337143868e-05, 'batch_size': 2155, 'optimizer': 'Adam'}. Best is trial 47 with value: 0.08894463563139286.
2026-05-13 17:47:10,607 - optuna.study.study - INFO - Trial 61 finished with value: 0.09096866091322076 and parameters: {'n_layers': 1, 'embedding_dim': 256, 'lr': 0.0001445876380028783, 'lambda_val': 0.00041732600564120694, 'batch_size': 2125, 'optimizer': 'Adam'}. Best is trial 61 with value: 0.09096866091322076.
2026-05-13 17:47:46,007 - optuna.study.study - INFO - Trial 62 finished with value: 0.0865077975776654 and parameters: {'n_layers': 1, 'embedding_dim': 256, 'lr': 0.00014109067939432025, 'lambda_val': 3.1129557684779256e-05, 'batch_size': 2128, 'optimizer': 'Adam'}. Best is trial 61 with value: 0.09096866091322076.
