2026-05-13 09:53:57,311 - optuna.study.study - INFO - Trial 54 finished with value: 0.08228527947644068 and parameters: {'n_layers': 1, 'embedding_dim': 128, 'lr': 0.014698458166911453, 'lambda_val': 0.0013841007079143908, 'batch_size': 2897, 'optimizer': 'RMSprop'}. Best is trial 20 with value: 0.08342088780344908.
2026-05-13 09:54:02,945 - optuna.study._optimize - INFO - Trial 55 pruned. 
2026-05-13 09:54:07,899 - optuna.study._optimize - INFO - Trial 56 pruned. 
2026-05-13 09:54:12,621 - optuna.study._optimize - INFO - Trial 57 pruned. 
2026-05-13 09:54:18,319 - optuna.study._optimize - INFO - Trial 58 pruned. 
2026-05-13 09:54:22,139 - optuna.study._optimize - INFO - Trial 59 pruned. 
2026-05-13 09:54:26,932 - optuna.study._optimize - INFO - Trial 60 pruned. 
2026-05-13 09:54:31,415 - optuna.study._optimize - INFO - Trial 61 pruned. 
2026-05-13 09:55:07,154 - optuna.study.study - INFO - Trial 62 finished with value: 0.07755855270580733 and parameters: {'n_layers': 1, 'embedding_dim': 256, 'lr': 0.0026812442774646387, 'lambda_val': 0.001164541034584929, 'batch_size': 2855, 'optimizer': 'RMSprop'}. Best is trial 20 with value: 0.08342088780344908.
2026-05-13 09:55:43,517 - optuna.study.study - INFO - Trial 63 finished with value: 0.06714269440784759 and parameters: {'n_layers': 1, 'embedding_dim': 256, 'lr': 0.00457172003877056, 'lambda_val': 0.005957088307338706, 'batch_size': 3060, 'optimizer': 'RMSprop'}. Best is trial 20 with value: 0.08342088780344908.
2026-05-13 09:56:19,334 - optuna.study.study - INFO - Trial 64 finished with value: 0.07367984216558789 and parameters: {'n_layers': 1, 'embedding_dim': 256, 'lr': 0.007744002222891083, 'lambda_val': 0.003397681680942797, 'batch_size': 3188, 'optimizer': 'RMSprop'}. Best is trial 20 with value: 0.08342088780344908.
2026-05-13 09:56:55,188 - optuna.study.study - INFO - Trial 65 finished with value: 0.08223969460014802 and parameters: {'n_layers': 1, 'embedding_dim': 256, 'lr': 0.0032968834665475645, 'lambda_val': 0.0017351401693545872, 'batch_size': 2788, 'optimizer': 'RMSprop'}. Best is trial 20 with value: 0.08342088780344908.
2026-05-13 09:57:02,992 - optuna.study._optimize - INFO - Trial 66 pruned. 
2026-05-13 09:57:06,746 - optuna.study._optimize - INFO - Trial 67 pruned. 
2026-05-13 09:57:43,247 - optuna.study.study - INFO - Trial 68 finished with value: 0.07100215995819714 and parameters: {'n_layers': 1, 'embedding_dim': 256, 'lr': 0.0014263337291286237, 'lambda_val': 0.0008262082536233735, 'batch_size': 2610, 'optimizer': 'Adam'}. Best is trial 20 with value: 0.08342088780344908.
2026-05-13 09:58:14,741 - optuna.study.study - INFO - Trial 69 finished with value: 0.031138979999861496 and parameters: {'n_layers': 1, 'embedding_dim': 32, 'lr': 0.0006910854892929504, 'lambda_val': 0.0024532053982138993, 'batch_size': 2402, 'optimizer': 'RMSprop'}. Best is trial 20 with value: 0.08342088780344908.
2026-05-13 09:58:19,539 - optuna.study._optimize - INFO - Trial 70 pruned. 
2026-05-13 09:58:55,055 - optuna.study.study - INFO - Trial 71 finished with value: 0.07200219832568043 and parameters: {'n_layers': 1, 'embedding_dim': 256, 'lr': 0.00547112282703038, 'lambda_val': 0.004208612411526632, 'batch_size': 2918, 'optimizer': 'RMSprop'}. Best is trial 20 with value: 0.08342088780344908.
2026-05-13 09:58:59,579 - optuna.study._optimize - INFO - Trial 72 pruned. 
2026-05-13 09:59:35,056 - optuna.study.study - INFO - Trial 73 finished with value: 0.0786633528949317 and parameters: {'n_layers': 1, 'embedding_dim': 256, 'lr': 0.0033525514330835747, 'lambda_val': 0.0015952553507976239, 'batch_size': 2833, 'optimizer': 'RMSprop'}. Best is trial 20 with value: 0.08342088780344908.
2026-05-13 10:00:10,022 - optuna.study.study - INFO - Trial 74 finished with value: 0.07715006743349086 and parameters: {'n_layers': 1, 'embedding_dim': 256, 'lr': 0.0017753657099140053, 'lambda_val': 0.0017330986199952732, 'batch_size': 2838, 'optimizer': 'RMSprop'}. Best is trial 20 with value: 0.08342088780344908.
2026-05-13 10:00:46,205 - optuna.study.study - INFO - Trial 75 finished with value: 0.07468322937717722 and parameters: {'n_layers': 1, 'embedding_dim': 256, 'lr': 0.0030720087769655806, 'lambda_val': 0.0026775749175800426, 'batch_size': 3213, 'optimizer': 'Adam'}. Best is trial 20 with value: 0.08342088780344908.
2026-05-13 10:00:51,274 - optuna.study._optimize - INFO - Trial 76 pruned. 
2026-05-13 10:01:26,439 - optuna.study.study - INFO - Trial 77 finished with value: 0.07945253640431646 and parameters: {'n_layers': 1, 'embedding_dim': 256, 'lr': 0.003985276119832008, 'lambda_val': 0.0008634607509036306, 'batch_size': 2235, 'optimizer': 'RMSprop'}. Best is trial 20 with value: 0.08342088780344908.
2026-05-13 10:01:31,089 - optuna.study._optimize - INFO - Trial 78 pruned. 
2026-05-13 10:01:35,148 - optuna.study._optimize - INFO - Trial 79 pruned. 
2026-05-13 10:01:42,285 - optuna.study._optimize - INFO - Trial 80 pruned. 
2026-05-13 10:02:17,076 - optuna.study.study - INFO - Trial 81 finished with value: 0.08225309986520588 and parameters: {'n_layers': 1, 'embedding_dim': 256, 'lr': 0.0032172277478127497, 'lambda_val': 0.0011110845145489699, 'batch_size': 2551, 'optimizer': 'RMSprop'}. Best is trial 20 with value: 0.08342088780344908.
2026-05-13 10:02:40,457 - optuna.study._optimize - INFO - Trial 82 pruned. 
2026-05-13 10:03:15,977 - optuna.study.study - INFO - Trial 83 finished with value: 0.08517052528092794 and parameters: {'n_layers': 1, 'embedding_dim': 256, 'lr': 0.004087974369384647, 'lambda_val': 0.0011329603770054515, 'batch_size': 2701, 'optimizer': 'RMSprop'}. Best is trial 83 with value: 0.08517052528092794.
2026-05-13 10:03:21,217 - optuna.study._optimize - INFO - Trial 84 pruned. 
2026-05-13 10:03:29,666 - optuna.study._optimize - INFO - Trial 85 pruned. 
2026-05-13 10:03:58,957 - optuna.study.study - INFO - Trial 86 finished with value: 0.05093148486465142 and parameters: {'n_layers': 1, 'embedding_dim': 128, 'lr': 0.0011519596854660354, 'lambda_val': 0.00028317204300485396, 'batch_size': 1762, 'optimizer': 'Adam'}. Best is trial 83 with value: 0.08517052528092794.
2026-05-13 10:04:33,737 - optuna.study.study - INFO - Trial 87 finished with value: 0.07992252401036008 and parameters: {'n_layers': 1, 'embedding_dim': 256, 'lr': 0.002929900935741367, 'lambda_val': 0.0011623879196159296, 'batch_size': 2685, 'optimizer': 'RMSprop'}. Best is trial 83 with value: 0.08517052528092794.
2026-05-13 10:04:45,926 - optuna.study._optimize - INFO - Trial 88 pruned. 
2026-05-13 10:05:23,216 - optuna.study.study - INFO - Trial 89 finished with value: 0.06520021900495007 and parameters: {'n_layers': 1, 'embedding_dim': 256, 'lr': 0.0015302352154516119, 'lambda_val': 0.0011899411895183458, 'batch_size': 2765, 'optimizer': 'Adam'}. Best is trial 83 with value: 0.08517052528092794.
2026-05-13 10:05:27,559 - optuna.study._optimize - INFO - Trial 90 pruned. 
2026-05-13 10:06:02,626 - optuna.study.study - INFO - Trial 91 finished with value: 0.08302002267873032 and parameters: {'n_layers': 1, 'embedding_dim': 256, 'lr': 0.0041885312486213, 'lambda_val': 0.000762266895582135, 'batch_size': 2548, 'optimizer': 'RMSprop'}. Best is trial 83 with value: 0.08517052528092794.
2026-05-13 10:06:37,706 - optuna.study.study - INFO - Trial 92 finished with value: 0.08420440863518382 and parameters: {'n_layers': 1, 'embedding_dim': 256, 'lr': 0.002767216448551694, 'lambda_val': 0.0012297739650053718, 'batch_size': 2558, 'optimizer': 'RMSprop'}. Best is trial 83 with value: 0.08517052528092794.
2026-05-13 10:07:15,143 - optuna.study.study - INFO - Trial 93 finished with value: 0.08158630886085841 and parameters: {'n_layers': 1, 'embedding_dim': 256, 'lr': 0.002676138706567392, 'lambda_val': 0.0021135173560238515, 'batch_size': 2400, 'optimizer': 'RMSprop'}. Best is trial 83 with value: 0.08517052528092794.
2026-05-13 10:07:20,312 - optuna.study._optimize - INFO - Trial 94 pruned. 
2026-05-13 10:07:56,776 - optuna.study.study - INFO - Trial 95 finished with value: 0.07038927149200826 and parameters: {'n_layers': 1, 'embedding_dim': 256, 'lr': 0.004621209833487877, 'lambda_val': 0.0037237078393255493, 'batch_size': 2583, 'optimizer': 'RMSprop'}. Best is trial 83 with value: 0.08517052528092794.
2026-05-13 10:08:35,195 - optuna.study.study - INFO - Trial 96 finished with value: 0.06930259661227557 and parameters: {'n_layers': 1, 'embedding_dim': 256, 'lr': 0.0013362022371891942, 'lambda_val': 0.0006341984372439253, 'batch_size': 2484, 'optimizer': 'RMSprop'}. Best is trial 83 with value: 0.08517052528092794.
2026-05-13 10:09:10,117 - optuna.study.study - INFO - Trial 97 finished with value: 0.07973838518151742 and parameters: {'n_layers': 1, 'embedding_dim': 256, 'lr': 0.006993110081987923, 'lambda_val': 0.0030032543347166384, 'batch_size': 2433, 'optimizer': 'RMSprop'}. Best is trial 83 with value: 0.08517052528092794.
2026-05-13 10:09:45,645 - optuna.study.study - INFO - Trial 98 finished with value: 0.07691488661727101 and parameters: {'n_layers': 1, 'embedding_dim': 256, 'lr': 0.003855466591063465, 'lambda_val': 0.0021724437831458906, 'batch_size': 2799, 'optimizer': 'Adam'}. Best is trial 83 with value: 0.08517052528092794.
2026-05-13 10:09:49,389 - optuna.study._optimize - INFO - Trial 99 pruned. 
2026-05-13 10:09:53,338 - optuna.study._optimize - INFO - Trial 100 pruned. 
2026-05-13 10:10:28,296 - optuna.study.study - INFO - Trial 101 finished with value: 0.07652620883389363 and parameters: {'n_layers': 1, 'embedding_dim': 256, 'lr': 0.0026036233541360657, 'lambda_val': 0.0011190666227282363, 'batch_size': 2678, 'optimizer': 'RMSprop'}. Best is trial 83 with value: 0.08517052528092794.
2026-05-13 10:11:09,514 - optuna.study.study - INFO - Trial 102 finished with value: 0.08179323095854951 and parameters: {'n_layers': 1, 'embedding_dim': 256, 'lr': 0.0029120687055104364, 'lambda_val': 0.001574599286842002, 'batch_size': 2719, 'optimizer': 'RMSprop'}. Best is trial 83 with value: 0.08517052528092794.
2026-05-13 10:11:50,979 - optuna.study.study - INFO - Trial 103 finished with value: 0.07793885454173244 and parameters: {'n_layers': 1, 'embedding_dim': 256, 'lr': 0.0019528093436984792, 'lambda_val': 0.001625884746103899, 'batch_size': 2756, 'optimizer': 'RMSprop'}. Best is trial 83 with value: 0.08517052528092794.
2026-05-13 10:12:27,186 - optuna.study.study - INFO - Trial 104 finished with value: 0.08396352925372369 and parameters: {'n_layers': 1, 'embedding_dim': 256, 'lr': 0.005188655320841654, 'lambda_val': 0.0025790746210039807, 'batch_size': 2878, 'optimizer': 'RMSprop'}. Best is trial 83 with value: 0.08517052528092794.
2026-05-13 10:12:32,827 - optuna.study._optimize - INFO - Trial 105 pruned. 
2026-05-13 10:13:14,618 - optuna.study.study - INFO - Trial 106 finished with value: 0.07787188933524654 and parameters: {'n_layers': 1, 'embedding_dim': 256, 'lr': 0.0035569397345600056, 'lambda_val': 0.0030141878975911314, 'batch_size': 2400, 'optimizer': 'RMSprop'}. Best is trial 83 with value: 0.08517052528092794.
2026-05-13 10:14:01,848 - optuna.study.study - INFO - Trial 107 finished with value: 0.08597763165685648 and parameters: {'n_layers': 1, 'embedding_dim': 256, 'lr': 0.008124159592896502, 'lambda_val': 0.0018607404066040523, 'batch_size': 3128, 'optimizer': 'RMSprop'}. Best is trial 107 with value: 0.08597763165685648.
2026-05-13 10:14:38,486 - optuna.study.study - INFO - Trial 108 finished with value: 0.08500827074528129 and parameters: {'n_layers': 1, 'embedding_dim': 256, 'lr': 0.008095358373754667, 'lambda_val': 0.0017884176294270776, 'batch_size': 3111, 'optimizer': 'RMSprop'}. Best is trial 107 with value: 0.08597763165685648.
2026-05-13 10:15:18,577 - optuna.study.study - INFO - Trial 109 finished with value: 0.07577623684067068 and parameters: {'n_layers': 1, 'embedding_dim': 256, 'lr': 0.00830920304421182, 'lambda_val': 0.0005096158212311799, 'batch_size': 3121, 'optimizer': 'RMSprop'}. Best is trial 107 with value: 0.08597763165685648.
2026-05-13 10:15:56,433 - optuna.study.study - INFO - Trial 110 finished with value: 0.08505355876362335 and parameters: {'n_layers': 1, 'embedding_dim': 256, 'lr': 0.01010941025683411, 'lambda_val': 0.0014055398308379194, 'batch_size': 2836, 'optimizer': 'RMSprop'}. Best is trial 107 with value: 0.08597763165685648.
2026-05-13 10:16:31,868 - optuna.study.study - INFO - Trial 111 finished with value: 0.08453303359534341 and parameters: {'n_layers': 1, 'embedding_dim': 256, 'lr': 0.010599417450911438, 'lambda_val': 0.0012645272069313025, 'batch_size': 3371, 'optimizer': 'RMSprop'}. Best is trial 107 with value: 0.08597763165685648.
2026-05-13 10:17:10,704 - optuna.study.study - INFO - Trial 112 finished with value: 0.08779861477383034 and parameters: {'n_layers': 1, 'embedding_dim': 256, 'lr': 0.010621140076969226, 'lambda_val': 0.0009871758100188695, 'batch_size': 2981, 'optimizer': 'RMSprop'}. Best is trial 112 with value: 0.08779861477383034.
2026-05-13 10:17:15,618 - optuna.study._optimize - INFO - Trial 113 pruned. 
2026-05-13 10:17:24,411 - optuna.study._optimize - INFO - Trial 114 pruned. 
2026-05-13 10:17:28,435 - optuna.study._optimize - INFO - Trial 115 pruned. 
2026-05-13 10:17:33,086 - optuna.study._optimize - INFO - Trial 116 pruned. 
2026-05-13 10:17:37,911 - optuna.study._optimize - INFO - Trial 117 pruned. 
2026-05-13 10:17:43,490 - optuna.study._optimize - INFO - Trial 118 pruned. 
2026-05-13 10:17:51,400 - optuna.study._optimize - INFO - Trial 119 pruned. 
2026-05-13 10:18:01,620 - optuna.study._optimize - INFO - Trial 120 pruned. 
2026-05-13 10:18:39,911 - optuna.study.study - INFO - Trial 121 finished with value: 0.08575935053049587 and parameters: {'n_layers': 1, 'embedding_dim': 256, 'lr': 0.008268707706182746, 'lambda_val': 0.0008327982802798319, 'batch_size': 2826, 'optimizer': 'RMSprop'}. Best is trial 112 with value: 0.08779861477383034.
2026-05-13 10:19:15,117 - optuna.study.study - INFO - Trial 122 finished with value: 0.08718515506588699 and parameters: {'n_layers': 1, 'embedding_dim': 256, 'lr': 0.008823506631609997, 'lambda_val': 0.0008424568613007225, 'batch_size': 3073, 'optimizer': 'RMSprop'}. Best is trial 112 with value: 0.08779861477383034.
2026-05-13 10:19:51,107 - optuna.study.study - INFO - Trial 123 finished with value: 0.08231069225612221 and parameters: {'n_layers': 1, 'embedding_dim': 256, 'lr': 0.008361707477379183, 'lambda_val': 0.0005874675696207583, 'batch_size': 3075, 'optimizer': 'RMSprop'}. Best is trial 112 with value: 0.08779861477383034.
2026-05-13 10:20:21,787 - optuna.study._optimize - INFO - Trial 124 pruned. 
2026-05-13 10:20:56,699 - optuna.study.study - INFO - Trial 125 finished with value: 0.08036820879357824 and parameters: {'n_layers': 1, 'embedding_dim': 256, 'lr': 0.010386918731168553, 'lambda_val': 0.0006274013383255526, 'batch_size': 3032, 'optimizer': 'RMSprop'}. Best is trial 112 with value: 0.08779861477383034.
2026-05-13 10:21:01,834 - optuna.study._optimize - INFO - Trial 126 pruned. 
2026-05-13 10:21:39,903 - optuna.study.study - INFO - Trial 127 finished with value: 0.08275627848027775 and parameters: {'n_layers': 1, 'embedding_dim': 256, 'lr': 0.007971726146755289, 'lambda_val': 0.0005360189231342599, 'batch_size': 2958, 'optimizer': 'RMSprop'}. Best is trial 112 with value: 0.08779861477383034.
2026-05-13 10:22:15,680 - optuna.study.study - INFO - Trial 128 finished with value: 0.07264370513534037 and parameters: {'n_layers': 1, 'embedding_dim': 256, 'lr': 0.005134933218769207, 'lambda_val': 0.00041515889144817987, 'batch_size': 2969, 'optimizer': 'RMSprop'}. Best is trial 112 with value: 0.08779861477383034.
2026-05-13 10:22:53,536 - optuna.study.study - INFO - Trial 129 finished with value: 0.08436543383256506 and parameters: {'n_layers': 1, 'embedding_dim': 256, 'lr': 0.010517969524264006, 'lambda_val': 0.0018570355336472192, 'batch_size': 2842, 'optimizer': 'RMSprop'}. Best is trial 112 with value: 0.08779861477383034.
2026-05-13 10:22:58,233 - optuna.study._optimize - INFO - Trial 130 pruned. 
2026-05-13 10:23:33,932 - optuna.study.study - INFO - Trial 131 finished with value: 0.08211277023503033 and parameters: {'n_layers': 1, 'embedding_dim': 256, 'lr': 0.009061454210728419, 'lambda_val': 0.001850926767374587, 'batch_size': 3165, 'optimizer': 'RMSprop'}. Best is trial 112 with value: 0.08779861477383034.
2026-05-13 10:23:38,445 - optuna.study._optimize - INFO - Trial 132 pruned. 
2026-05-13 10:24:20,446 - optuna.study.study - INFO - Trial 133 finished with value: 0.08697075190347114 and parameters: {'n_layers': 1, 'embedding_dim': 256, 'lr': 0.00731175025380995, 'lambda_val': 0.0007582895789880208, 'batch_size': 2817, 'optimizer': 'RMSprop'}. Best is trial 112 with value: 0.08779861477383034.
2026-05-13 10:24:56,243 - optuna.study.study - INFO - Trial 134 finished with value: 0.08169145683219814 and parameters: {'n_layers': 1, 'embedding_dim': 256, 'lr': 0.006540426301385776, 'lambda_val': 0.001791675618903394, 'batch_size': 2783, 'optimizer': 'RMSprop'}. Best is trial 112 with value: 0.08779861477383034.
2026-05-13 10:25:00,369 - optuna.study._optimize - INFO - Trial 135 pruned. 
2026-05-13 10:25:05,559 - optuna.study._optimize - INFO - Trial 136 pruned. 
2026-05-13 10:25:09,888 - optuna.study._optimize - INFO - Trial 137 pruned. 
2026-05-13 10:25:14,509 - optuna.study._optimize - INFO - Trial 138 pruned. 
2026-05-13 10:25:23,686 - optuna.study._optimize - INFO - Trial 139 pruned. 
2026-05-13 10:25:28,190 - optuna.study._optimize - INFO - Trial 140 pruned. 
2026-05-13 10:25:33,990 - optuna.study._optimize - INFO - Trial 141 pruned. 
2026-05-13 10:26:15,078 - optuna.study.study - INFO - Trial 142 finished with value: 0.0834349657380272 and parameters: {'n_layers': 1, 'embedding_dim': 256, 'lr': 0.0057512757462623, 'lambda_val': 0.0010403854632481133, 'batch_size': 3003, 'optimizer': 'RMSprop'}. Best is trial 112 with value: 0.08779861477383034.
2026-05-13 10:26:19,568 - optuna.study._optimize - INFO - Trial 143 pruned. 
2026-05-13 10:26:57,466 - optuna.study.study - INFO - Trial 144 finished with value: 0.08481248939816619 and parameters: {'n_layers': 1, 'embedding_dim': 256, 'lr': 0.004855515248447586, 'lambda_val': 0.001373811901531862, 'batch_size': 3119, 'optimizer': 'RMSprop'}. Best is trial 112 with value: 0.08779861477383034.
2026-05-13 10:27:32,461 - optuna.study.study - INFO - Trial 145 finished with value: 0.08269462997424167 and parameters: {'n_layers': 1, 'embedding_dim': 256, 'lr': 0.00484630940587014, 'lambda_val': 0.001412673183106153, 'batch_size': 3126, 'optimizer': 'RMSprop'}. Best is trial 112 with value: 0.08779861477383034.
2026-05-13 10:27:38,317 - optuna.study._optimize - INFO - Trial 146 pruned. 
2026-05-13 10:27:42,588 - optuna.study._optimize - INFO - Trial 147 pruned. 
2026-05-13 10:28:20,986 - optuna.study.study - INFO - Trial 148 finished with value: 0.07883356331540403 and parameters: {'n_layers': 1, 'embedding_dim': 256, 'lr': 0.006840257061056586, 'lambda_val': 0.0016411792276405147, 'batch_size': 3544, 'optimizer': 'RMSprop'}. Best is trial 112 with value: 0.08779861477383034.
2026-05-13 10:28:26,354 - optuna.study._optimize - INFO - Trial 149 pruned. 
2026-05-13 10:28:30,110 - optuna.study._optimize - INFO - Trial 150 pruned. 
2026-05-13 10:28:33,680 - optuna.study._optimize - INFO - Trial 151 pruned. 
2026-05-13 10:29:07,982 - optuna.study.study - INFO - Trial 152 finished with value: 0.08205705281252555 and parameters: {'n_layers': 1, 'embedding_dim': 256, 'lr': 0.0052265987033086984, 'lambda_val': 0.0007192829832710914, 'batch_size': 2889, 'optimizer': 'RMSprop'}. Best is trial 112 with value: 0.08779861477383034.
2026-05-13 10:29:40,667 - optuna.study.study - INFO - Trial 153 finished with value: 0.08284876223338486 and parameters: {'n_layers': 1, 'embedding_dim': 256, 'lr': 0.007661028167456081, 'lambda_val': 0.0013977460697643697, 'batch_size': 2770, 'optimizer': 'RMSprop'}. Best is trial 112 with value: 0.08779861477383034.
2026-05-13 10:29:44,990 - optuna.study._optimize - INFO - Trial 154 pruned. 
2026-05-13 10:30:20,170 - optuna.study.study - INFO - Trial 155 finished with value: 0.08412073019291952 and parameters: {'n_layers': 1, 'embedding_dim': 256, 'lr': 0.0042090835612618085, 'lambda_val': 0.0009482254785669103, 'batch_size': 2643, 'optimizer': 'RMSprop'}. Best is trial 112 with value: 0.08779861477383034.
2026-05-13 10:30:24,706 - optuna.study._optimize - INFO - Trial 156 pruned. 
2026-05-13 10:30:29,088 - optuna.study._optimize - INFO - Trial 157 pruned. 
2026-05-13 10:31:04,340 - optuna.study.study - INFO - Trial 158 finished with value: 0.08738443517625384 and parameters: {'n_layers': 1, 'embedding_dim': 256, 'lr': 0.005733092994273405, 'lambda_val': 0.0016579778200707914, 'batch_size': 3104, 'optimizer': 'RMSprop'}. Best is trial 112 with value: 0.08779861477383034.
2026-05-13 10:31:43,181 - optuna.study.study - INFO - Trial 159 finished with value: 0.08218366764704008 and parameters: {'n_layers': 1, 'embedding_dim': 256, 'lr': 0.006119266277761933, 'lambda_val': 0.0016588989888918998, 'batch_size': 3407, 'optimizer': 'RMSprop'}. Best is trial 112 with value: 0.08779861477383034.
2026-05-13 10:31:46,561 - optuna.study._optimize - INFO - Trial 160 pruned. 
2026-05-13 10:32:21,809 - optuna.study.study - INFO - Trial 161 finished with value: 0.08061513398187858 and parameters: {'n_layers': 1, 'embedding_dim': 256, 'lr': 0.004441897750283973, 'lambda_val': 0.0020800388119240803, 'batch_size': 3052, 'optimizer': 'RMSprop'}. Best is trial 112 with value: 0.08779861477383034.
2026-05-13 10:33:05,786 - optuna.study.study - INFO - Trial 162 finished with value: 0.08763427736474162 and parameters: {'n_layers': 1, 'embedding_dim': 256, 'lr': 0.007528816029282473, 'lambda_val': 0.0013245510739980058, 'batch_size': 2911, 'optimizer': 'RMSprop'}. Best is trial 112 with value: 0.08779861477383034.
2026-05-13 10:33:19,041 - optuna.study._optimize - INFO - Trial 163 pruned. 
