2026-05-14 02:59:26,270 - optuna.study.study - INFO - Trial 123 finished with value: 0.07907983897962495 and parameters: {'n_layers': 1, 'embedding_dim': 256, 'lr': 0.012304953896564474, 'lambda_val': 0.0017782007893374018, 'batch_size': 3991, 'optimizer': 'RMSprop'}. Best is trial 112 with value: 0.08410177668587294.
2026-05-14 02:59:31,413 - optuna.study._optimize - INFO - Trial 124 pruned. 
2026-05-14 03:00:06,957 - optuna.study.study - INFO - Trial 125 finished with value: 0.07636334946416709 and parameters: {'n_layers': 1, 'embedding_dim': 256, 'lr': 0.009272492733628922, 'lambda_val': 0.0008565690308088541, 'batch_size': 3975, 'optimizer': 'RMSprop'}. Best is trial 112 with value: 0.08410177668587294.
2026-05-14 03:00:46,655 - optuna.study.study - INFO - Trial 126 finished with value: 0.07980969488430678 and parameters: {'n_layers': 1, 'embedding_dim': 256, 'lr': 0.011491165252275394, 'lambda_val': 0.0013342329675889591, 'batch_size': 3703, 'optimizer': 'RMSprop'}. Best is trial 112 with value: 0.08410177668587294.
2026-05-14 03:00:50,873 - optuna.study._optimize - INFO - Trial 127 pruned. 
2026-05-14 03:00:55,272 - optuna.study._optimize - INFO - Trial 128 pruned. 
2026-05-14 03:01:31,080 - optuna.study.study - INFO - Trial 129 finished with value: 0.07759064167464473 and parameters: {'n_layers': 1, 'embedding_dim': 256, 'lr': 0.012981844025187301, 'lambda_val': 0.0005012887282435484, 'batch_size': 3924, 'optimizer': 'RMSprop'}. Best is trial 112 with value: 0.08410177668587294.
2026-05-14 03:01:37,174 - optuna.study._optimize - INFO - Trial 130 pruned. 
2026-05-14 03:02:12,951 - optuna.study.study - INFO - Trial 131 finished with value: 0.08018835934227525 and parameters: {'n_layers': 1, 'embedding_dim': 256, 'lr': 0.010759283951584252, 'lambda_val': 0.0019087383659148619, 'batch_size': 3465, 'optimizer': 'RMSprop'}. Best is trial 112 with value: 0.08410177668587294.
2026-05-14 03:02:48,315 - optuna.study.study - INFO - Trial 132 finished with value: 0.0748719413367429 and parameters: {'n_layers': 1, 'embedding_dim': 256, 'lr': 0.011852201009258887, 'lambda_val': 0.0020245261617397436, 'batch_size': 3427, 'optimizer': 'RMSprop'}. Best is trial 112 with value: 0.08410177668587294.
2026-05-14 03:03:23,814 - optuna.study.study - INFO - Trial 133 finished with value: 0.07570640515260194 and parameters: {'n_layers': 1, 'embedding_dim': 256, 'lr': 0.008598497503042368, 'lambda_val': 0.0011621650321286545, 'batch_size': 3676, 'optimizer': 'RMSprop'}. Best is trial 112 with value: 0.08410177668587294.
2026-05-14 03:03:27,949 - optuna.study._optimize - INFO - Trial 134 pruned. 
2026-05-14 03:03:32,094 - optuna.study._optimize - INFO - Trial 135 pruned. 
2026-05-14 03:04:06,300 - optuna.study.study - INFO - Trial 136 finished with value: 0.07299089103051444 and parameters: {'n_layers': 1, 'embedding_dim': 256, 'lr': 0.011040697927106293, 'lambda_val': 0.002851044286616186, 'batch_size': 3771, 'optimizer': 'RMSprop'}. Best is trial 112 with value: 0.08410177668587294.
2026-05-14 03:04:41,435 - optuna.study.study - INFO - Trial 137 finished with value: 0.07616158634933995 and parameters: {'n_layers': 1, 'embedding_dim': 256, 'lr': 0.009284664541473971, 'lambda_val': 0.0007292675744543089, 'batch_size': 3393, 'optimizer': 'RMSprop'}. Best is trial 112 with value: 0.08410177668587294.
2026-05-14 03:05:12,145 - optuna.study.study - INFO - Trial 138 finished with value: 0.07466879966569406 and parameters: {'n_layers': 1, 'embedding_dim': 96, 'lr': 0.015202362232015588, 'lambda_val': 0.0035121694484441693, 'batch_size': 3622, 'optimizer': 'RMSprop'}. Best is trial 112 with value: 0.08410177668587294.
2026-05-14 03:05:20,565 - optuna.study._optimize - INFO - Trial 139 pruned. 
2026-05-14 03:05:55,990 - optuna.study.study - INFO - Trial 140 finished with value: 0.06123448282883006 and parameters: {'n_layers': 1, 'embedding_dim': 256, 'lr': 0.00021903887764519357, 'lambda_val': 0.002208799874011876, 'batch_size': 3475, 'optimizer': 'RMSprop'}. Best is trial 112 with value: 0.08410177668587294.
2026-05-14 03:06:32,324 - optuna.study.study - INFO - Trial 141 finished with value: 0.07989967770770491 and parameters: {'n_layers': 1, 'embedding_dim': 256, 'lr': 0.010300109963515212, 'lambda_val': 0.001658228776866525, 'batch_size': 3724, 'optimizer': 'RMSprop'}. Best is trial 112 with value: 0.08410177668587294.
2026-05-14 03:07:11,312 - optuna.study.study - INFO - Trial 142 finished with value: 0.08306903202834832 and parameters: {'n_layers': 1, 'embedding_dim': 256, 'lr': 0.008209595816040012, 'lambda_val': 0.0010830147570176103, 'batch_size': 3723, 'optimizer': 'RMSprop'}. Best is trial 112 with value: 0.08410177668587294.
2026-05-14 03:07:52,016 - optuna.study.study - INFO - Trial 143 finished with value: 0.07888270127125913 and parameters: {'n_layers': 1, 'embedding_dim': 256, 'lr': 0.008072689356514845, 'lambda_val': 0.0017376555611572368, 'batch_size': 3843, 'optimizer': 'RMSprop'}. Best is trial 112 with value: 0.08410177668587294.
2026-05-14 03:08:26,977 - optuna.study.study - INFO - Trial 144 finished with value: 0.08222376754833606 and parameters: {'n_layers': 1, 'embedding_dim': 256, 'lr': 0.013863316493548009, 'lambda_val': 0.002735127643631872, 'batch_size': 3716, 'optimizer': 'RMSprop'}. Best is trial 112 with value: 0.08410177668587294.
2026-05-14 03:08:42,162 - optuna.study._optimize - INFO - Trial 145 pruned. 
2026-05-14 03:09:19,919 - optuna.study.study - INFO - Trial 146 finished with value: 0.0794643221290315 and parameters: {'n_layers': 1, 'embedding_dim': 256, 'lr': 0.00578213396746845, 'lambda_val': 0.0028502778521382714, 'batch_size': 3682, 'optimizer': 'RMSprop'}. Best is trial 112 with value: 0.08410177668587294.
2026-05-14 03:09:59,815 - optuna.study.study - INFO - Trial 147 finished with value: 0.072427911868906 and parameters: {'n_layers': 1, 'embedding_dim': 256, 'lr': 0.004836302345117585, 'lambda_val': 0.004903084438554506, 'batch_size': 3499, 'optimizer': 'RMSprop'}. Best is trial 112 with value: 0.08410177668587294.
2026-05-14 03:10:07,519 - optuna.study._optimize - INFO - Trial 148 pruned. 
2026-05-14 03:10:11,617 - optuna.study._optimize - INFO - Trial 149 pruned. 
2026-05-14 03:10:48,006 - optuna.study.study - INFO - Trial 150 finished with value: 0.07610614081349862 and parameters: {'n_layers': 1, 'embedding_dim': 256, 'lr': 0.006858790317702683, 'lambda_val': 0.0008917282871985539, 'batch_size': 3609, 'optimizer': 'RMSprop'}. Best is trial 112 with value: 0.08410177668587294.
2026-05-14 03:11:28,051 - optuna.study.study - INFO - Trial 151 finished with value: 0.07940714871775045 and parameters: {'n_layers': 1, 'embedding_dim': 256, 'lr': 0.010286982223677143, 'lambda_val': 0.002977469980774689, 'batch_size': 3674, 'optimizer': 'RMSprop'}. Best is trial 112 with value: 0.08410177668587294.
2026-05-14 03:12:07,553 - optuna.study.study - INFO - Trial 152 finished with value: 0.07988044223211534 and parameters: {'n_layers': 1, 'embedding_dim': 256, 'lr': 0.005813092448514754, 'lambda_val': 0.0026721079949650786, 'batch_size': 3729, 'optimizer': 'RMSprop'}. Best is trial 112 with value: 0.08410177668587294.
2026-05-14 03:12:48,035 - optuna.study.study - INFO - Trial 153 finished with value: 0.0821731725283425 and parameters: {'n_layers': 1, 'embedding_dim': 256, 'lr': 0.006302546085834639, 'lambda_val': 0.00212912864766126, 'batch_size': 3374, 'optimizer': 'RMSprop'}. Best is trial 112 with value: 0.08410177668587294.
2026-05-14 03:13:29,269 - optuna.study.study - INFO - Trial 154 finished with value: 0.08193946150298885 and parameters: {'n_layers': 1, 'embedding_dim': 256, 'lr': 0.006261665742847665, 'lambda_val': 0.002031263684706013, 'batch_size': 3245, 'optimizer': 'RMSprop'}. Best is trial 112 with value: 0.08410177668587294.
2026-05-14 03:14:12,312 - optuna.study.study - INFO - Trial 155 finished with value: 0.07960960821544494 and parameters: {'n_layers': 1, 'embedding_dim': 256, 'lr': 0.004203941483452383, 'lambda_val': 0.0021916901105494438, 'batch_size': 3245, 'optimizer': 'RMSprop'}. Best is trial 112 with value: 0.08410177668587294.
2026-05-14 03:15:04,019 - optuna.study.study - INFO - Trial 156 finished with value: 0.07812865449644615 and parameters: {'n_layers': 1, 'embedding_dim': 256, 'lr': 0.006185610762551026, 'lambda_val': 0.004337618073618619, 'batch_size': 3342, 'optimizer': 'RMSprop'}. Best is trial 112 with value: 0.08410177668587294.
2026-05-14 03:15:13,622 - optuna.study._optimize - INFO - Trial 157 pruned. 
2026-05-14 03:15:19,713 - optuna.study._optimize - INFO - Trial 158 pruned. 
2026-05-14 03:16:11,664 - optuna.study.study - INFO - Trial 159 finished with value: 0.07950141584905959 and parameters: {'n_layers': 1, 'embedding_dim': 256, 'lr': 0.006189720197537483, 'lambda_val': 0.003930232946233201, 'batch_size': 3343, 'optimizer': 'RMSprop'}. Best is trial 112 with value: 0.08410177668587294.
2026-05-14 03:16:16,706 - optuna.study._optimize - INFO - Trial 160 pruned. 
2026-05-14 03:17:03,322 - optuna.study.study - INFO - Trial 161 finished with value: 0.07750553101191424 and parameters: {'n_layers': 1, 'embedding_dim': 256, 'lr': 0.004018415085971397, 'lambda_val': 0.002098830711940676, 'batch_size': 3238, 'optimizer': 'RMSprop'}. Best is trial 112 with value: 0.08410177668587294.
2026-05-14 03:17:40,661 - optuna.study.study - INFO - Trial 162 finished with value: 0.07815149861499393 and parameters: {'n_layers': 1, 'embedding_dim': 256, 'lr': 0.004444552018886692, 'lambda_val': 0.0024407819861811866, 'batch_size': 3305, 'optimizer': 'RMSprop'}. Best is trial 112 with value: 0.08410177668587294.
2026-05-14 03:18:19,574 - optuna.study.study - INFO - Trial 163 finished with value: 0.08210634420015844 and parameters: {'n_layers': 1, 'embedding_dim': 256, 'lr': 0.006403136665219324, 'lambda_val': 0.001759072652934049, 'batch_size': 3537, 'optimizer': 'RMSprop'}. Best is trial 112 with value: 0.08410177668587294.
2026-05-14 03:19:04,032 - optuna.study.study - INFO - Trial 164 finished with value: 0.07801815236369025 and parameters: {'n_layers': 1, 'embedding_dim': 256, 'lr': 0.007048057720261774, 'lambda_val': 0.0016419121533713082, 'batch_size': 3564, 'optimizer': 'RMSprop'}. Best is trial 112 with value: 0.08410177668587294.
2026-05-14 03:19:45,839 - optuna.study.study - INFO - Trial 165 finished with value: 0.08312842608384488 and parameters: {'n_layers': 1, 'embedding_dim': 256, 'lr': 0.0053418442507565, 'lambda_val': 0.0031844935425108423, 'batch_size': 3412, 'optimizer': 'RMSprop'}. Best is trial 112 with value: 0.08410177668587294.
2026-05-14 03:20:26,311 - optuna.study.study - INFO - Trial 166 finished with value: 0.0797957766897249 and parameters: {'n_layers': 1, 'embedding_dim': 256, 'lr': 0.005409561536407039, 'lambda_val': 0.0029773846425765246, 'batch_size': 3414, 'optimizer': 'RMSprop'}. Best is trial 112 with value: 0.08410177668587294.
2026-05-14 03:20:34,725 - optuna.study._optimize - INFO - Trial 167 pruned. 
2026-05-14 03:20:39,474 - optuna.study._optimize - INFO - Trial 168 pruned. 
2026-05-14 03:21:20,775 - optuna.study.study - INFO - Trial 169 finished with value: 0.0796557858876508 and parameters: {'n_layers': 1, 'embedding_dim': 256, 'lr': 0.00752304195174342, 'lambda_val': 0.0017495193549171963, 'batch_size': 3588, 'optimizer': 'RMSprop'}. Best is trial 112 with value: 0.08410177668587294.
2026-05-14 03:22:02,762 - optuna.study.study - INFO - Trial 170 finished with value: 0.08101459713674218 and parameters: {'n_layers': 1, 'embedding_dim': 256, 'lr': 0.004826418968117669, 'lambda_val': 0.001978879903347351, 'batch_size': 3808, 'optimizer': 'RMSprop'}. Best is trial 112 with value: 0.08410177668587294.
2026-05-14 03:22:46,044 - optuna.study.study - INFO - Trial 171 finished with value: 0.07753758149865542 and parameters: {'n_layers': 1, 'embedding_dim': 256, 'lr': 0.005594005350225868, 'lambda_val': 0.00260984910477515, 'batch_size': 3822, 'optimizer': 'RMSprop'}. Best is trial 112 with value: 0.08410177668587294.
2026-05-14 03:23:27,857 - optuna.study.study - INFO - Trial 172 finished with value: 0.08217473263571759 and parameters: {'n_layers': 1, 'embedding_dim': 256, 'lr': 0.004659465266561322, 'lambda_val': 0.0010736199923262546, 'batch_size': 3757, 'optimizer': 'RMSprop'}. Best is trial 112 with value: 0.08410177668587294.
2026-05-14 03:24:09,404 - optuna.study.study - INFO - Trial 173 finished with value: 0.07750318847650169 and parameters: {'n_layers': 1, 'embedding_dim': 256, 'lr': 0.004510844618657985, 'lambda_val': 0.0009254750672637544, 'batch_size': 3368, 'optimizer': 'RMSprop'}. Best is trial 112 with value: 0.08410177668587294.
2026-05-14 03:24:48,443 - optuna.study.study - INFO - Trial 174 finished with value: 0.08162239196587659 and parameters: {'n_layers': 1, 'embedding_dim': 256, 'lr': 0.008128097667553477, 'lambda_val': 0.0010666717164326885, 'batch_size': 3868, 'optimizer': 'RMSprop'}. Best is trial 112 with value: 0.08410177668587294.
2026-05-14 03:25:27,933 - optuna.study.study - INFO - Trial 175 finished with value: 0.0837257810668962 and parameters: {'n_layers': 1, 'embedding_dim': 256, 'lr': 0.0036711109097226106, 'lambda_val': 0.0010821553399579724, 'batch_size': 3845, 'optimizer': 'RMSprop'}. Best is trial 112 with value: 0.08410177668587294.
2026-05-14 03:26:10,409 - optuna.study.study - INFO - Trial 176 finished with value: 0.07693678945474257 and parameters: {'n_layers': 1, 'embedding_dim': 256, 'lr': 0.0029770029982551117, 'lambda_val': 0.001073806827200536, 'batch_size': 3890, 'optimizer': 'RMSprop'}. Best is trial 112 with value: 0.08410177668587294.
2026-05-14 03:26:54,386 - optuna.study.study - INFO - Trial 177 finished with value: 0.07693365890514854 and parameters: {'n_layers': 1, 'embedding_dim': 256, 'lr': 0.004015970744603616, 'lambda_val': 0.000751702351068431, 'batch_size': 3947, 'optimizer': 'RMSprop'}. Best is trial 112 with value: 0.08410177668587294.
2026-05-14 03:27:37,602 - optuna.study.study - INFO - Trial 178 finished with value: 0.07768203607391345 and parameters: {'n_layers': 1, 'embedding_dim': 256, 'lr': 0.0037960184778313218, 'lambda_val': 0.0013084575906415884, 'batch_size': 3821, 'optimizer': 'RMSprop'}. Best is trial 112 with value: 0.08410177668587294.
2026-05-14 03:28:20,329 - optuna.study.study - INFO - Trial 179 finished with value: 0.08051096692651749 and parameters: {'n_layers': 1, 'embedding_dim': 256, 'lr': 0.004991005665643984, 'lambda_val': 0.0010967440183783448, 'batch_size': 3634, 'optimizer': 'RMSprop'}. Best is trial 112 with value: 0.08410177668587294.
2026-05-14 03:28:28,726 - optuna.study._optimize - INFO - Trial 180 pruned. 
2026-05-14 03:29:13,107 - optuna.study.study - INFO - Trial 181 finished with value: 0.07932869592451354 and parameters: {'n_layers': 1, 'embedding_dim': 256, 'lr': 0.006746132775681689, 'lambda_val': 0.0010999505549051268, 'batch_size': 3536, 'optimizer': 'RMSprop'}. Best is trial 112 with value: 0.08410177668587294.
2026-05-14 03:29:53,764 - optuna.study.study - INFO - Trial 182 finished with value: 0.08164747821209505 and parameters: {'n_layers': 1, 'embedding_dim': 256, 'lr': 0.003264323546121534, 'lambda_val': 0.0015422864830672539, 'batch_size': 3805, 'optimizer': 'RMSprop'}. Best is trial 112 with value: 0.08410177668587294.
2026-05-14 03:30:36,721 - optuna.study.study - INFO - Trial 183 finished with value: 0.08255587671065959 and parameters: {'n_layers': 1, 'embedding_dim': 256, 'lr': 0.00380961925793679, 'lambda_val': 0.001077635661491095, 'batch_size': 3778, 'optimizer': 'RMSprop'}. Best is trial 112 with value: 0.08410177668587294.
2026-05-14 03:31:19,736 - optuna.study.study - INFO - Trial 184 finished with value: 0.08162108219781922 and parameters: {'n_layers': 1, 'embedding_dim': 256, 'lr': 0.002858841108749342, 'lambda_val': 0.0007404173170423483, 'batch_size': 3773, 'optimizer': 'RMSprop'}. Best is trial 112 with value: 0.08410177668587294.
2026-05-14 03:31:52,429 - optuna.study._optimize - INFO - Trial 185 pruned. 
2026-05-14 03:31:56,369 - optuna.study._optimize - INFO - Trial 186 pruned. 
2026-05-14 03:32:20,029 - optuna.study._optimize - INFO - Trial 187 pruned. 
2026-05-14 03:32:30,531 - optuna.study._optimize - INFO - Trial 188 pruned. 
2026-05-14 03:32:43,237 - optuna.study._optimize - INFO - Trial 189 pruned. 
2026-05-14 03:33:08,749 - optuna.study._optimize - INFO - Trial 190 pruned. 
2026-05-14 03:33:53,980 - optuna.study.study - INFO - Trial 191 finished with value: 0.07682476337376423 and parameters: {'n_layers': 1, 'embedding_dim': 256, 'lr': 0.0036340388126678944, 'lambda_val': 0.0010426798559734233, 'batch_size': 3748, 'optimizer': 'RMSprop'}. Best is trial 112 with value: 0.08410177668587294.
2026-05-14 03:34:33,462 - optuna.study.study - INFO - Trial 192 finished with value: 0.07937269803600515 and parameters: {'n_layers': 1, 'embedding_dim': 256, 'lr': 0.004634059456007925, 'lambda_val': 0.001397215268042933, 'batch_size': 3631, 'optimizer': 'RMSprop'}. Best is trial 112 with value: 0.08410177668587294.
2026-05-14 03:35:15,155 - optuna.study.study - INFO - Trial 193 finished with value: 0.0784932476123195 and parameters: {'n_layers': 1, 'embedding_dim': 256, 'lr': 0.004670778147156739, 'lambda_val': 0.0009366263956259245, 'batch_size': 3992, 'optimizer': 'RMSprop'}. Best is trial 112 with value: 0.08410177668587294.
2026-05-14 03:36:01,562 - optuna.study.study - INFO - Trial 194 finished with value: 0.07968702009012721 and parameters: {'n_layers': 1, 'embedding_dim': 256, 'lr': 0.003279390376809986, 'lambda_val': 0.0007025622696269001, 'batch_size': 3836, 'optimizer': 'RMSprop'}. Best is trial 112 with value: 0.08410177668587294.
2026-05-14 03:36:45,742 - optuna.study.study - INFO - Trial 195 finished with value: 0.0844343831133359 and parameters: {'n_layers': 1, 'embedding_dim': 256, 'lr': 0.0052584475023918975, 'lambda_val': 0.0011864752006448718, 'batch_size': 3590, 'optimizer': 'RMSprop'}. Best is trial 195 with value: 0.0844343831133359.
2026-05-14 03:37:34,423 - optuna.study.study - INFO - Trial 196 finished with value: 0.07530576464027637 and parameters: {'n_layers': 1, 'embedding_dim': 256, 'lr': 0.0027557430795894233, 'lambda_val': 0.0015444465224767304, 'batch_size': 3562, 'optimizer': 'RMSprop'}. Best is trial 195 with value: 0.0844343831133359.
2026-05-14 03:38:19,258 - optuna.study.study - INFO - Trial 197 finished with value: 0.07704402153537732 and parameters: {'n_layers': 1, 'embedding_dim': 256, 'lr': 0.0040668992281716375, 'lambda_val': 0.0019443955535788742, 'batch_size': 3731, 'optimizer': 'RMSprop'}. Best is trial 195 with value: 0.0844343831133359.
2026-05-14 03:39:07,186 - optuna.study.study - INFO - Trial 198 finished with value: 0.08287138642042119 and parameters: {'n_layers': 1, 'embedding_dim': 256, 'lr': 0.005662364048110163, 'lambda_val': 0.0012757391499032779, 'batch_size': 3688, 'optimizer': 'RMSprop'}. Best is trial 195 with value: 0.0844343831133359.
2026-05-14 03:39:59,539 - optuna.study.study - INFO - Trial 199 finished with value: 0.08366677264550262 and parameters: {'n_layers': 1, 'embedding_dim': 256, 'lr': 0.00618417941314737, 'lambda_val': 0.0012168751619843405, 'batch_size': 3691, 'optimizer': 'RMSprop'}. Best is trial 195 with value: 0.0844343831133359.
