2026-05-11 03:12:27,272 - optuna.study.study - INFO - Trial 114 finished with value: 0.0696744156459586 and parameters: {'n_layers': 1, 'embedding_dim': 256, 'lr': 0.0004816796137671264, 'lambda_val': 0.00011750625890762675, 'batch_size': 2870, 'optimizer': 'Adam'}. Best is trial 21 with value: 0.09010673199911809.
2026-05-11 03:13:03,532 - optuna.study.study - INFO - Trial 115 finished with value: 0.07608181669113198 and parameters: {'n_layers': 1, 'embedding_dim': 256, 'lr': 0.00034548094364457806, 'lambda_val': 0.00019939609621758906, 'batch_size': 2566, 'optimizer': 'Adam'}. Best is trial 21 with value: 0.09010673199911809.
2026-05-11 03:13:39,084 - optuna.study.study - INFO - Trial 116 finished with value: 0.07029242129071529 and parameters: {'n_layers': 1, 'embedding_dim': 256, 'lr': 0.0003613119922200801, 'lambda_val': 2.5087665974530033e-06, 'batch_size': 2508, 'optimizer': 'Adam'}. Best is trial 21 with value: 0.09010673199911809.
2026-05-11 03:14:14,871 - optuna.study.study - INFO - Trial 117 finished with value: 0.05371010645956563 and parameters: {'n_layers': 1, 'embedding_dim': 256, 'lr': 0.0007260925298212757, 'lambda_val': 0.00019519002657386798, 'batch_size': 2551, 'optimizer': 'Adam'}. Best is trial 21 with value: 0.09010673199911809.
2026-05-11 03:14:51,038 - optuna.study.study - INFO - Trial 118 finished with value: 0.08572386670762751 and parameters: {'n_layers': 1, 'embedding_dim': 256, 'lr': 0.0002541037457698078, 'lambda_val': 9.603660428851465e-05, 'batch_size': 2449, 'optimizer': 'Adam'}. Best is trial 21 with value: 0.09010673199911809.
2026-05-11 03:15:25,508 - optuna.study.study - INFO - Trial 119 finished with value: 0.08837560670404329 and parameters: {'n_layers': 1, 'embedding_dim': 256, 'lr': 0.00025191150184939674, 'lambda_val': 9.546606193830497e-05, 'batch_size': 1369, 'optimizer': 'Adam'}. Best is trial 21 with value: 0.09010673199911809.
2026-05-11 03:15:30,147 - optuna.study._optimize - INFO - Trial 120 pruned. 
2026-05-11 03:16:04,692 - optuna.study.study - INFO - Trial 121 finished with value: 0.08917548647058998 and parameters: {'n_layers': 1, 'embedding_dim': 256, 'lr': 0.0002610229875894811, 'lambda_val': 0.00010418461934890946, 'batch_size': 1367, 'optimizer': 'Adam'}. Best is trial 21 with value: 0.09010673199911809.
2026-05-11 03:16:39,027 - optuna.study.study - INFO - Trial 122 finished with value: 0.0900002479471534 and parameters: {'n_layers': 1, 'embedding_dim': 256, 'lr': 0.0002582414881090255, 'lambda_val': 7.647261147640001e-05, 'batch_size': 1349, 'optimizer': 'Adam'}. Best is trial 21 with value: 0.09010673199911809.
2026-05-11 03:17:13,520 - optuna.study.study - INFO - Trial 123 finished with value: 0.09229573044538299 and parameters: {'n_layers': 1, 'embedding_dim': 256, 'lr': 0.00022772106380578516, 'lambda_val': 7.428031393427677e-05, 'batch_size': 1284, 'optimizer': 'Adam'}. Best is trial 123 with value: 0.09229573044538299.
2026-05-11 03:17:47,904 - optuna.study.study - INFO - Trial 124 finished with value: 0.08585854048889717 and parameters: {'n_layers': 1, 'embedding_dim': 256, 'lr': 0.0002924789204954415, 'lambda_val': 7.638239804803178e-05, 'batch_size': 1377, 'optimizer': 'Adam'}. Best is trial 123 with value: 0.09229573044538299.
2026-05-11 03:18:21,965 - optuna.study.study - INFO - Trial 125 finished with value: 0.08494780197904249 and parameters: {'n_layers': 1, 'embedding_dim': 256, 'lr': 0.0002695850976818672, 'lambda_val': 7.294705357785181e-05, 'batch_size': 1333, 'optimizer': 'Adam'}. Best is trial 123 with value: 0.09229573044538299.
2026-05-11 03:18:26,261 - optuna.study._optimize - INFO - Trial 126 pruned. 
2026-05-11 03:18:31,876 - optuna.study._optimize - INFO - Trial 127 pruned. 
2026-05-11 03:18:36,356 - optuna.study._optimize - INFO - Trial 128 pruned. 
2026-05-11 03:18:40,690 - optuna.study._optimize - INFO - Trial 129 pruned. 
2026-05-11 03:19:15,087 - optuna.study.study - INFO - Trial 130 finished with value: 0.08266463101165525 and parameters: {'n_layers': 1, 'embedding_dim': 256, 'lr': 0.00025229578373916697, 'lambda_val': 6.566298384404112e-05, 'batch_size': 1232, 'optimizer': 'Adam'}. Best is trial 123 with value: 0.09229573044538299.
2026-05-11 03:19:48,995 - optuna.study.study - INFO - Trial 131 finished with value: 0.09072416660842172 and parameters: {'n_layers': 1, 'embedding_dim': 256, 'lr': 0.0002598946609219361, 'lambda_val': 9.635672812238446e-05, 'batch_size': 1272, 'optimizer': 'Adam'}. Best is trial 123 with value: 0.09229573044538299.
2026-05-11 03:20:23,057 - optuna.study.study - INFO - Trial 132 finished with value: 0.08985465888006759 and parameters: {'n_layers': 1, 'embedding_dim': 256, 'lr': 0.0002650741322588407, 'lambda_val': 8.830883815527821e-05, 'batch_size': 1301, 'optimizer': 'Adam'}. Best is trial 123 with value: 0.09229573044538299.
2026-05-11 03:20:57,316 - optuna.study.study - INFO - Trial 133 finished with value: 0.08615220970042983 and parameters: {'n_layers': 1, 'embedding_dim': 256, 'lr': 0.0002530799360568082, 'lambda_val': 8.90901661936093e-05, 'batch_size': 1286, 'optimizer': 'Adam'}. Best is trial 123 with value: 0.09229573044538299.
2026-05-11 03:21:32,007 - optuna.study.study - INFO - Trial 134 finished with value: 0.08611512085176026 and parameters: {'n_layers': 1, 'embedding_dim': 256, 'lr': 0.00039835729813906986, 'lambda_val': 8.996207828273944e-05, 'batch_size': 1288, 'optimizer': 'Adam'}. Best is trial 123 with value: 0.09229573044538299.
2026-05-11 03:22:05,739 - optuna.study.study - INFO - Trial 135 finished with value: 0.0745923880548293 and parameters: {'n_layers': 1, 'embedding_dim': 256, 'lr': 0.0005569351391999082, 'lambda_val': 9.499209631759015e-05, 'batch_size': 1311, 'optimizer': 'Adam'}. Best is trial 123 with value: 0.09229573044538299.
2026-05-11 03:22:10,453 - optuna.study._optimize - INFO - Trial 136 pruned. 
2026-05-11 03:22:44,365 - optuna.study.study - INFO - Trial 137 finished with value: 0.0879343211058729 and parameters: {'n_layers': 1, 'embedding_dim': 256, 'lr': 0.00039547094500354626, 'lambda_val': 0.00014655010555370552, 'batch_size': 1357, 'optimizer': 'Adam'}. Best is trial 123 with value: 0.09229573044538299.
2026-05-11 03:23:18,379 - optuna.study.study - INFO - Trial 138 finished with value: 0.08372801898961453 and parameters: {'n_layers': 1, 'embedding_dim': 256, 'lr': 0.00040403188799736727, 'lambda_val': 0.0001175121529341837, 'batch_size': 1142, 'optimizer': 'Adam'}. Best is trial 123 with value: 0.09229573044538299.
2026-05-11 03:23:52,802 - optuna.study.study - INFO - Trial 139 finished with value: 0.07473467971537007 and parameters: {'n_layers': 1, 'embedding_dim': 256, 'lr': 0.00042146392424677337, 'lambda_val': 0.0001507672627810009, 'batch_size': 1486, 'optimizer': 'Adam'}. Best is trial 123 with value: 0.09229573044538299.
2026-05-11 03:23:57,030 - optuna.study._optimize - INFO - Trial 140 pruned. 
2026-05-11 03:24:34,758 - optuna.study.study - INFO - Trial 141 finished with value: 0.07604060558657195 and parameters: {'n_layers': 1, 'embedding_dim': 256, 'lr': 0.0003278351140361899, 'lambda_val': 6.0730090638506455e-05, 'batch_size': 1378, 'optimizer': 'Adam'}. Best is trial 123 with value: 0.09229573044538299.
2026-05-11 03:25:08,799 - optuna.study.study - INFO - Trial 142 finished with value: 0.08796169643674992 and parameters: {'n_layers': 1, 'embedding_dim': 256, 'lr': 0.00027367838322956794, 'lambda_val': 7.492654593472804e-05, 'batch_size': 1299, 'optimizer': 'Adam'}. Best is trial 123 with value: 0.09229573044538299.
2026-05-11 03:25:12,996 - optuna.study._optimize - INFO - Trial 143 pruned. 
2026-05-11 03:25:47,827 - optuna.study.study - INFO - Trial 144 finished with value: 0.07481001088821693 and parameters: {'n_layers': 1, 'embedding_dim': 256, 'lr': 0.0003721102692961298, 'lambda_val': 9.280041819907825e-05, 'batch_size': 1189, 'optimizer': 'Adam'}. Best is trial 123 with value: 0.09229573044538299.
2026-05-11 03:25:52,250 - optuna.study._optimize - INFO - Trial 145 pruned. 
2026-05-11 03:25:57,116 - optuna.study._optimize - INFO - Trial 146 pruned. 
2026-05-11 03:26:30,849 - optuna.study.study - INFO - Trial 147 finished with value: 0.0776210672794232 and parameters: {'n_layers': 1, 'embedding_dim': 256, 'lr': 0.0006082664721584435, 'lambda_val': 5.715832803416243e-05, 'batch_size': 1055, 'optimizer': 'Adam'}. Best is trial 123 with value: 0.09229573044538299.
2026-05-11 03:26:35,263 - optuna.study._optimize - INFO - Trial 148 pruned. 
2026-05-11 03:26:39,406 - optuna.study._optimize - INFO - Trial 149 pruned. 
2026-05-11 03:26:43,271 - optuna.study._optimize - INFO - Trial 150 pruned. 
2026-05-11 03:27:17,966 - optuna.study.study - INFO - Trial 151 finished with value: 0.09262455608020818 and parameters: {'n_layers': 1, 'embedding_dim': 256, 'lr': 0.0002866837116517262, 'lambda_val': 7.734380164432297e-05, 'batch_size': 1344, 'optimizer': 'Adam'}. Best is trial 151 with value: 0.09262455608020818.
2026-05-11 03:27:22,361 - optuna.study._optimize - INFO - Trial 152 pruned. 
2026-05-11 03:27:26,886 - optuna.study._optimize - INFO - Trial 153 pruned. 
2026-05-11 03:28:01,187 - optuna.study.study - INFO - Trial 154 finished with value: 0.09228062210672747 and parameters: {'n_layers': 1, 'embedding_dim': 256, 'lr': 0.00025912926884623334, 'lambda_val': 7.35780560044496e-05, 'batch_size': 1261, 'optimizer': 'Adam'}. Best is trial 151 with value: 0.09262455608020818.
2026-05-11 03:28:05,371 - optuna.study._optimize - INFO - Trial 155 pruned. 
2026-05-11 03:28:12,244 - optuna.study._optimize - INFO - Trial 156 pruned. 
2026-05-11 03:28:16,474 - optuna.study._optimize - INFO - Trial 157 pruned. 
2026-05-11 03:28:20,682 - optuna.study._optimize - INFO - Trial 158 pruned. 
2026-05-11 03:28:24,602 - optuna.study._optimize - INFO - Trial 159 pruned. 
2026-05-11 03:28:59,345 - optuna.study.study - INFO - Trial 160 finished with value: 0.0863657163923188 and parameters: {'n_layers': 1, 'embedding_dim': 256, 'lr': 0.00033213272489979217, 'lambda_val': 3.119242136800272e-05, 'batch_size': 1193, 'optimizer': 'Adam'}. Best is trial 151 with value: 0.09262455608020818.
2026-05-11 03:29:33,232 - optuna.study.study - INFO - Trial 161 finished with value: 0.08958610950440261 and parameters: {'n_layers': 1, 'embedding_dim': 256, 'lr': 0.00033400906899621675, 'lambda_val': 2.6617500915587756e-05, 'batch_size': 1226, 'optimizer': 'Adam'}. Best is trial 151 with value: 0.09262455608020818.
2026-05-11 03:30:07,194 - optuna.study.study - INFO - Trial 162 finished with value: 0.08555836911147278 and parameters: {'n_layers': 1, 'embedding_dim': 256, 'lr': 0.0005113928990758233, 'lambda_val': 3.2521744779354775e-05, 'batch_size': 1150, 'optimizer': 'Adam'}. Best is trial 151 with value: 0.09262455608020818.
2026-05-11 03:30:40,623 - optuna.study.study - INFO - Trial 163 finished with value: 0.08356204844696549 and parameters: {'n_layers': 1, 'embedding_dim': 256, 'lr': 0.0003393758418737477, 'lambda_val': 4.60957409466257e-05, 'batch_size': 1252, 'optimizer': 'Adam'}. Best is trial 151 with value: 0.09262455608020818.
2026-05-11 03:30:46,093 - optuna.study._optimize - INFO - Trial 164 pruned. 
2026-05-11 03:30:50,396 - optuna.study._optimize - INFO - Trial 165 pruned. 
2026-05-11 03:30:54,745 - optuna.study._optimize - INFO - Trial 166 pruned. 
2026-05-11 03:31:28,867 - optuna.study.study - INFO - Trial 167 finished with value: 0.07120091067926776 and parameters: {'n_layers': 1, 'embedding_dim': 256, 'lr': 0.0006705092183838336, 'lambda_val': 5.563359101881126e-05, 'batch_size': 1500, 'optimizer': 'Adam'}. Best is trial 151 with value: 0.09262455608020818.
2026-05-11 03:31:32,862 - optuna.study._optimize - INFO - Trial 168 pruned. 
2026-05-11 03:31:37,102 - optuna.study._optimize - INFO - Trial 169 pruned. 
2026-05-11 03:32:11,690 - optuna.study.study - INFO - Trial 170 finished with value: 0.08651966617611838 and parameters: {'n_layers': 1, 'embedding_dim': 256, 'lr': 0.0004547622484062672, 'lambda_val': 0.0001090400756563397, 'batch_size': 1415, 'optimizer': 'Adam'}. Best is trial 151 with value: 0.09262455608020818.
2026-05-11 03:32:45,296 - optuna.study.study - INFO - Trial 171 finished with value: 0.08058563678127878 and parameters: {'n_layers': 1, 'embedding_dim': 256, 'lr': 0.0004534908682786352, 'lambda_val': 0.00011863569619261718, 'batch_size': 1423, 'optimizer': 'Adam'}. Best is trial 151 with value: 0.09262455608020818.
2026-05-11 03:32:49,932 - optuna.study._optimize - INFO - Trial 172 pruned. 
2026-05-11 03:33:23,429 - optuna.study.study - INFO - Trial 173 finished with value: 0.07627178282830224 and parameters: {'n_layers': 1, 'embedding_dim': 256, 'lr': 0.00036538490148260846, 'lambda_val': 0.00010095057933949672, 'batch_size': 1349, 'optimizer': 'Adam'}. Best is trial 151 with value: 0.09262455608020818.
2026-05-11 03:33:57,884 - optuna.study.study - INFO - Trial 174 finished with value: 0.06785473391026478 and parameters: {'n_layers': 1, 'embedding_dim': 256, 'lr': 0.0005655593244045233, 'lambda_val': 7.396249353695667e-05, 'batch_size': 1575, 'optimizer': 'Adam'}. Best is trial 151 with value: 0.09262455608020818.
2026-05-11 03:34:02,204 - optuna.study._optimize - INFO - Trial 175 pruned. 
2026-05-11 03:34:06,606 - optuna.study._optimize - INFO - Trial 176 pruned. 
2026-05-11 03:34:36,686 - optuna.study.study - INFO - Trial 177 finished with value: 0.07820363913363217 and parameters: {'n_layers': 1, 'embedding_dim': 128, 'lr': 0.0004182905489814587, 'lambda_val': 0.00018461095297522421, 'batch_size': 1322, 'optimizer': 'Adam'}. Best is trial 151 with value: 0.09262455608020818.
2026-05-11 03:34:41,535 - optuna.study._optimize - INFO - Trial 178 pruned. 
2026-05-11 03:35:09,220 - optuna.study.study - INFO - Trial 179 finished with value: 0.046680128384435096 and parameters: {'n_layers': 1, 'embedding_dim': 96, 'lr': 0.0008540255350083668, 'lambda_val': 0.00010852416305345272, 'batch_size': 1651, 'optimizer': 'Adam'}. Best is trial 151 with value: 0.09262455608020818.
2026-05-11 03:35:13,566 - optuna.study._optimize - INFO - Trial 180 pruned. 
2026-05-11 03:35:47,410 - optuna.study.study - INFO - Trial 181 finished with value: 0.09800062623669713 and parameters: {'n_layers': 1, 'embedding_dim': 256, 'lr': 0.00028640436661351323, 'lambda_val': 8.034461846236138e-05, 'batch_size': 1369, 'optimizer': 'Adam'}. Best is trial 181 with value: 0.09800062623669713.
2026-05-11 03:36:21,710 - optuna.study.study - INFO - Trial 182 finished with value: 0.09845305497544377 and parameters: {'n_layers': 1, 'embedding_dim': 256, 'lr': 0.00025296016056648826, 'lambda_val': 7.882655090752635e-05, 'batch_size': 1415, 'optimizer': 'Adam'}. Best is trial 182 with value: 0.09845305497544377.
2026-05-11 03:36:27,506 - optuna.study._optimize - INFO - Trial 183 pruned. 
2026-05-11 03:36:31,977 - optuna.study._optimize - INFO - Trial 184 pruned. 
2026-05-11 03:36:36,217 - optuna.study._optimize - INFO - Trial 185 pruned. 
2026-05-11 03:36:42,138 - optuna.study._optimize - INFO - Trial 186 pruned. 
2026-05-11 03:37:16,606 - optuna.study.study - INFO - Trial 187 finished with value: 0.0885402109849268 and parameters: {'n_layers': 1, 'embedding_dim': 256, 'lr': 0.0002646289742286423, 'lambda_val': 5.4716232093794124e-05, 'batch_size': 1558, 'optimizer': 'Adam'}. Best is trial 182 with value: 0.09845305497544377.
2026-05-11 03:37:21,093 - optuna.study._optimize - INFO - Trial 188 pruned. 
2026-05-11 03:37:25,402 - optuna.study._optimize - INFO - Trial 189 pruned. 
2026-05-11 03:37:29,860 - optuna.study._optimize - INFO - Trial 190 pruned. 
2026-05-11 03:37:34,100 - optuna.study._optimize - INFO - Trial 191 pruned. 
2026-05-11 03:38:08,271 - optuna.study.study - INFO - Trial 192 finished with value: 0.08835785160200435 and parameters: {'n_layers': 1, 'embedding_dim': 256, 'lr': 0.0003372071504018528, 'lambda_val': 5.993766731882856e-05, 'batch_size': 1291, 'optimizer': 'Adam'}. Best is trial 182 with value: 0.09845305497544377.
2026-05-11 03:38:13,144 - optuna.study._optimize - INFO - Trial 193 pruned. 
2026-05-11 03:38:47,804 - optuna.study.study - INFO - Trial 194 finished with value: 0.0771641916710833 and parameters: {'n_layers': 1, 'embedding_dim': 256, 'lr': 0.00045611441959077313, 'lambda_val': 5.7050686025477105e-05, 'batch_size': 1325, 'optimizer': 'Adam'}. Best is trial 182 with value: 0.09845305497544377.
2026-05-11 03:38:52,075 - optuna.study._optimize - INFO - Trial 195 pruned. 
2026-05-11 03:38:56,349 - optuna.study._optimize - INFO - Trial 196 pruned. 
2026-05-11 03:39:00,664 - optuna.study._optimize - INFO - Trial 197 pruned. 
2026-05-11 03:39:04,777 - optuna.study._optimize - INFO - Trial 198 pruned. 
2026-05-11 03:39:09,146 - optuna.study._optimize - INFO - Trial 199 pruned. 
2026-05-11 03:39:37,148 - root - INFO -   **** Training e_100K_1c2dcs_rand1
2026-05-11 03:39:37,158 - root - INFO -   **** Getting 54402/65410 random edges
2026-05-11 03:39:37,679 - optuna.storages._rdb.storage - INFO - A new study created in RDB with name: Study_e_100K_1c2dcs_rand1
2026-05-11 03:40:25,824 - optuna.study.study - INFO - Trial 0 finished with value: 0.05592770614782217 and parameters: {'n_layers': 3, 'embedding_dim': 128, 'lr': 3.0366418596874736e-05, 'lambda_val': 6.765772001023339e-06, 'batch_size': 526, 'optimizer': 'RMSprop'}. Best is trial 0 with value: 0.05592770614782217.
2026-05-11 03:41:20,542 - optuna.study.study - INFO - Trial 1 finished with value: 0.0351352221393874 and parameters: {'n_layers': 1, 'embedding_dim': 32, 'lr': 0.0009783151707874224, 'lambda_val': 0.012546557909551708, 'batch_size': 531, 'optimizer': 'RMSprop'}. Best is trial 0 with value: 0.05592770614782217.
2026-05-11 03:42:06,894 - optuna.study.study - INFO - Trial 2 finished with value: 0.003334428885079671 and parameters: {'n_layers': 2, 'embedding_dim': 64, 'lr': 0.022540016164704912, 'lambda_val': 3.6577866427652252e-06, 'batch_size': 3735, 'optimizer': 'SGD'}. Best is trial 0 with value: 0.05592770614782217.
2026-05-11 03:42:34,218 - optuna.study.study - INFO - Trial 3 finished with value: 0.002943576323959526 and parameters: {'n_layers': 1, 'embedding_dim': 96, 'lr': 0.05988018455322985, 'lambda_val': 0.0010806170300988614, 'batch_size': 1172, 'optimizer': 'SGD'}. Best is trial 0 with value: 0.05592770614782217.
2026-05-11 03:43:08,964 - optuna.study.study - INFO - Trial 4 finished with value: 0.03834486161971339 and parameters: {'n_layers': 1, 'embedding_dim': 256, 'lr': 0.0313924848152004, 'lambda_val': 8.050941499822228e-05, 'batch_size': 4071, 'optimizer': 'Adam'}. Best is trial 0 with value: 0.05592770614782217.
2026-05-11 03:43:12,572 - optuna.study._optimize - INFO - Trial 5 pruned. 
2026-05-11 03:43:23,052 - optuna.study._optimize - INFO - Trial 6 pruned. 
2026-05-11 03:43:33,004 - optuna.study._optimize - INFO - Trial 7 pruned. 
2026-05-11 03:43:44,711 - optuna.study._optimize - INFO - Trial 8 pruned. 
2026-05-11 03:43:53,439 - optuna.study._optimize - INFO - Trial 9 pruned. 
2026-05-11 03:44:37,492 - optuna.study.study - INFO - Trial 10 finished with value: 0.008020688884797504 and parameters: {'n_layers': 4, 'embedding_dim': 128, 'lr': 8.410835424929526e-05, 'lambda_val': 0.0003526575995626635, 'batch_size': 2661, 'optimizer': 'RMSprop'}. Best is trial 0 with value: 0.05592770614782217.
2026-05-11 03:45:16,842 - optuna.study.study - INFO - Trial 11 finished with value: 0.03584339880038478 and parameters: {'n_layers': 3, 'embedding_dim': 128, 'lr': 0.006674430400814472, 'lambda_val': 9.079533629757448e-05, 'batch_size': 3876, 'optimizer': 'RMSprop'}. Best is trial 0 with value: 0.05592770614782217.
2026-05-11 03:45:22,789 - optuna.study._optimize - INFO - Trial 12 pruned. 
2026-05-11 03:46:01,322 - optuna.study.study - INFO - Trial 13 finished with value: 0.06761116545947718 and parameters: {'n_layers': 3, 'embedding_dim': 128, 'lr': 7.44999959488934e-05, 'lambda_val': 2.6010621515744916e-05, 'batch_size': 1914, 'optimizer': 'RMSprop'}. Best is trial 13 with value: 0.06761116545947718.
2026-05-11 03:46:06,082 - optuna.study._optimize - INFO - Trial 14 pruned. 
2026-05-11 03:46:11,239 - optuna.study._optimize - INFO - Trial 15 pruned. 
2026-05-11 03:46:52,156 - optuna.study.study - INFO - Trial 16 finished with value: 0.023637429112599053 and parameters: {'n_layers': 3, 'embedding_dim': 128, 'lr': 9.503575634622186e-05, 'lambda_val': 1.2563983578851815e-05, 'batch_size': 3087, 'optimizer': 'RMSprop'}. Best is trial 13 with value: 0.06761116545947718.
2026-05-11 03:47:21,765 - optuna.study.study - INFO - Trial 17 finished with value: 0.03443435299848389 and parameters: {'n_layers': 2, 'embedding_dim': 64, 'lr': 0.00023530140747206235, 'lambda_val': 9.102020240920769e-05, 'batch_size': 811, 'optimizer': 'RMSprop'}. Best is trial 13 with value: 0.06761116545947718.
2026-05-11 03:47:27,208 - optuna.study._optimize - INFO - Trial 18 pruned. 
2026-05-11 03:48:07,044 - optuna.study.study - INFO - Trial 19 finished with value: 0.02614762850258566 and parameters: {'n_layers': 3, 'embedding_dim': 128, 'lr': 0.00027917484470782477, 'lambda_val': 4.553158943650394e-06, 'batch_size': 2887, 'optimizer': 'RMSprop'}. Best is trial 13 with value: 0.06761116545947718.
2026-05-11 03:48:11,769 - optuna.study._optimize - INFO - Trial 20 pruned. 
2026-05-11 03:48:17,845 - optuna.study._optimize - INFO - Trial 21 pruned. 
2026-05-11 03:48:52,329 - optuna.study.study - INFO - Trial 22 finished with value: 0.050763669735358626 and parameters: {'n_layers': 1, 'embedding_dim': 256, 'lr': 0.0028991931141308723, 'lambda_val': 3.411454922248186e-05, 'batch_size': 3286, 'optimizer': 'Adam'}. Best is trial 13 with value: 0.06761116545947718.
2026-05-11 03:49:25,106 - optuna.study.study - INFO - Trial 23 finished with value: 0.022190390662243063 and parameters: {'n_layers': 2, 'embedding_dim': 96, 'lr': 0.003018740791953425, 'lambda_val': 3.2387462948767056e-05, 'batch_size': 3346, 'optimizer': 'Adam'}. Best is trial 13 with value: 0.06761116545947718.
