2026-05-11 06:23:50,834 - optuna.study.study - INFO - Trial 194 finished with value: 0.08430212931916284 and parameters: {'n_layers': 1, 'embedding_dim': 256, 'lr': 0.015364603604635983, 'lambda_val': 0.0014686982681681104, 'batch_size': 3669, 'optimizer': 'RMSprop'}. Best is trial 132 with value: 0.08640926798859318.
2026-05-11 06:24:25,096 - optuna.study.study - INFO - Trial 195 finished with value: 0.0829759219967875 and parameters: {'n_layers': 1, 'embedding_dim': 256, 'lr': 0.01580529774325037, 'lambda_val': 0.0010116217137552052, 'batch_size': 3603, 'optimizer': 'RMSprop'}. Best is trial 132 with value: 0.08640926798859318.
2026-05-11 06:24:29,290 - optuna.study._optimize - INFO - Trial 196 pruned. 
2026-05-11 06:24:33,917 - optuna.study._optimize - INFO - Trial 197 pruned. 
2026-05-11 06:24:40,065 - optuna.study._optimize - INFO - Trial 198 pruned. 
2026-05-11 06:25:15,259 - optuna.study.study - INFO - Trial 199 finished with value: 0.08330314775874993 and parameters: {'n_layers': 1, 'embedding_dim': 256, 'lr': 0.014457573226714013, 'lambda_val': 0.0017775945290710747, 'batch_size': 3615, 'optimizer': 'RMSprop'}. Best is trial 132 with value: 0.08640926798859318.
2026-05-11 06:25:43,894 - root - INFO -   **** Training e_100K_1c2dcs_rand3
2026-05-11 06:25:43,907 - root - INFO -   **** Getting 54402/65410 random edges
2026-05-11 06:25:44,460 - optuna.storages._rdb.storage - INFO - A new study created in RDB with name: Study_e_100K_1c2dcs_rand3
2026-05-11 06:26:44,152 - optuna.study.study - INFO - Trial 0 finished with value: 0.06385524201459458 and parameters: {'n_layers': 3, 'embedding_dim': 256, 'lr': 5.072828006523458e-05, 'lambda_val': 0.0003223333136847034, 'batch_size': 1882, 'optimizer': 'Adam'}. Best is trial 0 with value: 0.06385524201459458.
2026-05-11 06:27:28,324 - optuna.study.study - INFO - Trial 1 finished with value: 0.001388883699515875 and parameters: {'n_layers': 3, 'embedding_dim': 128, 'lr': 0.013499128059143422, 'lambda_val': 0.001355131268801889, 'batch_size': 2872, 'optimizer': 'SGD'}. Best is trial 0 with value: 0.06385524201459458.
2026-05-11 06:28:02,307 - optuna.study.study - INFO - Trial 2 finished with value: 0.022735022239978926 and parameters: {'n_layers': 2, 'embedding_dim': 64, 'lr': 2.5798583924242976e-05, 'lambda_val': 0.03006810345036782, 'batch_size': 3684, 'optimizer': 'Adam'}. Best is trial 0 with value: 0.06385524201459458.
2026-05-11 06:28:45,592 - optuna.study.study - INFO - Trial 3 finished with value: 0.0008457905314701352 and parameters: {'n_layers': 4, 'embedding_dim': 64, 'lr': 3.8629094988082117e-05, 'lambda_val': 0.00019019891308587176, 'batch_size': 868, 'optimizer': 'SGD'}. Best is trial 0 with value: 0.06385524201459458.
2026-05-11 06:29:40,552 - optuna.study.study - INFO - Trial 4 finished with value: 0.022458569493674016 and parameters: {'n_layers': 3, 'embedding_dim': 128, 'lr': 0.0015230649745788195, 'lambda_val': 0.00011240212152686793, 'batch_size': 1772, 'optimizer': 'Adam'}. Best is trial 0 with value: 0.06385524201459458.
2026-05-11 06:29:49,950 - optuna.study._optimize - INFO - Trial 5 pruned. 
2026-05-11 06:30:32,057 - optuna.study.study - INFO - Trial 6 finished with value: 0.022536488127307273 and parameters: {'n_layers': 4, 'embedding_dim': 96, 'lr': 0.04635586178444519, 'lambda_val': 0.0018451325843156, 'batch_size': 3187, 'optimizer': 'Adam'}. Best is trial 0 with value: 0.06385524201459458.
2026-05-11 06:31:01,488 - optuna.study.study - INFO - Trial 7 finished with value: 0.04552469048894499 and parameters: {'n_layers': 1, 'embedding_dim': 64, 'lr': 0.06432446191800405, 'lambda_val': 0.00014603408496810576, 'batch_size': 3712, 'optimizer': 'RMSprop'}. Best is trial 0 with value: 0.06385524201459458.
2026-05-11 06:31:35,630 - optuna.study.study - INFO - Trial 8 finished with value: 0.05571515744347345 and parameters: {'n_layers': 1, 'embedding_dim': 128, 'lr': 0.020358277986572193, 'lambda_val': 0.008399396166440247, 'batch_size': 2713, 'optimizer': 'Adam'}. Best is trial 0 with value: 0.06385524201459458.
2026-05-11 06:31:40,002 - optuna.study._optimize - INFO - Trial 9 pruned. 
2026-05-11 06:32:20,820 - optuna.study.study - INFO - Trial 10 finished with value: 0.058750439943899495 and parameters: {'n_layers': 2, 'embedding_dim': 256, 'lr': 0.00023117266160408215, 'lambda_val': 1.966338820463968e-06, 'batch_size': 559, 'optimizer': 'RMSprop'}. Best is trial 0 with value: 0.06385524201459458.
2026-05-11 06:33:10,190 - optuna.study.study - INFO - Trial 11 finished with value: 0.06028971394276396 and parameters: {'n_layers': 2, 'embedding_dim': 256, 'lr': 0.0001865046130325939, 'lambda_val': 1.2922798804170642e-06, 'batch_size': 513, 'optimizer': 'RMSprop'}. Best is trial 0 with value: 0.06385524201459458.
2026-05-11 06:34:00,473 - optuna.study.study - INFO - Trial 12 finished with value: 0.031064894015200427 and parameters: {'n_layers': 3, 'embedding_dim': 256, 'lr': 0.00018752953721093508, 'lambda_val': 6.525332522398125e-06, 'batch_size': 1351, 'optimizer': 'RMSprop'}. Best is trial 0 with value: 0.06385524201459458.
2026-05-11 06:34:42,319 - optuna.study.study - INFO - Trial 13 finished with value: 0.03926042154179567 and parameters: {'n_layers': 2, 'embedding_dim': 256, 'lr': 0.0001305538154060405, 'lambda_val': 1.4180991424521267e-05, 'batch_size': 2097, 'optimizer': 'RMSprop'}. Best is trial 0 with value: 0.06385524201459458.
2026-05-11 06:35:32,718 - optuna.study.study - INFO - Trial 14 finished with value: 0.025628005666585355 and parameters: {'n_layers': 3, 'embedding_dim': 256, 'lr': 0.0014930528251600125, 'lambda_val': 1.5715167084653787e-06, 'batch_size': 1094, 'optimizer': 'Adam'}. Best is trial 0 with value: 0.06385524201459458.
2026-05-11 06:35:37,776 - optuna.study._optimize - INFO - Trial 15 pruned. 
2026-05-11 06:36:09,421 - optuna.study.study - INFO - Trial 16 finished with value: 0.03253224690595488 and parameters: {'n_layers': 3, 'embedding_dim': 32, 'lr': 0.0005970754653197677, 'lambda_val': 0.00046367568850868706, 'batch_size': 655, 'optimizer': 'Adam'}. Best is trial 0 with value: 0.06385524201459458.
2026-05-11 06:36:14,593 - optuna.study._optimize - INFO - Trial 17 pruned. 
2026-05-11 06:36:21,064 - optuna.study._optimize - INFO - Trial 18 pruned. 
2026-05-11 06:37:05,529 - optuna.study.study - INFO - Trial 19 finished with value: 0.02675136678613842 and parameters: {'n_layers': 2, 'embedding_dim': 256, 'lr': 0.0005352458700716012, 'lambda_val': 0.00978690229304843, 'batch_size': 2625, 'optimizer': 'Adam'}. Best is trial 0 with value: 0.06385524201459458.
2026-05-11 06:37:09,370 - optuna.study._optimize - INFO - Trial 20 pruned. 
2026-05-11 06:37:51,276 - optuna.study.study - INFO - Trial 21 finished with value: 0.0521091228358142 and parameters: {'n_layers': 2, 'embedding_dim': 256, 'lr': 0.00018537280193113462, 'lambda_val': 1.7744929057462872e-06, 'batch_size': 538, 'optimizer': 'RMSprop'}. Best is trial 0 with value: 0.06385524201459458.
2026-05-11 06:38:33,754 - optuna.study.study - INFO - Trial 22 finished with value: 0.07983942689963226 and parameters: {'n_layers': 2, 'embedding_dim': 256, 'lr': 8.047703136530691e-05, 'lambda_val': 1.0848320817651416e-06, 'batch_size': 906, 'optimizer': 'RMSprop'}. Best is trial 22 with value: 0.07983942689963226.
2026-05-11 06:38:39,125 - optuna.study._optimize - INFO - Trial 23 pruned. 
2026-05-11 06:39:30,750 - optuna.study.study - INFO - Trial 24 finished with value: 0.02528329182886986 and parameters: {'n_layers': 3, 'embedding_dim': 256, 'lr': 0.0003604809237159668, 'lambda_val': 1.0221176244442858e-06, 'batch_size': 1402, 'optimizer': 'RMSprop'}. Best is trial 22 with value: 0.07983942689963226.
2026-05-11 06:40:13,793 - optuna.study.study - INFO - Trial 25 finished with value: 0.08858311597441294 and parameters: {'n_layers': 2, 'embedding_dim': 256, 'lr': 8.742528168623094e-05, 'lambda_val': 3.9494355403445956e-05, 'batch_size': 906, 'optimizer': 'RMSprop'}. Best is trial 25 with value: 0.08858311597441294.
2026-05-11 06:40:17,742 - optuna.study._optimize - INFO - Trial 26 pruned. 
2026-05-11 06:41:08,776 - optuna.study.study - INFO - Trial 27 finished with value: 0.06589314310677148 and parameters: {'n_layers': 3, 'embedding_dim': 256, 'lr': 8.090675882053247e-05, 'lambda_val': 1.3074755141706565e-05, 'batch_size': 969, 'optimizer': 'RMSprop'}. Best is trial 25 with value: 0.08858311597441294.
2026-05-11 06:41:15,988 - optuna.study._optimize - INFO - Trial 28 pruned. 
2026-05-11 06:42:06,093 - optuna.study.study - INFO - Trial 29 finished with value: 0.06416126225008827 and parameters: {'n_layers': 3, 'embedding_dim': 256, 'lr': 8.911642122416397e-05, 'lambda_val': 4.539815475832408e-06, 'batch_size': 1034, 'optimizer': 'RMSprop'}. Best is trial 25 with value: 0.08858311597441294.
2026-05-11 06:42:11,039 - optuna.study._optimize - INFO - Trial 30 pruned. 
2026-05-11 06:43:00,046 - optuna.study.study - INFO - Trial 31 finished with value: 0.04637824015653562 and parameters: {'n_layers': 3, 'embedding_dim': 256, 'lr': 0.00010138797210131498, 'lambda_val': 3.3885388981323376e-06, 'batch_size': 1046, 'optimizer': 'RMSprop'}. Best is trial 25 with value: 0.08858311597441294.
2026-05-11 06:43:50,541 - optuna.study.study - INFO - Trial 32 finished with value: 0.03457807803268027 and parameters: {'n_layers': 3, 'embedding_dim': 256, 'lr': 9.194844120550446e-05, 'lambda_val': 5.409902638122973e-05, 'batch_size': 1471, 'optimizer': 'RMSprop'}. Best is trial 25 with value: 0.08858311597441294.
2026-05-11 06:43:56,522 - optuna.study._optimize - INFO - Trial 33 pruned. 
2026-05-11 06:44:00,880 - optuna.study._optimize - INFO - Trial 34 pruned. 
2026-05-11 06:44:06,023 - optuna.study._optimize - INFO - Trial 35 pruned. 
2026-05-11 06:44:11,556 - optuna.study._optimize - INFO - Trial 36 pruned. 
2026-05-11 06:44:45,473 - optuna.study.study - INFO - Trial 37 finished with value: 0.025238195846776643 and parameters: {'n_layers': 2, 'embedding_dim': 128, 'lr': 0.0009028287328146069, 'lambda_val': 0.00010926342759728486, 'batch_size': 2012, 'optimizer': 'RMSprop'}. Best is trial 25 with value: 0.08858311597441294.
2026-05-11 06:44:50,773 - optuna.study._optimize - INFO - Trial 38 pruned. 
2026-05-11 06:44:55,106 - optuna.study._optimize - INFO - Trial 39 pruned. 
2026-05-11 06:45:00,448 - optuna.study._optimize - INFO - Trial 40 pruned. 
2026-05-11 06:45:06,653 - optuna.study._optimize - INFO - Trial 41 pruned. 
2026-05-11 06:45:13,056 - optuna.study._optimize - INFO - Trial 42 pruned. 
2026-05-11 06:45:18,360 - optuna.study._optimize - INFO - Trial 43 pruned. 
2026-05-11 06:45:24,045 - optuna.study._optimize - INFO - Trial 44 pruned. 
2026-05-11 06:45:28,827 - optuna.study._optimize - INFO - Trial 45 pruned. 
2026-05-11 06:45:33,929 - optuna.study._optimize - INFO - Trial 46 pruned. 
2026-05-11 06:46:25,417 - optuna.study.study - INFO - Trial 47 finished with value: 0.022751160737345462 and parameters: {'n_layers': 3, 'embedding_dim': 256, 'lr': 0.00022635530620336951, 'lambda_val': 8.027553908147663e-05, 'batch_size': 2990, 'optimizer': 'RMSprop'}. Best is trial 25 with value: 0.08858311597441294.
2026-05-11 06:46:29,927 - optuna.study._optimize - INFO - Trial 48 pruned. 
2026-05-11 06:47:21,149 - optuna.study.study - INFO - Trial 49 finished with value: 0.022195417304243965 and parameters: {'n_layers': 3, 'embedding_dim': 256, 'lr': 0.0007872013038013144, 'lambda_val': 0.0007335757837485759, 'batch_size': 706, 'optimizer': 'Adam'}. Best is trial 25 with value: 0.08858311597441294.
2026-05-11 06:47:25,200 - optuna.study._optimize - INFO - Trial 50 pruned. 
2026-05-11 06:48:06,338 - optuna.study.study - INFO - Trial 51 finished with value: 0.07028713148349111 and parameters: {'n_layers': 2, 'embedding_dim': 256, 'lr': 0.00015702499347486462, 'lambda_val': 1.2643882257477968e-06, 'batch_size': 570, 'optimizer': 'RMSprop'}. Best is trial 25 with value: 0.08858311597441294.
2026-05-11 06:48:47,638 - optuna.study.study - INFO - Trial 52 finished with value: 0.038084777752643253 and parameters: {'n_layers': 2, 'embedding_dim': 256, 'lr': 0.00032547319069419953, 'lambda_val': 1.1651680286004084e-06, 'batch_size': 623, 'optimizer': 'RMSprop'}. Best is trial 25 with value: 0.08858311597441294.
2026-05-11 06:49:29,478 - optuna.study.study - INFO - Trial 53 finished with value: 0.05636395572807855 and parameters: {'n_layers': 2, 'embedding_dim': 256, 'lr': 0.00012468648830400248, 'lambda_val': 4.858688844326609e-06, 'batch_size': 1108, 'optimizer': 'RMSprop'}. Best is trial 25 with value: 0.08858311597441294.
2026-05-11 06:50:11,003 - optuna.study.study - INFO - Trial 54 finished with value: 0.0934030755983107 and parameters: {'n_layers': 2, 'embedding_dim': 256, 'lr': 7.611249907796706e-05, 'lambda_val': 9.002554545974497e-06, 'batch_size': 929, 'optimizer': 'RMSprop'}. Best is trial 54 with value: 0.0934030755983107.
2026-05-11 06:50:16,024 - optuna.study._optimize - INFO - Trial 55 pruned. 
2026-05-11 06:50:49,799 - optuna.study.study - INFO - Trial 56 finished with value: 0.09176826123192791 and parameters: {'n_layers': 1, 'embedding_dim': 256, 'lr': 0.0001673604572262259, 'lambda_val': 1.8618101588987677e-06, 'batch_size': 1338, 'optimizer': 'RMSprop'}. Best is trial 54 with value: 0.0934030755983107.
2026-05-11 06:51:23,379 - optuna.study.study - INFO - Trial 57 finished with value: 0.12813174176502007 and parameters: {'n_layers': 1, 'embedding_dim': 256, 'lr': 0.00017529484977551473, 'lambda_val': 1.7071728717738818e-06, 'batch_size': 764, 'optimizer': 'RMSprop'}. Best is trial 57 with value: 0.12813174176502007.
2026-05-11 06:51:56,587 - optuna.study.study - INFO - Trial 58 finished with value: 0.07149406088380827 and parameters: {'n_layers': 1, 'embedding_dim': 256, 'lr': 0.0013919728634294848, 'lambda_val': 1.886717502637934e-06, 'batch_size': 549, 'optimizer': 'RMSprop'}. Best is trial 57 with value: 0.12813174176502007.
2026-05-11 06:52:24,973 - optuna.study.study - INFO - Trial 59 finished with value: 0.04000748128021697 and parameters: {'n_layers': 1, 'embedding_dim': 96, 'lr': 0.0016672830334222705, 'lambda_val': 1.8012915416381994e-06, 'batch_size': 1348, 'optimizer': 'RMSprop'}. Best is trial 57 with value: 0.12813174176502007.
2026-05-11 06:52:58,846 - optuna.study.study - INFO - Trial 60 finished with value: 0.0622191010453962 and parameters: {'n_layers': 1, 'embedding_dim': 256, 'lr': 0.001449487046837546, 'lambda_val': 2.3179332752435452e-06, 'batch_size': 795, 'optimizer': 'RMSprop'}. Best is trial 57 with value: 0.12813174176502007.
2026-05-11 06:53:32,392 - optuna.study.study - INFO - Trial 61 finished with value: 0.061478905654765804 and parameters: {'n_layers': 1, 'embedding_dim': 256, 'lr': 0.0026193282038827633, 'lambda_val': 1.4556012374614704e-06, 'batch_size': 532, 'optimizer': 'RMSprop'}. Best is trial 57 with value: 0.12813174176502007.
2026-05-11 06:54:02,719 - optuna.study.study - INFO - Trial 62 finished with value: 0.14110520347341055 and parameters: {'n_layers': 1, 'embedding_dim': 256, 'lr': 0.0001587395334087503, 'lambda_val': 1.0339603847621988e-06, 'batch_size': 649, 'optimizer': 'RMSprop'}. Best is trial 62 with value: 0.14110520347341055.
2026-05-11 06:54:36,327 - optuna.study.study - INFO - Trial 63 finished with value: 0.10769242121259574 and parameters: {'n_layers': 1, 'embedding_dim': 256, 'lr': 0.00023427000822983036, 'lambda_val': 1.0315703587394435e-06, 'batch_size': 671, 'optimizer': 'RMSprop'}. Best is trial 62 with value: 0.14110520347341055.
2026-05-11 06:55:09,776 - optuna.study.study - INFO - Trial 64 finished with value: 0.0995269365935296 and parameters: {'n_layers': 1, 'embedding_dim': 256, 'lr': 0.00022275208986293775, 'lambda_val': 1.0425685415096403e-06, 'batch_size': 832, 'optimizer': 'RMSprop'}. Best is trial 62 with value: 0.14110520347341055.
2026-05-11 06:55:43,251 - optuna.study.study - INFO - Trial 65 finished with value: 0.10247649855670883 and parameters: {'n_layers': 1, 'embedding_dim': 256, 'lr': 0.0002445082566142635, 'lambda_val': 2.8108022223351397e-06, 'batch_size': 692, 'optimizer': 'RMSprop'}. Best is trial 62 with value: 0.14110520347341055.
2026-05-11 06:56:17,249 - optuna.study.study - INFO - Trial 66 finished with value: 0.07135127273446148 and parameters: {'n_layers': 1, 'embedding_dim': 256, 'lr': 0.00042587967161148766, 'lambda_val': 1.0673778882316874e-06, 'batch_size': 693, 'optimizer': 'RMSprop'}. Best is trial 62 with value: 0.14110520347341055.
2026-05-11 06:56:45,512 - optuna.study.study - INFO - Trial 67 finished with value: 0.11947879718264937 and parameters: {'n_layers': 1, 'embedding_dim': 32, 'lr': 0.00024077082468795772, 'lambda_val': 2.271745145589319e-06, 'batch_size': 1158, 'optimizer': 'RMSprop'}. Best is trial 62 with value: 0.14110520347341055.
2026-05-11 06:57:12,681 - optuna.study.study - INFO - Trial 68 finished with value: 0.1284064588030385 and parameters: {'n_layers': 1, 'embedding_dim': 32, 'lr': 0.0002367381079290397, 'lambda_val': 2.982411270012404e-06, 'batch_size': 801, 'optimizer': 'RMSprop'}. Best is trial 62 with value: 0.14110520347341055.
2026-05-11 06:57:40,749 - optuna.study.study - INFO - Trial 69 finished with value: 0.12752361125387396 and parameters: {'n_layers': 1, 'embedding_dim': 32, 'lr': 0.0002563462817483365, 'lambda_val': 4.001008323167626e-06, 'batch_size': 800, 'optimizer': 'RMSprop'}. Best is trial 62 with value: 0.14110520347341055.
2026-05-11 06:58:09,337 - optuna.study.study - INFO - Trial 70 finished with value: 0.10526494749738664 and parameters: {'n_layers': 1, 'embedding_dim': 32, 'lr': 0.00026768566183040063, 'lambda_val': 3.730698208508612e-06, 'batch_size': 1138, 'optimizer': 'RMSprop'}. Best is trial 62 with value: 0.14110520347341055.
2026-05-11 06:58:37,844 - optuna.study.study - INFO - Trial 71 finished with value: 0.04764842410206179 and parameters: {'n_layers': 1, 'embedding_dim': 32, 'lr': 0.000648520658716035, 'lambda_val': 3.7878666104470945e-06, 'batch_size': 1150, 'optimizer': 'RMSprop'}. Best is trial 62 with value: 0.14110520347341055.
2026-05-11 06:59:05,494 - optuna.study.study - INFO - Trial 72 finished with value: 0.11319215197637379 and parameters: {'n_layers': 1, 'embedding_dim': 32, 'lr': 0.00032892824791833243, 'lambda_val': 2.4714578963212857e-06, 'batch_size': 693, 'optimizer': 'RMSprop'}. Best is trial 62 with value: 0.14110520347341055.
2026-05-11 06:59:32,216 - optuna.study.study - INFO - Trial 73 finished with value: 0.11421567737444965 and parameters: {'n_layers': 1, 'embedding_dim': 32, 'lr': 0.0003232278791019432, 'lambda_val': 6.340457541248672e-06, 'batch_size': 792, 'optimizer': 'RMSprop'}. Best is trial 62 with value: 0.14110520347341055.
2026-05-11 07:00:00,060 - optuna.study.study - INFO - Trial 74 finished with value: 0.08443816668119876 and parameters: {'n_layers': 1, 'embedding_dim': 32, 'lr': 0.00041105911310236663, 'lambda_val': 2.498899204610825e-06, 'batch_size': 798, 'optimizer': 'RMSprop'}. Best is trial 62 with value: 0.14110520347341055.
2026-05-11 07:00:28,067 - optuna.study.study - INFO - Trial 75 finished with value: 0.06636951826878641 and parameters: {'n_layers': 1, 'embedding_dim': 32, 'lr': 0.0006803091162487759, 'lambda_val': 5.662924543498255e-06, 'batch_size': 633, 'optimizer': 'RMSprop'}. Best is trial 62 with value: 0.14110520347341055.
2026-05-11 07:00:32,996 - optuna.study._optimize - INFO - Trial 76 pruned. 
2026-05-11 07:01:00,440 - optuna.study.study - INFO - Trial 77 finished with value: 0.08042543722630596 and parameters: {'n_layers': 1, 'embedding_dim': 32, 'lr': 0.0005259269596717911, 'lambda_val': 7.259049908673322e-06, 'batch_size': 627, 'optimizer': 'RMSprop'}. Best is trial 62 with value: 0.14110520347341055.
2026-05-11 07:01:04,755 - optuna.study._optimize - INFO - Trial 78 pruned. 
2026-05-11 07:01:27,914 - optuna.study.study - INFO - Trial 79 finished with value: 0.13194303048712525 and parameters: {'n_layers': 1, 'embedding_dim': 32, 'lr': 0.00029113382040589345, 'lambda_val': 4.465940576097088e-06, 'batch_size': 858, 'optimizer': 'RMSprop'}. Best is trial 62 with value: 0.14110520347341055.
2026-05-11 07:01:30,891 - optuna.study._optimize - INFO - Trial 80 pruned. 
2026-05-11 07:01:52,884 - optuna.study.study - INFO - Trial 81 finished with value: 0.08200221499504068 and parameters: {'n_layers': 1, 'embedding_dim': 32, 'lr': 0.000316843992908684, 'lambda_val': 4.299607220216148e-06, 'batch_size': 846, 'optimizer': 'RMSprop'}. Best is trial 62 with value: 0.14110520347341055.
2026-05-11 07:02:20,686 - optuna.study.study - INFO - Trial 82 finished with value: 0.04477701203792685 and parameters: {'n_layers': 1, 'embedding_dim': 32, 'lr': 0.001099458572754308, 'lambda_val': 1.48153944991597e-06, 'batch_size': 705, 'optimizer': 'RMSprop'}. Best is trial 62 with value: 0.14110520347341055.
2026-05-11 07:02:49,128 - optuna.study.study - INFO - Trial 83 finished with value: 0.07345875815322833 and parameters: {'n_layers': 1, 'embedding_dim': 32, 'lr': 0.0005154139715566933, 'lambda_val': 1.9146451588096154e-05, 'batch_size': 778, 'optimizer': 'RMSprop'}. Best is trial 62 with value: 0.14110520347341055.
2026-05-11 07:02:52,913 - optuna.study._optimize - INFO - Trial 84 pruned. 
2026-05-11 07:02:56,854 - optuna.study._optimize - INFO - Trial 85 pruned. 
2026-05-11 07:03:26,123 - optuna.study.study - INFO - Trial 86 finished with value: 0.07680062865036126 and parameters: {'n_layers': 1, 'embedding_dim': 32, 'lr': 0.0003817056376804636, 'lambda_val': 1.42425975138305e-06, 'batch_size': 1022, 'optimizer': 'RMSprop'}. Best is trial 62 with value: 0.14110520347341055.
2026-05-11 07:03:30,453 - optuna.study._optimize - INFO - Trial 87 pruned. 
2026-05-11 07:03:34,450 - optuna.study._optimize - INFO - Trial 88 pruned. 
