2026-05-11 02:40:28,377 - optuna.study._optimize - INFO - Trial 189 pruned. 
2026-05-11 02:41:03,826 - optuna.study.study - INFO - Trial 190 finished with value: 0.08133549988112647 and parameters: {'n_layers': 1, 'embedding_dim': 256, 'lr': 0.00015739643460134137, 'lambda_val': 1.4230654102321832e-06, 'batch_size': 3060, 'optimizer': 'Adam'}. Best is trial 15 with value: 0.10720122396305293.
2026-05-11 02:41:08,397 - optuna.study._optimize - INFO - Trial 191 pruned. 
2026-05-11 02:41:12,749 - optuna.study._optimize - INFO - Trial 192 pruned. 
2026-05-11 02:41:17,332 - optuna.study._optimize - INFO - Trial 193 pruned. 
2026-05-11 02:41:51,999 - optuna.study.study - INFO - Trial 194 finished with value: 0.06602394671643816 and parameters: {'n_layers': 1, 'embedding_dim': 256, 'lr': 0.00021654710309031502, 'lambda_val': 1.9328332448837347e-06, 'batch_size': 2787, 'optimizer': 'Adam'}. Best is trial 15 with value: 0.10720122396305293.
2026-05-11 02:41:56,169 - optuna.study._optimize - INFO - Trial 195 pruned. 
2026-05-11 02:42:00,231 - optuna.study._optimize - INFO - Trial 196 pruned. 
2026-05-11 02:42:04,384 - optuna.study._optimize - INFO - Trial 197 pruned. 
2026-05-11 02:42:07,972 - optuna.study._optimize - INFO - Trial 198 pruned. 
2026-05-11 02:42:12,059 - optuna.study._optimize - INFO - Trial 199 pruned. 
2026-05-11 02:42:39,372 - root - INFO - **** Training e_100K_1c2dcs
2026-05-11 02:42:39,372 - root - INFO -   ** 2-Dominant stats:
2026-05-11 02:42:39,373 - root - INFO -   ** Finding the dominant set:
2026-05-11 02:42:58,024 - root - INFO -   ** Getting the trainable edges:
2026-05-11 02:42:58,030 - helper_functions - INFO -      Number of nodes: 3657
2026-05-11 02:42:58,030 - helper_functions - INFO -      Ratio: 0.4035978368833462
2026-05-11 02:42:58,030 - helper_functions - INFO -      Number of unique users: 325
2026-05-11 02:42:58,030 - helper_functions - INFO -      Number of unique items: 3332
2026-05-11 02:42:58,030 - helper_functions - INFO -      Total dominant set edge: 67989
2026-05-11 02:42:58,030 - helper_functions - INFO -      Trainable edges: 54391.200000000004
2026-05-11 02:42:58,038 - root - INFO -   **** Getting 67989 dominant set edges
2026-05-11 02:42:58,171 - optuna.storages._rdb.storage - INFO - A new study created in RDB with name: Study_e_100K_1c2dcs
2026-05-11 02:43:36,157 - optuna.study.study - INFO - Trial 0 finished with value: 0.0015701899167405676 and parameters: {'n_layers': 1, 'embedding_dim': 128, 'lr': 0.06096872201159093, 'lambda_val': 0.0017765836374046412, 'batch_size': 3316, 'optimizer': 'SGD'}. Best is trial 0 with value: 0.0015701899167405676.
2026-05-11 02:44:30,317 - optuna.study.study - INFO - Trial 1 finished with value: 0.0019195503118539059 and parameters: {'n_layers': 2, 'embedding_dim': 128, 'lr': 5.042893460817231e-05, 'lambda_val': 0.0031501730854208237, 'batch_size': 737, 'optimizer': 'SGD'}. Best is trial 1 with value: 0.0019195503118539059.
2026-05-11 02:45:18,837 - optuna.study.study - INFO - Trial 2 finished with value: 0.04221240684506947 and parameters: {'n_layers': 1, 'embedding_dim': 96, 'lr': 3.546318938204764e-05, 'lambda_val': 8.056676190354778e-06, 'batch_size': 2772, 'optimizer': 'Adam'}. Best is trial 2 with value: 0.04221240684506947.
2026-05-11 02:45:53,952 - optuna.study.study - INFO - Trial 3 finished with value: 0.01852835865131438 and parameters: {'n_layers': 3, 'embedding_dim': 96, 'lr': 0.05767240181376282, 'lambda_val': 1.8148482280293798e-06, 'batch_size': 1296, 'optimizer': 'Adam'}. Best is trial 2 with value: 0.04221240684506947.
2026-05-11 02:46:23,654 - optuna.study.study - INFO - Trial 4 finished with value: 0.061976057564992075 and parameters: {'n_layers': 1, 'embedding_dim': 96, 'lr': 0.0004227588605772921, 'lambda_val': 8.561085602263265e-05, 'batch_size': 2425, 'optimizer': 'Adam'}. Best is trial 4 with value: 0.061976057564992075.
2026-05-11 02:46:33,655 - optuna.study._optimize - INFO - Trial 5 pruned. 
2026-05-11 02:47:02,646 - optuna.study.study - INFO - Trial 6 finished with value: 0.02573967429275568 and parameters: {'n_layers': 2, 'embedding_dim': 32, 'lr': 0.002293712146581822, 'lambda_val': 0.0006594250816228989, 'batch_size': 1056, 'optimizer': 'RMSprop'}. Best is trial 4 with value: 0.061976057564992075.
2026-05-11 02:47:08,737 - optuna.study._optimize - INFO - Trial 7 pruned. 
2026-05-11 02:47:13,719 - optuna.study._optimize - INFO - Trial 8 pruned. 
2026-05-11 02:47:41,910 - optuna.study.study - INFO - Trial 9 finished with value: 0.028794743028891772 and parameters: {'n_layers': 2, 'embedding_dim': 64, 'lr': 0.0007248573974510859, 'lambda_val': 0.010856794464326924, 'batch_size': 1461, 'optimizer': 'Adam'}. Best is trial 4 with value: 0.061976057564992075.
2026-05-11 02:48:05,160 - optuna.study.study - INFO - Trial 10 finished with value: 0.06511055418980558 and parameters: {'n_layers': 1, 'embedding_dim': 64, 'lr': 0.00032854345604459086, 'lambda_val': 3.833103693070164e-05, 'batch_size': 2125, 'optimizer': 'Adam'}. Best is trial 10 with value: 0.06511055418980558.
2026-05-11 02:48:28,533 - optuna.study.study - INFO - Trial 11 finished with value: 0.06477613516073287 and parameters: {'n_layers': 1, 'embedding_dim': 64, 'lr': 0.0002921668842197878, 'lambda_val': 3.3363930789149334e-05, 'batch_size': 2119, 'optimizer': 'Adam'}. Best is trial 10 with value: 0.06511055418980558.
2026-05-11 02:48:51,921 - optuna.study.study - INFO - Trial 12 finished with value: 0.08080125069764771 and parameters: {'n_layers': 1, 'embedding_dim': 64, 'lr': 0.0001400980555492515, 'lambda_val': 3.5303062952688686e-05, 'batch_size': 1821, 'optimizer': 'Adam'}. Best is trial 12 with value: 0.08080125069764771.
2026-05-11 02:49:15,994 - optuna.study.study - INFO - Trial 13 finished with value: 0.07022410207103015 and parameters: {'n_layers': 1, 'embedding_dim': 64, 'lr': 0.00011742900432934826, 'lambda_val': 4.116167924880829e-05, 'batch_size': 1808, 'optimizer': 'Adam'}. Best is trial 12 with value: 0.08080125069764771.
2026-05-11 02:49:42,972 - optuna.study._optimize - INFO - Trial 14 pruned. 
2026-05-11 02:50:08,141 - optuna.study.study - INFO - Trial 15 finished with value: 0.07871717482213719 and parameters: {'n_layers': 1, 'embedding_dim': 64, 'lr': 0.00010794979445600658, 'lambda_val': 0.00011924732344791913, 'batch_size': 2811, 'optimizer': 'RMSprop'}. Best is trial 12 with value: 0.08080125069764771.
2026-05-11 02:50:14,129 - optuna.study._optimize - INFO - Trial 16 pruned. 
2026-05-11 02:50:18,095 - optuna.study._optimize - INFO - Trial 17 pruned. 
2026-05-11 02:50:43,519 - optuna.study.study - INFO - Trial 18 finished with value: 0.05167497652423241 and parameters: {'n_layers': 1, 'embedding_dim': 64, 'lr': 0.00013881661020469823, 'lambda_val': 8.404216976920315e-06, 'batch_size': 4070, 'optimizer': 'RMSprop'}. Best is trial 12 with value: 0.08080125069764771.
2026-05-11 02:50:47,240 - optuna.study._optimize - INFO - Trial 19 pruned. 
2026-05-11 02:50:50,664 - optuna.study._optimize - INFO - Trial 20 pruned. 
2026-05-11 02:51:18,089 - optuna.study.study - INFO - Trial 21 finished with value: 0.09010673199911809 and parameters: {'n_layers': 1, 'embedding_dim': 64, 'lr': 0.0001669084836560024, 'lambda_val': 3.7028355734482356e-05, 'batch_size': 1775, 'optimizer': 'Adam'}. Best is trial 21 with value: 0.09010673199911809.
2026-05-11 02:51:44,882 - optuna.study.study - INFO - Trial 22 finished with value: 0.06882279617440275 and parameters: {'n_layers': 1, 'embedding_dim': 64, 'lr': 0.00020291625187079053, 'lambda_val': 1.77073561549929e-05, 'batch_size': 1793, 'optimizer': 'Adam'}. Best is trial 21 with value: 0.09010673199911809.
2026-05-11 02:51:48,901 - optuna.study._optimize - INFO - Trial 23 pruned. 
2026-05-11 02:51:52,691 - optuna.study._optimize - INFO - Trial 24 pruned. 
2026-05-11 02:51:56,976 - optuna.study._optimize - INFO - Trial 25 pruned. 
2026-05-11 02:52:03,905 - optuna.study._optimize - INFO - Trial 26 pruned. 
2026-05-11 02:52:30,525 - optuna.study.study - INFO - Trial 27 finished with value: 0.043135657296232324 and parameters: {'n_layers': 1, 'embedding_dim': 64, 'lr': 0.0017631495726811613, 'lambda_val': 0.000569068921862693, 'batch_size': 1062, 'optimizer': 'Adam'}. Best is trial 21 with value: 0.09010673199911809.
2026-05-11 02:52:35,148 - optuna.study._optimize - INFO - Trial 28 pruned. 
2026-05-11 02:52:39,604 - optuna.study._optimize - INFO - Trial 29 pruned. 
2026-05-11 02:52:43,299 - optuna.study._optimize - INFO - Trial 30 pruned. 
2026-05-11 02:52:47,232 - optuna.study._optimize - INFO - Trial 31 pruned. 
2026-05-11 02:52:50,601 - optuna.study._optimize - INFO - Trial 32 pruned. 
2026-05-11 02:52:54,323 - optuna.study._optimize - INFO - Trial 33 pruned. 
2026-05-11 02:52:57,802 - optuna.study._optimize - INFO - Trial 34 pruned. 
2026-05-11 02:53:01,789 - optuna.study._optimize - INFO - Trial 35 pruned. 
2026-05-11 02:53:05,740 - optuna.study._optimize - INFO - Trial 36 pruned. 
2026-05-11 02:53:33,921 - optuna.study.study - INFO - Trial 37 finished with value: 0.0625312237705745 and parameters: {'n_layers': 1, 'embedding_dim': 64, 'lr': 0.00038282373608356386, 'lambda_val': 1.590297792908964e-05, 'batch_size': 2639, 'optimizer': 'Adam'}. Best is trial 21 with value: 0.09010673199911809.
2026-05-11 02:53:38,935 - optuna.study._optimize - INFO - Trial 38 pruned. 
2026-05-11 02:54:06,737 - optuna.study.study - INFO - Trial 39 finished with value: 0.03628329569062179 and parameters: {'n_layers': 1, 'embedding_dim': 96, 'lr': 0.0010271037075503802, 'lambda_val': 6.0232637218536734e-05, 'batch_size': 2254, 'optimizer': 'Adam'}. Best is trial 21 with value: 0.09010673199911809.
2026-05-11 02:54:11,568 - optuna.study._optimize - INFO - Trial 40 pruned. 
2026-05-11 02:54:39,249 - optuna.study.study - INFO - Trial 41 finished with value: 0.0693131766044435 and parameters: {'n_layers': 1, 'embedding_dim': 64, 'lr': 0.00019034616358279576, 'lambda_val': 1.7725128597178283e-05, 'batch_size': 1834, 'optimizer': 'Adam'}. Best is trial 21 with value: 0.09010673199911809.
2026-05-11 02:55:06,187 - optuna.study.study - INFO - Trial 42 finished with value: 0.08189063926822053 and parameters: {'n_layers': 1, 'embedding_dim': 64, 'lr': 0.00015020204070839938, 'lambda_val': 9.390612609125352e-06, 'batch_size': 1777, 'optimizer': 'Adam'}. Best is trial 21 with value: 0.09010673199911809.
2026-05-11 02:55:34,973 - optuna.study.study - INFO - Trial 43 finished with value: 0.05357358593339298 and parameters: {'n_layers': 1, 'embedding_dim': 64, 'lr': 0.000502633542588711, 'lambda_val': 6.421819396412169e-06, 'batch_size': 2023, 'optimizer': 'Adam'}. Best is trial 21 with value: 0.09010673199911809.
2026-05-11 02:55:40,437 - optuna.study._optimize - INFO - Trial 44 pruned. 
2026-05-11 02:55:45,247 - optuna.study._optimize - INFO - Trial 45 pruned. 
2026-05-11 02:55:48,726 - optuna.study._optimize - INFO - Trial 46 pruned. 
2026-05-11 02:55:52,758 - optuna.study._optimize - INFO - Trial 47 pruned. 
2026-05-11 02:55:56,138 - optuna.study._optimize - INFO - Trial 48 pruned. 
2026-05-11 02:56:01,778 - optuna.study._optimize - INFO - Trial 49 pruned. 
2026-05-11 02:56:05,934 - optuna.study._optimize - INFO - Trial 50 pruned. 
2026-05-11 02:56:09,358 - optuna.study._optimize - INFO - Trial 51 pruned. 
2026-05-11 02:56:36,054 - optuna.study.study - INFO - Trial 52 finished with value: 0.07156401105424229 and parameters: {'n_layers': 1, 'embedding_dim': 64, 'lr': 0.0003937690372927255, 'lambda_val': 1.2012956865614182e-05, 'batch_size': 1450, 'optimizer': 'Adam'}. Best is trial 21 with value: 0.09010673199911809.
2026-05-11 02:57:02,854 - optuna.study.study - INFO - Trial 53 finished with value: 0.03743526991328264 and parameters: {'n_layers': 1, 'embedding_dim': 64, 'lr': 0.0009919736034918877, 'lambda_val': 1.0485568631823603e-05, 'batch_size': 1374, 'optimizer': 'Adam'}. Best is trial 21 with value: 0.09010673199911809.
2026-05-11 02:57:31,080 - optuna.study.study - INFO - Trial 54 finished with value: 0.05924762712035798 and parameters: {'n_layers': 1, 'embedding_dim': 64, 'lr': 0.00039851889571069647, 'lambda_val': 2.5113771500894005e-05, 'batch_size': 1522, 'optimizer': 'Adam'}. Best is trial 21 with value: 0.09010673199911809.
2026-05-11 02:57:34,469 - optuna.study._optimize - INFO - Trial 55 pruned. 
2026-05-11 02:58:01,697 - optuna.study.study - INFO - Trial 56 finished with value: 0.08246717313549978 and parameters: {'n_layers': 1, 'embedding_dim': 64, 'lr': 0.00026122155177150784, 'lambda_val': 1.1061753930552835e-05, 'batch_size': 1227, 'optimizer': 'Adam'}. Best is trial 21 with value: 0.09010673199911809.
2026-05-11 02:58:28,590 - optuna.study.study - INFO - Trial 57 finished with value: 0.06581221367314231 and parameters: {'n_layers': 1, 'embedding_dim': 64, 'lr': 0.000547503543858824, 'lambda_val': 1.0772912266009734e-05, 'batch_size': 1100, 'optimizer': 'Adam'}. Best is trial 21 with value: 0.09010673199911809.
2026-05-11 02:58:32,510 - optuna.study._optimize - INFO - Trial 58 pruned. 
2026-05-11 02:58:59,426 - optuna.study.study - INFO - Trial 59 finished with value: 0.06676853257223396 and parameters: {'n_layers': 1, 'embedding_dim': 64, 'lr': 0.000684826395846838, 'lambda_val': 1.5542488001676709e-06, 'batch_size': 1177, 'optimizer': 'Adam'}. Best is trial 21 with value: 0.09010673199911809.
2026-05-11 02:59:03,574 - optuna.study._optimize - INFO - Trial 60 pruned. 
2026-05-11 02:59:07,297 - optuna.study._optimize - INFO - Trial 61 pruned. 
2026-05-11 02:59:34,442 - optuna.study.study - INFO - Trial 62 finished with value: 0.06781576163623264 and parameters: {'n_layers': 1, 'embedding_dim': 64, 'lr': 0.0003330107810945412, 'lambda_val': 7.594176186825937e-06, 'batch_size': 1626, 'optimizer': 'Adam'}. Best is trial 21 with value: 0.09010673199911809.
2026-05-11 02:59:37,764 - optuna.study._optimize - INFO - Trial 63 pruned. 
2026-05-11 02:59:41,166 - optuna.study._optimize - INFO - Trial 64 pruned. 
2026-05-11 03:00:08,600 - optuna.study.study - INFO - Trial 65 finished with value: 0.07587041489682997 and parameters: {'n_layers': 1, 'embedding_dim': 64, 'lr': 0.00017409720934022656, 'lambda_val': 3.189362707279341e-05, 'batch_size': 2173, 'optimizer': 'RMSprop'}. Best is trial 21 with value: 0.09010673199911809.
2026-05-11 03:00:12,573 - optuna.study._optimize - INFO - Trial 66 pruned. 
2026-05-11 03:00:45,111 - optuna.study.study - INFO - Trial 67 finished with value: 0.05653703519838089 and parameters: {'n_layers': 1, 'embedding_dim': 128, 'lr': 0.00044059977030019664, 'lambda_val': 0.0002151082825652914, 'batch_size': 2047, 'optimizer': 'RMSprop'}. Best is trial 21 with value: 0.09010673199911809.
2026-05-11 03:00:49,319 - optuna.study._optimize - INFO - Trial 68 pruned. 
2026-05-11 03:00:53,186 - optuna.study._optimize - INFO - Trial 69 pruned. 
2026-05-11 03:00:57,981 - optuna.study._optimize - INFO - Trial 70 pruned. 
2026-05-11 03:01:02,079 - optuna.study._optimize - INFO - Trial 71 pruned. 
2026-05-11 03:01:06,751 - optuna.study._optimize - INFO - Trial 72 pruned. 
2026-05-11 03:01:10,692 - optuna.study._optimize - INFO - Trial 73 pruned. 
2026-05-11 03:01:15,078 - optuna.study._optimize - INFO - Trial 74 pruned. 
2026-05-11 03:01:41,995 - optuna.study.study - INFO - Trial 75 finished with value: 0.06700953058823429 and parameters: {'n_layers': 1, 'embedding_dim': 64, 'lr': 0.00023193749853324085, 'lambda_val': 2.256038637752959e-05, 'batch_size': 1451, 'optimizer': 'Adam'}. Best is trial 21 with value: 0.09010673199911809.
2026-05-11 03:01:46,663 - optuna.study._optimize - INFO - Trial 76 pruned. 
2026-05-11 03:01:54,226 - optuna.study._optimize - INFO - Trial 77 pruned. 
2026-05-11 03:01:58,093 - optuna.study._optimize - INFO - Trial 78 pruned. 
2026-05-11 03:02:01,948 - optuna.study._optimize - INFO - Trial 79 pruned. 
2026-05-11 03:02:06,160 - optuna.study._optimize - INFO - Trial 80 pruned. 
2026-05-11 03:02:09,968 - optuna.study._optimize - INFO - Trial 81 pruned. 
2026-05-11 03:02:13,370 - optuna.study._optimize - INFO - Trial 82 pruned. 
2026-05-11 03:02:16,915 - optuna.study._optimize - INFO - Trial 83 pruned. 
2026-05-11 03:02:20,739 - optuna.study._optimize - INFO - Trial 84 pruned. 
2026-05-11 03:02:55,290 - optuna.study.study - INFO - Trial 85 finished with value: 0.08933502155312166 and parameters: {'n_layers': 1, 'embedding_dim': 256, 'lr': 0.00021545462233217656, 'lambda_val': 0.0001317718345895148, 'batch_size': 2131, 'optimizer': 'Adam'}. Best is trial 21 with value: 0.09010673199911809.
2026-05-11 03:03:30,098 - optuna.study.study - INFO - Trial 86 finished with value: 0.0792478066092466 and parameters: {'n_layers': 1, 'embedding_dim': 256, 'lr': 0.0002265113124857221, 'lambda_val': 0.00012482310504513894, 'batch_size': 2260, 'optimizer': 'Adam'}. Best is trial 21 with value: 0.09010673199911809.
2026-05-11 03:04:05,004 - optuna.study.study - INFO - Trial 87 finished with value: 0.08048311014276414 and parameters: {'n_layers': 1, 'embedding_dim': 256, 'lr': 0.000422638737024873, 'lambda_val': 0.0002871588816856848, 'batch_size': 2258, 'optimizer': 'Adam'}. Best is trial 21 with value: 0.09010673199911809.
2026-05-11 03:04:40,577 - optuna.study.study - INFO - Trial 88 finished with value: 0.07095943330816727 and parameters: {'n_layers': 1, 'embedding_dim': 256, 'lr': 0.00023838881899623606, 'lambda_val': 0.0003989631501057843, 'batch_size': 2307, 'optimizer': 'Adam'}. Best is trial 21 with value: 0.09010673199911809.
2026-05-11 03:05:14,921 - optuna.study.study - INFO - Trial 89 finished with value: 0.054132327384180196 and parameters: {'n_layers': 1, 'embedding_dim': 256, 'lr': 0.0005236420933315404, 'lambda_val': 0.00010813092388171634, 'batch_size': 2130, 'optimizer': 'RMSprop'}. Best is trial 21 with value: 0.09010673199911809.
2026-05-11 03:05:53,098 - optuna.study.study - INFO - Trial 90 finished with value: 0.08216775730905461 and parameters: {'n_layers': 1, 'embedding_dim': 256, 'lr': 0.00028524014444627664, 'lambda_val': 0.00032319468032639554, 'batch_size': 2727, 'optimizer': 'Adam'}. Best is trial 21 with value: 0.09010673199911809.
2026-05-11 03:06:29,696 - optuna.study.study - INFO - Trial 91 finished with value: 0.07123457617214307 and parameters: {'n_layers': 1, 'embedding_dim': 256, 'lr': 0.0002867761416555144, 'lambda_val': 0.0006728474927990834, 'batch_size': 2658, 'optimizer': 'Adam'}. Best is trial 21 with value: 0.09010673199911809.
2026-05-11 03:06:34,591 - optuna.study._optimize - INFO - Trial 92 pruned. 
2026-05-11 03:06:39,009 - optuna.study._optimize - INFO - Trial 93 pruned. 
2026-05-11 03:07:22,347 - optuna.study.study - INFO - Trial 94 finished with value: 0.06656651474560157 and parameters: {'n_layers': 1, 'embedding_dim': 256, 'lr': 0.00045829143546733406, 'lambda_val': 0.000515863894232458, 'batch_size': 2525, 'optimizer': 'Adam'}. Best is trial 21 with value: 0.09010673199911809.
2026-05-11 03:07:58,753 - optuna.study.study - INFO - Trial 95 finished with value: 0.07748138028298261 and parameters: {'n_layers': 1, 'embedding_dim': 256, 'lr': 0.0003398174654485934, 'lambda_val': 0.0002549807281883841, 'batch_size': 2393, 'optimizer': 'Adam'}. Best is trial 21 with value: 0.09010673199911809.
2026-05-11 03:08:34,093 - optuna.study.study - INFO - Trial 96 finished with value: 0.06569932427496006 and parameters: {'n_layers': 1, 'embedding_dim': 256, 'lr': 0.000361958975481348, 'lambda_val': 0.0007875116907789075, 'batch_size': 2399, 'optimizer': 'Adam'}. Best is trial 21 with value: 0.09010673199911809.
2026-05-11 03:08:38,499 - optuna.study._optimize - INFO - Trial 97 pruned. 
2026-05-11 03:09:12,668 - optuna.study.study - INFO - Trial 98 finished with value: 0.06612280556142681 and parameters: {'n_layers': 1, 'embedding_dim': 256, 'lr': 0.0012505482350247054, 'lambda_val': 0.0015448040793163023, 'batch_size': 2264, 'optimizer': 'Adam'}. Best is trial 21 with value: 0.09010673199911809.
2026-05-11 03:09:48,083 - optuna.study.study - INFO - Trial 99 finished with value: 0.062264322805866336 and parameters: {'n_layers': 1, 'embedding_dim': 256, 'lr': 0.0005983231807336349, 'lambda_val': 0.0004103374981786711, 'batch_size': 2916, 'optimizer': 'Adam'}. Best is trial 21 with value: 0.09010673199911809.
2026-05-11 03:09:52,407 - optuna.study._optimize - INFO - Trial 100 pruned. 
2026-05-11 03:09:56,755 - optuna.study._optimize - INFO - Trial 101 pruned. 
2026-05-11 03:10:01,467 - optuna.study._optimize - INFO - Trial 102 pruned. 
2026-05-11 03:10:06,978 - optuna.study._optimize - INFO - Trial 103 pruned. 
2026-05-11 03:10:11,843 - optuna.study._optimize - INFO - Trial 104 pruned. 
2026-05-11 03:10:16,637 - optuna.study._optimize - INFO - Trial 105 pruned. 
2026-05-11 03:10:20,313 - optuna.study._optimize - INFO - Trial 106 pruned. 
2026-05-11 03:10:24,124 - optuna.study._optimize - INFO - Trial 107 pruned. 
2026-05-11 03:10:59,431 - optuna.study.study - INFO - Trial 108 finished with value: 0.07027219559172121 and parameters: {'n_layers': 1, 'embedding_dim': 256, 'lr': 0.00024081882419492554, 'lambda_val': 0.00015819847358240898, 'batch_size': 3086, 'optimizer': 'RMSprop'}. Best is trial 21 with value: 0.09010673199911809.
2026-05-11 03:11:03,572 - optuna.study._optimize - INFO - Trial 109 pruned. 
2026-05-11 03:11:08,335 - optuna.study._optimize - INFO - Trial 110 pruned. 
2026-05-11 03:11:42,893 - optuna.study.study - INFO - Trial 111 finished with value: 0.08908801055536412 and parameters: {'n_layers': 1, 'embedding_dim': 256, 'lr': 0.0003913983719016427, 'lambda_val': 5.578358864013932e-06, 'batch_size': 1380, 'optimizer': 'Adam'}. Best is trial 21 with value: 0.09010673199911809.
2026-05-11 03:11:47,086 - optuna.study._optimize - INFO - Trial 112 pruned. 
2026-05-11 03:11:51,273 - optuna.study._optimize - INFO - Trial 113 pruned. 
