2026-05-11 02:04:59,498 - optuna.study.study - INFO - Trial 61 finished with value: 0.07499715968334117 and parameters: {'n_layers': 1, 'embedding_dim': 256, 'lr': 0.00016123170597335775, 'lambda_val': 1.4891608812793919e-06, 'batch_size': 2864, 'optimizer': 'RMSprop'}. Best is trial 15 with value: 0.10720122396305293.
2026-05-11 02:05:04,111 - optuna.study._optimize - INFO - Trial 62 pruned. 
2026-05-11 02:05:43,505 - optuna.study.study - INFO - Trial 63 finished with value: 0.06185210035850028 and parameters: {'n_layers': 1, 'embedding_dim': 256, 'lr': 0.0005799751101178426, 'lambda_val': 2.4666364701465974e-06, 'batch_size': 2668, 'optimizer': 'RMSprop'}. Best is trial 15 with value: 0.10720122396305293.
2026-05-11 02:05:54,507 - optuna.study._optimize - INFO - Trial 64 pruned. 
2026-05-11 02:06:30,228 - optuna.study.study - INFO - Trial 65 finished with value: 0.09993332057614306 and parameters: {'n_layers': 1, 'embedding_dim': 256, 'lr': 0.0001190505164877863, 'lambda_val': 1.7947454717098572e-05, 'batch_size': 3489, 'optimizer': 'Adam'}. Best is trial 15 with value: 0.10720122396305293.
2026-05-11 02:07:05,360 - optuna.study.study - INFO - Trial 66 finished with value: 0.07367754352400932 and parameters: {'n_layers': 1, 'embedding_dim': 256, 'lr': 0.00019959897509429887, 'lambda_val': 1.8397645923399772e-05, 'batch_size': 3502, 'optimizer': 'Adam'}. Best is trial 15 with value: 0.10720122396305293.
2026-05-11 02:07:09,793 - optuna.study._optimize - INFO - Trial 67 pruned. 
2026-05-11 02:07:13,531 - optuna.study._optimize - INFO - Trial 68 pruned. 
2026-05-11 02:07:17,905 - optuna.study._optimize - INFO - Trial 69 pruned. 
2026-05-11 02:07:23,031 - optuna.study._optimize - INFO - Trial 70 pruned. 
2026-05-11 02:07:57,690 - optuna.study.study - INFO - Trial 71 finished with value: 0.06780949567315296 and parameters: {'n_layers': 1, 'embedding_dim': 256, 'lr': 0.00014970844187078594, 'lambda_val': 2.7292637255214037e-06, 'batch_size': 3144, 'optimizer': 'RMSprop'}. Best is trial 15 with value: 0.10720122396305293.
2026-05-11 02:08:02,217 - optuna.study._optimize - INFO - Trial 72 pruned. 
2026-05-11 02:08:37,719 - optuna.study.study - INFO - Trial 73 finished with value: 0.08675777696496612 and parameters: {'n_layers': 1, 'embedding_dim': 256, 'lr': 0.000255934103301682, 'lambda_val': 4.07462086743689e-06, 'batch_size': 3454, 'optimizer': 'Adam'}. Best is trial 15 with value: 0.10720122396305293.
2026-05-11 02:09:13,370 - optuna.study.study - INFO - Trial 74 finished with value: 0.06566458365927703 and parameters: {'n_layers': 1, 'embedding_dim': 256, 'lr': 0.00027072671468309926, 'lambda_val': 9.722675483309669e-06, 'batch_size': 3521, 'optimizer': 'Adam'}. Best is trial 15 with value: 0.10720122396305293.
2026-05-11 02:09:17,686 - optuna.study._optimize - INFO - Trial 75 pruned. 
2026-05-11 02:09:22,062 - optuna.study._optimize - INFO - Trial 76 pruned. 
2026-05-11 02:09:57,552 - optuna.study.study - INFO - Trial 77 finished with value: 0.05980194469477986 and parameters: {'n_layers': 1, 'embedding_dim': 256, 'lr': 0.0004705526146588226, 'lambda_val': 3.881627698500185e-06, 'batch_size': 3248, 'optimizer': 'Adam'}. Best is trial 15 with value: 0.10720122396305293.
2026-05-11 02:10:26,681 - optuna.study.study - INFO - Trial 78 finished with value: 0.04597649985219085 and parameters: {'n_layers': 1, 'embedding_dim': 64, 'lr': 0.0008986736914230862, 'lambda_val': 6.205171143579857e-06, 'batch_size': 2036, 'optimizer': 'Adam'}. Best is trial 15 with value: 0.10720122396305293.
2026-05-11 02:10:31,068 - optuna.study._optimize - INFO - Trial 79 pruned. 
2026-05-11 02:10:35,355 - optuna.study._optimize - INFO - Trial 80 pruned. 
2026-05-11 02:11:09,930 - optuna.study.study - INFO - Trial 81 finished with value: 0.07955932685538011 and parameters: {'n_layers': 1, 'embedding_dim': 256, 'lr': 0.0001496795774972255, 'lambda_val': 1.3826581044905502e-06, 'batch_size': 2756, 'optimizer': 'RMSprop'}. Best is trial 15 with value: 0.10720122396305293.
2026-05-11 02:11:44,049 - optuna.study.study - INFO - Trial 82 finished with value: 0.07826781180777938 and parameters: {'n_layers': 1, 'embedding_dim': 256, 'lr': 0.00016032650151529427, 'lambda_val': 1.6109733568859863e-06, 'batch_size': 2723, 'optimizer': 'RMSprop'}. Best is trial 15 with value: 0.10720122396305293.
2026-05-11 02:12:19,183 - optuna.study.study - INFO - Trial 83 finished with value: 0.05140850812348054 and parameters: {'n_layers': 1, 'embedding_dim': 256, 'lr': 0.00034771884109667663, 'lambda_val': 2.2006379636045544e-06, 'batch_size': 3152, 'optimizer': 'RMSprop'}. Best is trial 15 with value: 0.10720122396305293.
2026-05-11 02:12:24,081 - optuna.study._optimize - INFO - Trial 84 pruned. 
2026-05-11 02:12:29,587 - optuna.study._optimize - INFO - Trial 85 pruned. 
2026-05-11 02:12:33,453 - optuna.study._optimize - INFO - Trial 86 pruned. 
2026-05-11 02:12:39,421 - optuna.study._optimize - INFO - Trial 87 pruned. 
2026-05-11 02:12:43,968 - optuna.study._optimize - INFO - Trial 88 pruned. 
2026-05-11 02:13:13,546 - optuna.study.study - INFO - Trial 89 finished with value: 0.03141866702343827 and parameters: {'n_layers': 1, 'embedding_dim': 32, 'lr': 0.0024330118001891993, 'lambda_val': 4.793738983481536e-06, 'batch_size': 2498, 'optimizer': 'Adam'}. Best is trial 15 with value: 0.10720122396305293.
2026-05-11 02:13:17,863 - optuna.study._optimize - INFO - Trial 90 pruned. 
2026-05-11 02:13:52,209 - optuna.study.study - INFO - Trial 91 finished with value: 0.07262737531316449 and parameters: {'n_layers': 1, 'embedding_dim': 256, 'lr': 0.00016177361366117484, 'lambda_val': 1.8279679247414965e-06, 'batch_size': 2716, 'optimizer': 'RMSprop'}. Best is trial 15 with value: 0.10720122396305293.
2026-05-11 02:14:28,727 - optuna.study.study - INFO - Trial 92 finished with value: 0.07836930106713164 and parameters: {'n_layers': 1, 'embedding_dim': 256, 'lr': 0.00014347037154888495, 'lambda_val': 1.7221651167063589e-06, 'batch_size': 2926, 'optimizer': 'RMSprop'}. Best is trial 15 with value: 0.10720122396305293.
2026-05-11 02:14:33,059 - optuna.study._optimize - INFO - Trial 93 pruned. 
2026-05-11 02:15:09,644 - optuna.study.study - INFO - Trial 94 finished with value: 0.06270800918976024 and parameters: {'n_layers': 1, 'embedding_dim': 256, 'lr': 0.00028571260386185487, 'lambda_val': 2.4451315157666933e-06, 'batch_size': 3278, 'optimizer': 'RMSprop'}. Best is trial 15 with value: 0.10720122396305293.
2026-05-11 02:15:13,829 - optuna.study._optimize - INFO - Trial 95 pruned. 
2026-05-11 02:15:17,961 - optuna.study._optimize - INFO - Trial 96 pruned. 
2026-05-11 02:15:53,719 - optuna.study.study - INFO - Trial 97 finished with value: 0.06324656303334682 and parameters: {'n_layers': 1, 'embedding_dim': 256, 'lr': 0.00018606583218338626, 'lambda_val': 3.353397622135681e-06, 'batch_size': 2806, 'optimizer': 'RMSprop'}. Best is trial 15 with value: 0.10720122396305293.
2026-05-11 02:15:57,560 - optuna.study._optimize - INFO - Trial 98 pruned. 
2026-05-11 02:16:01,868 - optuna.study._optimize - INFO - Trial 99 pruned. 
2026-05-11 02:16:06,982 - optuna.study._optimize - INFO - Trial 100 pruned. 
2026-05-11 02:16:13,646 - optuna.study._optimize - INFO - Trial 101 pruned. 
2026-05-11 02:16:17,732 - optuna.study._optimize - INFO - Trial 102 pruned. 
2026-05-11 02:16:52,493 - optuna.study.study - INFO - Trial 103 finished with value: 0.08160743302285686 and parameters: {'n_layers': 1, 'embedding_dim': 256, 'lr': 0.00015115199020077118, 'lambda_val': 1.0564004771404792e-06, 'batch_size': 2434, 'optimizer': 'RMSprop'}. Best is trial 15 with value: 0.10720122396305293.
2026-05-11 02:16:56,698 - optuna.study._optimize - INFO - Trial 104 pruned. 
2026-05-11 02:17:34,347 - optuna.study.study - INFO - Trial 105 finished with value: 0.06731003580639003 and parameters: {'n_layers': 1, 'embedding_dim': 256, 'lr': 0.00022445642837371936, 'lambda_val': 2.7108358504260552e-06, 'batch_size': 3314, 'optimizer': 'RMSprop'}. Best is trial 15 with value: 0.10720122396305293.
2026-05-11 02:17:38,599 - optuna.study._optimize - INFO - Trial 106 pruned. 
2026-05-11 02:17:43,712 - optuna.study._optimize - INFO - Trial 107 pruned. 
2026-05-11 02:18:18,577 - optuna.study.study - INFO - Trial 108 finished with value: 0.06514995726109278 and parameters: {'n_layers': 1, 'embedding_dim': 96, 'lr': 0.00029271783004364694, 'lambda_val': 1.3982545874145527e-06, 'batch_size': 3005, 'optimizer': 'Adam'}. Best is trial 15 with value: 0.10720122396305293.
2026-05-11 02:18:22,030 - optuna.study._optimize - INFO - Trial 109 pruned. 
2026-05-11 02:18:25,799 - optuna.study._optimize - INFO - Trial 110 pruned. 
2026-05-11 02:19:00,593 - optuna.study.study - INFO - Trial 111 finished with value: 0.06396765857264607 and parameters: {'n_layers': 1, 'embedding_dim': 256, 'lr': 0.0001815330216394666, 'lambda_val': 1.7242495075169758e-06, 'batch_size': 2841, 'optimizer': 'RMSprop'}. Best is trial 15 with value: 0.10720122396305293.
2026-05-11 02:19:37,002 - optuna.study.study - INFO - Trial 112 finished with value: 0.062232794100683796 and parameters: {'n_layers': 1, 'embedding_dim': 256, 'lr': 0.0004020649482950497, 'lambda_val': 1.0077371836312911e-06, 'batch_size': 2701, 'optimizer': 'RMSprop'}. Best is trial 15 with value: 0.10720122396305293.
2026-05-11 02:19:41,596 - optuna.study._optimize - INFO - Trial 113 pruned. 
2026-05-11 02:20:16,055 - optuna.study.study - INFO - Trial 114 finished with value: 0.07438672368588274 and parameters: {'n_layers': 1, 'embedding_dim': 256, 'lr': 0.00016211232491491586, 'lambda_val': 1.547999162903287e-05, 'batch_size': 3453, 'optimizer': 'RMSprop'}. Best is trial 15 with value: 0.10720122396305293.
2026-05-11 02:20:51,824 - optuna.study.study - INFO - Trial 115 finished with value: 0.06333732058561174 and parameters: {'n_layers': 1, 'embedding_dim': 256, 'lr': 0.0001877240912268097, 'lambda_val': 2.399790886837123e-06, 'batch_size': 3532, 'optimizer': 'Adam'}. Best is trial 15 with value: 0.10720122396305293.
2026-05-11 02:20:55,931 - optuna.study._optimize - INFO - Trial 116 pruned. 
2026-05-11 02:21:00,129 - optuna.study._optimize - INFO - Trial 117 pruned. 
2026-05-11 02:21:05,172 - optuna.study._optimize - INFO - Trial 118 pruned. 
2026-05-11 02:21:09,609 - optuna.study._optimize - INFO - Trial 119 pruned. 
2026-05-11 02:21:13,972 - optuna.study._optimize - INFO - Trial 120 pruned. 
2026-05-11 02:21:18,377 - optuna.study._optimize - INFO - Trial 121 pruned. 
2026-05-11 02:21:53,040 - optuna.study.study - INFO - Trial 122 finished with value: 0.06240065357252715 and parameters: {'n_layers': 1, 'embedding_dim': 256, 'lr': 0.0001749890579669107, 'lambda_val': 1.0130851808044673e-06, 'batch_size': 2798, 'optimizer': 'RMSprop'}. Best is trial 15 with value: 0.10720122396305293.
2026-05-11 02:21:57,720 - optuna.study._optimize - INFO - Trial 123 pruned. 
2026-05-11 02:22:02,127 - optuna.study._optimize - INFO - Trial 124 pruned. 
2026-05-11 02:22:06,525 - optuna.study._optimize - INFO - Trial 125 pruned. 
2026-05-11 02:22:53,773 - optuna.study.study - INFO - Trial 126 finished with value: 0.06951692738174792 and parameters: {'n_layers': 1, 'embedding_dim': 256, 'lr': 0.00033673461542133454, 'lambda_val': 1.2929176963920477e-06, 'batch_size': 3343, 'optimizer': 'Adam'}. Best is trial 15 with value: 0.10720122396305293.
2026-05-11 02:23:02,836 - optuna.study._optimize - INFO - Trial 127 pruned. 
2026-05-11 02:23:07,568 - optuna.study._optimize - INFO - Trial 128 pruned. 
2026-05-11 02:23:11,632 - optuna.study._optimize - INFO - Trial 129 pruned. 
2026-05-11 02:23:48,002 - optuna.study.study - INFO - Trial 130 finished with value: 0.06348065618101272 and parameters: {'n_layers': 1, 'embedding_dim': 96, 'lr': 0.0002509193615768995, 'lambda_val': 1.9567840841541468e-06, 'batch_size': 3164, 'optimizer': 'Adam'}. Best is trial 15 with value: 0.10720122396305293.
2026-05-11 02:24:26,529 - optuna.study.study - INFO - Trial 131 finished with value: 0.07336773892845765 and parameters: {'n_layers': 1, 'embedding_dim': 256, 'lr': 0.00016349803667067866, 'lambda_val': 1.2439093534711394e-06, 'batch_size': 2844, 'optimizer': 'RMSprop'}. Best is trial 15 with value: 0.10720122396305293.
2026-05-11 02:24:31,465 - optuna.study._optimize - INFO - Trial 132 pruned. 
2026-05-11 02:25:08,853 - optuna.study.study - INFO - Trial 133 finished with value: 0.07185789647563125 and parameters: {'n_layers': 1, 'embedding_dim': 256, 'lr': 0.00020356998006351913, 'lambda_val': 1.0173915535756575e-06, 'batch_size': 2898, 'optimizer': 'RMSprop'}. Best is trial 15 with value: 0.10720122396305293.
2026-05-11 02:25:47,641 - optuna.study.study - INFO - Trial 134 finished with value: 0.07292105045295125 and parameters: {'n_layers': 1, 'embedding_dim': 256, 'lr': 0.00016196320419417288, 'lambda_val': 3.2697183783526738e-06, 'batch_size': 2666, 'optimizer': 'RMSprop'}. Best is trial 15 with value: 0.10720122396305293.
2026-05-11 02:25:52,238 - optuna.study._optimize - INFO - Trial 135 pruned. 
2026-05-11 02:25:58,615 - optuna.study._optimize - INFO - Trial 136 pruned. 
2026-05-11 02:26:02,790 - optuna.study._optimize - INFO - Trial 137 pruned. 
2026-05-11 02:26:07,760 - optuna.study._optimize - INFO - Trial 138 pruned. 
2026-05-11 02:26:11,668 - optuna.study._optimize - INFO - Trial 139 pruned. 
2026-05-11 02:26:48,419 - optuna.study.study - INFO - Trial 140 finished with value: 0.07992581608864634 and parameters: {'n_layers': 1, 'embedding_dim': 256, 'lr': 0.00018702004498027087, 'lambda_val': 1.957589948636969e-06, 'batch_size': 2322, 'optimizer': 'RMSprop'}. Best is trial 15 with value: 0.10720122396305293.
2026-05-11 02:26:52,668 - optuna.study._optimize - INFO - Trial 141 pruned. 
2026-05-11 02:27:35,230 - optuna.study.study - INFO - Trial 142 finished with value: 0.07091643102158339 and parameters: {'n_layers': 1, 'embedding_dim': 256, 'lr': 0.00019898541624338632, 'lambda_val': 1.2395952035936782e-06, 'batch_size': 2202, 'optimizer': 'RMSprop'}. Best is trial 15 with value: 0.10720122396305293.
2026-05-11 02:27:39,468 - optuna.study._optimize - INFO - Trial 143 pruned. 
2026-05-11 02:27:44,093 - optuna.study._optimize - INFO - Trial 144 pruned. 
2026-05-11 02:28:19,099 - optuna.study.study - INFO - Trial 145 finished with value: 0.06898276209874503 and parameters: {'n_layers': 1, 'embedding_dim': 256, 'lr': 0.00018715037147242977, 'lambda_val': 1.491693477123007e-06, 'batch_size': 2969, 'optimizer': 'RMSprop'}. Best is trial 15 with value: 0.10720122396305293.
2026-05-11 02:28:57,118 - optuna.study.study - INFO - Trial 146 finished with value: 0.06996689162174334 and parameters: {'n_layers': 1, 'embedding_dim': 256, 'lr': 0.0002648080785378728, 'lambda_val': 3.7795542566367315e-06, 'batch_size': 3480, 'optimizer': 'RMSprop'}. Best is trial 15 with value: 0.10720122396305293.
2026-05-11 02:29:01,457 - optuna.study._optimize - INFO - Trial 147 pruned. 
2026-05-11 02:29:05,554 - optuna.study._optimize - INFO - Trial 148 pruned. 
2026-05-11 02:29:09,342 - optuna.study._optimize - INFO - Trial 149 pruned. 
2026-05-11 02:29:14,974 - optuna.study._optimize - INFO - Trial 150 pruned. 
2026-05-11 02:29:52,052 - optuna.study.study - INFO - Trial 151 finished with value: 0.06759896624203983 and parameters: {'n_layers': 1, 'embedding_dim': 256, 'lr': 0.0002039674306771899, 'lambda_val': 5.806654321957128e-06, 'batch_size': 3287, 'optimizer': 'RMSprop'}. Best is trial 15 with value: 0.10720122396305293.
2026-05-11 02:29:56,490 - optuna.study._optimize - INFO - Trial 152 pruned. 
2026-05-11 02:30:30,903 - optuna.study.study - INFO - Trial 153 finished with value: 0.07827486109162886 and parameters: {'n_layers': 1, 'embedding_dim': 256, 'lr': 0.0001632084894011694, 'lambda_val': 2.536366264576634e-06, 'batch_size': 3059, 'optimizer': 'RMSprop'}. Best is trial 15 with value: 0.10720122396305293.
2026-05-11 02:31:05,984 - optuna.study.study - INFO - Trial 154 finished with value: 0.06147715645912164 and parameters: {'n_layers': 1, 'embedding_dim': 256, 'lr': 0.00024388862961038203, 'lambda_val': 2.4191806523085603e-06, 'batch_size': 3036, 'optimizer': 'RMSprop'}. Best is trial 15 with value: 0.10720122396305293.
2026-05-11 02:31:10,614 - optuna.study._optimize - INFO - Trial 155 pruned. 
2026-05-11 02:31:48,596 - optuna.study.study - INFO - Trial 156 finished with value: 0.07207994404336494 and parameters: {'n_layers': 1, 'embedding_dim': 256, 'lr': 0.00017510059868844048, 'lambda_val': 6.640660960612518e-05, 'batch_size': 2685, 'optimizer': 'Adam'}. Best is trial 15 with value: 0.10720122396305293.
2026-05-11 02:31:53,393 - optuna.study._optimize - INFO - Trial 157 pruned. 
2026-05-11 02:31:58,043 - optuna.study._optimize - INFO - Trial 158 pruned. 
2026-05-11 02:32:32,161 - optuna.study.study - INFO - Trial 159 finished with value: 0.06831873068339653 and parameters: {'n_layers': 1, 'embedding_dim': 256, 'lr': 0.0003315588499000954, 'lambda_val': 1.2825244165419394e-06, 'batch_size': 3197, 'optimizer': 'RMSprop'}. Best is trial 15 with value: 0.10720122396305293.
2026-05-11 02:32:36,621 - optuna.study._optimize - INFO - Trial 160 pruned. 
2026-05-11 02:32:41,371 - optuna.study._optimize - INFO - Trial 161 pruned. 
2026-05-11 02:33:18,047 - optuna.study.study - INFO - Trial 162 finished with value: 0.060916194418359285 and parameters: {'n_layers': 1, 'embedding_dim': 256, 'lr': 0.00021757829080849158, 'lambda_val': 3.0079248910278515e-06, 'batch_size': 2899, 'optimizer': 'RMSprop'}. Best is trial 15 with value: 0.10720122396305293.
2026-05-11 02:33:22,632 - optuna.study._optimize - INFO - Trial 163 pruned. 
2026-05-11 02:33:57,516 - optuna.study.study - INFO - Trial 164 finished with value: 0.0778922368424133 and parameters: {'n_layers': 1, 'embedding_dim': 256, 'lr': 0.00017044252404671683, 'lambda_val': 2.3144940771682055e-06, 'batch_size': 3004, 'optimizer': 'RMSprop'}. Best is trial 15 with value: 0.10720122396305293.
2026-05-11 02:34:01,820 - optuna.study._optimize - INFO - Trial 165 pruned. 
2026-05-11 02:34:37,934 - optuna.study.study - INFO - Trial 166 finished with value: 0.07711162492538161 and parameters: {'n_layers': 1, 'embedding_dim': 256, 'lr': 0.00018249427650108158, 'lambda_val': 2.3646534097451343e-06, 'batch_size': 2741, 'optimizer': 'RMSprop'}. Best is trial 15 with value: 0.10720122396305293.
2026-05-11 02:34:42,469 - optuna.study._optimize - INFO - Trial 167 pruned. 
2026-05-11 02:35:12,187 - optuna.study.study - INFO - Trial 168 finished with value: 0.0641362433569568 and parameters: {'n_layers': 1, 'embedding_dim': 128, 'lr': 0.00024504768733964557, 'lambda_val': 2.476980047143799e-06, 'batch_size': 2417, 'optimizer': 'RMSprop'}. Best is trial 15 with value: 0.10720122396305293.
2026-05-11 02:35:17,005 - optuna.study._optimize - INFO - Trial 169 pruned. 
2026-05-11 02:35:21,379 - optuna.study._optimize - INFO - Trial 170 pruned. 
2026-05-11 02:35:56,245 - optuna.study.study - INFO - Trial 171 finished with value: 0.07057596556882365 and parameters: {'n_layers': 1, 'embedding_dim': 256, 'lr': 0.00017467554014372012, 'lambda_val': 1.4388027138724722e-06, 'batch_size': 2929, 'optimizer': 'RMSprop'}. Best is trial 15 with value: 0.10720122396305293.
2026-05-11 02:36:01,663 - optuna.study._optimize - INFO - Trial 172 pruned. 
2026-05-11 02:36:36,277 - optuna.study.study - INFO - Trial 173 finished with value: 0.07278969968005954 and parameters: {'n_layers': 1, 'embedding_dim': 256, 'lr': 0.00016368137571202285, 'lambda_val': 2.4471717911573913e-06, 'batch_size': 2973, 'optimizer': 'RMSprop'}. Best is trial 15 with value: 0.10720122396305293.
2026-05-11 02:36:41,069 - optuna.study._optimize - INFO - Trial 174 pruned. 
2026-05-11 02:37:16,590 - optuna.study.study - INFO - Trial 175 finished with value: 0.06980720537981866 and parameters: {'n_layers': 1, 'embedding_dim': 256, 'lr': 0.00021950751807124072, 'lambda_val': 1.4847192995008194e-06, 'batch_size': 3275, 'optimizer': 'Adam'}. Best is trial 15 with value: 0.10720122396305293.
2026-05-11 02:37:51,306 - optuna.study.study - INFO - Trial 176 finished with value: 0.06850879502612463 and parameters: {'n_layers': 1, 'embedding_dim': 256, 'lr': 0.00028256038882727296, 'lambda_val': 1.9523887265155133e-06, 'batch_size': 2357, 'optimizer': 'RMSprop'}. Best is trial 15 with value: 0.10720122396305293.
2026-05-11 02:37:57,389 - optuna.study._optimize - INFO - Trial 177 pruned. 
2026-05-11 02:38:37,000 - optuna.study.study - INFO - Trial 178 finished with value: 0.0667096001510464 and parameters: {'n_layers': 1, 'embedding_dim': 256, 'lr': 0.0001757585503830287, 'lambda_val': 2.765650030761411e-06, 'batch_size': 2821, 'optimizer': 'RMSprop'}. Best is trial 15 with value: 0.10720122396305293.
2026-05-11 02:38:41,196 - optuna.study._optimize - INFO - Trial 179 pruned. 
2026-05-11 02:38:45,580 - optuna.study._optimize - INFO - Trial 180 pruned. 
2026-05-11 02:39:21,091 - optuna.study.study - INFO - Trial 181 finished with value: 0.06642366430888665 and parameters: {'n_layers': 1, 'embedding_dim': 256, 'lr': 0.00019405085122479855, 'lambda_val': 3.4423901427116943e-06, 'batch_size': 3219, 'optimizer': 'RMSprop'}. Best is trial 15 with value: 0.10720122396305293.
2026-05-11 02:39:56,813 - optuna.study.study - INFO - Trial 182 finished with value: 0.08118826705460012 and parameters: {'n_layers': 1, 'embedding_dim': 256, 'lr': 0.00015891456295370274, 'lambda_val': 2.2999192102260064e-06, 'batch_size': 3074, 'optimizer': 'RMSprop'}. Best is trial 15 with value: 0.10720122396305293.
2026-05-11 02:40:01,152 - optuna.study._optimize - INFO - Trial 183 pruned. 
2026-05-11 02:40:05,471 - optuna.study._optimize - INFO - Trial 184 pruned. 
2026-05-11 02:40:09,789 - optuna.study._optimize - INFO - Trial 185 pruned. 
2026-05-11 02:40:14,648 - optuna.study._optimize - INFO - Trial 186 pruned. 
2026-05-11 02:40:18,830 - optuna.study._optimize - INFO - Trial 187 pruned. 
2026-05-11 02:40:23,620 - optuna.study._optimize - INFO - Trial 188 pruned. 
