2026-05-11 12:06:34,423 - optuna.study.study - INFO - Trial 185 finished with value: 0.08735051178525946 and parameters: {'n_layers': 1, 'embedding_dim': 256, 'lr': 0.004944071417312517, 'lambda_val': 0.0015127450775755716, 'batch_size': 1593, 'optimizer': 'RMSprop'}. Best is trial 143 with value: 0.0902858427931235.
2026-05-11 12:06:42,221 - optuna.study._optimize - INFO - Trial 186 pruned. 
2026-05-11 12:07:13,562 - optuna.study._optimize - INFO - Trial 187 pruned. 
2026-05-11 12:07:25,663 - optuna.study._optimize - INFO - Trial 188 pruned. 
2026-05-11 12:07:46,207 - optuna.study._optimize - INFO - Trial 189 pruned. 
2026-05-11 12:08:19,793 - optuna.study.study - INFO - Trial 190 finished with value: 0.08785718874320064 and parameters: {'n_layers': 1, 'embedding_dim': 256, 'lr': 0.005285979799339785, 'lambda_val': 0.0007890178455526682, 'batch_size': 1347, 'optimizer': 'RMSprop'}. Best is trial 143 with value: 0.0902858427931235.
2026-05-11 12:08:26,033 - optuna.study._optimize - INFO - Trial 191 pruned. 
2026-05-11 12:08:59,415 - optuna.study.study - INFO - Trial 192 finished with value: 0.09339583857196082 and parameters: {'n_layers': 1, 'embedding_dim': 256, 'lr': 0.0071468999357604205, 'lambda_val': 0.001064593853557518, 'batch_size': 1401, 'optimizer': 'RMSprop'}. Best is trial 192 with value: 0.09339583857196082.
2026-05-11 12:09:33,574 - optuna.study.study - INFO - Trial 193 finished with value: 0.08316261084569984 and parameters: {'n_layers': 1, 'embedding_dim': 256, 'lr': 0.0074002485291296775, 'lambda_val': 0.001038646914349615, 'batch_size': 1303, 'optimizer': 'RMSprop'}. Best is trial 192 with value: 0.09339583857196082.
2026-05-11 12:10:07,671 - optuna.study.study - INFO - Trial 194 finished with value: 0.08449153386021296 and parameters: {'n_layers': 1, 'embedding_dim': 256, 'lr': 0.005836483755105471, 'lambda_val': 0.0005943312169957343, 'batch_size': 1436, 'optimizer': 'RMSprop'}. Best is trial 192 with value: 0.09339583857196082.
2026-05-11 12:10:42,691 - optuna.study.study - INFO - Trial 195 finished with value: 0.08081737813536718 and parameters: {'n_layers': 1, 'embedding_dim': 256, 'lr': 0.006788825381687194, 'lambda_val': 0.0008798075897278633, 'batch_size': 1413, 'optimizer': 'RMSprop'}. Best is trial 192 with value: 0.09339583857196082.
2026-05-11 12:10:47,483 - optuna.study._optimize - INFO - Trial 196 pruned. 
2026-05-11 12:10:51,944 - optuna.study._optimize - INFO - Trial 197 pruned. 
2026-05-11 12:10:58,832 - optuna.study._optimize - INFO - Trial 198 pruned. 
2026-05-11 12:11:08,345 - optuna.study._optimize - INFO - Trial 199 pruned. 
2026-05-11 12:11:35,122 - root - INFO -   **** Training e_100K_1c3dcs_rand2
2026-05-11 12:11:35,135 - root - INFO -   **** Getting 56335/65410 random edges
2026-05-11 12:11:35,222 - optuna.storages._rdb.storage - INFO - A new study created in RDB with name: Study_e_100K_1c3dcs_rand2
2026-05-11 12:12:23,324 - optuna.study.study - INFO - Trial 0 finished with value: 0.0015380680902137686 and parameters: {'n_layers': 3, 'embedding_dim': 32, 'lr': 0.003064607600813809, 'lambda_val': 2.7853300491272996e-06, 'batch_size': 1351, 'optimizer': 'SGD'}. Best is trial 0 with value: 0.0015380680902137686.
2026-05-11 12:13:07,089 - optuna.study.study - INFO - Trial 1 finished with value: 0.022113753128149817 and parameters: {'n_layers': 1, 'embedding_dim': 32, 'lr': 0.03418274296707349, 'lambda_val': 3.4361723113597394e-06, 'batch_size': 3280, 'optimizer': 'Adam'}. Best is trial 1 with value: 0.022113753128149817.
2026-05-11 12:13:40,027 - optuna.study.study - INFO - Trial 2 finished with value: 0.027181738137811436 and parameters: {'n_layers': 2, 'embedding_dim': 96, 'lr': 0.0026897132359539437, 'lambda_val': 0.01993686166260287, 'batch_size': 2132, 'optimizer': 'RMSprop'}. Best is trial 2 with value: 0.027181738137811436.
2026-05-11 12:14:37,195 - optuna.study.study - INFO - Trial 3 finished with value: 0.033233895375887064 and parameters: {'n_layers': 3, 'embedding_dim': 256, 'lr': 0.008328372216061114, 'lambda_val': 5.0634940808796255e-06, 'batch_size': 3896, 'optimizer': 'Adam'}. Best is trial 3 with value: 0.033233895375887064.
2026-05-11 12:15:09,816 - optuna.study.study - INFO - Trial 4 finished with value: 0.024218802934153922 and parameters: {'n_layers': 1, 'embedding_dim': 128, 'lr': 0.06213504646686566, 'lambda_val': 2.934079595938516e-05, 'batch_size': 2681, 'optimizer': 'RMSprop'}. Best is trial 3 with value: 0.033233895375887064.
2026-05-11 12:15:14,177 - optuna.study._optimize - INFO - Trial 5 pruned. 
2026-05-11 12:15:18,352 - optuna.study._optimize - INFO - Trial 6 pruned. 
2026-05-11 12:16:04,033 - optuna.study.study - INFO - Trial 7 finished with value: 0.01626658910803781 and parameters: {'n_layers': 4, 'embedding_dim': 64, 'lr': 0.00013076077548406244, 'lambda_val': 1.3329698404416989e-05, 'batch_size': 1533, 'optimizer': 'RMSprop'}. Best is trial 3 with value: 0.033233895375887064.
2026-05-11 12:16:08,868 - optuna.study._optimize - INFO - Trial 8 pruned. 
2026-05-11 12:16:12,941 - optuna.study._optimize - INFO - Trial 9 pruned. 
2026-05-11 12:16:18,996 - optuna.study._optimize - INFO - Trial 10 pruned. 
2026-05-11 12:16:51,734 - optuna.study.study - INFO - Trial 11 finished with value: 0.045794572891759235 and parameters: {'n_layers': 2, 'embedding_dim': 96, 'lr': 0.006864715004486116, 'lambda_val': 0.0019347844056031142, 'batch_size': 1954, 'optimizer': 'RMSprop'}. Best is trial 11 with value: 0.045794572891759235.
2026-05-11 12:17:33,897 - optuna.study.study - INFO - Trial 12 finished with value: 0.04896999312571596 and parameters: {'n_layers': 2, 'embedding_dim': 256, 'lr': 0.011650760954264802, 'lambda_val': 0.0010184063897156334, 'batch_size': 1964, 'optimizer': 'RMSprop'}. Best is trial 12 with value: 0.04896999312571596.
2026-05-11 12:18:11,117 - optuna.study.study - INFO - Trial 13 finished with value: 0.028537843391388276 and parameters: {'n_layers': 2, 'embedding_dim': 96, 'lr': 0.0004723976161731377, 'lambda_val': 0.0013764811772135341, 'batch_size': 1968, 'optimizer': 'RMSprop'}. Best is trial 12 with value: 0.04896999312571596.
2026-05-11 12:18:56,413 - optuna.study.study - INFO - Trial 14 finished with value: 0.04601813635953721 and parameters: {'n_layers': 2, 'embedding_dim': 256, 'lr': 0.012172145754079893, 'lambda_val': 0.002865602519159228, 'batch_size': 1631, 'optimizer': 'RMSprop'}. Best is trial 12 with value: 0.04896999312571596.
2026-05-11 12:19:37,966 - optuna.study.study - INFO - Trial 15 finished with value: 0.041954188313015985 and parameters: {'n_layers': 2, 'embedding_dim': 256, 'lr': 0.017639144656677163, 'lambda_val': 9.146970186045325e-05, 'batch_size': 1051, 'optimizer': 'RMSprop'}. Best is trial 12 with value: 0.04896999312571596.
2026-05-11 12:19:42,427 - optuna.study._optimize - INFO - Trial 16 pruned. 
2026-05-11 12:19:47,746 - optuna.study._optimize - INFO - Trial 17 pruned. 
2026-05-11 12:19:54,603 - optuna.study._optimize - INFO - Trial 18 pruned. 
2026-05-11 12:20:35,011 - optuna.study.study - INFO - Trial 19 finished with value: 0.07821968192139743 and parameters: {'n_layers': 1, 'embedding_dim': 256, 'lr': 0.004858674505829633, 'lambda_val': 0.0004199402599330044, 'batch_size': 592, 'optimizer': 'RMSprop'}. Best is trial 19 with value: 0.07821968192139743.
2026-05-11 12:20:39,150 - optuna.study._optimize - INFO - Trial 20 pruned. 
2026-05-11 12:21:13,017 - optuna.study.study - INFO - Trial 21 finished with value: 0.07296446347559139 and parameters: {'n_layers': 1, 'embedding_dim': 256, 'lr': 0.015058829453103929, 'lambda_val': 0.005731052907309589, 'batch_size': 1131, 'optimizer': 'RMSprop'}. Best is trial 19 with value: 0.07821968192139743.
2026-05-11 12:21:17,047 - optuna.study._optimize - INFO - Trial 22 pruned. 
2026-05-11 12:21:50,533 - optuna.study.study - INFO - Trial 23 finished with value: 0.05716278901596401 and parameters: {'n_layers': 1, 'embedding_dim': 256, 'lr': 0.0017063517738609242, 'lambda_val': 0.012771404759394684, 'batch_size': 1142, 'optimizer': 'RMSprop'}. Best is trial 19 with value: 0.07821968192139743.
2026-05-11 12:22:24,192 - optuna.study.study - INFO - Trial 24 finished with value: 0.04921790241673833 and parameters: {'n_layers': 1, 'embedding_dim': 256, 'lr': 0.0015087537546495731, 'lambda_val': 0.014035744933111794, 'batch_size': 1110, 'optimizer': 'RMSprop'}. Best is trial 19 with value: 0.07821968192139743.
2026-05-11 12:22:48,515 - optuna.study._optimize - INFO - Trial 25 pruned. 
2026-05-11 12:23:17,389 - optuna.study.study - INFO - Trial 26 finished with value: 0.05949026225868898 and parameters: {'n_layers': 1, 'embedding_dim': 64, 'lr': 0.0008920043051862762, 'lambda_val': 1.0856011106453326e-06, 'batch_size': 889, 'optimizer': 'RMSprop'}. Best is trial 19 with value: 0.07821968192139743.
2026-05-11 12:23:45,745 - optuna.study.study - INFO - Trial 27 finished with value: 0.0889930370626337 and parameters: {'n_layers': 1, 'embedding_dim': 64, 'lr': 0.00032279096380808254, 'lambda_val': 1.2207758208114982e-06, 'batch_size': 810, 'optimizer': 'RMSprop'}. Best is trial 27 with value: 0.0889930370626337.
2026-05-11 12:23:50,110 - optuna.study._optimize - INFO - Trial 28 pruned. 
2026-05-11 12:23:54,367 - optuna.study._optimize - INFO - Trial 29 pruned. 
2026-05-11 12:23:58,167 - optuna.study._optimize - INFO - Trial 30 pruned. 
2026-05-11 12:24:26,027 - optuna.study.study - INFO - Trial 31 finished with value: 0.05126554047211602 and parameters: {'n_layers': 1, 'embedding_dim': 64, 'lr': 0.0005851565734996094, 'lambda_val': 1.3147136970057013e-06, 'batch_size': 835, 'optimizer': 'RMSprop'}. Best is trial 27 with value: 0.0889930370626337.
2026-05-11 12:24:54,906 - optuna.study.study - INFO - Trial 32 finished with value: 0.0843864502587943 and parameters: {'n_layers': 1, 'embedding_dim': 64, 'lr': 0.0003199320347443025, 'lambda_val': 2.6144955854723455e-06, 'batch_size': 999, 'optimizer': 'RMSprop'}. Best is trial 27 with value: 0.0889930370626337.
2026-05-11 12:24:58,815 - optuna.study._optimize - INFO - Trial 33 pruned. 
2026-05-11 12:25:02,829 - optuna.study._optimize - INFO - Trial 34 pruned. 
2026-05-11 12:25:32,198 - optuna.study.study - INFO - Trial 35 finished with value: 0.10163886704334721 and parameters: {'n_layers': 1, 'embedding_dim': 32, 'lr': 0.0003004025766164384, 'lambda_val': 3.773169473807231e-06, 'batch_size': 924, 'optimizer': 'Adam'}. Best is trial 35 with value: 0.10163886704334721.
2026-05-11 12:26:01,921 - optuna.study.study - INFO - Trial 36 finished with value: 0.06592766019414725 and parameters: {'n_layers': 2, 'embedding_dim': 32, 'lr': 0.0002608727866189256, 'lambda_val': 3.711879727200641e-06, 'batch_size': 514, 'optimizer': 'Adam'}. Best is trial 35 with value: 0.10163886704334721.
2026-05-11 12:26:05,554 - optuna.study._optimize - INFO - Trial 37 pruned. 
2026-05-11 12:26:36,531 - optuna.study.study - INFO - Trial 38 finished with value: 0.02337755137196889 and parameters: {'n_layers': 2, 'embedding_dim': 32, 'lr': 0.00035692593116970944, 'lambda_val': 2.2421478115984516e-06, 'batch_size': 741, 'optimizer': 'Adam'}. Best is trial 35 with value: 0.10163886704334721.
2026-05-11 12:26:42,684 - optuna.study._optimize - INFO - Trial 39 pruned. 
2026-05-11 12:27:24,848 - optuna.study.study - INFO - Trial 40 finished with value: 0.03840794787214946 and parameters: {'n_layers': 1, 'embedding_dim': 32, 'lr': 0.0011108105428574108, 'lambda_val': 1.545988930223121e-05, 'batch_size': 3185, 'optimizer': 'Adam'}. Best is trial 35 with value: 0.10163886704334721.
2026-05-11 12:27:54,365 - optuna.study.study - INFO - Trial 41 finished with value: 0.12441597886256883 and parameters: {'n_layers': 1, 'embedding_dim': 96, 'lr': 0.00016100902593251228, 'lambda_val': 3.890315429000557e-06, 'batch_size': 1343, 'optimizer': 'RMSprop'}. Best is trial 41 with value: 0.12441597886256883.
2026-05-11 12:27:58,460 - optuna.study._optimize - INFO - Trial 42 pruned. 
2026-05-11 12:28:27,218 - optuna.study.study - INFO - Trial 43 finished with value: 0.13667121035266763 and parameters: {'n_layers': 1, 'embedding_dim': 96, 'lr': 0.00017132800977832704, 'lambda_val': 1.907689964735128e-06, 'batch_size': 697, 'optimizer': 'Adam'}. Best is trial 43 with value: 0.13667121035266763.
2026-05-11 12:28:59,582 - optuna.study.study - INFO - Trial 44 finished with value: 0.1048879413836458 and parameters: {'n_layers': 1, 'embedding_dim': 96, 'lr': 0.00015447714341593752, 'lambda_val': 1.6920538957222165e-06, 'batch_size': 1749, 'optimizer': 'Adam'}. Best is trial 43 with value: 0.13667121035266763.
2026-05-11 12:29:32,465 - optuna.study.study - INFO - Trial 45 finished with value: 0.0351950290113174 and parameters: {'n_layers': 2, 'embedding_dim': 96, 'lr': 0.00015344752760069666, 'lambda_val': 1.858352107498007e-06, 'batch_size': 1769, 'optimizer': 'Adam'}. Best is trial 43 with value: 0.13667121035266763.
2026-05-11 12:29:36,278 - optuna.study._optimize - INFO - Trial 46 pruned. 
2026-05-11 12:29:41,453 - optuna.study._optimize - INFO - Trial 47 pruned. 
2026-05-11 12:29:45,378 - optuna.study._optimize - INFO - Trial 48 pruned. 
2026-05-11 12:30:18,197 - optuna.study.study - INFO - Trial 49 finished with value: 0.05570385235920094 and parameters: {'n_layers': 2, 'embedding_dim': 96, 'lr': 0.00019269129962347497, 'lambda_val': 1.7669628713477882e-06, 'batch_size': 744, 'optimizer': 'Adam'}. Best is trial 43 with value: 0.13667121035266763.
2026-05-11 12:30:51,038 - optuna.study.study - INFO - Trial 50 finished with value: 0.030845108496017418 and parameters: {'n_layers': 2, 'embedding_dim': 96, 'lr': 0.00039298918126477516, 'lambda_val': 1.0176300539629353e-06, 'batch_size': 1243, 'optimizer': 'Adam'}. Best is trial 43 with value: 0.13667121035266763.
2026-05-11 12:30:54,902 - optuna.study._optimize - INFO - Trial 51 pruned. 
2026-05-11 12:31:24,599 - optuna.study.study - INFO - Trial 52 finished with value: 0.08558592920594969 and parameters: {'n_layers': 1, 'embedding_dim': 128, 'lr': 0.0002970504832956672, 'lambda_val': 3.12360350018926e-06, 'batch_size': 1030, 'optimizer': 'Adam'}. Best is trial 43 with value: 0.13667121035266763.
2026-05-11 12:31:54,472 - optuna.study.study - INFO - Trial 53 finished with value: 0.09267714533663796 and parameters: {'n_layers': 1, 'embedding_dim': 128, 'lr': 0.00019767025349119155, 'lambda_val': 5.521136630661535e-06, 'batch_size': 1788, 'optimizer': 'Adam'}. Best is trial 43 with value: 0.13667121035266763.
2026-05-11 12:32:24,621 - optuna.study.study - INFO - Trial 54 finished with value: 0.1151357180199862 and parameters: {'n_layers': 1, 'embedding_dim': 128, 'lr': 0.00014497516414797704, 'lambda_val': 7.5070635267165404e-06, 'batch_size': 1885, 'optimizer': 'Adam'}. Best is trial 43 with value: 0.13667121035266763.
2026-05-11 12:32:54,154 - optuna.study.study - INFO - Trial 55 finished with value: 0.05325897318755353 and parameters: {'n_layers': 1, 'embedding_dim': 128, 'lr': 0.0006988152475497975, 'lambda_val': 4.1236730553157434e-05, 'batch_size': 1756, 'optimizer': 'Adam'}. Best is trial 43 with value: 0.13667121035266763.
2026-05-11 12:32:57,987 - optuna.study._optimize - INFO - Trial 56 pruned. 
2026-05-11 12:33:03,417 - optuna.study._optimize - INFO - Trial 57 pruned. 
2026-05-11 12:33:07,521 - optuna.study._optimize - INFO - Trial 58 pruned. 
2026-05-11 12:33:11,412 - optuna.study._optimize - INFO - Trial 59 pruned. 
2026-05-11 12:33:15,282 - optuna.study._optimize - INFO - Trial 60 pruned. 
2026-05-11 12:33:43,139 - optuna.study.study - INFO - Trial 61 finished with value: 0.09413336780383429 and parameters: {'n_layers': 1, 'embedding_dim': 32, 'lr': 0.00020416235972349505, 'lambda_val': 1.4956223542272137e-06, 'batch_size': 1829, 'optimizer': 'Adam'}. Best is trial 43 with value: 0.13667121035266763.
2026-05-11 12:34:10,844 - optuna.study.study - INFO - Trial 62 finished with value: 0.08692917762636004 and parameters: {'n_layers': 1, 'embedding_dim': 32, 'lr': 0.00020501116912084448, 'lambda_val': 1.8290841147982476e-06, 'batch_size': 1652, 'optimizer': 'Adam'}. Best is trial 43 with value: 0.13667121035266763.
2026-05-11 12:34:14,762 - optuna.study._optimize - INFO - Trial 63 pruned. 
2026-05-11 12:34:48,832 - optuna.study.study - INFO - Trial 64 finished with value: 0.04178734904149058 and parameters: {'n_layers': 1, 'embedding_dim': 32, 'lr': 0.0004510852363406263, 'lambda_val': 4.973851324406e-06, 'batch_size': 2436, 'optimizer': 'Adam'}. Best is trial 43 with value: 0.13667121035266763.
2026-05-11 12:34:53,689 - optuna.study._optimize - INFO - Trial 65 pruned. 
2026-05-11 12:34:57,121 - optuna.study._optimize - INFO - Trial 66 pruned. 
2026-05-11 12:35:01,351 - optuna.study._optimize - INFO - Trial 67 pruned. 
2026-05-11 12:35:26,938 - optuna.study.study - INFO - Trial 68 finished with value: 0.057728502143217036 and parameters: {'n_layers': 1, 'embedding_dim': 96, 'lr': 0.000640079966499999, 'lambda_val': 0.00021290719586233574, 'batch_size': 2038, 'optimizer': 'Adam'}. Best is trial 43 with value: 0.13667121035266763.
2026-05-11 12:35:30,176 - optuna.study._optimize - INFO - Trial 69 pruned. 
2026-05-11 12:35:33,735 - optuna.study._optimize - INFO - Trial 70 pruned. 
2026-05-11 12:36:00,253 - optuna.study.study - INFO - Trial 71 finished with value: 0.06647673520963342 and parameters: {'n_layers': 1, 'embedding_dim': 96, 'lr': 0.0003898135394196142, 'lambda_val': 1.0281520136944557e-06, 'batch_size': 1190, 'optimizer': 'Adam'}. Best is trial 43 with value: 0.13667121035266763.
2026-05-11 12:36:04,055 - optuna.study._optimize - INFO - Trial 72 pruned. 
2026-05-11 12:36:09,517 - optuna.study._optimize - INFO - Trial 73 pruned. 
2026-05-11 12:36:41,422 - optuna.study.study - INFO - Trial 74 finished with value: 0.05643469427491027 and parameters: {'n_layers': 1, 'embedding_dim': 96, 'lr': 0.0004962749795324768, 'lambda_val': 4.451490724028964e-06, 'batch_size': 1111, 'optimizer': 'Adam'}. Best is trial 43 with value: 0.13667121035266763.
2026-05-11 12:36:45,430 - optuna.study._optimize - INFO - Trial 75 pruned. 
2026-05-11 12:37:13,582 - optuna.study.study - INFO - Trial 76 finished with value: 0.048752458951862386 and parameters: {'n_layers': 1, 'embedding_dim': 32, 'lr': 0.000808452549390526, 'lambda_val': 1.3276053117735436e-06, 'batch_size': 949, 'optimizer': 'Adam'}. Best is trial 43 with value: 0.13667121035266763.
2026-05-11 12:37:18,114 - optuna.study._optimize - INFO - Trial 77 pruned. 
2026-05-11 12:37:22,122 - optuna.study._optimize - INFO - Trial 78 pruned. 
2026-05-11 12:37:26,312 - optuna.study._optimize - INFO - Trial 79 pruned. 
2026-05-11 12:37:56,549 - optuna.study.study - INFO - Trial 80 finished with value: 0.12895684750605863 and parameters: {'n_layers': 1, 'embedding_dim': 96, 'lr': 0.00021077964463741156, 'lambda_val': 3.3196586448439807e-06, 'batch_size': 644, 'optimizer': 'Adam'}. Best is trial 43 with value: 0.13667121035266763.
2026-05-11 12:38:23,020 - optuna.study.study - INFO - Trial 81 finished with value: 0.10510795902914308 and parameters: {'n_layers': 1, 'embedding_dim': 96, 'lr': 0.0002897821467165507, 'lambda_val': 3.223082560772314e-06, 'batch_size': 643, 'optimizer': 'Adam'}. Best is trial 43 with value: 0.13667121035266763.
2026-05-11 12:38:59,590 - optuna.study.study - INFO - Trial 82 finished with value: 0.13070140128078908 and parameters: {'n_layers': 1, 'embedding_dim': 96, 'lr': 0.00021939251573812512, 'lambda_val': 3.4060027880518173e-06, 'batch_size': 620, 'optimizer': 'Adam'}. Best is trial 43 with value: 0.13667121035266763.
2026-05-11 12:39:03,928 - optuna.study._optimize - INFO - Trial 83 pruned. 
2026-05-11 12:39:07,676 - optuna.study._optimize - INFO - Trial 84 pruned. 
2026-05-11 12:39:11,679 - optuna.study._optimize - INFO - Trial 85 pruned. 
2026-05-11 12:39:38,088 - optuna.study.study - INFO - Trial 86 finished with value: 0.10966358268040409 and parameters: {'n_layers': 1, 'embedding_dim': 96, 'lr': 0.00026239225029368873, 'lambda_val': 8.297348962940755e-06, 'batch_size': 765, 'optimizer': 'Adam'}. Best is trial 43 with value: 0.13667121035266763.
2026-05-11 12:40:04,622 - optuna.study.study - INFO - Trial 87 finished with value: 0.10391607475864287 and parameters: {'n_layers': 1, 'embedding_dim': 96, 'lr': 0.0002570015670941321, 'lambda_val': 1.020022369799136e-05, 'batch_size': 771, 'optimizer': 'Adam'}. Best is trial 43 with value: 0.13667121035266763.
2026-05-11 12:40:29,333 - optuna.study.study - INFO - Trial 88 finished with value: 0.0769112044233959 and parameters: {'n_layers': 1, 'embedding_dim': 96, 'lr': 0.0004089472324796177, 'lambda_val': 8.817213528578618e-06, 'batch_size': 645, 'optimizer': 'Adam'}. Best is trial 43 with value: 0.13667121035266763.
2026-05-11 12:41:02,049 - optuna.study.study - INFO - Trial 89 finished with value: 0.09349800485503543 and parameters: {'n_layers': 1, 'embedding_dim': 96, 'lr': 0.00027233518841089297, 'lambda_val': 2.1885376781065825e-05, 'batch_size': 784, 'optimizer': 'Adam'}. Best is trial 43 with value: 0.13667121035266763.
2026-05-11 12:41:08,933 - optuna.study._optimize - INFO - Trial 90 pruned. 
2026-05-11 12:41:37,410 - optuna.study.study - INFO - Trial 91 finished with value: 0.11201888221525749 and parameters: {'n_layers': 1, 'embedding_dim': 96, 'lr': 0.00025880176930522306, 'lambda_val': 4.093381705966431e-06, 'batch_size': 853, 'optimizer': 'Adam'}. Best is trial 43 with value: 0.13667121035266763.
2026-05-11 12:42:06,293 - optuna.study.study - INFO - Trial 92 finished with value: 0.1127056845111499 and parameters: {'n_layers': 1, 'embedding_dim': 96, 'lr': 0.0002344278440738321, 'lambda_val': 6.954244368700694e-06, 'batch_size': 768, 'optimizer': 'Adam'}. Best is trial 43 with value: 0.13667121035266763.
