2026-05-11 11:28:05,685 - optuna.study.study - INFO - Trial 65 finished with value: 0.07525648355609332 and parameters: {'n_layers': 1, 'embedding_dim': 256, 'lr': 0.003425041050741502, 'lambda_val': 0.00035210136712977055, 'batch_size': 2297, 'optimizer': 'RMSprop'}. Best is trial 56 with value: 0.08931210353334987.
2026-05-11 11:28:09,328 - optuna.study._optimize - INFO - Trial 66 pruned. 
2026-05-11 11:28:23,014 - optuna.study._optimize - INFO - Trial 67 pruned. 
2026-05-11 11:28:28,236 - optuna.study._optimize - INFO - Trial 68 pruned. 
2026-05-11 11:28:32,577 - optuna.study._optimize - INFO - Trial 69 pruned. 
2026-05-11 11:28:37,018 - optuna.study._optimize - INFO - Trial 70 pruned. 
2026-05-11 11:28:41,458 - optuna.study._optimize - INFO - Trial 71 pruned. 
2026-05-11 11:28:45,802 - optuna.study._optimize - INFO - Trial 72 pruned. 
2026-05-11 11:28:50,530 - optuna.study._optimize - INFO - Trial 73 pruned. 
2026-05-11 11:29:24,767 - optuna.study.study - INFO - Trial 74 finished with value: 0.07922204563592121 and parameters: {'n_layers': 1, 'embedding_dim': 256, 'lr': 0.00667026031172326, 'lambda_val': 0.0009032802735795245, 'batch_size': 1903, 'optimizer': 'RMSprop'}. Best is trial 56 with value: 0.08931210353334987.
2026-05-11 11:29:32,986 - optuna.study._optimize - INFO - Trial 75 pruned. 
2026-05-11 11:29:39,943 - optuna.study._optimize - INFO - Trial 76 pruned. 
2026-05-11 11:30:13,627 - optuna.study.study - INFO - Trial 77 finished with value: 0.07741826544886207 and parameters: {'n_layers': 1, 'embedding_dim': 256, 'lr': 0.00455084193494052, 'lambda_val': 0.0032102773155658804, 'batch_size': 1570, 'optimizer': 'RMSprop'}. Best is trial 56 with value: 0.08931210353334987.
2026-05-11 11:30:24,745 - optuna.study._optimize - INFO - Trial 78 pruned. 
2026-05-11 11:31:04,274 - optuna.study.study - INFO - Trial 79 finished with value: 0.08302356362290267 and parameters: {'n_layers': 1, 'embedding_dim': 256, 'lr': 0.0075616432618711635, 'lambda_val': 0.0006347300034254184, 'batch_size': 1719, 'optimizer': 'RMSprop'}. Best is trial 56 with value: 0.08931210353334987.
2026-05-11 11:31:08,404 - optuna.study._optimize - INFO - Trial 80 pruned. 
2026-05-11 11:31:42,608 - optuna.study.study - INFO - Trial 81 finished with value: 0.08259835228521288 and parameters: {'n_layers': 1, 'embedding_dim': 256, 'lr': 0.010737538577867915, 'lambda_val': 0.0007802959023485906, 'batch_size': 1740, 'optimizer': 'RMSprop'}. Best is trial 56 with value: 0.08931210353334987.
2026-05-11 11:31:54,172 - optuna.study._optimize - INFO - Trial 82 pruned. 
2026-05-11 11:31:58,536 - optuna.study._optimize - INFO - Trial 83 pruned. 
2026-05-11 11:32:03,542 - optuna.study._optimize - INFO - Trial 84 pruned. 
2026-05-11 11:32:07,560 - optuna.study._optimize - INFO - Trial 85 pruned. 
2026-05-11 11:32:12,829 - optuna.study._optimize - INFO - Trial 86 pruned. 
2026-05-11 11:32:17,612 - optuna.study._optimize - INFO - Trial 87 pruned. 
2026-05-11 11:32:24,278 - optuna.study._optimize - INFO - Trial 88 pruned. 
2026-05-11 11:32:34,018 - optuna.study._optimize - INFO - Trial 89 pruned. 
2026-05-11 11:32:40,737 - optuna.study._optimize - INFO - Trial 90 pruned. 
2026-05-11 11:33:15,398 - optuna.study.study - INFO - Trial 91 finished with value: 0.08375885483046627 and parameters: {'n_layers': 1, 'embedding_dim': 256, 'lr': 0.00791930539816583, 'lambda_val': 0.0019982059433135513, 'batch_size': 1831, 'optimizer': 'RMSprop'}. Best is trial 56 with value: 0.08931210353334987.
2026-05-11 11:33:49,841 - optuna.study.study - INFO - Trial 92 finished with value: 0.08894969744923356 and parameters: {'n_layers': 1, 'embedding_dim': 256, 'lr': 0.0075725151898603385, 'lambda_val': 0.0012137839971914253, 'batch_size': 1670, 'optimizer': 'RMSprop'}. Best is trial 56 with value: 0.08931210353334987.
2026-05-11 11:34:23,772 - optuna.study.study - INFO - Trial 93 finished with value: 0.07732404396823117 and parameters: {'n_layers': 1, 'embedding_dim': 256, 'lr': 0.005142731901355014, 'lambda_val': 0.0012574395096368474, 'batch_size': 1463, 'optimizer': 'RMSprop'}. Best is trial 56 with value: 0.08931210353334987.
2026-05-11 11:34:29,263 - optuna.study._optimize - INFO - Trial 94 pruned. 
2026-05-11 11:35:03,642 - optuna.study.study - INFO - Trial 95 finished with value: 0.08294059429646876 and parameters: {'n_layers': 1, 'embedding_dim': 256, 'lr': 0.006744985795503467, 'lambda_val': 0.0007606687301936158, 'batch_size': 1024, 'optimizer': 'RMSprop'}. Best is trial 56 with value: 0.08931210353334987.
2026-05-11 11:35:10,014 - optuna.study._optimize - INFO - Trial 96 pruned. 
2026-05-11 11:35:48,927 - optuna.study.study - INFO - Trial 97 finished with value: 0.08530468765130332 and parameters: {'n_layers': 1, 'embedding_dim': 256, 'lr': 0.00864292904564437, 'lambda_val': 0.000993225448280231, 'batch_size': 1909, 'optimizer': 'RMSprop'}. Best is trial 56 with value: 0.08931210353334987.
2026-05-11 11:35:53,367 - optuna.study._optimize - INFO - Trial 98 pruned. 
2026-05-11 11:36:36,212 - optuna.study.study - INFO - Trial 99 finished with value: 0.0508211950695361 and parameters: {'n_layers': 1, 'embedding_dim': 256, 'lr': 0.00030768728070246866, 'lambda_val': 0.006539799281928245, 'batch_size': 2122, 'optimizer': 'RMSprop'}. Best is trial 56 with value: 0.08931210353334987.
2026-05-11 11:36:40,630 - optuna.study._optimize - INFO - Trial 100 pruned. 
2026-05-11 11:37:15,829 - optuna.study.study - INFO - Trial 101 finished with value: 0.08087156643459559 and parameters: {'n_layers': 1, 'embedding_dim': 256, 'lr': 0.008342550210001411, 'lambda_val': 0.0005793324263895307, 'batch_size': 1604, 'optimizer': 'RMSprop'}. Best is trial 56 with value: 0.08931210353334987.
2026-05-11 11:37:29,158 - optuna.study._optimize - INFO - Trial 102 pruned. 
2026-05-11 11:38:12,790 - optuna.study.study - INFO - Trial 103 finished with value: 0.08480521367350408 and parameters: {'n_layers': 1, 'embedding_dim': 256, 'lr': 0.009194317452531658, 'lambda_val': 0.0014538598262175818, 'batch_size': 2389, 'optimizer': 'RMSprop'}. Best is trial 56 with value: 0.08931210353334987.
2026-05-11 11:38:48,811 - optuna.study.study - INFO - Trial 104 finished with value: 0.08315009964415543 and parameters: {'n_layers': 1, 'embedding_dim': 256, 'lr': 0.0068919874279844175, 'lambda_val': 0.0013776113943187898, 'batch_size': 2437, 'optimizer': 'RMSprop'}. Best is trial 56 with value: 0.08931210353334987.
2026-05-11 11:38:57,285 - optuna.study._optimize - INFO - Trial 105 pruned. 
2026-05-11 11:39:38,631 - optuna.study.study - INFO - Trial 106 finished with value: 0.08463229470041776 and parameters: {'n_layers': 1, 'embedding_dim': 256, 'lr': 0.0057871609008105125, 'lambda_val': 0.0017877901058352941, 'batch_size': 2375, 'optimizer': 'RMSprop'}. Best is trial 56 with value: 0.08931210353334987.
2026-05-11 11:40:15,046 - optuna.study.study - INFO - Trial 107 finished with value: 0.0853071493688476 and parameters: {'n_layers': 1, 'embedding_dim': 256, 'lr': 0.005188549125979668, 'lambda_val': 0.0014469603790867789, 'batch_size': 2387, 'optimizer': 'RMSprop'}. Best is trial 56 with value: 0.08931210353334987.
2026-05-11 11:40:19,930 - optuna.study._optimize - INFO - Trial 108 pruned. 
2026-05-11 11:40:56,898 - optuna.study.study - INFO - Trial 109 finished with value: 0.07862185686986092 and parameters: {'n_layers': 1, 'embedding_dim': 256, 'lr': 0.0030256060563260147, 'lambda_val': 0.00416424377941063, 'batch_size': 2749, 'optimizer': 'RMSprop'}. Best is trial 56 with value: 0.08931210353334987.
2026-05-11 11:41:31,865 - optuna.study.study - INFO - Trial 110 finished with value: 0.08130758154646915 and parameters: {'n_layers': 1, 'embedding_dim': 256, 'lr': 0.00014580625389087583, 'lambda_val': 0.0005075502922028223, 'batch_size': 2360, 'optimizer': 'RMSprop'}. Best is trial 56 with value: 0.08931210353334987.
2026-05-11 11:42:07,592 - optuna.study.study - INFO - Trial 111 finished with value: 0.08425345924426743 and parameters: {'n_layers': 1, 'embedding_dim': 256, 'lr': 0.005905662234095461, 'lambda_val': 0.001873359451164164, 'batch_size': 2386, 'optimizer': 'RMSprop'}. Best is trial 56 with value: 0.08931210353334987.
2026-05-11 11:42:44,604 - optuna.study.study - INFO - Trial 112 finished with value: 0.08156787492689804 and parameters: {'n_layers': 1, 'embedding_dim': 256, 'lr': 0.009098361841345354, 'lambda_val': 0.00153880361006972, 'batch_size': 2537, 'optimizer': 'RMSprop'}. Best is trial 56 with value: 0.08931210353334987.
2026-05-11 11:43:29,773 - optuna.study.study - INFO - Trial 113 finished with value: 0.08923302205900527 and parameters: {'n_layers': 1, 'embedding_dim': 256, 'lr': 0.011255125101619775, 'lambda_val': 0.0006697182949473875, 'batch_size': 2633, 'optimizer': 'RMSprop'}. Best is trial 56 with value: 0.08931210353334987.
2026-05-11 11:44:05,377 - optuna.study.study - INFO - Trial 114 finished with value: 0.0839162121951948 and parameters: {'n_layers': 1, 'embedding_dim': 256, 'lr': 0.012046840452281077, 'lambda_val': 0.0008862186505750228, 'batch_size': 2662, 'optimizer': 'RMSprop'}. Best is trial 56 with value: 0.08931210353334987.
2026-05-11 11:44:15,455 - optuna.study._optimize - INFO - Trial 115 pruned. 
2026-05-11 11:44:53,960 - optuna.study.study - INFO - Trial 116 finished with value: 0.0797909802010407 and parameters: {'n_layers': 1, 'embedding_dim': 256, 'lr': 0.007670895405893527, 'lambda_val': 0.0005874889238361813, 'batch_size': 2217, 'optimizer': 'RMSprop'}. Best is trial 56 with value: 0.08931210353334987.
2026-05-11 11:44:58,959 - optuna.study._optimize - INFO - Trial 117 pruned. 
2026-05-11 11:45:02,857 - optuna.study._optimize - INFO - Trial 118 pruned. 
2026-05-11 11:45:07,639 - optuna.study._optimize - INFO - Trial 119 pruned. 
2026-05-11 11:45:41,878 - optuna.study.study - INFO - Trial 120 finished with value: 0.08756327258291695 and parameters: {'n_layers': 1, 'embedding_dim': 256, 'lr': 0.0036399823403015534, 'lambda_val': 0.0008903946373485261, 'batch_size': 2130, 'optimizer': 'RMSprop'}. Best is trial 56 with value: 0.08931210353334987.
2026-05-11 11:46:30,328 - optuna.study.study - INFO - Trial 121 finished with value: 0.08459941406372012 and parameters: {'n_layers': 1, 'embedding_dim': 256, 'lr': 0.003981328906483195, 'lambda_val': 0.0009152006357017639, 'batch_size': 2789, 'optimizer': 'RMSprop'}. Best is trial 56 with value: 0.08931210353334987.
2026-05-11 11:46:35,040 - optuna.study._optimize - INFO - Trial 122 pruned. 
2026-05-11 11:47:10,301 - optuna.study.study - INFO - Trial 123 finished with value: 0.08469035579091015 and parameters: {'n_layers': 1, 'embedding_dim': 256, 'lr': 0.004936319364937525, 'lambda_val': 0.0014465179065471024, 'batch_size': 2285, 'optimizer': 'RMSprop'}. Best is trial 56 with value: 0.08931210353334987.
2026-05-11 11:47:51,168 - optuna.study.study - INFO - Trial 124 finished with value: 0.08835154290253078 and parameters: {'n_layers': 1, 'embedding_dim': 256, 'lr': 0.006819315342497453, 'lambda_val': 0.000688522382369891, 'batch_size': 1969, 'optimizer': 'RMSprop'}. Best is trial 56 with value: 0.08931210353334987.
2026-05-11 11:48:26,694 - optuna.study.study - INFO - Trial 125 finished with value: 0.088983662200195 and parameters: {'n_layers': 1, 'embedding_dim': 256, 'lr': 0.006651557138682204, 'lambda_val': 0.0006204067017383162, 'batch_size': 1693, 'optimizer': 'RMSprop'}. Best is trial 56 with value: 0.08931210353334987.
2026-05-11 11:49:00,914 - optuna.study.study - INFO - Trial 126 finished with value: 0.08235581126241699 and parameters: {'n_layers': 1, 'embedding_dim': 256, 'lr': 0.004418705662685384, 'lambda_val': 0.0010882638580161411, 'batch_size': 1988, 'optimizer': 'RMSprop'}. Best is trial 56 with value: 0.08931210353334987.
2026-05-11 11:49:10,853 - optuna.study._optimize - INFO - Trial 127 pruned. 
2026-05-11 11:49:45,618 - optuna.study.study - INFO - Trial 128 finished with value: 0.06884109485735339 and parameters: {'n_layers': 1, 'embedding_dim': 256, 'lr': 0.0024080878867700356, 'lambda_val': 0.0004985148048783142, 'batch_size': 1771, 'optimizer': 'Adam'}. Best is trial 56 with value: 0.08931210353334987.
2026-05-11 11:49:57,936 - optuna.study._optimize - INFO - Trial 129 pruned. 
2026-05-11 11:50:02,431 - optuna.study._optimize - INFO - Trial 130 pruned. 
2026-05-11 11:50:06,926 - optuna.study._optimize - INFO - Trial 131 pruned. 
2026-05-11 11:50:11,222 - optuna.study._optimize - INFO - Trial 132 pruned. 
2026-05-11 11:50:17,873 - optuna.study._optimize - INFO - Trial 133 pruned. 
2026-05-11 11:50:22,337 - optuna.study._optimize - INFO - Trial 134 pruned. 
2026-05-11 11:50:27,197 - optuna.study._optimize - INFO - Trial 135 pruned. 
2026-05-11 11:50:34,169 - optuna.study._optimize - INFO - Trial 136 pruned. 
2026-05-11 11:50:38,565 - optuna.study._optimize - INFO - Trial 137 pruned. 
2026-05-11 11:50:45,254 - optuna.study._optimize - INFO - Trial 138 pruned. 
2026-05-11 11:50:50,307 - optuna.study._optimize - INFO - Trial 139 pruned. 
2026-05-11 11:51:25,308 - optuna.study.study - INFO - Trial 140 finished with value: 0.07836765264029416 and parameters: {'n_layers': 1, 'embedding_dim': 256, 'lr': 0.0029647010542338675, 'lambda_val': 0.0019564092891254277, 'batch_size': 1439, 'optimizer': 'RMSprop'}. Best is trial 56 with value: 0.08931210353334987.
2026-05-11 11:51:59,958 - optuna.study.study - INFO - Trial 141 finished with value: 0.08412874880212669 and parameters: {'n_layers': 1, 'embedding_dim': 256, 'lr': 0.008053499796023857, 'lambda_val': 0.001522363749386916, 'batch_size': 2173, 'optimizer': 'RMSprop'}. Best is trial 56 with value: 0.08931210353334987.
2026-05-11 11:52:34,190 - optuna.study.study - INFO - Trial 142 finished with value: 0.08307573133116611 and parameters: {'n_layers': 1, 'embedding_dim': 256, 'lr': 0.009404867561602113, 'lambda_val': 0.0008024402157193038, 'batch_size': 1918, 'optimizer': 'RMSprop'}. Best is trial 56 with value: 0.08931210353334987.
2026-05-11 11:53:08,990 - optuna.study.study - INFO - Trial 143 finished with value: 0.0902858427931235 and parameters: {'n_layers': 1, 'embedding_dim': 256, 'lr': 0.009859831239171855, 'lambda_val': 0.0011777807632311528, 'batch_size': 2017, 'optimizer': 'RMSprop'}. Best is trial 143 with value: 0.0902858427931235.
2026-05-11 11:53:43,608 - optuna.study.study - INFO - Trial 144 finished with value: 0.08789291098839665 and parameters: {'n_layers': 1, 'embedding_dim': 256, 'lr': 0.006596353499316344, 'lambda_val': 0.0010343923047091339, 'batch_size': 2031, 'optimizer': 'RMSprop'}. Best is trial 143 with value: 0.0902858427931235.
2026-05-11 11:54:18,261 - optuna.study.study - INFO - Trial 145 finished with value: 0.08023728657704883 and parameters: {'n_layers': 1, 'embedding_dim': 256, 'lr': 0.006299599296934231, 'lambda_val': 0.0011009579001156847, 'batch_size': 2072, 'optimizer': 'RMSprop'}. Best is trial 143 with value: 0.0902858427931235.
2026-05-11 11:54:54,273 - optuna.study.study - INFO - Trial 146 finished with value: 0.08366130692987377 and parameters: {'n_layers': 1, 'embedding_dim': 256, 'lr': 0.005213694750734876, 'lambda_val': 0.0009573833228975121, 'batch_size': 3147, 'optimizer': 'RMSprop'}. Best is trial 143 with value: 0.0902858427931235.
2026-05-11 11:54:58,612 - optuna.study._optimize - INFO - Trial 147 pruned. 
2026-05-11 11:55:05,079 - optuna.study._optimize - INFO - Trial 148 pruned. 
2026-05-11 11:55:09,519 - optuna.study._optimize - INFO - Trial 149 pruned. 
2026-05-11 11:55:14,069 - optuna.study._optimize - INFO - Trial 150 pruned. 
2026-05-11 11:55:18,509 - optuna.study._optimize - INFO - Trial 151 pruned. 
2026-05-11 11:55:25,171 - optuna.study._optimize - INFO - Trial 152 pruned. 
2026-05-11 11:55:31,993 - optuna.study._optimize - INFO - Trial 153 pruned. 
2026-05-11 11:56:06,394 - optuna.study.study - INFO - Trial 154 finished with value: 0.06858612087206885 and parameters: {'n_layers': 1, 'embedding_dim': 256, 'lr': 0.0006896673207934878, 'lambda_val': 0.0011346606816909383, 'batch_size': 2137, 'optimizer': 'RMSprop'}. Best is trial 143 with value: 0.0902858427931235.
2026-05-11 11:56:17,143 - optuna.study._optimize - INFO - Trial 155 pruned. 
2026-05-11 11:56:22,146 - optuna.study._optimize - INFO - Trial 156 pruned. 
2026-05-11 11:56:26,763 - optuna.study._optimize - INFO - Trial 157 pruned. 
2026-05-11 11:56:33,896 - optuna.study._optimize - INFO - Trial 158 pruned. 
2026-05-11 11:57:10,465 - optuna.study.study - INFO - Trial 159 finished with value: 0.08230528771906934 and parameters: {'n_layers': 1, 'embedding_dim': 256, 'lr': 0.008458183869920803, 'lambda_val': 0.0017693985364061705, 'batch_size': 1771, 'optimizer': 'RMSprop'}. Best is trial 143 with value: 0.0902858427931235.
2026-05-11 11:57:45,151 - optuna.study.study - INFO - Trial 160 finished with value: 0.08631515837157663 and parameters: {'n_layers': 1, 'embedding_dim': 256, 'lr': 0.004505132627706647, 'lambda_val': 0.0010092953160829043, 'batch_size': 2029, 'optimizer': 'RMSprop'}. Best is trial 143 with value: 0.0902858427931235.
2026-05-11 11:58:21,278 - optuna.study.study - INFO - Trial 161 finished with value: 0.08200478259103446 and parameters: {'n_layers': 1, 'embedding_dim': 256, 'lr': 0.003410138712321296, 'lambda_val': 0.0009719027100338616, 'batch_size': 3372, 'optimizer': 'RMSprop'}. Best is trial 143 with value: 0.0902858427931235.
2026-05-11 11:58:55,786 - optuna.study.study - INFO - Trial 162 finished with value: 0.08854657062790008 and parameters: {'n_layers': 1, 'embedding_dim': 256, 'lr': 0.004222218220483506, 'lambda_val': 0.0013379410685988222, 'batch_size': 2100, 'optimizer': 'RMSprop'}. Best is trial 143 with value: 0.0902858427931235.
2026-05-11 11:59:30,424 - optuna.study.study - INFO - Trial 163 finished with value: 0.08366770796618689 and parameters: {'n_layers': 1, 'embedding_dim': 256, 'lr': 0.0041850875161941045, 'lambda_val': 0.0011600191074439346, 'batch_size': 2174, 'optimizer': 'RMSprop'}. Best is trial 143 with value: 0.0902858427931235.
2026-05-11 12:00:05,132 - optuna.study.study - INFO - Trial 164 finished with value: 0.08236020420641552 and parameters: {'n_layers': 1, 'embedding_dim': 256, 'lr': 0.005385553283385347, 'lambda_val': 0.001397593994692998, 'batch_size': 2090, 'optimizer': 'RMSprop'}. Best is trial 143 with value: 0.0902858427931235.
2026-05-11 12:00:09,603 - optuna.study._optimize - INFO - Trial 165 pruned. 
2026-05-11 12:00:44,436 - optuna.study.study - INFO - Trial 166 finished with value: 0.08473828136996868 and parameters: {'n_layers': 1, 'embedding_dim': 256, 'lr': 0.006736871124199258, 'lambda_val': 0.0007265945866842361, 'batch_size': 2275, 'optimizer': 'RMSprop'}. Best is trial 143 with value: 0.0902858427931235.
2026-05-11 12:01:09,485 - optuna.study._optimize - INFO - Trial 167 pruned. 
2026-05-11 12:01:38,483 - optuna.study.study - INFO - Trial 168 finished with value: 0.04934630373496457 and parameters: {'n_layers': 1, 'embedding_dim': 96, 'lr': 0.0019026486791469833, 'lambda_val': 1.6152322839955298e-06, 'batch_size': 2048, 'optimizer': 'RMSprop'}. Best is trial 143 with value: 0.0902858427931235.
2026-05-11 12:01:46,253 - optuna.study._optimize - INFO - Trial 169 pruned. 
2026-05-11 12:02:20,776 - optuna.study.study - INFO - Trial 170 finished with value: 0.06491772852914568 and parameters: {'n_layers': 1, 'embedding_dim': 256, 'lr': 0.0011964207181500682, 'lambda_val': 0.00045211051494688606, 'batch_size': 2217, 'optimizer': 'RMSprop'}. Best is trial 143 with value: 0.0902858427931235.
2026-05-11 12:02:25,359 - optuna.study._optimize - INFO - Trial 171 pruned. 
2026-05-11 12:02:29,765 - optuna.study._optimize - INFO - Trial 172 pruned. 
2026-05-11 12:03:04,080 - optuna.study.study - INFO - Trial 173 finished with value: 0.08788198767196401 and parameters: {'n_layers': 1, 'embedding_dim': 256, 'lr': 0.007215025444606798, 'lambda_val': 0.0016752482366082099, 'batch_size': 1679, 'optimizer': 'RMSprop'}. Best is trial 143 with value: 0.0902858427931235.
2026-05-11 12:03:10,586 - optuna.study._optimize - INFO - Trial 174 pruned. 
2026-05-11 12:03:15,298 - optuna.study._optimize - INFO - Trial 175 pruned. 
2026-05-11 12:03:19,396 - optuna.study._optimize - INFO - Trial 176 pruned. 
2026-05-11 12:03:24,320 - optuna.study._optimize - INFO - Trial 177 pruned. 
2026-05-11 12:03:58,847 - optuna.study.study - INFO - Trial 178 finished with value: 0.08377441466853647 and parameters: {'n_layers': 1, 'embedding_dim': 256, 'lr': 0.009359600786646398, 'lambda_val': 0.0016926512445258567, 'batch_size': 1895, 'optimizer': 'RMSprop'}. Best is trial 143 with value: 0.0902858427931235.
2026-05-11 12:04:03,239 - optuna.study._optimize - INFO - Trial 179 pruned. 
2026-05-11 12:04:09,973 - optuna.study._optimize - INFO - Trial 180 pruned. 
2026-05-11 12:04:17,884 - optuna.study._optimize - INFO - Trial 181 pruned. 
2026-05-11 12:04:52,183 - optuna.study.study - INFO - Trial 182 finished with value: 0.08710363658025798 and parameters: {'n_layers': 1, 'embedding_dim': 256, 'lr': 0.00590142531647655, 'lambda_val': 0.0007237813016369567, 'batch_size': 1595, 'optimizer': 'RMSprop'}. Best is trial 143 with value: 0.0902858427931235.
2026-05-11 12:05:26,086 - optuna.study.study - INFO - Trial 183 finished with value: 0.08576926034669204 and parameters: {'n_layers': 1, 'embedding_dim': 256, 'lr': 0.005770228512452991, 'lambda_val': 0.0011428125921114898, 'batch_size': 1586, 'optimizer': 'RMSprop'}. Best is trial 143 with value: 0.0902858427931235.
2026-05-11 12:06:00,153 - optuna.study.study - INFO - Trial 184 finished with value: 0.08048613771429515 and parameters: {'n_layers': 1, 'embedding_dim': 256, 'lr': 0.005680494330842975, 'lambda_val': 0.0011225017377625797, 'batch_size': 1483, 'optimizer': 'RMSprop'}. Best is trial 143 with value: 0.0902858427931235.
