2026-05-11 05:01:55,412 - optuna.study.study - INFO - Trial 25 finished with value: 0.03993255510047284 and parameters: {'n_layers': 1, 'embedding_dim': 32, 'lr': 0.0008407712427904343, 'lambda_val': 0.006566148462140869, 'batch_size': 991, 'optimizer': 'Adam'}. Best is trial 20 with value: 0.05742616738537144.
2026-05-11 05:01:59,051 - optuna.study._optimize - INFO - Trial 26 pruned. 
2026-05-11 05:02:28,770 - optuna.study.study - INFO - Trial 27 finished with value: 0.05827150308710256 and parameters: {'n_layers': 1, 'embedding_dim': 32, 'lr': 0.03443433443793143, 'lambda_val': 0.0051095818450203525, 'batch_size': 1012, 'optimizer': 'Adam'}. Best is trial 27 with value: 0.05827150308710256.
2026-05-11 05:02:57,371 - optuna.study.study - INFO - Trial 28 finished with value: 0.057417005735968946 and parameters: {'n_layers': 1, 'embedding_dim': 32, 'lr': 0.03747207528194619, 'lambda_val': 0.004970977147237503, 'batch_size': 1089, 'optimizer': 'Adam'}. Best is trial 27 with value: 0.05827150308710256.
2026-05-11 05:03:01,279 - optuna.study._optimize - INFO - Trial 29 pruned. 
2026-05-11 05:03:06,060 - optuna.study._optimize - INFO - Trial 30 pruned. 
2026-05-11 05:03:34,012 - optuna.study.study - INFO - Trial 31 finished with value: 0.0584333853854925 and parameters: {'n_layers': 1, 'embedding_dim': 32, 'lr': 0.044514511318375534, 'lambda_val': 0.005594164956166139, 'batch_size': 1688, 'optimizer': 'Adam'}. Best is trial 31 with value: 0.0584333853854925.
2026-05-11 05:03:38,584 - optuna.study._optimize - INFO - Trial 32 pruned. 
2026-05-11 05:04:04,626 - optuna.study.study - INFO - Trial 33 finished with value: 0.0625477211561024 and parameters: {'n_layers': 1, 'embedding_dim': 32, 'lr': 0.04329094264200237, 'lambda_val': 0.0019774946480118813, 'batch_size': 1553, 'optimizer': 'Adam'}. Best is trial 33 with value: 0.0625477211561024.
2026-05-11 05:04:34,545 - optuna.study.study - INFO - Trial 34 finished with value: 0.05830610370266901 and parameters: {'n_layers': 1, 'embedding_dim': 32, 'lr': 0.019079633296560827, 'lambda_val': 0.0020999706702196376, 'batch_size': 1599, 'optimizer': 'Adam'}. Best is trial 33 with value: 0.0625477211561024.
2026-05-11 05:05:04,009 - optuna.study.study - INFO - Trial 35 finished with value: 0.05787629555597458 and parameters: {'n_layers': 1, 'embedding_dim': 32, 'lr': 0.05476110709155004, 'lambda_val': 0.0016568920167709619, 'batch_size': 1562, 'optimizer': 'Adam'}. Best is trial 33 with value: 0.0625477211561024.
2026-05-11 05:05:30,779 - optuna.study.study - INFO - Trial 36 finished with value: 0.0440588719143759 and parameters: {'n_layers': 1, 'embedding_dim': 32, 'lr': 0.016981734276943806, 'lambda_val': 0.0005528178075180435, 'batch_size': 1529, 'optimizer': 'Adam'}. Best is trial 33 with value: 0.0625477211561024.
2026-05-11 05:05:34,611 - optuna.study._optimize - INFO - Trial 37 pruned. 
2026-05-11 05:05:40,255 - optuna.study._optimize - INFO - Trial 38 pruned. 
2026-05-11 05:05:43,888 - optuna.study._optimize - INFO - Trial 39 pruned. 
2026-05-11 05:05:48,343 - optuna.study._optimize - INFO - Trial 40 pruned. 
2026-05-11 05:05:51,778 - optuna.study._optimize - INFO - Trial 41 pruned. 
2026-05-11 05:05:56,285 - optuna.study._optimize - INFO - Trial 42 pruned. 
2026-05-11 05:06:00,526 - optuna.study._optimize - INFO - Trial 43 pruned. 
2026-05-11 05:06:28,409 - optuna.study.study - INFO - Trial 44 finished with value: 0.058665367257033134 and parameters: {'n_layers': 1, 'embedding_dim': 32, 'lr': 0.01305297415814535, 'lambda_val': 0.008173762937633488, 'batch_size': 1505, 'optimizer': 'Adam'}. Best is trial 33 with value: 0.0625477211561024.
2026-05-11 05:06:31,809 - optuna.study._optimize - INFO - Trial 45 pruned. 
2026-05-11 05:06:34,730 - optuna.study._optimize - INFO - Trial 46 pruned. 
2026-05-11 05:07:01,211 - optuna.study.study - INFO - Trial 47 finished with value: 0.06812722426530939 and parameters: {'n_layers': 1, 'embedding_dim': 64, 'lr': 0.004759938782085888, 'lambda_val': 0.004029230566550235, 'batch_size': 1162, 'optimizer': 'Adam'}. Best is trial 47 with value: 0.06812722426530939.
2026-05-11 05:07:05,156 - optuna.study._optimize - INFO - Trial 48 pruned. 
2026-05-11 05:07:33,639 - optuna.study.study - INFO - Trial 49 finished with value: 0.05269540199236829 and parameters: {'n_layers': 1, 'embedding_dim': 64, 'lr': 0.0019157433731294218, 'lambda_val': 0.0031440603193369078, 'batch_size': 1182, 'optimizer': 'Adam'}. Best is trial 47 with value: 0.06812722426530939.
2026-05-11 05:07:37,317 - optuna.study._optimize - INFO - Trial 50 pruned. 
2026-05-11 05:08:04,362 - optuna.study.study - INFO - Trial 51 finished with value: 0.07377849062208333 and parameters: {'n_layers': 1, 'embedding_dim': 64, 'lr': 0.01314230895491684, 'lambda_val': 0.0041435436790084835, 'batch_size': 1357, 'optimizer': 'Adam'}. Best is trial 51 with value: 0.07377849062208333.
2026-05-11 05:08:33,976 - optuna.study.study - INFO - Trial 52 finished with value: 0.06896156732199181 and parameters: {'n_layers': 1, 'embedding_dim': 64, 'lr': 0.014520829733562586, 'lambda_val': 0.0032867466717875853, 'batch_size': 1382, 'optimizer': 'Adam'}. Best is trial 51 with value: 0.07377849062208333.
2026-05-11 05:09:11,873 - optuna.study.study - INFO - Trial 53 finished with value: 0.06903379609628278 and parameters: {'n_layers': 1, 'embedding_dim': 64, 'lr': 0.008031505802921838, 'lambda_val': 0.003755038129522794, 'batch_size': 1391, 'optimizer': 'Adam'}. Best is trial 51 with value: 0.07377849062208333.
2026-05-11 05:09:46,751 - optuna.study.study - INFO - Trial 54 finished with value: 0.061751337161261854 and parameters: {'n_layers': 1, 'embedding_dim': 64, 'lr': 0.003306563909893711, 'lambda_val': 0.0036036377056884103, 'batch_size': 1322, 'optimizer': 'Adam'}. Best is trial 51 with value: 0.07377849062208333.
2026-05-11 05:10:14,719 - optuna.study.study - INFO - Trial 55 finished with value: 0.06089015074565001 and parameters: {'n_layers': 1, 'embedding_dim': 64, 'lr': 0.0029938425125233385, 'lambda_val': 0.0036169418815265387, 'batch_size': 1318, 'optimizer': 'Adam'}. Best is trial 51 with value: 0.07377849062208333.
2026-05-11 05:10:45,071 - optuna.study.study - INFO - Trial 56 finished with value: 0.0673276858043109 and parameters: {'n_layers': 1, 'embedding_dim': 64, 'lr': 0.006613750306510887, 'lambda_val': 0.0011046574378371988, 'batch_size': 3490, 'optimizer': 'Adam'}. Best is trial 51 with value: 0.07377849062208333.
2026-05-11 05:11:14,166 - optuna.study.study - INFO - Trial 57 finished with value: 0.061830841747837505 and parameters: {'n_layers': 1, 'embedding_dim': 64, 'lr': 0.007767919735267868, 'lambda_val': 0.0006429956510083948, 'batch_size': 3541, 'optimizer': 'Adam'}. Best is trial 51 with value: 0.07377849062208333.
2026-05-11 05:11:21,063 - optuna.study._optimize - INFO - Trial 58 pruned. 
2026-05-11 05:11:51,468 - optuna.study.study - INFO - Trial 59 finished with value: 0.052293180138919315 and parameters: {'n_layers': 1, 'embedding_dim': 64, 'lr': 0.00125332019137516, 'lambda_val': 0.0012598223877738407, 'batch_size': 2635, 'optimizer': 'Adam'}. Best is trial 51 with value: 0.07377849062208333.
2026-05-11 05:11:56,105 - optuna.study._optimize - INFO - Trial 60 pruned. 
2026-05-11 05:12:26,823 - optuna.study.study - INFO - Trial 61 finished with value: 0.0637515657985369 and parameters: {'n_layers': 1, 'embedding_dim': 64, 'lr': 0.008680001164151994, 'lambda_val': 0.0007021494165793055, 'batch_size': 3586, 'optimizer': 'Adam'}. Best is trial 51 with value: 0.07377849062208333.
2026-05-11 05:12:57,913 - optuna.study.study - INFO - Trial 62 finished with value: 0.06631385198457979 and parameters: {'n_layers': 1, 'embedding_dim': 64, 'lr': 0.009273997607158605, 'lambda_val': 0.0005093676434021847, 'batch_size': 3980, 'optimizer': 'Adam'}. Best is trial 51 with value: 0.07377849062208333.
2026-05-11 05:13:24,259 - optuna.study._optimize - INFO - Trial 63 pruned. 
2026-05-11 05:13:55,304 - optuna.study.study - INFO - Trial 64 finished with value: 0.0635299435081653 and parameters: {'n_layers': 1, 'embedding_dim': 64, 'lr': 0.006149530103141786, 'lambda_val': 0.0007583352614147018, 'batch_size': 4096, 'optimizer': 'Adam'}. Best is trial 51 with value: 0.07377849062208333.
2026-05-11 05:14:00,009 - optuna.study._optimize - INFO - Trial 65 pruned. 
2026-05-11 05:14:35,543 - optuna.study.study - INFO - Trial 66 finished with value: 0.05630445679061973 and parameters: {'n_layers': 1, 'embedding_dim': 64, 'lr': 0.009485797106476061, 'lambda_val': 0.00048381687161665513, 'batch_size': 3297, 'optimizer': 'RMSprop'}. Best is trial 51 with value: 0.07377849062208333.
2026-05-11 05:14:55,042 - optuna.study._optimize - INFO - Trial 67 pruned. 
2026-05-11 05:15:35,700 - optuna.study.study - INFO - Trial 68 finished with value: 0.054675907115259464 and parameters: {'n_layers': 1, 'embedding_dim': 256, 'lr': 0.0041311721923365284, 'lambda_val': 4.3622943994919e-05, 'batch_size': 3741, 'optimizer': 'Adam'}. Best is trial 51 with value: 0.07377849062208333.
2026-05-11 05:15:41,899 - optuna.study._optimize - INFO - Trial 69 pruned. 
2026-05-11 05:16:20,787 - optuna.study.study - INFO - Trial 70 finished with value: 0.07451871692703861 and parameters: {'n_layers': 1, 'embedding_dim': 128, 'lr': 0.0020362387517002018, 'lambda_val': 0.0026260524554527287, 'batch_size': 3455, 'optimizer': 'Adam'}. Best is trial 70 with value: 0.07451871692703861.
2026-05-11 05:16:53,448 - optuna.study.study - INFO - Trial 71 finished with value: 0.07142731751307697 and parameters: {'n_layers': 1, 'embedding_dim': 128, 'lr': 0.0024718363924527142, 'lambda_val': 0.0012942633461638178, 'batch_size': 3473, 'optimizer': 'Adam'}. Best is trial 70 with value: 0.07451871692703861.
2026-05-11 05:17:26,928 - optuna.study.study - INFO - Trial 72 finished with value: 0.07734138520635096 and parameters: {'n_layers': 1, 'embedding_dim': 128, 'lr': 0.0022654247644716347, 'lambda_val': 0.0025816226799488706, 'batch_size': 3470, 'optimizer': 'Adam'}. Best is trial 72 with value: 0.07734138520635096.
2026-05-11 05:17:59,608 - optuna.study.study - INFO - Trial 73 finished with value: 0.06527405057640462 and parameters: {'n_layers': 1, 'embedding_dim': 128, 'lr': 0.0012623957458583598, 'lambda_val': 0.0025013000730982633, 'batch_size': 3123, 'optimizer': 'Adam'}. Best is trial 72 with value: 0.07734138520635096.
2026-05-11 05:18:33,691 - optuna.study.study - INFO - Trial 74 finished with value: 0.0661934176003129 and parameters: {'n_layers': 1, 'embedding_dim': 128, 'lr': 0.0025229283981637964, 'lambda_val': 0.0013512601944728711, 'batch_size': 3442, 'optimizer': 'Adam'}. Best is trial 72 with value: 0.07734138520635096.
2026-05-11 05:19:07,151 - optuna.study.study - INFO - Trial 75 finished with value: 0.07080163637404278 and parameters: {'n_layers': 1, 'embedding_dim': 128, 'lr': 0.0016406380094882104, 'lambda_val': 0.004582146784874955, 'batch_size': 3705, 'optimizer': 'Adam'}. Best is trial 72 with value: 0.07734138520635096.
2026-05-11 05:19:39,430 - optuna.study.study - INFO - Trial 76 finished with value: 0.054799128906137716 and parameters: {'n_layers': 1, 'embedding_dim': 128, 'lr': 0.0006437914458343636, 'lambda_val': 0.005432182134832969, 'batch_size': 3169, 'optimizer': 'RMSprop'}. Best is trial 72 with value: 0.07734138520635096.
2026-05-11 05:20:11,929 - optuna.study.study - INFO - Trial 77 finished with value: 0.05885544093526678 and parameters: {'n_layers': 1, 'embedding_dim': 128, 'lr': 0.0019850533518648485, 'lambda_val': 0.010958862701732224, 'batch_size': 2983, 'optimizer': 'Adam'}. Best is trial 72 with value: 0.07734138520635096.
2026-05-11 05:20:45,240 - optuna.study.study - INFO - Trial 78 finished with value: 0.0685752195097561 and parameters: {'n_layers': 1, 'embedding_dim': 128, 'lr': 0.0014429119795055603, 'lambda_val': 0.004208149958688543, 'batch_size': 3299, 'optimizer': 'Adam'}. Best is trial 72 with value: 0.07734138520635096.
2026-05-11 05:21:18,266 - optuna.study.study - INFO - Trial 79 finished with value: 0.05832936385674002 and parameters: {'n_layers': 1, 'embedding_dim': 128, 'lr': 0.0007082990307571709, 'lambda_val': 0.004212899243721592, 'batch_size': 3690, 'optimizer': 'Adam'}. Best is trial 72 with value: 0.07734138520635096.
2026-05-11 05:21:24,328 - optuna.study._optimize - INFO - Trial 80 pruned. 
2026-05-11 05:21:29,620 - optuna.study._optimize - INFO - Trial 81 pruned. 
2026-05-11 05:22:05,054 - optuna.study.study - INFO - Trial 82 finished with value: 0.073501665937751 and parameters: {'n_layers': 1, 'embedding_dim': 128, 'lr': 0.0016540182962827023, 'lambda_val': 0.004580408684378753, 'batch_size': 3405, 'optimizer': 'Adam'}. Best is trial 72 with value: 0.07734138520635096.
2026-05-11 05:22:38,014 - optuna.study.study - INFO - Trial 83 finished with value: 0.06121638014044423 and parameters: {'n_layers': 1, 'embedding_dim': 128, 'lr': 0.0015190614966654927, 'lambda_val': 0.006491845585261657, 'batch_size': 3382, 'optimizer': 'Adam'}. Best is trial 72 with value: 0.07734138520635096.
2026-05-11 05:23:13,936 - optuna.study.study - INFO - Trial 84 finished with value: 0.05348069307889399 and parameters: {'n_layers': 1, 'embedding_dim': 128, 'lr': 0.0004624553609774199, 'lambda_val': 0.0018963459459452267, 'batch_size': 3795, 'optimizer': 'Adam'}. Best is trial 72 with value: 0.07734138520635096.
2026-05-11 05:23:49,710 - optuna.study.study - INFO - Trial 85 finished with value: 0.05971971565452777 and parameters: {'n_layers': 1, 'embedding_dim': 128, 'lr': 0.0008746793988123328, 'lambda_val': 0.0047772644310752465, 'batch_size': 3351, 'optimizer': 'Adam'}. Best is trial 72 with value: 0.07734138520635096.
2026-05-11 05:24:33,726 - optuna.study.study - INFO - Trial 86 finished with value: 0.07392115760615223 and parameters: {'n_layers': 1, 'embedding_dim': 128, 'lr': 0.0015183054708792576, 'lambda_val': 0.0032545461048627206, 'batch_size': 3474, 'optimizer': 'Adam'}. Best is trial 72 with value: 0.07734138520635096.
2026-05-11 05:25:20,070 - optuna.study.study - INFO - Trial 87 finished with value: 0.059570752769339305 and parameters: {'n_layers': 1, 'embedding_dim': 128, 'lr': 0.001949556871617015, 'lambda_val': 0.008766046726023411, 'batch_size': 3499, 'optimizer': 'Adam'}. Best is trial 72 with value: 0.07734138520635096.
2026-05-11 05:26:05,234 - optuna.study.study - INFO - Trial 88 finished with value: 0.06645441735178735 and parameters: {'n_layers': 1, 'embedding_dim': 128, 'lr': 0.0009865174805802803, 'lambda_val': 0.00268627953687831, 'batch_size': 3755, 'optimizer': 'RMSprop'}. Best is trial 72 with value: 0.07734138520635096.
2026-05-11 05:26:11,102 - optuna.study._optimize - INFO - Trial 89 pruned. 
2026-05-11 05:26:15,492 - optuna.study._optimize - INFO - Trial 90 pruned. 
2026-05-11 05:26:49,852 - optuna.study.study - INFO - Trial 91 finished with value: 0.07123502185768459 and parameters: {'n_layers': 1, 'embedding_dim': 128, 'lr': 0.0014479069441967866, 'lambda_val': 0.0033551421381112015, 'batch_size': 3411, 'optimizer': 'Adam'}. Best is trial 72 with value: 0.07734138520635096.
2026-05-11 05:27:23,422 - optuna.study.study - INFO - Trial 92 finished with value: 0.0732600299761597 and parameters: {'n_layers': 1, 'embedding_dim': 128, 'lr': 0.002172870515937115, 'lambda_val': 0.0030580599083876586, 'batch_size': 3419, 'optimizer': 'Adam'}. Best is trial 72 with value: 0.07734138520635096.
2026-05-11 05:28:02,030 - optuna.study.study - INFO - Trial 93 finished with value: 0.05783991530557302 and parameters: {'n_layers': 1, 'embedding_dim': 128, 'lr': 0.0006346607542903626, 'lambda_val': 0.0019689794733934634, 'batch_size': 3582, 'optimizer': 'Adam'}. Best is trial 72 with value: 0.07734138520635096.
2026-05-11 05:28:36,802 - optuna.study.study - INFO - Trial 94 finished with value: 0.06851838174189913 and parameters: {'n_layers': 1, 'embedding_dim': 128, 'lr': 0.0022328437027261112, 'lambda_val': 0.006808740630016884, 'batch_size': 3424, 'optimizer': 'Adam'}. Best is trial 72 with value: 0.07734138520635096.
2026-05-11 05:29:12,842 - optuna.study.study - INFO - Trial 95 finished with value: 0.06753456799479177 and parameters: {'n_layers': 1, 'embedding_dim': 128, 'lr': 0.0014516340265762337, 'lambda_val': 0.0029191511633351393, 'batch_size': 2838, 'optimizer': 'Adam'}. Best is trial 72 with value: 0.07734138520635096.
2026-05-11 05:29:18,596 - optuna.study._optimize - INFO - Trial 96 pruned. 
2026-05-11 05:29:52,972 - optuna.study.study - INFO - Trial 97 finished with value: 0.06456285957198103 and parameters: {'n_layers': 1, 'embedding_dim': 128, 'lr': 0.0011134089999415625, 'lambda_val': 0.005051552348856761, 'batch_size': 3505, 'optimizer': 'Adam'}. Best is trial 72 with value: 0.07734138520635096.
2026-05-11 05:30:33,206 - optuna.study.study - INFO - Trial 98 finished with value: 0.05802280938818494 and parameters: {'n_layers': 1, 'embedding_dim': 128, 'lr': 0.000492723700517837, 'lambda_val': 0.002324517122146075, 'batch_size': 3448, 'optimizer': 'Adam'}. Best is trial 72 with value: 0.07734138520635096.
2026-05-11 05:31:15,941 - optuna.study.study - INFO - Trial 99 finished with value: 0.0781285791479747 and parameters: {'n_layers': 1, 'embedding_dim': 256, 'lr': 0.0026563272530605833, 'lambda_val': 0.0017326825876741972, 'batch_size': 3145, 'optimizer': 'Adam'}. Best is trial 99 with value: 0.0781285791479747.
2026-05-11 05:31:55,021 - optuna.study.study - INFO - Trial 100 finished with value: 0.059074078368378774 and parameters: {'n_layers': 1, 'embedding_dim': 256, 'lr': 0.0003019111661216692, 'lambda_val': 0.001733029866411769, 'batch_size': 3141, 'optimizer': 'Adam'}. Best is trial 99 with value: 0.0781285791479747.
2026-05-11 05:32:32,162 - optuna.study.study - INFO - Trial 101 finished with value: 0.07044101731461656 and parameters: {'n_layers': 1, 'embedding_dim': 256, 'lr': 0.0026620483972591698, 'lambda_val': 0.005932407673703215, 'batch_size': 3352, 'optimizer': 'Adam'}. Best is trial 99 with value: 0.0781285791479747.
2026-05-11 05:33:21,264 - optuna.study.study - INFO - Trial 102 finished with value: 0.07944002907862126 and parameters: {'n_layers': 1, 'embedding_dim': 256, 'lr': 0.002222938566420467, 'lambda_val': 0.0009193931200225015, 'batch_size': 3335, 'optimizer': 'Adam'}. Best is trial 102 with value: 0.07944002907862126.
2026-05-11 05:33:59,338 - optuna.study.study - INFO - Trial 103 finished with value: 0.07159990268684481 and parameters: {'n_layers': 1, 'embedding_dim': 256, 'lr': 0.0023314355167573355, 'lambda_val': 0.0009580227883536548, 'batch_size': 3548, 'optimizer': 'Adam'}. Best is trial 102 with value: 0.07944002907862126.
2026-05-11 05:34:35,225 - optuna.study.study - INFO - Trial 104 finished with value: 0.06992104393382399 and parameters: {'n_layers': 1, 'embedding_dim': 256, 'lr': 0.0021950680237784463, 'lambda_val': 0.0009715810773861551, 'batch_size': 3227, 'optimizer': 'Adam'}. Best is trial 102 with value: 0.07944002907862126.
2026-05-11 05:35:09,939 - optuna.study.study - INFO - Trial 105 finished with value: 0.0768610504503837 and parameters: {'n_layers': 1, 'embedding_dim': 256, 'lr': 0.003603826152448958, 'lambda_val': 0.0012775784821593, 'batch_size': 3555, 'optimizer': 'Adam'}. Best is trial 102 with value: 0.07944002907862126.
2026-05-11 05:35:48,454 - optuna.study.study - INFO - Trial 106 finished with value: 0.08051249449768202 and parameters: {'n_layers': 1, 'embedding_dim': 256, 'lr': 0.005327283557713005, 'lambda_val': 0.0012790460205767632, 'batch_size': 3607, 'optimizer': 'Adam'}. Best is trial 106 with value: 0.08051249449768202.
2026-05-11 05:36:27,670 - optuna.study.study - INFO - Trial 107 finished with value: 0.07135113181857694 and parameters: {'n_layers': 1, 'embedding_dim': 256, 'lr': 0.0037301208968281985, 'lambda_val': 0.000875022089030243, 'batch_size': 3616, 'optimizer': 'Adam'}. Best is trial 106 with value: 0.08051249449768202.
2026-05-11 05:36:32,954 - optuna.study._optimize - INFO - Trial 108 pruned. 
2026-05-11 05:37:11,876 - optuna.study.study - INFO - Trial 109 finished with value: 0.07359653188566463 and parameters: {'n_layers': 1, 'embedding_dim': 256, 'lr': 0.005647378650186543, 'lambda_val': 0.0006244450722147415, 'batch_size': 3894, 'optimizer': 'Adam'}. Best is trial 106 with value: 0.08051249449768202.
2026-05-11 05:37:52,179 - optuna.study.study - INFO - Trial 110 finished with value: 0.07368082217812848 and parameters: {'n_layers': 1, 'embedding_dim': 256, 'lr': 0.0052577863912222425, 'lambda_val': 0.0005515447826855692, 'batch_size': 3955, 'optimizer': 'Adam'}. Best is trial 106 with value: 0.08051249449768202.
2026-05-11 05:38:31,048 - optuna.study.study - INFO - Trial 111 finished with value: 0.07307439538899438 and parameters: {'n_layers': 1, 'embedding_dim': 256, 'lr': 0.00478810889661984, 'lambda_val': 0.0006713046355067761, 'batch_size': 3795, 'optimizer': 'Adam'}. Best is trial 106 with value: 0.08051249449768202.
2026-05-11 05:39:12,496 - optuna.study.study - INFO - Trial 112 finished with value: 0.08064309430179928 and parameters: {'n_layers': 1, 'embedding_dim': 256, 'lr': 0.0049958103026020015, 'lambda_val': 0.0006262863283125971, 'batch_size': 3932, 'optimizer': 'Adam'}. Best is trial 112 with value: 0.08064309430179928.
2026-05-11 05:39:51,905 - optuna.study.study - INFO - Trial 113 finished with value: 0.07356575646590309 and parameters: {'n_layers': 1, 'embedding_dim': 256, 'lr': 0.00518295929438514, 'lambda_val': 0.0005669522934032612, 'batch_size': 3951, 'optimizer': 'Adam'}. Best is trial 112 with value: 0.08064309430179928.
2026-05-11 05:40:30,050 - optuna.study.study - INFO - Trial 114 finished with value: 0.06702642285963684 and parameters: {'n_layers': 1, 'embedding_dim': 256, 'lr': 0.005118018919687937, 'lambda_val': 0.0002960909973038365, 'batch_size': 3939, 'optimizer': 'Adam'}. Best is trial 112 with value: 0.08064309430179928.
