2026-05-11 16:30:39,894 - optuna.study.study - INFO - Trial 193 finished with value: 0.08514900882333208 and parameters: {'n_layers': 1, 'embedding_dim': 256, 'lr': 0.006955914458520244, 'lambda_val': 0.0009239938080671519, 'batch_size': 3999, 'optimizer': 'Adam'}. Best is trial 191 with value: 0.0908249562513113.
2026-05-11 16:31:16,474 - optuna.study.study - INFO - Trial 194 finished with value: 0.08678989015153558 and parameters: {'n_layers': 1, 'embedding_dim': 256, 'lr': 0.007162831534433823, 'lambda_val': 0.0016117597084562246, 'batch_size': 3847, 'optimizer': 'Adam'}. Best is trial 191 with value: 0.0908249562513113.
2026-05-11 16:31:52,746 - optuna.study.study - INFO - Trial 195 finished with value: 0.08637326800646401 and parameters: {'n_layers': 1, 'embedding_dim': 256, 'lr': 0.0066727210756903675, 'lambda_val': 0.001224760808900962, 'batch_size': 3809, 'optimizer': 'Adam'}. Best is trial 191 with value: 0.0908249562513113.
2026-05-11 16:32:29,198 - optuna.study.study - INFO - Trial 196 finished with value: 0.08440317720867908 and parameters: {'n_layers': 1, 'embedding_dim': 256, 'lr': 0.006730789146146045, 'lambda_val': 0.0011921618933417367, 'batch_size': 3829, 'optimizer': 'Adam'}. Best is trial 191 with value: 0.0908249562513113.
2026-05-11 16:33:05,451 - optuna.study.study - INFO - Trial 197 finished with value: 0.0791786104598675 and parameters: {'n_layers': 1, 'embedding_dim': 256, 'lr': 0.008288961438229516, 'lambda_val': 0.0008199065308393289, 'batch_size': 4011, 'optimizer': 'Adam'}. Best is trial 191 with value: 0.0908249562513113.
2026-05-11 16:33:10,324 - optuna.study._optimize - INFO - Trial 198 pruned. 
2026-05-11 16:33:14,298 - optuna.study._optimize - INFO - Trial 199 pruned. 
