2026-05-11 00:18:28,270 - optuna.study.study - INFO - Trial 105 finished with value: 0.07996129728030064 and parameters: {'n_layers': 1, 'embedding_dim': 256, 'lr': 0.0051218899054900225, 'lambda_val': 0.0016738838608497204, 'batch_size': 3415, 'optimizer': 'RMSprop'}. Best is trial 7 with value: 0.08532008709719469.
2026-05-11 00:18:32,554 - optuna.study._optimize - INFO - Trial 106 pruned. 
2026-05-11 00:18:46,468 - optuna.study._optimize - INFO - Trial 107 pruned. 
2026-05-11 00:18:50,737 - optuna.study._optimize - INFO - Trial 108 pruned. 
2026-05-11 00:18:55,283 - optuna.study._optimize - INFO - Trial 109 pruned. 
2026-05-11 00:19:00,531 - optuna.study._optimize - INFO - Trial 110 pruned. 
2026-05-11 00:19:35,184 - optuna.study.study - INFO - Trial 111 finished with value: 0.07408350325252565 and parameters: {'n_layers': 1, 'embedding_dim': 256, 'lr': 0.009673803613857078, 'lambda_val': 0.0024432705397435393, 'batch_size': 3278, 'optimizer': 'RMSprop'}. Best is trial 7 with value: 0.08532008709719469.
2026-05-11 00:19:48,820 - optuna.study._optimize - INFO - Trial 112 pruned. 
2026-05-11 00:20:23,268 - optuna.study.study - INFO - Trial 113 finished with value: 0.07616920199121756 and parameters: {'n_layers': 1, 'embedding_dim': 256, 'lr': 0.004225950084847694, 'lambda_val': 0.0017647371422766865, 'batch_size': 3435, 'optimizer': 'RMSprop'}. Best is trial 7 with value: 0.08532008709719469.
2026-05-11 00:20:27,687 - optuna.study._optimize - INFO - Trial 114 pruned. 
2026-05-11 00:20:32,333 - optuna.study._optimize - INFO - Trial 115 pruned. 
2026-05-11 00:20:37,468 - optuna.study._optimize - INFO - Trial 116 pruned. 
2026-05-11 00:20:42,066 - optuna.study._optimize - INFO - Trial 117 pruned. 
2026-05-11 00:21:17,427 - optuna.study.study - INFO - Trial 118 finished with value: 0.07475046637226125 and parameters: {'n_layers': 1, 'embedding_dim': 256, 'lr': 0.004896393920233619, 'lambda_val': 0.0010624290561331157, 'batch_size': 3350, 'optimizer': 'RMSprop'}. Best is trial 7 with value: 0.08532008709719469.
2026-05-11 00:21:21,633 - optuna.study._optimize - INFO - Trial 119 pruned. 
2026-05-11 00:21:25,896 - optuna.study._optimize - INFO - Trial 120 pruned. 
2026-05-11 00:22:00,213 - optuna.study.study - INFO - Trial 121 finished with value: 0.07512215289968131 and parameters: {'n_layers': 1, 'embedding_dim': 256, 'lr': 0.006179160069874576, 'lambda_val': 0.002661864859853177, 'batch_size': 3884, 'optimizer': 'RMSprop'}. Best is trial 7 with value: 0.08532008709719469.
2026-05-11 00:22:06,918 - optuna.study._optimize - INFO - Trial 122 pruned. 
2026-05-11 00:22:41,590 - optuna.study.study - INFO - Trial 123 finished with value: 0.08002006802424742 and parameters: {'n_layers': 1, 'embedding_dim': 256, 'lr': 0.004113211547160725, 'lambda_val': 0.0015607238299694417, 'batch_size': 3737, 'optimizer': 'RMSprop'}. Best is trial 7 with value: 0.08532008709719469.
2026-05-11 00:23:16,415 - optuna.study.study - INFO - Trial 124 finished with value: 0.08012046021205682 and parameters: {'n_layers': 1, 'embedding_dim': 256, 'lr': 0.008172514395927784, 'lambda_val': 0.0021465031711149214, 'batch_size': 2735, 'optimizer': 'RMSprop'}. Best is trial 7 with value: 0.08532008709719469.
2026-05-11 00:23:50,603 - optuna.study.study - INFO - Trial 125 finished with value: 0.07884234469251127 and parameters: {'n_layers': 1, 'embedding_dim': 256, 'lr': 0.00856012085087914, 'lambda_val': 0.0020485947232393676, 'batch_size': 3207, 'optimizer': 'RMSprop'}. Best is trial 7 with value: 0.08532008709719469.
2026-05-11 00:23:54,665 - optuna.study._optimize - INFO - Trial 126 pruned. 
2026-05-11 00:24:29,115 - optuna.study.study - INFO - Trial 127 finished with value: 0.08238459895205481 and parameters: {'n_layers': 1, 'embedding_dim': 256, 'lr': 0.007401154812795337, 'lambda_val': 0.0008989039796805462, 'batch_size': 3620, 'optimizer': 'RMSprop'}. Best is trial 7 with value: 0.08532008709719469.
2026-05-11 00:24:39,935 - optuna.study._optimize - INFO - Trial 128 pruned. 
2026-05-11 00:24:45,957 - optuna.study._optimize - INFO - Trial 129 pruned. 
2026-05-11 00:24:49,690 - optuna.study._optimize - INFO - Trial 130 pruned. 
2026-05-11 00:25:24,644 - optuna.study.study - INFO - Trial 131 finished with value: 0.07734288106579097 and parameters: {'n_layers': 1, 'embedding_dim': 256, 'lr': 0.007762034477522311, 'lambda_val': 0.0020481773340694704, 'batch_size': 3590, 'optimizer': 'RMSprop'}. Best is trial 7 with value: 0.08532008709719469.
2026-05-11 00:25:29,108 - optuna.study._optimize - INFO - Trial 132 pruned. 
2026-05-11 00:26:03,969 - optuna.study.study - INFO - Trial 133 finished with value: 0.07957494014763423 and parameters: {'n_layers': 1, 'embedding_dim': 256, 'lr': 0.010207353733636605, 'lambda_val': 0.0009961434995690603, 'batch_size': 2786, 'optimizer': 'RMSprop'}. Best is trial 7 with value: 0.08532008709719469.
2026-05-11 00:26:16,442 - optuna.study._optimize - INFO - Trial 134 pruned. 
2026-05-11 00:26:51,759 - optuna.study.study - INFO - Trial 135 finished with value: 0.07757460484547048 and parameters: {'n_layers': 1, 'embedding_dim': 256, 'lr': 0.00414717769269385, 'lambda_val': 0.0016234398533584472, 'batch_size': 3058, 'optimizer': 'RMSprop'}. Best is trial 7 with value: 0.08532008709719469.
2026-05-11 00:27:25,977 - optuna.study.study - INFO - Trial 136 finished with value: 0.07499305533120876 and parameters: {'n_layers': 1, 'embedding_dim': 256, 'lr': 0.006112670041698116, 'lambda_val': 0.0028145932870839397, 'batch_size': 3454, 'optimizer': 'RMSprop'}. Best is trial 7 with value: 0.08532008709719469.
2026-05-11 00:27:30,985 - optuna.study._optimize - INFO - Trial 137 pruned. 
2026-05-11 00:27:35,248 - optuna.study._optimize - INFO - Trial 138 pruned. 
2026-05-11 00:27:39,401 - optuna.study._optimize - INFO - Trial 139 pruned. 
2026-05-11 00:28:14,357 - optuna.study.study - INFO - Trial 140 finished with value: 0.08162174780045142 and parameters: {'n_layers': 1, 'embedding_dim': 256, 'lr': 0.00712644260364055, 'lambda_val': 0.0011238461813802638, 'batch_size': 3125, 'optimizer': 'RMSprop'}. Best is trial 7 with value: 0.08532008709719469.
2026-05-11 00:28:48,946 - optuna.study.study - INFO - Trial 141 finished with value: 0.08265294830334816 and parameters: {'n_layers': 1, 'embedding_dim': 256, 'lr': 0.007106645762659058, 'lambda_val': 0.0011189456086344216, 'batch_size': 2967, 'optimizer': 'RMSprop'}. Best is trial 7 with value: 0.08532008709719469.
2026-05-11 00:29:23,666 - optuna.study.study - INFO - Trial 142 finished with value: 0.08112873785827229 and parameters: {'n_layers': 1, 'embedding_dim': 256, 'lr': 0.006900591214005661, 'lambda_val': 0.0010889579656850586, 'batch_size': 3303, 'optimizer': 'RMSprop'}. Best is trial 7 with value: 0.08532008709719469.
2026-05-11 00:29:58,136 - optuna.study.study - INFO - Trial 143 finished with value: 0.07251890511534331 and parameters: {'n_layers': 1, 'embedding_dim': 256, 'lr': 0.005424433316833134, 'lambda_val': 0.0008360882297175833, 'batch_size': 3146, 'optimizer': 'RMSprop'}. Best is trial 7 with value: 0.08532008709719469.
2026-05-11 00:30:33,005 - optuna.study.study - INFO - Trial 144 finished with value: 0.05438030605036851 and parameters: {'n_layers': 1, 'embedding_dim': 256, 'lr': 0.0003611289651828108, 'lambda_val': 0.0010598931111565158, 'batch_size': 3351, 'optimizer': 'RMSprop'}. Best is trial 7 with value: 0.08532008709719469.
2026-05-11 00:30:37,266 - optuna.study._optimize - INFO - Trial 145 pruned. 
2026-05-11 00:31:11,781 - optuna.study.study - INFO - Trial 146 finished with value: 0.07866505991915963 and parameters: {'n_layers': 1, 'embedding_dim': 256, 'lr': 0.0041770481031723015, 'lambda_val': 0.0017125889728039495, 'batch_size': 3551, 'optimizer': 'RMSprop'}. Best is trial 7 with value: 0.08532008709719469.
2026-05-11 00:31:15,821 - optuna.study._optimize - INFO - Trial 147 pruned. 
2026-05-11 00:31:20,141 - optuna.study._optimize - INFO - Trial 148 pruned. 
2026-05-11 00:31:42,134 - optuna.study._optimize - INFO - Trial 149 pruned. 
2026-05-11 00:31:47,560 - optuna.study._optimize - INFO - Trial 150 pruned. 
2026-05-11 00:31:52,581 - optuna.study._optimize - INFO - Trial 151 pruned. 
2026-05-11 00:32:26,721 - optuna.study.study - INFO - Trial 152 finished with value: 0.08086540814699304 and parameters: {'n_layers': 1, 'embedding_dim': 256, 'lr': 0.008052755520775518, 'lambda_val': 0.0018390344647397918, 'batch_size': 3233, 'optimizer': 'RMSprop'}. Best is trial 7 with value: 0.08532008709719469.
2026-05-11 00:32:33,101 - optuna.study._optimize - INFO - Trial 153 pruned. 
2026-05-11 00:32:37,451 - optuna.study._optimize - INFO - Trial 154 pruned. 
2026-05-11 00:33:12,172 - optuna.study.study - INFO - Trial 155 finished with value: 0.08609100438881132 and parameters: {'n_layers': 1, 'embedding_dim': 256, 'lr': 0.004551449658911473, 'lambda_val': 0.0014466025098959778, 'batch_size': 3596, 'optimizer': 'RMSprop'}. Best is trial 155 with value: 0.08609100438881132.
2026-05-11 00:33:16,115 - optuna.study._optimize - INFO - Trial 156 pruned. 
2026-05-11 00:33:20,435 - optuna.study._optimize - INFO - Trial 157 pruned. 
2026-05-11 00:33:24,762 - optuna.study._optimize - INFO - Trial 158 pruned. 
2026-05-11 00:33:30,017 - optuna.study._optimize - INFO - Trial 159 pruned. 
2026-05-11 00:33:33,835 - optuna.study._optimize - INFO - Trial 160 pruned. 
2026-05-11 00:34:08,840 - optuna.study.study - INFO - Trial 161 finished with value: 0.07825492590324698 and parameters: {'n_layers': 1, 'embedding_dim': 256, 'lr': 0.0056467668061243505, 'lambda_val': 0.0018633388657177288, 'batch_size': 3600, 'optimizer': 'RMSprop'}. Best is trial 155 with value: 0.08609100438881132.
2026-05-11 00:34:43,357 - optuna.study.study - INFO - Trial 162 finished with value: 0.08240273053286123 and parameters: {'n_layers': 1, 'embedding_dim': 256, 'lr': 0.0037401661165057153, 'lambda_val': 0.0023992874436194562, 'batch_size': 3888, 'optimizer': 'RMSprop'}. Best is trial 155 with value: 0.08609100438881132.
2026-05-11 00:35:17,851 - optuna.study.study - INFO - Trial 163 finished with value: 0.08065613795904522 and parameters: {'n_layers': 1, 'embedding_dim': 256, 'lr': 0.003771407224286869, 'lambda_val': 0.0012809938867589404, 'batch_size': 3922, 'optimizer': 'RMSprop'}. Best is trial 155 with value: 0.08609100438881132.
2026-05-11 00:35:22,307 - optuna.study._optimize - INFO - Trial 164 pruned. 
2026-05-11 00:35:26,732 - optuna.study._optimize - INFO - Trial 165 pruned. 
2026-05-11 00:36:01,843 - optuna.study.study - INFO - Trial 166 finished with value: 0.06241864275038301 and parameters: {'n_layers': 1, 'embedding_dim': 256, 'lr': 0.00011028573490595268, 'lambda_val': 0.003644995247888326, 'batch_size': 4006, 'optimizer': 'RMSprop'}. Best is trial 155 with value: 0.08609100438881132.
2026-05-11 00:36:36,248 - optuna.study.study - INFO - Trial 167 finished with value: 0.08227381069364041 and parameters: {'n_layers': 1, 'embedding_dim': 256, 'lr': 0.006891751057752692, 'lambda_val': 0.0014548939677286293, 'batch_size': 3828, 'optimizer': 'RMSprop'}. Best is trial 155 with value: 0.08609100438881132.
2026-05-11 00:36:40,952 - optuna.study._optimize - INFO - Trial 168 pruned. 
2026-05-11 00:37:17,729 - optuna.study.study - INFO - Trial 169 finished with value: 0.053444191495286716 and parameters: {'n_layers': 1, 'embedding_dim': 256, 'lr': 0.0006391870941048871, 'lambda_val': 7.268785682387887e-06, 'batch_size': 3771, 'optimizer': 'RMSprop'}. Best is trial 155 with value: 0.08609100438881132.
2026-05-11 00:37:52,740 - optuna.study.study - INFO - Trial 170 finished with value: 0.07260723834277286 and parameters: {'n_layers': 1, 'embedding_dim': 256, 'lr': 0.00675634358698512, 'lambda_val': 0.002350645427934503, 'batch_size': 3828, 'optimizer': 'RMSprop'}. Best is trial 155 with value: 0.08609100438881132.
2026-05-11 00:38:27,963 - optuna.study.study - INFO - Trial 171 finished with value: 0.08508768828982201 and parameters: {'n_layers': 1, 'embedding_dim': 256, 'lr': 0.0037135184388099756, 'lambda_val': 0.0014480962928296469, 'batch_size': 3937, 'optimizer': 'RMSprop'}. Best is trial 155 with value: 0.08609100438881132.
2026-05-11 00:39:14,364 - optuna.study.study - INFO - Trial 172 finished with value: 0.0806248275288652 and parameters: {'n_layers': 1, 'embedding_dim': 256, 'lr': 0.004945759145668067, 'lambda_val': 0.00152793758320209, 'batch_size': 3082, 'optimizer': 'RMSprop'}. Best is trial 155 with value: 0.08609100438881132.
2026-05-11 00:39:49,874 - optuna.study.study - INFO - Trial 173 finished with value: 0.07816407176106253 and parameters: {'n_layers': 1, 'embedding_dim': 256, 'lr': 0.006239275777717785, 'lambda_val': 0.0009719013151297848, 'batch_size': 3857, 'optimizer': 'RMSprop'}. Best is trial 155 with value: 0.08609100438881132.
2026-05-11 00:40:24,568 - optuna.study.study - INFO - Trial 174 finished with value: 0.07464804587514887 and parameters: {'n_layers': 1, 'embedding_dim': 256, 'lr': 0.009535033926594744, 'lambda_val': 0.002043059690596624, 'batch_size': 3990, 'optimizer': 'RMSprop'}. Best is trial 155 with value: 0.08609100438881132.
2026-05-11 00:40:28,499 - optuna.study._optimize - INFO - Trial 175 pruned. 
2026-05-11 00:40:36,203 - optuna.study._optimize - INFO - Trial 176 pruned. 
2026-05-11 00:41:10,599 - optuna.study.study - INFO - Trial 177 finished with value: 0.08153404925786874 and parameters: {'n_layers': 1, 'embedding_dim': 256, 'lr': 0.0033605638430451506, 'lambda_val': 0.001063434463800591, 'batch_size': 3482, 'optimizer': 'RMSprop'}. Best is trial 155 with value: 0.08609100438881132.
2026-05-11 00:41:43,166 - optuna.study.study - INFO - Trial 178 finished with value: 0.06381899656460902 and parameters: {'n_layers': 1, 'embedding_dim': 256, 'lr': 0.0008779217565517353, 'lambda_val': 0.0011077295664828756, 'batch_size': 1787, 'optimizer': 'RMSprop'}. Best is trial 155 with value: 0.08609100438881132.
2026-05-11 00:41:51,044 - optuna.study._optimize - INFO - Trial 179 pruned. 
2026-05-11 00:41:55,682 - optuna.study._optimize - INFO - Trial 180 pruned. 
2026-05-11 00:42:01,593 - optuna.study._optimize - INFO - Trial 181 pruned. 
2026-05-11 00:42:36,010 - optuna.study.study - INFO - Trial 182 finished with value: 0.08144369788793503 and parameters: {'n_layers': 1, 'embedding_dim': 256, 'lr': 0.00682493402944184, 'lambda_val': 0.002487656794561232, 'batch_size': 3253, 'optimizer': 'RMSprop'}. Best is trial 155 with value: 0.08609100438881132.
2026-05-11 00:42:40,466 - optuna.study._optimize - INFO - Trial 183 pruned. 
2026-05-11 00:42:45,234 - optuna.study._optimize - INFO - Trial 184 pruned. 
2026-05-11 00:43:20,161 - optuna.study.study - INFO - Trial 185 finished with value: 0.08296151795855307 and parameters: {'n_layers': 1, 'embedding_dim': 256, 'lr': 0.007535792425084818, 'lambda_val': 0.0017339227227906864, 'batch_size': 3729, 'optimizer': 'RMSprop'}. Best is trial 155 with value: 0.08609100438881132.
2026-05-11 00:43:24,484 - optuna.study._optimize - INFO - Trial 186 pruned. 
2026-05-11 00:44:00,027 - optuna.study.study - INFO - Trial 187 finished with value: 0.08011729310048121 and parameters: {'n_layers': 1, 'embedding_dim': 256, 'lr': 0.004560316905655311, 'lambda_val': 0.0014415972211468603, 'batch_size': 3937, 'optimizer': 'RMSprop'}. Best is trial 155 with value: 0.08609100438881132.
2026-05-11 00:44:04,534 - optuna.study._optimize - INFO - Trial 188 pruned. 
2026-05-11 00:44:08,741 - optuna.study._optimize - INFO - Trial 189 pruned. 
2026-05-11 00:44:12,886 - optuna.study._optimize - INFO - Trial 190 pruned. 
2026-05-11 00:44:49,584 - optuna.study.study - INFO - Trial 191 finished with value: 0.08114992531778527 and parameters: {'n_layers': 1, 'embedding_dim': 256, 'lr': 0.008002622259377295, 'lambda_val': 0.0020245200074312953, 'batch_size': 3571, 'optimizer': 'RMSprop'}. Best is trial 155 with value: 0.08609100438881132.
2026-05-11 00:45:24,958 - optuna.study.study - INFO - Trial 192 finished with value: 0.07878491489173067 and parameters: {'n_layers': 1, 'embedding_dim': 256, 'lr': 0.007003903916367967, 'lambda_val': 0.0018434986707322493, 'batch_size': 3566, 'optimizer': 'RMSprop'}. Best is trial 155 with value: 0.08609100438881132.
2026-05-11 00:45:29,252 - optuna.study._optimize - INFO - Trial 193 pruned. 
2026-05-11 00:46:04,158 - optuna.study.study - INFO - Trial 194 finished with value: 0.07403688885244195 and parameters: {'n_layers': 1, 'embedding_dim': 256, 'lr': 0.008630964121613401, 'lambda_val': 0.0021306743082534726, 'batch_size': 3622, 'optimizer': 'RMSprop'}. Best is trial 155 with value: 0.08609100438881132.
2026-05-11 00:46:12,655 - optuna.study._optimize - INFO - Trial 195 pruned. 
2026-05-11 00:46:16,903 - optuna.study._optimize - INFO - Trial 196 pruned. 
2026-05-11 00:46:53,645 - optuna.study.study - INFO - Trial 197 finished with value: 0.08637947729556342 and parameters: {'n_layers': 1, 'embedding_dim': 256, 'lr': 0.004460112224870947, 'lambda_val': 0.0015859181116673366, 'batch_size': 3826, 'optimizer': 'RMSprop'}. Best is trial 197 with value: 0.08637947729556342.
2026-05-11 00:47:02,321 - optuna.study._optimize - INFO - Trial 198 pruned. 
2026-05-11 00:47:07,892 - optuna.study._optimize - INFO - Trial 199 pruned. 
2026-05-11 00:47:36,716 - root - INFO -   **** Training e_100K_1c1dcs_rand4
2026-05-11 00:47:36,728 - root - INFO -   **** Getting 53072/65410 random edges
2026-05-11 00:47:37,276 - optuna.storages._rdb.storage - INFO - A new study created in RDB with name: Study_e_100K_1c1dcs_rand4
2026-05-11 00:48:20,638 - optuna.study.study - INFO - Trial 0 finished with value: 0.05312690595343221 and parameters: {'n_layers': 1, 'embedding_dim': 128, 'lr': 0.006578993818151495, 'lambda_val': 2.05237571535531e-05, 'batch_size': 1505, 'optimizer': 'Adam'}. Best is trial 0 with value: 0.05312690595343221.
2026-05-11 00:48:53,363 - optuna.study.study - INFO - Trial 1 finished with value: 0.02888752112747683 and parameters: {'n_layers': 3, 'embedding_dim': 64, 'lr': 0.012101800940460114, 'lambda_val': 2.2236331104250105e-05, 'batch_size': 2015, 'optimizer': 'Adam'}. Best is trial 0 with value: 0.05312690595343221.
2026-05-11 00:49:23,352 - optuna.study.study - INFO - Trial 2 finished with value: 0.016795545795576256 and parameters: {'n_layers': 2, 'embedding_dim': 32, 'lr': 0.03333776956320251, 'lambda_val': 4.110935089229013e-05, 'batch_size': 2171, 'optimizer': 'Adam'}. Best is trial 0 with value: 0.05312690595343221.
2026-05-11 00:50:08,776 - optuna.study.study - INFO - Trial 3 finished with value: 0.019062230944428785 and parameters: {'n_layers': 4, 'embedding_dim': 128, 'lr': 0.00035536454653228573, 'lambda_val': 0.0008308714559029735, 'batch_size': 1247, 'optimizer': 'RMSprop'}. Best is trial 0 with value: 0.05312690595343221.
2026-05-11 00:50:40,992 - optuna.study.study - INFO - Trial 4 finished with value: 0.11847522329459384 and parameters: {'n_layers': 1, 'embedding_dim': 96, 'lr': 8.279940314736458e-05, 'lambda_val': 3.6042654611747395e-05, 'batch_size': 2324, 'optimizer': 'Adam'}. Best is trial 4 with value: 0.11847522329459384.
2026-05-11 00:51:21,658 - optuna.study.study - INFO - Trial 5 finished with value: 0.040989976986709975 and parameters: {'n_layers': 2, 'embedding_dim': 256, 'lr': 0.04044649417902151, 'lambda_val': 0.000984026804043116, 'batch_size': 2063, 'optimizer': 'Adam'}. Best is trial 4 with value: 0.11847522329459384.
2026-05-11 00:51:26,754 - optuna.study._optimize - INFO - Trial 6 pruned. 
2026-05-11 00:51:34,000 - optuna.study._optimize - INFO - Trial 7 pruned. 
2026-05-11 00:51:37,853 - optuna.study._optimize - INFO - Trial 8 pruned. 
2026-05-11 00:51:42,768 - optuna.study._optimize - INFO - Trial 9 pruned. 
2026-05-11 00:51:48,082 - optuna.study._optimize - INFO - Trial 10 pruned. 
2026-05-11 00:52:18,559 - optuna.study.study - INFO - Trial 11 finished with value: 0.04811779526764856 and parameters: {'n_layers': 1, 'embedding_dim': 128, 'lr': 0.003755650957562383, 'lambda_val': 2.266254733792331e-06, 'batch_size': 1281, 'optimizer': 'Adam'}. Best is trial 4 with value: 0.11847522329459384.
2026-05-11 00:52:53,659 - optuna.study.study - INFO - Trial 12 finished with value: 0.06452345513068583 and parameters: {'n_layers': 1, 'embedding_dim': 256, 'lr': 0.0011435676247206433, 'lambda_val': 1.5787174276683833e-05, 'batch_size': 1384, 'optimizer': 'Adam'}. Best is trial 4 with value: 0.11847522329459384.
2026-05-11 00:53:31,428 - optuna.study.study - INFO - Trial 13 finished with value: 0.06172258569035741 and parameters: {'n_layers': 1, 'embedding_dim': 256, 'lr': 0.0011200639200709959, 'lambda_val': 0.00017409944137399049, 'batch_size': 2807, 'optimizer': 'Adam'}. Best is trial 4 with value: 0.11847522329459384.
2026-05-11 00:53:36,396 - optuna.study._optimize - INFO - Trial 14 pruned. 
2026-05-11 00:54:05,068 - optuna.study.study - INFO - Trial 15 finished with value: 0.03872358865577778 and parameters: {'n_layers': 1, 'embedding_dim': 64, 'lr': 0.0018526496190148546, 'lambda_val': 1.0317718056305088e-06, 'batch_size': 1622, 'optimizer': 'Adam'}. Best is trial 4 with value: 0.11847522329459384.
2026-05-11 00:54:44,792 - optuna.study.study - INFO - Trial 16 finished with value: 0.05965589602937776 and parameters: {'n_layers': 1, 'embedding_dim': 256, 'lr': 0.0005347331167767033, 'lambda_val': 7.92567781569072e-06, 'batch_size': 2639, 'optimizer': 'Adam'}. Best is trial 4 with value: 0.11847522329459384.
2026-05-11 00:54:49,581 - optuna.study._optimize - INFO - Trial 17 pruned. 
2026-05-11 00:54:54,447 - optuna.study._optimize - INFO - Trial 18 pruned. 
2026-05-11 00:54:58,297 - optuna.study._optimize - INFO - Trial 19 pruned. 
2026-05-11 00:55:35,214 - optuna.study.study - INFO - Trial 20 finished with value: 0.026046204527565318 and parameters: {'n_layers': 2, 'embedding_dim': 64, 'lr': 0.0005956644441677832, 'lambda_val': 0.0031268838929837195, 'batch_size': 2636, 'optimizer': 'Adam'}. Best is trial 4 with value: 0.11847522329459384.
