2026-05-11 14:39:56,367 - optuna.study.study - INFO - Trial 11 finished with value: 0.0921161506639036 and parameters: {'n_layers': 2, 'embedding_dim': 32, 'lr': 0.00020005789556860374, 'lambda_val': 0.00011675884172148886, 'batch_size': 517, 'optimizer': 'Adam'}. Best is trial 1 with value: 0.10069508388786577.
2026-05-11 14:40:00,842 - optuna.study._optimize - INFO - Trial 12 pruned. 
2026-05-11 14:40:08,648 - optuna.study._optimize - INFO - Trial 13 pruned. 
2026-05-11 14:40:18,665 - optuna.study._optimize - INFO - Trial 14 pruned. 
2026-05-11 14:40:24,098 - optuna.study._optimize - INFO - Trial 15 pruned. 
2026-05-11 14:40:29,371 - optuna.study._optimize - INFO - Trial 16 pruned. 
2026-05-11 14:40:35,593 - optuna.study._optimize - INFO - Trial 17 pruned. 
2026-05-11 14:40:40,395 - optuna.study._optimize - INFO - Trial 18 pruned. 
2026-05-11 14:40:46,982 - optuna.study._optimize - INFO - Trial 19 pruned. 
2026-05-11 14:40:50,989 - optuna.study._optimize - INFO - Trial 20 pruned. 
2026-05-11 14:41:19,436 - optuna.study.study - INFO - Trial 21 finished with value: 0.0631452859237808 and parameters: {'n_layers': 1, 'embedding_dim': 32, 'lr': 0.0005888593226346376, 'lambda_val': 0.00017422220507755308, 'batch_size': 746, 'optimizer': 'Adam'}. Best is trial 1 with value: 0.10069508388786577.
2026-05-11 14:41:53,431 - optuna.study.study - INFO - Trial 22 finished with value: 0.09138951529525245 and parameters: {'n_layers': 1, 'embedding_dim': 32, 'lr': 0.00022353959061372216, 'lambda_val': 0.0011709762309733637, 'batch_size': 1120, 'optimizer': 'Adam'}. Best is trial 1 with value: 0.10069508388786577.
2026-05-11 14:41:59,067 - optuna.study._optimize - INFO - Trial 23 pruned. 
2026-05-11 14:42:04,448 - optuna.study._optimize - INFO - Trial 24 pruned. 
2026-05-11 14:42:15,478 - optuna.study._optimize - INFO - Trial 25 pruned. 
2026-05-11 14:42:46,231 - optuna.study.study - INFO - Trial 26 finished with value: 0.10185438608368343 and parameters: {'n_layers': 1, 'embedding_dim': 32, 'lr': 0.00023272124399395432, 'lambda_val': 3.285511163562563e-05, 'batch_size': 1195, 'optimizer': 'Adam'}. Best is trial 26 with value: 0.10185438608368343.
2026-05-11 14:42:49,725 - optuna.study._optimize - INFO - Trial 27 pruned. 
2026-05-11 14:42:55,280 - optuna.study._optimize - INFO - Trial 28 pruned. 
2026-05-11 14:42:59,389 - optuna.study._optimize - INFO - Trial 29 pruned. 
2026-05-11 14:43:05,273 - optuna.study._optimize - INFO - Trial 30 pruned. 
2026-05-11 14:43:11,191 - optuna.study._optimize - INFO - Trial 31 pruned. 
2026-05-11 14:43:15,121 - optuna.study._optimize - INFO - Trial 32 pruned. 
2026-05-11 14:43:18,123 - optuna.study._optimize - INFO - Trial 33 pruned. 
2026-05-11 14:43:26,689 - optuna.study._optimize - INFO - Trial 34 pruned. 
2026-05-11 14:43:37,189 - optuna.study._optimize - INFO - Trial 35 pruned. 
2026-05-11 14:43:40,701 - optuna.study._optimize - INFO - Trial 36 pruned. 
2026-05-11 14:43:43,958 - optuna.study._optimize - INFO - Trial 37 pruned. 
2026-05-11 14:43:48,752 - optuna.study._optimize - INFO - Trial 38 pruned. 
2026-05-11 14:43:53,809 - optuna.study._optimize - INFO - Trial 39 pruned. 
2026-05-11 14:43:58,855 - optuna.study._optimize - INFO - Trial 40 pruned. 
2026-05-11 14:44:05,879 - optuna.study._optimize - INFO - Trial 41 pruned. 
2026-05-11 14:44:34,742 - optuna.study.study - INFO - Trial 42 finished with value: 0.10371810845531512 and parameters: {'n_layers': 1, 'embedding_dim': 32, 'lr': 0.0003141215996146359, 'lambda_val': 0.0008010950643625767, 'batch_size': 640, 'optimizer': 'Adam'}. Best is trial 42 with value: 0.10371810845531512.
2026-05-11 14:44:41,125 - optuna.study._optimize - INFO - Trial 43 pruned. 
2026-05-11 14:44:44,727 - optuna.study._optimize - INFO - Trial 44 pruned. 
2026-05-11 14:44:48,549 - optuna.study._optimize - INFO - Trial 45 pruned. 
2026-05-11 14:44:55,463 - optuna.study._optimize - INFO - Trial 46 pruned. 
2026-05-11 14:45:00,324 - optuna.study._optimize - INFO - Trial 47 pruned. 
2026-05-11 14:45:04,377 - optuna.study._optimize - INFO - Trial 48 pruned. 
2026-05-11 14:45:08,784 - optuna.study._optimize - INFO - Trial 49 pruned. 
2026-05-11 14:45:45,500 - optuna.study.study - INFO - Trial 50 finished with value: 0.08795312124073362 and parameters: {'n_layers': 1, 'embedding_dim': 256, 'lr': 0.0003259338651575373, 'lambda_val': 0.0002729599651820935, 'batch_size': 517, 'optimizer': 'Adam'}. Best is trial 42 with value: 0.10371810845531512.
2026-05-11 14:46:19,878 - optuna.study.study - INFO - Trial 51 finished with value: 0.08171001733190526 and parameters: {'n_layers': 1, 'embedding_dim': 256, 'lr': 0.0003061205525064382, 'lambda_val': 0.0003100501174186365, 'batch_size': 625, 'optimizer': 'Adam'}. Best is trial 42 with value: 0.10371810845531512.
2026-05-11 14:46:24,759 - optuna.study._optimize - INFO - Trial 52 pruned. 
2026-05-11 14:47:06,864 - optuna.study.study - INFO - Trial 53 finished with value: 0.06085481035872858 and parameters: {'n_layers': 1, 'embedding_dim': 256, 'lr': 0.0004883400196950052, 'lambda_val': 0.0007105980510039813, 'batch_size': 1091, 'optimizer': 'Adam'}. Best is trial 42 with value: 0.10371810845531512.
2026-05-11 14:47:11,336 - optuna.study._optimize - INFO - Trial 54 pruned. 
2026-05-11 14:47:15,665 - optuna.study._optimize - INFO - Trial 55 pruned. 
2026-05-11 14:47:20,570 - optuna.study._optimize - INFO - Trial 56 pruned. 
2026-05-11 14:47:49,322 - optuna.study.study - INFO - Trial 57 finished with value: 0.06429901055159704 and parameters: {'n_layers': 1, 'embedding_dim': 32, 'lr': 0.0003549671609191839, 'lambda_val': 0.00027209392946521725, 'batch_size': 1623, 'optimizer': 'Adam'}. Best is trial 42 with value: 0.10371810845531512.
2026-05-11 14:47:53,697 - optuna.study._optimize - INFO - Trial 58 pruned. 
2026-05-11 14:47:57,690 - optuna.study._optimize - INFO - Trial 59 pruned. 
2026-05-11 14:48:02,430 - optuna.study._optimize - INFO - Trial 60 pruned. 
2026-05-11 14:48:30,641 - optuna.study.study - INFO - Trial 61 finished with value: 0.0605948256557723 and parameters: {'n_layers': 1, 'embedding_dim': 32, 'lr': 0.0004929382766196632, 'lambda_val': 0.0003807545306327466, 'batch_size': 671, 'optimizer': 'Adam'}. Best is trial 42 with value: 0.10371810845531512.
2026-05-11 14:48:58,342 - optuna.study.study - INFO - Trial 62 finished with value: 0.10806482762403535 and parameters: {'n_layers': 1, 'embedding_dim': 32, 'lr': 0.00027368069661909904, 'lambda_val': 0.00018131931303759508, 'batch_size': 797, 'optimizer': 'Adam'}. Best is trial 62 with value: 0.10806482762403535.
2026-05-11 14:49:02,713 - optuna.study._optimize - INFO - Trial 63 pruned. 
2026-05-11 14:49:06,368 - optuna.study._optimize - INFO - Trial 64 pruned. 
2026-05-11 14:49:10,245 - optuna.study._optimize - INFO - Trial 65 pruned. 
2026-05-11 14:49:14,663 - optuna.study._optimize - INFO - Trial 66 pruned. 
2026-05-11 14:49:18,053 - optuna.study._optimize - INFO - Trial 67 pruned. 
2026-05-11 14:49:44,398 - optuna.study.study - INFO - Trial 68 finished with value: 0.04266944135301192 and parameters: {'n_layers': 1, 'embedding_dim': 32, 'lr': 0.0006821594888573979, 'lambda_val': 2.1761718860716064e-05, 'batch_size': 984, 'optimizer': 'Adam'}. Best is trial 62 with value: 0.10806482762403535.
2026-05-11 14:49:48,493 - optuna.study._optimize - INFO - Trial 69 pruned. 
2026-05-11 14:49:52,514 - optuna.study._optimize - INFO - Trial 70 pruned. 
2026-05-11 14:49:56,788 - optuna.study._optimize - INFO - Trial 71 pruned. 
2026-05-11 14:50:24,515 - optuna.study.study - INFO - Trial 72 finished with value: 0.08012108719575203 and parameters: {'n_layers': 1, 'embedding_dim': 32, 'lr': 0.0004149105274248408, 'lambda_val': 0.0004857260927536487, 'batch_size': 824, 'optimizer': 'Adam'}. Best is trial 62 with value: 0.10806482762403535.
2026-05-11 14:50:28,756 - optuna.study._optimize - INFO - Trial 73 pruned. 
2026-05-11 14:50:33,203 - optuna.study._optimize - INFO - Trial 74 pruned. 
2026-05-11 14:50:37,104 - optuna.study._optimize - INFO - Trial 75 pruned. 
2026-05-11 14:50:41,437 - optuna.study._optimize - INFO - Trial 76 pruned. 
2026-05-11 14:51:10,303 - optuna.study.study - INFO - Trial 77 finished with value: 0.046718362411090265 and parameters: {'n_layers': 1, 'embedding_dim': 96, 'lr': 0.0011356898889269497, 'lambda_val': 4.5634914617684524e-05, 'batch_size': 1220, 'optimizer': 'Adam'}. Best is trial 62 with value: 0.10806482762403535.
2026-05-11 14:51:15,103 - optuna.study._optimize - INFO - Trial 78 pruned. 
2026-05-11 14:51:20,667 - optuna.study._optimize - INFO - Trial 79 pruned. 
2026-05-11 14:51:24,804 - optuna.study._optimize - INFO - Trial 80 pruned. 
2026-05-11 14:52:07,299 - optuna.study.study - INFO - Trial 81 finished with value: 0.06086655810341238 and parameters: {'n_layers': 2, 'embedding_dim': 256, 'lr': 0.00018310281183692265, 'lambda_val': 3.600808790997823e-06, 'batch_size': 514, 'optimizer': 'Adam'}. Best is trial 62 with value: 0.10806482762403535.
2026-05-11 14:52:12,663 - optuna.study._optimize - INFO - Trial 82 pruned. 
2026-05-11 14:52:18,116 - optuna.study._optimize - INFO - Trial 83 pruned. 
2026-05-11 14:52:52,846 - optuna.study.study - INFO - Trial 84 finished with value: 0.08528907656722794 and parameters: {'n_layers': 1, 'embedding_dim': 256, 'lr': 0.0002850278596746033, 'lambda_val': 1.4089540857246004e-06, 'batch_size': 1044, 'optimizer': 'Adam'}. Best is trial 62 with value: 0.10806482762403535.
2026-05-11 14:53:24,164 - optuna.study.study - INFO - Trial 85 finished with value: 0.08279684632813965 and parameters: {'n_layers': 1, 'embedding_dim': 256, 'lr': 0.0003210700645877979, 'lambda_val': 1.5947648730526974e-06, 'batch_size': 1079, 'optimizer': 'Adam'}. Best is trial 62 with value: 0.10806482762403535.
2026-05-11 14:53:27,560 - optuna.study._optimize - INFO - Trial 86 pruned. 
2026-05-11 14:53:30,770 - optuna.study._optimize - INFO - Trial 87 pruned. 
2026-05-11 14:54:05,257 - optuna.study.study - INFO - Trial 88 finished with value: 0.06463436504977074 and parameters: {'n_layers': 1, 'embedding_dim': 256, 'lr': 0.0004168283124194599, 'lambda_val': 8.251141122968936e-05, 'batch_size': 1014, 'optimizer': 'Adam'}. Best is trial 62 with value: 0.10806482762403535.
2026-05-11 14:54:09,187 - optuna.study._optimize - INFO - Trial 89 pruned. 
2026-05-11 14:54:13,736 - optuna.study._optimize - INFO - Trial 90 pruned. 
2026-05-11 14:54:18,206 - optuna.study._optimize - INFO - Trial 91 pruned. 
2026-05-11 14:54:52,742 - optuna.study.study - INFO - Trial 92 finished with value: 0.07963448175960366 and parameters: {'n_layers': 1, 'embedding_dim': 256, 'lr': 0.0003556485418095519, 'lambda_val': 9.95050267540284e-06, 'batch_size': 747, 'optimizer': 'Adam'}. Best is trial 62 with value: 0.10806482762403535.
2026-05-11 14:54:57,298 - optuna.study._optimize - INFO - Trial 93 pruned. 
2026-05-11 14:55:02,000 - optuna.study._optimize - INFO - Trial 94 pruned. 
2026-05-11 14:55:06,095 - optuna.study._optimize - INFO - Trial 95 pruned. 
2026-05-11 14:55:11,409 - optuna.study._optimize - INFO - Trial 96 pruned. 
2026-05-11 14:55:40,629 - optuna.study.study - INFO - Trial 97 finished with value: 0.0905318659842684 and parameters: {'n_layers': 1, 'embedding_dim': 96, 'lr': 0.00026880314765801534, 'lambda_val': 0.0001891509790151819, 'batch_size': 1086, 'optimizer': 'Adam'}. Best is trial 62 with value: 0.10806482762403535.
2026-05-11 14:56:18,987 - optuna.study.study - INFO - Trial 98 finished with value: 0.09498592808086057 and parameters: {'n_layers': 1, 'embedding_dim': 96, 'lr': 0.00026560037538829624, 'lambda_val': 0.00016291922737840723, 'batch_size': 1091, 'optimizer': 'Adam'}. Best is trial 62 with value: 0.10806482762403535.
2026-05-11 14:56:47,801 - optuna.study.study - INFO - Trial 99 finished with value: 0.08330639437936549 and parameters: {'n_layers': 1, 'embedding_dim': 96, 'lr': 0.0002535028004599737, 'lambda_val': 0.00012851702605246298, 'batch_size': 1406, 'optimizer': 'Adam'}. Best is trial 62 with value: 0.10806482762403535.
2026-05-11 14:56:51,742 - optuna.study._optimize - INFO - Trial 100 pruned. 
2026-05-11 14:57:20,564 - optuna.study.study - INFO - Trial 101 finished with value: 0.05491493622626345 and parameters: {'n_layers': 1, 'embedding_dim': 96, 'lr': 0.0007274077313231928, 'lambda_val': 0.00020328691810000182, 'batch_size': 1065, 'optimizer': 'Adam'}. Best is trial 62 with value: 0.10806482762403535.
2026-05-11 14:57:49,482 - optuna.study.study - INFO - Trial 102 finished with value: 0.06003361968022847 and parameters: {'n_layers': 1, 'embedding_dim': 96, 'lr': 0.00041385380782439727, 'lambda_val': 7.038735019161877e-05, 'batch_size': 1107, 'optimizer': 'Adam'}. Best is trial 62 with value: 0.10806482762403535.
2026-05-11 14:58:21,424 - optuna.study.study - INFO - Trial 103 finished with value: 0.05566250529785684 and parameters: {'n_layers': 1, 'embedding_dim': 96, 'lr': 0.0004890457253920826, 'lambda_val': 2.8639136783030633e-05, 'batch_size': 1168, 'optimizer': 'Adam'}. Best is trial 62 with value: 0.10806482762403535.
2026-05-11 14:58:26,007 - optuna.study._optimize - INFO - Trial 104 pruned. 
2026-05-11 14:58:29,938 - optuna.study._optimize - INFO - Trial 105 pruned. 
2026-05-11 14:58:33,958 - optuna.study._optimize - INFO - Trial 106 pruned. 
2026-05-11 14:59:03,984 - optuna.study.study - INFO - Trial 107 finished with value: 0.05285070485963553 and parameters: {'n_layers': 1, 'embedding_dim': 32, 'lr': 0.0005847623676856448, 'lambda_val': 0.00024295818719128007, 'batch_size': 1254, 'optimizer': 'Adam'}. Best is trial 62 with value: 0.10806482762403535.
2026-05-11 14:59:07,781 - optuna.study._optimize - INFO - Trial 108 pruned. 
2026-05-11 14:59:11,789 - optuna.study._optimize - INFO - Trial 109 pruned. 
2026-05-11 14:59:45,190 - optuna.study.study - INFO - Trial 110 finished with value: 0.08336504632074838 and parameters: {'n_layers': 1, 'embedding_dim': 96, 'lr': 0.0003356957669531137, 'lambda_val': 0.0004223858505085631, 'batch_size': 686, 'optimizer': 'Adam'}. Best is trial 62 with value: 0.10806482762403535.
2026-05-11 15:00:19,709 - optuna.study.study - INFO - Trial 111 finished with value: 0.06577260505331493 and parameters: {'n_layers': 1, 'embedding_dim': 96, 'lr': 0.00045247056536037024, 'lambda_val': 0.0004075299158780052, 'batch_size': 717, 'optimizer': 'Adam'}. Best is trial 62 with value: 0.10806482762403535.
2026-05-11 15:00:48,926 - optuna.study.study - INFO - Trial 112 finished with value: 0.07594933002685483 and parameters: {'n_layers': 1, 'embedding_dim': 96, 'lr': 0.0003579205651734898, 'lambda_val': 0.00014568167903718826, 'batch_size': 784, 'optimizer': 'Adam'}. Best is trial 62 with value: 0.10806482762403535.
2026-05-11 15:00:57,698 - optuna.study._optimize - INFO - Trial 113 pruned. 
2026-05-11 15:01:07,070 - optuna.study._optimize - INFO - Trial 114 pruned. 
2026-05-11 15:01:10,961 - optuna.study._optimize - INFO - Trial 115 pruned. 
2026-05-11 15:01:15,058 - optuna.study._optimize - INFO - Trial 116 pruned. 
2026-05-11 15:01:19,172 - optuna.study._optimize - INFO - Trial 117 pruned. 
2026-05-11 15:01:23,468 - optuna.study._optimize - INFO - Trial 118 pruned. 
2026-05-11 15:01:52,058 - optuna.study.study - INFO - Trial 119 finished with value: 0.049941687766529165 and parameters: {'n_layers': 1, 'embedding_dim': 32, 'lr': 0.0005406788124000552, 'lambda_val': 0.0009859855265092505, 'batch_size': 1055, 'optimizer': 'Adam'}. Best is trial 62 with value: 0.10806482762403535.
2026-05-11 15:01:56,087 - optuna.study._optimize - INFO - Trial 120 pruned. 
2026-05-11 15:02:00,085 - optuna.study._optimize - INFO - Trial 121 pruned. 
2026-05-11 15:02:29,456 - optuna.study.study - INFO - Trial 122 finished with value: 0.06842049532204611 and parameters: {'n_layers': 1, 'embedding_dim': 96, 'lr': 0.00036136521572553774, 'lambda_val': 0.0001390309554569752, 'batch_size': 1210, 'optimizer': 'Adam'}. Best is trial 62 with value: 0.10806482762403535.
2026-05-11 15:02:33,364 - optuna.study._optimize - INFO - Trial 123 pruned. 
2026-05-11 15:02:37,820 - optuna.study._optimize - INFO - Trial 124 pruned. 
2026-05-11 15:02:41,806 - optuna.study._optimize - INFO - Trial 125 pruned. 
2026-05-11 15:02:45,925 - optuna.study._optimize - INFO - Trial 126 pruned. 
2026-05-11 15:03:21,737 - optuna.study.study - INFO - Trial 127 finished with value: 0.06618450025643456 and parameters: {'n_layers': 1, 'embedding_dim': 256, 'lr': 0.00025235907847801853, 'lambda_val': 0.0002005913847629787, 'batch_size': 2800, 'optimizer': 'RMSprop'}. Best is trial 62 with value: 0.10806482762403535.
2026-05-11 15:03:26,107 - optuna.study._optimize - INFO - Trial 128 pruned. 
2026-05-11 15:03:31,168 - optuna.study._optimize - INFO - Trial 129 pruned. 
2026-05-11 15:03:42,184 - optuna.study._optimize - INFO - Trial 130 pruned. 
2026-05-11 15:03:49,929 - optuna.study._optimize - INFO - Trial 131 pruned. 
2026-05-11 15:03:56,248 - optuna.study._optimize - INFO - Trial 132 pruned. 
2026-05-11 15:04:00,998 - optuna.study._optimize - INFO - Trial 133 pruned. 
2026-05-11 15:04:35,321 - optuna.study.study - INFO - Trial 134 finished with value: 0.09778392829916228 and parameters: {'n_layers': 1, 'embedding_dim': 256, 'lr': 0.00030075022703851095, 'lambda_val': 2.113420037594672e-06, 'batch_size': 766, 'optimizer': 'Adam'}. Best is trial 62 with value: 0.10806482762403535.
2026-05-11 15:05:09,823 - optuna.study.study - INFO - Trial 135 finished with value: 0.07193603372614897 and parameters: {'n_layers': 1, 'embedding_dim': 256, 'lr': 0.00032379715845432455, 'lambda_val': 0.00022421968166335302, 'batch_size': 1029, 'optimizer': 'Adam'}. Best is trial 62 with value: 0.10806482762403535.
2026-05-11 15:05:14,137 - optuna.study._optimize - INFO - Trial 136 pruned. 
2026-05-11 15:05:18,637 - optuna.study._optimize - INFO - Trial 137 pruned. 
2026-05-11 15:05:24,037 - optuna.study._optimize - INFO - Trial 138 pruned. 
2026-05-11 15:05:28,024 - optuna.study._optimize - INFO - Trial 139 pruned. 
2026-05-11 15:05:56,923 - optuna.study.study - INFO - Trial 140 finished with value: 0.077138947885136 and parameters: {'n_layers': 1, 'embedding_dim': 96, 'lr': 0.0005104709536345234, 'lambda_val': 2.935381875412717e-06, 'batch_size': 633, 'optimizer': 'Adam'}. Best is trial 62 with value: 0.10806482762403535.
2026-05-11 15:06:02,453 - optuna.study._optimize - INFO - Trial 141 pruned. 
2026-05-11 15:06:09,455 - optuna.study._optimize - INFO - Trial 142 pruned. 
2026-05-11 15:06:44,254 - optuna.study.study - INFO - Trial 143 finished with value: 0.08642285865783478 and parameters: {'n_layers': 1, 'embedding_dim': 256, 'lr': 0.00023490420934362482, 'lambda_val': 2.243164970082245e-06, 'batch_size': 1124, 'optimizer': 'Adam'}. Best is trial 62 with value: 0.10806482762403535.
2026-05-11 15:07:18,777 - optuna.study.study - INFO - Trial 144 finished with value: 0.08054187861508222 and parameters: {'n_layers': 1, 'embedding_dim': 256, 'lr': 0.0003145515376609213, 'lambda_val': 3.477944845109208e-06, 'batch_size': 1119, 'optimizer': 'Adam'}. Best is trial 62 with value: 0.10806482762403535.
2026-05-11 15:07:23,205 - optuna.study._optimize - INFO - Trial 145 pruned. 
2026-05-11 15:07:27,581 - optuna.study._optimize - INFO - Trial 146 pruned. 
2026-05-11 15:07:32,249 - optuna.study._optimize - INFO - Trial 147 pruned. 
2026-05-11 15:07:36,532 - optuna.study._optimize - INFO - Trial 148 pruned. 
2026-05-11 15:07:40,607 - optuna.study._optimize - INFO - Trial 149 pruned. 
2026-05-11 15:08:08,438 - optuna.study.study - INFO - Trial 150 finished with value: 0.0787804543019236 and parameters: {'n_layers': 1, 'embedding_dim': 32, 'lr': 0.00041603296956066726, 'lambda_val': 0.0003783376224037942, 'batch_size': 918, 'optimizer': 'RMSprop'}. Best is trial 62 with value: 0.10806482762403535.
2026-05-11 15:08:12,938 - optuna.study._optimize - INFO - Trial 151 pruned. 
2026-05-11 15:08:19,277 - optuna.study._optimize - INFO - Trial 152 pruned. 
2026-05-11 15:08:24,060 - optuna.study._optimize - INFO - Trial 153 pruned. 
2026-05-11 15:08:29,223 - optuna.study._optimize - INFO - Trial 154 pruned. 
2026-05-11 15:08:33,065 - optuna.study._optimize - INFO - Trial 155 pruned. 
2026-05-11 15:08:37,438 - optuna.study._optimize - INFO - Trial 156 pruned. 
2026-05-11 15:09:12,332 - optuna.study.study - INFO - Trial 157 finished with value: 0.08833819070330418 and parameters: {'n_layers': 1, 'embedding_dim': 256, 'lr': 0.0002931392075560818, 'lambda_val': 0.0011867301682673501, 'batch_size': 520, 'optimizer': 'Adam'}. Best is trial 62 with value: 0.10806482762403535.
2026-05-11 15:09:47,213 - optuna.study.study - INFO - Trial 158 finished with value: 0.07505683987664767 and parameters: {'n_layers': 1, 'embedding_dim': 256, 'lr': 0.0003494173194033354, 'lambda_val': 0.0012425100144115723, 'batch_size': 543, 'optimizer': 'Adam'}. Best is trial 62 with value: 0.10806482762403535.
2026-05-11 15:10:24,093 - optuna.study.study - INFO - Trial 159 finished with value: 0.05626417544757965 and parameters: {'n_layers': 1, 'embedding_dim': 96, 'lr': 0.0004706741077325521, 'lambda_val': 0.0007842171654086054, 'batch_size': 1236, 'optimizer': 'Adam'}. Best is trial 62 with value: 0.10806482762403535.
2026-05-11 15:10:28,476 - optuna.study._optimize - INFO - Trial 160 pruned. 
2026-05-11 15:10:32,938 - optuna.study._optimize - INFO - Trial 161 pruned. 
2026-05-11 15:10:37,945 - optuna.study._optimize - INFO - Trial 162 pruned. 
2026-05-11 15:11:12,396 - optuna.study.study - INFO - Trial 163 finished with value: 0.08340862529937541 and parameters: {'n_layers': 1, 'embedding_dim': 256, 'lr': 0.0003197362209754065, 'lambda_val': 0.00048170470630364795, 'batch_size': 519, 'optimizer': 'Adam'}. Best is trial 62 with value: 0.10806482762403535.
2026-05-11 15:11:17,494 - optuna.study._optimize - INFO - Trial 164 pruned. 
