2026-05-11 01:29:49,656 - optuna.study.study - INFO - Trial 138 finished with value: 0.045412983359112376 and parameters: {'n_layers': 1, 'embedding_dim': 128, 'lr': 0.0003842632597927272, 'lambda_val': 0.0019293282955039643, 'batch_size': 1729, 'optimizer': 'RMSprop'}. Best is trial 4 with value: 0.11847522329459384.
2026-05-11 01:29:53,397 - optuna.study._optimize - INFO - Trial 139 pruned. 
2026-05-11 01:29:58,518 - optuna.study._optimize - INFO - Trial 140 pruned. 
2026-05-11 01:30:29,414 - optuna.study.study - INFO - Trial 141 finished with value: 0.06722184174121261 and parameters: {'n_layers': 1, 'embedding_dim': 128, 'lr': 0.00023300127606127428, 'lambda_val': 0.00034442410807777646, 'batch_size': 2300, 'optimizer': 'Adam'}. Best is trial 4 with value: 0.11847522329459384.
2026-05-11 01:30:33,308 - optuna.study._optimize - INFO - Trial 142 pruned. 
2026-05-11 01:31:03,360 - optuna.study.study - INFO - Trial 143 finished with value: 0.06675877528443298 and parameters: {'n_layers': 1, 'embedding_dim': 128, 'lr': 0.00021963588994508123, 'lambda_val': 0.0009018891176685516, 'batch_size': 2243, 'optimizer': 'Adam'}. Best is trial 4 with value: 0.11847522329459384.
2026-05-11 01:31:07,601 - optuna.study._optimize - INFO - Trial 144 pruned. 
2026-05-11 01:31:11,490 - optuna.study._optimize - INFO - Trial 145 pruned. 
2026-05-11 01:31:15,741 - optuna.study._optimize - INFO - Trial 146 pruned. 
2026-05-11 01:31:47,131 - optuna.study.study - INFO - Trial 147 finished with value: 0.051283767044004405 and parameters: {'n_layers': 1, 'embedding_dim': 128, 'lr': 0.0003422793479566462, 'lambda_val': 0.0006756842320641166, 'batch_size': 2342, 'optimizer': 'Adam'}. Best is trial 4 with value: 0.11847522329459384.
2026-05-11 01:32:18,509 - optuna.study.study - INFO - Trial 148 finished with value: 0.08957513804395552 and parameters: {'n_layers': 1, 'embedding_dim': 128, 'lr': 0.0001989814820522534, 'lambda_val': 0.0002592045443103802, 'batch_size': 1938, 'optimizer': 'Adam'}. Best is trial 4 with value: 0.11847522329459384.
2026-05-11 01:32:23,103 - optuna.study._optimize - INFO - Trial 149 pruned. 
2026-05-11 01:32:27,635 - optuna.study._optimize - INFO - Trial 150 pruned. 
2026-05-11 01:32:58,770 - optuna.study.study - INFO - Trial 151 finished with value: 0.07928121334956155 and parameters: {'n_layers': 1, 'embedding_dim': 128, 'lr': 0.00019781718544419812, 'lambda_val': 0.0002592922943988361, 'batch_size': 2037, 'optimizer': 'Adam'}. Best is trial 4 with value: 0.11847522329459384.
2026-05-11 01:33:02,567 - optuna.study._optimize - INFO - Trial 152 pruned. 
2026-05-11 01:33:32,968 - optuna.study.study - INFO - Trial 153 finished with value: 0.06662254681081264 and parameters: {'n_layers': 1, 'embedding_dim': 128, 'lr': 0.0002545981989607772, 'lambda_val': 0.00013620987097091001, 'batch_size': 2033, 'optimizer': 'Adam'}. Best is trial 4 with value: 0.11847522329459384.
2026-05-11 01:33:36,948 - optuna.study._optimize - INFO - Trial 154 pruned. 
2026-05-11 01:33:41,074 - optuna.study._optimize - INFO - Trial 155 pruned. 
2026-05-11 01:33:44,681 - optuna.study._optimize - INFO - Trial 156 pruned. 
2026-05-11 01:33:48,288 - optuna.study._optimize - INFO - Trial 157 pruned. 
2026-05-11 01:33:53,908 - optuna.study._optimize - INFO - Trial 158 pruned. 
2026-05-11 01:34:24,352 - optuna.study.study - INFO - Trial 159 finished with value: 0.06719240517676936 and parameters: {'n_layers': 1, 'embedding_dim': 128, 'lr': 0.0002684429975185007, 'lambda_val': 0.0003424683348988686, 'batch_size': 1825, 'optimizer': 'Adam'}. Best is trial 4 with value: 0.11847522329459384.
2026-05-11 01:34:28,211 - optuna.study._optimize - INFO - Trial 160 pruned. 
2026-05-11 01:34:32,005 - optuna.study._optimize - INFO - Trial 161 pruned. 
2026-05-11 01:35:00,869 - optuna.study.study - INFO - Trial 162 finished with value: 0.0684109581063277 and parameters: {'n_layers': 1, 'embedding_dim': 128, 'lr': 0.00020772313943091076, 'lambda_val': 0.00022469601159436675, 'batch_size': 2280, 'optimizer': 'Adam'}. Best is trial 4 with value: 0.11847522329459384.
2026-05-11 01:35:29,532 - optuna.study.study - INFO - Trial 163 finished with value: 0.060765456094851705 and parameters: {'n_layers': 1, 'embedding_dim': 128, 'lr': 0.0003345788713800916, 'lambda_val': 0.0005402596988779065, 'batch_size': 1995, 'optimizer': 'Adam'}. Best is trial 4 with value: 0.11847522329459384.
2026-05-11 01:35:33,819 - optuna.study._optimize - INFO - Trial 164 pruned. 
2026-05-11 01:36:04,826 - optuna.study.study - INFO - Trial 165 finished with value: 0.07046294977011139 and parameters: {'n_layers': 1, 'embedding_dim': 128, 'lr': 0.00025421233176296104, 'lambda_val': 0.00047262226613485815, 'batch_size': 2104, 'optimizer': 'Adam'}. Best is trial 4 with value: 0.11847522329459384.
2026-05-11 01:36:08,585 - optuna.study._optimize - INFO - Trial 166 pruned. 
2026-05-11 01:36:41,047 - optuna.study.study - INFO - Trial 167 finished with value: 0.056397819310760156 and parameters: {'n_layers': 1, 'embedding_dim': 128, 'lr': 0.00045450423542950255, 'lambda_val': 0.00018366998794576105, 'batch_size': 2889, 'optimizer': 'Adam'}. Best is trial 4 with value: 0.11847522329459384.
2026-05-11 01:36:44,679 - optuna.study._optimize - INFO - Trial 168 pruned. 
2026-05-11 01:36:48,479 - optuna.study._optimize - INFO - Trial 169 pruned. 
2026-05-11 01:36:54,463 - optuna.study._optimize - INFO - Trial 170 pruned. 
2026-05-11 01:36:58,269 - optuna.study._optimize - INFO - Trial 171 pruned. 
2026-05-11 01:37:01,986 - optuna.study._optimize - INFO - Trial 172 pruned. 
2026-05-11 01:37:32,482 - optuna.study.study - INFO - Trial 173 finished with value: 0.07438794249407356 and parameters: {'n_layers': 1, 'embedding_dim': 96, 'lr': 0.0002463517338269152, 'lambda_val': 3.970864431902182e-05, 'batch_size': 1683, 'optimizer': 'Adam'}. Best is trial 4 with value: 0.11847522329459384.
2026-05-11 01:37:36,698 - optuna.study._optimize - INFO - Trial 174 pruned. 
2026-05-11 01:38:05,284 - optuna.study.study - INFO - Trial 175 finished with value: 0.06931570020975938 and parameters: {'n_layers': 1, 'embedding_dim': 96, 'lr': 0.0003109526863872219, 'lambda_val': 3.090122030009844e-05, 'batch_size': 1778, 'optimizer': 'Adam'}. Best is trial 4 with value: 0.11847522329459384.
2026-05-11 01:38:09,071 - optuna.study._optimize - INFO - Trial 176 pruned. 
2026-05-11 01:38:13,162 - optuna.study._optimize - INFO - Trial 177 pruned. 
2026-05-11 01:38:17,349 - optuna.study._optimize - INFO - Trial 178 pruned. 
2026-05-11 01:38:48,029 - optuna.study.study - INFO - Trial 179 finished with value: 0.05669832141750107 and parameters: {'n_layers': 1, 'embedding_dim': 96, 'lr': 0.0003686119585881747, 'lambda_val': 0.0008168959244938713, 'batch_size': 1691, 'optimizer': 'Adam'}. Best is trial 4 with value: 0.11847522329459384.
2026-05-11 01:39:25,711 - optuna.study.study - INFO - Trial 180 finished with value: 0.08411715211368706 and parameters: {'n_layers': 1, 'embedding_dim': 128, 'lr': 0.00019334413352641724, 'lambda_val': 2.0600821874101052e-05, 'batch_size': 1851, 'optimizer': 'Adam'}. Best is trial 4 with value: 0.11847522329459384.
2026-05-11 01:39:29,582 - optuna.study._optimize - INFO - Trial 181 pruned. 
2026-05-11 01:40:01,462 - optuna.study.study - INFO - Trial 182 finished with value: 0.072818382259152 and parameters: {'n_layers': 1, 'embedding_dim': 128, 'lr': 0.0002450388544594573, 'lambda_val': 1.0878442997853327e-05, 'batch_size': 1874, 'optimizer': 'Adam'}. Best is trial 4 with value: 0.11847522329459384.
2026-05-11 01:40:06,139 - optuna.study._optimize - INFO - Trial 183 pruned. 
2026-05-11 01:40:12,857 - optuna.study._optimize - INFO - Trial 184 pruned. 
2026-05-11 01:40:42,287 - optuna.study.study - INFO - Trial 185 finished with value: 0.05918638743245434 and parameters: {'n_layers': 1, 'embedding_dim': 128, 'lr': 0.0002973617680673872, 'lambda_val': 0.0003011951096271513, 'batch_size': 1939, 'optimizer': 'Adam'}. Best is trial 4 with value: 0.11847522329459384.
2026-05-11 01:40:45,965 - optuna.study._optimize - INFO - Trial 186 pruned. 
2026-05-11 01:40:50,180 - optuna.study._optimize - INFO - Trial 187 pruned. 
2026-05-11 01:40:54,030 - optuna.study._optimize - INFO - Trial 188 pruned. 
2026-05-11 01:40:57,736 - optuna.study._optimize - INFO - Trial 189 pruned. 
2026-05-11 01:41:33,258 - optuna.study.study - INFO - Trial 190 finished with value: 0.07772040328362122 and parameters: {'n_layers': 1, 'embedding_dim': 128, 'lr': 0.0002417742023318277, 'lambda_val': 0.0009366339969327397, 'batch_size': 1833, 'optimizer': 'Adam'}. Best is trial 4 with value: 0.11847522329459384.
2026-05-11 01:41:37,617 - optuna.study._optimize - INFO - Trial 191 pruned. 
2026-05-11 01:41:41,223 - optuna.study._optimize - INFO - Trial 192 pruned. 
2026-05-11 01:42:11,797 - optuna.study.study - INFO - Trial 193 finished with value: 0.06681705665462329 and parameters: {'n_layers': 1, 'embedding_dim': 128, 'lr': 0.00025996143581624134, 'lambda_val': 0.00137375401003206, 'batch_size': 1866, 'optimizer': 'Adam'}. Best is trial 4 with value: 0.11847522329459384.
2026-05-11 01:42:15,724 - optuna.study._optimize - INFO - Trial 194 pruned. 
2026-05-11 01:42:46,093 - optuna.study.study - INFO - Trial 195 finished with value: 0.058647612038955084 and parameters: {'n_layers': 1, 'embedding_dim': 128, 'lr': 0.00030897700156546504, 'lambda_val': 6.32190635766071e-06, 'batch_size': 1962, 'optimizer': 'Adam'}. Best is trial 4 with value: 0.11847522329459384.
2026-05-11 01:42:51,009 - optuna.study._optimize - INFO - Trial 196 pruned. 
2026-05-11 01:43:24,192 - optuna.study.study - INFO - Trial 197 finished with value: 0.06352454803897377 and parameters: {'n_layers': 1, 'embedding_dim': 128, 'lr': 0.00022507291498216676, 'lambda_val': 0.0005873726456120847, 'batch_size': 2541, 'optimizer': 'Adam'}. Best is trial 4 with value: 0.11847522329459384.
2026-05-11 01:43:28,105 - optuna.study._optimize - INFO - Trial 198 pruned. 
2026-05-11 01:43:32,153 - optuna.study._optimize - INFO - Trial 199 pruned. 
2026-05-11 01:43:54,654 - root - INFO -   **** Training e_100K_1c1dcs_rand5
2026-05-11 01:43:54,664 - root - INFO -   **** Getting 53072/65410 random edges
2026-05-11 01:43:55,673 - optuna.storages._rdb.storage - INFO - A new study created in RDB with name: Study_e_100K_1c1dcs_rand5
2026-05-11 01:44:50,239 - optuna.study.study - INFO - Trial 0 finished with value: 0.017934711611207372 and parameters: {'n_layers': 3, 'embedding_dim': 256, 'lr': 0.010286986241520302, 'lambda_val': 0.02240418004077037, 'batch_size': 1711, 'optimizer': 'RMSprop'}. Best is trial 0 with value: 0.017934711611207372.
2026-05-11 01:45:27,468 - optuna.study.study - INFO - Trial 1 finished with value: 0.02383597733692253 and parameters: {'n_layers': 1, 'embedding_dim': 128, 'lr': 0.0019595465799812015, 'lambda_val': 0.06598904913645591, 'batch_size': 1606, 'optimizer': 'Adam'}. Best is trial 1 with value: 0.02383597733692253.
2026-05-11 01:46:04,730 - optuna.study.study - INFO - Trial 2 finished with value: 0.010917005144294585 and parameters: {'n_layers': 3, 'embedding_dim': 128, 'lr': 1.4170960827120874e-05, 'lambda_val': 2.8298769877892823e-05, 'batch_size': 1445, 'optimizer': 'RMSprop'}. Best is trial 1 with value: 0.02383597733692253.
2026-05-11 01:46:40,705 - optuna.study.study - INFO - Trial 3 finished with value: 0.023722256930617823 and parameters: {'n_layers': 2, 'embedding_dim': 128, 'lr': 0.03494837327877632, 'lambda_val': 8.149513555501831e-06, 'batch_size': 4032, 'optimizer': 'Adam'}. Best is trial 1 with value: 0.02383597733692253.
2026-05-11 01:47:23,112 - optuna.study.study - INFO - Trial 4 finished with value: 0.03196864528442201 and parameters: {'n_layers': 4, 'embedding_dim': 128, 'lr': 0.012501298965548253, 'lambda_val': 1.8437861316721098e-05, 'batch_size': 960, 'optimizer': 'RMSprop'}. Best is trial 4 with value: 0.03196864528442201.
2026-05-11 01:48:01,030 - optuna.study.study - INFO - Trial 5 finished with value: 0.028235921115347264 and parameters: {'n_layers': 3, 'embedding_dim': 64, 'lr': 0.006050605397252317, 'lambda_val': 0.00010484378246530041, 'batch_size': 3476, 'optimizer': 'RMSprop'}. Best is trial 4 with value: 0.03196864528442201.
2026-05-11 01:48:47,405 - optuna.study.study - INFO - Trial 6 finished with value: 0.029071400328188633 and parameters: {'n_layers': 2, 'embedding_dim': 256, 'lr': 0.0004899745609613647, 'lambda_val': 2.6724916514260865e-06, 'batch_size': 2506, 'optimizer': 'RMSprop'}. Best is trial 4 with value: 0.03196864528442201.
2026-05-11 01:48:51,729 - optuna.study._optimize - INFO - Trial 7 pruned. 
2026-05-11 01:48:57,179 - optuna.study._optimize - INFO - Trial 8 pruned. 
2026-05-11 01:49:01,162 - optuna.study._optimize - INFO - Trial 9 pruned. 
2026-05-11 01:49:36,362 - optuna.study.study - INFO - Trial 10 finished with value: 0.00695261144022304 and parameters: {'n_layers': 4, 'embedding_dim': 32, 'lr': 0.0004064752430543247, 'lambda_val': 0.0010002764490646687, 'batch_size': 830, 'optimizer': 'RMSprop'}. Best is trial 4 with value: 0.03196864528442201.
2026-05-11 01:50:12,105 - optuna.study.study - INFO - Trial 11 finished with value: 0.060995696270697425 and parameters: {'n_layers': 1, 'embedding_dim': 256, 'lr': 0.00031740062165967574, 'lambda_val': 1.0712562499065824e-06, 'batch_size': 2929, 'optimizer': 'RMSprop'}. Best is trial 11 with value: 0.060995696270697425.
2026-05-11 01:50:47,676 - optuna.study.study - INFO - Trial 12 finished with value: 0.08371460276005245 and parameters: {'n_layers': 1, 'embedding_dim': 256, 'lr': 0.00013786140079833528, 'lambda_val': 1.1939288287764693e-06, 'batch_size': 2995, 'optimizer': 'RMSprop'}. Best is trial 12 with value: 0.08371460276005245.
2026-05-11 01:51:23,190 - optuna.study.study - INFO - Trial 13 finished with value: 0.10545433157054192 and parameters: {'n_layers': 1, 'embedding_dim': 256, 'lr': 0.00011645731500778369, 'lambda_val': 1.3170713086946424e-06, 'batch_size': 2790, 'optimizer': 'RMSprop'}. Best is trial 13 with value: 0.10545433157054192.
2026-05-11 01:51:27,158 - optuna.study._optimize - INFO - Trial 14 pruned. 
2026-05-11 01:52:03,535 - optuna.study.study - INFO - Trial 15 finished with value: 0.10720122396305293 and parameters: {'n_layers': 1, 'embedding_dim': 256, 'lr': 9.399981996281441e-05, 'lambda_val': 5.835681716048209e-06, 'batch_size': 3398, 'optimizer': 'RMSprop'}. Best is trial 15 with value: 0.10720122396305293.
2026-05-11 01:52:08,073 - optuna.study._optimize - INFO - Trial 16 pruned. 
2026-05-11 01:52:39,132 - optuna.study.study - INFO - Trial 17 finished with value: 0.035457973147249994 and parameters: {'n_layers': 1, 'embedding_dim': 32, 'lr': 0.00160414989865012, 'lambda_val': 0.0006964273744743557, 'batch_size': 3394, 'optimizer': 'RMSprop'}. Best is trial 15 with value: 0.10720122396305293.
2026-05-11 01:53:17,060 - optuna.study.study - INFO - Trial 18 finished with value: 0.10254980159425851 and parameters: {'n_layers': 1, 'embedding_dim': 256, 'lr': 0.00012161598692903662, 'lambda_val': 5.868972817865114e-05, 'batch_size': 2394, 'optimizer': 'Adam'}. Best is trial 15 with value: 0.10720122396305293.
2026-05-11 01:53:22,263 - optuna.study._optimize - INFO - Trial 19 pruned. 
2026-05-11 01:53:57,269 - optuna.study.study - INFO - Trial 20 finished with value: 0.06209918602314474 and parameters: {'n_layers': 1, 'embedding_dim': 256, 'lr': 0.00020193474482211668, 'lambda_val': 0.0002647062349431223, 'batch_size': 2628, 'optimizer': 'RMSprop'}. Best is trial 15 with value: 0.10720122396305293.
2026-05-11 01:54:02,001 - optuna.study._optimize - INFO - Trial 21 pruned. 
2026-05-11 01:54:38,952 - optuna.study.study - INFO - Trial 22 finished with value: 0.05752680696944 and parameters: {'n_layers': 1, 'embedding_dim': 256, 'lr': 0.0008921990589896649, 'lambda_val': 4.316348781161856e-06, 'batch_size': 2399, 'optimizer': 'Adam'}. Best is trial 15 with value: 0.10720122396305293.
2026-05-11 01:54:44,073 - optuna.study._optimize - INFO - Trial 23 pruned. 
2026-05-11 01:54:48,455 - optuna.study._optimize - INFO - Trial 24 pruned. 
2026-05-11 01:55:18,680 - optuna.study.study - INFO - Trial 25 finished with value: 0.07072567089105769 and parameters: {'n_layers': 1, 'embedding_dim': 64, 'lr': 0.00022719463527973694, 'lambda_val': 2.653849610000664e-06, 'batch_size': 2727, 'optimizer': 'Adam'}. Best is trial 15 with value: 0.10720122396305293.
2026-05-11 01:55:49,558 - optuna.study.study - INFO - Trial 26 finished with value: 0.025844673945190376 and parameters: {'n_layers': 2, 'embedding_dim': 32, 'lr': 0.000685187234777487, 'lambda_val': 4.195494260875642e-05, 'batch_size': 3003, 'optimizer': 'RMSprop'}. Best is trial 15 with value: 0.10720122396305293.
2026-05-11 01:55:53,553 - optuna.study._optimize - INFO - Trial 27 pruned. 
2026-05-11 01:55:58,421 - optuna.study._optimize - INFO - Trial 28 pruned. 
2026-05-11 01:56:03,974 - optuna.study._optimize - INFO - Trial 29 pruned. 
2026-05-11 01:56:38,721 - optuna.study.study - INFO - Trial 30 finished with value: 0.08066446943172695 and parameters: {'n_layers': 1, 'embedding_dim': 256, 'lr': 0.00014726695714543066, 'lambda_val': 2.613167333656725e-06, 'batch_size': 3144, 'optimizer': 'RMSprop'}. Best is trial 15 with value: 0.10720122396305293.
2026-05-11 01:57:19,376 - optuna.study.study - INFO - Trial 31 finished with value: 0.07189635815723279 and parameters: {'n_layers': 1, 'embedding_dim': 256, 'lr': 0.0001335960241101388, 'lambda_val': 1.256481744474294e-06, 'batch_size': 2994, 'optimizer': 'RMSprop'}. Best is trial 15 with value: 0.10720122396305293.
2026-05-11 01:57:55,357 - optuna.study.study - INFO - Trial 32 finished with value: 0.06994689307777957 and parameters: {'n_layers': 1, 'embedding_dim': 256, 'lr': 0.000206342431144214, 'lambda_val': 2.0909349573138357e-06, 'batch_size': 2553, 'optimizer': 'RMSprop'}. Best is trial 15 with value: 0.10720122396305293.
2026-05-11 01:58:00,129 - optuna.study._optimize - INFO - Trial 33 pruned. 
2026-05-11 01:58:34,154 - optuna.study.study - INFO - Trial 34 finished with value: 0.05037241412700299 and parameters: {'n_layers': 1, 'embedding_dim': 256, 'lr': 0.001478244065963766, 'lambda_val': 1.1401727539939428e-05, 'batch_size': 3136, 'optimizer': 'RMSprop'}. Best is trial 15 with value: 0.10720122396305293.
2026-05-11 01:58:41,738 - optuna.study._optimize - INFO - Trial 35 pruned. 
2026-05-11 01:58:46,107 - optuna.study._optimize - INFO - Trial 36 pruned. 
2026-05-11 01:58:50,300 - optuna.study._optimize - INFO - Trial 37 pruned. 
2026-05-11 01:58:53,799 - optuna.study._optimize - INFO - Trial 38 pruned. 
2026-05-11 01:58:57,877 - optuna.study._optimize - INFO - Trial 39 pruned. 
2026-05-11 01:59:01,974 - optuna.study._optimize - INFO - Trial 40 pruned. 
2026-05-11 01:59:37,468 - optuna.study.study - INFO - Trial 41 finished with value: 0.0747174532311198 and parameters: {'n_layers': 1, 'embedding_dim': 256, 'lr': 0.00016470394050452215, 'lambda_val': 3.6081641259922222e-06, 'batch_size': 3124, 'optimizer': 'RMSprop'}. Best is trial 15 with value: 0.10720122396305293.
2026-05-11 01:59:42,761 - optuna.study._optimize - INFO - Trial 42 pruned. 
2026-05-11 02:00:17,732 - optuna.study.study - INFO - Trial 43 finished with value: 0.07504267998200687 and parameters: {'n_layers': 1, 'embedding_dim': 256, 'lr': 0.00013240663859988473, 'lambda_val': 1.1015384706032822e-06, 'batch_size': 2849, 'optimizer': 'RMSprop'}. Best is trial 15 with value: 0.10720122396305293.
2026-05-11 02:00:54,519 - optuna.study.study - INFO - Trial 44 finished with value: 0.06285268009540801 and parameters: {'n_layers': 1, 'embedding_dim': 256, 'lr': 0.00025028159014417846, 'lambda_val': 2.6546383035229693e-05, 'batch_size': 3305, 'optimizer': 'RMSprop'}. Best is trial 15 with value: 0.10720122396305293.
2026-05-11 02:01:00,225 - optuna.study._optimize - INFO - Trial 45 pruned. 
2026-05-11 02:01:04,021 - optuna.study._optimize - INFO - Trial 46 pruned. 
2026-05-11 02:01:09,560 - optuna.study._optimize - INFO - Trial 47 pruned. 
2026-05-11 02:01:40,473 - optuna.study.study - INFO - Trial 48 finished with value: 0.0485172747470758 and parameters: {'n_layers': 1, 'embedding_dim': 128, 'lr': 0.00030456409480319406, 'lambda_val': 8.726568386444015e-06, 'batch_size': 4093, 'optimizer': 'RMSprop'}. Best is trial 15 with value: 0.10720122396305293.
2026-05-11 02:01:44,541 - optuna.study._optimize - INFO - Trial 49 pruned. 
2026-05-11 02:01:51,705 - optuna.study._optimize - INFO - Trial 50 pruned. 
2026-05-11 02:02:33,974 - optuna.study.study - INFO - Trial 51 finished with value: 0.07231918611879351 and parameters: {'n_layers': 1, 'embedding_dim': 256, 'lr': 0.0001393827464110545, 'lambda_val': 1.1438134765242077e-06, 'batch_size': 2820, 'optimizer': 'RMSprop'}. Best is trial 15 with value: 0.10720122396305293.
2026-05-11 02:03:09,620 - optuna.study.study - INFO - Trial 52 finished with value: 0.08000016176616036 and parameters: {'n_layers': 1, 'embedding_dim': 256, 'lr': 0.00013885256082606304, 'lambda_val': 1.0869378452019145e-06, 'batch_size': 3210, 'optimizer': 'RMSprop'}. Best is trial 15 with value: 0.10720122396305293.
2026-05-11 02:03:13,767 - optuna.study._optimize - INFO - Trial 53 pruned. 
2026-05-11 02:03:18,473 - optuna.study._optimize - INFO - Trial 54 pruned. 
2026-05-11 02:03:58,193 - optuna.study.study - INFO - Trial 55 finished with value: 0.05730493023851293 and parameters: {'n_layers': 1, 'embedding_dim': 256, 'lr': 0.00041110650439185863, 'lambda_val': 3.1635794379178364e-06, 'batch_size': 3347, 'optimizer': 'RMSprop'}. Best is trial 15 with value: 0.10720122396305293.
2026-05-11 02:04:02,640 - optuna.study._optimize - INFO - Trial 56 pruned. 
2026-05-11 02:04:06,943 - optuna.study._optimize - INFO - Trial 57 pruned. 
2026-05-11 02:04:11,300 - optuna.study._optimize - INFO - Trial 58 pruned. 
2026-05-11 02:04:14,808 - optuna.study._optimize - INFO - Trial 59 pruned. 
2026-05-11 02:04:21,286 - optuna.study._optimize - INFO - Trial 60 pruned. 
