2026-05-11 05:41:18,178 - optuna.study.study - INFO - Trial 115 finished with value: 0.05563118431519434 and parameters: {'n_layers': 1, 'embedding_dim': 256, 'lr': 0.0039876428216964795, 'lambda_val': 0.0001420244841815822, 'batch_size': 4030, 'optimizer': 'Adam'}. Best is trial 112 with value: 0.08064309430179928.
2026-05-11 05:41:53,230 - optuna.study.study - INFO - Trial 116 finished with value: 0.07667556685758217 and parameters: {'n_layers': 1, 'embedding_dim': 256, 'lr': 0.005419032004414247, 'lambda_val': 0.0005173041452965708, 'batch_size': 3884, 'optimizer': 'RMSprop'}. Best is trial 112 with value: 0.08064309430179928.
2026-05-11 05:42:29,619 - optuna.study.study - INFO - Trial 117 finished with value: 0.07706587557423215 and parameters: {'n_layers': 1, 'embedding_dim': 256, 'lr': 0.010666446371297721, 'lambda_val': 0.00043957880087469245, 'batch_size': 3861, 'optimizer': 'RMSprop'}. Best is trial 112 with value: 0.08064309430179928.
2026-05-11 05:43:16,547 - optuna.study.study - INFO - Trial 118 finished with value: 0.07165473310824795 and parameters: {'n_layers': 1, 'embedding_dim': 256, 'lr': 0.011074980190289258, 'lambda_val': 0.0002066240853617277, 'batch_size': 3827, 'optimizer': 'RMSprop'}. Best is trial 112 with value: 0.08064309430179928.
2026-05-11 05:43:53,743 - optuna.study.study - INFO - Trial 119 finished with value: 0.07092973548991074 and parameters: {'n_layers': 1, 'embedding_dim': 256, 'lr': 0.01544928176759413, 'lambda_val': 0.00036555383691589814, 'batch_size': 4086, 'optimizer': 'RMSprop'}. Best is trial 112 with value: 0.08064309430179928.
2026-05-11 05:44:20,849 - optuna.study._optimize - INFO - Trial 120 pruned. 
2026-05-11 05:44:59,711 - optuna.study.study - INFO - Trial 121 finished with value: 0.0748089214712935 and parameters: {'n_layers': 1, 'embedding_dim': 256, 'lr': 0.005826608423036836, 'lambda_val': 0.0007800413175334406, 'batch_size': 3909, 'optimizer': 'RMSprop'}. Best is trial 112 with value: 0.08064309430179928.
2026-05-11 05:45:37,338 - optuna.study.study - INFO - Trial 122 finished with value: 0.08197075547945257 and parameters: {'n_layers': 1, 'embedding_dim': 256, 'lr': 0.010736427153272677, 'lambda_val': 0.0008368777203567695, 'batch_size': 3752, 'optimizer': 'RMSprop'}. Best is trial 122 with value: 0.08197075547945257.
2026-05-11 05:46:22,452 - optuna.study.study - INFO - Trial 123 finished with value: 0.08393676979754278 and parameters: {'n_layers': 1, 'embedding_dim': 256, 'lr': 0.011288548992426562, 'lambda_val': 0.001171919300665354, 'batch_size': 3752, 'optimizer': 'RMSprop'}. Best is trial 123 with value: 0.08393676979754278.
2026-05-11 05:47:03,069 - optuna.study.study - INFO - Trial 124 finished with value: 0.08283567945949956 and parameters: {'n_layers': 1, 'embedding_dim': 256, 'lr': 0.010194607080805166, 'lambda_val': 0.0012894268660300521, 'batch_size': 3747, 'optimizer': 'RMSprop'}. Best is trial 123 with value: 0.08393676979754278.
2026-05-11 05:47:39,760 - optuna.study.study - INFO - Trial 125 finished with value: 0.07732836130512769 and parameters: {'n_layers': 1, 'embedding_dim': 256, 'lr': 0.010888519543412837, 'lambda_val': 0.0008520312374878723, 'batch_size': 3656, 'optimizer': 'RMSprop'}. Best is trial 123 with value: 0.08393676979754278.
2026-05-11 05:48:17,064 - optuna.study.study - INFO - Trial 126 finished with value: 0.08001852827908644 and parameters: {'n_layers': 1, 'embedding_dim': 256, 'lr': 0.010904102331444069, 'lambda_val': 0.0007755517448095725, 'batch_size': 3763, 'optimizer': 'RMSprop'}. Best is trial 123 with value: 0.08393676979754278.
2026-05-11 05:48:53,560 - optuna.study.study - INFO - Trial 127 finished with value: 0.07632127458867526 and parameters: {'n_layers': 1, 'embedding_dim': 256, 'lr': 0.010958628370705477, 'lambda_val': 0.0004438749772193763, 'batch_size': 3734, 'optimizer': 'RMSprop'}. Best is trial 123 with value: 0.08393676979754278.
2026-05-11 05:49:40,527 - optuna.study.study - INFO - Trial 128 finished with value: 0.07892538782180099 and parameters: {'n_layers': 1, 'embedding_dim': 256, 'lr': 0.017448614510365692, 'lambda_val': 0.001170881549928602, 'batch_size': 3647, 'optimizer': 'RMSprop'}. Best is trial 123 with value: 0.08393676979754278.
2026-05-11 05:50:16,839 - optuna.study.study - INFO - Trial 129 finished with value: 0.07999016836663622 and parameters: {'n_layers': 1, 'embedding_dim': 256, 'lr': 0.01877076733924463, 'lambda_val': 0.0011868672039165658, 'batch_size': 3640, 'optimizer': 'RMSprop'}. Best is trial 123 with value: 0.08393676979754278.
2026-05-11 05:50:22,041 - optuna.study._optimize - INFO - Trial 130 pruned. 
2026-05-11 05:50:58,501 - optuna.study.study - INFO - Trial 131 finished with value: 0.07715824810393342 and parameters: {'n_layers': 1, 'embedding_dim': 256, 'lr': 0.01778224288440377, 'lambda_val': 0.0012209879025169774, 'batch_size': 3753, 'optimizer': 'RMSprop'}. Best is trial 123 with value: 0.08393676979754278.
2026-05-11 05:51:35,237 - optuna.study.study - INFO - Trial 132 finished with value: 0.08640926798859318 and parameters: {'n_layers': 1, 'embedding_dim': 256, 'lr': 0.01793799285108155, 'lambda_val': 0.0011242930299209639, 'batch_size': 3783, 'optimizer': 'RMSprop'}. Best is trial 132 with value: 0.08640926798859318.
2026-05-11 05:51:41,297 - optuna.study._optimize - INFO - Trial 133 pruned. 
2026-05-11 05:52:18,526 - optuna.study.study - INFO - Trial 134 finished with value: 0.07692901932724584 and parameters: {'n_layers': 1, 'embedding_dim': 256, 'lr': 0.017947693927416283, 'lambda_val': 0.0008213750798275256, 'batch_size': 3668, 'optimizer': 'RMSprop'}. Best is trial 132 with value: 0.08640926798859318.
2026-05-11 05:52:56,071 - optuna.study.study - INFO - Trial 135 finished with value: 0.08033228175087986 and parameters: {'n_layers': 1, 'embedding_dim': 256, 'lr': 0.024010979119198157, 'lambda_val': 0.001662734834272126, 'batch_size': 3784, 'optimizer': 'RMSprop'}. Best is trial 132 with value: 0.08640926798859318.
2026-05-11 05:53:00,901 - optuna.study._optimize - INFO - Trial 136 pruned. 
2026-05-11 05:53:09,503 - optuna.study._optimize - INFO - Trial 137 pruned. 
2026-05-11 05:53:19,981 - optuna.study._optimize - INFO - Trial 138 pruned. 
2026-05-11 05:53:24,920 - optuna.study._optimize - INFO - Trial 139 pruned. 
2026-05-11 05:54:01,977 - optuna.study.study - INFO - Trial 140 finished with value: 0.08122711021440043 and parameters: {'n_layers': 1, 'embedding_dim': 256, 'lr': 0.014998451595225277, 'lambda_val': 0.0016122150985746022, 'batch_size': 3815, 'optimizer': 'RMSprop'}. Best is trial 132 with value: 0.08640926798859318.
2026-05-11 05:54:38,894 - optuna.study.study - INFO - Trial 141 finished with value: 0.07833507338804672 and parameters: {'n_layers': 1, 'embedding_dim': 256, 'lr': 0.014866769005629808, 'lambda_val': 0.0010823114870522014, 'batch_size': 3785, 'optimizer': 'RMSprop'}. Best is trial 132 with value: 0.08640926798859318.
2026-05-11 05:55:16,082 - optuna.study.study - INFO - Trial 142 finished with value: 0.07852745907629498 and parameters: {'n_layers': 1, 'embedding_dim': 256, 'lr': 0.01679236304197596, 'lambda_val': 0.002115196650256551, 'batch_size': 3794, 'optimizer': 'RMSprop'}. Best is trial 132 with value: 0.08640926798859318.
2026-05-11 05:55:52,916 - optuna.study.study - INFO - Trial 143 finished with value: 0.07519397202377029 and parameters: {'n_layers': 1, 'embedding_dim': 256, 'lr': 0.01507492246003552, 'lambda_val': 0.0016226461676871753, 'batch_size': 3811, 'optimizer': 'RMSprop'}. Best is trial 132 with value: 0.08640926798859318.
2026-05-11 05:56:30,209 - optuna.study.study - INFO - Trial 144 finished with value: 0.08387316251004562 and parameters: {'n_layers': 1, 'embedding_dim': 256, 'lr': 0.013668114817887675, 'lambda_val': 0.0011091313302473457, 'batch_size': 3785, 'optimizer': 'RMSprop'}. Best is trial 132 with value: 0.08640926798859318.
2026-05-11 05:57:07,757 - optuna.study.study - INFO - Trial 145 finished with value: 0.07529115005102589 and parameters: {'n_layers': 1, 'embedding_dim': 256, 'lr': 0.014133555338426045, 'lambda_val': 0.0012524911790648303, 'batch_size': 3799, 'optimizer': 'RMSprop'}. Best is trial 132 with value: 0.08640926798859318.
2026-05-11 05:57:39,359 - optuna.study.study - INFO - Trial 146 finished with value: 0.07491869619851622 and parameters: {'n_layers': 1, 'embedding_dim': 96, 'lr': 0.024300641240156264, 'lambda_val': 0.0010442504610684478, 'batch_size': 4019, 'optimizer': 'RMSprop'}. Best is trial 132 with value: 0.08640926798859318.
2026-05-11 05:58:16,109 - optuna.study.study - INFO - Trial 147 finished with value: 0.08008233684785196 and parameters: {'n_layers': 1, 'embedding_dim': 256, 'lr': 0.017923642048620035, 'lambda_val': 0.0021056600912486186, 'batch_size': 3731, 'optimizer': 'RMSprop'}. Best is trial 132 with value: 0.08640926798859318.
2026-05-11 05:58:20,837 - optuna.study._optimize - INFO - Trial 148 pruned. 
2026-05-11 05:58:57,451 - optuna.study.study - INFO - Trial 149 finished with value: 0.07937606023386777 and parameters: {'n_layers': 1, 'embedding_dim': 256, 'lr': 0.012397073023980491, 'lambda_val': 0.0006647503384147262, 'batch_size': 3727, 'optimizer': 'RMSprop'}. Best is trial 132 with value: 0.08640926798859318.
2026-05-11 05:59:34,063 - optuna.study.study - INFO - Trial 150 finished with value: 0.07818046014106768 and parameters: {'n_layers': 1, 'embedding_dim': 256, 'lr': 0.008519339090949587, 'lambda_val': 0.0006707091217039521, 'batch_size': 3708, 'optimizer': 'RMSprop'}. Best is trial 132 with value: 0.08640926798859318.
2026-05-11 06:00:12,002 - optuna.study.study - INFO - Trial 151 finished with value: 0.08442319011354749 and parameters: {'n_layers': 1, 'embedding_dim': 256, 'lr': 0.017128419854498433, 'lambda_val': 0.0014359228840712876, 'batch_size': 3594, 'optimizer': 'RMSprop'}. Best is trial 132 with value: 0.08640926798859318.
2026-05-11 06:00:48,017 - optuna.study.study - INFO - Trial 152 finished with value: 0.08213257065671395 and parameters: {'n_layers': 1, 'embedding_dim': 256, 'lr': 0.013256692708980238, 'lambda_val': 0.0013825616482832305, 'batch_size': 3585, 'optimizer': 'RMSprop'}. Best is trial 132 with value: 0.08640926798859318.
2026-05-11 06:01:24,723 - optuna.study.study - INFO - Trial 153 finished with value: 0.08234493431422055 and parameters: {'n_layers': 1, 'embedding_dim': 256, 'lr': 0.012103944254243208, 'lambda_val': 0.00144243850038297, 'batch_size': 3568, 'optimizer': 'RMSprop'}. Best is trial 132 with value: 0.08640926798859318.
2026-05-11 06:01:29,307 - optuna.study._optimize - INFO - Trial 154 pruned. 
2026-05-11 06:02:05,843 - optuna.study.study - INFO - Trial 155 finished with value: 0.08313158715194845 and parameters: {'n_layers': 1, 'embedding_dim': 256, 'lr': 0.007571365119040003, 'lambda_val': 0.00157925274224452, 'batch_size': 3582, 'optimizer': 'RMSprop'}. Best is trial 132 with value: 0.08640926798859318.
2026-05-11 06:02:41,903 - optuna.study.study - INFO - Trial 156 finished with value: 0.08380031882867024 and parameters: {'n_layers': 1, 'embedding_dim': 256, 'lr': 0.007317178652627838, 'lambda_val': 0.0015471652588447086, 'batch_size': 3545, 'optimizer': 'RMSprop'}. Best is trial 132 with value: 0.08640926798859318.
2026-05-11 06:03:18,293 - optuna.study.study - INFO - Trial 157 finished with value: 0.0788583975690232 and parameters: {'n_layers': 1, 'embedding_dim': 256, 'lr': 0.007417571216735933, 'lambda_val': 0.001595471121930719, 'batch_size': 3556, 'optimizer': 'RMSprop'}. Best is trial 132 with value: 0.08640926798859318.
2026-05-11 06:03:55,139 - optuna.study.study - INFO - Trial 158 finished with value: 0.08460796119502267 and parameters: {'n_layers': 1, 'embedding_dim': 256, 'lr': 0.009098923959451336, 'lambda_val': 0.002079537404724995, 'batch_size': 3517, 'optimizer': 'RMSprop'}. Best is trial 132 with value: 0.08640926798859318.
2026-05-11 06:04:31,636 - optuna.study.study - INFO - Trial 159 finished with value: 0.07801884099192431 and parameters: {'n_layers': 1, 'embedding_dim': 256, 'lr': 0.012705255998450474, 'lambda_val': 0.002182162702991058, 'batch_size': 3522, 'optimizer': 'RMSprop'}. Best is trial 132 with value: 0.08640926798859318.
2026-05-11 06:05:08,538 - optuna.study.study - INFO - Trial 160 finished with value: 0.07686662193589694 and parameters: {'n_layers': 1, 'embedding_dim': 256, 'lr': 0.008991948191343732, 'lambda_val': 0.002281857983604073, 'batch_size': 3570, 'optimizer': 'RMSprop'}. Best is trial 132 with value: 0.08640926798859318.
2026-05-11 06:05:44,958 - optuna.study.study - INFO - Trial 161 finished with value: 0.07724685687836404 and parameters: {'n_layers': 1, 'embedding_dim': 256, 'lr': 0.009050858872993452, 'lambda_val': 0.0018555963716801068, 'batch_size': 3722, 'optimizer': 'RMSprop'}. Best is trial 132 with value: 0.08640926798859318.
2026-05-11 06:06:22,686 - optuna.study.study - INFO - Trial 162 finished with value: 0.08114130086774106 and parameters: {'n_layers': 1, 'embedding_dim': 256, 'lr': 0.007654499639492025, 'lambda_val': 0.0014871310232615284, 'batch_size': 3837, 'optimizer': 'RMSprop'}. Best is trial 132 with value: 0.08640926798859318.
2026-05-11 06:06:59,321 - optuna.study.study - INFO - Trial 163 finished with value: 0.0806401020426199 and parameters: {'n_layers': 1, 'embedding_dim': 256, 'lr': 0.008175216708650379, 'lambda_val': 0.001494847938029439, 'batch_size': 3859, 'optimizer': 'RMSprop'}. Best is trial 132 with value: 0.08640926798859318.
2026-05-11 06:07:36,868 - optuna.study.study - INFO - Trial 164 finished with value: 0.08185936899731462 and parameters: {'n_layers': 1, 'embedding_dim': 256, 'lr': 0.008133962858042272, 'lambda_val': 0.0014629906142510376, 'batch_size': 3862, 'optimizer': 'RMSprop'}. Best is trial 132 with value: 0.08640926798859318.
2026-05-11 06:08:13,619 - optuna.study.study - INFO - Trial 165 finished with value: 0.08282216780689435 and parameters: {'n_layers': 1, 'embedding_dim': 256, 'lr': 0.006926599581535576, 'lambda_val': 0.0014141199171474076, 'batch_size': 3863, 'optimizer': 'RMSprop'}. Best is trial 132 with value: 0.08640926798859318.
2026-05-11 06:08:50,912 - optuna.study.study - INFO - Trial 166 finished with value: 0.08558473660453615 and parameters: {'n_layers': 1, 'embedding_dim': 256, 'lr': 0.0072407112890249545, 'lambda_val': 0.0014872981133379347, 'batch_size': 3872, 'optimizer': 'RMSprop'}. Best is trial 132 with value: 0.08640926798859318.
2026-05-11 06:09:22,587 - optuna.study.study - INFO - Trial 167 finished with value: 0.07273782117112018 and parameters: {'n_layers': 1, 'embedding_dim': 96, 'lr': 0.006586743934604894, 'lambda_val': 0.0010323069970162053, 'batch_size': 3971, 'optimizer': 'RMSprop'}. Best is trial 132 with value: 0.08640926798859318.
2026-05-11 06:10:04,851 - optuna.study.study - INFO - Trial 168 finished with value: 0.08295520578084027 and parameters: {'n_layers': 1, 'embedding_dim': 256, 'lr': 0.0073225474565108434, 'lambda_val': 0.0013989780994566787, 'batch_size': 4048, 'optimizer': 'RMSprop'}. Best is trial 132 with value: 0.08640926798859318.
2026-05-11 06:10:48,011 - optuna.study.study - INFO - Trial 169 finished with value: 0.07845392896188812 and parameters: {'n_layers': 1, 'embedding_dim': 256, 'lr': 0.007219161735601514, 'lambda_val': 0.0026734572140403702, 'batch_size': 4034, 'optimizer': 'RMSprop'}. Best is trial 132 with value: 0.08640926798859318.
2026-05-11 06:10:52,594 - optuna.study._optimize - INFO - Trial 170 pruned. 
2026-05-11 06:11:28,578 - optuna.study.study - INFO - Trial 171 finished with value: 0.07954174653009297 and parameters: {'n_layers': 1, 'embedding_dim': 256, 'lr': 0.010321789867762284, 'lambda_val': 0.0017457931613400926, 'batch_size': 3888, 'optimizer': 'RMSprop'}. Best is trial 132 with value: 0.08640926798859318.
2026-05-11 06:12:04,722 - optuna.study.study - INFO - Trial 172 finished with value: 0.08275806169896731 and parameters: {'n_layers': 1, 'embedding_dim': 256, 'lr': 0.01270688148999292, 'lambda_val': 0.0010889742584000428, 'batch_size': 3929, 'optimizer': 'RMSprop'}. Best is trial 132 with value: 0.08640926798859318.
2026-05-11 06:12:47,937 - optuna.study.study - INFO - Trial 173 finished with value: 0.08008558937082942 and parameters: {'n_layers': 1, 'embedding_dim': 256, 'lr': 0.012469813086788671, 'lambda_val': 0.0009878140821687504, 'batch_size': 3851, 'optimizer': 'RMSprop'}. Best is trial 132 with value: 0.08640926798859318.
2026-05-11 06:13:27,047 - optuna.study.study - INFO - Trial 174 finished with value: 0.0823109357104787 and parameters: {'n_layers': 1, 'embedding_dim': 256, 'lr': 0.009871938373047907, 'lambda_val': 0.001415810203708089, 'batch_size': 3967, 'optimizer': 'RMSprop'}. Best is trial 132 with value: 0.08640926798859318.
2026-05-11 06:13:31,662 - optuna.study._optimize - INFO - Trial 175 pruned. 
2026-05-11 06:14:10,973 - optuna.study.study - INFO - Trial 176 finished with value: 0.08637419634503536 and parameters: {'n_layers': 1, 'embedding_dim': 256, 'lr': 0.013137412559004307, 'lambda_val': 0.0023611999056488745, 'batch_size': 3889, 'optimizer': 'RMSprop'}. Best is trial 132 with value: 0.08640926798859318.
2026-05-11 06:14:48,075 - optuna.study.study - INFO - Trial 177 finished with value: 0.0804841854945312 and parameters: {'n_layers': 1, 'embedding_dim': 256, 'lr': 0.0131980581837337, 'lambda_val': 0.0027188470213772666, 'batch_size': 3921, 'optimizer': 'RMSprop'}. Best is trial 132 with value: 0.08640926798859318.
2026-05-11 06:15:24,438 - optuna.study.study - INFO - Trial 178 finished with value: 0.0858880588253093 and parameters: {'n_layers': 1, 'embedding_dim': 256, 'lr': 0.00925730352648426, 'lambda_val': 0.0024197570712616275, 'batch_size': 4081, 'optimizer': 'RMSprop'}. Best is trial 132 with value: 0.08640926798859318.
2026-05-11 06:16:00,011 - optuna.study.study - INFO - Trial 179 finished with value: 0.07919821856564196 and parameters: {'n_layers': 1, 'embedding_dim': 256, 'lr': 0.010141466739931226, 'lambda_val': 0.002189067729081394, 'batch_size': 3974, 'optimizer': 'RMSprop'}. Best is trial 132 with value: 0.08640926798859318.
2026-05-11 06:16:36,714 - optuna.study.study - INFO - Trial 180 finished with value: 0.07599774411658469 and parameters: {'n_layers': 1, 'embedding_dim': 256, 'lr': 0.01227789208268927, 'lambda_val': 0.0029432620428942046, 'batch_size': 4092, 'optimizer': 'RMSprop'}. Best is trial 132 with value: 0.08640926798859318.
2026-05-11 06:17:15,164 - optuna.study.study - INFO - Trial 181 finished with value: 0.08173643493392842 and parameters: {'n_layers': 1, 'embedding_dim': 256, 'lr': 0.008296060683193, 'lambda_val': 0.0012631824073559659, 'batch_size': 4023, 'optimizer': 'RMSprop'}. Best is trial 132 with value: 0.08640926798859318.
2026-05-11 06:17:53,187 - optuna.study.study - INFO - Trial 182 finished with value: 0.08112803497001568 and parameters: {'n_layers': 1, 'embedding_dim': 256, 'lr': 0.006680149703550197, 'lambda_val': 0.0018444537610965684, 'batch_size': 3927, 'optimizer': 'RMSprop'}. Best is trial 132 with value: 0.08640926798859318.
2026-05-11 06:18:41,294 - optuna.study.study - INFO - Trial 183 finished with value: 0.0820719684009756 and parameters: {'n_layers': 1, 'embedding_dim': 256, 'lr': 0.008974875706725382, 'lambda_val': 0.0011058916260134977, 'batch_size': 3901, 'optimizer': 'RMSprop'}. Best is trial 132 with value: 0.08640926798859318.
2026-05-11 06:18:46,249 - optuna.study._optimize - INFO - Trial 184 pruned. 
2026-05-11 06:19:25,473 - optuna.study.study - INFO - Trial 185 finished with value: 0.08062060129375552 and parameters: {'n_layers': 1, 'embedding_dim': 256, 'lr': 0.011620656772853188, 'lambda_val': 0.001114584976891212, 'batch_size': 4086, 'optimizer': 'RMSprop'}. Best is trial 132 with value: 0.08640926798859318.
2026-05-11 06:19:30,950 - optuna.study._optimize - INFO - Trial 186 pruned. 
2026-05-11 06:20:07,074 - optuna.study.study - INFO - Trial 187 finished with value: 0.07839441195484735 and parameters: {'n_layers': 1, 'embedding_dim': 256, 'lr': 0.014466077574849452, 'lambda_val': 0.0010558319567328333, 'batch_size': 3890, 'optimizer': 'RMSprop'}. Best is trial 132 with value: 0.08640926798859318.
2026-05-11 06:20:43,593 - optuna.study.study - INFO - Trial 188 finished with value: 0.07707090042825561 and parameters: {'n_layers': 1, 'embedding_dim': 256, 'lr': 0.006482683969324934, 'lambda_val': 0.003407859960445332, 'batch_size': 3697, 'optimizer': 'RMSprop'}. Best is trial 132 with value: 0.08640926798859318.
2026-05-11 06:21:17,119 - optuna.study.study - INFO - Trial 189 finished with value: 0.08127130858359213 and parameters: {'n_layers': 1, 'embedding_dim': 256, 'lr': 0.009165533179999892, 'lambda_val': 0.001242661687854189, 'batch_size': 3951, 'optimizer': 'RMSprop'}. Best is trial 132 with value: 0.08640926798859318.
2026-05-11 06:21:21,778 - optuna.study._optimize - INFO - Trial 190 pruned. 
2026-05-11 06:22:03,771 - optuna.study.study - INFO - Trial 191 finished with value: 0.07930061327212308 and parameters: {'n_layers': 1, 'embedding_dim': 256, 'lr': 0.007840272434112639, 'lambda_val': 0.0013959313310635134, 'batch_size': 3842, 'optimizer': 'RMSprop'}. Best is trial 132 with value: 0.08640926798859318.
2026-05-11 06:22:38,817 - optuna.study.study - INFO - Trial 192 finished with value: 0.07783220037490128 and parameters: {'n_layers': 1, 'embedding_dim': 256, 'lr': 0.009468968608948632, 'lambda_val': 0.0017279769353407616, 'batch_size': 3901, 'optimizer': 'RMSprop'}. Best is trial 132 with value: 0.08640926798859318.
2026-05-11 06:23:15,047 - optuna.study.study - INFO - Trial 193 finished with value: 0.07743948286217162 and parameters: {'n_layers': 1, 'embedding_dim': 256, 'lr': 0.007629675771364625, 'lambda_val': 0.0023910561777278896, 'batch_size': 3762, 'optimizer': 'RMSprop'}. Best is trial 132 with value: 0.08640926798859318.
