2026-05-10 20:55:05,642 - optuna.study.study - INFO - Trial 34 finished with value: 0.0702442301705083 and parameters: {'n_layers': 1, 'embedding_dim': 64, 'lr': 0.00022700256056441966, 'lambda_val': 0.00031262219155730206, 'batch_size': 1245, 'optimizer': 'RMSprop'}. Best is trial 34 with value: 0.0702442301705083.
2026-05-10 20:55:34,645 - optuna.study.study - INFO - Trial 35 finished with value: 0.08384512108517146 and parameters: {'n_layers': 1, 'embedding_dim': 128, 'lr': 0.00025081507274525973, 'lambda_val': 0.00017076404842046402, 'batch_size': 1275, 'optimizer': 'RMSprop'}. Best is trial 35 with value: 0.08384512108517146.
2026-05-10 20:56:06,705 - optuna.study.study - INFO - Trial 36 finished with value: 0.07386075414437525 and parameters: {'n_layers': 1, 'embedding_dim': 128, 'lr': 0.00022184169065625318, 'lambda_val': 0.0003942626289761648, 'batch_size': 1303, 'optimizer': 'RMSprop'}. Best is trial 35 with value: 0.08384512108517146.
2026-05-10 20:56:14,296 - optuna.study._optimize - INFO - Trial 37 pruned. 
2026-05-10 20:56:18,151 - optuna.study._optimize - INFO - Trial 38 pruned. 
2026-05-10 20:56:47,646 - optuna.study.study - INFO - Trial 39 finished with value: 0.03771023188997728 and parameters: {'n_layers': 1, 'embedding_dim': 128, 'lr': 0.002194865498602339, 'lambda_val': 0.00010840998933854898, 'batch_size': 2013, 'optimizer': 'RMSprop'}. Best is trial 35 with value: 0.08384512108517146.
2026-05-10 20:57:17,128 - optuna.study.study - INFO - Trial 40 finished with value: 0.07084802459736918 and parameters: {'n_layers': 1, 'embedding_dim': 128, 'lr': 0.00025634064532418106, 'lambda_val': 3.9208995194875444e-05, 'batch_size': 1306, 'optimizer': 'RMSprop'}. Best is trial 35 with value: 0.08384512108517146.
2026-05-10 20:57:46,676 - optuna.study.study - INFO - Trial 41 finished with value: 0.07724954029959637 and parameters: {'n_layers': 1, 'embedding_dim': 128, 'lr': 0.00021827727049955883, 'lambda_val': 2.4519333498137777e-05, 'batch_size': 1348, 'optimizer': 'RMSprop'}. Best is trial 35 with value: 0.08384512108517146.
2026-05-10 20:58:15,094 - optuna.study.study - INFO - Trial 42 finished with value: 0.06997872653575218 and parameters: {'n_layers': 1, 'embedding_dim': 128, 'lr': 0.00026144506643852055, 'lambda_val': 5.593835994019637e-06, 'batch_size': 1299, 'optimizer': 'RMSprop'}. Best is trial 35 with value: 0.08384512108517146.
2026-05-10 20:58:44,254 - optuna.study.study - INFO - Trial 43 finished with value: 0.06157845257607275 and parameters: {'n_layers': 1, 'embedding_dim': 128, 'lr': 0.0002262982778658254, 'lambda_val': 2.9296209800810428e-05, 'batch_size': 1496, 'optimizer': 'RMSprop'}. Best is trial 35 with value: 0.08384512108517146.
2026-05-10 20:59:10,890 - optuna.study.study - INFO - Trial 44 finished with value: 0.05333894218302764 and parameters: {'n_layers': 1, 'embedding_dim': 128, 'lr': 0.0006447425829452109, 'lambda_val': 2.5452105185745587e-05, 'batch_size': 1272, 'optimizer': 'RMSprop'}. Best is trial 35 with value: 0.08384512108517146.
2026-05-10 20:59:39,856 - optuna.study.study - INFO - Trial 45 finished with value: 0.0723995937564344 and parameters: {'n_layers': 1, 'embedding_dim': 128, 'lr': 0.00017330627845269327, 'lambda_val': 4.302541358460129e-06, 'batch_size': 2183, 'optimizer': 'RMSprop'}. Best is trial 35 with value: 0.08384512108517146.
2026-05-10 20:59:44,694 - optuna.study._optimize - INFO - Trial 46 pruned. 
2026-05-10 20:59:48,055 - optuna.study._optimize - INFO - Trial 47 pruned. 
2026-05-10 20:59:53,616 - optuna.study._optimize - INFO - Trial 48 pruned. 
2026-05-10 20:59:58,078 - optuna.study._optimize - INFO - Trial 49 pruned. 
2026-05-10 21:00:01,633 - optuna.study._optimize - INFO - Trial 50 pruned. 
2026-05-10 21:00:31,327 - optuna.study.study - INFO - Trial 51 finished with value: 0.07987390093425602 and parameters: {'n_layers': 1, 'embedding_dim': 128, 'lr': 0.0003652974036026698, 'lambda_val': 2.3876175763699164e-05, 'batch_size': 1040, 'optimizer': 'RMSprop'}. Best is trial 35 with value: 0.08384512108517146.
2026-05-10 21:01:00,908 - optuna.study.study - INFO - Trial 52 finished with value: 0.07218904452823525 and parameters: {'n_layers': 1, 'embedding_dim': 128, 'lr': 0.0003346529061645518, 'lambda_val': 1.965432572591618e-05, 'batch_size': 1021, 'optimizer': 'RMSprop'}. Best is trial 35 with value: 0.08384512108517146.
2026-05-10 21:01:29,743 - optuna.study.study - INFO - Trial 53 finished with value: 0.051653197181982226 and parameters: {'n_layers': 1, 'embedding_dim': 128, 'lr': 0.001070690641729235, 'lambda_val': 1.796567974758752e-05, 'batch_size': 1010, 'optimizer': 'RMSprop'}. Best is trial 35 with value: 0.08384512108517146.
2026-05-10 21:01:58,479 - optuna.study.study - INFO - Trial 54 finished with value: 0.06489227455031157 and parameters: {'n_layers': 1, 'embedding_dim': 128, 'lr': 0.00044154873974534527, 'lambda_val': 5.433429393369439e-06, 'batch_size': 661, 'optimizer': 'RMSprop'}. Best is trial 35 with value: 0.08384512108517146.
2026-05-10 21:02:02,193 - optuna.study._optimize - INFO - Trial 55 pruned. 
2026-05-10 21:02:37,278 - optuna.study.study - INFO - Trial 56 finished with value: 0.07049497858552643 and parameters: {'n_layers': 1, 'embedding_dim': 256, 'lr': 0.000374702999802003, 'lambda_val': 6.670219597796323e-05, 'batch_size': 1027, 'optimizer': 'RMSprop'}. Best is trial 35 with value: 0.08384512108517146.
2026-05-10 21:02:42,556 - optuna.study._optimize - INFO - Trial 57 pruned. 
2026-05-10 21:03:17,482 - optuna.study.study - INFO - Trial 58 finished with value: 0.06082876954149311 and parameters: {'n_layers': 2, 'embedding_dim': 128, 'lr': 0.00016801059915367704, 'lambda_val': 2.038097017281056e-05, 'batch_size': 524, 'optimizer': 'Adam'}. Best is trial 35 with value: 0.08384512108517146.
2026-05-10 21:03:46,093 - optuna.study.study - INFO - Trial 59 finished with value: 0.05139861050845968 and parameters: {'n_layers': 1, 'embedding_dim': 96, 'lr': 0.0005184154686822372, 'lambda_val': 0.00010488778873972313, 'batch_size': 1417, 'optimizer': 'RMSprop'}. Best is trial 35 with value: 0.08384512108517146.
2026-05-10 21:04:17,637 - optuna.study.study - INFO - Trial 60 finished with value: 0.03740229452282973 and parameters: {'n_layers': 1, 'embedding_dim': 128, 'lr': 0.0013152149181149073, 'lambda_val': 2.0277577926072304e-06, 'batch_size': 2434, 'optimizer': 'RMSprop'}. Best is trial 35 with value: 0.08384512108517146.
2026-05-10 21:04:46,594 - optuna.study.study - INFO - Trial 61 finished with value: 0.07186761382731977 and parameters: {'n_layers': 1, 'embedding_dim': 128, 'lr': 0.0002885522028178694, 'lambda_val': 4.1685439510506526e-05, 'batch_size': 1700, 'optimizer': 'RMSprop'}. Best is trial 35 with value: 0.08384512108517146.
2026-05-10 21:05:17,129 - optuna.study.study - INFO - Trial 62 finished with value: 0.062394584882611286 and parameters: {'n_layers': 1, 'embedding_dim': 128, 'lr': 0.0003184063517017954, 'lambda_val': 3.837513048885337e-05, 'batch_size': 1922, 'optimizer': 'RMSprop'}. Best is trial 35 with value: 0.08384512108517146.
2026-05-10 21:05:46,386 - optuna.study.study - INFO - Trial 63 finished with value: 0.06566273543652476 and parameters: {'n_layers': 1, 'embedding_dim': 128, 'lr': 0.00017024323274074564, 'lambda_val': 8.533870799525337e-06, 'batch_size': 1675, 'optimizer': 'RMSprop'}. Best is trial 35 with value: 0.08384512108517146.
2026-05-10 21:06:15,260 - optuna.study.study - INFO - Trial 64 finished with value: 0.06512009894678987 and parameters: {'n_layers': 1, 'embedding_dim': 128, 'lr': 0.00022678058611987333, 'lambda_val': 0.00019044202722364703, 'batch_size': 1549, 'optimizer': 'RMSprop'}. Best is trial 35 with value: 0.08384512108517146.
2026-05-10 21:06:20,305 - optuna.study._optimize - INFO - Trial 65 pruned. 
2026-05-10 21:06:24,853 - optuna.study._optimize - INFO - Trial 66 pruned. 
2026-05-10 21:06:28,987 - optuna.study._optimize - INFO - Trial 67 pruned. 
2026-05-10 21:06:58,264 - optuna.study.study - INFO - Trial 68 finished with value: 0.06491387098398997 and parameters: {'n_layers': 1, 'embedding_dim': 128, 'lr': 0.0005504141665137416, 'lambda_val': 0.0006222605840646534, 'batch_size': 1774, 'optimizer': 'RMSprop'}. Best is trial 35 with value: 0.08384512108517146.
2026-05-10 21:07:02,439 - optuna.study._optimize - INFO - Trial 69 pruned. 
2026-05-10 21:07:06,315 - optuna.study._optimize - INFO - Trial 70 pruned. 
2026-05-10 21:07:35,551 - optuna.study.study - INFO - Trial 71 finished with value: 0.07623273889889162 and parameters: {'n_layers': 1, 'embedding_dim': 128, 'lr': 0.00023420854638198357, 'lambda_val': 4.204669282608987e-05, 'batch_size': 1450, 'optimizer': 'RMSprop'}. Best is trial 35 with value: 0.08384512108517146.
2026-05-10 21:08:04,332 - optuna.study.study - INFO - Trial 72 finished with value: 0.07716911635266856 and parameters: {'n_layers': 1, 'embedding_dim': 128, 'lr': 0.0002012427892199513, 'lambda_val': 8.313020171481285e-05, 'batch_size': 1435, 'optimizer': 'RMSprop'}. Best is trial 35 with value: 0.08384512108517146.
2026-05-10 21:08:36,424 - optuna.study.study - INFO - Trial 73 finished with value: 0.06666658716470858 and parameters: {'n_layers': 1, 'embedding_dim': 128, 'lr': 0.00020112657533966554, 'lambda_val': 5.860347894841421e-05, 'batch_size': 1465, 'optimizer': 'RMSprop'}. Best is trial 35 with value: 0.08384512108517146.
2026-05-10 21:08:40,464 - optuna.study._optimize - INFO - Trial 74 pruned. 
2026-05-10 21:09:10,583 - optuna.study.study - INFO - Trial 75 finished with value: 0.0636602428570846 and parameters: {'n_layers': 1, 'embedding_dim': 128, 'lr': 0.00036420421452409524, 'lambda_val': 0.00012877409501826708, 'batch_size': 1191, 'optimizer': 'RMSprop'}. Best is trial 35 with value: 0.08384512108517146.
2026-05-10 21:09:16,201 - optuna.study._optimize - INFO - Trial 76 pruned. 
2026-05-10 21:09:46,297 - optuna.study.study - INFO - Trial 77 finished with value: 0.06947145093309236 and parameters: {'n_layers': 1, 'embedding_dim': 128, 'lr': 0.00020488565112068024, 'lambda_val': 2.582082913205629e-05, 'batch_size': 1408, 'optimizer': 'RMSprop'}. Best is trial 35 with value: 0.08384512108517146.
2026-05-10 21:09:50,574 - optuna.study._optimize - INFO - Trial 78 pruned. 
2026-05-10 21:09:55,454 - optuna.study._optimize - INFO - Trial 79 pruned. 
2026-05-10 21:10:01,174 - optuna.study._optimize - INFO - Trial 80 pruned. 
2026-05-10 21:10:32,385 - optuna.study.study - INFO - Trial 81 finished with value: 0.07811705569131411 and parameters: {'n_layers': 1, 'embedding_dim': 128, 'lr': 0.0002749312853911329, 'lambda_val': 4.2414691469323874e-05, 'batch_size': 1366, 'optimizer': 'RMSprop'}. Best is trial 35 with value: 0.08384512108517146.
2026-05-10 21:10:40,259 - optuna.study._optimize - INFO - Trial 82 pruned. 
2026-05-10 21:10:44,880 - optuna.study._optimize - INFO - Trial 83 pruned. 
2026-05-10 21:10:49,027 - optuna.study._optimize - INFO - Trial 84 pruned. 
2026-05-10 21:10:56,218 - optuna.study._optimize - INFO - Trial 85 pruned. 
2026-05-10 21:10:59,966 - optuna.study._optimize - INFO - Trial 86 pruned. 
2026-05-10 21:11:28,168 - optuna.study.study - INFO - Trial 87 finished with value: 0.06681048235324816 and parameters: {'n_layers': 1, 'embedding_dim': 96, 'lr': 0.0003772411348725225, 'lambda_val': 4.6291695814072865e-05, 'batch_size': 1099, 'optimizer': 'RMSprop'}. Best is trial 35 with value: 0.08384512108517146.
2026-05-10 21:11:32,070 - optuna.study._optimize - INFO - Trial 88 pruned. 
2026-05-10 21:11:36,974 - optuna.study._optimize - INFO - Trial 89 pruned. 
2026-05-10 21:11:41,182 - optuna.study._optimize - INFO - Trial 90 pruned. 
2026-05-10 21:12:11,185 - optuna.study.study - INFO - Trial 91 finished with value: 0.08434103883584258 and parameters: {'n_layers': 1, 'embedding_dim': 128, 'lr': 0.0002607423224662598, 'lambda_val': 3.331961292556016e-05, 'batch_size': 1463, 'optimizer': 'RMSprop'}. Best is trial 91 with value: 0.08434103883584258.
2026-05-10 21:12:40,684 - optuna.study.study - INFO - Trial 92 finished with value: 0.08413045840197153 and parameters: {'n_layers': 1, 'embedding_dim': 128, 'lr': 0.00025432411006555584, 'lambda_val': 1.554583774881692e-05, 'batch_size': 1476, 'optimizer': 'RMSprop'}. Best is trial 91 with value: 0.08434103883584258.
2026-05-10 21:13:09,512 - optuna.study.study - INFO - Trial 93 finished with value: 0.08576958513275892 and parameters: {'n_layers': 1, 'embedding_dim': 128, 'lr': 0.00017872097719125873, 'lambda_val': 3.412193516594044e-05, 'batch_size': 1499, 'optimizer': 'RMSprop'}. Best is trial 93 with value: 0.08576958513275892.
2026-05-10 21:13:37,786 - optuna.study.study - INFO - Trial 94 finished with value: 0.07460711642777848 and parameters: {'n_layers': 1, 'embedding_dim': 128, 'lr': 0.0002466650694725684, 'lambda_val': 3.268494969051888e-05, 'batch_size': 1524, 'optimizer': 'RMSprop'}. Best is trial 93 with value: 0.08576958513275892.
2026-05-10 21:14:07,174 - optuna.study.study - INFO - Trial 95 finished with value: 0.06651706828240911 and parameters: {'n_layers': 1, 'embedding_dim': 128, 'lr': 0.00024829477469542156, 'lambda_val': 3.5185540140587825e-05, 'batch_size': 1482, 'optimizer': 'RMSprop'}. Best is trial 93 with value: 0.08576958513275892.
2026-05-10 21:14:10,932 - optuna.study._optimize - INFO - Trial 96 pruned. 
2026-05-10 21:14:14,599 - optuna.study._optimize - INFO - Trial 97 pruned. 
2026-05-10 21:14:18,625 - optuna.study._optimize - INFO - Trial 98 pruned. 
2026-05-10 21:14:22,723 - optuna.study._optimize - INFO - Trial 99 pruned. 
2026-05-10 21:14:26,611 - optuna.study._optimize - INFO - Trial 100 pruned. 
2026-05-10 21:14:55,488 - optuna.study.study - INFO - Trial 101 finished with value: 0.08391616216490547 and parameters: {'n_layers': 1, 'embedding_dim': 128, 'lr': 0.00020049803278337364, 'lambda_val': 1.804480037689895e-05, 'batch_size': 1331, 'optimizer': 'RMSprop'}. Best is trial 93 with value: 0.08576958513275892.
2026-05-10 21:14:59,385 - optuna.study._optimize - INFO - Trial 102 pruned. 
2026-05-10 21:15:03,284 - optuna.study._optimize - INFO - Trial 103 pruned. 
2026-05-10 21:15:32,205 - optuna.study.study - INFO - Trial 104 finished with value: 0.06549649648309025 and parameters: {'n_layers': 1, 'embedding_dim': 128, 'lr': 0.00031843028859057947, 'lambda_val': 3.493110713708492e-05, 'batch_size': 1617, 'optimizer': 'RMSprop'}. Best is trial 93 with value: 0.08576958513275892.
2026-05-10 21:16:00,964 - optuna.study.study - INFO - Trial 105 finished with value: 0.062222580469573935 and parameters: {'n_layers': 1, 'embedding_dim': 128, 'lr': 0.0004927186403808158, 'lambda_val': 7.273522183598751e-06, 'batch_size': 1359, 'optimizer': 'RMSprop'}. Best is trial 93 with value: 0.08576958513275892.
2026-05-10 21:16:05,406 - optuna.study._optimize - INFO - Trial 106 pruned. 
2026-05-10 21:16:09,239 - optuna.study._optimize - INFO - Trial 107 pruned. 
2026-05-10 21:16:36,881 - optuna.study.study - INFO - Trial 108 finished with value: 0.07170662450388454 and parameters: {'n_layers': 1, 'embedding_dim': 96, 'lr': 0.0003701273792106666, 'lambda_val': 1.8504162197491177e-05, 'batch_size': 1067, 'optimizer': 'RMSprop'}. Best is trial 93 with value: 0.08576958513275892.
2026-05-10 21:16:40,524 - optuna.study._optimize - INFO - Trial 109 pruned. 
2026-05-10 21:17:09,889 - optuna.study.study - INFO - Trial 110 finished with value: 0.05779305998581201 and parameters: {'n_layers': 1, 'embedding_dim': 128, 'lr': 0.0007939508727193631, 'lambda_val': 2.7902299215986015e-05, 'batch_size': 1285, 'optimizer': 'RMSprop'}. Best is trial 93 with value: 0.08576958513275892.
2026-05-10 21:17:14,427 - optuna.study._optimize - INFO - Trial 111 pruned. 
2026-05-10 21:17:42,762 - optuna.study.study - INFO - Trial 112 finished with value: 0.07538078914431004 and parameters: {'n_layers': 1, 'embedding_dim': 128, 'lr': 0.0003032968691519079, 'lambda_val': 0.00010776253665876897, 'batch_size': 1312, 'optimizer': 'RMSprop'}. Best is trial 93 with value: 0.08576958513275892.
2026-05-10 21:17:46,815 - optuna.study._optimize - INFO - Trial 113 pruned. 
2026-05-10 21:18:15,319 - optuna.study.study - INFO - Trial 114 finished with value: 0.06384128539907817 and parameters: {'n_layers': 1, 'embedding_dim': 128, 'lr': 0.0002887007861276922, 'lambda_val': 0.0001324523637653514, 'batch_size': 1348, 'optimizer': 'RMSprop'}. Best is trial 93 with value: 0.08576958513275892.
2026-05-10 21:18:44,729 - optuna.study.study - INFO - Trial 115 finished with value: 0.054807770019322855 and parameters: {'n_layers': 1, 'embedding_dim': 128, 'lr': 0.0005903607898620512, 'lambda_val': 5.644338229860066e-05, 'batch_size': 1236, 'optimizer': 'RMSprop'}. Best is trial 93 with value: 0.08576958513275892.
2026-05-10 21:19:14,102 - optuna.study.study - INFO - Trial 116 finished with value: 0.09662026787757332 and parameters: {'n_layers': 1, 'embedding_dim': 128, 'lr': 0.00023719105328137702, 'lambda_val': 7.362302205236857e-05, 'batch_size': 1480, 'optimizer': 'RMSprop'}. Best is trial 116 with value: 0.09662026787757332.
2026-05-10 21:19:19,023 - optuna.study._optimize - INFO - Trial 117 pruned. 
2026-05-10 21:19:22,667 - optuna.study._optimize - INFO - Trial 118 pruned. 
2026-05-10 21:19:26,953 - optuna.study._optimize - INFO - Trial 119 pruned. 
2026-05-10 21:19:56,255 - optuna.study.study - INFO - Trial 120 finished with value: 0.07541488730500405 and parameters: {'n_layers': 1, 'embedding_dim': 128, 'lr': 0.00020886088399684185, 'lambda_val': 4.182420743033314e-05, 'batch_size': 817, 'optimizer': 'RMSprop'}. Best is trial 116 with value: 0.09662026787757332.
2026-05-10 21:20:00,268 - optuna.study._optimize - INFO - Trial 121 pruned. 
2026-05-10 21:20:29,786 - optuna.study.study - INFO - Trial 122 finished with value: 0.09755622333039767 and parameters: {'n_layers': 1, 'embedding_dim': 128, 'lr': 0.00020409673968076352, 'lambda_val': 2.3446964765857398e-05, 'batch_size': 794, 'optimizer': 'RMSprop'}. Best is trial 122 with value: 0.09755622333039767.
2026-05-10 21:20:33,694 - optuna.study._optimize - INFO - Trial 123 pruned. 
2026-05-10 21:20:37,405 - optuna.study._optimize - INFO - Trial 124 pruned. 
2026-05-10 21:20:41,280 - optuna.study._optimize - INFO - Trial 125 pruned. 
2026-05-10 21:20:47,820 - optuna.study._optimize - INFO - Trial 126 pruned. 
2026-05-10 21:21:17,240 - optuna.study.study - INFO - Trial 127 finished with value: 0.09010658777027682 and parameters: {'n_layers': 1, 'embedding_dim': 128, 'lr': 0.0002522150807436015, 'lambda_val': 4.939379999410376e-05, 'batch_size': 604, 'optimizer': 'RMSprop'}. Best is trial 122 with value: 0.09755622333039767.
2026-05-10 21:21:44,266 - optuna.study.study - INFO - Trial 128 finished with value: 0.07884672383287737 and parameters: {'n_layers': 1, 'embedding_dim': 64, 'lr': 0.00026433697522434334, 'lambda_val': 5.412551769611232e-05, 'batch_size': 983, 'optimizer': 'RMSprop'}. Best is trial 122 with value: 0.09755622333039767.
2026-05-10 21:22:17,306 - optuna.study.study - INFO - Trial 129 finished with value: 0.07314254450989359 and parameters: {'n_layers': 1, 'embedding_dim': 64, 'lr': 0.00026798104914471177, 'lambda_val': 6.232859790484081e-05, 'batch_size': 999, 'optimizer': 'RMSprop'}. Best is trial 122 with value: 0.09755622333039767.
2026-05-10 21:22:44,817 - optuna.study.study - INFO - Trial 130 finished with value: 0.07459308645499993 and parameters: {'n_layers': 1, 'embedding_dim': 64, 'lr': 0.0003811557263868966, 'lambda_val': 9.972375697802902e-06, 'batch_size': 628, 'optimizer': 'RMSprop'}. Best is trial 122 with value: 0.09755622333039767.
2026-05-10 21:22:49,145 - optuna.study._optimize - INFO - Trial 131 pruned. 
2026-05-10 21:22:52,988 - optuna.study._optimize - INFO - Trial 132 pruned. 
2026-05-10 21:23:21,841 - optuna.study.study - INFO - Trial 133 finished with value: 0.09210699108832808 and parameters: {'n_layers': 1, 'embedding_dim': 128, 'lr': 0.00022179833600537768, 'lambda_val': 8.585683375221588e-05, 'batch_size': 765, 'optimizer': 'RMSprop'}. Best is trial 122 with value: 0.09755622333039767.
2026-05-10 21:23:50,979 - optuna.study.study - INFO - Trial 134 finished with value: 0.0840816735284625 and parameters: {'n_layers': 1, 'embedding_dim': 128, 'lr': 0.00033781744318520514, 'lambda_val': 8.304156409058477e-05, 'batch_size': 764, 'optimizer': 'RMSprop'}. Best is trial 122 with value: 0.09755622333039767.
2026-05-10 21:24:18,557 - optuna.study.study - INFO - Trial 135 finished with value: 0.0663520118530322 and parameters: {'n_layers': 1, 'embedding_dim': 64, 'lr': 0.0004648965150208585, 'lambda_val': 7.031409350771185e-05, 'batch_size': 740, 'optimizer': 'RMSprop'}. Best is trial 122 with value: 0.09755622333039767.
2026-05-10 21:24:22,591 - optuna.study._optimize - INFO - Trial 136 pruned. 
2026-05-10 21:24:26,603 - optuna.study._optimize - INFO - Trial 137 pruned. 
2026-05-10 21:24:55,843 - optuna.study.study - INFO - Trial 138 finished with value: 0.07654626193601781 and parameters: {'n_layers': 1, 'embedding_dim': 128, 'lr': 0.00029162997583473166, 'lambda_val': 5.438707382288245e-05, 'batch_size': 850, 'optimizer': 'RMSprop'}. Best is trial 122 with value: 0.09755622333039767.
2026-05-10 21:25:24,540 - optuna.study.study - INFO - Trial 139 finished with value: 0.06946262809917665 and parameters: {'n_layers': 1, 'embedding_dim': 128, 'lr': 0.00038048262675688583, 'lambda_val': 2.7834215112322477e-05, 'batch_size': 514, 'optimizer': 'RMSprop'}. Best is trial 122 with value: 0.09755622333039767.
2026-05-10 21:25:54,215 - optuna.study.study - INFO - Trial 140 finished with value: 0.09263844065442027 and parameters: {'n_layers': 1, 'embedding_dim': 128, 'lr': 0.00023309811893761068, 'lambda_val': 1.5734307179845222e-05, 'batch_size': 765, 'optimizer': 'RMSprop'}. Best is trial 122 with value: 0.09755622333039767.
