2026-05-11 07:04:04,847 - optuna.study.study - INFO - Trial 89 finished with value: 0.07721477521714108 and parameters: {'n_layers': 1, 'embedding_dim': 128, 'lr': 0.00021924153893543196, 'lambda_val': 2.294699269993454e-06, 'batch_size': 1276, 'optimizer': 'RMSprop'}. Best is trial 62 with value: 0.14110520347341055.
2026-05-11 07:04:32,409 - optuna.study.study - INFO - Trial 90 finished with value: 0.09581566577303532 and parameters: {'n_layers': 1, 'embedding_dim': 32, 'lr': 0.00030742049701803863, 'lambda_val': 1.4322649082918998e-06, 'batch_size': 949, 'optimizer': 'RMSprop'}. Best is trial 62 with value: 0.14110520347341055.
2026-05-11 07:04:36,734 - optuna.study._optimize - INFO - Trial 91 pruned. 
2026-05-11 07:04:40,818 - optuna.study._optimize - INFO - Trial 92 pruned. 
2026-05-11 07:04:44,327 - optuna.study._optimize - INFO - Trial 93 pruned. 
2026-05-11 07:05:14,489 - optuna.study.study - INFO - Trial 94 finished with value: 0.049493372626987144 and parameters: {'n_layers': 1, 'embedding_dim': 64, 'lr': 0.00046366731390466264, 'lambda_val': 5.554883293879111e-06, 'batch_size': 3357, 'optimizer': 'RMSprop'}. Best is trial 62 with value: 0.14110520347341055.
2026-05-11 07:05:41,734 - optuna.study.study - INFO - Trial 95 finished with value: 0.1015833151252436 and parameters: {'n_layers': 1, 'embedding_dim': 32, 'lr': 0.00028336144480185647, 'lambda_val': 2.178910319331523e-06, 'batch_size': 1074, 'optimizer': 'RMSprop'}. Best is trial 62 with value: 0.14110520347341055.
2026-05-11 07:05:46,065 - optuna.study._optimize - INFO - Trial 96 pruned. 
2026-05-11 07:06:12,275 - optuna.study.study - INFO - Trial 97 finished with value: 0.043136127197868954 and parameters: {'n_layers': 1, 'embedding_dim': 32, 'lr': 0.0008689088717804435, 'lambda_val': 3.1879057183216097e-06, 'batch_size': 844, 'optimizer': 'RMSprop'}. Best is trial 62 with value: 0.14110520347341055.
2026-05-11 07:06:39,828 - optuna.study.study - INFO - Trial 98 finished with value: 0.041517394136516506 and parameters: {'n_layers': 1, 'embedding_dim': 32, 'lr': 0.0006218386695489409, 'lambda_val': 1.0223597320257941e-05, 'batch_size': 1446, 'optimizer': 'RMSprop'}. Best is trial 62 with value: 0.14110520347341055.
2026-05-11 07:07:08,941 - optuna.study.study - INFO - Trial 99 finished with value: 0.07588058916101613 and parameters: {'n_layers': 1, 'embedding_dim': 96, 'lr': 0.00038145161031329463, 'lambda_val': 1.7851061778499465e-06, 'batch_size': 736, 'optimizer': 'RMSprop'}. Best is trial 62 with value: 0.14110520347341055.
2026-05-11 07:07:12,781 - optuna.study._optimize - INFO - Trial 100 pruned. 
2026-05-11 07:07:40,702 - optuna.study.study - INFO - Trial 101 finished with value: 0.12195794007386207 and parameters: {'n_layers': 1, 'embedding_dim': 64, 'lr': 0.0002486110573569767, 'lambda_val': 2.8379412508680723e-06, 'batch_size': 686, 'optimizer': 'RMSprop'}. Best is trial 62 with value: 0.14110520347341055.
2026-05-11 07:07:44,353 - optuna.study._optimize - INFO - Trial 102 pruned. 
2026-05-11 07:07:48,222 - optuna.study._optimize - INFO - Trial 103 pruned. 
2026-05-11 07:07:52,272 - optuna.study._optimize - INFO - Trial 104 pruned. 
2026-05-11 07:08:21,355 - optuna.study.study - INFO - Trial 105 finished with value: 0.08561837000443584 and parameters: {'n_layers': 1, 'embedding_dim': 64, 'lr': 0.0002609524607473815, 'lambda_val': 1.0118930151280792e-06, 'batch_size': 1061, 'optimizer': 'RMSprop'}. Best is trial 62 with value: 0.14110520347341055.
2026-05-11 07:08:49,294 - optuna.study.study - INFO - Trial 106 finished with value: 0.10455014046864264 and parameters: {'n_layers': 1, 'embedding_dim': 64, 'lr': 0.00033360232491402126, 'lambda_val': 6.088809152182378e-06, 'batch_size': 589, 'optimizer': 'RMSprop'}. Best is trial 62 with value: 0.14110520347341055.
2026-05-11 07:08:53,162 - optuna.study._optimize - INFO - Trial 107 pruned. 
2026-05-11 07:08:57,155 - optuna.study._optimize - INFO - Trial 108 pruned. 
2026-05-11 07:09:25,356 - optuna.study.study - INFO - Trial 109 finished with value: 0.0668310097475078 and parameters: {'n_layers': 1, 'embedding_dim': 32, 'lr': 0.0004730973722652067, 'lambda_val': 3.932217952480411e-06, 'batch_size': 676, 'optimizer': 'RMSprop'}. Best is trial 62 with value: 0.14110520347341055.
2026-05-11 07:09:52,568 - optuna.study.study - INFO - Trial 110 finished with value: 0.08185713951441419 and parameters: {'n_layers': 1, 'embedding_dim': 64, 'lr': 0.0002558203439553768, 'lambda_val': 2.4473961740640386e-06, 'batch_size': 1287, 'optimizer': 'RMSprop'}. Best is trial 62 with value: 0.14110520347341055.
2026-05-11 07:10:20,662 - optuna.study.study - INFO - Trial 111 finished with value: 0.09725684639278134 and parameters: {'n_layers': 1, 'embedding_dim': 64, 'lr': 0.0003496053451243879, 'lambda_val': 5.8297377190005645e-06, 'batch_size': 601, 'optimizer': 'RMSprop'}. Best is trial 62 with value: 0.14110520347341055.
2026-05-11 07:10:48,242 - optuna.study.study - INFO - Trial 112 finished with value: 0.11559887471002867 and parameters: {'n_layers': 1, 'embedding_dim': 64, 'lr': 0.00032234908037512673, 'lambda_val': 7.90226399370188e-06, 'batch_size': 576, 'optimizer': 'RMSprop'}. Best is trial 62 with value: 0.14110520347341055.
2026-05-11 07:10:52,098 - optuna.study._optimize - INFO - Trial 113 pruned. 
2026-05-11 07:10:56,077 - optuna.study._optimize - INFO - Trial 114 pruned. 
2026-05-11 07:11:24,683 - optuna.study.study - INFO - Trial 115 finished with value: 0.0906716249772632 and parameters: {'n_layers': 1, 'embedding_dim': 96, 'lr': 0.00029106099449844344, 'lambda_val': 1.60278547909203e-05, 'batch_size': 745, 'optimizer': 'RMSprop'}. Best is trial 62 with value: 0.14110520347341055.
2026-05-11 07:11:31,611 - optuna.study._optimize - INFO - Trial 116 pruned. 
2026-05-11 07:11:35,454 - optuna.study._optimize - INFO - Trial 117 pruned. 
2026-05-11 07:12:04,582 - optuna.study.study - INFO - Trial 118 finished with value: 0.06236239243893791 and parameters: {'n_layers': 1, 'embedding_dim': 64, 'lr': 0.0004452909702059121, 'lambda_val': 1.840956760812546e-06, 'batch_size': 823, 'optimizer': 'RMSprop'}. Best is trial 62 with value: 0.14110520347341055.
2026-05-11 07:12:08,616 - optuna.study._optimize - INFO - Trial 119 pruned. 
2026-05-11 07:12:12,689 - optuna.study._optimize - INFO - Trial 120 pruned. 
2026-05-11 07:12:41,051 - optuna.study.study - INFO - Trial 121 finished with value: 0.11505364857481182 and parameters: {'n_layers': 1, 'embedding_dim': 64, 'lr': 0.0003206954603977808, 'lambda_val': 4.51136149538621e-06, 'batch_size': 587, 'optimizer': 'RMSprop'}. Best is trial 62 with value: 0.14110520347341055.
2026-05-11 07:13:08,715 - optuna.study.study - INFO - Trial 122 finished with value: 0.08885720561390623 and parameters: {'n_layers': 1, 'embedding_dim': 64, 'lr': 0.0003961547191401596, 'lambda_val': 3.858027102180477e-06, 'batch_size': 591, 'optimizer': 'RMSprop'}. Best is trial 62 with value: 0.14110520347341055.
2026-05-11 07:13:33,635 - optuna.study.study - INFO - Trial 123 finished with value: 0.03099625330788051 and parameters: {'n_layers': 1, 'embedding_dim': 64, 'lr': 0.00022925453719521358, 'lambda_val': 0.02497536247459273, 'batch_size': 735, 'optimizer': 'RMSprop'}. Best is trial 62 with value: 0.14110520347341055.
2026-05-11 07:13:57,245 - optuna.study.study - INFO - Trial 124 finished with value: 0.1116169647443772 and parameters: {'n_layers': 1, 'embedding_dim': 64, 'lr': 0.0002860408479581489, 'lambda_val': 1.5648030745423094e-06, 'batch_size': 668, 'optimizer': 'RMSprop'}. Best is trial 62 with value: 0.14110520347341055.
2026-05-11 07:14:22,751 - optuna.study.study - INFO - Trial 125 finished with value: 0.1068800614373974 and parameters: {'n_layers': 1, 'embedding_dim': 64, 'lr': 0.0003252959227835954, 'lambda_val': 1.0005424001497133e-06, 'batch_size': 665, 'optimizer': 'RMSprop'}. Best is trial 62 with value: 0.14110520347341055.
2026-05-11 07:14:26,380 - optuna.study._optimize - INFO - Trial 126 pruned. 
2026-05-11 07:14:53,928 - optuna.study.study - INFO - Trial 127 finished with value: 0.06775921872958114 and parameters: {'n_layers': 1, 'embedding_dim': 64, 'lr': 0.0005151637690218563, 'lambda_val': 2.1237355483455097e-06, 'batch_size': 581, 'optimizer': 'RMSprop'}. Best is trial 62 with value: 0.14110520347341055.
2026-05-11 07:14:57,502 - optuna.study._optimize - INFO - Trial 128 pruned. 
2026-05-11 07:15:25,763 - optuna.study.study - INFO - Trial 129 finished with value: 0.09596056649579504 and parameters: {'n_layers': 1, 'embedding_dim': 64, 'lr': 0.000287485274752498, 'lambda_val': 2.522520420776017e-06, 'batch_size': 889, 'optimizer': 'RMSprop'}. Best is trial 62 with value: 0.14110520347341055.
2026-05-11 07:15:53,754 - optuna.study.study - INFO - Trial 130 finished with value: 0.09074730527603213 and parameters: {'n_layers': 1, 'embedding_dim': 64, 'lr': 0.0003465171003621238, 'lambda_val': 1.0031055976261313e-05, 'batch_size': 674, 'optimizer': 'RMSprop'}. Best is trial 62 with value: 0.14110520347341055.
2026-05-11 07:16:22,004 - optuna.study.study - INFO - Trial 131 finished with value: 0.09741603102201478 and parameters: {'n_layers': 1, 'embedding_dim': 64, 'lr': 0.0003240428850828955, 'lambda_val': 1.0399297988766409e-06, 'batch_size': 651, 'optimizer': 'RMSprop'}. Best is trial 62 with value: 0.14110520347341055.
2026-05-11 07:16:53,401 - optuna.study.study - INFO - Trial 132 finished with value: 0.06888352075226029 and parameters: {'n_layers': 1, 'embedding_dim': 64, 'lr': 0.00041640795533540956, 'lambda_val': 1.7081438488253432e-06, 'batch_size': 802, 'optimizer': 'RMSprop'}. Best is trial 62 with value: 0.14110520347341055.
2026-05-11 07:16:57,417 - optuna.study._optimize - INFO - Trial 133 pruned. 
2026-05-11 07:17:01,512 - optuna.study._optimize - INFO - Trial 134 pruned. 
2026-05-11 07:17:29,167 - optuna.study.study - INFO - Trial 135 finished with value: 0.10493784439086158 and parameters: {'n_layers': 1, 'embedding_dim': 64, 'lr': 0.0003005653066367408, 'lambda_val': 3.0136788124008412e-06, 'batch_size': 833, 'optimizer': 'RMSprop'}. Best is trial 62 with value: 0.14110520347341055.
2026-05-11 07:18:08,207 - optuna.study.study - INFO - Trial 136 finished with value: 0.07078405093126075 and parameters: {'n_layers': 1, 'embedding_dim': 256, 'lr': 0.00099986893407639, 'lambda_val': 1.0299557152721778e-06, 'batch_size': 701, 'optimizer': 'RMSprop'}. Best is trial 62 with value: 0.14110520347341055.
2026-05-11 07:18:17,798 - optuna.study._optimize - INFO - Trial 137 pruned. 
2026-05-11 07:18:45,360 - optuna.study.study - INFO - Trial 138 finished with value: 0.06458074442718258 and parameters: {'n_layers': 1, 'embedding_dim': 64, 'lr': 0.000573821611118602, 'lambda_val': 1.6811654944017165e-06, 'batch_size': 592, 'optimizer': 'RMSprop'}. Best is trial 62 with value: 0.14110520347341055.
2026-05-11 07:19:14,824 - optuna.study.study - INFO - Trial 139 finished with value: 0.1028775984118312 and parameters: {'n_layers': 1, 'embedding_dim': 32, 'lr': 0.000385907514824774, 'lambda_val': 6.413649734111879e-06, 'batch_size': 757, 'optimizer': 'RMSprop'}. Best is trial 62 with value: 0.14110520347341055.
2026-05-11 07:19:18,918 - optuna.study._optimize - INFO - Trial 140 pruned. 
2026-05-11 07:19:22,929 - optuna.study._optimize - INFO - Trial 141 pruned. 
2026-05-11 07:19:27,550 - optuna.study._optimize - INFO - Trial 142 pruned. 
2026-05-11 07:19:31,617 - optuna.study._optimize - INFO - Trial 143 pruned. 
2026-05-11 07:19:59,353 - optuna.study.study - INFO - Trial 144 finished with value: 0.117477768329944 and parameters: {'n_layers': 1, 'embedding_dim': 32, 'lr': 0.0003304744496575551, 'lambda_val': 1.3445107390858185e-06, 'batch_size': 526, 'optimizer': 'RMSprop'}. Best is trial 62 with value: 0.14110520347341055.
2026-05-11 07:20:39,057 - optuna.study.study - INFO - Trial 145 finished with value: 0.08075492778840027 and parameters: {'n_layers': 1, 'embedding_dim': 256, 'lr': 0.0003678797712107715, 'lambda_val': 1.2700164090178604e-06, 'batch_size': 569, 'optimizer': 'RMSprop'}. Best is trial 62 with value: 0.14110520347341055.
2026-05-11 07:21:07,143 - optuna.study.study - INFO - Trial 146 finished with value: 0.04268502862047381 and parameters: {'n_layers': 1, 'embedding_dim': 32, 'lr': 0.0004910128455124568, 'lambda_val': 1.6614862325560067e-06, 'batch_size': 2522, 'optimizer': 'RMSprop'}. Best is trial 62 with value: 0.14110520347341055.
2026-05-11 07:21:36,867 - optuna.study.study - INFO - Trial 147 finished with value: 0.10528172443735982 and parameters: {'n_layers': 1, 'embedding_dim': 128, 'lr': 0.00032662644257926187, 'lambda_val': 1.0268191726824495e-06, 'batch_size': 515, 'optimizer': 'RMSprop'}. Best is trial 62 with value: 0.14110520347341055.
2026-05-11 07:21:40,938 - optuna.study._optimize - INFO - Trial 148 pruned. 
2026-05-11 07:21:45,011 - optuna.study._optimize - INFO - Trial 149 pruned. 
2026-05-11 07:22:19,382 - optuna.study.study - INFO - Trial 150 finished with value: 0.07866183908396754 and parameters: {'n_layers': 1, 'embedding_dim': 256, 'lr': 0.0004231591475426053, 'lambda_val': 1.983299595815709e-06, 'batch_size': 623, 'optimizer': 'Adam'}. Best is trial 62 with value: 0.14110520347341055.
2026-05-11 07:22:52,143 - optuna.study.study - INFO - Trial 151 finished with value: 0.10288200009395541 and parameters: {'n_layers': 1, 'embedding_dim': 128, 'lr': 0.0003146126864156909, 'lambda_val': 1.2198015886068902e-06, 'batch_size': 513, 'optimizer': 'RMSprop'}. Best is trial 62 with value: 0.14110520347341055.
2026-05-11 07:23:21,654 - optuna.study.study - INFO - Trial 152 finished with value: 0.10201705501417553 and parameters: {'n_layers': 1, 'embedding_dim': 128, 'lr': 0.00029901121121384054, 'lambda_val': 1.0132599936019862e-06, 'batch_size': 580, 'optimizer': 'RMSprop'}. Best is trial 62 with value: 0.14110520347341055.
2026-05-11 07:23:26,538 - optuna.study._optimize - INFO - Trial 153 pruned. 
2026-05-11 07:23:56,470 - optuna.study.study - INFO - Trial 154 finished with value: 0.09895610220785814 and parameters: {'n_layers': 1, 'embedding_dim': 128, 'lr': 0.00034832450828269876, 'lambda_val': 1.0098608265617898e-06, 'batch_size': 518, 'optimizer': 'RMSprop'}. Best is trial 62 with value: 0.14110520347341055.
2026-05-11 07:24:00,467 - optuna.study._optimize - INFO - Trial 155 pruned. 
2026-05-11 07:24:04,467 - optuna.study._optimize - INFO - Trial 156 pruned. 
2026-05-11 07:24:35,104 - optuna.study.study - INFO - Trial 157 finished with value: 0.060736871619571836 and parameters: {'n_layers': 1, 'embedding_dim': 32, 'lr': 0.0006746690338034699, 'lambda_val': 5.008657287001205e-06, 'batch_size': 602, 'optimizer': 'RMSprop'}. Best is trial 62 with value: 0.14110520347341055.
2026-05-11 07:24:39,209 - optuna.study._optimize - INFO - Trial 158 pruned. 
2026-05-11 07:25:21,426 - optuna.study.study - INFO - Trial 159 finished with value: 0.06692601436932233 and parameters: {'n_layers': 1, 'embedding_dim': 256, 'lr': 0.00044141757174280695, 'lambda_val': 2.5603232566111986e-06, 'batch_size': 725, 'optimizer': 'RMSprop'}. Best is trial 62 with value: 0.14110520347341055.
2026-05-11 07:25:25,557 - optuna.study._optimize - INFO - Trial 160 pruned. 
2026-05-11 07:25:29,334 - optuna.study._optimize - INFO - Trial 161 pruned. 
2026-05-11 07:25:33,339 - optuna.study._optimize - INFO - Trial 162 pruned. 
2026-05-11 07:25:37,676 - optuna.study._optimize - INFO - Trial 163 pruned. 
2026-05-11 07:25:42,212 - optuna.study._optimize - INFO - Trial 164 pruned. 
2026-05-11 07:25:49,282 - optuna.study._optimize - INFO - Trial 165 pruned. 
2026-05-11 07:25:53,689 - optuna.study._optimize - INFO - Trial 166 pruned. 
2026-05-11 07:26:27,923 - optuna.study.study - INFO - Trial 167 finished with value: 0.07865820103599912 and parameters: {'n_layers': 1, 'embedding_dim': 256, 'lr': 0.00024075041115424945, 'lambda_val': 1.251852102158645e-06, 'batch_size': 1125, 'optimizer': 'RMSprop'}. Best is trial 62 with value: 0.14110520347341055.
2026-05-11 07:26:34,348 - optuna.study._optimize - INFO - Trial 168 pruned. 
2026-05-11 07:26:38,097 - optuna.study._optimize - INFO - Trial 169 pruned. 
2026-05-11 07:27:14,159 - optuna.study.study - INFO - Trial 170 finished with value: 0.0705798828977867 and parameters: {'n_layers': 1, 'embedding_dim': 64, 'lr': 0.0003124093906192827, 'lambda_val': 0.0026293175486766652, 'batch_size': 779, 'optimizer': 'RMSprop'}. Best is trial 62 with value: 0.14110520347341055.
2026-05-11 07:27:50,228 - optuna.study.study - INFO - Trial 171 finished with value: 0.08928582059568801 and parameters: {'n_layers': 1, 'embedding_dim': 64, 'lr': 0.00030303227273755954, 'lambda_val': 3.1418530085658436e-06, 'batch_size': 838, 'optimizer': 'RMSprop'}. Best is trial 62 with value: 0.14110520347341055.
2026-05-11 07:27:54,409 - optuna.study._optimize - INFO - Trial 172 pruned. 
2026-05-11 07:28:22,643 - optuna.study.study - INFO - Trial 173 finished with value: 0.06607772266640465 and parameters: {'n_layers': 1, 'embedding_dim': 64, 'lr': 0.00036210242652229025, 'lambda_val': 6.543991156225386e-06, 'batch_size': 971, 'optimizer': 'RMSprop'}. Best is trial 62 with value: 0.14110520347341055.
2026-05-11 07:28:26,558 - optuna.study._optimize - INFO - Trial 174 pruned. 
2026-05-11 07:28:30,253 - optuna.study._optimize - INFO - Trial 175 pruned. 
2026-05-11 07:28:34,092 - optuna.study._optimize - INFO - Trial 176 pruned. 
2026-05-11 07:28:37,998 - optuna.study._optimize - INFO - Trial 177 pruned. 
2026-05-11 07:29:11,268 - optuna.study.study - INFO - Trial 178 finished with value: 0.07453125123477902 and parameters: {'n_layers': 1, 'embedding_dim': 256, 'lr': 0.0004383403320316836, 'lambda_val': 2.0034988584322158e-06, 'batch_size': 687, 'optimizer': 'RMSprop'}. Best is trial 62 with value: 0.14110520347341055.
2026-05-11 07:29:16,265 - optuna.study._optimize - INFO - Trial 179 pruned. 
2026-05-11 07:29:22,525 - optuna.study._optimize - INFO - Trial 180 pruned. 
2026-05-11 07:29:49,144 - optuna.study.study - INFO - Trial 181 finished with value: 0.11153978416953275 and parameters: {'n_layers': 1, 'embedding_dim': 64, 'lr': 0.00032698281560792416, 'lambda_val': 6.679260461803977e-06, 'batch_size': 613, 'optimizer': 'RMSprop'}. Best is trial 62 with value: 0.14110520347341055.
2026-05-11 07:30:16,808 - optuna.study.study - INFO - Trial 182 finished with value: 0.09478399714148131 and parameters: {'n_layers': 1, 'embedding_dim': 64, 'lr': 0.00039111011895312753, 'lambda_val': 8.496279445149715e-06, 'batch_size': 640, 'optimizer': 'RMSprop'}. Best is trial 62 with value: 0.14110520347341055.
2026-05-11 07:30:20,446 - optuna.study._optimize - INFO - Trial 183 pruned. 
2026-05-11 07:30:24,418 - optuna.study._optimize - INFO - Trial 184 pruned. 
2026-05-11 07:30:53,726 - optuna.study.study - INFO - Trial 185 finished with value: 0.08161343174801448 and parameters: {'n_layers': 1, 'embedding_dim': 128, 'lr': 0.0003269688780942852, 'lambda_val': 0.0004755326178363971, 'batch_size': 520, 'optimizer': 'RMSprop'}. Best is trial 62 with value: 0.14110520347341055.
2026-05-11 07:31:23,591 - optuna.study.study - INFO - Trial 186 finished with value: 0.13476542127706465 and parameters: {'n_layers': 1, 'embedding_dim': 64, 'lr': 0.0002546699580898574, 'lambda_val': 1.1915540366136907e-05, 'batch_size': 606, 'optimizer': 'RMSprop'}. Best is trial 62 with value: 0.14110520347341055.
2026-05-11 07:31:27,241 - optuna.study._optimize - INFO - Trial 187 pruned. 
2026-05-11 07:32:00,751 - optuna.study.study - INFO - Trial 188 finished with value: 0.10308207274849551 and parameters: {'n_layers': 1, 'embedding_dim': 256, 'lr': 0.0002470082008641896, 'lambda_val': 9.195242358081996e-06, 'batch_size': 677, 'optimizer': 'RMSprop'}. Best is trial 62 with value: 0.14110520347341055.
2026-05-11 07:32:04,330 - optuna.study._optimize - INFO - Trial 189 pruned. 
2026-05-11 07:32:08,323 - optuna.study._optimize - INFO - Trial 190 pruned. 
2026-05-11 07:32:36,204 - optuna.study.study - INFO - Trial 191 finished with value: 0.10041503311953205 and parameters: {'n_layers': 1, 'embedding_dim': 64, 'lr': 0.00028888227465415013, 'lambda_val': 1.0052541311334326e-06, 'batch_size': 760, 'optimizer': 'RMSprop'}. Best is trial 62 with value: 0.14110520347341055.
2026-05-11 07:33:07,429 - optuna.study.study - INFO - Trial 192 finished with value: 0.08577583684652003 and parameters: {'n_layers': 1, 'embedding_dim': 64, 'lr': 0.00036703013725460814, 'lambda_val': 6.650409421308676e-06, 'batch_size': 705, 'optimizer': 'RMSprop'}. Best is trial 62 with value: 0.14110520347341055.
2026-05-11 07:33:11,398 - optuna.study._optimize - INFO - Trial 193 pruned. 
2026-05-11 07:33:40,663 - optuna.study.study - INFO - Trial 194 finished with value: 0.07868847215835194 and parameters: {'n_layers': 1, 'embedding_dim': 64, 'lr': 0.00041747504005958303, 'lambda_val': 1.3056427461756036e-06, 'batch_size': 652, 'optimizer': 'RMSprop'}. Best is trial 62 with value: 0.14110520347341055.
2026-05-11 07:33:44,550 - optuna.study._optimize - INFO - Trial 195 pruned. 
2026-05-11 07:33:48,741 - optuna.study._optimize - INFO - Trial 196 pruned. 
2026-05-11 07:33:54,784 - optuna.study._optimize - INFO - Trial 197 pruned. 
2026-05-11 07:33:59,144 - optuna.study._optimize - INFO - Trial 198 pruned. 
2026-05-11 07:34:04,046 - optuna.study._optimize - INFO - Trial 199 pruned. 
2026-05-11 07:34:30,624 - root - INFO -   **** Training e_100K_1c2dcs_rand4
2026-05-11 07:34:30,634 - root - INFO -   **** Getting 54402/65410 random edges
2026-05-11 07:34:30,738 - optuna.storages._rdb.storage - INFO - A new study created in RDB with name: Study_e_100K_1c2dcs_rand4
2026-05-11 07:35:24,830 - optuna.study.study - INFO - Trial 0 finished with value: 0.0015977185063846 and parameters: {'n_layers': 1, 'embedding_dim': 256, 'lr': 0.0022013770527296674, 'lambda_val': 0.025799211622414744, 'batch_size': 2892, 'optimizer': 'SGD'}. Best is trial 0 with value: 0.0015977185063846.
