2026-05-11 12:42:34,475 - optuna.study.study - INFO - Trial 93 finished with value: 0.07205682335826835 and parameters: {'n_layers': 1, 'embedding_dim': 96, 'lr': 0.0003597736245119613, 'lambda_val': 7.1915787896480835e-06, 'batch_size': 990, 'optimizer': 'Adam'}. Best is trial 43 with value: 0.13667121035266763.
2026-05-11 12:43:04,952 - optuna.study.study - INFO - Trial 94 finished with value: 0.06110259050669294 and parameters: {'n_layers': 1, 'embedding_dim': 96, 'lr': 0.0005618557996930632, 'lambda_val': 4.504605022731409e-06, 'batch_size': 1055, 'optimizer': 'Adam'}. Best is trial 43 with value: 0.13667121035266763.
2026-05-11 12:43:41,998 - optuna.study.study - INFO - Trial 95 finished with value: 0.11752143909556455 and parameters: {'n_layers': 1, 'embedding_dim': 96, 'lr': 0.00022890999807846044, 'lambda_val': 1.2694820457978321e-05, 'batch_size': 855, 'optimizer': 'Adam'}. Best is trial 43 with value: 0.13667121035266763.
2026-05-11 12:44:10,623 - optuna.study.study - INFO - Trial 96 finished with value: 0.11932283336923907 and parameters: {'n_layers': 1, 'embedding_dim': 96, 'lr': 0.0002087501871813769, 'lambda_val': 1.4446128142307367e-05, 'batch_size': 879, 'optimizer': 'Adam'}. Best is trial 43 with value: 0.13667121035266763.
2026-05-11 12:44:41,259 - optuna.study.study - INFO - Trial 97 finished with value: 0.12892221062269527 and parameters: {'n_layers': 1, 'embedding_dim': 96, 'lr': 0.00021668392371614937, 'lambda_val': 1.321956152625548e-05, 'batch_size': 864, 'optimizer': 'Adam'}. Best is trial 43 with value: 0.13667121035266763.
2026-05-11 12:44:49,840 - optuna.study._optimize - INFO - Trial 98 pruned. 
2026-05-11 12:44:59,085 - optuna.study._optimize - INFO - Trial 99 pruned. 
2026-05-11 12:45:04,022 - optuna.study._optimize - INFO - Trial 100 pruned. 
2026-05-11 12:45:32,326 - optuna.study.study - INFO - Trial 101 finished with value: 0.12163481568487124 and parameters: {'n_layers': 1, 'embedding_dim': 96, 'lr': 0.0002335735066161853, 'lambda_val': 1.2669215079787364e-05, 'batch_size': 727, 'optimizer': 'Adam'}. Best is trial 43 with value: 0.13667121035266763.
2026-05-11 12:45:36,592 - optuna.study._optimize - INFO - Trial 102 pruned. 
2026-05-11 12:45:40,785 - optuna.study._optimize - INFO - Trial 103 pruned. 
2026-05-11 12:46:19,728 - optuna.study.study - INFO - Trial 104 finished with value: 0.09909374374268567 and parameters: {'n_layers': 1, 'embedding_dim': 96, 'lr': 0.00022601359165644227, 'lambda_val': 1.3414574112358987e-05, 'batch_size': 1167, 'optimizer': 'Adam'}. Best is trial 43 with value: 0.13667121035266763.
2026-05-11 12:46:48,287 - optuna.study.study - INFO - Trial 105 finished with value: 0.06192253977872945 and parameters: {'n_layers': 1, 'embedding_dim': 96, 'lr': 0.0004562427448415572, 'lambda_val': 6.731345802161027e-06, 'batch_size': 818, 'optimizer': 'Adam'}. Best is trial 43 with value: 0.13667121035266763.
2026-05-11 12:46:52,146 - optuna.study._optimize - INFO - Trial 106 pruned. 
2026-05-11 12:46:57,606 - optuna.study._optimize - INFO - Trial 107 pruned. 
2026-05-11 12:47:25,825 - optuna.study.study - INFO - Trial 108 finished with value: 0.07717157179100254 and parameters: {'n_layers': 1, 'embedding_dim': 96, 'lr': 0.00034373824635265703, 'lambda_val': 2.170812706231711e-05, 'batch_size': 931, 'optimizer': 'Adam'}. Best is trial 43 with value: 0.13667121035266763.
2026-05-11 12:47:29,983 - optuna.study._optimize - INFO - Trial 109 pruned. 
2026-05-11 12:47:59,808 - optuna.study.study - INFO - Trial 110 finished with value: 0.06114360359367526 and parameters: {'n_layers': 1, 'embedding_dim': 96, 'lr': 0.0007087804276694923, 'lambda_val': 9.760712226443065e-06, 'batch_size': 536, 'optimizer': 'Adam'}. Best is trial 43 with value: 0.13667121035266763.
2026-05-11 12:48:03,784 - optuna.study._optimize - INFO - Trial 111 pruned. 
2026-05-11 12:48:08,050 - optuna.study._optimize - INFO - Trial 112 pruned. 
2026-05-11 12:48:36,845 - optuna.study.study - INFO - Trial 113 finished with value: 0.11027278402600525 and parameters: {'n_layers': 1, 'embedding_dim': 96, 'lr': 0.0002605611296581549, 'lambda_val': 6.8712669486412824e-06, 'batch_size': 663, 'optimizer': 'Adam'}. Best is trial 43 with value: 0.13667121035266763.
2026-05-11 12:48:40,878 - optuna.study._optimize - INFO - Trial 114 pruned. 
2026-05-11 12:49:39,349 - optuna.study.study - INFO - Trial 115 finished with value: 0.08342924812419301 and parameters: {'n_layers': 1, 'embedding_dim': 96, 'lr': 0.0003041793428808343, 'lambda_val': 1.4789352501236158e-05, 'batch_size': 665, 'optimizer': 'Adam'}. Best is trial 43 with value: 0.13667121035266763.
2026-05-11 12:50:20,514 - optuna.study.study - INFO - Trial 116 finished with value: 0.07166969226809451 and parameters: {'n_layers': 1, 'embedding_dim': 96, 'lr': 0.0004279622538990986, 'lambda_val': 3.848759448400583e-06, 'batch_size': 903, 'optimizer': 'Adam'}. Best is trial 43 with value: 0.13667121035266763.
2026-05-11 12:50:49,344 - optuna.study.study - INFO - Trial 117 finished with value: 0.07983538512823322 and parameters: {'n_layers': 1, 'embedding_dim': 96, 'lr': 0.00034570549070989614, 'lambda_val': 6.909437237262999e-06, 'batch_size': 840, 'optimizer': 'Adam'}. Best is trial 43 with value: 0.13667121035266763.
2026-05-11 12:51:25,496 - optuna.study.study - INFO - Trial 118 finished with value: 0.12452053377573838 and parameters: {'n_layers': 1, 'embedding_dim': 256, 'lr': 0.00024029501990051867, 'lambda_val': 1.2497298688621548e-05, 'batch_size': 519, 'optimizer': 'Adam'}. Best is trial 43 with value: 0.13667121035266763.
2026-05-11 12:51:31,738 - optuna.study._optimize - INFO - Trial 119 pruned. 
2026-05-11 12:51:36,190 - optuna.study._optimize - INFO - Trial 120 pruned. 
2026-05-11 12:51:40,508 - optuna.study._optimize - INFO - Trial 121 pruned. 
2026-05-11 12:51:44,947 - optuna.study._optimize - INFO - Trial 122 pruned. 
2026-05-11 12:51:49,575 - optuna.study._optimize - INFO - Trial 123 pruned. 
2026-05-11 12:51:53,948 - optuna.study._optimize - INFO - Trial 124 pruned. 
2026-05-11 12:51:57,999 - optuna.study._optimize - INFO - Trial 125 pruned. 
2026-05-11 12:52:01,962 - optuna.study._optimize - INFO - Trial 126 pruned. 
2026-05-11 12:52:39,419 - optuna.study.study - INFO - Trial 127 finished with value: 0.07296260838867812 and parameters: {'n_layers': 1, 'embedding_dim': 256, 'lr': 0.00018834916696153196, 'lambda_val': 1.6140284747883236e-05, 'batch_size': 3746, 'optimizer': 'Adam'}. Best is trial 43 with value: 0.13667121035266763.
2026-05-11 12:53:09,653 - optuna.study.study - INFO - Trial 128 finished with value: 0.09445204821426176 and parameters: {'n_layers': 1, 'embedding_dim': 96, 'lr': 0.0003226360688192741, 'lambda_val': 2.5494848343113494e-05, 'batch_size': 599, 'optimizer': 'Adam'}. Best is trial 43 with value: 0.13667121035266763.
2026-05-11 12:53:13,674 - optuna.study._optimize - INFO - Trial 129 pruned. 
2026-05-11 12:53:18,525 - optuna.study._optimize - INFO - Trial 130 pruned. 
2026-05-11 12:53:22,640 - optuna.study._optimize - INFO - Trial 131 pruned. 
2026-05-11 12:53:53,381 - optuna.study.study - INFO - Trial 132 finished with value: 0.07978489336472407 and parameters: {'n_layers': 1, 'embedding_dim': 96, 'lr': 0.00038065247342233984, 'lambda_val': 0.00017205843944216278, 'batch_size': 782, 'optimizer': 'Adam'}. Best is trial 43 with value: 0.13667121035266763.
2026-05-11 12:53:57,609 - optuna.study._optimize - INFO - Trial 133 pruned. 
2026-05-11 12:54:25,968 - optuna.study.study - INFO - Trial 134 finished with value: 0.09682437956520949 and parameters: {'n_layers': 1, 'embedding_dim': 96, 'lr': 0.00026707361775444005, 'lambda_val': 5.753337336537006e-06, 'batch_size': 1014, 'optimizer': 'Adam'}. Best is trial 43 with value: 0.13667121035266763.
2026-05-11 12:54:55,367 - optuna.study.study - INFO - Trial 135 finished with value: 0.0860805666414013 and parameters: {'n_layers': 1, 'embedding_dim': 96, 'lr': 0.0003186413175453674, 'lambda_val': 1.3764342688357157e-05, 'batch_size': 910, 'optimizer': 'Adam'}. Best is trial 43 with value: 0.13667121035266763.
2026-05-11 12:54:59,642 - optuna.study._optimize - INFO - Trial 136 pruned. 
2026-05-11 12:55:28,714 - optuna.study.study - INFO - Trial 137 finished with value: 0.06374634380339964 and parameters: {'n_layers': 1, 'embedding_dim': 96, 'lr': 0.000528893752948693, 'lambda_val': 4.294715599469862e-06, 'batch_size': 728, 'optimizer': 'Adam'}. Best is trial 43 with value: 0.13667121035266763.
2026-05-11 12:55:32,598 - optuna.study._optimize - INFO - Trial 138 pruned. 
2026-05-11 12:55:36,739 - optuna.study._optimize - INFO - Trial 139 pruned. 
2026-05-11 12:55:40,934 - optuna.study._optimize - INFO - Trial 140 pruned. 
2026-05-11 12:55:46,899 - optuna.study._optimize - INFO - Trial 141 pruned. 
2026-05-11 12:55:52,256 - optuna.study._optimize - INFO - Trial 142 pruned. 
2026-05-11 12:55:56,175 - optuna.study._optimize - INFO - Trial 143 pruned. 
2026-05-11 12:56:25,968 - optuna.study.study - INFO - Trial 144 finished with value: 0.11594865810858744 and parameters: {'n_layers': 1, 'embedding_dim': 96, 'lr': 0.0002641232200427962, 'lambda_val': 5.349612102558846e-06, 'batch_size': 738, 'optimizer': 'Adam'}. Best is trial 43 with value: 0.13667121035266763.
2026-05-11 12:56:55,141 - optuna.study.study - INFO - Trial 145 finished with value: 0.07121250702911358 and parameters: {'n_layers': 1, 'embedding_dim': 96, 'lr': 0.0004015725946063024, 'lambda_val': 1.1768301632788535e-05, 'batch_size': 856, 'optimizer': 'Adam'}. Best is trial 43 with value: 0.13667121035266763.
2026-05-11 12:56:59,965 - optuna.study._optimize - INFO - Trial 146 pruned. 
2026-05-11 12:57:06,339 - optuna.study._optimize - INFO - Trial 147 pruned. 
2026-05-11 12:57:37,494 - optuna.study.study - INFO - Trial 148 finished with value: 0.06427502427845895 and parameters: {'n_layers': 1, 'embedding_dim': 96, 'lr': 0.00034791273256401577, 'lambda_val': 2.3879772905826933e-06, 'batch_size': 968, 'optimizer': 'Adam'}. Best is trial 43 with value: 0.13667121035266763.
2026-05-11 12:57:41,418 - optuna.study._optimize - INFO - Trial 149 pruned. 
2026-05-11 12:57:45,600 - optuna.study._optimize - INFO - Trial 150 pruned. 
2026-05-11 12:58:14,357 - optuna.study.study - INFO - Trial 151 finished with value: 0.11695353188191296 and parameters: {'n_layers': 1, 'embedding_dim': 96, 'lr': 0.0002803710067828483, 'lambda_val': 3.331995736331531e-06, 'batch_size': 653, 'optimizer': 'Adam'}. Best is trial 43 with value: 0.13667121035266763.
2026-05-11 12:58:42,786 - optuna.study.study - INFO - Trial 152 finished with value: 0.11273147059047108 and parameters: {'n_layers': 1, 'embedding_dim': 96, 'lr': 0.00027963929042716554, 'lambda_val': 9.893593571029849e-06, 'batch_size': 782, 'optimizer': 'Adam'}. Best is trial 43 with value: 0.13667121035266763.
2026-05-11 12:58:47,434 - optuna.study._optimize - INFO - Trial 153 pruned. 
2026-05-11 12:59:17,130 - optuna.study.study - INFO - Trial 154 finished with value: 0.08249303210166818 and parameters: {'n_layers': 1, 'embedding_dim': 96, 'lr': 0.0003058452575899443, 'lambda_val': 2.0612595579592273e-06, 'batch_size': 873, 'optimizer': 'Adam'}. Best is trial 43 with value: 0.13667121035266763.
2026-05-11 12:59:45,577 - optuna.study.study - INFO - Trial 155 finished with value: 0.06961835402830673 and parameters: {'n_layers': 1, 'embedding_dim': 96, 'lr': 0.00040377535116950243, 'lambda_val': 4.949995844566757e-06, 'batch_size': 818, 'optimizer': 'Adam'}. Best is trial 43 with value: 0.13667121035266763.
2026-05-11 13:00:14,312 - optuna.study.study - INFO - Trial 156 finished with value: 0.09824730495861213 and parameters: {'n_layers': 1, 'embedding_dim': 96, 'lr': 0.00028063670649456626, 'lambda_val': 9.726917851532833e-06, 'batch_size': 726, 'optimizer': 'Adam'}. Best is trial 43 with value: 0.13667121035266763.
2026-05-11 13:00:18,904 - optuna.study._optimize - INFO - Trial 157 pruned. 
2026-05-11 13:00:22,914 - optuna.study._optimize - INFO - Trial 158 pruned. 
2026-05-11 13:00:27,129 - optuna.study._optimize - INFO - Trial 159 pruned. 
2026-05-11 13:00:31,251 - optuna.study._optimize - INFO - Trial 160 pruned. 
2026-05-11 13:01:03,113 - optuna.study.study - INFO - Trial 161 finished with value: 0.11264271387568543 and parameters: {'n_layers': 1, 'embedding_dim': 96, 'lr': 0.00028288594861630066, 'lambda_val': 7.6921893680895e-06, 'batch_size': 762, 'optimizer': 'Adam'}. Best is trial 43 with value: 0.13667121035266763.
2026-05-11 13:01:07,673 - optuna.study._optimize - INFO - Trial 162 pruned. 
2026-05-11 13:01:36,999 - optuna.study.study - INFO - Trial 163 finished with value: 0.0793979624886201 and parameters: {'n_layers': 1, 'embedding_dim': 96, 'lr': 0.00035876304159176845, 'lambda_val': 4.422513231037149e-06, 'batch_size': 701, 'optimizer': 'Adam'}. Best is trial 43 with value: 0.13667121035266763.
2026-05-11 13:01:40,755 - optuna.study._optimize - INFO - Trial 164 pruned. 
2026-05-11 13:02:17,903 - optuna.study.study - INFO - Trial 165 finished with value: 0.10993101449280697 and parameters: {'n_layers': 1, 'embedding_dim': 96, 'lr': 0.00024742838604709403, 'lambda_val': 6.380723432102351e-06, 'batch_size': 868, 'optimizer': 'Adam'}. Best is trial 43 with value: 0.13667121035266763.
2026-05-11 13:02:52,584 - optuna.study.study - INFO - Trial 166 finished with value: 0.07112233815151627 and parameters: {'n_layers': 1, 'embedding_dim': 256, 'lr': 0.0004434291217622425, 'lambda_val': 1.4529439736015322e-05, 'batch_size': 794, 'optimizer': 'Adam'}. Best is trial 43 with value: 0.13667121035266763.
2026-05-11 13:02:56,904 - optuna.study._optimize - INFO - Trial 167 pruned. 
2026-05-11 13:03:31,779 - optuna.study.study - INFO - Trial 168 finished with value: 0.07402350394220888 and parameters: {'n_layers': 1, 'embedding_dim': 128, 'lr': 0.00031556695429142543, 'lambda_val': 5.413171433959024e-06, 'batch_size': 973, 'optimizer': 'Adam'}. Best is trial 43 with value: 0.13667121035266763.
2026-05-11 13:04:04,087 - optuna.study.study - INFO - Trial 169 finished with value: 0.053246021421066395 and parameters: {'n_layers': 1, 'embedding_dim': 96, 'lr': 0.0005737682892292452, 'lambda_val': 2.5410707326698778e-05, 'batch_size': 1326, 'optimizer': 'Adam'}. Best is trial 43 with value: 0.13667121035266763.
2026-05-11 13:04:07,937 - optuna.study._optimize - INFO - Trial 170 pruned. 
2026-05-11 13:04:12,243 - optuna.study._optimize - INFO - Trial 171 pruned. 
2026-05-11 13:04:16,251 - optuna.study._optimize - INFO - Trial 172 pruned. 
2026-05-11 13:04:47,265 - optuna.study.study - INFO - Trial 173 finished with value: 0.11331871648126131 and parameters: {'n_layers': 1, 'embedding_dim': 96, 'lr': 0.00027024438899800703, 'lambda_val': 6.130335047913666e-06, 'batch_size': 832, 'optimizer': 'Adam'}. Best is trial 43 with value: 0.13667121035266763.
2026-05-11 13:04:51,234 - optuna.study._optimize - INFO - Trial 174 pruned. 
2026-05-11 13:05:23,313 - optuna.study.study - INFO - Trial 175 finished with value: 0.0983439410388912 and parameters: {'n_layers': 1, 'embedding_dim': 96, 'lr': 0.00030794926559937237, 'lambda_val': 9.579695954651021e-06, 'batch_size': 812, 'optimizer': 'Adam'}. Best is trial 43 with value: 0.13667121035266763.
2026-05-11 13:05:27,201 - optuna.study._optimize - INFO - Trial 176 pruned. 
2026-05-11 13:05:31,109 - optuna.study._optimize - INFO - Trial 177 pruned. 
2026-05-11 13:05:34,996 - optuna.study._optimize - INFO - Trial 178 pruned. 
2026-05-11 13:06:07,498 - optuna.study.study - INFO - Trial 179 finished with value: 0.07239742258315428 and parameters: {'n_layers': 1, 'embedding_dim': 256, 'lr': 0.0003936967445345545, 'lambda_val': 6.0319457919284265e-06, 'batch_size': 1033, 'optimizer': 'Adam'}. Best is trial 43 with value: 0.13667121035266763.
2026-05-11 13:06:12,005 - optuna.study._optimize - INFO - Trial 180 pruned. 
2026-05-11 13:06:15,522 - optuna.study._optimize - INFO - Trial 181 pruned. 
2026-05-11 13:06:19,346 - optuna.study._optimize - INFO - Trial 182 pruned. 
2026-05-11 13:06:44,024 - optuna.study.study - INFO - Trial 183 finished with value: 0.09709855825806504 and parameters: {'n_layers': 1, 'embedding_dim': 96, 'lr': 0.000331251734651074, 'lambda_val': 5.024882125327527e-06, 'batch_size': 948, 'optimizer': 'Adam'}. Best is trial 43 with value: 0.13667121035266763.
2026-05-11 13:06:47,819 - optuna.study._optimize - INFO - Trial 184 pruned. 
2026-05-11 13:06:51,166 - optuna.study._optimize - INFO - Trial 185 pruned. 
2026-05-11 13:06:54,519 - optuna.study._optimize - INFO - Trial 186 pruned. 
2026-05-11 13:06:58,091 - optuna.study._optimize - INFO - Trial 187 pruned. 
2026-05-11 13:07:26,990 - optuna.study.study - INFO - Trial 188 finished with value: 0.07620560501910115 and parameters: {'n_layers': 1, 'embedding_dim': 96, 'lr': 0.00035717553054800066, 'lambda_val': 0.0011174378516942253, 'batch_size': 767, 'optimizer': 'Adam'}. Best is trial 43 with value: 0.13667121035266763.
2026-05-11 13:07:31,128 - optuna.study._optimize - INFO - Trial 189 pruned. 
2026-05-11 13:07:35,489 - optuna.study._optimize - INFO - Trial 190 pruned. 
2026-05-11 13:07:39,265 - optuna.study._optimize - INFO - Trial 191 pruned. 
2026-05-11 13:08:10,614 - optuna.study.study - INFO - Trial 192 finished with value: 0.10854064235835521 and parameters: {'n_layers': 1, 'embedding_dim': 96, 'lr': 0.0002749685861865743, 'lambda_val': 5.633178157639678e-06, 'batch_size': 717, 'optimizer': 'Adam'}. Best is trial 43 with value: 0.13667121035266763.
2026-05-11 13:08:14,354 - optuna.study._optimize - INFO - Trial 193 pruned. 
2026-05-11 13:08:18,086 - optuna.study._optimize - INFO - Trial 194 pruned. 
2026-05-11 13:08:46,262 - optuna.study.study - INFO - Trial 195 finished with value: 0.10295265466828364 and parameters: {'n_layers': 1, 'embedding_dim': 96, 'lr': 0.00031197320926093747, 'lambda_val': 1.1875718636482101e-05, 'batch_size': 676, 'optimizer': 'Adam'}. Best is trial 43 with value: 0.13667121035266763.
2026-05-11 13:08:50,039 - optuna.study._optimize - INFO - Trial 196 pruned. 
2026-05-11 13:08:54,835 - optuna.study._optimize - INFO - Trial 197 pruned. 
2026-05-11 13:08:58,555 - optuna.study._optimize - INFO - Trial 198 pruned. 
2026-05-11 13:09:02,563 - optuna.study._optimize - INFO - Trial 199 pruned. 
2026-05-11 13:09:23,513 - root - INFO -   **** Training e_100K_1c3dcs_rand3
2026-05-11 13:09:23,525 - root - INFO -   **** Getting 56335/65410 random edges
2026-05-11 13:09:23,638 - optuna.storages._rdb.storage - INFO - A new study created in RDB with name: Study_e_100K_1c3dcs_rand3
2026-05-11 13:10:02,556 - optuna.study.study - INFO - Trial 0 finished with value: 0.03221496624768397 and parameters: {'n_layers': 3, 'embedding_dim': 128, 'lr': 0.008954969231771933, 'lambda_val': 2.0455873782062462e-05, 'batch_size': 1168, 'optimizer': 'RMSprop'}. Best is trial 0 with value: 0.03221496624768397.
2026-05-11 13:10:44,441 - optuna.study.study - INFO - Trial 1 finished with value: 0.018071344533697326 and parameters: {'n_layers': 2, 'embedding_dim': 128, 'lr': 1.541706869433049e-05, 'lambda_val': 1.0532002989340358e-05, 'batch_size': 3448, 'optimizer': 'RMSprop'}. Best is trial 0 with value: 0.03221496624768397.
2026-05-11 13:11:13,582 - optuna.study.study - INFO - Trial 2 finished with value: 0.04121221921555293 and parameters: {'n_layers': 2, 'embedding_dim': 64, 'lr': 0.004106257543984868, 'lambda_val': 0.0011041509067639462, 'batch_size': 1163, 'optimizer': 'Adam'}. Best is trial 2 with value: 0.04121221921555293.
2026-05-11 13:12:05,854 - optuna.study.study - INFO - Trial 3 finished with value: 0.016359401593893326 and parameters: {'n_layers': 1, 'embedding_dim': 256, 'lr': 2.1085600830908584e-05, 'lambda_val': 6.535578775365706e-06, 'batch_size': 1803, 'optimizer': 'RMSprop'}. Best is trial 2 with value: 0.04121221921555293.
2026-05-11 13:12:53,879 - optuna.study.study - INFO - Trial 4 finished with value: 0.001127669291640508 and parameters: {'n_layers': 4, 'embedding_dim': 32, 'lr': 0.0035996423322787385, 'lambda_val': 6.209580284466283e-05, 'batch_size': 1963, 'optimizer': 'SGD'}. Best is trial 2 with value: 0.04121221921555293.
2026-05-11 13:13:35,953 - optuna.study.study - INFO - Trial 5 finished with value: 0.04460089216803566 and parameters: {'n_layers': 4, 'embedding_dim': 96, 'lr': 5.8515420835304834e-05, 'lambda_val': 0.00019172777271808243, 'batch_size': 2085, 'optimizer': 'Adam'}. Best is trial 5 with value: 0.04460089216803566.
2026-05-11 13:14:12,551 - optuna.study.study - INFO - Trial 6 finished with value: 0.028709731515582135 and parameters: {'n_layers': 1, 'embedding_dim': 256, 'lr': 0.00010729022235213303, 'lambda_val': 0.03165751365517567, 'batch_size': 2670, 'optimizer': 'Adam'}. Best is trial 5 with value: 0.04460089216803566.
2026-05-11 13:14:44,073 - optuna.study.study - INFO - Trial 7 finished with value: 0.017340764759644384 and parameters: {'n_layers': 3, 'embedding_dim': 64, 'lr': 0.0007595502338905608, 'lambda_val': 0.021730273968370968, 'batch_size': 1003, 'optimizer': 'Adam'}. Best is trial 5 with value: 0.04460089216803566.
2026-05-11 13:14:49,789 - optuna.study._optimize - INFO - Trial 8 pruned. 
2026-05-11 13:14:53,409 - optuna.study._optimize - INFO - Trial 9 pruned. 
2026-05-11 13:15:33,656 - optuna.study.study - INFO - Trial 10 finished with value: 0.010049229814979726 and parameters: {'n_layers': 4, 'embedding_dim': 96, 'lr': 0.0002640244217462765, 'lambda_val': 0.0047398113588315895, 'batch_size': 541, 'optimizer': 'Adam'}. Best is trial 5 with value: 0.04460089216803566.
2026-05-11 13:16:04,812 - optuna.study.study - INFO - Trial 11 finished with value: 0.032272834835769364 and parameters: {'n_layers': 2, 'embedding_dim': 64, 'lr': 0.001802031916166368, 'lambda_val': 0.0013410739081086672, 'batch_size': 1611, 'optimizer': 'Adam'}. Best is trial 5 with value: 0.04460089216803566.
2026-05-11 13:16:09,543 - optuna.study._optimize - INFO - Trial 12 pruned. 
