2026-05-11 08:53:30,704 - optuna.study.study - INFO - Trial 12 finished with value: 0.05636595910046185 and parameters: {'n_layers': 1, 'embedding_dim': 96, 'lr': 0.000600472349932928, 'lambda_val': 9.952886717764542e-05, 'batch_size': 1372, 'optimizer': 'Adam'}. Best is trial 12 with value: 0.05636595910046185.
2026-05-11 08:54:01,606 - optuna.study.study - INFO - Trial 13 finished with value: 0.08439149374117501 and parameters: {'n_layers': 1, 'embedding_dim': 96, 'lr': 0.00031485013454429073, 'lambda_val': 0.00028828918602863776, 'batch_size': 874, 'optimizer': 'Adam'}. Best is trial 13 with value: 0.08439149374117501.
2026-05-11 08:54:32,251 - optuna.study.study - INFO - Trial 14 finished with value: 0.019061353809870944 and parameters: {'n_layers': 2, 'embedding_dim': 32, 'lr': 0.0002961154020938806, 'lambda_val': 0.00282962092498354, 'batch_size': 655, 'optimizer': 'Adam'}. Best is trial 13 with value: 0.08439149374117501.
2026-05-11 08:55:07,592 - optuna.study.study - INFO - Trial 15 finished with value: 0.12860431361188532 and parameters: {'n_layers': 1, 'embedding_dim': 256, 'lr': 0.0001395164616753439, 'lambda_val': 0.00032185027493348965, 'batch_size': 1087, 'optimizer': 'Adam'}. Best is trial 15 with value: 0.12860431361188532.
2026-05-11 08:55:13,179 - optuna.study._optimize - INFO - Trial 16 pruned. 
2026-05-11 08:55:17,519 - optuna.study._optimize - INFO - Trial 17 pruned. 
2026-05-11 08:55:21,705 - optuna.study._optimize - INFO - Trial 18 pruned. 
2026-05-11 08:55:26,089 - optuna.study._optimize - INFO - Trial 19 pruned. 
2026-05-11 08:55:31,412 - optuna.study._optimize - INFO - Trial 20 pruned. 
2026-05-11 08:56:00,764 - optuna.study.study - INFO - Trial 21 finished with value: 0.06335469906304254 and parameters: {'n_layers': 1, 'embedding_dim': 96, 'lr': 0.00044451924110333103, 'lambda_val': 0.0001463865150077835, 'batch_size': 1269, 'optimizer': 'Adam'}. Best is trial 15 with value: 0.12860431361188532.
2026-05-11 08:56:29,779 - optuna.study.study - INFO - Trial 22 finished with value: 0.06055133670141288 and parameters: {'n_layers': 1, 'embedding_dim': 96, 'lr': 0.000436184080953101, 'lambda_val': 0.0010149006416538097, 'batch_size': 1204, 'optimizer': 'Adam'}. Best is trial 15 with value: 0.12860431361188532.
2026-05-11 08:56:33,732 - optuna.study._optimize - INFO - Trial 23 pruned. 
2026-05-11 08:57:05,122 - optuna.study.study - INFO - Trial 24 finished with value: 0.03078459674364697 and parameters: {'n_layers': 2, 'embedding_dim': 64, 'lr': 0.0009525946685467026, 'lambda_val': 0.0001894371124795132, 'batch_size': 527, 'optimizer': 'Adam'}. Best is trial 15 with value: 0.12860431361188532.
2026-05-11 08:57:32,658 - optuna.study.study - INFO - Trial 25 finished with value: 0.08111661187415346 and parameters: {'n_layers': 1, 'embedding_dim': 32, 'lr': 0.00031747390464997106, 'lambda_val': 1.417969576576462e-05, 'batch_size': 1327, 'optimizer': 'Adam'}. Best is trial 15 with value: 0.12860431361188532.
2026-05-11 08:57:37,110 - optuna.study._optimize - INFO - Trial 26 pruned. 
2026-05-11 08:58:07,395 - optuna.study.study - INFO - Trial 27 finished with value: 0.061433736407006445 and parameters: {'n_layers': 2, 'embedding_dim': 32, 'lr': 0.0002033554397874042, 'lambda_val': 2.91851711512417e-05, 'batch_size': 845, 'optimizer': 'Adam'}. Best is trial 15 with value: 0.12860431361188532.
2026-05-11 08:58:11,191 - optuna.study._optimize - INFO - Trial 28 pruned. 
2026-05-11 08:58:17,891 - optuna.study._optimize - INFO - Trial 29 pruned. 
2026-05-11 08:58:21,933 - optuna.study._optimize - INFO - Trial 30 pruned. 
2026-05-11 08:58:50,975 - optuna.study.study - INFO - Trial 31 finished with value: 0.0649464064171136 and parameters: {'n_layers': 1, 'embedding_dim': 96, 'lr': 0.0003628592551869336, 'lambda_val': 0.00015856142648496818, 'batch_size': 1243, 'optimizer': 'Adam'}. Best is trial 15 with value: 0.12860431361188532.
2026-05-11 08:59:45,521 - optuna.study.study - INFO - Trial 32 finished with value: 0.0856330534089622 and parameters: {'n_layers': 1, 'embedding_dim': 256, 'lr': 0.00026270989267484075, 'lambda_val': 3.2227503062738495e-05, 'batch_size': 1190, 'optimizer': 'Adam'}. Best is trial 15 with value: 0.12860431361188532.
2026-05-11 09:00:26,812 - optuna.study.study - INFO - Trial 33 finished with value: 0.09226798322511948 and parameters: {'n_layers': 1, 'embedding_dim': 256, 'lr': 0.0002303078626815399, 'lambda_val': 2.257184908483155e-05, 'batch_size': 872, 'optimizer': 'Adam'}. Best is trial 15 with value: 0.12860431361188532.
2026-05-11 09:00:36,550 - optuna.study._optimize - INFO - Trial 34 pruned. 
2026-05-11 09:01:13,985 - optuna.study.study - INFO - Trial 35 finished with value: 0.06623668497879202 and parameters: {'n_layers': 1, 'embedding_dim': 256, 'lr': 0.0008162845783758116, 'lambda_val': 0.0021563259204227434, 'batch_size': 977, 'optimizer': 'Adam'}. Best is trial 15 with value: 0.12860431361188532.
2026-05-11 09:01:18,926 - optuna.study._optimize - INFO - Trial 36 pruned. 
2026-05-11 09:01:48,405 - optuna.study.study - INFO - Trial 37 finished with value: 0.05243061842555487 and parameters: {'n_layers': 1, 'embedding_dim': 128, 'lr': 0.002024561199662141, 'lambda_val': 5.732972969032005e-05, 'batch_size': 818, 'optimizer': 'Adam'}. Best is trial 15 with value: 0.12860431361188532.
2026-05-11 09:01:56,482 - optuna.study._optimize - INFO - Trial 38 pruned. 
2026-05-11 09:02:36,596 - optuna.study.study - INFO - Trial 39 finished with value: 0.0934295430486697 and parameters: {'n_layers': 1, 'embedding_dim': 256, 'lr': 0.00023919846973464843, 'lambda_val': 0.0006424869885701828, 'batch_size': 1146, 'optimizer': 'Adam'}. Best is trial 15 with value: 0.12860431361188532.
2026-05-11 09:02:40,979 - optuna.study._optimize - INFO - Trial 40 pruned. 
2026-05-11 09:03:15,821 - optuna.study.study - INFO - Trial 41 finished with value: 0.0870481489849474 and parameters: {'n_layers': 1, 'embedding_dim': 256, 'lr': 0.00024481917105940206, 'lambda_val': 0.0006876389074089023, 'batch_size': 918, 'optimizer': 'Adam'}. Best is trial 15 with value: 0.12860431361188532.
2026-05-11 09:03:54,720 - optuna.study.study - INFO - Trial 42 finished with value: 0.07894507748892375 and parameters: {'n_layers': 1, 'embedding_dim': 256, 'lr': 0.00020888056970264318, 'lambda_val': 0.0008512561293404563, 'batch_size': 1480, 'optimizer': 'Adam'}. Best is trial 15 with value: 0.12860431361188532.
2026-05-11 09:04:33,552 - optuna.study.study - INFO - Trial 43 finished with value: 0.0654218157717265 and parameters: {'n_layers': 1, 'embedding_dim': 256, 'lr': 0.0006099546829165499, 'lambda_val': 0.0005630806511906219, 'batch_size': 660, 'optimizer': 'Adam'}. Best is trial 15 with value: 0.12860431361188532.
2026-05-11 09:04:37,920 - optuna.study._optimize - INFO - Trial 44 pruned. 
2026-05-11 09:04:42,185 - optuna.study._optimize - INFO - Trial 45 pruned. 
2026-05-11 09:05:26,013 - optuna.study.study - INFO - Trial 46 finished with value: 0.06776265021451623 and parameters: {'n_layers': 1, 'embedding_dim': 128, 'lr': 0.0002546806243978304, 'lambda_val': 0.0005540912563622178, 'batch_size': 2602, 'optimizer': 'Adam'}. Best is trial 15 with value: 0.12860431361188532.
2026-05-11 09:05:32,722 - optuna.study._optimize - INFO - Trial 47 pruned. 
2026-05-11 09:05:37,621 - optuna.study._optimize - INFO - Trial 48 pruned. 
2026-05-11 09:05:43,871 - optuna.study._optimize - INFO - Trial 49 pruned. 
2026-05-11 09:05:47,864 - optuna.study._optimize - INFO - Trial 50 pruned. 
2026-05-11 09:06:22,888 - optuna.study.study - INFO - Trial 51 finished with value: 0.08221868623841286 and parameters: {'n_layers': 1, 'embedding_dim': 256, 'lr': 0.00027984609286290843, 'lambda_val': 0.000322165861720886, 'batch_size': 892, 'optimizer': 'Adam'}. Best is trial 15 with value: 0.12860431361188532.
2026-05-11 09:06:57,237 - optuna.study.study - INFO - Trial 52 finished with value: 0.07084247458104703 and parameters: {'n_layers': 1, 'embedding_dim': 256, 'lr': 0.0004299141485533836, 'lambda_val': 0.00012649965940722408, 'batch_size': 1161, 'optimizer': 'Adam'}. Best is trial 15 with value: 0.12860431361188532.
2026-05-11 09:07:01,670 - optuna.study._optimize - INFO - Trial 53 pruned. 
2026-05-11 09:07:06,348 - optuna.study._optimize - INFO - Trial 54 pruned. 
2026-05-11 09:07:13,257 - optuna.study._optimize - INFO - Trial 55 pruned. 
2026-05-11 09:07:41,338 - optuna.study.study - INFO - Trial 56 finished with value: 0.055193359315198774 and parameters: {'n_layers': 1, 'embedding_dim': 96, 'lr': 0.0005537258995093278, 'lambda_val': 3.937964640496847e-05, 'batch_size': 1115, 'optimizer': 'Adam'}. Best is trial 15 with value: 0.12860431361188532.
2026-05-11 09:07:45,146 - optuna.study._optimize - INFO - Trial 57 pruned. 
2026-05-11 09:07:50,306 - optuna.study._optimize - INFO - Trial 58 pruned. 
2026-05-11 09:08:34,619 - optuna.study.study - INFO - Trial 59 finished with value: 0.055046728349392636 and parameters: {'n_layers': 1, 'embedding_dim': 96, 'lr': 0.00032285670138484734, 'lambda_val': 0.0012389862906331808, 'batch_size': 3403, 'optimizer': 'Adam'}. Best is trial 15 with value: 0.12860431361188532.
2026-05-11 09:08:39,300 - optuna.study._optimize - INFO - Trial 60 pruned. 
2026-05-11 09:09:13,885 - optuna.study.study - INFO - Trial 61 finished with value: 0.08111865070689843 and parameters: {'n_layers': 1, 'embedding_dim': 256, 'lr': 0.00024404795234291804, 'lambda_val': 0.000329331966988136, 'batch_size': 946, 'optimizer': 'Adam'}. Best is trial 15 with value: 0.12860431361188532.
2026-05-11 09:09:18,313 - optuna.study._optimize - INFO - Trial 62 pruned. 
2026-05-11 09:09:59,825 - optuna.study.study - INFO - Trial 63 finished with value: 0.05861285649177472 and parameters: {'n_layers': 1, 'embedding_dim': 256, 'lr': 0.00043271728367744134, 'lambda_val': 0.0007367131751967989, 'batch_size': 919, 'optimizer': 'Adam'}. Best is trial 15 with value: 0.12860431361188532.
2026-05-11 09:10:34,478 - optuna.study.study - INFO - Trial 64 finished with value: 0.07727061088590863 and parameters: {'n_layers': 1, 'embedding_dim': 256, 'lr': 0.00032278694192318315, 'lambda_val': 9.001999522518068e-06, 'batch_size': 1247, 'optimizer': 'Adam'}. Best is trial 15 with value: 0.12860431361188532.
2026-05-11 09:11:03,461 - optuna.study.study - INFO - Trial 65 finished with value: 0.044427840222227996 and parameters: {'n_layers': 1, 'embedding_dim': 96, 'lr': 0.0007064629647457147, 'lambda_val': 0.00026406735063479403, 'batch_size': 741, 'optimizer': 'Adam'}. Best is trial 15 with value: 0.12860431361188532.
2026-05-11 09:11:07,792 - optuna.study._optimize - INFO - Trial 66 pruned. 
2026-05-11 09:11:12,798 - optuna.study._optimize - INFO - Trial 67 pruned. 
2026-05-11 09:11:17,533 - optuna.study._optimize - INFO - Trial 68 pruned. 
2026-05-11 09:11:22,234 - optuna.study._optimize - INFO - Trial 69 pruned. 
2026-05-11 09:12:04,572 - optuna.study.study - INFO - Trial 70 finished with value: 0.06995278033972852 and parameters: {'n_layers': 1, 'embedding_dim': 256, 'lr': 0.0008821687832908302, 'lambda_val': 0.0004246251439156274, 'batch_size': 887, 'optimizer': 'Adam'}. Best is trial 15 with value: 0.12860431361188532.
2026-05-11 09:12:39,124 - optuna.study.study - INFO - Trial 71 finished with value: 0.08226737704546502 and parameters: {'n_layers': 1, 'embedding_dim': 256, 'lr': 0.00025383802438325506, 'lambda_val': 0.00030533946629014263, 'batch_size': 997, 'optimizer': 'Adam'}. Best is trial 15 with value: 0.12860431361188532.
2026-05-11 09:13:13,291 - optuna.study.study - INFO - Trial 72 finished with value: 0.08180227293740729 and parameters: {'n_layers': 1, 'embedding_dim': 256, 'lr': 0.00027597520768435666, 'lambda_val': 1.1467117765398962e-06, 'batch_size': 1238, 'optimizer': 'Adam'}. Best is trial 15 with value: 0.12860431361188532.
2026-05-11 09:13:17,776 - optuna.study._optimize - INFO - Trial 73 pruned. 
2026-05-11 09:13:52,613 - optuna.study.study - INFO - Trial 74 finished with value: 0.06488637185464687 and parameters: {'n_layers': 1, 'embedding_dim': 256, 'lr': 0.0003739229494417027, 'lambda_val': 0.0016310184035375228, 'batch_size': 784, 'optimizer': 'Adam'}. Best is trial 15 with value: 0.12860431361188532.
2026-05-11 09:13:57,141 - optuna.study._optimize - INFO - Trial 75 pruned. 
2026-05-11 09:14:01,467 - optuna.study._optimize - INFO - Trial 76 pruned. 
2026-05-11 09:14:05,388 - optuna.study._optimize - INFO - Trial 77 pruned. 
2026-05-11 09:14:09,790 - optuna.study._optimize - INFO - Trial 78 pruned. 
2026-05-11 09:14:49,379 - optuna.study.study - INFO - Trial 79 finished with value: 0.06875358781678131 and parameters: {'n_layers': 1, 'embedding_dim': 256, 'lr': 0.0005302111101839889, 'lambda_val': 0.00014426736986359958, 'batch_size': 1135, 'optimizer': 'RMSprop'}. Best is trial 15 with value: 0.12860431361188532.
2026-05-11 09:14:55,631 - optuna.study._optimize - INFO - Trial 80 pruned. 
2026-05-11 09:15:30,283 - optuna.study.study - INFO - Trial 81 finished with value: 0.07922126087849894 and parameters: {'n_layers': 1, 'embedding_dim': 256, 'lr': 0.00028852272747500844, 'lambda_val': 1.128883009698808e-06, 'batch_size': 1019, 'optimizer': 'Adam'}. Best is trial 15 with value: 0.12860431361188532.
2026-05-11 09:16:04,795 - optuna.study.study - INFO - Trial 82 finished with value: 0.0840170430150244 and parameters: {'n_layers': 1, 'embedding_dim': 256, 'lr': 0.00024567003620247794, 'lambda_val': 2.5443724058020617e-06, 'batch_size': 1227, 'optimizer': 'Adam'}. Best is trial 15 with value: 0.12860431361188532.
2026-05-11 09:16:09,112 - optuna.study._optimize - INFO - Trial 83 pruned. 
2026-05-11 09:16:13,492 - optuna.study._optimize - INFO - Trial 84 pruned. 
2026-05-11 09:16:17,993 - optuna.study._optimize - INFO - Trial 85 pruned. 
2026-05-11 09:16:53,005 - optuna.study.study - INFO - Trial 86 finished with value: 0.07633335553260774 and parameters: {'n_layers': 1, 'embedding_dim': 256, 'lr': 0.000375040369628732, 'lambda_val': 0.00024529136552630456, 'batch_size': 1121, 'optimizer': 'Adam'}. Best is trial 15 with value: 0.12860431361188532.
2026-05-11 09:16:56,693 - optuna.study._optimize - INFO - Trial 87 pruned. 
2026-05-11 09:17:02,008 - optuna.study._optimize - INFO - Trial 88 pruned. 
2026-05-11 09:17:07,066 - optuna.study._optimize - INFO - Trial 89 pruned. 
2026-05-11 09:17:11,286 - optuna.study._optimize - INFO - Trial 90 pruned. 
2026-05-11 09:17:46,033 - optuna.study.study - INFO - Trial 91 finished with value: 0.07488543634669691 and parameters: {'n_layers': 1, 'embedding_dim': 256, 'lr': 0.00028102788168278, 'lambda_val': 1.065043212161559e-06, 'batch_size': 1235, 'optimizer': 'Adam'}. Best is trial 15 with value: 0.12860431361188532.
2026-05-11 09:18:28,327 - optuna.study.study - INFO - Trial 92 finished with value: 0.07612944671027931 and parameters: {'n_layers': 1, 'embedding_dim': 256, 'lr': 0.0003484686729447802, 'lambda_val': 1.3548929794584235e-06, 'batch_size': 1330, 'optimizer': 'Adam'}. Best is trial 15 with value: 0.12860431361188532.
2026-05-11 09:19:02,697 - optuna.study.study - INFO - Trial 93 finished with value: 0.08631078843460457 and parameters: {'n_layers': 1, 'embedding_dim': 256, 'lr': 0.0002478243136208741, 'lambda_val': 2.399729947965598e-06, 'batch_size': 1104, 'optimizer': 'Adam'}. Best is trial 15 with value: 0.12860431361188532.
2026-05-11 09:19:07,052 - optuna.study._optimize - INFO - Trial 94 pruned. 
2026-05-11 09:19:11,842 - optuna.study._optimize - INFO - Trial 95 pruned. 
2026-05-11 09:19:47,063 - optuna.study.study - INFO - Trial 96 finished with value: 0.07189061627358924 and parameters: {'n_layers': 1, 'embedding_dim': 256, 'lr': 0.000647994682629309, 'lambda_val': 0.000925945590360767, 'batch_size': 968, 'optimizer': 'Adam'}. Best is trial 15 with value: 0.12860431361188532.
2026-05-11 09:19:51,046 - optuna.study._optimize - INFO - Trial 97 pruned. 
2026-05-11 09:20:27,623 - optuna.study.study - INFO - Trial 98 finished with value: 0.07285952435832954 and parameters: {'n_layers': 1, 'embedding_dim': 256, 'lr': 0.0001795753717554021, 'lambda_val': 4.086601392128562e-06, 'batch_size': 4071, 'optimizer': 'RMSprop'}. Best is trial 15 with value: 0.12860431361188532.
2026-05-11 09:20:31,962 - optuna.study._optimize - INFO - Trial 99 pruned. 
2026-05-11 09:20:37,069 - optuna.study._optimize - INFO - Trial 100 pruned. 
2026-05-11 09:21:11,196 - optuna.study.study - INFO - Trial 101 finished with value: 0.07940060631578852 and parameters: {'n_layers': 1, 'embedding_dim': 256, 'lr': 0.000290729574829021, 'lambda_val': 1.9887930811037947e-06, 'batch_size': 1222, 'optimizer': 'Adam'}. Best is trial 15 with value: 0.12860431361188532.
2026-05-11 09:21:45,822 - optuna.study.study - INFO - Trial 102 finished with value: 0.0746421950502321 and parameters: {'n_layers': 1, 'embedding_dim': 256, 'lr': 0.0004038734373884598, 'lambda_val': 1.526395035372403e-06, 'batch_size': 1542, 'optimizer': 'Adam'}. Best is trial 15 with value: 0.12860431361188532.
2026-05-11 09:21:50,195 - optuna.study._optimize - INFO - Trial 103 pruned. 
2026-05-11 09:22:24,846 - optuna.study.study - INFO - Trial 104 finished with value: 0.0792911992255409 and parameters: {'n_layers': 1, 'embedding_dim': 256, 'lr': 0.00031294012069721334, 'lambda_val': 0.00011505380526297818, 'batch_size': 1079, 'optimizer': 'Adam'}. Best is trial 15 with value: 0.12860431361188532.
2026-05-11 09:22:59,161 - optuna.study.study - INFO - Trial 105 finished with value: 0.07388956279026564 and parameters: {'n_layers': 1, 'embedding_dim': 256, 'lr': 0.0005111210787426921, 'lambda_val': 2.1595828951443682e-06, 'batch_size': 1285, 'optimizer': 'Adam'}. Best is trial 15 with value: 0.12860431361188532.
2026-05-11 09:23:03,399 - optuna.study._optimize - INFO - Trial 106 pruned. 
2026-05-11 09:23:09,184 - optuna.study._optimize - INFO - Trial 107 pruned. 
2026-05-11 09:23:13,640 - optuna.study._optimize - INFO - Trial 108 pruned. 
2026-05-11 09:23:18,588 - optuna.study._optimize - INFO - Trial 109 pruned. 
2026-05-11 09:23:22,939 - optuna.study._optimize - INFO - Trial 110 pruned. 
2026-05-11 09:23:27,625 - optuna.study._optimize - INFO - Trial 111 pruned. 
2026-05-11 09:23:32,582 - optuna.study._optimize - INFO - Trial 112 pruned. 
2026-05-11 09:24:11,484 - optuna.study.study - INFO - Trial 113 finished with value: 0.08239560207960483 and parameters: {'n_layers': 1, 'embedding_dim': 256, 'lr': 0.0003397010390374849, 'lambda_val': 0.0006451282609482195, 'batch_size': 708, 'optimizer': 'Adam'}. Best is trial 15 with value: 0.12860431361188532.
2026-05-11 09:24:49,856 - optuna.study.study - INFO - Trial 114 finished with value: 0.08461112691933544 and parameters: {'n_layers': 1, 'embedding_dim': 256, 'lr': 0.0003344584986293665, 'lambda_val': 0.0006313674334297494, 'batch_size': 720, 'optimizer': 'Adam'}. Best is trial 15 with value: 0.12860431361188532.
2026-05-11 09:25:24,903 - optuna.study.study - INFO - Trial 115 finished with value: 0.08114349870733316 and parameters: {'n_layers': 1, 'embedding_dim': 256, 'lr': 0.0003664576397076549, 'lambda_val': 0.0006932816882238438, 'batch_size': 706, 'optimizer': 'Adam'}. Best is trial 15 with value: 0.12860431361188532.
2026-05-11 09:25:52,401 - optuna.study.study - INFO - Trial 116 finished with value: 0.07085611542778626 and parameters: {'n_layers': 1, 'embedding_dim': 64, 'lr': 0.0004820559527595363, 'lambda_val': 0.0010307357185726914, 'batch_size': 525, 'optimizer': 'Adam'}. Best is trial 15 with value: 0.12860431361188532.
2026-05-11 09:26:26,712 - optuna.study.study - INFO - Trial 117 finished with value: 0.07884919781627736 and parameters: {'n_layers': 1, 'embedding_dim': 256, 'lr': 0.00032834114896306715, 'lambda_val': 0.0006569534757472102, 'batch_size': 647, 'optimizer': 'Adam'}. Best is trial 15 with value: 0.12860431361188532.
2026-05-11 09:26:30,619 - optuna.study._optimize - INFO - Trial 118 pruned. 
2026-05-11 09:26:35,235 - optuna.study._optimize - INFO - Trial 119 pruned. 
2026-05-11 09:26:39,437 - optuna.study._optimize - INFO - Trial 120 pruned. 
2026-05-11 09:27:13,412 - optuna.study.study - INFO - Trial 121 finished with value: 0.08108676586079927 and parameters: {'n_layers': 1, 'embedding_dim': 256, 'lr': 0.0002890017660030291, 'lambda_val': 0.0002469639905997797, 'batch_size': 860, 'optimizer': 'Adam'}. Best is trial 15 with value: 0.12860431361188532.
2026-05-11 09:27:18,281 - optuna.study._optimize - INFO - Trial 122 pruned. 
2026-05-11 09:27:59,937 - optuna.study.study - INFO - Trial 123 finished with value: 0.06950049799627092 and parameters: {'n_layers': 1, 'embedding_dim': 256, 'lr': 0.0006258920608870609, 'lambda_val': 0.00016846508720673667, 'batch_size': 1173, 'optimizer': 'Adam'}. Best is trial 15 with value: 0.12860431361188532.
2026-05-11 09:28:04,308 - optuna.study._optimize - INFO - Trial 124 pruned. 
2026-05-11 09:28:39,166 - optuna.study.study - INFO - Trial 125 finished with value: 0.08223033888667533 and parameters: {'n_layers': 1, 'embedding_dim': 256, 'lr': 0.00023949672670861262, 'lambda_val': 0.0004685524627241652, 'batch_size': 1062, 'optimizer': 'Adam'}. Best is trial 15 with value: 0.12860431361188532.
2026-05-11 09:28:43,731 - optuna.study._optimize - INFO - Trial 126 pruned. 
2026-05-11 09:28:48,682 - optuna.study._optimize - INFO - Trial 127 pruned. 
2026-05-11 09:28:54,549 - optuna.study._optimize - INFO - Trial 128 pruned. 
2026-05-11 09:29:04,275 - optuna.study._optimize - INFO - Trial 129 pruned. 
2026-05-11 09:29:40,486 - optuna.study.study - INFO - Trial 130 finished with value: 0.07430541108960506 and parameters: {'n_layers': 1, 'embedding_dim': 256, 'lr': 0.0004424744620839416, 'lambda_val': 0.000838742906463741, 'batch_size': 961, 'optimizer': 'Adam'}. Best is trial 15 with value: 0.12860431361188532.
2026-05-11 09:29:45,000 - optuna.study._optimize - INFO - Trial 131 pruned. 
2026-05-11 09:29:49,610 - optuna.study._optimize - INFO - Trial 132 pruned. 
