2026-05-11 03:49:29,665 - optuna.study._optimize - INFO - Trial 24 pruned. 
2026-05-11 03:49:36,570 - optuna.study._optimize - INFO - Trial 25 pruned. 
2026-05-11 03:50:10,895 - optuna.study.study - INFO - Trial 26 finished with value: 0.02996588436515102 and parameters: {'n_layers': 2, 'embedding_dim': 128, 'lr': 0.0021521681377676865, 'lambda_val': 6.197736793662114e-06, 'batch_size': 2312, 'optimizer': 'Adam'}. Best is trial 13 with value: 0.06761116545947718.
2026-05-11 03:50:47,863 - optuna.study.study - INFO - Trial 27 finished with value: 0.02362347745763028 and parameters: {'n_layers': 3, 'embedding_dim': 128, 'lr': 0.0005042504540740627, 'lambda_val': 3.881781615493149e-05, 'batch_size': 952, 'optimizer': 'RMSprop'}. Best is trial 13 with value: 0.06761116545947718.
2026-05-11 03:50:51,692 - optuna.study._optimize - INFO - Trial 28 pruned. 
2026-05-11 03:50:55,147 - optuna.study._optimize - INFO - Trial 29 pruned. 
2026-05-11 03:51:36,609 - optuna.study.study - INFO - Trial 30 finished with value: 0.019630642227018952 and parameters: {'n_layers': 3, 'embedding_dim': 96, 'lr': 0.0005419724158948673, 'lambda_val': 1.2253318422857515e-05, 'batch_size': 1943, 'optimizer': 'RMSprop'}. Best is trial 13 with value: 0.06761116545947718.
2026-05-11 03:52:30,103 - optuna.study.study - INFO - Trial 31 finished with value: 0.03358651656188094 and parameters: {'n_layers': 1, 'embedding_dim': 256, 'lr': 0.022442833382083735, 'lambda_val': 5.139139618638604e-05, 'batch_size': 3864, 'optimizer': 'Adam'}. Best is trial 13 with value: 0.06761116545947718.
2026-05-11 03:52:37,573 - optuna.study._optimize - INFO - Trial 32 pruned. 
2026-05-11 03:53:28,894 - optuna.study.study - INFO - Trial 33 finished with value: 0.043662619605575013 and parameters: {'n_layers': 1, 'embedding_dim': 256, 'lr': 0.009070848897472165, 'lambda_val': 1.7288584085288332e-05, 'batch_size': 3547, 'optimizer': 'Adam'}. Best is trial 13 with value: 0.06761116545947718.
2026-05-11 03:53:56,752 - optuna.study.study - INFO - Trial 34 finished with value: 0.03694684679719031 and parameters: {'n_layers': 1, 'embedding_dim': 64, 'lr': 0.00937421951423425, 'lambda_val': 2.0544740832980836e-05, 'batch_size': 3653, 'optimizer': 'Adam'}. Best is trial 13 with value: 0.06761116545947718.
2026-05-11 03:54:03,919 - optuna.study._optimize - INFO - Trial 35 pruned. 
2026-05-11 03:54:33,280 - optuna.study.study - INFO - Trial 36 finished with value: 0.08718875283072844 and parameters: {'n_layers': 1, 'embedding_dim': 32, 'lr': 0.0001613527667362314, 'lambda_val': 7.608548651722361e-06, 'batch_size': 3528, 'optimizer': 'Adam'}. Best is trial 36 with value: 0.08718875283072844.
2026-05-11 03:54:44,483 - optuna.study._optimize - INFO - Trial 37 pruned. 
2026-05-11 03:54:55,198 - optuna.study._optimize - INFO - Trial 38 pruned. 
2026-05-11 03:54:58,959 - optuna.study._optimize - INFO - Trial 39 pruned. 
2026-05-11 03:55:27,570 - optuna.study.study - INFO - Trial 40 finished with value: 0.0954589018087033 and parameters: {'n_layers': 1, 'embedding_dim': 32, 'lr': 0.00016509081757433498, 'lambda_val': 5.140294470878112e-05, 'batch_size': 2930, 'optimizer': 'Adam'}. Best is trial 40 with value: 0.0954589018087033.
2026-05-11 03:55:55,457 - optuna.study.study - INFO - Trial 41 finished with value: 0.05348302962041323 and parameters: {'n_layers': 1, 'embedding_dim': 32, 'lr': 0.0003424756628607191, 'lambda_val': 5.691915248996897e-05, 'batch_size': 2947, 'optimizer': 'Adam'}. Best is trial 40 with value: 0.0954589018087033.
2026-05-11 03:56:25,444 - optuna.study.study - INFO - Trial 42 finished with value: 0.08811939212709374 and parameters: {'n_layers': 1, 'embedding_dim': 32, 'lr': 0.00015553992168114666, 'lambda_val': 5.3524197766581646e-05, 'batch_size': 2523, 'optimizer': 'Adam'}. Best is trial 40 with value: 0.0954589018087033.
2026-05-11 03:56:53,210 - optuna.study.study - INFO - Trial 43 finished with value: 0.12005198767178281 and parameters: {'n_layers': 1, 'embedding_dim': 32, 'lr': 0.00014827480214721968, 'lambda_val': 9.099117408576953e-06, 'batch_size': 2536, 'optimizer': 'Adam'}. Best is trial 43 with value: 0.12005198767178281.
2026-05-11 03:57:23,460 - optuna.study.study - INFO - Trial 44 finished with value: 0.08639479453310862 and parameters: {'n_layers': 1, 'embedding_dim': 32, 'lr': 0.0001426075813136733, 'lambda_val': 0.00013185947033782277, 'batch_size': 2499, 'optimizer': 'Adam'}. Best is trial 43 with value: 0.12005198767178281.
2026-05-11 03:57:50,691 - optuna.study.study - INFO - Trial 45 finished with value: 0.07439234034931666 and parameters: {'n_layers': 1, 'embedding_dim': 32, 'lr': 0.00016728004190086828, 'lambda_val': 0.0001717037811376152, 'batch_size': 2535, 'optimizer': 'Adam'}. Best is trial 43 with value: 0.12005198767178281.
2026-05-11 03:58:19,285 - optuna.study.study - INFO - Trial 46 finished with value: 0.04090377951685372 and parameters: {'n_layers': 1, 'embedding_dim': 32, 'lr': 0.0007170907540804192, 'lambda_val': 0.0005466322183784937, 'batch_size': 2455, 'optimizer': 'Adam'}. Best is trial 43 with value: 0.12005198767178281.
2026-05-11 03:58:50,104 - optuna.study.study - INFO - Trial 47 finished with value: 0.08211197196659079 and parameters: {'n_layers': 1, 'embedding_dim': 32, 'lr': 0.00016227527649258035, 'lambda_val': 0.0003752822023533188, 'batch_size': 2721, 'optimizer': 'Adam'}. Best is trial 43 with value: 0.12005198767178281.
2026-05-11 03:59:17,816 - optuna.study.study - INFO - Trial 48 finished with value: 0.06183473703676142 and parameters: {'n_layers': 1, 'embedding_dim': 32, 'lr': 0.0003273414146882903, 'lambda_val': 0.00012615382403027928, 'batch_size': 2218, 'optimizer': 'Adam'}. Best is trial 43 with value: 0.12005198767178281.
2026-05-11 03:59:43,041 - optuna.study.study - INFO - Trial 49 finished with value: 0.05393677528714789 and parameters: {'n_layers': 1, 'embedding_dim': 32, 'lr': 0.00017690295747192932, 'lambda_val': 0.00671551523548332, 'batch_size': 3033, 'optimizer': 'Adam'}. Best is trial 43 with value: 0.12005198767178281.
2026-05-11 03:59:46,213 - optuna.study._optimize - INFO - Trial 50 pruned. 
2026-05-11 04:00:08,066 - optuna.study.study - INFO - Trial 51 finished with value: 0.0815725230853439 and parameters: {'n_layers': 1, 'embedding_dim': 32, 'lr': 0.0001434212031046054, 'lambda_val': 9.691740739684486e-06, 'batch_size': 2652, 'optimizer': 'Adam'}. Best is trial 43 with value: 0.12005198767178281.
2026-05-11 04:00:10,959 - optuna.study._optimize - INFO - Trial 52 pruned. 
2026-05-11 04:00:36,023 - optuna.study.study - INFO - Trial 53 finished with value: 0.07759577952697891 and parameters: {'n_layers': 1, 'embedding_dim': 32, 'lr': 0.00020877044989151258, 'lambda_val': 0.00037270760622989485, 'batch_size': 2747, 'optimizer': 'Adam'}. Best is trial 43 with value: 0.12005198767178281.
2026-05-11 04:01:03,002 - optuna.study.study - INFO - Trial 54 finished with value: 0.05853769133778009 and parameters: {'n_layers': 1, 'embedding_dim': 32, 'lr': 0.00038568169515332447, 'lambda_val': 0.0010672337333562346, 'batch_size': 2149, 'optimizer': 'Adam'}. Best is trial 43 with value: 0.12005198767178281.
2026-05-11 04:01:06,996 - optuna.study._optimize - INFO - Trial 55 pruned. 
2026-05-11 04:01:10,363 - optuna.study._optimize - INFO - Trial 56 pruned. 
2026-05-11 04:01:37,541 - optuna.study.study - INFO - Trial 57 finished with value: 0.032741959561830375 and parameters: {'n_layers': 1, 'embedding_dim': 32, 'lr': 0.0008520282780852303, 'lambda_val': 5.013603020862458e-06, 'batch_size': 2364, 'optimizer': 'Adam'}. Best is trial 43 with value: 0.12005198767178281.
2026-05-11 04:02:17,290 - optuna.study.study - INFO - Trial 58 finished with value: 0.05928523936714928 and parameters: {'n_layers': 1, 'embedding_dim': 32, 'lr': 0.00020710094768033426, 'lambda_val': 0.00034979772602554806, 'batch_size': 2982, 'optimizer': 'Adam'}. Best is trial 43 with value: 0.12005198767178281.
2026-05-11 04:03:06,272 - optuna.study.study - INFO - Trial 59 finished with value: 0.025736137327014054 and parameters: {'n_layers': 2, 'embedding_dim': 96, 'lr': 0.0004564298520428727, 'lambda_val': 0.0002063660909146718, 'batch_size': 2839, 'optimizer': 'Adam'}. Best is trial 43 with value: 0.12005198767178281.
2026-05-11 04:03:09,901 - optuna.study._optimize - INFO - Trial 60 pruned. 
2026-05-11 04:03:38,704 - optuna.study.study - INFO - Trial 61 finished with value: 0.09658058153432246 and parameters: {'n_layers': 1, 'embedding_dim': 32, 'lr': 0.00014907672370690286, 'lambda_val': 9.25257747050618e-06, 'batch_size': 2669, 'optimizer': 'Adam'}. Best is trial 43 with value: 0.12005198767178281.
2026-05-11 04:04:06,857 - optuna.study.study - INFO - Trial 62 finished with value: 0.05409031132632689 and parameters: {'n_layers': 1, 'embedding_dim': 32, 'lr': 0.00024222659343562907, 'lambda_val': 3.2108927442570296e-06, 'batch_size': 2731, 'optimizer': 'Adam'}. Best is trial 43 with value: 0.12005198767178281.
2026-05-11 04:04:10,877 - optuna.study._optimize - INFO - Trial 63 pruned. 
2026-05-11 04:04:14,797 - optuna.study._optimize - INFO - Trial 64 pruned. 
2026-05-11 04:04:41,244 - optuna.study.study - INFO - Trial 65 finished with value: 0.04100862078977954 and parameters: {'n_layers': 1, 'embedding_dim': 64, 'lr': 0.0015591967375228949, 'lambda_val': 2.814161833421149e-05, 'batch_size': 2223, 'optimizer': 'Adam'}. Best is trial 43 with value: 0.12005198767178281.
2026-05-11 04:04:45,238 - optuna.study._optimize - INFO - Trial 66 pruned. 
2026-05-11 04:04:49,531 - optuna.study._optimize - INFO - Trial 67 pruned. 
2026-05-11 04:05:17,195 - optuna.study.study - INFO - Trial 68 finished with value: 0.037861314910780146 and parameters: {'n_layers': 1, 'embedding_dim': 32, 'lr': 0.0006273273836236225, 'lambda_val': 1.8089529285624827e-06, 'batch_size': 2058, 'optimizer': 'Adam'}. Best is trial 43 with value: 0.12005198767178281.
2026-05-11 04:05:44,477 - optuna.study.study - INFO - Trial 69 finished with value: 0.10840207469767381 and parameters: {'n_layers': 1, 'embedding_dim': 96, 'lr': 0.00017016412017633638, 'lambda_val': 9.037636220736267e-05, 'batch_size': 1728, 'optimizer': 'Adam'}. Best is trial 43 with value: 0.12005198767178281.
2026-05-11 04:05:48,431 - optuna.study._optimize - INFO - Trial 70 pruned. 
2026-05-11 04:06:20,407 - optuna.study.study - INFO - Trial 71 finished with value: 0.09929797694549515 and parameters: {'n_layers': 1, 'embedding_dim': 96, 'lr': 0.0001448371200681034, 'lambda_val': 8.118004549967982e-05, 'batch_size': 2633, 'optimizer': 'Adam'}. Best is trial 43 with value: 0.12005198767178281.
2026-05-11 04:06:50,943 - optuna.study.study - INFO - Trial 72 finished with value: 0.07345061009693546 and parameters: {'n_layers': 1, 'embedding_dim': 96, 'lr': 0.00018761748178908232, 'lambda_val': 9.707288867770014e-05, 'batch_size': 2323, 'optimizer': 'Adam'}. Best is trial 43 with value: 0.12005198767178281.
2026-05-11 04:06:54,439 - optuna.study._optimize - INFO - Trial 73 pruned. 
2026-05-11 04:07:23,746 - optuna.study.study - INFO - Trial 74 finished with value: 0.06526631773144181 and parameters: {'n_layers': 1, 'embedding_dim': 96, 'lr': 0.0002648843700184302, 'lambda_val': 0.0001631898005467957, 'batch_size': 2466, 'optimizer': 'Adam'}. Best is trial 43 with value: 0.12005198767178281.
2026-05-11 04:07:27,614 - optuna.study._optimize - INFO - Trial 75 pruned. 
2026-05-11 04:07:31,109 - optuna.study._optimize - INFO - Trial 76 pruned. 
2026-05-11 04:07:57,477 - optuna.study.study - INFO - Trial 77 finished with value: 0.049205416480808215 and parameters: {'n_layers': 1, 'embedding_dim': 96, 'lr': 0.0004310828604904383, 'lambda_val': 1.0696658799132716e-05, 'batch_size': 3428, 'optimizer': 'Adam'}. Best is trial 43 with value: 0.12005198767178281.
2026-05-11 04:08:23,065 - optuna.study.study - INFO - Trial 78 finished with value: 0.05362417224806083 and parameters: {'n_layers': 1, 'embedding_dim': 64, 'lr': 0.00031210931282817783, 'lambda_val': 2.136920637286435e-05, 'batch_size': 2239, 'optimizer': 'Adam'}. Best is trial 43 with value: 0.12005198767178281.
2026-05-11 04:08:27,069 - optuna.study._optimize - INFO - Trial 79 pruned. 
2026-05-11 04:08:31,241 - optuna.study._optimize - INFO - Trial 80 pruned. 
2026-05-11 04:08:35,225 - optuna.study._optimize - INFO - Trial 81 pruned. 
2026-05-11 04:09:03,422 - optuna.study.study - INFO - Trial 82 finished with value: 0.08399602744409627 and parameters: {'n_layers': 1, 'embedding_dim': 32, 'lr': 0.00016518757704045873, 'lambda_val': 0.00012347499624831013, 'batch_size': 2732, 'optimizer': 'Adam'}. Best is trial 43 with value: 0.12005198767178281.
2026-05-11 04:09:10,533 - optuna.study._optimize - INFO - Trial 83 pruned. 
2026-05-11 04:09:38,807 - optuna.study.study - INFO - Trial 84 finished with value: 0.07558898920709729 and parameters: {'n_layers': 1, 'embedding_dim': 32, 'lr': 0.00022428577646546664, 'lambda_val': 6.681429475715773e-06, 'batch_size': 2953, 'optimizer': 'Adam'}. Best is trial 43 with value: 0.12005198767178281.
2026-05-11 04:09:43,221 - optuna.study._optimize - INFO - Trial 85 pruned. 
2026-05-11 04:09:47,628 - optuna.study._optimize - INFO - Trial 86 pruned. 
2026-05-11 04:09:51,425 - optuna.study._optimize - INFO - Trial 87 pruned. 
2026-05-11 04:09:55,277 - optuna.study._optimize - INFO - Trial 88 pruned. 
2026-05-11 04:09:59,051 - optuna.study._optimize - INFO - Trial 89 pruned. 
2026-05-11 04:10:29,377 - optuna.study.study - INFO - Trial 90 finished with value: 0.06677871859383434 and parameters: {'n_layers': 1, 'embedding_dim': 128, 'lr': 0.0002486984318210882, 'lambda_val': 5.61657042909275e-05, 'batch_size': 2529, 'optimizer': 'Adam'}. Best is trial 43 with value: 0.12005198767178281.
2026-05-11 04:11:02,539 - optuna.study.study - INFO - Trial 91 finished with value: 0.06115208241160145 and parameters: {'n_layers': 1, 'embedding_dim': 32, 'lr': 0.0001725337771587804, 'lambda_val': 0.0004900541497657904, 'batch_size': 2758, 'optimizer': 'Adam'}. Best is trial 43 with value: 0.12005198767178281.
2026-05-11 04:11:06,135 - optuna.study._optimize - INFO - Trial 92 pruned. 
2026-05-11 04:11:10,053 - optuna.study._optimize - INFO - Trial 93 pruned. 
2026-05-11 04:11:13,931 - optuna.study._optimize - INFO - Trial 94 pruned. 
2026-05-11 04:11:42,708 - optuna.study.study - INFO - Trial 95 finished with value: 0.0630657668226439 and parameters: {'n_layers': 1, 'embedding_dim': 32, 'lr': 0.00020832289638266966, 'lambda_val': 0.00045239679805759287, 'batch_size': 3244, 'optimizer': 'Adam'}. Best is trial 43 with value: 0.12005198767178281.
2026-05-11 04:11:46,414 - optuna.study._optimize - INFO - Trial 96 pruned. 
2026-05-11 04:12:15,594 - optuna.study.study - INFO - Trial 97 finished with value: 0.06574188095572693 and parameters: {'n_layers': 1, 'embedding_dim': 32, 'lr': 0.0003033019201641021, 'lambda_val': 1.7186340802730723e-05, 'batch_size': 2936, 'optimizer': 'Adam'}. Best is trial 43 with value: 0.12005198767178281.
2026-05-11 04:12:43,330 - optuna.study.study - INFO - Trial 98 finished with value: 0.044952687359776186 and parameters: {'n_layers': 1, 'embedding_dim': 96, 'lr': 0.0005598832940762054, 'lambda_val': 1.2748745742606108e-06, 'batch_size': 2275, 'optimizer': 'Adam'}. Best is trial 43 with value: 0.12005198767178281.
2026-05-11 04:12:48,255 - optuna.study._optimize - INFO - Trial 99 pruned. 
2026-05-11 04:12:52,278 - optuna.study._optimize - INFO - Trial 100 pruned. 
2026-05-11 04:12:56,108 - optuna.study._optimize - INFO - Trial 101 pruned. 
2026-05-11 04:13:23,797 - optuna.study.study - INFO - Trial 102 finished with value: 0.07729789816797017 and parameters: {'n_layers': 1, 'embedding_dim': 32, 'lr': 0.0002007397736109395, 'lambda_val': 5.837592211866894e-06, 'batch_size': 2518, 'optimizer': 'Adam'}. Best is trial 43 with value: 0.12005198767178281.
2026-05-11 04:13:27,073 - optuna.study._optimize - INFO - Trial 103 pruned. 
2026-05-11 04:13:49,821 - optuna.study.study - INFO - Trial 104 finished with value: 0.11429581535125381 and parameters: {'n_layers': 1, 'embedding_dim': 32, 'lr': 0.00015388305062614637, 'lambda_val': 9.993660040138927e-06, 'batch_size': 2660, 'optimizer': 'Adam'}. Best is trial 43 with value: 0.12005198767178281.
2026-05-11 04:14:11,900 - optuna.study.study - INFO - Trial 105 finished with value: 0.09102178464093329 and parameters: {'n_layers': 1, 'embedding_dim': 32, 'lr': 0.00026236638682828294, 'lambda_val': 2.5263077118949737e-05, 'batch_size': 1100, 'optimizer': 'Adam'}. Best is trial 43 with value: 0.12005198767178281.
2026-05-11 04:14:38,224 - optuna.study.study - INFO - Trial 106 finished with value: 0.08954635033878014 and parameters: {'n_layers': 1, 'embedding_dim': 32, 'lr': 0.0002502347902822786, 'lambda_val': 2.4584119198260173e-05, 'batch_size': 801, 'optimizer': 'Adam'}. Best is trial 43 with value: 0.12005198767178281.
2026-05-11 04:14:43,103 - optuna.study._optimize - INFO - Trial 107 pruned. 
2026-05-11 04:14:46,734 - optuna.study._optimize - INFO - Trial 108 pruned. 
2026-05-11 04:15:19,787 - optuna.study.study - INFO - Trial 109 finished with value: 0.0886947548991579 and parameters: {'n_layers': 1, 'embedding_dim': 256, 'lr': 0.00033051526682124005, 'lambda_val': 2.583283005951232e-05, 'batch_size': 651, 'optimizer': 'Adam'}. Best is trial 43 with value: 0.12005198767178281.
2026-05-11 04:15:50,733 - optuna.study.study - INFO - Trial 110 finished with value: 0.0645756034253336 and parameters: {'n_layers': 1, 'embedding_dim': 256, 'lr': 0.0008108644262669251, 'lambda_val': 2.5963463278114112e-05, 'batch_size': 688, 'optimizer': 'RMSprop'}. Best is trial 43 with value: 0.12005198767178281.
2026-05-11 04:16:23,192 - optuna.study.study - INFO - Trial 111 finished with value: 0.06733392257118921 and parameters: {'n_layers': 1, 'embedding_dim': 256, 'lr': 0.00034641690832917603, 'lambda_val': 4.3769572291019364e-05, 'batch_size': 1107, 'optimizer': 'Adam'}. Best is trial 43 with value: 0.12005198767178281.
2026-05-11 04:16:56,442 - optuna.study.study - INFO - Trial 112 finished with value: 0.07908888869390772 and parameters: {'n_layers': 1, 'embedding_dim': 256, 'lr': 0.0002833737032277623, 'lambda_val': 1.316652796511512e-05, 'batch_size': 832, 'optimizer': 'Adam'}. Best is trial 43 with value: 0.12005198767178281.
2026-05-11 04:17:33,774 - optuna.study.study - INFO - Trial 113 finished with value: 0.10099652161803772 and parameters: {'n_layers': 1, 'embedding_dim': 256, 'lr': 0.0002291228707431851, 'lambda_val': 3.116339921827784e-05, 'batch_size': 747, 'optimizer': 'Adam'}. Best is trial 43 with value: 0.12005198767178281.
2026-05-11 04:18:06,819 - optuna.study.study - INFO - Trial 114 finished with value: 0.10498287365380217 and parameters: {'n_layers': 1, 'embedding_dim': 256, 'lr': 0.00022991289740638304, 'lambda_val': 3.0374895833100383e-05, 'batch_size': 667, 'optimizer': 'Adam'}. Best is trial 43 with value: 0.12005198767178281.
2026-05-11 04:18:40,229 - optuna.study.study - INFO - Trial 115 finished with value: 0.11230681262140187 and parameters: {'n_layers': 1, 'embedding_dim': 256, 'lr': 0.00022512336342256448, 'lambda_val': 3.163619938430633e-05, 'batch_size': 651, 'optimizer': 'Adam'}. Best is trial 43 with value: 0.12005198767178281.
2026-05-11 04:19:13,129 - optuna.study.study - INFO - Trial 116 finished with value: 0.07949968536812543 and parameters: {'n_layers': 1, 'embedding_dim': 256, 'lr': 0.0004047268019385396, 'lambda_val': 3.338279274823499e-05, 'batch_size': 673, 'optimizer': 'Adam'}. Best is trial 43 with value: 0.12005198767178281.
2026-05-11 04:19:46,573 - optuna.study.study - INFO - Trial 117 finished with value: 0.07474922565762918 and parameters: {'n_layers': 1, 'embedding_dim': 256, 'lr': 0.0005050088893881833, 'lambda_val': 2.5271812288023434e-05, 'batch_size': 636, 'optimizer': 'Adam'}. Best is trial 43 with value: 0.12005198767178281.
2026-05-11 04:20:19,591 - optuna.study.study - INFO - Trial 118 finished with value: 0.11548983613181811 and parameters: {'n_layers': 1, 'embedding_dim': 256, 'lr': 0.0002342526737068291, 'lambda_val': 1.8329121699756992e-05, 'batch_size': 517, 'optimizer': 'Adam'}. Best is trial 43 with value: 0.12005198767178281.
2026-05-11 04:20:53,197 - optuna.study.study - INFO - Trial 119 finished with value: 0.09917090125452166 and parameters: {'n_layers': 1, 'embedding_dim': 256, 'lr': 0.00022037523878806167, 'lambda_val': 1.5040898546347923e-05, 'batch_size': 757, 'optimizer': 'Adam'}. Best is trial 43 with value: 0.12005198767178281.
2026-05-11 04:21:28,128 - optuna.study.study - INFO - Trial 120 finished with value: 0.12709225019369708 and parameters: {'n_layers': 1, 'embedding_dim': 256, 'lr': 0.00021504944867724435, 'lambda_val': 9.370745052284128e-06, 'batch_size': 518, 'optimizer': 'Adam'}. Best is trial 120 with value: 0.12709225019369708.
2026-05-11 04:22:14,184 - optuna.study.study - INFO - Trial 121 finished with value: 0.12020203447761114 and parameters: {'n_layers': 1, 'embedding_dim': 256, 'lr': 0.00022092281366648109, 'lambda_val': 9.257162650019334e-06, 'batch_size': 576, 'optimizer': 'Adam'}. Best is trial 120 with value: 0.12709225019369708.
2026-05-11 04:22:47,411 - optuna.study.study - INFO - Trial 122 finished with value: 0.1295669096186746 and parameters: {'n_layers': 1, 'embedding_dim': 256, 'lr': 0.0002031818364255313, 'lambda_val': 9.763164793882231e-06, 'batch_size': 526, 'optimizer': 'Adam'}. Best is trial 122 with value: 0.1295669096186746.
2026-05-11 04:23:21,675 - optuna.study.study - INFO - Trial 123 finished with value: 0.11402169302205069 and parameters: {'n_layers': 1, 'embedding_dim': 256, 'lr': 0.0002110016360451855, 'lambda_val': 1.552096286250761e-05, 'batch_size': 585, 'optimizer': 'Adam'}. Best is trial 122 with value: 0.1295669096186746.
