2026-05-11 07:36:15,784 - optuna.study.study - INFO - Trial 1 finished with value: 0.015935747211172212 and parameters: {'n_layers': 4, 'embedding_dim': 64, 'lr': 0.004512027772012861, 'lambda_val': 6.032683769562059e-06, 'batch_size': 2920, 'optimizer': 'Adam'}. Best is trial 1 with value: 0.015935747211172212.
2026-05-11 07:36:54,128 - optuna.study.study - INFO - Trial 2 finished with value: 0.0016371228394180405 and parameters: {'n_layers': 1, 'embedding_dim': 256, 'lr': 0.012630539244448995, 'lambda_val': 4.4422665139549005e-05, 'batch_size': 2231, 'optimizer': 'SGD'}. Best is trial 1 with value: 0.015935747211172212.
2026-05-11 07:37:30,412 - optuna.study.study - INFO - Trial 3 finished with value: 0.0586540583776019 and parameters: {'n_layers': 2, 'embedding_dim': 128, 'lr': 3.793199786397813e-05, 'lambda_val': 0.0002720283508471891, 'batch_size': 3641, 'optimizer': 'RMSprop'}. Best is trial 3 with value: 0.0586540583776019.
2026-05-11 07:38:04,073 - optuna.study.study - INFO - Trial 4 finished with value: 0.061802589086416504 and parameters: {'n_layers': 3, 'embedding_dim': 64, 'lr': 3.900101754649852e-05, 'lambda_val': 1.5450297775480038e-06, 'batch_size': 783, 'optimizer': 'RMSprop'}. Best is trial 4 with value: 0.061802589086416504.
2026-05-11 07:38:39,064 - optuna.study.study - INFO - Trial 5 finished with value: 0.02002670650114299 and parameters: {'n_layers': 1, 'embedding_dim': 256, 'lr': 0.07434229670457743, 'lambda_val': 1.1854533732493564e-05, 'batch_size': 2246, 'optimizer': 'Adam'}. Best is trial 4 with value: 0.061802589086416504.
2026-05-11 07:38:44,129 - optuna.study._optimize - INFO - Trial 6 pruned. 
2026-05-11 07:39:11,822 - optuna.study.study - INFO - Trial 7 finished with value: 0.04685842622277569 and parameters: {'n_layers': 1, 'embedding_dim': 32, 'lr': 0.0005879528136948614, 'lambda_val': 5.960552002385552e-05, 'batch_size': 1620, 'optimizer': 'Adam'}. Best is trial 4 with value: 0.061802589086416504.
2026-05-11 07:39:16,037 - optuna.study._optimize - INFO - Trial 8 pruned. 
2026-05-11 07:39:23,426 - optuna.study._optimize - INFO - Trial 9 pruned. 
2026-05-11 07:40:11,102 - optuna.study.study - INFO - Trial 10 finished with value: 0.012831112782205101 and parameters: {'n_layers': 4, 'embedding_dim': 96, 'lr': 0.0002661818393518906, 'lambda_val': 2.136598291734199e-06, 'batch_size': 604, 'optimizer': 'RMSprop'}. Best is trial 4 with value: 0.061802589086416504.
2026-05-11 07:40:15,940 - optuna.study._optimize - INFO - Trial 11 pruned. 
2026-05-11 07:40:21,130 - optuna.study._optimize - INFO - Trial 12 pruned. 
2026-05-11 07:40:57,845 - optuna.study.study - INFO - Trial 13 finished with value: 0.02643254653953275 and parameters: {'n_layers': 2, 'embedding_dim': 128, 'lr': 0.00011062825711835701, 'lambda_val': 0.00017108832611801824, 'batch_size': 3441, 'optimizer': 'RMSprop'}. Best is trial 4 with value: 0.061802589086416504.
2026-05-11 07:41:02,365 - optuna.study._optimize - INFO - Trial 14 pruned. 
2026-05-11 07:41:36,365 - optuna.study.study - INFO - Trial 15 finished with value: 0.02507134941735282 and parameters: {'n_layers': 2, 'embedding_dim': 64, 'lr': 0.00011625028773927122, 'lambda_val': 0.0010516068293298752, 'batch_size': 3477, 'optimizer': 'RMSprop'}. Best is trial 4 with value: 0.061802589086416504.
2026-05-11 07:42:14,880 - optuna.study.study - INFO - Trial 16 finished with value: 0.0562169040875631 and parameters: {'n_layers': 3, 'embedding_dim': 128, 'lr': 5.270000364531131e-05, 'lambda_val': 0.0036009546254289577, 'batch_size': 1820, 'optimizer': 'RMSprop'}. Best is trial 4 with value: 0.061802589086416504.
2026-05-11 07:42:48,635 - optuna.study.study - INFO - Trial 17 finished with value: 0.020423069227443025 and parameters: {'n_layers': 2, 'embedding_dim': 64, 'lr': 0.00043854223073694793, 'lambda_val': 1.2973710092085368e-06, 'batch_size': 1153, 'optimizer': 'RMSprop'}. Best is trial 4 with value: 0.061802589086416504.
2026-05-11 07:42:53,854 - optuna.study._optimize - INFO - Trial 18 pruned. 
2026-05-11 07:43:25,426 - optuna.study.study - INFO - Trial 19 finished with value: 0.012701514749362033 and parameters: {'n_layers': 3, 'embedding_dim': 32, 'lr': 0.0013392930310896468, 'lambda_val': 7.632848510718076e-06, 'batch_size': 1941, 'optimizer': 'Adam'}. Best is trial 4 with value: 0.061802589086416504.
2026-05-11 07:43:30,005 - optuna.study._optimize - INFO - Trial 20 pruned. 
2026-05-11 07:44:09,152 - optuna.study.study - INFO - Trial 21 finished with value: 0.025755141485994136 and parameters: {'n_layers': 3, 'embedding_dim': 128, 'lr': 7.686553060309792e-05, 'lambda_val': 0.002447219941796623, 'batch_size': 1799, 'optimizer': 'RMSprop'}. Best is trial 4 with value: 0.061802589086416504.
2026-05-11 07:44:14,378 - optuna.study._optimize - INFO - Trial 22 pruned. 
2026-05-11 07:44:19,362 - optuna.study._optimize - INFO - Trial 23 pruned. 
2026-05-11 07:44:25,034 - optuna.study._optimize - INFO - Trial 24 pruned. 
2026-05-11 07:44:29,822 - optuna.study._optimize - INFO - Trial 25 pruned. 
2026-05-11 07:44:35,123 - optuna.study._optimize - INFO - Trial 26 pruned. 
2026-05-11 07:44:39,603 - optuna.study._optimize - INFO - Trial 27 pruned. 
2026-05-11 07:44:44,470 - optuna.study._optimize - INFO - Trial 28 pruned. 
2026-05-11 07:44:51,427 - optuna.study._optimize - INFO - Trial 29 pruned. 
2026-05-11 07:44:55,654 - optuna.study._optimize - INFO - Trial 30 pruned. 
2026-05-11 07:45:43,677 - optuna.study.study - INFO - Trial 31 finished with value: 0.042413775380929004 and parameters: {'n_layers': 1, 'embedding_dim': 32, 'lr': 0.0007515236808935658, 'lambda_val': 9.588799591504471e-05, 'batch_size': 1665, 'optimizer': 'Adam'}. Best is trial 4 with value: 0.061802589086416504.
2026-05-11 07:45:56,027 - optuna.study._optimize - INFO - Trial 32 pruned. 
2026-05-11 07:46:00,942 - optuna.study._optimize - INFO - Trial 33 pruned. 
2026-05-11 07:46:35,655 - optuna.study.study - INFO - Trial 34 finished with value: 0.12399763130383332 and parameters: {'n_layers': 1, 'embedding_dim': 256, 'lr': 0.00018813053570559293, 'lambda_val': 1.9103207341345827e-05, 'batch_size': 791, 'optimizer': 'Adam'}. Best is trial 34 with value: 0.12399763130383332.
2026-05-11 07:47:17,859 - optuna.study.study - INFO - Trial 35 finished with value: 0.054876191771530185 and parameters: {'n_layers': 2, 'embedding_dim': 256, 'lr': 0.0001897621013074005, 'lambda_val': 2.0103619833673527e-05, 'batch_size': 716, 'optimizer': 'Adam'}. Best is trial 34 with value: 0.12399763130383332.
2026-05-11 07:47:22,149 - optuna.study._optimize - INFO - Trial 36 pruned. 
2026-05-11 07:47:28,147 - optuna.study._optimize - INFO - Trial 37 pruned. 
2026-05-11 07:47:32,541 - optuna.study._optimize - INFO - Trial 38 pruned. 
2026-05-11 07:47:38,519 - optuna.study._optimize - INFO - Trial 39 pruned. 
2026-05-11 07:48:18,026 - optuna.study.study - INFO - Trial 40 finished with value: 0.02815444153283136 and parameters: {'n_layers': 4, 'embedding_dim': 64, 'lr': 0.00015958414569893935, 'lambda_val': 1.0902013118125203e-06, 'batch_size': 701, 'optimizer': 'RMSprop'}. Best is trial 34 with value: 0.12399763130383332.
2026-05-11 07:50:15,206 - optuna.study.study - INFO - Trial 41 finished with value: 0.03901825225459322 and parameters: {'n_layers': 2, 'embedding_dim': 256, 'lr': 0.0002813763570364752, 'lambda_val': 1.7492100201685658e-05, 'batch_size': 668, 'optimizer': 'Adam'}. Best is trial 34 with value: 0.12399763130383332.
2026-05-11 07:51:03,032 - optuna.study.study - INFO - Trial 42 finished with value: 0.05540478050522525 and parameters: {'n_layers': 2, 'embedding_dim': 256, 'lr': 0.000176464704181295, 'lambda_val': 2.8007021338936627e-06, 'batch_size': 785, 'optimizer': 'Adam'}. Best is trial 34 with value: 0.12399763130383332.
2026-05-11 07:51:08,827 - optuna.study._optimize - INFO - Trial 43 pruned. 
2026-05-11 07:51:13,143 - optuna.study._optimize - INFO - Trial 44 pruned. 
2026-05-11 07:51:17,446 - optuna.study._optimize - INFO - Trial 45 pruned. 
2026-05-11 07:51:55,968 - optuna.study.study - INFO - Trial 46 finished with value: 0.029827539620206747 and parameters: {'n_layers': 3, 'embedding_dim': 128, 'lr': 0.00032901092890373927, 'lambda_val': 2.2057748994175045e-06, 'batch_size': 832, 'optimizer': 'RMSprop'}. Best is trial 34 with value: 0.12399763130383332.
2026-05-11 07:52:29,314 - optuna.study.study - INFO - Trial 47 finished with value: 0.04184323970572453 and parameters: {'n_layers': 1, 'embedding_dim': 64, 'lr': 0.0014600720204063762, 'lambda_val': 6.17570212546119e-06, 'batch_size': 4063, 'optimizer': 'RMSprop'}. Best is trial 34 with value: 0.12399763130383332.
2026-05-11 07:52:34,523 - optuna.study._optimize - INFO - Trial 48 pruned. 
2026-05-11 07:53:21,882 - optuna.study.study - INFO - Trial 49 finished with value: 0.030531189151292156 and parameters: {'n_layers': 2, 'embedding_dim': 256, 'lr': 0.00014009971802851875, 'lambda_val': 0.00013211261238800056, 'batch_size': 3817, 'optimizer': 'RMSprop'}. Best is trial 34 with value: 0.12399763130383332.
2026-05-11 07:53:25,870 - optuna.study._optimize - INFO - Trial 50 pruned. 
2026-05-11 07:54:12,516 - optuna.study.study - INFO - Trial 51 finished with value: 0.05409624639680772 and parameters: {'n_layers': 2, 'embedding_dim': 256, 'lr': 0.00017930975052855768, 'lambda_val': 1.2391840376245757e-05, 'batch_size': 710, 'optimizer': 'Adam'}. Best is trial 34 with value: 0.12399763130383332.
2026-05-11 07:54:54,827 - optuna.study.study - INFO - Trial 52 finished with value: 0.03807780737019418 and parameters: {'n_layers': 2, 'embedding_dim': 256, 'lr': 0.00022494080525448204, 'lambda_val': 1.6582450101818892e-06, 'batch_size': 1075, 'optimizer': 'Adam'}. Best is trial 34 with value: 0.12399763130383332.
2026-05-11 07:54:59,985 - optuna.study._optimize - INFO - Trial 53 pruned. 
2026-05-11 07:55:06,093 - optuna.study._optimize - INFO - Trial 54 pruned. 
2026-05-11 07:55:10,286 - optuna.study._optimize - INFO - Trial 55 pruned. 
2026-05-11 07:55:49,852 - optuna.study.study - INFO - Trial 56 finished with value: 0.0658072248505027 and parameters: {'n_layers': 3, 'embedding_dim': 128, 'lr': 0.00012492737844505103, 'lambda_val': 1.0195449641693363e-06, 'batch_size': 595, 'optimizer': 'Adam'}. Best is trial 34 with value: 0.12399763130383332.
2026-05-11 07:55:54,863 - optuna.study._optimize - INFO - Trial 57 pruned. 
2026-05-11 07:55:59,692 - optuna.study._optimize - INFO - Trial 58 pruned. 
2026-05-11 07:56:04,515 - optuna.study._optimize - INFO - Trial 59 pruned. 
2026-05-11 07:56:49,535 - optuna.study.study - INFO - Trial 60 finished with value: 0.015033536503049873 and parameters: {'n_layers': 4, 'embedding_dim': 128, 'lr': 0.00037099068495834354, 'lambda_val': 4.892913374212046e-06, 'batch_size': 1271, 'optimizer': 'RMSprop'}. Best is trial 34 with value: 0.12399763130383332.
2026-05-11 07:57:28,252 - optuna.study.study - INFO - Trial 61 finished with value: 0.04549161400530902 and parameters: {'n_layers': 3, 'embedding_dim': 128, 'lr': 0.00013089681943932838, 'lambda_val': 3.0748233173263173e-06, 'batch_size': 676, 'optimizer': 'Adam'}. Best is trial 34 with value: 0.12399763130383332.
2026-05-11 07:58:02,954 - optuna.study.study - INFO - Trial 62 finished with value: 0.052060864020424494 and parameters: {'n_layers': 2, 'embedding_dim': 128, 'lr': 0.00019750729411807089, 'lambda_val': 8.048024854459406e-06, 'batch_size': 666, 'optimizer': 'Adam'}. Best is trial 34 with value: 0.12399763130383332.
2026-05-11 07:58:07,598 - optuna.study._optimize - INFO - Trial 63 pruned. 
2026-05-11 07:58:12,289 - optuna.study._optimize - INFO - Trial 64 pruned. 
2026-05-11 07:58:17,871 - optuna.study._optimize - INFO - Trial 65 pruned. 
2026-05-11 07:58:22,983 - optuna.study._optimize - INFO - Trial 66 pruned. 
2026-05-11 07:59:10,008 - optuna.study.study - INFO - Trial 67 finished with value: 0.03299736627381342 and parameters: {'n_layers': 3, 'embedding_dim': 96, 'lr': 0.0002734866874783607, 'lambda_val': 1.6707934152099239e-06, 'batch_size': 515, 'optimizer': 'RMSprop'}. Best is trial 34 with value: 0.12399763130383332.
2026-05-11 07:59:13,897 - optuna.study._optimize - INFO - Trial 68 pruned. 
2026-05-11 07:59:18,554 - optuna.study._optimize - INFO - Trial 69 pruned. 
2026-05-11 07:59:25,058 - optuna.study._optimize - INFO - Trial 70 pruned. 
2026-05-11 08:00:13,914 - optuna.study.study - INFO - Trial 71 finished with value: 0.056664680320288485 and parameters: {'n_layers': 2, 'embedding_dim': 256, 'lr': 0.000181384487791758, 'lambda_val': 1.0732460710394312e-05, 'batch_size': 722, 'optimizer': 'Adam'}. Best is trial 34 with value: 0.12399763130383332.
2026-05-11 08:00:56,752 - optuna.study.study - INFO - Trial 72 finished with value: 0.05074534944513493 and parameters: {'n_layers': 2, 'embedding_dim': 256, 'lr': 0.0002353842859867834, 'lambda_val': 5.9202626866800364e-06, 'batch_size': 614, 'optimizer': 'Adam'}. Best is trial 34 with value: 0.12399763130383332.
2026-05-11 08:01:42,918 - optuna.study.study - INFO - Trial 73 finished with value: 0.07594978087936251 and parameters: {'n_layers': 2, 'embedding_dim': 256, 'lr': 0.00013269935119574201, 'lambda_val': 3.418715117446834e-05, 'batch_size': 750, 'optimizer': 'Adam'}. Best is trial 34 with value: 0.12399763130383332.
2026-05-11 08:01:48,157 - optuna.study._optimize - INFO - Trial 74 pruned. 
2026-05-11 08:02:32,217 - optuna.study.study - INFO - Trial 75 finished with value: 0.054662784406297155 and parameters: {'n_layers': 2, 'embedding_dim': 256, 'lr': 0.00014213677740093595, 'lambda_val': 1.010039833865539e-05, 'batch_size': 1175, 'optimizer': 'Adam'}. Best is trial 34 with value: 0.12399763130383332.
2026-05-11 08:02:38,619 - optuna.study._optimize - INFO - Trial 76 pruned. 
2026-05-11 08:02:44,991 - optuna.study._optimize - INFO - Trial 77 pruned. 
2026-05-11 08:02:49,392 - optuna.study._optimize - INFO - Trial 78 pruned. 
2026-05-11 08:02:54,664 - optuna.study._optimize - INFO - Trial 79 pruned. 
2026-05-11 08:02:59,869 - optuna.study._optimize - INFO - Trial 80 pruned. 
2026-05-11 08:03:42,954 - optuna.study.study - INFO - Trial 81 finished with value: 0.048316967309761594 and parameters: {'n_layers': 2, 'embedding_dim': 256, 'lr': 0.00018385062681389785, 'lambda_val': 1.874783110730283e-05, 'batch_size': 725, 'optimizer': 'Adam'}. Best is trial 34 with value: 0.12399763130383332.
2026-05-11 08:03:51,737 - optuna.study._optimize - INFO - Trial 82 pruned. 
2026-05-11 08:04:36,547 - optuna.study.study - INFO - Trial 83 finished with value: 0.03623420167673656 and parameters: {'n_layers': 2, 'embedding_dim': 256, 'lr': 0.0003317395428274652, 'lambda_val': 0.0001340985809494182, 'batch_size': 924, 'optimizer': 'Adam'}. Best is trial 34 with value: 0.12399763130383332.
2026-05-11 08:05:18,637 - optuna.study.study - INFO - Trial 84 finished with value: 0.03502774621980556 and parameters: {'n_layers': 2, 'embedding_dim': 256, 'lr': 0.0005472706826038222, 'lambda_val': 2.2296689535940412e-05, 'batch_size': 603, 'optimizer': 'Adam'}. Best is trial 34 with value: 0.12399763130383332.
2026-05-11 08:06:09,019 - optuna.study.study - INFO - Trial 85 finished with value: 0.032219219041697666 and parameters: {'n_layers': 2, 'embedding_dim': 256, 'lr': 0.00015018981195477068, 'lambda_val': 1.368258385775604e-06, 'batch_size': 3658, 'optimizer': 'Adam'}. Best is trial 34 with value: 0.12399763130383332.
2026-05-11 08:06:14,195 - optuna.study._optimize - INFO - Trial 86 pruned. 
2026-05-11 08:06:20,432 - optuna.study._optimize - INFO - Trial 87 pruned. 
2026-05-11 08:06:24,311 - optuna.study._optimize - INFO - Trial 88 pruned. 
2026-05-11 08:06:28,765 - optuna.study._optimize - INFO - Trial 89 pruned. 
2026-05-11 08:06:34,864 - optuna.study._optimize - INFO - Trial 90 pruned. 
2026-05-11 08:07:21,119 - optuna.study.study - INFO - Trial 91 finished with value: 0.052019840798258776 and parameters: {'n_layers': 2, 'embedding_dim': 256, 'lr': 0.00015957093590118887, 'lambda_val': 1.6772472387840045e-05, 'batch_size': 1161, 'optimizer': 'Adam'}. Best is trial 34 with value: 0.12399763130383332.
2026-05-11 08:08:04,719 - optuna.study.study - INFO - Trial 92 finished with value: 0.03751964028058711 and parameters: {'n_layers': 2, 'embedding_dim': 256, 'lr': 0.0002984694988235009, 'lambda_val': 1.0435918343714195e-05, 'batch_size': 755, 'optimizer': 'Adam'}. Best is trial 34 with value: 0.12399763130383332.
2026-05-11 08:08:50,905 - optuna.study.study - INFO - Trial 93 finished with value: 0.039360999093642685 and parameters: {'n_layers': 2, 'embedding_dim': 256, 'lr': 0.00040828135620326136, 'lambda_val': 2.5591362278525467e-06, 'batch_size': 1211, 'optimizer': 'Adam'}. Best is trial 34 with value: 0.12399763130383332.
2026-05-11 08:09:44,148 - optuna.study.study - INFO - Trial 94 finished with value: 0.0446686419386403 and parameters: {'n_layers': 2, 'embedding_dim': 256, 'lr': 0.00020141423341795323, 'lambda_val': 3.729918840835444e-05, 'batch_size': 1106, 'optimizer': 'Adam'}. Best is trial 34 with value: 0.12399763130383332.
2026-05-11 08:10:28,941 - optuna.study.study - INFO - Trial 95 finished with value: 0.044914912635374935 and parameters: {'n_layers': 2, 'embedding_dim': 256, 'lr': 0.0001391691784558958, 'lambda_val': 1.7185113013328854e-06, 'batch_size': 1533, 'optimizer': 'Adam'}. Best is trial 34 with value: 0.12399763130383332.
2026-05-11 08:10:33,238 - optuna.study._optimize - INFO - Trial 96 pruned. 
2026-05-11 08:10:37,499 - optuna.study._optimize - INFO - Trial 97 pruned. 
2026-05-11 08:10:44,564 - optuna.study._optimize - INFO - Trial 98 pruned. 
2026-05-11 08:11:16,495 - optuna.study.study - INFO - Trial 99 finished with value: 0.031793557281748985 and parameters: {'n_layers': 2, 'embedding_dim': 64, 'lr': 0.000705051057401598, 'lambda_val': 9.125270624875431e-06, 'batch_size': 576, 'optimizer': 'RMSprop'}. Best is trial 34 with value: 0.12399763130383332.
2026-05-11 08:11:27,160 - optuna.study._optimize - INFO - Trial 100 pruned. 
2026-05-11 08:12:19,664 - optuna.study.study - INFO - Trial 101 finished with value: 0.0482042841780458 and parameters: {'n_layers': 2, 'embedding_dim': 256, 'lr': 0.00019977159441152026, 'lambda_val': 1.2835987314229874e-05, 'batch_size': 676, 'optimizer': 'Adam'}. Best is trial 34 with value: 0.12399763130383332.
2026-05-11 08:12:27,198 - optuna.study._optimize - INFO - Trial 102 pruned. 
2026-05-11 08:13:08,972 - optuna.study.study - INFO - Trial 103 finished with value: 0.04734805644429979 and parameters: {'n_layers': 2, 'embedding_dim': 256, 'lr': 0.00023886763276573613, 'lambda_val': 1.7111722235543635e-05, 'batch_size': 701, 'optimizer': 'Adam'}. Best is trial 34 with value: 0.12399763130383332.
2026-05-11 08:13:16,250 - optuna.study._optimize - INFO - Trial 104 pruned. 
2026-05-11 08:13:24,119 - optuna.study._optimize - INFO - Trial 105 pruned. 
2026-05-11 08:13:33,512 - optuna.study._optimize - INFO - Trial 106 pruned. 
2026-05-11 08:13:39,071 - optuna.study._optimize - INFO - Trial 107 pruned. 
2026-05-11 08:14:16,867 - optuna.study.study - INFO - Trial 108 finished with value: 0.10612399513866913 and parameters: {'n_layers': 1, 'embedding_dim': 256, 'lr': 0.0001685440479541234, 'lambda_val': 0.0005642319372781633, 'batch_size': 869, 'optimizer': 'Adam'}. Best is trial 34 with value: 0.12399763130383332.
2026-05-11 08:14:54,787 - optuna.study.study - INFO - Trial 109 finished with value: 0.07628671686629519 and parameters: {'n_layers': 1, 'embedding_dim': 256, 'lr': 0.000463725274833422, 'lambda_val': 0.00046362683662472644, 'batch_size': 879, 'optimizer': 'Adam'}. Best is trial 34 with value: 0.12399763130383332.
2026-05-11 08:15:23,746 - optuna.study.study - INFO - Trial 110 finished with value: 0.058947564767473565 and parameters: {'n_layers': 1, 'embedding_dim': 64, 'lr': 0.00046082065167472343, 'lambda_val': 0.0005566708055002721, 'batch_size': 898, 'optimizer': 'RMSprop'}. Best is trial 34 with value: 0.12399763130383332.
2026-05-11 08:15:53,999 - optuna.study.study - INFO - Trial 111 finished with value: 0.046216415402316725 and parameters: {'n_layers': 1, 'embedding_dim': 64, 'lr': 0.0009782811017612768, 'lambda_val': 0.0005514906407961658, 'batch_size': 797, 'optimizer': 'RMSprop'}. Best is trial 34 with value: 0.12399763130383332.
2026-05-11 08:16:21,453 - optuna.study.study - INFO - Trial 112 finished with value: 0.058850349913103304 and parameters: {'n_layers': 1, 'embedding_dim': 64, 'lr': 0.0004576373387979373, 'lambda_val': 0.0003149746520927705, 'batch_size': 980, 'optimizer': 'RMSprop'}. Best is trial 34 with value: 0.12399763130383332.
2026-05-11 08:16:49,956 - optuna.study.study - INFO - Trial 113 finished with value: 0.05336835783866489 and parameters: {'n_layers': 1, 'embedding_dim': 64, 'lr': 0.0004921152053427084, 'lambda_val': 0.00028799556940968356, 'batch_size': 886, 'optimizer': 'RMSprop'}. Best is trial 34 with value: 0.12399763130383332.
2026-05-11 08:17:19,263 - optuna.study.study - INFO - Trial 114 finished with value: 0.0535976971073562 and parameters: {'n_layers': 1, 'embedding_dim': 64, 'lr': 0.00044966079148034643, 'lambda_val': 0.00024264811907814718, 'batch_size': 944, 'optimizer': 'RMSprop'}. Best is trial 34 with value: 0.12399763130383332.
2026-05-11 08:17:46,753 - optuna.study.study - INFO - Trial 115 finished with value: 0.07596301262850098 and parameters: {'n_layers': 1, 'embedding_dim': 64, 'lr': 0.0002829529400342401, 'lambda_val': 0.0007742314804541457, 'batch_size': 1031, 'optimizer': 'RMSprop'}. Best is trial 34 with value: 0.12399763130383332.
2026-05-11 08:18:26,855 - optuna.study.study - INFO - Trial 116 finished with value: 0.04840484318156736 and parameters: {'n_layers': 1, 'embedding_dim': 64, 'lr': 0.0006500490354491287, 'lambda_val': 0.00043414276943740533, 'batch_size': 1103, 'optimizer': 'RMSprop'}. Best is trial 34 with value: 0.12399763130383332.
2026-05-11 08:18:31,160 - optuna.study._optimize - INFO - Trial 117 pruned. 
