2026-05-11 10:07:03,377 - optuna.study.study - INFO - Trial 43 finished with value: 0.07695420475218138 and parameters: {'n_layers': 1, 'embedding_dim': 256, 'lr': 0.008448826546906757, 'lambda_val': 0.0003649997206465695, 'batch_size': 2902, 'optimizer': 'Adam'}. Best is trial 43 with value: 0.07695420475218138.
2026-05-11 10:07:07,679 - optuna.study._optimize - INFO - Trial 44 pruned. 
2026-05-11 10:07:37,503 - optuna.study.study - INFO - Trial 45 finished with value: 0.06103833336974995 and parameters: {'n_layers': 1, 'embedding_dim': 64, 'lr': 0.005295368830227445, 'lambda_val': 0.0012574033510790517, 'batch_size': 2749, 'optimizer': 'Adam'}. Best is trial 43 with value: 0.07695420475218138.
2026-05-11 10:07:41,934 - optuna.study._optimize - INFO - Trial 46 pruned. 
2026-05-11 10:07:55,247 - optuna.study._optimize - INFO - Trial 47 pruned. 
2026-05-11 10:07:59,696 - optuna.study._optimize - INFO - Trial 48 pruned. 
2026-05-11 10:08:12,822 - optuna.study._optimize - INFO - Trial 49 pruned. 
2026-05-11 10:08:18,133 - optuna.study._optimize - INFO - Trial 50 pruned. 
2026-05-11 10:08:55,208 - optuna.study.study - INFO - Trial 51 finished with value: 0.07754099763411763 and parameters: {'n_layers': 1, 'embedding_dim': 256, 'lr': 0.016164062994853616, 'lambda_val': 0.000304165741636426, 'batch_size': 3413, 'optimizer': 'Adam'}. Best is trial 51 with value: 0.07754099763411763.
2026-05-11 10:09:32,721 - optuna.study.study - INFO - Trial 52 finished with value: 0.07459021889936955 and parameters: {'n_layers': 1, 'embedding_dim': 256, 'lr': 0.017827263965384456, 'lambda_val': 0.000318691701096157, 'batch_size': 3531, 'optimizer': 'Adam'}. Best is trial 51 with value: 0.07754099763411763.
2026-05-11 10:10:10,216 - optuna.study.study - INFO - Trial 53 finished with value: 0.07311439529850808 and parameters: {'n_layers': 1, 'embedding_dim': 256, 'lr': 0.017917538501260474, 'lambda_val': 0.0004464424895600198, 'batch_size': 3637, 'optimizer': 'Adam'}. Best is trial 51 with value: 0.07754099763411763.
2026-05-11 10:10:14,868 - optuna.study._optimize - INFO - Trial 54 pruned. 
2026-05-11 10:10:19,189 - optuna.study._optimize - INFO - Trial 55 pruned. 
2026-05-11 10:10:24,098 - optuna.study._optimize - INFO - Trial 56 pruned. 
2026-05-11 10:10:28,398 - optuna.study._optimize - INFO - Trial 57 pruned. 
2026-05-11 10:10:35,039 - optuna.study._optimize - INFO - Trial 58 pruned. 
2026-05-11 10:10:42,877 - optuna.study._optimize - INFO - Trial 59 pruned. 
2026-05-11 10:10:48,288 - optuna.study._optimize - INFO - Trial 60 pruned. 
2026-05-11 10:11:26,312 - optuna.study.study - INFO - Trial 61 finished with value: 0.06821333344169417 and parameters: {'n_layers': 1, 'embedding_dim': 256, 'lr': 0.0146507508652719, 'lambda_val': 0.002245223076817668, 'batch_size': 3518, 'optimizer': 'Adam'}. Best is trial 51 with value: 0.07754099763411763.
2026-05-11 10:12:10,462 - optuna.study.study - INFO - Trial 62 finished with value: 0.06923095285087338 and parameters: {'n_layers': 1, 'embedding_dim': 256, 'lr': 0.016377094134901866, 'lambda_val': 0.0022161949346009282, 'batch_size': 3564, 'optimizer': 'Adam'}. Best is trial 51 with value: 0.07754099763411763.
2026-05-11 10:12:47,645 - optuna.study.study - INFO - Trial 63 finished with value: 0.0645867681317325 and parameters: {'n_layers': 1, 'embedding_dim': 256, 'lr': 0.017538587064860528, 'lambda_val': 0.001970877438118634, 'batch_size': 3569, 'optimizer': 'Adam'}. Best is trial 51 with value: 0.07754099763411763.
2026-05-11 10:12:52,291 - optuna.study._optimize - INFO - Trial 64 pruned. 
2026-05-11 10:13:29,955 - optuna.study.study - INFO - Trial 65 finished with value: 0.07178484340551987 and parameters: {'n_layers': 1, 'embedding_dim': 256, 'lr': 0.008948213795876691, 'lambda_val': 0.0021670142194987673, 'batch_size': 3716, 'optimizer': 'Adam'}. Best is trial 51 with value: 0.07754099763411763.
2026-05-11 10:13:33,889 - optuna.study._optimize - INFO - Trial 66 pruned. 
2026-05-11 10:14:11,509 - optuna.study.study - INFO - Trial 67 finished with value: 0.06483905264767 and parameters: {'n_layers': 1, 'embedding_dim': 256, 'lr': 0.010063692178748956, 'lambda_val': 0.0028232086580262388, 'batch_size': 3688, 'optimizer': 'Adam'}. Best is trial 51 with value: 0.07754099763411763.
2026-05-11 10:14:16,372 - optuna.study._optimize - INFO - Trial 68 pruned. 
2026-05-11 10:14:53,545 - optuna.study.study - INFO - Trial 69 finished with value: 0.07261308043592295 and parameters: {'n_layers': 1, 'embedding_dim': 256, 'lr': 0.007452414771407115, 'lambda_val': 0.00031182964635926273, 'batch_size': 3130, 'optimizer': 'Adam'}. Best is trial 51 with value: 0.07754099763411763.
2026-05-11 10:14:58,855 - optuna.study._optimize - INFO - Trial 70 pruned. 
2026-05-11 10:15:44,158 - optuna.study.study - INFO - Trial 71 finished with value: 0.0694194481095008 and parameters: {'n_layers': 1, 'embedding_dim': 256, 'lr': 0.008587481839705861, 'lambda_val': 0.0004616120324551803, 'batch_size': 3329, 'optimizer': 'Adam'}. Best is trial 51 with value: 0.07754099763411763.
2026-05-11 10:16:21,025 - optuna.study.study - INFO - Trial 72 finished with value: 0.07499712236382523 and parameters: {'n_layers': 1, 'embedding_dim': 256, 'lr': 0.007430530470526576, 'lambda_val': 0.0005953274061984057, 'batch_size': 3374, 'optimizer': 'Adam'}. Best is trial 51 with value: 0.07754099763411763.
2026-05-11 10:16:56,491 - optuna.study.study - INFO - Trial 73 finished with value: 0.05094934971638384 and parameters: {'n_layers': 1, 'embedding_dim': 256, 'lr': 0.001238739591692714, 'lambda_val': 0.0006366790507139755, 'batch_size': 750, 'optimizer': 'Adam'}. Best is trial 51 with value: 0.07754099763411763.
2026-05-11 10:17:33,830 - optuna.study.study - INFO - Trial 74 finished with value: 0.06297752867562083 and parameters: {'n_layers': 1, 'embedding_dim': 256, 'lr': 0.006639098473815011, 'lambda_val': 0.00013760726530026907, 'batch_size': 3382, 'optimizer': 'Adam'}. Best is trial 51 with value: 0.07754099763411763.
2026-05-11 10:17:38,007 - optuna.study._optimize - INFO - Trial 75 pruned. 
2026-05-11 10:17:42,838 - optuna.study._optimize - INFO - Trial 76 pruned. 
2026-05-11 10:17:58,437 - optuna.study._optimize - INFO - Trial 77 pruned. 
2026-05-11 10:18:41,865 - optuna.study.study - INFO - Trial 78 finished with value: 0.04514387297200865 and parameters: {'n_layers': 1, 'embedding_dim': 256, 'lr': 0.0029795996175073524, 'lambda_val': 3.961593266642719e-06, 'batch_size': 3651, 'optimizer': 'Adam'}. Best is trial 51 with value: 0.07754099763411763.
2026-05-11 10:18:47,506 - optuna.study._optimize - INFO - Trial 79 pruned. 
2026-05-11 10:19:24,530 - optuna.study.study - INFO - Trial 80 finished with value: 0.08186599952480411 and parameters: {'n_layers': 1, 'embedding_dim': 256, 'lr': 0.007438610188939794, 'lambda_val': 0.0004953238962682111, 'batch_size': 3447, 'optimizer': 'Adam'}. Best is trial 80 with value: 0.08186599952480411.
2026-05-11 10:20:02,021 - optuna.study.study - INFO - Trial 81 finished with value: 0.07114512424090758 and parameters: {'n_layers': 1, 'embedding_dim': 256, 'lr': 0.006917714139119869, 'lambda_val': 0.0005266457180746392, 'batch_size': 3442, 'optimizer': 'Adam'}. Best is trial 80 with value: 0.08186599952480411.
2026-05-11 10:20:06,623 - optuna.study._optimize - INFO - Trial 82 pruned. 
2026-05-11 10:20:44,437 - optuna.study.study - INFO - Trial 83 finished with value: 0.07800221465484351 and parameters: {'n_layers': 1, 'embedding_dim': 256, 'lr': 0.010478205922586891, 'lambda_val': 0.00036798143946102635, 'batch_size': 3334, 'optimizer': 'Adam'}. Best is trial 80 with value: 0.08186599952480411.
2026-05-11 10:20:49,134 - optuna.study._optimize - INFO - Trial 84 pruned. 
2026-05-11 10:20:53,620 - optuna.study._optimize - INFO - Trial 85 pruned. 
2026-05-11 10:21:31,632 - optuna.study.study - INFO - Trial 86 finished with value: 0.0756336216145531 and parameters: {'n_layers': 1, 'embedding_dim': 256, 'lr': 0.005536416450629092, 'lambda_val': 0.001336463928026273, 'batch_size': 3492, 'optimizer': 'Adam'}. Best is trial 80 with value: 0.08186599952480411.
2026-05-11 10:22:17,107 - optuna.study.study - INFO - Trial 87 finished with value: 0.05261916652007107 and parameters: {'n_layers': 1, 'embedding_dim': 64, 'lr': 0.0003522067812934135, 'lambda_val': 0.0011576565897638707, 'batch_size': 3495, 'optimizer': 'Adam'}. Best is trial 80 with value: 0.08186599952480411.
2026-05-11 10:22:22,715 - optuna.study._optimize - INFO - Trial 88 pruned. 
2026-05-11 10:22:27,164 - optuna.study._optimize - INFO - Trial 89 pruned. 
2026-05-11 10:23:04,681 - optuna.study.study - INFO - Trial 90 finished with value: 0.06581100347785188 and parameters: {'n_layers': 1, 'embedding_dim': 256, 'lr': 0.005344041902575291, 'lambda_val': 0.0005716969609752361, 'batch_size': 3554, 'optimizer': 'Adam'}. Best is trial 80 with value: 0.08186599952480411.
2026-05-11 10:23:41,738 - optuna.study.study - INFO - Trial 91 finished with value: 0.07405779117715064 and parameters: {'n_layers': 1, 'embedding_dim': 256, 'lr': 0.007396410177073176, 'lambda_val': 0.00023045503216397996, 'batch_size': 3604, 'optimizer': 'Adam'}. Best is trial 80 with value: 0.08186599952480411.
2026-05-11 10:23:46,887 - optuna.study._optimize - INFO - Trial 92 pruned. 
2026-05-11 10:23:51,640 - optuna.study._optimize - INFO - Trial 93 pruned. 
2026-05-11 10:24:29,518 - optuna.study.study - INFO - Trial 94 finished with value: 0.05596631712714202 and parameters: {'n_layers': 1, 'embedding_dim': 256, 'lr': 0.0033951936701821944, 'lambda_val': 0.00017163893215387018, 'batch_size': 3478, 'optimizer': 'Adam'}. Best is trial 80 with value: 0.08186599952480411.
2026-05-11 10:24:34,241 - optuna.study._optimize - INFO - Trial 95 pruned. 
2026-05-11 10:24:40,557 - optuna.study._optimize - INFO - Trial 96 pruned. 
2026-05-11 10:24:44,797 - optuna.study._optimize - INFO - Trial 97 pruned. 
2026-05-11 10:24:49,521 - optuna.study._optimize - INFO - Trial 98 pruned. 
2026-05-11 10:24:56,778 - optuna.study._optimize - INFO - Trial 99 pruned. 
2026-05-11 10:25:43,460 - optuna.study.study - INFO - Trial 100 finished with value: 0.0817895643993615 and parameters: {'n_layers': 1, 'embedding_dim': 256, 'lr': 0.010456840907397772, 'lambda_val': 0.0011449204627445595, 'batch_size': 3692, 'optimizer': 'Adam'}. Best is trial 80 with value: 0.08186599952480411.
2026-05-11 10:25:47,952 - optuna.study._optimize - INFO - Trial 101 pruned. 
2026-05-11 10:26:24,837 - optuna.study.study - INFO - Trial 102 finished with value: 0.07269448632200143 and parameters: {'n_layers': 1, 'embedding_dim': 256, 'lr': 0.00804611768147661, 'lambda_val': 0.0017065290047459788, 'batch_size': 3487, 'optimizer': 'Adam'}. Best is trial 80 with value: 0.08186599952480411.
2026-05-11 10:27:00,770 - optuna.study.study - INFO - Trial 103 finished with value: 0.0762224332047681 and parameters: {'n_layers': 1, 'embedding_dim': 256, 'lr': 0.014442998108697024, 'lambda_val': 0.0010179049561800824, 'batch_size': 3866, 'optimizer': 'Adam'}. Best is trial 80 with value: 0.08186599952480411.
2026-05-11 10:27:38,671 - optuna.study.study - INFO - Trial 104 finished with value: 0.06724561284230898 and parameters: {'n_layers': 1, 'embedding_dim': 256, 'lr': 0.01469171820442833, 'lambda_val': 0.0030606812914411867, 'batch_size': 3858, 'optimizer': 'Adam'}. Best is trial 80 with value: 0.08186599952480411.
2026-05-11 10:28:14,411 - optuna.study.study - INFO - Trial 105 finished with value: 0.07023051707578275 and parameters: {'n_layers': 1, 'embedding_dim': 256, 'lr': 0.006049737526161597, 'lambda_val': 0.0009987999264466586, 'batch_size': 3753, 'optimizer': 'Adam'}. Best is trial 80 with value: 0.08186599952480411.
2026-05-11 10:28:46,551 - optuna.study.study - INFO - Trial 106 finished with value: 0.05456686076222611 and parameters: {'n_layers': 1, 'embedding_dim': 96, 'lr': 0.003431209948590861, 'lambda_val': 0.0006863939917275697, 'batch_size': 3982, 'optimizer': 'Adam'}. Best is trial 80 with value: 0.08186599952480411.
2026-05-11 10:28:57,057 - optuna.study._optimize - INFO - Trial 107 pruned. 
2026-05-11 10:29:02,280 - optuna.study._optimize - INFO - Trial 108 pruned. 
2026-05-11 10:29:39,829 - optuna.study.study - INFO - Trial 109 finished with value: 0.065934391353581 and parameters: {'n_layers': 1, 'embedding_dim': 256, 'lr': 0.002568630979526069, 'lambda_val': 0.00150136584183439, 'batch_size': 3920, 'optimizer': 'Adam'}. Best is trial 80 with value: 0.08186599952480411.
2026-05-11 10:29:43,668 - optuna.study._optimize - INFO - Trial 110 pruned. 
2026-05-11 10:30:21,396 - optuna.study.study - INFO - Trial 111 finished with value: 0.07644226668101692 and parameters: {'n_layers': 1, 'embedding_dim': 256, 'lr': 0.009884672562320968, 'lambda_val': 0.00047343431140043247, 'batch_size': 3645, 'optimizer': 'Adam'}. Best is trial 80 with value: 0.08186599952480411.
2026-05-11 10:30:26,101 - optuna.study._optimize - INFO - Trial 112 pruned. 
2026-05-11 10:30:30,793 - optuna.study._optimize - INFO - Trial 113 pruned. 
2026-05-11 10:30:36,149 - optuna.study._optimize - INFO - Trial 114 pruned. 
2026-05-11 10:31:13,164 - optuna.study.study - INFO - Trial 115 finished with value: 0.07118881803468126 and parameters: {'n_layers': 1, 'embedding_dim': 256, 'lr': 0.00909051331116406, 'lambda_val': 0.0009123490866714416, 'batch_size': 3329, 'optimizer': 'Adam'}. Best is trial 80 with value: 0.08186599952480411.
2026-05-11 10:31:50,578 - optuna.study.study - INFO - Trial 116 finished with value: 0.06940728964206273 and parameters: {'n_layers': 1, 'embedding_dim': 256, 'lr': 0.005028296167248077, 'lambda_val': 0.0013151728134844125, 'batch_size': 3185, 'optimizer': 'Adam'}. Best is trial 80 with value: 0.08186599952480411.
2026-05-11 10:31:55,195 - optuna.study._optimize - INFO - Trial 117 pruned. 
2026-05-11 10:32:32,593 - optuna.study.study - INFO - Trial 118 finished with value: 0.06454568891105224 and parameters: {'n_layers': 1, 'embedding_dim': 256, 'lr': 0.006920487553440714, 'lambda_val': 0.00016823271030673347, 'batch_size': 3836, 'optimizer': 'Adam'}. Best is trial 80 with value: 0.08186599952480411.
2026-05-11 10:33:10,038 - optuna.study.study - INFO - Trial 119 finished with value: 0.06962837311849353 and parameters: {'n_layers': 1, 'embedding_dim': 256, 'lr': 0.011169537643768261, 'lambda_val': 0.00026991029599894323, 'batch_size': 3662, 'optimizer': 'Adam'}. Best is trial 80 with value: 0.08186599952480411.
2026-05-11 10:33:15,313 - optuna.study._optimize - INFO - Trial 120 pruned. 
2026-05-11 10:33:20,070 - optuna.study._optimize - INFO - Trial 121 pruned. 
2026-05-11 10:33:24,903 - optuna.study._optimize - INFO - Trial 122 pruned. 
2026-05-11 10:34:00,792 - optuna.study.study - INFO - Trial 123 finished with value: 0.06924416399046886 and parameters: {'n_layers': 1, 'embedding_dim': 256, 'lr': 0.007716939293307539, 'lambda_val': 0.0010612054463538057, 'batch_size': 3509, 'optimizer': 'Adam'}. Best is trial 80 with value: 0.08186599952480411.
2026-05-11 10:34:41,234 - optuna.study.study - INFO - Trial 124 finished with value: 0.07128746760953193 and parameters: {'n_layers': 1, 'embedding_dim': 256, 'lr': 0.009943665285757531, 'lambda_val': 0.00048460896557731876, 'batch_size': 3357, 'optimizer': 'Adam'}. Best is trial 80 with value: 0.08186599952480411.
2026-05-11 10:34:48,390 - optuna.study._optimize - INFO - Trial 125 pruned. 
2026-05-11 10:34:56,243 - optuna.study._optimize - INFO - Trial 126 pruned. 
2026-05-11 10:35:18,263 - optuna.study._optimize - INFO - Trial 127 pruned. 
2026-05-11 10:35:22,710 - optuna.study._optimize - INFO - Trial 128 pruned. 
2026-05-11 10:35:27,179 - optuna.study._optimize - INFO - Trial 129 pruned. 
2026-05-11 10:35:31,959 - optuna.study._optimize - INFO - Trial 130 pruned. 
2026-05-11 10:36:09,095 - optuna.study.study - INFO - Trial 131 finished with value: 0.06825546506201177 and parameters: {'n_layers': 1, 'embedding_dim': 256, 'lr': 0.00699282290001523, 'lambda_val': 0.002451462412218272, 'batch_size': 3518, 'optimizer': 'Adam'}. Best is trial 80 with value: 0.08186599952480411.
2026-05-11 10:36:46,389 - optuna.study.study - INFO - Trial 132 finished with value: 0.0653881850248115 and parameters: {'n_layers': 1, 'embedding_dim': 256, 'lr': 0.007946276452095816, 'lambda_val': 0.0016458148330149274, 'batch_size': 3475, 'optimizer': 'Adam'}. Best is trial 80 with value: 0.08186599952480411.
2026-05-11 10:37:23,105 - optuna.study.study - INFO - Trial 133 finished with value: 0.07200806544761344 and parameters: {'n_layers': 1, 'embedding_dim': 256, 'lr': 0.008812804907631462, 'lambda_val': 0.0011461878929651705, 'batch_size': 3285, 'optimizer': 'Adam'}. Best is trial 80 with value: 0.08186599952480411.
2026-05-11 10:38:00,528 - optuna.study.study - INFO - Trial 134 finished with value: 0.07125375540410071 and parameters: {'n_layers': 1, 'embedding_dim': 256, 'lr': 0.01256711690653034, 'lambda_val': 0.000826284569771964, 'batch_size': 3373, 'optimizer': 'Adam'}. Best is trial 80 with value: 0.08186599952480411.
2026-05-11 10:38:05,360 - optuna.study._optimize - INFO - Trial 135 pruned. 
2026-05-11 10:38:10,095 - optuna.study._optimize - INFO - Trial 136 pruned. 
2026-05-11 10:38:47,837 - optuna.study.study - INFO - Trial 137 finished with value: 0.0698474698305985 and parameters: {'n_layers': 1, 'embedding_dim': 256, 'lr': 0.006476109900709324, 'lambda_val': 0.0003512666992171252, 'batch_size': 3483, 'optimizer': 'Adam'}. Best is trial 80 with value: 0.08186599952480411.
2026-05-11 10:38:51,928 - optuna.study._optimize - INFO - Trial 138 pruned. 
2026-05-11 10:38:56,600 - optuna.study._optimize - INFO - Trial 139 pruned. 
2026-05-11 10:39:01,750 - optuna.study._optimize - INFO - Trial 140 pruned. 
2026-05-11 10:39:47,111 - optuna.study.study - INFO - Trial 141 finished with value: 0.06974717399568245 and parameters: {'n_layers': 1, 'embedding_dim': 256, 'lr': 0.0048932969130158, 'lambda_val': 0.0002937890321181164, 'batch_size': 3110, 'optimizer': 'Adam'}. Best is trial 80 with value: 0.08186599952480411.
2026-05-11 10:39:51,767 - optuna.study._optimize - INFO - Trial 142 pruned. 
2026-05-11 10:39:56,657 - optuna.study._optimize - INFO - Trial 143 pruned. 
2026-05-11 10:40:19,700 - optuna.study._optimize - INFO - Trial 144 pruned. 
2026-05-11 10:40:24,508 - optuna.study._optimize - INFO - Trial 145 pruned. 
2026-05-11 10:41:02,571 - optuna.study.study - INFO - Trial 146 finished with value: 0.07367796367343322 and parameters: {'n_layers': 1, 'embedding_dim': 256, 'lr': 0.0037342963976460817, 'lambda_val': 0.001413621210080672, 'batch_size': 3285, 'optimizer': 'Adam'}. Best is trial 80 with value: 0.08186599952480411.
2026-05-11 10:41:40,124 - optuna.study.study - INFO - Trial 147 finished with value: 0.07125909016872031 and parameters: {'n_layers': 1, 'embedding_dim': 256, 'lr': 0.003667172920999418, 'lambda_val': 0.0013424697546884014, 'batch_size': 3583, 'optimizer': 'Adam'}. Best is trial 80 with value: 0.08186599952480411.
2026-05-11 10:42:24,350 - optuna.study.study - INFO - Trial 148 finished with value: 0.07225897482040007 and parameters: {'n_layers': 1, 'embedding_dim': 256, 'lr': 0.004235478855728306, 'lambda_val': 0.0008324259611992409, 'batch_size': 3312, 'optimizer': 'Adam'}. Best is trial 80 with value: 0.08186599952480411.
2026-05-11 10:42:28,895 - optuna.study._optimize - INFO - Trial 149 pruned. 
2026-05-11 10:43:06,149 - optuna.study.study - INFO - Trial 150 finished with value: 0.07008812945242052 and parameters: {'n_layers': 1, 'embedding_dim': 256, 'lr': 0.015264023028272847, 'lambda_val': 0.0026833937993824804, 'batch_size': 3780, 'optimizer': 'Adam'}. Best is trial 80 with value: 0.08186599952480411.
2026-05-11 10:43:11,263 - optuna.study._optimize - INFO - Trial 151 pruned. 
2026-05-11 10:43:48,467 - optuna.study.study - INFO - Trial 152 finished with value: 0.0655350472988928 and parameters: {'n_layers': 1, 'embedding_dim': 256, 'lr': 0.00565771743814473, 'lambda_val': 0.0014363620377375271, 'batch_size': 3363, 'optimizer': 'Adam'}. Best is trial 80 with value: 0.08186599952480411.
2026-05-11 10:44:26,455 - optuna.study.study - INFO - Trial 153 finished with value: 0.07266736805575194 and parameters: {'n_layers': 1, 'embedding_dim': 256, 'lr': 0.007113960741311189, 'lambda_val': 0.0004231751561745597, 'batch_size': 3156, 'optimizer': 'Adam'}. Best is trial 80 with value: 0.08186599952480411.
2026-05-11 10:44:31,233 - optuna.study._optimize - INFO - Trial 154 pruned. 
2026-05-11 10:45:08,544 - optuna.study.study - INFO - Trial 155 finished with value: 0.07044042940470355 and parameters: {'n_layers': 1, 'embedding_dim': 256, 'lr': 0.0002497674969086737, 'lambda_val': 0.0006670049925174347, 'batch_size': 3051, 'optimizer': 'Adam'}. Best is trial 80 with value: 0.08186599952480411.
2026-05-11 10:45:53,852 - optuna.study.study - INFO - Trial 156 finished with value: 0.060634164661102864 and parameters: {'n_layers': 1, 'embedding_dim': 128, 'lr': 0.0018648728069647236, 'lambda_val': 0.0009482120378186723, 'batch_size': 3523, 'optimizer': 'Adam'}. Best is trial 80 with value: 0.08186599952480411.
2026-05-11 10:45:58,169 - optuna.study._optimize - INFO - Trial 157 pruned. 
2026-05-11 10:46:35,626 - optuna.study.study - INFO - Trial 158 finished with value: 0.09120841290173527 and parameters: {'n_layers': 1, 'embedding_dim': 256, 'lr': 0.0001269856236490417, 'lambda_val': 0.00045328812725947606, 'batch_size': 3280, 'optimizer': 'Adam'}. Best is trial 158 with value: 0.09120841290173527.
2026-05-11 10:46:40,269 - optuna.study._optimize - INFO - Trial 159 pruned. 
2026-05-11 10:46:44,527 - optuna.study._optimize - INFO - Trial 160 pruned. 
2026-05-11 10:46:49,312 - optuna.study._optimize - INFO - Trial 161 pruned. 
2026-05-11 10:46:54,052 - optuna.study._optimize - INFO - Trial 162 pruned. 
2026-05-11 10:46:58,994 - optuna.study._optimize - INFO - Trial 163 pruned. 
2026-05-11 10:47:04,171 - optuna.study._optimize - INFO - Trial 164 pruned. 
