2026-05-11 08:18:58,940 - optuna.study.study - INFO - Trial 118 finished with value: 0.07644654820879161 and parameters: {'n_layers': 1, 'embedding_dim': 64, 'lr': 0.00027940303818946234, 'lambda_val': 0.0006474080141420573, 'batch_size': 1020, 'optimizer': 'RMSprop'}. Best is trial 34 with value: 0.12399763130383332.
2026-05-11 08:19:25,945 - optuna.study.study - INFO - Trial 119 finished with value: 0.05690740858125919 and parameters: {'n_layers': 1, 'embedding_dim': 64, 'lr': 0.0008150821536037511, 'lambda_val': 0.0006774904546019504, 'batch_size': 998, 'optimizer': 'RMSprop'}. Best is trial 34 with value: 0.12399763130383332.
2026-05-11 08:20:04,675 - optuna.study.study - INFO - Trial 120 finished with value: 0.048415648600743696 and parameters: {'n_layers': 1, 'embedding_dim': 64, 'lr': 0.0007732577115724934, 'lambda_val': 0.0006481430165127814, 'batch_size': 1237, 'optimizer': 'RMSprop'}. Best is trial 34 with value: 0.12399763130383332.
2026-05-11 08:20:31,787 - optuna.study.study - INFO - Trial 121 finished with value: 0.04208362222758622 and parameters: {'n_layers': 1, 'embedding_dim': 64, 'lr': 0.0005626497022771712, 'lambda_val': 0.0013231797301556014, 'batch_size': 1033, 'optimizer': 'RMSprop'}. Best is trial 34 with value: 0.12399763130383332.
2026-05-11 08:21:01,452 - optuna.study.study - INFO - Trial 122 finished with value: 0.057778867093236354 and parameters: {'n_layers': 1, 'embedding_dim': 64, 'lr': 0.0002895288139863711, 'lambda_val': 0.002087480669892142, 'batch_size': 987, 'optimizer': 'RMSprop'}. Best is trial 34 with value: 0.12399763130383332.
2026-05-11 08:21:29,633 - optuna.study.study - INFO - Trial 123 finished with value: 0.04846690367532688 and parameters: {'n_layers': 1, 'embedding_dim': 64, 'lr': 0.0009553138763293101, 'lambda_val': 0.00037843566766145097, 'batch_size': 992, 'optimizer': 'RMSprop'}. Best is trial 34 with value: 0.12399763130383332.
2026-05-11 08:22:03,900 - optuna.study.study - INFO - Trial 124 finished with value: 0.08002510719065735 and parameters: {'n_layers': 1, 'embedding_dim': 64, 'lr': 0.00028242578440805364, 'lambda_val': 0.0007778711242929051, 'batch_size': 1082, 'optimizer': 'RMSprop'}. Best is trial 34 with value: 0.12399763130383332.
2026-05-11 08:22:32,812 - optuna.study.study - INFO - Trial 125 finished with value: 0.06721385481239801 and parameters: {'n_layers': 1, 'embedding_dim': 64, 'lr': 0.0002855662487268773, 'lambda_val': 0.0021225141937829426, 'batch_size': 1083, 'optimizer': 'RMSprop'}. Best is trial 34 with value: 0.12399763130383332.
2026-05-11 08:23:04,760 - optuna.study.study - INFO - Trial 126 finished with value: 0.06076021638547749 and parameters: {'n_layers': 1, 'embedding_dim': 64, 'lr': 0.0003386649801487391, 'lambda_val': 0.0005085594924100411, 'batch_size': 1462, 'optimizer': 'RMSprop'}. Best is trial 34 with value: 0.12399763130383332.
2026-05-11 08:23:32,815 - optuna.study.study - INFO - Trial 127 finished with value: 0.057989274582886614 and parameters: {'n_layers': 1, 'embedding_dim': 64, 'lr': 0.00037193633626943397, 'lambda_val': 0.0009007272846897089, 'batch_size': 1140, 'optimizer': 'RMSprop'}. Best is trial 34 with value: 0.12399763130383332.
2026-05-11 08:24:07,864 - optuna.study.study - INFO - Trial 128 finished with value: 0.06444080227222437 and parameters: {'n_layers': 1, 'embedding_dim': 64, 'lr': 0.00031001286858937287, 'lambda_val': 0.0004921153953210473, 'batch_size': 1339, 'optimizer': 'RMSprop'}. Best is trial 34 with value: 0.12399763130383332.
2026-05-11 08:24:35,006 - optuna.study.study - INFO - Trial 129 finished with value: 0.0682337390440669 and parameters: {'n_layers': 1, 'embedding_dim': 64, 'lr': 0.000282621532197017, 'lambda_val': 0.0005208038212869989, 'batch_size': 1481, 'optimizer': 'RMSprop'}. Best is trial 34 with value: 0.12399763130383332.
2026-05-11 08:25:14,047 - optuna.study.study - INFO - Trial 130 finished with value: 0.06368584233899593 and parameters: {'n_layers': 1, 'embedding_dim': 64, 'lr': 0.00028043504357542213, 'lambda_val': 0.0011697294084213757, 'batch_size': 1468, 'optimizer': 'RMSprop'}. Best is trial 34 with value: 0.12399763130383332.
2026-05-11 08:25:43,636 - optuna.study.study - INFO - Trial 131 finished with value: 0.08157992760790232 and parameters: {'n_layers': 1, 'embedding_dim': 64, 'lr': 0.0002678259915701528, 'lambda_val': 0.0012425797435816587, 'batch_size': 1494, 'optimizer': 'RMSprop'}. Best is trial 34 with value: 0.12399763130383332.
2026-05-11 08:26:11,315 - optuna.study.study - INFO - Trial 132 finished with value: 0.0539928584613783 and parameters: {'n_layers': 1, 'embedding_dim': 64, 'lr': 0.0002728194630453511, 'lambda_val': 0.0011821723032984619, 'batch_size': 1663, 'optimizer': 'RMSprop'}. Best is trial 34 with value: 0.12399763130383332.
2026-05-11 08:26:15,048 - optuna.study._optimize - INFO - Trial 133 pruned. 
2026-05-11 08:26:50,978 - optuna.study.study - INFO - Trial 134 finished with value: 0.06650511933681852 and parameters: {'n_layers': 1, 'embedding_dim': 64, 'lr': 0.0003034227528664584, 'lambda_val': 0.0007079346225430943, 'batch_size': 1323, 'optimizer': 'RMSprop'}. Best is trial 34 with value: 0.12399763130383332.
2026-05-11 08:27:18,928 - optuna.study.study - INFO - Trial 135 finished with value: 0.06394083477258936 and parameters: {'n_layers': 1, 'embedding_dim': 64, 'lr': 0.000294264078390085, 'lambda_val': 0.0007512819258694407, 'batch_size': 1321, 'optimizer': 'RMSprop'}. Best is trial 34 with value: 0.12399763130383332.
2026-05-11 08:27:58,219 - optuna.study.study - INFO - Trial 136 finished with value: 0.09219320746387277 and parameters: {'n_layers': 1, 'embedding_dim': 64, 'lr': 0.0002093024071132224, 'lambda_val': 0.0027828064401727126, 'batch_size': 1310, 'optimizer': 'RMSprop'}. Best is trial 34 with value: 0.12399763130383332.
2026-05-11 08:28:02,286 - optuna.study._optimize - INFO - Trial 137 pruned. 
2026-05-11 08:28:38,333 - optuna.study.study - INFO - Trial 138 finished with value: 0.05481558004164261 and parameters: {'n_layers': 1, 'embedding_dim': 64, 'lr': 0.00031445231524324465, 'lambda_val': 0.0031152597189772232, 'batch_size': 1357, 'optimizer': 'RMSprop'}. Best is trial 34 with value: 0.12399763130383332.
2026-05-11 08:29:04,221 - optuna.study.study - INFO - Trial 139 finished with value: 0.04163969729594538 and parameters: {'n_layers': 1, 'embedding_dim': 64, 'lr': 0.0003849546800462127, 'lambda_val': 0.0018874277393593052, 'batch_size': 1259, 'optimizer': 'RMSprop'}. Best is trial 34 with value: 0.12399763130383332.
2026-05-11 08:29:27,368 - optuna.study.study - INFO - Trial 140 finished with value: 0.08567148464031711 and parameters: {'n_layers': 1, 'embedding_dim': 64, 'lr': 0.0002444854841451835, 'lambda_val': 0.0008482851473995981, 'batch_size': 1363, 'optimizer': 'RMSprop'}. Best is trial 34 with value: 0.12399763130383332.
2026-05-11 08:29:49,914 - optuna.study.study - INFO - Trial 141 finished with value: 0.07359744805270717 and parameters: {'n_layers': 1, 'embedding_dim': 64, 'lr': 0.00025322501920674057, 'lambda_val': 0.0004086549085288572, 'batch_size': 1425, 'optimizer': 'RMSprop'}. Best is trial 34 with value: 0.12399763130383332.
2026-05-11 08:30:20,374 - optuna.study.study - INFO - Trial 142 finished with value: 0.053998123247399304 and parameters: {'n_layers': 1, 'embedding_dim': 64, 'lr': 0.00024846911578008183, 'lambda_val': 0.004427692831030061, 'batch_size': 1217, 'optimizer': 'RMSprop'}. Best is trial 34 with value: 0.12399763130383332.
2026-05-11 08:30:23,897 - optuna.study._optimize - INFO - Trial 143 pruned. 
2026-05-11 08:30:46,969 - optuna.study.study - INFO - Trial 144 finished with value: 0.0998098846641434 and parameters: {'n_layers': 1, 'embedding_dim': 64, 'lr': 0.0002232010654013348, 'lambda_val': 0.0001965952729529113, 'batch_size': 1413, 'optimizer': 'RMSprop'}. Best is trial 34 with value: 0.12399763130383332.
2026-05-11 08:31:10,528 - optuna.study.study - INFO - Trial 145 finished with value: 0.10350556772300193 and parameters: {'n_layers': 1, 'embedding_dim': 64, 'lr': 0.00022176964730489967, 'lambda_val': 0.0001964351875203193, 'batch_size': 1399, 'optimizer': 'RMSprop'}. Best is trial 34 with value: 0.12399763130383332.
2026-05-11 08:31:16,552 - optuna.study._optimize - INFO - Trial 146 pruned. 
2026-05-11 08:31:39,228 - optuna.study.study - INFO - Trial 147 finished with value: 0.06911330677988244 and parameters: {'n_layers': 1, 'embedding_dim': 64, 'lr': 0.0002569335370509454, 'lambda_val': 0.00014112274912744265, 'batch_size': 1425, 'optimizer': 'RMSprop'}. Best is trial 34 with value: 0.12399763130383332.
2026-05-11 08:31:42,922 - optuna.study._optimize - INFO - Trial 148 pruned. 
2026-05-11 08:31:46,450 - optuna.study._optimize - INFO - Trial 149 pruned. 
2026-05-11 08:32:27,224 - optuna.study.study - INFO - Trial 150 finished with value: 0.06953716985552563 and parameters: {'n_layers': 1, 'embedding_dim': 64, 'lr': 0.00022342635773311932, 'lambda_val': 0.00021350998025112283, 'batch_size': 1610, 'optimizer': 'RMSprop'}. Best is trial 34 with value: 0.12399763130383332.
2026-05-11 08:32:31,142 - optuna.study._optimize - INFO - Trial 151 pruned. 
2026-05-11 08:32:35,059 - optuna.study._optimize - INFO - Trial 152 pruned. 
2026-05-11 08:33:13,449 - optuna.study.study - INFO - Trial 153 finished with value: 0.06130830013693122 and parameters: {'n_layers': 1, 'embedding_dim': 64, 'lr': 0.00037676439919328837, 'lambda_val': 0.00015289812122068334, 'batch_size': 1399, 'optimizer': 'RMSprop'}. Best is trial 34 with value: 0.12399763130383332.
2026-05-11 08:33:17,014 - optuna.study._optimize - INFO - Trial 154 pruned. 
2026-05-11 08:33:20,768 - optuna.study._optimize - INFO - Trial 155 pruned. 
2026-05-11 08:33:24,136 - optuna.study._optimize - INFO - Trial 156 pruned. 
2026-05-11 08:33:27,448 - optuna.study._optimize - INFO - Trial 157 pruned. 
2026-05-11 08:33:30,970 - optuna.study._optimize - INFO - Trial 158 pruned. 
2026-05-11 08:33:36,382 - optuna.study._optimize - INFO - Trial 159 pruned. 
2026-05-11 08:33:39,904 - optuna.study._optimize - INFO - Trial 160 pruned. 
2026-05-11 08:34:04,189 - optuna.study.study - INFO - Trial 161 finished with value: 0.07669814930016862 and parameters: {'n_layers': 1, 'embedding_dim': 64, 'lr': 0.00024795478919003054, 'lambda_val': 0.001547349810565573, 'batch_size': 1092, 'optimizer': 'RMSprop'}. Best is trial 34 with value: 0.12399763130383332.
2026-05-11 08:34:32,305 - optuna.study.study - INFO - Trial 162 finished with value: 0.060749061105195595 and parameters: {'n_layers': 1, 'embedding_dim': 64, 'lr': 0.00034539272542325616, 'lambda_val': 0.0013272808815798902, 'batch_size': 1247, 'optimizer': 'RMSprop'}. Best is trial 34 with value: 0.12399763130383332.
2026-05-11 08:34:36,041 - optuna.study._optimize - INFO - Trial 163 pruned. 
2026-05-11 08:34:39,371 - optuna.study._optimize - INFO - Trial 164 pruned. 
2026-05-11 08:35:01,849 - optuna.study.study - INFO - Trial 165 finished with value: 0.0699614174041857 and parameters: {'n_layers': 1, 'embedding_dim': 64, 'lr': 0.0002611117864957767, 'lambda_val': 0.0005762373444415482, 'batch_size': 1127, 'optimizer': 'RMSprop'}. Best is trial 34 with value: 0.12399763130383332.
2026-05-11 08:35:27,425 - optuna.study.study - INFO - Trial 166 finished with value: 0.04980172705785504 and parameters: {'n_layers': 1, 'embedding_dim': 64, 'lr': 0.0005367138148635563, 'lambda_val': 0.00020637312414219653, 'batch_size': 1108, 'optimizer': 'RMSprop'}. Best is trial 34 with value: 0.12399763130383332.
2026-05-11 08:36:01,502 - optuna.study.study - INFO - Trial 167 finished with value: 0.09361691570287081 and parameters: {'n_layers': 1, 'embedding_dim': 64, 'lr': 0.00024068719214006407, 'lambda_val': 0.000382264019470774, 'batch_size': 1175, 'optimizer': 'RMSprop'}. Best is trial 34 with value: 0.12399763130383332.
2026-05-11 08:36:05,608 - optuna.study._optimize - INFO - Trial 168 pruned. 
2026-05-11 08:36:09,583 - optuna.study._optimize - INFO - Trial 169 pruned. 
2026-05-11 08:36:15,892 - optuna.study._optimize - INFO - Trial 170 pruned. 
2026-05-11 08:36:43,801 - optuna.study.study - INFO - Trial 171 finished with value: 0.07347876551989085 and parameters: {'n_layers': 1, 'embedding_dim': 64, 'lr': 0.0002606775259338705, 'lambda_val': 0.0006195778124966695, 'batch_size': 1322, 'optimizer': 'RMSprop'}. Best is trial 34 with value: 0.12399763130383332.
2026-05-11 08:37:11,842 - optuna.study.study - INFO - Trial 172 finished with value: 0.05686628358113202 and parameters: {'n_layers': 1, 'embedding_dim': 64, 'lr': 0.00036838215117183763, 'lambda_val': 0.0006191765185879122, 'batch_size': 1052, 'optimizer': 'RMSprop'}. Best is trial 34 with value: 0.12399763130383332.
2026-05-11 08:37:50,571 - optuna.study.study - INFO - Trial 173 finished with value: 0.08308110569916789 and parameters: {'n_layers': 1, 'embedding_dim': 64, 'lr': 0.0002552930869414912, 'lambda_val': 0.0010632389657803558, 'batch_size': 1325, 'optimizer': 'RMSprop'}. Best is trial 34 with value: 0.12399763130383332.
2026-05-11 08:37:54,722 - optuna.study._optimize - INFO - Trial 174 pruned. 
2026-05-11 08:38:27,209 - optuna.study.study - INFO - Trial 175 finished with value: 0.07473055624476382 and parameters: {'n_layers': 1, 'embedding_dim': 64, 'lr': 0.0002687127829857728, 'lambda_val': 0.0013458645127170925, 'batch_size': 1216, 'optimizer': 'RMSprop'}. Best is trial 34 with value: 0.12399763130383332.
2026-05-11 08:38:31,581 - optuna.study._optimize - INFO - Trial 176 pruned. 
2026-05-11 08:38:35,798 - optuna.study._optimize - INFO - Trial 177 pruned. 
2026-05-11 08:39:04,871 - optuna.study.study - INFO - Trial 178 finished with value: 0.06384619568934624 and parameters: {'n_layers': 1, 'embedding_dim': 32, 'lr': 0.0004488239500783603, 'lambda_val': 0.0007834932567198311, 'batch_size': 885, 'optimizer': 'RMSprop'}. Best is trial 34 with value: 0.12399763130383332.
2026-05-11 08:39:28,509 - optuna.study.study - INFO - Trial 179 finished with value: 0.0751117771409145 and parameters: {'n_layers': 1, 'embedding_dim': 64, 'lr': 0.0002713224979692609, 'lambda_val': 0.0011214589995033855, 'batch_size': 1221, 'optimizer': 'RMSprop'}. Best is trial 34 with value: 0.12399763130383332.
2026-05-11 08:39:51,340 - optuna.study.study - INFO - Trial 180 finished with value: 0.06191959982268432 and parameters: {'n_layers': 1, 'embedding_dim': 64, 'lr': 0.00033140108430658926, 'lambda_val': 0.0011760106641745163, 'batch_size': 1059, 'optimizer': 'RMSprop'}. Best is trial 34 with value: 0.12399763130383332.
2026-05-11 08:40:22,252 - optuna.study.study - INFO - Trial 181 finished with value: 0.07407917584187823 and parameters: {'n_layers': 1, 'embedding_dim': 64, 'lr': 0.00024697197629529934, 'lambda_val': 0.0009686919075330388, 'batch_size': 1266, 'optimizer': 'RMSprop'}. Best is trial 34 with value: 0.12399763130383332.
2026-05-11 08:40:26,941 - optuna.study._optimize - INFO - Trial 182 pruned. 
2026-05-11 08:40:51,753 - optuna.study.study - INFO - Trial 183 finished with value: 0.06726758314905308 and parameters: {'n_layers': 1, 'embedding_dim': 64, 'lr': 0.0002799236014896343, 'lambda_val': 0.001042881535837624, 'batch_size': 1160, 'optimizer': 'RMSprop'}. Best is trial 34 with value: 0.12399763130383332.
2026-05-11 08:40:55,085 - optuna.study._optimize - INFO - Trial 184 pruned. 
2026-05-11 08:41:24,672 - optuna.study.study - INFO - Trial 185 finished with value: 0.05668263059450168 and parameters: {'n_layers': 1, 'embedding_dim': 64, 'lr': 0.00040494656803794263, 'lambda_val': 0.0009596306386912595, 'batch_size': 960, 'optimizer': 'RMSprop'}. Best is trial 34 with value: 0.12399763130383332.
2026-05-11 08:41:53,962 - optuna.study.study - INFO - Trial 186 finished with value: 0.07181253095714259 and parameters: {'n_layers': 1, 'embedding_dim': 64, 'lr': 0.0003183952013978075, 'lambda_val': 0.0004343869236352229, 'batch_size': 1274, 'optimizer': 'RMSprop'}. Best is trial 34 with value: 0.12399763130383332.
2026-05-11 08:41:58,389 - optuna.study._optimize - INFO - Trial 187 pruned. 
2026-05-11 08:42:02,365 - optuna.study._optimize - INFO - Trial 188 pruned. 
2026-05-11 08:42:06,694 - optuna.study._optimize - INFO - Trial 189 pruned. 
2026-05-11 08:42:10,979 - optuna.study._optimize - INFO - Trial 190 pruned. 
2026-05-11 08:42:49,757 - optuna.study.study - INFO - Trial 191 finished with value: 0.07498418456946232 and parameters: {'n_layers': 1, 'embedding_dim': 64, 'lr': 0.0002707516673952275, 'lambda_val': 0.0006226018196562766, 'batch_size': 1338, 'optimizer': 'RMSprop'}. Best is trial 34 with value: 0.12399763130383332.
2026-05-11 08:42:53,752 - optuna.study._optimize - INFO - Trial 192 pruned. 
2026-05-11 08:42:58,159 - optuna.study._optimize - INFO - Trial 193 pruned. 
2026-05-11 08:43:26,526 - optuna.study.study - INFO - Trial 194 finished with value: 0.07713717135066324 and parameters: {'n_layers': 1, 'embedding_dim': 96, 'lr': 0.00021435068362513388, 'lambda_val': 0.0019922682048520548, 'batch_size': 1185, 'optimizer': 'RMSprop'}. Best is trial 34 with value: 0.12399763130383332.
2026-05-11 08:43:55,363 - optuna.study.study - INFO - Trial 195 finished with value: 0.10096884978192881 and parameters: {'n_layers': 1, 'embedding_dim': 96, 'lr': 0.00020396550668925505, 'lambda_val': 0.0012810708197509484, 'batch_size': 1150, 'optimizer': 'RMSprop'}. Best is trial 34 with value: 0.12399763130383332.
2026-05-11 08:43:59,437 - optuna.study._optimize - INFO - Trial 196 pruned. 
2026-05-11 08:44:03,700 - optuna.study._optimize - INFO - Trial 197 pruned. 
2026-05-11 08:44:32,597 - optuna.study.study - INFO - Trial 198 finished with value: 0.061819364919199135 and parameters: {'n_layers': 1, 'embedding_dim': 96, 'lr': 0.0003145945877663898, 'lambda_val': 0.001235263518233615, 'batch_size': 1016, 'optimizer': 'RMSprop'}. Best is trial 34 with value: 0.12399763130383332.
2026-05-11 08:44:36,327 - optuna.study._optimize - INFO - Trial 199 pruned. 
2026-05-11 08:45:03,573 - root - INFO -   **** Training e_100K_1c2dcs_rand5
2026-05-11 08:45:03,583 - root - INFO -   **** Getting 54402/65410 random edges
2026-05-11 08:45:03,689 - optuna.storages._rdb.storage - INFO - A new study created in RDB with name: Study_e_100K_1c2dcs_rand5
2026-05-11 08:45:53,635 - optuna.study.study - INFO - Trial 0 finished with value: 0.010201029168651581 and parameters: {'n_layers': 4, 'embedding_dim': 128, 'lr': 2.722457256010849e-05, 'lambda_val': 0.042237078249280094, 'batch_size': 3918, 'optimizer': 'RMSprop'}. Best is trial 0 with value: 0.010201029168651581.
2026-05-11 08:46:35,505 - optuna.study.study - INFO - Trial 1 finished with value: 0.002562304223801642 and parameters: {'n_layers': 2, 'embedding_dim': 256, 'lr': 0.010628817348072056, 'lambda_val': 1.0911619984068993e-05, 'batch_size': 574, 'optimizer': 'SGD'}. Best is trial 0 with value: 0.010201029168651581.
2026-05-11 08:47:26,629 - optuna.study.study - INFO - Trial 2 finished with value: 0.007854069488072778 and parameters: {'n_layers': 4, 'embedding_dim': 128, 'lr': 8.478224221707448e-05, 'lambda_val': 0.0012706619508786117, 'batch_size': 3282, 'optimizer': 'RMSprop'}. Best is trial 0 with value: 0.010201029168651581.
2026-05-11 08:48:07,843 - optuna.study.study - INFO - Trial 3 finished with value: 0.02042680532732561 and parameters: {'n_layers': 3, 'embedding_dim': 128, 'lr': 0.008675305701282943, 'lambda_val': 0.014649656785984783, 'batch_size': 2664, 'optimizer': 'Adam'}. Best is trial 3 with value: 0.02042680532732561.
2026-05-11 08:48:43,159 - optuna.study.study - INFO - Trial 4 finished with value: 0.002838342371287694 and parameters: {'n_layers': 3, 'embedding_dim': 32, 'lr': 0.0005373813947801231, 'lambda_val': 8.348375813878667e-05, 'batch_size': 3312, 'optimizer': 'SGD'}. Best is trial 3 with value: 0.02042680532732561.
2026-05-11 08:49:46,255 - optuna.study.study - INFO - Trial 5 finished with value: 0.022621868476663507 and parameters: {'n_layers': 4, 'embedding_dim': 128, 'lr': 0.004724527820296432, 'lambda_val': 1.5764959481493418e-06, 'batch_size': 2323, 'optimizer': 'Adam'}. Best is trial 5 with value: 0.022621868476663507.
2026-05-11 08:50:35,126 - optuna.study.study - INFO - Trial 6 finished with value: 0.05481944892969492 and parameters: {'n_layers': 1, 'embedding_dim': 96, 'lr': 0.0014663813748108168, 'lambda_val': 5.2773574764729095e-05, 'batch_size': 2332, 'optimizer': 'Adam'}. Best is trial 6 with value: 0.05481944892969492.
2026-05-11 08:51:13,324 - optuna.study.study - INFO - Trial 7 finished with value: 0.021125263189844364 and parameters: {'n_layers': 2, 'embedding_dim': 64, 'lr': 0.00016563477647691597, 'lambda_val': 0.0007969750994415924, 'batch_size': 2581, 'optimizer': 'RMSprop'}. Best is trial 6 with value: 0.05481944892969492.
2026-05-11 08:51:53,669 - optuna.study.study - INFO - Trial 8 finished with value: 0.02374559012015447 and parameters: {'n_layers': 4, 'embedding_dim': 96, 'lr': 0.0030793624134518257, 'lambda_val': 2.56481967168014e-05, 'batch_size': 1618, 'optimizer': 'Adam'}. Best is trial 6 with value: 0.05481944892969492.
2026-05-11 08:51:58,881 - optuna.study._optimize - INFO - Trial 9 pruned. 
2026-05-11 08:52:27,347 - optuna.study.study - INFO - Trial 10 finished with value: 0.02058563211582681 and parameters: {'n_layers': 1, 'embedding_dim': 96, 'lr': 0.0752794524870006, 'lambda_val': 1.814227648656675e-06, 'batch_size': 1570, 'optimizer': 'Adam'}. Best is trial 6 with value: 0.05481944892969492.
2026-05-11 08:53:01,632 - optuna.study.study - INFO - Trial 11 finished with value: 0.050853983523422006 and parameters: {'n_layers': 1, 'embedding_dim': 96, 'lr': 0.001265718590154724, 'lambda_val': 8.808751110589136e-05, 'batch_size': 1622, 'optimizer': 'Adam'}. Best is trial 6 with value: 0.05481944892969492.
