2026-05-10 23:09:42,481 - optuna.study.study - INFO - Trial 68 finished with value: 0.06354491093605609 and parameters: {'n_layers': 1, 'embedding_dim': 128, 'lr': 0.0002600467582162616, 'lambda_val': 2.3951810197485966e-05, 'batch_size': 2636, 'optimizer': 'RMSprop'}. Best is trial 19 with value: 0.1315657637592616.
2026-05-10 23:09:49,161 - optuna.study._optimize - INFO - Trial 69 pruned. 
2026-05-10 23:09:52,746 - optuna.study._optimize - INFO - Trial 70 pruned. 
2026-05-10 23:10:26,242 - optuna.study.study - INFO - Trial 71 finished with value: 0.0725484569404207 and parameters: {'n_layers': 1, 'embedding_dim': 256, 'lr': 0.00029350206764563525, 'lambda_val': 5.113339241159154e-06, 'batch_size': 1968, 'optimizer': 'Adam'}. Best is trial 19 with value: 0.1315657637592616.
2026-05-10 23:10:30,167 - optuna.study._optimize - INFO - Trial 72 pruned. 
2026-05-10 23:11:03,269 - optuna.study.study - INFO - Trial 73 finished with value: 0.06599064029013242 and parameters: {'n_layers': 1, 'embedding_dim': 256, 'lr': 0.0004002659781353215, 'lambda_val': 0.00010359444974473895, 'batch_size': 1852, 'optimizer': 'RMSprop'}. Best is trial 19 with value: 0.1315657637592616.
2026-05-10 23:11:07,476 - optuna.study._optimize - INFO - Trial 74 pruned. 
2026-05-10 23:11:44,572 - optuna.study.study - INFO - Trial 75 finished with value: 0.0731156295803486 and parameters: {'n_layers': 1, 'embedding_dim': 256, 'lr': 0.00023989817576539218, 'lambda_val': 0.0001651642073031839, 'batch_size': 1336, 'optimizer': 'RMSprop'}. Best is trial 19 with value: 0.1315657637592616.
2026-05-10 23:12:25,955 - optuna.study.study - INFO - Trial 76 finished with value: 0.06484606680999634 and parameters: {'n_layers': 1, 'embedding_dim': 256, 'lr': 0.000515462162235746, 'lambda_val': 2.122124864570398e-05, 'batch_size': 1504, 'optimizer': 'RMSprop'}. Best is trial 19 with value: 0.1315657637592616.
2026-05-10 23:13:00,739 - optuna.study.study - INFO - Trial 77 finished with value: 0.06557012226295915 and parameters: {'n_layers': 1, 'embedding_dim': 256, 'lr': 0.00031023961109961364, 'lambda_val': 3.144089487999457e-06, 'batch_size': 2054, 'optimizer': 'Adam'}. Best is trial 19 with value: 0.1315657637592616.
2026-05-10 23:13:04,820 - optuna.study._optimize - INFO - Trial 78 pruned. 
2026-05-10 23:13:08,200 - optuna.study._optimize - INFO - Trial 79 pruned. 
2026-05-10 23:13:13,269 - optuna.study._optimize - INFO - Trial 80 pruned. 
2026-05-10 23:13:17,451 - optuna.study._optimize - INFO - Trial 81 pruned. 
2026-05-10 23:13:51,305 - optuna.study.study - INFO - Trial 82 finished with value: 0.07912818602836011 and parameters: {'n_layers': 1, 'embedding_dim': 256, 'lr': 0.0002343053084250035, 'lambda_val': 0.0001231516457841511, 'batch_size': 1151, 'optimizer': 'RMSprop'}. Best is trial 19 with value: 0.1315657637592616.
2026-05-10 23:14:24,787 - optuna.study.study - INFO - Trial 83 finished with value: 0.1174337595541705 and parameters: {'n_layers': 1, 'embedding_dim': 256, 'lr': 0.00019711934786187756, 'lambda_val': 0.00012308922571297826, 'batch_size': 597, 'optimizer': 'RMSprop'}. Best is trial 19 with value: 0.1315657637592616.
2026-05-10 23:14:58,123 - optuna.study.study - INFO - Trial 84 finished with value: 0.09487184018339397 and parameters: {'n_layers': 1, 'embedding_dim': 256, 'lr': 0.00019503065792305854, 'lambda_val': 0.00011719790525791978, 'batch_size': 963, 'optimizer': 'RMSprop'}. Best is trial 19 with value: 0.1315657637592616.
2026-05-10 23:15:02,570 - optuna.study._optimize - INFO - Trial 85 pruned. 
2026-05-10 23:15:06,121 - optuna.study._optimize - INFO - Trial 86 pruned. 
2026-05-10 23:15:09,917 - optuna.study._optimize - INFO - Trial 87 pruned. 
2026-05-10 23:15:13,977 - optuna.study._optimize - INFO - Trial 88 pruned. 
2026-05-10 23:15:42,397 - optuna.study.study - INFO - Trial 89 finished with value: 0.122246945807872 and parameters: {'n_layers': 1, 'embedding_dim': 128, 'lr': 0.00023711989685842004, 'lambda_val': 8.003947632530938e-05, 'batch_size': 597, 'optimizer': 'RMSprop'}. Best is trial 19 with value: 0.1315657637592616.
2026-05-10 23:15:46,021 - optuna.study._optimize - INFO - Trial 90 pruned. 
2026-05-10 23:15:49,805 - optuna.study._optimize - INFO - Trial 91 pruned. 
2026-05-10 23:16:17,678 - optuna.study.study - INFO - Trial 92 finished with value: 0.09521055352421226 and parameters: {'n_layers': 1, 'embedding_dim': 128, 'lr': 0.00025152380188076125, 'lambda_val': 8.105769911193395e-05, 'batch_size': 870, 'optimizer': 'RMSprop'}. Best is trial 19 with value: 0.1315657637592616.
2026-05-10 23:16:22,645 - optuna.study._optimize - INFO - Trial 93 pruned. 
2026-05-10 23:16:50,429 - optuna.study.study - INFO - Trial 94 finished with value: 0.05481829751899833 and parameters: {'n_layers': 1, 'embedding_dim': 128, 'lr': 0.0003474964743093503, 'lambda_val': 0.0002161798329372227, 'batch_size': 885, 'optimizer': 'RMSprop'}. Best is trial 19 with value: 0.1315657637592616.
2026-05-10 23:17:00,169 - optuna.study._optimize - INFO - Trial 95 pruned. 
2026-05-10 23:17:03,853 - optuna.study._optimize - INFO - Trial 96 pruned. 
2026-05-10 23:17:07,440 - optuna.study._optimize - INFO - Trial 97 pruned. 
2026-05-10 23:17:11,781 - optuna.study._optimize - INFO - Trial 98 pruned. 
2026-05-10 23:17:37,750 - optuna.study.study - INFO - Trial 99 finished with value: 0.05005788078402448 and parameters: {'n_layers': 1, 'embedding_dim': 32, 'lr': 0.000471654148603273, 'lambda_val': 0.0005609912897217368, 'batch_size': 1094, 'optimizer': 'RMSprop'}. Best is trial 19 with value: 0.1315657637592616.
2026-05-10 23:18:08,724 - optuna.study.study - INFO - Trial 100 finished with value: 0.08220820620161307 and parameters: {'n_layers': 1, 'embedding_dim': 128, 'lr': 0.0003317256486386875, 'lambda_val': 7.730084664030936e-05, 'batch_size': 630, 'optimizer': 'RMSprop'}. Best is trial 19 with value: 0.1315657637592616.
2026-05-10 23:18:36,964 - optuna.study.study - INFO - Trial 101 finished with value: 0.0716246275274095 and parameters: {'n_layers': 1, 'embedding_dim': 128, 'lr': 0.00034991039688064124, 'lambda_val': 7.599362119680899e-05, 'batch_size': 643, 'optimizer': 'RMSprop'}. Best is trial 19 with value: 0.1315657637592616.
2026-05-10 23:18:40,529 - optuna.study._optimize - INFO - Trial 102 pruned. 
2026-05-10 23:19:08,847 - optuna.study.study - INFO - Trial 103 finished with value: 0.07629177072743336 and parameters: {'n_layers': 1, 'embedding_dim': 128, 'lr': 0.00028398390490654745, 'lambda_val': 0.0003307694752913795, 'batch_size': 865, 'optimizer': 'RMSprop'}. Best is trial 19 with value: 0.1315657637592616.
2026-05-10 23:19:14,305 - optuna.study._optimize - INFO - Trial 104 pruned. 
2026-05-10 23:19:21,206 - optuna.study._optimize - INFO - Trial 105 pruned. 
2026-05-10 23:19:25,570 - optuna.study._optimize - INFO - Trial 106 pruned. 
2026-05-10 23:19:29,040 - optuna.study._optimize - INFO - Trial 107 pruned. 
2026-05-10 23:20:02,633 - optuna.study.study - INFO - Trial 108 finished with value: 0.0741261362226772 and parameters: {'n_layers': 1, 'embedding_dim': 256, 'lr': 0.0003886316586850811, 'lambda_val': 0.00026560859191461267, 'batch_size': 872, 'optimizer': 'RMSprop'}. Best is trial 19 with value: 0.1315657637592616.
2026-05-10 23:20:07,558 - optuna.study._optimize - INFO - Trial 109 pruned. 
2026-05-10 23:20:11,391 - optuna.study._optimize - INFO - Trial 110 pruned. 
2026-05-10 23:20:44,110 - optuna.study.study - INFO - Trial 111 finished with value: 0.0824527731748119 and parameters: {'n_layers': 1, 'embedding_dim': 256, 'lr': 0.00024043779518878768, 'lambda_val': 3.648368599923854e-05, 'batch_size': 1235, 'optimizer': 'RMSprop'}. Best is trial 19 with value: 0.1315657637592616.
2026-05-10 23:21:16,905 - optuna.study.study - INFO - Trial 112 finished with value: 0.06996845203464346 and parameters: {'n_layers': 1, 'embedding_dim': 256, 'lr': 0.0003218258444181335, 'lambda_val': 7.377978460166e-05, 'batch_size': 1081, 'optimizer': 'RMSprop'}. Best is trial 19 with value: 0.1315657637592616.
2026-05-10 23:21:49,673 - optuna.study.study - INFO - Trial 113 finished with value: 0.07557721983405398 and parameters: {'n_layers': 1, 'embedding_dim': 256, 'lr': 0.00026008169770658316, 'lambda_val': 3.883959766409841e-05, 'batch_size': 1370, 'optimizer': 'RMSprop'}. Best is trial 19 with value: 0.1315657637592616.
2026-05-10 23:22:22,457 - optuna.study.study - INFO - Trial 114 finished with value: 0.09476762284317254 and parameters: {'n_layers': 1, 'embedding_dim': 256, 'lr': 0.00018655013362747254, 'lambda_val': 9.292988161166462e-05, 'batch_size': 1218, 'optimizer': 'RMSprop'}. Best is trial 19 with value: 0.1315657637592616.
2026-05-10 23:22:26,973 - optuna.study._optimize - INFO - Trial 115 pruned. 
2026-05-10 23:22:31,037 - optuna.study._optimize - INFO - Trial 116 pruned. 
2026-05-10 23:22:34,559 - optuna.study._optimize - INFO - Trial 117 pruned. 
2026-05-10 23:22:38,669 - optuna.study._optimize - INFO - Trial 118 pruned. 
2026-05-10 23:22:42,833 - optuna.study._optimize - INFO - Trial 119 pruned. 
2026-05-10 23:22:46,334 - optuna.study._optimize - INFO - Trial 120 pruned. 
2026-05-10 23:23:19,071 - optuna.study.study - INFO - Trial 121 finished with value: 0.08255521849734157 and parameters: {'n_layers': 1, 'embedding_dim': 256, 'lr': 0.0002466154428192141, 'lambda_val': 0.00012054974246311908, 'batch_size': 1150, 'optimizer': 'RMSprop'}. Best is trial 19 with value: 0.1315657637592616.
2026-05-10 23:23:52,452 - optuna.study.study - INFO - Trial 122 finished with value: 0.08067722610777021 and parameters: {'n_layers': 1, 'embedding_dim': 256, 'lr': 0.00020288432290607275, 'lambda_val': 0.00020067597189403792, 'batch_size': 1414, 'optimizer': 'RMSprop'}. Best is trial 19 with value: 0.1315657637592616.
2026-05-10 23:23:56,593 - optuna.study._optimize - INFO - Trial 123 pruned. 
2026-05-10 23:24:00,658 - optuna.study._optimize - INFO - Trial 124 pruned. 
2026-05-10 23:24:33,762 - optuna.study.study - INFO - Trial 125 finished with value: 0.07665925852289064 and parameters: {'n_layers': 1, 'embedding_dim': 256, 'lr': 0.0002473337988653622, 'lambda_val': 0.00023960236113440875, 'batch_size': 1279, 'optimizer': 'RMSprop'}. Best is trial 19 with value: 0.1315657637592616.
2026-05-10 23:24:40,544 - optuna.study._optimize - INFO - Trial 126 pruned. 
2026-05-10 23:24:44,797 - optuna.study._optimize - INFO - Trial 127 pruned. 
2026-05-10 23:25:17,331 - optuna.study.study - INFO - Trial 128 finished with value: 0.0903545262392875 and parameters: {'n_layers': 1, 'embedding_dim': 256, 'lr': 0.00019164146231762826, 'lambda_val': 8.73804309319044e-05, 'batch_size': 1447, 'optimizer': 'RMSprop'}. Best is trial 19 with value: 0.1315657637592616.
2026-05-10 23:25:21,450 - optuna.study._optimize - INFO - Trial 129 pruned. 
2026-05-10 23:25:53,745 - optuna.study.study - INFO - Trial 130 finished with value: 0.0751111700458697 and parameters: {'n_layers': 1, 'embedding_dim': 256, 'lr': 0.0002885528544916467, 'lambda_val': 6.67402691997296e-05, 'batch_size': 1063, 'optimizer': 'RMSprop'}. Best is trial 19 with value: 0.1315657637592616.
2026-05-10 23:26:26,498 - optuna.study.study - INFO - Trial 131 finished with value: 0.08771532786639631 and parameters: {'n_layers': 1, 'embedding_dim': 256, 'lr': 0.00019259030503259147, 'lambda_val': 0.000175802276250453, 'batch_size': 1422, 'optimizer': 'RMSprop'}. Best is trial 19 with value: 0.1315657637592616.
2026-05-10 23:26:30,506 - optuna.study._optimize - INFO - Trial 132 pruned. 
2026-05-10 23:27:02,039 - optuna.study.study - INFO - Trial 133 finished with value: 0.0801841903038508 and parameters: {'n_layers': 1, 'embedding_dim': 256, 'lr': 0.0002335545445399694, 'lambda_val': 0.0001585563426596927, 'batch_size': 1139, 'optimizer': 'RMSprop'}. Best is trial 19 with value: 0.1315657637592616.
2026-05-10 23:27:06,102 - optuna.study._optimize - INFO - Trial 134 pruned. 
2026-05-10 23:27:10,338 - optuna.study._optimize - INFO - Trial 135 pruned. 
2026-05-10 23:27:15,031 - optuna.study._optimize - INFO - Trial 136 pruned. 
2026-05-10 23:27:20,875 - optuna.study._optimize - INFO - Trial 137 pruned. 
2026-05-10 23:27:24,541 - optuna.study._optimize - INFO - Trial 138 pruned. 
2026-05-10 23:27:58,264 - optuna.study.study - INFO - Trial 139 finished with value: 0.08596978353037397 and parameters: {'n_layers': 1, 'embedding_dim': 256, 'lr': 0.00021362534658530966, 'lambda_val': 0.00017275027589054438, 'batch_size': 1634, 'optimizer': 'Adam'}. Best is trial 19 with value: 0.1315657637592616.
2026-05-10 23:28:01,861 - optuna.study._optimize - INFO - Trial 140 pruned. 
2026-05-10 23:28:35,596 - optuna.study.study - INFO - Trial 141 finished with value: 0.08662440570833506 and parameters: {'n_layers': 1, 'embedding_dim': 256, 'lr': 0.00025534215835488404, 'lambda_val': 0.00014971980891702953, 'batch_size': 1625, 'optimizer': 'Adam'}. Best is trial 19 with value: 0.1315657637592616.
2026-05-10 23:29:09,914 - optuna.study.study - INFO - Trial 142 finished with value: 0.07773385289208602 and parameters: {'n_layers': 1, 'embedding_dim': 256, 'lr': 0.0002546399585977649, 'lambda_val': 0.00014888856267665363, 'batch_size': 1644, 'optimizer': 'Adam'}. Best is trial 19 with value: 0.1315657637592616.
2026-05-10 23:29:14,043 - optuna.study._optimize - INFO - Trial 143 pruned. 
2026-05-10 23:29:47,458 - optuna.study.study - INFO - Trial 144 finished with value: 0.07075118239553202 and parameters: {'n_layers': 1, 'embedding_dim': 256, 'lr': 0.0003315802098852264, 'lambda_val': 0.00012641486584095732, 'batch_size': 1781, 'optimizer': 'Adam'}. Best is trial 19 with value: 0.1315657637592616.
2026-05-10 23:30:20,573 - optuna.study.study - INFO - Trial 145 finished with value: 0.0732588275763918 and parameters: {'n_layers': 1, 'embedding_dim': 256, 'lr': 0.00047341678474016423, 'lambda_val': 0.00017774841613764234, 'batch_size': 1453, 'optimizer': 'Adam'}. Best is trial 19 with value: 0.1315657637592616.
2026-05-10 23:30:24,912 - optuna.study._optimize - INFO - Trial 146 pruned. 
2026-05-10 23:30:28,689 - optuna.study._optimize - INFO - Trial 147 pruned. 
2026-05-10 23:30:33,084 - optuna.study._optimize - INFO - Trial 148 pruned. 
2026-05-10 23:30:38,177 - optuna.study._optimize - INFO - Trial 149 pruned. 
2026-05-10 23:30:42,120 - optuna.study._optimize - INFO - Trial 150 pruned. 
2026-05-10 23:30:46,229 - optuna.study._optimize - INFO - Trial 151 pruned. 
2026-05-10 23:30:50,758 - optuna.study._optimize - INFO - Trial 152 pruned. 
2026-05-10 23:30:54,978 - optuna.study._optimize - INFO - Trial 153 pruned. 
2026-05-10 23:31:28,463 - optuna.study.study - INFO - Trial 154 finished with value: 0.08535683203614496 and parameters: {'n_layers': 1, 'embedding_dim': 256, 'lr': 0.0002637754454493578, 'lambda_val': 8.258848626267246e-05, 'batch_size': 1444, 'optimizer': 'Adam'}. Best is trial 19 with value: 0.1315657637592616.
2026-05-10 23:32:01,334 - optuna.study.study - INFO - Trial 155 finished with value: 0.08373057512391156 and parameters: {'n_layers': 1, 'embedding_dim': 256, 'lr': 0.00024886049155057536, 'lambda_val': 8.165702663571506e-05, 'batch_size': 1446, 'optimizer': 'Adam'}. Best is trial 19 with value: 0.1315657637592616.
2026-05-10 23:32:05,540 - optuna.study._optimize - INFO - Trial 156 pruned. 
2026-05-10 23:32:38,901 - optuna.study.study - INFO - Trial 157 finished with value: 0.08545928011758686 and parameters: {'n_layers': 1, 'embedding_dim': 256, 'lr': 0.00024686108542514024, 'lambda_val': 5.6727061405293245e-05, 'batch_size': 1601, 'optimizer': 'Adam'}. Best is trial 19 with value: 0.1315657637592616.
2026-05-10 23:33:12,741 - optuna.study.study - INFO - Trial 158 finished with value: 0.08124811391408109 and parameters: {'n_layers': 1, 'embedding_dim': 256, 'lr': 0.00026988231756445676, 'lambda_val': 5.8798570277450623e-05, 'batch_size': 1567, 'optimizer': 'Adam'}. Best is trial 19 with value: 0.1315657637592616.
2026-05-10 23:33:46,748 - optuna.study.study - INFO - Trial 159 finished with value: 0.07504362058368348 and parameters: {'n_layers': 1, 'embedding_dim': 256, 'lr': 0.0004062654952724575, 'lambda_val': 6.756399446966949e-05, 'batch_size': 1644, 'optimizer': 'Adam'}. Best is trial 19 with value: 0.1315657637592616.
2026-05-10 23:34:19,697 - optuna.study.study - INFO - Trial 160 finished with value: 0.08484177352958762 and parameters: {'n_layers': 1, 'embedding_dim': 256, 'lr': 0.00022597869461296824, 'lambda_val': 1.6221414409746898e-06, 'batch_size': 1737, 'optimizer': 'Adam'}. Best is trial 19 with value: 0.1315657637592616.
2026-05-10 23:34:24,213 - optuna.study._optimize - INFO - Trial 161 pruned. 
2026-05-10 23:34:28,469 - optuna.study._optimize - INFO - Trial 162 pruned. 
2026-05-10 23:35:01,781 - optuna.study.study - INFO - Trial 163 finished with value: 0.08161985129559662 and parameters: {'n_layers': 1, 'embedding_dim': 256, 'lr': 0.0002656285240200084, 'lambda_val': 2.883165014067767e-06, 'batch_size': 1466, 'optimizer': 'Adam'}. Best is trial 19 with value: 0.1315657637592616.
2026-05-10 23:35:06,482 - optuna.study._optimize - INFO - Trial 164 pruned. 
2026-05-10 23:35:10,649 - optuna.study._optimize - INFO - Trial 165 pruned. 
2026-05-10 23:35:14,846 - optuna.study._optimize - INFO - Trial 166 pruned. 
2026-05-10 23:35:19,081 - optuna.study._optimize - INFO - Trial 167 pruned. 
2026-05-10 23:35:23,333 - optuna.study._optimize - INFO - Trial 168 pruned. 
2026-05-10 23:35:57,057 - optuna.study.study - INFO - Trial 169 finished with value: 0.07042556081552737 and parameters: {'n_layers': 1, 'embedding_dim': 256, 'lr': 0.0006427764969438391, 'lambda_val': 0.00011016831390605284, 'batch_size': 1597, 'optimizer': 'Adam'}. Best is trial 19 with value: 0.1315657637592616.
2026-05-10 23:36:30,147 - optuna.study.study - INFO - Trial 170 finished with value: 0.07494547978967689 and parameters: {'n_layers': 1, 'embedding_dim': 256, 'lr': 0.00037835129240030365, 'lambda_val': 7.780391258843584e-05, 'batch_size': 1292, 'optimizer': 'Adam'}. Best is trial 19 with value: 0.1315657637592616.
2026-05-10 23:36:34,639 - optuna.study._optimize - INFO - Trial 171 pruned. 
2026-05-10 23:36:39,065 - optuna.study._optimize - INFO - Trial 172 pruned. 
2026-05-10 23:37:12,114 - optuna.study.study - INFO - Trial 173 finished with value: 0.07891692022685373 and parameters: {'n_layers': 1, 'embedding_dim': 256, 'lr': 0.0002782856679673487, 'lambda_val': 2.5751350062524935e-05, 'batch_size': 1204, 'optimizer': 'RMSprop'}. Best is trial 19 with value: 0.1315657637592616.
2026-05-10 23:37:16,220 - optuna.study._optimize - INFO - Trial 174 pruned. 
2026-05-10 23:37:20,450 - optuna.study._optimize - INFO - Trial 175 pruned. 
2026-05-10 23:37:53,254 - optuna.study.study - INFO - Trial 176 finished with value: 0.07244401146311318 and parameters: {'n_layers': 1, 'embedding_dim': 256, 'lr': 0.00025026683717602487, 'lambda_val': 0.00013432611121503307, 'batch_size': 1531, 'optimizer': 'RMSprop'}. Best is trial 19 with value: 0.1315657637592616.
2026-05-10 23:37:56,785 - optuna.study._optimize - INFO - Trial 177 pruned. 
2026-05-10 23:38:00,904 - optuna.study._optimize - INFO - Trial 178 pruned. 
2026-05-10 23:38:05,079 - optuna.study._optimize - INFO - Trial 179 pruned. 
2026-05-10 23:38:32,571 - optuna.study.study - INFO - Trial 180 finished with value: 0.06435451454004354 and parameters: {'n_layers': 1, 'embedding_dim': 96, 'lr': 0.0004607747517194674, 'lambda_val': 0.00016191747588414438, 'batch_size': 916, 'optimizer': 'RMSprop'}. Best is trial 19 with value: 0.1315657637592616.
2026-05-10 23:39:00,836 - optuna.study.study - INFO - Trial 181 finished with value: 0.08716615854445593 and parameters: {'n_layers': 1, 'embedding_dim': 128, 'lr': 0.00034971158552322366, 'lambda_val': 7.732791467566556e-05, 'batch_size': 578, 'optimizer': 'RMSprop'}. Best is trial 19 with value: 0.1315657637592616.
2026-05-10 23:39:05,397 - optuna.study._optimize - INFO - Trial 182 pruned. 
2026-05-10 23:39:09,119 - optuna.study._optimize - INFO - Trial 183 pruned. 
2026-05-10 23:39:12,767 - optuna.study._optimize - INFO - Trial 184 pruned. 
2026-05-10 23:39:45,560 - optuna.study.study - INFO - Trial 185 finished with value: 0.07638554948773252 and parameters: {'n_layers': 1, 'embedding_dim': 256, 'lr': 0.00023675326538981684, 'lambda_val': 8.180939303104157e-05, 'batch_size': 1310, 'optimizer': 'RMSprop'}. Best is trial 19 with value: 0.1315657637592616.
2026-05-10 23:39:49,556 - optuna.study._optimize - INFO - Trial 186 pruned. 
2026-05-10 23:40:21,889 - optuna.study.study - INFO - Trial 187 finished with value: 0.0748393588793543 and parameters: {'n_layers': 1, 'embedding_dim': 256, 'lr': 0.0003236051090988239, 'lambda_val': 7.176426422667677e-05, 'batch_size': 1161, 'optimizer': 'RMSprop'}. Best is trial 19 with value: 0.1315657637592616.
2026-05-10 23:40:25,786 - optuna.study._optimize - INFO - Trial 188 pruned. 
2026-05-10 23:40:29,551 - optuna.study._optimize - INFO - Trial 189 pruned. 
2026-05-10 23:41:02,812 - optuna.study.study - INFO - Trial 190 finished with value: 0.07402642068040131 and parameters: {'n_layers': 1, 'embedding_dim': 256, 'lr': 0.000355089315723696, 'lambda_val': 9.595356121984709e-05, 'batch_size': 1611, 'optimizer': 'Adam'}. Best is trial 19 with value: 0.1315657637592616.
2026-05-10 23:41:38,035 - optuna.study.study - INFO - Trial 191 finished with value: 0.09455511315993609 and parameters: {'n_layers': 1, 'embedding_dim': 128, 'lr': 0.0002962144958380174, 'lambda_val': 7.783081638067747e-05, 'batch_size': 617, 'optimizer': 'RMSprop'}. Best is trial 19 with value: 0.1315657637592616.
2026-05-10 23:41:43,667 - optuna.study._optimize - INFO - Trial 192 pruned. 
2026-05-10 23:41:52,413 - optuna.study._optimize - INFO - Trial 193 pruned. 
2026-05-10 23:41:56,245 - optuna.study._optimize - INFO - Trial 194 pruned. 
2026-05-10 23:42:00,133 - optuna.study._optimize - INFO - Trial 195 pruned. 
2026-05-10 23:42:04,809 - optuna.study._optimize - INFO - Trial 196 pruned. 
