2026-05-10 22:34:12,045 - optuna.study._optimize - INFO - Trial 163 pruned. 
2026-05-10 22:34:16,446 - optuna.study._optimize - INFO - Trial 164 pruned. 
2026-05-10 22:34:22,624 - optuna.study._optimize - INFO - Trial 165 pruned. 
2026-05-10 22:34:26,961 - optuna.study._optimize - INFO - Trial 166 pruned. 
2026-05-10 22:35:02,665 - optuna.study.study - INFO - Trial 167 finished with value: 0.07047543666893781 and parameters: {'n_layers': 1, 'embedding_dim': 256, 'lr': 0.00015981319765255401, 'lambda_val': 1.3220826590134743e-06, 'batch_size': 3811, 'optimizer': 'Adam'}. Best is trial 10 with value: 0.11877962521025955.
2026-05-10 22:35:36,500 - optuna.study.study - INFO - Trial 168 finished with value: 0.0730336054392024 and parameters: {'n_layers': 1, 'embedding_dim': 256, 'lr': 0.00026391417333181154, 'lambda_val': 0.00034193876675734524, 'batch_size': 1411, 'optimizer': 'Adam'}. Best is trial 10 with value: 0.11877962521025955.
2026-05-10 22:36:10,857 - optuna.study.study - INFO - Trial 169 finished with value: 0.08580008995726454 and parameters: {'n_layers': 1, 'embedding_dim': 256, 'lr': 0.00012886775744034667, 'lambda_val': 0.0005279388365204573, 'batch_size': 3646, 'optimizer': 'RMSprop'}. Best is trial 10 with value: 0.11877962521025955.
2026-05-10 22:36:15,020 - optuna.study._optimize - INFO - Trial 170 pruned. 
2026-05-10 22:36:48,779 - optuna.study.study - INFO - Trial 171 finished with value: 0.09822404434431875 and parameters: {'n_layers': 1, 'embedding_dim': 256, 'lr': 0.00016188323061449452, 'lambda_val': 0.00037377099317371915, 'batch_size': 1337, 'optimizer': 'Adam'}. Best is trial 10 with value: 0.11877962521025955.
2026-05-10 22:37:21,003 - optuna.study.study - INFO - Trial 172 finished with value: 0.09170729776668057 and parameters: {'n_layers': 1, 'embedding_dim': 256, 'lr': 0.0002087485732887998, 'lambda_val': 0.00025188302439328123, 'batch_size': 1222, 'optimizer': 'Adam'}. Best is trial 10 with value: 0.11877962521025955.
2026-05-10 22:37:54,704 - optuna.study.study - INFO - Trial 173 finished with value: 0.10864537623624933 and parameters: {'n_layers': 1, 'embedding_dim': 256, 'lr': 0.00014199477833777357, 'lambda_val': 0.00033182765913592974, 'batch_size': 1636, 'optimizer': 'Adam'}. Best is trial 10 with value: 0.11877962521025955.
2026-05-10 22:38:28,144 - optuna.study.study - INFO - Trial 174 finished with value: 0.1090377827122452 and parameters: {'n_layers': 1, 'embedding_dim': 256, 'lr': 0.00016495782255212662, 'lambda_val': 0.00032656084073631297, 'batch_size': 1300, 'optimizer': 'Adam'}. Best is trial 10 with value: 0.11877962521025955.
2026-05-10 22:38:59,351 - optuna.study.study - INFO - Trial 175 finished with value: 0.09227887305588552 and parameters: {'n_layers': 1, 'embedding_dim': 256, 'lr': 0.00016709781969570715, 'lambda_val': 0.00031781938577701477, 'batch_size': 1632, 'optimizer': 'Adam'}. Best is trial 10 with value: 0.11877962521025955.
2026-05-10 22:39:03,165 - optuna.study._optimize - INFO - Trial 176 pruned. 
2026-05-10 22:39:07,082 - optuna.study._optimize - INFO - Trial 177 pruned. 
2026-05-10 22:39:40,125 - optuna.study.study - INFO - Trial 178 finished with value: 0.09637325295644651 and parameters: {'n_layers': 1, 'embedding_dim': 256, 'lr': 0.00016332183311920087, 'lambda_val': 0.00045887916626756014, 'batch_size': 1454, 'optimizer': 'Adam'}. Best is trial 10 with value: 0.11877962521025955.
2026-05-10 22:40:07,431 - optuna.study.study - INFO - Trial 179 finished with value: 0.06571344876291293 and parameters: {'n_layers': 1, 'embedding_dim': 96, 'lr': 0.0003172078093049123, 'lambda_val': 0.0006582888778992399, 'batch_size': 1365, 'optimizer': 'Adam'}. Best is trial 10 with value: 0.11877962521025955.
2026-05-10 22:40:11,113 - optuna.study._optimize - INFO - Trial 180 pruned. 
2026-05-10 22:40:15,185 - optuna.study._optimize - INFO - Trial 181 pruned. 
2026-05-10 22:40:48,875 - optuna.study.study - INFO - Trial 182 finished with value: 0.08717953103290242 and parameters: {'n_layers': 1, 'embedding_dim': 256, 'lr': 0.0001952253689104045, 'lambda_val': 0.0005857375630278247, 'batch_size': 1674, 'optimizer': 'Adam'}. Best is trial 10 with value: 0.11877962521025955.
2026-05-10 22:40:52,933 - optuna.study._optimize - INFO - Trial 183 pruned. 
2026-05-10 22:40:57,600 - optuna.study._optimize - INFO - Trial 184 pruned. 
2026-05-10 22:41:01,843 - optuna.study._optimize - INFO - Trial 185 pruned. 
2026-05-10 22:41:34,621 - optuna.study.study - INFO - Trial 186 finished with value: 0.08503870413708121 and parameters: {'n_layers': 1, 'embedding_dim': 256, 'lr': 0.0001685383583613407, 'lambda_val': 0.0002656169185727407, 'batch_size': 1791, 'optimizer': 'Adam'}. Best is trial 10 with value: 0.11877962521025955.
2026-05-10 22:41:39,056 - optuna.study._optimize - INFO - Trial 187 pruned. 
2026-05-10 22:42:16,008 - optuna.study.study - INFO - Trial 188 finished with value: 0.06891616200321367 and parameters: {'n_layers': 1, 'embedding_dim': 256, 'lr': 0.00025956244164404075, 'lambda_val': 0.000733280268249609, 'batch_size': 1924, 'optimizer': 'Adam'}. Best is trial 10 with value: 0.11877962521025955.
2026-05-10 22:42:49,407 - optuna.study.study - INFO - Trial 189 finished with value: 0.09303563735775382 and parameters: {'n_layers': 1, 'embedding_dim': 256, 'lr': 0.00014602305003716442, 'lambda_val': 1.0436526462877568e-06, 'batch_size': 2038, 'optimizer': 'RMSprop'}. Best is trial 10 with value: 0.11877962521025955.
2026-05-10 22:42:53,772 - optuna.study._optimize - INFO - Trial 190 pruned. 
2026-05-10 22:42:57,853 - optuna.study._optimize - INFO - Trial 191 pruned. 
2026-05-10 22:43:03,008 - optuna.study._optimize - INFO - Trial 192 pruned. 
2026-05-10 22:43:07,368 - optuna.study._optimize - INFO - Trial 193 pruned. 
2026-05-10 22:43:41,124 - optuna.study.study - INFO - Trial 194 finished with value: 0.08074882100389692 and parameters: {'n_layers': 1, 'embedding_dim': 256, 'lr': 0.0001880763456634871, 'lambda_val': 1.3846165295275556e-06, 'batch_size': 1723, 'optimizer': 'Adam'}. Best is trial 10 with value: 0.11877962521025955.
2026-05-10 22:43:45,790 - optuna.study._optimize - INFO - Trial 195 pruned. 
2026-05-10 22:43:50,091 - optuna.study._optimize - INFO - Trial 196 pruned. 
2026-05-10 22:43:54,560 - optuna.study._optimize - INFO - Trial 197 pruned. 
2026-05-10 22:43:58,948 - optuna.study._optimize - INFO - Trial 198 pruned. 
2026-05-10 22:44:32,413 - optuna.study.study - INFO - Trial 199 finished with value: 0.09236867923229307 and parameters: {'n_layers': 1, 'embedding_dim': 256, 'lr': 0.00016046561828119717, 'lambda_val': 0.001079737632867732, 'batch_size': 1520, 'optimizer': 'Adam'}. Best is trial 10 with value: 0.11877962521025955.
2026-05-10 22:44:52,695 - root - INFO -   **** Training e_100K_1c1dcs_rand2
2026-05-10 22:44:52,705 - root - INFO -   **** Getting 53072/65410 random edges
2026-05-10 22:44:53,288 - optuna.storages._rdb.storage - INFO - A new study created in RDB with name: Study_e_100K_1c1dcs_rand2
2026-05-10 22:45:33,984 - optuna.study.study - INFO - Trial 0 finished with value: 0.00212083959954488 and parameters: {'n_layers': 4, 'embedding_dim': 96, 'lr': 0.03958779745327916, 'lambda_val': 3.9785760969402345e-06, 'batch_size': 2131, 'optimizer': 'SGD'}. Best is trial 0 with value: 0.00212083959954488.
2026-05-10 22:46:05,586 - optuna.study.study - INFO - Trial 1 finished with value: 0.0019353001358571212 and parameters: {'n_layers': 2, 'embedding_dim': 96, 'lr': 0.05200343812483532, 'lambda_val': 0.002977446364658836, 'batch_size': 3193, 'optimizer': 'SGD'}. Best is trial 0 with value: 0.00212083959954488.
2026-05-10 22:47:04,340 - optuna.study.study - INFO - Trial 2 finished with value: 0.011609207414413838 and parameters: {'n_layers': 4, 'embedding_dim': 256, 'lr': 0.004887310369156917, 'lambda_val': 0.027009990959937596, 'batch_size': 3743, 'optimizer': 'Adam'}. Best is trial 2 with value: 0.011609207414413838.
2026-05-10 22:47:38,585 - optuna.study.study - INFO - Trial 3 finished with value: 0.020269123101645074 and parameters: {'n_layers': 3, 'embedding_dim': 64, 'lr': 0.043878866890310876, 'lambda_val': 0.013475201118991644, 'batch_size': 2858, 'optimizer': 'Adam'}. Best is trial 3 with value: 0.020269123101645074.
2026-05-10 22:48:09,665 - optuna.study.study - INFO - Trial 4 finished with value: 0.022309449341322007 and parameters: {'n_layers': 3, 'embedding_dim': 32, 'lr': 0.00012751021982013183, 'lambda_val': 0.0003674363708622131, 'batch_size': 3548, 'optimizer': 'Adam'}. Best is trial 4 with value: 0.022309449341322007.
2026-05-10 22:48:14,931 - optuna.study._optimize - INFO - Trial 5 pruned. 
2026-05-10 22:48:41,611 - optuna.study.study - INFO - Trial 6 finished with value: 0.025292518000524546 and parameters: {'n_layers': 3, 'embedding_dim': 32, 'lr': 0.036269860009544075, 'lambda_val': 0.0029481401406982366, 'batch_size': 3395, 'optimizer': 'RMSprop'}. Best is trial 6 with value: 0.025292518000524546.
2026-05-10 22:49:13,257 - optuna.study.study - INFO - Trial 7 finished with value: 0.022128656657751544 and parameters: {'n_layers': 4, 'embedding_dim': 32, 'lr': 0.00011187975479876229, 'lambda_val': 2.3032658273165526e-06, 'batch_size': 3434, 'optimizer': 'Adam'}. Best is trial 6 with value: 0.025292518000524546.
2026-05-10 22:50:01,634 - optuna.study.study - INFO - Trial 8 finished with value: 0.03850305670528745 and parameters: {'n_layers': 3, 'embedding_dim': 256, 'lr': 0.03970585080282314, 'lambda_val': 7.42954604909128e-05, 'batch_size': 1479, 'optimizer': 'RMSprop'}. Best is trial 8 with value: 0.03850305670528745.
2026-05-10 22:50:05,664 - optuna.study._optimize - INFO - Trial 9 pruned. 
2026-05-10 22:50:09,598 - optuna.study._optimize - INFO - Trial 10 pruned. 
2026-05-10 22:50:50,856 - optuna.study.study - INFO - Trial 11 finished with value: 0.04843456838425991 and parameters: {'n_layers': 2, 'embedding_dim': 256, 'lr': 0.010181726203963433, 'lambda_val': 0.00015088368589002968, 'batch_size': 1674, 'optimizer': 'RMSprop'}. Best is trial 11 with value: 0.04843456838425991.
2026-05-10 22:51:24,220 - optuna.study.study - INFO - Trial 12 finished with value: 0.05734958520940901 and parameters: {'n_layers': 1, 'embedding_dim': 256, 'lr': 0.008372446369480589, 'lambda_val': 6.602323099830713e-05, 'batch_size': 1465, 'optimizer': 'RMSprop'}. Best is trial 12 with value: 0.05734958520940901.
2026-05-10 22:52:08,276 - optuna.study.study - INFO - Trial 13 finished with value: 0.0752234576900455 and parameters: {'n_layers': 1, 'embedding_dim': 256, 'lr': 0.007936803046070208, 'lambda_val': 0.00022738446950514772, 'batch_size': 1261, 'optimizer': 'RMSprop'}. Best is trial 13 with value: 0.0752234576900455.
2026-05-10 22:52:40,217 - optuna.study.study - INFO - Trial 14 finished with value: 0.06487034594118268 and parameters: {'n_layers': 1, 'embedding_dim': 256, 'lr': 0.0005848877217654754, 'lambda_val': 1.8968533146830824e-05, 'batch_size': 1037, 'optimizer': 'RMSprop'}. Best is trial 13 with value: 0.0752234576900455.
2026-05-10 22:53:06,382 - optuna.study.study - INFO - Trial 15 finished with value: 0.05818238788075231 and parameters: {'n_layers': 1, 'embedding_dim': 128, 'lr': 0.00045510171588415075, 'lambda_val': 1.482052725339875e-05, 'batch_size': 981, 'optimizer': 'RMSprop'}. Best is trial 13 with value: 0.0752234576900455.
2026-05-10 22:53:40,871 - optuna.study.study - INFO - Trial 16 finished with value: 0.03941399841392283 and parameters: {'n_layers': 1, 'embedding_dim': 64, 'lr': 0.0005062228347975384, 'lambda_val': 0.0006247208243059327, 'batch_size': 2163, 'optimizer': 'RMSprop'}. Best is trial 13 with value: 0.0752234576900455.
2026-05-10 22:53:45,664 - optuna.study._optimize - INFO - Trial 17 pruned. 
2026-05-10 22:54:19,875 - optuna.study.study - INFO - Trial 18 finished with value: 0.06404016000875866 and parameters: {'n_layers': 1, 'embedding_dim': 256, 'lr': 0.000548416906465171, 'lambda_val': 0.0007877116208550723, 'batch_size': 2610, 'optimizer': 'RMSprop'}. Best is trial 13 with value: 0.0752234576900455.
2026-05-10 22:54:52,737 - optuna.study.study - INFO - Trial 19 finished with value: 0.1315657637592616 and parameters: {'n_layers': 1, 'embedding_dim': 256, 'lr': 0.00015331285162506104, 'lambda_val': 8.633810969112886e-06, 'batch_size': 981, 'optimizer': 'RMSprop'}. Best is trial 19 with value: 0.1315657637592616.
2026-05-10 22:55:25,564 - optuna.study.study - INFO - Trial 20 finished with value: 0.05696457975980121 and parameters: {'n_layers': 2, 'embedding_dim': 128, 'lr': 0.00013797008202385815, 'lambda_val': 6.1573759490378586e-06, 'batch_size': 1133, 'optimizer': 'RMSprop'}. Best is trial 19 with value: 0.1315657637592616.
2026-05-10 22:55:58,167 - optuna.study.study - INFO - Trial 21 finished with value: 0.0767139530640994 and parameters: {'n_layers': 1, 'embedding_dim': 256, 'lr': 0.00024111403274840027, 'lambda_val': 2.4012612726952197e-05, 'batch_size': 1839, 'optimizer': 'RMSprop'}. Best is trial 19 with value: 0.1315657637592616.
2026-05-10 22:56:02,363 - optuna.study._optimize - INFO - Trial 22 pruned. 
2026-05-10 22:56:35,303 - optuna.study.study - INFO - Trial 23 finished with value: 0.05966483717114472 and parameters: {'n_layers': 1, 'embedding_dim': 256, 'lr': 0.003312631042596821, 'lambda_val': 5.535085282627836e-05, 'batch_size': 1839, 'optimizer': 'RMSprop'}. Best is trial 19 with value: 0.1315657637592616.
2026-05-10 22:56:40,181 - optuna.study._optimize - INFO - Trial 24 pruned. 
2026-05-10 22:56:44,086 - optuna.study._optimize - INFO - Trial 25 pruned. 
2026-05-10 22:57:11,468 - optuna.study.study - INFO - Trial 26 finished with value: 0.04825924560775 and parameters: {'n_layers': 1, 'embedding_dim': 96, 'lr': 0.0011130731980433656, 'lambda_val': 1.1785105687374458e-06, 'batch_size': 806, 'optimizer': 'RMSprop'}. Best is trial 19 with value: 0.1315657637592616.
2026-05-10 22:57:16,936 - optuna.study._optimize - INFO - Trial 27 pruned. 
2026-05-10 22:57:50,649 - optuna.study.study - INFO - Trial 28 finished with value: 0.07548864042448071 and parameters: {'n_layers': 1, 'embedding_dim': 256, 'lr': 0.00027181561748527576, 'lambda_val': 0.00015188849556034415, 'batch_size': 1859, 'optimizer': 'Adam'}. Best is trial 19 with value: 0.1315657637592616.
2026-05-10 22:58:21,910 - optuna.study.study - INFO - Trial 29 finished with value: 0.03137668206874194 and parameters: {'n_layers': 2, 'embedding_dim': 96, 'lr': 0.00022940746392297064, 'lambda_val': 3.8448874199708976e-06, 'batch_size': 1888, 'optimizer': 'Adam'}. Best is trial 19 with value: 0.1315657637592616.
2026-05-10 22:58:26,179 - optuna.study._optimize - INFO - Trial 30 pruned. 
2026-05-10 22:58:58,969 - optuna.study.study - INFO - Trial 31 finished with value: 0.08133761390554298 and parameters: {'n_layers': 1, 'embedding_dim': 256, 'lr': 0.0002359124875622575, 'lambda_val': 0.00015535880354778915, 'batch_size': 1272, 'optimizer': 'Adam'}. Best is trial 19 with value: 0.1315657637592616.
2026-05-10 22:59:03,719 - optuna.study._optimize - INFO - Trial 32 pruned. 
2026-05-10 22:59:31,501 - optuna.study.study - INFO - Trial 33 finished with value: 0.07292255741700092 and parameters: {'n_layers': 1, 'embedding_dim': 96, 'lr': 0.00020520934617600763, 'lambda_val': 0.0003951764009714729, 'batch_size': 2096, 'optimizer': 'Adam'}. Best is trial 19 with value: 0.1315657637592616.
2026-05-10 23:00:04,855 - optuna.study.study - INFO - Trial 34 finished with value: 0.06451218962883716 and parameters: {'n_layers': 1, 'embedding_dim': 256, 'lr': 0.00027969353626004095, 'lambda_val': 0.0012555685964537925, 'batch_size': 1386, 'optimizer': 'Adam'}. Best is trial 19 with value: 0.1315657637592616.
2026-05-10 23:00:08,514 - optuna.study._optimize - INFO - Trial 35 pruned. 
2026-05-10 23:00:51,663 - optuna.study.study - INFO - Trial 36 finished with value: 0.03953089818956593 and parameters: {'n_layers': 2, 'embedding_dim': 256, 'lr': 0.0007905975420129844, 'lambda_val': 3.490051192427994e-06, 'batch_size': 2751, 'optimizer': 'Adam'}. Best is trial 19 with value: 0.1315657637592616.
2026-05-10 23:00:56,761 - optuna.study._optimize - INFO - Trial 37 pruned. 
2026-05-10 23:01:00,235 - optuna.study._optimize - INFO - Trial 38 pruned. 
2026-05-10 23:01:27,313 - optuna.study.study - INFO - Trial 39 finished with value: 0.038551915938070364 and parameters: {'n_layers': 1, 'embedding_dim': 32, 'lr': 0.0014316321799742032, 'lambda_val': 0.0002604641069124455, 'batch_size': 2228, 'optimizer': 'Adam'}. Best is trial 19 with value: 0.1315657637592616.
2026-05-10 23:01:32,213 - optuna.study._optimize - INFO - Trial 40 pruned. 
2026-05-10 23:01:36,361 - optuna.study._optimize - INFO - Trial 41 pruned. 
2026-05-10 23:01:40,643 - optuna.study._optimize - INFO - Trial 42 pruned. 
2026-05-10 23:01:47,136 - optuna.study._optimize - INFO - Trial 43 pruned. 
2026-05-10 23:02:21,539 - optuna.study.study - INFO - Trial 44 finished with value: 0.08806482986535372 and parameters: {'n_layers': 1, 'embedding_dim': 256, 'lr': 0.00016567767455441353, 'lambda_val': 0.0001078411350014154, 'batch_size': 1686, 'optimizer': 'RMSprop'}. Best is trial 19 with value: 0.1315657637592616.
2026-05-10 23:02:26,637 - optuna.study._optimize - INFO - Trial 45 pruned. 
2026-05-10 23:02:58,477 - optuna.study.study - INFO - Trial 46 finished with value: 0.07450080068214447 and parameters: {'n_layers': 1, 'embedding_dim': 256, 'lr': 0.0003592289510032857, 'lambda_val': 1.9198503694922182e-05, 'batch_size': 1431, 'optimizer': 'RMSprop'}. Best is trial 19 with value: 0.1315657637592616.
2026-05-10 23:03:03,056 - optuna.study._optimize - INFO - Trial 47 pruned. 
2026-05-10 23:03:06,845 - optuna.study._optimize - INFO - Trial 48 pruned. 
2026-05-10 23:03:12,576 - optuna.study._optimize - INFO - Trial 49 pruned. 
2026-05-10 23:03:16,200 - optuna.study._optimize - INFO - Trial 50 pruned. 
2026-05-10 23:03:48,654 - optuna.study.study - INFO - Trial 51 finished with value: 0.06454832357327074 and parameters: {'n_layers': 1, 'embedding_dim': 256, 'lr': 0.00031857603775619205, 'lambda_val': 0.0008905889032064225, 'batch_size': 1429, 'optimizer': 'RMSprop'}. Best is trial 19 with value: 0.1315657637592616.
2026-05-10 23:04:21,754 - optuna.study.study - INFO - Trial 52 finished with value: 0.05730953926614489 and parameters: {'n_layers': 1, 'embedding_dim': 256, 'lr': 0.0021161687140632997, 'lambda_val': 5.1839968496646416e-05, 'batch_size': 1034, 'optimizer': 'RMSprop'}. Best is trial 19 with value: 0.1315657637592616.
2026-05-10 23:04:25,812 - optuna.study._optimize - INFO - Trial 53 pruned. 
2026-05-10 23:04:53,061 - optuna.study.study - INFO - Trial 54 finished with value: 0.05328515581498039 and parameters: {'n_layers': 1, 'embedding_dim': 128, 'lr': 0.0006108091565593519, 'lambda_val': 0.00038102365533318, 'batch_size': 1562, 'optimizer': 'RMSprop'}. Best is trial 19 with value: 0.1315657637592616.
2026-05-10 23:04:57,479 - optuna.study._optimize - INFO - Trial 55 pruned. 
2026-05-10 23:05:29,546 - optuna.study.study - INFO - Trial 56 finished with value: 0.07645373731677352 and parameters: {'n_layers': 1, 'embedding_dim': 256, 'lr': 0.0004212942367610318, 'lambda_val': 1.579687712612081e-05, 'batch_size': 924, 'optimizer': 'RMSprop'}. Best is trial 19 with value: 0.1315657637592616.
2026-05-10 23:05:55,694 - optuna.study.study - INFO - Trial 57 finished with value: 0.07947929511002391 and parameters: {'n_layers': 1, 'embedding_dim': 32, 'lr': 0.0003733193602864141, 'lambda_val': 1.4093034274021604e-05, 'batch_size': 901, 'optimizer': 'RMSprop'}. Best is trial 19 with value: 0.1315657637592616.
2026-05-10 23:06:23,594 - optuna.study.study - INFO - Trial 58 finished with value: 0.022892822174953916 and parameters: {'n_layers': 2, 'embedding_dim': 32, 'lr': 0.0004378555332689759, 'lambda_val': 1.5261806034883202e-05, 'batch_size': 517, 'optimizer': 'RMSprop'}. Best is trial 19 with value: 0.1315657637592616.
2026-05-10 23:06:49,938 - optuna.study.study - INFO - Trial 59 finished with value: 0.04603976980396908 and parameters: {'n_layers': 1, 'embedding_dim': 32, 'lr': 0.0007263291624499551, 'lambda_val': 6.399795645777023e-06, 'batch_size': 868, 'optimizer': 'RMSprop'}. Best is trial 19 with value: 0.1315657637592616.
2026-05-10 23:07:15,755 - optuna.study.study - INFO - Trial 60 finished with value: 0.047955887898565974 and parameters: {'n_layers': 1, 'embedding_dim': 32, 'lr': 0.0011189294006047961, 'lambda_val': 2.435278223083266e-06, 'batch_size': 661, 'optimizer': 'RMSprop'}. Best is trial 19 with value: 0.1315657637592616.
2026-05-10 23:07:19,233 - optuna.study._optimize - INFO - Trial 61 pruned. 
2026-05-10 23:07:51,781 - optuna.study.study - INFO - Trial 62 finished with value: 0.0714291675779008 and parameters: {'n_layers': 1, 'embedding_dim': 256, 'lr': 0.0004190545990064893, 'lambda_val': 4.599484281048309e-05, 'batch_size': 942, 'optimizer': 'RMSprop'}. Best is trial 19 with value: 0.1315657637592616.
2026-05-10 23:07:55,751 - optuna.study._optimize - INFO - Trial 63 pruned. 
2026-05-10 23:08:30,061 - optuna.study.study - INFO - Trial 64 finished with value: 0.08241158204521455 and parameters: {'n_layers': 1, 'embedding_dim': 256, 'lr': 0.00018328451467784104, 'lambda_val': 1.2753602702481323e-05, 'batch_size': 2339, 'optimizer': 'RMSprop'}. Best is trial 19 with value: 0.1315657637592616.
2026-05-10 23:09:04,446 - optuna.study.study - INFO - Trial 65 finished with value: 0.06937144014899167 and parameters: {'n_layers': 1, 'embedding_dim': 256, 'lr': 0.0001812873094956558, 'lambda_val': 4.6767376603166364e-06, 'batch_size': 2441, 'optimizer': 'RMSprop'}. Best is trial 19 with value: 0.1315657637592616.
2026-05-10 23:09:08,278 - optuna.study._optimize - INFO - Trial 66 pruned. 
2026-05-10 23:09:12,266 - optuna.study._optimize - INFO - Trial 67 pruned. 
