2026-05-11 00:56:11,780 - optuna.study.study - INFO - Trial 21 finished with value: 0.06676633840003429 and parameters: {'n_layers': 1, 'embedding_dim': 256, 'lr': 0.0012905868126439279, 'lambda_val': 0.00017908524163776627, 'batch_size': 2629, 'optimizer': 'Adam'}. Best is trial 4 with value: 0.11847522329459384.
2026-05-11 00:56:49,688 - optuna.study.study - INFO - Trial 22 finished with value: 0.05578553852836018 and parameters: {'n_layers': 1, 'embedding_dim': 256, 'lr': 0.001490123366074895, 'lambda_val': 4.9245196479988665e-05, 'batch_size': 2381, 'optimizer': 'Adam'}. Best is trial 4 with value: 0.11847522329459384.
2026-05-11 00:57:24,350 - optuna.study.study - INFO - Trial 23 finished with value: 0.06627290742787177 and parameters: {'n_layers': 1, 'embedding_dim': 256, 'lr': 0.002850436644877681, 'lambda_val': 0.00028859385003986713, 'batch_size': 3383, 'optimizer': 'Adam'}. Best is trial 4 with value: 0.11847522329459384.
2026-05-11 00:58:03,506 - optuna.study.study - INFO - Trial 24 finished with value: 0.06763006621667231 and parameters: {'n_layers': 1, 'embedding_dim': 256, 'lr': 0.0034752228383814277, 'lambda_val': 0.00041426821070289884, 'batch_size': 3288, 'optimizer': 'Adam'}. Best is trial 4 with value: 0.11847522329459384.
2026-05-11 00:58:07,567 - optuna.study._optimize - INFO - Trial 25 pruned. 
2026-05-11 00:58:36,985 - optuna.study.study - INFO - Trial 26 finished with value: 0.04702328809139681 and parameters: {'n_layers': 1, 'embedding_dim': 96, 'lr': 0.00027351865895931983, 'lambda_val': 0.002163031076289882, 'batch_size': 2969, 'optimizer': 'Adam'}. Best is trial 4 with value: 0.11847522329459384.
2026-05-11 00:58:42,354 - optuna.study._optimize - INFO - Trial 27 pruned. 
2026-05-11 00:58:46,941 - optuna.study._optimize - INFO - Trial 28 pruned. 
2026-05-11 00:59:15,957 - optuna.study.study - INFO - Trial 29 finished with value: 0.08328672658924144 and parameters: {'n_layers': 1, 'embedding_dim': 96, 'lr': 0.00014847333488510195, 'lambda_val': 6.130400520956328e-05, 'batch_size': 2779, 'optimizer': 'RMSprop'}. Best is trial 4 with value: 0.11847522329459384.
2026-05-11 00:59:21,681 - optuna.study._optimize - INFO - Trial 30 pruned. 
2026-05-11 00:59:54,801 - optuna.study.study - INFO - Trial 31 finished with value: 0.0516123303469 and parameters: {'n_layers': 1, 'embedding_dim': 96, 'lr': 0.0006187906422269397, 'lambda_val': 0.00011984637083732872, 'batch_size': 2794, 'optimizer': 'RMSprop'}. Best is trial 4 with value: 0.11847522329459384.
2026-05-11 00:59:58,896 - optuna.study._optimize - INFO - Trial 32 pruned. 
2026-05-11 01:00:03,731 - optuna.study._optimize - INFO - Trial 33 pruned. 
2026-05-11 01:00:07,828 - optuna.study._optimize - INFO - Trial 34 pruned. 
2026-05-11 01:00:45,141 - optuna.study.study - INFO - Trial 35 finished with value: 0.028010043152882757 and parameters: {'n_layers': 2, 'embedding_dim': 128, 'lr': 0.000315036284064852, 'lambda_val': 0.00018665316512571367, 'batch_size': 1838, 'optimizer': 'RMSprop'}. Best is trial 4 with value: 0.11847522329459384.
2026-05-11 01:00:49,121 - optuna.study._optimize - INFO - Trial 36 pruned. 
2026-05-11 01:01:25,874 - optuna.study.study - INFO - Trial 37 finished with value: 0.05978210231164339 and parameters: {'n_layers': 1, 'embedding_dim': 256, 'lr': 0.004238471484007609, 'lambda_val': 7.051886732692532e-05, 'batch_size': 3894, 'optimizer': 'Adam'}. Best is trial 4 with value: 0.11847522329459384.
2026-05-11 01:01:29,937 - optuna.study._optimize - INFO - Trial 38 pruned. 
2026-05-11 01:01:59,904 - optuna.study.study - INFO - Trial 39 finished with value: 0.08321237115474837 and parameters: {'n_layers': 1, 'embedding_dim': 96, 'lr': 0.00020545056052909052, 'lambda_val': 0.0006601202796467288, 'batch_size': 1988, 'optimizer': 'Adam'}. Best is trial 4 with value: 0.11847522329459384.
2026-05-11 01:02:05,061 - optuna.study._optimize - INFO - Trial 40 pruned. 
2026-05-11 01:02:33,941 - optuna.study.study - INFO - Trial 41 finished with value: 0.041840763989609224 and parameters: {'n_layers': 1, 'embedding_dim': 96, 'lr': 0.00039803586734967394, 'lambda_val': 0.009345894973233463, 'batch_size': 1907, 'optimizer': 'Adam'}. Best is trial 4 with value: 0.11847522329459384.
2026-05-11 01:02:38,212 - optuna.study._optimize - INFO - Trial 42 pruned. 
2026-05-11 01:02:42,198 - optuna.study._optimize - INFO - Trial 43 pruned. 
2026-05-11 01:03:11,704 - optuna.study.study - INFO - Trial 44 finished with value: 0.06297219074330508 and parameters: {'n_layers': 1, 'embedding_dim': 96, 'lr': 0.00025512149540040253, 'lambda_val': 0.00021392441132309472, 'batch_size': 2272, 'optimizer': 'Adam'}. Best is trial 4 with value: 0.11847522329459384.
2026-05-11 01:03:16,991 - optuna.study._optimize - INFO - Trial 45 pruned. 
2026-05-11 01:03:21,075 - optuna.study._optimize - INFO - Trial 46 pruned. 
2026-05-11 01:03:27,560 - optuna.study._optimize - INFO - Trial 47 pruned. 
2026-05-11 01:03:56,751 - optuna.study.study - INFO - Trial 48 finished with value: 0.09227573452240591 and parameters: {'n_layers': 1, 'embedding_dim': 96, 'lr': 0.00015426728094005687, 'lambda_val': 0.0015033286639018631, 'batch_size': 1969, 'optimizer': 'Adam'}. Best is trial 4 with value: 0.11847522329459384.
2026-05-11 01:04:01,518 - optuna.study._optimize - INFO - Trial 49 pruned. 
2026-05-11 01:04:04,998 - optuna.study._optimize - INFO - Trial 50 pruned. 
2026-05-11 01:04:08,695 - optuna.study._optimize - INFO - Trial 51 pruned. 
2026-05-11 01:04:38,939 - optuna.study.study - INFO - Trial 52 finished with value: 0.049721602274103605 and parameters: {'n_layers': 1, 'embedding_dim': 96, 'lr': 0.00043255044705174114, 'lambda_val': 0.0014974692741997263, 'batch_size': 1511, 'optimizer': 'Adam'}. Best is trial 4 with value: 0.11847522329459384.
2026-05-11 01:04:43,143 - optuna.study._optimize - INFO - Trial 53 pruned. 
2026-05-11 01:05:12,519 - optuna.study.study - INFO - Trial 54 finished with value: 0.062045373604590934 and parameters: {'n_layers': 1, 'embedding_dim': 128, 'lr': 0.00017723377755689157, 'lambda_val': 0.0055669497401888285, 'batch_size': 1729, 'optimizer': 'Adam'}. Best is trial 4 with value: 0.11847522329459384.
2026-05-11 01:05:16,530 - optuna.study._optimize - INFO - Trial 55 pruned. 
2026-05-11 01:05:53,453 - optuna.study.study - INFO - Trial 56 finished with value: 0.05780283429801006 and parameters: {'n_layers': 1, 'embedding_dim': 256, 'lr': 0.00023333973042424715, 'lambda_val': 0.0026709360553262723, 'batch_size': 2932, 'optimizer': 'Adam'}. Best is trial 4 with value: 0.11847522329459384.
2026-05-11 01:05:57,657 - optuna.study._optimize - INFO - Trial 57 pruned. 
2026-05-11 01:06:01,220 - optuna.study._optimize - INFO - Trial 58 pruned. 
2026-05-11 01:06:07,634 - optuna.study._optimize - INFO - Trial 59 pruned. 
2026-05-11 01:06:11,774 - optuna.study._optimize - INFO - Trial 60 pruned. 
2026-05-11 01:06:49,823 - optuna.study.study - INFO - Trial 61 finished with value: 0.06660877000521429 and parameters: {'n_layers': 1, 'embedding_dim': 256, 'lr': 0.002591326494012099, 'lambda_val': 0.0002963531832183211, 'batch_size': 3332, 'optimizer': 'Adam'}. Best is trial 4 with value: 0.11847522329459384.
2026-05-11 01:07:25,763 - optuna.study.study - INFO - Trial 62 finished with value: 0.05533513398847921 and parameters: {'n_layers': 1, 'embedding_dim': 256, 'lr': 0.0007662529384008258, 'lambda_val': 0.00012667577318855745, 'batch_size': 3663, 'optimizer': 'Adam'}. Best is trial 4 with value: 0.11847522329459384.
2026-05-11 01:08:02,206 - optuna.study.study - INFO - Trial 63 finished with value: 0.05356913964600282 and parameters: {'n_layers': 1, 'embedding_dim': 256, 'lr': 0.0014731286828591945, 'lambda_val': 1.3229631593619628e-05, 'batch_size': 3488, 'optimizer': 'Adam'}. Best is trial 4 with value: 0.11847522329459384.
2026-05-11 01:08:39,828 - optuna.study.study - INFO - Trial 64 finished with value: 0.06709364936628669 and parameters: {'n_layers': 1, 'embedding_dim': 256, 'lr': 0.002774443974218471, 'lambda_val': 0.00027886250336592555, 'batch_size': 3281, 'optimizer': 'Adam'}. Best is trial 4 with value: 0.11847522329459384.
2026-05-11 01:08:45,024 - optuna.study._optimize - INFO - Trial 65 pruned. 
2026-05-11 01:09:15,469 - optuna.study.study - INFO - Trial 66 finished with value: 0.046306203939960884 and parameters: {'n_layers': 1, 'embedding_dim': 96, 'lr': 0.0004752682916712343, 'lambda_val': 0.0011035933681968228, 'batch_size': 3859, 'optimizer': 'RMSprop'}. Best is trial 4 with value: 0.11847522329459384.
2026-05-11 01:09:22,952 - optuna.study._optimize - INFO - Trial 67 pruned. 
2026-05-11 01:09:26,980 - optuna.study._optimize - INFO - Trial 68 pruned. 
2026-05-11 01:10:01,032 - optuna.study.study - INFO - Trial 69 finished with value: 0.08813203053109206 and parameters: {'n_layers': 1, 'embedding_dim': 128, 'lr': 0.0001387061428137213, 'lambda_val': 0.00040004414702769086, 'batch_size': 2366, 'optimizer': 'Adam'}. Best is trial 4 with value: 0.11847522329459384.
2026-05-11 01:10:05,225 - optuna.study._optimize - INFO - Trial 70 pruned. 
2026-05-11 01:10:37,338 - optuna.study.study - INFO - Trial 71 finished with value: 0.07383002216492912 and parameters: {'n_layers': 1, 'embedding_dim': 128, 'lr': 0.00020445599660469185, 'lambda_val': 0.0003869321780841679, 'batch_size': 2367, 'optimizer': 'Adam'}. Best is trial 4 with value: 0.11847522329459384.
2026-05-11 01:10:42,647 - optuna.study._optimize - INFO - Trial 72 pruned. 
2026-05-11 01:11:12,941 - optuna.study.study - INFO - Trial 73 finished with value: 0.06734556265697095 and parameters: {'n_layers': 1, 'embedding_dim': 128, 'lr': 0.0003224868338959289, 'lambda_val': 0.0007494856871505315, 'batch_size': 2126, 'optimizer': 'Adam'}. Best is trial 4 with value: 0.11847522329459384.
2026-05-11 01:11:43,352 - optuna.study.study - INFO - Trial 74 finished with value: 0.07580750121045257 and parameters: {'n_layers': 1, 'embedding_dim': 128, 'lr': 0.0002125962715497843, 'lambda_val': 0.0007522384962675084, 'batch_size': 1830, 'optimizer': 'Adam'}. Best is trial 4 with value: 0.11847522329459384.
2026-05-11 01:12:13,606 - optuna.study.study - INFO - Trial 75 finished with value: 0.06457158197482961 and parameters: {'n_layers': 1, 'embedding_dim': 128, 'lr': 0.000212179132631692, 'lambda_val': 0.0016900368958723472, 'batch_size': 1864, 'optimizer': 'Adam'}. Best is trial 4 with value: 0.11847522329459384.
2026-05-11 01:12:18,064 - optuna.study._optimize - INFO - Trial 76 pruned. 
2026-05-11 01:12:22,214 - optuna.study._optimize - INFO - Trial 77 pruned. 
2026-05-11 01:12:53,302 - optuna.study.study - INFO - Trial 78 finished with value: 0.05552077725320633 and parameters: {'n_layers': 1, 'embedding_dim': 128, 'lr': 0.0002869955691959917, 'lambda_val': 0.0024248269630903767, 'batch_size': 1772, 'optimizer': 'RMSprop'}. Best is trial 4 with value: 0.11847522329459384.
2026-05-11 01:13:25,501 - optuna.study.study - INFO - Trial 79 finished with value: 0.07031472735054861 and parameters: {'n_layers': 1, 'embedding_dim': 128, 'lr': 0.00016093447258647064, 'lambda_val': 0.000428610816560213, 'batch_size': 4093, 'optimizer': 'Adam'}. Best is trial 4 with value: 0.11847522329459384.
2026-05-11 01:13:29,163 - optuna.study._optimize - INFO - Trial 80 pruned. 
2026-05-11 01:13:33,219 - optuna.study._optimize - INFO - Trial 81 pruned. 
2026-05-11 01:13:40,890 - optuna.study._optimize - INFO - Trial 82 pruned. 
2026-05-11 01:13:44,824 - optuna.study._optimize - INFO - Trial 83 pruned. 
2026-05-11 01:13:48,664 - optuna.study._optimize - INFO - Trial 84 pruned. 
2026-05-11 01:14:18,737 - optuna.study.study - INFO - Trial 85 finished with value: 0.06225075258420936 and parameters: {'n_layers': 1, 'embedding_dim': 128, 'lr': 0.00038775005671671056, 'lambda_val': 0.0009251658520282067, 'batch_size': 1603, 'optimizer': 'Adam'}. Best is trial 4 with value: 0.11847522329459384.
2026-05-11 01:14:22,398 - optuna.study._optimize - INFO - Trial 86 pruned. 
2026-05-11 01:14:25,946 - optuna.study._optimize - INFO - Trial 87 pruned. 
2026-05-11 01:14:29,624 - optuna.study._optimize - INFO - Trial 88 pruned. 
2026-05-11 01:14:55,916 - optuna.study.study - INFO - Trial 89 finished with value: 0.0700373477161812 and parameters: {'n_layers': 1, 'embedding_dim': 96, 'lr': 0.00025788227228369637, 'lambda_val': 1.7701175188445777e-05, 'batch_size': 2303, 'optimizer': 'Adam'}. Best is trial 4 with value: 0.11847522329459384.
2026-05-11 01:14:59,755 - optuna.study._optimize - INFO - Trial 90 pruned. 
2026-05-11 01:15:32,754 - optuna.study.study - INFO - Trial 91 finished with value: 0.06426660800675542 and parameters: {'n_layers': 1, 'embedding_dim': 96, 'lr': 0.00029144082414792695, 'lambda_val': 1.838113716006442e-05, 'batch_size': 2330, 'optimizer': 'Adam'}. Best is trial 4 with value: 0.11847522329459384.
2026-05-11 01:16:04,396 - optuna.study.study - INFO - Trial 92 finished with value: 0.053019520158981405 and parameters: {'n_layers': 1, 'embedding_dim': 96, 'lr': 0.0005631238505928557, 'lambda_val': 2.2968930463401912e-05, 'batch_size': 2442, 'optimizer': 'Adam'}. Best is trial 4 with value: 0.11847522329459384.
2026-05-11 01:16:38,041 - optuna.study.study - INFO - Trial 93 finished with value: 0.07371996816586354 and parameters: {'n_layers': 1, 'embedding_dim': 96, 'lr': 0.00021173923871628474, 'lambda_val': 0.000347859974706745, 'batch_size': 2554, 'optimizer': 'Adam'}. Best is trial 4 with value: 0.11847522329459384.
2026-05-11 01:17:10,333 - optuna.study.study - INFO - Trial 94 finished with value: 0.07018258009718688 and parameters: {'n_layers': 1, 'embedding_dim': 96, 'lr': 0.00024221571749180278, 'lambda_val': 4.9207152890558746e-05, 'batch_size': 2565, 'optimizer': 'Adam'}. Best is trial 4 with value: 0.11847522329459384.
2026-05-11 01:17:42,391 - optuna.study.study - INFO - Trial 95 finished with value: 0.05302568298228508 and parameters: {'n_layers': 1, 'embedding_dim': 96, 'lr': 0.0003536449320035374, 'lambda_val': 6.294578139805004e-05, 'batch_size': 2577, 'optimizer': 'Adam'}. Best is trial 4 with value: 0.11847522329459384.
2026-05-11 01:18:15,673 - optuna.study.study - INFO - Trial 96 finished with value: 0.06873134397991888 and parameters: {'n_layers': 1, 'embedding_dim': 96, 'lr': 0.00020374645763880184, 'lambda_val': 4.842106544771641e-05, 'batch_size': 2694, 'optimizer': 'Adam'}. Best is trial 4 with value: 0.11847522329459384.
2026-05-11 01:18:19,371 - optuna.study._optimize - INFO - Trial 97 pruned. 
2026-05-11 01:18:23,245 - optuna.study._optimize - INFO - Trial 98 pruned. 
2026-05-11 01:18:29,405 - optuna.study._optimize - INFO - Trial 99 pruned. 
2026-05-11 01:18:33,090 - optuna.study._optimize - INFO - Trial 100 pruned. 
2026-05-11 01:19:03,198 - optuna.study.study - INFO - Trial 101 finished with value: 0.07056928452103955 and parameters: {'n_layers': 1, 'embedding_dim': 96, 'lr': 0.00024505596368614433, 'lambda_val': 2.880469741707899e-05, 'batch_size': 2262, 'optimizer': 'Adam'}. Best is trial 4 with value: 0.11847522329459384.
2026-05-11 01:19:31,192 - optuna.study.study - INFO - Trial 102 finished with value: 0.07894487623917354 and parameters: {'n_layers': 1, 'embedding_dim': 96, 'lr': 0.000223088619587936, 'lambda_val': 3.844261964018023e-05, 'batch_size': 2038, 'optimizer': 'Adam'}. Best is trial 4 with value: 0.11847522329459384.
2026-05-11 01:19:37,917 - optuna.study._optimize - INFO - Trial 103 pruned. 
2026-05-11 01:19:41,426 - optuna.study._optimize - INFO - Trial 104 pruned. 
2026-05-11 01:20:11,251 - optuna.study.study - INFO - Trial 105 finished with value: 0.053703988015993916 and parameters: {'n_layers': 1, 'embedding_dim': 96, 'lr': 0.00048284385883948623, 'lambda_val': 3.416013941422363e-05, 'batch_size': 1854, 'optimizer': 'Adam'}. Best is trial 4 with value: 0.11847522329459384.
2026-05-11 01:20:15,910 - optuna.study._optimize - INFO - Trial 106 pruned. 
2026-05-11 01:20:19,950 - optuna.study._optimize - INFO - Trial 107 pruned. 
2026-05-11 01:20:50,225 - optuna.study.study - INFO - Trial 108 finished with value: 0.06390653114464319 and parameters: {'n_layers': 1, 'embedding_dim': 32, 'lr': 0.00032531263720879833, 'lambda_val': 0.000145638074169776, 'batch_size': 1928, 'optimizer': 'Adam'}. Best is trial 4 with value: 0.11847522329459384.
2026-05-11 01:21:19,708 - optuna.study.study - INFO - Trial 109 finished with value: 0.07074465470155772 and parameters: {'n_layers': 1, 'embedding_dim': 96, 'lr': 0.00023484474701229488, 'lambda_val': 7.597047266685828e-05, 'batch_size': 2126, 'optimizer': 'Adam'}. Best is trial 4 with value: 0.11847522329459384.
2026-05-11 01:21:27,079 - optuna.study._optimize - INFO - Trial 110 pruned. 
2026-05-11 01:21:31,124 - optuna.study._optimize - INFO - Trial 111 pruned. 
2026-05-11 01:21:34,987 - optuna.study._optimize - INFO - Trial 112 pruned. 
2026-05-11 01:22:03,055 - optuna.study.study - INFO - Trial 113 finished with value: 0.05894088397928794 and parameters: {'n_layers': 1, 'embedding_dim': 96, 'lr': 0.00037680740409299425, 'lambda_val': 4.0762853699981096e-05, 'batch_size': 2225, 'optimizer': 'Adam'}. Best is trial 4 with value: 0.11847522329459384.
2026-05-11 01:22:07,015 - optuna.study._optimize - INFO - Trial 114 pruned. 
2026-05-11 01:22:10,885 - optuna.study._optimize - INFO - Trial 115 pruned. 
2026-05-11 01:22:41,524 - optuna.study.study - INFO - Trial 116 finished with value: 0.061571552126423346 and parameters: {'n_layers': 1, 'embedding_dim': 64, 'lr': 0.0002798715365807013, 'lambda_val': 0.00011231566544602424, 'batch_size': 2108, 'optimizer': 'Adam'}. Best is trial 4 with value: 0.11847522329459384.
2026-05-11 01:23:13,031 - optuna.study.study - INFO - Trial 117 finished with value: 0.07300646721617614 and parameters: {'n_layers': 1, 'embedding_dim': 128, 'lr': 0.00021002776228364736, 'lambda_val': 0.0003381616334700757, 'batch_size': 2285, 'optimizer': 'Adam'}. Best is trial 4 with value: 0.11847522329459384.
2026-05-11 01:23:18,998 - optuna.study._optimize - INFO - Trial 118 pruned. 
2026-05-11 01:23:51,861 - optuna.study.study - INFO - Trial 119 finished with value: 0.049067269333059306 and parameters: {'n_layers': 1, 'embedding_dim': 128, 'lr': 0.0006849220380031107, 'lambda_val': 0.0006533226329435161, 'batch_size': 2648, 'optimizer': 'Adam'}. Best is trial 4 with value: 0.11847522329459384.
2026-05-11 01:24:26,636 - optuna.study.study - INFO - Trial 120 finished with value: 0.05279720154185594 and parameters: {'n_layers': 1, 'embedding_dim': 96, 'lr': 0.000441503625239687, 'lambda_val': 0.0008806184301198708, 'batch_size': 2297, 'optimizer': 'Adam'}. Best is trial 4 with value: 0.11847522329459384.
2026-05-11 01:24:58,545 - optuna.study.study - INFO - Trial 121 finished with value: 0.07446875642967281 and parameters: {'n_layers': 1, 'embedding_dim': 128, 'lr': 0.00018620449861410406, 'lambda_val': 0.00048669954780793367, 'batch_size': 2197, 'optimizer': 'Adam'}. Best is trial 4 with value: 0.11847522329459384.
2026-05-11 01:25:28,629 - optuna.study.study - INFO - Trial 122 finished with value: 0.0761060310876425 and parameters: {'n_layers': 1, 'embedding_dim': 128, 'lr': 0.00019769510403056304, 'lambda_val': 0.000512402027841705, 'batch_size': 2192, 'optimizer': 'Adam'}. Best is trial 4 with value: 0.11847522329459384.
2026-05-11 01:26:00,952 - optuna.study.study - INFO - Trial 123 finished with value: 0.08519909923729448 and parameters: {'n_layers': 1, 'embedding_dim': 128, 'lr': 0.00019191626689594652, 'lambda_val': 0.0002712987735131335, 'batch_size': 1996, 'optimizer': 'Adam'}. Best is trial 4 with value: 0.11847522329459384.
2026-05-11 01:26:31,630 - optuna.study.study - INFO - Trial 124 finished with value: 0.09014884211728415 and parameters: {'n_layers': 1, 'embedding_dim': 128, 'lr': 0.00019323813415776975, 'lambda_val': 0.00047983110192430884, 'batch_size': 1960, 'optimizer': 'Adam'}. Best is trial 4 with value: 0.11847522329459384.
2026-05-11 01:26:35,435 - optuna.study._optimize - INFO - Trial 125 pruned. 
2026-05-11 01:26:39,174 - optuna.study._optimize - INFO - Trial 126 pruned. 
2026-05-11 01:26:43,035 - optuna.study._optimize - INFO - Trial 127 pruned. 
2026-05-11 01:26:46,841 - optuna.study._optimize - INFO - Trial 128 pruned. 
2026-05-11 01:26:50,585 - optuna.study._optimize - INFO - Trial 129 pruned. 
2026-05-11 01:27:24,790 - optuna.study.study - INFO - Trial 130 finished with value: 0.05434167515940849 and parameters: {'n_layers': 1, 'embedding_dim': 128, 'lr': 0.00032660360928261206, 'lambda_val': 0.001010454724027292, 'batch_size': 2052, 'optimizer': 'Adam'}. Best is trial 4 with value: 0.11847522329459384.
2026-05-11 01:27:57,405 - optuna.study.study - INFO - Trial 131 finished with value: 0.07786677185260611 and parameters: {'n_layers': 1, 'embedding_dim': 128, 'lr': 0.00019959873695306736, 'lambda_val': 0.0003089876894004847, 'batch_size': 2179, 'optimizer': 'Adam'}. Best is trial 4 with value: 0.11847522329459384.
2026-05-11 01:28:32,293 - optuna.study.study - INFO - Trial 132 finished with value: 0.0670592035149117 and parameters: {'n_layers': 1, 'embedding_dim': 128, 'lr': 0.00027593018532204777, 'lambda_val': 0.00018954489504675632, 'batch_size': 2483, 'optimizer': 'Adam'}. Best is trial 4 with value: 0.11847522329459384.
2026-05-11 01:28:36,262 - optuna.study._optimize - INFO - Trial 133 pruned. 
2026-05-11 01:28:42,253 - optuna.study._optimize - INFO - Trial 134 pruned. 
2026-05-11 01:28:45,993 - optuna.study._optimize - INFO - Trial 135 pruned. 
2026-05-11 01:28:50,583 - optuna.study._optimize - INFO - Trial 136 pruned. 
2026-05-11 01:29:19,992 - optuna.study.study - INFO - Trial 137 finished with value: 0.06285016426048053 and parameters: {'n_layers': 1, 'embedding_dim': 128, 'lr': 0.00028320058310737396, 'lambda_val': 0.0004584728900686424, 'batch_size': 2180, 'optimizer': 'Adam'}. Best is trial 4 with value: 0.11847522329459384.
