2026-05-11 13:56:29,451 - optuna.study.study - INFO - Trial 121 finished with value: 0.08669139876503029 and parameters: {'n_layers': 1, 'embedding_dim': 256, 'lr': 0.011014039197873937, 'lambda_val': 0.0006679103528652579, 'batch_size': 3807, 'optimizer': 'RMSprop'}. Best is trial 93 with value: 0.09646695452906398.
2026-05-11 13:56:48,238 - optuna.study._optimize - INFO - Trial 122 pruned. 
2026-05-11 13:57:36,589 - optuna.study.study - INFO - Trial 123 finished with value: 0.08306588489684294 and parameters: {'n_layers': 1, 'embedding_dim': 256, 'lr': 0.010793140916911739, 'lambda_val': 0.0014121487795046004, 'batch_size': 3815, 'optimizer': 'RMSprop'}. Best is trial 93 with value: 0.09646695452906398.
2026-05-11 13:58:15,633 - optuna.study.study - INFO - Trial 124 finished with value: 0.08408596594301256 and parameters: {'n_layers': 1, 'embedding_dim': 256, 'lr': 0.0053879937901438095, 'lambda_val': 0.0004797926008948569, 'batch_size': 4083, 'optimizer': 'RMSprop'}. Best is trial 93 with value: 0.09646695452906398.
2026-05-11 13:58:53,189 - optuna.study.study - INFO - Trial 125 finished with value: 0.08804744656356286 and parameters: {'n_layers': 1, 'embedding_dim': 256, 'lr': 0.007474989988841198, 'lambda_val': 0.0009828360006386959, 'batch_size': 3710, 'optimizer': 'RMSprop'}. Best is trial 93 with value: 0.09646695452906398.
2026-05-11 13:59:31,917 - optuna.study.study - INFO - Trial 126 finished with value: 0.09167362349365116 and parameters: {'n_layers': 1, 'embedding_dim': 256, 'lr': 0.007711811146654177, 'lambda_val': 0.0008447391866954471, 'batch_size': 3894, 'optimizer': 'RMSprop'}. Best is trial 93 with value: 0.09646695452906398.
2026-05-11 14:00:21,411 - optuna.study.study - INFO - Trial 127 finished with value: 0.08961654764229797 and parameters: {'n_layers': 1, 'embedding_dim': 256, 'lr': 0.007334195171031972, 'lambda_val': 0.0009189013492362382, 'batch_size': 3921, 'optimizer': 'RMSprop'}. Best is trial 93 with value: 0.09646695452906398.
2026-05-11 14:00:59,047 - optuna.study.study - INFO - Trial 128 finished with value: 0.08711811426226164 and parameters: {'n_layers': 1, 'embedding_dim': 256, 'lr': 0.004338410537005279, 'lambda_val': 0.0010994338536595403, 'batch_size': 3500, 'optimizer': 'RMSprop'}. Best is trial 93 with value: 0.09646695452906398.
2026-05-11 14:01:03,863 - optuna.study._optimize - INFO - Trial 129 pruned. 
2026-05-11 14:01:08,180 - optuna.study._optimize - INFO - Trial 130 pruned. 
2026-05-11 14:01:44,595 - optuna.study.study - INFO - Trial 131 finished with value: 0.08234296970783524 and parameters: {'n_layers': 1, 'embedding_dim': 256, 'lr': 0.007799377506602396, 'lambda_val': 0.0016606956919963426, 'batch_size': 4005, 'optimizer': 'RMSprop'}. Best is trial 93 with value: 0.09646695452906398.
2026-05-11 14:02:20,127 - optuna.study.study - INFO - Trial 132 finished with value: 0.08867578511102568 and parameters: {'n_layers': 1, 'embedding_dim': 256, 'lr': 0.006064114110716976, 'lambda_val': 0.0021862603837312887, 'batch_size': 3917, 'optimizer': 'RMSprop'}. Best is trial 93 with value: 0.09646695452906398.
2026-05-11 14:02:56,320 - optuna.study.study - INFO - Trial 133 finished with value: 0.09343986781402591 and parameters: {'n_layers': 1, 'embedding_dim': 256, 'lr': 0.0046727588242013495, 'lambda_val': 0.0023883783979033427, 'batch_size': 3892, 'optimizer': 'RMSprop'}. Best is trial 93 with value: 0.09646695452906398.
2026-05-11 14:03:32,572 - optuna.study.study - INFO - Trial 134 finished with value: 0.08922950439151152 and parameters: {'n_layers': 1, 'embedding_dim': 256, 'lr': 0.005813396753630856, 'lambda_val': 0.003569355568681662, 'batch_size': 3900, 'optimizer': 'RMSprop'}. Best is trial 93 with value: 0.09646695452906398.
2026-05-11 14:04:08,694 - optuna.study.study - INFO - Trial 135 finished with value: 0.0929568727779151 and parameters: {'n_layers': 1, 'embedding_dim': 256, 'lr': 0.006440393235506561, 'lambda_val': 0.002537125692401595, 'batch_size': 3873, 'optimizer': 'RMSprop'}. Best is trial 93 with value: 0.09646695452906398.
2026-05-11 14:04:47,471 - optuna.study.study - INFO - Trial 136 finished with value: 0.0843972378377432 and parameters: {'n_layers': 1, 'embedding_dim': 256, 'lr': 0.006308878925219216, 'lambda_val': 0.0037294263036903707, 'batch_size': 3857, 'optimizer': 'RMSprop'}. Best is trial 93 with value: 0.09646695452906398.
2026-05-11 14:05:23,333 - optuna.study.study - INFO - Trial 137 finished with value: 0.08283554342567405 and parameters: {'n_layers': 1, 'embedding_dim': 256, 'lr': 0.005365675744061599, 'lambda_val': 0.002406014423773437, 'batch_size': 3928, 'optimizer': 'RMSprop'}. Best is trial 93 with value: 0.09646695452906398.
2026-05-11 14:05:27,971 - optuna.study._optimize - INFO - Trial 138 pruned. 
2026-05-11 14:06:04,062 - optuna.study.study - INFO - Trial 139 finished with value: 0.08449398037393273 and parameters: {'n_layers': 1, 'embedding_dim': 256, 'lr': 0.008940163422104576, 'lambda_val': 0.002512808022593572, 'batch_size': 3785, 'optimizer': 'RMSprop'}. Best is trial 93 with value: 0.09646695452906398.
2026-05-11 14:06:09,297 - optuna.study._optimize - INFO - Trial 140 pruned. 
2026-05-11 14:06:55,917 - optuna.study.study - INFO - Trial 141 finished with value: 0.08639391818761806 and parameters: {'n_layers': 1, 'embedding_dim': 256, 'lr': 0.007904441694009393, 'lambda_val': 0.002041135825217212, 'batch_size': 3693, 'optimizer': 'RMSprop'}. Best is trial 93 with value: 0.09646695452906398.
2026-05-11 14:07:33,428 - optuna.study.study - INFO - Trial 142 finished with value: 0.08594218555227318 and parameters: {'n_layers': 1, 'embedding_dim': 256, 'lr': 0.00662324827041818, 'lambda_val': 0.0008542486265904447, 'batch_size': 3814, 'optimizer': 'RMSprop'}. Best is trial 93 with value: 0.09646695452906398.
2026-05-11 14:07:48,225 - optuna.study._optimize - INFO - Trial 143 pruned. 
2026-05-11 14:08:24,191 - optuna.study.study - INFO - Trial 144 finished with value: 0.08819182444954718 and parameters: {'n_layers': 1, 'embedding_dim': 256, 'lr': 0.006468659641297175, 'lambda_val': 0.000690698908820025, 'batch_size': 3957, 'optimizer': 'RMSprop'}. Best is trial 93 with value: 0.09646695452906398.
2026-05-11 14:09:00,953 - optuna.study.study - INFO - Trial 145 finished with value: 0.08278038171539867 and parameters: {'n_layers': 1, 'embedding_dim': 256, 'lr': 0.003830529229139686, 'lambda_val': 0.002977113295482541, 'batch_size': 3943, 'optimizer': 'RMSprop'}. Best is trial 93 with value: 0.09646695452906398.
2026-05-11 14:09:07,760 - optuna.study._optimize - INFO - Trial 146 pruned. 
2026-05-11 14:09:55,909 - optuna.study.study - INFO - Trial 147 finished with value: 0.08617219984668749 and parameters: {'n_layers': 1, 'embedding_dim': 256, 'lr': 0.0068975068948861976, 'lambda_val': 0.001953476013022009, 'batch_size': 4090, 'optimizer': 'RMSprop'}. Best is trial 93 with value: 0.09646695452906398.
2026-05-11 14:10:20,481 - optuna.study._optimize - INFO - Trial 148 pruned. 
2026-05-11 14:10:57,440 - optuna.study.study - INFO - Trial 149 finished with value: 0.08992494856598926 and parameters: {'n_layers': 1, 'embedding_dim': 256, 'lr': 0.0049956639787003725, 'lambda_val': 0.0012377465654581303, 'batch_size': 3976, 'optimizer': 'RMSprop'}. Best is trial 93 with value: 0.09646695452906398.
2026-05-11 14:11:36,468 - optuna.study.study - INFO - Trial 150 finished with value: 0.08263444467727474 and parameters: {'n_layers': 1, 'embedding_dim': 256, 'lr': 0.004568615367719961, 'lambda_val': 0.001267748149969579, 'batch_size': 3648, 'optimizer': 'RMSprop'}. Best is trial 93 with value: 0.09646695452906398.
2026-05-11 14:12:12,445 - optuna.study.study - INFO - Trial 151 finished with value: 0.08346880061249887 and parameters: {'n_layers': 1, 'embedding_dim': 256, 'lr': 0.008088979860933139, 'lambda_val': 0.002353623046927601, 'batch_size': 3960, 'optimizer': 'RMSprop'}. Best is trial 93 with value: 0.09646695452906398.
2026-05-11 14:12:48,458 - optuna.study.study - INFO - Trial 152 finished with value: 0.09184787847228487 and parameters: {'n_layers': 1, 'embedding_dim': 256, 'lr': 0.0051766963172146145, 'lambda_val': 0.0011980755083032069, 'batch_size': 3846, 'optimizer': 'RMSprop'}. Best is trial 93 with value: 0.09646695452906398.
2026-05-11 14:13:24,773 - optuna.study.study - INFO - Trial 153 finished with value: 0.08882800880857177 and parameters: {'n_layers': 1, 'embedding_dim': 256, 'lr': 0.0049927121857969705, 'lambda_val': 0.001126293728398459, 'batch_size': 3837, 'optimizer': 'RMSprop'}. Best is trial 93 with value: 0.09646695452906398.
2026-05-11 14:14:02,571 - optuna.study.study - INFO - Trial 154 finished with value: 0.08510985043336386 and parameters: {'n_layers': 1, 'embedding_dim': 256, 'lr': 0.004403193422271803, 'lambda_val': 0.0012424267385062334, 'batch_size': 3851, 'optimizer': 'RMSprop'}. Best is trial 93 with value: 0.09646695452906398.
2026-05-11 14:14:49,599 - optuna.study.study - INFO - Trial 155 finished with value: 0.0877153967063188 and parameters: {'n_layers': 1, 'embedding_dim': 256, 'lr': 0.005439403044822093, 'lambda_val': 0.0009723310171057694, 'batch_size': 3782, 'optimizer': 'RMSprop'}. Best is trial 93 with value: 0.09646695452906398.
2026-05-11 14:15:25,258 - optuna.study.study - INFO - Trial 156 finished with value: 0.08449826543169166 and parameters: {'n_layers': 1, 'embedding_dim': 256, 'lr': 0.003524409232269169, 'lambda_val': 0.0007613881735428202, 'batch_size': 4029, 'optimizer': 'RMSprop'}. Best is trial 93 with value: 0.09646695452906398.
2026-05-11 14:15:29,958 - optuna.study._optimize - INFO - Trial 157 pruned. 
2026-05-11 14:16:05,403 - optuna.study.study - INFO - Trial 158 finished with value: 0.08735391832203826 and parameters: {'n_layers': 1, 'embedding_dim': 256, 'lr': 0.006542037692100305, 'lambda_val': 0.0014455857774771264, 'batch_size': 3895, 'optimizer': 'RMSprop'}. Best is trial 93 with value: 0.09646695452906398.
2026-05-11 14:16:42,743 - optuna.study.study - INFO - Trial 159 finished with value: 0.08816906130591516 and parameters: {'n_layers': 1, 'embedding_dim': 128, 'lr': 0.00908512285042563, 'lambda_val': 0.0011482967256271634, 'batch_size': 3784, 'optimizer': 'RMSprop'}. Best is trial 93 with value: 0.09646695452906398.
2026-05-11 14:16:50,138 - optuna.study._optimize - INFO - Trial 160 pruned. 
2026-05-11 14:16:54,659 - optuna.study._optimize - INFO - Trial 161 pruned. 
2026-05-11 14:16:58,950 - optuna.study._optimize - INFO - Trial 162 pruned. 
2026-05-11 14:17:30,088 - optuna.study.study - INFO - Trial 163 finished with value: 0.0815121195770893 and parameters: {'n_layers': 1, 'embedding_dim': 128, 'lr': 0.010647416127121815, 'lambda_val': 0.0011573286354371697, 'batch_size': 3843, 'optimizer': 'RMSprop'}. Best is trial 93 with value: 0.09646695452906398.
2026-05-11 14:18:06,324 - optuna.study.study - INFO - Trial 164 finished with value: 0.09058469958108978 and parameters: {'n_layers': 1, 'embedding_dim': 256, 'lr': 0.004299311304748398, 'lambda_val': 0.0014561515505996981, 'batch_size': 3918, 'optimizer': 'RMSprop'}. Best is trial 93 with value: 0.09646695452906398.
2026-05-11 14:18:10,389 - optuna.study._optimize - INFO - Trial 165 pruned. 
2026-05-11 14:18:46,435 - optuna.study.study - INFO - Trial 166 finished with value: 0.08657078426835901 and parameters: {'n_layers': 1, 'embedding_dim': 256, 'lr': 0.0042299219772440645, 'lambda_val': 0.0014116094498252958, 'batch_size': 3993, 'optimizer': 'RMSprop'}. Best is trial 93 with value: 0.09646695452906398.
2026-05-11 14:18:50,282 - optuna.study._optimize - INFO - Trial 167 pruned. 
2026-05-11 14:19:26,543 - optuna.study.study - INFO - Trial 168 finished with value: 0.08750910856977041 and parameters: {'n_layers': 1, 'embedding_dim': 256, 'lr': 0.005731093694656606, 'lambda_val': 0.0017104450932010334, 'batch_size': 3914, 'optimizer': 'RMSprop'}. Best is trial 93 with value: 0.09646695452906398.
2026-05-11 14:19:35,063 - optuna.study._optimize - INFO - Trial 169 pruned. 
2026-05-11 14:19:40,329 - optuna.study._optimize - INFO - Trial 170 pruned. 
2026-05-11 14:20:17,091 - optuna.study.study - INFO - Trial 171 finished with value: 0.09104907886940763 and parameters: {'n_layers': 1, 'embedding_dim': 256, 'lr': 0.007333515845068809, 'lambda_val': 0.0010434520365628823, 'batch_size': 3735, 'optimizer': 'RMSprop'}. Best is trial 93 with value: 0.09646695452906398.
2026-05-11 14:20:54,579 - optuna.study.study - INFO - Trial 172 finished with value: 0.08966630558902687 and parameters: {'n_layers': 1, 'embedding_dim': 256, 'lr': 0.008738452082763215, 'lambda_val': 0.0011718105086030422, 'batch_size': 3848, 'optimizer': 'RMSprop'}. Best is trial 93 with value: 0.09646695452906398.
2026-05-11 14:21:31,592 - optuna.study.study - INFO - Trial 173 finished with value: 0.0897014902954179 and parameters: {'n_layers': 1, 'embedding_dim': 256, 'lr': 0.008534173596160488, 'lambda_val': 0.0012692514763384354, 'batch_size': 3967, 'optimizer': 'RMSprop'}. Best is trial 93 with value: 0.09646695452906398.
2026-05-11 14:22:07,859 - optuna.study.study - INFO - Trial 174 finished with value: 0.09106260676490496 and parameters: {'n_layers': 1, 'embedding_dim': 256, 'lr': 0.006247164538173542, 'lambda_val': 0.0015813074289930096, 'batch_size': 4006, 'optimizer': 'RMSprop'}. Best is trial 93 with value: 0.09646695452906398.
2026-05-11 14:22:44,421 - optuna.study.study - INFO - Trial 175 finished with value: 0.08906079548706389 and parameters: {'n_layers': 1, 'embedding_dim': 256, 'lr': 0.007859427768977302, 'lambda_val': 0.002250375339294158, 'batch_size': 4035, 'optimizer': 'RMSprop'}. Best is trial 93 with value: 0.09646695452906398.
2026-05-11 14:23:21,516 - optuna.study.study - INFO - Trial 176 finished with value: 0.0839520547990712 and parameters: {'n_layers': 1, 'embedding_dim': 256, 'lr': 0.004961500630934801, 'lambda_val': 0.002514447250736764, 'batch_size': 4030, 'optimizer': 'RMSprop'}. Best is trial 93 with value: 0.09646695452906398.
2026-05-11 14:23:25,887 - optuna.study._optimize - INFO - Trial 177 pruned. 
2026-05-11 14:24:07,355 - optuna.study.study - INFO - Trial 178 finished with value: 0.08176016551242538 and parameters: {'n_layers': 1, 'embedding_dim': 256, 'lr': 0.008249281318464186, 'lambda_val': 0.0014905130807964767, 'batch_size': 3964, 'optimizer': 'RMSprop'}. Best is trial 93 with value: 0.09646695452906398.
2026-05-11 14:24:43,485 - optuna.study.study - INFO - Trial 179 finished with value: 0.0898273007019768 and parameters: {'n_layers': 1, 'embedding_dim': 256, 'lr': 0.006228872315464994, 'lambda_val': 0.002151996210745172, 'batch_size': 4089, 'optimizer': 'RMSprop'}. Best is trial 93 with value: 0.09646695452906398.
2026-05-11 14:25:21,107 - optuna.study.study - INFO - Trial 180 finished with value: 0.08283505474965602 and parameters: {'n_layers': 1, 'embedding_dim': 256, 'lr': 0.004552909969557497, 'lambda_val': 0.003149678081921279, 'batch_size': 4075, 'optimizer': 'RMSprop'}. Best is trial 93 with value: 0.09646695452906398.
2026-05-11 14:25:57,217 - optuna.study.study - INFO - Trial 181 finished with value: 0.0861920766566049 and parameters: {'n_layers': 1, 'embedding_dim': 256, 'lr': 0.006102064040668278, 'lambda_val': 0.0021813299696393663, 'batch_size': 3852, 'optimizer': 'RMSprop'}. Best is trial 93 with value: 0.09646695452906398.
2026-05-11 14:26:34,002 - optuna.study.study - INFO - Trial 182 finished with value: 0.0858383123445598 and parameters: {'n_layers': 1, 'embedding_dim': 256, 'lr': 0.007226797183605255, 'lambda_val': 0.0014071259868740722, 'batch_size': 4094, 'optimizer': 'RMSprop'}. Best is trial 93 with value: 0.09646695452906398.
2026-05-11 14:26:39,360 - optuna.study._optimize - INFO - Trial 183 pruned. 
2026-05-11 14:26:44,152 - optuna.study._optimize - INFO - Trial 184 pruned. 
2026-05-11 14:26:49,179 - optuna.study._optimize - INFO - Trial 185 pruned. 
2026-05-11 14:27:38,795 - optuna.study.study - INFO - Trial 186 finished with value: 0.0893986621140549 and parameters: {'n_layers': 1, 'embedding_dim': 256, 'lr': 0.0070223450181389055, 'lambda_val': 0.0016976236505584694, 'batch_size': 3840, 'optimizer': 'RMSprop'}. Best is trial 93 with value: 0.09646695452906398.
2026-05-11 14:27:47,459 - optuna.study._optimize - INFO - Trial 187 pruned. 
2026-05-11 14:28:29,030 - optuna.study.study - INFO - Trial 188 finished with value: 0.09070034305064417 and parameters: {'n_layers': 1, 'embedding_dim': 256, 'lr': 0.007976135448880135, 'lambda_val': 0.0011759840250480588, 'batch_size': 4006, 'optimizer': 'RMSprop'}. Best is trial 93 with value: 0.09646695452906398.
2026-05-11 14:29:15,463 - optuna.study.study - INFO - Trial 189 finished with value: 0.08773811498781325 and parameters: {'n_layers': 1, 'embedding_dim': 256, 'lr': 0.0086915224548938, 'lambda_val': 0.0013457308649321004, 'batch_size': 3973, 'optimizer': 'RMSprop'}. Best is trial 93 with value: 0.09646695452906398.
2026-05-11 14:29:51,942 - optuna.study.study - INFO - Trial 190 finished with value: 0.085174830899564 and parameters: {'n_layers': 1, 'embedding_dim': 256, 'lr': 0.007410580342226943, 'lambda_val': 0.001808332353084919, 'batch_size': 4033, 'optimizer': 'RMSprop'}. Best is trial 93 with value: 0.09646695452906398.
2026-05-11 14:30:30,053 - optuna.study.study - INFO - Trial 191 finished with value: 0.09233625268993108 and parameters: {'n_layers': 1, 'embedding_dim': 256, 'lr': 0.005247775280813603, 'lambda_val': 0.0009952026435506485, 'batch_size': 3852, 'optimizer': 'RMSprop'}. Best is trial 93 with value: 0.09646695452906398.
2026-05-11 14:30:34,861 - optuna.study._optimize - INFO - Trial 192 pruned. 
2026-05-11 14:31:16,387 - optuna.study.study - INFO - Trial 193 finished with value: 0.09101338898410233 and parameters: {'n_layers': 1, 'embedding_dim': 256, 'lr': 0.009534580045512686, 'lambda_val': 0.0010326052067466365, 'batch_size': 4092, 'optimizer': 'RMSprop'}. Best is trial 93 with value: 0.09646695452906398.
2026-05-11 14:31:23,007 - optuna.study._optimize - INFO - Trial 194 pruned. 
2026-05-11 14:31:27,868 - optuna.study._optimize - INFO - Trial 195 pruned. 
2026-05-11 14:32:04,004 - optuna.study.study - INFO - Trial 196 finished with value: 0.08976584018702778 and parameters: {'n_layers': 1, 'embedding_dim': 256, 'lr': 0.005349959335409743, 'lambda_val': 0.001336488457918423, 'batch_size': 3873, 'optimizer': 'RMSprop'}. Best is trial 93 with value: 0.09646695452906398.
2026-05-11 14:32:42,258 - optuna.study.study - INFO - Trial 197 finished with value: 0.09155749202294927 and parameters: {'n_layers': 1, 'embedding_dim': 256, 'lr': 0.00409095365550648, 'lambda_val': 0.0014562224035638432, 'batch_size': 3752, 'optimizer': 'RMSprop'}. Best is trial 93 with value: 0.09646695452906398.
2026-05-11 14:32:49,114 - optuna.study._optimize - INFO - Trial 198 pruned. 
2026-05-11 14:33:25,537 - optuna.study.study - INFO - Trial 199 finished with value: 0.09281139964198287 and parameters: {'n_layers': 1, 'embedding_dim': 256, 'lr': 0.0046242124578398484, 'lambda_val': 0.0015406148313685355, 'batch_size': 3633, 'optimizer': 'RMSprop'}. Best is trial 93 with value: 0.09646695452906398.
2026-05-11 14:33:52,506 - root - INFO -   **** Training e_100K_1c3dcs_rand4
2026-05-11 14:33:52,519 - root - INFO -   **** Getting 56335/65410 random edges
2026-05-11 14:33:52,607 - optuna.storages._rdb.storage - INFO - A new study created in RDB with name: Study_e_100K_1c3dcs_rand4
2026-05-11 14:34:30,680 - optuna.study.study - INFO - Trial 0 finished with value: 0.01981760039458033 and parameters: {'n_layers': 4, 'embedding_dim': 64, 'lr': 0.008331991050321745, 'lambda_val': 0.0025414732083291766, 'batch_size': 2670, 'optimizer': 'Adam'}. Best is trial 0 with value: 0.01981760039458033.
2026-05-11 14:35:21,974 - optuna.study.study - INFO - Trial 1 finished with value: 0.10069508388786577 and parameters: {'n_layers': 1, 'embedding_dim': 256, 'lr': 0.00018132540825188805, 'lambda_val': 2.4089901455580103e-06, 'batch_size': 1275, 'optimizer': 'Adam'}. Best is trial 1 with value: 0.10069508388786577.
2026-05-11 14:36:45,051 - optuna.study.study - INFO - Trial 2 finished with value: 0.023330875708200173 and parameters: {'n_layers': 4, 'embedding_dim': 256, 'lr': 0.019475351843784898, 'lambda_val': 0.0034041185795693177, 'batch_size': 3090, 'optimizer': 'RMSprop'}. Best is trial 1 with value: 0.10069508388786577.
2026-05-11 14:37:34,807 - optuna.study.study - INFO - Trial 3 finished with value: 0.0017195061592045072 and parameters: {'n_layers': 4, 'embedding_dim': 64, 'lr': 0.013128214274358454, 'lambda_val': 4.428946000799634e-06, 'batch_size': 1860, 'optimizer': 'SGD'}. Best is trial 1 with value: 0.10069508388786577.
2026-05-11 14:38:01,337 - optuna.study.study - INFO - Trial 4 finished with value: 0.05048710071379126 and parameters: {'n_layers': 1, 'embedding_dim': 128, 'lr': 0.001386355910587905, 'lambda_val': 0.0004984504059441306, 'batch_size': 1282, 'optimizer': 'Adam'}. Best is trial 1 with value: 0.10069508388786577.
2026-05-11 14:38:08,595 - optuna.study._optimize - INFO - Trial 5 pruned. 
2026-05-11 14:38:29,955 - optuna.study.study - INFO - Trial 6 finished with value: 0.08335320898666126 and parameters: {'n_layers': 1, 'embedding_dim': 32, 'lr': 0.0004952380396211967, 'lambda_val': 0.0003160280507268221, 'batch_size': 549, 'optimizer': 'Adam'}. Best is trial 1 with value: 0.10069508388786577.
2026-05-11 14:38:33,713 - optuna.study._optimize - INFO - Trial 7 pruned. 
2026-05-11 14:38:38,523 - optuna.study._optimize - INFO - Trial 8 pruned. 
2026-05-11 14:38:42,685 - optuna.study._optimize - INFO - Trial 9 pruned. 
2026-05-11 14:39:25,871 - optuna.study.study - INFO - Trial 10 finished with value: 0.08324548347228154 and parameters: {'n_layers': 2, 'embedding_dim': 256, 'lr': 0.00011660133101440941, 'lambda_val': 1.1676653495505454e-06, 'batch_size': 607, 'optimizer': 'Adam'}. Best is trial 1 with value: 0.10069508388786577.
