2026-05-11 15:50:58,724 - optuna.study.study - INFO - Trial 81 finished with value: 0.08193510163877446 and parameters: {'n_layers': 1, 'embedding_dim': 256, 'lr': 0.0022779029166638265, 'lambda_val': 0.0017282982483495196, 'batch_size': 3870, 'optimizer': 'Adam'}. Best is trial 77 with value: 0.08682483764771703.
2026-05-11 15:51:34,417 - optuna.study.study - INFO - Trial 82 finished with value: 0.08291958876100983 and parameters: {'n_layers': 1, 'embedding_dim': 256, 'lr': 0.0028347396395247853, 'lambda_val': 0.0017936339924980193, 'batch_size': 3961, 'optimizer': 'Adam'}. Best is trial 77 with value: 0.08682483764771703.
2026-05-11 15:52:10,504 - optuna.study.study - INFO - Trial 83 finished with value: 0.0690438345992845 and parameters: {'n_layers': 1, 'embedding_dim': 256, 'lr': 0.000807732273005434, 'lambda_val': 0.001815249260406562, 'batch_size': 3958, 'optimizer': 'Adam'}. Best is trial 77 with value: 0.08682483764771703.
2026-05-11 15:52:46,001 - optuna.study.study - INFO - Trial 84 finished with value: 0.07446483668037378 and parameters: {'n_layers': 1, 'embedding_dim': 256, 'lr': 0.00237002874741606, 'lambda_val': 0.0005610554092066552, 'batch_size': 3883, 'optimizer': 'Adam'}. Best is trial 77 with value: 0.08682483764771703.
2026-05-11 15:53:22,054 - optuna.study.study - INFO - Trial 85 finished with value: 0.08547181103359244 and parameters: {'n_layers': 1, 'embedding_dim': 256, 'lr': 0.011538765026997438, 'lambda_val': 0.0012756282296445735, 'batch_size': 4084, 'optimizer': 'Adam'}. Best is trial 77 with value: 0.08682483764771703.
2026-05-11 15:53:25,181 - optuna.study._optimize - INFO - Trial 86 pruned. 
2026-05-11 15:53:29,731 - optuna.study._optimize - INFO - Trial 87 pruned. 
2026-05-11 15:53:34,746 - optuna.study._optimize - INFO - Trial 88 pruned. 
2026-05-11 15:54:01,008 - optuna.study.study - INFO - Trial 89 finished with value: 0.08045433785655703 and parameters: {'n_layers': 1, 'embedding_dim': 128, 'lr': 0.005418386574074129, 'lambda_val': 0.0016628140336594959, 'batch_size': 3859, 'optimizer': 'Adam'}. Best is trial 77 with value: 0.08682483764771703.
2026-05-11 15:54:06,096 - optuna.study._optimize - INFO - Trial 90 pruned. 
2026-05-11 15:54:10,389 - optuna.study._optimize - INFO - Trial 91 pruned. 
2026-05-11 15:54:16,675 - optuna.study._optimize - INFO - Trial 92 pruned. 
2026-05-11 15:54:21,042 - optuna.study._optimize - INFO - Trial 93 pruned. 
2026-05-11 15:54:56,425 - optuna.study.study - INFO - Trial 94 finished with value: 0.08038392126216842 and parameters: {'n_layers': 1, 'embedding_dim': 256, 'lr': 0.010023035933673163, 'lambda_val': 0.0029489530688923482, 'batch_size': 4000, 'optimizer': 'Adam'}. Best is trial 77 with value: 0.08682483764771703.
2026-05-11 15:55:31,084 - optuna.study.study - INFO - Trial 95 finished with value: 0.08810055601370238 and parameters: {'n_layers': 1, 'embedding_dim': 256, 'lr': 0.00672603102941191, 'lambda_val': 0.001549759015538004, 'batch_size': 3903, 'optimizer': 'Adam'}. Best is trial 95 with value: 0.08810055601370238.
2026-05-11 15:56:06,563 - optuna.study.study - INFO - Trial 96 finished with value: 0.07668315012673015 and parameters: {'n_layers': 1, 'embedding_dim': 256, 'lr': 0.0015383974843026663, 'lambda_val': 0.0009060781241117249, 'batch_size': 3902, 'optimizer': 'Adam'}. Best is trial 95 with value: 0.08810055601370238.
2026-05-11 15:56:27,940 - optuna.study._optimize - INFO - Trial 97 pruned. 
2026-05-11 15:56:32,213 - optuna.study._optimize - INFO - Trial 98 pruned. 
2026-05-11 15:56:36,780 - optuna.study._optimize - INFO - Trial 99 pruned. 
2026-05-11 15:57:12,692 - optuna.study.study - INFO - Trial 100 finished with value: 0.08076373190633496 and parameters: {'n_layers': 1, 'embedding_dim': 256, 'lr': 0.004845419417756037, 'lambda_val': 0.0005738699925308649, 'batch_size': 3985, 'optimizer': 'Adam'}. Best is trial 95 with value: 0.08810055601370238.
2026-05-11 15:57:48,736 - optuna.study.study - INFO - Trial 101 finished with value: 0.08320832461250047 and parameters: {'n_layers': 1, 'embedding_dim': 256, 'lr': 0.006927489388276254, 'lambda_val': 0.0025839382814897773, 'batch_size': 3552, 'optimizer': 'Adam'}. Best is trial 95 with value: 0.08810055601370238.
2026-05-11 15:58:21,332 - optuna.study.study - INFO - Trial 102 finished with value: 0.08495468192013018 and parameters: {'n_layers': 1, 'embedding_dim': 256, 'lr': 0.007403987877361231, 'lambda_val': 0.0021034538643941044, 'batch_size': 3585, 'optimizer': 'Adam'}. Best is trial 95 with value: 0.08810055601370238.
2026-05-11 15:58:57,287 - optuna.study.study - INFO - Trial 103 finished with value: 0.08430704660567795 and parameters: {'n_layers': 1, 'embedding_dim': 256, 'lr': 0.012890198729361044, 'lambda_val': 0.0025904002665451922, 'batch_size': 3645, 'optimizer': 'Adam'}. Best is trial 95 with value: 0.08810055601370238.
2026-05-11 15:59:01,765 - optuna.study._optimize - INFO - Trial 104 pruned. 
2026-05-11 15:59:06,150 - optuna.study._optimize - INFO - Trial 105 pruned. 
2026-05-11 15:59:10,458 - optuna.study._optimize - INFO - Trial 106 pruned. 
2026-05-11 15:59:51,135 - optuna.study.study - INFO - Trial 107 finished with value: 0.08627520203630584 and parameters: {'n_layers': 1, 'embedding_dim': 256, 'lr': 0.007277299013557828, 'lambda_val': 0.001034121731786227, 'batch_size': 3767, 'optimizer': 'Adam'}. Best is trial 95 with value: 0.08810055601370238.
2026-05-11 15:59:56,203 - optuna.study._optimize - INFO - Trial 108 pruned. 
2026-05-11 16:00:32,132 - optuna.study.study - INFO - Trial 109 finished with value: 0.08652581518888189 and parameters: {'n_layers': 1, 'embedding_dim': 256, 'lr': 0.007854175418906838, 'lambda_val': 0.0006618046343398878, 'batch_size': 3618, 'optimizer': 'Adam'}. Best is trial 95 with value: 0.08810055601370238.
2026-05-11 16:00:39,376 - optuna.study._optimize - INFO - Trial 110 pruned. 
2026-05-11 16:01:33,015 - optuna.study.study - INFO - Trial 111 finished with value: 0.08072781357546606 and parameters: {'n_layers': 1, 'embedding_dim': 256, 'lr': 0.007610422576044294, 'lambda_val': 0.000620609694454597, 'batch_size': 3548, 'optimizer': 'Adam'}. Best is trial 95 with value: 0.08810055601370238.
2026-05-11 16:02:08,382 - optuna.study.study - INFO - Trial 112 finished with value: 0.07675554220906546 and parameters: {'n_layers': 1, 'embedding_dim': 256, 'lr': 0.009087074903565528, 'lambda_val': 0.001126575829567393, 'batch_size': 3606, 'optimizer': 'Adam'}. Best is trial 95 with value: 0.08810055601370238.
2026-05-11 16:02:12,753 - optuna.study._optimize - INFO - Trial 113 pruned. 
2026-05-11 16:02:50,832 - optuna.study.study - INFO - Trial 114 finished with value: 0.08612548299078587 and parameters: {'n_layers': 1, 'embedding_dim': 256, 'lr': 0.007549532989373819, 'lambda_val': 0.002806689559113337, 'batch_size': 3471, 'optimizer': 'Adam'}. Best is trial 95 with value: 0.08810055601370238.
2026-05-11 16:02:54,862 - optuna.study._optimize - INFO - Trial 115 pruned. 
2026-05-11 16:02:59,421 - optuna.study._optimize - INFO - Trial 116 pruned. 
2026-05-11 16:03:38,954 - optuna.study.study - INFO - Trial 117 finished with value: 0.08147995007822392 and parameters: {'n_layers': 1, 'embedding_dim': 256, 'lr': 0.007935639871784837, 'lambda_val': 0.0013493973627651925, 'batch_size': 3725, 'optimizer': 'Adam'}. Best is trial 95 with value: 0.08810055601370238.
2026-05-11 16:03:43,193 - optuna.study._optimize - INFO - Trial 118 pruned. 
2026-05-11 16:03:47,865 - optuna.study._optimize - INFO - Trial 119 pruned. 
2026-05-11 16:03:52,146 - optuna.study._optimize - INFO - Trial 120 pruned. 
2026-05-11 16:04:28,320 - optuna.study.study - INFO - Trial 121 finished with value: 0.08359621824926539 and parameters: {'n_layers': 1, 'embedding_dim': 256, 'lr': 0.005144902244511452, 'lambda_val': 0.002526225877242996, 'batch_size': 3620, 'optimizer': 'Adam'}. Best is trial 95 with value: 0.08810055601370238.
2026-05-11 16:05:04,330 - optuna.study.study - INFO - Trial 122 finished with value: 0.08374336381139204 and parameters: {'n_layers': 1, 'embedding_dim': 256, 'lr': 0.00512863260995995, 'lambda_val': 0.0031595103623023894, 'batch_size': 3642, 'optimizer': 'Adam'}. Best is trial 95 with value: 0.08810055601370238.
2026-05-11 16:05:40,165 - optuna.study.study - INFO - Trial 123 finished with value: 0.08207491175529469 and parameters: {'n_layers': 1, 'embedding_dim': 256, 'lr': 0.004957224966218039, 'lambda_val': 0.0037101072217396508, 'batch_size': 3694, 'optimizer': 'Adam'}. Best is trial 95 with value: 0.08810055601370238.
2026-05-11 16:06:16,170 - optuna.study.study - INFO - Trial 124 finished with value: 0.0877076720588513 and parameters: {'n_layers': 1, 'embedding_dim': 256, 'lr': 0.009495886686895725, 'lambda_val': 0.0014708177764902514, 'batch_size': 3619, 'optimizer': 'Adam'}. Best is trial 95 with value: 0.08810055601370238.
2026-05-11 16:06:52,162 - optuna.study.study - INFO - Trial 125 finished with value: 0.08280762902035857 and parameters: {'n_layers': 1, 'embedding_dim': 256, 'lr': 0.009615373184863281, 'lambda_val': 0.0014235727170219788, 'batch_size': 3799, 'optimizer': 'Adam'}. Best is trial 95 with value: 0.08810055601370238.
2026-05-11 16:06:57,688 - optuna.study._optimize - INFO - Trial 126 pruned. 
2026-05-11 16:07:33,310 - optuna.study.study - INFO - Trial 127 finished with value: 0.08122677762532424 and parameters: {'n_layers': 1, 'embedding_dim': 256, 'lr': 0.008780366468523253, 'lambda_val': 0.0011062082141057828, 'batch_size': 3635, 'optimizer': 'RMSprop'}. Best is trial 95 with value: 0.08810055601370238.
2026-05-11 16:07:37,250 - optuna.study._optimize - INFO - Trial 128 pruned. 
2026-05-11 16:07:41,358 - optuna.study._optimize - INFO - Trial 129 pruned. 
2026-05-11 16:07:45,763 - optuna.study._optimize - INFO - Trial 130 pruned. 
2026-05-11 16:08:21,461 - optuna.study.study - INFO - Trial 131 finished with value: 0.08544088997748715 and parameters: {'n_layers': 1, 'embedding_dim': 256, 'lr': 0.005514603144845913, 'lambda_val': 0.0031008221563593483, 'batch_size': 3529, 'optimizer': 'Adam'}. Best is trial 95 with value: 0.08810055601370238.
2026-05-11 16:08:25,798 - optuna.study._optimize - INFO - Trial 132 pruned. 
2026-05-11 16:08:47,720 - optuna.study._optimize - INFO - Trial 133 pruned. 
2026-05-11 16:09:23,241 - optuna.study.study - INFO - Trial 134 finished with value: 0.08501049863307708 and parameters: {'n_layers': 1, 'embedding_dim': 256, 'lr': 0.008792131266928039, 'lambda_val': 0.001581676129039069, 'batch_size': 3499, 'optimizer': 'Adam'}. Best is trial 95 with value: 0.08810055601370238.
2026-05-11 16:09:27,817 - optuna.study._optimize - INFO - Trial 135 pruned. 
2026-05-11 16:10:03,767 - optuna.study.study - INFO - Trial 136 finished with value: 0.08713521071747476 and parameters: {'n_layers': 1, 'embedding_dim': 256, 'lr': 0.00828427055006469, 'lambda_val': 0.0016934208516618887, 'batch_size': 3515, 'optimizer': 'Adam'}. Best is trial 95 with value: 0.08810055601370238.
2026-05-11 16:10:39,690 - optuna.study.study - INFO - Trial 137 finished with value: 0.08180750257426254 and parameters: {'n_layers': 1, 'embedding_dim': 256, 'lr': 0.007741253892284343, 'lambda_val': 0.0017432752122019306, 'batch_size': 3324, 'optimizer': 'Adam'}. Best is trial 95 with value: 0.08810055601370238.
2026-05-11 16:10:44,898 - optuna.study._optimize - INFO - Trial 138 pruned. 
2026-05-11 16:10:50,262 - optuna.study._optimize - INFO - Trial 139 pruned. 
2026-05-11 16:10:54,896 - optuna.study._optimize - INFO - Trial 140 pruned. 
2026-05-11 16:11:30,529 - optuna.study.study - INFO - Trial 141 finished with value: 0.08145474725157227 and parameters: {'n_layers': 1, 'embedding_dim': 256, 'lr': 0.008777364780231228, 'lambda_val': 0.002016749928415135, 'batch_size': 3713, 'optimizer': 'Adam'}. Best is trial 95 with value: 0.08810055601370238.
2026-05-11 16:11:35,177 - optuna.study._optimize - INFO - Trial 142 pruned. 
2026-05-11 16:12:21,047 - optuna.study.study - INFO - Trial 143 finished with value: 0.08133290204144264 and parameters: {'n_layers': 1, 'embedding_dim': 256, 'lr': 0.00934950571251194, 'lambda_val': 0.0023602481274613255, 'batch_size': 3660, 'optimizer': 'Adam'}. Best is trial 95 with value: 0.08810055601370238.
2026-05-11 16:12:25,540 - optuna.study._optimize - INFO - Trial 144 pruned. 
2026-05-11 16:12:30,440 - optuna.study._optimize - INFO - Trial 145 pruned. 
2026-05-11 16:12:34,718 - optuna.study._optimize - INFO - Trial 146 pruned. 
2026-05-11 16:13:10,375 - optuna.study.study - INFO - Trial 147 finished with value: 0.0842484635488572 and parameters: {'n_layers': 1, 'embedding_dim': 256, 'lr': 0.010577275211659465, 'lambda_val': 0.0006015843656088794, 'batch_size': 3001, 'optimizer': 'Adam'}. Best is trial 95 with value: 0.08810055601370238.
2026-05-11 16:13:16,083 - optuna.study._optimize - INFO - Trial 148 pruned. 
2026-05-11 16:13:20,713 - optuna.study._optimize - INFO - Trial 149 pruned. 
2026-05-11 16:13:25,018 - optuna.study._optimize - INFO - Trial 150 pruned. 
2026-05-11 16:13:32,351 - optuna.study._optimize - INFO - Trial 151 pruned. 
2026-05-11 16:14:11,100 - optuna.study.study - INFO - Trial 152 finished with value: 0.08169593629841967 and parameters: {'n_layers': 1, 'embedding_dim': 256, 'lr': 0.008139987727819051, 'lambda_val': 0.00216340847649095, 'batch_size': 3608, 'optimizer': 'Adam'}. Best is trial 95 with value: 0.08810055601370238.
2026-05-11 16:14:28,633 - optuna.study._optimize - INFO - Trial 153 pruned. 
2026-05-11 16:14:33,588 - optuna.study._optimize - INFO - Trial 154 pruned. 
2026-05-11 16:14:38,144 - optuna.study._optimize - INFO - Trial 155 pruned. 
2026-05-11 16:14:44,227 - optuna.study._optimize - INFO - Trial 156 pruned. 
2026-05-11 16:14:57,973 - optuna.study._optimize - INFO - Trial 157 pruned. 
2026-05-11 16:15:04,026 - optuna.study._optimize - INFO - Trial 158 pruned. 
2026-05-11 16:15:07,923 - optuna.study._optimize - INFO - Trial 159 pruned. 
2026-05-11 16:15:11,994 - optuna.study._optimize - INFO - Trial 160 pruned. 
2026-05-11 16:15:46,114 - optuna.study.study - INFO - Trial 161 finished with value: 0.0837024273644498 and parameters: {'n_layers': 1, 'embedding_dim': 256, 'lr': 0.004679753861077688, 'lambda_val': 0.003072415736929945, 'batch_size': 3589, 'optimizer': 'Adam'}. Best is trial 95 with value: 0.08810055601370238.
2026-05-11 16:16:22,977 - optuna.study.study - INFO - Trial 162 finished with value: 0.07747676719306416 and parameters: {'n_layers': 1, 'embedding_dim': 256, 'lr': 0.0071680960406375616, 'lambda_val': 0.003914204113918858, 'batch_size': 3454, 'optimizer': 'Adam'}. Best is trial 95 with value: 0.08810055601370238.
2026-05-11 16:16:27,826 - optuna.study._optimize - INFO - Trial 163 pruned. 
2026-05-11 16:17:07,589 - optuna.study.study - INFO - Trial 164 finished with value: 0.0885766167527261 and parameters: {'n_layers': 1, 'embedding_dim': 256, 'lr': 0.005248169494463933, 'lambda_val': 0.0016339114087967584, 'batch_size': 3615, 'optimizer': 'Adam'}. Best is trial 164 with value: 0.0885766167527261.
2026-05-11 16:17:46,833 - optuna.study.study - INFO - Trial 165 finished with value: 0.08421948062253341 and parameters: {'n_layers': 1, 'embedding_dim': 256, 'lr': 0.009738780822762933, 'lambda_val': 0.0016170283223928194, 'batch_size': 3745, 'optimizer': 'Adam'}. Best is trial 164 with value: 0.0885766167527261.
2026-05-11 16:17:52,675 - optuna.study._optimize - INFO - Trial 166 pruned. 
2026-05-11 16:18:33,243 - optuna.study.study - INFO - Trial 167 finished with value: 0.08252792299857717 and parameters: {'n_layers': 1, 'embedding_dim': 256, 'lr': 0.009932922823201285, 'lambda_val': 0.0010716113267163127, 'batch_size': 3741, 'optimizer': 'Adam'}. Best is trial 164 with value: 0.0885766167527261.
2026-05-11 16:19:10,399 - optuna.study.study - INFO - Trial 168 finished with value: 0.08219497073072513 and parameters: {'n_layers': 1, 'embedding_dim': 256, 'lr': 0.0062515678725889295, 'lambda_val': 0.001679916133992078, 'batch_size': 3497, 'optimizer': 'Adam'}. Best is trial 164 with value: 0.0885766167527261.
2026-05-11 16:19:52,540 - optuna.study.study - INFO - Trial 169 finished with value: 0.06385717035245075 and parameters: {'n_layers': 1, 'embedding_dim': 256, 'lr': 0.0003619504762448117, 'lambda_val': 0.0008197457599493067, 'batch_size': 3846, 'optimizer': 'Adam'}. Best is trial 164 with value: 0.0885766167527261.
2026-05-11 16:20:30,198 - optuna.study.study - INFO - Trial 170 finished with value: 0.08263934620391267 and parameters: {'n_layers': 1, 'embedding_dim': 256, 'lr': 0.007777234132018663, 'lambda_val': 0.002169092815277674, 'batch_size': 3613, 'optimizer': 'Adam'}. Best is trial 164 with value: 0.0885766167527261.
2026-05-11 16:21:07,321 - optuna.study.study - INFO - Trial 171 finished with value: 0.08193447895436264 and parameters: {'n_layers': 1, 'embedding_dim': 256, 'lr': 0.011545210996320396, 'lambda_val': 0.001627443287127457, 'batch_size': 3740, 'optimizer': 'Adam'}. Best is trial 164 with value: 0.0885766167527261.
2026-05-11 16:21:45,668 - optuna.study.study - INFO - Trial 172 finished with value: 0.08494318704999296 and parameters: {'n_layers': 1, 'embedding_dim': 256, 'lr': 0.007648854218215048, 'lambda_val': 0.00240404495228262, 'batch_size': 3921, 'optimizer': 'Adam'}. Best is trial 164 with value: 0.0885766167527261.
2026-05-11 16:22:25,500 - optuna.study.study - INFO - Trial 173 finished with value: 0.08563150636602754 and parameters: {'n_layers': 1, 'embedding_dim': 256, 'lr': 0.008308123405338505, 'lambda_val': 0.0012009935833152332, 'batch_size': 3946, 'optimizer': 'Adam'}. Best is trial 164 with value: 0.0885766167527261.
2026-05-11 16:22:32,349 - optuna.study._optimize - INFO - Trial 174 pruned. 
2026-05-11 16:23:10,963 - optuna.study.study - INFO - Trial 175 finished with value: 0.09052736278477584 and parameters: {'n_layers': 1, 'embedding_dim': 256, 'lr': 0.005666799239526456, 'lambda_val': 0.002014568074182883, 'batch_size': 3911, 'optimizer': 'Adam'}. Best is trial 175 with value: 0.09052736278477584.
2026-05-11 16:23:14,964 - optuna.study._optimize - INFO - Trial 176 pruned. 
2026-05-11 16:23:19,278 - optuna.study._optimize - INFO - Trial 177 pruned. 
2026-05-11 16:23:24,299 - optuna.study._optimize - INFO - Trial 178 pruned. 
2026-05-11 16:24:10,171 - optuna.study.study - INFO - Trial 179 finished with value: 0.0847185540637605 and parameters: {'n_layers': 1, 'embedding_dim': 256, 'lr': 0.005664033304680439, 'lambda_val': 0.000940245562268874, 'batch_size': 3945, 'optimizer': 'Adam'}. Best is trial 175 with value: 0.09052736278477584.
2026-05-11 16:24:46,475 - optuna.study.study - INFO - Trial 180 finished with value: 0.08144106236361594 and parameters: {'n_layers': 1, 'embedding_dim': 256, 'lr': 0.003985103674768308, 'lambda_val': 0.0010074145554081766, 'batch_size': 3891, 'optimizer': 'Adam'}. Best is trial 175 with value: 0.09052736278477584.
2026-05-11 16:25:23,076 - optuna.study.study - INFO - Trial 181 finished with value: 0.08442841065859041 and parameters: {'n_layers': 1, 'embedding_dim': 256, 'lr': 0.005891448698549108, 'lambda_val': 0.0013796337216519766, 'batch_size': 3934, 'optimizer': 'Adam'}. Best is trial 175 with value: 0.09052736278477584.
2026-05-11 16:25:58,712 - optuna.study.study - INFO - Trial 182 finished with value: 0.08540175853930745 and parameters: {'n_layers': 1, 'embedding_dim': 256, 'lr': 0.005724123995985845, 'lambda_val': 0.0013252190057415696, 'batch_size': 3934, 'optimizer': 'Adam'}. Best is trial 175 with value: 0.09052736278477584.
2026-05-11 16:26:34,853 - optuna.study.study - INFO - Trial 183 finished with value: 0.08520153249185276 and parameters: {'n_layers': 1, 'embedding_dim': 256, 'lr': 0.004944067789311344, 'lambda_val': 0.0013760233799332796, 'batch_size': 3947, 'optimizer': 'Adam'}. Best is trial 175 with value: 0.09052736278477584.
2026-05-11 16:27:10,567 - optuna.study.study - INFO - Trial 184 finished with value: 0.08145864503231239 and parameters: {'n_layers': 1, 'embedding_dim': 256, 'lr': 0.0047274457575780205, 'lambda_val': 0.00184142050014385, 'batch_size': 4029, 'optimizer': 'Adam'}. Best is trial 175 with value: 0.09052736278477584.
2026-05-11 16:27:46,309 - optuna.study.study - INFO - Trial 185 finished with value: 0.08090352941189494 and parameters: {'n_layers': 1, 'embedding_dim': 256, 'lr': 0.0032471941476157895, 'lambda_val': 0.001258530506950601, 'batch_size': 3935, 'optimizer': 'Adam'}. Best is trial 175 with value: 0.09052736278477584.
2026-05-11 16:27:57,079 - optuna.study._optimize - INFO - Trial 186 pruned. 
2026-05-11 16:28:07,153 - optuna.study._optimize - INFO - Trial 187 pruned. 
2026-05-11 16:28:41,062 - optuna.study.study - INFO - Trial 188 finished with value: 0.08417753150462 and parameters: {'n_layers': 1, 'embedding_dim': 256, 'lr': 0.005894489189666157, 'lambda_val': 0.0018379924232800892, 'batch_size': 4081, 'optimizer': 'RMSprop'}. Best is trial 175 with value: 0.09052736278477584.
2026-05-11 16:28:46,830 - optuna.study._optimize - INFO - Trial 189 pruned. 
2026-05-11 16:29:23,313 - optuna.study.study - INFO - Trial 190 finished with value: 0.0860623882311565 and parameters: {'n_layers': 1, 'embedding_dim': 256, 'lr': 0.00816589113991208, 'lambda_val': 0.001500443296683086, 'batch_size': 3835, 'optimizer': 'Adam'}. Best is trial 175 with value: 0.09052736278477584.
2026-05-11 16:29:59,549 - optuna.study.study - INFO - Trial 191 finished with value: 0.0908249562513113 and parameters: {'n_layers': 1, 'embedding_dim': 256, 'lr': 0.008137252677662393, 'lambda_val': 0.0015141719518371574, 'batch_size': 3805, 'optimizer': 'Adam'}. Best is trial 191 with value: 0.0908249562513113.
2026-05-11 16:30:03,983 - optuna.study._optimize - INFO - Trial 192 pruned. 
