2026-05-11 15:11:51,837 - optuna.study.study - INFO - Trial 165 finished with value: 0.07429449399360454 and parameters: {'n_layers': 1, 'embedding_dim': 256, 'lr': 0.00038677652083899425, 'lambda_val': 0.0005574657875347455, 'batch_size': 520, 'optimizer': 'Adam'}. Best is trial 62 with value: 0.10806482762403535.
2026-05-11 15:11:56,297 - optuna.study._optimize - INFO - Trial 166 pruned. 
2026-05-11 15:12:00,653 - optuna.study._optimize - INFO - Trial 167 pruned. 
2026-05-11 15:12:04,553 - optuna.study._optimize - INFO - Trial 168 pruned. 
2026-05-11 15:12:39,177 - optuna.study.study - INFO - Trial 169 finished with value: 0.07053901387240621 and parameters: {'n_layers': 1, 'embedding_dim': 256, 'lr': 0.00038753393185747667, 'lambda_val': 0.0001986495255204071, 'batch_size': 1434, 'optimizer': 'Adam'}. Best is trial 62 with value: 0.10806482762403535.
2026-05-11 15:12:42,864 - optuna.study._optimize - INFO - Trial 170 pruned. 
2026-05-11 15:12:47,272 - optuna.study._optimize - INFO - Trial 171 pruned. 
2026-05-11 15:13:21,852 - optuna.study.study - INFO - Trial 172 finished with value: 0.08977298522402943 and parameters: {'n_layers': 1, 'embedding_dim': 256, 'lr': 0.00031480018591106184, 'lambda_val': 0.00013092286653817474, 'batch_size': 611, 'optimizer': 'Adam'}. Best is trial 62 with value: 0.10806482762403535.
2026-05-11 15:13:56,265 - optuna.study.study - INFO - Trial 173 finished with value: 0.075701777476582 and parameters: {'n_layers': 1, 'embedding_dim': 256, 'lr': 0.00034078483563920205, 'lambda_val': 0.00011303355223560509, 'batch_size': 622, 'optimizer': 'Adam'}. Best is trial 62 with value: 0.10806482762403535.
2026-05-11 15:14:31,255 - optuna.study.study - INFO - Trial 174 finished with value: 0.09136080729108381 and parameters: {'n_layers': 1, 'embedding_dim': 256, 'lr': 0.0002802466967176432, 'lambda_val': 0.00014933767175823233, 'batch_size': 677, 'optimizer': 'Adam'}. Best is trial 62 with value: 0.10806482762403535.
2026-05-11 15:14:35,629 - optuna.study._optimize - INFO - Trial 175 pruned. 
2026-05-11 15:15:10,478 - optuna.study.study - INFO - Trial 176 finished with value: 0.07572568265937402 and parameters: {'n_layers': 1, 'embedding_dim': 256, 'lr': 0.000515369941680836, 'lambda_val': 1.0599327640228568e-05, 'batch_size': 674, 'optimizer': 'Adam'}. Best is trial 62 with value: 0.10806482762403535.
2026-05-11 15:15:45,245 - optuna.study.study - INFO - Trial 177 finished with value: 0.08771525983613515 and parameters: {'n_layers': 1, 'embedding_dim': 256, 'lr': 0.0003283318940515936, 'lambda_val': 0.0002188442250751692, 'batch_size': 598, 'optimizer': 'Adam'}. Best is trial 62 with value: 0.10806482762403535.
2026-05-11 15:15:54,926 - optuna.study._optimize - INFO - Trial 178 pruned. 
2026-05-11 15:16:02,734 - optuna.study._optimize - INFO - Trial 179 pruned. 
2026-05-11 15:16:06,998 - optuna.study._optimize - INFO - Trial 180 pruned. 
2026-05-11 15:16:41,269 - optuna.study.study - INFO - Trial 181 finished with value: 0.07249119283353617 and parameters: {'n_layers': 1, 'embedding_dim': 256, 'lr': 0.0004099140223337355, 'lambda_val': 0.0001753149155968201, 'batch_size': 589, 'optimizer': 'Adam'}. Best is trial 62 with value: 0.10806482762403535.
2026-05-11 15:16:45,676 - optuna.study._optimize - INFO - Trial 182 pruned. 
2026-05-11 15:16:50,120 - optuna.study._optimize - INFO - Trial 183 pruned. 
2026-05-11 15:17:24,987 - optuna.study.study - INFO - Trial 184 finished with value: 0.0818562266531424 and parameters: {'n_layers': 1, 'embedding_dim': 256, 'lr': 0.0003378119394286672, 'lambda_val': 0.0005316441025451441, 'batch_size': 818, 'optimizer': 'Adam'}. Best is trial 62 with value: 0.10806482762403535.
2026-05-11 15:17:29,345 - optuna.study._optimize - INFO - Trial 185 pruned. 
2026-05-11 15:17:32,935 - optuna.study._optimize - INFO - Trial 186 pruned. 
2026-05-11 15:17:37,258 - optuna.study._optimize - INFO - Trial 187 pruned. 
2026-05-11 15:18:19,621 - optuna.study.study - INFO - Trial 188 finished with value: 0.07739497984017588 and parameters: {'n_layers': 1, 'embedding_dim': 256, 'lr': 0.0004550993223541103, 'lambda_val': 6.985782153735352e-05, 'batch_size': 636, 'optimizer': 'Adam'}. Best is trial 62 with value: 0.10806482762403535.
2026-05-11 15:18:23,662 - optuna.study._optimize - INFO - Trial 189 pruned. 
2026-05-11 15:18:27,948 - optuna.study._optimize - INFO - Trial 190 pruned. 
2026-05-11 15:18:32,013 - optuna.study._optimize - INFO - Trial 191 pruned. 
2026-05-11 15:18:36,046 - optuna.study._optimize - INFO - Trial 192 pruned. 
2026-05-11 15:19:19,037 - optuna.study.study - INFO - Trial 193 finished with value: 0.0728203121442509 and parameters: {'n_layers': 1, 'embedding_dim': 256, 'lr': 0.0003213286698694047, 'lambda_val': 0.00012543657090322398, 'batch_size': 1150, 'optimizer': 'Adam'}. Best is trial 62 with value: 0.10806482762403535.
2026-05-11 15:19:23,102 - optuna.study._optimize - INFO - Trial 194 pruned. 
2026-05-11 15:19:27,045 - optuna.study._optimize - INFO - Trial 195 pruned. 
2026-05-11 15:19:31,453 - optuna.study._optimize - INFO - Trial 196 pruned. 
2026-05-11 15:19:35,904 - optuna.study._optimize - INFO - Trial 197 pruned. 
2026-05-11 15:19:40,069 - optuna.study._optimize - INFO - Trial 198 pruned. 
2026-05-11 15:19:43,935 - optuna.study._optimize - INFO - Trial 199 pruned. 
2026-05-11 15:20:04,371 - root - INFO -   **** Training e_100K_1c3dcs_rand5
2026-05-11 15:20:04,381 - root - INFO -   **** Getting 56335/65410 random edges
2026-05-11 15:20:05,454 - optuna.storages._rdb.storage - INFO - A new study created in RDB with name: Study_e_100K_1c3dcs_rand5
2026-05-11 15:20:54,782 - optuna.study.study - INFO - Trial 0 finished with value: 0.04183170314915755 and parameters: {'n_layers': 1, 'embedding_dim': 96, 'lr': 0.0012310162469637697, 'lambda_val': 4.35406912098838e-06, 'batch_size': 2845, 'optimizer': 'Adam'}. Best is trial 0 with value: 0.04183170314915755.
2026-05-11 15:22:10,848 - optuna.study.study - INFO - Trial 1 finished with value: 0.02292384224273814 and parameters: {'n_layers': 3, 'embedding_dim': 128, 'lr': 0.001109639420949132, 'lambda_val': 1.392785102402564e-06, 'batch_size': 3662, 'optimizer': 'Adam'}. Best is trial 0 with value: 0.04183170314915755.
2026-05-11 15:23:12,291 - optuna.study.study - INFO - Trial 2 finished with value: 0.01950925336670273 and parameters: {'n_layers': 2, 'embedding_dim': 256, 'lr': 5.161270321046e-05, 'lambda_val': 0.024044593797293158, 'batch_size': 1855, 'optimizer': 'Adam'}. Best is trial 0 with value: 0.04183170314915755.
2026-05-11 15:23:52,909 - optuna.study.study - INFO - Trial 3 finished with value: 0.011378044571835139 and parameters: {'n_layers': 4, 'embedding_dim': 32, 'lr': 0.001514505593261194, 'lambda_val': 1.114861730084519e-06, 'batch_size': 673, 'optimizer': 'Adam'}. Best is trial 0 with value: 0.04183170314915755.
2026-05-11 15:24:29,930 - optuna.study.study - INFO - Trial 4 finished with value: 0.022585096349932637 and parameters: {'n_layers': 3, 'embedding_dim': 96, 'lr': 0.001020635652346578, 'lambda_val': 0.003224592104999584, 'batch_size': 2000, 'optimizer': 'Adam'}. Best is trial 0 with value: 0.04183170314915755.
2026-05-11 15:24:33,795 - optuna.study._optimize - INFO - Trial 5 pruned. 
2026-05-11 15:25:08,683 - optuna.study.study - INFO - Trial 6 finished with value: 0.012903450555447239 and parameters: {'n_layers': 4, 'embedding_dim': 32, 'lr': 0.0004589762055530227, 'lambda_val': 6.442040348432608e-05, 'batch_size': 581, 'optimizer': 'RMSprop'}. Best is trial 0 with value: 0.04183170314915755.
2026-05-11 15:25:13,795 - optuna.study._optimize - INFO - Trial 7 pruned. 
2026-05-11 15:25:43,619 - optuna.study.study - INFO - Trial 8 finished with value: 0.06326928932423428 and parameters: {'n_layers': 1, 'embedding_dim': 96, 'lr': 0.03826351075300165, 'lambda_val': 0.008404446927459005, 'batch_size': 3178, 'optimizer': 'Adam'}. Best is trial 8 with value: 0.06326928932423428.
2026-05-11 15:26:40,883 - optuna.study.study - INFO - Trial 9 finished with value: 0.035011392553343706 and parameters: {'n_layers': 3, 'embedding_dim': 256, 'lr': 0.004539364636297211, 'lambda_val': 4.752162325666848e-05, 'batch_size': 4073, 'optimizer': 'Adam'}. Best is trial 8 with value: 0.06326928932423428.
2026-05-11 15:26:45,164 - optuna.study._optimize - INFO - Trial 10 pruned. 
2026-05-11 15:26:49,075 - optuna.study._optimize - INFO - Trial 11 pruned. 
2026-05-11 15:27:21,349 - optuna.study.study - INFO - Trial 12 finished with value: 0.06099509564944037 and parameters: {'n_layers': 1, 'embedding_dim': 96, 'lr': 0.020646633038485858, 'lambda_val': 0.006765619818336998, 'batch_size': 2959, 'optimizer': 'Adam'}. Best is trial 8 with value: 0.06326928932423428.
2026-05-11 15:27:25,878 - optuna.study._optimize - INFO - Trial 13 pruned. 
2026-05-11 15:27:30,624 - optuna.study._optimize - INFO - Trial 14 pruned. 
2026-05-11 15:27:34,881 - optuna.study._optimize - INFO - Trial 15 pruned. 
2026-05-11 15:28:06,103 - optuna.study.study - INFO - Trial 16 finished with value: 0.07596173094286812 and parameters: {'n_layers': 1, 'embedding_dim': 96, 'lr': 0.006043043214980421, 'lambda_val': 0.002543750921372518, 'batch_size': 3801, 'optimizer': 'Adam'}. Best is trial 16 with value: 0.07596173094286812.
2026-05-11 15:28:38,847 - optuna.study.study - INFO - Trial 17 finished with value: 0.07000188332530802 and parameters: {'n_layers': 1, 'embedding_dim': 96, 'lr': 0.003718776416074246, 'lambda_val': 0.000933841514918642, 'batch_size': 3667, 'optimizer': 'Adam'}. Best is trial 16 with value: 0.07596173094286812.
2026-05-11 15:28:43,257 - optuna.study._optimize - INFO - Trial 18 pruned. 
2026-05-11 15:28:47,158 - optuna.study._optimize - INFO - Trial 19 pruned. 
2026-05-11 15:29:32,185 - optuna.study.study - INFO - Trial 20 finished with value: 0.03640836225409805 and parameters: {'n_layers': 2, 'embedding_dim': 256, 'lr': 0.00016555247445617136, 'lambda_val': 0.00022168938666789026, 'batch_size': 3731, 'optimizer': 'Adam'}. Best is trial 16 with value: 0.07596173094286812.
2026-05-11 15:30:02,530 - optuna.study.study - INFO - Trial 21 finished with value: 0.06496641939569302 and parameters: {'n_layers': 1, 'embedding_dim': 96, 'lr': 0.00937086876423792, 'lambda_val': 0.00605202375332526, 'batch_size': 3490, 'optimizer': 'Adam'}. Best is trial 16 with value: 0.07596173094286812.
2026-05-11 15:30:33,057 - optuna.study.study - INFO - Trial 22 finished with value: 0.08010752120625701 and parameters: {'n_layers': 1, 'embedding_dim': 96, 'lr': 0.009677394436209035, 'lambda_val': 0.0010561219906127422, 'batch_size': 3650, 'optimizer': 'Adam'}. Best is trial 22 with value: 0.08010752120625701.
2026-05-11 15:31:03,966 - optuna.study.study - INFO - Trial 23 finished with value: 0.06029152034170981 and parameters: {'n_layers': 1, 'embedding_dim': 96, 'lr': 0.0026651303016410276, 'lambda_val': 0.0008964631030474546, 'batch_size': 3871, 'optimizer': 'Adam'}. Best is trial 22 with value: 0.08010752120625701.
2026-05-11 15:31:34,922 - optuna.study.study - INFO - Trial 24 finished with value: 0.051622687765451404 and parameters: {'n_layers': 1, 'embedding_dim': 96, 'lr': 0.0003669554763682385, 'lambda_val': 0.00210499486559941, 'batch_size': 3508, 'optimizer': 'Adam'}. Best is trial 22 with value: 0.08010752120625701.
2026-05-11 15:31:40,389 - optuna.study._optimize - INFO - Trial 25 pruned. 
2026-05-11 15:32:13,225 - optuna.study.study - INFO - Trial 26 finished with value: 0.04939287100508256 and parameters: {'n_layers': 1, 'embedding_dim': 96, 'lr': 0.0025833685923343946, 'lambda_val': 5.415488730956507e-05, 'batch_size': 2494, 'optimizer': 'Adam'}. Best is trial 22 with value: 0.08010752120625701.
2026-05-11 15:32:18,059 - optuna.study._optimize - INFO - Trial 27 pruned. 
2026-05-11 15:32:47,182 - optuna.study.study - INFO - Trial 28 finished with value: 0.05142249926670009 and parameters: {'n_layers': 1, 'embedding_dim': 96, 'lr': 0.0005352535401957482, 'lambda_val': 0.0010925834187943126, 'batch_size': 1571, 'optimizer': 'RMSprop'}. Best is trial 22 with value: 0.08010752120625701.
2026-05-11 15:32:51,357 - optuna.study._optimize - INFO - Trial 29 pruned. 
2026-05-11 15:32:56,506 - optuna.study._optimize - INFO - Trial 30 pruned. 
2026-05-11 15:33:27,299 - optuna.study.study - INFO - Trial 31 finished with value: 0.06177741314363004 and parameters: {'n_layers': 1, 'embedding_dim': 96, 'lr': 0.00839554854804395, 'lambda_val': 0.006585377390370634, 'batch_size': 3418, 'optimizer': 'Adam'}. Best is trial 22 with value: 0.08010752120625701.
2026-05-11 15:33:58,913 - optuna.study.study - INFO - Trial 32 finished with value: 0.0651779004497769 and parameters: {'n_layers': 1, 'embedding_dim': 96, 'lr': 0.0016969165070080405, 'lambda_val': 0.003731961442034373, 'batch_size': 3601, 'optimizer': 'Adam'}. Best is trial 22 with value: 0.08010752120625701.
2026-05-11 15:34:02,887 - optuna.study._optimize - INFO - Trial 33 pruned. 
2026-05-11 15:34:39,442 - optuna.study.study - INFO - Trial 34 finished with value: 0.08068469420029613 and parameters: {'n_layers': 1, 'embedding_dim': 256, 'lr': 0.0018551588897367285, 'lambda_val': 0.0023953599454466803, 'batch_size': 3839, 'optimizer': 'Adam'}. Best is trial 34 with value: 0.08068469420029613.
2026-05-11 15:34:45,024 - optuna.study._optimize - INFO - Trial 35 pruned. 
2026-05-11 15:35:22,125 - optuna.study.study - INFO - Trial 36 finished with value: 0.06559686850834623 and parameters: {'n_layers': 1, 'embedding_dim': 256, 'lr': 0.0006701259242841, 'lambda_val': 0.0006691948593911, 'batch_size': 3892, 'optimizer': 'Adam'}. Best is trial 34 with value: 0.08068469420029613.
2026-05-11 15:35:58,908 - optuna.study.study - INFO - Trial 37 finished with value: 0.0807795407670778 and parameters: {'n_layers': 1, 'embedding_dim': 256, 'lr': 0.0028911465374464227, 'lambda_val': 0.002511078329761702, 'batch_size': 3240, 'optimizer': 'Adam'}. Best is trial 37 with value: 0.0807795407670778.
2026-05-11 15:36:05,669 - optuna.study._optimize - INFO - Trial 38 pruned. 
2026-05-11 15:36:10,840 - optuna.study._optimize - INFO - Trial 39 pruned. 
2026-05-11 15:36:44,095 - optuna.study.study - INFO - Trial 40 finished with value: 0.03562662124696244 and parameters: {'n_layers': 1, 'embedding_dim': 32, 'lr': 0.0008178999258819483, 'lambda_val': 0.015268224207271662, 'batch_size': 2032, 'optimizer': 'Adam'}. Best is trial 37 with value: 0.0807795407670778.
2026-05-11 15:37:20,832 - optuna.study.study - INFO - Trial 41 finished with value: 0.0797549018693107 and parameters: {'n_layers': 1, 'embedding_dim': 256, 'lr': 0.005499174438071044, 'lambda_val': 0.003351273212170886, 'batch_size': 3491, 'optimizer': 'Adam'}. Best is trial 37 with value: 0.0807795407670778.
2026-05-11 15:37:58,014 - optuna.study.study - INFO - Trial 42 finished with value: 0.08099358743759087 and parameters: {'n_layers': 1, 'embedding_dim': 256, 'lr': 0.006641328511239694, 'lambda_val': 0.0035970001321952256, 'batch_size': 3463, 'optimizer': 'Adam'}. Best is trial 42 with value: 0.08099358743759087.
2026-05-11 15:38:02,751 - optuna.study._optimize - INFO - Trial 43 pruned. 
2026-05-11 15:38:39,550 - optuna.study.study - INFO - Trial 44 finished with value: 0.07681505060653179 and parameters: {'n_layers': 1, 'embedding_dim': 256, 'lr': 0.012756667353233598, 'lambda_val': 0.004191062520726601, 'batch_size': 3385, 'optimizer': 'Adam'}. Best is trial 42 with value: 0.08099358743759087.
2026-05-11 15:39:16,241 - optuna.study.study - INFO - Trial 45 finished with value: 0.06810033606962644 and parameters: {'n_layers': 1, 'embedding_dim': 256, 'lr': 0.0010435534695076196, 'lambda_val': 0.0016505053806185454, 'batch_size': 2921, 'optimizer': 'Adam'}. Best is trial 42 with value: 0.08099358743759087.
2026-05-11 15:39:41,440 - optuna.study._optimize - INFO - Trial 46 pruned. 
2026-05-11 15:39:46,920 - optuna.study._optimize - INFO - Trial 47 pruned. 
2026-05-11 15:39:54,427 - optuna.study._optimize - INFO - Trial 48 pruned. 
2026-05-11 15:39:58,355 - optuna.study._optimize - INFO - Trial 49 pruned. 
2026-05-11 15:40:34,105 - optuna.study.study - INFO - Trial 50 finished with value: 0.07630677771270233 and parameters: {'n_layers': 1, 'embedding_dim': 256, 'lr': 0.0020822373872323783, 'lambda_val': 0.004682778250442489, 'batch_size': 3088, 'optimizer': 'Adam'}. Best is trial 42 with value: 0.08099358743759087.
2026-05-11 15:40:41,176 - optuna.study._optimize - INFO - Trial 51 pruned. 
2026-05-11 15:41:18,087 - optuna.study.study - INFO - Trial 52 finished with value: 0.08011240436424984 and parameters: {'n_layers': 1, 'embedding_dim': 256, 'lr': 0.015055453451250183, 'lambda_val': 0.0021342454282429666, 'batch_size': 3403, 'optimizer': 'Adam'}. Best is trial 42 with value: 0.08099358743759087.
2026-05-11 15:42:14,841 - optuna.study.study - INFO - Trial 53 finished with value: 0.08319774642319953 and parameters: {'n_layers': 1, 'embedding_dim': 256, 'lr': 0.003455337061509196, 'lambda_val': 0.002269706346843821, 'batch_size': 3602, 'optimizer': 'Adam'}. Best is trial 53 with value: 0.08319774642319953.
2026-05-11 15:42:19,713 - optuna.study._optimize - INFO - Trial 54 pruned. 
2026-05-11 15:42:23,545 - optuna.study._optimize - INFO - Trial 55 pruned. 
2026-05-11 15:42:28,206 - optuna.study._optimize - INFO - Trial 56 pruned. 
2026-05-11 15:42:34,493 - optuna.study._optimize - INFO - Trial 57 pruned. 
2026-05-11 15:43:06,136 - optuna.study.study - INFO - Trial 58 finished with value: 0.07534368768212908 and parameters: {'n_layers': 1, 'embedding_dim': 128, 'lr': 0.002986356859949801, 'lambda_val': 0.0009771755188867752, 'batch_size': 3216, 'optimizer': 'Adam'}. Best is trial 53 with value: 0.08319774642319953.
2026-05-11 15:43:11,519 - optuna.study._optimize - INFO - Trial 59 pruned. 
2026-05-11 15:43:15,726 - optuna.study._optimize - INFO - Trial 60 pruned. 
2026-05-11 15:43:53,186 - optuna.study.study - INFO - Trial 61 finished with value: 0.08456653700273813 and parameters: {'n_layers': 1, 'embedding_dim': 256, 'lr': 0.005489096495027897, 'lambda_val': 0.003054246672239144, 'batch_size': 3413, 'optimizer': 'Adam'}. Best is trial 61 with value: 0.08456653700273813.
2026-05-11 15:44:29,181 - optuna.study.study - INFO - Trial 62 finished with value: 0.0796290105382334 and parameters: {'n_layers': 1, 'embedding_dim': 256, 'lr': 0.0011465032550168422, 'lambda_val': 0.0013415062130665643, 'batch_size': 3380, 'optimizer': 'Adam'}. Best is trial 61 with value: 0.08456653700273813.
2026-05-11 15:44:33,707 - optuna.study._optimize - INFO - Trial 63 pruned. 
2026-05-11 15:45:10,770 - optuna.study.study - INFO - Trial 64 finished with value: 0.0839168167333772 and parameters: {'n_layers': 1, 'embedding_dim': 256, 'lr': 0.008764385251178598, 'lambda_val': 0.002596811200081303, 'batch_size': 3751, 'optimizer': 'Adam'}. Best is trial 61 with value: 0.08456653700273813.
2026-05-11 15:45:47,165 - optuna.study.study - INFO - Trial 65 finished with value: 0.0713552224745717 and parameters: {'n_layers': 1, 'embedding_dim': 256, 'lr': 0.001977933475458907, 'lambda_val': 0.00521217845220501, 'batch_size': 4036, 'optimizer': 'Adam'}. Best is trial 61 with value: 0.08456653700273813.
2026-05-11 15:45:52,145 - optuna.study._optimize - INFO - Trial 66 pruned. 
2026-05-11 15:45:56,729 - optuna.study._optimize - INFO - Trial 67 pruned. 
2026-05-11 15:46:01,446 - optuna.study._optimize - INFO - Trial 68 pruned. 
2026-05-11 15:46:37,568 - optuna.study.study - INFO - Trial 69 finished with value: 0.0755306351112929 and parameters: {'n_layers': 1, 'embedding_dim': 256, 'lr': 0.007363775567953497, 'lambda_val': 0.00044930026555971, 'batch_size': 2825, 'optimizer': 'Adam'}. Best is trial 61 with value: 0.08456653700273813.
2026-05-11 15:46:42,173 - optuna.study._optimize - INFO - Trial 70 pruned. 
2026-05-11 15:46:46,580 - optuna.study._optimize - INFO - Trial 71 pruned. 
2026-05-11 15:47:24,349 - optuna.study.study - INFO - Trial 72 finished with value: 0.08411058029511043 and parameters: {'n_layers': 1, 'embedding_dim': 256, 'lr': 0.009488551178738093, 'lambda_val': 0.0007435917595014331, 'batch_size': 3722, 'optimizer': 'Adam'}. Best is trial 61 with value: 0.08456653700273813.
2026-05-11 15:48:01,135 - optuna.study.study - INFO - Trial 73 finished with value: 0.08044422453961986 and parameters: {'n_layers': 1, 'embedding_dim': 256, 'lr': 0.008861851885166567, 'lambda_val': 0.0007908696318191819, 'batch_size': 3281, 'optimizer': 'Adam'}. Best is trial 61 with value: 0.08456653700273813.
2026-05-11 15:48:08,105 - optuna.study._optimize - INFO - Trial 74 pruned. 
2026-05-11 15:48:44,517 - optuna.study.study - INFO - Trial 75 finished with value: 0.07230228075322183 and parameters: {'n_layers': 1, 'embedding_dim': 256, 'lr': 0.0032013169009867132, 'lambda_val': 0.000250321591066417, 'batch_size': 3820, 'optimizer': 'Adam'}. Best is trial 61 with value: 0.08456653700273813.
2026-05-11 15:49:00,243 - optuna.study._optimize - INFO - Trial 76 pruned. 
2026-05-11 15:49:36,626 - optuna.study.study - INFO - Trial 77 finished with value: 0.08682483764771703 and parameters: {'n_layers': 1, 'embedding_dim': 256, 'lr': 0.010807065554744298, 'lambda_val': 0.0015495189591335711, 'batch_size': 3718, 'optimizer': 'Adam'}. Best is trial 77 with value: 0.08682483764771703.
2026-05-11 15:49:41,116 - optuna.study._optimize - INFO - Trial 78 pruned. 
2026-05-11 15:50:18,003 - optuna.study.study - INFO - Trial 79 finished with value: 0.08247479132961791 and parameters: {'n_layers': 1, 'embedding_dim': 256, 'lr': 0.002342217818498148, 'lambda_val': 0.0014018751736643226, 'batch_size': 3982, 'optimizer': 'Adam'}. Best is trial 77 with value: 0.08682483764771703.
2026-05-11 15:50:22,462 - optuna.study._optimize - INFO - Trial 80 pruned. 
