2026-05-11 13:16:40,283 - optuna.study.study - INFO - Trial 13 finished with value: 0.031756468296769286 and parameters: {'n_layers': 2, 'embedding_dim': 64, 'lr': 0.0004370063335454609, 'lambda_val': 0.0015821681599300329, 'batch_size': 1292, 'optimizer': 'Adam'}. Best is trial 5 with value: 0.04460089216803566.
2026-05-11 13:17:12,758 - optuna.study.study - INFO - Trial 14 finished with value: 0.0813047271192717 and parameters: {'n_layers': 3, 'embedding_dim': 32, 'lr': 0.00012792335759138424, 'lambda_val': 0.0004953789858098578, 'batch_size': 556, 'optimizer': 'Adam'}. Best is trial 14 with value: 0.0813047271192717.
2026-05-11 13:17:47,653 - optuna.study.study - INFO - Trial 15 finished with value: 0.07272801003041447 and parameters: {'n_layers': 4, 'embedding_dim': 32, 'lr': 0.00010491434389817858, 'lambda_val': 9.427563486986905e-05, 'batch_size': 620, 'optimizer': 'Adam'}. Best is trial 14 with value: 0.0813047271192717.
2026-05-11 13:18:29,588 - optuna.study.study - INFO - Trial 16 finished with value: 0.08554619404856427 and parameters: {'n_layers': 3, 'embedding_dim': 32, 'lr': 0.00016095335476151875, 'lambda_val': 1.2261927888668278e-06, 'batch_size': 628, 'optimizer': 'Adam'}. Best is trial 16 with value: 0.08554619404856427.
2026-05-11 13:19:02,157 - optuna.study.study - INFO - Trial 17 finished with value: 0.05151624228027055 and parameters: {'n_layers': 3, 'embedding_dim': 32, 'lr': 0.0001824282764965269, 'lambda_val': 1.6106743367623688e-06, 'batch_size': 766, 'optimizer': 'Adam'}. Best is trial 16 with value: 0.08554619404856427.
2026-05-11 13:19:06,287 - optuna.study._optimize - INFO - Trial 18 pruned. 
2026-05-11 13:19:10,648 - optuna.study._optimize - INFO - Trial 19 pruned. 
2026-05-11 13:19:14,912 - optuna.study._optimize - INFO - Trial 20 pruned. 
2026-05-11 13:19:49,200 - optuna.study.study - INFO - Trial 21 finished with value: 0.06247883908100595 and parameters: {'n_layers': 4, 'embedding_dim': 32, 'lr': 0.0001037226896039494, 'lambda_val': 4.7196373820236755e-05, 'batch_size': 531, 'optimizer': 'Adam'}. Best is trial 16 with value: 0.08554619404856427.
2026-05-11 13:19:53,854 - optuna.study._optimize - INFO - Trial 22 pruned. 
2026-05-11 13:20:25,855 - optuna.study.study - INFO - Trial 23 finished with value: 0.0182159697193636 and parameters: {'n_layers': 3, 'embedding_dim': 32, 'lr': 0.0014125460568384241, 'lambda_val': 4.991081796938541e-05, 'batch_size': 524, 'optimizer': 'Adam'}. Best is trial 16 with value: 0.08554619404856427.
2026-05-11 13:20:30,132 - optuna.study._optimize - INFO - Trial 24 pruned. 
2026-05-11 13:21:05,264 - optuna.study.study - INFO - Trial 25 finished with value: 0.03103127967884672 and parameters: {'n_layers': 4, 'embedding_dim': 32, 'lr': 0.00016907268881944564, 'lambda_val': 0.00010656555819075628, 'batch_size': 1381, 'optimizer': 'Adam'}. Best is trial 16 with value: 0.08554619404856427.
2026-05-11 13:21:11,075 - optuna.study._optimize - INFO - Trial 26 pruned. 
2026-05-11 13:21:18,268 - optuna.study._optimize - INFO - Trial 27 pruned. 
2026-05-11 13:21:54,063 - optuna.study.study - INFO - Trial 28 finished with value: 0.07842840212056475 and parameters: {'n_layers': 3, 'embedding_dim': 32, 'lr': 0.00010206599972114309, 'lambda_val': 0.0007268839235507955, 'batch_size': 1080, 'optimizer': 'RMSprop'}. Best is trial 16 with value: 0.08554619404856427.
2026-05-11 13:22:33,484 - optuna.study.study - INFO - Trial 29 finished with value: 0.03617533853418769 and parameters: {'n_layers': 3, 'embedding_dim': 128, 'lr': 0.00017686210948473238, 'lambda_val': 0.0005692296188952431, 'batch_size': 1000, 'optimizer': 'RMSprop'}. Best is trial 16 with value: 0.08554619404856427.
2026-05-11 13:22:37,573 - optuna.study._optimize - INFO - Trial 30 pruned. 
2026-05-11 13:22:41,941 - optuna.study._optimize - INFO - Trial 31 pruned. 
2026-05-11 13:23:14,051 - optuna.study.study - INFO - Trial 32 finished with value: 0.06824734460340584 and parameters: {'n_layers': 3, 'embedding_dim': 32, 'lr': 0.0001534228977068113, 'lambda_val': 0.0005784354827292194, 'batch_size': 647, 'optimizer': 'RMSprop'}. Best is trial 16 with value: 0.08554619404856427.
2026-05-11 13:23:19,339 - optuna.study._optimize - INFO - Trial 33 pruned. 
2026-05-11 13:23:58,301 - optuna.study.study - INFO - Trial 34 finished with value: 0.02079235571291671 and parameters: {'n_layers': 3, 'embedding_dim': 128, 'lr': 0.0005133285715594061, 'lambda_val': 0.0008167679364771374, 'batch_size': 758, 'optimizer': 'RMSprop'}. Best is trial 16 with value: 0.08554619404856427.
2026-05-11 13:24:02,773 - optuna.study._optimize - INFO - Trial 35 pruned. 
2026-05-11 13:24:50,197 - optuna.study.study - INFO - Trial 36 finished with value: 0.03619706045754988 and parameters: {'n_layers': 2, 'embedding_dim': 256, 'lr': 0.00028702093207906673, 'lambda_val': 2.5318700447884404e-05, 'batch_size': 2214, 'optimizer': 'RMSprop'}. Best is trial 16 with value: 0.08554619404856427.
2026-05-11 13:24:55,209 - optuna.study._optimize - INFO - Trial 37 pruned. 
2026-05-11 13:24:59,909 - optuna.study._optimize - INFO - Trial 38 pruned. 
2026-05-11 13:25:04,497 - optuna.study._optimize - INFO - Trial 39 pruned. 
2026-05-11 13:25:40,621 - optuna.study.study - INFO - Trial 40 finished with value: 0.0849717551562395 and parameters: {'n_layers': 1, 'embedding_dim': 256, 'lr': 0.006187813336637524, 'lambda_val': 0.0021743419129124464, 'batch_size': 3685, 'optimizer': 'RMSprop'}. Best is trial 16 with value: 0.08554619404856427.
2026-05-11 13:26:16,947 - optuna.study.study - INFO - Trial 41 finished with value: 0.08088857720299772 and parameters: {'n_layers': 1, 'embedding_dim': 256, 'lr': 0.01048926937932955, 'lambda_val': 0.002736575098457339, 'batch_size': 3605, 'optimizer': 'RMSprop'}. Best is trial 16 with value: 0.08554619404856427.
2026-05-11 13:26:56,175 - optuna.study.study - INFO - Trial 42 finished with value: 0.08794147623239511 and parameters: {'n_layers': 1, 'embedding_dim': 256, 'lr': 0.013789819461401584, 'lambda_val': 0.0027327002326385155, 'batch_size': 3859, 'optimizer': 'RMSprop'}. Best is trial 42 with value: 0.08794147623239511.
2026-05-11 13:27:36,310 - optuna.study.study - INFO - Trial 43 finished with value: 0.08520626365011597 and parameters: {'n_layers': 1, 'embedding_dim': 256, 'lr': 0.00730607109422275, 'lambda_val': 0.0020520531522391318, 'batch_size': 4026, 'optimizer': 'RMSprop'}. Best is trial 42 with value: 0.08794147623239511.
2026-05-11 13:28:13,522 - optuna.study.study - INFO - Trial 44 finished with value: 0.061767741750678014 and parameters: {'n_layers': 1, 'embedding_dim': 256, 'lr': 0.007130995486660773, 'lambda_val': 0.009410538915567394, 'batch_size': 4027, 'optimizer': 'RMSprop'}. Best is trial 42 with value: 0.08794147623239511.
2026-05-11 13:28:50,529 - optuna.study.study - INFO - Trial 45 finished with value: 0.08369627452691619 and parameters: {'n_layers': 1, 'embedding_dim': 256, 'lr': 0.042585929292480056, 'lambda_val': 0.002029061473419445, 'batch_size': 3590, 'optimizer': 'RMSprop'}. Best is trial 42 with value: 0.08794147623239511.
2026-05-11 13:29:26,616 - optuna.study.study - INFO - Trial 46 finished with value: 0.0799001400430316 and parameters: {'n_layers': 1, 'embedding_dim': 256, 'lr': 0.04274799427357727, 'lambda_val': 0.0020763315899588177, 'batch_size': 3514, 'optimizer': 'RMSprop'}. Best is trial 42 with value: 0.08794147623239511.
2026-05-11 13:30:02,425 - optuna.study.study - INFO - Trial 47 finished with value: 0.07767810167280224 and parameters: {'n_layers': 1, 'embedding_dim': 256, 'lr': 0.025572151576661283, 'lambda_val': 0.004188644838147595, 'batch_size': 3275, 'optimizer': 'RMSprop'}. Best is trial 42 with value: 0.08794147623239511.
2026-05-11 13:30:07,390 - optuna.study._optimize - INFO - Trial 48 pruned. 
2026-05-11 13:30:48,944 - optuna.study.study - INFO - Trial 49 finished with value: 0.08668190487835047 and parameters: {'n_layers': 1, 'embedding_dim': 256, 'lr': 0.013139127022150731, 'lambda_val': 0.0013500920864941365, 'batch_size': 3712, 'optimizer': 'RMSprop'}. Best is trial 42 with value: 0.08794147623239511.
2026-05-11 13:31:25,132 - optuna.study.study - INFO - Trial 50 finished with value: 0.08279899228417024 and parameters: {'n_layers': 1, 'embedding_dim': 256, 'lr': 0.01279868132622589, 'lambda_val': 0.0010401433961174165, 'batch_size': 3792, 'optimizer': 'RMSprop'}. Best is trial 42 with value: 0.08794147623239511.
2026-05-11 13:31:29,653 - optuna.study._optimize - INFO - Trial 51 pruned. 
2026-05-11 13:31:35,949 - optuna.study._optimize - INFO - Trial 52 pruned. 
2026-05-11 13:32:13,192 - optuna.study.study - INFO - Trial 53 finished with value: 0.08306622899502977 and parameters: {'n_layers': 1, 'embedding_dim': 256, 'lr': 0.0046197355020266215, 'lambda_val': 0.0033840741663238136, 'batch_size': 3682, 'optimizer': 'RMSprop'}. Best is trial 42 with value: 0.08794147623239511.
2026-05-11 13:32:18,181 - optuna.study._optimize - INFO - Trial 54 pruned. 
2026-05-11 13:32:48,748 - optuna.study.study - INFO - Trial 55 finished with value: 0.0871193740908294 and parameters: {'n_layers': 1, 'embedding_dim': 96, 'lr': 0.013057862879553317, 'lambda_val': 0.0016716680734112773, 'batch_size': 3945, 'optimizer': 'RMSprop'}. Best is trial 42 with value: 0.08794147623239511.
2026-05-11 13:33:19,891 - optuna.study.study - INFO - Trial 56 finished with value: 0.07739441040054892 and parameters: {'n_layers': 1, 'embedding_dim': 96, 'lr': 0.0031549220202804064, 'lambda_val': 0.0011900841636635362, 'batch_size': 3945, 'optimizer': 'RMSprop'}. Best is trial 42 with value: 0.08794147623239511.
2026-05-11 13:33:33,765 - optuna.study._optimize - INFO - Trial 57 pruned. 
2026-05-11 13:33:39,341 - optuna.study._optimize - INFO - Trial 58 pruned. 
2026-05-11 13:34:09,502 - optuna.study.study - INFO - Trial 59 finished with value: 0.08428519920712368 and parameters: {'n_layers': 1, 'embedding_dim': 96, 'lr': 0.03056685533420877, 'lambda_val': 0.001750668391775473, 'batch_size': 4092, 'optimizer': 'RMSprop'}. Best is trial 42 with value: 0.08794147623239511.
2026-05-11 13:34:13,419 - optuna.study._optimize - INFO - Trial 60 pruned. 
2026-05-11 13:34:44,655 - optuna.study.study - INFO - Trial 61 finished with value: 0.08500463212310545 and parameters: {'n_layers': 1, 'embedding_dim': 96, 'lr': 0.027669353379131765, 'lambda_val': 0.0030668101301985877, 'batch_size': 4068, 'optimizer': 'RMSprop'}. Best is trial 42 with value: 0.08794147623239511.
2026-05-11 13:35:12,893 - optuna.study.study - INFO - Trial 62 finished with value: 0.08166344530781104 and parameters: {'n_layers': 1, 'embedding_dim': 96, 'lr': 0.004319371790814148, 'lambda_val': 0.003224283553015329, 'batch_size': 3943, 'optimizer': 'RMSprop'}. Best is trial 42 with value: 0.08794147623239511.
2026-05-11 13:35:40,375 - optuna.study.study - INFO - Trial 63 finished with value: 0.07213969707106531 and parameters: {'n_layers': 1, 'embedding_dim': 96, 'lr': 0.014715626558856268, 'lambda_val': 0.004638391702406878, 'batch_size': 3678, 'optimizer': 'RMSprop'}. Best is trial 42 with value: 0.08794147623239511.
2026-05-11 13:35:51,353 - optuna.study._optimize - INFO - Trial 64 pruned. 
2026-05-11 13:36:24,264 - optuna.study.study - INFO - Trial 65 finished with value: 0.0827586177436124 and parameters: {'n_layers': 1, 'embedding_dim': 128, 'lr': 0.009996286095244052, 'lambda_val': 0.001357093670129972, 'batch_size': 3735, 'optimizer': 'RMSprop'}. Best is trial 42 with value: 0.08794147623239511.
2026-05-11 13:36:29,097 - optuna.study._optimize - INFO - Trial 66 pruned. 
2026-05-11 13:36:33,368 - optuna.study._optimize - INFO - Trial 67 pruned. 
2026-05-11 13:36:38,437 - optuna.study._optimize - INFO - Trial 68 pruned. 
2026-05-11 13:36:43,792 - optuna.study._optimize - INFO - Trial 69 pruned. 
2026-05-11 13:36:50,339 - optuna.study._optimize - INFO - Trial 70 pruned. 
2026-05-11 13:37:26,252 - optuna.study.study - INFO - Trial 71 finished with value: 0.08219508261674126 and parameters: {'n_layers': 1, 'embedding_dim': 96, 'lr': 0.03394395952787421, 'lambda_val': 0.00166837923657806, 'batch_size': 4073, 'optimizer': 'RMSprop'}. Best is trial 42 with value: 0.08794147623239511.
2026-05-11 13:37:57,078 - optuna.study.study - INFO - Trial 72 finished with value: 0.058489370426373186 and parameters: {'n_layers': 1, 'embedding_dim': 96, 'lr': 0.0008482598686988475, 'lambda_val': 0.0018813407510297677, 'batch_size': 3899, 'optimizer': 'RMSprop'}. Best is trial 42 with value: 0.08794147623239511.
2026-05-11 13:38:26,644 - optuna.study.study - INFO - Trial 73 finished with value: 0.08253455485119456 and parameters: {'n_layers': 1, 'embedding_dim': 96, 'lr': 0.017265684001338117, 'lambda_val': 0.0038807907910385323, 'batch_size': 3605, 'optimizer': 'RMSprop'}. Best is trial 42 with value: 0.08794147623239511.
2026-05-11 13:38:33,340 - optuna.study._optimize - INFO - Trial 74 pruned. 
2026-05-11 13:39:06,154 - optuna.study.study - INFO - Trial 75 finished with value: 0.08935151068443083 and parameters: {'n_layers': 1, 'embedding_dim': 128, 'lr': 0.01141911383774249, 'lambda_val': 0.0010253722274354603, 'batch_size': 3987, 'optimizer': 'RMSprop'}. Best is trial 75 with value: 0.08935151068443083.
2026-05-11 13:39:39,467 - optuna.study.study - INFO - Trial 76 finished with value: 0.0845999234939301 and parameters: {'n_layers': 1, 'embedding_dim': 128, 'lr': 0.01194866390829891, 'lambda_val': 0.0010096003067392638, 'batch_size': 3841, 'optimizer': 'RMSprop'}. Best is trial 75 with value: 0.08935151068443083.
2026-05-11 13:39:44,161 - optuna.study._optimize - INFO - Trial 77 pruned. 
2026-05-11 13:39:49,364 - optuna.study._optimize - INFO - Trial 78 pruned. 
2026-05-11 13:40:22,576 - optuna.study.study - INFO - Trial 79 finished with value: 0.08394402950140262 and parameters: {'n_layers': 1, 'embedding_dim': 128, 'lr': 0.005788311557810227, 'lambda_val': 0.0026570450258063013, 'batch_size': 3302, 'optimizer': 'RMSprop'}. Best is trial 75 with value: 0.08935151068443083.
2026-05-11 13:40:27,072 - optuna.study._optimize - INFO - Trial 80 pruned. 
2026-05-11 13:40:58,187 - optuna.study.study - INFO - Trial 81 finished with value: 0.08020436354964228 and parameters: {'n_layers': 1, 'embedding_dim': 128, 'lr': 0.011151562401911366, 'lambda_val': 0.001035616226843182, 'batch_size': 3847, 'optimizer': 'RMSprop'}. Best is trial 75 with value: 0.08935151068443083.
2026-05-11 13:41:30,011 - optuna.study.study - INFO - Trial 82 finished with value: 0.08111962267277512 and parameters: {'n_layers': 1, 'embedding_dim': 128, 'lr': 0.02012920731918958, 'lambda_val': 0.0007731316680467836, 'batch_size': 3773, 'optimizer': 'RMSprop'}. Best is trial 75 with value: 0.08935151068443083.
2026-05-11 13:41:34,946 - optuna.study._optimize - INFO - Trial 83 pruned. 
2026-05-11 13:42:06,389 - optuna.study.study - INFO - Trial 84 finished with value: 0.08215763798185467 and parameters: {'n_layers': 1, 'embedding_dim': 128, 'lr': 0.008182976549328013, 'lambda_val': 0.003084938355474993, 'batch_size': 3661, 'optimizer': 'RMSprop'}. Best is trial 75 with value: 0.08935151068443083.
2026-05-11 13:42:11,794 - optuna.study._optimize - INFO - Trial 85 pruned. 
2026-05-11 13:42:51,932 - optuna.study.study - INFO - Trial 86 finished with value: 0.08052089904977554 and parameters: {'n_layers': 1, 'embedding_dim': 256, 'lr': 0.004837376018547401, 'lambda_val': 0.0005199253301003876, 'batch_size': 3857, 'optimizer': 'RMSprop'}. Best is trial 75 with value: 0.08935151068443083.
2026-05-11 13:42:56,533 - optuna.study._optimize - INFO - Trial 87 pruned. 
2026-05-11 13:43:11,832 - optuna.study._optimize - INFO - Trial 88 pruned. 
2026-05-11 13:43:48,394 - optuna.study.study - INFO - Trial 89 finished with value: 0.060805879671820794 and parameters: {'n_layers': 1, 'embedding_dim': 256, 'lr': 0.0015782132005254955, 'lambda_val': 1.3642498111309699e-05, 'batch_size': 3460, 'optimizer': 'Adam'}. Best is trial 75 with value: 0.08935151068443083.
2026-05-11 13:44:24,334 - optuna.study.study - INFO - Trial 90 finished with value: 0.08732223577919508 and parameters: {'n_layers': 1, 'embedding_dim': 256, 'lr': 0.013510220053230947, 'lambda_val': 0.0008688221242697773, 'batch_size': 3717, 'optimizer': 'RMSprop'}. Best is trial 75 with value: 0.08935151068443083.
2026-05-11 13:45:00,667 - optuna.study.study - INFO - Trial 91 finished with value: 0.08630329467033213 and parameters: {'n_layers': 1, 'embedding_dim': 256, 'lr': 0.01376730861648907, 'lambda_val': 0.0008835758471368341, 'batch_size': 3749, 'optimizer': 'RMSprop'}. Best is trial 75 with value: 0.08935151068443083.
2026-05-11 13:45:30,912 - optuna.study._optimize - INFO - Trial 92 pruned. 
2026-05-11 13:46:04,926 - optuna.study.study - INFO - Trial 93 finished with value: 0.09646695452906398 and parameters: {'n_layers': 1, 'embedding_dim': 256, 'lr': 0.008991111923027942, 'lambda_val': 0.0007356571821450997, 'batch_size': 1834, 'optimizer': 'RMSprop'}. Best is trial 93 with value: 0.09646695452906398.
2026-05-11 13:46:11,303 - optuna.study._optimize - INFO - Trial 94 pruned. 
2026-05-11 13:46:24,716 - optuna.study._optimize - INFO - Trial 95 pruned. 
2026-05-11 13:47:03,205 - optuna.study.study - INFO - Trial 96 finished with value: 0.08438628465347134 and parameters: {'n_layers': 1, 'embedding_dim': 256, 'lr': 0.015717439844918277, 'lambda_val': 0.0014997372991955862, 'batch_size': 3357, 'optimizer': 'RMSprop'}. Best is trial 93 with value: 0.09646695452906398.
2026-05-11 13:47:41,739 - optuna.study.study - INFO - Trial 97 finished with value: 0.08813615040647539 and parameters: {'n_layers': 1, 'embedding_dim': 256, 'lr': 0.010184647178429873, 'lambda_val': 0.0006228490533229077, 'batch_size': 3774, 'optimizer': 'RMSprop'}. Best is trial 93 with value: 0.09646695452906398.
2026-05-11 13:47:53,264 - optuna.study._optimize - INFO - Trial 98 pruned. 
2026-05-11 13:47:59,356 - optuna.study._optimize - INFO - Trial 99 pruned. 
2026-05-11 13:48:19,302 - optuna.study._optimize - INFO - Trial 100 pruned. 
2026-05-11 13:48:24,781 - optuna.study._optimize - INFO - Trial 101 pruned. 
2026-05-11 13:48:31,649 - optuna.study._optimize - INFO - Trial 102 pruned. 
2026-05-11 13:49:07,488 - optuna.study.study - INFO - Trial 103 finished with value: 0.08705086631754755 and parameters: {'n_layers': 1, 'embedding_dim': 256, 'lr': 0.01434311974739403, 'lambda_val': 0.0015765141406298235, 'batch_size': 3990, 'optimizer': 'RMSprop'}. Best is trial 93 with value: 0.09646695452906398.
2026-05-11 13:49:43,735 - optuna.study.study - INFO - Trial 104 finished with value: 0.0865719448287287 and parameters: {'n_layers': 1, 'embedding_dim': 256, 'lr': 0.013876899582867938, 'lambda_val': 0.0006783510553141277, 'batch_size': 3622, 'optimizer': 'RMSprop'}. Best is trial 93 with value: 0.09646695452906398.
2026-05-11 13:49:48,399 - optuna.study._optimize - INFO - Trial 105 pruned. 
2026-05-11 13:49:52,948 - optuna.study._optimize - INFO - Trial 106 pruned. 
2026-05-11 13:49:58,168 - optuna.study._optimize - INFO - Trial 107 pruned. 
2026-05-11 13:50:06,285 - optuna.study._optimize - INFO - Trial 108 pruned. 
2026-05-11 13:50:11,768 - optuna.study._optimize - INFO - Trial 109 pruned. 
2026-05-11 13:50:49,417 - optuna.study.study - INFO - Trial 110 finished with value: 0.07629852264277069 and parameters: {'n_layers': 1, 'embedding_dim': 256, 'lr': 0.00022466624143773308, 'lambda_val': 0.00039824059089350997, 'batch_size': 2432, 'optimizer': 'RMSprop'}. Best is trial 93 with value: 0.09646695452906398.
2026-05-11 13:51:28,552 - optuna.study.study - INFO - Trial 111 finished with value: 0.089625219803273 and parameters: {'n_layers': 1, 'embedding_dim': 256, 'lr': 0.006927385058869841, 'lambda_val': 0.0007266319864976931, 'batch_size': 3837, 'optimizer': 'RMSprop'}. Best is trial 93 with value: 0.09646695452906398.
2026-05-11 13:51:33,064 - optuna.study._optimize - INFO - Trial 112 pruned. 
2026-05-11 13:52:10,348 - optuna.study.study - INFO - Trial 113 finished with value: 0.08220301391337677 and parameters: {'n_layers': 1, 'embedding_dim': 256, 'lr': 0.009544714199398674, 'lambda_val': 0.0011697741730613462, 'batch_size': 3816, 'optimizer': 'RMSprop'}. Best is trial 93 with value: 0.09646695452906398.
2026-05-11 13:52:48,341 - optuna.study.study - INFO - Trial 114 finished with value: 0.08669980759558271 and parameters: {'n_layers': 1, 'embedding_dim': 256, 'lr': 0.0073019508857902335, 'lambda_val': 0.0005505441909055914, 'batch_size': 3896, 'optimizer': 'RMSprop'}. Best is trial 93 with value: 0.09646695452906398.
2026-05-11 13:53:37,433 - optuna.study.study - INFO - Trial 115 finished with value: 0.08855173363701413 and parameters: {'n_layers': 1, 'embedding_dim': 256, 'lr': 0.007140465427057866, 'lambda_val': 0.0005001123776342009, 'batch_size': 3890, 'optimizer': 'RMSprop'}. Best is trial 93 with value: 0.09646695452906398.
2026-05-11 13:54:12,187 - optuna.study.study - INFO - Trial 116 finished with value: 0.08770525334237439 and parameters: {'n_layers': 1, 'embedding_dim': 256, 'lr': 0.00686271676309921, 'lambda_val': 0.0005131395046483602, 'batch_size': 3932, 'optimizer': 'RMSprop'}. Best is trial 93 with value: 0.09646695452906398.
2026-05-11 13:54:21,300 - optuna.study._optimize - INFO - Trial 117 pruned. 
2026-05-11 13:54:48,263 - optuna.study._optimize - INFO - Trial 118 pruned. 
2026-05-11 13:55:33,245 - optuna.study.study - INFO - Trial 119 finished with value: 0.08541689438643123 and parameters: {'n_layers': 1, 'embedding_dim': 256, 'lr': 0.007112451275014772, 'lambda_val': 0.0003658306641352075, 'batch_size': 3932, 'optimizer': 'RMSprop'}. Best is trial 93 with value: 0.09646695452906398.
2026-05-11 13:55:42,728 - optuna.study._optimize - INFO - Trial 120 pruned. 
