2026-05-10 19:49:14,988 - root - INFO - **** Training e_100K_full
2026-05-10 19:49:15,012 - helper_functions - INFO - Users: 610, Items: 9742
2026-05-10 19:49:15,142 - helper_functions - INFO - Edge index: torch.Size([2, 81763])
2026-05-10 19:49:15,142 - root - INFO - **** Generating the graph:
2026-05-10 19:49:15,208 - helper_functions - INFO - Number of unique users: 609
2026-05-10 19:49:15,209 - helper_functions - INFO - Number of unique items: 8452
2026-05-10 19:49:15,209 - helper_functions - INFO - Number of nodes: 9061
2026-05-10 19:49:15,210 - helper_functions - INFO - Number of edges: 81763
2026-05-10 19:49:18,116 - optuna.storages._rdb.storage - INFO - A new study created in RDB with name: Study_e_100K_full
2026-05-10 19:49:59,863 - optuna.study.study - INFO - Trial 0 finished with value: 0.03223402573366452 and parameters: {'n_layers': 3, 'embedding_dim': 128, 'lr': 0.07279942799776445, 'lambda_val': 4.719896165228555e-05, 'batch_size': 2450, 'optimizer': 'Adam'}. Best is trial 0 with value: 0.03223402573366452.
2026-05-10 19:50:33,203 - optuna.study.study - INFO - Trial 1 finished with value: 0.06902790942244427 and parameters: {'n_layers': 3, 'embedding_dim': 64, 'lr': 4.5879161400747536e-05, 'lambda_val': 0.0009721943806751426, 'batch_size': 2019, 'optimizer': 'Adam'}. Best is trial 1 with value: 0.06902790942244427.
2026-05-10 19:51:04,774 - optuna.study.study - INFO - Trial 2 finished with value: 0.0022484686676040957 and parameters: {'n_layers': 3, 'embedding_dim': 32, 'lr': 3.279583777927141e-05, 'lambda_val': 0.005356588129672923, 'batch_size': 2990, 'optimizer': 'SGD'}. Best is trial 1 with value: 0.06902790942244427.
2026-05-10 19:51:39,524 - optuna.study.study - INFO - Trial 3 finished with value: 0.04995718169155589 and parameters: {'n_layers': 2, 'embedding_dim': 128, 'lr': 0.013396372402986703, 'lambda_val': 0.001547385268830898, 'batch_size': 2146, 'optimizer': 'Adam'}. Best is trial 1 with value: 0.06902790942244427.
2026-05-10 19:52:11,578 - optuna.study.study - INFO - Trial 4 finished with value: 0.03358302804105362 and parameters: {'n_layers': 3, 'embedding_dim': 32, 'lr': 3.111368966720046e-05, 'lambda_val': 0.0016986372400977078, 'batch_size': 1134, 'optimizer': 'Adam'}. Best is trial 1 with value: 0.06902790942244427.
2026-05-10 19:52:17,251 - optuna.study._optimize - INFO - Trial 5 pruned. 
2026-05-10 19:52:21,821 - optuna.study._optimize - INFO - Trial 6 pruned. 
2026-05-10 19:53:22,338 - optuna.study.study - INFO - Trial 7 finished with value: 0.02260089864049967 and parameters: {'n_layers': 4, 'embedding_dim': 256, 'lr': 0.0002562822383999906, 'lambda_val': 0.0028735672662029534, 'batch_size': 1478, 'optimizer': 'RMSprop'}. Best is trial 1 with value: 0.06902790942244427.
2026-05-10 19:54:25,341 - optuna.study.study - INFO - Trial 8 finished with value: 0.03406860180093279 and parameters: {'n_layers': 4, 'embedding_dim': 256, 'lr': 0.009162114255175251, 'lambda_val': 1.0265147017220007e-05, 'batch_size': 3273, 'optimizer': 'RMSprop'}. Best is trial 1 with value: 0.06902790942244427.
2026-05-10 19:54:42,649 - optuna.study._optimize - INFO - Trial 9 pruned. 
2026-05-10 19:54:57,248 - optuna.study._optimize - INFO - Trial 10 pruned. 
2026-05-10 19:55:08,581 - optuna.study._optimize - INFO - Trial 11 pruned. 
2026-05-10 19:55:42,969 - optuna.study.study - INFO - Trial 12 finished with value: 0.02088504487715425 and parameters: {'n_layers': 2, 'embedding_dim': 128, 'lr': 0.00023075294210282804, 'lambda_val': 0.015817515377712334, 'batch_size': 614, 'optimizer': 'Adam'}. Best is trial 1 with value: 0.06902790942244427.
2026-05-10 19:55:47,094 - optuna.study._optimize - INFO - Trial 13 pruned. 
2026-05-10 19:55:51,101 - optuna.study._optimize - INFO - Trial 14 pruned. 
2026-05-10 19:56:26,340 - optuna.study.study - INFO - Trial 15 finished with value: 0.03330055354838485 and parameters: {'n_layers': 2, 'embedding_dim': 128, 'lr': 0.0007520214703823312, 'lambda_val': 1.95295956782082e-06, 'batch_size': 1072, 'optimizer': 'Adam'}. Best is trial 1 with value: 0.06902790942244427.
2026-05-10 19:56:56,192 - optuna.study.study - INFO - Trial 16 finished with value: 0.11251554167857614 and parameters: {'n_layers': 1, 'embedding_dim': 64, 'lr': 9.937829400654046e-05, 'lambda_val': 0.0006168371520328871, 'batch_size': 2391, 'optimizer': 'Adam'}. Best is trial 16 with value: 0.11251554167857614.
2026-05-10 19:57:00,463 - optuna.study._optimize - INFO - Trial 17 pruned. 
2026-05-10 19:57:04,658 - optuna.study._optimize - INFO - Trial 18 pruned. 
2026-05-10 19:57:09,546 - optuna.study._optimize - INFO - Trial 19 pruned. 
2026-05-10 19:57:39,209 - optuna.study.study - INFO - Trial 20 finished with value: 0.045945846057427575 and parameters: {'n_layers': 1, 'embedding_dim': 64, 'lr': 0.0004959728733854119, 'lambda_val': 0.008558883845053985, 'batch_size': 2431, 'optimizer': 'Adam'}. Best is trial 16 with value: 0.11251554167857614.
2026-05-10 19:58:14,277 - optuna.study.study - INFO - Trial 21 finished with value: 0.03901030787241739 and parameters: {'n_layers': 2, 'embedding_dim': 128, 'lr': 0.0021885483119304535, 'lambda_val': 0.0007074911537692771, 'batch_size': 2195, 'optimizer': 'Adam'}. Best is trial 16 with value: 0.11251554167857614.
2026-05-10 19:58:18,288 - optuna.study._optimize - INFO - Trial 22 pruned. 
2026-05-10 19:58:24,471 - optuna.study._optimize - INFO - Trial 23 pruned. 
2026-05-10 19:58:53,933 - optuna.study.study - INFO - Trial 24 finished with value: 0.07480541058332181 and parameters: {'n_layers': 1, 'embedding_dim': 96, 'lr': 0.005217648151662513, 'lambda_val': 0.006294541527858647, 'batch_size': 2771, 'optimizer': 'Adam'}. Best is trial 16 with value: 0.11251554167857614.
2026-05-10 19:59:23,628 - optuna.study.study - INFO - Trial 25 finished with value: 0.035267419162996465 and parameters: {'n_layers': 1, 'embedding_dim': 96, 'lr': 0.0004364949857890274, 'lambda_val': 0.029230500855798747, 'batch_size': 3594, 'optimizer': 'Adam'}. Best is trial 16 with value: 0.11251554167857614.
2026-05-10 19:59:53,481 - optuna.study.study - INFO - Trial 26 finished with value: 0.0802157192018818 and parameters: {'n_layers': 1, 'embedding_dim': 96, 'lr': 0.0044582228646504185, 'lambda_val': 0.004986353483094189, 'batch_size': 2775, 'optimizer': 'Adam'}. Best is trial 16 with value: 0.11251554167857614.
2026-05-10 20:00:23,468 - optuna.study.study - INFO - Trial 27 finished with value: 0.07628651721382453 and parameters: {'n_layers': 1, 'embedding_dim': 96, 'lr': 0.0038681953060507863, 'lambda_val': 0.005698257762794858, 'batch_size': 2876, 'optimizer': 'Adam'}. Best is trial 16 with value: 0.11251554167857614.
2026-05-10 20:00:27,483 - optuna.study._optimize - INFO - Trial 28 pruned. 
2026-05-10 20:00:32,089 - optuna.study._optimize - INFO - Trial 29 pruned. 
2026-05-10 20:01:01,006 - optuna.study.study - INFO - Trial 30 finished with value: 0.07468944302873949 and parameters: {'n_layers': 1, 'embedding_dim': 96, 'lr': 0.0015465515640637432, 'lambda_val': 0.0036567077047791993, 'batch_size': 2875, 'optimizer': 'Adam'}. Best is trial 16 with value: 0.11251554167857614.
2026-05-10 20:01:31,915 - optuna.study.study - INFO - Trial 31 finished with value: 0.07204228542272224 and parameters: {'n_layers': 1, 'embedding_dim': 96, 'lr': 0.005652173713426459, 'lambda_val': 0.007177854392157322, 'batch_size': 2762, 'optimizer': 'Adam'}. Best is trial 16 with value: 0.11251554167857614.
2026-05-10 20:02:01,146 - optuna.study.study - INFO - Trial 32 finished with value: 0.05358009163403556 and parameters: {'n_layers': 1, 'embedding_dim': 96, 'lr': 0.005627314858202203, 'lambda_val': 0.017069373459392304, 'batch_size': 3166, 'optimizer': 'Adam'}. Best is trial 16 with value: 0.11251554167857614.
2026-05-10 20:02:29,832 - optuna.study.study - INFO - Trial 33 finished with value: 0.07445712149913691 and parameters: {'n_layers': 1, 'embedding_dim': 96, 'lr': 0.002800821414806846, 'lambda_val': 0.0048844090263960695, 'batch_size': 2606, 'optimizer': 'Adam'}. Best is trial 16 with value: 0.11251554167857614.
2026-05-10 20:02:59,449 - optuna.study.study - INFO - Trial 34 finished with value: 0.0869322625416611 and parameters: {'n_layers': 1, 'embedding_dim': 96, 'lr': 0.026080913216570457, 'lambda_val': 0.002062061208352457, 'batch_size': 2857, 'optimizer': 'Adam'}. Best is trial 16 with value: 0.11251554167857614.
2026-05-10 20:03:03,873 - optuna.study._optimize - INFO - Trial 35 pruned. 
2026-05-10 20:03:08,000 - optuna.study._optimize - INFO - Trial 36 pruned. 
2026-05-10 20:03:12,025 - optuna.study._optimize - INFO - Trial 37 pruned. 
2026-05-10 20:03:40,997 - optuna.study.study - INFO - Trial 38 finished with value: 0.032677677487813195 and parameters: {'n_layers': 2, 'embedding_dim': 96, 'lr': 0.0009533231005341646, 'lambda_val': 0.002753957234317774, 'batch_size': 2525, 'optimizer': 'Adam'}. Best is trial 16 with value: 0.11251554167857614.
2026-05-10 20:03:45,575 - optuna.study._optimize - INFO - Trial 39 pruned. 
2026-05-10 20:03:48,435 - optuna.study._optimize - INFO - Trial 40 pruned. 
2026-05-10 20:04:14,601 - optuna.study.study - INFO - Trial 41 finished with value: 0.06628674455214287 and parameters: {'n_layers': 1, 'embedding_dim': 96, 'lr': 0.0014904691064968605, 'lambda_val': 0.003988676272301593, 'batch_size': 2849, 'optimizer': 'Adam'}. Best is trial 16 with value: 0.11251554167857614.
2026-05-10 20:04:42,022 - optuna.study.study - INFO - Trial 42 finished with value: 0.08216940550924526 and parameters: {'n_layers': 1, 'embedding_dim': 96, 'lr': 0.00609540543506721, 'lambda_val': 0.0010450461932593877, 'batch_size': 2747, 'optimizer': 'Adam'}. Best is trial 16 with value: 0.11251554167857614.
2026-05-10 20:05:07,860 - optuna.study.study - INFO - Trial 43 finished with value: 0.08293367004163829 and parameters: {'n_layers': 1, 'embedding_dim': 96, 'lr': 0.010542941732276158, 'lambda_val': 0.001193739284005729, 'batch_size': 3007, 'optimizer': 'Adam'}. Best is trial 16 with value: 0.11251554167857614.
2026-05-10 20:05:35,425 - optuna.study.study - INFO - Trial 44 finished with value: 0.08861904977150126 and parameters: {'n_layers': 1, 'embedding_dim': 96, 'lr': 0.00931215596259122, 'lambda_val': 0.0011213231398229057, 'batch_size': 3093, 'optimizer': 'RMSprop'}. Best is trial 16 with value: 0.11251554167857614.
2026-05-10 20:05:39,615 - optuna.study._optimize - INFO - Trial 45 pruned. 
2026-05-10 20:05:44,707 - optuna.study._optimize - INFO - Trial 46 pruned. 
2026-05-10 20:06:14,302 - optuna.study.study - INFO - Trial 47 finished with value: 0.07931910955381961 and parameters: {'n_layers': 1, 'embedding_dim': 64, 'lr': 0.01179254367706843, 'lambda_val': 0.001025645454237239, 'batch_size': 3749, 'optimizer': 'RMSprop'}. Best is trial 16 with value: 0.11251554167857614.
2026-05-10 20:06:18,891 - optuna.study._optimize - INFO - Trial 48 pruned. 
2026-05-10 20:06:22,870 - optuna.study._optimize - INFO - Trial 49 pruned. 
2026-05-10 20:06:52,913 - optuna.study.study - INFO - Trial 50 finished with value: 0.1095344142553535 and parameters: {'n_layers': 1, 'embedding_dim': 128, 'lr': 0.0001200968464319865, 'lambda_val': 5.358313098958406e-05, 'batch_size': 2618, 'optimizer': 'RMSprop'}. Best is trial 16 with value: 0.11251554167857614.
2026-05-10 20:07:23,490 - optuna.study.study - INFO - Trial 51 finished with value: 0.13024395514313283 and parameters: {'n_layers': 1, 'embedding_dim': 128, 'lr': 0.00010676426690590239, 'lambda_val': 3.350825674522868e-05, 'batch_size': 2469, 'optimizer': 'RMSprop'}. Best is trial 51 with value: 0.13024395514313283.
2026-05-10 20:07:53,994 - optuna.study.study - INFO - Trial 52 finished with value: 0.09511368652131766 and parameters: {'n_layers': 1, 'embedding_dim': 128, 'lr': 0.00015975535111382105, 'lambda_val': 1.1719756331950862e-05, 'batch_size': 2566, 'optimizer': 'RMSprop'}. Best is trial 51 with value: 0.13024395514313283.
2026-05-10 20:08:25,105 - optuna.study.study - INFO - Trial 53 finished with value: 0.07851198289440496 and parameters: {'n_layers': 1, 'embedding_dim': 128, 'lr': 0.00018167091858955695, 'lambda_val': 2.733620152919847e-05, 'batch_size': 2515, 'optimizer': 'RMSprop'}. Best is trial 51 with value: 0.13024395514313283.
2026-05-10 20:08:28,976 - optuna.study._optimize - INFO - Trial 54 pruned. 
2026-05-10 20:08:32,718 - optuna.study._optimize - INFO - Trial 55 pruned. 
2026-05-10 20:09:07,668 - optuna.study.study - INFO - Trial 56 finished with value: 0.03738947007940308 and parameters: {'n_layers': 2, 'embedding_dim': 128, 'lr': 0.00012284114144434183, 'lambda_val': 2.0887204627767068e-05, 'batch_size': 1883, 'optimizer': 'RMSprop'}. Best is trial 51 with value: 0.13024395514313283.
2026-05-10 20:09:13,375 - optuna.study._optimize - INFO - Trial 57 pruned. 
2026-05-10 20:09:17,081 - optuna.study._optimize - INFO - Trial 58 pruned. 
2026-05-10 20:09:22,556 - optuna.study._optimize - INFO - Trial 59 pruned. 
2026-05-10 20:09:51,401 - optuna.study.study - INFO - Trial 60 finished with value: 0.06300921662122919 and parameters: {'n_layers': 1, 'embedding_dim': 128, 'lr': 0.0003061037207974086, 'lambda_val': 1.6347933258608246e-05, 'batch_size': 2157, 'optimizer': 'RMSprop'}. Best is trial 51 with value: 0.13024395514313283.
2026-05-10 20:09:56,173 - optuna.study._optimize - INFO - Trial 61 pruned. 
2026-05-10 20:10:25,234 - optuna.study.study - INFO - Trial 62 finished with value: 0.07636168074196074 and parameters: {'n_layers': 1, 'embedding_dim': 64, 'lr': 0.0001750881435569168, 'lambda_val': 0.00020920759027941846, 'batch_size': 2952, 'optimizer': 'RMSprop'}. Best is trial 51 with value: 0.13024395514313283.
2026-05-10 20:10:55,434 - optuna.study.study - INFO - Trial 63 finished with value: 0.05289994642137742 and parameters: {'n_layers': 1, 'embedding_dim': 128, 'lr': 0.0005896606246459187, 'lambda_val': 6.917563724354077e-06, 'batch_size': 2524, 'optimizer': 'RMSprop'}. Best is trial 51 with value: 0.13024395514313283.
2026-05-10 20:10:59,547 - optuna.study._optimize - INFO - Trial 64 pruned. 
2026-05-10 20:11:03,623 - optuna.study._optimize - INFO - Trial 65 pruned. 
2026-05-10 20:11:07,927 - optuna.study._optimize - INFO - Trial 66 pruned. 
2026-05-10 20:11:12,086 - optuna.study._optimize - INFO - Trial 67 pruned. 
2026-05-10 20:11:43,643 - optuna.study.study - INFO - Trial 68 finished with value: 0.08985754155951749 and parameters: {'n_layers': 1, 'embedding_dim': 128, 'lr': 0.016606408445234765, 'lambda_val': 0.001414584883898531, 'batch_size': 3288, 'optimizer': 'RMSprop'}. Best is trial 51 with value: 0.13024395514313283.
2026-05-10 20:11:48,233 - optuna.study._optimize - INFO - Trial 69 pruned. 
2026-05-10 20:11:52,977 - optuna.study._optimize - INFO - Trial 70 pruned. 
2026-05-10 20:12:24,158 - optuna.study.study - INFO - Trial 71 finished with value: 0.06294691931524544 and parameters: {'n_layers': 1, 'embedding_dim': 128, 'lr': 0.00021518701283589138, 'lambda_val': 0.0004223542857522264, 'batch_size': 2894, 'optimizer': 'RMSprop'}. Best is trial 51 with value: 0.13024395514313283.
2026-05-10 20:12:54,602 - optuna.study.study - INFO - Trial 72 finished with value: 0.0942263020847976 and parameters: {'n_layers': 1, 'embedding_dim': 128, 'lr': 0.022748963815931722, 'lambda_val': 0.0013929183382642874, 'batch_size': 3185, 'optimizer': 'RMSprop'}. Best is trial 51 with value: 0.13024395514313283.
2026-05-10 20:12:58,484 - optuna.study._optimize - INFO - Trial 73 pruned. 
2026-05-10 20:13:30,044 - optuna.study.study - INFO - Trial 74 finished with value: 0.08923591173628473 and parameters: {'n_layers': 1, 'embedding_dim': 128, 'lr': 0.02298726203243557, 'lambda_val': 0.0015106298365246094, 'batch_size': 2812, 'optimizer': 'RMSprop'}. Best is trial 51 with value: 0.13024395514313283.
2026-05-10 20:14:01,724 - optuna.study.study - INFO - Trial 75 finished with value: 0.0880517061282668 and parameters: {'n_layers': 1, 'embedding_dim': 128, 'lr': 0.022509955654378865, 'lambda_val': 0.0007827285816807036, 'batch_size': 3405, 'optimizer': 'RMSprop'}. Best is trial 51 with value: 0.13024395514313283.
2026-05-10 20:14:33,381 - optuna.study.study - INFO - Trial 76 finished with value: 0.059659107478457325 and parameters: {'n_layers': 1, 'embedding_dim': 128, 'lr': 0.00014739793149045303, 'lambda_val': 0.0015343842287426166, 'batch_size': 3762, 'optimizer': 'RMSprop'}. Best is trial 51 with value: 0.13024395514313283.
2026-05-10 20:14:37,412 - optuna.study._optimize - INFO - Trial 77 pruned. 
2026-05-10 20:15:08,320 - optuna.study.study - INFO - Trial 78 finished with value: 0.08797892545707445 and parameters: {'n_layers': 1, 'embedding_dim': 128, 'lr': 0.007718495811820887, 'lambda_val': 0.002901172849741156, 'batch_size': 3130, 'optimizer': 'RMSprop'}. Best is trial 51 with value: 0.13024395514313283.
2026-05-10 20:15:15,156 - optuna.study._optimize - INFO - Trial 79 pruned. 
2026-05-10 20:15:32,465 - optuna.study._optimize - INFO - Trial 80 pruned. 
2026-05-10 20:16:03,241 - optuna.study.study - INFO - Trial 81 finished with value: 0.09363608742808519 and parameters: {'n_layers': 1, 'embedding_dim': 128, 'lr': 0.021696195129096554, 'lambda_val': 0.0008289975540863027, 'batch_size': 3418, 'optimizer': 'RMSprop'}. Best is trial 51 with value: 0.13024395514313283.
2026-05-10 20:16:07,013 - optuna.study._optimize - INFO - Trial 82 pruned. 
2026-05-10 20:16:35,867 - optuna.study.study - INFO - Trial 83 finished with value: 0.09205217608472561 and parameters: {'n_layers': 1, 'embedding_dim': 128, 'lr': 0.022294486334992977, 'lambda_val': 0.0009205169442338668, 'batch_size': 2265, 'optimizer': 'RMSprop'}. Best is trial 51 with value: 0.13024395514313283.
2026-05-10 20:16:39,726 - optuna.study._optimize - INFO - Trial 84 pruned. 
2026-05-10 20:16:43,537 - optuna.study._optimize - INFO - Trial 85 pruned. 
2026-05-10 20:16:47,509 - optuna.study._optimize - INFO - Trial 86 pruned. 
2026-05-10 20:16:52,376 - optuna.study._optimize - INFO - Trial 87 pruned. 
2026-05-10 20:16:56,629 - optuna.study._optimize - INFO - Trial 88 pruned. 
2026-05-10 20:17:01,054 - optuna.study._optimize - INFO - Trial 89 pruned. 
2026-05-10 20:17:29,189 - optuna.study.study - INFO - Trial 90 finished with value: 0.04757932905341917 and parameters: {'n_layers': 1, 'embedding_dim': 64, 'lr': 0.000396867276630537, 'lambda_val': 0.0002734037826740568, 'batch_size': 2492, 'optimizer': 'RMSprop'}. Best is trial 51 with value: 0.13024395514313283.
2026-05-10 20:17:59,668 - optuna.study.study - INFO - Trial 91 finished with value: 0.09651652377494765 and parameters: {'n_layers': 1, 'embedding_dim': 128, 'lr': 0.012035101217800825, 'lambda_val': 0.000985016439556479, 'batch_size': 3620, 'optimizer': 'RMSprop'}. Best is trial 51 with value: 0.13024395514313283.
2026-05-10 20:18:30,508 - optuna.study.study - INFO - Trial 92 finished with value: 0.09031455328125411 and parameters: {'n_layers': 1, 'embedding_dim': 128, 'lr': 0.011662456928325324, 'lambda_val': 0.0019002032932574136, 'batch_size': 3562, 'optimizer': 'RMSprop'}. Best is trial 51 with value: 0.13024395514313283.
2026-05-10 20:19:00,894 - optuna.study.study - INFO - Trial 93 finished with value: 0.0928499354225007 and parameters: {'n_layers': 1, 'embedding_dim': 128, 'lr': 0.011821665267474316, 'lambda_val': 0.0008615741558882633, 'batch_size': 3565, 'optimizer': 'RMSprop'}. Best is trial 51 with value: 0.13024395514313283.
2026-05-10 20:19:31,493 - optuna.study.study - INFO - Trial 94 finished with value: 0.08114268108642446 and parameters: {'n_layers': 1, 'embedding_dim': 128, 'lr': 0.006776812118385538, 'lambda_val': 0.0005184437767972038, 'batch_size': 3649, 'optimizer': 'RMSprop'}. Best is trial 51 with value: 0.13024395514313283.
2026-05-10 20:19:35,921 - optuna.study._optimize - INFO - Trial 95 pruned. 
2026-05-10 20:20:07,655 - optuna.study.study - INFO - Trial 96 finished with value: 0.08440016526573953 and parameters: {'n_layers': 1, 'embedding_dim': 128, 'lr': 0.0032559816061908347, 'lambda_val': 0.0007877370653611754, 'batch_size': 3944, 'optimizer': 'RMSprop'}. Best is trial 51 with value: 0.13024395514313283.
2026-05-10 20:20:11,719 - optuna.study._optimize - INFO - Trial 97 pruned. 
2026-05-10 20:20:48,014 - optuna.study.study - INFO - Trial 98 finished with value: 0.10757660934898555 and parameters: {'n_layers': 1, 'embedding_dim': 256, 'lr': 8.999866920078023e-05, 'lambda_val': 0.000161465944910997, 'batch_size': 3590, 'optimizer': 'RMSprop'}. Best is trial 51 with value: 0.13024395514313283.
2026-05-10 20:20:52,393 - optuna.study._optimize - INFO - Trial 99 pruned. 
2026-05-10 20:20:56,579 - optuna.study._optimize - INFO - Trial 100 pruned. 
2026-05-10 20:21:32,480 - optuna.study.study - INFO - Trial 101 finished with value: 0.09464322737113592 and parameters: {'n_layers': 1, 'embedding_dim': 256, 'lr': 0.00011108316392917086, 'lambda_val': 1.9242872402326256e-05, 'batch_size': 3857, 'optimizer': 'RMSprop'}. Best is trial 51 with value: 0.13024395514313283.
2026-05-10 20:22:08,229 - optuna.study.study - INFO - Trial 102 finished with value: 0.09783250385278307 and parameters: {'n_layers': 1, 'embedding_dim': 256, 'lr': 0.00010794450682645763, 'lambda_val': 2.3189379371306577e-05, 'batch_size': 3870, 'optimizer': 'RMSprop'}. Best is trial 51 with value: 0.13024395514313283.
2026-05-10 20:22:12,631 - optuna.study._optimize - INFO - Trial 103 pruned. 
2026-05-10 20:22:48,651 - optuna.study.study - INFO - Trial 104 finished with value: 0.07241879659112724 and parameters: {'n_layers': 1, 'embedding_dim': 256, 'lr': 0.00012191073913119304, 'lambda_val': 1.6536789355588254e-05, 'batch_size': 3919, 'optimizer': 'RMSprop'}. Best is trial 51 with value: 0.13024395514313283.
