2026-05-10 21:59:04,656 - optuna.study.study - INFO - Trial 49 finished with value: 0.09513578948286645 and parameters: {'n_layers': 1, 'embedding_dim': 256, 'lr': 0.00010148761329822426, 'lambda_val': 6.113039602628951e-06, 'batch_size': 3553, 'optimizer': 'Adam'}. Best is trial 10 with value: 0.11877962521025955.
2026-05-10 21:59:39,468 - optuna.study.study - INFO - Trial 50 finished with value: 0.11089088111194627 and parameters: {'n_layers': 1, 'embedding_dim': 256, 'lr': 8.630267503339122e-05, 'lambda_val': 2.477750623445891e-06, 'batch_size': 3482, 'optimizer': 'Adam'}. Best is trial 10 with value: 0.11877962521025955.
2026-05-10 22:00:15,461 - optuna.study.study - INFO - Trial 51 finished with value: 0.10663704275472502 and parameters: {'n_layers': 1, 'embedding_dim': 256, 'lr': 9.45216878902208e-05, 'lambda_val': 1.2863820911052098e-06, 'batch_size': 3517, 'optimizer': 'Adam'}. Best is trial 10 with value: 0.11877962521025955.
2026-05-10 22:00:51,905 - optuna.study.study - INFO - Trial 52 finished with value: 0.10476234520396725 and parameters: {'n_layers': 1, 'embedding_dim': 256, 'lr': 8.731564900796097e-05, 'lambda_val': 1.0389066931336272e-06, 'batch_size': 3635, 'optimizer': 'Adam'}. Best is trial 10 with value: 0.11877962521025955.
2026-05-10 22:00:56,255 - optuna.study._optimize - INFO - Trial 53 pruned. 
2026-05-10 22:01:00,561 - optuna.study._optimize - INFO - Trial 54 pruned. 
2026-05-10 22:01:04,978 - optuna.study._optimize - INFO - Trial 55 pruned. 
2026-05-10 22:01:09,118 - optuna.study._optimize - INFO - Trial 56 pruned. 
2026-05-10 22:01:44,141 - optuna.study.study - INFO - Trial 57 finished with value: 0.07351766882789516 and parameters: {'n_layers': 1, 'embedding_dim': 256, 'lr': 0.00018888257820556809, 'lambda_val': 6.863588249962292e-06, 'batch_size': 3441, 'optimizer': 'Adam'}. Best is trial 10 with value: 0.11877962521025955.
2026-05-10 22:01:49,243 - optuna.study._optimize - INFO - Trial 58 pruned. 
2026-05-10 22:02:24,818 - optuna.study.study - INFO - Trial 59 finished with value: 0.09077593098182522 and parameters: {'n_layers': 1, 'embedding_dim': 256, 'lr': 0.00010366288309467357, 'lambda_val': 1.5505471593279204e-06, 'batch_size': 3571, 'optimizer': 'Adam'}. Best is trial 10 with value: 0.11877962521025955.
2026-05-10 22:02:32,318 - optuna.study._optimize - INFO - Trial 60 pruned. 
2026-05-10 22:02:36,823 - optuna.study._optimize - INFO - Trial 61 pruned. 
2026-05-10 22:03:12,041 - optuna.study.study - INFO - Trial 62 finished with value: 0.06673688029321526 and parameters: {'n_layers': 1, 'embedding_dim': 256, 'lr': 0.00019685901976897722, 'lambda_val': 1.5898878640272485e-06, 'batch_size': 3472, 'optimizer': 'Adam'}. Best is trial 10 with value: 0.11877962521025955.
2026-05-10 22:03:47,102 - optuna.study.study - INFO - Trial 63 finished with value: 0.09308856995215829 and parameters: {'n_layers': 1, 'embedding_dim': 256, 'lr': 0.00012413572425922233, 'lambda_val': 1.5030212778368143e-05, 'batch_size': 3293, 'optimizer': 'Adam'}. Best is trial 10 with value: 0.11877962521025955.
2026-05-10 22:03:51,351 - optuna.study._optimize - INFO - Trial 64 pruned. 
2026-05-10 22:04:26,993 - optuna.study.study - INFO - Trial 65 finished with value: 0.08320419233290048 and parameters: {'n_layers': 1, 'embedding_dim': 256, 'lr': 0.00012417193724344075, 'lambda_val': 2.572885054682101e-06, 'batch_size': 2941, 'optimizer': 'Adam'}. Best is trial 10 with value: 0.11877962521025955.
2026-05-10 22:05:01,959 - optuna.study.study - INFO - Trial 66 finished with value: 0.11016825585973972 and parameters: {'n_layers': 1, 'embedding_dim': 256, 'lr': 8.734439163445427e-05, 'lambda_val': 5.304563287335515e-06, 'batch_size': 3678, 'optimizer': 'Adam'}. Best is trial 10 with value: 0.11877962521025955.
2026-05-10 22:05:06,275 - optuna.study._optimize - INFO - Trial 67 pruned. 
2026-05-10 22:05:10,601 - optuna.study._optimize - INFO - Trial 68 pruned. 
2026-05-10 22:05:47,023 - optuna.study.study - INFO - Trial 69 finished with value: 0.08381080047339524 and parameters: {'n_layers': 1, 'embedding_dim': 256, 'lr': 0.0001529384070656171, 'lambda_val': 3.322605543999199e-06, 'batch_size': 3243, 'optimizer': 'Adam'}. Best is trial 10 with value: 0.11877962521025955.
2026-05-10 22:06:22,856 - optuna.study.study - INFO - Trial 70 finished with value: 0.07865278107150848 and parameters: {'n_layers': 1, 'embedding_dim': 256, 'lr': 0.0002649808903689204, 'lambda_val': 4.988858547611169e-05, 'batch_size': 3682, 'optimizer': 'Adam'}. Best is trial 10 with value: 0.11877962521025955.
2026-05-10 22:06:58,042 - optuna.study.study - INFO - Trial 71 finished with value: 0.09759829863021809 and parameters: {'n_layers': 1, 'embedding_dim': 256, 'lr': 9.604755479317316e-05, 'lambda_val': 2.529237579917673e-06, 'batch_size': 3581, 'optimizer': 'Adam'}. Best is trial 10 with value: 0.11877962521025955.
2026-05-10 22:07:03,656 - optuna.study._optimize - INFO - Trial 72 pruned. 
2026-05-10 22:07:07,974 - optuna.study._optimize - INFO - Trial 73 pruned. 
2026-05-10 22:07:45,551 - optuna.study.study - INFO - Trial 74 finished with value: 0.07574313502389768 and parameters: {'n_layers': 1, 'embedding_dim': 256, 'lr': 0.00013215556493191119, 'lambda_val': 1.9584354516237676e-05, 'batch_size': 3615, 'optimizer': 'Adam'}. Best is trial 10 with value: 0.11877962521025955.
2026-05-10 22:07:49,880 - optuna.study._optimize - INFO - Trial 75 pruned. 
2026-05-10 22:07:54,198 - optuna.study._optimize - INFO - Trial 76 pruned. 
2026-05-10 22:07:58,338 - optuna.study._optimize - INFO - Trial 77 pruned. 
2026-05-10 22:08:36,400 - optuna.study.study - INFO - Trial 78 finished with value: 0.06851877273952811 and parameters: {'n_layers': 1, 'embedding_dim': 256, 'lr': 0.0005615477905861939, 'lambda_val': 2.2137005569409477e-06, 'batch_size': 3944, 'optimizer': 'Adam'}. Best is trial 10 with value: 0.11877962521025955.
2026-05-10 22:08:40,494 - optuna.study._optimize - INFO - Trial 79 pruned. 
2026-05-10 22:08:44,756 - optuna.study._optimize - INFO - Trial 80 pruned. 
2026-05-10 22:09:20,354 - optuna.study.study - INFO - Trial 81 finished with value: 0.09771490177171517 and parameters: {'n_layers': 1, 'embedding_dim': 256, 'lr': 0.00010350431634417769, 'lambda_val': 1.4132349601162077e-06, 'batch_size': 3649, 'optimizer': 'Adam'}. Best is trial 10 with value: 0.11877962521025955.
2026-05-10 22:09:55,610 - optuna.study.study - INFO - Trial 82 finished with value: 0.08899939452824045 and parameters: {'n_layers': 1, 'embedding_dim': 256, 'lr': 0.00011585036525370422, 'lambda_val': 1.929186068230353e-06, 'batch_size': 3702, 'optimizer': 'Adam'}. Best is trial 10 with value: 0.11877962521025955.
2026-05-10 22:10:30,890 - optuna.study.study - INFO - Trial 83 finished with value: 0.07418437343067572 and parameters: {'n_layers': 1, 'embedding_dim': 256, 'lr': 0.0001608812538986169, 'lambda_val': 1.2999202593569974e-06, 'batch_size': 3646, 'optimizer': 'Adam'}. Best is trial 10 with value: 0.11877962521025955.
2026-05-10 22:11:08,521 - optuna.study.study - INFO - Trial 84 finished with value: 0.06734033186279698 and parameters: {'n_layers': 1, 'embedding_dim': 256, 'lr': 0.0003127537673396049, 'lambda_val': 3.2001964138374e-06, 'batch_size': 3531, 'optimizer': 'Adam'}. Best is trial 10 with value: 0.11877962521025955.
2026-05-10 22:11:12,827 - optuna.study._optimize - INFO - Trial 85 pruned. 
2026-05-10 22:11:45,589 - optuna.study.study - INFO - Trial 86 finished with value: 0.10645149719769587 and parameters: {'n_layers': 1, 'embedding_dim': 256, 'lr': 9.663657435546003e-05, 'lambda_val': 2.50007533191572e-06, 'batch_size': 3796, 'optimizer': 'Adam'}. Best is trial 10 with value: 0.11877962521025955.
2026-05-10 22:11:49,647 - optuna.study._optimize - INFO - Trial 87 pruned. 
2026-05-10 22:12:24,785 - optuna.study.study - INFO - Trial 88 finished with value: 0.1040927693683255 and parameters: {'n_layers': 1, 'embedding_dim': 256, 'lr': 8.897038872999177e-05, 'lambda_val': 1.0181999901819524e-06, 'batch_size': 3947, 'optimizer': 'Adam'}. Best is trial 10 with value: 0.11877962521025955.
2026-05-10 22:12:28,747 - optuna.study._optimize - INFO - Trial 89 pruned. 
2026-05-10 22:12:32,764 - optuna.study._optimize - INFO - Trial 90 pruned. 
2026-05-10 22:13:08,264 - optuna.study.study - INFO - Trial 91 finished with value: 0.08579765681318952 and parameters: {'n_layers': 1, 'embedding_dim': 256, 'lr': 0.00010506060523392691, 'lambda_val': 1.0314676328096613e-06, 'batch_size': 3826, 'optimizer': 'Adam'}. Best is trial 10 with value: 0.11877962521025955.
2026-05-10 22:13:12,690 - optuna.study._optimize - INFO - Trial 92 pruned. 
2026-05-10 22:13:47,890 - optuna.study.study - INFO - Trial 93 finished with value: 0.07740647507743378 and parameters: {'n_layers': 1, 'embedding_dim': 256, 'lr': 0.00016952048519286168, 'lambda_val': 2.926686385075195e-06, 'batch_size': 3499, 'optimizer': 'Adam'}. Best is trial 10 with value: 0.11877962521025955.
2026-05-10 22:14:23,082 - optuna.study.study - INFO - Trial 94 finished with value: 0.06672542035200604 and parameters: {'n_layers': 1, 'embedding_dim': 256, 'lr': 0.00023882464465706506, 'lambda_val': 4.662826107321215e-06, 'batch_size': 3660, 'optimizer': 'Adam'}. Best is trial 10 with value: 0.11877962521025955.
2026-05-10 22:14:27,519 - optuna.study._optimize - INFO - Trial 95 pruned. 
2026-05-10 22:14:32,212 - optuna.study._optimize - INFO - Trial 96 pruned. 
2026-05-10 22:14:36,682 - optuna.study._optimize - INFO - Trial 97 pruned. 
2026-05-10 22:14:41,130 - optuna.study._optimize - INFO - Trial 98 pruned. 
2026-05-10 22:14:46,794 - optuna.study._optimize - INFO - Trial 99 pruned. 
2026-05-10 22:14:52,736 - optuna.study._optimize - INFO - Trial 100 pruned. 
2026-05-10 22:15:27,001 - optuna.study.study - INFO - Trial 101 finished with value: 0.08320364014434653 and parameters: {'n_layers': 1, 'embedding_dim': 256, 'lr': 0.00014191585913336856, 'lambda_val': 1.3355427945629557e-05, 'batch_size': 3047, 'optimizer': 'Adam'}. Best is trial 10 with value: 0.11877962521025955.
2026-05-10 22:15:31,791 - optuna.study._optimize - INFO - Trial 102 pruned. 
2026-05-10 22:16:12,329 - optuna.study.study - INFO - Trial 103 finished with value: 0.08923107880123463 and parameters: {'n_layers': 1, 'embedding_dim': 256, 'lr': 0.00011934576732205938, 'lambda_val': 3.5668742830819908e-06, 'batch_size': 3472, 'optimizer': 'Adam'}. Best is trial 10 with value: 0.11877962521025955.
2026-05-10 22:16:48,090 - optuna.study.study - INFO - Trial 104 finished with value: 0.06899838619801672 and parameters: {'n_layers': 1, 'embedding_dim': 256, 'lr': 0.00016700670238648356, 'lambda_val': 1.4159015408462413e-06, 'batch_size': 3540, 'optimizer': 'Adam'}. Best is trial 10 with value: 0.11877962521025955.
2026-05-10 22:16:52,430 - optuna.study._optimize - INFO - Trial 105 pruned. 
2026-05-10 22:17:29,060 - optuna.study.study - INFO - Trial 106 finished with value: 0.067182540473658 and parameters: {'n_layers': 1, 'embedding_dim': 256, 'lr': 0.00024745168697389377, 'lambda_val': 2.065068135406903e-06, 'batch_size': 3673, 'optimizer': 'Adam'}. Best is trial 10 with value: 0.11877962521025955.
2026-05-10 22:17:33,923 - optuna.study._optimize - INFO - Trial 107 pruned. 
2026-05-10 22:17:38,550 - optuna.study._optimize - INFO - Trial 108 pruned. 
2026-05-10 22:18:15,468 - optuna.study.study - INFO - Trial 109 finished with value: 0.06763908955057313 and parameters: {'n_layers': 1, 'embedding_dim': 256, 'lr': 0.00021643458275887002, 'lambda_val': 8.021943474773977e-06, 'batch_size': 3587, 'optimizer': 'Adam'}. Best is trial 10 with value: 0.11877962521025955.
2026-05-10 22:18:19,705 - optuna.study._optimize - INFO - Trial 110 pruned. 
2026-05-10 22:18:54,834 - optuna.study.study - INFO - Trial 111 finished with value: 0.08807279708559525 and parameters: {'n_layers': 1, 'embedding_dim': 256, 'lr': 0.00011656194443911112, 'lambda_val': 1.6304552373476516e-06, 'batch_size': 3559, 'optimizer': 'Adam'}. Best is trial 10 with value: 0.11877962521025955.
2026-05-10 22:18:59,232 - optuna.study._optimize - INFO - Trial 112 pruned. 
2026-05-10 22:19:03,527 - optuna.study._optimize - INFO - Trial 113 pruned. 
2026-05-10 22:19:41,661 - optuna.study.study - INFO - Trial 114 finished with value: 0.08699288221790195 and parameters: {'n_layers': 1, 'embedding_dim': 256, 'lr': 0.0001444356467548423, 'lambda_val': 2.4738004770809864e-06, 'batch_size': 3308, 'optimizer': 'Adam'}. Best is trial 10 with value: 0.11877962521025955.
2026-05-10 22:19:45,722 - optuna.study._optimize - INFO - Trial 115 pruned. 
2026-05-10 22:20:14,856 - optuna.study.study - INFO - Trial 116 finished with value: 0.05854535389779672 and parameters: {'n_layers': 1, 'embedding_dim': 96, 'lr': 0.0002986849444709528, 'lambda_val': 3.79682815510604e-06, 'batch_size': 3653, 'optimizer': 'Adam'}. Best is trial 10 with value: 0.11877962521025955.
2026-05-10 22:20:43,151 - optuna.study.study - INFO - Trial 117 finished with value: 0.09108702144676566 and parameters: {'n_layers': 1, 'embedding_dim': 128, 'lr': 0.00019250814287890143, 'lambda_val': 0.00012385772116416092, 'batch_size': 1683, 'optimizer': 'Adam'}. Best is trial 10 with value: 0.11877962521025955.
2026-05-10 22:20:46,673 - optuna.study._optimize - INFO - Trial 118 pruned. 
2026-05-10 22:20:50,488 - optuna.study._optimize - INFO - Trial 119 pruned. 
2026-05-10 22:20:54,225 - optuna.study._optimize - INFO - Trial 120 pruned. 
2026-05-10 22:20:58,161 - optuna.study._optimize - INFO - Trial 121 pruned. 
2026-05-10 22:21:29,773 - optuna.study.study - INFO - Trial 122 finished with value: 0.10838268656188758 and parameters: {'n_layers': 1, 'embedding_dim': 256, 'lr': 0.0001558520854691077, 'lambda_val': 5.164336324886805e-06, 'batch_size': 1457, 'optimizer': 'Adam'}. Best is trial 10 with value: 0.11877962521025955.
2026-05-10 22:22:02,682 - optuna.study.study - INFO - Trial 123 finished with value: 0.09941769345503194 and parameters: {'n_layers': 1, 'embedding_dim': 256, 'lr': 0.00016555649254413628, 'lambda_val': 0.0004938015558154765, 'batch_size': 1630, 'optimizer': 'Adam'}. Best is trial 10 with value: 0.11877962521025955.
2026-05-10 22:22:35,769 - optuna.study.study - INFO - Trial 124 finished with value: 0.11135146337943011 and parameters: {'n_layers': 1, 'embedding_dim': 256, 'lr': 0.0001550259406662833, 'lambda_val': 0.000560566856882668, 'batch_size': 1376, 'optimizer': 'Adam'}. Best is trial 10 with value: 0.11877962521025955.
2026-05-10 22:23:06,266 - optuna.study.study - INFO - Trial 125 finished with value: 0.06409600963492273 and parameters: {'n_layers': 1, 'embedding_dim': 256, 'lr': 0.0004009014823584915, 'lambda_val': 0.00126381639897339, 'batch_size': 1448, 'optimizer': 'Adam'}. Best is trial 10 with value: 0.11877962521025955.
2026-05-10 22:23:38,714 - optuna.study.study - INFO - Trial 126 finished with value: 0.10827877527920725 and parameters: {'n_layers': 1, 'embedding_dim': 256, 'lr': 0.00015653237411105404, 'lambda_val': 0.0008475213614333753, 'batch_size': 1401, 'optimizer': 'Adam'}. Best is trial 10 with value: 0.11877962521025955.
2026-05-10 22:24:11,375 - optuna.study.study - INFO - Trial 127 finished with value: 0.09492287695480785 and parameters: {'n_layers': 1, 'embedding_dim': 256, 'lr': 0.00016206022083614202, 'lambda_val': 0.0005950031397957119, 'batch_size': 1193, 'optimizer': 'RMSprop'}. Best is trial 10 with value: 0.11877962521025955.
2026-05-10 22:24:43,633 - optuna.study.study - INFO - Trial 128 finished with value: 0.10551882235285882 and parameters: {'n_layers': 1, 'embedding_dim': 256, 'lr': 0.00014227963145702373, 'lambda_val': 0.0004167650241474313, 'batch_size': 1376, 'optimizer': 'Adam'}. Best is trial 10 with value: 0.11877962521025955.
2026-05-10 22:25:10,334 - optuna.study.study - INFO - Trial 129 finished with value: 0.0688429295440411 and parameters: {'n_layers': 1, 'embedding_dim': 32, 'lr': 0.0003227151475527264, 'lambda_val': 0.0004849865701678236, 'batch_size': 1334, 'optimizer': 'Adam'}. Best is trial 10 with value: 0.11877962521025955.
2026-05-10 22:25:43,410 - optuna.study.study - INFO - Trial 130 finished with value: 0.09664057655471618 and parameters: {'n_layers': 1, 'embedding_dim': 256, 'lr': 0.00014912093434143084, 'lambda_val': 0.0008173540113239673, 'batch_size': 1385, 'optimizer': 'Adam'}. Best is trial 10 with value: 0.11877962521025955.
2026-05-10 22:26:16,994 - optuna.study.study - INFO - Trial 131 finished with value: 0.0741915393913627 and parameters: {'n_layers': 1, 'embedding_dim': 256, 'lr': 0.00048650415907118, 'lambda_val': 0.00028201847827359074, 'batch_size': 1271, 'optimizer': 'Adam'}. Best is trial 10 with value: 0.11877962521025955.
2026-05-10 22:26:21,187 - optuna.study._optimize - INFO - Trial 132 pruned. 
2026-05-10 22:26:54,065 - optuna.study.study - INFO - Trial 133 finished with value: 0.09780694210838008 and parameters: {'n_layers': 1, 'embedding_dim': 256, 'lr': 0.00013356283196588517, 'lambda_val': 0.0009535341354208268, 'batch_size': 1656, 'optimizer': 'Adam'}. Best is trial 10 with value: 0.11877962521025955.
2026-05-10 22:27:26,999 - optuna.study.study - INFO - Trial 134 finished with value: 0.08218481205619396 and parameters: {'n_layers': 1, 'embedding_dim': 256, 'lr': 0.00026986843980018166, 'lambda_val': 0.0009643891937934806, 'batch_size': 1012, 'optimizer': 'Adam'}. Best is trial 10 with value: 0.11877962521025955.
2026-05-10 22:28:00,895 - optuna.study.study - INFO - Trial 135 finished with value: 0.0760303121444088 and parameters: {'n_layers': 1, 'embedding_dim': 256, 'lr': 0.00017721508911734338, 'lambda_val': 0.0005059602393239781, 'batch_size': 1608, 'optimizer': 'Adam'}. Best is trial 10 with value: 0.11877962521025955.
2026-05-10 22:28:33,223 - optuna.study.study - INFO - Trial 136 finished with value: 0.07513011381072168 and parameters: {'n_layers': 1, 'embedding_dim': 256, 'lr': 0.00022184697499902682, 'lambda_val': 0.0006436468109231623, 'batch_size': 1489, 'optimizer': 'Adam'}. Best is trial 10 with value: 0.11877962521025955.
2026-05-10 22:29:03,645 - optuna.study.study - INFO - Trial 137 finished with value: 0.10785515718560129 and parameters: {'n_layers': 1, 'embedding_dim': 256, 'lr': 0.00012727337844600268, 'lambda_val': 0.0003769475492150807, 'batch_size': 1758, 'optimizer': 'Adam'}. Best is trial 10 with value: 0.11877962521025955.
2026-05-10 22:29:35,938 - optuna.study.study - INFO - Trial 138 finished with value: 0.09857024698123928 and parameters: {'n_layers': 1, 'embedding_dim': 256, 'lr': 0.00014541056482689715, 'lambda_val': 0.0009908929276109017, 'batch_size': 1748, 'optimizer': 'Adam'}. Best is trial 10 with value: 0.11877962521025955.
2026-05-10 22:30:08,874 - optuna.study.study - INFO - Trial 139 finished with value: 0.08502185448761049 and parameters: {'n_layers': 1, 'embedding_dim': 256, 'lr': 0.00014752870811589224, 'lambda_val': 0.0003873139381124706, 'batch_size': 1759, 'optimizer': 'RMSprop'}. Best is trial 10 with value: 0.11877962521025955.
2026-05-10 22:30:12,668 - optuna.study._optimize - INFO - Trial 140 pruned. 
2026-05-10 22:30:16,885 - optuna.study._optimize - INFO - Trial 141 pruned. 
2026-05-10 22:30:50,509 - optuna.study.study - INFO - Trial 142 finished with value: 0.06822104157245934 and parameters: {'n_layers': 1, 'embedding_dim': 256, 'lr': 0.00020608557892499207, 'lambda_val': 0.0020596966056685324, 'batch_size': 1698, 'optimizer': 'Adam'}. Best is trial 10 with value: 0.11877962521025955.
2026-05-10 22:30:54,739 - optuna.study._optimize - INFO - Trial 143 pruned. 
2026-05-10 22:31:28,520 - optuna.study.study - INFO - Trial 144 finished with value: 0.08786958008307973 and parameters: {'n_layers': 1, 'embedding_dim': 256, 'lr': 0.00016352024086664258, 'lambda_val': 0.0008107131571031299, 'batch_size': 1585, 'optimizer': 'Adam'}. Best is trial 10 with value: 0.11877962521025955.
2026-05-10 22:31:32,702 - optuna.study._optimize - INFO - Trial 145 pruned. 
2026-05-10 22:31:36,853 - optuna.study._optimize - INFO - Trial 146 pruned. 
2026-05-10 22:31:40,874 - optuna.study._optimize - INFO - Trial 147 pruned. 
2026-05-10 22:31:45,132 - optuna.study._optimize - INFO - Trial 148 pruned. 
2026-05-10 22:32:13,477 - optuna.study.study - INFO - Trial 149 finished with value: 0.07996096458305657 and parameters: {'n_layers': 1, 'embedding_dim': 96, 'lr': 0.00022647285720331153, 'lambda_val': 0.0005227748918277097, 'batch_size': 1374, 'optimizer': 'Adam'}. Best is trial 10 with value: 0.11877962521025955.
2026-05-10 22:32:17,840 - optuna.study._optimize - INFO - Trial 150 pruned. 
2026-05-10 22:32:22,377 - optuna.study._optimize - INFO - Trial 151 pruned. 
2026-05-10 22:32:26,693 - optuna.study._optimize - INFO - Trial 152 pruned. 
2026-05-10 22:32:59,428 - optuna.study.study - INFO - Trial 153 finished with value: 0.09730086530114661 and parameters: {'n_layers': 1, 'embedding_dim': 256, 'lr': 0.00018392550043051654, 'lambda_val': 0.00037716887424852074, 'batch_size': 1330, 'optimizer': 'Adam'}. Best is trial 10 with value: 0.11877962521025955.
2026-05-10 22:33:04,541 - optuna.study._optimize - INFO - Trial 154 pruned. 
2026-05-10 22:33:08,647 - optuna.study._optimize - INFO - Trial 155 pruned. 
2026-05-10 22:33:12,903 - optuna.study._optimize - INFO - Trial 156 pruned. 
2026-05-10 22:33:17,169 - optuna.study._optimize - INFO - Trial 157 pruned. 
2026-05-10 22:33:21,005 - optuna.study._optimize - INFO - Trial 158 pruned. 
2026-05-10 22:33:25,782 - optuna.study._optimize - INFO - Trial 159 pruned. 
2026-05-10 22:33:58,786 - optuna.study.study - INFO - Trial 160 finished with value: 0.09637206421708089 and parameters: {'n_layers': 1, 'embedding_dim': 256, 'lr': 0.00018184414100875148, 'lambda_val': 0.00042994099282378317, 'batch_size': 1111, 'optimizer': 'Adam'}. Best is trial 10 with value: 0.11877962521025955.
2026-05-10 22:34:02,981 - optuna.study._optimize - INFO - Trial 161 pruned. 
2026-05-10 22:34:07,800 - optuna.study._optimize - INFO - Trial 162 pruned. 
