2026-05-10 20:23:24,876 - optuna.study.study - INFO - Trial 105 finished with value: 0.0733399537992203 and parameters: {'n_layers': 1, 'embedding_dim': 256, 'lr': 0.0001703472135053177, 'lambda_val': 6.792114945157293e-05, 'batch_size': 3636, 'optimizer': 'RMSprop'}. Best is trial 51 with value: 0.13024395514313283.
2026-05-10 20:23:29,200 - optuna.study._optimize - INFO - Trial 106 pruned. 
2026-05-10 20:24:05,230 - optuna.study.study - INFO - Trial 107 finished with value: 0.07373761700084226 and parameters: {'n_layers': 1, 'embedding_dim': 256, 'lr': 0.00021934516852230418, 'lambda_val': 8.208592604435555e-06, 'batch_size': 3849, 'optimizer': 'RMSprop'}. Best is trial 51 with value: 0.13024395514313283.
2026-05-10 20:24:09,798 - optuna.study._optimize - INFO - Trial 108 pruned. 
2026-05-10 20:24:45,438 - optuna.study.study - INFO - Trial 109 finished with value: 0.08200685249906953 and parameters: {'n_layers': 1, 'embedding_dim': 256, 'lr': 0.00026225001504204097, 'lambda_val': 1.4213596985108123e-05, 'batch_size': 3688, 'optimizer': 'RMSprop'}. Best is trial 51 with value: 0.13024395514313283.
2026-05-10 20:24:50,061 - optuna.study._optimize - INFO - Trial 110 pruned. 
2026-05-10 20:24:54,550 - optuna.study._optimize - INFO - Trial 111 pruned. 
2026-05-10 20:24:59,169 - optuna.study._optimize - INFO - Trial 112 pruned. 
2026-05-10 20:25:03,836 - optuna.study._optimize - INFO - Trial 113 pruned. 
2026-05-10 20:25:07,720 - optuna.study._optimize - INFO - Trial 114 pruned. 
2026-05-10 20:25:11,601 - optuna.study._optimize - INFO - Trial 115 pruned. 
2026-05-10 20:25:15,418 - optuna.study._optimize - INFO - Trial 116 pruned. 
2026-05-10 20:25:49,293 - optuna.study.study - INFO - Trial 117 finished with value: 0.06396646695859513 and parameters: {'n_layers': 1, 'embedding_dim': 256, 'lr': 0.0011362599507973418, 'lambda_val': 1.1510797504254236e-05, 'batch_size': 2182, 'optimizer': 'RMSprop'}. Best is trial 51 with value: 0.13024395514313283.
2026-05-10 20:26:21,214 - optuna.study.study - INFO - Trial 118 finished with value: 0.07314976833730233 and parameters: {'n_layers': 1, 'embedding_dim': 128, 'lr': 0.00017502221928741211, 'lambda_val': 2.0558669262010423e-05, 'batch_size': 3990, 'optimizer': 'RMSprop'}. Best is trial 51 with value: 0.13024395514313283.
2026-05-10 20:26:25,925 - optuna.study._optimize - INFO - Trial 119 pruned. 
2026-05-10 20:26:30,088 - optuna.study._optimize - INFO - Trial 120 pruned. 
2026-05-10 20:27:00,765 - optuna.study.study - INFO - Trial 121 finished with value: 0.09293935819273068 and parameters: {'n_layers': 1, 'embedding_dim': 128, 'lr': 0.00976557314413124, 'lambda_val': 0.0017712261171256868, 'batch_size': 3553, 'optimizer': 'RMSprop'}. Best is trial 51 with value: 0.13024395514313283.
2026-05-10 20:27:31,288 - optuna.study.study - INFO - Trial 122 finished with value: 0.09265831203471965 and parameters: {'n_layers': 1, 'embedding_dim': 128, 'lr': 0.019434318296652785, 'lambda_val': 0.0011307343869043204, 'batch_size': 3338, 'optimizer': 'RMSprop'}. Best is trial 51 with value: 0.13024395514313283.
2026-05-10 20:27:36,847 - optuna.study._optimize - INFO - Trial 123 pruned. 
2026-05-10 20:27:40,609 - optuna.study._optimize - INFO - Trial 124 pruned. 
2026-05-10 20:28:12,039 - optuna.study.study - INFO - Trial 125 finished with value: 0.09056842796332089 and parameters: {'n_layers': 1, 'embedding_dim': 128, 'lr': 0.00962700903847254, 'lambda_val': 0.0023482839287235937, 'batch_size': 3709, 'optimizer': 'RMSprop'}. Best is trial 51 with value: 0.13024395514313283.
2026-05-10 20:28:15,612 - optuna.study._optimize - INFO - Trial 126 pruned. 
2026-05-10 20:28:45,804 - optuna.study.study - INFO - Trial 127 finished with value: 0.0823215060868229 and parameters: {'n_layers': 1, 'embedding_dim': 128, 'lr': 0.00011983931418458453, 'lambda_val': 0.001118795384525077, 'batch_size': 3623, 'optimizer': 'RMSprop'}. Best is trial 51 with value: 0.13024395514313283.
2026-05-10 20:29:21,899 - optuna.study.study - INFO - Trial 128 finished with value: 0.0812451610378847 and parameters: {'n_layers': 1, 'embedding_dim': 256, 'lr': 0.00014638737109978382, 'lambda_val': 0.0006397684705005238, 'batch_size': 3411, 'optimizer': 'RMSprop'}. Best is trial 51 with value: 0.13024395514313283.
2026-05-10 20:29:27,019 - optuna.study._optimize - INFO - Trial 129 pruned. 
2026-05-10 20:29:30,847 - optuna.study._optimize - INFO - Trial 130 pruned. 
2026-05-10 20:29:34,631 - optuna.study._optimize - INFO - Trial 131 pruned. 
2026-05-10 20:29:38,515 - optuna.study._optimize - INFO - Trial 132 pruned. 
2026-05-10 20:29:43,279 - optuna.study._optimize - INFO - Trial 133 pruned. 
2026-05-10 20:29:47,246 - optuna.study._optimize - INFO - Trial 134 pruned. 
2026-05-10 20:29:58,753 - optuna.study._optimize - INFO - Trial 135 pruned. 
2026-05-10 20:30:02,769 - optuna.study._optimize - INFO - Trial 136 pruned. 
2026-05-10 20:30:06,653 - optuna.study._optimize - INFO - Trial 137 pruned. 
2026-05-10 20:30:10,515 - optuna.study._optimize - INFO - Trial 138 pruned. 
2026-05-10 20:30:45,821 - optuna.study.study - INFO - Trial 139 finished with value: 0.07656329057567314 and parameters: {'n_layers': 1, 'embedding_dim': 256, 'lr': 0.00010807542806193094, 'lambda_val': 0.0006921308821687152, 'batch_size': 3637, 'optimizer': 'RMSprop'}. Best is trial 51 with value: 0.13024395514313283.
2026-05-10 20:30:49,725 - optuna.study._optimize - INFO - Trial 140 pruned. 
2026-05-10 20:31:21,236 - optuna.study.study - INFO - Trial 141 finished with value: 0.09004656461009132 and parameters: {'n_layers': 1, 'embedding_dim': 128, 'lr': 0.01056915351632239, 'lambda_val': 0.002279360697589887, 'batch_size': 3679, 'optimizer': 'RMSprop'}. Best is trial 51 with value: 0.13024395514313283.
2026-05-10 20:31:51,816 - optuna.study.study - INFO - Trial 142 finished with value: 0.09053508622896618 and parameters: {'n_layers': 1, 'embedding_dim': 128, 'lr': 0.00976509026911487, 'lambda_val': 0.002524807556084663, 'batch_size': 3743, 'optimizer': 'RMSprop'}. Best is trial 51 with value: 0.13024395514313283.
2026-05-10 20:32:22,545 - optuna.study.study - INFO - Trial 143 finished with value: 0.09378636468540738 and parameters: {'n_layers': 1, 'embedding_dim': 128, 'lr': 0.008569876456703575, 'lambda_val': 0.001334578319712535, 'batch_size': 3706, 'optimizer': 'RMSprop'}. Best is trial 51 with value: 0.13024395514313283.
2026-05-10 20:32:52,714 - optuna.study.study - INFO - Trial 144 finished with value: 0.09377738980390642 and parameters: {'n_layers': 1, 'embedding_dim': 128, 'lr': 0.006492696430763853, 'lambda_val': 0.0016358546153349461, 'batch_size': 3801, 'optimizer': 'RMSprop'}. Best is trial 51 with value: 0.13024395514313283.
2026-05-10 20:32:56,838 - optuna.study._optimize - INFO - Trial 145 pruned. 
2026-05-10 20:33:27,909 - optuna.study.study - INFO - Trial 146 finished with value: 0.08784931971846156 and parameters: {'n_layers': 1, 'embedding_dim': 128, 'lr': 0.008247322487618423, 'lambda_val': 0.0018006323757501158, 'batch_size': 3536, 'optimizer': 'RMSprop'}. Best is trial 51 with value: 0.13024395514313283.
2026-05-10 20:34:04,503 - optuna.study.study - INFO - Trial 147 finished with value: 0.08686679895733698 and parameters: {'n_layers': 1, 'embedding_dim': 256, 'lr': 0.003945473473215787, 'lambda_val': 0.001121003883804608, 'batch_size': 3884, 'optimizer': 'Adam'}. Best is trial 51 with value: 0.13024395514313283.
2026-05-10 20:34:08,672 - optuna.study._optimize - INFO - Trial 148 pruned. 
2026-05-10 20:34:39,765 - optuna.study.study - INFO - Trial 149 finished with value: 0.051801107097906224 and parameters: {'n_layers': 1, 'embedding_dim': 128, 'lr': 0.00020028328944923714, 'lambda_val': 0.0033844894738723334, 'batch_size': 3619, 'optimizer': 'RMSprop'}. Best is trial 51 with value: 0.13024395514313283.
2026-05-10 20:34:43,999 - optuna.study._optimize - INFO - Trial 150 pruned. 
2026-05-10 20:34:48,424 - optuna.study._optimize - INFO - Trial 151 pruned. 
2026-05-10 20:35:17,520 - optuna.study.study - INFO - Trial 152 finished with value: 0.05718813269642211 and parameters: {'n_layers': 1, 'embedding_dim': 128, 'lr': 0.0007023086656985633, 'lambda_val': 0.0005299764215885661, 'batch_size': 1775, 'optimizer': 'RMSprop'}. Best is trial 51 with value: 0.13024395514313283.
2026-05-10 20:35:49,160 - optuna.study.study - INFO - Trial 153 finished with value: 0.06888451343138753 and parameters: {'n_layers': 1, 'embedding_dim': 128, 'lr': 0.00014878908357124964, 'lambda_val': 0.000773351620235939, 'batch_size': 3712, 'optimizer': 'RMSprop'}. Best is trial 51 with value: 0.13024395514313283.
2026-05-10 20:35:53,323 - optuna.study._optimize - INFO - Trial 154 pruned. 
2026-05-10 20:35:58,998 - optuna.study._optimize - INFO - Trial 155 pruned. 
2026-05-10 20:36:02,664 - optuna.study._optimize - INFO - Trial 156 pruned. 
2026-05-10 20:36:06,751 - optuna.study._optimize - INFO - Trial 157 pruned. 
2026-05-10 20:36:11,103 - optuna.study._optimize - INFO - Trial 158 pruned. 
2026-05-10 20:36:14,869 - optuna.study._optimize - INFO - Trial 159 pruned. 
2026-05-10 20:36:19,280 - optuna.study._optimize - INFO - Trial 160 pruned. 
2026-05-10 20:36:50,494 - optuna.study.study - INFO - Trial 161 finished with value: 0.09017042886809663 and parameters: {'n_layers': 1, 'embedding_dim': 128, 'lr': 0.009020219798987247, 'lambda_val': 0.0023761449732477885, 'batch_size': 3716, 'optimizer': 'RMSprop'}. Best is trial 51 with value: 0.13024395514313283.
2026-05-10 20:36:54,446 - optuna.study._optimize - INFO - Trial 162 pruned. 
2026-05-10 20:36:58,722 - optuna.study._optimize - INFO - Trial 163 pruned. 
2026-05-10 20:37:03,158 - optuna.study._optimize - INFO - Trial 164 pruned. 
2026-05-10 20:37:07,777 - optuna.study._optimize - INFO - Trial 165 pruned. 
2026-05-10 20:37:12,704 - optuna.study._optimize - INFO - Trial 166 pruned. 
2026-05-10 20:37:16,117 - optuna.study._optimize - INFO - Trial 167 pruned. 
2026-05-10 20:37:20,802 - optuna.study._optimize - INFO - Trial 168 pruned. 
2026-05-10 20:37:50,538 - optuna.study.study - INFO - Trial 169 finished with value: 0.05152546855115491 and parameters: {'n_layers': 1, 'embedding_dim': 64, 'lr': 0.000260251636565241, 'lambda_val': 0.0008342239413743532, 'batch_size': 2560, 'optimizer': 'RMSprop'}. Best is trial 51 with value: 0.13024395514313283.
2026-05-10 20:37:55,303 - optuna.study._optimize - INFO - Trial 170 pruned. 
2026-05-10 20:38:25,994 - optuna.study.study - INFO - Trial 171 finished with value: 0.09487039272661917 and parameters: {'n_layers': 1, 'embedding_dim': 128, 'lr': 0.009466408994610738, 'lambda_val': 0.003071366387269306, 'batch_size': 3705, 'optimizer': 'RMSprop'}. Best is trial 51 with value: 0.13024395514313283.
2026-05-10 20:38:30,035 - optuna.study._optimize - INFO - Trial 172 pruned. 
2026-05-10 20:38:34,049 - optuna.study._optimize - INFO - Trial 173 pruned. 
2026-05-10 20:39:05,226 - optuna.study.study - INFO - Trial 174 finished with value: 0.0642137874426421 and parameters: {'n_layers': 1, 'embedding_dim': 128, 'lr': 0.0001409304208009097, 'lambda_val': 0.0022279095727386045, 'batch_size': 3622, 'optimizer': 'RMSprop'}. Best is trial 51 with value: 0.13024395514313283.
2026-05-10 20:39:10,576 - optuna.study._optimize - INFO - Trial 175 pruned. 
2026-05-10 20:39:14,386 - optuna.study._optimize - INFO - Trial 176 pruned. 
2026-05-10 20:39:18,646 - optuna.study._optimize - INFO - Trial 177 pruned. 
2026-05-10 20:39:24,360 - optuna.study._optimize - INFO - Trial 178 pruned. 
2026-05-10 20:39:29,136 - optuna.study._optimize - INFO - Trial 179 pruned. 
2026-05-10 20:39:34,465 - optuna.study._optimize - INFO - Trial 180 pruned. 
2026-05-10 20:39:38,662 - optuna.study._optimize - INFO - Trial 181 pruned. 
2026-05-10 20:39:44,070 - optuna.study._optimize - INFO - Trial 182 pruned. 
2026-05-10 20:40:14,776 - optuna.study.study - INFO - Trial 183 finished with value: 0.08734439983023064 and parameters: {'n_layers': 1, 'embedding_dim': 128, 'lr': 0.009671273372068028, 'lambda_val': 0.0017963829401388257, 'batch_size': 3652, 'optimizer': 'RMSprop'}. Best is trial 51 with value: 0.13024395514313283.
2026-05-10 20:40:18,850 - optuna.study._optimize - INFO - Trial 184 pruned. 
2026-05-10 20:40:22,639 - optuna.study._optimize - INFO - Trial 185 pruned. 
2026-05-10 20:40:26,902 - optuna.study._optimize - INFO - Trial 186 pruned. 
2026-05-10 20:40:31,508 - optuna.study._optimize - INFO - Trial 187 pruned. 
2026-05-10 20:40:35,462 - optuna.study._optimize - INFO - Trial 188 pruned. 
2026-05-10 20:40:39,825 - optuna.study._optimize - INFO - Trial 189 pruned. 
2026-05-10 20:40:43,680 - optuna.study._optimize - INFO - Trial 190 pruned. 
2026-05-10 20:41:15,069 - optuna.study.study - INFO - Trial 191 finished with value: 0.09205500165765551 and parameters: {'n_layers': 1, 'embedding_dim': 128, 'lr': 0.01227827268130022, 'lambda_val': 0.0017666910838313897, 'batch_size': 3595, 'optimizer': 'RMSprop'}. Best is trial 51 with value: 0.13024395514313283.
2026-05-10 20:41:20,027 - optuna.study._optimize - INFO - Trial 192 pruned. 
2026-05-10 20:41:50,752 - optuna.study.study - INFO - Trial 193 finished with value: 0.08893393117793329 and parameters: {'n_layers': 1, 'embedding_dim': 128, 'lr': 0.015246187313641583, 'lambda_val': 0.0013905228552306542, 'batch_size': 3759, 'optimizer': 'RMSprop'}. Best is trial 51 with value: 0.13024395514313283.
2026-05-10 20:41:54,859 - optuna.study._optimize - INFO - Trial 194 pruned. 
2026-05-10 20:42:25,487 - optuna.study.study - INFO - Trial 195 finished with value: 0.09580266682506598 and parameters: {'n_layers': 1, 'embedding_dim': 128, 'lr': 0.012388483875303022, 'lambda_val': 0.0017723316275821005, 'batch_size': 3424, 'optimizer': 'RMSprop'}. Best is trial 51 with value: 0.13024395514313283.
2026-05-10 20:42:29,366 - optuna.study._optimize - INFO - Trial 196 pruned. 
2026-05-10 20:42:33,221 - optuna.study._optimize - INFO - Trial 197 pruned. 
2026-05-10 20:42:37,411 - optuna.study._optimize - INFO - Trial 198 pruned. 
2026-05-10 20:42:41,551 - optuna.study._optimize - INFO - Trial 199 pruned. 
2026-05-10 20:43:03,237 - root - INFO - **** Training e_100K_1c1dcs
2026-05-10 20:43:03,237 - root - INFO -   ** 1-Dominant stats:
2026-05-10 20:43:03,237 - root - INFO -   ** Finding the dominant set:
2026-05-10 20:43:18,822 - root - INFO -   ** Getting the trainable edges:
2026-05-10 20:43:18,826 - helper_functions - INFO -      Number of nodes: 547
2026-05-10 20:43:18,827 - helper_functions - INFO -      Ratio: 0.06036861273590111
2026-05-10 20:43:18,827 - helper_functions - INFO -      Number of unique users: 320
2026-05-10 20:43:18,827 - helper_functions - INFO -      Number of unique items: 227
2026-05-10 20:43:18,827 - helper_functions - INFO -      Total dominant set edge: 66391
2026-05-10 20:43:18,827 - helper_functions - INFO -      Trainable edges: 53112.8
2026-05-10 20:43:18,834 - root - INFO -   **** Getting 66391 dominant set edges
2026-05-10 20:43:19,956 - optuna.storages._rdb.storage - INFO - A new study created in RDB with name: Study_e_100K_1c1dcs
2026-05-10 20:43:45,034 - optuna.study.study - INFO - Trial 0 finished with value: 0.06209446019819848 and parameters: {'n_layers': 1, 'embedding_dim': 64, 'lr': 0.011900029982085952, 'lambda_val': 0.0012618455191802957, 'batch_size': 1006, 'optimizer': 'RMSprop'}. Best is trial 0 with value: 0.06209446019819848.
2026-05-10 20:44:40,892 - optuna.study.study - INFO - Trial 1 finished with value: 0.006872856450225325 and parameters: {'n_layers': 4, 'embedding_dim': 32, 'lr': 1.2643468968831034e-05, 'lambda_val': 0.0049514679559862634, 'batch_size': 2470, 'optimizer': 'Adam'}. Best is trial 0 with value: 0.06209446019819848.
2026-05-10 20:45:08,152 - optuna.study.study - INFO - Trial 2 finished with value: 0.05838878457734272 and parameters: {'n_layers': 1, 'embedding_dim': 32, 'lr': 0.00012205999809946114, 'lambda_val': 0.00028336086918584745, 'batch_size': 3577, 'optimizer': 'RMSprop'}. Best is trial 0 with value: 0.06209446019819848.
2026-05-10 20:45:45,712 - optuna.study.study - INFO - Trial 3 finished with value: 0.0020227849421708844 and parameters: {'n_layers': 4, 'embedding_dim': 64, 'lr': 0.004728972966097268, 'lambda_val': 0.014344342549743712, 'batch_size': 919, 'optimizer': 'SGD'}. Best is trial 0 with value: 0.06209446019819848.
2026-05-10 20:46:32,775 - optuna.study.study - INFO - Trial 4 finished with value: 0.015929651612742252 and parameters: {'n_layers': 4, 'embedding_dim': 128, 'lr': 0.00033720023474889633, 'lambda_val': 2.046193190839918e-06, 'batch_size': 2680, 'optimizer': 'RMSprop'}. Best is trial 0 with value: 0.06209446019819848.
2026-05-10 20:46:37,628 - optuna.study._optimize - INFO - Trial 5 pruned. 
2026-05-10 20:47:16,917 - optuna.study.study - INFO - Trial 6 finished with value: 0.024044287120222524 and parameters: {'n_layers': 2, 'embedding_dim': 128, 'lr': 0.002097698916657254, 'lambda_val': 7.116981569478489e-05, 'batch_size': 2256, 'optimizer': 'RMSprop'}. Best is trial 0 with value: 0.06209446019819848.
2026-05-10 20:48:28,468 - optuna.study.study - INFO - Trial 7 finished with value: 0.026570749916884764 and parameters: {'n_layers': 4, 'embedding_dim': 256, 'lr': 0.02667927829101619, 'lambda_val': 1.1825681089196892e-06, 'batch_size': 1852, 'optimizer': 'Adam'}. Best is trial 0 with value: 0.06209446019819848.
2026-05-10 20:48:33,566 - optuna.study._optimize - INFO - Trial 8 pruned. 
2026-05-10 20:48:37,796 - optuna.study._optimize - INFO - Trial 9 pruned. 
2026-05-10 20:48:41,286 - optuna.study._optimize - INFO - Trial 10 pruned. 
2026-05-10 20:49:09,395 - optuna.study.study - INFO - Trial 11 finished with value: 0.04793609809499547 and parameters: {'n_layers': 1, 'embedding_dim': 32, 'lr': 0.00018054698108330345, 'lambda_val': 0.0007419005868606407, 'batch_size': 3843, 'optimizer': 'RMSprop'}. Best is trial 0 with value: 0.06209446019819848.
2026-05-10 20:49:39,531 - optuna.study.study - INFO - Trial 12 finished with value: 0.04458950731141896 and parameters: {'n_layers': 1, 'embedding_dim': 32, 'lr': 0.00013758030765441883, 'lambda_val': 5.078769295686496e-05, 'batch_size': 4033, 'optimizer': 'RMSprop'}. Best is trial 0 with value: 0.06209446019819848.
2026-05-10 20:49:44,778 - optuna.study._optimize - INFO - Trial 13 pruned. 
2026-05-10 20:49:49,237 - optuna.study._optimize - INFO - Trial 14 pruned. 
2026-05-10 20:50:22,822 - optuna.study.study - INFO - Trial 15 finished with value: 0.051681381242446756 and parameters: {'n_layers': 3, 'embedding_dim': 64, 'lr': 9.97123162827033e-05, 'lambda_val': 0.0017974936670748906, 'batch_size': 1339, 'optimizer': 'RMSprop'}. Best is trial 0 with value: 0.06209446019819848.
2026-05-10 20:50:26,375 - optuna.study._optimize - INFO - Trial 16 pruned. 
2026-05-10 20:50:29,634 - optuna.study._optimize - INFO - Trial 17 pruned. 
2026-05-10 20:50:33,184 - optuna.study._optimize - INFO - Trial 18 pruned. 
2026-05-10 20:50:39,544 - optuna.study._optimize - INFO - Trial 19 pruned. 
2026-05-10 20:51:20,346 - optuna.study.study - INFO - Trial 20 finished with value: 0.029417265337691536 and parameters: {'n_layers': 2, 'embedding_dim': 256, 'lr': 0.0004348922336996783, 'lambda_val': 0.001447068089424727, 'batch_size': 584, 'optimizer': 'RMSprop'}. Best is trial 0 with value: 0.06209446019819848.
2026-05-10 20:51:24,619 - optuna.study._optimize - INFO - Trial 21 pruned. 
2026-05-10 20:51:28,776 - optuna.study._optimize - INFO - Trial 22 pruned. 
2026-05-10 20:52:02,142 - optuna.study.study - INFO - Trial 23 finished with value: 0.01289228002297908 and parameters: {'n_layers': 3, 'embedding_dim': 64, 'lr': 0.00017775645577162758, 'lambda_val': 0.011706691487563831, 'batch_size': 1596, 'optimizer': 'RMSprop'}. Best is trial 0 with value: 0.06209446019819848.
2026-05-10 20:52:29,505 - optuna.study.study - INFO - Trial 24 finished with value: 0.061473437633040834 and parameters: {'n_layers': 2, 'embedding_dim': 64, 'lr': 0.00011737930218709977, 'lambda_val': 0.0010875352402410661, 'batch_size': 890, 'optimizer': 'RMSprop'}. Best is trial 0 with value: 0.06209446019819848.
2026-05-10 20:52:55,581 - optuna.study.study - INFO - Trial 25 finished with value: 0.03379602620173937 and parameters: {'n_layers': 1, 'embedding_dim': 32, 'lr': 0.0018696800066198664, 'lambda_val': 0.00010886253052808976, 'batch_size': 876, 'optimizer': 'RMSprop'}. Best is trial 0 with value: 0.06209446019819848.
2026-05-10 20:52:59,451 - optuna.study._optimize - INFO - Trial 26 pruned. 
2026-05-10 20:53:26,384 - optuna.study.study - INFO - Trial 27 finished with value: 0.0552197843218103 and parameters: {'n_layers': 1, 'embedding_dim': 64, 'lr': 0.00043057487192738216, 'lambda_val': 0.0043247282287356675, 'batch_size': 895, 'optimizer': 'RMSprop'}. Best is trial 0 with value: 0.06209446019819848.
2026-05-10 20:53:30,005 - optuna.study._optimize - INFO - Trial 28 pruned. 
2026-05-10 20:53:34,472 - optuna.study._optimize - INFO - Trial 29 pruned. 
2026-05-10 20:54:08,745 - optuna.study.study - INFO - Trial 30 finished with value: 0.018139543154564987 and parameters: {'n_layers': 2, 'embedding_dim': 96, 'lr': 0.001239987702344024, 'lambda_val': 1.3304771262459214e-05, 'batch_size': 2944, 'optimizer': 'Adam'}. Best is trial 0 with value: 0.06209446019819848.
2026-05-10 20:54:33,554 - optuna.study.study - INFO - Trial 31 finished with value: 0.04777670344219618 and parameters: {'n_layers': 1, 'embedding_dim': 64, 'lr': 0.0004329859761192307, 'lambda_val': 0.004303052387582795, 'batch_size': 835, 'optimizer': 'RMSprop'}. Best is trial 0 with value: 0.06209446019819848.
2026-05-10 20:54:37,253 - optuna.study._optimize - INFO - Trial 32 pruned. 
2026-05-10 20:54:40,405 - optuna.study._optimize - INFO - Trial 33 pruned. 
