2026-05-10 21:26:23,792 - optuna.study.study - INFO - Trial 141 finished with value: 0.07748678979036445 and parameters: {'n_layers': 1, 'embedding_dim': 128, 'lr': 0.00023008475098445906, 'lambda_val': 1.533046364055729e-05, 'batch_size': 728, 'optimizer': 'RMSprop'}. Best is trial 122 with value: 0.09755622333039767.
2026-05-10 21:26:27,647 - optuna.study._optimize - INFO - Trial 142 pruned. 
2026-05-10 21:26:57,523 - optuna.study.study - INFO - Trial 143 finished with value: 0.08955173469899574 and parameters: {'n_layers': 1, 'embedding_dim': 128, 'lr': 0.0002484905172138813, 'lambda_val': 1.505402514452543e-05, 'batch_size': 598, 'optimizer': 'RMSprop'}. Best is trial 122 with value: 0.09755622333039767.
2026-05-10 21:27:26,245 - optuna.study.study - INFO - Trial 144 finished with value: 0.07212078401853818 and parameters: {'n_layers': 1, 'embedding_dim': 128, 'lr': 0.0004984012604660783, 'lambda_val': 1.3461552192704976e-05, 'batch_size': 598, 'optimizer': 'RMSprop'}. Best is trial 122 with value: 0.09755622333039767.
2026-05-10 21:27:55,726 - optuna.study.study - INFO - Trial 145 finished with value: 0.08148067812154493 and parameters: {'n_layers': 1, 'embedding_dim': 128, 'lr': 0.0002818038796551601, 'lambda_val': 2.0792055927203935e-05, 'batch_size': 797, 'optimizer': 'RMSprop'}. Best is trial 122 with value: 0.09755622333039767.
2026-05-10 21:28:00,509 - optuna.study._optimize - INFO - Trial 146 pruned. 
2026-05-10 21:28:04,420 - optuna.study._optimize - INFO - Trial 147 pruned. 
2026-05-10 21:28:33,180 - optuna.study.study - INFO - Trial 148 finished with value: 0.09060891129551299 and parameters: {'n_layers': 1, 'embedding_dim': 128, 'lr': 0.0002358625145526133, 'lambda_val': 7.547728121734526e-06, 'batch_size': 657, 'optimizer': 'RMSprop'}. Best is trial 122 with value: 0.09755622333039767.
2026-05-10 21:28:38,549 - optuna.study._optimize - INFO - Trial 149 pruned. 
2026-05-10 21:28:42,361 - optuna.study._optimize - INFO - Trial 150 pruned. 
2026-05-10 21:28:46,193 - optuna.study._optimize - INFO - Trial 151 pruned. 
2026-05-10 21:29:15,315 - optuna.study.study - INFO - Trial 152 finished with value: 0.09806993337181102 and parameters: {'n_layers': 1, 'embedding_dim': 128, 'lr': 0.00024490472384777333, 'lambda_val': 1.242432707411273e-05, 'batch_size': 959, 'optimizer': 'RMSprop'}. Best is trial 152 with value: 0.09806993337181102.
2026-05-10 21:29:19,293 - optuna.study._optimize - INFO - Trial 153 pruned. 
2026-05-10 21:29:48,101 - optuna.study.study - INFO - Trial 154 finished with value: 0.07248016218414499 and parameters: {'n_layers': 1, 'embedding_dim': 128, 'lr': 0.0004166554858794985, 'lambda_val': 4.861501959454442e-06, 'batch_size': 789, 'optimizer': 'RMSprop'}. Best is trial 152 with value: 0.09806993337181102.
2026-05-10 21:30:16,924 - optuna.study.study - INFO - Trial 155 finished with value: 0.07534846465318983 and parameters: {'n_layers': 1, 'embedding_dim': 128, 'lr': 0.00023059365571005187, 'lambda_val': 1.2361709544284592e-05, 'batch_size': 926, 'optimizer': 'RMSprop'}. Best is trial 152 with value: 0.09806993337181102.
2026-05-10 21:30:21,213 - optuna.study._optimize - INFO - Trial 156 pruned. 
2026-05-10 21:30:49,655 - optuna.study.study - INFO - Trial 157 finished with value: 0.08497448880003174 and parameters: {'n_layers': 1, 'embedding_dim': 128, 'lr': 0.0003401003573880389, 'lambda_val': 1.3447217266383224e-05, 'batch_size': 690, 'optimizer': 'RMSprop'}. Best is trial 152 with value: 0.09806993337181102.
2026-05-10 21:30:53,785 - optuna.study._optimize - INFO - Trial 158 pruned. 
2026-05-10 21:30:57,198 - optuna.study._optimize - INFO - Trial 159 pruned. 
2026-05-10 21:31:27,943 - optuna.study.study - INFO - Trial 160 finished with value: 0.07793755212981604 and parameters: {'n_layers': 1, 'embedding_dim': 128, 'lr': 0.00031729088206544506, 'lambda_val': 5.861150751672529e-06, 'batch_size': 621, 'optimizer': 'RMSprop'}. Best is trial 152 with value: 0.09806993337181102.
2026-05-10 21:31:58,170 - optuna.study.study - INFO - Trial 161 finished with value: 0.07231550155658659 and parameters: {'n_layers': 1, 'embedding_dim': 128, 'lr': 0.0003640385408090005, 'lambda_val': 1.9040591394362325e-05, 'batch_size': 838, 'optimizer': 'RMSprop'}. Best is trial 152 with value: 0.09806993337181102.
2026-05-10 21:32:29,424 - optuna.study.study - INFO - Trial 162 finished with value: 0.09301555427058245 and parameters: {'n_layers': 1, 'embedding_dim': 128, 'lr': 0.0002631113086832867, 'lambda_val': 2.900403150260897e-05, 'batch_size': 588, 'optimizer': 'RMSprop'}. Best is trial 152 with value: 0.09806993337181102.
2026-05-10 21:33:10,797 - optuna.study.study - INFO - Trial 163 finished with value: 0.055352395679344135 and parameters: {'n_layers': 1, 'embedding_dim': 128, 'lr': 0.00025328346492128835, 'lambda_val': 0.007163182563332581, 'batch_size': 685, 'optimizer': 'RMSprop'}. Best is trial 152 with value: 0.09806993337181102.
2026-05-10 21:33:15,026 - optuna.study._optimize - INFO - Trial 164 pruned. 
2026-05-10 21:33:19,209 - optuna.study._optimize - INFO - Trial 165 pruned. 
2026-05-10 21:33:22,881 - optuna.study._optimize - INFO - Trial 166 pruned. 
2026-05-10 21:33:30,041 - optuna.study._optimize - INFO - Trial 167 pruned. 
2026-05-10 21:34:03,279 - optuna.study.study - INFO - Trial 168 finished with value: 0.06309482358577012 and parameters: {'n_layers': 1, 'embedding_dim': 128, 'lr': 0.0004554308845262104, 'lambda_val': 1.6987294078213118e-05, 'batch_size': 874, 'optimizer': 'RMSprop'}. Best is trial 152 with value: 0.09806993337181102.
2026-05-10 21:34:58,719 - optuna.study.study - INFO - Trial 169 finished with value: 0.09556574075505271 and parameters: {'n_layers': 1, 'embedding_dim': 128, 'lr': 0.0002479532761220892, 'lambda_val': 2.621394632680147e-05, 'batch_size': 515, 'optimizer': 'RMSprop'}. Best is trial 152 with value: 0.09806993337181102.
2026-05-10 21:35:07,995 - optuna.study._optimize - INFO - Trial 170 pruned. 
2026-05-10 21:35:11,815 - optuna.study._optimize - INFO - Trial 171 pruned. 
2026-05-10 21:35:16,538 - optuna.study._optimize - INFO - Trial 172 pruned. 
2026-05-10 21:35:21,303 - optuna.study._optimize - INFO - Trial 173 pruned. 
2026-05-10 21:35:25,013 - optuna.study._optimize - INFO - Trial 174 pruned. 
2026-05-10 21:35:55,780 - optuna.study.study - INFO - Trial 175 finished with value: 0.08503037250021311 and parameters: {'n_layers': 1, 'embedding_dim': 128, 'lr': 0.00028512987259411883, 'lambda_val': 2.033786494026691e-05, 'batch_size': 723, 'optimizer': 'RMSprop'}. Best is trial 152 with value: 0.09806993337181102.
2026-05-10 21:36:00,112 - optuna.study._optimize - INFO - Trial 176 pruned. 
2026-05-10 21:36:30,349 - optuna.study.study - INFO - Trial 177 finished with value: 0.07754254835894743 and parameters: {'n_layers': 1, 'embedding_dim': 128, 'lr': 0.0003939531081396773, 'lambda_val': 8.342497691635468e-05, 'batch_size': 581, 'optimizer': 'RMSprop'}. Best is trial 152 with value: 0.09806993337181102.
2026-05-10 21:36:34,065 - optuna.study._optimize - INFO - Trial 178 pruned. 
2026-05-10 21:37:05,317 - optuna.study.study - INFO - Trial 179 finished with value: 0.07399087981885538 and parameters: {'n_layers': 1, 'embedding_dim': 128, 'lr': 0.0003419414593997461, 'lambda_val': 3.832496000811868e-05, 'batch_size': 842, 'optimizer': 'RMSprop'}. Best is trial 152 with value: 0.09806993337181102.
2026-05-10 21:37:35,094 - optuna.study.study - INFO - Trial 180 finished with value: 0.07771767160793029 and parameters: {'n_layers': 1, 'embedding_dim': 128, 'lr': 0.0005775055477564462, 'lambda_val': 0.00012557261478843287, 'batch_size': 527, 'optimizer': 'RMSprop'}. Best is trial 152 with value: 0.09806993337181102.
2026-05-10 21:38:04,361 - optuna.study.study - INFO - Trial 181 finished with value: 0.08645990424871018 and parameters: {'n_layers': 1, 'embedding_dim': 128, 'lr': 0.0002699268573839568, 'lambda_val': 1.9104309736520817e-05, 'batch_size': 772, 'optimizer': 'RMSprop'}. Best is trial 152 with value: 0.09806993337181102.
2026-05-10 21:38:08,321 - optuna.study._optimize - INFO - Trial 182 pruned. 
2026-05-10 21:38:13,133 - optuna.study._optimize - INFO - Trial 183 pruned. 
2026-05-10 21:38:17,048 - optuna.study._optimize - INFO - Trial 184 pruned. 
2026-05-10 21:38:45,839 - optuna.study.study - INFO - Trial 185 finished with value: 0.09342018081073214 and parameters: {'n_layers': 1, 'embedding_dim': 128, 'lr': 0.00024805140473361625, 'lambda_val': 1.0718530566015574e-05, 'batch_size': 696, 'optimizer': 'RMSprop'}. Best is trial 152 with value: 0.09806993337181102.
2026-05-10 21:39:14,513 - optuna.study.study - INFO - Trial 186 finished with value: 0.08342270159869332 and parameters: {'n_layers': 1, 'embedding_dim': 128, 'lr': 0.00024058906904223497, 'lambda_val': 6.402137797770923e-06, 'batch_size': 775, 'optimizer': 'RMSprop'}. Best is trial 152 with value: 0.09806993337181102.
2026-05-10 21:39:18,447 - optuna.study._optimize - INFO - Trial 187 pruned. 
2026-05-10 21:39:48,260 - optuna.study.study - INFO - Trial 188 finished with value: 0.08533391055050628 and parameters: {'n_layers': 1, 'embedding_dim': 128, 'lr': 0.00027206669080045347, 'lambda_val': 1.509015520004749e-05, 'batch_size': 859, 'optimizer': 'RMSprop'}. Best is trial 152 with value: 0.09806993337181102.
2026-05-10 21:39:53,002 - optuna.study._optimize - INFO - Trial 189 pruned. 
2026-05-10 21:39:56,682 - optuna.study._optimize - INFO - Trial 190 pruned. 
2026-05-10 21:40:01,701 - optuna.study._optimize - INFO - Trial 191 pruned. 
2026-05-10 21:40:29,905 - optuna.study.study - INFO - Trial 192 finished with value: 0.08635022245995712 and parameters: {'n_layers': 1, 'embedding_dim': 128, 'lr': 0.00025432523315667806, 'lambda_val': 1.6752639446397167e-05, 'batch_size': 623, 'optimizer': 'RMSprop'}. Best is trial 152 with value: 0.09806993337181102.
2026-05-10 21:40:58,439 - optuna.study.study - INFO - Trial 193 finished with value: 0.092641133875941 and parameters: {'n_layers': 1, 'embedding_dim': 128, 'lr': 0.0002593994629198331, 'lambda_val': 1.0064587722381025e-05, 'batch_size': 622, 'optimizer': 'RMSprop'}. Best is trial 152 with value: 0.09806993337181102.
2026-05-10 21:41:02,394 - optuna.study._optimize - INFO - Trial 194 pruned. 
2026-05-10 21:41:07,388 - optuna.study._optimize - INFO - Trial 195 pruned. 
2026-05-10 21:41:11,862 - optuna.study._optimize - INFO - Trial 196 pruned. 
2026-05-10 21:41:41,112 - optuna.study.study - INFO - Trial 197 finished with value: 0.11016358673472489 and parameters: {'n_layers': 1, 'embedding_dim': 128, 'lr': 0.00023242230831577263, 'lambda_val': 1.447176289706694e-05, 'batch_size': 639, 'optimizer': 'RMSprop'}. Best is trial 197 with value: 0.11016358673472489.
2026-05-10 21:41:44,983 - optuna.study._optimize - INFO - Trial 198 pruned. 
2026-05-10 21:41:49,101 - optuna.study._optimize - INFO - Trial 199 pruned. 
2026-05-10 21:42:11,665 - root - INFO -   **** Training e_100K_1c1dcs_rand1
2026-05-10 21:42:11,675 - root - INFO -   **** Getting 53072/65410 random edges
2026-05-10 21:42:12,388 - optuna.storages._rdb.storage - INFO - A new study created in RDB with name: Study_e_100K_1c1dcs_rand1
2026-05-10 21:42:47,389 - optuna.study.study - INFO - Trial 0 finished with value: 0.01683506208902641 and parameters: {'n_layers': 3, 'embedding_dim': 96, 'lr': 0.0438509189588182, 'lambda_val': 4.227835573322746e-06, 'batch_size': 1937, 'optimizer': 'Adam'}. Best is trial 0 with value: 0.01683506208902641.
2026-05-10 21:43:19,548 - optuna.study.study - INFO - Trial 1 finished with value: 0.025794649083914052 and parameters: {'n_layers': 2, 'embedding_dim': 64, 'lr': 0.0016386342853379901, 'lambda_val': 1.8377244797882609e-06, 'batch_size': 3282, 'optimizer': 'Adam'}. Best is trial 1 with value: 0.025794649083914052.
2026-05-10 21:44:04,395 - optuna.study.study - INFO - Trial 2 finished with value: 0.001766432068550427 and parameters: {'n_layers': 4, 'embedding_dim': 128, 'lr': 0.019444117614449415, 'lambda_val': 0.08454082824398637, 'batch_size': 2526, 'optimizer': 'Adam'}. Best is trial 1 with value: 0.025794649083914052.
2026-05-10 21:44:32,670 - optuna.study.study - INFO - Trial 3 finished with value: 0.0022112540686966132 and parameters: {'n_layers': 2, 'embedding_dim': 64, 'lr': 0.007479462078763754, 'lambda_val': 0.011929234850526877, 'batch_size': 2167, 'optimizer': 'SGD'}. Best is trial 1 with value: 0.025794649083914052.
2026-05-10 21:45:01,857 - optuna.study.study - INFO - Trial 4 finished with value: 0.04328375266150077 and parameters: {'n_layers': 1, 'embedding_dim': 128, 'lr': 0.0014413276779634762, 'lambda_val': 8.32894232926135e-05, 'batch_size': 2260, 'optimizer': 'RMSprop'}. Best is trial 4 with value: 0.04328375266150077.
2026-05-10 21:46:07,789 - optuna.study.study - INFO - Trial 5 finished with value: 0.014614623850758734 and parameters: {'n_layers': 4, 'embedding_dim': 256, 'lr': 0.00030730845219844964, 'lambda_val': 2.3709977482716787e-06, 'batch_size': 3858, 'optimizer': 'RMSprop'}. Best is trial 4 with value: 0.04328375266150077.
2026-05-10 21:46:12,869 - optuna.study._optimize - INFO - Trial 6 pruned. 
2026-05-10 21:46:16,778 - optuna.study._optimize - INFO - Trial 7 pruned. 
2026-05-10 21:46:21,208 - optuna.study._optimize - INFO - Trial 8 pruned. 
2026-05-10 21:46:48,086 - optuna.study.study - INFO - Trial 9 finished with value: 0.043285911662571876 and parameters: {'n_layers': 1, 'embedding_dim': 32, 'lr': 0.009211958438878303, 'lambda_val': 0.0003679197725100027, 'batch_size': 1844, 'optimizer': 'RMSprop'}. Best is trial 9 with value: 0.043285911662571876.
2026-05-10 21:47:14,775 - optuna.study.study - INFO - Trial 10 finished with value: 0.11877962521025955 and parameters: {'n_layers': 1, 'embedding_dim': 32, 'lr': 0.00013467055761828147, 'lambda_val': 0.00020635794913070017, 'batch_size': 1541, 'optimizer': 'RMSprop'}. Best is trial 10 with value: 0.11877962521025955.
2026-05-10 21:47:18,210 - optuna.study._optimize - INFO - Trial 11 pruned. 
2026-05-10 21:47:21,877 - optuna.study._optimize - INFO - Trial 12 pruned. 
2026-05-10 21:47:27,278 - optuna.study._optimize - INFO - Trial 13 pruned. 
2026-05-10 21:47:53,541 - optuna.study.study - INFO - Trial 14 finished with value: 0.05035131514233836 and parameters: {'n_layers': 1, 'embedding_dim': 32, 'lr': 0.006809329089260379, 'lambda_val': 0.0010380925381505651, 'batch_size': 1346, 'optimizer': 'RMSprop'}. Best is trial 10 with value: 0.11877962521025955.
2026-05-10 21:48:20,112 - optuna.study.study - INFO - Trial 15 finished with value: 0.09069225386808356 and parameters: {'n_layers': 1, 'embedding_dim': 32, 'lr': 0.00020343215992651238, 'lambda_val': 0.0013760510132485376, 'batch_size': 1195, 'optimizer': 'RMSprop'}. Best is trial 10 with value: 0.11877962521025955.
2026-05-10 21:48:24,268 - optuna.study._optimize - INFO - Trial 16 pruned. 
2026-05-10 21:48:52,430 - optuna.study.study - INFO - Trial 17 finished with value: 0.02387599191310852 and parameters: {'n_layers': 2, 'embedding_dim': 32, 'lr': 0.000431805459054659, 'lambda_val': 0.0019103899113147077, 'batch_size': 1244, 'optimizer': 'RMSprop'}. Best is trial 10 with value: 0.11877962521025955.
2026-05-10 21:48:56,753 - optuna.study._optimize - INFO - Trial 18 pruned. 
2026-05-10 21:49:00,563 - optuna.study._optimize - INFO - Trial 19 pruned. 
2026-05-10 21:49:04,594 - optuna.study._optimize - INFO - Trial 20 pruned. 
2026-05-10 21:49:32,295 - optuna.study.study - INFO - Trial 21 finished with value: 0.038422690696174794 and parameters: {'n_layers': 1, 'embedding_dim': 32, 'lr': 0.0042120244472673, 'lambda_val': 0.00069224265587367, 'batch_size': 1315, 'optimizer': 'RMSprop'}. Best is trial 10 with value: 0.11877962521025955.
2026-05-10 21:50:00,633 - optuna.study.study - INFO - Trial 22 finished with value: 0.040241261055594724 and parameters: {'n_layers': 1, 'embedding_dim': 32, 'lr': 0.0006103003479648456, 'lambda_val': 0.0020911288096904673, 'batch_size': 1943, 'optimizer': 'RMSprop'}. Best is trial 10 with value: 0.11877962521025955.
2026-05-10 21:50:05,288 - optuna.study._optimize - INFO - Trial 23 pruned. 
2026-05-10 21:50:09,692 - optuna.study._optimize - INFO - Trial 24 pruned. 
2026-05-10 21:50:14,062 - optuna.study._optimize - INFO - Trial 25 pruned. 
2026-05-10 21:50:46,005 - optuna.study.study - INFO - Trial 26 finished with value: 0.020878476131890922 and parameters: {'n_layers': 2, 'embedding_dim': 32, 'lr': 0.0010273634147790782, 'lambda_val': 0.00028796478207828336, 'batch_size': 1259, 'optimizer': 'RMSprop'}. Best is trial 10 with value: 0.11877962521025955.
2026-05-10 21:51:12,144 - optuna.study.study - INFO - Trial 27 finished with value: 0.024432522537938595 and parameters: {'n_layers': 1, 'embedding_dim': 32, 'lr': 0.00024671289227652275, 'lambda_val': 0.032989401508249167, 'batch_size': 1750, 'optimizer': 'RMSprop'}. Best is trial 10 with value: 0.11877962521025955.
2026-05-10 21:51:16,129 - optuna.study._optimize - INFO - Trial 28 pruned. 
2026-05-10 21:51:20,215 - optuna.study._optimize - INFO - Trial 29 pruned. 
2026-05-10 21:51:24,732 - optuna.study._optimize - INFO - Trial 30 pruned. 
2026-05-10 21:51:51,176 - optuna.study.study - INFO - Trial 31 finished with value: 0.04597502454393779 and parameters: {'n_layers': 1, 'embedding_dim': 32, 'lr': 0.01133391331844492, 'lambda_val': 0.0003887807754126641, 'batch_size': 1763, 'optimizer': 'RMSprop'}. Best is trial 10 with value: 0.11877962521025955.
2026-05-10 21:52:17,441 - optuna.study.study - INFO - Trial 32 finished with value: 0.052964784891661815 and parameters: {'n_layers': 1, 'embedding_dim': 32, 'lr': 0.010898187998405383, 'lambda_val': 0.0013248584774312642, 'batch_size': 1443, 'optimizer': 'RMSprop'}. Best is trial 10 with value: 0.11877962521025955.
2026-05-10 21:52:43,886 - optuna.study.study - INFO - Trial 33 finished with value: 0.0614509695604625 and parameters: {'n_layers': 1, 'embedding_dim': 64, 'lr': 0.0022873107822237873, 'lambda_val': 0.0013048030483873534, 'batch_size': 1339, 'optimizer': 'RMSprop'}. Best is trial 10 with value: 0.11877962521025955.
2026-05-10 21:52:48,498 - optuna.study._optimize - INFO - Trial 34 pruned. 
2026-05-10 21:53:15,165 - optuna.study.study - INFO - Trial 35 finished with value: 0.0643744545139022 and parameters: {'n_layers': 1, 'embedding_dim': 64, 'lr': 0.002152485081498953, 'lambda_val': 0.004316980067432304, 'batch_size': 2119, 'optimizer': 'Adam'}. Best is trial 10 with value: 0.11877962521025955.
2026-05-10 21:53:41,791 - optuna.study.study - INFO - Trial 36 finished with value: 0.04610977119154229 and parameters: {'n_layers': 1, 'embedding_dim': 64, 'lr': 0.0008503099779138406, 'lambda_val': 0.005151208407938145, 'batch_size': 2110, 'optimizer': 'Adam'}. Best is trial 10 with value: 0.11877962521025955.
2026-05-10 21:53:45,775 - optuna.study._optimize - INFO - Trial 37 pruned. 
2026-05-10 21:54:14,322 - optuna.study.study - INFO - Trial 38 finished with value: 0.06737531282666641 and parameters: {'n_layers': 1, 'embedding_dim': 64, 'lr': 0.002553468696932316, 'lambda_val': 0.003431849995808269, 'batch_size': 2343, 'optimizer': 'Adam'}. Best is trial 10 with value: 0.11877962521025955.
2026-05-10 21:54:18,685 - optuna.study._optimize - INFO - Trial 39 pruned. 
2026-05-10 21:54:53,445 - optuna.study.study - INFO - Trial 40 finished with value: 0.032766291021869745 and parameters: {'n_layers': 2, 'embedding_dim': 128, 'lr': 0.0011572542297142066, 'lambda_val': 0.0033098301835921737, 'batch_size': 3130, 'optimizer': 'Adam'}. Best is trial 10 with value: 0.11877962521025955.
2026-05-10 21:55:21,456 - optuna.study.study - INFO - Trial 41 finished with value: 0.056879024601085196 and parameters: {'n_layers': 1, 'embedding_dim': 64, 'lr': 0.002559537213329727, 'lambda_val': 0.009107583383293035, 'batch_size': 2396, 'optimizer': 'Adam'}. Best is trial 10 with value: 0.11877962521025955.
2026-05-10 21:55:47,763 - optuna.study.study - INFO - Trial 42 finished with value: 0.05773998270573092 and parameters: {'n_layers': 1, 'embedding_dim': 64, 'lr': 0.0021830238938662138, 'lambda_val': 0.0070243034917934, 'batch_size': 2279, 'optimizer': 'Adam'}. Best is trial 10 with value: 0.11877962521025955.
2026-05-10 21:56:15,671 - optuna.study.study - INFO - Trial 43 finished with value: 0.05163061430077344 and parameters: {'n_layers': 1, 'embedding_dim': 64, 'lr': 0.0007264064115096364, 'lambda_val': 0.00044918792051380747, 'batch_size': 1977, 'optimizer': 'Adam'}. Best is trial 10 with value: 0.11877962521025955.
2026-05-10 21:56:43,709 - optuna.study.study - INFO - Trial 44 finished with value: 0.057714279537746944 and parameters: {'n_layers': 1, 'embedding_dim': 64, 'lr': 0.0016453161970415684, 'lambda_val': 0.0032704417062756072, 'batch_size': 2659, 'optimizer': 'Adam'}. Best is trial 10 with value: 0.11877962521025955.
2026-05-10 21:56:48,042 - optuna.study._optimize - INFO - Trial 45 pruned. 
2026-05-10 21:57:14,192 - optuna.study.study - INFO - Trial 46 finished with value: 0.04534351558414352 and parameters: {'n_layers': 1, 'embedding_dim': 64, 'lr': 0.0014371573979377337, 'lambda_val': 0.00027229287683230445, 'batch_size': 1087, 'optimizer': 'Adam'}. Best is trial 10 with value: 0.11877962521025955.
2026-05-10 21:57:47,989 - optuna.study.study - INFO - Trial 47 finished with value: 0.06916441455819279 and parameters: {'n_layers': 1, 'embedding_dim': 256, 'lr': 0.00038106703412832784, 'lambda_val': 8.223996341338025e-05, 'batch_size': 2223, 'optimizer': 'Adam'}. Best is trial 10 with value: 0.11877962521025955.
2026-05-10 21:58:29,419 - optuna.study.study - INFO - Trial 48 finished with value: 0.036324736042295636 and parameters: {'n_layers': 2, 'embedding_dim': 256, 'lr': 0.00035290402361644845, 'lambda_val': 7.344934307605825e-05, 'batch_size': 2216, 'optimizer': 'Adam'}. Best is trial 10 with value: 0.11877962521025955.
