2026-05-10 23:42:11,433 - optuna.study._optimize - INFO - Trial 197 pruned. 
2026-05-10 23:42:20,383 - optuna.study._optimize - INFO - Trial 198 pruned. 
2026-05-10 23:42:24,188 - optuna.study._optimize - INFO - Trial 199 pruned. 
2026-05-10 23:42:50,574 - root - INFO -   **** Training e_100K_1c1dcs_rand3
2026-05-10 23:42:50,587 - root - INFO -   **** Getting 53072/65410 random edges
2026-05-10 23:42:50,679 - optuna.storages._rdb.storage - INFO - A new study created in RDB with name: Study_e_100K_1c1dcs_rand3
2026-05-10 23:43:14,306 - optuna.study.study - INFO - Trial 0 finished with value: 0.04623174818464649 and parameters: {'n_layers': 1, 'embedding_dim': 32, 'lr': 4.60324477929993e-05, 'lambda_val': 3.2319490539678166e-05, 'batch_size': 2117, 'optimizer': 'Adam'}. Best is trial 0 with value: 0.04623174818464649.
2026-05-10 23:43:45,370 - optuna.study.study - INFO - Trial 1 finished with value: 0.003346150181571355 and parameters: {'n_layers': 3, 'embedding_dim': 64, 'lr': 0.008778933145135495, 'lambda_val': 0.00022318766014919262, 'batch_size': 1995, 'optimizer': 'SGD'}. Best is trial 0 with value: 0.04623174818464649.
2026-05-10 23:44:21,314 - optuna.study.study - INFO - Trial 2 finished with value: 0.014902781534167242 and parameters: {'n_layers': 3, 'embedding_dim': 64, 'lr': 0.00023469439738624595, 'lambda_val': 0.000119685667675202, 'batch_size': 3089, 'optimizer': 'Adam'}. Best is trial 0 with value: 0.04623174818464649.
2026-05-10 23:44:46,741 - optuna.study.study - INFO - Trial 3 finished with value: 0.0029994945217263385 and parameters: {'n_layers': 2, 'embedding_dim': 32, 'lr': 0.027242942434971454, 'lambda_val': 0.037025926321340615, 'batch_size': 1942, 'optimizer': 'SGD'}. Best is trial 0 with value: 0.04623174818464649.
2026-05-10 23:45:37,512 - optuna.study.study - INFO - Trial 4 finished with value: 0.02324618531661223 and parameters: {'n_layers': 3, 'embedding_dim': 256, 'lr': 1.9155957676665534e-05, 'lambda_val': 1.2909422342765214e-06, 'batch_size': 3919, 'optimizer': 'RMSprop'}. Best is trial 0 with value: 0.04623174818464649.
2026-05-10 23:45:47,582 - optuna.study._optimize - INFO - Trial 5 pruned. 
2026-05-10 23:46:17,610 - optuna.study.study - INFO - Trial 6 finished with value: 0.05589170321468977 and parameters: {'n_layers': 1, 'embedding_dim': 128, 'lr': 0.010749479816063756, 'lambda_val': 8.493642230741311e-05, 'batch_size': 1038, 'optimizer': 'RMSprop'}. Best is trial 6 with value: 0.05589170321468977.
2026-05-10 23:46:47,998 - optuna.study.study - INFO - Trial 7 finished with value: 0.08532008709719469 and parameters: {'n_layers': 2, 'embedding_dim': 32, 'lr': 8.73702875971976e-05, 'lambda_val': 3.216374775162717e-05, 'batch_size': 1065, 'optimizer': 'RMSprop'}. Best is trial 7 with value: 0.08532008709719469.
2026-05-10 23:46:55,245 - optuna.study._optimize - INFO - Trial 8 pruned. 
2026-05-10 23:47:02,720 - optuna.study._optimize - INFO - Trial 9 pruned. 
2026-05-10 23:47:37,114 - optuna.study.study - INFO - Trial 10 finished with value: 0.030490913941725286 and parameters: {'n_layers': 2, 'embedding_dim': 96, 'lr': 0.0015484156310277904, 'lambda_val': 0.00278422740241671, 'batch_size': 600, 'optimizer': 'RMSprop'}. Best is trial 7 with value: 0.08532008709719469.
2026-05-10 23:48:06,994 - optuna.study.study - INFO - Trial 11 finished with value: 0.04721677242691101 and parameters: {'n_layers': 1, 'embedding_dim': 128, 'lr': 0.0038822238921962402, 'lambda_val': 2.802147567758486e-06, 'batch_size': 877, 'optimizer': 'RMSprop'}. Best is trial 7 with value: 0.08532008709719469.
2026-05-10 23:48:11,412 - optuna.study._optimize - INFO - Trial 12 pruned. 
2026-05-10 23:48:46,355 - optuna.study.study - INFO - Trial 13 finished with value: 0.025638430039288115 and parameters: {'n_layers': 2, 'embedding_dim': 96, 'lr': 0.0003029184526395198, 'lambda_val': 9.736154809511222e-06, 'batch_size': 1288, 'optimizer': 'RMSprop'}. Best is trial 7 with value: 0.08532008709719469.
2026-05-10 23:49:19,781 - optuna.study.study - INFO - Trial 14 finished with value: 0.07550829649574768 and parameters: {'n_layers': 1, 'embedding_dim': 128, 'lr': 0.010173250762360928, 'lambda_val': 0.0022122232101455834, 'batch_size': 1430, 'optimizer': 'RMSprop'}. Best is trial 7 with value: 0.08532008709719469.
2026-05-10 23:49:51,492 - optuna.study.study - INFO - Trial 15 finished with value: 0.06829911409746367 and parameters: {'n_layers': 2, 'embedding_dim': 32, 'lr': 0.00015006272900009346, 'lambda_val': 0.0014634297357793023, 'batch_size': 1580, 'optimizer': 'RMSprop'}. Best is trial 7 with value: 0.08532008709719469.
2026-05-10 23:50:20,613 - optuna.study.study - INFO - Trial 16 finished with value: 0.038124143712108566 and parameters: {'n_layers': 1, 'embedding_dim': 32, 'lr': 0.0014739589067710457, 'lambda_val': 0.0007634899036201387, 'batch_size': 2624, 'optimizer': 'Adam'}. Best is trial 7 with value: 0.08532008709719469.
2026-05-10 23:50:26,439 - optuna.study._optimize - INFO - Trial 17 pruned. 
2026-05-10 23:50:55,460 - optuna.study.study - INFO - Trial 18 finished with value: 0.059709989015790395 and parameters: {'n_layers': 1, 'embedding_dim': 64, 'lr': 0.004975415319333763, 'lambda_val': 0.0005475802681505832, 'batch_size': 521, 'optimizer': 'RMSprop'}. Best is trial 7 with value: 0.08532008709719469.
2026-05-10 23:51:32,496 - optuna.study.study - INFO - Trial 19 finished with value: 0.02701920391015367 and parameters: {'n_layers': 2, 'embedding_dim': 96, 'lr': 0.0007853704285151481, 'lambda_val': 5.909808674530018e-06, 'batch_size': 1542, 'optimizer': 'RMSprop'}. Best is trial 7 with value: 0.08532008709719469.
2026-05-10 23:51:37,763 - optuna.study._optimize - INFO - Trial 20 pruned. 
2026-05-10 23:52:06,309 - optuna.study.study - INFO - Trial 21 finished with value: 0.02989626273188784 and parameters: {'n_layers': 2, 'embedding_dim': 32, 'lr': 0.00020976549300901197, 'lambda_val': 0.0013377444039289782, 'batch_size': 1608, 'optimizer': 'RMSprop'}. Best is trial 7 with value: 0.08532008709719469.
2026-05-10 23:52:33,274 - optuna.study.study - INFO - Trial 22 finished with value: 0.06213522942141729 and parameters: {'n_layers': 2, 'embedding_dim': 32, 'lr': 0.0001469752796725802, 'lambda_val': 0.001298248437827349, 'batch_size': 1027, 'optimizer': 'RMSprop'}. Best is trial 7 with value: 0.08532008709719469.
2026-05-10 23:52:36,671 - optuna.study._optimize - INFO - Trial 23 pruned. 
2026-05-10 23:53:06,081 - optuna.study.study - INFO - Trial 24 finished with value: 0.01890610754873492 and parameters: {'n_layers': 3, 'embedding_dim': 32, 'lr': 0.0003911620413830575, 'lambda_val': 0.00032679434046685413, 'batch_size': 1800, 'optimizer': 'RMSprop'}. Best is trial 7 with value: 0.08532008709719469.
2026-05-10 23:53:10,956 - optuna.study._optimize - INFO - Trial 25 pruned. 
2026-05-10 23:53:14,401 - optuna.study._optimize - INFO - Trial 26 pruned. 
2026-05-10 23:53:18,376 - optuna.study._optimize - INFO - Trial 27 pruned. 
2026-05-10 23:53:24,545 - optuna.study._optimize - INFO - Trial 28 pruned. 
2026-05-10 23:53:28,869 - optuna.study._optimize - INFO - Trial 29 pruned. 
2026-05-10 23:53:59,124 - optuna.study.study - INFO - Trial 30 finished with value: 0.05738373740633881 and parameters: {'n_layers': 1, 'embedding_dim': 64, 'lr': 0.0004416119974731366, 'lambda_val': 1.1180088639392507e-05, 'batch_size': 1784, 'optimizer': 'Adam'}. Best is trial 7 with value: 0.08532008709719469.
2026-05-10 23:54:03,091 - optuna.study._optimize - INFO - Trial 31 pruned. 
2026-05-10 23:54:06,757 - optuna.study._optimize - INFO - Trial 32 pruned. 
2026-05-10 23:54:10,885 - optuna.study._optimize - INFO - Trial 33 pruned. 
2026-05-10 23:54:14,852 - optuna.study._optimize - INFO - Trial 34 pruned. 
2026-05-10 23:54:18,939 - optuna.study._optimize - INFO - Trial 35 pruned. 
2026-05-10 23:54:25,032 - optuna.study._optimize - INFO - Trial 36 pruned. 
2026-05-10 23:54:31,025 - optuna.study._optimize - INFO - Trial 37 pruned. 
2026-05-10 23:54:35,893 - optuna.study._optimize - INFO - Trial 38 pruned. 
2026-05-10 23:54:41,165 - optuna.study._optimize - INFO - Trial 39 pruned. 
2026-05-10 23:54:45,424 - optuna.study._optimize - INFO - Trial 40 pruned. 
2026-05-10 23:55:18,020 - optuna.study.study - INFO - Trial 41 finished with value: 0.0569913401360593 and parameters: {'n_layers': 1, 'embedding_dim': 64, 'lr': 0.005338493010479501, 'lambda_val': 0.0007328410063662503, 'batch_size': 531, 'optimizer': 'RMSprop'}. Best is trial 7 with value: 0.08532008709719469.
2026-05-10 23:55:51,235 - optuna.study.study - INFO - Trial 42 finished with value: 0.06117024858107745 and parameters: {'n_layers': 1, 'embedding_dim': 64, 'lr': 0.006694791259129273, 'lambda_val': 0.0005452816083710335, 'batch_size': 524, 'optimizer': 'RMSprop'}. Best is trial 7 with value: 0.08532008709719469.
2026-05-10 23:55:54,852 - optuna.study._optimize - INFO - Trial 43 pruned. 
2026-05-10 23:55:59,079 - optuna.study._optimize - INFO - Trial 44 pruned. 
2026-05-10 23:56:03,624 - optuna.study._optimize - INFO - Trial 45 pruned. 
2026-05-10 23:56:39,108 - optuna.study.study - INFO - Trial 46 finished with value: 0.04956282430611419 and parameters: {'n_layers': 1, 'embedding_dim': 64, 'lr': 0.0013095225954920329, 'lambda_val': 0.002108252515750202, 'batch_size': 1319, 'optimizer': 'RMSprop'}. Best is trial 7 with value: 0.08532008709719469.
2026-05-10 23:56:45,976 - optuna.study._optimize - INFO - Trial 47 pruned. 
2026-05-10 23:56:49,630 - optuna.study._optimize - INFO - Trial 48 pruned. 
2026-05-10 23:56:54,172 - optuna.study._optimize - INFO - Trial 49 pruned. 
2026-05-10 23:56:58,453 - optuna.study._optimize - INFO - Trial 50 pruned. 
2026-05-10 23:57:02,316 - optuna.study._optimize - INFO - Trial 51 pruned. 
2026-05-10 23:57:29,003 - optuna.study.study - INFO - Trial 52 finished with value: 0.06549518676703897 and parameters: {'n_layers': 1, 'embedding_dim': 64, 'lr': 0.013202795240674947, 'lambda_val': 0.0010181368383566285, 'batch_size': 530, 'optimizer': 'RMSprop'}. Best is trial 7 with value: 0.08532008709719469.
2026-05-10 23:57:55,401 - optuna.study.study - INFO - Trial 53 finished with value: 0.06528554512848887 and parameters: {'n_layers': 1, 'embedding_dim': 64, 'lr': 0.010809598533663561, 'lambda_val': 0.0009189922155432646, 'batch_size': 796, 'optimizer': 'RMSprop'}. Best is trial 7 with value: 0.08532008709719469.
2026-05-10 23:58:22,046 - optuna.study.study - INFO - Trial 54 finished with value: 0.07003297598409834 and parameters: {'n_layers': 1, 'embedding_dim': 64, 'lr': 0.014430286819714587, 'lambda_val': 0.0010258661207771453, 'batch_size': 1194, 'optimizer': 'RMSprop'}. Best is trial 7 with value: 0.08532008709719469.
2026-05-10 23:58:25,804 - optuna.study._optimize - INFO - Trial 55 pruned. 
2026-05-10 23:58:30,064 - optuna.study._optimize - INFO - Trial 56 pruned. 
2026-05-10 23:58:34,040 - optuna.study._optimize - INFO - Trial 57 pruned. 
2026-05-10 23:58:37,875 - optuna.study._optimize - INFO - Trial 58 pruned. 
2026-05-10 23:58:41,276 - optuna.study._optimize - INFO - Trial 59 pruned. 
2026-05-10 23:59:16,057 - optuna.study.study - INFO - Trial 60 finished with value: 0.07961988357998227 and parameters: {'n_layers': 1, 'embedding_dim': 256, 'lr': 0.004353214759418835, 'lambda_val': 0.0008636598959516374, 'batch_size': 4072, 'optimizer': 'RMSprop'}. Best is trial 7 with value: 0.08532008709719469.
2026-05-10 23:59:51,193 - optuna.study.study - INFO - Trial 61 finished with value: 0.08426799949962546 and parameters: {'n_layers': 1, 'embedding_dim': 256, 'lr': 0.004403498417228889, 'lambda_val': 0.000844535928607615, 'batch_size': 3472, 'optimizer': 'RMSprop'}. Best is trial 7 with value: 0.08532008709719469.
2026-05-11 00:00:27,551 - optuna.study.study - INFO - Trial 62 finished with value: 0.0798099803551569 and parameters: {'n_layers': 1, 'embedding_dim': 256, 'lr': 0.004261298044333765, 'lambda_val': 0.0034702272831511143, 'batch_size': 3502, 'optimizer': 'RMSprop'}. Best is trial 7 with value: 0.08532008709719469.
2026-05-11 00:01:02,715 - optuna.study.study - INFO - Trial 63 finished with value: 0.07386582234253007 and parameters: {'n_layers': 1, 'embedding_dim': 256, 'lr': 0.004334412227354876, 'lambda_val': 0.004439896584412565, 'batch_size': 3999, 'optimizer': 'RMSprop'}. Best is trial 7 with value: 0.08532008709719469.
2026-05-11 00:01:37,900 - optuna.study.study - INFO - Trial 64 finished with value: 0.07531903372088489 and parameters: {'n_layers': 1, 'embedding_dim': 256, 'lr': 0.0037254329567037478, 'lambda_val': 0.004407341158026357, 'batch_size': 4067, 'optimizer': 'RMSprop'}. Best is trial 7 with value: 0.08532008709719469.
2026-05-11 00:02:12,023 - optuna.study.study - INFO - Trial 65 finished with value: 0.07543108453094857 and parameters: {'n_layers': 1, 'embedding_dim': 256, 'lr': 0.003907446278836345, 'lambda_val': 0.0034921708684793194, 'batch_size': 4064, 'optimizer': 'RMSprop'}. Best is trial 7 with value: 0.08532008709719469.
2026-05-11 00:02:17,034 - optuna.study._optimize - INFO - Trial 66 pruned. 
2026-05-11 00:02:51,624 - optuna.study.study - INFO - Trial 67 finished with value: 0.07111324430694675 and parameters: {'n_layers': 1, 'embedding_dim': 256, 'lr': 0.003537950866577135, 'lambda_val': 0.006547489283022966, 'batch_size': 3403, 'optimizer': 'RMSprop'}. Best is trial 7 with value: 0.08532008709719469.
2026-05-11 00:03:27,050 - optuna.study.study - INFO - Trial 68 finished with value: 0.07657002884004938 and parameters: {'n_layers': 1, 'embedding_dim': 256, 'lr': 0.0018756033881798249, 'lambda_val': 0.003111544216275417, 'batch_size': 4084, 'optimizer': 'RMSprop'}. Best is trial 7 with value: 0.08532008709719469.
2026-05-11 00:04:02,913 - optuna.study.study - INFO - Trial 69 finished with value: 0.07476450462120762 and parameters: {'n_layers': 1, 'embedding_dim': 256, 'lr': 0.001062485817039175, 'lambda_val': 0.0030056247139475935, 'batch_size': 3810, 'optimizer': 'Adam'}. Best is trial 7 with value: 0.08532008709719469.
2026-05-11 00:04:07,100 - optuna.study._optimize - INFO - Trial 70 pruned. 
2026-05-11 00:04:42,572 - optuna.study.study - INFO - Trial 71 finished with value: 0.07361497332381443 and parameters: {'n_layers': 1, 'embedding_dim': 256, 'lr': 0.0036021515515516443, 'lambda_val': 0.0034790357068498878, 'batch_size': 4093, 'optimizer': 'RMSprop'}. Best is trial 7 with value: 0.08532008709719469.
2026-05-11 00:05:16,776 - optuna.study.study - INFO - Trial 72 finished with value: 0.068712103088732 and parameters: {'n_layers': 1, 'embedding_dim': 256, 'lr': 0.0019145886458776867, 'lambda_val': 0.004652365072982359, 'batch_size': 3029, 'optimizer': 'RMSprop'}. Best is trial 7 with value: 0.08532008709719469.
2026-05-11 00:05:52,421 - optuna.study.study - INFO - Trial 73 finished with value: 0.08004090584355865 and parameters: {'n_layers': 1, 'embedding_dim': 256, 'lr': 0.006138173585618862, 'lambda_val': 0.0027237774248851498, 'batch_size': 3896, 'optimizer': 'RMSprop'}. Best is trial 7 with value: 0.08532008709719469.
2026-05-11 00:05:59,149 - optuna.study._optimize - INFO - Trial 74 pruned. 
2026-05-11 00:06:34,063 - optuna.study.study - INFO - Trial 75 finished with value: 0.08219868402491992 and parameters: {'n_layers': 1, 'embedding_dim': 256, 'lr': 0.0057168892413379715, 'lambda_val': 0.0024768344879179433, 'batch_size': 3645, 'optimizer': 'RMSprop'}. Best is trial 7 with value: 0.08532008709719469.
2026-05-11 00:07:09,102 - optuna.study.study - INFO - Trial 76 finished with value: 0.08058581037198158 and parameters: {'n_layers': 1, 'embedding_dim': 256, 'lr': 0.006054748573224343, 'lambda_val': 0.0018060087968237752, 'batch_size': 3636, 'optimizer': 'RMSprop'}. Best is trial 7 with value: 0.08532008709719469.
2026-05-11 00:07:44,798 - optuna.study.study - INFO - Trial 77 finished with value: 0.08319703284134167 and parameters: {'n_layers': 1, 'embedding_dim': 256, 'lr': 0.005489023345149689, 'lambda_val': 0.002484245238175069, 'batch_size': 3588, 'optimizer': 'RMSprop'}. Best is trial 7 with value: 0.08532008709719469.
2026-05-11 00:08:19,236 - optuna.study.study - INFO - Trial 78 finished with value: 0.0766345467012258 and parameters: {'n_layers': 1, 'embedding_dim': 256, 'lr': 0.0061372897132455076, 'lambda_val': 0.0007112803119175015, 'batch_size': 3563, 'optimizer': 'RMSprop'}. Best is trial 7 with value: 0.08532008709719469.
2026-05-11 00:08:54,684 - optuna.study.study - INFO - Trial 79 finished with value: 0.07940306521685594 and parameters: {'n_layers': 1, 'embedding_dim': 256, 'lr': 0.007833048856183609, 'lambda_val': 0.001717771418270327, 'batch_size': 3161, 'optimizer': 'RMSprop'}. Best is trial 7 with value: 0.08532008709719469.
2026-05-11 00:09:10,949 - optuna.study._optimize - INFO - Trial 80 pruned. 
2026-05-11 00:09:50,904 - optuna.study.study - INFO - Trial 81 finished with value: 0.07375868171275314 and parameters: {'n_layers': 1, 'embedding_dim': 256, 'lr': 0.00845809173438545, 'lambda_val': 0.001846964696776152, 'batch_size': 3250, 'optimizer': 'RMSprop'}. Best is trial 7 with value: 0.08532008709719469.
2026-05-11 00:10:25,550 - optuna.study.study - INFO - Trial 82 finished with value: 0.08104097947514072 and parameters: {'n_layers': 1, 'embedding_dim': 256, 'lr': 0.0063416060135790394, 'lambda_val': 0.0013749774141322887, 'batch_size': 3714, 'optimizer': 'RMSprop'}. Best is trial 7 with value: 0.08532008709719469.
2026-05-11 00:11:00,618 - optuna.study.study - INFO - Trial 83 finished with value: 0.08034689495406717 and parameters: {'n_layers': 1, 'embedding_dim': 256, 'lr': 0.005184858662543255, 'lambda_val': 0.0024678114960760404, 'batch_size': 3695, 'optimizer': 'RMSprop'}. Best is trial 7 with value: 0.08532008709719469.
2026-05-11 00:11:34,924 - optuna.study.study - INFO - Trial 84 finished with value: 0.08003580458355283 and parameters: {'n_layers': 1, 'embedding_dim': 256, 'lr': 0.006164300162589341, 'lambda_val': 0.0012781276321742387, 'batch_size': 3699, 'optimizer': 'RMSprop'}. Best is trial 7 with value: 0.08532008709719469.
2026-05-11 00:12:09,800 - optuna.study.study - INFO - Trial 85 finished with value: 0.0777844403627967 and parameters: {'n_layers': 1, 'embedding_dim': 256, 'lr': 0.005803613254209986, 'lambda_val': 0.002394097813583064, 'batch_size': 3716, 'optimizer': 'RMSprop'}. Best is trial 7 with value: 0.08532008709719469.
2026-05-11 00:12:44,589 - optuna.study.study - INFO - Trial 86 finished with value: 0.0813055038575037 and parameters: {'n_layers': 1, 'embedding_dim': 256, 'lr': 0.009147394998342304, 'lambda_val': 0.001243057782327002, 'batch_size': 3932, 'optimizer': 'RMSprop'}. Best is trial 7 with value: 0.08532008709719469.
2026-05-11 00:12:49,055 - optuna.study._optimize - INFO - Trial 87 pruned. 
2026-05-11 00:13:24,125 - optuna.study.study - INFO - Trial 88 finished with value: 0.0737678782911361 and parameters: {'n_layers': 1, 'embedding_dim': 256, 'lr': 0.0022492955241041022, 'lambda_val': 0.001300333219774152, 'batch_size': 3919, 'optimizer': 'RMSprop'}. Best is trial 7 with value: 0.08532008709719469.
2026-05-11 00:13:28,229 - optuna.study._optimize - INFO - Trial 89 pruned. 
2026-05-11 00:13:33,087 - optuna.study._optimize - INFO - Trial 90 pruned. 
2026-05-11 00:14:07,632 - optuna.study.study - INFO - Trial 91 finished with value: 0.08153545482964232 and parameters: {'n_layers': 1, 'embedding_dim': 256, 'lr': 0.006595398671968239, 'lambda_val': 0.0012390043897703312, 'batch_size': 3571, 'optimizer': 'RMSprop'}. Best is trial 7 with value: 0.08532008709719469.
2026-05-11 00:14:41,896 - optuna.study.study - INFO - Trial 92 finished with value: 0.080750763184942 and parameters: {'n_layers': 1, 'embedding_dim': 256, 'lr': 0.005086312158991533, 'lambda_val': 0.0025864028746007722, 'batch_size': 3324, 'optimizer': 'RMSprop'}. Best is trial 7 with value: 0.08532008709719469.
2026-05-11 00:14:47,984 - optuna.study._optimize - INFO - Trial 93 pruned. 
2026-05-11 00:15:22,910 - optuna.study.study - INFO - Trial 94 finished with value: 0.07334112118790778 and parameters: {'n_layers': 1, 'embedding_dim': 256, 'lr': 0.003290621314839254, 'lambda_val': 0.0019100514576973003, 'batch_size': 3590, 'optimizer': 'RMSprop'}. Best is trial 7 with value: 0.08532008709719469.
2026-05-11 00:15:30,449 - optuna.study._optimize - INFO - Trial 95 pruned. 
2026-05-11 00:15:34,636 - optuna.study._optimize - INFO - Trial 96 pruned. 
2026-05-11 00:15:38,945 - optuna.study._optimize - INFO - Trial 97 pruned. 
2026-05-11 00:15:49,380 - optuna.study._optimize - INFO - Trial 98 pruned. 
2026-05-11 00:15:57,823 - optuna.study._optimize - INFO - Trial 99 pruned. 
2026-05-11 00:16:02,596 - optuna.study._optimize - INFO - Trial 100 pruned. 
2026-05-11 00:16:37,548 - optuna.study.study - INFO - Trial 101 finished with value: 0.081659344138462 and parameters: {'n_layers': 1, 'embedding_dim': 256, 'lr': 0.00668330206396997, 'lambda_val': 0.0024018952486161626, 'batch_size': 3960, 'optimizer': 'RMSprop'}. Best is trial 7 with value: 0.08532008709719469.
2026-05-11 00:17:14,078 - optuna.study.study - INFO - Trial 102 finished with value: 0.0797674964092495 and parameters: {'n_layers': 1, 'embedding_dim': 256, 'lr': 0.011658094950507179, 'lambda_val': 0.001519024123922128, 'batch_size': 3949, 'optimizer': 'RMSprop'}. Best is trial 7 with value: 0.08532008709719469.
2026-05-11 00:17:49,408 - optuna.study.study - INFO - Trial 103 finished with value: 0.08032981372931125 and parameters: {'n_layers': 1, 'embedding_dim': 256, 'lr': 0.00715240031654659, 'lambda_val': 0.002426696377268163, 'batch_size': 3214, 'optimizer': 'RMSprop'}. Best is trial 7 with value: 0.08532008709719469.
2026-05-11 00:17:53,271 - optuna.study._optimize - INFO - Trial 104 pruned. 
