2026-05-11 10:47:41,235 - optuna.study.study - INFO - Trial 165 finished with value: 0.07300257461904339 and parameters: {'n_layers': 1, 'embedding_dim': 256, 'lr': 0.005151872322762116, 'lambda_val': 0.0007765226097916525, 'batch_size': 3346, 'optimizer': 'Adam'}. Best is trial 158 with value: 0.09120841290173527.
2026-05-11 10:48:19,655 - optuna.study.study - INFO - Trial 166 finished with value: 0.0760069996282271 and parameters: {'n_layers': 1, 'embedding_dim': 256, 'lr': 0.00014529859257677617, 'lambda_val': 0.0007152612805106267, 'batch_size': 3359, 'optimizer': 'Adam'}. Best is trial 158 with value: 0.09120841290173527.
2026-05-11 10:49:04,850 - optuna.study.study - INFO - Trial 167 finished with value: 0.07422169763478564 and parameters: {'n_layers': 1, 'embedding_dim': 256, 'lr': 0.00023205499301834692, 'lambda_val': 0.000799601972668555, 'batch_size': 3376, 'optimizer': 'Adam'}. Best is trial 158 with value: 0.09120841290173527.
2026-05-11 10:49:41,584 - optuna.study.study - INFO - Trial 168 finished with value: 0.07621367928244269 and parameters: {'n_layers': 1, 'embedding_dim': 256, 'lr': 0.0001202480749949701, 'lambda_val': 0.0011104908279383184, 'batch_size': 3425, 'optimizer': 'RMSprop'}. Best is trial 158 with value: 0.09120841290173527.
2026-05-11 10:50:18,408 - optuna.study.study - INFO - Trial 169 finished with value: 0.08324063977684974 and parameters: {'n_layers': 1, 'embedding_dim': 256, 'lr': 0.00016559576568312938, 'lambda_val': 0.001088928370039759, 'batch_size': 3250, 'optimizer': 'RMSprop'}. Best is trial 158 with value: 0.09120841290173527.
2026-05-11 10:50:53,587 - optuna.study.study - INFO - Trial 170 finished with value: 0.06984730662398188 and parameters: {'n_layers': 1, 'embedding_dim': 256, 'lr': 0.00016559713085360003, 'lambda_val': 0.0011015744857460472, 'batch_size': 3254, 'optimizer': 'RMSprop'}. Best is trial 158 with value: 0.09120841290173527.
2026-05-11 10:50:57,966 - optuna.study._optimize - INFO - Trial 171 pruned. 
2026-05-11 10:51:32,438 - optuna.study.study - INFO - Trial 172 finished with value: 0.07295527877269564 and parameters: {'n_layers': 1, 'embedding_dim': 256, 'lr': 0.00013124397039877258, 'lambda_val': 0.0013084515309791096, 'batch_size': 3324, 'optimizer': 'RMSprop'}. Best is trial 158 with value: 0.09120841290173527.
2026-05-11 10:52:09,375 - optuna.study.study - INFO - Trial 173 finished with value: 0.06688977698671301 and parameters: {'n_layers': 1, 'embedding_dim': 256, 'lr': 0.000227677533706759, 'lambda_val': 0.0007700838546585626, 'batch_size': 3418, 'optimizer': 'RMSprop'}. Best is trial 158 with value: 0.09120841290173527.
2026-05-11 10:52:45,692 - optuna.study.study - INFO - Trial 174 finished with value: 0.0863137949273258 and parameters: {'n_layers': 1, 'embedding_dim': 256, 'lr': 0.00014694022089092821, 'lambda_val': 0.000545219927785002, 'batch_size': 3541, 'optimizer': 'RMSprop'}. Best is trial 158 with value: 0.09120841290173527.
2026-05-11 10:53:33,536 - optuna.study.study - INFO - Trial 175 finished with value: 0.07544481368051355 and parameters: {'n_layers': 1, 'embedding_dim': 256, 'lr': 0.00014872897289698486, 'lambda_val': 0.0005629845169845911, 'batch_size': 3525, 'optimizer': 'RMSprop'}. Best is trial 158 with value: 0.09120841290173527.
2026-05-11 10:54:10,936 - optuna.study.study - INFO - Trial 176 finished with value: 0.0795180947085556 and parameters: {'n_layers': 1, 'embedding_dim': 256, 'lr': 0.00014011552302175257, 'lambda_val': 0.0005797971471914262, 'batch_size': 3573, 'optimizer': 'RMSprop'}. Best is trial 158 with value: 0.09120841290173527.
2026-05-11 10:54:47,496 - optuna.study.study - INFO - Trial 177 finished with value: 0.08659481532367433 and parameters: {'n_layers': 1, 'embedding_dim': 256, 'lr': 0.0001292759433351309, 'lambda_val': 0.0006761519950643358, 'batch_size': 3524, 'optimizer': 'RMSprop'}. Best is trial 158 with value: 0.09120841290173527.
2026-05-11 10:55:24,479 - optuna.study.study - INFO - Trial 178 finished with value: 0.08423641895141187 and parameters: {'n_layers': 1, 'embedding_dim': 256, 'lr': 0.00016089387735875946, 'lambda_val': 0.000560423323239893, 'batch_size': 3538, 'optimizer': 'RMSprop'}. Best is trial 158 with value: 0.09120841290173527.
2026-05-11 10:55:31,301 - optuna.study._optimize - INFO - Trial 179 pruned. 
2026-05-11 10:55:38,557 - optuna.study._optimize - INFO - Trial 180 pruned. 
2026-05-11 10:55:43,237 - optuna.study._optimize - INFO - Trial 181 pruned. 
2026-05-11 10:56:31,522 - optuna.study.study - INFO - Trial 182 finished with value: 0.07631818372855723 and parameters: {'n_layers': 1, 'embedding_dim': 256, 'lr': 0.00011602520600797897, 'lambda_val': 0.0004859045118280919, 'batch_size': 3609, 'optimizer': 'RMSprop'}. Best is trial 158 with value: 0.09120841290173527.
2026-05-11 10:57:08,434 - optuna.study.study - INFO - Trial 183 finished with value: 0.07601729411866522 and parameters: {'n_layers': 1, 'embedding_dim': 256, 'lr': 0.00012254645874270717, 'lambda_val': 0.0004787382619726273, 'batch_size': 3618, 'optimizer': 'RMSprop'}. Best is trial 158 with value: 0.09120841290173527.
2026-05-11 10:57:45,529 - optuna.study.study - INFO - Trial 184 finished with value: 0.07188107266992078 and parameters: {'n_layers': 1, 'embedding_dim': 256, 'lr': 0.00014967439457055985, 'lambda_val': 0.00048245024829294425, 'batch_size': 3634, 'optimizer': 'RMSprop'}. Best is trial 158 with value: 0.09120841290173527.
2026-05-11 10:58:23,112 - optuna.study.study - INFO - Trial 185 finished with value: 0.07699666265732057 and parameters: {'n_layers': 1, 'embedding_dim': 256, 'lr': 0.00011906024314563807, 'lambda_val': 0.0006943221490507393, 'batch_size': 3691, 'optimizer': 'RMSprop'}. Best is trial 158 with value: 0.09120841290173527.
2026-05-11 10:59:00,095 - optuna.study.study - INFO - Trial 186 finished with value: 0.08046261874871982 and parameters: {'n_layers': 1, 'embedding_dim': 256, 'lr': 0.00011626915419768734, 'lambda_val': 0.0010003249413325357, 'batch_size': 3808, 'optimizer': 'RMSprop'}. Best is trial 158 with value: 0.09120841290173527.
2026-05-11 10:59:04,854 - optuna.study._optimize - INFO - Trial 187 pruned. 
2026-05-11 10:59:42,313 - optuna.study.study - INFO - Trial 188 finished with value: 0.0681331256803171 and parameters: {'n_layers': 1, 'embedding_dim': 256, 'lr': 0.00012303527433173058, 'lambda_val': 0.0009869946405930135, 'batch_size': 3960, 'optimizer': 'RMSprop'}. Best is trial 158 with value: 0.09120841290173527.
2026-05-11 10:59:47,112 - optuna.study._optimize - INFO - Trial 189 pruned. 
2026-05-11 11:00:23,511 - optuna.study.study - INFO - Trial 190 finished with value: 0.07080108859512259 and parameters: {'n_layers': 1, 'embedding_dim': 256, 'lr': 0.00016714116196891107, 'lambda_val': 0.00042380012940360497, 'batch_size': 3704, 'optimizer': 'RMSprop'}. Best is trial 158 with value: 0.09120841290173527.
2026-05-11 11:00:28,736 - optuna.study._optimize - INFO - Trial 191 pruned. 
2026-05-11 11:01:05,289 - optuna.study.study - INFO - Trial 192 finished with value: 0.07180344479655365 and parameters: {'n_layers': 1, 'embedding_dim': 256, 'lr': 0.00021411656296438367, 'lambda_val': 0.001089583291983879, 'batch_size': 3594, 'optimizer': 'RMSprop'}. Best is trial 158 with value: 0.09120841290173527.
2026-05-11 11:01:42,442 - optuna.study.study - INFO - Trial 193 finished with value: 0.08001149128351558 and parameters: {'n_layers': 1, 'embedding_dim': 256, 'lr': 0.00012524029669214426, 'lambda_val': 0.000681362141404699, 'batch_size': 3679, 'optimizer': 'RMSprop'}. Best is trial 158 with value: 0.09120841290173527.
2026-05-11 11:02:18,766 - optuna.study.study - INFO - Trial 194 finished with value: 0.08412702689069425 and parameters: {'n_layers': 1, 'embedding_dim': 256, 'lr': 0.00013455581740848147, 'lambda_val': 0.0006354507031221168, 'batch_size': 3669, 'optimizer': 'RMSprop'}. Best is trial 158 with value: 0.09120841290173527.
2026-05-11 11:02:23,427 - optuna.study._optimize - INFO - Trial 195 pruned. 
2026-05-11 11:03:00,876 - optuna.study.study - INFO - Trial 196 finished with value: 0.07511186417816977 and parameters: {'n_layers': 1, 'embedding_dim': 256, 'lr': 0.00012688837648449757, 'lambda_val': 0.0005677311931510191, 'batch_size': 3764, 'optimizer': 'RMSprop'}. Best is trial 158 with value: 0.09120841290173527.
2026-05-11 11:03:04,780 - optuna.study._optimize - INFO - Trial 197 pruned. 
2026-05-11 11:03:52,458 - optuna.study.study - INFO - Trial 198 finished with value: 0.05099562943342887 and parameters: {'n_layers': 1, 'embedding_dim': 256, 'lr': 0.00037695061100770784, 'lambda_val': 0.0006670362408305649, 'batch_size': 3862, 'optimizer': 'RMSprop'}. Best is trial 158 with value: 0.09120841290173527.
2026-05-11 11:03:57,050 - optuna.study._optimize - INFO - Trial 199 pruned. 
2026-05-11 11:04:27,100 - root - INFO -   **** Training e_100K_1c3dcs_rand1
2026-05-11 11:04:27,113 - root - INFO -   **** Getting 56335/65410 random edges
2026-05-11 11:04:27,393 - optuna.storages._rdb.storage - INFO - A new study created in RDB with name: Study_e_100K_1c3dcs_rand1
2026-05-11 11:05:26,000 - optuna.study.study - INFO - Trial 0 finished with value: 0.0007406327797652657 and parameters: {'n_layers': 3, 'embedding_dim': 128, 'lr': 0.006075078718047611, 'lambda_val': 0.0002857280937160478, 'batch_size': 3741, 'optimizer': 'SGD'}. Best is trial 0 with value: 0.0007406327797652657.
2026-05-11 11:06:13,644 - optuna.study.study - INFO - Trial 1 finished with value: 0.015073944510992969 and parameters: {'n_layers': 2, 'embedding_dim': 96, 'lr': 0.0001056471690435442, 'lambda_val': 0.04038783778197452, 'batch_size': 638, 'optimizer': 'RMSprop'}. Best is trial 1 with value: 0.015073944510992969.
2026-05-11 11:07:09,041 - optuna.study.study - INFO - Trial 2 finished with value: 0.001694098779343341 and parameters: {'n_layers': 3, 'embedding_dim': 32, 'lr': 0.015786876353010276, 'lambda_val': 0.00016518544411570668, 'batch_size': 3888, 'optimizer': 'SGD'}. Best is trial 1 with value: 0.015073944510992969.
2026-05-11 11:07:57,523 - optuna.study.study - INFO - Trial 3 finished with value: 0.061147238106261596 and parameters: {'n_layers': 1, 'embedding_dim': 96, 'lr': 8.188745877560859e-05, 'lambda_val': 0.007986188816876414, 'batch_size': 2967, 'optimizer': 'RMSprop'}. Best is trial 3 with value: 0.061147238106261596.
2026-05-11 11:08:29,232 - optuna.study.study - INFO - Trial 4 finished with value: 0.0031108656441072363 and parameters: {'n_layers': 2, 'embedding_dim': 96, 'lr': 0.0028128348738005095, 'lambda_val': 1.30537307639133e-06, 'batch_size': 1236, 'optimizer': 'SGD'}. Best is trial 3 with value: 0.061147238106261596.
2026-05-11 11:09:01,266 - optuna.study.study - INFO - Trial 5 finished with value: 0.05770884460011979 and parameters: {'n_layers': 1, 'embedding_dim': 128, 'lr': 0.01122775283991628, 'lambda_val': 0.01291982038219149, 'batch_size': 3558, 'optimizer': 'Adam'}. Best is trial 3 with value: 0.061147238106261596.
2026-05-11 11:09:39,103 - optuna.study.study - INFO - Trial 6 finished with value: 0.04857162687853619 and parameters: {'n_layers': 1, 'embedding_dim': 256, 'lr': 0.008588226993186314, 'lambda_val': 3.550264426753644e-05, 'batch_size': 3583, 'optimizer': 'Adam'}. Best is trial 3 with value: 0.061147238106261596.
2026-05-11 11:09:46,045 - optuna.study._optimize - INFO - Trial 7 pruned. 
2026-05-11 11:09:49,908 - optuna.study._optimize - INFO - Trial 8 pruned. 
2026-05-11 11:09:59,191 - optuna.study._optimize - INFO - Trial 9 pruned. 
2026-05-11 11:10:03,154 - optuna.study._optimize - INFO - Trial 10 pruned. 
2026-05-11 11:10:08,921 - optuna.study._optimize - INFO - Trial 11 pruned. 
2026-05-11 11:10:14,890 - optuna.study._optimize - INFO - Trial 12 pruned. 
2026-05-11 11:10:44,671 - optuna.study.study - INFO - Trial 13 finished with value: 0.033448931729695625 and parameters: {'n_layers': 1, 'embedding_dim': 32, 'lr': 0.0005232452120558711, 'lambda_val': 0.008521051664159384, 'batch_size': 2137, 'optimizer': 'RMSprop'}. Best is trial 3 with value: 0.061147238106261596.
2026-05-11 11:10:49,205 - optuna.study._optimize - INFO - Trial 14 pruned. 
2026-05-11 11:11:20,826 - optuna.study.study - INFO - Trial 15 finished with value: 0.04987628841687883 and parameters: {'n_layers': 1, 'embedding_dim': 128, 'lr': 0.0010248030825756585, 'lambda_val': 0.0174326809820876, 'batch_size': 2342, 'optimizer': 'Adam'}. Best is trial 3 with value: 0.061147238106261596.
2026-05-11 11:11:27,222 - optuna.study._optimize - INFO - Trial 16 pruned. 
2026-05-11 11:11:31,770 - optuna.study._optimize - INFO - Trial 17 pruned. 
2026-05-11 11:11:35,979 - optuna.study._optimize - INFO - Trial 18 pruned. 
2026-05-11 11:12:09,105 - optuna.study.study - INFO - Trial 19 finished with value: 0.027415876876333276 and parameters: {'n_layers': 2, 'embedding_dim': 64, 'lr': 0.0004311747287412095, 'lambda_val': 0.0012426049851201764, 'batch_size': 2670, 'optimizer': 'RMSprop'}. Best is trial 3 with value: 0.061147238106261596.
2026-05-11 11:12:13,702 - optuna.study._optimize - INFO - Trial 20 pruned. 
2026-05-11 11:12:43,354 - optuna.study.study - INFO - Trial 21 finished with value: 0.05600644156563836 and parameters: {'n_layers': 1, 'embedding_dim': 128, 'lr': 0.0009621416215309767, 'lambda_val': 0.007226539178350881, 'batch_size': 2177, 'optimizer': 'Adam'}. Best is trial 3 with value: 0.061147238106261596.
2026-05-11 11:13:23,490 - optuna.study.study - INFO - Trial 22 finished with value: 0.06516138693883447 and parameters: {'n_layers': 1, 'embedding_dim': 128, 'lr': 0.0021439561003152477, 'lambda_val': 0.005881529157929685, 'batch_size': 1902, 'optimizer': 'Adam'}. Best is trial 22 with value: 0.06516138693883447.
2026-05-11 11:13:53,168 - optuna.study.study - INFO - Trial 23 finished with value: 0.06845097277081641 and parameters: {'n_layers': 1, 'embedding_dim': 128, 'lr': 0.0024484379245766326, 'lambda_val': 0.004714168707375757, 'batch_size': 1859, 'optimizer': 'Adam'}. Best is trial 23 with value: 0.06845097277081641.
2026-05-11 11:13:57,589 - optuna.study._optimize - INFO - Trial 24 pruned. 
2026-05-11 11:14:36,115 - optuna.study.study - INFO - Trial 25 finished with value: 0.05930052516196937 and parameters: {'n_layers': 1, 'embedding_dim': 96, 'lr': 0.00021560856184694568, 'lambda_val': 0.004351454001027741, 'batch_size': 1745, 'optimizer': 'Adam'}. Best is trial 23 with value: 0.06845097277081641.
2026-05-11 11:14:40,582 - optuna.study._optimize - INFO - Trial 26 pruned. 
2026-05-11 11:15:10,573 - optuna.study.study - INFO - Trial 27 finished with value: 0.058341309938192705 and parameters: {'n_layers': 1, 'embedding_dim': 128, 'lr': 0.0015745371565127194, 'lambda_val': 0.0007605441136634656, 'batch_size': 1954, 'optimizer': 'RMSprop'}. Best is trial 23 with value: 0.06845097277081641.
2026-05-11 11:15:15,319 - optuna.study._optimize - INFO - Trial 28 pruned. 
2026-05-11 11:15:58,030 - optuna.study.study - INFO - Trial 29 finished with value: 0.06444484085415908 and parameters: {'n_layers': 1, 'embedding_dim': 128, 'lr': 0.00661862953422038, 'lambda_val': 0.0003222539948804244, 'batch_size': 2486, 'optimizer': 'RMSprop'}. Best is trial 23 with value: 0.06845097277081641.
2026-05-11 11:16:03,085 - optuna.study._optimize - INFO - Trial 30 pruned. 
2026-05-11 11:16:07,338 - optuna.study._optimize - INFO - Trial 31 pruned. 
2026-05-11 11:16:38,140 - optuna.study.study - INFO - Trial 32 finished with value: 0.06780009581208833 and parameters: {'n_layers': 1, 'embedding_dim': 128, 'lr': 0.0018408994703660042, 'lambda_val': 0.004198711873965431, 'batch_size': 2562, 'optimizer': 'RMSprop'}. Best is trial 23 with value: 0.06845097277081641.
2026-05-11 11:17:08,074 - optuna.study.study - INFO - Trial 33 finished with value: 0.06508725165590927 and parameters: {'n_layers': 1, 'embedding_dim': 128, 'lr': 0.0021571486100891925, 'lambda_val': 0.00040808647649496853, 'batch_size': 2026, 'optimizer': 'RMSprop'}. Best is trial 23 with value: 0.06845097277081641.
2026-05-11 11:17:37,682 - optuna.study.study - INFO - Trial 34 finished with value: 0.0736487726067288 and parameters: {'n_layers': 1, 'embedding_dim': 128, 'lr': 0.00204300343304514, 'lambda_val': 0.003451084197626237, 'batch_size': 2091, 'optimizer': 'RMSprop'}. Best is trial 34 with value: 0.0736487726067288.
2026-05-11 11:17:42,693 - optuna.study._optimize - INFO - Trial 35 pruned. 
2026-05-11 11:17:47,186 - optuna.study._optimize - INFO - Trial 36 pruned. 
2026-05-11 11:17:51,548 - optuna.study._optimize - INFO - Trial 37 pruned. 
2026-05-11 11:18:21,842 - optuna.study.study - INFO - Trial 38 finished with value: 0.08258523247470743 and parameters: {'n_layers': 1, 'embedding_dim': 128, 'lr': 0.01377865032984874, 'lambda_val': 0.001556713318538285, 'batch_size': 1737, 'optimizer': 'Adam'}. Best is trial 38 with value: 0.08258523247470743.
2026-05-11 11:18:56,237 - optuna.study.study - INFO - Trial 39 finished with value: 0.08402140200033552 and parameters: {'n_layers': 1, 'embedding_dim': 256, 'lr': 0.01442693879928701, 'lambda_val': 0.001144116461304867, 'batch_size': 1380, 'optimizer': 'RMSprop'}. Best is trial 39 with value: 0.08402140200033552.
2026-05-11 11:19:02,037 - optuna.study._optimize - INFO - Trial 40 pruned. 
2026-05-11 11:19:06,710 - optuna.study._optimize - INFO - Trial 41 pruned. 
2026-05-11 11:19:40,845 - optuna.study.study - INFO - Trial 42 finished with value: 0.08396475980115728 and parameters: {'n_layers': 1, 'embedding_dim': 256, 'lr': 0.010724814328511757, 'lambda_val': 0.0007534124524182719, 'batch_size': 1732, 'optimizer': 'RMSprop'}. Best is trial 39 with value: 0.08402140200033552.
2026-05-11 11:20:18,681 - optuna.study.study - INFO - Trial 43 finished with value: 0.08492930358488521 and parameters: {'n_layers': 1, 'embedding_dim': 256, 'lr': 0.011110080553004938, 'lambda_val': 0.0006884512112555019, 'batch_size': 1692, 'optimizer': 'RMSprop'}. Best is trial 43 with value: 0.08492930358488521.
2026-05-11 11:20:55,110 - optuna.study.study - INFO - Trial 44 finished with value: 0.08488993120576394 and parameters: {'n_layers': 1, 'embedding_dim': 256, 'lr': 0.009936369177772193, 'lambda_val': 0.000691311713235525, 'batch_size': 1675, 'optimizer': 'RMSprop'}. Best is trial 43 with value: 0.08492930358488521.
2026-05-11 11:21:29,790 - optuna.study.study - INFO - Trial 45 finished with value: 0.08676319267978058 and parameters: {'n_layers': 1, 'embedding_dim': 256, 'lr': 0.011663913541728257, 'lambda_val': 0.0007147145471737458, 'batch_size': 1693, 'optimizer': 'RMSprop'}. Best is trial 45 with value: 0.08676319267978058.
2026-05-11 11:21:33,815 - optuna.study._optimize - INFO - Trial 46 pruned. 
2026-05-11 11:21:40,269 - optuna.study._optimize - INFO - Trial 47 pruned. 
2026-05-11 11:21:59,403 - optuna.study._optimize - INFO - Trial 48 pruned. 
2026-05-11 11:22:10,157 - optuna.study._optimize - INFO - Trial 49 pruned. 
2026-05-11 11:22:14,387 - optuna.study._optimize - INFO - Trial 50 pruned. 
2026-05-11 11:22:48,474 - optuna.study.study - INFO - Trial 51 finished with value: 0.0855128860948867 and parameters: {'n_layers': 1, 'embedding_dim': 256, 'lr': 0.014300216214013445, 'lambda_val': 0.001918965512758176, 'batch_size': 1453, 'optimizer': 'RMSprop'}. Best is trial 45 with value: 0.08676319267978058.
2026-05-11 11:22:52,794 - optuna.study._optimize - INFO - Trial 52 pruned. 
2026-05-11 11:22:57,737 - optuna.study._optimize - INFO - Trial 53 pruned. 
2026-05-11 11:23:02,066 - optuna.study._optimize - INFO - Trial 54 pruned. 
2026-05-11 11:23:06,469 - optuna.study._optimize - INFO - Trial 55 pruned. 
2026-05-11 11:23:42,963 - optuna.study.study - INFO - Trial 56 finished with value: 0.08931210353334987 and parameters: {'n_layers': 1, 'embedding_dim': 256, 'lr': 0.0053168091637075055, 'lambda_val': 0.0012289482680292385, 'batch_size': 1787, 'optimizer': 'RMSprop'}. Best is trial 56 with value: 0.08931210353334987.
2026-05-11 11:24:16,998 - optuna.study.study - INFO - Trial 57 finished with value: 0.0800203978963735 and parameters: {'n_layers': 1, 'embedding_dim': 256, 'lr': 0.004736594958265904, 'lambda_val': 0.00214354243466057, 'batch_size': 1312, 'optimizer': 'RMSprop'}. Best is trial 56 with value: 0.08931210353334987.
2026-05-11 11:24:22,491 - optuna.study._optimize - INFO - Trial 58 pruned. 
2026-05-11 11:25:04,811 - optuna.study.study - INFO - Trial 59 finished with value: 0.07803558404421417 and parameters: {'n_layers': 1, 'embedding_dim': 256, 'lr': 0.0033201006233269936, 'lambda_val': 0.0010309570436033441, 'batch_size': 1523, 'optimizer': 'RMSprop'}. Best is trial 56 with value: 0.08931210353334987.
2026-05-11 11:25:09,063 - optuna.study._optimize - INFO - Trial 60 pruned. 
2026-05-11 11:25:43,589 - optuna.study.study - INFO - Trial 61 finished with value: 0.08551654973550668 and parameters: {'n_layers': 1, 'embedding_dim': 256, 'lr': 0.010338695064800143, 'lambda_val': 0.0005662669030576984, 'batch_size': 1783, 'optimizer': 'RMSprop'}. Best is trial 56 with value: 0.08931210353334987.
2026-05-11 11:26:19,035 - optuna.study.study - INFO - Trial 62 finished with value: 0.08587202815544302 and parameters: {'n_layers': 1, 'embedding_dim': 256, 'lr': 0.005467963317092434, 'lambda_val': 0.0012394625964506363, 'batch_size': 1972, 'optimizer': 'RMSprop'}. Best is trial 56 with value: 0.08931210353334987.
2026-05-11 11:26:53,174 - optuna.study.study - INFO - Trial 63 finished with value: 0.07367503825149939 and parameters: {'n_layers': 1, 'embedding_dim': 256, 'lr': 0.0053227803637348895, 'lambda_val': 0.00045603798394704603, 'batch_size': 1949, 'optimizer': 'RMSprop'}. Best is trial 56 with value: 0.08931210353334987.
2026-05-11 11:27:27,672 - optuna.study.study - INFO - Trial 64 finished with value: 0.08352426726411258 and parameters: {'n_layers': 1, 'embedding_dim': 256, 'lr': 0.008099779381200935, 'lambda_val': 0.0019389767668206023, 'batch_size': 1840, 'optimizer': 'RMSprop'}. Best is trial 56 with value: 0.08931210353334987.
