2026-05-11 04:23:54,806 - optuna.study.study - INFO - Trial 124 finished with value: 0.12190416201655076 and parameters: {'n_layers': 1, 'embedding_dim': 256, 'lr': 0.00021725356527340644, 'lambda_val': 1.1450951162223462e-05, 'batch_size': 513, 'optimizer': 'Adam'}. Best is trial 122 with value: 0.1295669096186746.
2026-05-11 04:23:58,998 - optuna.study._optimize - INFO - Trial 125 pruned. 
2026-05-11 04:24:32,206 - optuna.study.study - INFO - Trial 126 finished with value: 0.1203224456452422 and parameters: {'n_layers': 1, 'embedding_dim': 256, 'lr': 0.00021213766125360324, 'lambda_val': 5.594564882777254e-06, 'batch_size': 590, 'optimizer': 'Adam'}. Best is trial 122 with value: 0.1295669096186746.
2026-05-11 04:25:05,343 - optuna.study.study - INFO - Trial 127 finished with value: 0.13030520698613005 and parameters: {'n_layers': 1, 'embedding_dim': 256, 'lr': 0.00021391840724612382, 'lambda_val': 8.189335383473967e-06, 'batch_size': 585, 'optimizer': 'Adam'}. Best is trial 127 with value: 0.13030520698613005.
2026-05-11 04:25:38,952 - optuna.study.study - INFO - Trial 128 finished with value: 0.07066649527292443 and parameters: {'n_layers': 1, 'embedding_dim': 256, 'lr': 0.00062166651268986, 'lambda_val': 6.517378917996626e-06, 'batch_size': 562, 'optimizer': 'Adam'}. Best is trial 127 with value: 0.13030520698613005.
2026-05-11 04:26:12,969 - optuna.study.study - INFO - Trial 129 finished with value: 0.09424217353364939 and parameters: {'n_layers': 1, 'embedding_dim': 256, 'lr': 0.00030449169970937334, 'lambda_val': 4.3209180264735045e-06, 'batch_size': 591, 'optimizer': 'Adam'}. Best is trial 127 with value: 0.13030520698613005.
2026-05-11 04:26:55,475 - optuna.study.study - INFO - Trial 130 finished with value: 0.11660428809748755 and parameters: {'n_layers': 1, 'embedding_dim': 256, 'lr': 0.00020336434076890416, 'lambda_val': 9.607656531377735e-06, 'batch_size': 606, 'optimizer': 'Adam'}. Best is trial 127 with value: 0.13030520698613005.
2026-05-11 04:27:29,137 - optuna.study.study - INFO - Trial 131 finished with value: 0.11630211876957408 and parameters: {'n_layers': 1, 'embedding_dim': 256, 'lr': 0.0001933252638207732, 'lambda_val': 9.48820693675752e-06, 'batch_size': 591, 'optimizer': 'Adam'}. Best is trial 127 with value: 0.13030520698613005.
2026-05-11 04:27:33,406 - optuna.study._optimize - INFO - Trial 132 pruned. 
2026-05-11 04:28:06,273 - optuna.study.study - INFO - Trial 133 finished with value: 0.12038985399045696 and parameters: {'n_layers': 1, 'embedding_dim': 256, 'lr': 0.00018796518629445199, 'lambda_val': 5.6022273576384735e-06, 'batch_size': 599, 'optimizer': 'Adam'}. Best is trial 127 with value: 0.13030520698613005.
2026-05-11 04:28:39,729 - optuna.study.study - INFO - Trial 134 finished with value: 0.0782603219235223 and parameters: {'n_layers': 1, 'embedding_dim': 256, 'lr': 0.0003708425766061147, 'lambda_val': 6.177690217531994e-06, 'batch_size': 600, 'optimizer': 'Adam'}. Best is trial 127 with value: 0.13030520698613005.
2026-05-11 04:29:14,021 - optuna.study.study - INFO - Trial 135 finished with value: 0.11218807525795735 and parameters: {'n_layers': 1, 'embedding_dim': 256, 'lr': 0.00019257606213170358, 'lambda_val': 3.502960519107279e-06, 'batch_size': 723, 'optimizer': 'Adam'}. Best is trial 127 with value: 0.13030520698613005.
2026-05-11 04:29:47,184 - optuna.study.study - INFO - Trial 136 finished with value: 0.09597720382564107 and parameters: {'n_layers': 1, 'embedding_dim': 256, 'lr': 0.00029517375028736064, 'lambda_val': 5.17049721737795e-06, 'batch_size': 512, 'optimizer': 'Adam'}. Best is trial 127 with value: 0.13030520698613005.
2026-05-11 04:29:51,690 - optuna.study._optimize - INFO - Trial 137 pruned. 
2026-05-11 04:29:55,908 - optuna.study._optimize - INFO - Trial 138 pruned. 
2026-05-11 04:30:00,100 - optuna.study._optimize - INFO - Trial 139 pruned. 
2026-05-11 04:30:33,753 - optuna.study.study - INFO - Trial 140 finished with value: 0.07115785696804681 and parameters: {'n_layers': 1, 'embedding_dim': 256, 'lr': 0.0003881803593446799, 'lambda_val': 2.336218507785397e-06, 'batch_size': 952, 'optimizer': 'Adam'}. Best is trial 127 with value: 0.13030520698613005.
2026-05-11 04:31:07,784 - optuna.study.study - INFO - Trial 141 finished with value: 0.12292337767480399 and parameters: {'n_layers': 1, 'embedding_dim': 256, 'lr': 0.00019705337231753952, 'lambda_val': 3.0293346219826604e-06, 'batch_size': 735, 'optimizer': 'Adam'}. Best is trial 127 with value: 0.13030520698613005.
2026-05-11 04:31:12,374 - optuna.study._optimize - INFO - Trial 142 pruned. 
2026-05-11 04:31:16,501 - optuna.study._optimize - INFO - Trial 143 pruned. 
2026-05-11 04:31:59,005 - optuna.study.study - INFO - Trial 144 finished with value: 0.1110214653650407 and parameters: {'n_layers': 1, 'embedding_dim': 256, 'lr': 0.00022585582388295924, 'lambda_val': 4.210690109015065e-06, 'batch_size': 723, 'optimizer': 'Adam'}. Best is trial 127 with value: 0.13030520698613005.
2026-05-11 04:32:32,174 - optuna.study.study - INFO - Trial 145 finished with value: 0.10526412611187519 and parameters: {'n_layers': 1, 'embedding_dim': 256, 'lr': 0.0002716861384675244, 'lambda_val': 1.7720202922523823e-05, 'batch_size': 585, 'optimizer': 'Adam'}. Best is trial 127 with value: 0.13030520698613005.
2026-05-11 04:32:38,366 - optuna.study._optimize - INFO - Trial 146 pruned. 
2026-05-11 04:32:42,570 - optuna.study._optimize - INFO - Trial 147 pruned. 
2026-05-11 04:32:46,675 - optuna.study._optimize - INFO - Trial 148 pruned. 
2026-05-11 04:33:19,973 - optuna.study.study - INFO - Trial 149 finished with value: 0.0816832878217706 and parameters: {'n_layers': 1, 'embedding_dim': 256, 'lr': 0.00032984337076128676, 'lambda_val': 9.944814790159006e-06, 'batch_size': 631, 'optimizer': 'Adam'}. Best is trial 127 with value: 0.13030520698613005.
2026-05-11 04:33:53,208 - optuna.study.study - INFO - Trial 150 finished with value: 0.08113654399569432 and parameters: {'n_layers': 1, 'embedding_dim': 256, 'lr': 0.0004796153338570021, 'lambda_val': 1.1737187573946338e-05, 'batch_size': 708, 'optimizer': 'Adam'}. Best is trial 127 with value: 0.13030520698613005.
2026-05-11 04:34:26,982 - optuna.study.study - INFO - Trial 151 finished with value: 0.11000784877337776 and parameters: {'n_layers': 1, 'embedding_dim': 256, 'lr': 0.00019797691365376795, 'lambda_val': 3.490211665549157e-06, 'batch_size': 743, 'optimizer': 'Adam'}. Best is trial 127 with value: 0.13030520698613005.
2026-05-11 04:35:01,008 - optuna.study.study - INFO - Trial 152 finished with value: 0.1089192010994144 and parameters: {'n_layers': 1, 'embedding_dim': 256, 'lr': 0.000250349206582381, 'lambda_val': 1.8124973235816526e-06, 'batch_size': 590, 'optimizer': 'Adam'}. Best is trial 127 with value: 0.13030520698613005.
2026-05-11 04:35:35,474 - optuna.study.study - INFO - Trial 153 finished with value: 0.11442725292352098 and parameters: {'n_layers': 1, 'embedding_dim': 256, 'lr': 0.00019720458300307881, 'lambda_val': 7.391864254496733e-06, 'batch_size': 697, 'optimizer': 'Adam'}. Best is trial 127 with value: 0.13030520698613005.
2026-05-11 04:35:39,676 - optuna.study._optimize - INFO - Trial 154 pruned. 
2026-05-11 04:36:12,883 - optuna.study.study - INFO - Trial 155 finished with value: 0.11177685714795842 and parameters: {'n_layers': 1, 'embedding_dim': 256, 'lr': 0.00021791584534488264, 'lambda_val': 5.666775461539521e-06, 'batch_size': 518, 'optimizer': 'Adam'}. Best is trial 127 with value: 0.13030520698613005.
2026-05-11 04:36:16,975 - optuna.study._optimize - INFO - Trial 156 pruned. 
2026-05-11 04:36:21,558 - optuna.study._optimize - INFO - Trial 157 pruned. 
2026-05-11 04:36:55,503 - optuna.study.study - INFO - Trial 158 finished with value: 0.07843100572191536 and parameters: {'n_layers': 1, 'embedding_dim': 256, 'lr': 0.0002983342361026432, 'lambda_val': 4.623270399021049e-06, 'batch_size': 1025, 'optimizer': 'Adam'}. Best is trial 127 with value: 0.13030520698613005.
2026-05-11 04:36:59,726 - optuna.study._optimize - INFO - Trial 159 pruned. 
2026-05-11 04:37:33,654 - optuna.study.study - INFO - Trial 160 finished with value: 0.10499278667296243 and parameters: {'n_layers': 1, 'embedding_dim': 256, 'lr': 0.0002470076551120267, 'lambda_val': 1.841976085382356e-05, 'batch_size': 687, 'optimizer': 'Adam'}. Best is trial 127 with value: 0.13030520698613005.
2026-05-11 04:38:07,098 - optuna.study.study - INFO - Trial 161 finished with value: 0.11796347389736092 and parameters: {'n_layers': 1, 'embedding_dim': 256, 'lr': 0.0002031580250209732, 'lambda_val': 3.064789343757456e-06, 'batch_size': 727, 'optimizer': 'Adam'}. Best is trial 127 with value: 0.13030520698613005.
2026-05-11 04:38:12,415 - optuna.study._optimize - INFO - Trial 162 pruned. 
2026-05-11 04:38:17,210 - optuna.study._optimize - INFO - Trial 163 pruned. 
2026-05-11 04:38:50,389 - optuna.study.study - INFO - Trial 164 finished with value: 0.1256117403879268 and parameters: {'n_layers': 1, 'embedding_dim': 256, 'lr': 0.00021929092274760044, 'lambda_val': 1.4028520157594802e-05, 'batch_size': 514, 'optimizer': 'Adam'}. Best is trial 127 with value: 0.13030520698613005.
2026-05-11 04:39:19,526 - optuna.study.study - INFO - Trial 165 finished with value: 0.11195764322296621 and parameters: {'n_layers': 1, 'embedding_dim': 128, 'lr': 0.0002747387551467869, 'lambda_val': 7.379025450481426e-06, 'batch_size': 514, 'optimizer': 'Adam'}. Best is trial 127 with value: 0.13030520698613005.
2026-05-11 04:39:24,037 - optuna.study._optimize - INFO - Trial 166 pruned. 
2026-05-11 04:39:30,434 - optuna.study._optimize - INFO - Trial 167 pruned. 
2026-05-11 04:39:34,616 - optuna.study._optimize - INFO - Trial 168 pruned. 
2026-05-11 04:40:10,112 - optuna.study.study - INFO - Trial 169 finished with value: 0.11148318964444924 and parameters: {'n_layers': 1, 'embedding_dim': 256, 'lr': 0.00022027686792476923, 'lambda_val': 4.0900172881684035e-06, 'batch_size': 577, 'optimizer': 'Adam'}. Best is trial 127 with value: 0.13030520698613005.
2026-05-11 04:40:14,850 - optuna.study._optimize - INFO - Trial 170 pruned. 
2026-05-11 04:40:48,244 - optuna.study.study - INFO - Trial 171 finished with value: 0.1146210806038477 and parameters: {'n_layers': 1, 'embedding_dim': 256, 'lr': 0.00020901031593153279, 'lambda_val': 1.2552401419056496e-05, 'batch_size': 637, 'optimizer': 'Adam'}. Best is trial 127 with value: 0.13030520698613005.
2026-05-11 04:40:52,413 - optuna.study._optimize - INFO - Trial 172 pruned. 
2026-05-11 04:41:28,136 - optuna.study.study - INFO - Trial 173 finished with value: 0.09570426976532369 and parameters: {'n_layers': 1, 'embedding_dim': 256, 'lr': 0.0002487744125299599, 'lambda_val': 9.40438175837956e-06, 'batch_size': 644, 'optimizer': 'Adam'}. Best is trial 127 with value: 0.13030520698613005.
2026-05-11 04:41:32,372 - optuna.study._optimize - INFO - Trial 174 pruned. 
2026-05-11 04:42:05,938 - optuna.study.study - INFO - Trial 175 finished with value: 0.09196513171483085 and parameters: {'n_layers': 1, 'embedding_dim': 256, 'lr': 0.0002989095566569272, 'lambda_val': 7.771555674359413e-06, 'batch_size': 591, 'optimizer': 'Adam'}. Best is trial 127 with value: 0.13030520698613005.
2026-05-11 04:42:39,405 - optuna.study.study - INFO - Trial 176 finished with value: 0.10969856546228617 and parameters: {'n_layers': 1, 'embedding_dim': 256, 'lr': 0.00019373997663982086, 'lambda_val': 5.188112547583492e-06, 'batch_size': 866, 'optimizer': 'Adam'}. Best is trial 127 with value: 0.13030520698613005.
2026-05-11 04:42:43,509 - optuna.study._optimize - INFO - Trial 177 pruned. 
2026-05-11 04:43:17,062 - optuna.study.study - INFO - Trial 178 finished with value: 0.10317753863550554 and parameters: {'n_layers': 1, 'embedding_dim': 256, 'lr': 0.0002541815330115584, 'lambda_val': 2.0000754925829245e-05, 'batch_size': 775, 'optimizer': 'Adam'}. Best is trial 127 with value: 0.13030520698613005.
2026-05-11 04:43:49,786 - optuna.study.study - INFO - Trial 179 finished with value: 0.07709591223250929 and parameters: {'n_layers': 1, 'embedding_dim': 256, 'lr': 0.0003989825029212794, 'lambda_val': 1.3045756624986119e-05, 'batch_size': 674, 'optimizer': 'Adam'}. Best is trial 127 with value: 0.13030520698613005.
2026-05-11 04:43:54,242 - optuna.study._optimize - INFO - Trial 180 pruned. 
2026-05-11 04:43:58,580 - optuna.study._optimize - INFO - Trial 181 pruned. 
2026-05-11 04:44:02,821 - optuna.study._optimize - INFO - Trial 182 pruned. 
2026-05-11 04:44:36,218 - optuna.study.study - INFO - Trial 183 finished with value: 0.10334329756283656 and parameters: {'n_layers': 1, 'embedding_dim': 256, 'lr': 0.00021973730301622362, 'lambda_val': 6.735512769536324e-06, 'batch_size': 693, 'optimizer': 'Adam'}. Best is trial 127 with value: 0.13030520698613005.
2026-05-11 04:45:09,166 - optuna.study.study - INFO - Trial 184 finished with value: 0.09045417708566253 and parameters: {'n_layers': 1, 'embedding_dim': 256, 'lr': 0.00029837629018863423, 'lambda_val': 1.1379625860868206e-05, 'batch_size': 631, 'optimizer': 'Adam'}. Best is trial 127 with value: 0.13030520698613005.
2026-05-11 04:45:42,983 - optuna.study.study - INFO - Trial 185 finished with value: 0.10366253491058706 and parameters: {'n_layers': 1, 'embedding_dim': 256, 'lr': 0.0002107683690718127, 'lambda_val': 2.00998738606595e-05, 'batch_size': 778, 'optimizer': 'Adam'}. Best is trial 127 with value: 0.13030520698613005.
2026-05-11 04:45:47,346 - optuna.study._optimize - INFO - Trial 186 pruned. 
2026-05-11 04:45:51,801 - optuna.study._optimize - INFO - Trial 187 pruned. 
2026-05-11 04:45:56,005 - optuna.study._optimize - INFO - Trial 188 pruned. 
2026-05-11 04:46:00,187 - optuna.study._optimize - INFO - Trial 189 pruned. 
2026-05-11 04:46:33,220 - optuna.study.study - INFO - Trial 190 finished with value: 0.08535768179836634 and parameters: {'n_layers': 1, 'embedding_dim': 256, 'lr': 0.0002575015653031562, 'lambda_val': 5.242250295787908e-06, 'batch_size': 914, 'optimizer': 'Adam'}. Best is trial 127 with value: 0.13030520698613005.
2026-05-11 04:46:37,831 - optuna.study._optimize - INFO - Trial 191 pruned. 
2026-05-11 04:47:10,530 - optuna.study.study - INFO - Trial 192 finished with value: 0.10184202998128775 and parameters: {'n_layers': 1, 'embedding_dim': 256, 'lr': 0.0002261771389704725, 'lambda_val': 7.150887620902744e-06, 'batch_size': 651, 'optimizer': 'Adam'}. Best is trial 127 with value: 0.13030520698613005.
2026-05-11 04:47:14,967 - optuna.study._optimize - INFO - Trial 193 pruned. 
2026-05-11 04:47:19,116 - optuna.study._optimize - INFO - Trial 194 pruned. 
2026-05-11 04:48:01,967 - optuna.study.study - INFO - Trial 195 finished with value: 0.08355230026919039 and parameters: {'n_layers': 1, 'embedding_dim': 256, 'lr': 0.00027533263336310365, 'lambda_val': 1.041932584450504e-05, 'batch_size': 1492, 'optimizer': 'Adam'}. Best is trial 127 with value: 0.13030520698613005.
2026-05-11 04:48:29,508 - optuna.study.study - INFO - Trial 196 finished with value: 0.08849277444993542 and parameters: {'n_layers': 1, 'embedding_dim': 64, 'lr': 0.00033592665289867914, 'lambda_val': 4.911263125407185e-06, 'batch_size': 703, 'optimizer': 'Adam'}. Best is trial 127 with value: 0.13030520698613005.
2026-05-11 04:48:33,659 - optuna.study._optimize - INFO - Trial 197 pruned. 
2026-05-11 04:48:38,263 - optuna.study._optimize - INFO - Trial 198 pruned. 
2026-05-11 04:48:42,628 - optuna.study._optimize - INFO - Trial 199 pruned. 
2026-05-11 04:49:09,941 - root - INFO -   **** Training e_100K_1c2dcs_rand2
2026-05-11 04:49:09,952 - root - INFO -   **** Getting 54402/65410 random edges
2026-05-11 04:49:10,057 - optuna.storages._rdb.storage - INFO - A new study created in RDB with name: Study_e_100K_1c2dcs_rand2
2026-05-11 04:49:54,266 - optuna.study.study - INFO - Trial 0 finished with value: 0.0479142996643186 and parameters: {'n_layers': 2, 'embedding_dim': 256, 'lr': 0.043660454907347164, 'lambda_val': 0.00017109716383169695, 'batch_size': 3825, 'optimizer': 'RMSprop'}. Best is trial 0 with value: 0.0479142996643186.
2026-05-11 04:50:39,424 - optuna.study.study - INFO - Trial 1 finished with value: 0.01958012763010002 and parameters: {'n_layers': 1, 'embedding_dim': 256, 'lr': 0.08983654378586069, 'lambda_val': 0.06949785740226451, 'batch_size': 3578, 'optimizer': 'Adam'}. Best is trial 0 with value: 0.0479142996643186.
2026-05-11 04:51:22,963 - optuna.study.study - INFO - Trial 2 finished with value: 0.040344519290455357 and parameters: {'n_layers': 4, 'embedding_dim': 128, 'lr': 0.07683795364448173, 'lambda_val': 9.268973643765121e-05, 'batch_size': 2038, 'optimizer': 'RMSprop'}. Best is trial 0 with value: 0.0479142996643186.
2026-05-11 04:51:57,002 - optuna.study.study - INFO - Trial 3 finished with value: 0.001985575264716174 and parameters: {'n_layers': 4, 'embedding_dim': 32, 'lr': 0.02020490338228937, 'lambda_val': 2.7041652234591944e-06, 'batch_size': 3770, 'optimizer': 'SGD'}. Best is trial 0 with value: 0.0479142996643186.
2026-05-11 04:52:23,320 - optuna.study.study - INFO - Trial 4 finished with value: 0.0013810757899010992 and parameters: {'n_layers': 1, 'embedding_dim': 32, 'lr': 0.005485560644220279, 'lambda_val': 1.5344515050323802e-05, 'batch_size': 1422, 'optimizer': 'SGD'}. Best is trial 0 with value: 0.0479142996643186.
2026-05-11 04:52:27,578 - optuna.study._optimize - INFO - Trial 5 pruned. 
2026-05-11 04:53:11,414 - optuna.study.study - INFO - Trial 6 finished with value: 0.021245054235006163 and parameters: {'n_layers': 4, 'embedding_dim': 128, 'lr': 0.0002927628293554957, 'lambda_val': 7.922445615410441e-05, 'batch_size': 1345, 'optimizer': 'Adam'}. Best is trial 0 with value: 0.0479142996643186.
2026-05-11 04:53:47,982 - optuna.study.study - INFO - Trial 7 finished with value: 0.02025633681521032 and parameters: {'n_layers': 4, 'embedding_dim': 64, 'lr': 0.003330734084059174, 'lambda_val': 0.003111646411443722, 'batch_size': 1280, 'optimizer': 'RMSprop'}. Best is trial 0 with value: 0.0479142996643186.
2026-05-11 04:53:51,808 - optuna.study._optimize - INFO - Trial 8 pruned. 
2026-05-11 04:54:34,109 - optuna.study.study - INFO - Trial 9 finished with value: 0.039134159386267665 and parameters: {'n_layers': 2, 'embedding_dim': 256, 'lr': 0.00031224563887035403, 'lambda_val': 0.000265190560453662, 'batch_size': 635, 'optimizer': 'Adam'}. Best is trial 0 with value: 0.0479142996643186.
2026-05-11 04:54:38,113 - optuna.study._optimize - INFO - Trial 10 pruned. 
2026-05-11 04:55:21,666 - optuna.study.study - INFO - Trial 11 finished with value: 0.03960482974270531 and parameters: {'n_layers': 3, 'embedding_dim': 128, 'lr': 0.057355222732245845, 'lambda_val': 6.74871772207844e-05, 'batch_size': 2416, 'optimizer': 'RMSprop'}. Best is trial 0 with value: 0.0479142996643186.
2026-05-11 04:56:14,500 - optuna.study.study - INFO - Trial 12 finished with value: 0.026735473965519285 and parameters: {'n_layers': 3, 'embedding_dim': 256, 'lr': 0.02805836790854556, 'lambda_val': 1.999337908600792e-05, 'batch_size': 3070, 'optimizer': 'RMSprop'}. Best is trial 0 with value: 0.0479142996643186.
2026-05-11 04:56:45,736 - optuna.study.study - INFO - Trial 13 finished with value: 0.02215762405219531 and parameters: {'n_layers': 2, 'embedding_dim': 96, 'lr': 0.0008551031132787956, 'lambda_val': 0.0003542790437013663, 'batch_size': 2127, 'optimizer': 'RMSprop'}. Best is trial 0 with value: 0.0479142996643186.
2026-05-11 04:57:11,626 - optuna.study._optimize - INFO - Trial 14 pruned. 
2026-05-11 04:57:15,991 - optuna.study._optimize - INFO - Trial 15 pruned. 
2026-05-11 04:57:30,745 - optuna.study._optimize - INFO - Trial 16 pruned. 
2026-05-11 04:58:21,569 - optuna.study.study - INFO - Trial 17 finished with value: 0.039298890527978206 and parameters: {'n_layers': 3, 'embedding_dim': 256, 'lr': 0.014136906443116073, 'lambda_val': 6.0509399061927064e-05, 'batch_size': 3205, 'optimizer': 'RMSprop'}. Best is trial 0 with value: 0.0479142996643186.
2026-05-11 04:58:54,116 - optuna.study.study - INFO - Trial 18 finished with value: 0.038732769316679495 and parameters: {'n_layers': 2, 'embedding_dim': 96, 'lr': 8.589152913582001e-05, 'lambda_val': 0.0008683765122112769, 'batch_size': 2510, 'optimizer': 'RMSprop'}. Best is trial 0 with value: 0.0479142996643186.
2026-05-11 04:59:22,116 - optuna.study.study - INFO - Trial 19 finished with value: 0.05473347525250171 and parameters: {'n_layers': 1, 'embedding_dim': 32, 'lr': 0.0427090935518955, 'lambda_val': 0.006133347170815401, 'batch_size': 1835, 'optimizer': 'Adam'}. Best is trial 19 with value: 0.05473347525250171.
2026-05-11 04:59:49,358 - optuna.study.study - INFO - Trial 20 finished with value: 0.05742616738537144 and parameters: {'n_layers': 1, 'embedding_dim': 32, 'lr': 0.008010047690813123, 'lambda_val': 0.010762507907022508, 'batch_size': 1752, 'optimizer': 'Adam'}. Best is trial 20 with value: 0.05742616738537144.
2026-05-11 05:00:15,580 - optuna.study.study - INFO - Trial 21 finished with value: 0.048051925009798165 and parameters: {'n_layers': 1, 'embedding_dim': 32, 'lr': 0.011348330705068377, 'lambda_val': 0.014288455939631562, 'batch_size': 886, 'optimizer': 'Adam'}. Best is trial 20 with value: 0.05742616738537144.
2026-05-11 05:00:54,496 - optuna.study.study - INFO - Trial 22 finished with value: 0.04806813691083735 and parameters: {'n_layers': 1, 'embedding_dim': 32, 'lr': 0.009570632449407365, 'lambda_val': 0.021927111373631507, 'batch_size': 512, 'optimizer': 'Adam'}. Best is trial 20 with value: 0.05742616738537144.
2026-05-11 05:00:57,858 - optuna.study._optimize - INFO - Trial 23 pruned. 
2026-05-11 05:01:26,516 - optuna.study.study - INFO - Trial 24 finished with value: 0.05267960240720196 and parameters: {'n_layers': 1, 'embedding_dim': 32, 'lr': 0.007531651233698887, 'lambda_val': 0.014788516492775386, 'batch_size': 995, 'optimizer': 'Adam'}. Best is trial 20 with value: 0.05742616738537144.
