2026-05-11 09:30:22,868 - optuna.study.study - INFO - Trial 133 finished with value: 0.08164517634681663 and parameters: {'n_layers': 1, 'embedding_dim': 256, 'lr': 0.0002552367323995481, 'lambda_val': 0.0004615110742863561, 'batch_size': 1017, 'optimizer': 'Adam'}. Best is trial 15 with value: 0.12860431361188532.
2026-05-11 09:31:04,935 - optuna.study.study - INFO - Trial 134 finished with value: 0.08109723478869878 and parameters: {'n_layers': 1, 'embedding_dim': 256, 'lr': 0.000368066994031328, 'lambda_val': 3.070492628813853e-05, 'batch_size': 784, 'optimizer': 'Adam'}. Best is trial 15 with value: 0.12860431361188532.
2026-05-11 09:31:09,197 - optuna.study._optimize - INFO - Trial 135 pruned. 
2026-05-11 09:31:13,615 - optuna.study._optimize - INFO - Trial 136 pruned. 
2026-05-11 09:31:44,871 - optuna.study.study - INFO - Trial 137 finished with value: 0.06856452959604797 and parameters: {'n_layers': 1, 'embedding_dim': 128, 'lr': 0.00026527972144308414, 'lambda_val': 0.00014020275409448423, 'batch_size': 2863, 'optimizer': 'Adam'}. Best is trial 15 with value: 0.12860431361188532.
2026-05-11 09:32:19,197 - optuna.study.study - INFO - Trial 138 finished with value: 0.07415746168836296 and parameters: {'n_layers': 1, 'embedding_dim': 256, 'lr': 0.0005593377983676278, 'lambda_val': 0.00021505567052707478, 'batch_size': 1101, 'optimizer': 'Adam'}. Best is trial 15 with value: 0.12860431361188532.
2026-05-11 09:32:53,316 - optuna.study.study - INFO - Trial 139 finished with value: 0.07533979791871852 and parameters: {'n_layers': 1, 'embedding_dim': 256, 'lr': 0.0003799169256476593, 'lambda_val': 1.6884818912210876e-05, 'batch_size': 1359, 'optimizer': 'Adam'}. Best is trial 15 with value: 0.12860431361188532.
2026-05-11 09:32:57,024 - optuna.study._optimize - INFO - Trial 140 pruned. 
2026-05-11 09:33:01,409 - optuna.study._optimize - INFO - Trial 141 pruned. 
2026-05-11 09:33:05,738 - optuna.study._optimize - INFO - Trial 142 pruned. 
2026-05-11 09:33:12,524 - optuna.study._optimize - INFO - Trial 143 pruned. 
2026-05-11 09:33:52,475 - optuna.study.study - INFO - Trial 144 finished with value: 0.07480795577846369 and parameters: {'n_layers': 1, 'embedding_dim': 256, 'lr': 0.0003313482133357951, 'lambda_val': 0.0002750371408633978, 'batch_size': 1060, 'optimizer': 'Adam'}. Best is trial 15 with value: 0.12860431361188532.
2026-05-11 09:33:58,425 - optuna.study._optimize - INFO - Trial 145 pruned. 
2026-05-11 09:34:32,265 - optuna.study.study - INFO - Trial 146 finished with value: 0.09671970525263289 and parameters: {'n_layers': 1, 'embedding_dim': 256, 'lr': 0.0002620557348318988, 'lambda_val': 7.438048881462679e-06, 'batch_size': 913, 'optimizer': 'Adam'}. Best is trial 15 with value: 0.12860431361188532.
2026-05-11 09:34:36,442 - optuna.study._optimize - INFO - Trial 147 pruned. 
2026-05-11 09:34:41,212 - optuna.study._optimize - INFO - Trial 148 pruned. 
2026-05-11 09:35:15,242 - optuna.study.study - INFO - Trial 149 finished with value: 0.07779290602846842 and parameters: {'n_layers': 1, 'embedding_dim': 256, 'lr': 0.00038016571752548024, 'lambda_val': 1.7264223505940855e-06, 'batch_size': 715, 'optimizer': 'Adam'}. Best is trial 15 with value: 0.12860431361188532.
2026-05-11 09:35:19,625 - optuna.study._optimize - INFO - Trial 150 pruned. 
2026-05-11 09:35:24,121 - optuna.study._optimize - INFO - Trial 151 pruned. 
2026-05-11 09:35:28,421 - optuna.study._optimize - INFO - Trial 152 pruned. 
2026-05-11 09:35:32,855 - optuna.study._optimize - INFO - Trial 153 pruned. 
2026-05-11 09:35:37,167 - optuna.study._optimize - INFO - Trial 154 pruned. 
2026-05-11 09:36:11,611 - optuna.study.study - INFO - Trial 155 finished with value: 0.07684842061763021 and parameters: {'n_layers': 1, 'embedding_dim': 256, 'lr': 0.0003398543937194004, 'lambda_val': 1.1715677258261092e-05, 'batch_size': 1095, 'optimizer': 'Adam'}. Best is trial 15 with value: 0.12860431361188532.
2026-05-11 09:36:17,558 - optuna.study._optimize - INFO - Trial 156 pruned. 
2026-05-11 09:36:21,975 - optuna.study._optimize - INFO - Trial 157 pruned. 
2026-05-11 09:36:26,537 - optuna.study._optimize - INFO - Trial 158 pruned. 
2026-05-11 09:36:30,832 - optuna.study._optimize - INFO - Trial 159 pruned. 
2026-05-11 09:36:35,829 - optuna.study._optimize - INFO - Trial 160 pruned. 
2026-05-11 09:37:09,732 - optuna.study.study - INFO - Trial 161 finished with value: 0.08168491500541548 and parameters: {'n_layers': 1, 'embedding_dim': 256, 'lr': 0.00034241635193892945, 'lambda_val': 0.0007362656433643859, 'batch_size': 673, 'optimizer': 'Adam'}. Best is trial 15 with value: 0.12860431361188532.
2026-05-11 09:37:15,838 - optuna.study._optimize - INFO - Trial 162 pruned. 
2026-05-11 09:37:49,771 - optuna.study.study - INFO - Trial 163 finished with value: 0.07001297513379688 and parameters: {'n_layers': 1, 'embedding_dim': 256, 'lr': 0.000499873964861042, 'lambda_val': 0.0008688271450204223, 'batch_size': 636, 'optimizer': 'Adam'}. Best is trial 15 with value: 0.12860431361188532.
2026-05-11 09:38:25,618 - optuna.study.study - INFO - Trial 164 finished with value: 0.0718855088838276 and parameters: {'n_layers': 1, 'embedding_dim': 256, 'lr': 0.0002322011121607241, 'lambda_val': 1.2326892008436504e-06, 'batch_size': 2458, 'optimizer': 'Adam'}. Best is trial 15 with value: 0.12860431361188532.
2026-05-11 09:38:30,033 - optuna.study._optimize - INFO - Trial 165 pruned. 
2026-05-11 09:39:04,285 - optuna.study.study - INFO - Trial 166 finished with value: 0.08614847434900018 and parameters: {'n_layers': 1, 'embedding_dim': 256, 'lr': 0.00039051471010692244, 'lambda_val': 1.6871722701820855e-06, 'batch_size': 531, 'optimizer': 'Adam'}. Best is trial 15 with value: 0.12860431361188532.
2026-05-11 09:39:33,812 - optuna.study.study - INFO - Trial 167 finished with value: 0.0823783311363436 and parameters: {'n_layers': 1, 'embedding_dim': 96, 'lr': 0.00039919511080879544, 'lambda_val': 2.2707256800334905e-06, 'batch_size': 576, 'optimizer': 'Adam'}. Best is trial 15 with value: 0.12860431361188532.
2026-05-11 09:40:02,633 - optuna.study.study - INFO - Trial 168 finished with value: 0.0587990585896031 and parameters: {'n_layers': 1, 'embedding_dim': 96, 'lr': 0.0006273821852917311, 'lambda_val': 1.8348729493181448e-06, 'batch_size': 540, 'optimizer': 'Adam'}. Best is trial 15 with value: 0.12860431361188532.
2026-05-11 09:40:07,361 - optuna.study._optimize - INFO - Trial 169 pruned. 
2026-05-11 09:40:34,981 - optuna.study.study - INFO - Trial 170 finished with value: 0.07854437753941693 and parameters: {'n_layers': 1, 'embedding_dim': 96, 'lr': 0.0004267764425443576, 'lambda_val': 3.669991272292878e-06, 'batch_size': 514, 'optimizer': 'RMSprop'}. Best is trial 15 with value: 0.12860431361188532.
2026-05-11 09:40:38,865 - optuna.study._optimize - INFO - Trial 171 pruned. 
2026-05-11 09:40:44,399 - optuna.study._optimize - INFO - Trial 172 pruned. 
2026-05-11 09:41:18,943 - optuna.study.study - INFO - Trial 173 finished with value: 0.08477016221993014 and parameters: {'n_layers': 1, 'embedding_dim': 256, 'lr': 0.00030931079276712585, 'lambda_val': 3.7619657777892586e-05, 'batch_size': 650, 'optimizer': 'Adam'}. Best is trial 15 with value: 0.12860431361188532.
2026-05-11 09:41:22,991 - optuna.study._optimize - INFO - Trial 174 pruned. 
2026-05-11 09:41:56,663 - optuna.study.study - INFO - Trial 175 finished with value: 0.09516974955900143 and parameters: {'n_layers': 1, 'embedding_dim': 256, 'lr': 0.0002995196587523744, 'lambda_val': 1.7322405418902203e-05, 'batch_size': 737, 'optimizer': 'Adam'}. Best is trial 15 with value: 0.12860431361188532.
2026-05-11 09:42:01,419 - optuna.study._optimize - INFO - Trial 176 pruned. 
2026-05-11 09:42:05,596 - optuna.study._optimize - INFO - Trial 177 pruned. 
2026-05-11 09:42:10,056 - optuna.study._optimize - INFO - Trial 178 pruned. 
2026-05-11 09:42:43,974 - optuna.study.study - INFO - Trial 179 finished with value: 0.07997109672309854 and parameters: {'n_layers': 1, 'embedding_dim': 256, 'lr': 0.00030669337324483974, 'lambda_val': 2.396468121490866e-05, 'batch_size': 756, 'optimizer': 'Adam'}. Best is trial 15 with value: 0.12860431361188532.
2026-05-11 09:42:47,925 - optuna.study._optimize - INFO - Trial 180 pruned. 
2026-05-11 09:43:22,634 - optuna.study.study - INFO - Trial 181 finished with value: 0.08481087819144899 and parameters: {'n_layers': 1, 'embedding_dim': 256, 'lr': 0.00027792108672888073, 'lambda_val': 1.9543932997842293e-05, 'batch_size': 930, 'optimizer': 'Adam'}. Best is trial 15 with value: 0.12860431361188532.
2026-05-11 09:43:27,705 - optuna.study._optimize - INFO - Trial 182 pruned. 
2026-05-11 09:44:02,506 - optuna.study.study - INFO - Trial 183 finished with value: 0.06299338835805977 and parameters: {'n_layers': 1, 'embedding_dim': 256, 'lr': 0.00044582613535062293, 'lambda_val': 1.7624602009841818e-05, 'batch_size': 794, 'optimizer': 'Adam'}. Best is trial 15 with value: 0.12860431361188532.
2026-05-11 09:44:36,517 - optuna.study.study - INFO - Trial 184 finished with value: 0.07762050921652361 and parameters: {'n_layers': 1, 'embedding_dim': 256, 'lr': 0.00036438733113813344, 'lambda_val': 5.9160265123494166e-05, 'batch_size': 942, 'optimizer': 'Adam'}. Best is trial 15 with value: 0.12860431361188532.
2026-05-11 09:44:40,882 - optuna.study._optimize - INFO - Trial 185 pruned. 
2026-05-11 09:44:45,727 - optuna.study._optimize - INFO - Trial 186 pruned. 
2026-05-11 09:44:50,350 - optuna.study._optimize - INFO - Trial 187 pruned. 
2026-05-11 09:44:54,641 - optuna.study._optimize - INFO - Trial 188 pruned. 
2026-05-11 09:45:01,438 - optuna.study._optimize - INFO - Trial 189 pruned. 
2026-05-11 09:45:11,420 - optuna.study._optimize - INFO - Trial 190 pruned. 
2026-05-11 09:45:46,155 - optuna.study.study - INFO - Trial 191 finished with value: 0.08078788551842199 and parameters: {'n_layers': 1, 'embedding_dim': 256, 'lr': 0.00027772227264628234, 'lambda_val': 1.3372417866854579e-06, 'batch_size': 1168, 'optimizer': 'Adam'}. Best is trial 15 with value: 0.12860431361188532.
2026-05-11 09:45:50,515 - optuna.study._optimize - INFO - Trial 192 pruned. 
2026-05-11 09:45:55,087 - optuna.study._optimize - INFO - Trial 193 pruned. 
2026-05-11 09:45:59,907 - optuna.study._optimize - INFO - Trial 194 pruned. 
2026-05-11 09:46:33,963 - optuna.study.study - INFO - Trial 195 finished with value: 0.08681133126615072 and parameters: {'n_layers': 1, 'embedding_dim': 256, 'lr': 0.00031077670716258773, 'lambda_val': 7.059864456011262e-06, 'batch_size': 1089, 'optimizer': 'Adam'}. Best is trial 15 with value: 0.12860431361188532.
2026-05-11 09:47:08,247 - optuna.study.study - INFO - Trial 196 finished with value: 0.07638906887585058 and parameters: {'n_layers': 1, 'embedding_dim': 256, 'lr': 0.00043623917180823116, 'lambda_val': 3.1460464558098356e-06, 'batch_size': 990, 'optimizer': 'Adam'}. Best is trial 15 with value: 0.12860431361188532.
2026-05-11 09:47:43,039 - optuna.study.study - INFO - Trial 197 finished with value: 0.08396760214883638 and parameters: {'n_layers': 1, 'embedding_dim': 256, 'lr': 0.00031985184631566095, 'lambda_val': 7.710361726167299e-06, 'batch_size': 1101, 'optimizer': 'Adam'}. Best is trial 15 with value: 0.12860431361188532.
2026-05-11 09:48:16,724 - optuna.study.study - INFO - Trial 198 finished with value: 0.08103638214890481 and parameters: {'n_layers': 1, 'embedding_dim': 256, 'lr': 0.00031242561176912865, 'lambda_val': 6.566301612328435e-06, 'batch_size': 1090, 'optimizer': 'Adam'}. Best is trial 15 with value: 0.12860431361188532.
2026-05-11 09:48:57,902 - optuna.study.study - INFO - Trial 199 finished with value: 0.06917873778560867 and parameters: {'n_layers': 1, 'embedding_dim': 256, 'lr': 0.0005187208638653681, 'lambda_val': 4.980211640280773e-06, 'batch_size': 1061, 'optimizer': 'Adam'}. Best is trial 15 with value: 0.12860431361188532.
2026-05-11 09:49:25,095 - root - INFO - **** Training e_100K_1c3dcs
2026-05-11 09:49:25,095 - root - INFO -   ** 3-Dominant stats:
2026-05-11 09:49:25,095 - root - INFO -   ** Finding the dominant set:
2026-05-11 09:49:45,031 - root - INFO -   ** Getting the trainable edges:
2026-05-11 09:49:45,037 - helper_functions - INFO -      Number of nodes: 4883
2026-05-11 09:49:45,037 - helper_functions - INFO -      Ratio: 0.5389029908398631
2026-05-11 09:49:45,037 - helper_functions - INFO -      Number of unique users: 343
2026-05-11 09:49:45,037 - helper_functions - INFO -      Number of unique items: 4540
2026-05-11 09:49:45,038 - helper_functions - INFO -      Total dominant set edge: 70473
2026-05-11 09:49:45,038 - helper_functions - INFO -      Trainable edges: 56378.4
2026-05-11 09:49:45,046 - root - INFO -   **** Getting 70473 dominant set edges
2026-05-11 09:49:45,972 - optuna.storages._rdb.storage - INFO - A new study created in RDB with name: Study_e_100K_1c3dcs
2026-05-11 09:50:32,585 - optuna.study.study - INFO - Trial 0 finished with value: 0.015202675955868909 and parameters: {'n_layers': 4, 'embedding_dim': 128, 'lr': 0.005208623247716919, 'lambda_val': 2.5860611511737556e-06, 'batch_size': 1032, 'optimizer': 'RMSprop'}. Best is trial 0 with value: 0.015202675955868909.
2026-05-11 09:51:08,832 - optuna.study.study - INFO - Trial 1 finished with value: 0.0011303862812944627 and parameters: {'n_layers': 2, 'embedding_dim': 128, 'lr': 5.1568567988055126e-05, 'lambda_val': 0.016401418709189985, 'batch_size': 3553, 'optimizer': 'SGD'}. Best is trial 0 with value: 0.015202675955868909.
2026-05-11 09:51:43,833 - optuna.study.study - INFO - Trial 2 finished with value: 0.04746487163529292 and parameters: {'n_layers': 3, 'embedding_dim': 32, 'lr': 7.801330330745394e-05, 'lambda_val': 8.955439101213709e-06, 'batch_size': 2493, 'optimizer': 'Adam'}. Best is trial 2 with value: 0.04746487163529292.
2026-05-11 09:52:14,157 - optuna.study.study - INFO - Trial 3 finished with value: 0.025287477433163414 and parameters: {'n_layers': 1, 'embedding_dim': 32, 'lr': 0.00019093926652590353, 'lambda_val': 0.07217654138622677, 'batch_size': 3992, 'optimizer': 'Adam'}. Best is trial 2 with value: 0.04746487163529292.
2026-05-11 09:52:55,516 - optuna.study.study - INFO - Trial 4 finished with value: 0.0020978361079330766 and parameters: {'n_layers': 4, 'embedding_dim': 96, 'lr': 0.0030293437918895967, 'lambda_val': 0.00019561526757835138, 'batch_size': 1245, 'optimizer': 'SGD'}. Best is trial 2 with value: 0.04746487163529292.
2026-05-11 09:53:01,691 - optuna.study._optimize - INFO - Trial 5 pruned. 
2026-05-11 09:53:46,540 - optuna.study.study - INFO - Trial 6 finished with value: 0.02068329730810706 and parameters: {'n_layers': 3, 'embedding_dim': 128, 'lr': 0.0006271671834707441, 'lambda_val': 0.014913001983041985, 'batch_size': 2790, 'optimizer': 'Adam'}. Best is trial 2 with value: 0.04746487163529292.
2026-05-11 09:53:51,058 - optuna.study._optimize - INFO - Trial 7 pruned. 
2026-05-11 09:53:55,144 - optuna.study._optimize - INFO - Trial 8 pruned. 
2026-05-11 09:54:23,745 - optuna.study.study - INFO - Trial 9 finished with value: 0.03984009861378546 and parameters: {'n_layers': 1, 'embedding_dim': 64, 'lr': 0.033643387192100964, 'lambda_val': 4.100188258409881e-06, 'batch_size': 1352, 'optimizer': 'RMSprop'}. Best is trial 2 with value: 0.04746487163529292.
2026-05-11 09:54:57,396 - optuna.study.study - INFO - Trial 10 finished with value: 0.011952374239715662 and parameters: {'n_layers': 3, 'embedding_dim': 32, 'lr': 0.0002443593398093867, 'lambda_val': 6.062954912504405e-05, 'batch_size': 2022, 'optimizer': 'Adam'}. Best is trial 2 with value: 0.04746487163529292.
2026-05-11 09:55:01,646 - optuna.study._optimize - INFO - Trial 11 pruned. 
2026-05-11 09:55:05,300 - optuna.study._optimize - INFO - Trial 12 pruned. 
2026-05-11 09:55:11,640 - optuna.study._optimize - INFO - Trial 13 pruned. 
2026-05-11 09:55:45,192 - optuna.study.study - INFO - Trial 14 finished with value: 0.02344197317135246 and parameters: {'n_layers': 2, 'embedding_dim': 96, 'lr': 0.001072735560818038, 'lambda_val': 1.1282494346855451e-05, 'batch_size': 1689, 'optimizer': 'Adam'}. Best is trial 2 with value: 0.04746487163529292.
2026-05-11 09:55:49,942 - optuna.study._optimize - INFO - Trial 15 pruned. 
2026-05-11 09:56:21,241 - optuna.study.study - INFO - Trial 16 finished with value: 0.07313591525089352 and parameters: {'n_layers': 1, 'embedding_dim': 64, 'lr': 7.535372379482821e-05, 'lambda_val': 0.0014975660672763547, 'batch_size': 3323, 'optimizer': 'Adam'}. Best is trial 16 with value: 0.07313591525089352.
2026-05-11 09:56:54,613 - optuna.study.study - INFO - Trial 17 finished with value: 0.0408322698986336 and parameters: {'n_layers': 2, 'embedding_dim': 64, 'lr': 6.422357527045733e-05, 'lambda_val': 0.0015948953580146065, 'batch_size': 3310, 'optimizer': 'Adam'}. Best is trial 16 with value: 0.07313591525089352.
2026-05-11 09:56:58,741 - optuna.study._optimize - INFO - Trial 18 pruned. 
2026-05-11 09:57:03,722 - optuna.study._optimize - INFO - Trial 19 pruned. 
2026-05-11 09:57:40,031 - optuna.study.study - INFO - Trial 20 finished with value: 0.05972242688528684 and parameters: {'n_layers': 1, 'embedding_dim': 256, 'lr': 0.0006561888917359335, 'lambda_val': 0.0006840024136518896, 'batch_size': 2574, 'optimizer': 'Adam'}. Best is trial 16 with value: 0.07313591525089352.
2026-05-11 09:58:17,005 - optuna.study.study - INFO - Trial 21 finished with value: 0.05168670764777537 and parameters: {'n_layers': 1, 'embedding_dim': 256, 'lr': 0.0008442073912536205, 'lambda_val': 0.00046847872033375107, 'batch_size': 2352, 'optimizer': 'Adam'}. Best is trial 16 with value: 0.07313591525089352.
2026-05-11 09:58:52,150 - optuna.study.study - INFO - Trial 22 finished with value: 0.05960598807409131 and parameters: {'n_layers': 1, 'embedding_dim': 256, 'lr': 0.0008826694356282252, 'lambda_val': 0.000614895274961958, 'batch_size': 1971, 'optimizer': 'Adam'}. Best is trial 16 with value: 0.07313591525089352.
2026-05-11 09:59:35,546 - optuna.study.study - INFO - Trial 23 finished with value: 0.06352229853776634 and parameters: {'n_layers': 1, 'embedding_dim': 256, 'lr': 0.001812845576426602, 'lambda_val': 0.005343095708779815, 'batch_size': 1942, 'optimizer': 'Adam'}. Best is trial 16 with value: 0.07313591525089352.
2026-05-11 10:00:13,235 - optuna.study.study - INFO - Trial 24 finished with value: 0.06664791238396214 and parameters: {'n_layers': 1, 'embedding_dim': 256, 'lr': 0.002227956898444938, 'lambda_val': 0.004493984149480832, 'batch_size': 2965, 'optimizer': 'Adam'}. Best is trial 16 with value: 0.07313591525089352.
2026-05-11 10:00:47,474 - optuna.study.study - INFO - Trial 25 finished with value: 0.06300814032662932 and parameters: {'n_layers': 1, 'embedding_dim': 256, 'lr': 0.002766118912719876, 'lambda_val': 0.004125872206619109, 'batch_size': 3053, 'optimizer': 'Adam'}. Best is trial 16 with value: 0.07313591525089352.
2026-05-11 10:01:03,438 - optuna.study._optimize - INFO - Trial 26 pruned. 
2026-05-11 10:01:39,363 - optuna.study.study - INFO - Trial 27 finished with value: 0.05004714108953902 and parameters: {'n_layers': 1, 'embedding_dim': 256, 'lr': 0.00030371706845859703, 'lambda_val': 0.03921868845191129, 'batch_size': 2855, 'optimizer': 'Adam'}. Best is trial 16 with value: 0.07313591525089352.
2026-05-11 10:02:13,091 - optuna.study.study - INFO - Trial 28 finished with value: 0.057785183545474114 and parameters: {'n_layers': 1, 'embedding_dim': 64, 'lr': 0.008397087519639242, 'lambda_val': 0.002024391439450591, 'batch_size': 3757, 'optimizer': 'Adam'}. Best is trial 16 with value: 0.07313591525089352.
2026-05-11 10:02:23,830 - optuna.study._optimize - INFO - Trial 29 pruned. 
2026-05-11 10:02:29,331 - optuna.study._optimize - INFO - Trial 30 pruned. 
2026-05-11 10:03:12,039 - optuna.study.study - INFO - Trial 31 finished with value: 0.062151528519372466 and parameters: {'n_layers': 1, 'embedding_dim': 256, 'lr': 0.0032248386146363772, 'lambda_val': 0.0043185480128111395, 'batch_size': 3073, 'optimizer': 'Adam'}. Best is trial 16 with value: 0.07313591525089352.
2026-05-11 10:03:49,291 - optuna.study.study - INFO - Trial 32 finished with value: 0.06341230078737409 and parameters: {'n_layers': 1, 'embedding_dim': 256, 'lr': 0.004060106330081236, 'lambda_val': 0.0031037804199355178, 'batch_size': 3254, 'optimizer': 'Adam'}. Best is trial 16 with value: 0.07313591525089352.
2026-05-11 10:04:26,928 - optuna.study.study - INFO - Trial 33 finished with value: 0.06480093621138355 and parameters: {'n_layers': 1, 'embedding_dim': 256, 'lr': 0.012444821373573573, 'lambda_val': 0.013575815176081118, 'batch_size': 3331, 'optimizer': 'Adam'}. Best is trial 16 with value: 0.07313591525089352.
2026-05-11 10:04:31,678 - optuna.study._optimize - INFO - Trial 34 pruned. 
2026-05-11 10:04:36,410 - optuna.study._optimize - INFO - Trial 35 pruned. 
2026-05-11 10:04:40,661 - optuna.study._optimize - INFO - Trial 36 pruned. 
2026-05-11 10:04:45,276 - optuna.study._optimize - INFO - Trial 37 pruned. 
2026-05-11 10:04:50,640 - optuna.study._optimize - INFO - Trial 38 pruned. 
2026-05-11 10:05:31,640 - optuna.study.study - INFO - Trial 39 finished with value: 0.0658332557175443 and parameters: {'n_layers': 1, 'embedding_dim': 256, 'lr': 0.005770179793273657, 'lambda_val': 0.0002620259440520264, 'batch_size': 2729, 'optimizer': 'Adam'}. Best is trial 16 with value: 0.07313591525089352.
2026-05-11 10:05:41,161 - optuna.study._optimize - INFO - Trial 40 pruned. 
2026-05-11 10:06:18,476 - optuna.study.study - INFO - Trial 41 finished with value: 0.06749703686281561 and parameters: {'n_layers': 1, 'embedding_dim': 256, 'lr': 0.013160934298046297, 'lambda_val': 0.0011122312569450345, 'batch_size': 2668, 'optimizer': 'Adam'}. Best is trial 16 with value: 0.07313591525089352.
2026-05-11 10:06:26,551 - optuna.study._optimize - INFO - Trial 42 pruned. 
