2026-06-04 15:23:24,706 - optuna.study.study - INFO - Trial 217 finished with values: [0.009286834387442003, 0.0017131087145823567, 0.00544674697045787] and parameters: {'n_layers': 4, 'embedding_dim': 96, 'lr': 0.0008527206735717898, 'lambda_val': 5.016933039935782e-06, 'batch_size': 3919, 'optimizer': 'RMSprop'}.
2026-06-04 15:24:09,938 - experiment_functions - INFO - Early stopping at epoch 850. Best Metrics: (0.008251179736088644, 0.001476991091164847, 0.004503237707938331)
2026-06-04 15:24:10,028 - optuna.study.study - INFO - Trial 218 finished with values: [0.008251179736088644, 0.001476991091164847, 0.004503237707938331] and parameters: {'n_layers': 4, 'embedding_dim': 256, 'lr': 0.0017568753093311267, 'lambda_val': 7.627763072576621e-05, 'batch_size': 2438, 'optimizer': 'Adam'}.
2026-06-04 15:25:05,043 - experiment_functions - INFO - Early stopping at epoch 1050. Best Metrics: (0.008890153711730913, 0.0016812914461785784, 0.00504778066686393)
2026-06-04 15:25:05,932 - optuna.study.study - INFO - Trial 219 finished with values: [0.008890153711730913, 0.0016812914461785784, 0.00504778066686393] and parameters: {'n_layers': 4, 'embedding_dim': 256, 'lr': 0.0008527206735717898, 'lambda_val': 7.359862236281652e-06, 'batch_size': 2311, 'optimizer': 'RMSprop'}.
2026-06-04 15:26:58,941 - experiment_functions - INFO - Early stopping at epoch 2200. Best Metrics: (0.009818173456102596, 0.0017281800522473039, 0.00529128039329291)
2026-06-04 15:26:59,048 - optuna.study.study - INFO - Trial 220 finished with values: [0.009818173456102596, 0.0017281800522473039, 0.00529128039329291] and parameters: {'n_layers': 4, 'embedding_dim': 256, 'lr': 0.0008527206735717898, 'lambda_val': 2.179922087788738e-05, 'batch_size': 739, 'optimizer': 'Adam'}.
2026-06-04 15:27:24,180 - experiment_functions - INFO - Early stopping at epoch 550. Best Metrics: (0.0034187042138952824, 0.0005358697836425749, 0.002046409511566071)
2026-06-04 15:27:24,552 - optuna.study.study - INFO - Trial 221 finished with values: [0.0034187042138952824, 0.0005358697836425749, 0.002046409511566071] and parameters: {'n_layers': 1, 'embedding_dim': 256, 'lr': 0.03158371176000556, 'lambda_val': 0.0003451880657732405, 'batch_size': 1826, 'optimizer': 'Adam'}.
2026-06-04 15:28:08,243 - experiment_functions - INFO - Early stopping at epoch 850. Best Metrics: (0.0067658728726105325, 0.0012894366668899458, 0.0040309234275454665)
2026-06-04 15:28:08,335 - optuna.study.study - INFO - Trial 222 finished with values: [0.0067658728726105325, 0.0012894366668899458, 0.0040309234275454665] and parameters: {'n_layers': 3, 'embedding_dim': 256, 'lr': 0.002073152681683234, 'lambda_val': 1.8898212223948182e-06, 'batch_size': 3337, 'optimizer': 'Adam'}.
2026-06-04 15:28:41,829 - experiment_functions - INFO - Early stopping at epoch 700. Best Metrics: (0.0053197252851839355, 0.0009109786321923772, 0.0029274518179964546)
2026-06-04 15:28:42,011 - optuna.study.study - INFO - Trial 223 finished with values: [0.0053197252851839355, 0.0009109786321923772, 0.0029274518179964546] and parameters: {'n_layers': 2, 'embedding_dim': 256, 'lr': 0.005913319416099858, 'lambda_val': 0.0001934486502752409, 'batch_size': 2534, 'optimizer': 'Adam'}.
2026-06-04 15:31:08,216 - optuna.study.study - INFO - Trial 224 finished with values: [0.011003699156716569, 0.00177004487909438, 0.0063779797696899045] and parameters: {'n_layers': 2, 'embedding_dim': 32, 'lr': 0.0014181685787657509, 'lambda_val': 7.298258738590182e-06, 'batch_size': 739, 'optimizer': 'RMSprop'}.
2026-06-04 15:33:46,178 - optuna.study.study - INFO - Trial 225 finished with values: [0.006164160475597453, 0.0010399222988813719, 0.004015655526931581] and parameters: {'n_layers': 3, 'embedding_dim': 96, 'lr': 0.0004090776901902334, 'lambda_val': 5.016933039935782e-06, 'batch_size': 739, 'optimizer': 'Adam'}.
2026-06-04 15:34:08,661 - experiment_functions - INFO - Early stopping at epoch 550. Best Metrics: (0.005469701388282532, 0.0008892089222318977, 0.003138598184753238)
2026-06-04 15:34:08,739 - optuna.study.study - INFO - Trial 226 finished with values: [0.005469701388282532, 0.0008892089222318977, 0.003138598184753238] and parameters: {'n_layers': 4, 'embedding_dim': 32, 'lr': 0.021903922702637243, 'lambda_val': 1.0009974035026707e-06, 'batch_size': 3337, 'optimizer': 'Adam'}.
2026-06-04 15:35:13,561 - experiment_functions - INFO - Early stopping at epoch 1250. Best Metrics: (0.010954907544387807, 0.001940853372630451, 0.006219850874896969)
2026-06-04 15:35:14,709 - optuna.study.study - INFO - Trial 227 finished with values: [0.010954907544387807, 0.001940853372630451, 0.006219850874896969] and parameters: {'n_layers': 4, 'embedding_dim': 256, 'lr': 0.0014181685787657509, 'lambda_val': 7.204655475546071e-06, 'batch_size': 739, 'optimizer': 'RMSprop'}.
2026-06-04 15:36:12,895 - experiment_functions - INFO - Early stopping at epoch 1400. Best Metrics: (0.009862430169046277, 0.0017800924375376782, 0.005869145862903426)
2026-06-04 15:36:13,153 - optuna.study.study - INFO - Trial 228 finished with values: [0.009862430169046277, 0.0017800924375376782, 0.005869145862903426] and parameters: {'n_layers': 4, 'embedding_dim': 64, 'lr': 0.0014181685787657509, 'lambda_val': 1.7844039295042361e-06, 'batch_size': 1368, 'optimizer': 'Adam'}.
2026-06-04 15:36:40,046 - experiment_functions - INFO - Early stopping at epoch 500. Best Metrics: (0.0004389932032985709, 7.033290910308795e-05, 0.00019564072593604583)
2026-06-04 15:36:41,030 - optuna.study.study - INFO - Trial 229 finished with values: [0.0004389932032985709, 7.033290910308795e-05, 0.00019564072593604583] and parameters: {'n_layers': 4, 'embedding_dim': 256, 'lr': 0.0014181685787657509, 'lambda_val': 5.016933039935782e-06, 'batch_size': 739, 'optimizer': 'SGD'}.
2026-06-04 15:37:51,511 - experiment_functions - INFO - Early stopping at epoch 1350. Best Metrics: (0.004901487795540564, 0.0009360975283006231, 0.002832913463250511)
2026-06-04 15:37:51,601 - optuna.study.study - INFO - Trial 230 finished with values: [0.004901487795540564, 0.0009360975283006231, 0.002832913463250511] and parameters: {'n_layers': 4, 'embedding_dim': 256, 'lr': 0.0004090776901902334, 'lambda_val': 0.04574908159608452, 'batch_size': 3650, 'optimizer': 'Adam'}.
2026-06-04 15:39:10,422 - experiment_functions - INFO - Early stopping at epoch 1950. Best Metrics: (0.008485873629493592, 0.0015088083595686248, 0.004906404605847427)
2026-06-04 15:39:10,507 - optuna.study.study - INFO - Trial 231 finished with values: [0.008485873629493592, 0.0015088083595686248, 0.004906404605847427] and parameters: {'n_layers': 3, 'embedding_dim': 96, 'lr': 0.0008527206735717898, 'lambda_val': 7.359862236281652e-06, 'batch_size': 2516, 'optimizer': 'Adam'}.
2026-06-04 15:41:53,770 - optuna.study.study - INFO - Trial 232 finished with values: [0.001054521614033315, 0.00013229285283676068, 0.0005624371971511124] and parameters: {'n_layers': 3, 'embedding_dim': 128, 'lr': 7.249327100639011e-05, 'lambda_val': 0.000222693868437361, 'batch_size': 2516, 'optimizer': 'RMSprop'}.
2026-06-04 15:42:51,742 - experiment_functions - INFO - Early stopping at epoch 1100. Best Metrics: (0.009018206298058017, 0.0016528233639225667, 0.005147566629987603)
2026-06-04 15:42:51,833 - optuna.study.study - INFO - Trial 233 finished with values: [0.009018206298058017, 0.0016528233639225667, 0.005147566629987603] and parameters: {'n_layers': 4, 'embedding_dim': 256, 'lr': 0.0014181685787657509, 'lambda_val': 5.6413681092531065e-05, 'batch_size': 739, 'optimizer': 'Adam'}.
2026-06-04 15:43:21,860 - experiment_functions - INFO - Early stopping at epoch 550. Best Metrics: (0.003148998363963428, 0.0005191238529037444, 0.0018543834055961186)
2026-06-04 15:43:22,243 - optuna.study.study - INFO - Trial 234 finished with values: [0.003148998363963428, 0.0005191238529037444, 0.0018543834055961186] and parameters: {'n_layers': 4, 'embedding_dim': 256, 'lr': 0.08896930678012212, 'lambda_val': 0.0006393772085417414, 'batch_size': 1995, 'optimizer': 'Adam'}.
2026-06-04 15:44:33,434 - experiment_functions - INFO - Early stopping at epoch 1750. Best Metrics: (0.006613998372870789, 0.0011990086409002614, 0.003791429546114094)
2026-06-04 15:44:33,523 - optuna.study.study - INFO - Trial 235 finished with values: [0.006613998372870789, 0.0011990086409002614, 0.003791429546114094] and parameters: {'n_layers': 3, 'embedding_dim': 96, 'lr': 0.0005268211601481077, 'lambda_val': 0.0026828102176673276, 'batch_size': 3509, 'optimizer': 'Adam'}.
2026-06-04 15:44:54,893 - experiment_functions - INFO - Early stopping at epoch 500. Best Metrics: (0.0004431882740230209, 8.038046754638624e-05, 0.00017670098766054207)
2026-06-04 15:44:55,460 - optuna.study.study - INFO - Trial 236 finished with values: [0.0004431882740230209, 8.038046754638624e-05, 0.00017670098766054207] and parameters: {'n_layers': 4, 'embedding_dim': 64, 'lr': 0.0004090776901902334, 'lambda_val': 3.266599538089538e-05, 'batch_size': 1946, 'optimizer': 'SGD'}.
2026-06-04 15:47:26,773 - optuna.study.study - INFO - Trial 237 finished with values: [0.006808106806384316, 0.0011822627101614309, 0.003742756286445382] and parameters: {'n_layers': 4, 'embedding_dim': 32, 'lr': 0.00030379311378365113, 'lambda_val': 0.0029474529646761295, 'batch_size': 2534, 'optimizer': 'Adam'}.
2026-06-04 15:48:12,595 - experiment_functions - INFO - Early stopping at epoch 850. Best Metrics: (0.00820068555251339, 0.0014719673119431979, 0.004464604786274787)
2026-06-04 15:48:12,696 - optuna.study.study - INFO - Trial 238 finished with values: [0.00820068555251339, 0.0014719673119431979, 0.004464604786274787] and parameters: {'n_layers': 4, 'embedding_dim': 256, 'lr': 0.0022691253374042394, 'lambda_val': 5.016933039935782e-06, 'batch_size': 1826, 'optimizer': 'Adam'}.
2026-06-04 15:50:21,781 - experiment_functions - INFO - Early stopping at epoch 3400. Best Metrics: (0.004629730499342941, 0.0006715118226271016, 0.0024990065584682935)
2026-06-04 15:50:21,896 - optuna.study.study - INFO - Trial 239 finished with values: [0.004629730499342941, 0.0006715118226271016, 0.0024990065584682935] and parameters: {'n_layers': 1, 'embedding_dim': 96, 'lr': 0.0005268211601481077, 'lambda_val': 7.359862236281652e-06, 'batch_size': 4045, 'optimizer': 'Adam'}.
2026-06-04 15:50:45,465 - experiment_functions - INFO - Early stopping at epoch 550. Best Metrics: (0.004795419233333604, 0.0007786857793556167, 0.002832879254044941)
2026-06-04 15:50:45,561 - optuna.study.study - INFO - Trial 240 finished with values: [0.004795419233333604, 0.0007786857793556167, 0.002832879254044941] and parameters: {'n_layers': 3, 'embedding_dim': 64, 'lr': 0.0431688027760024, 'lambda_val': 7.359862236281652e-06, 'batch_size': 3705, 'optimizer': 'Adam'}.
2026-06-04 15:52:07,702 - experiment_functions - INFO - Early stopping at epoch 1950. Best Metrics: (0.01333381796031339, 0.00235280326880568, 0.008115152525624614)
2026-06-04 15:52:07,789 - optuna.study.study - INFO - Trial 241 finished with values: [0.01333381796031339, 0.00235280326880568, 0.008115152525624614] and parameters: {'n_layers': 4, 'embedding_dim': 96, 'lr': 0.0008527206735717898, 'lambda_val': 1.2893510199521252e-06, 'batch_size': 1098, 'optimizer': 'RMSprop'}.
2026-06-04 15:52:49,298 - experiment_functions - INFO - Early stopping at epoch 950. Best Metrics: (0.007136482556486351, 0.0012492464331167528, 0.004111771016930157)
2026-06-04 15:52:49,378 - optuna.study.study - INFO - Trial 242 finished with values: [0.007136482556486351, 0.0012492464331167528, 0.004111771016930157] and parameters: {'n_layers': 3, 'embedding_dim': 128, 'lr': 0.0014181685787657509, 'lambda_val': 0.0029474529646761295, 'batch_size': 1368, 'optimizer': 'Adam'}.
2026-06-04 15:56:13,117 - optuna.study.study - INFO - Trial 243 finished with values: [0.0004926776909054614, 7.870587447250318e-05, 0.00022355683385059924] and parameters: {'n_layers': 4, 'embedding_dim': 256, 'lr': 2.5968274891425906e-05, 'lambda_val': 5.016933039935782e-06, 'batch_size': 3888, 'optimizer': 'RMSprop'}.
2026-06-04 15:56:48,694 - experiment_functions - INFO - Early stopping at epoch 750. Best Metrics: (0.0076497803291563716, 0.0013430236452542032, 0.0043022304470807776)
2026-06-04 15:56:49,124 - optuna.study.study - INFO - Trial 244 finished with values: [0.0076497803291563716, 0.0013430236452542032, 0.0043022304470807776] and parameters: {'n_layers': 4, 'embedding_dim': 96, 'lr': 0.0022691253374042394, 'lambda_val': 1.3255211938031085e-06, 'batch_size': 3337, 'optimizer': 'Adam'}.
2026-06-04 15:57:29,359 - experiment_functions - INFO - Early stopping at epoch 700. Best Metrics: (0.005006453625437336, 0.0009963828789604126, 0.002770460976295863)
2026-06-04 15:57:29,808 - optuna.study.study - INFO - Trial 245 finished with values: [0.005006453625437336, 0.0009963828789604126, 0.002770460976295863] and parameters: {'n_layers': 4, 'embedding_dim': 256, 'lr': 0.0017568753093311267, 'lambda_val': 0.02697715458080492, 'batch_size': 2534, 'optimizer': 'Adam'}.
2026-06-04 15:59:00,159 - experiment_functions - INFO - Early stopping at epoch 1700. Best Metrics: (0.0008189914462238801, 0.00011722151517181326, 0.00037598569145766517)
2026-06-04 15:59:00,810 - optuna.study.study - INFO - Trial 246 finished with values: [0.0008189914462238801, 0.00011722151517181326, 0.00037598569145766517] and parameters: {'n_layers': 4, 'embedding_dim': 256, 'lr': 8.36312170582599e-05, 'lambda_val': 0.003001642531865632, 'batch_size': 1126, 'optimizer': 'Adam'}.
2026-06-04 15:59:27,871 - experiment_functions - INFO - Early stopping at epoch 600. Best Metrics: (0.004551755192782701, 0.0008205506062026928, 0.0025927167619916643)
2026-06-04 15:59:27,949 - optuna.study.study - INFO - Trial 247 finished with values: [0.004551755192782701, 0.0008205506062026928, 0.0025927167619916643] and parameters: {'n_layers': 4, 'embedding_dim': 32, 'lr': 0.007900697792618734, 'lambda_val': 0.0029474529646761295, 'batch_size': 968, 'optimizer': 'RMSprop'}.
2026-06-04 16:00:55,638 - experiment_functions - INFO - Early stopping at epoch 1800. Best Metrics: (0.0034140196158544064, 0.0006246232165583763, 0.0019802854245607364)
2026-06-04 16:00:55,718 - optuna.study.study - INFO - Trial 248 finished with values: [0.0034140196158544064, 0.0006246232165583763, 0.0019802854245607364] and parameters: {'n_layers': 3, 'embedding_dim': 256, 'lr': 0.05020095348932179, 'lambda_val': 0.028928006992953205, 'batch_size': 928, 'optimizer': 'Adam'}.
2026-06-04 16:03:32,407 - optuna.study.study - INFO - Trial 249 finished with values: [0.010462460750097715, 0.0017934891821287428, 0.006297316484596912] and parameters: {'n_layers': 4, 'embedding_dim': 64, 'lr': 0.0005268211601481077, 'lambda_val': 7.359862236281652e-06, 'batch_size': 894, 'optimizer': 'Adam'}.
2026-06-04 16:04:51,196 - experiment_functions - INFO - Early stopping at epoch 1500. Best Metrics: (0.009005412506744944, 0.0016427758054792688, 0.005110574812385597)
2026-06-04 16:04:51,294 - optuna.study.study - INFO - Trial 250 finished with values: [0.009005412506744944, 0.0016427758054792688, 0.005110574812385597] and parameters: {'n_layers': 4, 'embedding_dim': 256, 'lr': 0.0014181685787657509, 'lambda_val': 1.7844039295042361e-06, 'batch_size': 739, 'optimizer': 'Adam'}.
2026-06-04 16:05:38,431 - experiment_functions - INFO - Early stopping at epoch 1050. Best Metrics: (0.010071353045930945, 0.00183033022975417, 0.005562613288618939)
2026-06-04 16:05:38,540 - optuna.study.study - INFO - Trial 251 finished with values: [0.010071353045930945, 0.00183033022975417, 0.005562613288618939] and parameters: {'n_layers': 4, 'embedding_dim': 128, 'lr': 0.0008527206735717898, 'lambda_val': 0.00026218929558311914, 'batch_size': 2516, 'optimizer': 'RMSprop'}.
2026-06-04 16:06:12,529 - experiment_functions - INFO - Early stopping at epoch 600. Best Metrics: (0.005825386290451994, 0.001188961082456963, 0.0033954607210596086)
2026-06-04 16:06:12,636 - optuna.study.study - INFO - Trial 252 finished with values: [0.005825386290451994, 0.001188961082456963, 0.0033954607210596086] and parameters: {'n_layers': 4, 'embedding_dim': 256, 'lr': 0.004053656763854123, 'lambda_val': 0.0008887256690272502, 'batch_size': 3509, 'optimizer': 'Adam'}.
2026-06-04 16:06:43,124 - experiment_functions - INFO - Early stopping at epoch 750. Best Metrics: (0.007156167920423813, 0.0012844128876682967, 0.004233975405723496)
2026-06-04 16:06:43,577 - optuna.study.study - INFO - Trial 253 finished with values: [0.007156167920423813, 0.0012844128876682967, 0.004233975405723496] and parameters: {'n_layers': 4, 'embedding_dim': 32, 'lr': 0.0022691253374042394, 'lambda_val': 1.8898212223948182e-06, 'batch_size': 3337, 'optimizer': 'Adam'}.
2026-06-04 16:09:30,770 - optuna.study.study - INFO - Trial 254 finished with values: [0.009183520252201344, 0.0016796168531046955, 0.005348759143607789] and parameters: {'n_layers': 4, 'embedding_dim': 96, 'lr': 0.0005268211601481077, 'lambda_val': 0.00011063404504052646, 'batch_size': 1826, 'optimizer': 'Adam'}.
2026-06-04 16:12:16,994 - optuna.study.study - INFO - Trial 255 finished with values: [0.009376994266305378, 0.001575792082523947, 0.005489367478419439] and parameters: {'n_layers': 4, 'embedding_dim': 96, 'lr': 0.0004090776901902334, 'lambda_val': 1.7844039295042361e-06, 'batch_size': 1368, 'optimizer': 'Adam'}.
2026-06-04 16:13:52,951 - experiment_functions - INFO - Early stopping at epoch 1950. Best Metrics: (0.0073444645916222046, 0.00134134905218032, 0.004216142855647523)
2026-06-04 16:13:53,562 - optuna.study.study - INFO - Trial 256 finished with values: [0.0073444645916222046, 0.00134134905218032, 0.004216142855647523] and parameters: {'n_layers': 3, 'embedding_dim': 256, 'lr': 0.0005268211601481077, 'lambda_val': 7.359862236281652e-06, 'batch_size': 3509, 'optimizer': 'Adam'}.
2026-06-04 16:15:57,114 - experiment_functions - INFO - Early stopping at epoch 3250. Best Metrics: (0.005704444691966603, 0.0008439949092370554, 0.0031425294862302447)
2026-06-04 16:15:57,682 - optuna.study.study - INFO - Trial 257 finished with values: [0.005704444691966603, 0.0008439949092370554, 0.0031425294862302447] and parameters: {'n_layers': 1, 'embedding_dim': 64, 'lr': 0.0014181685787657509, 'lambda_val': 1.7844039295042361e-06, 'batch_size': 1368, 'optimizer': 'Adam'}.
2026-06-04 16:18:03,626 - experiment_functions - INFO - Early stopping at epoch 3150. Best Metrics: (0.009141805483469162, 0.0016829660392524619, 0.005599137564018498)
2026-06-04 16:18:03,715 - optuna.study.study - INFO - Trial 258 finished with values: [0.009141805483469162, 0.0016829660392524619, 0.005599137564018498] and parameters: {'n_layers': 3, 'embedding_dim': 64, 'lr': 0.0014181685787657509, 'lambda_val': 2.827361387598921e-05, 'batch_size': 739, 'optimizer': 'Adam'}.
2026-06-04 16:18:40,743 - experiment_functions - INFO - Early stopping at epoch 850. Best Metrics: (0.0077463550433339145, 0.0014217295197267066, 0.004427973606063121)
2026-06-04 16:18:40,832 - optuna.study.study - INFO - Trial 259 finished with values: [0.0077463550433339145, 0.0014217295197267066, 0.004427973606063121] and parameters: {'n_layers': 4, 'embedding_dim': 96, 'lr': 0.0014181685787657509, 'lambda_val': 0.0003532268196548331, 'batch_size': 2914, 'optimizer': 'Adam'}.
2026-06-04 16:19:31,599 - experiment_functions - INFO - Early stopping at epoch 950. Best Metrics: (0.007261753877606354, 0.0013480474244758525, 0.003984977597121725)
2026-06-04 16:19:31,695 - optuna.study.study - INFO - Trial 260 finished with values: [0.007261753877606354, 0.0013480474244758525, 0.003984977597121725] and parameters: {'n_layers': 4, 'embedding_dim': 256, 'lr': 0.0014181685787657509, 'lambda_val': 0.0029474529646761295, 'batch_size': 739, 'optimizer': 'Adam'}.
2026-06-04 16:20:22,254 - experiment_functions - INFO - Early stopping at epoch 950. Best Metrics: (0.007897476895869577, 0.0015305780695291046, 0.00473357975164242)
2026-06-04 16:20:22,556 - optuna.study.study - INFO - Trial 261 finished with values: [0.007897476895869577, 0.0015305780695291046, 0.00473357975164242] and parameters: {'n_layers': 4, 'embedding_dim': 256, 'lr': 0.0014181685787657509, 'lambda_val': 5.016933039935782e-06, 'batch_size': 1826, 'optimizer': 'Adam'}.
2026-06-04 16:21:01,942 - experiment_functions - INFO - Early stopping at epoch 900. Best Metrics: (0.008661339105686337, 0.0016327282470359702, 0.004913618171761856)
2026-06-04 16:21:02,073 - optuna.study.study - INFO - Trial 262 finished with values: [0.008661339105686337, 0.0016327282470359702, 0.004913618171761856] and parameters: {'n_layers': 4, 'embedding_dim': 96, 'lr': 0.0014181685787657509, 'lambda_val': 7.204655475546071e-06, 'batch_size': 3919, 'optimizer': 'RMSprop'}.
2026-06-04 16:21:32,637 - experiment_functions - INFO - Early stopping at epoch 550. Best Metrics: (0.006495852671144903, 0.001145421662536004, 0.003614350290286204)
2026-06-04 16:21:32,712 - optuna.study.study - INFO - Trial 263 finished with values: [0.006495852671144903, 0.001145421662536004, 0.003614350290286204] and parameters: {'n_layers': 4, 'embedding_dim': 256, 'lr': 0.004480000793937752, 'lambda_val': 5.016933039935782e-06, 'batch_size': 3688, 'optimizer': 'RMSprop'}.
2026-06-04 16:21:53,346 - experiment_functions - INFO - Early stopping at epoch 500. Best Metrics: (0.0004296302308320129, 5.023779221649141e-05, 0.000198919947311944)
2026-06-04 16:21:53,429 - optuna.study.study - INFO - Trial 264 finished with values: [0.0004296302308320129, 5.023779221649141e-05, 0.000198919947311944] and parameters: {'n_layers': 2, 'embedding_dim': 64, 'lr': 4.5885813111078894e-05, 'lambda_val': 0.00040637247438902806, 'batch_size': 3688, 'optimizer': 'SGD'}.
2026-06-04 16:24:43,461 - experiment_functions - INFO - Early stopping at epoch 3950. Best Metrics: (0.009096103666557156, 0.0016528233639225669, 0.00531973507418415)
