2026-06-05 14:03:11,883 - optuna.study.study - INFO - Trial 45 finished with values: [0.0006220208307145299, 9.042802598968451e-05, 0.0002698113947988157] and parameters: {'n_layers': 4, 'embedding_dim': 256, 'lr': 0.021885874157007525, 'lambda_val': 0.04385302898822885, 'batch_size': 1989, 'optimizer': 'SGD'}.
2026-06-05 14:03:38,076 - experiment_functions - INFO - Early stopping at epoch 550. Best Metrics: (0.008935850615955013, 0.0010382477058074888, 0.004233399359018134)
2026-06-05 14:03:38,719 - optuna.study.study - INFO - Trial 46 finished with values: [0.008935850615955013, 0.0010382477058074888, 0.004233399359018134] and parameters: {'n_layers': 3, 'embedding_dim': 128, 'lr': 0.07148320651920811, 'lambda_val': 0.021395157619537992, 'batch_size': 1467, 'optimizer': 'Adam'}.
2026-06-05 14:04:17,054 - experiment_functions - INFO - Early stopping at epoch 850. Best Metrics: (0.006161752815739462, 0.0008841851430102487, 0.0033693259194783735)
2026-06-05 14:04:17,150 - optuna.study.study - INFO - Trial 47 finished with values: [0.006161752815739462, 0.0008841851430102487, 0.0033693259194783735] and parameters: {'n_layers': 1, 'embedding_dim': 256, 'lr': 0.09527885109298749, 'lambda_val': 4.778947336185181e-05, 'batch_size': 729, 'optimizer': 'RMSprop'}.
2026-06-05 14:04:40,449 - experiment_functions - INFO - Early stopping at epoch 500. Best Metrics: (0.00046965380385009906, 7.703128139862015e-05, 0.0002544608966113904)
2026-06-05 14:04:40,610 - optuna.study.study - INFO - Trial 48 finished with values: [0.00046965380385009906, 7.703128139862015e-05, 0.0002544608966113904] and parameters: {'n_layers': 4, 'embedding_dim': 96, 'lr': 0.0012977508691396867, 'lambda_val': 0.00016248928078577474, 'batch_size': 2481, 'optimizer': 'SGD'}.
2026-06-05 14:05:00,405 - experiment_functions - INFO - Early stopping at epoch 500. Best Metrics: (0.0003817198527094137, 7.368209525085404e-05, 0.0002333256691867263)
2026-06-05 14:05:00,615 - optuna.study.study - INFO - Trial 49 finished with values: [0.0003817198527094137, 7.368209525085404e-05, 0.0002333256691867263] and parameters: {'n_layers': 1, 'embedding_dim': 32, 'lr': 0.024896493062292777, 'lambda_val': 0.00014195880890034495, 'batch_size': 3571, 'optimizer': 'SGD'}.
2026-06-05 14:05:25,960 - experiment_functions - INFO - Early stopping at epoch 500. Best Metrics: (0.0004678465516268515, 7.368209525085404e-05, 0.0002147313881706489)
2026-06-05 14:05:26,193 - optuna.study.study - INFO - Trial 50 finished with values: [0.0004678465516268515, 7.368209525085404e-05, 0.0002147313881706489] and parameters: {'n_layers': 2, 'embedding_dim': 256, 'lr': 0.004991907428929939, 'lambda_val': 0.02936846366883511, 'batch_size': 2079, 'optimizer': 'SGD'}.
2026-06-05 14:05:46,523 - experiment_functions - INFO - Early stopping at epoch 500. Best Metrics: (0.0005927067719548271, 9.545180521133365e-05, 0.0002645028782743075)
2026-06-05 14:05:46,616 - optuna.study.study - INFO - Trial 51 finished with values: [0.0005927067719548271, 9.545180521133365e-05, 0.0002645028782743075] and parameters: {'n_layers': 2, 'embedding_dim': 32, 'lr': 6.876990202970542e-05, 'lambda_val': 0.0010787416649118934, 'batch_size': 3887, 'optimizer': 'SGD'}.
2026-06-05 14:06:07,362 - experiment_functions - INFO - Early stopping at epoch 500. Best Metrics: (0.0005929096080333978, 8.70788398419184e-05, 0.00026794108336785716)
2026-06-05 14:06:07,476 - optuna.study.study - INFO - Trial 52 finished with values: [0.0005929096080333978, 8.70788398419184e-05, 0.00026794108336785716] and parameters: {'n_layers': 3, 'embedding_dim': 32, 'lr': 0.0002857346242509807, 'lambda_val': 0.08580618687184582, 'batch_size': 2828, 'optimizer': 'RMSprop'}.
2026-06-05 14:06:27,624 - experiment_functions - INFO - Early stopping at epoch 500. Best Metrics: (0.0006844900209301865, 8.875343291580146e-05, 0.00038375645275571504)
2026-06-05 14:06:27,711 - optuna.study.study - INFO - Trial 53 finished with values: [0.0006844900209301865, 8.875343291580146e-05, 0.00038375645275571504] and parameters: {'n_layers': 2, 'embedding_dim': 32, 'lr': 7.37879398033151e-05, 'lambda_val': 7.487535492065269e-05, 'batch_size': 2271, 'optimizer': 'RMSprop'}.
2026-06-05 14:09:03,677 - optuna.study.study - INFO - Trial 54 finished with values: [0.050413734600144505, 0.006331636412351799, 0.026878711515129394] and parameters: {'n_layers': 3, 'embedding_dim': 32, 'lr': 0.00035382245097748176, 'lambda_val': 0.00011375426873786574, 'batch_size': 3477, 'optimizer': 'RMSprop'}.
2026-06-05 14:11:40,725 - optuna.study.study - INFO - Trial 55 finished with values: [0.03350986981109574, 0.0044108781566079445, 0.01740417171746455] and parameters: {'n_layers': 4, 'embedding_dim': 32, 'lr': 0.00029609176700534276, 'lambda_val': 0.00011721050749002031, 'batch_size': 2455, 'optimizer': 'RMSprop'}.
2026-06-05 14:12:04,782 - experiment_functions - INFO - Early stopping at epoch 550. Best Metrics: (0.012962634526468555, 0.0018219572643847547, 0.006446503043041162)
2026-06-05 14:12:04,881 - optuna.study.study - INFO - Trial 56 finished with values: [0.012962634526468555, 0.0018219572643847547, 0.006446503043041162] and parameters: {'n_layers': 1, 'embedding_dim': 128, 'lr': 0.056354797042132906, 'lambda_val': 0.003629328024442272, 'batch_size': 2586, 'optimizer': 'Adam'}.
2026-06-05 14:12:28,407 - experiment_functions - INFO - Early stopping at epoch 550. Best Metrics: (0.0046848197758488815, 0.0006614642641838035, 0.002368977405408624)
2026-06-05 14:12:28,515 - optuna.study.study - INFO - Trial 57 finished with values: [0.0046848197758488815, 0.0006614642641838035, 0.002368977405408624] and parameters: {'n_layers': 4, 'embedding_dim': 32, 'lr': 0.005189136595815164, 'lambda_val': 0.08580618687184582, 'batch_size': 1937, 'optimizer': 'RMSprop'}.
2026-06-05 14:15:09,296 - experiment_functions - INFO - Early stopping at epoch 3950. Best Metrics: (0.06830829058844443, 0.008516980373769174, 0.035200372321765074)
2026-06-05 14:15:09,525 - optuna.study.study - INFO - Trial 58 finished with values: [0.06830829058844443, 0.008516980373769174, 0.035200372321765074] and parameters: {'n_layers': 2, 'embedding_dim': 64, 'lr': 0.0008576367655519577, 'lambda_val': 0.0023604176548426264, 'batch_size': 926, 'optimizer': 'Adam'}.
2026-06-05 14:15:42,476 - experiment_functions - INFO - Early stopping at epoch 750. Best Metrics: (0.03023522324509929, 0.0035015741174894504, 0.01314677005875048)
2026-06-05 14:15:42,574 - optuna.study.study - INFO - Trial 59 finished with values: [0.03023522324509929, 0.0035015741174894504, 0.01314677005875048] and parameters: {'n_layers': 3, 'embedding_dim': 64, 'lr': 0.008261825578479428, 'lambda_val': 0.00033127211998733373, 'batch_size': 1529, 'optimizer': 'Adam'}.
2026-06-05 14:16:05,682 - experiment_functions - INFO - Early stopping at epoch 550. Best Metrics: (0.005550484454568512, 0.0007736620001339675, 0.0027254656862431303)
2026-06-05 14:16:05,995 - optuna.study.study - INFO - Trial 60 finished with values: [0.005550484454568512, 0.0007736620001339675, 0.0027254656862431303] and parameters: {'n_layers': 3, 'embedding_dim': 32, 'lr': 0.005189136595815164, 'lambda_val': 0.08580618687184582, 'batch_size': 1490, 'optimizer': 'RMSprop'}.
2026-06-05 14:16:38,566 - experiment_functions - INFO - Early stopping at epoch 750. Best Metrics: (0.0639554444416701, 0.007755040525152388, 0.03235689918434943)
2026-06-05 14:16:38,703 - optuna.study.study - INFO - Trial 61 finished with values: [0.0639554444416701, 0.007755040525152388, 0.03235689918434943] and parameters: {'n_layers': 2, 'embedding_dim': 64, 'lr': 0.0034108076646961875, 'lambda_val': 2.2392691089871585e-06, 'batch_size': 1774, 'optimizer': 'Adam'}.
2026-06-05 14:17:25,296 - experiment_functions - INFO - Early stopping at epoch 1000. Best Metrics: (0.018065936036648533, 0.002305914662736955, 0.008486598086255546)
2026-06-05 14:17:26,038 - optuna.study.study - INFO - Trial 62 finished with values: [0.018065936036648533, 0.002305914662736955, 0.008486598086255546] and parameters: {'n_layers': 4, 'embedding_dim': 96, 'lr': 0.0008260980234570757, 'lambda_val': 0.021886493172504122, 'batch_size': 2546, 'optimizer': 'Adam'}.
2026-06-05 14:18:05,753 - experiment_functions - INFO - Early stopping at epoch 800. Best Metrics: (0.015318102625843757, 0.0019023377319311412, 0.006817774666154883)
2026-06-05 14:18:05,874 - optuna.study.study - INFO - Trial 63 finished with values: [0.015318102625843757, 0.0019023377319311412, 0.006817774666154883] and parameters: {'n_layers': 4, 'embedding_dim': 128, 'lr': 0.0010962692711259227, 'lambda_val': 0.0296137038894491, 'batch_size': 2000, 'optimizer': 'Adam'}.
2026-06-05 14:18:38,384 - experiment_functions - INFO - Early stopping at epoch 750. Best Metrics: (0.03261559958670426, 0.003965436398955054, 0.01557024690897246)
2026-06-05 14:18:38,476 - optuna.study.study - INFO - Trial 64 finished with values: [0.03261559958670426, 0.003965436398955054, 0.01557024690897246] and parameters: {'n_layers': 1, 'embedding_dim': 128, 'lr': 0.009023344885011206, 'lambda_val': 0.003086353924928254, 'batch_size': 2271, 'optimizer': 'RMSprop'}.
2026-06-05 14:19:03,980 - experiment_functions - INFO - Early stopping at epoch 600. Best Metrics: (0.00031482104734432037, 7.033290910308795e-05, 0.00016061253867164331)
2026-06-05 14:19:04,123 - optuna.study.study - INFO - Trial 65 finished with values: [0.00031482104734432037, 7.033290910308795e-05, 0.00016061253867164331] and parameters: {'n_layers': 2, 'embedding_dim': 64, 'lr': 5.943480485051302e-05, 'lambda_val': 0.00941001736414929, 'batch_size': 1373, 'optimizer': 'Adam'}.
2026-06-05 14:19:27,704 - experiment_functions - INFO - Early stopping at epoch 550. Best Metrics: (0.009288306939148927, 0.0013246031214414896, 0.00476306197397333)
2026-06-05 14:19:27,874 - optuna.study.study - INFO - Trial 66 finished with values: [0.009288306939148927, 0.0013246031214414896, 0.00476306197397333] and parameters: {'n_layers': 2, 'embedding_dim': 64, 'lr': 0.009071427839704624, 'lambda_val': 0.04725669965811722, 'batch_size': 872, 'optimizer': 'Adam'}.
2026-06-05 14:20:36,455 - experiment_functions - INFO - Early stopping at epoch 1550. Best Metrics: (0.0006361726113345588, 7.870587447250318e-05, 0.0002597807330659424)
2026-06-05 14:20:36,540 - optuna.study.study - INFO - Trial 67 finished with values: [0.0006361726113345588, 7.870587447250318e-05, 0.0002597807330659424] and parameters: {'n_layers': 1, 'embedding_dim': 256, 'lr': 9.009937615404027e-05, 'lambda_val': 4.778947336185181e-05, 'batch_size': 522, 'optimizer': 'RMSprop'}.
2026-06-05 14:23:21,577 - optuna.study.study - INFO - Trial 68 finished with values: [0.06647802791804054, 0.007721548663674726, 0.031789553454369554] and parameters: {'n_layers': 1, 'embedding_dim': 128, 'lr': 0.004586159400047152, 'lambda_val': 2.2392691089871585e-06, 'batch_size': 1011, 'optimizer': 'RMSprop'}.
2026-06-05 14:24:08,490 - experiment_functions - INFO - Early stopping at epoch 1100. Best Metrics: (0.04633244032311277, 0.005735481278049434, 0.022957251363327585)
2026-06-05 14:24:08,730 - optuna.study.study - INFO - Trial 69 finished with values: [0.04633244032311277, 0.005735481278049434, 0.022957251363327585] and parameters: {'n_layers': 2, 'embedding_dim': 96, 'lr': 0.0009590496257981318, 'lambda_val': 0.007468981389036971, 'batch_size': 1769, 'optimizer': 'RMSprop'}.
2026-06-05 14:26:21,706 - experiment_functions - INFO - Early stopping at epoch 3600. Best Metrics: (0.0004087951032236487, 6.530912988143881e-05, 0.0002069465134283464)
2026-06-05 14:26:21,854 - optuna.study.study - INFO - Trial 70 finished with values: [0.0004087951032236487, 6.530912988143881e-05, 0.0002069465134283464] and parameters: {'n_layers': 2, 'embedding_dim': 32, 'lr': 5.762760446236896e-05, 'lambda_val': 0.00033127211998733373, 'batch_size': 2271, 'optimizer': 'Adam'}.
2026-06-05 14:26:53,398 - experiment_functions - INFO - Early stopping at epoch 550. Best Metrics: (0.012649363079096993, 0.0016025855717060754, 0.0061674941415392984)
2026-06-05 14:26:53,495 - optuna.study.study - INFO - Trial 71 finished with values: [0.012649363079096993, 0.0016025855717060754, 0.0061674941415392984] and parameters: {'n_layers': 3, 'embedding_dim': 256, 'lr': 0.004586159400047152, 'lambda_val': 0.08580618687184582, 'batch_size': 1011, 'optimizer': 'RMSprop'}.
2026-06-05 14:27:52,616 - experiment_functions - INFO - Early stopping at epoch 1350. Best Metrics: (0.03367951008943481, 0.003957063433585639, 0.015214156487923926)
2026-06-05 14:27:52,714 - optuna.study.study - INFO - Trial 72 finished with values: [0.03367951008943481, 0.003957063433585639, 0.015214156487923926] and parameters: {'n_layers': 4, 'embedding_dim': 64, 'lr': 0.0029470384606335377, 'lambda_val': 3.732019937312388e-06, 'batch_size': 2546, 'optimizer': 'RMSprop'}.
2026-06-05 14:28:59,443 - experiment_functions - INFO - Early stopping at epoch 1500. Best Metrics: (0.056455208770543205, 0.007212472369214282, 0.028709242191029664)
2026-06-05 14:28:59,532 - optuna.study.study - INFO - Trial 73 finished with values: [0.056455208770543205, 0.007212472369214282, 0.028709242191029664] and parameters: {'n_layers': 2, 'embedding_dim': 128, 'lr': 0.0007908861785647595, 'lambda_val': 0.0037563811732764327, 'batch_size': 1011, 'optimizer': 'RMSprop'}.
2026-06-05 14:31:35,234 - optuna.study.study - INFO - Trial 74 finished with values: [0.0539344043868978, 0.007522272087882643, 0.03120984957466702] and parameters: {'n_layers': 1, 'embedding_dim': 64, 'lr': 0.0009590496257981318, 'lambda_val': 5.587325552332493e-06, 'batch_size': 767, 'optimizer': 'RMSprop'}.
2026-06-05 14:32:14,394 - experiment_functions - INFO - Early stopping at epoch 950. Best Metrics: (0.03544979319495729, 0.004136244892491124, 0.01639343519791813)
2026-06-05 14:32:14,541 - optuna.study.study - INFO - Trial 75 finished with values: [0.03544979319495729, 0.004136244892491124, 0.01639343519791813] and parameters: {'n_layers': 4, 'embedding_dim': 32, 'lr': 0.0026407817619319117, 'lambda_val': 1.1327076247739166e-05, 'batch_size': 1624, 'optimizer': 'Adam'}.
2026-06-05 14:32:57,563 - experiment_functions - INFO - Early stopping at epoch 700. Best Metrics: (0.015003425369219208, 0.0019776944202558777, 0.00688011061983006)
2026-06-05 14:32:57,647 - optuna.study.study - INFO - Trial 76 finished with values: [0.015003425369219208, 0.0019776944202558777, 0.00688011061983006] and parameters: {'n_layers': 4, 'embedding_dim': 256, 'lr': 0.001414374009860838, 'lambda_val': 0.02560156160052963, 'batch_size': 2848, 'optimizer': 'Adam'}.
2026-06-05 14:33:21,237 - experiment_functions - INFO - Early stopping at epoch 550. Best Metrics: (0.01590771105747417, 0.0022372563467077506, 0.008019454548070461)
2026-06-05 14:33:21,325 - optuna.study.study - INFO - Trial 77 finished with values: [0.01590771105747417, 0.0022372563467077506, 0.008019454548070461] and parameters: {'n_layers': 1, 'embedding_dim': 128, 'lr': 0.06589928959328518, 'lambda_val': 3.4538148363737295e-06, 'batch_size': 2000, 'optimizer': 'Adam'}.
2026-06-05 14:36:08,418 - optuna.study.study - INFO - Trial 78 finished with values: [0.018648833598693584, 0.002855181190970594, 0.010621786387946862] and parameters: {'n_layers': 2, 'embedding_dim': 128, 'lr': 0.00017853594211867895, 'lambda_val': 9.558739147162892e-06, 'batch_size': 4002, 'optimizer': 'RMSprop'}.
2026-06-05 14:36:39,350 - experiment_functions - INFO - Early stopping at epoch 500. Best Metrics: (0.03071117814284971, 0.0038214213946011124, 0.013931059384358735)
2026-06-05 14:36:39,449 - optuna.study.study - INFO - Trial 79 finished with values: [0.03071117814284971, 0.0038214213946011124, 0.013931059384358735] and parameters: {'n_layers': 4, 'embedding_dim': 256, 'lr': 0.09527885109298749, 'lambda_val': 0.051056058442533477, 'batch_size': 681, 'optimizer': 'RMSprop'}.
2026-06-05 14:37:09,529 - experiment_functions - INFO - Early stopping at epoch 500. Best Metrics: (0.0005250407353696255, 5.6936164512023584e-05, 0.0002268367819711918)
2026-06-05 14:37:09,645 - optuna.study.study - INFO - Trial 80 finished with values: [0.0005250407353696255, 5.6936164512023584e-05, 0.0002268367819711918] and parameters: {'n_layers': 3, 'embedding_dim': 256, 'lr': 1.274607306757784e-05, 'lambda_val': 0.0021841916891966176, 'batch_size': 768, 'optimizer': 'RMSprop'}.
2026-06-05 14:37:35,106 - experiment_functions - INFO - Early stopping at epoch 600. Best Metrics: (0.03230948984835514, 0.004020697970393195, 0.015009118952388486)
2026-06-05 14:37:35,203 - optuna.study.study - INFO - Trial 81 finished with values: [0.03230948984835514, 0.004020697970393195, 0.015009118952388486] and parameters: {'n_layers': 2, 'embedding_dim': 32, 'lr': 0.009263044570931191, 'lambda_val': 0.0009472447880798233, 'batch_size': 1529, 'optimizer': 'Adam'}.
2026-06-05 14:40:17,685 - optuna.study.study - INFO - Trial 82 finished with values: [0.027021465113619914, 0.0042182999531113945, 0.014669507197176431] and parameters: {'n_layers': 2, 'embedding_dim': 96, 'lr': 0.0002857346242509807, 'lambda_val': 0.00408688017668438, 'batch_size': 2183, 'optimizer': 'Adam'}.
2026-06-05 14:41:07,148 - experiment_functions - INFO - Early stopping at epoch 1050. Best Metrics: (0.03033918442743221, 0.003746064706276375, 0.014407252455879456)
2026-06-05 14:41:07,298 - optuna.study.study - INFO - Trial 83 finished with values: [0.03033918442743221, 0.003746064706276375, 0.014407252455879456] and parameters: {'n_layers': 4, 'embedding_dim': 96, 'lr': 0.0007730079936260513, 'lambda_val': 0.005288720124154074, 'batch_size': 2394, 'optimizer': 'RMSprop'}.
2026-06-05 14:41:31,133 - experiment_functions - INFO - Early stopping at epoch 550. Best Metrics: (0.027114632732798273, 0.0035484627235581757, 0.01340162112957265)
2026-06-05 14:41:31,235 - optuna.study.study - INFO - Trial 84 finished with values: [0.027114632732798273, 0.0035484627235581757, 0.01340162112957265] and parameters: {'n_layers': 2, 'embedding_dim': 64, 'lr': 0.010315486857165407, 'lambda_val': 0.0021841916891966176, 'batch_size': 768, 'optimizer': 'RMSprop'}.
2026-06-05 14:44:04,393 - optuna.study.study - INFO - Trial 85 finished with values: [0.015095844072543366, 0.0023410811172884993, 0.008001192968515494] and parameters: {'n_layers': 3, 'embedding_dim': 32, 'lr': 0.00019511486736368744, 'lambda_val': 7.487535492065269e-05, 'batch_size': 2271, 'optimizer': 'RMSprop'}.
2026-06-05 14:44:29,711 - experiment_functions - INFO - Early stopping at epoch 500. Best Metrics: (0.0004241214148001392, 7.87058744725032e-05, 0.00019248878211691384)
2026-06-05 14:44:29,797 - optuna.study.study - INFO - Trial 86 finished with values: [0.0004241214148001392, 7.87058744725032e-05, 0.00019248878211691384] and parameters: {'n_layers': 4, 'embedding_dim': 128, 'lr': 0.0012977508691396867, 'lambda_val': 0.04385302898822885, 'batch_size': 2481, 'optimizer': 'SGD'}.
2026-06-05 14:47:14,297 - optuna.study.study - INFO - Trial 87 finished with values: [0.009689542807909622, 0.0016059347578538416, 0.004589465113047595] and parameters: {'n_layers': 4, 'embedding_dim': 64, 'lr': 0.00017225906647401988, 'lambda_val': 0.02560156160052963, 'batch_size': 2848, 'optimizer': 'RMSprop'}.
2026-06-05 14:50:22,170 - optuna.study.study - INFO - Trial 88 finished with values: [0.03555165345043265, 0.004874740438073549, 0.017825832327730662] and parameters: {'n_layers': 4, 'embedding_dim': 128, 'lr': 0.00024752772701677224, 'lambda_val': 0.003086353924928254, 'batch_size': 1307, 'optimizer': 'Adam'}.
2026-06-05 14:51:18,859 - experiment_functions - INFO - Early stopping at epoch 1050. Best Metrics: (0.00046802824975876597, 8.875343291580147e-05, 0.00024274337370118397)
2026-06-05 14:51:18,942 - optuna.study.study - INFO - Trial 89 finished with values: [0.00046802824975876597, 8.875343291580147e-05, 0.00024274337370118397] and parameters: {'n_layers': 3, 'embedding_dim': 256, 'lr': 3.308903814175601e-05, 'lambda_val': 0.00020574260712132375, 'batch_size': 1667, 'optimizer': 'Adam'}.
2026-06-05 14:51:41,315 - experiment_functions - INFO - Early stopping at epoch 550. Best Metrics: (0.021071477331318214, 0.0030594815459843256, 0.010446931020368732)
2026-06-05 14:51:41,395 - optuna.study.study - INFO - Trial 90 finished with values: [0.021071477331318214, 0.0030594815459843256, 0.010446931020368732] and parameters: {'n_layers': 1, 'embedding_dim': 32, 'lr': 0.027400834032566487, 'lambda_val': 0.007468981389036971, 'batch_size': 2690, 'optimizer': 'Adam'}.
2026-06-05 14:54:38,360 - optuna.study.study - INFO - Trial 91 finished with values: [0.029100901516236916, 0.0041814589054859665, 0.015726563606310147] and parameters: {'n_layers': 3, 'embedding_dim': 128, 'lr': 0.00017853594211867895, 'lambda_val': 5.271774885829176e-06, 'batch_size': 2586, 'optimizer': 'RMSprop'}.
2026-06-05 14:56:10,911 - experiment_functions - INFO - Early stopping at epoch 2250. Best Metrics: (0.0006935744167455169, 0.00010047558443298278, 0.0003214975674863556)
2026-06-05 14:56:10,999 - optuna.study.study - INFO - Trial 92 finished with values: [0.0006935744167455169, 0.00010047558443298278, 0.0003214975674863556] and parameters: {'n_layers': 4, 'embedding_dim': 64, 'lr': 3.308903814175601e-05, 'lambda_val': 3.5647402690247963e-06, 'batch_size': 1667, 'optimizer': 'RMSprop'}.
2026-06-05 14:58:43,915 - optuna.study.study - INFO - Trial 93 finished with values: [0.06755413810054667, 0.008846875209324135, 0.03846960949282339] and parameters: {'n_layers': 1, 'embedding_dim': 32, 'lr': 0.0009590496257981318, 'lambda_val': 3.684365830705915e-05, 'batch_size': 2108, 'optimizer': 'RMSprop'}.
2026-06-05 14:59:04,611 - experiment_functions - INFO - Early stopping at epoch 500. Best Metrics: (0.00035473159169387364, 5.526157143814054e-05, 0.0001445104561835435)
