2026-06-07 06:21:39,310 - optuna.study.study - INFO - Trial 95 finished with values: [0.011530308789508174, 0.0017382276106906024, 0.007094340851717863] and parameters: {'n_layers': 1, 'embedding_dim': 32, 'lr': 0.0010160627847963985, 'lambda_val': 0.0008628561498380414, 'batch_size': 572, 'optimizer': 'RMSprop'}.
2026-06-07 06:24:06,258 - optuna.study.study - INFO - Trial 96 finished with values: [0.008391056060386438, 0.0013379998660325541, 0.004325277173232943] and parameters: {'n_layers': 2, 'embedding_dim': 32, 'lr': 0.0623667533495946, 'lambda_val': 0.005434072620439486, 'batch_size': 758, 'optimizer': 'RMSprop'}.
2026-06-07 06:24:28,252 - experiment_functions - INFO - Early stopping at epoch 500. Best Metrics: (0.0004845932973062798, 7.703128139862015e-05, 0.00023621189216645918)
2026-06-07 06:24:28,354 - optuna.study.study - INFO - Trial 97 finished with values: [0.0004845932973062798, 7.703128139862015e-05, 0.00023621189216645918] and parameters: {'n_layers': 3, 'embedding_dim': 96, 'lr': 0.023750676895038965, 'lambda_val': 5.775403096605942e-06, 'batch_size': 628, 'optimizer': 'SGD'}.
2026-06-07 06:28:00,805 - optuna.study.study - INFO - Trial 98 finished with values: [0.03637106837203954, 0.005581418715252194, 0.020080012997752156] and parameters: {'n_layers': 4, 'embedding_dim': 256, 'lr': 0.0004340370842280224, 'lambda_val': 5.604086483439305e-05, 'batch_size': 1703, 'optimizer': 'RMSprop'}.
2026-06-07 06:30:28,398 - optuna.study.study - INFO - Trial 99 finished with values: [0.007188955119991089, 0.00111025520798446, 0.004191126168091452] and parameters: {'n_layers': 1, 'embedding_dim': 64, 'lr': 0.0005072367508583051, 'lambda_val': 1.8902402933529376e-05, 'batch_size': 1315, 'optimizer': 'RMSprop'}.
2026-06-07 06:32:51,251 - experiment_functions - INFO - Early stopping at epoch 3400. Best Metrics: (0.014933490985248129, 0.002421461584834885, 0.007992287732967496)
2026-06-07 06:32:51,332 - optuna.study.study - INFO - Trial 100 finished with values: [0.014933490985248129, 0.002421461584834885, 0.007992287732967496] and parameters: {'n_layers': 4, 'embedding_dim': 96, 'lr': 0.0004340370842280224, 'lambda_val': 0.01640628387641808, 'batch_size': 1703, 'optimizer': 'RMSprop'}.
2026-06-07 06:35:21,375 - optuna.study.study - INFO - Trial 101 finished with values: [0.020650401048661778, 0.003315694286288432, 0.012143991483031944] and parameters: {'n_layers': 2, 'embedding_dim': 32, 'lr': 0.0006306952898324421, 'lambda_val': 5.604086483439305e-05, 'batch_size': 2687, 'optimizer': 'RMSprop'}.
2026-06-07 06:35:53,206 - experiment_functions - INFO - Early stopping at epoch 650. Best Metrics: (0.01355014588405847, 0.002153526693013598, 0.007130598162728364)
2026-06-07 06:35:53,289 - optuna.study.study - INFO - Trial 102 finished with values: [0.01355014588405847, 0.002153526693013598, 0.007130598162728364] and parameters: {'n_layers': 2, 'embedding_dim': 256, 'lr': 0.002620274475670763, 'lambda_val': 0.005434072620439486, 'batch_size': 2687, 'optimizer': 'RMSprop'}.
2026-06-07 06:36:54,309 - experiment_functions - INFO - Early stopping at epoch 1600. Best Metrics: (0.008075749660313842, 0.0011973340478263783, 0.004064432001654949)
2026-06-07 06:36:54,401 - optuna.study.study - INFO - Trial 103 finished with values: [0.008075749660313842, 0.0011973340478263783, 0.004064432001654949] and parameters: {'n_layers': 2, 'embedding_dim': 32, 'lr': 0.002620274475670763, 'lambda_val': 0.0802171310991648, 'batch_size': 2687, 'optimizer': 'RMSprop'}.
2026-06-07 06:37:25,494 - experiment_functions - INFO - Early stopping at epoch 550. Best Metrics: (0.011014350081309077, 0.0017181324938040058, 0.005518148876021679)
2026-06-07 06:37:26,828 - optuna.study.study - INFO - Trial 104 finished with values: [0.011014350081309077, 0.0017181324938040058, 0.005518148876021679] and parameters: {'n_layers': 4, 'embedding_dim': 256, 'lr': 0.006175201562705211, 'lambda_val': 0.005434072620439486, 'batch_size': 2571, 'optimizer': 'RMSprop'}.
2026-06-07 06:38:00,557 - experiment_functions - INFO - Early stopping at epoch 600. Best Metrics: (0.022827760801880093, 0.003409471498425883, 0.011830525213222814)
2026-06-07 06:38:01,440 - optuna.study.study - INFO - Trial 105 finished with values: [0.022827760801880093, 0.003409471498425883, 0.011830525213222814] and parameters: {'n_layers': 4, 'embedding_dim': 256, 'lr': 0.002168096883511623, 'lambda_val': 5.604086483439305e-05, 'batch_size': 2975, 'optimizer': 'RMSprop'}.
2026-06-07 06:40:40,870 - optuna.study.study - INFO - Trial 106 finished with values: [0.02402261515930279, 0.003856587849152656, 0.013609927785474289] and parameters: {'n_layers': 2, 'embedding_dim': 96, 'lr': 0.0013734258944280648, 'lambda_val': 0.00010082268820599092, 'batch_size': 628, 'optimizer': 'Adam'}.
2026-06-07 06:41:01,433 - experiment_functions - INFO - Early stopping at epoch 500. Best Metrics: (0.00036966698337527075, 6.698372295532186e-05, 0.0001730235909686674)
2026-06-07 06:41:01,517 - optuna.study.study - INFO - Trial 107 finished with values: [0.00036966698337527075, 6.698372295532186e-05, 0.0001730235909686674] and parameters: {'n_layers': 3, 'embedding_dim': 32, 'lr': 0.002168096883511623, 'lambda_val': 5.604086483439305e-05, 'batch_size': 1212, 'optimizer': 'SGD'}.
2026-06-07 06:41:22,182 - experiment_functions - INFO - Early stopping at epoch 500. Best Metrics: (0.00042602977892333016, 6.530912988143881e-05, 0.000180279836477453)
2026-06-07 06:41:22,960 - optuna.study.study - INFO - Trial 108 finished with values: [0.00042602977892333016, 6.530912988143881e-05, 0.000180279836477453] and parameters: {'n_layers': 1, 'embedding_dim': 64, 'lr': 0.002168096883511623, 'lambda_val': 0.01247604248844867, 'batch_size': 2975, 'optimizer': 'SGD'}.
2026-06-07 06:43:49,540 - optuna.study.study - INFO - Trial 109 finished with values: [0.012203657082201775, 0.001979369013329761, 0.007246830831016436] and parameters: {'n_layers': 1, 'embedding_dim': 32, 'lr': 0.0008160092957204142, 'lambda_val': 0.0001648461698938241, 'batch_size': 1182, 'optimizer': 'RMSprop'}.
2026-06-07 06:44:23,245 - experiment_functions - INFO - Early stopping at epoch 850. Best Metrics: (0.018209541747552304, 0.0029104427624087347, 0.010161655120286554)
2026-06-07 06:44:23,648 - optuna.study.study - INFO - Trial 110 finished with values: [0.018209541747552304, 0.0029104427624087347, 0.010161655120286554] and parameters: {'n_layers': 2, 'embedding_dim': 32, 'lr': 0.002620274475670763, 'lambda_val': 0.0002115220011623213, 'batch_size': 2649, 'optimizer': 'RMSprop'}.
2026-06-07 06:44:48,260 - experiment_functions - INFO - Early stopping at epoch 550. Best Metrics: (0.009908690800570696, 0.001331301493737022, 0.005085773187989704)
2026-06-07 06:44:48,369 - optuna.study.study - INFO - Trial 111 finished with values: [0.009908690800570696, 0.001331301493737022, 0.005085773187989704] and parameters: {'n_layers': 3, 'embedding_dim': 96, 'lr': 0.08900268421806791, 'lambda_val': 2.029005253393236e-05, 'batch_size': 1182, 'optimizer': 'Adam'}.
2026-06-07 06:46:19,938 - experiment_functions - INFO - Early stopping at epoch 2300. Best Metrics: (0.0005548560275655892, 8.038046754638624e-05, 0.00026414078228961796)
2026-06-07 06:46:20,612 - optuna.study.study - INFO - Trial 112 finished with values: [0.0005548560275655892, 8.038046754638624e-05, 0.00026414078228961796] and parameters: {'n_layers': 2, 'embedding_dim': 128, 'lr': 1.9519043227070812e-05, 'lambda_val': 2.3950847744868506e-06, 'batch_size': 616, 'optimizer': 'RMSprop'}.
2026-06-07 06:49:06,775 - optuna.study.study - INFO - Trial 113 finished with values: [0.011358552080261713, 0.001875544242749012, 0.006260841007257407] and parameters: {'n_layers': 1, 'embedding_dim': 256, 'lr': 0.0008019801878988406, 'lambda_val': 0.007223156374299393, 'batch_size': 1312, 'optimizer': 'RMSprop'}.
2026-06-07 06:49:47,257 - experiment_functions - INFO - Early stopping at epoch 850. Best Metrics: (0.017713139929927707, 0.002753031013463729, 0.009274267551869922)
2026-06-07 06:49:47,346 - optuna.study.study - INFO - Trial 114 finished with values: [0.017713139929927707, 0.002753031013463729, 0.009274267551869922] and parameters: {'n_layers': 2, 'embedding_dim': 256, 'lr': 0.002620274475670763, 'lambda_val': 0.00010082268820599092, 'batch_size': 2050, 'optimizer': 'RMSprop'}.
2026-06-07 06:52:17,773 - optuna.study.study - INFO - Trial 115 finished with values: [0.01769172769988999, 0.00295733136847746, 0.010789930011240338] and parameters: {'n_layers': 4, 'embedding_dim': 32, 'lr': 0.0004340370842280224, 'lambda_val': 0.001761785848083831, 'batch_size': 572, 'optimizer': 'RMSprop'}.
2026-06-07 06:52:38,019 - experiment_functions - INFO - Early stopping at epoch 500. Best Metrics: (0.0005755341419959481, 8.70788398419184e-05, 0.0002747117427857013)
2026-06-07 06:52:38,100 - optuna.study.study - INFO - Trial 116 finished with values: [0.0005755341419959481, 8.70788398419184e-05, 0.0002747117427857013] and parameters: {'n_layers': 1, 'embedding_dim': 64, 'lr': 0.000278635546647775, 'lambda_val': 0.01247604248844867, 'batch_size': 2198, 'optimizer': 'RMSprop'}.
2026-06-07 06:53:29,214 - experiment_functions - INFO - Early stopping at epoch 1300. Best Metrics: (0.02090067697734532, 0.0032152187018554498, 0.010955210328634923)
2026-06-07 06:53:29,324 - optuna.study.study - INFO - Trial 117 finished with values: [0.02090067697734532, 0.0032152187018554498, 0.010955210328634923] and parameters: {'n_layers': 2, 'embedding_dim': 64, 'lr': 0.0038611334200534756, 'lambda_val': 2.3950847744868506e-06, 'batch_size': 616, 'optimizer': 'RMSprop'}.
2026-06-07 06:54:50,417 - experiment_functions - INFO - Early stopping at epoch 2050. Best Metrics: (0.011309540956074353, 0.0016712438877352807, 0.005422298433955901)
2026-06-07 06:54:50,499 - optuna.study.study - INFO - Trial 118 finished with values: [0.011309540956074353, 0.0016712438877352807, 0.005422298433955901] and parameters: {'n_layers': 2, 'embedding_dim': 96, 'lr': 0.023750676895038965, 'lambda_val': 0.0023488579024072286, 'batch_size': 3503, 'optimizer': 'RMSprop'}.
2026-06-07 06:57:20,364 - optuna.study.study - INFO - Trial 119 finished with values: [0.011332633116294526, 0.001835354008975819, 0.006377806146583131] and parameters: {'n_layers': 4, 'embedding_dim': 32, 'lr': 0.00022539328419737375, 'lambda_val': 5.604086483439305e-05, 'batch_size': 2687, 'optimizer': 'RMSprop'}.
2026-06-07 06:57:57,749 - experiment_functions - INFO - Early stopping at epoch 950. Best Metrics: (0.02557762256976661, 0.0039252461651818615, 0.014083882493161906)
2026-06-07 06:57:57,840 - optuna.study.study - INFO - Trial 120 finished with values: [0.02557762256976661, 0.0039252461651818615, 0.014083882493161906] and parameters: {'n_layers': 3, 'embedding_dim': 32, 'lr': 0.003577419943834574, 'lambda_val': 5.656965316395304e-06, 'batch_size': 1182, 'optimizer': 'RMSprop'}.
2026-06-07 07:00:28,233 - optuna.study.study - INFO - Trial 121 finished with values: [0.012836934720918158, 0.0021652488445307793, 0.007664258532872376] and parameters: {'n_layers': 2, 'embedding_dim': 64, 'lr': 0.0004340370842280224, 'lambda_val': 0.0059525210668399465, 'batch_size': 2050, 'optimizer': 'Adam'}.
2026-06-07 07:01:58,641 - experiment_functions - INFO - Early stopping at epoch 2050. Best Metrics: (0.012868098495642308, 0.002019559247102954, 0.006792793090134295)
2026-06-07 07:01:58,743 - optuna.study.study - INFO - Trial 122 finished with values: [0.012868098495642308, 0.002019559247102954, 0.006792793090134295] and parameters: {'n_layers': 4, 'embedding_dim': 128, 'lr': 0.0009791612272847586, 'lambda_val': 0.02500021456838615, 'batch_size': 621, 'optimizer': 'Adam'}.
2026-06-07 07:02:21,445 - experiment_functions - INFO - Early stopping at epoch 550. Best Metrics: (0.005694834045118088, 0.0008506932815325876, 0.0031905771841949085)
2026-06-07 07:02:21,531 - optuna.study.study - INFO - Trial 123 finished with values: [0.005694834045118088, 0.0008506932815325876, 0.0031905771841949085] and parameters: {'n_layers': 2, 'embedding_dim': 64, 'lr': 0.08900268421806791, 'lambda_val': 0.00010082268820599092, 'batch_size': 2945, 'optimizer': 'Adam'}.
2026-06-07 07:03:52,311 - experiment_functions - INFO - Early stopping at epoch 2450. Best Metrics: (0.008715724913026777, 0.0013078571907026593, 0.004220662760674402)
2026-06-07 07:03:52,634 - optuna.study.study - INFO - Trial 124 finished with values: [0.008715724913026777, 0.0013078571907026593, 0.004220662760674402] and parameters: {'n_layers': 1, 'embedding_dim': 64, 'lr': 0.07402063684569152, 'lambda_val': 0.03814463959770115, 'batch_size': 1315, 'optimizer': 'Adam'}.
2026-06-07 07:06:23,966 - optuna.study.study - INFO - Trial 125 finished with values: [0.03314658559832102, 0.005065644048496215, 0.018915583895986736] and parameters: {'n_layers': 3, 'embedding_dim': 32, 'lr': 0.0010160627847963985, 'lambda_val': 0.0008628561498380414, 'batch_size': 572, 'optimizer': 'RMSprop'}.
2026-06-07 07:07:20,134 - experiment_functions - INFO - Early stopping at epoch 1500. Best Metrics: (0.00046940160041365964, 5.526157143814054e-05, 0.00018017254130288485)
2026-06-07 07:07:20,230 - optuna.study.study - INFO - Trial 126 finished with values: [0.00046940160041365964, 5.526157143814054e-05, 0.00018017254130288485] and parameters: {'n_layers': 3, 'embedding_dim': 32, 'lr': 1.395847258170429e-05, 'lambda_val': 0.0037737243045340963, 'batch_size': 1182, 'optimizer': 'RMSprop'}.
2026-06-07 07:07:48,689 - experiment_functions - INFO - Early stopping at epoch 700. Best Metrics: (0.02048711288294085, 0.003201821957264385, 0.011157680334774631)
2026-06-07 07:07:48,793 - optuna.study.study - INFO - Trial 127 finished with values: [0.02048711288294085, 0.003201821957264385, 0.011157680334774631] and parameters: {'n_layers': 3, 'embedding_dim': 32, 'lr': 0.003577419943834574, 'lambda_val': 5.656965316395304e-06, 'batch_size': 2975, 'optimizer': 'RMSprop'}.
2026-06-07 07:08:39,819 - experiment_functions - INFO - Early stopping at epoch 1000. Best Metrics: (0.027526290971024547, 0.004258490186884587, 0.014456229178800949)
2026-06-07 07:08:39,891 - optuna.study.study - INFO - Trial 128 finished with values: [0.027526290971024547, 0.004258490186884587, 0.014456229178800949] and parameters: {'n_layers': 3, 'embedding_dim': 256, 'lr': 0.0013734258944280648, 'lambda_val': 1.8902402933529376e-05, 'batch_size': 1703, 'optimizer': 'RMSprop'}.
2026-06-07 07:10:46,473 - experiment_functions - INFO - Early stopping at epoch 3300. Best Metrics: (0.01130216879127688, 0.0017733940652421465, 0.0058103471264002405)
2026-06-07 07:10:46,568 - optuna.study.study - INFO - Trial 129 finished with values: [0.01130216879127688, 0.0017733940652421465, 0.0058103471264002405] and parameters: {'n_layers': 1, 'embedding_dim': 128, 'lr': 0.0038611334200534756, 'lambda_val': 0.01247604248844867, 'batch_size': 1312, 'optimizer': 'RMSprop'}.
2026-06-07 07:13:08,906 - experiment_functions - INFO - Early stopping at epoch 3600. Best Metrics: (0.029371944915956127, 0.004479536472637149, 0.01655044019396733)
2026-06-07 07:13:08,984 - optuna.study.study - INFO - Trial 130 finished with values: [0.029371944915956127, 0.004479536472637149, 0.01655044019396733] and parameters: {'n_layers': 2, 'embedding_dim': 96, 'lr': 0.0009791612272847586, 'lambda_val': 1.471855561908882e-05, 'batch_size': 1514, 'optimizer': 'RMSprop'}.
2026-06-07 07:13:48,667 - experiment_functions - INFO - Early stopping at epoch 1000. Best Metrics: (0.018238783239663242, 0.00266595217362181, 0.009172881960238763)
2026-06-07 07:13:49,007 - optuna.study.study - INFO - Trial 131 finished with values: [0.018238783239663242, 0.00266595217362181, 0.009172881960238763] and parameters: {'n_layers': 4, 'embedding_dim': 32, 'lr': 0.006175201562705211, 'lambda_val': 5.604086483439305e-05, 'batch_size': 877, 'optimizer': 'RMSprop'}.
2026-06-07 07:14:20,583 - experiment_functions - INFO - Early stopping at epoch 600. Best Metrics: (0.01983225374343905, 0.0030578069529104425, 0.01004131275396441)
2026-06-07 07:14:20,661 - optuna.study.study - INFO - Trial 132 finished with values: [0.01983225374343905, 0.0030578069529104425, 0.01004131275396441] and parameters: {'n_layers': 3, 'embedding_dim': 256, 'lr': 0.003577419943834574, 'lambda_val': 5.656965316395304e-06, 'batch_size': 3503, 'optimizer': 'RMSprop'}.
2026-06-07 07:14:43,355 - experiment_functions - INFO - Early stopping at epoch 550. Best Metrics: (0.005463337551556385, 0.0007468685109518388, 0.0029747508095656935)
2026-06-07 07:14:43,436 - optuna.study.study - INFO - Trial 133 finished with values: [0.005463337551556385, 0.0007468685109518388, 0.0029747508095656935] and parameters: {'n_layers': 2, 'embedding_dim': 64, 'lr': 0.0656762277075806, 'lambda_val': 2.3950847744868506e-06, 'batch_size': 2050, 'optimizer': 'RMSprop'}.
2026-06-07 07:17:10,874 - optuna.study.study - INFO - Trial 134 finished with values: [0.01653487326175732, 0.002686047290508406, 0.01016609917182863] and parameters: {'n_layers': 2, 'embedding_dim': 32, 'lr': 0.0005083437319990123, 'lambda_val': 0.00010082268820599092, 'batch_size': 2050, 'optimizer': 'RMSprop'}.
2026-06-07 07:17:39,007 - experiment_functions - INFO - Early stopping at epoch 650. Best Metrics: (0.011438325664207652, 0.0017934891821287425, 0.006116639278446592)
2026-06-07 07:17:39,086 - optuna.study.study - INFO - Trial 135 finished with values: [0.011438325664207652, 0.0017934891821287425, 0.006116639278446592] and parameters: {'n_layers': 2, 'embedding_dim': 128, 'lr': 0.00452528290927792, 'lambda_val': 0.021783435050720258, 'batch_size': 2155, 'optimizer': 'Adam'}.
2026-06-07 07:20:16,074 - experiment_functions - INFO - Early stopping at epoch 3850. Best Metrics: (0.018619568930422985, 0.003126465268939648, 0.010453215741328353)
2026-06-07 07:20:16,161 - optuna.study.study - INFO - Trial 136 finished with values: [0.018619568930422985, 0.003126465268939648, 0.010453215741328353] and parameters: {'n_layers': 3, 'embedding_dim': 96, 'lr': 0.0004340370842280224, 'lambda_val': 0.0059525210668399465, 'batch_size': 2649, 'optimizer': 'Adam'}.
2026-06-07 07:21:10,842 - experiment_functions - INFO - Early stopping at epoch 1400. Best Metrics: (0.01479249860338342, 0.0023159622211802533, 0.00831930729725433)
2026-06-07 07:21:11,519 - optuna.study.study - INFO - Trial 137 finished with values: [0.01479249860338342, 0.0023159622211802533, 0.00831930729725433] and parameters: {'n_layers': 1, 'embedding_dim': 96, 'lr': 0.002168096883511623, 'lambda_val': 5.604086483439305e-05, 'batch_size': 2975, 'optimizer': 'RMSprop'}.
2026-06-07 07:21:34,134 - experiment_functions - INFO - Early stopping at epoch 550. Best Metrics: (0.004711613413888377, 0.0007435193248040726, 0.0025828592459552157)
2026-06-07 07:21:34,223 - optuna.study.study - INFO - Trial 138 finished with values: [0.004711613413888377, 0.0007435193248040726, 0.0025828592459552157] and parameters: {'n_layers': 4, 'embedding_dim': 32, 'lr': 0.0623667533495946, 'lambda_val': 1.0308897870221961e-06, 'batch_size': 877, 'optimizer': 'RMSprop'}.
2026-06-07 07:22:09,711 - experiment_functions - INFO - Early stopping at epoch 900. Best Metrics: (0.018729618973488214, 0.0027865228749413893, 0.009625391749122409)
2026-06-07 07:22:09,807 - optuna.study.study - INFO - Trial 139 finished with values: [0.018729618973488214, 0.0027865228749413893, 0.009625391749122409] and parameters: {'n_layers': 3, 'embedding_dim': 32, 'lr': 0.006175201562705211, 'lambda_val': 5.656965316395304e-06, 'batch_size': 877, 'optimizer': 'RMSprop'}.
2026-06-07 07:22:31,314 - experiment_functions - INFO - Early stopping at epoch 500. Best Metrics: (0.0004760144660954972, 9.210261906356756e-05, 0.0002548174756324519)
2026-06-07 07:22:31,401 - optuna.study.study - INFO - Trial 140 finished with values: [0.0004760144660954972, 9.210261906356756e-05, 0.0002548174756324519] and parameters: {'n_layers': 4, 'embedding_dim': 64, 'lr': 0.0010160627847963985, 'lambda_val': 0.07313955329047682, 'batch_size': 2881, 'optimizer': 'SGD'}.
2026-06-07 07:25:18,260 - optuna.study.study - INFO - Trial 141 finished with values: [0.005561669629857505, 0.000899256480675196, 0.0031856633390623407] and parameters: {'n_layers': 1, 'embedding_dim': 256, 'lr': 0.0004340370842280224, 'lambda_val': 5.604086483439305e-05, 'batch_size': 1703, 'optimizer': 'Adam'}.
2026-06-07 07:25:50,282 - experiment_functions - INFO - Early stopping at epoch 650. Best Metrics: (0.015462385879716678, 0.0024800723424207916, 0.008393296668659947)
2026-06-07 07:25:50,362 - optuna.study.study - INFO - Trial 142 finished with values: [0.015462385879716678, 0.0024800723424207916, 0.008393296668659947] and parameters: {'n_layers': 2, 'embedding_dim': 256, 'lr': 0.006175201562705211, 'lambda_val': 0.00010082268820599092, 'batch_size': 3939, 'optimizer': 'Adam'}.
2026-06-07 07:26:15,019 - experiment_functions - INFO - Early stopping at epoch 500. Best Metrics: (0.002795603490670984, 0.0004203228615446447, 0.0018208427677939946)
2026-06-07 07:26:15,354 - optuna.study.study - INFO - Trial 143 finished with values: [0.002795603490670984, 0.0004203228615446447, 0.0018208427677939946] and parameters: {'n_layers': 2, 'embedding_dim': 256, 'lr': 0.08766342330978934, 'lambda_val': 0.0059525210668399465, 'batch_size': 1703, 'optimizer': 'Adam'}.
2026-06-07 07:26:41,396 - experiment_functions - INFO - Early stopping at epoch 550. Best Metrics: (0.014493849353612174, 0.002123384017683703, 0.007634321709339937)
2026-06-07 07:26:41,503 - optuna.study.study - INFO - Trial 144 finished with values: [0.014493849353612174, 0.002123384017683703, 0.007634321709339937] and parameters: {'n_layers': 4, 'embedding_dim': 128, 'lr': 0.013387802594397556, 'lambda_val': 3.626772695067491e-06, 'batch_size': 877, 'optimizer': 'RMSprop'}.
2026-06-07 07:27:12,223 - experiment_functions - INFO - Early stopping at epoch 550. Best Metrics: (0.010244536750561016, 0.0014234041128005895, 0.005060937818288987)
