2026-06-03 22:40:33,484 - optuna.study.study - INFO - Trial 221 finished with values: [0.00735684191090229, 0.0013011588184071272, 0.00420653690543983] and parameters: {'n_layers': 3, 'embedding_dim': 128, 'lr': 0.00280088767043512, 'lambda_val': 0.00010733978042493688, 'batch_size': 2575, 'optimizer': 'RMSprop'}.
2026-06-03 22:41:21,500 - experiment_functions - INFO - Early stopping at epoch 1150. Best Metrics: (0.007437801659141102, 0.0013379998660325541, 0.0044884850346205785)
2026-06-03 22:41:21,586 - optuna.study.study - INFO - Trial 222 finished with values: [0.007437801659141102, 0.0013379998660325541, 0.0044884850346205785] and parameters: {'n_layers': 3, 'embedding_dim': 96, 'lr': 0.002060594231766347, 'lambda_val': 0.00021888803225104277, 'batch_size': 1308, 'optimizer': 'Adam'}.
2026-06-03 22:43:59,958 - optuna.study.study - INFO - Trial 223 finished with values: [0.012109390697979087, 0.002116685645388171, 0.007211518408915599] and parameters: {'n_layers': 4, 'embedding_dim': 64, 'lr': 0.0006306221245460524, 'lambda_val': 0.0006427391414032312, 'batch_size': 836, 'optimizer': 'Adam'}.
2026-06-03 22:45:48,660 - experiment_functions - INFO - Early stopping at epoch 2250. Best Metrics: (0.010206339867401264, 0.0018269810436064035, 0.005862739553500837)
2026-06-03 22:45:48,865 - optuna.study.study - INFO - Trial 224 finished with values: [0.010206339867401264, 0.0018269810436064035, 0.005862739553500837] and parameters: {'n_layers': 3, 'embedding_dim': 256, 'lr': 0.0006306221245460524, 'lambda_val': 1.4920813731644995e-06, 'batch_size': 1308, 'optimizer': 'RMSprop'}.
2026-06-03 22:47:25,774 - experiment_functions - INFO - Early stopping at epoch 2300. Best Metrics: (0.010080309050521477, 0.0017499497622077834, 0.0056019774016278605)
2026-06-03 22:47:25,876 - optuna.study.study - INFO - Trial 225 finished with values: [0.010080309050521477, 0.0017499497622077834, 0.0056019774016278605] and parameters: {'n_layers': 3, 'embedding_dim': 128, 'lr': 0.000710331438856921, 'lambda_val': 8.50693942128844e-06, 'batch_size': 2258, 'optimizer': 'RMSprop'}.
2026-06-03 22:48:06,250 - experiment_functions - INFO - Early stopping at epoch 800. Best Metrics: (0.007775826106115304, 0.001373166320584098, 0.004444833648307584)
2026-06-03 22:48:06,344 - optuna.study.study - INFO - Trial 226 finished with values: [0.007775826106115304, 0.001373166320584098, 0.004444833648307584] and parameters: {'n_layers': 3, 'embedding_dim': 256, 'lr': 0.0017052659380858766, 'lambda_val': 1.4920813731644995e-06, 'batch_size': 3484, 'optimizer': 'RMSprop'}.
2026-06-03 22:49:17,305 - experiment_functions - INFO - Early stopping at epoch 1750. Best Metrics: (0.00984171596625633, 0.0017415767968383682, 0.005843801213356283)
2026-06-03 22:49:17,599 - optuna.study.study - INFO - Trial 227 finished with values: [0.00984171596625633, 0.0017415767968383682, 0.005843801213356283] and parameters: {'n_layers': 4, 'embedding_dim': 64, 'lr': 0.000710331438856921, 'lambda_val': 8.50693942128844e-06, 'batch_size': 3398, 'optimizer': 'RMSprop'}.
2026-06-03 22:50:02,961 - experiment_functions - INFO - Early stopping at epoch 900. Best Metrics: (0.006834809722194854, 0.001193984861678612, 0.0037575967565619144)
2026-06-03 22:50:03,060 - optuna.study.study - INFO - Trial 228 finished with values: [0.006834809722194854, 0.001193984861678612, 0.0037575967565619144] and parameters: {'n_layers': 3, 'embedding_dim': 256, 'lr': 0.0067486297711533616, 'lambda_val': 1.4920813731644995e-06, 'batch_size': 1308, 'optimizer': 'Adam'}.
2026-06-03 22:50:42,815 - experiment_functions - INFO - Early stopping at epoch 1000. Best Metrics: (0.01151902735852457, 0.0021501775068658315, 0.0068626046472565205)
2026-06-03 22:50:43,665 - optuna.study.study - INFO - Trial 229 finished with values: [0.01151902735852457, 0.0021501775068658315, 0.0068626046472565205] and parameters: {'n_layers': 4, 'embedding_dim': 32, 'lr': 0.002060594231766347, 'lambda_val': 0.00047268866494377303, 'batch_size': 790, 'optimizer': 'RMSprop'}.
2026-06-03 22:53:18,617 - optuna.study.study - INFO - Trial 230 finished with values: [0.008748223119523516, 0.0015054591734208588, 0.005302062416834227] and parameters: {'n_layers': 3, 'embedding_dim': 64, 'lr': 0.0006306221245460524, 'lambda_val': 8.50693942128844e-06, 'batch_size': 1308, 'optimizer': 'Adam'}.
2026-06-03 22:53:53,294 - experiment_functions - INFO - Early stopping at epoch 750. Best Metrics: (0.007155365874632383, 0.0013212539352937236, 0.004110010338177328)
2026-06-03 22:53:53,374 - optuna.study.study - INFO - Trial 231 finished with values: [0.007155365874632383, 0.0013212539352937236, 0.004110010338177328] and parameters: {'n_layers': 4, 'embedding_dim': 128, 'lr': 0.00280088767043512, 'lambda_val': 0.00010733978042493688, 'batch_size': 3980, 'optimizer': 'Adam'}.
2026-06-03 22:55:31,310 - experiment_functions - INFO - Early stopping at epoch 2500. Best Metrics: (0.009896609109020455, 0.0017332038314689534, 0.00590578789727906)
2026-06-03 22:55:31,406 - optuna.study.study - INFO - Trial 232 finished with values: [0.009896609109020455, 0.0017332038314689534, 0.00590578789727906] and parameters: {'n_layers': 3, 'embedding_dim': 64, 'lr': 0.000710331438856921, 'lambda_val': 5.609342222844582e-06, 'batch_size': 2574, 'optimizer': 'RMSprop'}.
2026-06-03 22:56:03,891 - experiment_functions - INFO - Early stopping at epoch 800. Best Metrics: (0.006964939789411674, 0.001190635675530846, 0.0041321748125615725)
2026-06-03 22:56:03,974 - optuna.study.study - INFO - Trial 233 finished with values: [0.006964939789411674, 0.001190635675530846, 0.0041321748125615725] and parameters: {'n_layers': 2, 'embedding_dim': 64, 'lr': 0.00280088767043512, 'lambda_val': 8.287870093807144e-05, 'batch_size': 1371, 'optimizer': 'RMSprop'}.
2026-06-03 22:56:36,145 - experiment_functions - INFO - Early stopping at epoch 800. Best Metrics: (0.007967963749994212, 0.0013413490521803203, 0.004731918698603247)
2026-06-03 22:56:36,282 - optuna.study.study - INFO - Trial 234 finished with values: [0.007967963749994212, 0.0013413490521803203, 0.004731918698603247] and parameters: {'n_layers': 4, 'embedding_dim': 32, 'lr': 0.002482762162524745, 'lambda_val': 0.0003123129135877017, 'batch_size': 2356, 'optimizer': 'Adam'}.
2026-06-03 22:57:09,996 - experiment_functions - INFO - Early stopping at epoch 800. Best Metrics: (0.009850861906969743, 0.001754973541429433, 0.005776567713104875)
2026-06-03 22:57:10,094 - optuna.study.study - INFO - Trial 235 finished with values: [0.009850861906969743, 0.001754973541429433, 0.005776567713104875] and parameters: {'n_layers': 4, 'embedding_dim': 64, 'lr': 0.00280088767043512, 'lambda_val': 8.287870093807144e-05, 'batch_size': 1113, 'optimizer': 'Adam'}.
2026-06-03 22:57:41,727 - experiment_functions - INFO - Early stopping at epoch 750. Best Metrics: (0.008917001972772258, 0.0016595217362180992, 0.00538718071100193)
2026-06-03 22:57:41,817 - optuna.study.study - INFO - Trial 236 finished with values: [0.008917001972772258, 0.0016595217362180992, 0.00538718071100193] and parameters: {'n_layers': 4, 'embedding_dim': 64, 'lr': 0.002060594231766347, 'lambda_val': 8.50693942128844e-06, 'batch_size': 2127, 'optimizer': 'RMSprop'}.
2026-06-03 22:58:39,914 - experiment_functions - INFO - Early stopping at epoch 1500. Best Metrics: (0.007347085992484141, 0.0013078571907026591, 0.004358191541469449)
2026-06-03 22:58:40,007 - optuna.study.study - INFO - Trial 237 finished with values: [0.007347085992484141, 0.0013078571907026591, 0.004358191541469449] and parameters: {'n_layers': 4, 'embedding_dim': 32, 'lr': 0.000710331438856921, 'lambda_val': 0.003379656411935868, 'batch_size': 2467, 'optimizer': 'Adam'}.
2026-06-03 23:01:15,313 - optuna.study.study - INFO - Trial 238 finished with values: [0.013145396914571401, 0.0022205104159689197, 0.00805509073646859] and parameters: {'n_layers': 3, 'embedding_dim': 64, 'lr': 0.000710331438856921, 'lambda_val': 0.0003123129135877017, 'batch_size': 774, 'optimizer': 'RMSprop'}.
2026-06-03 23:01:38,828 - experiment_functions - INFO - Early stopping at epoch 550. Best Metrics: (0.004979082370966984, 0.0008590662469020028, 0.002973861645173563)
2026-06-03 23:01:38,898 - optuna.study.study - INFO - Trial 239 finished with values: [0.004979082370966984, 0.0008590662469020028, 0.002973861645173563] and parameters: {'n_layers': 3, 'embedding_dim': 64, 'lr': 0.030553169031032737, 'lambda_val': 0.0003123129135877017, 'batch_size': 3091, 'optimizer': 'Adam'}.
2026-06-03 23:02:15,597 - experiment_functions - INFO - Early stopping at epoch 900. Best Metrics: (0.009454337549244756, 0.0016678947015875143, 0.005666650817805382)
2026-06-03 23:02:15,821 - optuna.study.study - INFO - Trial 240 finished with values: [0.009454337549244756, 0.0016678947015875143, 0.005666650817805382] and parameters: {'n_layers': 3, 'embedding_dim': 64, 'lr': 0.0018040479477802712, 'lambda_val': 0.0003123129135877017, 'batch_size': 1308, 'optimizer': 'RMSprop'}.
2026-06-03 23:04:23,264 - experiment_functions - INFO - Early stopping at epoch 2650. Best Metrics: (0.009910265192580276, 0.0018068859267198075, 0.005653952033329107)
2026-06-03 23:04:23,611 - optuna.study.study - INFO - Trial 241 finished with values: [0.009910265192580276, 0.0018068859267198075, 0.005653952033329107] and parameters: {'n_layers': 3, 'embedding_dim': 256, 'lr': 0.0006306221245460524, 'lambda_val': 2.468073181110974e-06, 'batch_size': 1308, 'optimizer': 'RMSprop'}.
2026-06-03 23:05:33,680 - experiment_functions - INFO - Early stopping at epoch 1650. Best Metrics: (0.010620362515798353, 0.0019107106973005558, 0.0062958219782991405)
2026-06-03 23:05:33,883 - optuna.study.study - INFO - Trial 242 finished with values: [0.010620362515798353, 0.0019107106973005558, 0.0062958219782991405] and parameters: {'n_layers': 3, 'embedding_dim': 128, 'lr': 0.000710331438856921, 'lambda_val': 2.468073181110974e-06, 'batch_size': 2127, 'optimizer': 'RMSprop'}.
2026-06-03 23:06:09,368 - experiment_functions - INFO - Early stopping at epoch 900. Best Metrics: (0.008163096123945111, 0.0013848884721012794, 0.004865853654936687)
2026-06-03 23:06:09,955 - optuna.study.study - INFO - Trial 243 finished with values: [0.008163096123945111, 0.0013848884721012794, 0.004865853654936687] and parameters: {'n_layers': 3, 'embedding_dim': 32, 'lr': 0.0027608560004649, 'lambda_val': 0.00047268866494377303, 'batch_size': 1308, 'optimizer': 'Adam'}.
2026-06-03 23:08:48,840 - optuna.study.study - INFO - Trial 244 finished with values: [0.01396985533852477, 0.0024482550740170137, 0.008565111376164987] and parameters: {'n_layers': 4, 'embedding_dim': 64, 'lr': 0.000710331438856921, 'lambda_val': 2.468073181110974e-06, 'batch_size': 790, 'optimizer': 'RMSprop'}.
2026-06-03 23:11:23,658 - optuna.study.study - INFO - Trial 245 finished with values: [0.009027960504449482, 0.0016059347578538416, 0.005567595473162561] and parameters: {'n_layers': 3, 'embedding_dim': 64, 'lr': 0.0006306221245460524, 'lambda_val': 0.00047268866494377303, 'batch_size': 1308, 'optimizer': 'Adam'}.
2026-06-03 23:12:38,215 - experiment_functions - INFO - Early stopping at epoch 1850. Best Metrics: (0.008156275000550016, 0.0014970862080514436, 0.004761285604434184)
2026-06-03 23:12:39,461 - optuna.study.study - INFO - Trial 246 finished with values: [0.008156275000550016, 0.0014970862080514436, 0.004761285604434184] and parameters: {'n_layers': 4, 'embedding_dim': 64, 'lr': 0.000710331438856921, 'lambda_val': 5.609342222844582e-06, 'batch_size': 2984, 'optimizer': 'Adam'}.
2026-06-03 23:15:10,295 - optuna.study.study - INFO - Trial 247 finished with values: [0.006743375773728405, 0.0011755643378658987, 0.0038637924038676815] and parameters: {'n_layers': 4, 'embedding_dim': 32, 'lr': 0.00033058091149224526, 'lambda_val': 0.003379656411935868, 'batch_size': 2127, 'optimizer': 'RMSprop'}.
2026-06-03 23:15:51,930 - experiment_functions - INFO - Early stopping at epoch 950. Best Metrics: (0.008265880638970482, 0.0014887132426820284, 0.004861751113887216)
2026-06-03 23:15:53,406 - optuna.study.study - INFO - Trial 248 finished with values: [0.008265880638970482, 0.0014887132426820284, 0.004861751113887216] and parameters: {'n_layers': 3, 'embedding_dim': 128, 'lr': 0.0027608560004649, 'lambda_val': 0.00047268866494377303, 'batch_size': 891, 'optimizer': 'Adam'}.
2026-06-03 23:16:46,187 - experiment_functions - INFO - Early stopping at epoch 1000. Best Metrics: (0.00791238602497684, 0.0014585705673521333, 0.004516724043409116)
2026-06-03 23:16:46,273 - optuna.study.study - INFO - Trial 249 finished with values: [0.00791238602497684, 0.0014585705673521333, 0.004516724043409116] and parameters: {'n_layers': 4, 'embedding_dim': 256, 'lr': 0.0027608560004649, 'lambda_val': 5.609342222844582e-06, 'batch_size': 513, 'optimizer': 'RMSprop'}.
2026-06-03 23:17:56,511 - experiment_functions - INFO - Early stopping at epoch 1750. Best Metrics: (0.0077728073445680335, 0.0014485230089088352, 0.004690909398099402)
2026-06-03 23:17:56,609 - optuna.study.study - INFO - Trial 250 finished with values: [0.0077728073445680335, 0.0014485230089088352, 0.004690909398099402] and parameters: {'n_layers': 4, 'embedding_dim': 64, 'lr': 0.000710331438856921, 'lambda_val': 5.609342222844582e-06, 'batch_size': 3931, 'optimizer': 'Adam'}.
2026-06-03 23:18:22,231 - experiment_functions - INFO - Early stopping at epoch 600. Best Metrics: (0.005347205804931808, 0.0009612164244088687, 0.0029957788371928855)
2026-06-03 23:18:22,357 - optuna.study.study - INFO - Trial 251 finished with values: [0.005347205804931808, 0.0009612164244088687, 0.0029957788371928855] and parameters: {'n_layers': 4, 'embedding_dim': 64, 'lr': 0.003453477290824188, 'lambda_val': 0.008888808346745524, 'batch_size': 2504, 'optimizer': 'RMSprop'}.
2026-06-03 23:18:53,737 - experiment_functions - INFO - Early stopping at epoch 750. Best Metrics: (0.009554659275004826, 0.001686315225400228, 0.005420031436723961)
2026-06-03 23:18:54,296 - optuna.study.study - INFO - Trial 252 finished with values: [0.009554659275004826, 0.001686315225400228, 0.005420031436723961] and parameters: {'n_layers': 4, 'embedding_dim': 64, 'lr': 0.002060594231766347, 'lambda_val': 8.50693942128844e-06, 'batch_size': 2127, 'optimizer': 'RMSprop'}.
2026-06-03 23:19:24,424 - experiment_functions - INFO - Early stopping at epoch 750. Best Metrics: (0.009285497050615366, 0.0016210060955187892, 0.0054389917376013175)
2026-06-03 23:19:24,514 - optuna.study.study - INFO - Trial 253 finished with values: [0.009285497050615366, 0.0016210060955187892, 0.0054389917376013175] and parameters: {'n_layers': 4, 'embedding_dim': 32, 'lr': 0.002060594231766347, 'lambda_val': 0.00047268866494377303, 'batch_size': 1356, 'optimizer': 'RMSprop'}.
2026-06-03 23:21:57,991 - optuna.study.study - INFO - Trial 254 finished with values: [0.010485641371256958, 0.0018085605197936904, 0.006468905164865099] and parameters: {'n_layers': 3, 'embedding_dim': 64, 'lr': 0.0006306221245460524, 'lambda_val': 2.4425729654268755e-05, 'batch_size': 1308, 'optimizer': 'RMSprop'}.
2026-06-03 23:22:56,106 - experiment_functions - INFO - Early stopping at epoch 1550. Best Metrics: (0.006261391088197119, 0.0009896845066648804, 0.003590935945674311)
2026-06-03 23:22:56,184 - optuna.study.study - INFO - Trial 255 finished with values: [0.006261391088197119, 0.0009896845066648804, 0.003590935945674311] and parameters: {'n_layers': 1, 'embedding_dim': 64, 'lr': 0.0018040479477802712, 'lambda_val': 0.0003123129135877017, 'batch_size': 790, 'optimizer': 'RMSprop'}.
2026-06-03 23:26:01,315 - experiment_functions - INFO - Early stopping at epoch 3900. Best Metrics: (0.012276410187510228, 0.002153526693013598, 0.006939921893323109)
2026-06-03 23:26:01,411 - optuna.study.study - INFO - Trial 256 finished with values: [0.012276410187510228, 0.002153526693013598, 0.006939921893323109] and parameters: {'n_layers': 3, 'embedding_dim': 256, 'lr': 0.0006306221245460524, 'lambda_val': 5.609342222844582e-06, 'batch_size': 836, 'optimizer': 'RMSprop'}.
2026-06-03 23:26:35,523 - experiment_functions - INFO - Early stopping at epoch 900. Best Metrics: (0.005925887218400551, 0.0008858597360841316, 0.003171388010862164)
2026-06-03 23:26:35,805 - optuna.study.study - INFO - Trial 257 finished with values: [0.005925887218400551, 0.0008858597360841316, 0.003171388010862164] and parameters: {'n_layers': 1, 'embedding_dim': 32, 'lr': 0.0037398856564293233, 'lambda_val': 5.085972175639675e-06, 'batch_size': 1308, 'optimizer': 'RMSprop'}.
2026-06-03 23:29:08,152 - optuna.study.study - INFO - Trial 258 finished with values: [0.009563160223108665, 0.0016461249916270345, 0.0059198849880969405] and parameters: {'n_layers': 3, 'embedding_dim': 64, 'lr': 0.000710331438856921, 'lambda_val': 5.609342222844582e-06, 'batch_size': 774, 'optimizer': 'Adam'}.
2026-06-03 23:31:01,578 - experiment_functions - INFO - Early stopping at epoch 2900. Best Metrics: (0.009194560521252544, 0.001624355281666555, 0.005387343882689214)
2026-06-03 23:31:01,670 - optuna.study.study - INFO - Trial 259 finished with values: [0.009194560521252544, 0.001624355281666555, 0.005387343882689214] and parameters: {'n_layers': 4, 'embedding_dim': 64, 'lr': 0.000620139549907349, 'lambda_val': 8.50693942128844e-06, 'batch_size': 2127, 'optimizer': 'Adam'}.
2026-06-03 23:33:31,742 - optuna.study.study - INFO - Trial 260 finished with values: [0.014014764600859729, 0.0024080648402438204, 0.008521057856978102] and parameters: {'n_layers': 4, 'embedding_dim': 32, 'lr': 0.000710331438856921, 'lambda_val': 5.609342222844582e-06, 'batch_size': 836, 'optimizer': 'RMSprop'}.
2026-06-03 23:35:58,366 - optuna.study.study - INFO - Trial 261 finished with values: [0.005465191650756623, 0.0007652890347645523, 0.0031273652706838087] and parameters: {'n_layers': 1, 'embedding_dim': 64, 'lr': 0.000710331438856921, 'lambda_val': 2.468073181110974e-06, 'batch_size': 790, 'optimizer': 'Adam'}.
2026-06-03 23:36:24,414 - experiment_functions - INFO - Early stopping at epoch 600. Best Metrics: (0.006191097649868432, 0.0011470962556098868, 0.0035577011378752623)
2026-06-03 23:36:24,504 - optuna.study.study - INFO - Trial 262 finished with values: [0.006191097649868432, 0.0011470962556098868, 0.0035577011378752623] and parameters: {'n_layers': 3, 'embedding_dim': 96, 'lr': 0.008809280533256025, 'lambda_val': 0.00047268866494377303, 'batch_size': 790, 'optimizer': 'Adam'}.
2026-06-03 23:38:22,824 - experiment_functions - INFO - Early stopping at epoch 3000. Best Metrics: (0.011069527504086827, 0.0019140598834483222, 0.006393967892031335)
2026-06-03 23:38:22,916 - optuna.study.study - INFO - Trial 263 finished with values: [0.011069527504086827, 0.0019140598834483222, 0.006393967892031335] and parameters: {'n_layers': 4, 'embedding_dim': 64, 'lr': 0.0006306221245460524, 'lambda_val': 0.0006427391414032312, 'batch_size': 1308, 'optimizer': 'Adam'}.
2026-06-03 23:41:15,381 - optuna.study.study - INFO - Trial 264 finished with values: [0.013872070151784613, 0.002441556701721482, 0.008207229749154934] and parameters: {'n_layers': 4, 'embedding_dim': 128, 'lr': 0.000710331438856921, 'lambda_val': 6.915536662672056e-06, 'batch_size': 774, 'optimizer': 'RMSprop'}.
2026-06-03 23:43:41,849 - optuna.study.study - INFO - Trial 265 finished with values: [0.005483516931123095, 0.0007619398486167862, 0.0029357504883887066] and parameters: {'n_layers': 1, 'embedding_dim': 64, 'lr': 0.000710331438856921, 'lambda_val': 5.085972175639675e-06, 'batch_size': 1308, 'optimizer': 'Adam'}.
2026-06-03 23:44:18,282 - experiment_functions - INFO - Early stopping at epoch 800. Best Metrics: (0.00827735920331844, 0.0015774666755978294, 0.004898990871592786)
2026-06-03 23:44:18,609 - optuna.study.study - INFO - Trial 266 finished with values: [0.00827735920331844, 0.0015774666755978294, 0.004898990871592786] and parameters: {'n_layers': 4, 'embedding_dim': 128, 'lr': 0.0027608560004649, 'lambda_val': 2.468073181110974e-06, 'batch_size': 1308, 'optimizer': 'Adam'}.
2026-06-03 23:46:51,452 - optuna.study.study - INFO - Trial 267 finished with values: [0.009992520244889261, 0.00165449795699645, 0.005729043126342144] and parameters: {'n_layers': 3, 'embedding_dim': 64, 'lr': 0.000710331438856921, 'lambda_val': 0.00047268866494377303, 'batch_size': 774, 'optimizer': 'Adam'}.
2026-06-03 23:47:24,799 - experiment_functions - INFO - Early stopping at epoch 800. Best Metrics: (0.009215913481508894, 0.0016796168531046955, 0.005273437313212754)
2026-06-03 23:47:24,893 - optuna.study.study - INFO - Trial 268 finished with values: [0.009215913481508894, 0.0016796168531046955, 0.005273437313212754] and parameters: {'n_layers': 4, 'embedding_dim': 64, 'lr': 0.0037398856564293233, 'lambda_val': 5.085972175639675e-06, 'batch_size': 790, 'optimizer': 'RMSprop'}.
2026-06-03 23:50:01,132 - optuna.study.study - INFO - Trial 269 finished with values: [0.010287710493896788, 0.0018135842990153394, 0.006023213915831426] and parameters: {'n_layers': 4, 'embedding_dim': 64, 'lr': 0.000710331438856921, 'lambda_val': 5.609342222844582e-06, 'batch_size': 1432, 'optimizer': 'Adam'}.
2026-06-03 23:50:41,257 - experiment_functions - INFO - Early stopping at epoch 1000. Best Metrics: (0.009948785215318518, 0.0017449259829861344, 0.005699317435034236)
2026-06-03 23:50:41,339 - optuna.study.study - INFO - Trial 270 finished with values: [0.009948785215318518, 0.0017449259829861344, 0.005699317435034236] and parameters: {'n_layers': 3, 'embedding_dim': 64, 'lr': 0.0018040479477802712, 'lambda_val': 0.0003123129135877017, 'batch_size': 1308, 'optimizer': 'RMSprop'}.
