2026-06-04 22:22:27,274 - optuna.study.study - INFO - Trial 294 finished with values: [0.010428979504944636, 0.0018989885457833748, 0.005886939483394901] and parameters: {'n_layers': 4, 'embedding_dim': 64, 'lr': 0.0007307808528773397, 'lambda_val': 3.61928423516103e-05, 'batch_size': 2777, 'optimizer': 'RMSprop'}.
2026-06-04 22:22:58,646 - experiment_functions - INFO - Early stopping at epoch 750. Best Metrics: (0.008623210202777096, 0.0015272288833813384, 0.004911645807132928)
2026-06-04 22:22:59,443 - optuna.study.study - INFO - Trial 295 finished with values: [0.008623210202777096, 0.0015272288833813384, 0.004911645807132928] and parameters: {'n_layers': 4, 'embedding_dim': 64, 'lr': 0.0038915436873682946, 'lambda_val': 0.00016262429302101681, 'batch_size': 791, 'optimizer': 'Adam'}.
2026-06-04 22:23:35,099 - experiment_functions - INFO - Early stopping at epoch 850. Best Metrics: (0.007897915430463464, 0.0013547457967713846, 0.004510576287204409)
2026-06-04 22:23:35,184 - optuna.study.study - INFO - Trial 296 finished with values: [0.007897915430463464, 0.0013547457967713846, 0.004510576287204409] and parameters: {'n_layers': 4, 'embedding_dim': 64, 'lr': 0.0018624775153074351, 'lambda_val': 0.00016262429302101681, 'batch_size': 3398, 'optimizer': 'Adam'}.
2026-06-04 22:24:02,616 - experiment_functions - INFO - Early stopping at epoch 650. Best Metrics: (0.007541693140113345, 0.001374840913657981, 0.004591382133014613)
2026-06-04 22:24:02,759 - optuna.study.study - INFO - Trial 297 finished with values: [0.007541693140113345, 0.001374840913657981, 0.004591382133014613] and parameters: {'n_layers': 4, 'embedding_dim': 64, 'lr': 0.0038915436873682946, 'lambda_val': 0.0006941468338775529, 'batch_size': 2129, 'optimizer': 'Adam'}.
2026-06-04 22:25:20,092 - experiment_functions - INFO - Early stopping at epoch 1950. Best Metrics: (0.014129147510159331, 0.0023879697233572246, 0.00819904790938646)
2026-06-04 22:25:20,190 - optuna.study.study - INFO - Trial 298 finished with values: [0.014129147510159331, 0.0023879697233572246, 0.00819904790938646] and parameters: {'n_layers': 4, 'embedding_dim': 64, 'lr': 0.0011827350330377861, 'lambda_val': 0.00012002132901256534, 'batch_size': 743, 'optimizer': 'RMSprop'}.
2026-06-04 22:27:47,885 - optuna.study.study - INFO - Trial 299 finished with values: [0.005700499939891144, 0.0008640900261236519, 0.0033401533804825905] and parameters: {'n_layers': 1, 'embedding_dim': 64, 'lr': 0.0010341842506299342, 'lambda_val': 1.6413472527343117e-06, 'batch_size': 791, 'optimizer': 'Adam'}.
2026-06-04 22:27:47,900 - root - INFO - Selected Trial 119 based on Max ndcg: 0.0090
2026-06-04 22:27:47,900 - root - INFO - Associated Recall: 0.0148
2026-06-04 22:27:47,900 - experiment_functions - INFO - Training the best model ... for e_gowalla_1c1dcs_strict_rand5
2026-06-04 22:30:23,912 - root - INFO -   ** Getting the trainable edges:
2026-06-04 22:30:23,936 - helper_functions - INFO -      Number of nodes: 10896
2026-06-04 22:30:23,936 - helper_functions - INFO -      Ratio: 0.15381357726675984
2026-06-04 22:30:23,936 - helper_functions - INFO -      Number of unique users: 2157
2026-06-04 22:30:23,936 - helper_functions - INFO -      Number of unique items: 8739
2026-06-04 22:30:23,936 - helper_functions - INFO -      Total dominant set edge: 450896
2026-06-04 22:30:23,936 - helper_functions - INFO -      Trainable edges: 360716.80000000005
2026-06-04 22:30:24,014 - root - INFO -   **** Getting 450896 dominant set edges
2026-06-04 22:30:24,168 - optuna.storages._rdb.storage - INFO - A new study created in RDB with name: Study_e_gowalla_1c1dcs
2026-06-04 22:31:48,419 - experiment_functions - INFO - Early stopping at epoch 2200. Best Metrics: (0.000463340004565254, 8.372965369415233e-05, 0.00025443956901816025)
2026-06-04 22:31:48,846 - optuna.study.study - INFO - Trial 0 finished with values: [0.000463340004565254, 8.372965369415233e-05, 0.00025443956901816025] and parameters: {'n_layers': 1, 'embedding_dim': 96, 'lr': 8.80971452366011e-05, 'lambda_val': 1.0296690711920884e-06, 'batch_size': 1070, 'optimizer': 'RMSprop'}.
2026-06-04 22:32:11,817 - experiment_functions - INFO - Early stopping at epoch 500. Best Metrics: (0.0006169423877436454, 7.703128139862015e-05, 0.000257781259738616)
2026-06-04 22:32:11,942 - optuna.study.study - INFO - Trial 1 finished with values: [0.0006169423877436454, 7.703128139862015e-05, 0.000257781259738616] and parameters: {'n_layers': 4, 'embedding_dim': 64, 'lr': 0.001262844338548854, 'lambda_val': 1.5013285586553525e-06, 'batch_size': 2794, 'optimizer': 'SGD'}.
2026-06-04 22:32:43,875 - experiment_functions - INFO - Early stopping at epoch 500. Best Metrics: (0.0005701901215280772, 7.2007502176971e-05, 0.00026986082385966096)
2026-06-04 22:32:43,984 - optuna.study.study - INFO - Trial 2 finished with values: [0.0005701901215280772, 7.2007502176971e-05, 0.00026986082385966096] and parameters: {'n_layers': 4, 'embedding_dim': 256, 'lr': 1.103680465901137e-05, 'lambda_val': 0.029064445940569273, 'batch_size': 2369, 'optimizer': 'RMSprop'}.
2026-06-04 22:33:10,003 - experiment_functions - INFO - Early stopping at epoch 550. Best Metrics: (0.04042560665149176, 0.004981914394802063, 0.020869692382907798)
2026-06-04 22:33:10,255 - optuna.study.study - INFO - Trial 3 finished with values: [0.04042560665149176, 0.004981914394802063, 0.020869692382907798] and parameters: {'n_layers': 3, 'embedding_dim': 96, 'lr': 0.003540381921720846, 'lambda_val': 3.532972028162508e-06, 'batch_size': 3114, 'optimizer': 'Adam'}.
2026-06-04 22:34:36,477 - experiment_functions - INFO - Early stopping at epoch 1950. Best Metrics: (0.011107558123308214, 0.0018504253466407664, 0.005894865689821806)
2026-06-04 22:34:36,618 - optuna.study.study - INFO - Trial 4 finished with values: [0.011107558123308214, 0.0018504253466407664, 0.005894865689821806] and parameters: {'n_layers': 1, 'embedding_dim': 256, 'lr': 0.028448639682008454, 'lambda_val': 5.853976848871819e-05, 'batch_size': 2159, 'optimizer': 'RMSprop'}.
2026-06-04 22:35:01,772 - experiment_functions - INFO - Early stopping at epoch 550. Best Metrics: (0.01315914842652826, 0.0017918145890548597, 0.0064810727112304435)
2026-06-04 22:35:02,771 - optuna.study.study - INFO - Trial 5 finished with values: [0.01315914842652826, 0.0017918145890548597, 0.0064810727112304435] and parameters: {'n_layers': 4, 'embedding_dim': 64, 'lr': 0.009556862834818597, 'lambda_val': 0.002216169184844733, 'batch_size': 516, 'optimizer': 'Adam'}.
2026-06-04 22:35:28,752 - experiment_functions - INFO - Early stopping at epoch 650. Best Metrics: (0.0004987063115060253, 6.865831602920491e-05, 0.00021946262279743655)
2026-06-04 22:35:29,403 - optuna.study.study - INFO - Trial 6 finished with values: [0.0004987063115060253, 6.865831602920491e-05, 0.00021946262279743655] and parameters: {'n_layers': 1, 'embedding_dim': 64, 'lr': 7.540479192397241e-05, 'lambda_val': 0.002864922707919979, 'batch_size': 3964, 'optimizer': 'RMSprop'}.
2026-06-04 22:35:50,369 - experiment_functions - INFO - Early stopping at epoch 500. Best Metrics: (0.0005952945988907874, 7.870587447250318e-05, 0.00025717934499991873)
2026-06-04 22:35:50,826 - optuna.study.study - INFO - Trial 7 finished with values: [0.0005952945988907874, 7.870587447250318e-05, 0.00025717934499991873] and parameters: {'n_layers': 2, 'embedding_dim': 32, 'lr': 0.0005892323895160657, 'lambda_val': 0.005581434643600451, 'batch_size': 630, 'optimizer': 'SGD'}.
2026-06-04 22:36:12,905 - experiment_functions - INFO - Early stopping at epoch 500. Best Metrics: (0.00048697176538566966, 6.363453680755577e-05, 0.00021828136230816648)
2026-06-04 22:36:12,996 - optuna.study.study - INFO - Trial 8 finished with values: [0.00048697176538566966, 6.363453680755577e-05, 0.00021828136230816648] and parameters: {'n_layers': 1, 'embedding_dim': 128, 'lr': 0.0007739596509273803, 'lambda_val': 3.0744221127097415e-06, 'batch_size': 3940, 'optimizer': 'SGD'}.
2026-06-04 22:36:35,701 - experiment_functions - INFO - Early stopping at epoch 500. Best Metrics: (0.0005847054927900341, 7.2007502176971e-05, 0.0002744042392668786)
2026-06-04 22:36:35,804 - optuna.study.study - INFO - Trial 9 finished with values: [0.0005847054927900341, 7.2007502176971e-05, 0.0002744042392668786] and parameters: {'n_layers': 3, 'embedding_dim': 64, 'lr': 0.010979429387298605, 'lambda_val': 4.990726802534784e-06, 'batch_size': 3979, 'optimizer': 'SGD'}.
2026-06-04 22:39:35,966 - optuna.study.study - INFO - Trial 10 finished with values: [0.00628230462087252, 0.0010014066581820616, 0.002965156560205564] and parameters: {'n_layers': 4, 'embedding_dim': 96, 'lr': 0.00010637809990030549, 'lambda_val': 0.020047720624645042, 'batch_size': 3017, 'optimizer': 'RMSprop'}.
2026-06-04 22:39:59,424 - experiment_functions - INFO - Early stopping at epoch 550. Best Metrics: (0.009937732053226367, 0.0014635943465737828, 0.005340874263235129)
2026-06-04 22:39:59,524 - optuna.study.study - INFO - Trial 11 finished with values: [0.009937732053226367, 0.0014635943465737828, 0.005340874263235129] and parameters: {'n_layers': 1, 'embedding_dim': 96, 'lr': 0.08333698415859936, 'lambda_val': 5.3533307747296766e-05, 'batch_size': 570, 'optimizer': 'Adam'}.
2026-06-04 22:40:22,586 - experiment_functions - INFO - Early stopping at epoch 550. Best Metrics: (0.016167501590767828, 0.002304240069663072, 0.00868409180918035)
2026-06-04 22:40:22,689 - optuna.study.study - INFO - Trial 12 finished with values: [0.016167501590767828, 0.002304240069663072, 0.00868409180918035] and parameters: {'n_layers': 2, 'embedding_dim': 32, 'lr': 0.023098200995385995, 'lambda_val': 1.5139846282757388e-05, 'batch_size': 2353, 'optimizer': 'RMSprop'}.
2026-06-04 22:44:28,150 - optuna.study.study - INFO - Trial 13 finished with values: [0.04474018257387109, 0.005748878022640499, 0.02340974030680663] and parameters: {'n_layers': 4, 'embedding_dim': 256, 'lr': 0.00011825532801285016, 'lambda_val': 8.600399380889837e-06, 'batch_size': 3577, 'optimizer': 'RMSprop'}.
2026-06-04 22:47:06,721 - optuna.study.study - INFO - Trial 14 finished with values: [0.015214064127326357, 0.002225534195190569, 0.007461095539682592] and parameters: {'n_layers': 4, 'embedding_dim': 32, 'lr': 0.08547228312239685, 'lambda_val': 0.0024741700262700477, 'batch_size': 2586, 'optimizer': 'Adam'}.
2026-06-04 22:47:31,622 - experiment_functions - INFO - Early stopping at epoch 500. Best Metrics: (0.021768812156051767, 0.0027614039788331443, 0.011940463326695518)
2026-06-04 22:47:31,731 - optuna.study.study - INFO - Trial 15 finished with values: [0.021768812156051767, 0.0027614039788331443, 0.011940463326695518] and parameters: {'n_layers': 4, 'embedding_dim': 96, 'lr': 0.08294142044076476, 'lambda_val': 7.362176208168903e-06, 'batch_size': 2331, 'optimizer': 'RMSprop'}.
2026-06-04 22:47:53,515 - experiment_functions - INFO - Early stopping at epoch 500. Best Metrics: (0.000449905588533766, 7.870587447250318e-05, 0.00021662938048824955)
2026-06-04 22:47:53,593 - optuna.study.study - INFO - Trial 16 finished with values: [0.000449905588533766, 7.870587447250318e-05, 0.00021662938048824955] and parameters: {'n_layers': 4, 'embedding_dim': 32, 'lr': 0.00034887980709853624, 'lambda_val': 7.713332538599585e-05, 'batch_size': 3890, 'optimizer': 'SGD'}.
2026-06-04 22:50:26,725 - optuna.study.study - INFO - Trial 17 finished with values: [0.0030239222171553554, 0.0004119498961752294, 0.0015972364946455736] and parameters: {'n_layers': 1, 'embedding_dim': 96, 'lr': 0.00013571510686484508, 'lambda_val': 0.0013184335261646747, 'batch_size': 3758, 'optimizer': 'Adam'}.
2026-06-04 22:50:50,565 - experiment_functions - INFO - Early stopping at epoch 550. Best Metrics: (0.058521919042843214, 0.007456962958001206, 0.03143967108286366)
2026-06-04 22:50:50,670 - optuna.study.study - INFO - Trial 18 finished with values: [0.058521919042843214, 0.007456962958001206, 0.03143967108286366] and parameters: {'n_layers': 1, 'embedding_dim': 96, 'lr': 0.010850387474674802, 'lambda_val': 0.00022368856507037872, 'batch_size': 3009, 'optimizer': 'Adam'}.
2026-06-04 22:51:11,811 - experiment_functions - INFO - Early stopping at epoch 500. Best Metrics: (0.0007826525029180924, 9.71263982852167e-05, 0.00026847395945928186)
2026-06-04 22:51:12,208 - optuna.study.study - INFO - Trial 19 finished with values: [0.0007826525029180924, 9.71263982852167e-05, 0.00026847395945928186] and parameters: {'n_layers': 4, 'embedding_dim': 32, 'lr': 2.0317274307506914e-05, 'lambda_val': 2.4352408459118126e-06, 'batch_size': 1555, 'optimizer': 'SGD'}.
2026-06-04 22:51:32,951 - experiment_functions - INFO - Early stopping at epoch 500. Best Metrics: (0.0005126735166026407, 7.53566883247371e-05, 0.00024275641942459402)
2026-06-04 22:51:34,038 - optuna.study.study - INFO - Trial 20 finished with values: [0.0005126735166026407, 7.53566883247371e-05, 0.00024275641942459402] and parameters: {'n_layers': 1, 'embedding_dim': 96, 'lr': 0.015002074473241443, 'lambda_val': 0.004752309024246128, 'batch_size': 755, 'optimizer': 'SGD'}.
2026-06-04 22:52:12,363 - experiment_functions - INFO - Early stopping at epoch 600. Best Metrics: (0.0004906064766419052, 8.205506062026926e-05, 0.00021407809325029473)
2026-06-04 22:52:12,458 - optuna.study.study - INFO - Trial 21 finished with values: [0.0004906064766419052, 8.205506062026926e-05, 0.00021407809325029473] and parameters: {'n_layers': 4, 'embedding_dim': 256, 'lr': 1.2726368031693164e-05, 'lambda_val': 0.00022637584318870192, 'batch_size': 2351, 'optimizer': 'Adam'}.
2026-06-04 22:52:36,206 - experiment_functions - INFO - Early stopping at epoch 500. Best Metrics: (0.00037733627950427637, 6.865831602920491e-05, 0.0002085551409046544)
2026-06-04 22:52:36,306 - optuna.study.study - INFO - Trial 22 finished with values: [0.00037733627950427637, 6.865831602920491e-05, 0.0002085551409046544] and parameters: {'n_layers': 1, 'embedding_dim': 256, 'lr': 0.07377753707185122, 'lambda_val': 9.315633622631724e-06, 'batch_size': 1630, 'optimizer': 'SGD'}.
2026-06-04 22:52:58,246 - experiment_functions - INFO - Early stopping at epoch 500. Best Metrics: (0.0006191702190158265, 8.707883984191842e-05, 0.0002765463502328879)
2026-06-04 22:52:58,919 - optuna.study.study - INFO - Trial 23 finished with values: [0.0006191702190158265, 8.707883984191842e-05, 0.0002765463502328879] and parameters: {'n_layers': 1, 'embedding_dim': 96, 'lr': 4.07709645256888e-05, 'lambda_val': 0.0065232825767523395, 'batch_size': 3267, 'optimizer': 'RMSprop'}.
2026-06-04 22:56:09,654 - optuna.study.study - INFO - Trial 24 finished with values: [0.011774304117349414, 0.001696362783843526, 0.006359940370107893] and parameters: {'n_layers': 4, 'embedding_dim': 128, 'lr': 7.419515921505045e-05, 'lambda_val': 3.817169278574449e-05, 'batch_size': 3821, 'optimizer': 'RMSprop'}.
2026-06-04 22:56:36,865 - experiment_functions - INFO - Early stopping at epoch 500. Best Metrics: (0.01363595091160825, 0.0016477995847009178, 0.007659105015421966)
2026-06-04 22:56:36,957 - optuna.study.study - INFO - Trial 25 finished with values: [0.01363595091160825, 0.0016477995847009178, 0.007659105015421966] and parameters: {'n_layers': 2, 'embedding_dim': 256, 'lr': 0.047644548305084466, 'lambda_val': 0.000337357517769222, 'batch_size': 3825, 'optimizer': 'RMSprop'}.
2026-06-04 22:59:08,689 - experiment_functions - INFO - Early stopping at epoch 3600. Best Metrics: (0.04206013148406683, 0.005434054524750486, 0.02116395768000566)
2026-06-04 22:59:09,460 - optuna.study.study - INFO - Trial 26 finished with values: [0.04206013148406683, 0.005434054524750486, 0.02116395768000566] and parameters: {'n_layers': 3, 'embedding_dim': 64, 'lr': 0.0007432804052483335, 'lambda_val': 0.0005094277795441267, 'batch_size': 2242, 'optimizer': 'Adam'}.
2026-06-04 22:59:33,372 - experiment_functions - INFO - Early stopping at epoch 500. Best Metrics: (0.009110856918925513, 0.001183937303235314, 0.0052668605720558506)
2026-06-04 22:59:33,460 - optuna.study.study - INFO - Trial 27 finished with values: [0.009110856918925513, 0.001183937303235314, 0.0052668605720558506] and parameters: {'n_layers': 3, 'embedding_dim': 96, 'lr': 0.032317704945109334, 'lambda_val': 0.011082293382797577, 'batch_size': 2377, 'optimizer': 'RMSprop'}.
2026-06-04 23:00:05,704 - experiment_functions - INFO - Early stopping at epoch 750. Best Metrics: (0.016622160907490816, 0.0024130886194654697, 0.008658040797847004)
2026-06-04 23:00:05,775 - optuna.study.study - INFO - Trial 28 finished with values: [0.016622160907490816, 0.0024130886194654697, 0.008658040797847004] and parameters: {'n_layers': 1, 'embedding_dim': 128, 'lr': 0.017336107761708283, 'lambda_val': 1.6669472887970978e-05, 'batch_size': 3447, 'optimizer': 'RMSprop'}.
2026-06-04 23:00:26,852 - experiment_functions - INFO - Early stopping at epoch 500. Best Metrics: (0.0006497740672246271, 8.038046754638622e-05, 0.00024194579382978237)
2026-06-04 23:00:26,919 - optuna.study.study - INFO - Trial 29 finished with values: [0.0006497740672246271, 8.038046754638622e-05, 0.00024194579382978237] and parameters: {'n_layers': 1, 'embedding_dim': 128, 'lr': 0.007966825325978439, 'lambda_val': 0.03483771709500029, 'batch_size': 1924, 'optimizer': 'SGD'}.
2026-06-04 23:03:21,245 - optuna.study.study - INFO - Trial 30 finished with values: [0.05569526277282998, 0.007415098131154129, 0.031363182407270165] and parameters: {'n_layers': 2, 'embedding_dim': 128, 'lr': 0.0003418709874020897, 'lambda_val': 4.933989724174048e-06, 'batch_size': 1064, 'optimizer': 'Adam'}.
2026-06-04 23:03:45,609 - experiment_functions - INFO - Early stopping at epoch 500. Best Metrics: (0.0005641351706947177, 8.540424676803538e-05, 0.0002706217447679275)
2026-06-04 23:03:45,698 - optuna.study.study - INFO - Trial 31 finished with values: [0.0005641351706947177, 8.540424676803538e-05, 0.0002706217447679275] and parameters: {'n_layers': 4, 'embedding_dim': 96, 'lr': 0.00012353134474696984, 'lambda_val': 1.6434238137431028e-05, 'batch_size': 1249, 'optimizer': 'SGD'}.
2026-06-04 23:04:21,577 - experiment_functions - INFO - Early stopping at epoch 550. Best Metrics: (0.02321502181357566, 0.0028769509009310737, 0.011705260186165876)
2026-06-04 23:04:21,829 - optuna.study.study - INFO - Trial 32 finished with values: [0.02321502181357566, 0.0028769509009310737, 0.011705260186165876] and parameters: {'n_layers': 4, 'embedding_dim': 256, 'lr': 0.06006268611544608, 'lambda_val': 3.3509343310867884e-06, 'batch_size': 1750, 'optimizer': 'Adam'}.
2026-06-04 23:05:45,539 - experiment_functions - INFO - Early stopping at epoch 2100. Best Metrics: (0.011916796058057297, 0.002012860874807422, 0.0058242175268512966)
2026-06-04 23:05:46,138 - optuna.study.study - INFO - Trial 33 finished with values: [0.011916796058057297, 0.002012860874807422, 0.0058242175268512966] and parameters: {'n_layers': 1, 'embedding_dim': 96, 'lr': 0.055430291097441665, 'lambda_val': 0.029045035745594923, 'batch_size': 2561, 'optimizer': 'RMSprop'}.
2026-06-04 23:06:15,295 - experiment_functions - INFO - Early stopping at epoch 650. Best Metrics: (0.0004751826500837712, 6.530912988143881e-05, 0.00018255599474116245)
2026-06-04 23:06:15,712 - optuna.study.study - INFO - Trial 34 finished with values: [0.0004751826500837712, 6.530912988143881e-05, 0.00018255599474116245] and parameters: {'n_layers': 2, 'embedding_dim': 128, 'lr': 0.07341360103734366, 'lambda_val': 0.0002798453803437829, 'batch_size': 1420, 'optimizer': 'SGD'}.
2026-06-04 23:08:51,636 - optuna.study.study - INFO - Trial 35 finished with values: [0.043793405078025184, 0.005767298546453212, 0.02242120254531142] and parameters: {'n_layers': 2, 'embedding_dim': 32, 'lr': 0.0003278860610242573, 'lambda_val': 0.0003734366700851135, 'batch_size': 3888, 'optimizer': 'Adam'}.
2026-06-04 23:11:43,039 - optuna.study.study - INFO - Trial 36 finished with values: [0.0005919196987353771, 8.707883984191842e-05, 0.00028067563167196835] and parameters: {'n_layers': 3, 'embedding_dim': 96, 'lr': 3.497115937875924e-05, 'lambda_val': 5.549577204880508e-06, 'batch_size': 2859, 'optimizer': 'RMSprop'}.
2026-06-04 23:13:46,947 - experiment_functions - INFO - Early stopping at epoch 2900. Best Metrics: (0.055141295156536096, 0.00687085538214214, 0.027023115117514346)
2026-06-04 23:13:47,038 - optuna.study.study - INFO - Trial 37 finished with values: [0.055141295156536096, 0.00687085538214214, 0.027023115117514346] and parameters: {'n_layers': 3, 'embedding_dim': 64, 'lr': 0.0005200733648452572, 'lambda_val': 2.388311754210309e-05, 'batch_size': 3566, 'optimizer': 'RMSprop'}.
2026-06-04 23:14:08,877 - experiment_functions - INFO - Early stopping at epoch 500. Best Metrics: (0.0005809859098793532, 6.86583160292049e-05, 0.00025394886625181544)
2026-06-04 23:14:08,992 - optuna.study.study - INFO - Trial 38 finished with values: [0.0005809859098793532, 6.86583160292049e-05, 0.00025394886625181544] and parameters: {'n_layers': 1, 'embedding_dim': 64, 'lr': 0.012819265837797343, 'lambda_val': 0.012618658894463725, 'batch_size': 1973, 'optimizer': 'SGD'}.
2026-06-04 23:14:31,423 - experiment_functions - INFO - Early stopping at epoch 500. Best Metrics: (0.0004397878647136647, 7.033290910308794e-05, 0.00020859400311620439)
2026-06-04 23:14:31,523 - optuna.study.study - INFO - Trial 39 finished with values: [0.0004397878647136647, 7.033290910308794e-05, 0.00020859400311620439] and parameters: {'n_layers': 3, 'embedding_dim': 64, 'lr': 2.0432132925624714e-05, 'lambda_val': 0.09101736137364394, 'batch_size': 3084, 'optimizer': 'RMSprop'}.
2026-06-04 23:16:21,479 - experiment_functions - INFO - Early stopping at epoch 2800. Best Metrics: (0.012027011924564832, 0.0018169334851631054, 0.005730794131203868)
