2026-06-05 14:59:04,697 - optuna.study.study - INFO - Trial 94 finished with values: [0.00035473159169387364, 5.526157143814054e-05, 0.0001445104561835435] and parameters: {'n_layers': 2, 'embedding_dim': 32, 'lr': 5.134015394997247e-05, 'lambda_val': 4.092345179211508e-05, 'batch_size': 2352, 'optimizer': 'SGD'}.
2026-06-05 15:01:57,169 - optuna.study.study - INFO - Trial 95 finished with values: [0.03967508629613299, 0.005554625226070066, 0.021380976732910582] and parameters: {'n_layers': 2, 'embedding_dim': 128, 'lr': 0.0002857346242509807, 'lambda_val': 2.2392691089871585e-06, 'batch_size': 2828, 'optimizer': 'Adam'}.
2026-06-05 15:05:52,105 - optuna.study.study - INFO - Trial 96 finished with values: [0.052877501468492585, 0.00690937102284145, 0.028514716888562552] and parameters: {'n_layers': 4, 'embedding_dim': 256, 'lr': 0.00017225906647401988, 'lambda_val': 0.00011375426873786574, 'batch_size': 2848, 'optimizer': 'RMSprop'}.
2026-06-05 15:06:14,837 - experiment_functions - INFO - Early stopping at epoch 550. Best Metrics: (0.020224103657396946, 0.0024449058878692476, 0.009270951446140914)
2026-06-05 15:06:14,920 - optuna.study.study - INFO - Trial 97 finished with values: [0.020224103657396946, 0.0024449058878692476, 0.009270951446140914] and parameters: {'n_layers': 2, 'embedding_dim': 32, 'lr': 0.06589928959328518, 'lambda_val': 0.0009472447880798233, 'batch_size': 2080, 'optimizer': 'Adam'}.
2026-06-05 15:06:52,415 - experiment_functions - INFO - Early stopping at epoch 800. Best Metrics: (0.020489026429521422, 0.002531984727711166, 0.009409047941607287)
2026-06-05 15:06:52,537 - optuna.study.study - INFO - Trial 98 finished with values: [0.020489026429521422, 0.002531984727711166, 0.009409047941607287] and parameters: {'n_layers': 4, 'embedding_dim': 96, 'lr': 0.001414374009860838, 'lambda_val': 0.007468981389036971, 'batch_size': 2394, 'optimizer': 'RMSprop'}.
2026-06-05 15:07:17,527 - experiment_functions - INFO - Early stopping at epoch 500. Best Metrics: (0.0003733915846222923, 6.698372295532186e-05, 0.00019293248859904907)
2026-06-05 15:07:17,978 - optuna.study.study - INFO - Trial 99 finished with values: [0.0003733915846222923, 6.698372295532186e-05, 0.00019293248859904907] and parameters: {'n_layers': 4, 'embedding_dim': 128, 'lr': 0.021885874157007525, 'lambda_val': 0.00021177238822931395, 'batch_size': 1989, 'optimizer': 'SGD'}.
2026-06-05 15:10:16,023 - optuna.study.study - INFO - Trial 100 finished with values: [0.015100673381354644, 0.002279121173554826, 0.007834069318041774] and parameters: {'n_layers': 3, 'embedding_dim': 128, 'lr': 0.00017853594211867895, 'lambda_val': 2.2392691089871585e-06, 'batch_size': 1774, 'optimizer': 'Adam'}.
2026-06-05 15:12:54,346 - optuna.study.study - INFO - Trial 101 finished with values: [0.00550057748500742, 0.0010114542166253602, 0.0032045658034913767] and parameters: {'n_layers': 1, 'embedding_dim': 128, 'lr': 0.0002857346242509807, 'lambda_val': 2.2392691089871585e-06, 'batch_size': 3183, 'optimizer': 'Adam'}.
2026-06-05 15:15:59,332 - optuna.study.study - INFO - Trial 102 finished with values: [0.07059769596529782, 0.008595686248241679, 0.03731902418409348] and parameters: {'n_layers': 3, 'embedding_dim': 128, 'lr': 0.0004666871232718281, 'lambda_val': 7.487535492065269e-05, 'batch_size': 2271, 'optimizer': 'RMSprop'}.
2026-06-05 15:19:54,200 - optuna.study.study - INFO - Trial 103 finished with values: [0.04672062583673821, 0.006110590126599237, 0.025881749162246014] and parameters: {'n_layers': 4, 'embedding_dim': 256, 'lr': 0.00017225906647401988, 'lambda_val': 1.7128084469469318e-05, 'batch_size': 2030, 'optimizer': 'RMSprop'}.
2026-06-05 15:20:23,088 - experiment_functions - INFO - Early stopping at epoch 600. Best Metrics: (0.03202638210287905, 0.003925246165181861, 0.015005903908269972)
2026-06-05 15:20:23,173 - optuna.study.study - INFO - Trial 104 finished with values: [0.03202638210287905, 0.003925246165181861, 0.015005903908269972] and parameters: {'n_layers': 4, 'embedding_dim': 96, 'lr': 0.0026407817619319117, 'lambda_val': 0.00408688017668438, 'batch_size': 3418, 'optimizer': 'Adam'}.
2026-06-05 15:23:11,838 - optuna.study.study - INFO - Trial 105 finished with values: [0.06721236206735638, 0.008414830196262308, 0.034533406694746936] and parameters: {'n_layers': 2, 'embedding_dim': 96, 'lr': 0.0008576367655519577, 'lambda_val': 0.0023604176548426264, 'batch_size': 926, 'optimizer': 'Adam'}.
2026-06-05 15:23:33,255 - experiment_functions - INFO - Early stopping at epoch 500. Best Metrics: (0.0004270259749806165, 8.372965369415233e-05, 0.00022870952982166845)
2026-06-05 15:23:33,351 - optuna.study.study - INFO - Trial 106 finished with values: [0.0004270259749806165, 8.372965369415233e-05, 0.00022870952982166845] and parameters: {'n_layers': 2, 'embedding_dim': 64, 'lr': 2.8861950409873333e-05, 'lambda_val': 2.2392691089871585e-06, 'batch_size': 2546, 'optimizer': 'RMSprop'}.
2026-06-05 15:24:20,961 - experiment_functions - INFO - Early stopping at epoch 1100. Best Metrics: (0.06052037102523125, 0.007359836559715989, 0.030891241955421343)
2026-06-05 15:24:21,030 - optuna.study.study - INFO - Trial 107 finished with values: [0.06052037102523125, 0.007359836559715989, 0.030891241955421343] and parameters: {'n_layers': 3, 'embedding_dim': 64, 'lr': 0.001414374009860838, 'lambda_val': 0.00033127211998733373, 'batch_size': 1280, 'optimizer': 'Adam'}.
2026-06-05 15:26:58,563 - optuna.study.study - INFO - Trial 108 finished with values: [0.07805670319987497, 0.009652354477861879, 0.042107413127760486] and parameters: {'n_layers': 2, 'embedding_dim': 32, 'lr': 0.0008576367655519577, 'lambda_val': 3.082500502951572e-05, 'batch_size': 2455, 'optimizer': 'Adam'}.
2026-06-05 15:27:47,935 - experiment_functions - INFO - Early stopping at epoch 1200. Best Metrics: (0.034339034959355315, 0.004129546520195593, 0.01608672128150333)
2026-06-05 15:27:48,046 - optuna.study.study - INFO - Trial 109 finished with values: [0.034339034959355315, 0.004129546520195593, 0.01608672128150333] and parameters: {'n_layers': 4, 'embedding_dim': 32, 'lr': 0.0026407817619319117, 'lambda_val': 0.00011721050749002031, 'batch_size': 1192, 'optimizer': 'Adam'}.
2026-06-05 15:28:31,279 - experiment_functions - INFO - Early stopping at epoch 950. Best Metrics: (0.05728864912249076, 0.00706845736486034, 0.029369008828298338)
2026-06-05 15:28:31,359 - optuna.study.study - INFO - Trial 110 finished with values: [0.05728864912249076, 0.00706845736486034, 0.029369008828298338] and parameters: {'n_layers': 3, 'embedding_dim': 96, 'lr': 0.001414374009860838, 'lambda_val': 0.00033127211998733373, 'batch_size': 1280, 'optimizer': 'Adam'}.
2026-06-05 15:29:05,806 - experiment_functions - INFO - Early stopping at epoch 550. Best Metrics: (0.03161277488555762, 0.0035518119097059414, 0.014296873273391934)
2026-06-05 15:29:05,891 - optuna.study.study - INFO - Trial 111 finished with values: [0.03161277488555762, 0.0035518119097059414, 0.014296873273391934] and parameters: {'n_layers': 4, 'embedding_dim': 256, 'lr': 0.056354797042132906, 'lambda_val': 1.1327076247739166e-05, 'batch_size': 1624, 'optimizer': 'Adam'}.
2026-06-05 15:30:26,379 - experiment_functions - INFO - Early stopping at epoch 2050. Best Metrics: (0.05817874410997877, 0.007071806551008106, 0.029014775203817414)
2026-06-05 15:30:26,757 - optuna.study.study - INFO - Trial 112 finished with values: [0.05817874410997877, 0.007071806551008106, 0.029014775203817414] and parameters: {'n_layers': 2, 'embedding_dim': 32, 'lr': 0.0009590496257981318, 'lambda_val': 0.0023604176548426264, 'batch_size': 2504, 'optimizer': 'Adam'}.
2026-06-05 15:31:08,865 - experiment_functions - INFO - Early stopping at epoch 950. Best Metrics: (0.04357489781769498, 0.005261571438140531, 0.02113370567217801)
2026-06-05 15:31:08,953 - optuna.study.study - INFO - Trial 113 finished with values: [0.04357489781769498, 0.005261571438140531, 0.02113370567217801] and parameters: {'n_layers': 4, 'embedding_dim': 64, 'lr': 0.0010470286775611781, 'lambda_val': 0.00020574260712132375, 'batch_size': 3339, 'optimizer': 'RMSprop'}.
2026-06-05 15:31:46,338 - experiment_functions - INFO - Early stopping at epoch 700. Best Metrics: (0.07083425871834978, 0.008607408399758858, 0.036400163483361954)
2026-06-05 15:31:46,458 - optuna.study.study - INFO - Trial 114 finished with values: [0.07083425871834978, 0.008607408399758858, 0.036400163483361954] and parameters: {'n_layers': 2, 'embedding_dim': 256, 'lr': 0.0029470384606335377, 'lambda_val': 5.587325552332493e-06, 'batch_size': 2271, 'optimizer': 'Adam'}.
2026-06-05 15:34:38,604 - optuna.study.study - INFO - Trial 115 finished with values: [0.04957538371147536, 0.0056735213343157625, 0.023553922647926842] and parameters: {'n_layers': 2, 'embedding_dim': 128, 'lr': 0.004586159400047152, 'lambda_val': 2.2392691089871585e-06, 'batch_size': 2828, 'optimizer': 'RMSprop'}.
2026-06-05 15:35:04,572 - experiment_functions - INFO - Early stopping at epoch 600. Best Metrics: (0.03706592891407866, 0.004392457632795231, 0.016956370271567104)
2026-06-05 15:35:04,669 - optuna.study.study - INFO - Trial 116 finished with values: [0.03706592891407866, 0.004392457632795231, 0.016956370271567104] and parameters: {'n_layers': 2, 'embedding_dim': 64, 'lr': 0.008261825578479428, 'lambda_val': 0.00033127211998733373, 'batch_size': 1529, 'optimizer': 'Adam'}.
2026-06-05 15:37:12,162 - experiment_functions - INFO - Early stopping at epoch 3200. Best Metrics: (0.060707270698533926, 0.007344765222051041, 0.030260880010408234)
2026-06-05 15:37:12,258 - optuna.study.study - INFO - Trial 117 finished with values: [0.060707270698533926, 0.007344765222051041, 0.030260880010408234] and parameters: {'n_layers': 3, 'embedding_dim': 32, 'lr': 0.0007908861785647595, 'lambda_val': 0.00011375426873786574, 'batch_size': 2947, 'optimizer': 'RMSprop'}.
2026-06-05 15:39:44,223 - optuna.study.study - INFO - Trial 118 finished with values: [0.06588438149779155, 0.008803335789403175, 0.037119166924524584] and parameters: {'n_layers': 1, 'embedding_dim': 32, 'lr': 0.0007908861785647595, 'lambda_val': 0.00011375426873786574, 'batch_size': 2947, 'optimizer': 'RMSprop'}.
2026-06-05 15:42:20,957 - optuna.study.study - INFO - Trial 119 finished with values: [0.0770915354058471, 0.009386094179114474, 0.04050875117990504] and parameters: {'n_layers': 2, 'embedding_dim': 32, 'lr': 0.0007908861785647595, 'lambda_val': 0.00011375426873786574, 'batch_size': 2947, 'optimizer': 'Adam'}.
2026-06-05 15:43:20,972 - experiment_functions - INFO - Early stopping at epoch 1550. Best Metrics: (0.048976133150544415, 0.0066163172349119155, 0.024378283412189193)
2026-06-05 15:43:21,395 - optuna.study.study - INFO - Trial 120 finished with values: [0.048976133150544415, 0.0066163172349119155, 0.024378283412189193] and parameters: {'n_layers': 1, 'embedding_dim': 32, 'lr': 0.0010470286775611781, 'lambda_val': 0.021886493172504122, 'batch_size': 3475, 'optimizer': 'Adam'}.
2026-06-05 15:46:10,916 - optuna.study.study - INFO - Trial 121 finished with values: [0.05026475518066247, 0.00618929600107174, 0.024818942089811048] and parameters: {'n_layers': 4, 'embedding_dim': 64, 'lr': 0.00029609176700534276, 'lambda_val': 3.732019937312388e-06, 'batch_size': 3207, 'optimizer': 'Adam'}.
2026-06-05 15:46:34,634 - experiment_functions - INFO - Early stopping at epoch 550. Best Metrics: (0.010380229302567778, 0.0010884854980239803, 0.004687333634197974)
2026-06-05 15:46:35,030 - optuna.study.study - INFO - Trial 122 finished with values: [0.010380229302567778, 0.0010884854980239803, 0.004687333634197974] and parameters: {'n_layers': 3, 'embedding_dim': 64, 'lr': 0.0984478051441499, 'lambda_val': 0.014103715670985523, 'batch_size': 768, 'optimizer': 'Adam'}.
2026-06-05 15:49:04,019 - optuna.study.study - INFO - Trial 123 finished with values: [0.01674399273606387, 0.0027094915935427693, 0.00905454549482091] and parameters: {'n_layers': 2, 'embedding_dim': 32, 'lr': 0.0002857346242509807, 'lambda_val': 0.00408688017668438, 'batch_size': 2183, 'optimizer': 'Adam'}.
2026-06-05 15:49:28,286 - experiment_functions - INFO - Early stopping at epoch 550. Best Metrics: (0.020780683553312324, 0.002681023511286757, 0.00944978691070038)
2026-06-05 15:49:28,370 - optuna.study.study - INFO - Trial 124 finished with values: [0.020780683553312324, 0.002681023511286757, 0.00944978691070038] and parameters: {'n_layers': 3, 'embedding_dim': 64, 'lr': 0.006771940094590308, 'lambda_val': 0.005328495718034868, 'batch_size': 767, 'optimizer': 'RMSprop'}.
2026-06-05 15:50:18,243 - experiment_functions - INFO - Early stopping at epoch 1250. Best Metrics: (0.006120031201400808, 0.0008138522339071607, 0.002889038023914243)
2026-06-05 15:50:18,609 - optuna.study.study - INFO - Trial 125 finished with values: [0.006120031201400808, 0.0008138522339071607, 0.002889038023914243] and parameters: {'n_layers': 4, 'embedding_dim': 32, 'lr': 0.05076772045729777, 'lambda_val': 0.051056058442533477, 'batch_size': 3686, 'optimizer': 'RMSprop'}.
2026-06-05 15:52:55,489 - optuna.study.study - INFO - Trial 126 finished with values: [0.023745637307203804, 0.0030795766628709223, 0.010780128514009883] and parameters: {'n_layers': 2, 'embedding_dim': 64, 'lr': 0.03664600596225258, 'lambda_val': 0.001818567306091985, 'batch_size': 666, 'optimizer': 'RMSprop'}.
2026-06-05 15:54:34,081 - experiment_functions - INFO - Early stopping at epoch 2250. Best Metrics: (0.04613049053932649, 0.0052314287628106365, 0.020993954397326004)
2026-06-05 15:54:34,158 - optuna.study.study - INFO - Trial 127 finished with values: [0.04613049053932649, 0.0052314287628106365, 0.020993954397326004] and parameters: {'n_layers': 2, 'embedding_dim': 128, 'lr': 0.004586159400047152, 'lambda_val': 2.2392691089871585e-06, 'batch_size': 1011, 'optimizer': 'Adam'}.
2026-06-05 15:54:56,728 - experiment_functions - INFO - Early stopping at epoch 550. Best Metrics: (0.021176562359820305, 0.0030209659052850162, 0.010260017545795315)
2026-06-05 15:54:56,829 - optuna.study.study - INFO - Trial 128 finished with values: [0.021176562359820305, 0.0030209659052850162, 0.010260017545795315] and parameters: {'n_layers': 1, 'embedding_dim': 32, 'lr': 0.027400834032566487, 'lambda_val': 0.007468981389036971, 'batch_size': 2690, 'optimizer': 'Adam'}.
2026-06-05 15:57:42,141 - optuna.study.study - INFO - Trial 129 finished with values: [0.03844995632660816, 0.004946747940250519, 0.018041495554575047] and parameters: {'n_layers': 2, 'embedding_dim': 96, 'lr': 0.0008260980234570757, 'lambda_val': 0.021886493172504122, 'batch_size': 768, 'optimizer': 'Adam'}.
2026-06-05 16:00:11,986 - optuna.study.study - INFO - Trial 130 finished with values: [0.0031795916671173647, 0.0005442427490119901, 0.0018481530379548512] and parameters: {'n_layers': 2, 'embedding_dim': 32, 'lr': 0.00017225906647401988, 'lambda_val': 0.00011721050749002031, 'batch_size': 2848, 'optimizer': 'RMSprop'}.
2026-06-05 16:01:05,002 - experiment_functions - INFO - Early stopping at epoch 950. Best Metrics: (0.03880373983156116, 0.004836224797374238, 0.018495929899086622)
2026-06-05 16:01:05,102 - optuna.study.study - INFO - Trial 131 finished with values: [0.03880373983156116, 0.004836224797374238, 0.018495929899086622] and parameters: {'n_layers': 3, 'embedding_dim': 256, 'lr': 0.0007730079936260513, 'lambda_val': 0.005288720124154074, 'batch_size': 2947, 'optimizer': 'RMSprop'}.
2026-06-05 16:02:51,117 - experiment_functions - INFO - Early stopping at epoch 2400. Best Metrics: (0.0003601185397656833, 6.363453680755577e-05, 0.00018532042536090432)
2026-06-05 16:02:51,923 - optuna.study.study - INFO - Trial 132 finished with values: [0.0003601185397656833, 6.363453680755577e-05, 0.00018532042536090432] and parameters: {'n_layers': 3, 'embedding_dim': 128, 'lr': 2.7134833406244442e-05, 'lambda_val': 0.0037563811732764327, 'batch_size': 1011, 'optimizer': 'RMSprop'}.
2026-06-05 16:04:24,699 - experiment_functions - INFO - Early stopping at epoch 2150. Best Metrics: (0.05707532750315244, 0.007006497421126667, 0.027916003791920458)
2026-06-05 16:04:24,794 - optuna.study.study - INFO - Trial 133 finished with values: [0.05707532750315244, 0.007006497421126667, 0.027916003791920458] and parameters: {'n_layers': 4, 'embedding_dim': 64, 'lr': 0.0007908861785647595, 'lambda_val': 3.732019937312388e-06, 'batch_size': 908, 'optimizer': 'RMSprop'}.
2026-06-05 16:04:46,859 - experiment_functions - INFO - Early stopping at epoch 500. Best Metrics: (0.0004988001320855054, 8.707883984191842e-05, 0.0002250809814864993)
2026-06-05 16:04:47,102 - optuna.study.study - INFO - Trial 134 finished with values: [0.0004988001320855054, 8.707883984191842e-05, 0.0002250809814864993] and parameters: {'n_layers': 3, 'embedding_dim': 64, 'lr': 0.008261825578479428, 'lambda_val': 3.684365830705915e-05, 'batch_size': 1529, 'optimizer': 'SGD'}.
2026-06-05 16:07:33,903 - optuna.study.study - INFO - Trial 135 finished with values: [0.053967324644362026, 0.007227543706879229, 0.02796208433794932] and parameters: {'n_layers': 2, 'embedding_dim': 96, 'lr': 0.0004253926145527492, 'lambda_val': 0.004285518144526943, 'batch_size': 2080, 'optimizer': 'Adam'}.
2026-06-05 16:07:55,155 - experiment_functions - INFO - Early stopping at epoch 500. Best Metrics: (0.0004626045204522742, 7.87058744725032e-05, 0.00020400024321825117)
2026-06-05 16:07:55,336 - optuna.study.study - INFO - Trial 136 finished with values: [0.0004626045204522742, 7.87058744725032e-05, 0.00020400024321825117] and parameters: {'n_layers': 1, 'embedding_dim': 96, 'lr': 0.0009590496257981318, 'lambda_val': 0.07255121184355613, 'batch_size': 655, 'optimizer': 'Adam'}.
2026-06-05 16:10:32,262 - optuna.study.study - INFO - Trial 137 finished with values: [0.04940210144964849, 0.006412016879898185, 0.026119366516972563] and parameters: {'n_layers': 3, 'embedding_dim': 32, 'lr': 0.00035382245097748176, 'lambda_val': 7.487535492065269e-05, 'batch_size': 3477, 'optimizer': 'RMSprop'}.
2026-06-05 16:11:12,850 - experiment_functions - INFO - Early stopping at epoch 950. Best Metrics: (0.012366673103274725, 0.0015640699310067654, 0.005449678805070776)
2026-06-05 16:11:12,944 - optuna.study.study - INFO - Trial 138 finished with values: [0.012366673103274725, 0.0015640699310067654, 0.005449678805070776] and parameters: {'n_layers': 3, 'embedding_dim': 64, 'lr': 0.0010470286775611781, 'lambda_val': 0.05333231486872106, 'batch_size': 3475, 'optimizer': 'Adam'}.
2026-06-05 16:11:37,302 - experiment_functions - INFO - Early stopping at epoch 600. Best Metrics: (0.0004552879088349126, 7.368209525085404e-05, 0.00021126713761265582)
2026-06-05 16:11:37,440 - optuna.study.study - INFO - Trial 139 finished with values: [0.0004552879088349126, 7.368209525085404e-05, 0.00021126713761265582] and parameters: {'n_layers': 2, 'embedding_dim': 32, 'lr': 1.7994921392467546e-05, 'lambda_val': 7.487535492065269e-05, 'batch_size': 2271, 'optimizer': 'Adam'}.
2026-06-05 16:12:08,658 - experiment_functions - INFO - Early stopping at epoch 700. Best Metrics: (0.06427085180198826, 0.008172014200549268, 0.03180585484321626)
2026-06-05 16:12:09,077 - optuna.study.study - INFO - Trial 140 finished with values: [0.06427085180198826, 0.008172014200549268, 0.03180585484321626] and parameters: {'n_layers': 1, 'embedding_dim': 128, 'lr': 0.0029470384606335377, 'lambda_val': 0.0011513204288259027, 'batch_size': 2974, 'optimizer': 'RMSprop'}.
2026-06-05 16:14:58,238 - optuna.study.study - INFO - Trial 141 finished with values: [0.08360797431878131, 0.010112867573179717, 0.044252678044133194] and parameters: {'n_layers': 2, 'embedding_dim': 96, 'lr': 0.0007730079936260513, 'lambda_val': 2.8670388049392515e-06, 'batch_size': 2271, 'optimizer': 'RMSprop'}.
2026-06-05 16:17:41,774 - optuna.study.study - INFO - Trial 142 finished with values: [0.09144956358602058, 0.0113788599370353, 0.050118550222470255] and parameters: {'n_layers': 1, 'embedding_dim': 96, 'lr': 0.0007730079936260513, 'lambda_val': 3.684365830705915e-05, 'batch_size': 4028, 'optimizer': 'RMSprop'}.
2026-06-05 16:18:37,823 - experiment_functions - INFO - Early stopping at epoch 1300. Best Metrics: (0.051938427550903055, 0.006592872931877555, 0.025321362644224417)
2026-06-05 16:18:38,182 - optuna.study.study - INFO - Trial 143 finished with values: [0.051938427550903055, 0.006592872931877555, 0.025321362644224417] and parameters: {'n_layers': 2, 'embedding_dim': 96, 'lr': 0.0009590496257981318, 'lambda_val': 0.007468981389036971, 'batch_size': 1769, 'optimizer': 'Adam'}.
2026-06-05 16:21:03,992 - experiment_functions - INFO - Early stopping at epoch 3850. Best Metrics: (0.040783384604368554, 0.0055981646459910255, 0.02120067671164407)
2026-06-05 16:21:04,081 - optuna.study.study - INFO - Trial 144 finished with values: [0.040783384604368554, 0.0055981646459910255, 0.02120067671164407] and parameters: {'n_layers': 1, 'embedding_dim': 32, 'lr': 0.0007908861785647595, 'lambda_val': 0.023412266320020313, 'batch_size': 2498, 'optimizer': 'RMSprop'}.
2026-06-05 16:23:39,259 - optuna.study.study - INFO - Trial 145 finished with values: [0.02744403444923114, 0.004218299953111394, 0.01634976361428448] and parameters: {'n_layers': 1, 'embedding_dim': 96, 'lr': 0.00035382245097748176, 'lambda_val': 0.00011375426873786574, 'batch_size': 3477, 'optimizer': 'RMSprop'}.
2026-06-05 16:26:11,096 - optuna.study.study - INFO - Trial 146 finished with values: [0.004903033293413692, 0.0008875343291580146, 0.002746392243586751] and parameters: {'n_layers': 2, 'embedding_dim': 64, 'lr': 0.00024752772701677224, 'lambda_val': 2.2392691089871585e-06, 'batch_size': 1307, 'optimizer': 'Adam'}.
