2026-06-05 06:54:03,630 - optuna.study.study - INFO - Trial 44 finished with values: [0.0005390029978097961, 8.372965369415233e-05, 0.0002916361809209083] and parameters: {'n_layers': 1, 'embedding_dim': 256, 'lr': 0.04382272611102685, 'lambda_val': 0.00012250709547244776, 'batch_size': 1554, 'optimizer': 'SGD'}.
2026-06-05 06:55:14,882 - experiment_functions - INFO - Early stopping at epoch 1750. Best Metrics: (0.011126227944414417, 0.0014033089959139928, 0.004882052449441025)
2026-06-05 06:55:15,816 - optuna.study.study - INFO - Trial 45 finished with values: [0.011126227944414417, 0.0014033089959139928, 0.004882052449441025] and parameters: {'n_layers': 1, 'embedding_dim': 128, 'lr': 0.02238024622660844, 'lambda_val': 0.05466852834793906, 'batch_size': 970, 'optimizer': 'Adam'}.
2026-06-05 06:58:11,547 - optuna.study.study - INFO - Trial 46 finished with values: [0.02187765294098431, 0.003595351329626901, 0.012362966475234995] and parameters: {'n_layers': 1, 'embedding_dim': 256, 'lr': 0.0002935151629562318, 'lambda_val': 0.006784020914475507, 'batch_size': 3358, 'optimizer': 'RMSprop'}.
2026-06-05 07:00:56,767 - optuna.study.study - INFO - Trial 47 finished with values: [0.000586589462582631, 9.210261906356756e-05, 0.0002579478029944993] and parameters: {'n_layers': 2, 'embedding_dim': 128, 'lr': 6.624588925552321e-05, 'lambda_val': 0.0001456555254618898, 'batch_size': 3740, 'optimizer': 'RMSprop'}.
2026-06-05 07:01:19,741 - experiment_functions - INFO - Early stopping at epoch 550. Best Metrics: (0.02228916346923964, 0.002825038515640699, 0.010509986716715618)
2026-06-05 07:01:19,841 - optuna.study.study - INFO - Trial 48 finished with values: [0.02228916346923964, 0.002825038515640699, 0.010509986716715618] and parameters: {'n_layers': 2, 'embedding_dim': 32, 'lr': 0.05734698935223446, 'lambda_val': 1.2393469425028176e-05, 'batch_size': 1146, 'optimizer': 'Adam'}.
2026-06-05 07:01:40,958 - experiment_functions - INFO - Early stopping at epoch 500. Best Metrics: (0.00029602181585442654, 5.526157143814053e-05, 0.0001640737292394512)
2026-06-05 07:01:41,790 - optuna.study.study - INFO - Trial 49 finished with values: [0.00029602181585442654, 5.526157143814053e-05, 0.0001640737292394512] and parameters: {'n_layers': 2, 'embedding_dim': 64, 'lr': 0.0036593836455479077, 'lambda_val': 0.005873037759583179, 'batch_size': 631, 'optimizer': 'SGD'}.
2026-06-05 07:02:55,396 - experiment_functions - INFO - Early stopping at epoch 1900. Best Metrics: (0.038107244543862405, 0.0043355214682832075, 0.017279602305991935)
2026-06-05 07:02:55,484 - optuna.study.study - INFO - Trial 50 finished with values: [0.038107244543862405, 0.0043355214682832075, 0.017279602305991935] and parameters: {'n_layers': 2, 'embedding_dim': 32, 'lr': 0.006542998749224963, 'lambda_val': 0.00013726443089426057, 'batch_size': 808, 'optimizer': 'Adam'}.
2026-06-05 07:03:20,496 - experiment_functions - INFO - Early stopping at epoch 500. Best Metrics: (0.0006601814942973581, 9.210261906356756e-05, 0.00027153912826238965)
2026-06-05 07:03:20,751 - optuna.study.study - INFO - Trial 51 finished with values: [0.0006601814942973581, 9.210261906356756e-05, 0.00027153912826238965] and parameters: {'n_layers': 4, 'embedding_dim': 128, 'lr': 1.518978398498057e-05, 'lambda_val': 0.029915014297001986, 'batch_size': 1536, 'optimizer': 'SGD'}.
2026-06-05 07:03:48,673 - experiment_functions - INFO - Early stopping at epoch 650. Best Metrics: (0.03974992202657365, 0.004909906892625093, 0.018485234154077827)
2026-06-05 07:03:48,821 - optuna.study.study - INFO - Trial 52 finished with values: [0.03974992202657365, 0.004909906892625093, 0.018485234154077827] and parameters: {'n_layers': 2, 'embedding_dim': 64, 'lr': 0.005703236170133443, 'lambda_val': 0.002704517607370656, 'batch_size': 1607, 'optimizer': 'Adam'}.
2026-06-05 07:04:11,768 - experiment_functions - INFO - Early stopping at epoch 550. Best Metrics: (0.006669607576261563, 0.00107173956728515, 0.003730687838838685)
2026-06-05 07:04:11,851 - optuna.study.study - INFO - Trial 53 finished with values: [0.006669607576261563, 0.00107173956728515, 0.003730687838838685] and parameters: {'n_layers': 1, 'embedding_dim': 96, 'lr': 0.02238024622660844, 'lambda_val': 0.05466852834793906, 'batch_size': 633, 'optimizer': 'RMSprop'}.
2026-06-05 07:05:56,552 - experiment_functions - INFO - Early stopping at epoch 1800. Best Metrics: (0.0003607050160479654, 5.3586978364257486e-05, 0.00015550176615211294)
2026-06-05 07:05:57,409 - optuna.study.study - INFO - Trial 54 finished with values: [0.0003607050160479654, 5.3586978364257486e-05, 0.00015550176615211294] and parameters: {'n_layers': 4, 'embedding_dim': 256, 'lr': 1.1517244102309136e-05, 'lambda_val': 0.00020503613481941254, 'batch_size': 747, 'optimizer': 'Adam'}.
2026-06-05 07:09:27,186 - optuna.study.study - INFO - Trial 55 finished with values: [0.011732111869851715, 0.0017298546453211872, 0.006099035304917278] and parameters: {'n_layers': 3, 'embedding_dim': 256, 'lr': 0.0001448734655841958, 'lambda_val': 6.977831082453278e-06, 'batch_size': 1298, 'optimizer': 'RMSprop'}.
2026-06-05 07:09:49,904 - experiment_functions - INFO - Early stopping at epoch 500. Best Metrics: (0.0006821347263663211, 8.875343291580147e-05, 0.0003246796053799772)
2026-06-05 07:09:50,007 - optuna.study.study - INFO - Trial 56 finished with values: [0.0006821347263663211, 8.875343291580147e-05, 0.0003246796053799772] and parameters: {'n_layers': 3, 'embedding_dim': 96, 'lr': 0.0043097709917901215, 'lambda_val': 0.001009549463278057, 'batch_size': 891, 'optimizer': 'SGD'}.
2026-06-05 07:10:31,925 - experiment_functions - INFO - Early stopping at epoch 750. Best Metrics: (0.01655817184609312, 0.0019525755241476322, 0.007331701319640664)
2026-06-05 07:10:32,016 - optuna.study.study - INFO - Trial 57 finished with values: [0.01655817184609312, 0.0019525755241476322, 0.007331701319640664] and parameters: {'n_layers': 3, 'embedding_dim': 256, 'lr': 0.011575453890852001, 'lambda_val': 0.006784020914475507, 'batch_size': 4021, 'optimizer': 'RMSprop'}.
2026-06-05 07:11:44,923 - experiment_functions - INFO - Early stopping at epoch 1850. Best Metrics: (0.06441399862737375, 0.0077282470359702595, 0.03197133906331093)
2026-06-05 07:11:45,039 - optuna.study.study - INFO - Trial 58 finished with values: [0.06441399862737375, 0.0077282470359702595, 0.03197133906331093] and parameters: {'n_layers': 2, 'embedding_dim': 32, 'lr': 0.0017163448230141686, 'lambda_val': 0.0007536284412237263, 'batch_size': 1642, 'optimizer': 'Adam'}.
2026-06-05 07:12:10,480 - experiment_functions - INFO - Early stopping at epoch 500. Best Metrics: (0.00043812331695567243, 7.033290910308795e-05, 0.0002128704935699423)
2026-06-05 07:12:10,836 - optuna.study.study - INFO - Trial 59 finished with values: [0.00043812331695567243, 7.033290910308795e-05, 0.0002128704935699423] and parameters: {'n_layers': 4, 'embedding_dim': 128, 'lr': 0.010864534580056047, 'lambda_val': 0.029915014297001986, 'batch_size': 3139, 'optimizer': 'SGD'}.
2026-06-05 07:14:46,430 - optuna.study.study - INFO - Trial 60 finished with values: [0.015782107031110923, 0.0025001674593073883, 0.008898815987241866] and parameters: {'n_layers': 2, 'embedding_dim': 64, 'lr': 0.00036100664498869524, 'lambda_val': 0.007008209464067845, 'batch_size': 595, 'optimizer': 'RMSprop'}.
2026-06-05 07:15:28,697 - experiment_functions - INFO - Early stopping at epoch 1000. Best Metrics: (0.011469095597042135, 0.0014384754504655369, 0.004947677691314776)
2026-06-05 07:15:28,791 - optuna.study.study - INFO - Trial 61 finished with values: [0.011469095597042135, 0.0014384754504655369, 0.004947677691314776] and parameters: {'n_layers': 3, 'embedding_dim': 64, 'lr': 0.024984519415047875, 'lambda_val': 0.019865073532322072, 'batch_size': 2568, 'optimizer': 'RMSprop'}.
2026-06-05 07:16:56,963 - experiment_functions - INFO - Early stopping at epoch 1500. Best Metrics: (0.013447970579440081, 0.0016210060955187892, 0.00576913157172306)
2026-06-05 07:16:57,061 - optuna.study.study - INFO - Trial 62 finished with values: [0.013447970579440081, 0.0016210060955187892, 0.00576913157172306] and parameters: {'n_layers': 4, 'embedding_dim': 256, 'lr': 0.0023440150084551373, 'lambda_val': 0.018222291262846232, 'batch_size': 1861, 'optimizer': 'RMSprop'}.
2026-06-05 07:17:24,985 - experiment_functions - INFO - Early stopping at epoch 500. Best Metrics: (0.0005030449514802351, 6.530912988143881e-05, 0.00022536038356408528)
2026-06-05 07:17:25,087 - optuna.study.study - INFO - Trial 63 finished with values: [0.0005030449514802351, 6.530912988143881e-05, 0.00022536038356408528] and parameters: {'n_layers': 3, 'embedding_dim': 256, 'lr': 0.027845228823252365, 'lambda_val': 0.002222029644900973, 'batch_size': 1275, 'optimizer': 'SGD'}.
2026-06-05 07:18:22,930 - experiment_functions - INFO - Early stopping at epoch 1400. Best Metrics: (0.008092845487044555, 0.0010348985196597228, 0.003644865292362728)
2026-06-05 07:18:23,056 - optuna.study.study - INFO - Trial 64 finished with values: [0.008092845487044555, 0.0010348985196597228, 0.003644865292362728] and parameters: {'n_layers': 2, 'embedding_dim': 96, 'lr': 0.029467057222353044, 'lambda_val': 0.060371212247772976, 'batch_size': 3595, 'optimizer': 'RMSprop'}.
2026-06-05 07:18:51,864 - experiment_functions - INFO - Early stopping at epoch 650. Best Metrics: (0.019526028822676338, 0.0024164378056132363, 0.009141733824622907)
2026-06-05 07:18:51,962 - optuna.study.study - INFO - Trial 65 finished with values: [0.019526028822676338, 0.0024164378056132363, 0.009141733824622907] and parameters: {'n_layers': 3, 'embedding_dim': 64, 'lr': 0.006542998749224963, 'lambda_val': 0.0021320826345663127, 'batch_size': 674, 'optimizer': 'Adam'}.
2026-06-05 07:19:11,882 - experiment_functions - INFO - Early stopping at epoch 500. Best Metrics: (0.0003974511120742759, 6.363453680755576e-05, 0.00016701647360455545)
2026-06-05 07:19:12,293 - optuna.study.study - INFO - Trial 66 finished with values: [0.0003974511120742759, 6.363453680755576e-05, 0.00016701647360455545] and parameters: {'n_layers': 1, 'embedding_dim': 32, 'lr': 0.0006596849911770471, 'lambda_val': 0.05466852834793906, 'batch_size': 3327, 'optimizer': 'SGD'}.
2026-06-05 07:22:26,699 - optuna.study.study - INFO - Trial 67 finished with values: [0.020771704752612197, 0.003302297541697368, 0.01200528020837884] and parameters: {'n_layers': 2, 'embedding_dim': 256, 'lr': 0.000350216316785427, 'lambda_val': 0.00017486567415461547, 'batch_size': 816, 'optimizer': 'Adam'}.
2026-06-05 07:22:57,077 - experiment_functions - INFO - Early stopping at epoch 500. Best Metrics: (0.0005389836545009021, 7.870587447250318e-05, 0.0002613799704090858)
2026-06-05 07:22:57,880 - optuna.study.study - INFO - Trial 68 finished with values: [0.0005389836545009021, 7.870587447250318e-05, 0.0002613799704090858] and parameters: {'n_layers': 4, 'embedding_dim': 256, 'lr': 1.0940731148899947e-05, 'lambda_val': 0.0028468440427530635, 'batch_size': 1275, 'optimizer': 'SGD'}.
2026-06-05 07:26:32,325 - optuna.study.study - INFO - Trial 69 finished with values: [0.0418644523897808, 0.0058912184339205585, 0.022201560514430313] and parameters: {'n_layers': 3, 'embedding_dim': 256, 'lr': 0.00020056257290353266, 'lambda_val': 0.0028468440427530635, 'batch_size': 2067, 'optimizer': 'RMSprop'}.
2026-06-05 07:27:00,868 - experiment_functions - INFO - Early stopping at epoch 550. Best Metrics: (0.018139546766006497, 0.002200415299082323, 0.008740647839773033)
2026-06-05 07:27:00,965 - optuna.study.study - INFO - Trial 70 finished with values: [0.018139546766006497, 0.002200415299082323, 0.008740647839773033] and parameters: {'n_layers': 2, 'embedding_dim': 256, 'lr': 0.004642352774614114, 'lambda_val': 0.019865073532322072, 'batch_size': 1298, 'optimizer': 'RMSprop'}.
2026-06-05 07:28:06,181 - experiment_functions - INFO - Early stopping at epoch 1750. Best Metrics: (0.0006444337928597907, 9.210261906356756e-05, 0.00028998165860239834)
2026-06-05 07:28:06,510 - optuna.study.study - INFO - Trial 71 finished with values: [0.0006444337928597907, 9.210261906356756e-05, 0.00028998165860239834] and parameters: {'n_layers': 1, 'embedding_dim': 64, 'lr': 0.00014892043552417684, 'lambda_val': 1.947934152619754e-06, 'batch_size': 747, 'optimizer': 'Adam'}.
2026-06-05 07:28:28,895 - experiment_functions - INFO - Early stopping at epoch 500. Best Metrics: (0.0004075619806967484, 7.2007502176971e-05, 0.00017706116149368082)
2026-06-05 07:28:29,025 - optuna.study.study - INFO - Trial 72 finished with values: [0.0004075619806967484, 7.2007502176971e-05, 0.00017706116149368082] and parameters: {'n_layers': 4, 'embedding_dim': 64, 'lr': 0.0023440150084551373, 'lambda_val': 0.018222291262846232, 'batch_size': 3529, 'optimizer': 'SGD'}.
2026-06-05 07:30:39,461 - experiment_functions - INFO - Early stopping at epoch 2200. Best Metrics: (0.03489161913014796, 0.004384084667425816, 0.016929718082970443)
2026-06-05 07:30:39,699 - optuna.study.study - INFO - Trial 73 finished with values: [0.03489161913014796, 0.004384084667425816, 0.016929718082970443] and parameters: {'n_layers': 4, 'embedding_dim': 256, 'lr': 0.0002935151629562318, 'lambda_val': 0.006784020914475507, 'batch_size': 4021, 'optimizer': 'Adam'}.
2026-06-05 07:32:51,963 - experiment_functions - INFO - Early stopping at epoch 3200. Best Metrics: (0.04041262856470818, 0.004792685377453279, 0.018598525089119695)
2026-06-05 07:32:52,115 - optuna.study.study - INFO - Trial 74 finished with values: [0.04041262856470818, 0.004792685377453279, 0.018598525089119695] and parameters: {'n_layers': 2, 'embedding_dim': 96, 'lr': 0.0041201733250423745, 'lambda_val': 0.0003344121448101528, 'batch_size': 1302, 'optimizer': 'RMSprop'}.
2026-06-05 07:33:14,121 - experiment_functions - INFO - Early stopping at epoch 500. Best Metrics: (0.0005384377583933234, 8.875343291580146e-05, 0.00026990136231771003)
2026-06-05 07:33:14,375 - optuna.study.study - INFO - Trial 75 finished with values: [0.0005384377583933234, 8.875343291580146e-05, 0.00026990136231771003] and parameters: {'n_layers': 2, 'embedding_dim': 96, 'lr': 0.000478584603147661, 'lambda_val': 4.680430056710386e-06, 'batch_size': 1986, 'optimizer': 'SGD'}.
2026-06-05 07:33:39,071 - experiment_functions - INFO - Early stopping at epoch 550. Best Metrics: (0.024894912403093154, 0.00319344899189497, 0.012001831891038579)
2026-06-05 07:33:39,714 - optuna.study.study - INFO - Trial 76 finished with values: [0.024894912403093154, 0.00319344899189497, 0.012001831891038579] and parameters: {'n_layers': 2, 'embedding_dim': 96, 'lr': 0.019367051543267743, 'lambda_val': 0.0008919112975523749, 'batch_size': 595, 'optimizer': 'RMSprop'}.
2026-06-05 07:34:10,882 - experiment_functions - INFO - Early stopping at epoch 550. Best Metrics: (0.021288081481795486, 0.0024733739701252597, 0.009862324518128913)
2026-06-05 07:34:10,983 - optuna.study.study - INFO - Trial 77 finished with values: [0.021288081481795486, 0.0024733739701252597, 0.009862324518128913] and parameters: {'n_layers': 3, 'embedding_dim': 256, 'lr': 0.027845228823252365, 'lambda_val': 0.0028468440427530635, 'batch_size': 1995, 'optimizer': 'Adam'}.
2026-06-05 07:34:34,693 - experiment_functions - INFO - Early stopping at epoch 550. Best Metrics: (0.010906625823362085, 0.001322928528367607, 0.005282038369055248)
2026-06-05 07:34:34,784 - optuna.study.study - INFO - Trial 78 finished with values: [0.010906625823362085, 0.001322928528367607, 0.005282038369055248] and parameters: {'n_layers': 3, 'embedding_dim': 64, 'lr': 0.027845228823252365, 'lambda_val': 0.0483097925295068, 'batch_size': 1275, 'optimizer': 'Adam'}.
2026-06-05 07:34:58,557 - experiment_functions - INFO - Early stopping at epoch 550. Best Metrics: (0.008600500128653963, 0.0012643177707817, 0.004438571296962169)
2026-06-05 07:34:58,663 - optuna.study.study - INFO - Trial 79 finished with values: [0.008600500128653963, 0.0012643177707817, 0.004438571296962169] and parameters: {'n_layers': 1, 'embedding_dim': 128, 'lr': 0.02238024622660844, 'lambda_val': 0.05466852834793906, 'batch_size': 970, 'optimizer': 'Adam'}.
2026-06-05 07:38:16,201 - optuna.study.study - INFO - Trial 80 finished with values: [0.06426255483645857, 0.008500234443030344, 0.035141984122010694] and parameters: {'n_layers': 2, 'embedding_dim': 256, 'lr': 0.0002935151629562318, 'lambda_val': 0.00010844106835038753, 'batch_size': 2799, 'optimizer': 'RMSprop'}.
2026-06-05 07:41:29,902 - optuna.study.study - INFO - Trial 81 finished with values: [0.018720422762149372, 0.002935561658516981, 0.010250630850316486] and parameters: {'n_layers': 2, 'embedding_dim': 256, 'lr': 0.0001808343553198497, 'lambda_val': 6.977831082453278e-06, 'batch_size': 2755, 'optimizer': 'RMSprop'}.
2026-06-05 07:41:53,379 - experiment_functions - INFO - Early stopping at epoch 500. Best Metrics: (0.00043305723265692534, 6.698372295532186e-05, 0.00023789301733827145)
2026-06-05 07:41:54,482 - optuna.study.study - INFO - Trial 82 finished with values: [0.00043305723265692534, 6.698372295532186e-05, 0.00023789301733827145] and parameters: {'n_layers': 1, 'embedding_dim': 256, 'lr': 0.005809481180223495, 'lambda_val': 0.012228980036022399, 'batch_size': 3529, 'optimizer': 'SGD'}.
2026-06-05 07:42:15,246 - experiment_functions - INFO - Early stopping at epoch 500. Best Metrics: (0.0007054190566586452, 9.71263982852167e-05, 0.00034494486335241253)
2026-06-05 07:42:15,405 - optuna.study.study - INFO - Trial 83 finished with values: [0.0007054190566586452, 9.71263982852167e-05, 0.00034494486335241253] and parameters: {'n_layers': 2, 'embedding_dim': 32, 'lr': 0.00013799410156741665, 'lambda_val': 0.0483097925295068, 'batch_size': 2437, 'optimizer': 'RMSprop'}.
2026-06-05 07:43:32,030 - experiment_functions - INFO - Early stopping at epoch 1300. Best Metrics: (0.007804704255532922, 0.000976287762073816, 0.0033525407760050204)
2026-06-05 07:43:32,355 - optuna.study.study - INFO - Trial 84 finished with values: [0.007804704255532922, 0.000976287762073816, 0.0033525407760050204] and parameters: {'n_layers': 4, 'embedding_dim': 256, 'lr': 0.0015391297039669685, 'lambda_val': 0.07074738156904987, 'batch_size': 2437, 'optimizer': 'RMSprop'}.
2026-06-05 07:43:59,103 - experiment_functions - INFO - Early stopping at epoch 500. Best Metrics: (0.00041115617475370557, 6.698372295532186e-05, 0.0002031465483176575)
2026-06-05 07:43:59,651 - optuna.study.study - INFO - Trial 85 finished with values: [0.00041115617475370557, 6.698372295532186e-05, 0.0002031465483176575] and parameters: {'n_layers': 2, 'embedding_dim': 256, 'lr': 6.624588925552321e-05, 'lambda_val': 0.019865073532322072, 'batch_size': 692, 'optimizer': 'RMSprop'}.
2026-06-05 07:46:57,427 - optuna.study.study - INFO - Trial 86 finished with values: [0.05969761690215652, 0.008187085538214213, 0.03401897148867903] and parameters: {'n_layers': 1, 'embedding_dim': 256, 'lr': 0.0006201349398045224, 'lambda_val': 6.977831082453278e-06, 'batch_size': 1300, 'optimizer': 'RMSprop'}.
2026-06-05 07:49:32,724 - optuna.study.study - INFO - Trial 87 finished with values: [0.02244267683057964, 0.003375979636948222, 0.012829235272350109] and parameters: {'n_layers': 2, 'embedding_dim': 64, 'lr': 0.000350216316785427, 'lambda_val': 0.00017486567415461547, 'batch_size': 1248, 'optimizer': 'Adam'}.
2026-06-05 07:52:10,092 - optuna.study.study - INFO - Trial 88 finished with values: [0.02874373972802583, 0.004357291178243687, 0.016697706300626163] and parameters: {'n_layers': 2, 'embedding_dim': 64, 'lr': 0.00036100664498869524, 'lambda_val': 0.0008919112975523749, 'batch_size': 1536, 'optimizer': 'Adam'}.
2026-06-05 07:53:30,724 - experiment_functions - INFO - Early stopping at epoch 1900. Best Metrics: (0.07990950264550765, 0.009508339473507939, 0.03981137413029371)
2026-06-05 07:53:31,072 - optuna.study.study - INFO - Trial 89 finished with values: [0.07990950264550765, 0.009508339473507939, 0.03981137413029371] and parameters: {'n_layers': 1, 'embedding_dim': 128, 'lr': 0.0023440150084551373, 'lambda_val': 0.00012250709547244776, 'batch_size': 1554, 'optimizer': 'RMSprop'}.
2026-06-05 07:53:56,055 - experiment_functions - INFO - Early stopping at epoch 500. Best Metrics: (0.0005357202729832517, 9.37772121374506e-05, 0.0002544131027542445)
2026-06-05 07:53:56,193 - optuna.study.study - INFO - Trial 90 finished with values: [0.0005357202729832517, 9.37772121374506e-05, 0.0002544131027542445] and parameters: {'n_layers': 4, 'embedding_dim': 128, 'lr': 0.0005440091810992007, 'lambda_val': 0.053935580802756795, 'batch_size': 1912, 'optimizer': 'SGD'}.
2026-06-05 07:55:01,311 - experiment_functions - INFO - Early stopping at epoch 1550. Best Metrics: (0.000538186707078306, 9.545180521133365e-05, 0.0002533294481816524)
2026-06-05 07:55:01,429 - optuna.study.study - INFO - Trial 91 finished with values: [0.000538186707078306, 9.545180521133365e-05, 0.0002533294481816524] and parameters: {'n_layers': 3, 'embedding_dim': 96, 'lr': 6.624588925552321e-05, 'lambda_val': 8.17902589782426e-05, 'batch_size': 1767, 'optimizer': 'RMSprop'}.
2026-06-05 07:55:26,342 - experiment_functions - INFO - Early stopping at epoch 550. Best Metrics: (0.011342259926817403, 0.001399959809766227, 0.005773759656060952)
2026-06-05 07:55:26,499 - optuna.study.study - INFO - Trial 92 finished with values: [0.011342259926817403, 0.001399959809766227, 0.005773759656060952] and parameters: {'n_layers': 2, 'embedding_dim': 128, 'lr': 0.010816166887355, 'lambda_val': 0.09479180593722179, 'batch_size': 1302, 'optimizer': 'RMSprop'}.
2026-06-05 07:55:56,798 - experiment_functions - INFO - Early stopping at epoch 500. Best Metrics: (0.00046297030112883833, 8.372965369415233e-05, 0.00019381775228025013)
