2026-06-07 01:24:37,759 - optuna.study.study - INFO - Trial 68 finished with values: [0.0034601270561379275, 0.0010399222988813719, 0.0021888540109406478] and parameters: {'n_layers': 3, 'embedding_dim': 96, 'lr': 0.00019178783016765463, 'lambda_val': 0.002165335135008093, 'batch_size': 2891, 'optimizer': 'Adam'}.
2026-06-07 01:25:05,359 - experiment_functions - INFO - Early stopping at epoch 650. Best Metrics: (0.0036433866258971607, 0.0009243753767834418, 0.002188461675275004)
2026-06-07 01:25:05,447 - optuna.study.study - INFO - Trial 69 finished with values: [0.0036433866258971607, 0.0009243753767834418, 0.002188461675275004] and parameters: {'n_layers': 3, 'embedding_dim': 96, 'lr': 0.0010897946373025513, 'lambda_val': 0.003413922431571512, 'batch_size': 3680, 'optimizer': 'Adam'}.
2026-06-07 01:25:42,194 - experiment_functions - INFO - Early stopping at epoch 900. Best Metrics: (0.0029847618657607056, 0.0007033290910308796, 0.0017255621245201782)
2026-06-07 01:25:42,678 - optuna.study.study - INFO - Trial 70 finished with values: [0.0029847618657607056, 0.0007033290910308796, 0.0017255621245201782] and parameters: {'n_layers': 3, 'embedding_dim': 64, 'lr': 0.00222643395785692, 'lambda_val': 0.00028607926724212617, 'batch_size': 1029, 'optimizer': 'RMSprop'}.
2026-06-07 01:26:32,744 - experiment_functions - INFO - Early stopping at epoch 1300. Best Metrics: (0.004850893774817418, 0.001404983588987876, 0.003239831939799672)
2026-06-07 01:26:32,828 - optuna.study.study - INFO - Trial 71 finished with values: [0.004850893774817418, 0.001404983588987876, 0.003239831939799672] and parameters: {'n_layers': 2, 'embedding_dim': 64, 'lr': 0.000762190113410319, 'lambda_val': 0.0007605677300524109, 'batch_size': 2179, 'optimizer': 'Adam'}.
2026-06-07 01:27:20,128 - experiment_functions - INFO - Early stopping at epoch 1200. Best Metrics: (0.003392510470515987, 0.0008557170607542367, 0.0021327548879212436)
2026-06-07 01:27:20,203 - optuna.study.study - INFO - Trial 72 finished with values: [0.003392510470515987, 0.0008557170607542367, 0.0021327548879212436] and parameters: {'n_layers': 3, 'embedding_dim': 64, 'lr': 0.00041076267416475083, 'lambda_val': 0.00032182782479893825, 'batch_size': 4054, 'optimizer': 'Adam'}.
2026-06-07 01:27:52,444 - experiment_functions - INFO - Early stopping at epoch 800. Best Metrics: (0.004018852902102826, 0.0010282001473641907, 0.0024115829306572733)
2026-06-07 01:27:52,524 - optuna.study.study - INFO - Trial 73 finished with values: [0.004018852902102826, 0.0010282001473641907, 0.0024115829306572733] and parameters: {'n_layers': 3, 'embedding_dim': 64, 'lr': 0.0011078514946922563, 'lambda_val': 1.058365552996417e-06, 'batch_size': 2883, 'optimizer': 'Adam'}.
2026-06-07 01:28:15,258 - experiment_functions - INFO - Early stopping at epoch 500. Best Metrics: (0.0005562764791742739, 7.703128139862015e-05, 0.0002457539670800245)
2026-06-07 01:28:15,348 - optuna.study.study - INFO - Trial 74 finished with values: [0.0005562764791742739, 7.703128139862015e-05, 0.0002457539670800245] and parameters: {'n_layers': 4, 'embedding_dim': 128, 'lr': 0.07934375271979709, 'lambda_val': 0.00011914359581119532, 'batch_size': 4054, 'optimizer': 'SGD'}.
2026-06-07 01:28:37,336 - experiment_functions - INFO - Early stopping at epoch 500. Best Metrics: (0.0003817350646986812, 7.703128139862015e-05, 0.0002253753645843093)
2026-06-07 01:28:38,785 - optuna.study.study - INFO - Trial 75 finished with values: [0.0003817350646986812, 7.703128139862015e-05, 0.0002253753645843093] and parameters: {'n_layers': 4, 'embedding_dim': 96, 'lr': 0.02548268482877469, 'lambda_val': 0.00011914359581119532, 'batch_size': 2652, 'optimizer': 'SGD'}.
2026-06-07 01:29:11,117 - experiment_functions - INFO - Early stopping at epoch 650. Best Metrics: (0.003936217296658059, 0.0012726907361511153, 0.0027312265184362204)
2026-06-07 01:29:11,194 - optuna.study.study - INFO - Trial 76 finished with values: [0.003936217296658059, 0.0012726907361511153, 0.0027312265184362204] and parameters: {'n_layers': 3, 'embedding_dim': 256, 'lr': 0.0011078514946922563, 'lambda_val': 0.0007117082181875168, 'batch_size': 1114, 'optimizer': 'Adam'}.
2026-06-07 01:29:43,140 - experiment_functions - INFO - Early stopping at epoch 800. Best Metrics: (0.005756010158222429, 0.0016143077232232568, 0.0038972290997403396)
2026-06-07 01:29:43,217 - optuna.study.study - INFO - Trial 77 finished with values: [0.005756010158222429, 0.0016143077232232568, 0.0038972290997403396] and parameters: {'n_layers': 2, 'embedding_dim': 64, 'lr': 0.000762190113410319, 'lambda_val': 0.00029907993070612653, 'batch_size': 2179, 'optimizer': 'Adam'}.
2026-06-07 01:30:07,530 - experiment_functions - INFO - Early stopping at epoch 550. Best Metrics: (0.0026664333151429215, 0.0007837095585772658, 0.0017199889732251866)
2026-06-07 01:30:08,456 - optuna.study.study - INFO - Trial 78 finished with values: [0.0026664333151429215, 0.0007837095585772658, 0.0017199889732251866] and parameters: {'n_layers': 4, 'embedding_dim': 96, 'lr': 0.08127511440699393, 'lambda_val': 0.00032182782479893825, 'batch_size': 4054, 'optimizer': 'Adam'}.
2026-06-07 01:30:30,063 - experiment_functions - INFO - Early stopping at epoch 500. Best Metrics: (0.0006443571801260994, 9.042802598968451e-05, 0.00029420008735788785)
2026-06-07 01:30:30,152 - optuna.study.study - INFO - Trial 79 finished with values: [0.0006443571801260994, 9.042802598968451e-05, 0.00029420008735788785] and parameters: {'n_layers': 3, 'embedding_dim': 96, 'lr': 0.001074276432881832, 'lambda_val': 1.9819161131689373e-06, 'batch_size': 1583, 'optimizer': 'SGD'}.
2026-06-07 01:30:52,850 - experiment_functions - INFO - Early stopping at epoch 500. Best Metrics: (0.002978146937213509, 0.0007384955455824236, 0.0019964903928189155)
2026-06-07 01:30:52,983 - optuna.study.study - INFO - Trial 80 finished with values: [0.002978146937213509, 0.0007384955455824236, 0.0019964903928189155] and parameters: {'n_layers': 3, 'embedding_dim': 128, 'lr': 0.03222787388169566, 'lambda_val': 0.0868747821267466, 'batch_size': 2239, 'optimizer': 'RMSprop'}.
2026-06-07 01:32:49,444 - experiment_functions - INFO - Early stopping at epoch 3000. Best Metrics: (0.004121255396259262, 0.0010583428226940855, 0.0026191348041764546)
2026-06-07 01:32:50,245 - optuna.study.study - INFO - Trial 81 finished with values: [0.004121255396259262, 0.0010583428226940855, 0.0026191348041764546] and parameters: {'n_layers': 4, 'embedding_dim': 64, 'lr': 0.00031084764364588095, 'lambda_val': 1.1883014168137366e-05, 'batch_size': 2652, 'optimizer': 'RMSprop'}.
2026-06-07 01:33:28,885 - experiment_functions - INFO - Early stopping at epoch 1000. Best Metrics: (0.00047881695086140406, 8.372965369415234e-05, 0.00020811027706558205)
2026-06-07 01:33:28,979 - optuna.study.study - INFO - Trial 82 finished with values: [0.00047881695086140406, 8.372965369415234e-05, 0.00020811027706558205] and parameters: {'n_layers': 4, 'embedding_dim': 32, 'lr': 1.0930556626230257e-05, 'lambda_val': 0.004873919280865077, 'batch_size': 2442, 'optimizer': 'Adam'}.
2026-06-07 01:34:00,032 - experiment_functions - INFO - Early stopping at epoch 800. Best Metrics: (0.0029497409613450333, 0.0006062026927456628, 0.001716054674622914)
2026-06-07 01:34:00,610 - optuna.study.study - INFO - Trial 83 finished with values: [0.0029497409613450333, 0.0006062026927456628, 0.001716054674622914] and parameters: {'n_layers': 3, 'embedding_dim': 32, 'lr': 0.00222643395785692, 'lambda_val': 0.00017376720983994695, 'batch_size': 1392, 'optimizer': 'RMSprop'}.
2026-06-07 01:34:23,759 - experiment_functions - INFO - Early stopping at epoch 550. Best Metrics: (0.0036080345341062336, 0.0009478196798178044, 0.002213881098879958)
2026-06-07 01:34:23,858 - optuna.study.study - INFO - Trial 84 finished with values: [0.0036080345341062336, 0.0009478196798178044, 0.002213881098879958] and parameters: {'n_layers': 3, 'embedding_dim': 64, 'lr': 0.0063362306152574144, 'lambda_val': 0.0007605677300524109, 'batch_size': 2891, 'optimizer': 'Adam'}.
2026-06-07 01:34:46,849 - experiment_functions - INFO - Early stopping at epoch 500. Best Metrics: (0.003949008048102458, 0.00112700113872329, 0.0029513894801280766)
2026-06-07 01:34:46,936 - optuna.study.study - INFO - Trial 85 finished with values: [0.003949008048102458, 0.00112700113872329, 0.0029513894801280766] and parameters: {'n_layers': 4, 'embedding_dim': 128, 'lr': 0.021653186861251617, 'lambda_val': 0.038960501758543035, 'batch_size': 1452, 'optimizer': 'RMSprop'}.
2026-06-07 01:35:08,120 - experiment_functions - INFO - Early stopping at epoch 500. Best Metrics: (0.00034783591897764415, 5.861075758590662e-05, 0.00018450338333623675)
2026-06-07 01:35:08,377 - optuna.study.study - INFO - Trial 86 finished with values: [0.00034783591897764415, 5.861075758590662e-05, 0.00018450338333623675] and parameters: {'n_layers': 4, 'embedding_dim': 64, 'lr': 0.0011078514946922563, 'lambda_val': 0.0016444864941473913, 'batch_size': 2883, 'optimizer': 'SGD'}.
2026-06-07 01:37:38,480 - optuna.study.study - INFO - Trial 87 finished with values: [0.0011292566375581579, 0.0002763078571907027, 0.0006439799229088223] and parameters: {'n_layers': 1, 'embedding_dim': 128, 'lr': 0.00010465532100552729, 'lambda_val': 2.747257525586621e-06, 'batch_size': 1919, 'optimizer': 'RMSprop'}.
2026-06-07 01:37:58,417 - experiment_functions - INFO - Early stopping at epoch 500. Best Metrics: (0.0005179008679856629, 6.698372295532186e-05, 0.00020385272078983716)
2026-06-07 01:37:58,893 - optuna.study.study - INFO - Trial 88 finished with values: [0.0005179008679856629, 6.698372295532186e-05, 0.00020385272078983716] and parameters: {'n_layers': 2, 'embedding_dim': 32, 'lr': 0.025057340678512768, 'lambda_val': 0.08295526263282023, 'batch_size': 1528, 'optimizer': 'SGD'}.
2026-06-07 01:40:24,280 - optuna.study.study - INFO - Trial 89 finished with values: [0.0013322415208060748, 0.00030477593944671445, 0.0007564978670861839] and parameters: {'n_layers': 3, 'embedding_dim': 32, 'lr': 0.00010216935156308171, 'lambda_val': 0.0054314837121898114, 'batch_size': 3431, 'optimizer': 'RMSprop'}.
2026-06-07 01:41:34,416 - experiment_functions - INFO - Early stopping at epoch 1900. Best Metrics: (0.00786767084848941, 0.0024599772255341954, 0.005502923742206692)
2026-06-07 01:41:34,515 - optuna.study.study - INFO - Trial 90 finished with values: [0.00786767084848941, 0.0024599772255341954, 0.005502923742206692] and parameters: {'n_layers': 1, 'embedding_dim': 32, 'lr': 0.0011078514946922563, 'lambda_val': 1.058365552996417e-06, 'batch_size': 2883, 'optimizer': 'Adam'}.
2026-06-07 01:42:03,373 - experiment_functions - INFO - Early stopping at epoch 700. Best Metrics: (0.002137264267207917, 0.0004873065844999665, 0.0012497090953006594)
2026-06-07 01:42:03,464 - optuna.study.study - INFO - Trial 91 finished with values: [0.002137264267207917, 0.0004873065844999665, 0.0012497090953006594] and parameters: {'n_layers': 4, 'embedding_dim': 64, 'lr': 0.0011078514946922563, 'lambda_val': 0.007828368357506445, 'batch_size': 2883, 'optimizer': 'Adam'}.
2026-06-07 01:42:30,201 - experiment_functions - INFO - Early stopping at epoch 500. Best Metrics: (0.001362227166059676, 0.00033826780092437544, 0.0009123199560188978)
2026-06-07 01:42:30,305 - optuna.study.study - INFO - Trial 92 finished with values: [0.001362227166059676, 0.00033826780092437544, 0.0009123199560188978] and parameters: {'n_layers': 4, 'embedding_dim': 256, 'lr': 0.0067730772476627945, 'lambda_val': 0.004919335424382364, 'batch_size': 3491, 'optimizer': 'RMSprop'}.
2026-06-07 01:45:12,167 - optuna.study.study - INFO - Trial 93 finished with values: [0.0014158419025720136, 0.0004990287360171479, 0.0010454327574714998] and parameters: {'n_layers': 1, 'embedding_dim': 256, 'lr': 0.00010465532100552729, 'lambda_val': 2.747257525586621e-06, 'batch_size': 2172, 'optimizer': 'RMSprop'}.
2026-06-07 01:45:34,216 - experiment_functions - INFO - Early stopping at epoch 550. Best Metrics: (0.0022929953087755233, 0.0007234242079174761, 0.0015012882824161316)
2026-06-07 01:45:34,289 - optuna.study.study - INFO - Trial 94 finished with values: [0.0022929953087755233, 0.0007234242079174761, 0.0015012882824161316] and parameters: {'n_layers': 3, 'embedding_dim': 32, 'lr': 0.038293069654092404, 'lambda_val': 0.00011034066715781793, 'batch_size': 3414, 'optimizer': 'RMSprop'}.
2026-06-07 01:45:54,807 - experiment_functions - INFO - Early stopping at epoch 500. Best Metrics: (0.00041416769510230764, 6.530912988143882e-05, 0.00020161701695709154)
2026-06-07 01:45:55,271 - optuna.study.study - INFO - Trial 95 finished with values: [0.00041416769510230764, 6.530912988143882e-05, 0.00020161701695709154] and parameters: {'n_layers': 1, 'embedding_dim': 64, 'lr': 0.0002629749436499667, 'lambda_val': 0.04959099122321664, 'batch_size': 3158, 'optimizer': 'Adam'}.
2026-06-07 01:46:28,754 - experiment_functions - INFO - Early stopping at epoch 750. Best Metrics: (0.0029706561734309154, 0.0008841851430102486, 0.00185605218885847)
2026-06-07 01:46:29,505 - optuna.study.study - INFO - Trial 96 finished with values: [0.0029706561734309154, 0.0008841851430102486, 0.00185605218885847] and parameters: {'n_layers': 4, 'embedding_dim': 128, 'lr': 0.006267253881614865, 'lambda_val': 5.747599187815172e-06, 'batch_size': 2739, 'optimizer': 'RMSprop'}.
2026-06-07 01:47:27,530 - experiment_functions - INFO - Early stopping at epoch 1450. Best Metrics: (0.003323773683777244, 0.0010449460781030212, 0.002178416254886825)
2026-06-07 01:47:27,616 - optuna.study.study - INFO - Trial 97 finished with values: [0.003323773683777244, 0.0010449460781030212, 0.002178416254886825] and parameters: {'n_layers': 3, 'embedding_dim': 96, 'lr': 0.00023240333325049055, 'lambda_val': 0.0054314837121898114, 'batch_size': 1114, 'optimizer': 'RMSprop'}.
2026-06-07 01:48:15,287 - experiment_functions - INFO - Early stopping at epoch 1200. Best Metrics: (0.003222641731304406, 0.0007451939178779557, 0.0020532662554761483)
2026-06-07 01:48:15,396 - optuna.study.study - INFO - Trial 98 finished with values: [0.003222641731304406, 0.0007451939178779557, 0.0020532662554761483] and parameters: {'n_layers': 4, 'embedding_dim': 64, 'lr': 0.0009136590553729405, 'lambda_val': 6.538231837458372e-06, 'batch_size': 1735, 'optimizer': 'Adam'}.
2026-06-07 01:48:42,456 - experiment_functions - INFO - Early stopping at epoch 650. Best Metrics: (0.002754710170530308, 0.0006078772858195459, 0.001636710663946691)
2026-06-07 01:48:42,564 - optuna.study.study - INFO - Trial 99 finished with values: [0.002754710170530308, 0.0006078772858195459, 0.001636710663946691] and parameters: {'n_layers': 4, 'embedding_dim': 64, 'lr': 0.0013711723145044142, 'lambda_val': 0.00044695073779346396, 'batch_size': 3294, 'optimizer': 'Adam'}.
2026-06-07 01:51:07,277 - optuna.study.study - INFO - Trial 100 finished with values: [0.007336504766110903, 0.0021987407060084403, 0.004988324881549762] and parameters: {'n_layers': 1, 'embedding_dim': 32, 'lr': 0.000762190113410319, 'lambda_val': 3.222265315337744e-05, 'batch_size': 3302, 'optimizer': 'Adam'}.
2026-06-07 01:52:48,475 - experiment_functions - INFO - Early stopping at epoch 2500. Best Metrics: (0.0032366367372964897, 0.0010114542166253602, 0.0020238315066326185)
2026-06-07 01:52:48,581 - optuna.study.study - INFO - Trial 101 finished with values: [0.0032366367372964897, 0.0010114542166253602, 0.0020238315066326185] and parameters: {'n_layers': 4, 'embedding_dim': 96, 'lr': 0.006267253881614865, 'lambda_val': 5.747599187815172e-06, 'batch_size': 2739, 'optimizer': 'RMSprop'}.
2026-06-07 01:53:24,025 - experiment_functions - INFO - Early stopping at epoch 900. Best Metrics: (0.005787263943521895, 0.0016796168531046955, 0.0036487920778858684)
2026-06-07 01:53:24,734 - optuna.study.study - INFO - Trial 102 finished with values: [0.005787263943521895, 0.0016796168531046955, 0.0036487920778858684] and parameters: {'n_layers': 2, 'embedding_dim': 64, 'lr': 0.000762190113410319, 'lambda_val': 0.00029907993070612653, 'batch_size': 2179, 'optimizer': 'Adam'}.
2026-06-07 01:54:09,116 - experiment_functions - INFO - Early stopping at epoch 1150. Best Metrics: (0.00870917662377726, 0.002707817000468886, 0.006036766064140292)
2026-06-07 01:54:09,483 - optuna.study.study - INFO - Trial 103 finished with values: [0.00870917662377726, 0.002707817000468886, 0.006036766064140292] and parameters: {'n_layers': 1, 'embedding_dim': 64, 'lr': 0.0011078514946922563, 'lambda_val': 0.0007605677300524109, 'batch_size': 2179, 'optimizer': 'Adam'}.
2026-06-07 01:54:47,690 - experiment_functions - INFO - Early stopping at epoch 1000. Best Metrics: (0.0076876470745853055, 0.0022740973943331773, 0.005153761074150006)
2026-06-07 01:54:47,786 - optuna.study.study - INFO - Trial 104 finished with values: [0.0076876470745853055, 0.0022740973943331773, 0.005153761074150006] and parameters: {'n_layers': 1, 'embedding_dim': 32, 'lr': 0.0011078514946922563, 'lambda_val': 1.058365552996417e-06, 'batch_size': 3163, 'optimizer': 'Adam'}.
2026-06-07 01:56:49,500 - experiment_functions - INFO - Early stopping at epoch 3250. Best Metrics: (0.0031444349779999386, 0.000977962355147699, 0.002174936024158038)
2026-06-07 01:56:49,657 - optuna.study.study - INFO - Trial 105 finished with values: [0.0031444349779999386, 0.000977962355147699, 0.002174936024158038] and parameters: {'n_layers': 2, 'embedding_dim': 64, 'lr': 0.03222787388169566, 'lambda_val': 0.00011914359581119532, 'batch_size': 2652, 'optimizer': 'RMSprop'}.
2026-06-07 01:58:22,640 - experiment_functions - INFO - Early stopping at epoch 2250. Best Metrics: (0.005562591211865469, 0.0015389510348985196, 0.003693552659255438)
2026-06-07 01:58:22,741 - optuna.study.study - INFO - Trial 106 finished with values: [0.005562591211865469, 0.0015389510348985196, 0.003693552659255438] and parameters: {'n_layers': 3, 'embedding_dim': 128, 'lr': 0.00031084764364588095, 'lambda_val': 1.0939005541756068e-06, 'batch_size': 2652, 'optimizer': 'RMSprop'}.
2026-06-07 01:58:46,062 - experiment_functions - INFO - Early stopping at epoch 550. Best Metrics: (0.005028065740408503, 0.001657847143144216, 0.003403909618748973)
2026-06-07 01:58:46,151 - optuna.study.study - INFO - Trial 107 finished with values: [0.005028065740408503, 0.001657847143144216, 0.003403909618748973] and parameters: {'n_layers': 2, 'embedding_dim': 96, 'lr': 0.0063362306152574144, 'lambda_val': 0.0007605677300524109, 'batch_size': 2896, 'optimizer': 'Adam'}.
2026-06-07 01:59:07,403 - experiment_functions - INFO - Early stopping at epoch 500. Best Metrics: (0.0032572447660571264, 0.0008691138053453012, 0.0021288710473596427)
2026-06-07 01:59:08,416 - optuna.study.study - INFO - Trial 108 finished with values: [0.0032572447660571264, 0.0008691138053453012, 0.0021288710473596427] and parameters: {'n_layers': 2, 'embedding_dim': 96, 'lr': 0.027383272358148473, 'lambda_val': 0.00044849490190016335, 'batch_size': 536, 'optimizer': 'RMSprop'}.
2026-06-07 01:59:33,641 - experiment_functions - INFO - Early stopping at epoch 550. Best Metrics: (0.009032305431496288, 0.0031046955589791687, 0.0066399078742179225)
2026-06-07 01:59:34,081 - optuna.study.study - INFO - Trial 109 finished with values: [0.009032305431496288, 0.0031046955589791687, 0.0066399078742179225] and parameters: {'n_layers': 1, 'embedding_dim': 256, 'lr': 0.005424684195660662, 'lambda_val': 0.003413922431571512, 'batch_size': 4046, 'optimizer': 'Adam'}.
2026-06-07 01:59:55,077 - experiment_functions - INFO - Early stopping at epoch 500. Best Metrics: (0.0016630569097109988, 0.00038515640699310073, 0.00112416020307896)
2026-06-07 01:59:55,539 - optuna.study.study - INFO - Trial 110 finished with values: [0.0016630569097109988, 0.00038515640699310073, 0.00112416020307896] and parameters: {'n_layers': 3, 'embedding_dim': 64, 'lr': 0.021653186861251617, 'lambda_val': 0.038960501758543035, 'batch_size': 3414, 'optimizer': 'RMSprop'}.
2026-06-07 02:00:29,932 - experiment_functions - INFO - Early stopping at epoch 800. Best Metrics: (0.0030194160960800354, 0.0006782101949226338, 0.0017319717388636626)
2026-06-07 02:00:30,907 - optuna.study.study - INFO - Trial 111 finished with values: [0.0030194160960800354, 0.0006782101949226338, 0.0017319717388636626] and parameters: {'n_layers': 4, 'embedding_dim': 96, 'lr': 0.0009136590553729405, 'lambda_val': 6.538231837458372e-06, 'batch_size': 2652, 'optimizer': 'Adam'}.
2026-06-07 02:03:36,165 - experiment_functions - INFO - Early stopping at epoch 3950. Best Metrics: (0.004658992423357729, 0.001366467948288566, 0.002986891165201573)
2026-06-07 02:03:36,260 - optuna.study.study - INFO - Trial 112 finished with values: [0.004658992423357729, 0.001366467948288566, 0.002986891165201573] and parameters: {'n_layers': 3, 'embedding_dim': 256, 'lr': 0.00019178783016765463, 'lambda_val': 3.491863285065632e-06, 'batch_size': 3510, 'optimizer': 'Adam'}.
2026-06-07 02:04:06,639 - experiment_functions - INFO - Early stopping at epoch 600. Best Metrics: (0.004551724530539572, 0.0013647933552146828, 0.003105868120179705)
2026-06-07 02:04:08,182 - optuna.study.study - INFO - Trial 113 finished with values: [0.004551724530539572, 0.0013647933552146828, 0.003105868120179705] and parameters: {'n_layers': 3, 'embedding_dim': 256, 'lr': 0.0013711723145044142, 'lambda_val': 1.4748392203086364e-06, 'batch_size': 3294, 'optimizer': 'Adam'}.
2026-06-07 02:04:31,107 - experiment_functions - INFO - Early stopping at epoch 550. Best Metrics: (0.0035142581124747684, 0.000892558108379664, 0.0019985826444417075)
