2026-06-03 09:43:24,325 - optuna.study.study - INFO - Trial 254 finished with values: [0.07982437884397288, 0.009299015339272555, 0.039507923426110064] and parameters: {'n_layers': 1, 'embedding_dim': 256, 'lr': 0.0026263356328818884, 'lambda_val': 3.621633479201664e-06, 'batch_size': 1104, 'optimizer': 'RMSprop'}.
2026-06-03 09:44:19,032 - experiment_functions - INFO - Early stopping at epoch 1200. Best Metrics: (0.07396404923868251, 0.009314086676937505, 0.03915467822654537)
2026-06-03 09:44:20,275 - optuna.study.study - INFO - Trial 255 finished with values: [0.07396404923868251, 0.009314086676937505, 0.03915467822654537] and parameters: {'n_layers': 2, 'embedding_dim': 96, 'lr': 0.0009463388507176841, 'lambda_val': 0.0012209141543013233, 'batch_size': 2234, 'optimizer': 'Adam'}.
2026-06-03 09:45:31,304 - experiment_functions - INFO - Early stopping at epoch 1700. Best Metrics: (0.10614718474600139, 0.013041730859401166, 0.05804615074556842)
2026-06-03 09:45:31,401 - optuna.study.study - INFO - Trial 256 finished with values: [0.10614718474600139, 0.013041730859401166, 0.05804615074556842] and parameters: {'n_layers': 1, 'embedding_dim': 64, 'lr': 0.0017600601147055445, 'lambda_val': 4.7992887649321705e-05, 'batch_size': 2273, 'optimizer': 'Adam'}.
2026-06-03 09:46:26,278 - experiment_functions - INFO - Early stopping at epoch 1400. Best Metrics: (0.0004659584443733481, 7.870587447250318e-05, 0.00024720965490963794)
2026-06-03 09:46:26,373 - optuna.study.study - INFO - Trial 257 finished with values: [0.0004659584443733481, 7.870587447250318e-05, 0.00024720965490963794] and parameters: {'n_layers': 1, 'embedding_dim': 64, 'lr': 0.0001327230429689748, 'lambda_val': 0.00015385577228629684, 'batch_size': 1441, 'optimizer': 'Adam'}.
2026-06-03 09:47:28,417 - experiment_functions - INFO - Early stopping at epoch 1100. Best Metrics: (0.0756859745260264, 0.009350927724562932, 0.04002538320258842)
2026-06-03 09:47:28,520 - optuna.study.study - INFO - Trial 258 finished with values: [0.0756859745260264, 0.009350927724562932, 0.04002538320258842] and parameters: {'n_layers': 2, 'embedding_dim': 256, 'lr': 0.0007931132107821007, 'lambda_val': 0.0006353517335696762, 'batch_size': 2315, 'optimizer': 'RMSprop'}.
2026-06-03 09:47:53,504 - experiment_functions - INFO - Early stopping at epoch 600. Best Metrics: (0.0005022682645723372, 7.703128139862013e-05, 0.00023329296561976662)
2026-06-03 09:47:54,621 - optuna.study.study - INFO - Trial 259 finished with values: [0.0005022682645723372, 7.703128139862013e-05, 0.00023329296561976662] and parameters: {'n_layers': 1, 'embedding_dim': 64, 'lr': 1.1479391924348242e-05, 'lambda_val': 0.01018555780897122, 'batch_size': 1346, 'optimizer': 'Adam'}.
2026-06-03 09:50:39,237 - optuna.study.study - INFO - Trial 260 finished with values: [0.10554482034513701, 0.013113738361578135, 0.05882994810628105] and parameters: {'n_layers': 1, 'embedding_dim': 64, 'lr': 0.0017600601147055445, 'lambda_val': 2.814272130048345e-06, 'batch_size': 1346, 'optimizer': 'Adam'}.
2026-06-03 09:53:05,615 - experiment_functions - INFO - Early stopping at epoch 3400. Best Metrics: (0.03693309784346234, 0.004457766762676669, 0.01716838566704653)
2026-06-03 09:53:05,703 - optuna.study.study - INFO - Trial 261 finished with values: [0.03693309784346234, 0.004457766762676669, 0.01716838566704653] and parameters: {'n_layers': 3, 'embedding_dim': 64, 'lr': 0.0017600601147055445, 'lambda_val': 0.00031016945451823507, 'batch_size': 1802, 'optimizer': 'RMSprop'}.
2026-06-03 09:55:49,248 - optuna.study.study - INFO - Trial 262 finished with values: [0.09924163765238848, 0.012706812244624555, 0.054836391899867665] and parameters: {'n_layers': 1, 'embedding_dim': 64, 'lr': 0.0009463388507176841, 'lambda_val': 0.0012209141543013233, 'batch_size': 2464, 'optimizer': 'Adam'}.
2026-06-03 09:56:52,327 - experiment_functions - INFO - Early stopping at epoch 1250. Best Metrics: (0.047396393281516146, 0.00589791680621609, 0.0228863144402814)
2026-06-03 09:56:52,429 - optuna.study.study - INFO - Trial 263 finished with values: [0.047396393281516146, 0.00589791680621609, 0.0228863144402814] and parameters: {'n_layers': 4, 'embedding_dim': 96, 'lr': 0.0009463388507176841, 'lambda_val': 0.00031016945451823507, 'batch_size': 1702, 'optimizer': 'Adam'}.
2026-06-03 10:01:23,007 - optuna.study.study - INFO - Trial 264 finished with values: [0.036538164712189666, 0.004158014602451604, 0.016358295497158278] and parameters: {'n_layers': 4, 'embedding_dim': 256, 'lr': 0.0026263356328818884, 'lambda_val': 1.6263951880298748e-05, 'batch_size': 2234, 'optimizer': 'Adam'}.
2026-06-03 10:02:52,242 - experiment_functions - INFO - Early stopping at epoch 1800. Best Metrics: (0.11020957896627712, 0.0133347846473307, 0.06007684701757052)
2026-06-03 10:02:52,371 - optuna.study.study - INFO - Trial 265 finished with values: [0.11020957896627712, 0.0133347846473307, 0.06007684701757052] and parameters: {'n_layers': 1, 'embedding_dim': 256, 'lr': 0.0017600601147055445, 'lambda_val': 7.608004402487057e-06, 'batch_size': 2234, 'optimizer': 'Adam'}.
2026-06-03 10:05:37,827 - optuna.study.study - INFO - Trial 266 finished with values: [0.07784872988556944, 0.010544912586241545, 0.045976719572101726] and parameters: {'n_layers': 1, 'embedding_dim': 96, 'lr': 0.0007931132107821007, 'lambda_val': 0.00031016945451823507, 'batch_size': 1441, 'optimizer': 'Adam'}.
2026-06-03 10:06:23,618 - experiment_functions - INFO - Early stopping at epoch 900. Best Metrics: (0.10186427544750253, 0.012512559448054126, 0.05560724825133705)
2026-06-03 10:06:23,710 - optuna.study.study - INFO - Trial 267 finished with values: [0.10186427544750253, 0.012512559448054126, 0.05560724825133705] and parameters: {'n_layers': 1, 'embedding_dim': 256, 'lr': 0.0026263356328818884, 'lambda_val': 0.0002814016114171031, 'batch_size': 2273, 'optimizer': 'Adam'}.
2026-06-03 10:06:55,779 - experiment_functions - INFO - Early stopping at epoch 700. Best Metrics: (0.036003605284100196, 0.004328823095987675, 0.016352929574083686)
2026-06-03 10:06:56,533 - optuna.study.study - INFO - Trial 268 finished with values: [0.036003605284100196, 0.004328823095987675, 0.016352929574083686] and parameters: {'n_layers': 3, 'embedding_dim': 64, 'lr': 0.0026263356328818884, 'lambda_val': 0.0014369013630720255, 'batch_size': 1966, 'optimizer': 'Adam'}.
2026-06-03 10:09:44,952 - optuna.study.study - INFO - Trial 269 finished with values: [0.09823335488422166, 0.01258289235715721, 0.05612360361352481] and parameters: {'n_layers': 1, 'embedding_dim': 96, 'lr': 0.0007931132107821007, 'lambda_val': 0.0006353517335696762, 'batch_size': 2234, 'optimizer': 'RMSprop'}.
2026-06-03 10:10:18,532 - experiment_functions - INFO - Early stopping at epoch 750. Best Metrics: (0.08789932304563504, 0.01104394132225869, 0.04699186673060055)
2026-06-03 10:10:18,645 - optuna.study.study - INFO - Trial 270 finished with values: [0.08789932304563504, 0.01104394132225869, 0.04699186673060055] and parameters: {'n_layers': 1, 'embedding_dim': 96, 'lr': 0.004311872557114808, 'lambda_val': 2.8807178813664366e-05, 'batch_size': 2273, 'optimizer': 'Adam'}.
2026-06-03 10:13:00,175 - optuna.study.study - INFO - Trial 271 finished with values: [0.08059933663462135, 0.010069328153258759, 0.04482055378995141] and parameters: {'n_layers': 2, 'embedding_dim': 32, 'lr': 0.0007931132107821007, 'lambda_val': 7.608004402487057e-06, 'batch_size': 2035, 'optimizer': 'Adam'}.
2026-06-03 10:15:29,664 - experiment_functions - INFO - Early stopping at epoch 3650. Best Metrics: (0.0915904692466682, 0.011447518253064505, 0.04883723615841282)
2026-06-03 10:15:29,759 - optuna.study.study - INFO - Trial 272 finished with values: [0.0915904692466682, 0.011447518253064505, 0.04883723615841282] and parameters: {'n_layers': 1, 'embedding_dim': 64, 'lr': 0.0026263356328818884, 'lambda_val': 0.00015385577228629684, 'batch_size': 643, 'optimizer': 'Adam'}.
2026-06-03 10:16:26,106 - experiment_functions - INFO - Early stopping at epoch 1300. Best Metrics: (0.07344069729454664, 0.009151651148770848, 0.03893008703785327)
2026-06-03 10:16:26,460 - optuna.study.study - INFO - Trial 273 finished with values: [0.07344069729454664, 0.009151651148770848, 0.03893008703785327] and parameters: {'n_layers': 2, 'embedding_dim': 64, 'lr': 0.0009344685265310301, 'lambda_val': 0.0014369013630720255, 'batch_size': 2273, 'optimizer': 'Adam'}.
2026-06-03 10:16:50,406 - experiment_functions - INFO - Early stopping at epoch 550. Best Metrics: (0.02555347297682351, 0.0033659320785049238, 0.012500124997627685)
2026-06-03 10:16:50,500 - optuna.study.study - INFO - Trial 274 finished with values: [0.02555347297682351, 0.0033659320785049238, 0.012500124997627685] and parameters: {'n_layers': 1, 'embedding_dim': 96, 'lr': 0.05788317030521258, 'lambda_val': 0.0006353517335696762, 'batch_size': 914, 'optimizer': 'Adam'}.
2026-06-03 10:19:44,010 - optuna.study.study - INFO - Trial 275 finished with values: [0.0974365275613958, 0.012574519391787798, 0.05397488739616361] and parameters: {'n_layers': 1, 'embedding_dim': 128, 'lr': 0.0006271642154522829, 'lambda_val': 0.000868123514447947, 'batch_size': 3350, 'optimizer': 'Adam'}.
2026-06-03 10:22:59,690 - optuna.study.study - INFO - Trial 276 finished with values: [0.10780606258871561, 0.013574251456895975, 0.05897622707818877] and parameters: {'n_layers': 1, 'embedding_dim': 256, 'lr': 0.0006271642154522829, 'lambda_val': 0.000868123514447947, 'batch_size': 4079, 'optimizer': 'Adam'}.
2026-06-03 10:25:50,691 - optuna.study.study - INFO - Trial 277 finished with values: [0.07431473861593223, 0.008527027932212473, 0.03590016084633307] and parameters: {'n_layers': 1, 'embedding_dim': 128, 'lr': 0.004311872557114808, 'lambda_val': 2.8807178813664366e-05, 'batch_size': 2273, 'optimizer': 'RMSprop'}.
2026-06-03 10:26:11,682 - experiment_functions - INFO - Early stopping at epoch 500. Best Metrics: (0.0006159511287362198, 7.870587447250318e-05, 0.00026484714242693545)
2026-06-03 10:26:11,983 - optuna.study.study - INFO - Trial 278 finished with values: [0.0006159511287362198, 7.870587447250318e-05, 0.00026484714242693545] and parameters: {'n_layers': 1, 'embedding_dim': 64, 'lr': 0.0020694076192798723, 'lambda_val': 0.00023256258118718116, 'batch_size': 600, 'optimizer': 'SGD'}.
2026-06-03 10:26:48,202 - experiment_functions - INFO - Early stopping at epoch 900. Best Metrics: (0.000294139032245781, 5.526157143814053e-05, 0.00016429192601758838)
2026-06-03 10:26:48,291 - optuna.study.study - INFO - Trial 279 finished with values: [0.000294139032245781, 5.526157143814053e-05, 0.00016429192601758838] and parameters: {'n_layers': 1, 'embedding_dim': 64, 'lr': 1.0396148424372758e-05, 'lambda_val': 2.8807178813664366e-05, 'batch_size': 2273, 'optimizer': 'Adam'}.
2026-06-03 10:27:21,426 - experiment_functions - INFO - Early stopping at epoch 700. Best Metrics: (0.06903746302723984, 0.008697836425748543, 0.03650552493425442)
2026-06-03 10:27:21,507 - optuna.study.study - INFO - Trial 280 finished with values: [0.06903746302723984, 0.008697836425748543, 0.03650552493425442] and parameters: {'n_layers': 2, 'embedding_dim': 96, 'lr': 0.0026263356328818884, 'lambda_val': 0.00031016945451823507, 'batch_size': 2448, 'optimizer': 'Adam'}.
2026-06-03 10:27:42,645 - experiment_functions - INFO - Early stopping at epoch 500. Best Metrics: (0.0005484617995548585, 8.707883984191843e-05, 0.00026921632797564194)
2026-06-03 10:27:42,987 - optuna.study.study - INFO - Trial 281 finished with values: [0.0005484617995548585, 8.707883984191843e-05, 0.00026921632797564194] and parameters: {'n_layers': 1, 'embedding_dim': 64, 'lr': 0.024396281542178568, 'lambda_val': 2.8807178813664366e-05, 'batch_size': 2273, 'optimizer': 'SGD'}.
2026-06-03 10:30:31,351 - optuna.study.study - INFO - Trial 282 finished with values: [0.09614604998041057, 0.012402036305177843, 0.053691277285911436] and parameters: {'n_layers': 1, 'embedding_dim': 96, 'lr': 0.0006271642154522829, 'lambda_val': 0.00031016945451823507, 'batch_size': 4079, 'optimizer': 'Adam'}.
2026-06-03 10:31:22,255 - experiment_functions - INFO - Early stopping at epoch 1150. Best Metrics: (0.02156012577459649, 0.0027195391519860674, 0.009605108854801623)
2026-06-03 10:31:22,375 - optuna.study.study - INFO - Trial 283 finished with values: [0.02156012577459649, 0.0027195391519860674, 0.009605108854801623] and parameters: {'n_layers': 2, 'embedding_dim': 96, 'lr': 0.0009463388507176841, 'lambda_val': 0.05389803735454495, 'batch_size': 2234, 'optimizer': 'Adam'}.
2026-06-03 10:33:24,101 - experiment_functions - INFO - Early stopping at epoch 3000. Best Metrics: (0.07792653020169128, 0.009583696161832673, 0.04034676463927917)
2026-06-03 10:33:24,185 - optuna.study.study - INFO - Trial 284 finished with values: [0.07792653020169128, 0.009583696161832673, 0.04034676463927917] and parameters: {'n_layers': 2, 'embedding_dim': 32, 'lr': 0.0009567600418419374, 'lambda_val': 0.00031016945451823507, 'batch_size': 2448, 'optimizer': 'Adam'}.
2026-06-03 10:36:17,414 - optuna.study.study - INFO - Trial 285 finished with values: [0.08915013043516139, 0.01171880233103356, 0.050245124629573666] and parameters: {'n_layers': 1, 'embedding_dim': 128, 'lr': 0.0006271642154522829, 'lambda_val': 0.000868123514447947, 'batch_size': 2683, 'optimizer': 'Adam'}.
2026-06-03 10:36:42,432 - experiment_functions - INFO - Early stopping at epoch 600. Best Metrics: (0.0005228623702143461, 6.865831602920491e-05, 0.00022569207005786838)
2026-06-03 10:36:42,544 - optuna.study.study - INFO - Trial 286 finished with values: [0.0005228623702143461, 6.865831602920491e-05, 0.00022569207005786838] and parameters: {'n_layers': 1, 'embedding_dim': 64, 'lr': 4.632305691177878e-05, 'lambda_val': 7.608004402487057e-06, 'batch_size': 600, 'optimizer': 'Adam'}.
2026-06-03 10:39:25,157 - optuna.study.study - INFO - Trial 287 finished with values: [0.09372792514026458, 0.012033625828923573, 0.053750035049456565] and parameters: {'n_layers': 1, 'embedding_dim': 64, 'lr': 0.0009463388507176841, 'lambda_val': 6.624143397965627e-05, 'batch_size': 1769, 'optimizer': 'Adam'}.
2026-06-03 10:42:38,410 - optuna.study.study - INFO - Trial 288 finished with values: [0.09713413642712561, 0.012678344162368547, 0.05598524694511151] and parameters: {'n_layers': 1, 'embedding_dim': 256, 'lr': 0.0007931132107821007, 'lambda_val': 6.140274743146612e-05, 'batch_size': 1441, 'optimizer': 'Adam'}.
2026-06-03 10:45:51,198 - optuna.study.study - INFO - Trial 289 finished with values: [0.10205795253703112, 0.013008238997923506, 0.058363470327826454] and parameters: {'n_layers': 1, 'embedding_dim': 256, 'lr': 0.0006137073018441479, 'lambda_val': 6.140274743146612e-05, 'batch_size': 2234, 'optimizer': 'RMSprop'}.
2026-06-03 10:46:24,042 - experiment_functions - INFO - Early stopping at epoch 700. Best Metrics: (0.056491113436879535, 0.006855784044477193, 0.02706535471882475)
2026-06-03 10:46:24,127 - optuna.study.study - INFO - Trial 290 finished with values: [0.056491113436879535, 0.006855784044477193, 0.02706535471882475] and parameters: {'n_layers': 2, 'embedding_dim': 96, 'lr': 0.003547716578185067, 'lambda_val': 6.624143397965627e-05, 'batch_size': 2234, 'optimizer': 'Adam'}.
2026-06-03 10:47:27,954 - experiment_functions - INFO - Early stopping at epoch 1500. Best Metrics: (0.038297704898112746, 0.005082389979235047, 0.019670701528667737)
2026-06-03 10:47:28,055 - optuna.study.study - INFO - Trial 291 finished with values: [0.038297704898112746, 0.005082389979235047, 0.019670701528667737] and parameters: {'n_layers': 1, 'embedding_dim': 128, 'lr': 0.0010353219839207425, 'lambda_val': 0.04972131100039007, 'batch_size': 2273, 'optimizer': 'Adam'}.
2026-06-03 10:48:24,772 - experiment_functions - INFO - Early stopping at epoch 1350. Best Metrics: (0.09494790353305554, 0.011769040123250049, 0.05141725471276611)
2026-06-03 10:48:24,872 - optuna.study.study - INFO - Trial 292 finished with values: [0.09494790353305554, 0.011769040123250049, 0.05141725471276611] and parameters: {'n_layers': 1, 'embedding_dim': 64, 'lr': 0.0026263356328818884, 'lambda_val': 0.00031016945451823507, 'batch_size': 1346, 'optimizer': 'Adam'}.
2026-06-03 10:48:45,877 - experiment_functions - INFO - Early stopping at epoch 500. Best Metrics: (0.0005248157506057544, 7.368209525085404e-05, 0.00023628856980703548)
2026-06-03 10:48:46,722 - optuna.study.study - INFO - Trial 293 finished with values: [0.0005248157506057544, 7.368209525085404e-05, 0.00023628856980703548] and parameters: {'n_layers': 1, 'embedding_dim': 64, 'lr': 0.0006271642154522829, 'lambda_val': 6.624143397965627e-05, 'batch_size': 1769, 'optimizer': 'SGD'}.
2026-06-03 10:50:06,022 - experiment_functions - INFO - Early stopping at epoch 1850. Best Metrics: (0.09988173854403241, 0.012385290374439011, 0.05509827765349076)
2026-06-03 10:50:06,935 - optuna.study.study - INFO - Trial 294 finished with values: [0.09988173854403241, 0.012385290374439011, 0.05509827765349076] and parameters: {'n_layers': 1, 'embedding_dim': 96, 'lr': 0.0020297156192103016, 'lambda_val': 0.00031016945451823507, 'batch_size': 1346, 'optimizer': 'Adam'}.
2026-06-03 10:52:47,992 - optuna.study.study - INFO - Trial 295 finished with values: [0.0810559629175322, 0.010831268001875545, 0.04763997862226418] and parameters: {'n_layers': 1, 'embedding_dim': 64, 'lr': 0.0009463388507176841, 'lambda_val': 1.154658470483179e-05, 'batch_size': 1346, 'optimizer': 'Adam'}.
2026-06-03 10:53:09,033 - experiment_functions - INFO - Early stopping at epoch 500. Best Metrics: (0.0005461209810058345, 7.368209525085404e-05, 0.00024707223572127316)
2026-06-03 10:53:09,350 - optuna.study.study - INFO - Trial 296 finished with values: [0.0005461209810058345, 7.368209525085404e-05, 0.00024707223572127316] and parameters: {'n_layers': 1, 'embedding_dim': 64, 'lr': 0.0026263356328818884, 'lambda_val': 1.6263951880298748e-05, 'batch_size': 676, 'optimizer': 'SGD'}.
2026-06-03 10:56:23,327 - optuna.study.study - INFO - Trial 297 finished with values: [0.08878863066393342, 0.010628642239935697, 0.04654444985711533] and parameters: {'n_layers': 1, 'embedding_dim': 256, 'lr': 0.0026263356328818884, 'lambda_val': 6.140274743146612e-05, 'batch_size': 639, 'optimizer': 'Adam'}.
2026-06-03 10:59:15,588 - optuna.study.study - INFO - Trial 298 finished with values: [0.07251647236889151, 0.008555496014468485, 0.035651353690642366] and parameters: {'n_layers': 1, 'embedding_dim': 128, 'lr': 0.004311872557114808, 'lambda_val': 2.8807178813664366e-05, 'batch_size': 639, 'optimizer': 'Adam'}.
2026-06-03 10:59:36,183 - experiment_functions - INFO - Early stopping at epoch 500. Best Metrics: (0.00041712414769050593, 6.86583160292049e-05, 0.00019225816662469882)
2026-06-03 10:59:36,289 - optuna.study.study - INFO - Trial 299 finished with values: [0.00041712414769050593, 6.86583160292049e-05, 0.00019225816662469882] and parameters: {'n_layers': 1, 'embedding_dim': 32, 'lr': 0.00019612806774005679, 'lambda_val': 0.0014369013630720255, 'batch_size': 2273, 'optimizer': 'RMSprop'}.
2026-06-03 10:59:36,305 - root - INFO - Selected Trial 222 based on Max ndcg: 0.0646
2026-06-03 10:59:36,305 - root - INFO - Associated Recall: 0.1142
2026-06-03 10:59:36,305 - experiment_functions - INFO - Training the best model ... for e_gowalla_full
2026-06-03 11:02:52,736 - root - INFO - **** Training e_gowalla_1c1dcs
2026-06-03 11:02:52,736 - root - INFO -   ** 1-Dominant stats:
2026-06-03 11:02:52,736 - root - INFO -   ** Finding the dominant set:
2026-06-03 13:52:37,730 - root - INFO -   ** Getting the trainable edges:
2026-06-03 13:52:37,748 - helper_functions - INFO -      Number of nodes: 10896
2026-06-03 13:52:37,748 - helper_functions - INFO -      Ratio: 0.15381357726675984
2026-06-03 13:52:37,748 - helper_functions - INFO -      Number of unique users: 2157
2026-06-03 13:52:37,748 - helper_functions - INFO -      Number of unique items: 8739
2026-06-03 13:52:37,748 - helper_functions - INFO -      Total dominant set edge: 63787
2026-06-03 13:52:37,748 - helper_functions - INFO -      Trainable edges: 51029.600000000006
2026-06-03 13:52:37,788 - root - INFO -   **** Getting 63787 dominant set edges
2026-06-03 13:52:37,932 - optuna.storages._rdb.storage - INFO - A new study created in RDB with name: Study_e_gowalla_1c1dcs_strict
2026-06-03 13:53:00,636 - experiment_functions - INFO - Early stopping at epoch 550. Best Metrics: (0.0010593144529791132, 0.0003700850693281532, 0.0007509084530898899)
2026-06-03 13:53:00,735 - optuna.study.study - INFO - Trial 0 finished with values: [0.0010593144529791132, 0.0003700850693281532, 0.0007509084530898899] and parameters: {'n_layers': 4, 'embedding_dim': 64, 'lr': 0.008051524614722692, 'lambda_val': 0.001214972879722574, 'batch_size': 1491, 'optimizer': 'RMSprop'}.
2026-06-03 13:53:22,585 - experiment_functions - INFO - Early stopping at epoch 500. Best Metrics: (0.0005932992907089653, 7.53566883247371e-05, 0.00028193886921099086)
2026-06-03 13:53:22,680 - optuna.study.study - INFO - Trial 1 finished with values: [0.0005932992907089653, 7.53566883247371e-05, 0.00028193886921099086] and parameters: {'n_layers': 3, 'embedding_dim': 128, 'lr': 0.0007465782429651481, 'lambda_val': 0.030921087388916624, 'batch_size': 2277, 'optimizer': 'SGD'}.
2026-06-03 13:53:48,194 - experiment_functions - INFO - Early stopping at epoch 550. Best Metrics: (0.0008073824224171408, 0.000286355415634001, 0.0005452342496798688)
2026-06-03 13:53:49,125 - optuna.study.study - INFO - Trial 2 finished with values: [0.0008073824224171408, 0.000286355415634001, 0.0005452342496798688] and parameters: {'n_layers': 2, 'embedding_dim': 256, 'lr': 0.017956531398886245, 'lambda_val': 0.01058979013820986, 'batch_size': 1446, 'optimizer': 'Adam'}.
2026-06-03 13:54:08,749 - experiment_functions - INFO - Early stopping at epoch 500. Best Metrics: (0.0005126131521141618, 7.703128139862015e-05, 0.00022903744691895342)
