2026-06-06 04:16:40,324 - optuna.study.study - INFO - Trial 266 finished with values: [0.0979928400511777, 0.011780762274767233, 0.05160312347934984] and parameters: {'n_layers': 1, 'embedding_dim': 128, 'lr': 0.0011525517839870857, 'lambda_val': 1.9645451789230886e-06, 'batch_size': 3853, 'optimizer': 'RMSprop'}.
2026-06-06 04:19:22,518 - experiment_functions - INFO - Early stopping at epoch 3500. Best Metrics: (0.09251829435197938, 0.01127838435260232, 0.048486843529975725)
2026-06-06 04:19:22,612 - optuna.study.study - INFO - Trial 267 finished with values: [0.09251829435197938, 0.01127838435260232, 0.048486843529975725] and parameters: {'n_layers': 1, 'embedding_dim': 256, 'lr': 0.0011525517839870857, 'lambda_val': 2.80429275845163e-06, 'batch_size': 3734, 'optimizer': 'Adam'}.
2026-06-06 04:20:05,968 - experiment_functions - INFO - Early stopping at epoch 900. Best Metrics: (0.07832170690972966, 0.009757853841516513, 0.0410459855275493)
2026-06-06 04:20:06,502 - optuna.study.study - INFO - Trial 268 finished with values: [0.07832170690972966, 0.009757853841516513, 0.0410459855275493] and parameters: {'n_layers': 1, 'embedding_dim': 256, 'lr': 0.003797813989642158, 'lambda_val': 9.945068556655057e-06, 'batch_size': 1841, 'optimizer': 'Adam'}.
2026-06-06 04:22:59,414 - optuna.study.study - INFO - Trial 269 finished with values: [0.08147819862528417, 0.009937035300421997, 0.04122371813619385] and parameters: {'n_layers': 2, 'embedding_dim': 96, 'lr': 0.0006492139755404522, 'lambda_val': 1.482563488933184e-06, 'batch_size': 3734, 'optimizer': 'Adam'}.
2026-06-06 04:23:23,238 - experiment_functions - INFO - Early stopping at epoch 500. Best Metrics: (0.00034113164505354205, 5.191238529037445e-05, 0.00016688246875957703)
2026-06-06 04:23:23,534 - optuna.study.study - INFO - Trial 270 finished with values: [0.00034113164505354205, 5.191238529037445e-05, 0.00016688246875957703] and parameters: {'n_layers': 1, 'embedding_dim': 256, 'lr': 0.00011812751747846378, 'lambda_val': 2.80429275845163e-06, 'batch_size': 2901, 'optimizer': 'Adam'}.
2026-06-06 04:23:47,060 - experiment_functions - INFO - Early stopping at epoch 500. Best Metrics: (0.00040653698397478727, 6.698372295532187e-05, 0.00021572490700514778)
2026-06-06 04:23:47,142 - optuna.study.study - INFO - Trial 271 finished with values: [0.00040653698397478727, 6.698372295532187e-05, 0.00021572490700514778] and parameters: {'n_layers': 4, 'embedding_dim': 96, 'lr': 0.0025949620955328543, 'lambda_val': 1.482563488933184e-06, 'batch_size': 1892, 'optimizer': 'SGD'}.
2026-06-06 04:26:38,773 - optuna.study.study - INFO - Trial 272 finished with values: [0.0016491273133639628, 0.0002612365195257553, 0.0007871334572028954] and parameters: {'n_layers': 1, 'embedding_dim': 256, 'lr': 0.000253453968163647, 'lambda_val': 3.378974650202849e-05, 'batch_size': 2005, 'optimizer': 'Adam'}.
2026-06-06 04:29:27,143 - optuna.study.study - INFO - Trial 273 finished with values: [0.08301726924743472, 0.010194922633799985, 0.044381265435222556] and parameters: {'n_layers': 2, 'embedding_dim': 96, 'lr': 0.0008375189225934038, 'lambda_val': 1.482563488933184e-06, 'batch_size': 2005, 'optimizer': 'Adam'}.
2026-06-06 04:30:09,227 - experiment_functions - INFO - Early stopping at epoch 1000. Best Metrics: (0.08125151386195899, 0.010209993971464935, 0.04230278029876608)
2026-06-06 04:30:09,311 - optuna.study.study - INFO - Trial 274 finished with values: [0.08125151386195899, 0.010209993971464935, 0.04230278029876608] and parameters: {'n_layers': 1, 'embedding_dim': 96, 'lr': 0.0025949620955328543, 'lambda_val': 0.0003851618423924071, 'batch_size': 3251, 'optimizer': 'Adam'}.
2026-06-06 04:30:53,406 - experiment_functions - INFO - Early stopping at epoch 1050. Best Metrics: (0.08228051097399168, 0.010119565945475249, 0.043224240712480655)
2026-06-06 04:30:53,506 - optuna.study.study - INFO - Trial 275 finished with values: [0.08228051097399168, 0.010119565945475249, 0.043224240712480655] and parameters: {'n_layers': 1, 'embedding_dim': 96, 'lr': 0.0025949620955328543, 'lambda_val': 0.0004495259947376086, 'batch_size': 3488, 'optimizer': 'Adam'}.
2026-06-06 04:33:42,183 - optuna.study.study - INFO - Trial 276 finished with values: [0.080999434726291, 0.01008105030477594, 0.04370050505467904] and parameters: {'n_layers': 2, 'embedding_dim': 96, 'lr': 0.0006492139755404522, 'lambda_val': 1.482563488933184e-06, 'batch_size': 1892, 'optimizer': 'Adam'}.
2026-06-06 04:34:43,649 - experiment_functions - INFO - Early stopping at epoch 1550. Best Metrics: (0.07892612032123769, 0.009551878893428897, 0.04117306294137659)
2026-06-06 04:34:43,744 - optuna.study.study - INFO - Trial 277 finished with values: [0.07892612032123769, 0.009551878893428897, 0.04117306294137659] and parameters: {'n_layers': 1, 'embedding_dim': 32, 'lr': 0.0025949620955328543, 'lambda_val': 1.482563488933184e-06, 'batch_size': 3472, 'optimizer': 'RMSprop'}.
2026-06-06 04:35:56,029 - experiment_functions - INFO - Early stopping at epoch 1400. Best Metrics: (0.08481096360673515, 0.010132962690066315, 0.043341201817986036)
2026-06-06 04:35:56,099 - optuna.study.study - INFO - Trial 278 finished with values: [0.08481096360673515, 0.010132962690066315, 0.043341201817986036] and parameters: {'n_layers': 2, 'embedding_dim': 256, 'lr': 0.0008375189225934038, 'lambda_val': 2.80429275845163e-06, 'batch_size': 3734, 'optimizer': 'Adam'}.
2026-06-06 04:37:00,848 - experiment_functions - INFO - Early stopping at epoch 1400. Best Metrics: (0.08048315802793216, 0.009551878893428898, 0.04066033342961391)
2026-06-06 04:37:01,153 - optuna.study.study - INFO - Trial 279 finished with values: [0.08048315802793216, 0.009551878893428898, 0.04066033342961391] and parameters: {'n_layers': 1, 'embedding_dim': 256, 'lr': 0.0025949620955328543, 'lambda_val': 1.9645451789230886e-06, 'batch_size': 1266, 'optimizer': 'RMSprop'}.
2026-06-06 04:37:23,025 - experiment_functions - INFO - Early stopping at epoch 500. Best Metrics: (0.0006502201023152827, 8.707883984191842e-05, 0.0003218832737749367)
2026-06-06 04:37:23,242 - optuna.study.study - INFO - Trial 280 finished with values: [0.0006502201023152827, 8.707883984191842e-05, 0.0003218832737749367] and parameters: {'n_layers': 2, 'embedding_dim': 96, 'lr': 0.0008375189225934038, 'lambda_val': 1.482563488933184e-06, 'batch_size': 2005, 'optimizer': 'SGD'}.
2026-06-06 04:38:35,355 - experiment_functions - INFO - Early stopping at epoch 1550. Best Metrics: (0.0932937607170662, 0.011392256681626365, 0.04941879833557624)
2026-06-06 04:38:35,430 - optuna.study.study - INFO - Trial 281 finished with values: [0.0932937607170662, 0.011392256681626365, 0.04941879833557624] and parameters: {'n_layers': 1, 'embedding_dim': 256, 'lr': 0.0011525517839870857, 'lambda_val': 3.1920449116234754e-05, 'batch_size': 3853, 'optimizer': 'RMSprop'}.
2026-06-06 04:39:25,565 - experiment_functions - INFO - Early stopping at epoch 1200. Best Metrics: (0.08614973743731015, 0.010565007703128142, 0.04509539327934092)
2026-06-06 04:39:25,689 - optuna.study.study - INFO - Trial 282 finished with values: [0.08614973743731015, 0.010565007703128142, 0.04509539327934092] and parameters: {'n_layers': 1, 'embedding_dim': 96, 'lr': 0.0025949620955328543, 'lambda_val': 1.9645451789230886e-06, 'batch_size': 2961, 'optimizer': 'Adam'}.
2026-06-06 04:41:52,948 - experiment_functions - INFO - Early stopping at epoch 2700. Best Metrics: (0.07419529529080858, 0.008870319512358496, 0.03780568387595904)
2026-06-06 04:41:53,034 - optuna.study.study - INFO - Trial 283 finished with values: [0.07419529529080858, 0.008870319512358496, 0.03780568387595904] and parameters: {'n_layers': 3, 'embedding_dim': 256, 'lr': 0.0006232408612082721, 'lambda_val': 1.9645451789230886e-06, 'batch_size': 1890, 'optimizer': 'RMSprop'}.
2026-06-06 04:44:53,460 - optuna.study.study - INFO - Trial 284 finished with values: [0.07385023103773307, 0.009881773728983858, 0.04009646081055563] and parameters: {'n_layers': 1, 'embedding_dim': 256, 'lr': 0.0006492139755404522, 'lambda_val': 1.482563488933184e-06, 'batch_size': 2555, 'optimizer': 'Adam'}.
2026-06-06 04:47:34,239 - optuna.study.study - INFO - Trial 285 finished with values: [0.08483842571669553, 0.010268604729050841, 0.04357072436427145] and parameters: {'n_layers': 1, 'embedding_dim': 96, 'lr': 0.0025949620955328543, 'lambda_val': 3.1920449116234754e-05, 'batch_size': 748, 'optimizer': 'RMSprop'}.
2026-06-06 04:50:15,264 - optuna.study.study - INFO - Trial 286 finished with values: [0.08788193110511394, 0.01075088753432916, 0.04673107295579041] and parameters: {'n_layers': 1, 'embedding_dim': 96, 'lr': 0.0025949620955328543, 'lambda_val': 1.9645451789230886e-06, 'batch_size': 755, 'optimizer': 'Adam'}.
2026-06-06 04:52:51,043 - optuna.study.study - INFO - Trial 287 finished with values: [0.07701336909791272, 0.009359300689932347, 0.03948987271380699] and parameters: {'n_layers': 1, 'embedding_dim': 64, 'lr': 0.0025949620955328543, 'lambda_val': 0.0002276261416734442, 'batch_size': 738, 'optimizer': 'RMSprop'}.
2026-06-06 04:55:16,533 - experiment_functions - INFO - Early stopping at epoch 3200. Best Metrics: (0.08218128113278134, 0.00993201152120035, 0.04239211654231077)
2026-06-06 04:55:17,327 - optuna.study.study - INFO - Trial 288 finished with values: [0.08218128113278134, 0.00993201152120035, 0.04239211654231077] and parameters: {'n_layers': 1, 'embedding_dim': 256, 'lr': 0.0025949620955328543, 'lambda_val': 2.80429275845163e-06, 'batch_size': 755, 'optimizer': 'Adam'}.
2026-06-06 04:56:07,435 - experiment_functions - INFO - Early stopping at epoch 1250. Best Metrics: (0.03886607428131151, 0.005285015741174895, 0.01866867653822122)
2026-06-06 04:56:07,697 - optuna.study.study - INFO - Trial 289 finished with values: [0.03886607428131151, 0.005285015741174895, 0.01866867653822122] and parameters: {'n_layers': 1, 'embedding_dim': 96, 'lr': 0.0025949620955328543, 'lambda_val': 0.020477072889289502, 'batch_size': 738, 'optimizer': 'Adam'}.
2026-06-06 04:57:53,581 - experiment_functions - INFO - Early stopping at epoch 2500. Best Metrics: (0.0808607747835498, 0.009746131689999332, 0.04143966522197934)
2026-06-06 04:57:53,878 - optuna.study.study - INFO - Trial 290 finished with values: [0.0808607747835498, 0.009746131689999332, 0.04143966522197934] and parameters: {'n_layers': 2, 'embedding_dim': 96, 'lr': 0.0008375189225934038, 'lambda_val': 1.9645451789230886e-06, 'batch_size': 3853, 'optimizer': 'Adam'}.
2026-06-06 05:00:54,717 - optuna.study.study - INFO - Trial 291 finished with values: [0.09250847439212016, 0.01169703262107308, 0.051065419466738045] and parameters: {'n_layers': 1, 'embedding_dim': 256, 'lr': 0.0006492139755404522, 'lambda_val': 2.80429275845163e-06, 'batch_size': 3853, 'optimizer': 'RMSprop'}.
2026-06-06 05:02:50,928 - experiment_functions - INFO - Early stopping at epoch 2650. Best Metrics: (0.08633583651013668, 0.010282001473641904, 0.04426830727546782)
2026-06-06 05:02:51,001 - optuna.study.study - INFO - Trial 292 finished with values: [0.08633583651013668, 0.010282001473641904, 0.04426830727546782] and parameters: {'n_layers': 2, 'embedding_dim': 128, 'lr': 0.0011525517839870857, 'lambda_val': 1.482563488933184e-06, 'batch_size': 1890, 'optimizer': 'Adam'}.
2026-06-06 05:05:31,235 - optuna.study.study - INFO - Trial 293 finished with values: [0.01757712303691624, 0.0028635541563400094, 0.010369519453345636] and parameters: {'n_layers': 2, 'embedding_dim': 96, 'lr': 0.0003181493385777307, 'lambda_val': 1.5739380446754205e-06, 'batch_size': 1266, 'optimizer': 'Adam'}.
2026-06-06 05:06:18,771 - experiment_functions - INFO - Early stopping at epoch 950. Best Metrics: (0.08988270521386882, 0.011013798646928797, 0.047391758575987784)
2026-06-06 05:06:19,452 - optuna.study.study - INFO - Trial 294 finished with values: [0.08988270521386882, 0.011013798646928797, 0.047391758575987784] and parameters: {'n_layers': 1, 'embedding_dim': 256, 'lr': 0.0025949620955328543, 'lambda_val': 1.9645451789230886e-06, 'batch_size': 3853, 'optimizer': 'Adam'}.
2026-06-06 05:07:00,345 - experiment_functions - INFO - Early stopping at epoch 950. Best Metrics: (0.07896369461701122, 0.009453077902069796, 0.04067751936386796)
2026-06-06 05:07:00,653 - optuna.study.study - INFO - Trial 295 finished with values: [0.07896369461701122, 0.009453077902069796, 0.04067751936386796] and parameters: {'n_layers': 1, 'embedding_dim': 128, 'lr': 0.0025949620955328543, 'lambda_val': 2.80429275845163e-06, 'batch_size': 3853, 'optimizer': 'RMSprop'}.
2026-06-06 05:09:41,193 - optuna.study.study - INFO - Trial 296 finished with values: [0.09066159787754727, 0.011159488244356622, 0.04882629554142508] and parameters: {'n_layers': 1, 'embedding_dim': 96, 'lr': 0.0011525517839870857, 'lambda_val': 3.1920449116234754e-05, 'batch_size': 2005, 'optimizer': 'RMSprop'}.
2026-06-06 05:12:20,572 - optuna.study.study - INFO - Trial 297 finished with values: [0.07392971223337803, 0.009865027798245028, 0.04109315375841782] and parameters: {'n_layers': 1, 'embedding_dim': 96, 'lr': 0.0008375189225934038, 'lambda_val': 1.9645451789230886e-06, 'batch_size': 2005, 'optimizer': 'Adam'}.
2026-06-06 05:13:52,659 - experiment_functions - INFO - Early stopping at epoch 2000. Best Metrics: (0.09645382229603715, 0.01166019157344765, 0.05083438498329262)
2026-06-06 05:13:52,754 - optuna.study.study - INFO - Trial 298 finished with values: [0.09645382229603715, 0.01166019157344765, 0.05083438498329262] and parameters: {'n_layers': 1, 'embedding_dim': 256, 'lr': 0.0011525517839870857, 'lambda_val': 1.9645451789230886e-06, 'batch_size': 3853, 'optimizer': 'RMSprop'}.
2026-06-06 05:16:33,603 - optuna.study.study - INFO - Trial 299 finished with values: [0.08647812085606031, 0.010864759863353205, 0.04708908744670294] and parameters: {'n_layers': 1, 'embedding_dim': 96, 'lr': 0.0011525517839870857, 'lambda_val': 1.9645451789230886e-06, 'batch_size': 1487, 'optimizer': 'RMSprop'}.
2026-06-06 05:16:33,619 - root - INFO - Selected Trial 259 based on Max ndcg: 0.0523
2026-06-06 05:16:33,619 - root - INFO - Associated Recall: 0.0975
2026-06-06 05:16:33,619 - experiment_functions - INFO - Training the best model ... for e_gowalla_1c1dcs_rand3
2026-06-06 05:19:36,390 - root - INFO -   **** Training e_gowalla_1c1dcs_rand4
2026-06-06 05:19:36,503 - root - INFO -   **** Getting 368544/845292 random edges
2026-06-06 05:19:37,425 - optuna.storages._rdb.storage - INFO - A new study created in RDB with name: Study_e_gowalla_1c1dcs_rand4
2026-06-06 05:20:24,561 - experiment_functions - INFO - Early stopping at epoch 1050. Best Metrics: (0.013160010318179172, 0.001801862147498158, 0.006587837853697221)
2026-06-06 05:20:24,651 - optuna.study.study - INFO - Trial 0 finished with values: [0.013160010318179172, 0.001801862147498158, 0.006587837853697221] and parameters: {'n_layers': 1, 'embedding_dim': 256, 'lr': 0.02638164782330716, 'lambda_val': 1.3398416216824042e-06, 'batch_size': 3867, 'optimizer': 'RMSprop'}.
2026-06-06 05:20:46,902 - experiment_functions - INFO - Early stopping at epoch 500. Best Metrics: (0.0004481378396938417, 6.698372295532187e-05, 0.00019641958653749517)
2026-06-06 05:20:46,995 - optuna.study.study - INFO - Trial 1 finished with values: [0.0004481378396938417, 6.698372295532187e-05, 0.00019641958653749517] and parameters: {'n_layers': 4, 'embedding_dim': 64, 'lr': 0.0033042379825761227, 'lambda_val': 2.979534431198929e-05, 'batch_size': 4030, 'optimizer': 'SGD'}.
2026-06-06 05:21:16,379 - experiment_functions - INFO - Early stopping at epoch 700. Best Metrics: (0.000572901675202165, 7.200750217697099e-05, 0.00022400838677485074)
2026-06-06 05:21:16,480 - optuna.study.study - INFO - Trial 2 finished with values: [0.000572901675202165, 7.200750217697099e-05, 0.00022400838677485074] and parameters: {'n_layers': 3, 'embedding_dim': 64, 'lr': 2.5452664244146665e-05, 'lambda_val': 0.0004477317685398527, 'batch_size': 1187, 'optimizer': 'RMSprop'}.
2026-06-06 05:21:38,164 - experiment_functions - INFO - Early stopping at epoch 500. Best Metrics: (0.00031018414737176103, 5.191238529037445e-05, 0.0001377372300430575)
2026-06-06 05:21:38,900 - optuna.study.study - INFO - Trial 3 finished with values: [0.00031018414737176103, 5.191238529037445e-05, 0.0001377372300430575] and parameters: {'n_layers': 2, 'embedding_dim': 96, 'lr': 0.0006620403243006898, 'lambda_val': 7.541754205300509e-05, 'batch_size': 1547, 'optimizer': 'SGD'}.
2026-06-06 05:22:02,165 - experiment_functions - INFO - Early stopping at epoch 500. Best Metrics: (0.0004134492645306576, 6.698372295532186e-05, 0.00016371421997475626)
2026-06-06 05:22:02,260 - optuna.study.study - INFO - Trial 4 finished with values: [0.0004134492645306576, 6.698372295532186e-05, 0.00016371421997475626] and parameters: {'n_layers': 1, 'embedding_dim': 256, 'lr': 2.0227993886447854e-05, 'lambda_val': 0.06940078662070691, 'batch_size': 1648, 'optimizer': 'SGD'}.
2026-06-06 05:22:27,928 - experiment_functions - INFO - Early stopping at epoch 500. Best Metrics: (0.0003323662102018308, 6.530912988143882e-05, 0.00021876316408490587)
2026-06-06 05:22:28,621 - optuna.study.study - INFO - Trial 5 finished with values: [0.0003323662102018308, 6.530912988143882e-05, 0.00021876316408490587] and parameters: {'n_layers': 2, 'embedding_dim': 256, 'lr': 2.693807049511328e-05, 'lambda_val': 0.01150601421948414, 'batch_size': 977, 'optimizer': 'SGD'}.
2026-06-06 05:24:25,119 - experiment_functions - INFO - Early stopping at epoch 2100. Best Metrics: (0.057129273119445954, 0.007125393529372363, 0.027755676743255638)
2026-06-06 05:24:25,202 - optuna.study.study - INFO - Trial 6 finished with values: [0.057129273119445954, 0.007125393529372363, 0.027755676743255638] and parameters: {'n_layers': 3, 'embedding_dim': 256, 'lr': 0.0004552200097553583, 'lambda_val': 0.001958251317392381, 'batch_size': 2193, 'optimizer': 'Adam'}.
2026-06-06 05:24:46,345 - experiment_functions - INFO - Early stopping at epoch 500. Best Metrics: (0.00039904874800906, 6.028535065978968e-05, 0.00019086339325793543)
2026-06-06 05:24:47,292 - optuna.study.study - INFO - Trial 7 finished with values: [0.00039904874800906, 6.028535065978968e-05, 0.00019086339325793543] and parameters: {'n_layers': 1, 'embedding_dim': 96, 'lr': 0.007479316943350578, 'lambda_val': 6.567997340058403e-05, 'batch_size': 770, 'optimizer': 'SGD'}.
2026-06-06 05:27:46,986 - optuna.study.study - INFO - Trial 8 finished with values: [0.0595276362358258, 0.007240940451470293, 0.030228010434958735] and parameters: {'n_layers': 4, 'embedding_dim': 96, 'lr': 0.0005278478256568082, 'lambda_val': 8.198950044762925e-06, 'batch_size': 1057, 'optimizer': 'RMSprop'}.
2026-06-06 05:30:51,530 - optuna.study.study - INFO - Trial 9 finished with values: [0.0025289714528379317, 0.0003784580346975685, 0.0011882609659668163] and parameters: {'n_layers': 4, 'embedding_dim': 128, 'lr': 6.402106726977996e-05, 'lambda_val': 8.324923476766547e-06, 'batch_size': 4010, 'optimizer': 'Adam'}.
2026-06-06 05:31:19,257 - experiment_functions - INFO - Early stopping at epoch 500. Best Metrics: (0.00038575929013291157, 7.2007502176971e-05, 0.00019920627398024694)
2026-06-06 05:31:19,339 - optuna.study.study - INFO - Trial 10 finished with values: [0.00038575929013291157, 7.2007502176971e-05, 0.00019920627398024694] and parameters: {'n_layers': 3, 'embedding_dim': 256, 'lr': 0.0401340301145446, 'lambda_val': 0.0009822838550460555, 'batch_size': 3058, 'optimizer': 'SGD'}.
2026-06-06 05:31:41,044 - experiment_functions - INFO - Early stopping at epoch 500. Best Metrics: (0.0005222396470168176, 8.038046754638622e-05, 0.00021532781331626332)
2026-06-06 05:31:41,147 - optuna.study.study - INFO - Trial 11 finished with values: [0.0005222396470168176, 8.038046754638622e-05, 0.00021532781331626332] and parameters: {'n_layers': 3, 'embedding_dim': 64, 'lr': 0.0007900602642959323, 'lambda_val': 1.3792758545918358e-05, 'batch_size': 3502, 'optimizer': 'SGD'}.
2026-06-06 05:34:11,281 - optuna.study.study - INFO - Trial 12 finished with values: [0.0156666329772708, 0.002344430303436265, 0.008492167708214926] and parameters: {'n_layers': 3, 'embedding_dim': 32, 'lr': 0.00021389021150995766, 'lambda_val': 3.209438228286478e-05, 'batch_size': 1934, 'optimizer': 'RMSprop'}.
2026-06-06 05:34:34,686 - experiment_functions - INFO - Early stopping at epoch 500. Best Metrics: (0.0005521211203342467, 9.210261906356757e-05, 0.0002619207487602656)
2026-06-06 05:34:34,851 - optuna.study.study - INFO - Trial 13 finished with values: [0.0005521211203342467, 9.210261906356757e-05, 0.0002619207487602656] and parameters: {'n_layers': 4, 'embedding_dim': 96, 'lr': 0.0021142565742655003, 'lambda_val': 1.006573582922827e-05, 'batch_size': 998, 'optimizer': 'SGD'}.
2026-06-06 05:37:26,585 - optuna.study.study - INFO - Trial 14 finished with values: [0.051479483310300264, 0.00601346372831402, 0.024778793799029072] and parameters: {'n_layers': 2, 'embedding_dim': 128, 'lr': 0.006829910291098024, 'lambda_val': 2.5535184182963008e-05, 'batch_size': 1079, 'optimizer': 'RMSprop'}.
2026-06-06 05:37:52,861 - experiment_functions - INFO - Early stopping at epoch 550. Best Metrics: (0.017571857885189297, 0.001992765757920825, 0.0076624375261864636)
2026-06-06 05:37:52,943 - optuna.study.study - INFO - Trial 15 finished with values: [0.017571857885189297, 0.001992765757920825, 0.0076624375261864636] and parameters: {'n_layers': 4, 'embedding_dim': 96, 'lr': 0.056760968140890614, 'lambda_val': 0.0024317965656885246, 'batch_size': 1686, 'optimizer': 'Adam'}.
2026-06-06 05:38:21,173 - experiment_functions - INFO - Early stopping at epoch 650. Best Metrics: (0.024933429327273656, 0.003072878290575391, 0.01151294338722384)
