2026-06-03 13:54:08,857 - optuna.study.study - INFO - Trial 3 finished with values: [0.0005126131521141618, 7.703128139862015e-05, 0.00022903744691895342] and parameters: {'n_layers': 1, 'embedding_dim': 32, 'lr': 6.384584978230432e-05, 'lambda_val': 2.0098616241177373e-05, 'batch_size': 3377, 'optimizer': 'SGD'}.
2026-06-03 13:54:34,657 - experiment_functions - INFO - Early stopping at epoch 650. Best Metrics: (0.00480973112220553, 0.001559046151785116, 0.003231187187668671)
2026-06-03 13:54:34,986 - optuna.study.study - INFO - Trial 4 finished with values: [0.00480973112220553, 0.001559046151785116, 0.003231187187668671] and parameters: {'n_layers': 1, 'embedding_dim': 64, 'lr': 0.0018644973108911816, 'lambda_val': 8.536566464955742e-05, 'batch_size': 2369, 'optimizer': 'RMSprop'}.
2026-06-03 13:55:00,994 - experiment_functions - INFO - Early stopping at epoch 600. Best Metrics: (0.0019178581693945125, 0.0005995043204501306, 0.0012456685758883805)
2026-06-03 13:55:01,089 - optuna.study.study - INFO - Trial 5 finished with values: [0.0019178581693945125, 0.0005995043204501306, 0.0012456685758883805] and parameters: {'n_layers': 3, 'embedding_dim': 128, 'lr': 0.0014552621483972018, 'lambda_val': 0.009337998461740198, 'batch_size': 1195, 'optimizer': 'Adam'}.
2026-06-03 13:55:24,828 - experiment_functions - INFO - Early stopping at epoch 550. Best Metrics: (0.0008924972420900923, 0.0002964029740772992, 0.0005602787543924431)
2026-06-03 13:55:26,212 - optuna.study.study - INFO - Trial 6 finished with values: [0.0008924972420900923, 0.0002964029740772992, 0.0005602787543924431] and parameters: {'n_layers': 4, 'embedding_dim': 96, 'lr': 0.01732801490461506, 'lambda_val': 0.003683137437388494, 'batch_size': 1881, 'optimizer': 'Adam'}.
2026-06-03 13:55:47,083 - experiment_functions - INFO - Early stopping at epoch 500. Best Metrics: (0.0004995927711217035, 6.865831602920491e-05, 0.00024296649504008795)
2026-06-03 13:55:47,189 - optuna.study.study - INFO - Trial 7 finished with values: [0.0004995927711217035, 6.865831602920491e-05, 0.00024296649504008795] and parameters: {'n_layers': 1, 'embedding_dim': 128, 'lr': 4.478514150952107e-05, 'lambda_val': 0.014546981560237598, 'batch_size': 1936, 'optimizer': 'RMSprop'}.
2026-06-03 13:56:14,267 - experiment_functions - INFO - Early stopping at epoch 550. Best Metrics: (0.00137850297547847, 0.0004789336191305512, 0.0009144173554514772)
2026-06-03 13:56:14,363 - optuna.study.study - INFO - Trial 8 finished with values: [0.00137850297547847, 0.0004789336191305512, 0.0009144173554514772] and parameters: {'n_layers': 3, 'embedding_dim': 256, 'lr': 0.011257419007849974, 'lambda_val': 0.00248087812785119, 'batch_size': 3052, 'optimizer': 'Adam'}.
2026-06-03 13:56:37,432 - experiment_functions - INFO - Early stopping at epoch 550. Best Metrics: (0.0015464101047111558, 0.00039018018621474985, 0.0008897699591449925)
2026-06-03 13:56:37,523 - optuna.study.study - INFO - Trial 9 finished with values: [0.0015464101047111558, 0.00039018018621474985, 0.0008897699591449925] and parameters: {'n_layers': 4, 'embedding_dim': 64, 'lr': 0.002359676800056199, 'lambda_val': 3.565569212735739e-06, 'batch_size': 3933, 'optimizer': 'RMSprop'}.
2026-06-03 13:57:01,998 - experiment_functions - INFO - Early stopping at epoch 600. Best Metrics: (0.0014079463605340082, 0.0005760600174157679, 0.001032731405881976)
2026-06-03 13:57:02,099 - optuna.study.study - INFO - Trial 10 finished with values: [0.0014079463605340082, 0.0005760600174157679, 0.001032731405881976] and parameters: {'n_layers': 3, 'embedding_dim': 64, 'lr': 0.013177047583454147, 'lambda_val': 0.00017827865769578737, 'batch_size': 3317, 'optimizer': 'RMSprop'}.
2026-06-03 13:57:30,274 - experiment_functions - INFO - Early stopping at epoch 550. Best Metrics: (0.001820981033323581, 0.0006363453680755576, 0.0012231206177593758)
2026-06-03 13:57:30,423 - optuna.study.study - INFO - Trial 11 finished with values: [0.001820981033323581, 0.0006363453680755576, 0.0012231206177593758] and parameters: {'n_layers': 4, 'embedding_dim': 256, 'lr': 0.006376881120140814, 'lambda_val': 7.927121361608539e-05, 'batch_size': 1865, 'optimizer': 'RMSprop'}.
2026-06-03 13:57:52,530 - experiment_functions - INFO - Early stopping at epoch 550. Best Metrics: (0.0019665856932882864, 0.0005057271083126801, 0.0011027074439308945)
2026-06-03 13:57:53,413 - optuna.study.study - INFO - Trial 12 finished with values: [0.0019665856932882864, 0.0005057271083126801, 0.0011027074439308945] and parameters: {'n_layers': 3, 'embedding_dim': 32, 'lr': 0.005937274594324768, 'lambda_val': 0.000142346054959725, 'batch_size': 711, 'optimizer': 'Adam'}.
2026-06-03 13:58:13,103 - experiment_functions - INFO - Early stopping at epoch 500. Best Metrics: (0.0005879933148783831, 7.870587447250318e-05, 0.00024397431948510815)
2026-06-03 13:58:13,189 - optuna.study.study - INFO - Trial 13 finished with values: [0.0005879933148783831, 7.870587447250318e-05, 0.00024397431948510815] and parameters: {'n_layers': 2, 'embedding_dim': 32, 'lr': 0.00013096205237201516, 'lambda_val': 1.9509421076022356e-05, 'batch_size': 1705, 'optimizer': 'SGD'}.
2026-06-03 13:58:35,305 - experiment_functions - INFO - Early stopping at epoch 550. Best Metrics: (0.002047372261656621, 0.0008021300823899792, 0.0015202410132764115)
2026-06-03 13:58:35,400 - optuna.study.study - INFO - Trial 14 finished with values: [0.002047372261656621, 0.0008021300823899792, 0.0015202410132764115] and parameters: {'n_layers': 1, 'embedding_dim': 96, 'lr': 0.008813340023110926, 'lambda_val': 0.025990812764396166, 'batch_size': 2094, 'optimizer': 'Adam'}.
2026-06-03 14:00:14,044 - experiment_functions - INFO - Early stopping at epoch 2400. Best Metrics: (0.005208619175719675, 0.001944202558778217, 0.004133635213032061)
2026-06-03 14:00:14,150 - optuna.study.study - INFO - Trial 15 finished with values: [0.005208619175719675, 0.001944202558778217, 0.004133635213032061] and parameters: {'n_layers': 1, 'embedding_dim': 256, 'lr': 0.0006158877725370185, 'lambda_val': 2.697820276812544e-06, 'batch_size': 1352, 'optimizer': 'Adam'}.
2026-06-03 14:00:36,349 - experiment_functions - INFO - Early stopping at epoch 550. Best Metrics: (0.0007437954371814536, 0.00028970460178176705, 0.0005263670067810501)
2026-06-03 14:00:36,443 - optuna.study.study - INFO - Trial 16 finished with values: [0.0007437954371814536, 0.00028970460178176705, 0.0005263670067810501] and parameters: {'n_layers': 4, 'embedding_dim': 32, 'lr': 0.09032174133742327, 'lambda_val': 0.0018117189258503353, 'batch_size': 2988, 'optimizer': 'Adam'}.
2026-06-03 14:01:05,289 - experiment_functions - INFO - Early stopping at epoch 750. Best Metrics: (0.0005893757343331709, 7.53566883247371e-05, 0.00023845919250895873)
2026-06-03 14:01:05,392 - optuna.study.study - INFO - Trial 17 finished with values: [0.0005893757343331709, 7.53566883247371e-05, 0.00023845919250895873] and parameters: {'n_layers': 3, 'embedding_dim': 32, 'lr': 1.871380082044237e-05, 'lambda_val': 0.030922001951365578, 'batch_size': 1951, 'optimizer': 'Adam'}.
2026-06-03 14:03:27,916 - optuna.study.study - INFO - Trial 18 finished with values: [0.0007411569751626412, 0.0001222452943934624, 0.0003659528679448639] and parameters: {'n_layers': 3, 'embedding_dim': 32, 'lr': 5.6635079794925213e-05, 'lambda_val': 9.853705387574286e-06, 'batch_size': 946, 'optimizer': 'RMSprop'}.
2026-06-03 14:06:05,327 - optuna.study.study - INFO - Trial 19 finished with values: [0.0008805124986687313, 0.0002662602987474044, 0.0006153123194976881] and parameters: {'n_layers': 4, 'embedding_dim': 96, 'lr': 7.641807986617319e-05, 'lambda_val': 1.1033501035792517e-05, 'batch_size': 3498, 'optimizer': 'RMSprop'}.
2026-06-03 14:07:48,450 - experiment_functions - INFO - Early stopping at epoch 2650. Best Metrics: (0.004126903583696911, 0.001332976086810905, 0.0027605696031368773)
2026-06-03 14:07:48,539 - optuna.study.study - INFO - Trial 20 finished with values: [0.004126903583696911, 0.001332976086810905, 0.0027605696031368773] and parameters: {'n_layers': 2, 'embedding_dim': 128, 'lr': 0.00024535156098645997, 'lambda_val': 0.0006859838564406128, 'batch_size': 2083, 'optimizer': 'RMSprop'}.
2026-06-03 14:08:19,364 - experiment_functions - INFO - Early stopping at epoch 700. Best Metrics: (0.000404087466738259, 7.703128139862015e-05, 0.00022053541653637614)
2026-06-03 14:08:19,478 - optuna.study.study - INFO - Trial 21 finished with values: [0.000404087466738259, 7.703128139862015e-05, 0.00022053541653637614] and parameters: {'n_layers': 4, 'embedding_dim': 128, 'lr': 1.3581611856261677e-05, 'lambda_val': 0.0011352390546591306, 'batch_size': 2942, 'optimizer': 'Adam'}.
2026-06-03 14:11:30,730 - optuna.study.study - INFO - Trial 22 finished with values: [0.0010026320649416194, 0.0002913791948556501, 0.0006122143183379388] and parameters: {'n_layers': 4, 'embedding_dim': 256, 'lr': 5.107534716812453e-05, 'lambda_val': 2.867112838714263e-05, 'batch_size': 2513, 'optimizer': 'Adam'}.
2026-06-03 14:11:51,135 - experiment_functions - INFO - Early stopping at epoch 500. Best Metrics: (0.00046288082045527, 7.368209525085404e-05, 0.0002483462542661538)
2026-06-03 14:11:52,098 - optuna.study.study - INFO - Trial 23 finished with values: [0.00046288082045527, 7.368209525085404e-05, 0.0002483462542661538] and parameters: {'n_layers': 2, 'embedding_dim': 64, 'lr': 0.0018784066667355106, 'lambda_val': 0.015657019363532226, 'batch_size': 3094, 'optimizer': 'SGD'}.
2026-06-03 14:12:24,136 - experiment_functions - INFO - Early stopping at epoch 800. Best Metrics: (0.0009261437069273279, 0.00027630785719070264, 0.0005980358593312722)
2026-06-03 14:12:24,342 - optuna.study.study - INFO - Trial 24 finished with values: [0.0009261437069273279, 0.00027630785719070264, 0.0005980358593312722] and parameters: {'n_layers': 2, 'embedding_dim': 96, 'lr': 0.0009953898625526991, 'lambda_val': 0.02787805142092731, 'batch_size': 680, 'optimizer': 'RMSprop'}.
2026-06-03 14:12:59,619 - experiment_functions - INFO - Early stopping at epoch 850. Best Metrics: (0.00048287673095696816, 7.870587447250318e-05, 0.00025027598006317097)
2026-06-03 14:12:59,722 - optuna.study.study - INFO - Trial 25 finished with values: [0.00048287673095696816, 7.870587447250318e-05, 0.00025027598006317097] and parameters: {'n_layers': 1, 'embedding_dim': 256, 'lr': 0.05049828206105063, 'lambda_val': 0.002221592732635211, 'batch_size': 1105, 'optimizer': 'SGD'}.
2026-06-03 14:13:36,388 - experiment_functions - INFO - Early stopping at epoch 750. Best Metrics: (0.00040320178356731764, 6.698372295532186e-05, 0.00018420440696174668)
2026-06-03 14:13:36,473 - optuna.study.study - INFO - Trial 26 finished with values: [0.00040320178356731764, 6.698372295532186e-05, 0.00018420440696174668] and parameters: {'n_layers': 4, 'embedding_dim': 256, 'lr': 0.027452240930335613, 'lambda_val': 0.08574261741727777, 'batch_size': 1746, 'optimizer': 'SGD'}.
2026-06-03 14:14:07,308 - experiment_functions - INFO - Early stopping at epoch 700. Best Metrics: (0.0015523257006273409, 0.0006346707750016746, 0.0012035186059773115)
2026-06-03 14:14:07,458 - optuna.study.study - INFO - Trial 27 finished with values: [0.0015523257006273409, 0.0006346707750016746, 0.0012035186059773115] and parameters: {'n_layers': 4, 'embedding_dim': 128, 'lr': 0.010028699903383422, 'lambda_val': 1.1031019465465648e-05, 'batch_size': 2162, 'optimizer': 'RMSprop'}.
2026-06-03 14:14:29,602 - experiment_functions - INFO - Early stopping at epoch 500. Best Metrics: (0.0015149472218778702, 0.0004002277446580481, 0.0009587402062631581)
2026-06-03 14:14:29,764 - optuna.study.study - INFO - Trial 28 finished with values: [0.0015149472218778702, 0.0004002277446580481, 0.0009587402062631581] and parameters: {'n_layers': 3, 'embedding_dim': 128, 'lr': 0.014207108552616627, 'lambda_val': 0.0005252719466354678, 'batch_size': 3933, 'optimizer': 'RMSprop'}.
2026-06-03 14:14:49,608 - experiment_functions - INFO - Early stopping at epoch 500. Best Metrics: (0.0003296793560193828, 6.195994373367273e-05, 0.0001521152813703603)
2026-06-03 14:14:50,146 - optuna.study.study - INFO - Trial 29 finished with values: [0.0003296793560193828, 6.195994373367273e-05, 0.0001521152813703603] and parameters: {'n_layers': 2, 'embedding_dim': 32, 'lr': 0.019820479928232715, 'lambda_val': 2.4542069332003836e-05, 'batch_size': 913, 'optimizer': 'SGD'}.
2026-06-03 14:15:10,047 - experiment_functions - INFO - Early stopping at epoch 500. Best Metrics: (0.001337897376702223, 0.0003198472771116619, 0.0009012645208948584)
2026-06-03 14:15:10,368 - optuna.study.study - INFO - Trial 30 finished with values: [0.001337897376702223, 0.0003198472771116619, 0.0009012645208948584] and parameters: {'n_layers': 2, 'embedding_dim': 32, 'lr': 0.0554419983592766, 'lambda_val': 1.5614970160261773e-06, 'batch_size': 682, 'optimizer': 'RMSprop'}.
2026-06-03 14:15:30,089 - experiment_functions - INFO - Early stopping at epoch 500. Best Metrics: (0.0005518835868590445, 7.703128139862013e-05, 0.00022445405246265514)
2026-06-03 14:15:30,324 - optuna.study.study - INFO - Trial 31 finished with values: [0.0005518835868590445, 7.703128139862013e-05, 0.00022445405246265514] and parameters: {'n_layers': 1, 'embedding_dim': 32, 'lr': 0.0014067169898276091, 'lambda_val': 1.078600699229543e-06, 'batch_size': 1489, 'optimizer': 'SGD'}.
2026-06-03 14:16:02,838 - experiment_functions - INFO - Early stopping at epoch 850. Best Metrics: (0.003126820884667529, 0.0008456695023109386, 0.001935867334250019)
2026-06-03 14:16:02,932 - optuna.study.study - INFO - Trial 32 finished with values: [0.003126820884667529, 0.0008456695023109386, 0.001935867334250019] and parameters: {'n_layers': 2, 'embedding_dim': 32, 'lr': 0.0010433155335864835, 'lambda_val': 2.2072560753305147e-05, 'batch_size': 2526, 'optimizer': 'RMSprop'}.
2026-06-03 14:16:27,162 - experiment_functions - INFO - Early stopping at epoch 500. Best Metrics: (0.0005605671763311174, 8.540424676803538e-05, 0.0002418030003455008)
2026-06-03 14:16:27,267 - optuna.study.study - INFO - Trial 33 finished with values: [0.0005605671763311174, 8.540424676803538e-05, 0.0002418030003455008] and parameters: {'n_layers': 3, 'embedding_dim': 256, 'lr': 0.0006474291340227404, 'lambda_val': 0.03355376221130594, 'batch_size': 1952, 'optimizer': 'SGD'}.
2026-06-03 14:16:58,910 - experiment_functions - INFO - Early stopping at epoch 650. Best Metrics: (0.0007198828901855118, 0.00022941925112197737, 0.00046018372560100503)
2026-06-03 14:16:59,009 - optuna.study.study - INFO - Trial 34 finished with values: [0.0007198828901855118, 0.00022941925112197737, 0.00046018372560100503] and parameters: {'n_layers': 3, 'embedding_dim': 256, 'lr': 0.001246415066793532, 'lambda_val': 0.050506142150434294, 'batch_size': 2554, 'optimizer': 'Adam'}.
2026-06-03 14:19:42,165 - optuna.study.study - INFO - Trial 35 finished with values: [0.0008010358499591173, 0.000144015004353942, 0.00040223222426809377] and parameters: {'n_layers': 4, 'embedding_dim': 128, 'lr': 3.9304375700492786e-05, 'lambda_val': 0.0034808140996535246, 'batch_size': 1399, 'optimizer': 'RMSprop'}.
2026-06-03 14:22:17,119 - optuna.study.study - INFO - Trial 36 finished with values: [0.0007693225481533046, 0.00011052314287628108, 0.00032538377022001716] and parameters: {'n_layers': 2, 'embedding_dim': 128, 'lr': 3.9820205726459e-05, 'lambda_val': 1.0757742422706817e-05, 'batch_size': 3896, 'optimizer': 'Adam'}.
2026-06-03 14:22:39,340 - experiment_functions - INFO - Early stopping at epoch 500. Best Metrics: (0.00043657595785575703, 7.368209525085404e-05, 0.00021426111025120307)
2026-06-03 14:22:39,430 - optuna.study.study - INFO - Trial 37 finished with values: [0.00043657595785575703, 7.368209525085404e-05, 0.00021426111025120307] and parameters: {'n_layers': 3, 'embedding_dim': 128, 'lr': 2.868746326030908e-05, 'lambda_val': 0.025364096338389288, 'batch_size': 2979, 'optimizer': 'Adam'}.
2026-06-03 14:23:01,050 - experiment_functions - INFO - Early stopping at epoch 500. Best Metrics: (0.0004484944753881809, 7.033290910308797e-05, 0.000195239117084318)
2026-06-03 14:23:01,144 - optuna.study.study - INFO - Trial 38 finished with values: [0.0004484944753881809, 7.033290910308797e-05, 0.000195239117084318] and parameters: {'n_layers': 4, 'embedding_dim': 96, 'lr': 5.3280850215514445e-05, 'lambda_val': 0.0014275578441129155, 'batch_size': 2769, 'optimizer': 'SGD'}.
2026-06-03 14:23:21,781 - experiment_functions - INFO - Early stopping at epoch 500. Best Metrics: (0.00048348176055242373, 6.865831602920491e-05, 0.00022947746654599797)
2026-06-03 14:23:21,874 - optuna.study.study - INFO - Trial 39 finished with values: [0.00048348176055242373, 6.865831602920491e-05, 0.00022947746654599797] and parameters: {'n_layers': 1, 'embedding_dim': 128, 'lr': 3.1475185990861593e-05, 'lambda_val': 0.0003096219080752794, 'batch_size': 3711, 'optimizer': 'SGD'}.
2026-06-03 14:23:46,615 - experiment_functions - INFO - Early stopping at epoch 550. Best Metrics: (0.0018518701986380566, 0.0006380199611494407, 0.0012741178910655167)
2026-06-03 14:23:47,684 - optuna.study.study - INFO - Trial 40 finished with values: [0.0018518701986380566, 0.0006380199611494407, 0.0012741178910655167] and parameters: {'n_layers': 1, 'embedding_dim': 256, 'lr': 0.07085951793836062, 'lambda_val': 3.6015692758113356e-06, 'batch_size': 1314, 'optimizer': 'Adam'}.
2026-06-03 14:24:07,951 - experiment_functions - INFO - Early stopping at epoch 500. Best Metrics: (0.000545708471306519, 6.195994373367272e-05, 0.00023089494869326394)
2026-06-03 14:24:08,702 - optuna.study.study - INFO - Trial 41 finished with values: [0.000545708471306519, 6.195994373367272e-05, 0.00023089494869326394] and parameters: {'n_layers': 1, 'embedding_dim': 96, 'lr': 0.0026782183131133443, 'lambda_val': 0.0007238030012333859, 'batch_size': 2215, 'optimizer': 'SGD'}.
2026-06-03 14:24:31,058 - experiment_functions - INFO - Early stopping at epoch 500. Best Metrics: (0.0005755429444941889, 7.87058744725032e-05, 0.00027055623897405623)
2026-06-03 14:24:31,157 - optuna.study.study - INFO - Trial 42 finished with values: [0.0005755429444941889, 7.87058744725032e-05, 0.00027055623897405623] and parameters: {'n_layers': 4, 'embedding_dim': 128, 'lr': 0.05653857837923815, 'lambda_val': 0.0004441980699182119, 'batch_size': 2024, 'optimizer': 'SGD'}.
2026-06-03 14:25:31,707 - experiment_functions - INFO - Early stopping at epoch 1600. Best Metrics: (0.0041298643081162725, 0.00122580213008239, 0.002632946528710173)
2026-06-03 14:25:31,799 - optuna.study.study - INFO - Trial 43 finished with values: [0.0041298643081162725, 0.00122580213008239, 0.002632946528710173] and parameters: {'n_layers': 2, 'embedding_dim': 64, 'lr': 0.00058211761161888, 'lambda_val': 0.0009043206687018967, 'batch_size': 571, 'optimizer': 'Adam'}.
2026-06-03 14:25:54,115 - experiment_functions - INFO - Early stopping at epoch 500. Best Metrics: (0.0004322575936880911, 7.870587447250317e-05, 0.0002220245688697124)
2026-06-03 14:25:54,210 - optuna.study.study - INFO - Trial 44 finished with values: [0.0004322575936880911, 7.870587447250317e-05, 0.0002220245688697124] and parameters: {'n_layers': 4, 'embedding_dim': 128, 'lr': 3.522851312138166e-05, 'lambda_val': 0.00014948839712825696, 'batch_size': 1920, 'optimizer': 'SGD'}.
2026-06-03 14:26:51,276 - experiment_functions - INFO - Early stopping at epoch 1550. Best Metrics: (0.0004147665780894756, 6.0285350659789674e-05, 0.00022171531450750434)
2026-06-03 14:26:52,090 - optuna.study.study - INFO - Trial 45 finished with values: [0.0004147665780894756, 6.0285350659789674e-05, 0.00022171531450750434] and parameters: {'n_layers': 1, 'embedding_dim': 64, 'lr': 2.7129716192412363e-05, 'lambda_val': 0.0007838720167323554, 'batch_size': 2387, 'optimizer': 'RMSprop'}.
2026-06-03 14:27:23,336 - experiment_functions - INFO - Early stopping at epoch 800. Best Metrics: (0.0043245745684873495, 0.0014937370219036774, 0.0030135387178432133)
2026-06-03 14:27:23,479 - optuna.study.study - INFO - Trial 46 finished with values: [0.0043245745684873495, 0.0014937370219036774, 0.0030135387178432133] and parameters: {'n_layers': 1, 'embedding_dim': 64, 'lr': 0.0008281403400701205, 'lambda_val': 0.0015102413658479369, 'batch_size': 2782, 'optimizer': 'RMSprop'}.
2026-06-03 14:30:32,377 - optuna.study.study - INFO - Trial 47 finished with values: [0.0023572535029625684, 0.0007887333377989149, 0.0016789318422621212] and parameters: {'n_layers': 4, 'embedding_dim': 256, 'lr': 9.669129164360957e-05, 'lambda_val': 9.660260844818593e-06, 'batch_size': 572, 'optimizer': 'RMSprop'}.
2026-06-03 14:30:55,181 - experiment_functions - INFO - Early stopping at epoch 550. Best Metrics: (0.002520107580727644, 0.0007317971732868913, 0.0016138695610880681)
2026-06-03 14:30:55,287 - optuna.study.study - INFO - Trial 48 finished with values: [0.002520107580727644, 0.0007317971732868913, 0.0016138695610880681] and parameters: {'n_layers': 3, 'embedding_dim': 64, 'lr': 0.006315240769324818, 'lambda_val': 1.780698705122307e-06, 'batch_size': 3776, 'optimizer': 'Adam'}.
2026-06-03 14:31:23,059 - experiment_functions - INFO - Early stopping at epoch 600. Best Metrics: (0.00042320730714131384, 0.00010215017750686584, 0.00025058170190567886)
2026-06-03 14:31:23,154 - optuna.study.study - INFO - Trial 49 finished with values: [0.00042320730714131384, 0.00010215017750686584, 0.00025058170190567886] and parameters: {'n_layers': 2, 'embedding_dim': 256, 'lr': 0.0034572215977821306, 'lambda_val': 0.08554437220257348, 'batch_size': 2611, 'optimizer': 'RMSprop'}.
2026-06-03 14:31:45,186 - experiment_functions - INFO - Early stopping at epoch 550. Best Metrics: (0.0004694036616151063, 0.00016411012124053855, 0.0003121430938319659)
