2026-06-04 03:18:34,303 - optuna.study.study - INFO - Trial 162 finished with values: [0.006298400097803775, 0.0009578672382611026, 0.0036799009317319232] and parameters: {'n_layers': 2, 'embedding_dim': 32, 'lr': 0.0007463197710430186, 'lambda_val': 0.0001888631680612503, 'batch_size': 2187, 'optimizer': 'Adam'}.
2026-06-04 03:19:29,027 - experiment_functions - INFO - Early stopping at epoch 1100. Best Metrics: (0.00752388960047633, 0.0012810637015205305, 0.0041408365497058695)
2026-06-04 03:19:29,526 - optuna.study.study - INFO - Trial 163 finished with values: [0.00752388960047633, 0.0012810637015205305, 0.0041408365497058695] and parameters: {'n_layers': 3, 'embedding_dim': 256, 'lr': 0.0036679476641700757, 'lambda_val': 4.115726125333198e-06, 'batch_size': 551, 'optimizer': 'RMSprop'}.
2026-06-04 03:19:50,486 - experiment_functions - INFO - Early stopping at epoch 500. Best Metrics: (0.002873968886230308, 0.00044879094380065646, 0.001600083059990477)
2026-06-04 03:19:50,849 - optuna.study.study - INFO - Trial 164 finished with values: [0.002873968886230308, 0.00044879094380065646, 0.001600083059990477] and parameters: {'n_layers': 4, 'embedding_dim': 32, 'lr': 0.08920899387991212, 'lambda_val': 0.00015132695924103293, 'batch_size': 870, 'optimizer': 'RMSprop'}.
2026-06-04 03:20:36,823 - experiment_functions - INFO - Early stopping at epoch 1000. Best Metrics: (0.008193494082893294, 0.0014552213812043671, 0.004786073103623444)
2026-06-04 03:20:36,985 - optuna.study.study - INFO - Trial 165 finished with values: [0.008193494082893294, 0.0014552213812043671, 0.004786073103623444] and parameters: {'n_layers': 4, 'embedding_dim': 128, 'lr': 0.0009744505282133616, 'lambda_val': 2.6963455125652685e-06, 'batch_size': 3163, 'optimizer': 'Adam'}.
2026-06-04 03:20:59,597 - experiment_functions - INFO - Early stopping at epoch 550. Best Metrics: (0.005670290843200545, 0.0009176770044879094, 0.003065417420944294)
2026-06-04 03:20:59,713 - optuna.study.study - INFO - Trial 166 finished with values: [0.005670290843200545, 0.0009176770044879094, 0.003065417420944294] and parameters: {'n_layers': 4, 'embedding_dim': 32, 'lr': 0.01099734275168188, 'lambda_val': 1.576550139040942e-05, 'batch_size': 1752, 'optimizer': 'RMSprop'}.
2026-06-04 03:21:28,388 - experiment_functions - INFO - Early stopping at epoch 550. Best Metrics: (0.005129683870527964, 0.0008691138053453011, 0.0029265236140039327)
2026-06-04 03:21:29,618 - optuna.study.study - INFO - Trial 167 finished with values: [0.005129683870527964, 0.0008691138053453011, 0.0029265236140039327] and parameters: {'n_layers': 3, 'embedding_dim': 256, 'lr': 0.02115907509102826, 'lambda_val': 7.0617547058187465e-06, 'batch_size': 1720, 'optimizer': 'RMSprop'}.
2026-06-04 03:21:52,018 - experiment_functions - INFO - Early stopping at epoch 550. Best Metrics: (0.0025318318320907245, 0.0004236720476924108, 0.0014889412131984172)
2026-06-04 03:21:52,140 - optuna.study.study - INFO - Trial 168 finished with values: [0.0025318318320907245, 0.0004236720476924108, 0.0014889412131984172] and parameters: {'n_layers': 3, 'embedding_dim': 32, 'lr': 0.05634408624233993, 'lambda_val': 0.0037563821735760064, 'batch_size': 1296, 'optimizer': 'Adam'}.
2026-06-04 03:22:17,807 - experiment_functions - INFO - Early stopping at epoch 550. Best Metrics: (0.004962360385625518, 0.0009126532252662603, 0.0027833800957913625)
2026-06-04 03:22:18,878 - optuna.study.study - INFO - Trial 169 finished with values: [0.004962360385625518, 0.0009126532252662603, 0.0027833800957913625] and parameters: {'n_layers': 4, 'embedding_dim': 128, 'lr': 0.010519255162305941, 'lambda_val': 0.0016044761768607098, 'batch_size': 1344, 'optimizer': 'RMSprop'}.
2026-06-04 03:24:56,276 - optuna.study.study - INFO - Trial 170 finished with values: [0.006483826324328253, 0.0011186281733538753, 0.003685332965912316] and parameters: {'n_layers': 2, 'embedding_dim': 128, 'lr': 0.0006097425316287412, 'lambda_val': 2.2435960383986775e-06, 'batch_size': 3903, 'optimizer': 'Adam'}.
2026-06-04 03:27:16,890 - experiment_functions - INFO - Early stopping at epoch 2800. Best Metrics: (0.0005770354194922806, 8.205506062026927e-05, 0.0002612593114733436)
2026-06-04 03:27:17,029 - optuna.study.study - INFO - Trial 171 finished with values: [0.0005770354194922806, 8.205506062026927e-05, 0.0002612593114733436] and parameters: {'n_layers': 4, 'embedding_dim': 256, 'lr': 3.304091512477082e-05, 'lambda_val': 2.6963455125652685e-06, 'batch_size': 727, 'optimizer': 'RMSprop'}.
2026-06-04 03:27:41,155 - experiment_functions - INFO - Early stopping at epoch 600. Best Metrics: (0.004495398947844864, 0.0007585906624690201, 0.002680146003431052)
2026-06-04 03:27:41,253 - optuna.study.study - INFO - Trial 172 finished with values: [0.004495398947844864, 0.0007585906624690201, 0.002680146003431052] and parameters: {'n_layers': 2, 'embedding_dim': 32, 'lr': 0.005720533217630053, 'lambda_val': 2.6963455125652685e-06, 'batch_size': 3299, 'optimizer': 'RMSprop'}.
2026-06-04 03:29:29,236 - experiment_functions - INFO - Early stopping at epoch 2900. Best Metrics: (0.006271187604352411, 0.0010348985196597228, 0.0037168811268797706)
2026-06-04 03:29:29,428 - optuna.study.study - INFO - Trial 173 finished with values: [0.006271187604352411, 0.0010348985196597228, 0.0037168811268797706] and parameters: {'n_layers': 2, 'embedding_dim': 64, 'lr': 0.0006097425316287412, 'lambda_val': 2.2435960383986775e-06, 'batch_size': 3903, 'optimizer': 'Adam'}.
2026-06-04 03:29:56,201 - experiment_functions - INFO - Early stopping at epoch 600. Best Metrics: (0.005967443969004254, 0.0010215017750686585, 0.003435505438716879)
2026-06-04 03:29:56,791 - optuna.study.study - INFO - Trial 174 finished with values: [0.005967443969004254, 0.0010215017750686585, 0.003435505438716879] and parameters: {'n_layers': 3, 'embedding_dim': 128, 'lr': 0.005720533217630053, 'lambda_val': 0.0037563821735760064, 'batch_size': 1296, 'optimizer': 'Adam'}.
2026-06-04 03:32:54,066 - optuna.study.study - INFO - Trial 175 finished with values: [0.002506912339917807, 0.00035668832473708886, 0.0014751975541279078] and parameters: {'n_layers': 2, 'embedding_dim': 256, 'lr': 0.00015842116483563462, 'lambda_val': 0.0016415700559882936, 'batch_size': 2513, 'optimizer': 'RMSprop'}.
2026-06-04 03:33:34,266 - experiment_functions - INFO - Early stopping at epoch 850. Best Metrics: (0.005690195406679098, 0.0009913590997387635, 0.0032014282107470896)
2026-06-04 03:33:34,375 - optuna.study.study - INFO - Trial 176 finished with values: [0.005690195406679098, 0.0009913590997387635, 0.0032014282107470896] and parameters: {'n_layers': 2, 'embedding_dim': 256, 'lr': 0.005091659899861729, 'lambda_val': 8.472875869813855e-05, 'batch_size': 1158, 'optimizer': 'Adam'}.
2026-06-04 03:36:10,904 - optuna.study.study - INFO - Trial 177 finished with values: [0.00467712979937944, 0.000792082523946681, 0.0027991610651228135] and parameters: {'n_layers': 4, 'embedding_dim': 64, 'lr': 0.00020852731164978597, 'lambda_val': 0.004181259159598131, 'batch_size': 3299, 'optimizer': 'RMSprop'}.
2026-06-04 03:36:48,965 - experiment_functions - INFO - Early stopping at epoch 900. Best Metrics: (0.011068388261035693, 0.001970996047960346, 0.0065717138073256905)
2026-06-04 03:36:49,080 - optuna.study.study - INFO - Trial 178 finished with values: [0.011068388261035693, 0.001970996047960346, 0.0065717138073256905] and parameters: {'n_layers': 4, 'embedding_dim': 64, 'lr': 0.0025795756581398536, 'lambda_val': 0.00015132695924103293, 'batch_size': 679, 'optimizer': 'RMSprop'}.
2026-06-04 03:37:17,681 - experiment_functions - INFO - Early stopping at epoch 700. Best Metrics: (0.00474354926912486, 0.0008071538616116284, 0.0027846639772634027)
2026-06-04 03:37:17,805 - optuna.study.study - INFO - Trial 179 finished with values: [0.00474354926912486, 0.0008071538616116284, 0.0027846639772634027] and parameters: {'n_layers': 2, 'embedding_dim': 64, 'lr': 0.005091659899861729, 'lambda_val': 8.472875869813855e-05, 'batch_size': 3054, 'optimizer': 'RMSprop'}.
2026-06-04 03:37:49,031 - experiment_functions - INFO - Early stopping at epoch 800. Best Metrics: (0.004842948276337837, 0.000755241476321254, 0.0026529512153084913)
2026-06-04 03:37:50,028 - optuna.study.study - INFO - Trial 180 finished with values: [0.004842948276337837, 0.000755241476321254, 0.0026529512153084913] and parameters: {'n_layers': 2, 'embedding_dim': 32, 'lr': 0.004277274112037138, 'lambda_val': 2.6963455125652685e-06, 'batch_size': 3299, 'optimizer': 'Adam'}.
2026-06-04 03:39:00,734 - experiment_functions - INFO - Early stopping at epoch 1500. Best Metrics: (0.0045656738325249475, 0.0008925581083796639, 0.0026378568377213585)
2026-06-04 03:39:00,830 - optuna.study.study - INFO - Trial 181 finished with values: [0.0045656738325249475, 0.0008925581083796639, 0.0026378568377213585] and parameters: {'n_layers': 2, 'embedding_dim': 256, 'lr': 0.0008797904665419303, 'lambda_val': 0.07904926929886606, 'batch_size': 2895, 'optimizer': 'Adam'}.
2026-06-04 03:39:38,720 - experiment_functions - INFO - Early stopping at epoch 800. Best Metrics: (0.005593677025925337, 0.000979636948221582, 0.0030921322511653607)
2026-06-04 03:39:38,839 - optuna.study.study - INFO - Trial 182 finished with values: [0.005593677025925337, 0.000979636948221582, 0.0030921322511653607] and parameters: {'n_layers': 2, 'embedding_dim': 256, 'lr': 0.01099734275168188, 'lambda_val': 2.9094394994277735e-06, 'batch_size': 679, 'optimizer': 'RMSprop'}.
2026-06-04 03:42:09,123 - optuna.study.study - INFO - Trial 183 finished with values: [0.006981882464707258, 0.0010985330564672786, 0.004061316186601854] and parameters: {'n_layers': 2, 'embedding_dim': 64, 'lr': 0.0006097425316287412, 'lambda_val': 5.282448475572872e-06, 'batch_size': 2271, 'optimizer': 'Adam'}.
2026-06-04 03:42:51,014 - experiment_functions - INFO - Early stopping at epoch 1000. Best Metrics: (0.0059592154759474155, 0.0010717395672851498, 0.0035065606410817733)
2026-06-04 03:42:51,477 - optuna.study.study - INFO - Trial 184 finished with values: [0.0059592154759474155, 0.0010717395672851498, 0.0035065606410817733] and parameters: {'n_layers': 2, 'embedding_dim': 128, 'lr': 0.005720533217630053, 'lambda_val': 2.9094394994277735e-06, 'batch_size': 679, 'optimizer': 'RMSprop'}.
2026-06-04 03:43:55,395 - experiment_functions - INFO - Early stopping at epoch 1500. Best Metrics: (0.005953879876879166, 0.001041596891955255, 0.0035782529433580693)
2026-06-04 03:43:55,570 - optuna.study.study - INFO - Trial 185 finished with values: [0.005953879876879166, 0.001041596891955255, 0.0035782529433580693] and parameters: {'n_layers': 1, 'embedding_dim': 256, 'lr': 0.0025795756581398536, 'lambda_val': 1.7827761161994677e-05, 'batch_size': 679, 'optimizer': 'RMSprop'}.
2026-06-04 03:44:36,256 - experiment_functions - INFO - Early stopping at epoch 1050. Best Metrics: (0.008464198841447846, 0.0013815392859535132, 0.004864961655838177)
2026-06-04 03:44:36,631 - optuna.study.study - INFO - Trial 186 finished with values: [0.008464198841447846, 0.0013815392859535132, 0.004864961655838177] and parameters: {'n_layers': 3, 'embedding_dim': 32, 'lr': 0.0022306925911484794, 'lambda_val': 8.472875869813855e-05, 'batch_size': 1158, 'optimizer': 'Adam'}.
2026-06-04 03:47:04,334 - optuna.study.study - INFO - Trial 187 finished with values: [0.010013772703064602, 0.0017114341215084732, 0.005951738093207922] and parameters: {'n_layers': 3, 'embedding_dim': 32, 'lr': 0.0007463197710430186, 'lambda_val': 0.0001888631680612503, 'batch_size': 1752, 'optimizer': 'RMSprop'}.
2026-06-04 03:47:38,036 - experiment_functions - INFO - Early stopping at epoch 700. Best Metrics: (0.005153501314688502, 0.0009478196798178043, 0.0030459038600849486)
2026-06-04 03:47:38,165 - optuna.study.study - INFO - Trial 188 finished with values: [0.005153501314688502, 0.0009478196798178043, 0.0030459038600849486] and parameters: {'n_layers': 2, 'embedding_dim': 256, 'lr': 0.0047397061985766835, 'lambda_val': 7.753300191826788e-06, 'batch_size': 3931, 'optimizer': 'RMSprop'}.
2026-06-04 03:48:21,999 - experiment_functions - INFO - Early stopping at epoch 1150. Best Metrics: (0.005989274687307713, 0.0010399222988813719, 0.0035753247382496337)
2026-06-04 03:48:22,127 - optuna.study.study - INFO - Trial 189 finished with values: [0.005989274687307713, 0.0010399222988813719, 0.0035753247382496337] and parameters: {'n_layers': 2, 'embedding_dim': 32, 'lr': 0.005720533217630053, 'lambda_val': 2.9094394994277735e-06, 'batch_size': 679, 'optimizer': 'RMSprop'}.
2026-06-04 03:48:49,206 - experiment_functions - INFO - Early stopping at epoch 550. Best Metrics: (0.005047051245198031, 0.000899256480675196, 0.0028961438387558286)
2026-06-04 03:48:49,404 - optuna.study.study - INFO - Trial 190 finished with values: [0.005047051245198031, 0.000899256480675196, 0.0028961438387558286] and parameters: {'n_layers': 2, 'embedding_dim': 256, 'lr': 0.004527047386587098, 'lambda_val': 0.0016415700559882936, 'batch_size': 4069, 'optimizer': 'RMSprop'}.
2026-06-04 03:49:17,503 - experiment_functions - INFO - Early stopping at epoch 650. Best Metrics: (0.005271085281984911, 0.0009193515975617927, 0.003017079319864387)
2026-06-04 03:49:17,642 - optuna.study.study - INFO - Trial 191 finished with values: [0.005271085281984911, 0.0009193515975617927, 0.003017079319864387] and parameters: {'n_layers': 2, 'embedding_dim': 128, 'lr': 0.010519255162305941, 'lambda_val': 1.7827761161994677e-05, 'batch_size': 2490, 'optimizer': 'Adam'}.
2026-06-04 03:52:38,227 - optuna.study.study - INFO - Trial 192 finished with values: [0.002374369887039786, 0.00032654564940719406, 0.001280989866112607] and parameters: {'n_layers': 4, 'embedding_dim': 256, 'lr': 0.00016523333469178715, 'lambda_val': 0.0009333372636037136, 'batch_size': 679, 'optimizer': 'RMSprop'}.
2026-06-04 03:53:08,933 - experiment_functions - INFO - Early stopping at epoch 550. Best Metrics: (0.007197220351814469, 0.0012291513162301562, 0.003895739734673594)
2026-06-04 03:53:10,582 - optuna.study.study - INFO - Trial 193 finished with values: [0.007197220351814469, 0.0012291513162301562, 0.003895739734673594] and parameters: {'n_layers': 4, 'embedding_dim': 256, 'lr': 0.010519255162305941, 'lambda_val': 1.9870285249823955e-06, 'batch_size': 1943, 'optimizer': 'Adam'}.
2026-06-04 03:53:40,680 - experiment_functions - INFO - Early stopping at epoch 550. Best Metrics: (0.0005075251113309065, 7.535668832473711e-05, 0.00023760949787668151)
2026-06-04 03:53:40,798 - optuna.study.study - INFO - Trial 194 finished with values: [0.0005075251113309065, 7.535668832473711e-05, 0.00023760949787668151] and parameters: {'n_layers': 4, 'embedding_dim': 256, 'lr': 1.5692671984514655e-05, 'lambda_val': 0.03809846794796893, 'batch_size': 1158, 'optimizer': 'Adam'}.
2026-06-04 03:55:48,378 - experiment_functions - INFO - Early stopping at epoch 3350. Best Metrics: (0.005611465166685872, 0.0008640900261236519, 0.0031344279440377594)
2026-06-04 03:55:48,493 - optuna.study.study - INFO - Trial 195 finished with values: [0.005611465166685872, 0.0008640900261236519, 0.0031344279440377594] and parameters: {'n_layers': 1, 'embedding_dim': 128, 'lr': 0.0009744505282133616, 'lambda_val': 1.7827761161994677e-05, 'batch_size': 2067, 'optimizer': 'Adam'}.
2026-06-04 03:56:11,031 - experiment_functions - INFO - Early stopping at epoch 550. Best Metrics: (0.00561238620095861, 0.0010348985196597228, 0.0033388634426189607)
2026-06-04 03:56:11,220 - optuna.study.study - INFO - Trial 196 finished with values: [0.00561238620095861, 0.0010348985196597228, 0.0033388634426189607] and parameters: {'n_layers': 4, 'embedding_dim': 32, 'lr': 0.0036679476641700757, 'lambda_val': 0.004793538018256415, 'batch_size': 1752, 'optimizer': 'RMSprop'}.
2026-06-04 03:56:31,955 - experiment_functions - INFO - Early stopping at epoch 500. Best Metrics: (0.0005145100897600133, 9.210261906356756e-05, 0.0002523495454098363)
2026-06-04 03:56:33,089 - optuna.study.study - INFO - Trial 197 finished with values: [0.0005145100897600133, 9.210261906356756e-05, 0.0002523495454098363] and parameters: {'n_layers': 2, 'embedding_dim': 64, 'lr': 0.00020852731164978597, 'lambda_val': 0.004181259159598131, 'batch_size': 1028, 'optimizer': 'SGD'}.
2026-06-04 03:57:08,004 - experiment_functions - INFO - Early stopping at epoch 750. Best Metrics: (0.005052851074200604, 0.0009612164244088686, 0.002876619895645178)
2026-06-04 03:57:08,679 - optuna.study.study - INFO - Trial 198 finished with values: [0.005052851074200604, 0.0009612164244088686, 0.002876619895645178] and parameters: {'n_layers': 4, 'embedding_dim': 128, 'lr': 0.0008797904665419303, 'lambda_val': 0.04457108840670691, 'batch_size': 3163, 'optimizer': 'RMSprop'}.
2026-06-04 03:58:02,228 - experiment_functions - INFO - Early stopping at epoch 1300. Best Metrics: (0.007531208179338301, 0.0012793891084466476, 0.004134546726692251)
2026-06-04 03:58:02,398 - optuna.study.study - INFO - Trial 199 finished with values: [0.007531208179338301, 0.0012793891084466476, 0.004134546726692251] and parameters: {'n_layers': 2, 'embedding_dim': 128, 'lr': 0.0008797904665419303, 'lambda_val': 0.00026012148846087845, 'batch_size': 3163, 'optimizer': 'RMSprop'}.
2026-06-04 03:58:40,632 - experiment_functions - INFO - Early stopping at epoch 800. Best Metrics: (0.0052245829948013075, 0.0009243753767834418, 0.0029348763823340398)
2026-06-04 03:58:41,030 - optuna.study.study - INFO - Trial 200 finished with values: [0.0052245829948013075, 0.0009243753767834418, 0.0029348763823340398] and parameters: {'n_layers': 2, 'embedding_dim': 256, 'lr': 0.010519255162305941, 'lambda_val': 8.472875869813855e-05, 'batch_size': 1943, 'optimizer': 'Adam'}.
2026-06-04 03:59:44,248 - experiment_functions - INFO - Early stopping at epoch 1200. Best Metrics: (0.005746992167977469, 0.0011470962556098868, 0.0033702863457498334)
2026-06-04 03:59:44,550 - optuna.study.study - INFO - Trial 201 finished with values: [0.005746992167977469, 0.0011470962556098868, 0.0033702863457498334] and parameters: {'n_layers': 4, 'embedding_dim': 256, 'lr': 0.0006097425316287412, 'lambda_val': 0.011676963975868567, 'batch_size': 2352, 'optimizer': 'Adam'}.
2026-06-04 04:00:57,303 - experiment_functions - INFO - Early stopping at epoch 1600. Best Metrics: (0.006459596780213754, 0.0012057070131957935, 0.0036709021643878854)
2026-06-04 04:00:57,416 - optuna.study.study - INFO - Trial 202 finished with values: [0.006459596780213754, 0.0012057070131957935, 0.0036709021643878854] and parameters: {'n_layers': 2, 'embedding_dim': 256, 'lr': 0.0008797904665419303, 'lambda_val': 0.00014816809310452117, 'batch_size': 3054, 'optimizer': 'RMSprop'}.
2026-06-04 04:01:26,265 - experiment_functions - INFO - Early stopping at epoch 550. Best Metrics: (0.0053051538943153604, 0.0009494942728916874, 0.003082780961300948)
2026-06-04 04:01:26,393 - optuna.study.study - INFO - Trial 203 finished with values: [0.0053051538943153604, 0.0009494942728916874, 0.003082780961300948] and parameters: {'n_layers': 3, 'embedding_dim': 256, 'lr': 0.005720533217630053, 'lambda_val': 0.0037563821735760064, 'batch_size': 3710, 'optimizer': 'Adam'}.
2026-06-04 04:02:16,155 - experiment_functions - INFO - Early stopping at epoch 1000. Best Metrics: (0.0077797322888934475, 0.0013095317837765424, 0.004204220427236438)
2026-06-04 04:02:16,283 - optuna.study.study - INFO - Trial 204 finished with values: [0.0077797322888934475, 0.0013095317837765424, 0.004204220427236438] and parameters: {'n_layers': 3, 'embedding_dim': 256, 'lr': 0.0036679476641700757, 'lambda_val': 4.115726125333198e-06, 'batch_size': 551, 'optimizer': 'Adam'}.
2026-06-04 04:02:43,569 - experiment_functions - INFO - Early stopping at epoch 600. Best Metrics: (0.006071584085292776, 0.0010767633465067988, 0.0035760309263392293)
2026-06-04 04:02:43,770 - optuna.study.study - INFO - Trial 205 finished with values: [0.006071584085292776, 0.0010767633465067988, 0.0035760309263392293] and parameters: {'n_layers': 3, 'embedding_dim': 128, 'lr': 0.010519255162305941, 'lambda_val': 0.00019051966138526212, 'batch_size': 1943, 'optimizer': 'Adam'}.
2026-06-04 04:05:55,561 - optuna.study.study - INFO - Trial 206 finished with values: [0.006475095958371384, 0.0010750887534329158, 0.003653285616408596] and parameters: {'n_layers': 3, 'embedding_dim': 256, 'lr': 0.00023426949296573345, 'lambda_val': 2.2435960383986775e-06, 'batch_size': 3903, 'optimizer': 'Adam'}.
2026-06-04 04:06:38,409 - experiment_functions - INFO - Early stopping at epoch 800. Best Metrics: (0.00806241736890523, 0.001480340277312613, 0.004533261386175838)
2026-06-04 04:06:38,783 - optuna.study.study - INFO - Trial 207 finished with values: [0.00806241736890523, 0.001480340277312613, 0.004533261386175838] and parameters: {'n_layers': 4, 'embedding_dim': 256, 'lr': 0.0009744505282133616, 'lambda_val': 1.6132262100968452e-05, 'batch_size': 3299, 'optimizer': 'RMSprop'}.
2026-06-04 04:09:13,860 - optuna.study.study - INFO - Trial 208 finished with values: [0.0013625749909029988, 0.00018922901734878423, 0.000681017113035645] and parameters: {'n_layers': 4, 'embedding_dim': 64, 'lr': 9.470416598454048e-05, 'lambda_val': 8.472875869813855e-05, 'batch_size': 3163, 'optimizer': 'RMSprop'}.
2026-06-04 04:09:43,887 - experiment_functions - INFO - Early stopping at epoch 650. Best Metrics: (0.0075740666803349194, 0.0013664679482885658, 0.004239799495483463)
2026-06-04 04:09:44,341 - optuna.study.study - INFO - Trial 209 finished with values: [0.0075740666803349194, 0.0013664679482885658, 0.004239799495483463] and parameters: {'n_layers': 4, 'embedding_dim': 128, 'lr': 0.0036679476641700757, 'lambda_val': 0.00015132695924103293, 'batch_size': 870, 'optimizer': 'RMSprop'}.
2026-06-04 04:10:40,061 - experiment_functions - INFO - Early stopping at epoch 1250. Best Metrics: (0.008201598005213662, 0.001508808359568625, 0.00471411146674239)
