2026-06-03 14:31:46,437 - optuna.study.study - INFO - Trial 50 finished with values: [0.0004694036616151063, 0.00016411012124053855, 0.0003121430938319659] and parameters: {'n_layers': 3, 'embedding_dim': 32, 'lr': 0.008813340023110926, 'lambda_val': 0.025990812764396166, 'batch_size': 946, 'optimizer': 'RMSprop'}.
2026-06-03 14:32:09,122 - experiment_functions - INFO - Early stopping at epoch 550. Best Metrics: (0.0019729362636173313, 0.0007066782771786458, 0.0014260377985467598)
2026-06-03 14:32:09,229 - optuna.study.study - INFO - Trial 51 finished with values: [0.0019729362636173313, 0.0007066782771786458, 0.0014260377985467598] and parameters: {'n_layers': 1, 'embedding_dim': 128, 'lr': 0.008051524614722692, 'lambda_val': 0.001214972879722574, 'batch_size': 1352, 'optimizer': 'RMSprop'}.
2026-06-03 14:32:31,264 - experiment_functions - INFO - Early stopping at epoch 550. Best Metrics: (0.0031171369635569217, 0.0009846607274432314, 0.0021069135256341362)
2026-06-03 14:32:31,352 - optuna.study.study - INFO - Trial 52 finished with values: [0.0031171369635569217, 0.0009846607274432314, 0.0021069135256341362] and parameters: {'n_layers': 2, 'embedding_dim': 32, 'lr': 0.008813340023110926, 'lambda_val': 2.2072560753305147e-05, 'batch_size': 2094, 'optimizer': 'Adam'}.
2026-06-03 14:33:00,232 - experiment_functions - INFO - Early stopping at epoch 750. Best Metrics: (0.004357006300562747, 0.001356420389845268, 0.002891523334254819)
2026-06-03 14:33:00,949 - optuna.study.study - INFO - Trial 53 finished with values: [0.004357006300562747, 0.001356420389845268, 0.002891523334254819] and parameters: {'n_layers': 1, 'embedding_dim': 32, 'lr': 0.0018644973108911816, 'lambda_val': 2.2072560753305147e-05, 'batch_size': 2526, 'optimizer': 'RMSprop'}.
2026-06-03 14:33:22,901 - experiment_functions - INFO - Early stopping at epoch 500. Best Metrics: (0.0004900872986088157, 7.703128139862015e-05, 0.00021686029233983721)
2026-06-03 14:33:23,080 - optuna.study.study - INFO - Trial 54 finished with values: [0.0004900872986088157, 7.703128139862015e-05, 0.00021686029233983721] and parameters: {'n_layers': 1, 'embedding_dim': 256, 'lr': 0.027452240930335613, 'lambda_val': 0.08574261741727777, 'batch_size': 3377, 'optimizer': 'SGD'}.
2026-06-03 14:35:38,807 - experiment_functions - INFO - Early stopping at epoch 3500. Best Metrics: (0.003941644569899272, 0.0012961350391854781, 0.0026060865112095804)
2026-06-03 14:35:38,908 - optuna.study.study - INFO - Trial 55 finished with values: [0.003941644569899272, 0.0012961350391854781, 0.0026060865112095804] and parameters: {'n_layers': 2, 'embedding_dim': 128, 'lr': 0.00024535156098645997, 'lambda_val': 0.0006859838564406128, 'batch_size': 2083, 'optimizer': 'RMSprop'}.
2026-06-03 14:36:04,749 - experiment_functions - INFO - Early stopping at epoch 500. Best Metrics: (0.0005974549594380677, 7.703128139862013e-05, 0.0002598497028045171)
2026-06-03 14:36:05,095 - optuna.study.study - INFO - Trial 56 finished with values: [0.0005974549594380677, 7.703128139862013e-05, 0.0002598497028045171] and parameters: {'n_layers': 4, 'embedding_dim': 256, 'lr': 3.9304375700492786e-05, 'lambda_val': 0.0034808140996535246, 'batch_size': 572, 'optimizer': 'RMSprop'}.
2026-06-03 14:37:12,052 - experiment_functions - INFO - Early stopping at epoch 1750. Best Metrics: (0.0015037396210504743, 0.0006581150780360373, 0.001223631002627577)
2026-06-03 14:37:12,189 - optuna.study.study - INFO - Trial 57 finished with values: [0.0015037396210504743, 0.0006581150780360373, 0.001223631002627577] and parameters: {'n_layers': 3, 'embedding_dim': 64, 'lr': 0.014207108552616627, 'lambda_val': 3.8315457306143855e-05, 'batch_size': 2782, 'optimizer': 'RMSprop'}.
2026-06-03 14:37:50,069 - experiment_functions - INFO - Early stopping at epoch 800. Best Metrics: (0.0007540627083738486, 0.00017415767968383683, 0.000423020905660906)
2026-06-03 14:37:50,228 - optuna.study.study - INFO - Trial 58 finished with values: [0.0007540627083738486, 0.00017415767968383683, 0.000423020905660906] and parameters: {'n_layers': 3, 'embedding_dim': 256, 'lr': 0.001246415066793532, 'lambda_val': 0.050506142150434294, 'batch_size': 2369, 'optimizer': 'RMSprop'}.
2026-06-03 14:38:18,968 - experiment_functions - INFO - Early stopping at epoch 550. Best Metrics: (0.0015669729805259168, 0.0004638622814656039, 0.0010056553458186175)
2026-06-03 14:38:19,064 - optuna.study.study - INFO - Trial 59 finished with values: [0.0015669729805259168, 0.0004638622814656039, 0.0010056553458186175] and parameters: {'n_layers': 4, 'embedding_dim': 256, 'lr': 0.006315240769324818, 'lambda_val': 7.927121361608539e-05, 'batch_size': 3776, 'optimizer': 'Adam'}.
2026-06-03 14:38:48,340 - experiment_functions - INFO - Early stopping at epoch 600. Best Metrics: (0.00214362801308624, 0.0005459173420858731, 0.001388936889045924)
2026-06-03 14:38:48,745 - optuna.study.study - INFO - Trial 60 finished with values: [0.00214362801308624, 0.0005459173420858731, 0.001388936889045924] and parameters: {'n_layers': 3, 'embedding_dim': 256, 'lr': 0.0008281403400701205, 'lambda_val': 0.0015102413658479369, 'batch_size': 3933, 'optimizer': 'RMSprop'}.
2026-06-03 14:40:29,344 - experiment_functions - INFO - Early stopping at epoch 2100. Best Metrics: (0.0032669519281909335, 0.0009528434590394537, 0.0021855701986010965)
2026-06-03 14:40:29,437 - optuna.study.study - INFO - Trial 61 finished with values: [0.0032669519281909335, 0.0009528434590394537, 0.0021855701986010965] and parameters: {'n_layers': 4, 'embedding_dim': 256, 'lr': 0.00021948009255211227, 'lambda_val': 7.927121361608539e-05, 'batch_size': 1865, 'optimizer': 'RMSprop'}.
2026-06-03 14:40:49,414 - experiment_functions - INFO - Early stopping at epoch 500. Best Metrics: (0.0005643933570961245, 9.042802598968451e-05, 0.00026717933730645836)
2026-06-03 14:40:49,755 - optuna.study.study - INFO - Trial 62 finished with values: [0.0005643933570961245, 9.042802598968451e-05, 0.00026717933730645836] and parameters: {'n_layers': 3, 'embedding_dim': 32, 'lr': 0.005937274594324768, 'lambda_val': 0.00017827865769578737, 'batch_size': 711, 'optimizer': 'SGD'}.
2026-06-03 14:41:10,152 - experiment_functions - INFO - Early stopping at epoch 500. Best Metrics: (0.0004833996578006709, 6.865831602920491e-05, 0.000262424399683139)
2026-06-03 14:41:10,528 - optuna.study.study - INFO - Trial 63 finished with values: [0.0004833996578006709, 6.865831602920491e-05, 0.000262424399683139] and parameters: {'n_layers': 1, 'embedding_dim': 96, 'lr': 0.008813340023110926, 'lambda_val': 0.00014948839712825696, 'batch_size': 1920, 'optimizer': 'SGD'}.
2026-06-03 14:41:31,673 - experiment_functions - INFO - Early stopping at epoch 500. Best Metrics: (0.0006488118358544362, 0.00017750686583160294, 0.0004163211945435497)
2026-06-03 14:41:32,047 - optuna.study.study - INFO - Trial 64 finished with values: [0.0006488118358544362, 0.00017750686583160294, 0.0004163211945435497] and parameters: {'n_layers': 4, 'embedding_dim': 64, 'lr': 0.013177047583454147, 'lambda_val': 0.04082003162769642, 'batch_size': 3317, 'optimizer': 'RMSprop'}.
2026-06-03 14:41:58,898 - experiment_functions - INFO - Early stopping at epoch 600. Best Metrics: (0.003743838379040671, 0.0016009109786321925, 0.0029530255189139467)
2026-06-03 14:41:59,016 - optuna.study.study - INFO - Trial 65 finished with values: [0.003743838379040671, 0.0016009109786321925, 0.0029530255189139467] and parameters: {'n_layers': 1, 'embedding_dim': 256, 'lr': 0.0026782183131133443, 'lambda_val': 0.011209840484258635, 'batch_size': 2215, 'optimizer': 'Adam'}.
2026-06-03 14:42:19,013 - experiment_functions - INFO - Early stopping at epoch 500. Best Metrics: (0.0004933729411564745, 6.865831602920491e-05, 0.00024415918356738523)
2026-06-03 14:42:19,099 - optuna.study.study - INFO - Trial 66 finished with values: [0.0004933729411564745, 6.865831602920491e-05, 0.00024415918356738523] and parameters: {'n_layers': 2, 'embedding_dim': 32, 'lr': 0.0554419983592766, 'lambda_val': 1.078600699229543e-06, 'batch_size': 1489, 'optimizer': 'SGD'}.
2026-06-03 14:42:41,614 - experiment_functions - INFO - Early stopping at epoch 550. Best Metrics: (0.0037130841323514225, 0.0011035568356889277, 0.00245730881912253)
2026-06-03 14:42:41,720 - optuna.study.study - INFO - Trial 67 finished with values: [0.0037130841323514225, 0.0011035568356889277, 0.00245730881912253] and parameters: {'n_layers': 2, 'embedding_dim': 64, 'lr': 0.006315240769324818, 'lambda_val': 1.780698705122307e-06, 'batch_size': 3052, 'optimizer': 'Adam'}.
2026-06-03 14:43:06,414 - experiment_functions - INFO - Early stopping at epoch 600. Best Metrics: (0.0014799514615932907, 0.0005794092035635341, 0.0011134244198643698)
2026-06-03 14:43:06,521 - optuna.study.study - INFO - Trial 68 finished with values: [0.0014799514615932907, 0.0005794092035635341, 0.0011134244198643698] and parameters: {'n_layers': 3, 'embedding_dim': 64, 'lr': 0.013177047583454147, 'lambda_val': 8.536566464955742e-05, 'batch_size': 3317, 'optimizer': 'RMSprop'}.
2026-06-03 14:43:32,841 - experiment_functions - INFO - Early stopping at epoch 600. Best Metrics: (0.002246762985961497, 0.0006681626364793356, 0.0014735733403642025)
2026-06-03 14:43:32,940 - optuna.study.study - INFO - Trial 69 finished with values: [0.002246762985961497, 0.0006681626364793356, 0.0014735733403642025] and parameters: {'n_layers': 3, 'embedding_dim': 128, 'lr': 0.0014552621483972018, 'lambda_val': 1.1560186574559926e-06, 'batch_size': 3896, 'optimizer': 'Adam'}.
2026-06-03 14:43:54,337 - experiment_functions - INFO - Early stopping at epoch 500. Best Metrics: (0.0006892874769688929, 0.0001406658182061759, 0.00034037489551090816)
2026-06-03 14:43:54,804 - optuna.study.study - INFO - Trial 70 finished with values: [0.0006892874769688929, 0.0001406658182061759, 0.00034037489551090816] and parameters: {'n_layers': 3, 'embedding_dim': 96, 'lr': 0.008813340023110926, 'lambda_val': 0.025990812764396166, 'batch_size': 2094, 'optimizer': 'RMSprop'}.
2026-06-03 14:44:15,120 - experiment_functions - INFO - Early stopping at epoch 500. Best Metrics: (0.0005282265053305716, 8.540424676803537e-05, 0.0003236191203809541)
2026-06-03 14:44:16,418 - optuna.study.study - INFO - Trial 71 finished with values: [0.0005282265053305716, 8.540424676803537e-05, 0.0003236191203809541] and parameters: {'n_layers': 4, 'embedding_dim': 32, 'lr': 0.0006158877725370185, 'lambda_val': 1.078600699229543e-06, 'batch_size': 1489, 'optimizer': 'SGD'}.
2026-06-03 14:44:44,390 - experiment_functions - INFO - Early stopping at epoch 700. Best Metrics: (0.0031193154660477743, 0.0012358496885256885, 0.002350564031876868)
2026-06-03 14:44:44,506 - optuna.study.study - INFO - Trial 72 finished with values: [0.0031193154660477743, 0.0012358496885256885, 0.002350564031876868] and parameters: {'n_layers': 1, 'embedding_dim': 96, 'lr': 0.0014552621483972018, 'lambda_val': 0.025990812764396166, 'batch_size': 1195, 'optimizer': 'Adam'}.
2026-06-03 14:45:24,235 - experiment_functions - INFO - Early stopping at epoch 800. Best Metrics: (0.0019497745806088809, 0.0005023779221649139, 0.0011742973745725567)
2026-06-03 14:45:24,342 - optuna.study.study - INFO - Trial 73 finished with values: [0.0019497745806088809, 0.0005023779221649139, 0.0011742973745725567] and parameters: {'n_layers': 4, 'embedding_dim': 256, 'lr': 0.0006158877725370185, 'lambda_val': 7.927121361608539e-05, 'batch_size': 1352, 'optimizer': 'RMSprop'}.
2026-06-03 14:45:46,338 - experiment_functions - INFO - Early stopping at epoch 500. Best Metrics: (0.00043819323812027683, 7.870587447250318e-05, 0.00023144709812600943)
2026-06-03 14:45:46,423 - optuna.study.study - INFO - Trial 74 finished with values: [0.00043819323812027683, 7.870587447250318e-05, 0.00023144709812600943] and parameters: {'n_layers': 1, 'embedding_dim': 256, 'lr': 0.05049828206105063, 'lambda_val': 4.660506017522071e-05, 'batch_size': 1105, 'optimizer': 'SGD'}.
2026-06-03 14:48:16,435 - optuna.study.study - INFO - Trial 75 finished with values: [0.0011128384312672954, 0.00040022774465804813, 0.0007083782377312701] and parameters: {'n_layers': 2, 'embedding_dim': 96, 'lr': 0.00013096205237201516, 'lambda_val': 0.02787805142092731, 'batch_size': 680, 'optimizer': 'RMSprop'}.
2026-06-03 14:50:39,701 - optuna.study.study - INFO - Trial 76 finished with values: [0.0012518655975302126, 0.0003483153593676736, 0.0007418036374862815] and parameters: {'n_layers': 1, 'embedding_dim': 32, 'lr': 0.00012220905263479506, 'lambda_val': 0.0015102413658479369, 'batch_size': 3317, 'optimizer': 'RMSprop'}.
2026-06-03 14:53:04,918 - optuna.study.study - INFO - Trial 77 finished with values: [0.0006740128301024533, 0.00013899122513229284, 0.0003418433372452229] and parameters: {'n_layers': 3, 'embedding_dim': 32, 'lr': 5.6635079794925213e-05, 'lambda_val': 9.853705387574286e-06, 'batch_size': 3495, 'optimizer': 'Adam'}.
2026-06-03 14:53:26,164 - experiment_functions - INFO - Early stopping at epoch 500. Best Metrics: (0.0005125176077592906, 7.368209525085404e-05, 0.000259964521937032)
2026-06-03 14:53:26,454 - optuna.study.study - INFO - Trial 78 finished with values: [0.0005125176077592906, 7.368209525085404e-05, 0.000259964521937032] and parameters: {'n_layers': 3, 'embedding_dim': 96, 'lr': 7.641807986617319e-05, 'lambda_val': 1.1033501035792517e-05, 'batch_size': 1314, 'optimizer': 'SGD'}.
2026-06-03 14:55:53,707 - optuna.study.study - INFO - Trial 79 finished with values: [0.0007188403898874816, 9.545180521133366e-05, 0.00031755345660825364] and parameters: {'n_layers': 4, 'embedding_dim': 32, 'lr': 2.868746326030908e-05, 'lambda_val': 2.2072560753305147e-05, 'batch_size': 2526, 'optimizer': 'Adam'}.
2026-06-03 14:56:18,739 - experiment_functions - INFO - Early stopping at epoch 600. Best Metrics: (0.001342454369972321, 0.00033324402170272627, 0.0007538560102826227)
2026-06-03 14:56:18,837 - optuna.study.study - INFO - Trial 80 finished with values: [0.001342454369972321, 0.00033324402170272627, 0.0007538560102826227] and parameters: {'n_layers': 4, 'embedding_dim': 64, 'lr': 0.002359676800056199, 'lambda_val': 3.565569212735739e-06, 'batch_size': 3645, 'optimizer': 'RMSprop'}.
2026-06-03 14:56:56,404 - experiment_functions - INFO - Early stopping at epoch 950. Best Metrics: (0.0011709072122311538, 0.0004956795498693818, 0.0009053458692346312)
2026-06-03 14:56:56,458 - optuna.study.study - INFO - Trial 81 finished with values: [0.0011709072122311538, 0.0004956795498693818, 0.0009053458692346312] and parameters: {'n_layers': 3, 'embedding_dim': 64, 'lr': 0.014207108552616627, 'lambda_val': 0.0004997820234959456, 'batch_size': 3933, 'optimizer': 'RMSprop'}.
2026-06-03 14:57:24,205 - experiment_functions - INFO - Early stopping at epoch 650. Best Metrics: (0.001871406666006827, 0.0005074017013865631, 0.0012153954283127338)
2026-06-03 14:57:24,281 - optuna.study.study - INFO - Trial 82 finished with values: [0.001871406666006827, 0.0005074017013865631, 0.0012153954283127338] and parameters: {'n_layers': 3, 'embedding_dim': 128, 'lr': 0.0008281403400701205, 'lambda_val': 0.0015102413658479369, 'batch_size': 1195, 'optimizer': 'RMSprop'}.
2026-06-03 14:57:56,915 - experiment_functions - INFO - Early stopping at epoch 850. Best Metrics: (0.005346835190240723, 0.0016779422600308126, 0.003661884101091211)
2026-06-03 14:57:57,001 - optuna.study.study - INFO - Trial 83 finished with values: [0.005346835190240723, 0.0016779422600308126, 0.003661884101091211] and parameters: {'n_layers': 1, 'embedding_dim': 32, 'lr': 0.0013766733587116105, 'lambda_val': 2.0098616241177373e-05, 'batch_size': 2263, 'optimizer': 'Adam'}.
2026-06-03 14:58:30,843 - experiment_functions - INFO - Early stopping at epoch 700. Best Metrics: (0.0006538978960276459, 0.00018420523812713512, 0.0004111608428020171)
2026-06-03 14:58:31,546 - optuna.study.study - INFO - Trial 84 finished with values: [0.0006538978960276459, 0.00018420523812713512, 0.0004111608428020171] and parameters: {'n_layers': 3, 'embedding_dim': 256, 'lr': 0.001246415066793532, 'lambda_val': 0.050506142150434294, 'batch_size': 1951, 'optimizer': 'Adam'}.
2026-06-03 14:58:52,832 - experiment_functions - INFO - Early stopping at epoch 500. Best Metrics: (0.001554580275885704, 0.0004203228615446446, 0.0009528006124577317)
2026-06-03 14:58:52,927 - optuna.study.study - INFO - Trial 85 finished with values: [0.001554580275885704, 0.0004203228615446446, 0.0009528006124577317] and parameters: {'n_layers': 4, 'embedding_dim': 64, 'lr': 0.01732801490461506, 'lambda_val': 0.003683137437388494, 'batch_size': 3933, 'optimizer': 'RMSprop'}.
2026-06-03 14:59:16,082 - experiment_functions - INFO - Early stopping at epoch 550. Best Metrics: (0.001489767879196433, 0.000468886060687253, 0.001011367854328084)
2026-06-03 14:59:16,167 - optuna.study.study - INFO - Trial 86 finished with values: [0.001489767879196433, 0.000468886060687253, 0.001011367854328084] and parameters: {'n_layers': 4, 'embedding_dim': 64, 'lr': 0.006376881120140814, 'lambda_val': 7.927121361608539e-05, 'batch_size': 1865, 'optimizer': 'RMSprop'}.
2026-06-03 14:59:42,509 - experiment_functions - INFO - Early stopping at epoch 500. Best Metrics: (0.001651648001228684, 0.0004889811775738496, 0.0011271025566286187)
2026-06-03 14:59:42,747 - optuna.study.study - INFO - Trial 87 finished with values: [0.001651648001228684, 0.0004889811775738496, 0.0011271025566286187] and parameters: {'n_layers': 4, 'embedding_dim': 256, 'lr': 0.09032174133742327, 'lambda_val': 0.0018117189258503353, 'batch_size': 3464, 'optimizer': 'Adam'}.
2026-06-03 15:02:27,178 - optuna.study.study - INFO - Trial 88 finished with values: [0.0056664809899379, 0.0020430035501373166, 0.004325963391798443] and parameters: {'n_layers': 1, 'embedding_dim': 256, 'lr': 0.0006158877725370185, 'lambda_val': 1.1031019465465648e-05, 'batch_size': 1352, 'optimizer': 'Adam'}.
2026-06-03 15:02:50,478 - experiment_functions - INFO - Early stopping at epoch 550. Best Metrics: (0.0013483346918727198, 0.0005341951905686919, 0.0010176002483536209)
2026-06-03 15:02:50,572 - optuna.study.study - INFO - Trial 89 finished with values: [0.0013483346918727198, 0.0005341951905686919, 0.0010176002483536209] and parameters: {'n_layers': 2, 'embedding_dim': 128, 'lr': 0.01506522012263809, 'lambda_val': 0.0006859838564406128, 'batch_size': 3776, 'optimizer': 'RMSprop'}.
2026-06-03 15:03:12,930 - experiment_functions - INFO - Early stopping at epoch 500. Best Metrics: (0.001773861829818765, 0.0004554893160961886, 0.001075608396350632)
2026-06-03 15:03:13,033 - optuna.study.study - INFO - Trial 90 finished with values: [0.001773861829818765, 0.0004554893160961886, 0.001075608396350632] and parameters: {'n_layers': 3, 'embedding_dim': 128, 'lr': 0.014207108552616627, 'lambda_val': 0.0005252719466354678, 'batch_size': 1534, 'optimizer': 'RMSprop'}.
2026-06-03 15:03:34,184 - experiment_functions - INFO - Early stopping at epoch 500. Best Metrics: (0.0004984157884473754, 8.038046754638624e-05, 0.0002476996653084867)
2026-06-03 15:03:34,990 - optuna.study.study - INFO - Trial 91 finished with values: [0.0004984157884473754, 8.038046754638624e-05, 0.0002476996653084867] and parameters: {'n_layers': 2, 'embedding_dim': 128, 'lr': 0.05653857837923815, 'lambda_val': 0.0004441980699182119, 'batch_size': 2024, 'optimizer': 'SGD'}.
2026-06-03 15:06:09,328 - optuna.study.study - INFO - Trial 92 finished with values: [0.001544466875159607, 0.00038013262777145167, 0.0008204049332070128] and parameters: {'n_layers': 3, 'embedding_dim': 96, 'lr': 7.641807986617319e-05, 'lambda_val': 1.1033501035792517e-05, 'batch_size': 3776, 'optimizer': 'RMSprop'}.
2026-06-03 15:06:31,801 - experiment_functions - INFO - Early stopping at epoch 500. Best Metrics: (0.0004378409226317178, 7.368209525085404e-05, 0.00020957424440211868)
2026-06-03 15:06:31,917 - optuna.study.study - INFO - Trial 93 finished with values: [0.0004378409226317178, 7.368209525085404e-05, 0.00020957424440211868] and parameters: {'n_layers': 4, 'embedding_dim': 128, 'lr': 0.00024535156098645997, 'lambda_val': 4.8514518913701034e-05, 'batch_size': 3933, 'optimizer': 'SGD'}.
2026-06-03 15:06:57,305 - experiment_functions - INFO - Early stopping at epoch 500. Best Metrics: (0.000393453488344575, 6.363453680755577e-05, 0.00024407045318273424)
2026-06-03 15:06:57,397 - optuna.study.study - INFO - Trial 94 finished with values: [0.000393453488344575, 6.363453680755577e-05, 0.00024407045318273424] and parameters: {'n_layers': 4, 'embedding_dim': 256, 'lr': 5.107534716812453e-05, 'lambda_val': 0.00248087812785119, 'batch_size': 2513, 'optimizer': 'SGD'}.
2026-06-03 15:07:19,549 - experiment_functions - INFO - Early stopping at epoch 550. Best Metrics: (0.0010785644798938716, 0.0003047759394467145, 0.0006504488410614093)
2026-06-03 15:07:19,635 - optuna.study.study - INFO - Trial 95 finished with values: [0.0010785644798938716, 0.0003047759394467145, 0.0006504488410614093] and parameters: {'n_layers': 4, 'embedding_dim': 32, 'lr': 0.008051524614722692, 'lambda_val': 0.00248087812785119, 'batch_size': 1491, 'optimizer': 'RMSprop'}.
2026-06-03 15:07:43,788 - experiment_functions - INFO - Early stopping at epoch 550. Best Metrics: (0.0015823696182654264, 0.0005358697836425749, 0.0011369089284707682)
2026-06-03 15:07:43,898 - optuna.study.study - INFO - Trial 96 finished with values: [0.0015823696182654264, 0.0005358697836425749, 0.0011369089284707682] and parameters: {'n_layers': 3, 'embedding_dim': 128, 'lr': 0.017956531398886245, 'lambda_val': 0.0002761722992457223, 'batch_size': 1446, 'optimizer': 'Adam'}.
2026-06-03 15:08:10,875 - experiment_functions - INFO - Early stopping at epoch 650. Best Metrics: (0.0010083496568506036, 0.0002277446580480943, 0.0005314244342124746)
