2026-06-04 09:10:20,554 - optuna.study.study - INFO - Trial 190 finished with values: [0.006212561527493654, 0.001080112532654565, 0.0037636141231477066] and parameters: {'n_layers': 2, 'embedding_dim': 32, 'lr': 0.0023047972503770693, 'lambda_val': 0.0002789985957451779, 'batch_size': 1839, 'optimizer': 'RMSprop'}.
2026-06-04 09:11:07,959 - experiment_functions - INFO - Early stopping at epoch 950. Best Metrics: (0.005888032081784287, 0.0011186281733538753, 0.0034070602530594414)
2026-06-04 09:11:08,247 - optuna.study.study - INFO - Trial 191 finished with values: [0.005888032081784287, 0.0011186281733538753, 0.0034070602530594414] and parameters: {'n_layers': 3, 'embedding_dim': 256, 'lr': 0.0009358706696693685, 'lambda_val': 0.0054022876436497684, 'batch_size': 3469, 'optimizer': 'Adam'}.
2026-06-04 09:11:53,626 - experiment_functions - INFO - Early stopping at epoch 1100. Best Metrics: (0.008290171717880141, 0.0013982852166923437, 0.004557436803860277)
2026-06-04 09:11:53,944 - optuna.study.study - INFO - Trial 192 finished with values: [0.008290171717880141, 0.0013982852166923437, 0.004557436803860277] and parameters: {'n_layers': 3, 'embedding_dim': 96, 'lr': 0.0023047972503770693, 'lambda_val': 4.830818973924614e-06, 'batch_size': 1423, 'optimizer': 'Adam'}.
2026-06-04 09:12:16,208 - experiment_functions - INFO - Early stopping at epoch 500. Best Metrics: (0.0005387116515128107, 8.038046754638624e-05, 0.00023287245325146394)
2026-06-04 09:12:16,293 - optuna.study.study - INFO - Trial 193 finished with values: [0.0005387116515128107, 8.038046754638624e-05, 0.00023287245325146394] and parameters: {'n_layers': 4, 'embedding_dim': 96, 'lr': 0.0015030608128443483, 'lambda_val': 4.446523827876978e-06, 'batch_size': 1344, 'optimizer': 'SGD'}.
2026-06-04 09:12:46,425 - experiment_functions - INFO - Early stopping at epoch 550. Best Metrics: (0.005222989931749595, 0.000969589389778284, 0.0029770842791261103)
2026-06-04 09:12:46,523 - optuna.study.study - INFO - Trial 194 finished with values: [0.005222989931749595, 0.000969589389778284, 0.0029770842791261103] and parameters: {'n_layers': 4, 'embedding_dim': 256, 'lr': 0.0044385330633786016, 'lambda_val': 0.0028698778902023414, 'batch_size': 3649, 'optimizer': 'RMSprop'}.
2026-06-04 09:14:08,893 - experiment_functions - INFO - Early stopping at epoch 1600. Best Metrics: (0.005724121565334476, 0.0011253265456494072, 0.003378022571902383)
2026-06-04 09:14:08,979 - optuna.study.study - INFO - Trial 195 finished with values: [0.005724121565334476, 0.0011253265456494072, 0.003378022571902383] and parameters: {'n_layers': 4, 'embedding_dim': 256, 'lr': 0.0005623238238546706, 'lambda_val': 0.015969865383418422, 'batch_size': 1427, 'optimizer': 'Adam'}.
2026-06-04 09:14:31,857 - experiment_functions - INFO - Early stopping at epoch 500. Best Metrics: (0.0005243364620058076, 6.530912988143882e-05, 0.00022107008998615166)
2026-06-04 09:14:31,959 - optuna.study.study - INFO - Trial 196 finished with values: [0.0005243364620058076, 6.530912988143882e-05, 0.00022107008998615166] and parameters: {'n_layers': 4, 'embedding_dim': 128, 'lr': 0.0044385330633786016, 'lambda_val': 4.830818973924614e-06, 'batch_size': 1423, 'optimizer': 'SGD'}.
2026-06-04 09:16:54,199 - experiment_functions - INFO - Early stopping at epoch 3450. Best Metrics: (0.00092120741387471, 0.00011722151517181326, 0.0004911147755816808)
2026-06-04 09:16:54,345 - optuna.study.study - INFO - Trial 197 finished with values: [0.00092120741387471, 0.00011722151517181326, 0.0004911147755816808] and parameters: {'n_layers': 1, 'embedding_dim': 256, 'lr': 0.00010524137482549855, 'lambda_val': 0.0028698778902023414, 'batch_size': 1888, 'optimizer': 'Adam'}.
2026-06-04 09:17:22,785 - experiment_functions - INFO - Early stopping at epoch 550. Best Metrics: (0.005608367750438314, 0.001041596891955255, 0.003330195017251715)
2026-06-04 09:17:23,518 - optuna.study.study - INFO - Trial 198 finished with values: [0.005608367750438314, 0.001041596891955255, 0.003330195017251715] and parameters: {'n_layers': 3, 'embedding_dim': 256, 'lr': 0.006587432041567714, 'lambda_val': 0.00011536063209032362, 'batch_size': 1839, 'optimizer': 'RMSprop'}.
2026-06-04 09:18:35,823 - experiment_functions - INFO - Early stopping at epoch 1650. Best Metrics: (0.007920934455908326, 0.001483689463460379, 0.0044924548848324876)
2026-06-04 09:18:35,916 - optuna.study.study - INFO - Trial 199 finished with values: [0.007920934455908326, 0.001483689463460379, 0.0044924548848324876] and parameters: {'n_layers': 4, 'embedding_dim': 128, 'lr': 0.0005758008621537027, 'lambda_val': 4.830818973924614e-06, 'batch_size': 3961, 'optimizer': 'Adam'}.
2026-06-04 09:19:47,173 - experiment_functions - INFO - Early stopping at epoch 1700. Best Metrics: (0.009841420494227614, 0.0017365530176167191, 0.00571711121907644)
2026-06-04 09:19:47,265 - optuna.study.study - INFO - Trial 200 finished with values: [0.009841420494227614, 0.0017365530176167191, 0.00571711121907644] and parameters: {'n_layers': 4, 'embedding_dim': 96, 'lr': 0.0009358706696693685, 'lambda_val': 2.2109211065368353e-05, 'batch_size': 1423, 'optimizer': 'Adam'}.
2026-06-04 09:20:15,121 - experiment_functions - INFO - Early stopping at epoch 650. Best Metrics: (0.006651873248023919, 0.0012140799785652088, 0.0037742138641423135)
2026-06-04 09:20:15,218 - optuna.study.study - INFO - Trial 201 finished with values: [0.006651873248023919, 0.0012140799785652088, 0.0037742138641423135] and parameters: {'n_layers': 3, 'embedding_dim': 96, 'lr': 0.003484360419061448, 'lambda_val': 1.9086610212452873e-05, 'batch_size': 3774, 'optimizer': 'RMSprop'}.
2026-06-04 09:21:15,851 - experiment_functions - INFO - Early stopping at epoch 1150. Best Metrics: (0.008030300600320664, 0.0014937370219036774, 0.004608416270188659)
2026-06-04 09:21:16,379 - optuna.study.study - INFO - Trial 202 finished with values: [0.008030300600320664, 0.0014937370219036774, 0.004608416270188659] and parameters: {'n_layers': 4, 'embedding_dim': 256, 'lr': 0.0009358706696693685, 'lambda_val': 0.00014523930854886327, 'batch_size': 1801, 'optimizer': 'Adam'}.
2026-06-04 09:22:08,831 - experiment_functions - INFO - Early stopping at epoch 1300. Best Metrics: (0.007991348791841484, 0.0013982852166923437, 0.004498748637295618)
2026-06-04 09:22:08,937 - optuna.study.study - INFO - Trial 203 finished with values: [0.007991348791841484, 0.0013982852166923437, 0.004498748637295618] and parameters: {'n_layers': 4, 'embedding_dim': 64, 'lr': 0.0009358706696693685, 'lambda_val': 1.933875333428983e-06, 'batch_size': 3961, 'optimizer': 'Adam'}.
2026-06-04 09:23:33,718 - experiment_functions - INFO - Early stopping at epoch 1650. Best Metrics: (0.01149407280288201, 0.002068122446245562, 0.006660532638430307)
2026-06-04 09:23:34,848 - optuna.study.study - INFO - Trial 204 finished with values: [0.01149407280288201, 0.002068122446245562, 0.006660532638430307] and parameters: {'n_layers': 4, 'embedding_dim': 256, 'lr': 0.0009358706696693685, 'lambda_val': 2.2109211065368353e-05, 'batch_size': 775, 'optimizer': 'RMSprop'}.
2026-06-04 09:24:43,877 - experiment_functions - INFO - Early stopping at epoch 1650. Best Metrics: (0.011300836682899109, 0.002051376515506732, 0.0067926324586823515)
2026-06-04 09:24:43,984 - optuna.study.study - INFO - Trial 205 finished with values: [0.011300836682899109, 0.002051376515506732, 0.0067926324586823515] and parameters: {'n_layers': 4, 'embedding_dim': 96, 'lr': 0.0009358706696693685, 'lambda_val': 4.830818973924614e-06, 'batch_size': 1423, 'optimizer': 'RMSprop'}.
2026-06-04 09:25:24,630 - experiment_functions - INFO - Early stopping at epoch 950. Best Metrics: (0.008911530504081137, 0.0015975617924844266, 0.005105183365478694)
2026-06-04 09:25:24,787 - optuna.study.study - INFO - Trial 206 finished with values: [0.008911530504081137, 0.0015975617924844266, 0.005105183365478694] and parameters: {'n_layers': 4, 'embedding_dim': 96, 'lr': 0.0009358706696693685, 'lambda_val': 0.00014523930854886327, 'batch_size': 4037, 'optimizer': 'RMSprop'}.
2026-06-04 09:26:17,320 - experiment_functions - INFO - Early stopping at epoch 1300. Best Metrics: (0.0006294207043871514, 8.372965369415233e-05, 0.00029279223347782984)
2026-06-04 09:26:17,416 - optuna.study.study - INFO - Trial 207 finished with values: [0.0006294207043871514, 8.372965369415233e-05, 0.00029279223347782984] and parameters: {'n_layers': 2, 'embedding_dim': 128, 'lr': 3.050123394725898e-05, 'lambda_val': 3.914801209617112e-05, 'batch_size': 1230, 'optimizer': 'RMSprop'}.
2026-06-04 09:27:07,615 - experiment_functions - INFO - Early stopping at epoch 950. Best Metrics: (0.0098610535356601, 0.0018470761604930004, 0.005500709971633277)
2026-06-04 09:27:08,542 - optuna.study.study - INFO - Trial 208 finished with values: [0.0098610535356601, 0.0018470761604930004, 0.005500709971633277] and parameters: {'n_layers': 4, 'embedding_dim': 256, 'lr': 0.0009358706696693685, 'lambda_val': 0.00014523930854886327, 'batch_size': 1801, 'optimizer': 'RMSprop'}.
2026-06-04 09:27:47,425 - experiment_functions - INFO - Early stopping at epoch 900. Best Metrics: (0.007881877416123787, 0.001404983588987876, 0.0043653018486747045)
2026-06-04 09:27:47,524 - optuna.study.study - INFO - Trial 209 finished with values: [0.007881877416123787, 0.001404983588987876, 0.0043653018486747045] and parameters: {'n_layers': 4, 'embedding_dim': 96, 'lr': 0.0013074159600185884, 'lambda_val': 1.9086610212452873e-05, 'batch_size': 3961, 'optimizer': 'Adam'}.
2026-06-04 09:29:02,723 - experiment_functions - INFO - Early stopping at epoch 1800. Best Metrics: (0.01184723985159375, 0.0020898921562060423, 0.0069691535806937635)
2026-06-04 09:29:02,836 - optuna.study.study - INFO - Trial 210 finished with values: [0.01184723985159375, 0.0020898921562060423, 0.0069691535806937635] and parameters: {'n_layers': 4, 'embedding_dim': 96, 'lr': 0.0013876621562912753, 'lambda_val': 2.5795384074392596e-06, 'batch_size': 682, 'optimizer': 'Adam'}.
2026-06-04 09:30:15,915 - experiment_functions - INFO - Early stopping at epoch 1750. Best Metrics: (0.010151224023803118, 0.0017800924375376782, 0.00584946922399157)
2026-06-04 09:30:16,016 - optuna.study.study - INFO - Trial 211 finished with values: [0.010151224023803118, 0.0017800924375376782, 0.00584946922399157] and parameters: {'n_layers': 4, 'embedding_dim': 96, 'lr': 0.0009358706696693685, 'lambda_val': 3.527273109344908e-05, 'batch_size': 1423, 'optimizer': 'Adam'}.
2026-06-04 09:30:50,927 - experiment_functions - INFO - Early stopping at epoch 650. Best Metrics: (0.0070463435343178825, 0.0012877620738160629, 0.004011255499641195)
2026-06-04 09:30:51,317 - optuna.study.study - INFO - Trial 212 finished with values: [0.0070463435343178825, 0.0012877620738160629, 0.004011255499641195] and parameters: {'n_layers': 4, 'embedding_dim': 256, 'lr': 0.0010273844172621362, 'lambda_val': 0.0030181428987451015, 'batch_size': 3497, 'optimizer': 'RMSprop'}.
2026-06-04 09:31:34,659 - experiment_functions - INFO - Early stopping at epoch 1150. Best Metrics: (0.006239539990459667, 0.0010566682296202024, 0.0036309294326408535)
2026-06-04 09:31:35,416 - optuna.study.study - INFO - Trial 213 finished with values: [0.006239539990459667, 0.0010566682296202024, 0.0036309294326408535] and parameters: {'n_layers': 2, 'embedding_dim': 32, 'lr': 0.0023047972503770693, 'lambda_val': 6.1407786046843e-05, 'batch_size': 1839, 'optimizer': 'RMSprop'}.
2026-06-04 09:32:30,727 - experiment_functions - INFO - Early stopping at epoch 1400. Best Metrics: (0.007974435171180896, 0.0013798646928796304, 0.004505678875075803)
2026-06-04 09:32:36,036 - optuna.study.study - INFO - Trial 214 finished with values: [0.007974435171180896, 0.0013798646928796304, 0.004505678875075803] and parameters: {'n_layers': 2, 'embedding_dim': 96, 'lr': 0.0013876621562912753, 'lambda_val': 6.1407786046843e-05, 'batch_size': 1423, 'optimizer': 'RMSprop'}.
2026-06-04 09:34:03,706 - experiment_functions - INFO - Early stopping at epoch 1950. Best Metrics: (0.007370161206476751, 0.0012978096322593612, 0.004084070934750329)
2026-06-04 09:34:03,807 - optuna.study.study - INFO - Trial 215 finished with values: [0.007370161206476751, 0.0012978096322593612, 0.004084070934750329] and parameters: {'n_layers': 2, 'embedding_dim': 256, 'lr': 0.0010805031278718544, 'lambda_val': 1.7048406161686997e-06, 'batch_size': 2567, 'optimizer': 'RMSprop'}.
2026-06-04 09:34:33,431 - experiment_functions - INFO - Early stopping at epoch 700. Best Metrics: (0.007243700101309184, 0.0012743653292249986, 0.004140465820977115)
2026-06-04 09:34:33,531 - optuna.study.study - INFO - Trial 216 finished with values: [0.007243700101309184, 0.0012743653292249986, 0.004140465820977115] and parameters: {'n_layers': 4, 'embedding_dim': 64, 'lr': 0.0037544382096841252, 'lambda_val': 2.8077752105590774e-05, 'batch_size': 3497, 'optimizer': 'Adam'}.
2026-06-04 09:36:11,801 - experiment_functions - INFO - Early stopping at epoch 2200. Best Metrics: (0.006930690051944242, 0.0011956594547524952, 0.0038322587487231237)
2026-06-04 09:36:12,468 - optuna.study.study - INFO - Trial 217 finished with values: [0.006930690051944242, 0.0011956594547524952, 0.0038322587487231237] and parameters: {'n_layers': 2, 'embedding_dim': 256, 'lr': 0.0005623238238546706, 'lambda_val': 8.614758327309204e-05, 'batch_size': 3752, 'optimizer': 'RMSprop'}.
2026-06-04 09:37:00,001 - experiment_functions - INFO - Early stopping at epoch 900. Best Metrics: (0.008267593528146766, 0.001510482952642508, 0.004547229530321419)
2026-06-04 09:37:00,099 - optuna.study.study - INFO - Trial 218 finished with values: [0.008267593528146766, 0.001510482952642508, 0.004547229530321419] and parameters: {'n_layers': 4, 'embedding_dim': 256, 'lr': 0.0009358706696693685, 'lambda_val': 1.933875333428983e-06, 'batch_size': 3961, 'optimizer': 'RMSprop'}.
2026-06-04 09:39:01,818 - experiment_functions - INFO - Early stopping at epoch 3150. Best Metrics: (0.0068726173299965, 0.0011671913724964835, 0.004104645513060251)
2026-06-04 09:39:01,932 - optuna.study.study - INFO - Trial 219 finished with values: [0.0068726173299965, 0.0011671913724964835, 0.004104645513060251] and parameters: {'n_layers': 2, 'embedding_dim': 96, 'lr': 0.0009358706696693685, 'lambda_val': 0.0002789985957451779, 'batch_size': 1839, 'optimizer': 'Adam'}.
2026-06-04 09:40:07,183 - experiment_functions - INFO - Early stopping at epoch 1250. Best Metrics: (0.008816064327297325, 0.0016344028401098537, 0.004877586626960731)
2026-06-04 09:40:07,780 - optuna.study.study - INFO - Trial 220 finished with values: [0.008816064327297325, 0.0016344028401098537, 0.004877586626960731] and parameters: {'n_layers': 4, 'embedding_dim': 256, 'lr': 0.0005623238238546706, 'lambda_val': 8.614758327309204e-05, 'batch_size': 3752, 'optimizer': 'RMSprop'}.
2026-06-04 09:41:08,766 - experiment_functions - INFO - Early stopping at epoch 1350. Best Metrics: (0.0007070446393149242, 0.00010215017750686583, 0.00029868585919407594)
2026-06-04 09:41:08,869 - optuna.study.study - INFO - Trial 221 finished with values: [0.0007070446393149242, 0.00010215017750686583, 0.00029868585919407594] and parameters: {'n_layers': 2, 'embedding_dim': 256, 'lr': 4.801048181568429e-05, 'lambda_val': 4.446523827876978e-06, 'batch_size': 2567, 'optimizer': 'RMSprop'}.
2026-06-04 09:42:11,879 - experiment_functions - INFO - Early stopping at epoch 1500. Best Metrics: (0.010775014378642894, 0.001970996047960346, 0.006398583815327663)
2026-06-04 09:42:12,015 - optuna.study.study - INFO - Trial 222 finished with values: [0.010775014378642894, 0.001970996047960346, 0.006398583815327663] and parameters: {'n_layers': 4, 'embedding_dim': 96, 'lr': 0.0009358706696693685, 'lambda_val': 2.2109211065368353e-05, 'batch_size': 1897, 'optimizer': 'RMSprop'}.
2026-06-04 09:42:52,486 - experiment_functions - INFO - Early stopping at epoch 750. Best Metrics: (0.007265721482399274, 0.001332976086810905, 0.004033674124562154)
2026-06-04 09:42:53,538 - optuna.study.study - INFO - Trial 223 finished with values: [0.007265721482399274, 0.001332976086810905, 0.004033674124562154] and parameters: {'n_layers': 4, 'embedding_dim': 256, 'lr': 0.0023047972503770693, 'lambda_val': 2.2109211065368353e-05, 'batch_size': 3469, 'optimizer': 'Adam'}.
2026-06-04 09:43:28,285 - experiment_functions - INFO - Early stopping at epoch 800. Best Metrics: (0.007316770997996703, 0.001368142541362449, 0.004149632436517619)
2026-06-04 09:43:28,404 - optuna.study.study - INFO - Trial 224 finished with values: [0.007316770997996703, 0.001368142541362449, 0.004149632436517619] and parameters: {'n_layers': 4, 'embedding_dim': 96, 'lr': 0.0023047972503770693, 'lambda_val': 2.8077752105590774e-05, 'batch_size': 3497, 'optimizer': 'Adam'}.
2026-06-04 09:43:52,368 - experiment_functions - INFO - Early stopping at epoch 550. Best Metrics: (0.004689192371966123, 0.0008272489784982249, 0.0027242245816847953)
2026-06-04 09:43:52,467 - optuna.study.study - INFO - Trial 225 finished with values: [0.004689192371966123, 0.0008272489784982249, 0.0027242245816847953] and parameters: {'n_layers': 3, 'embedding_dim': 96, 'lr': 0.0589103055695311, 'lambda_val': 4.830818973924614e-06, 'batch_size': 1423, 'optimizer': 'Adam'}.
2026-06-04 09:44:38,439 - experiment_functions - INFO - Early stopping at epoch 1150. Best Metrics: (0.0063824521292871325, 0.001083461718802331, 0.003630116240781438)
2026-06-04 09:44:38,531 - optuna.study.study - INFO - Trial 226 finished with values: [0.0063824521292871325, 0.001083461718802331, 0.003630116240781438] and parameters: {'n_layers': 2, 'embedding_dim': 96, 'lr': 0.0023047972503770693, 'lambda_val': 4.830818973924614e-06, 'batch_size': 3226, 'optimizer': 'Adam'}.
2026-06-04 09:46:12,434 - experiment_functions - INFO - Early stopping at epoch 2250. Best Metrics: (0.006111205159862747, 0.0010667157880635007, 0.003577617474876082)
2026-06-04 09:46:12,545 - optuna.study.study - INFO - Trial 227 finished with values: [0.006111205159862747, 0.0010667157880635007, 0.003577617474876082] and parameters: {'n_layers': 1, 'embedding_dim': 256, 'lr': 0.0009358706696693685, 'lambda_val': 2.2109211065368353e-05, 'batch_size': 2558, 'optimizer': 'RMSprop'}.
2026-06-04 09:46:57,087 - experiment_functions - INFO - Early stopping at epoch 900. Best Metrics: (0.00784751189589435, 0.0014133565543572914, 0.00429003437129684)
2026-06-04 09:46:57,178 - optuna.study.study - INFO - Trial 228 finished with values: [0.00784751189589435, 0.0014133565543572914, 0.00429003437129684] and parameters: {'n_layers': 3, 'embedding_dim': 256, 'lr': 0.0013876621562912753, 'lambda_val': 0.000867565506991593, 'batch_size': 902, 'optimizer': 'RMSprop'}.
2026-06-04 09:48:03,700 - experiment_functions - INFO - Early stopping at epoch 1650. Best Metrics: (0.007177736776585194, 0.001297809632259361, 0.004092486241126727)
2026-06-04 09:48:03,822 - optuna.study.study - INFO - Trial 229 finished with values: [0.007177736776585194, 0.001297809632259361, 0.004092486241126727] and parameters: {'n_layers': 2, 'embedding_dim': 128, 'lr': 0.0013876621562912753, 'lambda_val': 3.914801209617112e-05, 'batch_size': 1772, 'optimizer': 'RMSprop'}.
2026-06-04 09:50:18,593 - experiment_functions - INFO - Early stopping at epoch 3500. Best Metrics: (0.008373797557683879, 0.0013329760868109049, 0.004832439555065186)
2026-06-04 09:50:19,053 - optuna.study.study - INFO - Trial 230 finished with values: [0.008373797557683879, 0.0013329760868109049, 0.004832439555065186] and parameters: {'n_layers': 2, 'embedding_dim': 96, 'lr': 0.0005758008621537027, 'lambda_val': 2.2109211065368353e-05, 'batch_size': 2498, 'optimizer': 'RMSprop'}.
2026-06-04 09:52:50,675 - experiment_functions - INFO - Early stopping at epoch 3950. Best Metrics: (0.006991642369989165, 0.001150445441757653, 0.004034684163255715)
2026-06-04 09:52:50,764 - optuna.study.study - INFO - Trial 231 finished with values: [0.006991642369989165, 0.001150445441757653, 0.004034684163255715] and parameters: {'n_layers': 2, 'embedding_dim': 96, 'lr': 0.0009358706696693685, 'lambda_val': 4.830818973924614e-06, 'batch_size': 1839, 'optimizer': 'Adam'}.
2026-06-04 09:53:44,130 - experiment_functions - INFO - Early stopping at epoch 1250. Best Metrics: (0.009173384316269193, 0.0016327282470359704, 0.005217615238699133)
2026-06-04 09:53:44,228 - optuna.study.study - INFO - Trial 232 finished with values: [0.009173384316269193, 0.0016327282470359704, 0.005217615238699133] and parameters: {'n_layers': 3, 'embedding_dim': 128, 'lr': 0.0023047972503770693, 'lambda_val': 7.515581205048244e-06, 'batch_size': 775, 'optimizer': 'Adam'}.
2026-06-04 09:54:41,902 - experiment_functions - INFO - Early stopping at epoch 1100. Best Metrics: (0.009154167911887197, 0.0016528233639225667, 0.005129646614320412)
2026-06-04 09:54:42,011 - optuna.study.study - INFO - Trial 233 finished with values: [0.009154167911887197, 0.0016528233639225667, 0.005129646614320412] and parameters: {'n_layers': 4, 'embedding_dim': 256, 'lr': 0.0015616330871216168, 'lambda_val': 4.830818973924614e-06, 'batch_size': 1243, 'optimizer': 'Adam'}.
2026-06-04 09:55:37,995 - experiment_functions - INFO - Early stopping at epoch 1150. Best Metrics: (0.005376532670682685, 0.0010566682296202024, 0.0031757662324839375)
2026-06-04 09:55:38,098 - optuna.study.study - INFO - Trial 234 finished with values: [0.005376532670682685, 0.0010566682296202024, 0.0031757662324839375] and parameters: {'n_layers': 3, 'embedding_dim': 256, 'lr': 0.0005623238238546706, 'lambda_val': 0.014015740959195513, 'batch_size': 1423, 'optimizer': 'RMSprop'}.
2026-06-04 09:56:13,356 - experiment_functions - INFO - Early stopping at epoch 700. Best Metrics: (0.006920613453486846, 0.0013229285283676067, 0.00397018806044143)
