2026-06-07 08:09:56,550 - optuna.study.study - INFO - Trial 192 finished with values: [0.018182935597707818, 0.0026140397883314356, 0.009251281401705402] and parameters: {'n_layers': 4, 'embedding_dim': 32, 'lr': 0.006175201562705211, 'lambda_val': 1.0308897870221961e-06, 'batch_size': 1327, 'optimizer': 'RMSprop'}.
2026-06-07 08:10:23,295 - experiment_functions - INFO - Early stopping at epoch 650. Best Metrics: (0.01782165586672736, 0.002756380199611495, 0.009743190503097353)
2026-06-07 08:10:23,658 - optuna.study.study - INFO - Trial 193 finished with values: [0.01782165586672736, 0.002756380199611495, 0.009743190503097353] and parameters: {'n_layers': 2, 'embedding_dim': 64, 'lr': 0.003577419943834574, 'lambda_val': 1.471855561908882e-05, 'batch_size': 3184, 'optimizer': 'RMSprop'}.
2026-06-07 08:12:49,585 - optuna.study.study - INFO - Trial 194 finished with values: [0.026069185681773705, 0.004010650411949897, 0.014709120756531779] and parameters: {'n_layers': 2, 'embedding_dim': 32, 'lr': 0.0010601215811942713, 'lambda_val': 5.604086483439305e-05, 'batch_size': 1514, 'optimizer': 'RMSprop'}.
2026-06-07 08:14:12,881 - experiment_functions - INFO - Early stopping at epoch 2350. Best Metrics: (0.00043858070910713477, 8.707883984191843e-05, 0.00023076966785683377)
2026-06-07 08:14:12,974 - optuna.study.study - INFO - Trial 195 finished with values: [0.00043858070910713477, 8.707883984191843e-05, 0.00023076966785683377] and parameters: {'n_layers': 1, 'embedding_dim': 32, 'lr': 1.329981428375124e-05, 'lambda_val': 5.604086483439305e-05, 'batch_size': 2687, 'optimizer': 'RMSprop'}.
2026-06-07 08:14:54,265 - experiment_functions - INFO - Early stopping at epoch 950. Best Metrics: (0.022008504764547566, 0.0032286154464465137, 0.011405041043717664)
2026-06-07 08:14:54,768 - optuna.study.study - INFO - Trial 196 finished with values: [0.022008504764547566, 0.0032286154464465137, 0.011405041043717664] and parameters: {'n_layers': 4, 'embedding_dim': 96, 'lr': 0.004937225771948887, 'lambda_val': 5.656965316395304e-06, 'batch_size': 558, 'optimizer': 'RMSprop'}.
2026-06-07 08:17:16,335 - optuna.study.study - INFO - Trial 197 finished with values: [0.0035608388539512146, 0.0004822828052783174, 0.0018452553727048113] and parameters: {'n_layers': 1, 'embedding_dim': 32, 'lr': 0.0004340370842280224, 'lambda_val': 0.0059525210668399465, 'batch_size': 1877, 'optimizer': 'Adam'}.
2026-06-07 08:19:12,505 - experiment_functions - INFO - Early stopping at epoch 3100. Best Metrics: (0.017625059498224644, 0.002856855784044477, 0.010079385427694314)
2026-06-07 08:19:12,607 - optuna.study.study - INFO - Trial 198 finished with values: [0.017625059498224644, 0.002856855784044477, 0.010079385427694314] and parameters: {'n_layers': 1, 'embedding_dim': 96, 'lr': 0.0013734258944280648, 'lambda_val': 1.8902402933529376e-05, 'batch_size': 1703, 'optimizer': 'RMSprop'}.
2026-06-07 08:19:45,926 - experiment_functions - INFO - Early stopping at epoch 600. Best Metrics: (0.020051621579067248, 0.0031247906758657645, 0.010538060410667864)
2026-06-07 08:19:47,140 - optuna.study.study - INFO - Trial 199 finished with values: [0.020051621579067248, 0.0031247906758657645, 0.010538060410667864] and parameters: {'n_layers': 4, 'embedding_dim': 256, 'lr': 0.00287527930424118, 'lambda_val': 0.00010082268820599092, 'batch_size': 2975, 'optimizer': 'RMSprop'}.
2026-06-07 08:22:15,898 - experiment_functions - INFO - Early stopping at epoch 3950. Best Metrics: (0.02662028760514619, 0.004074284948757452, 0.014899131201690634)
2026-06-07 08:22:16,303 - optuna.study.study - INFO - Trial 200 finished with values: [0.02662028760514619, 0.004074284948757452, 0.014899131201690634] and parameters: {'n_layers': 2, 'embedding_dim': 64, 'lr': 0.0009791612272847586, 'lambda_val': 1.471855561908882e-05, 'batch_size': 1929, 'optimizer': 'RMSprop'}.
2026-06-07 08:24:50,861 - optuna.study.study - INFO - Trial 201 finished with values: [0.030378713591125806, 0.004958470091767701, 0.018011911735218728] and parameters: {'n_layers': 3, 'embedding_dim': 64, 'lr': 0.0010160627847963985, 'lambda_val': 5.604086483439305e-05, 'batch_size': 572, 'optimizer': 'Adam'}.
2026-06-07 08:26:10,170 - experiment_functions - INFO - Early stopping at epoch 1600. Best Metrics: (0.03212973269975875, 0.00488646258959073, 0.017233094581645042)
2026-06-07 08:26:10,242 - optuna.study.study - INFO - Trial 202 finished with values: [0.03212973269975875, 0.00488646258959073, 0.017233094581645042] and parameters: {'n_layers': 3, 'embedding_dim': 256, 'lr': 0.0008738901578381451, 'lambda_val': 5.604086483439305e-05, 'batch_size': 1703, 'optimizer': 'RMSprop'}.
2026-06-07 08:26:59,135 - experiment_functions - INFO - Early stopping at epoch 900. Best Metrics: (0.027951580095106492, 0.004223323732333043, 0.014798591030253066)
2026-06-07 08:26:59,357 - optuna.study.study - INFO - Trial 203 finished with values: [0.027951580095106492, 0.004223323732333043, 0.014798591030253066] and parameters: {'n_layers': 4, 'embedding_dim': 256, 'lr': 0.0009791612272847586, 'lambda_val': 1.471855561908882e-05, 'batch_size': 2975, 'optimizer': 'RMSprop'}.
2026-06-07 08:27:57,173 - experiment_functions - INFO - Early stopping at epoch 1150. Best Metrics: (0.027839672409602775, 0.004350592805948155, 0.015197711591234996)
2026-06-07 08:27:57,258 - optuna.study.study - INFO - Trial 204 finished with values: [0.027839672409602775, 0.004350592805948155, 0.015197711591234996] and parameters: {'n_layers': 3, 'embedding_dim': 256, 'lr': 0.0008738901578381451, 'lambda_val': 2.1562448265609146e-05, 'batch_size': 2975, 'optimizer': 'RMSprop'}.
2026-06-07 08:28:52,628 - experiment_functions - INFO - Early stopping at epoch 1450. Best Metrics: (0.031676617250121185, 0.004708955723759127, 0.01762573187438222)
2026-06-07 08:28:52,882 - optuna.study.study - INFO - Trial 205 finished with values: [0.031676617250121185, 0.004708955723759127, 0.01762573187438222] and parameters: {'n_layers': 3, 'embedding_dim': 32, 'lr': 0.0022844612214732766, 'lambda_val': 5.656965316395304e-06, 'batch_size': 1182, 'optimizer': 'RMSprop'}.
2026-06-07 08:31:18,088 - optuna.study.study - INFO - Trial 206 finished with values: [0.024900629129829488, 0.003931944537477393, 0.014974912213232695] and parameters: {'n_layers': 2, 'embedding_dim': 32, 'lr': 0.0010160627847963985, 'lambda_val': 1.471855561908882e-05, 'batch_size': 572, 'optimizer': 'RMSprop'}.
2026-06-07 08:33:43,973 - experiment_functions - INFO - Early stopping at epoch 3750. Best Metrics: (0.029208541764982963, 0.004516377520262577, 0.016729118096352528)
2026-06-07 08:33:44,070 - optuna.study.study - INFO - Trial 207 finished with values: [0.029208541764982963, 0.004516377520262577, 0.016729118096352528] and parameters: {'n_layers': 2, 'embedding_dim': 96, 'lr': 0.0009791612272847586, 'lambda_val': 1.471855561908882e-05, 'batch_size': 1514, 'optimizer': 'RMSprop'}.
2026-06-07 08:34:38,697 - experiment_functions - INFO - Early stopping at epoch 1450. Best Metrics: (0.006865204492815582, 0.0010148034027731262, 0.003542888016907111)
2026-06-07 08:34:38,781 - optuna.study.study - INFO - Trial 208 finished with values: [0.006865204492815582, 0.0010148034027731262, 0.003542888016907111] and parameters: {'n_layers': 4, 'embedding_dim': 32, 'lr': 0.002168096883511623, 'lambda_val': 0.07756418868924657, 'batch_size': 3332, 'optimizer': 'RMSprop'}.
2026-06-07 08:35:09,387 - experiment_functions - INFO - Early stopping at epoch 550. Best Metrics: (0.01825963993954875, 0.0026458570567352135, 0.009316412956231576)
2026-06-07 08:35:09,495 - optuna.study.study - INFO - Trial 209 finished with values: [0.01825963993954875, 0.0026458570567352135, 0.009316412956231576] and parameters: {'n_layers': 4, 'embedding_dim': 256, 'lr': 0.005346539558097208, 'lambda_val': 2.5313317558461653e-05, 'batch_size': 2975, 'optimizer': 'RMSprop'}.
2026-06-07 08:35:45,024 - experiment_functions - INFO - Early stopping at epoch 800. Best Metrics: (0.021204638206855975, 0.003159957130417309, 0.010973337176609957)
2026-06-07 08:35:45,112 - optuna.study.study - INFO - Trial 210 finished with values: [0.021204638206855975, 0.003159957130417309, 0.010973337176609957] and parameters: {'n_layers': 3, 'embedding_dim': 128, 'lr': 0.003577419943834574, 'lambda_val': 0.00010082268820599092, 'batch_size': 1182, 'optimizer': 'RMSprop'}.
2026-06-07 08:36:08,958 - experiment_functions - INFO - Early stopping at epoch 500. Best Metrics: (0.0005910601960549465, 8.540424676803537e-05, 0.0002583675367095902)
2026-06-07 08:36:09,048 - optuna.study.study - INFO - Trial 211 finished with values: [0.0005910601960549465, 8.540424676803537e-05, 0.0002583675367095902] and parameters: {'n_layers': 2, 'embedding_dim': 256, 'lr': 0.0013734258944280648, 'lambda_val': 1.471855561908882e-05, 'batch_size': 1418, 'optimizer': 'SGD'}.
2026-06-07 08:36:40,113 - experiment_functions - INFO - Early stopping at epoch 700. Best Metrics: (0.02427326326766356, 0.0035534865027798245, 0.01279837797278065)
2026-06-07 08:36:40,442 - optuna.study.study - INFO - Trial 212 finished with values: [0.02427326326766356, 0.0035534865027798245, 0.01279837797278065] and parameters: {'n_layers': 4, 'embedding_dim': 96, 'lr': 0.002168096883511623, 'lambda_val': 7.81432642581821e-06, 'batch_size': 2975, 'optimizer': 'RMSprop'}.
2026-06-07 08:38:46,230 - experiment_functions - INFO - Early stopping at epoch 3450. Best Metrics: (0.010964212817525862, 0.0016846406323263445, 0.005613126351181119)
2026-06-07 08:38:46,313 - optuna.study.study - INFO - Trial 213 finished with values: [0.010964212817525862, 0.0016846406323263445, 0.005613126351181119] and parameters: {'n_layers': 1, 'embedding_dim': 64, 'lr': 0.004937225771948887, 'lambda_val': 0.04701598106720832, 'batch_size': 2050, 'optimizer': 'Adam'}.
2026-06-07 08:39:25,002 - experiment_functions - INFO - Early stopping at epoch 950. Best Metrics: (0.024810617520830722, 0.0038096992430839307, 0.013412221541524999)
2026-06-07 08:39:25,087 - optuna.study.study - INFO - Trial 214 finished with values: [0.024810617520830722, 0.0038096992430839307, 0.013412221541524999] and parameters: {'n_layers': 3, 'embedding_dim': 64, 'lr': 0.003577419943834574, 'lambda_val': 2.3950847744868506e-06, 'batch_size': 1120, 'optimizer': 'RMSprop'}.
2026-06-07 08:39:56,493 - experiment_functions - INFO - Early stopping at epoch 600. Best Metrics: (0.018794151139127902, 0.002855181190970594, 0.009881438527702357)
2026-06-07 08:39:57,471 - optuna.study.study - INFO - Trial 215 finished with values: [0.018794151139127902, 0.002855181190970594, 0.009881438527702357] and parameters: {'n_layers': 3, 'embedding_dim': 256, 'lr': 0.003577419943834574, 'lambda_val': 2.1562448265609146e-05, 'batch_size': 2881, 'optimizer': 'RMSprop'}.
2026-06-07 08:40:48,913 - experiment_functions - INFO - Early stopping at epoch 1400. Best Metrics: (0.0004729406464841553, 8.372965369415233e-05, 0.00023850744340902464)
2026-06-07 08:40:48,987 - optuna.study.study - INFO - Trial 216 finished with values: [0.0004729406464841553, 8.372965369415233e-05, 0.00023850744340902464] and parameters: {'n_layers': 2, 'embedding_dim': 32, 'lr': 4.983845678493685e-05, 'lambda_val': 5.656965316395304e-06, 'batch_size': 2727, 'optimizer': 'Adam'}.
2026-06-07 08:42:49,213 - experiment_functions - INFO - Early stopping at epoch 2650. Best Metrics: (0.02592688422971132, 0.004055864424944738, 0.014575397103783649)
2026-06-07 08:42:49,312 - optuna.study.study - INFO - Trial 217 finished with values: [0.02592688422971132, 0.004055864424944738, 0.014575397103783649] and parameters: {'n_layers': 2, 'embedding_dim': 256, 'lr': 0.0006420352977986802, 'lambda_val': 0.00010082268820599092, 'batch_size': 2187, 'optimizer': 'RMSprop'}.
2026-06-07 08:43:45,599 - experiment_functions - INFO - Early stopping at epoch 1450. Best Metrics: (0.02255644234660504, 0.003396074753834818, 0.011832385784468)
2026-06-07 08:43:45,688 - optuna.study.study - INFO - Trial 218 finished with values: [0.02255644234660504, 0.003396074753834818, 0.011832385784468] and parameters: {'n_layers': 2, 'embedding_dim': 64, 'lr': 0.0013734258944280648, 'lambda_val': 1.471855561908882e-05, 'batch_size': 3184, 'optimizer': 'RMSprop'}.
2026-06-07 08:46:21,221 - optuna.study.study - INFO - Trial 219 finished with values: [0.02220021483849562, 0.0035451135374104095, 0.01268118962606261] and parameters: {'n_layers': 2, 'embedding_dim': 96, 'lr': 0.0009791612272847586, 'lambda_val': 0.00010082268820599092, 'batch_size': 572, 'optimizer': 'Adam'}.
2026-06-07 08:47:15,626 - experiment_functions - INFO - Early stopping at epoch 1300. Best Metrics: (0.03085033558276134, 0.0046871860137986466, 0.017384503726317637)
2026-06-07 08:47:16,298 - optuna.study.study - INFO - Trial 220 finished with values: [0.03085033558276134, 0.0046871860137986466, 0.017384503726317637] and parameters: {'n_layers': 3, 'embedding_dim': 96, 'lr': 0.0009791612272847586, 'lambda_val': 2.1562448265609146e-05, 'batch_size': 2975, 'optimizer': 'RMSprop'}.
2026-06-07 08:48:09,765 - experiment_functions - INFO - Early stopping at epoch 1050. Best Metrics: (0.026809120577079012, 0.004169736753968785, 0.014492911197075683)
2026-06-07 08:48:09,835 - optuna.study.study - INFO - Trial 221 finished with values: [0.026809120577079012, 0.004169736753968785, 0.014492911197075683] and parameters: {'n_layers': 3, 'embedding_dim': 256, 'lr': 0.0009791612272847586, 'lambda_val': 1.8902402933529376e-05, 'batch_size': 3181, 'optimizer': 'RMSprop'}.
2026-06-07 08:50:42,030 - optuna.study.study - INFO - Trial 222 finished with values: [0.007271768066228383, 0.0011789135240136645, 0.004755519846811025] and parameters: {'n_layers': 2, 'embedding_dim': 96, 'lr': 0.0004340370842280224, 'lambda_val': 0.0008628561498380414, 'batch_size': 572, 'optimizer': 'RMSprop'}.
2026-06-07 08:51:19,071 - experiment_functions - INFO - Early stopping at epoch 900. Best Metrics: (0.0005380242656350128, 8.540424676803537e-05, 0.00027030009362183333)
2026-06-07 08:51:19,160 - optuna.study.study - INFO - Trial 223 finished with values: [0.0005380242656350128, 8.540424676803537e-05, 0.00027030009362183333] and parameters: {'n_layers': 2, 'embedding_dim': 128, 'lr': 1.5724574049883943e-05, 'lambda_val': 0.0008628561498380414, 'batch_size': 1703, 'optimizer': 'RMSprop'}.
2026-06-07 08:51:56,128 - experiment_functions - INFO - Early stopping at epoch 950. Best Metrics: (0.02493272403608665, 0.0038297943599705274, 0.013327317522220137)
2026-06-07 08:51:56,498 - optuna.study.study - INFO - Trial 224 finished with values: [0.02493272403608665, 0.0038297943599705274, 0.013327317522220137] and parameters: {'n_layers': 3, 'embedding_dim': 32, 'lr': 0.003577419943834574, 'lambda_val': 1.471855561908882e-05, 'batch_size': 1182, 'optimizer': 'RMSprop'}.
2026-06-07 08:52:48,591 - experiment_functions - INFO - Early stopping at epoch 1300. Best Metrics: (0.02319038762761578, 0.003642239935695626, 0.012929826829058232)
2026-06-07 08:52:48,661 - optuna.study.study - INFO - Trial 225 finished with values: [0.02319038762761578, 0.003642239935695626, 0.012929826829058232] and parameters: {'n_layers': 2, 'embedding_dim': 64, 'lr': 0.0013734258944280648, 'lambda_val': 1.471855561908882e-05, 'batch_size': 2963, 'optimizer': 'RMSprop'}.
2026-06-07 08:55:35,358 - optuna.study.study - INFO - Trial 226 finished with values: [0.03635086109390034, 0.005598164645991025, 0.02087202378164579] and parameters: {'n_layers': 3, 'embedding_dim': 96, 'lr': 0.0010718155355804958, 'lambda_val': 5.656965316395304e-06, 'batch_size': 1182, 'optimizer': 'RMSprop'}.
2026-06-07 08:57:51,981 - experiment_functions - INFO - Early stopping at epoch 3500. Best Metrics: (0.03642049074763967, 0.00542568155938107, 0.020165186540756795)
2026-06-07 08:57:52,097 - optuna.study.study - INFO - Trial 227 finished with values: [0.03642049074763967, 0.00542568155938107, 0.020165186540756795] and parameters: {'n_layers': 4, 'embedding_dim': 32, 'lr': 0.0010601215811942713, 'lambda_val': 1.5522882454254386e-06, 'batch_size': 1514, 'optimizer': 'RMSprop'}.
2026-06-07 08:59:22,219 - experiment_functions - INFO - Early stopping at epoch 2300. Best Metrics: (0.02462481949714729, 0.003824770580748878, 0.013312631672169709)
2026-06-07 08:59:22,307 - optuna.study.study - INFO - Trial 228 finished with values: [0.02462481949714729, 0.003824770580748878, 0.013312631672169709] and parameters: {'n_layers': 4, 'embedding_dim': 32, 'lr': 0.0010160627847963985, 'lambda_val': 5.656965316395304e-06, 'batch_size': 3093, 'optimizer': 'Adam'}.
2026-06-07 08:59:54,086 - experiment_functions - INFO - Early stopping at epoch 800. Best Metrics: (0.020500011792823288, 0.003290575390180186, 0.011452681256942106)
2026-06-07 08:59:54,177 - optuna.study.study - INFO - Trial 229 finished with values: [0.020500011792823288, 0.003290575390180186, 0.011452681256942106] and parameters: {'n_layers': 2, 'embedding_dim': 32, 'lr': 0.002553735389978093, 'lambda_val': 0.00010082268820599092, 'batch_size': 2050, 'optimizer': 'RMSprop'}.
2026-06-07 09:00:33,518 - experiment_functions - INFO - Early stopping at epoch 700. Best Metrics: (0.025945070893445183, 0.003931944537477393, 0.014050654715499586)
2026-06-07 09:00:33,608 - optuna.study.study - INFO - Trial 230 finished with values: [0.025945070893445183, 0.003931944537477393, 0.014050654715499586] and parameters: {'n_layers': 4, 'embedding_dim': 256, 'lr': 0.0013734258944280648, 'lambda_val': 5.604086483439305e-05, 'batch_size': 2975, 'optimizer': 'RMSprop'}.
2026-06-07 09:01:44,210 - experiment_functions - INFO - Early stopping at epoch 1500. Best Metrics: (0.023475916838444272, 0.003682430169468819, 0.012574763494884409)
2026-06-07 09:01:44,346 - optuna.study.study - INFO - Trial 231 finished with values: [0.023475916838444272, 0.003682430169468819, 0.012574763494884409] and parameters: {'n_layers': 2, 'embedding_dim': 256, 'lr': 0.0009791612272847586, 'lambda_val': 1.8902402933529376e-05, 'batch_size': 2580, 'optimizer': 'RMSprop'}.
2026-06-07 09:02:22,099 - experiment_functions - INFO - Early stopping at epoch 950. Best Metrics: (0.017182410013629704, 0.0027396342688726645, 0.009840300437468837)
2026-06-07 09:02:22,190 - optuna.study.study - INFO - Trial 232 finished with values: [0.017182410013629704, 0.0027396342688726645, 0.009840300437468837] and parameters: {'n_layers': 2, 'embedding_dim': 32, 'lr': 0.002620274475670763, 'lambda_val': 7.542758231924599e-05, 'batch_size': 2975, 'optimizer': 'Adam'}.
2026-06-07 09:05:22,289 - optuna.study.study - INFO - Trial 233 finished with values: [0.0413614834598645, 0.0061005425681559386, 0.023227703245023153] and parameters: {'n_layers': 4, 'embedding_dim': 128, 'lr': 0.0009791612272847586, 'lambda_val': 1.471855561908882e-05, 'batch_size': 658, 'optimizer': 'RMSprop'}.
2026-06-07 09:07:20,660 - experiment_functions - INFO - Early stopping at epoch 2550. Best Metrics: (0.024668771226693056, 0.003943666688994574, 0.013656073257697068)
2026-06-07 09:07:20,757 - optuna.study.study - INFO - Trial 234 finished with values: [0.024668771226693056, 0.003943666688994574, 0.013656073257697068] and parameters: {'n_layers': 2, 'embedding_dim': 256, 'lr': 0.0006306952898324421, 'lambda_val': 0.00010082268820599092, 'batch_size': 2687, 'optimizer': 'RMSprop'}.
2026-06-07 09:08:34,075 - experiment_functions - INFO - Early stopping at epoch 1450. Best Metrics: (0.030347839510109616, 0.004623551476991092, 0.0160157804204658)
2026-06-07 09:08:34,150 - optuna.study.study - INFO - Trial 235 finished with values: [0.030347839510109616, 0.004623551476991092, 0.0160157804204658] and parameters: {'n_layers': 3, 'embedding_dim': 256, 'lr': 0.0010160627847963985, 'lambda_val': 0.0008628561498380414, 'batch_size': 572, 'optimizer': 'RMSprop'}.
2026-06-07 09:11:04,868 - optuna.study.study - INFO - Trial 236 finished with values: [0.027874289051278988, 0.004372362515908635, 0.015287659187097286] and parameters: {'n_layers': 2, 'embedding_dim': 32, 'lr': 0.0013734258944280648, 'lambda_val': 0.00010018538495092592, 'batch_size': 1182, 'optimizer': 'RMSprop'}.
2026-06-07 09:11:51,016 - experiment_functions - INFO - Early stopping at epoch 1050. Best Metrics: (0.021344219274846477, 0.0030879496282403378, 0.010912659631582191)
2026-06-07 09:11:51,647 - optuna.study.study - INFO - Trial 237 finished with values: [0.021344219274846477, 0.0030879496282403378, 0.010912659631582191] and parameters: {'n_layers': 4, 'embedding_dim': 96, 'lr': 0.004937225771948887, 'lambda_val': 2.1562448265609146e-05, 'batch_size': 558, 'optimizer': 'RMSprop'}.
2026-06-07 09:12:32,388 - experiment_functions - INFO - Early stopping at epoch 900. Best Metrics: (0.02516122437515046, 0.003890079710630317, 0.01339998529135095)
2026-06-07 09:12:33,078 - optuna.study.study - INFO - Trial 238 finished with values: [0.02516122437515046, 0.003890079710630317, 0.01339998529135095] and parameters: {'n_layers': 3, 'embedding_dim': 128, 'lr': 0.0009791612272847586, 'lambda_val': 0.0008628561498380414, 'batch_size': 3503, 'optimizer': 'RMSprop'}.
2026-06-07 09:15:17,937 - optuna.study.study - INFO - Trial 239 finished with values: [0.03279960982958648, 0.005124254806082122, 0.019163008268091447] and parameters: {'n_layers': 3, 'embedding_dim': 96, 'lr': 0.0006328376000987285, 'lambda_val': 5.604086483439305e-05, 'batch_size': 1111, 'optimizer': 'RMSprop'}.
2026-06-07 09:17:52,061 - optuna.study.study - INFO - Trial 240 finished with values: [0.0007996450888023631, 0.00011052314287628106, 0.00035635559378149954] and parameters: {'n_layers': 3, 'embedding_dim': 64, 'lr': 8.601938670044577e-05, 'lambda_val': 1.8902402933529376e-05, 'batch_size': 1703, 'optimizer': 'RMSprop'}.
2026-06-07 09:19:03,103 - experiment_functions - INFO - Early stopping at epoch 1800. Best Metrics: (0.02734982098174465, 0.004203228615446447, 0.014535390588993214)
