2026-06-04 12:37:18,377 - optuna.study.study - INFO - Trial 75 finished with values: [0.000428924815136258, 6.363453680755577e-05, 0.00022065124257532735] and parameters: {'n_layers': 1, 'embedding_dim': 64, 'lr': 2.550099485793571e-05, 'lambda_val': 0.013580455076832525, 'batch_size': 928, 'optimizer': 'RMSprop'}.
2026-06-04 12:37:40,225 - experiment_functions - INFO - Early stopping at epoch 500. Best Metrics: (0.0005553527063050465, 8.540424676803538e-05, 0.00028135073046142944)
2026-06-04 12:37:40,311 - optuna.study.study - INFO - Trial 76 finished with values: [0.0005553527063050465, 8.540424676803538e-05, 0.00028135073046142944] and parameters: {'n_layers': 3, 'embedding_dim': 96, 'lr': 4.354565516554788e-05, 'lambda_val': 0.00010889573483852956, 'batch_size': 945, 'optimizer': 'SGD'}.
2026-06-04 12:40:26,018 - optuna.study.study - INFO - Trial 77 finished with values: [0.0018562793206783209, 0.00027630785719070264, 0.0009286908534530422] and parameters: {'n_layers': 1, 'embedding_dim': 256, 'lr': 0.0001643791628358017, 'lambda_val': 7.359862236281652e-06, 'batch_size': 3602, 'optimizer': 'Adam'}.
2026-06-04 12:40:49,726 - experiment_functions - INFO - Early stopping at epoch 500. Best Metrics: (0.0005172167710394629, 7.033290910308794e-05, 0.0002704097171771235)
2026-06-04 12:40:49,816 - optuna.study.study - INFO - Trial 78 finished with values: [0.0005172167710394629, 7.033290910308794e-05, 0.0002704097171771235] and parameters: {'n_layers': 2, 'embedding_dim': 256, 'lr': 0.005913319416099858, 'lambda_val': 0.0037497626023223285, 'batch_size': 2534, 'optimizer': 'SGD'}.
2026-06-04 12:43:19,493 - optuna.study.study - INFO - Trial 79 finished with values: [0.008018597722617532, 0.0014250787058744723, 0.004950116426196709] and parameters: {'n_layers': 4, 'embedding_dim': 32, 'lr': 0.0004090776901902334, 'lambda_val': 1.8898212223948182e-06, 'batch_size': 1368, 'optimizer': 'Adam'}.
2026-06-04 12:45:37,701 - experiment_functions - INFO - Early stopping at epoch 3450. Best Metrics: (0.008506848809808594, 0.0015054591734208588, 0.004913121673903922)
2026-06-04 12:45:37,793 - optuna.study.study - INFO - Trial 80 finished with values: [0.008506848809808594, 0.0015054591734208588, 0.004913121673903922] and parameters: {'n_layers': 3, 'embedding_dim': 96, 'lr': 0.0005268211601481077, 'lambda_val': 7.359862236281652e-06, 'batch_size': 3509, 'optimizer': 'Adam'}.
2026-06-04 12:47:04,844 - experiment_functions - INFO - Early stopping at epoch 2300. Best Metrics: (0.004165135280087458, 0.0007887333377989149, 0.0023547725807224833)
2026-06-04 12:47:05,183 - optuna.study.study - INFO - Trial 81 finished with values: [0.004165135280087458, 0.0007887333377989149, 0.0023547725807224833] and parameters: {'n_layers': 1, 'embedding_dim': 96, 'lr': 0.0017568753093311267, 'lambda_val': 0.05198404914652649, 'batch_size': 2438, 'optimizer': 'Adam'}.
2026-06-04 12:48:06,252 - experiment_functions - INFO - Early stopping at epoch 1600. Best Metrics: (0.003361617788966401, 0.0006329961819277917, 0.001915582829155849)
2026-06-04 12:48:06,818 - optuna.study.study - INFO - Trial 82 finished with values: [0.003361617788966401, 0.0006329961819277917, 0.001915582829155849] and parameters: {'n_layers': 4, 'embedding_dim': 32, 'lr': 0.08896930678012212, 'lambda_val': 0.030897456598092354, 'batch_size': 1826, 'optimizer': 'Adam'}.
2026-06-04 12:48:36,330 - experiment_functions - INFO - Early stopping at epoch 750. Best Metrics: (0.0006848060927524208, 8.875343291580147e-05, 0.0003978506431408327)
2026-06-04 12:48:37,038 - optuna.study.study - INFO - Trial 83 finished with values: [0.0006848060927524208, 8.875343291580147e-05, 0.0003978506431408327] and parameters: {'n_layers': 3, 'embedding_dim': 32, 'lr': 2.7474973142173464e-05, 'lambda_val': 0.0007201869356981101, 'batch_size': 3819, 'optimizer': 'RMSprop'}.
2026-06-04 12:49:04,364 - experiment_functions - INFO - Early stopping at epoch 700. Best Metrics: (0.004958635171868833, 0.0008222251992765758, 0.002905692240663328)
2026-06-04 12:49:04,484 - optuna.study.study - INFO - Trial 84 finished with values: [0.004958635171868833, 0.0008222251992765758, 0.002905692240663328] and parameters: {'n_layers': 2, 'embedding_dim': 32, 'lr': 0.005872976959507259, 'lambda_val': 0.00013083520187761867, 'batch_size': 2270, 'optimizer': 'Adam'}.
2026-06-04 12:49:26,709 - experiment_functions - INFO - Early stopping at epoch 550. Best Metrics: (0.0003101728065566928, 5.191238529037444e-05, 0.00014893136839626465)
2026-06-04 12:49:26,794 - optuna.study.study - INFO - Trial 85 finished with values: [0.0003101728065566928, 5.191238529037444e-05, 0.00014893136839626465] and parameters: {'n_layers': 1, 'embedding_dim': 64, 'lr': 2.3129779934941844e-05, 'lambda_val': 0.0006078290875993505, 'batch_size': 1688, 'optimizer': 'Adam'}.
2026-06-04 12:49:59,658 - experiment_functions - INFO - Early stopping at epoch 700. Best Metrics: (0.004230828839885239, 0.0007100274633264116, 0.0025050749149417234)
2026-06-04 12:49:59,747 - optuna.study.study - INFO - Trial 86 finished with values: [0.004230828839885239, 0.0007100274633264116, 0.0025050749149417234] and parameters: {'n_layers': 2, 'embedding_dim': 256, 'lr': 0.02660347787147833, 'lambda_val': 1.0009974035026707e-06, 'batch_size': 1826, 'optimizer': 'RMSprop'}.
2026-06-04 12:51:50,958 - experiment_functions - INFO - Early stopping at epoch 2650. Best Metrics: (0.004532218525349094, 0.0008473440953848216, 0.00243416883104389)
2026-06-04 12:51:51,062 - optuna.study.study - INFO - Trial 87 finished with values: [0.004532218525349094, 0.0008473440953848216, 0.00243416883104389] and parameters: {'n_layers': 1, 'embedding_dim': 256, 'lr': 0.08500719886316734, 'lambda_val': 0.0032296178945151414, 'batch_size': 3482, 'optimizer': 'Adam'}.
2026-06-04 12:54:17,942 - optuna.study.study - INFO - Trial 88 finished with values: [0.0014886178347432448, 0.00024281599571304173, 0.0007001617548261395] and parameters: {'n_layers': 3, 'embedding_dim': 32, 'lr': 0.00018245712030057052, 'lambda_val': 0.030897456598092354, 'batch_size': 3509, 'optimizer': 'RMSprop'}.
2026-06-04 12:56:42,790 - optuna.study.study - INFO - Trial 89 finished with values: [0.004323815031424999, 0.0005861075758590663, 0.002343040945144267] and parameters: {'n_layers': 1, 'embedding_dim': 32, 'lr': 0.00030379311378365113, 'lambda_val': 7.204655475546071e-06, 'batch_size': 2481, 'optimizer': 'RMSprop'}.
2026-06-04 12:58:07,916 - experiment_functions - INFO - Early stopping at epoch 2250. Best Metrics: (0.0042776905144350725, 0.0007820349655033829, 0.002356887131847794)
2026-06-04 12:58:08,103 - optuna.study.study - INFO - Trial 90 finished with values: [0.0042776905144350725, 0.0007820349655033829, 0.002356887131847794] and parameters: {'n_layers': 2, 'embedding_dim': 64, 'lr': 0.005872976959507259, 'lambda_val': 0.06583082636580447, 'batch_size': 2270, 'optimizer': 'Adam'}.
2026-06-04 12:59:28,446 - experiment_functions - INFO - Early stopping at epoch 2150. Best Metrics: (0.0007821386373104919, 0.00011387232902404715, 0.00032497537674820715)
2026-06-04 12:59:28,535 - optuna.study.study - INFO - Trial 91 finished with values: [0.0007821386373104919, 0.00011387232902404715, 0.00032497537674820715] and parameters: {'n_layers': 3, 'embedding_dim': 32, 'lr': 5.440987935404723e-05, 'lambda_val': 4.733054159059329e-05, 'batch_size': 2593, 'optimizer': 'RMSprop'}.
2026-06-04 13:00:28,900 - experiment_functions - INFO - Early stopping at epoch 1500. Best Metrics: (0.009027372551161804, 0.001585839640967245, 0.0051191278592266475)
2026-06-04 13:00:28,998 - optuna.study.study - INFO - Trial 92 finished with values: [0.009027372551161804, 0.001585839640967245, 0.0051191278592266475] and parameters: {'n_layers': 4, 'embedding_dim': 64, 'lr': 0.0008527206735717898, 'lambda_val': 7.359862236281652e-06, 'batch_size': 2516, 'optimizer': 'Adam'}.
2026-06-04 13:02:40,942 - experiment_functions - INFO - Early stopping at epoch 2750. Best Metrics: (0.003977721892927687, 0.0006849085672181661, 0.0020720955585024885)
2026-06-04 13:02:41,967 - optuna.study.study - INFO - Trial 93 finished with values: [0.003977721892927687, 0.0006849085672181661, 0.0020720955585024885] and parameters: {'n_layers': 3, 'embedding_dim': 256, 'lr': 0.013064468809289647, 'lambda_val': 0.07902319768960056, 'batch_size': 928, 'optimizer': 'Adam'}.
2026-06-04 13:03:08,535 - experiment_functions - INFO - Early stopping at epoch 550. Best Metrics: (0.004500877471163606, 0.0008456695023109385, 0.0025984316511030157)
2026-06-04 13:03:09,014 - optuna.study.study - INFO - Trial 94 finished with values: [0.004500877471163606, 0.0008456695023109385, 0.0025984316511030157] and parameters: {'n_layers': 2, 'embedding_dim': 256, 'lr': 0.005913319416099858, 'lambda_val': 0.0037497626023223285, 'batch_size': 3688, 'optimizer': 'RMSprop'}.
2026-06-04 13:06:31,456 - optuna.study.study - INFO - Trial 95 finished with values: [0.0049162690337695, 0.0009293991560050908, 0.0028998910718464523] and parameters: {'n_layers': 4, 'embedding_dim': 256, 'lr': 0.00020086613586383904, 'lambda_val': 0.0494345449176384, 'batch_size': 2991, 'optimizer': 'RMSprop'}.
2026-06-04 13:06:54,581 - experiment_functions - INFO - Early stopping at epoch 550. Best Metrics: (0.0027115450818657304, 0.00046888606068725303, 0.0016437729468183008)
2026-06-04 13:06:54,698 - optuna.study.study - INFO - Trial 96 finished with values: [0.0027115450818657304, 0.00046888606068725303, 0.0016437729468183008] and parameters: {'n_layers': 3, 'embedding_dim': 64, 'lr': 0.08896930678012212, 'lambda_val': 9.66357909942193e-05, 'batch_size': 1776, 'optimizer': 'RMSprop'}.
2026-06-04 13:09:27,093 - optuna.study.study - INFO - Trial 97 finished with values: [0.005517417103532601, 0.0007133766494741778, 0.002865835986134863] and parameters: {'n_layers': 1, 'embedding_dim': 128, 'lr': 0.0003360739085976085, 'lambda_val': 0.000222693868437361, 'batch_size': 3105, 'optimizer': 'RMSprop'}.
2026-06-04 13:09:49,251 - experiment_functions - INFO - Early stopping at epoch 550. Best Metrics: (0.0032519781663769196, 0.0005107508875343292, 0.001739863101023892)
2026-06-04 13:09:49,363 - optuna.study.study - INFO - Trial 98 finished with values: [0.0032519781663769196, 0.0005107508875343292, 0.001739863101023892] and parameters: {'n_layers': 1, 'embedding_dim': 64, 'lr': 0.04650254725176234, 'lambda_val': 1.6849223886789598e-05, 'batch_size': 945, 'optimizer': 'Adam'}.
2026-06-04 13:11:02,716 - experiment_functions - INFO - Early stopping at epoch 1750. Best Metrics: (0.0004861412034848092, 7.368209525085404e-05, 0.00019517883493285057)
2026-06-04 13:11:02,807 - optuna.study.study - INFO - Trial 99 finished with values: [0.0004861412034848092, 7.368209525085404e-05, 0.00019517883493285057] and parameters: {'n_layers': 3, 'embedding_dim': 128, 'lr': 1.7972490093178155e-05, 'lambda_val': 4.733054159059329e-05, 'batch_size': 1676, 'optimizer': 'Adam'}.
2026-06-04 13:12:29,288 - experiment_functions - INFO - Early stopping at epoch 2200. Best Metrics: (0.005126767967783633, 0.0009947082858865295, 0.003057157945934896)
2026-06-04 13:12:29,383 - optuna.study.study - INFO - Trial 100 finished with values: [0.005126767967783633, 0.0009947082858865295, 0.003057157945934896] and parameters: {'n_layers': 4, 'embedding_dim': 64, 'lr': 0.0004090776901902334, 'lambda_val': 0.030897456598092354, 'batch_size': 1946, 'optimizer': 'RMSprop'}.
2026-06-04 13:13:59,249 - experiment_functions - INFO - Early stopping at epoch 2000. Best Metrics: (0.004199229237541939, 0.0007971063031683301, 0.0024260460012466233)
2026-06-04 13:13:59,551 - optuna.study.study - INFO - Trial 101 finished with values: [0.004199229237541939, 0.0007971063031683301, 0.0024260460012466233] and parameters: {'n_layers': 2, 'embedding_dim': 256, 'lr': 0.02660347787147833, 'lambda_val': 0.0037497626023223285, 'batch_size': 1826, 'optimizer': 'RMSprop'}.
2026-06-04 13:14:20,105 - experiment_functions - INFO - Early stopping at epoch 500. Best Metrics: (0.0007297962479273063, 9.37772121374506e-05, 0.00031711885619266665)
2026-06-04 13:14:20,785 - optuna.study.study - INFO - Trial 102 finished with values: [0.0007297962479273063, 9.37772121374506e-05, 0.00031711885619266665] and parameters: {'n_layers': 4, 'embedding_dim': 32, 'lr': 0.00030379311378365113, 'lambda_val': 0.07902319768960056, 'batch_size': 928, 'optimizer': 'Adam'}.
2026-06-04 13:14:52,511 - experiment_functions - INFO - Early stopping at epoch 800. Best Metrics: (0.0034735316210320858, 0.000574385424341885, 0.0020840470698263924)
2026-06-04 13:14:52,597 - optuna.study.study - INFO - Trial 103 finished with values: [0.0034735316210320858, 0.000574385424341885, 0.0020840470698263924] and parameters: {'n_layers': 2, 'embedding_dim': 64, 'lr': 0.02660347787147833, 'lambda_val': 3.648296647252239e-06, 'batch_size': 2516, 'optimizer': 'RMSprop'}.
2026-06-04 13:15:23,421 - experiment_functions - INFO - Early stopping at epoch 600. Best Metrics: (0.005889129558204285, 0.0010516444503985533, 0.003351520863262573)
2026-06-04 13:15:24,460 - optuna.study.study - INFO - Trial 104 finished with values: [0.005889129558204285, 0.0010516444503985533, 0.003351520863262573] and parameters: {'n_layers': 3, 'embedding_dim': 256, 'lr': 0.013064468809289647, 'lambda_val': 7.359862236281652e-06, 'batch_size': 928, 'optimizer': 'Adam'}.
2026-06-04 13:16:27,482 - experiment_functions - INFO - Early stopping at epoch 1300. Best Metrics: (0.004171002404542186, 0.0007552414763212541, 0.002295423161661438)
2026-06-04 13:16:27,568 - optuna.study.study - INFO - Trial 105 finished with values: [0.004171002404542186, 0.0007552414763212541, 0.002295423161661438] and parameters: {'n_layers': 3, 'embedding_dim': 256, 'lr': 0.03873700217879755, 'lambda_val': 0.0013001148419665876, 'batch_size': 1126, 'optimizer': 'RMSprop'}.
2026-06-04 13:16:57,716 - experiment_functions - INFO - Early stopping at epoch 550. Best Metrics: (0.00592702291573936, 0.0010399222988813719, 0.0034511684022258482)
2026-06-04 13:16:57,807 - optuna.study.study - INFO - Trial 106 finished with values: [0.00592702291573936, 0.0010399222988813719, 0.0034511684022258482] and parameters: {'n_layers': 4, 'embedding_dim': 256, 'lr': 0.005913319416099858, 'lambda_val': 0.0029474529646761295, 'batch_size': 2534, 'optimizer': 'Adam'}.
2026-06-04 13:17:26,203 - experiment_functions - INFO - Early stopping at epoch 700. Best Metrics: (0.0038995544863505674, 0.0006681626364793356, 0.002309220514919276)
2026-06-04 13:17:27,161 - optuna.study.study - INFO - Trial 107 finished with values: [0.0038995544863505674, 0.0006681626364793356, 0.002309220514919276] and parameters: {'n_layers': 2, 'embedding_dim': 64, 'lr': 0.021687551243651737, 'lambda_val': 1.0009974035026707e-06, 'batch_size': 1826, 'optimizer': 'RMSprop'}.
2026-06-04 13:19:34,642 - experiment_functions - INFO - Early stopping at epoch 3300. Best Metrics: (0.0046500975207102715, 0.0008825105499363655, 0.002577757049307481)
2026-06-04 13:19:34,714 - optuna.study.study - INFO - Trial 108 finished with values: [0.0046500975207102715, 0.0008825105499363655, 0.002577757049307481] and parameters: {'n_layers': 2, 'embedding_dim': 96, 'lr': 0.0005268211601481077, 'lambda_val': 0.06405803008831426, 'batch_size': 3509, 'optimizer': 'Adam'}.
2026-06-04 13:22:55,227 - optuna.study.study - INFO - Trial 109 finished with values: [0.003626049495294179, 0.0006798847879965168, 0.002219590994096179] and parameters: {'n_layers': 4, 'embedding_dim': 256, 'lr': 0.00020086613586383904, 'lambda_val': 0.0494345449176384, 'batch_size': 1826, 'optimizer': 'RMSprop'}.
2026-06-04 13:25:03,980 - experiment_functions - INFO - Early stopping at epoch 3550. Best Metrics: (0.004188196134976207, 0.0007686382209123184, 0.0022906959180888026)
2026-06-04 13:25:05,114 - optuna.study.study - INFO - Trial 110 finished with values: [0.004188196134976207, 0.0007686382209123184, 0.0022906959180888026] and parameters: {'n_layers': 1, 'embedding_dim': 32, 'lr': 0.007218934143837348, 'lambda_val': 0.061999086231369634, 'batch_size': 2991, 'optimizer': 'Adam'}.
2026-06-04 13:25:50,701 - experiment_functions - INFO - Early stopping at epoch 1200. Best Metrics: (0.003109495413630449, 0.0006329961819277916, 0.0018760795027383218)
2026-06-04 13:25:50,999 - optuna.study.study - INFO - Trial 111 finished with values: [0.003109495413630449, 0.0006329961819277916, 0.0018760795027383218] and parameters: {'n_layers': 3, 'embedding_dim': 32, 'lr': 0.002693732344507712, 'lambda_val': 0.07902319768960056, 'batch_size': 928, 'optimizer': 'Adam'}.
2026-06-04 13:27:18,640 - experiment_functions - INFO - Early stopping at epoch 2200. Best Metrics: (0.0004097193090606373, 7.033290910308795e-05, 0.00019388507482669189)
2026-06-04 13:27:18,757 - optuna.study.study - INFO - Trial 112 finished with values: [0.0004097193090606373, 7.033290910308795e-05, 0.00019388507482669189] and parameters: {'n_layers': 3, 'embedding_dim': 96, 'lr': 1.1731104043124105e-05, 'lambda_val': 1.8898212223948182e-06, 'batch_size': 1825, 'optimizer': 'Adam'}.
2026-06-04 13:28:07,780 - experiment_functions - INFO - Early stopping at epoch 1250. Best Metrics: (0.004507670962821417, 0.0008791613637885993, 0.0025060668319945387)
2026-06-04 13:28:07,849 - optuna.study.study - INFO - Trial 113 finished with values: [0.004507670962821417, 0.0008791613637885993, 0.0025060668319945387] and parameters: {'n_layers': 1, 'embedding_dim': 128, 'lr': 0.002746483851958088, 'lambda_val': 0.05383219142167494, 'batch_size': 3509, 'optimizer': 'RMSprop'}.
2026-06-04 13:30:45,211 - optuna.study.study - INFO - Trial 114 finished with values: [0.0013256434280120547, 0.0002076495411614978, 0.0006861248774141169] and parameters: {'n_layers': 3, 'embedding_dim': 96, 'lr': 0.00014044176795704148, 'lambda_val': 1.3382624515863634e-05, 'batch_size': 1825, 'optimizer': 'Adam'}.
2026-06-04 13:31:37,542 - experiment_functions - INFO - Early stopping at epoch 1350. Best Metrics: (0.004084709320915954, 0.0007535668832473709, 0.0022951694759809267)
2026-06-04 13:31:37,647 - optuna.study.study - INFO - Trial 115 finished with values: [0.004084709320915954, 0.0007535668832473709, 0.0022951694759809267] and parameters: {'n_layers': 2, 'embedding_dim': 64, 'lr': 0.005872976959507259, 'lambda_val': 0.06583082636580447, 'batch_size': 3888, 'optimizer': 'Adam'}.
2026-06-04 13:32:00,086 - experiment_functions - INFO - Early stopping at epoch 500. Best Metrics: (0.0023378541808373454, 0.00035166454551543975, 0.0014327142617756917)
2026-06-04 13:32:00,175 - optuna.study.study - INFO - Trial 116 finished with values: [0.0023378541808373454, 0.00035166454551543975, 0.0014327142617756917] and parameters: {'n_layers': 4, 'embedding_dim': 96, 'lr': 0.08500719886316734, 'lambda_val': 0.06405803008831426, 'batch_size': 2516, 'optimizer': 'RMSprop'}.
2026-06-04 13:34:25,565 - optuna.study.study - INFO - Trial 117 finished with values: [0.0021680689031565075, 0.0003315694286288433, 0.0012653620758905566] and parameters: {'n_layers': 2, 'embedding_dim': 32, 'lr': 0.00019906292920670134, 'lambda_val': 0.00013083520187761867, 'batch_size': 3888, 'optimizer': 'Adam'}.
2026-06-04 13:34:54,717 - experiment_functions - INFO - Early stopping at epoch 750. Best Metrics: (0.004561311040079408, 0.000760265255542903, 0.0026996793223940624)
2026-06-04 13:34:54,948 - optuna.study.study - INFO - Trial 118 finished with values: [0.004561311040079408, 0.000760265255542903, 0.0026996793223940624] and parameters: {'n_layers': 2, 'embedding_dim': 32, 'lr': 0.005872976959507259, 'lambda_val': 7.204655475546071e-06, 'batch_size': 2270, 'optimizer': 'RMSprop'}.
2026-06-04 13:35:25,103 - experiment_functions - INFO - Early stopping at epoch 550. Best Metrics: (0.005128046246527085, 0.0009076294460446113, 0.002944735933898887)
2026-06-04 13:35:25,438 - optuna.study.study - INFO - Trial 119 finished with values: [0.005128046246527085, 0.0009076294460446113, 0.002944735933898887] and parameters: {'n_layers': 4, 'embedding_dim': 256, 'lr': 0.08896930678012212, 'lambda_val': 1.0009974035026707e-06, 'batch_size': 1826, 'optimizer': 'Adam'}.
2026-06-04 13:37:47,787 - optuna.study.study - INFO - Trial 120 finished with values: [0.002174038409278027, 0.00030310134637283147, 0.001296785920167145] and parameters: {'n_layers': 1, 'embedding_dim': 32, 'lr': 0.00030379311378365113, 'lambda_val': 6.3660771256163535e-06, 'batch_size': 644, 'optimizer': 'Adam'}.
2026-06-04 13:38:59,415 - experiment_functions - INFO - Early stopping at epoch 1950. Best Metrics: (0.003848027293277395, 0.0007920825239466809, 0.0022551178459943523)
2026-06-04 13:38:59,500 - optuna.study.study - INFO - Trial 121 finished with values: [0.003848027293277395, 0.0007920825239466809, 0.0022551178459943523] and parameters: {'n_layers': 1, 'embedding_dim': 32, 'lr': 0.03873700217879755, 'lambda_val': 0.061999086231369634, 'batch_size': 2991, 'optimizer': 'RMSprop'}.
2026-06-04 13:39:52,160 - experiment_functions - INFO - Early stopping at epoch 1000. Best Metrics: (0.00903652555310155, 0.0017181324938040055, 0.0054560608367735484)
2026-06-04 13:39:52,239 - optuna.study.study - INFO - Trial 122 finished with values: [0.00903652555310155, 0.0017181324938040055, 0.0054560608367735484] and parameters: {'n_layers': 4, 'embedding_dim': 256, 'lr': 0.0014181685787657509, 'lambda_val': 5.016933039935782e-06, 'batch_size': 739, 'optimizer': 'Adam'}.
2026-06-04 13:40:34,757 - experiment_functions - INFO - Early stopping at epoch 850. Best Metrics: (0.006137570770931964, 0.0011504454417576528, 0.0035232172330338656)
