2026-06-03 17:01:48,924 - optuna.study.study - INFO - Trial 235 finished with values: [0.005852456353366141, 0.0017214816799517717, 0.003882511268285444] and parameters: {'n_layers': 1, 'embedding_dim': 32, 'lr': 0.0018644973108911816, 'lambda_val': 2.6151941707099572e-05, 'batch_size': 569, 'optimizer': 'Adam'}.
2026-06-03 17:02:11,499 - experiment_functions - INFO - Early stopping at epoch 550. Best Metrics: (0.001933794638051975, 0.0006162502511889611, 0.0012972943178698312)
2026-06-03 17:02:11,582 - optuna.study.study - INFO - Trial 236 finished with values: [0.001933794638051975, 0.0006162502511889611, 0.0012972943178698312] and parameters: {'n_layers': 2, 'embedding_dim': 64, 'lr': 0.01506522012263809, 'lambda_val': 0.0006859838564406128, 'batch_size': 1352, 'optimizer': 'Adam'}.
2026-06-03 17:02:38,161 - experiment_functions - INFO - Early stopping at epoch 600. Best Metrics: (0.004437095220684708, 0.0016310536539620873, 0.0032667800897018284)
2026-06-03 17:02:38,240 - optuna.study.study - INFO - Trial 237 finished with values: [0.004437095220684708, 0.0016310536539620873, 0.0032667800897018284] and parameters: {'n_layers': 1, 'embedding_dim': 256, 'lr': 0.0018644973108911816, 'lambda_val': 8.536566464955742e-05, 'batch_size': 2369, 'optimizer': 'RMSprop'}.
2026-06-03 17:03:05,579 - experiment_functions - INFO - Early stopping at epoch 650. Best Metrics: (0.0027563471463885308, 0.0009578672382611025, 0.0019521125973897748)
2026-06-03 17:03:05,669 - optuna.study.study - INFO - Trial 238 finished with values: [0.0027563471463885308, 0.0009578672382611025, 0.0019521125973897748] and parameters: {'n_layers': 2, 'embedding_dim': 128, 'lr': 0.0018644973108911816, 'lambda_val': 0.0006859838564406128, 'batch_size': 571, 'optimizer': 'Adam'}.
2026-06-03 17:04:07,050 - experiment_functions - INFO - Early stopping at epoch 1650. Best Metrics: (0.00535055445992342, 0.0015875142340411282, 0.003632971309026647)
2026-06-03 17:04:07,107 - optuna.study.study - INFO - Trial 239 finished with values: [0.00535055445992342, 0.0015875142340411282, 0.003632971309026647] and parameters: {'n_layers': 1, 'embedding_dim': 64, 'lr': 0.0006158877725370185, 'lambda_val': 0.0015102413658479369, 'batch_size': 1352, 'optimizer': 'Adam'}.
2026-06-03 17:04:29,230 - experiment_functions - INFO - Early stopping at epoch 550. Best Metrics: (0.003621215924690887, 0.0011336995110188225, 0.002360647563393143)
2026-06-03 17:04:29,297 - optuna.study.study - INFO - Trial 240 finished with values: [0.003621215924690887, 0.0011336995110188225, 0.002360647563393143] and parameters: {'n_layers': 1, 'embedding_dim': 64, 'lr': 0.027736462027974734, 'lambda_val': 1.1031019465465648e-05, 'batch_size': 2369, 'optimizer': 'Adam'}.
2026-06-03 17:05:12,062 - experiment_functions - INFO - Early stopping at epoch 1150. Best Metrics: (0.006046785454102231, 0.0017181324938040058, 0.003889176132633283)
2026-06-03 17:05:12,144 - optuna.study.study - INFO - Trial 241 finished with values: [0.006046785454102231, 0.0017181324938040058, 0.003889176132633283] and parameters: {'n_layers': 1, 'embedding_dim': 32, 'lr': 0.0018644973108911816, 'lambda_val': 3.6015692758113356e-06, 'batch_size': 569, 'optimizer': 'Adam'}.
2026-06-03 17:07:39,429 - optuna.study.study - INFO - Trial 242 finished with values: [0.0046751615069241526, 0.0014284278920222388, 0.0031400489545206174] and parameters: {'n_layers': 2, 'embedding_dim': 64, 'lr': 0.00027592593816554693, 'lambda_val': 3.6015692758113356e-06, 'batch_size': 1182, 'optimizer': 'RMSprop'}.
2026-06-03 17:08:46,483 - experiment_functions - INFO - Early stopping at epoch 1600. Best Metrics: (0.005178080425097867, 0.0018822426150445443, 0.0038611874630498175)
2026-06-03 17:08:46,558 - optuna.study.study - INFO - Trial 243 finished with values: [0.005178080425097867, 0.0018822426150445443, 0.0038611874630498175] and parameters: {'n_layers': 1, 'embedding_dim': 256, 'lr': 0.0006158877725370185, 'lambda_val': 2.6151941707099572e-05, 'batch_size': 2232, 'optimizer': 'Adam'}.
2026-06-03 17:11:12,678 - optuna.study.study - INFO - Trial 244 finished with values: [0.005304977421157601, 0.001721481679951772, 0.0036765304647724093] and parameters: {'n_layers': 1, 'embedding_dim': 64, 'lr': 0.0003870837679520275, 'lambda_val': 8.536566464955742e-05, 'batch_size': 2369, 'optimizer': 'Adam'}.
2026-06-03 17:11:34,921 - experiment_functions - INFO - Early stopping at epoch 550. Best Metrics: (0.002113250858875313, 0.0006899323464398152, 0.001421972173926237)
2026-06-03 17:11:35,012 - optuna.study.study - INFO - Trial 245 finished with values: [0.002113250858875313, 0.0006899323464398152, 0.001421972173926237] and parameters: {'n_layers': 2, 'embedding_dim': 64, 'lr': 0.005194863702442923, 'lambda_val': 3.6015692758113356e-06, 'batch_size': 571, 'optimizer': 'Adam'}.
2026-06-03 17:13:56,295 - experiment_functions - INFO - Early stopping at epoch 3800. Best Metrics: (0.005347679419101131, 0.001905686918078907, 0.003987779824678011)
2026-06-03 17:13:56,389 - optuna.study.study - INFO - Trial 246 finished with values: [0.005347679419101131, 0.001905686918078907, 0.003987779824678011] and parameters: {'n_layers': 1, 'embedding_dim': 96, 'lr': 0.0006158877725370185, 'lambda_val': 2.6151941707099572e-05, 'batch_size': 1314, 'optimizer': 'Adam'}.
2026-06-03 17:15:26,678 - experiment_functions - INFO - Early stopping at epoch 2200. Best Metrics: (0.005818882160804474, 0.0020028133163641237, 0.0043838279641253185)
2026-06-03 17:15:27,610 - optuna.study.study - INFO - Trial 247 finished with values: [0.005818882160804474, 0.0020028133163641237, 0.0043838279641253185] and parameters: {'n_layers': 1, 'embedding_dim': 256, 'lr': 0.0006158877725370185, 'lambda_val': 3.6015692758113356e-06, 'batch_size': 1195, 'optimizer': 'RMSprop'}.
2026-06-03 17:17:10,734 - experiment_functions - INFO - Early stopping at epoch 2500. Best Metrics: (0.005380052838631267, 0.0019542501172215153, 0.004100578927187926)
2026-06-03 17:17:11,514 - optuna.study.study - INFO - Trial 248 finished with values: [0.005380052838631267, 0.0019542501172215153, 0.004100578927187926] and parameters: {'n_layers': 1, 'embedding_dim': 256, 'lr': 0.0006158877725370185, 'lambda_val': 2.697820276812544e-06, 'batch_size': 1352, 'optimizer': 'Adam'}.
2026-06-03 17:19:03,113 - experiment_functions - INFO - Early stopping at epoch 3100. Best Metrics: (0.0049804251114564015, 0.001612633130149374, 0.0034009165445457405)
2026-06-03 17:19:03,209 - optuna.study.study - INFO - Trial 249 finished with values: [0.0049804251114564015, 0.001612633130149374, 0.0034009165445457405] and parameters: {'n_layers': 1, 'embedding_dim': 32, 'lr': 0.0006158877725370185, 'lambda_val': 2.697820276812544e-06, 'batch_size': 2526, 'optimizer': 'Adam'}.
2026-06-03 17:20:16,162 - experiment_functions - INFO - Early stopping at epoch 1750. Best Metrics: (0.005244995499507905, 0.0018906155804139597, 0.0038719862889862403)
2026-06-03 17:20:16,254 - optuna.study.study - INFO - Trial 250 finished with values: [0.005244995499507905, 0.0018906155804139597, 0.0038719862889862403] and parameters: {'n_layers': 1, 'embedding_dim': 256, 'lr': 0.0006158877725370185, 'lambda_val': 0.0006859838564406128, 'batch_size': 1352, 'optimizer': 'Adam'}.
2026-06-03 17:20:51,777 - experiment_functions - INFO - Early stopping at epoch 950. Best Metrics: (0.0058021429072451, 0.0017013865630651753, 0.003793121213782841)
2026-06-03 17:20:52,005 - optuna.study.study - INFO - Trial 251 finished with values: [0.0058021429072451, 0.0017013865630651753, 0.003793121213782841] and parameters: {'n_layers': 1, 'embedding_dim': 32, 'lr': 0.0018644973108911816, 'lambda_val': 2.6151941707099572e-05, 'batch_size': 1352, 'optimizer': 'Adam'}.
2026-06-03 17:22:22,865 - experiment_functions - INFO - Early stopping at epoch 2200. Best Metrics: (0.005544727365423696, 0.0020044879094380068, 0.004252730970403253)
2026-06-03 17:22:22,954 - optuna.study.study - INFO - Trial 252 finished with values: [0.005544727365423696, 0.0020044879094380068, 0.004252730970403253] and parameters: {'n_layers': 1, 'embedding_dim': 256, 'lr': 0.0006158877725370185, 'lambda_val': 2.697820276812544e-06, 'batch_size': 1195, 'optimizer': 'Adam'}.
2026-06-03 17:23:16,366 - experiment_functions - INFO - Early stopping at epoch 1200. Best Metrics: (0.0041233999577793825, 0.0013832138790273963, 0.002899274701591959)
2026-06-03 17:23:16,510 - optuna.study.study - INFO - Trial 253 finished with values: [0.0041233999577793825, 0.0013832138790273963, 0.002899274701591959] and parameters: {'n_layers': 2, 'embedding_dim': 256, 'lr': 0.0006158877725370185, 'lambda_val': 8.536566464955742e-05, 'batch_size': 1195, 'optimizer': 'Adam'}.
2026-06-03 17:23:40,248 - experiment_functions - INFO - Early stopping at epoch 600. Best Metrics: (0.004734907894945914, 0.0016779422600308128, 0.003381129120859653)
2026-06-03 17:23:40,323 - optuna.study.study - INFO - Trial 254 finished with values: [0.004734907894945914, 0.0016779422600308128, 0.003381129120859653] and parameters: {'n_layers': 1, 'embedding_dim': 64, 'lr': 0.005194863702442923, 'lambda_val': 2.6151941707099572e-05, 'batch_size': 2170, 'optimizer': 'Adam'}.
2026-06-03 17:25:05,306 - experiment_functions - INFO - Early stopping at epoch 2050. Best Metrics: (0.005581109938319546, 0.00200616250251189, 0.004382807195916158)
2026-06-03 17:25:05,697 - optuna.study.study - INFO - Trial 255 finished with values: [0.005581109938319546, 0.00200616250251189, 0.004382807195916158] and parameters: {'n_layers': 1, 'embedding_dim': 256, 'lr': 0.0006158877725370185, 'lambda_val': 1.1031019465465648e-05, 'batch_size': 1763, 'optimizer': 'Adam'}.
2026-06-03 17:26:47,642 - experiment_functions - INFO - Early stopping at epoch 2500. Best Metrics: (0.005882536446813282, 0.00206142407395003, 0.0043251203898486395)
2026-06-03 17:26:47,719 - optuna.study.study - INFO - Trial 256 finished with values: [0.005882536446813282, 0.00206142407395003, 0.0043251203898486395] and parameters: {'n_layers': 1, 'embedding_dim': 256, 'lr': 0.0006158877725370185, 'lambda_val': 1.1031019465465648e-05, 'batch_size': 1352, 'optimizer': 'RMSprop'}.
2026-06-03 17:27:11,434 - experiment_functions - INFO - Early stopping at epoch 600. Best Metrics: (0.0050258575588072955, 0.0016176569093710228, 0.003468729251958247)
2026-06-03 17:27:11,566 - optuna.study.study - INFO - Trial 257 finished with values: [0.0050258575588072955, 0.0016176569093710228, 0.003468729251958247] and parameters: {'n_layers': 1, 'embedding_dim': 32, 'lr': 0.005194863702442923, 'lambda_val': 8.536566464955742e-05, 'batch_size': 2500, 'optimizer': 'Adam'}.
2026-06-03 17:27:37,738 - experiment_functions - INFO - Early stopping at epoch 600. Best Metrics: (0.0015797346802198602, 0.0004253466407662938, 0.0009062174370305368)
2026-06-03 17:27:37,809 - optuna.study.study - INFO - Trial 258 finished with values: [0.0015797346802198602, 0.0004253466407662938, 0.0009062174370305368] and parameters: {'n_layers': 1, 'embedding_dim': 256, 'lr': 0.029472125543766683, 'lambda_val': 2.697820276812544e-06, 'batch_size': 1195, 'optimizer': 'RMSprop'}.
2026-06-03 17:28:40,644 - experiment_functions - INFO - Early stopping at epoch 1500. Best Metrics: (0.0051658878062846815, 0.0018772188358228952, 0.004017254971391799)
2026-06-03 17:28:40,734 - optuna.study.study - INFO - Trial 259 finished with values: [0.0051658878062846815, 0.0018772188358228952, 0.004017254971391799] and parameters: {'n_layers': 1, 'embedding_dim': 256, 'lr': 0.0006158877725370185, 'lambda_val': 2.697820276812544e-06, 'batch_size': 2447, 'optimizer': 'Adam'}.
2026-06-03 17:29:18,865 - experiment_functions - INFO - Early stopping at epoch 900. Best Metrics: (0.005348992920096818, 0.001815258892089222, 0.003794615111791401)
2026-06-03 17:29:18,935 - optuna.study.study - INFO - Trial 260 finished with values: [0.005348992920096818, 0.001815258892089222, 0.003794615111791401] and parameters: {'n_layers': 1, 'embedding_dim': 256, 'lr': 0.0010433155335864835, 'lambda_val': 2.6151941707099572e-05, 'batch_size': 1195, 'optimizer': 'RMSprop'}.
2026-06-03 17:30:01,881 - experiment_functions - INFO - Early stopping at epoch 950. Best Metrics: (0.003908219940274009, 0.0013379998660325541, 0.002921862308952824)
2026-06-03 17:30:01,950 - optuna.study.study - INFO - Trial 261 finished with values: [0.003908219940274009, 0.0013379998660325541, 0.002921862308952824] and parameters: {'n_layers': 2, 'embedding_dim': 256, 'lr': 0.0006158877725370185, 'lambda_val': 2.697820276812544e-06, 'batch_size': 1352, 'optimizer': 'Adam'}.
2026-06-03 17:30:31,199 - experiment_functions - INFO - Early stopping at epoch 750. Best Metrics: (0.005065954650670728, 0.0016444503985531518, 0.0033479524708073956)
2026-06-03 17:30:32,051 - optuna.study.study - INFO - Trial 262 finished with values: [0.005065954650670728, 0.0016444503985531518, 0.0033479524708073956] and parameters: {'n_layers': 1, 'embedding_dim': 64, 'lr': 0.0018644973108911816, 'lambda_val': 2.6151941707099572e-05, 'batch_size': 2369, 'optimizer': 'Adam'}.
2026-06-03 17:31:25,758 - experiment_functions - INFO - Early stopping at epoch 1150. Best Metrics: (0.0036959054973622414, 0.0012375242815995714, 0.002596262499934348)
2026-06-03 17:31:25,835 - optuna.study.study - INFO - Trial 263 finished with values: [0.0036959054973622414, 0.0012375242815995714, 0.002596262499934348] and parameters: {'n_layers': 3, 'embedding_dim': 256, 'lr': 0.0006158877725370185, 'lambda_val': 2.697820276812544e-06, 'batch_size': 569, 'optimizer': 'Adam'}.
2026-06-03 17:33:50,549 - optuna.study.study - INFO - Trial 264 finished with values: [0.005607437678657972, 0.0017700448790943799, 0.0037478126458362535] and parameters: {'n_layers': 1, 'embedding_dim': 64, 'lr': 0.0003870837679520275, 'lambda_val': 2.6151941707099572e-05, 'batch_size': 1314, 'optimizer': 'Adam'}.
2026-06-03 17:36:02,154 - experiment_functions - INFO - Early stopping at epoch 3200. Best Metrics: (0.005359879607881385, 0.0019760198271819946, 0.004132163249196644)
2026-06-03 17:36:02,273 - optuna.study.study - INFO - Trial 265 finished with values: [0.005359879607881385, 0.0019760198271819946, 0.004132163249196644] and parameters: {'n_layers': 1, 'embedding_dim': 256, 'lr': 0.0006158877725370185, 'lambda_val': 3.6015692758113356e-06, 'batch_size': 1352, 'optimizer': 'Adam'}.
2026-06-03 17:37:17,783 - experiment_functions - INFO - Early stopping at epoch 1800. Best Metrics: (0.004959784391985271, 0.0018336794159019357, 0.003678958849503488)
2026-06-03 17:37:18,560 - optuna.study.study - INFO - Trial 266 finished with values: [0.004959784391985271, 0.0018336794159019357, 0.003678958849503488] and parameters: {'n_layers': 1, 'embedding_dim': 256, 'lr': 0.00058211761161888, 'lambda_val': 3.6015692758113356e-06, 'batch_size': 3046, 'optimizer': 'Adam'}.
2026-06-03 17:37:42,620 - experiment_functions - INFO - Early stopping at epoch 600. Best Metrics: (0.005225010459657846, 0.0018219572643847547, 0.003811643375702079)
2026-06-03 17:37:42,708 - optuna.study.study - INFO - Trial 267 finished with values: [0.005225010459657846, 0.0018219572643847547, 0.003811643375702079] and parameters: {'n_layers': 1, 'embedding_dim': 64, 'lr': 0.005194863702442923, 'lambda_val': 3.6015692758113356e-06, 'batch_size': 2369, 'optimizer': 'Adam'}.
2026-06-03 17:38:12,662 - experiment_functions - INFO - Early stopping at epoch 750. Best Metrics: (0.005492963257241237, 0.0018772188358228952, 0.004015256075041744)
2026-06-03 17:38:12,741 - optuna.study.study - INFO - Trial 268 finished with values: [0.005492963257241237, 0.0018772188358228952, 0.004015256075041744] and parameters: {'n_layers': 1, 'embedding_dim': 96, 'lr': 0.0018644973108911816, 'lambda_val': 0.001214972879722574, 'batch_size': 1352, 'optimizer': 'Adam'}.
2026-06-03 17:38:55,257 - experiment_functions - INFO - Early stopping at epoch 1000. Best Metrics: (0.0049172474897900146, 0.001796838368276509, 0.003702488978261525)
2026-06-03 17:38:55,374 - optuna.study.study - INFO - Trial 269 finished with values: [0.0049172474897900146, 0.001796838368276509, 0.003702488978261525] and parameters: {'n_layers': 1, 'embedding_dim': 256, 'lr': 0.0010433155335864835, 'lambda_val': 2.0773857435136326e-05, 'batch_size': 1195, 'optimizer': 'RMSprop'}.
2026-06-03 17:39:29,478 - experiment_functions - INFO - Early stopping at epoch 900. Best Metrics: (0.00409209669336524, 0.0011789135240136647, 0.0027278610155561647)
2026-06-03 17:39:29,554 - optuna.study.study - INFO - Trial 270 finished with values: [0.00409209669336524, 0.0011789135240136647, 0.0027278610155561647] and parameters: {'n_layers': 2, 'embedding_dim': 32, 'lr': 0.0013766733587116105, 'lambda_val': 0.000717916479371018, 'batch_size': 1195, 'optimizer': 'Adam'}.
2026-06-03 17:40:19,195 - experiment_functions - INFO - Early stopping at epoch 1350. Best Metrics: (0.006385716796131972, 0.0017867908098332104, 0.0041132350539590705)
2026-06-03 17:40:19,550 - optuna.study.study - INFO - Trial 271 finished with values: [0.006385716796131972, 0.0017867908098332104, 0.0041132350539590705] and parameters: {'n_layers': 1, 'embedding_dim': 32, 'lr': 0.0018644973108911816, 'lambda_val': 1.2299853064209968e-05, 'batch_size': 569, 'optimizer': 'Adam'}.
2026-06-03 17:40:43,137 - experiment_functions - INFO - Early stopping at epoch 550. Best Metrics: (0.003319611022344993, 0.001111929801058343, 0.0022216988883561376)
2026-06-03 17:40:43,244 - optuna.study.study - INFO - Trial 272 finished with values: [0.003319611022344993, 0.001111929801058343, 0.0022216988883561376] and parameters: {'n_layers': 2, 'embedding_dim': 128, 'lr': 0.005194863702442923, 'lambda_val': 3.6015692758113356e-06, 'batch_size': 1314, 'optimizer': 'Adam'}.
2026-06-03 17:42:57,908 - experiment_functions - INFO - Early stopping at epoch 3700. Best Metrics: (0.00543926283182717, 0.0019207582557438545, 0.0039080290167973165)
2026-06-03 17:42:57,987 - optuna.study.study - INFO - Trial 273 finished with values: [0.00543926283182717, 0.0019207582557438545, 0.0039080290167973165] and parameters: {'n_layers': 1, 'embedding_dim': 64, 'lr': 0.0006158877725370185, 'lambda_val': 3.6015692758113356e-06, 'batch_size': 1352, 'optimizer': 'Adam'}.
2026-06-03 17:44:21,308 - experiment_functions - INFO - Early stopping at epoch 2000. Best Metrics: (0.004859380504856415, 0.001937504186482685, 0.003756343948383476)
2026-06-03 17:44:21,403 - optuna.study.study - INFO - Trial 274 finished with values: [0.004859380504856415, 0.001937504186482685, 0.003756343948383476] and parameters: {'n_layers': 1, 'embedding_dim': 256, 'lr': 0.00058211761161888, 'lambda_val': 2.697820276812544e-06, 'batch_size': 3046, 'optimizer': 'Adam'}.
2026-06-03 17:45:47,594 - experiment_functions - INFO - Early stopping at epoch 2350. Best Metrics: (0.005620005859305161, 0.0018320048228280528, 0.003952007272863056)
2026-06-03 17:45:47,916 - optuna.study.study - INFO - Trial 275 finished with values: [0.005620005859305161, 0.0018320048228280528, 0.003952007272863056] and parameters: {'n_layers': 1, 'embedding_dim': 64, 'lr': 0.0006158877725370185, 'lambda_val': 0.00023025798022303974, 'batch_size': 2353, 'optimizer': 'Adam'}.
2026-06-03 17:46:58,631 - experiment_functions - INFO - Early stopping at epoch 1700. Best Metrics: (0.0056594942936823035, 0.001979369013329761, 0.004290616818180472)
2026-06-03 17:46:58,715 - optuna.study.study - INFO - Trial 276 finished with values: [0.0056594942936823035, 0.001979369013329761, 0.004290616818180472] and parameters: {'n_layers': 1, 'embedding_dim': 256, 'lr': 0.0006158877725370185, 'lambda_val': 0.00014066527401303662, 'batch_size': 1314, 'optimizer': 'Adam'}.
2026-06-03 17:47:57,456 - experiment_functions - INFO - Early stopping at epoch 1400. Best Metrics: (0.005538117372165962, 0.0020078370955857725, 0.004223161691482164)
2026-06-03 17:47:57,551 - optuna.study.study - INFO - Trial 277 finished with values: [0.005538117372165962, 0.0020078370955857725, 0.004223161691482164] and parameters: {'n_layers': 1, 'embedding_dim': 256, 'lr': 0.0010433155335864835, 'lambda_val': 0.00014066527401303662, 'batch_size': 1195, 'optimizer': 'Adam'}.
2026-06-03 17:49:45,128 - experiment_functions - INFO - Early stopping at epoch 2900. Best Metrics: (0.005914856134255925, 0.0018973139527094919, 0.004367144013004077)
2026-06-03 17:49:45,212 - optuna.study.study - INFO - Trial 278 finished with values: [0.005914856134255925, 0.0018973139527094919, 0.004367144013004077] and parameters: {'n_layers': 1, 'embedding_dim': 96, 'lr': 0.0006158877725370185, 'lambda_val': 2.697820276812544e-06, 'batch_size': 1195, 'optimizer': 'Adam'}.
2026-06-03 17:50:29,942 - experiment_functions - INFO - Early stopping at epoch 1050. Best Metrics: (0.004502631191005753, 0.0017466005760600175, 0.003388158894315548)
2026-06-03 17:50:30,517 - optuna.study.study - INFO - Trial 279 finished with values: [0.004502631191005753, 0.0017466005760600175, 0.003388158894315548] and parameters: {'n_layers': 1, 'embedding_dim': 256, 'lr': 0.0006158877725370185, 'lambda_val': 0.00014066527401303662, 'batch_size': 4027, 'optimizer': 'RMSprop'}.
2026-06-03 17:52:25,817 - experiment_functions - INFO - Early stopping at epoch 2800. Best Metrics: (0.005673415651409514, 0.002051376515506732, 0.004246732363553245)
2026-06-03 17:52:25,904 - optuna.study.study - INFO - Trial 280 finished with values: [0.005673415651409514, 0.002051376515506732, 0.004246732363553245] and parameters: {'n_layers': 1, 'embedding_dim': 256, 'lr': 0.0006158877725370185, 'lambda_val': 1.1031019465465648e-05, 'batch_size': 1195, 'optimizer': 'Adam'}.
2026-06-03 17:52:52,473 - experiment_functions - INFO - Early stopping at epoch 600. Best Metrics: (0.005031365078559499, 0.0018487507535668833, 0.003771825485063488)
