2026-06-04 01:48:36,105 - optuna.study.study - INFO - Trial 68 finished with values: [0.005090566317884616, 0.0009310737490789739, 0.0028876129925148246] and parameters: {'n_layers': 3, 'embedding_dim': 256, 'lr': 0.005091659899861729, 'lambda_val': 0.006861251862596191, 'batch_size': 1158, 'optimizer': 'Adam'}.
2026-06-04 01:48:58,905 - experiment_functions - INFO - Early stopping at epoch 500. Best Metrics: (0.0005978715503800908, 6.865831602920491e-05, 0.00024949988368881)
2026-06-04 01:48:58,997 - optuna.study.study - INFO - Trial 69 finished with values: [0.0005978715503800908, 6.865831602920491e-05, 0.00024949988368881] and parameters: {'n_layers': 4, 'embedding_dim': 96, 'lr': 0.0001256961984687397, 'lambda_val': 0.006861251862596191, 'batch_size': 3545, 'optimizer': 'SGD'}.
2026-06-04 01:49:22,747 - experiment_functions - INFO - Early stopping at epoch 500. Best Metrics: (0.0005128963149085153, 6.698372295532187e-05, 0.0002310965530938721)
2026-06-04 01:49:22,853 - optuna.study.study - INFO - Trial 70 finished with values: [0.0005128963149085153, 6.698372295532187e-05, 0.0002310965530938721] and parameters: {'n_layers': 4, 'embedding_dim': 128, 'lr': 0.04830220176028814, 'lambda_val': 0.006861251862596191, 'batch_size': 3545, 'optimizer': 'SGD'}.
2026-06-04 01:51:49,424 - optuna.study.study - INFO - Trial 71 finished with values: [0.005201038276091325, 0.0008808359568624824, 0.002995772492030703] and parameters: {'n_layers': 2, 'embedding_dim': 32, 'lr': 0.0006097425316287412, 'lambda_val': 2.2435960383986775e-06, 'batch_size': 3931, 'optimizer': 'Adam'}.
2026-06-04 01:52:25,631 - experiment_functions - INFO - Early stopping at epoch 900. Best Metrics: (0.003771181337707779, 0.0007050036841047626, 0.002299368367071757)
2026-06-04 01:52:26,136 - optuna.study.study - INFO - Trial 72 finished with values: [0.003771181337707779, 0.0007050036841047626, 0.002299368367071757] and parameters: {'n_layers': 1, 'embedding_dim': 128, 'lr': 0.005720533217630053, 'lambda_val': 0.0016044761768607098, 'batch_size': 1526, 'optimizer': 'RMSprop'}.
2026-06-04 01:53:04,440 - experiment_functions - INFO - Early stopping at epoch 800. Best Metrics: (0.004398282028383836, 0.0008389711300154064, 0.002389193390892102)
2026-06-04 01:53:04,613 - optuna.study.study - INFO - Trial 73 finished with values: [0.004398282028383836, 0.0008389711300154064, 0.002389193390892102] and parameters: {'n_layers': 2, 'embedding_dim': 256, 'lr': 0.005091659899861729, 'lambda_val': 0.07191932301410733, 'batch_size': 1780, 'optimizer': 'Adam'}.
2026-06-04 01:55:30,701 - optuna.study.study - INFO - Trial 74 finished with values: [0.0016823959753466586, 0.00023779221649139262, 0.0009216852921284423] and parameters: {'n_layers': 2, 'embedding_dim': 32, 'lr': 0.00015842116483563462, 'lambda_val': 7.753300191826788e-06, 'batch_size': 3931, 'optimizer': 'Adam'}.
2026-06-04 01:56:20,593 - experiment_functions - INFO - Early stopping at epoch 950. Best Metrics: (0.008516252551150254, 0.0015573715587112334, 0.00469898518660065)
2026-06-04 01:56:21,296 - optuna.study.study - INFO - Trial 75 finished with values: [0.008516252551150254, 0.0015573715587112334, 0.00469898518660065] and parameters: {'n_layers': 4, 'embedding_dim': 256, 'lr': 0.0009744505282133616, 'lambda_val': 2.6963455125652685e-06, 'batch_size': 3212, 'optimizer': 'RMSprop'}.
2026-06-04 01:59:30,001 - optuna.study.study - INFO - Trial 76 finished with values: [0.003256892578874155, 0.0005526157143814053, 0.0018932537781876867] and parameters: {'n_layers': 3, 'embedding_dim': 256, 'lr': 0.00016964892264349868, 'lambda_val': 0.00013240141630371793, 'batch_size': 2817, 'optimizer': 'Adam'}.
2026-06-04 01:59:58,481 - experiment_functions - INFO - Early stopping at epoch 700. Best Metrics: (0.004051302740604534, 0.0006782101949226338, 0.0024362972463150864)
2026-06-04 01:59:58,584 - optuna.study.study - INFO - Trial 77 finished with values: [0.004051302740604534, 0.0006782101949226338, 0.0024362972463150864] and parameters: {'n_layers': 1, 'embedding_dim': 128, 'lr': 0.006823905996005937, 'lambda_val': 0.00026012148846087845, 'batch_size': 3623, 'optimizer': 'RMSprop'}.
2026-06-04 02:00:23,368 - experiment_functions - INFO - Early stopping at epoch 550. Best Metrics: (0.004599383068256885, 0.0007904079308727979, 0.0026075981252784318)
2026-06-04 02:00:24,113 - optuna.study.study - INFO - Trial 78 finished with values: [0.004599383068256885, 0.0007904079308727979, 0.0026075981252784318] and parameters: {'n_layers': 3, 'embedding_dim': 128, 'lr': 0.02841103786793073, 'lambda_val': 5.6114562068405035e-05, 'batch_size': 1720, 'optimizer': 'RMSprop'}.
2026-06-04 02:00:46,632 - experiment_functions - INFO - Early stopping at epoch 550. Best Metrics: (0.003513871360596496, 0.0005542903074552885, 0.0021349182807481057)
2026-06-04 02:00:46,780 - optuna.study.study - INFO - Trial 79 finished with values: [0.003513871360596496, 0.0005542903074552885, 0.0021349182807481057] and parameters: {'n_layers': 1, 'embedding_dim': 96, 'lr': 0.00832134173144575, 'lambda_val': 0.000877334254045309, 'batch_size': 3694, 'optimizer': 'RMSprop'}.
2026-06-04 02:01:16,465 - experiment_functions - INFO - Early stopping at epoch 700. Best Metrics: (0.005289910557892238, 0.0009176770044879095, 0.0030078975211021777)
2026-06-04 02:01:16,727 - optuna.study.study - INFO - Trial 80 finished with values: [0.005289910557892238, 0.0009176770044879095, 0.0030078975211021777] and parameters: {'n_layers': 2, 'embedding_dim': 128, 'lr': 0.004527047386587098, 'lambda_val': 0.00026012148846087845, 'batch_size': 1923, 'optimizer': 'Adam'}.
2026-06-04 02:02:46,881 - experiment_functions - INFO - Early stopping at epoch 2450. Best Metrics: (0.003485936080807906, 0.0006112264719673119, 0.0018261387487701803)
2026-06-04 02:02:47,041 - optuna.study.study - INFO - Trial 81 finished with values: [0.003485936080807906, 0.0006112264719673119, 0.0018261387487701803] and parameters: {'n_layers': 3, 'embedding_dim': 32, 'lr': 0.01099734275168188, 'lambda_val': 0.06278402406394074, 'batch_size': 679, 'optimizer': 'RMSprop'}.
2026-06-04 02:03:23,517 - experiment_functions - INFO - Early stopping at epoch 800. Best Metrics: (0.0005795401770480913, 8.707883984191842e-05, 0.00029810017758928294)
2026-06-04 02:03:23,832 - optuna.study.study - INFO - Trial 82 finished with values: [0.0005795401770480913, 8.707883984191842e-05, 0.00029810017758928294] and parameters: {'n_layers': 4, 'embedding_dim': 128, 'lr': 2.9881517534105148e-05, 'lambda_val': 1.4231303635222442e-06, 'batch_size': 2060, 'optimizer': 'Adam'}.
2026-06-04 02:03:51,077 - experiment_functions - INFO - Early stopping at epoch 500. Best Metrics: (0.000536275336427893, 8.038046754638624e-05, 0.0002647252512178034)
2026-06-04 02:03:51,180 - optuna.study.study - INFO - Trial 83 finished with values: [0.000536275336427893, 8.038046754638624e-05, 0.0002647252512178034] and parameters: {'n_layers': 4, 'embedding_dim': 256, 'lr': 0.0006750072862830801, 'lambda_val': 2.4278531579666018e-05, 'batch_size': 3326, 'optimizer': 'SGD'}.
2026-06-04 02:04:14,885 - experiment_functions - INFO - Early stopping at epoch 500. Best Metrics: (0.00043533843175158816, 7.870587447250318e-05, 0.000218161650060569)
2026-06-04 02:04:15,007 - optuna.study.study - INFO - Trial 84 finished with values: [0.00043533843175158816, 7.870587447250318e-05, 0.000218161650060569] and parameters: {'n_layers': 4, 'embedding_dim': 128, 'lr': 0.009770246827701563, 'lambda_val': 3.554292751882567e-05, 'batch_size': 2901, 'optimizer': 'SGD'}.
2026-06-04 02:04:37,116 - experiment_functions - INFO - Early stopping at epoch 550. Best Metrics: (0.003081587427944194, 0.00047558443298278524, 0.0016310096384379088)
2026-06-04 02:04:37,232 - optuna.study.study - INFO - Trial 85 finished with values: [0.003081587427944194, 0.00047558443298278524, 0.0016310096384379088] and parameters: {'n_layers': 1, 'embedding_dim': 32, 'lr': 0.014057671404838507, 'lambda_val': 0.004181259159598131, 'batch_size': 2510, 'optimizer': 'Adam'}.
2026-06-04 02:05:00,720 - experiment_functions - INFO - Early stopping at epoch 550. Best Metrics: (0.0032636434508900307, 0.0005593140866769376, 0.001945798266765949)
2026-06-04 02:05:00,831 - optuna.study.study - INFO - Trial 86 finished with values: [0.0032636434508900307, 0.0005593140866769376, 0.001945798266765949] and parameters: {'n_layers': 3, 'embedding_dim': 64, 'lr': 0.034261537155851944, 'lambda_val': 5.688960731175793e-05, 'batch_size': 3299, 'optimizer': 'RMSprop'}.
2026-06-04 02:06:38,483 - experiment_functions - INFO - Early stopping at epoch 2550. Best Metrics: (0.003930710138921009, 0.0007133766494741778, 0.0022972617775688505)
2026-06-04 02:06:38,587 - optuna.study.study - INFO - Trial 87 finished with values: [0.003930710138921009, 0.0007133766494741778, 0.0022972617775688505] and parameters: {'n_layers': 1, 'embedding_dim': 128, 'lr': 0.0008589356470438068, 'lambda_val': 0.01026021876459957, 'batch_size': 2901, 'optimizer': 'RMSprop'}.
2026-06-04 02:06:59,058 - experiment_functions - INFO - Early stopping at epoch 500. Best Metrics: (0.0005505273759921146, 7.535668832473711e-05, 0.00023729066944716602)
2026-06-04 02:06:59,160 - optuna.study.study - INFO - Trial 88 finished with values: [0.0005505273759921146, 7.535668832473711e-05, 0.00023729066944716602] and parameters: {'n_layers': 1, 'embedding_dim': 64, 'lr': 0.002459154637131929, 'lambda_val': 0.006861251862596191, 'batch_size': 3545, 'optimizer': 'SGD'}.
2026-06-04 02:07:57,160 - experiment_functions - INFO - Early stopping at epoch 1550. Best Metrics: (0.004171634683142948, 0.0007820349655033829, 0.002254519464980687)
2026-06-04 02:07:57,277 - optuna.study.study - INFO - Trial 89 finished with values: [0.004171634683142948, 0.0007820349655033829, 0.002254519464980687] and parameters: {'n_layers': 1, 'embedding_dim': 64, 'lr': 0.00832134173144575, 'lambda_val': 0.09611353650854988, 'batch_size': 2377, 'optimizer': 'RMSprop'}.
2026-06-04 02:08:25,453 - experiment_functions - INFO - Early stopping at epoch 650. Best Metrics: (0.005123261144205412, 0.000936097528300623, 0.003031431120094919)
2026-06-04 02:08:25,559 - optuna.study.study - INFO - Trial 90 finished with values: [0.005123261144205412, 0.000936097528300623, 0.003031431120094919] and parameters: {'n_layers': 2, 'embedding_dim': 128, 'lr': 0.005720533217630053, 'lambda_val': 2.9094394994277735e-06, 'batch_size': 2927, 'optimizer': 'RMSprop'}.
2026-06-04 02:11:48,377 - optuna.study.study - INFO - Trial 91 finished with values: [0.006932993212479354, 0.0011822627101614306, 0.004046277781817098] and parameters: {'n_layers': 4, 'embedding_dim': 256, 'lr': 0.00015842116483563462, 'lambda_val': 0.0016415700559882936, 'batch_size': 4069, 'optimizer': 'RMSprop'}.
2026-06-04 02:14:13,755 - optuna.study.study - INFO - Trial 92 finished with values: [0.000713485834608989, 0.0001155469220979302, 0.00039127576600526135] and parameters: {'n_layers': 1, 'embedding_dim': 64, 'lr': 5.6572504128012725e-05, 'lambda_val': 0.00015911449534133392, 'batch_size': 3299, 'optimizer': 'RMSprop'}.
2026-06-04 02:14:39,379 - experiment_functions - INFO - Early stopping at epoch 500. Best Metrics: (0.0004833356665477471, 7.703128139862015e-05, 0.0002192240239171214)
2026-06-04 02:14:39,492 - optuna.study.study - INFO - Trial 93 finished with values: [0.0004833356665477471, 7.703128139862015e-05, 0.0002192240239171214] and parameters: {'n_layers': 3, 'embedding_dim': 256, 'lr': 3.6291876994825016e-05, 'lambda_val': 7.687760190299752e-06, 'batch_size': 759, 'optimizer': 'SGD'}.
2026-06-04 02:15:27,582 - experiment_functions - INFO - Early stopping at epoch 1100. Best Metrics: (0.008367139873843875, 0.0015222051041596893, 0.004909806502456648)
2026-06-04 02:15:27,946 - optuna.study.study - INFO - Trial 94 finished with values: [0.008367139873843875, 0.0015222051041596893, 0.004909806502456648] and parameters: {'n_layers': 3, 'embedding_dim': 128, 'lr': 0.0025795756581398536, 'lambda_val': 1.7827761161994677e-05, 'batch_size': 679, 'optimizer': 'Adam'}.
2026-06-04 02:15:56,247 - experiment_functions - INFO - Early stopping at epoch 550. Best Metrics: (0.005555618042264711, 0.000971263982852167, 0.003239130560273019)
2026-06-04 02:15:56,351 - optuna.study.study - INFO - Trial 95 finished with values: [0.005555618042264711, 0.000971263982852167, 0.003239130560273019] and parameters: {'n_layers': 3, 'embedding_dim': 256, 'lr': 0.01099734275168188, 'lambda_val': 7.233718216592713e-05, 'batch_size': 3163, 'optimizer': 'RMSprop'}.
2026-06-04 02:16:17,988 - experiment_functions - INFO - Early stopping at epoch 550. Best Metrics: (0.0026687860123209522, 0.00038683100006698377, 0.0013721918838964229)
2026-06-04 02:16:18,829 - optuna.study.study - INFO - Trial 96 finished with values: [0.0026687860123209522, 0.00038683100006698377, 0.0013721918838964229] and parameters: {'n_layers': 1, 'embedding_dim': 32, 'lr': 0.028504820821667567, 'lambda_val': 1.4242629688355991e-05, 'batch_size': 1834, 'optimizer': 'RMSprop'}.
2026-06-04 02:16:44,101 - experiment_functions - INFO - Early stopping at epoch 500. Best Metrics: (0.0005552347631549563, 7.703128139862015e-05, 0.0002744258740247658)
2026-06-04 02:16:44,968 - optuna.study.study - INFO - Trial 97 finished with values: [0.0005552347631549563, 7.703128139862015e-05, 0.0002744258740247658] and parameters: {'n_layers': 3, 'embedding_dim': 256, 'lr': 0.0008797904665419303, 'lambda_val': 0.0008973938349176793, 'batch_size': 773, 'optimizer': 'SGD'}.
2026-06-04 02:17:06,710 - experiment_functions - INFO - Early stopping at epoch 500. Best Metrics: (0.00044760149640577066, 7.368209525085404e-05, 0.00021017717684408704)
2026-06-04 02:17:06,919 - optuna.study.study - INFO - Trial 98 finished with values: [0.00044760149640577066, 7.368209525085404e-05, 0.00021017717684408704] and parameters: {'n_layers': 2, 'embedding_dim': 128, 'lr': 7.37119818112549e-05, 'lambda_val': 0.07191932301410733, 'batch_size': 1780, 'optimizer': 'SGD'}.
2026-06-04 02:20:05,325 - optuna.study.study - INFO - Trial 99 finished with values: [0.006310149446448236, 0.001043271485029138, 0.0036489246642056115] and parameters: {'n_layers': 2, 'embedding_dim': 256, 'lr': 0.0006097425316287412, 'lambda_val': 2.2435960383986775e-06, 'batch_size': 2236, 'optimizer': 'Adam'}.
2026-06-04 02:20:55,321 - experiment_functions - INFO - Early stopping at epoch 1300. Best Metrics: (0.0033638832143754746, 0.0006748610087748677, 0.0019196693374640362)
2026-06-04 02:20:55,543 - optuna.study.study - INFO - Trial 100 finished with values: [0.0033638832143754746, 0.0006748610087748677, 0.0019196693374640362] and parameters: {'n_layers': 3, 'embedding_dim': 32, 'lr': 0.00832134173144575, 'lambda_val': 0.09611353650854988, 'batch_size': 2377, 'optimizer': 'RMSprop'}.
2026-06-04 02:21:18,024 - experiment_functions - INFO - Early stopping at epoch 550. Best Metrics: (0.0045387933210093824, 0.0007033290910308796, 0.002613055816610614)
2026-06-04 02:21:18,155 - optuna.study.study - INFO - Trial 101 finished with values: [0.0045387933210093824, 0.0007033290910308796, 0.002613055816610614] and parameters: {'n_layers': 3, 'embedding_dim': 32, 'lr': 0.04202506867893529, 'lambda_val': 4.3043355166166714e-05, 'batch_size': 3299, 'optimizer': 'Adam'}.
2026-06-04 02:21:48,469 - experiment_functions - INFO - Early stopping at epoch 550. Best Metrics: (0.0058146809995543065, 0.0010951838703195124, 0.0032235086066718655)
2026-06-04 02:21:48,880 - optuna.study.study - INFO - Trial 102 finished with values: [0.0058146809995543065, 0.0010951838703195124, 0.0032235086066718655] and parameters: {'n_layers': 4, 'embedding_dim': 256, 'lr': 0.0036679476641700757, 'lambda_val': 0.0016415700559882936, 'batch_size': 3054, 'optimizer': 'RMSprop'}.
2026-06-04 02:22:25,490 - experiment_functions - INFO - Early stopping at epoch 950. Best Metrics: (0.006103289880903251, 0.0010935092772456296, 0.0035700917065506787)
2026-06-04 02:22:25,595 - optuna.study.study - INFO - Trial 103 finished with values: [0.006103289880903251, 0.0010935092772456296, 0.0035700917065506787] and parameters: {'n_layers': 2, 'embedding_dim': 32, 'lr': 0.005720533217630053, 'lambda_val': 2.9094394994277735e-06, 'batch_size': 679, 'optimizer': 'RMSprop'}.
2026-06-04 02:23:48,974 - experiment_functions - INFO - Early stopping at epoch 2150. Best Metrics: (0.004434287171541641, 0.0008305981646459912, 0.0024519146043657032)
2026-06-04 02:23:49,534 - optuna.study.study - INFO - Trial 104 finished with values: [0.004434287171541641, 0.0008305981646459912, 0.0024519146043657032] and parameters: {'n_layers': 1, 'embedding_dim': 128, 'lr': 0.005720533217630053, 'lambda_val': 0.0016044761768607098, 'batch_size': 2927, 'optimizer': 'RMSprop'}.
2026-06-04 02:24:18,386 - experiment_functions - INFO - Early stopping at epoch 550. Best Metrics: (0.004106547875392496, 0.0006514167057405051, 0.0024436619894772373)
2026-06-04 02:24:18,711 - optuna.study.study - INFO - Trial 105 finished with values: [0.004106547875392496, 0.0006514167057405051, 0.0024436619894772373] and parameters: {'n_layers': 3, 'embedding_dim': 256, 'lr': 0.028959132035735552, 'lambda_val': 0.00013240141630371793, 'batch_size': 2817, 'optimizer': 'RMSprop'}.
2026-06-04 02:25:14,651 - experiment_functions - INFO - Early stopping at epoch 1450. Best Metrics: (0.004520026791292133, 0.0007435193248040726, 0.002602023450638783)
2026-06-04 02:25:14,851 - optuna.study.study - INFO - Trial 106 finished with values: [0.004520026791292133, 0.0007435193248040726, 0.002602023450638783] and parameters: {'n_layers': 1, 'embedding_dim': 96, 'lr': 0.014057671404838507, 'lambda_val': 1.7827761161994677e-05, 'batch_size': 1188, 'optimizer': 'Adam'}.
2026-06-04 02:25:46,314 - experiment_functions - INFO - Early stopping at epoch 650. Best Metrics: (0.0037889027215154704, 0.0006782101949226338, 0.0022865065162331207)
2026-06-04 02:25:46,620 - optuna.study.study - INFO - Trial 107 finished with values: [0.0037889027215154704, 0.0006782101949226338, 0.0022865065162331207] and parameters: {'n_layers': 2, 'embedding_dim': 256, 'lr': 0.028959132035735552, 'lambda_val': 0.00013240141630371793, 'batch_size': 1158, 'optimizer': 'Adam'}.
2026-06-04 02:26:50,401 - experiment_functions - INFO - Early stopping at epoch 1200. Best Metrics: (0.0052476410634578995, 0.000977962355147699, 0.0029319994786233218)
2026-06-04 02:26:50,549 - optuna.study.study - INFO - Trial 108 finished with values: [0.0052476410634578995, 0.000977962355147699, 0.0029319994786233218] and parameters: {'n_layers': 4, 'embedding_dim': 256, 'lr': 0.0006097425316287412, 'lambda_val': 0.03809846794796893, 'batch_size': 3931, 'optimizer': 'Adam'}.
2026-06-04 02:27:36,425 - experiment_functions - INFO - Early stopping at epoch 1150. Best Metrics: (0.0039117254615324976, 0.0007317971732868913, 0.0022673635941930646)
2026-06-04 02:27:37,134 - optuna.study.study - INFO - Trial 109 finished with values: [0.0039117254615324976, 0.0007317971732868913, 0.0022673635941930646] and parameters: {'n_layers': 1, 'embedding_dim': 128, 'lr': 0.005720533217630053, 'lambda_val': 0.0016044761768607098, 'batch_size': 1526, 'optimizer': 'RMSprop'}.
2026-06-04 02:28:05,662 - experiment_functions - INFO - Early stopping at epoch 550. Best Metrics: (0.00426850740283677, 0.0007770111862817335, 0.0023171713064739263)
2026-06-04 02:28:05,775 - optuna.study.study - INFO - Trial 110 finished with values: [0.00426850740283677, 0.0007770111862817335, 0.0023171713064739263] and parameters: {'n_layers': 3, 'embedding_dim': 256, 'lr': 0.005091659899861729, 'lambda_val': 0.021849198493297528, 'batch_size': 3547, 'optimizer': 'RMSprop'}.
2026-06-04 02:28:31,085 - experiment_functions - INFO - Early stopping at epoch 600. Best Metrics: (0.002833498391490688, 0.00046888606068725303, 0.001542618268001)
2026-06-04 02:28:31,297 - optuna.study.study - INFO - Trial 111 finished with values: [0.002833498391490688, 0.00046888606068725303, 0.001542618268001] and parameters: {'n_layers': 1, 'embedding_dim': 128, 'lr': 0.02841103786793073, 'lambda_val': 5.6114562068405035e-05, 'batch_size': 1720, 'optimizer': 'RMSprop'}.
2026-06-04 02:28:51,810 - experiment_functions - INFO - Early stopping at epoch 500. Best Metrics: (0.0006174974695333808, 6.86583160292049e-05, 0.00022799800114438155)
2026-06-04 02:28:52,074 - optuna.study.study - INFO - Trial 112 finished with values: [0.0006174974695333808, 6.86583160292049e-05, 0.00022799800114438155] and parameters: {'n_layers': 1, 'embedding_dim': 64, 'lr': 0.0018324539902739038, 'lambda_val': 8.472875869813855e-05, 'batch_size': 1158, 'optimizer': 'SGD'}.
2026-06-04 02:30:34,678 - experiment_functions - INFO - Early stopping at epoch 2450. Best Metrics: (0.0006476632745297606, 9.210261906356756e-05, 0.0002834663725303623)
2026-06-04 02:30:34,790 - optuna.study.study - INFO - Trial 113 finished with values: [0.0006476632745297606, 9.210261906356756e-05, 0.0002834663725303623] and parameters: {'n_layers': 1, 'embedding_dim': 256, 'lr': 9.625633381831606e-05, 'lambda_val': 0.006111006135139402, 'batch_size': 1526, 'optimizer': 'Adam'}.
2026-06-04 02:31:13,240 - experiment_functions - INFO - Early stopping at epoch 800. Best Metrics: (0.004665541916088524, 0.0008573916538281198, 0.0025225518521559192)
2026-06-04 02:31:13,364 - optuna.study.study - INFO - Trial 114 finished with values: [0.004665541916088524, 0.0008573916538281198, 0.0025225518521559192] and parameters: {'n_layers': 2, 'embedding_dim': 256, 'lr': 0.0025795756581398536, 'lambda_val': 0.07191932301410733, 'batch_size': 3828, 'optimizer': 'Adam'}.
2026-06-04 02:31:42,192 - experiment_functions - INFO - Early stopping at epoch 550. Best Metrics: (0.005190247646250653, 0.0008942327014535468, 0.0028585282660603464)
