2026-06-07 02:04:31,714 - optuna.study.study - INFO - Trial 114 finished with values: [0.0035142581124747684, 0.000892558108379664, 0.0019985826444417075] and parameters: {'n_layers': 3, 'embedding_dim': 64, 'lr': 0.005424684195660662, 'lambda_val': 0.0007605677300524109, 'batch_size': 1654, 'optimizer': 'Adam'}.
2026-06-07 02:05:20,698 - experiment_functions - INFO - Early stopping at epoch 950. Best Metrics: (0.002939220739282535, 0.0009628910174827518, 0.002021806148404113)
2026-06-07 02:05:20,791 - optuna.study.study - INFO - Trial 115 finished with values: [0.002939220739282535, 0.0009628910174827518, 0.002021806148404113] and parameters: {'n_layers': 4, 'embedding_dim': 256, 'lr': 0.021653186861251617, 'lambda_val': 3.1599316274137642e-06, 'batch_size': 1471, 'optimizer': 'Adam'}.
2026-06-07 02:05:44,501 - experiment_functions - INFO - Early stopping at epoch 550. Best Metrics: (0.003239555427759363, 0.000865764619197535, 0.0021515623134179007)
2026-06-07 02:05:44,742 - optuna.study.study - INFO - Trial 116 finished with values: [0.003239555427759363, 0.000865764619197535, 0.0021515623134179007] and parameters: {'n_layers': 3, 'embedding_dim': 96, 'lr': 0.005424684195660662, 'lambda_val': 0.0054314837121898114, 'batch_size': 4046, 'optimizer': 'Adam'}.
2026-06-07 02:06:15,036 - experiment_functions - INFO - Early stopping at epoch 600. Best Metrics: (0.0045780577054499215, 0.0012777145153727645, 0.003093756194097105)
2026-06-07 02:06:15,179 - optuna.study.study - INFO - Trial 117 finished with values: [0.0045780577054499215, 0.0012777145153727645, 0.003093756194097105] and parameters: {'n_layers': 3, 'embedding_dim': 256, 'lr': 0.0011078514946922563, 'lambda_val': 1.058365552996417e-06, 'batch_size': 2883, 'optimizer': 'Adam'}.
2026-06-07 02:08:45,791 - optuna.study.study - INFO - Trial 118 finished with values: [0.006500611488654653, 0.0021769709960479606, 0.00474761934478464] and parameters: {'n_layers': 1, 'embedding_dim': 96, 'lr': 0.00019178783016765463, 'lambda_val': 0.002165335135008093, 'batch_size': 3414, 'optimizer': 'RMSprop'}.
2026-06-07 02:10:53,432 - experiment_functions - INFO - Early stopping at epoch 2750. Best Metrics: (0.003312732933164745, 0.0010616920088418514, 0.00216655366057981)
2026-06-07 02:10:53,510 - optuna.study.study - INFO - Trial 119 finished with values: [0.003312732933164745, 0.0010616920088418514, 0.00216655366057981] and parameters: {'n_layers': 3, 'embedding_dim': 256, 'lr': 0.0020485036238635386, 'lambda_val': 6.538231837458372e-06, 'batch_size': 1861, 'optimizer': 'RMSprop'}.
2026-06-07 02:12:26,327 - experiment_functions - INFO - Early stopping at epoch 2450. Best Metrics: (0.0050667127381670085, 0.001515506731864157, 0.0033107218682216994)
2026-06-07 02:12:26,416 - optuna.study.study - INFO - Trial 120 finished with values: [0.0050667127381670085, 0.001515506731864157, 0.0033107218682216994] and parameters: {'n_layers': 2, 'embedding_dim': 64, 'lr': 0.00031084764364588095, 'lambda_val': 0.0007605677300524109, 'batch_size': 3991, 'optimizer': 'RMSprop'}.
2026-06-07 02:13:11,863 - experiment_functions - INFO - Early stopping at epoch 1150. Best Metrics: (0.004292473887960346, 0.001185611896309197, 0.0027565392066053354)
2026-06-07 02:13:12,194 - optuna.study.study - INFO - Trial 121 finished with values: [0.004292473887960346, 0.001185611896309197, 0.0027565392066053354] and parameters: {'n_layers': 3, 'embedding_dim': 64, 'lr': 0.0011078514946922563, 'lambda_val': 1.058365552996417e-06, 'batch_size': 1114, 'optimizer': 'Adam'}.
2026-06-07 02:13:35,011 - experiment_functions - INFO - Early stopping at epoch 500. Best Metrics: (0.00048760874801177215, 7.703128139862013e-05, 0.00019137185246105768)
2026-06-07 02:13:35,089 - optuna.study.study - INFO - Trial 122 finished with values: [0.00048760874801177215, 7.703128139862013e-05, 0.00019137185246105768] and parameters: {'n_layers': 4, 'embedding_dim': 128, 'lr': 0.00041076267416475083, 'lambda_val': 0.00017376720983994695, 'batch_size': 2239, 'optimizer': 'SGD'}.
2026-06-07 02:14:01,451 - experiment_functions - INFO - Early stopping at epoch 550. Best Metrics: (0.0029193442895591227, 0.0009427959005961552, 0.0020011492800128096)
2026-06-07 02:14:02,081 - optuna.study.study - INFO - Trial 123 finished with values: [0.0029193442895591227, 0.0009427959005961552, 0.0020011492800128096] and parameters: {'n_layers': 2, 'embedding_dim': 256, 'lr': 0.0396840294610648, 'lambda_val': 0.0007605677300524109, 'batch_size': 2374, 'optimizer': 'Adam'}.
2026-06-07 02:14:31,321 - experiment_functions - INFO - Early stopping at epoch 550. Best Metrics: (0.0017089820964261483, 0.0004219974546185277, 0.0009640807874120852)
2026-06-07 02:14:32,484 - optuna.study.study - INFO - Trial 124 finished with values: [0.0017089820964261483, 0.0004219974546185277, 0.0009640807874120852] and parameters: {'n_layers': 4, 'embedding_dim': 256, 'lr': 0.005424684195660662, 'lambda_val': 0.008047652276882608, 'batch_size': 1452, 'optimizer': 'Adam'}.
2026-06-07 02:14:54,964 - experiment_functions - INFO - Early stopping at epoch 500. Best Metrics: (0.0006599661715235507, 0.00014903878357559115, 0.0003852066839897049)
2026-06-07 02:14:55,136 - optuna.study.study - INFO - Trial 125 finished with values: [0.0006599661715235507, 0.00014903878357559115, 0.0003852066839897049] and parameters: {'n_layers': 1, 'embedding_dim': 256, 'lr': 0.03222787388169566, 'lambda_val': 0.0868747821267466, 'batch_size': 2239, 'optimizer': 'RMSprop'}.
2026-06-07 02:15:19,791 - experiment_functions - INFO - Early stopping at epoch 550. Best Metrics: (0.0045821572991534, 0.0014200549266528233, 0.003071906859963104)
2026-06-07 02:15:19,983 - optuna.study.study - INFO - Trial 126 finished with values: [0.0045821572991534, 0.0014200549266528233, 0.003071906859963104] and parameters: {'n_layers': 1, 'embedding_dim': 256, 'lr': 0.003111912344058094, 'lambda_val': 0.0054314837121898114, 'batch_size': 4046, 'optimizer': 'RMSprop'}.
2026-06-07 02:16:17,933 - experiment_functions - INFO - Early stopping at epoch 1150. Best Metrics: (0.0025423746098919135, 0.0007485431040257218, 0.001626246567118804)
2026-06-07 02:16:18,027 - optuna.study.study - INFO - Trial 127 finished with values: [0.0025423746098919135, 0.0007485431040257218, 0.001626246567118804] and parameters: {'n_layers': 4, 'embedding_dim': 256, 'lr': 0.0013711723145044142, 'lambda_val': 3.0304155778545706e-05, 'batch_size': 2652, 'optimizer': 'RMSprop'}.
2026-06-07 02:16:52,550 - experiment_functions - INFO - Early stopping at epoch 850. Best Metrics: (0.0030986098747523057, 0.0005978297273762476, 0.0016392432388980642)
2026-06-07 02:16:53,660 - optuna.study.study - INFO - Trial 128 finished with values: [0.0030986098747523057, 0.0005978297273762476, 0.0016392432388980642] and parameters: {'n_layers': 4, 'embedding_dim': 64, 'lr': 0.0009136590553729405, 'lambda_val': 6.538231837458372e-06, 'batch_size': 1735, 'optimizer': 'Adam'}.
2026-06-07 02:17:25,860 - experiment_functions - INFO - Early stopping at epoch 800. Best Metrics: (0.003857915712440953, 0.0009645656105566348, 0.002238468978611173)
2026-06-07 02:17:26,338 - optuna.study.study - INFO - Trial 129 finished with values: [0.003857915712440953, 0.0009645656105566348, 0.002238468978611173] and parameters: {'n_layers': 3, 'embedding_dim': 64, 'lr': 0.0011078514946922563, 'lambda_val': 1.058365552996417e-06, 'batch_size': 2883, 'optimizer': 'Adam'}.
2026-06-07 02:18:19,944 - experiment_functions - INFO - Early stopping at epoch 1400. Best Metrics: (0.006917583958300082, 0.00202290843325072, 0.004555016454894235)
2026-06-07 02:18:20,022 - optuna.study.study - INFO - Trial 130 finished with values: [0.006917583958300082, 0.00202290843325072, 0.004555016454894235] and parameters: {'n_layers': 2, 'embedding_dim': 64, 'lr': 0.000762190113410319, 'lambda_val': 0.0007605677300524109, 'batch_size': 676, 'optimizer': 'Adam'}.
2026-06-07 02:19:33,913 - experiment_functions - INFO - Early stopping at epoch 2000. Best Metrics: (0.0037109175938193502, 0.0008691138053453011, 0.0022565920496746975)
2026-06-07 02:19:34,001 - optuna.study.study - INFO - Trial 131 finished with values: [0.0037109175938193502, 0.0008691138053453011, 0.0022565920496746975] and parameters: {'n_layers': 3, 'embedding_dim': 32, 'lr': 0.00041076267416475083, 'lambda_val': 0.00028607926724212617, 'batch_size': 4054, 'optimizer': 'RMSprop'}.
2026-06-07 02:22:07,797 - optuna.study.study - INFO - Trial 132 finished with values: [0.005525013825465811, 0.0016444503985531518, 0.00374627226590881] and parameters: {'n_layers': 2, 'embedding_dim': 96, 'lr': 0.00031084764364588095, 'lambda_val': 6.538231837458372e-06, 'batch_size': 4046, 'optimizer': 'Adam'}.
2026-06-07 02:22:37,545 - experiment_functions - INFO - Early stopping at epoch 700. Best Metrics: (0.002215408692306174, 0.000504052515238797, 0.001273565890560575)
2026-06-07 02:22:37,636 - optuna.study.study - INFO - Trial 133 finished with values: [0.002215408692306174, 0.000504052515238797, 0.001273565890560575] and parameters: {'n_layers': 4, 'embedding_dim': 96, 'lr': 0.00222643395785692, 'lambda_val': 0.00017376720983994695, 'batch_size': 1392, 'optimizer': 'RMSprop'}.
2026-06-07 02:25:05,782 - optuna.study.study - INFO - Trial 134 finished with values: [0.005190198463230446, 0.0014937370219036776, 0.003431693257472814] and parameters: {'n_layers': 2, 'embedding_dim': 64, 'lr': 0.00031084764364588095, 'lambda_val': 0.0006098824234122334, 'batch_size': 2179, 'optimizer': 'Adam'}.
2026-06-07 02:25:46,495 - experiment_functions - INFO - Early stopping at epoch 1050. Best Metrics: (0.004969293467570498, 0.0014250787058744726, 0.0033059257304794546)
2026-06-07 02:25:46,999 - optuna.study.study - INFO - Trial 135 finished with values: [0.004969293467570498, 0.0014250787058744726, 0.0033059257304794546] and parameters: {'n_layers': 2, 'embedding_dim': 64, 'lr': 0.000762190113410319, 'lambda_val': 0.0006098824234122334, 'batch_size': 2652, 'optimizer': 'Adam'}.
2026-06-07 02:27:11,713 - experiment_functions - INFO - Early stopping at epoch 2150. Best Metrics: (0.003589892126707571, 0.0009561926451872194, 0.0021552835473576874)
2026-06-07 02:27:13,155 - optuna.study.study - INFO - Trial 136 finished with values: [0.003589892126707571, 0.0009561926451872194, 0.0021552835473576874] and parameters: {'n_layers': 3, 'embedding_dim': 96, 'lr': 0.00031084764364588095, 'lambda_val': 0.0054314837121898114, 'batch_size': 1114, 'optimizer': 'RMSprop'}.
2026-06-07 02:27:48,409 - experiment_functions - INFO - Early stopping at epoch 850. Best Metrics: (0.005486118316747245, 0.0016729184808091636, 0.003649597517986024)
2026-06-07 02:27:48,500 - optuna.study.study - INFO - Trial 137 finished with values: [0.005486118316747245, 0.0016729184808091636, 0.003649597517986024] and parameters: {'n_layers': 2, 'embedding_dim': 128, 'lr': 0.000762190113410319, 'lambda_val': 5.747599187815172e-06, 'batch_size': 2074, 'optimizer': 'RMSprop'}.
2026-06-07 02:30:24,501 - optuna.study.study - INFO - Trial 138 finished with values: [0.0038387343783168196, 0.0010332239265858397, 0.002362569629544623] and parameters: {'n_layers': 3, 'embedding_dim': 96, 'lr': 0.00019178783016765463, 'lambda_val': 0.002165335135008093, 'batch_size': 2043, 'optimizer': 'Adam'}.
2026-06-07 02:30:53,365 - experiment_functions - INFO - Early stopping at epoch 750. Best Metrics: (0.007684012930960395, 0.0023812713510616918, 0.005070793883229812)
2026-06-07 02:30:53,461 - optuna.study.study - INFO - Trial 139 finished with values: [0.007684012930960395, 0.0023812713510616918, 0.005070793883229812] and parameters: {'n_layers': 1, 'embedding_dim': 32, 'lr': 0.0020485036238635386, 'lambda_val': 0.0036211663329917747, 'batch_size': 1861, 'optimizer': 'Adam'}.
2026-06-07 02:31:26,884 - experiment_functions - INFO - Early stopping at epoch 850. Best Metrics: (0.0043980557831308385, 0.0014183803335789402, 0.0028875341595452084)
2026-06-07 02:31:26,966 - optuna.study.study - INFO - Trial 140 finished with values: [0.0043980557831308385, 0.0014183803335789402, 0.0028875341595452084] and parameters: {'n_layers': 2, 'embedding_dim': 64, 'lr': 0.000762190113410319, 'lambda_val': 0.0054314837121898114, 'batch_size': 1114, 'optimizer': 'Adam'}.
2026-06-07 02:31:49,619 - experiment_functions - INFO - Early stopping at epoch 550. Best Metrics: (0.003276989463765951, 0.0008205506062026927, 0.00196562066851575)
2026-06-07 02:31:49,729 - optuna.study.study - INFO - Trial 141 finished with values: [0.003276989463765951, 0.0008205506062026927, 0.00196562066851575] and parameters: {'n_layers': 3, 'embedding_dim': 64, 'lr': 0.0063362306152574144, 'lambda_val': 0.0007605677300524109, 'batch_size': 1452, 'optimizer': 'Adam'}.
2026-06-07 02:32:13,490 - experiment_functions - INFO - Early stopping at epoch 550. Best Metrics: (0.0032068222048185855, 0.000867439212271418, 0.0019607401689841486)
2026-06-07 02:32:13,580 - optuna.study.study - INFO - Trial 142 finished with values: [0.0032068222048185855, 0.000867439212271418, 0.0019607401689841486] and parameters: {'n_layers': 3, 'embedding_dim': 96, 'lr': 0.00801183287886021, 'lambda_val': 1.058365552996417e-06, 'batch_size': 2883, 'optimizer': 'Adam'}.
2026-06-07 02:32:46,302 - experiment_functions - INFO - Early stopping at epoch 800. Best Metrics: (0.0021596445325173914, 0.0004521401299484226, 0.0011930594001953313)
2026-06-07 02:32:46,399 - optuna.study.study - INFO - Trial 143 finished with values: [0.0021596445325173914, 0.0004521401299484226, 0.0011930594001953313] and parameters: {'n_layers': 4, 'embedding_dim': 64, 'lr': 0.0017197271078814886, 'lambda_val': 0.0001506752792709509, 'batch_size': 3461, 'optimizer': 'RMSprop'}.
2026-06-07 02:33:07,728 - experiment_functions - INFO - Early stopping at epoch 500. Best Metrics: (0.0008369274024626024, 9.37772121374506e-05, 0.00035102207525533965)
2026-06-07 02:33:08,453 - optuna.study.study - INFO - Trial 144 finished with values: [0.0008369274024626024, 9.37772121374506e-05, 0.00035102207525533965] and parameters: {'n_layers': 3, 'embedding_dim': 96, 'lr': 0.0003906575453432887, 'lambda_val': 0.0868747821267466, 'batch_size': 2891, 'optimizer': 'SGD'}.
2026-06-07 02:33:36,072 - experiment_functions - INFO - Early stopping at epoch 650. Best Metrics: (0.005892286864472267, 0.0018370286020497023, 0.004091286004807101)
2026-06-07 02:33:36,164 - optuna.study.study - INFO - Trial 145 finished with values: [0.005892286864472267, 0.0018370286020497023, 0.004091286004807101] and parameters: {'n_layers': 2, 'embedding_dim': 128, 'lr': 0.0017152190282418974, 'lambda_val': 6.538231837458372e-06, 'batch_size': 1114, 'optimizer': 'Adam'}.
2026-06-07 02:34:00,596 - experiment_functions - INFO - Early stopping at epoch 550. Best Metrics: (0.0033665900436223965, 0.0008590662469020028, 0.0020072598622209274)
2026-06-07 02:34:01,303 - optuna.study.study - INFO - Trial 146 finished with values: [0.0033665900436223965, 0.0008590662469020028, 0.0020072598622209274] and parameters: {'n_layers': 3, 'embedding_dim': 128, 'lr': 0.0063362306152574144, 'lambda_val': 0.003413922431571512, 'batch_size': 2891, 'optimizer': 'Adam'}.
2026-06-07 02:34:31,954 - experiment_functions - INFO - Early stopping at epoch 750. Best Metrics: (0.004361535990596823, 0.0011336995110188225, 0.002708442369054001)
2026-06-07 02:34:32,782 - optuna.study.study - INFO - Trial 147 finished with values: [0.004361535990596823, 0.0011336995110188225, 0.002708442369054001] and parameters: {'n_layers': 3, 'embedding_dim': 64, 'lr': 0.0011078514946922563, 'lambda_val': 1.058365552996417e-06, 'batch_size': 2883, 'optimizer': 'Adam'}.
2026-06-07 02:34:58,576 - experiment_functions - INFO - Early stopping at epoch 650. Best Metrics: (0.0025996102621186684, 0.0004822828052783174, 0.0014093022043598909)
2026-06-07 02:34:58,669 - optuna.study.study - INFO - Trial 148 finished with values: [0.0025996102621186684, 0.0004822828052783174, 0.0014093022043598909] and parameters: {'n_layers': 4, 'embedding_dim': 32, 'lr': 0.00222643395785692, 'lambda_val': 0.00028607926724212617, 'batch_size': 2652, 'optimizer': 'RMSprop'}.
2026-06-07 02:37:31,004 - optuna.study.study - INFO - Trial 149 finished with values: [0.0020812158347862982, 0.0004621876883917208, 0.001185893465085239] and parameters: {'n_layers': 4, 'embedding_dim': 64, 'lr': 0.00010193446979779483, 'lambda_val': 0.00044849490190016335, 'batch_size': 2926, 'optimizer': 'RMSprop'}.
2026-06-07 02:38:00,934 - experiment_functions - INFO - Early stopping at epoch 750. Best Metrics: (0.00426974403628648, 0.0012877620738160629, 0.002885958351268802)
2026-06-07 02:38:01,026 - optuna.study.study - INFO - Trial 150 finished with values: [0.00426974403628648, 0.0012877620738160629, 0.002885958351268802] and parameters: {'n_layers': 2, 'embedding_dim': 64, 'lr': 0.000762190113410319, 'lambda_val': 0.003413922431571512, 'batch_size': 4046, 'optimizer': 'Adam'}.
2026-06-07 02:38:23,620 - experiment_functions - INFO - Early stopping at epoch 550. Best Metrics: (0.0038772018790818306, 0.0009896845066648804, 0.002305513306410664)
2026-06-07 02:38:23,700 - optuna.study.study - INFO - Trial 151 finished with values: [0.0038772018790818306, 0.0009896845066648804, 0.002305513306410664] and parameters: {'n_layers': 3, 'embedding_dim': 64, 'lr': 0.0063362306152574144, 'lambda_val': 0.0007605677300524109, 'batch_size': 2891, 'optimizer': 'Adam'}.
2026-06-07 02:40:45,523 - optuna.study.study - INFO - Trial 152 finished with values: [0.0024057686201581553, 0.0008724629914930672, 0.0017139377290275913] and parameters: {'n_layers': 1, 'embedding_dim': 32, 'lr': 0.00023240333325049055, 'lambda_val': 0.0054314837121898114, 'batch_size': 1114, 'optimizer': 'Adam'}.
2026-06-07 02:41:07,407 - experiment_functions - INFO - Early stopping at epoch 500. Best Metrics: (0.00048073260631371613, 8.875343291580146e-05, 0.00027307954919406963)
2026-06-07 02:41:07,649 - optuna.study.study - INFO - Trial 153 finished with values: [0.00048073260631371613, 8.875343291580146e-05, 0.00027307954919406963] and parameters: {'n_layers': 3, 'embedding_dim': 128, 'lr': 0.00019178783016765463, 'lambda_val': 1.0939005541756068e-06, 'batch_size': 558, 'optimizer': 'SGD'}.
2026-06-07 02:42:12,438 - experiment_functions - INFO - Early stopping at epoch 1500. Best Metrics: (0.002909323492815033, 0.0007770111862817335, 0.0017793562182238799)
2026-06-07 02:42:12,709 - optuna.study.study - INFO - Trial 154 finished with values: [0.002909323492815033, 0.0007770111862817335, 0.0017793562182238799] and parameters: {'n_layers': 4, 'embedding_dim': 128, 'lr': 0.00031084764364588095, 'lambda_val': 0.0007605677300524109, 'batch_size': 2745, 'optimizer': 'Adam'}.
2026-06-07 02:42:38,559 - experiment_functions - INFO - Early stopping at epoch 650. Best Metrics: (0.004003464365723234, 0.0010248509612164245, 0.0024664508291093153)
2026-06-07 02:42:38,650 - optuna.study.study - INFO - Trial 155 finished with values: [0.004003464365723234, 0.0010248509612164245, 0.0024664508291093153] and parameters: {'n_layers': 3, 'embedding_dim': 32, 'lr': 0.0020485036238635386, 'lambda_val': 3.491863285065632e-06, 'batch_size': 3695, 'optimizer': 'Adam'}.
2026-06-07 02:43:27,494 - experiment_functions - INFO - Early stopping at epoch 1200. Best Metrics: (0.004289281239304724, 0.00118728648938308, 0.002595744577525024)
2026-06-07 02:43:27,578 - optuna.study.study - INFO - Trial 156 finished with values: [0.004289281239304724, 0.00118728648938308, 0.002595744577525024] and parameters: {'n_layers': 2, 'embedding_dim': 128, 'lr': 0.0017152190282418974, 'lambda_val': 6.538231837458372e-06, 'batch_size': 1114, 'optimizer': 'RMSprop'}.
2026-06-07 02:45:56,627 - optuna.study.study - INFO - Trial 157 finished with values: [0.00615641404038476, 0.002043003550137317, 0.0043538914090816465] and parameters: {'n_layers': 1, 'embedding_dim': 96, 'lr': 0.00019178783016765463, 'lambda_val': 0.006044657657370833, 'batch_size': 3414, 'optimizer': 'RMSprop'}.
2026-06-07 02:48:41,158 - optuna.study.study - INFO - Trial 158 finished with values: [0.0029814285272312183, 0.0009863353205171144, 0.001995775597670756] and parameters: {'n_layers': 1, 'embedding_dim': 256, 'lr': 0.00010417512637413931, 'lambda_val': 6.538231837458372e-06, 'batch_size': 4046, 'optimizer': 'Adam'}.
2026-06-07 02:51:01,709 - experiment_functions - INFO - Early stopping at epoch 3900. Best Metrics: (0.0071237169351264255, 0.002347779489584031, 0.005017377141514075)
2026-06-07 02:51:01,804 - optuna.study.study - INFO - Trial 159 finished with values: [0.0071237169351264255, 0.002347779489584031, 0.005017377141514075] and parameters: {'n_layers': 1, 'embedding_dim': 32, 'lr': 0.000762190113410319, 'lambda_val': 3.222265315337744e-05, 'batch_size': 3302, 'optimizer': 'Adam'}.
2026-06-07 02:51:38,233 - experiment_functions - INFO - Early stopping at epoch 950. Best Metrics: (0.0036453324869898064, 0.0008908835153057808, 0.0022174290376717927)
2026-06-07 02:51:38,333 - optuna.study.study - INFO - Trial 160 finished with values: [0.0036453324869898064, 0.0008908835153057808, 0.0022174290376717927] and parameters: {'n_layers': 3, 'embedding_dim': 32, 'lr': 0.000762190113410319, 'lambda_val': 3.222265315337744e-05, 'batch_size': 3510, 'optimizer': 'Adam'}.
2026-06-07 02:52:05,565 - experiment_functions - INFO - Early stopping at epoch 700. Best Metrics: (0.007787563026585419, 0.00235280326880568, 0.005305931037722705)
2026-06-07 02:52:05,650 - optuna.study.study - INFO - Trial 161 finished with values: [0.007787563026585419, 0.00235280326880568, 0.005305931037722705] and parameters: {'n_layers': 1, 'embedding_dim': 32, 'lr': 0.0020485036238635386, 'lambda_val': 0.0006098824234122334, 'batch_size': 2652, 'optimizer': 'Adam'}.
2026-06-07 02:52:27,993 - experiment_functions - INFO - Early stopping at epoch 500. Best Metrics: (0.0005109955824133365, 7.033290910308795e-05, 0.00022043923036773325)
