2026-06-04 08:21:50,177 - optuna.study.study - INFO - Trial 143 finished with values: [0.007075840529826839, 0.0012944604461115948, 0.004007233029570665] and parameters: {'n_layers': 4, 'embedding_dim': 96, 'lr': 0.007982799603933596, 'lambda_val': 4.538297140265218e-06, 'batch_size': 2517, 'optimizer': 'Adam'}.
2026-06-04 08:23:04,187 - experiment_functions - INFO - Early stopping at epoch 1450. Best Metrics: (0.009852210956885862, 0.001872195056601246, 0.005682654136304347)
2026-06-04 08:23:04,276 - optuna.study.study - INFO - Trial 144 finished with values: [0.009852210956885862, 0.001872195056601246, 0.005682654136304347] and parameters: {'n_layers': 4, 'embedding_dim': 256, 'lr': 0.0009358706696693685, 'lambda_val': 2.2109211065368353e-05, 'batch_size': 1344, 'optimizer': 'RMSprop'}.
2026-06-04 08:24:03,943 - experiment_functions - INFO - Early stopping at epoch 1600. Best Metrics: (0.0004337221061837982, 7.368209525085403e-05, 0.00018429752927639557)
2026-06-04 08:24:06,489 - optuna.study.study - INFO - Trial 145 finished with values: [0.0004337221061837982, 7.368209525085403e-05, 0.00018429752927639557] and parameters: {'n_layers': 2, 'embedding_dim': 64, 'lr': 1.765935963611109e-05, 'lambda_val': 4.446523827876978e-06, 'batch_size': 1700, 'optimizer': 'Adam'}.
2026-06-04 08:24:41,355 - experiment_functions - INFO - Early stopping at epoch 850. Best Metrics: (0.0062967980576651315, 0.0011370486971665889, 0.003555670867782613)
2026-06-04 08:24:41,817 - optuna.study.study - INFO - Trial 146 finished with values: [0.0062967980576651315, 0.0011370486971665889, 0.003555670867782613] and parameters: {'n_layers': 2, 'embedding_dim': 128, 'lr': 0.0023047972503770693, 'lambda_val': 0.0002789985957451779, 'batch_size': 2061, 'optimizer': 'RMSprop'}.
2026-06-04 08:25:06,086 - experiment_functions - INFO - Early stopping at epoch 550. Best Metrics: (0.005612301927582611, 0.0009947082858865295, 0.003182412358769658)
2026-06-04 08:25:06,490 - optuna.study.study - INFO - Trial 147 finished with values: [0.005612301927582611, 0.0009947082858865295, 0.003182412358769658] and parameters: {'n_layers': 4, 'embedding_dim': 96, 'lr': 0.014134145405446918, 'lambda_val': 4.446523827876978e-06, 'batch_size': 1344, 'optimizer': 'RMSprop'}.
2026-06-04 08:28:03,733 - optuna.study.study - INFO - Trial 148 finished with values: [0.0009936340830031594, 0.00014568959742782505, 0.0004920182753607379] and parameters: {'n_layers': 2, 'embedding_dim': 256, 'lr': 8.587689581574122e-05, 'lambda_val': 2.8077752105590774e-05, 'batch_size': 3961, 'optimizer': 'Adam'}.
2026-06-04 08:28:33,516 - experiment_functions - INFO - Early stopping at epoch 550. Best Metrics: (0.00548167470334003, 0.0010482952642507871, 0.003149910067816213)
2026-06-04 08:28:33,606 - optuna.study.study - INFO - Trial 149 finished with values: [0.00548167470334003, 0.0010482952642507871, 0.003149910067816213] and parameters: {'n_layers': 4, 'embedding_dim': 256, 'lr': 0.0044385330633786016, 'lambda_val': 0.0028698778902023414, 'batch_size': 1839, 'optimizer': 'RMSprop'}.
2026-06-04 08:28:56,906 - experiment_functions - INFO - Early stopping at epoch 500. Best Metrics: (0.0005154340870552873, 8.707883984191843e-05, 0.00025974691801467837)
2026-06-04 08:28:56,995 - optuna.study.study - INFO - Trial 150 finished with values: [0.0005154340870552873, 8.707883984191843e-05, 0.00025974691801467837] and parameters: {'n_layers': 4, 'embedding_dim': 128, 'lr': 0.00010109744647655127, 'lambda_val': 0.0028698778902023414, 'batch_size': 3961, 'optimizer': 'SGD'}.
2026-06-04 08:29:19,400 - experiment_functions - INFO - Early stopping at epoch 500. Best Metrics: (0.0004931839309560524, 6.698372295532186e-05, 0.00024893982780475963)
2026-06-04 08:29:19,687 - optuna.study.study - INFO - Trial 151 finished with values: [0.0004931839309560524, 6.698372295532186e-05, 0.00024893982780475963] and parameters: {'n_layers': 4, 'embedding_dim': 96, 'lr': 0.00028236588427973475, 'lambda_val': 2.2109211065368353e-05, 'batch_size': 3802, 'optimizer': 'SGD'}.
2026-06-04 08:29:45,022 - experiment_functions - INFO - Early stopping at epoch 600. Best Metrics: (0.005979289330133014, 0.0011069060218366939, 0.0033605073384345933)
2026-06-04 08:29:45,495 - optuna.study.study - INFO - Trial 152 finished with values: [0.005979289330133014, 0.0011069060218366939, 0.0033605073384345933] and parameters: {'n_layers': 4, 'embedding_dim': 64, 'lr': 0.004074850116282639, 'lambda_val': 0.0054022876436497684, 'batch_size': 3497, 'optimizer': 'Adam'}.
2026-06-04 08:30:15,570 - experiment_functions - INFO - Early stopping at epoch 550. Best Metrics: (0.004750723414711511, 0.000899256480675196, 0.0027361745267618126)
2026-06-04 08:30:16,048 - optuna.study.study - INFO - Trial 153 finished with values: [0.004750723414711511, 0.000899256480675196, 0.0027361745267618126] and parameters: {'n_layers': 4, 'embedding_dim': 256, 'lr': 0.014134145405446918, 'lambda_val': 0.0005151967667694534, 'batch_size': 1344, 'optimizer': 'RMSprop'}.
2026-06-04 08:30:44,577 - experiment_functions - INFO - Early stopping at epoch 550. Best Metrics: (0.004418230905546284, 0.0008088284546855114, 0.0025268697198532666)
2026-06-04 08:30:44,653 - optuna.study.study - INFO - Trial 154 finished with values: [0.004418230905546284, 0.0008088284546855114, 0.0025268697198532666] and parameters: {'n_layers': 3, 'embedding_dim': 256, 'lr': 0.014134145405446918, 'lambda_val': 0.0007078000623171965, 'batch_size': 1325, 'optimizer': 'RMSprop'}.
2026-06-04 08:31:14,812 - experiment_functions - INFO - Early stopping at epoch 750. Best Metrics: (0.0046903197471949275, 0.0008691138053453012, 0.002739303322855287)
2026-06-04 08:31:15,106 - optuna.study.study - INFO - Trial 155 finished with values: [0.0046903197471949275, 0.0008691138053453012, 0.002739303322855287] and parameters: {'n_layers': 4, 'embedding_dim': 32, 'lr': 0.0023047972503770693, 'lambda_val': 0.02043165778729133, 'batch_size': 3469, 'optimizer': 'Adam'}.
2026-06-04 08:34:14,139 - optuna.study.study - INFO - Trial 156 finished with values: [0.0013192720458525516, 0.00020262576193984865, 0.0006585858232391894] and parameters: {'n_layers': 2, 'embedding_dim': 256, 'lr': 0.00012608141670148858, 'lambda_val': 0.00014523930854886327, 'batch_size': 2310, 'optimizer': 'Adam'}.
2026-06-04 08:34:51,402 - experiment_functions - INFO - Early stopping at epoch 950. Best Metrics: (0.005190380240819097, 0.0008423203161631724, 0.0031036227201628186)
2026-06-04 08:34:51,483 - optuna.study.study - INFO - Trial 157 finished with values: [0.005190380240819097, 0.0008423203161631724, 0.0031036227201628186] and parameters: {'n_layers': 1, 'embedding_dim': 96, 'lr': 0.0038189458423184986, 'lambda_val': 2.8077752105590774e-05, 'batch_size': 1423, 'optimizer': 'RMSprop'}.
2026-06-04 08:37:08,345 - experiment_functions - INFO - Early stopping at epoch 3050. Best Metrics: (0.007817010941377912, 0.001406658182061759, 0.004577542621504587)
2026-06-04 08:37:08,772 - optuna.study.study - INFO - Trial 158 finished with values: [0.007817010941377912, 0.001406658182061759, 0.004577542621504587] and parameters: {'n_layers': 2, 'embedding_dim': 256, 'lr': 0.0005623238238546706, 'lambda_val': 4.446523827876978e-06, 'batch_size': 2567, 'optimizer': 'RMSprop'}.
2026-06-04 08:37:33,172 - experiment_functions - INFO - Early stopping at epoch 500. Best Metrics: (0.00044199619089391455, 7.033290910308794e-05, 0.000226238414955035)
2026-06-04 08:37:34,069 - optuna.study.study - INFO - Trial 159 finished with values: [0.00044199619089391455, 7.033290910308794e-05, 0.000226238414955035] and parameters: {'n_layers': 2, 'embedding_dim': 256, 'lr': 5.313053350081047e-05, 'lambda_val': 0.09689836937781025, 'batch_size': 1839, 'optimizer': 'RMSprop'}.
2026-06-04 08:38:07,323 - experiment_functions - INFO - Early stopping at epoch 650. Best Metrics: (0.0067660312964173235, 0.001292785853037712, 0.004031422508087153)
2026-06-04 08:38:07,396 - optuna.study.study - INFO - Trial 160 finished with values: [0.0067660312964173235, 0.001292785853037712, 0.004031422508087153] and parameters: {'n_layers': 3, 'embedding_dim': 256, 'lr': 0.0013876621562912753, 'lambda_val': 0.000867565506991593, 'batch_size': 3469, 'optimizer': 'RMSprop'}.
2026-06-04 08:38:33,264 - experiment_functions - INFO - Early stopping at epoch 550. Best Metrics: (0.004480767852107932, 0.0008155268269810437, 0.0025832363939296103)
2026-06-04 08:38:33,482 - optuna.study.study - INFO - Trial 161 finished with values: [0.004480767852107932, 0.0008155268269810437, 0.0025832363939296103] and parameters: {'n_layers': 4, 'embedding_dim': 128, 'lr': 0.019997575856895225, 'lambda_val': 0.0002789985957451779, 'batch_size': 3961, 'optimizer': 'RMSprop'}.
2026-06-04 08:39:01,109 - experiment_functions - INFO - Early stopping at epoch 500. Best Metrics: (0.0038578714001247624, 0.0006798847879965167, 0.0022832739241857272)
2026-06-04 08:39:01,194 - optuna.study.study - INFO - Trial 162 finished with values: [0.0038578714001247624, 0.0006798847879965167, 0.0022832739241857272] and parameters: {'n_layers': 4, 'embedding_dim': 256, 'lr': 0.09688439895262324, 'lambda_val': 0.001207385037656006, 'batch_size': 2310, 'optimizer': 'RMSprop'}.
2026-06-04 08:39:22,444 - experiment_functions - INFO - Early stopping at epoch 500. Best Metrics: (0.00022323346982719105, 4.6888606068725306e-05, 9.747695469814172e-05)
2026-06-04 08:39:22,666 - optuna.study.study - INFO - Trial 163 finished with values: [0.00022323346982719105, 4.6888606068725306e-05, 9.747695469814172e-05] and parameters: {'n_layers': 4, 'embedding_dim': 64, 'lr': 0.002820612855470111, 'lambda_val': 0.0002748178610784401, 'batch_size': 775, 'optimizer': 'SGD'}.
2026-06-04 08:41:41,320 - experiment_functions - INFO - Early stopping at epoch 3200. Best Metrics: (0.010285246765351893, 0.0018504253466407666, 0.006073304601890066)
2026-06-04 08:41:41,390 - optuna.study.study - INFO - Trial 164 finished with values: [0.010285246765351893, 0.0018504253466407666, 0.006073304601890066] and parameters: {'n_layers': 4, 'embedding_dim': 128, 'lr': 0.0003985070127686743, 'lambda_val': 8.999659749873041e-05, 'batch_size': 3058, 'optimizer': 'RMSprop'}.
2026-06-04 08:42:24,579 - experiment_functions - INFO - Early stopping at epoch 1050. Best Metrics: (0.007665572306622412, 0.0014066581820617592, 0.00430980551964753)
2026-06-04 08:42:24,856 - optuna.study.study - INFO - Trial 165 finished with values: [0.007665572306622412, 0.0014066581820617592, 0.00430980551964753] and parameters: {'n_layers': 4, 'embedding_dim': 64, 'lr': 0.0009358706696693685, 'lambda_val': 0.0054022876436497684, 'batch_size': 1801, 'optimizer': 'Adam'}.
2026-06-04 08:42:54,840 - experiment_functions - INFO - Early stopping at epoch 700. Best Metrics: (0.006974934083171403, 0.0011990086409002614, 0.003956788306896493)
2026-06-04 08:42:55,208 - optuna.study.study - INFO - Trial 166 finished with values: [0.006974934083171403, 0.0011990086409002614, 0.003956788306896493] and parameters: {'n_layers': 3, 'embedding_dim': 96, 'lr': 0.007158020046263984, 'lambda_val': 4.830818973924614e-06, 'batch_size': 1423, 'optimizer': 'Adam'}.
2026-06-04 08:44:06,743 - experiment_functions - INFO - Early stopping at epoch 1750. Best Metrics: (0.010490881503231788, 0.001838703195123585, 0.006104736067567236)
2026-06-04 08:44:07,122 - optuna.study.study - INFO - Trial 167 finished with values: [0.010490881503231788, 0.001838703195123585, 0.006104736067567236] and parameters: {'n_layers': 3, 'embedding_dim': 96, 'lr': 0.0009358706696693685, 'lambda_val': 1.7048406161686997e-06, 'batch_size': 1801, 'optimizer': 'RMSprop'}.
2026-06-04 08:46:47,019 - optuna.study.study - INFO - Trial 168 finished with values: [0.006607459385825261, 0.0010734141603590329, 0.003978148335286409] and parameters: {'n_layers': 2, 'embedding_dim': 128, 'lr': 0.0005623238238546706, 'lambda_val': 4.446523827876978e-06, 'batch_size': 1427, 'optimizer': 'Adam'}.
2026-06-04 08:47:16,884 - experiment_functions - INFO - Early stopping at epoch 700. Best Metrics: (0.0066619907292059756, 0.0011956594547524952, 0.0038550506379263364)
2026-06-04 08:47:17,200 - optuna.study.study - INFO - Trial 169 finished with values: [0.0066619907292059756, 0.0011956594547524952, 0.0038550506379263364] and parameters: {'n_layers': 3, 'embedding_dim': 96, 'lr': 0.0037544382096841252, 'lambda_val': 2.8077752105590774e-05, 'batch_size': 3497, 'optimizer': 'RMSprop'}.
2026-06-04 08:49:20,912 - experiment_functions - INFO - Early stopping at epoch 3100. Best Metrics: (0.009627718821090248, 0.001768370286020497, 0.005558855707720637)
2026-06-04 08:49:21,002 - optuna.study.study - INFO - Trial 170 finished with values: [0.009627718821090248, 0.001768370286020497, 0.005558855707720637] and parameters: {'n_layers': 3, 'embedding_dim': 96, 'lr': 0.0013876621562912753, 'lambda_val': 2.5795384074392596e-06, 'batch_size': 682, 'optimizer': 'Adam'}.
2026-06-04 08:49:42,446 - experiment_functions - INFO - Early stopping at epoch 500. Best Metrics: (0.0005338620026071103, 7.033290910308795e-05, 0.00024334361635442402)
2026-06-04 08:49:43,306 - optuna.study.study - INFO - Trial 171 finished with values: [0.0005338620026071103, 7.033290910308795e-05, 0.00024334361635442402] and parameters: {'n_layers': 2, 'embedding_dim': 128, 'lr': 0.0009358706696693685, 'lambda_val': 2.2109211065368353e-05, 'batch_size': 516, 'optimizer': 'SGD'}.
2026-06-04 08:50:08,029 - experiment_functions - INFO - Early stopping at epoch 500. Best Metrics: (0.0005002210376858881, 7.033290910308795e-05, 0.00020633526702639116)
2026-06-04 08:50:08,248 - optuna.study.study - INFO - Trial 172 finished with values: [0.0005002210376858881, 7.033290910308795e-05, 0.00020633526702639116] and parameters: {'n_layers': 2, 'embedding_dim': 256, 'lr': 0.004074850116282639, 'lambda_val': 0.0005151967667694534, 'batch_size': 1888, 'optimizer': 'SGD'}.
2026-06-04 08:50:38,106 - experiment_functions - INFO - Early stopping at epoch 550. Best Metrics: (0.006085790718548953, 0.0010566682296202024, 0.0033572528037086095)
2026-06-04 08:50:38,891 - optuna.study.study - INFO - Trial 173 finished with values: [0.006085790718548953, 0.0010566682296202024, 0.0033572528037086095] and parameters: {'n_layers': 4, 'embedding_dim': 256, 'lr': 0.014134145405446918, 'lambda_val': 2.2109211065368353e-05, 'batch_size': 1736, 'optimizer': 'RMSprop'}.
2026-06-04 08:50:59,858 - experiment_functions - INFO - Early stopping at epoch 500. Best Metrics: (0.00042384063566271776, 8.540424676803538e-05, 0.0001938988619379662)
2026-06-04 08:51:01,020 - optuna.study.study - INFO - Trial 174 finished with values: [0.00042384063566271776, 8.540424676803538e-05, 0.0001938988619379662] and parameters: {'n_layers': 3, 'embedding_dim': 64, 'lr': 0.00012162982584728387, 'lambda_val': 0.0002748178610784401, 'batch_size': 2747, 'optimizer': 'SGD'}.
2026-06-04 08:51:43,950 - experiment_functions - INFO - Early stopping at epoch 1000. Best Metrics: (0.007184663112796539, 0.0013262777145153725, 0.004135656509463922)
2026-06-04 08:51:44,034 - optuna.study.study - INFO - Trial 175 finished with values: [0.007184663112796539, 0.0013262777145153725, 0.004135656509463922] and parameters: {'n_layers': 4, 'embedding_dim': 96, 'lr': 0.0009358706696693685, 'lambda_val': 0.0023860098486142224, 'batch_size': 3323, 'optimizer': 'Adam'}.
2026-06-04 08:52:13,101 - experiment_functions - INFO - Early stopping at epoch 750. Best Metrics: (0.00498041502849416, 0.0007133766494741778, 0.002808748428159541)
2026-06-04 08:52:13,173 - optuna.study.study - INFO - Trial 176 finished with values: [0.00498041502849416, 0.0007133766494741778, 0.002808748428159541] and parameters: {'n_layers': 2, 'embedding_dim': 32, 'lr': 0.0023047972503770693, 'lambda_val': 0.000867565506991593, 'batch_size': 3469, 'optimizer': 'Adam'}.
2026-06-04 08:52:40,801 - experiment_functions - INFO - Early stopping at epoch 700. Best Metrics: (0.003405059682270689, 0.0005609886797508205, 0.0019547268628828727)
2026-06-04 08:52:40,912 - optuna.study.study - INFO - Trial 177 finished with values: [0.003405059682270689, 0.0005609886797508205, 0.0019547268628828727] and parameters: {'n_layers': 1, 'embedding_dim': 64, 'lr': 0.005645164292154372, 'lambda_val': 0.0002748178610784401, 'batch_size': 2639, 'optimizer': 'RMSprop'}.
2026-06-04 08:53:27,858 - experiment_functions - INFO - Early stopping at epoch 1100. Best Metrics: (0.008435867993955896, 0.0015389510348985198, 0.004973344843060888)
2026-06-04 08:53:27,934 - optuna.study.study - INFO - Trial 178 finished with values: [0.008435867993955896, 0.0015389510348985198, 0.004973344843060888] and parameters: {'n_layers': 3, 'embedding_dim': 128, 'lr': 0.0023047972503770693, 'lambda_val': 0.0002748178610784401, 'batch_size': 775, 'optimizer': 'Adam'}.
2026-06-04 08:54:21,550 - experiment_functions - INFO - Early stopping at epoch 1000. Best Metrics: (0.008718799759547669, 0.0016059347578538416, 0.004812111105192159)
2026-06-04 08:54:21,640 - optuna.study.study - INFO - Trial 179 finished with values: [0.008718799759547669, 0.0016059347578538416, 0.004812111105192159] and parameters: {'n_layers': 4, 'embedding_dim': 256, 'lr': 0.0009358706696693685, 'lambda_val': 0.00014523930854886327, 'batch_size': 2558, 'optimizer': 'RMSprop'}.
2026-06-04 08:57:04,214 - optuna.study.study - INFO - Trial 180 finished with values: [0.008096165170930203, 0.001471967311943198, 0.004894620877128349] and parameters: {'n_layers': 4, 'embedding_dim': 96, 'lr': 0.00028236588427973475, 'lambda_val': 0.00020421509796155136, 'batch_size': 3802, 'optimizer': 'RMSprop'}.
2026-06-04 08:57:28,254 - experiment_functions - INFO - Early stopping at epoch 550. Best Metrics: (0.0047204764117276185, 0.0008205506062026927, 0.002684742386317635)
2026-06-04 08:57:28,337 - optuna.study.study - INFO - Trial 181 finished with values: [0.0047204764117276185, 0.0008205506062026927, 0.002684742386317635] and parameters: {'n_layers': 3, 'embedding_dim': 96, 'lr': 0.011472785289985216, 'lambda_val': 0.006409139170390952, 'batch_size': 3961, 'optimizer': 'Adam'}.
2026-06-04 08:59:48,834 - experiment_functions - INFO - Early stopping at epoch 3600. Best Metrics: (0.014840854179062349, 0.002562127403041061, 0.008981376622929417)
2026-06-04 08:59:49,408 - optuna.study.study - INFO - Trial 182 finished with values: [0.014840854179062349, 0.002562127403041061, 0.008981376622929417] and parameters: {'n_layers': 4, 'embedding_dim': 64, 'lr': 0.0009358706696693685, 'lambda_val': 2.2109211065368353e-05, 'batch_size': 775, 'optimizer': 'RMSprop'}.
2026-06-04 09:01:20,219 - experiment_functions - INFO - Early stopping at epoch 2200. Best Metrics: (0.009741003109385117, 0.0017817670306115615, 0.005641101712871661)
2026-06-04 09:01:20,306 - optuna.study.study - INFO - Trial 183 finished with values: [0.009741003109385117, 0.0017817670306115615, 0.005641101712871661] and parameters: {'n_layers': 4, 'embedding_dim': 96, 'lr': 0.0009358706696693685, 'lambda_val': 4.830818973924614e-06, 'batch_size': 1423, 'optimizer': 'Adam'}.
2026-06-04 09:02:15,823 - experiment_functions - INFO - Early stopping at epoch 1050. Best Metrics: (0.007632049969288742, 0.001482014870386496, 0.00449482994082172)
2026-06-04 09:02:16,410 - optuna.study.study - INFO - Trial 184 finished with values: [0.007632049969288742, 0.001482014870386496, 0.00449482994082172] and parameters: {'n_layers': 4, 'embedding_dim': 256, 'lr': 0.0009993931731412705, 'lambda_val': 2.2109211065368353e-05, 'batch_size': 3469, 'optimizer': 'Adam'}.
2026-06-04 09:03:41,108 - experiment_functions - INFO - Early stopping at epoch 2150. Best Metrics: (0.012908036784170934, 0.0023561524549534463, 0.00803781688400305)
2026-06-04 09:03:42,002 - optuna.study.study - INFO - Trial 185 finished with values: [0.012908036784170934, 0.0023561524549534463, 0.00803781688400305] and parameters: {'n_layers': 4, 'embedding_dim': 64, 'lr': 0.0009358706696693685, 'lambda_val': 2.8077752105590774e-05, 'batch_size': 1005, 'optimizer': 'RMSprop'}.
2026-06-04 09:06:24,242 - optuna.study.study - INFO - Trial 186 finished with values: [0.00533960057993817, 0.0010516444503985533, 0.0031063252399888353] and parameters: {'n_layers': 4, 'embedding_dim': 96, 'lr': 0.00028236588427973475, 'lambda_val': 0.039618002209163034, 'batch_size': 2630, 'optimizer': 'RMSprop'}.
2026-06-04 09:06:56,632 - experiment_functions - INFO - Early stopping at epoch 600. Best Metrics: (0.007896682649289923, 0.0014066581820617592, 0.004299901744703038)
2026-06-04 09:06:56,713 - optuna.study.study - INFO - Trial 187 finished with values: [0.007896682649289923, 0.0014066581820617592, 0.004299901744703038] and parameters: {'n_layers': 4, 'embedding_dim': 256, 'lr': 0.0023047972503770693, 'lambda_val': 0.0002789985957451779, 'batch_size': 1801, 'optimizer': 'RMSprop'}.
2026-06-04 09:08:21,593 - experiment_functions - INFO - Early stopping at epoch 2050. Best Metrics: (0.011377261505856292, 0.0020547257016544983, 0.006654189299886496)
2026-06-04 09:08:21,896 - optuna.study.study - INFO - Trial 188 finished with values: [0.011377261505856292, 0.0020547257016544983, 0.006654189299886496] and parameters: {'n_layers': 4, 'embedding_dim': 96, 'lr': 0.0009358706696693685, 'lambda_val': 2.2109211065368353e-05, 'batch_size': 1230, 'optimizer': 'RMSprop'}.
2026-06-04 09:09:40,811 - experiment_functions - INFO - Early stopping at epoch 1950. Best Metrics: (0.00788399785919689, 0.0013949360305445776, 0.004590119473011527)
2026-06-04 09:09:42,099 - optuna.study.study - INFO - Trial 189 finished with values: [0.00788399785919689, 0.0013949360305445776, 0.004590119473011527] and parameters: {'n_layers': 3, 'embedding_dim': 96, 'lr': 0.0009358706696693685, 'lambda_val': 4.830818973924614e-06, 'batch_size': 2421, 'optimizer': 'Adam'}.
2026-06-04 09:10:20,223 - experiment_functions - INFO - Early stopping at epoch 1000. Best Metrics: (0.006212561527493654, 0.001080112532654565, 0.0037636141231477066)
