2026-06-04 06:43:29,504 - optuna.study.study - INFO - Trial 49 finished with values: [0.004001788707516717, 0.0007585906624690201, 0.002427703297742648] and parameters: {'n_layers': 2, 'embedding_dim': 64, 'lr': 0.005896600309432249, 'lambda_val': 0.002447818141975251, 'batch_size': 3752, 'optimizer': 'RMSprop'}.
2026-06-04 06:43:55,676 - experiment_functions - INFO - Early stopping at epoch 600. Best Metrics: (0.005617322976740464, 0.0010298747404380736, 0.003369043226434519)
2026-06-04 06:43:55,947 - optuna.study.study - INFO - Trial 50 finished with values: [0.005617322976740464, 0.0010298747404380736, 0.003369043226434519] and parameters: {'n_layers': 3, 'embedding_dim': 96, 'lr': 0.007158020046263984, 'lambda_val': 4.830818973924614e-06, 'batch_size': 3497, 'optimizer': 'RMSprop'}.
2026-06-04 06:44:58,982 - experiment_functions - INFO - Early stopping at epoch 1650. Best Metrics: (0.004288933539883952, 0.0008490186884587045, 0.0024239646230424937)
2026-06-04 06:44:59,072 - optuna.study.study - INFO - Trial 51 finished with values: [0.004288933539883952, 0.0008490186884587045, 0.0024239646230424937] and parameters: {'n_layers': 1, 'embedding_dim': 96, 'lr': 0.04700651621294063, 'lambda_val': 0.004312635774464951, 'batch_size': 2481, 'optimizer': 'RMSprop'}.
2026-06-04 06:46:51,473 - experiment_functions - INFO - Early stopping at epoch 3000. Best Metrics: (0.003989073166606353, 0.0007719874070600844, 0.002325812582747853)
2026-06-04 06:46:51,749 - optuna.study.study - INFO - Trial 52 finished with values: [0.003989073166606353, 0.0007719874070600844, 0.002325812582747853] and parameters: {'n_layers': 1, 'embedding_dim': 96, 'lr': 0.019127564392418365, 'lambda_val': 9.989132188829677e-05, 'batch_size': 3497, 'optimizer': 'RMSprop'}.
2026-06-04 06:47:29,931 - experiment_functions - INFO - Early stopping at epoch 850. Best Metrics: (0.0040240929548372335, 0.0007552414763212541, 0.0023230616777204912)
2026-06-04 06:47:30,004 - optuna.study.study - INFO - Trial 53 finished with values: [0.0040240929548372335, 0.0007552414763212541, 0.0023230616777204912] and parameters: {'n_layers': 4, 'embedding_dim': 128, 'lr': 0.007982799603933596, 'lambda_val': 0.039618002209163034, 'batch_size': 3544, 'optimizer': 'RMSprop'}.
2026-06-04 06:49:10,290 - experiment_functions - INFO - Early stopping at epoch 2650. Best Metrics: (0.003912819217007774, 0.000755241476321254, 0.002280773748283682)
2026-06-04 06:49:10,587 - optuna.study.study - INFO - Trial 54 finished with values: [0.003912819217007774, 0.000755241476321254, 0.002280773748283682] and parameters: {'n_layers': 1, 'embedding_dim': 96, 'lr': 0.03811330606468482, 'lambda_val': 0.0005151967667694534, 'batch_size': 3888, 'optimizer': 'Adam'}.
2026-06-04 06:49:39,047 - experiment_functions - INFO - Early stopping at epoch 550. Best Metrics: (0.004664888333071972, 0.0008875343291580146, 0.002638040853487982)
2026-06-04 06:49:39,133 - optuna.study.study - INFO - Trial 55 finished with values: [0.004664888333071972, 0.0008875343291580146, 0.002638040853487982] and parameters: {'n_layers': 3, 'embedding_dim': 256, 'lr': 0.005642760983601255, 'lambda_val': 0.0054022876436497684, 'batch_size': 3469, 'optimizer': 'RMSprop'}.
2026-06-04 06:50:18,969 - experiment_functions - INFO - Early stopping at epoch 950. Best Metrics: (0.008251728934173752, 0.0014937370219036774, 0.004680774527745336)
2026-06-04 06:50:19,177 - optuna.study.study - INFO - Trial 56 finished with values: [0.008251728934173752, 0.0014937370219036774, 0.004680774527745336] and parameters: {'n_layers': 3, 'embedding_dim': 96, 'lr': 0.0013074159600185884, 'lambda_val': 1.9086610212452873e-05, 'batch_size': 3497, 'optimizer': 'RMSprop'}.
2026-06-04 06:51:47,736 - experiment_functions - INFO - Early stopping at epoch 2450. Best Metrics: (0.0036439880659878783, 0.0007150512425480609, 0.002127380321923618)
2026-06-04 06:51:47,850 - optuna.study.study - INFO - Trial 57 finished with values: [0.0036439880659878783, 0.0007150512425480609, 0.002127380321923618] and parameters: {'n_layers': 1, 'embedding_dim': 32, 'lr': 0.03811330606468482, 'lambda_val': 0.0018633893015272906, 'batch_size': 3087, 'optimizer': 'RMSprop'}.
2026-06-04 06:52:08,945 - experiment_functions - INFO - Early stopping at epoch 500. Best Metrics: (0.0003164446560567592, 5.861075758590662e-05, 0.00013775178072275977)
2026-06-04 06:52:09,646 - optuna.study.study - INFO - Trial 58 finished with values: [0.0003164446560567592, 5.861075758590662e-05, 0.00013775178072275977] and parameters: {'n_layers': 2, 'embedding_dim': 96, 'lr': 4.161663982964273e-05, 'lambda_val': 4.0972501239992526e-06, 'batch_size': 2351, 'optimizer': 'SGD'}.
2026-06-04 06:52:33,860 - experiment_functions - INFO - Early stopping at epoch 550. Best Metrics: (0.005422309032833729, 0.0008825105499363655, 0.0030715367073177098)
2026-06-04 06:52:33,945 - optuna.study.study - INFO - Trial 59 finished with values: [0.005422309032833729, 0.0008825105499363655, 0.0030715367073177098] and parameters: {'n_layers': 2, 'embedding_dim': 128, 'lr': 0.006723362184220212, 'lambda_val': 0.00014523930854886327, 'batch_size': 1839, 'optimizer': 'RMSprop'}.
2026-06-04 06:53:19,097 - experiment_functions - INFO - Early stopping at epoch 1000. Best Metrics: (0.007539446010853748, 0.001435126264317771, 0.00434394311604393)
2026-06-04 06:53:19,436 - optuna.study.study - INFO - Trial 60 finished with values: [0.007539446010853748, 0.001435126264317771, 0.00434394311604393] and parameters: {'n_layers': 4, 'embedding_dim': 128, 'lr': 0.0010273844172621362, 'lambda_val': 1.933875333428983e-06, 'batch_size': 3961, 'optimizer': 'Adam'}.
2026-06-04 06:53:52,480 - experiment_functions - INFO - Early stopping at epoch 850. Best Metrics: (0.005584695105410211, 0.0009528434590394532, 0.003383541796388173)
2026-06-04 06:53:52,582 - optuna.study.study - INFO - Trial 61 finished with values: [0.005584695105410211, 0.0009528434590394532, 0.003383541796388173] and parameters: {'n_layers': 2, 'embedding_dim': 32, 'lr': 0.0023047972503770693, 'lambda_val': 0.0002789985957451779, 'batch_size': 3058, 'optimizer': 'RMSprop'}.
2026-06-04 06:54:29,216 - experiment_functions - INFO - Early stopping at epoch 900. Best Metrics: (0.004928070921737897, 0.0008406457230892894, 0.0028125545595736514)
2026-06-04 06:54:29,445 - optuna.study.study - INFO - Trial 62 finished with values: [0.004928070921737897, 0.0008406457230892894, 0.0028125545595736514] and parameters: {'n_layers': 2, 'embedding_dim': 96, 'lr': 0.00898171657562191, 'lambda_val': 2.1052099842147924e-05, 'batch_size': 2351, 'optimizer': 'RMSprop'}.
2026-06-04 06:57:13,845 - optuna.study.study - INFO - Trial 63 finished with values: [0.0021211241111474106, 0.00031314890481612975, 0.0011189591628445168] and parameters: {'n_layers': 1, 'embedding_dim': 256, 'lr': 0.00017247251739345996, 'lambda_val': 0.0002789985957451779, 'batch_size': 3058, 'optimizer': 'RMSprop'}.
2026-06-04 06:57:41,744 - experiment_functions - INFO - Early stopping at epoch 500. Best Metrics: (0.0033769506517915045, 0.0005609886797508206, 0.002071048369208375)
2026-06-04 06:57:41,821 - optuna.study.study - INFO - Trial 64 finished with values: [0.0033769506517915045, 0.0005609886797508206, 0.002071048369208375] and parameters: {'n_layers': 4, 'embedding_dim': 256, 'lr': 0.09547497823339654, 'lambda_val': 0.018714744804770398, 'batch_size': 3199, 'optimizer': 'RMSprop'}.
2026-06-04 06:58:03,620 - experiment_functions - INFO - Early stopping at epoch 550. Best Metrics: (0.003717742411988713, 0.0005844329827851832, 0.0020101807502545723)
2026-06-04 06:58:03,701 - optuna.study.study - INFO - Trial 65 finished with values: [0.003717742411988713, 0.0005844329827851832, 0.0020101807502545723] and parameters: {'n_layers': 2, 'embedding_dim': 32, 'lr': 0.005896600309432249, 'lambda_val': 0.002447818141975251, 'batch_size': 3752, 'optimizer': 'RMSprop'}.
2026-06-04 06:58:49,484 - experiment_functions - INFO - Early stopping at epoch 1200. Best Metrics: (0.0004815586432860578, 6.865831602920491e-05, 0.00021221931667421786)
2026-06-04 06:58:50,058 - optuna.study.study - INFO - Trial 66 finished with values: [0.0004815586432860578, 6.865831602920491e-05, 0.00021221931667421786] and parameters: {'n_layers': 3, 'embedding_dim': 32, 'lr': 1.3798113241902916e-05, 'lambda_val': 0.00016114073645453217, 'batch_size': 3497, 'optimizer': 'RMSprop'}.
2026-06-04 07:01:08,475 - experiment_functions - INFO - Early stopping at epoch 3700. Best Metrics: (0.004147008270746664, 0.0008138522339071605, 0.0024106577949548924)
2026-06-04 07:01:08,555 - optuna.study.study - INFO - Trial 67 finished with values: [0.004147008270746664, 0.0008138522339071605, 0.0024106577949548924] and parameters: {'n_layers': 1, 'embedding_dim': 96, 'lr': 0.0692061798584086, 'lambda_val': 0.05895230860296244, 'batch_size': 806, 'optimizer': 'Adam'}.
2026-06-04 07:01:35,674 - experiment_functions - INFO - Early stopping at epoch 500. Best Metrics: (0.00041003624322367104, 7.870587447250318e-05, 0.00021898394847097303)
2026-06-04 07:01:35,802 - optuna.study.study - INFO - Trial 68 finished with values: [0.00041003624322367104, 7.870587447250318e-05, 0.00021898394847097303] and parameters: {'n_layers': 4, 'embedding_dim': 256, 'lr': 0.008086415193231163, 'lambda_val': 1.3249981935549627e-05, 'batch_size': 3410, 'optimizer': 'SGD'}.
2026-06-04 07:02:02,458 - experiment_functions - INFO - Early stopping at epoch 650. Best Metrics: (0.005245366515395811, 0.0008573916538281198, 0.0028563494617115676)
2026-06-04 07:02:03,498 - optuna.study.study - INFO - Trial 69 finished with values: [0.005245366515395811, 0.0008573916538281198, 0.0028563494617115676] and parameters: {'n_layers': 2, 'embedding_dim': 64, 'lr': 0.005896600309432249, 'lambda_val': 0.00041860760081866575, 'batch_size': 3752, 'optimizer': 'RMSprop'}.
2026-06-04 07:02:24,194 - experiment_functions - INFO - Early stopping at epoch 500. Best Metrics: (0.0016077729053428534, 0.00023779221649139262, 0.0008981858746504029)
2026-06-04 07:02:24,581 - optuna.study.study - INFO - Trial 70 finished with values: [0.0016077729053428534, 0.00023779221649139262, 0.0008981858746504029] and parameters: {'n_layers': 4, 'embedding_dim': 32, 'lr': 0.07738255632893443, 'lambda_val': 0.0913709160623431, 'batch_size': 2261, 'optimizer': 'RMSprop'}.
2026-06-04 07:03:45,489 - experiment_functions - INFO - Early stopping at epoch 2200. Best Metrics: (0.004166411967555696, 0.0007770111862817336, 0.0023123799131311816)
2026-06-04 07:03:45,989 - optuna.study.study - INFO - Trial 71 finished with values: [0.004166411967555696, 0.0007770111862817336, 0.0023123799131311816] and parameters: {'n_layers': 1, 'embedding_dim': 64, 'lr': 0.005896600309432249, 'lambda_val': 0.05895230860296244, 'batch_size': 806, 'optimizer': 'RMSprop'}.
2026-06-04 07:04:08,278 - experiment_functions - INFO - Early stopping at epoch 500. Best Metrics: (0.000626946183204091, 8.038046754638624e-05, 0.0002850335135769438)
2026-06-04 07:04:08,409 - optuna.study.study - INFO - Trial 72 finished with values: [0.000626946183204091, 8.038046754638624e-05, 0.0002850335135769438] and parameters: {'n_layers': 3, 'embedding_dim': 96, 'lr': 0.0003119939859013628, 'lambda_val': 0.0913709160623431, 'batch_size': 1466, 'optimizer': 'RMSprop'}.
2026-06-04 07:05:41,439 - experiment_functions - INFO - Early stopping at epoch 2400. Best Metrics: (0.003993855834386908, 0.0007652890347645523, 0.0023924363319667076)
2026-06-04 07:05:41,529 - optuna.study.study - INFO - Trial 73 finished with values: [0.003993855834386908, 0.0007652890347645523, 0.0023924363319667076] and parameters: {'n_layers': 1, 'embedding_dim': 128, 'lr': 0.007982799603933596, 'lambda_val': 0.0012865728517446665, 'batch_size': 3544, 'optimizer': 'Adam'}.
2026-06-04 07:06:23,960 - experiment_functions - INFO - Early stopping at epoch 800. Best Metrics: (0.003897797784321091, 0.0006932815325875813, 0.0021160414121276405)
2026-06-04 07:06:24,054 - optuna.study.study - INFO - Trial 74 finished with values: [0.003897797784321091, 0.0006932815325875813, 0.0021160414121276405] and parameters: {'n_layers': 4, 'embedding_dim': 256, 'lr': 0.014134145405446918, 'lambda_val': 0.039618002209163034, 'batch_size': 3544, 'optimizer': 'RMSprop'}.
2026-06-04 07:06:53,918 - experiment_functions - INFO - Early stopping at epoch 550. Best Metrics: (0.005381434395476783, 0.001009779623551477, 0.0031584571639409493)
2026-06-04 07:06:54,470 - optuna.study.study - INFO - Trial 75 finished with values: [0.005381434395476783, 0.001009779623551477, 0.0031584571639409493] and parameters: {'n_layers': 4, 'embedding_dim': 256, 'lr': 0.014134145405446918, 'lambda_val': 2.2109211065368353e-05, 'batch_size': 1344, 'optimizer': 'RMSprop'}.
2026-06-04 07:07:14,957 - experiment_functions - INFO - Early stopping at epoch 500. Best Metrics: (0.0004905270623514851, 7.368209525085404e-05, 0.00022691003594776794)
2026-06-04 07:07:15,110 - optuna.study.study - INFO - Trial 76 finished with values: [0.0004905270623514851, 7.368209525085404e-05, 0.00022691003594776794] and parameters: {'n_layers': 3, 'embedding_dim': 32, 'lr': 0.006723362184220212, 'lambda_val': 0.00014523930854886327, 'batch_size': 1998, 'optimizer': 'SGD'}.
2026-06-04 07:07:37,648 - experiment_functions - INFO - Early stopping at epoch 550. Best Metrics: (0.004479900585069235, 0.0008389711300154063, 0.0026033111486726424)
2026-06-04 07:07:37,723 - optuna.study.study - INFO - Trial 77 finished with values: [0.004479900585069235, 0.0008389711300154063, 0.0026033111486726424] and parameters: {'n_layers': 4, 'embedding_dim': 32, 'lr': 0.006374731525389089, 'lambda_val': 0.0033908243169255567, 'batch_size': 2313, 'optimizer': 'RMSprop'}.
2026-06-04 07:08:01,891 - experiment_functions - INFO - Early stopping at epoch 550. Best Metrics: (0.005001381673413986, 0.0008490186884587045, 0.002866121362371053)
2026-06-04 07:08:02,296 - optuna.study.study - INFO - Trial 78 finished with values: [0.005001381673413986, 0.0008490186884587045, 0.002866121362371053] and parameters: {'n_layers': 3, 'embedding_dim': 96, 'lr': 0.011472785289985216, 'lambda_val': 0.00011536063209032362, 'batch_size': 3497, 'optimizer': 'RMSprop'}.
2026-06-04 07:10:45,495 - optuna.study.study - INFO - Trial 79 finished with values: [0.0011495202883048388, 0.00016578471431442164, 0.0005396610951195863] and parameters: {'n_layers': 4, 'embedding_dim': 96, 'lr': 9.855466014376363e-05, 'lambda_val': 2.1052099842147924e-05, 'batch_size': 2351, 'optimizer': 'Adam'}.
2026-06-04 07:11:07,713 - experiment_functions - INFO - Early stopping at epoch 500. Best Metrics: (0.0006454836351820643, 8.038046754638624e-05, 0.00027131171353264306)
2026-06-04 07:11:07,784 - optuna.study.study - INFO - Trial 80 finished with values: [0.0006454836351820643, 8.038046754638624e-05, 0.00027131171353264306] and parameters: {'n_layers': 4, 'embedding_dim': 96, 'lr': 0.0044385330633786016, 'lambda_val': 4.0972501239992526e-06, 'batch_size': 1496, 'optimizer': 'SGD'}.
2026-06-04 07:11:30,273 - experiment_functions - INFO - Early stopping at epoch 500. Best Metrics: (0.002307852981808669, 0.00038013262777145156, 0.0012460329167500496)
2026-06-04 07:11:30,354 - optuna.study.study - INFO - Trial 81 finished with values: [0.002307852981808669, 0.00038013262777145156, 0.0012460329167500496] and parameters: {'n_layers': 4, 'embedding_dim': 96, 'lr': 0.057615183260291636, 'lambda_val': 0.0913709160623431, 'batch_size': 1466, 'optimizer': 'RMSprop'}.
2026-06-04 07:13:53,372 - optuna.study.study - INFO - Trial 82 finished with values: [0.0022834569191206512, 0.0003315694286288433, 0.0012085697024889093] and parameters: {'n_layers': 1, 'embedding_dim': 32, 'lr': 0.0002170623403356149, 'lambda_val': 2.538154667606551e-05, 'batch_size': 3616, 'optimizer': 'Adam'}.
2026-06-04 07:16:36,688 - optuna.study.study - INFO - Trial 83 finished with values: [0.005227288649146663, 0.0010282001473641907, 0.0030149574323503773] and parameters: {'n_layers': 4, 'embedding_dim': 96, 'lr': 0.00028236588427973475, 'lambda_val': 0.039618002209163034, 'batch_size': 3544, 'optimizer': 'RMSprop'}.
2026-06-04 07:17:28,616 - experiment_functions - INFO - Early stopping at epoch 1350. Best Metrics: (0.005182318527840667, 0.0009042802598968451, 0.003005749217950395)
2026-06-04 07:17:28,701 - optuna.study.study - INFO - Trial 84 finished with values: [0.005182318527840667, 0.0009042802598968451, 0.003005749217950395] and parameters: {'n_layers': 2, 'embedding_dim': 64, 'lr': 0.0009993931731412705, 'lambda_val': 0.0054022876436497684, 'batch_size': 1700, 'optimizer': 'Adam'}.
2026-06-04 07:18:29,202 - experiment_functions - INFO - Early stopping at epoch 1150. Best Metrics: (0.008549207208873774, 0.0015389510348985198, 0.004804046225973143)
2026-06-04 07:18:29,511 - optuna.study.study - INFO - Trial 85 finished with values: [0.008549207208873774, 0.0015389510348985198, 0.004804046225973143] and parameters: {'n_layers': 4, 'embedding_dim': 256, 'lr': 0.0009358706696693685, 'lambda_val': 0.00014523930854886327, 'batch_size': 1801, 'optimizer': 'Adam'}.
2026-06-04 07:21:14,890 - optuna.study.study - INFO - Trial 86 finished with values: [0.0016989735950732085, 0.00024114140263915872, 0.0008839015732404416] and parameters: {'n_layers': 3, 'embedding_dim': 128, 'lr': 0.00012113582018162265, 'lambda_val': 1.9086610212452873e-05, 'batch_size': 3058, 'optimizer': 'Adam'}.
2026-06-04 07:21:45,864 - experiment_functions - INFO - Early stopping at epoch 750. Best Metrics: (0.005045902768633263, 0.0008423203161631724, 0.002949102904246476)
2026-06-04 07:21:45,946 - optuna.study.study - INFO - Trial 87 finished with values: [0.005045902768633263, 0.0008423203161631724, 0.002949102904246476] and parameters: {'n_layers': 2, 'embedding_dim': 96, 'lr': 0.007158020046263984, 'lambda_val': 4.446523827876978e-06, 'batch_size': 2749, 'optimizer': 'Adam'}.
2026-06-04 07:22:40,084 - experiment_functions - INFO - Early stopping at epoch 1100. Best Metrics: (0.003885964313448832, 0.000755241476321254, 0.002174969526986132)
2026-06-04 07:22:40,631 - optuna.study.study - INFO - Trial 88 finished with values: [0.003885964313448832, 0.000755241476321254, 0.002174969526986132] and parameters: {'n_layers': 3, 'embedding_dim': 256, 'lr': 0.05320408674234908, 'lambda_val': 0.0007134174480893843, 'batch_size': 3497, 'optimizer': 'RMSprop'}.
2026-06-04 07:23:24,220 - experiment_functions - INFO - Early stopping at epoch 1000. Best Metrics: (0.004494161700876578, 0.0007016544979569965, 0.0024505964949494696)
2026-06-04 07:23:24,312 - optuna.study.study - INFO - Trial 89 finished with values: [0.004494161700876578, 0.0007016544979569965, 0.0024505964949494696] and parameters: {'n_layers': 1, 'embedding_dim': 256, 'lr': 0.016201446778311295, 'lambda_val': 4.830818973924614e-06, 'batch_size': 3199, 'optimizer': 'Adam'}.
2026-06-04 07:26:06,638 - optuna.study.study - INFO - Trial 90 finished with values: [0.005664839242612775, 0.0009478196798178043, 0.0034011859073106777] and parameters: {'n_layers': 4, 'embedding_dim': 96, 'lr': 0.00028236588427973475, 'lambda_val': 0.0002748178610784401, 'batch_size': 806, 'optimizer': 'RMSprop'}.
2026-06-04 07:28:32,017 - optuna.study.study - INFO - Trial 91 finished with values: [0.001419658501475401, 0.00019760198271819948, 0.0006916245439632159] and parameters: {'n_layers': 3, 'embedding_dim': 32, 'lr': 0.00010709493567834111, 'lambda_val': 1.7171594062418532e-05, 'batch_size': 1819, 'optimizer': 'Adam'}.
2026-06-04 07:29:13,799 - experiment_functions - INFO - Early stopping at epoch 1000. Best Metrics: (0.009067902971135636, 0.001545649407194052, 0.005211479693801364)
2026-06-04 07:29:14,417 - optuna.study.study - INFO - Trial 92 finished with values: [0.009067902971135636, 0.001545649407194052, 0.005211479693801364] and parameters: {'n_layers': 3, 'embedding_dim': 96, 'lr': 0.0010273844172621362, 'lambda_val': 2.8077752105590774e-05, 'batch_size': 3497, 'optimizer': 'RMSprop'}.
2026-06-04 07:31:31,543 - experiment_functions - INFO - Early stopping at epoch 3300. Best Metrics: (0.005200717505620874, 0.0008188760131288098, 0.0030053904306617755)
2026-06-04 07:31:31,623 - optuna.study.study - INFO - Trial 93 finished with values: [0.005200717505620874, 0.0008188760131288098, 0.0030053904306617755] and parameters: {'n_layers': 1, 'embedding_dim': 256, 'lr': 0.0010442431692131513, 'lambda_val': 2.2233828008365298e-05, 'batch_size': 945, 'optimizer': 'Adam'}.
2026-06-04 07:31:53,244 - experiment_functions - INFO - Early stopping at epoch 500. Best Metrics: (0.0003779208509399602, 7.033290910308795e-05, 0.00015157832494727222)
2026-06-04 07:31:53,354 - optuna.study.study - INFO - Trial 94 finished with values: [0.0003779208509399602, 7.033290910308795e-05, 0.00015157832494727222] and parameters: {'n_layers': 4, 'embedding_dim': 64, 'lr': 0.00028236588427973475, 'lambda_val': 2.2519914952733722e-06, 'batch_size': 775, 'optimizer': 'SGD'}.
2026-06-04 07:34:21,536 - optuna.study.study - INFO - Trial 95 finished with values: [0.0053033820229623566, 0.0008172014200549268, 0.002948241134880794] and parameters: {'n_layers': 1, 'embedding_dim': 96, 'lr': 0.0010273844172621362, 'lambda_val': 2.8077752105590774e-05, 'batch_size': 2639, 'optimizer': 'Adam'}.
2026-06-04 07:36:57,959 - optuna.study.study - INFO - Trial 96 finished with values: [0.009399593722459933, 0.0015774666755978299, 0.005551950036507301] and parameters: {'n_layers': 3, 'embedding_dim': 96, 'lr': 0.0005758008621537027, 'lambda_val': 4.830818973924614e-06, 'batch_size': 1423, 'optimizer': 'Adam'}.
2026-06-04 07:37:23,336 - experiment_functions - INFO - Early stopping at epoch 550. Best Metrics: (0.0049845514034523196, 0.0009947082858865297, 0.002861741195501446)
