2026-06-07 04:17:56,683 - optuna.study.study - INFO - Trial 256 finished with values: [0.009163520315766775, 0.00280326880568022, 0.0064815650699362555] and parameters: {'n_layers': 1, 'embedding_dim': 64, 'lr': 0.005424684195660662, 'lambda_val': 0.00018703066672857182, 'batch_size': 4046, 'optimizer': 'Adam'}.
2026-06-07 04:18:16,406 - experiment_functions - INFO - Early stopping at epoch 500. Best Metrics: (0.0004945486462781068, 7.033290910308795e-05, 0.00019447298436780396)
2026-06-07 04:18:17,318 - optuna.study.study - INFO - Trial 257 finished with values: [0.0004945486462781068, 7.033290910308795e-05, 0.00019447298436780396] and parameters: {'n_layers': 1, 'embedding_dim': 32, 'lr': 0.0020485036238635386, 'lambda_val': 0.0036211663329917747, 'batch_size': 1861, 'optimizer': 'SGD'}.
2026-06-07 04:18:40,918 - experiment_functions - INFO - Early stopping at epoch 600. Best Metrics: (0.006956522448508021, 0.0020647732600977964, 0.004590845423363533)
2026-06-07 04:18:41,023 - optuna.study.study - INFO - Trial 258 finished with values: [0.006956522448508021, 0.0020647732600977964, 0.004590845423363533] and parameters: {'n_layers': 1, 'embedding_dim': 32, 'lr': 0.0020485036238635386, 'lambda_val': 0.0036211663329917747, 'batch_size': 1861, 'optimizer': 'RMSprop'}.
2026-06-07 04:19:28,560 - experiment_functions - INFO - Early stopping at epoch 1200. Best Metrics: (0.00788496116776187, 0.0025838971130015408, 0.005795384105220295)
2026-06-07 04:19:28,642 - optuna.study.study - INFO - Trial 259 finished with values: [0.00788496116776187, 0.0025838971130015408, 0.005795384105220295] and parameters: {'n_layers': 1, 'embedding_dim': 128, 'lr': 0.000762190113410319, 'lambda_val': 0.003413922431571512, 'batch_size': 1731, 'optimizer': 'Adam'}.
2026-06-07 04:19:53,639 - experiment_functions - INFO - Early stopping at epoch 550. Best Metrics: (0.008133560116187561, 0.0027580547926853776, 0.0062311450096765265)
2026-06-07 04:19:53,741 - optuna.study.study - INFO - Trial 260 finished with values: [0.008133560116187561, 0.0027580547926853776, 0.0062311450096765265] and parameters: {'n_layers': 1, 'embedding_dim': 256, 'lr': 0.005424684195660662, 'lambda_val': 0.003413922431571512, 'batch_size': 2118, 'optimizer': 'Adam'}.
2026-06-07 04:20:30,126 - experiment_functions - INFO - Early stopping at epoch 900. Best Metrics: (0.008917780159681461, 0.0029556567754035774, 0.006639919326214343)
2026-06-07 04:20:30,358 - optuna.study.study - INFO - Trial 261 finished with values: [0.008917780159681461, 0.0029556567754035774, 0.006639919326214343] and parameters: {'n_layers': 1, 'embedding_dim': 128, 'lr': 0.0017016645886361516, 'lambda_val': 5.7180358836305965e-06, 'batch_size': 1582, 'optimizer': 'Adam'}.
2026-06-07 04:20:52,640 - experiment_functions - INFO - Early stopping at epoch 550. Best Metrics: (0.008345120980027852, 0.0026743251389912247, 0.006129985205754328)
2026-06-07 04:20:52,732 - optuna.study.study - INFO - Trial 262 finished with values: [0.008345120980027852, 0.0026743251389912247, 0.006129985205754328] and parameters: {'n_layers': 1, 'embedding_dim': 64, 'lr': 0.011045658558976823, 'lambda_val': 0.0002771226906481787, 'batch_size': 2652, 'optimizer': 'Adam'}.
2026-06-07 04:21:14,789 - experiment_functions - INFO - Early stopping at epoch 550. Best Metrics: (0.006170914941895555, 0.001900663138857258, 0.004105779863028498)
2026-06-07 04:21:14,870 - optuna.study.study - INFO - Trial 263 finished with values: [0.006170914941895555, 0.001900663138857258, 0.004105779863028498] and parameters: {'n_layers': 1, 'embedding_dim': 32, 'lr': 0.026053498821507766, 'lambda_val': 3.491863285065632e-06, 'batch_size': 4046, 'optimizer': 'Adam'}.
2026-06-07 04:21:34,653 - experiment_functions - INFO - Early stopping at epoch 500. Best Metrics: (0.0004622409080173733, 6.865831602920491e-05, 0.0002046137727211629)
2026-06-07 04:21:35,164 - optuna.study.study - INFO - Trial 264 finished with values: [0.0004622409080173733, 6.865831602920491e-05, 0.0002046137727211629] and parameters: {'n_layers': 1, 'embedding_dim': 32, 'lr': 0.005424684195660662, 'lambda_val': 0.0007605677300524109, 'batch_size': 1666, 'optimizer': 'SGD'}.
2026-06-07 04:22:00,052 - experiment_functions - INFO - Early stopping at epoch 550. Best Metrics: (0.0035517825484143967, 0.0011621675932748344, 0.0024695438770015944)
2026-06-07 04:22:00,367 - optuna.study.study - INFO - Trial 265 finished with values: [0.0035517825484143967, 0.0011621675932748344, 0.0024695438770015944] and parameters: {'n_layers': 1, 'embedding_dim': 256, 'lr': 0.005424684195660662, 'lambda_val': 0.003413922431571512, 'batch_size': 4046, 'optimizer': 'RMSprop'}.
2026-06-07 04:22:27,768 - experiment_functions - INFO - Early stopping at epoch 550. Best Metrics: (0.0019273894918563923, 0.0005961551343023646, 0.001226982741918684)
2026-06-07 04:22:27,857 - optuna.study.study - INFO - Trial 266 finished with values: [0.0019273894918563923, 0.0005961551343023646, 0.001226982741918684] and parameters: {'n_layers': 3, 'embedding_dim': 256, 'lr': 0.005424684195660662, 'lambda_val': 0.003413922431571512, 'batch_size': 3414, 'optimizer': 'RMSprop'}.
2026-06-07 04:22:50,652 - experiment_functions - INFO - Early stopping at epoch 550. Best Metrics: (0.006273104251076079, 0.0018186080782369883, 0.00407341040122686)
2026-06-07 04:22:50,737 - optuna.study.study - INFO - Trial 267 finished with values: [0.006273104251076079, 0.0018186080782369883, 0.00407341040122686] and parameters: {'n_layers': 2, 'embedding_dim': 64, 'lr': 0.005424684195660662, 'lambda_val': 0.00029907993070612653, 'batch_size': 4046, 'optimizer': 'Adam'}.
2026-06-07 04:23:12,632 - experiment_functions - INFO - Early stopping at epoch 500. Best Metrics: (0.00042433329428297, 6.698372295532186e-05, 0.00018111566160794487)
2026-06-07 04:23:12,751 - optuna.study.study - INFO - Trial 268 finished with values: [0.00042433329428297, 6.698372295532186e-05, 0.00018111566160794487] and parameters: {'n_layers': 1, 'embedding_dim': 256, 'lr': 0.005424684195660662, 'lambda_val': 0.0005820050233493586, 'batch_size': 4046, 'optimizer': 'SGD'}.
2026-06-07 04:23:36,707 - experiment_functions - INFO - Early stopping at epoch 550. Best Metrics: (0.003816284471778578, 0.0010399222988813719, 0.002452646184525487)
2026-06-07 04:23:36,799 - optuna.study.study - INFO - Trial 269 finished with values: [0.003816284471778578, 0.0010399222988813719, 0.002452646184525487] and parameters: {'n_layers': 3, 'embedding_dim': 96, 'lr': 0.005424684195660662, 'lambda_val': 6.538231837458372e-06, 'batch_size': 4046, 'optimizer': 'Adam'}.
2026-06-07 04:23:58,909 - experiment_functions - INFO - Early stopping at epoch 500. Best Metrics: (0.00042433329428297, 6.698372295532186e-05, 0.00018111566160794487)
2026-06-07 04:23:58,993 - optuna.study.study - INFO - Trial 270 finished with values: [0.00042433329428297, 6.698372295532186e-05, 0.00018111566160794487] and parameters: {'n_layers': 1, 'embedding_dim': 256, 'lr': 0.003111912344058094, 'lambda_val': 3.5057330861811343e-06, 'batch_size': 4046, 'optimizer': 'SGD'}.
2026-06-07 04:24:38,610 - experiment_functions - INFO - Early stopping at epoch 900. Best Metrics: (0.008109537896701094, 0.0027597293857592603, 0.0059676040022568185)
2026-06-07 04:24:38,702 - optuna.study.study - INFO - Trial 271 finished with values: [0.008109537896701094, 0.0027597293857592603, 0.0059676040022568185] and parameters: {'n_layers': 1, 'embedding_dim': 256, 'lr': 0.000762190113410319, 'lambda_val': 0.003413922431571512, 'batch_size': 4046, 'optimizer': 'Adam'}.
2026-06-07 04:25:05,334 - experiment_functions - INFO - Early stopping at epoch 650. Best Metrics: (0.008388438311520053, 0.0027580547926853776, 0.006099000770281541)
2026-06-07 04:25:06,287 - optuna.study.study - INFO - Trial 272 finished with values: [0.008388438311520053, 0.0027580547926853776, 0.006099000770281541] and parameters: {'n_layers': 1, 'embedding_dim': 96, 'lr': 0.002761919687756251, 'lambda_val': 3.491863285065632e-06, 'batch_size': 4046, 'optimizer': 'Adam'}.
2026-06-07 04:25:28,832 - experiment_functions - INFO - Early stopping at epoch 550. Best Metrics: (0.007282398299867886, 0.0023611762341750955, 0.005130642994117707)
2026-06-07 04:25:28,909 - optuna.study.study - INFO - Trial 273 finished with values: [0.007282398299867886, 0.0023611762341750955, 0.005130642994117707] and parameters: {'n_layers': 1, 'embedding_dim': 64, 'lr': 0.005424684195660662, 'lambda_val': 0.003413922431571512, 'batch_size': 4046, 'optimizer': 'Adam'}.
2026-06-07 04:25:53,873 - experiment_functions - INFO - Early stopping at epoch 550. Best Metrics: (0.002937147871127957, 0.0007435193248040727, 0.001788730521633257)
2026-06-07 04:25:54,344 - optuna.study.study - INFO - Trial 274 finished with values: [0.002937147871127957, 0.0007435193248040727, 0.001788730521633257] and parameters: {'n_layers': 4, 'embedding_dim': 128, 'lr': 0.005424684195660662, 'lambda_val': 6.538231837458372e-06, 'batch_size': 4046, 'optimizer': 'Adam'}.
2026-06-07 04:26:14,342 - experiment_functions - INFO - Early stopping at epoch 500. Best Metrics: (0.0004622409080173733, 6.865831602920491e-05, 0.0002046137727211629)
2026-06-07 04:26:14,426 - optuna.study.study - INFO - Trial 275 finished with values: [0.0004622409080173733, 6.865831602920491e-05, 0.0002046137727211629] and parameters: {'n_layers': 1, 'embedding_dim': 32, 'lr': 0.005424684195660662, 'lambda_val': 3.222265315337744e-05, 'batch_size': 3302, 'optimizer': 'SGD'}.
2026-06-07 04:27:23,950 - experiment_functions - INFO - Early stopping at epoch 1650. Best Metrics: (0.00831913056491657, 0.0028869984593743723, 0.006121645210047845)
2026-06-07 04:27:24,035 - optuna.study.study - INFO - Trial 276 finished with values: [0.00831913056491657, 0.0028869984593743723, 0.006121645210047845] and parameters: {'n_layers': 1, 'embedding_dim': 256, 'lr': 0.000762190113410319, 'lambda_val': 0.003413922431571512, 'batch_size': 524, 'optimizer': 'Adam'}.
2026-06-07 04:27:49,217 - experiment_functions - INFO - Early stopping at epoch 550. Best Metrics: (0.009235055458432125, 0.003178377654230022, 0.006924457424239491)
2026-06-07 04:27:49,288 - optuna.study.study - INFO - Trial 277 finished with values: [0.009235055458432125, 0.003178377654230022, 0.006924457424239491] and parameters: {'n_layers': 1, 'embedding_dim': 256, 'lr': 0.005424684195660662, 'lambda_val': 0.003413922431571512, 'batch_size': 4046, 'optimizer': 'Adam'}.
2026-06-07 04:28:11,277 - experiment_functions - INFO - Early stopping at epoch 550. Best Metrics: (0.0035999256552489063, 0.0010750887534329158, 0.0024635387557776518)
2026-06-07 04:28:11,593 - optuna.study.study - INFO - Trial 278 finished with values: [0.0035999256552489063, 0.0010750887534329158, 0.0024635387557776518] and parameters: {'n_layers': 1, 'embedding_dim': 32, 'lr': 0.0293042526955544, 'lambda_val': 0.003413922431571512, 'batch_size': 4046, 'optimizer': 'Adam'}.
2026-06-07 04:29:29,977 - experiment_functions - INFO - Early stopping at epoch 1850. Best Metrics: (0.009668416881935402, 0.0032135441087815663, 0.0074272372820995336)
2026-06-07 04:29:30,064 - optuna.study.study - INFO - Trial 279 finished with values: [0.009668416881935402, 0.0032135441087815663, 0.0074272372820995336] and parameters: {'n_layers': 1, 'embedding_dim': 256, 'lr': 0.000762190113410319, 'lambda_val': 3.222265315337744e-05, 'batch_size': 1861, 'optimizer': 'Adam'}.
2026-06-07 04:30:11,635 - experiment_functions - INFO - Early stopping at epoch 1100. Best Metrics: (0.009438128569168328, 0.002813316364123518, 0.006794685855389842)
2026-06-07 04:30:11,714 - optuna.study.study - INFO - Trial 280 finished with values: [0.009438128569168328, 0.002813316364123518, 0.006794685855389842] and parameters: {'n_layers': 1, 'embedding_dim': 32, 'lr': 0.0017152190282418974, 'lambda_val': 1.058365552996417e-06, 'batch_size': 1114, 'optimizer': 'Adam'}.
2026-06-07 04:30:33,922 - experiment_functions - INFO - Early stopping at epoch 550. Best Metrics: (0.001677824756779692, 0.0004035769308058142, 0.0009399255377274283)
2026-06-07 04:30:34,009 - optuna.study.study - INFO - Trial 281 finished with values: [0.001677824756779692, 0.0004035769308058142, 0.0009399255377274283] and parameters: {'n_layers': 4, 'embedding_dim': 32, 'lr': 0.015511085093343051, 'lambda_val': 0.00426234068174577, 'batch_size': 4046, 'optimizer': 'Adam'}.
2026-06-07 04:31:05,632 - experiment_functions - INFO - Early stopping at epoch 800. Best Metrics: (0.008351239561174574, 0.002593944671444839, 0.005913384652944919)
2026-06-07 04:31:05,729 - optuna.study.study - INFO - Trial 282 finished with values: [0.008351239561174574, 0.002593944671444839, 0.005913384652944919] and parameters: {'n_layers': 1, 'embedding_dim': 64, 'lr': 0.001854982680164212, 'lambda_val': 0.0004137142097972384, 'batch_size': 3702, 'optimizer': 'Adam'}.
2026-06-07 04:31:42,961 - experiment_functions - INFO - Early stopping at epoch 850. Best Metrics: (0.007658199552401125, 0.0026860472905084064, 0.005617045362257647)
2026-06-07 04:31:43,050 - optuna.study.study - INFO - Trial 283 finished with values: [0.007658199552401125, 0.0026860472905084064, 0.005617045362257647] and parameters: {'n_layers': 1, 'embedding_dim': 256, 'lr': 0.000762190113410319, 'lambda_val': 0.003413922431571512, 'batch_size': 4046, 'optimizer': 'Adam'}.
2026-06-07 04:32:22,563 - experiment_functions - INFO - Early stopping at epoch 950. Best Metrics: (0.007541589110392654, 0.00255040525152388, 0.005474076579087528)
2026-06-07 04:32:22,647 - optuna.study.study - INFO - Trial 284 finished with values: [0.007541589110392654, 0.00255040525152388, 0.005474076579087528] and parameters: {'n_layers': 1, 'embedding_dim': 128, 'lr': 0.000762190113410319, 'lambda_val': 0.003413922431571512, 'batch_size': 3628, 'optimizer': 'Adam'}.
2026-06-07 04:32:47,469 - experiment_functions - INFO - Early stopping at epoch 550. Best Metrics: (0.008515959597396126, 0.003064505325205975, 0.006316665098337939)
2026-06-07 04:32:47,675 - optuna.study.study - INFO - Trial 285 finished with values: [0.008515959597396126, 0.003064505325205975, 0.006316665098337939] and parameters: {'n_layers': 1, 'embedding_dim': 256, 'lr': 0.005424684195660662, 'lambda_val': 0.005664799898024634, 'batch_size': 2883, 'optimizer': 'Adam'}.
2026-06-07 04:33:12,895 - experiment_functions - INFO - Early stopping at epoch 550. Best Metrics: (0.009360360553880922, 0.0030360372429499636, 0.006982453138136816)
2026-06-07 04:33:13,035 - optuna.study.study - INFO - Trial 286 finished with values: [0.009360360553880922, 0.0030360372429499636, 0.006982453138136816] and parameters: {'n_layers': 1, 'embedding_dim': 256, 'lr': 0.005424684195660662, 'lambda_val': 6.538231837458372e-06, 'batch_size': 4046, 'optimizer': 'Adam'}.
2026-06-07 04:33:38,085 - experiment_functions - INFO - Early stopping at epoch 550. Best Metrics: (0.009710084154953152, 0.0030846004420925716, 0.007233054369131513)
2026-06-07 04:33:38,173 - optuna.study.study - INFO - Trial 287 finished with values: [0.009710084154953152, 0.0030846004420925716, 0.007233054369131513] and parameters: {'n_layers': 1, 'embedding_dim': 256, 'lr': 0.005424684195660662, 'lambda_val': 3.491863285065632e-06, 'batch_size': 4046, 'optimizer': 'Adam'}.
2026-06-07 04:34:24,163 - experiment_functions - INFO - Early stopping at epoch 1200. Best Metrics: (0.007351664799906741, 0.0023728983856922767, 0.005100187661997799)
2026-06-07 04:34:24,254 - optuna.study.study - INFO - Trial 288 finished with values: [0.007351664799906741, 0.0023728983856922767, 0.005100187661997799] and parameters: {'n_layers': 1, 'embedding_dim': 64, 'lr': 0.000762190113410319, 'lambda_val': 0.003413922431571512, 'batch_size': 4046, 'optimizer': 'Adam'}.
2026-06-07 04:34:48,955 - experiment_functions - INFO - Early stopping at epoch 550. Best Metrics: (0.006527469692102382, 0.00218199477526961, 0.004534107589572513)
2026-06-07 04:34:49,038 - optuna.study.study - INFO - Trial 289 finished with values: [0.006527469692102382, 0.00218199477526961, 0.004534107589572513] and parameters: {'n_layers': 1, 'embedding_dim': 256, 'lr': 0.010069653798492298, 'lambda_val': 0.003413922431571512, 'batch_size': 1206, 'optimizer': 'Adam'}.
2026-06-07 04:35:12,804 - experiment_functions - INFO - Early stopping at epoch 600. Best Metrics: (0.00499861575723296, 0.001473641905017081, 0.003408022482257815)
2026-06-07 04:35:13,907 - optuna.study.study - INFO - Trial 290 finished with values: [0.00499861575723296, 0.001473641905017081, 0.003408022482257815] and parameters: {'n_layers': 2, 'embedding_dim': 32, 'lr': 0.0028344398259960786, 'lambda_val': 0.0007605677300524109, 'batch_size': 1861, 'optimizer': 'Adam'}.
2026-06-07 04:35:38,116 - experiment_functions - INFO - Early stopping at epoch 600. Best Metrics: (0.007715799759740148, 0.0024700247839774935, 0.005601726101200154)
2026-06-07 04:35:38,209 - optuna.study.study - INFO - Trial 291 finished with values: [0.007715799759740148, 0.0024700247839774935, 0.005601726101200154] and parameters: {'n_layers': 1, 'embedding_dim': 64, 'lr': 0.005424684195660662, 'lambda_val': 6.538231837458372e-06, 'batch_size': 4046, 'optimizer': 'Adam'}.
2026-06-07 04:36:03,335 - experiment_functions - INFO - Early stopping at epoch 600. Best Metrics: (0.009072805777623386, 0.002942260030812512, 0.006704472978005519)
2026-06-07 04:36:03,420 - optuna.study.study - INFO - Trial 292 finished with values: [0.009072805777623386, 0.002942260030812512, 0.006704472978005519] and parameters: {'n_layers': 1, 'embedding_dim': 128, 'lr': 0.005424684195660662, 'lambda_val': 6.538231837458372e-06, 'batch_size': 1662, 'optimizer': 'Adam'}.
2026-06-07 04:36:49,976 - experiment_functions - INFO - Early stopping at epoch 1200. Best Metrics: (0.007942616713380677, 0.002607341416035903, 0.005607811714931632)
2026-06-07 04:36:50,116 - optuna.study.study - INFO - Trial 293 finished with values: [0.007942616713380677, 0.002607341416035903, 0.005607811714931632] and parameters: {'n_layers': 1, 'embedding_dim': 96, 'lr': 0.000762190113410319, 'lambda_val': 0.003413922431571512, 'batch_size': 1602, 'optimizer': 'Adam'}.
2026-06-07 04:37:20,994 - experiment_functions - INFO - Early stopping at epoch 750. Best Metrics: (0.008972312425353526, 0.0029707281130685243, 0.006633511961220612)
2026-06-07 04:37:21,188 - optuna.study.study - INFO - Trial 294 finished with values: [0.008972312425353526, 0.0029707281130685243, 0.006633511961220612] and parameters: {'n_layers': 1, 'embedding_dim': 128, 'lr': 0.001854982680164212, 'lambda_val': 2.592531345957409e-05, 'batch_size': 3302, 'optimizer': 'Adam'}.
2026-06-07 04:37:46,180 - experiment_functions - INFO - Early stopping at epoch 550. Best Metrics: (0.009055253311242711, 0.0030444102083193782, 0.006926834841399181)
2026-06-07 04:37:46,269 - optuna.study.study - INFO - Trial 295 finished with values: [0.009055253311242711, 0.0030444102083193782, 0.006926834841399181] and parameters: {'n_layers': 1, 'embedding_dim': 256, 'lr': 0.005424684195660662, 'lambda_val': 2.708281900215428e-05, 'batch_size': 4046, 'optimizer': 'Adam'}.
2026-06-07 04:38:31,924 - experiment_functions - INFO - Early stopping at epoch 1050. Best Metrics: (0.008248817589269772, 0.00276475316498091, 0.0060713626285359736)
2026-06-07 04:38:33,060 - optuna.study.study - INFO - Trial 296 finished with values: [0.008248817589269772, 0.00276475316498091, 0.0060713626285359736] and parameters: {'n_layers': 1, 'embedding_dim': 256, 'lr': 0.000762190113410319, 'lambda_val': 0.003413922431571512, 'batch_size': 2074, 'optimizer': 'Adam'}.
2026-06-07 04:39:02,193 - experiment_functions - INFO - Early stopping at epoch 650. Best Metrics: (0.008966748358365978, 0.002997521602250653, 0.006859850883678393)
2026-06-07 04:39:02,282 - optuna.study.study - INFO - Trial 297 finished with values: [0.008966748358365978, 0.002997521602250653, 0.006859850883678393] and parameters: {'n_layers': 1, 'embedding_dim': 256, 'lr': 0.003231299459011048, 'lambda_val': 6.538231837458372e-06, 'batch_size': 2179, 'optimizer': 'Adam'}.
2026-06-07 04:39:27,001 - experiment_functions - INFO - Early stopping at epoch 600. Best Metrics: (0.006651459095085885, 0.001875544242749012, 0.004334084664326623)
2026-06-07 04:39:27,142 - optuna.study.study - INFO - Trial 298 finished with values: [0.006651459095085885, 0.001875544242749012, 0.004334084664326623] and parameters: {'n_layers': 1, 'embedding_dim': 64, 'lr': 0.007758894460897062, 'lambda_val': 0.0007605677300524109, 'batch_size': 520, 'optimizer': 'Adam'}.
2026-06-07 04:39:54,329 - experiment_functions - INFO - Early stopping at epoch 650. Best Metrics: (0.008482507276560384, 0.0028501574117489447, 0.006219871991916498)
2026-06-07 04:39:54,402 - optuna.study.study - INFO - Trial 299 finished with values: [0.008482507276560384, 0.0028501574117489447, 0.006219871991916498] and parameters: {'n_layers': 1, 'embedding_dim': 128, 'lr': 0.0020485036238635386, 'lambda_val': 6.538231837458372e-06, 'batch_size': 4046, 'optimizer': 'Adam'}.
2026-06-07 04:39:54,417 - root - INFO - Selected Trial 279 based on Max ndcg: 0.0074
2026-06-07 04:39:54,417 - root - INFO - Associated Recall: 0.0097
2026-06-07 04:39:54,418 - experiment_functions - INFO - Training the best model ... for e_gowalla_1c2dcs_strict
2026-06-07 04:41:26,564 - experiment_functions - INFO - Early stopping at epoch 2200. Best Metrics: (0.009808203771844626, 0.003242012191037578, 0.007103382705608549)
2026-06-07 04:41:29,861 - root - INFO -   **** Training e_gowalla_1c2dcs_strict_rand1
2026-06-07 04:41:29,898 - root - INFO -   **** Getting 93839/845292 random edges
2026-06-07 04:41:30,019 - optuna.storages._rdb.storage - INFO - A new study created in RDB with name: Study_e_gowalla_1c2dcs_strict_rand1
2026-06-07 04:43:13,119 - experiment_functions - INFO - Early stopping at epoch 2850. Best Metrics: (0.0006862686351396682, 9.210261906356756e-05, 0.00030826175743299306)
