2026-06-07 04:43:13,191 - optuna.study.study - INFO - Trial 0 finished with values: [0.0006862686351396682, 9.210261906356756e-05, 0.00030826175743299306] and parameters: {'n_layers': 2, 'embedding_dim': 32, 'lr': 7.387289319650828e-05, 'lambda_val': 1.0644711274350343e-05, 'batch_size': 2048, 'optimizer': 'Adam'}.
2026-06-07 04:43:34,814 - experiment_functions - INFO - Early stopping at epoch 500. Best Metrics: (0.0007178611370404278, 9.712639828521669e-05, 0.0003335399618204426)
2026-06-07 04:43:34,905 - optuna.study.study - INFO - Trial 1 finished with values: [0.0007178611370404278, 9.712639828521669e-05, 0.0003335399618204426] and parameters: {'n_layers': 2, 'embedding_dim': 128, 'lr': 0.0001562882837296512, 'lambda_val': 0.07104015181085824, 'batch_size': 947, 'optimizer': 'SGD'}.
2026-06-07 04:43:57,399 - experiment_functions - INFO - Early stopping at epoch 500. Best Metrics: (0.0003793739701639778, 6.865831602920491e-05, 0.0001674218973289111)
2026-06-07 04:43:57,487 - optuna.study.study - INFO - Trial 2 finished with values: [0.0003793739701639778, 6.865831602920491e-05, 0.0001674218973289111] and parameters: {'n_layers': 4, 'embedding_dim': 96, 'lr': 0.08156895544237801, 'lambda_val': 1.2963543011845413e-06, 'batch_size': 892, 'optimizer': 'SGD'}.
2026-06-07 04:45:09,595 - experiment_functions - INFO - Early stopping at epoch 1850. Best Metrics: (0.02473059810569714, 0.004002277446580481, 0.013866806781526115)
2026-06-07 04:45:09,685 - optuna.study.study - INFO - Trial 3 finished with values: [0.02473059810569714, 0.004002277446580481, 0.013866806781526115] and parameters: {'n_layers': 2, 'embedding_dim': 64, 'lr': 0.0013734258944280648, 'lambda_val': 0.00010082268820599092, 'batch_size': 2050, 'optimizer': 'RMSprop'}.
2026-06-07 04:46:36,787 - experiment_functions - INFO - Early stopping at epoch 2350. Best Metrics: (0.011255055584053946, 0.0021334315761270014, 0.006231780970015473)
2026-06-07 04:46:37,543 - optuna.study.study - INFO - Trial 4 finished with values: [0.011255055584053946, 0.0021334315761270014, 0.006231780970015473] and parameters: {'n_layers': 2, 'embedding_dim': 32, 'lr': 0.0009791612272847586, 'lambda_val': 0.02500021456838615, 'batch_size': 621, 'optimizer': 'RMSprop'}.
2026-06-07 04:47:02,272 - experiment_functions - INFO - Early stopping at epoch 500. Best Metrics: (0.0004608285708828277, 6.530912988143882e-05, 0.00019523737695175325)
2026-06-07 04:47:02,386 - optuna.study.study - INFO - Trial 5 finished with values: [0.0004608285708828277, 6.530912988143882e-05, 0.00019523737695175325] and parameters: {'n_layers': 2, 'embedding_dim': 256, 'lr': 4.614198742907089e-05, 'lambda_val': 0.02222089887931214, 'batch_size': 2094, 'optimizer': 'Adam'}.
2026-06-07 04:50:01,472 - experiment_functions - INFO - Early stopping at epoch 3650. Best Metrics: (0.018667995669515696, 0.002952307589255811, 0.010297148867444903)
2026-06-07 04:50:01,786 - optuna.study.study - INFO - Trial 6 finished with values: [0.018667995669515696, 0.002952307589255811, 0.010297148867444903] and parameters: {'n_layers': 3, 'embedding_dim': 256, 'lr': 0.0004340370842280224, 'lambda_val': 0.0059525210668399465, 'batch_size': 1703, 'optimizer': 'Adam'}.
2026-06-07 04:50:26,950 - experiment_functions - INFO - Early stopping at epoch 600. Best Metrics: (0.017018604243028066, 0.0026676267666956932, 0.009028959448921913)
2026-06-07 04:50:27,038 - optuna.study.study - INFO - Trial 7 finished with values: [0.017018604243028066, 0.0026676267666956932, 0.009028959448921913] and parameters: {'n_layers': 3, 'embedding_dim': 64, 'lr': 0.004996275630099498, 'lambda_val': 1.8902402933529376e-05, 'batch_size': 2881, 'optimizer': 'RMSprop'}.
2026-06-07 04:50:56,527 - experiment_functions - INFO - Early stopping at epoch 750. Best Metrics: (0.00042454838576916993, 7.870587447250318e-05, 0.00021370744283103754)
2026-06-07 04:50:56,619 - optuna.study.study - INFO - Trial 8 finished with values: [0.00042454838576916993, 7.870587447250318e-05, 0.00021370744283103754] and parameters: {'n_layers': 4, 'embedding_dim': 32, 'lr': 2.91531770495813e-05, 'lambda_val': 0.0003492217775437347, 'batch_size': 534, 'optimizer': 'RMSprop'}.
2026-06-07 04:51:20,846 - experiment_functions - INFO - Early stopping at epoch 550. Best Metrics: (0.007378076097563585, 0.0010382477058074888, 0.004042950415129055)
2026-06-07 04:51:21,235 - optuna.study.study - INFO - Trial 9 finished with values: [0.007378076097563585, 0.0010382477058074888, 0.004042950415129055] and parameters: {'n_layers': 2, 'embedding_dim': 128, 'lr': 0.08582619866792192, 'lambda_val': 2.0164491599431e-05, 'batch_size': 2891, 'optimizer': 'Adam'}.
2026-06-07 04:52:34,519 - experiment_functions - INFO - Early stopping at epoch 1900. Best Metrics: (0.0004926798313919129, 7.2007502176971e-05, 0.0002527300487187904)
2026-06-07 04:52:34,603 - optuna.study.study - INFO - Trial 10 finished with values: [0.0004926798313919129, 7.2007502176971e-05, 0.0002527300487187904] and parameters: {'n_layers': 3, 'embedding_dim': 64, 'lr': 1.9977675822379625e-05, 'lambda_val': 0.00018548540229447686, 'batch_size': 3227, 'optimizer': 'RMSprop'}.
2026-06-07 04:52:59,282 - experiment_functions - INFO - Early stopping at epoch 500. Best Metrics: (0.0038397550935078927, 0.0006916069395136983, 0.002075341756558956)
2026-06-07 04:52:59,597 - optuna.study.study - INFO - Trial 11 finished with values: [0.0038397550935078927, 0.0006916069395136983, 0.002075341756558956] and parameters: {'n_layers': 2, 'embedding_dim': 256, 'lr': 0.09496291242022484, 'lambda_val': 0.005434072620439486, 'batch_size': 758, 'optimizer': 'RMSprop'}.
2026-06-07 04:53:41,839 - experiment_functions - INFO - Early stopping at epoch 1150. Best Metrics: (0.0005918244581609125, 9.545180521133364e-05, 0.000285595306659969)
2026-06-07 04:53:41,926 - optuna.study.study - INFO - Trial 12 finished with values: [0.0005918244581609125, 9.545180521133364e-05, 0.000285595306659969] and parameters: {'n_layers': 1, 'embedding_dim': 32, 'lr': 3.717461658488425e-05, 'lambda_val': 6.740025958237136e-05, 'batch_size': 2094, 'optimizer': 'RMSprop'}.
2026-06-07 04:54:10,970 - experiment_functions - INFO - Early stopping at epoch 550. Best Metrics: (0.011528477818679897, 0.0016829660392524617, 0.006001717580157351)
2026-06-07 04:54:11,203 - optuna.study.study - INFO - Trial 13 finished with values: [0.011528477818679897, 0.0016829660392524617, 0.006001717580157351] and parameters: {'n_layers': 3, 'embedding_dim': 256, 'lr': 0.02223911438745917, 'lambda_val': 6.160400429327822e-06, 'batch_size': 3899, 'optimizer': 'RMSprop'}.
2026-06-07 04:54:32,603 - experiment_functions - INFO - Early stopping at epoch 500. Best Metrics: (0.0006240909712237834, 8.540424676803537e-05, 0.00030976920602288787)
2026-06-07 04:54:32,680 - optuna.study.study - INFO - Trial 14 finished with values: [0.0006240909712237834, 8.540424676803537e-05, 0.00030976920602288787] and parameters: {'n_layers': 4, 'embedding_dim': 64, 'lr': 3.966301487977207e-05, 'lambda_val': 0.00018768173634322157, 'batch_size': 1562, 'optimizer': 'SGD'}.
2026-06-07 04:54:56,668 - experiment_functions - INFO - Early stopping at epoch 500. Best Metrics: (0.0006431272743623523, 9.37772121374506e-05, 0.00029817485292302724)
2026-06-07 04:54:56,760 - optuna.study.study - INFO - Trial 15 finished with values: [0.0006431272743623523, 9.37772121374506e-05, 0.00029817485292302724] and parameters: {'n_layers': 2, 'embedding_dim': 256, 'lr': 0.00016152274544467036, 'lambda_val': 0.00033030472635527157, 'batch_size': 1627, 'optimizer': 'SGD'}.
2026-06-07 04:55:20,791 - experiment_functions - INFO - Early stopping at epoch 500. Best Metrics: (0.0004964326365552486, 7.53566883247371e-05, 0.00023675938676108866)
2026-06-07 04:55:20,951 - optuna.study.study - INFO - Trial 16 finished with values: [0.0004964326365552486, 7.53566883247371e-05, 0.00023675938676108866] and parameters: {'n_layers': 2, 'embedding_dim': 256, 'lr': 0.0013791907313438674, 'lambda_val': 4.340932710405587e-06, 'batch_size': 2605, 'optimizer': 'SGD'}.
2026-06-07 04:56:15,374 - experiment_functions - INFO - Early stopping at epoch 1400. Best Metrics: (0.015223792116607975, 0.0023829459441355753, 0.0086293693938683)
2026-06-07 04:56:15,623 - optuna.study.study - INFO - Trial 17 finished with values: [0.015223792116607975, 0.0023829459441355753, 0.0086293693938683] and parameters: {'n_layers': 1, 'embedding_dim': 96, 'lr': 0.002168096883511623, 'lambda_val': 5.604086483439305e-05, 'batch_size': 2975, 'optimizer': 'RMSprop'}.
2026-06-07 04:58:30,322 - experiment_functions - INFO - Early stopping at epoch 3550. Best Metrics: (0.0006170277277685678, 6.86583160292049e-05, 0.0002488646766189418)
2026-06-07 04:58:30,531 - optuna.study.study - INFO - Trial 18 finished with values: [0.0006170277277685678, 6.86583160292049e-05, 0.0002488646766189418] and parameters: {'n_layers': 1, 'embedding_dim': 128, 'lr': 2.3680651308294915e-05, 'lambda_val': 1.837345949695229e-06, 'batch_size': 3290, 'optimizer': 'RMSprop'}.
2026-06-07 04:59:04,931 - experiment_functions - INFO - Early stopping at epoch 800. Best Metrics: (0.023347410503869917, 0.003459709290642374, 0.012265804185832549)
2026-06-07 04:59:05,397 - optuna.study.study - INFO - Trial 19 finished with values: [0.023347410503869917, 0.003459709290642374, 0.012265804185832549] and parameters: {'n_layers': 3, 'embedding_dim': 96, 'lr': 0.003577419943834574, 'lambda_val': 5.656965316395304e-06, 'batch_size': 1182, 'optimizer': 'RMSprop'}.
2026-06-07 04:59:29,448 - experiment_functions - INFO - Early stopping at epoch 550. Best Metrics: (0.007713972078907864, 0.0010918346841717462, 0.004146256593842565)
2026-06-07 04:59:29,538 - optuna.study.study - INFO - Trial 20 finished with values: [0.007713972078907864, 0.0010918346841717462, 0.004146256593842565] and parameters: {'n_layers': 2, 'embedding_dim': 128, 'lr': 0.08900268421806791, 'lambda_val': 2.029005253393236e-05, 'batch_size': 1871, 'optimizer': 'Adam'}.
2026-06-07 05:01:35,318 - experiment_functions - INFO - Early stopping at epoch 3350. Best Metrics: (0.008975103419824654, 0.0012592939915600512, 0.004323734033938803)
2026-06-07 05:01:35,861 - optuna.study.study - INFO - Trial 21 finished with values: [0.008975103419824654, 0.0012592939915600512, 0.004323734033938803] and parameters: {'n_layers': 4, 'embedding_dim': 32, 'lr': 0.09061033244267265, 'lambda_val': 0.01640628387641808, 'batch_size': 2740, 'optimizer': 'Adam'}.
2026-06-07 05:05:04,349 - optuna.study.study - INFO - Trial 22 finished with values: [0.004001891440764417, 0.000760265255542903, 0.0023563056695121787] and parameters: {'n_layers': 4, 'embedding_dim': 256, 'lr': 0.00010801192601135046, 'lambda_val': 4.770619072822752e-05, 'batch_size': 3484, 'optimizer': 'Adam'}.
2026-06-07 05:05:24,980 - experiment_functions - INFO - Early stopping at epoch 500. Best Metrics: (0.0006138114193219836, 9.210261906356757e-05, 0.00024112644600382408)
2026-06-07 05:05:25,527 - optuna.study.study - INFO - Trial 23 finished with values: [0.0006138114193219836, 9.210261906356757e-05, 0.00024112644600382408] and parameters: {'n_layers': 2, 'embedding_dim': 64, 'lr': 0.0155577958178534, 'lambda_val': 0.0004581096063213806, 'batch_size': 3953, 'optimizer': 'SGD'}.
2026-06-07 05:05:51,522 - experiment_functions - INFO - Early stopping at epoch 500. Best Metrics: (0.0004776843260579513, 8.372965369415233e-05, 0.00023219911225069582)
2026-06-07 05:05:51,928 - optuna.study.study - INFO - Trial 24 finished with values: [0.0004776843260579513, 8.372965369415233e-05, 0.00023219911225069582] and parameters: {'n_layers': 3, 'embedding_dim': 256, 'lr': 0.0002630126249512911, 'lambda_val': 0.0015185052562471204, 'batch_size': 3729, 'optimizer': 'SGD'}.
2026-06-07 05:06:15,931 - experiment_functions - INFO - Early stopping at epoch 550. Best Metrics: (0.011411698276885667, 0.0017934891821287425, 0.005837053894395058)
2026-06-07 05:06:16,036 - optuna.study.study - INFO - Trial 25 finished with values: [0.011411698276885667, 0.0017934891821287425, 0.005837053894395058] and parameters: {'n_layers': 3, 'embedding_dim': 96, 'lr': 0.005992064501875298, 'lambda_val': 0.0037819648784626577, 'batch_size': 975, 'optimizer': 'RMSprop'}.
2026-06-07 05:06:47,396 - experiment_functions - INFO - Early stopping at epoch 750. Best Metrics: (0.0006619845318730828, 8.205506062026927e-05, 0.0002898315899887715)
2026-06-07 05:06:47,507 - optuna.study.study - INFO - Trial 26 finished with values: [0.0006619845318730828, 8.205506062026927e-05, 0.0002898315899887715] and parameters: {'n_layers': 3, 'embedding_dim': 96, 'lr': 0.015349366472401656, 'lambda_val': 9.340408716632992e-06, 'batch_size': 628, 'optimizer': 'SGD'}.
2026-06-07 05:07:18,829 - experiment_functions - INFO - Early stopping at epoch 800. Best Metrics: (0.018812004717699973, 0.002942260030812512, 0.010266458432475362)
2026-06-07 05:07:18,905 - optuna.study.study - INFO - Trial 27 finished with values: [0.018812004717699973, 0.002942260030812512, 0.010266458432475362] and parameters: {'n_layers': 2, 'embedding_dim': 32, 'lr': 0.002620274475670763, 'lambda_val': 0.0002115220011623213, 'batch_size': 2687, 'optimizer': 'RMSprop'}.
2026-06-07 05:09:00,149 - experiment_functions - INFO - Early stopping at epoch 2450. Best Metrics: (0.0003609274968977568, 7.033290910308795e-05, 0.00015355916249045016)
2026-06-07 05:09:00,482 - optuna.study.study - INFO - Trial 28 finished with values: [0.0003609274968977568, 7.033290910308795e-05, 0.00015355916249045016] and parameters: {'n_layers': 4, 'embedding_dim': 96, 'lr': 1.4149126700954324e-05, 'lambda_val': 4.459473312348052e-05, 'batch_size': 2298, 'optimizer': 'Adam'}.
2026-06-07 05:10:23,613 - experiment_functions - INFO - Early stopping at epoch 2150. Best Metrics: (0.0004827423257297418, 6.195994373367273e-05, 0.00023684437143748602)
2026-06-07 05:10:23,737 - optuna.study.study - INFO - Trial 29 finished with values: [0.0004827423257297418, 6.195994373367273e-05, 0.00023684437143748602] and parameters: {'n_layers': 2, 'embedding_dim': 96, 'lr': 4.840116884668675e-05, 'lambda_val': 3.961915381313715e-05, 'batch_size': 1987, 'optimizer': 'RMSprop'}.
2026-06-07 05:10:59,559 - experiment_functions - INFO - Early stopping at epoch 900. Best Metrics: (0.018711837152764872, 0.0026960948489517054, 0.009396444258122453)
2026-06-07 05:10:59,639 - optuna.study.study - INFO - Trial 30 finished with values: [0.018711837152764872, 0.0026960948489517054, 0.009396444258122453] and parameters: {'n_layers': 4, 'embedding_dim': 32, 'lr': 0.006175201562705211, 'lambda_val': 1.0308897870221961e-06, 'batch_size': 877, 'optimizer': 'RMSprop'}.
2026-06-07 05:14:27,839 - optuna.study.study - INFO - Trial 31 finished with values: [0.001309989506624206, 0.00023444303034362652, 0.0006929412777423692] and parameters: {'n_layers': 4, 'embedding_dim': 256, 'lr': 8.374887345125696e-05, 'lambda_val': 0.0006579114242834636, 'batch_size': 2877, 'optimizer': 'Adam'}.
2026-06-07 05:14:50,277 - experiment_functions - INFO - Early stopping at epoch 500. Best Metrics: (0.00045344364070085743, 7.2007502176971e-05, 0.0002050819013091391)
2026-06-07 05:14:50,360 - optuna.study.study - INFO - Trial 32 finished with values: [0.00045344364070085743, 7.2007502176971e-05, 0.0002050819013091391] and parameters: {'n_layers': 1, 'embedding_dim': 256, 'lr': 2.4394880882338393e-05, 'lambda_val': 0.0007536366410551063, 'batch_size': 3786, 'optimizer': 'SGD'}.
2026-06-07 05:15:12,428 - experiment_functions - INFO - Early stopping at epoch 500. Best Metrics: (0.00048476863692776287, 7.368209525085404e-05, 0.0002548074678132981)
2026-06-07 05:15:12,549 - optuna.study.study - INFO - Trial 33 finished with values: [0.00048476863692776287, 7.368209525085404e-05, 0.0002548074678132981] and parameters: {'n_layers': 1, 'embedding_dim': 128, 'lr': 0.0038611334200534756, 'lambda_val': 2.0331657272952335e-05, 'batch_size': 1312, 'optimizer': 'SGD'}.
2026-06-07 05:15:32,544 - experiment_functions - INFO - Early stopping at epoch 500. Best Metrics: (0.0003454691565340591, 6.195994373367272e-05, 0.00019236829186580317)
2026-06-07 05:15:33,108 - optuna.study.study - INFO - Trial 34 finished with values: [0.0003454691565340591, 6.195994373367272e-05, 0.00019236829186580317] and parameters: {'n_layers': 2, 'embedding_dim': 32, 'lr': 0.00011467697518617014, 'lambda_val': 0.0028600820147763138, 'batch_size': 4084, 'optimizer': 'SGD'}.
2026-06-07 05:15:57,355 - experiment_functions - INFO - Early stopping at epoch 550. Best Metrics: (0.015443482479416269, 0.0023494540826579143, 0.008154695332360698)
2026-06-07 05:15:57,432 - optuna.study.study - INFO - Trial 35 finished with values: [0.015443482479416269, 0.0023494540826579143, 0.008154695332360698] and parameters: {'n_layers': 3, 'embedding_dim': 96, 'lr': 0.023750676895038965, 'lambda_val': 5.775403096605942e-06, 'batch_size': 3503, 'optimizer': 'Adam'}.
2026-06-07 05:16:18,380 - experiment_functions - INFO - Early stopping at epoch 500. Best Metrics: (0.0004000447092542622, 7.870587447250318e-05, 0.0002095975258383614)
2026-06-07 05:16:18,499 - optuna.study.study - INFO - Trial 36 finished with values: [0.0004000447092542622, 7.870587447250318e-05, 0.0002095975258383614] and parameters: {'n_layers': 3, 'embedding_dim': 64, 'lr': 0.0038428090490532554, 'lambda_val': 0.056945821420511966, 'batch_size': 3022, 'optimizer': 'SGD'}.
2026-06-07 05:16:44,531 - experiment_functions - INFO - Early stopping at epoch 600. Best Metrics: (0.007825103687297939, 0.001145421662536004, 0.004286528461838555)
2026-06-07 05:16:44,625 - optuna.study.study - INFO - Trial 37 finished with values: [0.007825103687297939, 0.001145421662536004, 0.004286528461838555] and parameters: {'n_layers': 2, 'embedding_dim': 128, 'lr': 0.0656762277075806, 'lambda_val': 2.3950847744868506e-06, 'batch_size': 616, 'optimizer': 'RMSprop'}.
2026-06-07 05:17:08,660 - experiment_functions - INFO - Early stopping at epoch 500. Best Metrics: (0.0006417667050733216, 8.372965369415234e-05, 0.0002663154867276108)
2026-06-07 05:17:08,753 - optuna.study.study - INFO - Trial 38 finished with values: [0.0006417667050733216, 8.372965369415234e-05, 0.0002663154867276108] and parameters: {'n_layers': 2, 'embedding_dim': 256, 'lr': 0.02530830425719346, 'lambda_val': 0.0012729110225202262, 'batch_size': 2746, 'optimizer': 'SGD'}.
2026-06-07 05:17:31,446 - experiment_functions - INFO - Early stopping at epoch 550. Best Metrics: (0.0063787844503088555, 0.0010298747404380736, 0.0034735464021268514)
2026-06-07 05:17:31,522 - optuna.study.study - INFO - Trial 39 finished with values: [0.0063787844503088555, 0.0010298747404380736, 0.0034735464021268514] and parameters: {'n_layers': 4, 'embedding_dim': 32, 'lr': 0.022536607156936374, 'lambda_val': 2.5313317558461653e-05, 'batch_size': 3822, 'optimizer': 'RMSprop'}.
2026-06-07 05:20:04,582 - optuna.study.study - INFO - Trial 40 finished with values: [0.01414640826405185, 0.0023946680956527565, 0.008295972547801046] and parameters: {'n_layers': 1, 'embedding_dim': 128, 'lr': 0.0010160627847963985, 'lambda_val': 0.0008628561498380414, 'batch_size': 572, 'optimizer': 'RMSprop'}.
2026-06-07 05:20:26,544 - experiment_functions - INFO - Early stopping at epoch 500. Best Metrics: (0.00041055653156558936, 7.53566883247371e-05, 0.00022275419357781318)
2026-06-07 05:20:26,616 - optuna.study.study - INFO - Trial 41 finished with values: [0.00041055653156558936, 7.53566883247371e-05, 0.00022275419357781318] and parameters: {'n_layers': 3, 'embedding_dim': 96, 'lr': 0.0005091134281676407, 'lambda_val': 4.1877159999673555e-06, 'batch_size': 1671, 'optimizer': 'SGD'}.
2026-06-07 05:20:47,050 - experiment_functions - INFO - Early stopping at epoch 500. Best Metrics: (0.00034635486686867417, 6.530912988143882e-05, 0.0001750933660273087)
2026-06-07 05:20:47,428 - optuna.study.study - INFO - Trial 42 finished with values: [0.00034635486686867417, 6.530912988143882e-05, 0.0001750933660273087] and parameters: {'n_layers': 4, 'embedding_dim': 32, 'lr': 4.854603356488231e-05, 'lambda_val': 0.09033316429437767, 'batch_size': 2452, 'optimizer': 'RMSprop'}.
2026-06-07 05:22:34,838 - experiment_functions - INFO - Early stopping at epoch 2700. Best Metrics: (0.0007572993352034388, 0.00010047558443298278, 0.0003170124868200787)
2026-06-07 05:22:35,911 - optuna.study.study - INFO - Trial 43 finished with values: [0.0007572993352034388, 0.00010047558443298278, 0.0003170124868200787] and parameters: {'n_layers': 2, 'embedding_dim': 128, 'lr': 4.5961760534188086e-05, 'lambda_val': 7.861589022264094e-05, 'batch_size': 4087, 'optimizer': 'RMSprop'}.
2026-06-07 05:25:01,241 - optuna.study.study - INFO - Trial 44 finished with values: [0.0007354475987839539, 0.00010717395672851496, 0.0003510731056115857] and parameters: {'n_layers': 1, 'embedding_dim': 64, 'lr': 0.00022098219173494524, 'lambda_val': 0.01247604248844867, 'batch_size': 1222, 'optimizer': 'Adam'}.
2026-06-07 05:25:21,366 - experiment_functions - INFO - Early stopping at epoch 500. Best Metrics: (0.0006099942696893755, 7.870587447250318e-05, 0.00023762314930747915)
2026-06-07 05:25:21,623 - optuna.study.study - INFO - Trial 45 finished with values: [0.0006099942696893755, 7.870587447250318e-05, 0.00023762314930747915] and parameters: {'n_layers': 1, 'embedding_dim': 64, 'lr': 2.250105470988928e-05, 'lambda_val': 0.03814463959770115, 'batch_size': 1315, 'optimizer': 'Adam'}.
2026-06-07 05:25:49,064 - experiment_functions - INFO - Early stopping at epoch 650. Best Metrics: (0.000514293326410677, 8.372965369415234e-05, 0.00025064382109037727)
2026-06-07 05:25:49,140 - optuna.study.study - INFO - Trial 46 finished with values: [0.000514293326410677, 8.372965369415234e-05, 0.00025064382109037727] and parameters: {'n_layers': 2, 'embedding_dim': 128, 'lr': 0.0759131217119495, 'lambda_val': 0.0023488579024072286, 'batch_size': 1568, 'optimizer': 'SGD'}.
