2026-06-05 06:09:21,599 - optuna.study.study - INFO - Trial 298 finished with values: [0.05975856118100255, 0.008081586174559582, 0.0318888689997015] and parameters: {'n_layers': 1, 'embedding_dim': 256, 'lr': 0.0007432804052483335, 'lambda_val': 0.0024741700262700477, 'batch_size': 2586, 'optimizer': 'Adam'}.
2026-06-05 06:09:44,177 - experiment_functions - INFO - Early stopping at epoch 550. Best Metrics: (0.04668549070854204, 0.006184272221850091, 0.02519894451602634)
2026-06-05 06:09:44,275 - optuna.study.study - INFO - Trial 299 finished with values: [0.04668549070854204, 0.006184272221850091, 0.02519894451602634] and parameters: {'n_layers': 1, 'embedding_dim': 32, 'lr': 0.010850387474674802, 'lambda_val': 0.0024741700262700477, 'batch_size': 2331, 'optimizer': 'Adam'}.
2026-06-05 06:09:44,289 - root - INFO - Selected Trial 280 based on Max ndcg: 0.0434
2026-06-05 06:09:44,289 - root - INFO - Associated Recall: 0.0781
2026-06-05 06:09:44,289 - experiment_functions - INFO - Training the best model ... for e_gowalla_1c1dcs
2026-06-05 06:12:28,026 - root - INFO -   **** Training e_gowalla_1c1dcs_rand1
2026-06-05 06:12:28,138 - root - INFO -   **** Getting 368544/845292 random edges
2026-06-05 06:12:29,160 - optuna.storages._rdb.storage - INFO - A new study created in RDB with name: Study_e_gowalla_1c1dcs_rand1
2026-06-05 06:13:05,574 - experiment_functions - INFO - Early stopping at epoch 600. Best Metrics: (0.01297915203122543, 0.001547324000267935, 0.005823427727571497)
2026-06-05 06:13:05,761 - optuna.study.study - INFO - Trial 0 finished with values: [0.01297915203122543, 0.001547324000267935, 0.005823427727571497] and parameters: {'n_layers': 4, 'embedding_dim': 256, 'lr': 0.0023440150084551373, 'lambda_val': 0.018222291262846232, 'batch_size': 3529, 'optimizer': 'RMSprop'}.
2026-06-05 06:14:15,861 - experiment_functions - INFO - Early stopping at epoch 1200. Best Metrics: (0.0005360188681412351, 6.698372295532186e-05, 0.00021575471799350194)
2026-06-05 06:14:15,961 - optuna.study.study - INFO - Trial 1 finished with values: [0.0005360188681412351, 6.698372295532186e-05, 0.00021575471799350194] and parameters: {'n_layers': 4, 'embedding_dim': 256, 'lr': 1.1517244102309136e-05, 'lambda_val': 4.401078114383938e-06, 'batch_size': 3969, 'optimizer': 'RMSprop'}.
2026-06-05 06:14:38,107 - experiment_functions - INFO - Early stopping at epoch 500. Best Metrics: (0.000476941449710135, 7.200750217697099e-05, 0.00021708191002932972)
2026-06-05 06:14:38,194 - optuna.study.study - INFO - Trial 2 finished with values: [0.000476941449710135, 7.200750217697099e-05, 0.00021708191002932972] and parameters: {'n_layers': 3, 'embedding_dim': 64, 'lr': 0.010864534580056047, 'lambda_val': 1.157911783442221e-06, 'batch_size': 3139, 'optimizer': 'SGD'}.
2026-06-05 06:15:48,851 - experiment_functions - INFO - Early stopping at epoch 1750. Best Metrics: (0.011774845431476522, 0.0014970862080514436, 0.0051774794233171465)
2026-06-05 06:15:49,266 - optuna.study.study - INFO - Trial 3 finished with values: [0.011774845431476522, 0.0014970862080514436, 0.0051774794233171465] and parameters: {'n_layers': 2, 'embedding_dim': 96, 'lr': 0.002128004276932907, 'lambda_val': 0.060371212247772976, 'batch_size': 1302, 'optimizer': 'RMSprop'}.
2026-06-05 06:16:17,943 - experiment_functions - INFO - Early stopping at epoch 600. Best Metrics: (0.03539444190912742, 0.004091030879496283, 0.01643317833855072)
2026-06-05 06:16:18,963 - optuna.study.study - INFO - Trial 4 finished with values: [0.03539444190912742, 0.004091030879496283, 0.01643317833855072] and parameters: {'n_layers': 4, 'embedding_dim': 96, 'lr': 0.019367051543267743, 'lambda_val': 8.17902589782426e-05, 'batch_size': 1812, 'optimizer': 'RMSprop'}.
2026-06-05 06:16:40,088 - experiment_functions - INFO - Early stopping at epoch 500. Best Metrics: (0.00040419985496498916, 7.033290910308795e-05, 0.00017187811373735795)
2026-06-05 06:16:40,810 - optuna.study.study - INFO - Trial 5 finished with values: [0.00040419985496498916, 7.033290910308795e-05, 0.00017187811373735795] and parameters: {'n_layers': 1, 'embedding_dim': 128, 'lr': 0.0810804278361699, 'lambda_val': 0.07808935326711615, 'batch_size': 3583, 'optimizer': 'SGD'}.
2026-06-05 06:17:12,283 - experiment_functions - INFO - Early stopping at epoch 550. Best Metrics: (0.022981805921116958, 0.0026173889744792013, 0.010486120036548571)
2026-06-05 06:17:13,391 - optuna.study.study - INFO - Trial 6 finished with values: [0.022981805921116958, 0.0026173889744792013, 0.010486120036548571] and parameters: {'n_layers': 3, 'embedding_dim': 256, 'lr': 0.027845228823252365, 'lambda_val': 0.0028468440427530635, 'batch_size': 1275, 'optimizer': 'Adam'}.
2026-06-05 06:19:01,025 - experiment_functions - INFO - Early stopping at epoch 2600. Best Metrics: (0.02460919755679751, 0.002883649273226606, 0.011110716630690057)
2026-06-05 06:19:01,111 - optuna.study.study - INFO - Trial 7 finished with values: [0.02460919755679751, 0.002883649273226606, 0.011110716630690057] and parameters: {'n_layers': 4, 'embedding_dim': 64, 'lr': 0.07890941858371371, 'lambda_val': 0.001468044891542341, 'batch_size': 1660, 'optimizer': 'RMSprop'}.
2026-06-05 06:19:31,762 - experiment_functions - INFO - Early stopping at epoch 500. Best Metrics: (0.0005046679541057442, 6.363453680755576e-05, 0.00022523183019569002)
2026-06-05 06:19:31,902 - optuna.study.study - INFO - Trial 8 finished with values: [0.0005046679541057442, 6.363453680755576e-05, 0.00022523183019569002] and parameters: {'n_layers': 4, 'embedding_dim': 256, 'lr': 1.0940731148899947e-05, 'lambda_val': 4.28135932223045e-06, 'batch_size': 991, 'optimizer': 'SGD'}.
2026-06-05 06:20:02,283 - experiment_functions - INFO - Early stopping at epoch 500. Best Metrics: (0.0005933716376897433, 0.00010382477058074887, 0.0003156205574798859)
2026-06-05 06:20:02,373 - optuna.study.study - INFO - Trial 9 finished with values: [0.0005933716376897433, 0.00010382477058074887, 0.0003156205574798859] and parameters: {'n_layers': 4, 'embedding_dim': 256, 'lr': 0.014577440280312952, 'lambda_val': 0.07074738156904987, 'batch_size': 2036, 'optimizer': 'SGD'}.
2026-06-05 06:20:27,901 - experiment_functions - INFO - Early stopping at epoch 500. Best Metrics: (0.00040611108265217966, 7.535668832473711e-05, 0.00023669410469769587)
2026-06-05 06:20:28,308 - optuna.study.study - INFO - Trial 10 finished with values: [0.00040611108265217966, 7.535668832473711e-05, 0.00023669410469769587] and parameters: {'n_layers': 2, 'embedding_dim': 256, 'lr': 1.6876478568692283e-05, 'lambda_val': 0.0424842627993093, 'batch_size': 2619, 'optimizer': 'SGD'}.
2026-06-05 06:23:00,717 - optuna.study.study - INFO - Trial 11 finished with values: [0.006568643290278909, 0.0011973340478263783, 0.0038706805995034907] and parameters: {'n_layers': 2, 'embedding_dim': 64, 'lr': 0.00036100664498869524, 'lambda_val': 0.0008919112975523749, 'batch_size': 595, 'optimizer': 'Adam'}.
2026-06-05 06:23:43,257 - experiment_functions - INFO - Early stopping at epoch 950. Best Metrics: (0.0336507400503862, 0.003918547792886328, 0.015306885164663633)
2026-06-05 06:23:43,345 - optuna.study.study - INFO - Trial 12 finished with values: [0.0336507400503862, 0.003918547792886328, 0.015306885164663633] and parameters: {'n_layers': 3, 'embedding_dim': 96, 'lr': 0.0041201733250423745, 'lambda_val': 0.0003344121448101528, 'batch_size': 3082, 'optimizer': 'RMSprop'}.
2026-06-05 06:26:58,759 - optuna.study.study - INFO - Trial 13 finished with values: [0.023261978395169487, 0.0035987005157746667, 0.013606039689056033] and parameters: {'n_layers': 2, 'embedding_dim': 256, 'lr': 0.000350216316785427, 'lambda_val': 0.00017486567415461547, 'batch_size': 816, 'optimizer': 'Adam'}.
2026-06-05 06:27:20,822 - experiment_functions - INFO - Early stopping at epoch 500. Best Metrics: (0.00046162711311537594, 7.703128139862013e-05, 0.00020322267061152153)
2026-06-05 06:27:20,913 - optuna.study.study - INFO - Trial 14 finished with values: [0.00046162711311537594, 7.703128139862013e-05, 0.00020322267061152153] and parameters: {'n_layers': 3, 'embedding_dim': 64, 'lr': 1.8055052107374092e-05, 'lambda_val': 0.059436675422193275, 'batch_size': 2646, 'optimizer': 'SGD'}.
2026-06-05 06:27:55,081 - experiment_functions - INFO - Early stopping at epoch 600. Best Metrics: (0.0004025915728517155, 7.368209525085404e-05, 0.0002157209158996154)
2026-06-05 06:27:55,173 - optuna.study.study - INFO - Trial 15 finished with values: [0.0004025915728517155, 7.368209525085404e-05, 0.0002157209158996154] and parameters: {'n_layers': 3, 'embedding_dim': 256, 'lr': 1.8808246267438788e-05, 'lambda_val': 0.013304489789800665, 'batch_size': 744, 'optimizer': 'Adam'}.
2026-06-05 06:28:19,177 - experiment_functions - INFO - Early stopping at epoch 500. Best Metrics: (0.00049622576813358, 8.372965369415233e-05, 0.00023193215148856894)
2026-06-05 06:28:19,289 - optuna.study.study - INFO - Trial 16 finished with values: [0.00049622576813358, 8.372965369415233e-05, 0.00023193215148856894] and parameters: {'n_layers': 3, 'embedding_dim': 128, 'lr': 0.007707752411477586, 'lambda_val': 3.6689945310594065e-05, 'batch_size': 2005, 'optimizer': 'SGD'}.
2026-06-05 06:31:01,076 - optuna.study.study - INFO - Trial 17 finished with values: [0.05635629104393411, 0.007311273360573381, 0.029375100734427038] and parameters: {'n_layers': 2, 'embedding_dim': 64, 'lr': 0.00037519276912143255, 'lambda_val': 0.002704517607370656, 'batch_size': 4021, 'optimizer': 'Adam'}.
2026-06-05 06:31:28,856 - experiment_functions - INFO - Early stopping at epoch 500. Best Metrics: (0.0007329226639257051, 8.707883984191842e-05, 0.00028481251956867797)
2026-06-05 06:31:29,067 - optuna.study.study - INFO - Trial 18 finished with values: [0.0007329226639257051, 8.707883984191842e-05, 0.00028481251956867797] and parameters: {'n_layers': 2, 'embedding_dim': 256, 'lr': 0.0001448734655841958, 'lambda_val': 0.019865073532322072, 'batch_size': 1298, 'optimizer': 'RMSprop'}.
2026-06-05 06:31:53,277 - experiment_functions - INFO - Early stopping at epoch 500. Best Metrics: (0.0004688964618120134, 7.53566883247371e-05, 0.00020596353539032304)
2026-06-05 06:31:53,487 - optuna.study.study - INFO - Trial 19 finished with values: [0.0004688964618120134, 7.53566883247371e-05, 0.00020596353539032304] and parameters: {'n_layers': 2, 'embedding_dim': 96, 'lr': 0.000478584603147661, 'lambda_val': 4.680430056710386e-06, 'batch_size': 994, 'optimizer': 'SGD'}.
2026-06-05 06:32:16,737 - experiment_functions - INFO - Early stopping at epoch 500. Best Metrics: (0.00046306375199613837, 8.372965369415234e-05, 0.00022789684207065656)
2026-06-05 06:32:17,445 - optuna.study.study - INFO - Trial 20 finished with values: [0.00046306375199613837, 8.372965369415234e-05, 0.00022789684207065656] and parameters: {'n_layers': 2, 'embedding_dim': 128, 'lr': 1.1492865043588167e-05, 'lambda_val': 0.00572905272773, 'batch_size': 1986, 'optimizer': 'SGD'}.
2026-06-05 06:33:07,652 - experiment_functions - INFO - Early stopping at epoch 1100. Best Metrics: (0.01548654287627681, 0.001981043606403644, 0.006699522173118117)
2026-06-05 06:33:07,871 - optuna.study.study - INFO - Trial 21 finished with values: [0.01548654287627681, 0.001981043606403644, 0.006699522173118117] and parameters: {'n_layers': 2, 'embedding_dim': 64, 'lr': 0.0017598064686661866, 'lambda_val': 0.03699301214407421, 'batch_size': 1248, 'optimizer': 'RMSprop'}.
2026-06-05 06:33:45,280 - experiment_functions - INFO - Early stopping at epoch 500. Best Metrics: (0.0004761954361902277, 8.205506062026927e-05, 0.0002216158495504195)
2026-06-05 06:33:45,449 - optuna.study.study - INFO - Trial 22 finished with values: [0.0004761954361902277, 8.205506062026927e-05, 0.0002216158495504195] and parameters: {'n_layers': 4, 'embedding_dim': 256, 'lr': 2.1097674040416728e-05, 'lambda_val': 0.0022276693553447374, 'batch_size': 1861, 'optimizer': 'SGD'}.
2026-06-05 06:34:14,016 - experiment_functions - INFO - Early stopping at epoch 500. Best Metrics: (0.0005420816847269403, 8.707883984191843e-05, 0.0002347021210777693)
2026-06-05 06:34:15,123 - optuna.study.study - INFO - Trial 23 finished with values: [0.0005420816847269403, 8.707883984191843e-05, 0.0002347021210777693] and parameters: {'n_layers': 3, 'embedding_dim': 256, 'lr': 0.0043097709917901215, 'lambda_val': 0.001009549463278057, 'batch_size': 891, 'optimizer': 'SGD'}.
2026-06-05 06:34:41,290 - experiment_functions - INFO - Early stopping at epoch 600. Best Metrics: (0.027474560090157373, 0.00324871056333311, 0.01266028627719008)
2026-06-05 06:34:41,903 - optuna.study.study - INFO - Trial 24 finished with values: [0.027474560090157373, 0.00324871056333311, 0.01266028627719008] and parameters: {'n_layers': 3, 'embedding_dim': 64, 'lr': 0.024984519415047875, 'lambda_val': 7.059587443324882e-05, 'batch_size': 3993, 'optimizer': 'RMSprop'}.
2026-06-05 06:35:04,883 - experiment_functions - INFO - Early stopping at epoch 500. Best Metrics: (0.0003319183037944523, 6.363453680755577e-05, 0.00016728456053553318)
2026-06-05 06:35:04,974 - optuna.study.study - INFO - Trial 25 finished with values: [0.0003319183037944523, 6.363453680755577e-05, 0.00016728456053553318] and parameters: {'n_layers': 2, 'embedding_dim': 128, 'lr': 0.0005440091810992007, 'lambda_val': 0.053935580802756795, 'batch_size': 1912, 'optimizer': 'SGD'}.
2026-06-05 06:35:30,107 - experiment_functions - INFO - Early stopping at epoch 500. Best Metrics: (0.0007133192231656872, 9.210261906356756e-05, 0.0002906180645444563)
2026-06-05 06:35:30,218 - optuna.study.study - INFO - Trial 26 finished with values: [0.0007133192231656872, 9.210261906356756e-05, 0.0002906180645444563] and parameters: {'n_layers': 4, 'embedding_dim': 128, 'lr': 0.0010596794914140416, 'lambda_val': 0.029915014297001986, 'batch_size': 1536, 'optimizer': 'SGD'}.
2026-06-05 06:35:58,877 - experiment_functions - INFO - Early stopping at epoch 500. Best Metrics: (0.0005168221544651426, 7.2007502176971e-05, 0.00021519083194619326)
2026-06-05 06:35:58,994 - optuna.study.study - INFO - Trial 27 finished with values: [0.0005168221544651426, 7.2007502176971e-05, 0.00021519083194619326] and parameters: {'n_layers': 3, 'embedding_dim': 256, 'lr': 7.423313766631676e-05, 'lambda_val': 0.016217846124793836, 'batch_size': 669, 'optimizer': 'RMSprop'}.
2026-06-05 06:36:20,746 - experiment_functions - INFO - Early stopping at epoch 500. Best Metrics: (0.00030734664391946545, 5.526157143814053e-05, 0.00013461488538820806)
2026-06-05 06:36:21,652 - optuna.study.study - INFO - Trial 28 finished with values: [0.00030734664391946545, 5.526157143814053e-05, 0.00013461488538820806] and parameters: {'n_layers': 1, 'embedding_dim': 128, 'lr': 2.781081887948138e-05, 'lambda_val': 0.00018571794435108093, 'batch_size': 3744, 'optimizer': 'SGD'}.
2026-06-05 06:36:58,188 - experiment_functions - INFO - Early stopping at epoch 900. Best Metrics: (0.008017149119922051, 0.0009913590997387635, 0.003638818537233078)
2026-06-05 06:36:58,273 - optuna.study.study - INFO - Trial 29 finished with values: [0.008017149119922051, 0.0009913590997387635, 0.003638818537233078] and parameters: {'n_layers': 2, 'embedding_dim': 64, 'lr': 0.05215573830648526, 'lambda_val': 0.0483097925295068, 'batch_size': 2437, 'optimizer': 'RMSprop'}.
2026-06-05 06:39:16,922 - experiment_functions - INFO - Early stopping at epoch 2850. Best Metrics: (0.02073891967930488, 0.002590595485297073, 0.009511378245056509)
2026-06-05 06:39:18,033 - optuna.study.study - INFO - Trial 30 finished with values: [0.02073891967930488, 0.002590595485297073, 0.009511378245056509] and parameters: {'n_layers': 2, 'embedding_dim': 256, 'lr': 0.030325714675001437, 'lambda_val': 0.007008209464067845, 'batch_size': 2755, 'optimizer': 'RMSprop'}.
2026-06-05 06:39:39,325 - experiment_functions - INFO - Early stopping at epoch 500. Best Metrics: (0.00042359097928121965, 6.195994373367272e-05, 0.00016908511741963754)
2026-06-05 06:39:39,734 - optuna.study.study - INFO - Trial 31 finished with values: [0.00042359097928121965, 6.195994373367272e-05, 0.00016908511741963754] and parameters: {'n_layers': 4, 'embedding_dim': 32, 'lr': 1.7099989978212197e-05, 'lambda_val': 0.01821419352078481, 'batch_size': 1818, 'optimizer': 'SGD'}.
2026-06-05 06:42:37,823 - optuna.study.study - INFO - Trial 32 finished with values: [0.060146325959928346, 0.008347846473306986, 0.035005968726585096] and parameters: {'n_layers': 1, 'embedding_dim': 256, 'lr': 0.0006201349398045224, 'lambda_val': 6.977831082453278e-06, 'batch_size': 1300, 'optimizer': 'RMSprop'}.
2026-06-05 06:42:58,693 - experiment_functions - INFO - Early stopping at epoch 500. Best Metrics: (0.00046482202999202215, 6.363453680755577e-05, 0.0001668519746246034)
2026-06-05 06:42:59,824 - optuna.study.study - INFO - Trial 33 finished with values: [0.00046482202999202215, 6.363453680755577e-05, 0.0001668519746246034] and parameters: {'n_layers': 1, 'embedding_dim': 96, 'lr': 0.024034697065958528, 'lambda_val': 0.002826211874583175, 'batch_size': 2799, 'optimizer': 'SGD'}.
2026-06-05 06:43:20,721 - experiment_functions - INFO - Early stopping at epoch 500. Best Metrics: (0.0004808179716524154, 8.372965369415233e-05, 0.00020958586797622204)
2026-06-05 06:43:20,914 - optuna.study.study - INFO - Trial 34 finished with values: [0.0004808179716524154, 8.372965369415233e-05, 0.00020958586797622204] and parameters: {'n_layers': 4, 'embedding_dim': 32, 'lr': 0.0017163448230141686, 'lambda_val': 0.00016875617167475476, 'batch_size': 1642, 'optimizer': 'SGD'}.
2026-06-05 06:43:57,957 - experiment_functions - INFO - Early stopping at epoch 900. Best Metrics: (0.00026516769255412247, 5.861075758590662e-05, 0.00017401099919908913)
2026-06-05 06:43:58,188 - optuna.study.study - INFO - Trial 35 finished with values: [0.00026516769255412247, 5.861075758590662e-05, 0.00017401099919908913] and parameters: {'n_layers': 3, 'embedding_dim': 64, 'lr': 1.346723658443625e-05, 'lambda_val': 0.03531752411521458, 'batch_size': 1464, 'optimizer': 'Adam'}.
2026-06-05 06:45:40,999 - experiment_functions - INFO - Early stopping at epoch 2350. Best Metrics: (0.0003877681888523408, 6.698372295532187e-05, 0.00018148329702854157)
2026-06-05 06:45:41,083 - optuna.study.study - INFO - Trial 36 finished with values: [0.0003877681888523408, 6.698372295532187e-05, 0.00018148329702854157] and parameters: {'n_layers': 4, 'embedding_dim': 96, 'lr': 2.397476422932613e-05, 'lambda_val': 4.128660085531941e-06, 'batch_size': 4053, 'optimizer': 'RMSprop'}.
2026-06-05 06:46:45,308 - experiment_functions - INFO - Early stopping at epoch 1750. Best Metrics: (0.0006581014204202559, 8.70788398419184e-05, 0.00031053193415982806)
2026-06-05 06:46:46,257 - optuna.study.study - INFO - Trial 37 finished with values: [0.0006581014204202559, 8.70788398419184e-05, 0.00031053193415982806] and parameters: {'n_layers': 1, 'embedding_dim': 32, 'lr': 0.0001394128788174014, 'lambda_val': 0.00019199572870917748, 'batch_size': 1607, 'optimizer': 'RMSprop'}.
2026-06-05 06:49:19,401 - optuna.study.study - INFO - Trial 38 finished with values: [0.003867983193035352, 0.0007016544979569965, 0.002028028420381037] and parameters: {'n_layers': 4, 'embedding_dim': 32, 'lr': 0.00012312462786366718, 'lambda_val': 0.003892507443534669, 'batch_size': 2258, 'optimizer': 'Adam'}.
2026-06-05 06:51:11,590 - experiment_functions - INFO - Early stopping at epoch 2900. Best Metrics: (0.028005966572628424, 0.0032755040525152385, 0.012393284769884086)
2026-06-05 06:51:11,727 - optuna.study.study - INFO - Trial 39 finished with values: [0.028005966572628424, 0.0032755040525152385, 0.012393284769884086] and parameters: {'n_layers': 3, 'embedding_dim': 32, 'lr': 0.006542998749224963, 'lambda_val': 0.00013726443089426057, 'batch_size': 674, 'optimizer': 'Adam'}.
2026-06-05 06:51:49,463 - experiment_functions - INFO - Early stopping at epoch 550. Best Metrics: (0.00042421645506134255, 7.368209525085404e-05, 0.00020736094601648335)
2026-06-05 06:51:49,989 - optuna.study.study - INFO - Trial 40 finished with values: [0.00042421645506134255, 7.368209525085404e-05, 0.00020736094601648335] and parameters: {'n_layers': 4, 'embedding_dim': 256, 'lr': 2.50961792064713e-05, 'lambda_val': 0.001632216741738875, 'batch_size': 2349, 'optimizer': 'Adam'}.
2026-06-05 06:52:14,480 - experiment_functions - INFO - Early stopping at epoch 500. Best Metrics: (0.0004858461231850587, 7.703128139862015e-05, 0.00024115906850983866)
2026-06-05 06:52:14,561 - optuna.study.study - INFO - Trial 41 finished with values: [0.0004858461231850587, 7.703128139862015e-05, 0.00024115906850983866] and parameters: {'n_layers': 3, 'embedding_dim': 128, 'lr': 7.052487888440521e-05, 'lambda_val': 0.09479180593722179, 'batch_size': 2559, 'optimizer': 'Adam'}.
2026-06-05 06:53:14,803 - experiment_functions - INFO - Early stopping at epoch 1500. Best Metrics: (0.0006026693991381257, 7.703128139862015e-05, 0.00027181694375453776)
2026-06-05 06:53:15,434 - optuna.study.study - INFO - Trial 42 finished with values: [0.0006026693991381257, 7.703128139862015e-05, 0.00027181694375453776] and parameters: {'n_layers': 1, 'embedding_dim': 96, 'lr': 0.00014892043552417684, 'lambda_val': 0.0009208899624087596, 'batch_size': 747, 'optimizer': 'Adam'}.
2026-06-05 06:53:39,517 - experiment_functions - INFO - Early stopping at epoch 500. Best Metrics: (0.0004372133606450844, 7.2007502176971e-05, 0.0001804984246179298)
2026-06-05 06:53:39,824 - optuna.study.study - INFO - Trial 43 finished with values: [0.0004372133606450844, 7.2007502176971e-05, 0.0001804984246179298] and parameters: {'n_layers': 4, 'embedding_dim': 96, 'lr': 0.0006596849911770471, 'lambda_val': 1.4924006471519886e-06, 'batch_size': 3359, 'optimizer': 'SGD'}.
2026-06-05 06:54:03,536 - experiment_functions - INFO - Early stopping at epoch 500. Best Metrics: (0.0005390029978097961, 8.372965369415233e-05, 0.0002916361809209083)
