2026-06-07 00:38:20,059 - optuna.study.study - INFO - Trial 21 finished with values: [0.0006858452276948908, 8.875343291580147e-05, 0.00035223777829665855] and parameters: {'n_layers': 2, 'embedding_dim': 96, 'lr': 1.0930556626230257e-05, 'lambda_val': 0.0007420408771332212, 'batch_size': 2442, 'optimizer': 'RMSprop'}.
2026-06-07 00:41:01,414 - optuna.study.study - INFO - Trial 22 finished with values: [0.001306637173659851, 0.0003047759394467145, 0.000705877885738482] and parameters: {'n_layers': 4, 'embedding_dim': 96, 'lr': 5.947110592513951e-05, 'lambda_val': 1.4748392203086364e-06, 'batch_size': 3170, 'optimizer': 'Adam'}.
2026-06-07 00:42:12,694 - experiment_functions - INFO - Early stopping at epoch 1700. Best Metrics: (0.0003476073089067777, 7.368209525085404e-05, 0.00017447818927083757)
2026-06-07 00:42:12,778 - optuna.study.study - INFO - Trial 23 finished with values: [0.0003476073089067777, 7.368209525085404e-05, 0.00017447818927083757] and parameters: {'n_layers': 1, 'embedding_dim': 256, 'lr': 2.6517932596743605e-05, 'lambda_val': 0.0003170407395300774, 'batch_size': 869, 'optimizer': 'Adam'}.
2026-06-07 00:42:33,005 - experiment_functions - INFO - Early stopping at epoch 500. Best Metrics: (0.0005055140103684138, 8.205506062026927e-05, 0.00025466779374295784)
2026-06-07 00:42:33,094 - optuna.study.study - INFO - Trial 24 finished with values: [0.0005055140103684138, 8.205506062026927e-05, 0.00025466779374295784] and parameters: {'n_layers': 1, 'embedding_dim': 32, 'lr': 2.333406876399585e-05, 'lambda_val': 0.003100232833288598, 'batch_size': 2643, 'optimizer': 'Adam'}.
2026-06-07 00:42:59,139 - experiment_functions - INFO - Early stopping at epoch 500. Best Metrics: (0.00046906239231257735, 7.703128139862015e-05, 0.00019940025055018192)
2026-06-07 00:43:00,202 - optuna.study.study - INFO - Trial 25 finished with values: [0.00046906239231257735, 7.703128139862015e-05, 0.00019940025055018192] and parameters: {'n_layers': 4, 'embedding_dim': 256, 'lr': 7.008333419806241e-05, 'lambda_val': 0.00029907993070612653, 'batch_size': 1123, 'optimizer': 'SGD'}.
2026-06-07 00:43:20,683 - experiment_functions - INFO - Early stopping at epoch 500. Best Metrics: (0.00035224659209110663, 7.53566883247371e-05, 0.0001617757424156982)
2026-06-07 00:43:20,792 - optuna.study.study - INFO - Trial 26 finished with values: [0.00035224659209110663, 7.53566883247371e-05, 0.0001617757424156982] and parameters: {'n_layers': 4, 'embedding_dim': 32, 'lr': 0.021653186861251617, 'lambda_val': 0.038960501758543035, 'batch_size': 3578, 'optimizer': 'SGD'}.
2026-06-07 00:43:46,038 - experiment_functions - INFO - Early stopping at epoch 550. Best Metrics: (0.009421987057283861, 0.0031197668966441157, 0.0070465420839271485)
2026-06-07 00:43:46,279 - optuna.study.study - INFO - Trial 27 finished with values: [0.009421987057283861, 0.0031197668966441157, 0.0070465420839271485] and parameters: {'n_layers': 1, 'embedding_dim': 256, 'lr': 0.005424684195660662, 'lambda_val': 6.538231837458372e-06, 'batch_size': 4046, 'optimizer': 'Adam'}.
2026-06-07 00:44:07,259 - experiment_functions - INFO - Early stopping at epoch 500. Best Metrics: (0.00026667495484259133, 5.861075758590662e-05, 0.0001551043636492007)
2026-06-07 00:44:08,202 - optuna.study.study - INFO - Trial 28 finished with values: [0.00026667495484259133, 5.861075758590662e-05, 0.0001551043636492007] and parameters: {'n_layers': 1, 'embedding_dim': 128, 'lr': 3.368804361234291e-05, 'lambda_val': 0.0008971297075115505, 'batch_size': 843, 'optimizer': 'SGD'}.
2026-06-07 00:44:31,466 - experiment_functions - INFO - Early stopping at epoch 500. Best Metrics: (0.00042932749579054487, 5.693616451202358e-05, 0.00020442369486192228)
2026-06-07 00:44:32,800 - optuna.study.study - INFO - Trial 29 finished with values: [0.00042932749579054487, 5.693616451202358e-05, 0.00020442369486192228] and parameters: {'n_layers': 2, 'embedding_dim': 256, 'lr': 0.0027451119682157655, 'lambda_val': 0.017747037754618604, 'batch_size': 1493, 'optimizer': 'SGD'}.
2026-06-07 00:45:17,254 - experiment_functions - INFO - Early stopping at epoch 1150. Best Metrics: (0.0054798084299231865, 0.0015657445240806487, 0.003506959934228512)
2026-06-07 00:45:17,397 - optuna.study.study - INFO - Trial 30 finished with values: [0.0054798084299231865, 0.0015657445240806487, 0.003506959934228512] and parameters: {'n_layers': 2, 'embedding_dim': 64, 'lr': 0.000762190113410319, 'lambda_val': 0.0007605677300524109, 'batch_size': 2179, 'optimizer': 'Adam'}.
2026-06-07 00:45:43,595 - experiment_functions - INFO - Early stopping at epoch 500. Best Metrics: (0.0004657831982390847, 9.210261906356759e-05, 0.0002430718140355517)
2026-06-07 00:45:43,777 - optuna.study.study - INFO - Trial 31 finished with values: [0.0004657831982390847, 9.210261906356759e-05, 0.0002430718140355517] and parameters: {'n_layers': 4, 'embedding_dim': 256, 'lr': 0.0010083747390900234, 'lambda_val': 4.608396967116186e-06, 'batch_size': 972, 'optimizer': 'SGD'}.
2026-06-07 00:46:04,444 - experiment_functions - INFO - Early stopping at epoch 500. Best Metrics: (0.00036810174877486586, 5.861075758590662e-05, 0.00018528511285076382)
2026-06-07 00:46:04,571 - optuna.study.study - INFO - Trial 32 finished with values: [0.00036810174877486586, 5.861075758590662e-05, 0.00018528511285076382] and parameters: {'n_layers': 1, 'embedding_dim': 128, 'lr': 0.00024105662411162888, 'lambda_val': 2.4524434703883866e-06, 'batch_size': 638, 'optimizer': 'SGD'}.
2026-06-07 00:47:34,066 - experiment_functions - INFO - Early stopping at epoch 2300. Best Metrics: (0.004137483883751389, 0.0011353741040927054, 0.0027313397414565656)
2026-06-07 00:47:34,150 - optuna.study.study - INFO - Trial 33 finished with values: [0.004137483883751389, 0.0011353741040927054, 0.0027313397414565656] and parameters: {'n_layers': 4, 'embedding_dim': 64, 'lr': 0.00031084764364588095, 'lambda_val': 0.00011914359581119532, 'batch_size': 2652, 'optimizer': 'RMSprop'}.
2026-06-07 00:47:56,518 - experiment_functions - INFO - Early stopping at epoch 550. Best Metrics: (0.0013778096380857854, 0.00035333913858932284, 0.0007734208416032524)
2026-06-07 00:47:56,625 - optuna.study.study - INFO - Trial 34 finished with values: [0.0013778096380857854, 0.00035333913858932284, 0.0007734208416032524] and parameters: {'n_layers': 4, 'embedding_dim': 32, 'lr': 0.029327207416993392, 'lambda_val': 0.007930029569601321, 'batch_size': 3085, 'optimizer': 'Adam'}.
2026-06-07 00:48:23,113 - experiment_functions - INFO - Early stopping at epoch 500. Best Metrics: (0.003892408938324464, 0.0009930336928126466, 0.0027962504114436657)
2026-06-07 00:48:23,540 - optuna.study.study - INFO - Trial 35 finished with values: [0.003892408938324464, 0.0009930336928126466, 0.0027962504114436657] and parameters: {'n_layers': 4, 'embedding_dim': 256, 'lr': 0.03222787388169566, 'lambda_val': 0.0868747821267466, 'batch_size': 2239, 'optimizer': 'RMSprop'}.
2026-06-07 00:49:55,117 - experiment_functions - INFO - Early stopping at epoch 2300. Best Metrics: (0.003053509060913979, 0.0008406457230892892, 0.0019864651922339833)
2026-06-07 00:49:56,537 - optuna.study.study - INFO - Trial 36 finished with values: [0.003053509060913979, 0.0008406457230892892, 0.0019864651922339833] and parameters: {'n_layers': 3, 'embedding_dim': 96, 'lr': 0.00019178783016765463, 'lambda_val': 0.003413922431571512, 'batch_size': 2891, 'optimizer': 'Adam'}.
2026-06-07 00:50:22,201 - experiment_functions - INFO - Early stopping at epoch 600. Best Metrics: (0.002273364019650281, 0.0005928059481545984, 0.0013971009124399314)
2026-06-07 00:50:22,322 - optuna.study.study - INFO - Trial 37 finished with values: [0.002273364019650281, 0.0005928059481545984, 0.0013971009124399314] and parameters: {'n_layers': 4, 'embedding_dim': 32, 'lr': 0.025057340678512768, 'lambda_val': 3.222265315337744e-05, 'batch_size': 3302, 'optimizer': 'Adam'}.
2026-06-07 00:50:51,670 - experiment_functions - INFO - Early stopping at epoch 550. Best Metrics: (0.0030625728810261877, 0.0007351463594346575, 0.0017429798575506166)
2026-06-07 00:50:51,774 - optuna.study.study - INFO - Trial 38 finished with values: [0.0030625728810261877, 0.0007351463594346575, 0.0017429798575506166] and parameters: {'n_layers': 4, 'embedding_dim': 256, 'lr': 0.006267253881614865, 'lambda_val': 5.747599187815172e-06, 'batch_size': 1735, 'optimizer': 'Adam'}.
2026-06-07 00:51:23,668 - experiment_functions - INFO - Early stopping at epoch 750. Best Metrics: (0.0006702326195845521, 7.870587447250318e-05, 0.00025701529698993604)
2026-06-07 00:51:24,560 - optuna.study.study - INFO - Trial 39 finished with values: [0.0006702326195845521, 7.870587447250318e-05, 0.00025701529698993604] and parameters: {'n_layers': 3, 'embedding_dim': 128, 'lr': 0.08129549223581133, 'lambda_val': 0.0005273918235721608, 'batch_size': 2987, 'optimizer': 'SGD'}.
2026-06-07 00:54:06,913 - optuna.study.study - INFO - Trial 40 finished with values: [0.001897743614035496, 0.0005325205974948088, 0.0012025049889119977] and parameters: {'n_layers': 1, 'embedding_dim': 256, 'lr': 0.00010465532100552729, 'lambda_val': 2.747257525586621e-06, 'batch_size': 2172, 'optimizer': 'RMSprop'}.
2026-06-07 00:54:27,895 - experiment_functions - INFO - Early stopping at epoch 500. Best Metrics: (0.0003329399033911685, 6.028535065978968e-05, 0.0001741292252340907)
2026-06-07 00:54:28,106 - optuna.study.study - INFO - Trial 41 finished with values: [0.0003329399033911685, 6.028535065978968e-05, 0.0001741292252340907] and parameters: {'n_layers': 2, 'embedding_dim': 96, 'lr': 1.9807885952621845e-05, 'lambda_val': 0.05671013123072485, 'batch_size': 2831, 'optimizer': 'SGD'}.
2026-06-07 00:54:50,264 - experiment_functions - INFO - Early stopping at epoch 550. Best Metrics: (0.0020815529363099623, 0.0005124254806082122, 0.0011510349854269553)
2026-06-07 00:54:50,337 - optuna.study.study - INFO - Trial 42 finished with values: [0.0020815529363099623, 0.0005124254806082122, 0.0011510349854269553] and parameters: {'n_layers': 3, 'embedding_dim': 32, 'lr': 0.01266086432591958, 'lambda_val': 0.010755771217610706, 'batch_size': 3431, 'optimizer': 'Adam'}.
2026-06-07 00:55:14,458 - experiment_functions - INFO - Early stopping at epoch 600. Best Metrics: (0.003018508056561008, 0.0007083528702525287, 0.0017257497572253705)
2026-06-07 00:55:14,565 - optuna.study.study - INFO - Trial 43 finished with values: [0.003018508056561008, 0.0007083528702525287, 0.0017257497572253705] and parameters: {'n_layers': 3, 'embedding_dim': 32, 'lr': 0.00222643395785692, 'lambda_val': 0.00028607926724212617, 'batch_size': 4042, 'optimizer': 'RMSprop'}.
2026-06-07 00:55:34,790 - experiment_functions - INFO - Early stopping at epoch 500. Best Metrics: (0.0003712909796066147, 5.861075758590663e-05, 0.0001801462730314256)
2026-06-07 00:55:34,994 - optuna.study.study - INFO - Trial 44 finished with values: [0.0003712909796066147, 5.861075758590663e-05, 0.0001801462730314256] and parameters: {'n_layers': 1, 'embedding_dim': 64, 'lr': 0.00022073251369240747, 'lambda_val': 4.7358111072249705e-06, 'batch_size': 3206, 'optimizer': 'SGD'}.
2026-06-07 00:55:55,463 - experiment_functions - INFO - Early stopping at epoch 500. Best Metrics: (0.0005803707454018929, 7.368209525085404e-05, 0.0002973729401618634)
2026-06-07 00:55:55,761 - optuna.study.study - INFO - Trial 45 finished with values: [0.0005803707454018929, 7.368209525085404e-05, 0.0002973729401618634] and parameters: {'n_layers': 2, 'embedding_dim': 64, 'lr': 0.0012657511253013419, 'lambda_val': 0.00076756088740781, 'batch_size': 2255, 'optimizer': 'SGD'}.
2026-06-07 00:57:02,155 - experiment_functions - INFO - Early stopping at epoch 1600. Best Metrics: (0.0030365505432527256, 0.0008724629914930673, 0.001979455460171202)
2026-06-07 00:57:02,225 - optuna.study.study - INFO - Trial 46 finished with values: [0.0030365505432527256, 0.0008724629914930673, 0.001979455460171202] and parameters: {'n_layers': 3, 'embedding_dim': 128, 'lr': 0.0020485036238635386, 'lambda_val': 9.785349688563776e-06, 'batch_size': 1861, 'optimizer': 'RMSprop'}.
2026-06-07 00:57:24,394 - experiment_functions - INFO - Early stopping at epoch 500. Best Metrics: (0.00035900988945121643, 5.861075758590663e-05, 0.00014915500423145125)
2026-06-07 00:57:24,484 - optuna.study.study - INFO - Trial 47 finished with values: [0.00035900988945121643, 5.861075758590663e-05, 0.00014915500423145125] and parameters: {'n_layers': 3, 'embedding_dim': 128, 'lr': 1.4477489686474811e-05, 'lambda_val': 0.009264476955369626, 'batch_size': 2635, 'optimizer': 'SGD'}.
2026-06-07 00:57:49,475 - experiment_functions - INFO - Early stopping at epoch 600. Best Metrics: (0.002269834636305359, 0.0005207984459776274, 0.0013052253519186404)
2026-06-07 00:57:50,332 - optuna.study.study - INFO - Trial 48 finished with values: [0.002269834636305359, 0.0005207984459776274, 0.0013052253519186404] and parameters: {'n_layers': 4, 'embedding_dim': 64, 'lr': 0.0017197271078814886, 'lambda_val': 0.00044849490190016335, 'batch_size': 2926, 'optimizer': 'RMSprop'}.
2026-06-07 00:58:11,047 - experiment_functions - INFO - Early stopping at epoch 500. Best Metrics: (0.00032663731380614324, 5.861075758590662e-05, 0.00013591912158954962)
2026-06-07 00:58:11,138 - optuna.study.study - INFO - Trial 49 finished with values: [0.00032663731380614324, 5.861075758590662e-05, 0.00013591912158954962] and parameters: {'n_layers': 1, 'embedding_dim': 128, 'lr': 2.056224463894759e-05, 'lambda_val': 3.132706227597507e-05, 'batch_size': 1891, 'optimizer': 'SGD'}.
2026-06-07 01:00:43,974 - optuna.study.study - INFO - Trial 50 finished with values: [0.0027104922087647426, 0.0010097796235514769, 0.001999707436162824] and parameters: {'n_layers': 2, 'embedding_dim': 96, 'lr': 0.03222787388169566, 'lambda_val': 0.0007420408771332212, 'batch_size': 2442, 'optimizer': 'RMSprop'}.
2026-06-07 01:01:06,609 - experiment_functions - INFO - Early stopping at epoch 500. Best Metrics: (0.0038641881763149897, 0.0010298747404380736, 0.0025959445881140347)
2026-06-07 01:01:06,700 - optuna.study.study - INFO - Trial 51 finished with values: [0.0038641881763149897, 0.0010298747404380736, 0.0025959445881140347] and parameters: {'n_layers': 4, 'embedding_dim': 96, 'lr': 0.027383272358148473, 'lambda_val': 0.00044849490190016335, 'batch_size': 2239, 'optimizer': 'RMSprop'}.
2026-06-07 01:01:34,828 - experiment_functions - INFO - Early stopping at epoch 550. Best Metrics: (0.00407292623431278, 0.0012258021300823897, 0.002685616466470641)
2026-06-07 01:01:34,909 - optuna.study.study - INFO - Trial 52 finished with values: [0.00407292623431278, 0.0012258021300823897, 0.002685616466470641] and parameters: {'n_layers': 3, 'embedding_dim': 256, 'lr': 0.005424684195660662, 'lambda_val': 6.538231837458372e-06, 'batch_size': 3377, 'optimizer': 'Adam'}.
2026-06-07 01:04:05,280 - experiment_functions - INFO - Early stopping at epoch 3850. Best Metrics: (0.0006868670345189067, 0.00010884854980239804, 0.000340942418754958)
2026-06-07 01:04:05,377 - optuna.study.study - INFO - Trial 53 finished with values: [0.0006868670345189067, 0.00010884854980239804, 0.000340942418754958] and parameters: {'n_layers': 2, 'embedding_dim': 128, 'lr': 5.34273989839083e-05, 'lambda_val': 9.785349688563776e-06, 'batch_size': 1861, 'optimizer': 'Adam'}.
2026-06-07 01:04:28,283 - experiment_functions - INFO - Early stopping at epoch 550. Best Metrics: (0.008284172169625728, 0.002696094848951705, 0.00605094487237013)
2026-06-07 01:04:28,377 - optuna.study.study - INFO - Trial 54 finished with values: [0.008284172169625728, 0.002696094848951705, 0.00605094487237013] and parameters: {'n_layers': 1, 'embedding_dim': 96, 'lr': 0.005424684195660662, 'lambda_val': 0.003413922431571512, 'batch_size': 4046, 'optimizer': 'Adam'}.
2026-06-07 01:07:34,282 - optuna.study.study - INFO - Trial 55 finished with values: [0.0022944077287067226, 0.0006262978096322593, 0.0015803926524723731] and parameters: {'n_layers': 3, 'embedding_dim': 256, 'lr': 5.947110592513951e-05, 'lambda_val': 1.4748392203086364e-06, 'batch_size': 3170, 'optimizer': 'Adam'}.
2026-06-07 01:07:55,646 - experiment_functions - INFO - Early stopping at epoch 500. Best Metrics: (0.0005979872232006042, 7.870587447250318e-05, 0.0002686846721196356)
2026-06-07 01:07:55,728 - optuna.study.study - INFO - Trial 56 finished with values: [0.0005979872232006042, 7.870587447250318e-05, 0.0002686846721196356] and parameters: {'n_layers': 3, 'embedding_dim': 96, 'lr': 1.0930556626230257e-05, 'lambda_val': 0.0005273918235721608, 'batch_size': 2442, 'optimizer': 'SGD'}.
2026-06-07 01:08:48,193 - experiment_functions - INFO - Early stopping at epoch 1300. Best Metrics: (0.0007301868209758287, 8.372965369415233e-05, 0.00033438545002931376)
2026-06-07 01:08:48,496 - optuna.study.study - INFO - Trial 57 finished with values: [0.0007301868209758287, 8.372965369415233e-05, 0.00033438545002931376] and parameters: {'n_layers': 3, 'embedding_dim': 96, 'lr': 1.0930556626230257e-05, 'lambda_val': 0.0007420408771332212, 'batch_size': 3431, 'optimizer': 'Adam'}.
2026-06-07 01:10:21,598 - experiment_functions - INFO - Early stopping at epoch 2550. Best Metrics: (0.0006501623532320686, 8.540424676803539e-05, 0.0002502980153089845)
2026-06-07 01:10:21,700 - optuna.study.study - INFO - Trial 58 finished with values: [0.0006501623532320686, 8.540424676803539e-05, 0.0002502980153089845] and parameters: {'n_layers': 3, 'embedding_dim': 32, 'lr': 3.975166372643812e-05, 'lambda_val': 0.0005273918235721608, 'batch_size': 1783, 'optimizer': 'RMSprop'}.
2026-06-07 01:10:42,235 - experiment_functions - INFO - Early stopping at epoch 500. Best Metrics: (0.000323711454272306, 5.358697836425749e-05, 0.0001493947931696143)
2026-06-07 01:10:42,334 - optuna.study.study - INFO - Trial 59 finished with values: [0.000323711454272306, 5.358697836425749e-05, 0.0001493947931696143] and parameters: {'n_layers': 1, 'embedding_dim': 96, 'lr': 7.837501487508114e-05, 'lambda_val': 0.0054314837121898114, 'batch_size': 3170, 'optimizer': 'RMSprop'}.
2026-06-07 01:11:35,475 - experiment_functions - INFO - Early stopping at epoch 1350. Best Metrics: (0.0009899913948992636, 0.00017583227275771987, 0.0005100137255865197)
2026-06-07 01:11:35,557 - optuna.study.study - INFO - Trial 60 finished with values: [0.0009899913948992636, 0.00017583227275771987, 0.0005100137255865197] and parameters: {'n_layers': 4, 'embedding_dim': 64, 'lr': 0.00031084764364588095, 'lambda_val': 0.05981291269382697, 'batch_size': 2652, 'optimizer': 'RMSprop'}.
2026-06-07 01:11:58,056 - experiment_functions - INFO - Early stopping at epoch 500. Best Metrics: (0.0002698321994621581, 4.1864826847076163e-05, 0.0001646900254760742)
2026-06-07 01:11:58,143 - optuna.study.study - INFO - Trial 61 finished with values: [0.0002698321994621581, 4.1864826847076163e-05, 0.0001646900254760742] and parameters: {'n_layers': 3, 'embedding_dim': 128, 'lr': 0.00019178783016765463, 'lambda_val': 0.06611463240941208, 'batch_size': 2891, 'optimizer': 'Adam'}.
2026-06-07 01:13:17,482 - experiment_functions - INFO - Early stopping at epoch 2100. Best Metrics: (0.006251160398881892, 0.0017415767968383682, 0.004096184829859285)
2026-06-07 01:13:17,579 - optuna.study.study - INFO - Trial 62 finished with values: [0.006251160398881892, 0.0017415767968383682, 0.004096184829859285] and parameters: {'n_layers': 2, 'embedding_dim': 64, 'lr': 0.00031084764364588095, 'lambda_val': 0.0007605677300524109, 'batch_size': 2652, 'optimizer': 'RMSprop'}.
2026-06-07 01:15:17,260 - experiment_functions - INFO - Early stopping at epoch 3100. Best Metrics: (0.005610324985608878, 0.0017466005760600177, 0.0038059841977219587)
2026-06-07 01:15:17,978 - optuna.study.study - INFO - Trial 63 finished with values: [0.005610324985608878, 0.0017466005760600177, 0.0038059841977219587] and parameters: {'n_layers': 2, 'embedding_dim': 96, 'lr': 0.00031084764364588095, 'lambda_val': 0.0006098824234122334, 'batch_size': 2652, 'optimizer': 'Adam'}.
2026-06-07 01:15:50,081 - experiment_functions - INFO - Early stopping at epoch 800. Best Metrics: (0.0029439638741924714, 0.0007217496148435931, 0.0018330619921193732)
2026-06-07 01:15:50,167 - optuna.study.study - INFO - Trial 64 finished with values: [0.0029439638741924714, 0.0007217496148435931, 0.0018330619921193732] and parameters: {'n_layers': 3, 'embedding_dim': 64, 'lr': 0.0017197271078814886, 'lambda_val': 0.0001506752792709509, 'batch_size': 3461, 'optimizer': 'RMSprop'}.
2026-06-07 01:16:13,810 - experiment_functions - INFO - Early stopping at epoch 550. Best Metrics: (0.002364777155341483, 0.0004956795498693819, 0.001320434210473705)
2026-06-07 01:16:13,913 - optuna.study.study - INFO - Trial 65 finished with values: [0.002364777155341483, 0.0004956795498693819, 0.001320434210473705] and parameters: {'n_layers': 3, 'embedding_dim': 96, 'lr': 0.0017152190282418974, 'lambda_val': 0.0054314837121898114, 'batch_size': 1114, 'optimizer': 'RMSprop'}.
2026-06-07 01:18:44,193 - optuna.study.study - INFO - Trial 66 finished with values: [0.0006453111101274935, 0.00011052314287628108, 0.0003021968873040219] and parameters: {'n_layers': 3, 'embedding_dim': 64, 'lr': 4.455055578870285e-05, 'lambda_val': 0.0007420408771332212, 'batch_size': 2442, 'optimizer': 'Adam'}.
2026-06-07 01:22:00,559 - optuna.study.study - INFO - Trial 67 finished with values: [0.0030553700350179867, 0.0008490186884587045, 0.00204867554389104] and parameters: {'n_layers': 4, 'embedding_dim': 256, 'lr': 0.00010533162467921403, 'lambda_val': 2.747257525586621e-06, 'batch_size': 1735, 'optimizer': 'Adam'}.
