2026-06-03 16:23:54,411 - optuna.study.study - INFO - Trial 189 finished with values: [0.0025301013676565388, 0.0006983053118092304, 0.001550140435015445] and parameters: {'n_layers': 2, 'embedding_dim': 96, 'lr': 0.006315240769324818, 'lambda_val': 1.780698705122307e-06, 'batch_size': 572, 'optimizer': 'Adam'}.
2026-06-03 16:24:29,908 - experiment_functions - INFO - Early stopping at epoch 900. Best Metrics: (0.0048433759033543545, 0.0016678947015875143, 0.003347254577054353)
2026-06-03 16:24:30,008 - optuna.study.study - INFO - Trial 190 finished with values: [0.0048433759033543545, 0.0016678947015875143, 0.003347254577054353] and parameters: {'n_layers': 1, 'embedding_dim': 96, 'lr': 0.0010433155335864835, 'lambda_val': 0.001214972879722574, 'batch_size': 1352, 'optimizer': 'RMSprop'}.
2026-06-03 16:24:54,679 - experiment_functions - INFO - Early stopping at epoch 550. Best Metrics: (0.0016080128802126532, 0.00047223524683501916, 0.0010731586050470646)
2026-06-03 16:24:55,027 - optuna.study.study - INFO - Trial 191 finished with values: [0.0016080128802126532, 0.00047223524683501916, 0.0010731586050470646] and parameters: {'n_layers': 4, 'embedding_dim': 128, 'lr': 0.004405498867122906, 'lambda_val': 0.00022250083118396295, 'batch_size': 1865, 'optimizer': 'RMSprop'}.
2026-06-03 16:25:18,131 - experiment_functions - INFO - Early stopping at epoch 550. Best Metrics: (0.0040486699148762325, 0.0014887132426820284, 0.0029470329555773356)
2026-06-03 16:25:18,284 - optuna.study.study - INFO - Trial 192 finished with values: [0.0040486699148762325, 0.0014887132426820284, 0.0029470329555773356] and parameters: {'n_layers': 1, 'embedding_dim': 128, 'lr': 0.01506522012263809, 'lambda_val': 0.0006859838564406128, 'batch_size': 1352, 'optimizer': 'Adam'}.
2026-06-03 16:26:09,327 - experiment_functions - INFO - Early stopping at epoch 1150. Best Metrics: (0.002827239245600272, 0.0009210261906356756, 0.0018946338898384785)
2026-06-03 16:26:09,429 - optuna.study.study - INFO - Trial 193 finished with values: [0.002827239245600272, 0.0009210261906356756, 0.0018946338898384785] and parameters: {'n_layers': 2, 'embedding_dim': 256, 'lr': 0.0010433155335864835, 'lambda_val': 2.2072560753305147e-05, 'batch_size': 957, 'optimizer': 'RMSprop'}.
2026-06-03 16:26:44,731 - experiment_functions - INFO - Early stopping at epoch 900. Best Metrics: (0.002797242221408445, 0.0011353741040927054, 0.0020581811924538546)
2026-06-03 16:26:44,847 - optuna.study.study - INFO - Trial 194 finished with values: [0.002797242221408445, 0.0011353741040927054, 0.0020581811924538546] and parameters: {'n_layers': 1, 'embedding_dim': 96, 'lr': 0.0006158877725370185, 'lambda_val': 0.025990812764396166, 'batch_size': 3192, 'optimizer': 'Adam'}.
2026-06-03 16:27:09,409 - experiment_functions - INFO - Early stopping at epoch 550. Best Metrics: (0.003778938156006069, 0.0014116819612834083, 0.002928291566082253)
2026-06-03 16:27:09,907 - optuna.study.study - INFO - Trial 195 finished with values: [0.003778938156006069, 0.0014116819612834083, 0.002928291566082253] and parameters: {'n_layers': 1, 'embedding_dim': 256, 'lr': 0.001924199836373552, 'lambda_val': 2.2072560753305147e-05, 'batch_size': 2526, 'optimizer': 'RMSprop'}.
2026-06-03 16:27:30,150 - experiment_functions - INFO - Early stopping at epoch 500. Best Metrics: (0.0004751543406356836, 6.195994373367272e-05, 0.00019748179392574817)
2026-06-03 16:27:30,233 - optuna.study.study - INFO - Trial 196 finished with values: [0.0004751543406356836, 6.195994373367272e-05, 0.00019748179392574817] and parameters: {'n_layers': 2, 'embedding_dim': 32, 'lr': 0.00024535156098645997, 'lambda_val': 1.6249619969834492e-06, 'batch_size': 2782, 'optimizer': 'SGD'}.
2026-06-03 16:27:56,412 - experiment_functions - INFO - Early stopping at epoch 600. Best Metrics: (0.001884680871301738, 0.0007033290910308795, 0.0013766735447963494)
2026-06-03 16:27:56,769 - optuna.study.study - INFO - Trial 197 finished with values: [0.001884680871301738, 0.0007033290910308795, 0.0013766735447963494] and parameters: {'n_layers': 3, 'embedding_dim': 128, 'lr': 0.01506522012263809, 'lambda_val': 2.2072560753305147e-05, 'batch_size': 1352, 'optimizer': 'RMSprop'}.
2026-06-03 16:28:22,521 - experiment_functions - INFO - Early stopping at epoch 650. Best Metrics: (0.004824244386627903, 0.0015607207448589992, 0.003220624006424362)
2026-06-03 16:28:22,611 - optuna.study.study - INFO - Trial 198 finished with values: [0.004824244386627903, 0.0015607207448589992, 0.003220624006424362] and parameters: {'n_layers': 1, 'embedding_dim': 64, 'lr': 0.0018644973108911816, 'lambda_val': 8.536566464955742e-05, 'batch_size': 2369, 'optimizer': 'RMSprop'}.
2026-06-03 16:28:48,828 - experiment_functions - INFO - Early stopping at epoch 550. Best Metrics: (0.002742011321151959, 0.000900931073749079, 0.0018662099826871306)
2026-06-03 16:28:48,928 - optuna.study.study - INFO - Trial 199 finished with values: [0.002742011321151959, 0.000900931073749079, 0.0018662099826871306] and parameters: {'n_layers': 2, 'embedding_dim': 256, 'lr': 0.008813340023110926, 'lambda_val': 2.2072560753305147e-05, 'batch_size': 2094, 'optimizer': 'Adam'}.
2026-06-03 16:29:17,798 - experiment_functions - INFO - Early stopping at epoch 650. Best Metrics: (0.003105807551805569, 0.0013932614374706947, 0.0024540180581641854)
2026-06-03 16:29:18,446 - optuna.study.study - INFO - Trial 200 finished with values: [0.003105807551805569, 0.0013932614374706947, 0.0024540180581641854] and parameters: {'n_layers': 1, 'embedding_dim': 256, 'lr': 0.0013766733587116105, 'lambda_val': 0.02123592780057048, 'batch_size': 2263, 'optimizer': 'Adam'}.
2026-06-03 16:29:49,112 - experiment_functions - INFO - Early stopping at epoch 800. Best Metrics: (0.005239042088382599, 0.0015741174894500637, 0.003417157000696874)
2026-06-03 16:29:49,215 - optuna.study.study - INFO - Trial 201 finished with values: [0.005239042088382599, 0.0015741174894500637, 0.003417157000696874] and parameters: {'n_layers': 1, 'embedding_dim': 32, 'lr': 0.0018644973108911816, 'lambda_val': 0.0006859838564406128, 'batch_size': 3027, 'optimizer': 'Adam'}.
2026-06-03 16:30:21,618 - experiment_functions - INFO - Early stopping at epoch 850. Best Metrics: (0.005212694821401971, 0.0016042601647799585, 0.0033653817579131166)
2026-06-03 16:30:21,708 - optuna.study.study - INFO - Trial 202 finished with values: [0.005212694821401971, 0.0016042601647799585, 0.0033653817579131166] and parameters: {'n_layers': 1, 'embedding_dim': 32, 'lr': 0.0013766733587116105, 'lambda_val': 0.0006859838564406128, 'batch_size': 2263, 'optimizer': 'Adam'}.
2026-06-03 16:30:47,348 - experiment_functions - INFO - Early stopping at epoch 500. Best Metrics: (0.0002847687615401725, 4.353941992095921e-05, 0.00012444214472645264)
2026-06-03 16:30:48,069 - optuna.study.study - INFO - Trial 203 finished with values: [0.0002847687615401725, 4.353941992095921e-05, 0.00012444214472645264] and parameters: {'n_layers': 4, 'embedding_dim': 256, 'lr': 0.00058211761161888, 'lambda_val': 2.697820276812544e-06, 'batch_size': 3046, 'optimizer': 'SGD'}.
2026-06-03 16:31:50,499 - experiment_functions - INFO - Early stopping at epoch 1600. Best Metrics: (0.004609026353105502, 0.0013246031214414898, 0.002993986129773688)
2026-06-03 16:31:50,595 - optuna.study.study - INFO - Trial 204 finished with values: [0.004609026353105502, 0.0013246031214414898, 0.002993986129773688] and parameters: {'n_layers': 2, 'embedding_dim': 96, 'lr': 0.0006158877725370185, 'lambda_val': 3.6015692758113356e-06, 'batch_size': 1314, 'optimizer': 'Adam'}.
2026-06-03 16:32:19,896 - experiment_functions - INFO - Early stopping at epoch 700. Best Metrics: (0.0031935512513080384, 0.0010968584633933953, 0.002254734120620228)
2026-06-03 16:32:19,999 - optuna.study.study - INFO - Trial 205 finished with values: [0.0031935512513080384, 0.0010968584633933953, 0.002254734120620228] and parameters: {'n_layers': 2, 'embedding_dim': 128, 'lr': 0.0018644973108911816, 'lambda_val': 3.6015692758113356e-06, 'batch_size': 569, 'optimizer': 'Adam'}.
2026-06-03 16:34:43,330 - experiment_functions - INFO - Early stopping at epoch 3950. Best Metrics: (0.00214632207467572, 0.0007937571170205641, 0.0015701689072820102)
2026-06-03 16:34:43,421 - optuna.study.study - INFO - Trial 206 finished with values: [0.00214632207467572, 0.0007937571170205641, 0.0015701689072820102] and parameters: {'n_layers': 1, 'embedding_dim': 64, 'lr': 0.01506522012263809, 'lambda_val': 3.6015692758113356e-06, 'batch_size': 2369, 'optimizer': 'RMSprop'}.
2026-06-03 16:35:10,251 - experiment_functions - INFO - Early stopping at epoch 600. Best Metrics: (0.0014730364481997484, 0.0005157746667559783, 0.001004216695582253)
2026-06-03 16:35:11,228 - optuna.study.study - INFO - Trial 207 finished with values: [0.0014730364481997484, 0.0005157746667559783, 0.001004216695582253] and parameters: {'n_layers': 4, 'embedding_dim': 128, 'lr': 0.006315240769324818, 'lambda_val': 8.536566464955742e-05, 'batch_size': 2396, 'optimizer': 'RMSprop'}.
2026-06-03 16:35:41,212 - experiment_functions - INFO - Early stopping at epoch 750. Best Metrics: (0.004822100869111008, 0.001656172550070333, 0.0034830992634301196)
2026-06-03 16:35:41,295 - optuna.study.study - INFO - Trial 208 finished with values: [0.004822100869111008, 0.001656172550070333, 0.0034830992634301196] and parameters: {'n_layers': 1, 'embedding_dim': 96, 'lr': 0.0018644973108911816, 'lambda_val': 2.2072560753305147e-05, 'batch_size': 2217, 'optimizer': 'RMSprop'}.
2026-06-03 16:36:04,883 - experiment_functions - INFO - Early stopping at epoch 600. Best Metrics: (0.0054284968451776714, 0.001617656909371023, 0.0035458893598629892)
2026-06-03 16:36:04,988 - optuna.study.study - INFO - Trial 209 finished with values: [0.0054284968451776714, 0.001617656909371023, 0.0035458893598629892] and parameters: {'n_layers': 1, 'embedding_dim': 32, 'lr': 0.005194863702442923, 'lambda_val': 3.6015692758113356e-06, 'batch_size': 2121, 'optimizer': 'Adam'}.
2026-06-03 16:36:44,604 - experiment_functions - INFO - Early stopping at epoch 1000. Best Metrics: (0.004110518081638359, 0.0015741174894500635, 0.003127013862747219)
2026-06-03 16:36:44,712 - optuna.study.study - INFO - Trial 210 finished with values: [0.004110518081638359, 0.0015741174894500635, 0.003127013862747219] and parameters: {'n_layers': 1, 'embedding_dim': 128, 'lr': 0.0006158877725370185, 'lambda_val': 0.011209840484258635, 'batch_size': 1314, 'optimizer': 'Adam'}.
2026-06-03 16:37:06,983 - experiment_functions - INFO - Early stopping at epoch 550. Best Metrics: (0.004265209036905662, 0.0014954116149775605, 0.003168759094230959)
2026-06-03 16:37:07,427 - optuna.study.study - INFO - Trial 211 finished with values: [0.004265209036905662, 0.0014954116149775605, 0.003168759094230959] and parameters: {'n_layers': 1, 'embedding_dim': 64, 'lr': 0.01506522012263809, 'lambda_val': 2.697820276812544e-06, 'batch_size': 1352, 'optimizer': 'Adam'}.
2026-06-03 16:38:04,557 - experiment_functions - INFO - Early stopping at epoch 1350. Best Metrics: (0.0055087081742684835, 0.001989416571773059, 0.004161589054614104)
2026-06-03 16:38:04,649 - optuna.study.study - INFO - Trial 212 finished with values: [0.0055087081742684835, 0.001989416571773059, 0.004161589054614104] and parameters: {'n_layers': 1, 'embedding_dim': 256, 'lr': 0.0010433155335864835, 'lambda_val': 0.00014066527401303662, 'batch_size': 1195, 'optimizer': 'Adam'}.
2026-06-03 16:40:46,160 - optuna.study.study - INFO - Trial 213 finished with values: [0.0044206376136593445, 0.001585839640967245, 0.003493255278927521] and parameters: {'n_layers': 1, 'embedding_dim': 256, 'lr': 0.0001864832616125299, 'lambda_val': 2.697820276812544e-06, 'batch_size': 1352, 'optimizer': 'RMSprop'}.
2026-06-03 16:41:26,929 - experiment_functions - INFO - Early stopping at epoch 900. Best Metrics: (0.00385710438175567, 0.0013446982383280863, 0.002657069540602617)
2026-06-03 16:41:27,681 - optuna.study.study - INFO - Trial 214 finished with values: [0.00385710438175567, 0.0013446982383280863, 0.002657069540602617] and parameters: {'n_layers': 2, 'embedding_dim': 256, 'lr': 0.0006158877725370185, 'lambda_val': 3.6015692758113356e-06, 'batch_size': 1352, 'optimizer': 'RMSprop'}.
2026-06-03 16:42:31,876 - experiment_functions - INFO - Early stopping at epoch 1650. Best Metrics: (0.0038657054688695635, 0.0013095317837765424, 0.002653030994336793)
2026-06-03 16:42:32,199 - optuna.study.study - INFO - Trial 215 finished with values: [0.0038657054688695635, 0.0013095317837765424, 0.002653030994336793] and parameters: {'n_layers': 2, 'embedding_dim': 96, 'lr': 0.0006158877725370185, 'lambda_val': 3.3358659880322945e-05, 'batch_size': 1314, 'optimizer': 'Adam'}.
2026-06-03 16:42:54,440 - experiment_functions - INFO - Early stopping at epoch 550. Best Metrics: (0.0036701812664500896, 0.0012726907361511153, 0.00251051809726017)
2026-06-03 16:42:54,539 - optuna.study.study - INFO - Trial 216 finished with values: [0.0036701812664500896, 0.0012726907361511153, 0.00251051809726017] and parameters: {'n_layers': 1, 'embedding_dim': 64, 'lr': 0.003549531731861599, 'lambda_val': 2.8232908556860138e-05, 'batch_size': 2782, 'optimizer': 'RMSprop'}.
2026-06-03 16:43:17,667 - experiment_functions - INFO - Early stopping at epoch 500. Best Metrics: (0.000538005061304087, 9.04280259896845e-05, 0.00029962390246067997)
2026-06-03 16:43:17,775 - optuna.study.study - INFO - Trial 217 finished with values: [0.000538005061304087, 9.04280259896845e-05, 0.00029962390246067997] and parameters: {'n_layers': 2, 'embedding_dim': 256, 'lr': 0.005194863702442923, 'lambda_val': 3.6015692758113356e-06, 'batch_size': 1314, 'optimizer': 'SGD'}.
2026-06-03 16:43:39,934 - experiment_functions - INFO - Early stopping at epoch 550. Best Metrics: (0.0022164337232113453, 0.0008121776408332774, 0.0015145531897881926)
2026-06-03 16:43:40,004 - optuna.study.study - INFO - Trial 218 finished with values: [0.0022164337232113453, 0.0008121776408332774, 0.0015145531897881926] and parameters: {'n_layers': 1, 'embedding_dim': 64, 'lr': 0.005194863702442923, 'lambda_val': 0.0015102413658479369, 'batch_size': 2782, 'optimizer': 'RMSprop'}.
2026-06-03 16:44:22,985 - experiment_functions - INFO - Early stopping at epoch 950. Best Metrics: (0.004138901646834721, 0.0014217295197267066, 0.002884192394577628)
2026-06-03 16:44:23,055 - optuna.study.study - INFO - Trial 219 finished with values: [0.004138901646834721, 0.0014217295197267066, 0.002884192394577628] and parameters: {'n_layers': 2, 'embedding_dim': 256, 'lr': 0.0006158877725370185, 'lambda_val': 2.6151941707099572e-05, 'batch_size': 1314, 'optimizer': 'Adam'}.
2026-06-03 16:44:42,778 - experiment_functions - INFO - Early stopping at epoch 500. Best Metrics: (0.0004553208675666078, 6.028535065978968e-05, 0.00020854207888418725)
2026-06-03 16:44:42,880 - optuna.study.study - INFO - Trial 220 finished with values: [0.0004553208675666078, 6.028535065978968e-05, 0.00020854207888418725] and parameters: {'n_layers': 2, 'embedding_dim': 32, 'lr': 0.0018644973108911816, 'lambda_val': 3.6015692758113356e-06, 'batch_size': 2232, 'optimizer': 'SGD'}.
2026-06-03 16:45:06,743 - experiment_functions - INFO - Early stopping at epoch 600. Best Metrics: (0.004670024011203332, 0.001589188827115011, 0.003233794861525138)
2026-06-03 16:45:06,844 - optuna.study.study - INFO - Trial 221 finished with values: [0.004670024011203332, 0.001589188827115011, 0.003233794861525138] and parameters: {'n_layers': 1, 'embedding_dim': 64, 'lr': 0.005194863702442923, 'lambda_val': 0.00033779060812827883, 'batch_size': 2369, 'optimizer': 'Adam'}.
2026-06-03 16:45:53,179 - experiment_functions - INFO - Early stopping at epoch 1150. Best Metrics: (0.003200752258557408, 0.0010767633465067988, 0.0022740950810386106)
2026-06-03 16:45:53,269 - optuna.study.study - INFO - Trial 222 finished with values: [0.003200752258557408, 0.0010767633465067988, 0.0022740950810386106] and parameters: {'n_layers': 2, 'embedding_dim': 128, 'lr': 0.00047049715714108574, 'lambda_val': 0.0006859838564406128, 'batch_size': 2083, 'optimizer': 'RMSprop'}.
2026-06-03 16:46:27,550 - experiment_functions - INFO - Early stopping at epoch 850. Best Metrics: (0.0007844769031201246, 0.00012057070131957936, 0.0003591500742901191)
2026-06-03 16:46:27,642 - optuna.study.study - INFO - Trial 223 finished with values: [0.0007844769031201246, 0.00012057070131957936, 0.0003591500742901191] and parameters: {'n_layers': 4, 'embedding_dim': 64, 'lr': 0.005194863702442923, 'lambda_val': 0.056128447155083847, 'batch_size': 2369, 'optimizer': 'Adam'}.
2026-06-03 16:48:48,241 - experiment_functions - INFO - Early stopping at epoch 3850. Best Metrics: (0.0045819718812361646, 0.001445173822761069, 0.0030356606091135035)
2026-06-03 16:48:48,344 - optuna.study.study - INFO - Trial 224 finished with values: [0.0045819718812361646, 0.001445173822761069, 0.0030356606091135035] and parameters: {'n_layers': 2, 'embedding_dim': 64, 'lr': 0.00027592593816554693, 'lambda_val': 3.8315457306143855e-05, 'batch_size': 1182, 'optimizer': 'RMSprop'}.
2026-06-03 16:49:08,227 - experiment_functions - INFO - Early stopping at epoch 500. Best Metrics: (0.0005614145735721193, 6.530912988143881e-05, 0.000250063403056417)
2026-06-03 16:49:08,510 - optuna.study.study - INFO - Trial 225 finished with values: [0.0005614145735721193, 6.530912988143881e-05, 0.000250063403056417] and parameters: {'n_layers': 1, 'embedding_dim': 32, 'lr': 0.0013766733587116105, 'lambda_val': 2.0098616241177373e-05, 'batch_size': 2263, 'optimizer': 'SGD'}.
2026-06-03 16:49:30,904 - experiment_functions - INFO - Early stopping at epoch 550. Best Metrics: (0.0033647275893658223, 0.0010399222988813719, 0.0021769501746230382)
2026-06-03 16:49:31,005 - optuna.study.study - INFO - Trial 226 finished with values: [0.0033647275893658223, 0.0010399222988813719, 0.0021769501746230382] and parameters: {'n_layers': 2, 'embedding_dim': 64, 'lr': 0.006315240769324818, 'lambda_val': 1.780698705122307e-06, 'batch_size': 3052, 'optimizer': 'Adam'}.
2026-06-03 16:51:54,217 - optuna.study.study - INFO - Trial 227 finished with values: [0.0043385144258149926, 0.0012341750954518052, 0.0027496612566550826] and parameters: {'n_layers': 2, 'embedding_dim': 32, 'lr': 0.00058211761161888, 'lambda_val': 0.0006859838564406128, 'batch_size': 571, 'optimizer': 'Adam'}.
2026-06-03 16:52:18,577 - experiment_functions - INFO - Early stopping at epoch 550. Best Metrics: (0.0021908084228106947, 0.0006581150780360372, 0.0013995828870122789)
2026-06-03 16:52:19,004 - optuna.study.study - INFO - Trial 228 finished with values: [0.0021908084228106947, 0.0006581150780360372, 0.0013995828870122789] and parameters: {'n_layers': 3, 'embedding_dim': 128, 'lr': 0.005194863702442923, 'lambda_val': 3.6015692758113356e-06, 'batch_size': 1314, 'optimizer': 'Adam'}.
2026-06-03 16:54:14,002 - experiment_functions - INFO - Early stopping at epoch 3100. Best Metrics: (0.006013204872164803, 0.0019492263379998658, 0.004095625366119663)
2026-06-03 16:54:14,150 - optuna.study.study - INFO - Trial 229 finished with values: [0.006013204872164803, 0.0019492263379998658, 0.004095625366119663] and parameters: {'n_layers': 1, 'embedding_dim': 96, 'lr': 0.0006158877725370185, 'lambda_val': 0.00014066527401303662, 'batch_size': 1195, 'optimizer': 'RMSprop'}.
2026-06-03 16:56:35,637 - optuna.study.study - INFO - Trial 230 finished with values: [0.002743727316346882, 0.000828923571572108, 0.0018195782079623417] and parameters: {'n_layers': 1, 'embedding_dim': 32, 'lr': 0.0001864832616125299, 'lambda_val': 2.697820276812544e-06, 'batch_size': 2039, 'optimizer': 'RMSprop'}.
2026-06-03 16:56:59,319 - experiment_functions - INFO - Early stopping at epoch 550. Best Metrics: (0.0019496007896783465, 0.000612901065041195, 0.001257496782655914)
2026-06-03 16:56:59,558 - optuna.study.study - INFO - Trial 231 finished with values: [0.0019496007896783465, 0.000612901065041195, 0.001257496782655914] and parameters: {'n_layers': 2, 'embedding_dim': 128, 'lr': 0.01506522012263809, 'lambda_val': 0.0012516819100943332, 'batch_size': 1314, 'optimizer': 'Adam'}.
2026-06-03 16:57:24,553 - experiment_functions - INFO - Early stopping at epoch 600. Best Metrics: (0.004860336599878398, 0.0017583227275771987, 0.0037055470306985635)
2026-06-03 16:57:24,667 - optuna.study.study - INFO - Trial 232 finished with values: [0.004860336599878398, 0.0017583227275771987, 0.0037055470306985635] and parameters: {'n_layers': 1, 'embedding_dim': 128, 'lr': 0.005194863702442923, 'lambda_val': 3.6015692758113356e-06, 'batch_size': 1314, 'optimizer': 'Adam'}.
2026-06-03 16:58:21,874 - experiment_functions - INFO - Early stopping at epoch 1500. Best Metrics: (0.005177144073716415, 0.0017901399959809768, 0.0037551037187981556)
2026-06-03 16:58:22,575 - optuna.study.study - INFO - Trial 233 finished with values: [0.005177144073716415, 0.0017901399959809768, 0.0037551037187981556] and parameters: {'n_layers': 1, 'embedding_dim': 96, 'lr': 0.00058211761161888, 'lambda_val': 3.6015692758113356e-06, 'batch_size': 3046, 'optimizer': 'RMSprop'}.
2026-06-03 17:00:58,663 - experiment_functions - INFO - Early stopping at epoch 3800. Best Metrics: (0.005803045786965637, 0.0020413289570634335, 0.004309000872790063)
2026-06-03 17:00:58,761 - optuna.study.study - INFO - Trial 234 finished with values: [0.005803045786965637, 0.0020413289570634335, 0.004309000872790063] and parameters: {'n_layers': 1, 'embedding_dim': 256, 'lr': 0.0006158877725370185, 'lambda_val': 2.697820276812544e-06, 'batch_size': 1195, 'optimizer': 'Adam'}.
2026-06-03 17:01:48,786 - experiment_functions - INFO - Early stopping at epoch 1350. Best Metrics: (0.005852456353366141, 0.0017214816799517717, 0.003882511268285444)
