2026-06-03 15:43:56,751 - optuna.study.study - INFO - Trial 142 finished with values: [0.0021929677508107084, 0.0006949561256614642, 0.0014897684832719878] and parameters: {'n_layers': 2, 'embedding_dim': 96, 'lr': 0.006315240769324818, 'lambda_val': 1.780698705122307e-06, 'batch_size': 572, 'optimizer': 'RMSprop'}.
2026-06-03 15:44:22,991 - experiment_functions - INFO - Early stopping at epoch 600. Best Metrics: (0.0025292683389741334, 0.0007502176970996048, 0.0015778146850242744)
2026-06-03 15:44:23,478 - optuna.study.study - INFO - Trial 143 finished with values: [0.0025292683389741334, 0.0007502176970996048, 0.0015778146850242744] and parameters: {'n_layers': 3, 'embedding_dim': 128, 'lr': 0.0013766733587116105, 'lambda_val': 2.0098616241177373e-05, 'batch_size': 3896, 'optimizer': 'Adam'}.
2026-06-03 15:46:50,482 - optuna.study.study - INFO - Trial 144 finished with values: [0.005403242191486494, 0.0017650210998727308, 0.0038650930738399073] and parameters: {'n_layers': 1, 'embedding_dim': 64, 'lr': 0.0003870837679520275, 'lambda_val': 8.536566464955742e-05, 'batch_size': 2369, 'optimizer': 'Adam'}.
2026-06-03 15:47:18,622 - experiment_functions - INFO - Early stopping at epoch 550. Best Metrics: (0.001894875756367247, 0.0004873065844999665, 0.001107684994077176)
2026-06-03 15:47:18,696 - optuna.study.study - INFO - Trial 145 finished with values: [0.001894875756367247, 0.0004873065844999665, 0.001107684994077176] and parameters: {'n_layers': 4, 'embedding_dim': 256, 'lr': 0.0018644973108911816, 'lambda_val': 1.944686572038125e-06, 'batch_size': 1865, 'optimizer': 'RMSprop'}.
2026-06-03 15:48:16,439 - experiment_functions - INFO - Early stopping at epoch 1500. Best Metrics: (0.002818340293321052, 0.0008155268269810437, 0.0017785325412284097)
2026-06-03 15:48:16,519 - optuna.study.study - INFO - Trial 146 finished with values: [0.002818340293321052, 0.0008155268269810437, 0.0017785325412284097] and parameters: {'n_layers': 3, 'embedding_dim': 64, 'lr': 0.0006158877725370185, 'lambda_val': 0.0002761722992457223, 'batch_size': 1352, 'optimizer': 'Adam'}.
2026-06-03 15:48:46,661 - experiment_functions - INFO - Early stopping at epoch 700. Best Metrics: (0.0017998692191542275, 0.0006782101949226338, 0.001248462982676046)
2026-06-03 15:48:46,765 - optuna.study.study - INFO - Trial 147 finished with values: [0.0017998692191542275, 0.0006782101949226338, 0.001248462982676046] and parameters: {'n_layers': 3, 'embedding_dim': 128, 'lr': 0.013177047583454147, 'lambda_val': 8.536566464955742e-05, 'batch_size': 2958, 'optimizer': 'RMSprop'}.
2026-06-03 15:51:47,231 - optuna.study.study - INFO - Trial 148 finished with values: [0.002428848238465899, 0.0007971063031683301, 0.0016997534675412425] and parameters: {'n_layers': 3, 'embedding_dim': 256, 'lr': 9.669129164360957e-05, 'lambda_val': 9.660260844818593e-06, 'batch_size': 572, 'optimizer': 'RMSprop'}.
2026-06-03 15:54:11,195 - optuna.study.study - INFO - Trial 149 finished with values: [0.0036894051968197096, 0.001081787125728448, 0.002464154217342502] and parameters: {'n_layers': 2, 'embedding_dim': 32, 'lr': 0.00024535156098645997, 'lambda_val': 0.0006859838564406128, 'batch_size': 3915, 'optimizer': 'RMSprop'}.
2026-06-03 15:55:06,048 - experiment_functions - INFO - Early stopping at epoch 1300. Best Metrics: (0.0050964548552771384, 0.0018671712773795967, 0.00391725241093783)
2026-06-03 15:55:06,148 - optuna.study.study - INFO - Trial 150 finished with values: [0.0050964548552771384, 0.0018671712773795967, 0.00391725241093783] and parameters: {'n_layers': 1, 'embedding_dim': 256, 'lr': 0.00058211761161888, 'lambda_val': 3.6015692758113356e-06, 'batch_size': 3046, 'optimizer': 'Adam'}.
2026-06-03 15:55:52,820 - experiment_functions - INFO - Early stopping at epoch 1250. Best Metrics: (0.003222998587414952, 0.0009930336928126466, 0.0020986739093769463)
2026-06-03 15:55:53,706 - optuna.study.study - INFO - Trial 151 finished with values: [0.003222998587414952, 0.0009930336928126466, 0.0020986739093769463] and parameters: {'n_layers': 2, 'embedding_dim': 32, 'lr': 0.00058211761161888, 'lambda_val': 0.0009043206687018967, 'batch_size': 2552, 'optimizer': 'Adam'}.
2026-06-03 15:56:14,165 - experiment_functions - INFO - Early stopping at epoch 500. Best Metrics: (0.001498438044988071, 0.0002980775671511823, 0.0008789764151167838)
2026-06-03 15:56:14,292 - optuna.study.study - INFO - Trial 152 finished with values: [0.001498438044988071, 0.0002980775671511823, 0.0008789764151167838] and parameters: {'n_layers': 2, 'embedding_dim': 64, 'lr': 0.06575313660194003, 'lambda_val': 0.0015102413658479369, 'batch_size': 2782, 'optimizer': 'RMSprop'}.
2026-06-03 15:56:36,133 - experiment_functions - INFO - Early stopping at epoch 500. Best Metrics: (0.00034636554790930496, 5.526157143814054e-05, 0.00016687375611965045)
2026-06-03 15:56:36,264 - optuna.study.study - INFO - Trial 153 finished with values: [0.00034636554790930496, 5.526157143814054e-05, 0.00016687375611965045] and parameters: {'n_layers': 1, 'embedding_dim': 256, 'lr': 0.0006158877725370185, 'lambda_val': 1.2299853064209968e-05, 'batch_size': 2626, 'optimizer': 'SGD'}.
2026-06-03 15:58:39,719 - experiment_functions - INFO - Early stopping at epoch 3000. Best Metrics: (0.0053603318487759725, 0.0019525755241476322, 0.003993261071975675)
2026-06-03 15:58:39,865 - optuna.study.study - INFO - Trial 154 finished with values: [0.0053603318487759725, 0.0019525755241476322, 0.003993261071975675] and parameters: {'n_layers': 1, 'embedding_dim': 256, 'lr': 0.0006158877725370185, 'lambda_val': 3.6015692758113356e-06, 'batch_size': 1352, 'optimizer': 'Adam'}.
2026-06-03 15:59:02,276 - experiment_functions - INFO - Early stopping at epoch 550. Best Metrics: (0.004411915007862197, 0.0015071337664947417, 0.003029471425175324)
2026-06-03 15:59:02,381 - optuna.study.study - INFO - Trial 155 finished with values: [0.004411915007862197, 0.0015071337664947417, 0.003029471425175324] and parameters: {'n_layers': 1, 'embedding_dim': 64, 'lr': 0.01506522012263809, 'lambda_val': 0.0006859838564406128, 'batch_size': 2369, 'optimizer': 'Adam'}.
2026-06-03 15:59:29,328 - experiment_functions - INFO - Early stopping at epoch 700. Best Metrics: (0.0030061339753825666, 0.0011655167794226002, 0.002081203137215325)
2026-06-03 15:59:29,413 - optuna.study.study - INFO - Trial 156 finished with values: [0.0030061339753825666, 0.0011655167794226002, 0.002081203137215325] and parameters: {'n_layers': 1, 'embedding_dim': 32, 'lr': 0.0013766733587116105, 'lambda_val': 0.02787805142092731, 'batch_size': 2083, 'optimizer': 'Adam'}.
2026-06-03 16:00:08,143 - experiment_functions - INFO - Early stopping at epoch 900. Best Metrics: (0.0050508639981624815, 0.0018035367405720413, 0.0036038977006411055)
2026-06-03 16:00:08,237 - optuna.study.study - INFO - Trial 157 finished with values: [0.0050508639981624815, 0.0018035367405720413, 0.0036038977006411055] and parameters: {'n_layers': 1, 'embedding_dim': 256, 'lr': 0.0010433155335864835, 'lambda_val': 2.6151941707099572e-05, 'batch_size': 1195, 'optimizer': 'RMSprop'}.
2026-06-03 16:00:39,953 - experiment_functions - INFO - Early stopping at epoch 650. Best Metrics: (0.0024256692454089437, 0.0007837095585772658, 0.0017856089561209092)
2026-06-03 16:00:40,046 - optuna.study.study - INFO - Trial 158 finished with values: [0.0024256692454089437, 0.0007837095585772658, 0.0017856089561209092] and parameters: {'n_layers': 3, 'embedding_dim': 256, 'lr': 0.0008281403400701205, 'lambda_val': 0.0015102413658479369, 'batch_size': 2526, 'optimizer': 'Adam'}.
2026-06-03 16:01:00,223 - experiment_functions - INFO - Early stopping at epoch 500. Best Metrics: (0.0005373292807343391, 6.86583160292049e-05, 0.00024420489384233357)
2026-06-03 16:01:00,318 - optuna.study.study - INFO - Trial 159 finished with values: [0.0005373292807343391, 6.86583160292049e-05, 0.00024420489384233357] and parameters: {'n_layers': 3, 'embedding_dim': 32, 'lr': 0.0008281403400701205, 'lambda_val': 0.0015102413658479369, 'batch_size': 2782, 'optimizer': 'SGD'}.
2026-06-03 16:01:42,872 - experiment_functions - INFO - Early stopping at epoch 900. Best Metrics: (0.0019981836531062207, 0.0006731864157009846, 0.0013907781954555515)
2026-06-03 16:01:42,968 - optuna.study.study - INFO - Trial 160 finished with values: [0.0019981836531062207, 0.0006731864157009846, 0.0013907781954555515] and parameters: {'n_layers': 3, 'embedding_dim': 256, 'lr': 0.001848714723795852, 'lambda_val': 5.479001466553638e-06, 'batch_size': 2215, 'optimizer': 'RMSprop'}.
2026-06-03 16:02:06,592 - experiment_functions - INFO - Early stopping at epoch 550. Best Metrics: (0.00186965253001201, 0.0006179248442628443, 0.0013025681991361915)
2026-06-03 16:02:06,688 - optuna.study.study - INFO - Trial 161 finished with values: [0.00186965253001201, 0.0006179248442628443, 0.0013025681991361915] and parameters: {'n_layers': 2, 'embedding_dim': 128, 'lr': 0.01585163849319074, 'lambda_val': 0.0006859838564406128, 'batch_size': 2094, 'optimizer': 'Adam'}.
2026-06-03 16:02:38,178 - experiment_functions - INFO - Early stopping at epoch 650. Best Metrics: (0.002095218124344856, 0.0006631388572576866, 0.0014950331580386145)
2026-06-03 16:02:38,259 - optuna.study.study - INFO - Trial 162 finished with values: [0.002095218124344856, 0.0006631388572576866, 0.0014950331580386145] and parameters: {'n_layers': 3, 'embedding_dim': 256, 'lr': 0.00058211761161888, 'lambda_val': 0.0009043206687018967, 'batch_size': 3046, 'optimizer': 'RMSprop'}.
2026-06-03 16:03:17,009 - experiment_functions - INFO - Early stopping at epoch 1000. Best Metrics: (0.0038473883726135917, 0.0011387232902404715, 0.0025171788910940134)
2026-06-03 16:03:17,104 - optuna.study.study - INFO - Trial 163 finished with values: [0.0038473883726135917, 0.0011387232902404715, 0.0025171788910940134] and parameters: {'n_layers': 2, 'embedding_dim': 64, 'lr': 0.0006158877725370185, 'lambda_val': 0.0013421723548407416, 'batch_size': 1352, 'optimizer': 'Adam'}.
2026-06-03 16:03:39,722 - experiment_functions - INFO - Early stopping at epoch 550. Best Metrics: (0.0035085824019463474, 0.001155469220979302, 0.002493252784532811)
2026-06-03 16:03:39,809 - optuna.study.study - INFO - Trial 164 finished with values: [0.0035085824019463474, 0.001155469220979302, 0.002493252784532811] and parameters: {'n_layers': 2, 'embedding_dim': 64, 'lr': 0.006315240769324818, 'lambda_val': 1.780698705122307e-06, 'batch_size': 3052, 'optimizer': 'Adam'}.
2026-06-03 16:04:45,856 - experiment_functions - INFO - Early stopping at epoch 1700. Best Metrics: (0.004300027960215556, 0.0012676669569294662, 0.002792584069488131)
2026-06-03 16:04:45,937 - optuna.study.study - INFO - Trial 165 finished with values: [0.004300027960215556, 0.0012676669569294662, 0.002792584069488131] and parameters: {'n_layers': 2, 'embedding_dim': 96, 'lr': 0.0006158877725370185, 'lambda_val': 3.6015692758113356e-06, 'batch_size': 1314, 'optimizer': 'Adam'}.
2026-06-03 16:05:09,870 - experiment_functions - INFO - Early stopping at epoch 600. Best Metrics: (0.004852667069186886, 0.001701386563065175, 0.0035276974740010136)
2026-06-03 16:05:09,999 - optuna.study.study - INFO - Trial 166 finished with values: [0.004852667069186886, 0.001701386563065175, 0.0035276974740010136] and parameters: {'n_layers': 1, 'embedding_dim': 64, 'lr': 0.005194863702442923, 'lambda_val': 3.6015692758113356e-06, 'batch_size': 2369, 'optimizer': 'Adam'}.
2026-06-03 16:05:45,032 - experiment_functions - INFO - Early stopping at epoch 850. Best Metrics: (0.002861637192237297, 0.001013128809699243, 0.0020095329856380474)
2026-06-03 16:05:45,445 - optuna.study.study - INFO - Trial 167 finished with values: [0.002861637192237297, 0.001013128809699243, 0.0020095329856380474] and parameters: {'n_layers': 2, 'embedding_dim': 128, 'lr': 0.0006158877725370185, 'lambda_val': 3.6015692758113356e-06, 'batch_size': 3445, 'optimizer': 'Adam'}.
2026-06-03 16:06:26,047 - experiment_functions - INFO - Early stopping at epoch 950. Best Metrics: (0.0028744111915505496, 0.0012827382945944134, 0.002270871940191779)
2026-06-03 16:06:26,612 - optuna.study.study - INFO - Trial 168 finished with values: [0.0028744111915505496, 0.0012827382945944134, 0.002270871940191779] and parameters: {'n_layers': 1, 'embedding_dim': 256, 'lr': 0.0006158877725370185, 'lambda_val': 0.025990812764396166, 'batch_size': 1195, 'optimizer': 'Adam'}.
2026-06-03 16:07:54,367 - experiment_functions - INFO - Early stopping at epoch 2350. Best Metrics: (0.004586660493159027, 0.00134134905218032, 0.00301350477636936)
2026-06-03 16:07:54,449 - optuna.study.study - INFO - Trial 169 finished with values: [0.004586660493159027, 0.00134134905218032, 0.00301350477636936] and parameters: {'n_layers': 2, 'embedding_dim': 64, 'lr': 0.00058211761161888, 'lambda_val': 2.2072560753305147e-05, 'batch_size': 571, 'optimizer': 'Adam'}.
2026-06-03 16:08:18,664 - experiment_functions - INFO - Early stopping at epoch 550. Best Metrics: (0.0024906212632138888, 0.001008105030477594, 0.001920697504932767)
2026-06-03 16:08:18,744 - optuna.study.study - INFO - Trial 170 finished with values: [0.0024906212632138888, 0.001008105030477594, 0.001920697504932767] and parameters: {'n_layers': 1, 'embedding_dim': 256, 'lr': 0.0018644973108911816, 'lambda_val': 0.011209840484258635, 'batch_size': 2215, 'optimizer': 'RMSprop'}.
2026-06-03 16:08:40,654 - experiment_functions - INFO - Early stopping at epoch 500. Best Metrics: (0.00045824480146939786, 7.200750217697099e-05, 0.00018841438401275793)
2026-06-03 16:08:40,718 - optuna.study.study - INFO - Trial 171 finished with values: [0.00045824480146939786, 7.200750217697099e-05, 0.00018841438401275793] and parameters: {'n_layers': 1, 'embedding_dim': 256, 'lr': 0.0006158877725370185, 'lambda_val': 9.660260844818593e-06, 'batch_size': 1195, 'optimizer': 'SGD'}.
2026-06-03 16:09:02,447 - experiment_functions - INFO - Early stopping at epoch 500. Best Metrics: (0.00047548959876835635, 5.358697836425748e-05, 0.00019731108883461242)
2026-06-03 16:09:02,517 - optuna.study.study - INFO - Trial 172 finished with values: [0.00047548959876835635, 5.358697836425748e-05, 0.00019731108883461242] and parameters: {'n_layers': 1, 'embedding_dim': 256, 'lr': 0.0006158877725370185, 'lambda_val': 0.00022250083118396295, 'batch_size': 1352, 'optimizer': 'SGD'}.
2026-06-03 16:09:26,943 - experiment_functions - INFO - Early stopping at epoch 550. Best Metrics: (0.0016291129823085338, 0.0005978297273762476, 0.001158198266947183)
2026-06-03 16:09:27,027 - optuna.study.study - INFO - Trial 173 finished with values: [0.0016291129823085338, 0.0005978297273762476, 0.001158198266947183] and parameters: {'n_layers': 1, 'embedding_dim': 256, 'lr': 0.08162930175773236, 'lambda_val': 1.2299853064209968e-05, 'batch_size': 1352, 'optimizer': 'Adam'}.
2026-06-03 16:10:29,900 - experiment_functions - INFO - Early stopping at epoch 1650. Best Metrics: (0.0018798621176175456, 0.0005057271083126801, 0.0011799893920267385)
2026-06-03 16:10:29,975 - optuna.study.study - INFO - Trial 174 finished with values: [0.0018798621176175456, 0.0005057271083126801, 0.0011799893920267385] and parameters: {'n_layers': 3, 'embedding_dim': 64, 'lr': 0.00024535156098645997, 'lambda_val': 0.009032069950182213, 'batch_size': 1865, 'optimizer': 'RMSprop'}.
2026-06-03 16:10:53,878 - experiment_functions - INFO - Early stopping at epoch 600. Best Metrics: (0.004645174597923469, 0.0017348784245428365, 0.0034330412969921513)
2026-06-03 16:10:53,971 - optuna.study.study - INFO - Trial 175 finished with values: [0.004645174597923469, 0.0017348784245428365, 0.0034330412969921513] and parameters: {'n_layers': 1, 'embedding_dim': 64, 'lr': 0.006315240769324818, 'lambda_val': 8.536566464955742e-05, 'batch_size': 2369, 'optimizer': 'Adam'}.
2026-06-03 16:13:21,393 - optuna.study.study - INFO - Trial 176 finished with values: [0.004725928899984272, 0.0013614441690669168, 0.003224460034162174] and parameters: {'n_layers': 2, 'embedding_dim': 64, 'lr': 0.00027592593816554693, 'lambda_val': 3.8315457306143855e-05, 'batch_size': 1182, 'optimizer': 'RMSprop'}.
2026-06-03 16:13:41,504 - experiment_functions - INFO - Early stopping at epoch 500. Best Metrics: (0.00027967819121313306, 5.526157143814053e-05, 0.00015686595790309775)
2026-06-03 16:13:41,625 - optuna.study.study - INFO - Trial 177 finished with values: [0.00027967819121313306, 5.526157143814053e-05, 0.00015686595790309775] and parameters: {'n_layers': 1, 'embedding_dim': 64, 'lr': 0.00024535156098645997, 'lambda_val': 0.0414807286300203, 'batch_size': 2782, 'optimizer': 'SGD'}.
2026-06-03 16:14:34,662 - experiment_functions - INFO - Early stopping at epoch 1400. Best Metrics: (0.0018419117671354475, 0.0007468685109518387, 0.0014351425068106934)
2026-06-03 16:14:34,799 - optuna.study.study - INFO - Trial 178 finished with values: [0.0018419117671354475, 0.0007468685109518387, 0.0014351425068106934] and parameters: {'n_layers': 2, 'embedding_dim': 64, 'lr': 0.014207108552616627, 'lambda_val': 3.8315457306143855e-05, 'batch_size': 1182, 'optimizer': 'RMSprop'}.
2026-06-03 16:17:36,568 - optuna.study.study - INFO - Trial 179 finished with values: [0.004139385567930522, 0.0013664679482885658, 0.0030130554566104176] and parameters: {'n_layers': 3, 'embedding_dim': 256, 'lr': 0.0001864832616125299, 'lambda_val': 2.697820276812544e-06, 'batch_size': 1352, 'optimizer': 'RMSprop'}.
2026-06-03 16:18:26,647 - experiment_functions - INFO - Early stopping at epoch 1350. Best Metrics: (0.006080592589772733, 0.0017583227275771987, 0.004136890704963386)
2026-06-03 16:18:26,736 - optuna.study.study - INFO - Trial 180 finished with values: [0.006080592589772733, 0.0017583227275771987, 0.004136890704963386] and parameters: {'n_layers': 1, 'embedding_dim': 32, 'lr': 0.0018644973108911816, 'lambda_val': 3.6015692758113356e-06, 'batch_size': 569, 'optimizer': 'Adam'}.
2026-06-03 16:19:23,106 - experiment_functions - INFO - Early stopping at epoch 1150. Best Metrics: (0.0010432221588469188, 0.0004923303637216157, 0.0008465397145079237)
2026-06-03 16:19:23,237 - optuna.study.study - INFO - Trial 181 finished with values: [0.0010432221588469188, 0.0004923303637216157, 0.0008465397145079237] and parameters: {'n_layers': 4, 'embedding_dim': 256, 'lr': 0.006315240769324818, 'lambda_val': 0.0006859838564406128, 'batch_size': 3052, 'optimizer': 'RMSprop'}.
2026-06-03 16:20:53,584 - experiment_functions - INFO - Early stopping at epoch 2200. Best Metrics: (0.0006003355973687617, 8.875343291580146e-05, 0.00026491595124733774)
2026-06-03 16:20:53,927 - optuna.study.study - INFO - Trial 182 finished with values: [0.0006003355973687617, 8.875343291580146e-05, 0.00026491595124733774] and parameters: {'n_layers': 1, 'embedding_dim': 256, 'lr': 9.669129164360957e-05, 'lambda_val': 9.660260844818593e-06, 'batch_size': 572, 'optimizer': 'Adam'}.
2026-06-03 16:21:22,961 - experiment_functions - INFO - Early stopping at epoch 650. Best Metrics: (0.003203345816299182, 0.0014418246366133028, 0.002610866125711212)
2026-06-03 16:21:23,048 - optuna.study.study - INFO - Trial 183 finished with values: [0.003203345816299182, 0.0014418246366133028, 0.002610866125711212] and parameters: {'n_layers': 1, 'embedding_dim': 256, 'lr': 0.0013766733587116105, 'lambda_val': 0.016674570642215843, 'batch_size': 2369, 'optimizer': 'Adam'}.
2026-06-03 16:21:49,956 - experiment_functions - INFO - Early stopping at epoch 700. Best Metrics: (0.0053880067566872605, 0.001446848415834952, 0.0034085965713278005)
2026-06-03 16:21:50,147 - optuna.study.study - INFO - Trial 184 finished with values: [0.0053880067566872605, 0.001446848415834952, 0.0034085965713278005] and parameters: {'n_layers': 1, 'embedding_dim': 32, 'lr': 0.0018644973108911816, 'lambda_val': 2.2072560753305147e-05, 'batch_size': 981, 'optimizer': 'RMSprop'}.
2026-06-03 16:22:13,255 - experiment_functions - INFO - Early stopping at epoch 550. Best Metrics: (0.003494183305180718, 0.0013848884721012794, 0.002655671477735452)
2026-06-03 16:22:13,353 - optuna.study.study - INFO - Trial 185 finished with values: [0.003494183305180718, 0.0013848884721012794, 0.002655671477735452] and parameters: {'n_layers': 1, 'embedding_dim': 128, 'lr': 0.005194863702442923, 'lambda_val': 0.011209840484258635, 'batch_size': 1314, 'optimizer': 'Adam'}.
2026-06-03 16:22:45,772 - experiment_functions - INFO - Early stopping at epoch 850. Best Metrics: (0.0054480471880673275, 0.001585839640967245, 0.003517207064497581)
2026-06-03 16:22:45,864 - optuna.study.study - INFO - Trial 186 finished with values: [0.0054480471880673275, 0.001585839640967245, 0.003517207064497581] and parameters: {'n_layers': 1, 'embedding_dim': 32, 'lr': 0.0018644973108911816, 'lambda_val': 0.0006859838564406128, 'batch_size': 1352, 'optimizer': 'Adam'}.
2026-06-03 16:23:10,780 - experiment_functions - INFO - Early stopping at epoch 600. Best Metrics: (0.004423662786402379, 0.0015992363855583096, 0.003204075161517236)
2026-06-03 16:23:10,872 - optuna.study.study - INFO - Trial 187 finished with values: [0.004423662786402379, 0.0015992363855583096, 0.003204075161517236] and parameters: {'n_layers': 1, 'embedding_dim': 128, 'lr': 0.0018644973108911816, 'lambda_val': 1.5212624452962504e-06, 'batch_size': 2232, 'optimizer': 'RMSprop'}.
2026-06-03 16:23:31,130 - experiment_functions - INFO - Early stopping at epoch 500. Best Metrics: (0.0004702177116601103, 8.038046754638624e-05, 0.00021828218799494807)
2026-06-03 16:23:31,431 - optuna.study.study - INFO - Trial 188 finished with values: [0.0004702177116601103, 8.038046754638624e-05, 0.00021828218799494807] and parameters: {'n_layers': 1, 'embedding_dim': 96, 'lr': 0.008051524614722692, 'lambda_val': 0.001214972879722574, 'batch_size': 1352, 'optimizer': 'SGD'}.
2026-06-03 16:23:54,316 - experiment_functions - INFO - Early stopping at epoch 550. Best Metrics: (0.0025301013676565388, 0.0006983053118092304, 0.001550140435015445)
