2026-06-06 00:48:52,441 - optuna.study.study - INFO - Trial 156 finished with values: [0.040167741586236726, 0.004724027061424075, 0.01833409556626856] and parameters: {'n_layers': 2, 'embedding_dim': 64, 'lr': 0.003797813989642158, 'lambda_val': 0.0002470779691093862, 'batch_size': 1941, 'optimizer': 'RMSprop'}.
2026-06-06 00:49:23,117 - experiment_functions - INFO - Early stopping at epoch 700. Best Metrics: (0.05052676619848184, 0.0062512559448054126, 0.02424571995994016)
2026-06-06 00:49:23,192 - optuna.study.study - INFO - Trial 157 finished with values: [0.05052676619848184, 0.0062512559448054126, 0.02424571995994016] and parameters: {'n_layers': 3, 'embedding_dim': 64, 'lr': 0.0025949620955328543, 'lambda_val': 0.0002535337009555308, 'batch_size': 2788, 'optimizer': 'Adam'}.
2026-06-06 00:50:27,897 - experiment_functions - INFO - Early stopping at epoch 1500. Best Metrics: (0.07743686648484382, 0.009381070399892827, 0.03934121945162578)
2026-06-06 00:50:28,409 - optuna.study.study - INFO - Trial 158 finished with values: [0.07743686648484382, 0.009381070399892827, 0.03934121945162578] and parameters: {'n_layers': 2, 'embedding_dim': 96, 'lr': 0.0013657829614293975, 'lambda_val': 1.9645451789230886e-06, 'batch_size': 2005, 'optimizer': 'Adam'}.
2026-06-06 00:53:12,912 - optuna.study.study - INFO - Trial 159 finished with values: [0.0950882700330696, 0.011646794828856588, 0.04961101274026779] and parameters: {'n_layers': 1, 'embedding_dim': 96, 'lr': 0.0011525517839870857, 'lambda_val': 2.80429275845163e-06, 'batch_size': 3853, 'optimizer': 'Adam'}.
2026-06-06 00:54:06,517 - experiment_functions - INFO - Early stopping at epoch 1150. Best Metrics: (0.04875563274656927, 0.005948154598432582, 0.023495272658158824)
2026-06-06 00:54:06,632 - optuna.study.study - INFO - Trial 160 finished with values: [0.04875563274656927, 0.005948154598432582, 0.023495272658158824] and parameters: {'n_layers': 4, 'embedding_dim': 96, 'lr': 0.0008375189225934038, 'lambda_val': 1.9645451789230886e-06, 'batch_size': 3734, 'optimizer': 'Adam'}.
2026-06-06 00:56:53,461 - optuna.study.study - INFO - Trial 161 finished with values: [0.06709181591354586, 0.008033022975416974, 0.03331672746546161] and parameters: {'n_layers': 3, 'embedding_dim': 64, 'lr': 0.0006492139755404522, 'lambda_val': 1.2264285179082735e-06, 'batch_size': 3383, 'optimizer': 'Adam'}.
2026-06-06 00:57:15,049 - experiment_functions - INFO - Early stopping at epoch 500. Best Metrics: (0.00046234313887324357, 8.540424676803537e-05, 0.00020418728096247468)
2026-06-06 00:57:15,242 - optuna.study.study - INFO - Trial 162 finished with values: [0.00046234313887324357, 8.540424676803537e-05, 0.00020418728096247468] and parameters: {'n_layers': 1, 'embedding_dim': 128, 'lr': 0.003797813989642158, 'lambda_val': 0.007710635522261197, 'batch_size': 4018, 'optimizer': 'SGD'}.
2026-06-06 00:59:51,282 - optuna.study.study - INFO - Trial 163 finished with values: [0.027356137281814945, 0.004194855650077032, 0.01675349248875295] and parameters: {'n_layers': 1, 'embedding_dim': 96, 'lr': 0.0006492139755404522, 'lambda_val': 0.0002471252740752473, 'batch_size': 755, 'optimizer': 'RMSprop'}.
2026-06-06 01:02:23,742 - optuna.study.study - INFO - Trial 164 finished with values: [0.0003992217215697226, 7.368209525085404e-05, 0.00018148131925780234] and parameters: {'n_layers': 2, 'embedding_dim': 64, 'lr': 0.00010102349623159513, 'lambda_val': 1.34010871294427e-05, 'batch_size': 2005, 'optimizer': 'Adam'}.
2026-06-06 01:03:43,620 - experiment_functions - INFO - Early stopping at epoch 2000. Best Metrics: (0.08138865494612604, 0.009870051577466675, 0.04272376900571076)
2026-06-06 01:03:43,723 - optuna.study.study - INFO - Trial 165 finished with values: [0.08138865494612604, 0.009870051577466675, 0.04272376900571076] and parameters: {'n_layers': 1, 'embedding_dim': 64, 'lr': 0.003797813989642158, 'lambda_val': 2.80429275845163e-06, 'batch_size': 738, 'optimizer': 'Adam'}.
2026-06-06 01:06:21,621 - optuna.study.study - INFO - Trial 166 finished with values: [0.04971580072454782, 0.007168932949293321, 0.028462186959084784] and parameters: {'n_layers': 1, 'embedding_dim': 96, 'lr': 0.0006492139755404522, 'lambda_val': 1.9645451789230886e-06, 'batch_size': 1890, 'optimizer': 'Adam'}.
2026-06-06 01:09:01,031 - optuna.study.study - INFO - Trial 167 finished with values: [0.08863978304257035, 0.011125996382878962, 0.04735594893494795] and parameters: {'n_layers': 1, 'embedding_dim': 64, 'lr': 0.0011525517839870857, 'lambda_val': 7.4032238942432714e-06, 'batch_size': 2901, 'optimizer': 'Adam'}.
2026-06-06 01:11:48,297 - optuna.study.study - INFO - Trial 168 finished with values: [0.06900318953176005, 0.008190434724361978, 0.034290154764569564] and parameters: {'n_layers': 3, 'embedding_dim': 64, 'lr': 0.0005984874691553314, 'lambda_val': 1.5838623830328296e-05, 'batch_size': 3853, 'optimizer': 'Adam'}.
2026-06-06 01:12:48,065 - experiment_functions - INFO - Early stopping at epoch 1400. Best Metrics: (0.08052668878899816, 0.00978967110992029, 0.04127967440156182)
2026-06-06 01:12:53,575 - optuna.study.study - INFO - Trial 169 finished with values: [0.08052668878899816, 0.00978967110992029, 0.04127967440156182] and parameters: {'n_layers': 1, 'embedding_dim': 128, 'lr': 0.0025949620955328543, 'lambda_val': 1.9645451789230886e-06, 'batch_size': 1890, 'optimizer': 'RMSprop'}.
2026-06-06 01:13:18,144 - experiment_functions - INFO - Early stopping at epoch 550. Best Metrics: (0.04447167710291309, 0.00612901065041195, 0.02427821726294493)
2026-06-06 01:13:18,253 - optuna.study.study - INFO - Trial 170 finished with values: [0.04447167710291309, 0.00612901065041195, 0.02427821726294493] and parameters: {'n_layers': 1, 'embedding_dim': 128, 'lr': 0.018992580146226075, 'lambda_val': 1.5618350584822937e-05, 'batch_size': 2901, 'optimizer': 'Adam'}.
2026-06-06 01:16:21,542 - optuna.study.study - INFO - Trial 171 finished with values: [0.08478870079479409, 0.01088318038716592, 0.04589776259315488] and parameters: {'n_layers': 1, 'embedding_dim': 256, 'lr': 0.0006492139755404522, 'lambda_val': 2.80429275845163e-06, 'batch_size': 3786, 'optimizer': 'Adam'}.
2026-06-06 01:16:59,512 - experiment_functions - INFO - Early stopping at epoch 900. Best Metrics: (0.06577271178988643, 0.007818675061959943, 0.03343988077106655)
2026-06-06 01:16:59,895 - optuna.study.study - INFO - Trial 172 finished with values: [0.06577271178988643, 0.007818675061959943, 0.03343988077106655] and parameters: {'n_layers': 1, 'embedding_dim': 96, 'lr': 0.007650229911234196, 'lambda_val': 2.80429275845163e-06, 'batch_size': 1266, 'optimizer': 'Adam'}.
2026-06-06 01:17:39,426 - experiment_functions - INFO - Early stopping at epoch 850. Best Metrics: (0.0806756432348732, 0.009915265590461518, 0.04204934790280626)
2026-06-06 01:17:39,684 - optuna.study.study - INFO - Trial 173 finished with values: [0.0806756432348732, 0.009915265590461518, 0.04204934790280626] and parameters: {'n_layers': 1, 'embedding_dim': 128, 'lr': 0.003918670659096881, 'lambda_val': 3.1920449116234754e-05, 'batch_size': 3853, 'optimizer': 'Adam'}.
2026-06-06 01:20:17,114 - optuna.study.study - INFO - Trial 174 finished with values: [0.06643700756193212, 0.00835454484560252, 0.03615533502243247] and parameters: {'n_layers': 2, 'embedding_dim': 32, 'lr': 0.0008375189225934038, 'lambda_val': 5.314912869017192e-05, 'batch_size': 1281, 'optimizer': 'Adam'}.
2026-06-06 01:23:07,269 - optuna.study.study - INFO - Trial 175 finished with values: [0.07727841821109918, 0.009592069127202089, 0.04209305329442764] and parameters: {'n_layers': 2, 'embedding_dim': 96, 'lr': 0.0008375189225934038, 'lambda_val': 1.9645451789230886e-06, 'batch_size': 1094, 'optimizer': 'Adam'}.
2026-06-06 01:26:11,498 - optuna.study.study - INFO - Trial 176 finished with values: [0.07841396030616636, 0.010255207984459776, 0.043199468217048204] and parameters: {'n_layers': 1, 'embedding_dim': 256, 'lr': 0.0006492139755404522, 'lambda_val': 2.7872631749241567e-05, 'batch_size': 2901, 'optimizer': 'Adam'}.
2026-06-06 01:29:09,533 - optuna.study.study - INFO - Trial 177 finished with values: [0.024929543982668757, 0.0039888807019894165, 0.014812802131179028] and parameters: {'n_layers': 1, 'embedding_dim': 256, 'lr': 0.0006492139755404522, 'lambda_val': 3.3599958466912935e-05, 'batch_size': 853, 'optimizer': 'Adam'}.
2026-06-06 01:29:42,091 - experiment_functions - INFO - Early stopping at epoch 750. Best Metrics: (0.0003470154425193737, 7.2007502176971e-05, 0.00016837170435494284)
2026-06-06 01:29:42,720 - optuna.study.study - INFO - Trial 178 finished with values: [0.0003470154425193737, 7.2007502176971e-05, 0.00016837170435494284] and parameters: {'n_layers': 1, 'embedding_dim': 128, 'lr': 0.04924173954466515, 'lambda_val': 1.9645451789230886e-06, 'batch_size': 1487, 'optimizer': 'SGD'}.
2026-06-06 01:32:34,372 - optuna.study.study - INFO - Trial 179 finished with values: [0.05010706086699446, 0.006108915533525354, 0.024353839911912794] and parameters: {'n_layers': 4, 'embedding_dim': 64, 'lr': 0.00034607757694671775, 'lambda_val': 1.5838623830328296e-05, 'batch_size': 3533, 'optimizer': 'Adam'}.
2026-06-06 01:32:55,633 - experiment_functions - INFO - Early stopping at epoch 500. Best Metrics: (0.0005269754552760732, 6.698372295532186e-05, 0.0002381091668316006)
2026-06-06 01:32:56,698 - optuna.study.study - INFO - Trial 180 finished with values: [0.0005269754552760732, 6.698372295532186e-05, 0.0002381091668316006] and parameters: {'n_layers': 1, 'embedding_dim': 96, 'lr': 0.00034607757694671775, 'lambda_val': 1.5838623830328296e-05, 'batch_size': 1890, 'optimizer': 'SGD'}.
2026-06-06 01:36:17,777 - optuna.study.study - INFO - Trial 181 finished with values: [0.07279931669535793, 0.009275571036238195, 0.040206676446684464] and parameters: {'n_layers': 2, 'embedding_dim': 256, 'lr': 0.0005984874691553314, 'lambda_val': 9.945068556655057e-06, 'batch_size': 975, 'optimizer': 'Adam'}.
2026-06-06 01:39:41,942 - optuna.study.study - INFO - Trial 182 finished with values: [0.08479026095793409, 0.009998995244155673, 0.04272050972752967] and parameters: {'n_layers': 2, 'embedding_dim': 256, 'lr': 0.0008375189225934038, 'lambda_val': 1.482563488933184e-06, 'batch_size': 2005, 'optimizer': 'RMSprop'}.
2026-06-06 01:40:13,224 - experiment_functions - INFO - Early stopping at epoch 700. Best Metrics: (0.07219201379032564, 0.008805010382477059, 0.03753164619189262)
2026-06-06 01:40:13,582 - optuna.study.study - INFO - Trial 183 finished with values: [0.07219201379032564, 0.008805010382477059, 0.03753164619189262] and parameters: {'n_layers': 1, 'embedding_dim': 64, 'lr': 0.007650229911234196, 'lambda_val': 1.5838623830328296e-05, 'batch_size': 3533, 'optimizer': 'Adam'}.
2026-06-06 01:40:41,289 - experiment_functions - INFO - Early stopping at epoch 550. Best Metrics: (0.033936437942522435, 0.0038967780829258494, 0.01562992512044011)
2026-06-06 01:40:41,935 - optuna.study.study - INFO - Trial 184 finished with values: [0.033936437942522435, 0.0038967780829258494, 0.01562992512044011] and parameters: {'n_layers': 2, 'embedding_dim': 128, 'lr': 0.023789324911773227, 'lambda_val': 1.9645451789230886e-06, 'batch_size': 2005, 'optimizer': 'Adam'}.
2026-06-06 01:41:19,414 - experiment_functions - INFO - Early stopping at epoch 800. Best Metrics: (0.06847806340460422, 0.00844832205773997, 0.035712903718792176)
2026-06-06 01:41:19,795 - optuna.study.study - INFO - Trial 185 finished with values: [0.06847806340460422, 0.00844832205773997, 0.035712903718792176] and parameters: {'n_layers': 2, 'embedding_dim': 96, 'lr': 0.0025949620955328543, 'lambda_val': 1.9645451789230886e-06, 'batch_size': 1890, 'optimizer': 'Adam'}.
2026-06-06 01:44:04,333 - optuna.study.study - INFO - Trial 186 finished with values: [0.08679808603488233, 0.01061524549534463, 0.0459463888067361] and parameters: {'n_layers': 1, 'embedding_dim': 96, 'lr': 0.0025949620955328543, 'lambda_val': 1.9645451789230886e-06, 'batch_size': 738, 'optimizer': 'Adam'}.
2026-06-06 01:46:40,962 - optuna.study.study - INFO - Trial 187 finished with values: [0.08276209639322268, 0.010248509612164246, 0.04445944495518992] and parameters: {'n_layers': 1, 'embedding_dim': 32, 'lr': 0.0025949620955328543, 'lambda_val': 5.314912869017192e-05, 'batch_size': 755, 'optimizer': 'Adam'}.
2026-06-06 01:47:07,143 - experiment_functions - INFO - Early stopping at epoch 550. Best Metrics: (0.031152057879120402, 0.003675731797173287, 0.015017518799239332)
2026-06-06 01:47:07,980 - optuna.study.study - INFO - Trial 188 finished with values: [0.031152057879120402, 0.003675731797173287, 0.015017518799239332] and parameters: {'n_layers': 2, 'embedding_dim': 96, 'lr': 0.039140660639623195, 'lambda_val': 1.482563488933184e-06, 'batch_size': 2005, 'optimizer': 'Adam'}.
2026-06-06 01:47:38,943 - experiment_functions - INFO - Early stopping at epoch 650. Best Metrics: (0.07091395517469756, 0.009098064170406593, 0.037074799948598414)
2026-06-06 01:47:40,475 - optuna.study.study - INFO - Trial 189 finished with values: [0.07091395517469756, 0.009098064170406593, 0.037074799948598414] and parameters: {'n_layers': 1, 'embedding_dim': 128, 'lr': 0.007650229911234196, 'lambda_val': 1.0229781127321935e-05, 'batch_size': 2901, 'optimizer': 'Adam'}.
2026-06-06 01:48:25,220 - experiment_functions - INFO - Early stopping at epoch 950. Best Metrics: (0.05565746267546977, 0.006626364793355215, 0.027259326167656216)
2026-06-06 01:48:25,550 - optuna.study.study - INFO - Trial 190 finished with values: [0.05565746267546977, 0.006626364793355215, 0.027259326167656216] and parameters: {'n_layers': 3, 'embedding_dim': 96, 'lr': 0.0011525517839870857, 'lambda_val': 3.1920449116234754e-05, 'batch_size': 3853, 'optimizer': 'RMSprop'}.
2026-06-06 01:49:33,450 - experiment_functions - INFO - Early stopping at epoch 1650. Best Metrics: (0.07061341955434053, 0.008331100542568156, 0.034946348399078946)
2026-06-06 01:49:34,036 - optuna.study.study - INFO - Trial 191 finished with values: [0.07061341955434053, 0.008331100542568156, 0.034946348399078946] and parameters: {'n_layers': 1, 'embedding_dim': 64, 'lr': 0.003797813989642158, 'lambda_val': 1.2264285179082735e-06, 'batch_size': 1841, 'optimizer': 'RMSprop'}.
2026-06-06 01:52:14,933 - optuna.study.study - INFO - Trial 192 finished with values: [0.05793378417324518, 0.00805814187152522, 0.033640582110340864] and parameters: {'n_layers': 1, 'embedding_dim': 96, 'lr': 0.00047846492423548573, 'lambda_val': 3.1920449116234754e-05, 'batch_size': 3853, 'optimizer': 'RMSprop'}.
2026-06-06 01:52:36,694 - experiment_functions - INFO - Early stopping at epoch 500. Best Metrics: (0.0005770308166855463, 7.535668832473711e-05, 0.0002605610185157294)
2026-06-06 01:52:37,073 - optuna.study.study - INFO - Trial 193 finished with values: [0.0005770308166855463, 7.535668832473711e-05, 0.0002605610185157294] and parameters: {'n_layers': 1, 'embedding_dim': 32, 'lr': 0.0025949620955328543, 'lambda_val': 2.80429275845163e-06, 'batch_size': 755, 'optimizer': 'SGD'}.
2026-06-06 01:53:55,196 - experiment_functions - INFO - Early stopping at epoch 1250. Best Metrics: (0.05945007262660506, 0.007230892893026995, 0.030217843151340573)
2026-06-06 01:53:55,918 - optuna.study.study - INFO - Trial 194 finished with values: [0.05945007262660506, 0.007230892893026995, 0.030217843151340573] and parameters: {'n_layers': 4, 'embedding_dim': 256, 'lr': 0.0006492139755404522, 'lambda_val': 1.482563488933184e-06, 'batch_size': 1920, 'optimizer': 'Adam'}.
2026-06-06 01:54:32,500 - experiment_functions - INFO - Early stopping at epoch 900. Best Metrics: (0.06675828671777403, 0.008182061758992566, 0.03402198337747561)
2026-06-06 01:54:32,720 - optuna.study.study - INFO - Trial 195 finished with values: [0.06675828671777403, 0.008182061758992566, 0.03402198337747561] and parameters: {'n_layers': 2, 'embedding_dim': 32, 'lr': 0.0025949620955328543, 'lambda_val': 5.314912869017192e-05, 'batch_size': 2351, 'optimizer': 'Adam'}.
2026-06-06 01:55:25,868 - experiment_functions - INFO - Early stopping at epoch 1350. Best Metrics: (0.05213714785988938, 0.006346707750016747, 0.025562869712699998)
2026-06-06 01:55:26,097 - optuna.study.study - INFO - Trial 196 finished with values: [0.05213714785988938, 0.006346707750016747, 0.025562869712699998] and parameters: {'n_layers': 1, 'embedding_dim': 64, 'lr': 0.007650229911234196, 'lambda_val': 2.80429275845163e-06, 'batch_size': 639, 'optimizer': 'Adam'}.
2026-06-06 01:58:03,524 - experiment_functions - INFO - Early stopping at epoch 3700. Best Metrics: (0.08465279779489004, 0.010208319378391052, 0.04425417834887739)
2026-06-06 01:58:04,212 - optuna.study.study - INFO - Trial 197 finished with values: [0.08465279779489004, 0.010208319378391052, 0.04425417834887739] and parameters: {'n_layers': 2, 'embedding_dim': 96, 'lr': 0.0008375189225934038, 'lambda_val': 2.80429275845163e-06, 'batch_size': 2901, 'optimizer': 'Adam'}.
2026-06-06 02:00:46,028 - optuna.study.study - INFO - Trial 198 finished with values: [0.07161422630950232, 0.009422935226739903, 0.04055964841917491] and parameters: {'n_layers': 1, 'embedding_dim': 96, 'lr': 0.0008375189225934038, 'lambda_val': 1.9645451789230886e-06, 'batch_size': 1487, 'optimizer': 'RMSprop'}.
2026-06-06 02:03:50,330 - optuna.study.study - INFO - Trial 199 finished with values: [0.07465878648591771, 0.009913590997387634, 0.04121032172073253] and parameters: {'n_layers': 1, 'embedding_dim': 256, 'lr': 0.0006492139755404522, 'lambda_val': 1.2264285179082735e-06, 'batch_size': 2592, 'optimizer': 'Adam'}.
2026-06-06 02:06:30,040 - optuna.study.study - INFO - Trial 200 finished with values: [0.08539684743135566, 0.010384151651148772, 0.04464687372330048] and parameters: {'n_layers': 1, 'embedding_dim': 32, 'lr': 0.0025949620955328543, 'lambda_val': 1.9645451789230886e-06, 'batch_size': 1890, 'optimizer': 'RMSprop'}.
2026-06-06 02:08:57,379 - experiment_functions - INFO - Early stopping at epoch 3450. Best Metrics: (0.08540888070884911, 0.010359032755040527, 0.04493357194224657)
2026-06-06 02:08:57,684 - optuna.study.study - INFO - Trial 201 finished with values: [0.08540888070884911, 0.010359032755040527, 0.04493357194224657] and parameters: {'n_layers': 2, 'embedding_dim': 96, 'lr': 0.0008375189225934038, 'lambda_val': 2.80429275845163e-06, 'batch_size': 2336, 'optimizer': 'Adam'}.
2026-06-06 02:11:40,701 - optuna.study.study - INFO - Trial 202 finished with values: [0.05279878881576418, 0.007480407261035569, 0.029630699881777654] and parameters: {'n_layers': 1, 'embedding_dim': 128, 'lr': 0.0006492139755404522, 'lambda_val': 1.482563488933184e-06, 'batch_size': 1890, 'optimizer': 'Adam'}.
2026-06-06 02:12:01,441 - experiment_functions - INFO - Early stopping at epoch 500. Best Metrics: (0.0004793271128870737, 6.195994373367273e-05, 0.00019015707465794033)
2026-06-06 02:12:01,784 - optuna.study.study - INFO - Trial 203 finished with values: [0.0004793271128870737, 6.195994373367273e-05, 0.00019015707465794033] and parameters: {'n_layers': 1, 'embedding_dim': 96, 'lr': 0.0008375189225934038, 'lambda_val': 1.879189373307025e-06, 'batch_size': 3016, 'optimizer': 'SGD'}.
2026-06-06 02:12:39,327 - experiment_functions - INFO - Early stopping at epoch 850. Best Metrics: (0.07192278867814667, 0.00886697032621073, 0.03695296956024362)
2026-06-06 02:12:39,399 - optuna.study.study - INFO - Trial 204 finished with values: [0.07192278867814667, 0.00886697032621073, 0.03695296956024362] and parameters: {'n_layers': 2, 'embedding_dim': 96, 'lr': 0.0025949620955328543, 'lambda_val': 1.9645451789230886e-06, 'batch_size': 1890, 'optimizer': 'Adam'}.
2026-06-06 02:15:24,492 - optuna.study.study - INFO - Trial 205 finished with values: [0.0913311075356719, 0.011295130283341148, 0.049995295688449216] and parameters: {'n_layers': 1, 'embedding_dim': 128, 'lr': 0.0011525517839870857, 'lambda_val': 1.9645451789230886e-06, 'batch_size': 1890, 'optimizer': 'Adam'}.
2026-06-06 02:17:06,179 - experiment_functions - INFO - Early stopping at epoch 2100. Best Metrics: (0.0005189833739364161, 8.372965369415233e-05, 0.00026795215537053367)
2026-06-06 02:17:07,591 - optuna.study.study - INFO - Trial 206 finished with values: [0.0005189833739364161, 8.372965369415233e-05, 0.00026795215537053367] and parameters: {'n_layers': 2, 'embedding_dim': 256, 'lr': 1.5216511323556251e-05, 'lambda_val': 9.945068556655057e-06, 'batch_size': 1266, 'optimizer': 'Adam'}.
2026-06-06 02:17:37,466 - experiment_functions - INFO - Early stopping at epoch 550. Best Metrics: (0.01489647410994875, 0.0018504253466407664, 0.006925371568935309)
2026-06-06 02:17:37,853 - optuna.study.study - INFO - Trial 207 finished with values: [0.01489647410994875, 0.0018504253466407664, 0.006925371568935309] and parameters: {'n_layers': 4, 'embedding_dim': 128, 'lr': 0.003918670659096881, 'lambda_val': 0.009612278673143178, 'batch_size': 2133, 'optimizer': 'RMSprop'}.
2026-06-06 02:20:33,651 - optuna.study.study - INFO - Trial 208 finished with values: [0.0006138112573433733, 0.00011052314287628108, 0.0003224195722207656] and parameters: {'n_layers': 4, 'embedding_dim': 96, 'lr': 4.0483999576140845e-05, 'lambda_val': 2.80429275845163e-06, 'batch_size': 2901, 'optimizer': 'Adam'}.
2026-06-06 02:20:59,512 - experiment_functions - INFO - Early stopping at epoch 650. Best Metrics: (0.0006368104023831548, 7.870587447250318e-05, 0.00027656774410366846)
2026-06-06 02:20:59,622 - optuna.study.study - INFO - Trial 209 finished with values: [0.0006368104023831548, 7.870587447250318e-05, 0.00027656774410366846] and parameters: {'n_layers': 1, 'embedding_dim': 64, 'lr': 3.2397135912879125e-05, 'lambda_val': 1.9645451789230886e-06, 'batch_size': 3427, 'optimizer': 'Adam'}.
2026-06-06 02:22:34,191 - experiment_functions - INFO - Early stopping at epoch 2150. Best Metrics: (0.06816187952635071, 0.008155268269810436, 0.033896618260214006)
