2026-06-05 08:46:01,590 - optuna.study.study - INFO - Trial 141 finished with values: [0.0005720156199682712, 7.53566883247371e-05, 0.0002568882003011199] and parameters: {'n_layers': 2, 'embedding_dim': 128, 'lr': 2.4177718291726505e-05, 'lambda_val': 0.00012250709547244776, 'batch_size': 816, 'optimizer': 'RMSprop'}.
2026-06-05 08:46:25,677 - experiment_functions - INFO - Early stopping at epoch 550. Best Metrics: (0.0472556189606652, 0.006072074485899926, 0.024032903717034048)
2026-06-05 08:46:25,767 - optuna.study.study - INFO - Trial 142 finished with values: [0.0472556189606652, 0.006072074485899926, 0.024032903717034048] and parameters: {'n_layers': 2, 'embedding_dim': 64, 'lr': 0.008809992969564242, 'lambda_val': 0.002704517607370656, 'batch_size': 4021, 'optimizer': 'Adam'}.
2026-06-05 08:50:03,035 - optuna.study.study - INFO - Trial 143 finished with values: [0.04012059524681016, 0.0052230557974412214, 0.019224988154386332] and parameters: {'n_layers': 3, 'embedding_dim': 256, 'lr': 0.0002935151629562318, 'lambda_val': 0.010049953072921752, 'batch_size': 3358, 'optimizer': 'Adam'}.
2026-06-05 08:52:39,298 - optuna.study.study - INFO - Trial 144 finished with values: [0.016852890102848007, 0.0025755241476321258, 0.009862327479436665] and parameters: {'n_layers': 2, 'embedding_dim': 64, 'lr': 0.00036100664498869524, 'lambda_val': 6.977831082453278e-06, 'batch_size': 595, 'optimizer': 'RMSprop'}.
2026-06-05 08:53:38,963 - experiment_functions - INFO - Early stopping at epoch 1450. Best Metrics: (0.007932500883906334, 0.0010215017750686583, 0.0037057171574595292)
2026-06-05 08:53:39,983 - optuna.study.study - INFO - Trial 145 finished with values: [0.007932500883906334, 0.0010215017750686583, 0.0037057171574595292] and parameters: {'n_layers': 3, 'embedding_dim': 64, 'lr': 0.0015391297039669685, 'lambda_val': 0.07074738156904987, 'batch_size': 1248, 'optimizer': 'Adam'}.
2026-06-05 08:56:36,068 - optuna.study.study - INFO - Trial 146 finished with values: [0.026724969814160872, 0.0034027731261303505, 0.012334741312341519] and parameters: {'n_layers': 1, 'embedding_dim': 256, 'lr': 0.024984519415047875, 'lambda_val': 0.006425131620276728, 'batch_size': 1300, 'optimizer': 'RMSprop'}.
2026-06-05 08:56:58,951 - experiment_functions - INFO - Early stopping at epoch 550. Best Metrics: (0.019418764164006546, 0.0023126130350324876, 0.008658691276194067)
2026-06-05 08:56:59,057 - optuna.study.study - INFO - Trial 147 finished with values: [0.019418764164006546, 0.0023126130350324876, 0.008658691276194067] and parameters: {'n_layers': 2, 'embedding_dim': 32, 'lr': 0.011575453890852001, 'lambda_val': 0.006784020914475507, 'batch_size': 2205, 'optimizer': 'RMSprop'}.
2026-06-05 08:57:38,521 - experiment_functions - INFO - Early stopping at epoch 900. Best Metrics: (0.02440303442306732, 0.0029439346238863957, 0.011494467938783576)
2026-06-05 08:57:38,614 - optuna.study.study - INFO - Trial 148 finished with values: [0.02440303442306732, 0.0029439346238863957, 0.011494467938783576] and parameters: {'n_layers': 4, 'embedding_dim': 64, 'lr': 0.0026337988972589856, 'lambda_val': 0.001468044891542341, 'batch_size': 1660, 'optimizer': 'RMSprop'}.
2026-06-05 09:00:57,710 - optuna.study.study - INFO - Trial 149 finished with values: [0.057919751314326196, 0.006733538750083731, 0.028280335021947312] and parameters: {'n_layers': 2, 'embedding_dim': 256, 'lr': 0.006542998749224963, 'lambda_val': 6.977831082453278e-06, 'batch_size': 808, 'optimizer': 'RMSprop'}.
2026-06-05 09:03:55,171 - optuna.study.study - INFO - Trial 150 finished with values: [0.05980891212596481, 0.008212204434322459, 0.034688458179239455] and parameters: {'n_layers': 1, 'embedding_dim': 256, 'lr': 0.0006201349398045224, 'lambda_val': 6.977831082453278e-06, 'batch_size': 1300, 'optimizer': 'RMSprop'}.
2026-06-05 09:06:53,663 - optuna.study.study - INFO - Trial 151 finished with values: [0.029573126525439777, 0.0033575591131355088, 0.013311917281506729] and parameters: {'n_layers': 4, 'embedding_dim': 96, 'lr': 0.01073703024868891, 'lambda_val': 8.17902589782426e-05, 'batch_size': 1812, 'optimizer': 'Adam'}.
2026-06-05 09:07:19,406 - experiment_functions - INFO - Early stopping at epoch 500. Best Metrics: (0.0005688509634279286, 8.205506062026927e-05, 0.00021810304793461728)
2026-06-05 09:07:20,101 - optuna.study.study - INFO - Trial 152 finished with values: [0.0005688509634279286, 8.205506062026927e-05, 0.00021810304793461728] and parameters: {'n_layers': 2, 'embedding_dim': 256, 'lr': 0.002843500215424042, 'lambda_val': 0.0007536284412237263, 'batch_size': 1157, 'optimizer': 'SGD'}.
2026-06-05 09:08:05,832 - experiment_functions - INFO - Early stopping at epoch 1050. Best Metrics: (0.03875371394635602, 0.004558242347109653, 0.018203635667864614)
2026-06-05 09:08:06,239 - optuna.study.study - INFO - Trial 153 finished with values: [0.03875371394635602, 0.004558242347109653, 0.018203635667864614] and parameters: {'n_layers': 3, 'embedding_dim': 64, 'lr': 0.00277162555113125, 'lambda_val': 6.977831082453278e-06, 'batch_size': 2988, 'optimizer': 'RMSprop'}.
2026-06-05 09:08:39,520 - experiment_functions - INFO - Early stopping at epoch 800. Best Metrics: (0.04622477919829624, 0.005576394936030545, 0.022258683068607416)
2026-06-05 09:08:39,603 - optuna.study.study - INFO - Trial 154 finished with values: [0.04622477919829624, 0.005576394936030545, 0.022258683068607416] and parameters: {'n_layers': 2, 'embedding_dim': 32, 'lr': 0.0023785608804078183, 'lambda_val': 0.0015694921564952753, 'batch_size': 2307, 'optimizer': 'RMSprop'}.
2026-06-05 09:11:34,442 - optuna.study.study - INFO - Trial 155 finished with values: [0.0017770175535653022, 0.00023276843726974342, 0.0008508927302346037] and parameters: {'n_layers': 1, 'embedding_dim': 256, 'lr': 0.0002935151629562318, 'lambda_val': 0.00010844106835038753, 'batch_size': 1300, 'optimizer': 'Adam'}.
2026-06-05 09:14:27,846 - optuna.study.study - INFO - Trial 156 finished with values: [0.044825903582965745, 0.00605197936901333, 0.023344100551136896] and parameters: {'n_layers': 3, 'embedding_dim': 96, 'lr': 0.0002935151629562318, 'lambda_val': 8.17902589782426e-05, 'batch_size': 1812, 'optimizer': 'Adam'}.
2026-06-05 09:14:57,003 - experiment_functions - INFO - Early stopping at epoch 650. Best Metrics: (0.06468448763073502, 0.008314354611829325, 0.03249284347305527)
2026-06-05 09:14:57,113 - optuna.study.study - INFO - Trial 157 finished with values: [0.06468448763073502, 0.008314354611829325, 0.03249284347305527] and parameters: {'n_layers': 1, 'embedding_dim': 128, 'lr': 0.005703236170133443, 'lambda_val': 0.002704517607370656, 'batch_size': 3735, 'optimizer': 'Adam'}.
2026-06-05 09:15:21,489 - experiment_functions - INFO - Early stopping at epoch 500. Best Metrics: (0.00045352881922032566, 6.530912988143882e-05, 0.00021182026804520852)
2026-06-05 09:15:21,621 - optuna.study.study - INFO - Trial 158 finished with values: [0.00045352881922032566, 6.530912988143882e-05, 0.00021182026804520852] and parameters: {'n_layers': 4, 'embedding_dim': 96, 'lr': 0.019367051543267743, 'lambda_val': 8.17902589782426e-05, 'batch_size': 1812, 'optimizer': 'SGD'}.
2026-06-05 09:18:12,852 - optuna.study.study - INFO - Trial 159 finished with values: [0.0037500651579419155, 0.0006329961819277917, 0.0022907172858132657] and parameters: {'n_layers': 1, 'embedding_dim': 256, 'lr': 0.0002935151629562318, 'lambda_val': 0.0004441036553353607, 'batch_size': 1554, 'optimizer': 'RMSprop'}.
2026-06-05 09:18:34,082 - experiment_functions - INFO - Early stopping at epoch 500. Best Metrics: (0.0006287978746690103, 7.870587447250318e-05, 0.00027186387797384175)
2026-06-05 09:18:34,325 - optuna.study.study - INFO - Trial 160 finished with values: [0.0006287978746690103, 7.870587447250318e-05, 0.00027186387797384175] and parameters: {'n_layers': 2, 'embedding_dim': 64, 'lr': 0.005703236170133443, 'lambda_val': 0.002704517607370656, 'batch_size': 1607, 'optimizer': 'SGD'}.
2026-06-05 09:21:27,316 - optuna.study.study - INFO - Trial 161 finished with values: [0.002160963769184049, 0.0003885055931408668, 0.00121966331030198] and parameters: {'n_layers': 1, 'embedding_dim': 256, 'lr': 0.0002935151629562318, 'lambda_val': 0.0007536284412237263, 'batch_size': 1300, 'optimizer': 'RMSprop'}.
2026-06-05 09:23:45,494 - experiment_functions - INFO - Early stopping at epoch 3450. Best Metrics: (0.0879182499800751, 0.010606872529975218, 0.04613867973725778)
2026-06-05 09:23:45,600 - optuna.study.study - INFO - Trial 162 finished with values: [0.0879182499800751, 0.010606872529975218, 0.04613867973725778] and parameters: {'n_layers': 1, 'embedding_dim': 64, 'lr': 0.0023440150084551373, 'lambda_val': 0.00012250709547244776, 'batch_size': 1554, 'optimizer': 'Adam'}.
2026-06-05 09:25:47,366 - experiment_functions - INFO - Early stopping at epoch 2400. Best Metrics: (0.0815912822447132, 0.00994875745193918, 0.041930904607060386)
2026-06-05 09:25:47,452 - optuna.study.study - INFO - Trial 163 finished with values: [0.0815912822447132, 0.00994875745193918, 0.041930904607060386] and parameters: {'n_layers': 2, 'embedding_dim': 256, 'lr': 0.0008252437334877037, 'lambda_val': 6.977831082453278e-06, 'batch_size': 1300, 'optimizer': 'RMSprop'}.
2026-06-05 09:26:12,094 - experiment_functions - INFO - Early stopping at epoch 550. Best Metrics: (0.025801978113289246, 0.003062830732132092, 0.012000776531765381)
2026-06-05 09:26:12,583 - optuna.study.study - INFO - Trial 164 finished with values: [0.025801978113289246, 0.003062830732132092, 0.012000776531765381] and parameters: {'n_layers': 3, 'embedding_dim': 64, 'lr': 0.024984519415047875, 'lambda_val': 0.0007536284412237263, 'batch_size': 1642, 'optimizer': 'Adam'}.
2026-06-05 09:28:50,079 - optuna.study.study - INFO - Trial 165 finished with values: [0.06500720248009446, 0.00885524817469355, 0.037384165906213775] and parameters: {'n_layers': 1, 'embedding_dim': 64, 'lr': 0.0006201349398045224, 'lambda_val': 6.977831082453278e-06, 'batch_size': 3113, 'optimizer': 'RMSprop'}.
2026-06-05 09:29:16,649 - experiment_functions - INFO - Early stopping at epoch 600. Best Metrics: (0.02969523852035611, 0.003593676736553018, 0.013543183392016198)
2026-06-05 09:29:16,743 - optuna.study.study - INFO - Trial 166 finished with values: [0.02969523852035611, 0.003593676736553018, 0.013543183392016198] and parameters: {'n_layers': 3, 'embedding_dim': 64, 'lr': 0.005703236170133443, 'lambda_val': 0.006784020914475507, 'batch_size': 3358, 'optimizer': 'Adam'}.
2026-06-05 09:32:01,166 - optuna.study.study - INFO - Trial 167 finished with values: [0.04175525168076123, 0.004826177238930939, 0.019001500796363164] and parameters: {'n_layers': 3, 'embedding_dim': 64, 'lr': 0.0023440150084551373, 'lambda_val': 0.00012250709547244776, 'batch_size': 1554, 'optimizer': 'RMSprop'}.
2026-06-05 09:35:14,097 - optuna.study.study - INFO - Trial 168 finished with values: [0.014437916442056721, 0.00222051041596892, 0.0087325178957901] and parameters: {'n_layers': 2, 'embedding_dim': 256, 'lr': 0.0002935151629562318, 'lambda_val': 7.059587443324882e-05, 'batch_size': 586, 'optimizer': 'RMSprop'}.
2026-06-05 09:39:10,400 - optuna.study.study - INFO - Trial 169 finished with values: [0.051970984302233035, 0.005964900529171412, 0.024399772410768017] and parameters: {'n_layers': 4, 'embedding_dim': 256, 'lr': 0.006542998749224963, 'lambda_val': 6.977831082453278e-06, 'batch_size': 808, 'optimizer': 'RMSprop'}.
2026-06-05 09:39:48,456 - experiment_functions - INFO - Early stopping at epoch 800. Best Metrics: (0.027550606451003566, 0.0033491861477660933, 0.01260605989945156)
2026-06-05 09:39:48,564 - optuna.study.study - INFO - Trial 170 finished with values: [0.027550606451003566, 0.0033491861477660933, 0.01260605989945156] and parameters: {'n_layers': 3, 'embedding_dim': 128, 'lr': 0.0023440150084551373, 'lambda_val': 0.0028468440427530635, 'batch_size': 1995, 'optimizer': 'RMSprop'}.
2026-06-05 09:42:27,534 - optuna.study.study - INFO - Trial 171 finished with values: [0.04712722072422192, 0.005681894299685177, 0.02207738903069777] and parameters: {'n_layers': 2, 'embedding_dim': 64, 'lr': 0.006542998749224963, 'lambda_val': 6.977831082453278e-06, 'batch_size': 617, 'optimizer': 'RMSprop'}.
2026-06-05 09:42:58,303 - experiment_functions - INFO - Early stopping at epoch 600. Best Metrics: (0.000496693222452113, 8.372965369415233e-05, 0.00021773987235871236)
2026-06-05 09:42:58,399 - optuna.study.study - INFO - Trial 172 finished with values: [0.000496693222452113, 8.372965369415233e-05, 0.00021773987235871236] and parameters: {'n_layers': 2, 'embedding_dim': 256, 'lr': 6.207238576173367e-05, 'lambda_val': 0.0028468440427530635, 'batch_size': 2067, 'optimizer': 'RMSprop'}.
2026-06-05 09:43:33,920 - experiment_functions - INFO - Early stopping at epoch 850. Best Metrics: (0.035047075611171735, 0.004422600308125126, 0.01598174813323641)
2026-06-05 09:43:34,671 - optuna.study.study - INFO - Trial 173 finished with values: [0.035047075611171735, 0.004422600308125126, 0.01598174813323641] and parameters: {'n_layers': 2, 'embedding_dim': 64, 'lr': 0.0023440150084551373, 'lambda_val': 0.012784402152247295, 'batch_size': 1146, 'optimizer': 'Adam'}.
2026-06-05 09:44:00,274 - experiment_functions - INFO - Early stopping at epoch 600. Best Metrics: (0.03997723306522081, 0.004961819277915467, 0.020039962662312526)
2026-06-05 09:44:01,092 - optuna.study.study - INFO - Trial 174 finished with values: [0.03997723306522081, 0.004961819277915467, 0.020039962662312526] and parameters: {'n_layers': 3, 'embedding_dim': 32, 'lr': 0.0051502087362069494, 'lambda_val': 0.00013726443089426057, 'batch_size': 1995, 'optimizer': 'Adam'}.
2026-06-05 09:44:37,342 - experiment_functions - INFO - Early stopping at epoch 850. Best Metrics: (0.02863144366450037, 0.003444637952977427, 0.013706761613065992)
2026-06-05 09:44:38,094 - optuna.study.study - INFO - Trial 175 finished with values: [0.02863144366450037, 0.003444637952977427, 0.013706761613065992] and parameters: {'n_layers': 3, 'embedding_dim': 64, 'lr': 0.024984519415047875, 'lambda_val': 7.059587443324882e-05, 'batch_size': 617, 'optimizer': 'RMSprop'}.
2026-06-05 09:47:23,278 - optuna.study.study - INFO - Trial 176 finished with values: [0.043840002175969804, 0.005094112130752228, 0.02018887610508667] and parameters: {'n_layers': 2, 'embedding_dim': 96, 'lr': 0.0041201733250423745, 'lambda_val': 0.0003344121448101528, 'batch_size': 1554, 'optimizer': 'RMSprop'}.
2026-06-05 09:47:57,107 - experiment_functions - INFO - Early stopping at epoch 750. Best Metrics: (0.034705858180778044, 0.0042266729184808095, 0.01664467263424461)
2026-06-05 09:47:57,632 - optuna.study.study - INFO - Trial 177 finished with values: [0.034705858180778044, 0.0042266729184808095, 0.01664467263424461] and parameters: {'n_layers': 4, 'embedding_dim': 64, 'lr': 0.006542998749224963, 'lambda_val': 0.00012294834982179084, 'batch_size': 617, 'optimizer': 'RMSprop'}.
2026-06-05 09:48:18,083 - experiment_functions - INFO - Early stopping at epoch 500. Best Metrics: (0.0003520812522044795, 7.87058744725032e-05, 0.0001877722219156232)
2026-06-05 09:48:19,196 - optuna.study.study - INFO - Trial 178 finished with values: [0.0003520812522044795, 7.87058744725032e-05, 0.0001877722219156232] and parameters: {'n_layers': 2, 'embedding_dim': 32, 'lr': 0.0017163448230141686, 'lambda_val': 0.00010844106835038753, 'batch_size': 2799, 'optimizer': 'SGD'}.
2026-06-05 09:49:15,408 - experiment_functions - INFO - Early stopping at epoch 1200. Best Metrics: (0.07288133000424737, 0.008940652421461585, 0.03630503465336693)
2026-06-05 09:49:15,505 - optuna.study.study - INFO - Trial 179 finished with values: [0.07288133000424737, 0.008940652421461585, 0.03630503465336693] and parameters: {'n_layers': 1, 'embedding_dim': 256, 'lr': 0.0023440150084551373, 'lambda_val': 0.0003344121448101528, 'batch_size': 1554, 'optimizer': 'RMSprop'}.
2026-06-05 09:49:37,398 - experiment_functions - INFO - Early stopping at epoch 500. Best Metrics: (0.00034487731302456677, 6.363453680755577e-05, 0.00014270548823152866)
2026-06-05 09:49:37,511 - optuna.study.study - INFO - Trial 180 finished with values: [0.00034487731302456677, 6.363453680755577e-05, 0.00014270548823152866] and parameters: {'n_layers': 3, 'embedding_dim': 64, 'lr': 0.006542998749224963, 'lambda_val': 0.026069949545344355, 'batch_size': 2646, 'optimizer': 'SGD'}.
2026-06-05 09:52:37,570 - optuna.study.study - INFO - Trial 181 finished with values: [0.025191323003265754, 0.0037544376716457904, 0.01270922004420035] and parameters: {'n_layers': 3, 'embedding_dim': 128, 'lr': 0.00020056257290353266, 'lambda_val': 0.0028468440427530635, 'batch_size': 1995, 'optimizer': 'Adam'}.
2026-06-05 09:53:04,413 - experiment_functions - INFO - Early stopping at epoch 550. Best Metrics: (0.03528157017071436, 0.004057539018018622, 0.01652773646958197)
2026-06-05 09:53:05,312 - optuna.study.study - INFO - Trial 182 finished with values: [0.03528157017071436, 0.004057539018018622, 0.01652773646958197] and parameters: {'n_layers': 4, 'embedding_dim': 96, 'lr': 0.019367051543267743, 'lambda_val': 8.17902589782426e-05, 'batch_size': 1710, 'optimizer': 'RMSprop'}.
2026-06-05 09:56:39,657 - optuna.study.study - INFO - Trial 183 finished with values: [0.020149964396972125, 0.003206845736486034, 0.010374869286636654] and parameters: {'n_layers': 3, 'embedding_dim': 256, 'lr': 0.0002935151629562318, 'lambda_val': 0.010049953072921752, 'batch_size': 708, 'optimizer': 'Adam'}.
2026-06-05 09:57:18,875 - experiment_functions - INFO - Early stopping at epoch 900. Best Metrics: (0.06322127843377062, 0.007961015473240003, 0.031182202348395433)
2026-06-05 09:57:18,962 - optuna.study.study - INFO - Trial 184 finished with values: [0.06322127843377062, 0.007961015473240003, 0.031182202348395433] and parameters: {'n_layers': 1, 'embedding_dim': 128, 'lr': 0.0023440150084551373, 'lambda_val': 0.0028468440427530635, 'batch_size': 1995, 'optimizer': 'RMSprop'}.
2026-06-05 09:59:35,430 - experiment_functions - INFO - Early stopping at epoch 3000. Best Metrics: (0.04026384039504093, 0.004596757987808962, 0.01793263416961728)
2026-06-05 09:59:35,522 - optuna.study.study - INFO - Trial 185 finished with values: [0.04026384039504093, 0.004596757987808962, 0.01793263416961728] and parameters: {'n_layers': 3, 'embedding_dim': 128, 'lr': 0.00277162555113125, 'lambda_val': 6.977831082453278e-06, 'batch_size': 633, 'optimizer': 'Adam'}.
2026-06-05 09:59:57,365 - experiment_functions - INFO - Early stopping at epoch 500. Best Metrics: (0.0004175168115066391, 7.870587447250318e-05, 0.0002162085019211451)
2026-06-05 09:59:57,447 - optuna.study.study - INFO - Trial 186 finished with values: [0.0004175168115066391, 7.870587447250318e-05, 0.0002162085019211451] and parameters: {'n_layers': 3, 'embedding_dim': 64, 'lr': 0.00036100664498869524, 'lambda_val': 0.036867811397163115, 'batch_size': 1504, 'optimizer': 'Adam'}.
2026-06-05 10:00:55,840 - experiment_functions - INFO - Early stopping at epoch 1050. Best Metrics: (0.0416101586254706, 0.004780963225936097, 0.019679840341127346)
2026-06-05 10:00:55,981 - optuna.study.study - INFO - Trial 187 finished with values: [0.0416101586254706, 0.004780963225936097, 0.019679840341127346] and parameters: {'n_layers': 3, 'embedding_dim': 256, 'lr': 0.01574383229988295, 'lambda_val': 6.977831082453278e-06, 'batch_size': 1300, 'optimizer': 'RMSprop'}.
2026-06-05 10:04:32,401 - optuna.study.study - INFO - Trial 188 finished with values: [0.05478172998326316, 0.006350056936164513, 0.025808181570311416] and parameters: {'n_layers': 3, 'embedding_dim': 256, 'lr': 0.006542998749224963, 'lambda_val': 3.6389561047642882e-06, 'batch_size': 808, 'optimizer': 'RMSprop'}.
2026-06-05 10:05:05,016 - experiment_functions - INFO - Early stopping at epoch 550. Best Metrics: (0.044247563474637694, 0.005459173420858732, 0.02113578021709526)
2026-06-05 10:05:05,212 - optuna.study.study - INFO - Trial 189 finished with values: [0.044247563474637694, 0.005459173420858732, 0.02113578021709526] and parameters: {'n_layers': 3, 'embedding_dim': 256, 'lr': 0.006542998749224963, 'lambda_val': 6.977831082453278e-06, 'batch_size': 2928, 'optimizer': 'Adam'}.
2026-06-05 10:05:28,036 - experiment_functions - INFO - Early stopping at epoch 550. Best Metrics: (0.021498590213293846, 0.0026676267666956932, 0.010165439258248012)
2026-06-05 10:05:28,277 - optuna.study.study - INFO - Trial 190 finished with values: [0.021498590213293846, 0.0026676267666956932, 0.010165439258248012] and parameters: {'n_layers': 2, 'embedding_dim': 32, 'lr': 0.024984519415047875, 'lambda_val': 0.0008919112975523749, 'batch_size': 1293, 'optimizer': 'RMSprop'}.
2026-06-05 10:05:57,890 - experiment_functions - INFO - Early stopping at epoch 650. Best Metrics: (0.04136109199828841, 0.005043874338535735, 0.019764214919577867)
2026-06-05 10:05:58,096 - optuna.study.study - INFO - Trial 191 finished with values: [0.04136109199828841, 0.005043874338535735, 0.019764214919577867] and parameters: {'n_layers': 4, 'embedding_dim': 64, 'lr': 0.0024709595203389, 'lambda_val': 7.059587443324882e-05, 'batch_size': 3968, 'optimizer': 'Adam'}.
2026-06-05 10:06:21,375 - experiment_functions - INFO - Early stopping at epoch 550. Best Metrics: (0.04232594587314762, 0.004950097126398286, 0.019618236832571422)
2026-06-05 10:06:21,472 - optuna.study.study - INFO - Trial 192 finished with values: [0.04232594587314762, 0.004950097126398286, 0.019618236832571422] and parameters: {'n_layers': 2, 'embedding_dim': 32, 'lr': 0.024984519415047875, 'lambda_val': 7.059587443324882e-05, 'batch_size': 4073, 'optimizer': 'Adam'}.
2026-06-05 10:07:09,893 - experiment_functions - INFO - Early stopping at epoch 1200. Best Metrics: (0.06671010515208327, 0.008235648737356823, 0.035532620279939045)
