2026-06-04 17:12:08,458 - optuna.study.study - INFO - Trial 10 finished with values: [0.0034028791140409595, 0.000577734610489651, 0.002121480255809464] and parameters: {'n_layers': 4, 'embedding_dim': 96, 'lr': 0.0915582294142734, 'lambda_val': 6.999649792113642e-06, 'batch_size': 2701, 'optimizer': 'RMSprop'}.
2026-06-04 17:12:34,575 - experiment_functions - INFO - Early stopping at epoch 600. Best Metrics: (0.004497437479517394, 0.0008456695023109385, 0.002714076781799729)
2026-06-04 17:12:35,504 - optuna.study.study - INFO - Trial 11 finished with values: [0.004497437479517394, 0.0008456695023109385, 0.002714076781799729] and parameters: {'n_layers': 2, 'embedding_dim': 128, 'lr': 0.004398575629441856, 'lambda_val': 0.0015000126802708358, 'batch_size': 1731, 'optimizer': 'RMSprop'}.
2026-06-04 17:12:57,256 - experiment_functions - INFO - Early stopping at epoch 500. Best Metrics: (0.0003349372822288907, 7.703128139862015e-05, 0.0001750220678800804)
2026-06-04 17:12:58,223 - optuna.study.study - INFO - Trial 12 finished with values: [0.0003349372822288907, 7.703128139862015e-05, 0.0001750220678800804] and parameters: {'n_layers': 3, 'embedding_dim': 96, 'lr': 1.7571512694797825e-05, 'lambda_val': 0.0027770030048097864, 'batch_size': 2805, 'optimizer': 'SGD'}.
2026-06-04 17:13:30,753 - experiment_functions - INFO - Early stopping at epoch 550. Best Metrics: (0.005982417779490871, 0.0010734141603590329, 0.0035194502497300803)
2026-06-04 17:13:31,078 - optuna.study.study - INFO - Trial 13 finished with values: [0.005982417779490871, 0.0010734141603590329, 0.0035194502497300803] and parameters: {'n_layers': 3, 'embedding_dim': 256, 'lr': 0.005575824047051625, 'lambda_val': 0.00016262429302101681, 'batch_size': 2193, 'optimizer': 'RMSprop'}.
2026-06-04 17:13:51,617 - experiment_functions - INFO - Early stopping at epoch 500. Best Metrics: (0.0003362241545530726, 6.195994373367272e-05, 0.00015125850358439256)
2026-06-04 17:13:52,602 - optuna.study.study - INFO - Trial 14 finished with values: [0.0003362241545530726, 6.195994373367272e-05, 0.00015125850358439256] and parameters: {'n_layers': 2, 'embedding_dim': 64, 'lr': 0.00374881475142826, 'lambda_val': 0.0008584486035316331, 'batch_size': 2314, 'optimizer': 'SGD'}.
2026-06-04 17:14:13,355 - experiment_functions - INFO - Early stopping at epoch 500. Best Metrics: (0.00048444984098745234, 7.703128139862015e-05, 0.00020397128938806)
2026-06-04 17:14:13,587 - optuna.study.study - INFO - Trial 15 finished with values: [0.00048444984098745234, 7.703128139862015e-05, 0.00020397128938806] and parameters: {'n_layers': 2, 'embedding_dim': 64, 'lr': 2.0799465955924264e-05, 'lambda_val': 2.7698801623790517e-06, 'batch_size': 3604, 'optimizer': 'SGD'}.
2026-06-04 17:14:39,590 - experiment_functions - INFO - Early stopping at epoch 600. Best Metrics: (0.0007239427929466039, 0.00011052314287628108, 0.00035067930629972805)
2026-06-04 17:14:39,733 - optuna.study.study - INFO - Trial 16 finished with values: [0.0007239427929466039, 0.00011052314287628108, 0.00035067930629972805] and parameters: {'n_layers': 3, 'embedding_dim': 96, 'lr': 9.809148192392527e-05, 'lambda_val': 0.013449171672366679, 'batch_size': 3768, 'optimizer': 'RMSprop'}.
2026-06-04 17:15:06,205 - experiment_functions - INFO - Early stopping at epoch 650. Best Metrics: (0.006638433514626275, 0.0011387232902404715, 0.003676083141682717)
2026-06-04 17:15:06,294 - optuna.study.study - INFO - Trial 17 finished with values: [0.006638433514626275, 0.0011387232902404715, 0.003676083141682717] and parameters: {'n_layers': 3, 'embedding_dim': 32, 'lr': 0.004869110805383165, 'lambda_val': 3.61928423516103e-05, 'batch_size': 2614, 'optimizer': 'RMSprop'}.
2026-06-04 17:18:15,396 - optuna.study.study - INFO - Trial 18 finished with values: [0.0038128054295302532, 0.0006162502511889611, 0.0021632180719365172] and parameters: {'n_layers': 3, 'embedding_dim': 256, 'lr': 0.0001615571289794213, 'lambda_val': 3.8631777865125085e-06, 'batch_size': 2129, 'optimizer': 'RMSprop'}.
2026-06-04 17:18:36,584 - experiment_functions - INFO - Early stopping at epoch 500. Best Metrics: (0.00036841157803103495, 6.530912988143881e-05, 0.00016399604177848821)
2026-06-04 17:18:36,815 - optuna.study.study - INFO - Trial 19 finished with values: [0.00036841157803103495, 6.530912988143881e-05, 0.00016399604177848821] and parameters: {'n_layers': 2, 'embedding_dim': 128, 'lr': 1.0329894186727467e-05, 'lambda_val': 3.0211085306191777e-05, 'batch_size': 1119, 'optimizer': 'SGD'}.
2026-06-04 17:21:08,835 - optuna.study.study - INFO - Trial 20 finished with values: [0.00622589962502438, 0.0010282001473641907, 0.003651300331811252] and parameters: {'n_layers': 2, 'embedding_dim': 96, 'lr': 0.00040769039157989535, 'lambda_val': 0.0007214277903221163, 'batch_size': 2679, 'optimizer': 'RMSprop'}.
2026-06-04 17:21:30,530 - experiment_functions - INFO - Early stopping at epoch 500. Best Metrics: (0.0026850176697660526, 0.0004806082122044343, 0.0017257295723643756)
2026-06-04 17:21:31,297 - optuna.study.study - INFO - Trial 21 finished with values: [0.0026850176697660526, 0.0004806082122044343, 0.0017257295723643756] and parameters: {'n_layers': 3, 'embedding_dim': 96, 'lr': 0.08891051240725381, 'lambda_val': 7.531082890563869e-05, 'batch_size': 1178, 'optimizer': 'RMSprop'}.
2026-06-04 17:22:01,700 - experiment_functions - INFO - Early stopping at epoch 550. Best Metrics: (0.0062658975418698444, 0.0011253265456494072, 0.003588880738391409)
2026-06-04 17:22:02,399 - optuna.study.study - INFO - Trial 22 finished with values: [0.0062658975418698444, 0.0011253265456494072, 0.003588880738391409] and parameters: {'n_layers': 4, 'embedding_dim': 256, 'lr': 0.014232768730502419, 'lambda_val': 4.633766555970088e-05, 'batch_size': 2180, 'optimizer': 'Adam'}.
2026-06-04 17:22:22,970 - experiment_functions - INFO - Early stopping at epoch 500. Best Metrics: (0.0004601243774731234, 7.535668832473711e-05, 0.00023700079866520663)
2026-06-04 17:22:23,127 - optuna.study.study - INFO - Trial 23 finished with values: [0.0004601243774731234, 7.535668832473711e-05, 0.00023700079866520663] and parameters: {'n_layers': 2, 'embedding_dim': 32, 'lr': 4.516871848493937e-05, 'lambda_val': 0.0001401521075606089, 'batch_size': 3657, 'optimizer': 'SGD'}.
2026-06-04 17:25:07,641 - optuna.study.study - INFO - Trial 24 finished with values: [0.004549210768728959, 0.0007585906624690201, 0.0027091768054604997] and parameters: {'n_layers': 3, 'embedding_dim': 128, 'lr': 0.00022150750424668007, 'lambda_val': 0.005255002744531624, 'batch_size': 1973, 'optimizer': 'RMSprop'}.
2026-06-04 17:25:32,159 - experiment_functions - INFO - Early stopping at epoch 600. Best Metrics: (0.005435433361159215, 0.0009210261906356758, 0.003209609716098546)
2026-06-04 17:25:33,276 - optuna.study.study - INFO - Trial 25 finished with values: [0.005435433361159215, 0.0009210261906356758, 0.003209609716098546] and parameters: {'n_layers': 2, 'embedding_dim': 64, 'lr': 0.0038915436873682946, 'lambda_val': 1.6413472527343117e-06, 'batch_size': 4089, 'optimizer': 'RMSprop'}.
2026-06-04 17:25:53,539 - experiment_functions - INFO - Early stopping at epoch 500. Best Metrics: (0.00041346700068517586, 6.530912988143882e-05, 0.0002202488666008818)
2026-06-04 17:25:54,021 - optuna.study.study - INFO - Trial 26 finished with values: [0.00041346700068517586, 6.530912988143882e-05, 0.0002202488666008818] and parameters: {'n_layers': 3, 'embedding_dim': 32, 'lr': 0.0015283734151537453, 'lambda_val': 4.0458212911588125e-05, 'batch_size': 1336, 'optimizer': 'SGD'}.
2026-06-04 17:26:38,587 - experiment_functions - INFO - Early stopping at epoch 1100. Best Metrics: (0.0042835038230390355, 0.0007837095585772659, 0.0023748010196384802)
2026-06-04 17:26:38,699 - optuna.study.study - INFO - Trial 27 finished with values: [0.0042835038230390355, 0.0007837095585772659, 0.0023748010196384802] and parameters: {'n_layers': 2, 'embedding_dim': 96, 'lr': 0.007372062066661765, 'lambda_val': 0.05696999518149749, 'batch_size': 4024, 'optimizer': 'RMSprop'}.
2026-06-04 17:27:10,174 - experiment_functions - INFO - Early stopping at epoch 800. Best Metrics: (0.0004800395751711761, 7.535668832473711e-05, 0.0002106427835197173)
2026-06-04 17:27:10,261 - optuna.study.study - INFO - Trial 28 finished with values: [0.0004800395751711761, 7.535668832473711e-05, 0.0002106427835197173] and parameters: {'n_layers': 1, 'embedding_dim': 128, 'lr': 0.06356361609217498, 'lambda_val': 0.0053513737506438695, 'batch_size': 2129, 'optimizer': 'SGD'}.
2026-06-04 17:27:33,492 - experiment_functions - INFO - Early stopping at epoch 500. Best Metrics: (0.00039822882418019635, 7.535668832473711e-05, 0.00021760607872302578)
2026-06-04 17:27:33,600 - optuna.study.study - INFO - Trial 29 finished with values: [0.00039822882418019635, 7.535668832473711e-05, 0.00021760607872302578] and parameters: {'n_layers': 4, 'embedding_dim': 128, 'lr': 0.0003166191009083644, 'lambda_val': 0.010647168185599083, 'batch_size': 2179, 'optimizer': 'SGD'}.
2026-06-04 17:28:10,663 - experiment_functions - INFO - Early stopping at epoch 1000. Best Metrics: (0.0005752067029570897, 7.53566883247371e-05, 0.00025899697701857655)
2026-06-04 17:28:10,754 - optuna.study.study - INFO - Trial 30 finished with values: [0.0005752067029570897, 7.53566883247371e-05, 0.00025899697701857655] and parameters: {'n_layers': 1, 'embedding_dim': 32, 'lr': 1.0240310270784878e-05, 'lambda_val': 7.91251565633466e-05, 'batch_size': 2871, 'optimizer': 'Adam'}.
2026-06-04 17:28:35,827 - experiment_functions - INFO - Early stopping at epoch 650. Best Metrics: (0.0004590038590421355, 7.703128139862013e-05, 0.0002298796093371157)
2026-06-04 17:28:36,777 - optuna.study.study - INFO - Trial 31 finished with values: [0.0004590038590421355, 7.703128139862013e-05, 0.0002298796093371157] and parameters: {'n_layers': 2, 'embedding_dim': 32, 'lr': 1.0551724282324685e-05, 'lambda_val': 0.02040454335975694, 'batch_size': 3741, 'optimizer': 'Adam'}.
2026-06-04 17:30:56,732 - optuna.study.study - INFO - Trial 32 finished with values: [0.004008286280117428, 0.0007719874070600846, 0.0021837277233535206] and parameters: {'n_layers': 1, 'embedding_dim': 32, 'lr': 0.07467555285381862, 'lambda_val': 0.003566951312101301, 'batch_size': 3322, 'optimizer': 'Adam'}.
2026-06-04 17:32:53,049 - experiment_functions - INFO - Early stopping at epoch 3050. Best Metrics: (0.004642059954172203, 0.000865764619197535, 0.002590736051201922)
2026-06-04 17:32:53,650 - optuna.study.study - INFO - Trial 33 finished with values: [0.004642059954172203, 0.000865764619197535, 0.002590736051201922] and parameters: {'n_layers': 1, 'embedding_dim': 128, 'lr': 0.020299600929016177, 'lambda_val': 0.004078312210980698, 'batch_size': 1107, 'optimizer': 'Adam'}.
2026-06-04 17:33:17,221 - experiment_functions - INFO - Early stopping at epoch 550. Best Metrics: (0.00433524129107238, 0.000828923571572108, 0.0024753388749970996)
2026-06-04 17:33:18,047 - optuna.study.study - INFO - Trial 34 finished with values: [0.00433524129107238, 0.000828923571572108, 0.0024753388749970996] and parameters: {'n_layers': 4, 'embedding_dim': 32, 'lr': 0.003777254071001523, 'lambda_val': 0.014288330649818581, 'batch_size': 2067, 'optimizer': 'RMSprop'}.
2026-06-04 17:33:39,102 - experiment_functions - INFO - Early stopping at epoch 500. Best Metrics: (0.000361615739531112, 6.363453680755576e-05, 0.00017707972006189687)
2026-06-04 17:33:40,815 - optuna.study.study - INFO - Trial 35 finished with values: [0.000361615739531112, 6.363453680755576e-05, 0.00017707972006189687] and parameters: {'n_layers': 4, 'embedding_dim': 32, 'lr': 4.445356310699853e-05, 'lambda_val': 3.2921356557223836e-06, 'batch_size': 1071, 'optimizer': 'SGD'}.
2026-06-04 17:34:05,189 - experiment_functions - INFO - Early stopping at epoch 500. Best Metrics: (0.00038368243274224865, 5.3586978364257486e-05, 0.0001703598744229113)
2026-06-04 17:34:05,284 - optuna.study.study - INFO - Trial 36 finished with values: [0.00038368243274224865, 5.3586978364257486e-05, 0.0001703598744229113] and parameters: {'n_layers': 2, 'embedding_dim': 256, 'lr': 0.00027670661121871804, 'lambda_val': 0.0036203522910722673, 'batch_size': 3360, 'optimizer': 'SGD'}.
2026-06-04 17:34:25,817 - experiment_functions - INFO - Early stopping at epoch 500. Best Metrics: (0.0004930616764764538, 7.870587447250318e-05, 0.000243406329252592)
2026-06-04 17:34:26,030 - optuna.study.study - INFO - Trial 37 finished with values: [0.0004930616764764538, 7.870587447250318e-05, 0.000243406329252592] and parameters: {'n_layers': 2, 'embedding_dim': 32, 'lr': 0.010564178384140486, 'lambda_val': 0.004320326268445537, 'batch_size': 3119, 'optimizer': 'SGD'}.
2026-06-04 17:35:01,326 - experiment_functions - INFO - Early stopping at epoch 800. Best Metrics: (0.0037348154802839136, 0.0006983053118092304, 0.002234511629197311)
2026-06-04 17:35:01,422 - optuna.study.study - INFO - Trial 38 finished with values: [0.0037348154802839136, 0.0006983053118092304, 0.002234511629197311] and parameters: {'n_layers': 3, 'embedding_dim': 128, 'lr': 0.02827896378992597, 'lambda_val': 0.0007827624692138454, 'batch_size': 1664, 'optimizer': 'RMSprop'}.
2026-06-04 17:35:34,760 - experiment_functions - INFO - Early stopping at epoch 800. Best Metrics: (0.0006214143766373101, 9.37772121374506e-05, 0.0003142718814768092)
2026-06-04 17:35:35,952 - optuna.study.study - INFO - Trial 39 finished with values: [0.0006214143766373101, 9.37772121374506e-05, 0.0003142718814768092] and parameters: {'n_layers': 3, 'embedding_dim': 96, 'lr': 0.02983878771088268, 'lambda_val': 8.6979092787628e-06, 'batch_size': 674, 'optimizer': 'SGD'}.
2026-06-04 17:36:01,775 - experiment_functions - INFO - Early stopping at epoch 500. Best Metrics: (0.0006083613269047086, 0.00010549936365463192, 0.0002857503966396874)
2026-06-04 17:36:01,916 - optuna.study.study - INFO - Trial 40 finished with values: [0.0006083613269047086, 0.00010549936365463192, 0.0002857503966396874] and parameters: {'n_layers': 3, 'embedding_dim': 256, 'lr': 1.1841364370748706e-05, 'lambda_val': 0.009867291930335193, 'batch_size': 1550, 'optimizer': 'SGD'}.
2026-06-04 17:36:27,616 - experiment_functions - INFO - Early stopping at epoch 500. Best Metrics: (0.0006549925355442199, 5.861075758590662e-05, 0.00030172782510481667)
2026-06-04 17:36:29,543 - optuna.study.study - INFO - Trial 41 finished with values: [0.0006549925355442199, 5.861075758590662e-05, 0.00030172782510481667] and parameters: {'n_layers': 3, 'embedding_dim': 256, 'lr': 4.167190185556184e-05, 'lambda_val': 0.0001578161643642247, 'batch_size': 2598, 'optimizer': 'SGD'}.
2026-06-04 17:36:52,073 - experiment_functions - INFO - Early stopping at epoch 550. Best Metrics: (0.003462022236318799, 0.0004889811775738496, 0.0019841793605964897)
2026-06-04 17:36:52,622 - optuna.study.study - INFO - Trial 42 finished with values: [0.003462022236318799, 0.0004889811775738496, 0.0019841793605964897] and parameters: {'n_layers': 2, 'embedding_dim': 32, 'lr': 0.011166658072200589, 'lambda_val': 0.0053501705460420115, 'batch_size': 1084, 'optimizer': 'Adam'}.
2026-06-04 17:37:29,112 - experiment_functions - INFO - Early stopping at epoch 850. Best Metrics: (0.004879610487713241, 0.0007384955455824236, 0.002609409268614036)
2026-06-04 17:37:30,155 - optuna.study.study - INFO - Trial 43 finished with values: [0.004879610487713241, 0.0007384955455824236, 0.002609409268614036] and parameters: {'n_layers': 1, 'embedding_dim': 32, 'lr': 0.003020999848042007, 'lambda_val': 0.0010139778593023846, 'batch_size': 1575, 'optimizer': 'Adam'}.
2026-06-04 17:37:59,693 - experiment_functions - INFO - Early stopping at epoch 500. Best Metrics: (0.0004404087435688875, 5.3586978364257486e-05, 0.00015792430013414422)
2026-06-04 17:37:59,977 - optuna.study.study - INFO - Trial 44 finished with values: [0.0004404087435688875, 5.3586978364257486e-05, 0.00015792430013414422] and parameters: {'n_layers': 3, 'embedding_dim': 256, 'lr': 0.0010883410542181845, 'lambda_val': 0.0010582799095148324, 'batch_size': 775, 'optimizer': 'SGD'}.
2026-06-04 17:38:21,725 - experiment_functions - INFO - Early stopping at epoch 500. Best Metrics: (0.0006276946087811165, 7.703128139862013e-05, 0.00028167918851544144)
2026-06-04 17:38:21,815 - optuna.study.study - INFO - Trial 45 finished with values: [0.0006276946087811165, 7.703128139862013e-05, 0.00028167918851544144] and parameters: {'n_layers': 2, 'embedding_dim': 64, 'lr': 2.168099392282134e-05, 'lambda_val': 0.0640428692522824, 'batch_size': 1093, 'optimizer': 'SGD'}.
2026-06-04 17:38:44,008 - experiment_functions - INFO - Early stopping at epoch 500. Best Metrics: (0.0005432779362968366, 7.87058744725032e-05, 0.00022737487599109476)
2026-06-04 17:38:44,607 - optuna.study.study - INFO - Trial 46 finished with values: [0.0005432779362968366, 7.87058744725032e-05, 0.00022737487599109476] and parameters: {'n_layers': 4, 'embedding_dim': 96, 'lr': 0.08048346384618388, 'lambda_val': 0.0011239079008896861, 'batch_size': 3010, 'optimizer': 'SGD'}.
2026-06-04 17:39:33,282 - experiment_functions - INFO - Early stopping at epoch 1050. Best Metrics: (0.01045006395733114, 0.0019324804072610358, 0.006082486450273194)
2026-06-04 17:39:33,379 - optuna.study.study - INFO - Trial 47 finished with values: [0.01045006395733114, 0.0019324804072610358, 0.006082486450273194] and parameters: {'n_layers': 4, 'embedding_dim': 128, 'lr': 0.0011827350330377861, 'lambda_val': 2.344534953461632e-06, 'batch_size': 1621, 'optimizer': 'RMSprop'}.
2026-06-04 17:40:32,330 - experiment_functions - INFO - Early stopping at epoch 1400. Best Metrics: (0.004462429551831836, 0.0007803603724294997, 0.00263192011013589)
2026-06-04 17:40:32,440 - optuna.study.study - INFO - Trial 48 finished with values: [0.004462429551831836, 0.0007803603724294997, 0.00263192011013589] and parameters: {'n_layers': 1, 'embedding_dim': 256, 'lr': 0.004846510423333318, 'lambda_val': 0.00030928804991492686, 'batch_size': 938, 'optimizer': 'Adam'}.
2026-06-04 17:40:53,391 - experiment_functions - INFO - Early stopping at epoch 500. Best Metrics: (0.00045186739154464935, 7.033290910308795e-05, 0.0001976251728601279)
2026-06-04 17:40:54,095 - optuna.study.study - INFO - Trial 49 finished with values: [0.00045186739154464935, 7.033290910308795e-05, 0.0001976251728601279] and parameters: {'n_layers': 4, 'embedding_dim': 32, 'lr': 0.009905759851486255, 'lambda_val': 0.0023559516185051557, 'batch_size': 514, 'optimizer': 'SGD'}.
2026-06-04 17:42:17,370 - experiment_functions - INFO - Early stopping at epoch 1950. Best Metrics: (0.004657236276300819, 0.0008707883984191843, 0.0025466961062527277)
2026-06-04 17:42:18,428 - optuna.study.study - INFO - Trial 50 finished with values: [0.004657236276300819, 0.0008707883984191843, 0.0025466961062527277] and parameters: {'n_layers': 1, 'embedding_dim': 256, 'lr': 0.004846510423333318, 'lambda_val': 0.003566951312101301, 'batch_size': 3322, 'optimizer': 'Adam'}.
2026-06-04 17:42:46,737 - experiment_functions - INFO - Early stopping at epoch 700. Best Metrics: (0.004146219120705083, 0.0006530912988143881, 0.0025269729234426667)
2026-06-04 17:42:46,829 - optuna.study.study - INFO - Trial 51 finished with values: [0.004146219120705083, 0.0006530912988143881, 0.0025269729234426667] and parameters: {'n_layers': 1, 'embedding_dim': 96, 'lr': 0.020299600929016177, 'lambda_val': 5.520510971299447e-06, 'batch_size': 3889, 'optimizer': 'Adam'}.
2026-06-04 17:43:57,774 - experiment_functions - INFO - Early stopping at epoch 1900. Best Metrics: (0.004367850755640703, 0.000825574385424342, 0.0024084969982676434)
2026-06-04 17:43:57,854 - optuna.study.study - INFO - Trial 52 finished with values: [0.004367850755640703, 0.000825574385424342, 0.0024084969982676434] and parameters: {'n_layers': 1, 'embedding_dim': 64, 'lr': 0.014232768730502419, 'lambda_val': 0.005578758561394433, 'batch_size': 2180, 'optimizer': 'RMSprop'}.
2026-06-04 17:44:23,324 - experiment_functions - INFO - Early stopping at epoch 650. Best Metrics: (0.004006658314695406, 0.0005425681559381072, 0.002069469994805487)
2026-06-04 17:44:23,845 - optuna.study.study - INFO - Trial 53 finished with values: [0.004006658314695406, 0.0005425681559381072, 0.002069469994805487] and parameters: {'n_layers': 1, 'embedding_dim': 32, 'lr': 0.005575824047051625, 'lambda_val': 0.00014211823475497582, 'batch_size': 3648, 'optimizer': 'Adam'}.
2026-06-04 17:44:45,016 - experiment_functions - INFO - Early stopping at epoch 500. Best Metrics: (0.0006511848823548276, 7.703128139862015e-05, 0.00032879749097880354)
2026-06-04 17:44:45,923 - optuna.study.study - INFO - Trial 54 finished with values: [0.0006511848823548276, 7.703128139862015e-05, 0.00032879749097880354] and parameters: {'n_layers': 2, 'embedding_dim': 96, 'lr': 0.0848575531057853, 'lambda_val': 0.0011239079008896861, 'batch_size': 1336, 'optimizer': 'SGD'}.
2026-06-04 17:45:12,456 - experiment_functions - INFO - Early stopping at epoch 500. Best Metrics: (0.0002281301102658657, 4.8563199142608344e-05, 0.0001231993897661564)
2026-06-04 17:45:12,560 - optuna.study.study - INFO - Trial 55 finished with values: [0.0002281301102658657, 4.8563199142608344e-05, 0.0001231993897661564] and parameters: {'n_layers': 4, 'embedding_dim': 96, 'lr': 0.014970226258122101, 'lambda_val': 4.196870314530011e-06, 'batch_size': 3943, 'optimizer': 'SGD'}.
2026-06-04 17:46:18,020 - experiment_functions - INFO - Early stopping at epoch 1500. Best Metrics: (0.004163171414942116, 0.0007669636278384352, 0.002356852543239789)
