2026-06-04 05:09:31,215 - optuna.study.study - INFO - Trial 257 finished with values: [0.008452117219532061, 0.00144015004353942, 0.004988831996573617] and parameters: {'n_layers': 3, 'embedding_dim': 32, 'lr': 0.0007463197710430186, 'lambda_val': 0.0001888631680612503, 'batch_size': 3864, 'optimizer': 'RMSprop'}.
2026-06-04 05:09:55,277 - experiment_functions - INFO - Early stopping at epoch 500. Best Metrics: (0.00044209827014305434, 7.200750217697099e-05, 0.0001734956026980053)
2026-06-04 05:09:55,401 - optuna.study.study - INFO - Trial 258 finished with values: [0.00044209827014305434, 7.200750217697099e-05, 0.0001734956026980053] and parameters: {'n_layers': 2, 'embedding_dim': 256, 'lr': 0.0007463197710430186, 'lambda_val': 2.6963455125652685e-06, 'batch_size': 2083, 'optimizer': 'SGD'}.
2026-06-04 05:11:44,317 - experiment_functions - INFO - Early stopping at epoch 2600. Best Metrics: (0.010828457836053818, 0.0018688458704534797, 0.0060216915279668)
2026-06-04 05:11:44,419 - optuna.study.study - INFO - Trial 259 finished with values: [0.010828457836053818, 0.0018688458704534797, 0.0060216915279668] and parameters: {'n_layers': 3, 'embedding_dim': 128, 'lr': 0.0006097425316287412, 'lambda_val': 1.0360779001134501e-06, 'batch_size': 2083, 'optimizer': 'RMSprop'}.
2026-06-04 05:12:04,831 - experiment_functions - INFO - Early stopping at epoch 500. Best Metrics: (0.00046665120737841837, 6.698372295532186e-05, 0.0002070188237671969)
2026-06-04 05:12:05,232 - optuna.study.study - INFO - Trial 260 finished with values: [0.00046665120737841837, 6.698372295532186e-05, 0.0002070188237671969] and parameters: {'n_layers': 2, 'embedding_dim': 32, 'lr': 0.0008797904665419303, 'lambda_val': 0.00026012148846087845, 'batch_size': 3163, 'optimizer': 'SGD'}.
2026-06-04 05:12:35,443 - experiment_functions - INFO - Early stopping at epoch 550. Best Metrics: (0.0071709451981548265, 0.001265992363855583, 0.0038181300181778935)
2026-06-04 05:12:35,986 - optuna.study.study - INFO - Trial 261 finished with values: [0.0071709451981548265, 0.001265992363855583, 0.0038181300181778935] and parameters: {'n_layers': 4, 'embedding_dim': 256, 'lr': 0.0036679476641700757, 'lambda_val': 0.00015132695924103293, 'batch_size': 2550, 'optimizer': 'RMSprop'}.
2026-06-04 05:13:00,783 - experiment_functions - INFO - Early stopping at epoch 550. Best Metrics: (0.0064755275448470226, 0.0011203027664277582, 0.0038757522304540526)
2026-06-04 05:13:01,784 - optuna.study.study - INFO - Trial 262 finished with values: [0.0064755275448470226, 0.0011203027664277582, 0.0038757522304540526] and parameters: {'n_layers': 3, 'embedding_dim': 128, 'lr': 0.004799363271853079, 'lambda_val': 1.7872411446639862e-05, 'batch_size': 3299, 'optimizer': 'RMSprop'}.
2026-06-04 05:14:58,225 - experiment_functions - INFO - Early stopping at epoch 3150. Best Metrics: (0.0005448951640105938, 8.372965369415233e-05, 0.00023093568413363045)
2026-06-04 05:14:58,322 - optuna.study.study - INFO - Trial 263 finished with values: [0.0005448951640105938, 8.372965369415233e-05, 0.00023093568413363045] and parameters: {'n_layers': 1, 'embedding_dim': 96, 'lr': 1.09942755931502e-05, 'lambda_val': 1.9870285249823955e-06, 'batch_size': 1164, 'optimizer': 'Adam'}.
2026-06-04 05:15:19,161 - experiment_functions - INFO - Early stopping at epoch 500. Best Metrics: (0.00042478740985705485, 6.530912988143882e-05, 0.00017166074527829857)
2026-06-04 05:15:19,260 - optuna.study.study - INFO - Trial 264 finished with values: [0.00042478740985705485, 6.530912988143882e-05, 0.00017166074527829857] and parameters: {'n_layers': 3, 'embedding_dim': 64, 'lr': 0.011882715549269481, 'lambda_val': 0.0001888631680612503, 'batch_size': 2271, 'optimizer': 'SGD'}.
2026-06-04 05:15:57,880 - experiment_functions - INFO - Early stopping at epoch 1000. Best Metrics: (0.010440262623198958, 0.0017750686583160292, 0.006235345774264331)
2026-06-04 05:15:58,074 - optuna.study.study - INFO - Trial 265 finished with values: [0.010440262623198958, 0.0017750686583160292, 0.006235345774264331] and parameters: {'n_layers': 3, 'embedding_dim': 32, 'lr': 0.0036679476641700757, 'lambda_val': 9.396340181954428e-05, 'batch_size': 602, 'optimizer': 'RMSprop'}.
2026-06-04 05:16:28,617 - experiment_functions - INFO - Early stopping at epoch 600. Best Metrics: (0.006979065245196077, 0.0012710161430772322, 0.003974547727659662)
2026-06-04 05:16:29,709 - optuna.study.study - INFO - Trial 266 finished with values: [0.006979065245196077, 0.0012710161430772322, 0.003974547727659662] and parameters: {'n_layers': 3, 'embedding_dim': 256, 'lr': 0.0036679476641700757, 'lambda_val': 4.115726125333198e-06, 'batch_size': 2449, 'optimizer': 'RMSprop'}.
2026-06-04 05:18:52,271 - optuna.study.study - INFO - Trial 267 finished with values: [0.006137405292328837, 0.001051644450398553, 0.003652007706453898] and parameters: {'n_layers': 2, 'embedding_dim': 32, 'lr': 0.0009744505282133616, 'lambda_val': 0.0001888631680612503, 'batch_size': 1752, 'optimizer': 'Adam'}.
2026-06-04 05:20:08,259 - experiment_functions - INFO - Early stopping at epoch 1800. Best Metrics: (0.010993718531621349, 0.0019709960479603454, 0.00663573002763652)
2026-06-04 05:20:08,415 - optuna.study.study - INFO - Trial 268 finished with values: [0.010993718531621349, 0.0019709960479603454, 0.00663573002763652] and parameters: {'n_layers': 3, 'embedding_dim': 128, 'lr': 0.0009744505282133616, 'lambda_val': 8.472875869813855e-05, 'batch_size': 1158, 'optimizer': 'RMSprop'}.
2026-06-04 05:20:31,037 - experiment_functions - INFO - Early stopping at epoch 500. Best Metrics: (0.0006369370046036089, 7.53566883247371e-05, 0.00028438039184828845)
2026-06-04 05:20:31,146 - optuna.study.study - INFO - Trial 269 finished with values: [0.0006369370046036089, 7.53566883247371e-05, 0.00028438039184828845] and parameters: {'n_layers': 3, 'embedding_dim': 128, 'lr': 0.0009744505282133616, 'lambda_val': 2.6963455125652685e-06, 'batch_size': 602, 'optimizer': 'SGD'}.
2026-06-04 05:22:07,894 - experiment_functions - INFO - Early stopping at epoch 2200. Best Metrics: (0.0100841108745564, 0.001826981043606404, 0.005810127083424156)
2026-06-04 05:22:08,008 - optuna.study.study - INFO - Trial 270 finished with values: [0.0100841108745564, 0.001826981043606404, 0.005810127083424156] and parameters: {'n_layers': 4, 'embedding_dim': 128, 'lr': 0.0009744505282133616, 'lambda_val': 8.472875869813855e-05, 'batch_size': 1158, 'optimizer': 'Adam'}.
2026-06-04 05:23:24,978 - experiment_functions - INFO - Early stopping at epoch 1700. Best Metrics: (0.006997226673641209, 0.0012860874807421796, 0.004126369078182342)
2026-06-04 05:23:25,071 - optuna.study.study - INFO - Trial 271 finished with values: [0.006997226673641209, 0.0012860874807421796, 0.004126369078182342] and parameters: {'n_layers': 2, 'embedding_dim': 256, 'lr': 0.0008797904665419303, 'lambda_val': 2.6963455125652685e-06, 'batch_size': 3163, 'optimizer': 'RMSprop'}.
2026-06-04 05:24:27,117 - experiment_functions - INFO - Early stopping at epoch 1400. Best Metrics: (0.010639291625764739, 0.0020279322124723696, 0.0061645900752726615)
2026-06-04 05:24:27,307 - optuna.study.study - INFO - Trial 272 finished with values: [0.010639291625764739, 0.0020279322124723696, 0.0061645900752726615] and parameters: {'n_layers': 4, 'embedding_dim': 128, 'lr': 0.0008797904665419303, 'lambda_val': 7.233718216592713e-05, 'batch_size': 1553, 'optimizer': 'RMSprop'}.
2026-06-04 05:25:34,438 - experiment_functions - INFO - Early stopping at epoch 1650. Best Metrics: (0.007027779090083792, 0.0012425480608212207, 0.003976892482261398)
2026-06-04 05:25:34,528 - optuna.study.study - INFO - Trial 273 finished with values: [0.007027779090083792, 0.0012425480608212207, 0.003976892482261398] and parameters: {'n_layers': 2, 'embedding_dim': 128, 'lr': 0.0008797904665419303, 'lambda_val': 0.00011034453274605101, 'batch_size': 3163, 'optimizer': 'RMSprop'}.
2026-06-04 05:26:32,131 - experiment_functions - INFO - Early stopping at epoch 1400. Best Metrics: (0.006821878908467604, 0.0011990086409002614, 0.004065733749454272)
2026-06-04 05:26:32,231 - optuna.study.study - INFO - Trial 274 finished with values: [0.006821878908467604, 0.0011990086409002614, 0.004065733749454272] and parameters: {'n_layers': 2, 'embedding_dim': 128, 'lr': 0.0008797904665419303, 'lambda_val': 0.00026012148846087845, 'batch_size': 3163, 'optimizer': 'RMSprop'}.
2026-06-04 05:27:45,062 - experiment_functions - INFO - Early stopping at epoch 1300. Best Metrics: (0.011114356959410272, 0.0020647732600977964, 0.0063086868403044805)
2026-06-04 05:27:45,165 - optuna.study.study - INFO - Trial 275 finished with values: [0.011114356959410272, 0.0020647732600977964, 0.0063086868403044805] and parameters: {'n_layers': 4, 'embedding_dim': 256, 'lr': 0.0009744505282133616, 'lambda_val': 1.6132262100968452e-05, 'batch_size': 870, 'optimizer': 'RMSprop'}.
2026-06-04 05:28:42,058 - experiment_functions - INFO - Early stopping at epoch 1250. Best Metrics: (0.008667712846641376, 0.0015791412686717128, 0.004855977898718712)
2026-06-04 05:28:42,388 - optuna.study.study - INFO - Trial 276 finished with values: [0.008667712846641376, 0.0015791412686717128, 0.004855977898718712] and parameters: {'n_layers': 4, 'embedding_dim': 128, 'lr': 0.0008797904665419303, 'lambda_val': 0.0005210088573938224, 'batch_size': 2353, 'optimizer': 'Adam'}.
2026-06-04 05:29:15,699 - experiment_functions - INFO - Early stopping at epoch 600. Best Metrics: (0.006386861338282467, 0.00114877084868377, 0.003623694196078735)
2026-06-04 05:29:16,448 - optuna.study.study - INFO - Trial 277 finished with values: [0.006386861338282467, 0.00114877084868377, 0.003623694196078735] and parameters: {'n_layers': 4, 'embedding_dim': 256, 'lr': 0.010519255162305941, 'lambda_val': 1.9870285249823955e-06, 'batch_size': 3903, 'optimizer': 'Adam'}.
2026-06-04 05:29:43,958 - experiment_functions - INFO - Early stopping at epoch 650. Best Metrics: (0.007194660905259882, 0.0013112063768504253, 0.004188290248832633)
2026-06-04 05:29:44,054 - optuna.study.study - INFO - Trial 278 finished with values: [0.007194660905259882, 0.0013112063768504253, 0.004188290248832633] and parameters: {'n_layers': 4, 'embedding_dim': 64, 'lr': 0.0036679476641700757, 'lambda_val': 0.00015132695924103293, 'batch_size': 2672, 'optimizer': 'RMSprop'}.
2026-06-04 05:30:09,747 - experiment_functions - INFO - Early stopping at epoch 600. Best Metrics: (0.005229691055984025, 0.001004755844329828, 0.003205346860889952)
2026-06-04 05:30:09,874 - optuna.study.study - INFO - Trial 279 finished with values: [0.005229691055984025, 0.001004755844329828, 0.003205346860889952] and parameters: {'n_layers': 4, 'embedding_dim': 64, 'lr': 0.0025795756581398536, 'lambda_val': 0.015023604159818906, 'batch_size': 1943, 'optimizer': 'RMSprop'}.
2026-06-04 05:30:50,349 - experiment_functions - INFO - Early stopping at epoch 900. Best Metrics: (0.005076109436293219, 0.0009360975283006231, 0.002920241822859454)
2026-06-04 05:30:50,538 - optuna.study.study - INFO - Trial 280 finished with values: [0.005076109436293219, 0.0009360975283006231, 0.002920241822859454] and parameters: {'n_layers': 4, 'embedding_dim': 96, 'lr': 0.0009744505282133616, 'lambda_val': 0.046637586989731264, 'batch_size': 3929, 'optimizer': 'Adam'}.
2026-06-04 05:31:42,020 - experiment_functions - INFO - Early stopping at epoch 1300. Best Metrics: (0.012634479990426967, 0.00227577198740706, 0.007500057558874691)
2026-06-04 05:31:42,154 - optuna.study.study - INFO - Trial 281 finished with values: [0.012634479990426967, 0.00227577198740706, 0.007500057558874691] and parameters: {'n_layers': 3, 'embedding_dim': 64, 'lr': 0.0025795756581398536, 'lambda_val': 5.282448475572872e-06, 'batch_size': 528, 'optimizer': 'RMSprop'}.
2026-06-04 05:32:27,591 - experiment_functions - INFO - Early stopping at epoch 1100. Best Metrics: (0.008636903760119403, 0.0015674191171545315, 0.004912367751641037)
2026-06-04 05:32:27,694 - optuna.study.study - INFO - Trial 282 finished with values: [0.008636903760119403, 0.0015674191171545315, 0.004912367751641037] and parameters: {'n_layers': 3, 'embedding_dim': 96, 'lr': 0.0025795756581398536, 'lambda_val': 0.00015132695924103293, 'batch_size': 679, 'optimizer': 'Adam'}.
2026-06-04 05:33:34,250 - experiment_functions - INFO - Early stopping at epoch 1400. Best Metrics: (0.0004757148709780665, 7.53566883247371e-05, 0.000242211833005329)
2026-06-04 05:33:34,401 - optuna.study.study - INFO - Trial 283 finished with values: [0.0004757148709780665, 7.53566883247371e-05, 0.000242211833005329] and parameters: {'n_layers': 3, 'embedding_dim': 256, 'lr': 1.213436504513271e-05, 'lambda_val': 9.396340181954428e-05, 'batch_size': 602, 'optimizer': 'RMSprop'}.
2026-06-04 05:34:34,208 - experiment_functions - INFO - Early stopping at epoch 1150. Best Metrics: (0.00842441576641514, 0.0015037845803469755, 0.004736688703549885)
2026-06-04 05:34:34,417 - optuna.study.study - INFO - Trial 284 finished with values: [0.00842441576641514, 0.0015037845803469755, 0.004736688703549885] and parameters: {'n_layers': 4, 'embedding_dim': 256, 'lr': 0.0008797904665419303, 'lambda_val': 0.0002966875497275749, 'batch_size': 1752, 'optimizer': 'Adam'}.
2026-06-04 05:35:06,833 - experiment_functions - INFO - Early stopping at epoch 600. Best Metrics: (0.00721048125219036, 0.0013246031214414896, 0.003986208463112929)
2026-06-04 05:35:06,954 - optuna.study.study - INFO - Trial 285 finished with values: [0.00721048125219036, 0.0013246031214414896, 0.003986208463112929] and parameters: {'n_layers': 4, 'embedding_dim': 256, 'lr': 0.005091659899861729, 'lambda_val': 2.6963455125652685e-06, 'batch_size': 4030, 'optimizer': 'Adam'}.
2026-06-04 05:35:44,256 - experiment_functions - INFO - Early stopping at epoch 700. Best Metrics: (0.008270970418011558, 0.001473641905017081, 0.004656570963755135)
2026-06-04 05:35:44,815 - optuna.study.study - INFO - Trial 286 finished with values: [0.008270970418011558, 0.001473641905017081, 0.004656570963755135] and parameters: {'n_layers': 4, 'embedding_dim': 256, 'lr': 0.0025795756581398536, 'lambda_val': 0.00015132695924103293, 'batch_size': 679, 'optimizer': 'RMSprop'}.
2026-06-04 05:36:11,327 - experiment_functions - INFO - Early stopping at epoch 650. Best Metrics: (0.00613540890174885, 0.0011403978833143544, 0.003681091560096759)
2026-06-04 05:36:11,426 - optuna.study.study - INFO - Trial 287 finished with values: [0.00613540890174885, 0.0011403978833143544, 0.003681091560096759] and parameters: {'n_layers': 3, 'embedding_dim': 64, 'lr': 0.009270963217244401, 'lambda_val': 9.396340181954428e-05, 'batch_size': 1296, 'optimizer': 'Adam'}.
2026-06-04 05:36:41,902 - experiment_functions - INFO - Early stopping at epoch 600. Best Metrics: (0.006311335510103248, 0.0011621675932748344, 0.0036019784135299148)
2026-06-04 05:36:42,012 - optuna.study.study - INFO - Trial 288 finished with values: [0.006311335510103248, 0.0011621675932748344, 0.0036019784135299148] and parameters: {'n_layers': 3, 'embedding_dim': 256, 'lr': 0.004148540178413485, 'lambda_val': 1.7827761161994677e-05, 'batch_size': 1158, 'optimizer': 'RMSprop'}.
2026-06-04 05:37:45,138 - experiment_functions - INFO - Early stopping at epoch 1600. Best Metrics: (0.00773440093838795, 0.0014686181257954317, 0.0047248484737972656)
2026-06-04 05:37:45,251 - optuna.study.study - INFO - Trial 289 finished with values: [0.00773440093838795, 0.0014686181257954317, 0.0047248484737972656] and parameters: {'n_layers': 4, 'embedding_dim': 64, 'lr': 0.0008204274611611849, 'lambda_val': 3.918957207828335e-06, 'batch_size': 3163, 'optimizer': 'Adam'}.
2026-06-04 05:39:23,908 - experiment_functions - INFO - Early stopping at epoch 2400. Best Metrics: (0.00648314917860234, 0.0011387232902404715, 0.003598650075998234)
2026-06-04 05:39:24,387 - optuna.study.study - INFO - Trial 290 finished with values: [0.00648314917860234, 0.0011387232902404715, 0.003598650075998234] and parameters: {'n_layers': 2, 'embedding_dim': 128, 'lr': 0.0009744505282133616, 'lambda_val': 8.472875869813855e-05, 'batch_size': 3163, 'optimizer': 'Adam'}.
2026-06-04 05:40:20,172 - experiment_functions - INFO - Early stopping at epoch 1300. Best Metrics: (0.005014095432883102, 0.0009076294460446113, 0.00297253705026271)
2026-06-04 05:40:20,882 - optuna.study.study - INFO - Trial 291 finished with values: [0.005014095432883102, 0.0009076294460446113, 0.00297253705026271] and parameters: {'n_layers': 1, 'embedding_dim': 256, 'lr': 0.0025795756581398536, 'lambda_val': 1.6132262100968452e-05, 'batch_size': 3299, 'optimizer': 'RMSprop'}.
2026-06-04 05:40:54,196 - experiment_functions - INFO - Early stopping at epoch 850. Best Metrics: (0.008132846336460699, 0.0014284278920222388, 0.004779128006394929)
2026-06-04 05:40:54,298 - optuna.study.study - INFO - Trial 292 finished with values: [0.008132846336460699, 0.0014284278920222388, 0.004779128006394929] and parameters: {'n_layers': 3, 'embedding_dim': 32, 'lr': 0.0036679476641700757, 'lambda_val': 5.37424644644685e-06, 'batch_size': 1158, 'optimizer': 'Adam'}.
2026-06-04 05:41:39,328 - experiment_functions - INFO - Early stopping at epoch 1050. Best Metrics: (0.0003365086312771362, 6.698372295532186e-05, 0.0001799440856914663)
2026-06-04 05:41:39,431 - optuna.study.study - INFO - Trial 293 finished with values: [0.0003365086312771362, 6.698372295532186e-05, 0.0001799440856914663] and parameters: {'n_layers': 3, 'embedding_dim': 128, 'lr': 1.1848150154457843e-05, 'lambda_val': 0.00015132695924103293, 'batch_size': 1752, 'optimizer': 'RMSprop'}.
2026-06-04 05:42:05,055 - experiment_functions - INFO - Early stopping at epoch 600. Best Metrics: (0.006207603552096536, 0.0012090561993435595, 0.0035298053481755526)
2026-06-04 05:42:05,721 - optuna.study.study - INFO - Trial 294 finished with values: [0.006207603552096536, 0.0012090561993435595, 0.0035298053481755526] and parameters: {'n_layers': 4, 'embedding_dim': 64, 'lr': 0.0025795756581398536, 'lambda_val': 0.005541307625282511, 'batch_size': 1752, 'optimizer': 'RMSprop'}.
2026-06-04 05:42:56,717 - experiment_functions - INFO - Early stopping at epoch 1350. Best Metrics: (0.004416458585749938, 0.0007803603724294996, 0.0025970863592511884)
2026-06-04 05:42:57,079 - optuna.study.study - INFO - Trial 295 finished with values: [0.004416458585749938, 0.0007803603724294996, 0.0025970863592511884] and parameters: {'n_layers': 2, 'embedding_dim': 32, 'lr': 0.0007463197710430186, 'lambda_val': 0.014686153890429031, 'batch_size': 2716, 'optimizer': 'RMSprop'}.
2026-06-04 05:43:36,032 - experiment_functions - INFO - Early stopping at epoch 1000. Best Metrics: (0.005394872539302282, 0.0009779623551476992, 0.0029384952735508735)
2026-06-04 05:43:37,148 - optuna.study.study - INFO - Trial 296 finished with values: [0.005394872539302282, 0.0009779623551476992, 0.0029384952735508735] and parameters: {'n_layers': 3, 'embedding_dim': 32, 'lr': 0.0007463197710430186, 'lambda_val': 0.019100531183395667, 'batch_size': 3163, 'optimizer': 'RMSprop'}.
2026-06-04 05:44:19,981 - experiment_functions - INFO - Early stopping at epoch 950. Best Metrics: (0.009956072064304475, 0.0017516243552816665, 0.005726305681317463)
2026-06-04 05:44:20,119 - optuna.study.study - INFO - Trial 297 finished with values: [0.009956072064304475, 0.0017516243552816665, 0.005726305681317463] and parameters: {'n_layers': 4, 'embedding_dim': 128, 'lr': 0.0014393148291660118, 'lambda_val': 8.472875869813855e-05, 'batch_size': 1328, 'optimizer': 'Adam'}.
2026-06-04 05:46:42,851 - optuna.study.study - INFO - Trial 298 finished with values: [0.006246653238342207, 0.0008222251992765758, 0.003751139615384104] and parameters: {'n_layers': 2, 'embedding_dim': 32, 'lr': 0.0007463197710430186, 'lambda_val': 5.282448475572872e-06, 'batch_size': 528, 'optimizer': 'Adam'}.
2026-06-04 05:47:12,923 - experiment_functions - INFO - Early stopping at epoch 750. Best Metrics: (0.004001461694203504, 0.0007451939178779557, 0.0023709485308432217)
2026-06-04 05:47:13,430 - optuna.study.study - INFO - Trial 299 finished with values: [0.004001461694203504, 0.0007451939178779557, 0.0023709485308432217] and parameters: {'n_layers': 2, 'embedding_dim': 64, 'lr': 0.0036679476641700757, 'lambda_val': 0.012766188824047193, 'batch_size': 1759, 'optimizer': 'Adam'}.
2026-06-04 05:47:13,445 - root - INFO - Selected Trial 281 based on Max ndcg: 0.0075
2026-06-04 05:47:13,445 - root - INFO - Associated Recall: 0.0126
2026-06-04 05:47:13,445 - experiment_functions - INFO - Training the best model ... for e_gowalla_1c1dcs_strict_rand2
2026-06-04 05:48:15,487 - experiment_functions - INFO - Early stopping at epoch 1600. Best Metrics: (0.012670950647129406, 0.0022372563467077497, 0.0078124448250917805)
2026-06-04 05:48:18,920 - root - INFO -   **** Training e_gowalla_1c1dcs_strict_rand3
2026-06-04 05:48:18,939 - root - INFO -   **** Getting 51651/845292 random edges
2026-06-04 05:48:19,798 - optuna.storages._rdb.storage - INFO - A new study created in RDB with name: Study_e_gowalla_1c1dcs_strict_rand3
2026-06-04 05:50:46,681 - optuna.study.study - INFO - Trial 0 finished with values: [0.005497881359205578, 0.0008238997923504589, 0.003001282581534644] and parameters: {'n_layers': 1, 'embedding_dim': 64, 'lr': 0.0009358706696693685, 'lambda_val': 2.2519914952733722e-06, 'batch_size': 4017, 'optimizer': 'Adam'}.
2026-06-04 05:53:32,195 - optuna.study.study - INFO - Trial 1 finished with values: [0.0017409073957451637, 0.00023611762341750958, 0.0008486980359856595] and parameters: {'n_layers': 3, 'embedding_dim': 128, 'lr': 0.00012113582018162265, 'lambda_val': 1.9086610212452873e-05, 'batch_size': 2568, 'optimizer': 'Adam'}.
2026-06-04 05:54:42,842 - experiment_functions - INFO - Early stopping at epoch 1650. Best Metrics: (0.004548719052753143, 0.0008607408399758859, 0.0024833558670482093)
