2026-06-05 01:34:05,642 - optuna.study.study - INFO - Trial 140 finished with values: [0.027750647973693282, 0.003921896979034095, 0.015541558080498358] and parameters: {'n_layers': 2, 'embedding_dim': 256, 'lr': 0.00011825532801285016, 'lambda_val': 0.0014577942142459904, 'batch_size': 3888, 'optimizer': 'Adam'}.
2026-06-05 01:37:00,670 - optuna.study.study - INFO - Trial 141 finished with values: [0.014591640523591451, 0.0020965905285015743, 0.008744469268099464] and parameters: {'n_layers': 1, 'embedding_dim': 256, 'lr': 0.00014762589122934152, 'lambda_val': 8.600399380889837e-06, 'batch_size': 3577, 'optimizer': 'RMSprop'}.
2026-06-05 01:37:25,261 - experiment_functions - INFO - Early stopping at epoch 500. Best Metrics: (0.03963964014559878, 0.005166119632929198, 0.020669121620866367)
2026-06-05 01:37:25,442 - optuna.study.study - INFO - Trial 142 finished with values: [0.03963964014559878, 0.005166119632929198, 0.020669121620866367] and parameters: {'n_layers': 4, 'embedding_dim': 96, 'lr': 0.08294142044076476, 'lambda_val': 0.002216169184844733, 'batch_size': 516, 'optimizer': 'RMSprop'}.
2026-06-05 01:37:50,815 - experiment_functions - INFO - Early stopping at epoch 550. Best Metrics: (0.016565605827494362, 0.0019676468618125796, 0.008156422413284207)
2026-06-05 01:37:51,140 - optuna.study.study - INFO - Trial 143 finished with values: [0.016565605827494362, 0.0019676468618125796, 0.008156422413284207] and parameters: {'n_layers': 4, 'embedding_dim': 64, 'lr': 0.009556862834818597, 'lambda_val': 0.002216169184844733, 'batch_size': 3825, 'optimizer': 'Adam'}.
2026-06-05 01:38:17,013 - experiment_functions - INFO - Early stopping at epoch 550. Best Metrics: (0.027263873414845777, 0.0033810034161698703, 0.01294487848664571)
2026-06-05 01:38:17,661 - optuna.study.study - INFO - Trial 144 finished with values: [0.027263873414845777, 0.0033810034161698703, 0.01294487848664571] and parameters: {'n_layers': 2, 'embedding_dim': 128, 'lr': 0.017336107761708283, 'lambda_val': 1.6669472887970978e-05, 'batch_size': 3497, 'optimizer': 'Adam'}.
2026-06-05 01:38:39,834 - experiment_functions - INFO - Early stopping at epoch 500. Best Metrics: (0.00044726079385107607, 7.703128139862015e-05, 0.0002061678257919073)
2026-06-05 01:38:39,960 - optuna.study.study - INFO - Trial 145 finished with values: [0.00044726079385107607, 7.703128139862015e-05, 0.0002061678257919073] and parameters: {'n_layers': 2, 'embedding_dim': 96, 'lr': 0.0003278860610242573, 'lambda_val': 0.001834720302556635, 'batch_size': 3009, 'optimizer': 'SGD'}.
2026-06-05 01:41:11,401 - optuna.study.study - INFO - Trial 146 finished with values: [0.026097736166119084, 0.0036539620872128075, 0.014846481020433039] and parameters: {'n_layers': 1, 'embedding_dim': 64, 'lr': 0.0002686546266038812, 'lambda_val': 2.061360640875514e-06, 'batch_size': 2242, 'optimizer': 'Adam'}.
2026-06-05 01:42:13,873 - experiment_functions - INFO - Early stopping at epoch 1450. Best Metrics: (0.04094998331156883, 0.0050840645723089295, 0.019879258788771764)
2026-06-05 01:42:13,974 - optuna.study.study - INFO - Trial 147 finished with values: [0.04094998331156883, 0.0050840645723089295, 0.019879258788771764] and parameters: {'n_layers': 3, 'embedding_dim': 64, 'lr': 0.0011560040828054651, 'lambda_val': 0.0005094277795441267, 'batch_size': 2859, 'optimizer': 'Adam'}.
2026-06-05 01:45:07,152 - optuna.study.study - INFO - Trial 148 finished with values: [0.002494652358421388, 0.00040022774465804813, 0.0013322024821120805] and parameters: {'n_layers': 1, 'embedding_dim': 256, 'lr': 0.00011825532801285016, 'lambda_val': 0.004752309024246128, 'batch_size': 3577, 'optimizer': 'RMSprop'}.
2026-06-05 01:47:54,272 - optuna.study.study - INFO - Trial 149 finished with values: [0.053684300685922545, 0.006947886663540761, 0.027342867856829337] and parameters: {'n_layers': 2, 'embedding_dim': 96, 'lr': 0.0003278860610242573, 'lambda_val': 0.0003734366700851135, 'batch_size': 3114, 'optimizer': 'Adam'}.
2026-06-05 01:50:28,658 - optuna.study.study - INFO - Trial 150 finished with values: [0.05243403520969152, 0.006934489918949695, 0.027509506894131123] and parameters: {'n_layers': 2, 'embedding_dim': 32, 'lr': 0.0007432804052483335, 'lambda_val': 4.933989724174048e-06, 'batch_size': 3375, 'optimizer': 'Adam'}.
2026-06-05 01:53:01,895 - optuna.study.study - INFO - Trial 151 finished with values: [0.05447598137306897, 0.007301225802130083, 0.03087205277467888] and parameters: {'n_layers': 1, 'embedding_dim': 64, 'lr': 0.0003278860610242573, 'lambda_val': 2.061360640875514e-06, 'batch_size': 2859, 'optimizer': 'RMSprop'}.
2026-06-05 01:53:56,508 - experiment_functions - INFO - Early stopping at epoch 1350. Best Metrics: (0.019929012745692455, 0.002603992229888137, 0.009707699025761232)
2026-06-05 01:53:56,955 - optuna.study.study - INFO - Trial 152 finished with values: [0.019929012745692455, 0.002603992229888137, 0.009707699025761232] and parameters: {'n_layers': 4, 'embedding_dim': 32, 'lr': 0.000936097337950737, 'lambda_val': 0.0024741700262700477, 'batch_size': 1458, 'optimizer': 'RMSprop'}.
2026-06-05 01:54:57,363 - experiment_functions - INFO - Early stopping at epoch 1350. Best Metrics: (0.03699927748334366, 0.004950097126398286, 0.018864692211476998)
2026-06-05 01:54:57,793 - optuna.study.study - INFO - Trial 153 finished with values: [0.03699927748334366, 0.004950097126398286, 0.018864692211476998] and parameters: {'n_layers': 3, 'embedding_dim': 96, 'lr': 0.0003278860610242573, 'lambda_val': 0.002216169184844733, 'batch_size': 3888, 'optimizer': 'RMSprop'}.
2026-06-05 01:57:43,196 - optuna.study.study - INFO - Trial 154 finished with values: [0.07098978037019855, 0.009429633599035436, 0.0399695279477069] and parameters: {'n_layers': 1, 'embedding_dim': 128, 'lr': 0.0007432804052483335, 'lambda_val': 0.0003734366700851135, 'batch_size': 1214, 'optimizer': 'Adam'}.
2026-06-05 02:00:31,229 - optuna.study.study - INFO - Trial 155 finished with values: [0.05591927710164646, 0.0074017013865630655, 0.030047701459106468] and parameters: {'n_layers': 2, 'embedding_dim': 96, 'lr': 0.0003278860610242573, 'lambda_val': 1.6669472887970978e-05, 'batch_size': 1750, 'optimizer': 'Adam'}.
2026-06-05 02:00:55,428 - experiment_functions - INFO - Early stopping at epoch 500. Best Metrics: (0.0006586762103036923, 8.038046754638622e-05, 0.0002800565102408562)
2026-06-05 02:00:55,497 - optuna.study.study - INFO - Trial 156 finished with values: [0.0006586762103036923, 8.038046754638622e-05, 0.0002800565102408562] and parameters: {'n_layers': 4, 'embedding_dim': 96, 'lr': 0.0005200733648452572, 'lambda_val': 2.388311754210309e-05, 'batch_size': 1900, 'optimizer': 'SGD'}.
2026-06-05 02:01:22,363 - experiment_functions - INFO - Early stopping at epoch 550. Best Metrics: (0.014912684218905552, 0.0018621474981579476, 0.008106759019604762)
2026-06-05 02:01:22,684 - optuna.study.study - INFO - Trial 157 finished with values: [0.014912684218905552, 0.0018621474981579476, 0.008106759019604762] and parameters: {'n_layers': 3, 'embedding_dim': 128, 'lr': 0.04952238908215193, 'lambda_val': 2.388311754210309e-05, 'batch_size': 3566, 'optimizer': 'RMSprop'}.
2026-06-05 02:01:49,319 - experiment_functions - INFO - Early stopping at epoch 600. Best Metrics: (0.02440916093002861, 0.0031013463728314017, 0.011794666743882073)
2026-06-05 02:01:49,416 - optuna.study.study - INFO - Trial 158 finished with values: [0.02440916093002861, 0.0031013463728314017, 0.011794666743882073] and parameters: {'n_layers': 2, 'embedding_dim': 96, 'lr': 0.003540381921720846, 'lambda_val': 0.0003734366700851135, 'batch_size': 4054, 'optimizer': 'RMSprop'}.
2026-06-05 02:04:32,663 - optuna.study.study - INFO - Trial 159 finished with values: [0.05700399940231598, 0.007528970460178177, 0.0297884148294352] and parameters: {'n_layers': 2, 'embedding_dim': 64, 'lr': 0.0007432804052483335, 'lambda_val': 1.4343556300786811e-05, 'batch_size': 2242, 'optimizer': 'Adam'}.
2026-06-05 02:05:13,269 - experiment_functions - INFO - Early stopping at epoch 950. Best Metrics: (0.0468836845350961, 0.00606872529975216, 0.023566490375432934)
2026-06-05 02:05:13,642 - optuna.study.study - INFO - Trial 160 finished with values: [0.0468836845350961, 0.00606872529975216, 0.023566490375432934] and parameters: {'n_layers': 2, 'embedding_dim': 64, 'lr': 0.000936097337950737, 'lambda_val': 3.3509343310867884e-06, 'batch_size': 2859, 'optimizer': 'RMSprop'}.
2026-06-05 02:07:58,101 - optuna.study.study - INFO - Trial 161 finished with values: [0.07518893592304414, 0.00993368611427423, 0.04267582498482222] and parameters: {'n_layers': 1, 'embedding_dim': 96, 'lr': 0.000936097337950737, 'lambda_val': 2.061360640875514e-06, 'batch_size': 2859, 'optimizer': 'Adam'}.
2026-06-05 02:08:19,238 - experiment_functions - INFO - Early stopping at epoch 500. Best Metrics: (0.0005688021897173658, 8.038046754638624e-05, 0.00023638330627284186)
2026-06-05 02:08:19,332 - optuna.study.study - INFO - Trial 162 finished with values: [0.0005688021897173658, 8.038046754638624e-05, 0.00023638330627284186] and parameters: {'n_layers': 1, 'embedding_dim': 64, 'lr': 0.00014805903517458113, 'lambda_val': 0.025253110155543216, 'batch_size': 1214, 'optimizer': 'RMSprop'}.
2026-06-05 02:10:12,051 - experiment_functions - INFO - Early stopping at epoch 2750. Best Metrics: (0.05387965622626944, 0.006993100676535602, 0.02740470504963356)
2026-06-05 02:10:12,157 - optuna.study.study - INFO - Trial 163 finished with values: [0.05387965622626944, 0.006993100676535602, 0.02740470504963356] and parameters: {'n_layers': 2, 'embedding_dim': 64, 'lr': 0.0005442466826639005, 'lambda_val': 3.3509343310867884e-06, 'batch_size': 3566, 'optimizer': 'RMSprop'}.
2026-06-05 02:10:59,647 - experiment_functions - INFO - Early stopping at epoch 1100. Best Metrics: (0.0380583780636037, 0.004822828052783175, 0.01856886090092581)
2026-06-05 02:10:59,736 - optuna.study.study - INFO - Trial 164 finished with values: [0.0380583780636037, 0.004822828052783175, 0.01856886090092581] and parameters: {'n_layers': 3, 'embedding_dim': 64, 'lr': 0.0007432804052483335, 'lambda_val': 0.0003734366700851135, 'batch_size': 2859, 'optimizer': 'RMSprop'}.
2026-06-05 02:11:22,810 - experiment_functions - INFO - Early stopping at epoch 550. Best Metrics: (0.0471566324495505, 0.006147431174224663, 0.025843441761690737)
2026-06-05 02:11:22,908 - optuna.study.study - INFO - Trial 165 finished with values: [0.0471566324495505, 0.006147431174224663, 0.025843441761690737] and parameters: {'n_layers': 1, 'embedding_dim': 32, 'lr': 0.010850387474674802, 'lambda_val': 0.00022368856507037872, 'batch_size': 2331, 'optimizer': 'Adam'}.
2026-06-05 02:15:26,999 - optuna.study.study - INFO - Trial 166 finished with values: [0.0399235949087609, 0.005363721615647398, 0.020752618296864825] and parameters: {'n_layers': 4, 'embedding_dim': 256, 'lr': 0.00011825532801285016, 'lambda_val': 8.600399380889837e-06, 'batch_size': 1920, 'optimizer': 'RMSprop'}.
2026-06-05 02:16:28,517 - experiment_functions - INFO - Early stopping at epoch 1300. Best Metrics: (0.05901931468954054, 0.0080698640230424, 0.03184333546335616)
2026-06-05 02:16:28,617 - optuna.study.study - INFO - Trial 167 finished with values: [0.05901931468954054, 0.0080698640230424, 0.03184333546335616] and parameters: {'n_layers': 1, 'embedding_dim': 256, 'lr': 0.0007432804052483335, 'lambda_val': 0.0024741700262700477, 'batch_size': 2586, 'optimizer': 'Adam'}.
2026-06-05 02:16:53,406 - experiment_functions - INFO - Early stopping at epoch 500. Best Metrics: (0.03748970960248679, 0.004769241074418917, 0.01952370394417865)
2026-06-05 02:16:53,802 - optuna.study.study - INFO - Trial 168 finished with values: [0.03748970960248679, 0.004769241074418917, 0.01952370394417865] and parameters: {'n_layers': 4, 'embedding_dim': 96, 'lr': 0.08294142044076476, 'lambda_val': 2.388311754210309e-05, 'batch_size': 516, 'optimizer': 'RMSprop'}.
2026-06-05 02:17:40,931 - experiment_functions - INFO - Early stopping at epoch 1200. Best Metrics: (0.0540186186259474, 0.007142139460111193, 0.02824507854652898)
2026-06-05 02:17:41,346 - optuna.study.study - INFO - Trial 169 finished with values: [0.0540186186259474, 0.007142139460111193, 0.02824507854652898] and parameters: {'n_layers': 1, 'embedding_dim': 32, 'lr': 0.000936097337950737, 'lambda_val': 0.0024741700262700477, 'batch_size': 2586, 'optimizer': 'RMSprop'}.
2026-06-05 02:18:14,151 - experiment_functions - INFO - Early stopping at epoch 550. Best Metrics: (0.021121573562232304, 0.0027145153727644185, 0.010125348418681146)
2026-06-05 02:18:14,253 - optuna.study.study - INFO - Trial 170 finished with values: [0.021121573562232304, 0.0027145153727644185, 0.010125348418681146] and parameters: {'n_layers': 3, 'embedding_dim': 256, 'lr': 0.010850387474674802, 'lambda_val': 0.00032088813103114836, 'batch_size': 2331, 'optimizer': 'Adam'}.
2026-06-05 02:18:42,636 - experiment_functions - INFO - Early stopping at epoch 600. Best Metrics: (0.05035206769191269, 0.006266327282470359, 0.026203002614353325)
2026-06-05 02:18:42,787 - optuna.study.study - INFO - Trial 171 finished with values: [0.05035206769191269, 0.006266327282470359, 0.026203002614353325] and parameters: {'n_layers': 2, 'embedding_dim': 128, 'lr': 0.003540381921720846, 'lambda_val': 0.0003734366700851135, 'batch_size': 3114, 'optimizer': 'Adam'}.
2026-06-05 02:20:48,255 - experiment_functions - INFO - Early stopping at epoch 3000. Best Metrics: (0.04663323096477139, 0.0059163373300288044, 0.023115153060098554)
2026-06-05 02:20:48,402 - optuna.study.study - INFO - Trial 172 finished with values: [0.04663323096477139, 0.0059163373300288044, 0.023115153060098554] and parameters: {'n_layers': 3, 'embedding_dim': 64, 'lr': 0.0007432804052483335, 'lambda_val': 4.933989724174048e-06, 'batch_size': 3032, 'optimizer': 'RMSprop'}.
2026-06-05 02:24:48,737 - optuna.study.study - INFO - Trial 173 finished with values: [0.0010577176633271134, 0.00017918145890548595, 0.00048033091265191086] and parameters: {'n_layers': 4, 'embedding_dim': 256, 'lr': 3.138931074701618e-05, 'lambda_val': 0.00022637584318870192, 'batch_size': 3577, 'optimizer': 'Adam'}.
2026-06-05 02:27:40,716 - optuna.study.study - INFO - Trial 174 finished with values: [0.019356749215757182, 0.0026408332775135646, 0.009171753014186762] and parameters: {'n_layers': 3, 'embedding_dim': 96, 'lr': 0.0002487999076432075, 'lambda_val': 0.022592464234760894, 'batch_size': 3114, 'optimizer': 'Adam'}.
2026-06-05 02:28:58,879 - experiment_functions - INFO - Early stopping at epoch 1950. Best Metrics: (0.05078108660922997, 0.006942862884319111, 0.026618091085860312)
2026-06-05 02:28:59,332 - optuna.study.study - INFO - Trial 175 finished with values: [0.05078108660922997, 0.006942862884319111, 0.026618091085860312] and parameters: {'n_layers': 1, 'embedding_dim': 96, 'lr': 0.0004923748132201506, 'lambda_val': 0.005705807362941788, 'batch_size': 2038, 'optimizer': 'RMSprop'}.
2026-06-05 02:30:04,126 - experiment_functions - INFO - Early stopping at epoch 1250. Best Metrics: (0.04282908044954224, 0.005482617723893094, 0.02153281425828906)
2026-06-05 02:30:04,253 - optuna.study.study - INFO - Trial 176 finished with values: [0.04282908044954224, 0.005482617723893094, 0.02153281425828906] and parameters: {'n_layers': 2, 'embedding_dim': 256, 'lr': 0.00105994739638826, 'lambda_val': 2.4234769878470296e-05, 'batch_size': 2586, 'optimizer': 'RMSprop'}.
2026-06-05 02:31:43,398 - experiment_functions - INFO - Early stopping at epoch 1600. Best Metrics: (0.04017193697669965, 0.00513932614374707, 0.019447026009884415)
2026-06-05 02:31:43,573 - optuna.study.study - INFO - Trial 177 finished with values: [0.04017193697669965, 0.00513932614374707, 0.019447026009884415] and parameters: {'n_layers': 4, 'embedding_dim': 256, 'lr': 0.0005200733648452572, 'lambda_val': 1.2643036671926655e-05, 'batch_size': 3566, 'optimizer': 'RMSprop'}.
2026-06-05 02:33:04,909 - experiment_functions - INFO - Early stopping at epoch 2000. Best Metrics: (0.05587126088904127, 0.007595954183133498, 0.029393762705565363)
2026-06-05 02:33:05,328 - optuna.study.study - INFO - Trial 178 finished with values: [0.05587126088904127, 0.007595954183133498, 0.029393762705565363] and parameters: {'n_layers': 1, 'embedding_dim': 96, 'lr': 0.000936097337950737, 'lambda_val': 0.0024741700262700477, 'batch_size': 744, 'optimizer': 'Adam'}.
2026-06-05 02:35:55,404 - optuna.study.study - INFO - Trial 179 finished with values: [0.05025563637917705, 0.006438810369080314, 0.026038311414716263] and parameters: {'n_layers': 3, 'embedding_dim': 64, 'lr': 0.0005233025150540158, 'lambda_val': 1.6669472887970978e-05, 'batch_size': 3447, 'optimizer': 'Adam'}.
2026-06-05 02:39:14,340 - optuna.study.study - INFO - Trial 180 finished with values: [0.026018540447985978, 0.003640565342621743, 0.014071881478771201] and parameters: {'n_layers': 2, 'embedding_dim': 256, 'lr': 0.00011825532801285016, 'lambda_val': 4.933989724174048e-06, 'batch_size': 2716, 'optimizer': 'RMSprop'}.
2026-06-05 02:41:20,477 - experiment_functions - INFO - Early stopping at epoch 2800. Best Metrics: (0.05572253675605231, 0.007160559983923907, 0.029479052761761517)
2026-06-05 02:41:21,131 - optuna.study.study - INFO - Trial 181 finished with values: [0.05572253675605231, 0.007160559983923907, 0.029479052761761517] and parameters: {'n_layers': 3, 'embedding_dim': 96, 'lr': 0.0005200733648452572, 'lambda_val': 2.388311754210309e-05, 'batch_size': 1900, 'optimizer': 'RMSprop'}.
2026-06-05 02:42:33,807 - experiment_functions - INFO - Early stopping at epoch 1150. Best Metrics: (0.04237061479938398, 0.00535869783642575, 0.02115906961862245)
2026-06-05 02:42:34,006 - optuna.study.study - INFO - Trial 182 finished with values: [0.04237061479938398, 0.00535869783642575, 0.02115906961862245] and parameters: {'n_layers': 4, 'embedding_dim': 256, 'lr': 0.0005200733648452572, 'lambda_val': 1.2643036671926655e-05, 'batch_size': 3566, 'optimizer': 'RMSprop'}.
2026-06-05 02:45:17,635 - optuna.study.study - INFO - Trial 183 finished with values: [0.057981567478611454, 0.007621073079241745, 0.030503163127449637] and parameters: {'n_layers': 2, 'embedding_dim': 64, 'lr': 0.0007432804052483335, 'lambda_val': 4.933989724174048e-06, 'batch_size': 672, 'optimizer': 'Adam'}.
2026-06-05 02:45:42,740 - experiment_functions - INFO - Early stopping at epoch 550. Best Metrics: (0.017113199384501527, 0.00231931140732802, 0.008800294412900768)
2026-06-05 02:45:43,665 - optuna.study.study - INFO - Trial 184 finished with values: [0.017113199384501527, 0.00231931140732802, 0.008800294412900768] and parameters: {'n_layers': 3, 'embedding_dim': 64, 'lr': 0.029749226721519435, 'lambda_val': 2.264578702522949e-06, 'batch_size': 3566, 'optimizer': 'RMSprop'}.
2026-06-05 02:48:39,281 - optuna.study.study - INFO - Trial 185 finished with values: [0.04866942239351433, 0.006363453680755577, 0.02591407308515131] and parameters: {'n_layers': 3, 'embedding_dim': 96, 'lr': 0.0002487999076432075, 'lambda_val': 9.325564591196157e-05, 'batch_size': 1214, 'optimizer': 'RMSprop'}.
2026-06-05 02:51:32,829 - optuna.study.study - INFO - Trial 186 finished with values: [0.04374606077700363, 0.005624958135173153, 0.022338970869175554] and parameters: {'n_layers': 4, 'embedding_dim': 64, 'lr': 0.00028773695651224536, 'lambda_val': 2.264578702522949e-06, 'batch_size': 2859, 'optimizer': 'RMSprop'}.
2026-06-05 02:52:32,845 - experiment_functions - INFO - Early stopping at epoch 1050. Best Metrics: (0.03190835911170084, 0.004030745528836493, 0.015574297468248871)
2026-06-05 02:52:33,223 - optuna.study.study - INFO - Trial 187 finished with values: [0.03190835911170084, 0.004030745528836493, 0.015574297468248871] and parameters: {'n_layers': 3, 'embedding_dim': 256, 'lr': 0.001442796931783781, 'lambda_val': 4.7060452177400585e-05, 'batch_size': 1900, 'optimizer': 'RMSprop'}.
2026-06-05 02:52:56,363 - experiment_functions - INFO - Early stopping at epoch 550. Best Metrics: (0.02195713123809863, 0.003082925849018689, 0.011112933294934887)
2026-06-05 02:52:56,482 - optuna.study.study - INFO - Trial 188 finished with values: [0.02195713123809863, 0.003082925849018689, 0.011112933294934887] and parameters: {'n_layers': 1, 'embedding_dim': 64, 'lr': 0.010850387474674802, 'lambda_val': 0.00022368856507037872, 'batch_size': 3009, 'optimizer': 'RMSprop'}.
2026-06-05 02:54:59,546 - experiment_functions - INFO - Early stopping at epoch 2950. Best Metrics: (0.02814993575340823, 0.0037577868577935566, 0.013697220653705459)
2026-06-05 02:54:59,706 - optuna.study.study - INFO - Trial 189 finished with values: [0.02814993575340823, 0.0037577868577935566, 0.013697220653705459] and parameters: {'n_layers': 2, 'embedding_dim': 96, 'lr': 0.002554052113368515, 'lambda_val': 1.6669472887970978e-05, 'batch_size': 516, 'optimizer': 'RMSprop'}.
2026-06-05 02:55:54,214 - experiment_functions - INFO - Early stopping at epoch 950. Best Metrics: (0.03110582408002233, 0.004012325005023779, 0.0158204590537756)
2026-06-05 02:55:54,339 - optuna.study.study - INFO - Trial 190 finished with values: [0.03110582408002233, 0.004012325005023779, 0.0158204590537756] and parameters: {'n_layers': 3, 'embedding_dim': 256, 'lr': 0.0005200733648452572, 'lambda_val': 0.0024741700262700477, 'batch_size': 1900, 'optimizer': 'RMSprop'}.
2026-06-05 02:56:21,622 - experiment_functions - INFO - Early stopping at epoch 550. Best Metrics: (0.03599351300758138, 0.004680487641503115, 0.01768614154533334)
