2026-06-04 10:59:27,967 - optuna.study.study - INFO - Trial 282 finished with values: [0.008374746125934968, 0.0013982852166923437, 0.004992843286725285] and parameters: {'n_layers': 2, 'embedding_dim': 64, 'lr': 0.0009358706696693685, 'lambda_val': 0.00014523930854886327, 'batch_size': 1801, 'optimizer': 'RMSprop'}.
2026-06-04 11:02:09,610 - optuna.study.study - INFO - Trial 283 finished with values: [0.002808943112030311, 0.00043037041998794304, 0.0016775600810469762] and parameters: {'n_layers': 4, 'embedding_dim': 96, 'lr': 0.00015419496809314208, 'lambda_val': 2.8077752105590774e-05, 'batch_size': 1897, 'optimizer': 'RMSprop'}.
2026-06-04 11:02:57,073 - experiment_functions - INFO - Early stopping at epoch 900. Best Metrics: (0.00883969293159655, 0.0015791412686717128, 0.004978441248715679)
2026-06-04 11:02:57,230 - optuna.study.study - INFO - Trial 284 finished with values: [0.00883969293159655, 0.0015791412686717128, 0.004978441248715679] and parameters: {'n_layers': 4, 'embedding_dim': 256, 'lr': 0.0009358706696693685, 'lambda_val': 1.9086610212452873e-05, 'batch_size': 3497, 'optimizer': 'RMSprop'}.
2026-06-04 11:05:47,066 - optuna.study.study - INFO - Trial 285 finished with values: [0.010342163955867066, 0.0018554491258624157, 0.00600667849692903] and parameters: {'n_layers': 4, 'embedding_dim': 128, 'lr': 0.0003985070127686743, 'lambda_val': 0.002235534303069972, 'batch_size': 1005, 'optimizer': 'RMSprop'}.
2026-06-04 11:08:02,983 - experiment_functions - INFO - Early stopping at epoch 3550. Best Metrics: (0.00712983631922262, 0.0011772389309397816, 0.004297352909408497)
2026-06-04 11:08:03,398 - optuna.study.study - INFO - Trial 286 finished with values: [0.00712983631922262, 0.0011772389309397816, 0.004297352909408497] and parameters: {'n_layers': 2, 'embedding_dim': 96, 'lr': 0.0009358706696693685, 'lambda_val': 1.1459295912098884e-05, 'batch_size': 1423, 'optimizer': 'Adam'}.
2026-06-04 11:08:54,241 - experiment_functions - INFO - Early stopping at epoch 1150. Best Metrics: (0.008144067881763873, 0.0014518721950566014, 0.004545858099041619)
2026-06-04 11:08:54,644 - optuna.study.study - INFO - Trial 287 finished with values: [0.008144067881763873, 0.0014518721950566014, 0.004545858099041619] and parameters: {'n_layers': 3, 'embedding_dim': 128, 'lr': 0.0009993931731412705, 'lambda_val': 2.2109211065368353e-05, 'batch_size': 3469, 'optimizer': 'Adam'}.
2026-06-04 11:10:20,046 - experiment_functions - INFO - Early stopping at epoch 2150. Best Metrics: (0.004415556124535802, 0.0007770111862817336, 0.002453799811078724)
2026-06-04 11:10:20,464 - optuna.study.study - INFO - Trial 288 finished with values: [0.004415556124535802, 0.0007770111862817336, 0.002453799811078724] and parameters: {'n_layers': 4, 'embedding_dim': 64, 'lr': 0.0009358706696693685, 'lambda_val': 0.07336668761463899, 'batch_size': 1005, 'optimizer': 'RMSprop'}.
2026-06-04 11:11:19,220 - experiment_functions - INFO - Early stopping at epoch 1300. Best Metrics: (0.012242128765465566, 0.0021317569830531184, 0.006908676275664944)
2026-06-04 11:11:19,587 - optuna.study.study - INFO - Trial 289 finished with values: [0.012242128765465566, 0.0021317569830531184, 0.006908676275664944] and parameters: {'n_layers': 4, 'embedding_dim': 128, 'lr': 0.0009358706696693685, 'lambda_val': 8.999659749873041e-05, 'batch_size': 1423, 'optimizer': 'RMSprop'}.
2026-06-04 11:13:21,021 - experiment_functions - INFO - Early stopping at epoch 2900. Best Metrics: (0.00637277672640023, 0.001036573112733606, 0.0036940355201526168)
2026-06-04 11:13:21,474 - optuna.study.study - INFO - Trial 290 finished with values: [0.00637277672640023, 0.001036573112733606, 0.0036940355201526168] and parameters: {'n_layers': 1, 'embedding_dim': 256, 'lr': 0.0009358706696693685, 'lambda_val': 1.933875333428983e-06, 'batch_size': 3961, 'optimizer': 'RMSprop'}.
2026-06-04 11:15:38,112 - experiment_functions - INFO - Early stopping at epoch 3450. Best Metrics: (0.013860918086935937, 0.002516913390046219, 0.008390088003966048)
2026-06-04 11:15:39,268 - optuna.study.study - INFO - Trial 291 finished with values: [0.013860918086935937, 0.002516913390046219, 0.008390088003966048] and parameters: {'n_layers': 4, 'embedding_dim': 64, 'lr': 0.0009358706696693685, 'lambda_val': 2.8077752105590774e-05, 'batch_size': 775, 'optimizer': 'RMSprop'}.
2026-06-04 11:15:59,976 - experiment_functions - INFO - Early stopping at epoch 500. Best Metrics: (0.0005328566374977129, 8.372965369415233e-05, 0.0002800650973640386)
2026-06-04 11:16:00,281 - optuna.study.study - INFO - Trial 292 finished with values: [0.0005328566374977129, 8.372965369415233e-05, 0.0002800650973640386] and parameters: {'n_layers': 3, 'embedding_dim': 64, 'lr': 0.0009358706696693685, 'lambda_val': 2.5795384074392596e-06, 'batch_size': 1264, 'optimizer': 'SGD'}.
2026-06-04 11:16:45,195 - experiment_functions - INFO - Early stopping at epoch 850. Best Metrics: (0.008985776774730822, 0.0016092839440016078, 0.004947433092191232)
2026-06-04 11:16:46,052 - optuna.study.study - INFO - Trial 293 finished with values: [0.008985776774730822, 0.0016092839440016078, 0.004947433092191232] and parameters: {'n_layers': 4, 'embedding_dim': 256, 'lr': 0.0009993931731412705, 'lambda_val': 0.00014523930854886327, 'batch_size': 2558, 'optimizer': 'RMSprop'}.
2026-06-04 11:17:08,253 - experiment_functions - INFO - Early stopping at epoch 500. Best Metrics: (0.0006322320137342466, 7.703128139862015e-05, 0.0002830159359102572)
2026-06-04 11:17:08,354 - optuna.study.study - INFO - Trial 294 finished with values: [0.0006322320137342466, 7.703128139862015e-05, 0.0002830159359102572] and parameters: {'n_layers': 4, 'embedding_dim': 96, 'lr': 1.288856803778304e-05, 'lambda_val': 2.2109211065368353e-05, 'batch_size': 682, 'optimizer': 'Adam'}.
2026-06-04 11:19:22,528 - experiment_functions - INFO - Early stopping at epoch 3400. Best Metrics: (0.011192247378607917, 0.001977694420255878, 0.0066380805427242)
2026-06-04 11:19:23,160 - optuna.study.study - INFO - Trial 295 finished with values: [0.011192247378607917, 0.001977694420255878, 0.0066380805427242] and parameters: {'n_layers': 3, 'embedding_dim': 96, 'lr': 0.0005758008621537027, 'lambda_val': 0.00037674849834926565, 'batch_size': 1423, 'optimizer': 'RMSprop'}.
2026-06-04 11:20:23,429 - experiment_functions - INFO - Early stopping at epoch 1150. Best Metrics: (0.008475036251025683, 0.0015858396409672453, 0.004745758855601903)
2026-06-04 11:20:23,551 - optuna.study.study - INFO - Trial 296 finished with values: [0.008475036251025683, 0.0015858396409672453, 0.004745758855601903] and parameters: {'n_layers': 4, 'embedding_dim': 256, 'lr': 0.0009358706696693685, 'lambda_val': 2.2109211065368353e-05, 'batch_size': 2310, 'optimizer': 'Adam'}.
2026-06-04 11:21:00,136 - experiment_functions - INFO - Early stopping at epoch 850. Best Metrics: (0.008655605411489025, 0.001592538013262777, 0.005041244669589453)
2026-06-04 11:21:00,352 - optuna.study.study - INFO - Trial 297 finished with values: [0.008655605411489025, 0.001592538013262777, 0.005041244669589453] and parameters: {'n_layers': 4, 'embedding_dim': 96, 'lr': 0.0013876621562912753, 'lambda_val': 0.00014523930854886327, 'batch_size': 3021, 'optimizer': 'RMSprop'}.
2026-06-04 11:21:26,960 - experiment_functions - INFO - Early stopping at epoch 500. Best Metrics: (0.00039610007802364866, 6.530912988143882e-05, 0.00022638588677939005)
2026-06-04 11:21:27,049 - optuna.study.study - INFO - Trial 298 finished with values: [0.00039610007802364866, 6.530912988143882e-05, 0.00022638588677939005] and parameters: {'n_layers': 4, 'embedding_dim': 256, 'lr': 7.859791278036507e-05, 'lambda_val': 0.00014523930854886327, 'batch_size': 584, 'optimizer': 'SGD'}.
2026-06-04 11:21:48,481 - experiment_functions - INFO - Early stopping at epoch 500. Best Metrics: (0.0005946535842045269, 7.870587447250318e-05, 0.0002864137802507265)
2026-06-04 11:21:48,561 - optuna.study.study - INFO - Trial 299 finished with values: [0.0005946535842045269, 7.870587447250318e-05, 0.0002864137802507265] and parameters: {'n_layers': 3, 'embedding_dim': 96, 'lr': 0.0005758008621537027, 'lambda_val': 4.830818973924614e-06, 'batch_size': 2690, 'optimizer': 'SGD'}.
2026-06-04 11:21:48,576 - root - INFO - Selected Trial 277 based on Max ndcg: 0.0093
2026-06-04 11:21:48,576 - root - INFO - Associated Recall: 0.0153
2026-06-04 11:21:48,576 - experiment_functions - INFO - Training the best model ... for e_gowalla_1c1dcs_strict_rand3
2026-06-04 11:24:10,109 - experiment_functions - INFO - Early stopping at epoch 3650. Best Metrics: (0.014413688038078498, 0.002565476589188827, 0.00898468920169834)
2026-06-04 11:24:13,483 - root - INFO -   **** Training e_gowalla_1c1dcs_strict_rand4
2026-06-04 11:24:13,502 - root - INFO -   **** Getting 51651/845292 random edges
2026-06-04 11:24:13,624 - optuna.storages._rdb.storage - INFO - A new study created in RDB with name: Study_e_gowalla_1c1dcs_strict_rand4
2026-06-04 11:24:35,239 - experiment_functions - INFO - Early stopping at epoch 550. Best Metrics: (0.002903022232648899, 0.0004337196061357091, 0.0016361893208140174)
2026-06-04 11:24:35,422 - optuna.study.study - INFO - Trial 0 finished with values: [0.002903022232648899, 0.0004337196061357091, 0.0016361893208140174] and parameters: {'n_layers': 1, 'embedding_dim': 32, 'lr': 0.03174614439650414, 'lambda_val': 5.1016022094875355e-06, 'batch_size': 2036, 'optimizer': 'RMSprop'}.
2026-06-04 11:25:00,469 - experiment_functions - INFO - Early stopping at epoch 600. Best Metrics: (0.0005306669783218429, 8.038046754638622e-05, 0.00025702135413424766)
2026-06-04 11:25:00,560 - optuna.study.study - INFO - Trial 1 finished with values: [0.0005306669783218429, 8.038046754638622e-05, 0.00025702135413424766] and parameters: {'n_layers': 4, 'embedding_dim': 64, 'lr': 6.887028244927355e-05, 'lambda_val': 0.06521627358403344, 'batch_size': 1422, 'optimizer': 'Adam'}.
2026-06-04 11:25:26,501 - experiment_functions - INFO - Early stopping at epoch 500. Best Metrics: (0.002535830452269497, 0.00044711635072677337, 0.0015264842171480296)
2026-06-04 11:25:27,041 - optuna.study.study - INFO - Trial 2 finished with values: [0.002535830452269497, 0.00044711635072677337, 0.0015264842171480296] and parameters: {'n_layers': 3, 'embedding_dim': 256, 'lr': 0.08500719886316734, 'lambda_val': 0.0032296178945151414, 'batch_size': 887, 'optimizer': 'Adam'}.
2026-06-04 11:25:47,682 - experiment_functions - INFO - Early stopping at epoch 500. Best Metrics: (0.0005845348363357251, 8.707883984191842e-05, 0.0002943579238401323)
2026-06-04 11:25:47,973 - optuna.study.study - INFO - Trial 3 finished with values: [0.0005845348363357251, 8.707883984191842e-05, 0.0002943579238401323] and parameters: {'n_layers': 4, 'embedding_dim': 32, 'lr': 0.050035850224393816, 'lambda_val': 0.0494345449176384, 'batch_size': 960, 'optimizer': 'SGD'}.
2026-06-04 11:26:10,168 - experiment_functions - INFO - Early stopping at epoch 500. Best Metrics: (0.000325855942297397, 6.530912988143881e-05, 0.00014007440863971347)
2026-06-04 11:26:10,245 - optuna.study.study - INFO - Trial 4 finished with values: [0.000325855942297397, 6.530912988143881e-05, 0.00014007440863971347] and parameters: {'n_layers': 4, 'embedding_dim': 96, 'lr': 0.004164738308981974, 'lambda_val': 2.3896262258069383e-05, 'batch_size': 2838, 'optimizer': 'SGD'}.
2026-06-04 11:27:32,234 - experiment_functions - INFO - Early stopping at epoch 2200. Best Metrics: (0.0036955389173063164, 0.0006597896711099204, 0.002109987407630964)
2026-06-04 11:27:32,584 - optuna.study.study - INFO - Trial 5 finished with values: [0.0036955389173063164, 0.0006597896711099204, 0.002109987407630964] and parameters: {'n_layers': 3, 'embedding_dim': 32, 'lr': 0.006097730317148143, 'lambda_val': 0.033994727743062635, 'batch_size': 4064, 'optimizer': 'Adam'}.
2026-06-04 11:27:52,614 - experiment_functions - INFO - Early stopping at epoch 500. Best Metrics: (0.0006021167385396668, 9.210261906356756e-05, 0.000252769205610214)
2026-06-04 11:27:52,870 - optuna.study.study - INFO - Trial 6 finished with values: [0.0006021167385396668, 9.210261906356756e-05, 0.000252769205610214] and parameters: {'n_layers': 3, 'embedding_dim': 32, 'lr': 0.0014181685787657509, 'lambda_val': 0.0003112341535664991, 'batch_size': 739, 'optimizer': 'SGD'}.
2026-06-04 11:30:31,146 - optuna.study.study - INFO - Trial 7 finished with values: [0.008264709309641046, 0.001374840913657981, 0.004817638443106885] and parameters: {'n_layers': 3, 'embedding_dim': 96, 'lr': 0.0004090776901902334, 'lambda_val': 1.8898212223948182e-06, 'batch_size': 1825, 'optimizer': 'Adam'}.
2026-06-04 11:30:56,744 - experiment_functions - INFO - Early stopping at epoch 550. Best Metrics: (0.005846870817474044, 0.001041596891955255, 0.0033652134968719404)
2026-06-04 11:30:57,131 - optuna.study.study - INFO - Trial 8 finished with values: [0.005846870817474044, 0.001041596891955255, 0.0033652134968719404] and parameters: {'n_layers': 4, 'embedding_dim': 128, 'lr': 0.007900697792618734, 'lambda_val': 0.00026218929558311914, 'batch_size': 968, 'optimizer': 'RMSprop'}.
2026-06-04 11:31:25,094 - experiment_functions - INFO - Early stopping at epoch 700. Best Metrics: (0.004084194798672073, 0.0006949561256614642, 0.0022893537694295245)
2026-06-04 11:31:25,444 - optuna.study.study - INFO - Trial 9 finished with values: [0.004084194798672073, 0.0006949561256614642, 0.0022893537694295245] and parameters: {'n_layers': 1, 'embedding_dim': 96, 'lr': 0.018462925003005032, 'lambda_val': 3.0210429347112765e-06, 'batch_size': 929, 'optimizer': 'Adam'}.
2026-06-04 11:34:10,455 - optuna.study.study - INFO - Trial 10 finished with values: [0.0012225671981216395, 0.00016578471431442164, 0.0006277640999971248] and parameters: {'n_layers': 1, 'embedding_dim': 256, 'lr': 0.0001643791628358017, 'lambda_val': 4.455400500697832e-06, 'batch_size': 969, 'optimizer': 'Adam'}.
2026-06-04 11:35:32,703 - experiment_functions - INFO - Early stopping at epoch 2000. Best Metrics: (0.0006790677988514414, 8.707883984191842e-05, 0.00033862696294110583)
2026-06-04 11:35:32,913 - optuna.study.study - INFO - Trial 11 finished with values: [0.0006790677988514414, 8.707883984191842e-05, 0.00033862696294110583] and parameters: {'n_layers': 3, 'embedding_dim': 128, 'lr': 1.7972490093178155e-05, 'lambda_val': 0.0011745787395198433, 'batch_size': 2548, 'optimizer': 'RMSprop'}.
2026-06-04 11:35:56,412 - experiment_functions - INFO - Early stopping at epoch 550. Best Metrics: (0.00410461473334838, 0.000787058744725032, 0.002417658709162555)
2026-06-04 11:35:56,490 - optuna.study.study - INFO - Trial 12 finished with values: [0.00410461473334838, 0.000787058744725032, 0.002417658709162555] and parameters: {'n_layers': 4, 'embedding_dim': 64, 'lr': 0.003470517438183551, 'lambda_val': 0.030897456598092354, 'batch_size': 3509, 'optimizer': 'RMSprop'}.
2026-06-04 11:36:33,141 - experiment_functions - INFO - Early stopping at epoch 900. Best Metrics: (0.0051549519964168376, 0.0010198271819947754, 0.0030481334791257774)
2026-06-04 11:36:33,386 - optuna.study.study - INFO - Trial 13 finished with values: [0.0051549519964168376, 0.0010198271819947754, 0.0030481334791257774] and parameters: {'n_layers': 4, 'embedding_dim': 64, 'lr': 0.0008527206735717898, 'lambda_val': 0.021039161138826524, 'batch_size': 2516, 'optimizer': 'RMSprop'}.
2026-06-04 11:36:57,205 - experiment_functions - INFO - Early stopping at epoch 550. Best Metrics: (0.005115757376118744, 0.0008439949092370555, 0.0029010215972480927)
2026-06-04 11:36:57,317 - optuna.study.study - INFO - Trial 14 finished with values: [0.005115757376118744, 0.0008439949092370555, 0.0029010215972480927] and parameters: {'n_layers': 3, 'embedding_dim': 96, 'lr': 0.03873700217879755, 'lambda_val': 7.359862236281652e-06, 'batch_size': 1126, 'optimizer': 'Adam'}.
2026-06-04 11:39:40,055 - optuna.study.study - INFO - Trial 15 finished with values: [0.0010781482373790935, 0.00016076093509277245, 0.0005826175498257159] and parameters: {'n_layers': 4, 'embedding_dim': 96, 'lr': 7.70984273910781e-05, 'lambda_val': 0.0005361591749845432, 'batch_size': 3857, 'optimizer': 'Adam'}.
2026-06-04 11:40:01,477 - experiment_functions - INFO - Early stopping at epoch 500. Best Metrics: (0.000500188334556651, 7.368209525085404e-05, 0.00023102067476265403)
2026-06-04 11:40:01,560 - optuna.study.study - INFO - Trial 16 finished with values: [0.000500188334556651, 7.368209525085404e-05, 0.00023102067476265403] and parameters: {'n_layers': 3, 'embedding_dim': 96, 'lr': 0.005308530132486122, 'lambda_val': 8.35935129067969e-06, 'batch_size': 921, 'optimizer': 'SGD'}.
2026-06-04 11:40:30,409 - experiment_functions - INFO - Early stopping at epoch 600. Best Metrics: (0.0040570505727163956, 0.0007719874070600844, 0.0025385062131176063)
2026-06-04 11:40:30,650 - optuna.study.study - INFO - Trial 17 finished with values: [0.0040570505727163956, 0.0007719874070600844, 0.0025385062131176063] and parameters: {'n_layers': 2, 'embedding_dim': 256, 'lr': 0.005913319416099858, 'lambda_val': 0.0037497626023223285, 'batch_size': 2534, 'optimizer': 'Adam'}.
2026-06-04 11:42:54,510 - optuna.study.study - INFO - Trial 18 finished with values: [0.004278379813844426, 0.000609551878893429, 0.002481494170751941] and parameters: {'n_layers': 1, 'embedding_dim': 32, 'lr': 0.0003360739085976085, 'lambda_val': 3.23744586075858e-05, 'batch_size': 3105, 'optimizer': 'Adam'}.
2026-06-04 11:43:14,892 - experiment_functions - INFO - Early stopping at epoch 500. Best Metrics: (0.0005197950902199723, 6.698372295532186e-05, 0.00020497779789099659)
2026-06-04 11:43:15,942 - optuna.study.study - INFO - Trial 19 finished with values: [0.0005197950902199723, 6.698372295532186e-05, 0.00020497779789099659] and parameters: {'n_layers': 3, 'embedding_dim': 32, 'lr': 0.00020086613586383904, 'lambda_val': 0.061999086231369634, 'batch_size': 2991, 'optimizer': 'Adam'}.
2026-06-04 11:43:45,750 - experiment_functions - INFO - Early stopping at epoch 550. Best Metrics: (0.006474591715209009, 0.0012023578270480275, 0.003806188607659049)
2026-06-04 11:43:45,836 - optuna.study.study - INFO - Trial 20 finished with values: [0.006474591715209009, 0.0012023578270480275, 0.003806188607659049] and parameters: {'n_layers': 4, 'embedding_dim': 256, 'lr': 0.004480000793937752, 'lambda_val': 5.016933039935782e-06, 'batch_size': 2311, 'optimizer': 'RMSprop'}.
2026-06-04 11:44:07,213 - experiment_functions - INFO - Early stopping at epoch 500. Best Metrics: (0.0003183401756950768, 6.698372295532187e-05, 0.0001690921071924145)
2026-06-04 11:44:07,317 - optuna.study.study - INFO - Trial 21 finished with values: [0.0003183401756950768, 6.698372295532187e-05, 0.0001690921071924145] and parameters: {'n_layers': 2, 'embedding_dim': 128, 'lr': 0.00276835925174618, 'lambda_val': 0.05205011654445667, 'batch_size': 2206, 'optimizer': 'SGD'}.
2026-06-04 11:44:33,768 - experiment_functions - INFO - Early stopping at epoch 550. Best Metrics: (0.004457613839286012, 0.0006999799048831133, 0.002613032092315017)
2026-06-04 11:44:34,596 - optuna.study.study - INFO - Trial 22 finished with values: [0.004457613839286012, 0.0006999799048831133, 0.002613032092315017] and parameters: {'n_layers': 2, 'embedding_dim': 256, 'lr': 0.02660347787147833, 'lambda_val': 3.648296647252239e-06, 'batch_size': 2154, 'optimizer': 'RMSprop'}.
2026-06-04 11:44:56,653 - experiment_functions - INFO - Early stopping at epoch 550. Best Metrics: (0.0025695580319954323, 0.0004605130953178378, 0.0014751077886760195)
2026-06-04 11:44:56,740 - optuna.study.study - INFO - Trial 23 finished with values: [0.0025695580319954323, 0.0004605130953178378, 0.0014751077886760195] and parameters: {'n_layers': 3, 'embedding_dim': 32, 'lr': 0.04399351763662359, 'lambda_val': 4.733054159059329e-05, 'batch_size': 1676, 'optimizer': 'RMSprop'}.
2026-06-04 11:45:26,679 - experiment_functions - INFO - Early stopping at epoch 550. Best Metrics: (0.0051611741376876704, 0.0008858597360841316, 0.002983449340495563)
2026-06-04 11:45:27,559 - optuna.study.study - INFO - Trial 24 finished with values: [0.0051611741376876704, 0.0008858597360841316, 0.002983449340495563] and parameters: {'n_layers': 4, 'embedding_dim': 256, 'lr': 0.08896930678012212, 'lambda_val': 1.0009974035026707e-06, 'batch_size': 1826, 'optimizer': 'Adam'}.
2026-06-04 11:48:04,829 - optuna.study.study - INFO - Trial 25 finished with values: [0.0013495072525503472, 0.00014736419050170808, 0.0005727201448093956] and parameters: {'n_layers': 2, 'embedding_dim': 128, 'lr': 0.00014272157858606356, 'lambda_val': 0.0001624267337748229, 'batch_size': 1580, 'optimizer': 'Adam'}.
2026-06-04 11:48:24,865 - experiment_functions - INFO - Early stopping at epoch 500. Best Metrics: (0.00026564903881822247, 5.526157143814054e-05, 0.00015835023947996323)
2026-06-04 11:48:25,221 - optuna.study.study - INFO - Trial 26 finished with values: [0.00026564903881822247, 5.526157143814054e-05, 0.00015835023947996323] and parameters: {'n_layers': 2, 'embedding_dim': 32, 'lr': 0.0008603297685639823, 'lambda_val': 0.001616172868221894, 'batch_size': 3460, 'optimizer': 'SGD'}.
2026-06-04 11:48:47,591 - experiment_functions - INFO - Early stopping at epoch 500. Best Metrics: (0.0005632410271644411, 7.368209525085404e-05, 0.000265991961042298)
2026-06-04 11:48:47,679 - optuna.study.study - INFO - Trial 27 finished with values: [0.0005632410271644411, 7.368209525085404e-05, 0.000265991961042298] and parameters: {'n_layers': 3, 'embedding_dim': 128, 'lr': 0.00010284783368260673, 'lambda_val': 0.05383219142167494, 'batch_size': 726, 'optimizer': 'RMSprop'}.
2026-06-04 11:50:33,468 - experiment_functions - INFO - Early stopping at epoch 2900. Best Metrics: (0.000515510999089573, 9.210261906356757e-05, 0.00023267739411268173)
