2026-06-04 07:37:23,618 - optuna.study.study - INFO - Trial 97 finished with values: [0.0049845514034523196, 0.0009947082858865297, 0.002861741195501446] and parameters: {'n_layers': 4, 'embedding_dim': 128, 'lr': 0.011472785289985216, 'lambda_val': 0.006409139170390952, 'batch_size': 3961, 'optimizer': 'Adam'}.
2026-06-04 07:37:57,855 - experiment_functions - INFO - Early stopping at epoch 850. Best Metrics: (0.004858113456070703, 0.0008222251992765757, 0.0028641341923570135)
2026-06-04 07:37:58,229 - optuna.study.study - INFO - Trial 98 finished with values: [0.004858113456070703, 0.0008222251992765757, 0.0028641341923570135] and parameters: {'n_layers': 2, 'embedding_dim': 96, 'lr': 0.007982799603933596, 'lambda_val': 2.1052099842147924e-05, 'batch_size': 3544, 'optimizer': 'Adam'}.
2026-06-04 07:38:30,979 - experiment_functions - INFO - Early stopping at epoch 600. Best Metrics: (0.0060542551348066265, 0.0011035568356889277, 0.0033998464253321855)
2026-06-04 07:38:31,665 - optuna.study.study - INFO - Trial 99 finished with values: [0.0060542551348066265, 0.0011035568356889277, 0.0033998464253321855] and parameters: {'n_layers': 4, 'embedding_dim': 256, 'lr': 0.0044385330633786016, 'lambda_val': 0.0028698778902023414, 'batch_size': 3961, 'optimizer': 'Adam'}.
2026-06-04 07:39:27,006 - experiment_functions - INFO - Early stopping at epoch 1500. Best Metrics: (0.0048718223630629725, 0.000751892290173488, 0.0026783247294328806)
2026-06-04 07:39:27,272 - optuna.study.study - INFO - Trial 100 finished with values: [0.0048718223630629725, 0.000751892290173488, 0.0026783247294328806] and parameters: {'n_layers': 1, 'embedding_dim': 64, 'lr': 0.0009358706696693685, 'lambda_val': 0.0012865728517446665, 'batch_size': 3089, 'optimizer': 'Adam'}.
2026-06-04 07:39:48,527 - experiment_functions - INFO - Early stopping at epoch 500. Best Metrics: (0.0007484761872195724, 9.210261906356757e-05, 0.0003438084125310276)
2026-06-04 07:39:49,166 - optuna.study.study - INFO - Trial 101 finished with values: [0.0007484761872195724, 9.210261906356757e-05, 0.0003438084125310276] and parameters: {'n_layers': 4, 'embedding_dim': 64, 'lr': 0.0023047972503770693, 'lambda_val': 0.0002789985957451779, 'batch_size': 3649, 'optimizer': 'SGD'}.
2026-06-04 07:40:26,305 - experiment_functions - INFO - Early stopping at epoch 900. Best Metrics: (0.004332867226527761, 0.0008105030477593946, 0.0024865187172773756)
2026-06-04 07:40:26,394 - optuna.study.study - INFO - Trial 102 finished with values: [0.004332867226527761, 0.0008105030477593946, 0.0024865187172773756] and parameters: {'n_layers': 2, 'embedding_dim': 128, 'lr': 0.0044385330633786016, 'lambda_val': 0.006409139170390952, 'batch_size': 3961, 'optimizer': 'Adam'}.
2026-06-04 07:41:47,490 - experiment_functions - INFO - Early stopping at epoch 1950. Best Metrics: (0.004513187383007213, 0.0007820349655033827, 0.0028006068325853372)
2026-06-04 07:41:47,798 - optuna.study.study - INFO - Trial 103 finished with values: [0.004513187383007213, 0.0007820349655033827, 0.0028006068325853372] and parameters: {'n_layers': 1, 'embedding_dim': 256, 'lr': 0.007158020046263984, 'lambda_val': 4.830818973924614e-06, 'batch_size': 1424, 'optimizer': 'Adam'}.
2026-06-04 07:42:15,123 - experiment_functions - INFO - Early stopping at epoch 600. Best Metrics: (0.006540437948523105, 0.0012325005023779223, 0.003987834151980047)
2026-06-04 07:42:15,241 - optuna.study.study - INFO - Trial 104 finished with values: [0.006540437948523105, 0.0012325005023779223, 0.003987834151980047] and parameters: {'n_layers': 4, 'embedding_dim': 128, 'lr': 0.0044385330633786016, 'lambda_val': 0.0028698778902023414, 'batch_size': 1587, 'optimizer': 'Adam'}.
2026-06-04 07:44:22,077 - experiment_functions - INFO - Early stopping at epoch 3150. Best Metrics: (0.005180152677202779, 0.001053319043472436, 0.003130938255280564)
2026-06-04 07:44:22,262 - optuna.study.study - INFO - Trial 105 finished with values: [0.005180152677202779, 0.001053319043472436, 0.003130938255280564] and parameters: {'n_layers': 4, 'embedding_dim': 96, 'lr': 0.00028236588427973475, 'lambda_val': 0.039618002209163034, 'batch_size': 3802, 'optimizer': 'RMSprop'}.
2026-06-04 07:44:57,988 - experiment_functions - INFO - Early stopping at epoch 950. Best Metrics: (0.0050863748589882124, 0.000892558108379664, 0.0029680538267683756)
2026-06-04 07:44:58,098 - optuna.study.study - INFO - Trial 106 finished with values: [0.0050863748589882124, 0.000892558108379664, 0.0029680538267683756] and parameters: {'n_layers': 2, 'embedding_dim': 32, 'lr': 0.0023047972503770693, 'lambda_val': 1.933875333428983e-06, 'batch_size': 3058, 'optimizer': 'Adam'}.
2026-06-04 07:45:29,212 - experiment_functions - INFO - Early stopping at epoch 800. Best Metrics: (0.00751565857040018, 0.0013698171344363322, 0.004397853244871558)
2026-06-04 07:45:29,383 - optuna.study.study - INFO - Trial 107 finished with values: [0.00751565857040018, 0.0013698171344363322, 0.004397853244871558] and parameters: {'n_layers': 4, 'embedding_dim': 32, 'lr': 0.0023047972503770693, 'lambda_val': 0.0002789985957451779, 'batch_size': 3058, 'optimizer': 'RMSprop'}.
2026-06-04 07:45:52,141 - experiment_functions - INFO - Early stopping at epoch 550. Best Metrics: (0.004250144150597988, 0.0007954317100944471, 0.0025676694104171407)
2026-06-04 07:45:52,251 - optuna.study.study - INFO - Trial 108 finished with values: [0.004250144150597988, 0.0007954317100944471, 0.0025676694104171407] and parameters: {'n_layers': 3, 'embedding_dim': 64, 'lr': 0.006374731525389089, 'lambda_val': 0.0033908243169255567, 'batch_size': 3469, 'optimizer': 'RMSprop'}.
2026-06-04 07:47:16,786 - experiment_functions - INFO - Early stopping at epoch 1900. Best Metrics: (0.007054237609691187, 0.0012291513162301562, 0.003826400819946987)
2026-06-04 07:47:17,171 - optuna.study.study - INFO - Trial 109 finished with values: [0.007054237609691187, 0.0012291513162301562, 0.003826400819946987] and parameters: {'n_layers': 2, 'embedding_dim': 256, 'lr': 0.0005623238238546706, 'lambda_val': 8.614758327309204e-05, 'batch_size': 3752, 'optimizer': 'RMSprop'}.
2026-06-04 07:48:15,518 - experiment_functions - INFO - Early stopping at epoch 1300. Best Metrics: (0.006554814045395396, 0.0012224529439346238, 0.003758764408588193)
2026-06-04 07:48:15,710 - optuna.study.study - INFO - Trial 110 finished with values: [0.006554814045395396, 0.0012224529439346238, 0.003758764408588193] and parameters: {'n_layers': 2, 'embedding_dim': 256, 'lr': 0.0013876621562912753, 'lambda_val': 6.1407786046843e-05, 'batch_size': 1839, 'optimizer': 'RMSprop'}.
2026-06-04 07:50:40,479 - optuna.study.study - INFO - Trial 111 finished with values: [0.0021430747631176156, 0.00029305378792953313, 0.001111320132723596] and parameters: {'n_layers': 1, 'embedding_dim': 96, 'lr': 0.00028236588427973475, 'lambda_val': 0.0002748178610784401, 'batch_size': 945, 'optimizer': 'RMSprop'}.
2026-06-04 07:51:05,195 - experiment_functions - INFO - Early stopping at epoch 550. Best Metrics: (0.0036288311895655407, 0.0006078772858195459, 0.0022578243195048777)
2026-06-04 07:51:06,233 - optuna.study.study - INFO - Trial 112 finished with values: [0.0036288311895655407, 0.0006078772858195459, 0.0022578243195048777] and parameters: {'n_layers': 1, 'embedding_dim': 256, 'lr': 0.016201446778311295, 'lambda_val': 1.9086610212452873e-05, 'batch_size': 3199, 'optimizer': 'RMSprop'}.
2026-06-04 07:51:35,759 - experiment_functions - INFO - Early stopping at epoch 550. Best Metrics: (0.0061605735515707005, 0.0010817871257284481, 0.0034151468937422607)
2026-06-04 07:51:35,830 - optuna.study.study - INFO - Trial 113 finished with values: [0.0061605735515707005, 0.0010817871257284481, 0.0034151468937422607] and parameters: {'n_layers': 4, 'embedding_dim': 256, 'lr': 0.00898171657562191, 'lambda_val': 8.999659749873041e-05, 'batch_size': 2351, 'optimizer': 'RMSprop'}.
2026-06-04 07:52:59,222 - experiment_functions - INFO - Early stopping at epoch 2100. Best Metrics: (0.008584192441541977, 0.001545649407194052, 0.00508168861966869)
2026-06-04 07:52:59,783 - optuna.study.study - INFO - Trial 114 finished with values: [0.008584192441541977, 0.001545649407194052, 0.00508168861966869] and parameters: {'n_layers': 3, 'embedding_dim': 96, 'lr': 0.0009358706696693685, 'lambda_val': 4.830818973924614e-06, 'batch_size': 1423, 'optimizer': 'Adam'}.
2026-06-04 07:53:23,666 - experiment_functions - INFO - Early stopping at epoch 550. Best Metrics: (0.005778970115147824, 0.0010348985196597226, 0.003381524799088253)
2026-06-04 07:53:23,999 - optuna.study.study - INFO - Trial 115 finished with values: [0.005778970115147824, 0.0010348985196597226, 0.003381524799088253] and parameters: {'n_layers': 3, 'embedding_dim': 96, 'lr': 0.006587432041567714, 'lambda_val': 0.00011536063209032362, 'batch_size': 3497, 'optimizer': 'RMSprop'}.
2026-06-04 07:54:26,327 - experiment_functions - INFO - Early stopping at epoch 1200. Best Metrics: (0.008762391348103513, 0.001592538013262777, 0.004722461972497012)
2026-06-04 07:54:26,409 - optuna.study.study - INFO - Trial 116 finished with values: [0.008762391348103513, 0.001592538013262777, 0.004722461972497012] and parameters: {'n_layers': 4, 'embedding_dim': 256, 'lr': 0.0009993931731412705, 'lambda_val': 2.2109211065368353e-05, 'batch_size': 2310, 'optimizer': 'Adam'}.
2026-06-04 07:55:50,662 - experiment_functions - INFO - Early stopping at epoch 2200. Best Metrics: (0.008606927054462674, 0.0015473240002679346, 0.005085950362555674)
2026-06-04 07:55:50,991 - optuna.study.study - INFO - Trial 117 finished with values: [0.008606927054462674, 0.0015473240002679346, 0.005085950362555674] and parameters: {'n_layers': 2, 'embedding_dim': 96, 'lr': 0.0013876621562912753, 'lambda_val': 3.914801209617112e-05, 'batch_size': 1230, 'optimizer': 'RMSprop'}.
2026-06-04 07:56:37,504 - experiment_functions - INFO - Early stopping at epoch 1200. Best Metrics: (0.005124480342271574, 0.0009645656105566349, 0.0029219689010547144)
2026-06-04 07:56:37,617 - optuna.study.study - INFO - Trial 118 finished with values: [0.005124480342271574, 0.0009645656105566349, 0.0029219689010547144] and parameters: {'n_layers': 3, 'embedding_dim': 64, 'lr': 0.0009993931731412705, 'lambda_val': 0.01760730139204167, 'batch_size': 1700, 'optimizer': 'Adam'}.
2026-06-04 07:57:08,526 - experiment_functions - INFO - Early stopping at epoch 800. Best Metrics: (0.005648717554717233, 0.001046620671176904, 0.0033084777910593853)
2026-06-04 07:57:09,014 - optuna.study.study - INFO - Trial 119 finished with values: [0.005648717554717233, 0.001046620671176904, 0.0033084777910593853] and parameters: {'n_layers': 3, 'embedding_dim': 32, 'lr': 0.0023047972503770693, 'lambda_val': 0.000867565506991593, 'batch_size': 3469, 'optimizer': 'Adam'}.
2026-06-04 07:57:43,004 - experiment_functions - INFO - Early stopping at epoch 800. Best Metrics: (0.0038567749678141195, 0.0006899323464398152, 0.0021477109504489185)
2026-06-04 07:57:43,072 - optuna.study.study - INFO - Trial 120 finished with values: [0.0038567749678141195, 0.0006899323464398152, 0.0021477109504489185] and parameters: {'n_layers': 3, 'embedding_dim': 96, 'lr': 0.0037544382096841252, 'lambda_val': 0.09136832704959988, 'batch_size': 3497, 'optimizer': 'RMSprop'}.
2026-06-04 07:58:16,710 - experiment_functions - INFO - Early stopping at epoch 850. Best Metrics: (0.008915920233269956, 0.0016076093509277245, 0.005292415733989969)
2026-06-04 07:58:18,028 - optuna.study.study - INFO - Trial 121 finished with values: [0.008915920233269956, 0.0016076093509277245, 0.005292415733989969] and parameters: {'n_layers': 3, 'embedding_dim': 64, 'lr': 0.002820612855470111, 'lambda_val': 0.0002748178610784401, 'batch_size': 775, 'optimizer': 'RMSprop'}.
2026-06-04 07:58:59,108 - experiment_functions - INFO - Early stopping at epoch 1050. Best Metrics: (0.0006048751392918572, 8.875343291580147e-05, 0.000259891474591372)
2026-06-04 07:58:59,302 - optuna.study.study - INFO - Trial 122 finished with values: [0.0006048751392918572, 8.875343291580147e-05, 0.000259891474591372] and parameters: {'n_layers': 1, 'embedding_dim': 128, 'lr': 5.132650060634319e-05, 'lambda_val': 2.2519914952733722e-06, 'batch_size': 2639, 'optimizer': 'Adam'}.
2026-06-04 07:59:32,033 - experiment_functions - INFO - Early stopping at epoch 700. Best Metrics: (0.004820056673676946, 0.0008908835153057808, 0.0027532759983428406)
2026-06-04 07:59:32,108 - optuna.study.study - INFO - Trial 123 finished with values: [0.004820056673676946, 0.0008908835153057808, 0.0027532759983428406] and parameters: {'n_layers': 2, 'embedding_dim': 256, 'lr': 0.0044385330633786016, 'lambda_val': 0.0028698778902023414, 'batch_size': 1558, 'optimizer': 'Adam'}.
2026-06-04 07:59:57,143 - experiment_functions - INFO - Early stopping at epoch 600. Best Metrics: (0.0052078719608440556, 0.0008942327014535468, 0.0028669419353177608)
2026-06-04 07:59:57,586 - optuna.study.study - INFO - Trial 124 finished with values: [0.0052078719608440556, 0.0008942327014535468, 0.0028669419353177608] and parameters: {'n_layers': 2, 'embedding_dim': 96, 'lr': 0.004940475209986187, 'lambda_val': 0.0005151967667694534, 'batch_size': 1888, 'optimizer': 'RMSprop'}.
2026-06-04 08:02:29,201 - optuna.study.study - INFO - Trial 125 finished with values: [0.0041267993351484095, 0.0006681626364793355, 0.0024388642101328185] and parameters: {'n_layers': 3, 'embedding_dim': 64, 'lr': 0.0002170623403356149, 'lambda_val': 2.2233828008365298e-05, 'batch_size': 3402, 'optimizer': 'RMSprop'}.
2026-06-04 08:02:54,899 - experiment_functions - INFO - Early stopping at epoch 550. Best Metrics: (0.00496792683267189, 0.0009478196798178044, 0.0029342095760184184)
2026-06-04 08:02:55,004 - optuna.study.study - INFO - Trial 126 finished with values: [0.00496792683267189, 0.0009478196798178044, 0.0029342095760184184] and parameters: {'n_layers': 4, 'embedding_dim': 128, 'lr': 0.011472785289985216, 'lambda_val': 0.006409139170390952, 'batch_size': 3961, 'optimizer': 'Adam'}.
2026-06-04 08:05:32,275 - experiment_functions - INFO - Early stopping at epoch 3800. Best Metrics: (0.00511100636471825, 0.0008506932815325875, 0.0030399665714304323)
2026-06-04 08:05:32,338 - optuna.study.study - INFO - Trial 127 finished with values: [0.00511100636471825, 0.0008506932815325875, 0.0030399665714304323] and parameters: {'n_layers': 1, 'embedding_dim': 256, 'lr': 0.0013876621562912753, 'lambda_val': 6.1407786046843e-05, 'batch_size': 1076, 'optimizer': 'Adam'}.
2026-06-04 08:06:00,810 - experiment_functions - INFO - Early stopping at epoch 700. Best Metrics: (0.006661201211014475, 0.0012006832339741442, 0.004012343032372461)
2026-06-04 08:06:00,887 - optuna.study.study - INFO - Trial 128 finished with values: [0.006661201211014475, 0.0012006832339741442, 0.004012343032372461] and parameters: {'n_layers': 3, 'embedding_dim': 64, 'lr': 0.005645164292154372, 'lambda_val': 0.0002748178610784401, 'batch_size': 775, 'optimizer': 'RMSprop'}.
2026-06-04 08:06:57,879 - experiment_functions - INFO - Early stopping at epoch 1250. Best Metrics: (0.004348746852344428, 0.0008506932815325877, 0.0024105762882306735)
2026-06-04 08:06:57,968 - optuna.study.study - INFO - Trial 129 finished with values: [0.004348746852344428, 0.0008506932815325877, 0.0024105762882306735] and parameters: {'n_layers': 2, 'embedding_dim': 256, 'lr': 0.014134145405446918, 'lambda_val': 0.0054022876436497684, 'batch_size': 3469, 'optimizer': 'RMSprop'}.
2026-06-04 08:07:37,120 - experiment_functions - INFO - Early stopping at epoch 1000. Best Metrics: (0.005258505170284274, 0.0008975818876013129, 0.003060101472031857)
2026-06-04 08:07:38,036 - optuna.study.study - INFO - Trial 130 finished with values: [0.005258505170284274, 0.0008975818876013129, 0.003060101472031857] and parameters: {'n_layers': 2, 'embedding_dim': 64, 'lr': 0.004074850116282639, 'lambda_val': 1.2783765641563612e-05, 'batch_size': 3057, 'optimizer': 'Adam'}.
2026-06-04 08:10:24,509 - optuna.study.study - INFO - Trial 131 finished with values: [0.005259242054293792, 0.0008372965369415233, 0.0029970351862061624] and parameters: {'n_layers': 1, 'embedding_dim': 256, 'lr': 0.0010442431692131513, 'lambda_val': 0.00018719781028967436, 'batch_size': 945, 'optimizer': 'Adam'}.
2026-06-04 08:11:30,338 - experiment_functions - INFO - Early stopping at epoch 1250. Best Metrics: (0.008429803112370333, 0.0015305780695291046, 0.004759388736732404)
2026-06-04 08:11:30,447 - optuna.study.study - INFO - Trial 132 finished with values: [0.008429803112370333, 0.0015305780695291046, 0.004759388736732404] and parameters: {'n_layers': 4, 'embedding_dim': 256, 'lr': 0.0009358706696693685, 'lambda_val': 0.00014523930854886327, 'batch_size': 1801, 'optimizer': 'Adam'}.
2026-06-04 08:14:04,967 - optuna.study.study - INFO - Trial 133 finished with values: [0.0041700753948536035, 0.0007117020564002947, 0.002619338737556583] and parameters: {'n_layers': 4, 'embedding_dim': 64, 'lr': 0.00028236588427973475, 'lambda_val': 0.0002748178610784401, 'batch_size': 775, 'optimizer': 'RMSprop'}.
2026-06-04 08:16:05,907 - experiment_functions - INFO - Early stopping at epoch 3000. Best Metrics: (0.0006560389454698512, 9.210261906356756e-05, 0.0002990527275053316)
2026-06-04 08:16:06,185 - optuna.study.study - INFO - Trial 134 finished with values: [0.0006560389454698512, 9.210261906356756e-05, 0.0002990527275053316] and parameters: {'n_layers': 4, 'embedding_dim': 96, 'lr': 1.7426982806959048e-05, 'lambda_val': 0.009754411019917267, 'batch_size': 2156, 'optimizer': 'RMSprop'}.
2026-06-04 08:16:46,747 - experiment_functions - INFO - Early stopping at epoch 1000. Best Metrics: (0.006866487753256189, 0.0013112063768504253, 0.003979795134078623)
2026-06-04 08:16:47,803 - optuna.study.study - INFO - Trial 135 finished with values: [0.006866487753256189, 0.0013112063768504253, 0.003979795134078623] and parameters: {'n_layers': 4, 'embedding_dim': 64, 'lr': 0.0009993931731412705, 'lambda_val': 0.0054022876436497684, 'batch_size': 3544, 'optimizer': 'Adam'}.
2026-06-04 08:17:34,924 - experiment_functions - INFO - Early stopping at epoch 900. Best Metrics: (0.009186401829403019, 0.0016611963292919821, 0.005251832600150508)
2026-06-04 08:17:35,958 - optuna.study.study - INFO - Trial 136 finished with values: [0.009186401829403019, 0.0016611963292919821, 0.005251832600150508] and parameters: {'n_layers': 4, 'embedding_dim': 256, 'lr': 0.0009358706696693685, 'lambda_val': 0.00014523930854886327, 'batch_size': 1801, 'optimizer': 'RMSprop'}.
2026-06-04 08:18:11,018 - experiment_functions - INFO - Early stopping at epoch 750. Best Metrics: (0.005518883476995954, 0.00097293857592605, 0.0031431246253175375)
2026-06-04 08:18:11,804 - optuna.study.study - INFO - Trial 137 finished with values: [0.005518883476995954, 0.00097293857592605, 0.0031431246253175375] and parameters: {'n_layers': 2, 'embedding_dim': 256, 'lr': 0.0013876621562912753, 'lambda_val': 0.0021409506884441775, 'batch_size': 3339, 'optimizer': 'RMSprop'}.
2026-06-04 08:19:03,919 - experiment_functions - INFO - Early stopping at epoch 1150. Best Metrics: (0.0005361063823638786, 7.703128139862015e-05, 0.0002421343688428965)
2026-06-04 08:19:04,012 - optuna.study.study - INFO - Trial 138 finished with values: [0.0005361063823638786, 7.703128139862015e-05, 0.0002421343688428965] and parameters: {'n_layers': 2, 'embedding_dim': 256, 'lr': 1.9235588344371975e-05, 'lambda_val': 0.0012865728517446665, 'batch_size': 1839, 'optimizer': 'Adam'}.
2026-06-04 08:19:53,280 - experiment_functions - INFO - Early stopping at epoch 1000. Best Metrics: (0.006255802391942443, 0.0011370486971665887, 0.0035830134481960037)
2026-06-04 08:19:53,384 - optuna.study.study - INFO - Trial 139 finished with values: [0.006255802391942443, 0.0011370486971665887, 0.0035830134481960037] and parameters: {'n_layers': 3, 'embedding_dim': 256, 'lr': 0.0009993931731412705, 'lambda_val': 0.0023860098486142224, 'batch_size': 3469, 'optimizer': 'Adam'}.
2026-06-04 08:20:16,795 - experiment_functions - INFO - Early stopping at epoch 550. Best Metrics: (0.006309545931323408, 0.0011923102686047292, 0.0036863359177004697)
2026-06-04 08:20:16,889 - optuna.study.study - INFO - Trial 140 finished with values: [0.006309545931323408, 0.0011923102686047292, 0.0036863359177004697] and parameters: {'n_layers': 4, 'embedding_dim': 64, 'lr': 0.004074850116282639, 'lambda_val': 0.0005151967667694534, 'batch_size': 3497, 'optimizer': 'RMSprop'}.
2026-06-04 08:20:57,603 - experiment_functions - INFO - Early stopping at epoch 1100. Best Metrics: (0.007007427697308077, 0.0011789135240136647, 0.004094572865612342)
2026-06-04 08:20:57,922 - optuna.study.study - INFO - Trial 141 finished with values: [0.007007427697308077, 0.0011789135240136647, 0.004094572865612342] and parameters: {'n_layers': 2, 'embedding_dim': 32, 'lr': 0.0023047972503770693, 'lambda_val': 6.1407786046843e-05, 'batch_size': 1839, 'optimizer': 'RMSprop'}.
2026-06-04 08:21:22,800 - experiment_functions - INFO - Early stopping at epoch 600. Best Metrics: (0.004895280755547705, 0.000833947350793757, 0.0029307660372304804)
2026-06-04 08:21:22,948 - optuna.study.study - INFO - Trial 142 finished with values: [0.004895280755547705, 0.000833947350793757, 0.0029307660372304804] and parameters: {'n_layers': 2, 'embedding_dim': 96, 'lr': 0.007158020046263984, 'lambda_val': 4.446523827876978e-06, 'batch_size': 2749, 'optimizer': 'RMSprop'}.
2026-06-04 08:21:49,451 - experiment_functions - INFO - Early stopping at epoch 600. Best Metrics: (0.007075840529826839, 0.0012944604461115948, 0.004007233029570665)
