2026-06-06 15:18:58,370 - optuna.study.study - INFO - Trial 113 finished with values: [0.013246393863552188, 0.002304240069663072, 0.007876356383532651] and parameters: {'n_layers': 1, 'embedding_dim': 96, 'lr': 0.0005151812249168082, 'lambda_val': 5.454874190410738e-06, 'batch_size': 1303, 'optimizer': 'Adam'}.
2026-06-06 15:19:53,850 - experiment_functions - INFO - Early stopping at epoch 1400. Best Metrics: (0.0005282239336295502, 7.033290910308795e-05, 0.0002532728703115329)
2026-06-06 15:19:54,133 - optuna.study.study - INFO - Trial 114 finished with values: [0.0005282239336295502, 7.033290910308795e-05, 0.0002532728703115329] and parameters: {'n_layers': 1, 'embedding_dim': 64, 'lr': 0.00014815746640230623, 'lambda_val': 0.017411477750148854, 'batch_size': 536, 'optimizer': 'RMSprop'}.
2026-06-06 15:20:44,174 - experiment_functions - INFO - Early stopping at epoch 1200. Best Metrics: (0.020328777317380677, 0.002470024783977494, 0.009106212040101178)
2026-06-06 15:20:44,739 - optuna.study.study - INFO - Trial 115 finished with values: [0.020328777317380677, 0.002470024783977494, 0.009106212040101178] and parameters: {'n_layers': 1, 'embedding_dim': 64, 'lr': 0.010081153699021374, 'lambda_val': 0.017411477750148854, 'batch_size': 1015, 'optimizer': 'RMSprop'}.
2026-06-06 15:21:14,473 - experiment_functions - INFO - Early stopping at epoch 550. Best Metrics: (0.031821904715494634, 0.0037226204032420125, 0.01501585847325039)
2026-06-06 15:21:15,347 - optuna.study.study - INFO - Trial 116 finished with values: [0.031821904715494634, 0.0037226204032420125, 0.01501585847325039] and parameters: {'n_layers': 3, 'embedding_dim': 128, 'lr': 0.024960250005651878, 'lambda_val': 4.147813246373108e-05, 'batch_size': 3007, 'optimizer': 'RMSprop'}.
2026-06-06 15:21:43,664 - experiment_functions - INFO - Early stopping at epoch 550. Best Metrics: (0.011766886285593569, 0.0014518721950566014, 0.006046472776645937)
2026-06-06 15:21:44,320 - optuna.study.study - INFO - Trial 117 finished with values: [0.011766886285593569, 0.0014518721950566014, 0.006046472776645937] and parameters: {'n_layers': 2, 'embedding_dim': 128, 'lr': 0.06128758575490874, 'lambda_val': 2.252556463844016e-05, 'batch_size': 3909, 'optimizer': 'RMSprop'}.
2026-06-06 15:22:22,407 - experiment_functions - INFO - Early stopping at epoch 800. Best Metrics: (0.02474170140896269, 0.002933887065443097, 0.010825323972843403)
2026-06-06 15:22:23,159 - optuna.study.study - INFO - Trial 118 finished with values: [0.02474170140896269, 0.002933887065443097, 0.010825323972843403] and parameters: {'n_layers': 2, 'embedding_dim': 96, 'lr': 0.00593968435272672, 'lambda_val': 0.006586196833192326, 'batch_size': 1165, 'optimizer': 'Adam'}.
2026-06-06 15:26:18,781 - optuna.study.study - INFO - Trial 119 finished with values: [0.037131415111546426, 0.0050170808493536076, 0.019034082090449846] and parameters: {'n_layers': 4, 'embedding_dim': 256, 'lr': 0.00014815746640230623, 'lambda_val': 0.0007001581162856878, 'batch_size': 2277, 'optimizer': 'RMSprop'}.
2026-06-06 15:29:10,993 - optuna.study.study - INFO - Trial 120 finished with values: [0.04741721481698797, 0.006015138321387902, 0.024192174981221306] and parameters: {'n_layers': 4, 'embedding_dim': 64, 'lr': 0.00029816136001899624, 'lambda_val': 0.0007001581162856878, 'batch_size': 2237, 'optimizer': 'Adam'}.
2026-06-06 15:29:39,032 - experiment_functions - INFO - Early stopping at epoch 550. Best Metrics: (0.013884175460425436, 0.001661196329291982, 0.006740102000346203)
2026-06-06 15:29:40,644 - optuna.study.study - INFO - Trial 121 finished with values: [0.013884175460425436, 0.001661196329291982, 0.006740102000346203] and parameters: {'n_layers': 3, 'embedding_dim': 96, 'lr': 0.0693886464668809, 'lambda_val': 2.6044128056798885e-05, 'batch_size': 2302, 'optimizer': 'RMSprop'}.
2026-06-06 15:30:09,659 - experiment_functions - INFO - Early stopping at epoch 550. Best Metrics: (0.027187850180152465, 0.003175028468082256, 0.012513532407458346)
2026-06-06 15:30:10,941 - optuna.study.study - INFO - Trial 122 finished with values: [0.027187850180152465, 0.003175028468082256, 0.012513532407458346] and parameters: {'n_layers': 4, 'embedding_dim': 96, 'lr': 0.0504067015569555, 'lambda_val': 3.3494997586996853e-06, 'batch_size': 2404, 'optimizer': 'Adam'}.
2026-06-06 15:33:08,878 - optuna.study.study - INFO - Trial 123 finished with values: [0.0015770976520886695, 0.0002595619264518722, 0.0007613983485621158] and parameters: {'n_layers': 1, 'embedding_dim': 256, 'lr': 0.0004253235577843119, 'lambda_val': 1.4780082520235353e-05, 'batch_size': 589, 'optimizer': 'Adam'}.
2026-06-06 15:35:58,573 - optuna.study.study - INFO - Trial 124 finished with values: [0.028339350850150838, 0.0036757317971732872, 0.01377633806502326] and parameters: {'n_layers': 4, 'embedding_dim': 64, 'lr': 0.00039823438048122364, 'lambda_val': 0.009625224795450376, 'batch_size': 953, 'optimizer': 'Adam'}.
2026-06-06 15:39:57,591 - optuna.study.study - INFO - Trial 125 finished with values: [0.05257038683500703, 0.006517516243552818, 0.025865127769031594] and parameters: {'n_layers': 4, 'embedding_dim': 256, 'lr': 0.00039823438048122364, 'lambda_val': 0.0008971608129751253, 'batch_size': 814, 'optimizer': 'RMSprop'}.
2026-06-06 15:40:24,778 - experiment_functions - INFO - Early stopping at epoch 550. Best Metrics: (0.033004550572709235, 0.004049166052649206, 0.01630595696261311)
2026-06-06 15:40:25,402 - optuna.study.study - INFO - Trial 126 finished with values: [0.033004550572709235, 0.004049166052649206, 0.01630595696261311] and parameters: {'n_layers': 4, 'embedding_dim': 64, 'lr': 0.005596800397668782, 'lambda_val': 3.3494997586996853e-06, 'batch_size': 3074, 'optimizer': 'Adam'}.
2026-06-06 15:43:04,898 - optuna.study.study - INFO - Trial 127 finished with values: [0.030133646633667646, 0.00436398955053922, 0.016869934114255903] and parameters: {'n_layers': 2, 'embedding_dim': 64, 'lr': 0.00029816136001899624, 'lambda_val': 0.0001288880800291056, 'batch_size': 2030, 'optimizer': 'RMSprop'}.
2026-06-06 15:43:37,103 - experiment_functions - INFO - Early stopping at epoch 700. Best Metrics: (0.030433135618244074, 0.003915198606738563, 0.014728744550786538)
2026-06-06 15:43:37,826 - optuna.study.study - INFO - Trial 128 finished with values: [0.030433135618244074, 0.003915198606738563, 0.014728744550786538] and parameters: {'n_layers': 1, 'embedding_dim': 128, 'lr': 0.013856986777548135, 'lambda_val': 0.0005031918520424605, 'batch_size': 2277, 'optimizer': 'RMSprop'}.
2026-06-06 15:45:56,259 - experiment_functions - INFO - Early stopping at epoch 2800. Best Metrics: (0.05336630293000532, 0.006576127001138724, 0.025966142099153766)
2026-06-06 15:45:57,098 - optuna.study.study - INFO - Trial 129 finished with values: [0.05336630293000532, 0.006576127001138724, 0.025966142099153766] and parameters: {'n_layers': 4, 'embedding_dim': 128, 'lr': 0.0005151812249168082, 'lambda_val': 2.6092056130364808e-05, 'batch_size': 3832, 'optimizer': 'Adam'}.
2026-06-06 15:49:16,283 - optuna.study.study - INFO - Trial 130 finished with values: [0.05657595246191416, 0.0076863822091231835, 0.031776733957309594] and parameters: {'n_layers': 2, 'embedding_dim': 256, 'lr': 0.00039823438048122364, 'lambda_val': 0.0008971608129751253, 'batch_size': 953, 'optimizer': 'RMSprop'}.
2026-06-06 15:50:01,168 - experiment_functions - INFO - Early stopping at epoch 700. Best Metrics: (0.00042966959628618935, 7.53566883247371e-05, 0.00024985645947260863)
2026-06-06 15:50:01,636 - optuna.study.study - INFO - Trial 131 finished with values: [0.00042966959628618935, 7.53566883247371e-05, 0.00024985645947260863] and parameters: {'n_layers': 4, 'embedding_dim': 256, 'lr': 3.08844090692991e-05, 'lambda_val': 0.0001420292710963057, 'batch_size': 1760, 'optimizer': 'RMSprop'}.
2026-06-06 15:50:33,760 - experiment_functions - INFO - Early stopping at epoch 650. Best Metrics: (0.02504596651484489, 0.0029539821823296943, 0.011093067235311792)
2026-06-06 15:50:34,168 - optuna.study.study - INFO - Trial 132 finished with values: [0.02504596651484489, 0.0029539821823296943, 0.011093067235311792] and parameters: {'n_layers': 4, 'embedding_dim': 64, 'lr': 0.014361178206195096, 'lambda_val': 0.00025971850447075427, 'batch_size': 2631, 'optimizer': 'Adam'}.
2026-06-06 15:53:14,920 - optuna.study.study - INFO - Trial 133 finished with values: [0.006950985399262776, 0.0012157545716390918, 0.00394280313209063] and parameters: {'n_layers': 1, 'embedding_dim': 128, 'lr': 0.000287312616338059, 'lambda_val': 2.2159355846189394e-06, 'batch_size': 3164, 'optimizer': 'Adam'}.
2026-06-06 15:56:04,461 - optuna.study.study - INFO - Trial 134 finished with values: [0.029615283061921342, 0.0037695090093107374, 0.014317690209313888] and parameters: {'n_layers': 4, 'embedding_dim': 64, 'lr': 0.00039823438048122364, 'lambda_val': 0.0054454682798184975, 'batch_size': 1240, 'optimizer': 'RMSprop'}.
2026-06-06 15:57:24,660 - experiment_functions - INFO - Early stopping at epoch 1800. Best Metrics: (0.01804575025436129, 0.0020882175631321592, 0.007799931998546315)
2026-06-06 15:57:24,905 - optuna.study.study - INFO - Trial 135 finished with values: [0.01804575025436129, 0.0020882175631321592, 0.007799931998546315] and parameters: {'n_layers': 3, 'embedding_dim': 96, 'lr': 0.04708241095252787, 'lambda_val': 0.005143748310703553, 'batch_size': 1516, 'optimizer': 'RMSprop'}.
2026-06-06 16:01:23,334 - optuna.study.study - INFO - Trial 136 finished with values: [0.03921015404257146, 0.00451302833411481, 0.01737408079617268] and parameters: {'n_layers': 4, 'embedding_dim': 256, 'lr': 0.0016310133844241697, 'lambda_val': 1.2160816785194988e-06, 'batch_size': 666, 'optimizer': 'Adam'}.
2026-06-06 16:01:48,972 - experiment_functions - INFO - Early stopping at epoch 550. Best Metrics: (0.008015010442621331, 0.0009813115412954654, 0.0038891431884413483)
2026-06-06 16:01:49,270 - optuna.study.study - INFO - Trial 137 finished with values: [0.008015010442621331, 0.0009813115412954654, 0.0038891431884413483] and parameters: {'n_layers': 4, 'embedding_dim': 32, 'lr': 0.0323699675032409, 'lambda_val': 0.029461778634504096, 'batch_size': 1805, 'optimizer': 'RMSprop'}.
2026-06-06 16:04:17,714 - optuna.study.study - INFO - Trial 138 finished with values: [0.01204828617603109, 0.0019575993033692815, 0.007210314941827673] and parameters: {'n_layers': 1, 'embedding_dim': 32, 'lr': 0.0005194903303948574, 'lambda_val': 0.0010621271203785812, 'batch_size': 1460, 'optimizer': 'Adam'}.
2026-06-06 16:04:44,316 - experiment_functions - INFO - Early stopping at epoch 550. Best Metrics: (0.02209676136481076, 0.00270446781432112, 0.01012577166331716)
2026-06-06 16:04:44,737 - optuna.study.study - INFO - Trial 139 finished with values: [0.02209676136481076, 0.00270446781432112, 0.01012577166331716] and parameters: {'n_layers': 4, 'embedding_dim': 32, 'lr': 0.08790291616580895, 'lambda_val': 1.2160816785194988e-06, 'batch_size': 2631, 'optimizer': 'Adam'}.
2026-06-06 16:05:26,708 - experiment_functions - INFO - Early stopping at epoch 850. Best Metrics: (0.06311994063406368, 0.007614374706946213, 0.03135334531623118)
2026-06-06 16:05:26,967 - optuna.study.study - INFO - Trial 140 finished with values: [0.06311994063406368, 0.007614374706946213, 0.03135334531623118] and parameters: {'n_layers': 2, 'embedding_dim': 128, 'lr': 0.0016310133844241697, 'lambda_val': 4.5847333595117975e-06, 'batch_size': 2259, 'optimizer': 'RMSprop'}.
2026-06-06 16:06:18,150 - experiment_functions - INFO - Early stopping at epoch 850. Best Metrics: (0.05033809911993975, 0.006118963091968652, 0.024178712013089604)
2026-06-06 16:06:18,779 - optuna.study.study - INFO - Trial 141 finished with values: [0.05033809911993975, 0.006118963091968652, 0.024178712013089604] and parameters: {'n_layers': 3, 'embedding_dim': 256, 'lr': 0.0007970006502074318, 'lambda_val': 0.0012489670078927163, 'batch_size': 4046, 'optimizer': 'RMSprop'}.
2026-06-06 16:07:17,872 - experiment_functions - INFO - Early stopping at epoch 1400. Best Metrics: (0.044983972211953716, 0.005345301091834684, 0.021253856884341265)
2026-06-06 16:07:18,630 - optuna.study.study - INFO - Trial 142 finished with values: [0.044983972211953716, 0.005345301091834684, 0.021253856884341265] and parameters: {'n_layers': 1, 'embedding_dim': 64, 'lr': 0.010081153699021374, 'lambda_val': 8.354781545326947e-06, 'batch_size': 2059, 'optimizer': 'RMSprop'}.
2026-06-06 16:09:46,477 - experiment_functions - INFO - Early stopping at epoch 2450. Best Metrics: (0.057263573407041496, 0.00700817201420055, 0.028037602604622524)
2026-06-06 16:09:46,762 - optuna.study.study - INFO - Trial 143 finished with values: [0.057263573407041496, 0.00700817201420055, 0.028037602604622524] and parameters: {'n_layers': 4, 'embedding_dim': 256, 'lr': 0.0004384493357461144, 'lambda_val': 0.0007173537198529124, 'batch_size': 953, 'optimizer': 'RMSprop'}.
2026-06-06 16:10:14,011 - experiment_functions - INFO - Early stopping at epoch 500. Best Metrics: (0.0003224908350190178, 6.0285350659789674e-05, 0.0001393322202034367)
2026-06-06 16:10:14,460 - optuna.study.study - INFO - Trial 144 finished with values: [0.0003224908350190178, 6.0285350659789674e-05, 0.0001393322202034367] and parameters: {'n_layers': 1, 'embedding_dim': 256, 'lr': 1.2500428993673535e-05, 'lambda_val': 1.4780082520235353e-05, 'batch_size': 2302, 'optimizer': 'Adam'}.
2026-06-06 16:10:42,693 - experiment_functions - INFO - Early stopping at epoch 550. Best Metrics: (0.018540755493020224, 0.0022439547190032825, 0.008387480038156012)
2026-06-06 16:10:44,462 - optuna.study.study - INFO - Trial 145 finished with values: [0.018540755493020224, 0.0022439547190032825, 0.008387480038156012] and parameters: {'n_layers': 3, 'embedding_dim': 96, 'lr': 0.024960250005651878, 'lambda_val': 0.005654238457918686, 'batch_size': 1985, 'optimizer': 'Adam'}.
2026-06-06 16:12:07,963 - experiment_functions - INFO - Early stopping at epoch 1800. Best Metrics: (0.0005018050771514094, 7.033290910308795e-05, 0.00021221966659177902)
2026-06-06 16:12:08,613 - optuna.study.study - INFO - Trial 146 finished with values: [0.0005018050771514094, 7.033290910308795e-05, 0.00021221966659177902] and parameters: {'n_layers': 3, 'embedding_dim': 128, 'lr': 1.2489906189280505e-05, 'lambda_val': 2.252556463844016e-05, 'batch_size': 3469, 'optimizer': 'Adam'}.
2026-06-06 16:14:52,120 - optuna.study.study - INFO - Trial 147 finished with values: [0.06659096514312172, 0.009002612365195258, 0.03734187293777957] and parameters: {'n_layers': 1, 'embedding_dim': 96, 'lr': 0.0007970006502074318, 'lambda_val': 3.3494997586996853e-06, 'batch_size': 1760, 'optimizer': 'Adam'}.
2026-06-06 16:15:17,583 - experiment_functions - INFO - Early stopping at epoch 550. Best Metrics: (0.012356137011118803, 0.001904012325005024, 0.0061421823787414405)
2026-06-06 16:15:18,391 - optuna.study.study - INFO - Trial 148 finished with values: [0.012356137011118803, 0.001904012325005024, 0.0061421823787414405] and parameters: {'n_layers': 1, 'embedding_dim': 32, 'lr': 0.05199048927325542, 'lambda_val': 0.0013810581485740883, 'batch_size': 1218, 'optimizer': 'Adam'}.
2026-06-06 16:18:54,188 - optuna.study.study - INFO - Trial 149 finished with values: [0.021437305727178793, 0.003148234978900128, 0.011422050212338813] and parameters: {'n_layers': 3, 'embedding_dim': 256, 'lr': 0.00014815746640230623, 'lambda_val': 0.0007001581162856878, 'batch_size': 2163, 'optimizer': 'RMSprop'}.
2026-06-06 16:22:10,523 - optuna.study.study - INFO - Trial 150 finished with values: [0.06253287406649435, 0.007657914126867171, 0.03294872753884327] and parameters: {'n_layers': 4, 'embedding_dim': 128, 'lr': 0.00039823438048122364, 'lambda_val': 2.6092056130364808e-05, 'batch_size': 2302, 'optimizer': 'RMSprop'}.
2026-06-06 16:24:58,700 - optuna.study.study - INFO - Trial 151 finished with values: [0.06126159039654964, 0.008429901533927255, 0.03433839779769489] and parameters: {'n_layers': 1, 'embedding_dim': 128, 'lr': 0.0005151812249168082, 'lambda_val': 2.6092056130364808e-05, 'batch_size': 3832, 'optimizer': 'Adam'}.
2026-06-06 16:25:52,346 - experiment_functions - INFO - Early stopping at epoch 1100. Best Metrics: (0.04007378913258661, 0.00474914595753232, 0.0187021866162957)
2026-06-06 16:25:53,930 - optuna.study.study - INFO - Trial 152 finished with values: [0.04007378913258661, 0.00474914595753232, 0.0187021866162957] and parameters: {'n_layers': 4, 'embedding_dim': 96, 'lr': 0.0015700216413847947, 'lambda_val': 7.550136003216131e-06, 'batch_size': 3145, 'optimizer': 'RMSprop'}.
2026-06-06 16:29:52,235 - optuna.study.study - INFO - Trial 153 finished with values: [0.03762750155676624, 0.005000334918614777, 0.01999371508364281] and parameters: {'n_layers': 4, 'embedding_dim': 256, 'lr': 0.00014493081704961333, 'lambda_val': 7.199693710203336e-05, 'batch_size': 3591, 'optimizer': 'Adam'}.
2026-06-06 16:33:11,947 - optuna.study.study - INFO - Trial 154 finished with values: [0.05103204102493399, 0.0070885524817469354, 0.02912597822469598] and parameters: {'n_layers': 2, 'embedding_dim': 256, 'lr': 0.00039823438048122364, 'lambda_val': 4.5847333595117975e-06, 'batch_size': 814, 'optimizer': 'RMSprop'}.
2026-06-06 16:34:09,655 - experiment_functions - INFO - Early stopping at epoch 1400. Best Metrics: (0.0005332243082594747, 6.195994373367272e-05, 0.00022794633032392617)
2026-06-06 16:34:10,002 - optuna.study.study - INFO - Trial 155 finished with values: [0.0005332243082594747, 6.195994373367272e-05, 0.00022794633032392617] and parameters: {'n_layers': 1, 'embedding_dim': 96, 'lr': 1.2814432995077052e-05, 'lambda_val': 7.199693710203336e-05, 'batch_size': 3591, 'optimizer': 'Adam'}.
2026-06-06 16:35:14,774 - experiment_functions - INFO - Early stopping at epoch 1000. Best Metrics: (0.05657934941898493, 0.006869180789068257, 0.02812186745940967)
2026-06-06 16:35:15,307 - optuna.study.study - INFO - Trial 156 finished with values: [0.05657934941898493, 0.006869180789068257, 0.02812186745940967] and parameters: {'n_layers': 4, 'embedding_dim': 256, 'lr': 0.0007970006502074318, 'lambda_val': 1.2160816785194988e-06, 'batch_size': 3591, 'optimizer': 'Adam'}.
2026-06-06 16:37:10,978 - experiment_functions - INFO - Early stopping at epoch 2450. Best Metrics: (0.05893644664799302, 0.007381606269676468, 0.030413986175259675)
2026-06-06 16:37:11,226 - optuna.study.study - INFO - Trial 157 finished with values: [0.05893644664799302, 0.007381606269676468, 0.030413986175259675] and parameters: {'n_layers': 3, 'embedding_dim': 128, 'lr': 0.00039823438048122364, 'lambda_val': 0.0014674492199833664, 'batch_size': 2302, 'optimizer': 'RMSprop'}.
2026-06-06 16:37:58,721 - experiment_functions - INFO - Early stopping at epoch 1100. Best Metrics: (0.0004852511895391584, 8.205506062026927e-05, 0.00021019994329601237)
2026-06-06 16:37:59,300 - optuna.study.study - INFO - Trial 158 finished with values: [0.0004852511895391584, 8.205506062026927e-05, 0.00021019994329601237] and parameters: {'n_layers': 1, 'embedding_dim': 128, 'lr': 9.203092879887201e-05, 'lambda_val': 7.199693710203336e-05, 'batch_size': 3591, 'optimizer': 'Adam'}.
2026-06-06 16:41:01,685 - experiment_functions - INFO - Early stopping at epoch 3250. Best Metrics: (0.07394813094423876, 0.00904280259896845, 0.03679290404218107)
2026-06-06 16:41:01,952 - optuna.study.study - INFO - Trial 159 finished with values: [0.07394813094423876, 0.00904280259896845, 0.03679290404218107] and parameters: {'n_layers': 3, 'embedding_dim': 256, 'lr': 0.0004543711173429324, 'lambda_val': 0.0004257798995801158, 'batch_size': 2277, 'optimizer': 'Adam'}.
2026-06-06 16:44:08,976 - optuna.study.study - INFO - Trial 160 finished with values: [0.09625518729591849, 0.011909705941456227, 0.051828680851058136] and parameters: {'n_layers': 1, 'embedding_dim': 256, 'lr': 0.0007970006502074318, 'lambda_val': 3.3494997586996853e-06, 'batch_size': 3074, 'optimizer': 'RMSprop'}.
2026-06-06 16:47:05,716 - optuna.study.study - INFO - Trial 161 finished with values: [0.053682854093919895, 0.006706745260901602, 0.026658147186410422] and parameters: {'n_layers': 3, 'embedding_dim': 96, 'lr': 0.00039823438048122364, 'lambda_val': 0.0028258090394084607, 'batch_size': 2277, 'optimizer': 'Adam'}.
2026-06-06 16:49:56,956 - optuna.study.study - INFO - Trial 162 finished with values: [0.09422601438093776, 0.011712103958738028, 0.051245118189896174] and parameters: {'n_layers': 1, 'embedding_dim': 128, 'lr': 0.0007970006502074318, 'lambda_val': 7.199693710203336e-05, 'batch_size': 3591, 'optimizer': 'RMSprop'}.
2026-06-06 16:53:53,406 - optuna.study.study - INFO - Trial 163 finished with values: [0.03997006045339584, 0.004757518922901736, 0.018922626133644427] and parameters: {'n_layers': 4, 'embedding_dim': 256, 'lr': 0.0019878431480735456, 'lambda_val': 7.650473592526119e-05, 'batch_size': 953, 'optimizer': 'RMSprop'}.
2026-06-06 16:56:37,670 - optuna.study.study - INFO - Trial 164 finished with values: [0.07202226073008636, 0.00906959608815058, 0.03927546109102799] and parameters: {'n_layers': 2, 'embedding_dim': 64, 'lr': 0.0005151812249168082, 'lambda_val': 0.0005031918520424605, 'batch_size': 2277, 'optimizer': 'RMSprop'}.
2026-06-06 16:59:57,383 - optuna.study.study - INFO - Trial 165 finished with values: [0.04566976474412176, 0.005300087078839842, 0.021201315867485502] and parameters: {'n_layers': 2, 'embedding_dim': 256, 'lr': 0.005090178116339799, 'lambda_val': 0.0004825728156493151, 'batch_size': 2422, 'optimizer': 'RMSprop'}.
2026-06-06 17:02:27,069 - experiment_functions - INFO - Early stopping at epoch 3250. Best Metrics: (0.04647281928618596, 0.005809163373300288, 0.022399338983584902)
