2026-06-04 20:26:17,161 - optuna.study.study - INFO - Trial 198 finished with values: [0.011537394186601121, 0.00206142407395003, 0.006681799458642161] and parameters: {'n_layers': 4, 'embedding_dim': 64, 'lr': 0.0010341842506299342, 'lambda_val': 1.6413472527343117e-06, 'batch_size': 791, 'optimizer': 'Adam'}.
2026-06-04 20:26:42,051 - experiment_functions - INFO - Early stopping at epoch 550. Best Metrics: (0.00519196568116305, 0.0008791613637885993, 0.0030215582204700603)
2026-06-04 20:26:42,169 - optuna.study.study - INFO - Trial 199 finished with values: [0.00519196568116305, 0.0008791613637885993, 0.0030215582204700603] and parameters: {'n_layers': 4, 'embedding_dim': 96, 'lr': 0.015391059160667443, 'lambda_val': 3.61928423516103e-05, 'batch_size': 3889, 'optimizer': 'RMSprop'}.
2026-06-04 20:27:08,213 - experiment_functions - INFO - Early stopping at epoch 550. Best Metrics: (0.0054790320273365905, 0.0009863353205171144, 0.003180897058265019)
2026-06-04 20:27:08,453 - optuna.study.study - INFO - Trial 200 finished with values: [0.0054790320273365905, 0.0009863353205171144, 0.003180897058265019] and parameters: {'n_layers': 4, 'embedding_dim': 128, 'lr': 0.003777254071001523, 'lambda_val': 0.004185304191460628, 'batch_size': 3398, 'optimizer': 'RMSprop'}.
2026-06-04 20:29:06,063 - experiment_functions - INFO - Early stopping at epoch 2950. Best Metrics: (0.007803291778044281, 0.001399959809766227, 0.004531387933456308)
2026-06-04 20:29:06,226 - optuna.study.study - INFO - Trial 201 finished with values: [0.007803291778044281, 0.001399959809766227, 0.004531387933456308] and parameters: {'n_layers': 4, 'embedding_dim': 64, 'lr': 0.0007307808528773397, 'lambda_val': 4.730522364295859e-06, 'batch_size': 3889, 'optimizer': 'Adam'}.
2026-06-04 20:31:44,313 - optuna.study.study - INFO - Trial 202 finished with values: [0.013559956432207653, 0.0024047156540960546, 0.008392891402150769] and parameters: {'n_layers': 4, 'embedding_dim': 64, 'lr': 0.0007307808528773397, 'lambda_val': 3.61928423516103e-05, 'batch_size': 791, 'optimizer': 'RMSprop'}.
2026-06-04 20:34:11,553 - optuna.study.study - INFO - Trial 203 finished with values: [0.0033775015065580197, 0.0006765356018487509, 0.0018889659231966045] and parameters: {'n_layers': 3, 'embedding_dim': 32, 'lr': 0.00040769039157989535, 'lambda_val': 0.07916609315511221, 'batch_size': 2129, 'optimizer': 'RMSprop'}.
2026-06-04 20:34:52,612 - experiment_functions - INFO - Early stopping at epoch 1000. Best Metrics: (0.010021072013228645, 0.0018119097059414563, 0.005960344342534132)
2026-06-04 20:34:52,929 - optuna.study.study - INFO - Trial 204 finished with values: [0.010021072013228645, 0.0018119097059414563, 0.005960344342534132] and parameters: {'n_layers': 4, 'embedding_dim': 64, 'lr': 0.0018402169651938755, 'lambda_val': 1.6413472527343117e-06, 'batch_size': 791, 'optimizer': 'Adam'}.
2026-06-04 20:35:28,483 - experiment_functions - INFO - Early stopping at epoch 650. Best Metrics: (0.007600625506671055, 0.0014234041128005895, 0.004366211336417987)
2026-06-04 20:35:29,420 - optuna.study.study - INFO - Trial 205 finished with values: [0.007600625506671055, 0.0014234041128005895, 0.004366211336417987] and parameters: {'n_layers': 4, 'embedding_dim': 256, 'lr': 0.0032493879970223157, 'lambda_val': 0.00016806129938668377, 'batch_size': 1336, 'optimizer': 'Adam'}.
2026-06-04 20:36:14,227 - experiment_functions - INFO - Early stopping at epoch 1000. Best Metrics: (0.008895025381646531, 0.0016411012124053854, 0.0052115281047095475)
2026-06-04 20:36:15,337 - optuna.study.study - INFO - Trial 206 finished with values: [0.008895025381646531, 0.0016411012124053854, 0.0052115281047095475] and parameters: {'n_layers': 4, 'embedding_dim': 128, 'lr': 0.0011827350330377861, 'lambda_val': 3.8631777865125085e-06, 'batch_size': 1621, 'optimizer': 'Adam'}.
2026-06-04 20:37:23,098 - experiment_functions - INFO - Early stopping at epoch 1700. Best Metrics: (0.006174938329918694, 0.0010667157880635005, 0.003679289272083496)
2026-06-04 20:37:23,184 - optuna.study.study - INFO - Trial 207 finished with values: [0.006174938329918694, 0.0010667157880635005, 0.003679289272083496] and parameters: {'n_layers': 2, 'embedding_dim': 96, 'lr': 0.0011827350330377861, 'lambda_val': 2.344534953461632e-06, 'batch_size': 1621, 'optimizer': 'Adam'}.
2026-06-04 20:38:29,385 - experiment_functions - INFO - Early stopping at epoch 1650. Best Metrics: (0.009158750889033753, 0.0016796168531046957, 0.005376716731511445)
2026-06-04 20:38:29,531 - optuna.study.study - INFO - Trial 208 finished with values: [0.009158750889033753, 0.0016796168531046957, 0.005376716731511445] and parameters: {'n_layers': 4, 'embedding_dim': 64, 'lr': 0.0007307808528773397, 'lambda_val': 3.61928423516103e-05, 'batch_size': 3398, 'optimizer': 'RMSprop'}.
2026-06-04 20:38:55,750 - experiment_functions - INFO - Early stopping at epoch 600. Best Metrics: (0.0067695782963014895, 0.0011973340478263783, 0.003914419104878732)
2026-06-04 20:38:56,676 - optuna.study.study - INFO - Trial 209 finished with values: [0.0067695782963014895, 0.0011973340478263783, 0.003914419104878732] and parameters: {'n_layers': 3, 'embedding_dim': 96, 'lr': 0.005524565371225565, 'lambda_val': 3.8631777865125085e-06, 'batch_size': 2880, 'optimizer': 'RMSprop'}.
2026-06-04 20:39:20,776 - experiment_functions - INFO - Early stopping at epoch 550. Best Metrics: (0.00491810808702748, 0.000787058744725032, 0.002845667257067366)
2026-06-04 20:39:20,872 - optuna.study.study - INFO - Trial 210 finished with values: [0.00491810808702748, 0.000787058744725032, 0.002845667257067366] and parameters: {'n_layers': 4, 'embedding_dim': 64, 'lr': 0.06571071114871913, 'lambda_val': 3.8631777865125085e-06, 'batch_size': 2129, 'optimizer': 'Adam'}.
2026-06-04 20:39:48,494 - experiment_functions - INFO - Early stopping at epoch 650. Best Metrics: (0.008283725114565698, 0.0014836894634603793, 0.004818751604370609)
2026-06-04 20:39:48,587 - optuna.study.study - INFO - Trial 211 finished with values: [0.008283725114565698, 0.0014836894634603793, 0.004818751604370609] and parameters: {'n_layers': 4, 'embedding_dim': 64, 'lr': 0.0018624775153074351, 'lambda_val': 3.61928423516103e-05, 'batch_size': 3398, 'optimizer': 'RMSprop'}.
2026-06-04 20:42:24,562 - optuna.study.study - INFO - Trial 212 finished with values: [0.004609524330658996, 0.0007753365932078505, 0.0028860764176485737] and parameters: {'n_layers': 4, 'embedding_dim': 64, 'lr': 0.00022150750424668007, 'lambda_val': 5.199522209620257e-06, 'batch_size': 2129, 'optimizer': 'Adam'}.
2026-06-04 20:42:54,108 - experiment_functions - INFO - Early stopping at epoch 700. Best Metrics: (0.00899752210336225, 0.0016009109786321927, 0.0052822329371490844)
2026-06-04 20:42:54,502 - optuna.study.study - INFO - Trial 213 finished with values: [0.00899752210336225, 0.0016009109786321927, 0.0052822329371490844] and parameters: {'n_layers': 4, 'embedding_dim': 64, 'lr': 0.0038915436873682946, 'lambda_val': 0.00024523530035259447, 'batch_size': 791, 'optimizer': 'Adam'}.
2026-06-04 20:43:33,348 - experiment_functions - INFO - Early stopping at epoch 850. Best Metrics: (0.005381233710057372, 0.0009863353205171144, 0.003013044117535058)
2026-06-04 20:43:33,450 - optuna.study.study - INFO - Trial 214 finished with values: [0.005381233710057372, 0.0009863353205171144, 0.003013044117535058] and parameters: {'n_layers': 4, 'embedding_dim': 128, 'lr': 0.0011320058446591282, 'lambda_val': 0.02627154508597836, 'batch_size': 3356, 'optimizer': 'Adam'}.
2026-06-04 20:44:03,302 - experiment_functions - INFO - Early stopping at epoch 700. Best Metrics: (0.00432160118824957, 0.0008222251992765758, 0.0026496591691481013)
2026-06-04 20:44:03,423 - optuna.study.study - INFO - Trial 215 finished with values: [0.00432160118824957, 0.0008222251992765758, 0.0026496591691481013] and parameters: {'n_layers': 4, 'embedding_dim': 64, 'lr': 0.0032493879970223157, 'lambda_val': 0.024168770757183055, 'batch_size': 861, 'optimizer': 'Adam'}.
2026-06-04 20:44:45,328 - experiment_functions - INFO - Early stopping at epoch 1100. Best Metrics: (0.005611942648917966, 0.0009578672382611026, 0.0033302993212566043)
2026-06-04 20:44:45,411 - optuna.study.study - INFO - Trial 216 finished with values: [0.005611942648917966, 0.0009578672382611026, 0.0033302993212566043] and parameters: {'n_layers': 2, 'embedding_dim': 32, 'lr': 0.0018624775153074351, 'lambda_val': 3.61928423516103e-05, 'batch_size': 3543, 'optimizer': 'RMSprop'}.
2026-06-04 20:45:26,332 - experiment_functions - INFO - Early stopping at epoch 900. Best Metrics: (0.008182155402779525, 0.0016009109786321925, 0.00468234277263323)
2026-06-04 20:45:27,406 - optuna.study.study - INFO - Trial 217 finished with values: [0.008182155402779525, 0.0016009109786321925, 0.00468234277263323] and parameters: {'n_layers': 4, 'embedding_dim': 128, 'lr': 0.003777254071001523, 'lambda_val': 3.61928423516103e-05, 'batch_size': 516, 'optimizer': 'Adam'}.
2026-06-04 20:48:19,179 - optuna.study.study - INFO - Trial 218 finished with values: [0.006618238883864281, 0.001193984861678612, 0.0040550694549343035] and parameters: {'n_layers': 4, 'embedding_dim': 128, 'lr': 0.00022150750424668007, 'lambda_val': 0.005255002744531624, 'batch_size': 2129, 'optimizer': 'RMSprop'}.
2026-06-04 20:48:59,730 - experiment_functions - INFO - Early stopping at epoch 900. Best Metrics: (0.00036697621253913514, 6.530912988143882e-05, 0.00017342106791704633)
2026-06-04 20:49:00,827 - optuna.study.study - INFO - Trial 219 finished with values: [0.00036697621253913514, 6.530912988143882e-05, 0.00017342106791704633] and parameters: {'n_layers': 4, 'embedding_dim': 128, 'lr': 1.3368336486387468e-05, 'lambda_val': 1.6413472527343117e-06, 'batch_size': 791, 'optimizer': 'Adam'}.
2026-06-04 20:51:35,002 - optuna.study.study - INFO - Trial 220 finished with values: [0.009661557694556514, 0.0016394266193315026, 0.005734402054635067] and parameters: {'n_layers': 3, 'embedding_dim': 64, 'lr': 0.0007307808528773397, 'lambda_val': 8.758320188573612e-06, 'batch_size': 1336, 'optimizer': 'Adam'}.
2026-06-04 20:52:18,180 - experiment_functions - INFO - Early stopping at epoch 850. Best Metrics: (0.007126846447655786, 0.0012710161430772324, 0.003923892349358171)
2026-06-04 20:52:18,326 - optuna.study.study - INFO - Trial 221 finished with values: [0.007126846447655786, 0.0012710161430772324, 0.003923892349358171] and parameters: {'n_layers': 3, 'embedding_dim': 256, 'lr': 0.003777254071001523, 'lambda_val': 3.8631777865125085e-06, 'batch_size': 2129, 'optimizer': 'Adam'}.
2026-06-04 20:53:01,618 - experiment_functions - INFO - Early stopping at epoch 1000. Best Metrics: (0.008685220259894549, 0.0015942126063366606, 0.0049525172802157924)
2026-06-04 20:53:01,733 - optuna.study.study - INFO - Trial 222 finished with values: [0.008685220259894549, 0.0015942126063366606, 0.0049525172802157924] and parameters: {'n_layers': 4, 'embedding_dim': 96, 'lr': 0.0010341842506299342, 'lambda_val': 3.61928423516103e-05, 'batch_size': 3510, 'optimizer': 'RMSprop'}.
2026-06-04 20:53:23,559 - experiment_functions - INFO - Early stopping at epoch 500. Best Metrics: (0.0004662682772984321, 6.698372295532186e-05, 0.00018455406320585257)
2026-06-04 20:53:24,196 - optuna.study.study - INFO - Trial 223 finished with values: [0.0004662682772984321, 6.698372295532186e-05, 0.00018455406320585257] and parameters: {'n_layers': 4, 'embedding_dim': 64, 'lr': 0.0010341842506299342, 'lambda_val': 3.61928423516103e-05, 'batch_size': 791, 'optimizer': 'SGD'}.
2026-06-04 20:53:54,666 - experiment_functions - INFO - Early stopping at epoch 650. Best Metrics: (0.008235163001596272, 0.0014769910911648471, 0.004770489460891463)
2026-06-04 20:53:55,246 - optuna.study.study - INFO - Trial 224 finished with values: [0.008235163001596272, 0.0014769910911648471, 0.004770489460891463] and parameters: {'n_layers': 4, 'embedding_dim': 128, 'lr': 0.0038915436873682946, 'lambda_val': 3.61928423516103e-05, 'batch_size': 2129, 'optimizer': 'Adam'}.
2026-06-04 20:54:40,165 - experiment_functions - INFO - Early stopping at epoch 900. Best Metrics: (0.00865742025583155, 0.0016243552816665552, 0.005124409369062495)
2026-06-04 20:54:40,265 - optuna.study.study - INFO - Trial 225 finished with values: [0.00865742025583155, 0.0016243552816665552, 0.005124409369062495] and parameters: {'n_layers': 4, 'embedding_dim': 96, 'lr': 0.0010341842506299342, 'lambda_val': 3.61928423516103e-05, 'batch_size': 3889, 'optimizer': 'RMSprop'}.
2026-06-04 20:55:01,571 - experiment_functions - INFO - Early stopping at epoch 500. Best Metrics: (0.0005336597067566891, 7.033290910308795e-05, 0.00022396287669982333)
2026-06-04 20:55:01,718 - optuna.study.study - INFO - Trial 226 finished with values: [0.0005336597067566891, 7.033290910308795e-05, 0.00022396287669982333] and parameters: {'n_layers': 3, 'embedding_dim': 64, 'lr': 0.00040769039157989535, 'lambda_val': 3.61928423516103e-05, 'batch_size': 2067, 'optimizer': 'SGD'}.
2026-06-04 20:57:53,123 - optuna.study.study - INFO - Trial 227 finished with values: [0.006317194132616453, 0.0011270011387232905, 0.003566972711841197] and parameters: {'n_layers': 4, 'embedding_dim': 128, 'lr': 0.000217189797847865, 'lambda_val': 0.005255002744531624, 'batch_size': 3356, 'optimizer': 'Adam'}.
2026-06-04 20:58:20,513 - experiment_functions - INFO - Early stopping at epoch 650. Best Metrics: (0.007919626444896764, 0.0014234041128005895, 0.004487556693662164)
2026-06-04 20:58:20,612 - optuna.study.study - INFO - Trial 228 finished with values: [0.007919626444896764, 0.0014234041128005895, 0.004487556693662164] and parameters: {'n_layers': 4, 'embedding_dim': 64, 'lr': 0.003777254071001523, 'lambda_val': 1.6413472527343117e-06, 'batch_size': 2003, 'optimizer': 'RMSprop'}.
2026-06-04 21:00:56,720 - optuna.study.study - INFO - Trial 229 finished with values: [0.011171704212262407, 0.002016210060955188, 0.006913009283251781] and parameters: {'n_layers': 4, 'embedding_dim': 64, 'lr': 0.0007688676008588178, 'lambda_val': 0.00016262429302101681, 'batch_size': 719, 'optimizer': 'Adam'}.
2026-06-04 21:03:44,192 - experiment_functions - INFO - Early stopping at epoch 3550. Best Metrics: (0.009589458027524186, 0.0017064103422868243, 0.005406146461727734)
2026-06-04 21:03:44,347 - optuna.study.study - INFO - Trial 230 finished with values: [0.009589458027524186, 0.0017064103422868243, 0.005406146461727734] and parameters: {'n_layers': 3, 'embedding_dim': 256, 'lr': 0.00040769039157989535, 'lambda_val': 2.344534953461632e-06, 'batch_size': 2129, 'optimizer': 'RMSprop'}.
2026-06-04 21:04:50,940 - experiment_functions - INFO - Early stopping at epoch 1700. Best Metrics: (0.0007319311771577111, 9.545180521133365e-05, 0.00031466774407427374)
2026-06-04 21:04:51,255 - optuna.study.study - INFO - Trial 231 finished with values: [0.0007319311771577111, 9.545180521133365e-05, 0.00031466774407427374] and parameters: {'n_layers': 4, 'embedding_dim': 64, 'lr': 3.052533725551004e-05, 'lambda_val': 8.758320188573612e-06, 'batch_size': 3414, 'optimizer': 'Adam'}.
2026-06-04 21:07:27,840 - optuna.study.study - INFO - Trial 232 finished with values: [0.009115164601809455, 0.0015808158617455958, 0.005345225826332336] and parameters: {'n_layers': 3, 'embedding_dim': 96, 'lr': 0.00040769039157989535, 'lambda_val': 0.000497909955595776, 'batch_size': 2129, 'optimizer': 'RMSprop'}.
2026-06-04 21:07:48,984 - experiment_functions - INFO - Early stopping at epoch 500. Best Metrics: (0.0006279416472019, 9.210261906356756e-05, 0.0002812430633851803)
2026-06-04 21:07:50,232 - optuna.study.study - INFO - Trial 233 finished with values: [0.0006279416472019, 9.210261906356756e-05, 0.0002812430633851803] and parameters: {'n_layers': 4, 'embedding_dim': 64, 'lr': 0.0007688676008588178, 'lambda_val': 3.61928423516103e-05, 'batch_size': 2193, 'optimizer': 'SGD'}.
2026-06-04 21:08:20,945 - experiment_functions - INFO - Early stopping at epoch 550. Best Metrics: (0.006725017320843621, 0.0012224529439346238, 0.0037115026838985938)
2026-06-04 21:08:21,874 - optuna.study.study - INFO - Trial 234 finished with values: [0.006725017320843621, 0.0012224529439346238, 0.0037115026838985938] and parameters: {'n_layers': 4, 'embedding_dim': 128, 'lr': 0.003777254071001523, 'lambda_val': 0.0016802535218420423, 'batch_size': 1621, 'optimizer': 'RMSprop'}.
2026-06-04 21:09:08,999 - experiment_functions - INFO - Early stopping at epoch 900. Best Metrics: (0.005316163619245432, 0.0010231763681425412, 0.0030144765975185944)
2026-06-04 21:09:09,492 - optuna.study.study - INFO - Trial 235 finished with values: [0.005316163619245432, 0.0010231763681425412, 0.0030144765975185944] and parameters: {'n_layers': 4, 'embedding_dim': 256, 'lr': 0.0013813482214859749, 'lambda_val': 0.019677648682928033, 'batch_size': 775, 'optimizer': 'Adam'}.
2026-06-04 21:09:43,129 - experiment_functions - INFO - Early stopping at epoch 800. Best Metrics: (0.0077085558874604295, 0.0013714917275102151, 0.004495232498340333)
2026-06-04 21:09:43,602 - optuna.study.study - INFO - Trial 236 finished with values: [0.0077085558874604295, 0.0013714917275102151, 0.004495232498340333] and parameters: {'n_layers': 3, 'embedding_dim': 96, 'lr': 0.00271379640296128, 'lambda_val': 2.344534953461632e-06, 'batch_size': 1336, 'optimizer': 'Adam'}.
2026-06-04 21:12:18,570 - optuna.study.study - INFO - Trial 237 finished with values: [0.014490135885847457, 0.002568825775336593, 0.008998543412691207] and parameters: {'n_layers': 4, 'embedding_dim': 64, 'lr': 0.0007307808528773397, 'lambda_val': 0.00012002132901256534, 'batch_size': 516, 'optimizer': 'RMSprop'}.
2026-06-04 21:13:10,998 - experiment_functions - INFO - Early stopping at epoch 1250. Best Metrics: (0.010739614433361794, 0.0020379797709156673, 0.006516564194940656)
2026-06-04 21:13:11,108 - optuna.study.study - INFO - Trial 238 finished with values: [0.010739614433361794, 0.0020379797709156673, 0.006516564194940656] and parameters: {'n_layers': 4, 'embedding_dim': 96, 'lr': 0.0013813482214859749, 'lambda_val': 1.6413472527343117e-06, 'batch_size': 791, 'optimizer': 'Adam'}.
2026-06-04 21:13:40,784 - experiment_functions - INFO - Early stopping at epoch 700. Best Metrics: (0.007224872367709398, 0.0012576193984861679, 0.004108580074769926)
2026-06-04 21:13:40,880 - optuna.study.study - INFO - Trial 239 finished with values: [0.007224872367709398, 0.0012576193984861679, 0.004108580074769926] and parameters: {'n_layers': 3, 'embedding_dim': 96, 'lr': 0.004614564538778378, 'lambda_val': 3.61928423516103e-05, 'batch_size': 2129, 'optimizer': 'RMSprop'}.
2026-06-04 21:14:19,952 - experiment_functions - INFO - Early stopping at epoch 1000. Best Metrics: (0.006453128801341995, 0.0011136043941322258, 0.003708963691365534)
2026-06-04 21:14:20,175 - optuna.study.study - INFO - Trial 240 finished with values: [0.006453128801341995, 0.0011136043941322258, 0.003708963691365534] and parameters: {'n_layers': 2, 'embedding_dim': 64, 'lr': 0.0011827350330377861, 'lambda_val': 0.0010585355849248238, 'batch_size': 3358, 'optimizer': 'RMSprop'}.
2026-06-04 21:17:29,787 - optuna.study.study - INFO - Trial 241 finished with values: [0.008189861244189509, 0.0014786656842387302, 0.00468049223929664] and parameters: {'n_layers': 3, 'embedding_dim': 256, 'lr': 0.00040769039157989535, 'lambda_val': 2.344534953461632e-06, 'batch_size': 2129, 'optimizer': 'Adam'}.
2026-06-04 21:17:59,347 - experiment_functions - INFO - Early stopping at epoch 650. Best Metrics: (0.008346404672909652, 0.0015305780695291046, 0.00462586652633736)
2026-06-04 21:17:59,450 - optuna.study.study - INFO - Trial 242 finished with values: [0.008346404672909652, 0.0015305780695291046, 0.00462586652633736] and parameters: {'n_layers': 4, 'embedding_dim': 128, 'lr': 0.00271379640296128, 'lambda_val': 0.00014360463461151902, 'batch_size': 1451, 'optimizer': 'RMSprop'}.
2026-06-04 21:18:58,042 - experiment_functions - INFO - Early stopping at epoch 1450. Best Metrics: (0.007318871382614228, 0.001220778350860741, 0.004252730872906479)
2026-06-04 21:18:58,596 - optuna.study.study - INFO - Trial 243 finished with values: [0.007318871382614228, 0.001220778350860741, 0.004252730872906479] and parameters: {'n_layers': 2, 'embedding_dim': 128, 'lr': 0.0013813482214859749, 'lambda_val': 4.633766555970088e-05, 'batch_size': 1336, 'optimizer': 'Adam'}.
2026-06-04 21:20:26,810 - experiment_functions - INFO - Early stopping at epoch 2250. Best Metrics: (0.012174585836435112, 0.002089892156206042, 0.006830335841854658)
2026-06-04 21:20:26,898 - optuna.study.study - INFO - Trial 244 finished with values: [0.012174585836435112, 0.002089892156206042, 0.006830335841854658] and parameters: {'n_layers': 4, 'embedding_dim': 64, 'lr': 0.0007307808528773397, 'lambda_val': 3.61928423516103e-05, 'batch_size': 2067, 'optimizer': 'RMSprop'}.
2026-06-04 21:21:01,165 - experiment_functions - INFO - Early stopping at epoch 800. Best Metrics: (0.008503307162637414, 0.0015289034764552215, 0.0047607649743124595)
2026-06-04 21:21:01,268 - optuna.study.study - INFO - Trial 245 finished with values: [0.008503307162637414, 0.0015289034764552215, 0.0047607649743124595] and parameters: {'n_layers': 4, 'embedding_dim': 96, 'lr': 0.0038915436873682946, 'lambda_val': 2.344534953461632e-06, 'batch_size': 791, 'optimizer': 'RMSprop'}.
2026-06-04 21:21:28,211 - experiment_functions - INFO - Early stopping at epoch 650. Best Metrics: (0.00616156218180944, 0.0011052314287628106, 0.003539009553703778)
