2026-06-07 03:42:10,593 - optuna.study.study - INFO - Trial 209 finished with values: [0.004785125797509236, 0.0013212539352937236, 0.0031259955598947854] and parameters: {'n_layers': 2, 'embedding_dim': 64, 'lr': 0.008728644909107356, 'lambda_val': 0.0007605677300524109, 'batch_size': 3629, 'optimizer': 'Adam'}.
2026-06-07 03:42:30,953 - experiment_functions - INFO - Early stopping at epoch 500. Best Metrics: (0.000339271189058159, 6.363453680755577e-05, 0.00015934048469159724)
2026-06-07 03:42:31,051 - optuna.study.study - INFO - Trial 210 finished with values: [0.000339271189058159, 6.363453680755577e-05, 0.00015934048469159724] and parameters: {'n_layers': 2, 'embedding_dim': 64, 'lr': 0.00031084764364588095, 'lambda_val': 0.01620438973926288, 'batch_size': 3991, 'optimizer': 'SGD'}.
2026-06-07 03:45:00,363 - optuna.study.study - INFO - Trial 211 finished with values: [0.006286461478967777, 0.002088217563132159, 0.0043118117341673] and parameters: {'n_layers': 1, 'embedding_dim': 96, 'lr': 0.00019178783016765463, 'lambda_val': 0.006044657657370833, 'batch_size': 4046, 'optimizer': 'Adam'}.
2026-06-07 03:45:25,091 - experiment_functions - INFO - Early stopping at epoch 550. Best Metrics: (0.007845529851751305, 0.0028250385156406996, 0.006175121911627831)
2026-06-07 03:45:25,199 - optuna.study.study - INFO - Trial 212 finished with values: [0.007845529851751305, 0.0028250385156406996, 0.006175121911627831] and parameters: {'n_layers': 1, 'embedding_dim': 256, 'lr': 0.005424684195660662, 'lambda_val': 0.003413922431571512, 'batch_size': 2118, 'optimizer': 'Adam'}.
2026-06-07 03:46:02,502 - experiment_functions - INFO - Early stopping at epoch 850. Best Metrics: (0.008013738947667942, 0.0027865228749413893, 0.006099069522834105)
2026-06-07 03:46:02,601 - optuna.study.study - INFO - Trial 213 finished with values: [0.008013738947667942, 0.0027865228749413893, 0.006099069522834105] and parameters: {'n_layers': 1, 'embedding_dim': 256, 'lr': 0.000762190113410319, 'lambda_val': 0.003413922431571512, 'batch_size': 4046, 'optimizer': 'Adam'}.
2026-06-07 03:46:33,560 - experiment_functions - INFO - Early stopping at epoch 700. Best Metrics: (0.00620937609331641, 0.0020714716323933283, 0.0043769489877258415)
2026-06-07 03:46:34,623 - optuna.study.study - INFO - Trial 214 finished with values: [0.00620937609331641, 0.0020714716323933283, 0.0043769489877258415] and parameters: {'n_layers': 1, 'embedding_dim': 256, 'lr': 0.003111912344058094, 'lambda_val': 3.882538286126529e-05, 'batch_size': 4046, 'optimizer': 'RMSprop'}.
2026-06-07 03:47:27,441 - experiment_functions - INFO - Early stopping at epoch 1400. Best Metrics: (0.008326029750731746, 0.002570500368410476, 0.005752948355370913)
2026-06-07 03:47:27,527 - optuna.study.study - INFO - Trial 215 finished with values: [0.008326029750731746, 0.002570500368410476, 0.005752948355370913] and parameters: {'n_layers': 1, 'embedding_dim': 64, 'lr': 0.000762190113410319, 'lambda_val': 0.0007605677300524109, 'batch_size': 3302, 'optimizer': 'Adam'}.
2026-06-07 03:47:58,644 - experiment_functions - INFO - Early stopping at epoch 700. Best Metrics: (0.009251206933467702, 0.003099671779757519, 0.006892542747118866)
2026-06-07 03:47:58,737 - optuna.study.study - INFO - Trial 216 finished with values: [0.009251206933467702, 0.003099671779757519, 0.006892542747118866] and parameters: {'n_layers': 1, 'embedding_dim': 256, 'lr': 0.0020485036238635386, 'lambda_val': 6.538231837458372e-06, 'batch_size': 1861, 'optimizer': 'Adam'}.
2026-06-07 03:48:22,247 - experiment_functions - INFO - Early stopping at epoch 600. Best Metrics: (0.0049329494887980765, 0.0013899122513229285, 0.003125894367556179)
2026-06-07 03:48:22,334 - optuna.study.study - INFO - Trial 217 finished with values: [0.0049329494887980765, 0.0013899122513229285, 0.003125894367556179] and parameters: {'n_layers': 2, 'embedding_dim': 32, 'lr': 0.0028344398259960786, 'lambda_val': 3.491863285065632e-06, 'batch_size': 1861, 'optimizer': 'Adam'}.
2026-06-07 03:49:46,825 - experiment_functions - INFO - Early stopping at epoch 2200. Best Metrics: (0.005450863226513424, 0.0016360774331837364, 0.0036503427080035126)
2026-06-07 03:49:46,909 - optuna.study.study - INFO - Trial 218 finished with values: [0.005450863226513424, 0.0016360774331837364, 0.0036503427080035126] and parameters: {'n_layers': 2, 'embedding_dim': 96, 'lr': 0.00031084764364588095, 'lambda_val': 0.002165335135008093, 'batch_size': 1798, 'optimizer': 'RMSprop'}.
2026-06-07 03:50:10,424 - experiment_functions - INFO - Early stopping at epoch 600. Best Metrics: (0.008826020429436325, 0.0026173889744792018, 0.005861082807766848)
2026-06-07 03:50:10,496 - optuna.study.study - INFO - Trial 219 finished with values: [0.008826020429436325, 0.0026173889744792018, 0.005861082807766848] and parameters: {'n_layers': 1, 'embedding_dim': 32, 'lr': 0.005424684195660662, 'lambda_val': 0.0001291352601118963, 'batch_size': 2883, 'optimizer': 'Adam'}.
2026-06-07 03:50:35,365 - experiment_functions - INFO - Early stopping at epoch 550. Best Metrics: (0.009556862025681295, 0.003131489048161297, 0.007179477715209132)
2026-06-07 03:50:36,023 - optuna.study.study - INFO - Trial 220 finished with values: [0.009556862025681295, 0.003131489048161297, 0.007179477715209132] and parameters: {'n_layers': 1, 'embedding_dim': 256, 'lr': 0.005424684195660662, 'lambda_val': 2.708281900215428e-05, 'batch_size': 4046, 'optimizer': 'Adam'}.
2026-06-07 03:51:00,682 - experiment_functions - INFO - Early stopping at epoch 550. Best Metrics: (0.002993890041505592, 0.000969589389778284, 0.002055666037778257)
2026-06-07 03:51:01,279 - optuna.study.study - INFO - Trial 221 finished with values: [0.002993890041505592, 0.000969589389778284, 0.002055666037778257] and parameters: {'n_layers': 1, 'embedding_dim': 256, 'lr': 0.08452292105585447, 'lambda_val': 1.1883014168137366e-05, 'batch_size': 2652, 'optimizer': 'Adam'}.
2026-06-07 03:52:07,933 - experiment_functions - INFO - Early stopping at epoch 1600. Best Metrics: (0.003909545509047455, 0.0010265255542903076, 0.002344326325221278)
2026-06-07 03:52:08,125 - optuna.study.study - INFO - Trial 222 finished with values: [0.003909545509047455, 0.0010265255542903076, 0.002344326325221278] and parameters: {'n_layers': 3, 'embedding_dim': 128, 'lr': 0.00031084764364588095, 'lambda_val': 0.0023853234246901897, 'batch_size': 2349, 'optimizer': 'Adam'}.
2026-06-07 03:52:44,551 - experiment_functions - INFO - Early stopping at epoch 900. Best Metrics: (0.007121011247103729, 0.002481746935494675, 0.005264614402136286)
2026-06-07 03:52:45,128 - optuna.study.study - INFO - Trial 223 finished with values: [0.007121011247103729, 0.002481746935494675, 0.005264614402136286] and parameters: {'n_layers': 1, 'embedding_dim': 128, 'lr': 0.000762190113410319, 'lambda_val': 0.003413922431571512, 'batch_size': 4046, 'optimizer': 'Adam'}.
2026-06-07 03:53:08,720 - experiment_functions - INFO - Early stopping at epoch 600. Best Metrics: (0.006689006386026682, 0.0019910911648469425, 0.004183717996181662)
2026-06-07 03:53:08,803 - optuna.study.study - INFO - Trial 224 finished with values: [0.006689006386026682, 0.0019910911648469425, 0.004183717996181662] and parameters: {'n_layers': 1, 'embedding_dim': 32, 'lr': 0.0020485036238635386, 'lambda_val': 0.0036211663329917747, 'batch_size': 1861, 'optimizer': 'RMSprop'}.
2026-06-07 03:53:58,251 - experiment_functions - INFO - Early stopping at epoch 1250. Best Metrics: (0.008951037262836812, 0.002935561658516981, 0.0067179182594126734)
2026-06-07 03:53:58,483 - optuna.study.study - INFO - Trial 225 finished with values: [0.008951037262836812, 0.002935561658516981, 0.0067179182594126734] and parameters: {'n_layers': 1, 'embedding_dim': 128, 'lr': 0.001386254691386787, 'lambda_val': 2.521172778271889e-05, 'batch_size': 1662, 'optimizer': 'Adam'}.
2026-06-07 03:54:40,539 - experiment_functions - INFO - Early stopping at epoch 1050. Best Metrics: (0.0080889061308807, 0.0026910710697300552, 0.005744406457334598)
2026-06-07 03:54:40,634 - optuna.study.study - INFO - Trial 226 finished with values: [0.0080889061308807, 0.0026910710697300552, 0.005744406457334598] and parameters: {'n_layers': 1, 'embedding_dim': 128, 'lr': 0.000762190113410319, 'lambda_val': 0.003413922431571512, 'batch_size': 1861, 'optimizer': 'Adam'}.
2026-06-07 03:56:54,802 - experiment_functions - INFO - Early stopping at epoch 3750. Best Metrics: (0.0007638566442916678, 0.00013229285283676068, 0.000388421465174136)
2026-06-07 03:56:54,911 - optuna.study.study - INFO - Trial 227 finished with values: [0.0007638566442916678, 0.00013229285283676068, 0.000388421465174136] and parameters: {'n_layers': 2, 'embedding_dim': 32, 'lr': 5.823676321200489e-05, 'lambda_val': 1.058365552996417e-06, 'batch_size': 3163, 'optimizer': 'Adam'}.
2026-06-07 03:57:17,944 - experiment_functions - INFO - Early stopping at epoch 550. Best Metrics: (0.008743728446557294, 0.0028903476455221385, 0.006412793271633662)
2026-06-07 03:57:18,044 - optuna.study.study - INFO - Trial 228 finished with values: [0.008743728446557294, 0.0028903476455221385, 0.006412793271633662] and parameters: {'n_layers': 1, 'embedding_dim': 128, 'lr': 0.005424684195660662, 'lambda_val': 0.0023853234246901897, 'batch_size': 4046, 'optimizer': 'Adam'}.
2026-06-07 03:57:43,209 - experiment_functions - INFO - Early stopping at epoch 550. Best Metrics: (0.009710084154953152, 0.0030846004420925716, 0.007232861675186713)
2026-06-07 03:57:43,699 - optuna.study.study - INFO - Trial 229 finished with values: [0.009710084154953152, 0.0030846004420925716, 0.007232861675186713] and parameters: {'n_layers': 1, 'embedding_dim': 256, 'lr': 0.005424684195660662, 'lambda_val': 6.538231837458372e-06, 'batch_size': 4046, 'optimizer': 'Adam'}.
2026-06-07 03:58:19,030 - experiment_functions - INFO - Early stopping at epoch 900. Best Metrics: (0.0053820152122407575, 0.00151718132493804, 0.003589242800564559)
2026-06-07 03:58:19,216 - optuna.study.study - INFO - Trial 230 finished with values: [0.0053820152122407575, 0.00151718132493804, 0.003589242800564559] and parameters: {'n_layers': 2, 'embedding_dim': 64, 'lr': 0.000762190113410319, 'lambda_val': 0.0007605677300524109, 'batch_size': 3302, 'optimizer': 'Adam'}.
2026-06-07 03:59:34,645 - experiment_functions - INFO - Early stopping at epoch 2000. Best Metrics: (0.006006957653495106, 0.001838703195123585, 0.004022319615479788)
2026-06-07 03:59:34,725 - optuna.study.study - INFO - Trial 231 finished with values: [0.006006957653495106, 0.001838703195123585, 0.004022319615479788] and parameters: {'n_layers': 2, 'embedding_dim': 64, 'lr': 0.000762190113410319, 'lambda_val': 0.00029907993070612653, 'batch_size': 855, 'optimizer': 'Adam'}.
2026-06-07 04:00:07,033 - experiment_functions - INFO - Early stopping at epoch 650. Best Metrics: (0.003646385773803829, 0.0010600174157679684, 0.0023768405170560276)
2026-06-07 04:00:07,108 - optuna.study.study - INFO - Trial 232 finished with values: [0.003646385773803829, 0.0010600174157679684, 0.0023768405170560276] and parameters: {'n_layers': 3, 'embedding_dim': 256, 'lr': 0.000762190113410319, 'lambda_val': 0.003413922431571512, 'batch_size': 3294, 'optimizer': 'Adam'}.
2026-06-07 04:00:38,991 - experiment_functions - INFO - Early stopping at epoch 800. Best Metrics: (0.005681076191181624, 0.0017265054591734212, 0.003664668294085864)
2026-06-07 04:00:39,119 - optuna.study.study - INFO - Trial 233 finished with values: [0.005681076191181624, 0.0017265054591734212, 0.003664668294085864] and parameters: {'n_layers': 2, 'embedding_dim': 64, 'lr': 0.0011947544456977542, 'lambda_val': 6.1376684894157035e-06, 'batch_size': 2268, 'optimizer': 'Adam'}.
2026-06-07 04:01:16,315 - experiment_functions - INFO - Early stopping at epoch 950. Best Metrics: (0.005283652862960997, 0.0014066581820617592, 0.0032924125746317933)
2026-06-07 04:01:16,416 - optuna.study.study - INFO - Trial 234 finished with values: [0.005283652862960997, 0.0014066581820617592, 0.0032924125746317933] and parameters: {'n_layers': 2, 'embedding_dim': 64, 'lr': 0.000762190113410319, 'lambda_val': 0.0007605677300524109, 'batch_size': 2674, 'optimizer': 'Adam'}.
2026-06-07 04:02:30,866 - experiment_functions - INFO - Early stopping at epoch 2000. Best Metrics: (0.00819347742531803, 0.0026676267666956932, 0.006048325080365355)
2026-06-07 04:02:30,947 - optuna.study.study - INFO - Trial 235 finished with values: [0.00819347742531803, 0.0026676267666956932, 0.006048325080365355] and parameters: {'n_layers': 1, 'embedding_dim': 64, 'lr': 0.000762190113410319, 'lambda_val': 0.003413922431571512, 'batch_size': 676, 'optimizer': 'Adam'}.
2026-06-07 04:02:58,750 - experiment_functions - INFO - Early stopping at epoch 700. Best Metrics: (0.00240854843761337, 0.00046721146761336994, 0.0013411354982349954)
2026-06-07 04:02:58,840 - optuna.study.study - INFO - Trial 236 finished with values: [0.00240854843761337, 0.00046721146761336994, 0.0013411354982349954] and parameters: {'n_layers': 4, 'embedding_dim': 32, 'lr': 0.0020485036238635386, 'lambda_val': 0.0007605677300524109, 'batch_size': 3193, 'optimizer': 'Adam'}.
2026-06-07 04:03:44,126 - experiment_functions - INFO - Early stopping at epoch 1200. Best Metrics: (0.004232018571835839, 0.0015473240002679346, 0.0029683249593207314)
2026-06-07 04:03:44,263 - optuna.study.study - INFO - Trial 237 finished with values: [0.004232018571835839, 0.0015473240002679346, 0.0029683249593207314] and parameters: {'n_layers': 1, 'embedding_dim': 64, 'lr': 0.000762190113410319, 'lambda_val': 0.03475024239785584, 'batch_size': 1028, 'optimizer': 'Adam'}.
2026-06-07 04:04:11,615 - experiment_functions - INFO - Early stopping at epoch 700. Best Metrics: (0.0071633980103689675, 0.0022288833813383347, 0.004943356487935376)
2026-06-07 04:04:11,697 - optuna.study.study - INFO - Trial 238 finished with values: [0.0071633980103689675, 0.0022288833813383347, 0.004943356487935376] and parameters: {'n_layers': 1, 'embedding_dim': 32, 'lr': 0.0020485036238635386, 'lambda_val': 0.00426234068174577, 'batch_size': 2883, 'optimizer': 'Adam'}.
2026-06-07 04:04:35,827 - experiment_functions - INFO - Early stopping at epoch 600. Best Metrics: (0.008254547720797385, 0.00268772188358229, 0.00589177247032612)
2026-06-07 04:04:35,925 - optuna.study.study - INFO - Trial 239 finished with values: [0.008254547720797385, 0.00268772188358229, 0.00589177247032612] and parameters: {'n_layers': 1, 'embedding_dim': 64, 'lr': 0.005424684195660662, 'lambda_val': 0.00029907993070612653, 'batch_size': 4046, 'optimizer': 'Adam'}.
2026-06-07 04:05:00,557 - experiment_functions - INFO - Early stopping at epoch 600. Best Metrics: (0.008624009769249227, 0.0027932212472369217, 0.006306720753612908)
2026-06-07 04:05:00,645 - optuna.study.study - INFO - Trial 240 finished with values: [0.008624009769249227, 0.0027932212472369217, 0.006306720753612908] and parameters: {'n_layers': 1, 'embedding_dim': 96, 'lr': 0.005424684195660662, 'lambda_val': 0.0007605677300524109, 'batch_size': 1666, 'optimizer': 'Adam'}.
2026-06-07 04:05:21,130 - experiment_functions - INFO - Early stopping at epoch 500. Best Metrics: (0.0004782418525919438, 7.368209525085404e-05, 0.000214969171430733)
2026-06-07 04:05:21,478 - optuna.study.study - INFO - Trial 241 finished with values: [0.0004782418525919438, 7.368209525085404e-05, 0.000214969171430733] and parameters: {'n_layers': 2, 'embedding_dim': 64, 'lr': 4.784115159669517e-05, 'lambda_val': 0.0007605677300524109, 'batch_size': 3991, 'optimizer': 'SGD'}.
2026-06-07 04:05:49,234 - experiment_functions - INFO - Early stopping at epoch 700. Best Metrics: (0.007662695009862604, 0.002553754437671646, 0.00578065547263275)
2026-06-07 04:05:49,322 - optuna.study.study - INFO - Trial 242 finished with values: [0.007662695009862604, 0.002553754437671646, 0.00578065547263275] and parameters: {'n_layers': 1, 'embedding_dim': 64, 'lr': 0.001854982680164212, 'lambda_val': 2.592531345957409e-05, 'batch_size': 3480, 'optimizer': 'Adam'}.
2026-06-07 04:06:09,686 - experiment_functions - INFO - Early stopping at epoch 500. Best Metrics: (0.0003863080027171752, 6.698372295532186e-05, 0.00018762378480078796)
2026-06-07 04:06:10,730 - optuna.study.study - INFO - Trial 243 finished with values: [0.0003863080027171752, 6.698372295532186e-05, 0.00018762378480078796] and parameters: {'n_layers': 1, 'embedding_dim': 96, 'lr': 0.003111912344058094, 'lambda_val': 0.003413922431571512, 'batch_size': 4046, 'optimizer': 'SGD'}.
2026-06-07 04:06:37,342 - experiment_functions - INFO - Early stopping at epoch 600. Best Metrics: (0.0020374348836712814, 0.0006329961819277917, 0.0013299588278278974)
2026-06-07 04:06:37,667 - optuna.study.study - INFO - Trial 244 finished with values: [0.0020374348836712814, 0.0006329961819277917, 0.0013299588278278974] and parameters: {'n_layers': 1, 'embedding_dim': 256, 'lr': 0.003111912344058094, 'lambda_val': 0.08390561471775379, 'batch_size': 1881, 'optimizer': 'Adam'}.
2026-06-07 04:07:02,585 - experiment_functions - INFO - Early stopping at epoch 550. Best Metrics: (0.008588615155065859, 0.0030109183468417177, 0.006784069074828997)
2026-06-07 04:07:03,223 - optuna.study.study - INFO - Trial 245 finished with values: [0.008588615155065859, 0.0030109183468417177, 0.006784069074828997] and parameters: {'n_layers': 1, 'embedding_dim': 256, 'lr': 0.005424684195660662, 'lambda_val': 3.491863285065632e-06, 'batch_size': 4046, 'optimizer': 'Adam'}.
2026-06-07 04:09:32,304 - optuna.study.study - INFO - Trial 246 finished with values: [0.005706641590753298, 0.0016846406323263445, 0.0038155279674785304] and parameters: {'n_layers': 2, 'embedding_dim': 64, 'lr': 0.00031084764364588095, 'lambda_val': 0.00029907993070612653, 'batch_size': 1982, 'optimizer': 'Adam'}.
2026-06-07 04:09:58,215 - experiment_functions - INFO - Early stopping at epoch 600. Best Metrics: (0.005648957595722497, 0.0018068859267198073, 0.003774290877955543)
2026-06-07 04:09:58,450 - optuna.study.study - INFO - Trial 247 finished with values: [0.005648957595722497, 0.0018068859267198073, 0.003774290877955543] and parameters: {'n_layers': 2, 'embedding_dim': 128, 'lr': 0.0020485036238635386, 'lambda_val': 6.538231837458372e-06, 'batch_size': 1861, 'optimizer': 'Adam'}.
2026-06-07 04:12:31,384 - optuna.study.study - INFO - Trial 248 finished with values: [0.0013939685731042058, 0.0004454417576528904, 0.0009126299779314629] and parameters: {'n_layers': 2, 'embedding_dim': 96, 'lr': 7.76503102684732e-05, 'lambda_val': 0.0007605677300524109, 'batch_size': 2896, 'optimizer': 'Adam'}.
2026-06-07 04:12:57,592 - experiment_functions - INFO - Early stopping at epoch 600. Best Metrics: (0.0030992883154262844, 0.0007736620001339675, 0.001946265165711328)
2026-06-07 04:12:57,674 - optuna.study.study - INFO - Trial 249 finished with values: [0.0030992883154262844, 0.0007736620001339675, 0.001946265165711328] and parameters: {'n_layers': 4, 'embedding_dim': 96, 'lr': 0.0020485036238635386, 'lambda_val': 0.0007605677300524109, 'batch_size': 2179, 'optimizer': 'Adam'}.
2026-06-07 04:13:28,997 - experiment_functions - INFO - Early stopping at epoch 700. Best Metrics: (0.008867661584632074, 0.0030243150914327824, 0.00673919904538792)
2026-06-07 04:13:29,155 - optuna.study.study - INFO - Trial 250 finished with values: [0.008867661584632074, 0.0030243150914327824, 0.00673919904538792] and parameters: {'n_layers': 1, 'embedding_dim': 256, 'lr': 0.0020485036238635386, 'lambda_val': 6.538231837458372e-06, 'batch_size': 4046, 'optimizer': 'Adam'}.
2026-06-07 04:13:55,091 - experiment_functions - INFO - Early stopping at epoch 650. Best Metrics: (0.003116242230987621, 0.0008205506062026927, 0.001808332390104095)
2026-06-07 04:13:55,395 - optuna.study.study - INFO - Trial 251 finished with values: [0.003116242230987621, 0.0008205506062026927, 0.001808332390104095] and parameters: {'n_layers': 3, 'embedding_dim': 32, 'lr': 0.0020485036238635386, 'lambda_val': 0.0036211663329917747, 'batch_size': 1861, 'optimizer': 'Adam'}.
2026-06-07 04:14:22,581 - experiment_functions - INFO - Early stopping at epoch 700. Best Metrics: (0.007669505734284718, 0.0023142876281063702, 0.00516111455023716)
2026-06-07 04:14:22,668 - optuna.study.study - INFO - Trial 252 finished with values: [0.007669505734284718, 0.0023142876281063702, 0.00516111455023716] and parameters: {'n_layers': 1, 'embedding_dim': 32, 'lr': 0.0020485036238635386, 'lambda_val': 0.00426234068174577, 'batch_size': 1861, 'optimizer': 'Adam'}.
2026-06-07 04:14:42,469 - experiment_functions - INFO - Early stopping at epoch 500. Best Metrics: (0.00047539438494505215, 5.3586978364257486e-05, 0.00019177709654946487)
2026-06-07 04:14:43,563 - optuna.study.study - INFO - Trial 253 finished with values: [0.00047539438494505215, 5.3586978364257486e-05, 0.00019177709654946487] and parameters: {'n_layers': 1, 'embedding_dim': 32, 'lr': 0.005424684195660662, 'lambda_val': 0.0036211663329917747, 'batch_size': 4046, 'optimizer': 'SGD'}.
2026-06-07 04:15:08,826 - experiment_functions - INFO - Early stopping at epoch 550. Best Metrics: (0.009111138165953662, 0.003099671779757519, 0.00691689858631049)
2026-06-07 04:15:08,901 - optuna.study.study - INFO - Trial 254 finished with values: [0.009111138165953662, 0.003099671779757519, 0.00691689858631049] and parameters: {'n_layers': 1, 'embedding_dim': 256, 'lr': 0.005424684195660662, 'lambda_val': 0.0023853234246901897, 'batch_size': 4046, 'optimizer': 'Adam'}.
2026-06-07 04:17:32,447 - optuna.study.study - INFO - Trial 255 finished with values: [0.0047392525294305925, 0.0014820148703864958, 0.003312466194494133] and parameters: {'n_layers': 1, 'embedding_dim': 32, 'lr': 0.00021709888289061374, 'lambda_val': 0.0001291352601118963, 'batch_size': 2883, 'optimizer': 'Adam'}.
2026-06-07 04:17:56,599 - experiment_functions - INFO - Early stopping at epoch 600. Best Metrics: (0.009163520315766775, 0.00280326880568022, 0.0064815650699362555)
