2026-06-07 02:52:28,118 - optuna.study.study - INFO - Trial 162 finished with values: [0.0005109955824133365, 7.033290910308795e-05, 0.00022043923036773325] and parameters: {'n_layers': 3, 'embedding_dim': 128, 'lr': 0.0011078514946922563, 'lambda_val': 9.366054006731289e-05, 'batch_size': 2883, 'optimizer': 'SGD'}.
2026-06-07 02:53:12,840 - experiment_functions - INFO - Early stopping at epoch 1100. Best Metrics: (0.0027359820099277315, 0.0007602652555429031, 0.0016469234019713516)
2026-06-07 02:53:13,538 - optuna.study.study - INFO - Trial 163 finished with values: [0.0027359820099277315, 0.0007602652555429031, 0.0016469234019713516] and parameters: {'n_layers': 3, 'embedding_dim': 96, 'lr': 0.00041076267416475083, 'lambda_val': 0.011996840212523105, 'batch_size': 1392, 'optimizer': 'Adam'}.
2026-06-07 02:53:45,515 - experiment_functions - INFO - Early stopping at epoch 800. Best Metrics: (0.005030559688256843, 0.0013597695759930337, 0.003208974709571695)
2026-06-07 02:53:45,610 - optuna.study.study - INFO - Trial 164 finished with values: [0.005030559688256843, 0.0013597695759930337, 0.003208974709571695] and parameters: {'n_layers': 2, 'embedding_dim': 64, 'lr': 0.000762190113410319, 'lambda_val': 0.0006098824234122334, 'batch_size': 4049, 'optimizer': 'Adam'}.
2026-06-07 02:54:14,628 - experiment_functions - INFO - Early stopping at epoch 750. Best Metrics: (0.008222358690278821, 0.0024449058878692476, 0.005549899839659384)
2026-06-07 02:54:14,714 - optuna.study.study - INFO - Trial 165 finished with values: [0.008222358690278821, 0.0024449058878692476, 0.005549899839659384] and parameters: {'n_layers': 1, 'embedding_dim': 32, 'lr': 0.0020485036238635386, 'lambda_val': 0.0007605677300524109, 'batch_size': 2179, 'optimizer': 'Adam'}.
2026-06-07 02:56:26,883 - experiment_functions - INFO - Early stopping at epoch 3200. Best Metrics: (0.0065997897241287335, 0.0021552012860874803, 0.004795557684803598)
2026-06-07 02:56:26,961 - optuna.study.study - INFO - Trial 166 finished with values: [0.0065997897241287335, 0.0021552012860874803, 0.004795557684803598] and parameters: {'n_layers': 1, 'embedding_dim': 256, 'lr': 0.005424684195660662, 'lambda_val': 6.538231837458372e-06, 'batch_size': 4046, 'optimizer': 'RMSprop'}.
2026-06-07 02:56:50,583 - experiment_functions - INFO - Early stopping at epoch 550. Best Metrics: (0.0020724960798034243, 0.0006279724027061424, 0.0013968675383608188)
2026-06-07 02:56:51,199 - optuna.study.study - INFO - Trial 167 finished with values: [0.0020724960798034243, 0.0006279724027061424, 0.0013968675383608188] and parameters: {'n_layers': 3, 'embedding_dim': 96, 'lr': 0.021653186861251617, 'lambda_val': 0.003413922431571512, 'batch_size': 4046, 'optimizer': 'Adam'}.
2026-06-07 02:57:13,522 - experiment_functions - INFO - Early stopping at epoch 500. Best Metrics: (0.0007225072754621643, 0.0001724830866099538, 0.00042932712444455185)
2026-06-07 02:57:14,487 - optuna.study.study - INFO - Trial 168 finished with values: [0.0007225072754621643, 0.0001724830866099538, 0.00042932712444455185] and parameters: {'n_layers': 3, 'embedding_dim': 128, 'lr': 0.007908602894321078, 'lambda_val': 0.052504934258477666, 'batch_size': 1392, 'optimizer': 'RMSprop'}.
2026-06-07 02:58:16,844 - experiment_functions - INFO - Early stopping at epoch 1650. Best Metrics: (0.008486242376579689, 0.002664277580547927, 0.005960841582595024)
2026-06-07 02:58:16,921 - optuna.study.study - INFO - Trial 169 finished with values: [0.008486242376579689, 0.002664277580547927, 0.005960841582595024] and parameters: {'n_layers': 1, 'embedding_dim': 64, 'lr': 0.000762190113410319, 'lambda_val': 0.0007605677300524109, 'batch_size': 2652, 'optimizer': 'Adam'}.
2026-06-07 02:58:40,088 - experiment_functions - INFO - Early stopping at epoch 550. Best Metrics: (0.008821007347806215, 0.0027597293857592607, 0.006342627068874061)
2026-06-07 02:58:40,181 - optuna.study.study - INFO - Trial 170 finished with values: [0.008821007347806215, 0.0027597293857592607, 0.006342627068874061] and parameters: {'n_layers': 1, 'embedding_dim': 128, 'lr': 0.005424684195660662, 'lambda_val': 0.0023853234246901897, 'batch_size': 4046, 'optimizer': 'Adam'}.
2026-06-07 03:01:17,101 - optuna.study.study - INFO - Trial 171 finished with values: [0.004640138200116785, 0.0013899122513229285, 0.0030847412065889697] and parameters: {'n_layers': 3, 'embedding_dim': 96, 'lr': 0.00023240333325049055, 'lambda_val': 1.4748392203086364e-06, 'batch_size': 1348, 'optimizer': 'Adam'}.
2026-06-07 03:02:44,020 - experiment_functions - INFO - Early stopping at epoch 2400. Best Metrics: (0.0005333273592329098, 7.870587447250318e-05, 0.00021206173078056674)
2026-06-07 03:02:44,108 - optuna.study.study - INFO - Trial 172 finished with values: [0.0005333273592329098, 7.870587447250318e-05, 0.00021206173078056674] and parameters: {'n_layers': 2, 'embedding_dim': 32, 'lr': 2.254901849924764e-05, 'lambda_val': 0.00029907993070612653, 'batch_size': 1984, 'optimizer': 'Adam'}.
2026-06-07 03:05:17,960 - optuna.study.study - INFO - Trial 173 finished with values: [0.005738256595091305, 0.0017315292383950703, 0.0036992508198043115] and parameters: {'n_layers': 2, 'embedding_dim': 96, 'lr': 0.00031084764364588095, 'lambda_val': 0.0006098824234122334, 'batch_size': 2652, 'optimizer': 'Adam'}.
2026-06-07 03:06:00,979 - experiment_functions - INFO - Early stopping at epoch 1100. Best Metrics: (0.0036793001458797973, 0.0009679147967044009, 0.0023618963046480933)
2026-06-07 03:06:01,056 - optuna.study.study - INFO - Trial 174 finished with values: [0.0036793001458797973, 0.0009679147967044009, 0.0023618963046480933] and parameters: {'n_layers': 3, 'embedding_dim': 64, 'lr': 0.0011078514946922563, 'lambda_val': 1.058365552996417e-06, 'batch_size': 1114, 'optimizer': 'Adam'}.
2026-06-07 03:06:30,292 - experiment_functions - INFO - Early stopping at epoch 750. Best Metrics: (0.0030791236422911955, 0.0006949561256614642, 0.001725221269179581)
2026-06-07 03:06:30,657 - optuna.study.study - INFO - Trial 175 finished with values: [0.0030791236422911955, 0.0006949561256614642, 0.001725221269179581] and parameters: {'n_layers': 3, 'embedding_dim': 32, 'lr': 0.0013711723145044142, 'lambda_val': 0.00028607926724212617, 'batch_size': 4054, 'optimizer': 'Adam'}.
2026-06-07 03:08:59,389 - optuna.study.study - INFO - Trial 176 finished with values: [0.006270234059117967, 0.0018068859267198077, 0.004101547137288794] and parameters: {'n_layers': 2, 'embedding_dim': 64, 'lr': 0.00031084764364588095, 'lambda_val': 0.00011914359581119532, 'batch_size': 2652, 'optimizer': 'RMSprop'}.
2026-06-07 03:09:29,127 - experiment_functions - INFO - Early stopping at epoch 700. Best Metrics: (0.006010781998836734, 0.0018202826713108716, 0.003905879306137521)
2026-06-07 03:09:29,245 - optuna.study.study - INFO - Trial 177 finished with values: [0.006010781998836734, 0.0018202826713108716, 0.003905879306137521] and parameters: {'n_layers': 2, 'embedding_dim': 128, 'lr': 0.0017152190282418974, 'lambda_val': 1.058365552996417e-06, 'batch_size': 1114, 'optimizer': 'Adam'}.
2026-06-07 03:09:59,117 - experiment_functions - INFO - Early stopping at epoch 750. Best Metrics: (0.005274832017559121, 0.0015942126063366602, 0.003703748166596208)
2026-06-07 03:09:59,217 - optuna.study.study - INFO - Trial 178 finished with values: [0.005274832017559121, 0.0015942126063366602, 0.003703748166596208] and parameters: {'n_layers': 2, 'embedding_dim': 64, 'lr': 0.000762190113410319, 'lambda_val': 0.0006098824234122334, 'batch_size': 2652, 'optimizer': 'Adam'}.
2026-06-07 03:10:33,102 - experiment_functions - INFO - Early stopping at epoch 850. Best Metrics: (0.004357376393802321, 0.0013446982383280865, 0.0030612006233748782)
2026-06-07 03:10:34,515 - optuna.study.study - INFO - Trial 179 finished with values: [0.004357376393802321, 0.0013446982383280865, 0.0030612006233748782] and parameters: {'n_layers': 3, 'embedding_dim': 64, 'lr': 0.000762190113410319, 'lambda_val': 3.6010482788593593e-06, 'batch_size': 1114, 'optimizer': 'Adam'}.
2026-06-07 03:11:10,771 - experiment_functions - INFO - Early stopping at epoch 950. Best Metrics: (0.005350257364271479, 0.001624355281666555, 0.0035030449147963882)
2026-06-07 03:11:11,023 - optuna.study.study - INFO - Trial 180 finished with values: [0.005350257364271479, 0.001624355281666555, 0.0035030449147963882] and parameters: {'n_layers': 2, 'embedding_dim': 32, 'lr': 0.000762190113410319, 'lambda_val': 0.0007605677300524109, 'batch_size': 2179, 'optimizer': 'Adam'}.
2026-06-07 03:12:08,787 - experiment_functions - INFO - Early stopping at epoch 1350. Best Metrics: (0.009632248431228424, 0.0032001473641905015, 0.00714171665646631)
2026-06-07 03:12:08,874 - optuna.study.study - INFO - Trial 181 finished with values: [0.009632248431228424, 0.0032001473641905015, 0.00714171665646631] and parameters: {'n_layers': 1, 'embedding_dim': 256, 'lr': 0.000762190113410319, 'lambda_val': 3.222265315337744e-05, 'batch_size': 3294, 'optimizer': 'Adam'}.
2026-06-07 03:12:38,001 - experiment_functions - INFO - Early stopping at epoch 750. Best Metrics: (0.008785243772788106, 0.0026140397883314356, 0.006111486785132025)
2026-06-07 03:12:38,083 - optuna.study.study - INFO - Trial 182 finished with values: [0.008785243772788106, 0.0026140397883314356, 0.006111486785132025] and parameters: {'n_layers': 1, 'embedding_dim': 32, 'lr': 0.0028344398259960786, 'lambda_val': 3.491863285065632e-06, 'batch_size': 1861, 'optimizer': 'Adam'}.
2026-06-07 03:13:03,578 - experiment_functions - INFO - Early stopping at epoch 600. Best Metrics: (0.004458998644563866, 0.001373166320584098, 0.002901573136780702)
2026-06-07 03:13:03,814 - optuna.study.study - INFO - Trial 183 finished with values: [0.004458998644563866, 0.001373166320584098, 0.002901573136780702] and parameters: {'n_layers': 2, 'embedding_dim': 128, 'lr': 0.0011078514946922563, 'lambda_val': 0.0007605677300524109, 'batch_size': 2883, 'optimizer': 'RMSprop'}.
2026-06-07 03:15:50,227 - optuna.study.study - INFO - Trial 184 finished with values: [0.009103479270830614, 0.003037711836023846, 0.006862966657076951] and parameters: {'n_layers': 1, 'embedding_dim': 256, 'lr': 0.00031084764364588095, 'lambda_val': 6.538231837458372e-06, 'batch_size': 4046, 'optimizer': 'Adam'}.
2026-06-07 03:16:13,181 - experiment_functions - INFO - Early stopping at epoch 550. Best Metrics: (0.0038819106636517973, 0.0009963828789604126, 0.002323337479637052)
2026-06-07 03:16:13,758 - optuna.study.study - INFO - Trial 185 finished with values: [0.0038819106636517973, 0.0009963828789604126, 0.002323337479637052] and parameters: {'n_layers': 3, 'embedding_dim': 64, 'lr': 0.005203827941055956, 'lambda_val': 1.058365552996417e-06, 'batch_size': 2282, 'optimizer': 'Adam'}.
2026-06-07 03:16:36,917 - experiment_functions - INFO - Early stopping at epoch 550. Best Metrics: (0.0028729947081636634, 0.0008657646191975349, 0.0018478387923065252)
2026-06-07 03:16:37,006 - optuna.study.study - INFO - Trial 186 finished with values: [0.0028729947081636634, 0.0008657646191975349, 0.0018478387923065252] and parameters: {'n_layers': 2, 'embedding_dim': 96, 'lr': 0.02706587864096201, 'lambda_val': 0.0006098824234122334, 'batch_size': 2652, 'optimizer': 'Adam'}.
2026-06-07 03:17:57,405 - experiment_functions - INFO - Early stopping at epoch 1950. Best Metrics: (0.005878079004655357, 0.001726505459173421, 0.0039735512636643894)
2026-06-07 03:17:57,513 - optuna.study.study - INFO - Trial 187 finished with values: [0.005878079004655357, 0.001726505459173421, 0.0039735512636643894] and parameters: {'n_layers': 3, 'embedding_dim': 128, 'lr': 0.00031084764364588095, 'lambda_val': 1.1883014168137366e-05, 'batch_size': 2652, 'optimizer': 'RMSprop'}.
2026-06-07 03:20:33,863 - optuna.study.study - INFO - Trial 188 finished with values: [0.0042541536999088185, 0.0010868109049500972, 0.0025389282085774225] and parameters: {'n_layers': 3, 'embedding_dim': 96, 'lr': 0.00019178783016765463, 'lambda_val': 0.002165335135008093, 'batch_size': 1074, 'optimizer': 'Adam'}.
2026-06-07 03:23:10,524 - optuna.study.study - INFO - Trial 189 finished with values: [0.004449314161330712, 0.0012241275370085069, 0.0026424957034542353] and parameters: {'n_layers': 3, 'embedding_dim': 96, 'lr': 0.00019178783016765463, 'lambda_val': 0.002165335135008093, 'batch_size': 2784, 'optimizer': 'RMSprop'}.
2026-06-07 03:23:55,920 - experiment_functions - INFO - Early stopping at epoch 1050. Best Metrics: (0.008455223604225301, 0.0028468082256011794, 0.006277374049664575)
2026-06-07 03:23:56,206 - optuna.study.study - INFO - Trial 190 finished with values: [0.008455223604225301, 0.0028468082256011794, 0.006277374049664575] and parameters: {'n_layers': 1, 'embedding_dim': 256, 'lr': 0.000762190113410319, 'lambda_val': 0.003413922431571512, 'batch_size': 2074, 'optimizer': 'Adam'}.
2026-06-07 03:26:26,132 - optuna.study.study - INFO - Trial 191 finished with values: [0.005597354662065409, 0.0015958871994105435, 0.0036512813214745277] and parameters: {'n_layers': 2, 'embedding_dim': 64, 'lr': 0.00031084764364588095, 'lambda_val': 0.00029907993070612653, 'batch_size': 2179, 'optimizer': 'Adam'}.
2026-06-07 03:26:49,439 - experiment_functions - INFO - Early stopping at epoch 550. Best Metrics: (0.005435579597001336, 0.0017181324938040055, 0.003725679685177472)
2026-06-07 03:26:49,525 - optuna.study.study - INFO - Trial 192 finished with values: [0.005435579597001336, 0.0017181324938040055, 0.003725679685177472] and parameters: {'n_layers': 2, 'embedding_dim': 96, 'lr': 0.0063362306152574144, 'lambda_val': 0.00021636699878359715, 'batch_size': 2896, 'optimizer': 'Adam'}.
2026-06-07 03:29:28,022 - experiment_functions - INFO - Early stopping at epoch 3900. Best Metrics: (0.004722976310266762, 0.001331301493737022, 0.003193764540896733)
2026-06-07 03:29:28,236 - optuna.study.study - INFO - Trial 193 finished with values: [0.004722976310266762, 0.001331301493737022, 0.003193764540896733] and parameters: {'n_layers': 3, 'embedding_dim': 128, 'lr': 0.00041076267416475083, 'lambda_val': 2.3236365063827913e-06, 'batch_size': 1392, 'optimizer': 'Adam'}.
2026-06-07 03:29:53,423 - experiment_functions - INFO - Early stopping at epoch 600. Best Metrics: (0.008607280142311761, 0.0028216893294929334, 0.006270857850447853)
2026-06-07 03:29:53,515 - optuna.study.study - INFO - Trial 194 finished with values: [0.008607280142311761, 0.0028216893294929334, 0.006270857850447853] and parameters: {'n_layers': 1, 'embedding_dim': 128, 'lr': 0.005424684195660662, 'lambda_val': 3.491863285065632e-06, 'batch_size': 4046, 'optimizer': 'Adam'}.
2026-06-07 03:30:20,652 - experiment_functions - INFO - Early stopping at epoch 600. Best Metrics: (0.008165456760131399, 0.002853506597896711, 0.006039275076608804)
2026-06-07 03:30:21,087 - optuna.study.study - INFO - Trial 195 finished with values: [0.008165456760131399, 0.002853506597896711, 0.006039275076608804] and parameters: {'n_layers': 1, 'embedding_dim': 256, 'lr': 0.003111912344058094, 'lambda_val': 0.003413922431571512, 'batch_size': 4046, 'optimizer': 'Adam'}.
2026-06-07 03:31:07,399 - experiment_functions - INFO - Early stopping at epoch 1100. Best Metrics: (0.0024435367858406175, 0.0006530912988143881, 0.0014611334286674937)
2026-06-07 03:31:07,489 - optuna.study.study - INFO - Trial 196 finished with values: [0.0024435367858406175, 0.0006530912988143881, 0.0014611334286674937] and parameters: {'n_layers': 3, 'embedding_dim': 128, 'lr': 0.00031084764364588095, 'lambda_val': 0.015365193136772735, 'batch_size': 2652, 'optimizer': 'Adam'}.
2026-06-07 03:32:36,065 - experiment_functions - INFO - Early stopping at epoch 2350. Best Metrics: (0.006640580752877485, 0.0019659722687386965, 0.0044972521504925336)
2026-06-07 03:32:36,149 - optuna.study.study - INFO - Trial 197 finished with values: [0.006640580752877485, 0.0019659722687386965, 0.0044972521504925336] and parameters: {'n_layers': 2, 'embedding_dim': 64, 'lr': 0.00031084764364588095, 'lambda_val': 0.0005559527053332463, 'batch_size': 2652, 'optimizer': 'RMSprop'}.
2026-06-07 03:33:01,897 - experiment_functions - INFO - Early stopping at epoch 600. Best Metrics: (0.006205068610443949, 0.00190736151115279, 0.004309071513075514)
2026-06-07 03:33:02,754 - optuna.study.study - INFO - Trial 198 finished with values: [0.006205068610443949, 0.00190736151115279, 0.004309071513075514] and parameters: {'n_layers': 2, 'embedding_dim': 128, 'lr': 0.0020485036238635386, 'lambda_val': 6.538231837458372e-06, 'batch_size': 1861, 'optimizer': 'Adam'}.
2026-06-07 03:33:28,619 - experiment_functions - INFO - Early stopping at epoch 550. Best Metrics: (0.003051027053942192, 0.0008908835153057808, 0.001972275287406434)
2026-06-07 03:33:28,713 - optuna.study.study - INFO - Trial 199 finished with values: [0.003051027053942192, 0.0008908835153057808, 0.001972275287406434] and parameters: {'n_layers': 2, 'embedding_dim': 256, 'lr': 0.003111912344058094, 'lambda_val': 0.0007605677300524109, 'batch_size': 1710, 'optimizer': 'RMSprop'}.
2026-06-07 03:34:50,446 - experiment_functions - INFO - Early stopping at epoch 2150. Best Metrics: (0.0054994555754221495, 0.0018470761604930002, 0.003789802357000726)
2026-06-07 03:34:50,750 - optuna.study.study - INFO - Trial 200 finished with values: [0.0054994555754221495, 0.0018470761604930002, 0.003789802357000726] and parameters: {'n_layers': 1, 'embedding_dim': 96, 'lr': 0.0063362306152574144, 'lambda_val': 1.9144811339436236e-06, 'batch_size': 2896, 'optimizer': 'RMSprop'}.
2026-06-07 03:35:13,146 - experiment_functions - INFO - Early stopping at epoch 550. Best Metrics: (0.006107007269431553, 0.0017466005760600175, 0.0039195740782843455)
2026-06-07 03:35:13,231 - optuna.study.study - INFO - Trial 201 finished with values: [0.006107007269431553, 0.0017466005760600175, 0.0039195740782843455] and parameters: {'n_layers': 2, 'embedding_dim': 64, 'lr': 0.005424684195660662, 'lambda_val': 0.00029907993070612653, 'batch_size': 2179, 'optimizer': 'Adam'}.
2026-06-07 03:36:14,256 - experiment_functions - INFO - Early stopping at epoch 1600. Best Metrics: (0.005807566240510604, 0.0016327282470359702, 0.00385162325148493)
2026-06-07 03:36:14,349 - optuna.study.study - INFO - Trial 202 finished with values: [0.005807566240510604, 0.0016327282470359702, 0.00385162325148493] and parameters: {'n_layers': 2, 'embedding_dim': 64, 'lr': 0.000762190113410319, 'lambda_val': 0.0007605677300524109, 'batch_size': 1880, 'optimizer': 'Adam'}.
2026-06-07 03:36:53,175 - experiment_functions - INFO - Early stopping at epoch 1000. Best Metrics: (0.004816208297861582, 0.001304508004554893, 0.0030178924951674317)
2026-06-07 03:36:53,388 - optuna.study.study - INFO - Trial 203 finished with values: [0.004816208297861582, 0.001304508004554893, 0.0030178924951674317] and parameters: {'n_layers': 2, 'embedding_dim': 64, 'lr': 0.0009185976129161797, 'lambda_val': 0.0005559527053332463, 'batch_size': 2652, 'optimizer': 'RMSprop'}.
2026-06-07 03:39:29,648 - experiment_functions - INFO - Early stopping at epoch 3950. Best Metrics: (0.0058268856831308205, 0.0018219572643847545, 0.003971332109481242)
2026-06-07 03:39:29,743 - optuna.study.study - INFO - Trial 204 finished with values: [0.0058268856831308205, 0.0018219572643847545, 0.003971332109481242] and parameters: {'n_layers': 2, 'embedding_dim': 128, 'lr': 0.00031084764364588095, 'lambda_val': 0.0005559527053332463, 'batch_size': 3350, 'optimizer': 'Adam'}.
2026-06-07 03:40:27,037 - experiment_functions - INFO - Early stopping at epoch 1550. Best Metrics: (0.008210389775488743, 0.0025236117623417507, 0.005772065823488837)
2026-06-07 03:40:27,745 - optuna.study.study - INFO - Trial 205 finished with values: [0.008210389775488743, 0.0025236117623417507, 0.005772065823488837] and parameters: {'n_layers': 1, 'embedding_dim': 32, 'lr': 0.0017152190282418974, 'lambda_val': 1.058365552996417e-06, 'batch_size': 1114, 'optimizer': 'Adam'}.
2026-06-07 03:40:49,698 - experiment_functions - INFO - Early stopping at epoch 500. Best Metrics: (0.0006391927997439846, 9.042802598968451e-05, 0.0002656965375779929)
2026-06-07 03:40:49,789 - optuna.study.study - INFO - Trial 206 finished with values: [0.0006391927997439846, 9.042802598968451e-05, 0.0002656965375779929] and parameters: {'n_layers': 4, 'embedding_dim': 96, 'lr': 0.00031084764364588095, 'lambda_val': 0.011664641871275548, 'batch_size': 2652, 'optimizer': 'SGD'}.
2026-06-07 03:41:21,648 - experiment_functions - INFO - Early stopping at epoch 800. Best Metrics: (0.005206174479122847, 0.0015004353941992096, 0.003309094563570766)
2026-06-07 03:41:22,077 - optuna.study.study - INFO - Trial 207 finished with values: [0.005206174479122847, 0.0015004353941992096, 0.003309094563570766] and parameters: {'n_layers': 2, 'embedding_dim': 64, 'lr': 0.0009747960752891156, 'lambda_val': 0.003413922431571512, 'batch_size': 1964, 'optimizer': 'Adam'}.
2026-06-07 03:41:46,985 - experiment_functions - INFO - Early stopping at epoch 550. Best Metrics: (0.008279652076829206, 0.0030477593944671444, 0.006229917839641362)
2026-06-07 03:41:47,852 - optuna.study.study - INFO - Trial 208 finished with values: [0.008279652076829206, 0.0030477593944671444, 0.006229917839641362] and parameters: {'n_layers': 1, 'embedding_dim': 256, 'lr': 0.005424684195660662, 'lambda_val': 0.005664799898024634, 'batch_size': 4046, 'optimizer': 'Adam'}.
2026-06-07 03:42:10,519 - experiment_functions - INFO - Early stopping at epoch 550. Best Metrics: (0.004785125797509236, 0.0013212539352937236, 0.0031259955598947854)
