2026-06-05 00:07:43,543 - optuna.study.study - INFO - Trial 88 finished with values: [0.0005183067370086157, 7.703128139862015e-05, 0.00022065460785588092] and parameters: {'n_layers': 4, 'embedding_dim': 96, 'lr': 0.055430291097441665, 'lambda_val': 1.6434238137431028e-05, 'batch_size': 2561, 'optimizer': 'SGD'}.
2026-06-05 00:08:14,915 - experiment_functions - INFO - Early stopping at epoch 500. Best Metrics: (0.0006848014994943433, 0.00010382477058074888, 0.0003065952354928184)
2026-06-05 00:08:15,064 - optuna.study.study - INFO - Trial 89 finished with values: [0.0006848014994943433, 0.00010382477058074888, 0.0003065952354928184] and parameters: {'n_layers': 4, 'embedding_dim': 256, 'lr': 0.00011825532801285016, 'lambda_val': 0.012618658894463725, 'batch_size': 3577, 'optimizer': 'SGD'}.
2026-06-05 00:10:52,503 - optuna.study.study - INFO - Trial 90 finished with values: [0.07625454143951142, 0.009868376984392793, 0.04142018094653177] and parameters: {'n_layers': 1, 'embedding_dim': 64, 'lr': 0.000936097337950737, 'lambda_val': 2.061360640875514e-06, 'batch_size': 2859, 'optimizer': 'RMSprop'}.
2026-06-05 00:12:07,828 - experiment_functions - INFO - Early stopping at epoch 1200. Best Metrics: (0.04130928330511634, 0.005213008238997925, 0.020616705607069206)
2026-06-05 00:12:08,931 - optuna.study.study - INFO - Trial 91 finished with values: [0.04130928330511634, 0.005213008238997925, 0.020616705607069206] and parameters: {'n_layers': 4, 'embedding_dim': 256, 'lr': 0.0005200733648452572, 'lambda_val': 1.2643036671926655e-05, 'batch_size': 3566, 'optimizer': 'RMSprop'}.
2026-06-05 00:13:24,392 - experiment_functions - INFO - Early stopping at epoch 1850. Best Metrics: (0.009610837721602579, 0.0014954116149775607, 0.004558882497470049)
2026-06-05 00:13:24,534 - optuna.study.study - INFO - Trial 92 finished with values: [0.009610837721602579, 0.0014954116149775607, 0.004558882497470049] and parameters: {'n_layers': 3, 'embedding_dim': 64, 'lr': 0.003540381921720846, 'lambda_val': 0.07208515494242437, 'batch_size': 3114, 'optimizer': 'RMSprop'}.
2026-06-05 00:16:18,705 - optuna.study.study - INFO - Trial 93 finished with values: [0.04610068226794116, 0.006006765356018487, 0.02332629027436576] and parameters: {'n_layers': 3, 'embedding_dim': 64, 'lr': 0.0003418709874020897, 'lambda_val': 1.4962675921406695e-06, 'batch_size': 1064, 'optimizer': 'RMSprop'}.
2026-06-05 00:18:04,915 - experiment_functions - INFO - Early stopping at epoch 2700. Best Metrics: (0.011627134568045391, 0.00190736151115279, 0.0057051069033429635)
2026-06-05 00:18:05,811 - optuna.study.study - INFO - Trial 94 finished with values: [0.011627134568045391, 0.00190736151115279, 0.0057051069033429635] and parameters: {'n_layers': 1, 'embedding_dim': 96, 'lr': 0.055430291097441665, 'lambda_val': 0.029045035745594923, 'batch_size': 1070, 'optimizer': 'RMSprop'}.
2026-06-05 00:22:13,119 - optuna.study.study - INFO - Trial 95 finished with values: [0.03436633984969582, 0.004682162234576999, 0.017500112083948274] and parameters: {'n_layers': 4, 'embedding_dim': 256, 'lr': 0.00011825532801285016, 'lambda_val': 0.00022637584318870192, 'batch_size': 3577, 'optimizer': 'Adam'}.
2026-06-05 00:22:36,146 - experiment_functions - INFO - Early stopping at epoch 500. Best Metrics: (0.00042408790737463265, 6.028535065978968e-05, 0.00019062232864169087)
2026-06-05 00:22:36,234 - optuna.study.study - INFO - Trial 96 finished with values: [0.00042408790737463265, 6.028535065978968e-05, 0.00019062232864169087] and parameters: {'n_layers': 4, 'embedding_dim': 64, 'lr': 0.001262844338548854, 'lambda_val': 1.5013285586553525e-06, 'batch_size': 1408, 'optimizer': 'SGD'}.
2026-06-05 00:23:01,284 - experiment_functions - INFO - Early stopping at epoch 500. Best Metrics: (0.03800161579391658, 0.004918279857994507, 0.02012989677656261)
2026-06-05 00:23:01,702 - optuna.study.study - INFO - Trial 97 finished with values: [0.03800161579391658, 0.004918279857994507, 0.02012989677656261] and parameters: {'n_layers': 4, 'embedding_dim': 96, 'lr': 0.08294142044076476, 'lambda_val': 0.002216169184844733, 'batch_size': 516, 'optimizer': 'RMSprop'}.
2026-06-05 00:23:23,981 - experiment_functions - INFO - Early stopping at epoch 500. Best Metrics: (0.0004651748560856937, 6.865831602920491e-05, 0.00019837966170341753)
2026-06-05 00:23:24,057 - optuna.study.study - INFO - Trial 98 finished with values: [0.0004651748560856937, 6.865831602920491e-05, 0.00019837966170341753] and parameters: {'n_layers': 2, 'embedding_dim': 96, 'lr': 0.0003965290613386454, 'lambda_val': 0.03417070264288617, 'batch_size': 3566, 'optimizer': 'SGD'}.
2026-06-05 00:24:30,897 - experiment_functions - INFO - Early stopping at epoch 1650. Best Metrics: (0.018309856904485458, 0.003236988411815929, 0.009488945973163571)
2026-06-05 00:24:31,027 - optuna.study.study - INFO - Trial 99 finished with values: [0.018309856904485458, 0.003236988411815929, 0.009488945973163571] and parameters: {'n_layers': 1, 'embedding_dim': 96, 'lr': 0.015002074473241443, 'lambda_val': 0.004752309024246128, 'batch_size': 3566, 'optimizer': 'RMSprop'}.
2026-06-05 00:24:57,792 - experiment_functions - INFO - Early stopping at epoch 550. Best Metrics: (0.034829077589829435, 0.004434322459642307, 0.018418016697592843)
2026-06-05 00:24:58,145 - optuna.study.study - INFO - Trial 100 finished with values: [0.034829077589829435, 0.004434322459642307, 0.018418016697592843] and parameters: {'n_layers': 3, 'embedding_dim': 96, 'lr': 0.003540381921720846, 'lambda_val': 8.600399380889837e-06, 'batch_size': 3114, 'optimizer': 'Adam'}.
2026-06-05 00:25:24,958 - experiment_functions - INFO - Early stopping at epoch 500. Best Metrics: (0.029319646345041857, 0.0038063500569361637, 0.01614644490592556)
2026-06-05 00:25:25,518 - optuna.study.study - INFO - Trial 101 finished with values: [0.029319646345041857, 0.0038063500569361637, 0.01614644490592556] and parameters: {'n_layers': 4, 'embedding_dim': 128, 'lr': 0.06006268611544608, 'lambda_val': 2.264578702522949e-06, 'batch_size': 1750, 'optimizer': 'RMSprop'}.
2026-06-05 00:28:02,033 - optuna.study.study - INFO - Trial 102 finished with values: [0.04454715812835412, 0.006010114542166253, 0.023033593931246564] and parameters: {'n_layers': 2, 'embedding_dim': 32, 'lr': 0.0003278860610242573, 'lambda_val': 1.70267277154218e-06, 'batch_size': 3888, 'optimizer': 'RMSprop'}.
2026-06-05 00:30:37,847 - optuna.study.study - INFO - Trial 103 finished with values: [0.01664866015498977, 0.0024013664679482885, 0.00816474062452624] and parameters: {'n_layers': 3, 'embedding_dim': 32, 'lr': 0.0003278860610242573, 'lambda_val': 0.021581423034180355, 'batch_size': 1900, 'optimizer': 'Adam'}.
2026-06-05 00:33:01,416 - experiment_functions - INFO - Early stopping at epoch 3600. Best Metrics: (0.015043293656564354, 0.002267399022037645, 0.007290189294327228)
2026-06-05 00:33:01,525 - optuna.study.study - INFO - Trial 104 finished with values: [0.015043293656564354, 0.002267399022037645, 0.007290189294327228] and parameters: {'n_layers': 4, 'embedding_dim': 32, 'lr': 0.08547228312239685, 'lambda_val': 0.0024741700262700477, 'batch_size': 3577, 'optimizer': 'Adam'}.
2026-06-05 00:33:49,508 - experiment_functions - INFO - Early stopping at epoch 1100. Best Metrics: (0.03850984522593024, 0.0049969857324670105, 0.01936416220741337)
2026-06-05 00:33:49,596 - optuna.study.study - INFO - Trial 105 finished with values: [0.03850984522593024, 0.0049969857324670105, 0.01936416220741337] and parameters: {'n_layers': 3, 'embedding_dim': 64, 'lr': 0.0007432804052483335, 'lambda_val': 0.0005094277795441267, 'batch_size': 2859, 'optimizer': 'RMSprop'}.
2026-06-05 00:37:56,286 - optuna.study.study - INFO - Trial 106 finished with values: [0.042382241555872814, 0.005593140866769375, 0.020780752774125704] and parameters: {'n_layers': 4, 'embedding_dim': 256, 'lr': 0.00034591006673268676, 'lambda_val': 1.2643036671926655e-05, 'batch_size': 1064, 'optimizer': 'RMSprop'}.
2026-06-05 00:40:56,872 - optuna.study.study - INFO - Trial 107 finished with values: [0.048751188464634734, 0.006318239667760735, 0.02462470615957506] and parameters: {'n_layers': 3, 'embedding_dim': 96, 'lr': 0.0004923748132201506, 'lambda_val': 0.00032088813103114836, 'batch_size': 2038, 'optimizer': 'Adam'}.
2026-06-05 00:44:24,696 - optuna.study.study - INFO - Trial 108 finished with values: [0.06617740458250415, 0.008604059213611093, 0.03606758067687631] and parameters: {'n_layers': 2, 'embedding_dim': 256, 'lr': 0.0003278860610242573, 'lambda_val': 1.6669472887970978e-05, 'batch_size': 1750, 'optimizer': 'Adam'}.
2026-06-05 00:44:48,183 - experiment_functions - INFO - Early stopping at epoch 500. Best Metrics: (0.0317211307613508, 0.0040056266327282465, 0.016698218288469378)
2026-06-05 00:44:49,101 - optuna.study.study - INFO - Trial 109 finished with values: [0.0317211307613508, 0.0040056266327282465, 0.016698218288469378] and parameters: {'n_layers': 4, 'embedding_dim': 64, 'lr': 0.08294142044076476, 'lambda_val': 0.002216169184844733, 'batch_size': 516, 'optimizer': 'RMSprop'}.
2026-06-05 00:45:12,961 - experiment_functions - INFO - Early stopping at epoch 500. Best Metrics: (0.00915453258131389, 0.0010868109049500972, 0.005082795939226249)
2026-06-05 00:45:13,894 - optuna.study.study - INFO - Trial 110 finished with values: [0.00915453258131389, 0.0010868109049500972, 0.005082795939226249] and parameters: {'n_layers': 2, 'embedding_dim': 128, 'lr': 0.055430291097441665, 'lambda_val': 0.022759446679175066, 'batch_size': 3944, 'optimizer': 'RMSprop'}.
2026-06-05 00:45:43,499 - experiment_functions - INFO - Early stopping at epoch 550. Best Metrics: (0.0006985073271883376, 0.00010215017750686584, 0.0003267561362194003)
2026-06-05 00:45:44,156 - optuna.study.study - INFO - Trial 111 finished with values: [0.0006985073271883376, 0.00010215017750686584, 0.0003267561362194003] and parameters: {'n_layers': 2, 'embedding_dim': 256, 'lr': 2.5862128660947406e-05, 'lambda_val': 0.0012003022780356736, 'batch_size': 3009, 'optimizer': 'Adam'}.
2026-06-05 00:48:49,438 - optuna.study.study - INFO - Trial 112 finished with values: [0.023459776123204046, 0.0033123451001406657, 0.01180211773763144] and parameters: {'n_layers': 4, 'embedding_dim': 96, 'lr': 0.00011825532801285016, 'lambda_val': 0.0006821827368649684, 'batch_size': 3577, 'optimizer': 'Adam'}.
2026-06-05 00:51:40,854 - optuna.study.study - INFO - Trial 113 finished with values: [0.050903408129971836, 0.0065275638019961155, 0.02614181987253402] and parameters: {'n_layers': 2, 'embedding_dim': 96, 'lr': 0.0003278860610242573, 'lambda_val': 0.0009133566637043713, 'batch_size': 3888, 'optimizer': 'Adam'}.
2026-06-05 00:52:37,703 - experiment_functions - INFO - Early stopping at epoch 1300. Best Metrics: (0.048688165874126964, 0.006187621407997857, 0.02542461504723639)
2026-06-05 00:52:37,866 - optuna.study.study - INFO - Trial 114 finished with values: [0.048688165874126964, 0.006187621407997857, 0.02542461504723639] and parameters: {'n_layers': 2, 'embedding_dim': 96, 'lr': 0.0007432804052483335, 'lambda_val': 0.0003734366700851135, 'batch_size': 1214, 'optimizer': 'RMSprop'}.
2026-06-05 00:55:29,422 - optuna.study.study - INFO - Trial 115 finished with values: [0.05137102760229977, 0.006592872931877555, 0.02502085160210887] and parameters: {'n_layers': 3, 'embedding_dim': 64, 'lr': 0.0005200733648452572, 'lambda_val': 2.264578702522949e-06, 'batch_size': 3047, 'optimizer': 'RMSprop'}.
2026-06-05 00:56:05,324 - experiment_functions - INFO - Early stopping at epoch 550. Best Metrics: (0.0233385886537733, 0.002927188693147565, 0.01152406355229104)
2026-06-05 00:56:05,419 - optuna.study.study - INFO - Trial 116 finished with values: [0.0233385886537733, 0.002927188693147565, 0.01152406355229104] and parameters: {'n_layers': 4, 'embedding_dim': 256, 'lr': 0.06006268611544608, 'lambda_val': 3.3509343310867884e-06, 'batch_size': 1750, 'optimizer': 'Adam'}.
2026-06-05 00:56:31,932 - experiment_functions - INFO - Early stopping at epoch 550. Best Metrics: (0.036097341171195736, 0.0045029807756715124, 0.018445165926104012)
2026-06-05 00:56:32,217 - optuna.study.study - INFO - Trial 117 finished with values: [0.036097341171195736, 0.0045029807756715124, 0.018445165926104012] and parameters: {'n_layers': 3, 'embedding_dim': 96, 'lr': 0.003540381921720846, 'lambda_val': 1.6669472887970978e-05, 'batch_size': 3114, 'optimizer': 'Adam'}.
2026-06-05 00:59:29,707 - optuna.study.study - INFO - Trial 118 finished with values: [0.058972229859261274, 0.007850492330363721, 0.03116547094220825] and parameters: {'n_layers': 2, 'embedding_dim': 128, 'lr': 0.0007432804052483335, 'lambda_val': 4.933989724174048e-06, 'batch_size': 1064, 'optimizer': 'Adam'}.
2026-06-05 01:00:56,555 - experiment_functions - INFO - Early stopping at epoch 2300. Best Metrics: (0.0006606883355934696, 9.37772121374506e-05, 0.0002835045191079622)
2026-06-05 01:00:56,682 - optuna.study.study - INFO - Trial 119 finished with values: [0.0006606883355934696, 9.37772121374506e-05, 0.0002835045191079622] and parameters: {'n_layers': 2, 'embedding_dim': 32, 'lr': 1.9642800026212462e-05, 'lambda_val': 5.549577204880508e-06, 'batch_size': 2859, 'optimizer': 'Adam'}.
2026-06-05 01:01:32,396 - experiment_functions - INFO - Early stopping at epoch 550. Best Metrics: (0.022770190493781886, 0.0027781499095719748, 0.010848684029908668)
2026-06-05 01:01:32,508 - optuna.study.study - INFO - Trial 120 finished with values: [0.022770190493781886, 0.0027781499095719748, 0.010848684029908668] and parameters: {'n_layers': 4, 'embedding_dim': 256, 'lr': 0.009556862834818597, 'lambda_val': 2.3264187931610947e-05, 'batch_size': 3447, 'optimizer': 'Adam'}.
2026-06-05 01:01:57,061 - experiment_functions - INFO - Early stopping at epoch 550. Best Metrics: (0.05337919083823243, 0.006850760265255543, 0.028806278771994764)
2026-06-05 01:01:58,067 - optuna.study.study - INFO - Trial 121 finished with values: [0.05337919083823243, 0.006850760265255543, 0.028806278771994764] and parameters: {'n_layers': 1, 'embedding_dim': 96, 'lr': 0.010850387474674802, 'lambda_val': 0.00022368856507037872, 'batch_size': 2331, 'optimizer': 'Adam'}.
2026-06-05 01:04:57,013 - optuna.study.study - INFO - Trial 122 finished with values: [0.05567942746336051, 0.007189028066179918, 0.029255571767411344] and parameters: {'n_layers': 3, 'embedding_dim': 96, 'lr': 0.0005200733648452572, 'lambda_val': 2.388311754210309e-05, 'batch_size': 1900, 'optimizer': 'RMSprop'}.
2026-06-05 01:07:50,925 - optuna.study.study - INFO - Trial 123 finished with values: [0.03684825347553599, 0.004707281130685244, 0.018700499922181] and parameters: {'n_layers': 4, 'embedding_dim': 64, 'lr': 0.0007432804052483335, 'lambda_val': 1.5139846282757388e-05, 'batch_size': 2859, 'optimizer': 'Adam'}.
2026-06-05 01:11:31,570 - optuna.study.study - INFO - Trial 124 finished with values: [0.027883483747798244, 0.003943666688994574, 0.0152150212715303] and parameters: {'n_layers': 3, 'embedding_dim': 256, 'lr': 0.00011825532801285016, 'lambda_val': 9.325564591196157e-05, 'batch_size': 1214, 'optimizer': 'RMSprop'}.
2026-06-05 01:11:57,918 - experiment_functions - INFO - Early stopping at epoch 550. Best Metrics: (0.042441362107212915, 0.005218032018219573, 0.021958929599065435)
2026-06-05 01:11:58,335 - optuna.study.study - INFO - Trial 125 finished with values: [0.042441362107212915, 0.005218032018219573, 0.021958929599065435] and parameters: {'n_layers': 3, 'embedding_dim': 96, 'lr': 0.003540381921720846, 'lambda_val': 3.532972028162508e-06, 'batch_size': 4054, 'optimizer': 'Adam'}.
2026-06-05 01:12:31,131 - experiment_functions - INFO - Early stopping at epoch 500. Best Metrics: (0.03314300011790452, 0.004055864424944739, 0.01826463573198069)
2026-06-05 01:12:31,226 - optuna.study.study - INFO - Trial 126 finished with values: [0.03314300011790452, 0.004055864424944739, 0.01826463573198069] and parameters: {'n_layers': 4, 'embedding_dim': 256, 'lr': 0.06006268611544608, 'lambda_val': 4.7060452177400585e-05, 'batch_size': 3577, 'optimizer': 'RMSprop'}.
2026-06-05 01:12:56,300 - experiment_functions - INFO - Early stopping at epoch 550. Best Metrics: (0.028432033216376034, 0.0033759796369482215, 0.013875702938398883)
2026-06-05 01:12:57,041 - optuna.study.study - INFO - Trial 127 finished with values: [0.028432033216376034, 0.0033759796369482215, 0.013875702938398883] and parameters: {'n_layers': 3, 'embedding_dim': 64, 'lr': 0.010850387474674802, 'lambda_val': 1.8693810339284113e-05, 'batch_size': 3566, 'optimizer': 'Adam'}.
2026-06-05 01:13:19,386 - experiment_functions - INFO - Early stopping at epoch 500. Best Metrics: (0.00027442113418106384, 5.6936164512023584e-05, 0.0001348425580598452)
2026-06-05 01:13:19,460 - optuna.study.study - INFO - Trial 128 finished with values: [0.00027442113418106384, 5.6936164512023584e-05, 0.0001348425580598452] and parameters: {'n_layers': 3, 'embedding_dim': 64, 'lr': 0.010979429387298605, 'lambda_val': 0.03286530652036621, 'batch_size': 3979, 'optimizer': 'SGD'}.
2026-06-05 01:13:43,137 - experiment_functions - INFO - Early stopping at epoch 550. Best Metrics: (0.011375354591174247, 0.001649474177774801, 0.005499018379057212)
2026-06-05 01:13:43,229 - optuna.study.study - INFO - Trial 129 finished with values: [0.011375354591174247, 0.001649474177774801, 0.005499018379057212] and parameters: {'n_layers': 4, 'embedding_dim': 32, 'lr': 0.08333698415859936, 'lambda_val': 0.0003734366700851135, 'batch_size': 3888, 'optimizer': 'Adam'}.
2026-06-05 01:15:04,270 - experiment_functions - INFO - Early stopping at epoch 1950. Best Metrics: (0.05540753774876093, 0.007096925447116352, 0.028510866189229433)
2026-06-05 01:15:04,366 - optuna.study.study - INFO - Trial 130 finished with values: [0.05540753774876093, 0.007096925447116352, 0.028510866189229433] and parameters: {'n_layers': 2, 'embedding_dim': 64, 'lr': 0.0005442466826639005, 'lambda_val': 3.3509343310867884e-06, 'batch_size': 3566, 'optimizer': 'RMSprop'}.
2026-06-05 01:15:43,759 - experiment_functions - INFO - Early stopping at epoch 950. Best Metrics: (0.05205381463681086, 0.007111996784781298, 0.027527590077633668)
2026-06-05 01:15:43,996 - optuna.study.study - INFO - Trial 131 finished with values: [0.05205381463681086, 0.007111996784781298, 0.027527590077633668] and parameters: {'n_layers': 1, 'embedding_dim': 64, 'lr': 0.000936097337950737, 'lambda_val': 0.0024741700262700477, 'batch_size': 2586, 'optimizer': 'RMSprop'}.
2026-06-05 01:18:41,895 - optuna.study.study - INFO - Trial 132 finished with values: [0.04473918312334614, 0.005656775403576931, 0.022102393371377985] and parameters: {'n_layers': 3, 'embedding_dim': 96, 'lr': 0.0007432804052483335, 'lambda_val': 2.264578702522949e-06, 'batch_size': 1100, 'optimizer': 'RMSprop'}.
2026-06-05 01:19:06,982 - experiment_functions - INFO - Early stopping at epoch 550. Best Metrics: (0.02711797465483011, 0.0032436867841114606, 0.012663118643539382)
2026-06-05 01:19:07,994 - optuna.study.study - INFO - Trial 133 finished with values: [0.02711797465483011, 0.0032436867841114606, 0.012663118643539382] and parameters: {'n_layers': 2, 'embedding_dim': 96, 'lr': 0.017336107761708283, 'lambda_val': 1.6669472887970978e-05, 'batch_size': 3447, 'optimizer': 'Adam'}.
2026-06-05 01:19:40,651 - experiment_functions - INFO - Early stopping at epoch 750. Best Metrics: (0.016217223872862074, 0.002485096121642441, 0.00880046530986696)
2026-06-05 01:19:40,757 - optuna.study.study - INFO - Trial 134 finished with values: [0.016217223872862074, 0.002485096121642441, 0.00880046530986696] and parameters: {'n_layers': 1, 'embedding_dim': 128, 'lr': 0.017336107761708283, 'lambda_val': 1.6669472887970978e-05, 'batch_size': 3447, 'optimizer': 'RMSprop'}.
2026-06-05 01:20:03,936 - experiment_functions - INFO - Early stopping at epoch 550. Best Metrics: (0.00047258712210413676, 6.363453680755577e-05, 0.00022871981770445835)
2026-06-05 01:20:04,034 - optuna.study.study - INFO - Trial 135 finished with values: [0.00047258712210413676, 6.363453680755577e-05, 0.00022871981770445835] and parameters: {'n_layers': 3, 'embedding_dim': 32, 'lr': 6.412664912626422e-05, 'lambda_val': 0.021581423034180355, 'batch_size': 1900, 'optimizer': 'RMSprop'}.
2026-06-05 01:23:04,614 - optuna.study.study - INFO - Trial 136 finished with values: [0.02293340502151147, 0.003960412619733405, 0.012501561735774564] and parameters: {'n_layers': 1, 'embedding_dim': 256, 'lr': 0.010850387474674802, 'lambda_val': 0.00022368856507037872, 'batch_size': 3332, 'optimizer': 'RMSprop'}.
2026-06-05 01:23:47,897 - experiment_functions - INFO - Early stopping at epoch 900. Best Metrics: (0.05115286116368731, 0.006956259628910175, 0.02717142536156657)
2026-06-05 01:23:47,976 - optuna.study.study - INFO - Trial 137 finished with values: [0.05115286116368731, 0.006956259628910175, 0.02717142536156657] and parameters: {'n_layers': 1, 'embedding_dim': 256, 'lr': 0.00105994739638826, 'lambda_val': 0.0024741700262700477, 'batch_size': 2586, 'optimizer': 'RMSprop'}.
2026-06-05 01:27:54,378 - optuna.study.study - INFO - Trial 138 finished with values: [0.03526783169326948, 0.004722352468350191, 0.01810139848191164] and parameters: {'n_layers': 4, 'embedding_dim': 256, 'lr': 0.00011825532801285016, 'lambda_val': 0.00022637584318870192, 'batch_size': 3577, 'optimizer': 'Adam'}.
2026-06-05 01:30:45,646 - optuna.study.study - INFO - Trial 139 finished with values: [0.018310355652448457, 0.002585571706075424, 0.0097891016352267] and parameters: {'n_layers': 2, 'embedding_dim': 128, 'lr': 0.00011825532801285016, 'lambda_val': 0.00022637584318870192, 'batch_size': 3577, 'optimizer': 'Adam'}.
