2026-06-05 18:22:16,286 - optuna.study.study - INFO - Trial 203 finished with values: [0.07461390723718034, 0.009702592270078372, 0.0423427519481336] and parameters: {'n_layers': 1, 'embedding_dim': 96, 'lr': 0.0007730079936260513, 'lambda_val': 5.587325552332493e-06, 'batch_size': 2546, 'optimizer': 'Adam'}.
2026-06-05 18:22:38,305 - experiment_functions - INFO - Early stopping at epoch 500. Best Metrics: (0.00037383754542996646, 6.195994373367272e-05, 0.00018315444722453701)
2026-06-05 18:22:38,406 - optuna.study.study - INFO - Trial 204 finished with values: [0.00037383754542996646, 6.195994373367272e-05, 0.00018315444722453701] and parameters: {'n_layers': 2, 'embedding_dim': 96, 'lr': 0.0004253926145527492, 'lambda_val': 0.00020574260712132375, 'batch_size': 2080, 'optimizer': 'SGD'}.
2026-06-05 18:23:03,114 - experiment_functions - INFO - Early stopping at epoch 550. Best Metrics: (0.035137378081864824, 0.004127871927121709, 0.016877600089223285)
2026-06-05 18:23:03,203 - optuna.study.study - INFO - Trial 205 finished with values: [0.035137378081864824, 0.004127871927121709, 0.016877600089223285] and parameters: {'n_layers': 2, 'embedding_dim': 96, 'lr': 0.016890967246723055, 'lambda_val': 3.684365830705915e-05, 'batch_size': 4028, 'optimizer': 'RMSprop'}.
2026-06-05 18:23:28,147 - experiment_functions - INFO - Early stopping at epoch 550. Best Metrics: (0.04826337529804583, 0.00663473775872463, 0.026480671919220888)
2026-06-05 18:23:28,558 - optuna.study.study - INFO - Trial 206 finished with values: [0.04826337529804583, 0.00663473775872463, 0.026480671919220888] and parameters: {'n_layers': 1, 'embedding_dim': 128, 'lr': 0.018894701130546775, 'lambda_val': 5.587325552332493e-06, 'batch_size': 3475, 'optimizer': 'Adam'}.
2026-06-05 18:25:59,737 - optuna.study.study - INFO - Trial 207 finished with values: [0.04738998448430434, 0.006683300957867238, 0.027504350045413038] and parameters: {'n_layers': 1, 'embedding_dim': 32, 'lr': 0.0007908861785647595, 'lambda_val': 0.00011375426873786574, 'batch_size': 1406, 'optimizer': 'RMSprop'}.
2026-06-05 18:28:32,699 - optuna.study.study - INFO - Trial 208 finished with values: [0.0542623820728382, 0.007671310871458236, 0.032026725250158615] and parameters: {'n_layers': 1, 'embedding_dim': 64, 'lr': 0.0009590496257981318, 'lambda_val': 5.587325552332493e-06, 'batch_size': 767, 'optimizer': 'RMSprop'}.
2026-06-05 18:29:02,852 - experiment_functions - INFO - Early stopping at epoch 700. Best Metrics: (0.06629439475777787, 0.008232299551209056, 0.0338062579392168)
2026-06-05 18:29:02,941 - optuna.study.study - INFO - Trial 209 finished with values: [0.06629439475777787, 0.008232299551209056, 0.0338062579392168] and parameters: {'n_layers': 2, 'embedding_dim': 64, 'lr': 0.0034108076646961875, 'lambda_val': 3.082500502951572e-05, 'batch_size': 2455, 'optimizer': 'Adam'}.
2026-06-05 18:29:33,515 - experiment_functions - INFO - Early stopping at epoch 650. Best Metrics: (0.04984451550632441, 0.006003416169870722, 0.024077994869048647)
2026-06-05 18:29:33,877 - optuna.study.study - INFO - Trial 210 finished with values: [0.04984451550632441, 0.006003416169870722, 0.024077994869048647] and parameters: {'n_layers': 3, 'embedding_dim': 96, 'lr': 0.0034108076646961875, 'lambda_val': 2.8670388049392515e-06, 'batch_size': 2271, 'optimizer': 'Adam'}.
2026-06-05 18:31:01,475 - experiment_functions - INFO - Early stopping at epoch 2200. Best Metrics: (0.05060115820425746, 0.006246232165583762, 0.024181622109517954)
2026-06-05 18:31:01,563 - optuna.study.study - INFO - Trial 211 finished with values: [0.05060115820425746, 0.006246232165583762, 0.024181622109517954] and parameters: {'n_layers': 3, 'embedding_dim': 32, 'lr': 0.0007908861785647595, 'lambda_val': 3.684365830705915e-05, 'batch_size': 4028, 'optimizer': 'RMSprop'}.
2026-06-05 18:31:37,797 - experiment_functions - INFO - Early stopping at epoch 950. Best Metrics: (0.0005065471214278625, 7.870587447250317e-05, 0.0002641321457032579)
2026-06-05 18:31:38,001 - optuna.study.study - INFO - Trial 212 finished with values: [0.0005065471214278625, 7.870587447250317e-05, 0.0002641321457032579] and parameters: {'n_layers': 1, 'embedding_dim': 32, 'lr': 2.3320551057567477e-05, 'lambda_val': 0.005288720124154074, 'batch_size': 4028, 'optimizer': 'RMSprop'}.
2026-06-05 18:34:20,713 - optuna.study.study - INFO - Trial 213 finished with values: [0.07737272709133824, 0.010064304374037108, 0.0419619126778539] and parameters: {'n_layers': 1, 'embedding_dim': 96, 'lr': 0.0007730079936260513, 'lambda_val': 5.587325552332493e-06, 'batch_size': 2665, 'optimizer': 'Adam'}.
2026-06-05 18:34:53,994 - experiment_functions - INFO - Early stopping at epoch 800. Best Metrics: (0.06742115261645783, 0.008336124321789805, 0.03459890952438109)
2026-06-05 18:34:54,066 - optuna.study.study - INFO - Trial 214 finished with values: [0.06742115261645783, 0.008336124321789805, 0.03459890952438109] and parameters: {'n_layers': 2, 'embedding_dim': 32, 'lr': 0.0029470384606335377, 'lambda_val': 5.587325552332493e-06, 'batch_size': 2271, 'optimizer': 'Adam'}.
2026-06-05 18:38:07,320 - optuna.study.study - INFO - Trial 215 finished with values: [0.013685771208138563, 0.00221548663674727, 0.007637368034432174] and parameters: {'n_layers': 2, 'embedding_dim': 256, 'lr': 0.0002549662923287038, 'lambda_val': 0.00625644496588457, 'batch_size': 926, 'optimizer': 'RMSprop'}.
2026-06-05 18:38:42,545 - experiment_functions - INFO - Early stopping at epoch 850. Best Metrics: (0.0601530885096605, 0.007296202022908433, 0.031191401113454708)
2026-06-05 18:38:42,878 - optuna.study.study - INFO - Trial 216 finished with values: [0.0601530885096605, 0.007296202022908433, 0.031191401113454708] and parameters: {'n_layers': 2, 'embedding_dim': 32, 'lr': 0.0034108076646961875, 'lambda_val': 2.2392691089871585e-06, 'batch_size': 2003, 'optimizer': 'Adam'}.
2026-06-05 18:41:25,626 - optuna.study.study - INFO - Trial 217 finished with values: [0.07300672512205297, 0.009133230624958136, 0.0400376361326012] and parameters: {'n_layers': 2, 'embedding_dim': 64, 'lr': 0.0008576367655519577, 'lambda_val': 2.2392691089871585e-06, 'batch_size': 926, 'optimizer': 'Adam'}.
2026-06-05 18:42:30,439 - experiment_functions - INFO - Early stopping at epoch 1550. Best Metrics: (0.06909845264179994, 0.008346171880233105, 0.03485093854236845)
2026-06-05 18:42:31,444 - optuna.study.study - INFO - Trial 218 finished with values: [0.06909845264179994, 0.008346171880233105, 0.03485093854236845] and parameters: {'n_layers': 2, 'embedding_dim': 64, 'lr': 0.0010470286775611781, 'lambda_val': 0.0008180730124640583, 'batch_size': 3475, 'optimizer': 'Adam'}.
2026-06-05 18:42:59,780 - experiment_functions - INFO - Early stopping at epoch 650. Best Metrics: (0.05097259918232028, 0.005981646459910243, 0.0242075910899904)
2026-06-05 18:42:59,868 - optuna.study.study - INFO - Trial 219 finished with values: [0.05097259918232028, 0.005981646459910243, 0.0242075910899904] and parameters: {'n_layers': 2, 'embedding_dim': 64, 'lr': 0.0029470384606335377, 'lambda_val': 5.587325552332493e-06, 'batch_size': 4049, 'optimizer': 'RMSprop'}.
2026-06-05 18:45:37,261 - optuna.study.study - INFO - Trial 220 finished with values: [0.07467647172594745, 0.00909638957733271, 0.039685652995468425] and parameters: {'n_layers': 2, 'embedding_dim': 32, 'lr': 0.0008576367655519577, 'lambda_val': 3.082500502951572e-05, 'batch_size': 2266, 'optimizer': 'Adam'}.
2026-06-05 18:48:16,028 - optuna.study.study - INFO - Trial 221 finished with values: [0.07394822304757584, 0.00921863487172617, 0.038542980772789275] and parameters: {'n_layers': 2, 'embedding_dim': 32, 'lr': 0.0008576367655519577, 'lambda_val': 5.587325552332493e-06, 'batch_size': 2455, 'optimizer': 'Adam'}.
2026-06-05 18:49:27,976 - experiment_functions - INFO - Early stopping at epoch 1850. Best Metrics: (0.00048379414491265486, 8.038046754638624e-05, 0.00021803005098334756)
2026-06-05 18:49:28,059 - optuna.study.study - INFO - Trial 222 finished with values: [0.00048379414491265486, 8.038046754638624e-05, 0.00021803005098334756] and parameters: {'n_layers': 1, 'embedding_dim': 96, 'lr': 1.1785023893854922e-05, 'lambda_val': 0.0003803484426817354, 'batch_size': 4028, 'optimizer': 'RMSprop'}.
2026-06-05 18:52:03,763 - optuna.study.study - INFO - Trial 223 finished with values: [0.057548375190661215, 0.00793254739098399, 0.0327292001223628] and parameters: {'n_layers': 1, 'embedding_dim': 64, 'lr': 0.0010470286775611781, 'lambda_val': 0.0023604176548426264, 'batch_size': 926, 'optimizer': 'Adam'}.
2026-06-05 18:54:53,131 - optuna.study.study - INFO - Trial 224 finished with values: [0.06841993528440707, 0.008599035434389444, 0.036068011422005844] and parameters: {'n_layers': 2, 'embedding_dim': 96, 'lr': 0.0007908861785647595, 'lambda_val': 0.0023604176548426264, 'batch_size': 926, 'optimizer': 'Adam'}.
2026-06-05 18:56:39,130 - experiment_functions - INFO - Early stopping at epoch 2700. Best Metrics: (0.06669120588711296, 0.008158617455958203, 0.034342159289965674)
2026-06-05 18:56:39,212 - optuna.study.study - INFO - Trial 225 finished with values: [0.06669120588711296, 0.008158617455958203, 0.034342159289965674] and parameters: {'n_layers': 2, 'embedding_dim': 32, 'lr': 0.0009590496257981318, 'lambda_val': 0.0011986625901797602, 'batch_size': 1769, 'optimizer': 'RMSprop'}.
2026-06-05 18:59:35,107 - optuna.study.study - INFO - Trial 226 finished with values: [0.07847617236503751, 0.009838234309062898, 0.04245622687153982] and parameters: {'n_layers': 2, 'embedding_dim': 128, 'lr': 0.0007908861785647595, 'lambda_val': 0.0001580551667310673, 'batch_size': 926, 'optimizer': 'Adam'}.
2026-06-05 19:00:21,152 - experiment_functions - INFO - Early stopping at epoch 1050. Best Metrics: (0.0555775928546265, 0.006845736486033895, 0.02855421779348893)
2026-06-05 19:00:21,383 - optuna.study.study - INFO - Trial 227 finished with values: [0.0555775928546265, 0.006845736486033895, 0.02855421779348893] and parameters: {'n_layers': 2, 'embedding_dim': 96, 'lr': 0.0007730079936260513, 'lambda_val': 0.004285518144526943, 'batch_size': 4028, 'optimizer': 'RMSprop'}.
2026-06-05 19:01:10,166 - experiment_functions - INFO - Early stopping at epoch 1150. Best Metrics: (0.08326181039831812, 0.010243485832942595, 0.0434451604313803)
2026-06-05 19:01:10,243 - optuna.study.study - INFO - Trial 228 finished with values: [0.08326181039831812, 0.010243485832942595, 0.0434451604313803] and parameters: {'n_layers': 1, 'embedding_dim': 96, 'lr': 0.0029470384606335377, 'lambda_val': 5.240378342281421e-05, 'batch_size': 2777, 'optimizer': 'Adam'}.
2026-06-05 19:03:43,927 - experiment_functions - INFO - Early stopping at epoch 3900. Best Metrics: (0.07772339230262829, 0.009545180521133364, 0.041567409112608714)
2026-06-05 19:03:44,306 - optuna.study.study - INFO - Trial 229 finished with values: [0.07772339230262829, 0.009545180521133364, 0.041567409112608714] and parameters: {'n_layers': 2, 'embedding_dim': 32, 'lr': 0.0009590496257981318, 'lambda_val': 0.00011375426873786574, 'batch_size': 2266, 'optimizer': 'RMSprop'}.
2026-06-05 19:06:18,494 - optuna.study.study - INFO - Trial 230 finished with values: [0.06548785926795724, 0.008736352066447853, 0.036805341693602854] and parameters: {'n_layers': 1, 'embedding_dim': 32, 'lr': 0.0007912354345926823, 'lambda_val': 0.00011375426873786574, 'batch_size': 3281, 'optimizer': 'Adam'}.
2026-06-05 19:07:23,679 - experiment_functions - INFO - Early stopping at epoch 1150. Best Metrics: (0.0693664837361046, 0.008269140598834485, 0.03447770817085193)
2026-06-05 19:07:24,330 - optuna.study.study - INFO - Trial 231 finished with values: [0.0693664837361046, 0.008269140598834485, 0.03447770817085193] and parameters: {'n_layers': 3, 'embedding_dim': 256, 'lr': 0.0008576367655519577, 'lambda_val': 0.00011375426873786574, 'batch_size': 2271, 'optimizer': 'Adam'}.
2026-06-05 19:08:34,854 - experiment_functions - INFO - Early stopping at epoch 1500. Best Metrics: (0.07744199728723256, 0.008974144282939247, 0.0379711259652247)
2026-06-05 19:08:35,134 - optuna.study.study - INFO - Trial 232 finished with values: [0.07744199728723256, 0.008974144282939247, 0.0379711259652247] and parameters: {'n_layers': 1, 'embedding_dim': 256, 'lr': 0.0029470384606335377, 'lambda_val': 5.587325552332493e-06, 'batch_size': 2271, 'optimizer': 'RMSprop'}.
2026-06-05 19:11:31,534 - optuna.study.study - INFO - Trial 233 finished with values: [0.06021904227520172, 0.007405050572710831, 0.031989179031538126] and parameters: {'n_layers': 3, 'embedding_dim': 96, 'lr': 0.0009590496257981318, 'lambda_val': 3.082500502951572e-05, 'batch_size': 564, 'optimizer': 'RMSprop'}.
2026-06-05 19:11:53,197 - experiment_functions - INFO - Early stopping at epoch 500. Best Metrics: (0.0002996111470167351, 5.3586978364257486e-05, 0.000157682808813055)
2026-06-05 19:11:53,300 - optuna.study.study - INFO - Trial 234 finished with values: [0.0002996111470167351, 5.3586978364257486e-05, 0.000157682808813055] and parameters: {'n_layers': 1, 'embedding_dim': 128, 'lr': 0.0007908861785647595, 'lambda_val': 0.0037563811732764327, 'batch_size': 4028, 'optimizer': 'SGD'}.
2026-06-05 19:12:36,610 - experiment_functions - INFO - Early stopping at epoch 950. Best Metrics: (0.04329662158671206, 0.005387165918681761, 0.020161613405747028)
2026-06-05 19:12:36,691 - optuna.study.study - INFO - Trial 235 finished with values: [0.04329662158671206, 0.005387165918681761, 0.020161613405747028] and parameters: {'n_layers': 3, 'embedding_dim': 96, 'lr': 0.001414374009860838, 'lambda_val': 0.0023604176548426264, 'batch_size': 926, 'optimizer': 'Adam'}.
2026-06-05 19:13:40,947 - experiment_functions - INFO - Early stopping at epoch 1500. Best Metrics: (0.05719691708043497, 0.00718400428695827, 0.02890709046955611)
2026-06-05 19:13:41,636 - optuna.study.study - INFO - Trial 236 finished with values: [0.05719691708043497, 0.00718400428695827, 0.02890709046955611] and parameters: {'n_layers': 2, 'embedding_dim': 96, 'lr': 0.0007730079936260513, 'lambda_val': 0.004467439026738161, 'batch_size': 1769, 'optimizer': 'RMSprop'}.
2026-06-05 19:15:03,441 - experiment_functions - INFO - Early stopping at epoch 2050. Best Metrics: (0.06978130205593794, 0.008272489784982249, 0.03478184209846057)
2026-06-05 19:15:03,573 - optuna.study.study - INFO - Trial 237 finished with values: [0.06978130205593794, 0.008272489784982249, 0.03478184209846057] and parameters: {'n_layers': 2, 'embedding_dim': 32, 'lr': 0.0018762947263184326, 'lambda_val': 5.587325552332493e-06, 'batch_size': 2271, 'optimizer': 'Adam'}.
2026-06-05 19:17:54,042 - experiment_functions - INFO - Early stopping at epoch 3150. Best Metrics: (0.049852496314651586, 0.005701989416571773, 0.023493507308475183)
2026-06-05 19:17:54,117 - optuna.study.study - INFO - Trial 238 finished with values: [0.049852496314651586, 0.005701989416571773, 0.023493507308475183] and parameters: {'n_layers': 3, 'embedding_dim': 256, 'lr': 0.001646411856301354, 'lambda_val': 7.487535492065269e-05, 'batch_size': 2271, 'optimizer': 'RMSprop'}.
2026-06-05 19:18:23,887 - experiment_functions - INFO - Early stopping at epoch 700. Best Metrics: (0.060708209761198416, 0.007657914126867171, 0.031078777516945887)
2026-06-05 19:18:23,965 - optuna.study.study - INFO - Trial 239 finished with values: [0.060708209761198416, 0.007657914126867171, 0.031078777516945887] and parameters: {'n_layers': 2, 'embedding_dim': 64, 'lr': 0.0029470384606335377, 'lambda_val': 0.0011513204288259027, 'batch_size': 2947, 'optimizer': 'Adam'}.
2026-06-05 19:21:07,929 - optuna.study.study - INFO - Trial 240 finished with values: [0.09036443514825959, 0.011104226672918481, 0.046770592368745256] and parameters: {'n_layers': 1, 'embedding_dim': 96, 'lr': 0.0010470286775611781, 'lambda_val': 0.00020574260712132375, 'batch_size': 4028, 'optimizer': 'Adam'}.
2026-06-05 19:21:33,480 - experiment_functions - INFO - Early stopping at epoch 500. Best Metrics: (0.0004545520445392485, 7.53566883247371e-05, 0.0002403884098530834)
2026-06-05 19:21:33,571 - optuna.study.study - INFO - Trial 241 finished with values: [0.0004545520445392485, 7.53566883247371e-05, 0.0002403884098530834] and parameters: {'n_layers': 2, 'embedding_dim': 256, 'lr': 0.0029470384606335377, 'lambda_val': 5.587325552332493e-06, 'batch_size': 2947, 'optimizer': 'SGD'}.
2026-06-05 19:24:27,376 - optuna.study.study - INFO - Trial 242 finished with values: [0.07861565194521045, 0.009918614776609283, 0.04217114231631434] and parameters: {'n_layers': 2, 'embedding_dim': 128, 'lr': 0.0005272741245061854, 'lambda_val': 2.8670388049392515e-06, 'batch_size': 2271, 'optimizer': 'Adam'}.
2026-06-05 19:27:10,385 - optuna.study.study - INFO - Trial 243 finished with values: [0.07604739962138804, 0.009493268135842992, 0.041970633719719944] and parameters: {'n_layers': 2, 'embedding_dim': 64, 'lr': 0.0008576367655519577, 'lambda_val': 0.00011375426873786574, 'batch_size': 926, 'optimizer': 'Adam'}.
2026-06-05 19:27:33,427 - experiment_functions - INFO - Early stopping at epoch 550. Best Metrics: (0.0004750563380496129, 7.033290910308794e-05, 0.00021611212122685152)
2026-06-05 19:27:33,495 - optuna.study.study - INFO - Trial 244 finished with values: [0.0004750563380496129, 7.033290910308794e-05, 0.00021611212122685152] and parameters: {'n_layers': 1, 'embedding_dim': 96, 'lr': 1.37506111389931e-05, 'lambda_val': 2.8670388049392515e-06, 'batch_size': 2271, 'optimizer': 'RMSprop'}.
2026-06-05 19:28:04,524 - experiment_functions - INFO - Early stopping at epoch 700. Best Metrics: (0.06546600291694958, 0.008269140598834483, 0.03317632757249867)
2026-06-05 19:28:04,835 - optuna.study.study - INFO - Trial 245 finished with values: [0.06546600291694958, 0.008269140598834483, 0.03317632757249867] and parameters: {'n_layers': 1, 'embedding_dim': 128, 'lr': 0.0029470384606335377, 'lambda_val': 0.0011513204288259027, 'batch_size': 2974, 'optimizer': 'RMSprop'}.
2026-06-05 19:28:47,417 - experiment_functions - INFO - Early stopping at epoch 1000. Best Metrics: (0.07364536878216714, 0.008990890213678078, 0.037113974862516046)
2026-06-05 19:28:47,496 - optuna.study.study - INFO - Trial 246 finished with values: [0.07364536878216714, 0.008990890213678078, 0.037113974862516046] and parameters: {'n_layers': 2, 'embedding_dim': 64, 'lr': 0.0018762947263184326, 'lambda_val': 5.587325552332493e-06, 'batch_size': 2504, 'optimizer': 'Adam'}.
2026-06-05 19:31:22,398 - optuna.study.study - INFO - Trial 247 finished with values: [0.06207327832999977, 0.007972737624757184, 0.03348542872329265] and parameters: {'n_layers': 2, 'embedding_dim': 32, 'lr': 0.0004666871232718281, 'lambda_val': 0.00011375426873786574, 'batch_size': 3366, 'optimizer': 'RMSprop'}.
2026-06-05 19:32:14,992 - experiment_functions - INFO - Early stopping at epoch 1300. Best Metrics: (0.044098424933197475, 0.0054357291178243694, 0.0215828100820906)
2026-06-05 19:32:15,075 - optuna.study.study - INFO - Trial 248 finished with values: [0.044098424933197475, 0.0054357291178243694, 0.0215828100820906] and parameters: {'n_layers': 4, 'embedding_dim': 32, 'lr': 0.0010470286775611781, 'lambda_val': 0.00020574260712132375, 'batch_size': 3405, 'optimizer': 'Adam'}.
2026-06-05 19:34:55,413 - optuna.study.study - INFO - Trial 249 finished with values: [0.07578530030360178, 0.009453077902069796, 0.04095164588505126] and parameters: {'n_layers': 2, 'embedding_dim': 64, 'lr': 0.0008576367655519577, 'lambda_val': 0.0002713017942370913, 'batch_size': 926, 'optimizer': 'RMSprop'}.
2026-06-05 19:37:33,974 - optuna.study.study - INFO - Trial 250 finished with values: [0.07326130528264974, 0.00965235447786188, 0.04114796875235713] and parameters: {'n_layers': 1, 'embedding_dim': 96, 'lr': 0.0010470286775611781, 'lambda_val': 5.587325552332493e-06, 'batch_size': 1220, 'optimizer': 'Adam'}.
2026-06-05 19:38:14,450 - experiment_functions - INFO - Early stopping at epoch 900. Best Metrics: (0.05865735928483947, 0.007078504923303637, 0.029589703002867094)
2026-06-05 19:38:14,778 - optuna.study.study - INFO - Trial 251 finished with values: [0.05865735928483947, 0.007078504923303637, 0.029589703002867094] and parameters: {'n_layers': 3, 'embedding_dim': 96, 'lr': 0.0010470286775611781, 'lambda_val': 7.487535492065269e-05, 'batch_size': 2271, 'optimizer': 'RMSprop'}.
2026-06-05 19:38:40,197 - experiment_functions - INFO - Early stopping at epoch 500. Best Metrics: (0.0005140651722130568, 9.042802598968451e-05, 0.00023123615710062738)
2026-06-05 19:38:40,839 - optuna.study.study - INFO - Trial 252 finished with values: [0.0005140651722130568, 9.042802598968451e-05, 0.00023123615710062738] and parameters: {'n_layers': 2, 'embedding_dim': 256, 'lr': 0.0007730079936260513, 'lambda_val': 0.005288720124154074, 'batch_size': 2947, 'optimizer': 'SGD'}.
2026-06-05 19:39:16,776 - experiment_functions - INFO - Early stopping at epoch 900. Best Metrics: (0.06219408927820294, 0.00790910308794963, 0.03203516245368968)
2026-06-05 19:39:16,950 - optuna.study.study - INFO - Trial 253 finished with values: [0.06219408927820294, 0.00790910308794963, 0.03203516245368968] and parameters: {'n_layers': 2, 'embedding_dim': 32, 'lr': 0.0018762947263184326, 'lambda_val': 0.0010325696441814036, 'batch_size': 2271, 'optimizer': 'Adam'}.
2026-06-05 19:41:55,668 - optuna.study.study - INFO - Trial 254 finished with values: [0.07704260575408789, 0.010045883850224395, 0.04179033063661213] and parameters: {'n_layers': 1, 'embedding_dim': 96, 'lr': 0.0007730079936260513, 'lambda_val': 5.587325552332493e-06, 'batch_size': 2546, 'optimizer': 'Adam'}.
