2026-06-06 06:35:44,738 - optuna.study.study - INFO - Trial 64 finished with values: [0.06898008521815732, 0.008783240672516578, 0.03717568653669394] and parameters: {'n_layers': 3, 'embedding_dim': 256, 'lr': 0.00021389021150995766, 'lambda_val': 1.3398416216824042e-06, 'batch_size': 3867, 'optimizer': 'RMSprop'}.
2026-06-06 06:36:25,708 - experiment_functions - INFO - Early stopping at epoch 1000. Best Metrics: (0.05274786120118974, 0.006140732801929132, 0.025174524665306952)
2026-06-06 06:36:25,878 - optuna.study.study - INFO - Trial 65 finished with values: [0.05274786120118974, 0.006140732801929132, 0.025174524665306952] and parameters: {'n_layers': 1, 'embedding_dim': 64, 'lr': 0.006829910291098024, 'lambda_val': 2.5535184182963008e-05, 'batch_size': 3521, 'optimizer': 'RMSprop'}.
2026-06-06 06:36:56,611 - experiment_functions - INFO - Early stopping at epoch 500. Best Metrics: (0.00046630848407474196, 8.205506062026927e-05, 0.0002177574925215833)
2026-06-06 06:36:56,915 - optuna.study.study - INFO - Trial 66 finished with values: [0.00046630848407474196, 8.205506062026927e-05, 0.0002177574925215833] and parameters: {'n_layers': 4, 'embedding_dim': 256, 'lr': 0.013769923730273376, 'lambda_val': 3.453094155452938e-05, 'batch_size': 3112, 'optimizer': 'SGD'}.
2026-06-06 06:37:18,988 - experiment_functions - INFO - Early stopping at epoch 500. Best Metrics: (0.0006264409896962967, 7.033290910308797e-05, 0.00026004973830343314)
2026-06-06 06:37:19,076 - optuna.study.study - INFO - Trial 67 finished with values: [0.0006264409896962967, 7.033290910308797e-05, 0.00026004973830343314] and parameters: {'n_layers': 3, 'embedding_dim': 64, 'lr': 0.004471753451787057, 'lambda_val': 0.001602265573028567, 'batch_size': 2911, 'optimizer': 'SGD'}.
2026-06-06 06:37:51,710 - experiment_functions - INFO - Early stopping at epoch 700. Best Metrics: (0.0005163979688912919, 7.033290910308795e-05, 0.00024508241807784874)
2026-06-06 06:37:51,797 - optuna.study.study - INFO - Trial 68 finished with values: [0.0005163979688912919, 7.033290910308795e-05, 0.00024508241807784874] and parameters: {'n_layers': 3, 'embedding_dim': 128, 'lr': 1.742366775733471e-05, 'lambda_val': 2.5535184182963008e-05, 'batch_size': 3376, 'optimizer': 'RMSprop'}.
2026-06-06 06:38:20,519 - experiment_functions - INFO - Early stopping at epoch 650. Best Metrics: (0.04503247797292209, 0.005487641503114744, 0.021835066957904454)
2026-06-06 06:38:20,621 - optuna.study.study - INFO - Trial 69 finished with values: [0.04503247797292209, 0.005487641503114744, 0.021835066957904454] and parameters: {'n_layers': 1, 'embedding_dim': 128, 'lr': 0.005828487948467767, 'lambda_val': 0.001602265573028567, 'batch_size': 3359, 'optimizer': 'RMSprop'}.
2026-06-06 06:40:23,294 - experiment_functions - INFO - Early stopping at epoch 2900. Best Metrics: (0.034376808267289824, 0.004169736753968785, 0.015888478070714578)
2026-06-06 06:40:23,382 - optuna.study.study - INFO - Trial 70 finished with values: [0.034376808267289824, 0.004169736753968785, 0.015888478070714578] and parameters: {'n_layers': 4, 'embedding_dim': 64, 'lr': 0.004471753451787057, 'lambda_val': 3.453094155452938e-05, 'batch_size': 1350, 'optimizer': 'RMSprop'}.
2026-06-06 06:40:46,643 - experiment_functions - INFO - Early stopping at epoch 500. Best Metrics: (0.00026544150898596356, 5.191238529037444e-05, 0.0001361275554261922)
2026-06-06 06:40:46,721 - optuna.study.study - INFO - Trial 71 finished with values: [0.00026544150898596356, 5.191238529037444e-05, 0.0001361275554261922] and parameters: {'n_layers': 1, 'embedding_dim': 256, 'lr': 0.01433727156286783, 'lambda_val': 5.315262969436241e-05, 'batch_size': 3428, 'optimizer': 'SGD'}.
2026-06-06 06:41:09,169 - experiment_functions - INFO - Early stopping at epoch 500. Best Metrics: (0.00032853329547944006, 6.530912988143881e-05, 0.00014533364408144024)
2026-06-06 06:41:09,247 - optuna.study.study - INFO - Trial 72 finished with values: [0.00032853329547944006, 6.530912988143881e-05, 0.00014533364408144024] and parameters: {'n_layers': 4, 'embedding_dim': 64, 'lr': 0.0001831080422236499, 'lambda_val': 0.00021855955357733515, 'batch_size': 1754, 'optimizer': 'SGD'}.
2026-06-06 06:41:38,133 - experiment_functions - INFO - Early stopping at epoch 550. Best Metrics: (0.029281412428790128, 0.003603724294996316, 0.014424982813194997)
2026-06-06 06:41:38,227 - optuna.study.study - INFO - Trial 73 finished with values: [0.029281412428790128, 0.003603724294996316, 0.014424982813194997] and parameters: {'n_layers': 2, 'embedding_dim': 256, 'lr': 0.02638164782330716, 'lambda_val': 1.3398416216824042e-06, 'batch_size': 2323, 'optimizer': 'RMSprop'}.
2026-06-06 06:44:15,696 - experiment_functions - INFO - Early stopping at epoch 3850. Best Metrics: (0.03735891879421295, 0.004276910710697301, 0.01722506545563075)
2026-06-06 06:44:15,782 - optuna.study.study - INFO - Trial 74 finished with values: [0.03735891879421295, 0.004276910710697301, 0.01722506545563075] and parameters: {'n_layers': 3, 'embedding_dim': 64, 'lr': 0.003907207464051617, 'lambda_val': 1.2021465828711608e-06, 'batch_size': 667, 'optimizer': 'Adam'}.
2026-06-06 06:44:36,433 - experiment_functions - INFO - Early stopping at epoch 500. Best Metrics: (0.0006531942223742275, 8.540424676803538e-05, 0.00028298377561270037)
2026-06-06 06:44:36,523 - optuna.study.study - INFO - Trial 75 finished with values: [0.0006531942223742275, 8.540424676803538e-05, 0.00028298377561270037] and parameters: {'n_layers': 2, 'embedding_dim': 32, 'lr': 1.1904901716070201e-05, 'lambda_val': 5.315262969436241e-05, 'batch_size': 3428, 'optimizer': 'SGD'}.
2026-06-06 06:44:57,192 - experiment_functions - INFO - Early stopping at epoch 500. Best Metrics: (0.0005468938644903796, 8.372965369415233e-05, 0.00026537419428388637)
2026-06-06 06:44:57,460 - optuna.study.study - INFO - Trial 76 finished with values: [0.0005468938644903796, 8.372965369415233e-05, 0.00026537419428388637] and parameters: {'n_layers': 2, 'embedding_dim': 32, 'lr': 0.0007900602642959323, 'lambda_val': 1.955436327810479e-06, 'batch_size': 2031, 'optimizer': 'SGD'}.
2026-06-06 06:47:59,125 - optuna.study.study - INFO - Trial 77 finished with values: [0.037582506998656534, 0.004224998325406926, 0.017224994845894986] and parameters: {'n_layers': 3, 'embedding_dim': 128, 'lr': 0.006829910291098024, 'lambda_val': 1.2021465828711608e-06, 'batch_size': 1079, 'optimizer': 'Adam'}.
2026-06-06 06:48:51,990 - experiment_functions - INFO - Early stopping at epoch 1300. Best Metrics: (0.06744013244215104, 0.008150244490588788, 0.03420794447821357)
2026-06-06 06:48:52,076 - optuna.study.study - INFO - Trial 78 finished with values: [0.06744013244215104, 0.008150244490588788, 0.03420794447821357] and parameters: {'n_layers': 2, 'embedding_dim': 32, 'lr': 0.0019509035141199726, 'lambda_val': 1.3036977819163817e-06, 'batch_size': 3209, 'optimizer': 'Adam'}.
2026-06-06 06:51:48,967 - optuna.study.study - INFO - Trial 79 finished with values: [0.039715172527787175, 0.005135976957599303, 0.01873036432101885] and parameters: {'n_layers': 1, 'embedding_dim': 256, 'lr': 0.06778474199549463, 'lambda_val': 0.0004272001150018832, 'batch_size': 3115, 'optimizer': 'RMSprop'}.
2026-06-06 06:52:12,403 - experiment_functions - INFO - Early stopping at epoch 500. Best Metrics: (0.0006644187806795616, 8.205506062026926e-05, 0.00029000899965435183)
2026-06-06 06:52:12,484 - optuna.study.study - INFO - Trial 80 finished with values: [0.0006644187806795616, 8.205506062026926e-05, 0.00029000899965435183] and parameters: {'n_layers': 1, 'embedding_dim': 256, 'lr': 2.0227993886447854e-05, 'lambda_val': 0.06940078662070691, 'batch_size': 818, 'optimizer': 'SGD'}.
2026-06-06 06:53:27,673 - experiment_functions - INFO - Early stopping at epoch 1850. Best Metrics: (0.014521332189837142, 0.0018638220912318307, 0.006552878256933714)
2026-06-06 06:53:27,787 - optuna.study.study - INFO - Trial 81 finished with values: [0.014521332189837142, 0.0018638220912318307, 0.006552878256933714] and parameters: {'n_layers': 1, 'embedding_dim': 128, 'lr': 0.017061469787437597, 'lambda_val': 0.03327536519765874, 'batch_size': 3655, 'optimizer': 'RMSprop'}.
2026-06-06 06:53:51,552 - experiment_functions - INFO - Early stopping at epoch 500. Best Metrics: (0.0004631155570754245, 7.703128139862015e-05, 0.0002103617061513807)
2026-06-06 06:53:52,742 - optuna.study.study - INFO - Trial 82 finished with values: [0.0004631155570754245, 7.703128139862015e-05, 0.0002103617061513807] and parameters: {'n_layers': 4, 'embedding_dim': 96, 'lr': 0.06778474199549463, 'lambda_val': 0.0004272001150018832, 'batch_size': 998, 'optimizer': 'SGD'}.
2026-06-06 06:55:47,167 - experiment_functions - INFO - Early stopping at epoch 3050. Best Metrics: (0.0006676597301786201, 8.540424676803538e-05, 0.00031265882707564154)
2026-06-06 06:55:47,281 - optuna.study.study - INFO - Trial 83 finished with values: [0.0006676597301786201, 8.540424676803538e-05, 0.00031265882707564154] and parameters: {'n_layers': 1, 'embedding_dim': 64, 'lr': 0.00011274902426104014, 'lambda_val': 3.453094155452938e-05, 'batch_size': 2989, 'optimizer': 'Adam'}.
2026-06-06 06:56:08,619 - experiment_functions - INFO - Early stopping at epoch 500. Best Metrics: (0.00047571098771366206, 8.038046754638624e-05, 0.00021130540000396833)
2026-06-06 06:56:09,649 - optuna.study.study - INFO - Trial 84 finished with values: [0.00047571098771366206, 8.038046754638624e-05, 0.00021130540000396833] and parameters: {'n_layers': 2, 'embedding_dim': 64, 'lr': 0.09213127506742724, 'lambda_val': 1.3792758545918358e-05, 'batch_size': 1587, 'optimizer': 'SGD'}.
2026-06-06 06:56:33,108 - experiment_functions - INFO - Early stopping at epoch 550. Best Metrics: (0.003758460884715022, 0.0005844329827851832, 0.0019021499611172844)
2026-06-06 06:56:33,212 - optuna.study.study - INFO - Trial 85 finished with values: [0.003758460884715022, 0.0005844329827851832, 0.0019021499611172844] and parameters: {'n_layers': 1, 'embedding_dim': 96, 'lr': 0.06778474199549463, 'lambda_val': 0.0004272001150018832, 'batch_size': 1057, 'optimizer': 'RMSprop'}.
2026-06-06 06:58:00,015 - experiment_functions - INFO - Early stopping at epoch 1950. Best Metrics: (0.012564254717724672, 0.0015757920825239468, 0.0055540097711588654)
2026-06-06 06:58:00,090 - optuna.study.study - INFO - Trial 86 finished with values: [0.012564254717724672, 0.0015757920825239468, 0.0055540097711588654] and parameters: {'n_layers': 3, 'embedding_dim': 128, 'lr': 0.0006711529294623438, 'lambda_val': 0.05520066514814425, 'batch_size': 1712, 'optimizer': 'RMSprop'}.
2026-06-06 06:58:19,890 - experiment_functions - INFO - Early stopping at epoch 500. Best Metrics: (0.0004544597489197798, 7.033290910308795e-05, 0.0002062067900023549)
2026-06-06 06:58:20,324 - optuna.study.study - INFO - Trial 87 finished with values: [0.0004544597489197798, 7.033290910308795e-05, 0.0002062067900023549] and parameters: {'n_layers': 1, 'embedding_dim': 32, 'lr': 1.7406079260870917e-05, 'lambda_val': 0.00020186323866532547, 'batch_size': 3209, 'optimizer': 'SGD'}.
2026-06-06 06:58:44,118 - experiment_functions - INFO - Early stopping at epoch 600. Best Metrics: (0.0006407899112190202, 9.37772121374506e-05, 0.00036140345037047805)
2026-06-06 06:58:44,222 - optuna.study.study - INFO - Trial 88 finished with values: [0.0006407899112190202, 9.37772121374506e-05, 0.00036140345037047805] and parameters: {'n_layers': 1, 'embedding_dim': 32, 'lr': 0.00021389021150995766, 'lambda_val': 0.0034713085104803743, 'batch_size': 1934, 'optimizer': 'Adam'}.
2026-06-06 06:59:28,121 - experiment_functions - INFO - Early stopping at epoch 1050. Best Metrics: (0.0004033597801178076, 7.368209525085404e-05, 0.00020005627481065497)
2026-06-06 06:59:28,355 - optuna.study.study - INFO - Trial 89 finished with values: [0.0004033597801178076, 7.368209525085404e-05, 0.00020005627481065497] and parameters: {'n_layers': 4, 'embedding_dim': 64, 'lr': 6.402106726977996e-05, 'lambda_val': 0.001602265573028567, 'batch_size': 1350, 'optimizer': 'Adam'}.
2026-06-06 07:00:31,785 - experiment_functions - INFO - Early stopping at epoch 1500. Best Metrics: (0.06208606300218807, 0.007674660057606002, 0.031082898810545673)
2026-06-06 07:00:31,921 - optuna.study.study - INFO - Trial 90 finished with values: [0.06208606300218807, 0.007674660057606002, 0.031082898810545673] and parameters: {'n_layers': 2, 'embedding_dim': 96, 'lr': 0.0006810282647636203, 'lambda_val': 0.003010182335575881, 'batch_size': 3082, 'optimizer': 'RMSprop'}.
2026-06-06 07:01:05,865 - experiment_functions - INFO - Early stopping at epoch 700. Best Metrics: (0.0748631929538092, 0.009201888940987342, 0.03790519723694358)
2026-06-06 07:01:06,156 - optuna.study.study - INFO - Trial 91 finished with values: [0.0748631929538092, 0.009201888940987342, 0.03790519723694358] and parameters: {'n_layers': 1, 'embedding_dim': 256, 'lr': 0.005828487948467767, 'lambda_val': 7.265971768922724e-05, 'batch_size': 3359, 'optimizer': 'Adam'}.
2026-06-06 07:01:30,751 - experiment_functions - INFO - Early stopping at epoch 550. Best Metrics: (0.021685944666660757, 0.0025403576930805817, 0.010210843033099394)
2026-06-06 07:01:30,845 - optuna.study.study - INFO - Trial 92 finished with values: [0.021685944666660757, 0.0025403576930805817, 0.010210843033099394] and parameters: {'n_layers': 2, 'embedding_dim': 96, 'lr': 0.0933995728246717, 'lambda_val': 3.996555780966423e-06, 'batch_size': 3655, 'optimizer': 'Adam'}.
2026-06-06 07:01:54,360 - experiment_functions - INFO - Early stopping at epoch 500. Best Metrics: (0.00048799528766536307, 7.368209525085404e-05, 0.00021936906798278666)
2026-06-06 07:01:54,437 - optuna.study.study - INFO - Trial 93 finished with values: [0.00048799528766536307, 7.368209525085404e-05, 0.00021936906798278666] and parameters: {'n_layers': 1, 'embedding_dim': 256, 'lr': 7.252908008304454e-05, 'lambda_val': 2.0985468033383384e-06, 'batch_size': 3502, 'optimizer': 'SGD'}.
2026-06-06 07:02:32,634 - experiment_functions - INFO - Early stopping at epoch 950. Best Metrics: (0.03219878590527508, 0.0036924777279121173, 0.014630036550333219)
2026-06-06 07:02:32,729 - optuna.study.study - INFO - Trial 94 finished with values: [0.03219878590527508, 0.0036924777279121173, 0.014630036550333219] and parameters: {'n_layers': 2, 'embedding_dim': 32, 'lr': 0.01433727156286783, 'lambda_val': 5.315262969436241e-05, 'batch_size': 3428, 'optimizer': 'RMSprop'}.
2026-06-06 07:02:57,841 - experiment_functions - INFO - Early stopping at epoch 600. Best Metrics: (0.05666316284150605, 0.007019894165717732, 0.029154677230505553)
2026-06-06 07:02:57,933 - optuna.study.study - INFO - Trial 95 finished with values: [0.05666316284150605, 0.007019894165717732, 0.029154677230505553] and parameters: {'n_layers': 1, 'embedding_dim': 64, 'lr': 0.017061469787437597, 'lambda_val': 5.510107267630662e-06, 'batch_size': 3655, 'optimizer': 'Adam'}.
2026-06-06 07:03:21,188 - experiment_functions - INFO - Early stopping at epoch 500. Best Metrics: (0.00048731004487982086, 8.372965369415233e-05, 0.00023995464714878135)
2026-06-06 07:03:21,278 - optuna.study.study - INFO - Trial 96 finished with values: [0.00048731004487982086, 8.372965369415233e-05, 0.00023995464714878135] and parameters: {'n_layers': 4, 'embedding_dim': 96, 'lr': 0.0017827212934439936, 'lambda_val': 0.019903917190942273, 'batch_size': 998, 'optimizer': 'SGD'}.
2026-06-06 07:04:18,205 - experiment_functions - INFO - Early stopping at epoch 1300. Best Metrics: (0.04166183497282298, 0.004719003282202425, 0.019569140923125696)
2026-06-06 07:04:18,288 - optuna.study.study - INFO - Trial 97 finished with values: [0.04166183497282298, 0.004719003282202425, 0.019569140923125696] and parameters: {'n_layers': 3, 'embedding_dim': 96, 'lr': 0.004471753451787057, 'lambda_val': 7.734626957073474e-06, 'batch_size': 3502, 'optimizer': 'RMSprop'}.
2026-06-06 07:04:38,792 - experiment_functions - INFO - Early stopping at epoch 500. Best Metrics: (0.0005402371076681862, 8.372965369415233e-05, 0.00023355846451408912)
2026-06-06 07:04:38,968 - optuna.study.study - INFO - Trial 98 finished with values: [0.0005402371076681862, 8.372965369415233e-05, 0.00023355846451408912] and parameters: {'n_layers': 1, 'embedding_dim': 32, 'lr': 0.0019509035141199726, 'lambda_val': 4.2735070605297645e-06, 'batch_size': 3082, 'optimizer': 'SGD'}.
2026-06-06 07:05:09,746 - experiment_functions - INFO - Early stopping at epoch 500. Best Metrics: (0.00046326467566718335, 8.038046754638624e-05, 0.00021109512858984148)
2026-06-06 07:05:10,587 - optuna.study.study - INFO - Trial 99 finished with values: [0.00046326467566718335, 8.038046754638624e-05, 0.00021109512858984148] and parameters: {'n_layers': 4, 'embedding_dim': 256, 'lr': 2.8474638397626485e-05, 'lambda_val': 0.02051584646892502, 'batch_size': 2241, 'optimizer': 'SGD'}.
2026-06-06 07:05:54,609 - experiment_functions - INFO - Early stopping at epoch 1100. Best Metrics: (0.03146670633256018, 0.0035417643512626437, 0.014225507436218367)
2026-06-06 07:05:54,958 - optuna.study.study - INFO - Trial 100 finished with values: [0.03146670633256018, 0.0035417643512626437, 0.014225507436218367] and parameters: {'n_layers': 2, 'embedding_dim': 32, 'lr': 0.01433727156286783, 'lambda_val': 5.315262969436241e-05, 'batch_size': 3556, 'optimizer': 'RMSprop'}.
2026-06-06 07:09:19,477 - experiment_functions - INFO - Early stopping at epoch 3700. Best Metrics: (0.0777493480586432, 0.00935092772456293, 0.04089445269289645)
2026-06-06 07:09:19,572 - optuna.study.study - INFO - Trial 101 finished with values: [0.0777493480586432, 0.00935092772456293, 0.04089445269289645] and parameters: {'n_layers': 3, 'embedding_dim': 256, 'lr': 0.0003834700215967704, 'lambda_val': 1.3398416216824042e-06, 'batch_size': 3981, 'optimizer': 'RMSprop'}.
2026-06-06 07:11:45,671 - experiment_functions - INFO - Early stopping at epoch 2450. Best Metrics: (0.03704327475867532, 0.0038549132560787725, 0.016953118388833063)
2026-06-06 07:11:45,741 - optuna.study.study - INFO - Trial 102 finished with values: [0.03704327475867532, 0.0038549132560787725, 0.016953118388833063] and parameters: {'n_layers': 4, 'embedding_dim': 256, 'lr': 0.013769923730273376, 'lambda_val': 1.3398416216824042e-06, 'batch_size': 3867, 'optimizer': 'Adam'}.
2026-06-06 07:12:34,163 - experiment_functions - INFO - Early stopping at epoch 1200. Best Metrics: (0.06091987581618059, 0.007842119364994307, 0.031124309431014904)
2026-06-06 07:12:34,237 - optuna.study.study - INFO - Trial 103 finished with values: [0.06091987581618059, 0.007842119364994307, 0.031124309431014904] and parameters: {'n_layers': 1, 'embedding_dim': 32, 'lr': 0.0017827212934439936, 'lambda_val': 0.003998877390754319, 'batch_size': 2911, 'optimizer': 'RMSprop'}.
2026-06-06 07:12:58,096 - experiment_functions - INFO - Early stopping at epoch 550. Best Metrics: (0.004918674047425275, 0.0007234242079174761, 0.0025060161041687914)
2026-06-06 07:12:58,214 - optuna.study.study - INFO - Trial 104 finished with values: [0.004918674047425275, 0.0007234242079174761, 0.0025060161041687914] and parameters: {'n_layers': 1, 'embedding_dim': 128, 'lr': 0.0933995728246717, 'lambda_val': 0.003281160907046789, 'batch_size': 1444, 'optimizer': 'Adam'}.
2026-06-06 07:13:44,068 - experiment_functions - INFO - Early stopping at epoch 1150. Best Metrics: (0.030859750851032295, 0.003828119766896644, 0.014825007003700513)
2026-06-06 07:13:44,437 - optuna.study.study - INFO - Trial 105 finished with values: [0.030859750851032295, 0.003828119766896644, 0.014825007003700513] and parameters: {'n_layers': 1, 'embedding_dim': 64, 'lr': 0.013766889767599102, 'lambda_val': 7.265971768922724e-05, 'batch_size': 2069, 'optimizer': 'RMSprop'}.
2026-06-06 07:14:47,298 - experiment_functions - INFO - Early stopping at epoch 1550. Best Metrics: (0.06299669630827974, 0.007440217027262375, 0.030981419351307226)
2026-06-06 07:14:47,413 - optuna.study.study - INFO - Trial 106 finished with values: [0.06299669630827974, 0.007440217027262375, 0.030981419351307226] and parameters: {'n_layers': 1, 'embedding_dim': 64, 'lr': 0.004471753451787057, 'lambda_val': 7.265971768922724e-05, 'batch_size': 1350, 'optimizer': 'RMSprop'}.
2026-06-06 07:17:25,469 - optuna.study.study - INFO - Trial 107 finished with values: [0.09003183204781416, 0.010864759863353205, 0.048083943325192585] and parameters: {'n_layers': 1, 'embedding_dim': 32, 'lr': 0.0019509035141199726, 'lambda_val': 1.3036977819163817e-06, 'batch_size': 3209, 'optimizer': 'RMSprop'}.
2026-06-06 07:20:16,907 - optuna.study.study - INFO - Trial 108 finished with values: [0.0705818016562293, 0.009034429633599036, 0.039018835980855] and parameters: {'n_layers': 2, 'embedding_dim': 128, 'lr': 0.00033582122517218145, 'lambda_val': 4.2735070605297645e-06, 'batch_size': 3649, 'optimizer': 'RMSprop'}.
2026-06-06 07:20:48,048 - experiment_functions - INFO - Early stopping at epoch 550. Best Metrics: (0.015620755713944357, 0.0018537745327885323, 0.007159864087433798)
2026-06-06 07:20:48,133 - optuna.study.study - INFO - Trial 109 finished with values: [0.015620755713944357, 0.0018537745327885323, 0.007159864087433798] and parameters: {'n_layers': 3, 'embedding_dim': 256, 'lr': 0.0560051538676415, 'lambda_val': 0.001958251317392381, 'batch_size': 2911, 'optimizer': 'Adam'}.
2026-06-06 07:21:16,013 - experiment_functions - INFO - Early stopping at epoch 600. Best Metrics: (0.05377130761095639, 0.006425413624489249, 0.024863226370251804)
