2026-06-05 12:48:57,160 - optuna.study.study - INFO - Trial 295 finished with values: [0.07798191337955897, 0.010271953915198608, 0.043999790777036515] and parameters: {'n_layers': 1, 'embedding_dim': 256, 'lr': 0.0006201349398045224, 'lambda_val': 0.00012250709547244776, 'batch_size': 2100, 'optimizer': 'RMSprop'}.
2026-06-05 12:51:36,899 - optuna.study.study - INFO - Trial 296 finished with values: [0.07722586478281972, 0.009429633599035436, 0.040857976498380265] and parameters: {'n_layers': 1, 'embedding_dim': 64, 'lr': 0.0023440150084551373, 'lambda_val': 0.0004967295342867077, 'batch_size': 617, 'optimizer': 'RMSprop'}.
2026-06-05 12:52:22,074 - experiment_functions - INFO - Early stopping at epoch 850. Best Metrics: (0.06853005859896363, 0.00823397414428294, 0.03461700511248222)
2026-06-05 12:52:22,154 - optuna.study.study - INFO - Trial 297 finished with values: [0.06853005859896363, 0.00823397414428294, 0.03461700511248222] and parameters: {'n_layers': 2, 'embedding_dim': 256, 'lr': 0.0023785608804078183, 'lambda_val': 1.8928189863403825e-06, 'batch_size': 1554, 'optimizer': 'Adam'}.
2026-06-05 12:53:04,728 - experiment_functions - INFO - Early stopping at epoch 800. Best Metrics: (0.06713595902306152, 0.008136847745997723, 0.033389292179943734)
2026-06-05 12:53:04,823 - optuna.study.study - INFO - Trial 298 finished with values: [0.06713595902306152, 0.008136847745997723, 0.033389292179943734] and parameters: {'n_layers': 2, 'embedding_dim': 256, 'lr': 0.0023440150084551373, 'lambda_val': 0.00012250709547244776, 'batch_size': 1554, 'optimizer': 'Adam'}.
2026-06-05 12:55:03,987 - experiment_functions - INFO - Early stopping at epoch 2650. Best Metrics: (0.08275127327191194, 0.00998224931341684, 0.04298339735593535)
2026-06-05 12:55:04,354 - optuna.study.study - INFO - Trial 299 finished with values: [0.08275127327191194, 0.00998224931341684, 0.04298339735593535] and parameters: {'n_layers': 2, 'embedding_dim': 128, 'lr': 0.0008252437334877037, 'lambda_val': 6.977831082453278e-06, 'batch_size': 3890, 'optimizer': 'Adam'}.
2026-06-05 12:55:04,369 - root - INFO - Selected Trial 263 based on Max ndcg: 0.0483
2026-06-05 12:55:04,369 - root - INFO - Associated Recall: 0.0903
2026-06-05 12:55:04,369 - experiment_functions - INFO - Training the best model ... for e_gowalla_1c1dcs_rand1
2026-06-05 12:57:50,182 - root - INFO -   **** Training e_gowalla_1c1dcs_rand2
2026-06-05 12:57:50,286 - root - INFO -   **** Getting 368544/845292 random edges
2026-06-05 12:57:50,520 - optuna.storages._rdb.storage - INFO - A new study created in RDB with name: Study_e_gowalla_1c1dcs_rand2
2026-06-05 12:58:13,461 - experiment_functions - INFO - Early stopping at epoch 500. Best Metrics: (0.0003367264847269915, 8.205506062026926e-05, 0.000171681573044875)
2026-06-05 12:58:13,583 - optuna.study.study - INFO - Trial 0 finished with values: [0.0003367264847269915, 8.205506062026926e-05, 0.000171681573044875] and parameters: {'n_layers': 3, 'embedding_dim': 96, 'lr': 0.0002837983701075917, 'lambda_val': 1.6296099097518827e-05, 'batch_size': 1440, 'optimizer': 'SGD'}.
2026-06-05 12:59:47,917 - experiment_functions - INFO - Early stopping at epoch 2450. Best Metrics: (0.0005512803598105127, 8.707883984191843e-05, 0.00022792480001816378)
2026-06-05 12:59:48,658 - optuna.study.study - INFO - Trial 1 finished with values: [0.0005512803598105127, 8.707883984191843e-05, 0.00022792480001816378] and parameters: {'n_layers': 4, 'embedding_dim': 32, 'lr': 9.009937615404027e-05, 'lambda_val': 0.00170675028928201, 'batch_size': 522, 'optimizer': 'RMSprop'}.
2026-06-05 13:00:10,390 - experiment_functions - INFO - Early stopping at epoch 500. Best Metrics: (0.000461014012935467, 7.87058744725032e-05, 0.00023281795341495315)
2026-06-05 13:00:10,478 - optuna.study.study - INFO - Trial 2 finished with values: [0.000461014012935467, 7.87058744725032e-05, 0.00023281795341495315] and parameters: {'n_layers': 3, 'embedding_dim': 64, 'lr': 0.004389082508978356, 'lambda_val': 2.087248221568297e-06, 'batch_size': 652, 'optimizer': 'SGD'}.
2026-06-05 13:00:31,712 - experiment_functions - INFO - Early stopping at epoch 500. Best Metrics: (0.00046355911813011344, 7.703128139862013e-05, 0.0002617638579102392)
2026-06-05 13:00:32,365 - optuna.study.study - INFO - Trial 3 finished with values: [0.00046355911813011344, 7.703128139862013e-05, 0.0002617638579102392] and parameters: {'n_layers': 2, 'embedding_dim': 64, 'lr': 5.134015394997247e-05, 'lambda_val': 0.04670579858673422, 'batch_size': 3856, 'optimizer': 'SGD'}.
2026-06-05 13:02:06,171 - experiment_functions - INFO - Early stopping at epoch 2300. Best Metrics: (0.07029930039309291, 0.008890414629245095, 0.0353327102935667)
2026-06-05 13:02:06,271 - optuna.study.study - INFO - Trial 4 finished with values: [0.07029930039309291, 0.008890414629245095, 0.0353327102935667] and parameters: {'n_layers': 1, 'embedding_dim': 96, 'lr': 0.0007730079936260513, 'lambda_val': 0.005288720124154074, 'batch_size': 4028, 'optimizer': 'RMSprop'}.
2026-06-05 13:04:40,043 - optuna.study.study - INFO - Trial 5 finished with values: [0.006494763271708652, 0.0010566682296202024, 0.0032576661022004263] and parameters: {'n_layers': 4, 'embedding_dim': 32, 'lr': 0.00017225906647401988, 'lambda_val': 0.02560156160052963, 'batch_size': 2848, 'optimizer': 'RMSprop'}.
2026-06-05 13:05:03,138 - experiment_functions - INFO - Early stopping at epoch 550. Best Metrics: (0.006493286260127664, 0.000899256480675196, 0.0032735533532350348)
2026-06-05 13:05:03,222 - optuna.study.study - INFO - Trial 6 finished with values: [0.006493286260127664, 0.000899256480675196, 0.0032735533532350348] and parameters: {'n_layers': 3, 'embedding_dim': 32, 'lr': 0.005189136595815164, 'lambda_val': 0.08580618687184582, 'batch_size': 1490, 'optimizer': 'RMSprop'}.
2026-06-05 13:05:46,767 - experiment_functions - INFO - Early stopping at epoch 1050. Best Metrics: (0.03950693441264794, 0.004719003282202425, 0.018766874119553696)
2026-06-05 13:05:46,844 - optuna.study.study - INFO - Trial 7 finished with values: [0.03950693441264794, 0.004719003282202425, 0.018766874119553696] and parameters: {'n_layers': 4, 'embedding_dim': 32, 'lr': 0.0026407817619319117, 'lambda_val': 0.00011721050749002031, 'batch_size': 2352, 'optimizer': 'Adam'}.
2026-06-05 13:07:18,690 - experiment_functions - INFO - Early stopping at epoch 2300. Best Metrics: (0.05062642357729283, 0.006730189563935963, 0.025304197949410002)
2026-06-05 13:07:18,959 - optuna.study.study - INFO - Trial 8 finished with values: [0.05062642357729283, 0.006730189563935963, 0.025304197949410002] and parameters: {'n_layers': 1, 'embedding_dim': 96, 'lr': 0.0008260980234570757, 'lambda_val': 0.021886493172504122, 'batch_size': 2498, 'optimizer': 'Adam'}.
2026-06-05 13:10:07,995 - optuna.study.study - INFO - Trial 9 finished with values: [0.054746094470690745, 0.00684908567218166, 0.02736813065910459] and parameters: {'n_layers': 4, 'embedding_dim': 64, 'lr': 0.00029609176700534276, 'lambda_val': 3.732019937312388e-06, 'batch_size': 3339, 'optimizer': 'RMSprop'}.
2026-06-05 13:10:51,288 - experiment_functions - INFO - Early stopping at epoch 900. Best Metrics: (0.08210882869883539, 0.010178176703061157, 0.0433658508801402)
2026-06-05 13:10:51,382 - optuna.study.study - INFO - Trial 10 finished with values: [0.08210882869883539, 0.010178176703061157, 0.0433658508801402] and parameters: {'n_layers': 1, 'embedding_dim': 256, 'lr': 0.0029470384606335377, 'lambda_val': 5.587325552332493e-06, 'batch_size': 2546, 'optimizer': 'Adam'}.
2026-06-05 13:11:18,070 - experiment_functions - INFO - Early stopping at epoch 550. Best Metrics: (0.02965859731946793, 0.003459709290642374, 0.0136530994001389)
2026-06-05 13:11:18,233 - optuna.study.study - INFO - Trial 11 finished with values: [0.02965859731946793, 0.003459709290642374, 0.0136530994001389] and parameters: {'n_layers': 3, 'embedding_dim': 128, 'lr': 0.056354797042132906, 'lambda_val': 5.271774885829176e-06, 'batch_size': 2586, 'optimizer': 'Adam'}.
2026-06-05 13:13:17,282 - experiment_functions - INFO - Early stopping at epoch 3000. Best Metrics: (0.06322834881264029, 0.007684707616049301, 0.03232236948218896)
2026-06-05 13:13:17,821 - optuna.study.study - INFO - Trial 12 finished with values: [0.06322834881264029, 0.007684707616049301, 0.03232236948218896] and parameters: {'n_layers': 3, 'embedding_dim': 32, 'lr': 0.0007908861785647595, 'lambda_val': 0.00011375426873786574, 'batch_size': 2947, 'optimizer': 'RMSprop'}.
2026-06-05 13:14:08,674 - experiment_functions - INFO - Early stopping at epoch 1300. Best Metrics: (0.0004902537230508702, 6.0285350659789674e-05, 0.00021542630041128573)
2026-06-05 13:14:09,820 - optuna.study.study - INFO - Trial 13 finished with values: [0.0004902537230508702, 6.0285350659789674e-05, 0.00021542630041128573] and parameters: {'n_layers': 4, 'embedding_dim': 32, 'lr': 4.231237383262435e-05, 'lambda_val': 4.6468946474934535e-06, 'batch_size': 1320, 'optimizer': 'RMSprop'}.
2026-06-05 13:16:33,650 - optuna.study.study - INFO - Trial 14 finished with values: [0.0010383082640063324, 0.00015573715587112333, 0.0005394561467771485] and parameters: {'n_layers': 1, 'embedding_dim': 32, 'lr': 0.00035382245097748176, 'lambda_val': 0.0005610399823217974, 'batch_size': 800, 'optimizer': 'RMSprop'}.
2026-06-05 13:16:54,855 - experiment_functions - INFO - Early stopping at epoch 500. Best Metrics: (0.0005519506625339343, 8.875343291580147e-05, 0.00028286305268409407)
2026-06-05 13:16:54,940 - optuna.study.study - INFO - Trial 15 finished with values: [0.0005519506625339343, 8.875343291580147e-05, 0.00028286305268409407] and parameters: {'n_layers': 2, 'embedding_dim': 64, 'lr': 5.943480485051302e-05, 'lambda_val': 0.00941001736414929, 'batch_size': 1373, 'optimizer': 'Adam'}.
2026-06-05 13:17:19,010 - experiment_functions - INFO - Early stopping at epoch 550. Best Metrics: (0.030879985994934807, 0.004069261169535803, 0.01542789964254121)
2026-06-05 13:17:19,107 - optuna.study.study - INFO - Trial 16 finished with values: [0.030879985994934807, 0.004069261169535803, 0.01542789964254121] and parameters: {'n_layers': 1, 'embedding_dim': 128, 'lr': 0.03166161406234853, 'lambda_val': 1.7128084469469318e-05, 'batch_size': 2030, 'optimizer': 'Adam'}.
2026-06-05 13:17:39,521 - experiment_functions - INFO - Early stopping at epoch 500. Best Metrics: (0.0005294452435922059, 8.038046754638622e-05, 0.0002454436187536608)
2026-06-05 13:17:39,601 - optuna.study.study - INFO - Trial 17 finished with values: [0.0005294452435922059, 8.038046754638622e-05, 0.0002454436187536608] and parameters: {'n_layers': 2, 'embedding_dim': 32, 'lr': 0.009263044570931191, 'lambda_val': 5.939926970166561e-06, 'batch_size': 1529, 'optimizer': 'SGD'}.
2026-06-05 13:18:01,216 - experiment_functions - INFO - Early stopping at epoch 500. Best Metrics: (0.0004461686615142071, 8.540424676803537e-05, 0.0002455203844675913)
2026-06-05 13:18:01,307 - optuna.study.study - INFO - Trial 18 finished with values: [0.0004461686615142071, 8.540424676803537e-05, 0.0002455203844675913] and parameters: {'n_layers': 1, 'embedding_dim': 128, 'lr': 0.001184614393037348, 'lambda_val': 0.003629328024442272, 'batch_size': 2119, 'optimizer': 'SGD'}.
2026-06-05 13:20:43,085 - optuna.study.study - INFO - Trial 19 finished with values: [0.07364481940771934, 0.00959709290642374, 0.03933531827734642] and parameters: {'n_layers': 1, 'embedding_dim': 96, 'lr': 0.0007912354345926823, 'lambda_val': 0.0023604176548426264, 'batch_size': 2504, 'optimizer': 'Adam'}.
2026-06-05 13:23:11,866 - optuna.study.study - INFO - Trial 20 finished with values: [0.0400162758948579, 0.005857726572442897, 0.023147132638825375] and parameters: {'n_layers': 1, 'embedding_dim': 32, 'lr': 0.0009590496257981318, 'lambda_val': 0.007468981389036971, 'batch_size': 655, 'optimizer': 'RMSprop'}.
2026-06-05 13:26:22,113 - optuna.study.study - INFO - Trial 21 finished with values: [0.001357747263974536, 0.00026291111259963833, 0.000655790539756873] and parameters: {'n_layers': 2, 'embedding_dim': 256, 'lr': 0.00015800985714896668, 'lambda_val': 0.02936846366883511, 'batch_size': 2079, 'optimizer': 'RMSprop'}.
2026-06-05 13:28:54,943 - optuna.study.study - INFO - Trial 22 finished with values: [0.05079713599231208, 0.0068055462522607, 0.028089683220951293] and parameters: {'n_layers': 2, 'embedding_dim': 32, 'lr': 0.0004666871232718281, 'lambda_val': 7.487535492065269e-05, 'batch_size': 2271, 'optimizer': 'RMSprop'}.
2026-06-05 13:29:23,143 - experiment_functions - INFO - Early stopping at epoch 600. Best Metrics: (0.00043784776209557854, 5.861075758590662e-05, 0.00019327030891847297)
2026-06-05 13:29:23,239 - optuna.study.study - INFO - Trial 23 finished with values: [0.00043784776209557854, 5.861075758590662e-05, 0.00019327030891847297] and parameters: {'n_layers': 1, 'embedding_dim': 256, 'lr': 4.6546413083885245e-05, 'lambda_val': 2.7508396221765e-06, 'batch_size': 2388, 'optimizer': 'Adam'}.
2026-06-05 13:32:15,264 - optuna.study.study - INFO - Trial 24 finished with values: [0.05036374793331369, 0.0059364324469154, 0.023910246764399175] and parameters: {'n_layers': 2, 'embedding_dim': 128, 'lr': 0.004586159400047152, 'lambda_val': 2.2392691089871585e-06, 'batch_size': 1011, 'optimizer': 'RMSprop'}.
2026-06-05 13:34:16,510 - experiment_functions - INFO - Early stopping at epoch 2700. Best Metrics: (0.03242002860181685, 0.0036238194118829127, 0.014445411369715904)
2026-06-05 13:34:16,600 - optuna.study.study - INFO - Trial 25 finished with values: [0.03242002860181685, 0.0036238194118829127, 0.014445411369715904] and parameters: {'n_layers': 4, 'embedding_dim': 96, 'lr': 0.007201354720703791, 'lambda_val': 1.41735749349472e-06, 'batch_size': 2155, 'optimizer': 'Adam'}.
2026-06-05 13:36:46,929 - optuna.study.study - INFO - Trial 26 finished with values: [0.0006936456231662246, 0.00010047558443298278, 0.0003301089568480876] and parameters: {'n_layers': 3, 'embedding_dim': 32, 'lr': 6.876990202970542e-05, 'lambda_val': 0.0010787416649118934, 'batch_size': 3608, 'optimizer': 'RMSprop'}.
2026-06-05 13:39:26,913 - optuna.study.study - INFO - Trial 27 finished with values: [0.016192902061794922, 0.0021987407060084403, 0.007117373214698637] and parameters: {'n_layers': 1, 'embedding_dim': 128, 'lr': 0.06589928959328518, 'lambda_val': 0.0296137038894491, 'batch_size': 2000, 'optimizer': 'Adam'}.
2026-06-05 13:40:04,656 - experiment_functions - INFO - Early stopping at epoch 850. Best Metrics: (0.0001968800042775141, 4.5214012994842254e-05, 9.699614216861106e-05)
2026-06-05 13:40:04,759 - optuna.study.study - INFO - Trial 28 finished with values: [0.0001968800042775141, 4.5214012994842254e-05, 9.699614216861106e-05] and parameters: {'n_layers': 3, 'embedding_dim': 96, 'lr': 3.088833921402479e-05, 'lambda_val': 0.007181758155536501, 'batch_size': 2820, 'optimizer': 'Adam'}.
2026-06-05 13:40:25,482 - experiment_functions - INFO - Early stopping at epoch 500. Best Metrics: (0.0004605246942364728, 7.535668832473711e-05, 0.00025072613431267676)
2026-06-05 13:40:25,565 - optuna.study.study - INFO - Trial 29 finished with values: [0.0004605246942364728, 7.535668832473711e-05, 0.00025072613431267676] and parameters: {'n_layers': 1, 'embedding_dim': 64, 'lr': 0.0015375187981367332, 'lambda_val': 0.002157111855296116, 'batch_size': 2829, 'optimizer': 'SGD'}.
2026-06-05 13:43:01,034 - optuna.study.study - INFO - Trial 30 finished with values: [0.07760377398977457, 0.009836559715989016, 0.04208620194369762] and parameters: {'n_layers': 1, 'embedding_dim': 32, 'lr': 0.0010470286775611781, 'lambda_val': 0.00020574260712132375, 'batch_size': 3475, 'optimizer': 'Adam'}.
2026-06-05 13:44:00,947 - experiment_functions - INFO - Early stopping at epoch 1500. Best Metrics: (0.011365525029035905, 0.0014501976019827183, 0.005230003918920385)
2026-06-05 13:44:02,083 - optuna.study.study - INFO - Trial 31 finished with values: [0.011365525029035905, 0.0014501976019827183, 0.005230003918920385] and parameters: {'n_layers': 2, 'embedding_dim': 64, 'lr': 0.009071427839704624, 'lambda_val': 0.04725669965811722, 'batch_size': 1720, 'optimizer': 'Adam'}.
2026-06-05 13:44:48,388 - experiment_functions - INFO - Early stopping at epoch 1100. Best Metrics: (0.029345150019557918, 0.003426217429164713, 0.012660740655835228)
2026-06-05 13:44:48,477 - optuna.study.study - INFO - Trial 32 finished with values: [0.029345150019557918, 0.003426217429164713, 0.012660740655835228] and parameters: {'n_layers': 3, 'embedding_dim': 64, 'lr': 0.008261825578479428, 'lambda_val': 0.00033127211998733373, 'batch_size': 1280, 'optimizer': 'Adam'}.
2026-06-05 13:45:10,995 - experiment_functions - INFO - Early stopping at epoch 550. Best Metrics: (0.005817913249709851, 0.000899256480675196, 0.0029346124502606396)
2026-06-05 13:45:11,081 - optuna.study.study - INFO - Trial 33 finished with values: [0.005817913249709851, 0.000899256480675196, 0.0029346124502606396] and parameters: {'n_layers': 2, 'embedding_dim': 32, 'lr': 0.06314388482538222, 'lambda_val': 3.684365830705915e-05, 'batch_size': 2108, 'optimizer': 'RMSprop'}.
2026-06-05 13:45:31,665 - experiment_functions - INFO - Early stopping at epoch 500. Best Metrics: (0.00047950301570531925, 7.703128139862015e-05, 0.00023225548183225894)
2026-06-05 13:45:31,760 - optuna.study.study - INFO - Trial 34 finished with values: [0.00047950301570531925, 7.703128139862015e-05, 0.00023225548183225894] and parameters: {'n_layers': 1, 'embedding_dim': 64, 'lr': 0.027400834032566487, 'lambda_val': 0.007779290136639793, 'batch_size': 3289, 'optimizer': 'SGD'}.
2026-06-05 13:48:14,766 - optuna.study.study - INFO - Trial 35 finished with values: [0.03523010194176603, 0.0052347779489584035, 0.019332161279703313] and parameters: {'n_layers': 2, 'embedding_dim': 96, 'lr': 0.0002857346242509807, 'lambda_val': 0.00408688017668438, 'batch_size': 2828, 'optimizer': 'Adam'}.
2026-06-05 13:51:11,731 - optuna.study.study - INFO - Trial 36 finished with values: [0.0008249897369984885, 0.00014401500435394198, 0.00041680522534736584] and parameters: {'n_layers': 3, 'embedding_dim': 128, 'lr': 6.150399094765664e-05, 'lambda_val': 2.1314687746871293e-05, 'batch_size': 3837, 'optimizer': 'Adam'}.
2026-06-05 13:54:26,154 - optuna.study.study - INFO - Trial 37 finished with values: [0.011293839779998573, 0.0018772188358228952, 0.006312454681023072] and parameters: {'n_layers': 2, 'embedding_dim': 256, 'lr': 0.00015303311347060822, 'lambda_val': 0.0009472447880798233, 'batch_size': 4094, 'optimizer': 'Adam'}.
2026-06-05 13:54:50,906 - experiment_functions - INFO - Early stopping at epoch 550. Best Metrics: (0.023195463164360768, 0.0028719271217094245, 0.010457992678408877)
2026-06-05 13:54:51,029 - optuna.study.study - INFO - Trial 38 finished with values: [0.023195463164360768, 0.0028719271217094245, 0.010457992678408877] and parameters: {'n_layers': 3, 'embedding_dim': 64, 'lr': 0.010315486857165407, 'lambda_val': 0.0021841916891966176, 'batch_size': 768, 'optimizer': 'RMSprop'}.
2026-06-05 13:57:38,950 - optuna.study.study - INFO - Trial 39 finished with values: [0.014545411302008277, 0.0022422801259293994, 0.008369238225886885] and parameters: {'n_layers': 2, 'embedding_dim': 128, 'lr': 0.00017853594211867895, 'lambda_val': 9.558739147162892e-06, 'batch_size': 3334, 'optimizer': 'RMSprop'}.
2026-06-05 13:58:01,440 - experiment_functions - INFO - Early stopping at epoch 500. Best Metrics: (0.0004874673125392675, 8.205506062026927e-05, 0.0002698743100139073)
2026-06-05 13:58:01,563 - optuna.study.study - INFO - Trial 40 finished with values: [0.0004874673125392675, 8.205506062026927e-05, 0.0002698743100139073] and parameters: {'n_layers': 2, 'embedding_dim': 96, 'lr': 0.004991907428929939, 'lambda_val': 0.01436036159533426, 'batch_size': 3489, 'optimizer': 'SGD'}.
2026-06-05 13:58:22,746 - experiment_functions - INFO - Early stopping at epoch 500. Best Metrics: (0.0004960141983681082, 6.530912988143882e-05, 0.00017733922176530774)
2026-06-05 13:58:22,849 - optuna.study.study - INFO - Trial 41 finished with values: [0.0004960141983681082, 6.530912988143882e-05, 0.00017733922176530774] and parameters: {'n_layers': 1, 'embedding_dim': 64, 'lr': 4.46568763203307e-05, 'lambda_val': 0.0017795146175815, 'batch_size': 3207, 'optimizer': 'SGD'}.
2026-06-05 14:01:30,635 - optuna.study.study - INFO - Trial 42 finished with values: [0.010344373464005647, 0.001585839640967245, 0.005122263173090303] and parameters: {'n_layers': 4, 'embedding_dim': 128, 'lr': 0.00010146620414484356, 'lambda_val': 0.003086353924928254, 'batch_size': 4091, 'optimizer': 'Adam'}.
2026-06-05 14:02:17,643 - experiment_functions - INFO - Early stopping at epoch 1000. Best Metrics: (0.04766506231418672, 0.005785719070265925, 0.02270548406721697)
2026-06-05 14:02:17,721 - optuna.study.study - INFO - Trial 43 finished with values: [0.04766506231418672, 0.005785719070265925, 0.02270548406721697] and parameters: {'n_layers': 4, 'embedding_dim': 96, 'lr': 0.001414374009860838, 'lambda_val': 8.153827573061686e-06, 'batch_size': 2394, 'optimizer': 'Adam'}.
2026-06-05 14:02:40,670 - experiment_functions - INFO - Early stopping at epoch 550. Best Metrics: (0.0006380496112047797, 9.71263982852167e-05, 0.0003197496582494357)
2026-06-05 14:02:40,741 - optuna.study.study - INFO - Trial 44 finished with values: [0.0006380496112047797, 9.71263982852167e-05, 0.0003197496582494357] and parameters: {'n_layers': 2, 'embedding_dim': 64, 'lr': 3.308903814175601e-05, 'lambda_val': 3.5647402690247963e-06, 'batch_size': 1667, 'optimizer': 'RMSprop'}.
2026-06-05 14:03:10,958 - experiment_functions - INFO - Early stopping at epoch 500. Best Metrics: (0.0006220208307145299, 9.042802598968451e-05, 0.0002698113947988157)
