2026-06-06 05:38:21,255 - optuna.study.study - INFO - Trial 16 finished with values: [0.024933429327273656, 0.003072878290575391, 0.01151294338722384] and parameters: {'n_layers': 3, 'embedding_dim': 64, 'lr': 0.004471753451787057, 'lambda_val': 0.001602265573028567, 'batch_size': 1350, 'optimizer': 'RMSprop'}.
2026-06-06 05:38:46,060 - experiment_functions - INFO - Early stopping at epoch 600. Best Metrics: (0.021302547823209953, 0.0026106906021836694, 0.00946245433465984)
2026-06-06 05:38:46,271 - optuna.study.study - INFO - Trial 17 finished with values: [0.021302547823209953, 0.0026106906021836694, 0.00946245433465984] and parameters: {'n_layers': 1, 'embedding_dim': 64, 'lr': 0.015113935710369755, 'lambda_val': 0.029440788062141395, 'batch_size': 3521, 'optimizer': 'Adam'}.
2026-06-06 05:39:09,496 - experiment_functions - INFO - Early stopping at epoch 550. Best Metrics: (0.04696860757901837, 0.005943130819210932, 0.024562557193005572)
2026-06-06 05:39:09,603 - optuna.study.study - INFO - Trial 18 finished with values: [0.04696860757901837, 0.005943130819210932, 0.024562557193005572] and parameters: {'n_layers': 2, 'embedding_dim': 32, 'lr': 0.01433727156286783, 'lambda_val': 5.315262969436241e-05, 'batch_size': 3428, 'optimizer': 'Adam'}.
2026-06-06 05:39:36,978 - experiment_functions - INFO - Early stopping at epoch 550. Best Metrics: (0.021321174513657882, 0.0026006430437403713, 0.009594062186332504)
2026-06-06 05:39:37,069 - optuna.study.study - INFO - Trial 19 finished with values: [0.021321174513657882, 0.0026006430437403713, 0.009594062186332504] and parameters: {'n_layers': 3, 'embedding_dim': 32, 'lr': 0.0933995728246717, 'lambda_val': 3.996555780966423e-06, 'batch_size': 2911, 'optimizer': 'Adam'}.
2026-06-06 05:40:16,205 - experiment_functions - INFO - Early stopping at epoch 950. Best Metrics: (0.0005140882847344399, 7.368209525085404e-05, 0.00023843113582636962)
2026-06-06 05:40:16,372 - optuna.study.study - INFO - Trial 20 finished with values: [0.0005140882847344399, 7.368209525085404e-05, 0.00023843113582636962] and parameters: {'n_layers': 1, 'embedding_dim': 128, 'lr': 2.4027549300888472e-05, 'lambda_val': 0.011559216876508498, 'batch_size': 3529, 'optimizer': 'Adam'}.
2026-06-06 05:40:37,657 - experiment_functions - INFO - Early stopping at epoch 500. Best Metrics: (0.009659122969905145, 0.0009561926451872195, 0.004709955793038863)
2026-06-06 05:40:38,389 - optuna.study.study - INFO - Trial 21 finished with values: [0.009659122969905145, 0.0009561926451872195, 0.004709955793038863] and parameters: {'n_layers': 2, 'embedding_dim': 64, 'lr': 0.09213127506742724, 'lambda_val': 0.0019142718699741395, 'batch_size': 1587, 'optimizer': 'RMSprop'}.
2026-06-06 05:41:59,321 - experiment_functions - INFO - Early stopping at epoch 1850. Best Metrics: (0.0004866342084737971, 7.200750217697099e-05, 0.00021727300819410808)
2026-06-06 05:41:59,801 - optuna.study.study - INFO - Trial 22 finished with values: [0.0004866342084737971, 7.200750217697099e-05, 0.00021727300819410808] and parameters: {'n_layers': 1, 'embedding_dim': 256, 'lr': 6.30336215286114e-05, 'lambda_val': 1.3467221201318294e-05, 'batch_size': 742, 'optimizer': 'Adam'}.
2026-06-06 05:42:24,747 - experiment_functions - INFO - Early stopping at epoch 500. Best Metrics: (0.0004653486069165128, 7.033290910308795e-05, 0.00023289132520953177)
2026-06-06 05:42:24,827 - optuna.study.study - INFO - Trial 23 finished with values: [0.0004653486069165128, 7.033290910308795e-05, 0.00023289132520953177] and parameters: {'n_layers': 4, 'embedding_dim': 128, 'lr': 0.0014793048132167568, 'lambda_val': 0.00010273372390631821, 'batch_size': 2078, 'optimizer': 'SGD'}.
2026-06-06 05:42:48,622 - experiment_functions - INFO - Early stopping at epoch 500. Best Metrics: (0.0005833275144731773, 8.540424676803538e-05, 0.00026210599785035876)
2026-06-06 05:42:48,689 - optuna.study.study - INFO - Trial 24 finished with values: [0.0005833275144731773, 8.540424676803538e-05, 0.00026210599785035876] and parameters: {'n_layers': 3, 'embedding_dim': 128, 'lr': 0.0011045395350059257, 'lambda_val': 0.00019736900791033436, 'batch_size': 2129, 'optimizer': 'SGD'}.
2026-06-06 05:43:19,079 - experiment_functions - INFO - Early stopping at epoch 500. Best Metrics: (0.00047240893500265766, 8.205506062026927e-05, 0.0002363412475007353)
2026-06-06 05:43:19,200 - optuna.study.study - INFO - Trial 25 finished with values: [0.00047240893500265766, 8.205506062026927e-05, 0.0002363412475007353] and parameters: {'n_layers': 4, 'embedding_dim': 256, 'lr': 1.1904901716070201e-05, 'lambda_val': 0.00020186323866532547, 'batch_size': 2241, 'optimizer': 'SGD'}.
2026-06-06 05:43:49,676 - experiment_functions - INFO - Early stopping at epoch 500. Best Metrics: (0.0005030716151408123, 8.038046754638624e-05, 0.00028218002177443993)
2026-06-06 05:43:49,977 - optuna.study.study - INFO - Trial 26 finished with values: [0.0005030716151408123, 8.038046754638624e-05, 0.00028218002177443993] and parameters: {'n_layers': 4, 'embedding_dim': 256, 'lr': 7.857041486489714e-05, 'lambda_val': 0.00015284853634263792, 'batch_size': 3112, 'optimizer': 'SGD'}.
2026-06-06 05:46:24,473 - optuna.study.study - INFO - Trial 27 finished with values: [0.026833258397808812, 0.0034998995244155673, 0.012131200789578762] and parameters: {'n_layers': 1, 'embedding_dim': 96, 'lr': 0.06778474199549463, 'lambda_val': 0.0004272001150018832, 'batch_size': 3115, 'optimizer': 'RMSprop'}.
2026-06-06 05:46:47,631 - experiment_functions - INFO - Early stopping at epoch 500. Best Metrics: (0.0006644187806795616, 8.205506062026926e-05, 0.00029000899965435183)
2026-06-06 05:46:47,762 - optuna.study.study - INFO - Trial 28 finished with values: [0.0006644187806795616, 8.205506062026926e-05, 0.00029000899965435183] and parameters: {'n_layers': 1, 'embedding_dim': 256, 'lr': 0.009021346056218228, 'lambda_val': 4.922331159406591e-06, 'batch_size': 1609, 'optimizer': 'SGD'}.
2026-06-06 05:47:09,565 - experiment_functions - INFO - Early stopping at epoch 500. Best Metrics: (0.0004669701932650841, 8.205506062026926e-05, 0.00021830732124811738)
2026-06-06 05:47:09,652 - optuna.study.study - INFO - Trial 29 finished with values: [0.0004669701932650841, 8.205506062026926e-05, 0.00021830732124811738] and parameters: {'n_layers': 2, 'embedding_dim': 96, 'lr': 0.0002722811692097501, 'lambda_val': 4.36085592019629e-06, 'batch_size': 584, 'optimizer': 'SGD'}.
2026-06-06 05:50:44,757 - experiment_functions - INFO - Early stopping at epoch 3650. Best Metrics: (0.03631175309782142, 0.003841516511487709, 0.01654646542603749)
2026-06-06 05:50:44,896 - optuna.study.study - INFO - Trial 30 finished with values: [0.03631175309782142, 0.003841516511487709, 0.01654646542603749] and parameters: {'n_layers': 4, 'embedding_dim': 256, 'lr': 0.013769923730273376, 'lambda_val': 3.453094155452938e-05, 'batch_size': 2989, 'optimizer': 'Adam'}.
2026-06-06 05:51:07,269 - experiment_functions - INFO - Early stopping at epoch 500. Best Metrics: (0.00041661936484932, 6.698372295532186e-05, 0.00017583584891295295)
2026-06-06 05:51:07,504 - optuna.study.study - INFO - Trial 31 finished with values: [0.00041661936484932, 6.698372295532186e-05, 0.00017583584891295295] and parameters: {'n_layers': 3, 'embedding_dim': 64, 'lr': 1.742366775733471e-05, 'lambda_val': 0.006426503425155776, 'batch_size': 3376, 'optimizer': 'SGD'}.
2026-06-06 05:51:40,530 - experiment_functions - INFO - Early stopping at epoch 800. Best Metrics: (0.06239962672606144, 0.007590930403911849, 0.03242044746686157)
2026-06-06 05:51:40,615 - optuna.study.study - INFO - Trial 32 finished with values: [0.06239962672606144, 0.007590930403911849, 0.03242044746686157] and parameters: {'n_layers': 2, 'embedding_dim': 32, 'lr': 0.0019509035141199726, 'lambda_val': 4.2735070605297645e-06, 'batch_size': 3082, 'optimizer': 'RMSprop'}.
2026-06-06 05:52:36,108 - experiment_functions - INFO - Early stopping at epoch 1400. Best Metrics: (0.07359591993024672, 0.009072945274298345, 0.03742781652740113)
2026-06-06 05:52:36,203 - optuna.study.study - INFO - Trial 33 finished with values: [0.07359591993024672, 0.009072945274298345, 0.03742781652740113] and parameters: {'n_layers': 1, 'embedding_dim': 32, 'lr': 0.0017827212934439936, 'lambda_val': 0.0016696163443190065, 'batch_size': 3209, 'optimizer': 'RMSprop'}.
2026-06-06 05:52:57,541 - experiment_functions - INFO - Early stopping at epoch 500. Best Metrics: (0.0003509648731998288, 5.861075758590662e-05, 0.0002010218196889931)
2026-06-06 05:52:57,966 - optuna.study.study - INFO - Trial 34 finished with values: [0.0003509648731998288, 5.861075758590662e-05, 0.0002010218196889931] and parameters: {'n_layers': 2, 'embedding_dim': 64, 'lr': 0.00017533742125036325, 'lambda_val': 0.04861344353383118, 'batch_size': 3154, 'optimizer': 'RMSprop'}.
2026-06-06 05:54:00,592 - experiment_functions - INFO - Early stopping at epoch 1550. Best Metrics: (0.00038708932703383086, 6.363453680755577e-05, 0.0001890154361856221)
2026-06-06 05:54:00,686 - optuna.study.study - INFO - Trial 35 finished with values: [0.00038708932703383086, 6.363453680755577e-05, 0.0001890154361856221] and parameters: {'n_layers': 3, 'embedding_dim': 64, 'lr': 8.303674916570031e-05, 'lambda_val': 1.2021465828711608e-06, 'batch_size': 667, 'optimizer': 'Adam'}.
2026-06-06 05:54:21,142 - experiment_functions - INFO - Early stopping at epoch 500. Best Metrics: (0.0004297679182549613, 5.861075758590662e-05, 0.00016297244302576638)
2026-06-06 05:54:21,558 - optuna.study.study - INFO - Trial 36 finished with values: [0.0004297679182549613, 5.861075758590662e-05, 0.00016297244302576638] and parameters: {'n_layers': 1, 'embedding_dim': 64, 'lr': 0.008851479449395013, 'lambda_val': 0.0022429217908253975, 'batch_size': 3725, 'optimizer': 'SGD'}.
2026-06-06 05:54:45,576 - experiment_functions - INFO - Early stopping at epoch 500. Best Metrics: (0.0003636128647210513, 6.530912988143881e-05, 0.0001777929880504782)
2026-06-06 05:54:45,670 - optuna.study.study - INFO - Trial 37 finished with values: [0.0003636128647210513, 6.530912988143881e-05, 0.0001777929880504782] and parameters: {'n_layers': 3, 'embedding_dim': 128, 'lr': 0.00015192374470902046, 'lambda_val': 1.9355455608176007e-06, 'batch_size': 4015, 'optimizer': 'SGD'}.
2026-06-06 05:55:10,792 - experiment_functions - INFO - Early stopping at epoch 500. Best Metrics: (0.0004043945904534988, 7.033290910308795e-05, 0.00019190536724519172)
2026-06-06 05:55:10,892 - optuna.study.study - INFO - Trial 38 finished with values: [0.0004043945904534988, 7.033290910308795e-05, 0.00019190536724519172] and parameters: {'n_layers': 4, 'embedding_dim': 128, 'lr': 0.0013479527755646359, 'lambda_val': 0.0010096710588240008, 'batch_size': 3625, 'optimizer': 'SGD'}.
2026-06-06 05:55:59,850 - experiment_functions - INFO - Early stopping at epoch 1150. Best Metrics: (0.05697993857816367, 0.00657445240806484, 0.02736150344941458)
2026-06-06 05:56:00,188 - optuna.study.study - INFO - Trial 39 finished with values: [0.05697993857816367, 0.00657445240806484, 0.02736150344941458] and parameters: {'n_layers': 1, 'embedding_dim': 128, 'lr': 0.005828487948467767, 'lambda_val': 7.265971768922724e-05, 'batch_size': 3359, 'optimizer': 'RMSprop'}.
2026-06-06 05:59:07,887 - optuna.study.study - INFO - Trial 40 finished with values: [0.02219790411952208, 0.0033307656239533793, 0.011502764621065854] and parameters: {'n_layers': 4, 'embedding_dim': 128, 'lr': 0.00013510229001541778, 'lambda_val': 0.00054092001322401, 'batch_size': 2918, 'optimizer': 'RMSprop'}.
2026-06-06 06:00:35,168 - experiment_functions - INFO - Early stopping at epoch 1950. Best Metrics: (0.01172341898819662, 0.0015607207448589994, 0.005274320312137498)
2026-06-06 06:00:35,257 - optuna.study.study - INFO - Trial 41 finished with values: [0.01172341898819662, 0.0015607207448589994, 0.005274320312137498] and parameters: {'n_layers': 3, 'embedding_dim': 128, 'lr': 0.0006711529294623438, 'lambda_val': 0.05520066514814425, 'batch_size': 967, 'optimizer': 'RMSprop'}.
2026-06-06 06:00:57,605 - experiment_functions - INFO - Early stopping at epoch 500. Best Metrics: (0.00047670165831533405, 7.870587447250318e-05, 0.00018629785774736829)
2026-06-06 06:00:57,692 - optuna.study.study - INFO - Trial 42 finished with values: [0.00047670165831533405, 7.870587447250318e-05, 0.00018629785774736829] and parameters: {'n_layers': 4, 'embedding_dim': 64, 'lr': 0.0001831080422236499, 'lambda_val': 2.5261528091800284e-05, 'batch_size': 1754, 'optimizer': 'SGD'}.
2026-06-06 06:01:26,748 - experiment_functions - INFO - Early stopping at epoch 600. Best Metrics: (0.03902391264123208, 0.004953446312546053, 0.018427277166559473)
2026-06-06 06:01:27,563 - optuna.study.study - INFO - Trial 43 finished with values: [0.03902391264123208, 0.004953446312546053, 0.018427277166559473] and parameters: {'n_layers': 1, 'embedding_dim': 256, 'lr': 0.010696466135957424, 'lambda_val': 0.0034713085104803743, 'batch_size': 1699, 'optimizer': 'Adam'}.
2026-06-06 06:02:42,585 - experiment_functions - INFO - Early stopping at epoch 1700. Best Metrics: (0.0008814609377503297, 0.00010382477058074887, 0.0003354020108488681)
2026-06-06 06:02:42,975 - optuna.study.study - INFO - Trial 44 finished with values: [0.0008814609377503297, 0.00010382477058074887, 0.0003354020108488681] and parameters: {'n_layers': 1, 'embedding_dim': 256, 'lr': 7.252908008304454e-05, 'lambda_val': 2.0985468033383384e-06, 'batch_size': 1388, 'optimizer': 'Adam'}.
2026-06-06 06:03:43,675 - experiment_functions - INFO - Early stopping at epoch 1350. Best Metrics: (0.0005901395998723493, 6.363453680755576e-05, 0.0002187172181445666)
2026-06-06 06:03:43,781 - optuna.study.study - INFO - Trial 45 finished with values: [0.0005901395998723493, 6.363453680755576e-05, 0.0002187172181445666] and parameters: {'n_layers': 3, 'embedding_dim': 128, 'lr': 2.6175266307115295e-05, 'lambda_val': 0.0019147790004403935, 'batch_size': 610, 'optimizer': 'RMSprop'}.
2026-06-06 06:04:14,014 - experiment_functions - INFO - Early stopping at epoch 500. Best Metrics: (0.0004359846413112206, 6.195994373367272e-05, 0.0002002428163115857)
2026-06-06 06:04:14,997 - optuna.study.study - INFO - Trial 46 finished with values: [0.0004359846413112206, 6.195994373367272e-05, 0.0002002428163115857] and parameters: {'n_layers': 4, 'embedding_dim': 256, 'lr': 0.01910930414147159, 'lambda_val': 0.00013018133791011956, 'batch_size': 1103, 'optimizer': 'SGD'}.
2026-06-06 06:04:41,326 - experiment_functions - INFO - Early stopping at epoch 550. Best Metrics: (0.016422879156632642, 0.0019458771518521, 0.00754127550742132)
2026-06-06 06:04:41,861 - optuna.study.study - INFO - Trial 47 finished with values: [0.016422879156632642, 0.0019458771518521, 0.00754127550742132] and parameters: {'n_layers': 3, 'embedding_dim': 128, 'lr': 0.00840531106258904, 'lambda_val': 0.02117775041803238, 'batch_size': 772, 'optimizer': 'RMSprop'}.
2026-06-06 06:07:20,927 - optuna.study.study - INFO - Trial 48 finished with values: [0.06368518582146096, 0.008763145555629981, 0.035196275734791845] and parameters: {'n_layers': 1, 'embedding_dim': 96, 'lr': 0.0006810282647636203, 'lambda_val': 0.003010182335575881, 'batch_size': 1712, 'optimizer': 'RMSprop'}.
2026-06-06 06:07:46,512 - experiment_functions - INFO - Early stopping at epoch 600. Best Metrics: (0.05936371964326087, 0.007322995512090563, 0.030473223583684168)
2026-06-06 06:07:46,613 - optuna.study.study - INFO - Trial 49 finished with values: [0.05936371964326087, 0.007322995512090563, 0.030473223583684168] and parameters: {'n_layers': 1, 'embedding_dim': 64, 'lr': 0.017061469787437597, 'lambda_val': 5.510107267630662e-06, 'batch_size': 3655, 'optimizer': 'Adam'}.
2026-06-06 06:08:31,651 - experiment_functions - INFO - Early stopping at epoch 1100. Best Metrics: (0.0700870620467608, 0.008547123049099069, 0.03511438013865762)
2026-06-06 06:08:31,949 - optuna.study.study - INFO - Trial 50 finished with values: [0.0700870620467608, 0.008547123049099069, 0.03511438013865762] and parameters: {'n_layers': 2, 'embedding_dim': 32, 'lr': 0.0019509035141199726, 'lambda_val': 5.315262969436241e-05, 'batch_size': 2384, 'optimizer': 'Adam'}.
2026-06-06 06:11:03,891 - optuna.study.study - INFO - Trial 51 finished with values: [0.004980005484356545, 0.0008188760131288096, 0.0025076978836058223] and parameters: {'n_layers': 3, 'embedding_dim': 32, 'lr': 0.00013510229001541778, 'lambda_val': 0.00054092001322401, 'batch_size': 2918, 'optimizer': 'RMSprop'}.
2026-06-06 06:13:47,266 - optuna.study.study - INFO - Trial 52 finished with values: [0.04160866603802917, 0.004883113403442964, 0.01910466489728196] and parameters: {'n_layers': 3, 'embedding_dim': 64, 'lr': 0.005828487948467767, 'lambda_val': 3.996555780966423e-06, 'batch_size': 1237, 'optimizer': 'RMSprop'}.
2026-06-06 06:17:05,450 - experiment_functions - INFO - Early stopping at epoch 3350. Best Metrics: (0.033996361654443696, 0.0036774063902471703, 0.015476814076161876)
2026-06-06 06:17:05,770 - optuna.study.study - INFO - Trial 53 finished with values: [0.033996361654443696, 0.0036774063902471703, 0.015476814076161876] and parameters: {'n_layers': 4, 'embedding_dim': 256, 'lr': 0.01433727156286783, 'lambda_val': 5.315262969436241e-05, 'batch_size': 2989, 'optimizer': 'Adam'}.
2026-06-06 06:18:44,712 - experiment_functions - INFO - Early stopping at epoch 1650. Best Metrics: (0.04474831466836262, 0.005027128407796905, 0.021350567667593655)
2026-06-06 06:18:44,888 - optuna.study.study - INFO - Trial 54 finished with values: [0.04474831466836262, 0.005027128407796905, 0.021350567667593655] and parameters: {'n_layers': 4, 'embedding_dim': 256, 'lr': 0.01445113432663584, 'lambda_val': 4.922331159406591e-06, 'batch_size': 1609, 'optimizer': 'RMSprop'}.
2026-06-06 06:20:17,011 - experiment_functions - INFO - Early stopping at epoch 2300. Best Metrics: (0.01262548468899801, 0.0016662201085136314, 0.005565580983642585)
2026-06-06 06:20:18,031 - optuna.study.study - INFO - Trial 55 finished with values: [0.01262548468899801, 0.0016662201085136314, 0.005565580983642585] and parameters: {'n_layers': 1, 'embedding_dim': 128, 'lr': 0.010696466135957424, 'lambda_val': 0.05520066514814425, 'batch_size': 967, 'optimizer': 'RMSprop'}.
2026-06-06 06:20:41,794 - experiment_functions - INFO - Early stopping at epoch 500. Best Metrics: (0.0006316307857005155, 8.707883984191843e-05, 0.0002920208054645296)
2026-06-06 06:20:41,873 - optuna.study.study - INFO - Trial 56 finished with values: [0.0006316307857005155, 8.707883984191843e-05, 0.0002920208054645296] and parameters: {'n_layers': 2, 'embedding_dim': 96, 'lr': 0.0006711529294623438, 'lambda_val': 0.05520066514814425, 'batch_size': 943, 'optimizer': 'SGD'}.
2026-06-06 06:22:26,080 - experiment_functions - INFO - Early stopping at epoch 2750. Best Metrics: (0.016640387140244014, 0.002190367740639025, 0.007255255952187804)
2026-06-06 06:22:26,163 - optuna.study.study - INFO - Trial 57 finished with values: [0.016640387140244014, 0.002190367740639025, 0.007255255952187804] and parameters: {'n_layers': 1, 'embedding_dim': 64, 'lr': 0.017061469787437597, 'lambda_val': 0.02117775041803238, 'batch_size': 772, 'optimizer': 'RMSprop'}.
2026-06-06 06:23:00,849 - experiment_functions - INFO - Early stopping at epoch 800. Best Metrics: (0.06558402630604586, 0.008188760131288097, 0.03235066278499444)
2026-06-06 06:23:01,369 - optuna.study.study - INFO - Trial 58 finished with values: [0.06558402630604586, 0.008188760131288097, 0.03235066278499444] and parameters: {'n_layers': 1, 'embedding_dim': 128, 'lr': 0.0017827212934439936, 'lambda_val': 0.003998877390754319, 'batch_size': 3866, 'optimizer': 'RMSprop'}.
2026-06-06 06:23:25,973 - experiment_functions - INFO - Early stopping at epoch 550. Best Metrics: (0.024223030725153107, 0.0028149909571974015, 0.011139477198828636)
2026-06-06 06:23:26,067 - optuna.study.study - INFO - Trial 59 finished with values: [0.024223030725153107, 0.0028149909571974015, 0.011139477198828636] and parameters: {'n_layers': 3, 'embedding_dim': 64, 'lr': 0.0933995728246717, 'lambda_val': 3.996555780966423e-06, 'batch_size': 2911, 'optimizer': 'Adam'}.
2026-06-06 06:26:32,472 - optuna.study.study - INFO - Trial 60 finished with values: [0.002633574913488063, 0.0004286958269140599, 0.0013597293114289907] and parameters: {'n_layers': 4, 'embedding_dim': 128, 'lr': 6.402106726977996e-05, 'lambda_val': 0.0003577550815319552, 'batch_size': 4010, 'optimizer': 'RMSprop'}.
2026-06-06 06:28:47,872 - experiment_functions - INFO - Early stopping at epoch 3050. Best Metrics: (0.037569797429458894, 0.0048295264250787055, 0.01765265359672539)
2026-06-06 06:28:48,691 - optuna.study.study - INFO - Trial 61 finished with values: [0.037569797429458894, 0.0048295264250787055, 0.01765265359672539] and parameters: {'n_layers': 1, 'embedding_dim': 256, 'lr': 0.0006711529294623438, 'lambda_val': 0.05520066514814425, 'batch_size': 1699, 'optimizer': 'RMSprop'}.
2026-06-06 06:31:43,575 - optuna.study.study - INFO - Trial 62 finished with values: [0.0061063913771908646, 0.00111025520798446, 0.00352716120310548] and parameters: {'n_layers': 1, 'embedding_dim': 256, 'lr': 0.00030476287758649944, 'lambda_val': 2.0985468033383384e-06, 'batch_size': 2177, 'optimizer': 'Adam'}.
2026-06-06 06:32:05,488 - experiment_functions - INFO - Early stopping at epoch 500. Best Metrics: (0.0005348537675416239, 8.875343291580147e-05, 0.000291657893082947)
2026-06-06 06:32:05,593 - optuna.study.study - INFO - Trial 63 finished with values: [0.0005348537675416239, 8.875343291580147e-05, 0.000291657893082947] and parameters: {'n_layers': 2, 'embedding_dim': 96, 'lr': 0.0002722811692097501, 'lambda_val': 4.36085592019629e-06, 'batch_size': 584, 'optimizer': 'SGD'}.
