2026-06-06 13:04:25,195 - optuna.study.study - INFO - Trial 13 finished with values: [0.02745037590833357, 0.0031281398620135307, 0.01252346787638197] and parameters: {'n_layers': 3, 'embedding_dim': 256, 'lr': 0.05199048927325542, 'lambda_val': 0.00025971850447075427, 'batch_size': 1838, 'optimizer': 'Adam'}.
2026-06-06 13:07:29,489 - optuna.study.study - INFO - Trial 14 finished with values: [0.06291041014784614, 0.008103355884520063, 0.03419039072680574] and parameters: {'n_layers': 3, 'embedding_dim': 128, 'lr': 0.0004543711173429324, 'lambda_val': 0.00016614359093763118, 'batch_size': 1031, 'optimizer': 'Adam'}.
2026-06-06 13:11:23,250 - optuna.study.study - INFO - Trial 15 finished with values: [0.03635539551418295, 0.005028803000870788, 0.01849049421347699] and parameters: {'n_layers': 4, 'embedding_dim': 256, 'lr': 0.00014815746640230623, 'lambda_val': 0.0007001581162856878, 'batch_size': 2163, 'optimizer': 'RMSprop'}.
2026-06-06 13:11:53,772 - experiment_functions - INFO - Early stopping at epoch 500. Best Metrics: (0.0005802767903504667, 8.875343291580146e-05, 0.0002624490717989558)
2026-06-06 13:11:53,868 - optuna.study.study - INFO - Trial 16 finished with values: [0.0005802767903504667, 8.875343291580146e-05, 0.0002624490717989558] and parameters: {'n_layers': 4, 'embedding_dim': 256, 'lr': 0.0504067015569555, 'lambda_val': 0.001953487001672056, 'batch_size': 2404, 'optimizer': 'SGD'}.
2026-06-06 13:12:20,224 - experiment_functions - INFO - Early stopping at epoch 600. Best Metrics: (0.00036624509425864637, 6.363453680755576e-05, 0.00015176916715436948)
2026-06-06 13:12:21,003 - optuna.study.study - INFO - Trial 17 finished with values: [0.00036624509425864637, 6.363453680755576e-05, 0.00015176916715436948] and parameters: {'n_layers': 2, 'embedding_dim': 96, 'lr': 9.778362659360786e-05, 'lambda_val': 0.0002948954522646474, 'batch_size': 565, 'optimizer': 'Adam'}.
2026-06-06 13:12:42,365 - experiment_functions - INFO - Early stopping at epoch 500. Best Metrics: (0.0004644701261284461, 8.707883984191843e-05, 0.0002389510205877439)
2026-06-06 13:12:43,284 - optuna.study.study - INFO - Trial 18 finished with values: [0.0004644701261284461, 8.707883984191843e-05, 0.0002389510205877439] and parameters: {'n_layers': 2, 'embedding_dim': 64, 'lr': 0.0007546086825199165, 'lambda_val': 2.8207676851082736e-05, 'batch_size': 3590, 'optimizer': 'SGD'}.
2026-06-06 13:13:10,408 - experiment_functions - INFO - Early stopping at epoch 600. Best Metrics: (0.052607231068680566, 0.0066364123517985135, 0.02574849892362655)
2026-06-06 13:13:11,599 - optuna.study.study - INFO - Trial 19 finished with values: [0.052607231068680566, 0.0066364123517985135, 0.02574849892362655] and parameters: {'n_layers': 1, 'embedding_dim': 128, 'lr': 0.013856986777548135, 'lambda_val': 0.0005031918520424605, 'batch_size': 2277, 'optimizer': 'Adam'}.
2026-06-06 13:14:02,755 - experiment_functions - INFO - Early stopping at epoch 1300. Best Metrics: (0.01937404361596108, 0.0023595016411012124, 0.008709768999140147)
2026-06-06 13:14:02,833 - optuna.study.study - INFO - Trial 20 finished with values: [0.01937404361596108, 0.0023595016411012124, 0.008709768999140147] and parameters: {'n_layers': 1, 'embedding_dim': 64, 'lr': 0.010081153699021374, 'lambda_val': 0.017411477750148854, 'batch_size': 1015, 'optimizer': 'RMSprop'}.
2026-06-06 13:14:23,532 - experiment_functions - INFO - Early stopping at epoch 500. Best Metrics: (0.000577395650411272, 8.038046754638622e-05, 0.00025853198912351107)
2026-06-06 13:14:23,772 - optuna.study.study - INFO - Trial 21 finished with values: [0.000577395650411272, 8.038046754638622e-05, 0.00025853198912351107] and parameters: {'n_layers': 1, 'embedding_dim': 32, 'lr': 0.0006507771018879831, 'lambda_val': 0.00013066365702307277, 'batch_size': 2721, 'optimizer': 'SGD'}.
2026-06-06 13:14:57,638 - experiment_functions - INFO - Early stopping at epoch 800. Best Metrics: (0.0005335180394496244, 8.540424676803538e-05, 0.000293885660282541)
2026-06-06 13:14:57,731 - optuna.study.study - INFO - Trial 22 finished with values: [0.0005335180394496244, 8.540424676803538e-05, 0.000293885660282541] and parameters: {'n_layers': 3, 'embedding_dim': 64, 'lr': 3.2797561473544116e-05, 'lambda_val': 2.0415526431970795e-06, 'batch_size': 1474, 'optimizer': 'Adam'}.
2026-06-06 13:15:22,053 - experiment_functions - INFO - Early stopping at epoch 550. Best Metrics: (0.010323020319986527, 0.0013815392859535132, 0.005315204510021143)
2026-06-06 13:15:22,311 - optuna.study.study - INFO - Trial 23 finished with values: [0.010323020319986527, 0.0013815392859535132, 0.005315204510021143] and parameters: {'n_layers': 2, 'embedding_dim': 96, 'lr': 0.09719698309756705, 'lambda_val': 4.886409589708403e-06, 'batch_size': 2047, 'optimizer': 'RMSprop'}.
2026-06-06 13:15:44,513 - experiment_functions - INFO - Early stopping at epoch 500. Best Metrics: (0.0004628451115987494, 7.033290910308795e-05, 0.00020299389995150676)
2026-06-06 13:15:44,880 - optuna.study.study - INFO - Trial 24 finished with values: [0.0004628451115987494, 7.033290910308795e-05, 0.00020299389995150676] and parameters: {'n_layers': 1, 'embedding_dim': 128, 'lr': 0.0023064993647543396, 'lambda_val': 0.0017491251394533274, 'batch_size': 1565, 'optimizer': 'SGD'}.
2026-06-06 13:16:18,325 - experiment_functions - INFO - Early stopping at epoch 550. Best Metrics: (0.01745553638509444, 0.0020061625025118894, 0.00772529036914195)
2026-06-06 13:16:18,428 - optuna.study.study - INFO - Trial 25 finished with values: [0.01745553638509444, 0.0020061625025118894, 0.00772529036914195] and parameters: {'n_layers': 3, 'embedding_dim': 256, 'lr': 0.024960250005651878, 'lambda_val': 0.006586196833192326, 'batch_size': 3832, 'optimizer': 'Adam'}.
2026-06-06 13:16:42,445 - experiment_functions - INFO - Early stopping at epoch 500. Best Metrics: (0.00045344634980933523, 6.363453680755576e-05, 0.00020699052949009358)
2026-06-06 13:16:42,544 - optuna.study.study - INFO - Trial 26 finished with values: [0.00045344634980933523, 6.363453680755576e-05, 0.00020699052949009358] and parameters: {'n_layers': 4, 'embedding_dim': 96, 'lr': 0.00012904779272115654, 'lambda_val': 0.026934516856949163, 'batch_size': 1763, 'optimizer': 'RMSprop'}.
2026-06-06 13:17:10,746 - experiment_functions - INFO - Early stopping at epoch 700. Best Metrics: (0.00038884517957802565, 5.3586978364257486e-05, 0.00015065761183943405)
2026-06-06 13:17:10,846 - optuna.study.study - INFO - Trial 27 finished with values: [0.00038884517957802565, 5.3586978364257486e-05, 0.00015065761183943405] and parameters: {'n_layers': 2, 'embedding_dim': 32, 'lr': 6.592949636150612e-05, 'lambda_val': 7.257287907525187e-06, 'batch_size': 1228, 'optimizer': 'Adam'}.
2026-06-06 13:19:15,617 - experiment_functions - INFO - Early stopping at epoch 3250. Best Metrics: (0.0004864296929012658, 8.540424676803538e-05, 0.00020755697917514978)
2026-06-06 13:19:16,386 - optuna.study.study - INFO - Trial 28 finished with values: [0.0004864296929012658, 8.540424676803538e-05, 0.00020755697917514978] and parameters: {'n_layers': 1, 'embedding_dim': 96, 'lr': 0.00012222711745347222, 'lambda_val': 0.005654238457918686, 'batch_size': 1985, 'optimizer': 'RMSprop'}.
2026-06-06 13:19:40,199 - experiment_functions - INFO - Early stopping at epoch 550. Best Metrics: (0.0005744626569916319, 7.870587447250318e-05, 0.00028550819297032236)
2026-06-06 13:19:40,410 - optuna.study.study - INFO - Trial 29 finished with values: [0.0005744626569916319, 7.870587447250318e-05, 0.00028550819297032236] and parameters: {'n_layers': 1, 'embedding_dim': 128, 'lr': 0.00015823551648389632, 'lambda_val': 0.02119502726939229, 'batch_size': 1667, 'optimizer': 'Adam'}.
2026-06-06 13:20:11,159 - experiment_functions - INFO - Early stopping at epoch 500. Best Metrics: (0.0006220208307145299, 9.042802598968451e-05, 0.0002698113947988157)
2026-06-06 13:20:11,256 - optuna.study.study - INFO - Trial 30 finished with values: [0.0006220208307145299, 9.042802598968451e-05, 0.0002698113947988157] and parameters: {'n_layers': 4, 'embedding_dim': 256, 'lr': 0.0006690991190778664, 'lambda_val': 0.0002927906123327155, 'batch_size': 2119, 'optimizer': 'SGD'}.
2026-06-06 13:20:32,785 - experiment_functions - INFO - Early stopping at epoch 500. Best Metrics: (0.0004373058272829357, 6.195994373367272e-05, 0.00022144831728119766)
2026-06-06 13:20:33,240 - optuna.study.study - INFO - Trial 31 finished with values: [0.0004373058272829357, 6.195994373367272e-05, 0.00022144831728119766] and parameters: {'n_layers': 1, 'embedding_dim': 96, 'lr': 0.0006409130095873695, 'lambda_val': 0.09759392656409067, 'batch_size': 645, 'optimizer': 'SGD'}.
2026-06-06 13:20:59,998 - experiment_functions - INFO - Early stopping at epoch 550. Best Metrics: (0.025607608397162425, 0.002992497823029004, 0.01147627117172111)
2026-06-06 13:21:00,381 - optuna.study.study - INFO - Trial 32 finished with values: [0.025607608397162425, 0.002992497823029004, 0.01147627117172111] and parameters: {'n_layers': 4, 'embedding_dim': 96, 'lr': 0.08790291616580895, 'lambda_val': 1.2160816785194988e-06, 'batch_size': 2631, 'optimizer': 'Adam'}.
2026-06-06 13:23:28,077 - optuna.study.study - INFO - Trial 33 finished with values: [0.009196510037350138, 0.0015992363855583094, 0.005382926431849725] and parameters: {'n_layers': 1, 'embedding_dim': 32, 'lr': 0.0005194903303948574, 'lambda_val': 0.0010621271203785812, 'batch_size': 1460, 'optimizer': 'Adam'}.
2026-06-06 13:26:15,420 - optuna.study.study - INFO - Trial 34 finished with values: [0.018524012572328726, 0.0024783977493469085, 0.008608948287375033] and parameters: {'n_layers': 4, 'embedding_dim': 64, 'lr': 0.00029816136001899624, 'lambda_val': 0.02300204924147889, 'batch_size': 2030, 'optimizer': 'Adam'}.
2026-06-06 13:26:37,568 - experiment_functions - INFO - Early stopping at epoch 500. Best Metrics: (0.0004898965539327337, 7.368209525085404e-05, 0.00023699363560918178)
2026-06-06 13:26:37,712 - optuna.study.study - INFO - Trial 35 finished with values: [0.0004898965539327337, 7.368209525085404e-05, 0.00023699363560918178] and parameters: {'n_layers': 2, 'embedding_dim': 96, 'lr': 0.00016552142711002372, 'lambda_val': 0.00010564732020687757, 'batch_size': 2143, 'optimizer': 'SGD'}.
2026-06-06 13:29:14,548 - optuna.study.study - INFO - Trial 36 finished with values: [0.012824328789426404, 0.001698037376917409, 0.00595686322694228] and parameters: {'n_layers': 2, 'embedding_dim': 64, 'lr': 0.000818492203535154, 'lambda_val': 0.07750876010218215, 'batch_size': 689, 'optimizer': 'RMSprop'}.
2026-06-06 13:32:02,074 - optuna.study.study - INFO - Trial 37 finished with values: [0.019013397090633457, 0.0026927456628039388, 0.009738973730399324] and parameters: {'n_layers': 4, 'embedding_dim': 64, 'lr': 0.00014493081704961333, 'lambda_val': 2.6092056130364808e-05, 'batch_size': 3633, 'optimizer': 'RMSprop'}.
2026-06-06 13:34:52,293 - optuna.study.study - INFO - Trial 38 finished with values: [0.07360163585692384, 0.009270547257016546, 0.04050332921350015] and parameters: {'n_layers': 2, 'embedding_dim': 96, 'lr': 0.0005151812249168082, 'lambda_val': 0.0002757363874074985, 'batch_size': 2440, 'optimizer': 'Adam'}.
2026-06-06 13:37:57,980 - optuna.study.study - INFO - Trial 39 finished with values: [0.09132197940016307, 0.011475986335320518, 0.04930562425645422] and parameters: {'n_layers': 1, 'embedding_dim': 256, 'lr': 0.0007970006502074318, 'lambda_val': 3.3494997586996853e-06, 'batch_size': 3074, 'optimizer': 'Adam'}.
2026-06-06 13:38:45,190 - experiment_functions - INFO - Early stopping at epoch 900. Best Metrics: (0.06258636523545819, 0.007257686382209124, 0.02992251115243758)
2026-06-06 13:38:45,268 - optuna.study.study - INFO - Trial 40 finished with values: [0.06258636523545819, 0.007257686382209124, 0.02992251115243758] and parameters: {'n_layers': 2, 'embedding_dim': 256, 'lr': 0.0016310133844241697, 'lambda_val': 4.5847333595117975e-06, 'batch_size': 2259, 'optimizer': 'RMSprop'}.
2026-06-06 13:41:50,933 - optuna.study.study - INFO - Trial 41 finished with values: [0.0009225464350148421, 0.0001540625627972403, 0.0004766329047468494] and parameters: {'n_layers': 4, 'embedding_dim': 128, 'lr': 7.06134203260073e-05, 'lambda_val': 0.005143748310703553, 'batch_size': 1516, 'optimizer': 'RMSprop'}.
2026-06-06 13:43:39,847 - experiment_functions - INFO - Early stopping at epoch 2350. Best Metrics: (0.06586594851676122, 0.008133498559849957, 0.03422984535805928)
2026-06-06 13:43:39,952 - optuna.study.study - INFO - Trial 42 finished with values: [0.06586594851676122, 0.008133498559849957, 0.03422984535805928] and parameters: {'n_layers': 3, 'embedding_dim': 128, 'lr': 0.00039823438048122364, 'lambda_val': 0.0008971608129751253, 'batch_size': 2302, 'optimizer': 'RMSprop'}.
2026-06-06 13:44:05,152 - experiment_functions - INFO - Early stopping at epoch 500. Best Metrics: (0.00040463253555558565, 5.861075758590663e-05, 0.00020007588747948958)
2026-06-06 13:44:05,776 - optuna.study.study - INFO - Trial 43 finished with values: [0.00040463253555558565, 5.861075758590663e-05, 0.00020007588747948958] and parameters: {'n_layers': 4, 'embedding_dim': 128, 'lr': 0.02617236663532539, 'lambda_val': 1.1713369465737043e-05, 'batch_size': 2549, 'optimizer': 'SGD'}.
2026-06-06 13:45:18,911 - experiment_functions - INFO - Early stopping at epoch 1550. Best Metrics: (0.0879962247021068, 0.010881505794092037, 0.04623602766331422)
2026-06-06 13:45:19,005 - optuna.study.study - INFO - Trial 44 finished with values: [0.0879962247021068, 0.010881505794092037, 0.04623602766331422] and parameters: {'n_layers': 1, 'embedding_dim': 256, 'lr': 0.0019878431480735456, 'lambda_val': 7.650473592526119e-05, 'batch_size': 1717, 'optimizer': 'Adam'}.
2026-06-06 13:45:40,558 - experiment_functions - INFO - Early stopping at epoch 500. Best Metrics: (0.0006490364576888874, 9.880099135909974e-05, 0.00034852587641483933)
2026-06-06 13:45:40,652 - optuna.study.study - INFO - Trial 45 finished with values: [0.0006490364576888874, 9.880099135909974e-05, 0.00034852587641483933] and parameters: {'n_layers': 2, 'embedding_dim': 64, 'lr': 3.610482169302858e-05, 'lambda_val': 0.0017077889046942189, 'batch_size': 1095, 'optimizer': 'SGD'}.
2026-06-06 13:48:08,228 - experiment_functions - INFO - Early stopping at epoch 2950. Best Metrics: (0.04620691231494457, 0.0053101346372831405, 0.020964494706507082)
2026-06-06 13:48:08,311 - optuna.study.study - INFO - Trial 46 finished with values: [0.04620691231494457, 0.0053101346372831405, 0.020964494706507082] and parameters: {'n_layers': 2, 'embedding_dim': 256, 'lr': 0.00593968435272672, 'lambda_val': 1.4780082520235353e-05, 'batch_size': 1165, 'optimizer': 'Adam'}.
2026-06-06 13:48:31,423 - experiment_functions - INFO - Early stopping at epoch 550. Best Metrics: (0.015611702134799366, 0.0019626230825909308, 0.0075043334998488075)
2026-06-06 13:48:31,711 - optuna.study.study - INFO - Trial 47 finished with values: [0.015611702134799366, 0.0019626230825909308, 0.0075043334998488075] and parameters: {'n_layers': 3, 'embedding_dim': 32, 'lr': 0.04708241095252787, 'lambda_val': 2.252556463844016e-05, 'batch_size': 1760, 'optimizer': 'RMSprop'}.
2026-06-06 13:48:53,298 - experiment_functions - INFO - Early stopping at epoch 500. Best Metrics: (0.00047868487776551376, 8.540424676803538e-05, 0.0002585126236924108)
2026-06-06 13:48:55,259 - optuna.study.study - INFO - Trial 48 finished with values: [0.00047868487776551376, 8.540424676803538e-05, 0.0002585126236924108] and parameters: {'n_layers': 2, 'embedding_dim': 64, 'lr': 0.0005338892879952053, 'lambda_val': 3.2950738432782127e-06, 'batch_size': 1509, 'optimizer': 'SGD'}.
2026-06-06 13:49:18,691 - experiment_functions - INFO - Early stopping at epoch 550. Best Metrics: (0.009041497379998481, 0.0010482952642507871, 0.004298028344881658)
2026-06-06 13:49:18,767 - optuna.study.study - INFO - Trial 49 finished with values: [0.009041497379998481, 0.0010482952642507871, 0.004298028344881658] and parameters: {'n_layers': 4, 'embedding_dim': 32, 'lr': 0.027467324939181564, 'lambda_val': 0.029461778634504096, 'batch_size': 1805, 'optimizer': 'RMSprop'}.
2026-06-06 13:52:08,689 - optuna.study.study - INFO - Trial 50 finished with values: [0.028144691422951184, 0.004094380065644048, 0.01720530266023358] and parameters: {'n_layers': 2, 'embedding_dim': 128, 'lr': 0.0003985149678492164, 'lambda_val': 0.0005031918520424605, 'batch_size': 520, 'optimizer': 'RMSprop'}.
2026-06-06 13:52:31,901 - experiment_functions - INFO - Early stopping at epoch 500. Best Metrics: (0.0006787270284077778, 9.712639828521669e-05, 0.00036705849862588355)
2026-06-06 13:52:31,984 - optuna.study.study - INFO - Trial 51 finished with values: [0.0006787270284077778, 9.712639828521669e-05, 0.00036705849862588355] and parameters: {'n_layers': 3, 'embedding_dim': 96, 'lr': 0.00014493081704961333, 'lambda_val': 0.07777942389555165, 'batch_size': 2995, 'optimizer': 'RMSprop'}.
2026-06-06 13:52:52,788 - experiment_functions - INFO - Early stopping at epoch 500. Best Metrics: (0.0003697627633145284, 6.698372295532186e-05, 0.00020381024782213574)
2026-06-06 13:52:53,336 - optuna.study.study - INFO - Trial 52 finished with values: [0.0003697627633145284, 6.698372295532186e-05, 0.00020381024782213574] and parameters: {'n_layers': 1, 'embedding_dim': 32, 'lr': 0.0006507771018879831, 'lambda_val': 0.0010621271203785812, 'batch_size': 2721, 'optimizer': 'SGD'}.
2026-06-06 13:54:15,067 - experiment_functions - INFO - Early stopping at epoch 2150. Best Metrics: (0.0006846366942746805, 8.707883984191842e-05, 0.00028536800738808795)
2026-06-06 13:54:15,776 - optuna.study.study - INFO - Trial 53 finished with values: [0.0006846366942746805, 8.707883984191842e-05, 0.00028536800738808795] and parameters: {'n_layers': 2, 'embedding_dim': 32, 'lr': 5.1727929785317973e-05, 'lambda_val': 0.00016614359093763118, 'batch_size': 3007, 'optimizer': 'RMSprop'}.
2026-06-06 13:54:38,410 - experiment_functions - INFO - Early stopping at epoch 500. Best Metrics: (0.0005467818594745939, 9.545180521133366e-05, 0.00028312801853663593)
2026-06-06 13:54:38,501 - optuna.study.study - INFO - Trial 54 finished with values: [0.0005467818594745939, 9.545180521133366e-05, 0.00028312801853663593] and parameters: {'n_layers': 4, 'embedding_dim': 64, 'lr': 0.0010947479206541396, 'lambda_val': 2.0434993155213635e-05, 'batch_size': 2963, 'optimizer': 'SGD'}.
2026-06-06 13:55:04,619 - experiment_functions - INFO - Early stopping at epoch 600. Best Metrics: (0.013708098064050576, 0.0016879898184741107, 0.006063509445765733)
2026-06-06 13:55:04,869 - optuna.study.study - INFO - Trial 55 finished with values: [0.013708098064050576, 0.0016879898184741107, 0.006063509445765733] and parameters: {'n_layers': 1, 'embedding_dim': 128, 'lr': 0.013856986777548135, 'lambda_val': 0.05998290825459003, 'batch_size': 2277, 'optimizer': 'Adam'}.
2026-06-06 13:56:17,034 - experiment_functions - INFO - Early stopping at epoch 1900. Best Metrics: (0.0004468168835346906, 8.372965369415234e-05, 0.00025126046569861867)
2026-06-06 13:56:17,109 - optuna.study.study - INFO - Trial 56 finished with values: [0.0004468168835346906, 8.372965369415234e-05, 0.00025126046569861867] and parameters: {'n_layers': 1, 'embedding_dim': 64, 'lr': 0.00014493081704961333, 'lambda_val': 2.6092056130364808e-05, 'batch_size': 1095, 'optimizer': 'RMSprop'}.
2026-06-06 13:57:41,612 - experiment_functions - INFO - Early stopping at epoch 1900. Best Metrics: (0.025133734644826974, 0.0032420121910375784, 0.01155342616630709)
2026-06-06 13:57:41,714 - optuna.study.study - INFO - Trial 57 finished with values: [0.025133734644826974, 0.0032420121910375784, 0.01155342616630709] and parameters: {'n_layers': 1, 'embedding_dim': 256, 'lr': 0.0007970006502074318, 'lambda_val': 0.08364495601201007, 'batch_size': 1760, 'optimizer': 'RMSprop'}.
2026-06-06 13:58:05,246 - experiment_functions - INFO - Early stopping at epoch 550. Best Metrics: (0.012316240898165017, 0.0014903878357559112, 0.0057252200657890865)
2026-06-06 13:58:05,319 - optuna.study.study - INFO - Trial 58 finished with values: [0.012316240898165017, 0.0014903878357559112, 0.0057252200657890865] and parameters: {'n_layers': 4, 'embedding_dim': 32, 'lr': 0.0504067015569555, 'lambda_val': 0.006586196833192326, 'batch_size': 2404, 'optimizer': 'Adam'}.
2026-06-06 14:00:12,289 - experiment_functions - INFO - Early stopping at epoch 2950. Best Metrics: (0.07992775504758831, 0.009715989014669435, 0.04175431067229811)
2026-06-06 14:00:12,358 - optuna.study.study - INFO - Trial 59 finished with values: [0.07992775504758831, 0.009715989014669435, 0.04175431067229811] and parameters: {'n_layers': 2, 'embedding_dim': 96, 'lr': 0.0007970006502074318, 'lambda_val': 3.3494997586996853e-06, 'batch_size': 3074, 'optimizer': 'Adam'}.
2026-06-06 14:00:43,871 - experiment_functions - INFO - Early stopping at epoch 500. Best Metrics: (0.00039925654229679933, 6.530912988143881e-05, 0.00015891272578026164)
2026-06-06 14:00:44,224 - optuna.study.study - INFO - Trial 60 finished with values: [0.00039925654229679933, 6.530912988143881e-05, 0.00015891272578026164] and parameters: {'n_layers': 4, 'embedding_dim': 256, 'lr': 0.00013792592470301187, 'lambda_val': 0.06790004674705916, 'batch_size': 1805, 'optimizer': 'RMSprop'}.
2026-06-06 14:03:26,608 - optuna.study.study - INFO - Trial 61 finished with values: [0.03843083338194605, 0.004757518922901736, 0.017898544623556525] and parameters: {'n_layers': 1, 'embedding_dim': 128, 'lr': 0.013856986777548135, 'lambda_val': 0.0005031918520424605, 'batch_size': 2277, 'optimizer': 'RMSprop'}.
2026-06-06 14:03:47,209 - experiment_functions - INFO - Early stopping at epoch 500. Best Metrics: (0.0005184123643360108, 7.033290910308795e-05, 0.00023385372034536765)
