2026-06-03 18:41:35,791 - optuna.study.study - INFO - Trial 26 finished with values: [0.0005734795401502007, 8.540424676803537e-05, 0.00026257692533415526] and parameters: {'n_layers': 2, 'embedding_dim': 64, 'lr': 0.00042268901417156205, 'lambda_val': 0.003617269668994207, 'batch_size': 680, 'optimizer': 'SGD'}.
2026-06-03 18:41:55,973 - experiment_functions - INFO - Early stopping at epoch 500. Best Metrics: (0.0004221408468373515, 7.200750217697099e-05, 0.00018195778984931533)
2026-06-03 18:41:56,079 - optuna.study.study - INFO - Trial 27 finished with values: [0.0004221408468373515, 7.200750217697099e-05, 0.00018195778984931533] and parameters: {'n_layers': 2, 'embedding_dim': 32, 'lr': 0.09389528997202237, 'lambda_val': 1.8417844132324817e-06, 'batch_size': 1770, 'optimizer': 'SGD'}.
2026-06-03 18:42:20,269 - experiment_functions - INFO - Early stopping at epoch 550. Best Metrics: (0.0059786858324489935, 0.0009880099135909975, 0.0034372885136688494)
2026-06-03 18:42:20,380 - optuna.study.study - INFO - Trial 28 finished with values: [0.0059786858324489935, 0.0009880099135909975, 0.0034372885136688494] and parameters: {'n_layers': 3, 'embedding_dim': 96, 'lr': 0.011544828952739577, 'lambda_val': 0.0010538261748747916, 'batch_size': 1446, 'optimizer': 'Adam'}.
2026-06-03 18:42:40,524 - experiment_functions - INFO - Early stopping at epoch 500. Best Metrics: (0.0005126131521141618, 7.703128139862015e-05, 0.00022903744691895342)
2026-06-03 18:42:40,623 - optuna.study.study - INFO - Trial 29 finished with values: [0.0005126131521141618, 7.703128139862015e-05, 0.00022903744691895342] and parameters: {'n_layers': 1, 'embedding_dim': 32, 'lr': 0.0063714433987838385, 'lambda_val': 8.715020965617673e-05, 'batch_size': 665, 'optimizer': 'SGD'}.
2026-06-03 18:43:02,408 - experiment_functions - INFO - Early stopping at epoch 500. Best Metrics: (0.00046838801828846653, 7.703128139862015e-05, 0.00023398841310417947)
2026-06-03 18:43:02,507 - optuna.study.study - INFO - Trial 30 finished with values: [0.00046838801828846653, 7.703128139862015e-05, 0.00023398841310417947] and parameters: {'n_layers': 3, 'embedding_dim': 96, 'lr': 8.284033712983715e-05, 'lambda_val': 0.00017695593771970523, 'batch_size': 3942, 'optimizer': 'SGD'}.
2026-06-03 18:46:11,306 - optuna.study.study - INFO - Trial 31 finished with values: [0.00614802073348691, 0.0010315493335119566, 0.003733644857290393] and parameters: {'n_layers': 3, 'embedding_dim': 256, 'lr': 0.0003517857503442046, 'lambda_val': 0.003379656411935868, 'batch_size': 513, 'optimizer': 'RMSprop'}.
2026-06-03 18:48:44,021 - optuna.study.study - INFO - Trial 32 finished with values: [0.0006126717977308734, 0.00011052314287628108, 0.00032923447629014575] and parameters: {'n_layers': 2, 'embedding_dim': 96, 'lr': 8.637823228343827e-05, 'lambda_val': 2.393431434886667e-06, 'batch_size': 1733, 'optimizer': 'RMSprop'}.
2026-06-03 18:49:04,249 - experiment_functions - INFO - Early stopping at epoch 500. Best Metrics: (0.0003735753041678281, 7.2007502176971e-05, 0.00015129617361920114)
2026-06-03 18:49:04,341 - optuna.study.study - INFO - Trial 33 finished with values: [0.0003735753041678281, 7.2007502176971e-05, 0.00015129617361920114] and parameters: {'n_layers': 3, 'embedding_dim': 32, 'lr': 0.0005532105580283136, 'lambda_val': 0.00016031914143972386, 'batch_size': 2502, 'optimizer': 'SGD'}.
2026-06-03 18:51:40,490 - optuna.study.study - INFO - Trial 34 finished with values: [0.01158708650981411, 0.0020044879094380068, 0.006939351594966802] and parameters: {'n_layers': 4, 'embedding_dim': 64, 'lr': 0.000710331438856921, 'lambda_val': 0.00047268866494377303, 'batch_size': 774, 'optimizer': 'Adam'}.
2026-06-03 18:54:09,370 - optuna.study.study - INFO - Trial 35 finished with values: [0.0009321283001505221, 0.00013229285283676068, 0.00039606979455962445] and parameters: {'n_layers': 1, 'embedding_dim': 96, 'lr': 8.121894063645713e-05, 'lambda_val': 1.0139570246796915e-05, 'batch_size': 3980, 'optimizer': 'Adam'}.
2026-06-03 18:54:43,962 - experiment_functions - INFO - Early stopping at epoch 850. Best Metrics: (0.007840679996562207, 0.0014334516712438878, 0.004640328763955592)
2026-06-03 18:54:44,047 - optuna.study.study - INFO - Trial 36 finished with values: [0.007840679996562207, 0.0014334516712438878, 0.004640328763955592] and parameters: {'n_layers': 3, 'embedding_dim': 64, 'lr': 0.00280088767043512, 'lambda_val': 8.287870093807144e-05, 'batch_size': 1371, 'optimizer': 'Adam'}.
2026-06-03 18:55:07,612 - experiment_functions - INFO - Early stopping at epoch 550. Best Metrics: (0.0054179600101893575, 0.0009160024114140264, 0.003172021809526375)
2026-06-03 18:55:07,725 - optuna.study.study - INFO - Trial 37 finished with values: [0.0054179600101893575, 0.0009160024114140264, 0.003172021809526375] and parameters: {'n_layers': 4, 'embedding_dim': 64, 'lr': 0.03446031343627178, 'lambda_val': 0.00010733978042493688, 'batch_size': 3398, 'optimizer': 'Adam'}.
2026-06-03 18:57:52,319 - optuna.study.study - INFO - Trial 38 finished with values: [0.0038496481945725154, 0.0007284479871391252, 0.0023778860588251063] and parameters: {'n_layers': 3, 'embedding_dim': 128, 'lr': 0.00037734562638801824, 'lambda_val': 0.07088990051076362, 'batch_size': 1580, 'optimizer': 'Adam'}.
2026-06-03 18:58:14,514 - experiment_functions - INFO - Early stopping at epoch 550. Best Metrics: (0.00026564903881822247, 5.526157143814054e-05, 0.00015840716008028472)
2026-06-03 18:58:14,604 - optuna.study.study - INFO - Trial 39 finished with values: [0.00026564903881822247, 5.526157143814054e-05, 0.00015840716008028472] and parameters: {'n_layers': 3, 'embedding_dim': 32, 'lr': 0.016547659515674606, 'lambda_val': 1.228677367576637e-05, 'batch_size': 1542, 'optimizer': 'SGD'}.
2026-06-03 18:58:35,357 - experiment_functions - INFO - Early stopping at epoch 500. Best Metrics: (0.00035857493920406675, 6.363453680755577e-05, 0.00020127686841502936)
2026-06-03 18:58:35,454 - optuna.study.study - INFO - Trial 40 finished with values: [0.00035857493920406675, 6.363453680755577e-05, 0.00020127686841502936] and parameters: {'n_layers': 1, 'embedding_dim': 128, 'lr': 0.00011733765921819139, 'lambda_val': 0.0021396894787044088, 'batch_size': 996, 'optimizer': 'SGD'}.
2026-06-03 19:00:43,865 - experiment_functions - INFO - Early stopping at epoch 3600. Best Metrics: (0.0004733733346422841, 7.703128139862013e-05, 0.0002319305368182287)
2026-06-03 19:00:43,954 - optuna.study.study - INFO - Trial 41 finished with values: [0.0004733733346422841, 7.703128139862013e-05, 0.0002319305368182287] and parameters: {'n_layers': 1, 'embedding_dim': 32, 'lr': 7.253574174507539e-05, 'lambda_val': 1.5217347204976375e-05, 'batch_size': 664, 'optimizer': 'Adam'}.
2026-06-03 19:01:09,338 - experiment_functions - INFO - Early stopping at epoch 500. Best Metrics: (0.0006347220539407858, 9.042802598968451e-05, 0.00027960979247296214)
2026-06-03 19:01:10,048 - optuna.study.study - INFO - Trial 42 finished with values: [0.0006347220539407858, 9.042802598968451e-05, 0.00027960979247296214] and parameters: {'n_layers': 3, 'embedding_dim': 256, 'lr': 2.6928964739957108e-05, 'lambda_val': 0.026376980701189847, 'batch_size': 3116, 'optimizer': 'SGD'}.
2026-06-03 19:01:41,156 - experiment_functions - INFO - Early stopping at epoch 700. Best Metrics: (0.006956464512570994, 0.001220778350860741, 0.004033509087516856)
2026-06-03 19:01:42,197 - optuna.study.study - INFO - Trial 43 finished with values: [0.006956464512570994, 0.001220778350860741, 0.004033509087516856] and parameters: {'n_layers': 3, 'embedding_dim': 128, 'lr': 0.004007370943469233, 'lambda_val': 0.00016259265782080494, 'batch_size': 2984, 'optimizer': 'Adam'}.
2026-06-03 19:03:21,274 - experiment_functions - INFO - Early stopping at epoch 2650. Best Metrics: (0.0004976893224004995, 8.205506062026927e-05, 0.00019810959801337197)
2026-06-03 19:03:21,594 - optuna.study.study - INFO - Trial 44 finished with values: [0.0004976893224004995, 8.205506062026927e-05, 0.00019810959801337197] and parameters: {'n_layers': 4, 'embedding_dim': 32, 'lr': 4.8120991161034025e-05, 'lambda_val': 9.42110145837049e-05, 'batch_size': 1493, 'optimizer': 'RMSprop'}.
2026-06-03 19:05:53,170 - optuna.study.study - INFO - Trial 45 finished with values: [0.0006740129902371827, 0.0001004755844329828, 0.0002912368414264498] and parameters: {'n_layers': 1, 'embedding_dim': 128, 'lr': 0.00010263055976391896, 'lambda_val': 5.085972175639675e-06, 'batch_size': 641, 'optimizer': 'Adam'}.
2026-06-03 19:06:13,390 - experiment_functions - INFO - Early stopping at epoch 500. Best Metrics: (0.0004605531343339011, 7.033290910308795e-05, 0.00021207525504645636)
2026-06-03 19:06:13,715 - optuna.study.study - INFO - Trial 46 finished with values: [0.0004605531343339011, 7.033290910308795e-05, 0.00021207525504645636] and parameters: {'n_layers': 1, 'embedding_dim': 64, 'lr': 0.00028258300925281844, 'lambda_val': 4.9301557280128085e-05, 'batch_size': 2862, 'optimizer': 'SGD'}.
2026-06-03 19:06:34,687 - experiment_functions - INFO - Early stopping at epoch 500. Best Metrics: (0.0005320248978328999, 6.530912988143882e-05, 0.0002337894036989856)
2026-06-03 19:06:34,826 - optuna.study.study - INFO - Trial 47 finished with values: [0.0005320248978328999, 6.530912988143882e-05, 0.0002337894036989856] and parameters: {'n_layers': 3, 'embedding_dim': 64, 'lr': 7.780587389939403e-05, 'lambda_val': 3.6253073924106987e-06, 'batch_size': 2834, 'optimizer': 'SGD'}.
2026-06-03 19:06:58,127 - experiment_functions - INFO - Early stopping at epoch 550. Best Metrics: (0.005547029086335366, 0.0009846607274432314, 0.0032939774440935146)
2026-06-03 19:06:58,212 - optuna.study.study - INFO - Trial 48 finished with values: [0.005547029086335366, 0.0009846607274432314, 0.0032939774440935146] and parameters: {'n_layers': 3, 'embedding_dim': 64, 'lr': 0.005875923861834851, 'lambda_val': 0.00025850151634462684, 'batch_size': 2574, 'optimizer': 'RMSprop'}.
2026-06-03 19:07:20,808 - experiment_functions - INFO - Early stopping at epoch 500. Best Metrics: (0.0005636253383575041, 7.53566883247371e-05, 0.0002449393669425317)
2026-06-03 19:07:20,894 - optuna.study.study - INFO - Trial 49 finished with values: [0.0005636253383575041, 7.53566883247371e-05, 0.0002449393669425317] and parameters: {'n_layers': 3, 'embedding_dim': 128, 'lr': 8.561301360591945e-05, 'lambda_val': 0.03761145984863424, 'batch_size': 3484, 'optimizer': 'RMSprop'}.
2026-06-03 19:07:56,691 - experiment_functions - INFO - Early stopping at epoch 850. Best Metrics: (0.00460176195360647, 0.0009143278183401435, 0.0026824928858599443)
2026-06-03 19:07:57,362 - optuna.study.study - INFO - Trial 50 finished with values: [0.00460176195360647, 0.0009143278183401435, 0.0026824928858599443] and parameters: {'n_layers': 3, 'embedding_dim': 96, 'lr': 0.0018040479477802712, 'lambda_val': 0.026376980701189847, 'batch_size': 1936, 'optimizer': 'Adam'}.
2026-06-03 19:08:28,039 - experiment_functions - INFO - Early stopping at epoch 750. Best Metrics: (0.008464691883298694, 0.001476991091164847, 0.005026875980351756)
2026-06-03 19:08:28,190 - optuna.study.study - INFO - Trial 51 finished with values: [0.008464691883298694, 0.001476991091164847, 0.005026875980351756] and parameters: {'n_layers': 3, 'embedding_dim': 64, 'lr': 0.002060594231766347, 'lambda_val': 0.00021888803225104277, 'batch_size': 2127, 'optimizer': 'RMSprop'}.
2026-06-03 19:08:49,613 - experiment_functions - INFO - Early stopping at epoch 500. Best Metrics: (0.0007120402113901899, 0.00010215017750686583, 0.0002983245393299212)
2026-06-03 19:08:50,493 - optuna.study.study - INFO - Trial 52 finished with values: [0.0007120402113901899, 0.00010215017750686583, 0.0002983245393299212] and parameters: {'n_layers': 4, 'embedding_dim': 64, 'lr': 0.0038053181581307245, 'lambda_val': 1.3849771019288732e-05, 'batch_size': 681, 'optimizer': 'SGD'}.
2026-06-03 19:11:18,559 - optuna.study.study - INFO - Trial 53 finished with values: [0.0009887240880992183, 0.00015741174894500637, 0.0004653541092309437] and parameters: {'n_layers': 2, 'embedding_dim': 64, 'lr': 0.0001463216973541482, 'lambda_val': 1.109906362587361e-06, 'batch_size': 1213, 'optimizer': 'RMSprop'}.
2026-06-03 19:11:47,145 - experiment_functions - INFO - Early stopping at epoch 550. Best Metrics: (0.004717212311342918, 0.0008238997923504589, 0.002669519944848164)
2026-06-03 19:11:47,231 - optuna.study.study - INFO - Trial 54 finished with values: [0.004717212311342918, 0.0008238997923504589, 0.002669519944848164] and parameters: {'n_layers': 3, 'embedding_dim': 256, 'lr': 0.011544828952739577, 'lambda_val': 0.008589102899886254, 'batch_size': 1449, 'optimizer': 'Adam'}.
2026-06-03 19:13:08,257 - experiment_functions - INFO - Early stopping at epoch 2150. Best Metrics: (0.006452476709122356, 0.0010215017750686585, 0.003790638432828482)
2026-06-03 19:13:08,788 - optuna.study.study - INFO - Trial 55 finished with values: [0.006452476709122356, 0.0010215017750686585, 0.003790638432828482] and parameters: {'n_layers': 1, 'embedding_dim': 96, 'lr': 0.0015683866974798046, 'lambda_val': 2.393431434886667e-06, 'batch_size': 1505, 'optimizer': 'RMSprop'}.
2026-06-03 19:13:32,228 - experiment_functions - INFO - Early stopping at epoch 550. Best Metrics: (0.004088768705574179, 0.0007066782771786456, 0.0023620882070258973)
2026-06-03 19:13:32,318 - optuna.study.study - INFO - Trial 56 finished with values: [0.004088768705574179, 0.0007066782771786456, 0.0023620882070258973] and parameters: {'n_layers': 2, 'embedding_dim': 96, 'lr': 0.03446031343627178, 'lambda_val': 0.00010733978042493688, 'batch_size': 790, 'optimizer': 'Adam'}.
2026-06-03 19:13:53,810 - experiment_functions - INFO - Early stopping at epoch 500. Best Metrics: (0.0005036154230100199, 8.038046754638622e-05, 0.0002326236665910852)
2026-06-03 19:13:54,031 - optuna.study.study - INFO - Trial 57 finished with values: [0.0005036154230100199, 8.038046754638622e-05, 0.0002326236665910852] and parameters: {'n_layers': 4, 'embedding_dim': 64, 'lr': 3.916763860789649e-05, 'lambda_val': 0.035425396326119726, 'batch_size': 3942, 'optimizer': 'RMSprop'}.
2026-06-03 19:14:20,463 - experiment_functions - INFO - Early stopping at epoch 650. Best Metrics: (0.004849353653611978, 0.000751892290173488, 0.0026875675771776244)
2026-06-03 19:14:20,552 - optuna.study.study - INFO - Trial 58 finished with values: [0.004849353653611978, 0.000751892290173488, 0.0026875675771776244] and parameters: {'n_layers': 1, 'embedding_dim': 64, 'lr': 0.004007370943469233, 'lambda_val': 0.00016259265782080494, 'batch_size': 2984, 'optimizer': 'RMSprop'}.
2026-06-03 19:15:22,425 - experiment_functions - INFO - Early stopping at epoch 1650. Best Metrics: (0.008824123847641814, 0.0014686181257954319, 0.005084963265320738)
2026-06-03 19:15:22,516 - optuna.study.study - INFO - Trial 59 finished with values: [0.008824123847641814, 0.0014686181257954319, 0.005084963265320738] and parameters: {'n_layers': 2, 'embedding_dim': 32, 'lr': 0.002060594231766347, 'lambda_val': 0.00021888803225104277, 'batch_size': 790, 'optimizer': 'RMSprop'}.
2026-06-03 19:17:55,000 - optuna.study.study - INFO - Trial 60 finished with values: [0.002328210136151233, 0.00032487105633331097, 0.0013263154022618122] and parameters: {'n_layers': 2, 'embedding_dim': 96, 'lr': 0.0003517857503442046, 'lambda_val': 0.003379656411935868, 'batch_size': 513, 'optimizer': 'RMSprop'}.
2026-06-03 19:18:36,870 - experiment_functions - INFO - Early stopping at epoch 1100. Best Metrics: (0.0061703512959283046, 0.000900931073749079, 0.0032516044241765697)
2026-06-03 19:18:36,964 - optuna.study.study - INFO - Trial 61 finished with values: [0.0061703512959283046, 0.000900931073749079, 0.0032516044241765697] and parameters: {'n_layers': 1, 'embedding_dim': 32, 'lr': 0.0014471032063295877, 'lambda_val': 1.109906362587361e-06, 'batch_size': 3116, 'optimizer': 'RMSprop'}.
2026-06-03 19:20:22,672 - experiment_functions - INFO - Early stopping at epoch 2550. Best Metrics: (0.004759992834235443, 0.000892558108379664, 0.002608021627324136)
2026-06-03 19:20:22,762 - optuna.study.study - INFO - Trial 62 finished with values: [0.004759992834235443, 0.000892558108379664, 0.002608021627324136] and parameters: {'n_layers': 1, 'embedding_dim': 256, 'lr': 0.03789202322821606, 'lambda_val': 0.00025850151634462684, 'batch_size': 1015, 'optimizer': 'RMSprop'}.
2026-06-03 19:22:41,544 - experiment_functions - INFO - Early stopping at epoch 3400. Best Metrics: (0.0007276725857055876, 0.0001038247705807489, 0.00030278202341035707)
2026-06-03 19:22:41,692 - optuna.study.study - INFO - Trial 63 finished with values: [0.0007276725857055876, 0.0001038247705807489, 0.00030278202341035707] and parameters: {'n_layers': 1, 'embedding_dim': 256, 'lr': 8.121894063645713e-05, 'lambda_val': 1.0139570246796915e-05, 'batch_size': 681, 'optimizer': 'RMSprop'}.
2026-06-03 19:23:18,845 - experiment_functions - INFO - Early stopping at epoch 850. Best Metrics: (0.008217874770263079, 0.0014334516712438876, 0.00465062422683086)
2026-06-03 19:23:18,931 - optuna.study.study - INFO - Trial 64 finished with values: [0.008217874770263079, 0.0014334516712438876, 0.00465062422683086] and parameters: {'n_layers': 3, 'embedding_dim': 128, 'lr': 0.0027608560004649, 'lambda_val': 5.085972175639675e-06, 'batch_size': 1308, 'optimizer': 'Adam'}.
2026-06-03 19:23:54,150 - experiment_functions - INFO - Early stopping at epoch 900. Best Metrics: (0.004061426269001017, 0.0006698372295532187, 0.002422561968533118)
2026-06-03 19:23:54,390 - optuna.study.study - INFO - Trial 65 finished with values: [0.004061426269001017, 0.0006698372295532187, 0.002422561968533118] and parameters: {'n_layers': 1, 'embedding_dim': 96, 'lr': 0.0014471032063295877, 'lambda_val': 0.003379656411935868, 'batch_size': 1872, 'optimizer': 'RMSprop'}.
2026-06-03 19:26:03,957 - experiment_functions - INFO - Early stopping at epoch 3400. Best Metrics: (0.0005349032963612505, 0.00010047558443298278, 0.0002688970674787664)
2026-06-03 19:26:04,029 - optuna.study.study - INFO - Trial 66 finished with values: [0.0005349032963612505, 0.00010047558443298278, 0.0002688970674787664] and parameters: {'n_layers': 2, 'embedding_dim': 96, 'lr': 8.637823228343827e-05, 'lambda_val': 2.393431434886667e-06, 'batch_size': 1733, 'optimizer': 'RMSprop'}.
2026-06-03 19:26:25,001 - experiment_functions - INFO - Early stopping at epoch 500. Best Metrics: (0.00038599534364784, 7.368209525085404e-05, 0.000190890408853949)
2026-06-03 19:26:25,295 - optuna.study.study - INFO - Trial 67 finished with values: [0.00038599534364784, 7.368209525085404e-05, 0.000190890408853949] and parameters: {'n_layers': 2, 'embedding_dim': 96, 'lr': 0.005853681807819527, 'lambda_val': 0.00025850151634462684, 'batch_size': 2104, 'optimizer': 'SGD'}.
2026-06-03 19:26:46,911 - experiment_functions - INFO - Early stopping at epoch 500. Best Metrics: (0.0006521989838425378, 8.205506062026927e-05, 0.00026264348317817034)
2026-06-03 19:26:47,388 - optuna.study.study - INFO - Trial 68 finished with values: [0.0006521989838425378, 8.205506062026927e-05, 0.00026264348317817034] and parameters: {'n_layers': 3, 'embedding_dim': 96, 'lr': 8.284033712983715e-05, 'lambda_val': 0.00017695593771970523, 'batch_size': 3942, 'optimizer': 'SGD'}.
2026-06-03 19:27:43,417 - experiment_functions - INFO - Early stopping at epoch 1500. Best Metrics: (0.0005308569244030848, 8.038046754638622e-05, 0.00027643632301922977)
2026-06-03 19:27:43,514 - optuna.study.study - INFO - Trial 69 finished with values: [0.0005308569244030848, 8.038046754638622e-05, 0.00027643632301922977] and parameters: {'n_layers': 1, 'embedding_dim': 64, 'lr': 2.9046508338137656e-05, 'lambda_val': 0.001214423045852566, 'batch_size': 3893, 'optimizer': 'Adam'}.
2026-06-03 19:28:18,356 - experiment_functions - INFO - Early stopping at epoch 850. Best Metrics: (0.002101278856074596, 0.0004152990823229955, 0.001132844728251501)
2026-06-03 19:28:18,471 - optuna.study.study - INFO - Trial 70 finished with values: [0.002101278856074596, 0.0004152990823229955, 0.001132844728251501] and parameters: {'n_layers': 4, 'embedding_dim': 64, 'lr': 0.047868600250918256, 'lambda_val': 0.09402982700871432, 'batch_size': 3398, 'optimizer': 'RMSprop'}.
2026-06-03 19:28:45,238 - experiment_functions - INFO - Early stopping at epoch 500. Best Metrics: (0.0004563372509054881, 7.200750217697099e-05, 0.0001853908790553214)
2026-06-03 19:28:45,408 - optuna.study.study - INFO - Trial 71 finished with values: [0.0004563372509054881, 7.200750217697099e-05, 0.0001853908790553214] and parameters: {'n_layers': 4, 'embedding_dim': 256, 'lr': 0.0038053181581307245, 'lambda_val': 1.3849771019288732e-05, 'batch_size': 1671, 'optimizer': 'SGD'}.
2026-06-03 19:29:09,244 - experiment_functions - INFO - Early stopping at epoch 500. Best Metrics: (0.0005319782580832202, 8.540424676803538e-05, 0.00029662768671197607)
2026-06-03 19:29:10,330 - optuna.study.study - INFO - Trial 72 finished with values: [0.0005319782580832202, 8.540424676803538e-05, 0.00029662768671197607] and parameters: {'n_layers': 2, 'embedding_dim': 256, 'lr': 0.016547659515674606, 'lambda_val': 1.228677367576637e-05, 'batch_size': 3116, 'optimizer': 'SGD'}.
2026-06-03 19:30:26,972 - experiment_functions - INFO - Early stopping at epoch 1850. Best Metrics: (0.0005128455100368441, 7.2007502176971e-05, 0.00020716170631103305)
2026-06-03 19:30:27,056 - optuna.study.study - INFO - Trial 73 finished with values: [0.0005128455100368441, 7.2007502176971e-05, 0.00020716170631103305] and parameters: {'n_layers': 1, 'embedding_dim': 256, 'lr': 1.0517175989980823e-05, 'lambda_val': 0.014913533649560542, 'batch_size': 1310, 'optimizer': 'RMSprop'}.
2026-06-03 19:30:50,184 - experiment_functions - INFO - Early stopping at epoch 550. Best Metrics: (0.003733688358422132, 0.0007334717663607743, 0.00223686454391802)
