2026-06-03 21:36:43,640 - optuna.study.study - INFO - Trial 172 finished with values: [0.007503852439639631, 0.001219103757786858, 0.004430842863053256] and parameters: {'n_layers': 4, 'embedding_dim': 32, 'lr': 0.00033058091149224526, 'lambda_val': 0.003379656411935868, 'batch_size': 3398, 'optimizer': 'RMSprop'}.
2026-06-03 21:37:16,600 - experiment_functions - INFO - Early stopping at epoch 800. Best Metrics: (0.00675882593409535, 0.0011621675932748344, 0.003873079705755786)
2026-06-03 21:37:16,898 - optuna.study.study - INFO - Trial 173 finished with values: [0.00675882593409535, 0.0011621675932748344, 0.003873079705755786] and parameters: {'n_layers': 2, 'embedding_dim': 96, 'lr': 0.0018040479477802712, 'lambda_val': 0.00021888803225104277, 'batch_size': 2574, 'optimizer': 'RMSprop'}.
2026-06-03 21:38:48,244 - experiment_functions - INFO - Early stopping at epoch 1900. Best Metrics: (0.010330672969517375, 0.0018805680219706614, 0.006038117656711319)
2026-06-03 21:38:48,340 - optuna.study.study - INFO - Trial 174 finished with values: [0.010330672969517375, 0.0018805680219706614, 0.006038117656711319] and parameters: {'n_layers': 3, 'embedding_dim': 256, 'lr': 0.0006306221245460524, 'lambda_val': 1.4920813731644995e-06, 'batch_size': 1308, 'optimizer': 'RMSprop'}.
2026-06-03 21:39:28,152 - experiment_functions - INFO - Early stopping at epoch 950. Best Metrics: (0.006113311560960994, 0.0011253265456494072, 0.003537497067967695)
2026-06-03 21:39:28,464 - optuna.study.study - INFO - Trial 175 finished with values: [0.006113311560960994, 0.0011253265456494072, 0.003537497067967695] and parameters: {'n_layers': 2, 'embedding_dim': 128, 'lr': 0.0027608560004649, 'lambda_val': 2.468073181110974e-06, 'batch_size': 2650, 'optimizer': 'Adam'}.
2026-06-03 21:39:59,273 - experiment_functions - INFO - Early stopping at epoch 700. Best Metrics: (0.005996469818648978, 0.001152120034831536, 0.0035252863359634414)
2026-06-03 21:39:59,352 - optuna.study.study - INFO - Trial 176 finished with values: [0.005996469818648978, 0.001152120034831536, 0.0035252863359634414] and parameters: {'n_layers': 3, 'embedding_dim': 128, 'lr': 0.0027608560004649, 'lambda_val': 0.003379656411935868, 'batch_size': 1308, 'optimizer': 'Adam'}.
2026-06-03 21:40:29,399 - experiment_functions - INFO - Early stopping at epoch 550. Best Metrics: (0.0050674083538715855, 0.0009913590997387635, 0.002978489651198926)
2026-06-03 21:40:30,293 - optuna.study.study - INFO - Trial 177 finished with values: [0.0050674083538715855, 0.0009913590997387635, 0.002978489651198926] and parameters: {'n_layers': 4, 'embedding_dim': 256, 'lr': 0.004007370943469233, 'lambda_val': 0.003379656411935868, 'batch_size': 3442, 'optimizer': 'RMSprop'}.
2026-06-03 21:40:51,649 - experiment_functions - INFO - Early stopping at epoch 500. Best Metrics: (0.0005235689975320304, 7.033290910308795e-05, 0.00021793103388610758)
2026-06-03 21:40:52,525 - optuna.study.study - INFO - Trial 178 finished with values: [0.0005235689975320304, 7.033290910308795e-05, 0.00021793103388610758] and parameters: {'n_layers': 4, 'embedding_dim': 64, 'lr': 0.062440406846716465, 'lambda_val': 0.00025850151634462684, 'batch_size': 3980, 'optimizer': 'SGD'}.
2026-06-03 21:41:17,776 - experiment_functions - INFO - Early stopping at epoch 500. Best Metrics: (0.0004571115323709202, 7.2007502176971e-05, 0.00021235220890492668)
2026-06-03 21:41:17,867 - optuna.study.study - INFO - Trial 179 finished with values: [0.0004571115323709202, 7.2007502176971e-05, 0.00021235220890492668] and parameters: {'n_layers': 3, 'embedding_dim': 256, 'lr': 8.569779170380212e-05, 'lambda_val': 0.00016259265782080494, 'batch_size': 2270, 'optimizer': 'SGD'}.
2026-06-03 21:41:40,257 - experiment_functions - INFO - Early stopping at epoch 550. Best Metrics: (0.004732863002089427, 0.000753566883247371, 0.002559875130763014)
2026-06-03 21:41:40,351 - optuna.study.study - INFO - Trial 180 finished with values: [0.004732863002089427, 0.000753566883247371, 0.002559875130763014] and parameters: {'n_layers': 3, 'embedding_dim': 32, 'lr': 0.013046142472379304, 'lambda_val': 5.085972175639675e-06, 'batch_size': 1308, 'optimizer': 'RMSprop'}.
2026-06-03 21:42:21,942 - experiment_functions - INFO - Early stopping at epoch 900. Best Metrics: (0.006257546720796835, 0.0011186281733538753, 0.0034622408797700104)
2026-06-03 21:42:22,023 - optuna.study.study - INFO - Trial 181 finished with values: [0.006257546720796835, 0.0011186281733538753, 0.0034622408797700104] and parameters: {'n_layers': 2, 'embedding_dim': 256, 'lr': 0.00280088767043512, 'lambda_val': 8.287870093807144e-05, 'batch_size': 1371, 'optimizer': 'RMSprop'}.
2026-06-03 21:43:24,005 - experiment_functions - INFO - Early stopping at epoch 1650. Best Metrics: (0.006619402836140651, 0.0009813115412954652, 0.003662063081609244)
2026-06-03 21:43:24,099 - optuna.study.study - INFO - Trial 182 finished with values: [0.006619402836140651, 0.0009813115412954652, 0.003662063081609244] and parameters: {'n_layers': 1, 'embedding_dim': 64, 'lr': 0.0014471032063295877, 'lambda_val': 0.00025850151634462684, 'batch_size': 1213, 'optimizer': 'RMSprop'}.
2026-06-03 21:43:49,071 - experiment_functions - INFO - Early stopping at epoch 550. Best Metrics: (0.006240238018973966, 0.0010700649742112667, 0.003450608785518995)
2026-06-03 21:43:49,400 - optuna.study.study - INFO - Trial 183 finished with values: [0.006240238018973966, 0.0010700649742112667, 0.003450608785518995] and parameters: {'n_layers': 3, 'embedding_dim': 128, 'lr': 0.01940586887095751, 'lambda_val': 2.468073181110974e-06, 'batch_size': 1446, 'optimizer': 'Adam'}.
2026-06-03 21:45:19,729 - experiment_functions - INFO - Early stopping at epoch 1750. Best Metrics: (0.0077073301723221905, 0.0014753164980909638, 0.00442999704176927)
2026-06-03 21:45:20,431 - optuna.study.study - INFO - Trial 184 finished with values: [0.0077073301723221905, 0.0014753164980909638, 0.00442999704176927] and parameters: {'n_layers': 4, 'embedding_dim': 256, 'lr': 0.00033058091149224526, 'lambda_val': 0.003379656411935868, 'batch_size': 2270, 'optimizer': 'RMSprop'}.
2026-06-03 21:47:27,946 - experiment_functions - INFO - Early stopping at epoch 3200. Best Metrics: (0.009360970190985148, 0.0016678947015875147, 0.0053244092311050826)
2026-06-03 21:47:28,047 - optuna.study.study - INFO - Trial 185 finished with values: [0.009360970190985148, 0.0016678947015875147, 0.0053244092311050826] and parameters: {'n_layers': 4, 'embedding_dim': 64, 'lr': 0.000710331438856921, 'lambda_val': 5.609342222844582e-06, 'batch_size': 2467, 'optimizer': 'Adam'}.
2026-06-03 21:48:35,682 - experiment_functions - INFO - Early stopping at epoch 1750. Best Metrics: (0.0068669997430468145, 0.0010951838703195124, 0.0038072820892344236)
2026-06-03 21:48:35,785 - optuna.study.study - INFO - Trial 186 finished with values: [0.0068669997430468145, 0.0010951838703195124, 0.0038072820892344236] and parameters: {'n_layers': 2, 'embedding_dim': 64, 'lr': 0.002060594231766347, 'lambda_val': 2.468073181110974e-06, 'batch_size': 1308, 'optimizer': 'Adam'}.
2026-06-03 21:49:00,389 - experiment_functions - INFO - Early stopping at epoch 550. Best Metrics: (0.003486976306493993, 0.0006112264719673119, 0.002003630529660929)
2026-06-03 21:49:00,484 - optuna.study.study - INFO - Trial 187 finished with values: [0.003486976306493993, 0.0006112264719673119, 0.002003630529660929] and parameters: {'n_layers': 4, 'embedding_dim': 96, 'lr': 0.009195844216725802, 'lambda_val': 0.01484633721680471, 'batch_size': 513, 'optimizer': 'RMSprop'}.
2026-06-03 21:50:08,267 - experiment_functions - INFO - Early stopping at epoch 1600. Best Metrics: (0.009089641520291182, 0.0016277044678143211, 0.005280372989538473)
2026-06-03 21:50:08,359 - optuna.study.study - INFO - Trial 188 finished with values: [0.009089641520291182, 0.0016277044678143211, 0.005280372989538473] and parameters: {'n_layers': 4, 'embedding_dim': 96, 'lr': 0.000710331438856921, 'lambda_val': 0.00047268866494377303, 'batch_size': 2127, 'optimizer': 'Adam'}.
2026-06-03 21:50:39,566 - experiment_functions - INFO - Early stopping at epoch 750. Best Metrics: (0.008408967144028341, 0.0014635943465737826, 0.0049625296622511205)
2026-06-03 21:50:39,651 - optuna.study.study - INFO - Trial 189 finished with values: [0.008408967144028341, 0.0014635943465737826, 0.0049625296622511205] and parameters: {'n_layers': 3, 'embedding_dim': 64, 'lr': 0.0018040479477802712, 'lambda_val': 0.0003123129135877017, 'batch_size': 2574, 'optimizer': 'RMSprop'}.
2026-06-03 21:51:10,099 - experiment_functions - INFO - Early stopping at epoch 550. Best Metrics: (0.006821721856881532, 0.001185611896309197, 0.0037991715427094577)
2026-06-03 21:51:10,404 - optuna.study.study - INFO - Trial 190 finished with values: [0.006821721856881532, 0.001185611896309197, 0.0037991715427094577] and parameters: {'n_layers': 4, 'embedding_dim': 256, 'lr': 0.005875923861834851, 'lambda_val': 5.609342222844582e-06, 'batch_size': 2574, 'optimizer': 'RMSprop'}.
2026-06-03 21:52:14,641 - experiment_functions - INFO - Early stopping at epoch 1400. Best Metrics: (0.006881362230466948, 0.001230825909304039, 0.003910108155519991)
2026-06-03 21:52:14,724 - optuna.study.study - INFO - Trial 191 finished with values: [0.006881362230466948, 0.001230825909304039, 0.003910108155519991] and parameters: {'n_layers': 2, 'embedding_dim': 256, 'lr': 0.002060594231766347, 'lambda_val': 5.085972175639675e-06, 'batch_size': 1277, 'optimizer': 'RMSprop'}.
2026-06-03 21:52:37,293 - experiment_functions - INFO - Early stopping at epoch 550. Best Metrics: (0.004387440297275971, 0.0007301225802130082, 0.0024066544279922725)
2026-06-03 21:52:37,381 - optuna.study.study - INFO - Trial 192 finished with values: [0.004387440297275971, 0.0007301225802130082, 0.0024066544279922725] and parameters: {'n_layers': 3, 'embedding_dim': 32, 'lr': 0.011544828952739577, 'lambda_val': 5.498598937302318e-05, 'batch_size': 2574, 'optimizer': 'RMSprop'}.
2026-06-03 21:53:12,348 - experiment_functions - INFO - Early stopping at epoch 850. Best Metrics: (0.0070990052310921144, 0.0013781900998057475, 0.00436558202182489)
2026-06-03 21:53:12,564 - optuna.study.study - INFO - Trial 193 finished with values: [0.0070990052310921144, 0.0013781900998057475, 0.00436558202182489] and parameters: {'n_layers': 3, 'embedding_dim': 64, 'lr': 0.00280088767043512, 'lambda_val': 0.00047268866494377303, 'batch_size': 1670, 'optimizer': 'Adam'}.
2026-06-03 21:55:46,274 - optuna.study.study - INFO - Trial 194 finished with values: [0.005524753873952416, 0.0008071538616116284, 0.0031288921437912947] and parameters: {'n_layers': 1, 'embedding_dim': 128, 'lr': 0.0007205855380900513, 'lambda_val': 1.109906362587361e-06, 'batch_size': 1213, 'optimizer': 'Adam'}.
2026-06-03 21:56:16,449 - experiment_functions - INFO - Early stopping at epoch 550. Best Metrics: (0.006580765708546101, 0.0011722151517181325, 0.0037467717174871256)
2026-06-03 21:56:16,542 - optuna.study.study - INFO - Trial 195 finished with values: [0.006580765708546101, 0.0011722151517181325, 0.0037467717174871256] and parameters: {'n_layers': 4, 'embedding_dim': 256, 'lr': 0.0018040479477802712, 'lambda_val': 0.003379656411935868, 'batch_size': 2574, 'optimizer': 'RMSprop'}.
2026-06-03 21:58:54,829 - optuna.study.study - INFO - Trial 196 finished with values: [0.011155993374747177, 0.002019559247102954, 0.00676386940756838] and parameters: {'n_layers': 4, 'embedding_dim': 64, 'lr': 0.000710331438856921, 'lambda_val': 0.00047268866494377303, 'batch_size': 790, 'optimizer': 'Adam'}.
2026-06-03 22:01:29,624 - optuna.study.study - INFO - Trial 197 finished with values: [0.009171773420864119, 0.0016143077232232568, 0.005679653800860545] and parameters: {'n_layers': 3, 'embedding_dim': 64, 'lr': 0.0006306221245460524, 'lambda_val': 5.085972175639675e-06, 'batch_size': 1308, 'optimizer': 'Adam'}.
2026-06-03 22:04:40,039 - optuna.study.study - INFO - Trial 198 finished with values: [0.0060302677550102615, 0.0009528434590394534, 0.0036765627403590505] and parameters: {'n_layers': 3, 'embedding_dim': 256, 'lr': 0.0002877059431931959, 'lambda_val': 2.393431434886667e-06, 'batch_size': 790, 'optimizer': 'RMSprop'}.
2026-06-03 22:06:15,300 - experiment_functions - INFO - Early stopping at epoch 2550. Best Metrics: (0.009906023786878791, 0.0016712438877352805, 0.005662136703660122)
2026-06-03 22:06:15,399 - optuna.study.study - INFO - Trial 199 finished with values: [0.009906023786878791, 0.0016712438877352805, 0.005662136703660122] and parameters: {'n_layers': 2, 'embedding_dim': 32, 'lr': 0.002060594231766347, 'lambda_val': 8.277965708883697e-06, 'batch_size': 641, 'optimizer': 'RMSprop'}.
2026-06-03 22:08:05,824 - experiment_functions - INFO - Early stopping at epoch 2650. Best Metrics: (0.007826872615055226, 0.0014719673119431979, 0.004544053773664801)
2026-06-03 22:08:05,933 - optuna.study.study - INFO - Trial 200 finished with values: [0.007826872615055226, 0.0014719673119431979, 0.004544053773664801] and parameters: {'n_layers': 4, 'embedding_dim': 96, 'lr': 0.00033058091149224526, 'lambda_val': 0.003379656411935868, 'batch_size': 3398, 'optimizer': 'RMSprop'}.
2026-06-03 22:08:53,671 - experiment_functions - INFO - Early stopping at epoch 1250. Best Metrics: (0.00035461623703016777, 7.53566883247371e-05, 0.00018310353223067996)
2026-06-03 22:08:53,788 - optuna.study.study - INFO - Trial 201 finished with values: [0.00035461623703016777, 7.53566883247371e-05, 0.00018310353223067996] and parameters: {'n_layers': 1, 'embedding_dim': 64, 'lr': 1.3398264036849533e-05, 'lambda_val': 0.00047268866494377303, 'batch_size': 2820, 'optimizer': 'Adam'}.
2026-06-03 22:09:15,073 - experiment_functions - INFO - Early stopping at epoch 500. Best Metrics: (0.0005372080887855555, 7.53566883247371e-05, 0.00023960370355406127)
2026-06-03 22:09:15,293 - optuna.study.study - INFO - Trial 202 finished with values: [0.0005372080887855555, 7.53566883247371e-05, 0.00023960370355406127] and parameters: {'n_layers': 3, 'embedding_dim': 64, 'lr': 0.000710331438856921, 'lambda_val': 0.0003123129135877017, 'batch_size': 774, 'optimizer': 'SGD'}.
2026-06-03 22:09:38,868 - experiment_functions - INFO - Early stopping at epoch 550. Best Metrics: (0.005211837371217247, 0.0009093040391184941, 0.00319929899190005)
2026-06-03 22:09:38,956 - optuna.study.study - INFO - Trial 203 finished with values: [0.005211837371217247, 0.0009093040391184941, 0.00319929899190005] and parameters: {'n_layers': 3, 'embedding_dim': 64, 'lr': 0.04340284922364368, 'lambda_val': 5.085972175639675e-06, 'batch_size': 774, 'optimizer': 'Adam'}.
2026-06-03 22:10:03,434 - experiment_functions - INFO - Early stopping at epoch 600. Best Metrics: (0.006682253858196546, 0.0012107307924174426, 0.0041920222180285354)
2026-06-03 22:10:03,565 - optuna.study.study - INFO - Trial 204 finished with values: [0.006682253858196546, 0.0012107307924174426, 0.0041920222180285354] and parameters: {'n_layers': 3, 'embedding_dim': 32, 'lr': 0.0027608560004649, 'lambda_val': 0.003379656411935868, 'batch_size': 1308, 'optimizer': 'RMSprop'}.
2026-06-03 22:13:01,929 - optuna.study.study - INFO - Trial 205 finished with values: [0.004770900095994096, 0.0009109786321923772, 0.0028088661279530368] and parameters: {'n_layers': 2, 'embedding_dim': 256, 'lr': 0.00033058091149224526, 'lambda_val': 0.003379656411935868, 'batch_size': 2270, 'optimizer': 'RMSprop'}.
2026-06-03 22:15:40,420 - optuna.study.study - INFO - Trial 206 finished with values: [0.011642801477441258, 0.0020229084332507204, 0.007254992584764518] and parameters: {'n_layers': 4, 'embedding_dim': 64, 'lr': 0.000710331438856921, 'lambda_val': 5.609342222844582e-06, 'batch_size': 579, 'optimizer': 'Adam'}.
2026-06-03 22:18:08,500 - optuna.study.study - INFO - Trial 207 finished with values: [0.005810077922386886, 0.000827248978498225, 0.003292976911311628] and parameters: {'n_layers': 1, 'embedding_dim': 64, 'lr': 0.000710331438856921, 'lambda_val': 0.0007185275119189745, 'batch_size': 774, 'optimizer': 'Adam'}.
2026-06-03 22:20:44,092 - optuna.study.study - INFO - Trial 208 finished with values: [0.008818495338527833, 0.00140163440284011, 0.005321760835151517] and parameters: {'n_layers': 2, 'embedding_dim': 96, 'lr': 0.0005673190670316244, 'lambda_val': 1.4920813731644995e-06, 'batch_size': 1308, 'optimizer': 'RMSprop'}.
2026-06-03 22:23:15,106 - optuna.study.study - INFO - Trial 209 finished with values: [0.006464412091560363, 0.0010901600910978632, 0.003748682390507679] and parameters: {'n_layers': 4, 'embedding_dim': 32, 'lr': 0.00033058091149224526, 'lambda_val': 0.003379656411935868, 'batch_size': 3398, 'optimizer': 'RMSprop'}.
2026-06-03 22:24:50,929 - experiment_functions - INFO - Early stopping at epoch 2200. Best Metrics: (0.0007303247705419575, 0.00010047558443298278, 0.0003403532089395563)
2026-06-03 22:24:51,036 - optuna.study.study - INFO - Trial 210 finished with values: [0.0007303247705419575, 0.00010047558443298278, 0.0003403532089395563] and parameters: {'n_layers': 4, 'embedding_dim': 128, 'lr': 2.348976430157968e-05, 'lambda_val': 0.00010733978042493688, 'batch_size': 3980, 'optimizer': 'Adam'}.
2026-06-03 22:27:29,449 - optuna.study.study - INFO - Trial 211 finished with values: [0.010101783423682488, 0.0018286556366802868, 0.006136774658603753] and parameters: {'n_layers': 4, 'embedding_dim': 64, 'lr': 0.000710331438856921, 'lambda_val': 5.609342222844582e-06, 'batch_size': 836, 'optimizer': 'Adam'}.
2026-06-03 22:30:15,424 - experiment_functions - INFO - Early stopping at epoch 3950. Best Metrics: (0.008188629463615286, 0.0014200549266528235, 0.004654781302466717)
2026-06-03 22:30:15,528 - optuna.study.study - INFO - Trial 212 finished with values: [0.008188629463615286, 0.0014200549266528235, 0.004654781302466717] and parameters: {'n_layers': 3, 'embedding_dim': 128, 'lr': 0.00047366866307194686, 'lambda_val': 2.468073181110974e-06, 'batch_size': 2574, 'optimizer': 'Adam'}.
2026-06-03 22:31:42,291 - experiment_functions - INFO - Early stopping at epoch 2200. Best Metrics: (0.007662613107881368, 0.0013580949829191508, 0.004338594233013929)
2026-06-03 22:31:43,210 - optuna.study.study - INFO - Trial 213 finished with values: [0.007662613107881368, 0.0013580949829191508, 0.004338594233013929] and parameters: {'n_layers': 3, 'embedding_dim': 64, 'lr': 0.000710331438856921, 'lambda_val': 0.0006605374801086046, 'batch_size': 2467, 'optimizer': 'Adam'}.
2026-06-03 22:32:23,545 - experiment_functions - INFO - Early stopping at epoch 950. Best Metrics: (0.009576307314033809, 0.0017198070868778886, 0.005722829180414003)
2026-06-03 22:32:23,790 - optuna.study.study - INFO - Trial 214 finished with values: [0.009576307314033809, 0.0017198070868778886, 0.005722829180414003] and parameters: {'n_layers': 3, 'embedding_dim': 96, 'lr': 0.002060594231766347, 'lambda_val': 0.00021888803225104277, 'batch_size': 790, 'optimizer': 'RMSprop'}.
2026-06-03 22:34:11,885 - experiment_functions - INFO - Early stopping at epoch 2900. Best Metrics: (0.0049655838370266285, 0.0006983053118092304, 0.0027768659235907034)
2026-06-03 22:34:11,985 - optuna.study.study - INFO - Trial 215 finished with values: [0.0049655838370266285, 0.0006983053118092304, 0.0027768659235907034] and parameters: {'n_layers': 1, 'embedding_dim': 64, 'lr': 0.000710331438856921, 'lambda_val': 0.0026643727325535447, 'batch_size': 1371, 'optimizer': 'Adam'}.
2026-06-03 22:35:11,260 - experiment_functions - INFO - Early stopping at epoch 1450. Best Metrics: (0.007917508929676822, 0.0013815392859535135, 0.0045262395238463)
2026-06-03 22:35:12,283 - optuna.study.study - INFO - Trial 216 finished with values: [0.007917508929676822, 0.0013815392859535135, 0.0045262395238463] and parameters: {'n_layers': 4, 'embedding_dim': 64, 'lr': 0.000710331438856921, 'lambda_val': 0.00013291360520720403, 'batch_size': 3980, 'optimizer': 'Adam'}.
2026-06-03 22:35:40,191 - experiment_functions - INFO - Early stopping at epoch 650. Best Metrics: (0.008625649999638682, 0.0015607207448589994, 0.0049800844113361276)
2026-06-03 22:35:40,280 - optuna.study.study - INFO - Trial 217 finished with values: [0.008625649999638682, 0.0015607207448589994, 0.0049800844113361276] and parameters: {'n_layers': 4, 'embedding_dim': 64, 'lr': 0.0037398856564293233, 'lambda_val': 5.085972175639675e-06, 'batch_size': 1308, 'optimizer': 'RMSprop'}.
2026-06-03 22:36:06,713 - experiment_functions - INFO - Early stopping at epoch 650. Best Metrics: (0.0061281906365145845, 0.001081787125728448, 0.0034695427482215402)
2026-06-03 22:36:07,929 - optuna.study.study - INFO - Trial 218 finished with values: [0.0061281906365145845, 0.001081787125728448, 0.0034695427482215402] and parameters: {'n_layers': 3, 'embedding_dim': 32, 'lr': 0.007619952096174603, 'lambda_val': 8.277965708883697e-06, 'batch_size': 1371, 'optimizer': 'RMSprop'}.
2026-06-03 22:36:52,289 - experiment_functions - INFO - Early stopping at epoch 1050. Best Metrics: (0.00986790574907276, 0.0018303302297541697, 0.005776548433109993)
2026-06-03 22:36:52,580 - optuna.study.study - INFO - Trial 219 finished with values: [0.00986790574907276, 0.0018303302297541697, 0.005776548433109993] and parameters: {'n_layers': 3, 'embedding_dim': 96, 'lr': 0.002060594231766347, 'lambda_val': 0.00021888803225104277, 'batch_size': 790, 'optimizer': 'RMSprop'}.
2026-06-03 22:40:06,129 - optuna.study.study - INFO - Trial 220 finished with values: [0.007145682505666249, 0.0012927858530377122, 0.004287393809316918] and parameters: {'n_layers': 3, 'embedding_dim': 256, 'lr': 0.0003517857503442046, 'lambda_val': 5.085972175639675e-06, 'batch_size': 3876, 'optimizer': 'Adam'}.
2026-06-03 22:40:33,383 - experiment_functions - INFO - Early stopping at epoch 600. Best Metrics: (0.00735684191090229, 0.0013011588184071272, 0.00420653690543983)
