2026-06-04 04:10:40,342 - optuna.study.study - INFO - Trial 210 finished with values: [0.008201598005213662, 0.001508808359568625, 0.00471411146674239] and parameters: {'n_layers': 4, 'embedding_dim': 128, 'lr': 0.0008204274611611849, 'lambda_val': 0.000251801836582855, 'batch_size': 3163, 'optimizer': 'Adam'}.
2026-06-04 04:13:19,882 - experiment_functions - INFO - Early stopping at epoch 3850. Best Metrics: (0.006138219314645467, 0.0010600174157679684, 0.003565407991728684)
2026-06-04 04:13:20,058 - optuna.study.study - INFO - Trial 211 finished with values: [0.006138219314645467, 0.0010600174157679684, 0.003565407991728684] and parameters: {'n_layers': 1, 'embedding_dim': 256, 'lr': 0.0009744505282133616, 'lambda_val': 3.296708187602422e-06, 'batch_size': 3299, 'optimizer': 'RMSprop'}.
2026-06-04 04:14:23,486 - experiment_functions - INFO - Early stopping at epoch 1650. Best Metrics: (0.009436215329118088, 0.0016126331301493737, 0.005620014919483751)
2026-06-04 04:14:23,600 - optuna.study.study - INFO - Trial 212 finished with values: [0.009436215329118088, 0.0016126331301493737, 0.005620014919483751] and parameters: {'n_layers': 2, 'embedding_dim': 64, 'lr': 0.0025795756581398536, 'lambda_val': 1.7827761161994677e-05, 'batch_size': 679, 'optimizer': 'RMSprop'}.
2026-06-04 04:16:30,718 - experiment_functions - INFO - Early stopping at epoch 3450. Best Metrics: (0.00951403786732636, 0.0015741174894500637, 0.005770593086814915)
2026-06-04 04:16:30,916 - optuna.study.study - INFO - Trial 213 finished with values: [0.00951403786732636, 0.0015741174894500637, 0.005770593086814915] and parameters: {'n_layers': 3, 'embedding_dim': 32, 'lr': 0.0007463197710430186, 'lambda_val': 0.0001888631680612503, 'batch_size': 1943, 'optimizer': 'RMSprop'}.
2026-06-04 04:16:52,866 - experiment_functions - INFO - Early stopping at epoch 500. Best Metrics: (0.000571143692783126, 9.210261906356756e-05, 0.0002791790006243783)
2026-06-04 04:16:52,975 - optuna.study.study - INFO - Trial 214 finished with values: [0.000571143692783126, 9.210261906356756e-05, 0.0002791790006243783] and parameters: {'n_layers': 2, 'embedding_dim': 128, 'lr': 0.0006097425316287412, 'lambda_val': 2.2435960383986775e-06, 'batch_size': 3903, 'optimizer': 'SGD'}.
2026-06-04 04:17:22,787 - experiment_functions - INFO - Early stopping at epoch 700. Best Metrics: (0.008486396630926913, 0.001592538013262777, 0.004867309263842751)
2026-06-04 04:17:23,340 - optuna.study.study - INFO - Trial 215 finished with values: [0.008486396630926913, 0.001592538013262777, 0.004867309263842751] and parameters: {'n_layers': 4, 'embedding_dim': 64, 'lr': 0.0025795756581398536, 'lambda_val': 1.9870285249823955e-06, 'batch_size': 1943, 'optimizer': 'RMSprop'}.
2026-06-04 04:19:50,564 - optuna.study.study - INFO - Trial 216 finished with values: [0.004609053477557148, 0.0006430437403710899, 0.0023849964465507186] and parameters: {'n_layers': 1, 'embedding_dim': 64, 'lr': 0.0004917140070980949, 'lambda_val': 1.3052381092373641e-06, 'batch_size': 2729, 'optimizer': 'Adam'}.
2026-06-04 04:20:23,406 - experiment_functions - INFO - Early stopping at epoch 600. Best Metrics: (0.006257449468060775, 0.0011102552079844598, 0.0034712199997135222)
2026-06-04 04:20:23,841 - optuna.study.study - INFO - Trial 217 finished with values: [0.006257449468060775, 0.0011102552079844598, 0.0034712199997135222] and parameters: {'n_layers': 4, 'embedding_dim': 256, 'lr': 0.0036679476641700757, 'lambda_val': 0.0016044761768607098, 'batch_size': 517, 'optimizer': 'RMSprop'}.
2026-06-04 04:20:46,604 - experiment_functions - INFO - Early stopping at epoch 550. Best Metrics: (0.003910895121914479, 0.0007351463594346574, 0.0023410853011642655)
2026-06-04 04:20:46,717 - optuna.study.study - INFO - Trial 218 finished with values: [0.003910895121914479, 0.0007351463594346574, 0.0023410853011642655] and parameters: {'n_layers': 4, 'embedding_dim': 32, 'lr': 0.018433968594710002, 'lambda_val': 0.00015132695924103293, 'batch_size': 1158, 'optimizer': 'RMSprop'}.
2026-06-04 04:21:59,969 - experiment_functions - INFO - Early stopping at epoch 1350. Best Metrics: (0.006450122447257406, 0.0012810637015205305, 0.0036462572088173965)
2026-06-04 04:22:00,079 - optuna.study.study - INFO - Trial 219 finished with values: [0.006450122447257406, 0.0012810637015205305, 0.0036462572088173965] and parameters: {'n_layers': 4, 'embedding_dim': 256, 'lr': 0.0006097425316287412, 'lambda_val': 0.011676963975868567, 'batch_size': 679, 'optimizer': 'RMSprop'}.
2026-06-04 04:22:34,163 - experiment_functions - INFO - Early stopping at epoch 800. Best Metrics: (0.005939284125252802, 0.0010533190434724362, 0.0033590384759155374)
2026-06-04 04:22:34,250 - optuna.study.study - INFO - Trial 220 finished with values: [0.005939284125252802, 0.0010533190434724362, 0.0033590384759155374] and parameters: {'n_layers': 2, 'embedding_dim': 128, 'lr': 0.004527047386587098, 'lambda_val': 1.7827761161994677e-05, 'batch_size': 1943, 'optimizer': 'RMSprop'}.
2026-06-04 04:25:12,831 - experiment_functions - INFO - Early stopping at epoch 3850. Best Metrics: (0.0006372094104465927, 9.210261906356756e-05, 0.0002670998968802723)
2026-06-04 04:25:13,156 - optuna.study.study - INFO - Trial 221 finished with values: [0.0006372094104465927, 9.210261906356756e-05, 0.0002670998968802723] and parameters: {'n_layers': 3, 'embedding_dim': 128, 'lr': 4.383453510743966e-05, 'lambda_val': 1.7827761161994677e-05, 'batch_size': 679, 'optimizer': 'Adam'}.
2026-06-04 04:25:43,871 - experiment_functions - INFO - Early stopping at epoch 700. Best Metrics: (0.007695140789302164, 0.0013748409136579815, 0.004383564626541731)
2026-06-04 04:25:45,010 - optuna.study.study - INFO - Trial 222 finished with values: [0.007695140789302164, 0.0013748409136579815, 0.004383564626541731] and parameters: {'n_layers': 4, 'embedding_dim': 96, 'lr': 0.0025795756581398536, 'lambda_val': 0.00015132695924103293, 'batch_size': 3163, 'optimizer': 'Adam'}.
2026-06-04 04:26:17,666 - experiment_functions - INFO - Early stopping at epoch 600. Best Metrics: (0.007340398020606676, 0.0013128809699243084, 0.004076459786193451)
2026-06-04 04:26:18,104 - optuna.study.study - INFO - Trial 223 finished with values: [0.007340398020606676, 0.0013128809699243084, 0.004076459786193451] and parameters: {'n_layers': 4, 'embedding_dim': 256, 'lr': 0.0036679476641700757, 'lambda_val': 2.6963455125652685e-06, 'batch_size': 3163, 'optimizer': 'RMSprop'}.
2026-06-04 04:27:39,571 - experiment_functions - INFO - Early stopping at epoch 1700. Best Metrics: (0.009212956634677078, 0.001664545515439748, 0.005219673394885766)
2026-06-04 04:27:39,679 - optuna.study.study - INFO - Trial 224 finished with values: [0.009212956634677078, 0.001664545515439748, 0.005219673394885766] and parameters: {'n_layers': 3, 'embedding_dim': 256, 'lr': 0.0006097425316287412, 'lambda_val': 2.6963455125652685e-06, 'batch_size': 2083, 'optimizer': 'RMSprop'}.
2026-06-04 04:29:54,091 - experiment_functions - INFO - Early stopping at epoch 2850. Best Metrics: (0.011883069143843785, 0.002205439078303972, 0.007132497090415404)
2026-06-04 04:29:54,386 - optuna.study.study - INFO - Trial 225 finished with values: [0.011883069143843785, 0.002205439078303972, 0.007132497090415404] and parameters: {'n_layers': 3, 'embedding_dim': 256, 'lr': 0.0009744505282133616, 'lambda_val': 5.282448475572872e-06, 'batch_size': 528, 'optimizer': 'RMSprop'}.
2026-06-04 04:30:35,122 - experiment_functions - INFO - Early stopping at epoch 1050. Best Metrics: (0.010623061173687004, 0.001803536740572041, 0.0061222133387139705)
2026-06-04 04:30:36,291 - optuna.study.study - INFO - Trial 226 finished with values: [0.010623061173687004, 0.001803536740572041, 0.0061222133387139705] and parameters: {'n_layers': 3, 'embedding_dim': 32, 'lr': 0.0036679476641700757, 'lambda_val': 9.396340181954428e-05, 'batch_size': 602, 'optimizer': 'RMSprop'}.
2026-06-04 04:31:44,525 - experiment_functions - INFO - Early stopping at epoch 1600. Best Metrics: (0.007227917624232504, 0.0013480474244758525, 0.004238078835101205)
2026-06-04 04:31:45,417 - optuna.study.study - INFO - Trial 227 finished with values: [0.007227917624232504, 0.0013480474244758525, 0.004238078835101205] and parameters: {'n_layers': 3, 'embedding_dim': 128, 'lr': 0.0009744505282133616, 'lambda_val': 8.472875869813855e-05, 'batch_size': 3163, 'optimizer': 'Adam'}.
2026-06-04 04:32:18,387 - experiment_functions - INFO - Early stopping at epoch 600. Best Metrics: (0.006945218329611474, 0.0012827382945944136, 0.003886759957782461)
2026-06-04 04:32:19,168 - optuna.study.study - INFO - Trial 228 finished with values: [0.006945218329611474, 0.0012827382945944136, 0.003886759957782461] and parameters: {'n_layers': 4, 'embedding_dim': 256, 'lr': 0.0036679476641700757, 'lambda_val': 4.520593331010792e-05, 'batch_size': 1553, 'optimizer': 'RMSprop'}.
2026-06-04 04:32:59,090 - experiment_functions - INFO - Early stopping at epoch 1050. Best Metrics: (0.0036212452437895913, 0.0006798847879965168, 0.0021833060861947196)
2026-06-04 04:32:59,311 - optuna.study.study - INFO - Trial 229 finished with values: [0.0036212452437895913, 0.0006798847879965168, 0.0021833060861947196] and parameters: {'n_layers': 2, 'embedding_dim': 32, 'lr': 0.010519255162305941, 'lambda_val': 0.03720405696879673, 'batch_size': 2613, 'optimizer': 'RMSprop'}.
2026-06-04 04:33:45,456 - experiment_functions - INFO - Early stopping at epoch 1150. Best Metrics: (0.004721009514788612, 0.0007753365932078504, 0.002738190429546549)
2026-06-04 04:33:46,323 - optuna.study.study - INFO - Trial 230 finished with values: [0.004721009514788612, 0.0007753365932078504, 0.002738190429546549] and parameters: {'n_layers': 1, 'embedding_dim': 128, 'lr': 0.010519255162305941, 'lambda_val': 1.9870285249823955e-06, 'batch_size': 3163, 'optimizer': 'Adam'}.
2026-06-04 04:34:10,222 - experiment_functions - INFO - Early stopping at epoch 500. Best Metrics: (0.000471270871121256, 6.0285350659789674e-05, 0.00022026367152288477)
2026-06-04 04:34:10,525 - optuna.study.study - INFO - Trial 231 finished with values: [0.000471270871121256, 6.0285350659789674e-05, 0.00022026367152288477] and parameters: {'n_layers': 2, 'embedding_dim': 256, 'lr': 0.0006097425316287412, 'lambda_val': 0.00022784399995910408, 'batch_size': 2236, 'optimizer': 'SGD'}.
2026-06-04 04:36:57,394 - experiment_functions - INFO - Early stopping at epoch 3900. Best Metrics: (0.0053247169686252835, 0.0008172014200549268, 0.0030040524683676464)
2026-06-04 04:36:57,542 - optuna.study.study - INFO - Trial 232 finished with values: [0.0053247169686252835, 0.0008172014200549268, 0.0030040524683676464] and parameters: {'n_layers': 1, 'embedding_dim': 256, 'lr': 0.0007463197710430186, 'lambda_val': 0.00014816809310452117, 'batch_size': 2187, 'optimizer': 'Adam'}.
2026-06-04 04:37:42,773 - experiment_functions - INFO - Early stopping at epoch 850. Best Metrics: (0.007607111558661534, 0.0014066581820617592, 0.004230021289800843)
2026-06-04 04:37:43,611 - optuna.study.study - INFO - Trial 233 finished with values: [0.007607111558661534, 0.0014066581820617592, 0.004230021289800843] and parameters: {'n_layers': 4, 'embedding_dim': 256, 'lr': 0.0008797904665419303, 'lambda_val': 0.0005210088573938224, 'batch_size': 3929, 'optimizer': 'RMSprop'}.
2026-06-04 04:40:31,175 - optuna.study.study - INFO - Trial 234 finished with values: [0.007419211198964266, 0.0013597695759930337, 0.004329718835319178] and parameters: {'n_layers': 3, 'embedding_dim': 128, 'lr': 0.0006097425316287412, 'lambda_val': 6.633315182426109e-05, 'batch_size': 3903, 'optimizer': 'Adam'}.
2026-06-04 04:40:56,701 - experiment_functions - INFO - Early stopping at epoch 500. Best Metrics: (0.0004901834661269256, 6.530912988143882e-05, 0.00021895753366274283)
2026-06-04 04:40:57,589 - optuna.study.study - INFO - Trial 235 finished with values: [0.0004901834661269256, 6.530912988143882e-05, 0.00021895753366274283] and parameters: {'n_layers': 3, 'embedding_dim': 256, 'lr': 0.0008797904665419303, 'lambda_val': 0.00026012148846087845, 'batch_size': 3163, 'optimizer': 'SGD'}.
2026-06-04 04:43:46,013 - experiment_functions - INFO - Early stopping at epoch 3750. Best Metrics: (0.006167797662203559, 0.001085136311876214, 0.003490223358206572)
2026-06-04 04:43:47,185 - optuna.study.study - INFO - Trial 236 finished with values: [0.006167797662203559, 0.001085136311876214, 0.003490223358206572] and parameters: {'n_layers': 2, 'embedding_dim': 256, 'lr': 0.0006097425316287412, 'lambda_val': 0.0005862536131194439, 'batch_size': 2236, 'optimizer': 'Adam'}.
2026-06-04 04:44:34,360 - experiment_functions - INFO - Early stopping at epoch 1050. Best Metrics: (0.009157984329942385, 0.0016310536539620873, 0.005239075805785644)
2026-06-04 04:44:34,546 - optuna.study.study - INFO - Trial 237 finished with values: [0.009157984329942385, 0.0016310536539620873, 0.005239075805785644] and parameters: {'n_layers': 4, 'embedding_dim': 128, 'lr': 0.0009744505282133616, 'lambda_val': 2.6963455125652685e-06, 'batch_size': 3163, 'optimizer': 'RMSprop'}.
2026-06-04 04:45:36,819 - experiment_functions - INFO - Early stopping at epoch 1600. Best Metrics: (0.005571964173204366, 0.0009980574720342957, 0.0033806037767872884)
2026-06-04 04:45:36,920 - optuna.study.study - INFO - Trial 238 finished with values: [0.005571964173204366, 0.0009980574720342957, 0.0033806037767872884] and parameters: {'n_layers': 1, 'embedding_dim': 128, 'lr': 0.005720533217630053, 'lambda_val': 2.9094394994277735e-06, 'batch_size': 679, 'optimizer': 'RMSprop'}.
2026-06-04 04:48:06,740 - optuna.study.study - INFO - Trial 239 finished with values: [0.009458538049816813, 0.001622680688592672, 0.0054539539171076235] and parameters: {'n_layers': 4, 'embedding_dim': 32, 'lr': 0.0007463197710430186, 'lambda_val': 0.0002966875497275749, 'batch_size': 1752, 'optimizer': 'Adam'}.
2026-06-04 04:48:41,631 - experiment_functions - INFO - Early stopping at epoch 650. Best Metrics: (0.007378772416029033, 0.0013212539352937236, 0.003997458377284704)
2026-06-04 04:48:41,975 - optuna.study.study - INFO - Trial 240 finished with values: [0.007378772416029033, 0.0013212539352937236, 0.003997458377284704] and parameters: {'n_layers': 4, 'embedding_dim': 256, 'lr': 0.005091659899861729, 'lambda_val': 2.6963455125652685e-06, 'batch_size': 584, 'optimizer': 'RMSprop'}.
2026-06-04 04:49:08,803 - experiment_functions - INFO - Early stopping at epoch 650. Best Metrics: (0.006983196314636881, 0.0012743653292249988, 0.004180895433139064)
2026-06-04 04:49:08,904 - optuna.study.study - INFO - Trial 241 finished with values: [0.006983196314636881, 0.0012743653292249988, 0.004180895433139064] and parameters: {'n_layers': 3, 'embedding_dim': 64, 'lr': 0.0036679476641700757, 'lambda_val': 0.00015132695924103293, 'batch_size': 2550, 'optimizer': 'RMSprop'}.
2026-06-04 04:50:48,609 - experiment_functions - INFO - Early stopping at epoch 2200. Best Metrics: (0.0072388859875876935, 0.0013564203898452675, 0.004313592437884976)
2026-06-04 04:50:48,721 - optuna.study.study - INFO - Trial 242 finished with values: [0.0072388859875876935, 0.0013564203898452675, 0.004313592437884976] and parameters: {'n_layers': 2, 'embedding_dim': 256, 'lr': 0.0007463197710430186, 'lambda_val': 2.6963455125652685e-06, 'batch_size': 2083, 'optimizer': 'RMSprop'}.
2026-06-04 04:51:21,691 - experiment_functions - INFO - Early stopping at epoch 800. Best Metrics: (0.005845180886101862, 0.0009561926451872196, 0.00326108803409609)
2026-06-04 04:51:21,836 - optuna.study.study - INFO - Trial 243 finished with values: [0.005845180886101862, 0.0009561926451872196, 0.00326108803409609] and parameters: {'n_layers': 2, 'embedding_dim': 96, 'lr': 0.004527047386587098, 'lambda_val': 9.396340181954428e-05, 'batch_size': 1636, 'optimizer': 'Adam'}.
2026-06-04 04:52:21,802 - experiment_functions - INFO - Early stopping at epoch 1450. Best Metrics: (0.006510062742285952, 0.0010801125326545652, 0.0036728212584028396)
2026-06-04 04:52:22,243 - optuna.study.study - INFO - Trial 244 finished with values: [0.006510062742285952, 0.0010801125326545652, 0.0036728212584028396] and parameters: {'n_layers': 2, 'embedding_dim': 128, 'lr': 0.0009744505282133616, 'lambda_val': 4.3043355166166714e-05, 'batch_size': 3163, 'optimizer': 'Adam'}.
2026-06-04 04:53:30,788 - experiment_functions - INFO - Early stopping at epoch 1400. Best Metrics: (0.009635456855208717, 0.0017047357492129414, 0.005506321806309644)
2026-06-04 04:53:31,257 - optuna.study.study - INFO - Trial 245 finished with values: [0.009635456855208717, 0.0017047357492129414, 0.005506321806309644] and parameters: {'n_layers': 3, 'embedding_dim': 256, 'lr': 0.0009744505282133616, 'lambda_val': 8.472875869813855e-05, 'batch_size': 1158, 'optimizer': 'RMSprop'}.
2026-06-04 04:56:02,972 - optuna.study.study - INFO - Trial 246 finished with values: [0.00643660728687986, 0.0009963828789604128, 0.003670212534308768] and parameters: {'n_layers': 2, 'embedding_dim': 64, 'lr': 0.0006097425316287412, 'lambda_val': 0.0001888631680612503, 'batch_size': 3903, 'optimizer': 'Adam'}.
2026-06-04 04:56:36,718 - experiment_functions - INFO - Early stopping at epoch 700. Best Metrics: (0.005143148990726637, 0.0008825105499363655, 0.002951673925854525)
2026-06-04 04:56:37,006 - optuna.study.study - INFO - Trial 247 finished with values: [0.005143148990726637, 0.0008825105499363655, 0.002951673925854525] and parameters: {'n_layers': 2, 'embedding_dim': 256, 'lr': 0.010519255162305941, 'lambda_val': 7.233718216592713e-05, 'batch_size': 3163, 'optimizer': 'Adam'}.
2026-06-04 04:59:01,993 - optuna.study.study - INFO - Trial 248 finished with values: [0.0006958569346399907, 0.00012224529439346237, 0.0003651643584033389] and parameters: {'n_layers': 2, 'embedding_dim': 32, 'lr': 8.589783148991302e-05, 'lambda_val': 5.282448475572872e-06, 'batch_size': 3163, 'optimizer': 'RMSprop'}.
2026-06-04 05:00:51,075 - experiment_functions - INFO - Early stopping at epoch 2250. Best Metrics: (0.005000735744006286, 0.0009360975283006231, 0.002812168058411865)
2026-06-04 05:00:51,296 - optuna.study.study - INFO - Trial 249 finished with values: [0.005000735744006286, 0.0009360975283006231, 0.002812168058411865] and parameters: {'n_layers': 3, 'embedding_dim': 256, 'lr': 0.0006097425316287412, 'lambda_val': 0.04184126831737374, 'batch_size': 1158, 'optimizer': 'Adam'}.
2026-06-04 05:01:32,682 - experiment_functions - INFO - Early stopping at epoch 1050. Best Metrics: (0.010357636112568664, 0.0018370286020497023, 0.006015684494839473)
2026-06-04 05:01:32,917 - optuna.study.study - INFO - Trial 250 finished with values: [0.010357636112568664, 0.0018370286020497023, 0.006015684494839473] and parameters: {'n_layers': 4, 'embedding_dim': 32, 'lr': 0.0022306925911484794, 'lambda_val': 0.00015132695924103293, 'batch_size': 1158, 'optimizer': 'RMSprop'}.
2026-06-04 05:02:08,055 - experiment_functions - INFO - Early stopping at epoch 900. Best Metrics: (0.008492350606235334, 0.0014920624288297945, 0.0049532567900148145)
2026-06-04 05:02:09,351 - optuna.study.study - INFO - Trial 251 finished with values: [0.008492350606235334, 0.0014920624288297945, 0.0049532567900148145] and parameters: {'n_layers': 3, 'embedding_dim': 32, 'lr': 0.0036679476641700757, 'lambda_val': 4.115726125333198e-06, 'batch_size': 1158, 'optimizer': 'RMSprop'}.
2026-06-04 05:04:53,736 - optuna.study.study - INFO - Trial 252 finished with values: [0.005803003268215999, 0.0009947082858865297, 0.0034574929969983666] and parameters: {'n_layers': 3, 'embedding_dim': 128, 'lr': 0.0002569930945604776, 'lambda_val': 1.7827761161994677e-05, 'batch_size': 3163, 'optimizer': 'Adam'}.
2026-06-04 05:05:24,260 - experiment_functions - INFO - Early stopping at epoch 550. Best Metrics: (0.005556695704304032, 0.0010616920088418514, 0.0032913552306086612)
2026-06-04 05:05:24,410 - optuna.study.study - INFO - Trial 253 finished with values: [0.005556695704304032, 0.0010616920088418514, 0.0032913552306086612] and parameters: {'n_layers': 4, 'embedding_dim': 256, 'lr': 0.0036679476641700757, 'lambda_val': 0.00336702858381742, 'batch_size': 1943, 'optimizer': 'RMSprop'}.
2026-06-04 05:06:30,391 - experiment_functions - INFO - Early stopping at epoch 1350. Best Metrics: (0.004515655079319465, 0.0008724629914930673, 0.002528378310198985)
2026-06-04 05:06:30,490 - optuna.study.study - INFO - Trial 254 finished with values: [0.004515655079319465, 0.0008724629914930673, 0.002528378310198985] and parameters: {'n_layers': 3, 'embedding_dim': 256, 'lr': 0.0006097425316287412, 'lambda_val': 0.09109649482242431, 'batch_size': 2083, 'optimizer': 'RMSprop'}.
2026-06-04 05:06:59,784 - experiment_functions - INFO - Early stopping at epoch 650. Best Metrics: (0.007518738840471108, 0.0013597695759930337, 0.0041853872538471)
2026-06-04 05:07:00,191 - optuna.study.study - INFO - Trial 255 finished with values: [0.007518738840471108, 0.0013597695759930337, 0.0041853872538471] and parameters: {'n_layers': 3, 'embedding_dim': 128, 'lr': 0.0025795756581398536, 'lambda_val': 1.7827761161994677e-05, 'batch_size': 4086, 'optimizer': 'RMSprop'}.
2026-06-04 05:08:09,771 - experiment_functions - INFO - Early stopping at epoch 1400. Best Metrics: (0.008068554861736172, 0.001503784580346976, 0.004568275666762954)
2026-06-04 05:08:09,868 - optuna.study.study - INFO - Trial 256 finished with values: [0.008068554861736172, 0.001503784580346976, 0.004568275666762954] and parameters: {'n_layers': 3, 'embedding_dim': 256, 'lr': 0.0006097425316287412, 'lambda_val': 2.6963455125652685e-06, 'batch_size': 3472, 'optimizer': 'RMSprop'}.
2026-06-04 05:09:31,124 - experiment_functions - INFO - Early stopping at epoch 2200. Best Metrics: (0.008452117219532061, 0.00144015004353942, 0.004988831996573617)
