2026-06-06 08:28:32,112 - optuna.study.study - INFO - Trial 158 finished with values: [0.02535776311556476, 0.003278853238663005, 0.012403258739365049] and parameters: {'n_layers': 1, 'embedding_dim': 64, 'lr': 0.017061469787437597, 'lambda_val': 5.315262969436241e-05, 'batch_size': 2560, 'optimizer': 'RMSprop'}.
2026-06-06 08:29:00,356 - experiment_functions - INFO - Early stopping at epoch 600. Best Metrics: (0.046369274178418296, 0.0056115613905820885, 0.02275372202047583)
2026-06-06 08:29:00,439 - optuna.study.study - INFO - Trial 159 finished with values: [0.046369274178418296, 0.0056115613905820885, 0.02275372202047583] and parameters: {'n_layers': 3, 'embedding_dim': 96, 'lr': 0.004471753451787057, 'lambda_val': 5.315262969436241e-05, 'batch_size': 2193, 'optimizer': 'Adam'}.
2026-06-06 08:31:20,801 - experiment_functions - INFO - Early stopping at epoch 3600. Best Metrics: (0.06636795421975213, 0.007969388438609419, 0.03337076013170781)
2026-06-06 08:31:21,523 - optuna.study.study - INFO - Trial 160 finished with values: [0.06636795421975213, 0.007969388438609419, 0.03337076013170781] and parameters: {'n_layers': 2, 'embedding_dim': 32, 'lr': 0.0019509035141199726, 'lambda_val': 1.9480584609486296e-06, 'batch_size': 976, 'optimizer': 'RMSprop'}.
2026-06-06 08:34:10,227 - experiment_functions - INFO - Early stopping at epoch 3750. Best Metrics: (0.06008930340284763, 0.006944537477392993, 0.02852228418709259)
2026-06-06 08:34:10,363 - optuna.study.study - INFO - Trial 161 finished with values: [0.06008930340284763, 0.006944537477392993, 0.02852228418709259] and parameters: {'n_layers': 1, 'embedding_dim': 256, 'lr': 0.005828487948467767, 'lambda_val': 3.996555780966423e-06, 'batch_size': 1237, 'optimizer': 'RMSprop'}.
2026-06-06 08:35:13,956 - experiment_functions - INFO - Early stopping at epoch 1500. Best Metrics: (0.09008823988793598, 0.010891553352535336, 0.047423481538775625)
2026-06-06 08:35:14,074 - optuna.study.study - INFO - Trial 162 finished with values: [0.09008823988793598, 0.010891553352535336, 0.047423481538775625] and parameters: {'n_layers': 1, 'embedding_dim': 128, 'lr': 0.0019509035141199726, 'lambda_val': 4.2735070605297645e-06, 'batch_size': 3866, 'optimizer': 'Adam'}.
2026-06-06 08:35:45,233 - experiment_functions - INFO - Early stopping at epoch 550. Best Metrics: (0.027643485568906577, 0.0033039721347712507, 0.012831111420773476)
2026-06-06 08:35:45,424 - optuna.study.study - INFO - Trial 163 finished with values: [0.027643485568906577, 0.0033039721347712507, 0.012831111420773476] and parameters: {'n_layers': 3, 'embedding_dim': 256, 'lr': 0.011257935006540517, 'lambda_val': 0.001958251317392381, 'batch_size': 2193, 'optimizer': 'Adam'}.
2026-06-06 08:36:17,038 - experiment_functions - INFO - Early stopping at epoch 550. Best Metrics: (0.031296802251067526, 0.003729318775537544, 0.014476938271443885)
2026-06-06 08:36:17,237 - optuna.study.study - INFO - Trial 164 finished with values: [0.031296802251067526, 0.003729318775537544, 0.014476938271443885] and parameters: {'n_layers': 3, 'embedding_dim': 256, 'lr': 0.03515456804055655, 'lambda_val': 3.309420512764139e-05, 'batch_size': 801, 'optimizer': 'Adam'}.
2026-06-06 08:38:47,957 - optuna.study.study - INFO - Trial 165 finished with values: [0.04814194006491187, 0.006812244624556233, 0.028013596544575713] and parameters: {'n_layers': 1, 'embedding_dim': 64, 'lr': 0.0006810282647636203, 'lambda_val': 1.2176798127435423e-06, 'batch_size': 1503, 'optimizer': 'RMSprop'}.
2026-06-06 08:39:13,633 - experiment_functions - INFO - Early stopping at epoch 600. Best Metrics: (0.038883430279562765, 0.004668765489985934, 0.01789629292725293)
2026-06-06 08:39:13,922 - optuna.study.study - INFO - Trial 166 finished with values: [0.038883430279562765, 0.004668765489985934, 0.01789629292725293] and parameters: {'n_layers': 3, 'embedding_dim': 32, 'lr': 0.005828487948467767, 'lambda_val': 3.456741724473969e-06, 'batch_size': 2384, 'optimizer': 'Adam'}.
2026-06-06 08:41:04,644 - experiment_functions - INFO - Early stopping at epoch 2800. Best Metrics: (0.05052553637493645, 0.005961551343023645, 0.024151468900601904)
2026-06-06 08:41:04,730 - optuna.study.study - INFO - Trial 167 finished with values: [0.05052553637493645, 0.005961551343023645, 0.024151468900601904] and parameters: {'n_layers': 3, 'embedding_dim': 32, 'lr': 0.0019509035141199726, 'lambda_val': 4.2735070605297645e-06, 'batch_size': 1350, 'optimizer': 'RMSprop'}.
2026-06-06 08:43:15,025 - experiment_functions - INFO - Early stopping at epoch 2200. Best Metrics: (0.056249191132571104, 0.0066866501440150045, 0.028218317692607683)
2026-06-06 08:43:15,849 - optuna.study.study - INFO - Trial 168 finished with values: [0.056249191132571104, 0.0066866501440150045, 0.028218317692607683] and parameters: {'n_layers': 4, 'embedding_dim': 256, 'lr': 0.0006810282647636203, 'lambda_val': 4.922331159406591e-06, 'batch_size': 1044, 'optimizer': 'RMSprop'}.
2026-06-06 08:44:08,313 - experiment_functions - INFO - Early stopping at epoch 1250. Best Metrics: (0.012927755982026261, 0.0016243552816665552, 0.0058036960091252315)
2026-06-06 08:44:08,539 - optuna.study.study - INFO - Trial 169 finished with values: [0.012927755982026261, 0.0016243552816665552, 0.0058036960091252315] and parameters: {'n_layers': 4, 'embedding_dim': 64, 'lr': 0.002124781352620552, 'lambda_val': 0.023151733571273782, 'batch_size': 3981, 'optimizer': 'RMSprop'}.
2026-06-06 08:47:03,285 - optuna.study.study - INFO - Trial 170 finished with values: [0.0870951839949081, 0.010677205439078304, 0.04634695073053451] and parameters: {'n_layers': 2, 'embedding_dim': 128, 'lr': 0.0006711529294623438, 'lambda_val': 5.480077822962117e-05, 'batch_size': 2384, 'optimizer': 'RMSprop'}.
2026-06-06 08:49:44,324 - optuna.study.study - INFO - Trial 171 finished with values: [0.06514228315869623, 0.00881673253399424, 0.03510776042502146] and parameters: {'n_layers': 1, 'embedding_dim': 128, 'lr': 0.0006810282647636203, 'lambda_val': 0.003010182335575881, 'batch_size': 1712, 'optimizer': 'RMSprop'}.
2026-06-06 08:52:18,780 - optuna.study.study - INFO - Trial 172 finished with values: [0.08870494208292382, 0.010931743586308527, 0.04806113886508612] and parameters: {'n_layers': 1, 'embedding_dim': 32, 'lr': 0.0019509035141199726, 'lambda_val': 3.456741724473969e-06, 'batch_size': 2384, 'optimizer': 'Adam'}.
2026-06-06 08:54:52,529 - optuna.study.study - INFO - Trial 173 finished with values: [0.051675285949506704, 0.007274432312947953, 0.030370186371629086] and parameters: {'n_layers': 1, 'embedding_dim': 64, 'lr': 0.0006711529294623438, 'lambda_val': 5.315262969436241e-05, 'batch_size': 1712, 'optimizer': 'RMSprop'}.
2026-06-06 08:57:48,542 - optuna.study.study - INFO - Trial 174 finished with values: [0.07478277073449364, 0.009387768772188358, 0.04121562723715661] and parameters: {'n_layers': 2, 'embedding_dim': 128, 'lr': 0.0006711529294623438, 'lambda_val': 5.148126115320708e-06, 'batch_size': 1122, 'optimizer': 'Adam'}.
2026-06-06 08:58:39,101 - experiment_functions - INFO - Early stopping at epoch 1250. Best Metrics: (0.061066575914238946, 0.00731629713979503, 0.03021684836874091)
2026-06-06 08:58:39,689 - optuna.study.study - INFO - Trial 175 finished with values: [0.061066575914238946, 0.00731629713979503, 0.03021684836874091] and parameters: {'n_layers': 2, 'embedding_dim': 32, 'lr': 0.0017827212934439936, 'lambda_val': 4.922331159406591e-06, 'batch_size': 2911, 'optimizer': 'RMSprop'}.
2026-06-06 09:01:18,834 - optuna.study.study - INFO - Trial 176 finished with values: [0.020461469250676937, 0.0033408131823966774, 0.012256574075293361] and parameters: {'n_layers': 1, 'embedding_dim': 128, 'lr': 0.00033582122517218145, 'lambda_val': 7.265971768922724e-05, 'batch_size': 3067, 'optimizer': 'RMSprop'}.
2026-06-06 09:02:02,636 - experiment_functions - INFO - Early stopping at epoch 1100. Best Metrics: (0.0005254040245103206, 9.880099135909974e-05, 0.00022936646754237228)
2026-06-06 09:02:02,817 - optuna.study.study - INFO - Trial 177 finished with values: [0.0005254040245103206, 9.880099135909974e-05, 0.00022936646754237228] and parameters: {'n_layers': 1, 'embedding_dim': 96, 'lr': 2.95371846676625e-05, 'lambda_val': 1.3036977819163817e-06, 'batch_size': 3209, 'optimizer': 'Adam'}.
2026-06-06 09:02:36,956 - experiment_functions - INFO - Early stopping at epoch 800. Best Metrics: (0.005784156950076522, 0.001006430437403711, 0.0031631920123534403)
2026-06-06 09:02:37,703 - optuna.study.study - INFO - Trial 178 finished with values: [0.005784156950076522, 0.001006430437403711, 0.0031631920123534403] and parameters: {'n_layers': 1, 'embedding_dim': 128, 'lr': 0.04838192957945049, 'lambda_val': 5.510107267630662e-06, 'batch_size': 3655, 'optimizer': 'RMSprop'}.
2026-06-06 09:05:14,830 - optuna.study.study - INFO - Trial 179 finished with values: [0.09031379943493101, 0.01098867975082055, 0.0478688674987014] and parameters: {'n_layers': 1, 'embedding_dim': 32, 'lr': 0.0017827212934439936, 'lambda_val': 5.148126115320708e-06, 'batch_size': 3209, 'optimizer': 'Adam'}.
2026-06-06 09:08:08,313 - optuna.study.study - INFO - Trial 180 finished with values: [0.0025420502574992785, 0.0005090762944604461, 0.0014483551461639984] and parameters: {'n_layers': 1, 'embedding_dim': 256, 'lr': 0.00021389021150995766, 'lambda_val': 1.3398416216824042e-06, 'batch_size': 2989, 'optimizer': 'RMSprop'}.
2026-06-06 09:08:29,546 - experiment_functions - INFO - Early stopping at epoch 500. Best Metrics: (0.0005283190646494752, 8.707883984191842e-05, 0.00024193450117403542)
2026-06-06 09:08:29,804 - optuna.study.study - INFO - Trial 181 finished with values: [0.0005283190646494752, 8.707883984191842e-05, 0.00024193450117403542] and parameters: {'n_layers': 1, 'embedding_dim': 96, 'lr': 7.852263898665611e-05, 'lambda_val': 8.198950044762925e-06, 'batch_size': 1350, 'optimizer': 'SGD'}.
2026-06-06 09:09:11,868 - experiment_functions - INFO - Early stopping at epoch 1050. Best Metrics: (0.06826668334898651, 0.00869616183267466, 0.03564729520913485)
2026-06-06 09:09:12,299 - optuna.study.study - INFO - Trial 182 finished with values: [0.06826668334898651, 0.00869616183267466, 0.03564729520913485] and parameters: {'n_layers': 1, 'embedding_dim': 32, 'lr': 0.0017827212934439936, 'lambda_val': 0.0016696163443190065, 'batch_size': 3866, 'optimizer': 'RMSprop'}.
2026-06-06 09:13:11,234 - optuna.study.study - INFO - Trial 183 finished with values: [0.06603605505549932, 0.008269140598834485, 0.034393813895903076] and parameters: {'n_layers': 4, 'embedding_dim': 256, 'lr': 0.00021389021150995766, 'lambda_val': 1.3398416216824042e-06, 'batch_size': 3867, 'optimizer': 'RMSprop'}.
2026-06-06 09:13:48,326 - experiment_functions - INFO - Early stopping at epoch 650. Best Metrics: (0.029873801974504188, 0.0035853037711836024, 0.013879361254900103)
2026-06-06 09:13:48,434 - optuna.study.study - INFO - Trial 184 finished with values: [0.029873801974504188, 0.0035853037711836024, 0.013879361254900103] and parameters: {'n_layers': 3, 'embedding_dim': 256, 'lr': 0.0019509035141199726, 'lambda_val': 0.002721157973998006, 'batch_size': 2193, 'optimizer': 'RMSprop'}.
2026-06-06 09:14:09,758 - experiment_functions - INFO - Early stopping at epoch 500. Best Metrics: (0.0008718375296532668, 9.545180521133365e-05, 0.00033639624314932986)
2026-06-06 09:14:10,070 - optuna.study.study - INFO - Trial 185 finished with values: [0.0008718375296532668, 9.545180521133365e-05, 0.00033639624314932986] and parameters: {'n_layers': 1, 'embedding_dim': 96, 'lr': 0.00032610475745856415, 'lambda_val': 0.06702899171785481, 'batch_size': 1696, 'optimizer': 'RMSprop'}.
2026-06-06 09:16:46,585 - optuna.study.study - INFO - Trial 186 finished with values: [0.08529587816452147, 0.010531515841650478, 0.0460117977228925] and parameters: {'n_layers': 1, 'embedding_dim': 32, 'lr': 0.0019509035141199726, 'lambda_val': 1.3036977819163817e-06, 'batch_size': 1712, 'optimizer': 'RMSprop'}.
2026-06-06 09:19:42,975 - optuna.study.study - INFO - Trial 187 finished with values: [0.08556594311169431, 0.01025688257753366, 0.04442952608688426] and parameters: {'n_layers': 2, 'embedding_dim': 128, 'lr': 0.0006810282647636203, 'lambda_val': 5.510107267630662e-06, 'batch_size': 2873, 'optimizer': 'Adam'}.
2026-06-06 09:22:27,107 - optuna.study.study - INFO - Trial 188 finished with values: [0.09401246988758304, 0.011234844932681358, 0.04956182434701707] and parameters: {'n_layers': 1, 'embedding_dim': 96, 'lr': 0.0019509035141199726, 'lambda_val': 1.3036977819163817e-06, 'batch_size': 1712, 'optimizer': 'RMSprop'}.
2026-06-06 09:23:08,535 - experiment_functions - INFO - Early stopping at epoch 1000. Best Metrics: (0.06379728180925319, 0.007748342152856856, 0.03209698481154734)
2026-06-06 09:23:08,735 - optuna.study.study - INFO - Trial 189 finished with values: [0.06379728180925319, 0.007748342152856856, 0.03209698481154734] and parameters: {'n_layers': 2, 'embedding_dim': 32, 'lr': 0.0019509035141199726, 'lambda_val': 1.3036977819163817e-06, 'batch_size': 2384, 'optimizer': 'RMSprop'}.
2026-06-06 09:23:43,002 - experiment_functions - INFO - Early stopping at epoch 700. Best Metrics: (0.0738586987649898, 0.009287293187755376, 0.03856919470755009)
2026-06-06 09:23:43,431 - optuna.study.study - INFO - Trial 190 finished with values: [0.0738586987649898, 0.009287293187755376, 0.03856919470755009] and parameters: {'n_layers': 1, 'embedding_dim': 256, 'lr': 0.005828487948467767, 'lambda_val': 1.9181328945787323e-06, 'batch_size': 3136, 'optimizer': 'Adam'}.
2026-06-06 09:24:21,130 - experiment_functions - INFO - Early stopping at epoch 900. Best Metrics: (0.05790843065250109, 0.006813919217630118, 0.028158109409336864)
2026-06-06 09:24:21,223 - optuna.study.study - INFO - Trial 191 finished with values: [0.05790843065250109, 0.006813919217630118, 0.028158109409336864] and parameters: {'n_layers': 1, 'embedding_dim': 64, 'lr': 0.005828487948467767, 'lambda_val': 2.5535184182963008e-05, 'batch_size': 3359, 'optimizer': 'RMSprop'}.
2026-06-06 09:26:23,963 - experiment_functions - INFO - Early stopping at epoch 2400. Best Metrics: (0.08954239349709438, 0.010752562127403041, 0.0467562128422099)
2026-06-06 09:26:24,289 - optuna.study.study - INFO - Trial 192 finished with values: [0.08954239349709438, 0.010752562127403041, 0.0467562128422099] and parameters: {'n_layers': 2, 'embedding_dim': 256, 'lr': 0.0006711529294623438, 'lambda_val': 1.2176798127435423e-06, 'batch_size': 2384, 'optimizer': 'RMSprop'}.
2026-06-06 09:26:52,329 - experiment_functions - INFO - Early stopping at epoch 550. Best Metrics: (0.025329674087172693, 0.002952307589255811, 0.011511819582932944)
2026-06-06 09:26:56,716 - optuna.study.study - INFO - Trial 193 finished with values: [0.025329674087172693, 0.002952307589255811, 0.011511819582932944] and parameters: {'n_layers': 4, 'embedding_dim': 128, 'lr': 0.005828487948467767, 'lambda_val': 0.001602265573028567, 'batch_size': 3359, 'optimizer': 'RMSprop'}.
2026-06-06 09:30:55,610 - optuna.study.study - INFO - Trial 194 finished with values: [0.039352421008100144, 0.00551276039922299, 0.021777138685108575] and parameters: {'n_layers': 4, 'embedding_dim': 256, 'lr': 0.00021389021150995766, 'lambda_val': 4.922331159406591e-06, 'batch_size': 667, 'optimizer': 'RMSprop'}.
2026-06-06 09:32:29,671 - experiment_functions - INFO - Early stopping at epoch 2500. Best Metrics: (0.0006682946229351799, 0.00011387232902404717, 0.00029507121097670035)
2026-06-06 09:32:29,758 - optuna.study.study - INFO - Trial 195 finished with values: [0.0006682946229351799, 0.00011387232902404717, 0.00029507121097670035] and parameters: {'n_layers': 1, 'embedding_dim': 64, 'lr': 0.00021389021150995766, 'lambda_val': 0.0001152199727179159, 'batch_size': 1350, 'optimizer': 'RMSprop'}.
2026-06-06 09:33:10,388 - experiment_functions - INFO - Early stopping at epoch 650. Best Metrics: (0.04650082808598729, 0.005675195927389645, 0.02294584617094016)
2026-06-06 09:33:11,292 - optuna.study.study - INFO - Trial 196 finished with values: [0.04650082808598729, 0.005675195927389645, 0.02294584617094016] and parameters: {'n_layers': 4, 'embedding_dim': 256, 'lr': 0.0017827212934439936, 'lambda_val': 7.265971768922724e-05, 'batch_size': 3359, 'optimizer': 'Adam'}.
2026-06-06 09:34:36,583 - experiment_functions - INFO - Early stopping at epoch 1850. Best Metrics: (0.06637442350435482, 0.007783508607408399, 0.03156435163900403)
2026-06-06 09:34:36,867 - optuna.study.study - INFO - Trial 197 finished with values: [0.06637442350435482, 0.007783508607408399, 0.03156435163900403] and parameters: {'n_layers': 1, 'embedding_dim': 256, 'lr': 0.004471753451787057, 'lambda_val': 1.3398416216824042e-06, 'batch_size': 2989, 'optimizer': 'RMSprop'}.
2026-06-06 09:35:58,369 - experiment_functions - INFO - Early stopping at epoch 1950. Best Metrics: (0.0920302670410262, 0.011033893763815392, 0.04740944494673453)
2026-06-06 09:35:58,717 - optuna.study.study - INFO - Trial 198 finished with values: [0.0920302670410262, 0.011033893763815392, 0.04740944494673453] and parameters: {'n_layers': 1, 'embedding_dim': 96, 'lr': 0.0019509035141199726, 'lambda_val': 5.510107267630662e-06, 'batch_size': 2384, 'optimizer': 'RMSprop'}.
2026-06-06 09:38:37,189 - optuna.study.study - INFO - Trial 199 finished with values: [0.05059652551062839, 0.007279456092169603, 0.030341536672129906] and parameters: {'n_layers': 1, 'embedding_dim': 96, 'lr': 0.0006810282647636203, 'lambda_val': 7.265971768922724e-05, 'batch_size': 1350, 'optimizer': 'RMSprop'}.
2026-06-06 09:39:15,864 - experiment_functions - INFO - Early stopping at epoch 900. Best Metrics: (0.07681565094300977, 0.009818139192176301, 0.04171874912984213)
2026-06-06 09:39:15,985 - optuna.study.study - INFO - Trial 200 finished with values: [0.07681565094300977, 0.009818139192176301, 0.04171874912984213] and parameters: {'n_layers': 1, 'embedding_dim': 96, 'lr': 0.0017827212934439936, 'lambda_val': 0.0006603606000578724, 'batch_size': 3082, 'optimizer': 'RMSprop'}.
2026-06-06 09:41:57,548 - optuna.study.study - INFO - Trial 201 finished with values: [0.04780084439859643, 0.0067904749145957545, 0.02705815707989462] and parameters: {'n_layers': 1, 'embedding_dim': 128, 'lr': 0.0006711529294623438, 'lambda_val': 5.480077822962117e-05, 'batch_size': 1065, 'optimizer': 'RMSprop'}.
2026-06-06 09:44:19,477 - experiment_functions - INFO - Early stopping at epoch 3600. Best Metrics: (0.07034150908465868, 0.008667693750418648, 0.03776629952280209)
2026-06-06 09:44:20,402 - optuna.study.study - INFO - Trial 202 finished with values: [0.07034150908465868, 0.008667693750418648, 0.03776629952280209] and parameters: {'n_layers': 2, 'embedding_dim': 32, 'lr': 0.0006711529294623438, 'lambda_val': 0.0006603606000578724, 'batch_size': 2579, 'optimizer': 'RMSprop'}.
2026-06-06 09:45:01,787 - experiment_functions - INFO - Early stopping at epoch 950. Best Metrics: (0.03810056037158434, 0.004442695425011721, 0.018545399817618213)
2026-06-06 09:45:01,875 - optuna.study.study - INFO - Trial 203 finished with values: [0.03810056037158434, 0.004442695425011721, 0.018545399817618213] and parameters: {'n_layers': 2, 'embedding_dim': 96, 'lr': 0.014623403753466198, 'lambda_val': 1.2176798127435423e-06, 'batch_size': 2384, 'optimizer': 'RMSprop'}.
2026-06-06 09:47:44,179 - optuna.study.study - INFO - Trial 204 finished with values: [0.08688806795404677, 0.010523142876281063, 0.04587926383765251] and parameters: {'n_layers': 1, 'embedding_dim': 32, 'lr': 0.0019509035141199726, 'lambda_val': 3.456741724473969e-06, 'batch_size': 2384, 'optimizer': 'RMSprop'}.
2026-06-06 09:48:27,754 - experiment_functions - INFO - Early stopping at epoch 1100. Best Metrics: (0.03445624511762772, 0.004384084667425816, 0.01653880354995151)
2026-06-06 09:48:27,849 - optuna.study.study - INFO - Trial 205 finished with values: [0.03445624511762772, 0.004384084667425816, 0.01653880354995151] and parameters: {'n_layers': 2, 'embedding_dim': 32, 'lr': 0.0019509035141199726, 'lambda_val': 0.00648922829026096, 'batch_size': 976, 'optimizer': 'RMSprop'}.
2026-06-06 09:51:01,096 - optuna.study.study - INFO - Trial 206 finished with values: [0.05853201532977918, 0.008098332105298412, 0.032518985801480924] and parameters: {'n_layers': 1, 'embedding_dim': 32, 'lr': 0.0006810282647636203, 'lambda_val': 0.003010182335575881, 'batch_size': 3082, 'optimizer': 'RMSprop'}.
2026-06-06 09:54:17,073 - experiment_functions - INFO - Early stopping at epoch 3850. Best Metrics: (0.08743010502273078, 0.010521468283207182, 0.0453956394259252)
2026-06-06 09:54:17,658 - optuna.study.study - INFO - Trial 207 finished with values: [0.08743010502273078, 0.010521468283207182, 0.0453956394259252] and parameters: {'n_layers': 2, 'embedding_dim': 256, 'lr': 0.0006810282647636203, 'lambda_val': 5.510107267630662e-06, 'batch_size': 2873, 'optimizer': 'Adam'}.
2026-06-06 09:55:14,781 - experiment_functions - INFO - Early stopping at epoch 1350. Best Metrics: (0.08581907248983724, 0.010266930135976958, 0.04372785607569625)
2026-06-06 09:55:14,884 - optuna.study.study - INFO - Trial 208 finished with values: [0.08581907248983724, 0.010266930135976958, 0.04372785607569625] and parameters: {'n_layers': 1, 'embedding_dim': 96, 'lr': 0.0019509035141199726, 'lambda_val': 4.2735070605297645e-06, 'batch_size': 3866, 'optimizer': 'RMSprop'}.
2026-06-06 09:56:23,975 - experiment_functions - INFO - Early stopping at epoch 1550. Best Metrics: (0.06847158431133575, 0.008290910308794964, 0.03481156306466461)
2026-06-06 09:56:24,295 - optuna.study.study - INFO - Trial 209 finished with values: [0.06847158431133575, 0.008290910308794964, 0.03481156306466461] and parameters: {'n_layers': 2, 'embedding_dim': 128, 'lr': 0.0006711529294623438, 'lambda_val': 0.0016696163443190065, 'batch_size': 3209, 'optimizer': 'RMSprop'}.
