2026-06-07 09:19:03,193 - optuna.study.study - INFO - Trial 241 finished with values: [0.02734982098174465, 0.004203228615446447, 0.014535390588993214] and parameters: {'n_layers': 4, 'embedding_dim': 32, 'lr': 0.0010601215811942713, 'lambda_val': 0.0008628561498380414, 'batch_size': 1514, 'optimizer': 'RMSprop'}.
2026-06-07 09:19:39,963 - experiment_functions - INFO - Early stopping at epoch 900. Best Metrics: (0.02670281505637109, 0.0037879295331234514, 0.014312841694425161)
2026-06-07 09:19:40,836 - optuna.study.study - INFO - Trial 242 finished with values: [0.02670281505637109, 0.0037879295331234514, 0.014312841694425161] and parameters: {'n_layers': 4, 'embedding_dim': 32, 'lr': 0.002168096883511623, 'lambda_val': 2.6854131809518415e-06, 'batch_size': 2975, 'optimizer': 'RMSprop'}.
2026-06-07 09:20:42,209 - experiment_functions - INFO - Early stopping at epoch 1500. Best Metrics: (0.03153340808717671, 0.004909906892625093, 0.01745959678499507)
2026-06-07 09:20:42,377 - optuna.study.study - INFO - Trial 243 finished with values: [0.03153340808717671, 0.004909906892625093, 0.01745959678499507] and parameters: {'n_layers': 3, 'embedding_dim': 64, 'lr': 0.0013734258944280648, 'lambda_val': 0.0008628561498380414, 'batch_size': 572, 'optimizer': 'RMSprop'}.
2026-06-07 09:21:53,434 - experiment_functions - INFO - Early stopping at epoch 1850. Best Metrics: (0.023078597779649525, 0.0036573112733605737, 0.013103162728564075)
2026-06-07 09:21:53,541 - optuna.study.study - INFO - Trial 244 finished with values: [0.023078597779649525, 0.0036573112733605737, 0.013103162728564075] and parameters: {'n_layers': 2, 'embedding_dim': 32, 'lr': 0.0013734258944280648, 'lambda_val': 5.604086483439305e-05, 'batch_size': 2975, 'optimizer': 'RMSprop'}.
2026-06-07 09:22:53,619 - experiment_functions - INFO - Early stopping at epoch 1100. Best Metrics: (0.03263133561999088, 0.00486469287963025, 0.017584293212490748)
2026-06-07 09:22:53,705 - optuna.study.study - INFO - Trial 245 finished with values: [0.03263133561999088, 0.00486469287963025, 0.017584293212490748] and parameters: {'n_layers': 4, 'embedding_dim': 256, 'lr': 0.0009791612272847586, 'lambda_val': 1.471855561908882e-05, 'batch_size': 1514, 'optimizer': 'RMSprop'}.
2026-06-07 09:23:22,259 - experiment_functions - INFO - Early stopping at epoch 500. Best Metrics: (0.0048047744343940055, 0.0006112264719673119, 0.002840336422710358)
2026-06-07 09:23:22,337 - optuna.study.study - INFO - Trial 246 finished with values: [0.0048047744343940055, 0.0006112264719673119, 0.002840336422710358] and parameters: {'n_layers': 4, 'embedding_dim': 256, 'lr': 0.0948616920386105, 'lambda_val': 0.001761785848083831, 'batch_size': 2975, 'optimizer': 'Adam'}.
2026-06-07 09:24:00,487 - experiment_functions - INFO - Early stopping at epoch 950. Best Metrics: (0.024456290392987343, 0.003761136043941323, 0.013379845550497708)
2026-06-07 09:24:00,573 - optuna.study.study - INFO - Trial 247 finished with values: [0.024456290392987343, 0.003761136043941323, 0.013379845550497708] and parameters: {'n_layers': 3, 'embedding_dim': 32, 'lr': 0.003577419943834574, 'lambda_val': 5.656965316395304e-06, 'batch_size': 1182, 'optimizer': 'RMSprop'}.
2026-06-07 09:25:08,314 - experiment_functions - INFO - Early stopping at epoch 1550. Best Metrics: (0.030519034092470188, 0.004566615312479067, 0.016518218259156198)
2026-06-07 09:25:08,395 - optuna.study.study - INFO - Trial 248 finished with values: [0.030519034092470188, 0.004566615312479067, 0.016518218259156198] and parameters: {'n_layers': 4, 'embedding_dim': 96, 'lr': 0.0013734258944280648, 'lambda_val': 1.471855561908882e-05, 'batch_size': 1595, 'optimizer': 'Adam'}.
2026-06-07 09:25:39,998 - experiment_functions - INFO - Early stopping at epoch 600. Best Metrics: (0.016467283861291513, 0.0025118896108245695, 0.008415168589894589)
2026-06-07 09:25:40,073 - optuna.study.study - INFO - Trial 249 finished with values: [0.016467283861291513, 0.0025118896108245695, 0.008415168589894589] and parameters: {'n_layers': 3, 'embedding_dim': 256, 'lr': 0.003577419943834574, 'lambda_val': 0.0011770311971803446, 'batch_size': 1711, 'optimizer': 'RMSprop'}.
2026-06-07 09:27:41,043 - experiment_functions - INFO - Early stopping at epoch 2500. Best Metrics: (0.0004995470645125131, 9.545180521133365e-05, 0.00023850049952380236)
2026-06-07 09:27:41,136 - optuna.study.study - INFO - Trial 250 finished with values: [0.0004995470645125131, 9.545180521133365e-05, 0.00023850049952380236] and parameters: {'n_layers': 3, 'embedding_dim': 256, 'lr': 2.9349240042656504e-05, 'lambda_val': 1.471855561908882e-05, 'batch_size': 572, 'optimizer': 'RMSprop'}.
2026-06-07 09:28:01,789 - experiment_functions - INFO - Early stopping at epoch 500. Best Metrics: (0.0005750924282483408, 8.205506062026927e-05, 0.00026508347440077365)
2026-06-07 09:28:02,173 - optuna.study.study - INFO - Trial 251 finished with values: [0.0005750924282483408, 8.205506062026927e-05, 0.00026508347440077365] and parameters: {'n_layers': 4, 'embedding_dim': 32, 'lr': 0.0022844612214732766, 'lambda_val': 5.656965316395304e-06, 'batch_size': 1182, 'optimizer': 'SGD'}.
2026-06-07 09:30:47,739 - optuna.study.study - INFO - Trial 252 finished with values: [0.035037629773173075, 0.005434054524750486, 0.0204930558541041] and parameters: {'n_layers': 3, 'embedding_dim': 96, 'lr': 0.0006328376000987285, 'lambda_val': 5.604086483439305e-05, 'batch_size': 1111, 'optimizer': 'RMSprop'}.
2026-06-07 09:31:41,533 - experiment_functions - INFO - Early stopping at epoch 1350. Best Metrics: (0.02586254497742571, 0.003908500234443031, 0.01372967017332395)
2026-06-07 09:31:41,628 - optuna.study.study - INFO - Trial 253 finished with values: [0.02586254497742571, 0.003908500234443031, 0.01372967017332395] and parameters: {'n_layers': 4, 'embedding_dim': 32, 'lr': 0.0013734258944280648, 'lambda_val': 1.8902402933529376e-05, 'batch_size': 2930, 'optimizer': 'RMSprop'}.
2026-06-07 09:32:21,041 - experiment_functions - INFO - Early stopping at epoch 700. Best Metrics: (0.02581985466432969, 0.003945341282068458, 0.013948854505595095)
2026-06-07 09:32:21,127 - optuna.study.study - INFO - Trial 254 finished with values: [0.02581985466432969, 0.003945341282068458, 0.013948854505595095] and parameters: {'n_layers': 4, 'embedding_dim': 256, 'lr': 0.0013734258944280648, 'lambda_val': 5.604086483439305e-05, 'batch_size': 2975, 'optimizer': 'RMSprop'}.
2026-06-07 09:34:58,042 - experiment_functions - INFO - Early stopping at epoch 3500. Best Metrics: (0.03730250921383097, 0.0054139594078638905, 0.019817861143767216)
2026-06-07 09:34:58,127 - optuna.study.study - INFO - Trial 255 finished with values: [0.03730250921383097, 0.0054139594078638905, 0.019817861143767216] and parameters: {'n_layers': 4, 'embedding_dim': 128, 'lr': 0.0013734258944280648, 'lambda_val': 1.471855561908882e-05, 'batch_size': 572, 'optimizer': 'RMSprop'}.
2026-06-07 09:37:29,656 - optuna.study.study - INFO - Trial 256 finished with values: [0.017711923314177824, 0.0029590059615513427, 0.010755951542939051] and parameters: {'n_layers': 4, 'embedding_dim': 32, 'lr': 0.00032876837023732925, 'lambda_val': 5.604086483439305e-05, 'batch_size': 1703, 'optimizer': 'RMSprop'}.
2026-06-07 09:38:37,811 - experiment_functions - INFO - Early stopping at epoch 1350. Best Metrics: (0.031269408412463916, 0.004817804273561524, 0.0168621611720801)
2026-06-07 09:38:37,901 - optuna.study.study - INFO - Trial 257 finished with values: [0.031269408412463916, 0.004817804273561524, 0.0168621611720801] and parameters: {'n_layers': 3, 'embedding_dim': 256, 'lr': 0.0009791612272847586, 'lambda_val': 1.471855561908882e-05, 'batch_size': 1514, 'optimizer': 'RMSprop'}.
2026-06-07 09:39:11,930 - experiment_functions - INFO - Early stopping at epoch 700. Best Metrics: (0.016382208626842608, 0.0025872462991493065, 0.008903206098916304)
2026-06-07 09:39:12,772 - optuna.study.study - INFO - Trial 258 finished with values: [0.016382208626842608, 0.0025872462991493065, 0.008903206098916304] and parameters: {'n_layers': 2, 'embedding_dim': 256, 'lr': 0.0022844612214732766, 'lambda_val': 0.0011075170393277593, 'batch_size': 2187, 'optimizer': 'RMSprop'}.
2026-06-07 09:42:12,818 - optuna.study.study - INFO - Trial 259 finished with values: [0.009136315025415329, 0.0014887132426820281, 0.005550707562604583] and parameters: {'n_layers': 2, 'embedding_dim': 256, 'lr': 0.0002527845453356463, 'lambda_val': 0.00010082268820599092, 'batch_size': 2050, 'optimizer': 'RMSprop'}.
2026-06-07 09:43:56,509 - experiment_functions - INFO - Early stopping at epoch 2500. Best Metrics: (0.028524435630703, 0.004491258624154331, 0.015755431875393137)
2026-06-07 09:43:56,580 - optuna.study.study - INFO - Trial 260 finished with values: [0.028524435630703, 0.004491258624154331, 0.015755431875393137] and parameters: {'n_layers': 3, 'embedding_dim': 96, 'lr': 0.0006328376000987285, 'lambda_val': 0.002245934698588522, 'batch_size': 1111, 'optimizer': 'RMSprop'}.
2026-06-07 09:44:32,657 - experiment_functions - INFO - Early stopping at epoch 900. Best Metrics: (0.023544586970994465, 0.0035635340612231226, 0.013174634665527176)
2026-06-07 09:44:33,304 - optuna.study.study - INFO - Trial 261 finished with values: [0.023544586970994465, 0.0035635340612231226, 0.013174634665527176] and parameters: {'n_layers': 3, 'embedding_dim': 32, 'lr': 0.003872913927860718, 'lambda_val': 1.258044231944951e-05, 'batch_size': 1182, 'optimizer': 'RMSprop'}.
2026-06-07 09:46:26,554 - experiment_functions - INFO - Early stopping at epoch 2750. Best Metrics: (0.027304613695932668, 0.004375711702056399, 0.015736086077225046)
2026-06-07 09:46:26,648 - optuna.study.study - INFO - Trial 262 finished with values: [0.027304613695932668, 0.004375711702056399, 0.015736086077225046] and parameters: {'n_layers': 2, 'embedding_dim': 128, 'lr': 0.0009791612272847586, 'lambda_val': 0.0008628561498380414, 'batch_size': 572, 'optimizer': 'RMSprop'}.
2026-06-07 09:49:20,210 - optuna.study.study - INFO - Trial 263 finished with values: [0.025800341278708297, 0.004203228615446446, 0.015402660995444394] and parameters: {'n_layers': 4, 'embedding_dim': 128, 'lr': 0.0004340370842280224, 'lambda_val': 5.604086483439305e-05, 'batch_size': 572, 'optimizer': 'RMSprop'}.
2026-06-07 09:51:56,590 - optuna.study.study - INFO - Trial 264 finished with values: [0.030641928111543464, 0.004764217295197267, 0.018254650986988905] and parameters: {'n_layers': 2, 'embedding_dim': 96, 'lr': 0.0009791612272847586, 'lambda_val': 5.604086483439305e-05, 'batch_size': 1111, 'optimizer': 'RMSprop'}.
2026-06-07 09:54:26,504 - optuna.study.study - INFO - Trial 265 finished with values: [0.016366140425653777, 0.0026341349052180323, 0.009222952284588084] and parameters: {'n_layers': 1, 'embedding_dim': 96, 'lr': 0.0009791612272847586, 'lambda_val': 2.1562448265609146e-05, 'batch_size': 2975, 'optimizer': 'RMSprop'}.
2026-06-07 09:55:37,536 - experiment_functions - INFO - Early stopping at epoch 1550. Best Metrics: (0.014740809294268506, 0.002404715654096055, 0.008069201441335811)
2026-06-07 09:55:37,618 - optuna.study.study - INFO - Trial 266 finished with values: [0.014740809294268506, 0.002404715654096055, 0.008069201441335811] and parameters: {'n_layers': 2, 'embedding_dim': 256, 'lr': 0.0006420352977986802, 'lambda_val': 0.010046534399816976, 'batch_size': 2687, 'optimizer': 'RMSprop'}.
2026-06-07 09:57:11,190 - experiment_functions - INFO - Early stopping at epoch 2050. Best Metrics: (0.026995160064054714, 0.004209926987741979, 0.014743363523631231)
2026-06-07 09:57:11,275 - optuna.study.study - INFO - Trial 267 finished with values: [0.026995160064054714, 0.004209926987741979, 0.014743363523631231] and parameters: {'n_layers': 2, 'embedding_dim': 256, 'lr': 0.0008738901578381451, 'lambda_val': 2.1562448265609146e-05, 'batch_size': 1595, 'optimizer': 'RMSprop'}.
2026-06-07 09:57:34,457 - experiment_functions - INFO - Early stopping at epoch 500. Best Metrics: (0.0005864154425749069, 9.880099135909974e-05, 0.00027556836237428207)
2026-06-07 09:57:34,540 - optuna.study.study - INFO - Trial 268 finished with values: [0.0005864154425749069, 9.880099135909974e-05, 0.00027556836237428207] and parameters: {'n_layers': 4, 'embedding_dim': 128, 'lr': 0.0009791612272847586, 'lambda_val': 0.00014351375456912266, 'batch_size': 3000, 'optimizer': 'SGD'}.
2026-06-07 09:59:14,295 - experiment_functions - INFO - Early stopping at epoch 2800. Best Metrics: (0.0006054188053787498, 8.372965369415234e-05, 0.0002647503386417492)
2026-06-07 09:59:14,628 - optuna.study.study - INFO - Trial 269 finished with values: [0.0006054188053787498, 8.372965369415234e-05, 0.0002647503386417492] and parameters: {'n_layers': 2, 'embedding_dim': 32, 'lr': 4.1778569551616446e-05, 'lambda_val': 1.471855561908882e-05, 'batch_size': 726, 'optimizer': 'RMSprop'}.
2026-06-07 10:01:40,753 - optuna.study.study - INFO - Trial 270 finished with values: [0.026829505209628707, 0.004201554022372563, 0.015226721054327503] and parameters: {'n_layers': 2, 'embedding_dim': 32, 'lr': 0.0010718155355804958, 'lambda_val': 1.5522882454254386e-06, 'batch_size': 1514, 'optimizer': 'RMSprop'}.
2026-06-07 10:02:33,579 - experiment_functions - INFO - Early stopping at epoch 1400. Best Metrics: (0.026631700307172258, 0.00405084064572309, 0.014994643026469944)
2026-06-07 10:02:33,649 - optuna.study.study - INFO - Trial 271 finished with values: [0.026631700307172258, 0.00405084064572309, 0.014994643026469944] and parameters: {'n_layers': 2, 'embedding_dim': 32, 'lr': 0.002168096883511623, 'lambda_val': 5.604086483439305e-05, 'batch_size': 959, 'optimizer': 'RMSprop'}.
2026-06-07 10:04:09,787 - experiment_functions - INFO - Early stopping at epoch 1950. Best Metrics: (0.02955022795019369, 0.004707281130685244, 0.015886040403661067)
2026-06-07 10:04:10,011 - optuna.study.study - INFO - Trial 272 finished with values: [0.02955022795019369, 0.004707281130685244, 0.015886040403661067] and parameters: {'n_layers': 3, 'embedding_dim': 256, 'lr': 0.0008738901578381451, 'lambda_val': 0.0008628561498380414, 'batch_size': 572, 'optimizer': 'RMSprop'}.
2026-06-07 10:04:41,211 - experiment_functions - INFO - Early stopping at epoch 600. Best Metrics: (0.013896964545052277, 0.002058074887802264, 0.0071489909644114735)
2026-06-07 10:04:42,387 - optuna.study.study - INFO - Trial 273 finished with values: [0.013896964545052277, 0.002058074887802264, 0.0071489909644114735] and parameters: {'n_layers': 3, 'embedding_dim': 256, 'lr': 0.011001147965213095, 'lambda_val': 1.8902402933529376e-05, 'batch_size': 3181, 'optimizer': 'RMSprop'}.
2026-06-07 10:05:43,058 - experiment_functions - INFO - Early stopping at epoch 1400. Best Metrics: (0.028355896498222535, 0.004322124723692143, 0.015451677652418833)
2026-06-07 10:05:43,235 - optuna.study.study - INFO - Trial 274 finished with values: [0.028355896498222535, 0.004322124723692143, 0.015451677652418833] and parameters: {'n_layers': 3, 'embedding_dim': 128, 'lr': 0.0009791612272847586, 'lambda_val': 0.00010082268820599092, 'batch_size': 2975, 'optimizer': 'RMSprop'}.
2026-06-07 10:08:09,891 - optuna.study.study - INFO - Trial 275 finished with values: [0.004789091959584424, 0.0007384955455824235, 0.0029256779008493138] and parameters: {'n_layers': 1, 'embedding_dim': 96, 'lr': 0.00036456642855558005, 'lambda_val': 2.1562448265609146e-05, 'batch_size': 1929, 'optimizer': 'RMSprop'}.
2026-06-07 10:10:46,026 - optuna.study.study - INFO - Trial 276 finished with values: [0.029710409640973507, 0.0046202022908433255, 0.017347772437081445] and parameters: {'n_layers': 2, 'embedding_dim': 96, 'lr': 0.0010160627847963985, 'lambda_val': 8.825101710739673e-06, 'batch_size': 572, 'optimizer': 'RMSprop'}.
2026-06-07 10:11:39,281 - experiment_functions - INFO - Early stopping at epoch 1050. Best Metrics: (0.02750571677734337, 0.0042903074552883644, 0.014783161530895083)
2026-06-07 10:11:39,365 - optuna.study.study - INFO - Trial 277 finished with values: [0.02750571677734337, 0.0042903074552883644, 0.014783161530895083] and parameters: {'n_layers': 3, 'embedding_dim': 256, 'lr': 0.0009791612272847586, 'lambda_val': 1.471855561908882e-05, 'batch_size': 3181, 'optimizer': 'RMSprop'}.
2026-06-07 10:12:18,935 - experiment_functions - INFO - Early stopping at epoch 950. Best Metrics: (0.027311875739537448, 0.004104427624087347, 0.01461533934980479)
2026-06-07 10:12:19,571 - optuna.study.study - INFO - Trial 278 finished with values: [0.027311875739537448, 0.004104427624087347, 0.01461533934980479] and parameters: {'n_layers': 4, 'embedding_dim': 64, 'lr': 0.0013490499059008248, 'lambda_val': 1.8902402933529376e-05, 'batch_size': 3181, 'optimizer': 'RMSprop'}.
2026-06-07 10:13:47,336 - experiment_functions - INFO - Early stopping at epoch 2050. Best Metrics: (0.03206793416414176, 0.004968517650210998, 0.017606372794226523)
2026-06-07 10:13:47,428 - optuna.study.study - INFO - Trial 279 finished with values: [0.03206793416414176, 0.004968517650210998, 0.017606372794226523] and parameters: {'n_layers': 3, 'embedding_dim': 128, 'lr': 0.0009791612272847586, 'lambda_val': 0.0008628561498380414, 'batch_size': 658, 'optimizer': 'RMSprop'}.
2026-06-07 10:16:14,161 - optuna.study.study - INFO - Trial 280 finished with values: [0.025133370026278645, 0.0040223725634670774, 0.014361954048028543] and parameters: {'n_layers': 2, 'embedding_dim': 32, 'lr': 0.0010601215811942713, 'lambda_val': 1.471855561908882e-05, 'batch_size': 1514, 'optimizer': 'RMSprop'}.
2026-06-07 10:17:30,521 - experiment_functions - INFO - Early stopping at epoch 1700. Best Metrics: (0.03431190914157194, 0.0050807153861611625, 0.018732615378743118)
