2026-06-03 20:36:09,958 - optuna.study.study - INFO - Trial 124 finished with values: [0.004593193143588248, 0.000865764619197535, 0.002515020103279659] and parameters: {'n_layers': 2, 'embedding_dim': 256, 'lr': 0.006618720765032931, 'lambda_val': 0.008589102899886254, 'batch_size': 3398, 'optimizer': 'Adam'}.
2026-06-03 20:38:36,438 - optuna.study.study - INFO - Trial 125 finished with values: [0.0016568326020985169, 0.00023611762341750953, 0.0008388071755022485] and parameters: {'n_layers': 1, 'embedding_dim': 64, 'lr': 0.00020098399678081456, 'lambda_val': 5.609342222844582e-06, 'batch_size': 1505, 'optimizer': 'RMSprop'}.
2026-06-03 20:39:00,401 - experiment_functions - INFO - Early stopping at epoch 550. Best Metrics: (0.005991950810158802, 0.0010014066581820618, 0.003470231854040703)
2026-06-03 20:39:00,516 - optuna.study.study - INFO - Trial 126 finished with values: [0.005991950810158802, 0.0010014066581820618, 0.003470231854040703] and parameters: {'n_layers': 4, 'embedding_dim': 64, 'lr': 0.03446031343627178, 'lambda_val': 0.00010733978042493688, 'batch_size': 1308, 'optimizer': 'Adam'}.
2026-06-03 20:40:04,673 - experiment_functions - INFO - Early stopping at epoch 1650. Best Metrics: (0.000715623228398334, 0.00010047558443298278, 0.0002843787770565347)
2026-06-03 20:40:04,781 - optuna.study.study - INFO - Trial 127 finished with values: [0.000715623228398334, 0.00010047558443298278, 0.0002843787770565347] and parameters: {'n_layers': 1, 'embedding_dim': 128, 'lr': 6.240821241370547e-05, 'lambda_val': 0.00047268866494377303, 'batch_size': 701, 'optimizer': 'RMSprop'}.
2026-06-03 20:41:28,450 - experiment_functions - INFO - Early stopping at epoch 2150. Best Metrics: (0.0004500397058108824, 7.870587447250318e-05, 0.00023871688382056747)
2026-06-03 20:41:28,561 - optuna.study.study - INFO - Trial 128 finished with values: [0.0004500397058108824, 7.870587447250318e-05, 0.00023871688382056747] and parameters: {'n_layers': 2, 'embedding_dim': 96, 'lr': 3.526098906840069e-05, 'lambda_val': 0.00021888803225104277, 'batch_size': 790, 'optimizer': 'RMSprop'}.
2026-06-03 20:42:01,835 - experiment_functions - INFO - Early stopping at epoch 850. Best Metrics: (0.0043612677489951665, 0.0006899323464398152, 0.0022987816326943164)
2026-06-03 20:42:01,953 - optuna.study.study - INFO - Trial 129 finished with values: [0.0043612677489951665, 0.0006899323464398152, 0.0022987816326943164] and parameters: {'n_layers': 1, 'embedding_dim': 64, 'lr': 0.005875923861834851, 'lambda_val': 0.00025850151634462684, 'batch_size': 1371, 'optimizer': 'Adam'}.
2026-06-03 20:42:46,826 - experiment_functions - INFO - Early stopping at epoch 1100. Best Metrics: (0.007990952615427349, 0.0014267532989483557, 0.0047338935568867315)
2026-06-03 20:42:47,422 - optuna.study.study - INFO - Trial 130 finished with values: [0.007990952615427349, 0.0014267532989483557, 0.0047338935568867315] and parameters: {'n_layers': 2, 'embedding_dim': 96, 'lr': 0.002060594231766347, 'lambda_val': 0.00021888803225104277, 'batch_size': 790, 'optimizer': 'RMSprop'}.
2026-06-03 20:45:36,871 - experiment_functions - INFO - Early stopping at epoch 3300. Best Metrics: (0.009769502952385899, 0.00183033022975417, 0.00567550291880758)
2026-06-03 20:45:36,979 - optuna.study.study - INFO - Trial 131 finished with values: [0.009769502952385899, 0.00183033022975417, 0.00567550291880758] and parameters: {'n_layers': 4, 'embedding_dim': 256, 'lr': 0.000710331438856921, 'lambda_val': 8.277965708883697e-06, 'batch_size': 774, 'optimizer': 'Adam'}.
2026-06-03 20:46:00,526 - experiment_functions - INFO - Early stopping at epoch 550. Best Metrics: (0.003327366320470649, 0.0005593140866769376, 0.0020795300555841467)
2026-06-03 20:46:00,637 - optuna.study.study - INFO - Trial 132 finished with values: [0.003327366320470649, 0.0005593140866769376, 0.0020795300555841467] and parameters: {'n_layers': 2, 'embedding_dim': 96, 'lr': 0.03446031343627178, 'lambda_val': 0.00010733978042493688, 'batch_size': 2056, 'optimizer': 'RMSprop'}.
2026-06-03 20:47:11,822 - experiment_functions - INFO - Early stopping at epoch 1900. Best Metrics: (0.006383091355375029, 0.0009293991560050908, 0.0034519709806796585)
2026-06-03 20:47:11,988 - optuna.study.study - INFO - Trial 133 finished with values: [0.006383091355375029, 0.0009293991560050908, 0.0034519709806796585] and parameters: {'n_layers': 1, 'embedding_dim': 64, 'lr': 0.0014471032063295877, 'lambda_val': 0.00025850151634462684, 'batch_size': 1213, 'optimizer': 'RMSprop'}.
2026-06-03 20:47:37,407 - experiment_functions - INFO - Early stopping at epoch 550. Best Metrics: (0.006201862172750172, 0.0010399222988813717, 0.0035038635225056796)
2026-06-03 20:47:37,520 - optuna.study.study - INFO - Trial 134 finished with values: [0.006201862172750172, 0.0010399222988813717, 0.0035038635225056796] and parameters: {'n_layers': 3, 'embedding_dim': 128, 'lr': 0.011544828952739577, 'lambda_val': 0.0010538261748747916, 'batch_size': 1446, 'optimizer': 'Adam'}.
2026-06-03 20:48:18,081 - experiment_functions - INFO - Early stopping at epoch 1050. Best Metrics: (0.006714189514569381, 0.0011437470694621206, 0.0038292861597417267)
2026-06-03 20:48:19,202 - optuna.study.study - INFO - Trial 135 finished with values: [0.006714189514569381, 0.0011437470694621206, 0.0038292861597417267] and parameters: {'n_layers': 2, 'embedding_dim': 32, 'lr': 0.00280088767043512, 'lambda_val': 8.287870093807144e-05, 'batch_size': 1371, 'optimizer': 'RMSprop'}.
2026-06-03 20:48:43,137 - experiment_functions - INFO - Early stopping at epoch 550. Best Metrics: (0.005631282200807138, 0.0009478196798178044, 0.003080374505186809)
2026-06-03 20:48:43,240 - optuna.study.study - INFO - Trial 136 finished with values: [0.005631282200807138, 0.0009478196798178044, 0.003080374505186809] and parameters: {'n_layers': 4, 'embedding_dim': 64, 'lr': 0.03446031343627178, 'lambda_val': 0.00021888803225104277, 'batch_size': 790, 'optimizer': 'Adam'}.
2026-06-03 20:49:29,980 - experiment_functions - INFO - Early stopping at epoch 1150. Best Metrics: (0.00760838838501217, 0.0013949360305445778, 0.0043674247877602546)
2026-06-03 20:49:30,369 - optuna.study.study - INFO - Trial 137 finished with values: [0.00760838838501217, 0.0013949360305445778, 0.0043674247877602546] and parameters: {'n_layers': 2, 'embedding_dim': 96, 'lr': 0.002060594231766347, 'lambda_val': 0.00021888803225104277, 'batch_size': 790, 'optimizer': 'RMSprop'}.
2026-06-03 20:52:08,216 - optuna.study.study - INFO - Trial 138 finished with values: [0.001356356656122966, 0.00019927657579208252, 0.0006401810477936817] and parameters: {'n_layers': 2, 'embedding_dim': 128, 'lr': 0.0001463216973541482, 'lambda_val': 0.0002705156165706316, 'batch_size': 1460, 'optimizer': 'RMSprop'}.
2026-06-03 20:53:28,358 - experiment_functions - INFO - Early stopping at epoch 1650. Best Metrics: (0.005895347880963469, 0.0011705405586442496, 0.0035349840462394213)
2026-06-03 20:53:28,472 - optuna.study.study - INFO - Trial 139 finished with values: [0.005895347880963469, 0.0011705405586442496, 0.0035349840462394213] and parameters: {'n_layers': 3, 'embedding_dim': 256, 'lr': 0.0003517857503442046, 'lambda_val': 0.008589102899886254, 'batch_size': 2270, 'optimizer': 'RMSprop'}.
2026-06-03 20:55:20,867 - experiment_functions - INFO - Early stopping at epoch 2900. Best Metrics: (0.004124184392083301, 0.0007368209525085405, 0.002275244405230393)
2026-06-03 20:55:21,953 - optuna.study.study - INFO - Trial 140 finished with values: [0.004124184392083301, 0.0007368209525085405, 0.002275244405230393] and parameters: {'n_layers': 3, 'embedding_dim': 64, 'lr': 0.09544353740921636, 'lambda_val': 0.003379656411935868, 'batch_size': 3921, 'optimizer': 'RMSprop'}.
2026-06-03 20:55:46,838 - experiment_functions - INFO - Early stopping at epoch 600. Best Metrics: (0.005896929007056869, 0.0010951838703195122, 0.003586073646962629)
2026-06-03 20:55:47,005 - optuna.study.study - INFO - Trial 141 finished with values: [0.005896929007056869, 0.0010951838703195122, 0.003586073646962629] and parameters: {'n_layers': 4, 'embedding_dim': 32, 'lr': 0.005875923861834851, 'lambda_val': 5.609342222844582e-06, 'batch_size': 2574, 'optimizer': 'RMSprop'}.
2026-06-03 20:56:46,177 - experiment_functions - INFO - Early stopping at epoch 1200. Best Metrics: (0.008652158439131514, 0.0015054591734208588, 0.004750021261118129)
2026-06-03 20:56:46,672 - optuna.study.study - INFO - Trial 142 finished with values: [0.008652158439131514, 0.0015054591734208588, 0.004750021261118129] and parameters: {'n_layers': 3, 'embedding_dim': 256, 'lr': 0.0027608560004649, 'lambda_val': 5.085972175639675e-06, 'batch_size': 513, 'optimizer': 'RMSprop'}.
2026-06-03 20:57:27,105 - experiment_functions - INFO - Early stopping at epoch 1050. Best Metrics: (0.00611095302277543, 0.0011018822426150446, 0.0035211837930610285)
2026-06-03 20:57:27,951 - optuna.study.study - INFO - Trial 143 finished with values: [0.00611095302277543, 0.0011018822426150446, 0.0035211837930610285] and parameters: {'n_layers': 2, 'embedding_dim': 32, 'lr': 0.002060594231766347, 'lambda_val': 0.003379656411935868, 'batch_size': 790, 'optimizer': 'RMSprop'}.
2026-06-03 21:00:14,735 - optuna.study.study - INFO - Trial 144 finished with values: [0.0015863679229107656, 0.00024616518186080784, 0.0008544265753375548] and parameters: {'n_layers': 3, 'embedding_dim': 128, 'lr': 0.00011861030491137445, 'lambda_val': 0.00016259265782080494, 'batch_size': 2984, 'optimizer': 'Adam'}.
2026-06-03 21:00:59,043 - experiment_functions - INFO - Early stopping at epoch 1000. Best Metrics: (0.006932685828420926, 0.0012827382945944136, 0.0039590663534513175)
2026-06-03 21:00:59,161 - optuna.study.study - INFO - Trial 145 finished with values: [0.006932685828420926, 0.0012827382945944136, 0.0039590663534513175] and parameters: {'n_layers': 3, 'embedding_dim': 128, 'lr': 0.0027608560004649, 'lambda_val': 2.468073181110974e-06, 'batch_size': 2635, 'optimizer': 'Adam'}.
2026-06-03 21:01:24,594 - experiment_functions - INFO - Early stopping at epoch 600. Best Metrics: (0.0006540588619951579, 8.372965369415233e-05, 0.0002745108385482316)
2026-06-03 21:01:24,708 - optuna.study.study - INFO - Trial 146 finished with values: [0.0006540588619951579, 8.372965369415233e-05, 0.0002745108385482316] and parameters: {'n_layers': 3, 'embedding_dim': 64, 'lr': 8.364698385513235e-05, 'lambda_val': 0.00043770200193187273, 'batch_size': 2270, 'optimizer': 'Adam'}.
2026-06-03 21:02:00,385 - experiment_functions - INFO - Early stopping at epoch 800. Best Metrics: (0.0038368706547484742, 0.0007100274633264116, 0.0021582458629771113)
2026-06-03 21:02:00,500 - optuna.study.study - INFO - Trial 147 finished with values: [0.0038368706547484742, 0.0007100274633264116, 0.0021582458629771113] and parameters: {'n_layers': 4, 'embedding_dim': 96, 'lr': 0.002060594231766347, 'lambda_val': 0.09402982700871432, 'batch_size': 3398, 'optimizer': 'RMSprop'}.
2026-06-03 21:03:29,414 - experiment_functions - INFO - Early stopping at epoch 2200. Best Metrics: (0.009746607127368254, 0.0017633465067988482, 0.005774568052842562)
2026-06-03 21:03:29,536 - optuna.study.study - INFO - Trial 148 finished with values: [0.009746607127368254, 0.0017633465067988482, 0.005774568052842562] and parameters: {'n_layers': 4, 'embedding_dim': 64, 'lr': 0.000710331438856921, 'lambda_val': 5.609342222844582e-06, 'batch_size': 2984, 'optimizer': 'RMSprop'}.
2026-06-03 21:03:56,022 - experiment_functions - INFO - Early stopping at epoch 650. Best Metrics: (0.007068260557521219, 0.0011939848616786123, 0.003983549444148994)
2026-06-03 21:03:57,058 - optuna.study.study - INFO - Trial 149 finished with values: [0.007068260557521219, 0.0011939848616786123, 0.003983549444148994] and parameters: {'n_layers': 3, 'embedding_dim': 32, 'lr': 0.0027608560004649, 'lambda_val': 0.003379656411935868, 'batch_size': 1308, 'optimizer': 'RMSprop'}.
2026-06-03 21:04:20,875 - experiment_functions - INFO - Early stopping at epoch 550. Best Metrics: (0.003046206756601855, 0.0005442427490119901, 0.0018610109629150374)
2026-06-03 21:04:20,988 - optuna.study.study - INFO - Trial 150 finished with values: [0.003046206756601855, 0.0005442427490119901, 0.0018610109629150374] and parameters: {'n_layers': 3, 'embedding_dim': 64, 'lr': 0.05157112666211084, 'lambda_val': 0.0024039163597317716, 'batch_size': 1449, 'optimizer': 'Adam'}.
2026-06-03 21:07:06,984 - optuna.study.study - INFO - Trial 151 finished with values: [0.0019463189298607434, 0.00026960948489517043, 0.0011931956534795714] and parameters: {'n_layers': 1, 'embedding_dim': 256, 'lr': 0.00022346360246513678, 'lambda_val': 1.109906362587361e-06, 'batch_size': 1213, 'optimizer': 'RMSprop'}.
2026-06-03 21:07:42,294 - experiment_functions - INFO - Early stopping at epoch 900. Best Metrics: (0.006206077681373872, 0.0010750887534329158, 0.0035330087616275343)
2026-06-03 21:07:42,959 - optuna.study.study - INFO - Trial 152 finished with values: [0.006206077681373872, 0.0010750887534329158, 0.0035330087616275343] and parameters: {'n_layers': 2, 'embedding_dim': 32, 'lr': 0.0027608560004649, 'lambda_val': 0.0005471949744339948, 'batch_size': 1449, 'optimizer': 'RMSprop'}.
2026-06-03 21:08:27,701 - experiment_functions - INFO - Early stopping at epoch 1100. Best Metrics: (0.005302387364494779, 0.0008975818876013129, 0.0029304443054179313)
2026-06-03 21:08:28,329 - optuna.study.study - INFO - Trial 153 finished with values: [0.005302387364494779, 0.0008975818876013129, 0.0029304443054179313] and parameters: {'n_layers': 2, 'embedding_dim': 96, 'lr': 0.011544828952739577, 'lambda_val': 2.393431434886667e-06, 'batch_size': 1446, 'optimizer': 'Adam'}.
2026-06-03 21:09:02,175 - experiment_functions - INFO - Early stopping at epoch 750. Best Metrics: (0.007942127243138862, 0.0014167057405050573, 0.004606712767100282)
2026-06-03 21:09:03,204 - optuna.study.study - INFO - Trial 154 finished with values: [0.007942127243138862, 0.0014167057405050573, 0.004606712767100282] and parameters: {'n_layers': 4, 'embedding_dim': 96, 'lr': 0.002060594231766347, 'lambda_val': 0.00021888803225104277, 'batch_size': 2820, 'optimizer': 'Adam'}.
2026-06-03 21:09:50,861 - experiment_functions - INFO - Early stopping at epoch 1100. Best Metrics: (0.009584798641660456, 0.00180856051979369, 0.005687502678472287)
2026-06-03 21:09:50,973 - optuna.study.study - INFO - Trial 155 finished with values: [0.009584798641660456, 0.00180856051979369, 0.005687502678472287] and parameters: {'n_layers': 3, 'embedding_dim': 128, 'lr': 0.002060594231766347, 'lambda_val': 2.468073181110974e-06, 'batch_size': 790, 'optimizer': 'RMSprop'}.
2026-06-03 21:10:49,335 - experiment_functions - INFO - Early stopping at epoch 1450. Best Metrics: (0.0071695573158073456, 0.0012710161430772324, 0.004104697775083383)
2026-06-03 21:10:49,446 - optuna.study.study - INFO - Trial 156 finished with values: [0.0071695573158073456, 0.0012710161430772324, 0.004104697775083383] and parameters: {'n_layers': 2, 'embedding_dim': 96, 'lr': 0.002060594231766347, 'lambda_val': 2.393431434886667e-06, 'batch_size': 1505, 'optimizer': 'RMSprop'}.
2026-06-03 21:13:22,675 - experiment_functions - INFO - Early stopping at epoch 3950. Best Metrics: (0.009498420076647694, 0.0016310536539620873, 0.00540919637527939)
2026-06-03 21:13:22,784 - optuna.study.study - INFO - Trial 157 finished with values: [0.009498420076647694, 0.0016310536539620873, 0.00540919637527939] and parameters: {'n_layers': 3, 'embedding_dim': 64, 'lr': 0.000710331438856921, 'lambda_val': 0.00047268866494377303, 'batch_size': 1371, 'optimizer': 'Adam'}.
2026-06-03 21:16:35,788 - optuna.study.study - INFO - Trial 158 finished with values: [0.007160469714343082, 0.0011973340478263783, 0.004200355805762475] and parameters: {'n_layers': 3, 'embedding_dim': 256, 'lr': 0.0003517857503442046, 'lambda_val': 5.085972175639675e-06, 'batch_size': 1308, 'optimizer': 'Adam'}.
2026-06-03 21:19:45,963 - optuna.study.study - INFO - Trial 159 finished with values: [0.0024494197424168155, 0.0003432915801460245, 0.00134439927825941] and parameters: {'n_layers': 3, 'embedding_dim': 256, 'lr': 0.00013586542489208133, 'lambda_val': 0.00021888803225104277, 'batch_size': 2270, 'optimizer': 'RMSprop'}.
2026-06-03 21:21:04,479 - experiment_functions - INFO - Early stopping at epoch 1600. Best Metrics: (0.00864705374103219, 0.0015573715587112332, 0.004944108124955936)
2026-06-03 21:21:04,599 - optuna.study.study - INFO - Trial 160 finished with values: [0.00864705374103219, 0.0015573715587112332, 0.004944108124955936] and parameters: {'n_layers': 3, 'embedding_dim': 256, 'lr': 0.000710331438856921, 'lambda_val': 5.609342222844582e-06, 'batch_size': 2574, 'optimizer': 'RMSprop'}.
2026-06-03 21:21:38,528 - experiment_functions - INFO - Early stopping at epoch 850. Best Metrics: (0.007621991119843728, 0.0012894366668899458, 0.0043844993669350145)
2026-06-03 21:21:39,218 - optuna.study.study - INFO - Trial 161 finished with values: [0.007621991119843728, 0.0012894366668899458, 0.0043844993669350145] and parameters: {'n_layers': 3, 'embedding_dim': 32, 'lr': 0.0027608560004649, 'lambda_val': 0.00047268866494377303, 'batch_size': 1308, 'optimizer': 'Adam'}.
2026-06-03 21:22:39,907 - experiment_functions - INFO - Early stopping at epoch 1600. Best Metrics: (0.008794187460984315, 0.0015037845803469755, 0.005121772476870591)
2026-06-03 21:22:40,953 - optuna.study.study - INFO - Trial 162 finished with values: [0.008794187460984315, 0.0015037845803469755, 0.005121772476870591] and parameters: {'n_layers': 2, 'embedding_dim': 32, 'lr': 0.002060594231766347, 'lambda_val': 0.00021888803225104277, 'batch_size': 790, 'optimizer': 'RMSprop'}.
2026-06-03 21:24:14,860 - experiment_functions - INFO - Early stopping at epoch 2450. Best Metrics: (0.0050921460728076086, 0.0008506932815325876, 0.003043311170120672)
2026-06-03 21:24:14,992 - optuna.study.study - INFO - Trial 163 finished with values: [0.0050921460728076086, 0.0008506932815325876, 0.003043311170120672] and parameters: {'n_layers': 1, 'embedding_dim': 96, 'lr': 0.0015683866974798046, 'lambda_val': 2.393431434886667e-06, 'batch_size': 2127, 'optimizer': 'Adam'}.
2026-06-03 21:25:12,021 - experiment_functions - INFO - Early stopping at epoch 1150. Best Metrics: (0.008432467912404706, 0.0014920624288297945, 0.004662366854629235)
2026-06-03 21:25:12,574 - optuna.study.study - INFO - Trial 164 finished with values: [0.008432467912404706, 0.0014920624288297945, 0.004662366854629235] and parameters: {'n_layers': 3, 'embedding_dim': 256, 'lr': 0.0027608560004649, 'lambda_val': 2.468073181110974e-06, 'batch_size': 513, 'optimizer': 'RMSprop'}.
2026-06-03 21:25:36,916 - experiment_functions - INFO - Early stopping at epoch 550. Best Metrics: (0.004237198566199388, 0.0007451939178779556, 0.0024326344286623035)
2026-06-03 21:25:37,065 - optuna.study.study - INFO - Trial 165 finished with values: [0.004237198566199388, 0.0007451939178779556, 0.0024326344286623035] and parameters: {'n_layers': 4, 'embedding_dim': 64, 'lr': 0.011544828952739577, 'lambda_val': 0.026782624146144254, 'batch_size': 2127, 'optimizer': 'Adam'}.
2026-06-03 21:26:00,858 - experiment_functions - INFO - Early stopping at epoch 550. Best Metrics: (0.005842470508013037, 0.0009947082858865297, 0.0032450570218817637)
2026-06-03 21:26:00,968 - optuna.study.study - INFO - Trial 166 finished with values: [0.005842470508013037, 0.0009947082858865297, 0.0032450570218817637] and parameters: {'n_layers': 3, 'embedding_dim': 64, 'lr': 0.01921089424742082, 'lambda_val': 8.287870093807144e-05, 'batch_size': 1213, 'optimizer': 'Adam'}.
2026-06-03 21:28:39,933 - optuna.study.study - INFO - Trial 167 finished with values: [0.011510762595790527, 0.002007837095585773, 0.006815642245313959] and parameters: {'n_layers': 4, 'embedding_dim': 64, 'lr': 0.000710331438856921, 'lambda_val': 8.50693942128844e-06, 'batch_size': 836, 'optimizer': 'Adam'}.
2026-06-03 21:29:13,119 - experiment_functions - INFO - Early stopping at epoch 800. Best Metrics: (0.0059368219780239154, 0.0011102552079844598, 0.00331977150097061)
2026-06-03 21:29:13,277 - optuna.study.study - INFO - Trial 168 finished with values: [0.0059368219780239154, 0.0011102552079844598, 0.00331977150097061] and parameters: {'n_layers': 3, 'embedding_dim': 64, 'lr': 0.002060594231766347, 'lambda_val': 0.00896885007909695, 'batch_size': 1371, 'optimizer': 'Adam'}.
2026-06-03 21:31:40,982 - experiment_functions - INFO - Early stopping at epoch 3900. Best Metrics: (0.010138944174700048, 0.0017449259829861344, 0.006039505128140968)
2026-06-03 21:31:41,095 - optuna.study.study - INFO - Trial 169 finished with values: [0.010138944174700048, 0.0017449259829861344, 0.006039505128140968] and parameters: {'n_layers': 4, 'embedding_dim': 32, 'lr': 0.000710331438856921, 'lambda_val': 2.468073181110974e-06, 'batch_size': 2127, 'optimizer': 'Adam'}.
2026-06-03 21:33:32,464 - experiment_functions - INFO - Early stopping at epoch 2650. Best Metrics: (0.005263976517635989, 0.0008959072945274299, 0.002998970394081618)
2026-06-03 21:33:32,573 - optuna.study.study - INFO - Trial 170 finished with values: [0.005263976517635989, 0.0008959072945274299, 0.002998970394081618] and parameters: {'n_layers': 1, 'embedding_dim': 256, 'lr': 0.00280088767043512, 'lambda_val': 8.277965708883697e-06, 'batch_size': 1371, 'optimizer': 'Adam'}.
2026-06-03 21:34:13,559 - experiment_functions - INFO - Early stopping at epoch 1000. Best Metrics: (0.006516751946089136, 0.0010918346841717462, 0.0037456838945375596)
2026-06-03 21:34:13,804 - optuna.study.study - INFO - Trial 171 finished with values: [0.006516751946089136, 0.0010918346841717462, 0.0037456838945375596] and parameters: {'n_layers': 2, 'embedding_dim': 96, 'lr': 0.002060594231766347, 'lambda_val': 7.1791123088488e-06, 'batch_size': 2909, 'optimizer': 'RMSprop'}.
