2026-06-04 21:21:29,294 - optuna.study.study - INFO - Trial 246 finished with values: [0.00616156218180944, 0.0011052314287628106, 0.003539009553703778] and parameters: {'n_layers': 3, 'embedding_dim': 64, 'lr': 0.0032493879970223157, 'lambda_val': 0.00016806129938668377, 'batch_size': 3685, 'optimizer': 'Adam'}.
2026-06-04 21:22:02,107 - experiment_functions - INFO - Early stopping at epoch 750. Best Metrics: (0.008147985500344302, 0.001480340277312613, 0.004514105289345383)
2026-06-04 21:22:02,189 - optuna.study.study - INFO - Trial 247 finished with values: [0.008147985500344302, 0.001480340277312613, 0.004514105289345383] and parameters: {'n_layers': 4, 'embedding_dim': 96, 'lr': 0.0018624775153074351, 'lambda_val': 3.61928423516103e-05, 'batch_size': 3398, 'optimizer': 'RMSprop'}.
2026-06-04 21:22:25,422 - experiment_functions - INFO - Early stopping at epoch 550. Best Metrics: (0.006398721272212738, 0.0011437470694621206, 0.0037004127378485346)
2026-06-04 21:22:25,529 - optuna.study.study - INFO - Trial 248 finished with values: [0.006398721272212738, 0.0011437470694621206, 0.0037004127378485346] and parameters: {'n_layers': 4, 'embedding_dim': 64, 'lr': 0.004869110805383165, 'lambda_val': 3.61928423516103e-05, 'batch_size': 3507, 'optimizer': 'RMSprop'}.
2026-06-04 21:22:46,593 - experiment_functions - INFO - Early stopping at epoch 500. Best Metrics: (0.00035066766853804446, 5.526157143814054e-05, 0.00014588541155255894)
2026-06-04 21:22:46,686 - optuna.study.study - INFO - Trial 249 finished with values: [0.00035066766853804446, 5.526157143814054e-05, 0.00014588541155255894] and parameters: {'n_layers': 4, 'embedding_dim': 64, 'lr': 0.0018624775153074351, 'lambda_val': 3.61928423516103e-05, 'batch_size': 2344, 'optimizer': 'SGD'}.
2026-06-04 21:23:25,082 - experiment_functions - INFO - Early stopping at epoch 900. Best Metrics: (0.009497902142537602, 0.0016779422600308124, 0.005458477951259854)
2026-06-04 21:23:25,305 - optuna.study.study - INFO - Trial 250 finished with values: [0.009497902142537602, 0.0016779422600308124, 0.005458477951259854] and parameters: {'n_layers': 4, 'embedding_dim': 64, 'lr': 0.0038915436873682946, 'lambda_val': 1.6413472527343117e-06, 'batch_size': 516, 'optimizer': 'Adam'}.
2026-06-04 21:24:03,714 - experiment_functions - INFO - Early stopping at epoch 850. Best Metrics: (0.009285976949847502, 0.0016427758054792688, 0.005364255534073009)
2026-06-04 21:24:03,816 - optuna.study.study - INFO - Trial 251 finished with values: [0.009285976949847502, 0.0016427758054792688, 0.005364255534073009] and parameters: {'n_layers': 4, 'embedding_dim': 128, 'lr': 0.0011827350330377861, 'lambda_val': 3.61928423516103e-05, 'batch_size': 2831, 'optimizer': 'RMSprop'}.
2026-06-04 21:26:42,704 - experiment_functions - INFO - Early stopping at epoch 3150. Best Metrics: (0.010492930197044906, 0.0019324804072610358, 0.006098007520758862)
2026-06-04 21:26:42,814 - optuna.study.study - INFO - Trial 252 finished with values: [0.010492930197044906, 0.0019324804072610358, 0.006098007520758862] and parameters: {'n_layers': 4, 'embedding_dim': 256, 'lr': 0.00040769039157989535, 'lambda_val': 3.61928423516103e-05, 'batch_size': 2129, 'optimizer': 'RMSprop'}.
2026-06-04 21:27:42,525 - experiment_functions - INFO - Early stopping at epoch 1500. Best Metrics: (0.007846434733913464, 0.0014585705673521336, 0.004702144153763809)
2026-06-04 21:27:43,208 - optuna.study.study - INFO - Trial 253 finished with values: [0.007846434733913464, 0.0014585705673521336, 0.004702144153763809] and parameters: {'n_layers': 4, 'embedding_dim': 64, 'lr': 0.0007688676008588178, 'lambda_val': 0.00016262429302101681, 'batch_size': 3905, 'optimizer': 'Adam'}.
2026-06-04 21:28:08,667 - experiment_functions - INFO - Early stopping at epoch 600. Best Metrics: (0.007604565463114784, 0.0012860874807421796, 0.0042807304698113235)
2026-06-04 21:28:09,110 - optuna.study.study - INFO - Trial 254 finished with values: [0.007604565463114784, 0.0012860874807421796, 0.0042807304698113235] and parameters: {'n_layers': 4, 'embedding_dim': 64, 'lr': 0.0018624775153074351, 'lambda_val': 0.0024069962232057067, 'batch_size': 3398, 'optimizer': 'RMSprop'}.
2026-06-04 21:31:01,201 - optuna.study.study - INFO - Trial 255 finished with values: [0.009136519495859629, 0.0016210060955187892, 0.005446326565332394] and parameters: {'n_layers': 4, 'embedding_dim': 128, 'lr': 0.0003407757299446511, 'lambda_val': 1.9630585538121265e-06, 'batch_size': 1603, 'optimizer': 'Adam'}.
2026-06-04 21:31:27,449 - experiment_functions - INFO - Early stopping at epoch 650. Best Metrics: (0.0034580016607187315, 0.000577734610489651, 0.0018696854119817062)
2026-06-04 21:31:27,567 - optuna.study.study - INFO - Trial 256 finished with values: [0.0034580016607187315, 0.000577734610489651, 0.0018696854119817062] and parameters: {'n_layers': 2, 'embedding_dim': 64, 'lr': 0.04222040234033127, 'lambda_val': 3.61928423516103e-05, 'batch_size': 791, 'optimizer': 'RMSprop'}.
2026-06-04 21:31:49,122 - experiment_functions - INFO - Early stopping at epoch 500. Best Metrics: (0.000554425128097813, 7.87058744725032e-05, 0.0002412760191030971)
2026-06-04 21:31:50,038 - optuna.study.study - INFO - Trial 257 finished with values: [0.000554425128097813, 7.87058744725032e-05, 0.0002412760191030971] and parameters: {'n_layers': 3, 'embedding_dim': 64, 'lr': 0.0010341842506299342, 'lambda_val': 2.530036395071033e-06, 'batch_size': 2129, 'optimizer': 'SGD'}.
2026-06-04 21:32:18,499 - experiment_functions - INFO - Early stopping at epoch 550. Best Metrics: (0.005232537246129811, 0.0008439949092370555, 0.002937985440361181)
2026-06-04 21:32:18,616 - optuna.study.study - INFO - Trial 258 finished with values: [0.005232537246129811, 0.0008439949092370555, 0.002937985440361181] and parameters: {'n_layers': 3, 'embedding_dim': 256, 'lr': 0.03048022245648937, 'lambda_val': 2.344534953461632e-06, 'batch_size': 2129, 'optimizer': 'RMSprop'}.
2026-06-04 21:33:03,688 - experiment_functions - INFO - Early stopping at epoch 850. Best Metrics: (0.0075435277842608615, 0.0013480474244758525, 0.004051178083488514)
2026-06-04 21:33:03,799 - optuna.study.study - INFO - Trial 259 finished with values: [0.0075435277842608615, 0.0013480474244758525, 0.004051178083488514] and parameters: {'n_layers': 4, 'embedding_dim': 256, 'lr': 0.003777254071001523, 'lambda_val': 4.1287110163929275e-05, 'batch_size': 516, 'optimizer': 'RMSprop'}.
2026-06-04 21:33:53,496 - experiment_functions - INFO - Early stopping at epoch 950. Best Metrics: (0.009808270869138798, 0.0017231562730256548, 0.005310676201810034)
2026-06-04 21:33:53,731 - optuna.study.study - INFO - Trial 260 finished with values: [0.009808270869138798, 0.0017231562730256548, 0.005310676201810034] and parameters: {'n_layers': 4, 'embedding_dim': 256, 'lr': 0.0011827350330377861, 'lambda_val': 3.61928423516103e-05, 'batch_size': 1621, 'optimizer': 'RMSprop'}.
2026-06-04 21:34:44,488 - experiment_functions - INFO - Early stopping at epoch 1200. Best Metrics: (0.007470851758580375, 0.001299484225333244, 0.004462056364000085)
2026-06-04 21:34:44,580 - optuna.study.study - INFO - Trial 261 finished with values: [0.007470851758580375, 0.001299484225333244, 0.004462056364000085] and parameters: {'n_layers': 2, 'embedding_dim': 64, 'lr': 0.0018402169651938755, 'lambda_val': 1.6413472527343117e-06, 'batch_size': 1621, 'optimizer': 'RMSprop'}.
2026-06-04 21:35:14,370 - experiment_functions - INFO - Early stopping at epoch 550. Best Metrics: (0.006952993049676909, 0.0012793891084466474, 0.004025472920021218)
2026-06-04 21:35:14,501 - optuna.study.study - INFO - Trial 262 finished with values: [0.006952993049676909, 0.0012793891084466474, 0.004025472920021218] and parameters: {'n_layers': 4, 'embedding_dim': 256, 'lr': 0.003703846159128376, 'lambda_val': 1.926507025411557e-06, 'batch_size': 3823, 'optimizer': 'RMSprop'}.
2026-06-04 21:38:38,940 - optuna.study.study - INFO - Trial 263 finished with values: [0.00840311192229875, 0.0015975617924844266, 0.004776084803819449] and parameters: {'n_layers': 4, 'embedding_dim': 256, 'lr': 0.00040769039157989535, 'lambda_val': 2.344534953461632e-06, 'batch_size': 2129, 'optimizer': 'Adam'}.
2026-06-04 21:40:44,856 - experiment_functions - INFO - Early stopping at epoch 3250. Best Metrics: (0.008021975533649021, 0.0014635943465737828, 0.0047191471513868795)
2026-06-04 21:40:45,886 - optuna.study.study - INFO - Trial 264 finished with values: [0.008021975533649021, 0.0014635943465737828, 0.0047191471513868795] and parameters: {'n_layers': 3, 'embedding_dim': 64, 'lr': 0.0007688676008588178, 'lambda_val': 5.981576370506789e-06, 'batch_size': 2129, 'optimizer': 'Adam'}.
2026-06-04 21:41:20,830 - experiment_functions - INFO - Early stopping at epoch 800. Best Metrics: (0.008200089240347338, 0.0015389510348985198, 0.004749166984669002)
2026-06-04 21:41:21,493 - optuna.study.study - INFO - Trial 265 finished with values: [0.008200089240347338, 0.0015389510348985198, 0.004749166984669002] and parameters: {'n_layers': 4, 'embedding_dim': 96, 'lr': 0.003777254071001523, 'lambda_val': 0.0003075755804949793, 'batch_size': 791, 'optimizer': 'Adam'}.
2026-06-04 21:41:56,268 - experiment_functions - INFO - Early stopping at epoch 750. Best Metrics: (0.00861123853740908, 0.0015908634201888944, 0.004881235697051124)
2026-06-04 21:41:56,382 - optuna.study.study - INFO - Trial 266 finished with values: [0.00861123853740908, 0.0015908634201888944, 0.004881235697051124] and parameters: {'n_layers': 4, 'embedding_dim': 128, 'lr': 0.0038915436873682946, 'lambda_val': 2.344534953461632e-06, 'batch_size': 791, 'optimizer': 'Adam'}.
2026-06-04 21:42:32,515 - experiment_functions - INFO - Early stopping at epoch 800. Best Metrics: (0.007553737066720313, 0.0013899122513229285, 0.004384743523399782)
2026-06-04 21:42:32,588 - optuna.study.study - INFO - Trial 267 finished with values: [0.007553737066720313, 0.0013899122513229285, 0.004384743523399782] and parameters: {'n_layers': 3, 'embedding_dim': 128, 'lr': 0.0038915436873682946, 'lambda_val': 2.344534953461632e-06, 'batch_size': 1621, 'optimizer': 'Adam'}.
2026-06-04 21:43:42,255 - experiment_functions - INFO - Early stopping at epoch 1650. Best Metrics: (0.00813252589625975, 0.0014334516712438878, 0.0047286495804871355)
2026-06-04 21:43:42,351 - optuna.study.study - INFO - Trial 268 finished with values: [0.00813252589625975, 0.0014334516712438878, 0.0047286495804871355] and parameters: {'n_layers': 4, 'embedding_dim': 96, 'lr': 0.0007307808528773397, 'lambda_val': 1.6413472527343117e-06, 'batch_size': 3282, 'optimizer': 'Adam'}.
2026-06-04 21:46:20,502 - optuna.study.study - INFO - Trial 269 finished with values: [0.014668515140267317, 0.0026073414160359036, 0.008963647031816378] and parameters: {'n_layers': 4, 'embedding_dim': 64, 'lr': 0.0007307808528773397, 'lambda_val': 1.6413472527343117e-06, 'batch_size': 791, 'optimizer': 'RMSprop'}.
2026-06-04 21:46:49,290 - experiment_functions - INFO - Early stopping at epoch 650. Best Metrics: (0.005432475182984095, 0.0010164779958470092, 0.003126543020081619)
2026-06-04 21:46:49,383 - optuna.study.study - INFO - Trial 270 finished with values: [0.005432475182984095, 0.0010164779958470092, 0.003126543020081619] and parameters: {'n_layers': 4, 'embedding_dim': 96, 'lr': 0.0038915436873682946, 'lambda_val': 0.009212039905753745, 'batch_size': 791, 'optimizer': 'Adam'}.
2026-06-04 21:47:47,176 - experiment_functions - INFO - Early stopping at epoch 1300. Best Metrics: (0.007253590791364515, 0.0013899122513229285, 0.004159136772029831)
2026-06-04 21:47:47,289 - optuna.study.study - INFO - Trial 271 finished with values: [0.007253590791364515, 0.0013899122513229285, 0.004159136772029831] and parameters: {'n_layers': 4, 'embedding_dim': 128, 'lr': 0.0007307808528773397, 'lambda_val': 0.004674800033144226, 'batch_size': 1621, 'optimizer': 'Adam'}.
2026-06-04 21:48:36,935 - experiment_functions - INFO - Early stopping at epoch 1100. Best Metrics: (0.010032847066814779, 0.0018721950566012462, 0.005830629755619536)
2026-06-04 21:48:37,018 - optuna.study.study - INFO - Trial 272 finished with values: [0.010032847066814779, 0.0018721950566012462, 0.005830629755619536] and parameters: {'n_layers': 4, 'embedding_dim': 128, 'lr': 0.0011827350330377861, 'lambda_val': 0.0001340628727271744, 'batch_size': 1421, 'optimizer': 'RMSprop'}.
2026-06-04 21:50:43,133 - experiment_functions - INFO - Early stopping at epoch 2600. Best Metrics: (0.00883511823420154, 0.0015908634201888942, 0.005102661894148649)
2026-06-04 21:50:43,459 - optuna.study.study - INFO - Trial 273 finished with values: [0.00883511823420154, 0.0015908634201888942, 0.005102661894148649] and parameters: {'n_layers': 3, 'embedding_dim': 256, 'lr': 0.00040769039157989535, 'lambda_val': 3.61928423516103e-05, 'batch_size': 3398, 'optimizer': 'RMSprop'}.
2026-06-04 21:53:42,878 - optuna.study.study - INFO - Trial 274 finished with values: [0.00681726024086962, 0.0012375242815995714, 0.003937076949729356] and parameters: {'n_layers': 2, 'embedding_dim': 256, 'lr': 0.001108829236690452, 'lambda_val': 0.00016262429302101681, 'batch_size': 719, 'optimizer': 'Adam'}.
2026-06-04 21:55:01,860 - experiment_functions - INFO - Early stopping at epoch 2000. Best Metrics: (0.005508777772291976, 0.0010583428226940855, 0.003029213685374992)
2026-06-04 21:55:01,949 - optuna.study.study - INFO - Trial 275 finished with values: [0.005508777772291976, 0.0010583428226940855, 0.003029213685374992] and parameters: {'n_layers': 4, 'embedding_dim': 64, 'lr': 0.0007307808528773397, 'lambda_val': 0.0253888520716478, 'batch_size': 516, 'optimizer': 'RMSprop'}.
2026-06-04 21:55:57,743 - experiment_functions - INFO - Early stopping at epoch 1250. Best Metrics: (0.007982183854504218, 0.0014635943465737824, 0.004634241084557392)
2026-06-04 21:55:57,842 - optuna.study.study - INFO - Trial 276 finished with values: [0.007982183854504218, 0.0014635943465737824, 0.004634241084557392] and parameters: {'n_layers': 4, 'embedding_dim': 128, 'lr': 0.0007307808528773397, 'lambda_val': 0.00016262429302101681, 'batch_size': 3398, 'optimizer': 'Adam'}.
2026-06-04 21:56:42,608 - experiment_functions - INFO - Early stopping at epoch 1100. Best Metrics: (0.005708902204353985, 0.0010365731127336057, 0.0031998789955698225)
2026-06-04 21:56:42,725 - optuna.study.study - INFO - Trial 277 finished with values: [0.005708902204353985, 0.0010365731127336057, 0.0031998789955698225] and parameters: {'n_layers': 4, 'embedding_dim': 64, 'lr': 0.0007307808528773397, 'lambda_val': 0.021321891681736115, 'batch_size': 2067, 'optimizer': 'Adam'}.
2026-06-04 21:57:38,106 - experiment_functions - INFO - Early stopping at epoch 1050. Best Metrics: (0.009858238386824493, 0.0017767432513899123, 0.005463662173253494)
2026-06-04 21:57:38,189 - optuna.study.study - INFO - Trial 278 finished with values: [0.009858238386824493, 0.0017767432513899123, 0.005463662173253494] and parameters: {'n_layers': 4, 'embedding_dim': 256, 'lr': 0.0007688676008588178, 'lambda_val': 3.8631777865125085e-06, 'batch_size': 2193, 'optimizer': 'RMSprop'}.
2026-06-04 21:59:49,594 - experiment_functions - INFO - Early stopping at epoch 3400. Best Metrics: (0.011395824219457307, 0.0019509009310737491, 0.006780048771444612)
2026-06-04 21:59:50,089 - optuna.study.study - INFO - Trial 279 finished with values: [0.011395824219457307, 0.0019509009310737491, 0.006780048771444612] and parameters: {'n_layers': 3, 'embedding_dim': 64, 'lr': 0.0007307808528773397, 'lambda_val': 8.758320188573612e-06, 'batch_size': 1336, 'optimizer': 'RMSprop'}.
2026-06-04 22:00:11,484 - experiment_functions - INFO - Early stopping at epoch 500. Best Metrics: (0.0003256778274006363, 6.86583160292049e-05, 0.00016326402320145168)
2026-06-04 22:00:12,148 - optuna.study.study - INFO - Trial 280 finished with values: [0.0003256778274006363, 6.86583160292049e-05, 0.00016326402320145168] and parameters: {'n_layers': 3, 'embedding_dim': 64, 'lr': 0.0018624775153074351, 'lambda_val': 3.61928423516103e-05, 'batch_size': 2129, 'optimizer': 'SGD'}.
2026-06-04 22:02:42,960 - optuna.study.study - INFO - Trial 281 finished with values: [0.0043937075946258765, 0.0006363453680755576, 0.0023539673569583004] and parameters: {'n_layers': 1, 'embedding_dim': 96, 'lr': 0.0005305581261546907, 'lambda_val': 0.00019141549058738962, 'batch_size': 1336, 'optimizer': 'Adam'}.
2026-06-04 22:03:38,546 - experiment_functions - INFO - Early stopping at epoch 1300. Best Metrics: (0.012183866551971513, 0.002156875879161364, 0.007084441027636056)
2026-06-04 22:03:38,635 - optuna.study.study - INFO - Trial 282 finished with values: [0.012183866551971513, 0.002156875879161364, 0.007084441027636056] and parameters: {'n_layers': 4, 'embedding_dim': 96, 'lr': 0.0010341842506299342, 'lambda_val': 3.61928423516103e-05, 'batch_size': 1233, 'optimizer': 'RMSprop'}.
2026-06-04 22:06:08,022 - optuna.study.study - INFO - Trial 283 finished with values: [0.0029177685176225627, 0.000433719606135709, 0.0016860306279375856] and parameters: {'n_layers': 4, 'embedding_dim': 32, 'lr': 0.0001687609464039229, 'lambda_val': 2.344534953461632e-06, 'batch_size': 3543, 'optimizer': 'RMSprop'}.
2026-06-04 22:06:56,974 - experiment_functions - INFO - Early stopping at epoch 1200. Best Metrics: (0.01288879304995092, 0.0023042400696630717, 0.007903755803315595)
2026-06-04 22:06:57,117 - optuna.study.study - INFO - Trial 284 finished with values: [0.01288879304995092, 0.0023042400696630717, 0.007903755803315595] and parameters: {'n_layers': 4, 'embedding_dim': 64, 'lr': 0.0018624775153074351, 'lambda_val': 3.61928423516103e-05, 'batch_size': 791, 'optimizer': 'RMSprop'}.
2026-06-04 22:09:33,450 - optuna.study.study - INFO - Trial 285 finished with values: [0.010288471904655016, 0.0018520999397146495, 0.006209496216659934] and parameters: {'n_layers': 4, 'embedding_dim': 64, 'lr': 0.00040769039157989535, 'lambda_val': 3.8631777865125085e-06, 'batch_size': 2834, 'optimizer': 'RMSprop'}.
2026-06-04 22:09:55,917 - experiment_functions - INFO - Early stopping at epoch 550. Best Metrics: (0.004207260484114124, 0.0006932815325875812, 0.00249912624061451)
2026-06-04 22:09:56,010 - optuna.study.study - INFO - Trial 286 finished with values: [0.004207260484114124, 0.0006932815325875812, 0.00249912624061451] and parameters: {'n_layers': 3, 'embedding_dim': 64, 'lr': 0.07311338681214223, 'lambda_val': 3.61928423516103e-05, 'batch_size': 1336, 'optimizer': 'Adam'}.
2026-06-04 22:12:32,458 - optuna.study.study - INFO - Trial 287 finished with values: [0.012609429005884404, 0.0022171612298211535, 0.007607538709131624] and parameters: {'n_layers': 4, 'embedding_dim': 64, 'lr': 0.0008554671082016039, 'lambda_val': 1.6413472527343117e-06, 'batch_size': 791, 'optimizer': 'Adam'}.
2026-06-04 22:15:42,946 - optuna.study.study - INFO - Trial 288 finished with values: [0.008154600164382573, 0.0013915868443968116, 0.004633592629476854] and parameters: {'n_layers': 3, 'embedding_dim': 256, 'lr': 0.00040769039157989535, 'lambda_val': 3.8631777865125085e-06, 'batch_size': 1727, 'optimizer': 'Adam'}.
2026-06-04 22:16:38,497 - experiment_functions - INFO - Early stopping at epoch 1050. Best Metrics: (0.008924288858558465, 0.001622680688592672, 0.004929580895688237)
2026-06-04 22:16:38,914 - optuna.study.study - INFO - Trial 289 finished with values: [0.008924288858558465, 0.001622680688592672, 0.004929580895688237] and parameters: {'n_layers': 4, 'embedding_dim': 256, 'lr': 0.0011827350330377861, 'lambda_val': 3.8631777865125085e-06, 'batch_size': 1621, 'optimizer': 'Adam'}.
2026-06-04 22:17:19,149 - experiment_functions - INFO - Early stopping at epoch 1000. Best Metrics: (0.007177595681899587, 0.00122580213008239, 0.004051442973375188)
2026-06-04 22:17:19,268 - optuna.study.study - INFO - Trial 290 finished with values: [0.007177595681899587, 0.00122580213008239, 0.004051442973375188] and parameters: {'n_layers': 2, 'embedding_dim': 96, 'lr': 0.0018624775153074351, 'lambda_val': 0.00016262429302101681, 'batch_size': 2193, 'optimizer': 'RMSprop'}.
2026-06-04 22:17:56,228 - experiment_functions - INFO - Early stopping at epoch 950. Best Metrics: (0.00838606480496214, 0.0014954116149775605, 0.004888458095022754)
2026-06-04 22:17:56,318 - optuna.study.study - INFO - Trial 291 finished with values: [0.00838606480496214, 0.0014954116149775605, 0.004888458095022754] and parameters: {'n_layers': 4, 'embedding_dim': 32, 'lr': 0.0018624775153074351, 'lambda_val': 3.61928423516103e-05, 'batch_size': 3543, 'optimizer': 'RMSprop'}.
2026-06-04 22:18:30,526 - experiment_functions - INFO - Early stopping at epoch 750. Best Metrics: (0.008605021089717267, 0.0015590461517851163, 0.004962546046725142)
2026-06-04 22:18:30,685 - optuna.study.study - INFO - Trial 292 finished with values: [0.008605021089717267, 0.0015590461517851163, 0.004962546046725142] and parameters: {'n_layers': 4, 'embedding_dim': 128, 'lr': 0.003777254071001523, 'lambda_val': 3.61928423516103e-05, 'batch_size': 791, 'optimizer': 'Adam'}.
2026-06-04 22:21:03,038 - optuna.study.study - INFO - Trial 293 finished with values: [0.006390608119119289, 0.0010516444503985533, 0.0038751296234136594] and parameters: {'n_layers': 3, 'embedding_dim': 64, 'lr': 0.00032425072521192837, 'lambda_val': 0.004334286284733242, 'batch_size': 2129, 'optimizer': 'RMSprop'}.
2026-06-04 22:22:26,629 - experiment_functions - INFO - Early stopping at epoch 2100. Best Metrics: (0.010428979504944636, 0.0018989885457833748, 0.005886939483394901)
