2026-06-04 16:24:43,834 - optuna.study.study - INFO - Trial 265 finished with values: [0.009096103666557156, 0.0016528233639225669, 0.00531973507418415] and parameters: {'n_layers': 4, 'embedding_dim': 128, 'lr': 0.0005268211601481077, 'lambda_val': 7.359862236281652e-06, 'batch_size': 2347, 'optimizer': 'Adam'}.
2026-06-04 16:25:10,848 - experiment_functions - INFO - Early stopping at epoch 700. Best Metrics: (0.004926596450055807, 0.0008172014200549268, 0.0028830044944365423)
2026-06-04 16:25:11,139 - optuna.study.study - INFO - Trial 266 finished with values: [0.004926596450055807, 0.0008172014200549268, 0.0028830044944365423] and parameters: {'n_layers': 2, 'embedding_dim': 32, 'lr': 0.006097730317148143, 'lambda_val': 1.7844039295042361e-06, 'batch_size': 1368, 'optimizer': 'Adam'}.
2026-06-04 16:25:43,287 - experiment_functions - INFO - Early stopping at epoch 700. Best Metrics: (0.008290034370585985, 0.0015054591734208586, 0.004610738552153735)
2026-06-04 16:25:44,564 - optuna.study.study - INFO - Trial 267 finished with values: [0.008290034370585985, 0.0015054591734208586, 0.004610738552153735] and parameters: {'n_layers': 4, 'embedding_dim': 128, 'lr': 0.0017568753093311267, 'lambda_val': 1.8898212223948182e-06, 'batch_size': 3688, 'optimizer': 'RMSprop'}.
2026-06-04 16:26:32,679 - experiment_functions - INFO - Early stopping at epoch 900. Best Metrics: (0.008089891299350801, 0.0015171813249380403, 0.004574461535009759)
2026-06-04 16:26:32,902 - optuna.study.study - INFO - Trial 268 finished with values: [0.008089891299350801, 0.0015171813249380403, 0.004574461535009759] and parameters: {'n_layers': 4, 'embedding_dim': 256, 'lr': 0.0014181685787657509, 'lambda_val': 5.6413681092531065e-05, 'batch_size': 1826, 'optimizer': 'Adam'}.
2026-06-04 16:27:15,803 - experiment_functions - INFO - Early stopping at epoch 800. Best Metrics: (0.008251890420488208, 0.0015054591734208588, 0.0046907214909550285)
2026-06-04 16:27:15,993 - optuna.study.study - INFO - Trial 269 finished with values: [0.008251890420488208, 0.0015054591734208588, 0.0046907214909550285] and parameters: {'n_layers': 4, 'embedding_dim': 256, 'lr': 0.0017568753093311267, 'lambda_val': 5.016933039935782e-06, 'batch_size': 2438, 'optimizer': 'Adam'}.
2026-06-04 16:28:08,901 - experiment_functions - INFO - Early stopping at epoch 1000. Best Metrics: (0.008853147743846683, 0.0015875142340411282, 0.005057359300926214)
2026-06-04 16:28:09,146 - optuna.study.study - INFO - Trial 270 finished with values: [0.008853147743846683, 0.0015875142340411282, 0.005057359300926214] and parameters: {'n_layers': 4, 'embedding_dim': 256, 'lr': 0.0014181685787657509, 'lambda_val': 2.179922087788738e-05, 'batch_size': 903, 'optimizer': 'Adam'}.
2026-06-04 16:28:33,817 - experiment_functions - INFO - Early stopping at epoch 600. Best Metrics: (0.006242830865660912, 0.0011320249179449394, 0.0037118807390079736)
2026-06-04 16:28:33,900 - optuna.study.study - INFO - Trial 271 finished with values: [0.006242830865660912, 0.0011320249179449394, 0.0037118807390079736] and parameters: {'n_layers': 4, 'embedding_dim': 32, 'lr': 0.006097730317148143, 'lambda_val': 5.6413681092531065e-05, 'batch_size': 2922, 'optimizer': 'Adam'}.
2026-06-04 16:29:39,630 - experiment_functions - INFO - Early stopping at epoch 1250. Best Metrics: (0.009049632155409937, 0.0016628709223658652, 0.005172478809800472)
2026-06-04 16:29:39,719 - optuna.study.study - INFO - Trial 272 finished with values: [0.009049632155409937, 0.0016628709223658652, 0.005172478809800472] and parameters: {'n_layers': 4, 'embedding_dim': 256, 'lr': 0.0014181685787657509, 'lambda_val': 2.179922087788738e-05, 'batch_size': 739, 'optimizer': 'Adam'}.
2026-06-04 16:30:25,208 - experiment_functions - INFO - Early stopping at epoch 850. Best Metrics: (0.008356157450416875, 0.0015389510348985198, 0.004729057667741947)
2026-06-04 16:30:25,536 - optuna.study.study - INFO - Trial 273 finished with values: [0.008356157450416875, 0.0015389510348985198, 0.004729057667741947] and parameters: {'n_layers': 4, 'embedding_dim': 256, 'lr': 0.0008527206735717898, 'lambda_val': 5.016933039935782e-06, 'batch_size': 3919, 'optimizer': 'RMSprop'}.
2026-06-04 16:31:02,265 - experiment_functions - INFO - Early stopping at epoch 800. Best Metrics: (0.008247207216826744, 0.0015021099872730927, 0.004708810730346685)
2026-06-04 16:31:02,375 - optuna.study.study - INFO - Trial 274 finished with values: [0.008247207216826744, 0.0015021099872730927, 0.004708810730346685] and parameters: {'n_layers': 4, 'embedding_dim': 128, 'lr': 0.0017568753093311267, 'lambda_val': 0.00026218929558311914, 'batch_size': 2438, 'optimizer': 'Adam'}.
2026-06-04 16:31:55,003 - experiment_functions - INFO - Early stopping at epoch 1350. Best Metrics: (0.009528173793842305, 0.001686315225400228, 0.00559724590408655)
2026-06-04 16:31:55,087 - optuna.study.study - INFO - Trial 275 finished with values: [0.009528173793842305, 0.001686315225400228, 0.00559724590408655] and parameters: {'n_layers': 4, 'embedding_dim': 32, 'lr': 0.0014181685787657509, 'lambda_val': 7.298258738590182e-06, 'batch_size': 2534, 'optimizer': 'RMSprop'}.
2026-06-04 16:32:55,443 - experiment_functions - INFO - Early stopping at epoch 1150. Best Metrics: (0.009394859041679207, 0.0017499497622077834, 0.005301542783971256)
2026-06-04 16:32:56,127 - optuna.study.study - INFO - Trial 276 finished with values: [0.009394859041679207, 0.0017499497622077834, 0.005301542783971256] and parameters: {'n_layers': 4, 'embedding_dim': 256, 'lr': 0.0008527206735717898, 'lambda_val': 7.359862236281652e-06, 'batch_size': 2534, 'optimizer': 'RMSprop'}.
2026-06-04 16:33:31,637 - experiment_functions - INFO - Early stopping at epoch 650. Best Metrics: (0.007146966553877282, 0.0013128809699243088, 0.0040023281220610855)
2026-06-04 16:33:31,786 - optuna.study.study - INFO - Trial 277 finished with values: [0.007146966553877282, 0.0013128809699243088, 0.0040023281220610855] and parameters: {'n_layers': 4, 'embedding_dim': 256, 'lr': 0.006097730317148143, 'lambda_val': 4.5634838799137194e-05, 'batch_size': 822, 'optimizer': 'Adam'}.
2026-06-04 16:35:17,749 - experiment_functions - INFO - Early stopping at epoch 2900. Best Metrics: (0.0092229101271751, 0.0014602451604260169, 0.0053909984716961675)
2026-06-04 16:35:18,034 - optuna.study.study - INFO - Trial 278 finished with values: [0.0092229101271751, 0.0014602451604260169, 0.0053909984716961675] and parameters: {'n_layers': 2, 'embedding_dim': 32, 'lr': 0.0014181685787657509, 'lambda_val': 1.042789165609145e-06, 'batch_size': 739, 'optimizer': 'RMSprop'}.
2026-06-04 16:36:06,114 - experiment_functions - INFO - Early stopping at epoch 900. Best Metrics: (0.00866619875651974, 0.0016126331301493737, 0.004924251810402747)
2026-06-04 16:36:06,215 - optuna.study.study - INFO - Trial 279 finished with values: [0.00866619875651974, 0.0016126331301493737, 0.004924251810402747] and parameters: {'n_layers': 4, 'embedding_dim': 256, 'lr': 0.0017568753093311267, 'lambda_val': 1.8898212223948182e-06, 'batch_size': 739, 'optimizer': 'Adam'}.
2026-06-04 16:36:54,834 - experiment_functions - INFO - Early stopping at epoch 1200. Best Metrics: (0.00935919088288002, 0.0016997119699912924, 0.005454129946026767)
2026-06-04 16:36:54,929 - optuna.study.study - INFO - Trial 280 finished with values: [0.00935919088288002, 0.0016997119699912924, 0.005454129946026767] and parameters: {'n_layers': 4, 'embedding_dim': 64, 'lr': 0.0014181685787657509, 'lambda_val': 1.7844039295042361e-06, 'batch_size': 1368, 'optimizer': 'Adam'}.
2026-06-04 16:37:44,233 - experiment_functions - INFO - Early stopping at epoch 1150. Best Metrics: (0.008104697021011551, 0.0015423002210462858, 0.004689971751660835)
2026-06-04 16:37:44,316 - optuna.study.study - INFO - Trial 281 finished with values: [0.008104697021011551, 0.0015423002210462858, 0.004689971751660835] and parameters: {'n_layers': 4, 'embedding_dim': 96, 'lr': 0.0014181685787657509, 'lambda_val': 5.6413681092531065e-05, 'batch_size': 1826, 'optimizer': 'Adam'}.
2026-06-04 16:39:10,626 - experiment_functions - INFO - Early stopping at epoch 2200. Best Metrics: (0.007741453098210938, 0.0013430236452542032, 0.004656564991289123)
2026-06-04 16:39:10,754 - optuna.study.study - INFO - Trial 282 finished with values: [0.007741453098210938, 0.0013430236452542032, 0.004656564991289123] and parameters: {'n_layers': 2, 'embedding_dim': 96, 'lr': 0.0008527206735717898, 'lambda_val': 7.359862236281652e-06, 'batch_size': 2311, 'optimizer': 'RMSprop'}.
2026-06-04 16:40:35,484 - experiment_functions - INFO - Early stopping at epoch 2000. Best Metrics: (0.008802250146947802, 0.0015858396409672453, 0.005133606386317854)
2026-06-04 16:40:35,599 - optuna.study.study - INFO - Trial 283 finished with values: [0.008802250146947802, 0.0015858396409672453, 0.005133606386317854] and parameters: {'n_layers': 4, 'embedding_dim': 96, 'lr': 0.0005268211601481077, 'lambda_val': 7.627763072576621e-05, 'batch_size': 3509, 'optimizer': 'Adam'}.
2026-06-04 16:43:13,279 - optuna.study.study - INFO - Trial 284 finished with values: [0.011338163354675006, 0.0020212338401768373, 0.006755879259544534] and parameters: {'n_layers': 4, 'embedding_dim': 64, 'lr': 0.0005268211601481077, 'lambda_val': 7.359862236281652e-06, 'batch_size': 1826, 'optimizer': 'RMSprop'}.
2026-06-04 16:45:47,234 - optuna.study.study - INFO - Trial 285 finished with values: [0.01067917615230485, 0.0018320048228280528, 0.006127341958502322] and parameters: {'n_layers': 3, 'embedding_dim': 64, 'lr': 0.0008527206735717898, 'lambda_val': 7.359862236281652e-06, 'batch_size': 968, 'optimizer': 'Adam'}.
2026-06-04 16:46:52,889 - experiment_functions - INFO - Early stopping at epoch 1250. Best Metrics: (0.009352776450558247, 0.0016930135976957598, 0.005383504074153095)
2026-06-04 16:46:53,013 - optuna.study.study - INFO - Trial 286 finished with values: [0.009352776450558247, 0.0016930135976957598, 0.005383504074153095] and parameters: {'n_layers': 4, 'embedding_dim': 256, 'lr': 0.0014181685787657509, 'lambda_val': 5.016933039935782e-06, 'batch_size': 739, 'optimizer': 'Adam'}.
2026-06-04 16:47:44,943 - experiment_functions - INFO - Early stopping at epoch 1300. Best Metrics: (0.006635422194088001, 0.0011923102686047294, 0.00401353308585338)
2026-06-04 16:47:45,377 - optuna.study.study - INFO - Trial 287 finished with values: [0.006635422194088001, 0.0011923102686047294, 0.00401353308585338] and parameters: {'n_layers': 2, 'embedding_dim': 96, 'lr': 0.0014181685787657509, 'lambda_val': 7.298258738590182e-06, 'batch_size': 3337, 'optimizer': 'RMSprop'}.
2026-06-04 16:48:35,156 - experiment_functions - INFO - Early stopping at epoch 1300. Best Metrics: (0.00893790868514032, 0.0015556969656373499, 0.005055363729967107)
2026-06-04 16:48:35,243 - optuna.study.study - INFO - Trial 288 finished with values: [0.00893790868514032, 0.0015556969656373499, 0.005055363729967107] and parameters: {'n_layers': 4, 'embedding_dim': 32, 'lr': 0.0014181685787657509, 'lambda_val': 0.0029474529646761295, 'batch_size': 739, 'optimizer': 'Adam'}.
2026-06-04 16:50:39,416 - experiment_functions - INFO - Early stopping at epoch 2850. Best Metrics: (0.009420206092985547, 0.0017683702860204972, 0.005668868825075838)
2026-06-04 16:50:39,530 - optuna.study.study - INFO - Trial 289 finished with values: [0.009420206092985547, 0.0017683702860204972, 0.005668868825075838] and parameters: {'n_layers': 4, 'embedding_dim': 128, 'lr': 0.0005268211601481077, 'lambda_val': 0.00026218929558311914, 'batch_size': 1468, 'optimizer': 'Adam'}.
2026-06-04 16:52:10,921 - experiment_functions - INFO - Early stopping at epoch 2350. Best Metrics: (0.008426011862538942, 0.0015037845803469755, 0.004944571776042034)
2026-06-04 16:52:11,195 - optuna.study.study - INFO - Trial 290 finished with values: [0.008426011862538942, 0.0015037845803469755, 0.004944571776042034] and parameters: {'n_layers': 3, 'embedding_dim': 64, 'lr': 0.0008527206735717898, 'lambda_val': 4.44825161724569e-05, 'batch_size': 2127, 'optimizer': 'Adam'}.
2026-06-04 16:53:01,824 - experiment_functions - INFO - Early stopping at epoch 1250. Best Metrics: (0.009679214788741305, 0.001724830866099538, 0.0058685455595969375)
2026-06-04 16:53:02,116 - optuna.study.study - INFO - Trial 291 finished with values: [0.009679214788741305, 0.001724830866099538, 0.0058685455595969375] and parameters: {'n_layers': 4, 'embedding_dim': 64, 'lr': 0.0014181685787657509, 'lambda_val': 1.7844039295042361e-06, 'batch_size': 1368, 'optimizer': 'Adam'}.
2026-06-04 16:55:32,831 - optuna.study.study - INFO - Trial 292 finished with values: [0.008679907111277214, 0.001366467948288566, 0.005356850778448244] and parameters: {'n_layers': 4, 'embedding_dim': 32, 'lr': 0.0004090776901902334, 'lambda_val': 0.000468743986180307, 'batch_size': 1825, 'optimizer': 'Adam'}.
2026-06-04 16:56:10,514 - experiment_functions - INFO - Early stopping at epoch 700. Best Metrics: (0.008241862283493558, 0.0015724428963761806, 0.0047025912094602485)
2026-06-04 16:56:10,596 - optuna.study.study - INFO - Trial 293 finished with values: [0.008241862283493558, 0.0015724428963761806, 0.0047025912094602485] and parameters: {'n_layers': 4, 'embedding_dim': 256, 'lr': 0.0014181685787657509, 'lambda_val': 0.0003532268196548331, 'batch_size': 1826, 'optimizer': 'RMSprop'}.
2026-06-04 16:57:15,123 - experiment_functions - INFO - Early stopping at epoch 1600. Best Metrics: (0.010711691478559679, 0.00198439279255141, 0.0063441746036849425)
2026-06-04 16:57:15,265 - optuna.study.study - INFO - Trial 294 finished with values: [0.010711691478559679, 0.00198439279255141, 0.0063441746036849425] and parameters: {'n_layers': 4, 'embedding_dim': 64, 'lr': 0.0014181685787657509, 'lambda_val': 7.359862236281652e-06, 'batch_size': 739, 'optimizer': 'Adam'}.
2026-06-04 16:57:59,078 - experiment_functions - INFO - Early stopping at epoch 800. Best Metrics: (0.004755985774406486, 0.0008992564806751961, 0.002724441265432716)
2026-06-04 16:57:59,153 - optuna.study.study - INFO - Trial 295 finished with values: [0.004755985774406486, 0.0008992564806751961, 0.002724441265432716] and parameters: {'n_layers': 4, 'embedding_dim': 256, 'lr': 0.0014181685787657509, 'lambda_val': 0.031643604808186336, 'batch_size': 739, 'optimizer': 'RMSprop'}.
2026-06-04 16:58:36,952 - experiment_functions - INFO - Early stopping at epoch 700. Best Metrics: (0.007398033618027673, 0.0013982852166923437, 0.004089095787151918)
2026-06-04 16:58:37,033 - optuna.study.study - INFO - Trial 296 finished with values: [0.007398033618027673, 0.0013982852166923437, 0.004089095787151918] and parameters: {'n_layers': 4, 'embedding_dim': 256, 'lr': 0.004480000793937752, 'lambda_val': 5.016933039935782e-06, 'batch_size': 796, 'optimizer': 'Adam'}.
2026-06-04 17:01:05,232 - optuna.study.study - INFO - Trial 297 finished with values: [0.0015936883680239876, 0.00024114140263915872, 0.0009048413548593914] and parameters: {'n_layers': 4, 'embedding_dim': 32, 'lr': 0.00011520780015014751, 'lambda_val': 1.8898212223948182e-06, 'batch_size': 3850, 'optimizer': 'Adam'}.
2026-06-04 17:02:14,044 - experiment_functions - INFO - Early stopping at epoch 1750. Best Metrics: (0.008642123104896145, 0.0014501976019827183, 0.004873621627319956)
2026-06-04 17:02:15,005 - optuna.study.study - INFO - Trial 298 finished with values: [0.008642123104896145, 0.0014501976019827183, 0.004873621627319956] and parameters: {'n_layers': 3, 'embedding_dim': 64, 'lr': 0.0008527206735717898, 'lambda_val': 7.359862236281652e-06, 'batch_size': 2516, 'optimizer': 'Adam'}.
2026-06-04 17:03:19,646 - experiment_functions - INFO - Early stopping at epoch 1150. Best Metrics: (0.008401639970686096, 0.0015556969656373503, 0.004674084659734503)
2026-06-04 17:03:20,446 - optuna.study.study - INFO - Trial 299 finished with values: [0.008401639970686096, 0.0015556969656373503, 0.004674084659734503] and parameters: {'n_layers': 4, 'embedding_dim': 256, 'lr': 0.0008527206735717898, 'lambda_val': 7.359862236281652e-06, 'batch_size': 2516, 'optimizer': 'Adam'}.
2026-06-04 17:03:20,462 - root - INFO - Selected Trial 241 based on Max ndcg: 0.0081
2026-06-04 17:03:20,462 - root - INFO - Associated Recall: 0.0133
2026-06-04 17:03:20,462 - experiment_functions - INFO - Training the best model ... for e_gowalla_1c1dcs_strict_rand4
2026-06-04 17:04:47,588 - experiment_functions - INFO - Early stopping at epoch 2100. Best Metrics: (0.012972616977378868, 0.002371223792618394, 0.007903633311401273)
2026-06-04 17:04:50,776 - root - INFO -   **** Training e_gowalla_1c1dcs_strict_rand5
2026-06-04 17:04:50,795 - root - INFO -   **** Getting 51651/845292 random edges
2026-06-04 17:04:50,900 - optuna.storages._rdb.storage - INFO - A new study created in RDB with name: Study_e_gowalla_1c1dcs_strict_rand5
2026-06-04 17:05:14,308 - experiment_functions - INFO - Early stopping at epoch 500. Best Metrics: (0.0005680111369216211, 6.028535065978968e-05, 0.00022897891955150372)
2026-06-04 17:05:14,395 - optuna.study.study - INFO - Trial 0 finished with values: [0.0005680111369216211, 6.028535065978968e-05, 0.00022897891955150372] and parameters: {'n_layers': 4, 'embedding_dim': 128, 'lr': 0.006462314028302632, 'lambda_val': 0.0007605182844680763, 'batch_size': 2026, 'optimizer': 'SGD'}.
2026-06-04 17:06:24,699 - experiment_functions - INFO - Early stopping at epoch 1550. Best Metrics: (0.004808517116885113, 0.0009193515975617926, 0.002773630908316616)
2026-06-04 17:06:25,043 - optuna.study.study - INFO - Trial 1 finished with values: [0.004808517116885113, 0.0009193515975617926, 0.002773630908316616] and parameters: {'n_layers': 2, 'embedding_dim': 256, 'lr': 0.0010341842506299342, 'lambda_val': 0.00612225365863352, 'batch_size': 550, 'optimizer': 'RMSprop'}.
2026-06-04 17:07:07,611 - experiment_functions - INFO - Early stopping at epoch 1050. Best Metrics: (0.004703695806157031, 0.0008506932815325875, 0.0027394413887339097)
2026-06-04 17:07:07,704 - optuna.study.study - INFO - Trial 2 finished with values: [0.004703695806157031, 0.0008506932815325875, 0.0027394413887339097] and parameters: {'n_layers': 2, 'embedding_dim': 96, 'lr': 0.015015785154943912, 'lambda_val': 1.0846976808752377e-06, 'batch_size': 1265, 'optimizer': 'Adam'}.
2026-06-04 17:07:31,742 - experiment_functions - INFO - Early stopping at epoch 550. Best Metrics: (0.0004740375146151082, 7.53566883247371e-05, 0.0002012983220980221)
2026-06-04 17:07:32,305 - optuna.study.study - INFO - Trial 3 finished with values: [0.0004740375146151082, 7.53566883247371e-05, 0.0002012983220980221] and parameters: {'n_layers': 2, 'embedding_dim': 128, 'lr': 2.046821949874292e-05, 'lambda_val': 2.009750581552559e-06, 'batch_size': 875, 'optimizer': 'RMSprop'}.
2026-06-04 17:07:54,795 - experiment_functions - INFO - Early stopping at epoch 500. Best Metrics: (0.0004736669772580546, 6.363453680755576e-05, 0.0002566753185375308)
2026-06-04 17:07:54,879 - optuna.study.study - INFO - Trial 4 finished with values: [0.0004736669772580546, 6.363453680755576e-05, 0.0002566753185375308] and parameters: {'n_layers': 1, 'embedding_dim': 256, 'lr': 7.766016728069523e-05, 'lambda_val': 0.049964201450354385, 'batch_size': 3662, 'optimizer': 'SGD'}.
2026-06-04 17:08:15,109 - experiment_functions - INFO - Early stopping at epoch 500. Best Metrics: (0.00044334700113360495, 7.703128139862015e-05, 0.0002284517076816275)
2026-06-04 17:08:15,275 - optuna.study.study - INFO - Trial 5 finished with values: [0.00044334700113360495, 7.703128139862015e-05, 0.0002284517076816275] and parameters: {'n_layers': 2, 'embedding_dim': 32, 'lr': 4.6913597055320246e-05, 'lambda_val': 0.047077054701502946, 'batch_size': 2073, 'optimizer': 'Adam'}.
2026-06-04 17:08:38,113 - experiment_functions - INFO - Early stopping at epoch 550. Best Metrics: (0.004289965422671741, 0.0006949561256614644, 0.0024212280323813516)
2026-06-04 17:08:38,202 - optuna.study.study - INFO - Trial 6 finished with values: [0.004289965422671741, 0.0006949561256614644, 0.0024212280323813516] and parameters: {'n_layers': 2, 'embedding_dim': 64, 'lr': 0.02101654654078168, 'lambda_val': 0.00045954191038052427, 'batch_size': 2296, 'optimizer': 'Adam'}.
2026-06-04 17:09:01,972 - experiment_functions - INFO - Early stopping at epoch 550. Best Metrics: (0.00484688628545322, 0.0007954317100944472, 0.002637974324957226)
2026-06-04 17:09:02,055 - optuna.study.study - INFO - Trial 7 finished with values: [0.00484688628545322, 0.0007954317100944472, 0.002637974324957226] and parameters: {'n_layers': 4, 'embedding_dim': 64, 'lr': 0.014970226258122101, 'lambda_val': 4.196870314530011e-06, 'batch_size': 3943, 'optimizer': 'RMSprop'}.
2026-06-04 17:09:26,830 - experiment_functions - INFO - Early stopping at epoch 550. Best Metrics: (0.0054118856964652925, 0.0009260499698573247, 0.0030975165169558816)
2026-06-04 17:09:27,365 - optuna.study.study - INFO - Trial 8 finished with values: [0.0054118856964652925, 0.0009260499698573247, 0.0030975165169558816] and parameters: {'n_layers': 4, 'embedding_dim': 96, 'lr': 0.045292257364849445, 'lambda_val': 5.520510971299447e-06, 'batch_size': 3889, 'optimizer': 'Adam'}.
2026-06-04 17:11:42,599 - experiment_functions - INFO - Early stopping at epoch 3650. Best Metrics: (0.0006665617423224375, 9.377721213745061e-05, 0.00027348723301075)
2026-06-04 17:11:42,968 - optuna.study.study - INFO - Trial 9 finished with values: [0.0006665617423224375, 9.377721213745061e-05, 0.00027348723301075] and parameters: {'n_layers': 4, 'embedding_dim': 32, 'lr': 4.8225146026598846e-05, 'lambda_val': 0.00019205234619986943, 'batch_size': 1964, 'optimizer': 'RMSprop'}.
2026-06-04 17:12:07,596 - experiment_functions - INFO - Early stopping at epoch 550. Best Metrics: (0.0034028791140409595, 0.000577734610489651, 0.002121480255809464)
