2026-06-03 17:52:52,870 - optuna.study.study - INFO - Trial 281 finished with values: [0.005031365078559499, 0.0018487507535668833, 0.003771825485063488] and parameters: {'n_layers': 1, 'embedding_dim': 256, 'lr': 0.005194863702442923, 'lambda_val': 2.2634352103481605e-05, 'batch_size': 1072, 'optimizer': 'Adam'}.
2026-06-03 17:54:22,693 - experiment_functions - INFO - Early stopping at epoch 2400. Best Metrics: (0.0054815971870323995, 0.001810235112867573, 0.0037947358658594107)
2026-06-03 17:54:22,790 - optuna.study.study - INFO - Trial 282 finished with values: [0.0054815971870323995, 0.001810235112867573, 0.0037947358658594107] and parameters: {'n_layers': 1, 'embedding_dim': 64, 'lr': 0.0006158877725370185, 'lambda_val': 8.536566464955742e-05, 'batch_size': 2369, 'optimizer': 'Adam'}.
2026-06-03 17:55:25,374 - experiment_functions - INFO - Early stopping at epoch 1500. Best Metrics: (0.004946431662214898, 0.001872195056601246, 0.0038552566238326635)
2026-06-03 17:55:25,463 - optuna.study.study - INFO - Trial 283 finished with values: [0.004946431662214898, 0.001872195056601246, 0.0038552566238326635] and parameters: {'n_layers': 1, 'embedding_dim': 256, 'lr': 0.0010433155335864835, 'lambda_val': 0.00014066527401303662, 'batch_size': 1352, 'optimizer': 'Adam'}.
2026-06-03 17:57:32,472 - experiment_functions - INFO - Early stopping at epoch 3600. Best Metrics: (0.006302270346991775, 0.0017934891821287428, 0.004211656033716302)
2026-06-03 17:57:32,560 - optuna.study.study - INFO - Trial 284 finished with values: [0.006302270346991775, 0.0017934891821287428, 0.004211656033716302] and parameters: {'n_layers': 1, 'embedding_dim': 32, 'lr': 0.0006158877725370185, 'lambda_val': 3.6015692758113356e-06, 'batch_size': 1314, 'optimizer': 'RMSprop'}.
2026-06-03 17:58:56,507 - experiment_functions - INFO - Early stopping at epoch 2200. Best Metrics: (0.005233302745215419, 0.001843726974345234, 0.003803682872594036)
2026-06-03 17:58:56,594 - optuna.study.study - INFO - Trial 285 finished with values: [0.005233302745215419, 0.001843726974345234, 0.003803682872594036] and parameters: {'n_layers': 1, 'embedding_dim': 128, 'lr': 0.00058211761161888, 'lambda_val': 3.6015692758113356e-06, 'batch_size': 3046, 'optimizer': 'Adam'}.
2026-06-03 17:59:28,551 - experiment_functions - INFO - Early stopping at epoch 850. Best Metrics: (0.0055244589516634255, 0.0016712438877352805, 0.003583117656657179)
2026-06-03 17:59:28,667 - optuna.study.study - INFO - Trial 286 finished with values: [0.0055244589516634255, 0.0016712438877352805, 0.003583117656657179] and parameters: {'n_layers': 1, 'embedding_dim': 32, 'lr': 0.0018644973108911816, 'lambda_val': 2.2072560753305147e-05, 'batch_size': 981, 'optimizer': 'RMSprop'}.
2026-06-03 18:00:17,099 - experiment_functions - INFO - Early stopping at epoch 1250. Best Metrics: (0.0034979374610220053, 0.0010650411949896176, 0.002297495064173007)
2026-06-03 18:00:17,192 - optuna.study.study - INFO - Trial 287 finished with values: [0.0034979374610220053, 0.0010650411949896176, 0.002297495064173007] and parameters: {'n_layers': 2, 'embedding_dim': 96, 'lr': 0.0006158877725370185, 'lambda_val': 1.5212624452962504e-06, 'batch_size': 2232, 'optimizer': 'Adam'}.
2026-06-03 18:00:40,409 - experiment_functions - INFO - Early stopping at epoch 600. Best Metrics: (0.005447925654594092, 0.001734878424542836, 0.003806183993419058)
2026-06-03 18:00:40,506 - optuna.study.study - INFO - Trial 288 finished with values: [0.005447925654594092, 0.001734878424542836, 0.003806183993419058] and parameters: {'n_layers': 1, 'embedding_dim': 32, 'lr': 0.006315240769324818, 'lambda_val': 2.6151941707099572e-05, 'batch_size': 1195, 'optimizer': 'Adam'}.
2026-06-03 18:01:08,305 - experiment_functions - INFO - Early stopping at epoch 700. Best Metrics: (0.004475585411925336, 0.0015841650478933618, 0.003222678284443093)
2026-06-03 18:01:08,400 - optuna.study.study - INFO - Trial 289 finished with values: [0.004475585411925336, 0.0015841650478933618, 0.003222678284443093] and parameters: {'n_layers': 1, 'embedding_dim': 96, 'lr': 0.0018644973108911816, 'lambda_val': 2.2072560753305147e-05, 'batch_size': 2217, 'optimizer': 'RMSprop'}.
2026-06-03 18:04:15,589 - optuna.study.study - INFO - Trial 290 finished with values: [0.000624243968883696, 0.00010382477058074888, 0.0003118157199795707] and parameters: {'n_layers': 4, 'embedding_dim': 256, 'lr': 3.0194720914446096e-05, 'lambda_val': 2.697820276812544e-06, 'batch_size': 1352, 'optimizer': 'RMSprop'}.
2026-06-03 18:04:53,488 - experiment_functions - INFO - Early stopping at epoch 800. Best Metrics: (0.0019520607866175042, 0.0006229486234844933, 0.001310191453111652)
2026-06-03 18:04:53,604 - optuna.study.study - INFO - Trial 291 finished with values: [0.0019520607866175042, 0.0006229486234844933, 0.001310191453111652] and parameters: {'n_layers': 3, 'embedding_dim': 256, 'lr': 0.0018644973108911816, 'lambda_val': 2.2072560753305147e-05, 'batch_size': 981, 'optimizer': 'RMSprop'}.
2026-06-03 18:05:29,164 - experiment_functions - INFO - Early stopping at epoch 950. Best Metrics: (0.004923594626772645, 0.0015506731864157008, 0.00318790259973747)
2026-06-03 18:05:29,447 - optuna.study.study - INFO - Trial 292 finished with values: [0.004923594626772645, 0.0015506731864157008, 0.00318790259973747] and parameters: {'n_layers': 1, 'embedding_dim': 32, 'lr': 0.0018644973108911816, 'lambda_val': 3.6015692758113356e-06, 'batch_size': 2121, 'optimizer': 'Adam'}.
2026-06-03 18:08:12,495 - optuna.study.study - INFO - Trial 293 finished with values: [0.005076873658843883, 0.0019877419786991763, 0.004033074397235629] and parameters: {'n_layers': 1, 'embedding_dim': 256, 'lr': 0.0006158877725370185, 'lambda_val': 2.6151941707099572e-05, 'batch_size': 1195, 'optimizer': 'Adam'}.
2026-06-03 18:10:55,194 - optuna.study.study - INFO - Trial 294 finished with values: [0.0034130279838497112, 0.0011705405586442496, 0.0024424180035886485] and parameters: {'n_layers': 1, 'embedding_dim': 256, 'lr': 0.0001402040928798274, 'lambda_val': 3.6015692758113356e-06, 'batch_size': 2369, 'optimizer': 'Adam'}.
2026-06-03 18:12:54,403 - experiment_functions - INFO - Early stopping at epoch 3150. Best Metrics: (0.002328421900517798, 0.0006062026927456628, 0.001500523938191359)
2026-06-03 18:12:55,427 - optuna.study.study - INFO - Trial 295 finished with values: [0.002328421900517798, 0.0006062026927456628, 0.001500523938191359] and parameters: {'n_layers': 4, 'embedding_dim': 64, 'lr': 0.0003870837679520275, 'lambda_val': 8.536566464955742e-05, 'batch_size': 1195, 'optimizer': 'Adam'}.
2026-06-03 18:14:26,643 - experiment_functions - INFO - Early stopping at epoch 2200. Best Metrics: (0.005297135887276674, 0.00198439279255141, 0.004141713955498726)
2026-06-03 18:14:26,748 - optuna.study.study - INFO - Trial 296 finished with values: [0.005297135887276674, 0.00198439279255141, 0.004141713955498726] and parameters: {'n_layers': 1, 'embedding_dim': 256, 'lr': 0.0006158877725370185, 'lambda_val': 1.1031019465465648e-05, 'batch_size': 1352, 'optimizer': 'Adam'}.
2026-06-03 18:14:58,256 - experiment_functions - INFO - Early stopping at epoch 800. Best Metrics: (0.005261349325272009, 0.0016729184808091636, 0.0034794598573822393)
2026-06-03 18:14:58,331 - optuna.study.study - INFO - Trial 297 finished with values: [0.005261349325272009, 0.0016729184808091636, 0.0034794598573822393] and parameters: {'n_layers': 1, 'embedding_dim': 96, 'lr': 0.0010433155335864835, 'lambda_val': 0.0019775295724831585, 'batch_size': 1195, 'optimizer': 'RMSprop'}.
2026-06-03 18:15:29,215 - experiment_functions - INFO - Early stopping at epoch 800. Best Metrics: (0.005774774705704677, 0.001729854645321187, 0.003918045206001226)
2026-06-03 18:15:29,638 - optuna.study.study - INFO - Trial 298 finished with values: [0.005774774705704677, 0.001729854645321187, 0.003918045206001226] and parameters: {'n_layers': 1, 'embedding_dim': 32, 'lr': 0.0018644973108911816, 'lambda_val': 2.6151941707099572e-05, 'batch_size': 1195, 'optimizer': 'Adam'}.
2026-06-03 18:15:52,230 - experiment_functions - INFO - Early stopping at epoch 550. Best Metrics: (0.0046270806913634565, 0.0017181324938040055, 0.003444282492365524)
2026-06-03 18:15:52,327 - optuna.study.study - INFO - Trial 299 finished with values: [0.0046270806913634565, 0.0017181324938040055, 0.003444282492365524] and parameters: {'n_layers': 1, 'embedding_dim': 96, 'lr': 0.007814735983832546, 'lambda_val': 8.536566464955742e-05, 'batch_size': 2369, 'optimizer': 'Adam'}.
2026-06-03 18:15:52,342 - root - INFO - Selected Trial 247 based on Max ndcg: 0.0044
2026-06-03 18:15:52,342 - root - INFO - Associated Recall: 0.0058
2026-06-03 18:15:52,342 - experiment_functions - INFO - Training the best model ... for e_gowalla_1c1dcs_strict
2026-06-03 18:17:20,124 - experiment_functions - INFO - Early stopping at epoch 2150. Best Metrics: (0.006058264982209486, 0.002009511688659656, 0.004347727718625773)
2026-06-03 18:17:23,580 - root - INFO -   **** Training e_gowalla_1c1dcs_strict_rand1
2026-06-03 18:17:23,599 - root - INFO -   **** Getting 51651/845292 random edges
2026-06-03 18:17:23,718 - optuna.storages._rdb.storage - INFO - A new study created in RDB with name: Study_e_gowalla_1c1dcs_strict_rand1
2026-06-03 18:19:51,226 - optuna.study.study - INFO - Trial 0 finished with values: [0.0011698980829011434, 0.00017248308660995377, 0.0006108535990172185] and parameters: {'n_layers': 2, 'embedding_dim': 64, 'lr': 0.0001463216973541482, 'lambda_val': 0.0002705156165706316, 'batch_size': 1460, 'optimizer': 'RMSprop'}.
2026-06-03 18:20:11,701 - experiment_functions - INFO - Early stopping at epoch 500. Best Metrics: (0.00045223738544778374, 7.033290910308795e-05, 0.0002562575663467235)
2026-06-03 18:20:11,797 - optuna.study.study - INFO - Trial 1 finished with values: [0.00045223738544778374, 7.033290910308795e-05, 0.0002562575663467235] and parameters: {'n_layers': 4, 'embedding_dim': 32, 'lr': 0.00017020197787442757, 'lambda_val': 1.7185164149164783e-05, 'batch_size': 2818, 'optimizer': 'SGD'}.
2026-06-03 18:21:39,265 - experiment_functions - INFO - Early stopping at epoch 2350. Best Metrics: (0.000670023986782084, 0.00010549936365463192, 0.0003206613475821095)
2026-06-03 18:21:39,403 - optuna.study.study - INFO - Trial 2 finished with values: [0.000670023986782084, 0.00010549936365463192, 0.0003206613475821095] and parameters: {'n_layers': 4, 'embedding_dim': 32, 'lr': 6.0066841150850955e-05, 'lambda_val': 2.005770549498432e-05, 'batch_size': 2754, 'optimizer': 'Adam'}.
2026-06-03 18:21:59,979 - experiment_functions - INFO - Early stopping at epoch 500. Best Metrics: (0.000383025876791606, 7.703128139862013e-05, 0.00021434975597067862)
2026-06-03 18:22:00,074 - optuna.study.study - INFO - Trial 3 finished with values: [0.000383025876791606, 7.703128139862013e-05, 0.00021434975597067862] and parameters: {'n_layers': 2, 'embedding_dim': 64, 'lr': 0.018542367242933885, 'lambda_val': 0.001953594059042866, 'batch_size': 972, 'optimizer': 'SGD'}.
2026-06-03 18:23:46,829 - experiment_functions - INFO - Early stopping at epoch 2750. Best Metrics: (0.0007774580202668573, 9.880099135909974e-05, 0.00032354338666815407)
2026-06-03 18:23:46,931 - optuna.study.study - INFO - Trial 4 finished with values: [0.0007774580202668573, 9.880099135909974e-05, 0.00032354338666815407] and parameters: {'n_layers': 4, 'embedding_dim': 64, 'lr': 3.916763860789649e-05, 'lambda_val': 0.0038733955368825987, 'batch_size': 3909, 'optimizer': 'RMSprop'}.
2026-06-03 18:25:06,193 - experiment_functions - INFO - Early stopping at epoch 1900. Best Metrics: (0.004539712237482404, 0.0008406457230892894, 0.00248911952020642)
2026-06-03 18:25:06,308 - optuna.study.study - INFO - Trial 5 finished with values: [0.004539712237482404, 0.0008406457230892894, 0.00248911952020642] and parameters: {'n_layers': 1, 'embedding_dim': 256, 'lr': 0.03789202322821606, 'lambda_val': 0.00030251839951992836, 'batch_size': 1015, 'optimizer': 'RMSprop'}.
2026-06-03 18:25:45,727 - experiment_functions - INFO - Early stopping at epoch 1050. Best Metrics: (0.005721773446207618, 0.0008523678746064707, 0.0031841773631281355)
2026-06-03 18:25:45,836 - optuna.study.study - INFO - Trial 6 finished with values: [0.005721773446207618, 0.0008523678746064707, 0.0031841773631281355] and parameters: {'n_layers': 1, 'embedding_dim': 32, 'lr': 0.0015683866974798046, 'lambda_val': 0.0017288396181291184, 'batch_size': 1505, 'optimizer': 'RMSprop'}.
2026-06-03 18:27:11,851 - experiment_functions - INFO - Early stopping at epoch 2350. Best Metrics: (0.007008499799715502, 0.0010784379395806817, 0.00396529800209621)
2026-06-03 18:27:11,932 - optuna.study.study - INFO - Trial 7 finished with values: [0.007008499799715502, 0.0010784379395806817, 0.00396529800209621] and parameters: {'n_layers': 1, 'embedding_dim': 64, 'lr': 0.0014471032063295877, 'lambda_val': 1.109906362587361e-06, 'batch_size': 1213, 'optimizer': 'RMSprop'}.
2026-06-03 18:27:41,882 - experiment_functions - INFO - Early stopping at epoch 700. Best Metrics: (0.00031628930897971023, 6.86583160292049e-05, 0.00017490771312663448)
2026-06-03 18:27:41,966 - optuna.study.study - INFO - Trial 8 finished with values: [0.00031628930897971023, 6.86583160292049e-05, 0.00017490771312663448] and parameters: {'n_layers': 1, 'embedding_dim': 256, 'lr': 0.00045006918839043025, 'lambda_val': 0.0003001769499954791, 'batch_size': 543, 'optimizer': 'SGD'}.
2026-06-03 18:29:06,912 - experiment_functions - INFO - Early stopping at epoch 2200. Best Metrics: (0.004208922554347617, 0.000756916069395137, 0.0023106388075727464)
2026-06-03 18:29:07,004 - optuna.study.study - INFO - Trial 9 finished with values: [0.004208922554347617, 0.000756916069395137, 0.0023106388075727464] and parameters: {'n_layers': 2, 'embedding_dim': 96, 'lr': 0.08323981505972321, 'lambda_val': 0.0014403479846065931, 'batch_size': 1590, 'optimizer': 'RMSprop'}.
2026-06-03 18:30:08,602 - experiment_functions - INFO - Early stopping at epoch 1600. Best Metrics: (0.0032913092466450946, 0.0006195994373367271, 0.0018716255453029734)
2026-06-03 18:30:08,732 - optuna.study.study - INFO - Trial 10 finished with values: [0.0032913092466450946, 0.0006195994373367271, 0.0018716255453029734] and parameters: {'n_layers': 3, 'embedding_dim': 64, 'lr': 0.016847576506974767, 'lambda_val': 0.03349546426778235, 'batch_size': 681, 'optimizer': 'RMSprop'}.
2026-06-03 18:30:31,421 - experiment_functions - INFO - Early stopping at epoch 500. Best Metrics: (0.0005239631203981844, 7.200750217697099e-05, 0.00023366669742207167)
2026-06-03 18:30:31,525 - optuna.study.study - INFO - Trial 11 finished with values: [0.0005239631203981844, 7.200750217697099e-05, 0.00023366669742207167] and parameters: {'n_layers': 3, 'embedding_dim': 128, 'lr': 2.4001665679067823e-05, 'lambda_val': 0.011030318501910432, 'batch_size': 2860, 'optimizer': 'Adam'}.
2026-06-03 18:30:53,882 - experiment_functions - INFO - Early stopping at epoch 500. Best Metrics: (0.0004630571471910255, 6.530912988143881e-05, 0.00019760201417458613)
2026-06-03 18:30:53,975 - optuna.study.study - INFO - Trial 12 finished with values: [0.0004630571471910255, 6.530912988143881e-05, 0.00019760201417458613] and parameters: {'n_layers': 1, 'embedding_dim': 256, 'lr': 1.0517175989980823e-05, 'lambda_val': 0.014913533649560542, 'batch_size': 1310, 'optimizer': 'SGD'}.
2026-06-03 18:32:54,138 - experiment_functions - INFO - Early stopping at epoch 3400. Best Metrics: (0.000722777159578017, 9.04280259896845e-05, 0.00029365975073283586)
2026-06-03 18:32:54,291 - optuna.study.study - INFO - Trial 13 finished with values: [0.000722777159578017, 9.04280259896845e-05, 0.00029365975073283586] and parameters: {'n_layers': 1, 'embedding_dim': 32, 'lr': 1.4056282215186718e-05, 'lambda_val': 2.8213498420411537e-05, 'batch_size': 1524, 'optimizer': 'RMSprop'}.
2026-06-03 18:33:14,550 - experiment_functions - INFO - Early stopping at epoch 500. Best Metrics: (0.0004660419408524206, 7.870587447250318e-05, 0.00023103153565740206)
2026-06-03 18:33:14,639 - optuna.study.study - INFO - Trial 14 finished with values: [0.0004660419408524206, 7.870587447250318e-05, 0.00023103153565740206] and parameters: {'n_layers': 1, 'embedding_dim': 96, 'lr': 1.347218293074296e-05, 'lambda_val': 8.488849448457501e-05, 'batch_size': 518, 'optimizer': 'SGD'}.
2026-06-03 18:35:40,056 - optuna.study.study - INFO - Trial 15 finished with values: [0.0011661613709663073, 0.00016411012124053855, 0.0005749872920189302] and parameters: {'n_layers': 1, 'embedding_dim': 64, 'lr': 0.00012213661061495398, 'lambda_val': 0.001214423045852566, 'batch_size': 3893, 'optimizer': 'RMSprop'}.
2026-06-03 18:36:17,219 - experiment_functions - INFO - Early stopping at epoch 850. Best Metrics: (0.007955599173428944, 0.0014652689396476657, 0.004688770837058038)
2026-06-03 18:36:17,308 - optuna.study.study - INFO - Trial 16 finished with values: [0.007955599173428944, 0.0014652689396476657, 0.004688770837058038] and parameters: {'n_layers': 3, 'embedding_dim': 128, 'lr': 0.0027608560004649, 'lambda_val': 2.468073181110974e-06, 'batch_size': 1308, 'optimizer': 'Adam'}.
2026-06-03 18:36:46,562 - experiment_functions - INFO - Early stopping at epoch 750. Best Metrics: (0.0005236673867543531, 8.540424676803538e-05, 0.00022034025052574034)
2026-06-03 18:36:47,603 - optuna.study.study - INFO - Trial 17 finished with values: [0.0005236673867543531, 8.540424676803538e-05, 0.00022034025052574034] and parameters: {'n_layers': 1, 'embedding_dim': 64, 'lr': 4.968329504133451e-05, 'lambda_val': 0.012656082992665485, 'batch_size': 2994, 'optimizer': 'Adam'}.
2026-06-03 18:37:08,620 - experiment_functions - INFO - Early stopping at epoch 500. Best Metrics: (0.0005966502709633669, 9.545180521133365e-05, 0.00027179296506847937)
2026-06-03 18:37:08,984 - optuna.study.study - INFO - Trial 18 finished with values: [0.0005966502709633669, 9.545180521133365e-05, 0.00027179296506847937] and parameters: {'n_layers': 1, 'embedding_dim': 128, 'lr': 4.931373797168982e-05, 'lambda_val': 7.555634745702531e-06, 'batch_size': 546, 'optimizer': 'SGD'}.
2026-06-03 18:37:29,216 - experiment_functions - INFO - Early stopping at epoch 500. Best Metrics: (0.0004705933222683977, 6.195994373367272e-05, 0.00019661048098001287)
2026-06-03 18:37:29,323 - optuna.study.study - INFO - Trial 19 finished with values: [0.0004705933222683977, 6.195994373367272e-05, 0.00019661048098001287] and parameters: {'n_layers': 3, 'embedding_dim': 32, 'lr': 0.00013914666238494096, 'lambda_val': 0.0143138867453006, 'batch_size': 2159, 'optimizer': 'SGD'}.
2026-06-03 18:38:11,819 - experiment_functions - INFO - Early stopping at epoch 1100. Best Metrics: (0.004894793844061563, 0.0007384955455824235, 0.002885694372564224)
2026-06-03 18:38:11,912 - optuna.study.study - INFO - Trial 20 finished with values: [0.004894793844061563, 0.0007384955455824235, 0.002885694372564224] and parameters: {'n_layers': 1, 'embedding_dim': 96, 'lr': 0.0018040479477802712, 'lambda_val': 0.0003123129135877017, 'batch_size': 1936, 'optimizer': 'Adam'}.
2026-06-03 18:38:34,224 - experiment_functions - INFO - Early stopping at epoch 500. Best Metrics: (0.000555645086442577, 7.368209525085404e-05, 0.00029532374165093864)
2026-06-03 18:38:34,318 - optuna.study.study - INFO - Trial 21 finished with values: [0.000555645086442577, 7.368209525085404e-05, 0.00029532374165093864] and parameters: {'n_layers': 4, 'embedding_dim': 96, 'lr': 0.0038053181581307245, 'lambda_val': 1.3849771019288732e-05, 'batch_size': 1671, 'optimizer': 'SGD'}.
2026-06-03 18:39:16,417 - experiment_functions - INFO - Early stopping at epoch 1050. Best Metrics: (0.007793211540044277, 0.0013899122513229287, 0.004452621469938244)
2026-06-03 18:39:16,515 - optuna.study.study - INFO - Trial 22 finished with values: [0.007793211540044277, 0.0013899122513229287, 0.004452621469938244] and parameters: {'n_layers': 2, 'embedding_dim': 96, 'lr': 0.002060594231766347, 'lambda_val': 0.00021888803225104277, 'batch_size': 790, 'optimizer': 'RMSprop'}.
2026-06-03 18:39:49,140 - experiment_functions - INFO - Early stopping at epoch 600. Best Metrics: (0.004121531473595165, 0.0007602652555429031, 0.0022549239521193268)
2026-06-03 18:39:49,236 - optuna.study.study - INFO - Trial 23 finished with values: [0.004121531473595165, 0.0007602652555429031, 0.0022549239521193268] and parameters: {'n_layers': 4, 'embedding_dim': 256, 'lr': 0.006618720765032931, 'lambda_val': 0.008589102899886254, 'batch_size': 1449, 'optimizer': 'RMSprop'}.
2026-06-03 18:40:34,389 - experiment_functions - INFO - Early stopping at epoch 1050. Best Metrics: (0.0004465935359706852, 7.87058744725032e-05, 0.00018177958510004212)
2026-06-03 18:40:34,484 - optuna.study.study - INFO - Trial 24 finished with values: [0.0004465935359706852, 7.87058744725032e-05, 0.00018177958510004212] and parameters: {'n_layers': 1, 'embedding_dim': 256, 'lr': 1.7009837464912612e-05, 'lambda_val': 0.01261788718187083, 'batch_size': 1097, 'optimizer': 'Adam'}.
2026-06-03 18:41:15,048 - experiment_functions - INFO - Early stopping at epoch 950. Best Metrics: (0.0007090212712658175, 9.880099135909974e-05, 0.0002766578901702535)
2026-06-03 18:41:15,153 - optuna.study.study - INFO - Trial 25 finished with values: [0.0007090212712658175, 9.880099135909974e-05, 0.0002766578901702535] and parameters: {'n_layers': 4, 'embedding_dim': 96, 'lr': 1.591164719189174e-05, 'lambda_val': 0.018363215121888217, 'batch_size': 2467, 'optimizer': 'Adam'}.
2026-06-03 18:41:35,624 - experiment_functions - INFO - Early stopping at epoch 500. Best Metrics: (0.0005734795401502007, 8.540424676803537e-05, 0.00026257692533415526)
