2026-06-06 14:03:47,996 - optuna.study.study - INFO - Trial 62 finished with values: [0.0005184123643360108, 7.033290910308795e-05, 0.00023385372034536765] and parameters: {'n_layers': 1, 'embedding_dim': 32, 'lr': 0.0016310133844241697, 'lambda_val': 4.5847333595117975e-06, 'batch_size': 2721, 'optimizer': 'SGD'}.
2026-06-06 14:04:10,485 - experiment_functions - INFO - Early stopping at epoch 550. Best Metrics: (0.024389483705003212, 0.003320718065510081, 0.011843286464480863)
2026-06-06 14:04:10,577 - optuna.study.study - INFO - Trial 63 finished with values: [0.024389483705003212, 0.003320718065510081, 0.011843286464480863] and parameters: {'n_layers': 1, 'embedding_dim': 32, 'lr': 0.05199048927325542, 'lambda_val': 0.00025971850447075427, 'batch_size': 3164, 'optimizer': 'Adam'}.
2026-06-06 14:04:34,554 - experiment_functions - INFO - Early stopping at epoch 550. Best Metrics: (0.02330266134300075, 0.002635809498291916, 0.010389961796359745)
2026-06-06 14:04:34,835 - optuna.study.study - INFO - Trial 64 finished with values: [0.02330266134300075, 0.002635809498291916, 0.010389961796359745] and parameters: {'n_layers': 4, 'embedding_dim': 32, 'lr': 0.04708241095252787, 'lambda_val': 2.252556463844016e-05, 'batch_size': 3469, 'optimizer': 'Adam'}.
2026-06-06 14:05:19,819 - experiment_functions - INFO - Early stopping at epoch 1150. Best Metrics: (0.0006027908556855041, 9.545180521133365e-05, 0.00028151673566321594)
2026-06-06 14:05:20,895 - optuna.study.study - INFO - Trial 65 finished with values: [0.0006027908556855041, 9.545180521133365e-05, 0.00028151673566321594] and parameters: {'n_layers': 1, 'embedding_dim': 64, 'lr': 0.00014815746640230623, 'lambda_val': 0.0007001581162856878, 'batch_size': 2681, 'optimizer': 'RMSprop'}.
2026-06-06 14:06:31,318 - experiment_functions - INFO - Early stopping at epoch 1650. Best Metrics: (0.05489610502119827, 0.006939513698171344, 0.02779070376413515)
2026-06-06 14:06:31,619 - optuna.study.study - INFO - Trial 66 finished with values: [0.05489610502119827, 0.006939513698171344, 0.02779070376413515] and parameters: {'n_layers': 2, 'embedding_dim': 96, 'lr': 0.0006507771018879831, 'lambda_val': 0.005654238457918686, 'batch_size': 1985, 'optimizer': 'RMSprop'}.
2026-06-06 14:09:05,863 - optuna.study.study - INFO - Trial 67 finished with values: [0.0009397173467973525, 0.00013899122513229287, 0.00043803440971565286] and parameters: {'n_layers': 4, 'embedding_dim': 32, 'lr': 7.06134203260073e-05, 'lambda_val': 0.00014511874074845464, 'batch_size': 1516, 'optimizer': 'RMSprop'}.
2026-06-06 14:11:44,621 - experiment_functions - INFO - Early stopping at epoch 3450. Best Metrics: (0.05306309991869313, 0.0066531582825373435, 0.026336360822891116)
2026-06-06 14:11:44,800 - optuna.study.study - INFO - Trial 68 finished with values: [0.05306309991869313, 0.0066531582825373435, 0.026336360822891116] and parameters: {'n_layers': 3, 'embedding_dim': 128, 'lr': 0.00039823438048122364, 'lambda_val': 0.0028258090394084607, 'batch_size': 1966, 'optimizer': 'Adam'}.
2026-06-06 14:14:50,581 - optuna.study.study - INFO - Trial 69 finished with values: [0.001454075120622474, 0.00022104628575256215, 0.0007114385791931667] and parameters: {'n_layers': 4, 'embedding_dim': 128, 'lr': 7.06134203260073e-05, 'lambda_val': 5.28770978807981e-06, 'batch_size': 1516, 'optimizer': 'RMSprop'}.
2026-06-06 14:15:15,541 - experiment_functions - INFO - Early stopping at epoch 600. Best Metrics: (0.0004657703070385847, 6.363453680755577e-05, 0.00022183802317709468)
2026-06-06 14:15:15,974 - optuna.study.study - INFO - Trial 70 finished with values: [0.0004657703070385847, 6.363453680755577e-05, 0.00022183802317709468] and parameters: {'n_layers': 3, 'embedding_dim': 32, 'lr': 2.4668720822561164e-05, 'lambda_val': 2.252556463844016e-05, 'batch_size': 1760, 'optimizer': 'RMSprop'}.
2026-06-06 14:15:49,667 - experiment_functions - INFO - Early stopping at epoch 600. Best Metrics: (0.000723152700704923, 9.210261906356756e-05, 0.00028127558335332517)
2026-06-06 14:15:50,180 - optuna.study.study - INFO - Trial 71 finished with values: [0.000723152700704923, 9.210261906356756e-05, 0.00028127558335332517] and parameters: {'n_layers': 3, 'embedding_dim': 256, 'lr': 2.211843455549331e-05, 'lambda_val': 0.00014511874074845464, 'batch_size': 696, 'optimizer': 'RMSprop'}.
2026-06-06 14:16:11,921 - experiment_functions - INFO - Early stopping at epoch 500. Best Metrics: (0.00032428810349615544, 5.6936164512023584e-05, 0.00016745344116500993)
2026-06-06 14:16:12,071 - optuna.study.study - INFO - Trial 72 finished with values: [0.00032428810349615544, 5.6936164512023584e-05, 0.00016745344116500993] and parameters: {'n_layers': 1, 'embedding_dim': 96, 'lr': 0.00029816136001899624, 'lambda_val': 0.02300204924147889, 'batch_size': 1985, 'optimizer': 'Adam'}.
2026-06-06 14:19:27,564 - experiment_functions - INFO - Early stopping at epoch 3650. Best Metrics: (0.019476375216657387, 0.00237457297876616, 0.008403530970527763)
2026-06-06 14:19:27,674 - optuna.study.study - INFO - Trial 73 finished with values: [0.019476375216657387, 0.00237457297876616, 0.008403530970527763] and parameters: {'n_layers': 3, 'embedding_dim': 256, 'lr': 0.024960250005651878, 'lambda_val': 0.006586196833192326, 'batch_size': 3832, 'optimizer': 'RMSprop'}.
2026-06-06 14:19:47,753 - experiment_functions - INFO - Early stopping at epoch 500. Best Metrics: (0.0003949780267868954, 7.368209525085404e-05, 0.00018036167266275257)
2026-06-06 14:19:48,911 - optuna.study.study - INFO - Trial 74 finished with values: [0.0003949780267868954, 7.368209525085404e-05, 0.00018036167266275257] and parameters: {'n_layers': 2, 'embedding_dim': 32, 'lr': 0.0504067015569555, 'lambda_val': 0.001953487001672056, 'batch_size': 1910, 'optimizer': 'SGD'}.
2026-06-06 14:20:12,995 - experiment_functions - INFO - Early stopping at epoch 550. Best Metrics: (0.025337396294932514, 0.003123116082791882, 0.011993883344614958)
2026-06-06 14:20:13,857 - optuna.study.study - INFO - Trial 75 finished with values: [0.025337396294932514, 0.003123116082791882, 0.011993883344614958] and parameters: {'n_layers': 2, 'embedding_dim': 96, 'lr': 0.0693886464668809, 'lambda_val': 2.6044128056798885e-05, 'batch_size': 3007, 'optimizer': 'Adam'}.
2026-06-06 14:20:36,432 - experiment_functions - INFO - Early stopping at epoch 500. Best Metrics: (0.0004289817814554355, 7.033290910308795e-05, 0.00019751312076215046)
2026-06-06 14:20:36,531 - optuna.study.study - INFO - Trial 76 finished with values: [0.0004289817814554355, 7.033290910308795e-05, 0.00019751312076215046] and parameters: {'n_layers': 3, 'embedding_dim': 96, 'lr': 0.00012489857730922413, 'lambda_val': 0.07777942389555165, 'batch_size': 1906, 'optimizer': 'Adam'}.
2026-06-06 14:21:01,587 - experiment_functions - INFO - Early stopping at epoch 550. Best Metrics: (0.035346026467582455, 0.004060888204166387, 0.01595594119534222)
2026-06-06 14:21:02,355 - optuna.study.study - INFO - Trial 77 finished with values: [0.035346026467582455, 0.004060888204166387, 0.01595594119534222] and parameters: {'n_layers': 2, 'embedding_dim': 128, 'lr': 0.013856986777548135, 'lambda_val': 0.0005031918520424605, 'batch_size': 1970, 'optimizer': 'Adam'}.
2026-06-06 14:24:03,582 - optuna.study.study - INFO - Trial 78 finished with values: [0.08826782293273328, 0.011209726036573114, 0.04723714054249347] and parameters: {'n_layers': 1, 'embedding_dim': 256, 'lr': 0.0007970006502074318, 'lambda_val': 7.199693710203336e-05, 'batch_size': 3591, 'optimizer': 'Adam'}.
2026-06-06 14:24:26,252 - experiment_functions - INFO - Early stopping at epoch 550. Best Metrics: (0.008392651188354161, 0.001008105030477594, 0.004035404459709929)
2026-06-06 14:24:26,333 - optuna.study.study - INFO - Trial 79 finished with values: [0.008392651188354161, 0.001008105030477594, 0.004035404459709929] and parameters: {'n_layers': 4, 'embedding_dim': 32, 'lr': 0.0323699675032409, 'lambda_val': 0.029461778634504096, 'batch_size': 1805, 'optimizer': 'RMSprop'}.
2026-06-06 14:24:52,324 - experiment_functions - INFO - Early stopping at epoch 550. Best Metrics: (0.017642611160722, 0.0020848683769843926, 0.008844170509243444)
2026-06-06 14:24:52,921 - optuna.study.study - INFO - Trial 80 finished with values: [0.017642611160722, 0.0020848683769843926, 0.008844170509243444] and parameters: {'n_layers': 4, 'embedding_dim': 96, 'lr': 0.08790291616580895, 'lambda_val': 1.2160816785194988e-06, 'batch_size': 1805, 'optimizer': 'RMSprop'}.
2026-06-06 14:25:14,212 - experiment_functions - INFO - Early stopping at epoch 500. Best Metrics: (0.0003953284331203584, 5.861075758590663e-05, 0.0001822390560726965)
2026-06-06 14:25:14,759 - optuna.study.study - INFO - Trial 81 finished with values: [0.0003953284331203584, 5.861075758590663e-05, 0.0001822390560726965] and parameters: {'n_layers': 1, 'embedding_dim': 128, 'lr': 7.06134203260073e-05, 'lambda_val': 0.005143748310703553, 'batch_size': 1560, 'optimizer': 'RMSprop'}.
2026-06-06 14:28:45,788 - optuna.study.study - INFO - Trial 82 finished with values: [0.01477245153378483, 0.0024030410610221715, 0.007734738559118462] and parameters: {'n_layers': 3, 'embedding_dim': 256, 'lr': 0.00014815746640230623, 'lambda_val': 0.00025971850447075427, 'batch_size': 2163, 'optimizer': 'Adam'}.
2026-06-06 14:29:07,305 - experiment_functions - INFO - Early stopping at epoch 500. Best Metrics: (0.0003496320719455425, 6.195994373367273e-05, 0.00018950409567229645)
2026-06-06 14:29:08,235 - optuna.study.study - INFO - Trial 83 finished with values: [0.0003496320719455425, 6.195994373367273e-05, 0.00018950409567229645] and parameters: {'n_layers': 1, 'embedding_dim': 128, 'lr': 0.0006507771018879831, 'lambda_val': 1.1713369465737043e-05, 'batch_size': 2549, 'optimizer': 'SGD'}.
2026-06-06 14:32:09,075 - optuna.study.study - INFO - Trial 84 finished with values: [0.08803916291928422, 0.011251590863420187, 0.04753679288965928] and parameters: {'n_layers': 1, 'embedding_dim': 256, 'lr': 0.0007970006502074318, 'lambda_val': 1.4780082520235353e-05, 'batch_size': 3074, 'optimizer': 'Adam'}.
2026-06-06 14:32:35,106 - experiment_functions - INFO - Early stopping at epoch 550. Best Metrics: (0.01778576333789266, 0.002116685645388171, 0.008700618864107754)
2026-06-06 14:32:35,200 - optuna.study.study - INFO - Trial 85 finished with values: [0.01778576333789266, 0.002116685645388171, 0.008700618864107754] and parameters: {'n_layers': 3, 'embedding_dim': 128, 'lr': 0.04708241095252787, 'lambda_val': 2.252556463844016e-05, 'batch_size': 3623, 'optimizer': 'RMSprop'}.
2026-06-06 14:32:57,242 - experiment_functions - INFO - Early stopping at epoch 500. Best Metrics: (0.0007795521318741755, 0.0001038247705807489, 0.00034204636106634624)
2026-06-06 14:32:58,037 - optuna.study.study - INFO - Trial 86 finished with values: [0.0007795521318741755, 0.0001038247705807489, 0.00034204636106634624] and parameters: {'n_layers': 4, 'embedding_dim': 64, 'lr': 0.00014493081704961333, 'lambda_val': 1.3785549357225351e-06, 'batch_size': 2556, 'optimizer': 'SGD'}.
2026-06-06 14:33:22,973 - experiment_functions - INFO - Early stopping at epoch 550. Best Metrics: (0.012382117104740947, 0.001554022372563467, 0.0061600015356915)
2026-06-06 14:33:23,994 - optuna.study.study - INFO - Trial 87 finished with values: [0.012382117104740947, 0.001554022372563467, 0.0061600015356915] and parameters: {'n_layers': 2, 'embedding_dim': 128, 'lr': 0.06128758575490874, 'lambda_val': 3.478120597048564e-05, 'batch_size': 3007, 'optimizer': 'RMSprop'}.
2026-06-06 14:33:46,646 - experiment_functions - INFO - Early stopping at epoch 500. Best Metrics: (0.014308943794406285, 0.001550673186415701, 0.007153738441869179)
2026-06-06 14:33:46,746 - optuna.study.study - INFO - Trial 88 finished with values: [0.014308943794406285, 0.001550673186415701, 0.007153738441869179] and parameters: {'n_layers': 2, 'embedding_dim': 128, 'lr': 0.06128758575490874, 'lambda_val': 0.0017491251394533274, 'batch_size': 1565, 'optimizer': 'RMSprop'}.
2026-06-06 14:36:30,530 - experiment_functions - INFO - Early stopping at epoch 3900. Best Metrics: (0.05703056415606502, 0.007031616317234914, 0.030074297742144082)
2026-06-06 14:36:30,632 - optuna.study.study - INFO - Trial 89 finished with values: [0.05703056415606502, 0.007031616317234914, 0.030074297742144082] and parameters: {'n_layers': 4, 'embedding_dim': 64, 'lr': 0.0005151812249168082, 'lambda_val': 2.6092056130364808e-05, 'batch_size': 2440, 'optimizer': 'RMSprop'}.
2026-06-06 14:36:54,067 - experiment_functions - INFO - Early stopping at epoch 500. Best Metrics: (0.00046000318215216467, 8.038046754638624e-05, 0.00024139739439418034)
2026-06-06 14:36:54,168 - optuna.study.study - INFO - Trial 90 finished with values: [0.00046000318215216467, 8.038046754638624e-05, 0.00024139739439418034] and parameters: {'n_layers': 3, 'embedding_dim': 128, 'lr': 2.211843455549331e-05, 'lambda_val': 0.08873111788623919, 'batch_size': 2147, 'optimizer': 'SGD'}.
2026-06-06 14:37:20,330 - experiment_functions - INFO - Early stopping at epoch 550. Best Metrics: (0.012322410918518007, 0.001373166320584098, 0.005256223104053562)
2026-06-06 14:37:20,535 - optuna.study.study - INFO - Trial 91 finished with values: [0.012322410918518007, 0.001373166320584098, 0.005256223104053562] and parameters: {'n_layers': 3, 'embedding_dim': 128, 'lr': 0.024960250005651878, 'lambda_val': 0.02119502726939229, 'batch_size': 3832, 'optimizer': 'Adam'}.
2026-06-06 14:40:03,829 - optuna.study.study - INFO - Trial 92 finished with values: [0.05640464367674523, 0.00727275771987407, 0.02845056727616943] and parameters: {'n_layers': 2, 'embedding_dim': 96, 'lr': 0.0005151812249168082, 'lambda_val': 0.005143748310703553, 'batch_size': 1516, 'optimizer': 'Adam'}.
2026-06-06 14:40:29,237 - experiment_functions - INFO - Early stopping at epoch 500. Best Metrics: (0.0003958142285695576, 6.363453680755577e-05, 0.00019193226391578115)
2026-06-06 14:40:29,400 - optuna.study.study - INFO - Trial 93 finished with values: [0.0003958142285695576, 6.363453680755577e-05, 0.00019193226391578115] and parameters: {'n_layers': 2, 'embedding_dim': 256, 'lr': 0.043230505329432796, 'lambda_val': 5.4807114726775164e-05, 'batch_size': 3851, 'optimizer': 'SGD'}.
2026-06-06 14:44:20,436 - optuna.study.study - INFO - Trial 94 finished with values: [0.043740420804628415, 0.005792417442561457, 0.0231487427473465] and parameters: {'n_layers': 4, 'embedding_dim': 256, 'lr': 0.00014493081704961333, 'lambda_val': 4.5847333595117975e-06, 'batch_size': 3633, 'optimizer': 'RMSprop'}.
2026-06-06 14:47:06,503 - optuna.study.study - INFO - Trial 95 finished with values: [0.05340236809798467, 0.006693348516310538, 0.02786383116410525] and parameters: {'n_layers': 4, 'embedding_dim': 64, 'lr': 0.00039823438048122364, 'lambda_val': 0.0008971608129751253, 'batch_size': 953, 'optimizer': 'RMSprop'}.
2026-06-06 14:48:49,184 - experiment_functions - INFO - Early stopping at epoch 2650. Best Metrics: (0.0005206519220481284, 7.200750217697099e-05, 0.0002102877807190199)
2026-06-06 14:48:49,276 - optuna.study.study - INFO - Trial 96 finished with values: [0.0005206519220481284, 7.200750217697099e-05, 0.0002102877807190199] and parameters: {'n_layers': 1, 'embedding_dim': 128, 'lr': 3.0889817764486426e-05, 'lambda_val': 0.0008971608129751253, 'batch_size': 2782, 'optimizer': 'RMSprop'}.
2026-06-06 14:49:10,008 - experiment_functions - INFO - Early stopping at epoch 500. Best Metrics: (0.0004573807493818135, 7.033290910308795e-05, 0.0002269381342495619)
2026-06-06 14:49:10,309 - optuna.study.study - INFO - Trial 97 finished with values: [0.0004573807493818135, 7.033290910308795e-05, 0.0002269381342495619] and parameters: {'n_layers': 2, 'embedding_dim': 64, 'lr': 0.012136843006185682, 'lambda_val': 3.2950738432782127e-06, 'batch_size': 1509, 'optimizer': 'SGD'}.
2026-06-06 14:51:45,367 - optuna.study.study - INFO - Trial 98 finished with values: [0.004791752672259099, 0.0008758121776408333, 0.002957711851269115] and parameters: {'n_layers': 1, 'embedding_dim': 128, 'lr': 0.0004543711173429324, 'lambda_val': 0.00016614359093763118, 'batch_size': 1031, 'optimizer': 'Adam'}.
2026-06-06 14:52:07,739 - experiment_functions - INFO - Early stopping at epoch 500. Best Metrics: (0.00039176045045387093, 6.86583160292049e-05, 0.00018368113647784012)
2026-06-06 14:52:08,136 - optuna.study.study - INFO - Trial 99 finished with values: [0.00039176045045387093, 6.86583160292049e-05, 0.00018368113647784012] and parameters: {'n_layers': 3, 'embedding_dim': 96, 'lr': 0.09719698309756705, 'lambda_val': 4.886409589708403e-06, 'batch_size': 1165, 'optimizer': 'SGD'}.
2026-06-06 14:54:40,880 - optuna.study.study - INFO - Trial 100 finished with values: [0.048127862716655354, 0.006433786589858664, 0.02642471922776236] and parameters: {'n_layers': 3, 'embedding_dim': 32, 'lr': 0.0004543711173429324, 'lambda_val': 0.00025971850447075427, 'batch_size': 1031, 'optimizer': 'Adam'}.
2026-06-06 14:56:54,071 - experiment_functions - INFO - Early stopping at epoch 3300. Best Metrics: (0.0531422171402799, 0.006686650144015004, 0.02669209498517418)
2026-06-06 14:56:54,149 - optuna.study.study - INFO - Trial 101 finished with values: [0.0531422171402799, 0.006686650144015004, 0.02669209498517418] and parameters: {'n_layers': 3, 'embedding_dim': 64, 'lr': 0.0003985149678492164, 'lambda_val': 0.0028258090394084607, 'batch_size': 1966, 'optimizer': 'RMSprop'}.
2026-06-06 14:59:00,762 - experiment_functions - INFO - Early stopping at epoch 2900. Best Metrics: (0.024618423142109835, 0.0028535065978967113, 0.010839732861947846)
2026-06-06 14:59:00,867 - optuna.study.study - INFO - Trial 102 finished with values: [0.024618423142109835, 0.0028535065978967113, 0.010839732861947846] and parameters: {'n_layers': 4, 'embedding_dim': 96, 'lr': 0.024960250005651878, 'lambda_val': 0.0018437331566743573, 'batch_size': 1805, 'optimizer': 'RMSprop'}.
2026-06-06 15:01:56,000 - optuna.study.study - INFO - Trial 103 finished with values: [0.04600224739022747, 0.00576060017415768, 0.02153891434523146] and parameters: {'n_layers': 1, 'embedding_dim': 256, 'lr': 0.013856986777548135, 'lambda_val': 0.0005031918520424605, 'batch_size': 3591, 'optimizer': 'RMSprop'}.
2026-06-06 15:04:29,233 - optuna.study.study - INFO - Trial 104 finished with values: [0.07344030428763036, 0.008967445910643714, 0.03755493405836524] and parameters: {'n_layers': 2, 'embedding_dim': 32, 'lr': 0.0007970006502074318, 'lambda_val': 7.199693710203336e-05, 'batch_size': 3591, 'optimizer': 'Adam'}.
2026-06-06 15:04:49,820 - experiment_functions - INFO - Early stopping at epoch 500. Best Metrics: (0.0006250437623589304, 9.04280259896845e-05, 0.0002486269592520429)
2026-06-06 15:04:50,252 - optuna.study.study - INFO - Trial 105 finished with values: [0.0006250437623589304, 9.04280259896845e-05, 0.0002486269592520429] and parameters: {'n_layers': 4, 'embedding_dim': 32, 'lr': 0.0004543711173429324, 'lambda_val': 0.006586196833192326, 'batch_size': 1628, 'optimizer': 'SGD'}.
2026-06-06 15:07:38,156 - optuna.study.study - INFO - Trial 106 finished with values: [0.01772593017347, 0.0026441824636613304, 0.00971032438912769] and parameters: {'n_layers': 4, 'embedding_dim': 64, 'lr': 0.00014493081704961333, 'lambda_val': 2.6092056130364808e-05, 'batch_size': 3633, 'optimizer': 'RMSprop'}.
2026-06-06 15:08:05,086 - experiment_functions - INFO - Early stopping at epoch 600. Best Metrics: (0.053018588667731466, 0.006738562529305379, 0.026771272374844567)
2026-06-06 15:08:05,173 - optuna.study.study - INFO - Trial 107 finished with values: [0.053018588667731466, 0.006738562529305379, 0.026771272374844567] and parameters: {'n_layers': 1, 'embedding_dim': 128, 'lr': 0.013856986777548135, 'lambda_val': 0.0005031918520424605, 'batch_size': 2631, 'optimizer': 'Adam'}.
2026-06-06 15:08:30,964 - experiment_functions - INFO - Early stopping at epoch 550. Best Metrics: (0.03485780530157999, 0.004037443901132026, 0.015310636283388692)
2026-06-06 15:08:31,067 - optuna.study.study - INFO - Trial 108 finished with values: [0.03485780530157999, 0.004037443901132026, 0.015310636283388692] and parameters: {'n_layers': 2, 'embedding_dim': 128, 'lr': 0.013856986777548135, 'lambda_val': 0.0005031918520424605, 'batch_size': 1970, 'optimizer': 'Adam'}.
2026-06-06 15:08:58,000 - experiment_functions - INFO - Early stopping at epoch 550. Best Metrics: (0.027676003668135694, 0.0032503851564069934, 0.012746389231015702)
2026-06-06 15:08:58,120 - optuna.study.study - INFO - Trial 109 finished with values: [0.027676003668135694, 0.0032503851564069934, 0.012746389231015702] and parameters: {'n_layers': 4, 'embedding_dim': 96, 'lr': 0.04708241095252787, 'lambda_val': 2.252556463844016e-05, 'batch_size': 1985, 'optimizer': 'Adam'}.
2026-06-06 15:11:29,779 - optuna.study.study - INFO - Trial 110 finished with values: [0.03776758282715468, 0.0058376314555563, 0.01990038785960996] and parameters: {'n_layers': 1, 'embedding_dim': 32, 'lr': 0.0005194903303948574, 'lambda_val': 0.017787300556045323, 'batch_size': 2723, 'optimizer': 'RMSprop'}.
2026-06-06 15:13:30,601 - experiment_functions - INFO - Early stopping at epoch 2650. Best Metrics: (0.04721305127786304, 0.005921361109250452, 0.02253819716147136)
2026-06-06 15:13:30,695 - optuna.study.study - INFO - Trial 111 finished with values: [0.04721305127786304, 0.005921361109250452, 0.02253819716147136] and parameters: {'n_layers': 3, 'embedding_dim': 128, 'lr': 0.00039823438048122364, 'lambda_val': 0.005143748310703553, 'batch_size': 2302, 'optimizer': 'RMSprop'}.
2026-06-06 15:16:21,610 - optuna.study.study - INFO - Trial 112 finished with values: [0.07813991479801931, 0.009714314421595552, 0.04261252000247649] and parameters: {'n_layers': 2, 'embedding_dim': 96, 'lr': 0.0005151812249168082, 'lambda_val': 0.0005031918520424605, 'batch_size': 2277, 'optimizer': 'RMSprop'}.
