2026-06-05 23:21:01,402 - optuna.study.study - INFO - Trial 104 finished with values: [0.03473363892592861, 0.004000602853506598, 0.01596402037348585] and parameters: {'n_layers': 4, 'embedding_dim': 96, 'lr': 0.003797813989642158, 'lambda_val': 6.711434296264996e-05, 'batch_size': 3407, 'optimizer': 'RMSprop'}.
2026-06-05 23:24:54,744 - optuna.study.study - INFO - Trial 105 finished with values: [0.024853801207460623, 0.003593676736553018, 0.012970303664142492] and parameters: {'n_layers': 4, 'embedding_dim': 256, 'lr': 0.0001336135869313187, 'lambda_val': 5.314912869017192e-05, 'batch_size': 2351, 'optimizer': 'Adam'}.
2026-06-05 23:25:24,999 - experiment_functions - INFO - Early stopping at epoch 700. Best Metrics: (0.04537765891955964, 0.00550773662000134, 0.021017176686488597)
2026-06-05 23:25:25,852 - optuna.study.study - INFO - Trial 106 finished with values: [0.04537765891955964, 0.00550773662000134, 0.021017176686488597] and parameters: {'n_layers': 1, 'embedding_dim': 128, 'lr': 0.003797813989642158, 'lambda_val': 0.007710635522261197, 'batch_size': 4018, 'optimizer': 'RMSprop'}.
2026-06-05 23:25:56,210 - experiment_functions - INFO - Early stopping at epoch 700. Best Metrics: (0.06682946266578625, 0.00826244222653895, 0.03464067194887473)
2026-06-05 23:25:56,367 - optuna.study.study - INFO - Trial 107 finished with values: [0.06682946266578625, 0.00826244222653895, 0.03464067194887473] and parameters: {'n_layers': 2, 'embedding_dim': 64, 'lr': 0.003797813989642158, 'lambda_val': 1.2264285179082735e-06, 'batch_size': 1841, 'optimizer': 'Adam'}.
2026-06-05 23:27:26,966 - experiment_functions - INFO - Early stopping at epoch 1500. Best Metrics: (0.06033155684915103, 0.007341416035903275, 0.02994188094601317)
2026-06-05 23:27:27,342 - optuna.study.study - INFO - Trial 108 finished with values: [0.06033155684915103, 0.007341416035903275, 0.02994188094601317] and parameters: {'n_layers': 4, 'embedding_dim': 256, 'lr': 0.0006492139755404522, 'lambda_val': 1.482563488933184e-06, 'batch_size': 1920, 'optimizer': 'Adam'}.
2026-06-05 23:29:13,386 - experiment_functions - INFO - Early stopping at epoch 2650. Best Metrics: (0.05034079049884215, 0.006095518788934289, 0.02468218015611597)
2026-06-05 23:29:13,653 - optuna.study.study - INFO - Trial 109 finished with values: [0.05034079049884215, 0.006095518788934289, 0.02468218015611597] and parameters: {'n_layers': 4, 'embedding_dim': 32, 'lr': 0.0014400532960571737, 'lambda_val': 1.482563488933184e-06, 'batch_size': 755, 'optimizer': 'Adam'}.
2026-06-05 23:29:40,456 - experiment_functions - INFO - Early stopping at epoch 550. Best Metrics: (0.03753645813600617, 0.00451302833411481, 0.018061191509367296)
2026-06-05 23:29:40,550 - optuna.study.study - INFO - Trial 110 finished with values: [0.03753645813600617, 0.00451302833411481, 0.018061191509367296] and parameters: {'n_layers': 3, 'embedding_dim': 128, 'lr': 0.007650229911234196, 'lambda_val': 0.0012508747629343686, 'batch_size': 2853, 'optimizer': 'Adam'}.
2026-06-05 23:33:31,717 - optuna.study.study - INFO - Trial 111 finished with values: [0.023013218877497514, 0.0033307656239533793, 0.012116452219023214] and parameters: {'n_layers': 4, 'embedding_dim': 256, 'lr': 0.0001336135869313187, 'lambda_val': 5.314912869017192e-05, 'batch_size': 1487, 'optimizer': 'RMSprop'}.
2026-06-05 23:36:50,317 - optuna.study.study - INFO - Trial 112 finished with values: [0.04684241453161815, 0.005223055797441222, 0.020816852204040604] and parameters: {'n_layers': 2, 'embedding_dim': 256, 'lr': 0.007650229911234196, 'lambda_val': 2.80429275845163e-06, 'batch_size': 1266, 'optimizer': 'Adam'}.
2026-06-05 23:37:51,427 - experiment_functions - INFO - Early stopping at epoch 1400. Best Metrics: (0.032611141089219996, 0.003851564069931007, 0.01496842277322374)
2026-06-05 23:37:51,745 - optuna.study.study - INFO - Trial 113 finished with values: [0.032611141089219996, 0.003851564069931007, 0.01496842277322374] and parameters: {'n_layers': 4, 'embedding_dim': 64, 'lr': 0.0025949620955328543, 'lambda_val': 0.0002470779691093862, 'batch_size': 3130, 'optimizer': 'RMSprop'}.
2026-06-05 23:40:41,977 - optuna.study.study - INFO - Trial 114 finished with values: [0.08502574708556186, 0.010407595954183134, 0.045445150066067856] and parameters: {'n_layers': 2, 'embedding_dim': 96, 'lr': 0.0008375189225934038, 'lambda_val': 1.482563488933184e-06, 'batch_size': 2005, 'optimizer': 'Adam'}.
2026-06-05 23:42:24,380 - experiment_functions - INFO - Early stopping at epoch 2600. Best Metrics: (0.034193218466362064, 0.004017348784245429, 0.016053058937731898)
2026-06-05 23:42:24,471 - optuna.study.study - INFO - Trial 115 finished with values: [0.034193218466362064, 0.004017348784245429, 0.016053058937731898] and parameters: {'n_layers': 4, 'embedding_dim': 32, 'lr': 0.0025949620955328543, 'lambda_val': 1.2264285179082735e-06, 'batch_size': 1841, 'optimizer': 'RMSprop'}.
2026-06-05 23:45:02,171 - optuna.study.study - INFO - Trial 116 finished with values: [0.04915556056975743, 0.007132091901667894, 0.02872033199995259] and parameters: {'n_layers': 1, 'embedding_dim': 96, 'lr': 0.0006492139755404522, 'lambda_val': 1.9645451789230886e-06, 'batch_size': 1890, 'optimizer': 'Adam'}.
2026-06-05 23:45:24,208 - experiment_functions - INFO - Early stopping at epoch 500. Best Metrics: (0.0005666600693256275, 8.875343291580146e-05, 0.00026028933600322294)
2026-06-05 23:45:25,194 - optuna.study.study - INFO - Trial 117 finished with values: [0.0005666600693256275, 8.875343291580146e-05, 0.00026028933600322294] and parameters: {'n_layers': 3, 'embedding_dim': 64, 'lr': 1.4205989672479234e-05, 'lambda_val': 1.482563488933184e-06, 'batch_size': 3708, 'optimizer': 'Adam'}.
2026-06-05 23:45:48,060 - experiment_functions - INFO - Early stopping at epoch 500. Best Metrics: (0.0005069304218322213, 7.033290910308797e-05, 0.0002291781841693015)
2026-06-05 23:45:48,174 - optuna.study.study - INFO - Trial 118 finished with values: [0.0005069304218322213, 7.033290910308797e-05, 0.0002291781841693015] and parameters: {'n_layers': 2, 'embedding_dim': 128, 'lr': 8.824439602051199e-05, 'lambda_val': 0.001677222142016489, 'batch_size': 2697, 'optimizer': 'RMSprop'}.
2026-06-05 23:47:40,584 - experiment_functions - INFO - Early stopping at epoch 2350. Best Metrics: (0.03332463509569357, 0.0038348181391921763, 0.014719811314001444)
2026-06-05 23:47:40,671 - optuna.study.study - INFO - Trial 119 finished with values: [0.03332463509569357, 0.0038348181391921763, 0.014719811314001444] and parameters: {'n_layers': 4, 'embedding_dim': 128, 'lr': 0.0025949620955328543, 'lambda_val': 1.9645451789230886e-06, 'batch_size': 755, 'optimizer': 'Adam'}.
2026-06-05 23:48:23,848 - experiment_functions - INFO - Early stopping at epoch 1050. Best Metrics: (0.07145760797557535, 0.008433250720075022, 0.035433868612511826)
2026-06-05 23:48:23,941 - optuna.study.study - INFO - Trial 120 finished with values: [0.07145760797557535, 0.008433250720075022, 0.035433868612511826] and parameters: {'n_layers': 1, 'embedding_dim': 64, 'lr': 0.003797813989642158, 'lambda_val': 1.2264285179082735e-06, 'batch_size': 1915, 'optimizer': 'RMSprop'}.
2026-06-05 23:48:52,999 - experiment_functions - INFO - Early stopping at epoch 650. Best Metrics: (0.070955234112042, 0.008997588585973607, 0.037029326490922346)
2026-06-05 23:48:53,335 - optuna.study.study - INFO - Trial 121 finished with values: [0.070955234112042, 0.008997588585973607, 0.037029326490922346] and parameters: {'n_layers': 1, 'embedding_dim': 128, 'lr': 0.007650229911234196, 'lambda_val': 1.0229781127321935e-05, 'batch_size': 2901, 'optimizer': 'Adam'}.
2026-06-05 23:49:48,328 - experiment_functions - INFO - Early stopping at epoch 1350. Best Metrics: (0.05238800926492637, 0.006341683970795095, 0.02707597221150724)
2026-06-05 23:49:48,408 - optuna.study.study - INFO - Trial 122 finished with values: [0.05238800926492637, 0.006341683970795095, 0.02707597221150724] and parameters: {'n_layers': 4, 'embedding_dim': 32, 'lr': 0.0011590275843617274, 'lambda_val': 0.0002470779691093862, 'batch_size': 958, 'optimizer': 'Adam'}.
2026-06-05 23:50:15,141 - experiment_functions - INFO - Early stopping at epoch 600. Best Metrics: (0.05357139307143435, 0.006681626364793355, 0.026919000583571495)
2026-06-05 23:50:15,273 - optuna.study.study - INFO - Trial 123 finished with values: [0.05357139307143435, 0.006681626364793355, 0.026919000583571495] and parameters: {'n_layers': 1, 'embedding_dim': 128, 'lr': 0.016319289862143857, 'lambda_val': 2.80429275845163e-06, 'batch_size': 2901, 'optimizer': 'Adam'}.
2026-06-05 23:50:41,855 - experiment_functions - INFO - Early stopping at epoch 550. Best Metrics: (0.018490598990346805, 0.002396342688726639, 0.008824652334889323)
2026-06-05 23:50:41,953 - optuna.study.study - INFO - Trial 124 finished with values: [0.018490598990346805, 0.002396342688726639, 0.008824652334889323] and parameters: {'n_layers': 4, 'embedding_dim': 96, 'lr': 0.008793986584879794, 'lambda_val': 0.008565798660646664, 'batch_size': 755, 'optimizer': 'Adam'}.
2026-06-05 23:53:37,068 - optuna.study.study - INFO - Trial 125 finished with values: [0.014558178876422922, 0.0024298345502043, 0.008673495139448185] and parameters: {'n_layers': 1, 'embedding_dim': 256, 'lr': 0.00046092521863438257, 'lambda_val': 9.945068556655057e-06, 'batch_size': 1266, 'optimizer': 'Adam'}.
2026-06-05 23:56:27,348 - optuna.study.study - INFO - Trial 126 finished with values: [0.0854637366801912, 0.010382477058074888, 0.04619422908579484] and parameters: {'n_layers': 2, 'embedding_dim': 96, 'lr': 0.0008375189225934038, 'lambda_val': 1.9645451789230886e-06, 'batch_size': 2005, 'optimizer': 'Adam'}.
2026-06-05 23:59:42,538 - optuna.study.study - INFO - Trial 127 finished with values: [0.024853671856149118, 0.003206845736486034, 0.011671916859663978] and parameters: {'n_layers': 2, 'embedding_dim': 256, 'lr': 0.0006492139755404522, 'lambda_val': 0.055208491785824466, 'batch_size': 1266, 'optimizer': 'Adam'}.
2026-06-06 00:02:19,289 - optuna.study.study - INFO - Trial 128 finished with values: [0.07055279379276257, 0.008731328287226206, 0.036526955337799316] and parameters: {'n_layers': 2, 'embedding_dim': 32, 'lr': 0.0008375189225934038, 'lambda_val': 5.314912869017192e-05, 'batch_size': 2351, 'optimizer': 'Adam'}.
2026-06-06 00:04:44,328 - experiment_functions - INFO - Early stopping at epoch 3700. Best Metrics: (0.07257665464952502, 0.00860740839975886, 0.035829231802838035)
2026-06-06 00:04:44,904 - optuna.study.study - INFO - Trial 129 finished with values: [0.07257665464952502, 0.00860740839975886, 0.035829231802838035] and parameters: {'n_layers': 1, 'embedding_dim': 64, 'lr': 0.003797813989642158, 'lambda_val': 1.8874302546405528e-06, 'batch_size': 738, 'optimizer': 'RMSprop'}.
2026-06-06 00:05:09,161 - experiment_functions - INFO - Early stopping at epoch 500. Best Metrics: (0.0004728583846031242, 7.2007502176971e-05, 0.00022424636887507992)
2026-06-06 00:05:09,701 - optuna.study.study - INFO - Trial 130 finished with values: [0.0004728583846031242, 7.2007502176971e-05, 0.00022424636887507992] and parameters: {'n_layers': 3, 'embedding_dim': 128, 'lr': 1.582365727029881e-05, 'lambda_val': 1.0229781127321935e-05, 'batch_size': 752, 'optimizer': 'RMSprop'}.
2026-06-06 00:07:53,204 - optuna.study.study - INFO - Trial 131 finished with values: [0.09106729942698844, 0.011018822426150446, 0.04781547187312134] and parameters: {'n_layers': 1, 'embedding_dim': 96, 'lr': 0.0025949620955328543, 'lambda_val': 1.9645451789230886e-06, 'batch_size': 755, 'optimizer': 'Adam'}.
2026-06-06 00:08:22,595 - experiment_functions - INFO - Early stopping at epoch 550. Best Metrics: (0.028664012326985594, 0.0034546855114207255, 0.013458497341728597)
2026-06-06 00:08:23,286 - optuna.study.study - INFO - Trial 132 finished with values: [0.028664012326985594, 0.0034546855114207255, 0.013458497341728597] and parameters: {'n_layers': 2, 'embedding_dim': 256, 'lr': 0.008793986584879794, 'lambda_val': 0.00191214395764258, 'batch_size': 1266, 'optimizer': 'Adam'}.
2026-06-06 00:09:37,407 - experiment_functions - INFO - Early stopping at epoch 1350. Best Metrics: (0.037580269237037355, 0.004625226070064974, 0.017296003436974745)
2026-06-06 00:09:37,527 - optuna.study.study - INFO - Trial 133 finished with values: [0.037580269237037355, 0.004625226070064974, 0.017296003436974745] and parameters: {'n_layers': 3, 'embedding_dim': 256, 'lr': 0.0006492139755404522, 'lambda_val': 0.007710635522261197, 'batch_size': 1599, 'optimizer': 'RMSprop'}.
2026-06-06 00:10:54,143 - experiment_functions - INFO - Early stopping at epoch 1250. Best Metrics: (0.05802685498887006, 0.006957934221984057, 0.02831804467769196)
2026-06-06 00:10:54,612 - optuna.study.study - INFO - Trial 134 finished with values: [0.05802685498887006, 0.006957934221984057, 0.02831804467769196] and parameters: {'n_layers': 4, 'embedding_dim': 256, 'lr': 0.0006492139755404522, 'lambda_val': 5.314912869017192e-05, 'batch_size': 2351, 'optimizer': 'Adam'}.
2026-06-06 00:14:08,361 - optuna.study.study - INFO - Trial 135 finished with values: [0.05965710981471482, 0.007237591265322527, 0.028719394004294962] and parameters: {'n_layers': 4, 'embedding_dim': 128, 'lr': 0.0006492139755404522, 'lambda_val': 5.023119231407218e-05, 'batch_size': 1266, 'optimizer': 'Adam'}.
2026-06-06 00:16:56,377 - optuna.study.study - INFO - Trial 136 finished with values: [0.06354519232909059, 0.007631120637685043, 0.031309135842372146] and parameters: {'n_layers': 3, 'embedding_dim': 64, 'lr': 0.0005984874691553314, 'lambda_val': 1.0229781127321935e-05, 'batch_size': 3853, 'optimizer': 'Adam'}.
2026-06-06 00:20:29,256 - optuna.study.study - INFO - Trial 137 finished with values: [0.019028666911700045, 0.0030310134637283144, 0.00972082540113259] and parameters: {'n_layers': 3, 'embedding_dim': 256, 'lr': 0.00020900924353094014, 'lambda_val': 0.006909805852222459, 'batch_size': 755, 'optimizer': 'RMSprop'}.
2026-06-06 00:21:44,338 - experiment_functions - INFO - Early stopping at epoch 1800. Best Metrics: (0.0818839669699056, 0.009793020296068055, 0.04160372278012383)
2026-06-06 00:21:44,806 - optuna.study.study - INFO - Trial 138 finished with values: [0.0818839669699056, 0.009793020296068055, 0.04160372278012383] and parameters: {'n_layers': 1, 'embedding_dim': 96, 'lr': 0.0025949620955328543, 'lambda_val': 2.80429275845163e-06, 'batch_size': 1890, 'optimizer': 'RMSprop'}.
2026-06-06 00:22:07,974 - experiment_functions - INFO - Early stopping at epoch 550. Best Metrics: (0.007096592216354206, 0.0010315493335119566, 0.0033193836247037397)
2026-06-06 00:22:08,348 - optuna.study.study - INFO - Trial 139 finished with values: [0.007096592216354206, 0.0010315493335119566, 0.0033193836247037397] and parameters: {'n_layers': 4, 'embedding_dim': 32, 'lr': 0.0025949620955328543, 'lambda_val': 0.08586254535169426, 'batch_size': 614, 'optimizer': 'RMSprop'}.
2026-06-06 00:23:37,056 - experiment_functions - INFO - Early stopping at epoch 2250. Best Metrics: (0.05762240470239932, 0.006738562529305379, 0.028286298711706067)
2026-06-06 00:23:37,138 - optuna.study.study - INFO - Trial 140 finished with values: [0.05762240470239932, 0.006738562529305379, 0.028286298711706067] and parameters: {'n_layers': 1, 'embedding_dim': 64, 'lr': 0.007650229911234196, 'lambda_val': 2.80429275845163e-06, 'batch_size': 639, 'optimizer': 'Adam'}.
2026-06-06 00:26:05,409 - optuna.study.study - INFO - Trial 141 finished with values: [0.00667871799298827, 0.001190635675530846, 0.0039312674323109505] and parameters: {'n_layers': 1, 'embedding_dim': 64, 'lr': 0.0005984874691553314, 'lambda_val': 1.0229781127321935e-05, 'batch_size': 755, 'optimizer': 'Adam'}.
2026-06-06 00:26:37,911 - experiment_functions - INFO - Early stopping at epoch 750. Best Metrics: (0.0657008269810774, 0.00813014937370219, 0.0335851986154375)
2026-06-06 00:26:38,022 - optuna.study.study - INFO - Trial 142 finished with values: [0.0657008269810774, 0.00813014937370219, 0.0335851986154375] and parameters: {'n_layers': 1, 'embedding_dim': 96, 'lr': 0.007650229911234196, 'lambda_val': 2.80429275845163e-06, 'batch_size': 1477, 'optimizer': 'Adam'}.
2026-06-06 00:29:41,709 - optuna.study.study - INFO - Trial 143 finished with values: [0.0833705947295824, 0.010742514568959746, 0.0448210297616679] and parameters: {'n_layers': 1, 'embedding_dim': 256, 'lr': 0.0006492139755404522, 'lambda_val': 1.482563488933184e-06, 'batch_size': 3734, 'optimizer': 'Adam'}.
2026-06-06 00:32:30,526 - optuna.study.study - INFO - Trial 144 finished with values: [0.051259384691300994, 0.006018487507535669, 0.024217951480037386] and parameters: {'n_layers': 4, 'embedding_dim': 64, 'lr': 0.0011525517839870857, 'lambda_val': 1.0229781127321935e-05, 'batch_size': 639, 'optimizer': 'Adam'}.
2026-06-06 00:35:51,839 - optuna.study.study - INFO - Trial 145 finished with values: [0.08421013091931964, 0.010335588452006163, 0.04579289174017562] and parameters: {'n_layers': 2, 'embedding_dim': 256, 'lr': 0.0006492139755404522, 'lambda_val': 1.5739380446754205e-06, 'batch_size': 1266, 'optimizer': 'Adam'}.
2026-06-06 00:37:23,507 - experiment_functions - INFO - Early stopping at epoch 2200. Best Metrics: (0.040508262966687456, 0.004558242347109653, 0.018437049961684007)
2026-06-06 00:37:23,627 - optuna.study.study - INFO - Trial 146 finished with values: [0.040508262966687456, 0.004558242347109653, 0.018437049961684007] and parameters: {'n_layers': 3, 'embedding_dim': 64, 'lr': 0.003797813989642158, 'lambda_val': 7.4032238942432714e-06, 'batch_size': 3516, 'optimizer': 'RMSprop'}.
2026-06-06 00:37:56,000 - experiment_functions - INFO - Early stopping at epoch 750. Best Metrics: (0.060498098535140404, 0.007562462321655839, 0.030649877414736876)
2026-06-06 00:37:56,083 - optuna.study.study - INFO - Trial 147 finished with values: [0.060498098535140404, 0.007562462321655839, 0.030649877414736876] and parameters: {'n_layers': 1, 'embedding_dim': 96, 'lr': 0.0030777772444340735, 'lambda_val': 0.00191214395764258, 'batch_size': 1890, 'optimizer': 'RMSprop'}.
2026-06-06 00:40:31,648 - optuna.study.study - INFO - Trial 148 finished with values: [0.021977566687213793, 0.0034932011521200354, 0.012011311253432234] and parameters: {'n_layers': 2, 'embedding_dim': 64, 'lr': 0.00034607757694671775, 'lambda_val': 9.945068556655057e-06, 'batch_size': 1266, 'optimizer': 'Adam'}.
2026-06-06 00:43:02,045 - optuna.study.study - INFO - Trial 149 finished with values: [0.012755037483889087, 0.0021635742514568962, 0.007302226139784031] and parameters: {'n_layers': 1, 'embedding_dim': 64, 'lr': 0.00034607757694671775, 'lambda_val': 1.9645451789230886e-06, 'batch_size': 3427, 'optimizer': 'Adam'}.
2026-06-06 00:43:50,360 - experiment_functions - INFO - Early stopping at epoch 1100. Best Metrics: (0.07551912131847001, 0.009273896443164311, 0.03780129531540931)
2026-06-06 00:43:50,469 - optuna.study.study - INFO - Trial 150 finished with values: [0.07551912131847001, 0.009273896443164311, 0.03780129531540931] and parameters: {'n_layers': 2, 'embedding_dim': 96, 'lr': 0.0011590275843617274, 'lambda_val': 0.0002470779691093862, 'batch_size': 3734, 'optimizer': 'Adam'}.
2026-06-06 00:44:39,650 - experiment_functions - INFO - Early stopping at epoch 1200. Best Metrics: (0.045708869591733925, 0.005599839239064908, 0.02207145637011981)
2026-06-06 00:44:40,230 - optuna.study.study - INFO - Trial 151 finished with values: [0.045708869591733925, 0.005599839239064908, 0.02207145637011981] and parameters: {'n_layers': 4, 'embedding_dim': 32, 'lr': 0.0014400532960571737, 'lambda_val': 1.9645451789230886e-06, 'batch_size': 1890, 'optimizer': 'Adam'}.
2026-06-06 00:46:25,047 - experiment_functions - INFO - Early stopping at epoch 2550. Best Metrics: (0.08340105684252057, 0.009926987741978699, 0.042049373122779975)
2026-06-06 00:46:25,748 - optuna.study.study - INFO - Trial 152 finished with values: [0.08340105684252057, 0.009926987741978699, 0.042049373122779975] and parameters: {'n_layers': 1, 'embedding_dim': 96, 'lr': 0.0025949620955328543, 'lambda_val': 1.9645451789230886e-06, 'batch_size': 1890, 'optimizer': 'RMSprop'}.
2026-06-06 00:46:48,995 - experiment_functions - INFO - Early stopping at epoch 500. Best Metrics: (0.0005210847941439407, 5.3586978364257486e-05, 0.0002162370955969419)
2026-06-06 00:46:49,079 - optuna.study.study - INFO - Trial 153 finished with values: [0.0005210847941439407, 5.3586978364257486e-05, 0.0002162370955969419] and parameters: {'n_layers': 2, 'embedding_dim': 128, 'lr': 0.0006492139755404522, 'lambda_val': 1.5739380446754205e-06, 'batch_size': 3853, 'optimizer': 'SGD'}.
2026-06-06 00:47:38,787 - experiment_functions - INFO - Early stopping at epoch 1050. Best Metrics: (0.04821764923013927, 0.005846004420925715, 0.023357969288370906)
2026-06-06 00:47:39,584 - optuna.study.study - INFO - Trial 154 finished with values: [0.04821764923013927, 0.005846004420925715, 0.023357969288370906] and parameters: {'n_layers': 4, 'embedding_dim': 96, 'lr': 0.0011525517839870857, 'lambda_val': 1.0229781127321935e-05, 'batch_size': 2005, 'optimizer': 'Adam'}.
2026-06-06 00:48:01,053 - experiment_functions - INFO - Early stopping at epoch 500. Best Metrics: (0.0005167181436333753, 8.205506062026927e-05, 0.00022207083290739696)
2026-06-06 00:48:01,149 - optuna.study.study - INFO - Trial 155 finished with values: [0.0005167181436333753, 8.205506062026927e-05, 0.00022207083290739696] and parameters: {'n_layers': 1, 'embedding_dim': 96, 'lr': 0.00034607757694671775, 'lambda_val': 0.02587860956145783, 'batch_size': 3533, 'optimizer': 'Adam'}.
2026-06-06 00:48:52,369 - experiment_functions - INFO - Early stopping at epoch 1250. Best Metrics: (0.040167741586236726, 0.004724027061424075, 0.01833409556626856)
