2026-06-04 05:54:42,948 - optuna.study.study - INFO - Trial 2 finished with values: [0.004548719052753143, 0.0008607408399758859, 0.0024833558670482093] and parameters: {'n_layers': 1, 'embedding_dim': 256, 'lr': 0.016201446778311295, 'lambda_val': 0.0012865728517446665, 'batch_size': 3199, 'optimizer': 'Adam'}.
2026-06-04 05:55:04,074 - experiment_functions - INFO - Early stopping at epoch 500. Best Metrics: (0.0004027130270119013, 6.0285350659789674e-05, 0.00017695100715877916)
2026-06-04 05:55:04,412 - optuna.study.study - INFO - Trial 3 finished with values: [0.0004027130270119013, 6.0285350659789674e-05, 0.00017695100715877916] and parameters: {'n_layers': 3, 'embedding_dim': 64, 'lr': 0.08110150541170548, 'lambda_val': 0.00041860760081866575, 'batch_size': 890, 'optimizer': 'SGD'}.
2026-06-04 05:55:24,660 - experiment_functions - INFO - Early stopping at epoch 500. Best Metrics: (0.00041799767979862855, 7.033290910308795e-05, 0.00020873236239005773)
2026-06-04 05:55:25,197 - optuna.study.study - INFO - Trial 4 finished with values: [0.00041799767979862855, 7.033290910308795e-05, 0.00020873236239005773] and parameters: {'n_layers': 1, 'embedding_dim': 32, 'lr': 0.0014490745598287457, 'lambda_val': 0.0017232366847329667, 'batch_size': 2426, 'optimizer': 'SGD'}.
2026-06-04 05:55:49,717 - experiment_functions - INFO - Early stopping at epoch 550. Best Metrics: (0.00601689736916006, 0.001036573112733606, 0.003616068261363627)
2026-06-04 05:55:50,702 - optuna.study.study - INFO - Trial 5 finished with values: [0.00601689736916006, 0.001036573112733606, 0.003616068261363627] and parameters: {'n_layers': 3, 'embedding_dim': 96, 'lr': 0.0037544382096841252, 'lambda_val': 0.0007134174480893843, 'batch_size': 3497, 'optimizer': 'RMSprop'}.
2026-06-04 05:56:18,603 - experiment_functions - INFO - Early stopping at epoch 600. Best Metrics: (0.0006291127588036579, 7.368209525085404e-05, 0.0002854478902607083)
2026-06-04 05:56:18,755 - optuna.study.study - INFO - Trial 6 finished with values: [0.0006291127588036579, 7.368209525085404e-05, 0.0002854478902607083] and parameters: {'n_layers': 4, 'embedding_dim': 128, 'lr': 2.755919682292746e-05, 'lambda_val': 0.01892219057190362, 'batch_size': 2313, 'optimizer': 'RMSprop'}.
2026-06-04 05:58:45,794 - optuna.study.study - INFO - Trial 7 finished with values: [0.001809110974029843, 0.00025453814723022303, 0.0009640159587971473] and parameters: {'n_layers': 3, 'embedding_dim': 32, 'lr': 0.00013893843173396516, 'lambda_val': 9.583246688763602e-06, 'batch_size': 3616, 'optimizer': 'Adam'}.
2026-06-04 05:59:08,662 - experiment_functions - INFO - Early stopping at epoch 500. Best Metrics: (0.0021216143076787366, 0.00037343425547591935, 0.0012155444319962483)
2026-06-04 05:59:08,799 - optuna.study.study - INFO - Trial 8 finished with values: [0.0021216143076787366, 0.00037343425547591935, 0.0012155444319962483] and parameters: {'n_layers': 4, 'embedding_dim': 96, 'lr': 0.057615183260291636, 'lambda_val': 0.0913709160623431, 'batch_size': 1466, 'optimizer': 'RMSprop'}.
2026-06-04 05:59:35,789 - experiment_functions - INFO - Early stopping at epoch 650. Best Metrics: (0.0003861195308727251, 6.530912988143882e-05, 0.00017330395335091831)
2026-06-04 05:59:36,111 - optuna.study.study - INFO - Trial 9 finished with values: [0.0003861195308727251, 6.530912988143882e-05, 0.00017330395335091831] and parameters: {'n_layers': 1, 'embedding_dim': 128, 'lr': 5.477727826900318e-05, 'lambda_val': 0.02189391626838075, 'batch_size': 3116, 'optimizer': 'RMSprop'}.
2026-06-04 06:00:00,458 - experiment_functions - INFO - Early stopping at epoch 550. Best Metrics: (0.004262258142200733, 0.0007066782771786457, 0.0024735207907360186)
2026-06-04 06:00:00,566 - optuna.study.study - INFO - Trial 10 finished with values: [0.004262258142200733, 0.0007066782771786457, 0.0024735207907360186] and parameters: {'n_layers': 3, 'embedding_dim': 96, 'lr': 0.0692061798584086, 'lambda_val': 2.467412737881427e-06, 'batch_size': 2807, 'optimizer': 'Adam'}.
2026-06-04 06:01:12,850 - experiment_functions - INFO - Early stopping at epoch 1900. Best Metrics: (0.004560974717040092, 0.0008540424676803537, 0.0024933949267461454)
2026-06-04 06:01:13,171 - optuna.study.study - INFO - Trial 11 finished with values: [0.004560974717040092, 0.0008540424676803537, 0.0024933949267461454] and parameters: {'n_layers': 1, 'embedding_dim': 96, 'lr': 0.014539947333675968, 'lambda_val': 0.009754411019917267, 'batch_size': 2156, 'optimizer': 'RMSprop'}.
2026-06-04 06:01:51,725 - experiment_functions - INFO - Early stopping at epoch 850. Best Metrics: (0.004129040548571316, 0.0007820349655033826, 0.0023992253117594694)
2026-06-04 06:01:51,876 - optuna.study.study - INFO - Trial 12 finished with values: [0.004129040548571316, 0.0007820349655033826, 0.0023992253117594694] and parameters: {'n_layers': 4, 'embedding_dim': 128, 'lr': 0.007982799603933596, 'lambda_val': 0.039618002209163034, 'batch_size': 3544, 'optimizer': 'RMSprop'}.
2026-06-04 06:03:26,185 - experiment_functions - INFO - Early stopping at epoch 2500. Best Metrics: (0.005849432589317957, 0.0009109786321923773, 0.0033309830217887033)
2026-06-04 06:03:26,454 - optuna.study.study - INFO - Trial 13 finished with values: [0.005849432589317957, 0.0009109786321923773, 0.0033309830217887033] and parameters: {'n_layers': 1, 'embedding_dim': 96, 'lr': 0.0010273844172621362, 'lambda_val': 2.8077752105590774e-05, 'batch_size': 2639, 'optimizer': 'RMSprop'}.
2026-06-04 06:03:47,392 - experiment_functions - INFO - Early stopping at epoch 500. Best Metrics: (0.0006010639431930391, 8.038046754638624e-05, 0.0002978914950819489)
2026-06-04 06:03:48,584 - optuna.study.study - INFO - Trial 14 finished with values: [0.0006010639431930391, 8.038046754638624e-05, 0.0002978914950819489] and parameters: {'n_layers': 1, 'embedding_dim': 128, 'lr': 0.00843920102738802, 'lambda_val': 1.7529861154844532e-06, 'batch_size': 2315, 'optimizer': 'SGD'}.
2026-06-04 06:06:22,493 - optuna.study.study - INFO - Trial 15 finished with values: [0.004850628052027129, 0.0008021300823899792, 0.003066117284484153] and parameters: {'n_layers': 4, 'embedding_dim': 64, 'lr': 0.00028236588427973475, 'lambda_val': 0.0002748178610784401, 'batch_size': 775, 'optimizer': 'RMSprop'}.
2026-06-04 06:09:30,928 - optuna.study.study - INFO - Trial 16 finished with values: [0.005381164527545903, 0.0009327483421528569, 0.0032282553506685586] and parameters: {'n_layers': 3, 'embedding_dim': 256, 'lr': 0.0002170623403356149, 'lambda_val': 2.2233828008365298e-05, 'batch_size': 3339, 'optimizer': 'Adam'}.
2026-06-04 06:11:45,526 - experiment_functions - INFO - Early stopping at epoch 3550. Best Metrics: (0.0005365185032716612, 8.540424676803538e-05, 0.0002646020176659865)
2026-06-04 06:11:46,086 - optuna.study.study - INFO - Trial 17 finished with values: [0.0005365185032716612, 8.540424676803538e-05, 0.0002646020176659865] and parameters: {'n_layers': 1, 'embedding_dim': 128, 'lr': 1.220354289346838e-05, 'lambda_val': 0.001725198812045786, 'batch_size': 2941, 'optimizer': 'RMSprop'}.
2026-06-04 06:12:07,928 - experiment_functions - INFO - Early stopping at epoch 500. Best Metrics: (0.00037457548770902566, 5.861075758590662e-05, 0.00017804857099763512)
2026-06-04 06:12:08,022 - optuna.study.study - INFO - Trial 18 finished with values: [0.00037457548770902566, 5.861075758590662e-05, 0.00017804857099763512] and parameters: {'n_layers': 3, 'embedding_dim': 96, 'lr': 0.00010816547046590807, 'lambda_val': 0.00021982418894933619, 'batch_size': 1398, 'optimizer': 'SGD'}.
2026-06-04 06:14:40,308 - optuna.study.study - INFO - Trial 19 finished with values: [0.0020224647995032543, 0.000289704601781767, 0.0010406064965742632] and parameters: {'n_layers': 1, 'embedding_dim': 128, 'lr': 0.0001686972750133445, 'lambda_val': 3.1261859941007923e-06, 'batch_size': 2619, 'optimizer': 'RMSprop'}.
2026-06-04 06:15:00,760 - experiment_functions - INFO - Early stopping at epoch 500. Best Metrics: (0.0006977137324913902, 8.540424676803537e-05, 0.00028362612321952967)
2026-06-04 06:15:00,909 - optuna.study.study - INFO - Trial 20 finished with values: [0.0006977137324913902, 8.540424676803537e-05, 0.00028362612321952967] and parameters: {'n_layers': 4, 'embedding_dim': 32, 'lr': 4.161663982964273e-05, 'lambda_val': 4.0972501239992526e-06, 'batch_size': 1496, 'optimizer': 'SGD'}.
2026-06-04 06:15:28,807 - experiment_functions - INFO - Early stopping at epoch 500. Best Metrics: (0.0007733165421222222, 9.377721213745061e-05, 0.00035924449907753856)
2026-06-04 06:15:29,529 - optuna.study.study - INFO - Trial 21 finished with values: [0.0007733165421222222, 9.377721213745061e-05, 0.00035924449907753856] and parameters: {'n_layers': 4, 'embedding_dim': 256, 'lr': 3.8421037634249e-05, 'lambda_val': 0.00016114073645453217, 'batch_size': 1054, 'optimizer': 'SGD'}.
2026-06-04 06:15:53,380 - experiment_functions - INFO - Early stopping at epoch 500. Best Metrics: (0.0005117125749787014, 6.530912988143882e-05, 0.00023241993458704554)
2026-06-04 06:15:53,814 - optuna.study.study - INFO - Trial 22 finished with values: [0.0005117125749787014, 6.530912988143882e-05, 0.00023241993458704554] and parameters: {'n_layers': 2, 'embedding_dim': 256, 'lr': 0.00021404446865611144, 'lambda_val': 0.013425866272857795, 'batch_size': 725, 'optimizer': 'SGD'}.
2026-06-04 06:18:32,115 - optuna.study.study - INFO - Trial 23 finished with values: [0.00337367214456432, 0.00047558443298278524, 0.00195096236309825] and parameters: {'n_layers': 3, 'embedding_dim': 96, 'lr': 0.00018443974637780152, 'lambda_val': 7.217508821223787e-05, 'batch_size': 2482, 'optimizer': 'RMSprop'}.
2026-06-04 06:18:54,695 - experiment_functions - INFO - Early stopping at epoch 550. Best Metrics: (0.0036725512359198713, 0.0007050036841047626, 0.002116234270436045)
2026-06-04 06:18:54,778 - optuna.study.study - INFO - Trial 24 finished with values: [0.0036725512359198713, 0.0007050036841047626, 0.002116234270436045] and parameters: {'n_layers': 4, 'embedding_dim': 32, 'lr': 0.006374731525389089, 'lambda_val': 0.008774895079304625, 'batch_size': 2446, 'optimizer': 'RMSprop'}.
2026-06-04 06:19:27,386 - experiment_functions - INFO - Early stopping at epoch 750. Best Metrics: (0.0007068341283732268, 8.875343291580147e-05, 0.00030720219189655417)
2026-06-04 06:19:27,472 - optuna.study.study - INFO - Trial 25 finished with values: [0.0007068341283732268, 8.875343291580147e-05, 0.00030720219189655417] and parameters: {'n_layers': 1, 'embedding_dim': 256, 'lr': 3.515353448488146e-05, 'lambda_val': 1.4058453603980198e-05, 'batch_size': 3117, 'optimizer': 'Adam'}.
2026-06-04 06:22:02,507 - optuna.study.study - INFO - Trial 26 finished with values: [0.0031330656175167955, 0.00046051309531783773, 0.0017018222277269991] and parameters: {'n_layers': 3, 'embedding_dim': 96, 'lr': 0.00023367406244930206, 'lambda_val': 0.00017552517498145025, 'batch_size': 1077, 'optimizer': 'Adam'}.
2026-06-04 06:22:32,293 - experiment_functions - INFO - Early stopping at epoch 550. Best Metrics: (0.00540827434525639, 0.0009997320651081788, 0.0030403384352644964)
2026-06-04 06:22:33,479 - optuna.study.study - INFO - Trial 27 finished with values: [0.00540827434525639, 0.0009997320651081788, 0.0030403384352644964] and parameters: {'n_layers': 4, 'embedding_dim': 256, 'lr': 0.0044385330633786016, 'lambda_val': 0.0028698778902023414, 'batch_size': 3649, 'optimizer': 'RMSprop'}.
2026-06-04 06:23:17,912 - experiment_functions - INFO - Early stopping at epoch 900. Best Metrics: (0.0058959485700890366, 0.0011085806149105767, 0.00343286827250712)
2026-06-04 06:23:17,992 - optuna.study.study - INFO - Trial 28 finished with values: [0.0058959485700890366, 0.0011085806149105767, 0.00343286827250712] and parameters: {'n_layers': 3, 'embedding_dim': 256, 'lr': 0.0009993931731412705, 'lambda_val': 0.0054022876436497684, 'batch_size': 3469, 'optimizer': 'Adam'}.
2026-06-04 06:24:19,045 - experiment_functions - INFO - Early stopping at epoch 1450. Best Metrics: (0.0004866101786818769, 0.00010382477058074888, 0.00024212639464180394)
2026-06-04 06:24:19,141 - optuna.study.study - INFO - Trial 29 finished with values: [0.0004866101786818769, 0.00010382477058074888, 0.00024212639464180394] and parameters: {'n_layers': 1, 'embedding_dim': 256, 'lr': 4.788781574741185e-05, 'lambda_val': 0.0009081705461319978, 'batch_size': 3419, 'optimizer': 'Adam'}.
2026-06-04 06:24:48,686 - experiment_functions - INFO - Early stopping at epoch 750. Best Metrics: (0.00582242378725227, 0.001013128809699243, 0.0033717828079449456)
2026-06-04 06:24:48,764 - optuna.study.study - INFO - Trial 30 finished with values: [0.00582242378725227, 0.001013128809699243, 0.0033717828079449456] and parameters: {'n_layers': 2, 'embedding_dim': 64, 'lr': 0.004074850116282639, 'lambda_val': 0.0005151967667694534, 'batch_size': 1888, 'optimizer': 'Adam'}.
2026-06-04 06:26:01,523 - experiment_functions - INFO - Early stopping at epoch 1900. Best Metrics: (0.004093028705115059, 0.0007853841516511488, 0.0023656886433808936)
2026-06-04 06:26:01,610 - optuna.study.study - INFO - Trial 31 finished with values: [0.004093028705115059, 0.0007853841516511488, 0.0023656886433808936] and parameters: {'n_layers': 1, 'embedding_dim': 128, 'lr': 0.019127564392418365, 'lambda_val': 9.989132188829677e-05, 'batch_size': 3112, 'optimizer': 'RMSprop'}.
2026-06-04 06:28:43,249 - experiment_functions - INFO - Early stopping at epoch 3900. Best Metrics: (0.004252817178823375, 0.0007954317100944472, 0.002461599737561954)
2026-06-04 06:28:43,331 - optuna.study.study - INFO - Trial 32 finished with values: [0.004252817178823375, 0.0007954317100944472, 0.002461599737561954] and parameters: {'n_layers': 1, 'embedding_dim': 256, 'lr': 0.0010442431692131513, 'lambda_val': 0.029761245184599175, 'batch_size': 945, 'optimizer': 'Adam'}.
2026-06-04 06:29:14,121 - experiment_functions - INFO - Early stopping at epoch 650. Best Metrics: (0.004985855556987754, 0.0008959072945274298, 0.002931273055020561)
2026-06-04 06:29:14,202 - optuna.study.study - INFO - Trial 33 finished with values: [0.004985855556987754, 0.0008959072945274298, 0.002931273055020561] and parameters: {'n_layers': 2, 'embedding_dim': 256, 'lr': 0.006723362184220212, 'lambda_val': 0.00014523930854886327, 'batch_size': 1658, 'optimizer': 'RMSprop'}.
2026-06-04 06:30:02,573 - experiment_functions - INFO - Early stopping at epoch 1150. Best Metrics: (0.004212503038530342, 0.0007669636278384354, 0.002327382779350175)
2026-06-04 06:30:02,672 - optuna.study.study - INFO - Trial 34 finished with values: [0.004212503038530342, 0.0007669636278384354, 0.002327382779350175] and parameters: {'n_layers': 4, 'embedding_dim': 96, 'lr': 0.008086415193231163, 'lambda_val': 0.018714744804770398, 'batch_size': 4048, 'optimizer': 'RMSprop'}.
2026-06-04 06:30:22,839 - experiment_functions - INFO - Early stopping at epoch 500. Best Metrics: (0.0004216986078516101, 6.53091298814388e-05, 0.0002610184744650625)
2026-06-04 06:30:23,903 - optuna.study.study - INFO - Trial 35 finished with values: [0.0004216986078516101, 6.53091298814388e-05, 0.0002610184744650625] and parameters: {'n_layers': 3, 'embedding_dim': 32, 'lr': 0.000283368504752352, 'lambda_val': 2.3395771401165866e-06, 'batch_size': 810, 'optimizer': 'SGD'}.
2026-06-04 06:30:43,965 - experiment_functions - INFO - Early stopping at epoch 500. Best Metrics: (0.0006251731572169116, 0.00010215017750686583, 0.00029126480192214334)
2026-06-04 06:30:44,821 - optuna.study.study - INFO - Trial 36 finished with values: [0.0006251731572169116, 0.00010215017750686583, 0.00029126480192214334] and parameters: {'n_layers': 1, 'embedding_dim': 64, 'lr': 0.04700651621294063, 'lambda_val': 0.004312635774464951, 'batch_size': 2481, 'optimizer': 'SGD'}.
2026-06-04 06:33:03,295 - experiment_functions - INFO - Early stopping at epoch 3850. Best Metrics: (0.0016117551576729588, 0.0002545381472302231, 0.0008062280063198232)
2026-06-04 06:33:03,390 - optuna.study.study - INFO - Trial 37 finished with values: [0.0016117551576729588, 0.0002545381472302231, 0.0008062280063198232] and parameters: {'n_layers': 2, 'embedding_dim': 32, 'lr': 0.00017247251739345996, 'lambda_val': 0.0002789985957451779, 'batch_size': 3058, 'optimizer': 'RMSprop'}.
2026-06-04 06:34:06,467 - experiment_functions - INFO - Early stopping at epoch 1650. Best Metrics: (0.004166345703281154, 0.0007803603724294998, 0.0023413333734944113)
2026-06-04 06:34:06,558 - optuna.study.study - INFO - Trial 38 finished with values: [0.004166345703281154, 0.0007803603724294998, 0.0023413333734944113] and parameters: {'n_layers': 1, 'embedding_dim': 96, 'lr': 0.03811330606468482, 'lambda_val': 0.0018633893015272906, 'batch_size': 3087, 'optimizer': 'Adam'}.
2026-06-04 06:35:04,481 - experiment_functions - INFO - Early stopping at epoch 1550. Best Metrics: (0.002946573261865407, 0.0005559649005291715, 0.001737182470344327)
2026-06-04 06:35:04,563 - optuna.study.study - INFO - Trial 39 finished with values: [0.002946573261865407, 0.0005559649005291715, 0.001737182470344327] and parameters: {'n_layers': 3, 'embedding_dim': 32, 'lr': 0.07738255632893443, 'lambda_val': 0.01074069428419912, 'batch_size': 1179, 'optimizer': 'Adam'}.
2026-06-04 06:35:55,300 - experiment_functions - INFO - Early stopping at epoch 1100. Best Metrics: (0.006729490533750023, 0.0012157545716390918, 0.0040721207424376064)
2026-06-04 06:35:55,646 - optuna.study.study - INFO - Trial 40 finished with values: [0.006729490533750023, 0.0012157545716390918, 0.0040721207424376064] and parameters: {'n_layers': 2, 'embedding_dim': 256, 'lr': 0.0013876621562912753, 'lambda_val': 6.1407786046843e-05, 'batch_size': 1839, 'optimizer': 'RMSprop'}.
2026-06-04 06:36:16,514 - experiment_functions - INFO - Early stopping at epoch 500. Best Metrics: (0.0005063087058549379, 7.368209525085404e-05, 0.0001963854559372566)
2026-06-04 06:36:17,605 - optuna.study.study - INFO - Trial 41 finished with values: [0.0005063087058549379, 7.368209525085404e-05, 0.0001963854559372566] and parameters: {'n_layers': 3, 'embedding_dim': 64, 'lr': 0.01360362471370135, 'lambda_val': 0.0010677914680667325, 'batch_size': 720, 'optimizer': 'SGD'}.
2026-06-04 06:36:43,320 - experiment_functions - INFO - Early stopping at epoch 550. Best Metrics: (0.005027542914225265, 0.0009227007837095586, 0.0028840939327272413)
2026-06-04 06:36:44,525 - optuna.study.study - INFO - Trial 42 finished with values: [0.005027542914225265, 0.0009227007837095586, 0.0028840939327272413] and parameters: {'n_layers': 4, 'embedding_dim': 128, 'lr': 0.011472785289985216, 'lambda_val': 0.006409139170390952, 'batch_size': 3961, 'optimizer': 'Adam'}.
2026-06-04 06:37:13,446 - experiment_functions - INFO - Early stopping at epoch 700. Best Metrics: (0.003290261739586565, 0.0006145756581150781, 0.002121297300079815)
2026-06-04 06:37:14,201 - optuna.study.study - INFO - Trial 43 finished with values: [0.003290261739586565, 0.0006145756581150781, 0.002121297300079815] and parameters: {'n_layers': 2, 'embedding_dim': 96, 'lr': 0.02818910190002765, 'lambda_val': 2.1052099842147924e-05, 'batch_size': 2351, 'optimizer': 'RMSprop'}.
2026-06-04 06:40:13,076 - optuna.study.study - INFO - Trial 44 finished with values: [0.006290208240129638, 0.001083461718802331, 0.0036537589877747964] and parameters: {'n_layers': 2, 'embedding_dim': 256, 'lr': 0.0005623238238546706, 'lambda_val': 4.446523827876978e-06, 'batch_size': 1427, 'optimizer': 'Adam'}.
2026-06-04 06:40:51,791 - experiment_functions - INFO - Early stopping at epoch 950. Best Metrics: (0.005387062844739723, 0.0009545180521133364, 0.0031950253845604267)
2026-06-04 06:40:51,879 - optuna.study.study - INFO - Trial 45 finished with values: [0.005387062844739723, 0.0009545180521133364, 0.0031950253845604267] and parameters: {'n_layers': 2, 'embedding_dim': 96, 'lr': 0.007158020046263984, 'lambda_val': 4.830818973924614e-06, 'batch_size': 1819, 'optimizer': 'Adam'}.
2026-06-04 06:41:12,026 - experiment_functions - INFO - Early stopping at epoch 500. Best Metrics: (0.000389978010687299, 5.358697836425748e-05, 0.00016012902314897014)
2026-06-04 06:41:12,532 - optuna.study.study - INFO - Trial 46 finished with values: [0.000389978010687299, 5.358697836425748e-05, 0.00016012902314897014] and parameters: {'n_layers': 2, 'embedding_dim': 32, 'lr': 0.00027396549475058873, 'lambda_val': 4.883540721191189e-06, 'batch_size': 3451, 'optimizer': 'SGD'}.
2026-06-04 06:41:34,676 - experiment_functions - INFO - Early stopping at epoch 550. Best Metrics: (0.003337006502123292, 0.0005492665282336393, 0.00184104725892097)
2026-06-04 06:41:34,898 - optuna.study.study - INFO - Trial 47 finished with values: [0.003337006502123292, 0.0005492665282336393, 0.00184104725892097] and parameters: {'n_layers': 3, 'embedding_dim': 32, 'lr': 0.07682245549237667, 'lambda_val': 1.7171594062418532e-05, 'batch_size': 734, 'optimizer': 'RMSprop'}.
2026-06-04 06:43:04,551 - experiment_functions - INFO - Early stopping at epoch 2150. Best Metrics: (0.004100375476982808, 0.000755241476321254, 0.002337006739148831)
2026-06-04 06:43:04,688 - optuna.study.study - INFO - Trial 48 finished with values: [0.004100375476982808, 0.000755241476321254, 0.002337006739148831] and parameters: {'n_layers': 1, 'embedding_dim': 256, 'lr': 0.014134145405446918, 'lambda_val': 0.05895230860296244, 'batch_size': 806, 'optimizer': 'RMSprop'}.
2026-06-04 06:43:29,382 - experiment_functions - INFO - Early stopping at epoch 600. Best Metrics: (0.004001788707516717, 0.0007585906624690201, 0.002427703297742648)
