2026-06-03 15:08:11,228 - optuna.study.study - INFO - Trial 97 finished with values: [0.0010083496568506036, 0.0002277446580480943, 0.0005314244342124746] and parameters: {'n_layers': 4, 'embedding_dim': 64, 'lr': 0.0009455487151464264, 'lambda_val': 0.014546981560237598, 'batch_size': 3933, 'optimizer': 'RMSprop'}.
2026-06-03 15:08:41,424 - experiment_functions - INFO - Early stopping at epoch 750. Best Metrics: (0.0022606102960127834, 0.0006564404849621542, 0.0014408683793894362)
2026-06-03 15:08:41,744 - optuna.study.study - INFO - Trial 98 finished with values: [0.0022606102960127834, 0.0006564404849621542, 0.0014408683793894362] and parameters: {'n_layers': 3, 'embedding_dim': 64, 'lr': 0.0008281403400701205, 'lambda_val': 0.0015102413658479369, 'batch_size': 2782, 'optimizer': 'Adam'}.
2026-06-03 15:09:10,037 - experiment_functions - INFO - Early stopping at epoch 700. Best Metrics: (0.0018687456960321948, 0.0005057271083126801, 0.0010994469429179345)
2026-06-03 15:09:10,141 - optuna.study.study - INFO - Trial 99 finished with values: [0.0018687456960321948, 0.0005057271083126801, 0.0010994469429179345] and parameters: {'n_layers': 3, 'embedding_dim': 64, 'lr': 0.0014552621483972018, 'lambda_val': 2.6151941707099572e-05, 'batch_size': 1195, 'optimizer': 'RMSprop'}.
2026-06-03 15:09:33,070 - experiment_functions - INFO - Early stopping at epoch 550. Best Metrics: (0.004026385241003996, 0.0015255542903074555, 0.00305290072097443)
2026-06-03 15:09:33,164 - optuna.study.study - INFO - Trial 100 finished with values: [0.004026385241003996, 0.0015255542903074555, 0.00305290072097443] and parameters: {'n_layers': 1, 'embedding_dim': 128, 'lr': 0.01506522012263809, 'lambda_val': 0.0006859838564406128, 'batch_size': 1352, 'optimizer': 'Adam'}.
2026-06-03 15:11:10,758 - experiment_functions - INFO - Early stopping at epoch 2350. Best Metrics: (0.003033585717458686, 0.0008490186884587044, 0.0018436725118031582)
2026-06-03 15:11:10,851 - optuna.study.study - INFO - Trial 101 finished with values: [0.003033585717458686, 0.0008490186884587044, 0.0018436725118031582] and parameters: {'n_layers': 4, 'embedding_dim': 128, 'lr': 0.00024535156098645997, 'lambda_val': 0.00022250083118396295, 'batch_size': 1865, 'optimizer': 'RMSprop'}.
2026-06-03 15:11:37,066 - experiment_functions - INFO - Early stopping at epoch 550. Best Metrics: (0.0024652547955663936, 0.0008942327014535468, 0.0017217185565149187)
2026-06-03 15:11:37,172 - optuna.study.study - INFO - Trial 102 finished with values: [0.0024652547955663936, 0.0008942327014535468, 0.0017217185565149187] and parameters: {'n_layers': 2, 'embedding_dim': 256, 'lr': 0.008813340023110926, 'lambda_val': 2.2072560753305147e-05, 'batch_size': 3687, 'optimizer': 'Adam'}.
2026-06-03 15:12:05,221 - experiment_functions - INFO - Early stopping at epoch 650. Best Metrics: (0.002162530164735088, 0.0005995043204501306, 0.0013580641530580527)
2026-06-03 15:12:05,326 - optuna.study.study - INFO - Trial 103 finished with values: [0.002162530164735088, 0.0005995043204501306, 0.0013580641530580527] and parameters: {'n_layers': 3, 'embedding_dim': 128, 'lr': 0.0008281403400701205, 'lambda_val': 0.0015102413658479369, 'batch_size': 1195, 'optimizer': 'RMSprop'}.
2026-06-03 15:12:29,897 - experiment_functions - INFO - Early stopping at epoch 550. Best Metrics: (0.002510661400008028, 0.0010499698573246702, 0.0019882447427401143)
2026-06-03 15:12:30,146 - optuna.study.study - INFO - Trial 104 finished with values: [0.002510661400008028, 0.0010499698573246702, 0.0019882447427401143] and parameters: {'n_layers': 1, 'embedding_dim': 256, 'lr': 0.0013766733587116105, 'lambda_val': 0.016674570642215843, 'batch_size': 2263, 'optimizer': 'RMSprop'}.
2026-06-03 15:12:53,067 - experiment_functions - INFO - Early stopping at epoch 500. Best Metrics: (0.0019459633063403522, 0.0006145756581150781, 0.0013271819517175745)
2026-06-03 15:12:53,157 - optuna.study.study - INFO - Trial 105 finished with values: [0.0019459633063403522, 0.0006145756581150781, 0.0013271819517175745] and parameters: {'n_layers': 4, 'embedding_dim': 128, 'lr': 0.01506522012263809, 'lambda_val': 0.0006859838564406128, 'batch_size': 3776, 'optimizer': 'RMSprop'}.
2026-06-03 15:13:37,613 - experiment_functions - INFO - Early stopping at epoch 1150. Best Metrics: (0.0031658330663053118, 0.0009411213075222721, 0.002026513717902732)
2026-06-03 15:13:38,072 - optuna.study.study - INFO - Trial 106 finished with values: [0.0031658330663053118, 0.0009411213075222721, 0.002026513717902732] and parameters: {'n_layers': 2, 'embedding_dim': 64, 'lr': 0.00058211761161888, 'lambda_val': 0.0009043206687018967, 'batch_size': 3046, 'optimizer': 'Adam'}.
2026-06-03 15:14:12,653 - experiment_functions - INFO - Early stopping at epoch 900. Best Metrics: (0.0023650226442521885, 0.0006363453680755576, 0.0014284640850355222)
2026-06-03 15:14:12,738 - optuna.study.study - INFO - Trial 107 finished with values: [0.0023650226442521885, 0.0006363453680755576, 0.0014284640850355222] and parameters: {'n_layers': 3, 'embedding_dim': 32, 'lr': 0.0010433155335864835, 'lambda_val': 4.0913266870922855e-05, 'batch_size': 2526, 'optimizer': 'RMSprop'}.
2026-06-03 15:14:42,459 - experiment_functions - INFO - Early stopping at epoch 750. Best Metrics: (0.0013107764876656033, 0.0005325205974948088, 0.0009489774530901423)
2026-06-03 15:14:42,552 - optuna.study.study - INFO - Trial 108 finished with values: [0.0013107764876656033, 0.0005325205974948088, 0.0009489774530901423] and parameters: {'n_layers': 2, 'embedding_dim': 64, 'lr': 0.006315240769324818, 'lambda_val': 0.0009043206687018967, 'batch_size': 3776, 'optimizer': 'RMSprop'}.
2026-06-03 15:15:07,526 - experiment_functions - INFO - Early stopping at epoch 600. Best Metrics: (0.005171282027531475, 0.0017918145890548597, 0.003915856533832201)
2026-06-03 15:15:08,645 - optuna.study.study - INFO - Trial 109 finished with values: [0.005171282027531475, 0.0017918145890548597, 0.003915856533832201] and parameters: {'n_layers': 1, 'embedding_dim': 128, 'lr': 0.005194863702442923, 'lambda_val': 3.6015692758113356e-06, 'batch_size': 1314, 'optimizer': 'Adam'}.
2026-06-03 15:15:35,014 - experiment_functions - INFO - Early stopping at epoch 600. Best Metrics: (0.0024032513898065303, 0.0007033290910308795, 0.0015350570422779269)
2026-06-03 15:15:35,151 - optuna.study.study - INFO - Trial 110 finished with values: [0.0024032513898065303, 0.0007033290910308795, 0.0015350570422779269] and parameters: {'n_layers': 3, 'embedding_dim': 128, 'lr': 0.0014552621483972018, 'lambda_val': 4.287043434340858e-05, 'batch_size': 3896, 'optimizer': 'Adam'}.
2026-06-03 15:17:53,098 - experiment_functions - INFO - Early stopping at epoch 3350. Best Metrics: (0.005715244032716018, 0.001982718199477527, 0.004227266662470448)
2026-06-03 15:17:53,195 - optuna.study.study - INFO - Trial 111 finished with values: [0.005715244032716018, 0.001982718199477527, 0.004227266662470448] and parameters: {'n_layers': 1, 'embedding_dim': 256, 'lr': 0.0006158877725370185, 'lambda_val': 3.6015692758113356e-06, 'batch_size': 1352, 'optimizer': 'Adam'}.
2026-06-03 15:18:15,034 - experiment_functions - INFO - Early stopping at epoch 550. Best Metrics: (0.002259095955909896, 0.0006849085672181661, 0.0015238030151622124)
2026-06-03 15:18:15,263 - optuna.study.study - INFO - Trial 112 finished with values: [0.002259095955909896, 0.0006849085672181661, 0.0015238030151622124] and parameters: {'n_layers': 1, 'embedding_dim': 32, 'lr': 0.013177047583454147, 'lambda_val': 1.1031019465465648e-05, 'batch_size': 3317, 'optimizer': 'RMSprop'}.
2026-06-03 15:18:37,029 - experiment_functions - INFO - Early stopping at epoch 550. Best Metrics: (0.0015941205479951094, 0.0005693616451202358, 0.0011293963176125803)
2026-06-03 15:18:37,121 - optuna.study.study - INFO - Trial 113 finished with values: [0.0015941205479951094, 0.0005693616451202358, 0.0011293963176125803] and parameters: {'n_layers': 1, 'embedding_dim': 32, 'lr': 0.07085951793836062, 'lambda_val': 2.0098616241177373e-05, 'batch_size': 1314, 'optimizer': 'Adam'}.
2026-06-03 15:19:04,170 - experiment_functions - INFO - Early stopping at epoch 550. Best Metrics: (0.0014555028205802028, 0.0004889811775738496, 0.0009911864568222406)
2026-06-03 15:19:05,147 - optuna.study.study - INFO - Trial 114 finished with values: [0.0014555028205802028, 0.0004889811775738496, 0.0009911864568222406] and parameters: {'n_layers': 3, 'embedding_dim': 256, 'lr': 0.0018644973108911816, 'lambda_val': 0.0015102413658479369, 'batch_size': 3933, 'optimizer': 'RMSprop'}.
2026-06-03 15:19:29,933 - experiment_functions - INFO - Early stopping at epoch 550. Best Metrics: (0.0012753872815563876, 0.0005358697836425748, 0.0009251323078280014)
2026-06-03 15:19:30,629 - optuna.study.study - INFO - Trial 115 finished with values: [0.0012753872815563876, 0.0005358697836425748, 0.0009251323078280014] and parameters: {'n_layers': 1, 'embedding_dim': 256, 'lr': 0.09032174133742327, 'lambda_val': 3.09516609635417e-05, 'batch_size': 2094, 'optimizer': 'Adam'}.
2026-06-03 15:21:54,647 - experiment_functions - INFO - Early stopping at epoch 3500. Best Metrics: (0.005436338971000314, 0.0019961149440685918, 0.004290951791367767)
2026-06-03 15:21:54,752 - optuna.study.study - INFO - Trial 116 finished with values: [0.005436338971000314, 0.0019961149440685918, 0.004290951791367767] and parameters: {'n_layers': 1, 'embedding_dim': 256, 'lr': 0.0006158877725370185, 'lambda_val': 2.6151941707099572e-05, 'batch_size': 1195, 'optimizer': 'Adam'}.
2026-06-03 15:22:32,530 - experiment_functions - INFO - Early stopping at epoch 750. Best Metrics: (0.0017051855940099351, 0.0004789336191305513, 0.001142179111501807)
2026-06-03 15:22:32,613 - optuna.study.study - INFO - Trial 117 finished with values: [0.0017051855940099351, 0.0004789336191305513, 0.001142179111501807] and parameters: {'n_layers': 4, 'embedding_dim': 256, 'lr': 0.0006158877725370185, 'lambda_val': 2.1503798857636363e-05, 'batch_size': 3645, 'optimizer': 'RMSprop'}.
2026-06-03 15:23:02,272 - experiment_functions - INFO - Early stopping at epoch 750. Best Metrics: (0.001712311528537893, 0.0007117020564002947, 0.001332348083137025)
2026-06-03 15:23:02,537 - optuna.study.study - INFO - Trial 118 finished with values: [0.001712311528537893, 0.0007117020564002947, 0.001332348083137025] and parameters: {'n_layers': 2, 'embedding_dim': 64, 'lr': 0.014207108552616627, 'lambda_val': 3.8315457306143855e-05, 'batch_size': 1182, 'optimizer': 'RMSprop'}.
2026-06-03 15:23:40,949 - experiment_functions - INFO - Early stopping at epoch 950. Best Metrics: (0.0007033448436457927, 0.00018587983120101816, 0.00044068096373932623)
2026-06-03 15:23:41,388 - optuna.study.study - INFO - Trial 119 finished with values: [0.0007033448436457927, 0.00018587983120101816, 0.00044068096373932623] and parameters: {'n_layers': 3, 'embedding_dim': 96, 'lr': 0.0006158877725370185, 'lambda_val': 0.03255445368348382, 'batch_size': 577, 'optimizer': 'RMSprop'}.
2026-06-03 15:24:31,443 - experiment_functions - INFO - Early stopping at epoch 1200. Best Metrics: (0.0004963902055262181, 6.865831602920491e-05, 0.00019494680670739166)
2026-06-03 15:24:31,544 - optuna.study.study - INFO - Trial 120 finished with values: [0.0004963902055262181, 6.865831602920491e-05, 0.00019494680670739166] and parameters: {'n_layers': 1, 'embedding_dim': 256, 'lr': 1.0957909753641172e-05, 'lambda_val': 0.00035280082313059077, 'batch_size': 1865, 'optimizer': 'RMSprop'}.
2026-06-03 15:24:57,748 - experiment_functions - INFO - Early stopping at epoch 650. Best Metrics: (0.0029554880101752327, 0.0012710161430772324, 0.002331938219758875)
2026-06-03 15:24:57,843 - optuna.study.study - INFO - Trial 121 finished with values: [0.0029554880101752327, 0.0012710161430772324, 0.002331938219758875] and parameters: {'n_layers': 1, 'embedding_dim': 96, 'lr': 0.0013766733587116105, 'lambda_val': 0.02787805142092731, 'batch_size': 2263, 'optimizer': 'Adam'}.
2026-06-03 15:25:23,263 - experiment_functions - INFO - Early stopping at epoch 600. Best Metrics: (0.0016910354456803312, 0.0004772590260566682, 0.0009749663799274594)
2026-06-03 15:25:23,852 - optuna.study.study - INFO - Trial 122 finished with values: [0.0016910354456803312, 0.0004772590260566682, 0.0009749663799274594] and parameters: {'n_layers': 2, 'embedding_dim': 128, 'lr': 0.0014552621483972018, 'lambda_val': 0.009337998461740198, 'batch_size': 1195, 'optimizer': 'RMSprop'}.
2026-06-03 15:26:02,775 - experiment_functions - INFO - Early stopping at epoch 1000. Best Metrics: (0.004879462043442324, 0.001726505459173421, 0.003640174914862988)
2026-06-03 15:26:02,875 - optuna.study.study - INFO - Trial 123 finished with values: [0.004879462043442324, 0.001726505459173421, 0.003640174914862988] and parameters: {'n_layers': 1, 'embedding_dim': 96, 'lr': 0.0010433155335864835, 'lambda_val': 0.00014066527401303662, 'batch_size': 1195, 'optimizer': 'RMSprop'}.
2026-06-03 15:26:26,134 - experiment_functions - INFO - Early stopping at epoch 550. Best Metrics: (0.0015094640291506416, 0.0004169736753968785, 0.0009144503100074355)
2026-06-03 15:26:26,313 - optuna.study.study - INFO - Trial 124 finished with values: [0.0015094640291506416, 0.0004169736753968785, 0.0009144503100074355] and parameters: {'n_layers': 4, 'embedding_dim': 64, 'lr': 0.00549933469838882, 'lambda_val': 3.3650082149692864e-06, 'batch_size': 2782, 'optimizer': 'RMSprop'}.
2026-06-03 15:27:53,250 - experiment_functions - INFO - Early stopping at epoch 2300. Best Metrics: (0.0018213874251874612, 0.0006798847879965167, 0.0013212470491155007)
2026-06-03 15:27:53,348 - optuna.study.study - INFO - Trial 125 finished with values: [0.0018213874251874612, 0.0006798847879965167, 0.0013212470491155007] and parameters: {'n_layers': 3, 'embedding_dim': 64, 'lr': 0.006315240769324818, 'lambda_val': 1.780698705122307e-06, 'batch_size': 3317, 'optimizer': 'RMSprop'}.
2026-06-03 15:28:16,339 - experiment_functions - INFO - Early stopping at epoch 550. Best Metrics: (0.0016700349856170371, 0.00038683100006698366, 0.0009571083197320503)
2026-06-03 15:28:16,412 - optuna.study.study - INFO - Trial 126 finished with values: [0.0016700349856170371, 0.00038683100006698366, 0.0009571083197320503] and parameters: {'n_layers': 4, 'embedding_dim': 64, 'lr': 0.0018644973108911816, 'lambda_val': 2.8448904029011504e-05, 'batch_size': 2369, 'optimizer': 'RMSprop'}.
2026-06-03 15:29:24,293 - experiment_functions - INFO - Early stopping at epoch 1650. Best Metrics: (0.0015007844860814188, 0.0007066782771786456, 0.0011766633158570533)
2026-06-03 15:29:24,428 - optuna.study.study - INFO - Trial 127 finished with values: [0.0015007844860814188, 0.0007066782771786456, 0.0011766633158570533] and parameters: {'n_layers': 1, 'embedding_dim': 256, 'lr': 0.014560831560560771, 'lambda_val': 0.0015102413658479369, 'batch_size': 2215, 'optimizer': 'RMSprop'}.
2026-06-03 15:31:07,574 - experiment_functions - INFO - Early stopping at epoch 2150. Best Metrics: (0.002913961138137319, 0.0009126532252662603, 0.0019739173385967985)
2026-06-03 15:31:07,651 - optuna.study.study - INFO - Trial 128 finished with values: [0.002913961138137319, 0.0009126532252662603, 0.0019739173385967985] and parameters: {'n_layers': 4, 'embedding_dim': 256, 'lr': 0.00021948009255211227, 'lambda_val': 7.927121361608539e-05, 'batch_size': 1865, 'optimizer': 'RMSprop'}.
2026-06-03 15:31:30,390 - experiment_functions - INFO - Early stopping at epoch 550. Best Metrics: (0.0017084329746896976, 0.000609551878893429, 0.0011701811192496457)
2026-06-03 15:31:30,460 - optuna.study.study - INFO - Trial 129 finished with values: [0.0017084329746896976, 0.000609551878893429, 0.0011701811192496457] and parameters: {'n_layers': 2, 'embedding_dim': 96, 'lr': 0.07085951793836062, 'lambda_val': 2.398355232408811e-06, 'batch_size': 1314, 'optimizer': 'Adam'}.
2026-06-03 15:31:50,610 - experiment_functions - INFO - Early stopping at epoch 500. Best Metrics: (0.00047464997305794265, 7.703128139862015e-05, 0.00020259223927424758)
2026-06-03 15:31:50,677 - optuna.study.study - INFO - Trial 130 finished with values: [0.00047464997305794265, 7.703128139862015e-05, 0.00020259223927424758] and parameters: {'n_layers': 2, 'embedding_dim': 64, 'lr': 0.00058211761161888, 'lambda_val': 0.0009043206687018967, 'batch_size': 1352, 'optimizer': 'SGD'}.
2026-06-03 15:32:11,529 - experiment_functions - INFO - Early stopping at epoch 500. Best Metrics: (0.001966319300694708, 0.0004437671645790073, 0.001133820547809204)
2026-06-03 15:32:11,883 - optuna.study.study - INFO - Trial 131 finished with values: [0.001966319300694708, 0.0004437671645790073, 0.001133820547809204] and parameters: {'n_layers': 3, 'embedding_dim': 64, 'lr': 0.08437135009733654, 'lambda_val': 0.002233145732238771, 'batch_size': 3933, 'optimizer': 'RMSprop'}.
2026-06-03 15:34:37,351 - optuna.study.study - INFO - Trial 132 finished with values: [0.0017056473410379655, 0.00041697367539687857, 0.0009123647250216787] and parameters: {'n_layers': 4, 'embedding_dim': 32, 'lr': 0.00013096205237201516, 'lambda_val': 1.1031019465465648e-05, 'batch_size': 680, 'optimizer': 'Adam'}.
2026-06-03 15:35:04,608 - experiment_functions - INFO - Early stopping at epoch 700. Best Metrics: (0.002161755541118648, 0.00046386228146560386, 0.0012356344670423043)
2026-06-03 15:35:04,770 - optuna.study.study - INFO - Trial 133 finished with values: [0.002161755541118648, 0.00046386228146560386, 0.0012356344670423043] and parameters: {'n_layers': 3, 'embedding_dim': 32, 'lr': 0.0026782183131133443, 'lambda_val': 0.000142346054959725, 'batch_size': 711, 'optimizer': 'Adam'}.
2026-06-03 15:35:31,258 - experiment_functions - INFO - Early stopping at epoch 650. Best Metrics: (0.0011762676086726144, 0.00048730658449996645, 0.0009006420805299963)
2026-06-03 15:35:31,334 - optuna.study.study - INFO - Trial 134 finished with values: [0.0011762676086726144, 0.00048730658449996645, 0.0009006420805299963] and parameters: {'n_layers': 3, 'embedding_dim': 64, 'lr': 0.014207108552616627, 'lambda_val': 0.0004997820234959456, 'batch_size': 3933, 'optimizer': 'RMSprop'}.
2026-06-03 15:38:02,959 - experiment_functions - INFO - Early stopping at epoch 3700. Best Metrics: (0.005263738917269575, 0.001970996047960346, 0.00412185673370347)
2026-06-03 15:38:03,136 - optuna.study.study - INFO - Trial 135 finished with values: [0.005263738917269575, 0.001970996047960346, 0.00412185673370347] and parameters: {'n_layers': 1, 'embedding_dim': 256, 'lr': 0.0006158877725370185, 'lambda_val': 1.2299853064209968e-05, 'batch_size': 1352, 'optimizer': 'Adam'}.
2026-06-03 15:38:29,354 - experiment_functions - INFO - Early stopping at epoch 600. Best Metrics: (0.0016133280254257262, 0.00046386228146560386, 0.0010124126578053593)
2026-06-03 15:38:29,422 - optuna.study.study - INFO - Trial 136 finished with values: [0.0016133280254257262, 0.00046386228146560386, 0.0010124126578053593] and parameters: {'n_layers': 3, 'embedding_dim': 128, 'lr': 0.001986285822943326, 'lambda_val': 0.009337998461740198, 'batch_size': 1195, 'optimizer': 'Adam'}.
2026-06-03 15:38:54,823 - experiment_functions - INFO - Early stopping at epoch 650. Best Metrics: (0.004508425407203655, 0.001368142541362449, 0.0029134820676703322)
2026-06-03 15:38:54,907 - optuna.study.study - INFO - Trial 137 finished with values: [0.004508425407203655, 0.001368142541362449, 0.0029134820676703322] and parameters: {'n_layers': 1, 'embedding_dim': 32, 'lr': 0.0018644973108911816, 'lambda_val': 2.2072560753305147e-05, 'batch_size': 2782, 'optimizer': 'RMSprop'}.
2026-06-03 15:39:15,417 - experiment_functions - INFO - Early stopping at epoch 500. Best Metrics: (0.0004885258884732757, 6.530912988143882e-05, 0.00021564686821556314)
2026-06-03 15:39:15,630 - optuna.study.study - INFO - Trial 138 finished with values: [0.0004885258884732757, 6.530912988143882e-05, 0.00021564686821556314] and parameters: {'n_layers': 1, 'embedding_dim': 96, 'lr': 1.871201428636622e-05, 'lambda_val': 0.025990812764396166, 'batch_size': 2094, 'optimizer': 'Adam'}.
2026-06-03 15:40:33,018 - experiment_functions - INFO - Early stopping at epoch 1950. Best Metrics: (0.004283247520725162, 0.0014167057405050573, 0.0029348495513409406)
2026-06-03 15:40:33,090 - optuna.study.study - INFO - Trial 139 finished with values: [0.004283247520725162, 0.0014167057405050573, 0.0029348495513409406] and parameters: {'n_layers': 2, 'embedding_dim': 128, 'lr': 0.00058211761161888, 'lambda_val': 0.0006859838564406128, 'batch_size': 571, 'optimizer': 'Adam'}.
2026-06-03 15:40:58,590 - experiment_functions - INFO - Early stopping at epoch 650. Best Metrics: (0.0018639636551989799, 0.00048228280527831745, 0.0011309589791323996)
2026-06-03 15:40:59,598 - optuna.study.study - INFO - Trial 140 finished with values: [0.0018639636551989799, 0.00048228280527831745, 0.0011309589791323996] and parameters: {'n_layers': 3, 'embedding_dim': 32, 'lr': 0.0014552621483972018, 'lambda_val': 1.780698705122307e-06, 'batch_size': 3052, 'optimizer': 'Adam'}.
2026-06-03 15:43:33,181 - experiment_functions - INFO - Early stopping at epoch 3750. Best Metrics: (0.0054631280253748206, 0.0020296068055462523, 0.004073020377922445)
2026-06-03 15:43:33,372 - optuna.study.study - INFO - Trial 141 finished with values: [0.0054631280253748206, 0.0020296068055462523, 0.004073020377922445] and parameters: {'n_layers': 1, 'embedding_dim': 256, 'lr': 0.0006158877725370185, 'lambda_val': 2.697820276812544e-06, 'batch_size': 1352, 'optimizer': 'Adam'}.
2026-06-03 15:43:56,656 - experiment_functions - INFO - Early stopping at epoch 550. Best Metrics: (0.0021929677508107084, 0.0006949561256614642, 0.0014897684832719878)
