2026-06-04 14:32:52,711 - optuna.study.study - INFO - Trial 170 finished with values: [0.0068295583995660065, 0.0012291513162301562, 0.0039174513991946935] and parameters: {'n_layers': 4, 'embedding_dim': 256, 'lr': 0.004480000793937752, 'lambda_val': 5.016933039935782e-06, 'batch_size': 3509, 'optimizer': 'RMSprop'}.
2026-06-04 14:33:19,815 - experiment_functions - INFO - Early stopping at epoch 600. Best Metrics: (0.001327279544924509, 0.0002411414026391587, 0.0008013739751326859)
2026-06-04 14:33:19,928 - optuna.study.study - INFO - Trial 171 finished with values: [0.001327279544924509, 0.0002411414026391587, 0.0008013739751326859] and parameters: {'n_layers': 1, 'embedding_dim': 256, 'lr': 0.08500719886316734, 'lambda_val': 0.0032296178945151414, 'batch_size': 2516, 'optimizer': 'Adam'}.
2026-06-04 14:33:52,760 - experiment_functions - INFO - Early stopping at epoch 600. Best Metrics: (0.006823584229999435, 0.0012609685846339338, 0.003854993195502462)
2026-06-04 14:33:52,855 - optuna.study.study - INFO - Trial 172 finished with values: [0.006823584229999435, 0.0012609685846339338, 0.003854993195502462] and parameters: {'n_layers': 4, 'embedding_dim': 256, 'lr': 0.006097730317148143, 'lambda_val': 5.6413681092531065e-05, 'batch_size': 3075, 'optimizer': 'Adam'}.
2026-06-04 14:34:52,973 - experiment_functions - INFO - Early stopping at epoch 1150. Best Metrics: (0.005199164407704799, 0.0009880099135909973, 0.0030070368049435114)
2026-06-04 14:34:53,425 - optuna.study.study - INFO - Trial 173 finished with values: [0.005199164407704799, 0.0009880099135909973, 0.0030070368049435114] and parameters: {'n_layers': 4, 'embedding_dim': 256, 'lr': 0.0008527206735717898, 'lambda_val': 0.021039161138826524, 'batch_size': 1126, 'optimizer': 'Adam'}.
2026-06-04 14:36:01,162 - experiment_functions - INFO - Early stopping at epoch 1750. Best Metrics: (0.004571679754930278, 0.0008875343291580146, 0.002546636302395589)
2026-06-04 14:36:01,254 - optuna.study.study - INFO - Trial 174 finished with values: [0.004571679754930278, 0.0008875343291580146, 0.002546636302395589] and parameters: {'n_layers': 1, 'embedding_dim': 128, 'lr': 0.004480000793937752, 'lambda_val': 0.008433392860348091, 'batch_size': 2008, 'optimizer': 'RMSprop'}.
2026-06-04 14:37:20,851 - experiment_functions - INFO - Early stopping at epoch 2050. Best Metrics: (0.004779522279506825, 0.0008741375845669503, 0.0027016327736091765)
2026-06-04 14:37:20,941 - optuna.study.study - INFO - Trial 175 finished with values: [0.004779522279506825, 0.0008741375845669503, 0.0027016327736091765] and parameters: {'n_layers': 1, 'embedding_dim': 128, 'lr': 0.002947410528904454, 'lambda_val': 0.05383219142167494, 'batch_size': 1826, 'optimizer': 'Adam'}.
2026-06-04 14:38:57,115 - experiment_functions - INFO - Early stopping at epoch 2400. Best Metrics: (0.007465438729236107, 0.0013128809699243084, 0.004376435117885102)
2026-06-04 14:38:57,194 - optuna.study.study - INFO - Trial 176 finished with values: [0.007465438729236107, 0.0013128809699243084, 0.004376435117885102] and parameters: {'n_layers': 3, 'embedding_dim': 96, 'lr': 0.0005268211601481077, 'lambda_val': 7.359862236281652e-06, 'batch_size': 3509, 'optimizer': 'Adam'}.
2026-06-04 14:39:23,207 - experiment_functions - INFO - Early stopping at epoch 650. Best Metrics: (0.00820374768634622, 0.001431777078170005, 0.004985652163463819)
2026-06-04 14:39:23,599 - optuna.study.study - INFO - Trial 177 finished with values: [0.00820374768634622, 0.001431777078170005, 0.004985652163463819] and parameters: {'n_layers': 4, 'embedding_dim': 32, 'lr': 0.006097730317148143, 'lambda_val': 5.6413681092531065e-05, 'batch_size': 822, 'optimizer': 'Adam'}.
2026-06-04 14:40:16,653 - experiment_functions - INFO - Early stopping at epoch 1200. Best Metrics: (0.008791979865319917, 0.0016092839440016078, 0.00505304162657809)
2026-06-04 14:40:16,731 - optuna.study.study - INFO - Trial 178 finished with values: [0.008791979865319917, 0.0016092839440016078, 0.00505304162657809] and parameters: {'n_layers': 4, 'embedding_dim': 128, 'lr': 0.0008527206735717898, 'lambda_val': 0.00026218929558311914, 'batch_size': 2516, 'optimizer': 'Adam'}.
2026-06-04 14:42:40,078 - optuna.study.study - INFO - Trial 179 finished with values: [0.0050075129910560545, 0.0007384955455824236, 0.0028009233304259282] and parameters: {'n_layers': 2, 'embedding_dim': 32, 'lr': 0.0004090776901902334, 'lambda_val': 1.8898212223948182e-06, 'batch_size': 1368, 'optimizer': 'RMSprop'}.
2026-06-04 14:44:43,019 - experiment_functions - INFO - Early stopping at epoch 3400. Best Metrics: (0.004194747535668068, 0.0008088284546855115, 0.0024130921036774416)
2026-06-04 14:44:43,107 - optuna.study.study - INFO - Trial 180 finished with values: [0.004194747535668068, 0.0008088284546855115, 0.0024130921036774416] and parameters: {'n_layers': 1, 'embedding_dim': 64, 'lr': 0.08896930678012212, 'lambda_val': 0.03410627252741982, 'batch_size': 1587, 'optimizer': 'RMSprop'}.
2026-06-04 14:47:17,688 - optuna.study.study - INFO - Trial 181 finished with values: [0.008770719965965353, 0.0014954116149775607, 0.005229598158477168] and parameters: {'n_layers': 4, 'embedding_dim': 64, 'lr': 0.0004090776901902334, 'lambda_val': 1.7844039295042361e-06, 'batch_size': 1368, 'optimizer': 'Adam'}.
2026-06-04 14:48:07,890 - experiment_functions - INFO - Early stopping at epoch 1100. Best Metrics: (0.004296832900130791, 0.000792082523946681, 0.002319113405938563)
2026-06-04 14:48:08,396 - optuna.study.study - INFO - Trial 182 finished with values: [0.004296832900130791, 0.000792082523946681, 0.002319113405938563] and parameters: {'n_layers': 2, 'embedding_dim': 256, 'lr': 0.005913319416099858, 'lambda_val': 0.06405803008831426, 'batch_size': 3509, 'optimizer': 'RMSprop'}.
2026-06-04 14:49:01,495 - experiment_functions - INFO - Early stopping at epoch 1150. Best Metrics: (0.004616020738923054, 0.0008640900261236519, 0.0025901650680696976)
2026-06-04 14:49:01,573 - optuna.study.study - INFO - Trial 183 finished with values: [0.004616020738923054, 0.0008640900261236519, 0.0025901650680696976] and parameters: {'n_layers': 2, 'embedding_dim': 256, 'lr': 0.0010072848810039788, 'lambda_val': 0.06405803008831426, 'batch_size': 3888, 'optimizer': 'Adam'}.
2026-06-04 14:51:06,339 - experiment_functions - INFO - Early stopping at epoch 3000. Best Metrics: (0.0040450629726644415, 0.0007083528702525286, 0.0023643798857245694)
2026-06-04 14:51:06,666 - optuna.study.study - INFO - Trial 184 finished with values: [0.0040450629726644415, 0.0007083528702525286, 0.0023643798857245694] and parameters: {'n_layers': 1, 'embedding_dim': 256, 'lr': 0.0008527206735717898, 'lambda_val': 0.0029474529646761295, 'batch_size': 2516, 'optimizer': 'Adam'}.
2026-06-04 14:51:27,752 - experiment_functions - INFO - Early stopping at epoch 500. Best Metrics: (0.0005846730046373711, 8.707883984191842e-05, 0.0002935054581253622)
2026-06-04 14:51:28,671 - optuna.study.study - INFO - Trial 185 finished with values: [0.0005846730046373711, 8.707883984191842e-05, 0.0002935054581253622] and parameters: {'n_layers': 4, 'embedding_dim': 64, 'lr': 0.0008527206735717898, 'lambda_val': 0.030897456598092354, 'batch_size': 1946, 'optimizer': 'SGD'}.
2026-06-04 14:53:54,232 - experiment_functions - INFO - Early stopping at epoch 3650. Best Metrics: (0.0075940109248527786, 0.0013547457967713844, 0.004590814946464763)
2026-06-04 14:53:54,527 - optuna.study.study - INFO - Trial 186 finished with values: [0.0075940109248527786, 0.0013547457967713844, 0.004590814946464763] and parameters: {'n_layers': 3, 'embedding_dim': 96, 'lr': 0.0005268211601481077, 'lambda_val': 7.359862236281652e-06, 'batch_size': 4045, 'optimizer': 'Adam'}.
2026-06-04 14:54:18,723 - experiment_functions - INFO - Early stopping at epoch 550. Best Metrics: (0.005505080434750606, 0.0008992564806751959, 0.003132654174269575)
2026-06-04 14:54:18,821 - optuna.study.study - INFO - Trial 187 finished with values: [0.005505080434750606, 0.0008992564806751959, 0.003132654174269575] and parameters: {'n_layers': 3, 'embedding_dim': 96, 'lr': 0.03873700217879755, 'lambda_val': 7.359862236281652e-06, 'batch_size': 3705, 'optimizer': 'Adam'}.
2026-06-04 14:54:52,567 - experiment_functions - INFO - Early stopping at epoch 850. Best Metrics: (0.007198458244264404, 0.001230825909304039, 0.004134588776839311)
2026-06-04 14:54:52,922 - optuna.study.study - INFO - Trial 188 finished with values: [0.007198458244264404, 0.001230825909304039, 0.004134588776839311] and parameters: {'n_layers': 4, 'embedding_dim': 32, 'lr': 0.0022691253374042394, 'lambda_val': 1.8898212223948182e-06, 'batch_size': 3337, 'optimizer': 'Adam'}.
2026-06-04 14:57:20,575 - optuna.study.study - INFO - Trial 189 finished with values: [0.0024298222016819566, 0.0003667358831803872, 0.0013059409283914705] and parameters: {'n_layers': 4, 'embedding_dim': 32, 'lr': 0.00018852010380237432, 'lambda_val': 3.3259809738592966e-06, 'batch_size': 1368, 'optimizer': 'Adam'}.
2026-06-04 14:58:13,501 - experiment_functions - INFO - Early stopping at epoch 1000. Best Metrics: (0.007927798145205906, 0.001513832138790274, 0.004603405018847768)
2026-06-04 14:58:13,609 - optuna.study.study - INFO - Trial 190 finished with values: [0.007927798145205906, 0.001513832138790274, 0.004603405018847768] and parameters: {'n_layers': 4, 'embedding_dim': 256, 'lr': 0.0014181685787657509, 'lambda_val': 5.016933039935782e-06, 'batch_size': 1826, 'optimizer': 'Adam'}.
2026-06-04 14:59:06,020 - experiment_functions - INFO - Early stopping at epoch 1000. Best Metrics: (0.010801807048093548, 0.0019425279657043339, 0.006162605746225144)
2026-06-04 14:59:06,115 - optuna.study.study - INFO - Trial 191 finished with values: [0.010801807048093548, 0.0019425279657043339, 0.006162605746225144] and parameters: {'n_layers': 4, 'embedding_dim': 256, 'lr': 0.0014181685787657509, 'lambda_val': 5.016933039935782e-06, 'batch_size': 739, 'optimizer': 'RMSprop'}.
2026-06-04 15:00:15,719 - experiment_functions - INFO - Early stopping at epoch 1900. Best Metrics: (0.00356898743878326, 0.0006279724027061425, 0.001971743782478618)
2026-06-04 15:00:15,805 - optuna.study.study - INFO - Trial 192 finished with values: [0.00356898743878326, 0.0006279724027061425, 0.001971743782478618] and parameters: {'n_layers': 2, 'embedding_dim': 32, 'lr': 0.05388465145759409, 'lambda_val': 0.000915140469916225, 'batch_size': 2270, 'optimizer': 'RMSprop'}.
2026-06-04 15:00:42,366 - experiment_functions - INFO - Early stopping at epoch 550. Best Metrics: (0.004457935468584542, 0.0007719874070600843, 0.0026622510495697507)
2026-06-04 15:00:42,709 - optuna.study.study - INFO - Trial 193 finished with values: [0.004457935468584542, 0.0007719874070600843, 0.0026622510495697507] and parameters: {'n_layers': 2, 'embedding_dim': 256, 'lr': 0.02660347787147833, 'lambda_val': 2.3449369939320573e-05, 'batch_size': 1826, 'optimizer': 'Adam'}.
2026-06-04 15:01:37,055 - experiment_functions - INFO - Early stopping at epoch 1350. Best Metrics: (0.005012875421752698, 0.0008808359568624824, 0.0027316347310938414)
2026-06-04 15:01:37,179 - optuna.study.study - INFO - Trial 194 finished with values: [0.005012875421752698, 0.0008808359568624824, 0.0027316347310938414] and parameters: {'n_layers': 4, 'embedding_dim': 64, 'lr': 0.0008527206735717898, 'lambda_val': 0.06405803008831426, 'batch_size': 2516, 'optimizer': 'Adam'}.
2026-06-04 15:02:04,561 - experiment_functions - INFO - Early stopping at epoch 700. Best Metrics: (0.003965841649905312, 0.0007066782771786457, 0.002273334468526512)
2026-06-04 15:02:04,691 - optuna.study.study - INFO - Trial 195 finished with values: [0.003965841649905312, 0.0007066782771786457, 0.002273334468526512] and parameters: {'n_layers': 2, 'embedding_dim': 32, 'lr': 0.006097730317148143, 'lambda_val': 5.6413681092531065e-05, 'batch_size': 3075, 'optimizer': 'Adam'}.
2026-06-04 15:02:42,179 - experiment_functions - INFO - Early stopping at epoch 700. Best Metrics: (0.005033582002559368, 0.0009628910174827517, 0.0028685364420864114)
2026-06-04 15:02:42,252 - optuna.study.study - INFO - Trial 196 finished with values: [0.005033582002559368, 0.0009628910174827517, 0.0028685364420864114] and parameters: {'n_layers': 4, 'embedding_dim': 256, 'lr': 0.0008527206735717898, 'lambda_val': 0.03788100942795368, 'batch_size': 3888, 'optimizer': 'RMSprop'}.
2026-06-04 15:03:22,350 - experiment_functions - INFO - Early stopping at epoch 750. Best Metrics: (0.007005622272090852, 0.00130283341148101, 0.00404083317983761)
2026-06-04 15:03:23,024 - optuna.study.study - INFO - Trial 197 finished with values: [0.007005622272090852, 0.00130283341148101, 0.00404083317983761] and parameters: {'n_layers': 4, 'embedding_dim': 256, 'lr': 0.0017568753093311267, 'lambda_val': 0.003001642531865632, 'batch_size': 894, 'optimizer': 'Adam'}.
2026-06-04 15:04:10,908 - experiment_functions - INFO - Early stopping at epoch 900. Best Metrics: (0.007534133907194712, 0.0013999598097662266, 0.004218191656553527)
2026-06-04 15:04:11,010 - optuna.study.study - INFO - Trial 198 finished with values: [0.007534133907194712, 0.0013999598097662266, 0.004218191656553527] and parameters: {'n_layers': 4, 'embedding_dim': 256, 'lr': 0.0014181685787657509, 'lambda_val': 0.0029474529646761295, 'batch_size': 739, 'optimizer': 'Adam'}.
2026-06-04 15:04:41,374 - experiment_functions - INFO - Early stopping at epoch 550. Best Metrics: (0.005463926424176987, 0.00093442293522674, 0.0030897249128318247)
2026-06-04 15:04:41,562 - optuna.study.study - INFO - Trial 199 finished with values: [0.005463926424176987, 0.00093442293522674, 0.0030897249128318247] and parameters: {'n_layers': 4, 'embedding_dim': 256, 'lr': 0.08896930678012212, 'lambda_val': 1.0009974035026707e-06, 'batch_size': 1995, 'optimizer': 'Adam'}.
2026-06-04 15:06:04,912 - experiment_functions - INFO - Early stopping at epoch 1600. Best Metrics: (0.007749054654975999, 0.0014585705673521336, 0.004590038751826524)
2026-06-04 15:06:04,994 - optuna.study.study - INFO - Trial 200 finished with values: [0.007749054654975999, 0.0014585705673521336, 0.004590038751826524] and parameters: {'n_layers': 4, 'embedding_dim': 256, 'lr': 0.0005537578052885072, 'lambda_val': 1.8898212223948182e-06, 'batch_size': 3688, 'optimizer': 'Adam'}.
2026-06-04 15:06:35,014 - experiment_functions - INFO - Early stopping at epoch 550. Best Metrics: (0.006268631027612505, 0.001111929801058343, 0.0035633595801826574)
2026-06-04 15:06:35,321 - optuna.study.study - INFO - Trial 201 finished with values: [0.006268631027612505, 0.001111929801058343, 0.0035633595801826574] and parameters: {'n_layers': 4, 'embedding_dim': 256, 'lr': 0.017487271162740594, 'lambda_val': 0.0004883759264301332, 'batch_size': 660, 'optimizer': 'Adam'}.
2026-06-04 15:07:04,436 - experiment_functions - INFO - Early stopping at epoch 650. Best Metrics: (0.006189668736645247, 0.001083461718802331, 0.0035255333742368277)
2026-06-04 15:07:04,526 - optuna.study.study - INFO - Trial 202 finished with values: [0.006189668736645247, 0.001083461718802331, 0.0035255333742368277] and parameters: {'n_layers': 3, 'embedding_dim': 128, 'lr': 0.013734110163054702, 'lambda_val': 6.8194438463592905e-06, 'batch_size': 676, 'optimizer': 'Adam'}.
2026-06-04 15:07:30,095 - experiment_functions - INFO - Early stopping at epoch 550. Best Metrics: (0.006920003916669821, 0.0012877620738160627, 0.003962422137706414)
2026-06-04 15:07:30,188 - optuna.study.study - INFO - Trial 203 finished with values: [0.006920003916669821, 0.0012877620738160627, 0.003962422137706414] and parameters: {'n_layers': 4, 'embedding_dim': 128, 'lr': 0.012839987127174263, 'lambda_val': 0.00026218929558311914, 'batch_size': 968, 'optimizer': 'Adam'}.
2026-06-04 15:10:12,951 - optuna.study.study - INFO - Trial 204 finished with values: [0.0023457312573415393, 0.0003064505325205975, 0.0011355606370607846] and parameters: {'n_layers': 1, 'embedding_dim': 256, 'lr': 0.00030379311378365113, 'lambda_val': 5.016933039935782e-06, 'batch_size': 739, 'optimizer': 'RMSprop'}.
2026-06-04 15:11:08,120 - experiment_functions - INFO - Early stopping at epoch 1350. Best Metrics: (0.0050575650823587864, 0.0009947082858865297, 0.002929503456720611)
2026-06-04 15:11:08,624 - optuna.study.study - INFO - Trial 205 finished with values: [0.0050575650823587864, 0.0009947082858865297, 0.002929503456720611] and parameters: {'n_layers': 3, 'embedding_dim': 96, 'lr': 0.0008527206735717898, 'lambda_val': 0.021039161138826524, 'batch_size': 1126, 'optimizer': 'Adam'}.
2026-06-04 15:14:08,152 - optuna.study.study - INFO - Trial 206 finished with values: [0.006225545967204232, 0.0010616920088418514, 0.003603745611228863] and parameters: {'n_layers': 2, 'embedding_dim': 256, 'lr': 0.0004090776901902334, 'lambda_val': 3.1903735069140576e-06, 'batch_size': 3075, 'optimizer': 'Adam'}.
2026-06-04 15:14:36,977 - experiment_functions - INFO - Early stopping at epoch 650. Best Metrics: (0.00753976233403619, 0.001408332775135642, 0.004401433976674348)
2026-06-04 15:14:37,063 - optuna.study.study - INFO - Trial 207 finished with values: [0.00753976233403619, 0.001408332775135642, 0.004401433976674348] and parameters: {'n_layers': 4, 'embedding_dim': 96, 'lr': 0.003689859980343995, 'lambda_val': 5.6413681092531065e-05, 'batch_size': 2516, 'optimizer': 'Adam'}.
2026-06-04 15:15:14,771 - experiment_functions - INFO - Early stopping at epoch 700. Best Metrics: (0.00751470466715191, 0.001369817134436332, 0.004185809760978791)
2026-06-04 15:15:14,870 - optuna.study.study - INFO - Trial 208 finished with values: [0.00751470466715191, 0.001369817134436332, 0.004185809760978791] and parameters: {'n_layers': 4, 'embedding_dim': 256, 'lr': 0.0017568753093311267, 'lambda_val': 1.8898212223948182e-06, 'batch_size': 3688, 'optimizer': 'Adam'}.
2026-06-04 15:17:04,647 - experiment_functions - INFO - Early stopping at epoch 2800. Best Metrics: (0.00524346504545803, 0.0010014066581820616, 0.0030211182965097197)
2026-06-04 15:17:05,107 - optuna.study.study - INFO - Trial 209 finished with values: [0.00524346504545803, 0.0010014066581820616, 0.0030211182965097197] and parameters: {'n_layers': 4, 'embedding_dim': 64, 'lr': 0.0002936345482804683, 'lambda_val': 0.021039161138826524, 'batch_size': 3337, 'optimizer': 'Adam'}.
2026-06-04 15:17:26,797 - experiment_functions - INFO - Early stopping at epoch 500. Best Metrics: (0.0004380192941244664, 6.698372295532186e-05, 0.00019334427902297565)
2026-06-04 15:17:26,949 - optuna.study.study - INFO - Trial 210 finished with values: [0.0004380192941244664, 6.698372295532186e-05, 0.00019334427902297565] and parameters: {'n_layers': 3, 'embedding_dim': 96, 'lr': 0.0004090776901902334, 'lambda_val': 7.359862236281652e-06, 'batch_size': 4045, 'optimizer': 'SGD'}.
2026-06-04 15:18:12,085 - experiment_functions - INFO - Early stopping at epoch 850. Best Metrics: (0.008129819960443738, 0.0015138321387902743, 0.00464329291765388)
2026-06-04 15:18:13,109 - optuna.study.study - INFO - Trial 211 finished with values: [0.008129819960443738, 0.0015138321387902743, 0.00464329291765388] and parameters: {'n_layers': 4, 'embedding_dim': 256, 'lr': 0.0014181685787657509, 'lambda_val': 0.0003532268196548331, 'batch_size': 1826, 'optimizer': 'Adam'}.
2026-06-04 15:18:35,973 - experiment_functions - INFO - Early stopping at epoch 550. Best Metrics: (0.004364381436550387, 0.0007401701386563064, 0.002507302998543077)
2026-06-04 15:18:36,049 - optuna.study.study - INFO - Trial 212 finished with values: [0.004364381436550387, 0.0007401701386563064, 0.002507302998543077] and parameters: {'n_layers': 4, 'embedding_dim': 32, 'lr': 0.01653233581742127, 'lambda_val': 7.204655475546071e-06, 'batch_size': 1946, 'optimizer': 'RMSprop'}.
2026-06-04 15:21:01,312 - optuna.study.study - INFO - Trial 213 finished with values: [0.0037156525882981223, 0.0005559649005291715, 0.002122322356718074] and parameters: {'n_layers': 1, 'embedding_dim': 64, 'lr': 0.0004090776901902334, 'lambda_val': 1.8898212223948182e-06, 'batch_size': 1826, 'optimizer': 'Adam'}.
2026-06-04 15:21:29,808 - experiment_functions - INFO - Early stopping at epoch 650. Best Metrics: (0.005486133195351366, 0.0009193515975617926, 0.00305072357780515)
2026-06-04 15:21:29,899 - optuna.study.study - INFO - Trial 214 finished with values: [0.005486133195351366, 0.0009193515975617926, 0.00305072357780515] and parameters: {'n_layers': 4, 'embedding_dim': 96, 'lr': 0.009897528698746164, 'lambda_val': 7.204655475546071e-06, 'batch_size': 3585, 'optimizer': 'RMSprop'}.
2026-06-04 15:22:10,142 - experiment_functions - INFO - Early stopping at epoch 950. Best Metrics: (0.0007184727915071583, 8.205506062026927e-05, 0.00032122803747928704)
2026-06-04 15:22:10,211 - optuna.study.study - INFO - Trial 215 finished with values: [0.0007184727915071583, 8.205506062026927e-05, 0.00032122803747928704] and parameters: {'n_layers': 4, 'embedding_dim': 96, 'lr': 2.270462044380253e-05, 'lambda_val': 3.266599538089538e-05, 'batch_size': 1946, 'optimizer': 'Adam'}.
2026-06-04 15:22:37,604 - experiment_functions - INFO - Early stopping at epoch 650. Best Metrics: (0.007213522511764418, 0.0013246031214414896, 0.004078511021935875)
2026-06-04 15:22:37,711 - optuna.study.study - INFO - Trial 216 finished with values: [0.007213522511764418, 0.0013246031214414896, 0.004078511021935875] and parameters: {'n_layers': 4, 'embedding_dim': 64, 'lr': 0.004480000793937752, 'lambda_val': 5.016933039935782e-06, 'batch_size': 2516, 'optimizer': 'Adam'}.
2026-06-04 15:23:24,622 - experiment_functions - INFO - Early stopping at epoch 1100. Best Metrics: (0.009286834387442003, 0.0017131087145823567, 0.00544674697045787)
