2026-06-04 01:01:59,534 - optuna.study.study - INFO - Trial 20 finished with values: [0.00031141927544386846, 5.023779221649139e-05, 0.0001228405223862344] and parameters: {'n_layers': 1, 'embedding_dim': 64, 'lr': 0.09025868098763766, 'lambda_val': 0.0013601176283491567, 'batch_size': 3457, 'optimizer': 'SGD'}.
2026-06-04 01:02:21,282 - experiment_functions - INFO - Early stopping at epoch 550. Best Metrics: (0.0023857524787967792, 0.00035333913858932284, 0.001256726790217727)
2026-06-04 01:02:21,354 - optuna.study.study - INFO - Trial 21 finished with values: [0.0023857524787967792, 0.00035333913858932284, 0.001256726790217727] and parameters: {'n_layers': 1, 'embedding_dim': 32, 'lr': 0.07187904576023343, 'lambda_val': 5.915055659206572e-06, 'batch_size': 3504, 'optimizer': 'Adam'}.
2026-06-04 01:05:19,213 - optuna.study.study - INFO - Trial 22 finished with values: [0.0064632225246152334, 0.00112700113872329, 0.003583088636882149] and parameters: {'n_layers': 2, 'embedding_dim': 256, 'lr': 0.0006097425316287412, 'lambda_val': 2.2435960383986775e-06, 'batch_size': 2236, 'optimizer': 'Adam'}.
2026-06-04 01:05:42,277 - experiment_functions - INFO - Early stopping at epoch 500. Best Metrics: (0.0005927783862010883, 7.870587447250317e-05, 0.0002896031721874602)
2026-06-04 01:05:42,396 - optuna.study.study - INFO - Trial 23 finished with values: [0.0005927783862010883, 7.870587447250317e-05, 0.0002896031721874602] and parameters: {'n_layers': 4, 'embedding_dim': 128, 'lr': 0.009770246827701563, 'lambda_val': 1.5616918548184367e-05, 'batch_size': 1164, 'optimizer': 'SGD'}.
2026-06-04 01:06:50,086 - experiment_functions - INFO - Early stopping at epoch 1500. Best Metrics: (0.0007869477511198324, 9.042802598968451e-05, 0.00035352246184308363)
2026-06-04 01:06:50,176 - optuna.study.study - INFO - Trial 24 finished with values: [0.0007869477511198324, 9.042802598968451e-05, 0.00035352246184308363] and parameters: {'n_layers': 2, 'embedding_dim': 256, 'lr': 4.246245818101396e-05, 'lambda_val': 0.000877334254045309, 'batch_size': 3605, 'optimizer': 'RMSprop'}.
2026-06-04 01:07:14,214 - experiment_functions - INFO - Early stopping at epoch 600. Best Metrics: (0.0047478912473677614, 0.0007719874070600844, 0.002684354549183912)
2026-06-04 01:07:14,330 - optuna.study.study - INFO - Trial 25 finished with values: [0.0047478912473677614, 0.0007719874070600844, 0.002684354549183912] and parameters: {'n_layers': 3, 'embedding_dim': 32, 'lr': 0.01099734275168188, 'lambda_val': 2.1809499050591773e-05, 'batch_size': 3753, 'optimizer': 'RMSprop'}.
2026-06-04 01:08:44,201 - experiment_functions - INFO - Early stopping at epoch 2450. Best Metrics: (0.003916936841324433, 0.000755241476321254, 0.0022758297531413544)
2026-06-04 01:08:44,340 - optuna.study.study - INFO - Trial 26 finished with values: [0.003916936841324433, 0.000755241476321254, 0.0022758297531413544] and parameters: {'n_layers': 1, 'embedding_dim': 64, 'lr': 0.014057671404838507, 'lambda_val': 0.004181259159598131, 'batch_size': 2510, 'optimizer': 'Adam'}.
2026-06-04 01:09:04,261 - experiment_functions - INFO - Early stopping at epoch 500. Best Metrics: (0.0004391655325437975, 6.698372295532186e-05, 0.0002023735562796852)
2026-06-04 01:09:04,386 - optuna.study.study - INFO - Trial 27 finished with values: [0.0004391655325437975, 6.698372295532186e-05, 0.0002023735562796852] and parameters: {'n_layers': 1, 'embedding_dim': 32, 'lr': 6.699508675146568e-05, 'lambda_val': 0.005077641816195355, 'batch_size': 2706, 'optimizer': 'SGD'}.
2026-06-04 01:09:31,303 - experiment_functions - INFO - Early stopping at epoch 500. Best Metrics: (0.0005368876181549462, 7.200750217697099e-05, 0.000232734177600579)
2026-06-04 01:09:31,404 - optuna.study.study - INFO - Trial 28 finished with values: [0.0005368876181549462, 7.200750217697099e-05, 0.000232734177600579] and parameters: {'n_layers': 4, 'embedding_dim': 256, 'lr': 0.00012424951465004545, 'lambda_val': 3.8613487775841215e-06, 'batch_size': 1315, 'optimizer': 'SGD'}.
2026-06-04 01:09:51,915 - experiment_functions - INFO - Early stopping at epoch 500. Best Metrics: (0.00048639878526583817, 7.200750217697099e-05, 0.00023761582350613592)
2026-06-04 01:09:52,916 - optuna.study.study - INFO - Trial 29 finished with values: [0.00048639878526583817, 7.200750217697099e-05, 0.00023761582350613592] and parameters: {'n_layers': 3, 'embedding_dim': 32, 'lr': 0.0025795756581398536, 'lambda_val': 0.06278402406394074, 'batch_size': 679, 'optimizer': 'SGD'}.
2026-06-04 01:12:16,691 - optuna.study.study - INFO - Trial 30 finished with values: [0.0069700943388537676, 0.0010868109049500972, 0.004090296490859335] and parameters: {'n_layers': 2, 'embedding_dim': 32, 'lr': 0.0007463197710430186, 'lambda_val': 0.0001888631680612503, 'batch_size': 1752, 'optimizer': 'Adam'}.
2026-06-04 01:12:42,000 - experiment_functions - INFO - Early stopping at epoch 500. Best Metrics: (0.0003808404400295284, 6.865831602920491e-05, 0.00018167296164083122)
2026-06-04 01:12:42,365 - optuna.study.study - INFO - Trial 31 finished with values: [0.0003808404400295284, 6.865831602920491e-05, 0.00018167296164083122] and parameters: {'n_layers': 3, 'embedding_dim': 256, 'lr': 0.00016964892264349868, 'lambda_val': 0.0008973938349176793, 'batch_size': 773, 'optimizer': 'SGD'}.
2026-06-04 01:13:12,366 - experiment_functions - INFO - Early stopping at epoch 700. Best Metrics: (0.005326558219057929, 0.0010014066581820618, 0.0032316244228357874)
2026-06-04 01:13:12,733 - optuna.study.study - INFO - Trial 32 finished with values: [0.005326558219057929, 0.0010014066581820618, 0.0032316244228357874] and parameters: {'n_layers': 2, 'embedding_dim': 128, 'lr': 0.004527047386587098, 'lambda_val': 0.00026012148846087845, 'batch_size': 1923, 'optimizer': 'Adam'}.
2026-06-04 01:14:57,252 - experiment_functions - INFO - Early stopping at epoch 2750. Best Metrics: (0.0038065666938178243, 0.0006882577533659322, 0.002270984395901817)
2026-06-04 01:14:57,352 - optuna.study.study - INFO - Trial 33 finished with values: [0.0038065666938178243, 0.0006882577533659322, 0.002270984395901817] and parameters: {'n_layers': 1, 'embedding_dim': 128, 'lr': 0.0008589356470438068, 'lambda_val': 0.01026021876459957, 'batch_size': 2901, 'optimizer': 'RMSprop'}.
2026-06-04 01:15:35,278 - experiment_functions - INFO - Early stopping at epoch 750. Best Metrics: (0.006798993037976203, 0.0012107307924174428, 0.0038422892056207327)
2026-06-04 01:15:35,381 - optuna.study.study - INFO - Trial 34 finished with values: [0.006798993037976203, 0.0012107307924174428, 0.0038422892056207327] and parameters: {'n_layers': 3, 'embedding_dim': 256, 'lr': 0.005091659899861729, 'lambda_val': 8.472875869813855e-05, 'batch_size': 1158, 'optimizer': 'Adam'}.
2026-06-04 01:15:58,779 - experiment_functions - INFO - Early stopping at epoch 550. Best Metrics: (0.003214151974775475, 0.000540893562864224, 0.0019691965522495515)
2026-06-04 01:15:58,878 - optuna.study.study - INFO - Trial 35 finished with values: [0.003214151974775475, 0.000540893562864224, 0.0019691965522495515] and parameters: {'n_layers': 3, 'embedding_dim': 64, 'lr': 0.034261537155851944, 'lambda_val': 5.688960731175793e-05, 'batch_size': 3299, 'optimizer': 'RMSprop'}.
2026-06-04 01:16:20,641 - experiment_functions - INFO - Early stopping at epoch 500. Best Metrics: (0.0004796109947471236, 7.368209525085403e-05, 0.0002651524662165171)
2026-06-04 01:16:21,046 - optuna.study.study - INFO - Trial 36 finished with values: [0.0004796109947471236, 7.368209525085403e-05, 0.0002651524662165171] and parameters: {'n_layers': 2, 'embedding_dim': 128, 'lr': 0.001269502212766453, 'lambda_val': 1.1595522767094412e-05, 'batch_size': 3848, 'optimizer': 'SGD'}.
2026-06-04 01:16:47,926 - experiment_functions - INFO - Early stopping at epoch 550. Best Metrics: (0.004491601628598643, 0.0007284479871391252, 0.0026095843879913013)
2026-06-04 01:16:48,501 - optuna.study.study - INFO - Trial 37 finished with values: [0.004491601628598643, 0.0007284479871391252, 0.0026095843879913013] and parameters: {'n_layers': 2, 'embedding_dim': 256, 'lr': 0.028959132035735552, 'lambda_val': 0.00013240141630371793, 'batch_size': 2817, 'optimizer': 'Adam'}.
2026-06-04 01:17:14,254 - experiment_functions - INFO - Early stopping at epoch 500. Best Metrics: (0.00037561665317270955, 7.703128139862015e-05, 0.0002060897686759766)
2026-06-04 01:17:14,371 - optuna.study.study - INFO - Trial 38 finished with values: [0.00037561665317270955, 7.703128139862015e-05, 0.0002060897686759766] and parameters: {'n_layers': 3, 'embedding_dim': 256, 'lr': 3.6291876994825016e-05, 'lambda_val': 7.687760190299752e-06, 'batch_size': 3078, 'optimizer': 'SGD'}.
2026-06-04 01:17:41,398 - experiment_functions - INFO - Early stopping at epoch 500. Best Metrics: (0.0005139344197343728, 6.530912988143882e-05, 0.0002499030477815192)
2026-06-04 01:17:41,849 - optuna.study.study - INFO - Trial 39 finished with values: [0.0005139344197343728, 6.530912988143882e-05, 0.0002499030477815192] and parameters: {'n_layers': 4, 'embedding_dim': 256, 'lr': 0.00364702323355297, 'lambda_val': 2.1719689200685895e-05, 'batch_size': 3183, 'optimizer': 'SGD'}.
2026-06-04 01:18:45,059 - experiment_functions - INFO - Early stopping at epoch 1400. Best Metrics: (0.0005805314895862261, 7.368209525085404e-05, 0.0002544633277902368)
2026-06-04 01:18:45,198 - optuna.study.study - INFO - Trial 40 finished with values: [0.0005805314895862261, 7.368209525085404e-05, 0.0002544633277902368] and parameters: {'n_layers': 2, 'embedding_dim': 256, 'lr': 3.441668049265303e-05, 'lambda_val': 1.603098101153512e-05, 'batch_size': 787, 'optimizer': 'RMSprop'}.
2026-06-04 01:19:27,184 - experiment_functions - INFO - Early stopping at epoch 1100. Best Metrics: (0.00464263905904739, 0.0008423203161631723, 0.002532886078219929)
2026-06-04 01:19:27,294 - optuna.study.study - INFO - Trial 41 finished with values: [0.00464263905904739, 0.0008423203161631723, 0.002532886078219929] and parameters: {'n_layers': 1, 'embedding_dim': 64, 'lr': 0.006823905996005937, 'lambda_val': 0.03809846794796893, 'batch_size': 3623, 'optimizer': 'RMSprop'}.
2026-06-04 01:19:54,415 - experiment_functions - INFO - Early stopping at epoch 650. Best Metrics: (0.003535050912586176, 0.0005274968182731596, 0.001975159331468489)
2026-06-04 01:19:55,917 - optuna.study.study - INFO - Trial 42 finished with values: [0.003535050912586176, 0.0005274968182731596, 0.001975159331468489] and parameters: {'n_layers': 1, 'embedding_dim': 128, 'lr': 0.028504820821667567, 'lambda_val': 2.310635277329693e-05, 'batch_size': 1834, 'optimizer': 'RMSprop'}.
2026-06-04 01:20:22,784 - experiment_functions - INFO - Early stopping at epoch 500. Best Metrics: (0.00041870413714775896, 8.70788398419184e-05, 0.00022115346962856374)
2026-06-04 01:20:22,920 - optuna.study.study - INFO - Trial 43 finished with values: [0.00041870413714775896, 8.70788398419184e-05, 0.00022115346962856374] and parameters: {'n_layers': 2, 'embedding_dim': 256, 'lr': 6.355675710092495e-05, 'lambda_val': 2.399223243954385e-06, 'batch_size': 2895, 'optimizer': 'SGD'}.
2026-06-04 01:20:44,708 - experiment_functions - INFO - Early stopping at epoch 500. Best Metrics: (0.0005383623082363498, 8.875343291580146e-05, 0.0002626367272063927)
2026-06-04 01:20:45,746 - optuna.study.study - INFO - Trial 44 finished with values: [0.0005383623082363498, 8.875343291580146e-05, 0.0002626367272063927] and parameters: {'n_layers': 2, 'embedding_dim': 128, 'lr': 7.37119818112549e-05, 'lambda_val': 0.07191932301410733, 'batch_size': 1780, 'optimizer': 'SGD'}.
2026-06-04 01:21:19,165 - experiment_functions - INFO - Early stopping at epoch 850. Best Metrics: (0.006252696024076949, 0.0010298747404380736, 0.0036812937108939695)
2026-06-04 01:21:19,313 - optuna.study.study - INFO - Trial 45 finished with values: [0.006252696024076949, 0.0010298747404380736, 0.0036812937108939695] and parameters: {'n_layers': 3, 'embedding_dim': 32, 'lr': 0.0022306925911484794, 'lambda_val': 7.753300191826788e-06, 'batch_size': 3931, 'optimizer': 'Adam'}.
2026-06-04 01:21:46,590 - experiment_functions - INFO - Early stopping at epoch 500. Best Metrics: (0.0004915096993699452, 7.033290910308797e-05, 0.0002033861422578986)
2026-06-04 01:21:47,033 - optuna.study.study - INFO - Trial 46 finished with values: [0.0004915096993699452, 7.033290910308797e-05, 0.0002033861422578986] and parameters: {'n_layers': 4, 'embedding_dim': 256, 'lr': 0.0006750072862830801, 'lambda_val': 2.4278531579666018e-05, 'batch_size': 3326, 'optimizer': 'SGD'}.
2026-06-04 01:24:24,930 - optuna.study.study - INFO - Trial 47 finished with values: [0.0024399844465907822, 0.0003566883247370889, 0.001360042881061192] and parameters: {'n_layers': 2, 'embedding_dim': 128, 'lr': 0.00015842116483563462, 'lambda_val': 0.0016415700559882936, 'batch_size': 4069, 'optimizer': 'RMSprop'}.
2026-06-04 01:24:47,434 - experiment_functions - INFO - Early stopping at epoch 500. Best Metrics: (0.00041467406514604136, 7.703128139862015e-05, 0.00019668435841299235)
2026-06-04 01:24:47,592 - optuna.study.study - INFO - Trial 48 finished with values: [0.00041467406514604136, 7.703128139862015e-05, 0.00019668435841299235] and parameters: {'n_layers': 4, 'embedding_dim': 96, 'lr': 0.0012538107962443686, 'lambda_val': 0.058635241097055826, 'batch_size': 2026, 'optimizer': 'SGD'}.
2026-06-04 01:25:09,404 - experiment_functions - INFO - Early stopping at epoch 500. Best Metrics: (0.00044113414689601747, 7.53566883247371e-05, 0.0002074107608214045)
2026-06-04 01:25:09,541 - optuna.study.study - INFO - Trial 49 finished with values: [0.00044113414689601747, 7.53566883247371e-05, 0.0002074107608214045] and parameters: {'n_layers': 3, 'embedding_dim': 96, 'lr': 0.03404425582786039, 'lambda_val': 9.217034241152206e-06, 'batch_size': 2762, 'optimizer': 'SGD'}.
2026-06-04 01:27:41,546 - optuna.study.study - INFO - Trial 50 finished with values: [0.0006890450580782138, 0.00010215017750686583, 0.00029828231465446283] and parameters: {'n_layers': 1, 'embedding_dim': 128, 'lr': 5.308039630761987e-05, 'lambda_val': 2.310635277329693e-05, 'batch_size': 2739, 'optimizer': 'Adam'}.
2026-06-04 01:28:48,620 - experiment_functions - INFO - Early stopping at epoch 1750. Best Metrics: (0.0043017183853440175, 0.0007904079308727979, 0.002376151510639919)
2026-06-04 01:28:48,818 - optuna.study.study - INFO - Trial 51 finished with values: [0.0043017183853440175, 0.0007904079308727979, 0.002376151510639919] and parameters: {'n_layers': 1, 'embedding_dim': 96, 'lr': 0.014057671404838507, 'lambda_val': 0.07713841098783157, 'batch_size': 2844, 'optimizer': 'Adam'}.
2026-06-04 01:29:12,797 - experiment_functions - INFO - Early stopping at epoch 500. Best Metrics: (0.0006177188011457333, 8.70788398419184e-05, 0.0002762483674905524)
2026-06-04 01:29:14,007 - optuna.study.study - INFO - Trial 52 finished with values: [0.0006177188011457333, 8.70788398419184e-05, 0.0002762483674905524] and parameters: {'n_layers': 2, 'embedding_dim': 256, 'lr': 0.0002187261920360521, 'lambda_val': 0.00013240141630371793, 'batch_size': 546, 'optimizer': 'SGD'}.
2026-06-04 01:29:44,420 - experiment_functions - INFO - Early stopping at epoch 550. Best Metrics: (0.006295677596995782, 0.0011403978833143548, 0.003480082570690476)
2026-06-04 01:29:44,540 - optuna.study.study - INFO - Trial 53 finished with values: [0.006295677596995782, 0.0011403978833143548, 0.003480082570690476] and parameters: {'n_layers': 4, 'embedding_dim': 256, 'lr': 0.0036679476641700757, 'lambda_val': 0.0016044761768607098, 'batch_size': 3054, 'optimizer': 'RMSprop'}.
2026-06-04 01:32:20,210 - optuna.study.study - INFO - Trial 54 finished with values: [0.005457876476579094, 0.0009846607274432314, 0.0032541491581024548] and parameters: {'n_layers': 4, 'embedding_dim': 64, 'lr': 0.00020852731164978597, 'lambda_val': 0.004181259159598131, 'batch_size': 3623, 'optimizer': 'RMSprop'}.
2026-06-04 01:32:41,220 - experiment_functions - INFO - Early stopping at epoch 500. Best Metrics: (0.0007244460379381823, 8.372965369415234e-05, 0.00032242502747621135)
2026-06-04 01:32:41,447 - optuna.study.study - INFO - Trial 55 finished with values: [0.0007244460379381823, 8.372965369415234e-05, 0.00032242502747621135] and parameters: {'n_layers': 1, 'embedding_dim': 128, 'lr': 0.028504820821667567, 'lambda_val': 2.310635277329693e-05, 'batch_size': 1834, 'optimizer': 'SGD'}.
2026-06-04 01:33:31,889 - experiment_functions - INFO - Early stopping at epoch 1100. Best Metrics: (0.0005801734668189309, 9.210261906356757e-05, 0.00026842229097728636)
2026-06-04 01:33:32,244 - optuna.study.study - INFO - Trial 56 finished with values: [0.0005801734668189309, 9.210261906356757e-05, 0.00026842229097728636] and parameters: {'n_layers': 2, 'embedding_dim': 256, 'lr': 3.18787545234542e-05, 'lambda_val': 0.007877559318286393, 'batch_size': 1441, 'optimizer': 'RMSprop'}.
2026-06-04 01:34:19,413 - experiment_functions - INFO - Early stopping at epoch 1100. Best Metrics: (0.0029586690509749826, 0.0004152990823229956, 0.0014845506794725527)
2026-06-04 01:34:19,529 - optuna.study.study - INFO - Trial 57 finished with values: [0.0029586690509749826, 0.0004152990823229956, 0.0014845506794725527] and parameters: {'n_layers': 1, 'embedding_dim': 256, 'lr': 0.05854985506515562, 'lambda_val': 2.6963455125652685e-06, 'batch_size': 3212, 'optimizer': 'RMSprop'}.
2026-06-04 01:36:57,374 - optuna.study.study - INFO - Trial 58 finished with values: [0.001906932389058154, 0.00025788733337798916, 0.0010031113340239497] and parameters: {'n_layers': 2, 'embedding_dim': 128, 'lr': 0.00015842116483563462, 'lambda_val': 0.007877559318286393, 'batch_size': 2844, 'optimizer': 'RMSprop'}.
2026-06-04 01:37:21,246 - experiment_functions - INFO - Early stopping at epoch 500. Best Metrics: (0.00045918524589330526, 6.530912988143882e-05, 0.00022571914773352508)
2026-06-04 01:37:21,349 - optuna.study.study - INFO - Trial 59 finished with values: [0.00045918524589330526, 6.530912988143882e-05, 0.00022571914773352508] and parameters: {'n_layers': 2, 'embedding_dim': 256, 'lr': 0.00017650678558847274, 'lambda_val': 0.0003659354178538993, 'batch_size': 1699, 'optimizer': 'SGD'}.
2026-06-04 01:37:44,794 - experiment_functions - INFO - Early stopping at epoch 600. Best Metrics: (0.0005478274090375384, 8.540424676803537e-05, 0.00028147775034294487)
2026-06-04 01:37:44,905 - optuna.study.study - INFO - Trial 60 finished with values: [0.0005478274090375384, 8.540424676803537e-05, 0.00028147775034294487] and parameters: {'n_layers': 1, 'embedding_dim': 32, 'lr': 0.07187904576023343, 'lambda_val': 5.915055659206572e-06, 'batch_size': 2817, 'optimizer': 'SGD'}.
2026-06-04 01:40:10,386 - optuna.study.study - INFO - Trial 61 finished with values: [0.002844472236039672, 0.0003935293723625159, 0.0015047093709931144] and parameters: {'n_layers': 3, 'embedding_dim': 32, 'lr': 0.00015842116483563462, 'lambda_val': 0.0012199133261869412, 'batch_size': 3931, 'optimizer': 'RMSprop'}.
2026-06-04 01:40:59,926 - experiment_functions - INFO - Early stopping at epoch 1250. Best Metrics: (0.0038705725899720036, 0.0006681626364793356, 0.0023628851874213297)
2026-06-04 01:41:00,044 - optuna.study.study - INFO - Trial 62 finished with values: [0.0038705725899720036, 0.0006681626364793356, 0.0023628851874213297] and parameters: {'n_layers': 1, 'embedding_dim': 128, 'lr': 0.0008797904665419303, 'lambda_val': 0.004181259159598131, 'batch_size': 2510, 'optimizer': 'RMSprop'}.
2026-06-04 01:44:23,683 - optuna.study.study - INFO - Trial 63 finished with values: [0.002005710398736036, 0.000326545649407194, 0.001133993312746564] and parameters: {'n_layers': 4, 'embedding_dim': 256, 'lr': 0.00012424951465004545, 'lambda_val': 1.7827761161994677e-05, 'batch_size': 1943, 'optimizer': 'Adam'}.
2026-06-04 01:46:00,995 - experiment_functions - INFO - Early stopping at epoch 2450. Best Metrics: (0.0005066437542286278, 9.210261906356756e-05, 0.00025436317167886824)
2026-06-04 01:46:01,093 - optuna.study.study - INFO - Trial 64 finished with values: [0.0005066437542286278, 9.210261906356756e-05, 0.00025436317167886824] and parameters: {'n_layers': 3, 'embedding_dim': 96, 'lr': 5.6572504128012725e-05, 'lambda_val': 0.00015911449534133392, 'batch_size': 949, 'optimizer': 'RMSprop'}.
2026-06-04 01:46:28,685 - experiment_functions - INFO - Early stopping at epoch 700. Best Metrics: (0.0003608976809102248, 7.033290910308795e-05, 0.00017817062921180658)
2026-06-04 01:46:28,876 - optuna.study.study - INFO - Trial 65 finished with values: [0.0003608976809102248, 7.033290910308795e-05, 0.00017817062921180658] and parameters: {'n_layers': 2, 'embedding_dim': 32, 'lr': 1.619917766538419e-05, 'lambda_val': 0.0001888631680612503, 'batch_size': 3623, 'optimizer': 'RMSprop'}.
2026-06-04 01:46:52,496 - experiment_functions - INFO - Early stopping at epoch 550. Best Metrics: (0.003937498367200171, 0.0006681626364793355, 0.0023869588437644873)
2026-06-04 01:46:52,627 - optuna.study.study - INFO - Trial 66 finished with values: [0.003937498367200171, 0.0006681626364793355, 0.0023869588437644873] and parameters: {'n_layers': 3, 'embedding_dim': 64, 'lr': 0.04202506867893529, 'lambda_val': 1.4832794204419072e-06, 'batch_size': 3299, 'optimizer': 'RMSprop'}.
2026-06-04 01:48:04,485 - experiment_functions - INFO - Early stopping at epoch 1950. Best Metrics: (0.0005585526027724363, 7.53566883247371e-05, 0.00024921176041339983)
2026-06-04 01:48:04,808 - optuna.study.study - INFO - Trial 67 finished with values: [0.0005585526027724363, 7.53566883247371e-05, 0.00024921176041339983] and parameters: {'n_layers': 2, 'embedding_dim': 32, 'lr': 3.441668049265303e-05, 'lambda_val': 1.00995462098372e-06, 'batch_size': 4048, 'optimizer': 'RMSprop'}.
2026-06-04 01:48:36,001 - experiment_functions - INFO - Early stopping at epoch 600. Best Metrics: (0.005090566317884616, 0.0009310737490789739, 0.0028876129925148246)
