2026-06-06 11:38:03,720 - optuna.study.study - INFO - Trial 263 finished with values: [0.07864625638028672, 0.010253533391385893, 0.04391460484906113] and parameters: {'n_layers': 1, 'embedding_dim': 128, 'lr': 0.0006810282647636203, 'lambda_val': 5.510107267630662e-06, 'batch_size': 3209, 'optimizer': 'Adam'}.
2026-06-06 11:38:25,498 - experiment_functions - INFO - Early stopping at epoch 500. Best Metrics: (0.0005540950284440466, 8.038046754638622e-05, 0.0002688261778424774)
2026-06-06 11:38:25,576 - optuna.study.study - INFO - Trial 264 finished with values: [0.0005540950284440466, 8.038046754638622e-05, 0.0002688261778424774] and parameters: {'n_layers': 1, 'embedding_dim': 128, 'lr': 3.1703938826330585e-05, 'lambda_val': 0.0003223122856697912, 'batch_size': 2873, 'optimizer': 'RMSprop'}.
2026-06-06 11:41:28,221 - optuna.study.study - INFO - Trial 265 finished with values: [0.08090591826524193, 0.01059180119231027, 0.044089180731856935] and parameters: {'n_layers': 1, 'embedding_dim': 256, 'lr': 0.0006711529294623438, 'lambda_val': 1.2176798127435423e-06, 'batch_size': 3209, 'optimizer': 'Adam'}.
2026-06-06 11:43:08,436 - experiment_functions - INFO - Early stopping at epoch 2150. Best Metrics: (0.09142815253954469, 0.011213075222720878, 0.048279525188696486)
2026-06-06 11:43:08,540 - optuna.study.study - INFO - Trial 266 finished with values: [0.09142815253954469, 0.011213075222720878, 0.048279525188696486] and parameters: {'n_layers': 1, 'embedding_dim': 256, 'lr': 0.0016789844014982978, 'lambda_val': 3.456741724473969e-06, 'batch_size': 2384, 'optimizer': 'Adam'}.
2026-06-06 11:45:43,399 - experiment_functions - INFO - Early stopping at epoch 3100. Best Metrics: (0.06016162571236769, 0.006825641369147297, 0.028045762081889233)
2026-06-06 11:45:43,477 - optuna.study.study - INFO - Trial 267 finished with values: [0.06016162571236769, 0.006825641369147297, 0.028045762081889233] and parameters: {'n_layers': 2, 'embedding_dim': 256, 'lr': 0.0019509035141199726, 'lambda_val': 1.2176798127435423e-06, 'batch_size': 2384, 'optimizer': 'RMSprop'}.
2026-06-06 11:48:20,555 - optuna.study.study - INFO - Trial 268 finished with values: [0.0871380556637931, 0.01063701520530511, 0.04692112143760766] and parameters: {'n_layers': 1, 'embedding_dim': 32, 'lr': 0.0019509035141199726, 'lambda_val': 1.3036977819163817e-06, 'batch_size': 3209, 'optimizer': 'Adam'}.
2026-06-06 11:49:50,411 - experiment_functions - INFO - Early stopping at epoch 1950. Best Metrics: (0.05438220139141725, 0.006540960546587179, 0.026394888281042167)
2026-06-06 11:49:50,489 - optuna.study.study - INFO - Trial 269 finished with values: [0.05438220139141725, 0.006540960546587179, 0.026394888281042167] and parameters: {'n_layers': 4, 'embedding_dim': 96, 'lr': 0.0006711529294623438, 'lambda_val': 5.315262969436241e-05, 'batch_size': 2384, 'optimizer': 'RMSprop'}.
2026-06-06 11:50:46,758 - experiment_functions - INFO - Early stopping at epoch 1500. Best Metrics: (0.0004371171637309789, 5.6936164512023584e-05, 0.0001916061548766624)
2026-06-06 11:50:47,418 - optuna.study.study - INFO - Trial 270 finished with values: [0.0004371171637309789, 5.6936164512023584e-05, 0.0001916061548766624] and parameters: {'n_layers': 1, 'embedding_dim': 32, 'lr': 2.492206029982229e-05, 'lambda_val': 5.148126115320708e-06, 'batch_size': 3209, 'optimizer': 'Adam'}.
2026-06-06 11:52:27,926 - experiment_functions - INFO - Early stopping at epoch 2150. Best Metrics: (0.09023462981755567, 0.010997052716189967, 0.047807819992661156)
2026-06-06 11:52:28,230 - optuna.study.study - INFO - Trial 271 finished with values: [0.09023462981755567, 0.010997052716189967, 0.047807819992661156] and parameters: {'n_layers': 1, 'embedding_dim': 256, 'lr': 0.0018430978876726675, 'lambda_val': 5.510107267630662e-06, 'batch_size': 2564, 'optimizer': 'Adam'}.
2026-06-06 11:53:28,289 - experiment_functions - INFO - Early stopping at epoch 1450. Best Metrics: (0.056987182657152816, 0.006559381070399894, 0.027058966961854405)
2026-06-06 11:53:28,685 - optuna.study.study - INFO - Trial 272 finished with values: [0.056987182657152816, 0.006559381070399894, 0.027058966961854405] and parameters: {'n_layers': 1, 'embedding_dim': 96, 'lr': 0.005828487948467767, 'lambda_val': 7.265971768922724e-05, 'batch_size': 3082, 'optimizer': 'RMSprop'}.
2026-06-06 11:55:30,177 - experiment_functions - INFO - Early stopping at epoch 2950. Best Metrics: (0.09350058823697287, 0.011409002612365198, 0.050435570769511655)
2026-06-06 11:55:30,281 - optuna.study.study - INFO - Trial 273 finished with values: [0.09350058823697287, 0.011409002612365198, 0.050435570769511655] and parameters: {'n_layers': 1, 'embedding_dim': 96, 'lr': 0.0019509035141199726, 'lambda_val': 1.3036977819163817e-06, 'batch_size': 1712, 'optimizer': 'Adam'}.
2026-06-06 11:58:52,706 - optuna.study.study - INFO - Trial 274 finished with values: [0.09032659067035408, 0.01088987875946145, 0.04747479442459522] and parameters: {'n_layers': 2, 'embedding_dim': 256, 'lr': 0.0006711529294623438, 'lambda_val': 1.2176798127435423e-06, 'batch_size': 2384, 'optimizer': 'RMSprop'}.
2026-06-06 11:59:31,143 - experiment_functions - INFO - Early stopping at epoch 900. Best Metrics: (0.07569099544031549, 0.009672449594748476, 0.039912565812969314)
2026-06-06 11:59:31,217 - optuna.study.study - INFO - Trial 275 finished with values: [0.07569099544031549, 0.009672449594748476, 0.039912565812969314] and parameters: {'n_layers': 1, 'embedding_dim': 96, 'lr': 0.0017827212934439936, 'lambda_val': 0.0006603606000578724, 'batch_size': 3082, 'optimizer': 'RMSprop'}.
2026-06-06 12:02:06,107 - optuna.study.study - INFO - Trial 276 finished with values: [0.08510216760201565, 0.010549936365463194, 0.04612968609724208] and parameters: {'n_layers': 1, 'embedding_dim': 32, 'lr': 0.0017827212934439936, 'lambda_val': 1.3036977819163817e-06, 'batch_size': 1712, 'optimizer': 'Adam'}.
2026-06-06 12:04:41,003 - optuna.study.study - INFO - Trial 277 finished with values: [0.08261323122745924, 0.010238462053720945, 0.04558547104636532] and parameters: {'n_layers': 1, 'embedding_dim': 32, 'lr': 0.0019509035141199726, 'lambda_val': 1.3036977819163817e-06, 'batch_size': 1712, 'optimizer': 'RMSprop'}.
2026-06-06 12:07:32,415 - optuna.study.study - INFO - Trial 278 finished with values: [0.05089559703240245, 0.006986402304240071, 0.028321303796048126] and parameters: {'n_layers': 2, 'embedding_dim': 128, 'lr': 0.00027961420373195966, 'lambda_val': 1.3036977819163817e-06, 'batch_size': 3209, 'optimizer': 'RMSprop'}.
2026-06-06 12:10:15,870 - optuna.study.study - INFO - Trial 279 finished with values: [0.07872961227755466, 0.00973608413155603, 0.04134960480409032] and parameters: {'n_layers': 2, 'embedding_dim': 64, 'lr': 0.0006711529294623438, 'lambda_val': 5.510107267630662e-06, 'batch_size': 3359, 'optimizer': 'Adam'}.
2026-06-06 12:11:24,705 - experiment_functions - INFO - Early stopping at epoch 1650. Best Metrics: (0.09063239800204013, 0.01104226672918481, 0.04747217848484518)
2026-06-06 12:11:24,914 - optuna.study.study - INFO - Trial 280 finished with values: [0.09063239800204013, 0.01104226672918481, 0.04747217848484518] and parameters: {'n_layers': 1, 'embedding_dim': 96, 'lr': 0.0019509035141199726, 'lambda_val': 5.148126115320708e-06, 'batch_size': 3209, 'optimizer': 'Adam'}.
2026-06-06 12:14:09,616 - optuna.study.study - INFO - Trial 281 finished with values: [0.06815644108420267, 0.009118159287293188, 0.03737449238508641] and parameters: {'n_layers': 1, 'embedding_dim': 128, 'lr': 0.0006711529294623438, 'lambda_val': 5.315262969436241e-05, 'batch_size': 2384, 'optimizer': 'Adam'}.
2026-06-06 12:14:55,417 - experiment_functions - INFO - Early stopping at epoch 1000. Best Metrics: (0.07468124875085745, 0.008923906490722755, 0.037178118670790294)
2026-06-06 12:14:56,509 - optuna.study.study - INFO - Trial 282 finished with values: [0.07468124875085745, 0.008923906490722755, 0.037178118670790294] and parameters: {'n_layers': 2, 'embedding_dim': 128, 'lr': 0.0019509035141199726, 'lambda_val': 3.456741724473969e-06, 'batch_size': 2384, 'optimizer': 'Adam'}.
2026-06-06 12:15:59,859 - experiment_functions - INFO - Early stopping at epoch 1350. Best Metrics: (0.08900265388555653, 0.010633666019157344, 0.04516970355028497)
2026-06-06 12:15:59,946 - optuna.study.study - INFO - Trial 283 finished with values: [0.08900265388555653, 0.010633666019157344, 0.04516970355028497] and parameters: {'n_layers': 1, 'embedding_dim': 256, 'lr': 0.0018430978876726675, 'lambda_val': 5.510107267630662e-06, 'batch_size': 2384, 'optimizer': 'RMSprop'}.
2026-06-06 12:18:34,177 - optuna.study.study - INFO - Trial 284 finished with values: [0.055638967224460496, 0.007294527429834552, 0.03143427885701563] and parameters: {'n_layers': 2, 'embedding_dim': 32, 'lr': 0.0006711529294623438, 'lambda_val': 1.3036977819163817e-06, 'batch_size': 1122, 'optimizer': 'Adam'}.
2026-06-06 12:21:07,165 - optuna.study.study - INFO - Trial 285 finished with values: [0.061195022769299716, 0.008285886529573313, 0.03259792794462378] and parameters: {'n_layers': 1, 'embedding_dim': 32, 'lr': 0.0006711529294623438, 'lambda_val': 0.003010182335575881, 'batch_size': 3866, 'optimizer': 'Adam'}.
2026-06-06 12:21:53,936 - experiment_functions - INFO - Early stopping at epoch 1150. Best Metrics: (0.0653064479169643, 0.00783207180655101, 0.03225706628745845)
2026-06-06 12:21:54,028 - optuna.study.study - INFO - Trial 286 finished with values: [0.0653064479169643, 0.00783207180655101, 0.03225706628745845] and parameters: {'n_layers': 2, 'embedding_dim': 32, 'lr': 0.0019509035141199726, 'lambda_val': 1.3036977819163817e-06, 'batch_size': 2579, 'optimizer': 'RMSprop'}.
2026-06-06 12:24:57,486 - optuna.study.study - INFO - Trial 287 finished with values: [0.09418701875115397, 0.011176234175095454, 0.04841419259824333] and parameters: {'n_layers': 1, 'embedding_dim': 256, 'lr': 0.0019509035141199726, 'lambda_val': 1.3036977819163817e-06, 'batch_size': 1122, 'optimizer': 'RMSprop'}.
2026-06-06 12:28:33,085 - optuna.study.study - INFO - Trial 288 finished with values: [0.04708982962727098, 0.005407261035568357, 0.022136986638429983] and parameters: {'n_layers': 3, 'embedding_dim': 256, 'lr': 0.0017827212934439936, 'lambda_val': 8.198950044762925e-06, 'batch_size': 1122, 'optimizer': 'RMSprop'}.
2026-06-06 12:31:52,726 - optuna.study.study - INFO - Trial 289 finished with values: [0.05946994385081177, 0.006741911715453144, 0.028203804478837306] and parameters: {'n_layers': 2, 'embedding_dim': 256, 'lr': 0.0019509035141199726, 'lambda_val': 5.510107267630662e-06, 'batch_size': 2873, 'optimizer': 'RMSprop'}.
2026-06-06 12:34:01,857 - experiment_functions - INFO - Early stopping at epoch 2550. Best Metrics: (0.08835200071985695, 0.010683903811373836, 0.04664984985854265)
2026-06-06 12:34:02,322 - optuna.study.study - INFO - Trial 290 finished with values: [0.08835200071985695, 0.010683903811373836, 0.04664984985854265] and parameters: {'n_layers': 2, 'embedding_dim': 256, 'lr': 0.0006711529294623438, 'lambda_val': 4.801966235090449e-06, 'batch_size': 2384, 'optimizer': 'RMSprop'}.
2026-06-06 12:36:38,842 - optuna.study.study - INFO - Trial 291 finished with values: [0.08637265616574487, 0.010487976421729519, 0.04561218740229372] and parameters: {'n_layers': 1, 'embedding_dim': 32, 'lr': 0.0017827212934439936, 'lambda_val': 1.3036977819163817e-06, 'batch_size': 3082, 'optimizer': 'RMSprop'}.
2026-06-06 12:38:44,831 - experiment_functions - INFO - Early stopping at epoch 3000. Best Metrics: (0.0933755842055337, 0.01124656708419854, 0.05019248832174519)
2026-06-06 12:38:44,926 - optuna.study.study - INFO - Trial 292 finished with values: [0.0933755842055337, 0.01124656708419854, 0.05019248832174519] and parameters: {'n_layers': 1, 'embedding_dim': 128, 'lr': 0.0019509035141199726, 'lambda_val': 4.2735070605297645e-06, 'batch_size': 1726, 'optimizer': 'Adam'}.
2026-06-06 12:39:30,782 - experiment_functions - INFO - Early stopping at epoch 1050. Best Metrics: (0.07351232976293129, 0.008944001607609352, 0.03775698391451184)
2026-06-06 12:39:30,880 - optuna.study.study - INFO - Trial 293 finished with values: [0.07351232976293129, 0.008944001607609352, 0.03775698391451184] and parameters: {'n_layers': 2, 'embedding_dim': 96, 'lr': 0.0019509035141199726, 'lambda_val': 5.315262969436241e-05, 'batch_size': 1712, 'optimizer': 'Adam'}.
2026-06-06 12:40:22,480 - experiment_functions - INFO - Early stopping at epoch 1150. Best Metrics: (0.05538676306502541, 0.006487373568222922, 0.025982625250523857)
2026-06-06 12:40:22,560 - optuna.study.study - INFO - Trial 294 finished with values: [0.05538676306502541, 0.006487373568222922, 0.025982625250523857] and parameters: {'n_layers': 2, 'embedding_dim': 128, 'lr': 0.0019509035141199726, 'lambda_val': 5.315262969436241e-05, 'batch_size': 2178, 'optimizer': 'RMSprop'}.
2026-06-06 12:41:23,193 - experiment_functions - INFO - Early stopping at epoch 1450. Best Metrics: (0.08516162414976014, 0.010151383213879029, 0.04315320583568863)
2026-06-06 12:41:23,275 - optuna.study.study - INFO - Trial 295 finished with values: [0.08516162414976014, 0.010151383213879029, 0.04315320583568863] and parameters: {'n_layers': 1, 'embedding_dim': 96, 'lr': 0.0019509035141199726, 'lambda_val': 1.3036977819163817e-06, 'batch_size': 3866, 'optimizer': 'RMSprop'}.
2026-06-06 12:42:40,968 - experiment_functions - INFO - Early stopping at epoch 1650. Best Metrics: (0.09262525813449517, 0.011124321789805077, 0.04828710861610429)
2026-06-06 12:42:41,058 - optuna.study.study - INFO - Trial 296 finished with values: [0.09262525813449517, 0.011124321789805077, 0.04828710861610429] and parameters: {'n_layers': 1, 'embedding_dim': 256, 'lr': 0.0017827212934439936, 'lambda_val': 5.148126115320708e-06, 'batch_size': 3209, 'optimizer': 'Adam'}.
2026-06-06 12:45:18,141 - optuna.study.study - INFO - Trial 297 finished with values: [0.08866311209180949, 0.010920021434791346, 0.0471884730228944] and parameters: {'n_layers': 1, 'embedding_dim': 32, 'lr': 0.0017827212934439936, 'lambda_val': 1.3036977819163817e-06, 'batch_size': 2384, 'optimizer': 'Adam'}.
2026-06-06 12:47:53,752 - optuna.study.study - INFO - Trial 298 finished with values: [0.08308486623548117, 0.010216692343760467, 0.04527503350505348] and parameters: {'n_layers': 1, 'embedding_dim': 32, 'lr': 0.0019509035141199726, 'lambda_val': 3.456741724473969e-06, 'batch_size': 1237, 'optimizer': 'RMSprop'}.
2026-06-06 12:48:16,049 - experiment_functions - INFO - Early stopping at epoch 550. Best Metrics: (0.0006464973891266088, 9.545180521133365e-05, 0.0002817145508699997)
2026-06-06 12:48:16,311 - optuna.study.study - INFO - Trial 299 finished with values: [0.0006464973891266088, 9.545180521133365e-05, 0.0002817145508699997] and parameters: {'n_layers': 2, 'embedding_dim': 32, 'lr': 5.5273788892405636e-05, 'lambda_val': 0.0006603606000578724, 'batch_size': 2579, 'optimizer': 'RMSprop'}.
2026-06-06 12:48:16,326 - root - INFO - Selected Trial 273 based on Max ndcg: 0.0504
2026-06-06 12:48:16,326 - root - INFO - Associated Recall: 0.0935
2026-06-06 12:48:16,326 - experiment_functions - INFO - Training the best model ... for e_gowalla_1c1dcs_rand4
2026-06-06 12:50:46,637 - experiment_functions - INFO - Early stopping at epoch 3650. Best Metrics: (0.09398037052963208, 0.011430772322325677, 0.05077258324648356)
2026-06-06 12:50:50,339 - root - INFO -   **** Training e_gowalla_1c1dcs_rand5
2026-06-06 12:50:50,436 - root - INFO -   **** Getting 368544/845292 random edges
2026-06-06 12:50:50,673 - optuna.storages._rdb.storage - INFO - A new study created in RDB with name: Study_e_gowalla_1c1dcs_rand5
2026-06-06 12:51:14,602 - experiment_functions - INFO - Early stopping at epoch 500. Best Metrics: (0.0005276957620170192, 8.205506062026927e-05, 0.00023430455150727584)
2026-06-06 12:51:14,695 - optuna.study.study - INFO - Trial 0 finished with values: [0.0005276957620170192, 8.205506062026927e-05, 0.00023430455150727584] and parameters: {'n_layers': 4, 'embedding_dim': 96, 'lr': 0.0074220680769118835, 'lambda_val': 0.07081681434299639, 'batch_size': 2556, 'optimizer': 'SGD'}.
2026-06-06 12:51:38,156 - experiment_functions - INFO - Early stopping at epoch 500. Best Metrics: (0.0005139973421703019, 6.195994373367272e-05, 0.00020778551319648698)
2026-06-06 12:51:38,262 - optuna.study.study - INFO - Trial 1 finished with values: [0.0005139973421703019, 6.195994373367272e-05, 0.00020778551319648698] and parameters: {'n_layers': 1, 'embedding_dim': 256, 'lr': 0.00013792592470301187, 'lambda_val': 0.06790004674705916, 'batch_size': 3377, 'optimizer': 'SGD'}.
2026-06-06 12:52:00,869 - experiment_functions - INFO - Early stopping at epoch 500. Best Metrics: (0.00030039912190376656, 7.368209525085404e-05, 0.00016962839526069544)
2026-06-06 12:52:00,951 - optuna.study.study - INFO - Trial 2 finished with values: [0.00030039912190376656, 7.368209525085404e-05, 0.00016962839526069544] and parameters: {'n_layers': 4, 'embedding_dim': 64, 'lr': 0.012136843006185682, 'lambda_val': 2.0434993155213635e-05, 'batch_size': 2963, 'optimizer': 'SGD'}.
2026-06-06 12:53:08,066 - experiment_functions - INFO - Early stopping at epoch 1450. Best Metrics: (0.03707890166464417, 0.004425949494272892, 0.017149529220934205)
2026-06-06 12:53:08,158 - optuna.study.study - INFO - Trial 3 finished with values: [0.03707890166464417, 0.004425949494272892, 0.017149529220934205] and parameters: {'n_layers': 4, 'embedding_dim': 96, 'lr': 0.0015700216413847947, 'lambda_val': 7.550136003216131e-06, 'batch_size': 2723, 'optimizer': 'RMSprop'}.
2026-06-06 12:53:31,438 - experiment_functions - INFO - Early stopping at epoch 500. Best Metrics: (0.0002884194733736012, 5.3586978364257486e-05, 0.00015204052532675723)
2026-06-06 12:53:31,611 - optuna.study.study - INFO - Trial 4 finished with values: [0.0002884194733736012, 5.3586978364257486e-05, 0.00015204052532675723] and parameters: {'n_layers': 3, 'embedding_dim': 96, 'lr': 1.0918799263594692e-05, 'lambda_val': 0.010322383267529251, 'batch_size': 3296, 'optimizer': 'Adam'}.
2026-06-06 12:53:55,035 - experiment_functions - INFO - Early stopping at epoch 500. Best Metrics: (0.0005599718895926751, 7.703128139862015e-05, 0.0002448690203162129)
2026-06-06 12:53:55,125 - optuna.study.study - INFO - Trial 5 finished with values: [0.0005599718895926751, 7.703128139862015e-05, 0.0002448690203162129] and parameters: {'n_layers': 1, 'embedding_dim': 256, 'lr': 0.043230505329432796, 'lambda_val': 5.4807114726775164e-05, 'batch_size': 3851, 'optimizer': 'SGD'}.
2026-06-06 12:55:00,947 - experiment_functions - INFO - Early stopping at epoch 1700. Best Metrics: (0.01220712414327205, 0.0014954116149775605, 0.005438433191078012)
2026-06-06 12:55:01,043 - optuna.study.study - INFO - Trial 6 finished with values: [0.01220712414327205, 0.0014954116149775605, 0.005438433191078012] and parameters: {'n_layers': 2, 'embedding_dim': 32, 'lr': 0.06128758575490874, 'lambda_val': 0.02351662149053395, 'batch_size': 3007, 'optimizer': 'RMSprop'}.
2026-06-06 12:56:40,174 - experiment_functions - INFO - Early stopping at epoch 1850. Best Metrics: (0.0006627056190479925, 8.707883984191843e-05, 0.0002893530771368745)
2026-06-06 12:56:40,742 - optuna.study.study - INFO - Trial 7 finished with values: [0.0006627056190479925, 8.707883984191843e-05, 0.0002893530771368745] and parameters: {'n_layers': 3, 'embedding_dim': 256, 'lr': 2.211843455549331e-05, 'lambda_val': 0.00014511874074845464, 'batch_size': 3623, 'optimizer': 'RMSprop'}.
2026-06-06 12:57:06,171 - experiment_functions - INFO - Early stopping at epoch 550. Best Metrics: (0.003998428010197256, 0.0005074017013865632, 0.0018517697873265113)
2026-06-06 12:57:06,257 - optuna.study.study - INFO - Trial 8 finished with values: [0.003998428010197256, 0.0005074017013865632, 0.0018517697873265113] and parameters: {'n_layers': 3, 'embedding_dim': 96, 'lr': 0.0693886464668809, 'lambda_val': 0.07777942389555165, 'batch_size': 2995, 'optimizer': 'Adam'}.
2026-06-06 13:00:03,461 - optuna.study.study - INFO - Trial 9 finished with values: [0.0020941421977632557, 0.0003315694286288432, 0.0010589568218027621] and parameters: {'n_layers': 3, 'embedding_dim': 128, 'lr': 0.00010628188820232566, 'lambda_val': 1.5188369665796941e-06, 'batch_size': 1885, 'optimizer': 'Adam'}.
2026-06-06 13:02:55,203 - optuna.study.study - INFO - Trial 10 finished with values: [0.058649082149444975, 0.007190702659253801, 0.030725535420749125] and parameters: {'n_layers': 4, 'embedding_dim': 64, 'lr': 0.0005366117657423627, 'lambda_val': 1.9837318123085626e-06, 'batch_size': 953, 'optimizer': 'RMSprop'}.
2026-06-06 13:03:20,925 - experiment_functions - INFO - Early stopping at epoch 500. Best Metrics: (0.0004348794414049366, 7.368209525085404e-05, 0.00024577039974056983)
2026-06-06 13:03:21,489 - optuna.study.study - INFO - Trial 11 finished with values: [0.0004348794414049366, 7.368209525085404e-05, 0.00024577039974056983] and parameters: {'n_layers': 2, 'embedding_dim': 256, 'lr': 0.038786485274008915, 'lambda_val': 7.5586798453824e-06, 'batch_size': 1157, 'optimizer': 'SGD'}.
2026-06-06 13:03:53,114 - experiment_functions - INFO - Early stopping at epoch 750. Best Metrics: (0.0005661128484551511, 7.870587447250317e-05, 0.00030448929195454145)
2026-06-06 13:03:53,202 - optuna.study.study - INFO - Trial 12 finished with values: [0.0005661128484551511, 7.870587447250317e-05, 0.00030448929195454145] and parameters: {'n_layers': 1, 'embedding_dim': 128, 'lr': 3.0889817764486426e-05, 'lambda_val': 0.00020537083868309774, 'batch_size': 3921, 'optimizer': 'RMSprop'}.
2026-06-06 13:04:25,111 - experiment_functions - INFO - Early stopping at epoch 550. Best Metrics: (0.02745037590833357, 0.0031281398620135307, 0.01252346787638197)
