2026-06-03 03:39:14,316 - optuna.study.study - INFO - Trial 45 finished with values: [0.027595947607533013, 0.0030594815459843256, 0.012318959898794174] and parameters: {'n_layers': 4, 'embedding_dim': 32, 'lr': 0.013617980368711006, 'lambda_val': 1.5381898362420838e-05, 'batch_size': 3643, 'optimizer': 'Adam'}.
2026-06-03 03:39:36,670 - experiment_functions - INFO - Early stopping at epoch 500. Best Metrics: (0.00041386288311413984, 7.703128139862015e-05, 0.00020284270014576947)
2026-06-03 03:39:36,774 - optuna.study.study - INFO - Trial 46 finished with values: [0.00041386288311413984, 7.703128139862015e-05, 0.00020284270014576947] and parameters: {'n_layers': 1, 'embedding_dim': 128, 'lr': 3.120367359672667e-05, 'lambda_val': 1.1397460600510589e-05, 'batch_size': 3971, 'optimizer': 'SGD'}.
2026-06-03 03:39:57,707 - experiment_functions - INFO - Early stopping at epoch 500. Best Metrics: (0.0006419717746862309, 8.875343291580147e-05, 0.0003247342543385935)
2026-06-03 03:39:57,831 - optuna.study.study - INFO - Trial 47 finished with values: [0.0006419717746862309, 8.875343291580147e-05, 0.0003247342543385935] and parameters: {'n_layers': 1, 'embedding_dim': 32, 'lr': 0.0007931132107821007, 'lambda_val': 0.0026054387008563715, 'batch_size': 2646, 'optimizer': 'SGD'}.
2026-06-03 03:42:40,564 - optuna.study.study - INFO - Trial 48 finished with values: [0.03560872415797713, 0.004191506463929265, 0.0163490381940861] and parameters: {'n_layers': 3, 'embedding_dim': 32, 'lr': 0.0028801527056521274, 'lambda_val': 7.853874347388544e-06, 'batch_size': 1517, 'optimizer': 'RMSprop'}.
2026-06-03 03:43:13,952 - experiment_functions - INFO - Early stopping at epoch 800. Best Metrics: (0.02551221850950845, 0.0030360372429499628, 0.011815414101375762)
2026-06-03 03:43:14,337 - optuna.study.study - INFO - Trial 49 finished with values: [0.02551221850950845, 0.0030360372429499628, 0.011815414101375762] and parameters: {'n_layers': 2, 'embedding_dim': 32, 'lr': 0.007710552789847537, 'lambda_val': 0.004439823730306383, 'batch_size': 1904, 'optimizer': 'Adam'}.
2026-06-03 03:43:59,544 - experiment_functions - INFO - Early stopping at epoch 1100. Best Metrics: (0.0005002216490454444, 7.535668832473711e-05, 0.00023381948285470784)
2026-06-03 03:44:00,199 - optuna.study.study - INFO - Trial 50 finished with values: [0.0005002216490454444, 7.535668832473711e-05, 0.00023381948285470784] and parameters: {'n_layers': 2, 'embedding_dim': 32, 'lr': 1.7152463466969075e-05, 'lambda_val': 1.3293715624933457e-05, 'batch_size': 1674, 'optimizer': 'RMSprop'}.
2026-06-03 03:44:25,434 - experiment_functions - INFO - Early stopping at epoch 550. Best Metrics: (0.01538075080261282, 0.0019056869180789067, 0.007243955771904377)
2026-06-03 03:44:25,522 - optuna.study.study - INFO - Trial 51 finished with values: [0.01538075080261282, 0.0019056869180789067, 0.007243955771904377] and parameters: {'n_layers': 4, 'embedding_dim': 32, 'lr': 0.005313954177263257, 'lambda_val': 0.006951514173989239, 'batch_size': 1947, 'optimizer': 'RMSprop'}.
2026-06-03 03:44:46,240 - experiment_functions - INFO - Early stopping at epoch 500. Best Metrics: (0.00040283867496891494, 5.526157143814054e-05, 0.00017290856302190283)
2026-06-03 03:44:46,348 - optuna.study.study - INFO - Trial 52 finished with values: [0.00040283867496891494, 5.526157143814054e-05, 0.00017290856302190283] and parameters: {'n_layers': 1, 'embedding_dim': 32, 'lr': 0.018167097127187466, 'lambda_val': 0.0014369013630720255, 'batch_size': 1295, 'optimizer': 'SGD'}.
2026-06-03 03:45:27,752 - experiment_functions - INFO - Early stopping at epoch 950. Best Metrics: (0.03140363337045548, 0.003563534061223123, 0.015215188599794309)
2026-06-03 03:45:28,352 - optuna.study.study - INFO - Trial 53 finished with values: [0.03140363337045548, 0.003563534061223123, 0.015215188599794309] and parameters: {'n_layers': 4, 'embedding_dim': 32, 'lr': 0.036125955900243076, 'lambda_val': 2.296770310028916e-06, 'batch_size': 1674, 'optimizer': 'RMSprop'}.
2026-06-03 03:46:04,158 - experiment_functions - INFO - Early stopping at epoch 500. Best Metrics: (0.0452418302547046, 0.005886194654698908, 0.02369828327409623)
2026-06-03 03:46:04,811 - optuna.study.study - INFO - Trial 54 finished with values: [0.0452418302547046, 0.005886194654698908, 0.02369828327409623] and parameters: {'n_layers': 4, 'embedding_dim': 256, 'lr': 0.05848561228434413, 'lambda_val': 0.0840407552704538, 'batch_size': 2355, 'optimizer': 'RMSprop'}.
2026-06-03 03:46:25,934 - experiment_functions - INFO - Early stopping at epoch 500. Best Metrics: (0.00046309483731826214, 7.53566883247371e-05, 0.00021507544270334638)
2026-06-03 03:46:26,031 - optuna.study.study - INFO - Trial 55 finished with values: [0.00046309483731826214, 7.53566883247371e-05, 0.00021507544270334638] and parameters: {'n_layers': 1, 'embedding_dim': 32, 'lr': 0.0008746152120122533, 'lambda_val': 3.722883243763735e-06, 'batch_size': 3592, 'optimizer': 'SGD'}.
2026-06-03 03:49:08,374 - optuna.study.study - INFO - Trial 56 finished with values: [0.02843833052325406, 0.003950365061290106, 0.015749069748041054] and parameters: {'n_layers': 3, 'embedding_dim': 32, 'lr': 0.0002143090370477042, 'lambda_val': 0.00014136652601835472, 'batch_size': 2530, 'optimizer': 'RMSprop'}.
2026-06-03 03:49:31,768 - experiment_functions - INFO - Early stopping at epoch 500. Best Metrics: (0.0004387928898529072, 7.870587447250318e-05, 0.00019211376560710118)
2026-06-03 03:49:31,865 - optuna.study.study - INFO - Trial 57 finished with values: [0.0004387928898529072, 7.870587447250318e-05, 0.00019211376560710118] and parameters: {'n_layers': 2, 'embedding_dim': 96, 'lr': 0.000279477375910841, 'lambda_val': 0.02018887560132656, 'batch_size': 1295, 'optimizer': 'SGD'}.
2026-06-03 03:49:53,573 - experiment_functions - INFO - Early stopping at epoch 500. Best Metrics: (0.0005006711748461407, 7.368209525085404e-05, 0.00021283394112258375)
2026-06-03 03:49:54,393 - optuna.study.study - INFO - Trial 58 finished with values: [0.0005006711748461407, 7.368209525085404e-05, 0.00021283394112258375] and parameters: {'n_layers': 2, 'embedding_dim': 32, 'lr': 0.000308315778158796, 'lambda_val': 0.031835262002797765, 'batch_size': 1948, 'optimizer': 'SGD'}.
2026-06-03 03:50:15,873 - experiment_functions - INFO - Early stopping at epoch 500. Best Metrics: (0.00032192493905315546, 6.530912988143882e-05, 0.00015866260015841687)
2026-06-03 03:50:15,963 - optuna.study.study - INFO - Trial 59 finished with values: [0.00032192493905315546, 6.530912988143882e-05, 0.00015866260015841687] and parameters: {'n_layers': 2, 'embedding_dim': 32, 'lr': 0.00710210347174133, 'lambda_val': 0.003485985825944796, 'batch_size': 2216, 'optimizer': 'SGD'}.
2026-06-03 03:50:37,804 - experiment_functions - INFO - Early stopping at epoch 500. Best Metrics: (0.0005110766524790323, 8.540424676803538e-05, 0.00023715882671911757)
2026-06-03 03:50:37,901 - optuna.study.study - INFO - Trial 60 finished with values: [0.0005110766524790323, 8.540424676803538e-05, 0.00023715882671911757] and parameters: {'n_layers': 3, 'embedding_dim': 32, 'lr': 0.001569262341931714, 'lambda_val': 1.2002182229297308e-05, 'batch_size': 3210, 'optimizer': 'SGD'}.
2026-06-03 03:51:14,587 - experiment_functions - INFO - Early stopping at epoch 900. Best Metrics: (0.006726987367639938, 0.0009143278183401434, 0.0030472086289522714)
2026-06-03 03:51:15,333 - optuna.study.study - INFO - Trial 61 finished with values: [0.006726987367639938, 0.0009143278183401434, 0.0030472086289522714] and parameters: {'n_layers': 1, 'embedding_dim': 64, 'lr': 0.05848561228434413, 'lambda_val': 0.0773764602931624, 'batch_size': 1769, 'optimizer': 'RMSprop'}.
2026-06-03 03:51:50,834 - experiment_functions - INFO - Early stopping at epoch 500. Best Metrics: (0.0003438786868113639, 6.86583160292049e-05, 0.0001747634972454589)
2026-06-03 03:51:51,625 - optuna.study.study - INFO - Trial 62 finished with values: [0.0003438786868113639, 6.86583160292049e-05, 0.0001747634972454589] and parameters: {'n_layers': 4, 'embedding_dim': 256, 'lr': 0.021147334126878935, 'lambda_val': 0.02077820750200917, 'batch_size': 3385, 'optimizer': 'SGD'}.
2026-06-03 03:52:17,378 - experiment_functions - INFO - Early stopping at epoch 600. Best Metrics: (0.030117543866521445, 0.003509947082858866, 0.013545022476898259)
2026-06-03 03:52:17,496 - optuna.study.study - INFO - Trial 63 finished with values: [0.030117543866521445, 0.003509947082858866, 0.013545022476898259] and parameters: {'n_layers': 2, 'embedding_dim': 32, 'lr': 0.007710552789847537, 'lambda_val': 0.003485985825944796, 'batch_size': 1904, 'optimizer': 'Adam'}.
2026-06-03 03:52:39,464 - experiment_functions - INFO - Early stopping at epoch 500. Best Metrics: (0.00041355336338700987, 7.2007502176971e-05, 0.00023086590093922542)
2026-06-03 03:52:39,553 - optuna.study.study - INFO - Trial 64 finished with values: [0.00041355336338700987, 7.2007502176971e-05, 0.00023086590093922542] and parameters: {'n_layers': 3, 'embedding_dim': 32, 'lr': 0.0002841680829294362, 'lambda_val': 0.016568028414726124, 'batch_size': 3640, 'optimizer': 'SGD'}.
2026-06-03 03:54:01,765 - experiment_functions - INFO - Early stopping at epoch 1950. Best Metrics: (0.09680024055310892, 0.011956594547524952, 0.05325170072533822)
2026-06-03 03:54:01,859 - optuna.study.study - INFO - Trial 65 finished with values: [0.09680024055310892, 0.011956594547524952, 0.05325170072533822] and parameters: {'n_layers': 1, 'embedding_dim': 64, 'lr': 0.0017600601147055445, 'lambda_val': 6.624143397965627e-05, 'batch_size': 1769, 'optimizer': 'RMSprop'}.
2026-06-03 03:54:24,109 - experiment_functions - INFO - Early stopping at epoch 500. Best Metrics: (0.0004802952825201646, 8.372965369415233e-05, 0.00023289332771998217)
2026-06-03 03:54:24,195 - optuna.study.study - INFO - Trial 66 finished with values: [0.0004802952825201646, 8.372965369415233e-05, 0.00023289332771998217] and parameters: {'n_layers': 2, 'embedding_dim': 64, 'lr': 5.491721140932394e-05, 'lambda_val': 0.04480058747584424, 'batch_size': 2216, 'optimizer': 'RMSprop'}.
2026-06-03 03:57:14,738 - optuna.study.study - INFO - Trial 67 finished with values: [0.05680061799762401, 0.006567754035769309, 0.026574257947772472] and parameters: {'n_layers': 1, 'embedding_dim': 128, 'lr': 0.00511270340142449, 'lambda_val': 0.000868123514447947, 'batch_size': 2273, 'optimizer': 'RMSprop'}.
2026-06-03 03:57:40,812 - experiment_functions - INFO - Early stopping at epoch 550. Best Metrics: (0.02226198776432983, 0.0025504052515238794, 0.010004957005776352)
2026-06-03 03:57:40,917 - optuna.study.study - INFO - Trial 68 finished with values: [0.02226198776432983, 0.0025504052515238794, 0.010004957005776352] and parameters: {'n_layers': 4, 'embedding_dim': 32, 'lr': 0.05605085711216016, 'lambda_val': 0.0006092016125409939, 'batch_size': 1575, 'optimizer': 'Adam'}.
2026-06-03 03:59:03,529 - experiment_functions - INFO - Early stopping at epoch 1350. Best Metrics: (0.009652943441887834, 0.0011203027664277582, 0.004282740206582231)
2026-06-03 03:59:03,639 - optuna.study.study - INFO - Trial 69 finished with values: [0.009652943441887834, 0.0011203027664277582, 0.004282740206582231] and parameters: {'n_layers': 3, 'embedding_dim': 256, 'lr': 0.0009344685265310301, 'lambda_val': 0.0840407552704538, 'batch_size': 1343, 'optimizer': 'Adam'}.
2026-06-03 03:59:25,215 - experiment_functions - INFO - Early stopping at epoch 500. Best Metrics: (0.0004683739057028726, 7.033290910308795e-05, 0.00019371706406087262)
2026-06-03 03:59:25,322 - optuna.study.study - INFO - Trial 70 finished with values: [0.0004683739057028726, 7.033290910308795e-05, 0.00019371706406087262] and parameters: {'n_layers': 1, 'embedding_dim': 64, 'lr': 0.0017600601147055445, 'lambda_val': 0.0773764602931624, 'batch_size': 3592, 'optimizer': 'SGD'}.
2026-06-03 03:59:47,118 - experiment_functions - INFO - Early stopping at epoch 500. Best Metrics: (0.0004222922603256182, 6.028535065978968e-05, 0.00017640482478726107)
2026-06-03 03:59:47,217 - optuna.study.study - INFO - Trial 71 finished with values: [0.0004222922603256182, 6.028535065978968e-05, 0.00017640482478726107] and parameters: {'n_layers': 1, 'embedding_dim': 96, 'lr': 3.236982759249356e-05, 'lambda_val': 0.00031016945451823507, 'batch_size': 2184, 'optimizer': 'SGD'}.
2026-06-03 04:02:38,454 - optuna.study.study - INFO - Trial 72 finished with values: [0.06234165251883547, 0.0073648603389376375, 0.030089368583147053] and parameters: {'n_layers': 1, 'embedding_dim': 128, 'lr': 0.008408133081698252, 'lambda_val': 2.8807178813664366e-05, 'batch_size': 600, 'optimizer': 'RMSprop'}.
2026-06-03 04:05:56,303 - optuna.study.study - INFO - Trial 73 finished with values: [0.05273012220436512, 0.006700046888606069, 0.028004240099220198] and parameters: {'n_layers': 4, 'embedding_dim': 96, 'lr': 0.0002143090370477042, 'lambda_val': 0.0002814016114171031, 'batch_size': 2448, 'optimizer': 'RMSprop'}.
2026-06-03 04:06:33,662 - experiment_functions - INFO - Early stopping at epoch 750. Best Metrics: (0.03971540321321024, 0.005109183468417175, 0.01917348793720868)
2026-06-03 04:06:33,763 - optuna.study.study - INFO - Trial 74 finished with values: [0.03971540321321024, 0.005109183468417175, 0.01917348793720868] and parameters: {'n_layers': 3, 'embedding_dim': 96, 'lr': 0.0015579274365812065, 'lambda_val': 0.003485985825944796, 'batch_size': 2448, 'optimizer': 'Adam'}.
2026-06-03 04:09:17,827 - optuna.study.study - INFO - Trial 75 finished with values: [0.04290270573564058, 0.005343626498760801, 0.019614473384399065] and parameters: {'n_layers': 1, 'embedding_dim': 96, 'lr': 0.01447735814370163, 'lambda_val': 0.002197601157394706, 'batch_size': 2234, 'optimizer': 'RMSprop'}.
2026-06-03 04:09:39,240 - experiment_functions - INFO - Early stopping at epoch 500. Best Metrics: (0.00040915626310407985, 6.530912988143881e-05, 0.0001915615493168285)
2026-06-03 04:09:39,340 - optuna.study.study - INFO - Trial 76 finished with values: [0.00040915626310407985, 6.530912988143881e-05, 0.0001915615493168285] and parameters: {'n_layers': 1, 'embedding_dim': 64, 'lr': 0.00030452242506905796, 'lambda_val': 0.0773764602931624, 'batch_size': 1769, 'optimizer': 'RMSprop'}.
2026-06-03 04:10:02,025 - experiment_functions - INFO - Early stopping at epoch 500. Best Metrics: (0.0004126909249131717, 6.698372295532187e-05, 0.00019196592425899052)
2026-06-03 04:10:02,110 - optuna.study.study - INFO - Trial 77 finished with values: [0.0004126909249131717, 6.698372295532187e-05, 0.00019196592425899052] and parameters: {'n_layers': 1, 'embedding_dim': 128, 'lr': 0.0008746152120122533, 'lambda_val': 0.0006830636090781869, 'batch_size': 3592, 'optimizer': 'SGD'}.
2026-06-03 04:12:20,608 - experiment_functions - INFO - Early stopping at epoch 3400. Best Metrics: (0.015438081415099392, 0.0018906155804139595, 0.00661062790405982)
2026-06-03 04:12:20,694 - optuna.study.study - INFO - Trial 78 finished with values: [0.015438081415099392, 0.0018906155804139595, 0.00661062790405982] and parameters: {'n_layers': 4, 'embedding_dim': 32, 'lr': 0.003618612896374858, 'lambda_val': 0.0036173053146817007, 'batch_size': 920, 'optimizer': 'Adam'}.
2026-06-03 04:12:47,865 - experiment_functions - INFO - Early stopping at epoch 550. Best Metrics: (0.02038203569197154, 0.0023544778618795636, 0.00895920339550705)
2026-06-03 04:12:47,959 - optuna.study.study - INFO - Trial 79 finished with values: [0.02038203569197154, 0.0023544778618795636, 0.00895920339550705] and parameters: {'n_layers': 3, 'embedding_dim': 96, 'lr': 0.03369299540820716, 'lambda_val': 0.003485985825944796, 'batch_size': 2448, 'optimizer': 'Adam'}.
2026-06-03 04:13:12,634 - experiment_functions - INFO - Early stopping at epoch 550. Best Metrics: (0.02984647244701435, 0.003317368879362315, 0.013652266183541283)
2026-06-03 04:13:12,721 - optuna.study.study - INFO - Trial 80 finished with values: [0.02984647244701435, 0.003317368879362315, 0.013652266183541283] and parameters: {'n_layers': 2, 'embedding_dim': 64, 'lr': 0.09224645098747321, 'lambda_val': 2.5260254327516684e-06, 'batch_size': 4023, 'optimizer': 'Adam'}.
2026-06-03 04:14:40,158 - experiment_functions - INFO - Early stopping at epoch 2100. Best Metrics: (0.09293677781151241, 0.011424073950030143, 0.05085750453997638)
2026-06-03 04:14:40,239 - optuna.study.study - INFO - Trial 81 finished with values: [0.09293677781151241, 0.011424073950030143, 0.05085750453997638] and parameters: {'n_layers': 1, 'embedding_dim': 64, 'lr': 0.0026263356328818884, 'lambda_val': 1.6263951880298748e-05, 'batch_size': 639, 'optimizer': 'Adam'}.
2026-06-03 04:15:05,428 - experiment_functions - INFO - Early stopping at epoch 550. Best Metrics: (0.02603083550011801, 0.003528367606671579, 0.013654195150605742)
2026-06-03 04:15:05,531 - optuna.study.study - INFO - Trial 82 finished with values: [0.02603083550011801, 0.003528367606671579, 0.013654195150605742] and parameters: {'n_layers': 2, 'embedding_dim': 64, 'lr': 0.0034685071070209975, 'lambda_val': 0.0036173053146817007, 'batch_size': 712, 'optimizer': 'RMSprop'}.
2026-06-03 04:15:46,637 - experiment_functions - INFO - Early stopping at epoch 1000. Best Metrics: (0.022727820424614745, 0.002694420255877822, 0.010429482629646363)
2026-06-03 04:15:46,781 - optuna.study.study - INFO - Trial 83 finished with values: [0.022727820424614745, 0.002694420255877822, 0.010429482629646363] and parameters: {'n_layers': 2, 'embedding_dim': 32, 'lr': 0.007710552789847537, 'lambda_val': 0.004439823730306383, 'batch_size': 1575, 'optimizer': 'Adam'}.
2026-06-03 04:16:12,805 - experiment_functions - INFO - Early stopping at epoch 500. Best Metrics: (0.0005202914780090653, 6.698372295532187e-05, 0.00026849477497975423)
2026-06-03 04:16:12,913 - optuna.study.study - INFO - Trial 84 finished with values: [0.0005202914780090653, 6.698372295532187e-05, 0.00026849477497975423] and parameters: {'n_layers': 3, 'embedding_dim': 128, 'lr': 0.00022437050337848337, 'lambda_val': 0.000868123514447947, 'batch_size': 3210, 'optimizer': 'SGD'}.
2026-06-03 04:19:01,945 - experiment_functions - INFO - Early stopping at epoch 3650. Best Metrics: (0.02463721761326559, 0.003468082256011789, 0.0123640469874703)
2026-06-03 04:19:02,037 - optuna.study.study - INFO - Trial 85 finished with values: [0.02463721761326559, 0.003468082256011789, 0.0123640469874703] and parameters: {'n_layers': 3, 'embedding_dim': 96, 'lr': 0.00045181778495769544, 'lambda_val': 0.02518430669345533, 'batch_size': 2315, 'optimizer': 'Adam'}.
2026-06-03 04:22:28,226 - optuna.study.study - INFO - Trial 86 finished with values: [0.0006719937979334909, 8.707883984191842e-05, 0.0002790979770430605] and parameters: {'n_layers': 4, 'embedding_dim': 128, 'lr': 4.308752958079511e-05, 'lambda_val': 0.0073269530843175735, 'batch_size': 2315, 'optimizer': 'RMSprop'}.
2026-06-03 04:22:52,559 - experiment_functions - INFO - Early stopping at epoch 500. Best Metrics: (0.00042926838821032116, 7.2007502176971e-05, 0.00021477892554307143)
2026-06-03 04:22:52,649 - optuna.study.study - INFO - Trial 87 finished with values: [0.00042926838821032116, 7.2007502176971e-05, 0.00021477892554307143] and parameters: {'n_layers': 3, 'embedding_dim': 96, 'lr': 0.006587422524818515, 'lambda_val': 0.02518430669345533, 'batch_size': 3210, 'optimizer': 'SGD'}.
2026-06-03 04:23:15,158 - experiment_functions - INFO - Early stopping at epoch 550. Best Metrics: (0.0003629818915315727, 6.698372295532186e-05, 0.00015769473977915346)
2026-06-03 04:23:15,690 - optuna.study.study - INFO - Trial 88 finished with values: [0.0003629818915315727, 6.698372295532186e-05, 0.00015769473977915346] and parameters: {'n_layers': 1, 'embedding_dim': 32, 'lr': 0.000327414537422656, 'lambda_val': 0.025606955185169786, 'batch_size': 600, 'optimizer': 'Adam'}.
2026-06-03 04:23:42,955 - experiment_functions - INFO - Early stopping at epoch 500. Best Metrics: (0.0005140931785831809, 6.195994373367272e-05, 0.00020792529607009452)
2026-06-03 04:23:43,123 - optuna.study.study - INFO - Trial 89 finished with values: [0.0005140931785831809, 6.195994373367272e-05, 0.00020792529607009452] and parameters: {'n_layers': 4, 'embedding_dim': 128, 'lr': 6.907455281118128e-05, 'lambda_val': 4.332436544993132e-05, 'batch_size': 2265, 'optimizer': 'SGD'}.
2026-06-03 04:24:07,457 - experiment_functions - INFO - Early stopping at epoch 500. Best Metrics: (0.0005066093331613904, 6.195994373367272e-05, 0.0001930954262584057)
2026-06-03 04:24:07,761 - optuna.study.study - INFO - Trial 90 finished with values: [0.0005066093331613904, 6.195994373367272e-05, 0.0001930954262584057] and parameters: {'n_layers': 3, 'embedding_dim': 96, 'lr': 0.0007931132107821007, 'lambda_val': 0.0026054387008563715, 'batch_size': 2646, 'optimizer': 'SGD'}.
2026-06-03 04:24:32,323 - experiment_functions - INFO - Early stopping at epoch 500. Best Metrics: (0.0004025915728517155, 7.368209525085404e-05, 0.00021529707528794323)
2026-06-03 04:24:33,628 - optuna.study.study - INFO - Trial 91 finished with values: [0.0004025915728517155, 7.368209525085404e-05, 0.00021529707528794323] and parameters: {'n_layers': 1, 'embedding_dim': 256, 'lr': 0.04199609198569572, 'lambda_val': 0.02561225227858541, 'batch_size': 3598, 'optimizer': 'SGD'}.
2026-06-03 04:27:18,107 - optuna.study.study - INFO - Trial 92 finished with values: [0.08065636638855381, 0.010759260499698574, 0.046827738981869343] and parameters: {'n_layers': 1, 'embedding_dim': 96, 'lr': 0.0007931132107821007, 'lambda_val': 0.00031016945451823507, 'batch_size': 1441, 'optimizer': 'Adam'}.
2026-06-03 04:27:44,488 - experiment_functions - INFO - Early stopping at epoch 600. Best Metrics: (0.023543637293894516, 0.0028484828186750625, 0.010570982580349329)
