2026-06-03 23:53:08,197 - optuna.study.study - INFO - Trial 271 finished with values: [0.00979778704116288, 0.001719807086877889, 0.005713891434664826] and parameters: {'n_layers': 3, 'embedding_dim': 32, 'lr': 0.0006306221245460524, 'lambda_val': 2.468073181110974e-06, 'batch_size': 2127, 'optimizer': 'RMSprop'}.
2026-06-03 23:54:10,806 - experiment_functions - INFO - Early stopping at epoch 1600. Best Metrics: (0.010725386808284465, 0.001932480407261036, 0.0065710190006236)
2026-06-03 23:54:10,947 - optuna.study.study - INFO - Trial 272 finished with values: [0.010725386808284465, 0.001932480407261036, 0.0065710190006236] and parameters: {'n_layers': 3, 'embedding_dim': 64, 'lr': 0.002060594231766347, 'lambda_val': 5.085972175639675e-06, 'batch_size': 790, 'optimizer': 'RMSprop'}.
2026-06-03 23:56:39,769 - optuna.study.study - INFO - Trial 273 finished with values: [0.010392567789826397, 0.0018604729050840647, 0.006161597189771431] and parameters: {'n_layers': 4, 'embedding_dim': 32, 'lr': 0.000710331438856921, 'lambda_val': 3.464142434888773e-05, 'batch_size': 1113, 'optimizer': 'Adam'}.
2026-06-03 23:57:00,506 - experiment_functions - INFO - Early stopping at epoch 500. Best Metrics: (0.0005289423430694413, 7.368209525085404e-05, 0.00021955421409456925)
2026-06-03 23:57:00,619 - optuna.study.study - INFO - Trial 274 finished with values: [0.0005289423430694413, 7.368209525085404e-05, 0.00021955421409456925] and parameters: {'n_layers': 2, 'embedding_dim': 64, 'lr': 0.002060594231766347, 'lambda_val': 5.609342222844582e-06, 'batch_size': 579, 'optimizer': 'SGD'}.
2026-06-03 23:59:36,864 - optuna.study.study - INFO - Trial 275 finished with values: [0.011295957937127501, 0.0021183602384620536, 0.006967842801472435] and parameters: {'n_layers': 4, 'embedding_dim': 64, 'lr': 0.000710331438856921, 'lambda_val': 5.609342222844582e-06, 'batch_size': 836, 'optimizer': 'Adam'}.
2026-06-04 00:02:13,112 - optuna.study.study - INFO - Trial 276 finished with values: [0.01108891602311717, 0.001989416571773059, 0.00671256946099441] and parameters: {'n_layers': 4, 'embedding_dim': 64, 'lr': 0.0006306221245460524, 'lambda_val': 8.50693942128844e-06, 'batch_size': 784, 'optimizer': 'Adam'}.
2026-06-04 00:04:49,739 - optuna.study.study - INFO - Trial 277 finished with values: [0.013907575834224278, 0.002475048563199143, 0.00833055442684776] and parameters: {'n_layers': 4, 'embedding_dim': 64, 'lr': 0.000710331438856921, 'lambda_val': 8.50693942128844e-06, 'batch_size': 836, 'optimizer': 'RMSprop'}.
2026-06-04 00:07:26,489 - optuna.study.study - INFO - Trial 278 finished with values: [0.014302892446564373, 0.002560452809967178, 0.00888952056066347] and parameters: {'n_layers': 4, 'embedding_dim': 64, 'lr': 0.000710331438856921, 'lambda_val': 2.468073181110974e-06, 'batch_size': 790, 'optimizer': 'RMSprop'}.
2026-06-04 00:08:41,507 - experiment_functions - INFO - Early stopping at epoch 1800. Best Metrics: (0.00956213460377378, 0.0017281800522473039, 0.005707804551006363)
2026-06-04 00:08:41,598 - optuna.study.study - INFO - Trial 279 finished with values: [0.00956213460377378, 0.0017281800522473039, 0.005707804551006363] and parameters: {'n_layers': 3, 'embedding_dim': 128, 'lr': 0.000710331438856921, 'lambda_val': 0.0024277132118546247, 'batch_size': 790, 'optimizer': 'RMSprop'}.
2026-06-04 00:09:55,127 - experiment_functions - INFO - Early stopping at epoch 1850. Best Metrics: (0.009217278379944807, 0.0016042601647799585, 0.0051087766766264985)
2026-06-04 00:09:55,216 - optuna.study.study - INFO - Trial 280 finished with values: [0.009217278379944807, 0.0016042601647799585, 0.0051087766766264985] and parameters: {'n_layers': 4, 'embedding_dim': 64, 'lr': 0.0006306221245460524, 'lambda_val': 0.0006427391414032312, 'batch_size': 2467, 'optimizer': 'Adam'}.
2026-06-04 00:11:14,176 - experiment_functions - INFO - Early stopping at epoch 2000. Best Metrics: (0.008102175315980014, 0.0014602451604260164, 0.004508571943188151)
2026-06-04 00:11:15,220 - optuna.study.study - INFO - Trial 281 finished with values: [0.008102175315980014, 0.0014602451604260164, 0.004508571943188151] and parameters: {'n_layers': 4, 'embedding_dim': 64, 'lr': 0.000710331438856921, 'lambda_val': 0.00047268866494377303, 'batch_size': 3193, 'optimizer': 'Adam'}.
2026-06-04 00:13:51,258 - optuna.study.study - INFO - Trial 282 finished with values: [0.011309466400301399, 0.0019626230825909308, 0.006859354926732103] and parameters: {'n_layers': 4, 'embedding_dim': 64, 'lr': 0.000710331438856921, 'lambda_val': 0.00047268866494377303, 'batch_size': 774, 'optimizer': 'Adam'}.
2026-06-04 00:16:43,496 - optuna.study.study - INFO - Trial 283 finished with values: [0.014037891454457678, 0.002513564203898453, 0.008237167436389659] and parameters: {'n_layers': 4, 'embedding_dim': 128, 'lr': 0.000710331438856921, 'lambda_val': 5.262101562432281e-06, 'batch_size': 790, 'optimizer': 'RMSprop'}.
2026-06-04 00:19:22,952 - optuna.study.study - INFO - Trial 284 finished with values: [0.008817079041018349, 0.001515506731864157, 0.00539581187586363] and parameters: {'n_layers': 3, 'embedding_dim': 96, 'lr': 0.0006306221245460524, 'lambda_val': 0.00021888803225104277, 'batch_size': 790, 'optimizer': 'Adam'}.
2026-06-04 00:21:55,744 - optuna.study.study - INFO - Trial 285 finished with values: [0.009171773420864119, 0.0016143077232232568, 0.0056790976255848185] and parameters: {'n_layers': 3, 'embedding_dim': 64, 'lr': 0.0006306221245460524, 'lambda_val': 8.50693942128844e-06, 'batch_size': 1308, 'optimizer': 'Adam'}.
2026-06-04 00:24:23,598 - experiment_functions - INFO - Early stopping at epoch 3450. Best Metrics: (0.0142208451144036, 0.002513564203898453, 0.008415728733803744)
2026-06-04 00:24:23,690 - optuna.study.study - INFO - Trial 286 finished with values: [0.0142208451144036, 0.002513564203898453, 0.008415728733803744] and parameters: {'n_layers': 4, 'embedding_dim': 128, 'lr': 0.000710331438856921, 'lambda_val': 8.50693942128844e-06, 'batch_size': 790, 'optimizer': 'RMSprop'}.
2026-06-04 00:26:59,415 - optuna.study.study - INFO - Trial 287 finished with values: [0.01110768234844759, 0.0019693214548864627, 0.0065391175407749575] and parameters: {'n_layers': 4, 'embedding_dim': 64, 'lr': 0.000710331438856921, 'lambda_val': 5.609342222844582e-06, 'batch_size': 1191, 'optimizer': 'Adam'}.
2026-06-04 00:27:53,347 - experiment_functions - INFO - Early stopping at epoch 1100. Best Metrics: (0.007955489261744853, 0.0013932614374706947, 0.004457706751623376)
2026-06-04 00:27:53,432 - optuna.study.study - INFO - Trial 288 finished with values: [0.007955489261744853, 0.0013932614374706947, 0.004457706751623376] and parameters: {'n_layers': 3, 'embedding_dim': 256, 'lr': 0.0027608560004649, 'lambda_val': 3.282554719703929e-05, 'batch_size': 513, 'optimizer': 'RMSprop'}.
2026-06-04 00:28:32,946 - experiment_functions - INFO - Early stopping at epoch 950. Best Metrics: (0.009767259291199662, 0.0017147833076562398, 0.005608004484319419)
2026-06-04 00:28:33,033 - optuna.study.study - INFO - Trial 289 finished with values: [0.009767259291199662, 0.0017147833076562398, 0.005608004484319419] and parameters: {'n_layers': 3, 'embedding_dim': 96, 'lr': 0.002060594231766347, 'lambda_val': 0.00021888803225104277, 'batch_size': 790, 'optimizer': 'RMSprop'}.
2026-06-04 00:29:13,809 - experiment_functions - INFO - Early stopping at epoch 900. Best Metrics: (0.008586402594377722, 0.001557371558711233, 0.0047866880825939645)
2026-06-04 00:29:14,982 - optuna.study.study - INFO - Trial 290 finished with values: [0.008586402594377722, 0.001557371558711233, 0.0047866880825939645] and parameters: {'n_layers': 4, 'embedding_dim': 128, 'lr': 0.001077113690244203, 'lambda_val': 5.609342222844582e-06, 'batch_size': 3946, 'optimizer': 'RMSprop'}.
2026-06-04 00:29:38,009 - experiment_functions - INFO - Early stopping at epoch 550. Best Metrics: (0.004933886605104282, 0.000860740839975886, 0.0029174367164817106)
2026-06-04 00:29:38,099 - optuna.study.study - INFO - Trial 291 finished with values: [0.004933886605104282, 0.000860740839975886, 0.0029174367164817106] and parameters: {'n_layers': 3, 'embedding_dim': 64, 'lr': 0.03475242928487851, 'lambda_val': 5.609342222844582e-06, 'batch_size': 2467, 'optimizer': 'Adam'}.
2026-06-04 00:31:32,383 - experiment_functions - INFO - Early stopping at epoch 3150. Best Metrics: (0.0069353641558005845, 0.001155469220979302, 0.003987913346501929)
2026-06-04 00:31:32,487 - optuna.study.study - INFO - Trial 292 finished with values: [0.0069353641558005845, 0.001155469220979302, 0.003987913346501929] and parameters: {'n_layers': 2, 'embedding_dim': 32, 'lr': 0.0007576049516462297, 'lambda_val': 5.609342222844582e-06, 'batch_size': 3194, 'optimizer': 'RMSprop'}.
2026-06-04 00:32:27,368 - experiment_functions - INFO - Early stopping at epoch 1400. Best Metrics: (0.011570140808440576, 0.0021099872730926386, 0.006882521153031174)
2026-06-04 00:32:27,449 - optuna.study.study - INFO - Trial 293 finished with values: [0.011570140808440576, 0.0021099872730926386, 0.006882521153031174] and parameters: {'n_layers': 3, 'embedding_dim': 64, 'lr': 0.002060594231766347, 'lambda_val': 1.1041864511659188e-05, 'batch_size': 790, 'optimizer': 'RMSprop'}.
2026-06-04 00:34:59,422 - optuna.study.study - INFO - Trial 294 finished with values: [0.009513101595971572, 0.001656172550070333, 0.005764637664154386] and parameters: {'n_layers': 3, 'embedding_dim': 64, 'lr': 0.000710331438856921, 'lambda_val': 0.0003123129135877017, 'batch_size': 836, 'optimizer': 'Adam'}.
2026-06-04 00:37:27,413 - optuna.study.study - INFO - Trial 295 finished with values: [0.008603042484007747, 0.0014083327751356425, 0.005110991303306497] and parameters: {'n_layers': 2, 'embedding_dim': 64, 'lr': 0.000710331438856921, 'lambda_val': 0.00047268866494377303, 'batch_size': 790, 'optimizer': 'RMSprop'}.
2026-06-04 00:37:50,424 - experiment_functions - INFO - Early stopping at epoch 550. Best Metrics: (0.005418052899166991, 0.0009293991560050909, 0.003116130238777426)
2026-06-04 00:37:50,540 - optuna.study.study - INFO - Trial 296 finished with values: [0.005418052899166991, 0.0009293991560050909, 0.003116130238777426] and parameters: {'n_layers': 3, 'embedding_dim': 64, 'lr': 0.01217882197407008, 'lambda_val': 0.0003123129135877017, 'batch_size': 774, 'optimizer': 'RMSprop'}.
2026-06-04 00:39:22,740 - experiment_functions - INFO - Early stopping at epoch 2350. Best Metrics: (0.011872458397846836, 0.0021083126800187555, 0.007053230784566027)
2026-06-04 00:39:23,240 - optuna.study.study - INFO - Trial 297 finished with values: [0.011872458397846836, 0.0021083126800187555, 0.007053230784566027] and parameters: {'n_layers': 4, 'embedding_dim': 64, 'lr': 0.000710331438856921, 'lambda_val': 3.192932588267738e-06, 'batch_size': 1743, 'optimizer': 'RMSprop'}.
2026-06-04 00:40:59,352 - experiment_functions - INFO - Early stopping at epoch 2000. Best Metrics: (0.009626026194851955, 0.0018571237189362985, 0.005680650885281685)
2026-06-04 00:40:59,431 - optuna.study.study - INFO - Trial 298 finished with values: [0.009626026194851955, 0.0018571237189362985, 0.005680650885281685] and parameters: {'n_layers': 3, 'embedding_dim': 256, 'lr': 0.0006306221245460524, 'lambda_val': 1.4920813731644995e-06, 'batch_size': 1308, 'optimizer': 'RMSprop'}.
2026-06-04 00:43:33,385 - optuna.study.study - INFO - Trial 299 finished with values: [0.007115851206132431, 0.0011638421863487175, 0.004167498073124045] and parameters: {'n_layers': 2, 'embedding_dim': 96, 'lr': 0.000710331438856921, 'lambda_val': 8.277965708883697e-06, 'batch_size': 774, 'optimizer': 'Adam'}.
2026-06-04 00:43:33,401 - root - INFO - Selected Trial 278 based on Max ndcg: 0.0089
2026-06-04 00:43:33,401 - root - INFO - Associated Recall: 0.0143
2026-06-04 00:43:33,401 - experiment_functions - INFO - Training the best model ... for e_gowalla_1c1dcs_strict_rand1
2026-06-04 00:46:10,682 - root - INFO -   **** Training e_gowalla_1c1dcs_strict_rand2
2026-06-04 00:46:10,701 - root - INFO -   **** Getting 51651/845292 random edges
2026-06-04 00:46:10,816 - optuna.storages._rdb.storage - INFO - A new study created in RDB with name: Study_e_gowalla_1c1dcs_strict_rand2
2026-06-04 00:46:37,531 - experiment_functions - INFO - Early stopping at epoch 600. Best Metrics: (0.006887905713323781, 0.001150445441757653, 0.0038828784374693084)
2026-06-04 00:46:37,643 - optuna.study.study - INFO - Trial 0 finished with values: [0.006887905713323781, 0.001150445441757653, 0.0038828784374693084] and parameters: {'n_layers': 3, 'embedding_dim': 128, 'lr': 0.010519255162305941, 'lambda_val': 1.7827761161994677e-05, 'batch_size': 1943, 'optimizer': 'Adam'}.
2026-06-04 00:47:17,354 - experiment_functions - INFO - Early stopping at epoch 1000. Best Metrics: (0.0005653402016817325, 8.707883984191842e-05, 0.000285396624541853)
2026-06-04 00:47:18,567 - optuna.study.study - INFO - Trial 1 finished with values: [0.0005653402016817325, 8.707883984191842e-05, 0.000285396624541853] and parameters: {'n_layers': 2, 'embedding_dim': 96, 'lr': 3.18787545234542e-05, 'lambda_val': 0.007877559318286393, 'batch_size': 2844, 'optimizer': 'RMSprop'}.
2026-06-04 00:47:38,479 - experiment_functions - INFO - Early stopping at epoch 500. Best Metrics: (0.0003601575333385312, 5.6936164512023584e-05, 0.00018063945703299995)
2026-06-04 00:47:38,815 - optuna.study.study - INFO - Trial 2 finished with values: [0.0003601575333385312, 5.6936164512023584e-05, 0.00018063945703299995] and parameters: {'n_layers': 3, 'embedding_dim': 32, 'lr': 0.00017592174964564103, 'lambda_val': 1.8599939262109093e-06, 'batch_size': 1445, 'optimizer': 'SGD'}.
2026-06-04 00:48:03,256 - experiment_functions - INFO - Early stopping at epoch 550. Best Metrics: (0.0041240157112014154, 0.0007334717663607744, 0.0024062887185591127)
2026-06-04 00:48:03,802 - optuna.study.study - INFO - Trial 3 finished with values: [0.0041240157112014154, 0.0007334717663607744, 0.0024062887185591127] and parameters: {'n_layers': 3, 'embedding_dim': 128, 'lr': 0.02841103786793073, 'lambda_val': 5.6114562068405035e-05, 'batch_size': 1720, 'optimizer': 'RMSprop'}.
2026-06-04 00:49:45,146 - experiment_functions - INFO - Early stopping at epoch 2750. Best Metrics: (0.0006144727242612101, 0.0001004755844329828, 0.0003035062293064203)
2026-06-04 00:49:45,511 - optuna.study.study - INFO - Trial 4 finished with values: [0.0006144727242612101, 0.0001004755844329828, 0.0003035062293064203] and parameters: {'n_layers': 1, 'embedding_dim': 96, 'lr': 5.6572504128012725e-05, 'lambda_val': 0.00015911449534133392, 'batch_size': 949, 'optimizer': 'RMSprop'}.
2026-06-04 00:50:07,118 - experiment_functions - INFO - Early stopping at epoch 550. Best Metrics: (0.0030260410136071334, 0.0004906557706477326, 0.0018272592136711543)
2026-06-04 00:50:07,483 - optuna.study.study - INFO - Trial 5 finished with values: [0.0030260410136071334, 0.0004906557706477326, 0.0018272592136711543] and parameters: {'n_layers': 2, 'embedding_dim': 32, 'lr': 0.04202506867893529, 'lambda_val': 1.00995462098372e-06, 'batch_size': 2927, 'optimizer': 'Adam'}.
2026-06-04 00:50:37,333 - experiment_functions - INFO - Early stopping at epoch 550. Best Metrics: (0.0066804326124785245, 0.001185611896309197, 0.003800249408274238)
2026-06-04 00:50:37,419 - optuna.study.study - INFO - Trial 6 finished with values: [0.0066804326124785245, 0.001185611896309197, 0.003800249408274238] and parameters: {'n_layers': 4, 'embedding_dim': 256, 'lr': 0.0036679476641700757, 'lambda_val': 0.00014816809310452117, 'batch_size': 3054, 'optimizer': 'RMSprop'}.
2026-06-04 00:50:57,823 - experiment_functions - INFO - Early stopping at epoch 500. Best Metrics: (0.00039660485634673425, 4.68886060687253e-05, 0.00015158515823004555)
2026-06-04 00:50:58,133 - optuna.study.study - INFO - Trial 7 finished with values: [0.00039660485634673425, 4.68886060687253e-05, 0.00015158515823004555] and parameters: {'n_layers': 2, 'embedding_dim': 64, 'lr': 0.0012126580910526883, 'lambda_val': 0.004578634076806443, 'batch_size': 3142, 'optimizer': 'SGD'}.
2026-06-04 00:51:36,140 - experiment_functions - INFO - Early stopping at epoch 1000. Best Metrics: (0.005729890009240873, 0.0009411213075222722, 0.0032976208826837254)
2026-06-04 00:51:36,249 - optuna.study.study - INFO - Trial 8 finished with values: [0.005729890009240873, 0.0009411213075222722, 0.0032976208826837254] and parameters: {'n_layers': 2, 'embedding_dim': 32, 'lr': 0.004277274112037138, 'lambda_val': 4.3043355166166714e-05, 'batch_size': 1097, 'optimizer': 'Adam'}.
2026-06-04 00:51:57,275 - experiment_functions - INFO - Early stopping at epoch 500. Best Metrics: (0.00045294145980340845, 8.372965369415234e-05, 0.00023357825734129448)
2026-06-04 00:51:57,589 - optuna.study.study - INFO - Trial 9 finished with values: [0.00045294145980340845, 8.372965369415234e-05, 0.00023357825734129448] and parameters: {'n_layers': 2, 'embedding_dim': 96, 'lr': 0.00018055572259240184, 'lambda_val': 1.6586058926940277e-06, 'batch_size': 1489, 'optimizer': 'SGD'}.
2026-06-04 00:52:21,664 - experiment_functions - INFO - Early stopping at epoch 600. Best Metrics: (0.006720759292878921, 0.0010650411949896176, 0.003927364259038309)
2026-06-04 00:52:22,467 - optuna.study.study - INFO - Trial 10 finished with values: [0.006720759292878921, 0.0010650411949896176, 0.003927364259038309] and parameters: {'n_layers': 3, 'embedding_dim': 32, 'lr': 0.009270963217244401, 'lambda_val': 9.396340181954428e-05, 'batch_size': 1296, 'optimizer': 'Adam'}.
2026-06-04 00:53:27,342 - experiment_functions - INFO - Early stopping at epoch 1600. Best Metrics: (0.007011115774227581, 0.001259293991560051, 0.004196981927410402)
2026-06-04 00:53:27,633 - optuna.study.study - INFO - Trial 11 finished with values: [0.007011115774227581, 0.001259293991560051, 0.004196981927410402] and parameters: {'n_layers': 2, 'embedding_dim': 128, 'lr': 0.0008797904665419303, 'lambda_val': 7.233718216592713e-05, 'batch_size': 3163, 'optimizer': 'RMSprop'}.
2026-06-04 00:53:54,608 - experiment_functions - INFO - Early stopping at epoch 550. Best Metrics: (0.0038975057925438824, 0.0006681626364793356, 0.002431297668823877)
2026-06-04 00:53:54,707 - optuna.study.study - INFO - Trial 12 finished with values: [0.0038975057925438824, 0.0006681626364793356, 0.002431297668823877] and parameters: {'n_layers': 2, 'embedding_dim': 256, 'lr': 0.05854985506515562, 'lambda_val': 2.6963455125652685e-06, 'batch_size': 3212, 'optimizer': 'Adam'}.
2026-06-04 00:54:23,940 - experiment_functions - INFO - Early stopping at epoch 650. Best Metrics: (0.0005796863877716703, 8.038046754638622e-05, 0.00025028316093694385)
2026-06-04 00:54:24,664 - optuna.study.study - INFO - Trial 13 finished with values: [0.0005796863877716703, 8.038046754638622e-05, 0.00025028316093694385] and parameters: {'n_layers': 4, 'embedding_dim': 128, 'lr': 0.04830220176028814, 'lambda_val': 1.4231303635222442e-06, 'batch_size': 2060, 'optimizer': 'SGD'}.
2026-06-04 00:57:06,944 - optuna.study.study - INFO - Trial 14 finished with values: [0.002580678604137475, 0.00043371960613570906, 0.0014911722450804527] and parameters: {'n_layers': 4, 'embedding_dim': 96, 'lr': 0.00017650678558847274, 'lambda_val': 0.0003659354178538993, 'batch_size': 1699, 'optimizer': 'Adam'}.
2026-06-04 00:57:38,001 - experiment_functions - INFO - Early stopping at epoch 800. Best Metrics: (0.0046045886805160426, 0.0006899323464398151, 0.002439072265620561)
2026-06-04 00:57:38,379 - optuna.study.study - INFO - Trial 15 finished with values: [0.0046045886805160426, 0.0006899323464398151, 0.002439072265620561] and parameters: {'n_layers': 1, 'embedding_dim': 64, 'lr': 0.0018324539902739038, 'lambda_val': 0.0009333372636037136, 'batch_size': 3929, 'optimizer': 'RMSprop'}.
2026-06-04 00:58:25,238 - experiment_functions - INFO - Early stopping at epoch 1250. Best Metrics: (0.00048483450251431696, 8.707883984191842e-05, 0.00026926195894016086)
2026-06-04 00:58:25,700 - optuna.study.study - INFO - Trial 16 finished with values: [0.00048483450251431696, 8.707883984191842e-05, 0.00026926195894016086] and parameters: {'n_layers': 1, 'embedding_dim': 64, 'lr': 1.7139539145564175e-05, 'lambda_val': 2.3412500753763268e-06, 'batch_size': 3815, 'optimizer': 'Adam'}.
2026-06-04 01:00:00,022 - experiment_functions - INFO - Early stopping at epoch 2250. Best Metrics: (0.004498123180797667, 0.0008255743854243419, 0.0025330494286115676)
2026-06-04 01:00:00,121 - optuna.study.study - INFO - Trial 17 finished with values: [0.004498123180797667, 0.0008255743854243419, 0.0025330494286115676] and parameters: {'n_layers': 1, 'embedding_dim': 256, 'lr': 0.002459154637131929, 'lambda_val': 0.006861251862596191, 'batch_size': 3545, 'optimizer': 'Adam'}.
2026-06-04 01:00:54,861 - experiment_functions - INFO - Early stopping at epoch 1400. Best Metrics: (0.0040921259041451375, 0.0007786857793556166, 0.002397735033466104)
2026-06-04 01:00:54,939 - optuna.study.study - INFO - Trial 18 finished with values: [0.0040921259041451375, 0.0007786857793556166, 0.002397735033466104] and parameters: {'n_layers': 1, 'embedding_dim': 128, 'lr': 0.005720533217630053, 'lambda_val': 0.0016044761768607098, 'batch_size': 1526, 'optimizer': 'RMSprop'}.
2026-06-04 01:01:37,560 - experiment_functions - INFO - Early stopping at epoch 1100. Best Metrics: (0.004297359989019248, 0.0007636144416906692, 0.0022784228544728584)
2026-06-04 01:01:37,677 - optuna.study.study - INFO - Trial 19 finished with values: [0.004297359989019248, 0.0007636144416906692, 0.0022784228544728584] and parameters: {'n_layers': 1, 'embedding_dim': 96, 'lr': 0.00832134173144575, 'lambda_val': 0.09611353650854988, 'batch_size': 2377, 'optimizer': 'RMSprop'}.
2026-06-04 01:01:59,463 - experiment_functions - INFO - Early stopping at epoch 550. Best Metrics: (0.00031141927544386846, 5.023779221649139e-05, 0.0001228405223862344)
