2026-06-04 11:50:33,584 - optuna.study.study - INFO - Trial 28 finished with values: [0.000515510999089573, 9.210261906356757e-05, 0.00023267739411268173] and parameters: {'n_layers': 3, 'embedding_dim': 32, 'lr': 2.7474973142173464e-05, 'lambda_val': 0.0007201869356981101, 'batch_size': 2097, 'optimizer': 'RMSprop'}.
2026-06-04 11:50:53,744 - experiment_functions - INFO - Early stopping at epoch 500. Best Metrics: (0.0003333340507339278, 5.861075758590662e-05, 0.00014230496172349338)
2026-06-04 11:50:54,486 - optuna.study.study - INFO - Trial 29 finished with values: [0.0003333340507339278, 5.861075758590662e-05, 0.00014230496172349338] and parameters: {'n_layers': 1, 'embedding_dim': 64, 'lr': 0.001498061841316558, 'lambda_val': 0.02827185587983181, 'batch_size': 3264, 'optimizer': 'SGD'}.
2026-06-04 11:52:08,278 - experiment_functions - INFO - Early stopping at epoch 1750. Best Metrics: (0.003895532018843012, 0.000723424207917476, 0.002355043423842176)
2026-06-04 11:52:09,129 - optuna.study.study - INFO - Trial 30 finished with values: [0.003895532018843012, 0.000723424207917476, 0.002355043423842176] and parameters: {'n_layers': 1, 'embedding_dim': 256, 'lr': 0.0017568753093311267, 'lambda_val': 0.003001642531865632, 'batch_size': 2438, 'optimizer': 'Adam'}.
2026-06-04 11:54:58,734 - optuna.study.study - INFO - Trial 31 finished with values: [0.001508891051921565, 0.0002444905887869248, 0.0007935195469353744] and parameters: {'n_layers': 4, 'embedding_dim': 128, 'lr': 0.00014427106773476223, 'lambda_val': 0.0029474529646761295, 'batch_size': 1501, 'optimizer': 'Adam'}.
2026-06-04 11:55:19,272 - experiment_functions - INFO - Early stopping at epoch 500. Best Metrics: (0.00043536177258037174, 7.703128139862015e-05, 0.00020485959884934018)
2026-06-04 11:55:19,367 - optuna.study.study - INFO - Trial 32 finished with values: [0.00043536177258037174, 7.703128139862015e-05, 0.00020485959884934018] and parameters: {'n_layers': 1, 'embedding_dim': 96, 'lr': 0.001043036059805577, 'lambda_val': 0.024878530277184556, 'batch_size': 2064, 'optimizer': 'SGD'}.
2026-06-04 11:55:40,835 - experiment_functions - INFO - Early stopping at epoch 500. Best Metrics: (0.00048073964817700886, 8.372965369415234e-05, 0.0002294350381312987)
2026-06-04 11:55:40,961 - optuna.study.study - INFO - Trial 33 finished with values: [0.00048073964817700886, 8.372965369415234e-05, 0.0002294350381312987] and parameters: {'n_layers': 3, 'embedding_dim': 96, 'lr': 4.354565516554788e-05, 'lambda_val': 0.00010889573483852956, 'batch_size': 945, 'optimizer': 'SGD'}.
2026-06-04 11:56:42,594 - experiment_functions - INFO - Early stopping at epoch 1600. Best Metrics: (0.0005774841059410243, 8.540424676803537e-05, 0.00025194523173919684)
2026-06-04 11:56:43,581 - optuna.study.study - INFO - Trial 34 finished with values: [0.0005774841059410243, 8.540424676803537e-05, 0.00025194523173919684] and parameters: {'n_layers': 1, 'embedding_dim': 128, 'lr': 2.0475681226045503e-05, 'lambda_val': 0.0031345403287035855, 'batch_size': 2955, 'optimizer': 'RMSprop'}.
2026-06-04 11:57:27,720 - experiment_functions - INFO - Early stopping at epoch 1100. Best Metrics: (0.004410405132037126, 0.000825574385424342, 0.0025770778274248852)
2026-06-04 11:57:27,801 - optuna.study.study - INFO - Trial 35 finished with values: [0.004410405132037126, 0.000825574385424342, 0.0025770778274248852] and parameters: {'n_layers': 2, 'embedding_dim': 96, 'lr': 0.0010072848810039788, 'lambda_val': 0.06405803008831426, 'batch_size': 3888, 'optimizer': 'Adam'}.
2026-06-04 11:59:58,415 - optuna.study.study - INFO - Trial 36 finished with values: [0.0010322201782535666, 0.0001724830866099538, 0.0005409210249759655] and parameters: {'n_layers': 3, 'embedding_dim': 64, 'lr': 0.00014839033192520638, 'lambda_val': 0.0012062591954365572, 'batch_size': 786, 'optimizer': 'RMSprop'}.
2026-06-04 12:01:05,152 - experiment_functions - INFO - Early stopping at epoch 1800. Best Metrics: (0.003501543382715451, 0.000612901065041195, 0.002044299447348225)
2026-06-04 12:01:05,517 - optuna.study.study - INFO - Trial 37 finished with values: [0.003501543382715451, 0.000612901065041195, 0.002044299447348225] and parameters: {'n_layers': 3, 'embedding_dim': 32, 'lr': 0.013064468809289647, 'lambda_val': 0.07902319768960056, 'batch_size': 928, 'optimizer': 'Adam'}.
2026-06-04 12:01:30,894 - experiment_functions - INFO - Early stopping at epoch 500. Best Metrics: (0.0004078761770561781, 6.0285350659789674e-05, 0.00016549681033820737)
2026-06-04 12:01:31,200 - optuna.study.study - INFO - Trial 38 finished with values: [0.0004078761770561781, 6.0285350659789674e-05, 0.00016549681033820737] and parameters: {'n_layers': 3, 'embedding_dim': 256, 'lr': 0.09033739223199559, 'lambda_val': 7.2136661627570305e-06, 'batch_size': 1300, 'optimizer': 'SGD'}.
2026-06-04 12:02:26,956 - experiment_functions - INFO - Early stopping at epoch 1500. Best Metrics: (0.00041485711728223853, 8.540424676803538e-05, 0.00022057358018452776)
2026-06-04 12:02:27,059 - optuna.study.study - INFO - Trial 39 finished with values: [0.00041485711728223853, 8.540424676803538e-05, 0.00022057358018452776] and parameters: {'n_layers': 1, 'embedding_dim': 64, 'lr': 2.550099485793571e-05, 'lambda_val': 1.5580929891779312e-06, 'batch_size': 3569, 'optimizer': 'RMSprop'}.
2026-06-04 12:02:59,606 - experiment_functions - INFO - Early stopping at epoch 800. Best Metrics: (0.0004862066084980699, 7.368209525085404e-05, 0.00021878182230880197)
2026-06-04 12:02:59,698 - optuna.study.study - INFO - Trial 40 finished with values: [0.0004862066084980699, 7.368209525085404e-05, 0.00021878182230880197] and parameters: {'n_layers': 2, 'embedding_dim': 96, 'lr': 4.326919543367669e-05, 'lambda_val': 0.023173758795273162, 'batch_size': 1837, 'optimizer': 'Adam'}.
2026-06-04 12:03:42,197 - experiment_functions - INFO - Early stopping at epoch 1050. Best Metrics: (0.003985819427689023, 0.0007351463594346575, 0.002210729772801962)
2026-06-04 12:03:42,425 - optuna.study.study - INFO - Trial 41 finished with values: [0.003985819427689023, 0.0007351463594346575, 0.002210729772801962] and parameters: {'n_layers': 4, 'embedding_dim': 64, 'lr': 0.005448976716966541, 'lambda_val': 0.06959612042277923, 'batch_size': 2593, 'optimizer': 'RMSprop'}.
2026-06-04 12:06:11,335 - optuna.study.study - INFO - Trial 42 finished with values: [0.00679535245961885, 0.001085136311876214, 0.004202971020235858] and parameters: {'n_layers': 4, 'embedding_dim': 32, 'lr': 0.00030379311378365113, 'lambda_val': 7.204655475546071e-06, 'batch_size': 3585, 'optimizer': 'RMSprop'}.
2026-06-04 12:06:31,852 - experiment_functions - INFO - Early stopping at epoch 500. Best Metrics: (0.0004802743731927892, 6.028535065978968e-05, 0.00021105870411197803)
2026-06-04 12:06:32,059 - optuna.study.study - INFO - Trial 43 finished with values: [0.0004802743731927892, 6.028535065978968e-05, 0.00021105870411197803] and parameters: {'n_layers': 4, 'embedding_dim': 32, 'lr': 0.020280096502630907, 'lambda_val': 0.01057977583154855, 'batch_size': 3613, 'optimizer': 'SGD'}.
2026-06-04 12:06:52,950 - experiment_functions - INFO - Early stopping at epoch 500. Best Metrics: (0.00039675767012736394, 7.033290910308795e-05, 0.0001916829271248326)
2026-06-04 12:06:53,883 - optuna.study.study - INFO - Trial 44 finished with values: [0.00039675767012736394, 7.033290910308795e-05, 0.0001916829271248326] and parameters: {'n_layers': 2, 'embedding_dim': 96, 'lr': 0.004238303806936364, 'lambda_val': 0.0012170367422580564, 'batch_size': 1414, 'optimizer': 'SGD'}.
2026-06-04 12:07:36,827 - experiment_functions - INFO - Early stopping at epoch 1100. Best Metrics: (0.004006202466169054, 0.000755241476321254, 0.002313688751732567)
2026-06-04 12:07:36,914 - optuna.study.study - INFO - Trial 45 finished with values: [0.004006202466169054, 0.000755241476321254, 0.002313688751732567] and parameters: {'n_layers': 2, 'embedding_dim': 64, 'lr': 0.005872976959507259, 'lambda_val': 0.06583082636580447, 'batch_size': 2270, 'optimizer': 'Adam'}.
2026-06-04 12:07:57,121 - experiment_functions - INFO - Early stopping at epoch 500. Best Metrics: (0.00046041669684315876, 6.865831602920491e-05, 0.00017935359257098118)
2026-06-04 12:07:57,705 - optuna.study.study - INFO - Trial 46 finished with values: [0.00046041669684315876, 6.865831602920491e-05, 0.00017935359257098118] and parameters: {'n_layers': 2, 'embedding_dim': 32, 'lr': 0.06291340480834369, 'lambda_val': 0.015167414752627785, 'batch_size': 3466, 'optimizer': 'SGD'}.
2026-06-04 12:09:35,723 - experiment_functions - INFO - Early stopping at epoch 2700. Best Metrics: (0.0006173283091741639, 8.540424676803537e-05, 0.0002548006490935417)
2026-06-04 12:09:35,823 - optuna.study.study - INFO - Trial 47 finished with values: [0.0006173283091741639, 8.540424676803537e-05, 0.0002548006490935417] and parameters: {'n_layers': 1, 'embedding_dim': 64, 'lr': 2.3129779934941844e-05, 'lambda_val': 4.184168777842785e-06, 'batch_size': 1688, 'optimizer': 'RMSprop'}.
2026-06-04 12:09:57,242 - experiment_functions - INFO - Early stopping at epoch 500. Best Metrics: (0.0006269703460009272, 8.875343291580147e-05, 0.00027313831053494224)
2026-06-04 12:09:57,338 - optuna.study.study - INFO - Trial 48 finished with values: [0.0006269703460009272, 8.875343291580147e-05, 0.00027313831053494224] and parameters: {'n_layers': 4, 'embedding_dim': 64, 'lr': 0.00028997793455103516, 'lambda_val': 0.04882164715511376, 'batch_size': 766, 'optimizer': 'RMSprop'}.
2026-06-04 12:10:17,791 - experiment_functions - INFO - Early stopping at epoch 500. Best Metrics: (0.0005384903873826, 7.53566883247371e-05, 0.00024464495484395783)
2026-06-04 12:10:18,571 - optuna.study.study - INFO - Trial 49 finished with values: [0.0005384903873826, 7.53566883247371e-05, 0.00024464495484395783] and parameters: {'n_layers': 2, 'embedding_dim': 64, 'lr': 0.004129213679785697, 'lambda_val': 9.66357909942193e-05, 'batch_size': 1579, 'optimizer': 'SGD'}.
2026-06-04 12:11:02,742 - experiment_functions - INFO - Early stopping at epoch 1100. Best Metrics: (0.0004222355805880569, 5.02377922164914e-05, 0.00015941450976119046)
2026-06-04 12:11:02,838 - optuna.study.study - INFO - Trial 50 finished with values: [0.0004222355805880569, 5.02377922164914e-05, 0.00015941450976119046] and parameters: {'n_layers': 2, 'embedding_dim': 128, 'lr': 0.06917017128178203, 'lambda_val': 0.023992865318772268, 'batch_size': 2206, 'optimizer': 'SGD'}.
2026-06-04 12:11:27,250 - experiment_functions - INFO - Early stopping at epoch 600. Best Metrics: (0.003915675383384524, 0.0007401701386563066, 0.0022783998509243917)
2026-06-04 12:11:27,326 - optuna.study.study - INFO - Trial 51 finished with values: [0.003915675383384524, 0.0007401701386563066, 0.0022783998509243917] and parameters: {'n_layers': 4, 'embedding_dim': 32, 'lr': 0.006097730317148143, 'lambda_val': 0.033994727743062635, 'batch_size': 4064, 'optimizer': 'Adam'}.
2026-06-04 12:13:10,745 - experiment_functions - INFO - Early stopping at epoch 2600. Best Metrics: (0.003699384317820922, 0.0006547658918882713, 0.0019381587990645144)
2026-06-04 12:13:11,058 - optuna.study.study - INFO - Trial 52 finished with values: [0.003699384317820922, 0.0006547658918882713, 0.0019381587990645144] and parameters: {'n_layers': 3, 'embedding_dim': 96, 'lr': 0.03873700217879755, 'lambda_val': 0.07902319768960056, 'batch_size': 2143, 'optimizer': 'Adam'}.
2026-06-04 12:15:41,941 - optuna.study.study - INFO - Trial 53 finished with values: [0.0015400129493668728, 0.0002126733203831469, 0.0007137536308522305] and parameters: {'n_layers': 1, 'embedding_dim': 128, 'lr': 0.00014272157858606356, 'lambda_val': 0.00010423582286031921, 'batch_size': 3105, 'optimizer': 'RMSprop'}.
2026-06-04 12:16:20,342 - experiment_functions - INFO - Early stopping at epoch 900. Best Metrics: (0.004847903541615141, 0.000867439212271418, 0.0027203060452936616)
2026-06-04 12:16:20,444 - optuna.study.study - INFO - Trial 54 finished with values: [0.004847903541615141, 0.000867439212271418, 0.0027203060452936616] and parameters: {'n_layers': 4, 'embedding_dim': 96, 'lr': 0.0008527206735717898, 'lambda_val': 0.06405803008831426, 'batch_size': 2516, 'optimizer': 'RMSprop'}.
2026-06-04 12:16:42,762 - experiment_functions - INFO - Early stopping at epoch 550. Best Metrics: (0.0033840300277975703, 0.0005978297273762476, 0.0019175467658549522)
2026-06-04 12:16:42,843 - optuna.study.study - INFO - Trial 55 finished with values: [0.0033840300277975703, 0.0005978297273762476, 0.0019175467658549522] and parameters: {'n_layers': 4, 'embedding_dim': 32, 'lr': 0.03174614439650414, 'lambda_val': 5.1016022094875355e-06, 'batch_size': 2036, 'optimizer': 'RMSprop'}.
2026-06-04 12:18:23,241 - experiment_functions - INFO - Early stopping at epoch 2750. Best Metrics: (0.003900007570775784, 0.0007284479871391252, 0.0022250199618955692)
2026-06-04 12:18:23,370 - optuna.study.study - INFO - Trial 56 finished with values: [0.003900007570775784, 0.0007284479871391252, 0.0022250199618955692] and parameters: {'n_layers': 1, 'embedding_dim': 32, 'lr': 0.007218934143837348, 'lambda_val': 0.061999086231369634, 'batch_size': 2991, 'optimizer': 'Adam'}.
2026-06-04 12:18:43,822 - experiment_functions - INFO - Early stopping at epoch 500. Best Metrics: (0.0005357710796012972, 7.87058744725032e-05, 0.00024870249528087773)
2026-06-04 12:18:44,420 - optuna.study.study - INFO - Trial 57 finished with values: [0.0005357710796012972, 7.87058744725032e-05, 0.00024870249528087773] and parameters: {'n_layers': 4, 'embedding_dim': 32, 'lr': 0.03174614439650414, 'lambda_val': 5.1016022094875355e-06, 'batch_size': 2036, 'optimizer': 'SGD'}.
2026-06-04 12:19:43,170 - experiment_functions - INFO - Early stopping at epoch 1500. Best Metrics: (0.004652360045413649, 0.0008506932815325875, 0.0025313745058993873)
2026-06-04 12:19:43,259 - optuna.study.study - INFO - Trial 58 finished with values: [0.004652360045413649, 0.0008506932815325875, 0.0025313745058993873] and parameters: {'n_layers': 1, 'embedding_dim': 128, 'lr': 0.002947410528904454, 'lambda_val': 0.05383219142167494, 'batch_size': 3509, 'optimizer': 'RMSprop'}.
2026-06-04 12:22:15,286 - optuna.study.study - INFO - Trial 59 finished with values: [0.0019571499862269886, 0.00035333913858932284, 0.0010781090598739561] and parameters: {'n_layers': 3, 'embedding_dim': 64, 'lr': 0.00020086613586383904, 'lambda_val': 0.021039161138826524, 'batch_size': 2516, 'optimizer': 'RMSprop'}.
2026-06-04 12:22:35,777 - experiment_functions - INFO - Early stopping at epoch 500. Best Metrics: (0.00047947448026815947, 8.038046754638622e-05, 0.0002575260100936903)
2026-06-04 12:22:36,072 - optuna.study.study - INFO - Trial 60 finished with values: [0.00047947448026815947, 8.038046754638622e-05, 0.0002575260100936903] and parameters: {'n_layers': 3, 'embedding_dim': 32, 'lr': 0.00020086613586383904, 'lambda_val': 0.061999086231369634, 'batch_size': 2991, 'optimizer': 'Adam'}.
2026-06-04 12:23:10,640 - experiment_functions - INFO - Early stopping at epoch 800. Best Metrics: (0.00043953130204507873, 8.70788398419184e-05, 0.00022587926919761313)
2026-06-04 12:23:10,746 - optuna.study.study - INFO - Trial 61 finished with values: [0.00043953130204507873, 8.70788398419184e-05, 0.00022587926919761313] and parameters: {'n_layers': 1, 'embedding_dim': 256, 'lr': 2.3129779934941844e-05, 'lambda_val': 0.0003112341535664991, 'batch_size': 739, 'optimizer': 'RMSprop'}.
2026-06-04 12:23:58,189 - experiment_functions - INFO - Early stopping at epoch 1150. Best Metrics: (0.004660869554405747, 0.0008975818876013129, 0.0026564519038740383)
2026-06-04 12:23:58,283 - optuna.study.study - INFO - Trial 62 finished with values: [0.004660869554405747, 0.0008975818876013129, 0.0026564519038740383] and parameters: {'n_layers': 2, 'embedding_dim': 128, 'lr': 0.0010072848810039788, 'lambda_val': 0.06405803008831426, 'batch_size': 3888, 'optimizer': 'Adam'}.
2026-06-04 12:26:29,743 - optuna.study.study - INFO - Trial 63 finished with values: [0.001124796670819925, 0.00013731663205840983, 0.000528025856590611] and parameters: {'n_layers': 3, 'embedding_dim': 64, 'lr': 0.00014839033192520638, 'lambda_val': 0.0012062591954365572, 'batch_size': 928, 'optimizer': 'Adam'}.
2026-06-04 12:26:50,001 - experiment_functions - INFO - Early stopping at epoch 500. Best Metrics: (0.0004947528753507487, 7.53566883247371e-05, 0.0002508222314748191)
2026-06-04 12:26:50,584 - optuna.study.study - INFO - Trial 64 finished with values: [0.0004947528753507487, 7.53566883247371e-05, 0.0002508222314748191] and parameters: {'n_layers': 3, 'embedding_dim': 32, 'lr': 0.00014272157858606356, 'lambda_val': 0.0006770699316504487, 'batch_size': 1580, 'optimizer': 'SGD'}.
2026-06-04 12:27:20,773 - experiment_functions - INFO - Early stopping at epoch 550. Best Metrics: (0.007223110693087753, 0.001272690736151115, 0.0040350021530602435)
2026-06-04 12:27:20,864 - optuna.study.study - INFO - Trial 65 finished with values: [0.007223110693087753, 0.001272690736151115, 0.0040350021530602435] and parameters: {'n_layers': 4, 'embedding_dim': 256, 'lr': 0.004480000793937752, 'lambda_val': 5.016933039935782e-06, 'batch_size': 2311, 'optimizer': 'RMSprop'}.
2026-06-04 12:27:41,643 - experiment_functions - INFO - Early stopping at epoch 500. Best Metrics: (0.00043242238175215047, 7.368209525085404e-05, 0.00020338139156593626)
2026-06-04 12:27:42,267 - optuna.study.study - INFO - Trial 66 finished with values: [0.00043242238175215047, 7.368209525085404e-05, 0.00020338139156593626] and parameters: {'n_layers': 3, 'embedding_dim': 64, 'lr': 0.005448976716966541, 'lambda_val': 0.06959612042277923, 'batch_size': 945, 'optimizer': 'SGD'}.
2026-06-04 12:28:47,868 - experiment_functions - INFO - Early stopping at epoch 1800. Best Metrics: (0.0033790332449360936, 0.0006514167057405051, 0.0019137048245686887)
2026-06-04 12:28:47,955 - optuna.study.study - INFO - Trial 67 finished with values: [0.0033790332449360936, 0.0006514167057405051, 0.0019137048245686887] and parameters: {'n_layers': 1, 'embedding_dim': 32, 'lr': 0.050035850224393816, 'lambda_val': 0.0494345449176384, 'batch_size': 960, 'optimizer': 'Adam'}.
2026-06-04 12:29:26,323 - experiment_functions - INFO - Early stopping at epoch 900. Best Metrics: (0.0005182805908939017, 7.703128139862013e-05, 0.0002479265423093439)
2026-06-04 12:29:26,751 - optuna.study.study - INFO - Trial 68 finished with values: [0.0005182805908939017, 7.703128139862013e-05, 0.0002479265423093439] and parameters: {'n_layers': 3, 'embedding_dim': 128, 'lr': 2.0475681226045503e-05, 'lambda_val': 7.359862236281652e-06, 'batch_size': 1126, 'optimizer': 'RMSprop'}.
2026-06-04 12:31:53,469 - experiment_functions - INFO - Early stopping at epoch 3900. Best Metrics: (0.0010537371813096885, 0.00014568959742782502, 0.000575174243592854)
2026-06-04 12:31:53,549 - optuna.study.study - INFO - Trial 69 finished with values: [0.0010537371813096885, 0.00014568959742782502, 0.000575174243592854] and parameters: {'n_layers': 3, 'embedding_dim': 64, 'lr': 0.00014839033192520638, 'lambda_val': 5.1016022094875355e-06, 'batch_size': 786, 'optimizer': 'RMSprop'}.
2026-06-04 12:32:42,515 - experiment_functions - INFO - Early stopping at epoch 1150. Best Metrics: (0.0005308550100344004, 7.870587447250318e-05, 0.00025896908667971425)
2026-06-04 12:32:42,594 - optuna.study.study - INFO - Trial 70 finished with values: [0.0005308550100344004, 7.870587447250318e-05, 0.00025896908667971425] and parameters: {'n_layers': 3, 'embedding_dim': 128, 'lr': 2.9364871278563124e-05, 'lambda_val': 4.017909288602887e-06, 'batch_size': 3235, 'optimizer': 'Adam'}.
2026-06-04 12:33:03,290 - experiment_functions - INFO - Early stopping at epoch 500. Best Metrics: (0.00042363967082032535, 5.5261571438140545e-05, 0.0002112576021760737)
2026-06-04 12:33:03,380 - optuna.study.study - INFO - Trial 71 finished with values: [0.00042363967082032535, 5.5261571438140545e-05, 0.0002112576021760737] and parameters: {'n_layers': 2, 'embedding_dim': 64, 'lr': 0.00030379311378365113, 'lambda_val': 0.0005361591749845432, 'batch_size': 3857, 'optimizer': 'SGD'}.
2026-06-04 12:35:45,543 - optuna.study.study - INFO - Trial 72 finished with values: [0.0011302258706118607, 0.00016243552816665548, 0.0006239526657447513] and parameters: {'n_layers': 4, 'embedding_dim': 96, 'lr': 7.70984273910781e-05, 'lambda_val': 4.455400500697832e-06, 'batch_size': 3857, 'optimizer': 'RMSprop'}.
2026-06-04 12:36:30,095 - experiment_functions - INFO - Early stopping at epoch 1150. Best Metrics: (0.00966348660351267, 0.0016662201085136312, 0.00547215466946995)
2026-06-04 12:36:30,238 - optuna.study.study - INFO - Trial 73 finished with values: [0.00966348660351267, 0.0016662201085136312, 0.00547215466946995] and parameters: {'n_layers': 4, 'embedding_dim': 32, 'lr': 0.0014181685787657509, 'lambda_val': 0.0029474529646761295, 'batch_size': 739, 'optimizer': 'Adam'}.
2026-06-04 12:36:50,780 - experiment_functions - INFO - Early stopping at epoch 500. Best Metrics: (0.0005408584947962764, 7.870587447250318e-05, 0.0002575919806744913)
2026-06-04 12:36:51,566 - optuna.study.study - INFO - Trial 74 finished with values: [0.0005408584947962764, 7.870587447250318e-05, 0.0002575919806744913] and parameters: {'n_layers': 3, 'embedding_dim': 32, 'lr': 0.00020086613586383904, 'lambda_val': 0.061999086231369634, 'batch_size': 2991, 'optimizer': 'Adam'}.
2026-06-04 12:37:17,310 - experiment_functions - INFO - Early stopping at epoch 650. Best Metrics: (0.000428924815136258, 6.363453680755577e-05, 0.00022065124257532735)
