2026-06-05 11:28:07,800 - optuna.study.study - INFO - Trial 244 finished with values: [0.00046249779971143577, 7.033290910308795e-05, 0.00022984672225613955] and parameters: {'n_layers': 1, 'embedding_dim': 64, 'lr': 7.221769192045255e-05, 'lambda_val': 0.0016814429808714936, 'batch_size': 1300, 'optimizer': 'RMSprop'}.
2026-06-05 11:28:33,567 - experiment_functions - INFO - Early stopping at epoch 500. Best Metrics: (0.0005723324268881293, 8.038046754638624e-05, 0.0003109889726837286)
2026-06-05 11:28:33,642 - optuna.study.study - INFO - Trial 245 finished with values: [0.0005723324268881293, 8.038046754638624e-05, 0.0003109889726837286] and parameters: {'n_layers': 2, 'embedding_dim': 256, 'lr': 0.0023440150084551373, 'lambda_val': 0.00019504902637205833, 'batch_size': 1812, 'optimizer': 'SGD'}.
2026-06-05 11:31:33,015 - optuna.study.study - INFO - Trial 246 finished with values: [0.05924564388736629, 0.008359568624824168, 0.03394776784402337] and parameters: {'n_layers': 1, 'embedding_dim': 256, 'lr': 0.0006201349398045224, 'lambda_val': 0.0003344121448101528, 'batch_size': 1300, 'optimizer': 'RMSprop'}.
2026-06-05 11:34:28,772 - optuna.study.study - INFO - Trial 247 finished with values: [0.008019397688626218, 0.0014150311474311742, 0.004521494722696919] and parameters: {'n_layers': 1, 'embedding_dim': 256, 'lr': 0.0002935151629562318, 'lambda_val': 1.4491750574665045e-05, 'batch_size': 2799, 'optimizer': 'Adam'}.
2026-06-05 11:34:52,740 - experiment_functions - INFO - Early stopping at epoch 550. Best Metrics: (0.0004837970974491472, 8.372965369415233e-05, 0.00021535694741881334)
2026-06-05 11:34:52,840 - optuna.study.study - INFO - Trial 248 finished with values: [0.0004837970974491472, 8.372965369415233e-05, 0.00021535694741881334] and parameters: {'n_layers': 1, 'embedding_dim': 128, 'lr': 8.320483320029179e-05, 'lambda_val': 3.6389561047642882e-06, 'batch_size': 808, 'optimizer': 'Adam'}.
2026-06-05 11:37:31,941 - experiment_functions - INFO - Early stopping at epoch 2700. Best Metrics: (0.035582822877403116, 0.004049166052649206, 0.016268860258686898)
2026-06-05 11:37:32,031 - optuna.study.study - INFO - Trial 249 finished with values: [0.035582822877403116, 0.004049166052649206, 0.016268860258686898] and parameters: {'n_layers': 4, 'embedding_dim': 256, 'lr': 0.0023440150084551373, 'lambda_val': 0.0003344121448101528, 'batch_size': 1554, 'optimizer': 'RMSprop'}.
2026-06-05 11:38:13,480 - experiment_functions - INFO - Early stopping at epoch 900. Best Metrics: (0.06920058890589376, 0.008408131823966776, 0.03562070406273213)
2026-06-05 11:38:14,750 - optuna.study.study - INFO - Trial 250 finished with values: [0.06920058890589376, 0.008408131823966776, 0.03562070406273213] and parameters: {'n_layers': 2, 'embedding_dim': 128, 'lr': 0.0023440150084551373, 'lambda_val': 0.00012250709547244776, 'batch_size': 1554, 'optimizer': 'Adam'}.
2026-06-05 11:40:11,161 - experiment_functions - INFO - Early stopping at epoch 2300. Best Metrics: (0.07950063694032775, 0.00968919552548731, 0.040611484734860384)
2026-06-05 11:40:11,378 - optuna.study.study - INFO - Trial 251 finished with values: [0.07950063694032775, 0.00968919552548731, 0.040611484734860384] and parameters: {'n_layers': 2, 'embedding_dim': 256, 'lr': 0.0006201349398045224, 'lambda_val': 0.0007536284412237263, 'batch_size': 1642, 'optimizer': 'RMSprop'}.
2026-06-05 11:43:12,926 - optuna.study.study - INFO - Trial 252 finished with values: [0.08427689873811796, 0.010809498291915064, 0.04645388306219184] and parameters: {'n_layers': 1, 'embedding_dim': 256, 'lr': 0.0008252437334877037, 'lambda_val': 0.0003344121448101528, 'batch_size': 1300, 'optimizer': 'RMSprop'}.
2026-06-05 11:45:54,817 - optuna.study.study - INFO - Trial 253 finished with values: [0.07328971932747305, 0.009694219304708955, 0.04128615829678588] and parameters: {'n_layers': 1, 'embedding_dim': 128, 'lr': 0.0007375072560140114, 'lambda_val': 8.17902589782426e-05, 'batch_size': 1812, 'optimizer': 'RMSprop'}.
2026-06-05 11:46:38,135 - experiment_functions - INFO - Early stopping at epoch 1000. Best Metrics: (0.039258187567089826, 0.004757518922901736, 0.018622580633531602)
2026-06-05 11:46:38,243 - optuna.study.study - INFO - Trial 254 finished with values: [0.039258187567089826, 0.004757518922901736, 0.018622580633531602] and parameters: {'n_layers': 4, 'embedding_dim': 64, 'lr': 0.0014474267912490204, 'lambda_val': 2.9592301381874183e-05, 'batch_size': 3735, 'optimizer': 'RMSprop'}.
2026-06-05 11:47:24,158 - experiment_functions - INFO - Early stopping at epoch 1050. Best Metrics: (0.035879760647242895, 0.004288632862214483, 0.016031286755274984)
2026-06-05 11:47:24,249 - optuna.study.study - INFO - Trial 255 finished with values: [0.035879760647242895, 0.004288632862214483, 0.016031286755274984] and parameters: {'n_layers': 2, 'embedding_dim': 128, 'lr': 0.0023440150084551373, 'lambda_val': 0.0028468440427530635, 'batch_size': 1554, 'optimizer': 'RMSprop'}.
2026-06-05 11:50:20,518 - optuna.study.study - INFO - Trial 256 finished with values: [0.044995990943973524, 0.006554357291178243, 0.026545400120190972] and parameters: {'n_layers': 1, 'embedding_dim': 256, 'lr': 0.0006201349398045224, 'lambda_val': 6.418679611908736e-05, 'batch_size': 1373, 'optimizer': 'Adam'}.
2026-06-05 11:52:57,448 - optuna.study.study - INFO - Trial 257 finished with values: [0.06604522501019673, 0.008820081720142006, 0.038001805509818874] and parameters: {'n_layers': 1, 'embedding_dim': 64, 'lr': 0.0006201349398045224, 'lambda_val': 6.977831082453278e-06, 'batch_size': 3113, 'optimizer': 'RMSprop'}.
2026-06-05 11:53:41,697 - experiment_functions - INFO - Early stopping at epoch 850. Best Metrics: (0.06555053360967539, 0.008270815191908368, 0.034012822947196215)
2026-06-05 11:53:41,992 - optuna.study.study - INFO - Trial 258 finished with values: [0.06555053360967539, 0.008270815191908368, 0.034012822947196215] and parameters: {'n_layers': 2, 'embedding_dim': 256, 'lr': 0.0017163448230141686, 'lambda_val': 0.0007536284412237263, 'batch_size': 1300, 'optimizer': 'Adam'}.
2026-06-05 11:54:19,437 - experiment_functions - INFO - Early stopping at epoch 700. Best Metrics: (0.07568377093771578, 0.00927892022238596, 0.03853821121883676)
2026-06-05 11:54:19,530 - optuna.study.study - INFO - Trial 259 finished with values: [0.07568377093771578, 0.00927892022238596, 0.03853821121883676] and parameters: {'n_layers': 2, 'embedding_dim': 256, 'lr': 0.0023440150084551373, 'lambda_val': 0.0003344121448101528, 'batch_size': 3735, 'optimizer': 'Adam'}.
2026-06-05 11:57:44,581 - experiment_functions - INFO - Early stopping at epoch 3800. Best Metrics: (0.04476502938003898, 0.005094112130752227, 0.019957001941744597)
2026-06-05 11:57:44,658 - optuna.study.study - INFO - Trial 260 finished with values: [0.04476502938003898, 0.005094112130752227, 0.019957001941744597] and parameters: {'n_layers': 3, 'embedding_dim': 256, 'lr': 0.0023440150084551373, 'lambda_val': 7.059587443324882e-05, 'batch_size': 1300, 'optimizer': 'RMSprop'}.
2026-06-05 11:58:36,198 - experiment_functions - INFO - Early stopping at epoch 1200. Best Metrics: (0.07890143280816579, 0.01000401902337732, 0.04122622252643221)
2026-06-05 11:58:36,283 - optuna.study.study - INFO - Trial 261 finished with values: [0.07890143280816579, 0.01000401902337732, 0.04122622252643221] and parameters: {'n_layers': 1, 'embedding_dim': 128, 'lr': 0.0023440150084551373, 'lambda_val': 0.0007536284412237263, 'batch_size': 1554, 'optimizer': 'Adam'}.
2026-06-05 11:59:25,714 - experiment_functions - INFO - Early stopping at epoch 1100. Best Metrics: (0.028145589247807027, 0.003647263714917275, 0.01246273551575002)
2026-06-05 11:59:25,813 - optuna.study.study - INFO - Trial 262 finished with values: [0.028145589247807027, 0.003647263714917275, 0.01246273551575002] and parameters: {'n_layers': 1, 'embedding_dim': 256, 'lr': 0.001492637607346936, 'lambda_val': 0.05038089589641711, 'batch_size': 1300, 'optimizer': 'RMSprop'}.
2026-06-05 12:02:06,008 - optuna.study.study - INFO - Trial 263 finished with values: [0.09029639479690305, 0.011075758590662468, 0.04831037323979429] and parameters: {'n_layers': 1, 'embedding_dim': 96, 'lr': 0.0014474267912490204, 'lambda_val': 0.00012250709547244776, 'batch_size': 1554, 'optimizer': 'RMSprop'}.
2026-06-05 12:02:54,360 - experiment_functions - INFO - Early stopping at epoch 1100. Best Metrics: (0.0005482745025714113, 7.368209525085404e-05, 0.00027712599626178355)
2026-06-05 12:02:54,468 - optuna.study.study - INFO - Trial 264 finished with values: [0.0005482745025714113, 7.368209525085404e-05, 0.00027712599626178355] and parameters: {'n_layers': 1, 'embedding_dim': 256, 'lr': 7.57655070312132e-05, 'lambda_val': 6.977831082453278e-06, 'batch_size': 1300, 'optimizer': 'RMSprop'}.
2026-06-05 12:06:49,772 - optuna.study.study - INFO - Trial 265 finished with values: [0.060053453012881806, 0.007053386027195393, 0.030816753024573342] and parameters: {'n_layers': 4, 'embedding_dim': 256, 'lr': 0.0006201349398045224, 'lambda_val': 6.977831082453278e-06, 'batch_size': 826, 'optimizer': 'RMSprop'}.
2026-06-05 12:07:28,155 - experiment_functions - INFO - Early stopping at epoch 800. Best Metrics: (0.052170868642716625, 0.0063266126331301496, 0.025326517426540268)
2026-06-05 12:07:28,258 - optuna.study.study - INFO - Trial 266 finished with values: [0.052170868642716625, 0.0063266126331301496, 0.025326517426540268] and parameters: {'n_layers': 3, 'embedding_dim': 128, 'lr': 0.0023440150084551373, 'lambda_val': 0.0001259444323663503, 'batch_size': 1610, 'optimizer': 'Adam'}.
2026-06-05 12:10:47,453 - optuna.study.study - INFO - Trial 267 finished with values: [0.049508929799579375, 0.006818942996851766, 0.025269772662766525] and parameters: {'n_layers': 2, 'embedding_dim': 256, 'lr': 0.0002935151629562318, 'lambda_val': 0.006784020914475507, 'batch_size': 3358, 'optimizer': 'Adam'}.
2026-06-05 12:11:18,821 - experiment_functions - INFO - Early stopping at epoch 700. Best Metrics: (0.06340939790393314, 0.00804139594078639, 0.03186150324099383)
2026-06-05 12:11:18,921 - optuna.study.study - INFO - Trial 268 finished with values: [0.06340939790393314, 0.00804139594078639, 0.03186150324099383] and parameters: {'n_layers': 1, 'embedding_dim': 128, 'lr': 0.0023440150084551373, 'lambda_val': 0.0028468440427530635, 'batch_size': 4021, 'optimizer': 'RMSprop'}.
2026-06-05 12:11:40,754 - experiment_functions - INFO - Early stopping at epoch 500. Best Metrics: (0.0005940491893364904, 9.71263982852167e-05, 0.0002990253329542094)
2026-06-05 12:11:41,606 - optuna.study.study - INFO - Trial 269 finished with values: [0.0005940491893364904, 9.71263982852167e-05, 0.0002990253329542094] and parameters: {'n_layers': 1, 'embedding_dim': 128, 'lr': 0.0023440150084551373, 'lambda_val': 0.0028468440427530635, 'batch_size': 3250, 'optimizer': 'SGD'}.
2026-06-05 12:12:22,864 - experiment_functions - INFO - Early stopping at epoch 900. Best Metrics: (0.0546422357254311, 0.00702491794493938, 0.027617771574747256)
2026-06-05 12:12:23,150 - optuna.study.study - INFO - Trial 270 finished with values: [0.0546422357254311, 0.00702491794493938, 0.027617771574747256] and parameters: {'n_layers': 2, 'embedding_dim': 128, 'lr': 0.0017163448230141686, 'lambda_val': 0.0028468440427530635, 'batch_size': 1361, 'optimizer': 'Adam'}.
2026-06-05 12:13:03,271 - experiment_functions - INFO - Early stopping at epoch 900. Best Metrics: (0.06968188859322884, 0.008543773862951303, 0.03650549706754261)
2026-06-05 12:13:03,384 - optuna.study.study - INFO - Trial 271 finished with values: [0.06968188859322884, 0.008543773862951303, 0.03650549706754261] and parameters: {'n_layers': 2, 'embedding_dim': 96, 'lr': 0.0023440150084551373, 'lambda_val': 0.00012250709547244776, 'batch_size': 1554, 'optimizer': 'Adam'}.
2026-06-05 12:15:29,166 - optuna.study.study - INFO - Trial 272 finished with values: [0.024431249654951828, 0.0038884051175564335, 0.015049988391039574] and parameters: {'n_layers': 1, 'embedding_dim': 32, 'lr': 0.0006201349398045224, 'lambda_val': 0.0007536284412237263, 'batch_size': 1300, 'optimizer': 'RMSprop'}.
2026-06-05 12:18:18,328 - optuna.study.study - INFO - Trial 273 finished with values: [0.002893081967915869, 0.0005526157143814053, 0.0017106569321283691] and parameters: {'n_layers': 1, 'embedding_dim': 256, 'lr': 0.0002935151629562318, 'lambda_val': 6.829853986539386e-05, 'batch_size': 1554, 'optimizer': 'RMSprop'}.
2026-06-05 12:20:51,903 - optuna.study.study - INFO - Trial 274 finished with values: [0.05260972985918615, 0.007403375979636947, 0.03043111742990715] and parameters: {'n_layers': 1, 'embedding_dim': 64, 'lr': 0.0006201349398045224, 'lambda_val': 7.059587443324882e-05, 'batch_size': 2203, 'optimizer': 'RMSprop'}.
2026-06-05 12:21:13,445 - experiment_functions - INFO - Early stopping at epoch 500. Best Metrics: (0.0005324165972378599, 7.87058744725032e-05, 0.00022911167940022377)
2026-06-05 12:21:13,541 - optuna.study.study - INFO - Trial 275 finished with values: [0.0005324165972378599, 7.87058744725032e-05, 0.00022911167940022377] and parameters: {'n_layers': 1, 'embedding_dim': 128, 'lr': 0.006542998749224963, 'lambda_val': 0.002704517607370656, 'batch_size': 1300, 'optimizer': 'SGD'}.
2026-06-05 12:22:38,496 - experiment_functions - INFO - Early stopping at epoch 1800. Best Metrics: (0.06702749262047887, 0.008064840243820752, 0.03478047158233836)
2026-06-05 12:22:38,581 - optuna.study.study - INFO - Trial 276 finished with values: [0.06702749262047887, 0.008064840243820752, 0.03478047158233836] and parameters: {'n_layers': 3, 'embedding_dim': 128, 'lr': 0.0006201349398045224, 'lambda_val': 1.8955427304330258e-06, 'batch_size': 3358, 'optimizer': 'RMSprop'}.
2026-06-05 12:24:06,115 - experiment_functions - INFO - Early stopping at epoch 1700. Best Metrics: (0.07700707559363308, 0.009386094179114474, 0.03932976835960571)
2026-06-05 12:24:07,494 - optuna.study.study - INFO - Trial 277 finished with values: [0.07700707559363308, 0.009386094179114474, 0.03932976835960571] and parameters: {'n_layers': 2, 'embedding_dim': 256, 'lr': 0.0006201349398045224, 'lambda_val': 0.0007536284412237263, 'batch_size': 2799, 'optimizer': 'RMSprop'}.
2026-06-05 12:24:30,867 - experiment_functions - INFO - Early stopping at epoch 500. Best Metrics: (0.00041511803698553537, 8.038046754638624e-05, 0.00022302929944629238)
2026-06-05 12:24:31,076 - optuna.study.study - INFO - Trial 278 finished with values: [0.00041511803698553537, 8.038046754638624e-05, 0.00022302929944629238] and parameters: {'n_layers': 1, 'embedding_dim': 256, 'lr': 0.0023440150084551373, 'lambda_val': 0.005129998393566201, 'batch_size': 1554, 'optimizer': 'SGD'}.
2026-06-05 12:25:02,918 - experiment_functions - INFO - Early stopping at epoch 650. Best Metrics: (0.05196266890457096, 0.00636512827382946, 0.025370752250335107)
2026-06-05 12:25:03,003 - optuna.study.study - INFO - Trial 279 finished with values: [0.05196266890457096, 0.00636512827382946, 0.025370752250335107] and parameters: {'n_layers': 3, 'embedding_dim': 128, 'lr': 0.0023440150084551373, 'lambda_val': 0.0007536284412237263, 'batch_size': 3890, 'optimizer': 'Adam'}.
2026-06-05 12:28:21,634 - optuna.study.study - INFO - Trial 280 finished with values: [0.058378212891440955, 0.0066866501440150045, 0.028018175274848248] and parameters: {'n_layers': 2, 'embedding_dim': 256, 'lr': 0.006542998749224963, 'lambda_val': 6.977831082453278e-06, 'batch_size': 808, 'optimizer': 'RMSprop'}.
2026-06-05 12:29:01,733 - experiment_functions - INFO - Early stopping at epoch 950. Best Metrics: (0.05294879279520009, 0.0064605800790407935, 0.025402642989847617)
2026-06-05 12:29:01,825 - optuna.study.study - INFO - Trial 281 finished with values: [0.05294879279520009, 0.0064605800790407935, 0.025402642989847617] and parameters: {'n_layers': 2, 'embedding_dim': 64, 'lr': 0.0017163448230141686, 'lambda_val': 0.0015694921564952753, 'batch_size': 2307, 'optimizer': 'RMSprop'}.
2026-06-05 12:30:16,083 - experiment_functions - INFO - Early stopping at epoch 1750. Best Metrics: (0.08580234203124017, 0.010469555897916805, 0.044190777803034806)
2026-06-05 12:30:16,959 - optuna.study.study - INFO - Trial 282 finished with values: [0.08580234203124017, 0.010469555897916805, 0.044190777803034806] and parameters: {'n_layers': 1, 'embedding_dim': 128, 'lr': 0.0023440150084551373, 'lambda_val': 8.17902589782426e-05, 'batch_size': 1812, 'optimizer': 'Adam'}.
2026-06-05 12:30:55,579 - experiment_functions - INFO - Early stopping at epoch 900. Best Metrics: (0.07045178512154301, 0.008699511018822426, 0.034774164280798096)
2026-06-05 12:30:55,668 - optuna.study.study - INFO - Trial 283 finished with values: [0.07045178512154301, 0.008699511018822426, 0.034774164280798096] and parameters: {'n_layers': 2, 'embedding_dim': 64, 'lr': 0.0017163448230141686, 'lambda_val': 0.00012250709547244776, 'batch_size': 4021, 'optimizer': 'Adam'}.
2026-06-05 12:33:57,608 - optuna.study.study - INFO - Trial 284 finished with values: [0.08368593688469055, 0.010749212941255276, 0.04683389421363397] and parameters: {'n_layers': 1, 'embedding_dim': 256, 'lr': 0.0008252437334877037, 'lambda_val': 6.977831082453278e-06, 'batch_size': 1300, 'optimizer': 'RMSprop'}.
2026-06-05 12:35:24,245 - experiment_functions - INFO - Early stopping at epoch 1550. Best Metrics: (0.05311152403308682, 0.006366802866903343, 0.025438888548815736)
2026-06-05 12:35:24,367 - optuna.study.study - INFO - Trial 285 finished with values: [0.05311152403308682, 0.006366802866903343, 0.025438888548815736] and parameters: {'n_layers': 3, 'embedding_dim': 256, 'lr': 0.0006201349398045224, 'lambda_val': 0.0028468440427530635, 'batch_size': 1799, 'optimizer': 'Adam'}.
2026-06-05 12:36:05,262 - experiment_functions - INFO - Early stopping at epoch 950. Best Metrics: (0.062330837766158526, 0.007525621274030411, 0.032071826401401445)
2026-06-05 12:36:05,366 - optuna.study.study - INFO - Trial 286 finished with values: [0.062330837766158526, 0.007525621274030411, 0.032071826401401445] and parameters: {'n_layers': 2, 'embedding_dim': 64, 'lr': 0.0017163448230141686, 'lambda_val': 0.00012647602145488904, 'batch_size': 1812, 'optimizer': 'RMSprop'}.
2026-06-05 12:36:52,669 - experiment_functions - INFO - Early stopping at epoch 1000. Best Metrics: (0.08581377072403278, 0.010605197936901333, 0.04472688796841471)
2026-06-05 12:36:52,765 - optuna.study.study - INFO - Trial 287 finished with values: [0.08581377072403278, 0.010605197936901333, 0.04472688796841471] and parameters: {'n_layers': 1, 'embedding_dim': 256, 'lr': 0.0023440150084551373, 'lambda_val': 0.00012250709547244776, 'batch_size': 3539, 'optimizer': 'Adam'}.
2026-06-05 12:37:41,713 - experiment_functions - INFO - Early stopping at epoch 1150. Best Metrics: (0.07498729926932535, 0.009292316966977026, 0.03866490286806087)
2026-06-05 12:37:41,840 - optuna.study.study - INFO - Trial 288 finished with values: [0.07498729926932535, 0.009292316966977026, 0.03866490286806087] and parameters: {'n_layers': 1, 'embedding_dim': 128, 'lr': 0.0023440150084551373, 'lambda_val': 0.0003344121448101528, 'batch_size': 1554, 'optimizer': 'RMSprop'}.
2026-06-05 12:38:12,986 - experiment_functions - INFO - Early stopping at epoch 700. Best Metrics: (0.07868109309322953, 0.009649005291714115, 0.040486766660263566)
2026-06-05 12:38:13,086 - optuna.study.study - INFO - Trial 289 finished with values: [0.07868109309322953, 0.009649005291714115, 0.040486766660263566] and parameters: {'n_layers': 1, 'embedding_dim': 128, 'lr': 0.005703236170133443, 'lambda_val': 6.977831082453278e-06, 'batch_size': 3612, 'optimizer': 'Adam'}.
2026-06-05 12:38:46,208 - experiment_functions - INFO - Early stopping at epoch 750. Best Metrics: (0.07436398159013968, 0.009299015339272555, 0.03775833090726268)
2026-06-05 12:38:46,296 - optuna.study.study - INFO - Trial 290 finished with values: [0.07436398159013968, 0.009299015339272555, 0.03775833090726268] and parameters: {'n_layers': 1, 'embedding_dim': 128, 'lr': 0.0023440150084551373, 'lambda_val': 0.0007536284412237263, 'batch_size': 3890, 'optimizer': 'RMSprop'}.
2026-06-05 12:39:21,115 - experiment_functions - INFO - Early stopping at epoch 850. Best Metrics: (0.07183660132594008, 0.009067921495076696, 0.0374390466087781)
2026-06-05 12:39:21,206 - optuna.study.study - INFO - Trial 291 finished with values: [0.07183660132594008, 0.009067921495076696, 0.0374390466087781] and parameters: {'n_layers': 1, 'embedding_dim': 32, 'lr': 0.003882837728452431, 'lambda_val': 0.0007536284412237263, 'batch_size': 3890, 'optimizer': 'Adam'}.
2026-06-05 12:39:49,454 - experiment_functions - INFO - Early stopping at epoch 650. Best Metrics: (0.02585886912447944, 0.003118092303570233, 0.011493298197087788)
2026-06-05 12:39:49,553 - optuna.study.study - INFO - Trial 292 finished with values: [0.02585886912447944, 0.003118092303570233, 0.011493298197087788] and parameters: {'n_layers': 3, 'embedding_dim': 64, 'lr': 0.005703236170133443, 'lambda_val': 0.002704517607370656, 'batch_size': 1554, 'optimizer': 'Adam'}.
2026-06-05 12:42:59,395 - experiment_functions - INFO - Early stopping at epoch 3800. Best Metrics: (0.08473563368625729, 0.010410945140330901, 0.04496662234760144)
2026-06-05 12:42:59,570 - optuna.study.study - INFO - Trial 293 finished with values: [0.08473563368625729, 0.010410945140330901, 0.04496662234760144] and parameters: {'n_layers': 2, 'embedding_dim': 256, 'lr': 0.0006201349398045224, 'lambda_val': 0.00012250709547244776, 'batch_size': 1300, 'optimizer': 'RMSprop'}.
2026-06-05 12:45:55,128 - optuna.study.study - INFO - Trial 294 finished with values: [0.07531735212983359, 0.00958034697568491, 0.04120058454193887] and parameters: {'n_layers': 2, 'embedding_dim': 128, 'lr': 0.0006201349398045224, 'lambda_val': 6.977831082453278e-06, 'batch_size': 1300, 'optimizer': 'Adam'}.
