2026-06-04 17:46:18,320 - optuna.study.study - INFO - Trial 56 finished with values: [0.004163171414942116, 0.0007669636278384352, 0.002356852543239789] and parameters: {'n_layers': 4, 'embedding_dim': 128, 'lr': 0.014232768730502419, 'lambda_val': 0.005255002744531624, 'batch_size': 2180, 'optimizer': 'RMSprop'}.
2026-06-04 17:46:42,796 - experiment_functions - INFO - Early stopping at epoch 600. Best Metrics: (0.004252030887908316, 0.0008372965369415233, 0.0024685458885662375)
2026-06-04 17:46:42,890 - optuna.study.study - INFO - Trial 57 finished with values: [0.004252030887908316, 0.0008372965369415233, 0.0024685458885662375] and parameters: {'n_layers': 4, 'embedding_dim': 32, 'lr': 0.003777254071001523, 'lambda_val': 0.014288330649818581, 'batch_size': 2067, 'optimizer': 'RMSprop'}.
2026-06-04 17:47:11,929 - experiment_functions - INFO - Early stopping at epoch 750. Best Metrics: (0.004420621165209936, 0.000684908567218166, 0.002487679958221637)
2026-06-04 17:47:12,753 - optuna.study.study - INFO - Trial 58 finished with values: [0.004420621165209936, 0.000684908567218166, 0.002487679958221637] and parameters: {'n_layers': 1, 'embedding_dim': 32, 'lr': 0.004846510423333318, 'lambda_val': 7.100449954558587e-05, 'batch_size': 2614, 'optimizer': 'Adam'}.
2026-06-04 17:48:18,937 - experiment_functions - INFO - Early stopping at epoch 1650. Best Metrics: (0.008797530878749186, 0.001587514234041128, 0.00506244672975747)
2026-06-04 17:48:19,487 - optuna.study.study - INFO - Trial 59 finished with values: [0.008797530878749186, 0.001587514234041128, 0.00506244672975747] and parameters: {'n_layers': 4, 'embedding_dim': 64, 'lr': 0.0007307808528773397, 'lambda_val': 3.61928423516103e-05, 'batch_size': 3398, 'optimizer': 'RMSprop'}.
2026-06-04 17:48:48,101 - experiment_functions - INFO - Early stopping at epoch 550. Best Metrics: (0.004882789225355247, 0.0008942327014535467, 0.0027597179715774384)
2026-06-04 17:48:48,192 - optuna.study.study - INFO - Trial 60 finished with values: [0.004882789225355247, 0.0008942327014535467, 0.0027597179715774384] and parameters: {'n_layers': 3, 'embedding_dim': 256, 'lr': 0.005575824047051625, 'lambda_val': 0.005255002744531624, 'batch_size': 2193, 'optimizer': 'RMSprop'}.
2026-06-04 17:49:21,367 - experiment_functions - INFO - Early stopping at epoch 850. Best Metrics: (0.0061831699221788754, 0.0010248509612164245, 0.0038110474625653525)
2026-06-04 17:49:21,453 - optuna.study.study - INFO - Trial 61 finished with values: [0.0061831699221788754, 0.0010248509612164245, 0.0038110474625653525] and parameters: {'n_layers': 2, 'embedding_dim': 32, 'lr': 0.0032493879970223157, 'lambda_val': 0.00016806129938668377, 'batch_size': 1336, 'optimizer': 'RMSprop'}.
2026-06-04 17:50:19,497 - experiment_functions - INFO - Early stopping at epoch 1350. Best Metrics: (0.004655126229867656, 0.0008088284546855115, 0.002649528969421066)
2026-06-04 17:50:19,937 - optuna.study.study - INFO - Trial 62 finished with values: [0.004655126229867656, 0.0008088284546855115, 0.002649528969421066] and parameters: {'n_layers': 1, 'embedding_dim': 256, 'lr': 0.004846510423333318, 'lambda_val': 0.00030928804991492686, 'batch_size': 938, 'optimizer': 'Adam'}.
2026-06-04 17:51:33,824 - experiment_functions - INFO - Early stopping at epoch 1900. Best Metrics: (0.0044854701317988644, 0.000859066246902003, 0.0024901099239801588)
2026-06-04 17:51:33,999 - optuna.study.study - INFO - Trial 63 finished with values: [0.0044854701317988644, 0.000859066246902003, 0.0024901099239801588] and parameters: {'n_layers': 1, 'embedding_dim': 128, 'lr': 0.020299600929016177, 'lambda_val': 0.004078312210980698, 'batch_size': 1107, 'optimizer': 'RMSprop'}.
2026-06-04 17:51:55,653 - experiment_functions - INFO - Early stopping at epoch 500. Best Metrics: (0.0003760717720752114, 6.363453680755577e-05, 0.00018914773427139908)
2026-06-04 17:51:55,737 - optuna.study.study - INFO - Trial 64 finished with values: [0.0003760717720752114, 6.363453680755577e-05, 0.00018914773427139908] and parameters: {'n_layers': 3, 'embedding_dim': 96, 'lr': 0.004869110805383165, 'lambda_val': 3.61928423516103e-05, 'batch_size': 674, 'optimizer': 'SGD'}.
2026-06-04 17:52:16,838 - experiment_functions - INFO - Early stopping at epoch 500. Best Metrics: (0.0004185678216978582, 8.540424676803538e-05, 0.00021233437753871194)
2026-06-04 17:52:17,696 - optuna.study.study - INFO - Trial 65 finished with values: [0.0004185678216978582, 8.540424676803538e-05, 0.00021233437753871194] and parameters: {'n_layers': 4, 'embedding_dim': 32, 'lr': 0.009905759851486255, 'lambda_val': 0.0023559516185051557, 'batch_size': 514, 'optimizer': 'SGD'}.
2026-06-04 17:52:41,350 - experiment_functions - INFO - Early stopping at epoch 550. Best Metrics: (0.004834157245361238, 0.0008624154330497691, 0.002743311138867143)
2026-06-04 17:52:41,454 - optuna.study.study - INFO - Trial 66 finished with values: [0.004834157245361238, 0.0008624154330497691, 0.002743311138867143] and parameters: {'n_layers': 4, 'embedding_dim': 64, 'lr': 0.02827896378992597, 'lambda_val': 0.0007827624692138454, 'batch_size': 791, 'optimizer': 'Adam'}.
2026-06-04 17:53:15,042 - experiment_functions - INFO - Early stopping at epoch 750. Best Metrics: (0.0072046342242587606, 0.0013078571907026593, 0.004080749417035357)
2026-06-04 17:53:15,242 - optuna.study.study - INFO - Trial 67 finished with values: [0.0072046342242587606, 0.0013078571907026593, 0.004080749417035357] and parameters: {'n_layers': 3, 'embedding_dim': 128, 'lr': 0.005575824047051625, 'lambda_val': 0.00016262429302101681, 'batch_size': 516, 'optimizer': 'Adam'}.
2026-06-04 17:53:45,157 - experiment_functions - INFO - Early stopping at epoch 550. Best Metrics: (0.005975214669351654, 0.0010181525889208923, 0.003324628923695248)
2026-06-04 17:53:45,236 - optuna.study.study - INFO - Trial 68 finished with values: [0.005975214669351654, 0.0010181525889208923, 0.003324628923695248] and parameters: {'n_layers': 4, 'embedding_dim': 256, 'lr': 0.014232768730502419, 'lambda_val': 4.633766555970088e-05, 'batch_size': 2180, 'optimizer': 'RMSprop'}.
2026-06-04 17:54:09,997 - experiment_functions - INFO - Early stopping at epoch 500. Best Metrics: (0.00040045976151287466, 5.023779221649141e-05, 0.00016102717918468234)
2026-06-04 17:54:10,571 - optuna.study.study - INFO - Trial 69 finished with values: [0.00040045976151287466, 5.023779221649141e-05, 0.00016102717918468234] and parameters: {'n_layers': 3, 'embedding_dim': 256, 'lr': 0.0010341842506299342, 'lambda_val': 0.0015000126802708358, 'batch_size': 550, 'optimizer': 'SGD'}.
2026-06-04 17:54:30,058 - experiment_functions - INFO - Early stopping at epoch 500. Best Metrics: (0.00047161521735644696, 8.707883984191842e-05, 0.000241805522758472)
2026-06-04 17:54:30,642 - optuna.study.study - INFO - Trial 70 finished with values: [0.00047161521735644696, 8.707883984191842e-05, 0.000241805522758472] and parameters: {'n_layers': 1, 'embedding_dim': 32, 'lr': 4.6913597055320246e-05, 'lambda_val': 2.7698801623790517e-06, 'batch_size': 3604, 'optimizer': 'SGD'}.
2026-06-04 17:54:54,092 - experiment_functions - INFO - Early stopping at epoch 500. Best Metrics: (0.0006028309464809552, 7.368209525085404e-05, 0.0002508288975998308)
2026-06-04 17:54:55,094 - optuna.study.study - INFO - Trial 71 finished with values: [0.0006028309464809552, 7.368209525085404e-05, 0.0002508288975998308] and parameters: {'n_layers': 2, 'embedding_dim': 256, 'lr': 0.004398575629441856, 'lambda_val': 0.0015000126802708358, 'batch_size': 1731, 'optimizer': 'SGD'}.
2026-06-04 17:55:19,233 - experiment_functions - INFO - Early stopping at epoch 600. Best Metrics: (0.0036768343755802257, 0.0005509411213075223, 0.0020799235127096495)
2026-06-04 17:55:20,129 - optuna.study.study - INFO - Trial 72 finished with values: [0.0036768343755802257, 0.0005509411213075223, 0.0020799235127096495] and parameters: {'n_layers': 1, 'embedding_dim': 96, 'lr': 0.045292257364849445, 'lambda_val': 5.520510971299447e-06, 'batch_size': 1731, 'optimizer': 'Adam'}.
2026-06-04 17:57:40,825 - experiment_functions - INFO - Early stopping at epoch 3450. Best Metrics: (0.006578991918897109, 0.001006430437403711, 0.0037755438050233654)
2026-06-04 17:57:41,442 - optuna.study.study - INFO - Trial 73 finished with values: [0.006578991918897109, 0.001006430437403711, 0.0037755438050233654] and parameters: {'n_layers': 1, 'embedding_dim': 256, 'lr': 0.0010341842506299342, 'lambda_val': 0.00016262429302101681, 'batch_size': 550, 'optimizer': 'RMSprop'}.
2026-06-04 17:59:34,300 - experiment_functions - INFO - Early stopping at epoch 2950. Best Metrics: (0.005313055173641132, 0.0008356219438676402, 0.0029653496139295946)
2026-06-04 17:59:34,402 - optuna.study.study - INFO - Trial 74 finished with values: [0.005313055173641132, 0.0008356219438676402, 0.0029653496139295946] and parameters: {'n_layers': 1, 'embedding_dim': 128, 'lr': 0.0011827350330377861, 'lambda_val': 4.619891936036428e-05, 'batch_size': 2717, 'optimizer': 'Adam'}.
2026-06-04 18:00:27,196 - experiment_functions - INFO - Early stopping at epoch 1400. Best Metrics: (0.004881700707465247, 0.0007803603724294998, 0.0026415358564671)
2026-06-04 18:00:27,281 - optuna.study.study - INFO - Trial 75 finished with values: [0.004881700707465247, 0.0007803603724294998, 0.0026415358564671] and parameters: {'n_layers': 1, 'embedding_dim': 64, 'lr': 0.0011827350330377861, 'lambda_val': 0.0010139778593023846, 'batch_size': 1575, 'optimizer': 'RMSprop'}.
2026-06-04 18:00:47,934 - experiment_functions - INFO - Early stopping at epoch 500. Best Metrics: (0.0006328789147579764, 9.712639828521669e-05, 0.0002850260275427333)
2026-06-04 18:00:49,047 - optuna.study.study - INFO - Trial 76 finished with values: [0.0006328789147579764, 9.712639828521669e-05, 0.0002850260275427333] and parameters: {'n_layers': 2, 'embedding_dim': 64, 'lr': 2.0799465955924264e-05, 'lambda_val': 0.0010489434457379013, 'batch_size': 3604, 'optimizer': 'SGD'}.
2026-06-04 18:01:50,580 - experiment_functions - INFO - Early stopping at epoch 1250. Best Metrics: (0.000624106866176059, 8.038046754638624e-05, 0.000261586223221222)
2026-06-04 18:01:50,844 - optuna.study.study - INFO - Trial 77 finished with values: [0.000624106866176059, 8.038046754638624e-05, 0.000261586223221222] and parameters: {'n_layers': 3, 'embedding_dim': 256, 'lr': 1.1841364370748706e-05, 'lambda_val': 0.009867291930335193, 'batch_size': 1550, 'optimizer': 'Adam'}.
2026-06-04 18:02:30,061 - experiment_functions - INFO - Early stopping at epoch 950. Best Metrics: (0.004075384848947824, 0.0007401701386563066, 0.002348661454790501)
2026-06-04 18:02:30,361 - optuna.study.study - INFO - Trial 78 finished with values: [0.004075384848947824, 0.0007401701386563066, 0.002348661454790501] and parameters: {'n_layers': 4, 'embedding_dim': 64, 'lr': 0.0011827350330377861, 'lambda_val': 0.08307957014044424, 'batch_size': 2158, 'optimizer': 'RMSprop'}.
2026-06-04 18:05:02,818 - experiment_functions - INFO - Early stopping at epoch 3850. Best Metrics: (0.0007508922148017384, 0.00013061825976287765, 0.0003633703992987982)
2026-06-04 18:05:02,901 - optuna.study.study - INFO - Trial 79 finished with values: [0.0007508922148017384, 0.00013061825976287765, 0.0003633703992987982] and parameters: {'n_layers': 3, 'embedding_dim': 96, 'lr': 9.809148192392527e-05, 'lambda_val': 0.013449171672366679, 'batch_size': 3768, 'optimizer': 'RMSprop'}.
2026-06-04 18:05:23,206 - experiment_functions - INFO - Early stopping at epoch 500. Best Metrics: (0.0003683993877569876, 5.526157143814053e-05, 0.00015481133428482102)
2026-06-04 18:05:23,370 - optuna.study.study - INFO - Trial 80 finished with values: [0.0003683993877569876, 5.526157143814053e-05, 0.00015481133428482102] and parameters: {'n_layers': 3, 'embedding_dim': 32, 'lr': 0.045292257364849445, 'lambda_val': 5.520510971299447e-06, 'batch_size': 3889, 'optimizer': 'SGD'}.
2026-06-04 18:05:49,216 - experiment_functions - INFO - Early stopping at epoch 600. Best Metrics: (0.0046245827898823335, 0.0008272489784982249, 0.002582065492116835)
2026-06-04 18:05:49,428 - optuna.study.study - INFO - Trial 81 finished with values: [0.0046245827898823335, 0.0008272489784982249, 0.002582065492116835] and parameters: {'n_layers': 4, 'embedding_dim': 64, 'lr': 0.014970226258122101, 'lambda_val': 4.196870314530011e-06, 'batch_size': 3943, 'optimizer': 'RMSprop'}.
2026-06-04 18:06:15,143 - experiment_functions - INFO - Early stopping at epoch 550. Best Metrics: (0.004752020665369798, 0.0008975818876013129, 0.002760548704261501)
2026-06-04 18:06:15,359 - optuna.study.study - INFO - Trial 82 finished with values: [0.004752020665369798, 0.0008975818876013129, 0.002760548704261501] and parameters: {'n_layers': 4, 'embedding_dim': 128, 'lr': 0.003777254071001523, 'lambda_val': 0.014288330649818581, 'batch_size': 2555, 'optimizer': 'RMSprop'}.
2026-06-04 18:06:37,576 - experiment_functions - INFO - Early stopping at epoch 550. Best Metrics: (0.0005339444248522607, 7.53566883247371e-05, 0.0002315094024138355)
2026-06-04 18:06:38,231 - optuna.study.study - INFO - Trial 83 finished with values: [0.0005339444248522607, 7.53566883247371e-05, 0.0002315094024138355] and parameters: {'n_layers': 1, 'embedding_dim': 32, 'lr': 0.07467555285381862, 'lambda_val': 0.003566951312101301, 'batch_size': 3322, 'optimizer': 'SGD'}.
2026-06-04 18:07:33,312 - experiment_functions - INFO - Early stopping at epoch 1200. Best Metrics: (0.006325981070816301, 0.0012525956192645186, 0.0037160574588105738)
2026-06-04 18:07:33,409 - optuna.study.study - INFO - Trial 84 finished with values: [0.006325981070816301, 0.0012525956192645186, 0.0037160574588105738] and parameters: {'n_layers': 4, 'embedding_dim': 128, 'lr': 0.0007688676008588178, 'lambda_val': 0.014288330649818581, 'batch_size': 775, 'optimizer': 'RMSprop'}.
2026-06-04 18:08:42,447 - experiment_functions - INFO - Early stopping at epoch 1800. Best Metrics: (0.0041939463735318145, 0.0007870587447250318, 0.0022745295931780245)
2026-06-04 18:08:42,536 - optuna.study.study - INFO - Trial 85 finished with values: [0.0041939463735318145, 0.0007870587447250318, 0.0022745295931780245] and parameters: {'n_layers': 2, 'embedding_dim': 64, 'lr': 0.008850408365388045, 'lambda_val': 0.005255002744531624, 'batch_size': 4089, 'optimizer': 'RMSprop'}.
2026-06-04 18:12:04,345 - optuna.study.study - INFO - Trial 86 finished with values: [0.005370431869769894, 0.0008473440953848217, 0.003168185767994521] and parameters: {'n_layers': 4, 'embedding_dim': 256, 'lr': 0.0001615571289794213, 'lambda_val': 2.344534953461632e-06, 'batch_size': 2129, 'optimizer': 'RMSprop'}.
2026-06-04 18:12:31,049 - experiment_functions - INFO - Early stopping at epoch 550. Best Metrics: (0.004353453362900003, 0.00075859066246902, 0.002472976936816885)
2026-06-04 18:12:31,459 - optuna.study.study - INFO - Trial 87 finished with values: [0.004353453362900003, 0.00075859066246902, 0.002472976936816885] and parameters: {'n_layers': 2, 'embedding_dim': 256, 'lr': 0.015015785154943912, 'lambda_val': 0.000855371813884613, 'batch_size': 1265, 'optimizer': 'Adam'}.
2026-06-04 18:13:00,064 - experiment_functions - INFO - Early stopping at epoch 550. Best Metrics: (0.005565329137691807, 0.0009076294460446113, 0.0031874185340658116)
2026-06-04 18:13:00,159 - optuna.study.study - INFO - Trial 88 finished with values: [0.005565329137691807, 0.0009076294460446113, 0.0031874185340658116] and parameters: {'n_layers': 3, 'embedding_dim': 256, 'lr': 0.06428015028659323, 'lambda_val': 3.8631777865125085e-06, 'batch_size': 2129, 'optimizer': 'Adam'}.
2026-06-04 18:13:20,479 - experiment_functions - INFO - Early stopping at epoch 500. Best Metrics: (0.00042885826431301896, 7.53566883247371e-05, 0.00020820161804517733)
2026-06-04 18:13:21,500 - optuna.study.study - INFO - Trial 89 finished with values: [0.00042885826431301896, 7.53566883247371e-05, 0.00020820161804517733] and parameters: {'n_layers': 2, 'embedding_dim': 32, 'lr': 0.010564178384140486, 'lambda_val': 4.3905763392192376e-05, 'batch_size': 1093, 'optimizer': 'SGD'}.
2026-06-04 18:14:34,812 - experiment_functions - INFO - Early stopping at epoch 1900. Best Metrics: (0.004900371003286953, 0.0007719874070600844, 0.0028385934955199223)
2026-06-04 18:14:35,052 - optuna.study.study - INFO - Trial 90 finished with values: [0.004900371003286953, 0.0007719874070600844, 0.0028385934955199223] and parameters: {'n_layers': 1, 'embedding_dim': 96, 'lr': 0.003020999848042007, 'lambda_val': 5.520510971299447e-06, 'batch_size': 3889, 'optimizer': 'Adam'}.
2026-06-04 18:17:45,093 - optuna.study.study - INFO - Trial 91 finished with values: [0.009725695068790213, 0.0017583227275771987, 0.005785333081501201] and parameters: {'n_layers': 3, 'embedding_dim': 256, 'lr': 0.00040769039157989535, 'lambda_val': 3.8631777865125085e-06, 'batch_size': 2129, 'optimizer': 'RMSprop'}.
2026-06-04 18:18:09,910 - experiment_functions - INFO - Early stopping at epoch 550. Best Metrics: (0.0069474100940596405, 0.0012743653292249986, 0.003819453540081887)
2026-06-04 18:18:10,011 - optuna.study.study - INFO - Trial 92 finished with values: [0.0069474100940596405, 0.0012743653292249986, 0.003819453540081887] and parameters: {'n_layers': 4, 'embedding_dim': 96, 'lr': 0.003777254071001523, 'lambda_val': 0.0011239079008896861, 'batch_size': 2067, 'optimizer': 'RMSprop'}.
2026-06-04 18:18:46,221 - experiment_functions - INFO - Early stopping at epoch 900. Best Metrics: (0.003978603796687516, 0.000683233974144283, 0.0023672457415535877)
2026-06-04 18:18:46,632 - optuna.study.study - INFO - Trial 93 finished with values: [0.003978603796687516, 0.000683233974144283, 0.0023672457415535877] and parameters: {'n_layers': 1, 'embedding_dim': 128, 'lr': 0.003020999848042007, 'lambda_val': 0.0015000126802708358, 'batch_size': 1575, 'optimizer': 'RMSprop'}.
2026-06-04 18:21:32,861 - experiment_functions - INFO - Early stopping at epoch 3750. Best Metrics: (0.0005024999910571924, 6.865831602920491e-05, 0.00021656341432770902)
2026-06-04 18:21:33,194 - optuna.study.study - INFO - Trial 94 finished with values: [0.0005024999910571924, 6.865831602920491e-05, 0.00021656341432770902] and parameters: {'n_layers': 2, 'embedding_dim': 256, 'lr': 1.0551724282324685e-05, 'lambda_val': 0.00022287299207874025, 'batch_size': 3848, 'optimizer': 'RMSprop'}.
2026-06-04 18:22:28,329 - experiment_functions - INFO - Early stopping at epoch 1400. Best Metrics: (0.0004981343069934606, 7.703128139862013e-05, 0.0002495876602863401)
2026-06-04 18:22:28,612 - optuna.study.study - INFO - Trial 95 finished with values: [0.0004981343069934606, 7.703128139862013e-05, 0.0002495876602863401] and parameters: {'n_layers': 1, 'embedding_dim': 128, 'lr': 1.0240310270784878e-05, 'lambda_val': 0.004078312210980698, 'batch_size': 1002, 'optimizer': 'Adam'}.
2026-06-04 18:22:51,129 - experiment_functions - INFO - Early stopping at epoch 550. Best Metrics: (0.0006044770633743448, 8.540424676803537e-05, 0.00023755538870103796)
2026-06-04 18:22:51,628 - optuna.study.study - INFO - Trial 96 finished with values: [0.0006044770633743448, 8.540424676803537e-05, 0.00023755538870103796] and parameters: {'n_layers': 4, 'embedding_dim': 32, 'lr': 1.1841364370748706e-05, 'lambda_val': 4.196870314530011e-06, 'batch_size': 3943, 'optimizer': 'RMSprop'}.
2026-06-04 18:23:15,233 - experiment_functions - INFO - Early stopping at epoch 550. Best Metrics: (0.00414900786167967, 0.0007669636278384354, 0.0023829116420616974)
2026-06-04 18:23:15,358 - optuna.study.study - INFO - Trial 97 finished with values: [0.00414900786167967, 0.0007669636278384354, 0.0023829116420616974] and parameters: {'n_layers': 4, 'embedding_dim': 64, 'lr': 0.014970226258122101, 'lambda_val': 0.00019205234619986943, 'batch_size': 3943, 'optimizer': 'RMSprop'}.
2026-06-04 18:24:28,778 - experiment_functions - INFO - Early stopping at epoch 1850. Best Metrics: (0.005695592257919378, 0.0009813115412954652, 0.0032420677600337663)
2026-06-04 18:24:29,826 - optuna.study.study - INFO - Trial 98 finished with values: [0.005695592257919378, 0.0009813115412954652, 0.0032420677600337663] and parameters: {'n_layers': 2, 'embedding_dim': 96, 'lr': 0.007372062066661765, 'lambda_val': 1.0846976808752377e-06, 'batch_size': 1265, 'optimizer': 'Adam'}.
2026-06-04 18:26:44,502 - experiment_functions - INFO - Early stopping at epoch 3350. Best Metrics: (0.00646963973653763, 0.0010935092772456293, 0.003880759563080183)
2026-06-04 18:26:44,588 - optuna.study.study - INFO - Trial 99 finished with values: [0.00646963973653763, 0.0010935092772456293, 0.003880759563080183] and parameters: {'n_layers': 2, 'embedding_dim': 128, 'lr': 0.00040769039157989535, 'lambda_val': 0.0015000126802708358, 'batch_size': 2679, 'optimizer': 'RMSprop'}.
2026-06-04 18:27:14,765 - experiment_functions - INFO - Early stopping at epoch 550. Best Metrics: (0.004612056395915282, 0.0008624154330497691, 0.002583266665169988)
2026-06-04 18:27:15,154 - optuna.study.study - INFO - Trial 100 finished with values: [0.004612056395915282, 0.0008624154330497691, 0.002583266665169988] and parameters: {'n_layers': 4, 'embedding_dim': 256, 'lr': 0.003777254071001523, 'lambda_val': 0.014288330649818581, 'batch_size': 2555, 'optimizer': 'RMSprop'}.
2026-06-04 18:27:35,612 - experiment_functions - INFO - Early stopping at epoch 500. Best Metrics: (0.000555117440728943, 7.703128139862015e-05, 0.00023659788469831044)
2026-06-04 18:27:36,216 - optuna.study.study - INFO - Trial 101 finished with values: [0.000555117440728943, 7.703128139862015e-05, 0.00023659788469831044] and parameters: {'n_layers': 2, 'embedding_dim': 32, 'lr': 3.3127154323791786e-05, 'lambda_val': 0.00016806129938668377, 'batch_size': 2679, 'optimizer': 'RMSprop'}.
