2026-06-04 23:16:22,170 - optuna.study.study - INFO - Trial 40 finished with values: [0.012027011924564832, 0.0018169334851631054, 0.005730794131203868] and parameters: {'n_layers': 3, 'embedding_dim': 32, 'lr': 0.05542390076825767, 'lambda_val': 0.006159294564164397, 'batch_size': 1359, 'optimizer': 'Adam'}.
2026-06-04 23:16:44,759 - experiment_functions - INFO - Early stopping at epoch 500. Best Metrics: (0.00988547015027562, 0.00130283341148101, 0.005726010047740106)
2026-06-04 23:16:44,860 - optuna.study.study - INFO - Trial 41 finished with values: [0.00988547015027562, 0.00130283341148101, 0.005726010047740106] and parameters: {'n_layers': 3, 'embedding_dim': 64, 'lr': 0.05624303092199558, 'lambda_val': 0.021581423034180355, 'batch_size': 1900, 'optimizer': 'RMSprop'}.
2026-06-04 23:17:08,600 - experiment_functions - INFO - Early stopping at epoch 500. Best Metrics: (0.00045768743094417956, 4.8563199142608344e-05, 0.00021052046927051574)
2026-06-04 23:17:08,726 - optuna.study.study - INFO - Trial 42 finished with values: [0.00045768743094417956, 4.8563199142608344e-05, 0.00021052046927051574] and parameters: {'n_layers': 3, 'embedding_dim': 96, 'lr': 0.06799344626233127, 'lambda_val': 0.00012438721582721903, 'batch_size': 3875, 'optimizer': 'SGD'}.
2026-06-04 23:17:33,417 - experiment_functions - INFO - Early stopping at epoch 500. Best Metrics: (0.0005362728565028427, 7.368209525085404e-05, 0.00028615812143582955)
2026-06-04 23:17:33,608 - optuna.study.study - INFO - Trial 43 finished with values: [0.0005362728565028427, 7.368209525085404e-05, 0.00028615812143582955] and parameters: {'n_layers': 3, 'embedding_dim': 128, 'lr': 5.012153257127629e-05, 'lambda_val': 0.04537589278543795, 'batch_size': 3841, 'optimizer': 'SGD'}.
2026-06-04 23:17:57,929 - experiment_functions - INFO - Early stopping at epoch 550. Best Metrics: (0.012328951074835826, 0.00190736151115279, 0.006364656799587807)
2026-06-04 23:17:59,002 - optuna.study.study - INFO - Trial 44 finished with values: [0.012328951074835826, 0.00190736151115279, 0.006364656799587807] and parameters: {'n_layers': 1, 'embedding_dim': 128, 'lr': 0.056163111460559745, 'lambda_val': 0.00016718622086060638, 'batch_size': 1769, 'optimizer': 'Adam'}.
2026-06-04 23:20:42,622 - optuna.study.study - INFO - Trial 45 finished with values: [0.0007307575105704513, 0.00011889610824569631, 0.0003741566946004031] and parameters: {'n_layers': 2, 'embedding_dim': 96, 'lr': 5.246127133150549e-05, 'lambda_val': 0.0010794950918079859, 'batch_size': 2768, 'optimizer': 'RMSprop'}.
2026-06-04 23:21:25,006 - experiment_functions - INFO - Early stopping at epoch 1000. Best Metrics: (0.0005264691307882431, 7.703128139862015e-05, 0.0002313275286337325)
2026-06-04 23:21:25,165 - optuna.study.study - INFO - Trial 46 finished with values: [0.0005264691307882431, 7.703128139862015e-05, 0.0002313275286337325] and parameters: {'n_layers': 3, 'embedding_dim': 64, 'lr': 1.689932095737287e-05, 'lambda_val': 0.017891899823066475, 'batch_size': 3970, 'optimizer': 'Adam'}.
2026-06-04 23:21:48,924 - experiment_functions - INFO - Early stopping at epoch 500. Best Metrics: (0.00044824470896353565, 6.028535065978968e-05, 0.0002286404373922057)
2026-06-04 23:21:49,016 - optuna.study.study - INFO - Trial 47 finished with values: [0.00044824470896353565, 6.028535065978968e-05, 0.0002286404373922057] and parameters: {'n_layers': 3, 'embedding_dim': 96, 'lr': 0.00725616368370097, 'lambda_val': 1.5756903061669223e-05, 'batch_size': 3410, 'optimizer': 'SGD'}.
2026-06-04 23:22:15,594 - experiment_functions - INFO - Early stopping at epoch 500. Best Metrics: (0.00047258206363753386, 8.038046754638624e-05, 0.00019730175828834944)
2026-06-04 23:22:16,130 - optuna.study.study - INFO - Trial 48 finished with values: [0.00047258206363753386, 8.038046754638624e-05, 0.00019730175828834944] and parameters: {'n_layers': 2, 'embedding_dim': 256, 'lr': 0.002772309380932508, 'lambda_val': 0.03417070264288617, 'batch_size': 1862, 'optimizer': 'SGD'}.
2026-06-04 23:22:36,910 - experiment_functions - INFO - Early stopping at epoch 500. Best Metrics: (0.0005283091020274073, 7.703128139862015e-05, 0.00023012079747876426)
2026-06-04 23:22:38,307 - optuna.study.study - INFO - Trial 49 finished with values: [0.0005283091020274073, 7.703128139862015e-05, 0.00023012079747876426] and parameters: {'n_layers': 1, 'embedding_dim': 64, 'lr': 0.000936097337950737, 'lambda_val': 0.00012036169610033453, 'batch_size': 1024, 'optimizer': 'SGD'}.
2026-06-04 23:23:02,884 - experiment_functions - INFO - Early stopping at epoch 550. Best Metrics: (0.0004871795734587553, 6.865831602920491e-05, 0.00019592835439318518)
2026-06-04 23:23:02,982 - optuna.study.study - INFO - Trial 50 finished with values: [0.0004871795734587553, 6.865831602920491e-05, 0.00019592835439318518] and parameters: {'n_layers': 3, 'embedding_dim': 64, 'lr': 2.0432132925624714e-05, 'lambda_val': 0.09101736137364394, 'batch_size': 3084, 'optimizer': 'RMSprop'}.
2026-06-04 23:23:25,972 - experiment_functions - INFO - Early stopping at epoch 550. Best Metrics: (0.00690073676653487, 0.0009930336928126464, 0.0037107684289891954)
2026-06-04 23:23:26,071 - optuna.study.study - INFO - Trial 51 finished with values: [0.00690073676653487, 0.0009930336928126464, 0.0037107684289891954] and parameters: {'n_layers': 2, 'embedding_dim': 32, 'lr': 0.047644548305084466, 'lambda_val': 0.000337357517769222, 'batch_size': 1274, 'optimizer': 'RMSprop'}.
2026-06-04 23:23:47,979 - experiment_functions - INFO - Early stopping at epoch 500. Best Metrics: (0.0007014838252488128, 9.37772121374506e-05, 0.0002925034772401292)
2026-06-04 23:23:48,451 - optuna.study.study - INFO - Trial 52 finished with values: [0.0007014838252488128, 9.37772121374506e-05, 0.0002925034772401292] and parameters: {'n_layers': 1, 'embedding_dim': 128, 'lr': 0.015002074473241443, 'lambda_val': 0.00020575997068060907, 'batch_size': 755, 'optimizer': 'SGD'}.
2026-06-04 23:24:12,131 - experiment_functions - INFO - Early stopping at epoch 500. Best Metrics: (0.0006067763923116657, 7.368209525085404e-05, 0.00024301732076727325)
2026-06-04 23:24:12,219 - optuna.study.study - INFO - Trial 53 finished with values: [0.0006067763923116657, 7.368209525085404e-05, 0.00024301732076727325] and parameters: {'n_layers': 3, 'embedding_dim': 96, 'lr': 0.0001413258020320246, 'lambda_val': 0.006159294564164397, 'batch_size': 3009, 'optimizer': 'SGD'}.
2026-06-04 23:25:52,305 - experiment_functions - INFO - Early stopping at epoch 2550. Best Metrics: (0.016622959476294406, 0.0022707482081854107, 0.008578220697521732)
2026-06-04 23:25:52,407 - optuna.study.study - INFO - Trial 54 finished with values: [0.016622959476294406, 0.0022707482081854107, 0.008578220697521732] and parameters: {'n_layers': 3, 'embedding_dim': 32, 'lr': 0.0003278860610242573, 'lambda_val': 0.021581423034180355, 'batch_size': 3888, 'optimizer': 'RMSprop'}.
2026-06-04 23:28:41,538 - optuna.study.study - INFO - Trial 55 finished with values: [0.007095389284442881, 0.0011990086409002611, 0.00342910722261635] and parameters: {'n_layers': 4, 'embedding_dim': 64, 'lr': 0.00011825532801285016, 'lambda_val': 0.017891899823066475, 'batch_size': 3577, 'optimizer': 'RMSprop'}.
2026-06-04 23:30:14,899 - experiment_functions - INFO - Early stopping at epoch 2350. Best Metrics: (0.04904318388822626, 0.006412016879898185, 0.025630678477382887)
2026-06-04 23:30:14,991 - optuna.study.study - INFO - Trial 56 finished with values: [0.04904318388822626, 0.006412016879898185, 0.025630678477382887] and parameters: {'n_layers': 2, 'embedding_dim': 32, 'lr': 0.0007432804052483335, 'lambda_val': 0.0003734366700851135, 'batch_size': 2602, 'optimizer': 'Adam'}.
2026-06-04 23:30:42,225 - experiment_functions - INFO - Early stopping at epoch 600. Best Metrics: (0.0005455814199863017, 7.200750217697099e-05, 0.00024859394849380875)
2026-06-04 23:30:42,425 - optuna.study.study - INFO - Trial 57 finished with values: [0.0005455814199863017, 7.200750217697099e-05, 0.00024859394849380875] and parameters: {'n_layers': 4, 'embedding_dim': 64, 'lr': 1.2726368031693164e-05, 'lambda_val': 0.00022637584318870192, 'batch_size': 516, 'optimizer': 'Adam'}.
2026-06-04 23:31:18,528 - experiment_functions - INFO - Early stopping at epoch 550. Best Metrics: (0.02266329623224889, 0.0029238395069997995, 0.010716432942889232)
2026-06-04 23:31:18,638 - optuna.study.study - INFO - Trial 58 finished with values: [0.02266329623224889, 0.0029238395069997995, 0.010716432942889232] and parameters: {'n_layers': 4, 'embedding_dim': 256, 'lr': 0.028448639682008454, 'lambda_val': 5.853976848871819e-05, 'batch_size': 2586, 'optimizer': 'Adam'}.
2026-06-04 23:31:39,594 - experiment_functions - INFO - Early stopping at epoch 500. Best Metrics: (0.0006315639800988841, 8.707883984191843e-05, 0.0002725341980748617)
2026-06-04 23:31:39,682 - optuna.study.study - INFO - Trial 59 finished with values: [0.0006315639800988841, 8.707883984191843e-05, 0.0002725341980748617] and parameters: {'n_layers': 2, 'embedding_dim': 32, 'lr': 5.012153257127629e-05, 'lambda_val': 2.4352408459118126e-06, 'batch_size': 3841, 'optimizer': 'SGD'}.
2026-06-04 23:34:36,448 - optuna.study.study - INFO - Trial 60 finished with values: [0.04973115010830593, 0.006659856654832875, 0.025969641634618703] and parameters: {'n_layers': 3, 'embedding_dim': 96, 'lr': 0.0002487999076432075, 'lambda_val': 9.325564591196157e-05, 'batch_size': 1214, 'optimizer': 'RMSprop'}.
2026-06-04 23:37:26,636 - optuna.study.study - INFO - Trial 61 finished with values: [0.04927432592973068, 0.006174224663406792, 0.02329537428166278] and parameters: {'n_layers': 3, 'embedding_dim': 64, 'lr': 0.0007432804052483335, 'lambda_val': 2.264578702522949e-06, 'batch_size': 3566, 'optimizer': 'RMSprop'}.
2026-06-04 23:38:13,836 - experiment_functions - INFO - Early stopping at epoch 750. Best Metrics: (0.0005079488518561319, 7.703128139862013e-05, 0.00023440871395870089)
2026-06-04 23:38:13,999 - optuna.study.study - INFO - Trial 62 finished with values: [0.0005079488518561319, 7.703128139862013e-05, 0.00023440871395870089] and parameters: {'n_layers': 4, 'embedding_dim': 256, 'lr': 1.103680465901137e-05, 'lambda_val': 5.853976848871819e-05, 'batch_size': 2369, 'optimizer': 'RMSprop'}.
2026-06-04 23:38:38,668 - experiment_functions - INFO - Early stopping at epoch 550. Best Metrics: (0.012687983919677431, 0.0018018621474981578, 0.00657961917507668)
2026-06-04 23:38:38,807 - optuna.study.study - INFO - Trial 63 finished with values: [0.012687983919677431, 0.0018018621474981578, 0.00657961917507668] and parameters: {'n_layers': 2, 'embedding_dim': 96, 'lr': 0.06006268611544608, 'lambda_val': 3.3509343310867884e-06, 'batch_size': 1750, 'optimizer': 'RMSprop'}.
2026-06-04 23:42:24,023 - optuna.study.study - INFO - Trial 64 finished with values: [0.03682214359530744, 0.005035501373166319, 0.019835909258865848] and parameters: {'n_layers': 3, 'embedding_dim': 256, 'lr': 0.00011825532801285016, 'lambda_val': 8.600399380889837e-06, 'batch_size': 3114, 'optimizer': 'Adam'}.
2026-06-04 23:45:21,640 - optuna.study.study - INFO - Trial 65 finished with values: [0.058534905060927706, 0.007741643780561325, 0.02942470832608966] and parameters: {'n_layers': 2, 'embedding_dim': 128, 'lr': 0.0007432804052483335, 'lambda_val': 4.933989724174048e-06, 'batch_size': 1064, 'optimizer': 'Adam'}.
2026-06-04 23:45:49,065 - experiment_functions - INFO - Early stopping at epoch 550. Best Metrics: (0.015822581741416892, 0.0019575993033692815, 0.007158020351038503)
2026-06-04 23:45:49,185 - optuna.study.study - INFO - Trial 66 finished with values: [0.015822581741416892, 0.0019575993033692815, 0.007158020351038503] and parameters: {'n_layers': 4, 'embedding_dim': 96, 'lr': 0.010850387474674802, 'lambda_val': 0.002216169184844733, 'batch_size': 2396, 'optimizer': 'Adam'}.
2026-06-04 23:46:15,469 - experiment_functions - INFO - Early stopping at epoch 500. Best Metrics: (0.000472455845013795, 7.535668832473711e-05, 0.00018386474406425612)
2026-06-04 23:46:16,090 - optuna.study.study - INFO - Trial 67 finished with values: [0.000472455845013795, 7.535668832473711e-05, 0.00018386474406425612] and parameters: {'n_layers': 2, 'embedding_dim': 256, 'lr': 0.0005892323895160657, 'lambda_val': 0.005581434643600451, 'batch_size': 1420, 'optimizer': 'SGD'}.
2026-06-04 23:46:47,924 - experiment_functions - INFO - Early stopping at epoch 500. Best Metrics: (0.0005356315669610109, 7.703128139862015e-05, 0.00024950930456937756)
2026-06-04 23:46:48,013 - optuna.study.study - INFO - Trial 68 finished with values: [0.0005356315669610109, 7.703128139862015e-05, 0.00024950930456937756] and parameters: {'n_layers': 4, 'embedding_dim': 256, 'lr': 6.904316320098816e-05, 'lambda_val': 4.990726802534784e-06, 'batch_size': 3979, 'optimizer': 'SGD'}.
2026-06-04 23:47:11,721 - experiment_functions - INFO - Early stopping at epoch 550. Best Metrics: (0.011375354591174247, 0.001649474177774801, 0.005499018379057212)
2026-06-04 23:47:12,694 - optuna.study.study - INFO - Trial 69 finished with values: [0.011375354591174247, 0.001649474177774801, 0.005499018379057212] and parameters: {'n_layers': 4, 'embedding_dim': 32, 'lr': 0.08333698415859936, 'lambda_val': 0.0003734366700851135, 'batch_size': 3888, 'optimizer': 'Adam'}.
2026-06-04 23:47:33,650 - experiment_functions - INFO - Early stopping at epoch 500. Best Metrics: (0.000801778704852981, 9.71263982852167e-05, 0.0003145014441610115)
2026-06-04 23:47:34,274 - optuna.study.study - INFO - Trial 70 finished with values: [0.000801778704852981, 9.71263982852167e-05, 0.0003145014441610115] and parameters: {'n_layers': 3, 'embedding_dim': 32, 'lr': 0.010979429387298605, 'lambda_val': 4.990726802534784e-06, 'batch_size': 1609, 'optimizer': 'SGD'}.
2026-06-04 23:50:12,442 - optuna.study.study - INFO - Trial 71 finished with values: [0.03949263551421536, 0.0050137316632058405, 0.02000832755993912] and parameters: {'n_layers': 3, 'embedding_dim': 32, 'lr': 0.0003278860610242573, 'lambda_val': 5.549577204880508e-06, 'batch_size': 2859, 'optimizer': 'RMSprop'}.
2026-06-04 23:51:00,865 - experiment_functions - INFO - Early stopping at epoch 1150. Best Metrics: (0.0006089924234905591, 8.372965369415233e-05, 0.0002544980855428807)
2026-06-04 23:51:00,962 - optuna.study.study - INFO - Trial 72 finished with values: [0.0006089924234905591, 8.372965369415233e-05, 0.0002544980855428807] and parameters: {'n_layers': 3, 'embedding_dim': 64, 'lr': 3.497115937875924e-05, 'lambda_val': 5.549577204880508e-06, 'batch_size': 2242, 'optimizer': 'Adam'}.
2026-06-04 23:51:25,543 - experiment_functions - INFO - Early stopping at epoch 500. Best Metrics: (0.0003763994227378682, 6.530912988143882e-05, 0.00017326346789388683)
2026-06-04 23:51:25,919 - optuna.study.study - INFO - Trial 73 finished with values: [0.0003763994227378682, 6.530912988143882e-05, 0.00017326346789388683] and parameters: {'n_layers': 4, 'embedding_dim': 96, 'lr': 0.08294142044076476, 'lambda_val': 7.362176208168903e-06, 'batch_size': 3890, 'optimizer': 'SGD'}.
2026-06-04 23:51:49,559 - experiment_functions - INFO - Early stopping at epoch 500. Best Metrics: (0.01356419699633971, 0.0017767432513899125, 0.007374149237645785)
2026-06-04 23:51:50,180 - optuna.study.study - INFO - Trial 74 finished with values: [0.01356419699633971, 0.0017767432513899125, 0.007374149237645785] and parameters: {'n_layers': 3, 'embedding_dim': 96, 'lr': 0.05624303092199558, 'lambda_val': 5.3533307747296766e-05, 'batch_size': 1900, 'optimizer': 'RMSprop'}.
2026-06-04 23:52:45,348 - experiment_functions - INFO - Early stopping at epoch 1400. Best Metrics: (0.05185517680624738, 0.007177305914662736, 0.02799412481272498)
2026-06-04 23:52:45,460 - optuna.study.study - INFO - Trial 75 finished with values: [0.05185517680624738, 0.007177305914662736, 0.02799412481272498] and parameters: {'n_layers': 1, 'embedding_dim': 32, 'lr': 0.00105994739638826, 'lambda_val': 0.0024741700262700477, 'batch_size': 2586, 'optimizer': 'Adam'}.
2026-06-04 23:54:35,284 - experiment_functions - INFO - Early stopping at epoch 2800. Best Metrics: (0.012520560720477683, 0.002232232567486101, 0.006321183486392491)
2026-06-04 23:54:36,041 - optuna.study.study - INFO - Trial 76 finished with values: [0.012520560720477683, 0.002232232567486101, 0.006321183486392491] and parameters: {'n_layers': 1, 'embedding_dim': 96, 'lr': 0.05624303092199558, 'lambda_val': 0.021581423034180355, 'batch_size': 2331, 'optimizer': 'RMSprop'}.
2026-06-04 23:55:00,179 - experiment_functions - INFO - Early stopping at epoch 500. Best Metrics: (0.007786281249593609, 0.0009645656105566349, 0.004545789555533978)
2026-06-04 23:55:01,413 - optuna.study.study - INFO - Trial 77 finished with values: [0.007786281249593609, 0.0009645656105566349, 0.004545789555533978] and parameters: {'n_layers': 3, 'embedding_dim': 96, 'lr': 0.03964210211405844, 'lambda_val': 0.029045035745594923, 'batch_size': 3841, 'optimizer': 'RMSprop'}.
2026-06-04 23:58:22,653 - optuna.study.study - INFO - Trial 78 finished with values: [0.03447640987597585, 0.004799383749748812, 0.019340603630642498] and parameters: {'n_layers': 2, 'embedding_dim': 256, 'lr': 0.00011825532801285016, 'lambda_val': 8.600399380889837e-06, 'batch_size': 3577, 'optimizer': 'RMSprop'}.
2026-06-04 23:59:08,943 - experiment_functions - INFO - Early stopping at epoch 1000. Best Metrics: (0.0005173200536016307, 7.2007502176971e-05, 0.00019790702246333438)
2026-06-04 23:59:10,011 - optuna.study.study - INFO - Trial 79 finished with values: [0.0005173200536016307, 7.2007502176971e-05, 0.00019790702246333438] and parameters: {'n_layers': 1, 'embedding_dim': 256, 'lr': 4.07709645256888e-05, 'lambda_val': 0.000337357517769222, 'batch_size': 3825, 'optimizer': 'RMSprop'}.
2026-06-04 23:59:34,987 - experiment_functions - INFO - Early stopping at epoch 550. Best Metrics: (0.01257246973185247, 0.0017231562730256548, 0.006102770986718017)
2026-06-04 23:59:35,681 - optuna.study.study - INFO - Trial 80 finished with values: [0.01257246973185247, 0.0017231562730256548, 0.006102770986718017] and parameters: {'n_layers': 2, 'embedding_dim': 96, 'lr': 0.08547228312239685, 'lambda_val': 0.000337357517769222, 'batch_size': 2586, 'optimizer': 'Adam'}.
2026-06-05 00:00:11,558 - experiment_functions - INFO - Early stopping at epoch 600. Best Metrics: (0.02293138626874696, 0.0031147431174224664, 0.012055067263058276)
2026-06-05 00:00:11,905 - optuna.study.study - INFO - Trial 81 finished with values: [0.02293138626874696, 0.0031147431174224664, 0.012055067263058276] and parameters: {'n_layers': 3, 'embedding_dim': 256, 'lr': 0.015769334502487884, 'lambda_val': 2.388311754210309e-05, 'batch_size': 3566, 'optimizer': 'RMSprop'}.
2026-06-05 00:01:36,841 - experiment_functions - INFO - Early stopping at epoch 2150. Best Metrics: (0.010716701884304892, 0.0014903878357559112, 0.004915550247268482)
2026-06-05 00:01:37,569 - optuna.study.study - INFO - Trial 82 finished with values: [0.010716701884304892, 0.0014903878357559112, 0.004915550247268482] and parameters: {'n_layers': 3, 'embedding_dim': 32, 'lr': 0.05624303092199558, 'lambda_val': 0.021581423034180355, 'batch_size': 1900, 'optimizer': 'RMSprop'}.
2026-06-05 00:02:01,056 - experiment_functions - INFO - Early stopping at epoch 550. Best Metrics: (0.008560002404910406, 0.0013647933552146828, 0.004498201367229087)
2026-06-05 00:02:01,155 - optuna.study.study - INFO - Trial 83 finished with values: [0.008560002404910406, 0.0013647933552146828, 0.004498201367229087] and parameters: {'n_layers': 1, 'embedding_dim': 64, 'lr': 0.028448639682008454, 'lambda_val': 0.00012036169610033453, 'batch_size': 2159, 'optimizer': 'RMSprop'}.
2026-06-05 00:05:29,345 - optuna.study.study - INFO - Trial 84 finished with values: [0.06421208509157905, 0.008379663741710765, 0.034630727775525734] and parameters: {'n_layers': 2, 'embedding_dim': 256, 'lr': 0.0003278860610242573, 'lambda_val': 1.6669472887970978e-05, 'batch_size': 3447, 'optimizer': 'Adam'}.
2026-06-05 00:05:55,256 - experiment_functions - INFO - Early stopping at epoch 550. Best Metrics: (0.021011330346733515, 0.0030343626498760806, 0.011228777540787254)
2026-06-05 00:05:56,110 - optuna.study.study - INFO - Trial 85 finished with values: [0.021011330346733515, 0.0030343626498760806, 0.011228777540787254] and parameters: {'n_layers': 2, 'embedding_dim': 128, 'lr': 0.017336107761708283, 'lambda_val': 1.6669472887970978e-05, 'batch_size': 3447, 'optimizer': 'RMSprop'}.
2026-06-05 00:06:21,222 - experiment_functions - INFO - Early stopping at epoch 550. Best Metrics: (0.02218650889516821, 0.002572174961484359, 0.010728191342745746)
2026-06-05 00:06:21,775 - optuna.study.study - INFO - Trial 86 finished with values: [0.02218650889516821, 0.002572174961484359, 0.010728191342745746] and parameters: {'n_layers': 3, 'embedding_dim': 64, 'lr': 0.010979429387298605, 'lambda_val': 0.0010799812297527676, 'batch_size': 3979, 'optimizer': 'Adam'}.
2026-06-05 00:07:18,197 - experiment_functions - INFO - Early stopping at epoch 1300. Best Metrics: (0.04277508708780497, 0.0055244825507401694, 0.021088610739919515)
2026-06-05 00:07:18,298 - optuna.study.study - INFO - Trial 87 finished with values: [0.04277508708780497, 0.0055244825507401694, 0.021088610739919515] and parameters: {'n_layers': 3, 'embedding_dim': 64, 'lr': 0.0007432804052483335, 'lambda_val': 0.0005094277795441267, 'batch_size': 2859, 'optimizer': 'Adam'}.
2026-06-05 00:07:42,962 - experiment_functions - INFO - Early stopping at epoch 500. Best Metrics: (0.0005183067370086157, 7.703128139862015e-05, 0.00022065460785588092)
