2026-06-04 13:40:34,842 - optuna.study.study - INFO - Trial 123 finished with values: [0.006137570770931964, 0.0011504454417576528, 0.0035232172330338656] and parameters: {'n_layers': 3, 'embedding_dim': 256, 'lr': 0.0017568753093311267, 'lambda_val': 0.003001642531865632, 'batch_size': 1126, 'optimizer': 'Adam'}.
2026-06-04 13:42:20,944 - experiment_functions - INFO - Early stopping at epoch 2950. Best Metrics: (0.004412604724169382, 0.0008289235715721081, 0.0024600107683977815)
2026-06-04 13:42:21,299 - optuna.study.study - INFO - Trial 124 finished with values: [0.004412604724169382, 0.0008289235715721081, 0.0024600107683977815] and parameters: {'n_layers': 1, 'embedding_dim': 64, 'lr': 0.08896930678012212, 'lambda_val': 0.03410627252741982, 'batch_size': 1587, 'optimizer': 'RMSprop'}.
2026-06-04 13:42:44,843 - experiment_functions - INFO - Early stopping at epoch 550. Best Metrics: (0.004268368704969227, 0.0006631388572576864, 0.0025201012222404355)
2026-06-04 13:42:44,944 - optuna.study.study - INFO - Trial 125 finished with values: [0.004268368704969227, 0.0006631388572576864, 0.0025201012222404355] and parameters: {'n_layers': 2, 'embedding_dim': 128, 'lr': 0.05388465145759409, 'lambda_val': 0.00014455478461733426, 'batch_size': 2270, 'optimizer': 'Adam'}.
2026-06-04 13:43:35,132 - experiment_functions - INFO - Early stopping at epoch 1100. Best Metrics: (0.004833808973766889, 0.0009042802598968452, 0.0026871922560485328)
2026-06-04 13:43:35,447 - optuna.study.study - INFO - Trial 126 finished with values: [0.004833808973766889, 0.0009042802598968452, 0.0026871922560485328] and parameters: {'n_layers': 2, 'embedding_dim': 256, 'lr': 0.0010072848810039788, 'lambda_val': 0.06405803008831426, 'batch_size': 3888, 'optimizer': 'Adam'}.
2026-06-04 13:44:03,567 - experiment_functions - INFO - Early stopping at epoch 550. Best Metrics: (0.0041345897866977566, 0.0006916069395136983, 0.002253851230886613)
2026-06-04 13:44:03,649 - optuna.study.study - INFO - Trial 127 finished with values: [0.0041345897866977566, 0.0006916069395136983, 0.002253851230886613] and parameters: {'n_layers': 3, 'embedding_dim': 256, 'lr': 0.08500719886316734, 'lambda_val': 0.00014737712683213163, 'batch_size': 887, 'optimizer': 'Adam'}.
2026-06-04 13:44:41,360 - experiment_functions - INFO - Early stopping at epoch 850. Best Metrics: (0.00484030889968134, 0.0009193515975617926, 0.002802112716057939)
2026-06-04 13:44:41,443 - optuna.study.study - INFO - Trial 128 finished with values: [0.00484030889968134, 0.0009193515975617926, 0.002802112716057939] and parameters: {'n_layers': 4, 'embedding_dim': 128, 'lr': 0.0010072848810039788, 'lambda_val': 0.06405803008831426, 'batch_size': 3888, 'optimizer': 'Adam'}.
2026-06-04 13:45:14,340 - experiment_functions - INFO - Early stopping at epoch 850. Best Metrics: (0.004246530524708708, 0.0007435193248040726, 0.002494516779902171)
2026-06-04 13:45:14,434 - optuna.study.study - INFO - Trial 129 finished with values: [0.004246530524708708, 0.0007435193248040726, 0.002494516779902171] and parameters: {'n_layers': 4, 'embedding_dim': 32, 'lr': 0.0017568753093311267, 'lambda_val': 0.05198404914652649, 'batch_size': 2991, 'optimizer': 'Adam'}.
2026-06-04 13:47:39,863 - optuna.study.study - INFO - Trial 130 finished with values: [0.0014648166351034057, 0.00023276843726974348, 0.0007855907484730375] and parameters: {'n_layers': 4, 'embedding_dim': 32, 'lr': 0.00015727628946056606, 'lambda_val': 1.8898212223948182e-06, 'batch_size': 1368, 'optimizer': 'Adam'}.
2026-06-04 13:48:05,808 - experiment_functions - INFO - Early stopping at epoch 600. Best Metrics: (0.003776874246747232, 0.0006899323464398152, 0.0021283976560410034)
2026-06-04 13:48:05,909 - optuna.study.study - INFO - Trial 131 finished with values: [0.003776874246747232, 0.0006899323464398152, 0.0021283976560410034] and parameters: {'n_layers': 2, 'embedding_dim': 128, 'lr': 0.01590647013552204, 'lambda_val': 0.06405803008831426, 'batch_size': 3888, 'optimizer': 'Adam'}.
2026-06-04 13:48:38,399 - experiment_functions - INFO - Early stopping at epoch 850. Best Metrics: (0.004740667554156144, 0.0007250988009913592, 0.0026161053886850118)
2026-06-04 13:48:39,423 - optuna.study.study - INFO - Trial 132 finished with values: [0.004740667554156144, 0.0007250988009913592, 0.0026161053886850118] and parameters: {'n_layers': 1, 'embedding_dim': 32, 'lr': 0.0042231305931508915, 'lambda_val': 5.1016022094875355e-06, 'batch_size': 2154, 'optimizer': 'RMSprop'}.
2026-06-04 13:50:05,860 - experiment_functions - INFO - Early stopping at epoch 2250. Best Metrics: (0.004599414919283728, 0.0008557170607542369, 0.00252464374583071)
2026-06-04 13:50:06,616 - optuna.study.study - INFO - Trial 133 finished with values: [0.004599414919283728, 0.0008557170607542369, 0.00252464374583071] and parameters: {'n_layers': 1, 'embedding_dim': 128, 'lr': 0.002947410528904454, 'lambda_val': 0.05383219142167494, 'batch_size': 1826, 'optimizer': 'Adam'}.
2026-06-04 13:50:48,887 - experiment_functions - INFO - Early stopping at epoch 800. Best Metrics: (0.0044601714576851265, 0.0008557170607542369, 0.0025068116564610247)
2026-06-04 13:50:48,980 - optuna.study.study - INFO - Trial 134 finished with values: [0.0044601714576851265, 0.0008557170607542369, 0.0025068116564610247] and parameters: {'n_layers': 4, 'embedding_dim': 256, 'lr': 0.0009834023718369865, 'lambda_val': 0.06405803008831426, 'batch_size': 2516, 'optimizer': 'RMSprop'}.
2026-06-04 13:51:39,714 - experiment_functions - INFO - Early stopping at epoch 1350. Best Metrics: (0.0036951474653126957, 0.000646392926518856, 0.0020035309850872872)
2026-06-04 13:51:40,139 - optuna.study.study - INFO - Trial 135 finished with values: [0.0036951474653126957, 0.000646392926518856, 0.0020035309850872872] and parameters: {'n_layers': 2, 'embedding_dim': 32, 'lr': 0.005872976959507259, 'lambda_val': 0.0494345449176384, 'batch_size': 2991, 'optimizer': 'Adam'}.
2026-06-04 13:53:37,760 - experiment_functions - INFO - Early stopping at epoch 3200. Best Metrics: (0.004328979513354293, 0.0008121776408332776, 0.002415037330595419)
2026-06-04 13:53:38,072 - optuna.study.study - INFO - Trial 136 finished with values: [0.004328979513354293, 0.0008121776408332776, 0.002415037330595419] and parameters: {'n_layers': 1, 'embedding_dim': 64, 'lr': 0.08500719886316734, 'lambda_val': 0.0032296178945151414, 'batch_size': 2516, 'optimizer': 'Adam'}.
2026-06-04 13:54:25,849 - experiment_functions - INFO - Early stopping at epoch 900. Best Metrics: (0.007649899228905362, 0.001441824636613303, 0.0043081887137332835)
2026-06-04 13:54:25,939 - optuna.study.study - INFO - Trial 137 finished with values: [0.007649899228905362, 0.001441824636613303, 0.0043081887137332835] and parameters: {'n_layers': 4, 'embedding_dim': 256, 'lr': 0.0017568753093311267, 'lambda_val': 1.8898212223948182e-06, 'batch_size': 2438, 'optimizer': 'Adam'}.
2026-06-04 13:56:53,627 - optuna.study.study - INFO - Trial 138 finished with values: [0.004556585341894534, 0.0007451939178779556, 0.002710130269935334] and parameters: {'n_layers': 4, 'embedding_dim': 32, 'lr': 0.00030379311378365113, 'lambda_val': 0.000915140469916225, 'batch_size': 960, 'optimizer': 'RMSprop'}.
2026-06-04 13:57:57,167 - experiment_functions - INFO - Early stopping at epoch 1700. Best Metrics: (0.003369413063509713, 0.0006112264719673119, 0.0018390804623256542)
2026-06-04 13:57:57,254 - optuna.study.study - INFO - Trial 139 finished with values: [0.003369413063509713, 0.0006112264719673119, 0.0018390804623256542] and parameters: {'n_layers': 3, 'embedding_dim': 32, 'lr': 0.007218934143837348, 'lambda_val': 0.061999086231369634, 'batch_size': 887, 'optimizer': 'Adam'}.
2026-06-04 13:59:57,591 - experiment_functions - INFO - Early stopping at epoch 3150. Best Metrics: (0.005047522808205548, 0.0008121776408332775, 0.002982037454921763)
2026-06-04 13:59:57,710 - optuna.study.study - INFO - Trial 140 finished with values: [0.005047522808205548, 0.0008121776408332775, 0.002982037454921763] and parameters: {'n_layers': 1, 'embedding_dim': 128, 'lr': 0.0008527206735717898, 'lambda_val': 0.000222693868437361, 'batch_size': 2516, 'optimizer': 'Adam'}.
2026-06-04 14:00:25,811 - experiment_functions - INFO - Early stopping at epoch 700. Best Metrics: (0.0031977966371498183, 0.0005291714113470427, 0.0017982537630980165)
2026-06-04 14:00:26,992 - optuna.study.study - INFO - Trial 141 finished with values: [0.0031977966371498183, 0.0005291714113470427, 0.0017982537630980165] and parameters: {'n_layers': 4, 'embedding_dim': 32, 'lr': 0.03174614439650414, 'lambda_val': 5.016933039935782e-06, 'batch_size': 2311, 'optimizer': 'RMSprop'}.
2026-06-04 14:00:54,886 - experiment_functions - INFO - Early stopping at epoch 500. Best Metrics: (0.002375348638679321, 0.0004437671645790073, 0.0013815891656298398)
2026-06-04 14:00:55,550 - optuna.study.study - INFO - Trial 142 finished with values: [0.002375348638679321, 0.0004437671645790073, 0.0013815891656298398] and parameters: {'n_layers': 3, 'embedding_dim': 256, 'lr': 0.08500719886316734, 'lambda_val': 0.0032296178945151414, 'batch_size': 887, 'optimizer': 'Adam'}.
2026-06-04 14:01:19,731 - experiment_functions - INFO - Early stopping at epoch 550. Best Metrics: (0.003653894075864577, 0.0005978297273762476, 0.0021070139859598962)
2026-06-04 14:01:19,832 - optuna.study.study - INFO - Trial 143 finished with values: [0.003653894075864577, 0.0005978297273762476, 0.0021070139859598962] and parameters: {'n_layers': 2, 'embedding_dim': 32, 'lr': 0.03174614439650414, 'lambda_val': 5.1016022094875355e-06, 'batch_size': 2036, 'optimizer': 'Adam'}.
2026-06-04 14:01:41,612 - experiment_functions - INFO - Early stopping at epoch 550. Best Metrics: (0.0035776200555576137, 0.0005593140866769374, 0.0019624333577469436)
2026-06-04 14:01:41,877 - optuna.study.study - INFO - Trial 144 finished with values: [0.0035776200555576137, 0.0005593140866769374, 0.0019624333577469436] and parameters: {'n_layers': 2, 'embedding_dim': 32, 'lr': 0.02660347787147833, 'lambda_val': 9.608437770072281e-06, 'batch_size': 960, 'optimizer': 'Adam'}.
2026-06-04 14:04:25,682 - optuna.study.study - INFO - Trial 145 finished with values: [0.0013871668565178998, 0.00021099872730926387, 0.0007839034422571214] and parameters: {'n_layers': 1, 'embedding_dim': 256, 'lr': 0.00020086613586383904, 'lambda_val': 0.0494345449176384, 'batch_size': 2991, 'optimizer': 'RMSprop'}.
2026-06-04 14:04:58,409 - experiment_functions - INFO - Early stopping at epoch 600. Best Metrics: (0.0068358569621278665, 0.0012458972469689866, 0.0038171043183900535)
2026-06-04 14:04:58,478 - optuna.study.study - INFO - Trial 146 finished with values: [0.0068358569621278665, 0.0012458972469689866, 0.0038171043183900535] and parameters: {'n_layers': 4, 'embedding_dim': 256, 'lr': 0.006097730317148143, 'lambda_val': 5.6413681092531065e-05, 'batch_size': 3075, 'optimizer': 'Adam'}.
2026-06-04 14:05:56,053 - experiment_functions - INFO - Early stopping at epoch 1450. Best Metrics: (0.006166748475540164, 0.0011956594547524952, 0.0033367148717104063)
2026-06-04 14:05:56,406 - optuna.study.study - INFO - Trial 147 finished with values: [0.006166748475540164, 0.0011956594547524952, 0.0033367148717104063] and parameters: {'n_layers': 4, 'embedding_dim': 64, 'lr': 0.0008527206735717898, 'lambda_val': 0.021039161138826524, 'batch_size': 528, 'optimizer': 'RMSprop'}.
2026-06-04 14:06:28,273 - experiment_functions - INFO - Early stopping at epoch 750. Best Metrics: (0.003904545816947622, 0.0006346707750016745, 0.0021994938052165474)
2026-06-04 14:06:28,356 - optuna.study.study - INFO - Trial 148 finished with values: [0.003904545816947622, 0.0006346707750016745, 0.0021994938052165474] and parameters: {'n_layers': 1, 'embedding_dim': 96, 'lr': 0.02660347787147833, 'lambda_val': 3.0210429347112765e-06, 'batch_size': 929, 'optimizer': 'Adam'}.
2026-06-04 14:06:48,508 - experiment_functions - INFO - Early stopping at epoch 500. Best Metrics: (0.0005505449884612343, 7.703128139862015e-05, 0.00023346869049440769)
2026-06-04 14:06:48,753 - optuna.study.study - INFO - Trial 149 finished with values: [0.0005505449884612343, 7.703128139862015e-05, 0.00023346869049440769] and parameters: {'n_layers': 3, 'embedding_dim': 32, 'lr': 0.0004090776901902334, 'lambda_val': 7.204655475546071e-06, 'batch_size': 1825, 'optimizer': 'SGD'}.
2026-06-04 14:07:18,881 - experiment_functions - INFO - Early stopping at epoch 550. Best Metrics: (0.005540263054782684, 0.0009896845066648806, 0.003128785969258247)
2026-06-04 14:07:19,621 - optuna.study.study - INFO - Trial 150 finished with values: [0.005540263054782684, 0.0009896845066648806, 0.003128785969258247] and parameters: {'n_layers': 4, 'embedding_dim': 256, 'lr': 0.005913319416099858, 'lambda_val': 0.0007933062074896631, 'batch_size': 2534, 'optimizer': 'RMSprop'}.
2026-06-04 14:07:45,922 - experiment_functions - INFO - Early stopping at epoch 550. Best Metrics: (0.004518768622156078, 0.0008188760131288098, 0.0027033980428498206)
2026-06-04 14:07:46,003 - optuna.study.study - INFO - Trial 151 finished with values: [0.004518768622156078, 0.0008188760131288098, 0.0027033980428498206] and parameters: {'n_layers': 2, 'embedding_dim': 256, 'lr': 0.005913319416099858, 'lambda_val': 0.0037497626023223285, 'batch_size': 1948, 'optimizer': 'RMSprop'}.
2026-06-04 14:10:29,433 - optuna.study.study - INFO - Trial 152 finished with values: [0.00452753420457676, 0.000646392926518856, 0.0024865344585907894] and parameters: {'n_layers': 1, 'embedding_dim': 256, 'lr': 0.0003360739085976085, 'lambda_val': 5.016933039935782e-06, 'batch_size': 2311, 'optimizer': 'RMSprop'}.
2026-06-04 14:12:01,322 - experiment_functions - INFO - Early stopping at epoch 1900. Best Metrics: (0.003968890790679254, 0.0007418447317301895, 0.0021251923241053673)
2026-06-04 14:12:02,110 - optuna.study.study - INFO - Trial 153 finished with values: [0.003968890790679254, 0.0007418447317301895, 0.0021251923241053673] and parameters: {'n_layers': 3, 'embedding_dim': 256, 'lr': 0.08500719886316734, 'lambda_val': 0.0032296178945151414, 'batch_size': 3482, 'optimizer': 'Adam'}.
2026-06-04 14:14:35,842 - optuna.study.study - INFO - Trial 154 finished with values: [0.006351376744668315, 0.0009829861343693483, 0.003670160237243968] and parameters: {'n_layers': 2, 'embedding_dim': 64, 'lr': 0.0004090776901902334, 'lambda_val': 1.0009974035026707e-06, 'batch_size': 1826, 'optimizer': 'RMSprop'}.
2026-06-04 14:14:58,790 - experiment_functions - INFO - Early stopping at epoch 500. Best Metrics: (0.00041186773151282607, 5.526157143814054e-05, 0.00016169440095843105)
2026-06-04 14:14:58,870 - optuna.study.study - INFO - Trial 155 finished with values: [0.00041186773151282607, 5.526157143814054e-05, 0.00016169440095843105] and parameters: {'n_layers': 4, 'embedding_dim': 128, 'lr': 0.002947410528904454, 'lambda_val': 0.05383219142167494, 'batch_size': 739, 'optimizer': 'SGD'}.
2026-06-04 14:15:22,519 - experiment_functions - INFO - Early stopping at epoch 500. Best Metrics: (0.00043153845905538114, 7.87058744725032e-05, 0.0001908493213896908)
2026-06-04 14:15:23,002 - optuna.study.study - INFO - Trial 156 finished with values: [0.00043153845905538114, 7.87058744725032e-05, 0.0001908493213896908] and parameters: {'n_layers': 2, 'embedding_dim': 256, 'lr': 0.005913319416099858, 'lambda_val': 0.0037497626023223285, 'batch_size': 3688, 'optimizer': 'SGD'}.
2026-06-04 14:16:05,897 - experiment_functions - INFO - Early stopping at epoch 800. Best Metrics: (0.007284871803290197, 0.0013547457967713846, 0.004171042773120176)
2026-06-04 14:16:06,033 - optuna.study.study - INFO - Trial 157 finished with values: [0.007284871803290197, 0.0013547457967713846, 0.004171042773120176] and parameters: {'n_layers': 4, 'embedding_dim': 256, 'lr': 0.0017568753093311267, 'lambda_val': 1.8898212223948182e-06, 'batch_size': 3688, 'optimizer': 'Adam'}.
2026-06-04 14:16:49,670 - experiment_functions - INFO - Early stopping at epoch 950. Best Metrics: (0.003592234717374214, 0.0006229486234844932, 0.002231072821475695)
2026-06-04 14:16:49,765 - optuna.study.study - INFO - Trial 158 finished with values: [0.003592234717374214, 0.0006229486234844932, 0.002231072821475695] and parameters: {'n_layers': 2, 'embedding_dim': 256, 'lr': 0.08896930678012212, 'lambda_val': 1.0009974035026707e-06, 'batch_size': 2270, 'optimizer': 'RMSprop'}.
2026-06-04 14:18:18,015 - experiment_functions - INFO - Early stopping at epoch 2100. Best Metrics: (0.0045869895820133295, 0.000862415433049769, 0.0025168018287356703)
2026-06-04 14:18:18,101 - optuna.study.study - INFO - Trial 159 finished with values: [0.0045869895820133295, 0.000862415433049769, 0.0025168018287356703] and parameters: {'n_layers': 1, 'embedding_dim': 256, 'lr': 0.0009834023718369865, 'lambda_val': 0.06405803008831426, 'batch_size': 2516, 'optimizer': 'Adam'}.
2026-06-04 14:19:39,743 - experiment_functions - INFO - Early stopping at epoch 2100. Best Metrics: (0.008594452646019794, 0.001470292718869315, 0.005001756602078938)
2026-06-04 14:19:39,987 - optuna.study.study - INFO - Trial 160 finished with values: [0.008594452646019794, 0.001470292718869315, 0.005001756602078938] and parameters: {'n_layers': 3, 'embedding_dim': 64, 'lr': 0.0008527206735717898, 'lambda_val': 7.359862236281652e-06, 'batch_size': 2516, 'optimizer': 'Adam'}.
2026-06-04 14:20:16,048 - experiment_functions - INFO - Early stopping at epoch 800. Best Metrics: (0.004857996496469482, 0.0008892089222318977, 0.0025685788869932967)
2026-06-04 14:20:16,786 - optuna.study.study - INFO - Trial 161 finished with values: [0.004857996496469482, 0.0008892089222318977, 0.0025685788869932967] and parameters: {'n_layers': 4, 'embedding_dim': 128, 'lr': 0.0010072848810039788, 'lambda_val': 0.06405803008831426, 'batch_size': 3509, 'optimizer': 'RMSprop'}.
2026-06-04 14:22:52,349 - optuna.study.study - INFO - Trial 162 finished with values: [0.009150974243986176, 0.0016159823162971397, 0.005606509104540561] and parameters: {'n_layers': 4, 'embedding_dim': 64, 'lr': 0.0004090776901902334, 'lambda_val': 3.266599538089538e-05, 'batch_size': 1946, 'optimizer': 'RMSprop'}.
2026-06-04 14:24:46,502 - experiment_functions - INFO - Early stopping at epoch 2550. Best Metrics: (0.0008388906797138668, 0.000144015004353942, 0.0004648779642350766)
2026-06-04 14:24:46,736 - optuna.study.study - INFO - Trial 163 finished with values: [0.0008388906797138668, 0.000144015004353942, 0.0004648779642350766] and parameters: {'n_layers': 2, 'embedding_dim': 256, 'lr': 9.850492370272733e-05, 'lambda_val': 0.003408181582178322, 'batch_size': 2516, 'optimizer': 'Adam'}.
2026-06-04 14:27:33,650 - optuna.study.study - INFO - Trial 164 finished with values: [0.005139147105977349, 0.0008238997923504589, 0.002954998052500929] and parameters: {'n_layers': 1, 'embedding_dim': 256, 'lr': 0.0008527206735717898, 'lambda_val': 0.000222693868437361, 'batch_size': 2516, 'optimizer': 'Adam'}.
2026-06-04 14:28:13,517 - experiment_functions - INFO - Early stopping at epoch 850. Best Metrics: (0.005601317156607409, 0.0009545180521133366, 0.003140167161597704)
2026-06-04 14:28:13,974 - optuna.study.study - INFO - Trial 165 finished with values: [0.005601317156607409, 0.0009545180521133366, 0.003140167161597704] and parameters: {'n_layers': 2, 'embedding_dim': 256, 'lr': 0.006097730317148143, 'lambda_val': 5.016933039935782e-06, 'batch_size': 3075, 'optimizer': 'Adam'}.
2026-06-04 14:28:47,994 - experiment_functions - INFO - Early stopping at epoch 750. Best Metrics: (0.004877305845141004, 0.0008858597360841315, 0.0025736835488123543)
2026-06-04 14:28:48,199 - optuna.study.study - INFO - Trial 166 finished with values: [0.004877305845141004, 0.0008858597360841315, 0.0025736835488123543] and parameters: {'n_layers': 4, 'embedding_dim': 128, 'lr': 0.0010072848810039788, 'lambda_val': 0.06405803008831426, 'batch_size': 3434, 'optimizer': 'RMSprop'}.
2026-06-04 14:29:14,477 - experiment_functions - INFO - Early stopping at epoch 650. Best Metrics: (0.006894648011532795, 0.0011856118963091968, 0.004008221175151212)
2026-06-04 14:29:14,762 - optuna.study.study - INFO - Trial 167 finished with values: [0.006894648011532795, 0.0011856118963091968, 0.004008221175151212] and parameters: {'n_layers': 4, 'embedding_dim': 32, 'lr': 0.005913319416099858, 'lambda_val': 1.8898212223948182e-06, 'batch_size': 2534, 'optimizer': 'Adam'}.
2026-06-04 14:31:19,044 - experiment_functions - INFO - Early stopping at epoch 3350. Best Metrics: (0.0009615796765292765, 0.00012726907361511152, 0.0005429908672941663)
2026-06-04 14:31:19,178 - optuna.study.study - INFO - Trial 168 finished with values: [0.0009615796765292765, 0.00012726907361511152, 0.0005429908672941663] and parameters: {'n_layers': 4, 'embedding_dim': 32, 'lr': 9.881912082040711e-05, 'lambda_val': 0.0029474529646761295, 'batch_size': 2270, 'optimizer': 'Adam'}.
2026-06-04 14:32:22,150 - experiment_functions - INFO - Early stopping at epoch 1550. Best Metrics: (0.004815251557010676, 0.0008825105499363654, 0.002641029604788153)
2026-06-04 14:32:22,336 - optuna.study.study - INFO - Trial 169 finished with values: [0.004815251557010676, 0.0008825105499363654, 0.002641029604788153] and parameters: {'n_layers': 2, 'embedding_dim': 128, 'lr': 0.0010072848810039788, 'lambda_val': 0.05383219142167494, 'batch_size': 3509, 'optimizer': 'Adam'}.
2026-06-04 14:32:52,474 - experiment_functions - INFO - Early stopping at epoch 550. Best Metrics: (0.0068295583995660065, 0.0012291513162301562, 0.0039174513991946935)
