2026-06-05 19:44:35,358 - optuna.study.study - INFO - Trial 255 finished with values: [0.05886978640500299, 0.008150244490588788, 0.03373285729997759] and parameters: {'n_layers': 1, 'embedding_dim': 96, 'lr': 0.0008576367655519577, 'lambda_val': 0.0001580551667310673, 'batch_size': 1201, 'optimizer': 'Adam'}.
2026-06-05 19:45:12,948 - experiment_functions - INFO - Early stopping at epoch 950. Best Metrics: (0.0004153088648203001, 7.703128139862013e-05, 0.00019539196281655863)
2026-06-05 19:45:13,061 - optuna.study.study - INFO - Trial 256 finished with values: [0.0004153088648203001, 7.703128139862013e-05, 0.00019539196281655863] and parameters: {'n_layers': 1, 'embedding_dim': 64, 'lr': 4.3458945982507134e-05, 'lambda_val': 0.0018008584330935855, 'batch_size': 2546, 'optimizer': 'Adam'}.
2026-06-05 19:48:01,374 - optuna.study.study - INFO - Trial 257 finished with values: [0.0957151051678113, 0.011842722218500905, 0.05165897704221453] and parameters: {'n_layers': 1, 'embedding_dim': 128, 'lr': 0.0010470286775611781, 'lambda_val': 2.8670388049392515e-06, 'batch_size': 2271, 'optimizer': 'RMSprop'}.
2026-06-05 19:48:24,629 - experiment_functions - INFO - Early stopping at epoch 550. Best Metrics: (0.0006425569581028407, 8.205506062026926e-05, 0.0002864023951095407)
2026-06-05 19:48:24,715 - optuna.study.study - INFO - Trial 258 finished with values: [0.0006425569581028407, 8.205506062026926e-05, 0.0002864023951095407] and parameters: {'n_layers': 1, 'embedding_dim': 96, 'lr': 8.935911851364074e-05, 'lambda_val': 2.8670388049392515e-06, 'batch_size': 3475, 'optimizer': 'Adam'}.
2026-06-05 19:51:00,670 - optuna.study.study - INFO - Trial 259 finished with values: [0.06649049653870343, 0.008488512291513163, 0.03683683520560084] and parameters: {'n_layers': 2, 'embedding_dim': 32, 'lr': 0.0008576367655519577, 'lambda_val': 2.0513596702725523e-06, 'batch_size': 926, 'optimizer': 'Adam'}.
2026-06-05 19:53:43,923 - optuna.study.study - INFO - Trial 260 finished with values: [0.08237477059181948, 0.010524817469354946, 0.04466651885521452] and parameters: {'n_layers': 1, 'embedding_dim': 96, 'lr': 0.0007730079936260513, 'lambda_val': 0.0006434072702442174, 'batch_size': 3475, 'optimizer': 'Adam'}.
2026-06-05 19:56:22,779 - optuna.study.study - INFO - Trial 261 finished with values: [0.07667761245166864, 0.009324134235380803, 0.03962570879415643] and parameters: {'n_layers': 2, 'embedding_dim': 32, 'lr': 0.0007730079936260513, 'lambda_val': 3.684365830705915e-05, 'batch_size': 4028, 'optimizer': 'RMSprop'}.
2026-06-05 19:59:03,183 - optuna.study.study - INFO - Trial 262 finished with values: [0.06342389798644067, 0.007557438542434188, 0.031454694231696424] and parameters: {'n_layers': 3, 'embedding_dim': 32, 'lr': 0.0010470286775611781, 'lambda_val': 5.587325552332493e-06, 'batch_size': 1800, 'optimizer': 'Adam'}.
2026-06-05 20:02:24,164 - experiment_functions - INFO - Early stopping at epoch 3950. Best Metrics: (0.08961011679543021, 0.010839640967244959, 0.0473144434581449)
2026-06-05 20:02:24,252 - optuna.study.study - INFO - Trial 263 finished with values: [0.08961011679543021, 0.010839640967244959, 0.0473144434581449] and parameters: {'n_layers': 2, 'embedding_dim': 256, 'lr': 0.0007730079936260513, 'lambda_val': 5.587325552332493e-06, 'batch_size': 1989, 'optimizer': 'Adam'}.
2026-06-05 20:05:23,735 - optuna.study.study - INFO - Trial 264 finished with values: [0.08613994408115636, 0.010462857525621275, 0.04590419629682988] and parameters: {'n_layers': 2, 'embedding_dim': 128, 'lr': 0.0007730079936260513, 'lambda_val': 2.8670388049392515e-06, 'batch_size': 2555, 'optimizer': 'Adam'}.
2026-06-05 20:07:55,897 - optuna.study.study - INFO - Trial 265 finished with values: [0.05540282501281226, 0.007704802732935897, 0.03131113719132273] and parameters: {'n_layers': 1, 'embedding_dim': 32, 'lr': 0.0007912354345926823, 'lambda_val': 0.00011375426873786574, 'batch_size': 2266, 'optimizer': 'Adam'}.
2026-06-05 20:08:36,733 - experiment_functions - INFO - Early stopping at epoch 1000. Best Metrics: (0.009604885036078396, 0.001188961082456963, 0.004057605158000436)
2026-06-05 20:08:36,828 - optuna.study.study - INFO - Trial 266 finished with values: [0.009604885036078396, 0.001188961082456963, 0.004057605158000436] and parameters: {'n_layers': 2, 'embedding_dim': 64, 'lr': 0.0018762947263184326, 'lambda_val': 0.09177961270759825, 'batch_size': 2271, 'optimizer': 'Adam'}.
2026-06-05 20:11:19,610 - optuna.study.study - INFO - Trial 267 finished with values: [0.07225062204652383, 0.009200214347913457, 0.04053777496273213] and parameters: {'n_layers': 2, 'embedding_dim': 64, 'lr': 0.0008576367655519577, 'lambda_val': 2.2392691089871585e-06, 'batch_size': 926, 'optimizer': 'Adam'}.
2026-06-05 20:13:52,950 - optuna.study.study - INFO - Trial 268 finished with values: [0.06645887020469399, 0.008721280728782905, 0.03641139417513948] and parameters: {'n_layers': 1, 'embedding_dim': 32, 'lr': 0.0009590496257981318, 'lambda_val': 3.082500502951572e-05, 'batch_size': 2266, 'optimizer': 'Adam'}.
2026-06-05 20:14:36,673 - experiment_functions - INFO - Early stopping at epoch 1050. Best Metrics: (0.043890407417198955, 0.005278317368879362, 0.020801786976747373)
2026-06-05 20:14:38,147 - optuna.study.study - INFO - Trial 269 finished with values: [0.043890407417198955, 0.005278317368879362, 0.020801786976747373] and parameters: {'n_layers': 4, 'embedding_dim': 32, 'lr': 0.0018762947263184326, 'lambda_val': 5.587325552332493e-06, 'batch_size': 2271, 'optimizer': 'Adam'}.
2026-06-05 20:16:49,293 - experiment_functions - INFO - Early stopping at epoch 3150. Best Metrics: (0.07173719011546095, 0.008980842655234779, 0.03525932040490426)
2026-06-05 20:16:49,650 - optuna.study.study - INFO - Trial 270 finished with values: [0.07173719011546095, 0.008980842655234779, 0.03525932040490426] and parameters: {'n_layers': 1, 'embedding_dim': 128, 'lr': 0.0010470286775611781, 'lambda_val': 0.004390997941342856, 'batch_size': 2271, 'optimizer': 'Adam'}.
2026-06-05 20:19:52,684 - optuna.study.study - INFO - Trial 271 finished with values: [0.09507325129581409, 0.01165349320115212, 0.05133407252672655] and parameters: {'n_layers': 1, 'embedding_dim': 256, 'lr': 0.0010470286775611781, 'lambda_val': 2.8670388049392515e-06, 'batch_size': 1587, 'optimizer': 'RMSprop'}.
2026-06-05 20:22:35,824 - optuna.study.study - INFO - Trial 272 finished with values: [0.09216072886073011, 0.011566414361310203, 0.0500361737729991] and parameters: {'n_layers': 1, 'embedding_dim': 96, 'lr': 0.0008576367655519577, 'lambda_val': 3.684365830705915e-05, 'batch_size': 4028, 'optimizer': 'RMSprop'}.
2026-06-05 20:25:11,434 - optuna.study.study - INFO - Trial 273 finished with values: [0.07273465288911961, 0.008912184339205573, 0.038736506425012064] and parameters: {'n_layers': 2, 'embedding_dim': 32, 'lr': 0.0007730079936260513, 'lambda_val': 5.587325552332493e-06, 'batch_size': 2504, 'optimizer': 'Adam'}.
2026-06-05 20:26:05,494 - experiment_functions - INFO - Early stopping at epoch 1300. Best Metrics: (0.08608497701916315, 0.010323866300488982, 0.044482015038266105)
2026-06-05 20:26:05,576 - optuna.study.study - INFO - Trial 274 finished with values: [0.08608497701916315, 0.010323866300488982, 0.044482015038266105] and parameters: {'n_layers': 1, 'embedding_dim': 96, 'lr': 0.0029470384606335377, 'lambda_val': 5.587325552332493e-06, 'batch_size': 2075, 'optimizer': 'Adam'}.
2026-06-05 20:28:42,610 - optuna.study.study - INFO - Trial 275 finished with values: [0.07379693978746715, 0.008882041663875679, 0.0400730600617141] and parameters: {'n_layers': 2, 'embedding_dim': 32, 'lr': 0.0008576367655519577, 'lambda_val': 3.082500502951572e-05, 'batch_size': 2266, 'optimizer': 'RMSprop'}.
2026-06-05 20:31:18,682 - optuna.study.study - INFO - Trial 276 finished with values: [0.06456923682246622, 0.008337798914863689, 0.03545009480409674] and parameters: {'n_layers': 2, 'embedding_dim': 32, 'lr': 0.0008576367655519577, 'lambda_val': 0.0001580551667310673, 'batch_size': 926, 'optimizer': 'Adam'}.
2026-06-05 20:33:55,457 - optuna.study.study - INFO - Trial 277 finished with values: [0.06300973442401124, 0.008100006698372294, 0.03542205432128777] and parameters: {'n_layers': 2, 'embedding_dim': 32, 'lr': 0.0008576367655519577, 'lambda_val': 2.2392691089871585e-06, 'batch_size': 926, 'optimizer': 'Adam'}.
2026-06-05 20:35:03,648 - experiment_functions - INFO - Early stopping at epoch 1650. Best Metrics: (0.07191036518543495, 0.009312412083863622, 0.037314780794598976)
2026-06-05 20:35:03,724 - optuna.study.study - INFO - Trial 278 finished with values: [0.07191036518543495, 0.009312412083863622, 0.037314780794598976] and parameters: {'n_layers': 1, 'embedding_dim': 96, 'lr': 0.0010470286775611781, 'lambda_val': 0.004285518144526943, 'batch_size': 3285, 'optimizer': 'Adam'}.
2026-06-05 20:37:47,198 - optuna.study.study - INFO - Trial 279 finished with values: [0.084880451034772, 0.010729117824368679, 0.045591814641542355] and parameters: {'n_layers': 1, 'embedding_dim': 96, 'lr': 0.0010470286775611781, 'lambda_val': 0.00020574260712132375, 'batch_size': 2271, 'optimizer': 'Adam'}.
2026-06-05 20:40:38,952 - experiment_functions - INFO - Early stopping at epoch 3700. Best Metrics: (0.07178182575868855, 0.008655971598901467, 0.036898757069136846)
2026-06-05 20:40:39,062 - optuna.study.study - INFO - Trial 280 finished with values: [0.07178182575868855, 0.008655971598901467, 0.036898757069136846] and parameters: {'n_layers': 3, 'embedding_dim': 128, 'lr': 0.0007908861785647595, 'lambda_val': 0.00011375426873786574, 'batch_size': 1587, 'optimizer': 'Adam'}.
2026-06-05 20:43:16,410 - optuna.study.study - INFO - Trial 281 finished with values: [0.07453786551266452, 0.00907964364659388, 0.03963454243227473] and parameters: {'n_layers': 2, 'embedding_dim': 32, 'lr': 0.0008576367655519577, 'lambda_val': 0.0001580551667310673, 'batch_size': 2947, 'optimizer': 'Adam'}.
2026-06-05 20:44:13,732 - experiment_functions - INFO - Early stopping at epoch 1150. Best Metrics: (0.05059812797011901, 0.005976622680688593, 0.024256908415143788)
2026-06-05 20:44:13,915 - optuna.study.study - INFO - Trial 282 finished with values: [0.05059812797011901, 0.005976622680688593, 0.024256908415143788] and parameters: {'n_layers': 4, 'embedding_dim': 128, 'lr': 0.0007730079936260513, 'lambda_val': 2.8670388049392515e-06, 'batch_size': 2271, 'optimizer': 'RMSprop'}.
2026-06-05 20:45:32,686 - experiment_functions - INFO - Early stopping at epoch 1300. Best Metrics: (0.05088177131751234, 0.005918011923102685, 0.02368709772916775)
2026-06-05 20:45:32,800 - optuna.study.study - INFO - Trial 283 finished with values: [0.05088177131751234, 0.005918011923102685, 0.02368709772916775] and parameters: {'n_layers': 4, 'embedding_dim': 256, 'lr': 0.0007730079936260513, 'lambda_val': 5.587325552332493e-06, 'batch_size': 2266, 'optimizer': 'RMSprop'}.
2026-06-05 20:48:29,685 - optuna.study.study - INFO - Trial 284 finished with values: [0.08114831788169004, 0.010112867573179718, 0.04463858215893603] and parameters: {'n_layers': 2, 'embedding_dim': 128, 'lr': 0.0008576367655519577, 'lambda_val': 3.082500502951572e-05, 'batch_size': 926, 'optimizer': 'Adam'}.
2026-06-05 20:49:17,612 - experiment_functions - INFO - Early stopping at epoch 1050. Best Metrics: (0.04424693828709014, 0.005181190970594146, 0.020783556095021673)
2026-06-05 20:49:17,699 - optuna.study.study - INFO - Trial 285 finished with values: [0.04424693828709014, 0.005181190970594146, 0.020783556095021673] and parameters: {'n_layers': 3, 'embedding_dim': 96, 'lr': 0.0018893199928513118, 'lambda_val': 5.587325552332493e-06, 'batch_size': 2665, 'optimizer': 'RMSprop'}.
2026-06-05 20:52:08,125 - optuna.study.study - INFO - Trial 286 finished with values: [0.0819554249406588, 0.010144684841583495, 0.04354555337191425] and parameters: {'n_layers': 2, 'embedding_dim': 96, 'lr': 0.0010384920456476296, 'lambda_val': 3.822576611915219e-05, 'batch_size': 926, 'optimizer': 'Adam'}.
2026-06-05 20:55:11,759 - optuna.study.study - INFO - Trial 287 finished with values: [0.09199744696729428, 0.01162000133967446, 0.05041013635634495] and parameters: {'n_layers': 1, 'embedding_dim': 256, 'lr': 0.000792839435761378, 'lambda_val': 3.684365830705915e-05, 'batch_size': 2108, 'optimizer': 'RMSprop'}.
2026-06-05 20:55:35,176 - experiment_functions - INFO - Early stopping at epoch 550. Best Metrics: (0.0005876051129414468, 7.703128139862015e-05, 0.00024557531088868675)
2026-06-05 20:55:36,123 - optuna.study.study - INFO - Trial 288 finished with values: [0.0005876051129414468, 7.703128139862015e-05, 0.00024557531088868675] and parameters: {'n_layers': 1, 'embedding_dim': 128, 'lr': 0.0002023296092064631, 'lambda_val': 7.487535492065269e-05, 'batch_size': 2271, 'optimizer': 'RMSprop'}.
2026-06-05 20:58:32,627 - optuna.study.study - INFO - Trial 289 finished with values: [0.06979707850627638, 0.008192109317435864, 0.03556772701864468] and parameters: {'n_layers': 3, 'embedding_dim': 96, 'lr': 0.0007730079936260513, 'lambda_val': 3.684365830705915e-05, 'batch_size': 1822, 'optimizer': 'RMSprop'}.
2026-06-05 21:01:55,293 - optuna.study.study - INFO - Trial 290 finished with values: [0.08381090522384423, 0.010362381941188293, 0.04522004783718409] and parameters: {'n_layers': 2, 'embedding_dim': 256, 'lr': 0.0005272741245061854, 'lambda_val': 2.8670388049392515e-06, 'batch_size': 2271, 'optimizer': 'Adam'}.
2026-06-05 21:02:16,846 - experiment_functions - INFO - Early stopping at epoch 500. Best Metrics: (0.0004241214148001392, 7.87058744725032e-05, 0.00019248878211691384)
2026-06-05 21:02:18,448 - optuna.study.study - INFO - Trial 291 finished with values: [0.0004241214148001392, 7.87058744725032e-05, 0.00019248878211691384] and parameters: {'n_layers': 1, 'embedding_dim': 128, 'lr': 0.0005272741245061854, 'lambda_val': 5.587325552332493e-06, 'batch_size': 2786, 'optimizer': 'SGD'}.
2026-06-05 21:02:43,937 - experiment_functions - INFO - Early stopping at epoch 600. Best Metrics: (0.05365615613359403, 0.006644785317167929, 0.02761860205912125)
2026-06-05 21:02:44,215 - optuna.study.study - INFO - Trial 292 finished with values: [0.05365615613359403, 0.006644785317167929, 0.02761860205912125] and parameters: {'n_layers': 2, 'embedding_dim': 32, 'lr': 0.007735123116275345, 'lambda_val': 3.082500502951572e-05, 'batch_size': 2455, 'optimizer': 'Adam'}.
2026-06-05 21:05:16,674 - optuna.study.study - INFO - Trial 293 finished with values: [0.058286196376723616, 0.008160292049032085, 0.033282094277935784] and parameters: {'n_layers': 1, 'embedding_dim': 32, 'lr': 0.0007908861785647595, 'lambda_val': 0.00011375426873786574, 'batch_size': 2271, 'optimizer': 'RMSprop'}.
2026-06-05 21:05:59,816 - experiment_functions - INFO - Early stopping at epoch 1000. Best Metrics: (0.08611441945851825, 0.01040592136110925, 0.04453298067385554)
2026-06-05 21:05:59,893 - optuna.study.study - INFO - Trial 294 finished with values: [0.08611441945851825, 0.01040592136110925, 0.04453298067385554] and parameters: {'n_layers': 1, 'embedding_dim': 96, 'lr': 0.0029470384606335377, 'lambda_val': 0.00020574260712132375, 'batch_size': 3475, 'optimizer': 'Adam'}.
2026-06-05 21:06:22,132 - experiment_functions - INFO - Early stopping at epoch 500. Best Metrics: (0.0004605457417814559, 8.038046754638624e-05, 0.000246805651411925)
2026-06-05 21:06:22,229 - optuna.study.study - INFO - Trial 295 finished with values: [0.0004605457417814559, 8.038046754638624e-05, 0.000246805651411925] and parameters: {'n_layers': 3, 'embedding_dim': 64, 'lr': 0.0002079237995505436, 'lambda_val': 0.036379332534158364, 'batch_size': 3281, 'optimizer': 'Adam'}.
2026-06-05 21:07:02,737 - experiment_functions - INFO - Early stopping at epoch 950. Best Metrics: (0.06973298566132281, 0.008471766360774331, 0.03527278842866617)
2026-06-05 21:07:02,834 - optuna.study.study - INFO - Trial 296 finished with values: [0.06973298566132281, 0.008471766360774331, 0.03527278842866617] and parameters: {'n_layers': 2, 'embedding_dim': 64, 'lr': 0.0018762947263184326, 'lambda_val': 0.0002713017942370913, 'batch_size': 2517, 'optimizer': 'Adam'}.
2026-06-05 21:10:07,527 - optuna.study.study - INFO - Trial 297 finished with values: [0.08526544112525472, 0.010935092772456294, 0.04566529831957043] and parameters: {'n_layers': 1, 'embedding_dim': 256, 'lr': 0.0007912354345926823, 'lambda_val': 0.0003158051517797666, 'batch_size': 2504, 'optimizer': 'Adam'}.
2026-06-05 21:11:47,259 - experiment_functions - INFO - Early stopping at epoch 2450. Best Metrics: (0.06717325306282641, 0.008448322057739968, 0.03411745077250509)
2026-06-05 21:11:47,514 - optuna.study.study - INFO - Trial 298 finished with values: [0.06717325306282641, 0.008448322057739968, 0.03411745077250509] and parameters: {'n_layers': 1, 'embedding_dim': 96, 'lr': 0.0007730079936260513, 'lambda_val': 0.005288720124154074, 'batch_size': 4028, 'optimizer': 'RMSprop'}.
2026-06-05 21:12:25,846 - experiment_functions - INFO - Early stopping at epoch 900. Best Metrics: (0.06023219447472488, 0.0073347176636077436, 0.02990891529630829)
2026-06-05 21:12:25,929 - optuna.study.study - INFO - Trial 299 finished with values: [0.06023219447472488, 0.0073347176636077436, 0.02990891529630829] and parameters: {'n_layers': 2, 'embedding_dim': 64, 'lr': 0.0018762947263184326, 'lambda_val': 3.082500502951572e-05, 'batch_size': 2504, 'optimizer': 'RMSprop'}.
2026-06-05 21:12:25,944 - root - INFO - Selected Trial 257 based on Max ndcg: 0.0517
2026-06-05 21:12:25,944 - root - INFO - Associated Recall: 0.0957
2026-06-05 21:12:25,944 - experiment_functions - INFO - Training the best model ... for e_gowalla_1c1dcs_rand2
2026-06-05 21:15:15,328 - root - INFO -   **** Training e_gowalla_1c1dcs_rand3
2026-06-05 21:15:15,443 - root - INFO -   **** Getting 368544/845292 random edges
2026-06-05 21:15:15,969 - optuna.storages._rdb.storage - INFO - A new study created in RDB with name: Study_e_gowalla_1c1dcs_rand3
2026-06-05 21:15:38,801 - experiment_functions - INFO - Early stopping at epoch 500. Best Metrics: (0.0004241214148001392, 7.87058744725032e-05, 0.00019248878211691384)
2026-06-05 21:15:38,887 - optuna.study.study - INFO - Trial 0 finished with values: [0.0004241214148001392, 7.87058744725032e-05, 0.00019248878211691384] and parameters: {'n_layers': 2, 'embedding_dim': 128, 'lr': 0.001073268138985609, 'lambda_val': 0.0193497987677142, 'batch_size': 971, 'optimizer': 'SGD'}.
2026-06-05 21:16:03,519 - experiment_functions - INFO - Early stopping at epoch 500. Best Metrics: (0.02271009866315406, 0.002526960948489517, 0.010442205736426787)
2026-06-05 21:16:03,638 - optuna.study.study - INFO - Trial 1 finished with values: [0.02271009866315406, 0.002526960948489517, 0.010442205736426787] and parameters: {'n_layers': 3, 'embedding_dim': 128, 'lr': 0.09560914537583286, 'lambda_val': 1.0229781127321935e-05, 'batch_size': 752, 'optimizer': 'RMSprop'}.
2026-06-05 21:16:26,462 - experiment_functions - INFO - Early stopping at epoch 500. Best Metrics: (0.0003210717775002708, 6.195994373367272e-05, 0.00018585943042930296)
2026-06-05 21:16:26,546 - optuna.study.study - INFO - Trial 2 finished with values: [0.0003210717775002708, 6.195994373367272e-05, 0.00018585943042930296] and parameters: {'n_layers': 3, 'embedding_dim': 96, 'lr': 0.05864167229079073, 'lambda_val': 1.561323947442175e-05, 'batch_size': 1747, 'optimizer': 'SGD'}.
2026-06-05 21:16:51,647 - experiment_functions - INFO - Early stopping at epoch 500. Best Metrics: (0.000536463019717089, 6.195994373367272e-05, 0.00019318028518349874)
2026-06-05 21:16:51,945 - optuna.study.study - INFO - Trial 3 finished with values: [0.000536463019717089, 6.195994373367272e-05, 0.00019318028518349874] and parameters: {'n_layers': 3, 'embedding_dim': 128, 'lr': 0.00020291753107136212, 'lambda_val': 1.906480529748647e-05, 'batch_size': 2519, 'optimizer': 'SGD'}.
2026-06-05 21:17:13,283 - experiment_functions - INFO - Early stopping at epoch 500. Best Metrics: (0.0004543730300627241, 7.703128139862015e-05, 0.00020940914661015837)
2026-06-05 21:17:13,449 - optuna.study.study - INFO - Trial 4 finished with values: [0.0004543730300627241, 7.703128139862015e-05, 0.00020940914661015837] and parameters: {'n_layers': 2, 'embedding_dim': 64, 'lr': 0.06938371777215022, 'lambda_val': 1.8893996265952707e-05, 'batch_size': 4020, 'optimizer': 'SGD'}.
2026-06-05 21:17:47,643 - experiment_functions - INFO - Early stopping at epoch 550. Best Metrics: (0.0060290811959409375, 0.0007435193248040727, 0.0030505619606437584)
2026-06-05 21:17:47,947 - optuna.study.study - INFO - Trial 5 finished with values: [0.0060290811959409375, 0.0007435193248040727, 0.0030505619606437584] and parameters: {'n_layers': 4, 'embedding_dim': 256, 'lr': 0.00488563226931828, 'lambda_val': 0.07310978064365092, 'batch_size': 2924, 'optimizer': 'RMSprop'}.
2026-06-05 21:18:16,101 - experiment_functions - INFO - Early stopping at epoch 500. Best Metrics: (0.0006235929496710712, 8.540424676803537e-05, 0.00028973896140428295)
2026-06-05 21:18:16,186 - optuna.study.study - INFO - Trial 6 finished with values: [0.0006235929496710712, 8.540424676803537e-05, 0.00028973896140428295] and parameters: {'n_layers': 3, 'embedding_dim': 256, 'lr': 0.00013024236477514111, 'lambda_val': 0.0005926907818137016, 'batch_size': 3708, 'optimizer': 'SGD'}.
2026-06-05 21:18:44,301 - experiment_functions - INFO - Early stopping at epoch 550. Best Metrics: (0.027554854890423048, 0.0032302900395203967, 0.012605568651704526)
