2026-06-04 02:31:42,425 - optuna.study.study - INFO - Trial 115 finished with values: [0.005190247646250653, 0.0008942327014535468, 0.0028585282660603464] and parameters: {'n_layers': 3, 'embedding_dim': 256, 'lr': 0.028959132035735552, 'lambda_val': 0.00013240141630371793, 'batch_size': 1158, 'optimizer': 'Adam'}.
2026-06-04 02:34:11,824 - experiment_functions - INFO - Early stopping at epoch 3300. Best Metrics: (0.006260417001746598, 0.0011035568356889277, 0.003664167142855754)
2026-06-04 02:34:12,384 - optuna.study.study - INFO - Trial 116 finished with values: [0.006260417001746598, 0.0011035568356889277, 0.003664167142855754] and parameters: {'n_layers': 2, 'embedding_dim': 256, 'lr': 0.0006097425316287412, 'lambda_val': 2.2435960383986775e-06, 'batch_size': 3903, 'optimizer': 'Adam'}.
2026-06-04 02:34:35,492 - experiment_functions - INFO - Early stopping at epoch 550. Best Metrics: (0.0027398758558940554, 0.00046553687453948684, 0.0015147277709330715)
2026-06-04 02:34:35,580 - optuna.study.study - INFO - Trial 117 finished with values: [0.0027398758558940554, 0.00046553687453948684, 0.0015147277709330715] and parameters: {'n_layers': 1, 'embedding_dim': 96, 'lr': 0.028504820821667567, 'lambda_val': 0.00014816809310452117, 'batch_size': 1645, 'optimizer': 'RMSprop'}.
2026-06-04 02:36:59,501 - optuna.study.study - INFO - Trial 118 finished with values: [0.0019273397294433015, 0.00027295867104293656, 0.0011130516710434212] and parameters: {'n_layers': 1, 'embedding_dim': 32, 'lr': 0.0002128733070623029, 'lambda_val': 0.01026021876459957, 'batch_size': 4011, 'optimizer': 'Adam'}.
2026-06-04 02:37:32,676 - experiment_functions - INFO - Early stopping at epoch 800. Best Metrics: (0.005749002513863943, 0.0009612164244088687, 0.003160122409675543)
2026-06-04 02:37:32,779 - optuna.study.study - INFO - Trial 119 finished with values: [0.005749002513863943, 0.0009612164244088687, 0.003160122409675543] and parameters: {'n_layers': 2, 'embedding_dim': 96, 'lr': 0.004527047386587098, 'lambda_val': 0.00026012148846087845, 'batch_size': 1923, 'optimizer': 'Adam'}.
2026-06-04 02:38:27,422 - experiment_functions - INFO - Early stopping at epoch 1100. Best Metrics: (0.007020968109528581, 0.0013664679482885658, 0.004161072636725671)
2026-06-04 02:38:28,467 - optuna.study.study - INFO - Trial 120 finished with values: [0.007020968109528581, 0.0013664679482885658, 0.004161072636725671] and parameters: {'n_layers': 3, 'embedding_dim': 256, 'lr': 0.0009744505282133616, 'lambda_val': 2.6963455125652685e-06, 'batch_size': 3299, 'optimizer': 'RMSprop'}.
2026-06-04 02:38:58,524 - experiment_functions - INFO - Early stopping at epoch 700. Best Metrics: (0.005375215349374887, 0.0009930336928126466, 0.003149776359632576)
2026-06-04 02:38:58,683 - optuna.study.study - INFO - Trial 121 finished with values: [0.005375215349374887, 0.0009930336928126466, 0.003149776359632576] and parameters: {'n_layers': 2, 'embedding_dim': 128, 'lr': 0.004527047386587098, 'lambda_val': 7.233718216592713e-05, 'batch_size': 3163, 'optimizer': 'RMSprop'}.
2026-06-04 02:39:18,992 - experiment_functions - INFO - Early stopping at epoch 500. Best Metrics: (0.0004140927009649294, 6.865831602920491e-05, 0.0002100456308884884)
2026-06-04 02:39:19,099 - optuna.study.study - INFO - Trial 122 finished with values: [0.0004140927009649294, 6.865831602920491e-05, 0.0002100456308884884] and parameters: {'n_layers': 2, 'embedding_dim': 32, 'lr': 0.004277274112037138, 'lambda_val': 0.00013240141630371793, 'batch_size': 2817, 'optimizer': 'SGD'}.
2026-06-04 02:42:19,022 - optuna.study.study - INFO - Trial 123 finished with values: [0.006182557497618058, 0.0010633666019157345, 0.0034249029900548468] and parameters: {'n_layers': 2, 'embedding_dim': 256, 'lr': 0.0006097425316287412, 'lambda_val': 5.282448475572872e-06, 'batch_size': 2271, 'optimizer': 'Adam'}.
2026-06-04 02:42:43,011 - experiment_functions - INFO - Early stopping at epoch 500. Best Metrics: (0.0004043559006179176, 5.6936164512023584e-05, 0.00018455944729682192)
2026-06-04 02:42:43,391 - optuna.study.study - INFO - Trial 124 finished with values: [0.0004043559006179176, 5.6936164512023584e-05, 0.00018455944729682192] and parameters: {'n_layers': 2, 'embedding_dim': 256, 'lr': 0.0006097425316287412, 'lambda_val': 0.001052760186062327, 'batch_size': 2236, 'optimizer': 'SGD'}.
2026-06-04 02:43:05,994 - experiment_functions - INFO - Early stopping at epoch 550. Best Metrics: (0.0030747454695018665, 0.0005375443767164579, 0.0018240549110950005)
2026-06-04 02:43:06,298 - optuna.study.study - INFO - Trial 125 finished with values: [0.0030747454695018665, 0.0005375443767164579, 0.0018240549110950005] and parameters: {'n_layers': 1, 'embedding_dim': 64, 'lr': 0.014057671404838507, 'lambda_val': 5.568179936195729e-05, 'batch_size': 2510, 'optimizer': 'RMSprop'}.
2026-06-04 02:44:15,581 - experiment_functions - INFO - Early stopping at epoch 1800. Best Metrics: (0.00432067255109871, 0.0008088284546855115, 0.002388812848698222)
2026-06-04 02:44:15,687 - optuna.study.study - INFO - Trial 126 finished with values: [0.00432067255109871, 0.0008088284546855115, 0.002388812848698222] and parameters: {'n_layers': 1, 'embedding_dim': 96, 'lr': 0.014057671404838507, 'lambda_val': 0.004181259159598131, 'batch_size': 2377, 'optimizer': 'Adam'}.
2026-06-04 02:45:56,353 - experiment_functions - INFO - Early stopping at epoch 2400. Best Metrics: (0.004523801574644319, 0.0008356219438676402, 0.0024980581696308125)
2026-06-04 02:45:56,507 - optuna.study.study - INFO - Trial 127 finished with values: [0.004523801574644319, 0.0008356219438676402, 0.0024980581696308125] and parameters: {'n_layers': 1, 'embedding_dim': 256, 'lr': 0.028959132035735552, 'lambda_val': 0.00013240141630371793, 'batch_size': 2817, 'optimizer': 'RMSprop'}.
2026-06-04 02:46:47,010 - experiment_functions - INFO - Early stopping at epoch 1300. Best Metrics: (0.0036342521646386093, 0.0005944805412284815, 0.002133316927361608)
2026-06-04 02:46:47,728 - optuna.study.study - INFO - Trial 128 finished with values: [0.0036342521646386093, 0.0005944805412284815, 0.002133316927361608] and parameters: {'n_layers': 1, 'embedding_dim': 96, 'lr': 0.0008589356470438068, 'lambda_val': 0.01026021876459957, 'batch_size': 2901, 'optimizer': 'RMSprop'}.
2026-06-04 02:47:18,936 - experiment_functions - INFO - Early stopping at epoch 600. Best Metrics: (0.005750998979593573, 0.0010549936365463193, 0.0032617202377983193)
2026-06-04 02:47:19,142 - optuna.study.study - INFO - Trial 129 finished with values: [0.005750998979593573, 0.0010549936365463193, 0.0032617202377983193] and parameters: {'n_layers': 3, 'embedding_dim': 256, 'lr': 0.005091659899861729, 'lambda_val': 8.472875869813855e-05, 'batch_size': 1158, 'optimizer': 'RMSprop'}.
2026-06-04 02:47:55,262 - experiment_functions - INFO - Early stopping at epoch 950. Best Metrics: (0.004413756327390456, 0.0007267733940652422, 0.00240779080232179)
2026-06-04 02:47:55,704 - optuna.study.study - INFO - Trial 130 finished with values: [0.004413756327390456, 0.0007267733940652422, 0.00240779080232179] and parameters: {'n_layers': 1, 'embedding_dim': 32, 'lr': 0.004277274112037138, 'lambda_val': 4.3043355166166714e-05, 'batch_size': 1526, 'optimizer': 'RMSprop'}.
2026-06-04 02:48:55,458 - experiment_functions - INFO - Early stopping at epoch 1450. Best Metrics: (0.004379366805075145, 0.0008389711300154062, 0.002554281359333046)
2026-06-04 02:48:55,586 - optuna.study.study - INFO - Trial 131 finished with values: [0.004379366805075145, 0.0008389711300154062, 0.002554281359333046] and parameters: {'n_layers': 2, 'embedding_dim': 128, 'lr': 0.0006097425316287412, 'lambda_val': 0.05381780508719268, 'batch_size': 3910, 'optimizer': 'RMSprop'}.
2026-06-04 02:49:31,631 - experiment_functions - INFO - Early stopping at epoch 750. Best Metrics: (0.004492631596135168, 0.0008439949092370554, 0.002551723003124163)
2026-06-04 02:49:31,854 - optuna.study.study - INFO - Trial 132 finished with values: [0.004492631596135168, 0.0008439949092370554, 0.002551723003124163] and parameters: {'n_layers': 2, 'embedding_dim': 256, 'lr': 0.009270963217244401, 'lambda_val': 0.0061198056787206455, 'batch_size': 1296, 'optimizer': 'Adam'}.
2026-06-04 02:50:17,774 - experiment_functions - INFO - Early stopping at epoch 850. Best Metrics: (0.006880165625058094, 0.0012676669569294662, 0.0039484654775225605)
2026-06-04 02:50:18,637 - optuna.study.study - INFO - Trial 133 finished with values: [0.006880165625058094, 0.0012676669569294662, 0.0039484654775225605] and parameters: {'n_layers': 4, 'embedding_dim': 256, 'lr': 0.0009744505282133616, 'lambda_val': 0.0009333372636037136, 'batch_size': 3929, 'optimizer': 'Adam'}.
2026-06-04 02:50:42,049 - experiment_functions - INFO - Early stopping at epoch 550. Best Metrics: (0.003940949540660949, 0.0006882577533659321, 0.00229909266079143)
2026-06-04 02:50:42,160 - optuna.study.study - INFO - Trial 134 finished with values: [0.003940949540660949, 0.0006882577533659321, 0.00229909266079143] and parameters: {'n_layers': 3, 'embedding_dim': 64, 'lr': 0.02841103786793073, 'lambda_val': 5.6114562068405035e-05, 'batch_size': 1720, 'optimizer': 'RMSprop'}.
2026-06-04 02:51:36,398 - experiment_functions - INFO - Early stopping at epoch 1400. Best Metrics: (0.004250040590049998, 0.0008155268269810437, 0.0024329221472633544)
2026-06-04 02:51:37,174 - optuna.study.study - INFO - Trial 135 finished with values: [0.004250040590049998, 0.0008155268269810437, 0.0024329221472633544] and parameters: {'n_layers': 1, 'embedding_dim': 96, 'lr': 0.014057671404838507, 'lambda_val': 0.006861251862596191, 'batch_size': 2844, 'optimizer': 'Adam'}.
2026-06-04 02:52:08,582 - experiment_functions - INFO - Early stopping at epoch 600. Best Metrics: (0.004740384638078013, 0.0009093040391184941, 0.002872508046644084)
2026-06-04 02:52:09,163 - optuna.study.study - INFO - Trial 136 finished with values: [0.004740384638078013, 0.0009093040391184941, 0.002872508046644084] and parameters: {'n_layers': 3, 'embedding_dim': 256, 'lr': 0.005091659899861729, 'lambda_val': 0.006861251862596191, 'batch_size': 1158, 'optimizer': 'Adam'}.
2026-06-04 02:52:40,442 - experiment_functions - INFO - Early stopping at epoch 750. Best Metrics: (0.004463580367621874, 0.0006614642641838034, 0.0025734795211851485)
2026-06-04 02:52:41,468 - optuna.study.study - INFO - Trial 137 finished with values: [0.004463580367621874, 0.0006614642641838034, 0.0025734795211851485] and parameters: {'n_layers': 1, 'embedding_dim': 128, 'lr': 0.00832134173144575, 'lambda_val': 0.00026012148846087845, 'batch_size': 2973, 'optimizer': 'Adam'}.
2026-06-04 02:53:09,025 - experiment_functions - INFO - Early stopping at epoch 600. Best Metrics: (0.0065346096738663605, 0.0011588184071270682, 0.003768684607500457)
2026-06-04 02:53:09,131 - optuna.study.study - INFO - Trial 138 finished with values: [0.0065346096738663605, 0.0011588184071270682, 0.003768684607500457] and parameters: {'n_layers': 3, 'embedding_dim': 128, 'lr': 0.010519255162305941, 'lambda_val': 1.9870285249823955e-06, 'batch_size': 1943, 'optimizer': 'Adam'}.
2026-06-04 02:53:36,938 - experiment_functions - INFO - Early stopping at epoch 500. Best Metrics: (0.003980729460115428, 0.0006413691472972068, 0.002260261189405455)
2026-06-04 02:53:37,131 - optuna.study.study - INFO - Trial 139 finished with values: [0.003980729460115428, 0.0006413691472972068, 0.002260261189405455] and parameters: {'n_layers': 4, 'embedding_dim': 256, 'lr': 0.05854985506515562, 'lambda_val': 0.00010272437837201803, 'batch_size': 3212, 'optimizer': 'RMSprop'}.
2026-06-04 02:54:10,574 - experiment_functions - INFO - Early stopping at epoch 800. Best Metrics: (0.008365972233165228, 0.0014920624288297945, 0.004702811751745206)
2026-06-04 02:54:10,684 - optuna.study.study - INFO - Trial 140 finished with values: [0.008365972233165228, 0.0014920624288297945, 0.004702811751745206] and parameters: {'n_layers': 4, 'embedding_dim': 64, 'lr': 0.0036679476641700757, 'lambda_val': 0.00015132695924103293, 'batch_size': 870, 'optimizer': 'RMSprop'}.
2026-06-04 02:54:39,234 - experiment_functions - INFO - Early stopping at epoch 550. Best Metrics: (0.004367851783657445, 0.0007803603724294997, 0.0026515720802342485)
2026-06-04 02:54:39,929 - optuna.study.study - INFO - Trial 141 finished with values: [0.004367851783657445, 0.0007803603724294997, 0.0026515720802342485] and parameters: {'n_layers': 3, 'embedding_dim': 256, 'lr': 0.02115907509102826, 'lambda_val': 5.6114562068405035e-05, 'batch_size': 3984, 'optimizer': 'RMSprop'}.
2026-06-04 02:55:12,850 - experiment_functions - INFO - Early stopping at epoch 600. Best Metrics: (0.007670508262281336, 0.0013614441690669168, 0.004156523695015099)
2026-06-04 02:55:12,959 - optuna.study.study - INFO - Trial 142 finished with values: [0.007670508262281336, 0.0013614441690669168, 0.004156523695015099] and parameters: {'n_layers': 4, 'embedding_dim': 256, 'lr': 0.0036679476641700757, 'lambda_val': 0.00014816809310452117, 'batch_size': 679, 'optimizer': 'RMSprop'}.
2026-06-04 02:55:35,645 - experiment_functions - INFO - Early stopping at epoch 550. Best Metrics: (0.0051779132235253746, 0.0008506932815325876, 0.0028955977808352885)
2026-06-04 02:55:35,751 - optuna.study.study - INFO - Trial 143 finished with values: [0.0051779132235253746, 0.0008506932815325876, 0.0028955977808352885] and parameters: {'n_layers': 3, 'embedding_dim': 32, 'lr': 0.01099734275168188, 'lambda_val': 0.0001888631680612503, 'batch_size': 1752, 'optimizer': 'RMSprop'}.
2026-06-04 02:55:57,916 - experiment_functions - INFO - Early stopping at epoch 500. Best Metrics: (0.00032587180547371186, 5.526157143814054e-05, 0.0001665541567538235)
2026-06-04 02:55:58,443 - optuna.study.study - INFO - Trial 144 finished with values: [0.00032587180547371186, 5.526157143814054e-05, 0.0001665541567538235] and parameters: {'n_layers': 2, 'embedding_dim': 128, 'lr': 0.00015842116483563462, 'lambda_val': 0.0016415700559882936, 'batch_size': 4069, 'optimizer': 'SGD'}.
2026-06-04 02:56:45,850 - experiment_functions - INFO - Early stopping at epoch 1050. Best Metrics: (0.009555516376742092, 0.0017298546453211867, 0.005577896866288394)
2026-06-04 02:56:46,092 - optuna.study.study - INFO - Trial 145 finished with values: [0.009555516376742092, 0.0017298546453211867, 0.005577896866288394] and parameters: {'n_layers': 4, 'embedding_dim': 128, 'lr': 0.0008797904665419303, 'lambda_val': 8.472875869813855e-05, 'batch_size': 3163, 'optimizer': 'RMSprop'}.
2026-06-04 02:59:47,142 - optuna.study.study - INFO - Trial 146 finished with values: [0.0029670545322298806, 0.0004286958269140599, 0.001708540373296173] and parameters: {'n_layers': 2, 'embedding_dim': 256, 'lr': 0.00018699804446629579, 'lambda_val': 0.00024542430177600983, 'batch_size': 3566, 'optimizer': 'Adam'}.
2026-06-04 03:00:07,634 - experiment_functions - INFO - Early stopping at epoch 500. Best Metrics: (0.0005065350384581063, 7.2007502176971e-05, 0.00022681387157163948)
2026-06-04 03:00:07,833 - optuna.study.study - INFO - Trial 147 finished with values: [0.0005065350384581063, 7.2007502176971e-05, 0.00022681387157163948] and parameters: {'n_layers': 1, 'embedding_dim': 64, 'lr': 0.0018324539902739038, 'lambda_val': 0.0009333372636037136, 'batch_size': 3299, 'optimizer': 'SGD'}.
2026-06-04 03:00:33,261 - experiment_functions - INFO - Early stopping at epoch 600. Best Metrics: (0.005171687835505186, 0.000937772121374506, 0.003092565622849853)
2026-06-04 03:00:34,409 - optuna.study.study - INFO - Trial 148 finished with values: [0.005171687835505186, 0.000937772121374506, 0.003092565622849853] and parameters: {'n_layers': 3, 'embedding_dim': 64, 'lr': 0.009270963217244401, 'lambda_val': 0.0037563821735760064, 'batch_size': 1296, 'optimizer': 'Adam'}.
2026-06-04 03:03:00,996 - optuna.study.study - INFO - Trial 149 finished with values: [0.002731353793832572, 0.00046218768839172077, 0.0015950583395683087] and parameters: {'n_layers': 1, 'embedding_dim': 64, 'lr': 0.00048227122681830187, 'lambda_val': 0.09611353650854988, 'batch_size': 2377, 'optimizer': 'RMSprop'}.
2026-06-04 03:03:32,449 - experiment_functions - INFO - Early stopping at epoch 600. Best Metrics: (0.006497852615925283, 0.0012140799785652088, 0.0036056191396255342)
2026-06-04 03:03:32,850 - optuna.study.study - INFO - Trial 150 finished with values: [0.006497852615925283, 0.0012140799785652088, 0.0036056191396255342] and parameters: {'n_layers': 3, 'embedding_dim': 256, 'lr': 0.0036679476641700757, 'lambda_val': 0.00014816809310452117, 'batch_size': 1943, 'optimizer': 'RMSprop'}.
2026-06-04 03:04:40,010 - experiment_functions - INFO - Early stopping at epoch 1800. Best Metrics: (0.005240308618457056, 0.0008121776408332776, 0.0029643812911767887)
2026-06-04 03:04:40,117 - optuna.study.study - INFO - Trial 151 finished with values: [0.005240308618457056, 0.0008121776408332776, 0.0029643812911767887] and parameters: {'n_layers': 2, 'embedding_dim': 32, 'lr': 0.0008797904665419303, 'lambda_val': 2.2435960383986775e-06, 'batch_size': 3931, 'optimizer': 'Adam'}.
2026-06-04 03:07:31,691 - optuna.study.study - INFO - Trial 152 finished with values: [0.0058305399777502384, 0.0009896845066648804, 0.0035409826425019646] and parameters: {'n_layers': 4, 'embedding_dim': 128, 'lr': 0.00018228254500282214, 'lambda_val': 2.6963455125652685e-06, 'batch_size': 3212, 'optimizer': 'RMSprop'}.
2026-06-04 03:08:53,129 - experiment_functions - INFO - Early stopping at epoch 2200. Best Metrics: (0.005514844144478406, 0.0009009310737490789, 0.0030261021662823053)
2026-06-04 03:08:53,246 - optuna.study.study - INFO - Trial 153 finished with values: [0.005514844144478406, 0.0009009310737490789, 0.0030261021662823053] and parameters: {'n_layers': 2, 'embedding_dim': 32, 'lr': 0.0007463197710430186, 'lambda_val': 0.0016415700559882936, 'batch_size': 4069, 'optimizer': 'Adam'}.
2026-06-04 03:10:03,835 - experiment_functions - INFO - Early stopping at epoch 1350. Best Metrics: (0.006279310309015379, 0.0012458972469689866, 0.0035829131648668316)
2026-06-04 03:10:04,930 - optuna.study.study - INFO - Trial 154 finished with values: [0.006279310309015379, 0.0012458972469689866, 0.0035829131648668316] and parameters: {'n_layers': 4, 'embedding_dim': 256, 'lr': 0.0006097425316287412, 'lambda_val': 0.011676963975868567, 'batch_size': 679, 'optimizer': 'RMSprop'}.
2026-06-04 03:12:54,375 - experiment_functions - INFO - Early stopping at epoch 3800. Best Metrics: (0.0077371848709775915, 0.001406658182061759, 0.004555694732056927)
2026-06-04 03:12:55,013 - optuna.study.study - INFO - Trial 155 finished with values: [0.0077371848709775915, 0.001406658182061759, 0.004555694732056927] and parameters: {'n_layers': 2, 'embedding_dim': 256, 'lr': 0.0006097425316287412, 'lambda_val': 2.6963455125652685e-06, 'batch_size': 2083, 'optimizer': 'RMSprop'}.
2026-06-04 03:13:20,674 - experiment_functions - INFO - Early stopping at epoch 600. Best Metrics: (0.005670701272570093, 0.001051644450398553, 0.0035097112104832983)
2026-06-04 03:13:21,365 - optuna.study.study - INFO - Trial 156 finished with values: [0.005670701272570093, 0.001051644450398553, 0.0035097112104832983] and parameters: {'n_layers': 3, 'embedding_dim': 32, 'lr': 0.01099734275168188, 'lambda_val': 0.000990844149483802, 'batch_size': 1296, 'optimizer': 'Adam'}.
2026-06-04 03:13:54,674 - experiment_functions - INFO - Early stopping at epoch 850. Best Metrics: (0.005643398213749012, 0.0009243753767834416, 0.003136818954679272)
2026-06-04 03:13:54,855 - optuna.study.study - INFO - Trial 157 finished with values: [0.005643398213749012, 0.0009243753767834416, 0.003136818954679272] and parameters: {'n_layers': 2, 'embedding_dim': 32, 'lr': 0.005091659899861729, 'lambda_val': 8.472875869813855e-05, 'batch_size': 1158, 'optimizer': 'RMSprop'}.
2026-06-04 03:14:42,253 - experiment_functions - INFO - Early stopping at epoch 1000. Best Metrics: (0.005318422534476681, 0.0009511688659655705, 0.0032104274028993468)
2026-06-04 03:14:42,362 - optuna.study.study - INFO - Trial 158 finished with values: [0.005318422534476681, 0.0009511688659655705, 0.0032104274028993468] and parameters: {'n_layers': 2, 'embedding_dim': 256, 'lr': 0.01099734275168188, 'lambda_val': 2.2435960383986775e-06, 'batch_size': 2236, 'optimizer': 'Adam'}.
2026-06-04 03:15:22,565 - experiment_functions - INFO - Early stopping at epoch 1050. Best Metrics: (0.005567114867036953, 0.0009913590997387635, 0.0032549273903470393)
2026-06-04 03:15:22,942 - optuna.study.study - INFO - Trial 159 finished with values: [0.005567114867036953, 0.0009913590997387635, 0.0032549273903470393] and parameters: {'n_layers': 2, 'embedding_dim': 32, 'lr': 0.005720533217630053, 'lambda_val': 0.00015132695924103293, 'batch_size': 807, 'optimizer': 'RMSprop'}.
2026-06-04 03:15:46,924 - experiment_functions - INFO - Early stopping at epoch 550. Best Metrics: (0.004786091997530096, 0.0008372965369415233, 0.00290506093056223)
2026-06-04 03:15:47,034 - optuna.study.study - INFO - Trial 160 finished with values: [0.004786091997530096, 0.0008372965369415233, 0.00290506093056223] and parameters: {'n_layers': 3, 'embedding_dim': 64, 'lr': 0.01099734275168188, 'lambda_val': 0.00015132695924103293, 'batch_size': 3163, 'optimizer': 'RMSprop'}.
2026-06-04 03:16:44,219 - experiment_functions - INFO - Early stopping at epoch 1300. Best Metrics: (0.0005228644257870324, 7.870587447250318e-05, 0.00022089753792913638)
2026-06-04 03:16:44,633 - optuna.study.study - INFO - Trial 161 finished with values: [0.0005228644257870324, 7.870587447250318e-05, 0.00022089753792913638] and parameters: {'n_layers': 4, 'embedding_dim': 128, 'lr': 1.119819388514796e-05, 'lambda_val': 8.472875869813855e-05, 'batch_size': 3163, 'optimizer': 'RMSprop'}.
2026-06-04 03:18:34,195 - experiment_functions - INFO - Early stopping at epoch 3000. Best Metrics: (0.006298400097803775, 0.0009578672382611026, 0.0036799009317319232)
