2026-06-04 18:30:11,758 - optuna.study.study - INFO - Trial 102 finished with values: [0.0013251429827007826, 0.00019592738964431641, 0.0006498618415636211] and parameters: {'n_layers': 4, 'embedding_dim': 64, 'lr': 0.00011237919940812166, 'lambda_val': 0.00045954191038052427, 'batch_size': 2296, 'optimizer': 'Adam'}.
2026-06-04 18:30:59,818 - experiment_functions - INFO - Early stopping at epoch 1100. Best Metrics: (0.005196809225527214, 0.0008624154330497691, 0.0030232926629681213)
2026-06-04 18:31:00,356 - optuna.study.study - INFO - Trial 103 finished with values: [0.005196809225527214, 0.0008624154330497691, 0.0030232926629681213] and parameters: {'n_layers': 1, 'embedding_dim': 256, 'lr': 0.0032493879970223157, 'lambda_val': 0.00016262429302101681, 'batch_size': 550, 'optimizer': 'RMSprop'}.
2026-06-04 18:33:37,256 - optuna.study.study - INFO - Trial 104 finished with values: [0.005685696968649026, 0.0009042802598968451, 0.0032783090259564957] and parameters: {'n_layers': 1, 'embedding_dim': 128, 'lr': 0.0011827350330377861, 'lambda_val': 4.619891936036428e-05, 'batch_size': 2067, 'optimizer': 'Adam'}.
2026-06-04 18:34:11,930 - experiment_functions - INFO - Early stopping at epoch 750. Best Metrics: (0.004974288689359145, 0.000828923571572108, 0.0028203422612170788)
2026-06-04 18:34:12,679 - optuna.study.study - INFO - Trial 105 finished with values: [0.004974288689359145, 0.000828923571572108, 0.0028203422612170788] and parameters: {'n_layers': 2, 'embedding_dim': 96, 'lr': 0.007461158555522927, 'lambda_val': 1.6413472527343117e-06, 'batch_size': 4089, 'optimizer': 'Adam'}.
2026-06-04 18:35:43,445 - experiment_functions - INFO - Early stopping at epoch 1950. Best Metrics: (0.005204522122050037, 0.0009947082858865297, 0.003054154826885453)
2026-06-04 18:35:43,816 - optuna.study.study - INFO - Trial 106 finished with values: [0.005204522122050037, 0.0009947082858865297, 0.003054154826885453] and parameters: {'n_layers': 2, 'embedding_dim': 256, 'lr': 0.0010341842506299342, 'lambda_val': 0.00612225365863352, 'batch_size': 550, 'optimizer': 'RMSprop'}.
2026-06-04 18:36:10,213 - experiment_functions - INFO - Early stopping at epoch 650. Best Metrics: (0.004910858633763408, 0.0008021300823899794, 0.002685270202559242)
2026-06-04 18:36:10,531 - optuna.study.study - INFO - Trial 107 finished with values: [0.004910858633763408, 0.0008021300823899794, 0.002685270202559242] and parameters: {'n_layers': 2, 'embedding_dim': 32, 'lr': 0.0032493879970223157, 'lambda_val': 0.003919266573458972, 'batch_size': 2193, 'optimizer': 'RMSprop'}.
2026-06-04 18:38:38,036 - experiment_functions - INFO - Early stopping at epoch 3050. Best Metrics: (0.004985662639484785, 0.0009160024114140264, 0.0027972575050028443)
2026-06-04 18:38:39,129 - optuna.study.study - INFO - Trial 108 finished with values: [0.004985662639484785, 0.0009160024114140264, 0.0027972575050028443] and parameters: {'n_layers': 3, 'embedding_dim': 256, 'lr': 0.00040769039157989535, 'lambda_val': 0.07164786241671743, 'batch_size': 2129, 'optimizer': 'RMSprop'}.
2026-06-04 18:39:14,978 - experiment_functions - INFO - Early stopping at epoch 750. Best Metrics: (0.007231320910540586, 0.0013061825976287762, 0.004040606839954411)
2026-06-04 18:39:15,677 - optuna.study.study - INFO - Trial 109 finished with values: [0.007231320910540586, 0.0013061825976287762, 0.004040606839954411] and parameters: {'n_layers': 3, 'embedding_dim': 128, 'lr': 0.003777254071001523, 'lambda_val': 0.00024523530035259447, 'batch_size': 2067, 'optimizer': 'Adam'}.
2026-06-04 18:39:44,070 - experiment_functions - INFO - Early stopping at epoch 550. Best Metrics: (0.004284961711753791, 0.000787058744725032, 0.0025211256555723095)
2026-06-04 18:39:44,992 - optuna.study.study - INFO - Trial 110 finished with values: [0.004284961711753791, 0.000787058744725032, 0.0025211256555723095] and parameters: {'n_layers': 4, 'embedding_dim': 96, 'lr': 0.015015785154943912, 'lambda_val': 0.00171283194050491, 'batch_size': 2219, 'optimizer': 'RMSprop'}.
2026-06-04 18:40:11,842 - experiment_functions - INFO - Early stopping at epoch 550. Best Metrics: (0.004506580016737274, 0.0008238997923504588, 0.0025740566734852068)
2026-06-04 18:40:12,303 - optuna.study.study - INFO - Trial 111 finished with values: [0.004506580016737274, 0.0008238997923504588, 0.0025740566734852068] and parameters: {'n_layers': 4, 'embedding_dim': 64, 'lr': 0.014970226258122101, 'lambda_val': 0.0007827624692138454, 'batch_size': 791, 'optimizer': 'RMSprop'}.
2026-06-04 18:40:43,868 - experiment_functions - INFO - Early stopping at epoch 550. Best Metrics: (0.005943754416406938, 0.001080112532654565, 0.003469298256568537)
2026-06-04 18:40:44,338 - optuna.study.study - INFO - Trial 112 finished with values: [0.005943754416406938, 0.001080112532654565, 0.003469298256568537] and parameters: {'n_layers': 3, 'embedding_dim': 256, 'lr': 0.005575824047051625, 'lambda_val': 0.00016262429302101681, 'batch_size': 2180, 'optimizer': 'RMSprop'}.
2026-06-04 18:41:22,196 - experiment_functions - INFO - Early stopping at epoch 850. Best Metrics: (0.010193760805944306, 0.0017382276106906022, 0.005786849632238073)
2026-06-04 18:41:23,325 - optuna.study.study - INFO - Trial 113 finished with values: [0.010193760805944306, 0.0017382276106906022, 0.005786849632238073] and parameters: {'n_layers': 4, 'embedding_dim': 64, 'lr': 0.0038915436873682946, 'lambda_val': 1.6413472527343117e-06, 'batch_size': 791, 'optimizer': 'Adam'}.
2026-06-04 18:41:56,964 - experiment_functions - INFO - Early stopping at epoch 700. Best Metrics: (0.006943816269022771, 0.001224127537008507, 0.003919137673141324)
2026-06-04 18:41:57,655 - optuna.study.study - INFO - Trial 114 finished with values: [0.006943816269022771, 0.001224127537008507, 0.003919137673141324] and parameters: {'n_layers': 3, 'embedding_dim': 96, 'lr': 0.004869110805383165, 'lambda_val': 0.00016262429302101681, 'batch_size': 2193, 'optimizer': 'Adam'}.
2026-06-04 18:45:13,980 - optuna.study.study - INFO - Trial 115 finished with values: [0.007263483063006769, 0.0013580949829191508, 0.004206042624425625] and parameters: {'n_layers': 3, 'embedding_dim': 256, 'lr': 0.00040769039157989535, 'lambda_val': 3.8631777865125085e-06, 'batch_size': 2129, 'optimizer': 'Adam'}.
2026-06-04 18:45:39,947 - experiment_functions - INFO - Early stopping at epoch 550. Best Metrics: (0.0048558844764842405, 0.0007803603724294997, 0.0028740677194576997)
2026-06-04 18:45:40,225 - optuna.study.study - INFO - Trial 116 finished with values: [0.0048558844764842405, 0.0007803603724294997, 0.0028740677194576997] and parameters: {'n_layers': 2, 'embedding_dim': 64, 'lr': 0.009069256619070064, 'lambda_val': 3.61928423516103e-05, 'batch_size': 1469, 'optimizer': 'RMSprop'}.
2026-06-04 18:46:54,889 - experiment_functions - INFO - Early stopping at epoch 1700. Best Metrics: (0.007652845397690696, 0.001404983588987876, 0.004380250666664771)
2026-06-04 18:46:55,227 - optuna.study.study - INFO - Trial 117 finished with values: [0.007652845397690696, 0.001404983588987876, 0.004380250666664771] and parameters: {'n_layers': 4, 'embedding_dim': 96, 'lr': 0.0007307808528773397, 'lambda_val': 3.61928423516103e-05, 'batch_size': 3889, 'optimizer': 'Adam'}.
2026-06-04 18:47:22,660 - experiment_functions - INFO - Early stopping at epoch 550. Best Metrics: (0.005981480359240479, 0.001076763346506799, 0.003375100632923911)
2026-06-04 18:47:22,934 - optuna.study.study - INFO - Trial 118 finished with values: [0.005981480359240479, 0.001076763346506799, 0.003375100632923911] and parameters: {'n_layers': 4, 'embedding_dim': 64, 'lr': 0.02827896378992597, 'lambda_val': 4.633766555970088e-05, 'batch_size': 791, 'optimizer': 'Adam'}.
2026-06-04 18:50:04,237 - optuna.study.study - INFO - Trial 119 finished with values: [0.014810015484102186, 0.002657579208252395, 0.00902390290178067] and parameters: {'n_layers': 4, 'embedding_dim': 64, 'lr': 0.0007307808528773397, 'lambda_val': 3.61928423516103e-05, 'batch_size': 516, 'optimizer': 'RMSprop'}.
2026-06-04 18:52:59,469 - optuna.study.study - INFO - Trial 120 finished with values: [0.007517725801336495, 0.0013647933552146828, 0.004398728650328236] and parameters: {'n_layers': 4, 'embedding_dim': 128, 'lr': 0.00022150750424668007, 'lambda_val': 0.005255002744531624, 'batch_size': 3356, 'optimizer': 'RMSprop'}.
2026-06-04 18:53:24,162 - experiment_functions - INFO - Early stopping at epoch 500. Best Metrics: (0.0005212768666170459, 7.033290910308795e-05, 0.00024248983601027446)
2026-06-04 18:53:24,672 - optuna.study.study - INFO - Trial 121 finished with values: [0.0005212768666170459, 7.033290910308795e-05, 0.00024248983601027446] and parameters: {'n_layers': 3, 'embedding_dim': 64, 'lr': 0.00040769039157989535, 'lambda_val': 1.4027085340382974e-05, 'batch_size': 2129, 'optimizer': 'SGD'}.
2026-06-04 18:53:49,710 - experiment_functions - INFO - Early stopping at epoch 550. Best Metrics: (0.006292305227426182, 0.0011136043941322258, 0.0037449806811838122)
2026-06-04 18:53:50,074 - optuna.study.study - INFO - Trial 122 finished with values: [0.006292305227426182, 0.0011136043941322258, 0.0037449806811838122] and parameters: {'n_layers': 4, 'embedding_dim': 32, 'lr': 0.014232768730502419, 'lambda_val': 4.633766555970088e-05, 'batch_size': 2067, 'optimizer': 'Adam'}.
2026-06-04 18:55:37,328 - experiment_functions - INFO - Early stopping at epoch 2700. Best Metrics: (0.0045406857289917255, 0.0008456695023109385, 0.0024603886432823683)
2026-06-04 18:55:37,788 - optuna.study.study - INFO - Trial 123 finished with values: [0.0045406857289917255, 0.0008456695023109385, 0.0024603886432823683] and parameters: {'n_layers': 1, 'embedding_dim': 128, 'lr': 0.020299600929016177, 'lambda_val': 0.004078312210980698, 'batch_size': 1107, 'optimizer': 'Adam'}.
2026-06-04 18:56:27,540 - experiment_functions - INFO - Early stopping at epoch 1100. Best Metrics: (0.004076598277750667, 0.0007753365932078504, 0.002183920267117991)
2026-06-04 18:56:28,204 - optuna.study.study - INFO - Trial 124 finished with values: [0.004076598277750667, 0.0007753365932078504, 0.002183920267117991] and parameters: {'n_layers': 4, 'embedding_dim': 96, 'lr': 0.01756884378995446, 'lambda_val': 0.0027236312311982006, 'batch_size': 2067, 'optimizer': 'RMSprop'}.
2026-06-04 18:59:23,966 - optuna.study.study - INFO - Trial 125 finished with values: [0.007090881712153658, 0.0012542702123384019, 0.00425227173711566] and parameters: {'n_layers': 4, 'embedding_dim': 128, 'lr': 0.000217189797847865, 'lambda_val': 2.344534953461632e-06, 'batch_size': 2546, 'optimizer': 'RMSprop'}.
2026-06-04 19:01:32,169 - experiment_functions - INFO - Early stopping at epoch 3000. Best Metrics: (0.004812751506276155, 0.0008892089222318977, 0.0026255644130591714)
2026-06-04 19:01:32,483 - optuna.study.study - INFO - Trial 126 finished with values: [0.004812751506276155, 0.0008892089222318977, 0.0026255644130591714] and parameters: {'n_layers': 1, 'embedding_dim': 256, 'lr': 0.004846510423333318, 'lambda_val': 0.0020309213067852203, 'batch_size': 4024, 'optimizer': 'Adam'}.
2026-06-04 19:02:04,520 - experiment_functions - INFO - Early stopping at epoch 550. Best Metrics: (0.004985594978018923, 0.0008423203161631723, 0.0029012921072591514)
2026-06-04 19:02:04,939 - optuna.study.study - INFO - Trial 127 finished with values: [0.004985594978018923, 0.0008423203161631723, 0.0029012921072591514] and parameters: {'n_layers': 3, 'embedding_dim': 256, 'lr': 0.028281424759837182, 'lambda_val': 7.708708921742085e-06, 'batch_size': 2193, 'optimizer': 'RMSprop'}.
2026-06-04 19:02:36,228 - experiment_functions - INFO - Early stopping at epoch 700. Best Metrics: (0.005411849479331165, 0.00093442293522674, 0.0032512674796067805)
2026-06-04 19:02:36,498 - optuna.study.study - INFO - Trial 128 finished with values: [0.005411849479331165, 0.00093442293522674, 0.0032512674796067805] and parameters: {'n_layers': 2, 'embedding_dim': 64, 'lr': 0.0038915436873682946, 'lambda_val': 3.61928423516103e-05, 'batch_size': 3398, 'optimizer': 'RMSprop'}.
2026-06-04 19:04:02,454 - experiment_functions - INFO - Early stopping at epoch 1950. Best Metrics: (0.004546706862909035, 0.0008506932815325876, 0.002531724170656421)
2026-06-04 19:04:03,766 - optuna.study.study - INFO - Trial 129 finished with values: [0.004546706862909035, 0.0008506932815325876, 0.002531724170656421] and parameters: {'n_layers': 1, 'embedding_dim': 256, 'lr': 0.004846510423333318, 'lambda_val': 0.003566951312101301, 'batch_size': 3322, 'optimizer': 'Adam'}.
2026-06-04 19:04:29,526 - experiment_functions - INFO - Early stopping at epoch 550. Best Metrics: (0.005817994603468627, 0.00097293857592605, 0.0033419483492107675)
2026-06-04 19:04:29,782 - optuna.study.study - INFO - Trial 130 finished with values: [0.005817994603468627, 0.00097293857592605, 0.0033419483492107675] and parameters: {'n_layers': 4, 'embedding_dim': 96, 'lr': 0.045292257364849445, 'lambda_val': 5.520510971299447e-06, 'batch_size': 1336, 'optimizer': 'Adam'}.
2026-06-04 19:05:00,488 - experiment_functions - INFO - Early stopping at epoch 650. Best Metrics: (0.00681137913556654, 0.0011688659655703666, 0.004050745101023651)
2026-06-04 19:05:00,972 - optuna.study.study - INFO - Trial 131 finished with values: [0.00681137913556654, 0.0011688659655703666, 0.004050745101023651] and parameters: {'n_layers': 3, 'embedding_dim': 64, 'lr': 0.004846510423333318, 'lambda_val': 3.8631777865125085e-06, 'batch_size': 3322, 'optimizer': 'Adam'}.
2026-06-04 19:06:05,646 - experiment_functions - INFO - Early stopping at epoch 1350. Best Metrics: (0.0042648559777050616, 0.0007602652555429031, 0.002352201571223918)
2026-06-04 19:06:05,966 - optuna.study.study - INFO - Trial 132 finished with values: [0.0042648559777050616, 0.0007602652555429031, 0.002352201571223918] and parameters: {'n_layers': 2, 'embedding_dim': 256, 'lr': 0.020299600929016177, 'lambda_val': 0.004078312210980698, 'batch_size': 1265, 'optimizer': 'RMSprop'}.
2026-06-04 19:06:44,053 - experiment_functions - INFO - Early stopping at epoch 850. Best Metrics: (0.008677280473243839, 0.0015540223725634672, 0.0049221131064178135)
2026-06-04 19:06:44,729 - optuna.study.study - INFO - Trial 133 finished with values: [0.008677280473243839, 0.0015540223725634672, 0.0049221131064178135] and parameters: {'n_layers': 4, 'embedding_dim': 64, 'lr': 0.0018624775153074351, 'lambda_val': 3.61928423516103e-05, 'batch_size': 3398, 'optimizer': 'RMSprop'}.
2026-06-04 19:07:58,666 - experiment_functions - INFO - Early stopping at epoch 1850. Best Metrics: (0.007954762325886244, 0.0013781900998057475, 0.004805449499031827)
2026-06-04 19:07:59,936 - optuna.study.study - INFO - Trial 134 finished with values: [0.007954762325886244, 0.0013781900998057475, 0.004805449499031827] and parameters: {'n_layers': 2, 'embedding_dim': 64, 'lr': 0.0011827350330377861, 'lambda_val': 2.344534953461632e-06, 'batch_size': 1621, 'optimizer': 'RMSprop'}.
2026-06-04 19:08:32,113 - experiment_functions - INFO - Early stopping at epoch 750. Best Metrics: (0.004466039366884202, 0.0007100274633264116, 0.0025487183491085556)
2026-06-04 19:08:32,704 - optuna.study.study - INFO - Trial 135 finished with values: [0.004466039366884202, 0.0007100274633264116, 0.0025487183491085556] and parameters: {'n_layers': 1, 'embedding_dim': 64, 'lr': 0.003020999848042007, 'lambda_val': 0.0015000126802708358, 'batch_size': 1575, 'optimizer': 'RMSprop'}.
2026-06-04 19:09:05,646 - experiment_functions - INFO - Early stopping at epoch 750. Best Metrics: (0.006486829886717119, 0.00107173956728515, 0.0036494099602453504)
2026-06-04 19:09:06,622 - optuna.study.study - INFO - Trial 136 finished with values: [0.006486829886717119, 0.00107173956728515, 0.0036494099602453504] and parameters: {'n_layers': 2, 'embedding_dim': 64, 'lr': 0.0032493879970223157, 'lambda_val': 0.00016806129938668377, 'batch_size': 2193, 'optimizer': 'RMSprop'}.
2026-06-04 19:09:41,266 - experiment_functions - INFO - Early stopping at epoch 750. Best Metrics: (0.007970222969618485, 0.0014602451604260162, 0.004563730763655663)
2026-06-04 19:09:42,088 - optuna.study.study - INFO - Trial 137 finished with values: [0.007970222969618485, 0.0014602451604260162, 0.004563730763655663] and parameters: {'n_layers': 4, 'embedding_dim': 64, 'lr': 0.0011827350330377861, 'lambda_val': 0.005255002744531624, 'batch_size': 2193, 'optimizer': 'RMSprop'}.
2026-06-04 19:12:16,092 - optuna.study.study - INFO - Trial 138 finished with values: [0.004828716096577286, 0.0007652890347645523, 0.0027268774815618524] and parameters: {'n_layers': 1, 'embedding_dim': 128, 'lr': 0.0007307808528773397, 'lambda_val': 3.61928423516103e-05, 'batch_size': 1107, 'optimizer': 'Adam'}.
2026-06-04 19:13:45,724 - experiment_functions - INFO - Early stopping at epoch 2250. Best Metrics: (0.0043795189624165985, 0.0008138522339071606, 0.0024557705567933436)
2026-06-04 19:13:46,502 - optuna.study.study - INFO - Trial 139 finished with values: [0.0043795189624165985, 0.0008138522339071606, 0.0024557705567933436] and parameters: {'n_layers': 1, 'embedding_dim': 128, 'lr': 0.005575824047051625, 'lambda_val': 0.0015000126802708358, 'batch_size': 2679, 'optimizer': 'RMSprop'}.
2026-06-04 19:14:44,221 - experiment_functions - INFO - Early stopping at epoch 1500. Best Metrics: (0.006053710652575823, 0.0009126532252662604, 0.003386551288482181)
2026-06-04 19:14:45,390 - optuna.study.study - INFO - Trial 140 finished with values: [0.006053710652575823, 0.0009126532252662604, 0.003386551288482181] and parameters: {'n_layers': 1, 'embedding_dim': 64, 'lr': 0.0011827350330377861, 'lambda_val': 0.0010139778593023846, 'batch_size': 1575, 'optimizer': 'RMSprop'}.
2026-06-04 19:17:16,048 - optuna.study.study - INFO - Trial 141 finished with values: [0.0005073171693008274, 9.545180521133365e-05, 0.00023727256802526906] and parameters: {'n_layers': 1, 'embedding_dim': 96, 'lr': 0.00012587599470514546, 'lambda_val': 0.00016262429302101681, 'batch_size': 550, 'optimizer': 'RMSprop'}.
2026-06-04 19:18:27,850 - experiment_functions - INFO - Early stopping at epoch 1650. Best Metrics: (0.004082007022324917, 0.0007736620001339675, 0.0022300856674320716)
2026-06-04 19:18:28,270 - optuna.study.study - INFO - Trial 142 finished with values: [0.004082007022324917, 0.0007736620001339675, 0.0022300856674320716] and parameters: {'n_layers': 3, 'embedding_dim': 128, 'lr': 0.020299600929016177, 'lambda_val': 0.004078312210980698, 'batch_size': 1107, 'optimizer': 'RMSprop'}.
2026-06-04 19:18:56,858 - experiment_functions - INFO - Early stopping at epoch 550. Best Metrics: (0.0074092397178764195, 0.0013497220175497356, 0.004121486218642203)
2026-06-04 19:18:58,693 - optuna.study.study - INFO - Trial 143 finished with values: [0.0074092397178764195, 0.0013497220175497356, 0.004121486218642203] and parameters: {'n_layers': 4, 'embedding_dim': 128, 'lr': 0.004869110805383165, 'lambda_val': 3.61928423516103e-05, 'batch_size': 2067, 'optimizer': 'RMSprop'}.
2026-06-04 19:21:36,455 - optuna.study.study - INFO - Trial 144 finished with values: [0.006733783763137708, 0.0010315493335119566, 0.004042404670137853] and parameters: {'n_layers': 2, 'embedding_dim': 96, 'lr': 0.00040769039157989535, 'lambda_val': 0.0007214277903221163, 'batch_size': 2180, 'optimizer': 'RMSprop'}.
2026-06-04 19:23:49,597 - experiment_functions - INFO - Early stopping at epoch 3650. Best Metrics: (0.003143647836789595, 0.000612901065041195, 0.0018392751579577647)
2026-06-04 19:23:49,879 - optuna.study.study - INFO - Trial 145 finished with values: [0.003143647836789595, 0.000612901065041195, 0.0018392751579577647] and parameters: {'n_layers': 1, 'embedding_dim': 32, 'lr': 0.020299600929016177, 'lambda_val': 0.004078312210980698, 'batch_size': 1107, 'optimizer': 'RMSprop'}.
2026-06-04 19:24:21,775 - experiment_functions - INFO - Early stopping at epoch 750. Best Metrics: (0.005317082934563195, 0.0008791613637885993, 0.0031057162193423153)
2026-06-04 19:24:22,143 - optuna.study.study - INFO - Trial 146 finished with values: [0.005317082934563195, 0.0008791613637885993, 0.0031057162193423153] and parameters: {'n_layers': 2, 'embedding_dim': 32, 'lr': 0.004869110805383165, 'lambda_val': 1.3926192188434668e-05, 'batch_size': 1731, 'optimizer': 'RMSprop'}.
2026-06-04 19:27:10,009 - optuna.study.study - INFO - Trial 147 finished with values: [0.0014050669492929812, 0.00023611762341750958, 0.0007299929542627728] and parameters: {'n_layers': 1, 'embedding_dim': 256, 'lr': 0.0001615571289794213, 'lambda_val': 2.344534953461632e-06, 'batch_size': 2129, 'optimizer': 'RMSprop'}.
2026-06-04 19:27:37,803 - experiment_functions - INFO - Early stopping at epoch 600. Best Metrics: (0.007129621351735921, 0.0013195793422198408, 0.00424650557704636)
2026-06-04 19:27:38,658 - optuna.study.study - INFO - Trial 148 finished with values: [0.007129621351735921, 0.0013195793422198408, 0.00424650557704636] and parameters: {'n_layers': 4, 'embedding_dim': 64, 'lr': 0.0032493879970223157, 'lambda_val': 0.00016806129938668377, 'batch_size': 3398, 'optimizer': 'RMSprop'}.
2026-06-04 19:28:06,883 - experiment_functions - INFO - Early stopping at epoch 500. Best Metrics: (0.00329249318003642, 0.000572710831268002, 0.001997452455265362)
2026-06-04 19:28:07,849 - optuna.study.study - INFO - Trial 149 finished with values: [0.00329249318003642, 0.000572710831268002, 0.001997452455265362] and parameters: {'n_layers': 3, 'embedding_dim': 256, 'lr': 0.06428015028659323, 'lambda_val': 0.00016262429302101681, 'batch_size': 1776, 'optimizer': 'RMSprop'}.
2026-06-04 19:29:33,322 - experiment_functions - INFO - Early stopping at epoch 2100. Best Metrics: (0.009487797032880906, 0.0017164579007301227, 0.005473301510406947)
