2026-06-05 04:34:59,966 - optuna.study.study - INFO - Trial 245 finished with values: [0.06952311191203982, 0.009176770044879094, 0.040122978382208706] and parameters: {'n_layers': 1, 'embedding_dim': 256, 'lr': 0.0003278860610242573, 'lambda_val': 2.061360640875514e-06, 'batch_size': 2859, 'optimizer': 'RMSprop'}.
2026-06-05 04:35:21,494 - experiment_functions - INFO - Early stopping at epoch 500. Best Metrics: (0.0005710349804825433, 8.205506062026927e-05, 0.0002371339131302512)
2026-06-05 04:35:22,142 - optuna.study.study - INFO - Trial 246 finished with values: [0.0005710349804825433, 8.205506062026927e-05, 0.0002371339131302512] and parameters: {'n_layers': 2, 'embedding_dim': 64, 'lr': 0.0039548374396807095, 'lambda_val': 1.6669472887970978e-05, 'batch_size': 2242, 'optimizer': 'SGD'}.
2026-06-05 04:36:24,010 - experiment_functions - INFO - Early stopping at epoch 1400. Best Metrics: (0.012386227158413633, 0.0016829660392524617, 0.00604140501920723)
2026-06-05 04:36:24,144 - optuna.study.study - INFO - Trial 247 finished with values: [0.012386227158413633, 0.0016829660392524617, 0.00604140501920723] and parameters: {'n_layers': 3, 'embedding_dim': 96, 'lr': 0.0007432804052483335, 'lambda_val': 0.019774838946689837, 'batch_size': 1064, 'optimizer': 'RMSprop'}.
2026-06-05 04:39:50,869 - optuna.study.study - INFO - Trial 248 finished with values: [0.06447305712284304, 0.008436599906222787, 0.03558243443160378] and parameters: {'n_layers': 2, 'embedding_dim': 256, 'lr': 0.0003278860610242573, 'lambda_val': 1.6669472887970978e-05, 'batch_size': 1750, 'optimizer': 'Adam'}.
2026-06-05 04:41:31,867 - experiment_functions - INFO - Early stopping at epoch 2600. Best Metrics: (0.047230197099930475, 0.006115613905820885, 0.023867124872265246)
2026-06-05 04:41:33,135 - optuna.study.study - INFO - Trial 249 finished with values: [0.047230197099930475, 0.006115613905820885, 0.023867124872265246] and parameters: {'n_layers': 2, 'embedding_dim': 32, 'lr': 0.0005442466826639005, 'lambda_val': 0.0003734366700851135, 'batch_size': 3566, 'optimizer': 'RMSprop'}.
2026-06-05 04:42:50,467 - experiment_functions - INFO - Early stopping at epoch 1900. Best Metrics: (0.05484710702957321, 0.0071052984124857655, 0.028595273083901956)
2026-06-05 04:42:50,594 - optuna.study.study - INFO - Trial 250 finished with values: [0.05484710702957321, 0.0071052984124857655, 0.028595273083901956] and parameters: {'n_layers': 2, 'embedding_dim': 64, 'lr': 0.0007432804052483335, 'lambda_val': 0.0003734366700851135, 'batch_size': 672, 'optimizer': 'Adam'}.
2026-06-05 04:45:29,671 - optuna.study.study - INFO - Trial 251 finished with values: [0.07417971639157449, 0.009739433317703798, 0.04114851537038309] and parameters: {'n_layers': 1, 'embedding_dim': 64, 'lr': 0.000936097337950737, 'lambda_val': 2.061360640875514e-06, 'batch_size': 2183, 'optimizer': 'Adam'}.
2026-06-05 04:48:21,347 - optuna.study.study - INFO - Trial 252 finished with values: [0.05960817478651616, 0.007905753901801862, 0.032633229170904735] and parameters: {'n_layers': 2, 'embedding_dim': 96, 'lr': 0.0003278860610242573, 'lambda_val': 1.6669472887970978e-05, 'batch_size': 2586, 'optimizer': 'Adam'}.
2026-06-05 04:51:00,506 - optuna.study.study - INFO - Trial 253 finished with values: [0.0673869004202972, 0.008776542300221046, 0.03692328855197867] and parameters: {'n_layers': 1, 'embedding_dim': 64, 'lr': 0.000936097337950737, 'lambda_val': 3.7692983082791845e-06, 'batch_size': 1135, 'optimizer': 'RMSprop'}.
2026-06-05 04:54:48,906 - optuna.study.study - INFO - Trial 254 finished with values: [0.06271534376655527, 0.008044745126934157, 0.03250833791165406] and parameters: {'n_layers': 3, 'embedding_dim': 256, 'lr': 0.0003278860610242573, 'lambda_val': 2.061360640875514e-06, 'batch_size': 2859, 'optimizer': 'RMSprop'}.
2026-06-05 04:55:51,891 - experiment_functions - INFO - Early stopping at epoch 1450. Best Metrics: (0.04840792429575942, 0.006314890481612968, 0.025014783362455013)
2026-06-05 04:55:52,018 - optuna.study.study - INFO - Trial 255 finished with values: [0.04840792429575942, 0.006314890481612968, 0.025014783362455013] and parameters: {'n_layers': 2, 'embedding_dim': 96, 'lr': 0.000936097337950737, 'lambda_val': 2.061360640875514e-06, 'batch_size': 1900, 'optimizer': 'RMSprop'}.
2026-06-05 04:57:12,746 - experiment_functions - INFO - Early stopping at epoch 2000. Best Metrics: (0.06276427137123504, 0.008399758858597362, 0.03431892555967493)
2026-06-05 04:57:13,443 - optuna.study.study - INFO - Trial 256 finished with values: [0.06276427137123504, 0.008399758858597362, 0.03431892555967493] and parameters: {'n_layers': 1, 'embedding_dim': 64, 'lr': 0.000936097337950737, 'lambda_val': 0.0003734366700851135, 'batch_size': 1214, 'optimizer': 'RMSprop'}.
2026-06-05 05:01:01,161 - optuna.study.study - INFO - Trial 257 finished with values: [0.057406173773725394, 0.0074820818541094505, 0.029961445263513777] and parameters: {'n_layers': 3, 'embedding_dim': 256, 'lr': 0.0003278860610242573, 'lambda_val': 1.6669472887970978e-05, 'batch_size': 1315, 'optimizer': 'Adam'}.
2026-06-05 05:04:08,486 - optuna.study.study - INFO - Trial 258 finished with values: [0.08034340674078538, 0.010241811239868713, 0.04291100450863492] and parameters: {'n_layers': 1, 'embedding_dim': 256, 'lr': 0.000936097337950737, 'lambda_val': 2.061360640875514e-06, 'batch_size': 2586, 'optimizer': 'RMSprop'}.
2026-06-05 05:07:36,842 - optuna.study.study - INFO - Trial 259 finished with values: [0.06702800964212967, 0.008856922767767434, 0.036422998437093804] and parameters: {'n_layers': 2, 'embedding_dim': 256, 'lr': 0.0003278860610242573, 'lambda_val': 1.6669472887970978e-05, 'batch_size': 2859, 'optimizer': 'Adam'}.
2026-06-05 05:10:38,694 - optuna.study.study - INFO - Trial 260 finished with values: [0.0019065618173419634, 0.0002796570433384688, 0.0009241068061593286] and parameters: {'n_layers': 3, 'embedding_dim': 128, 'lr': 5.469411443433173e-05, 'lambda_val': 1.6669472887970978e-05, 'batch_size': 3032, 'optimizer': 'RMSprop'}.
2026-06-05 05:13:45,869 - optuna.study.study - INFO - Trial 261 finished with values: [0.050545111570369804, 0.006445508741375846, 0.02663341118150069] and parameters: {'n_layers': 4, 'embedding_dim': 96, 'lr': 0.0003278860610242573, 'lambda_val': 2.061360640875514e-06, 'batch_size': 1900, 'optimizer': 'RMSprop'}.
2026-06-05 05:16:23,851 - optuna.study.study - INFO - Trial 262 finished with values: [0.050765066337262355, 0.006589523745729789, 0.02626182751384349] and parameters: {'n_layers': 2, 'embedding_dim': 32, 'lr': 0.0007432804052483335, 'lambda_val': 4.933989724174048e-06, 'batch_size': 3566, 'optimizer': 'Adam'}.
2026-06-05 05:16:45,374 - experiment_functions - INFO - Early stopping at epoch 500. Best Metrics: (0.0005065350384581063, 7.2007502176971e-05, 0.00022681387157163948)
2026-06-05 05:16:46,422 - optuna.study.study - INFO - Trial 263 finished with values: [0.0005065350384581063, 7.2007502176971e-05, 0.00022681387157163948] and parameters: {'n_layers': 2, 'embedding_dim': 64, 'lr': 0.0007432804052483335, 'lambda_val': 0.00021449446899673844, 'batch_size': 672, 'optimizer': 'SGD'}.
2026-06-05 05:18:10,602 - experiment_functions - INFO - Early stopping at epoch 1800. Best Metrics: (0.058559400717938574, 0.008024650010047558, 0.031468563704114515)
2026-06-05 05:18:10,692 - optuna.study.study - INFO - Trial 264 finished with values: [0.058559400717938574, 0.008024650010047558, 0.031468563704114515] and parameters: {'n_layers': 1, 'embedding_dim': 256, 'lr': 0.0007432804052483335, 'lambda_val': 0.0024741700262700477, 'batch_size': 2586, 'optimizer': 'Adam'}.
2026-06-05 05:20:10,126 - experiment_functions - INFO - Early stopping at epoch 3050. Best Metrics: (0.05199288861876023, 0.006693348516310538, 0.026281715420161365)
2026-06-05 05:20:10,234 - optuna.study.study - INFO - Trial 265 finished with values: [0.05199288861876023, 0.006693348516310538, 0.026281715420161365] and parameters: {'n_layers': 2, 'embedding_dim': 32, 'lr': 0.00047821362810165967, 'lambda_val': 2.061360640875514e-06, 'batch_size': 3566, 'optimizer': 'RMSprop'}.
2026-06-05 05:20:34,865 - experiment_functions - INFO - Early stopping at epoch 550. Best Metrics: (0.019754133293945472, 0.0027027932212472373, 0.010225331837210779)
2026-06-05 05:20:34,943 - optuna.study.study - INFO - Trial 266 finished with values: [0.019754133293945472, 0.0027027932212472373, 0.010225331837210779] and parameters: {'n_layers': 2, 'embedding_dim': 96, 'lr': 0.059112833613224364, 'lambda_val': 5.496242044184513e-05, 'batch_size': 672, 'optimizer': 'Adam'}.
2026-06-05 05:23:14,519 - optuna.study.study - INFO - Trial 267 finished with values: [0.07443406445753474, 0.009848281867506196, 0.042150343830097435] and parameters: {'n_layers': 1, 'embedding_dim': 64, 'lr': 0.0007432804052483335, 'lambda_val': 1.4343556300786811e-05, 'batch_size': 2859, 'optimizer': 'Adam'}.
2026-06-05 05:23:38,246 - experiment_functions - INFO - Early stopping at epoch 500. Best Metrics: (0.013431009539417232, 0.0016411012124053854, 0.007375415121196865)
2026-06-05 05:23:38,865 - optuna.study.study - INFO - Trial 268 finished with values: [0.013431009539417232, 0.0016411012124053854, 0.007375415121196865] and parameters: {'n_layers': 3, 'embedding_dim': 96, 'lr': 0.08314452357351564, 'lambda_val': 2.388311754210309e-05, 'batch_size': 2562, 'optimizer': 'RMSprop'}.
2026-06-05 05:26:37,985 - optuna.study.study - INFO - Trial 269 finished with values: [0.055544245653311126, 0.007036640096456562, 0.028519871605763854] and parameters: {'n_layers': 3, 'embedding_dim': 96, 'lr': 0.0005200733648452572, 'lambda_val': 2.388311754210309e-05, 'batch_size': 1900, 'optimizer': 'Adam'}.
2026-06-05 05:27:32,584 - experiment_functions - INFO - Early stopping at epoch 1350. Best Metrics: (0.05323495644570421, 0.007214146962288164, 0.02849165415677246)
2026-06-05 05:27:32,951 - optuna.study.study - INFO - Trial 270 finished with values: [0.05323495644570421, 0.007214146962288164, 0.02849165415677246] and parameters: {'n_layers': 1, 'embedding_dim': 64, 'lr': 0.000936097337950737, 'lambda_val': 0.0024741700262700477, 'batch_size': 735, 'optimizer': 'RMSprop'}.
2026-06-05 05:29:51,565 - experiment_functions - INFO - Early stopping at epoch 3100. Best Metrics: (0.05148924744579027, 0.00657947618728649, 0.026438498251391655)
2026-06-05 05:29:51,658 - optuna.study.study - INFO - Trial 271 finished with values: [0.05148924744579027, 0.00657947618728649, 0.026438498251391655] and parameters: {'n_layers': 3, 'embedding_dim': 96, 'lr': 0.0005200733648452572, 'lambda_val': 2.388311754210309e-05, 'batch_size': 1900, 'optimizer': 'RMSprop'}.
2026-06-05 05:30:40,550 - experiment_functions - INFO - Early stopping at epoch 1100. Best Metrics: (0.010691369760090262, 0.0014769910911648467, 0.005165993835549848)
2026-06-05 05:30:40,645 - optuna.study.study - INFO - Trial 272 finished with values: [0.010691369760090262, 0.0014769910911648467, 0.005165993835549848] and parameters: {'n_layers': 2, 'embedding_dim': 128, 'lr': 0.00105994739638826, 'lambda_val': 0.08629748472545483, 'batch_size': 1524, 'optimizer': 'Adam'}.
2026-06-05 05:33:21,003 - optuna.study.study - INFO - Trial 273 finished with values: [0.07543793254194679, 0.009787996516846406, 0.041649209561554115] and parameters: {'n_layers': 1, 'embedding_dim': 64, 'lr': 0.000936097337950737, 'lambda_val': 2.061360640875514e-06, 'batch_size': 2183, 'optimizer': 'RMSprop'}.
2026-06-05 05:36:04,902 - optuna.study.study - INFO - Trial 274 finished with values: [0.06487645778320653, 0.008394735079375711, 0.034712965279350604] and parameters: {'n_layers': 2, 'embedding_dim': 64, 'lr': 0.0005200733648452572, 'lambda_val': 2.388311754210309e-05, 'batch_size': 2120, 'optimizer': 'RMSprop'}.
2026-06-05 05:37:02,371 - experiment_functions - INFO - Early stopping at epoch 1400. Best Metrics: (0.009918570891760034, 0.0016796168531046953, 0.0053638995717214906)
2026-06-05 05:37:02,474 - optuna.study.study - INFO - Trial 275 finished with values: [0.009918570891760034, 0.0016796168531046953, 0.0053638995717214906] and parameters: {'n_layers': 1, 'embedding_dim': 128, 'lr': 0.031048885348921296, 'lambda_val': 4.933989724174048e-06, 'batch_size': 3141, 'optimizer': 'RMSprop'}.
2026-06-05 05:37:47,440 - experiment_functions - INFO - Early stopping at epoch 1000. Best Metrics: (0.041638866062262046, 0.005464197200080381, 0.02181380795499241)
2026-06-05 05:37:47,525 - optuna.study.study - INFO - Trial 276 finished with values: [0.041638866062262046, 0.005464197200080381, 0.02181380795499241] and parameters: {'n_layers': 2, 'embedding_dim': 64, 'lr': 0.000936097337950737, 'lambda_val': 2.061360640875514e-06, 'batch_size': 1064, 'optimizer': 'RMSprop'}.
2026-06-05 05:40:33,562 - optuna.study.study - INFO - Trial 277 finished with values: [0.07960317407722924, 0.010310469555897917, 0.04330377013846817] and parameters: {'n_layers': 1, 'embedding_dim': 96, 'lr': 0.000936097337950737, 'lambda_val': 2.061360640875514e-06, 'batch_size': 2859, 'optimizer': 'Adam'}.
2026-06-05 05:41:00,329 - experiment_functions - INFO - Early stopping at epoch 550. Best Metrics: (0.008779913459036044, 0.0012425480608212202, 0.004416082089939231)
2026-06-05 05:41:00,432 - optuna.study.study - INFO - Trial 278 finished with values: [0.008779913459036044, 0.0012425480608212202, 0.004416082089939231] and parameters: {'n_layers': 1, 'embedding_dim': 256, 'lr': 0.07099100108191203, 'lambda_val': 0.00022053441583265288, 'batch_size': 2586, 'optimizer': 'Adam'}.
2026-06-05 05:43:39,631 - optuna.study.study - INFO - Trial 279 finished with values: [0.07265130249140343, 0.009592069127202089, 0.04087391648336461] and parameters: {'n_layers': 1, 'embedding_dim': 64, 'lr': 0.0007432804052483335, 'lambda_val': 2.061360640875514e-06, 'batch_size': 2854, 'optimizer': 'RMSprop'}.
2026-06-05 05:46:24,612 - optuna.study.study - INFO - Trial 280 finished with values: [0.0781451328505502, 0.01016980373769174, 0.04339715393596297] and parameters: {'n_layers': 1, 'embedding_dim': 96, 'lr': 0.000936097337950737, 'lambda_val': 2.061360640875514e-06, 'batch_size': 3447, 'optimizer': 'RMSprop'}.
2026-06-05 05:47:02,211 - experiment_functions - INFO - Early stopping at epoch 900. Best Metrics: (0.05206400606526865, 0.00696463259427959, 0.027682112563562435)
2026-06-05 05:47:02,318 - optuna.study.study - INFO - Trial 281 finished with values: [0.05206400606526865, 0.00696463259427959, 0.027682112563562435] and parameters: {'n_layers': 1, 'embedding_dim': 64, 'lr': 0.000936097337950737, 'lambda_val': 0.0024741700262700477, 'batch_size': 2859, 'optimizer': 'RMSprop'}.
2026-06-05 05:47:26,647 - experiment_functions - INFO - Early stopping at epoch 550. Best Metrics: (0.057112885023627324, 0.007331368477459978, 0.03024131143764307)
2026-06-05 05:47:26,739 - optuna.study.study - INFO - Trial 282 finished with values: [0.057112885023627324, 0.007331368477459978, 0.03024131143764307] and parameters: {'n_layers': 1, 'embedding_dim': 96, 'lr': 0.010850387474674802, 'lambda_val': 0.0003734366700851135, 'batch_size': 3009, 'optimizer': 'Adam'}.
2026-06-05 05:48:08,831 - experiment_functions - INFO - Early stopping at epoch 1000. Best Metrics: (0.05313288165296626, 0.007220845334583697, 0.028309603145730947)
2026-06-05 05:48:08,925 - optuna.study.study - INFO - Trial 283 finished with values: [0.05313288165296626, 0.007220845334583697, 0.028309603145730947] and parameters: {'n_layers': 1, 'embedding_dim': 96, 'lr': 0.0007432804052483335, 'lambda_val': 0.0024741700262700477, 'batch_size': 4094, 'optimizer': 'RMSprop'}.
2026-06-05 05:48:39,496 - experiment_functions - INFO - Early stopping at epoch 550. Best Metrics: (0.04002134056985749, 0.0049132560787728576, 0.02179152292851462)
2026-06-05 05:48:40,358 - optuna.study.study - INFO - Trial 284 finished with values: [0.04002134056985749, 0.0049132560787728576, 0.02179152292851462] and parameters: {'n_layers': 2, 'embedding_dim': 256, 'lr': 0.003723951914886607, 'lambda_val': 4.819840959097401e-06, 'batch_size': 1750, 'optimizer': 'Adam'}.
2026-06-05 05:49:31,075 - experiment_functions - INFO - Early stopping at epoch 1200. Best Metrics: (0.0539853997910503, 0.007023243351865496, 0.02753889080587037)
2026-06-05 05:49:31,227 - optuna.study.study - INFO - Trial 285 finished with values: [0.0539853997910503, 0.007023243351865496, 0.02753889080587037] and parameters: {'n_layers': 2, 'embedding_dim': 64, 'lr': 0.000936097337950737, 'lambda_val': 2.061360640875514e-06, 'batch_size': 2331, 'optimizer': 'Adam'}.
2026-06-05 05:52:12,415 - optuna.study.study - INFO - Trial 286 finished with values: [0.038544160019329816, 0.0052933887065443105, 0.021004593099960434] and parameters: {'n_layers': 2, 'embedding_dim': 64, 'lr': 0.0003278860610242573, 'lambda_val': 2.061360640875514e-06, 'batch_size': 652, 'optimizer': 'Adam'}.
2026-06-05 05:54:20,680 - experiment_functions - INFO - Early stopping at epoch 3100. Best Metrics: (0.056399597478526874, 0.007353138187420457, 0.02977138859780345)
2026-06-05 05:54:20,753 - optuna.study.study - INFO - Trial 287 finished with values: [0.056399597478526874, 0.007353138187420457, 0.02977138859780345] and parameters: {'n_layers': 2, 'embedding_dim': 64, 'lr': 0.0007432804052483335, 'lambda_val': 2.1726075208657243e-05, 'batch_size': 2586, 'optimizer': 'Adam'}.
2026-06-05 05:54:44,090 - experiment_functions - INFO - Early stopping at epoch 550. Best Metrics: (0.052454171989760476, 0.0067452609016009114, 0.028394935662065624)
2026-06-05 05:54:44,164 - optuna.study.study - INFO - Trial 288 finished with values: [0.052454171989760476, 0.0067452609016009114, 0.028394935662065624] and parameters: {'n_layers': 1, 'embedding_dim': 64, 'lr': 0.010850387474674802, 'lambda_val': 0.00022368856507037872, 'batch_size': 1935, 'optimizer': 'Adam'}.
2026-06-05 05:57:42,407 - optuna.study.study - INFO - Trial 289 finished with values: [0.04772379877605514, 0.006065376113604395, 0.023511975028221162] and parameters: {'n_layers': 3, 'embedding_dim': 96, 'lr': 0.0007432804052483335, 'lambda_val': 4.933989724174048e-06, 'batch_size': 2859, 'optimizer': 'RMSprop'}.
2026-06-05 05:58:03,201 - experiment_functions - INFO - Early stopping at epoch 500. Best Metrics: (0.0005710349804825433, 8.205506062026927e-05, 0.0002371339131302512)
2026-06-05 05:58:03,595 - optuna.study.study - INFO - Trial 290 finished with values: [0.0005710349804825433, 8.205506062026927e-05, 0.0002371339131302512] and parameters: {'n_layers': 1, 'embedding_dim': 64, 'lr': 0.000936097337950737, 'lambda_val': 2.061360640875514e-06, 'batch_size': 2331, 'optimizer': 'SGD'}.
2026-06-05 06:00:46,659 - optuna.study.study - INFO - Trial 291 finished with values: [0.069496216460214, 0.009069596088150582, 0.037954878073658944] and parameters: {'n_layers': 1, 'embedding_dim': 96, 'lr': 0.00044375088250705124, 'lambda_val': 0.0003734366700851135, 'batch_size': 2859, 'optimizer': 'RMSprop'}.
2026-06-05 06:01:52,468 - experiment_functions - INFO - Early stopping at epoch 1250. Best Metrics: (0.06317612729688422, 0.008130149373702192, 0.03301714629826935)
2026-06-05 06:01:52,834 - optuna.study.study - INFO - Trial 292 finished with values: [0.06317612729688422, 0.008130149373702192, 0.03301714629826935] and parameters: {'n_layers': 2, 'embedding_dim': 256, 'lr': 0.000936097337950737, 'lambda_val': 2.061360640875514e-06, 'batch_size': 1750, 'optimizer': 'Adam'}.
2026-06-05 06:03:18,847 - experiment_functions - INFO - Early stopping at epoch 1750. Best Metrics: (0.07201130505154005, 0.00962388639560587, 0.03855631882080237)
2026-06-05 06:03:18,964 - optuna.study.study - INFO - Trial 293 finished with values: [0.07201130505154005, 0.00962388639560587, 0.03855631882080237] and parameters: {'n_layers': 1, 'embedding_dim': 256, 'lr': 0.00105994739638826, 'lambda_val': 0.0003734366700851135, 'batch_size': 2586, 'optimizer': 'Adam'}.
2026-06-05 06:03:51,268 - experiment_functions - INFO - Early stopping at epoch 650. Best Metrics: (0.06509575262830791, 0.008609082992832742, 0.035373862504961134)
2026-06-05 06:03:51,403 - optuna.study.study - INFO - Trial 294 finished with values: [0.06509575262830791, 0.008609082992832742, 0.035373862504961134] and parameters: {'n_layers': 1, 'embedding_dim': 256, 'lr': 0.0033595071416412372, 'lambda_val': 0.0003734366700851135, 'batch_size': 2586, 'optimizer': 'Adam'}.
2026-06-05 06:06:36,391 - optuna.study.study - INFO - Trial 295 finished with values: [0.07700208776749265, 0.009933686114274231, 0.041933963197502575] and parameters: {'n_layers': 1, 'embedding_dim': 96, 'lr': 0.0007432804052483335, 'lambda_val': 2.061360640875514e-06, 'batch_size': 3566, 'optimizer': 'RMSprop'}.
2026-06-05 06:07:27,019 - experiment_functions - INFO - Early stopping at epoch 1200. Best Metrics: (0.024852334530035332, 0.0035417643512626433, 0.013159677039535222)
2026-06-05 06:07:27,291 - optuna.study.study - INFO - Trial 296 finished with values: [0.024852334530035332, 0.0035417643512626433, 0.013159677039535222] and parameters: {'n_layers': 2, 'embedding_dim': 96, 'lr': 0.007713731536876498, 'lambda_val': 3.3509343310867884e-06, 'batch_size': 1524, 'optimizer': 'RMSprop'}.
2026-06-05 06:08:16,340 - experiment_functions - INFO - Early stopping at epoch 1150. Best Metrics: (0.03755650725983749, 0.004906557706477327, 0.019359991471836768)
2026-06-05 06:08:17,319 - optuna.study.study - INFO - Trial 297 finished with values: [0.03755650725983749, 0.004906557706477327, 0.019359991471836768] and parameters: {'n_layers': 2, 'embedding_dim': 96, 'lr': 0.0007432804052483335, 'lambda_val': 0.0024741700262700477, 'batch_size': 1214, 'optimizer': 'RMSprop'}.
2026-06-05 06:09:20,722 - experiment_functions - INFO - Early stopping at epoch 1300. Best Metrics: (0.05975856118100255, 0.008081586174559582, 0.0318888689997015)
