2026-06-06 02:22:34,284 - optuna.study.study - INFO - Trial 210 finished with values: [0.06816187952635071, 0.008155268269810436, 0.033896618260214006] and parameters: {'n_layers': 3, 'embedding_dim': 96, 'lr': 0.0008375189225934038, 'lambda_val': 1.9645451789230886e-06, 'batch_size': 2901, 'optimizer': 'Adam'}.
2026-06-06 02:25:34,132 - optuna.study.study - INFO - Trial 211 finished with values: [0.08107252022103772, 0.009474847612030277, 0.04035213005015857] and parameters: {'n_layers': 1, 'embedding_dim': 256, 'lr': 0.0025949620955328543, 'lambda_val': 2.80429275845163e-06, 'batch_size': 1487, 'optimizer': 'RMSprop'}.
2026-06-06 02:26:52,753 - experiment_functions - INFO - Early stopping at epoch 1850. Best Metrics: (0.08169756673279506, 0.00993870989349588, 0.041727642878955154)
2026-06-06 02:26:52,933 - optuna.study.study - INFO - Trial 212 finished with values: [0.08169756673279506, 0.00993870989349588, 0.041727642878955154] and parameters: {'n_layers': 2, 'embedding_dim': 96, 'lr': 0.0008375189225934038, 'lambda_val': 9.945068556655057e-06, 'batch_size': 3734, 'optimizer': 'Adam'}.
2026-06-06 02:29:53,904 - optuna.study.study - INFO - Trial 213 finished with values: [0.08161227989314054, 0.010501373166320584, 0.04391519740194862] and parameters: {'n_layers': 1, 'embedding_dim': 256, 'lr': 0.0006492139755404522, 'lambda_val': 1.482563488933184e-06, 'batch_size': 3734, 'optimizer': 'Adam'}.
2026-06-06 02:32:33,459 - optuna.study.study - INFO - Trial 214 finished with values: [0.07825783304768703, 0.01009779623551477, 0.043224151424736554] and parameters: {'n_layers': 1, 'embedding_dim': 96, 'lr': 0.0008375189225934038, 'lambda_val': 1.482563488933184e-06, 'batch_size': 2392, 'optimizer': 'Adam'}.
2026-06-06 02:33:28,380 - experiment_functions - INFO - Early stopping at epoch 1400. Best Metrics: (0.04354579463857587, 0.005236452542032287, 0.02055885712196864)
2026-06-06 02:33:28,801 - optuna.study.study - INFO - Trial 215 finished with values: [0.04354579463857587, 0.005236452542032287, 0.02055885712196864] and parameters: {'n_layers': 3, 'embedding_dim': 32, 'lr': 0.0025577630368650026, 'lambda_val': 5.314912869017192e-05, 'batch_size': 755, 'optimizer': 'Adam'}.
2026-06-06 02:36:04,818 - experiment_functions - INFO - Early stopping at epoch 3700. Best Metrics: (0.086484514888817, 0.010429365664143615, 0.04602046883759541)
2026-06-06 02:36:05,092 - optuna.study.study - INFO - Trial 216 finished with values: [0.086484514888817, 0.010429365664143615, 0.04602046883759541] and parameters: {'n_layers': 2, 'embedding_dim': 96, 'lr': 0.0008375189225934038, 'lambda_val': 7.4032238942432714e-06, 'batch_size': 2901, 'optimizer': 'Adam'}.
2026-06-06 02:38:22,557 - experiment_functions - INFO - Early stopping at epoch 3500. Best Metrics: (0.04784724192957944, 0.005529506329961819, 0.02146268682416311)
2026-06-06 02:38:22,657 - optuna.study.study - INFO - Trial 217 finished with values: [0.04784724192957944, 0.005529506329961819, 0.02146268682416311] and parameters: {'n_layers': 2, 'embedding_dim': 64, 'lr': 0.003797813989642158, 'lambda_val': 1.5739380446754205e-06, 'batch_size': 1266, 'optimizer': 'RMSprop'}.
2026-06-06 02:40:54,229 - optuna.study.study - INFO - Trial 218 finished with values: [0.01263511351568717, 0.00218199477526961, 0.007519236672105168] and parameters: {'n_layers': 1, 'embedding_dim': 96, 'lr': 0.0006492139755404522, 'lambda_val': 1.9645451789230886e-06, 'batch_size': 738, 'optimizer': 'Adam'}.
2026-06-06 02:41:45,822 - experiment_functions - INFO - Early stopping at epoch 1300. Best Metrics: (0.0003973610633717017, 6.195994373367272e-05, 0.0001693656421570151)
2026-06-06 02:41:46,083 - optuna.study.study - INFO - Trial 219 finished with values: [0.0003973610633717017, 6.195994373367272e-05, 0.0001693656421570151] and parameters: {'n_layers': 1, 'embedding_dim': 128, 'lr': 3.346438617799403e-05, 'lambda_val': 1.0229781127321935e-05, 'batch_size': 1890, 'optimizer': 'RMSprop'}.
2026-06-06 02:43:08,246 - experiment_functions - INFO - Early stopping at epoch 2100. Best Metrics: (0.07515945178379464, 0.008935628642239936, 0.03816604119272173)
2026-06-06 02:43:08,369 - optuna.study.study - INFO - Trial 220 finished with values: [0.07515945178379464, 0.008935628642239936, 0.03816604119272173] and parameters: {'n_layers': 2, 'embedding_dim': 32, 'lr': 0.0011525517839870857, 'lambda_val': 0.0002470779691093862, 'batch_size': 3734, 'optimizer': 'Adam'}.
2026-06-06 02:45:55,956 - optuna.study.study - INFO - Trial 221 finished with values: [0.08304106199830202, 0.010183200482282804, 0.04483759629395191] and parameters: {'n_layers': 2, 'embedding_dim': 96, 'lr': 0.0008375189225934038, 'lambda_val': 1.482563488933184e-06, 'batch_size': 2005, 'optimizer': 'Adam'}.
2026-06-06 02:46:39,174 - experiment_functions - INFO - Early stopping at epoch 1100. Best Metrics: (0.0005486183737358797, 7.870587447250318e-05, 0.00021867118988651142)
2026-06-06 02:46:39,260 - optuna.study.study - INFO - Trial 222 finished with values: [0.0005486183737358797, 7.870587447250318e-05, 0.00021867118988651142] and parameters: {'n_layers': 1, 'embedding_dim': 96, 'lr': 0.00010566188392090978, 'lambda_val': 2.80429275845163e-06, 'batch_size': 1890, 'optimizer': 'Adam'}.
2026-06-06 02:49:33,773 - optuna.study.study - INFO - Trial 223 finished with values: [0.025977833682303834, 0.004124522740973944, 0.015582926683435567] and parameters: {'n_layers': 1, 'embedding_dim': 256, 'lr': 0.0006492139755404522, 'lambda_val': 1.9645451789230886e-06, 'batch_size': 845, 'optimizer': 'Adam'}.
2026-06-06 02:52:17,152 - optuna.study.study - INFO - Trial 224 finished with values: [0.08756841113551742, 0.010754236720476925, 0.04669140640191555] and parameters: {'n_layers': 1, 'embedding_dim': 96, 'lr': 0.0025949620955328543, 'lambda_val': 1.9645451789230886e-06, 'batch_size': 738, 'optimizer': 'Adam'}.
2026-06-06 02:54:52,265 - optuna.study.study - INFO - Trial 225 finished with values: [0.047505990465307804, 0.0068624824167727244, 0.028369386947873824] and parameters: {'n_layers': 1, 'embedding_dim': 96, 'lr': 0.0008375189225934038, 'lambda_val': 1.482563488933184e-06, 'batch_size': 738, 'optimizer': 'RMSprop'}.
2026-06-06 02:57:30,991 - optuna.study.study - INFO - Trial 226 finished with values: [0.06279688541803984, 0.00864090026123652, 0.036012211828964205] and parameters: {'n_layers': 1, 'embedding_dim': 96, 'lr': 0.0011525517839870857, 'lambda_val': 7.4032238942432714e-06, 'batch_size': 755, 'optimizer': 'Adam'}.
2026-06-06 02:59:59,642 - experiment_functions - INFO - Early stopping at epoch 3200. Best Metrics: (0.08571160301167038, 0.010218366936834348, 0.044215685792497385)
2026-06-06 02:59:59,957 - optuna.study.study - INFO - Trial 227 finished with values: [0.08571160301167038, 0.010218366936834348, 0.044215685792497385] and parameters: {'n_layers': 1, 'embedding_dim': 256, 'lr': 0.0025949620955328543, 'lambda_val': 1.9645451789230886e-06, 'batch_size': 755, 'optimizer': 'Adam'}.
2026-06-06 03:00:51,216 - experiment_functions - INFO - Early stopping at epoch 1100. Best Metrics: (0.07201310043683984, 0.008642574854310404, 0.035437334826269824)
2026-06-06 03:00:51,302 - optuna.study.study - INFO - Trial 228 finished with values: [0.07201310043683984, 0.008642574854310404, 0.035437334826269824] and parameters: {'n_layers': 1, 'embedding_dim': 256, 'lr': 0.003024713038203535, 'lambda_val': 2.80429275845163e-06, 'batch_size': 2901, 'optimizer': 'RMSprop'}.
2026-06-06 03:03:26,655 - optuna.study.study - INFO - Trial 229 finished with values: [0.07057981048547733, 0.009352602317636814, 0.039644160283001315] and parameters: {'n_layers': 1, 'embedding_dim': 64, 'lr': 0.0013657829614293975, 'lambda_val': 1.9645451789230886e-06, 'batch_size': 738, 'optimizer': 'Adam'}.
2026-06-06 03:04:47,958 - experiment_functions - INFO - Early stopping at epoch 1950. Best Metrics: (0.0005364336870517578, 8.205506062026926e-05, 0.0002464151199446518)
2026-06-06 03:04:48,534 - optuna.study.study - INFO - Trial 230 finished with values: [0.0005364336870517578, 8.205506062026926e-05, 0.0002464151199446518] and parameters: {'n_layers': 2, 'embedding_dim': 96, 'lr': 8.495268381785428e-05, 'lambda_val': 1.9645451789230886e-06, 'batch_size': 2005, 'optimizer': 'Adam'}.
2026-06-06 03:05:44,674 - experiment_functions - INFO - Early stopping at epoch 1200. Best Metrics: (0.0762719297041407, 0.009049500971263984, 0.03844766906248128)
2026-06-06 03:05:45,431 - optuna.study.study - INFO - Trial 231 finished with values: [0.0762719297041407, 0.009049500971263984, 0.03844766906248128] and parameters: {'n_layers': 2, 'embedding_dim': 128, 'lr': 0.0011590275843617274, 'lambda_val': 0.0002470779691093862, 'batch_size': 3756, 'optimizer': 'Adam'}.
2026-06-06 03:08:21,512 - optuna.study.study - INFO - Trial 232 finished with values: [0.07240644565487134, 0.008516980373769176, 0.035807145416313] and parameters: {'n_layers': 1, 'embedding_dim': 64, 'lr': 0.003797813989642158, 'lambda_val': 6.620963189542858e-05, 'batch_size': 738, 'optimizer': 'RMSprop'}.
2026-06-06 03:11:09,158 - optuna.study.study - INFO - Trial 233 finished with values: [0.08426807923740283, 0.010295398218232969, 0.045091614802673104] and parameters: {'n_layers': 2, 'embedding_dim': 96, 'lr': 0.0008375189225934038, 'lambda_val': 1.9645451789230886e-06, 'batch_size': 2005, 'optimizer': 'Adam'}.
2026-06-06 03:11:55,875 - experiment_functions - INFO - Early stopping at epoch 1150. Best Metrics: (0.08179263900609705, 0.01003081251255945, 0.042777511088439066)
2026-06-06 03:11:56,792 - optuna.study.study - INFO - Trial 234 finished with values: [0.08179263900609705, 0.01003081251255945, 0.042777511088439066] and parameters: {'n_layers': 1, 'embedding_dim': 64, 'lr': 0.003797813989642158, 'lambda_val': 7.4032238942432714e-06, 'batch_size': 1841, 'optimizer': 'Adam'}.
2026-06-06 03:12:20,514 - experiment_functions - INFO - Early stopping at epoch 550. Best Metrics: (0.05003161429092051, 0.0065275638019961155, 0.026387253604433756)
2026-06-06 03:12:20,632 - optuna.study.study - INFO - Trial 235 finished with values: [0.05003161429092051, 0.0065275638019961155, 0.026387253604433756] and parameters: {'n_layers': 1, 'embedding_dim': 96, 'lr': 0.019985723026221657, 'lambda_val': 1.482563488933184e-06, 'batch_size': 3853, 'optimizer': 'Adam'}.
2026-06-06 03:13:04,958 - experiment_functions - INFO - Early stopping at epoch 1000. Best Metrics: (0.030164330614909265, 0.0034396141737557773, 0.013539638100980127)
2026-06-06 03:13:05,099 - optuna.study.study - INFO - Trial 236 finished with values: [0.030164330614909265, 0.0034396141737557773, 0.013539638100980127] and parameters: {'n_layers': 3, 'embedding_dim': 96, 'lr': 0.021646316440238192, 'lambda_val': 2.80429275845163e-06, 'batch_size': 1890, 'optimizer': 'Adam'}.
2026-06-06 03:15:43,967 - optuna.study.study - INFO - Trial 237 finished with values: [0.066953702906371, 0.0091466273695492, 0.037696177562919646] and parameters: {'n_layers': 1, 'embedding_dim': 96, 'lr': 0.0011525517839870857, 'lambda_val': 0.0016994798127633248, 'batch_size': 833, 'optimizer': 'Adam'}.
2026-06-06 03:18:45,570 - optuna.study.study - INFO - Trial 238 finished with values: [0.07673253261775209, 0.010094447049367003, 0.04202743488757375] and parameters: {'n_layers': 1, 'embedding_dim': 256, 'lr': 0.0006492139755404522, 'lambda_val': 3.1920449116234754e-05, 'batch_size': 2901, 'optimizer': 'Adam'}.
2026-06-06 03:21:42,646 - optuna.study.study - INFO - Trial 239 finished with values: [0.019314601615187853, 0.003210194922633801, 0.011502809534275512] and parameters: {'n_layers': 1, 'embedding_dim': 256, 'lr': 0.0006492139755404522, 'lambda_val': 1.482563488933184e-06, 'batch_size': 738, 'optimizer': 'Adam'}.
2026-06-06 03:24:24,458 - optuna.study.study - INFO - Trial 240 finished with values: [0.08539082324236791, 0.010832942594949426, 0.047099673998282035] and parameters: {'n_layers': 1, 'embedding_dim': 96, 'lr': 0.0011525517839870857, 'lambda_val': 1.9645451789230886e-06, 'batch_size': 1487, 'optimizer': 'RMSprop'}.
2026-06-06 03:26:58,543 - optuna.study.study - INFO - Trial 241 finished with values: [0.08018432918508968, 0.009793020296068055, 0.042788851516480285] and parameters: {'n_layers': 1, 'embedding_dim': 32, 'lr': 0.0025949620955328543, 'lambda_val': 1.9645451789230886e-06, 'batch_size': 755, 'optimizer': 'Adam'}.
2026-06-06 03:28:28,888 - experiment_functions - INFO - Early stopping at epoch 2200. Best Metrics: (0.08478958158471284, 0.010065978967110992, 0.0431060484875711)
2026-06-06 03:28:28,990 - optuna.study.study - INFO - Trial 242 finished with values: [0.08478958158471284, 0.010065978967110992, 0.0431060484875711] and parameters: {'n_layers': 1, 'embedding_dim': 96, 'lr': 0.0025949620955328543, 'lambda_val': 1.9645451789230886e-06, 'batch_size': 1487, 'optimizer': 'RMSprop'}.
2026-06-06 03:28:52,337 - experiment_functions - INFO - Early stopping at epoch 500. Best Metrics: (0.00034617213392291015, 5.861075758590663e-05, 0.00017614759748564614)
2026-06-06 03:28:52,438 - optuna.study.study - INFO - Trial 243 finished with values: [0.00034617213392291015, 5.861075758590663e-05, 0.00017614759748564614] and parameters: {'n_layers': 1, 'embedding_dim': 256, 'lr': 0.0025949620955328543, 'lambda_val': 5.314912869017192e-05, 'batch_size': 3853, 'optimizer': 'SGD'}.
2026-06-06 03:29:52,000 - experiment_functions - INFO - Early stopping at epoch 1450. Best Metrics: (0.08297239876217521, 0.009710965235447786, 0.04239592645144495)
2026-06-06 03:29:52,124 - optuna.study.study - INFO - Trial 244 finished with values: [0.08297239876217521, 0.009710965235447786, 0.04239592645144495] and parameters: {'n_layers': 1, 'embedding_dim': 64, 'lr': 0.0025949620955328543, 'lambda_val': 1.9645451789230886e-06, 'batch_size': 3427, 'optimizer': 'RMSprop'}.
2026-06-06 03:33:14,858 - optuna.study.study - INFO - Trial 245 finished with values: [0.0825586540987511, 0.010359032755040524, 0.04514780753460581] and parameters: {'n_layers': 2, 'embedding_dim': 256, 'lr': 0.0006492139755404522, 'lambda_val': 1.5739380446754205e-06, 'batch_size': 1266, 'optimizer': 'Adam'}.
2026-06-06 03:35:33,785 - experiment_functions - INFO - Early stopping at epoch 2950. Best Metrics: (0.08434839727052318, 0.010052582222519927, 0.042395389347971525)
2026-06-06 03:35:34,377 - optuna.study.study - INFO - Trial 246 finished with values: [0.08434839727052318, 0.010052582222519927, 0.042395389347971525] and parameters: {'n_layers': 1, 'embedding_dim': 256, 'lr': 0.0025949620955328543, 'lambda_val': 1.9645451789230886e-06, 'batch_size': 755, 'optimizer': 'Adam'}.
2026-06-06 03:39:00,190 - optuna.study.study - INFO - Trial 247 finished with values: [0.08628346774674273, 0.010712371893629849, 0.046657458795807315] and parameters: {'n_layers': 2, 'embedding_dim': 256, 'lr': 0.0006492139755404522, 'lambda_val': 1.482563488933184e-06, 'batch_size': 1892, 'optimizer': 'Adam'}.
2026-06-06 03:39:39,786 - experiment_functions - INFO - Early stopping at epoch 850. Best Metrics: (0.08243557026906186, 0.009948757451939178, 0.042754226783138456)
2026-06-06 03:39:41,022 - optuna.study.study - INFO - Trial 248 finished with values: [0.08243557026906186, 0.009948757451939178, 0.042754226783138456] and parameters: {'n_layers': 1, 'embedding_dim': 128, 'lr': 0.0025949620955328543, 'lambda_val': 1.9645451789230886e-06, 'batch_size': 3634, 'optimizer': 'RMSprop'}.
2026-06-06 03:41:02,935 - experiment_functions - INFO - Early stopping at epoch 1700. Best Metrics: (0.0939183959037848, 0.011414026391586844, 0.048968982597505935)
2026-06-06 03:41:03,580 - optuna.study.study - INFO - Trial 249 finished with values: [0.0939183959037848, 0.011414026391586844, 0.048968982597505935] and parameters: {'n_layers': 1, 'embedding_dim': 256, 'lr': 0.0011525517839870857, 'lambda_val': 2.80429275845163e-06, 'batch_size': 3853, 'optimizer': 'RMSprop'}.
2026-06-06 03:41:41,301 - experiment_functions - INFO - Early stopping at epoch 800. Best Metrics: (0.06729486103222475, 0.00792584901868846, 0.033314727738994944)
2026-06-06 03:41:41,688 - optuna.study.study - INFO - Trial 250 finished with values: [0.06729486103222475, 0.00792584901868846, 0.033314727738994944] and parameters: {'n_layers': 1, 'embedding_dim': 128, 'lr': 0.003918670659096881, 'lambda_val': 8.098558726038623e-06, 'batch_size': 3853, 'optimizer': 'RMSprop'}.
2026-06-06 03:42:42,294 - experiment_functions - INFO - Early stopping at epoch 1350. Best Metrics: (0.05842540978872443, 0.006961283408131824, 0.02881659910379101)
2026-06-06 03:42:43,284 - optuna.study.study - INFO - Trial 251 finished with values: [0.05842540978872443, 0.006961283408131824, 0.02881659910379101] and parameters: {'n_layers': 2, 'embedding_dim': 96, 'lr': 0.0025949620955328543, 'lambda_val': 1.9645451789230886e-06, 'batch_size': 738, 'optimizer': 'Adam'}.
2026-06-06 03:45:29,490 - optuna.study.study - INFO - Trial 252 finished with values: [0.07324510111784575, 0.009695893897782838, 0.04141203702534094] and parameters: {'n_layers': 1, 'embedding_dim': 128, 'lr': 0.0008375189225934038, 'lambda_val': 1.2238130953869465e-06, 'batch_size': 1890, 'optimizer': 'Adam'}.
2026-06-06 03:48:21,717 - optuna.study.study - INFO - Trial 253 finished with values: [0.08475012722113556, 0.01031381874204568, 0.04503871627770982] and parameters: {'n_layers': 2, 'embedding_dim': 96, 'lr': 0.0008375189225934038, 'lambda_val': 1.482563488933184e-06, 'batch_size': 2005, 'optimizer': 'Adam'}.
2026-06-06 03:51:12,738 - optuna.study.study - INFO - Trial 254 finished with values: [0.08227654018584878, 0.010250184205238126, 0.044256358090879744] and parameters: {'n_layers': 2, 'embedding_dim': 96, 'lr': 0.0008375189225934038, 'lambda_val': 1.9645451789230886e-06, 'batch_size': 1487, 'optimizer': 'Adam'}.
2026-06-06 03:54:02,165 - optuna.study.study - INFO - Trial 255 finished with values: [0.09428266856630298, 0.011614977560452811, 0.04978679921746193] and parameters: {'n_layers': 1, 'embedding_dim': 128, 'lr': 0.0011525517839870857, 'lambda_val': 1.9645451789230886e-06, 'batch_size': 2901, 'optimizer': 'Adam'}.
2026-06-06 03:56:46,546 - optuna.study.study - INFO - Trial 256 finished with values: [0.05819903045701621, 0.007827048027329359, 0.03233097641280622] and parameters: {'n_layers': 2, 'embedding_dim': 96, 'lr': 0.00042408379696738034, 'lambda_val': 1.9645451789230886e-06, 'batch_size': 2005, 'optimizer': 'Adam'}.
2026-06-06 03:58:26,775 - experiment_functions - INFO - Early stopping at epoch 2200. Best Metrics: (0.07930326428532364, 0.00973440953848215, 0.03999190091159895)
2026-06-06 03:58:27,691 - optuna.study.study - INFO - Trial 257 finished with values: [0.07930326428532364, 0.00973440953848215, 0.03999190091159895] and parameters: {'n_layers': 1, 'embedding_dim': 256, 'lr': 0.0011525517839870857, 'lambda_val': 0.0019340970326084202, 'batch_size': 2463, 'optimizer': 'Adam'}.
2026-06-06 03:58:55,881 - experiment_functions - INFO - Early stopping at epoch 650. Best Metrics: (0.07103774175444764, 0.009103087949628243, 0.03724517458248375)
2026-06-06 03:58:56,046 - optuna.study.study - INFO - Trial 258 finished with values: [0.07103774175444764, 0.009103087949628243, 0.03724517458248375] and parameters: {'n_layers': 1, 'embedding_dim': 96, 'lr': 0.008398190913230083, 'lambda_val': 7.4032238942432714e-06, 'batch_size': 2901, 'optimizer': 'Adam'}.
2026-06-06 04:02:00,865 - optuna.study.study - INFO - Trial 259 finished with values: [0.09753634473813443, 0.011968316699042133, 0.05233554605542171] and parameters: {'n_layers': 1, 'embedding_dim': 256, 'lr': 0.0011525517839870857, 'lambda_val': 1.9645451789230886e-06, 'batch_size': 1890, 'optimizer': 'RMSprop'}.
2026-06-06 04:02:40,653 - experiment_functions - INFO - Early stopping at epoch 1000. Best Metrics: (0.06279480233687369, 0.007691405988344832, 0.031508309262233136)
2026-06-06 04:02:40,863 - optuna.study.study - INFO - Trial 260 finished with values: [0.06279480233687369, 0.007691405988344832, 0.031508309262233136] and parameters: {'n_layers': 2, 'embedding_dim': 32, 'lr': 0.0025949620955328543, 'lambda_val': 1.482563488933184e-06, 'batch_size': 2133, 'optimizer': 'Adam'}.
2026-06-06 04:03:03,945 - experiment_functions - INFO - Early stopping at epoch 500. Best Metrics: (0.0004969163473574699, 8.205506062026927e-05, 0.0002102641631344706)
2026-06-06 04:03:04,043 - optuna.study.study - INFO - Trial 261 finished with values: [0.0004969163473574699, 8.205506062026927e-05, 0.0002102641631344706] and parameters: {'n_layers': 1, 'embedding_dim': 256, 'lr': 0.0011525517839870857, 'lambda_val': 3.1920449116234754e-05, 'batch_size': 3853, 'optimizer': 'SGD'}.
2026-06-06 04:05:35,819 - optuna.study.study - INFO - Trial 262 finished with values: [0.013500830892316759, 0.002272422801259294, 0.008077336755803872] and parameters: {'n_layers': 1, 'embedding_dim': 96, 'lr': 0.0006492139755404522, 'lambda_val': 2.7872631749241567e-05, 'batch_size': 738, 'optimizer': 'Adam'}.
2026-06-06 04:08:16,065 - optuna.study.study - INFO - Trial 263 finished with values: [0.08896083588868596, 0.011167861209726036, 0.04757314568047015] and parameters: {'n_layers': 1, 'embedding_dim': 96, 'lr': 0.0011525517839870857, 'lambda_val': 2.80429275845163e-06, 'batch_size': 1890, 'optimizer': 'Adam'}.
2026-06-06 04:10:48,403 - optuna.study.study - INFO - Trial 264 finished with values: [0.08275811011867192, 0.010305445776676267, 0.04368808551847312] and parameters: {'n_layers': 1, 'embedding_dim': 32, 'lr': 0.0011525517839870857, 'lambda_val': 3.1920449116234754e-05, 'batch_size': 3871, 'optimizer': 'Adam'}.
2026-06-06 04:13:51,060 - optuna.study.study - INFO - Trial 265 finished with values: [0.09176109332199783, 0.011455891218433921, 0.048399979397804604] and parameters: {'n_layers': 1, 'embedding_dim': 256, 'lr': 0.0008375189225934038, 'lambda_val': 1.482563488933184e-06, 'batch_size': 3786, 'optimizer': 'Adam'}.
