2026-06-07 05:28:33,446 - optuna.study.study - INFO - Trial 47 finished with values: [0.001394259528515842, 0.00019927657579208252, 0.0007053015784089135] and parameters: {'n_layers': 1, 'embedding_dim': 256, 'lr': 0.0001472985477228042, 'lambda_val': 6.85355234334663e-06, 'batch_size': 3184, 'optimizer': 'RMSprop'}.
2026-06-07 05:30:30,118 - experiment_functions - INFO - Early stopping at epoch 3100. Best Metrics: (0.01201893836739397, 0.001761671913724965, 0.005933539614203319)
2026-06-07 05:30:30,189 - optuna.study.study - INFO - Trial 48 finished with values: [0.01201893836739397, 0.001761671913724965, 0.005933539614203319] and parameters: {'n_layers': 1, 'embedding_dim': 96, 'lr': 0.00452528290927792, 'lambda_val': 0.021783435050720258, 'batch_size': 2649, 'optimizer': 'RMSprop'}.
2026-06-07 05:30:51,720 - experiment_functions - INFO - Early stopping at epoch 500. Best Metrics: (0.00041172976992711664, 7.535668832473711e-05, 0.00018070068034554238)
2026-06-07 05:30:52,087 - optuna.study.study - INFO - Trial 49 finished with values: [0.00041172976992711664, 7.535668832473711e-05, 0.00018070068034554238] and parameters: {'n_layers': 4, 'embedding_dim': 64, 'lr': 0.00916725787035205, 'lambda_val': 0.0008084185475209273, 'batch_size': 3741, 'optimizer': 'SGD'}.
2026-06-07 05:31:37,185 - experiment_functions - INFO - Early stopping at epoch 950. Best Metrics: (0.013568265582168594, 0.002054725701654498, 0.006928770665538785)
2026-06-07 05:31:37,680 - optuna.study.study - INFO - Trial 50 finished with values: [0.013568265582168594, 0.002054725701654498, 0.006928770665538785] and parameters: {'n_layers': 2, 'embedding_dim': 256, 'lr': 0.002620274475670763, 'lambda_val': 0.005434072620439486, 'batch_size': 758, 'optimizer': 'RMSprop'}.
2026-06-07 05:34:23,207 - optuna.study.study - INFO - Trial 51 finished with values: [0.0011292293026839365, 0.0001657847143144216, 0.000563956568906267] and parameters: {'n_layers': 1, 'embedding_dim': 256, 'lr': 0.0001472985477228042, 'lambda_val': 0.006159233636228718, 'batch_size': 3741, 'optimizer': 'RMSprop'}.
2026-06-07 05:36:52,866 - optuna.study.study - INFO - Trial 52 finished with values: [0.003913429938353066, 0.0006547658918882712, 0.0021851528477943973] and parameters: {'n_layers': 1, 'embedding_dim': 96, 'lr': 0.0004340370842280224, 'lambda_val': 0.0059525210668399465, 'batch_size': 1703, 'optimizer': 'Adam'}.
2026-06-07 05:38:38,421 - experiment_functions - INFO - Early stopping at epoch 2150. Best Metrics: (0.010581589543708782, 0.0015305780695291046, 0.005067478961350254)
2026-06-07 05:38:38,503 - optuna.study.study - INFO - Trial 53 finished with values: [0.010581589543708782, 0.0015305780695291046, 0.005067478961350254] and parameters: {'n_layers': 3, 'embedding_dim': 256, 'lr': 0.02223911438745917, 'lambda_val': 0.004387272924170296, 'batch_size': 3899, 'optimizer': 'RMSprop'}.
2026-06-07 05:41:05,481 - optuna.study.study - INFO - Trial 54 finished with values: [0.01769420353171503, 0.002873601714783308, 0.010150276509179436] and parameters: {'n_layers': 2, 'embedding_dim': 32, 'lr': 0.0005083437319990123, 'lambda_val': 1.471855561908882e-05, 'batch_size': 3184, 'optimizer': 'RMSprop'}.
2026-06-07 05:41:37,560 - experiment_functions - INFO - Early stopping at epoch 750. Best Metrics: (0.010655129217767909, 0.0015824904548194792, 0.005455019546611183)
2026-06-07 05:41:37,648 - optuna.study.study - INFO - Trial 55 finished with values: [0.010655129217767909, 0.0015824904548194792, 0.005455019546611183] and parameters: {'n_layers': 3, 'embedding_dim': 96, 'lr': 0.003577419943834574, 'lambda_val': 0.014184326652360543, 'batch_size': 975, 'optimizer': 'RMSprop'}.
2026-06-07 05:42:05,795 - experiment_functions - INFO - Early stopping at epoch 700. Best Metrics: (0.01756933582974266, 0.0027195391519860674, 0.009211644601370186)
2026-06-07 05:42:05,886 - optuna.study.study - INFO - Trial 56 finished with values: [0.01756933582974266, 0.0027195391519860674, 0.009211644601370186] and parameters: {'n_layers': 3, 'embedding_dim': 32, 'lr': 0.006175201562705211, 'lambda_val': 5.656965316395304e-06, 'batch_size': 1182, 'optimizer': 'RMSprop'}.
2026-06-07 05:44:41,133 - optuna.study.study - INFO - Trial 57 finished with values: [0.0007098472134035565, 9.71263982852167e-05, 0.0003035641643068769] and parameters: {'n_layers': 4, 'embedding_dim': 64, 'lr': 3.966301487977207e-05, 'lambda_val': 5.656965316395304e-06, 'batch_size': 1182, 'optimizer': 'RMSprop'}.
2026-06-07 05:45:02,841 - experiment_functions - INFO - Early stopping at epoch 550. Best Metrics: (0.0031743310116694083, 0.0005559649005291715, 0.0017224956959032466)
2026-06-07 05:45:03,362 - optuna.study.study - INFO - Trial 58 finished with values: [0.0031743310116694083, 0.0005559649005291715, 0.0017224956959032466] and parameters: {'n_layers': 1, 'embedding_dim': 32, 'lr': 0.022536607156936374, 'lambda_val': 2.5313317558461653e-05, 'batch_size': 3822, 'optimizer': 'RMSprop'}.
2026-06-07 05:45:33,483 - experiment_functions - INFO - Early stopping at epoch 600. Best Metrics: (0.0006194115169615702, 8.372965369415233e-05, 0.0002873416154496066)
2026-06-07 05:45:33,937 - optuna.study.study - INFO - Trial 59 finished with values: [0.0006194115169615702, 8.372965369415233e-05, 0.0002873416154496066] and parameters: {'n_layers': 2, 'embedding_dim': 256, 'lr': 4.614198742907089e-05, 'lambda_val': 0.02222089887931214, 'batch_size': 2094, 'optimizer': 'Adam'}.
2026-06-07 05:45:59,922 - experiment_functions - INFO - Early stopping at epoch 500. Best Metrics: (0.0005132763025779911, 6.363453680755576e-05, 0.00020437022848821847)
2026-06-07 05:46:00,252 - optuna.study.study - INFO - Trial 60 finished with values: [0.0005132763025779911, 6.363453680755576e-05, 0.00020437022848821847] and parameters: {'n_layers': 3, 'embedding_dim': 256, 'lr': 0.0002630126249512911, 'lambda_val': 0.0015185052562471204, 'batch_size': 3729, 'optimizer': 'SGD'}.
2026-06-07 05:48:15,043 - experiment_functions - INFO - Early stopping at epoch 3350. Best Metrics: (0.0005922310087155202, 8.875343291580147e-05, 0.0002701380819650494)
2026-06-07 05:48:15,991 - optuna.study.study - INFO - Trial 61 finished with values: [0.0005922310087155202, 8.875343291580147e-05, 0.0002701380819650494] and parameters: {'n_layers': 2, 'embedding_dim': 128, 'lr': 4.5961760534188086e-05, 'lambda_val': 7.861589022264094e-05, 'batch_size': 4087, 'optimizer': 'Adam'}.
2026-06-07 05:49:30,676 - experiment_functions - INFO - Early stopping at epoch 1600. Best Metrics: (0.016064344904753867, 0.0026458570567352135, 0.008983883040821128)
2026-06-07 05:49:30,748 - optuna.study.study - INFO - Trial 62 finished with values: [0.016064344904753867, 0.0026458570567352135, 0.008983883040821128] and parameters: {'n_layers': 2, 'embedding_dim': 256, 'lr': 0.0010160627847963985, 'lambda_val': 0.005434072620439486, 'batch_size': 758, 'optimizer': 'RMSprop'}.
2026-06-07 05:49:52,519 - experiment_functions - INFO - Early stopping at epoch 500. Best Metrics: (0.0004878266567994231, 6.86583160292049e-05, 0.00024062373550070854)
2026-06-07 05:49:52,633 - optuna.study.study - INFO - Trial 63 finished with values: [0.0004878266567994231, 6.86583160292049e-05, 0.00024062373550070854] and parameters: {'n_layers': 4, 'embedding_dim': 64, 'lr': 3.966301487977207e-05, 'lambda_val': 0.00018768173634322157, 'batch_size': 1562, 'optimizer': 'SGD'}.
2026-06-07 05:50:29,253 - experiment_functions - INFO - Early stopping at epoch 900. Best Metrics: (0.004933338436367927, 0.0007234242079174761, 0.0027880704070663517)
2026-06-07 05:50:29,331 - optuna.study.study - INFO - Trial 64 finished with values: [0.004933338436367927, 0.0007234242079174761, 0.0027880704070663517] and parameters: {'n_layers': 1, 'embedding_dim': 128, 'lr': 0.0656762277075806, 'lambda_val': 2.3950847744868506e-06, 'batch_size': 616, 'optimizer': 'RMSprop'}.
2026-06-07 05:51:49,296 - experiment_functions - INFO - Early stopping at epoch 1700. Best Metrics: (0.01992560513533827, 0.003118092303570232, 0.010895488457302633)
2026-06-07 05:51:49,373 - optuna.study.study - INFO - Trial 65 finished with values: [0.01992560513533827, 0.003118092303570232, 0.010895488457302633] and parameters: {'n_layers': 2, 'embedding_dim': 256, 'lr': 0.0013734258944280648, 'lambda_val': 0.00010082268820599092, 'batch_size': 1703, 'optimizer': 'Adam'}.
2026-06-07 05:52:09,848 - experiment_functions - INFO - Early stopping at epoch 500. Best Metrics: (0.00040973396408453585, 5.191238529037445e-05, 0.00016686956243858585)
2026-06-07 05:52:10,120 - optuna.study.study - INFO - Trial 66 finished with values: [0.00040973396408453585, 5.191238529037445e-05, 0.00016686956243858585] and parameters: {'n_layers': 1, 'embedding_dim': 64, 'lr': 0.00022098219173494524, 'lambda_val': 0.01247604248844867, 'batch_size': 1222, 'optimizer': 'Adam'}.
2026-06-07 05:54:48,779 - experiment_functions - INFO - Early stopping at epoch 3500. Best Metrics: (0.011526727804963763, 0.001703061156139058, 0.00556090241249544)
2026-06-07 05:54:48,866 - optuna.study.study - INFO - Trial 67 finished with values: [0.011526727804963763, 0.001703061156139058, 0.00556090241249544] and parameters: {'n_layers': 2, 'embedding_dim': 256, 'lr': 0.0759131217119495, 'lambda_val': 0.0023488579024072286, 'batch_size': 1568, 'optimizer': 'RMSprop'}.
2026-06-07 05:55:15,463 - experiment_functions - INFO - Early stopping at epoch 600. Best Metrics: (0.013480125974434763, 0.00208319378391051, 0.007039095441822602)
2026-06-07 05:55:15,655 - optuna.study.study - INFO - Trial 68 finished with values: [0.013480125974434763, 0.00208319378391051, 0.007039095441822602] and parameters: {'n_layers': 3, 'embedding_dim': 96, 'lr': 0.015349366472401656, 'lambda_val': 0.00027879781240501165, 'batch_size': 628, 'optimizer': 'Adam'}.
2026-06-07 05:55:52,202 - experiment_functions - INFO - Early stopping at epoch 650. Best Metrics: (0.022324663381326607, 0.0034831535936767364, 0.012096552983178367)
2026-06-07 05:55:53,262 - optuna.study.study - INFO - Trial 69 finished with values: [0.022324663381326607, 0.0034831535936767364, 0.012096552983178367] and parameters: {'n_layers': 4, 'embedding_dim': 256, 'lr': 0.002168096883511623, 'lambda_val': 5.604086483439305e-05, 'batch_size': 2975, 'optimizer': 'RMSprop'}.
2026-06-07 05:56:17,854 - experiment_functions - INFO - Early stopping at epoch 550. Best Metrics: (0.0072706675028623696, 0.0009980574720342957, 0.003939129604829186)
2026-06-07 05:56:17,944 - optuna.study.study - INFO - Trial 70 finished with values: [0.0072706675028623696, 0.0009980574720342957, 0.003939129604829186] and parameters: {'n_layers': 2, 'embedding_dim': 128, 'lr': 0.08900268421806791, 'lambda_val': 2.029005253393236e-05, 'batch_size': 2818, 'optimizer': 'Adam'}.
2026-06-07 05:58:45,420 - optuna.study.study - INFO - Trial 71 finished with values: [0.01692178411761187, 0.00260566682296202, 0.009806066311471356] and parameters: {'n_layers': 1, 'embedding_dim': 32, 'lr': 0.0010160627847963985, 'lambda_val': 2.5313317558461653e-05, 'batch_size': 2198, 'optimizer': 'RMSprop'}.
2026-06-07 06:01:31,214 - optuna.study.study - INFO - Trial 72 finished with values: [0.0056479797072888326, 0.0011052314287628106, 0.0031148610711815173] and parameters: {'n_layers': 4, 'embedding_dim': 96, 'lr': 0.00016546768703671984, 'lambda_val': 0.01640628387641808, 'batch_size': 2740, 'optimizer': 'RMSprop'}.
2026-06-07 06:01:55,912 - experiment_functions - INFO - Early stopping at epoch 500. Best Metrics: (0.0035394518089813787, 0.0006480675195927391, 0.001961587467042752)
2026-06-07 06:01:56,036 - optuna.study.study - INFO - Trial 73 finished with values: [0.0035394518089813787, 0.0006480675195927391, 0.001961587467042752] and parameters: {'n_layers': 2, 'embedding_dim': 256, 'lr': 0.08766342330978934, 'lambda_val': 0.02500021456838615, 'batch_size': 621, 'optimizer': 'RMSprop'}.
2026-06-07 06:02:32,499 - experiment_functions - INFO - Early stopping at epoch 900. Best Metrics: (0.023361209570809414, 0.003478129814455087, 0.012129713583699372)
2026-06-07 06:02:32,585 - optuna.study.study - INFO - Trial 74 finished with values: [0.023361209570809414, 0.003478129814455087, 0.012129713583699372] and parameters: {'n_layers': 4, 'embedding_dim': 32, 'lr': 0.002168096883511623, 'lambda_val': 5.604086483439305e-05, 'batch_size': 2975, 'optimizer': 'RMSprop'}.
2026-06-07 06:03:01,781 - experiment_functions - INFO - Early stopping at epoch 550. Best Metrics: (0.011170961444999239, 0.0015925380132627773, 0.005793948083640898)
2026-06-07 06:03:01,889 - optuna.study.study - INFO - Trial 75 finished with values: [0.011170961444999239, 0.0015925380132627773, 0.005793948083640898] and parameters: {'n_layers': 3, 'embedding_dim': 256, 'lr': 0.023750676895038965, 'lambda_val': 5.775403096605942e-06, 'batch_size': 3503, 'optimizer': 'RMSprop'}.
2026-06-07 06:03:25,515 - experiment_functions - INFO - Early stopping at epoch 500. Best Metrics: (0.0004928177636879258, 6.865831602920491e-05, 0.0002092975206053979)
2026-06-07 06:03:25,610 - optuna.study.study - INFO - Trial 76 finished with values: [0.0004928177636879258, 6.865831602920491e-05, 0.0002092975206053979] and parameters: {'n_layers': 4, 'embedding_dim': 128, 'lr': 9.390346607225947e-05, 'lambda_val': 2.5313317558461653e-05, 'batch_size': 3290, 'optimizer': 'SGD'}.
2026-06-07 06:03:49,243 - experiment_functions - INFO - Early stopping at epoch 500. Best Metrics: (0.0005415020617606702, 6.865831602920491e-05, 0.00024979722693859845)
2026-06-07 06:03:49,315 - optuna.study.study - INFO - Trial 77 finished with values: [0.0005415020617606702, 6.865831602920491e-05, 0.00024979722693859845] and parameters: {'n_layers': 4, 'embedding_dim': 128, 'lr': 0.0001562882837296512, 'lambda_val': 0.02500021456838615, 'batch_size': 947, 'optimizer': 'RMSprop'}.
2026-06-07 06:05:15,502 - experiment_functions - INFO - Early stopping at epoch 2050. Best Metrics: (0.0006275107252462958, 0.00010382477058074888, 0.0003178232790347625)
2026-06-07 06:05:15,850 - optuna.study.study - INFO - Trial 78 finished with values: [0.0006275107252462958, 0.00010382477058074888, 0.0003178232790347625] and parameters: {'n_layers': 1, 'embedding_dim': 256, 'lr': 0.0001472985477228042, 'lambda_val': 0.00552911060843172, 'batch_size': 3184, 'optimizer': 'RMSprop'}.
2026-06-07 06:05:38,109 - experiment_functions - INFO - Early stopping at epoch 500. Best Metrics: (0.00039359705168766416, 5.526157143814053e-05, 0.00017163267079554166)
2026-06-07 06:05:38,215 - optuna.study.study - INFO - Trial 79 finished with values: [0.00039359705168766416, 5.526157143814053e-05, 0.00017163267079554166] and parameters: {'n_layers': 2, 'embedding_dim': 128, 'lr': 1.9977675822379625e-05, 'lambda_val': 0.0023488579024072286, 'batch_size': 3227, 'optimizer': 'RMSprop'}.
2026-06-07 06:06:00,091 - experiment_functions - INFO - Early stopping at epoch 550. Best Metrics: (0.0003022681061901524, 6.865831602920491e-05, 0.00016377017341632854)
2026-06-07 06:06:00,611 - optuna.study.study - INFO - Trial 80 finished with values: [0.0003022681061901524, 6.865831602920491e-05, 0.00016377017341632854] and parameters: {'n_layers': 2, 'embedding_dim': 32, 'lr': 0.09496291242022484, 'lambda_val': 0.005434072620439486, 'batch_size': 758, 'optimizer': 'SGD'}.
2026-06-07 06:07:28,807 - experiment_functions - INFO - Early stopping at epoch 2350. Best Metrics: (0.0006167853484705923, 9.210261906356756e-05, 0.000260086730919461)
2026-06-07 06:07:28,901 - optuna.study.study - INFO - Trial 81 finished with values: [0.0006167853484705923, 9.210261906356756e-05, 0.000260086730919461] and parameters: {'n_layers': 2, 'embedding_dim': 64, 'lr': 8.374887345125696e-05, 'lambda_val': 0.0006579114242834636, 'batch_size': 2050, 'optimizer': 'Adam'}.
2026-06-07 06:07:51,833 - experiment_functions - INFO - Early stopping at epoch 550. Best Metrics: (0.004852612513890536, 0.0007786857793556166, 0.0026705416583521014)
2026-06-07 06:07:51,926 - optuna.study.study - INFO - Trial 82 finished with values: [0.004852612513890536, 0.0007786857793556166, 0.0026705416583521014] and parameters: {'n_layers': 4, 'embedding_dim': 32, 'lr': 0.09061033244267265, 'lambda_val': 0.0004389667826837536, 'batch_size': 2881, 'optimizer': 'Adam'}.
2026-06-07 06:08:36,325 - experiment_functions - INFO - Early stopping at epoch 1100. Best Metrics: (0.00047211135374627803, 8.540424676803538e-05, 0.00026826347084916064)
2026-06-07 06:08:36,569 - optuna.study.study - INFO - Trial 83 finished with values: [0.00047211135374627803, 8.540424676803538e-05, 0.00026826347084916064] and parameters: {'n_layers': 2, 'embedding_dim': 96, 'lr': 4.5961760534188086e-05, 'lambda_val': 7.861589022264094e-05, 'batch_size': 4087, 'optimizer': 'RMSprop'}.
2026-06-07 06:09:26,083 - experiment_functions - INFO - Early stopping at epoch 1250. Best Metrics: (0.0006017995234669725, 0.00010884854980239804, 0.00029867387032736167)
2026-06-07 06:09:26,450 - optuna.study.study - INFO - Trial 84 finished with values: [0.0006017995234669725, 0.00010884854980239804, 0.00029867387032736167] and parameters: {'n_layers': 1, 'embedding_dim': 128, 'lr': 3.717461658488425e-05, 'lambda_val': 0.0008628561498380414, 'batch_size': 2094, 'optimizer': 'RMSprop'}.
2026-06-07 06:10:15,542 - experiment_functions - INFO - Early stopping at epoch 1050. Best Metrics: (0.0004591942917633285, 6.363453680755576e-05, 0.00017087137920053985)
2026-06-07 06:10:15,865 - optuna.study.study - INFO - Trial 85 finished with values: [0.0004591942917633285, 6.363453680755576e-05, 0.00017087137920053985] and parameters: {'n_layers': 2, 'embedding_dim': 256, 'lr': 1.195735477996289e-05, 'lambda_val': 0.002864379498293188, 'batch_size': 2746, 'optimizer': 'RMSprop'}.
2026-06-07 06:10:36,125 - experiment_functions - INFO - Early stopping at epoch 500. Best Metrics: (0.00038325725340001995, 6.698372295532187e-05, 0.000207921769101313)
2026-06-07 06:10:36,314 - optuna.study.study - INFO - Trial 86 finished with values: [0.00038325725340001995, 6.698372295532187e-05, 0.000207921769101313] and parameters: {'n_layers': 1, 'embedding_dim': 32, 'lr': 0.015349366472401656, 'lambda_val': 2.5313317558461653e-05, 'batch_size': 3822, 'optimizer': 'SGD'}.
2026-06-07 06:12:08,095 - experiment_functions - INFO - Early stopping at epoch 2450. Best Metrics: (0.008824050686034072, 0.0013162301560720744, 0.004183485020858645)
2026-06-07 06:12:08,650 - optuna.study.study - INFO - Trial 87 finished with values: [0.008824050686034072, 0.0013162301560720744, 0.004183485020858645] and parameters: {'n_layers': 1, 'embedding_dim': 64, 'lr': 0.07402063684569152, 'lambda_val': 0.03814463959770115, 'batch_size': 1315, 'optimizer': 'Adam'}.
2026-06-07 06:12:31,558 - experiment_functions - INFO - Early stopping at epoch 550. Best Metrics: (0.00700096277813854, 0.0011002076495411615, 0.00358699577025498)
2026-06-07 06:12:31,648 - optuna.study.study - INFO - Trial 88 finished with values: [0.00700096277813854, 0.0011002076495411615, 0.00358699577025498] and parameters: {'n_layers': 4, 'embedding_dim': 32, 'lr': 0.022536607156936374, 'lambda_val': 2.5313317558461653e-05, 'batch_size': 2687, 'optimizer': 'RMSprop'}.
2026-06-07 06:12:53,400 - experiment_functions - INFO - Early stopping at epoch 500. Best Metrics: (0.0004909417145719969, 6.028535065978968e-05, 0.00017470924186027315)
2026-06-07 06:12:53,494 - optuna.study.study - INFO - Trial 89 finished with values: [0.0004909417145719969, 6.028535065978968e-05, 0.00017470924186027315] and parameters: {'n_layers': 4, 'embedding_dim': 64, 'lr': 2.250105470988928e-05, 'lambda_val': 0.03814463959770115, 'batch_size': 1315, 'optimizer': 'Adam'}.
2026-06-07 06:13:39,420 - experiment_functions - INFO - Early stopping at epoch 1150. Best Metrics: (0.0005617516718522834, 8.540424676803537e-05, 0.0002787492896519164)
2026-06-07 06:13:39,686 - optuna.study.study - INFO - Trial 90 finished with values: [0.0005617516718522834, 8.540424676803537e-05, 0.0002787492896519164] and parameters: {'n_layers': 1, 'embedding_dim': 128, 'lr': 0.00013820443624134663, 'lambda_val': 2.5313317558461653e-05, 'batch_size': 572, 'optimizer': 'Adam'}.
2026-06-07 06:15:33,822 - experiment_functions - INFO - Early stopping at epoch 3050. Best Metrics: (0.009833650273917761, 0.0015707683033022977, 0.005154507632432754)
2026-06-07 06:15:33,925 - optuna.study.study - INFO - Trial 91 finished with values: [0.009833650273917761, 0.0015707683033022977, 0.005154507632432754] and parameters: {'n_layers': 1, 'embedding_dim': 64, 'lr': 0.0038611334200534756, 'lambda_val': 0.01247604248844867, 'batch_size': 1312, 'optimizer': 'RMSprop'}.
2026-06-07 06:16:07,757 - experiment_functions - INFO - Early stopping at epoch 800. Best Metrics: (0.019186909923673882, 0.0030444102083193782, 0.010753295270205583)
2026-06-07 06:16:08,182 - optuna.study.study - INFO - Trial 92 finished with values: [0.019186909923673882, 0.0030444102083193782, 0.010753295270205583] and parameters: {'n_layers': 2, 'embedding_dim': 96, 'lr': 0.002620274475670763, 'lambda_val': 1.8902402933529376e-05, 'batch_size': 2881, 'optimizer': 'RMSprop'}.
2026-06-07 06:16:28,649 - experiment_functions - INFO - Early stopping at epoch 500. Best Metrics: (0.0003806204341683595, 5.5261571438140545e-05, 0.00017833980560867318)
2026-06-07 06:16:28,742 - optuna.study.study - INFO - Trial 93 finished with values: [0.0003806204341683595, 5.5261571438140545e-05, 0.00017833980560867318] and parameters: {'n_layers': 2, 'embedding_dim': 32, 'lr': 0.00011467697518617014, 'lambda_val': 0.0028600820147763138, 'batch_size': 4084, 'optimizer': 'SGD'}.
2026-06-07 06:19:12,843 - optuna.study.study - INFO - Trial 94 finished with values: [0.02807935821495281, 0.0044359970527161905, 0.01535238642609188] and parameters: {'n_layers': 2, 'embedding_dim': 128, 'lr': 0.0009791612272847586, 'lambda_val': 0.0008628561498380414, 'batch_size': 572, 'optimizer': 'RMSprop'}.
