2026-06-07 07:27:12,538 - optuna.study.study - INFO - Trial 145 finished with values: [0.010244536750561016, 0.0014234041128005895, 0.005060937818288987] and parameters: {'n_layers': 4, 'embedding_dim': 256, 'lr': 0.0038611334200534756, 'lambda_val': 0.01247604248844867, 'batch_size': 1312, 'optimizer': 'RMSprop'}.
2026-06-07 07:27:35,040 - experiment_functions - INFO - Early stopping at epoch 550. Best Metrics: (0.00877114224137336, 0.0013698171344363322, 0.004527385026836788)
2026-06-07 07:27:35,126 - optuna.study.study - INFO - Trial 146 finished with values: [0.00877114224137336, 0.0013698171344363322, 0.004527385026836788] and parameters: {'n_layers': 3, 'embedding_dim': 32, 'lr': 0.006175201562705211, 'lambda_val': 0.01247604248844867, 'batch_size': 2737, 'optimizer': 'RMSprop'}.
2026-06-07 07:28:07,584 - experiment_functions - INFO - Early stopping at epoch 750. Best Metrics: (0.017832379223764194, 0.0027262375242815997, 0.009630141881046385)
2026-06-07 07:28:08,971 - optuna.study.study - INFO - Trial 147 finished with values: [0.017832379223764194, 0.0027262375242815997, 0.009630141881046385] and parameters: {'n_layers': 3, 'embedding_dim': 96, 'lr': 0.002168096883511623, 'lambda_val': 0.0059525210668399465, 'batch_size': 2975, 'optimizer': 'Adam'}.
2026-06-07 07:28:40,345 - experiment_functions - INFO - Early stopping at epoch 600. Best Metrics: (0.011912024624439185, 0.0016712438877352802, 0.006055747498210776)
2026-06-07 07:28:40,890 - optuna.study.study - INFO - Trial 148 finished with values: [0.011912024624439185, 0.0016712438877352802, 0.006055747498210776] and parameters: {'n_layers': 3, 'embedding_dim': 256, 'lr': 0.02223911438745917, 'lambda_val': 6.160400429327822e-06, 'batch_size': 3654, 'optimizer': 'RMSprop'}.
2026-06-07 07:29:32,227 - experiment_functions - INFO - Early stopping at epoch 1300. Best Metrics: (0.02276576709352539, 0.0035886529573313686, 0.012745034132565175)
2026-06-07 07:29:32,296 - optuna.study.study - INFO - Trial 149 finished with values: [0.02276576709352539, 0.0035886529573313686, 0.012745034132565175] and parameters: {'n_layers': 2, 'embedding_dim': 64, 'lr': 0.0013734258944280648, 'lambda_val': 1.471855561908882e-05, 'batch_size': 3184, 'optimizer': 'RMSprop'}.
2026-06-07 07:30:10,146 - experiment_functions - INFO - Early stopping at epoch 950. Best Metrics: (0.018601737750031558, 0.00286355415634001, 0.010236904147334065)
2026-06-07 07:30:10,376 - optuna.study.study - INFO - Trial 150 finished with values: [0.018601737750031558, 0.00286355415634001, 0.010236904147334065] and parameters: {'n_layers': 2, 'embedding_dim': 64, 'lr': 0.0038611334200534756, 'lambda_val': 5.656965316395304e-06, 'batch_size': 1182, 'optimizer': 'RMSprop'}.
2026-06-07 07:30:34,531 - experiment_functions - INFO - Early stopping at epoch 550. Best Metrics: (0.017936957311148517, 0.0027228883381338336, 0.009499055969689564)
2026-06-07 07:30:34,701 - optuna.study.study - INFO - Trial 151 finished with values: [0.017936957311148517, 0.0027228883381338336, 0.009499055969689564] and parameters: {'n_layers': 4, 'embedding_dim': 64, 'lr': 0.004996275630099498, 'lambda_val': 1.8902402933529376e-05, 'batch_size': 3731, 'optimizer': 'RMSprop'}.
2026-06-07 07:31:07,018 - experiment_functions - INFO - Early stopping at epoch 750. Best Metrics: (0.0188143455523435, 0.002840109853305647, 0.009854247738401902)
2026-06-07 07:31:07,116 - optuna.study.study - INFO - Trial 152 finished with values: [0.0188143455523435, 0.002840109853305647, 0.009854247738401902] and parameters: {'n_layers': 3, 'embedding_dim': 96, 'lr': 0.0028531654456578, 'lambda_val': 0.001761785848083831, 'batch_size': 1182, 'optimizer': 'RMSprop'}.
2026-06-07 07:31:29,368 - experiment_functions - INFO - Early stopping at epoch 550. Best Metrics: (0.007998001260013059, 0.0011822627101614306, 0.004214480235985698)
2026-06-07 07:31:29,915 - optuna.study.study - INFO - Trial 153 finished with values: [0.007998001260013059, 0.0011822627101614306, 0.004214480235985698] and parameters: {'n_layers': 3, 'embedding_dim': 32, 'lr': 0.009211885153670146, 'lambda_val': 0.0059525210668399465, 'batch_size': 1703, 'optimizer': 'RMSprop'}.
2026-06-07 07:32:07,628 - experiment_functions - INFO - Early stopping at epoch 950. Best Metrics: (0.02624512367061069, 0.003960412619733405, 0.013886361559733352)
2026-06-07 07:32:07,704 - optuna.study.study - INFO - Trial 154 finished with values: [0.02624512367061069, 0.003960412619733405, 0.013886361559733352] and parameters: {'n_layers': 3, 'embedding_dim': 32, 'lr': 0.003872913927860718, 'lambda_val': 5.656965316395304e-06, 'batch_size': 1182, 'optimizer': 'RMSprop'}.
2026-06-07 07:33:24,264 - experiment_functions - INFO - Early stopping at epoch 2000. Best Metrics: (0.013307011969197627, 0.002190367740639025, 0.0072039632150052)
2026-06-07 07:33:24,349 - optuna.study.study - INFO - Trial 155 finished with values: [0.013307011969197627, 0.002190367740639025, 0.0072039632150052] and parameters: {'n_layers': 2, 'embedding_dim': 64, 'lr': 0.0010160627847963985, 'lambda_val': 0.014495536719284082, 'batch_size': 2050, 'optimizer': 'Adam'}.
2026-06-07 07:34:03,379 - experiment_functions - INFO - Early stopping at epoch 950. Best Metrics: (0.020105824196071237, 0.0031046955589791683, 0.011254125892388214)
2026-06-07 07:34:03,755 - optuna.study.study - INFO - Trial 156 finished with values: [0.020105824196071237, 0.0031046955589791683, 0.011254125892388214] and parameters: {'n_layers': 2, 'embedding_dim': 96, 'lr': 0.002620274475670763, 'lambda_val': 0.00010082268820599092, 'batch_size': 2050, 'optimizer': 'Adam'}.
2026-06-07 07:34:42,517 - experiment_functions - INFO - Early stopping at epoch 900. Best Metrics: (0.023087159857038943, 0.003618795632661264, 0.012809173655056101)
2026-06-07 07:34:43,458 - optuna.study.study - INFO - Trial 157 finished with values: [0.023087159857038943, 0.003618795632661264, 0.012809173655056101] and parameters: {'n_layers': 3, 'embedding_dim': 96, 'lr': 0.0010160627847963985, 'lambda_val': 0.001673308701517779, 'batch_size': 3739, 'optimizer': 'RMSprop'}.
2026-06-07 07:35:19,793 - experiment_functions - INFO - Early stopping at epoch 650. Best Metrics: (0.020872899089164572, 0.0034061223122781167, 0.0114072685933508)
2026-06-07 07:35:21,021 - optuna.study.study - INFO - Trial 158 finished with values: [0.020872899089164572, 0.0034061223122781167, 0.0114072685933508] and parameters: {'n_layers': 4, 'embedding_dim': 256, 'lr': 0.002168096883511623, 'lambda_val': 0.001761785848083831, 'batch_size': 2975, 'optimizer': 'Adam'}.
2026-06-07 07:36:06,066 - experiment_functions - INFO - Early stopping at epoch 1100. Best Metrics: (0.023701279719670423, 0.0037427155201286088, 0.013249683736559386)
2026-06-07 07:36:06,155 - optuna.study.study - INFO - Trial 159 finished with values: [0.023701279719670423, 0.0037427155201286088, 0.013249683736559386] and parameters: {'n_layers': 2, 'embedding_dim': 96, 'lr': 0.002168096883511623, 'lambda_val': 5.604086483439305e-05, 'batch_size': 1514, 'optimizer': 'RMSprop'}.
2026-06-07 07:36:39,691 - experiment_functions - INFO - Early stopping at epoch 650. Best Metrics: (0.0198222503275201, 0.0029020697970393197, 0.009951522522811692)
2026-06-07 07:36:40,073 - optuna.study.study - INFO - Trial 160 finished with values: [0.0198222503275201, 0.0029020697970393197, 0.009951522522811692] and parameters: {'n_layers': 3, 'embedding_dim': 256, 'lr': 0.003577419943834574, 'lambda_val': 1.8902402933529376e-05, 'batch_size': 1703, 'optimizer': 'RMSprop'}.
2026-06-07 07:37:47,783 - experiment_functions - INFO - Early stopping at epoch 1450. Best Metrics: (0.024600375475509733, 0.0038917543037042, 0.013495565209374087)
2026-06-07 07:37:47,954 - optuna.study.study - INFO - Trial 161 finished with values: [0.024600375475509733, 0.0038917543037042, 0.013495565209374087] and parameters: {'n_layers': 2, 'embedding_dim': 256, 'lr': 0.0013734258944280648, 'lambda_val': 5.604086483439305e-05, 'batch_size': 1111, 'optimizer': 'RMSprop'}.
2026-06-07 07:38:31,346 - experiment_functions - INFO - Early stopping at epoch 1150. Best Metrics: (0.0007251910544459602, 9.210261906356756e-05, 0.00028463234709487064)
2026-06-07 07:38:31,426 - optuna.study.study - INFO - Trial 162 finished with values: [0.0007251910544459602, 9.210261906356756e-05, 0.00028463234709487064] and parameters: {'n_layers': 3, 'embedding_dim': 32, 'lr': 3.680552528155105e-05, 'lambda_val': 0.0008628561498380414, 'batch_size': 572, 'optimizer': 'RMSprop'}.
2026-06-07 07:38:58,925 - experiment_functions - INFO - Early stopping at epoch 600. Best Metrics: (0.019675848900477983, 0.0030527831736887937, 0.010415336120150137)
2026-06-07 07:38:58,995 - optuna.study.study - INFO - Trial 163 finished with values: [0.019675848900477983, 0.0030527831736887937, 0.010415336120150137] and parameters: {'n_layers': 3, 'embedding_dim': 128, 'lr': 0.003577419943834574, 'lambda_val': 5.656965316395304e-06, 'batch_size': 3503, 'optimizer': 'RMSprop'}.
2026-06-07 07:39:21,148 - experiment_functions - INFO - Early stopping at epoch 500. Best Metrics: (0.0005172144305913654, 6.530912988143882e-05, 0.00023073865457404153)
2026-06-07 07:39:21,234 - optuna.study.study - INFO - Trial 164 finished with values: [0.0005172144305913654, 6.530912988143882e-05, 0.00023073865457404153] and parameters: {'n_layers': 1, 'embedding_dim': 256, 'lr': 0.0013734258944280648, 'lambda_val': 0.00010082268820599092, 'batch_size': 2975, 'optimizer': 'SGD'}.
2026-06-07 07:40:08,991 - experiment_functions - INFO - Early stopping at epoch 1050. Best Metrics: (0.027759292005297018, 0.004194855650077032, 0.015181632288980312)
2026-06-07 07:40:09,074 - optuna.study.study - INFO - Trial 165 finished with values: [0.027759292005297018, 0.004194855650077032, 0.015181632288980312] and parameters: {'n_layers': 4, 'embedding_dim': 128, 'lr': 0.0009791612272847586, 'lambda_val': 0.0008628561498380414, 'batch_size': 1703, 'optimizer': 'RMSprop'}.
2026-06-07 07:42:35,294 - optuna.study.study - INFO - Trial 166 finished with values: [0.015425142255847724, 0.0025001674593073883, 0.008708141096800175] and parameters: {'n_layers': 1, 'embedding_dim': 32, 'lr': 0.0010160627847963985, 'lambda_val': 2.5313317558461653e-05, 'batch_size': 2050, 'optimizer': 'RMSprop'}.
2026-06-07 07:44:01,517 - experiment_functions - INFO - Early stopping at epoch 2100. Best Metrics: (0.02775895484735562, 0.004303704199879429, 0.015528990102196627)
2026-06-07 07:44:01,587 - optuna.study.study - INFO - Trial 167 finished with values: [0.02775895484735562, 0.004303704199879429, 0.015528990102196627] and parameters: {'n_layers': 2, 'embedding_dim': 128, 'lr': 0.0009791612272847586, 'lambda_val': 0.00010082268820599092, 'batch_size': 2050, 'optimizer': 'RMSprop'}.
2026-06-07 07:44:27,432 - experiment_functions - INFO - Early stopping at epoch 500. Best Metrics: (0.000537782548632734, 8.707883984191842e-05, 0.0002415524610165197)
2026-06-07 07:44:27,718 - optuna.study.study - INFO - Trial 168 finished with values: [0.000537782548632734, 8.707883984191842e-05, 0.0002415524610165197] and parameters: {'n_layers': 3, 'embedding_dim': 256, 'lr': 5.00528005278814e-05, 'lambda_val': 5.604086483439305e-05, 'batch_size': 2975, 'optimizer': 'SGD'}.
2026-06-07 07:46:56,518 - optuna.study.study - INFO - Trial 169 finished with values: [0.025248583336035836, 0.004020697970393195, 0.0153400951495606] and parameters: {'n_layers': 2, 'embedding_dim': 32, 'lr': 0.0010160627847963985, 'lambda_val': 8.825101710739673e-06, 'batch_size': 572, 'optimizer': 'RMSprop'}.
2026-06-07 07:47:36,116 - experiment_functions - INFO - Early stopping at epoch 1000. Best Metrics: (0.01721723290576309, 0.002513564203898453, 0.008921902718499845)
2026-06-07 07:47:36,801 - optuna.study.study - INFO - Trial 170 finished with values: [0.01721723290576309, 0.002513564203898453, 0.008921902718499845] and parameters: {'n_layers': 4, 'embedding_dim': 32, 'lr': 0.006175201562705211, 'lambda_val': 5.604086483439305e-05, 'batch_size': 877, 'optimizer': 'RMSprop'}.
2026-06-07 07:47:56,870 - experiment_functions - INFO - Early stopping at epoch 500. Best Metrics: (0.00044770461446512033, 7.87058744725032e-05, 0.0002086303974211191)
2026-06-07 07:47:56,947 - optuna.study.study - INFO - Trial 171 finished with values: [0.00044770461446512033, 7.87058744725032e-05, 0.0002086303974211191] and parameters: {'n_layers': 3, 'embedding_dim': 32, 'lr': 3.4877176965860726e-05, 'lambda_val': 0.0031666425562085687, 'batch_size': 1703, 'optimizer': 'RMSprop'}.
2026-06-07 07:49:31,849 - experiment_functions - INFO - Early stopping at epoch 2250. Best Metrics: (0.015868788714213065, 0.002538683100006698, 0.008492696149329711)
2026-06-07 07:49:31,914 - optuna.study.study - INFO - Trial 172 finished with values: [0.015868788714213065, 0.002538683100006698, 0.008492696149329711] and parameters: {'n_layers': 1, 'embedding_dim': 256, 'lr': 0.0013734258944280648, 'lambda_val': 0.00010082268820599092, 'batch_size': 2975, 'optimizer': 'RMSprop'}.
2026-06-07 07:50:09,363 - experiment_functions - INFO - Early stopping at epoch 950. Best Metrics: (0.026298446872560784, 0.003920222385960212, 0.014065923660849754)
2026-06-07 07:50:09,435 - optuna.study.study - INFO - Trial 173 finished with values: [0.026298446872560784, 0.003920222385960212, 0.014065923660849754] and parameters: {'n_layers': 3, 'embedding_dim': 32, 'lr': 0.003577419943834574, 'lambda_val': 1.8902402933529376e-05, 'batch_size': 1182, 'optimizer': 'RMSprop'}.
2026-06-07 07:50:33,278 - experiment_functions - INFO - Early stopping at epoch 550. Best Metrics: (0.0117981256091405, 0.0017733940652421463, 0.006284639278915726)
2026-06-07 07:50:33,713 - optuna.study.study - INFO - Trial 174 finished with values: [0.0117981256091405, 0.0017733940652421463, 0.006284639278915726] and parameters: {'n_layers': 3, 'embedding_dim': 96, 'lr': 0.023750676895038965, 'lambda_val': 5.775403096605942e-06, 'batch_size': 628, 'optimizer': 'Adam'}.
2026-06-07 07:50:57,760 - experiment_functions - INFO - Early stopping at epoch 550. Best Metrics: (0.015951678339299134, 0.0024583026324603123, 0.008684308956448608)
2026-06-07 07:50:57,848 - optuna.study.study - INFO - Trial 175 finished with values: [0.015951678339299134, 0.0024583026324603123, 0.008684308956448608] and parameters: {'n_layers': 3, 'embedding_dim': 96, 'lr': 0.023750676895038965, 'lambda_val': 3.400614466479764e-05, 'batch_size': 3503, 'optimizer': 'Adam'}.
2026-06-07 07:51:53,098 - experiment_functions - INFO - Early stopping at epoch 1400. Best Metrics: (0.02525613244370873, 0.003953714247437873, 0.014470233359707915)
2026-06-07 07:51:53,173 - optuna.study.study - INFO - Trial 176 finished with values: [0.02525613244370873, 0.003953714247437873, 0.014470233359707915] and parameters: {'n_layers': 2, 'embedding_dim': 64, 'lr': 0.0022844612214732766, 'lambda_val': 5.656965316395304e-06, 'batch_size': 1182, 'optimizer': 'RMSprop'}.
2026-06-07 07:52:28,658 - experiment_functions - INFO - Early stopping at epoch 900. Best Metrics: (0.017455590792808826, 0.002629111125996383, 0.009247850252478382)
2026-06-07 07:52:28,990 - optuna.study.study - INFO - Trial 177 finished with values: [0.017455590792808826, 0.002629111125996383, 0.009247850252478382] and parameters: {'n_layers': 3, 'embedding_dim': 32, 'lr': 0.006240617698103692, 'lambda_val': 5.656965316395304e-06, 'batch_size': 877, 'optimizer': 'RMSprop'}.
2026-06-07 07:53:42,975 - experiment_functions - INFO - Early stopping at epoch 1900. Best Metrics: (0.02217042969840304, 0.003488177372898386, 0.012070086528837884)
2026-06-07 07:53:43,097 - optuna.study.study - INFO - Trial 178 finished with values: [0.02217042969840304, 0.003488177372898386, 0.012070086528837884] and parameters: {'n_layers': 2, 'embedding_dim': 64, 'lr': 0.0013734258944280648, 'lambda_val': 1.471855561908882e-05, 'batch_size': 3184, 'optimizer': 'RMSprop'}.
2026-06-07 07:54:07,707 - experiment_functions - INFO - Early stopping at epoch 600. Best Metrics: (0.010623053334271085, 0.0015573715587112332, 0.005327565112904565)
2026-06-07 07:54:07,931 - optuna.study.study - INFO - Trial 179 finished with values: [0.010623053334271085, 0.0015573715587112332, 0.005327565112904565] and parameters: {'n_layers': 4, 'embedding_dim': 32, 'lr': 0.006175201562705211, 'lambda_val': 0.0063664758989193755, 'batch_size': 2430, 'optimizer': 'RMSprop'}.
2026-06-07 07:55:06,340 - experiment_functions - INFO - Early stopping at epoch 1250. Best Metrics: (0.02213193827877758, 0.003499899524415567, 0.012287573894384887)
2026-06-07 07:55:06,446 - optuna.study.study - INFO - Trial 180 finished with values: [0.02213193827877758, 0.003499899524415567, 0.012287573894384887] and parameters: {'n_layers': 2, 'embedding_dim': 256, 'lr': 0.0009791612272847586, 'lambda_val': 2.5313317558461653e-05, 'batch_size': 3181, 'optimizer': 'RMSprop'}.
2026-06-07 07:56:09,025 - experiment_functions - INFO - Early stopping at epoch 1250. Best Metrics: (0.027384975591564317, 0.004340545247504856, 0.014714586434941343)
2026-06-07 07:56:09,117 - optuna.study.study - INFO - Trial 181 finished with values: [0.027384975591564317, 0.004340545247504856, 0.014714586434941343] and parameters: {'n_layers': 3, 'embedding_dim': 256, 'lr': 0.0008738901578381451, 'lambda_val': 2.1562448265609146e-05, 'batch_size': 2975, 'optimizer': 'RMSprop'}.
2026-06-07 07:58:34,787 - optuna.study.study - INFO - Trial 182 finished with values: [0.025485049966453517, 0.0039470158751423404, 0.014499416656368435] and parameters: {'n_layers': 2, 'embedding_dim': 32, 'lr': 0.0009791612272847586, 'lambda_val': 1.471855561908882e-05, 'batch_size': 1514, 'optimizer': 'RMSprop'}.
2026-06-07 07:59:27,196 - experiment_functions - INFO - Early stopping at epoch 1400. Best Metrics: (0.026631700307172258, 0.00405084064572309, 0.014994643026469944)
2026-06-07 07:59:27,271 - optuna.study.study - INFO - Trial 183 finished with values: [0.026631700307172258, 0.00405084064572309, 0.014994643026469944] and parameters: {'n_layers': 2, 'embedding_dim': 32, 'lr': 0.002168096883511623, 'lambda_val': 5.604086483439305e-05, 'batch_size': 959, 'optimizer': 'RMSprop'}.
2026-06-07 08:00:04,952 - experiment_functions - INFO - Early stopping at epoch 800. Best Metrics: (0.01669512531201057, 0.0025487306584499963, 0.008722063211935402)
2026-06-07 08:00:05,402 - optuna.study.study - INFO - Trial 184 finished with values: [0.01669512531201057, 0.0025487306584499963, 0.008722063211935402] and parameters: {'n_layers': 2, 'embedding_dim': 256, 'lr': 0.003577419943834574, 'lambda_val': 5.656965316395304e-06, 'batch_size': 3503, 'optimizer': 'RMSprop'}.
2026-06-07 08:02:50,990 - optuna.study.study - INFO - Trial 185 finished with values: [0.018951598979169676, 0.00297910107843794, 0.010485268632143172] and parameters: {'n_layers': 1, 'embedding_dim': 256, 'lr': 0.0009791612272847586, 'lambda_val': 1.8902402933529376e-05, 'batch_size': 1703, 'optimizer': 'RMSprop'}.
2026-06-07 08:03:15,189 - experiment_functions - INFO - Early stopping at epoch 600. Best Metrics: (0.014008242896844233, 0.0022205104159689197, 0.007368977585674006)
2026-06-07 08:03:15,276 - optuna.study.study - INFO - Trial 186 finished with values: [0.014008242896844233, 0.0022205104159689197, 0.007368977585674006] and parameters: {'n_layers': 3, 'embedding_dim': 32, 'lr': 0.006175201562705211, 'lambda_val': 5.656965316395304e-06, 'batch_size': 2832, 'optimizer': 'RMSprop'}.
2026-06-07 08:04:30,252 - experiment_functions - INFO - Early stopping at epoch 2000. Best Metrics: (0.012043528095035845, 0.0019241074418916205, 0.0062817922655053786)
2026-06-07 08:04:30,353 - optuna.study.study - INFO - Trial 187 finished with values: [0.012043528095035845, 0.0019241074418916205, 0.0062817922655053786] and parameters: {'n_layers': 4, 'embedding_dim': 32, 'lr': 0.000681272982909075, 'lambda_val': 0.02500021456838615, 'batch_size': 1459, 'optimizer': 'RMSprop'}.
2026-06-07 08:05:00,088 - experiment_functions - INFO - Early stopping at epoch 750. Best Metrics: (0.02062586074582387, 0.0032018219572643846, 0.010931822075423947)
2026-06-07 08:05:00,177 - optuna.study.study - INFO - Trial 188 finished with values: [0.02062586074582387, 0.0032018219572643846, 0.010931822075423947] and parameters: {'n_layers': 3, 'embedding_dim': 32, 'lr': 0.003577419943834574, 'lambda_val': 1.8902402933529376e-05, 'batch_size': 2881, 'optimizer': 'RMSprop'}.
2026-06-07 08:07:26,335 - optuna.study.study - INFO - Trial 189 finished with values: [0.02753406025928688, 0.00418313349855985, 0.01560235277166535] and parameters: {'n_layers': 2, 'embedding_dim': 32, 'lr': 0.0013734258944280648, 'lambda_val': 1.471855561908882e-05, 'batch_size': 1595, 'optimizer': 'RMSprop'}.
2026-06-07 08:07:59,934 - experiment_functions - INFO - Early stopping at epoch 700. Best Metrics: (0.013986654063141398, 0.002166923437604662, 0.007218188326287214)
2026-06-07 08:08:00,503 - optuna.study.study - INFO - Trial 190 finished with values: [0.013986654063141398, 0.002166923437604662, 0.007218188326287214] and parameters: {'n_layers': 2, 'embedding_dim': 256, 'lr': 0.002620274475670763, 'lambda_val': 0.005434072620439486, 'batch_size': 2687, 'optimizer': 'RMSprop'}.
2026-06-07 08:09:28,472 - experiment_functions - INFO - Early stopping at epoch 2450. Best Metrics: (0.0006470381130806611, 9.880099135909975e-05, 0.0003334316874149764)
2026-06-07 08:09:28,560 - optuna.study.study - INFO - Trial 191 finished with values: [0.0006470381130806611, 9.880099135909975e-05, 0.0003334316874149764] and parameters: {'n_layers': 2, 'embedding_dim': 32, 'lr': 0.00010157126783870196, 'lambda_val': 5.656965316395304e-06, 'batch_size': 2649, 'optimizer': 'RMSprop'}.
2026-06-07 08:09:56,458 - experiment_functions - INFO - Early stopping at epoch 700. Best Metrics: (0.018182935597707818, 0.0026140397883314356, 0.009251281401705402)
