2026-06-03 02:48:20,551 - root - INFO - **** Training e_gowalla_full
2026-06-03 02:48:20,551 - root - INFO - --- Hardware Check ---
2026-06-03 02:48:20,551 - root - INFO - PyTorch version 2.6.0+cu124
2026-06-03 02:48:20,551 - root - INFO - Is CUDA available? True
2026-06-03 02:48:20,572 - root - INFO - GPU Device Name: NVIDIA GeForce RTX 3090
2026-06-03 02:48:22,895 - helper_functions - INFO - Users: 29858, Items: 40981
2026-06-03 02:48:22,895 - helper_functions - INFO - Edge index: torch.Size([2, 1027370])
2026-06-03 02:48:22,895 - root - INFO - **** Generating the graph:
2026-06-03 02:48:24,173 - helper_functions - INFO - Number of unique users: 29858
2026-06-03 02:48:24,186 - helper_functions - INFO - Number of unique items: 40981
2026-06-03 02:48:24,186 - helper_functions - INFO - Number of nodes: 70839
2026-06-03 02:48:24,209 - helper_functions - INFO - Number of edges: 1027370
2026-06-03 02:48:27,699 - optuna.storages._rdb.storage - INFO - A new study created in RDB with name: Study_e_gowalla_full
2026-06-03 02:48:56,000 - experiment_functions - INFO - Early stopping at epoch 500. Best Metrics: (0.0005892972021959314, 7.870587447250318e-05, 0.0003015441248867288)
2026-06-03 02:48:56,097 - optuna.study.study - INFO - Trial 0 finished with values: [0.0005892972021959314, 7.870587447250318e-05, 0.0003015441248867288] and parameters: {'n_layers': 4, 'embedding_dim': 128, 'lr': 0.005320907269111628, 'lambda_val': 0.0745003253495396, 'batch_size': 1726, 'optimizer': 'SGD'}.
2026-06-03 02:49:19,536 - experiment_functions - INFO - Early stopping at epoch 550. Best Metrics: (0.0210416252757553, 0.0024298345502043006, 0.009028241012433874)
2026-06-03 02:49:19,640 - optuna.study.study - INFO - Trial 1 finished with values: [0.0210416252757553, 0.0024298345502043006, 0.009028241012433874] and parameters: {'n_layers': 2, 'embedding_dim': 32, 'lr': 0.021147334126878935, 'lambda_val': 0.006951514173989239, 'batch_size': 3385, 'optimizer': 'Adam'}.
2026-06-03 02:49:42,233 - experiment_functions - INFO - Early stopping at epoch 500. Best Metrics: (0.00047083401312285957, 7.870587447250318e-05, 0.00020579870409443286)
2026-06-03 02:49:42,336 - optuna.study.study - INFO - Trial 2 finished with values: [0.00047083401312285957, 7.870587447250318e-05, 0.00020579870409443286] and parameters: {'n_layers': 1, 'embedding_dim': 128, 'lr': 0.000327414537422656, 'lambda_val': 0.025606955185169786, 'batch_size': 3410, 'optimizer': 'Adam'}.
2026-06-03 02:50:05,892 - experiment_functions - INFO - Early stopping at epoch 550. Best Metrics: (0.026821930099092867, 0.0032554089356286423, 0.012560806917955535)
2026-06-03 02:50:06,004 - optuna.study.study - INFO - Trial 3 finished with values: [0.026821930099092867, 0.0032554089356286423, 0.012560806917955535] and parameters: {'n_layers': 2, 'embedding_dim': 32, 'lr': 0.05605085711216016, 'lambda_val': 0.0006092016125409939, 'batch_size': 1575, 'optimizer': 'Adam'}.
2026-06-03 02:53:21,441 - optuna.study.study - INFO - Trial 4 finished with values: [0.04138926189250355, 0.004769241074418917, 0.019055978478244355] and parameters: {'n_layers': 4, 'embedding_dim': 96, 'lr': 0.006108566649059157, 'lambda_val': 1.3145520728365675e-06, 'batch_size': 1276, 'optimizer': 'RMSprop'}.
2026-06-03 02:56:47,856 - optuna.study.study - INFO - Trial 5 finished with values: [0.012059950576852843, 0.0015556969656373503, 0.0054393419679567324] and parameters: {'n_layers': 4, 'embedding_dim': 128, 'lr': 0.0008218958871259177, 'lambda_val': 0.01662424548106528, 'batch_size': 979, 'optimizer': 'RMSprop'}.
2026-06-03 02:59:41,064 - experiment_functions - INFO - Early stopping at epoch 3750. Best Metrics: (0.03939115594673601, 0.00452977426485364, 0.018004223033354555)
2026-06-03 02:59:41,212 - optuna.study.study - INFO - Trial 6 finished with values: [0.03939115594673601, 0.00452977426485364, 0.018004223033354555] and parameters: {'n_layers': 3, 'embedding_dim': 96, 'lr': 0.0029996525529070012, 'lambda_val': 4.5805610201863314e-06, 'batch_size': 3512, 'optimizer': 'RMSprop'}.
2026-06-03 03:00:09,075 - experiment_functions - INFO - Early stopping at epoch 650. Best Metrics: (0.0006389976416544177, 9.712639828521669e-05, 0.0002823389924494523)
2026-06-03 03:00:09,181 - optuna.study.study - INFO - Trial 7 finished with values: [0.0006389976416544177, 9.712639828521669e-05, 0.0002823389924494523] and parameters: {'n_layers': 2, 'embedding_dim': 64, 'lr': 0.006587422524818515, 'lambda_val': 0.000376934083384807, 'batch_size': 2511, 'optimizer': 'SGD'}.
2026-06-03 03:00:30,922 - experiment_functions - INFO - Early stopping at epoch 500. Best Metrics: (0.0004731857535664998, 6.86583160292049e-05, 0.0001891184135580012)
2026-06-03 03:00:30,994 - optuna.study.study - INFO - Trial 8 finished with values: [0.0004731857535664998, 6.86583160292049e-05, 0.0001891184135580012] and parameters: {'n_layers': 2, 'embedding_dim': 64, 'lr': 0.00710210347174133, 'lambda_val': 0.0009821692415885536, 'batch_size': 2216, 'optimizer': 'SGD'}.
2026-06-03 03:00:57,646 - experiment_functions - INFO - Early stopping at epoch 550. Best Metrics: (0.031269081001578956, 0.0037829057539018013, 0.015193107495547007)
2026-06-03 03:00:57,727 - optuna.study.study - INFO - Trial 9 finished with values: [0.031269081001578956, 0.0037829057539018013, 0.015193107495547007] and parameters: {'n_layers': 2, 'embedding_dim': 128, 'lr': 0.018167097127187466, 'lambda_val': 0.0014369013630720255, 'batch_size': 1295, 'optimizer': 'Adam'}.
2026-06-03 03:01:22,064 - experiment_functions - INFO - Early stopping at epoch 550. Best Metrics: (0.017731239736411785, 0.0020647732600977964, 0.0076502375143224265)
2026-06-03 03:01:22,935 - optuna.study.study - INFO - Trial 10 finished with values: [0.017731239736411785, 0.0020647732600977964, 0.0076502375143224265] and parameters: {'n_layers': 1, 'embedding_dim': 128, 'lr': 0.02552115659495942, 'lambda_val': 0.032978224929031345, 'batch_size': 3816, 'optimizer': 'Adam'}.
2026-06-03 03:04:33,309 - optuna.study.study - INFO - Trial 11 finished with values: [0.008605981454872062, 0.001364793355214683, 0.004285316020133074] and parameters: {'n_layers': 4, 'embedding_dim': 96, 'lr': 0.00014526546598710952, 'lambda_val': 0.020032954540070147, 'batch_size': 2707, 'optimizer': 'Adam'}.
2026-06-03 03:04:55,338 - experiment_functions - INFO - Early stopping at epoch 500. Best Metrics: (0.00034304732886195896, 7.200750217697099e-05, 0.000172640260950842)
2026-06-03 03:04:55,450 - optuna.study.study - INFO - Trial 12 finished with values: [0.00034304732886195896, 7.200750217697099e-05, 0.000172640260950842] and parameters: {'n_layers': 2, 'embedding_dim': 64, 'lr': 0.09531235549367831, 'lambda_val': 0.0012702122679416467, 'batch_size': 1931, 'optimizer': 'SGD'}.
2026-06-03 03:05:34,037 - experiment_functions - INFO - Early stopping at epoch 550. Best Metrics: (0.009787296520284153, 0.001200683233974144, 0.004689501109760208)
2026-06-03 03:05:34,130 - optuna.study.study - INFO - Trial 13 finished with values: [0.009787296520284153, 0.001200683233974144, 0.004689501109760208] and parameters: {'n_layers': 4, 'embedding_dim': 256, 'lr': 0.005313954177263257, 'lambda_val': 0.03788742120727976, 'batch_size': 1947, 'optimizer': 'RMSprop'}.
2026-06-03 03:06:53,267 - experiment_functions - INFO - Early stopping at epoch 1950. Best Metrics: (0.01654443776281933, 0.0019525755241476322, 0.007110567566325004)
2026-06-03 03:06:54,295 - optuna.study.study - INFO - Trial 14 finished with values: [0.01654443776281933, 0.0019525755241476322, 0.007110567566325004] and parameters: {'n_layers': 4, 'embedding_dim': 32, 'lr': 0.003618612896374858, 'lambda_val': 0.0036173053146817007, 'batch_size': 920, 'optimizer': 'Adam'}.
2026-06-03 03:07:17,360 - experiment_functions - INFO - Early stopping at epoch 500. Best Metrics: (0.0005882818033515967, 8.205506062026927e-05, 0.00030699039451634075)
2026-06-03 03:07:17,470 - optuna.study.study - INFO - Trial 15 finished with values: [0.0005882818033515967, 8.205506062026927e-05, 0.00030699039451634075] and parameters: {'n_layers': 3, 'embedding_dim': 64, 'lr': 1.694622263248614e-05, 'lambda_val': 1.6263951880298748e-05, 'batch_size': 639, 'optimizer': 'SGD'}.
2026-06-03 03:07:40,314 - experiment_functions - INFO - Early stopping at epoch 500. Best Metrics: (0.000642427014750776, 8.875343291580147e-05, 0.00031995008170980743)
2026-06-03 03:07:40,412 - optuna.study.study - INFO - Trial 16 finished with values: [0.000642427014750776, 8.875343291580147e-05, 0.00031995008170980743] and parameters: {'n_layers': 1, 'embedding_dim': 128, 'lr': 0.0008746152120122533, 'lambda_val': 0.0006830636090781869, 'batch_size': 3592, 'optimizer': 'SGD'}.
2026-06-03 03:08:01,930 - experiment_functions - INFO - Early stopping at epoch 500. Best Metrics: (0.0005248679818918497, 9.042802598968451e-05, 0.0002679910133673188)
2026-06-03 03:08:02,470 - optuna.study.study - INFO - Trial 17 finished with values: [0.0005248679818918497, 9.042802598968451e-05, 0.0002679910133673188] and parameters: {'n_layers': 1, 'embedding_dim': 64, 'lr': 1.4404672615913307e-05, 'lambda_val': 2.5260254327516684e-06, 'batch_size': 4023, 'optimizer': 'Adam'}.
2026-06-03 03:08:23,797 - experiment_functions - INFO - Early stopping at epoch 500. Best Metrics: (0.0004504070703677451, 7.535668832473711e-05, 0.00020485200404239264)
2026-06-03 03:08:23,902 - optuna.study.study - INFO - Trial 18 finished with values: [0.0004504070703677451, 7.535668832473711e-05, 0.00020485200404239264] and parameters: {'n_layers': 2, 'embedding_dim': 32, 'lr': 3.236982759249356e-05, 'lambda_val': 2.253385337742071e-05, 'batch_size': 2184, 'optimizer': 'SGD'}.
2026-06-03 03:08:59,105 - experiment_functions - INFO - Early stopping at epoch 500. Best Metrics: (0.00043109269397031475, 6.698372295532186e-05, 0.00020687047612193713)
2026-06-03 03:08:59,818 - optuna.study.study - INFO - Trial 19 finished with values: [0.00043109269397031475, 6.698372295532186e-05, 0.00020687047612193713] and parameters: {'n_layers': 4, 'embedding_dim': 256, 'lr': 0.0170957273407046, 'lambda_val': 2.0189420817976334e-05, 'batch_size': 1771, 'optimizer': 'SGD'}.
2026-06-03 03:09:20,789 - experiment_functions - INFO - Early stopping at epoch 500. Best Metrics: (0.00038679682803898483, 8.038046754638624e-05, 0.00018803221812374306)
2026-06-03 03:09:20,875 - optuna.study.study - INFO - Trial 20 finished with values: [0.00038679682803898483, 8.038046754638624e-05, 0.00018803221812374306] and parameters: {'n_layers': 1, 'embedding_dim': 32, 'lr': 0.06060047843315504, 'lambda_val': 0.014647481656408876, 'batch_size': 1948, 'optimizer': 'SGD'}.
2026-06-03 03:09:56,482 - experiment_functions - INFO - Early stopping at epoch 500. Best Metrics: (0.04468275170958181, 0.0056785451135374105, 0.023553027272892366)
2026-06-03 03:09:56,598 - optuna.study.study - INFO - Trial 21 finished with values: [0.04468275170958181, 0.0056785451135374105, 0.023553027272892366] and parameters: {'n_layers': 4, 'embedding_dim': 256, 'lr': 0.05848561228434413, 'lambda_val': 0.0840407552704538, 'batch_size': 2355, 'optimizer': 'RMSprop'}.
2026-06-03 03:10:18,500 - experiment_functions - INFO - Early stopping at epoch 500. Best Metrics: (0.00046309483731826214, 7.53566883247371e-05, 0.0002178536302638941)
2026-06-03 03:10:18,583 - optuna.study.study - INFO - Trial 22 finished with values: [0.00046309483731826214, 7.53566883247371e-05, 0.0002178536302638941] and parameters: {'n_layers': 3, 'embedding_dim': 32, 'lr': 1.7677406074793566e-05, 'lambda_val': 0.00014136652601835472, 'batch_size': 1310, 'optimizer': 'RMSprop'}.
2026-06-03 03:11:01,294 - experiment_functions - INFO - Early stopping at epoch 1050. Best Metrics: (0.019203811332379316, 0.0025252863554156343, 0.008788293286551742)
2026-06-03 03:11:01,398 - optuna.study.study - INFO - Trial 23 finished with values: [0.019203811332379316, 0.0025252863554156343, 0.008788293286551742] and parameters: {'n_layers': 1, 'embedding_dim': 64, 'lr': 0.0017600601147055445, 'lambda_val': 0.0773764602931624, 'batch_size': 1769, 'optimizer': 'RMSprop'}.
2026-06-03 03:11:23,642 - experiment_functions - INFO - Early stopping at epoch 500. Best Metrics: (0.0004344651861058008, 6.865831602920491e-05, 0.00019695785217211008)
2026-06-03 03:11:23,726 - optuna.study.study - INFO - Trial 24 finished with values: [0.0004344651861058008, 6.865831602920491e-05, 0.00019695785217211008] and parameters: {'n_layers': 3, 'embedding_dim': 32, 'lr': 0.0002841680829294362, 'lambda_val': 2.4972444406810103e-05, 'batch_size': 3640, 'optimizer': 'SGD'}.
2026-06-03 03:11:49,883 - experiment_functions - INFO - Early stopping at epoch 500. Best Metrics: (0.0004056328736953556, 8.038046754638621e-05, 0.0001894743222924796)
2026-06-03 03:11:49,990 - optuna.study.study - INFO - Trial 25 finished with values: [0.0004056328736953556, 8.038046754638621e-05, 0.0001894743222924796] and parameters: {'n_layers': 3, 'embedding_dim': 128, 'lr': 4.34094900056223e-05, 'lambda_val': 0.0007772396661605792, 'batch_size': 3634, 'optimizer': 'SGD'}.
2026-06-03 03:14:41,038 - experiment_functions - INFO - Early stopping at epoch 3650. Best Metrics: (0.027924412427916122, 0.003637216156473977, 0.012804377366060478)
2026-06-03 03:14:41,162 - optuna.study.study - INFO - Trial 26 finished with values: [0.027924412427916122, 0.003637216156473977, 0.012804377366060478] and parameters: {'n_layers': 1, 'embedding_dim': 256, 'lr': 0.04199609198569572, 'lambda_val': 0.0073269530843175735, 'batch_size': 3598, 'optimizer': 'RMSprop'}.
2026-06-03 03:15:15,910 - experiment_functions - INFO - Early stopping at epoch 700. Best Metrics: (0.021166787887405943, 0.0027530310134637284, 0.009967319911086858)
2026-06-03 03:15:16,205 - optuna.study.study - INFO - Trial 27 finished with values: [0.021166787887405943, 0.0027530310134637284, 0.009967319911086858] and parameters: {'n_layers': 3, 'embedding_dim': 96, 'lr': 0.001569262341931714, 'lambda_val': 0.02518430669345533, 'batch_size': 3210, 'optimizer': 'Adam'}.
2026-06-03 03:15:54,143 - experiment_functions - INFO - Early stopping at epoch 900. Best Metrics: (0.0006365846689811901, 7.535668832473711e-05, 0.0002850025475666101)
2026-06-03 03:15:54,231 - optuna.study.study - INFO - Trial 28 finished with values: [0.0006365846689811901, 7.535668832473711e-05, 0.0002850025475666101] and parameters: {'n_layers': 4, 'embedding_dim': 32, 'lr': 1.7152463466969075e-05, 'lambda_val': 2.296770310028916e-06, 'batch_size': 1674, 'optimizer': 'RMSprop'}.
2026-06-03 03:16:48,030 - experiment_functions - INFO - Early stopping at epoch 1350. Best Metrics: (0.06030533976778958, 0.007127068122446246, 0.028862686096633845)
2026-06-03 03:16:48,134 - optuna.study.study - INFO - Trial 29 finished with values: [0.06030533976778958, 0.007127068122446246, 0.028862686096633845] and parameters: {'n_layers': 1, 'embedding_dim': 32, 'lr': 0.004311872557114808, 'lambda_val': 0.0006353517335696762, 'batch_size': 2273, 'optimizer': 'RMSprop'}.
2026-06-03 03:19:54,080 - optuna.study.study - INFO - Trial 30 finished with values: [0.036972878701309865, 0.005206309866702392, 0.019363725092395624] and parameters: {'n_layers': 3, 'embedding_dim': 96, 'lr': 0.0002143090370477042, 'lambda_val': 0.003485985825944796, 'batch_size': 2448, 'optimizer': 'Adam'}.
2026-06-03 03:21:48,976 - experiment_functions - INFO - Early stopping at epoch 2800. Best Metrics: (0.010858456742578838, 0.0014133565543572914, 0.004547266867912554)
2026-06-03 03:21:49,069 - optuna.study.study - INFO - Trial 31 finished with values: [0.010858456742578838, 0.0014133565543572914, 0.004547266867912554] and parameters: {'n_layers': 2, 'embedding_dim': 64, 'lr': 0.0034685071070209975, 'lambda_val': 0.055938381166922534, 'batch_size': 638, 'optimizer': 'Adam'}.
2026-06-03 03:25:00,845 - optuna.study.study - INFO - Trial 32 finished with values: [0.0008478980089460167, 0.0001188961082456963, 0.0003666975400176736] and parameters: {'n_layers': 4, 'embedding_dim': 96, 'lr': 3.8304994084183315e-05, 'lambda_val': 2.5959208770344766e-06, 'batch_size': 2860, 'optimizer': 'Adam'}.
2026-06-03 03:25:29,473 - experiment_functions - INFO - Early stopping at epoch 600. Best Metrics: (0.0004594004621832418, 7.53566883247371e-05, 0.00021736415926764318)
2026-06-03 03:25:29,573 - optuna.study.study - INFO - Trial 33 finished with values: [0.0004594004621832418, 7.53566883247371e-05, 0.00021736415926764318] and parameters: {'n_layers': 4, 'embedding_dim': 64, 'lr': 3.4352719377481404e-05, 'lambda_val': 0.005541460487970458, 'batch_size': 736, 'optimizer': 'Adam'}.
2026-06-03 03:26:56,166 - experiment_functions - INFO - Early stopping at epoch 1600. Best Metrics: (0.03942814274037796, 0.0050304775939446714, 0.01913913024336579)
2026-06-03 03:26:56,255 - optuna.study.study - INFO - Trial 34 finished with values: [0.03942814274037796, 0.0050304775939446714, 0.01913913024336579] and parameters: {'n_layers': 4, 'embedding_dim': 128, 'lr': 0.0005487208473083224, 'lambda_val': 0.0026848100129980676, 'batch_size': 2315, 'optimizer': 'Adam'}.
2026-06-03 03:29:54,879 - optuna.study.study - INFO - Trial 35 finished with values: [0.01054007917572717, 0.0017181324938040058, 0.005711234427722517] and parameters: {'n_layers': 2, 'embedding_dim': 128, 'lr': 0.00022437050337848337, 'lambda_val': 0.000868123514447947, 'batch_size': 877, 'optimizer': 'RMSprop'}.
2026-06-03 03:30:23,162 - experiment_functions - INFO - Early stopping at epoch 650. Best Metrics: (0.01902743732708048, 0.0021585504722352465, 0.008239806926206595)
2026-06-03 03:30:23,267 - optuna.study.study - INFO - Trial 36 finished with values: [0.01902743732708048, 0.0021585504722352465, 0.008239806926206595] and parameters: {'n_layers': 1, 'embedding_dim': 96, 'lr': 0.01447735814370163, 'lambda_val': 0.02018887560132656, 'batch_size': 2234, 'optimizer': 'RMSprop'}.
2026-06-03 03:30:58,514 - experiment_functions - INFO - Early stopping at epoch 500. Best Metrics: (0.00048396221560910864, 6.865831602920491e-05, 0.0002025211740035893)
2026-06-03 03:30:58,619 - optuna.study.study - INFO - Trial 37 finished with values: [0.00048396221560910864, 6.865831602920491e-05, 0.0002025211740035893] and parameters: {'n_layers': 4, 'embedding_dim': 256, 'lr': 0.0008487318989011249, 'lambda_val': 0.04136045632506796, 'batch_size': 617, 'optimizer': 'SGD'}.
2026-06-03 03:31:19,604 - experiment_functions - INFO - Early stopping at epoch 500. Best Metrics: (0.0004514963345092624, 7.368209525085403e-05, 0.00023793984283275958)
2026-06-03 03:31:19,898 - optuna.study.study - INFO - Trial 38 finished with values: [0.0004514963345092624, 7.368209525085403e-05, 0.00023793984283275958] and parameters: {'n_layers': 1, 'embedding_dim': 32, 'lr': 0.00030452242506905796, 'lambda_val': 3.722883243763735e-06, 'batch_size': 1926, 'optimizer': 'SGD'}.
2026-06-03 03:31:47,586 - experiment_functions - INFO - Early stopping at epoch 500. Best Metrics: (0.00031562463213196914, 5.526157143814053e-05, 0.00014348940177092388)
2026-06-03 03:31:48,644 - optuna.study.study - INFO - Trial 39 finished with values: [0.00031562463213196914, 5.526157143814053e-05, 0.00014348940177092388] and parameters: {'n_layers': 4, 'embedding_dim': 128, 'lr': 6.907455281118128e-05, 'lambda_val': 4.332436544993132e-05, 'batch_size': 2265, 'optimizer': 'SGD'}.
2026-06-03 03:32:17,421 - experiment_functions - INFO - Early stopping at epoch 550. Best Metrics: (0.015982426998676497, 0.00200616250251189, 0.008007855913511271)
2026-06-03 03:32:17,898 - optuna.study.study - INFO - Trial 40 finished with values: [0.015982426998676497, 0.00200616250251189, 0.008007855913511271] and parameters: {'n_layers': 4, 'embedding_dim': 96, 'lr': 0.0059546790300672265, 'lambda_val': 0.04480058747584424, 'batch_size': 855, 'optimizer': 'RMSprop'}.
2026-06-03 03:33:06,277 - experiment_functions - INFO - Early stopping at epoch 1100. Best Metrics: (0.09783049648920661, 0.012251322928528367, 0.05293580579163117)
2026-06-03 03:33:07,049 - optuna.study.study - INFO - Trial 41 finished with values: [0.09783049648920661, 0.012251322928528367, 0.05293580579163117] and parameters: {'n_layers': 1, 'embedding_dim': 96, 'lr': 0.0026263356328818884, 'lambda_val': 0.00031016945451823507, 'batch_size': 1441, 'optimizer': 'Adam'}.
2026-06-03 03:33:29,592 - experiment_functions - INFO - Early stopping at epoch 500. Best Metrics: (0.0005894784711069264, 8.875343291580147e-05, 0.00031881815646987965)
2026-06-03 03:33:29,684 - optuna.study.study - INFO - Trial 42 finished with values: [0.0005894784711069264, 8.875343291580147e-05, 0.00031881815646987965] and parameters: {'n_layers': 3, 'embedding_dim': 32, 'lr': 0.01937763580831428, 'lambda_val': 0.003993616525790391, 'batch_size': 2415, 'optimizer': 'SGD'}.
2026-06-03 03:33:53,813 - experiment_functions - INFO - Early stopping at epoch 500. Best Metrics: (0.00031392462869167276, 4.856319914260835e-05, 0.00016237287025511042)
2026-06-03 03:33:53,901 - optuna.study.study - INFO - Trial 43 finished with values: [0.00031392462869167276, 4.856319914260835e-05, 0.00016237287025511042] and parameters: {'n_layers': 4, 'embedding_dim': 64, 'lr': 0.05000423455169344, 'lambda_val': 0.05312968744908981, 'batch_size': 2967, 'optimizer': 'SGD'}.
2026-06-03 03:36:27,551 - optuna.study.study - INFO - Trial 44 finished with values: [0.03759110486755834, 0.005757250988009913, 0.02311106758559529] and parameters: {'n_layers': 1, 'embedding_dim': 32, 'lr': 0.0009344685265310301, 'lambda_val': 2.8807178813664366e-05, 'batch_size': 600, 'optimizer': 'Adam'}.
