2026-06-04 09:56:13,674 - optuna.study.study - INFO - Trial 235 finished with values: [0.006920613453486846, 0.0013229285283676067, 0.00397018806044143] and parameters: {'n_layers': 3, 'embedding_dim': 256, 'lr': 0.002820612855470111, 'lambda_val': 0.0002748178610784401, 'batch_size': 775, 'optimizer': 'RMSprop'}.
2026-06-04 09:58:08,770 - experiment_functions - INFO - Early stopping at epoch 2700. Best Metrics: (0.0008067698992224288, 0.00011219773595016412, 0.00035734514303500546)
2026-06-04 09:58:09,034 - optuna.study.study - INFO - Trial 236 finished with values: [0.0008067698992224288, 0.00011219773595016412, 0.00035734514303500546] and parameters: {'n_layers': 4, 'embedding_dim': 128, 'lr': 5.7290586583417895e-05, 'lambda_val': 0.000778044958007887, 'batch_size': 1423, 'optimizer': 'Adam'}.
2026-06-04 09:58:59,738 - experiment_functions - INFO - Early stopping at epoch 1200. Best Metrics: (0.004030176249742814, 0.0007602652555429031, 0.002253185493992637)
2026-06-04 09:58:59,827 - optuna.study.study - INFO - Trial 237 finished with values: [0.004030176249742814, 0.0007602652555429031, 0.002253185493992637] and parameters: {'n_layers': 4, 'embedding_dim': 96, 'lr': 0.022171758893818883, 'lambda_val': 0.0023860098486142224, 'batch_size': 3469, 'optimizer': 'RMSprop'}.
2026-06-04 09:59:24,156 - experiment_functions - INFO - Early stopping at epoch 600. Best Metrics: (0.0049679763830576575, 0.0009411213075222721, 0.0027997365181871153)
2026-06-04 09:59:24,248 - optuna.study.study - INFO - Trial 238 finished with values: [0.0049679763830576575, 0.0009411213075222721, 0.0027997365181871153] and parameters: {'n_layers': 4, 'embedding_dim': 32, 'lr': 0.0023047972503770693, 'lambda_val': 0.017835408789966936, 'batch_size': 2517, 'optimizer': 'RMSprop'}.
2026-06-04 10:02:31,909 - optuna.study.study - INFO - Trial 239 finished with values: [0.001001300597318181, 0.00015406256279724027, 0.00046613169890130223] and parameters: {'n_layers': 3, 'embedding_dim': 256, 'lr': 8.304790129980258e-05, 'lambda_val': 4.44264623528296e-06, 'batch_size': 985, 'optimizer': 'RMSprop'}.
2026-06-04 10:03:40,920 - experiment_functions - INFO - Early stopping at epoch 1700. Best Metrics: (0.011218215852208007, 0.0019575993033692815, 0.006755390007233644)
2026-06-04 10:03:40,995 - optuna.study.study - INFO - Trial 240 finished with values: [0.011218215852208007, 0.0019575993033692815, 0.006755390007233644] and parameters: {'n_layers': 3, 'embedding_dim': 96, 'lr': 0.0009358706696693685, 'lambda_val': 4.830818973924614e-06, 'batch_size': 1423, 'optimizer': 'RMSprop'}.
2026-06-04 10:04:26,250 - experiment_functions - INFO - Early stopping at epoch 850. Best Metrics: (0.006784838847597895, 0.0012408734677473376, 0.003857379899026286)
2026-06-04 10:04:27,085 - optuna.study.study - INFO - Trial 241 finished with values: [0.006784838847597895, 0.0012408734677473376, 0.003857379899026286] and parameters: {'n_layers': 4, 'embedding_dim': 256, 'lr': 0.0009358706696693685, 'lambda_val': 0.0054022876436497684, 'batch_size': 1801, 'optimizer': 'Adam'}.
2026-06-04 10:05:51,519 - experiment_functions - INFO - Early stopping at epoch 2150. Best Metrics: (0.004384535556709606, 0.0008272489784982249, 0.002379028142582297)
2026-06-04 10:05:51,655 - optuna.study.study - INFO - Trial 242 finished with values: [0.004384535556709606, 0.0008272489784982249, 0.002379028142582297] and parameters: {'n_layers': 2, 'embedding_dim': 96, 'lr': 0.007982799603933596, 'lambda_val': 0.01659686506248472, 'batch_size': 2517, 'optimizer': 'Adam'}.
2026-06-04 10:06:18,268 - experiment_functions - INFO - Early stopping at epoch 500. Best Metrics: (0.0004312142601893265, 7.703128139862015e-05, 0.00018646574887519585)
2026-06-04 10:06:18,354 - optuna.study.study - INFO - Trial 243 finished with values: [0.0004312142601893265, 7.703128139862015e-05, 0.00018646574887519585] and parameters: {'n_layers': 4, 'embedding_dim': 256, 'lr': 0.0009358706696693685, 'lambda_val': 0.00014523930854886327, 'batch_size': 1801, 'optimizer': 'SGD'}.
2026-06-04 10:06:40,323 - experiment_functions - INFO - Early stopping at epoch 500. Best Metrics: (0.0003227738818818038, 5.526157143814053e-05, 0.0001346107282916173)
2026-06-04 10:06:40,481 - optuna.study.study - INFO - Trial 244 finished with values: [0.0003227738818818038, 5.526157143814053e-05, 0.0001346107282916173] and parameters: {'n_layers': 4, 'embedding_dim': 96, 'lr': 1.9696906346065198e-05, 'lambda_val': 2.2109211065368353e-05, 'batch_size': 1230, 'optimizer': 'SGD'}.
2026-06-04 10:07:05,822 - experiment_functions - INFO - Early stopping at epoch 500. Best Metrics: (0.0005385660170010422, 7.033290910308795e-05, 0.0002446850555859401)
2026-06-04 10:07:05,892 - optuna.study.study - INFO - Trial 245 finished with values: [0.0005385660170010422, 7.033290910308795e-05, 0.0002446850555859401] and parameters: {'n_layers': 3, 'embedding_dim': 256, 'lr': 0.0013876621562912753, 'lambda_val': 0.00014523930854886327, 'batch_size': 1801, 'optimizer': 'SGD'}.
2026-06-04 10:08:29,504 - experiment_functions - INFO - Early stopping at epoch 1850. Best Metrics: (0.006723373427267919, 0.001188961082456963, 0.003816337073654693)
2026-06-04 10:08:29,686 - optuna.study.study - INFO - Trial 246 finished with values: [0.006723373427267919, 0.001188961082456963, 0.003816337073654693] and parameters: {'n_layers': 2, 'embedding_dim': 256, 'lr': 0.0005623238238546706, 'lambda_val': 8.614758327309204e-05, 'batch_size': 3752, 'optimizer': 'RMSprop'}.
2026-06-04 10:10:22,954 - experiment_functions - INFO - Early stopping at epoch 3000. Best Metrics: (0.010226625165297836, 0.0016712438877352807, 0.005957239206756464)
2026-06-04 10:10:24,167 - optuna.study.study - INFO - Trial 247 finished with values: [0.010226625165297836, 0.0016712438877352807, 0.005957239206756464] and parameters: {'n_layers': 2, 'embedding_dim': 64, 'lr': 0.0009358706696693685, 'lambda_val': 2.2109211065368353e-05, 'batch_size': 775, 'optimizer': 'RMSprop'}.
2026-06-04 10:13:04,336 - optuna.study.study - INFO - Trial 248 finished with values: [0.00996055800794721, 0.0017784178444637954, 0.005970570014810007] and parameters: {'n_layers': 3, 'embedding_dim': 96, 'lr': 0.0009358706696693685, 'lambda_val': 4.830818973924614e-06, 'batch_size': 682, 'optimizer': 'Adam'}.
2026-06-04 10:13:33,737 - experiment_functions - INFO - Early stopping at epoch 700. Best Metrics: (0.004282458253432757, 0.0007954317100944471, 0.0024449840156061165)
2026-06-04 10:13:33,806 - optuna.study.study - INFO - Trial 249 finished with values: [0.004282458253432757, 0.0007954317100944471, 0.0024449840156061165] and parameters: {'n_layers': 3, 'embedding_dim': 96, 'lr': 0.002151242872485861, 'lambda_val': 0.052660247801799585, 'batch_size': 1801, 'optimizer': 'RMSprop'}.
2026-06-04 10:14:49,323 - experiment_functions - INFO - Early stopping at epoch 1800. Best Metrics: (0.011221907073921063, 0.0020229084332507204, 0.006539643941885202)
2026-06-04 10:14:49,637 - optuna.study.study - INFO - Trial 250 finished with values: [0.011221907073921063, 0.0020229084332507204, 0.006539643941885202] and parameters: {'n_layers': 4, 'embedding_dim': 96, 'lr': 0.0013876621562912753, 'lambda_val': 7.021316323863495e-06, 'batch_size': 682, 'optimizer': 'Adam'}.
2026-06-04 10:15:27,231 - experiment_functions - INFO - Early stopping at epoch 750. Best Metrics: (0.00569044208875258, 0.001083461718802331, 0.0032197592911648804)
2026-06-04 10:15:27,307 - optuna.study.study - INFO - Trial 251 finished with values: [0.00569044208875258, 0.001083461718802331, 0.0032197592911648804] and parameters: {'n_layers': 3, 'embedding_dim': 256, 'lr': 0.0013876621562912753, 'lambda_val': 0.011312715284268512, 'batch_size': 775, 'optimizer': 'RMSprop'}.
2026-06-04 10:15:53,033 - experiment_functions - INFO - Early stopping at epoch 500. Best Metrics: (0.00039804353597642253, 5.861075758590663e-05, 0.00017033363190378833)
2026-06-04 10:15:53,670 - optuna.study.study - INFO - Trial 252 finished with values: [0.00039804353597642253, 5.861075758590663e-05, 0.00017033363190378833] and parameters: {'n_layers': 3, 'embedding_dim': 256, 'lr': 1.5566041501220097e-05, 'lambda_val': 8.999659749873041e-05, 'batch_size': 1423, 'optimizer': 'RMSprop'}.
2026-06-04 10:16:36,300 - experiment_functions - INFO - Early stopping at epoch 800. Best Metrics: (0.009350819127554002, 0.0017181324938040058, 0.005191118444518726)
2026-06-04 10:16:36,378 - optuna.study.study - INFO - Trial 253 finished with values: [0.009350819127554002, 0.0017181324938040058, 0.005191118444518726] and parameters: {'n_layers': 4, 'embedding_dim': 256, 'lr': 0.0013876621562912753, 'lambda_val': 0.00014523930854886327, 'batch_size': 1230, 'optimizer': 'RMSprop'}.
2026-06-04 10:19:19,920 - optuna.study.study - INFO - Trial 254 finished with values: [0.010540237431657749, 0.0019123852903744393, 0.00676761699535232] and parameters: {'n_layers': 4, 'embedding_dim': 96, 'lr': 0.0005758008621537027, 'lambda_val': 2.2109211065368353e-05, 'batch_size': 775, 'optimizer': 'Adam'}.
2026-06-04 10:20:06,190 - experiment_functions - INFO - Early stopping at epoch 1250. Best Metrics: (0.006876434807718634, 0.0009411213075222722, 0.0036959286497770505)
2026-06-04 10:20:06,323 - optuna.study.study - INFO - Trial 255 finished with values: [0.006876434807718634, 0.0009411213075222722, 0.0036959286497770505] and parameters: {'n_layers': 1, 'embedding_dim': 32, 'lr': 0.0023047972503770693, 'lambda_val': 0.0002748178610784401, 'batch_size': 775, 'optimizer': 'Adam'}.
2026-06-04 10:20:33,029 - experiment_functions - INFO - Early stopping at epoch 600. Best Metrics: (0.0076492682840339325, 0.0013564203898452675, 0.004272421267884321)
2026-06-04 10:20:33,283 - optuna.study.study - INFO - Trial 256 finished with values: [0.0076492682840339325, 0.0013564203898452675, 0.004272421267884321] and parameters: {'n_layers': 4, 'embedding_dim': 96, 'lr': 0.010018166291964033, 'lambda_val': 2.5795384074392596e-06, 'batch_size': 682, 'optimizer': 'Adam'}.
2026-06-04 10:23:17,018 - optuna.study.study - INFO - Trial 257 finished with values: [0.012350374943787566, 0.0021752964029740775, 0.007658881524957356] and parameters: {'n_layers': 4, 'embedding_dim': 96, 'lr': 0.0004925603808497043, 'lambda_val': 0.00014523930854886327, 'batch_size': 682, 'optimizer': 'RMSprop'}.
2026-06-04 10:24:24,870 - experiment_functions - INFO - Early stopping at epoch 1550. Best Metrics: (0.01045994612324531, 0.0018822426150445443, 0.0060151907147634786)
2026-06-04 10:24:24,973 - optuna.study.study - INFO - Trial 258 finished with values: [0.01045994612324531, 0.0018822426150445443, 0.0060151907147634786] and parameters: {'n_layers': 4, 'embedding_dim': 128, 'lr': 0.0009358706696693685, 'lambda_val': 2.2109211065368353e-05, 'batch_size': 1801, 'optimizer': 'RMSprop'}.
2026-06-04 10:26:07,595 - experiment_functions - INFO - Early stopping at epoch 2300. Best Metrics: (0.007961474592691864, 0.0014568959742782505, 0.004571312951705858)
2026-06-04 10:26:07,685 - optuna.study.study - INFO - Trial 259 finished with values: [0.007961474592691864, 0.0014568959742782505, 0.004571312951705858] and parameters: {'n_layers': 2, 'embedding_dim': 256, 'lr': 0.0009358706696693685, 'lambda_val': 2.2109211065368353e-05, 'batch_size': 1344, 'optimizer': 'RMSprop'}.
2026-06-04 10:26:55,083 - experiment_functions - INFO - Early stopping at epoch 1150. Best Metrics: (0.00803533583841174, 0.0015004353941992098, 0.004620430171066863)
2026-06-04 10:26:55,170 - optuna.study.study - INFO - Trial 260 finished with values: [0.00803533583841174, 0.0015004353941992098, 0.004620430171066863] and parameters: {'n_layers': 3, 'embedding_dim': 96, 'lr': 0.0009358706696693685, 'lambda_val': 0.00014523930854886327, 'batch_size': 3497, 'optimizer': 'RMSprop'}.
2026-06-04 10:28:28,323 - experiment_functions - INFO - Early stopping at epoch 2250. Best Metrics: (0.010157679827292668, 0.0017834416236854446, 0.005848110878671018)
2026-06-04 10:28:28,398 - optuna.study.study - INFO - Trial 261 finished with values: [0.010157679827292668, 0.0017834416236854446, 0.005848110878671018] and parameters: {'n_layers': 4, 'embedding_dim': 96, 'lr': 0.0009358706696693685, 'lambda_val': 4.830818973924614e-06, 'batch_size': 1423, 'optimizer': 'Adam'}.
2026-06-04 10:31:01,756 - optuna.study.study - INFO - Trial 262 finished with values: [0.0012203539298209943, 0.00017750686583160294, 0.0005854107022364565] and parameters: {'n_layers': 4, 'embedding_dim': 64, 'lr': 0.00010339130756959958, 'lambda_val': 3.527273109344908e-05, 'batch_size': 1423, 'optimizer': 'RMSprop'}.
2026-06-04 10:32:04,410 - experiment_functions - INFO - Early stopping at epoch 1600. Best Metrics: (0.009199831528414415, 0.0015674191171545318, 0.005304413448307213)
2026-06-04 10:32:04,495 - optuna.study.study - INFO - Trial 263 finished with values: [0.009199831528414415, 0.0015674191171545318, 0.005304413448307213] and parameters: {'n_layers': 3, 'embedding_dim': 64, 'lr': 0.0009358706696693685, 'lambda_val': 4.830818973924614e-06, 'batch_size': 2979, 'optimizer': 'RMSprop'}.
2026-06-04 10:32:53,288 - experiment_functions - INFO - Early stopping at epoch 1150. Best Metrics: (0.008707912923017792, 0.0015975617924844263, 0.00517964185770583)
2026-06-04 10:32:53,368 - optuna.study.study - INFO - Trial 264 finished with values: [0.008707912923017792, 0.0015975617924844263, 0.00517964185770583] and parameters: {'n_layers': 4, 'embedding_dim': 96, 'lr': 0.0009993931731412705, 'lambda_val': 4.196412637639855e-05, 'batch_size': 2310, 'optimizer': 'Adam'}.
2026-06-04 10:33:53,253 - experiment_functions - INFO - Early stopping at epoch 1500. Best Metrics: (0.010859456443282359, 0.0019609484895170472, 0.006482056411858918)
2026-06-04 10:33:53,551 - optuna.study.study - INFO - Trial 265 finished with values: [0.010859456443282359, 0.0019609484895170472, 0.006482056411858918] and parameters: {'n_layers': 4, 'embedding_dim': 64, 'lr': 0.0009358706696693685, 'lambda_val': 0.00014523930854886327, 'batch_size': 1801, 'optimizer': 'RMSprop'}.
2026-06-04 10:34:44,678 - experiment_functions - INFO - Early stopping at epoch 1150. Best Metrics: (0.008481728299983974, 0.001503784580346976, 0.004837555454021717)
2026-06-04 10:34:45,007 - optuna.study.study - INFO - Trial 266 finished with values: [0.008481728299983974, 0.001503784580346976, 0.004837555454021717] and parameters: {'n_layers': 4, 'embedding_dim': 128, 'lr': 0.0009358706696693685, 'lambda_val': 6.28513345954955e-05, 'batch_size': 3032, 'optimizer': 'Adam'}.
2026-06-04 10:35:57,816 - experiment_functions - INFO - Early stopping at epoch 1800. Best Metrics: (0.011698109021664578, 0.0019894165717730594, 0.006672706150638866)
2026-06-04 10:35:57,926 - optuna.study.study - INFO - Trial 267 finished with values: [0.011698109021664578, 0.0019894165717730594, 0.006672706150638866] and parameters: {'n_layers': 3, 'embedding_dim': 96, 'lr': 0.0009358706696693685, 'lambda_val': 4.830818973924614e-06, 'batch_size': 1423, 'optimizer': 'RMSprop'}.
2026-06-04 10:37:40,502 - experiment_functions - INFO - Early stopping at epoch 2750. Best Metrics: (0.006669261007270633, 0.0010817871257284481, 0.003918903983392757)
2026-06-04 10:37:40,591 - optuna.study.study - INFO - Trial 268 finished with values: [0.006669261007270633, 0.0010817871257284481, 0.003918903983392757] and parameters: {'n_layers': 1, 'embedding_dim': 96, 'lr': 0.0013876621562912753, 'lambda_val': 3.914801209617112e-05, 'batch_size': 1230, 'optimizer': 'RMSprop'}.
2026-06-04 10:38:49,377 - experiment_functions - INFO - Early stopping at epoch 1700. Best Metrics: (0.010294718518585088, 0.0018437269743452344, 0.006279637414078269)
2026-06-04 10:38:49,467 - optuna.study.study - INFO - Trial 269 finished with values: [0.010294718518585088, 0.0018437269743452344, 0.006279637414078269] and parameters: {'n_layers': 3, 'embedding_dim': 96, 'lr': 0.0009358706696693685, 'lambda_val': 0.00014523930854886327, 'batch_size': 1423, 'optimizer': 'RMSprop'}.
2026-06-04 10:39:59,590 - experiment_functions - INFO - Early stopping at epoch 1350. Best Metrics: (0.009567293107253001, 0.0017717194721682632, 0.005466776071000008)
2026-06-04 10:39:59,680 - optuna.study.study - INFO - Trial 270 finished with values: [0.009567293107253001, 0.0017717194721682632, 0.005466776071000008] and parameters: {'n_layers': 4, 'embedding_dim': 256, 'lr': 0.0005758008621537027, 'lambda_val': 0.00014523930854886327, 'batch_size': 2498, 'optimizer': 'RMSprop'}.
2026-06-04 10:41:11,133 - experiment_functions - INFO - Early stopping at epoch 1350. Best Metrics: (0.008900090152814377, 0.0016210060955187892, 0.005067077840888156)
2026-06-04 10:41:11,610 - optuna.study.study - INFO - Trial 271 finished with values: [0.008900090152814377, 0.0016210060955187892, 0.005067077840888156] and parameters: {'n_layers': 4, 'embedding_dim': 256, 'lr': 0.0005623238238546706, 'lambda_val': 2.8077752105590774e-05, 'batch_size': 3752, 'optimizer': 'RMSprop'}.
2026-06-04 10:43:49,736 - experiment_functions - INFO - Early stopping at epoch 3850. Best Metrics: (0.012519468927044681, 0.002215486636747271, 0.007143813764640203)
2026-06-04 10:43:49,806 - optuna.study.study - INFO - Trial 272 finished with values: [0.012519468927044681, 0.002215486636747271, 0.007143813764640203] and parameters: {'n_layers': 4, 'embedding_dim': 96, 'lr': 0.0009358706696693685, 'lambda_val': 2.5795384074392596e-06, 'batch_size': 682, 'optimizer': 'Adam'}.
2026-06-04 10:45:56,230 - experiment_functions - INFO - Early stopping at epoch 3300. Best Metrics: (0.012854796012107117, 0.0022858195458503585, 0.007545432101490449)
2026-06-04 10:45:56,420 - optuna.study.study - INFO - Trial 273 finished with values: [0.012854796012107117, 0.0022858195458503585, 0.007545432101490449] and parameters: {'n_layers': 3, 'embedding_dim': 64, 'lr': 0.0009358706696693685, 'lambda_val': 0.0002748178610784401, 'batch_size': 775, 'optimizer': 'RMSprop'}.
2026-06-04 10:48:21,595 - experiment_functions - INFO - Early stopping at epoch 3850. Best Metrics: (0.0007553668464440641, 0.00012057070131957935, 0.000369992319696653)
2026-06-04 10:48:21,682 - optuna.study.study - INFO - Trial 274 finished with values: [0.0007553668464440641, 0.00012057070131957935, 0.000369992319696653] and parameters: {'n_layers': 1, 'embedding_dim': 128, 'lr': 0.00010667681971750745, 'lambda_val': 2.5795384074392596e-06, 'batch_size': 1423, 'optimizer': 'Adam'}.
2026-06-04 10:49:33,260 - experiment_functions - INFO - Early stopping at epoch 1750. Best Metrics: (0.0005219588665614707, 7.703128139862015e-05, 0.0002746742919220417)
2026-06-04 10:49:33,497 - optuna.study.study - INFO - Trial 275 finished with values: [0.0005219588665614707, 7.703128139862015e-05, 0.0002746742919220417] and parameters: {'n_layers': 4, 'embedding_dim': 96, 'lr': 1.0004791224947307e-05, 'lambda_val': 4.830818973924614e-06, 'batch_size': 682, 'optimizer': 'RMSprop'}.
2026-06-04 10:52:12,021 - optuna.study.study - INFO - Trial 276 finished with values: [0.00735638069440278, 0.0012643177707817, 0.004578112866871736] and parameters: {'n_layers': 2, 'embedding_dim': 128, 'lr': 0.0003985070127686743, 'lambda_val': 0.0002748178610784401, 'batch_size': 3058, 'optimizer': 'RMSprop'}.
2026-06-04 10:54:04,007 - experiment_functions - INFO - Early stopping at epoch 2850. Best Metrics: (0.015309710117918289, 0.0027178645589121847, 0.009283282516007197)
2026-06-04 10:54:04,096 - optuna.study.study - INFO - Trial 277 finished with values: [0.015309710117918289, 0.0027178645589121847, 0.009283282516007197] and parameters: {'n_layers': 4, 'embedding_dim': 64, 'lr': 0.0009358706696693685, 'lambda_val': 4.830818973924614e-06, 'batch_size': 775, 'optimizer': 'RMSprop'}.
2026-06-04 10:55:10,815 - experiment_functions - INFO - Early stopping at epoch 1600. Best Metrics: (0.009871573020277191, 0.0017700448790943803, 0.005711980186498489)
2026-06-04 10:55:10,921 - optuna.study.study - INFO - Trial 278 finished with values: [0.009871573020277191, 0.0017700448790943803, 0.005711980186498489] and parameters: {'n_layers': 4, 'embedding_dim': 96, 'lr': 0.0009358706696693685, 'lambda_val': 4.830818973924614e-06, 'batch_size': 1423, 'optimizer': 'Adam'}.
2026-06-04 10:56:23,921 - experiment_functions - INFO - Early stopping at epoch 1800. Best Metrics: (0.012322288566147635, 0.0022556768705204633, 0.00754325021479603)
2026-06-04 10:56:24,027 - optuna.study.study - INFO - Trial 279 finished with values: [0.012322288566147635, 0.0022556768705204633, 0.00754325021479603] and parameters: {'n_layers': 3, 'embedding_dim': 96, 'lr': 0.0013876621562912753, 'lambda_val': 2.5795384074392596e-06, 'batch_size': 682, 'optimizer': 'RMSprop'}.
2026-06-04 10:57:45,628 - experiment_functions - INFO - Early stopping at epoch 2100. Best Metrics: (0.00908656997185263, 0.0016126331301493742, 0.00529510225955333)
2026-06-04 10:57:45,719 - optuna.study.study - INFO - Trial 280 finished with values: [0.00908656997185263, 0.0016126331301493742, 0.00529510225955333] and parameters: {'n_layers': 2, 'embedding_dim': 96, 'lr': 0.001824440293641177, 'lambda_val': 4.112861956759072e-06, 'batch_size': 775, 'optimizer': 'RMSprop'}.
2026-06-04 10:58:18,138 - experiment_functions - INFO - Early stopping at epoch 600. Best Metrics: (0.007042318809168966, 0.001269341550003349, 0.0039780341790680625)
2026-06-04 10:58:18,240 - optuna.study.study - INFO - Trial 281 finished with values: [0.007042318809168966, 0.001269341550003349, 0.0039780341790680625] and parameters: {'n_layers': 4, 'embedding_dim': 256, 'lr': 0.0030107594587316534, 'lambda_val': 0.00014523930854886327, 'batch_size': 1801, 'optimizer': 'RMSprop'}.
2026-06-04 10:59:27,747 - experiment_functions - INFO - Early stopping at epoch 1800. Best Metrics: (0.008374746125934968, 0.0013982852166923437, 0.004992843286725285)
