2026-06-06 07:21:16,081 - optuna.study.study - INFO - Trial 110 finished with values: [0.05377130761095639, 0.006425413624489249, 0.024863226370251804] and parameters: {'n_layers': 3, 'embedding_dim': 96, 'lr': 0.004471753451787057, 'lambda_val': 5.315262969436241e-05, 'batch_size': 3502, 'optimizer': 'Adam'}.
2026-06-06 07:21:44,717 - experiment_functions - INFO - Early stopping at epoch 600. Best Metrics: (0.03879244316811142, 0.004960144684841583, 0.018297830508009708)
2026-06-06 07:21:44,826 - optuna.study.study - INFO - Trial 111 finished with values: [0.03879244316811142, 0.004960144684841583, 0.018297830508009708] and parameters: {'n_layers': 1, 'embedding_dim': 256, 'lr': 0.010696466135957424, 'lambda_val': 0.0034713085104803743, 'batch_size': 1699, 'optimizer': 'Adam'}.
2026-06-06 07:22:19,339 - experiment_functions - INFO - Early stopping at epoch 550. Best Metrics: (0.03355192312636281, 0.0038917543037041997, 0.016231728254285354)
2026-06-06 07:22:19,491 - optuna.study.study - INFO - Trial 112 finished with values: [0.03355192312636281, 0.0038917543037041997, 0.016231728254285354] and parameters: {'n_layers': 4, 'embedding_dim': 256, 'lr': 0.02638164782330716, 'lambda_val': 3.453094155452938e-05, 'batch_size': 3867, 'optimizer': 'RMSprop'}.
2026-06-06 07:22:44,976 - experiment_functions - INFO - Early stopping at epoch 600. Best Metrics: (0.058971093467997455, 0.007281130685243486, 0.030015837783025683)
2026-06-06 07:22:45,279 - optuna.study.study - INFO - Trial 113 finished with values: [0.058971093467997455, 0.007281130685243486, 0.030015837783025683] and parameters: {'n_layers': 1, 'embedding_dim': 64, 'lr': 0.017061469787437597, 'lambda_val': 5.510107267630662e-06, 'batch_size': 3655, 'optimizer': 'Adam'}.
2026-06-06 07:25:23,858 - optuna.study.study - INFO - Trial 114 finished with values: [0.059656635127931575, 0.008304307053386029, 0.0342801784862664] and parameters: {'n_layers': 1, 'embedding_dim': 96, 'lr': 0.0006810282647636203, 'lambda_val': 1.2176798127435423e-06, 'batch_size': 1712, 'optimizer': 'RMSprop'}.
2026-06-06 07:25:52,468 - experiment_functions - INFO - Early stopping at epoch 700. Best Metrics: (0.00045225824029809954, 6.195994373367272e-05, 0.00020334211456613636)
2026-06-06 07:25:53,405 - optuna.study.study - INFO - Trial 115 finished with values: [0.00045225824029809954, 6.195994373367272e-05, 0.00020334211456613636] and parameters: {'n_layers': 2, 'embedding_dim': 64, 'lr': 2.2235766667626976e-05, 'lambda_val': 5.315262969436241e-05, 'batch_size': 2384, 'optimizer': 'RMSprop'}.
2026-06-06 07:27:25,006 - experiment_functions - INFO - Early stopping at epoch 2200. Best Metrics: (0.05891529811669112, 0.006842387299886128, 0.02777106867565997)
2026-06-06 07:27:25,622 - optuna.study.study - INFO - Trial 116 finished with values: [0.05891529811669112, 0.006842387299886128, 0.02777106867565997] and parameters: {'n_layers': 1, 'embedding_dim': 128, 'lr': 0.005828487948467767, 'lambda_val': 1.3398416216824042e-06, 'batch_size': 2323, 'optimizer': 'RMSprop'}.
2026-06-06 07:27:48,597 - experiment_functions - INFO - Early stopping at epoch 550. Best Metrics: (0.010962205306573793, 0.0015423002210462856, 0.005734221196385479)
2026-06-06 07:27:48,692 - optuna.study.study - INFO - Trial 117 finished with values: [0.010962205306573793, 0.0015423002210462856, 0.005734221196385479] and parameters: {'n_layers': 1, 'embedding_dim': 64, 'lr': 0.0933995728246717, 'lambda_val': 3.996555780966423e-06, 'batch_size': 2604, 'optimizer': 'Adam'}.
2026-06-06 07:28:13,277 - experiment_functions - INFO - Early stopping at epoch 600. Best Metrics: (0.03869308016139515, 0.005119231026860474, 0.019194559904010006)
2026-06-06 07:28:13,501 - optuna.study.study - INFO - Trial 118 finished with values: [0.03869308016139515, 0.005119231026860474, 0.019194559904010006] and parameters: {'n_layers': 1, 'embedding_dim': 32, 'lr': 0.01433727156286783, 'lambda_val': 0.003010182335575881, 'batch_size': 1712, 'optimizer': 'Adam'}.
2026-06-06 07:28:45,366 - experiment_functions - INFO - Early stopping at epoch 750. Best Metrics: (0.0766942509519615, 0.009526759997320652, 0.04079632807334301)
2026-06-06 07:28:45,724 - optuna.study.study - INFO - Trial 119 finished with values: [0.0766942509519615, 0.009526759997320652, 0.04079632807334301] and parameters: {'n_layers': 1, 'embedding_dim': 64, 'lr': 0.005828487948467767, 'lambda_val': 5.510107267630662e-06, 'batch_size': 3359, 'optimizer': 'Adam'}.
2026-06-06 07:30:00,940 - experiment_functions - INFO - Early stopping at epoch 1900. Best Metrics: (0.03453804881777, 0.004052515238796973, 0.015756834822267824)
2026-06-06 07:30:01,121 - optuna.study.study - INFO - Trial 120 finished with values: [0.03453804881777, 0.004052515238796973, 0.015756834822267824] and parameters: {'n_layers': 3, 'embedding_dim': 32, 'lr': 0.013769923730273376, 'lambda_val': 3.209438228286478e-05, 'batch_size': 1934, 'optimizer': 'RMSprop'}.
2026-06-06 07:31:42,908 - experiment_functions - INFO - Early stopping at epoch 2650. Best Metrics: (0.0006824289413264592, 8.540424676803538e-05, 0.0002882380234994224)
2026-06-06 07:31:43,017 - optuna.study.study - INFO - Trial 121 finished with values: [0.0006824289413264592, 8.540424676803538e-05, 0.0002882380234994224] and parameters: {'n_layers': 4, 'embedding_dim': 32, 'lr': 6.013811965658963e-05, 'lambda_val': 1.2021465828711608e-06, 'batch_size': 1079, 'optimizer': 'Adam'}.
2026-06-06 07:35:33,601 - experiment_functions - INFO - Early stopping at epoch 3900. Best Metrics: (0.048919779535852755, 0.005693616451202358, 0.023231371550635208)
2026-06-06 07:35:34,023 - optuna.study.study - INFO - Trial 122 finished with values: [0.048919779535852755, 0.005693616451202358, 0.023231371550635208] and parameters: {'n_layers': 4, 'embedding_dim': 256, 'lr': 0.003907207464051617, 'lambda_val': 4.922331159406591e-06, 'batch_size': 667, 'optimizer': 'RMSprop'}.
2026-06-06 07:36:19,008 - experiment_functions - INFO - Early stopping at epoch 1100. Best Metrics: (0.04202778178163159, 0.005179516377520263, 0.021148629278319248)
2026-06-06 07:36:19,312 - optuna.study.study - INFO - Trial 123 finished with values: [0.04202778178163159, 0.005179516377520263, 0.021148629278319248] and parameters: {'n_layers': 3, 'embedding_dim': 32, 'lr': 0.0019509035141199726, 'lambda_val': 4.2735070605297645e-06, 'batch_size': 1350, 'optimizer': 'RMSprop'}.
2026-06-06 07:37:11,224 - experiment_functions - INFO - Early stopping at epoch 1100. Best Metrics: (0.06237173377666511, 0.007416772724228012, 0.03121573660962553)
2026-06-06 07:37:11,307 - optuna.study.study - INFO - Trial 124 finished with values: [0.06237173377666511, 0.007416772724228012, 0.03121573660962553] and parameters: {'n_layers': 1, 'embedding_dim': 256, 'lr': 0.005828487948467767, 'lambda_val': 7.265971768922724e-05, 'batch_size': 1079, 'optimizer': 'Adam'}.
2026-06-06 07:37:50,646 - experiment_functions - INFO - Early stopping at epoch 900. Best Metrics: (0.06951057525676688, 0.008654297005827585, 0.034516236522598054)
2026-06-06 07:37:51,529 - optuna.study.study - INFO - Trial 125 finished with values: [0.06951057525676688, 0.008654297005827585, 0.034516236522598054] and parameters: {'n_layers': 1, 'embedding_dim': 128, 'lr': 0.002124781352620552, 'lambda_val': 0.0016696163443190065, 'batch_size': 3209, 'optimizer': 'RMSprop'}.
2026-06-06 07:40:42,092 - experiment_functions - INFO - Early stopping at epoch 3850. Best Metrics: (0.08529241276119397, 0.010420992698774197, 0.046160510542158015)
2026-06-06 07:40:42,170 - optuna.study.study - INFO - Trial 126 finished with values: [0.08529241276119397, 0.010420992698774197, 0.046160510542158015] and parameters: {'n_layers': 2, 'embedding_dim': 128, 'lr': 0.0006711529294623438, 'lambda_val': 5.315262969436241e-05, 'batch_size': 2384, 'optimizer': 'RMSprop'}.
2026-06-06 07:41:31,630 - experiment_functions - INFO - Early stopping at epoch 1200. Best Metrics: (0.006028813858438108, 0.0009478196798178044, 0.00307981928658132)
2026-06-06 07:41:31,756 - optuna.study.study - INFO - Trial 127 finished with values: [0.006028813858438108, 0.0009478196798178044, 0.00307981928658132] and parameters: {'n_layers': 1, 'embedding_dim': 128, 'lr': 0.05910433281713665, 'lambda_val': 8.198950044762925e-06, 'batch_size': 3359, 'optimizer': 'RMSprop'}.
2026-06-06 07:43:16,305 - experiment_functions - INFO - Early stopping at epoch 2350. Best Metrics: (0.030414882685764606, 0.003727644182463662, 0.014074085209214281)
2026-06-06 07:43:16,396 - optuna.study.study - INFO - Trial 128 finished with values: [0.030414882685764606, 0.003727644182463662, 0.014074085209214281] and parameters: {'n_layers': 1, 'embedding_dim': 256, 'lr': 0.02638164782330716, 'lambda_val': 0.003595721119459768, 'batch_size': 2323, 'optimizer': 'RMSprop'}.
2026-06-06 07:43:42,237 - experiment_functions - INFO - Early stopping at epoch 600. Best Metrics: (0.04152317352976669, 0.005643378658985867, 0.020774071734501527)
2026-06-06 07:43:42,611 - optuna.study.study - INFO - Trial 129 finished with values: [0.04152317352976669, 0.005643378658985867, 0.020774071734501527] and parameters: {'n_layers': 1, 'embedding_dim': 96, 'lr': 0.010696466135957424, 'lambda_val': 0.0034713085104803743, 'batch_size': 1706, 'optimizer': 'Adam'}.
2026-06-06 07:44:13,220 - experiment_functions - INFO - Early stopping at epoch 700. Best Metrics: (0.04434355139214672, 0.00535869783642575, 0.02049675779761656)
2026-06-06 07:44:14,440 - optuna.study.study - INFO - Trial 130 finished with values: [0.04434355139214672, 0.00535869783642575, 0.02049675779761656] and parameters: {'n_layers': 1, 'embedding_dim': 128, 'lr': 0.005828487948467767, 'lambda_val': 0.0016696163443190065, 'batch_size': 3209, 'optimizer': 'RMSprop'}.
2026-06-06 07:44:40,070 - experiment_functions - INFO - Early stopping at epoch 500. Best Metrics: (0.014408823599563962, 0.0016009109786321925, 0.006971333544490525)
2026-06-06 07:44:40,420 - optuna.study.study - INFO - Trial 131 finished with values: [0.014408823599563962, 0.0016009109786321925, 0.006971333544490525] and parameters: {'n_layers': 4, 'embedding_dim': 128, 'lr': 0.04144140535344331, 'lambda_val': 0.003998877390754319, 'batch_size': 2193, 'optimizer': 'RMSprop'}.
2026-06-06 07:45:30,468 - experiment_functions - INFO - Early stopping at epoch 1150. Best Metrics: (0.08453948048145071, 0.01016812914461786, 0.0435802627451973)
2026-06-06 07:45:30,730 - optuna.study.study - INFO - Trial 132 finished with values: [0.08453948048145071, 0.01016812914461786, 0.0435802627451973] and parameters: {'n_layers': 1, 'embedding_dim': 128, 'lr': 0.0019509035141199726, 'lambda_val': 4.2735070605297645e-06, 'batch_size': 3866, 'optimizer': 'RMSprop'}.
2026-06-06 07:48:08,015 - experiment_functions - INFO - Early stopping at epoch 3900. Best Metrics: (0.030494951251739927, 0.0038130484292316965, 0.014935002539943332)
2026-06-06 07:48:08,125 - optuna.study.study - INFO - Trial 133 finished with values: [0.030494951251739927, 0.0038130484292316965, 0.014935002539943332] and parameters: {'n_layers': 1, 'embedding_dim': 128, 'lr': 0.017061469787437597, 'lambda_val': 2.5535184182963008e-05, 'batch_size': 1079, 'optimizer': 'RMSprop'}.
2026-06-06 07:48:56,742 - experiment_functions - INFO - Early stopping at epoch 1200. Best Metrics: (0.059863787013179015, 0.007344765222051042, 0.0295898584883046)
2026-06-06 07:48:56,839 - optuna.study.study - INFO - Trial 134 finished with values: [0.059863787013179015, 0.007344765222051042, 0.0295898584883046] and parameters: {'n_layers': 2, 'embedding_dim': 32, 'lr': 0.0019509035141199726, 'lambda_val': 5.315262969436241e-05, 'batch_size': 1156, 'optimizer': 'RMSprop'}.
2026-06-06 07:50:29,923 - experiment_functions - INFO - Early stopping at epoch 2350. Best Metrics: (0.061104116635888994, 0.007091901667894702, 0.02911572690953564)
2026-06-06 07:50:30,008 - optuna.study.study - INFO - Trial 135 finished with values: [0.061104116635888994, 0.007091901667894702, 0.02911572690953564] and parameters: {'n_layers': 1, 'embedding_dim': 64, 'lr': 0.005828487948467767, 'lambda_val': 3.996555780966423e-06, 'batch_size': 1237, 'optimizer': 'RMSprop'}.
2026-06-06 07:50:50,811 - experiment_functions - INFO - Early stopping at epoch 500. Best Metrics: (0.0005326932904214855, 7.033290910308795e-05, 0.00029101017193180253)
2026-06-06 07:50:51,325 - optuna.study.study - INFO - Trial 136 finished with values: [0.0005326932904214855, 7.033290910308795e-05, 0.00029101017193180253] and parameters: {'n_layers': 1, 'embedding_dim': 64, 'lr': 0.00017177228966626382, 'lambda_val': 0.001602265573028567, 'batch_size': 1052, 'optimizer': 'Adam'}.
2026-06-06 07:51:12,054 - experiment_functions - INFO - Early stopping at epoch 500. Best Metrics: (0.0004948564886463423, 6.195994373367272e-05, 0.00024185991236631773)
2026-06-06 07:51:12,159 - optuna.study.study - INFO - Trial 137 finished with values: [0.0004948564886463423, 6.195994373367272e-05, 0.00024185991236631773] and parameters: {'n_layers': 2, 'embedding_dim': 32, 'lr': 0.01433727156286783, 'lambda_val': 7.38199366681301e-06, 'batch_size': 3428, 'optimizer': 'SGD'}.
2026-06-06 07:53:49,258 - optuna.study.study - INFO - Trial 138 finished with values: [0.08619178638418681, 0.010630316833009579, 0.045868453485986525] and parameters: {'n_layers': 1, 'embedding_dim': 32, 'lr': 0.0019509035141199726, 'lambda_val': 1.3036977819163817e-06, 'batch_size': 3209, 'optimizer': 'Adam'}.
2026-06-06 07:56:48,785 - experiment_functions - INFO - Early stopping at epoch 3950. Best Metrics: (0.05753181892848162, 0.007004822828052784, 0.02974558375303626)
2026-06-06 07:56:48,861 - optuna.study.study - INFO - Trial 139 finished with values: [0.05753181892848162, 0.007004822828052784, 0.02974558375303626] and parameters: {'n_layers': 4, 'embedding_dim': 96, 'lr': 0.0005278478256568082, 'lambda_val': 8.198950044762925e-06, 'batch_size': 1350, 'optimizer': 'RMSprop'}.
2026-06-06 08:00:46,563 - optuna.study.study - INFO - Trial 140 finished with values: [0.06449553171948699, 0.008009578672382613, 0.034018279826887064] and parameters: {'n_layers': 4, 'embedding_dim': 256, 'lr': 0.00021389021150995766, 'lambda_val': 1.3398416216824042e-06, 'batch_size': 2989, 'optimizer': 'RMSprop'}.
2026-06-06 08:01:19,465 - experiment_functions - INFO - Early stopping at epoch 750. Best Metrics: (0.03887721420391265, 0.004995311139393128, 0.018422648165273718)
2026-06-06 08:01:19,565 - optuna.study.study - INFO - Trial 141 finished with values: [0.03887721420391265, 0.004995311139393128, 0.018422648165273718] and parameters: {'n_layers': 2, 'embedding_dim': 96, 'lr': 0.0019509035141199726, 'lambda_val': 0.015026518206426703, 'batch_size': 2384, 'optimizer': 'Adam'}.
2026-06-06 08:04:25,424 - optuna.study.study - INFO - Trial 142 finished with values: [0.09323379321121099, 0.0114676133699511, 0.04978107974365225] and parameters: {'n_layers': 1, 'embedding_dim': 256, 'lr': 0.0017827212934439936, 'lambda_val': 5.148126115320708e-06, 'batch_size': 1122, 'optimizer': 'Adam'}.
2026-06-06 08:06:38,927 - experiment_functions - INFO - Early stopping at epoch 2950. Best Metrics: (0.057277142757224446, 0.006746935494674795, 0.027830006219799513)
2026-06-06 08:06:39,209 - optuna.study.study - INFO - Trial 143 finished with values: [0.057277142757224446, 0.006746935494674795, 0.027830006219799513] and parameters: {'n_layers': 1, 'embedding_dim': 256, 'lr': 0.005828487948467767, 'lambda_val': 7.265971768922724e-05, 'batch_size': 3115, 'optimizer': 'RMSprop'}.
2026-06-06 08:09:35,595 - optuna.study.study - INFO - Trial 144 finished with values: [0.07260981363287207, 0.00877821689329493, 0.03839402798417304] and parameters: {'n_layers': 3, 'embedding_dim': 96, 'lr': 0.0005278478256568082, 'lambda_val': 8.198950044762925e-06, 'batch_size': 1696, 'optimizer': 'RMSprop'}.
2026-06-06 08:10:20,347 - experiment_functions - INFO - Early stopping at epoch 1100. Best Metrics: (0.07008121664286054, 0.008396409672449595, 0.03599766115405758)
2026-06-06 08:10:20,661 - optuna.study.study - INFO - Trial 145 finished with values: [0.07008121664286054, 0.008396409672449595, 0.03599766115405758] and parameters: {'n_layers': 2, 'embedding_dim': 32, 'lr': 0.0019509035141199726, 'lambda_val': 3.456741724473969e-06, 'batch_size': 2384, 'optimizer': 'Adam'}.
2026-06-06 08:10:57,091 - experiment_functions - INFO - Early stopping at epoch 950. Best Metrics: (0.0006987187210152966, 9.042802598968451e-05, 0.00029441624446729226)
2026-06-06 08:10:57,383 - optuna.study.study - INFO - Trial 146 finished with values: [0.0006987187210152966, 9.042802598968451e-05, 0.00029441624446729226] and parameters: {'n_layers': 1, 'embedding_dim': 32, 'lr': 0.00013510229001541778, 'lambda_val': 0.00054092001322401, 'batch_size': 2918, 'optimizer': 'RMSprop'}.
2026-06-06 08:11:26,594 - experiment_functions - INFO - Early stopping at epoch 550. Best Metrics: (0.02671575478967764, 0.003310670507066783, 0.013291597431627123)
2026-06-06 08:11:26,670 - optuna.study.study - INFO - Trial 147 finished with values: [0.02671575478967764, 0.003310670507066783, 0.013291597431627123] and parameters: {'n_layers': 2, 'embedding_dim': 256, 'lr': 0.02638164782330716, 'lambda_val': 1.3398416216824042e-06, 'batch_size': 3214, 'optimizer': 'RMSprop'}.
2026-06-06 08:11:57,416 - experiment_functions - INFO - Early stopping at epoch 700. Best Metrics: (0.04441065614874424, 0.005387165918681761, 0.020927897646036968)
2026-06-06 08:11:58,213 - optuna.study.study - INFO - Trial 148 finished with values: [0.04441065614874424, 0.005387165918681761, 0.020927897646036968] and parameters: {'n_layers': 1, 'embedding_dim': 128, 'lr': 0.005828487948467767, 'lambda_val': 0.001602265573028567, 'batch_size': 3359, 'optimizer': 'RMSprop'}.
2026-06-06 08:12:46,674 - experiment_functions - INFO - Early stopping at epoch 800. Best Metrics: (0.04141166350617083, 0.00468383682765088, 0.019380848827908942)
2026-06-06 08:12:46,765 - optuna.study.study - INFO - Trial 149 finished with values: [0.04141166350617083, 0.00468383682765088, 0.019380848827908942] and parameters: {'n_layers': 4, 'embedding_dim': 256, 'lr': 0.01433727156286783, 'lambda_val': 5.315262969436241e-05, 'batch_size': 2989, 'optimizer': 'RMSprop'}.
2026-06-06 08:14:20,538 - experiment_functions - INFO - Early stopping at epoch 1700. Best Metrics: (0.051820154311550175, 0.00650244490588787, 0.0251273350258288)
2026-06-06 08:14:20,638 - optuna.study.study - INFO - Trial 150 finished with values: [0.051820154311550175, 0.00650244490588787, 0.0251273350258288] and parameters: {'n_layers': 3, 'embedding_dim': 256, 'lr': 0.0003834700215967704, 'lambda_val': 0.003010182335575881, 'batch_size': 3082, 'optimizer': 'RMSprop'}.
2026-06-06 08:14:52,308 - experiment_functions - INFO - Early stopping at epoch 750. Best Metrics: (0.05746725291748852, 0.006847411079107777, 0.028741310041580117)
2026-06-06 08:14:53,017 - optuna.study.study - INFO - Trial 151 finished with values: [0.05746725291748852, 0.006847411079107777, 0.028741310041580117] and parameters: {'n_layers': 1, 'embedding_dim': 64, 'lr': 0.005828487948467767, 'lambda_val': 0.00011326982753488592, 'batch_size': 3209, 'optimizer': 'RMSprop'}.
2026-06-06 08:17:45,653 - experiment_functions - INFO - Early stopping at epoch 3800. Best Metrics: (0.06757559577309723, 0.007972737624757184, 0.032530916109045765)
2026-06-06 08:17:46,669 - optuna.study.study - INFO - Trial 152 finished with values: [0.06757559577309723, 0.007972737624757184, 0.032530916109045765] and parameters: {'n_layers': 1, 'embedding_dim': 256, 'lr': 0.003907207464051617, 'lambda_val': 4.922331159406591e-06, 'batch_size': 1772, 'optimizer': 'RMSprop'}.
2026-06-06 08:19:34,372 - experiment_functions - INFO - Early stopping at epoch 2750. Best Metrics: (0.0796582721953643, 0.009739433317703798, 0.040404160769925486)
2026-06-06 08:19:34,447 - optuna.study.study - INFO - Trial 153 finished with values: [0.0796582721953643, 0.009739433317703798, 0.040404160769925486] and parameters: {'n_layers': 1, 'embedding_dim': 32, 'lr': 0.0017827212934439936, 'lambda_val': 0.0006603606000578724, 'batch_size': 3082, 'optimizer': 'RMSprop'}.
2026-06-06 08:21:58,838 - optuna.study.study - INFO - Trial 154 finished with values: [0.0005452424192789072, 8.540424676803537e-05, 0.0002662586770677822] and parameters: {'n_layers': 1, 'embedding_dim': 32, 'lr': 0.00011985658031930032, 'lambda_val': 5.315262969436241e-05, 'batch_size': 2384, 'optimizer': 'RMSprop'}.
2026-06-06 08:24:32,789 - experiment_functions - INFO - Early stopping at epoch 3850. Best Metrics: (0.05916004767783499, 0.007009846607274432, 0.02867994245361926)
2026-06-06 08:24:33,076 - optuna.study.study - INFO - Trial 155 finished with values: [0.05916004767783499, 0.007009846607274432, 0.02867994245361926] and parameters: {'n_layers': 1, 'embedding_dim': 96, 'lr': 0.005828487948467767, 'lambda_val': 8.198950044762925e-06, 'batch_size': 1696, 'optimizer': 'RMSprop'}.
2026-06-06 08:27:26,019 - optuna.study.study - INFO - Trial 156 finished with values: [0.005515290426818336, 0.0010030812512559447, 0.003067922544409537] and parameters: {'n_layers': 1, 'embedding_dim': 256, 'lr': 0.0002548931113564868, 'lambda_val': 1.1882786454634558e-06, 'batch_size': 2536, 'optimizer': 'RMSprop'}.
2026-06-06 08:28:00,738 - experiment_functions - INFO - Early stopping at epoch 750. Best Metrics: (0.05889961372706681, 0.006936164512023578, 0.02848420345676247)
2026-06-06 08:28:01,244 - optuna.study.study - INFO - Trial 157 finished with values: [0.05889961372706681, 0.006936164512023578, 0.02848420345676247] and parameters: {'n_layers': 2, 'embedding_dim': 128, 'lr': 0.0019509035141199726, 'lambda_val': 7.265971768922724e-05, 'batch_size': 3866, 'optimizer': 'RMSprop'}.
2026-06-06 08:28:31,721 - experiment_functions - INFO - Early stopping at epoch 750. Best Metrics: (0.02535776311556476, 0.003278853238663005, 0.012403258739365049)
