2026-06-05 16:28:38,757 - optuna.study.study - INFO - Trial 147 finished with values: [0.037973088918798775, 0.005758925581083798, 0.021936669150486306] and parameters: {'n_layers': 1, 'embedding_dim': 32, 'lr': 0.0009590496257981318, 'lambda_val': 0.007468981389036971, 'batch_size': 655, 'optimizer': 'RMSprop'}.
2026-06-05 16:29:01,429 - experiment_functions - INFO - Early stopping at epoch 500. Best Metrics: (0.0005563758364770554, 8.875343291580147e-05, 0.00026367784699599437)
2026-06-05 16:29:01,531 - optuna.study.study - INFO - Trial 148 finished with values: [0.0005563758364770554, 8.875343291580147e-05, 0.00026367784699599437] and parameters: {'n_layers': 2, 'embedding_dim': 128, 'lr': 1.8957331580889483e-05, 'lambda_val': 0.003086353924928254, 'batch_size': 2271, 'optimizer': 'Adam'}.
2026-06-05 16:31:34,864 - optuna.study.study - INFO - Trial 149 finished with values: [0.05625865300466048, 0.00735481278049434, 0.030466245025420287] and parameters: {'n_layers': 2, 'embedding_dim': 32, 'lr': 0.0004666871232718281, 'lambda_val': 7.487535492065269e-05, 'batch_size': 2271, 'optimizer': 'RMSprop'}.
2026-06-05 16:32:44,767 - experiment_functions - INFO - Early stopping at epoch 1750. Best Metrics: (0.05736057501743347, 0.0070215687587916135, 0.028705439782917487)
2026-06-05 16:32:45,209 - optuna.study.study - INFO - Trial 150 finished with values: [0.05736057501743347, 0.0070215687587916135, 0.028705439782917487] and parameters: {'n_layers': 2, 'embedding_dim': 32, 'lr': 0.0008576367655519577, 'lambda_val': 0.002216645949290765, 'batch_size': 2947, 'optimizer': 'RMSprop'}.
2026-06-05 16:34:14,581 - experiment_functions - INFO - Early stopping at epoch 2250. Best Metrics: (0.0719957347752965, 0.008609082992832742, 0.0363096565540829)
2026-06-05 16:34:14,669 - optuna.study.study - INFO - Trial 151 finished with values: [0.0719957347752965, 0.008609082992832742, 0.0363096565540829] and parameters: {'n_layers': 2, 'embedding_dim': 32, 'lr': 0.0018762947263184326, 'lambda_val': 5.587325552332493e-06, 'batch_size': 2271, 'optimizer': 'Adam'}.
2026-06-05 16:36:53,280 - optuna.study.study - INFO - Trial 152 finished with values: [0.05395757789646624, 0.007240940451470293, 0.030331960886732817] and parameters: {'n_layers': 2, 'embedding_dim': 64, 'lr': 0.0004666871232718281, 'lambda_val': 2.2392691089871585e-06, 'batch_size': 1774, 'optimizer': 'Adam'}.
2026-06-05 16:38:01,503 - experiment_functions - INFO - Early stopping at epoch 1550. Best Metrics: (0.03908709361440976, 0.00451805211333646, 0.01759742092382208)
2026-06-05 16:38:01,591 - optuna.study.study - INFO - Trial 153 finished with values: [0.03908709361440976, 0.00451805211333646, 0.01759742092382208] and parameters: {'n_layers': 2, 'embedding_dim': 128, 'lr': 0.0029470384606335377, 'lambda_val': 0.0011513204288259027, 'batch_size': 1774, 'optimizer': 'RMSprop'}.
2026-06-05 16:41:04,385 - optuna.study.study - INFO - Trial 154 finished with values: [0.0856349943888876, 0.01095016411012124, 0.04650933503830965] and parameters: {'n_layers': 1, 'embedding_dim': 256, 'lr': 0.0007730079936260513, 'lambda_val': 5.587325552332493e-06, 'batch_size': 2546, 'optimizer': 'Adam'}.
2026-06-05 16:42:31,720 - experiment_functions - INFO - Early stopping at epoch 1950. Best Metrics: (0.017753427997530866, 0.0021937169267867906, 0.008051383068912359)
2026-06-05 16:42:31,807 - optuna.study.study - INFO - Trial 155 finished with values: [0.017753427997530866, 0.0021937169267867906, 0.008051383068912359] and parameters: {'n_layers': 3, 'embedding_dim': 128, 'lr': 0.0007730079936260513, 'lambda_val': 0.031282836436495084, 'batch_size': 1280, 'optimizer': 'RMSprop'}.
2026-06-05 16:44:18,415 - experiment_functions - INFO - Early stopping at epoch 2650. Best Metrics: (0.06263465949870806, 0.007580882845468552, 0.031728061599844835)
2026-06-05 16:44:18,561 - optuna.study.study - INFO - Trial 156 finished with values: [0.06263465949870806, 0.007580882845468552, 0.031728061599844835] and parameters: {'n_layers': 3, 'embedding_dim': 32, 'lr': 0.0007908861785647595, 'lambda_val': 0.00011375426873786574, 'batch_size': 2947, 'optimizer': 'RMSprop'}.
2026-06-05 16:46:51,003 - optuna.study.study - INFO - Trial 157 finished with values: [0.05465465996995613, 0.00759093040391185, 0.03177617291853967] and parameters: {'n_layers': 1, 'embedding_dim': 32, 'lr': 0.0010470286775611781, 'lambda_val': 2.2392691089871585e-06, 'batch_size': 1011, 'optimizer': 'RMSprop'}.
2026-06-05 16:49:23,230 - optuna.study.study - INFO - Trial 158 finished with values: [0.028200816528616772, 0.0042517918145890555, 0.016664000806927936] and parameters: {'n_layers': 1, 'embedding_dim': 64, 'lr': 0.0007912354345926823, 'lambda_val': 0.0023604176548426264, 'batch_size': 767, 'optimizer': 'Adam'}.
2026-06-05 16:51:56,976 - optuna.study.study - INFO - Trial 159 finished with values: [0.021601616892513543, 0.0038197468015272284, 0.01113217191715951] and parameters: {'n_layers': 1, 'embedding_dim': 96, 'lr': 0.0007730079936260513, 'lambda_val': 0.021886493172504122, 'batch_size': 522, 'optimizer': 'RMSprop'}.
2026-06-05 16:54:31,179 - optuna.study.study - INFO - Trial 160 finished with values: [0.06283214085939219, 0.008377989148636881, 0.035724972722181406] and parameters: {'n_layers': 1, 'embedding_dim': 32, 'lr': 0.0007908861785647595, 'lambda_val': 0.00011375426873786574, 'batch_size': 2947, 'optimizer': 'RMSprop'}.
2026-06-05 16:55:21,537 - experiment_functions - INFO - Early stopping at epoch 1250. Best Metrics: (0.0437094571753392, 0.0052347779489584035, 0.021887398058110876)
2026-06-05 16:55:21,630 - optuna.study.study - INFO - Trial 161 finished with values: [0.0437094571753392, 0.0052347779489584035, 0.021887398058110876] and parameters: {'n_layers': 4, 'embedding_dim': 32, 'lr': 0.0007908861785647595, 'lambda_val': 7.487535492065269e-05, 'batch_size': 2271, 'optimizer': 'RMSprop'}.
2026-06-05 16:57:51,125 - optuna.study.study - INFO - Trial 162 finished with values: [0.0266752104352047, 0.00410610221716123, 0.015573976573577421] and parameters: {'n_layers': 2, 'embedding_dim': 32, 'lr': 0.0004666871232718281, 'lambda_val': 7.487535492065269e-05, 'batch_size': 722, 'optimizer': 'RMSprop'}.
2026-06-05 17:00:29,026 - optuna.study.study - INFO - Trial 163 finished with values: [0.07217200675132718, 0.008786589858664345, 0.03796324618823975] and parameters: {'n_layers': 2, 'embedding_dim': 32, 'lr': 0.0007908861785647595, 'lambda_val': 0.00011375426873786574, 'batch_size': 2947, 'optimizer': 'RMSprop'}.
2026-06-05 17:01:06,735 - experiment_functions - INFO - Early stopping at epoch 600. Best Metrics: (0.03979169554240386, 0.004717328689128542, 0.018313807196490013)
2026-06-05 17:01:06,822 - optuna.study.study - INFO - Trial 164 finished with values: [0.03979169554240386, 0.004717328689128542, 0.018313807196490013] and parameters: {'n_layers': 4, 'embedding_dim': 256, 'lr': 0.0029470384606335377, 'lambda_val': 5.587325552332493e-06, 'batch_size': 2271, 'optimizer': 'Adam'}.
2026-06-05 17:03:42,732 - optuna.study.study - INFO - Trial 165 finished with values: [0.062004861760380385, 0.007910777681023511, 0.032139988257113554] and parameters: {'n_layers': 2, 'embedding_dim': 32, 'lr': 0.0008576367655519577, 'lambda_val': 0.0023604176548426264, 'batch_size': 926, 'optimizer': 'Adam'}.
2026-06-05 17:04:19,576 - experiment_functions - INFO - Early stopping at epoch 850. Best Metrics: (0.06581320450578948, 0.008012927858530377, 0.03221513332096335)
2026-06-05 17:04:20,235 - optuna.study.study - INFO - Trial 166 finished with values: [0.06581320450578948, 0.008012927858530377, 0.03221513332096335] and parameters: {'n_layers': 1, 'embedding_dim': 128, 'lr': 0.0029470384606335377, 'lambda_val': 0.0011513204288259027, 'batch_size': 2595, 'optimizer': 'RMSprop'}.
2026-06-05 17:07:08,622 - optuna.study.study - INFO - Trial 167 finished with values: [0.0928035452147043, 0.011475986335320517, 0.04863614664277538] and parameters: {'n_layers': 1, 'embedding_dim': 128, 'lr': 0.0010470286775611781, 'lambda_val': 0.00020574260712132375, 'batch_size': 3475, 'optimizer': 'Adam'}.
2026-06-05 17:10:04,044 - optuna.study.study - INFO - Trial 168 finished with values: [0.08079768650448924, 0.010029137919485566, 0.04437763314856487] and parameters: {'n_layers': 2, 'embedding_dim': 128, 'lr': 0.0008576367655519577, 'lambda_val': 0.0001580551667310673, 'batch_size': 926, 'optimizer': 'Adam'}.
2026-06-05 17:12:32,719 - optuna.study.study - INFO - Trial 169 finished with values: [0.01161830609570209, 0.001981043606403644, 0.006594334072571648] and parameters: {'n_layers': 1, 'embedding_dim': 32, 'lr': 0.00035382245097748176, 'lambda_val': 3.684365830705915e-05, 'batch_size': 3477, 'optimizer': 'RMSprop'}.
2026-06-05 17:15:06,162 - optuna.study.study - INFO - Trial 170 finished with values: [0.07149960101420906, 0.009299015339272555, 0.03922280988827386] and parameters: {'n_layers': 1, 'embedding_dim': 32, 'lr': 0.0009590496257981318, 'lambda_val': 3.684365830705915e-05, 'batch_size': 2108, 'optimizer': 'RMSprop'}.
2026-06-05 17:15:59,876 - experiment_functions - INFO - Early stopping at epoch 900. Best Metrics: (0.0005070591745905183, 7.033290910308795e-05, 0.00021216602931313342)
2026-06-05 17:16:00,110 - optuna.study.study - INFO - Trial 171 finished with values: [0.0005070591745905183, 7.033290910308795e-05, 0.00021216602931313342] and parameters: {'n_layers': 4, 'embedding_dim': 256, 'lr': 1.7726623394354058e-05, 'lambda_val': 0.004870117303345283, 'batch_size': 2848, 'optimizer': 'RMSprop'}.
2026-06-05 17:18:38,156 - optuna.study.study - INFO - Trial 172 finished with values: [0.07721170395228678, 0.009431308192109317, 0.040344888385495804] and parameters: {'n_layers': 2, 'embedding_dim': 32, 'lr': 0.0009590496257981318, 'lambda_val': 3.684365830705915e-05, 'batch_size': 2266, 'optimizer': 'RMSprop'}.
2026-06-05 17:22:32,476 - optuna.study.study - INFO - Trial 173 finished with values: [0.041635148026722586, 0.005474244758523678, 0.021304731057456998] and parameters: {'n_layers': 4, 'embedding_dim': 256, 'lr': 0.00017225906647401988, 'lambda_val': 0.00011375426873786574, 'batch_size': 2894, 'optimizer': 'Adam'}.
2026-06-05 17:23:37,044 - experiment_functions - INFO - Early stopping at epoch 1650. Best Metrics: (0.0571563199685778, 0.007249313416839709, 0.029500301220226482)
2026-06-05 17:23:37,133 - optuna.study.study - INFO - Trial 174 finished with values: [0.0571563199685778, 0.007249313416839709, 0.029500301220226482] and parameters: {'n_layers': 2, 'embedding_dim': 32, 'lr': 0.0008576367655519577, 'lambda_val': 0.0023604176548426264, 'batch_size': 2271, 'optimizer': 'RMSprop'}.
2026-06-05 17:26:17,334 - optuna.study.study - INFO - Trial 175 finished with values: [0.06246419494844225, 0.008709558577265724, 0.033517904392986284] and parameters: {'n_layers': 1, 'embedding_dim': 96, 'lr': 0.0010470286775611781, 'lambda_val': 0.004285518144526943, 'batch_size': 915, 'optimizer': 'Adam'}.
2026-06-05 17:29:07,791 - optuna.study.study - INFO - Trial 176 finished with values: [0.05045078546953592, 0.006522540022774466, 0.026004670417650144] and parameters: {'n_layers': 4, 'embedding_dim': 64, 'lr': 0.00029609176700534276, 'lambda_val': 3.732019937312388e-06, 'batch_size': 3207, 'optimizer': 'Adam'}.
2026-06-05 17:29:29,608 - experiment_functions - INFO - Early stopping at epoch 550. Best Metrics: (0.0003779595547707782, 5.358697836425749e-05, 0.0001763391823010742)
2026-06-05 17:29:29,704 - optuna.study.study - INFO - Trial 177 finished with values: [0.0003779595547707782, 5.358697836425749e-05, 0.0001763391823010742] and parameters: {'n_layers': 1, 'embedding_dim': 32, 'lr': 4.575952179966325e-05, 'lambda_val': 0.00033127211998733373, 'batch_size': 1280, 'optimizer': 'RMSprop'}.
2026-06-05 17:31:23,101 - experiment_functions - INFO - Early stopping at epoch 2650. Best Metrics: (0.08333506571918636, 0.01015473240002679, 0.04334420246878966)
2026-06-05 17:31:23,190 - optuna.study.study - INFO - Trial 178 finished with values: [0.08333506571918636, 0.01015473240002679, 0.04334420246878966] and parameters: {'n_layers': 2, 'embedding_dim': 96, 'lr': 0.0009590496257981318, 'lambda_val': 2.8670388049392515e-06, 'batch_size': 2271, 'optimizer': 'Adam'}.
2026-06-05 17:32:10,371 - experiment_functions - INFO - Early stopping at epoch 1100. Best Metrics: (0.04399205683487883, 0.00555797441221783, 0.02244447479156804)
2026-06-05 17:32:10,444 - optuna.study.study - INFO - Trial 179 finished with values: [0.04399205683487883, 0.00555797441221783, 0.02244447479156804] and parameters: {'n_layers': 3, 'embedding_dim': 64, 'lr': 0.0008576367655519577, 'lambda_val': 0.0023604176548426264, 'batch_size': 3207, 'optimizer': 'Adam'}.
2026-06-05 17:36:04,493 - optuna.study.study - INFO - Trial 180 finished with values: [0.045244004195223085, 0.006103891754303704, 0.024853348866480728] and parameters: {'n_layers': 4, 'embedding_dim': 256, 'lr': 0.00017225906647401988, 'lambda_val': 0.00033127211998733373, 'batch_size': 2030, 'optimizer': 'RMSprop'}.
2026-06-05 17:38:42,552 - optuna.study.study - INFO - Trial 181 finished with values: [0.05370096742102821, 0.006663205840980641, 0.02599258636654083] and parameters: {'n_layers': 3, 'embedding_dim': 32, 'lr': 0.0007908861785647595, 'lambda_val': 0.00020574260712132375, 'batch_size': 3475, 'optimizer': 'Adam'}.
2026-06-05 17:42:03,811 - optuna.study.study - INFO - Trial 182 finished with values: [0.08643478274731703, 0.010633666019157344, 0.0468137406177037] and parameters: {'n_layers': 2, 'embedding_dim': 256, 'lr': 0.0004666871232718281, 'lambda_val': 7.487535492065269e-05, 'batch_size': 2271, 'optimizer': 'RMSprop'}.
2026-06-05 17:44:41,342 - optuna.study.study - INFO - Trial 183 finished with values: [0.072273806880286, 0.008754772590260565, 0.03725453366464241] and parameters: {'n_layers': 2, 'embedding_dim': 32, 'lr': 0.0007908861785647595, 'lambda_val': 0.00011375426873786574, 'batch_size': 2947, 'optimizer': 'Adam'}.
2026-06-05 17:47:16,144 - optuna.study.study - INFO - Trial 184 finished with values: [0.06464919325924993, 0.008166990421327618, 0.03646427636074072] and parameters: {'n_layers': 2, 'embedding_dim': 32, 'lr': 0.0008576367655519577, 'lambda_val': 0.00011375426873786574, 'batch_size': 926, 'optimizer': 'RMSprop'}.
2026-06-05 17:48:15,697 - experiment_functions - INFO - Early stopping at epoch 1400. Best Metrics: (0.06638242921724437, 0.008126800187554425, 0.033830767684242986)
2026-06-05 17:48:15,967 - optuna.study.study - INFO - Trial 185 finished with values: [0.06638242921724437, 0.008126800187554425, 0.033830767684242986] and parameters: {'n_layers': 2, 'embedding_dim': 96, 'lr': 0.0009590496257981318, 'lambda_val': 0.0011986625901797602, 'batch_size': 1769, 'optimizer': 'RMSprop'}.
2026-06-05 17:52:08,937 - optuna.study.study - INFO - Trial 186 finished with values: [0.049014141163926335, 0.006489048161296806, 0.02659428476023516] and parameters: {'n_layers': 4, 'embedding_dim': 256, 'lr': 0.00017225906647401988, 'lambda_val': 0.00011375426873786574, 'batch_size': 2848, 'optimizer': 'RMSprop'}.
2026-06-05 17:53:11,041 - experiment_functions - INFO - Early stopping at epoch 1600. Best Metrics: (0.05282578056172883, 0.00670004688860607, 0.02574827550825126)
2026-06-05 17:53:11,146 - optuna.study.study - INFO - Trial 187 finished with values: [0.05282578056172883, 0.00670004688860607, 0.02574827550825126] and parameters: {'n_layers': 1, 'embedding_dim': 64, 'lr': 0.0010470286775611781, 'lambda_val': 0.021886493172504122, 'batch_size': 3339, 'optimizer': 'Adam'}.
2026-06-05 17:55:46,659 - optuna.study.study - INFO - Trial 188 finished with values: [0.04931363489851093, 0.007127068122446246, 0.027893472295383078] and parameters: {'n_layers': 1, 'embedding_dim': 96, 'lr': 0.0007730079936260513, 'lambda_val': 0.005288720124154074, 'batch_size': 908, 'optimizer': 'RMSprop'}.
2026-06-05 17:58:23,378 - optuna.study.study - INFO - Trial 189 finished with values: [0.07853762753706409, 0.009463125460513096, 0.04121273092463104] and parameters: {'n_layers': 2, 'embedding_dim': 32, 'lr': 0.0008576367655519577, 'lambda_val': 3.082500502951572e-05, 'batch_size': 2455, 'optimizer': 'Adam'}.
2026-06-05 18:00:56,123 - experiment_functions - INFO - Early stopping at epoch 3550. Best Metrics: (0.05636266201180587, 0.007090227074820818, 0.02835232942327711)
2026-06-05 18:00:56,208 - optuna.study.study - INFO - Trial 190 finished with values: [0.05636266201180587, 0.007090227074820818, 0.02835232942327711] and parameters: {'n_layers': 3, 'embedding_dim': 96, 'lr': 0.00035382245097748176, 'lambda_val': 0.0023604176548426264, 'batch_size': 2504, 'optimizer': 'RMSprop'}.
2026-06-05 18:01:47,550 - experiment_functions - INFO - Early stopping at epoch 1200. Best Metrics: (0.05066420003543132, 0.0061390582088552475, 0.024551058569726763)
2026-06-05 18:01:47,854 - optuna.study.study - INFO - Trial 191 finished with values: [0.05066420003543132, 0.0061390582088552475, 0.024551058569726763] and parameters: {'n_layers': 3, 'embedding_dim': 64, 'lr': 0.001414374009860838, 'lambda_val': 0.00011375426873786574, 'batch_size': 1280, 'optimizer': 'RMSprop'}.
2026-06-05 18:04:20,373 - optuna.study.study - INFO - Trial 192 finished with values: [0.003183799910766313, 0.0005710362381941189, 0.001807819779914927] and parameters: {'n_layers': 1, 'embedding_dim': 96, 'lr': 0.00029609176700534276, 'lambda_val': 3.732019937312388e-06, 'batch_size': 1760, 'optimizer': 'RMSprop'}.
2026-06-05 18:05:17,393 - experiment_functions - INFO - Early stopping at epoch 1150. Best Metrics: (0.0455640602870465, 0.005578069529104428, 0.022229824739773973)
2026-06-05 18:05:17,477 - optuna.study.study - INFO - Trial 193 finished with values: [0.0455640602870465, 0.005578069529104428, 0.022229824739773973] and parameters: {'n_layers': 4, 'embedding_dim': 128, 'lr': 0.0007908861785647595, 'lambda_val': 2.3088888260231913e-06, 'batch_size': 2947, 'optimizer': 'RMSprop'}.
2026-06-05 18:08:08,079 - optuna.study.study - INFO - Trial 194 finished with values: [0.020524522206829623, 0.003263781900998058, 0.011991908340664733] and parameters: {'n_layers': 3, 'embedding_dim': 96, 'lr': 0.00022736433347294907, 'lambda_val': 0.00033127211998733373, 'batch_size': 1280, 'optimizer': 'Adam'}.
2026-06-05 18:08:48,461 - experiment_functions - INFO - Early stopping at epoch 1000. Best Metrics: (0.042534011426867364, 0.004965168464063234, 0.019801999184639266)
2026-06-05 18:08:48,558 - optuna.study.study - INFO - Trial 195 finished with values: [0.042534011426867364, 0.004965168464063234, 0.019801999184639266] and parameters: {'n_layers': 2, 'embedding_dim': 32, 'lr': 0.004586159400047152, 'lambda_val': 2.2392691089871585e-06, 'batch_size': 3477, 'optimizer': 'RMSprop'}.
2026-06-05 18:09:42,729 - experiment_functions - INFO - Early stopping at epoch 950. Best Metrics: (0.06075398915480084, 0.007287829057539019, 0.029748554446253284)
2026-06-05 18:09:43,304 - optuna.study.study - INFO - Trial 196 finished with values: [0.06075398915480084, 0.007287829057539019, 0.029748554446253284] and parameters: {'n_layers': 3, 'embedding_dim': 256, 'lr': 0.0008576367655519577, 'lambda_val': 0.00011375426873786574, 'batch_size': 2848, 'optimizer': 'RMSprop'}.
2026-06-05 18:10:26,565 - experiment_functions - INFO - Early stopping at epoch 1000. Best Metrics: (0.056590517879087227, 0.006952910442762409, 0.028459308767211224)
2026-06-05 18:10:26,633 - optuna.study.study - INFO - Trial 197 finished with values: [0.056590517879087227, 0.006952910442762409, 0.028459308767211224] and parameters: {'n_layers': 3, 'embedding_dim': 64, 'lr': 0.001414374009860838, 'lambda_val': 0.00033127211998733373, 'batch_size': 1280, 'optimizer': 'Adam'}.
2026-06-05 18:10:49,276 - experiment_functions - INFO - Early stopping at epoch 500. Best Metrics: (0.0003643757063436727, 6.530912988143882e-05, 0.0001704942788834032)
2026-06-05 18:10:49,362 - optuna.study.study - INFO - Trial 198 finished with values: [0.0003643757063436727, 6.530912988143882e-05, 0.0001704942788834032] and parameters: {'n_layers': 4, 'embedding_dim': 64, 'lr': 1.922429228519961e-05, 'lambda_val': 0.021629372578415795, 'batch_size': 1280, 'optimizer': 'RMSprop'}.
2026-06-05 18:11:28,517 - experiment_functions - INFO - Early stopping at epoch 950. Best Metrics: (0.026556845796069147, 0.003242012191037578, 0.011942403373416816)
2026-06-05 18:11:29,021 - optuna.study.study - INFO - Trial 199 finished with values: [0.026556845796069147, 0.003242012191037578, 0.011942403373416816] and parameters: {'n_layers': 1, 'embedding_dim': 96, 'lr': 0.014532470922762476, 'lambda_val': 0.005288720124154074, 'batch_size': 4028, 'optimizer': 'RMSprop'}.
2026-06-05 18:14:13,162 - experiment_functions - INFO - Early stopping at epoch 3850. Best Metrics: (0.082844773049291, 0.01008105030477594, 0.04308873568539512)
2026-06-05 18:14:13,250 - optuna.study.study - INFO - Trial 200 finished with values: [0.082844773049291, 0.01008105030477594, 0.04308873568539512] and parameters: {'n_layers': 2, 'embedding_dim': 96, 'lr': 0.0007730079936260513, 'lambda_val': 2.8670388049392515e-06, 'batch_size': 2271, 'optimizer': 'RMSprop'}.
2026-06-05 18:16:56,374 - optuna.study.study - INFO - Trial 201 finished with values: [0.08806469078157789, 0.011127670975952844, 0.047961856686398546] and parameters: {'n_layers': 1, 'embedding_dim': 96, 'lr': 0.0009590496257981318, 'lambda_val': 2.8670388049392515e-06, 'batch_size': 2271, 'optimizer': 'RMSprop'}.
2026-06-05 18:19:34,398 - optuna.study.study - INFO - Trial 202 finished with values: [0.05061448416441024, 0.007113671377855182, 0.029464092906227965] and parameters: {'n_layers': 1, 'embedding_dim': 96, 'lr': 0.0007730079936260513, 'lambda_val': 2.8670388049392515e-06, 'batch_size': 915, 'optimizer': 'RMSprop'}.
