2026-06-06 20:30:46,010 - optuna.study.study - INFO - Trial 272 finished with values: [0.07541879069428742, 0.009310737490789738, 0.039529594774580276] and parameters: {'n_layers': 3, 'embedding_dim': 256, 'lr': 0.0004543711173429324, 'lambda_val': 7.650473592526119e-05, 'batch_size': 1717, 'optimizer': 'Adam'}.
2026-06-06 20:31:37,472 - experiment_functions - INFO - Early stopping at epoch 850. Best Metrics: (0.056353303866817736, 0.006666555027128408, 0.026496046363571384)
2026-06-06 20:31:37,853 - optuna.study.study - INFO - Trial 273 finished with values: [0.056353303866817736, 0.006666555027128408, 0.026496046363571384] and parameters: {'n_layers': 2, 'embedding_dim': 256, 'lr': 0.0016310133844241697, 'lambda_val': 0.0005031918520424605, 'batch_size': 2277, 'optimizer': 'RMSprop'}.
2026-06-06 20:32:54,383 - experiment_functions - INFO - Early stopping at epoch 1350. Best Metrics: (0.07830432457006693, 0.009473173018956395, 0.03972642779061805)
2026-06-06 20:32:56,223 - optuna.study.study - INFO - Trial 274 finished with values: [0.07830432457006693, 0.009473173018956395, 0.03972642779061805] and parameters: {'n_layers': 2, 'embedding_dim': 256, 'lr': 0.0007970006502074318, 'lambda_val': 0.0002757363874074985, 'batch_size': 2440, 'optimizer': 'RMSprop'}.
2026-06-06 20:34:38,275 - experiment_functions - INFO - Early stopping at epoch 2150. Best Metrics: (0.0005885495188194633, 9.37772121374506e-05, 0.0002670133934602823)
2026-06-06 20:34:39,992 - optuna.study.study - INFO - Trial 275 finished with values: [0.0005885495188194633, 9.37772121374506e-05, 0.0002670133934602823] and parameters: {'n_layers': 3, 'embedding_dim': 128, 'lr': 1.3485900757814502e-05, 'lambda_val': 3.3494997586996853e-06, 'batch_size': 2624, 'optimizer': 'RMSprop'}.
2026-06-06 20:37:43,843 - optuna.study.study - INFO - Trial 276 finished with values: [0.07273098584656262, 0.009352602317636814, 0.039916548785404106] and parameters: {'n_layers': 2, 'embedding_dim': 128, 'lr': 0.0005151812249168082, 'lambda_val': 3.3494997586996853e-06, 'batch_size': 1760, 'optimizer': 'Adam'}.
2026-06-06 20:40:40,097 - optuna.study.study - INFO - Trial 277 finished with values: [0.09286007414049123, 0.011598231629713981, 0.05019643249226361] and parameters: {'n_layers': 1, 'embedding_dim': 128, 'lr': 0.0007970006502074318, 'lambda_val': 1.4780082520235353e-05, 'batch_size': 3622, 'optimizer': 'RMSprop'}.
2026-06-06 20:41:34,879 - experiment_functions - INFO - Early stopping at epoch 950. Best Metrics: (0.06498023988171497, 0.007637819009980576, 0.033011882397385846)
2026-06-06 20:41:36,347 - optuna.study.study - INFO - Trial 278 finished with values: [0.06498023988171497, 0.007637819009980576, 0.033011882397385846] and parameters: {'n_layers': 2, 'embedding_dim': 128, 'lr': 0.0016310133844241697, 'lambda_val': 1.4780082520235353e-05, 'batch_size': 3074, 'optimizer': 'RMSprop'}.
2026-06-06 20:42:07,033 - experiment_functions - INFO - Early stopping at epoch 500. Best Metrics: (0.0005930541102631961, 9.210261906356757e-05, 0.00026789083082592565)
2026-06-06 20:42:08,396 - optuna.study.study - INFO - Trial 279 finished with values: [0.0005930541102631961, 9.210261906356757e-05, 0.00026789083082592565] and parameters: {'n_layers': 3, 'embedding_dim': 128, 'lr': 0.0004543711173429324, 'lambda_val': 0.002811009892367939, 'batch_size': 1031, 'optimizer': 'SGD'}.
2026-06-06 20:45:21,568 - optuna.study.study - INFO - Trial 280 finished with values: [0.09076337813424042, 0.011437470694621208, 0.04850992970134192] and parameters: {'n_layers': 1, 'embedding_dim': 256, 'lr': 0.0007970006502074318, 'lambda_val': 1.4780082520235353e-05, 'batch_size': 3074, 'optimizer': 'Adam'}.
2026-06-06 20:45:56,551 - experiment_functions - INFO - Early stopping at epoch 500. Best Metrics: (0.0005687090848915643, 7.870587447250318e-05, 0.0002576733366407376)
2026-06-06 20:45:58,691 - optuna.study.study - INFO - Trial 281 finished with values: [0.0005687090848915643, 7.870587447250318e-05, 0.0002576733366407376] and parameters: {'n_layers': 3, 'embedding_dim': 256, 'lr': 0.0005151812249168082, 'lambda_val': 0.0004257798995801158, 'batch_size': 2440, 'optimizer': 'SGD'}.
2026-06-06 20:46:37,950 - experiment_functions - INFO - Early stopping at epoch 700. Best Metrics: (0.06868060913555882, 0.008511956594547523, 0.035485350383478484)
2026-06-06 20:46:38,900 - optuna.study.study - INFO - Trial 282 finished with values: [0.06868060913555882, 0.008511956594547523, 0.035485350383478484] and parameters: {'n_layers': 2, 'embedding_dim': 128, 'lr': 0.0030460565528740375, 'lambda_val': 3.4875481690343986e-06, 'batch_size': 2277, 'optimizer': 'Adam'}.
2026-06-06 20:49:21,483 - optuna.study.study - INFO - Trial 283 finished with values: [0.04737841867793096, 0.006239533793288231, 0.022549868478715047] and parameters: {'n_layers': 1, 'embedding_dim': 64, 'lr': 0.0007970006502074318, 'lambda_val': 0.02741487560666379, 'batch_size': 3074, 'optimizer': 'Adam'}.
2026-06-06 20:52:10,154 - optuna.study.study - INFO - Trial 284 finished with values: [0.07408236201145173, 0.009695893897782838, 0.0409053427851209] and parameters: {'n_layers': 1, 'embedding_dim': 96, 'lr': 0.0007970006502074318, 'lambda_val': 0.0005031918520424605, 'batch_size': 2277, 'optimizer': 'Adam'}.
2026-06-06 20:55:00,841 - optuna.study.study - INFO - Trial 285 finished with values: [0.0746242877795768, 0.00944805412284815, 0.03942015394205343] and parameters: {'n_layers': 2, 'embedding_dim': 64, 'lr': 0.0005151812249168082, 'lambda_val': 1.4780082520235353e-05, 'batch_size': 3074, 'optimizer': 'Adam'}.
2026-06-06 20:57:54,811 - optuna.study.study - INFO - Trial 286 finished with values: [0.08529708253054769, 0.010792752361176234, 0.046393448899238] and parameters: {'n_layers': 1, 'embedding_dim': 128, 'lr': 0.0007970006502074318, 'lambda_val': 0.0002757363874074985, 'batch_size': 3074, 'optimizer': 'Adam'}.
2026-06-06 20:59:24,989 - experiment_functions - INFO - Early stopping at epoch 1650. Best Metrics: (0.08378273698002082, 0.009993971464934023, 0.04327584101631843)
2026-06-06 20:59:25,894 - optuna.study.study - INFO - Trial 287 finished with values: [0.08378273698002082, 0.009993971464934023, 0.04327584101631843] and parameters: {'n_layers': 2, 'embedding_dim': 256, 'lr': 0.0007970006502074318, 'lambda_val': 3.3494997586996853e-06, 'batch_size': 3074, 'optimizer': 'RMSprop'}.
2026-06-06 21:02:27,873 - optuna.study.study - INFO - Trial 288 finished with values: [0.07119959130856816, 0.008776542300221046, 0.03640361627911091] and parameters: {'n_layers': 3, 'embedding_dim': 96, 'lr': 0.0005151812249168082, 'lambda_val': 7.3425109472929e-05, 'batch_size': 2619, 'optimizer': 'Adam'}.
2026-06-06 21:05:38,761 - optuna.study.study - INFO - Trial 289 finished with values: [0.08932077791128475, 0.011343693482483758, 0.04876785715490014] and parameters: {'n_layers': 1, 'embedding_dim': 256, 'lr': 0.0007970006502074318, 'lambda_val': 1.4780082520235353e-05, 'batch_size': 3074, 'optimizer': 'Adam'}.
2026-06-06 21:08:34,671 - optuna.study.study - INFO - Trial 290 finished with values: [0.08197404418194015, 0.009985598499564605, 0.0433431570998985] and parameters: {'n_layers': 2, 'embedding_dim': 96, 'lr': 0.0006507771018879831, 'lambda_val': 1.3752217901425446e-05, 'batch_size': 1985, 'optimizer': 'RMSprop'}.
2026-06-06 21:09:52,154 - experiment_functions - INFO - Early stopping at epoch 1250. Best Metrics: (0.06481800696947905, 0.007974412217831068, 0.03187984700046005)
2026-06-06 21:09:52,810 - optuna.study.study - INFO - Trial 291 finished with values: [0.06481800696947905, 0.007974412217831068, 0.03187984700046005] and parameters: {'n_layers': 3, 'embedding_dim': 256, 'lr': 0.0007970006502074318, 'lambda_val': 0.0004257798995801158, 'batch_size': 2277, 'optimizer': 'Adam'}.
2026-06-06 21:13:05,256 - optuna.study.study - INFO - Trial 292 finished with values: [0.09135608560553372, 0.011333645924040459, 0.04838537210383252] and parameters: {'n_layers': 1, 'embedding_dim': 256, 'lr': 0.0007970006502074318, 'lambda_val': 3.3494997586996853e-06, 'batch_size': 3074, 'optimizer': 'Adam'}.
2026-06-06 21:15:55,616 - optuna.study.study - INFO - Trial 293 finished with values: [0.07408236201145173, 0.009695893897782838, 0.0409053427851209] and parameters: {'n_layers': 1, 'embedding_dim': 96, 'lr': 0.0007970006502074318, 'lambda_val': 0.0005031918520424605, 'batch_size': 2277, 'optimizer': 'Adam'}.
2026-06-06 21:16:42,362 - experiment_functions - INFO - Early stopping at epoch 900. Best Metrics: (0.06768810640881216, 0.008453345836961617, 0.03497520060105774)
2026-06-06 21:16:43,813 - optuna.study.study - INFO - Trial 294 finished with values: [0.06768810640881216, 0.008453345836961617, 0.03497520060105774] and parameters: {'n_layers': 2, 'embedding_dim': 96, 'lr': 0.0019878431480735456, 'lambda_val': 0.0005031918520424605, 'batch_size': 1502, 'optimizer': 'Adam'}.
2026-06-06 21:20:13,587 - optuna.study.study - INFO - Trial 295 finished with values: [0.08370537778026006, 0.010446111594882445, 0.04411615479537003] and parameters: {'n_layers': 2, 'embedding_dim': 256, 'lr': 0.0005151812249168082, 'lambda_val': 0.0002757363874074985, 'batch_size': 2440, 'optimizer': 'Adam'}.
2026-06-06 21:23:06,910 - optuna.study.study - INFO - Trial 296 finished with values: [0.08404578277328377, 0.010660459508339474, 0.04718245078070242] and parameters: {'n_layers': 1, 'embedding_dim': 128, 'lr': 0.0007970006502074318, 'lambda_val': 0.0002757363874074985, 'batch_size': 2259, 'optimizer': 'RMSprop'}.
2026-06-06 21:25:47,734 - optuna.study.study - INFO - Trial 297 finished with values: [0.06714729685958643, 0.008885390850023444, 0.03780446529250268] and parameters: {'n_layers': 1, 'embedding_dim': 32, 'lr': 0.0007970006502074318, 'lambda_val': 6.095558663530395e-06, 'batch_size': 3521, 'optimizer': 'RMSprop'}.
2026-06-06 21:28:34,280 - optuna.study.study - INFO - Trial 298 finished with values: [0.05698858293419318, 0.007607676334650681, 0.03179469745921603] and parameters: {'n_layers': 2, 'embedding_dim': 64, 'lr': 0.0005151812249168082, 'lambda_val': 3.3494997586996853e-06, 'batch_size': 1074, 'optimizer': 'RMSprop'}.
2026-06-06 21:31:09,315 - experiment_functions - INFO - Early stopping at epoch 2900. Best Metrics: (0.08748137734750769, 0.010573380668497554, 0.04576792232295973)
2026-06-06 21:31:10,297 - optuna.study.study - INFO - Trial 299 finished with values: [0.08748137734750769, 0.010573380668497554, 0.04576792232295973] and parameters: {'n_layers': 2, 'embedding_dim': 256, 'lr': 0.0007970006502074318, 'lambda_val': 1.4780082520235353e-05, 'batch_size': 2259, 'optimizer': 'Adam'}.
2026-06-06 21:31:10,312 - root - INFO - Selected Trial 160 based on Max ndcg: 0.0518
2026-06-06 21:31:10,312 - root - INFO - Associated Recall: 0.0963
2026-06-06 21:31:10,312 - experiment_functions - INFO - Training the best model ... for e_gowalla_1c1dcs_rand5
2026-06-06 21:34:15,610 - root - INFO - **** Training e_gowalla_1c2dcs
2026-06-06 21:34:15,610 - root - INFO -   ** 2-Dominant stats:
2026-06-06 21:34:15,610 - root - INFO -   ** Finding the dominant set:
2026-06-07 00:22:38,993 - root - INFO -   ** Getting the trainable edges:
2026-06-07 00:22:39,018 - helper_functions - INFO -      Number of nodes: 13550
2026-06-07 00:22:39,018 - helper_functions - INFO -      Ratio: 0.19127881534183147
2026-06-07 00:22:39,018 - helper_functions - INFO -      Number of unique users: 3483
2026-06-07 00:22:39,018 - helper_functions - INFO -      Number of unique items: 10067
2026-06-07 00:22:39,018 - helper_functions - INFO -      Total dominant set edge: 115753
2026-06-07 00:22:39,018 - helper_functions - INFO -      Trainable edges: 92602.40000000001
2026-06-07 00:22:39,049 - root - INFO -   **** Getting 115753 dominant set edges
2026-06-07 00:22:39,191 - optuna.storages._rdb.storage - INFO - A new study created in RDB with name: Study_e_gowalla_1c2dcs_strict
2026-06-07 00:24:04,236 - experiment_functions - INFO - Early stopping at epoch 2150. Best Metrics: (0.004198311426122916, 0.0011320249179449396, 0.002634075757083441)
2026-06-07 00:24:04,713 - optuna.study.study - INFO - Trial 0 finished with values: [0.004198311426122916, 0.0011320249179449396, 0.002634075757083441] and parameters: {'n_layers': 3, 'embedding_dim': 96, 'lr': 0.00023240333325049055, 'lambda_val': 0.0054314837121898114, 'batch_size': 1114, 'optimizer': 'RMSprop'}.
2026-06-07 00:24:30,864 - experiment_functions - INFO - Early stopping at epoch 500. Best Metrics: (0.0003458593881620611, 6.363453680755577e-05, 0.00016029896497991638)
2026-06-07 00:24:30,982 - optuna.study.study - INFO - Trial 1 finished with values: [0.0003458593881620611, 6.363453680755577e-05, 0.00016029896497991638] and parameters: {'n_layers': 4, 'embedding_dim': 256, 'lr': 0.0028601707884396113, 'lambda_val': 0.004919335424382364, 'batch_size': 3491, 'optimizer': 'SGD'}.
2026-06-07 00:24:52,236 - experiment_functions - INFO - Early stopping at epoch 500. Best Metrics: (0.0005583271503124291, 0.00012894366668899458, 0.0003132981888275591)
2026-06-07 00:24:53,379 - optuna.study.study - INFO - Trial 2 finished with values: [0.0005583271503124291, 0.00012894366668899458, 0.0003132981888275591] and parameters: {'n_layers': 2, 'embedding_dim': 96, 'lr': 0.08127511440699393, 'lambda_val': 0.05705568348429461, 'batch_size': 2165, 'optimizer': 'Adam'}.
2026-06-07 00:25:14,991 - experiment_functions - INFO - Early stopping at epoch 500. Best Metrics: (0.0003468595940825845, 7.200750217697099e-05, 0.00016729454623984764)
2026-06-07 00:25:15,191 - optuna.study.study - INFO - Trial 3 finished with values: [0.0003468595940825845, 7.200750217697099e-05, 0.00016729454623984764] and parameters: {'n_layers': 3, 'embedding_dim': 96, 'lr': 0.08615035682204321, 'lambda_val': 1.6586068017839052e-06, 'batch_size': 616, 'optimizer': 'SGD'}.
2026-06-07 00:25:46,737 - experiment_functions - INFO - Early stopping at epoch 750. Best Metrics: (0.0036646258180112663, 0.0010298747404380736, 0.0023406510144797004)
2026-06-07 00:25:46,849 - optuna.study.study - INFO - Trial 4 finished with values: [0.0036646258180112663, 0.0010298747404380736, 0.0023406510144797004] and parameters: {'n_layers': 3, 'embedding_dim': 96, 'lr': 0.0009061044953077022, 'lambda_val': 0.0020784089442329704, 'batch_size': 1018, 'optimizer': 'Adam'}.
2026-06-07 00:26:09,033 - experiment_functions - INFO - Early stopping at epoch 500. Best Metrics: (0.0005981595129507085, 8.875343291580146e-05, 0.0002762751578181101)
2026-06-07 00:26:09,182 - optuna.study.study - INFO - Trial 5 finished with values: [0.0005981595129507085, 8.875343291580146e-05, 0.0002762751578181101] and parameters: {'n_layers': 4, 'embedding_dim': 96, 'lr': 0.07934375271979709, 'lambda_val': 0.00032182782479893825, 'batch_size': 4054, 'optimizer': 'SGD'}.
2026-06-07 00:28:34,334 - optuna.study.study - INFO - Trial 6 finished with values: [0.001958625608913549, 0.0005308460044209257, 0.001298117486252977] and parameters: {'n_layers': 1, 'embedding_dim': 64, 'lr': 0.00014499293030895963, 'lambda_val': 1.8308617620896738e-06, 'batch_size': 1919, 'optimizer': 'Adam'}.
2026-06-07 00:29:00,563 - experiment_functions - INFO - Early stopping at epoch 500. Best Metrics: (0.00042664666944227877, 8.372965369415233e-05, 0.00019019268143059234)
2026-06-07 00:29:00,940 - optuna.study.study - INFO - Trial 7 finished with values: [0.00042664666944227877, 8.372965369415233e-05, 0.00019019268143059234] and parameters: {'n_layers': 4, 'embedding_dim': 256, 'lr': 0.001074276432881832, 'lambda_val': 1.9819161131689373e-06, 'batch_size': 1583, 'optimizer': 'SGD'}.
2026-06-07 00:29:23,058 - experiment_functions - INFO - Early stopping at epoch 550. Best Metrics: (0.0015884744210968285, 0.0003449661732199076, 0.000858678601639977)
2026-06-07 00:29:23,183 - optuna.study.study - INFO - Trial 8 finished with values: [0.0015884744210968285, 0.0003449661732199076, 0.000858678601639977] and parameters: {'n_layers': 2, 'embedding_dim': 32, 'lr': 0.005734193950506802, 'lambda_val': 0.06115046684270653, 'batch_size': 3157, 'optimizer': 'Adam'}.
2026-06-07 00:31:26,396 - experiment_functions - INFO - Early stopping at epoch 3000. Best Metrics: (0.0050952549781634274, 0.001435126264317771, 0.003383832767842441)
2026-06-07 00:31:26,500 - optuna.study.study - INFO - Trial 9 finished with values: [0.0050952549781634274, 0.001435126264317771, 0.003383832767842441] and parameters: {'n_layers': 3, 'embedding_dim': 128, 'lr': 0.00041076267416475083, 'lambda_val': 0.00017376720983994695, 'batch_size': 1392, 'optimizer': 'Adam'}.
2026-06-07 00:31:55,579 - experiment_functions - INFO - Early stopping at epoch 700. Best Metrics: (0.003117251938542633, 0.0007267733940652422, 0.0019139180164020233)
2026-06-07 00:31:55,865 - optuna.study.study - INFO - Trial 10 finished with values: [0.003117251938542633, 0.0007267733940652422, 0.0019139180164020233] and parameters: {'n_layers': 4, 'embedding_dim': 64, 'lr': 0.0011078514946922563, 'lambda_val': 1.058365552996417e-06, 'batch_size': 2883, 'optimizer': 'Adam'}.
2026-06-07 00:32:16,195 - experiment_functions - INFO - Early stopping at epoch 500. Best Metrics: (0.0005338095240060565, 8.540424676803537e-05, 0.00025471493675477473)
2026-06-07 00:32:17,333 - optuna.study.study - INFO - Trial 11 finished with values: [0.0005338095240060565, 8.540424676803537e-05, 0.00025471493675477473] and parameters: {'n_layers': 3, 'embedding_dim': 32, 'lr': 3.975166372643812e-05, 'lambda_val': 0.08295526263282023, 'batch_size': 1528, 'optimizer': 'Adam'}.
2026-06-07 00:34:47,321 - optuna.study.study - INFO - Trial 12 finished with values: [0.0006264076213018842, 0.00010047558443298278, 0.0002738940833667313] and parameters: {'n_layers': 1, 'embedding_dim': 128, 'lr': 7.837501487508114e-05, 'lambda_val': 0.0032418777714283737, 'batch_size': 1250, 'optimizer': 'RMSprop'}.
2026-06-07 00:35:14,988 - experiment_functions - INFO - Early stopping at epoch 550. Best Metrics: (0.0004636002846828777, 7.53566883247371e-05, 0.00017621588338078995)
2026-06-07 00:35:15,089 - optuna.study.study - INFO - Trial 13 finished with values: [0.0004636002846828777, 7.53566883247371e-05, 0.00017621588338078995] and parameters: {'n_layers': 3, 'embedding_dim': 256, 'lr': 1.027779632166135e-05, 'lambda_val': 7.464014570775675e-05, 'batch_size': 3480, 'optimizer': 'RMSprop'}.
2026-06-07 00:35:37,312 - experiment_functions - INFO - Early stopping at epoch 550. Best Metrics: (0.0026371906811868454, 0.0008389711300154064, 0.001758023610727364)
2026-06-07 00:35:37,555 - optuna.study.study - INFO - Trial 14 finished with values: [0.0026371906811868454, 0.0008389711300154064, 0.001758023610727364] and parameters: {'n_layers': 3, 'embedding_dim': 32, 'lr': 0.0396840294610648, 'lambda_val': 4.657433916769204e-06, 'batch_size': 2374, 'optimizer': 'RMSprop'}.
2026-06-07 00:35:59,673 - experiment_functions - INFO - Early stopping at epoch 500. Best Metrics: (0.00046291726474726233, 6.698372295532186e-05, 0.00019152746034831314)
2026-06-07 00:35:59,811 - optuna.study.study - INFO - Trial 15 finished with values: [0.00046291726474726233, 6.698372295532186e-05, 0.00019152746034831314] and parameters: {'n_layers': 4, 'embedding_dim': 96, 'lr': 0.006798901861131576, 'lambda_val': 0.00035088590161409057, 'batch_size': 2937, 'optimizer': 'SGD'}.
2026-06-07 00:36:22,181 - experiment_functions - INFO - Early stopping at epoch 550. Best Metrics: (0.00229349899229338, 0.0006932815325875812, 0.001426799748829296)
2026-06-07 00:36:22,294 - optuna.study.study - INFO - Trial 16 finished with values: [0.00229349899229338, 0.0006932815325875812, 0.001426799748829296] and parameters: {'n_layers': 3, 'embedding_dim': 32, 'lr': 0.038293069654092404, 'lambda_val': 0.00011034066715781793, 'batch_size': 1452, 'optimizer': 'RMSprop'}.
2026-06-07 00:36:43,239 - experiment_functions - INFO - Early stopping at epoch 500. Best Metrics: (0.0005121041767078878, 7.703128139862015e-05, 0.00026732377716612467)
2026-06-07 00:36:43,355 - optuna.study.study - INFO - Trial 17 finished with values: [0.0005121041767078878, 7.703128139862015e-05, 0.00026732377716612467] and parameters: {'n_layers': 2, 'embedding_dim': 96, 'lr': 0.02548268482877469, 'lambda_val': 4.884448670891485e-05, 'batch_size': 1432, 'optimizer': 'SGD'}.
2026-06-07 00:37:03,710 - experiment_functions - INFO - Early stopping at epoch 500. Best Metrics: (0.000399020047526396, 7.200750217697099e-05, 0.00017352324340573326)
2026-06-07 00:37:04,909 - optuna.study.study - INFO - Trial 18 finished with values: [0.000399020047526396, 7.200750217697099e-05, 0.00017352324340573326] and parameters: {'n_layers': 1, 'embedding_dim': 64, 'lr': 0.0066205026868837715, 'lambda_val': 0.0003700273963016921, 'batch_size': 3810, 'optimizer': 'SGD'}.
2026-06-07 00:37:27,566 - experiment_functions - INFO - Early stopping at epoch 500. Best Metrics: (0.0005737429399978107, 8.038046754638624e-05, 0.0002278315281422469)
2026-06-07 00:37:27,685 - optuna.study.study - INFO - Trial 19 finished with values: [0.0005737429399978107, 8.038046754638624e-05, 0.0002278315281422469] and parameters: {'n_layers': 4, 'embedding_dim': 96, 'lr': 5.2128114700918054e-05, 'lambda_val': 0.043100315866532915, 'batch_size': 3680, 'optimizer': 'Adam'}.
2026-06-07 00:37:53,748 - experiment_functions - INFO - Early stopping at epoch 650. Best Metrics: (0.0038609774151757916, 0.0009126532252662603, 0.002194857339378331)
2026-06-07 00:37:54,347 - optuna.study.study - INFO - Trial 20 finished with values: [0.0038609774151757916, 0.0009126532252662603, 0.002194857339378331] and parameters: {'n_layers': 3, 'embedding_dim': 32, 'lr': 0.0013711723145044142, 'lambda_val': 4.991713043181534e-06, 'batch_size': 3294, 'optimizer': 'Adam'}.
2026-06-07 00:38:19,475 - experiment_functions - INFO - Early stopping at epoch 600. Best Metrics: (0.0006858452276948908, 8.875343291580147e-05, 0.00035223777829665855)
