2026-06-05 21:18:44,381 - optuna.study.study - INFO - Trial 7 finished with values: [0.027554854890423048, 0.0032302900395203967, 0.012605568651704526] and parameters: {'n_layers': 4, 'embedding_dim': 128, 'lr': 0.05987924207906121, 'lambda_val': 1.4551971153439733e-05, 'batch_size': 1499, 'optimizer': 'Adam'}.
2026-06-05 21:19:04,581 - experiment_functions - INFO - Early stopping at epoch 500. Best Metrics: (0.0005028387382895824, 7.368209525085403e-05, 0.000220733530321105)
2026-06-05 21:19:04,683 - optuna.study.study - INFO - Trial 8 finished with values: [0.0005028387382895824, 7.368209525085403e-05, 0.000220733530321105] and parameters: {'n_layers': 1, 'embedding_dim': 32, 'lr': 1.4696074406713668e-05, 'lambda_val': 0.09887708972635915, 'batch_size': 2335, 'optimizer': 'SGD'}.
2026-06-05 21:20:46,432 - experiment_functions - INFO - Early stopping at epoch 2400. Best Metrics: (0.023875625312379363, 0.002707817000468886, 0.010415144495847838)
2026-06-05 21:20:46,570 - optuna.study.study - INFO - Trial 9 finished with values: [0.023875625312379363, 0.002707817000468886, 0.010415144495847838] and parameters: {'n_layers': 4, 'embedding_dim': 64, 'lr': 0.039131791946535856, 'lambda_val': 0.001677222142016489, 'batch_size': 2697, 'optimizer': 'RMSprop'}.
2026-06-05 21:22:25,497 - experiment_functions - INFO - Early stopping at epoch 2450. Best Metrics: (0.04966815245681682, 0.006028535065978967, 0.02309077543226156)
2026-06-05 21:22:25,904 - optuna.study.study - INFO - Trial 10 finished with values: [0.04966815245681682, 0.006028535065978967, 0.02309077543226156] and parameters: {'n_layers': 4, 'embedding_dim': 32, 'lr': 0.0014400532960571737, 'lambda_val': 0.0002470779691093862, 'batch_size': 755, 'optimizer': 'Adam'}.
2026-06-05 21:23:04,705 - experiment_functions - INFO - Early stopping at epoch 850. Best Metrics: (0.04399253283951613, 0.005311809230357022, 0.019922320697641275)
2026-06-05 21:23:04,804 - optuna.study.study - INFO - Trial 11 finished with values: [0.04399253283951613, 0.005311809230357022, 0.019922320697641275] and parameters: {'n_layers': 2, 'embedding_dim': 128, 'lr': 0.0030777772444340735, 'lambda_val': 0.00191214395764258, 'batch_size': 899, 'optimizer': 'Adam'}.
2026-06-05 21:23:29,968 - experiment_functions - INFO - Early stopping at epoch 550. Best Metrics: (0.00040469017989576086, 6.530912988143882e-05, 0.00017160692612935936)
2026-06-05 21:23:30,977 - optuna.study.study - INFO - Trial 12 finished with values: [0.00040469017989576086, 6.530912988143882e-05, 0.00017160692612935936] and parameters: {'n_layers': 3, 'embedding_dim': 96, 'lr': 1.1457867781454342e-05, 'lambda_val': 0.003257794861177856, 'batch_size': 2731, 'optimizer': 'RMSprop'}.
2026-06-05 21:23:51,770 - experiment_functions - INFO - Early stopping at epoch 500. Best Metrics: (0.0007029322537812206, 8.707883984191842e-05, 0.0003568666856166825)
2026-06-05 21:23:51,858 - optuna.study.study - INFO - Trial 13 finished with values: [0.0007029322537812206, 8.707883984191842e-05, 0.0003568666856166825] and parameters: {'n_layers': 3, 'embedding_dim': 32, 'lr': 1.4842010598937153e-05, 'lambda_val': 0.014684902608016642, 'batch_size': 2189, 'optimizer': 'Adam'}.
2026-06-05 21:24:23,720 - experiment_functions - INFO - Early stopping at epoch 750. Best Metrics: (0.017487771428820142, 0.002170272623752428, 0.007722778614311028)
2026-06-05 21:24:23,791 - optuna.study.study - INFO - Trial 14 finished with values: [0.017487771428820142, 0.002170272623752428, 0.007722778614311028] and parameters: {'n_layers': 1, 'embedding_dim': 128, 'lr': 0.010355053602882436, 'lambda_val': 0.022494101952502732, 'batch_size': 568, 'optimizer': 'Adam'}.
2026-06-05 21:25:48,533 - experiment_functions - INFO - Early stopping at epoch 2050. Best Metrics: (0.08021797922867169, 0.009726036573112735, 0.041333494570589685)
2026-06-05 21:25:49,101 - optuna.study.study - INFO - Trial 15 finished with values: [0.08021797922867169, 0.009726036573112735, 0.041333494570589685] and parameters: {'n_layers': 1, 'embedding_dim': 96, 'lr': 0.0025949620955328543, 'lambda_val': 1.9645451789230886e-06, 'batch_size': 1890, 'optimizer': 'RMSprop'}.
2026-06-05 21:29:40,759 - optuna.study.study - INFO - Trial 16 finished with values: [0.02285679649591868, 0.0033810034161698707, 0.012375951222203656] and parameters: {'n_layers': 4, 'embedding_dim': 256, 'lr': 0.0001336135869313187, 'lambda_val': 5.314912869017192e-05, 'batch_size': 1487, 'optimizer': 'RMSprop'}.
2026-06-05 21:30:06,763 - experiment_functions - INFO - Early stopping at epoch 500. Best Metrics: (0.00044382500964815794, 7.703128139862013e-05, 0.0002197796640380241)
2026-06-05 21:30:06,846 - optuna.study.study - INFO - Trial 17 finished with values: [0.00044382500964815794, 7.703128139862013e-05, 0.0002197796640380241] and parameters: {'n_layers': 2, 'embedding_dim': 256, 'lr': 0.0020779339022834373, 'lambda_val': 1.5838623830328296e-05, 'batch_size': 3533, 'optimizer': 'SGD'}.
2026-06-05 21:30:27,566 - experiment_functions - INFO - Early stopping at epoch 500. Best Metrics: (0.00044827680586941086, 7.368209525085404e-05, 0.00021631214277796997)
2026-06-05 21:30:27,922 - optuna.study.study - INFO - Trial 18 finished with values: [0.00044827680586941086, 7.368209525085404e-05, 0.00021631214277796997] and parameters: {'n_layers': 1, 'embedding_dim': 64, 'lr': 4.094084758171102e-05, 'lambda_val': 0.01158638616997104, 'batch_size': 1176, 'optimizer': 'SGD'}.
2026-06-05 21:33:33,158 - optuna.study.study - INFO - Trial 19 finished with values: [0.003641730377434411, 0.0005810837966374172, 0.0018626853280638992] and parameters: {'n_layers': 4, 'embedding_dim': 128, 'lr': 8.333187350647212e-05, 'lambda_val': 6.711434296264996e-05, 'batch_size': 2327, 'optimizer': 'RMSprop'}.
2026-06-05 21:33:58,429 - experiment_functions - INFO - Early stopping at epoch 500. Best Metrics: (0.000567609889990268, 9.04280259896845e-05, 0.00029098618250777557)
2026-06-05 21:33:58,966 - optuna.study.study - INFO - Trial 20 finished with values: [0.000567609889990268, 9.04280259896845e-05, 0.00029098618250777557] and parameters: {'n_layers': 4, 'embedding_dim': 128, 'lr': 0.010182177532745558, 'lambda_val': 0.002864690755335586, 'batch_size': 2239, 'optimizer': 'SGD'}.
2026-06-05 21:37:04,971 - optuna.study.study - INFO - Trial 21 finished with values: [0.0013000667144355865, 0.00018587983120101818, 0.0005557942176146605] and parameters: {'n_layers': 4, 'embedding_dim': 128, 'lr': 9.4734286564571e-05, 'lambda_val': 0.0012039889610296177, 'batch_size': 986, 'optimizer': 'Adam'}.
2026-06-05 21:37:25,366 - experiment_functions - INFO - Early stopping at epoch 500. Best Metrics: (0.0005636712906595758, 7.87058744725032e-05, 0.0002156489094910275)
2026-06-05 21:37:25,458 - optuna.study.study - INFO - Trial 22 finished with values: [0.0005636712906595758, 7.87058744725032e-05, 0.0002156489094910275] and parameters: {'n_layers': 2, 'embedding_dim': 32, 'lr': 0.0003560968121061279, 'lambda_val': 0.016977944720440934, 'batch_size': 614, 'optimizer': 'SGD'}.
2026-06-05 21:37:53,604 - experiment_functions - INFO - Early stopping at epoch 550. Best Metrics: (0.026690276100263574, 0.0030795766628709227, 0.012139436882679423)
2026-06-05 21:37:53,703 - optuna.study.study - INFO - Trial 23 finished with values: [0.026690276100263574, 0.0030795766628709227, 0.012139436882679423] and parameters: {'n_layers': 4, 'embedding_dim': 128, 'lr': 0.08529103594261771, 'lambda_val': 7.057675938389195e-06, 'batch_size': 1993, 'optimizer': 'Adam'}.
2026-06-05 21:38:29,953 - experiment_functions - INFO - Early stopping at epoch 950. Best Metrics: (0.003572073660646237, 0.0006195994373367271, 0.0018984541806258556)
2026-06-05 21:38:30,269 - optuna.study.study - INFO - Trial 24 finished with values: [0.003572073660646237, 0.0006195994373367271, 0.0018984541806258556] and parameters: {'n_layers': 1, 'embedding_dim': 32, 'lr': 0.09884839893940871, 'lambda_val': 0.00013987950930203187, 'batch_size': 980, 'optimizer': 'RMSprop'}.
2026-06-05 21:42:07,456 - optuna.study.study - INFO - Trial 25 finished with values: [0.035520840938551845, 0.004943398754102753, 0.017780817122034033] and parameters: {'n_layers': 3, 'embedding_dim': 256, 'lr': 0.00020900924353094014, 'lambda_val': 0.006909805852222459, 'batch_size': 2889, 'optimizer': 'Adam'}.
2026-06-05 21:42:39,802 - experiment_functions - INFO - Early stopping at epoch 550. Best Metrics: (0.02984501728756426, 0.003449661732199076, 0.013662761740615982)
2026-06-05 21:42:39,974 - optuna.study.study - INFO - Trial 26 finished with values: [0.02984501728756426, 0.003449661732199076, 0.013662761740615982] and parameters: {'n_layers': 3, 'embedding_dim': 256, 'lr': 0.015338747118030613, 'lambda_val': 0.0012508747629343686, 'batch_size': 2853, 'optimizer': 'Adam'}.
2026-06-05 21:43:02,162 - experiment_functions - INFO - Early stopping at epoch 500. Best Metrics: (0.0003883301343918964, 6.530912988143882e-05, 0.00017931446124122224)
2026-06-05 21:43:02,252 - optuna.study.study - INFO - Trial 27 finished with values: [0.0003883301343918964, 6.530912988143882e-05, 0.00017931446124122224] and parameters: {'n_layers': 2, 'embedding_dim': 96, 'lr': 8.654616107228922e-05, 'lambda_val': 9.068590907047247e-06, 'batch_size': 2211, 'optimizer': 'SGD'}.
2026-06-05 21:43:25,815 - experiment_functions - INFO - Early stopping at epoch 500. Best Metrics: (0.0005259762104881635, 6.86583160292049e-05, 0.0002459379126047519)
2026-06-05 21:43:25,911 - optuna.study.study - INFO - Trial 28 finished with values: [0.0005259762104881635, 6.86583160292049e-05, 0.0002459379126047519] and parameters: {'n_layers': 1, 'embedding_dim': 256, 'lr': 1.296794509017157e-05, 'lambda_val': 7.792800082468315e-05, 'batch_size': 3369, 'optimizer': 'SGD'}.
2026-06-05 21:44:01,139 - experiment_functions - INFO - Early stopping at epoch 800. Best Metrics: (0.06821567431970976, 0.008151919083662671, 0.033980720505905865)
2026-06-05 21:44:01,242 - optuna.study.study - INFO - Trial 29 finished with values: [0.06821567431970976, 0.008151919083662671, 0.033980720505905865] and parameters: {'n_layers': 1, 'embedding_dim': 128, 'lr': 0.003918670659096881, 'lambda_val': 3.1920449116234754e-05, 'batch_size': 3853, 'optimizer': 'RMSprop'}.
2026-06-05 21:44:26,391 - experiment_functions - INFO - Early stopping at epoch 550. Best Metrics: (0.00923277004690101, 0.0012124053854913257, 0.004631788388761218)
2026-06-05 21:44:27,029 - optuna.study.study - INFO - Trial 30 finished with values: [0.00923277004690101, 0.0012124053854913257, 0.004631788388761218] and parameters: {'n_layers': 2, 'embedding_dim': 128, 'lr': 0.004592049638216867, 'lambda_val': 0.08735890070057756, 'batch_size': 1383, 'optimizer': 'RMSprop'}.
2026-06-05 21:44:52,269 - experiment_functions - INFO - Early stopping at epoch 500. Best Metrics: (0.0006125978079078016, 9.377721213745062e-05, 0.0002696387506602546)
2026-06-05 21:44:53,073 - optuna.study.study - INFO - Trial 31 finished with values: [0.0006125978079078016, 9.377721213745062e-05, 0.0002696387506602546] and parameters: {'n_layers': 4, 'embedding_dim': 128, 'lr': 4.6639704209928806e-05, 'lambda_val': 0.02060137970823099, 'batch_size': 3387, 'optimizer': 'SGD'}.
2026-06-05 21:45:15,804 - experiment_functions - INFO - Early stopping at epoch 500. Best Metrics: (0.0004641918720530123, 8.540424676803538e-05, 0.00020887232066512886)
2026-06-05 21:45:16,073 - optuna.study.study - INFO - Trial 32 finished with values: [0.0004641918720530123, 8.540424676803538e-05, 0.00020887232066512886] and parameters: {'n_layers': 2, 'embedding_dim': 96, 'lr': 4.826459371467508e-05, 'lambda_val': 0.011281966503890194, 'batch_size': 3000, 'optimizer': 'RMSprop'}.
2026-06-05 21:45:42,787 - experiment_functions - INFO - Early stopping at epoch 600. Best Metrics: (0.023764596269925595, 0.0028267131087145823, 0.010364225156138458)
2026-06-05 21:45:43,045 - optuna.study.study - INFO - Trial 33 finished with values: [0.023764596269925595, 0.0028267131087145823, 0.010364225156138458] and parameters: {'n_layers': 2, 'embedding_dim': 96, 'lr': 0.008793986584879794, 'lambda_val': 0.008565798660646664, 'batch_size': 1906, 'optimizer': 'Adam'}.
2026-06-05 21:46:07,877 - experiment_functions - INFO - Early stopping at epoch 500. Best Metrics: (0.0004938032573606065, 6.363453680755576e-05, 0.00019702092978036835)
2026-06-05 21:46:08,182 - optuna.study.study - INFO - Trial 34 finished with values: [0.0004938032573606065, 6.363453680755576e-05, 0.00019702092978036835] and parameters: {'n_layers': 4, 'embedding_dim': 128, 'lr': 0.001215155494326517, 'lambda_val': 2.1613015030781435e-06, 'batch_size': 2713, 'optimizer': 'SGD'}.
2026-06-05 21:46:38,567 - experiment_functions - INFO - Early stopping at epoch 500. Best Metrics: (0.000692508666994429, 0.00010047558443298278, 0.0002950440435682734)
2026-06-05 21:46:38,663 - optuna.study.study - INFO - Trial 35 finished with values: [0.000692508666994429, 0.00010047558443298278, 0.0002950440435682734] and parameters: {'n_layers': 4, 'embedding_dim': 256, 'lr': 0.00018157146131172442, 'lambda_val': 1.8302426053138405e-06, 'batch_size': 1890, 'optimizer': 'SGD'}.
2026-06-05 21:46:58,925 - experiment_functions - INFO - Early stopping at epoch 500. Best Metrics: (0.0003850067924721648, 7.033290910308795e-05, 0.00021160041321235354)
2026-06-05 21:46:58,998 - optuna.study.study - INFO - Trial 36 finished with values: [0.0003850067924721648, 7.033290910308795e-05, 0.00021160041321235354] and parameters: {'n_layers': 1, 'embedding_dim': 64, 'lr': 0.00014961995706701622, 'lambda_val': 0.032908612857678675, 'batch_size': 603, 'optimizer': 'SGD'}.
2026-06-05 21:49:05,249 - experiment_functions - INFO - Early stopping at epoch 2950. Best Metrics: (0.08556642762012276, 0.010240136646794828, 0.04384961376754246)
2026-06-05 21:49:05,452 - optuna.study.study - INFO - Trial 37 finished with values: [0.08556642762012276, 0.010240136646794828, 0.04384961376754246] and parameters: {'n_layers': 2, 'embedding_dim': 96, 'lr': 0.0008375189225934038, 'lambda_val': 1.482563488933184e-06, 'batch_size': 3734, 'optimizer': 'Adam'}.
2026-06-05 21:49:25,833 - experiment_functions - INFO - Early stopping at epoch 500. Best Metrics: (0.00037883259892313527, 7.870587447250318e-05, 0.00019382565106620906)
2026-06-05 21:49:27,476 - optuna.study.study - INFO - Trial 38 finished with values: [0.00037883259892313527, 7.870587447250318e-05, 0.00019382565106620906] and parameters: {'n_layers': 3, 'embedding_dim': 32, 'lr': 1.1340889574439507e-05, 'lambda_val': 0.05127415695038332, 'batch_size': 619, 'optimizer': 'RMSprop'}.
2026-06-05 21:52:10,886 - experiment_functions - INFO - Early stopping at epoch 3800. Best Metrics: (0.047258383812662945, 0.0055529506329961825, 0.021650426814291756)
2026-06-05 21:52:11,001 - optuna.study.study - INFO - Trial 39 finished with values: [0.047258383812662945, 0.0055529506329961825, 0.021650426814291756] and parameters: {'n_layers': 2, 'embedding_dim': 128, 'lr': 0.006584281759530826, 'lambda_val': 0.00023138991547762126, 'batch_size': 1104, 'optimizer': 'RMSprop'}.
2026-06-05 21:52:31,481 - experiment_functions - INFO - Early stopping at epoch 500. Best Metrics: (0.0004326511215753486, 7.703128139862013e-05, 0.0001991189200937949)
2026-06-05 21:52:31,987 - optuna.study.study - INFO - Trial 40 finished with values: [0.0004326511215753486, 7.703128139862013e-05, 0.0001991189200937949] and parameters: {'n_layers': 2, 'embedding_dim': 32, 'lr': 0.04248424273257122, 'lambda_val': 1.3274876572859763e-06, 'batch_size': 3208, 'optimizer': 'SGD'}.
2026-06-05 21:53:01,073 - experiment_functions - INFO - Early stopping at epoch 650. Best Metrics: (0.06952619736026065, 0.008815057940920358, 0.03671808033102262)
2026-06-05 21:53:01,160 - optuna.study.study - INFO - Trial 41 finished with values: [0.06952619736026065, 0.008815057940920358, 0.03671808033102262] and parameters: {'n_layers': 1, 'embedding_dim': 128, 'lr': 0.007650229911234196, 'lambda_val': 1.5618350584822937e-05, 'batch_size': 2901, 'optimizer': 'Adam'}.
2026-06-05 21:53:35,347 - experiment_functions - INFO - Early stopping at epoch 850. Best Metrics: (0.015374801544561906, 0.0021032889007971066, 0.007747018760553424)
2026-06-05 21:53:35,444 - optuna.study.study - INFO - Trial 42 finished with values: [0.015374801544561906, 0.0021032889007971066, 0.007747018760553424] and parameters: {'n_layers': 1, 'embedding_dim': 64, 'lr': 0.02565521693336446, 'lambda_val': 4.5568303635176404e-05, 'batch_size': 3092, 'optimizer': 'RMSprop'}.
2026-06-05 21:53:55,767 - experiment_functions - INFO - Early stopping at epoch 500. Best Metrics: (0.00043917215607469005, 7.53566883247371e-05, 0.00019684321754820478)
2026-06-05 21:53:56,222 - optuna.study.study - INFO - Trial 43 finished with values: [0.00043917215607469005, 7.53566883247371e-05, 0.00019684321754820478] and parameters: {'n_layers': 1, 'embedding_dim': 32, 'lr': 0.02294708289231678, 'lambda_val': 1.5181406065711707e-06, 'batch_size': 1076, 'optimizer': 'SGD'}.
2026-06-05 21:55:50,483 - experiment_functions - INFO - Early stopping at epoch 2750. Best Metrics: (0.018810556071708538, 0.002257351463594347, 0.0081866746304831)
2026-06-05 21:55:50,573 - optuna.study.study - INFO - Trial 44 finished with values: [0.018810556071708538, 0.002257351463594347, 0.0081866746304831] and parameters: {'n_layers': 4, 'embedding_dim': 64, 'lr': 0.022839699286990096, 'lambda_val': 0.004214243117784979, 'batch_size': 3134, 'optimizer': 'RMSprop'}.
2026-06-05 21:56:34,904 - experiment_functions - INFO - Early stopping at epoch 1100. Best Metrics: (0.07150654393154324, 0.008518654966843058, 0.036017756649880064)
2026-06-05 21:56:36,050 - optuna.study.study - INFO - Trial 45 finished with values: [0.07150654393154324, 0.008518654966843058, 0.036017756649880064] and parameters: {'n_layers': 1, 'embedding_dim': 64, 'lr': 0.003797813989642158, 'lambda_val': 1.2264285179082735e-06, 'batch_size': 1841, 'optimizer': 'RMSprop'}.
2026-06-05 21:59:12,724 - optuna.study.study - INFO - Trial 46 finished with values: [0.007341428660191057, 0.0012860874807421798, 0.0036660499850661448] and parameters: {'n_layers': 3, 'embedding_dim': 64, 'lr': 0.00015153149181335385, 'lambda_val': 0.015361046335908908, 'batch_size': 2732, 'optimizer': 'RMSprop'}.
2026-06-05 22:00:21,462 - experiment_functions - INFO - Early stopping at epoch 1250. Best Metrics: (0.042891457903753455, 0.005459173420858731, 0.020120930328164872)
2026-06-05 22:00:21,577 - optuna.study.study - INFO - Trial 47 finished with values: [0.042891457903753455, 0.005459173420858731, 0.020120930328164872] and parameters: {'n_layers': 3, 'embedding_dim': 256, 'lr': 0.0006492139755404522, 'lambda_val': 0.007710635522261197, 'batch_size': 2351, 'optimizer': 'Adam'}.
2026-06-05 22:00:43,196 - experiment_functions - INFO - Early stopping at epoch 500. Best Metrics: (0.0004760847265100988, 6.698372295532186e-05, 0.0002100440110325634)
2026-06-05 22:00:43,580 - optuna.study.study - INFO - Trial 48 finished with values: [0.0004760847265100988, 6.698372295532186e-05, 0.0002100440110325634] and parameters: {'n_layers': 3, 'embedding_dim': 64, 'lr': 0.03292066943995933, 'lambda_val': 0.005622423735160845, 'batch_size': 1747, 'optimizer': 'SGD'}.
2026-06-05 22:02:04,692 - experiment_functions - INFO - Early stopping at epoch 1350. Best Metrics: (0.04851843570298718, 0.005707013195793423, 0.023027573879385796)
2026-06-05 22:02:04,782 - optuna.study.study - INFO - Trial 49 finished with values: [0.04851843570298718, 0.005707013195793423, 0.023027573879385796] and parameters: {'n_layers': 4, 'embedding_dim': 256, 'lr': 0.0011525517839870857, 'lambda_val': 7.4032238942432714e-06, 'batch_size': 1266, 'optimizer': 'Adam'}.
2026-06-05 22:02:35,014 - experiment_functions - INFO - Early stopping at epoch 500. Best Metrics: (0.0007065662972248261, 9.545180521133365e-05, 0.00034973665749448113)
2026-06-05 22:02:35,348 - optuna.study.study - INFO - Trial 50 finished with values: [0.0007065662972248261, 9.545180521133365e-05, 0.00034973665749448113] and parameters: {'n_layers': 4, 'embedding_dim': 256, 'lr': 0.0011525517839870857, 'lambda_val': 7.4032238942432714e-06, 'batch_size': 1680, 'optimizer': 'SGD'}.
2026-06-05 22:03:12,789 - experiment_functions - INFO - Early stopping at epoch 800. Best Metrics: (0.02902702113776099, 0.0034345903945341284, 0.012987276125349754)
2026-06-05 22:03:12,898 - optuna.study.study - INFO - Trial 51 finished with values: [0.02902702113776099, 0.0034345903945341284, 0.012987276125349754] and parameters: {'n_layers': 3, 'embedding_dim': 128, 'lr': 0.0030777772444340735, 'lambda_val': 0.00191214395764258, 'batch_size': 2924, 'optimizer': 'RMSprop'}.
2026-06-05 22:03:36,330 - experiment_functions - INFO - Early stopping at epoch 500. Best Metrics: (0.0003966175674601224, 8.038046754638624e-05, 0.00019662339326538637)
2026-06-05 22:03:36,420 - optuna.study.study - INFO - Trial 52 finished with values: [0.0003966175674601224, 8.038046754638624e-05, 0.00019662339326538637] and parameters: {'n_layers': 4, 'embedding_dim': 96, 'lr': 4.6639704209928806e-05, 'lambda_val': 0.00023138991547762126, 'batch_size': 3387, 'optimizer': 'SGD'}.
2026-06-05 22:06:31,904 - optuna.study.study - INFO - Trial 53 finished with values: [0.01548158804374035, 0.002448255074017014, 0.007638820498422041] and parameters: {'n_layers': 3, 'embedding_dim': 128, 'lr': 0.00015153149181335385, 'lambda_val': 0.015361046335908908, 'batch_size': 3853, 'optimizer': 'RMSprop'}.
2026-06-05 22:07:49,387 - experiment_functions - INFO - Early stopping at epoch 1650. Best Metrics: (0.06705897901626373, 0.008106705070667828, 0.03373759432836242)
