2026-06-05 02:56:21,749 - optuna.study.study - INFO - Trial 191 finished with values: [0.03599351300758138, 0.004680487641503115, 0.01768614154533334] and parameters: {'n_layers': 1, 'embedding_dim': 256, 'lr': 0.010850387474674802, 'lambda_val': 0.0024741700262700477, 'batch_size': 2586, 'optimizer': 'Adam'}.
2026-06-05 02:58:40,058 - experiment_functions - INFO - Early stopping at epoch 2900. Best Metrics: (0.05503418854298653, 0.006964632594279591, 0.027468341274154998)
2026-06-05 02:58:40,178 - optuna.study.study - INFO - Trial 192 finished with values: [0.05503418854298653, 0.006964632594279591, 0.027468341274154998] and parameters: {'n_layers': 3, 'embedding_dim': 128, 'lr': 0.0007432804052483335, 'lambda_val': 4.933989724174048e-06, 'batch_size': 3956, 'optimizer': 'Adam'}.
2026-06-05 02:59:04,066 - experiment_functions - INFO - Early stopping at epoch 500. Best Metrics: (0.030364346966771365, 0.0038096992430839307, 0.016150818744022355)
2026-06-05 02:59:04,162 - optuna.study.study - INFO - Trial 193 finished with values: [0.030364346966771365, 0.0038096992430839307, 0.016150818744022355] and parameters: {'n_layers': 4, 'embedding_dim': 64, 'lr': 0.08294142044076476, 'lambda_val': 3.862313972805562e-05, 'batch_size': 516, 'optimizer': 'RMSprop'}.
2026-06-05 03:01:51,972 - optuna.study.study - INFO - Trial 194 finished with values: [0.04612826875048186, 0.006195994373367273, 0.025378536650689582] and parameters: {'n_layers': 2, 'embedding_dim': 96, 'lr': 0.0002487999076432075, 'lambda_val': 1.6669472887970978e-05, 'batch_size': 1214, 'optimizer': 'RMSprop'}.
2026-06-05 03:04:27,503 - optuna.study.study - INFO - Trial 195 finished with values: [0.0689039623408051, 0.00888874003617121, 0.03810925079622385] and parameters: {'n_layers': 1, 'embedding_dim': 32, 'lr': 0.00105994739638826, 'lambda_val': 2.388311754210309e-05, 'batch_size': 2586, 'optimizer': 'Adam'}.
2026-06-05 03:05:10,906 - experiment_functions - INFO - Early stopping at epoch 750. Best Metrics: (0.020824587247605147, 0.002645857056735214, 0.010388014649248722)
2026-06-05 03:05:11,059 - optuna.study.study - INFO - Trial 196 finished with values: [0.020824587247605147, 0.002645857056735214, 0.010388014649248722] and parameters: {'n_layers': 3, 'embedding_dim': 256, 'lr': 0.00105994739638826, 'lambda_val': 0.0024741700262700477, 'batch_size': 1064, 'optimizer': 'RMSprop'}.
2026-06-05 03:08:00,134 - optuna.study.study - INFO - Trial 197 finished with values: [0.05527446307639195, 0.007250988009913591, 0.03027656536824005] and parameters: {'n_layers': 2, 'embedding_dim': 96, 'lr': 0.0003278860610242573, 'lambda_val': 1.0124982802390631e-06, 'batch_size': 1214, 'optimizer': 'RMSprop'}.
2026-06-05 03:08:24,345 - experiment_functions - INFO - Early stopping at epoch 500. Best Metrics: (0.019193504810873608, 0.002337731931140733, 0.010580517939929155)
2026-06-05 03:08:25,025 - optuna.study.study - INFO - Trial 198 finished with values: [0.019193504810873608, 0.002337731931140733, 0.010580517939929155] and parameters: {'n_layers': 3, 'embedding_dim': 96, 'lr': 0.08294142044076476, 'lambda_val': 2.264578702522949e-06, 'batch_size': 1100, 'optimizer': 'RMSprop'}.
2026-06-05 03:08:52,224 - experiment_functions - INFO - Early stopping at epoch 550. Best Metrics: (0.04224605937324818, 0.0053938642909772926, 0.020442112315463456)
2026-06-05 03:08:52,327 - optuna.study.study - INFO - Trial 199 finished with values: [0.04224605937324818, 0.0053938642909772926, 0.020442112315463456] and parameters: {'n_layers': 1, 'embedding_dim': 256, 'lr': 0.010850387474674802, 'lambda_val': 0.0024741700262700477, 'batch_size': 3009, 'optimizer': 'Adam'}.
2026-06-05 03:11:33,535 - optuna.study.study - INFO - Trial 200 finished with values: [0.07411900738268092, 0.009576997789537144, 0.04052272326213608] and parameters: {'n_layers': 1, 'embedding_dim': 64, 'lr': 0.0007432804052483335, 'lambda_val': 2.061360640875514e-06, 'batch_size': 3032, 'optimizer': 'RMSprop'}.
2026-06-05 03:11:57,700 - experiment_functions - INFO - Early stopping at epoch 550. Best Metrics: (0.0248178835556398, 0.0032570835287025254, 0.011885410920050176)
2026-06-05 03:11:58,515 - optuna.study.study - INFO - Trial 201 finished with values: [0.0248178835556398, 0.0032570835287025254, 0.011885410920050176] and parameters: {'n_layers': 1, 'embedding_dim': 96, 'lr': 0.010850387474674802, 'lambda_val': 0.011580632624311358, 'batch_size': 2331, 'optimizer': 'Adam'}.
2026-06-05 03:13:00,317 - experiment_functions - INFO - Early stopping at epoch 1300. Best Metrics: (0.059682164772690484, 0.008188760131288097, 0.032633211632619126)
2026-06-05 03:13:00,567 - optuna.study.study - INFO - Trial 202 finished with values: [0.059682164772690484, 0.008188760131288097, 0.032633211632619126] and parameters: {'n_layers': 1, 'embedding_dim': 256, 'lr': 0.0007432804052483335, 'lambda_val': 0.0024741700262700477, 'batch_size': 2586, 'optimizer': 'Adam'}.
2026-06-05 03:13:27,860 - experiment_functions - INFO - Early stopping at epoch 650. Best Metrics: (0.022661577105024953, 0.003170004688860607, 0.011417182341427213)
2026-06-05 03:13:27,968 - optuna.study.study - INFO - Trial 203 finished with values: [0.022661577105024953, 0.003170004688860607, 0.011417182341427213] and parameters: {'n_layers': 1, 'embedding_dim': 64, 'lr': 0.010850387474674802, 'lambda_val': 2.388311754210309e-05, 'batch_size': 1900, 'optimizer': 'RMSprop'}.
2026-06-05 03:16:03,366 - optuna.study.study - INFO - Trial 204 finished with values: [0.041216366064553145, 0.005650077031281398, 0.02089852994713373] and parameters: {'n_layers': 2, 'embedding_dim': 32, 'lr': 0.0003278860610242573, 'lambda_val': 2.388311754210309e-05, 'batch_size': 3523, 'optimizer': 'Adam'}.
2026-06-05 03:18:46,482 - optuna.study.study - INFO - Trial 205 finished with values: [0.07224800436774269, 0.009525085404246767, 0.04090925643325919] and parameters: {'n_layers': 1, 'embedding_dim': 96, 'lr': 0.0007432804052483335, 'lambda_val': 2.061360640875514e-06, 'batch_size': 1214, 'optimizer': 'RMSprop'}.
2026-06-05 03:21:18,332 - optuna.study.study - INFO - Trial 206 finished with values: [0.025042685249357783, 0.003531716792819345, 0.014730934369913962] and parameters: {'n_layers': 1, 'embedding_dim': 64, 'lr': 0.0003278860610242573, 'lambda_val': 2.061360640875514e-06, 'batch_size': 977, 'optimizer': 'RMSprop'}.
2026-06-05 03:23:58,380 - optuna.study.study - INFO - Trial 207 finished with values: [0.05257661705793161, 0.0073347176636077436, 0.029477523814715984] and parameters: {'n_layers': 1, 'embedding_dim': 96, 'lr': 0.0003278860610242573, 'lambda_val': 0.0003734366700851135, 'batch_size': 3114, 'optimizer': 'Adam'}.
2026-06-05 03:27:05,561 - optuna.study.study - INFO - Trial 208 finished with values: [0.05121897796585994, 0.006787125728447988, 0.026390684124494457] and parameters: {'n_layers': 3, 'embedding_dim': 128, 'lr': 0.0003418709874020897, 'lambda_val': 4.933989724174048e-06, 'batch_size': 1064, 'optimizer': 'Adam'}.
2026-06-05 03:27:35,996 - experiment_functions - INFO - Early stopping at epoch 650. Best Metrics: (0.019962346745943785, 0.0027614039788331443, 0.01002838086966846)
2026-06-05 03:27:36,125 - optuna.study.study - INFO - Trial 209 finished with values: [0.019962346745943785, 0.0027614039788331443, 0.01002838086966846] and parameters: {'n_layers': 4, 'embedding_dim': 64, 'lr': 0.007237567876606076, 'lambda_val': 2.061360640875514e-06, 'batch_size': 2859, 'optimizer': 'RMSprop'}.
2026-06-05 03:31:24,210 - optuna.study.study - INFO - Trial 210 finished with values: [0.05842288892913488, 0.007487105633331101, 0.030822960551910607] and parameters: {'n_layers': 3, 'embedding_dim': 256, 'lr': 0.0003278860610242573, 'lambda_val': 1.6669472887970978e-05, 'batch_size': 2859, 'optimizer': 'Adam'}.
2026-06-05 03:32:21,899 - experiment_functions - INFO - Early stopping at epoch 1000. Best Metrics: (0.03355265154529185, 0.0043271485029137925, 0.016522562060148516)
2026-06-05 03:32:22,365 - optuna.study.study - INFO - Trial 211 finished with values: [0.03355265154529185, 0.0043271485029137925, 0.016522562060148516] and parameters: {'n_layers': 3, 'embedding_dim': 256, 'lr': 0.0007432804052483335, 'lambda_val': 0.0024741700262700477, 'batch_size': 1214, 'optimizer': 'Adam'}.
2026-06-05 03:33:18,175 - experiment_functions - INFO - Early stopping at epoch 1300. Best Metrics: (0.01159382880531345, 0.001550673186415701, 0.005638560164547943)
2026-06-05 03:33:18,339 - optuna.study.study - INFO - Trial 212 finished with values: [0.01159382880531345, 0.001550673186415701, 0.005638560164547943] and parameters: {'n_layers': 2, 'embedding_dim': 96, 'lr': 0.0007432804052483335, 'lambda_val': 0.07253895443827123, 'batch_size': 2242, 'optimizer': 'Adam'}.
2026-06-05 03:36:06,383 - optuna.study.study - INFO - Trial 213 finished with values: [0.05073911194073319, 0.006281398620135307, 0.025330423206429246] and parameters: {'n_layers': 3, 'embedding_dim': 64, 'lr': 0.0007432804052483335, 'lambda_val': 2.264578702522949e-06, 'batch_size': 3566, 'optimizer': 'Adam'}.
2026-06-05 03:38:39,516 - optuna.study.study - INFO - Trial 214 finished with values: [0.044817442598874026, 0.006043606403643914, 0.024862050459682053] and parameters: {'n_layers': 2, 'embedding_dim': 32, 'lr': 0.0003278860610242573, 'lambda_val': 1.6669472887970978e-05, 'batch_size': 1750, 'optimizer': 'Adam'}.
2026-06-05 03:41:24,631 - optuna.study.study - INFO - Trial 215 finished with values: [0.07370804675730865, 0.009721012793891084, 0.04188107641703602] and parameters: {'n_layers': 1, 'embedding_dim': 128, 'lr': 0.0007432804052483335, 'lambda_val': 4.933989724174048e-06, 'batch_size': 1064, 'optimizer': 'RMSprop'}.
2026-06-05 03:44:04,799 - optuna.study.study - INFO - Trial 216 finished with values: [0.07190127331349815, 0.00931743586308527, 0.0385657169866733] and parameters: {'n_layers': 1, 'embedding_dim': 64, 'lr': 0.000936097337950737, 'lambda_val': 2.061360640875514e-06, 'batch_size': 2183, 'optimizer': 'RMSprop'}.
2026-06-05 03:46:27,809 - experiment_functions - INFO - Early stopping at epoch 3050. Best Metrics: (0.07863832769171061, 0.010196597226873869, 0.04254542550118741)
2026-06-05 03:46:27,936 - optuna.study.study - INFO - Trial 217 finished with values: [0.07863832769171061, 0.010196597226873869, 0.04254542550118741] and parameters: {'n_layers': 1, 'embedding_dim': 256, 'lr': 0.000936097337950737, 'lambda_val': 2.061360640875514e-06, 'batch_size': 2859, 'optimizer': 'RMSprop'}.
2026-06-05 03:49:02,398 - experiment_functions - INFO - Early stopping at epoch 3300. Best Metrics: (0.0742633235474353, 0.0098281867506196, 0.03993089036143511)
2026-06-05 03:49:02,534 - optuna.study.study - INFO - Trial 218 finished with values: [0.0742633235474353, 0.0098281867506196, 0.03993089036143511] and parameters: {'n_layers': 1, 'embedding_dim': 256, 'lr': 0.0007432804052483335, 'lambda_val': 0.0003734366700851135, 'batch_size': 2602, 'optimizer': 'Adam'}.
2026-06-05 03:51:42,378 - optuna.study.study - INFO - Trial 219 finished with values: [0.07252599067554173, 0.009533458369616183, 0.03965991480261502] and parameters: {'n_layers': 1, 'embedding_dim': 64, 'lr': 0.000936097337950737, 'lambda_val': 2.061360640875514e-06, 'batch_size': 2331, 'optimizer': 'Adam'}.
2026-06-05 03:54:17,539 - optuna.study.study - INFO - Trial 220 finished with values: [0.050302904217788526, 0.0066196664210596825, 0.025763370237622766] and parameters: {'n_layers': 2, 'embedding_dim': 32, 'lr': 0.0007432804052483335, 'lambda_val': 4.933989724174048e-06, 'batch_size': 3375, 'optimizer': 'Adam'}.
2026-06-05 03:54:55,034 - experiment_functions - INFO - Early stopping at epoch 850. Best Metrics: (0.03900205939952625, 0.0054574988277848475, 0.020330649990458256)
2026-06-05 03:54:55,234 - optuna.study.study - INFO - Trial 221 finished with values: [0.03900205939952625, 0.0054574988277848475, 0.020330649990458256] and parameters: {'n_layers': 2, 'embedding_dim': 96, 'lr': 0.0007432804052483335, 'lambda_val': 0.005171563546578648, 'batch_size': 1750, 'optimizer': 'Adam'}.
2026-06-05 03:55:34,854 - experiment_functions - INFO - Early stopping at epoch 950. Best Metrics: (0.02849207178832284, 0.003563534061223123, 0.013855394277514602)
2026-06-05 03:55:35,394 - optuna.study.study - INFO - Trial 222 finished with values: [0.02849207178832284, 0.003563534061223123, 0.013855394277514602] and parameters: {'n_layers': 4, 'embedding_dim': 32, 'lr': 0.000936097337950737, 'lambda_val': 0.0024741700262700477, 'batch_size': 2586, 'optimizer': 'Adam'}.
2026-06-05 03:57:53,763 - experiment_functions - INFO - Early stopping at epoch 3400. Best Metrics: (0.0529787964166779, 0.007070131957934223, 0.027341263498023356)
2026-06-05 03:57:53,871 - optuna.study.study - INFO - Trial 223 finished with values: [0.0529787964166779, 0.007070131957934223, 0.027341263498023356] and parameters: {'n_layers': 2, 'embedding_dim': 64, 'lr': 0.0007432804052483335, 'lambda_val': 0.0003734366700851135, 'batch_size': 672, 'optimizer': 'Adam'}.
2026-06-05 03:58:31,870 - experiment_functions - INFO - Early stopping at epoch 900. Best Metrics: (0.052210895091910695, 0.007001473641905016, 0.027127636579523252)
2026-06-05 03:58:31,998 - optuna.study.study - INFO - Trial 224 finished with values: [0.052210895091910695, 0.007001473641905016, 0.027127636579523252] and parameters: {'n_layers': 1, 'embedding_dim': 96, 'lr': 0.000936097337950737, 'lambda_val': 0.0022796558969384764, 'batch_size': 2859, 'optimizer': 'RMSprop'}.
2026-06-05 04:00:06,669 - experiment_functions - INFO - Early stopping at epoch 2450. Best Metrics: (0.02483220244655714, 0.003404447719204234, 0.012606426708743573)
2026-06-05 04:00:06,883 - optuna.study.study - INFO - Trial 225 finished with values: [0.02483220244655714, 0.003404447719204234, 0.012606426708743573] and parameters: {'n_layers': 3, 'embedding_dim': 32, 'lr': 0.0007432804052483335, 'lambda_val': 0.006685955985128667, 'batch_size': 1064, 'optimizer': 'Adam'}.
2026-06-05 04:03:09,100 - optuna.study.study - INFO - Trial 226 finished with values: [0.03841411233257557, 0.004884787996516847, 0.01904888200062766] and parameters: {'n_layers': 3, 'embedding_dim': 128, 'lr': 0.00105994739638826, 'lambda_val': 4.933989724174048e-06, 'batch_size': 1064, 'optimizer': 'RMSprop'}.
2026-06-05 04:03:37,576 - experiment_functions - INFO - Early stopping at epoch 600. Best Metrics: (0.055706829635590774, 0.007081854109451405, 0.029693052102892668)
2026-06-05 04:03:37,668 - optuna.study.study - INFO - Trial 227 finished with values: [0.055706829635590774, 0.007081854109451405, 0.029693052102892668] and parameters: {'n_layers': 2, 'embedding_dim': 128, 'lr': 0.0032056463714742675, 'lambda_val': 4.933989724174048e-06, 'batch_size': 3369, 'optimizer': 'Adam'}.
2026-06-05 04:04:02,628 - experiment_functions - INFO - Early stopping at epoch 550. Best Metrics: (0.03695344763337002, 0.004374037108982518, 0.017542348325325505)
2026-06-05 04:04:04,026 - optuna.study.study - INFO - Trial 228 finished with values: [0.03695344763337002, 0.004374037108982518, 0.017542348325325505] and parameters: {'n_layers': 2, 'embedding_dim': 96, 'lr': 0.010850387474674802, 'lambda_val': 0.00014319922067449002, 'batch_size': 3810, 'optimizer': 'Adam'}.
2026-06-05 04:04:42,885 - experiment_functions - INFO - Early stopping at epoch 950. Best Metrics: (0.03370440519339881, 0.004429298680420658, 0.016936631469117835)
2026-06-05 04:04:43,088 - optuna.study.study - INFO - Trial 229 finished with values: [0.03370440519339881, 0.004429298680420658, 0.016936631469117835] and parameters: {'n_layers': 2, 'embedding_dim': 32, 'lr': 0.000936097337950737, 'lambda_val': 0.0024741700262700477, 'batch_size': 3114, 'optimizer': 'RMSprop'}.
2026-06-05 04:05:12,540 - experiment_functions - INFO - Early stopping at epoch 550. Best Metrics: (0.0006288471659563665, 8.875343291580147e-05, 0.00023200261042694015)
2026-06-05 04:05:13,570 - optuna.study.study - INFO - Trial 230 finished with values: [0.0006288471659563665, 8.875343291580147e-05, 0.00023200261042694015] and parameters: {'n_layers': 2, 'embedding_dim': 256, 'lr': 1.7610923264743147e-05, 'lambda_val': 1.6669472887970978e-05, 'batch_size': 1750, 'optimizer': 'Adam'}.
2026-06-05 04:07:45,975 - optuna.study.study - INFO - Trial 231 finished with values: [0.06578482776099488, 0.008662669971197, 0.03551650346001246] and parameters: {'n_layers': 1, 'embedding_dim': 32, 'lr': 0.0007432804052483335, 'lambda_val': 0.0003734366700851135, 'batch_size': 2602, 'optimizer': 'Adam'}.
2026-06-05 04:09:25,542 - experiment_functions - INFO - Early stopping at epoch 2400. Best Metrics: (0.05406501465679954, 0.0069880768973139525, 0.02770795567249313)
2026-06-05 04:09:25,952 - optuna.study.study - INFO - Trial 232 finished with values: [0.05406501465679954, 0.0069880768973139525, 0.02770795567249313] and parameters: {'n_layers': 2, 'embedding_dim': 64, 'lr': 0.0005442466826639005, 'lambda_val': 1.2031408895922998e-05, 'batch_size': 3566, 'optimizer': 'RMSprop'}.
2026-06-05 04:12:28,210 - optuna.study.study - INFO - Trial 233 finished with values: [0.03385882291530353, 0.004817804273561524, 0.019637990297352248] and parameters: {'n_layers': 1, 'embedding_dim': 256, 'lr': 0.0003418709874020897, 'lambda_val': 0.0024741700262700477, 'batch_size': 1064, 'optimizer': 'Adam'}.
2026-06-05 04:13:52,037 - experiment_functions - INFO - Early stopping at epoch 2050. Best Metrics: (0.057281199705678104, 0.0076528903476455225, 0.0306102829073945)
2026-06-05 04:13:52,797 - optuna.study.study - INFO - Trial 234 finished with values: [0.057281199705678104, 0.0076528903476455225, 0.0306102829073945] and parameters: {'n_layers': 1, 'embedding_dim': 96, 'lr': 0.000936097337950737, 'lambda_val': 0.0024741700262700477, 'batch_size': 744, 'optimizer': 'Adam'}.
2026-06-05 04:14:16,884 - experiment_functions - INFO - Early stopping at epoch 550. Best Metrics: (0.03468985037276956, 0.00445776676267667, 0.017409950148927007)
2026-06-05 04:14:17,024 - optuna.study.study - INFO - Trial 235 finished with values: [0.03468985037276956, 0.00445776676267667, 0.017409950148927007] and parameters: {'n_layers': 1, 'embedding_dim': 96, 'lr': 0.022431317519972894, 'lambda_val': 0.00022368856507037872, 'batch_size': 2331, 'optimizer': 'Adam'}.
2026-06-05 04:17:08,473 - optuna.study.study - INFO - Trial 236 finished with values: [0.05921949267163351, 0.0078069529104427635, 0.03277671325287673] and parameters: {'n_layers': 2, 'embedding_dim': 96, 'lr': 0.0003278860610242573, 'lambda_val': 1.0124982802390631e-06, 'batch_size': 3566, 'optimizer': 'RMSprop'}.
2026-06-05 04:18:23,373 - experiment_functions - INFO - Early stopping at epoch 1700. Best Metrics: (0.03513816532081882, 0.004420925715051242, 0.016346633084124807)
2026-06-05 04:18:23,616 - optuna.study.study - INFO - Trial 237 finished with values: [0.03513816532081882, 0.004420925715051242, 0.016346633084124807] and parameters: {'n_layers': 4, 'embedding_dim': 64, 'lr': 0.000936097337950737, 'lambda_val': 8.941858515268372e-05, 'batch_size': 3447, 'optimizer': 'Adam'}.
2026-06-05 04:19:02,996 - experiment_functions - INFO - Early stopping at epoch 950. Best Metrics: (0.05788573454170332, 0.007644517382276109, 0.030519767279855607)
2026-06-05 04:19:03,532 - optuna.study.study - INFO - Trial 238 finished with values: [0.05788573454170332, 0.007644517382276109, 0.030519767279855607] and parameters: {'n_layers': 1, 'embedding_dim': 64, 'lr': 0.000936097337950737, 'lambda_val': 0.0024741700262700477, 'batch_size': 2586, 'optimizer': 'RMSprop'}.
2026-06-05 04:21:43,613 - optuna.study.study - INFO - Trial 239 finished with values: [0.07302430930048541, 0.00959709290642374, 0.041007985613269356] and parameters: {'n_layers': 1, 'embedding_dim': 64, 'lr': 0.000936097337950737, 'lambda_val': 2.061360640875514e-06, 'batch_size': 3447, 'optimizer': 'RMSprop'}.
2026-06-05 04:24:22,159 - optuna.study.study - INFO - Trial 240 finished with values: [0.03588981861207059, 0.0051895639359635605, 0.0201136064152776] and parameters: {'n_layers': 1, 'embedding_dim': 96, 'lr': 0.0003278860610242573, 'lambda_val': 0.006936446373693046, 'batch_size': 1214, 'optimizer': 'RMSprop'}.
2026-06-05 04:27:12,465 - optuna.study.study - INFO - Trial 241 finished with values: [0.07664544200119265, 0.010109518387031951, 0.04301868042873175] and parameters: {'n_layers': 1, 'embedding_dim': 128, 'lr': 0.0007432804052483335, 'lambda_val': 4.933989724174048e-06, 'batch_size': 2586, 'optimizer': 'Adam'}.
2026-06-05 04:27:53,374 - experiment_functions - INFO - Early stopping at epoch 900. Best Metrics: (0.024993532557099376, 0.0032771786455891216, 0.012376839289996567)
2026-06-05 04:27:53,479 - optuna.study.study - INFO - Trial 242 finished with values: [0.024993532557099376, 0.0032771786455891216, 0.012376839289996567] and parameters: {'n_layers': 4, 'embedding_dim': 64, 'lr': 0.0007432804052483335, 'lambda_val': 0.0024741700262700477, 'batch_size': 1117, 'optimizer': 'Adam'}.
2026-06-05 04:28:58,542 - experiment_functions - INFO - Early stopping at epoch 1650. Best Metrics: (0.0580958719627626, 0.007631120637685043, 0.03246959330469358)
2026-06-05 04:28:58,804 - optuna.study.study - INFO - Trial 243 finished with values: [0.0580958719627626, 0.007631120637685043, 0.03246959330469358] and parameters: {'n_layers': 1, 'embedding_dim': 32, 'lr': 0.000936097337950737, 'lambda_val': 2.061360640875514e-06, 'batch_size': 1329, 'optimizer': 'RMSprop'}.
2026-06-05 04:31:57,847 - optuna.study.study - INFO - Trial 244 finished with values: [0.06251347127427105, 0.008140196932145488, 0.033294818169159995] and parameters: {'n_layers': 2, 'embedding_dim': 128, 'lr': 0.0007432804052483335, 'lambda_val': 4.933989724174048e-06, 'batch_size': 1064, 'optimizer': 'Adam'}.
