2026-06-06 09:59:09,904 - optuna.study.study - INFO - Trial 210 finished with values: [0.07244249649310018, 0.009801393261437473, 0.040194157788510154] and parameters: {'n_layers': 1, 'embedding_dim': 128, 'lr': 0.0006810282647636203, 'lambda_val': 1.9181328945787323e-06, 'batch_size': 2873, 'optimizer': 'Adam'}.
2026-06-06 10:01:48,259 - optuna.study.study - INFO - Trial 211 finished with values: [0.09002074411329332, 0.011127670975952844, 0.049397291479731015] and parameters: {'n_layers': 1, 'embedding_dim': 32, 'lr': 0.0017827212934439936, 'lambda_val': 1.3036977819163817e-06, 'batch_size': 3209, 'optimizer': 'Adam'}.
2026-06-06 10:04:44,896 - optuna.study.study - INFO - Trial 212 finished with values: [0.08000558059435238, 0.009881773728983858, 0.044092532962764726] and parameters: {'n_layers': 2, 'embedding_dim': 128, 'lr': 0.0006711529294623438, 'lambda_val': 3.996555780966423e-06, 'batch_size': 1237, 'optimizer': 'RMSprop'}.
2026-06-06 10:07:23,719 - optuna.study.study - INFO - Trial 213 finished with values: [0.07469233336838521, 0.00925715051242548, 0.04001641230455034] and parameters: {'n_layers': 2, 'embedding_dim': 32, 'lr': 0.0009002298727573989, 'lambda_val': 4.922331159406591e-06, 'batch_size': 2911, 'optimizer': 'Adam'}.
2026-06-06 10:10:20,139 - optuna.study.study - INFO - Trial 214 finished with values: [0.08728104796051254, 0.010583428226940852, 0.04623987778173589] and parameters: {'n_layers': 2, 'embedding_dim': 128, 'lr': 0.0006711529294623438, 'lambda_val': 5.315262969436241e-05, 'batch_size': 2384, 'optimizer': 'Adam'}.
2026-06-06 10:11:45,112 - experiment_functions - INFO - Early stopping at epoch 2050. Best Metrics: (0.09314659440962712, 0.011300154062562798, 0.04947544525293936)
2026-06-06 10:11:46,166 - optuna.study.study - INFO - Trial 215 finished with values: [0.09314659440962712, 0.011300154062562798, 0.04947544525293936] and parameters: {'n_layers': 1, 'embedding_dim': 96, 'lr': 0.0017827212934439936, 'lambda_val': 1.3036977819163817e-06, 'batch_size': 3209, 'optimizer': 'Adam'}.
2026-06-06 10:14:11,991 - optuna.study.study - INFO - Trial 216 finished with values: [0.0012897208325246498, 0.00017750686583160294, 0.0006157849210808922] and parameters: {'n_layers': 1, 'embedding_dim': 32, 'lr': 0.00020279189699524093, 'lambda_val': 1.3036977819163817e-06, 'batch_size': 3209, 'optimizer': 'Adam'}.
2026-06-06 10:16:58,389 - optuna.study.study - INFO - Trial 217 finished with values: [0.0006577797633670491, 9.545180521133365e-05, 0.0003157043598918843] and parameters: {'n_layers': 2, 'embedding_dim': 128, 'lr': 6.457003326382981e-05, 'lambda_val': 5.510107267630662e-06, 'batch_size': 3359, 'optimizer': 'Adam'}.
2026-06-06 10:17:18,378 - experiment_functions - INFO - Early stopping at epoch 500. Best Metrics: (0.0007014793972544663, 7.535668832473711e-05, 0.0003197254977288188)
2026-06-06 10:17:19,106 - optuna.study.study - INFO - Trial 218 finished with values: [0.0007014793972544663, 7.535668832473711e-05, 0.0003197254977288188] and parameters: {'n_layers': 1, 'embedding_dim': 32, 'lr': 0.0019509035141199726, 'lambda_val': 1.3036977819163817e-06, 'batch_size': 2384, 'optimizer': 'SGD'}.
2026-06-06 10:18:20,112 - experiment_functions - INFO - Early stopping at epoch 1650. Best Metrics: (0.0004911048642081354, 9.210261906356757e-05, 0.0002460085712481042)
2026-06-06 10:18:20,212 - optuna.study.study - INFO - Trial 219 finished with values: [0.0004911048642081354, 9.210261906356757e-05, 0.0002460085712481042] and parameters: {'n_layers': 1, 'embedding_dim': 32, 'lr': 7.080371760571535e-05, 'lambda_val': 1.3398416216824042e-06, 'batch_size': 976, 'optimizer': 'RMSprop'}.
2026-06-06 10:20:56,187 - optuna.study.study - INFO - Trial 220 finished with values: [0.05915459637625656, 0.006889275905954855, 0.02806385308630877] and parameters: {'n_layers': 1, 'embedding_dim': 64, 'lr': 0.005828487948467767, 'lambda_val': 3.996555780966423e-06, 'batch_size': 1237, 'optimizer': 'RMSprop'}.
2026-06-06 10:23:28,338 - optuna.study.study - INFO - Trial 221 finished with values: [0.05689477030200782, 0.007820349655033828, 0.03123830913632936] and parameters: {'n_layers': 1, 'embedding_dim': 32, 'lr': 0.0006810282647636203, 'lambda_val': 0.003010182335575881, 'batch_size': 3304, 'optimizer': 'Adam'}.
2026-06-06 10:23:48,559 - experiment_functions - INFO - Early stopping at epoch 500. Best Metrics: (0.0005538477208865505, 8.038046754638622e-05, 0.0002478842901919395)
2026-06-06 10:23:49,436 - optuna.study.study - INFO - Trial 222 finished with values: [0.0005538477208865505, 8.038046754638622e-05, 0.0002478842901919395] and parameters: {'n_layers': 1, 'embedding_dim': 32, 'lr': 0.0003834700215967704, 'lambda_val': 5.148126115320708e-06, 'batch_size': 3981, 'optimizer': 'SGD'}.
2026-06-06 10:26:27,299 - optuna.study.study - INFO - Trial 223 finished with values: [0.07078495504140317, 0.009364324469153997, 0.03773765716170898] and parameters: {'n_layers': 1, 'embedding_dim': 64, 'lr': 0.0006711529294623438, 'lambda_val': 0.003010182335575881, 'batch_size': 3765, 'optimizer': 'RMSprop'}.
2026-06-06 10:29:23,790 - optuna.study.study - INFO - Trial 224 finished with values: [0.08402686174672694, 0.010287025252863553, 0.04353586068233753] and parameters: {'n_layers': 2, 'embedding_dim': 128, 'lr': 0.0006810282647636203, 'lambda_val': 4.2735070605297645e-06, 'batch_size': 2873, 'optimizer': 'Adam'}.
2026-06-06 10:30:41,481 - experiment_functions - INFO - Early stopping at epoch 1750. Best Metrics: (0.07046651269009319, 0.00867439212271418, 0.036030930211684783)
2026-06-06 10:30:41,737 - optuna.study.study - INFO - Trial 225 finished with values: [0.07046651269009319, 0.00867439212271418, 0.036030930211684783] and parameters: {'n_layers': 2, 'embedding_dim': 128, 'lr': 0.0006711529294623438, 'lambda_val': 0.0016696163443190065, 'batch_size': 2384, 'optimizer': 'RMSprop'}.
2026-06-06 10:31:26,376 - experiment_functions - INFO - Early stopping at epoch 850. Best Metrics: (0.07496413974807008, 0.009156674927992499, 0.037992923830721635)
2026-06-06 10:31:26,565 - optuna.study.study - INFO - Trial 226 finished with values: [0.07496413974807008, 0.009156674927992499, 0.037992923830721635] and parameters: {'n_layers': 2, 'embedding_dim': 256, 'lr': 0.0016789844014982978, 'lambda_val': 5.510107267630662e-06, 'batch_size': 2873, 'optimizer': 'Adam'}.
2026-06-06 10:32:07,338 - experiment_functions - INFO - Early stopping at epoch 1050. Best Metrics: (0.013012489671874045, 0.0017817670306115615, 0.0064191501556803785)
2026-06-06 10:32:07,912 - optuna.study.study - INFO - Trial 227 finished with values: [0.013012489671874045, 0.0017817670306115615, 0.0064191501556803785] and parameters: {'n_layers': 1, 'embedding_dim': 32, 'lr': 0.028140344836785097, 'lambda_val': 3.182875913831637e-06, 'batch_size': 3209, 'optimizer': 'RMSprop'}.
2026-06-06 10:35:41,559 - experiment_functions - INFO - Early stopping at epoch 3950. Best Metrics: (0.04956627395573675, 0.005566347377587246, 0.022489424989079056)
2026-06-06 10:35:41,810 - optuna.study.study - INFO - Trial 228 finished with values: [0.04956627395573675, 0.005566347377587246, 0.022489424989079056] and parameters: {'n_layers': 3, 'embedding_dim': 256, 'lr': 0.002124781352620552, 'lambda_val': 1.3398416216824042e-06, 'batch_size': 3867, 'optimizer': 'RMSprop'}.
2026-06-06 10:37:12,832 - experiment_functions - INFO - Early stopping at epoch 1950. Best Metrics: (0.07028174449155297, 0.008516980373769174, 0.03598497979704961)
2026-06-06 10:37:13,188 - optuna.study.study - INFO - Trial 229 finished with values: [0.07028174449155297, 0.008516980373769174, 0.03598497979704961] and parameters: {'n_layers': 3, 'embedding_dim': 128, 'lr': 0.0006711529294623438, 'lambda_val': 3.456741724473969e-06, 'batch_size': 2384, 'optimizer': 'RMSprop'}.
2026-06-06 10:38:00,359 - experiment_functions - INFO - Early stopping at epoch 1050. Best Metrics: (0.00030768930282471505, 5.526157143814053e-05, 0.0001536652349808695)
2026-06-06 10:38:00,449 - optuna.study.study - INFO - Trial 230 finished with values: [0.00030768930282471505, 5.526157143814053e-05, 0.0001536652349808695] and parameters: {'n_layers': 1, 'embedding_dim': 256, 'lr': 1.888639777914307e-05, 'lambda_val': 1.2176798127435423e-06, 'batch_size': 2384, 'optimizer': 'RMSprop'}.
2026-06-06 10:41:56,930 - optuna.study.study - INFO - Trial 231 finished with values: [0.061590379481463155, 0.0076579141268671705, 0.032376284086307903] and parameters: {'n_layers': 4, 'embedding_dim': 256, 'lr': 0.00021389021150995766, 'lambda_val': 1.3398416216824042e-06, 'batch_size': 3867, 'optimizer': 'RMSprop'}.
2026-06-06 10:42:38,815 - experiment_functions - INFO - Early stopping at epoch 1000. Best Metrics: (0.0005497269611478766, 8.372965369415234e-05, 0.0002744554793435558)
2026-06-06 10:42:38,918 - optuna.study.study - INFO - Trial 232 finished with values: [0.0005497269611478766, 8.372965369415234e-05, 0.0002744554793435558] and parameters: {'n_layers': 1, 'embedding_dim': 128, 'lr': 3.9133556352491217e-05, 'lambda_val': 4.2735070605297645e-06, 'batch_size': 3082, 'optimizer': 'Adam'}.
2026-06-06 10:43:18,457 - experiment_functions - INFO - Early stopping at epoch 950. Best Metrics: (0.034910117661253105, 0.004246768035367406, 0.016332119222546407)
2026-06-06 10:43:18,764 - optuna.study.study - INFO - Trial 233 finished with values: [0.034910117661253105, 0.004246768035367406, 0.016332119222546407] and parameters: {'n_layers': 4, 'embedding_dim': 32, 'lr': 0.0017827212934439936, 'lambda_val': 1.3805674552011148e-05, 'batch_size': 3529, 'optimizer': 'RMSprop'}.
2026-06-06 10:44:59,738 - experiment_functions - INFO - Early stopping at epoch 2450. Best Metrics: (0.027556137304816996, 0.0033441623685444436, 0.01234081694328467)
2026-06-06 10:44:59,815 - optuna.study.study - INFO - Trial 234 finished with values: [0.027556137304816996, 0.0033441623685444436, 0.01234081694328467] and parameters: {'n_layers': 2, 'embedding_dim': 96, 'lr': 0.014584310589117884, 'lambda_val': 0.003010182335575881, 'batch_size': 2384, 'optimizer': 'RMSprop'}.
2026-06-06 10:47:35,915 - optuna.study.study - INFO - Trial 235 finished with values: [0.08535775586666686, 0.010543237993167661, 0.04673159902401638] and parameters: {'n_layers': 1, 'embedding_dim': 32, 'lr': 0.0019509035141199726, 'lambda_val': 1.3036977819163817e-06, 'batch_size': 1712, 'optimizer': 'Adam'}.
2026-06-06 10:48:59,514 - experiment_functions - INFO - Early stopping at epoch 1950. Best Metrics: (0.0885773893157686, 0.010511420724763883, 0.044739537379383625)
2026-06-06 10:49:00,084 - optuna.study.study - INFO - Trial 236 finished with values: [0.0885773893157686, 0.010511420724763883, 0.044739537379383625] and parameters: {'n_layers': 1, 'embedding_dim': 128, 'lr': 0.0019509035141199726, 'lambda_val': 3.456741724473969e-06, 'batch_size': 2384, 'optimizer': 'RMSprop'}.
2026-06-06 10:50:01,458 - experiment_functions - INFO - Early stopping at epoch 1450. Best Metrics: (0.08831006095212453, 0.010883180387165918, 0.046713045509734805)
2026-06-06 10:50:01,588 - optuna.study.study - INFO - Trial 237 finished with values: [0.08831006095212453, 0.010883180387165918, 0.046713045509734805] and parameters: {'n_layers': 1, 'embedding_dim': 96, 'lr': 0.0019509035141199726, 'lambda_val': 4.2735070605297645e-06, 'batch_size': 3866, 'optimizer': 'Adam'}.
2026-06-06 10:52:30,548 - optuna.study.study - INFO - Trial 238 finished with values: [0.019976034256527917, 0.0031197668966441157, 0.011472883614661767] and parameters: {'n_layers': 1, 'embedding_dim': 32, 'lr': 0.0006711529294623438, 'lambda_val': 5.148126115320708e-06, 'batch_size': 1122, 'optimizer': 'Adam'}.
2026-06-06 10:52:51,197 - experiment_functions - INFO - Early stopping at epoch 500. Best Metrics: (0.0006940675494748105, 8.038046754638622e-05, 0.0002981823712645871)
2026-06-06 10:52:51,499 - optuna.study.study - INFO - Trial 239 finished with values: [0.0006940675494748105, 8.038046754638622e-05, 0.0002981823712645871] and parameters: {'n_layers': 1, 'embedding_dim': 32, 'lr': 0.0017827212934439936, 'lambda_val': 0.0016696163443190065, 'batch_size': 3866, 'optimizer': 'SGD'}.
2026-06-06 10:55:27,403 - optuna.study.study - INFO - Trial 240 finished with values: [0.07856182594024344, 0.010035836291781097, 0.043178489429730536] and parameters: {'n_layers': 1, 'embedding_dim': 32, 'lr': 0.0019509035141199726, 'lambda_val': 3.456741724473969e-06, 'batch_size': 826, 'optimizer': 'Adam'}.
2026-06-06 10:57:32,185 - experiment_functions - INFO - Early stopping at epoch 3150. Best Metrics: (0.08362363556099948, 0.010099470828588652, 0.04326081348976443)
2026-06-06 10:57:32,339 - optuna.study.study - INFO - Trial 241 finished with values: [0.08362363556099948, 0.010099470828588652, 0.04326081348976443] and parameters: {'n_layers': 1, 'embedding_dim': 32, 'lr': 0.0019509035141199726, 'lambda_val': 1.3036977819163817e-06, 'batch_size': 3866, 'optimizer': 'Adam'}.
2026-06-06 10:59:12,845 - experiment_functions - INFO - Early stopping at epoch 2350. Best Metrics: (0.09209484236011516, 0.01120805144349923, 0.04857035753027498)
2026-06-06 10:59:12,933 - optuna.study.study - INFO - Trial 242 finished with values: [0.09209484236011516, 0.01120805144349923, 0.04857035753027498] and parameters: {'n_layers': 1, 'embedding_dim': 128, 'lr': 0.0018430978876726675, 'lambda_val': 5.510107267630662e-06, 'batch_size': 2384, 'optimizer': 'Adam'}.
2026-06-06 10:59:44,138 - experiment_functions - INFO - Early stopping at epoch 750. Best Metrics: (0.07021933767753331, 0.008771518520999397, 0.03639128256534456)
2026-06-06 10:59:44,221 - optuna.study.study - INFO - Trial 243 finished with values: [0.07021933767753331, 0.008771518520999397, 0.03639128256534456] and parameters: {'n_layers': 1, 'embedding_dim': 32, 'lr': 0.005828487948467767, 'lambda_val': 5.148126115320708e-06, 'batch_size': 3359, 'optimizer': 'Adam'}.
2026-06-06 11:02:34,445 - optuna.study.study - INFO - Trial 244 finished with values: [0.03133734362865755, 0.004657043338468753, 0.017968568009028005] and parameters: {'n_layers': 2, 'embedding_dim': 128, 'lr': 0.0003707764999310482, 'lambda_val': 1.9181328945787323e-06, 'batch_size': 675, 'optimizer': 'RMSprop'}.
2026-06-06 11:03:11,616 - experiment_functions - INFO - Early stopping at epoch 800. Best Metrics: (0.005005216259855972, 0.0008322727577198742, 0.0026537322592992954)
2026-06-06 11:03:11,730 - optuna.study.study - INFO - Trial 245 finished with values: [0.005005216259855972, 0.0008322727577198742, 0.0026537322592992954] and parameters: {'n_layers': 1, 'embedding_dim': 256, 'lr': 0.08971910178614198, 'lambda_val': 1.3398416216824042e-06, 'batch_size': 2384, 'optimizer': 'RMSprop'}.
2026-06-06 11:03:33,890 - experiment_functions - INFO - Early stopping at epoch 500. Best Metrics: (0.0004804135972012347, 7.870587447250318e-05, 0.0002672511363179384)
2026-06-06 11:03:35,064 - optuna.study.study - INFO - Trial 246 finished with values: [0.0004804135972012347, 7.870587447250318e-05, 0.0002672511363179384] and parameters: {'n_layers': 2, 'embedding_dim': 96, 'lr': 0.0012134818761443643, 'lambda_val': 5.148126115320708e-06, 'batch_size': 2384, 'optimizer': 'SGD'}.
2026-06-06 11:06:21,882 - optuna.study.study - INFO - Trial 247 finished with values: [0.07601269056623229, 0.010099470828588655, 0.041748750000009355] and parameters: {'n_layers': 1, 'embedding_dim': 128, 'lr': 0.0006711529294623438, 'lambda_val': 5.148126115320708e-06, 'batch_size': 3359, 'optimizer': 'Adam'}.
2026-06-06 11:09:27,141 - optuna.study.study - INFO - Trial 248 finished with values: [0.07013312680437261, 0.00873970125259562, 0.037883924698259575] and parameters: {'n_layers': 3, 'embedding_dim': 128, 'lr': 0.00033582122517218145, 'lambda_val': 4.2735070605297645e-06, 'batch_size': 2384, 'optimizer': 'RMSprop'}.
2026-06-06 11:10:06,462 - experiment_functions - INFO - Early stopping at epoch 900. Best Metrics: (0.046809335477980066, 0.005470895572375913, 0.022203116108175817)
2026-06-06 11:10:06,685 - optuna.study.study - INFO - Trial 249 finished with values: [0.046809335477980066, 0.005470895572375913, 0.022203116108175817] and parameters: {'n_layers': 3, 'embedding_dim': 64, 'lr': 0.0019509035141199726, 'lambda_val': 4.2735070605297645e-06, 'batch_size': 3959, 'optimizer': 'RMSprop'}.
2026-06-06 11:13:01,800 - optuna.study.study - INFO - Trial 250 finished with values: [0.07870179726420728, 0.009694219304708956, 0.042595923048838885] and parameters: {'n_layers': 2, 'embedding_dim': 128, 'lr': 0.0006711529294623438, 'lambda_val': 3.996555780966423e-06, 'batch_size': 1237, 'optimizer': 'RMSprop'}.
2026-06-06 11:13:48,977 - experiment_functions - INFO - Early stopping at epoch 900. Best Metrics: (0.07473110219385846, 0.00910308794962824, 0.03817360510288514)
2026-06-06 11:13:49,054 - optuna.study.study - INFO - Trial 251 finished with values: [0.07473110219385846, 0.00910308794962824, 0.03817360510288514] and parameters: {'n_layers': 2, 'embedding_dim': 256, 'lr': 0.0019509035141199726, 'lambda_val': 1.2176798127435423e-06, 'batch_size': 1712, 'optimizer': 'Adam'}.
2026-06-06 11:16:11,243 - experiment_functions - INFO - Early stopping at epoch 3500. Best Metrics: (0.086940545626318, 0.010399222988813718, 0.04537283586992229)
2026-06-06 11:16:11,357 - optuna.study.study - INFO - Trial 252 finished with values: [0.086940545626318, 0.010399222988813718, 0.04537283586992229] and parameters: {'n_layers': 1, 'embedding_dim': 32, 'lr': 0.0019509035141199726, 'lambda_val': 4.2735070605297645e-06, 'batch_size': 3866, 'optimizer': 'Adam'}.
2026-06-06 11:16:58,523 - experiment_functions - INFO - Early stopping at epoch 900. Best Metrics: (0.07547837342223213, 0.00907461986737223, 0.03787217101554689)
2026-06-06 11:16:58,618 - optuna.study.study - INFO - Trial 253 finished with values: [0.07547837342223213, 0.00907461986737223, 0.03787217101554689] and parameters: {'n_layers': 2, 'embedding_dim': 256, 'lr': 0.0019509035141199726, 'lambda_val': 5.148126115320708e-06, 'batch_size': 1712, 'optimizer': 'Adam'}.
2026-06-06 11:17:28,305 - experiment_functions - INFO - Early stopping at epoch 700. Best Metrics: (0.0406959041178656, 0.0053017616719137255, 0.019234627490214037)
2026-06-06 11:17:28,394 - optuna.study.study - INFO - Trial 254 finished with values: [0.0406959041178656, 0.0053017616719137255, 0.019234627490214037] and parameters: {'n_layers': 1, 'embedding_dim': 96, 'lr': 0.0022202597527126652, 'lambda_val': 0.023986184535980188, 'batch_size': 4051, 'optimizer': 'RMSprop'}.
2026-06-06 11:19:48,907 - experiment_functions - INFO - Early stopping at epoch 3500. Best Metrics: (0.09103842020785773, 0.010931743586308528, 0.047003280486986175)
2026-06-06 11:19:49,045 - optuna.study.study - INFO - Trial 255 finished with values: [0.09103842020785773, 0.010931743586308528, 0.047003280486986175] and parameters: {'n_layers': 1, 'embedding_dim': 64, 'lr': 0.0019509035141199726, 'lambda_val': 1.3036977819163817e-06, 'batch_size': 2384, 'optimizer': 'RMSprop'}.
2026-06-06 11:22:43,922 - optuna.study.study - INFO - Trial 256 finished with values: [0.08241121291539959, 0.010017415767968383, 0.04382355292644403] and parameters: {'n_layers': 2, 'embedding_dim': 128, 'lr': 0.0006711529294623438, 'lambda_val': 5.510107267630662e-06, 'batch_size': 1842, 'optimizer': 'RMSprop'}.
2026-06-06 11:25:19,757 - optuna.study.study - INFO - Trial 257 finished with values: [0.08516635951773263, 0.010487976421729519, 0.046258713166927284] and parameters: {'n_layers': 1, 'embedding_dim': 32, 'lr': 0.0019509035141199726, 'lambda_val': 1.3036977819163817e-06, 'batch_size': 2384, 'optimizer': 'Adam'}.
2026-06-06 11:25:54,242 - experiment_functions - INFO - Early stopping at epoch 900. Best Metrics: (0.0037264620935598507, 0.0006028535065978968, 0.0019167622503402449)
2026-06-06 11:25:54,934 - optuna.study.study - INFO - Trial 258 finished with values: [0.0037264620935598507, 0.0006028535065978968, 0.0019167622503402449] and parameters: {'n_layers': 1, 'embedding_dim': 32, 'lr': 0.07756674586335899, 'lambda_val': 0.00017333332833642938, 'batch_size': 1614, 'optimizer': 'RMSprop'}.
2026-06-06 11:28:30,219 - optuna.study.study - INFO - Trial 259 finished with values: [0.08767367179318739, 0.010610221716122982, 0.046842227456966964] and parameters: {'n_layers': 1, 'embedding_dim': 32, 'lr': 0.0019509035141199726, 'lambda_val': 4.2735070605297645e-06, 'batch_size': 2262, 'optimizer': 'Adam'}.
2026-06-06 11:31:11,526 - optuna.study.study - INFO - Trial 260 finished with values: [0.03796765727056137, 0.004807756715118227, 0.017666018819635004] and parameters: {'n_layers': 1, 'embedding_dim': 128, 'lr': 0.03533170963751645, 'lambda_val': 0.0006603606000578724, 'batch_size': 2384, 'optimizer': 'RMSprop'}.
2026-06-06 11:33:47,879 - optuna.study.study - INFO - Trial 261 finished with values: [0.037645316998630454, 0.005618259762877621, 0.022627337473132496] and parameters: {'n_layers': 1, 'embedding_dim': 96, 'lr': 0.0005278478256568082, 'lambda_val': 8.198950044762925e-06, 'batch_size': 1696, 'optimizer': 'RMSprop'}.
2026-06-06 11:35:17,180 - experiment_functions - INFO - Early stopping at epoch 2100. Best Metrics: (0.09382105333021493, 0.011367137785518119, 0.049519158114282175)
2026-06-06 11:35:17,620 - optuna.study.study - INFO - Trial 262 finished with values: [0.09382105333021493, 0.011367137785518119, 0.049519158114282175] and parameters: {'n_layers': 1, 'embedding_dim': 128, 'lr': 0.0017827212934439936, 'lambda_val': 5.148126115320708e-06, 'batch_size': 2873, 'optimizer': 'Adam'}.
