2026-06-05 22:07:49,501 - optuna.study.study - INFO - Trial 54 finished with values: [0.06705897901626373, 0.008106705070667828, 0.03373759432836242] and parameters: {'n_layers': 3, 'embedding_dim': 128, 'lr': 0.0005984874691553314, 'lambda_val': 1.0229781127321935e-05, 'batch_size': 3853, 'optimizer': 'RMSprop'}.
2026-06-05 22:08:11,658 - experiment_functions - INFO - Early stopping at epoch 500. Best Metrics: (0.0005717510361550977, 7.368209525085404e-05, 0.00022481819073997517)
2026-06-05 22:08:11,954 - optuna.study.study - INFO - Trial 55 finished with values: [0.0005717510361550977, 7.368209525085404e-05, 0.00022481819073997517] and parameters: {'n_layers': 2, 'embedding_dim': 96, 'lr': 0.004592049638216867, 'lambda_val': 0.08735890070057756, 'batch_size': 1890, 'optimizer': 'SGD'}.
2026-06-05 22:08:32,166 - experiment_functions - INFO - Early stopping at epoch 500. Best Metrics: (0.0005869505845794142, 0.00010382477058074887, 0.0002946797065050139)
2026-06-05 22:08:32,544 - optuna.study.study - INFO - Trial 56 finished with values: [0.0005869505845794142, 0.00010382477058074887, 0.0002946797065050139] and parameters: {'n_layers': 1, 'embedding_dim': 32, 'lr': 0.02294708289231678, 'lambda_val': 1.5181406065711707e-06, 'batch_size': 980, 'optimizer': 'SGD'}.
2026-06-05 22:09:06,497 - experiment_functions - INFO - Early stopping at epoch 600. Best Metrics: (0.03762382786478612, 0.0046118293254739096, 0.017848189195871857)
2026-06-05 22:09:06,784 - optuna.study.study - INFO - Trial 57 finished with values: [0.03762382786478612, 0.0046118293254739096, 0.017848189195871857] and parameters: {'n_layers': 4, 'embedding_dim': 128, 'lr': 0.0030777772444340735, 'lambda_val': 7.4032238942432714e-06, 'batch_size': 2610, 'optimizer': 'Adam'}.
2026-06-05 22:09:28,458 - experiment_functions - INFO - Early stopping at epoch 500. Best Metrics: (0.0003494378637842324, 4.856319914260835e-05, 0.0001641728106250721)
2026-06-05 22:09:28,752 - optuna.study.study - INFO - Trial 58 finished with values: [0.0003494378637842324, 4.856319914260835e-05, 0.0001641728106250721] and parameters: {'n_layers': 3, 'embedding_dim': 64, 'lr': 1.4842010598937153e-05, 'lambda_val': 0.014684902608016642, 'batch_size': 825, 'optimizer': 'Adam'}.
2026-06-05 22:12:47,536 - optuna.study.study - INFO - Trial 59 finished with values: [0.08214579657283329, 0.010076026525554291, 0.04472750446245052] and parameters: {'n_layers': 2, 'embedding_dim': 256, 'lr': 0.0006492139755404522, 'lambda_val': 9.945068556655057e-06, 'batch_size': 1266, 'optimizer': 'Adam'}.
2026-06-05 22:13:40,448 - experiment_functions - INFO - Early stopping at epoch 1300. Best Metrics: (0.08015227050198963, 0.009545180521133364, 0.041493299425735646)
2026-06-05 22:13:40,590 - optuna.study.study - INFO - Trial 60 finished with values: [0.08015227050198963, 0.009545180521133364, 0.041493299425735646] and parameters: {'n_layers': 1, 'embedding_dim': 64, 'lr': 0.0025949620955328543, 'lambda_val': 1.9645451789230886e-06, 'batch_size': 3427, 'optimizer': 'RMSprop'}.
2026-06-05 22:14:03,544 - experiment_functions - INFO - Early stopping at epoch 500. Best Metrics: (0.0005587641499499828, 8.707883984191842e-05, 0.00028213104644365163)
2026-06-05 22:14:03,652 - optuna.study.study - INFO - Trial 61 finished with values: [0.0005587641499499828, 8.707883984191842e-05, 0.00028213104644365163] and parameters: {'n_layers': 1, 'embedding_dim': 256, 'lr': 0.00015153149181335385, 'lambda_val': 0.015361046335908908, 'batch_size': 1933, 'optimizer': 'SGD'}.
2026-06-05 22:16:40,709 - optuna.study.study - INFO - Trial 62 finished with values: [0.03555875458353484, 0.004332172282135442, 0.017129156381561518] and parameters: {'n_layers': 4, 'embedding_dim': 32, 'lr': 0.0025949620955328543, 'lambda_val': 1.9645451789230886e-06, 'batch_size': 614, 'optimizer': 'RMSprop'}.
2026-06-05 22:20:14,846 - optuna.study.study - INFO - Trial 63 finished with values: [0.012257929663927069, 0.0019609484895170477, 0.0061657953633079176] and parameters: {'n_layers': 3, 'embedding_dim': 256, 'lr': 0.00015153149181335385, 'lambda_val': 0.015361046335908908, 'batch_size': 2853, 'optimizer': 'Adam'}.
2026-06-05 22:23:48,615 - optuna.study.study - INFO - Trial 64 finished with values: [0.027163630686295508, 0.003880032152187019, 0.014683365296357376] and parameters: {'n_layers': 3, 'embedding_dim': 256, 'lr': 0.00013024236477514111, 'lambda_val': 0.0005926907818137016, 'batch_size': 3708, 'optimizer': 'RMSprop'}.
2026-06-05 22:25:06,677 - experiment_functions - INFO - Early stopping at epoch 1600. Best Metrics: (0.04724384440119746, 0.005631656507468685, 0.022448689475534304)
2026-06-05 22:25:06,749 - optuna.study.study - INFO - Trial 65 finished with values: [0.04724384440119746, 0.005631656507468685, 0.022448689475534304] and parameters: {'n_layers': 4, 'embedding_dim': 128, 'lr': 0.0011525517839870857, 'lambda_val': 1.0229781127321935e-05, 'batch_size': 752, 'optimizer': 'Adam'}.
2026-06-05 22:25:35,839 - experiment_functions - INFO - Early stopping at epoch 650. Best Metrics: (0.0006801236630437433, 0.0001038247705807489, 0.0003293436167789901)
2026-06-05 22:25:36,499 - optuna.study.study - INFO - Trial 66 finished with values: [0.0006801236630437433, 0.0001038247705807489, 0.0003293436167789901] and parameters: {'n_layers': 2, 'embedding_dim': 128, 'lr': 4.826459371467508e-05, 'lambda_val': 6.711434296264996e-05, 'batch_size': 3000, 'optimizer': 'RMSprop'}.
2026-06-05 22:26:32,768 - experiment_functions - INFO - Early stopping at epoch 1300. Best Metrics: (0.033133978941676, 0.0038934288967780828, 0.015310563460446572)
2026-06-05 22:26:32,863 - optuna.study.study - INFO - Trial 67 finished with values: [0.033133978941676, 0.0038934288967780828, 0.015310563460446572] and parameters: {'n_layers': 4, 'embedding_dim': 64, 'lr': 0.003797813989642158, 'lambda_val': 1.2264285179082735e-06, 'batch_size': 3516, 'optimizer': 'RMSprop'}.
2026-06-05 22:29:16,967 - experiment_functions - INFO - Early stopping at epoch 3750. Best Metrics: (0.0006024340294244497, 8.707883984191842e-05, 0.00023481136495430506)
2026-06-05 22:29:17,115 - optuna.study.study - INFO - Trial 68 finished with values: [0.0006024340294244497, 8.707883984191842e-05, 0.00023481136495430506] and parameters: {'n_layers': 3, 'embedding_dim': 128, 'lr': 4.6639704209928806e-05, 'lambda_val': 0.0011529228679437466, 'batch_size': 3800, 'optimizer': 'RMSprop'}.
2026-06-05 22:32:04,016 - optuna.study.study - INFO - Trial 69 finished with values: [0.033268022489953204, 0.003935293723625159, 0.01544776566053855] and parameters: {'n_layers': 4, 'embedding_dim': 64, 'lr': 0.003797813989642158, 'lambda_val': 6.711434296264996e-05, 'batch_size': 1338, 'optimizer': 'RMSprop'}.
2026-06-05 22:33:37,270 - experiment_functions - INFO - Early stopping at epoch 2200. Best Metrics: (0.023402253047066522, 0.0027295867104293655, 0.01033008380980745)
2026-06-05 22:33:37,380 - optuna.study.study - INFO - Trial 70 finished with values: [0.023402253047066522, 0.0027295867104293655, 0.01033008380980745] and parameters: {'n_layers': 4, 'embedding_dim': 64, 'lr': 0.039131791946535856, 'lambda_val': 0.001677222142016489, 'batch_size': 2697, 'optimizer': 'RMSprop'}.
2026-06-05 22:34:22,131 - experiment_functions - INFO - Early stopping at epoch 900. Best Metrics: (0.05110613878897311, 0.006077098265121576, 0.02432898442283779)
2026-06-05 22:34:22,215 - optuna.study.study - INFO - Trial 71 finished with values: [0.05110613878897311, 0.006077098265121576, 0.02432898442283779] and parameters: {'n_layers': 4, 'embedding_dim': 128, 'lr': 0.001215155494326517, 'lambda_val': 2.1613015030781435e-06, 'batch_size': 2713, 'optimizer': 'Adam'}.
2026-06-05 22:35:56,180 - experiment_functions - INFO - Early stopping at epoch 1950. Best Metrics: (0.0006297699734305005, 9.37772121374506e-05, 0.0003053837965366324)
2026-06-05 22:35:56,549 - optuna.study.study - INFO - Trial 72 finished with values: [0.0006297699734305005, 9.37772121374506e-05, 0.0003053837965366324] and parameters: {'n_layers': 2, 'embedding_dim': 256, 'lr': 1.296794509017157e-05, 'lambda_val': 7.604146676190024e-06, 'batch_size': 2889, 'optimizer': 'Adam'}.
2026-06-05 22:36:21,232 - experiment_functions - INFO - Early stopping at epoch 500. Best Metrics: (0.0004260337524893466, 6.363453680755577e-05, 0.00020117613026671532)
2026-06-05 22:36:21,336 - optuna.study.study - INFO - Trial 73 finished with values: [0.0004260337524893466, 6.363453680755577e-05, 0.00020117613026671532] and parameters: {'n_layers': 4, 'embedding_dim': 128, 'lr': 4.6639704209928806e-05, 'lambda_val': 0.02060137970823099, 'batch_size': 3387, 'optimizer': 'SGD'}.
2026-06-05 22:36:42,874 - experiment_functions - INFO - Early stopping at epoch 500. Best Metrics: (0.0004641918720530123, 8.540424676803538e-05, 0.00020764307318168443)
2026-06-05 22:36:42,962 - optuna.study.study - INFO - Trial 74 finished with values: [0.0004641918720530123, 8.540424676803538e-05, 0.00020764307318168443] and parameters: {'n_layers': 2, 'embedding_dim': 96, 'lr': 0.0008375189225934038, 'lambda_val': 1.482563488933184e-06, 'batch_size': 2924, 'optimizer': 'SGD'}.
2026-06-05 22:37:47,717 - experiment_functions - INFO - Early stopping at epoch 1750. Best Metrics: (0.00045773828402217895, 8.372965369415233e-05, 0.0002389717593304175)
2026-06-05 22:37:48,484 - optuna.study.study - INFO - Trial 75 finished with values: [0.00045773828402217895, 8.372965369415233e-05, 0.0002389717593304175] and parameters: {'n_layers': 1, 'embedding_dim': 64, 'lr': 0.0001336135869313187, 'lambda_val': 5.314912869017192e-05, 'batch_size': 1841, 'optimizer': 'RMSprop'}.
2026-06-05 22:38:08,932 - experiment_functions - INFO - Early stopping at epoch 500. Best Metrics: (0.0004573709189840554, 6.530912988143881e-05, 0.0002181955804445071)
2026-06-05 22:38:09,787 - optuna.study.study - INFO - Trial 76 finished with values: [0.0004573709189840554, 6.530912988143881e-05, 0.0002181955804445071] and parameters: {'n_layers': 3, 'embedding_dim': 32, 'lr': 0.006817751326171378, 'lambda_val': 0.0002470779691093862, 'batch_size': 755, 'optimizer': 'SGD'}.
2026-06-05 22:38:30,613 - experiment_functions - INFO - Early stopping at epoch 500. Best Metrics: (0.0004941497400321697, 7.53566883247371e-05, 0.0002206042297600934)
2026-06-05 22:38:31,473 - optuna.study.study - INFO - Trial 77 finished with values: [0.0004941497400321697, 7.53566883247371e-05, 0.0002206042297600934] and parameters: {'n_layers': 4, 'embedding_dim': 32, 'lr': 0.0014400532960571737, 'lambda_val': 2.003454584524342e-06, 'batch_size': 755, 'optimizer': 'SGD'}.
2026-06-05 22:39:02,456 - experiment_functions - INFO - Early stopping at epoch 500. Best Metrics: (0.020815984179222192, 0.0023846205372094584, 0.009981892958804483)
2026-06-05 22:39:02,973 - optuna.study.study - INFO - Trial 78 finished with values: [0.020815984179222192, 0.0023846205372094584, 0.009981892958804483] and parameters: {'n_layers': 4, 'embedding_dim': 256, 'lr': 0.039131791946535856, 'lambda_val': 0.001677222142016489, 'batch_size': 2697, 'optimizer': 'RMSprop'}.
2026-06-05 22:39:31,116 - experiment_functions - INFO - Early stopping at epoch 650. Best Metrics: (0.07006122739745453, 0.008977493469087012, 0.036841897418216384)
2026-06-05 22:39:31,189 - optuna.study.study - INFO - Trial 79 finished with values: [0.07006122739745453, 0.008977493469087012, 0.036841897418216384] and parameters: {'n_layers': 1, 'embedding_dim': 96, 'lr': 0.007650229911234196, 'lambda_val': 2.80429275845163e-06, 'batch_size': 2901, 'optimizer': 'Adam'}.
2026-06-05 22:42:08,947 - optuna.study.study - INFO - Trial 80 finished with values: [0.0036811319808193435, 0.00072007502176971, 0.002067286435830162] and parameters: {'n_layers': 2, 'embedding_dim': 96, 'lr': 0.00023613231320873362, 'lambda_val': 7.4032238942432714e-06, 'batch_size': 1266, 'optimizer': 'Adam'}.
2026-06-05 22:42:45,511 - experiment_functions - INFO - Early stopping at epoch 700. Best Metrics: (0.04845193302315008, 0.005768973139527095, 0.022367190031195854)
2026-06-05 22:42:45,594 - optuna.study.study - INFO - Trial 81 finished with values: [0.04845193302315008, 0.005768973139527095, 0.022367190031195854] and parameters: {'n_layers': 2, 'embedding_dim': 256, 'lr': 0.0030777772444340735, 'lambda_val': 0.00191214395764258, 'batch_size': 1266, 'optimizer': 'Adam'}.
2026-06-05 22:43:54,298 - experiment_functions - INFO - Early stopping at epoch 1500. Best Metrics: (0.06805865765801385, 0.007885658784915265, 0.03284286356496917)
2026-06-05 22:43:54,624 - optuna.study.study - INFO - Trial 82 finished with values: [0.06805865765801385, 0.007885658784915265, 0.03284286356496917] and parameters: {'n_layers': 1, 'embedding_dim': 256, 'lr': 0.003797813989642158, 'lambda_val': 1.2264285179082735e-06, 'batch_size': 4018, 'optimizer': 'RMSprop'}.
2026-06-05 22:46:57,553 - optuna.study.study - INFO - Trial 83 finished with values: [0.0013031746803234571, 0.00018587983120101818, 0.0005931905181574507] and parameters: {'n_layers': 4, 'embedding_dim': 128, 'lr': 9.4734286564571e-05, 'lambda_val': 0.0012039889610296177, 'batch_size': 986, 'optimizer': 'Adam'}.
2026-06-05 22:49:55,778 - optuna.study.study - INFO - Trial 84 finished with values: [0.05909074061258513, 0.007579208252394668, 0.029212680265038295] and parameters: {'n_layers': 1, 'embedding_dim': 256, 'lr': 0.0006492139755404522, 'lambda_val': 0.01286797222463573, 'batch_size': 2901, 'optimizer': 'Adam'}.
2026-06-05 22:51:48,878 - experiment_functions - INFO - Early stopping at epoch 2500. Best Metrics: (0.05457338144259531, 0.00660124589724697, 0.02666967767532009)
2026-06-05 22:51:48,965 - optuna.study.study - INFO - Trial 85 finished with values: [0.05457338144259531, 0.00660124589724697, 0.02666967767532009] and parameters: {'n_layers': 4, 'embedding_dim': 96, 'lr': 0.0006492139755404522, 'lambda_val': 5.314912869017192e-05, 'batch_size': 2351, 'optimizer': 'RMSprop'}.
2026-06-05 22:52:32,679 - experiment_functions - INFO - Early stopping at epoch 900. Best Metrics: (0.014069844499578554, 0.0016645455154397483, 0.00639802060293289)
2026-06-05 22:52:33,210 - optuna.study.study - INFO - Trial 86 finished with values: [0.014069844499578554, 0.0016645455154397483, 0.00639802060293289] and parameters: {'n_layers': 4, 'embedding_dim': 128, 'lr': 0.0030777772444340735, 'lambda_val': 0.010004250247852628, 'batch_size': 755, 'optimizer': 'Adam'}.
2026-06-05 22:55:14,652 - optuna.study.study - INFO - Trial 87 finished with values: [0.052955283498497784, 0.007065108178712573, 0.028873741265846842] and parameters: {'n_layers': 2, 'embedding_dim': 64, 'lr': 0.00034607757694671775, 'lambda_val': 1.5838623830328296e-05, 'batch_size': 3533, 'optimizer': 'Adam'}.
2026-06-05 22:56:29,636 - experiment_functions - INFO - Early stopping at epoch 1250. Best Metrics: (0.04703679039177129, 0.005752227208788265, 0.02301837766321093)
2026-06-05 22:56:29,952 - optuna.study.study - INFO - Trial 88 finished with values: [0.04703679039177129, 0.005752227208788265, 0.02301837766321093] and parameters: {'n_layers': 4, 'embedding_dim': 256, 'lr': 0.0006492139755404522, 'lambda_val': 0.0012039889610296177, 'batch_size': 1920, 'optimizer': 'Adam'}.
2026-06-05 22:59:12,714 - optuna.study.study - INFO - Trial 89 finished with values: [0.08935325409797991, 0.010762609685846341, 0.04586989027715359] and parameters: {'n_layers': 1, 'embedding_dim': 96, 'lr': 0.0025949620955328543, 'lambda_val': 1.9645451789230886e-06, 'batch_size': 755, 'optimizer': 'Adam'}.
2026-06-05 23:01:56,344 - optuna.study.study - INFO - Trial 90 finished with values: [0.007728440879656223, 0.0013681425413624492, 0.003831449281650222] and parameters: {'n_layers': 4, 'embedding_dim': 64, 'lr': 0.00015153149181335385, 'lambda_val': 0.015361046335908908, 'batch_size': 1993, 'optimizer': 'RMSprop'}.
2026-06-05 23:04:46,855 - optuna.study.study - INFO - Trial 91 finished with values: [0.08760760537897537, 0.010677205439078302, 0.04716920055415267] and parameters: {'n_layers': 2, 'embedding_dim': 96, 'lr': 0.0008375189225934038, 'lambda_val': 1.482563488933184e-06, 'batch_size': 2005, 'optimizer': 'Adam'}.
2026-06-05 23:05:13,137 - experiment_functions - INFO - Early stopping at epoch 600. Best Metrics: (0.030389507693367238, 0.0038264451738227612, 0.01407885320711608)
2026-06-05 23:05:13,247 - optuna.study.study - INFO - Trial 92 finished with values: [0.030389507693367238, 0.0038264451738227612, 0.01407885320711608] and parameters: {'n_layers': 1, 'embedding_dim': 128, 'lr': 0.010355053602882436, 'lambda_val': 0.022494101952502732, 'batch_size': 3734, 'optimizer': 'Adam'}.
2026-06-05 23:05:40,436 - experiment_functions - INFO - Early stopping at epoch 550. Best Metrics: (0.02715870854568529, 0.003118092303570232, 0.012326267925642228)
2026-06-05 23:05:40,817 - optuna.study.study - INFO - Trial 93 finished with values: [0.02715870854568529, 0.003118092303570232, 0.012326267925642228] and parameters: {'n_layers': 4, 'embedding_dim': 96, 'lr': 0.016319289862143857, 'lambda_val': 0.0002470779691093862, 'batch_size': 2944, 'optimizer': 'Adam'}.
2026-06-05 23:06:08,150 - experiment_functions - INFO - Early stopping at epoch 600. Best Metrics: (0.0005849912885831668, 8.875343291580147e-05, 0.00030311077810995325)
2026-06-05 23:06:08,240 - optuna.study.study - INFO - Trial 94 finished with values: [0.0005849912885831668, 8.875343291580147e-05, 0.00030311077810995325] and parameters: {'n_layers': 3, 'embedding_dim': 96, 'lr': 1.4842010598937153e-05, 'lambda_val': 0.014684902608016642, 'batch_size': 3000, 'optimizer': 'RMSprop'}.
2026-06-05 23:06:42,610 - experiment_functions - INFO - Early stopping at epoch 850. Best Metrics: (0.0004979195338918038, 8.70788398419184e-05, 0.00022419198028681268)
2026-06-05 23:06:42,690 - optuna.study.study - INFO - Trial 95 finished with values: [0.0004979195338918038, 8.70788398419184e-05, 0.00022419198028681268] and parameters: {'n_layers': 4, 'embedding_dim': 32, 'lr': 1.4842010598937153e-05, 'lambda_val': 0.0002470779691093862, 'batch_size': 2189, 'optimizer': 'Adam'}.
2026-06-05 23:08:16,751 - experiment_functions - INFO - Early stopping at epoch 2200. Best Metrics: (0.050584785560724266, 0.005969924308393061, 0.025132328898816666)
2026-06-05 23:08:17,375 - optuna.study.study - INFO - Trial 96 finished with values: [0.050584785560724266, 0.005969924308393061, 0.025132328898816666] and parameters: {'n_layers': 4, 'embedding_dim': 64, 'lr': 0.0011525517839870857, 'lambda_val': 7.4032238942432714e-06, 'batch_size': 639, 'optimizer': 'Adam'}.
2026-06-05 23:08:43,842 - experiment_functions - INFO - Early stopping at epoch 600. Best Metrics: (0.025603122545596036, 0.0030008707883984196, 0.011256359714881545)
2026-06-05 23:08:44,240 - optuna.study.study - INFO - Trial 97 finished with values: [0.025603122545596036, 0.0030008707883984196, 0.011256359714881545] and parameters: {'n_layers': 2, 'embedding_dim': 96, 'lr': 0.008793986584879794, 'lambda_val': 0.008565798660646664, 'batch_size': 1906, 'optimizer': 'Adam'}.
2026-06-05 23:11:56,406 - optuna.study.study - INFO - Trial 98 finished with values: [0.00176769147377301, 0.00029137919485565004, 0.0008838621205271405] and parameters: {'n_layers': 2, 'embedding_dim': 256, 'lr': 0.00020900924353094014, 'lambda_val': 0.0015355688484034226, 'batch_size': 899, 'optimizer': 'Adam'}.
2026-06-05 23:12:30,709 - experiment_functions - INFO - Early stopping at epoch 550. Best Metrics: (0.02723586443491689, 0.0030812512559448054, 0.012341954891141968)
2026-06-05 23:12:31,016 - optuna.study.study - INFO - Trial 99 finished with values: [0.02723586443491689, 0.0030812512559448054, 0.012341954891141968] and parameters: {'n_layers': 4, 'embedding_dim': 256, 'lr': 0.08529103594261771, 'lambda_val': 7.057675938389195e-06, 'batch_size': 4020, 'optimizer': 'Adam'}.
2026-06-05 23:13:57,502 - experiment_functions - INFO - Early stopping at epoch 2100. Best Metrics: (0.08457201194854208, 0.010094447049367003, 0.0438172051605774)
2026-06-05 23:13:57,904 - optuna.study.study - INFO - Trial 100 finished with values: [0.08457201194854208, 0.010094447049367003, 0.0438172051605774] and parameters: {'n_layers': 1, 'embedding_dim': 96, 'lr': 0.0025949620955328543, 'lambda_val': 1.9645451789230886e-06, 'batch_size': 1487, 'optimizer': 'RMSprop'}.
2026-06-05 23:17:52,527 - optuna.study.study - INFO - Trial 101 finished with values: [0.044538017854465595, 0.005306785451135374, 0.020512302223088703] and parameters: {'n_layers': 4, 'embedding_dim': 256, 'lr': 0.0011525517839870857, 'lambda_val': 7.4032238942432714e-06, 'batch_size': 1487, 'optimizer': 'RMSprop'}.
2026-06-05 23:19:14,469 - experiment_functions - INFO - Early stopping at epoch 1750. Best Metrics: (0.09701170035058318, 0.011743921227141805, 0.050656239814640076)
2026-06-05 23:19:14,553 - optuna.study.study - INFO - Trial 102 finished with values: [0.09701170035058318, 0.011743921227141805, 0.050656239814640076] and parameters: {'n_layers': 1, 'embedding_dim': 256, 'lr': 0.0011525517839870857, 'lambda_val': 3.1920449116234754e-05, 'batch_size': 3853, 'optimizer': 'RMSprop'}.
2026-06-05 23:19:50,306 - experiment_functions - INFO - Early stopping at epoch 800. Best Metrics: (0.04017226299226996, 0.004948422533324402, 0.01931223386463147)
2026-06-05 23:19:50,396 - optuna.study.study - INFO - Trial 103 finished with values: [0.04017226299226996, 0.004948422533324402, 0.01931223386463147] and parameters: {'n_layers': 4, 'embedding_dim': 64, 'lr': 0.0014400532960571737, 'lambda_val': 2.80429275845163e-06, 'batch_size': 2901, 'optimizer': 'Adam'}.
2026-06-05 23:21:01,323 - experiment_functions - INFO - Early stopping at epoch 1550. Best Metrics: (0.03473363892592861, 0.004000602853506598, 0.01596402037348585)
