2026-06-03 06:07:06,364 - optuna.study.study - INFO - Trial 146 finished with values: [0.02562823483758678, 0.00286355415634001, 0.011166585656794174] and parameters: {'n_layers': 4, 'embedding_dim': 32, 'lr': 0.010056707165379035, 'lambda_val': 7.853874347388544e-06, 'batch_size': 1750, 'optimizer': 'Adam'}.
2026-06-03 06:09:48,973 - optuna.study.study - INFO - Trial 147 finished with values: [0.01615369587941831, 0.001970996047960346, 0.007147774956770969] and parameters: {'n_layers': 4, 'embedding_dim': 32, 'lr': 0.003618612896374858, 'lambda_val': 0.0036173053146817007, 'batch_size': 659, 'optimizer': 'Adam'}.
2026-06-03 06:10:12,375 - experiment_functions - INFO - Early stopping at epoch 550. Best Metrics: (0.005865687519582588, 0.0007033290910308795, 0.0030513946118089323)
2026-06-03 06:10:14,340 - optuna.study.study - INFO - Trial 148 finished with values: [0.005865687519582588, 0.0007033290910308795, 0.0030513946118089323] and parameters: {'n_layers': 2, 'embedding_dim': 32, 'lr': 0.05848561228434413, 'lambda_val': 0.0840407552704538, 'batch_size': 2355, 'optimizer': 'RMSprop'}.
2026-06-03 06:10:53,047 - experiment_functions - INFO - Early stopping at epoch 800. Best Metrics: (0.01951683715652336, 0.0024650010047558442, 0.008807305250661144)
2026-06-03 06:10:53,152 - optuna.study.study - INFO - Trial 149 finished with values: [0.01951683715652336, 0.0024650010047558442, 0.008807305250661144] and parameters: {'n_layers': 3, 'embedding_dim': 96, 'lr': 0.0015579274365812065, 'lambda_val': 0.02518430669345533, 'batch_size': 2448, 'optimizer': 'Adam'}.
2026-06-03 06:13:45,324 - optuna.study.study - INFO - Trial 150 finished with values: [0.07563755327986274, 0.00870118561189631, 0.03656131932293386] and parameters: {'n_layers': 1, 'embedding_dim': 128, 'lr': 0.004311872557114808, 'lambda_val': 2.8807178813664366e-05, 'batch_size': 2273, 'optimizer': 'RMSprop'}.
2026-06-03 06:17:01,655 - optuna.study.study - INFO - Trial 151 finished with values: [0.11290097354285737, 0.01395605867774131, 0.06451167096844643] and parameters: {'n_layers': 1, 'embedding_dim': 256, 'lr': 0.0009463388507176841, 'lambda_val': 7.608004402487057e-06, 'batch_size': 2234, 'optimizer': 'Adam'}.
2026-06-03 06:19:51,915 - optuna.study.study - INFO - Trial 152 finished with values: [0.06356164871064082, 0.007396677607341417, 0.030588934116670366] and parameters: {'n_layers': 1, 'embedding_dim': 128, 'lr': 0.004311872557114808, 'lambda_val': 0.0006353517335696762, 'batch_size': 2273, 'optimizer': 'RMSprop'}.
2026-06-03 06:24:23,759 - optuna.study.study - INFO - Trial 153 finished with values: [0.06198831150429951, 0.007862214481880904, 0.032940030840748584] and parameters: {'n_layers': 4, 'embedding_dim': 256, 'lr': 0.0002143090370477042, 'lambda_val': 0.0002814016114171031, 'batch_size': 1462, 'optimizer': 'RMSprop'}.
2026-06-03 06:24:47,330 - experiment_functions - INFO - Early stopping at epoch 500. Best Metrics: (0.00032214820407491633, 5.023779221649139e-05, 0.0001370201769891277)
2026-06-03 06:24:47,440 - optuna.study.study - INFO - Trial 154 finished with values: [0.00032214820407491633, 5.023779221649139e-05, 0.0001370201769891277] and parameters: {'n_layers': 2, 'embedding_dim': 96, 'lr': 1.7538243785485374e-05, 'lambda_val': 0.00042363702137007827, 'batch_size': 2273, 'optimizer': 'RMSprop'}.
2026-06-03 06:25:59,955 - experiment_functions - INFO - Early stopping at epoch 1550. Best Metrics: (0.0004262491999532103, 7.200750217697099e-05, 0.00023286165833560798)
2026-06-03 06:26:00,231 - optuna.study.study - INFO - Trial 155 finished with values: [0.0004262491999532103, 7.200750217697099e-05, 0.00023286165833560798] and parameters: {'n_layers': 1, 'embedding_dim': 256, 'lr': 6.674905261605384e-05, 'lambda_val': 0.0002814016114171031, 'batch_size': 2448, 'optimizer': 'RMSprop'}.
2026-06-03 06:26:25,159 - experiment_functions - INFO - Early stopping at epoch 550. Best Metrics: (0.03869615359858086, 0.004936700381807221, 0.018159940011386762)
2026-06-03 06:26:25,286 - optuna.study.study - INFO - Trial 156 finished with values: [0.03869615359858086, 0.004936700381807221, 0.018159940011386762] and parameters: {'n_layers': 1, 'embedding_dim': 96, 'lr': 0.01447735814370163, 'lambda_val': 0.002197601157394706, 'batch_size': 2234, 'optimizer': 'Adam'}.
2026-06-03 06:29:09,940 - optuna.study.study - INFO - Trial 157 finished with values: [0.06219169407873864, 0.007760064304374037, 0.03300229225931198] and parameters: {'n_layers': 3, 'embedding_dim': 32, 'lr': 0.00045181778495769544, 'lambda_val': 7.608004402487057e-06, 'batch_size': 2315, 'optimizer': 'Adam'}.
2026-06-03 06:29:32,442 - experiment_functions - INFO - Early stopping at epoch 500. Best Metrics: (0.0005365432406121077, 8.038046754638624e-05, 0.000264065403035419)
2026-06-03 06:29:32,558 - optuna.study.study - INFO - Trial 158 finished with values: [0.0005365432406121077, 8.038046754638624e-05, 0.000264065403035419] and parameters: {'n_layers': 2, 'embedding_dim': 64, 'lr': 0.0017600601147055445, 'lambda_val': 6.624143397965627e-05, 'batch_size': 1769, 'optimizer': 'SGD'}.
2026-06-03 06:30:27,477 - experiment_functions - INFO - Early stopping at epoch 1300. Best Metrics: (0.0934725527059144, 0.011452542032286154, 0.049878377396909944)
2026-06-03 06:30:27,794 - optuna.study.study - INFO - Trial 159 finished with values: [0.0934725527059144, 0.011452542032286154, 0.049878377396909944] and parameters: {'n_layers': 1, 'embedding_dim': 64, 'lr': 0.0026263356328818884, 'lambda_val': 0.000868123514447947, 'batch_size': 1346, 'optimizer': 'Adam'}.
2026-06-03 06:30:50,340 - experiment_functions - INFO - Early stopping at epoch 500. Best Metrics: (0.0004170807128237002, 7.703128139862015e-05, 0.00018177377881342882)
2026-06-03 06:30:50,507 - optuna.study.study - INFO - Trial 160 finished with values: [0.0004170807128237002, 7.703128139862015e-05, 0.00018177377881342882] and parameters: {'n_layers': 1, 'embedding_dim': 128, 'lr': 0.0002143090370477042, 'lambda_val': 0.009486835054678575, 'batch_size': 2021, 'optimizer': 'SGD'}.
2026-06-03 06:33:42,049 - optuna.study.study - INFO - Trial 161 finished with values: [0.01872846597335379, 0.002945609216960279, 0.01008322614183865] and parameters: {'n_layers': 2, 'embedding_dim': 96, 'lr': 0.0002143090370477042, 'lambda_val': 0.003485985825944796, 'batch_size': 2448, 'optimizer': 'Adam'}.
2026-06-03 06:35:51,705 - experiment_functions - INFO - Early stopping at epoch 2600. Best Metrics: (0.05411481299916985, 0.006741911715453145, 0.02704907622009487)
2026-06-03 06:35:51,825 - optuna.study.study - INFO - Trial 162 finished with values: [0.05411481299916985, 0.006741911715453145, 0.02704907622009487] and parameters: {'n_layers': 4, 'embedding_dim': 96, 'lr': 0.0005487208473083224, 'lambda_val': 1.3018932096194356e-06, 'batch_size': 2448, 'optimizer': 'Adam'}.
2026-06-03 06:38:48,625 - optuna.study.study - INFO - Trial 163 finished with values: [0.0005657993444455297, 0.00010549936365463193, 0.0002583212923661824] and parameters: {'n_layers': 2, 'embedding_dim': 128, 'lr': 6.227270336098185e-05, 'lambda_val': 0.0002814016114171031, 'batch_size': 3741, 'optimizer': 'RMSprop'}.
2026-06-03 06:39:27,192 - experiment_functions - INFO - Early stopping at epoch 900. Best Metrics: (0.0787913670419335, 0.010323866300488982, 0.04298173462001185)
2026-06-03 06:39:28,144 - optuna.study.study - INFO - Trial 164 finished with values: [0.0787913670419335, 0.010323866300488982, 0.04298173462001185] and parameters: {'n_layers': 1, 'embedding_dim': 64, 'lr': 0.0026263356328818884, 'lambda_val': 0.0029269164188673986, 'batch_size': 1702, 'optimizer': 'Adam'}.
2026-06-03 06:42:04,981 - optuna.study.study - INFO - Trial 165 finished with values: [0.07757323702893223, 0.010181525889208922, 0.04534415146560484] and parameters: {'n_layers': 1, 'embedding_dim': 32, 'lr': 0.0009344685265310301, 'lambda_val': 0.0014369013630720255, 'batch_size': 1966, 'optimizer': 'Adam'}.
2026-06-03 06:44:02,663 - experiment_functions - INFO - Early stopping at epoch 2400. Best Metrics: (0.029414292828677316, 0.003374305043874339, 0.01325812347446596)
2026-06-03 06:44:02,793 - optuna.study.study - INFO - Trial 166 finished with values: [0.029414292828677316, 0.003374305043874339, 0.01325812347446596] and parameters: {'n_layers': 4, 'embedding_dim': 96, 'lr': 0.006108566649059157, 'lambda_val': 1.3145520728365675e-06, 'batch_size': 1276, 'optimizer': 'Adam'}.
2026-06-03 06:44:29,236 - experiment_functions - INFO - Early stopping at epoch 500. Best Metrics: (0.016301809537399584, 0.0019659722687386965, 0.00793937722439098)
2026-06-03 06:44:29,601 - optuna.study.study - INFO - Trial 167 finished with values: [0.016301809537399584, 0.0019659722687386965, 0.00793937722439098] and parameters: {'n_layers': 4, 'embedding_dim': 96, 'lr': 0.05848561228434413, 'lambda_val': 0.0840407552704538, 'batch_size': 2355, 'optimizer': 'RMSprop'}.
2026-06-03 06:44:59,653 - experiment_functions - INFO - Early stopping at epoch 600. Best Metrics: (0.007276331664089868, 0.0010717395672851498, 0.0035545842449656484)
2026-06-03 06:44:59,768 - optuna.study.study - INFO - Trial 168 finished with values: [0.007276331664089868, 0.0010717395672851498, 0.0035545842449656484] and parameters: {'n_layers': 1, 'embedding_dim': 256, 'lr': 0.05848561228434413, 'lambda_val': 4.5805610201863314e-06, 'batch_size': 2234, 'optimizer': 'RMSprop'}.
2026-06-03 06:47:47,786 - optuna.study.study - INFO - Trial 169 finished with values: [0.0417559136307282, 0.006545984325808828, 0.025309062713396314] and parameters: {'n_layers': 1, 'embedding_dim': 128, 'lr': 0.00045181778495769544, 'lambda_val': 0.0009666773515797903, 'batch_size': 2315, 'optimizer': 'Adam'}.
2026-06-03 06:48:18,110 - experiment_functions - INFO - Early stopping at epoch 600. Best Metrics: (0.047734153256880345, 0.005993368611427424, 0.0239905824382037)
2026-06-03 06:48:18,234 - optuna.study.study - INFO - Trial 170 finished with values: [0.047734153256880345, 0.005993368611427424, 0.0239905824382037] and parameters: {'n_layers': 3, 'embedding_dim': 96, 'lr': 0.0026263356328818884, 'lambda_val': 9.002037953525173e-05, 'batch_size': 3616, 'optimizer': 'Adam'}.
2026-06-03 06:51:03,402 - optuna.study.study - INFO - Trial 171 finished with values: [0.06355016202687842, 0.007329693884386094, 0.030481286101839186] and parameters: {'n_layers': 1, 'embedding_dim': 96, 'lr': 0.008408133081698252, 'lambda_val': 2.8807178813664366e-05, 'batch_size': 1600, 'optimizer': 'RMSprop'}.
2026-06-03 06:53:58,300 - optuna.study.study - INFO - Trial 172 finished with values: [0.10295865376674175, 0.0128407796905352, 0.0578411989104369] and parameters: {'n_layers': 1, 'embedding_dim': 128, 'lr': 0.0020694076192798723, 'lambda_val': 7.608004402487057e-06, 'batch_size': 600, 'optimizer': 'Adam'}.
2026-06-03 06:54:25,941 - experiment_functions - INFO - Early stopping at epoch 500. Best Metrics: (0.0005695936899070326, 7.53566883247371e-05, 0.00025601475404900286)
2026-06-03 06:54:26,066 - optuna.study.study - INFO - Trial 173 finished with values: [0.0005695936899070326, 7.53566883247371e-05, 0.00025601475404900286] and parameters: {'n_layers': 4, 'embedding_dim': 128, 'lr': 0.0002143090370477042, 'lambda_val': 2.8807178813664366e-05, 'batch_size': 2273, 'optimizer': 'SGD'}.
2026-06-03 06:55:28,247 - experiment_functions - INFO - Early stopping at epoch 1350. Best Metrics: (0.07980099973590643, 0.010047558443298278, 0.04203186739764729)
2026-06-03 06:55:28,959 - optuna.study.study - INFO - Trial 174 finished with values: [0.07980099973590643, 0.010047558443298278, 0.04203186739764729] and parameters: {'n_layers': 2, 'embedding_dim': 96, 'lr': 0.0009567600418419374, 'lambda_val': 0.00031016945451823507, 'batch_size': 2448, 'optimizer': 'Adam'}.
2026-06-03 06:56:01,194 - experiment_functions - INFO - Early stopping at epoch 550. Best Metrics: (0.0344110468563886, 0.003898452675999732, 0.015051828276946731)
2026-06-03 06:56:01,308 - optuna.study.study - INFO - Trial 175 finished with values: [0.0344110468563886, 0.003898452675999732, 0.015051828276946731] and parameters: {'n_layers': 2, 'embedding_dim': 256, 'lr': 0.0078386796546334, 'lambda_val': 0.000868123514447947, 'batch_size': 2448, 'optimizer': 'Adam'}.
2026-06-03 06:56:28,615 - experiment_functions - INFO - Early stopping at epoch 550. Best Metrics: (0.040001203869216316, 0.004883113403442964, 0.01921231302845357)
2026-06-03 06:56:29,140 - optuna.study.study - INFO - Trial 176 finished with values: [0.040001203869216316, 0.004883113403442964, 0.01921231302845357] and parameters: {'n_layers': 2, 'embedding_dim': 128, 'lr': 0.006108566649059157, 'lambda_val': 0.002197601157394706, 'batch_size': 877, 'optimizer': 'RMSprop'}.
2026-06-03 06:56:53,688 - experiment_functions - INFO - Early stopping at epoch 500. Best Metrics: (0.0004475730873403323, 6.865831602920491e-05, 0.00022696506044579044)
2026-06-03 06:56:54,695 - optuna.study.study - INFO - Trial 177 finished with values: [0.0004475730873403323, 6.865831602920491e-05, 0.00022696506044579044] and parameters: {'n_layers': 3, 'embedding_dim': 96, 'lr': 0.0029996525529070012, 'lambda_val': 6.649558150466894e-05, 'batch_size': 1769, 'optimizer': 'SGD'}.
2026-06-03 06:59:56,670 - optuna.study.study - INFO - Trial 178 finished with values: [0.03929427228027292, 0.004474512693415499, 0.01766829323852633] and parameters: {'n_layers': 2, 'embedding_dim': 128, 'lr': 0.006108566649059157, 'lambda_val': 1.3145520728365675e-06, 'batch_size': 1052, 'optimizer': 'Adam'}.
2026-06-03 07:00:38,000 - experiment_functions - INFO - Early stopping at epoch 800. Best Metrics: (0.029224662107886424, 0.0033475115546922098, 0.012944934810229227)
2026-06-03 07:00:38,103 - optuna.study.study - INFO - Trial 179 finished with values: [0.029224662107886424, 0.0033475115546922098, 0.012944934810229227] and parameters: {'n_layers': 4, 'embedding_dim': 96, 'lr': 0.004311872557114808, 'lambda_val': 2.871324759471368e-05, 'batch_size': 2852, 'optimizer': 'Adam'}.
2026-06-03 07:03:16,228 - optuna.study.study - INFO - Trial 180 finished with values: [0.0008440074675999525, 0.00014903878357559115, 0.00038830172070808015] and parameters: {'n_layers': 1, 'embedding_dim': 96, 'lr': 0.0002143090370477042, 'lambda_val': 0.0002814016114171031, 'batch_size': 2448, 'optimizer': 'Adam'}.
2026-06-03 07:06:01,896 - optuna.study.study - INFO - Trial 181 finished with values: [0.07813016878709186, 0.010553285551610959, 0.04617392631994902] and parameters: {'n_layers': 1, 'embedding_dim': 96, 'lr': 0.0007931132107821007, 'lambda_val': 0.00031016945451823507, 'batch_size': 1441, 'optimizer': 'Adam'}.
2026-06-03 07:08:37,670 - optuna.study.study - INFO - Trial 182 finished with values: [0.05899909130359572, 0.006989751490387836, 0.02797412530241566] and parameters: {'n_layers': 1, 'embedding_dim': 32, 'lr': 0.004311872557114808, 'lambda_val': 0.0006353517335696762, 'batch_size': 1441, 'optimizer': 'RMSprop'}.
2026-06-03 07:09:17,820 - experiment_functions - INFO - Early stopping at epoch 800. Best Metrics: (0.0004628540943785207, 7.033290910308795e-05, 0.00020946438661037127)
2026-06-03 07:09:18,318 - optuna.study.study - INFO - Trial 183 finished with values: [0.0004628540943785207, 7.033290910308795e-05, 0.00020946438661037127] and parameters: {'n_layers': 3, 'embedding_dim': 128, 'lr': 1.8489083689598537e-05, 'lambda_val': 0.000868123514447947, 'batch_size': 668, 'optimizer': 'RMSprop'}.
2026-06-03 07:12:08,477 - experiment_functions - INFO - Early stopping at epoch 3500. Best Metrics: (0.02550189525678401, 0.0029405854377386295, 0.010986821084022191)
2026-06-03 07:12:09,380 - optuna.study.study - INFO - Trial 184 finished with values: [0.02550189525678401, 0.0029405854377386295, 0.010986821084022191] and parameters: {'n_layers': 3, 'embedding_dim': 128, 'lr': 0.00511270340142449, 'lambda_val': 0.000868123514447947, 'batch_size': 870, 'optimizer': 'Adam'}.
2026-06-03 07:15:23,970 - optuna.study.study - INFO - Trial 185 finished with values: [0.04052678356137808, 0.004690535199946414, 0.018911835332875982] and parameters: {'n_layers': 3, 'embedding_dim': 128, 'lr': 0.036125955900243076, 'lambda_val': 0.000868123514447947, 'batch_size': 2273, 'optimizer': 'RMSprop'}.
2026-06-03 07:19:27,775 - optuna.study.study - INFO - Trial 186 finished with values: [0.06791211638878736, 0.008655971598901469, 0.03666338856539163] and parameters: {'n_layers': 3, 'embedding_dim': 256, 'lr': 0.0002143090370477042, 'lambda_val': 0.0002814016114171031, 'batch_size': 2355, 'optimizer': 'RMSprop'}.
2026-06-03 07:21:58,408 - experiment_functions - INFO - Early stopping at epoch 3350. Best Metrics: (0.030803237961680618, 0.003741040927054726, 0.014350162353147615)
2026-06-03 07:21:58,818 - optuna.study.study - INFO - Trial 187 finished with values: [0.030803237961680618, 0.003741040927054726, 0.014350162353147615] and parameters: {'n_layers': 4, 'embedding_dim': 64, 'lr': 0.0017600601147055445, 'lambda_val': 0.0002814016114171031, 'batch_size': 2448, 'optimizer': 'RMSprop'}.
2026-06-03 07:24:16,444 - experiment_functions - INFO - Early stopping at epoch 3250. Best Metrics: (0.05462422071946461, 0.006396945542233238, 0.025267875864816373)
2026-06-03 07:24:16,848 - optuna.study.study - INFO - Trial 188 finished with values: [0.05462422071946461, 0.006396945542233238, 0.025267875864816373] and parameters: {'n_layers': 1, 'embedding_dim': 128, 'lr': 0.00511270340142449, 'lambda_val': 0.000868123514447947, 'batch_size': 600, 'optimizer': 'Adam'}.
2026-06-03 07:25:20,238 - experiment_functions - INFO - Early stopping at epoch 1250. Best Metrics: (0.04969504322308349, 0.006162502511889612, 0.025616579909502103)
2026-06-03 07:25:20,338 - optuna.study.study - INFO - Trial 189 finished with values: [0.04969504322308349, 0.006162502511889612, 0.025616579909502103] and parameters: {'n_layers': 4, 'embedding_dim': 96, 'lr': 0.0009463388507176841, 'lambda_val': 1.6263951880298748e-05, 'batch_size': 2234, 'optimizer': 'Adam'}.
2026-06-03 07:27:51,833 - experiment_functions - INFO - Early stopping at epoch 3050. Best Metrics: (0.05465035649185483, 0.0069378391050974614, 0.027412893197959143)
2026-06-03 07:27:52,014 - optuna.study.study - INFO - Trial 190 finished with values: [0.05465035649185483, 0.0069378391050974614, 0.027412893197959143] and parameters: {'n_layers': 3, 'embedding_dim': 128, 'lr': 0.00045181778495769544, 'lambda_val': 0.0026848100129980676, 'batch_size': 1769, 'optimizer': 'Adam'}.
2026-06-03 07:28:56,880 - experiment_functions - INFO - Early stopping at epoch 1500. Best Metrics: (0.0007538016512079766, 9.042802598968451e-05, 0.0003548564659527298)
2026-06-03 07:28:57,031 - optuna.study.study - INFO - Trial 191 finished with values: [0.0007538016512079766, 9.042802598968451e-05, 0.0003548564659527298] and parameters: {'n_layers': 2, 'embedding_dim': 96, 'lr': 1.1951502597349823e-05, 'lambda_val': 0.00031016945451823507, 'batch_size': 1441, 'optimizer': 'Adam'}.
2026-06-03 07:33:09,279 - experiment_functions - INFO - Early stopping at epoch 3750. Best Metrics: (0.035600697449811085, 0.004196530243150915, 0.015775077376690393)
2026-06-03 07:33:09,404 - optuna.study.study - INFO - Trial 192 finished with values: [0.035600697449811085, 0.004196530243150915, 0.015775077376690393] and parameters: {'n_layers': 4, 'embedding_dim': 256, 'lr': 0.0010353219839207425, 'lambda_val': 0.00042363702137007827, 'batch_size': 1276, 'optimizer': 'RMSprop'}.
2026-06-03 07:33:58,068 - experiment_functions - INFO - Early stopping at epoch 1150. Best Metrics: (0.01431670847607356, 0.001870520463527363, 0.006367214065901141)
2026-06-03 07:33:58,206 - optuna.study.study - INFO - Trial 193 finished with values: [0.01431670847607356, 0.001870520463527363, 0.006367214065901141] and parameters: {'n_layers': 4, 'embedding_dim': 32, 'lr': 0.0010353219839207425, 'lambda_val': 0.03262029547334665, 'batch_size': 2273, 'optimizer': 'Adam'}.
2026-06-03 07:34:23,701 - experiment_functions - INFO - Early stopping at epoch 550. Best Metrics: (0.04016995096498072, 0.0046453211869515705, 0.01842731118758373)
2026-06-03 07:34:24,097 - optuna.study.study - INFO - Trial 194 finished with values: [0.04016995096498072, 0.0046453211869515705, 0.01842731118758373] and parameters: {'n_layers': 1, 'embedding_dim': 128, 'lr': 0.0211050431003831, 'lambda_val': 0.0019118425504507368, 'batch_size': 2273, 'optimizer': 'Adam'}.
2026-06-03 07:36:57,520 - experiment_functions - INFO - Early stopping at epoch 3900. Best Metrics: (0.04048936195583219, 0.004752495143680086, 0.018332247284514443)
2026-06-03 07:36:57,623 - optuna.study.study - INFO - Trial 195 finished with values: [0.04048936195583219, 0.004752495143680086, 0.018332247284514443] and parameters: {'n_layers': 2, 'embedding_dim': 32, 'lr': 0.004311872557114808, 'lambda_val': 7.874626561692484e-05, 'batch_size': 2273, 'optimizer': 'RMSprop'}.
2026-06-03 07:37:43,875 - experiment_functions - INFO - Early stopping at epoch 1050. Best Metrics: (0.09974323600993082, 0.01231830665148369, 0.05497292468463052)
2026-06-03 07:37:43,987 - optuna.study.study - INFO - Trial 196 finished with values: [0.09974323600993082, 0.01231830665148369, 0.05497292468463052] and parameters: {'n_layers': 1, 'embedding_dim': 96, 'lr': 0.0026263356328818884, 'lambda_val': 2.8807178813664366e-05, 'batch_size': 2273, 'optimizer': 'Adam'}.
2026-06-03 07:38:23,646 - experiment_functions - INFO - Early stopping at epoch 550. Best Metrics: (0.03484454885362104, 0.003957063433585639, 0.015890727434454313)
2026-06-03 07:38:23,826 - optuna.study.study - INFO - Trial 197 finished with values: [0.03484454885362104, 0.003957063433585639, 0.015890727434454313] and parameters: {'n_layers': 4, 'embedding_dim': 256, 'lr': 0.05848561228434413, 'lambda_val': 7.971458468835675e-06, 'batch_size': 2448, 'optimizer': 'Adam'}.
