2026-06-04 19:29:33,607 - optuna.study.study - INFO - Trial 150 finished with values: [0.009487797032880906, 0.0017164579007301227, 0.005473301510406947] and parameters: {'n_layers': 4, 'embedding_dim': 64, 'lr': 0.0007688676008588178, 'lambda_val': 0.00016262429302101681, 'batch_size': 2193, 'optimizer': 'Adam'}.
2026-06-04 19:30:07,139 - experiment_functions - INFO - Early stopping at epoch 750. Best Metrics: (0.006991312427152775, 0.0011705405586442496, 0.004115803174938019)
2026-06-04 19:30:07,492 - optuna.study.study - INFO - Trial 151 finished with values: [0.006991312427152775, 0.0011705405586442496, 0.004115803174938019] and parameters: {'n_layers': 3, 'embedding_dim': 64, 'lr': 0.0032493879970223157, 'lambda_val': 0.00016806129938668377, 'batch_size': 3322, 'optimizer': 'Adam'}.
2026-06-04 19:30:35,665 - experiment_functions - INFO - Early stopping at epoch 600. Best Metrics: (0.007338062806113041, 0.0013631187621407999, 0.004311908641019313)
2026-06-04 19:30:36,753 - optuna.study.study - INFO - Trial 152 finished with values: [0.007338062806113041, 0.0013631187621407999, 0.004311908641019313] and parameters: {'n_layers': 4, 'embedding_dim': 64, 'lr': 0.004869110805383165, 'lambda_val': 3.61928423516103e-05, 'batch_size': 2067, 'optimizer': 'RMSprop'}.
2026-06-04 19:31:14,627 - experiment_functions - INFO - Early stopping at epoch 850. Best Metrics: (0.00709578208663841, 0.0012358496885256885, 0.004130900481313697)
2026-06-04 19:31:15,222 - optuna.study.study - INFO - Trial 153 finished with values: [0.00709578208663841, 0.0012358496885256885, 0.004130900481313697] and parameters: {'n_layers': 4, 'embedding_dim': 64, 'lr': 0.0011827350330377861, 'lambda_val': 0.005255002744531624, 'batch_size': 3322, 'optimizer': 'Adam'}.
2026-06-04 19:31:42,674 - experiment_functions - INFO - Early stopping at epoch 550. Best Metrics: (0.004816164522215241, 0.0008054792685377453, 0.0027016192772191944)
2026-06-04 19:31:43,220 - optuna.study.study - INFO - Trial 154 finished with values: [0.004816164522215241, 0.0008054792685377453, 0.0027016192772191944] and parameters: {'n_layers': 4, 'embedding_dim': 96, 'lr': 0.045292257364849445, 'lambda_val': 5.520510971299447e-06, 'batch_size': 1336, 'optimizer': 'RMSprop'}.
2026-06-04 19:32:18,738 - experiment_functions - INFO - Early stopping at epoch 800. Best Metrics: (0.005454935497855983, 0.000932748342152857, 0.003114520002860203)
2026-06-04 19:32:19,105 - optuna.study.study - INFO - Trial 155 finished with values: [0.005454935497855983, 0.000932748342152857, 0.003114520002860203] and parameters: {'n_layers': 2, 'embedding_dim': 96, 'lr': 0.007372062066661765, 'lambda_val': 1.0846976808752377e-06, 'batch_size': 1265, 'optimizer': 'Adam'}.
2026-06-04 19:32:55,404 - experiment_functions - INFO - Early stopping at epoch 850. Best Metrics: (0.008372692655920387, 0.0014987608011253263, 0.005120847279152052)
2026-06-04 19:32:55,831 - optuna.study.study - INFO - Trial 156 finished with values: [0.008372692655920387, 0.0014987608011253263, 0.005120847279152052] and parameters: {'n_layers': 4, 'embedding_dim': 32, 'lr': 0.0032493879970223157, 'lambda_val': 0.00016806129938668377, 'batch_size': 1336, 'optimizer': 'Adam'}.
2026-06-04 19:33:30,557 - experiment_functions - INFO - Early stopping at epoch 600. Best Metrics: (0.007602595617486108, 0.001399959809766227, 0.004210661479625754)
2026-06-04 19:33:30,815 - optuna.study.study - INFO - Trial 157 finished with values: [0.007602595617486108, 0.001399959809766227, 0.004210661479625754] and parameters: {'n_layers': 4, 'embedding_dim': 256, 'lr': 0.0018624775153074351, 'lambda_val': 0.0011239079008896861, 'batch_size': 2067, 'optimizer': 'RMSprop'}.
2026-06-04 19:34:05,919 - experiment_functions - INFO - Early stopping at epoch 800. Best Metrics: (0.008431700703102661, 0.0014619197534998995, 0.004989306438402318)
2026-06-04 19:34:06,245 - optuna.study.study - INFO - Trial 158 finished with values: [0.008431700703102661, 0.0014619197534998995, 0.004989306438402318] and parameters: {'n_layers': 4, 'embedding_dim': 32, 'lr': 0.0018624775153074351, 'lambda_val': 4.633766555970088e-05, 'batch_size': 3543, 'optimizer': 'RMSprop'}.
2026-06-04 19:34:43,093 - experiment_functions - INFO - Early stopping at epoch 750. Best Metrics: (0.00907295910754314, 0.001612633130149374, 0.005146069256527939)
2026-06-04 19:34:44,448 - optuna.study.study - INFO - Trial 159 finished with values: [0.00907295910754314, 0.001612633130149374, 0.005146069256527939] and parameters: {'n_layers': 4, 'embedding_dim': 128, 'lr': 0.003777254071001523, 'lambda_val': 1.6413472527343117e-06, 'batch_size': 791, 'optimizer': 'Adam'}.
2026-06-04 19:35:26,864 - experiment_functions - INFO - Early stopping at epoch 900. Best Metrics: (0.007686824754252345, 0.001404983588987876, 0.00451851413312745)
2026-06-04 19:35:27,485 - optuna.study.study - INFO - Trial 160 finished with values: [0.007686824754252345, 0.001404983588987876, 0.00451851413312745] and parameters: {'n_layers': 3, 'embedding_dim': 128, 'lr': 0.003777254071001523, 'lambda_val': 3.61928423516103e-05, 'batch_size': 1499, 'optimizer': 'Adam'}.
2026-06-04 19:36:02,801 - experiment_functions - INFO - Early stopping at epoch 550. Best Metrics: (0.005230371335501148, 0.0009310737490789739, 0.0028646185289542903)
2026-06-04 19:36:03,311 - optuna.study.study - INFO - Trial 161 finished with values: [0.005230371335501148, 0.0009310737490789739, 0.0028646185289542903] and parameters: {'n_layers': 3, 'embedding_dim': 256, 'lr': 0.005575824047051625, 'lambda_val': 0.005255002744531624, 'batch_size': 2193, 'optimizer': 'RMSprop'}.
2026-06-04 19:36:30,199 - experiment_functions - INFO - Early stopping at epoch 600. Best Metrics: (0.007095635962173797, 0.0011136043941322258, 0.004190020724308985)
2026-06-04 19:36:30,747 - optuna.study.study - INFO - Trial 162 finished with values: [0.007095635962173797, 0.0011136043941322258, 0.004190020724308985] and parameters: {'n_layers': 3, 'embedding_dim': 32, 'lr': 0.004869110805383165, 'lambda_val': 3.61928423516103e-05, 'batch_size': 2193, 'optimizer': 'RMSprop'}.
2026-06-04 19:37:22,653 - experiment_functions - INFO - Early stopping at epoch 1250. Best Metrics: (0.0070334834478285296, 0.0012777145153727645, 0.0042387757182762035)
2026-06-04 19:37:22,953 - optuna.study.study - INFO - Trial 163 finished with values: [0.0070334834478285296, 0.0012777145153727645, 0.0042387757182762035] and parameters: {'n_layers': 2, 'embedding_dim': 64, 'lr': 0.0032493879970223157, 'lambda_val': 4.633766555970088e-05, 'batch_size': 791, 'optimizer': 'RMSprop'}.
2026-06-04 19:40:10,034 - optuna.study.study - INFO - Trial 164 finished with values: [0.0015962035949516097, 0.00024449058878692475, 0.0008560587492944336] and parameters: {'n_layers': 3, 'embedding_dim': 128, 'lr': 0.000217189797847865, 'lambda_val': 2.344534953461632e-06, 'batch_size': 516, 'optimizer': 'RMSprop'}.
2026-06-04 19:40:57,922 - experiment_functions - INFO - Early stopping at epoch 1050. Best Metrics: (0.009788163787004171, 0.0018370286020497023, 0.005839083614881815)
2026-06-04 19:40:58,477 - optuna.study.study - INFO - Trial 165 finished with values: [0.009788163787004171, 0.0018370286020497023, 0.005839083614881815] and parameters: {'n_layers': 4, 'embedding_dim': 96, 'lr': 0.0013813482214859749, 'lambda_val': 0.00016262429302101681, 'batch_size': 1336, 'optimizer': 'Adam'}.
2026-06-04 19:43:42,878 - optuna.study.study - INFO - Trial 166 finished with values: [0.005408842151940692, 0.0008992564806751961, 0.0031845995953630442] and parameters: {'n_layers': 2, 'embedding_dim': 128, 'lr': 0.00040769039157989535, 'lambda_val': 0.0015000126802708358, 'batch_size': 2180, 'optimizer': 'Adam'}.
2026-06-04 19:46:14,176 - optuna.study.study - INFO - Trial 167 finished with values: [0.002457485041901615, 0.00034664076629379063, 0.0013443026212279685] and parameters: {'n_layers': 4, 'embedding_dim': 32, 'lr': 0.000217189797847865, 'lambda_val': 2.344534953461632e-06, 'batch_size': 708, 'optimizer': 'RMSprop'}.
2026-06-04 19:47:06,988 - experiment_functions - INFO - Early stopping at epoch 950. Best Metrics: (0.008482086807660763, 0.0016025855717060756, 0.00479792001581811)
2026-06-04 19:47:07,351 - optuna.study.study - INFO - Trial 168 finished with values: [0.008482086807660763, 0.0016025855717060756, 0.00479792001581811] and parameters: {'n_layers': 4, 'embedding_dim': 256, 'lr': 0.0007307808528773397, 'lambda_val': 3.61928423516103e-05, 'batch_size': 3398, 'optimizer': 'RMSprop'}.
2026-06-04 19:48:22,870 - experiment_functions - INFO - Early stopping at epoch 1800. Best Metrics: (0.008759100892683114, 0.0016745930738830464, 0.005248254157387553)
2026-06-04 19:48:23,464 - optuna.study.study - INFO - Trial 169 finished with values: [0.008759100892683114, 0.0016745930738830464, 0.005248254157387553] and parameters: {'n_layers': 4, 'embedding_dim': 64, 'lr': 0.0007307808528773397, 'lambda_val': 3.61928423516103e-05, 'batch_size': 3627, 'optimizer': 'RMSprop'}.
2026-06-04 19:50:58,655 - experiment_functions - INFO - Early stopping at epoch 3200. Best Metrics: (0.009532978768995278, 0.0016628709223658652, 0.005477419962760107)
2026-06-04 19:50:58,926 - optuna.study.study - INFO - Trial 170 finished with values: [0.009532978768995278, 0.0016628709223658652, 0.005477419962760107] and parameters: {'n_layers': 3, 'embedding_dim': 256, 'lr': 0.00040769039157989535, 'lambda_val': 3.8631777865125085e-06, 'batch_size': 2129, 'optimizer': 'RMSprop'}.
2026-06-04 19:52:04,535 - experiment_functions - INFO - Early stopping at epoch 1550. Best Metrics: (0.008121373459400784, 0.0014485230089088352, 0.004694674713301325)
2026-06-04 19:52:05,078 - optuna.study.study - INFO - Trial 171 finished with values: [0.008121373459400784, 0.0014485230089088352, 0.004694674713301325] and parameters: {'n_layers': 4, 'embedding_dim': 64, 'lr': 0.0007307808528773397, 'lambda_val': 8.758320188573612e-06, 'batch_size': 3889, 'optimizer': 'Adam'}.
2026-06-04 19:55:21,298 - optuna.study.study - INFO - Trial 172 finished with values: [0.00960724996155348, 0.0018001875544242751, 0.005760698268611826] and parameters: {'n_layers': 3, 'embedding_dim': 256, 'lr': 0.00040769039157989535, 'lambda_val': 2.344534953461632e-06, 'batch_size': 2129, 'optimizer': 'RMSprop'}.
2026-06-04 19:58:35,563 - optuna.study.study - INFO - Trial 173 finished with values: [0.007425879901204473, 0.0013530712036975018, 0.004487654133026392] and parameters: {'n_layers': 3, 'embedding_dim': 256, 'lr': 0.00040769039157989535, 'lambda_val': 3.8631777865125085e-06, 'batch_size': 2129, 'optimizer': 'Adam'}.
2026-06-04 19:59:16,299 - experiment_functions - INFO - Early stopping at epoch 1000. Best Metrics: (0.007669688124052347, 0.001436800857391654, 0.004584555081615123)
2026-06-04 19:59:16,762 - optuna.study.study - INFO - Trial 174 finished with values: [0.007669688124052347, 0.001436800857391654, 0.004584555081615123] and parameters: {'n_layers': 4, 'embedding_dim': 32, 'lr': 0.0018624775153074351, 'lambda_val': 3.61928423516103e-05, 'batch_size': 3398, 'optimizer': 'RMSprop'}.
2026-06-04 19:59:44,042 - experiment_functions - INFO - Early stopping at epoch 600. Best Metrics: (0.00612294010152267, 0.0010248509612164245, 0.003306417458320394)
2026-06-04 19:59:44,332 - optuna.study.study - INFO - Trial 175 finished with values: [0.00612294010152267, 0.0010248509612164245, 0.003306417458320394] and parameters: {'n_layers': 3, 'embedding_dim': 32, 'lr': 0.003777254071001523, 'lambda_val': 0.0011239079008896861, 'batch_size': 2614, 'optimizer': 'RMSprop'}.
2026-06-04 20:02:31,687 - optuna.study.study - INFO - Trial 176 finished with values: [0.0013402861696342684, 0.0002227208788264452, 0.0007543106498310782] and parameters: {'n_layers': 3, 'embedding_dim': 128, 'lr': 0.000217189797847865, 'lambda_val': 0.00016262429302101681, 'batch_size': 516, 'optimizer': 'Adam'}.
2026-06-04 20:03:02,597 - experiment_functions - INFO - Early stopping at epoch 700. Best Metrics: (0.005770917967643215, 0.0009729385759260501, 0.003253982755438107)
2026-06-04 20:03:02,870 - optuna.study.study - INFO - Trial 177 finished with values: [0.005770917967643215, 0.0009729385759260501, 0.003253982755438107] and parameters: {'n_layers': 2, 'embedding_dim': 32, 'lr': 0.004869110805383165, 'lambda_val': 1.3926192188434668e-05, 'batch_size': 1731, 'optimizer': 'RMSprop'}.
2026-06-04 20:03:31,476 - experiment_functions - INFO - Early stopping at epoch 650. Best Metrics: (0.0044483425604064175, 0.0007050036841047627, 0.0024286898827281076)
2026-06-04 20:03:32,648 - optuna.study.study - INFO - Trial 178 finished with values: [0.0044483425604064175, 0.0007050036841047627, 0.0024286898827281076] and parameters: {'n_layers': 1, 'embedding_dim': 64, 'lr': 0.004912664929179723, 'lambda_val': 0.0010139778593023846, 'batch_size': 1575, 'optimizer': 'RMSprop'}.
2026-06-04 20:04:14,522 - experiment_functions - INFO - Early stopping at epoch 850. Best Metrics: (0.008785716145056872, 0.0016394266193315026, 0.005006007601943083)
2026-06-04 20:04:15,825 - optuna.study.study - INFO - Trial 179 finished with values: [0.008785716145056872, 0.0016394266193315026, 0.005006007601943083] and parameters: {'n_layers': 4, 'embedding_dim': 128, 'lr': 0.0011827350330377861, 'lambda_val': 2.344534953461632e-06, 'batch_size': 3358, 'optimizer': 'RMSprop'}.
2026-06-04 20:05:03,113 - experiment_functions - INFO - Early stopping at epoch 1050. Best Metrics: (0.009206836192182943, 0.0016193315024449059, 0.00531654667837282)
2026-06-04 20:05:03,539 - optuna.study.study - INFO - Trial 180 finished with values: [0.009206836192182943, 0.0016193315024449059, 0.00531654667837282] and parameters: {'n_layers': 4, 'embedding_dim': 96, 'lr': 0.0010341842506299342, 'lambda_val': 3.61928423516103e-05, 'batch_size': 3889, 'optimizer': 'RMSprop'}.
2026-06-04 20:06:53,523 - experiment_functions - INFO - Early stopping at epoch 2750. Best Metrics: (0.006673366848656766, 0.001150445441757653, 0.0037580816768211507)
2026-06-04 20:06:53,615 - optuna.study.study - INFO - Trial 181 finished with values: [0.006673366848656766, 0.001150445441757653, 0.0037580816768211507] and parameters: {'n_layers': 2, 'embedding_dim': 128, 'lr': 0.0011827350330377861, 'lambda_val': 2.344534953461632e-06, 'batch_size': 1621, 'optimizer': 'Adam'}.
2026-06-04 20:07:17,797 - experiment_functions - INFO - Early stopping at epoch 550. Best Metrics: (0.005376166689470451, 0.0009913590997387635, 0.003117006923937442)
2026-06-04 20:07:18,754 - optuna.study.study - INFO - Trial 182 finished with values: [0.005376166689470451, 0.0009913590997387635, 0.003117006923937442] and parameters: {'n_layers': 4, 'embedding_dim': 96, 'lr': 0.004869110805383165, 'lambda_val': 0.005255002744531624, 'batch_size': 3356, 'optimizer': 'RMSprop'}.
2026-06-04 20:07:53,228 - experiment_functions - INFO - Early stopping at epoch 750. Best Metrics: (0.00893572187507034, 0.0016427758054792688, 0.004987282414959638)
2026-06-04 20:07:54,322 - optuna.study.study - INFO - Trial 183 finished with values: [0.00893572187507034, 0.0016427758054792688, 0.004987282414959638] and parameters: {'n_layers': 4, 'embedding_dim': 128, 'lr': 0.0038915436873682946, 'lambda_val': 1.5091392659681355e-06, 'batch_size': 775, 'optimizer': 'Adam'}.
2026-06-04 20:10:27,142 - optuna.study.study - INFO - Trial 184 finished with values: [0.002570042893597239, 0.0003834818139192177, 0.0015890794552429212] and parameters: {'n_layers': 1, 'embedding_dim': 128, 'lr': 0.00022150750424668007, 'lambda_val': 0.00016262429302101681, 'batch_size': 3356, 'optimizer': 'RMSprop'}.
2026-06-04 20:13:26,684 - optuna.study.study - INFO - Trial 185 finished with values: [0.002641238735074707, 0.00042367204769241083, 0.0015167289306356195] and parameters: {'n_layers': 2, 'embedding_dim': 256, 'lr': 0.00034253000732903957, 'lambda_val': 0.00612225365863352, 'batch_size': 703, 'optimizer': 'Adam'}.
2026-06-04 20:16:10,871 - optuna.study.study - INFO - Trial 186 finished with values: [0.0011191909458913504, 0.00017415767968383683, 0.0005856409453983022] and parameters: {'n_layers': 3, 'embedding_dim': 128, 'lr': 0.00017255782522784376, 'lambda_val': 3.8631777865125085e-06, 'batch_size': 516, 'optimizer': 'RMSprop'}.
2026-06-04 20:16:38,890 - experiment_functions - INFO - Early stopping at epoch 650. Best Metrics: (0.008358841867893884, 0.0015104829526425081, 0.004819245210965547)
2026-06-04 20:16:39,091 - optuna.study.study - INFO - Trial 187 finished with values: [0.008358841867893884, 0.0015104829526425081, 0.004819245210965547] and parameters: {'n_layers': 4, 'embedding_dim': 64, 'lr': 0.004614564538778378, 'lambda_val': 3.61928423516103e-05, 'batch_size': 2129, 'optimizer': 'Adam'}.
2026-06-04 20:17:09,938 - experiment_functions - INFO - Early stopping at epoch 700. Best Metrics: (0.006244299068000513, 0.0011537946279054192, 0.0035640161684533673)
2026-06-04 20:17:10,064 - optuna.study.study - INFO - Trial 188 finished with values: [0.006244299068000513, 0.0011537946279054192, 0.0035640161684533673] and parameters: {'n_layers': 3, 'embedding_dim': 96, 'lr': 0.005575824047051625, 'lambda_val': 2.7520828720652296e-06, 'batch_size': 2067, 'optimizer': 'RMSprop'}.
2026-06-04 20:17:38,655 - experiment_functions - INFO - Early stopping at epoch 550. Best Metrics: (0.006275640245873517, 0.0011102552079844598, 0.0034813622801366084)
2026-06-04 20:17:39,395 - optuna.study.study - INFO - Trial 189 finished with values: [0.006275640245873517, 0.0011102552079844598, 0.0034813622801366084] and parameters: {'n_layers': 3, 'embedding_dim': 256, 'lr': 0.004869110805383165, 'lambda_val': 0.00016262429302101681, 'batch_size': 2193, 'optimizer': 'RMSprop'}.
2026-06-04 20:18:07,240 - experiment_functions - INFO - Early stopping at epoch 700. Best Metrics: (0.008883175089486404, 0.0015255542903074555, 0.005160154458128928)
2026-06-04 20:18:07,369 - optuna.study.study - INFO - Trial 190 finished with values: [0.008883175089486404, 0.0015255542903074555, 0.005160154458128928] and parameters: {'n_layers': 4, 'embedding_dim': 32, 'lr': 0.00271379640296128, 'lambda_val': 2.344534953461632e-06, 'batch_size': 2067, 'optimizer': 'RMSprop'}.
2026-06-04 20:19:17,757 - experiment_functions - INFO - Early stopping at epoch 1850. Best Metrics: (0.007814734047062769, 0.0014016344028401101, 0.004726290565572079)
2026-06-04 20:19:17,854 - optuna.study.study - INFO - Trial 191 finished with values: [0.007814734047062769, 0.0014016344028401101, 0.004726290565572079] and parameters: {'n_layers': 2, 'embedding_dim': 64, 'lr': 0.0011827350330377861, 'lambda_val': 2.344534953461632e-06, 'batch_size': 1621, 'optimizer': 'RMSprop'}.
2026-06-04 20:19:43,417 - experiment_functions - INFO - Early stopping at epoch 600. Best Metrics: (0.007284957458735854, 0.0013313014937370222, 0.004291027241765797)
2026-06-04 20:19:43,779 - optuna.study.study - INFO - Trial 192 finished with values: [0.007284957458735854, 0.0013313014937370222, 0.004291027241765797] and parameters: {'n_layers': 4, 'embedding_dim': 64, 'lr': 0.004869110805383165, 'lambda_val': 1.6413472527343117e-06, 'batch_size': 2067, 'optimizer': 'RMSprop'}.
2026-06-04 20:20:10,032 - experiment_functions - INFO - Early stopping at epoch 550. Best Metrics: (0.005576176278181151, 0.0009310737490789738, 0.003216229505017975)
2026-06-04 20:20:10,224 - optuna.study.study - INFO - Trial 193 finished with values: [0.005576176278181151, 0.0009310737490789738, 0.003216229505017975] and parameters: {'n_layers': 4, 'embedding_dim': 128, 'lr': 0.02182448811679373, 'lambda_val': 2.344534953461632e-06, 'batch_size': 2546, 'optimizer': 'RMSprop'}.
2026-06-04 20:23:02,514 - optuna.study.study - INFO - Trial 194 finished with values: [0.007672104600287139, 0.0013547457967713846, 0.004478496399090846] and parameters: {'n_layers': 4, 'embedding_dim': 128, 'lr': 0.00022150750424668007, 'lambda_val': 0.005255002744531624, 'batch_size': 3356, 'optimizer': 'RMSprop'}.
2026-06-04 20:23:23,775 - experiment_functions - INFO - Early stopping at epoch 500. Best Metrics: (0.0005212768666170459, 7.033290910308795e-05, 0.00024248983601027446)
2026-06-04 20:23:24,819 - optuna.study.study - INFO - Trial 195 finished with values: [0.0005212768666170459, 7.033290910308795e-05, 0.00024248983601027446] and parameters: {'n_layers': 3, 'embedding_dim': 64, 'lr': 0.004846510423333318, 'lambda_val': 3.8631777865125085e-06, 'batch_size': 1621, 'optimizer': 'SGD'}.
2026-06-04 20:23:52,114 - experiment_functions - INFO - Early stopping at epoch 600. Best Metrics: (0.000512915069985202, 8.540424676803538e-05, 0.0002615834329171989)
2026-06-04 20:23:52,206 - optuna.study.study - INFO - Trial 196 finished with values: [0.000512915069985202, 8.540424676803538e-05, 0.0002615834329171989] and parameters: {'n_layers': 1, 'embedding_dim': 256, 'lr': 1.388017461575609e-05, 'lambda_val': 0.00016262429302101681, 'batch_size': 3322, 'optimizer': 'RMSprop'}.
2026-06-04 20:24:25,709 - experiment_functions - INFO - Early stopping at epoch 800. Best Metrics: (0.009106276698198173, 0.0015841650478933618, 0.005282815276205041)
2026-06-04 20:24:25,799 - optuna.study.study - INFO - Trial 197 finished with values: [0.009106276698198173, 0.0015841650478933618, 0.005282815276205041] and parameters: {'n_layers': 4, 'embedding_dim': 64, 'lr': 0.0038915436873682946, 'lambda_val': 1.0361574781773687e-05, 'batch_size': 791, 'optimizer': 'Adam'}.
2026-06-04 20:26:16,819 - experiment_functions - INFO - Early stopping at epoch 2800. Best Metrics: (0.011537394186601121, 0.00206142407395003, 0.006681799458642161)
