2026-06-06 17:02:27,424 - optuna.study.study - INFO - Trial 166 finished with values: [0.04647281928618596, 0.005809163373300288, 0.022399338983584902] and parameters: {'n_layers': 3, 'embedding_dim': 128, 'lr': 0.00039823438048122364, 'lambda_val': 0.005143748310703553, 'batch_size': 2302, 'optimizer': 'RMSprop'}.
2026-06-06 17:02:54,667 - experiment_functions - INFO - Early stopping at epoch 500. Best Metrics: (0.0004146660804062358, 6.698372295532187e-05, 0.0001754479812947508)
2026-06-06 17:02:55,708 - optuna.study.study - INFO - Trial 167 finished with values: [0.0004146660804062358, 6.698372295532187e-05, 0.0001754479812947508] and parameters: {'n_layers': 4, 'embedding_dim': 128, 'lr': 0.0004543711173429324, 'lambda_val': 0.0008971608129751253, 'batch_size': 1031, 'optimizer': 'SGD'}.
2026-06-06 17:05:53,895 - optuna.study.study - INFO - Trial 168 finished with values: [0.01627288182078301, 0.0029271886931475652, 0.00875011433884573] and parameters: {'n_layers': 1, 'embedding_dim': 256, 'lr': 0.0007202223647646139, 'lambda_val': 0.013152803691188748, 'batch_size': 561, 'optimizer': 'Adam'}.
2026-06-06 17:06:19,309 - experiment_functions - INFO - Early stopping at epoch 500. Best Metrics: (0.0006224981990151717, 8.205506062026927e-05, 0.0002884983917830891)
2026-06-06 17:06:19,581 - optuna.study.study - INFO - Trial 169 finished with values: [0.0006224981990151717, 8.205506062026927e-05, 0.0002884983917830891] and parameters: {'n_layers': 4, 'embedding_dim': 64, 'lr': 0.00039823438048122364, 'lambda_val': 0.0054454682798184975, 'batch_size': 1240, 'optimizer': 'SGD'}.
2026-06-06 17:07:43,173 - experiment_functions - INFO - Early stopping at epoch 1350. Best Metrics: (0.053093493864767034, 0.006542635139661063, 0.02553252395476721)
2026-06-06 17:07:43,828 - optuna.study.study - INFO - Trial 170 finished with values: [0.053093493864767034, 0.006542635139661063, 0.02553252395476721] and parameters: {'n_layers': 4, 'embedding_dim': 256, 'lr': 0.0004384493357461144, 'lambda_val': 0.0007001581162856878, 'batch_size': 2163, 'optimizer': 'RMSprop'}.
2026-06-06 17:08:24,763 - experiment_functions - INFO - Early stopping at epoch 750. Best Metrics: (0.03326735354333445, 0.004002277446580481, 0.015227531547115855)
2026-06-06 17:08:25,319 - optuna.study.study - INFO - Trial 171 finished with values: [0.03326735354333445, 0.004002277446580481, 0.015227531547115855] and parameters: {'n_layers': 2, 'embedding_dim': 256, 'lr': 0.0016310133844241697, 'lambda_val': 0.008842840418384578, 'batch_size': 2093, 'optimizer': 'RMSprop'}.
2026-06-06 17:10:24,816 - experiment_functions - INFO - Early stopping at epoch 2550. Best Metrics: (0.053935704588465305, 0.006587849152655905, 0.02671284876411931)
2026-06-06 17:10:25,474 - optuna.study.study - INFO - Trial 172 finished with values: [0.053935704588465305, 0.006587849152655905, 0.02671284876411931] and parameters: {'n_layers': 4, 'embedding_dim': 96, 'lr': 0.0005151812249168082, 'lambda_val': 0.0002757363874074985, 'batch_size': 2440, 'optimizer': 'Adam'}.
2026-06-06 17:12:19,315 - experiment_functions - INFO - Early stopping at epoch 2300. Best Metrics: (0.0007073767916493687, 0.00010549936365463193, 0.00031967913059726733)
2026-06-06 17:12:19,854 - optuna.study.study - INFO - Trial 173 finished with values: [0.0007073767916493687, 0.00010549936365463193, 0.00031967913059726733] and parameters: {'n_layers': 2, 'embedding_dim': 256, 'lr': 2.2995274140963022e-05, 'lambda_val': 0.0012489670078927163, 'batch_size': 4046, 'optimizer': 'Adam'}.
2026-06-06 17:13:05,422 - experiment_functions - INFO - Early stopping at epoch 1100. Best Metrics: (0.005007322392122881, 0.0008038046754638622, 0.0026745352672708825)
2026-06-06 17:13:06,049 - optuna.study.study - INFO - Trial 174 finished with values: [0.005007322392122881, 0.0008038046754638622, 0.0026745352672708825] and parameters: {'n_layers': 1, 'embedding_dim': 64, 'lr': 0.06260744360538076, 'lambda_val': 8.354781545326947e-06, 'batch_size': 2059, 'optimizer': 'RMSprop'}.
2026-06-06 17:14:44,663 - experiment_functions - INFO - Early stopping at epoch 2150. Best Metrics: (0.024974641702516332, 0.003020965905285016, 0.011700813718962743)
2026-06-06 17:14:45,948 - optuna.study.study - INFO - Trial 175 finished with values: [0.024974641702516332, 0.003020965905285016, 0.011700813718962743] and parameters: {'n_layers': 4, 'embedding_dim': 96, 'lr': 0.0005366117657423627, 'lambda_val': 0.009625224795450376, 'batch_size': 953, 'optimizer': 'RMSprop'}.
2026-06-06 17:15:11,801 - experiment_functions - INFO - Early stopping at epoch 550. Best Metrics: (0.027188738190148207, 0.0032604327148502915, 0.012954656361868079)
2026-06-06 17:15:12,071 - optuna.study.study - INFO - Trial 176 finished with values: [0.027188738190148207, 0.0032604327148502915, 0.012954656361868079] and parameters: {'n_layers': 3, 'embedding_dim': 32, 'lr': 0.013856986777548135, 'lambda_val': 0.0005031918520424605, 'batch_size': 1966, 'optimizer': 'RMSprop'}.
2026-06-06 17:16:00,129 - experiment_functions - INFO - Early stopping at epoch 850. Best Metrics: (0.07808596185669381, 0.009337530979971868, 0.04019264499822504)
2026-06-06 17:16:01,189 - optuna.study.study - INFO - Trial 177 finished with values: [0.07808596185669381, 0.009337530979971868, 0.04019264499822504] and parameters: {'n_layers': 2, 'embedding_dim': 256, 'lr': 0.0016310133844241697, 'lambda_val': 7.199693710203336e-05, 'batch_size': 3591, 'optimizer': 'Adam'}.
2026-06-06 17:16:26,450 - experiment_functions - INFO - Early stopping at epoch 500. Best Metrics: (0.0005128110639196445, 7.53566883247371e-05, 0.00024567430471656625)
2026-06-06 17:16:26,706 - optuna.study.study - INFO - Trial 178 finished with values: [0.0005128110639196445, 7.53566883247371e-05, 0.00024567430471656625] and parameters: {'n_layers': 2, 'embedding_dim': 128, 'lr': 0.00039823438048122364, 'lambda_val': 3.3494997586996853e-06, 'batch_size': 3074, 'optimizer': 'SGD'}.
2026-06-06 17:16:53,130 - experiment_functions - INFO - Early stopping at epoch 550. Best Metrics: (0.02711673658968549, 0.003257083528702526, 0.01264679557283511)
2026-06-06 17:16:53,486 - optuna.study.study - INFO - Trial 179 finished with values: [0.02711673658968549, 0.003257083528702526, 0.01264679557283511] and parameters: {'n_layers': 2, 'embedding_dim': 64, 'lr': 0.04708241095252787, 'lambda_val': 2.252556463844016e-05, 'batch_size': 2440, 'optimizer': 'Adam'}.
2026-06-06 17:20:08,519 - optuna.study.study - INFO - Trial 180 finished with values: [0.012395948784072871, 0.0020296068055462527, 0.006536301362492583] and parameters: {'n_layers': 2, 'embedding_dim': 256, 'lr': 0.00014815746640230623, 'lambda_val': 0.0007001581162856878, 'batch_size': 3748, 'optimizer': 'RMSprop'}.
2026-06-06 17:23:03,552 - optuna.study.study - INFO - Trial 181 finished with values: [0.046342206745315306, 0.0052012860874807425, 0.021584775004174623] and parameters: {'n_layers': 3, 'embedding_dim': 96, 'lr': 0.009439693630750003, 'lambda_val': 3.3494997586996853e-06, 'batch_size': 1966, 'optimizer': 'RMSprop'}.
2026-06-06 17:23:33,172 - experiment_functions - INFO - Early stopping at epoch 600. Best Metrics: (0.06110785796940753, 0.007443566213410142, 0.030157666708369432)
2026-06-06 17:23:33,505 - optuna.study.study - INFO - Trial 182 finished with values: [0.06110785796940753, 0.007443566213410142, 0.030157666708369432] and parameters: {'n_layers': 2, 'embedding_dim': 96, 'lr': 0.00593968435272672, 'lambda_val': 1.4780082520235353e-05, 'batch_size': 2660, 'optimizer': 'Adam'}.
2026-06-06 17:26:16,753 - optuna.study.study - INFO - Trial 183 finished with values: [0.062494055824476605, 0.007885658784915265, 0.031854081272309376] and parameters: {'n_layers': 2, 'embedding_dim': 64, 'lr': 0.0005151812249168082, 'lambda_val': 0.0028258090394084607, 'batch_size': 1966, 'optimizer': 'RMSprop'}.
2026-06-06 17:26:45,114 - experiment_functions - INFO - Early stopping at epoch 500. Best Metrics: (0.0004149653049164768, 8.540424676803538e-05, 0.00022638417318917792)
2026-06-06 17:26:46,352 - optuna.study.study - INFO - Trial 184 finished with values: [0.0004149653049164768, 8.540424676803538e-05, 0.00022638417318917792] and parameters: {'n_layers': 2, 'embedding_dim': 256, 'lr': 0.005595788346532104, 'lambda_val': 1.1147373067134742e-06, 'batch_size': 3591, 'optimizer': 'SGD'}.
2026-06-06 17:30:01,491 - optuna.study.study - INFO - Trial 185 finished with values: [0.06121508164728158, 0.007430169468819078, 0.031176479993350843] and parameters: {'n_layers': 4, 'embedding_dim': 128, 'lr': 0.0005151812249168082, 'lambda_val': 3.4875481690343986e-06, 'batch_size': 2277, 'optimizer': 'Adam'}.
2026-06-06 17:31:04,294 - experiment_functions - INFO - Early stopping at epoch 1300. Best Metrics: (0.030658621215835485, 0.003514970862080515, 0.014102270042399834)
2026-06-06 17:31:04,674 - optuna.study.study - INFO - Trial 186 finished with values: [0.030658621215835485, 0.003514970862080515, 0.014102270042399834] and parameters: {'n_layers': 4, 'embedding_dim': 96, 'lr': 0.005771332725042641, 'lambda_val': 4.660547528567464e-06, 'batch_size': 1760, 'optimizer': 'Adam'}.
2026-06-06 17:31:41,995 - experiment_functions - INFO - Early stopping at epoch 750. Best Metrics: (0.058212535754482944, 0.00710697300555965, 0.029302920167075124)
2026-06-06 17:31:43,692 - optuna.study.study - INFO - Trial 187 finished with values: [0.058212535754482944, 0.00710697300555965, 0.029302920167075124] and parameters: {'n_layers': 2, 'embedding_dim': 128, 'lr': 0.0016310133844241697, 'lambda_val': 0.0005031918520424605, 'batch_size': 2631, 'optimizer': 'RMSprop'}.
2026-06-06 17:33:58,143 - experiment_functions - INFO - Early stopping at epoch 2250. Best Metrics: (0.04130566944468444, 0.004968517650210999, 0.019223437575437038)
2026-06-06 17:33:58,589 - optuna.study.study - INFO - Trial 188 finished with values: [0.04130566944468444, 0.004968517650210999, 0.019223437575437038] and parameters: {'n_layers': 4, 'embedding_dim': 256, 'lr': 0.0007970006502074318, 'lambda_val': 0.0007001581162856878, 'batch_size': 2163, 'optimizer': 'RMSprop'}.
2026-06-06 17:37:53,114 - optuna.study.study - INFO - Trial 189 finished with values: [0.03281963314888708, 0.004543171009444706, 0.01738073486003361] and parameters: {'n_layers': 4, 'embedding_dim': 256, 'lr': 0.00014815746640230623, 'lambda_val': 0.0007001581162856878, 'batch_size': 1909, 'optimizer': 'RMSprop'}.
2026-06-06 17:38:32,058 - experiment_functions - INFO - Early stopping at epoch 750. Best Metrics: (0.0565373964763289, 0.0070550606202692745, 0.0269896662221246)
2026-06-06 17:38:33,022 - optuna.study.study - INFO - Trial 190 finished with values: [0.0565373964763289, 0.0070550606202692745, 0.0269896662221246] and parameters: {'n_layers': 3, 'embedding_dim': 128, 'lr': 0.0019878431480735456, 'lambda_val': 7.650473592526119e-05, 'batch_size': 1966, 'optimizer': 'Adam'}.
2026-06-06 17:39:03,452 - experiment_functions - INFO - Early stopping at epoch 550. Best Metrics: (0.03029234422774144, 0.0035015741174894504, 0.013681280920461572)
2026-06-06 17:39:04,695 - optuna.study.study - INFO - Trial 191 finished with values: [0.03029234422774144, 0.0035015741174894504, 0.013681280920461572] and parameters: {'n_layers': 3, 'embedding_dim': 128, 'lr': 0.013856986777548135, 'lambda_val': 0.0004833903325221198, 'batch_size': 2631, 'optimizer': 'Adam'}.
2026-06-06 17:39:56,589 - experiment_functions - INFO - Early stopping at epoch 1100. Best Metrics: (0.06144748211113677, 0.007324670105164446, 0.030321868063458157)
2026-06-06 17:39:56,853 - optuna.study.study - INFO - Trial 192 finished with values: [0.06144748211113677, 0.007324670105164446, 0.030321868063458157] and parameters: {'n_layers': 2, 'embedding_dim': 128, 'lr': 0.0016310133844241697, 'lambda_val': 3.3494997586996853e-06, 'batch_size': 1128, 'optimizer': 'RMSprop'}.
2026-06-06 17:40:35,368 - experiment_functions - INFO - Early stopping at epoch 750. Best Metrics: (0.02955877377599003, 0.003538415165114877, 0.013662124148862127)
2026-06-06 17:40:36,445 - optuna.study.study - INFO - Trial 193 finished with values: [0.02955877377599003, 0.003538415165114877, 0.013662124148862127] and parameters: {'n_layers': 4, 'embedding_dim': 96, 'lr': 0.0028807011188252273, 'lambda_val': 0.0005031918520424605, 'batch_size': 3591, 'optimizer': 'RMSprop'}.
2026-06-06 17:43:03,365 - optuna.study.study - INFO - Trial 194 finished with values: [0.001985282668330546, 0.0003617121039587381, 0.0011148749268395772] and parameters: {'n_layers': 1, 'embedding_dim': 32, 'lr': 0.00029816136001899624, 'lambda_val': 0.0007001581162856878, 'batch_size': 2237, 'optimizer': 'Adam'}.
2026-06-06 17:45:59,234 - optuna.study.study - INFO - Trial 195 finished with values: [0.005969133022233601, 0.0010533190434724362, 0.003416930251164593] and parameters: {'n_layers': 1, 'embedding_dim': 256, 'lr': 0.0004543711173429324, 'lambda_val': 0.0008971608129751253, 'batch_size': 953, 'optimizer': 'Adam'}.
2026-06-06 17:49:13,033 - optuna.study.study - INFO - Trial 196 finished with values: [0.004661973449153977, 0.0008356219438676402, 0.00265283527904973] and parameters: {'n_layers': 2, 'embedding_dim': 256, 'lr': 0.00014815746640230623, 'lambda_val': 0.0007001581162856878, 'batch_size': 2277, 'optimizer': 'RMSprop'}.
2026-06-06 17:49:43,200 - experiment_functions - INFO - Early stopping at epoch 600. Best Metrics: (0.06172890293197922, 0.007696429767566481, 0.031423310248871024)
2026-06-06 17:49:44,271 - optuna.study.study - INFO - Trial 197 finished with values: [0.06172890293197922, 0.007696429767566481, 0.031423310248871024] and parameters: {'n_layers': 2, 'embedding_dim': 96, 'lr': 0.005596800397668782, 'lambda_val': 3.3494997586996853e-06, 'batch_size': 3074, 'optimizer': 'Adam'}.
2026-06-06 17:52:43,911 - optuna.study.study - INFO - Trial 198 finished with values: [0.04219391560723492, 0.0054156340009377715, 0.019790781732516874] and parameters: {'n_layers': 1, 'embedding_dim': 256, 'lr': 0.021310549494775455, 'lambda_val': 0.0007001581162856878, 'batch_size': 2163, 'optimizer': 'RMSprop'}.
2026-06-06 17:54:39,509 - experiment_functions - INFO - Early stopping at epoch 2650. Best Metrics: (0.053498621153547164, 0.006587849152655905, 0.027330158690185024)
2026-06-06 17:54:40,142 - optuna.study.study - INFO - Trial 199 finished with values: [0.053498621153547164, 0.006587849152655905, 0.027330158690185024] and parameters: {'n_layers': 4, 'embedding_dim': 64, 'lr': 0.0005151812249168082, 'lambda_val': 2.6092056130364808e-05, 'batch_size': 3074, 'optimizer': 'RMSprop'}.
2026-06-06 17:57:47,882 - experiment_functions - INFO - Early stopping at epoch 3350. Best Metrics: (0.07843129905545991, 0.009538482148837834, 0.04188553804450872)
2026-06-06 17:57:48,241 - optuna.study.study - INFO - Trial 200 finished with values: [0.07843129905545991, 0.009538482148837834, 0.04188553804450872] and parameters: {'n_layers': 3, 'embedding_dim': 256, 'lr': 0.00039823438048122364, 'lambda_val': 3.3494997586996853e-06, 'batch_size': 3074, 'optimizer': 'RMSprop'}.
2026-06-06 17:58:25,027 - experiment_functions - INFO - Early stopping at epoch 700. Best Metrics: (0.05539629907147448, 0.007066782771786456, 0.02757482166630219)
2026-06-06 17:58:25,323 - optuna.study.study - INFO - Trial 201 finished with values: [0.05539629907147448, 0.007066782771786456, 0.02757482166630219] and parameters: {'n_layers': 3, 'embedding_dim': 128, 'lr': 0.0019878431480735456, 'lambda_val': 7.650473592526119e-05, 'batch_size': 1966, 'optimizer': 'Adam'}.
2026-06-06 17:59:22,169 - experiment_functions - INFO - Early stopping at epoch 1150. Best Metrics: (0.05138049812261937, 0.006159153325741845, 0.024583491564971974)
2026-06-06 17:59:22,512 - optuna.study.study - INFO - Trial 202 finished with values: [0.05138049812261937, 0.006159153325741845, 0.024583491564971974] and parameters: {'n_layers': 4, 'embedding_dim': 96, 'lr': 0.0007970006502074318, 'lambda_val': 0.0002757363874074985, 'batch_size': 3591, 'optimizer': 'Adam'}.
2026-06-06 17:59:48,736 - experiment_functions - INFO - Early stopping at epoch 550. Best Metrics: (0.021186767744760342, 0.002625761939848617, 0.010689369599639153)
2026-06-06 17:59:49,336 - optuna.study.study - INFO - Trial 203 finished with values: [0.021186767744760342, 0.002625761939848617, 0.010689369599639153] and parameters: {'n_layers': 2, 'embedding_dim': 64, 'lr': 0.03219507513154651, 'lambda_val': 4.5847333595117975e-06, 'batch_size': 3074, 'optimizer': 'RMSprop'}.
2026-06-06 18:02:05,174 - experiment_functions - INFO - Early stopping at epoch 2400. Best Metrics: (0.06864659996753246, 0.008217228213544111, 0.03455300537886191)
2026-06-06 18:02:05,447 - optuna.study.study - INFO - Trial 204 finished with values: [0.06864659996753246, 0.008217228213544111, 0.03455300537886191] and parameters: {'n_layers': 3, 'embedding_dim': 256, 'lr': 0.0004543711173429324, 'lambda_val': 0.0004257798995801158, 'batch_size': 3832, 'optimizer': 'Adam'}.
2026-06-06 18:05:02,991 - optuna.study.study - INFO - Trial 205 finished with values: [0.06597917422946221, 0.008471766360774331, 0.034521211240435536] and parameters: {'n_layers': 2, 'embedding_dim': 128, 'lr': 0.00039823438048122364, 'lambda_val': 0.0028258090394084607, 'batch_size': 2302, 'optimizer': 'RMSprop'}.
2026-06-06 18:08:08,929 - optuna.study.study - INFO - Trial 206 finished with values: [0.08676513585949262, 0.011079107776810235, 0.04771138460704521] and parameters: {'n_layers': 1, 'embedding_dim': 256, 'lr': 0.0007970006502074318, 'lambda_val': 1.4780082520235353e-05, 'batch_size': 1617, 'optimizer': 'RMSprop'}.
2026-06-06 18:09:03,746 - experiment_functions - INFO - Early stopping at epoch 1050. Best Metrics: (0.04288865250731397, 0.005015406256279724, 0.02059390327913253)
2026-06-06 18:09:04,073 - optuna.study.study - INFO - Trial 207 finished with values: [0.04288865250731397, 0.005015406256279724, 0.02059390327913253] and parameters: {'n_layers': 4, 'embedding_dim': 128, 'lr': 0.0019878431480735456, 'lambda_val': 3.3494997586996853e-06, 'batch_size': 1717, 'optimizer': 'Adam'}.
2026-06-06 18:11:54,292 - optuna.study.study - INFO - Trial 208 finished with values: [0.08111395186776907, 0.010429365664143613, 0.04362742288297415] and parameters: {'n_layers': 1, 'embedding_dim': 128, 'lr': 0.0007970006502074318, 'lambda_val': 0.0002757363874074985, 'batch_size': 2440, 'optimizer': 'Adam'}.
2026-06-06 18:13:53,512 - experiment_functions - INFO - Early stopping at epoch 2650. Best Metrics: (0.06293224600485074, 0.007761738897447922, 0.0314866126966704)
2026-06-06 18:13:54,274 - optuna.study.study - INFO - Trial 209 finished with values: [0.06293224600485074, 0.007761738897447922, 0.0314866126966704] and parameters: {'n_layers': 3, 'embedding_dim': 96, 'lr': 0.00039823438048122364, 'lambda_val': 0.0008971608129751253, 'batch_size': 2660, 'optimizer': 'RMSprop'}.
2026-06-06 18:17:54,572 - optuna.study.study - INFO - Trial 210 finished with values: [0.06409880679807815, 0.007863889074954786, 0.032595672307629005] and parameters: {'n_layers': 4, 'embedding_dim': 256, 'lr': 0.00039823438048122364, 'lambda_val': 1.2160816785194988e-06, 'batch_size': 2265, 'optimizer': 'RMSprop'}.
2026-06-06 18:21:11,621 - optuna.study.study - INFO - Trial 211 finished with values: [0.06357188710652248, 0.0076997789537142465, 0.031824705223955134] and parameters: {'n_layers': 4, 'embedding_dim': 128, 'lr': 0.00039823438048122364, 'lambda_val': 2.6092056130364808e-05, 'batch_size': 2302, 'optimizer': 'Adam'}.
2026-06-06 18:24:27,655 - experiment_functions - INFO - Early stopping at epoch 3250. Best Metrics: (0.06176994973642942, 0.007518922901734879, 0.030653440096247223)
2026-06-06 18:24:29,182 - optuna.study.study - INFO - Trial 212 finished with values: [0.06176994973642942, 0.007518922901734879, 0.030653440096247223] and parameters: {'n_layers': 4, 'embedding_dim': 256, 'lr': 0.0004543711173429324, 'lambda_val': 2.6092056130364808e-05, 'batch_size': 2302, 'optimizer': 'RMSprop'}.
2026-06-06 18:27:41,201 - optuna.study.study - INFO - Trial 213 finished with values: [0.0884651005504276, 0.011162837430504387, 0.0480331813080997] and parameters: {'n_layers': 1, 'embedding_dim': 256, 'lr': 0.0007970006502074318, 'lambda_val': 1.4780082520235353e-05, 'batch_size': 3074, 'optimizer': 'Adam'}.
2026-06-06 18:28:18,787 - experiment_functions - INFO - Early stopping at epoch 500. Best Metrics: (0.0005687090848915643, 7.870587447250318e-05, 0.0002576733366407376)
2026-06-06 18:28:20,024 - optuna.study.study - INFO - Trial 214 finished with values: [0.0005687090848915643, 7.870587447250318e-05, 0.0002576733366407376] and parameters: {'n_layers': 4, 'embedding_dim': 256, 'lr': 0.0004384493357461144, 'lambda_val': 0.0007001581162856878, 'batch_size': 2163, 'optimizer': 'SGD'}.
2026-06-06 18:30:24,804 - experiment_functions - INFO - Early stopping at epoch 3050. Best Metrics: (0.05423784043138777, 0.006916069395136982, 0.027899453663715185)
2026-06-06 18:30:25,706 - optuna.study.study - INFO - Trial 215 finished with values: [0.05423784043138777, 0.006916069395136982, 0.027899453663715185] and parameters: {'n_layers': 2, 'embedding_dim': 32, 'lr': 0.0007970006502074318, 'lambda_val': 0.005143748310703553, 'batch_size': 1071, 'optimizer': 'RMSprop'}.
2026-06-06 18:30:56,788 - experiment_functions - INFO - Early stopping at epoch 550. Best Metrics: (0.013203635719524907, 0.00173152923839507, 0.006809927535600969)
2026-06-06 18:30:57,955 - optuna.study.study - INFO - Trial 216 finished with values: [0.013203635719524907, 0.00173152923839507, 0.006809927535600969] and parameters: {'n_layers': 2, 'embedding_dim': 96, 'lr': 0.053429226125996, 'lambda_val': 1.4780082520235353e-05, 'batch_size': 2660, 'optimizer': 'RMSprop'}.
2026-06-06 18:31:32,846 - experiment_functions - INFO - Early stopping at epoch 550. Best Metrics: (0.03848500433037993, 0.004569964498626834, 0.017783600373032463)
