2026-06-05 10:07:09,982 - optuna.study.study - INFO - Trial 193 finished with values: [0.06671010515208327, 0.008235648737356823, 0.035532620279939045] and parameters: {'n_layers': 2, 'embedding_dim': 32, 'lr': 0.0017163448230141686, 'lambda_val': 0.0007536284412237263, 'batch_size': 1361, 'optimizer': 'Adam'}.
2026-06-05 10:08:24,568 - experiment_functions - INFO - Early stopping at epoch 1750. Best Metrics: (0.08708271112372713, 0.010640364391452876, 0.0458042480721359)
2026-06-05 10:08:24,669 - optuna.study.study - INFO - Trial 194 finished with values: [0.08708271112372713, 0.010640364391452876, 0.0458042480721359] and parameters: {'n_layers': 1, 'embedding_dim': 128, 'lr': 0.0023440150084551373, 'lambda_val': 8.17902589782426e-05, 'batch_size': 1812, 'optimizer': 'Adam'}.
2026-06-05 10:08:56,715 - experiment_functions - INFO - Early stopping at epoch 650. Best Metrics: (0.05830844731003763, 0.007177305914662737, 0.02964719492968728)
2026-06-05 10:08:56,813 - optuna.study.study - INFO - Trial 195 finished with values: [0.05830844731003763, 0.007177305914662737, 0.02964719492968728] and parameters: {'n_layers': 3, 'embedding_dim': 128, 'lr': 0.0023440150084551373, 'lambda_val': 7.059587443324882e-05, 'batch_size': 3735, 'optimizer': 'Adam'}.
2026-06-05 10:09:29,469 - experiment_functions - INFO - Early stopping at epoch 700. Best Metrics: (0.0603258796462594, 0.007405050572710832, 0.03047261977792385)
2026-06-05 10:09:29,567 - optuna.study.study - INFO - Trial 196 finished with values: [0.0603258796462594, 0.007405050572710832, 0.03047261977792385] and parameters: {'n_layers': 2, 'embedding_dim': 128, 'lr': 0.0023440150084551373, 'lambda_val': 0.0028468440427530635, 'batch_size': 4021, 'optimizer': 'Adam'}.
2026-06-05 10:10:11,777 - experiment_functions - INFO - Early stopping at epoch 1000. Best Metrics: (0.06805764669594089, 0.008202156875879163, 0.03452712998348478)
2026-06-05 10:10:11,860 - optuna.study.study - INFO - Trial 197 finished with values: [0.06805764669594089, 0.008202156875879163, 0.03452712998348478] and parameters: {'n_layers': 2, 'embedding_dim': 64, 'lr': 0.0014474267912490204, 'lambda_val': 7.059587443324882e-05, 'batch_size': 2203, 'optimizer': 'RMSprop'}.
2026-06-05 10:13:25,554 - optuna.study.study - INFO - Trial 198 finished with values: [0.028678083688256084, 0.0042601647799584705, 0.01692121748302527] and parameters: {'n_layers': 2, 'embedding_dim': 256, 'lr': 0.0002935151629562318, 'lambda_val': 6.977831082453278e-06, 'batch_size': 1000, 'optimizer': 'RMSprop'}.
2026-06-05 10:15:58,299 - optuna.study.study - INFO - Trial 199 finished with values: [0.025611421026263948, 0.0038884051175564335, 0.013373382660754725] and parameters: {'n_layers': 2, 'embedding_dim': 32, 'lr': 0.0002935151629562318, 'lambda_val': 0.006784020914475507, 'batch_size': 3358, 'optimizer': 'Adam'}.
2026-06-05 10:16:23,904 - experiment_functions - INFO - Early stopping at epoch 600. Best Metrics: (0.029832964889368874, 0.0036874539486904685, 0.013848282544645195)
2026-06-05 10:16:23,999 - optuna.study.study - INFO - Trial 200 finished with values: [0.029832964889368874, 0.0036874539486904685, 0.013848282544645195] and parameters: {'n_layers': 3, 'embedding_dim': 32, 'lr': 0.005703236170133443, 'lambda_val': 0.006784020914475507, 'batch_size': 3358, 'optimizer': 'Adam'}.
2026-06-05 10:19:23,886 - optuna.study.study - INFO - Trial 201 finished with values: [0.05512463023826606, 0.006482349789001273, 0.026568455708744353] and parameters: {'n_layers': 1, 'embedding_dim': 256, 'lr': 0.006542998749224963, 'lambda_val': 6.977831082453278e-06, 'batch_size': 1300, 'optimizer': 'RMSprop'}.
2026-06-05 10:20:48,652 - experiment_functions - INFO - Early stopping at epoch 2100. Best Metrics: (0.057320247402120265, 0.006658182061758993, 0.027189180872026923)
2026-06-05 10:20:48,743 - optuna.study.study - INFO - Trial 202 finished with values: [0.057320247402120265, 0.006658182061758993, 0.027189180872026923] and parameters: {'n_layers': 1, 'embedding_dim': 96, 'lr': 0.005703236170133443, 'lambda_val': 7.059587443324882e-05, 'batch_size': 1397, 'optimizer': 'RMSprop'}.
2026-06-05 10:21:23,168 - experiment_functions - INFO - Early stopping at epoch 800. Best Metrics: (0.06641665823479413, 0.008304307053386029, 0.03381962379044452)
2026-06-05 10:21:23,533 - optuna.study.study - INFO - Trial 203 finished with values: [0.06641665823479413, 0.008304307053386029, 0.03381962379044452] and parameters: {'n_layers': 2, 'embedding_dim': 64, 'lr': 0.0017163448230141686, 'lambda_val': 0.0007536284412237263, 'batch_size': 4021, 'optimizer': 'Adam'}.
2026-06-05 10:24:21,810 - optuna.study.study - INFO - Trial 204 finished with values: [0.040763467544388025, 0.006234510014066582, 0.023829872510840337] and parameters: {'n_layers': 1, 'embedding_dim': 256, 'lr': 0.0006201349398045224, 'lambda_val': 6.977831082453278e-06, 'batch_size': 1300, 'optimizer': 'Adam'}.
2026-06-05 10:26:43,315 - experiment_functions - INFO - Early stopping at epoch 3800. Best Metrics: (0.0006214780352283891, 9.210261906356756e-05, 0.00031610078471820934)
2026-06-05 10:26:43,414 - optuna.study.study - INFO - Trial 205 finished with values: [0.0006214780352283891, 9.210261906356756e-05, 0.00031610078471820934] and parameters: {'n_layers': 1, 'embedding_dim': 64, 'lr': 6.974153512348668e-05, 'lambda_val': 6.977831082453278e-06, 'batch_size': 2928, 'optimizer': 'Adam'}.
2026-06-05 10:30:20,828 - optuna.study.study - INFO - Trial 206 finished with values: [0.03883585239676509, 0.005102485096121643, 0.018508373513226685] and parameters: {'n_layers': 3, 'embedding_dim': 256, 'lr': 0.0002935151629562318, 'lambda_val': 0.010049953072921752, 'batch_size': 3358, 'optimizer': 'Adam'}.
2026-06-05 10:33:39,878 - optuna.study.study - INFO - Trial 207 finished with values: [0.04246270963864718, 0.0047792886328622145, 0.01954677384077501] and parameters: {'n_layers': 2, 'embedding_dim': 256, 'lr': 0.006542998749224963, 'lambda_val': 0.00013726443089426057, 'batch_size': 808, 'optimizer': 'Adam'}.
2026-06-05 10:35:02,494 - experiment_functions - INFO - Early stopping at epoch 2100. Best Metrics: (0.07317149882708197, 0.009119833880367072, 0.03745316462550583)
2026-06-05 10:35:02,676 - optuna.study.study - INFO - Trial 208 finished with values: [0.07317149882708197, 0.009119833880367072, 0.03745316462550583] and parameters: {'n_layers': 1, 'embedding_dim': 32, 'lr': 0.001492637607346936, 'lambda_val': 0.0015694921564952753, 'batch_size': 2307, 'optimizer': 'RMSprop'}.
2026-06-05 10:35:25,636 - experiment_functions - INFO - Early stopping at epoch 500. Best Metrics: (0.00040060737891842765, 6.86583160292049e-05, 0.00016199729791957325)
2026-06-05 10:35:25,743 - optuna.study.study - INFO - Trial 209 finished with values: [0.00040060737891842765, 6.86583160292049e-05, 0.00016199729791957325] and parameters: {'n_layers': 3, 'embedding_dim': 96, 'lr': 0.0002935151629562318, 'lambda_val': 0.010901984133619574, 'batch_size': 1812, 'optimizer': 'SGD'}.
2026-06-05 10:38:18,127 - optuna.study.study - INFO - Trial 210 finished with values: [0.04792383778001454, 0.006643110724094046, 0.02655910574250591] and parameters: {'n_layers': 2, 'embedding_dim': 128, 'lr': 0.00037519276912143255, 'lambda_val': 8.17902589782426e-05, 'batch_size': 1812, 'optimizer': 'Adam'}.
2026-06-05 10:39:21,455 - experiment_functions - INFO - Early stopping at epoch 1550. Best Metrics: (0.08530156014498456, 0.010240136646794828, 0.04299805731875134)
2026-06-05 10:39:21,551 - optuna.study.study - INFO - Trial 211 finished with values: [0.08530156014498456, 0.010240136646794828, 0.04299805731875134] and parameters: {'n_layers': 1, 'embedding_dim': 64, 'lr': 0.0023440150084551373, 'lambda_val': 0.00012250709547244776, 'batch_size': 3539, 'optimizer': 'Adam'}.
2026-06-05 10:40:05,157 - experiment_functions - INFO - Early stopping at epoch 1000. Best Metrics: (0.07488292636433101, 0.009357626096858463, 0.03917458922752399)
2026-06-05 10:40:05,297 - optuna.study.study - INFO - Trial 212 finished with values: [0.07488292636433101, 0.009357626096858463, 0.03917458922752399] and parameters: {'n_layers': 1, 'embedding_dim': 128, 'lr': 0.0023440150084551373, 'lambda_val': 0.0003344121448101528, 'batch_size': 1554, 'optimizer': 'RMSprop'}.
2026-06-05 10:43:04,411 - optuna.study.study - INFO - Trial 213 finished with values: [0.04244601133624582, 0.006201018152588922, 0.02489902219115599] and parameters: {'n_layers': 1, 'embedding_dim': 256, 'lr': 0.0006201349398045224, 'lambda_val': 6.977831082453278e-06, 'batch_size': 1300, 'optimizer': 'Adam'}.
2026-06-05 10:43:38,461 - experiment_functions - INFO - Early stopping at epoch 650. Best Metrics: (0.0004723270717348767, 6.86583160292049e-05, 0.00019761993781355734)
2026-06-05 10:43:38,562 - optuna.study.study - INFO - Trial 214 finished with values: [0.0004723270717348767, 6.86583160292049e-05, 0.00019761993781355734] and parameters: {'n_layers': 2, 'embedding_dim': 256, 'lr': 3.0345359553406005e-05, 'lambda_val': 0.00013726443089426057, 'batch_size': 1642, 'optimizer': 'Adam'}.
2026-06-05 10:46:19,279 - optuna.study.study - INFO - Trial 215 finished with values: [0.054483375128929354, 0.00638187420456829, 0.0259654632820435] and parameters: {'n_layers': 1, 'embedding_dim': 96, 'lr': 0.006542998749224963, 'lambda_val': 6.977831082453278e-06, 'batch_size': 1300, 'optimizer': 'RMSprop'}.
2026-06-05 10:48:20,980 - experiment_functions - INFO - Early stopping at epoch 2450. Best Metrics: (0.03878809044330913, 0.004497956996449862, 0.01764014569368924)
2026-06-05 10:48:21,660 - optuna.study.study - INFO - Trial 216 finished with values: [0.03878809044330913, 0.004497956996449862, 0.01764014569368924] and parameters: {'n_layers': 2, 'embedding_dim': 256, 'lr': 0.0023785608804078183, 'lambda_val': 0.0015694921564952753, 'batch_size': 1300, 'optimizer': 'RMSprop'}.
2026-06-05 10:48:54,816 - experiment_functions - INFO - Early stopping at epoch 750. Best Metrics: (0.07982379148645659, 0.00994875745193918, 0.04135113924049196)
2026-06-05 10:48:54,903 - optuna.study.study - INFO - Trial 217 finished with values: [0.07982379148645659, 0.00994875745193918, 0.04135113924049196] and parameters: {'n_layers': 1, 'embedding_dim': 128, 'lr': 0.003882837728452431, 'lambda_val': 0.0007536284412237263, 'batch_size': 3890, 'optimizer': 'Adam'}.
2026-06-05 10:49:37,165 - experiment_functions - INFO - Early stopping at epoch 1000. Best Metrics: (0.0667953029872754, 0.00802465001004756, 0.03430934845663994)
2026-06-05 10:49:37,251 - optuna.study.study - INFO - Trial 218 finished with values: [0.0667953029872754, 0.00802465001004756, 0.03430934845663994] and parameters: {'n_layers': 2, 'embedding_dim': 64, 'lr': 0.0014474267912490204, 'lambda_val': 7.059587443324882e-05, 'batch_size': 2203, 'optimizer': 'RMSprop'}.
2026-06-05 10:50:31,346 - experiment_functions - INFO - Early stopping at epoch 1200. Best Metrics: (0.05411525776896725, 0.006241208386362114, 0.025250471338323373)
2026-06-05 10:50:32,102 - optuna.study.study - INFO - Trial 219 finished with values: [0.05411525776896725, 0.006241208386362114, 0.025250471338323373] and parameters: {'n_layers': 2, 'embedding_dim': 128, 'lr': 0.0023440150084551373, 'lambda_val': 3.7103185425608245e-05, 'batch_size': 3095, 'optimizer': 'RMSprop'}.
2026-06-05 10:51:13,470 - experiment_functions - INFO - Early stopping at epoch 950. Best Metrics: (0.0431202861641424, 0.005214682832071807, 0.019870630699945584)
2026-06-05 10:51:14,017 - optuna.study.study - INFO - Trial 220 finished with values: [0.0431202861641424, 0.005214682832071807, 0.019870630699945584] and parameters: {'n_layers': 2, 'embedding_dim': 96, 'lr': 0.0023785608804078183, 'lambda_val': 0.0015694921564952753, 'batch_size': 2307, 'optimizer': 'RMSprop'}.
2026-06-05 10:54:19,899 - experiment_functions - INFO - Early stopping at epoch 3750. Best Metrics: (0.055816048217320405, 0.006413691472972068, 0.025888282311986015)
2026-06-05 10:54:19,978 - optuna.study.study - INFO - Trial 221 finished with values: [0.055816048217320405, 0.006413691472972068, 0.025888282311986015] and parameters: {'n_layers': 2, 'embedding_dim': 256, 'lr': 0.0023440150084551373, 'lambda_val': 0.00010844106835038753, 'batch_size': 1995, 'optimizer': 'RMSprop'}.
2026-06-05 10:54:53,091 - experiment_functions - INFO - Early stopping at epoch 750. Best Metrics: (0.0698873603939248, 0.008969120503717594, 0.03581480268036389)
2026-06-05 10:54:53,178 - optuna.study.study - INFO - Trial 222 finished with values: [0.0698873603939248, 0.008969120503717594, 0.03581480268036389] and parameters: {'n_layers': 1, 'embedding_dim': 128, 'lr': 0.006542998749224963, 'lambda_val': 6.977831082453278e-06, 'batch_size': 1821, 'optimizer': 'Adam'}.
2026-06-05 10:55:25,180 - experiment_functions - INFO - Early stopping at epoch 650. Best Metrics: (0.05423176548118792, 0.0066179918279858, 0.025545195529265305)
2026-06-05 10:55:25,268 - optuna.study.study - INFO - Trial 223 finished with values: [0.05423176548118792, 0.0066179918279858, 0.025545195529265305] and parameters: {'n_layers': 3, 'embedding_dim': 128, 'lr': 0.00277162555113125, 'lambda_val': 6.977831082453278e-06, 'batch_size': 2928, 'optimizer': 'Adam'}.
2026-06-05 10:55:45,957 - experiment_functions - INFO - Early stopping at epoch 500. Best Metrics: (0.0005417539085232835, 6.865831602920491e-05, 0.0002298956994321525)
2026-06-05 10:55:46,074 - optuna.study.study - INFO - Trial 224 finished with values: [0.0005417539085232835, 6.865831602920491e-05, 0.0002298956994321525] and parameters: {'n_layers': 2, 'embedding_dim': 32, 'lr': 0.006542998749224963, 'lambda_val': 6.977831082453278e-06, 'batch_size': 617, 'optimizer': 'SGD'}.
2026-06-05 10:56:17,609 - experiment_functions - INFO - Early stopping at epoch 750. Best Metrics: (0.03767149947976692, 0.00438073548127805, 0.016868283827400275)
2026-06-05 10:56:17,690 - optuna.study.study - INFO - Trial 225 finished with values: [0.03767149947976692, 0.00438073548127805, 0.016868283827400275] and parameters: {'n_layers': 2, 'embedding_dim': 64, 'lr': 0.005703236170133443, 'lambda_val': 0.0007536284412237263, 'batch_size': 1157, 'optimizer': 'Adam'}.
2026-06-05 10:57:29,674 - experiment_functions - INFO - Early stopping at epoch 1200. Best Metrics: (0.04995463650385185, 0.0061005425681559386, 0.024726291243925527)
2026-06-05 10:57:29,757 - optuna.study.study - INFO - Trial 226 finished with values: [0.04995463650385185, 0.0061005425681559386, 0.024726291243925527] and parameters: {'n_layers': 4, 'embedding_dim': 256, 'lr': 0.0006201349398045224, 'lambda_val': 0.0003344121448101528, 'batch_size': 1920, 'optimizer': 'RMSprop'}.
2026-06-05 10:57:53,154 - experiment_functions - INFO - Early stopping at epoch 550. Best Metrics: (0.02144364659197497, 0.002622412753700851, 0.009977490133026404)
2026-06-05 10:57:53,271 - optuna.study.study - INFO - Trial 227 finished with values: [0.02144364659197497, 0.002622412753700851, 0.009977490133026404] and parameters: {'n_layers': 3, 'embedding_dim': 32, 'lr': 0.047737089318353236, 'lambda_val': 0.00013726443089426057, 'batch_size': 1995, 'optimizer': 'Adam'}.
2026-06-05 10:58:24,050 - experiment_functions - INFO - Early stopping at epoch 700. Best Metrics: (0.042602714929169054, 0.0052431509143278186, 0.020180128449516815)
2026-06-05 10:58:24,135 - optuna.study.study - INFO - Trial 228 finished with values: [0.042602714929169054, 0.0052431509143278186, 0.020180128449516815] and parameters: {'n_layers': 1, 'embedding_dim': 128, 'lr': 0.005703236170133443, 'lambda_val': 0.002704517607370656, 'batch_size': 3075, 'optimizer': 'RMSprop'}.
2026-06-05 11:01:01,347 - optuna.study.study - INFO - Trial 229 finished with values: [0.007870330125833413, 0.0014820148703864964, 0.0045829947120016] and parameters: {'n_layers': 1, 'embedding_dim': 128, 'lr': 0.00037519276912143255, 'lambda_val': 0.000860447676725823, 'batch_size': 1995, 'optimizer': 'Adam'}.
2026-06-05 11:01:42,272 - experiment_functions - INFO - Early stopping at epoch 1000. Best Metrics: (0.06987680727263691, 0.00838803670708018, 0.03742822650116473)
2026-06-05 11:01:42,360 - optuna.study.study - INFO - Trial 230 finished with values: [0.06987680727263691, 0.00838803670708018, 0.03742822650116473] and parameters: {'n_layers': 2, 'embedding_dim': 32, 'lr': 0.0023440150084551373, 'lambda_val': 0.00012250709547244776, 'batch_size': 1554, 'optimizer': 'Adam'}.
2026-06-05 11:04:59,299 - optuna.study.study - INFO - Trial 231 finished with values: [0.04918242051319339, 0.006589523745729788, 0.025109124998927874] and parameters: {'n_layers': 2, 'embedding_dim': 256, 'lr': 0.0002935151629562318, 'lambda_val': 0.006784020914475507, 'batch_size': 3358, 'optimizer': 'Adam'}.
2026-06-05 11:08:35,796 - optuna.study.study - INFO - Trial 232 finished with values: [0.05654359673320088, 0.006448857927523612, 0.026380415449530552] and parameters: {'n_layers': 3, 'embedding_dim': 256, 'lr': 0.006542998749224963, 'lambda_val': 3.6389561047642882e-06, 'batch_size': 808, 'optimizer': 'RMSprop'}.
2026-06-05 11:09:19,798 - experiment_functions - INFO - Early stopping at epoch 1100. Best Metrics: (0.05453194545075035, 0.006564404849621541, 0.026475705294119866)
2026-06-05 11:09:20,106 - optuna.study.study - INFO - Trial 233 finished with values: [0.05453194545075035, 0.006564404849621541, 0.026475705294119866] and parameters: {'n_layers': 2, 'embedding_dim': 32, 'lr': 0.0023440150084551373, 'lambda_val': 8.041173596576259e-05, 'batch_size': 3035, 'optimizer': 'RMSprop'}.
2026-06-05 11:11:47,267 - optuna.study.study - INFO - Trial 234 finished with values: [0.02511535579996035, 0.003915198606738563, 0.014978847842693875] and parameters: {'n_layers': 1, 'embedding_dim': 32, 'lr': 0.0006201349398045224, 'lambda_val': 0.0007536284412237263, 'batch_size': 1642, 'optimizer': 'Adam'}.
2026-06-05 11:12:53,299 - experiment_functions - INFO - Early stopping at epoch 1400. Best Metrics: (0.08301163111190672, 0.010178176703061155, 0.043257060325127834)
2026-06-05 11:12:53,385 - optuna.study.study - INFO - Trial 235 finished with values: [0.08301163111190672, 0.010178176703061155, 0.043257060325127834] and parameters: {'n_layers': 1, 'embedding_dim': 256, 'lr': 0.0023440150084551373, 'lambda_val': 0.00012250709547244776, 'batch_size': 1554, 'optimizer': 'Adam'}.
2026-06-05 11:15:31,193 - optuna.study.study - INFO - Trial 236 finished with values: [0.08132836579727039, 0.010208319378391052, 0.04486624207158485] and parameters: {'n_layers': 1, 'embedding_dim': 64, 'lr': 0.0023440150084551373, 'lambda_val': 6.977831082453278e-06, 'batch_size': 617, 'optimizer': 'Adam'}.
2026-06-05 11:16:31,277 - experiment_functions - INFO - Early stopping at epoch 1450. Best Metrics: (0.06765553367264777, 0.008624154330497688, 0.034461223000721256)
2026-06-05 11:16:31,368 - optuna.study.study - INFO - Trial 237 finished with values: [0.06765553367264777, 0.008624154330497688, 0.034461223000721256] and parameters: {'n_layers': 1, 'embedding_dim': 128, 'lr': 0.0023440150084551373, 'lambda_val': 0.0028468440427530635, 'batch_size': 1024, 'optimizer': 'Adam'}.
2026-06-05 11:19:33,018 - optuna.study.study - INFO - Trial 238 finished with values: [0.07998570285274231, 0.010297072811306854, 0.04206465006527438] and parameters: {'n_layers': 1, 'embedding_dim': 256, 'lr': 0.0007375072560140114, 'lambda_val': 0.0015694921564952753, 'batch_size': 1840, 'optimizer': 'RMSprop'}.
2026-06-05 11:20:19,086 - experiment_functions - INFO - Early stopping at epoch 800. Best Metrics: (0.05810735416900748, 0.006994775269609485, 0.028199791669859406)
2026-06-05 11:20:19,501 - optuna.study.study - INFO - Trial 239 finished with values: [0.05810735416900748, 0.006994775269609485, 0.028199791669859406] and parameters: {'n_layers': 3, 'embedding_dim': 256, 'lr': 0.0017163448230141686, 'lambda_val': 7.059587443324882e-05, 'batch_size': 1642, 'optimizer': 'Adam'}.
2026-06-05 11:21:33,016 - experiment_functions - INFO - Early stopping at epoch 1550. Best Metrics: (0.06937181222987873, 0.008460044209257151, 0.03679048103094882)
2026-06-05 11:21:33,108 - optuna.study.study - INFO - Trial 240 finished with values: [0.06937181222987873, 0.008460044209257151, 0.03679048103094882] and parameters: {'n_layers': 3, 'embedding_dim': 128, 'lr': 0.0006201349398045224, 'lambda_val': 6.977831082453278e-06, 'batch_size': 3358, 'optimizer': 'RMSprop'}.
2026-06-05 11:24:11,058 - optuna.study.study - INFO - Trial 241 finished with values: [0.028899792101705547, 0.004474512693415499, 0.01637623529839291] and parameters: {'n_layers': 1, 'embedding_dim': 96, 'lr': 0.00037519276912143255, 'lambda_val': 0.002704517607370656, 'batch_size': 4021, 'optimizer': 'Adam'}.
2026-06-05 11:24:41,766 - experiment_functions - INFO - Early stopping at epoch 650. Best Metrics: (0.008865075248984161, 0.0012911112599638288, 0.004832271560616614)
2026-06-05 11:24:41,985 - optuna.study.study - INFO - Trial 242 finished with values: [0.008865075248984161, 0.0012911112599638288, 0.004832271560616614] and parameters: {'n_layers': 1, 'embedding_dim': 256, 'lr': 0.03427751272260323, 'lambda_val': 6.977831082453278e-06, 'batch_size': 1300, 'optimizer': 'RMSprop'}.
2026-06-05 11:27:22,728 - optuna.study.study - INFO - Trial 243 finished with values: [0.014371984056751186, 0.0021401299484225334, 0.0073909461014868665] and parameters: {'n_layers': 3, 'embedding_dim': 64, 'lr': 0.00014942480375359303, 'lambda_val': 0.00012250709547244776, 'batch_size': 3735, 'optimizer': 'RMSprop'}.
2026-06-05 11:28:07,208 - experiment_functions - INFO - Early stopping at epoch 1150. Best Metrics: (0.00046249779971143577, 7.033290910308795e-05, 0.00022984672225613955)
