2026-06-03 19:30:50,267 - optuna.study.study - INFO - Trial 74 finished with values: [0.003733688358422132, 0.0007334717663607743, 0.00223686454391802] and parameters: {'n_layers': 3, 'embedding_dim': 64, 'lr': 0.016847576506974767, 'lambda_val': 0.012331631931568181, 'batch_size': 1453, 'optimizer': 'Adam'}.
2026-06-03 19:31:12,688 - experiment_functions - INFO - Early stopping at epoch 500. Best Metrics: (0.00041279780336314604, 6.530912988143882e-05, 0.00019720596213719977)
2026-06-03 19:31:13,104 - optuna.study.study - INFO - Trial 75 finished with values: [0.00041279780336314604, 6.530912988143882e-05, 0.00019720596213719977] and parameters: {'n_layers': 4, 'embedding_dim': 96, 'lr': 1.591164719189174e-05, 'lambda_val': 0.06530250962270037, 'batch_size': 3398, 'optimizer': 'Adam'}.
2026-06-03 19:34:21,652 - optuna.study.study - INFO - Trial 76 finished with values: [0.006069486528474695, 0.0010616920088418514, 0.003707182450627121] and parameters: {'n_layers': 3, 'embedding_dim': 256, 'lr': 0.0003517857503442046, 'lambda_val': 0.003379656411935868, 'batch_size': 513, 'optimizer': 'RMSprop'}.
2026-06-03 19:34:54,571 - experiment_functions - INFO - Early stopping at epoch 750. Best Metrics: (0.007963854383408124, 0.0014083327751356419, 0.004593589645662715)
2026-06-03 19:34:54,675 - optuna.study.study - INFO - Trial 77 finished with values: [0.007963854383408124, 0.0014083327751356419, 0.004593589645662715] and parameters: {'n_layers': 3, 'embedding_dim': 128, 'lr': 0.0027608560004649, 'lambda_val': 2.468073181110974e-06, 'batch_size': 1449, 'optimizer': 'RMSprop'}.
2026-06-03 19:35:15,578 - experiment_functions - INFO - Early stopping at epoch 500. Best Metrics: (0.0005688281324349692, 6.698372295532186e-05, 0.00023159803454242582)
2026-06-03 19:35:15,905 - optuna.study.study - INFO - Trial 78 finished with values: [0.0005688281324349692, 6.698372295532186e-05, 0.00023159803454242582] and parameters: {'n_layers': 3, 'embedding_dim': 64, 'lr': 7.780587389939403e-05, 'lambda_val': 3.6253073924106987e-06, 'batch_size': 1105, 'optimizer': 'SGD'}.
2026-06-03 19:35:36,362 - experiment_functions - INFO - Early stopping at epoch 500. Best Metrics: (0.00039118388240189686, 5.191238529037444e-05, 0.00016688106056488732)
2026-06-03 19:35:36,462 - optuna.study.study - INFO - Trial 79 finished with values: [0.00039118388240189686, 5.191238529037444e-05, 0.00016688106056488732] and parameters: {'n_layers': 3, 'embedding_dim': 32, 'lr': 0.0005532105580283136, 'lambda_val': 0.00016031914143972386, 'batch_size': 2502, 'optimizer': 'SGD'}.
2026-06-03 19:36:03,251 - experiment_functions - INFO - Early stopping at epoch 700. Best Metrics: (0.00038907108144775983, 7.368209525085404e-05, 0.00016731882899018998)
2026-06-03 19:36:03,343 - optuna.study.study - INFO - Trial 80 finished with values: [0.00038907108144775983, 7.368209525085404e-05, 0.00016731882899018998] and parameters: {'n_layers': 1, 'embedding_dim': 32, 'lr': 4.569444625325768e-05, 'lambda_val': 1.1050888829752084e-06, 'batch_size': 3484, 'optimizer': 'RMSprop'}.
2026-06-03 19:38:40,378 - optuna.study.study - INFO - Trial 81 finished with values: [0.0009192598192046222, 0.00013731663205840983, 0.0004305532919773149] and parameters: {'n_layers': 3, 'embedding_dim': 96, 'lr': 8.637823228343827e-05, 'lambda_val': 0.00025850151634462684, 'batch_size': 2574, 'optimizer': 'RMSprop'}.
2026-06-03 19:41:07,746 - optuna.study.study - INFO - Trial 82 finished with values: [0.0012028755634344325, 0.0001540625627972403, 0.0005412589842286005] and parameters: {'n_layers': 2, 'embedding_dim': 64, 'lr': 0.0001463216973541482, 'lambda_val': 0.0002705156165706316, 'batch_size': 1460, 'optimizer': 'RMSprop'}.
2026-06-03 19:41:28,442 - experiment_functions - INFO - Early stopping at epoch 500. Best Metrics: (0.0005600033994852804, 7.033290910308795e-05, 0.0002234139996565065)
2026-06-03 19:41:28,540 - optuna.study.study - INFO - Trial 83 finished with values: [0.0005600033994852804, 7.033290910308795e-05, 0.0002234139996565065] and parameters: {'n_layers': 1, 'embedding_dim': 128, 'lr': 0.0002106754005442837, 'lambda_val': 0.018363215121888217, 'batch_size': 546, 'optimizer': 'SGD'}.
2026-06-03 19:43:07,377 - experiment_functions - INFO - Early stopping at epoch 2500. Best Metrics: (0.00898069007218089, 0.0016578471431442162, 0.0053631784140109155)
2026-06-03 19:43:07,478 - optuna.study.study - INFO - Trial 84 finished with values: [0.00898069007218089, 0.0016578471431442162, 0.0053631784140109155] and parameters: {'n_layers': 4, 'embedding_dim': 64, 'lr': 0.000710331438856921, 'lambda_val': 5.609342222844582e-06, 'batch_size': 2467, 'optimizer': 'Adam'}.
2026-06-03 19:45:29,801 - optuna.study.study - INFO - Trial 85 finished with values: [0.002903685952557332, 0.00037175966240203637, 0.0016241352117637674] and parameters: {'n_layers': 1, 'embedding_dim': 32, 'lr': 0.00020148094706010813, 'lambda_val': 0.001214423045852566, 'batch_size': 3893, 'optimizer': 'RMSprop'}.
2026-06-03 19:45:51,556 - experiment_functions - INFO - Early stopping at epoch 500. Best Metrics: (0.0005055794952118826, 8.540424676803538e-05, 0.0002561768101659532)
2026-06-03 19:45:52,279 - optuna.study.study - INFO - Trial 86 finished with values: [0.0005055794952118826, 8.540424676803538e-05, 0.0002561768101659532] and parameters: {'n_layers': 3, 'embedding_dim': 96, 'lr': 7.780587389939403e-05, 'lambda_val': 0.03761145984863424, 'batch_size': 3484, 'optimizer': 'SGD'}.
2026-06-03 19:47:32,775 - experiment_functions - INFO - Early stopping at epoch 2100. Best Metrics: (0.006704585352192072, 0.0012994842253332439, 0.003940642847828354)
2026-06-03 19:47:32,907 - optuna.study.study - INFO - Trial 87 finished with values: [0.006704585352192072, 0.0012994842253332439, 0.003940642847828354] and parameters: {'n_layers': 3, 'embedding_dim': 256, 'lr': 0.0003517857503442046, 'lambda_val': 0.003379656411935868, 'batch_size': 2270, 'optimizer': 'RMSprop'}.
2026-06-03 19:47:55,392 - experiment_functions - INFO - Early stopping at epoch 500. Best Metrics: (0.0005228397040509159, 7.703128139862013e-05, 0.00023092935886447484)
2026-06-03 19:47:55,481 - optuna.study.study - INFO - Trial 88 finished with values: [0.0005228397040509159, 7.703128139862013e-05, 0.00023092935886447484] and parameters: {'n_layers': 4, 'embedding_dim': 96, 'lr': 1.591164719189174e-05, 'lambda_val': 0.018363215121888217, 'batch_size': 3476, 'optimizer': 'Adam'}.
2026-06-03 19:49:57,988 - experiment_functions - INFO - Early stopping at epoch 3150. Best Metrics: (0.0011350642281083175, 0.00014234041128005897, 0.0005670000963027102)
2026-06-03 19:49:58,107 - optuna.study.study - INFO - Trial 89 finished with values: [0.0011350642281083175, 0.00014234041128005897, 0.0005670000963027102] and parameters: {'n_layers': 4, 'embedding_dim': 64, 'lr': 8.121894063645713e-05, 'lambda_val': 0.00010733978042493688, 'batch_size': 3980, 'optimizer': 'Adam'}.
2026-06-03 19:52:36,070 - optuna.study.study - INFO - Trial 90 finished with values: [0.0007454316274397995, 9.377721213745061e-05, 0.0003306158024492696] and parameters: {'n_layers': 3, 'embedding_dim': 96, 'lr': 8.121894063645713e-05, 'lambda_val': 7.135755342128597e-06, 'batch_size': 2574, 'optimizer': 'Adam'}.
2026-06-03 19:53:01,471 - experiment_functions - INFO - Early stopping at epoch 650. Best Metrics: (0.003681686040455126, 0.0005794092035635341, 0.001988344938867021)
2026-06-03 19:53:01,560 - optuna.study.study - INFO - Trial 91 finished with values: [0.003681686040455126, 0.0005794092035635341, 0.001988344938867021] and parameters: {'n_layers': 1, 'embedding_dim': 32, 'lr': 0.005875923861834851, 'lambda_val': 0.00025850151634462684, 'batch_size': 2574, 'optimizer': 'RMSprop'}.
2026-06-03 19:53:27,109 - experiment_functions - INFO - Early stopping at epoch 500. Best Metrics: (0.00040924440623067883, 5.1912385290374434e-05, 0.0001860187019266716)
2026-06-03 19:53:27,241 - optuna.study.study - INFO - Trial 92 finished with values: [0.00040924440623067883, 5.1912385290374434e-05, 0.0001860187019266716] and parameters: {'n_layers': 3, 'embedding_dim': 256, 'lr': 2.6928964739957108e-05, 'lambda_val': 0.026376980701189847, 'batch_size': 3909, 'optimizer': 'SGD'}.
2026-06-03 19:55:50,304 - optuna.study.study - INFO - Trial 93 finished with values: [0.0007968234867223411, 0.00011722151517181324, 0.0003466830819438501] and parameters: {'n_layers': 1, 'embedding_dim': 32, 'lr': 6.0066841150850955e-05, 'lambda_val': 2.005770549498432e-05, 'batch_size': 3441, 'optimizer': 'RMSprop'}.
2026-06-03 19:56:40,480 - experiment_functions - INFO - Early stopping at epoch 1350. Best Metrics: (0.0005400902986021746, 8.875343291580146e-05, 0.00023397346036673164)
2026-06-03 19:56:40,594 - optuna.study.study - INFO - Trial 94 finished with values: [0.0005400902986021746, 8.875343291580146e-05, 0.00023397346036673164] and parameters: {'n_layers': 2, 'embedding_dim': 32, 'lr': 1.4056282215186718e-05, 'lambda_val': 0.001214423045852566, 'batch_size': 3893, 'optimizer': 'RMSprop'}.
2026-06-03 19:57:06,767 - experiment_functions - INFO - Early stopping at epoch 650. Best Metrics: (0.006252688060433632, 0.001150445441757653, 0.0035732973626709454)
2026-06-03 19:57:06,860 - optuna.study.study - INFO - Trial 95 finished with values: [0.006252688060433632, 0.001150445441757653, 0.0035732973626709454] and parameters: {'n_layers': 4, 'embedding_dim': 32, 'lr': 0.004007370943469233, 'lambda_val': 9.42110145837049e-05, 'batch_size': 2984, 'optimizer': 'RMSprop'}.
2026-06-03 19:57:35,284 - experiment_functions - INFO - Early stopping at epoch 550. Best Metrics: (0.0044802023487470494, 0.0008506932815325877, 0.0025566363136077085)
2026-06-03 19:57:35,382 - optuna.study.study - INFO - Trial 96 finished with values: [0.0044802023487470494, 0.0008506932815325877, 0.0025566363136077085] and parameters: {'n_layers': 3, 'embedding_dim': 256, 'lr': 0.006618720765032931, 'lambda_val': 0.00484673840979081, 'batch_size': 3949, 'optimizer': 'RMSprop'}.
2026-06-03 19:58:07,123 - experiment_functions - INFO - Early stopping at epoch 750. Best Metrics: (0.005440052426025379, 0.0009461450867439212, 0.0032895825538337923)
2026-06-03 19:58:07,256 - optuna.study.study - INFO - Trial 97 finished with values: [0.005440052426025379, 0.0009461450867439212, 0.0032895825538337923] and parameters: {'n_layers': 3, 'embedding_dim': 96, 'lr': 0.011544828952739577, 'lambda_val': 1.109906362587361e-06, 'batch_size': 1446, 'optimizer': 'RMSprop'}.
2026-06-03 19:58:32,577 - experiment_functions - INFO - Early stopping at epoch 500. Best Metrics: (0.000579711650168148, 7.870587447250318e-05, 0.00029266068485439334)
2026-06-03 19:58:32,673 - optuna.study.study - INFO - Trial 98 finished with values: [0.000579711650168148, 7.870587447250318e-05, 0.00029266068485439334] and parameters: {'n_layers': 3, 'embedding_dim': 256, 'lr': 0.00013914666238494096, 'lambda_val': 0.00030251839951992836, 'batch_size': 2159, 'optimizer': 'SGD'}.
2026-06-03 19:58:57,641 - experiment_functions - INFO - Early stopping at epoch 550. Best Metrics: (0.006184850398623857, 0.0010482952642507871, 0.0035737084037119216)
2026-06-03 19:58:57,943 - optuna.study.study - INFO - Trial 99 finished with values: [0.006184850398623857, 0.0010482952642507871, 0.0035737084037119216] and parameters: {'n_layers': 3, 'embedding_dim': 128, 'lr': 0.011544828952739577, 'lambda_val': 0.00025850151634462684, 'batch_size': 2574, 'optimizer': 'Adam'}.
2026-06-03 19:59:30,400 - experiment_functions - INFO - Early stopping at epoch 700. Best Metrics: (0.0076803426647933755, 0.0014518721950566014, 0.004360437434989964)
2026-06-03 19:59:30,508 - optuna.study.study - INFO - Trial 100 finished with values: [0.0076803426647933755, 0.0014518721950566014, 0.004360437434989964] and parameters: {'n_layers': 4, 'embedding_dim': 128, 'lr': 0.00280088767043512, 'lambda_val': 0.00010733978042493688, 'batch_size': 3980, 'optimizer': 'Adam'}.
2026-06-03 19:59:58,968 - experiment_functions - INFO - Early stopping at epoch 550. Best Metrics: (0.005205417484515079, 0.0009478196798178043, 0.0030577215213284646)
2026-06-03 19:59:59,093 - optuna.study.study - INFO - Trial 101 finished with values: [0.005205417484515079, 0.0009478196798178043, 0.0030577215213284646] and parameters: {'n_layers': 3, 'embedding_dim': 256, 'lr': 0.006618720765032931, 'lambda_val': 0.00030251839951992836, 'batch_size': 3949, 'optimizer': 'RMSprop'}.
2026-06-03 20:00:33,568 - experiment_functions - INFO - Early stopping at epoch 850. Best Metrics: (0.00783250008621402, 0.0013966106236184609, 0.004641256098519305)
2026-06-03 20:00:33,795 - optuna.study.study - INFO - Trial 102 finished with values: [0.00783250008621402, 0.0013966106236184609, 0.004641256098519305] and parameters: {'n_layers': 3, 'embedding_dim': 64, 'lr': 0.0018040479477802712, 'lambda_val': 0.0003123129135877017, 'batch_size': 2574, 'optimizer': 'RMSprop'}.
2026-06-03 20:01:11,388 - experiment_functions - INFO - Early stopping at epoch 700. Best Metrics: (0.004329976547556648, 0.0007669636278384354, 0.0022840247879903344)
2026-06-03 20:01:11,481 - optuna.study.study - INFO - Trial 103 finished with values: [0.004329976547556648, 0.0007669636278384354, 0.0022840247879903344] and parameters: {'n_layers': 4, 'embedding_dim': 256, 'lr': 0.006618720765032931, 'lambda_val': 0.008589102899886254, 'batch_size': 1449, 'optimizer': 'RMSprop'}.
2026-06-03 20:03:21,297 - experiment_functions - INFO - Early stopping at epoch 3400. Best Metrics: (0.005200827509546928, 0.0008490186884587048, 0.0030229476276549434)
2026-06-03 20:03:21,526 - optuna.study.study - INFO - Trial 104 finished with values: [0.005200827509546928, 0.0008490186884587048, 0.0030229476276549434] and parameters: {'n_layers': 1, 'embedding_dim': 128, 'lr': 0.0018484765502686299, 'lambda_val': 5.085972175639675e-06, 'batch_size': 1505, 'optimizer': 'Adam'}.
2026-06-03 20:05:20,856 - experiment_functions - INFO - Early stopping at epoch 3200. Best Metrics: (0.009059910590683133, 0.0015975617924844263, 0.005288763968012514)
2026-06-03 20:05:21,037 - optuna.study.study - INFO - Trial 105 finished with values: [0.009059910590683133, 0.0015975617924844263, 0.005288763968012514] and parameters: {'n_layers': 4, 'embedding_dim': 32, 'lr': 0.000710331438856921, 'lambda_val': 0.00047268866494377303, 'batch_size': 2127, 'optimizer': 'Adam'}.
2026-06-03 20:06:08,388 - experiment_functions - INFO - Early stopping at epoch 1100. Best Metrics: (0.004102612450457838, 0.0007770111862817336, 0.0024525989778298803)
2026-06-03 20:06:08,503 - optuna.study.study - INFO - Trial 106 finished with values: [0.004102612450457838, 0.0007770111862817336, 0.0024525989778298803] and parameters: {'n_layers': 1, 'embedding_dim': 256, 'lr': 0.0014471032063295877, 'lambda_val': 0.0012861504251211432, 'batch_size': 3949, 'optimizer': 'RMSprop'}.
2026-06-03 20:08:42,821 - optuna.study.study - INFO - Trial 107 finished with values: [0.005355047282783866, 0.0008406457230892892, 0.0031138067338496787] and parameters: {'n_layers': 2, 'embedding_dim': 96, 'lr': 0.00035763003225974197, 'lambda_val': 0.001589689064221384, 'batch_size': 2984, 'optimizer': 'Adam'}.
2026-06-03 20:11:07,419 - optuna.study.study - INFO - Trial 108 finished with values: [0.004809109744849653, 0.0007200750217697101, 0.0028074681742059166] and parameters: {'n_layers': 2, 'embedding_dim': 32, 'lr': 0.0003517857503442046, 'lambda_val': 0.003379656411935868, 'batch_size': 3703, 'optimizer': 'RMSprop'}.
2026-06-03 20:12:11,801 - experiment_functions - INFO - Early stopping at epoch 1600. Best Metrics: (0.003700832766369363, 0.0006581150780360372, 0.0020718261692054623)
2026-06-03 20:12:11,901 - optuna.study.study - INFO - Trial 109 finished with values: [0.003700832766369363, 0.0006581150780360372, 0.0020718261692054623] and parameters: {'n_layers': 3, 'embedding_dim': 96, 'lr': 0.011544828952739577, 'lambda_val': 0.03349546426778235, 'batch_size': 681, 'optimizer': 'RMSprop'}.
2026-06-03 20:14:45,102 - optuna.study.study - INFO - Trial 110 finished with values: [0.008782055409466428, 0.0015037845803469755, 0.00524358298897895] and parameters: {'n_layers': 3, 'embedding_dim': 64, 'lr': 0.0006306221245460524, 'lambda_val': 5.085972175639675e-06, 'batch_size': 1308, 'optimizer': 'Adam'}.
2026-06-03 20:17:29,064 - optuna.study.study - INFO - Trial 111 finished with values: [0.006641601892211748, 0.0010734141603590327, 0.004004335071307332] and parameters: {'n_layers': 3, 'embedding_dim': 128, 'lr': 0.0002877059431931959, 'lambda_val': 2.393431434886667e-06, 'batch_size': 1505, 'optimizer': 'RMSprop'}.
2026-06-03 20:18:07,332 - experiment_functions - INFO - Early stopping at epoch 950. Best Metrics: (0.00794983443363982, 0.0013915868443968116, 0.004800870807617532)
2026-06-03 20:18:07,442 - optuna.study.study - INFO - Trial 112 finished with values: [0.00794983443363982, 0.0013915868443968116, 0.004800870807617532] and parameters: {'n_layers': 3, 'embedding_dim': 64, 'lr': 0.00280088767043512, 'lambda_val': 8.287870093807144e-05, 'batch_size': 1371, 'optimizer': 'Adam'}.
2026-06-03 20:20:40,302 - optuna.study.study - INFO - Trial 113 finished with values: [0.009390929081764218, 0.0016310536539620873, 0.005869168527687242] and parameters: {'n_layers': 3, 'embedding_dim': 64, 'lr': 0.000710331438856921, 'lambda_val': 0.0003123129135877017, 'batch_size': 774, 'optimizer': 'Adam'}.
2026-06-03 20:23:18,970 - optuna.study.study - INFO - Trial 114 finished with values: [0.0016504280637020718, 0.00022104628575256215, 0.0007721077701254091] and parameters: {'n_layers': 2, 'embedding_dim': 128, 'lr': 0.0001463216973541482, 'lambda_val': 0.0002705156165706316, 'batch_size': 2282, 'optimizer': 'RMSprop'}.
2026-06-03 20:23:44,622 - experiment_functions - INFO - Early stopping at epoch 600. Best Metrics: (0.006012496475545538, 0.001078437939580682, 0.0035410121275751484)
2026-06-03 20:23:45,066 - optuna.study.study - INFO - Trial 115 finished with values: [0.006012496475545538, 0.001078437939580682, 0.0035410121275751484] and parameters: {'n_layers': 3, 'embedding_dim': 64, 'lr': 0.011544828952739577, 'lambda_val': 5.609342222844582e-06, 'batch_size': 2467, 'optimizer': 'Adam'}.
2026-06-03 20:24:58,111 - experiment_functions - INFO - Early stopping at epoch 1400. Best Metrics: (0.007708190611145983, 0.0014100073682095252, 0.004373808075453422)
2026-06-03 20:24:58,232 - optuna.study.study - INFO - Trial 116 finished with values: [0.007708190611145983, 0.0014100073682095252, 0.004373808075453422] and parameters: {'n_layers': 4, 'embedding_dim': 256, 'lr': 0.00033058091149224526, 'lambda_val': 0.003379656411935868, 'batch_size': 3398, 'optimizer': 'RMSprop'}.
2026-06-03 20:25:26,054 - experiment_functions - INFO - Early stopping at epoch 500. Best Metrics: (0.003945394573316485, 0.0007451939178779556, 0.002245306480892895)
2026-06-03 20:25:26,315 - optuna.study.study - INFO - Trial 117 finished with values: [0.003945394573316485, 0.0007451939178779556, 0.002245306480892895] and parameters: {'n_layers': 4, 'embedding_dim': 256, 'lr': 0.047868600250918256, 'lambda_val': 0.003379656411935868, 'batch_size': 513, 'optimizer': 'RMSprop'}.
2026-06-03 20:28:13,408 - optuna.study.study - INFO - Trial 118 finished with values: [0.008874615090988431, 0.001485364056534262, 0.005289439212015634] and parameters: {'n_layers': 3, 'embedding_dim': 128, 'lr': 0.00047366866307194686, 'lambda_val': 2.468073181110974e-06, 'batch_size': 1308, 'optimizer': 'Adam'}.
2026-06-03 20:28:38,740 - experiment_functions - INFO - Early stopping at epoch 550. Best Metrics: (0.004970095553077951, 0.000899256480675196, 0.003053969182282621)
2026-06-03 20:28:38,840 - optuna.study.study - INFO - Trial 119 finished with values: [0.004970095553077951, 0.000899256480675196, 0.003053969182282621] and parameters: {'n_layers': 3, 'embedding_dim': 128, 'lr': 0.009975079266581378, 'lambda_val': 0.003379656411935868, 'batch_size': 1308, 'optimizer': 'Adam'}.
2026-06-03 20:31:05,098 - optuna.study.study - INFO - Trial 120 finished with values: [0.0007917019236695557, 0.00013061825976287765, 0.0004184251295448212] and parameters: {'n_layers': 3, 'embedding_dim': 32, 'lr': 0.0001463216973541482, 'lambda_val': 0.003379656411935868, 'batch_size': 513, 'optimizer': 'RMSprop'}.
2026-06-03 20:32:15,862 - experiment_functions - INFO - Early stopping at epoch 1800. Best Metrics: (0.00407147621183016, 0.000751892290173488, 0.002323886750044287)
2026-06-03 20:32:15,968 - optuna.study.study - INFO - Trial 121 finished with values: [0.00407147621183016, 0.000751892290173488, 0.002323886750044287] and parameters: {'n_layers': 2, 'embedding_dim': 96, 'lr': 0.03446031343627178, 'lambda_val': 0.03349546426778235, 'batch_size': 970, 'optimizer': 'Adam'}.
2026-06-03 20:35:07,504 - optuna.study.study - INFO - Trial 122 finished with values: [0.004885684614129723, 0.0008959072945274298, 0.002617872225686069] and parameters: {'n_layers': 4, 'embedding_dim': 128, 'lr': 0.000710331438856921, 'lambda_val': 0.07088990051076362, 'batch_size': 588, 'optimizer': 'Adam'}.
2026-06-03 20:35:32,806 - experiment_functions - INFO - Early stopping at epoch 550. Best Metrics: (0.005743000788391614, 0.0009863353205171142, 0.003298248583029236)
2026-06-03 20:35:33,593 - optuna.study.study - INFO - Trial 123 finished with values: [0.005743000788391614, 0.0009863353205171142, 0.003298248583029236] and parameters: {'n_layers': 3, 'embedding_dim': 128, 'lr': 0.01940586887095751, 'lambda_val': 2.468073181110974e-06, 'batch_size': 1308, 'optimizer': 'Adam'}.
2026-06-03 20:36:09,648 - experiment_functions - INFO - Early stopping at epoch 750. Best Metrics: (0.004593193143588248, 0.000865764619197535, 0.002515020103279659)
