2026-06-03 07:40:55,455 - optuna.study.study - INFO - Trial 198 finished with values: [0.012733934650951488, 0.002017884654029071, 0.006708938589811069] and parameters: {'n_layers': 2, 'embedding_dim': 32, 'lr': 0.0002143090370477042, 'lambda_val': 0.0006331806834513722, 'batch_size': 2448, 'optimizer': 'RMSprop'}.
2026-06-03 07:43:30,696 - optuna.study.study - INFO - Trial 199 finished with values: [0.04083342933718544, 0.004948422533324402, 0.018889854722212072] and parameters: {'n_layers': 1, 'embedding_dim': 64, 'lr': 0.0211050431003831, 'lambda_val': 0.0019118425504507368, 'batch_size': 1769, 'optimizer': 'RMSprop'}.
2026-06-03 07:44:14,317 - experiment_functions - INFO - Early stopping at epoch 850. Best Metrics: (0.03173003268736199, 0.003680755576394936, 0.014178792821586707)
2026-06-03 07:44:14,399 - optuna.study.study - INFO - Trial 200 finished with values: [0.03173003268736199, 0.003680755576394936, 0.014178792821586707] and parameters: {'n_layers': 3, 'embedding_dim': 128, 'lr': 0.004253706800291006, 'lambda_val': 0.0006353517335696762, 'batch_size': 2315, 'optimizer': 'Adam'}.
2026-06-03 07:48:36,707 - experiment_functions - INFO - Early stopping at epoch 3900. Best Metrics: (0.04254902216265119, 0.0050807153861611625, 0.019736292200977765)
2026-06-03 07:48:36,796 - optuna.study.study - INFO - Trial 201 finished with values: [0.04254902216265119, 0.0050807153861611625, 0.019736292200977765] and parameters: {'n_layers': 4, 'embedding_dim': 256, 'lr': 0.0009463388507176841, 'lambda_val': 4.5805610201863314e-06, 'batch_size': 2234, 'optimizer': 'RMSprop'}.
2026-06-03 07:51:24,487 - optuna.study.study - INFO - Trial 202 finished with values: [0.09869841910432942, 0.01265824904548195, 0.056282748046310456] and parameters: {'n_layers': 1, 'embedding_dim': 96, 'lr': 0.0009463388507176841, 'lambda_val': 0.0005936250566304678, 'batch_size': 1892, 'optimizer': 'Adam'}.
2026-06-03 07:52:51,395 - experiment_functions - INFO - Early stopping at epoch 2100. Best Metrics: (0.014442908394458812, 0.0019642976756648134, 0.006508262153751063)
2026-06-03 07:52:51,644 - optuna.study.study - INFO - Trial 203 finished with values: [0.014442908394458812, 0.0019642976756648134, 0.006508262153751063] and parameters: {'n_layers': 1, 'embedding_dim': 128, 'lr': 0.006108566649059157, 'lambda_val': 0.05881267873656791, 'batch_size': 877, 'optimizer': 'Adam'}.
2026-06-03 07:53:18,439 - experiment_functions - INFO - Early stopping at epoch 650. Best Metrics: (0.00040836347475699437, 6.86583160292049e-05, 0.00020463118696680785)
2026-06-03 07:53:18,519 - optuna.study.study - INFO - Trial 204 finished with values: [0.00040836347475699437, 6.86583160292049e-05, 0.00020463118696680785] and parameters: {'n_layers': 1, 'embedding_dim': 64, 'lr': 0.0001090841971397024, 'lambda_val': 0.000868123514447947, 'batch_size': 2394, 'optimizer': 'Adam'}.
2026-06-03 07:54:57,879 - experiment_functions - INFO - Early stopping at epoch 2000. Best Metrics: (0.04544567091519819, 0.0057036640096456565, 0.022024212522443704)
2026-06-03 07:54:58,006 - optuna.study.study - INFO - Trial 205 finished with values: [0.04544567091519819, 0.0057036640096456565, 0.022024212522443704] and parameters: {'n_layers': 4, 'embedding_dim': 96, 'lr': 0.0007931132107821007, 'lambda_val': 0.00031016945451823507, 'batch_size': 3121, 'optimizer': 'Adam'}.
2026-06-03 07:57:47,016 - optuna.study.study - INFO - Trial 206 finished with values: [0.061787957766134556, 0.007178980507736621, 0.02935163160097594] and parameters: {'n_layers': 1, 'embedding_dim': 128, 'lr': 0.004311872557114808, 'lambda_val': 0.0006353517335696762, 'batch_size': 2273, 'optimizer': 'RMSprop'}.
2026-06-03 08:00:42,861 - experiment_functions - INFO - Early stopping at epoch 2850. Best Metrics: (0.07683274208769297, 0.009427959005961554, 0.04019592010526168)
2026-06-03 08:00:43,175 - optuna.study.study - INFO - Trial 207 finished with values: [0.07683274208769297, 0.009427959005961554, 0.04019592010526168] and parameters: {'n_layers': 3, 'embedding_dim': 256, 'lr': 0.00045181778495769544, 'lambda_val': 7.608004402487057e-06, 'batch_size': 2315, 'optimizer': 'RMSprop'}.
2026-06-03 08:03:31,617 - optuna.study.study - INFO - Trial 208 finished with values: [0.10261269428524947, 0.012842454283609084, 0.057919127386592446] and parameters: {'n_layers': 1, 'embedding_dim': 96, 'lr': 0.0009463388507176841, 'lambda_val': 0.00031016945451823507, 'batch_size': 2234, 'optimizer': 'Adam'}.
2026-06-03 08:06:09,315 - optuna.study.study - INFO - Trial 209 finished with values: [0.018265650123969402, 0.0027396342688726645, 0.009247642689800658] and parameters: {'n_layers': 3, 'embedding_dim': 32, 'lr': 0.0002143090370477042, 'lambda_val': 0.00020413650952195634, 'batch_size': 1462, 'optimizer': 'RMSprop'}.
2026-06-03 08:08:54,777 - optuna.study.study - INFO - Trial 210 finished with values: [0.07558877122749344, 0.00995378123116083, 0.04121609793720076] and parameters: {'n_layers': 1, 'embedding_dim': 96, 'lr': 0.0007931132107821007, 'lambda_val': 0.009515702805173358, 'batch_size': 1702, 'optimizer': 'Adam'}.
2026-06-03 08:11:41,173 - optuna.study.study - INFO - Trial 211 finished with values: [0.07141615769470686, 0.008466742581552684, 0.03560859906174851] and parameters: {'n_layers': 1, 'embedding_dim': 96, 'lr': 0.004311872557114808, 'lambda_val': 2.8807178813664366e-05, 'batch_size': 639, 'optimizer': 'Adam'}.
2026-06-03 08:14:19,207 - experiment_functions - INFO - Early stopping at epoch 3900. Best Metrics: (0.00045001451674201397, 9.37772121374506e-05, 0.00022609621506313184)
2026-06-03 08:14:19,299 - optuna.study.study - INFO - Trial 212 finished with values: [0.00045001451674201397, 9.37772121374506e-05, 0.00022609621506313184] and parameters: {'n_layers': 1, 'embedding_dim': 128, 'lr': 0.00028575652956967253, 'lambda_val': 0.0006353517335696762, 'batch_size': 870, 'optimizer': 'Adam'}.
2026-06-03 08:15:32,855 - experiment_functions - INFO - Early stopping at epoch 1050. Best Metrics: (0.050246249183153006, 0.0060251858798312016, 0.024216911231424023)
2026-06-03 08:15:32,955 - optuna.study.study - INFO - Trial 213 finished with values: [0.050246249183153006, 0.0060251858798312016, 0.024216911231424023] and parameters: {'n_layers': 4, 'embedding_dim': 256, 'lr': 0.0009567600418419374, 'lambda_val': 7.608004402487057e-06, 'batch_size': 2632, 'optimizer': 'Adam'}.
2026-06-03 08:15:53,590 - experiment_functions - INFO - Early stopping at epoch 500. Best Metrics: (0.0004020595512268325, 7.033290910308797e-05, 0.00020671679919186643)
2026-06-03 08:15:54,237 - optuna.study.study - INFO - Trial 214 finished with values: [0.0004020595512268325, 7.033290910308797e-05, 0.00020671679919186643] and parameters: {'n_layers': 1, 'embedding_dim': 32, 'lr': 0.00015373584715816806, 'lambda_val': 0.0014369013630720255, 'batch_size': 2234, 'optimizer': 'Adam'}.
2026-06-03 08:16:20,125 - experiment_functions - INFO - Early stopping at epoch 500. Best Metrics: (0.00035201186234330283, 7.200750217697099e-05, 0.00020414008735059391)
2026-06-03 08:16:20,471 - optuna.study.study - INFO - Trial 215 finished with values: [0.00035201186234330283, 7.200750217697099e-05, 0.00020414008735059391] and parameters: {'n_layers': 3, 'embedding_dim': 128, 'lr': 0.0020694076192798723, 'lambda_val': 7.608004402487057e-06, 'batch_size': 1769, 'optimizer': 'SGD'}.
2026-06-03 08:19:10,278 - optuna.study.study - INFO - Trial 216 finished with values: [0.06568320906150626, 0.007637819009980575, 0.030848432385193848] and parameters: {'n_layers': 1, 'embedding_dim': 128, 'lr': 0.00511270340142449, 'lambda_val': 7.608004402487057e-06, 'batch_size': 600, 'optimizer': 'Adam'}.
2026-06-03 08:20:03,115 - experiment_functions - INFO - Early stopping at epoch 950. Best Metrics: (0.06000458157716491, 0.0074435662134101415, 0.02995969995538054)
2026-06-03 08:20:03,189 - optuna.study.study - INFO - Trial 217 finished with values: [0.06000458157716491, 0.0074435662134101415, 0.02995969995538054] and parameters: {'n_layers': 2, 'embedding_dim': 256, 'lr': 0.0009463388507176841, 'lambda_val': 0.0016902648170801962, 'batch_size': 2234, 'optimizer': 'RMSprop'}.
2026-06-03 08:22:46,982 - optuna.study.study - INFO - Trial 218 finished with values: [0.06359560752929921, 0.007344765222051042, 0.030707171292592417] and parameters: {'n_layers': 1, 'embedding_dim': 96, 'lr': 0.008408133081698252, 'lambda_val': 2.8807178813664366e-05, 'batch_size': 1600, 'optimizer': 'RMSprop'}.
2026-06-03 08:27:18,939 - optuna.study.study - INFO - Trial 219 finished with values: [0.05974455203428247, 0.007525621274030412, 0.03161074325214639] and parameters: {'n_layers': 4, 'embedding_dim': 256, 'lr': 0.0002143090370477042, 'lambda_val': 7.608004402487057e-06, 'batch_size': 2234, 'optimizer': 'Adam'}.
2026-06-03 08:27:54,254 - experiment_functions - INFO - Early stopping at epoch 800. Best Metrics: (0.0857619638532591, 0.010700649742112668, 0.04531064430556784)
2026-06-03 08:27:54,718 - optuna.study.study - INFO - Trial 220 finished with values: [0.0857619638532591, 0.010700649742112668, 0.04531064430556784] and parameters: {'n_layers': 1, 'embedding_dim': 96, 'lr': 0.003547716578185067, 'lambda_val': 0.000868123514447947, 'batch_size': 2234, 'optimizer': 'Adam'}.
2026-06-03 08:30:42,908 - optuna.study.study - INFO - Trial 221 finished with values: [0.09722134127842275, 0.011693683434925314, 0.051045180087970946] and parameters: {'n_layers': 1, 'embedding_dim': 96, 'lr': 0.0026263356328818884, 'lambda_val': 2.8807178813664366e-05, 'batch_size': 639, 'optimizer': 'Adam'}.
2026-06-03 08:33:56,777 - optuna.study.study - INFO - Trial 222 finished with values: [0.11419535803413876, 0.014106772054390785, 0.06460874798892755] and parameters: {'n_layers': 1, 'embedding_dim': 256, 'lr': 0.0009463388507176841, 'lambda_val': 2.8807178813664366e-05, 'batch_size': 2234, 'optimizer': 'RMSprop'}.
2026-06-03 08:37:09,147 - optuna.study.study - INFO - Trial 223 finished with values: [0.09216999262338044, 0.012211132694755175, 0.05349893188284157] and parameters: {'n_layers': 1, 'embedding_dim': 256, 'lr': 0.0006137073018441479, 'lambda_val': 6.140274743146612e-05, 'batch_size': 2234, 'optimizer': 'Adam'}.
2026-06-03 08:39:40,610 - optuna.study.study - INFO - Trial 224 finished with values: [0.0007088427817502384, 0.0001155469220979302, 0.0003274819725856864] and parameters: {'n_layers': 1, 'embedding_dim': 64, 'lr': 0.0002143090370477042, 'lambda_val': 6.624143397965627e-05, 'batch_size': 1769, 'optimizer': 'RMSprop'}.
2026-06-03 08:41:05,271 - experiment_functions - INFO - Early stopping at epoch 1700. Best Metrics: (0.05057156950896041, 0.006221113269475519, 0.02425709530328323)
2026-06-03 08:41:05,556 - optuna.study.study - INFO - Trial 225 finished with values: [0.05057156950896041, 0.006221113269475519, 0.02425709530328323] and parameters: {'n_layers': 4, 'embedding_dim': 96, 'lr': 0.0005487208473083224, 'lambda_val': 1.3018932096194356e-06, 'batch_size': 2273, 'optimizer': 'RMSprop'}.
2026-06-03 08:42:04,422 - experiment_functions - INFO - Early stopping at epoch 1400. Best Metrics: (0.0935809000358222, 0.01160995378123116, 0.05114697150076834)
2026-06-03 08:42:05,205 - optuna.study.study - INFO - Trial 226 finished with values: [0.0935809000358222, 0.01160995378123116, 0.05114697150076834] and parameters: {'n_layers': 1, 'embedding_dim': 64, 'lr': 0.0026263356328818884, 'lambda_val': 0.00031016945451823507, 'batch_size': 1441, 'optimizer': 'Adam'}.
2026-06-03 08:44:48,919 - optuna.study.study - INFO - Trial 227 finished with values: [0.10594642977580566, 0.013107039989282605, 0.059845706417815996] and parameters: {'n_layers': 1, 'embedding_dim': 64, 'lr': 0.0017600601147055445, 'lambda_val': 6.624143397965627e-05, 'batch_size': 1346, 'optimizer': 'Adam'}.
2026-06-03 08:47:31,864 - optuna.study.study - INFO - Trial 228 finished with values: [0.09075809030850342, 0.011566414361310201, 0.049729854255293686] and parameters: {'n_layers': 1, 'embedding_dim': 64, 'lr': 0.0009344685265310301, 'lambda_val': 0.0014369013630720255, 'batch_size': 1966, 'optimizer': 'RMSprop'}.
2026-06-03 08:50:25,575 - optuna.study.study - INFO - Trial 229 finished with values: [0.09196273052322478, 0.011263313014937371, 0.048659219446724675] and parameters: {'n_layers': 1, 'embedding_dim': 128, 'lr': 0.0026263356328818884, 'lambda_val': 7.608004402487057e-06, 'batch_size': 600, 'optimizer': 'Adam'}.
2026-06-03 08:51:20,842 - experiment_functions - INFO - Early stopping at epoch 1150. Best Metrics: (0.08281305309993528, 0.01031716792819345, 0.043855705027544226)
2026-06-03 08:51:21,673 - optuna.study.study - INFO - Trial 230 finished with values: [0.08281305309993528, 0.01031716792819345, 0.043855705027544226] and parameters: {'n_layers': 2, 'embedding_dim': 128, 'lr': 0.0010353219839207425, 'lambda_val': 0.00042363702137007827, 'batch_size': 2273, 'optimizer': 'Adam'}.
2026-06-03 08:53:58,179 - optuna.study.study - INFO - Trial 231 finished with values: [0.080275620528036, 0.010626967646861813, 0.045961069584471353] and parameters: {'n_layers': 1, 'embedding_dim': 32, 'lr': 0.0009344685265310301, 'lambda_val': 0.0026848100129980676, 'batch_size': 1769, 'optimizer': 'Adam'}.
2026-06-03 08:56:37,161 - optuna.study.study - INFO - Trial 232 finished with values: [0.07034327018643156, 0.00977292517918146, 0.04160786909550964] and parameters: {'n_layers': 1, 'embedding_dim': 64, 'lr': 0.0007931132107821007, 'lambda_val': 2.8807178813664366e-05, 'batch_size': 1441, 'optimizer': 'Adam'}.
2026-06-03 08:57:04,684 - experiment_functions - INFO - Early stopping at epoch 550. Best Metrics: (0.0005438925178190572, 7.703128139862015e-05, 0.0002634804425914673)
2026-06-03 08:57:04,756 - optuna.study.study - INFO - Trial 233 finished with values: [0.0005438925178190572, 7.703128139862015e-05, 0.0002634804425914673] and parameters: {'n_layers': 1, 'embedding_dim': 256, 'lr': 6.846972616582888e-05, 'lambda_val': 0.00019590833476144278, 'batch_size': 2448, 'optimizer': 'RMSprop'}.
2026-06-03 08:59:50,495 - optuna.study.study - INFO - Trial 234 finished with values: [0.08620151085025454, 0.011134369348248378, 0.050571816396283505] and parameters: {'n_layers': 1, 'embedding_dim': 96, 'lr': 0.0007931132107821007, 'lambda_val': 0.0006353517335696762, 'batch_size': 1441, 'optimizer': 'RMSprop'}.
2026-06-03 09:00:33,915 - experiment_functions - INFO - Early stopping at epoch 1050. Best Metrics: (0.032897998782309194, 0.004015674191171545, 0.01519444058363229)
2026-06-03 09:00:34,019 - optuna.study.study - INFO - Trial 235 finished with values: [0.032897998782309194, 0.004015674191171545, 0.01519444058363229] and parameters: {'n_layers': 3, 'embedding_dim': 32, 'lr': 0.0017600601147055445, 'lambda_val': 0.0014369013630720255, 'batch_size': 1966, 'optimizer': 'RMSprop'}.
2026-06-03 09:03:35,209 - optuna.study.study - INFO - Trial 236 finished with values: [0.00130666290942439, 0.00020430035501373166, 0.0006572693352874732] and parameters: {'n_layers': 1, 'embedding_dim': 256, 'lr': 0.0002143090370477042, 'lambda_val': 0.0002814016114171031, 'batch_size': 1441, 'optimizer': 'RMSprop'}.
2026-06-03 09:06:21,828 - optuna.study.study - INFO - Trial 237 finished with values: [0.042458059563544495, 0.006624690200281332, 0.025514361999769784] and parameters: {'n_layers': 1, 'embedding_dim': 128, 'lr': 0.00045181778495769544, 'lambda_val': 0.001324656891850075, 'batch_size': 2315, 'optimizer': 'Adam'}.
2026-06-03 09:09:06,609 - optuna.study.study - INFO - Trial 238 finished with values: [0.07805069793357233, 0.010534865027798246, 0.04642206635290684] and parameters: {'n_layers': 1, 'embedding_dim': 96, 'lr': 0.0007931132107821007, 'lambda_val': 0.00031016945451823507, 'batch_size': 1441, 'optimizer': 'Adam'}.
2026-06-03 09:11:50,246 - optuna.study.study - INFO - Trial 239 finished with values: [0.06112504717315541, 0.008748074217965036, 0.03657881293529468] and parameters: {'n_layers': 1, 'embedding_dim': 96, 'lr': 0.0009463388507176841, 'lambda_val': 4.5805610201863314e-06, 'batch_size': 628, 'optimizer': 'Adam'}.
2026-06-03 09:12:45,362 - experiment_functions - INFO - Early stopping at epoch 1300. Best Metrics: (0.09566286808014902, 0.01188458704534798, 0.05139734882788343)
2026-06-03 09:12:45,455 - optuna.study.study - INFO - Trial 240 finished with values: [0.09566286808014902, 0.01188458704534798, 0.05139734882788343] and parameters: {'n_layers': 1, 'embedding_dim': 64, 'lr': 0.0017600601147055445, 'lambda_val': 2.8807178813664366e-05, 'batch_size': 2273, 'optimizer': 'RMSprop'}.
2026-06-03 09:16:08,702 - experiment_functions - INFO - Early stopping at epoch 3750. Best Metrics: (0.04824218259655134, 0.005417308594011656, 0.022417089294332417)
2026-06-03 09:16:08,806 - optuna.study.study - INFO - Trial 241 finished with values: [0.04824218259655134, 0.005417308594011656, 0.022417089294332417] and parameters: {'n_layers': 2, 'embedding_dim': 256, 'lr': 0.006108566649059157, 'lambda_val': 4.5805610201863314e-06, 'batch_size': 2234, 'optimizer': 'Adam'}.
2026-06-03 09:17:42,015 - experiment_functions - INFO - Early stopping at epoch 1950. Best Metrics: (0.06827224356614389, 0.0083662669971197, 0.035942347077130975)
2026-06-03 09:17:42,105 - optuna.study.study - INFO - Trial 242 finished with values: [0.06827224356614389, 0.0083662669971197, 0.035942347077130975] and parameters: {'n_layers': 3, 'embedding_dim': 96, 'lr': 0.0007931132107821007, 'lambda_val': 7.608004402487057e-06, 'batch_size': 2315, 'optimizer': 'Adam'}.
2026-06-03 09:20:34,594 - optuna.study.study - INFO - Trial 243 finished with values: [0.03340416729183399, 0.0038699845937437208, 0.015434052213640583] and parameters: {'n_layers': 2, 'embedding_dim': 96, 'lr': 0.008408133081698252, 'lambda_val': 0.00031016945451823507, 'batch_size': 600, 'optimizer': 'Adam'}.
2026-06-03 09:21:26,055 - experiment_functions - INFO - Early stopping at epoch 1200. Best Metrics: (0.0720293506170955, 0.008637551075088755, 0.03524047357748054)
2026-06-03 09:21:26,172 - optuna.study.study - INFO - Trial 244 finished with values: [0.0720293506170955, 0.008637551075088755, 0.03524047357748054] and parameters: {'n_layers': 1, 'embedding_dim': 96, 'lr': 0.0026263356328818884, 'lambda_val': 0.000868123514447947, 'batch_size': 1441, 'optimizer': 'RMSprop'}.
2026-06-03 09:22:07,251 - experiment_functions - INFO - Early stopping at epoch 900. Best Metrics: (0.04577331957422586, 0.005474244758523678, 0.021497515441664585)
2026-06-03 09:22:07,527 - optuna.study.study - INFO - Trial 245 finished with values: [0.04577331957422586, 0.005474244758523678, 0.021497515441664585] and parameters: {'n_layers': 3, 'embedding_dim': 64, 'lr': 0.0026263356328818884, 'lambda_val': 1.6263951880298748e-05, 'batch_size': 2315, 'optimizer': 'Adam'}.
2026-06-03 09:24:37,509 - optuna.study.study - INFO - Trial 246 finished with values: [0.021033866366776875, 0.0034932011521200354, 0.012350300755038197] and parameters: {'n_layers': 1, 'embedding_dim': 32, 'lr': 0.00045181778495769544, 'lambda_val': 7.608004402487057e-06, 'batch_size': 2315, 'optimizer': 'Adam'}.
2026-06-03 09:27:16,647 - experiment_functions - INFO - Early stopping at epoch 3950. Best Metrics: (0.0790255520082138, 0.009968852568825777, 0.044054770228646484)
2026-06-03 09:27:16,739 - optuna.study.study - INFO - Trial 247 finished with values: [0.0790255520082138, 0.009968852568825777, 0.044054770228646484] and parameters: {'n_layers': 2, 'embedding_dim': 32, 'lr': 0.0007931132107821007, 'lambda_val': 0.00042363702137007827, 'batch_size': 1441, 'optimizer': 'Adam'}.
2026-06-03 09:28:07,069 - experiment_functions - INFO - Early stopping at epoch 1200. Best Metrics: (0.0952338604830015, 0.01188961082456963, 0.05178809453488641)
2026-06-03 09:28:07,751 - optuna.study.study - INFO - Trial 248 finished with values: [0.0952338604830015, 0.01188961082456963, 0.05178809453488641] and parameters: {'n_layers': 1, 'embedding_dim': 64, 'lr': 0.0026263356328818884, 'lambda_val': 0.00015385577228629684, 'batch_size': 1441, 'optimizer': 'Adam'}.
2026-06-03 09:31:01,650 - optuna.study.study - INFO - Trial 249 finished with values: [0.0997594639668578, 0.012757050036841048, 0.055148188433414506] and parameters: {'n_layers': 1, 'embedding_dim': 128, 'lr': 0.0006271642154522829, 'lambda_val': 0.000868123514447947, 'batch_size': 4079, 'optimizer': 'Adam'}.
2026-06-03 09:33:54,238 - optuna.study.study - INFO - Trial 250 finished with values: [0.09446485464048379, 0.012160894902538685, 0.05473393809352257] and parameters: {'n_layers': 1, 'embedding_dim': 128, 'lr': 0.0009463388507176841, 'lambda_val': 0.0005936250566304678, 'batch_size': 1281, 'optimizer': 'Adam'}.
2026-06-03 09:36:38,516 - optuna.study.study - INFO - Trial 251 finished with values: [0.10216476134597817, 0.01285752562127403, 0.057551868926228406] and parameters: {'n_layers': 1, 'embedding_dim': 64, 'lr': 0.0017600601147055445, 'lambda_val': 6.624143397965627e-05, 'batch_size': 995, 'optimizer': 'Adam'}.
2026-06-03 09:39:26,764 - optuna.study.study - INFO - Trial 252 finished with values: [0.1034808931104604, 0.013128809699243084, 0.05831682954089057] and parameters: {'n_layers': 1, 'embedding_dim': 96, 'lr': 0.0009463388507176841, 'lambda_val': 0.00031016945451823507, 'batch_size': 2234, 'optimizer': 'Adam'}.
2026-06-03 09:40:14,105 - experiment_functions - INFO - Early stopping at epoch 1100. Best Metrics: (0.07539251500593597, 0.008940652421461586, 0.037773498164532654)
2026-06-03 09:40:14,188 - optuna.study.study - INFO - Trial 253 finished with values: [0.07539251500593597, 0.008940652421461586, 0.037773498164532654] and parameters: {'n_layers': 1, 'embedding_dim': 96, 'lr': 0.0026263356328818884, 'lambda_val': 0.00031016945451823507, 'batch_size': 2360, 'optimizer': 'RMSprop'}.
