2026-06-03 04:27:44,627 - optuna.study.study - INFO - Trial 93 finished with values: [0.023543637293894516, 0.0028484828186750625, 0.010570982580349329] and parameters: {'n_layers': 4, 'embedding_dim': 32, 'lr': 0.00391055153287547, 'lambda_val': 0.0026848100129980676, 'batch_size': 2273, 'optimizer': 'Adam'}.
2026-06-03 04:30:47,464 - optuna.study.study - INFO - Trial 94 finished with values: [0.04194690528453579, 0.005809163373300287, 0.02210699393027906] and parameters: {'n_layers': 3, 'embedding_dim': 96, 'lr': 0.0002143090370477042, 'lambda_val': 1.3018932096194356e-06, 'batch_size': 2448, 'optimizer': 'Adam'}.
2026-06-03 04:32:26,709 - experiment_functions - INFO - Early stopping at epoch 1900. Best Metrics: (0.016467368230561802, 0.002228883381338335, 0.007547584677703483)
2026-06-03 04:32:27,105 - optuna.study.study - INFO - Trial 95 finished with values: [0.016467368230561802, 0.002228883381338335, 0.007547584677703483] and parameters: {'n_layers': 4, 'embedding_dim': 128, 'lr': 0.0008218958871259177, 'lambda_val': 0.01662424548106528, 'batch_size': 3816, 'optimizer': 'RMSprop'}.
2026-06-03 04:35:29,273 - optuna.study.study - INFO - Trial 96 finished with values: [0.05925290608587882, 0.006993100676535603, 0.029363466742329383] and parameters: {'n_layers': 2, 'embedding_dim': 128, 'lr': 0.006108566649059157, 'lambda_val': 1.3145520728365675e-06, 'batch_size': 877, 'optimizer': 'RMSprop'}.
2026-06-03 04:38:18,947 - optuna.study.study - INFO - Trial 97 finished with values: [0.017910470530970744, 0.0030125929399156008, 0.009998906705663248] and parameters: {'n_layers': 2, 'embedding_dim': 96, 'lr': 0.0002143090370477042, 'lambda_val': 0.003485985825944796, 'batch_size': 2448, 'optimizer': 'Adam'}.
2026-06-03 04:38:43,494 - experiment_functions - INFO - Early stopping at epoch 550. Best Metrics: (0.03005083841394285, 0.0034865027798245025, 0.014311276763404131)
2026-06-03 04:38:43,590 - optuna.study.study - INFO - Trial 98 finished with values: [0.03005083841394285, 0.0034865027798245025, 0.014311276763404131] and parameters: {'n_layers': 2, 'embedding_dim': 64, 'lr': 0.05605085711216016, 'lambda_val': 0.0006092016125409939, 'batch_size': 1321, 'optimizer': 'Adam'}.
2026-06-03 04:39:25,975 - experiment_functions - INFO - Early stopping at epoch 600. Best Metrics: (0.007316007269110218, 0.0008774867707147164, 0.0031562432560489698)
2026-06-03 04:39:26,155 - optuna.study.study - INFO - Trial 99 finished with values: [0.007316007269110218, 0.0008774867707147164, 0.0031562432560489698] and parameters: {'n_layers': 4, 'embedding_dim': 256, 'lr': 0.04199609198569572, 'lambda_val': 0.023142945755860466, 'batch_size': 3643, 'optimizer': 'Adam'}.
2026-06-03 04:42:15,381 - optuna.study.study - INFO - Trial 100 finished with values: [0.10527478254807134, 0.013187420456828993, 0.058844694206104636] and parameters: {'n_layers': 1, 'embedding_dim': 96, 'lr': 0.0009463388507176841, 'lambda_val': 4.5805610201863314e-06, 'batch_size': 2234, 'optimizer': 'Adam'}.
2026-06-03 04:45:05,182 - optuna.study.study - INFO - Trial 101 finished with values: [0.05884260040670556, 0.006815593810704, 0.027992319133545537] and parameters: {'n_layers': 1, 'embedding_dim': 128, 'lr': 0.00511270340142449, 'lambda_val': 0.000868123514447947, 'batch_size': 2273, 'optimizer': 'RMSprop'}.
2026-06-03 04:48:19,575 - optuna.study.study - INFO - Trial 102 finished with values: [0.044537753098835696, 0.005951503784580346, 0.0236896345244713] and parameters: {'n_layers': 4, 'embedding_dim': 96, 'lr': 0.0002143090370477042, 'lambda_val': 0.0006353517335696762, 'batch_size': 1232, 'optimizer': 'RMSprop'}.
2026-06-03 04:49:07,311 - experiment_functions - INFO - Early stopping at epoch 1150. Best Metrics: (0.03097345918604749, 0.0037008506932815328, 0.014246788654923346)
2026-06-03 04:49:07,408 - optuna.study.study - INFO - Trial 103 finished with values: [0.03097345918604749, 0.0037008506932815328, 0.014246788654923346] and parameters: {'n_layers': 3, 'embedding_dim': 32, 'lr': 0.004311872557114808, 'lambda_val': 0.0006353517335696762, 'batch_size': 2273, 'optimizer': 'Adam'}.
2026-06-03 04:49:30,907 - experiment_functions - INFO - Early stopping at epoch 550. Best Metrics: (0.02798668893971907, 0.0035434389443365264, 0.013945230434600747)
2026-06-03 04:49:31,332 - optuna.study.study - INFO - Trial 104 finished with values: [0.02798668893971907, 0.0035434389443365264, 0.013945230434600747] and parameters: {'n_layers': 2, 'embedding_dim': 32, 'lr': 0.036125955900243076, 'lambda_val': 3.3594667226233163e-06, 'batch_size': 1674, 'optimizer': 'RMSprop'}.
2026-06-03 04:52:44,463 - optuna.study.study - INFO - Trial 105 finished with values: [0.03705476727321929, 0.005087413758456695, 0.01967573473964574] and parameters: {'n_layers': 4, 'embedding_dim': 96, 'lr': 0.00017926430681304515, 'lambda_val': 1.3145520728365675e-06, 'batch_size': 1600, 'optimizer': 'RMSprop'}.
2026-06-03 04:55:58,490 - optuna.study.study - INFO - Trial 106 finished with values: [0.03959978939326606, 0.005482617723893093, 0.020545807982236756] and parameters: {'n_layers': 4, 'embedding_dim': 96, 'lr': 0.0002143090370477042, 'lambda_val': 0.00031016945451823507, 'batch_size': 1441, 'optimizer': 'Adam'}.
2026-06-03 04:56:32,868 - experiment_functions - INFO - Early stopping at epoch 750. Best Metrics: (0.09254444518036604, 0.011492732266059347, 0.04979503269284214)
2026-06-03 04:56:32,968 - optuna.study.study - INFO - Trial 107 finished with values: [0.09254444518036604, 0.011492732266059347, 0.04979503269284214] and parameters: {'n_layers': 1, 'embedding_dim': 128, 'lr': 0.004311872557114808, 'lambda_val': 2.8807178813664366e-05, 'batch_size': 2273, 'optimizer': 'Adam'}.
2026-06-03 04:59:21,115 - optuna.study.study - INFO - Trial 108 finished with values: [0.0531343395517317, 0.006112264719673121, 0.024642842058320687] and parameters: {'n_layers': 1, 'embedding_dim': 128, 'lr': 0.008408133081698252, 'lambda_val': 2.8807178813664366e-05, 'batch_size': 639, 'optimizer': 'Adam'}.
2026-06-03 05:03:43,183 - experiment_functions - INFO - Early stopping at epoch 3900. Best Metrics: (0.03765376807162631, 0.0043656641436131014, 0.017093914101239057)
2026-06-03 05:03:43,556 - optuna.study.study - INFO - Trial 109 finished with values: [0.03765376807162631, 0.0043656641436131014, 0.017093914101239057] and parameters: {'n_layers': 4, 'embedding_dim': 256, 'lr': 0.002379873643338375, 'lambda_val': 6.624143397965627e-05, 'batch_size': 2355, 'optimizer': 'RMSprop'}.
2026-06-03 05:06:53,641 - optuna.study.study - INFO - Trial 110 finished with values: [0.011407700695396069, 0.001473641905017081, 0.005187242447719511] and parameters: {'n_layers': 4, 'embedding_dim': 96, 'lr': 0.0007931132107821007, 'lambda_val': 0.02018887560132656, 'batch_size': 933, 'optimizer': 'RMSprop'}.
2026-06-03 05:09:41,098 - experiment_functions - INFO - Early stopping at epoch 3850. Best Metrics: (0.04550682164096052, 0.004693884386094179, 0.02090165280868699)
2026-06-03 05:09:41,192 - optuna.study.study - INFO - Trial 111 finished with values: [0.04550682164096052, 0.004693884386094179, 0.02090165280868699] and parameters: {'n_layers': 2, 'embedding_dim': 96, 'lr': 0.018167097127187466, 'lambda_val': 1.3018932096194356e-06, 'batch_size': 2448, 'optimizer': 'Adam'}.
2026-06-03 05:11:15,919 - experiment_functions - INFO - Early stopping at epoch 2250. Best Metrics: (0.049643689714604804, 0.006552682698104361, 0.025557833316361477)
2026-06-03 05:11:16,069 - optuna.study.study - INFO - Trial 112 finished with values: [0.049643689714604804, 0.006552682698104361, 0.025557833316361477] and parameters: {'n_layers': 1, 'embedding_dim': 128, 'lr': 0.001569262341931714, 'lambda_val': 0.02518430669345533, 'batch_size': 600, 'optimizer': 'Adam'}.
2026-06-03 05:13:53,784 - optuna.study.study - INFO - Trial 113 finished with values: [0.04731699814405725, 0.005708687788867306, 0.022350320755760836] and parameters: {'n_layers': 1, 'embedding_dim': 64, 'lr': 0.0078386796546334, 'lambda_val': 0.000868123514447947, 'batch_size': 600, 'optimizer': 'RMSprop'}.
2026-06-03 05:14:22,294 - experiment_functions - INFO - Early stopping at epoch 550. Best Metrics: (0.01593279479002682, 0.0019291312211132693, 0.007883638917317701)
2026-06-03 05:14:22,390 - optuna.study.study - INFO - Trial 114 finished with values: [0.01593279479002682, 0.0019291312211132693, 0.007883638917317701] and parameters: {'n_layers': 4, 'embedding_dim': 96, 'lr': 0.0059546790300672265, 'lambda_val': 0.04480058747584424, 'batch_size': 855, 'optimizer': 'RMSprop'}.
2026-06-03 05:14:55,035 - experiment_functions - INFO - Early stopping at epoch 750. Best Metrics: (0.03594069507474448, 0.004462790541898319, 0.0165260866343289)
2026-06-03 05:14:55,125 - optuna.study.study - INFO - Trial 115 finished with values: [0.03594069507474448, 0.004462790541898319, 0.0165260866343289] and parameters: {'n_layers': 2, 'embedding_dim': 64, 'lr': 0.0034685071070209975, 'lambda_val': 0.004439823730306383, 'batch_size': 1575, 'optimizer': 'Adam'}.
2026-06-03 05:15:51,140 - experiment_functions - INFO - Early stopping at epoch 1350. Best Metrics: (0.0005989115297563381, 7.53566883247371e-05, 0.0002705315467795675)
2026-06-03 05:15:51,556 - optuna.study.study - INFO - Trial 116 finished with values: [0.0005989115297563381, 7.53566883247371e-05, 0.0002705315467795675] and parameters: {'n_layers': 1, 'embedding_dim': 128, 'lr': 2.700413620121859e-05, 'lambda_val': 0.0002039132797027864, 'batch_size': 2273, 'optimizer': 'RMSprop'}.
2026-06-03 05:18:51,480 - optuna.study.study - INFO - Trial 117 finished with values: [0.03134121213585209, 0.003297273762475719, 0.013761061293311597] and parameters: {'n_layers': 4, 'embedding_dim': 64, 'lr': 0.013617980368711006, 'lambda_val': 1.5381898362420838e-05, 'batch_size': 3598, 'optimizer': 'Adam'}.
2026-06-03 05:21:02,756 - experiment_functions - INFO - Early stopping at epoch 2700. Best Metrics: (0.029469877871509665, 0.003211869515707683, 0.012799650651136297)
2026-06-03 05:21:03,749 - optuna.study.study - INFO - Trial 118 finished with values: [0.029469877871509665, 0.003211869515707683, 0.012799650651136297] and parameters: {'n_layers': 4, 'embedding_dim': 96, 'lr': 0.007710552789847537, 'lambda_val': 1.3145520728365675e-06, 'batch_size': 1904, 'optimizer': 'Adam'}.
2026-06-03 05:23:44,435 - optuna.study.study - INFO - Trial 119 finished with values: [0.07521452731999816, 0.00925715051242548, 0.03933496192768121] and parameters: {'n_layers': 2, 'embedding_dim': 32, 'lr': 0.0010353219839207425, 'lambda_val': 0.00042363702137007827, 'batch_size': 2273, 'optimizer': 'Adam'}.
2026-06-03 05:26:27,249 - optuna.study.study - INFO - Trial 120 finished with values: [0.061594689583792536, 0.007612700113872329, 0.031211668783442944] and parameters: {'n_layers': 3, 'embedding_dim': 32, 'lr': 0.00045181778495769544, 'lambda_val': 7.608004402487057e-06, 'batch_size': 2315, 'optimizer': 'Adam'}.
2026-06-03 05:26:55,242 - experiment_functions - INFO - Early stopping at epoch 650. Best Metrics: (0.018807435115198567, 0.0021652488445307793, 0.008135063461169172)
2026-06-03 05:26:55,412 - optuna.study.study - INFO - Trial 121 finished with values: [0.018807435115198567, 0.0021652488445307793, 0.008135063461169172] and parameters: {'n_layers': 1, 'embedding_dim': 96, 'lr': 0.01447735814370163, 'lambda_val': 0.02018887560132656, 'batch_size': 2234, 'optimizer': 'RMSprop'}.
2026-06-03 05:27:30,809 - experiment_functions - INFO - Early stopping at epoch 500. Best Metrics: (0.04683185107394314, 0.005944805412284815, 0.024808635385026288)
2026-06-03 05:27:30,907 - optuna.study.study - INFO - Trial 122 finished with values: [0.04683185107394314, 0.005944805412284815, 0.024808635385026288] and parameters: {'n_layers': 4, 'embedding_dim': 256, 'lr': 0.05848561228434413, 'lambda_val': 0.0840407552704538, 'batch_size': 2355, 'optimizer': 'RMSprop'}.
2026-06-03 05:27:59,326 - experiment_functions - INFO - Early stopping at epoch 550. Best Metrics: (0.019418800055605673, 0.002208788264451738, 0.008743715686313764)
2026-06-03 05:27:59,419 - optuna.study.study - INFO - Trial 123 finished with values: [0.019418800055605673, 0.002208788264451738, 0.008743715686313764] and parameters: {'n_layers': 4, 'embedding_dim': 96, 'lr': 0.007710552789847537, 'lambda_val': 0.004439823730306383, 'batch_size': 1904, 'optimizer': 'RMSprop'}.
2026-06-03 05:30:36,814 - optuna.study.study - INFO - Trial 124 finished with values: [0.0025891074167448684, 0.0004789336191305513, 0.0014545521361104233] and parameters: {'n_layers': 1, 'embedding_dim': 96, 'lr': 0.0002143090370477042, 'lambda_val': 1.3018932096194356e-06, 'batch_size': 4077, 'optimizer': 'Adam'}.
2026-06-03 05:33:28,611 - optuna.study.study - INFO - Trial 125 finished with values: [0.03280190305004887, 0.0037427155201286088, 0.01458196289503932] and parameters: {'n_layers': 2, 'embedding_dim': 96, 'lr': 0.005371742021703193, 'lambda_val': 2.8807178813664366e-05, 'batch_size': 600, 'optimizer': 'Adam'}.
2026-06-03 05:36:44,020 - optuna.study.study - INFO - Trial 126 finished with values: [0.04799355206499712, 0.006026860472905084, 0.024384063078716312] and parameters: {'n_layers': 4, 'embedding_dim': 96, 'lr': 0.0002143090370477042, 'lambda_val': 1.3018932096194356e-06, 'batch_size': 2448, 'optimizer': 'Adam'}.
2026-06-03 05:37:05,833 - experiment_functions - INFO - Early stopping at epoch 500. Best Metrics: (0.0003739154404639852, 6.698372295532187e-05, 0.00020039026123391533)
2026-06-03 05:37:05,965 - optuna.study.study - INFO - Trial 127 finished with values: [0.0003739154404639852, 6.698372295532187e-05, 0.00020039026123391533] and parameters: {'n_layers': 1, 'embedding_dim': 96, 'lr': 3.083066094391554e-05, 'lambda_val': 0.04480058747584424, 'batch_size': 2234, 'optimizer': 'RMSprop'}.
2026-06-03 05:37:32,896 - experiment_functions - INFO - Early stopping at epoch 600. Best Metrics: (0.021071681837393604, 0.0025554290307455286, 0.009054571884406311)
2026-06-03 05:37:32,995 - optuna.study.study - INFO - Trial 128 finished with values: [0.021071681837393604, 0.0025554290307455286, 0.009054571884406311] and parameters: {'n_layers': 1, 'embedding_dim': 128, 'lr': 0.01111600846649195, 'lambda_val': 0.032978224929031345, 'batch_size': 2428, 'optimizer': 'Adam'}.
2026-06-03 05:38:00,024 - experiment_functions - INFO - Early stopping at epoch 550. Best Metrics: (0.02219826690823379, 0.0026659521736218097, 0.010049734356806193)
2026-06-03 05:38:00,115 - optuna.study.study - INFO - Trial 129 finished with values: [0.02219826690823379, 0.0026659521736218097, 0.010049734356806193] and parameters: {'n_layers': 3, 'embedding_dim': 96, 'lr': 0.006108566649059157, 'lambda_val': 0.003485985825944796, 'batch_size': 2448, 'optimizer': 'RMSprop'}.
2026-06-03 05:40:38,583 - experiment_functions - INFO - Early stopping at epoch 2650. Best Metrics: (0.009108062587755513, 0.001331301493737022, 0.004262756924020418)
2026-06-03 05:40:38,682 - optuna.study.study - INFO - Trial 130 finished with values: [0.009108062587755513, 0.001331301493737022, 0.004262756924020418] and parameters: {'n_layers': 3, 'embedding_dim': 256, 'lr': 0.00045181778495769544, 'lambda_val': 0.0840407552704538, 'batch_size': 2315, 'optimizer': 'RMSprop'}.
2026-06-03 05:41:02,874 - experiment_functions - INFO - Early stopping at epoch 550. Best Metrics: (0.006775458477396928, 0.0007451939178779556, 0.003440840360473182)
2026-06-03 05:41:02,965 - optuna.study.study - INFO - Trial 131 finished with values: [0.006775458477396928, 0.0007451939178779556, 0.003440840360473182] and parameters: {'n_layers': 4, 'embedding_dim': 32, 'lr': 0.05848561228434413, 'lambda_val': 0.0840407552704538, 'batch_size': 2355, 'optimizer': 'RMSprop'}.
2026-06-03 05:45:32,924 - optuna.study.study - INFO - Trial 132 finished with values: [0.03457208361320185, 0.004189831870855382, 0.015608021028111332] and parameters: {'n_layers': 4, 'embedding_dim': 256, 'lr': 0.0009344685265310301, 'lambda_val': 2.8807178813664366e-05, 'batch_size': 600, 'optimizer': 'Adam'}.
2026-06-03 05:47:42,517 - experiment_functions - INFO - Early stopping at epoch 2600. Best Metrics: (0.05594659040304714, 0.00718400428695827, 0.028190568049810266)
2026-06-03 05:47:42,993 - optuna.study.study - INFO - Trial 133 finished with values: [0.05594659040304714, 0.00718400428695827, 0.028190568049810266] and parameters: {'n_layers': 3, 'embedding_dim': 128, 'lr': 0.00045181778495769544, 'lambda_val': 0.0026848100129980676, 'batch_size': 2315, 'optimizer': 'Adam'}.
2026-06-03 05:48:12,130 - experiment_functions - INFO - Early stopping at epoch 550. Best Metrics: (0.039485761209116996, 0.004492933217228214, 0.018828824702818183)
2026-06-03 05:48:12,467 - optuna.study.study - INFO - Trial 134 finished with values: [0.039485761209116996, 0.004492933217228214, 0.018828824702818183] and parameters: {'n_layers': 4, 'embedding_dim': 96, 'lr': 0.036125955900243076, 'lambda_val': 2.296770310028916e-06, 'batch_size': 1674, 'optimizer': 'RMSprop'}.
2026-06-03 05:48:34,104 - experiment_functions - INFO - Early stopping at epoch 500. Best Metrics: (0.0005179033724261187, 7.368209525085404e-05, 0.00022977882084262988)
2026-06-03 05:48:34,294 - optuna.study.study - INFO - Trial 135 finished with values: [0.0005179033724261187, 7.368209525085404e-05, 0.00022977882084262988] and parameters: {'n_layers': 1, 'embedding_dim': 96, 'lr': 0.0026263356328818884, 'lambda_val': 1.627258280468188e-06, 'batch_size': 1441, 'optimizer': 'SGD'}.
2026-06-03 05:53:06,339 - optuna.study.study - INFO - Trial 136 finished with values: [0.06312231568566024, 0.008001205707013195, 0.03339206988894512] and parameters: {'n_layers': 4, 'embedding_dim': 256, 'lr': 0.0002143090370477042, 'lambda_val': 0.0002814016114171031, 'batch_size': 2448, 'optimizer': 'RMSprop'}.
2026-06-03 05:53:57,743 - experiment_functions - INFO - Early stopping at epoch 1200. Best Metrics: (0.03835665485195036, 0.004868042065778017, 0.018473695188143055)
2026-06-03 05:53:57,910 - optuna.study.study - INFO - Trial 137 finished with values: [0.03835665485195036, 0.004868042065778017, 0.018473695188143055] and parameters: {'n_layers': 4, 'embedding_dim': 32, 'lr': 0.0009344685265310301, 'lambda_val': 0.0014369013630720255, 'batch_size': 1295, 'optimizer': 'Adam'}.
2026-06-03 05:54:54,222 - experiment_functions - INFO - Early stopping at epoch 1350. Best Metrics: (0.08914225200836513, 0.011052314287628104, 0.047177468151533807)
2026-06-03 05:54:54,313 - optuna.study.study - INFO - Trial 138 finished with values: [0.08914225200836513, 0.011052314287628104, 0.047177468151533807] and parameters: {'n_layers': 1, 'embedding_dim': 64, 'lr': 0.0026263356328818884, 'lambda_val': 0.0012209141543013233, 'batch_size': 1346, 'optimizer': 'Adam'}.
2026-06-03 05:55:30,332 - experiment_functions - INFO - Early stopping at epoch 800. Best Metrics: (0.059067001919994803, 0.007103623819411883, 0.027688223657292836)
2026-06-03 05:55:31,350 - optuna.study.study - INFO - Trial 139 finished with values: [0.059067001919994803, 0.007103623819411883, 0.027688223657292836] and parameters: {'n_layers': 1, 'embedding_dim': 128, 'lr': 0.00511270340142449, 'lambda_val': 0.000868123514447947, 'batch_size': 870, 'optimizer': 'Adam'}.
2026-06-03 05:58:19,028 - optuna.study.study - INFO - Trial 140 finished with values: [0.047627824518144755, 0.005904615178511622, 0.02254695256741724] and parameters: {'n_layers': 1, 'embedding_dim': 128, 'lr': 0.0211050431003831, 'lambda_val': 0.0019118425504507368, 'batch_size': 2273, 'optimizer': 'RMSprop'}.
2026-06-03 05:59:31,794 - experiment_functions - INFO - Early stopping at epoch 1750. Best Metrics: (0.09321466059050296, 0.011479335521468284, 0.050413299505394346)
2026-06-03 05:59:31,889 - optuna.study.study - INFO - Trial 141 finished with values: [0.09321466059050296, 0.011479335521468284, 0.050413299505394346] and parameters: {'n_layers': 1, 'embedding_dim': 64, 'lr': 0.0017600601147055445, 'lambda_val': 6.624143397965627e-05, 'batch_size': 1769, 'optimizer': 'RMSprop'}.
2026-06-03 06:00:08,721 - experiment_functions - INFO - Early stopping at epoch 850. Best Metrics: (0.026099224284789797, 0.0031599571304173086, 0.01190223634915686)
2026-06-03 06:00:09,110 - optuna.study.study - INFO - Trial 142 finished with values: [0.026099224284789797, 0.0031599571304173086, 0.01190223634915686] and parameters: {'n_layers': 2, 'embedding_dim': 64, 'lr': 0.0034685071070209975, 'lambda_val': 0.0036173053146817007, 'batch_size': 1894, 'optimizer': 'RMSprop'}.
2026-06-03 06:00:40,070 - experiment_functions - INFO - Early stopping at epoch 550. Best Metrics: (0.018384061270972286, 0.0021836693683434925, 0.008505837619825655)
2026-06-03 06:00:40,165 - optuna.study.study - INFO - Trial 143 finished with values: [0.018384061270972286, 0.0021836693683434925, 0.008505837619825655] and parameters: {'n_layers': 4, 'embedding_dim': 128, 'lr': 0.007710552789847537, 'lambda_val': 0.003485985825944796, 'batch_size': 1904, 'optimizer': 'Adam'}.
2026-06-03 06:03:56,171 - optuna.study.study - INFO - Trial 144 finished with values: [0.04061109298202051, 0.00468383682765088, 0.018722276771481982] and parameters: {'n_layers': 3, 'embedding_dim': 128, 'lr': 0.036125955900243076, 'lambda_val': 0.000868123514447947, 'batch_size': 2273, 'optimizer': 'RMSprop'}.
2026-06-03 06:04:22,763 - experiment_functions - INFO - Early stopping at epoch 600. Best Metrics: (0.016618501181422142, 0.002026257619398486, 0.0075357054253455055)
2026-06-03 06:04:22,864 - optuna.study.study - INFO - Trial 145 finished with values: [0.016618501181422142, 0.002026257619398486, 0.0075357054253455055] and parameters: {'n_layers': 4, 'embedding_dim': 32, 'lr': 0.00391055153287547, 'lambda_val': 0.00950765150522855, 'batch_size': 2999, 'optimizer': 'Adam'}.
