2026-06-06 18:31:33,833 - optuna.study.study - INFO - Trial 217 finished with values: [0.03848500433037993, 0.004569964498626834, 0.017783600373032463] and parameters: {'n_layers': 4, 'embedding_dim': 128, 'lr': 0.0071610497772977115, 'lambda_val': 7.199693710203336e-05, 'batch_size': 3591, 'optimizer': 'Adam'}.
2026-06-06 18:34:19,173 - optuna.study.study - INFO - Trial 218 finished with values: [0.04613902089049456, 0.006395270949159355, 0.02718071207713543] and parameters: {'n_layers': 2, 'embedding_dim': 64, 'lr': 0.0005151812249168082, 'lambda_val': 0.0005031918520424605, 'batch_size': 675, 'optimizer': 'RMSprop'}.
2026-06-06 18:37:13,304 - optuna.study.study - INFO - Trial 219 finished with values: [0.055415875576146724, 0.007512224529439347, 0.029052286441575065] and parameters: {'n_layers': 2, 'embedding_dim': 96, 'lr': 0.00039823438048122364, 'lambda_val': 0.0028258090394084607, 'batch_size': 2277, 'optimizer': 'Adam'}.
2026-06-06 18:40:17,252 - optuna.study.study - INFO - Trial 220 finished with values: [0.03502836411362773, 0.00538716591868176, 0.020979529692956023] and parameters: {'n_layers': 1, 'embedding_dim': 256, 'lr': 0.0005151812249168082, 'lambda_val': 0.0002757363874074985, 'batch_size': 1717, 'optimizer': 'Adam'}.
2026-06-06 18:43:16,114 - optuna.study.study - INFO - Trial 221 finished with values: [0.06045520818390567, 0.0072844798713912525, 0.031251490399591464] and parameters: {'n_layers': 4, 'embedding_dim': 64, 'lr': 0.0007970006502074318, 'lambda_val': 1.2160816785194988e-06, 'batch_size': 953, 'optimizer': 'Adam'}.
2026-06-06 18:44:44,232 - experiment_functions - INFO - Early stopping at epoch 1900. Best Metrics: (0.07133965857263914, 0.009072945274298347, 0.0372420767539293)
2026-06-06 18:44:45,448 - optuna.study.study - INFO - Trial 222 finished with values: [0.07133965857263914, 0.009072945274298347, 0.0372420767539293] and parameters: {'n_layers': 2, 'embedding_dim': 96, 'lr': 0.0006507771018879831, 'lambda_val': 0.0014674492199833664, 'batch_size': 1985, 'optimizer': 'RMSprop'}.
2026-06-06 18:45:47,354 - experiment_functions - INFO - Early stopping at epoch 900. Best Metrics: (0.04866556397190813, 0.005991694018353541, 0.02348023647998889)
2026-06-06 18:45:49,185 - optuna.study.study - INFO - Trial 223 finished with values: [0.04866556397190813, 0.005991694018353541, 0.02348023647998889] and parameters: {'n_layers': 4, 'embedding_dim': 256, 'lr': 0.0007970006502074318, 'lambda_val': 0.0008971608129751253, 'batch_size': 3591, 'optimizer': 'Adam'}.
2026-06-06 18:48:31,981 - optuna.study.study - INFO - Trial 224 finished with values: [0.06098674257837908, 0.00831100542568156, 0.03476468797010031] and parameters: {'n_layers': 1, 'embedding_dim': 64, 'lr': 0.0006507771018879831, 'lambda_val': 0.0005031918520424605, 'batch_size': 2277, 'optimizer': 'RMSprop'}.
2026-06-06 18:49:02,984 - experiment_functions - INFO - Early stopping at epoch 550. Best Metrics: (0.025986519282493376, 0.003025989684506665, 0.01211304117114032)
2026-06-06 18:49:04,131 - optuna.study.study - INFO - Trial 225 finished with values: [0.025986519282493376, 0.003025989684506665, 0.01211304117114032] and parameters: {'n_layers': 2, 'embedding_dim': 64, 'lr': 0.013303898514410165, 'lambda_val': 0.0028258090394084607, 'batch_size': 1966, 'optimizer': 'RMSprop'}.
2026-06-06 18:52:15,253 - optuna.study.study - INFO - Trial 226 finished with values: [0.06616107982177451, 0.008227275771987407, 0.0357319123148811] and parameters: {'n_layers': 3, 'embedding_dim': 128, 'lr': 0.0004543711173429324, 'lambda_val': 1.4780082520235353e-05, 'batch_size': 1031, 'optimizer': 'RMSprop'}.
2026-06-06 18:54:57,047 - optuna.study.study - INFO - Trial 227 finished with values: [0.05074787092053831, 0.0070299417241610285, 0.02918930293280537] and parameters: {'n_layers': 1, 'embedding_dim': 64, 'lr': 0.0005151812249168082, 'lambda_val': 0.0001948847941844892, 'batch_size': 3074, 'optimizer': 'RMSprop'}.
2026-06-06 18:57:54,548 - optuna.study.study - INFO - Trial 228 finished with values: [0.053222978519991165, 0.006723491191640432, 0.02846498281409278] and parameters: {'n_layers': 4, 'embedding_dim': 64, 'lr': 0.00039823438048122364, 'lambda_val': 2.4505146265384152e-06, 'batch_size': 953, 'optimizer': 'Adam'}.
2026-06-06 19:00:30,196 - experiment_functions - INFO - Early stopping at epoch 3250. Best Metrics: (0.06228328503449118, 0.007559113135508071, 0.03232150282739795)
2026-06-06 19:00:31,140 - optuna.study.study - INFO - Trial 229 finished with values: [0.06228328503449118, 0.007559113135508071, 0.03232150282739795] and parameters: {'n_layers': 4, 'embedding_dim': 96, 'lr': 0.0005151812249168082, 'lambda_val': 3.4875481690343986e-06, 'batch_size': 2440, 'optimizer': 'Adam'}.
2026-06-06 19:01:41,324 - experiment_functions - INFO - Early stopping at epoch 1300. Best Metrics: (0.013510833909498775, 0.0016913390046218771, 0.005998864855491251)
2026-06-06 19:01:42,305 - optuna.study.study - INFO - Trial 230 finished with values: [0.013510833909498775, 0.0016913390046218771, 0.005998864855491251] and parameters: {'n_layers': 2, 'embedding_dim': 256, 'lr': 0.005596800397668782, 'lambda_val': 0.03189442585908832, 'batch_size': 2302, 'optimizer': 'RMSprop'}.
2026-06-06 19:02:34,243 - experiment_functions - INFO - Early stopping at epoch 1000. Best Metrics: (0.06597564147122242, 0.007719874070600845, 0.03274408834046409)
2026-06-06 19:02:35,987 - optuna.study.study - INFO - Trial 231 finished with values: [0.06597564147122242, 0.007719874070600845, 0.03274408834046409] and parameters: {'n_layers': 2, 'embedding_dim': 128, 'lr': 0.0016310133844241697, 'lambda_val': 1.4780082520235353e-05, 'batch_size': 3074, 'optimizer': 'RMSprop'}.
2026-06-06 19:03:07,261 - experiment_functions - INFO - Early stopping at epoch 550. Best Metrics: (0.012354455593693532, 0.0015222051041596893, 0.006266319562628132)
2026-06-06 19:03:08,317 - optuna.study.study - INFO - Trial 232 finished with values: [0.012354455593693532, 0.0015222051041596893, 0.006266319562628132] and parameters: {'n_layers': 2, 'embedding_dim': 128, 'lr': 0.055274444803765525, 'lambda_val': 7.199693710203336e-05, 'batch_size': 2396, 'optimizer': 'RMSprop'}.
2026-06-06 19:05:57,402 - optuna.study.study - INFO - Trial 233 finished with values: [0.06950563267928378, 0.00882343090628977, 0.03758051932700875] and parameters: {'n_layers': 2, 'embedding_dim': 64, 'lr': 0.0005151812249168082, 'lambda_val': 1.4780082520235353e-05, 'batch_size': 2277, 'optimizer': 'Adam'}.
2026-06-06 19:08:51,906 - optuna.study.study - INFO - Trial 234 finished with values: [0.09451816340025142, 0.011725500703329091, 0.051296897273571486] and parameters: {'n_layers': 1, 'embedding_dim': 128, 'lr': 0.0007970006502074318, 'lambda_val': 3.3494997586996853e-06, 'batch_size': 3622, 'optimizer': 'RMSprop'}.
2026-06-06 19:11:31,184 - experiment_functions - INFO - Early stopping at epoch 3450. Best Metrics: (0.08285045552360037, 0.00999899524415567, 0.04278667963804754)
2026-06-06 19:11:32,112 - optuna.study.study - INFO - Trial 235 finished with values: [0.08285045552360037, 0.00999899524415567, 0.04278667963804754] and parameters: {'n_layers': 2, 'embedding_dim': 128, 'lr': 0.0007970006502074318, 'lambda_val': 4.5847333595117975e-06, 'batch_size': 3074, 'optimizer': 'Adam'}.
2026-06-06 19:14:59,113 - optuna.study.study - INFO - Trial 236 finished with values: [0.07981856483885251, 0.010116216759327484, 0.04418607093323884] and parameters: {'n_layers': 2, 'embedding_dim': 256, 'lr': 0.00039823438048122364, 'lambda_val': 4.5847333595117975e-06, 'batch_size': 2259, 'optimizer': 'RMSprop'}.
2026-06-06 19:15:33,229 - experiment_functions - INFO - Early stopping at epoch 600. Best Metrics: (0.043474523965774906, 0.005102485096121643, 0.02017073511726854)
2026-06-06 19:15:34,777 - optuna.study.study - INFO - Trial 237 finished with values: [0.043474523965774906, 0.005102485096121643, 0.02017073511726854] and parameters: {'n_layers': 2, 'embedding_dim': 128, 'lr': 0.007291242630141284, 'lambda_val': 0.0005031918520424605, 'batch_size': 1966, 'optimizer': 'Adam'}.
2026-06-06 19:18:16,557 - optuna.study.study - INFO - Trial 238 finished with values: [0.0204803632449639, 0.0033592337062093914, 0.012318121284237017] and parameters: {'n_layers': 1, 'embedding_dim': 96, 'lr': 0.00042756933980022364, 'lambda_val': 0.0005031918520424605, 'batch_size': 2277, 'optimizer': 'Adam'}.
2026-06-06 19:18:46,539 - experiment_functions - INFO - Early stopping at epoch 500. Best Metrics: (0.000530332580952633, 8.372965369415233e-05, 0.00023888754203122515)
2026-06-06 19:18:47,515 - optuna.study.study - INFO - Trial 239 finished with values: [0.000530332580952633, 8.372965369415233e-05, 0.00023888754203122515] and parameters: {'n_layers': 1, 'embedding_dim': 256, 'lr': 1.5194828820184838e-05, 'lambda_val': 7.650473592526119e-05, 'batch_size': 2277, 'optimizer': 'Adam'}.
2026-06-06 19:20:46,769 - experiment_functions - INFO - Early stopping at epoch 2850. Best Metrics: (0.000589148276086782, 9.210261906356756e-05, 0.000252617518358989)
2026-06-06 19:20:47,775 - optuna.study.study - INFO - Trial 240 finished with values: [0.000589148276086782, 9.210261906356756e-05, 0.000252617518358989] and parameters: {'n_layers': 1, 'embedding_dim': 128, 'lr': 6.289828812155723e-05, 'lambda_val': 0.0010107943380007207, 'batch_size': 3317, 'optimizer': 'RMSprop'}.
2026-06-06 19:23:05,097 - experiment_functions - INFO - Early stopping at epoch 2950. Best Metrics: (0.08459229984608768, 0.010261906356755307, 0.04373804498652873)
2026-06-06 19:23:06,024 - optuna.study.study - INFO - Trial 241 finished with values: [0.08459229984608768, 0.010261906356755307, 0.04373804498652873] and parameters: {'n_layers': 2, 'embedding_dim': 128, 'lr': 0.0007970006502074318, 'lambda_val': 1.2160816785194988e-06, 'batch_size': 3074, 'optimizer': 'Adam'}.
2026-06-06 19:25:57,683 - optuna.study.study - INFO - Trial 242 finished with values: [0.06127029632822, 0.008444972871592203, 0.03390737950222652] and parameters: {'n_layers': 1, 'embedding_dim': 128, 'lr': 0.000523226958132027, 'lambda_val': 2.6092056130364808e-05, 'batch_size': 3832, 'optimizer': 'Adam'}.
2026-06-06 19:27:14,810 - experiment_functions - INFO - Early stopping at epoch 1400. Best Metrics: (0.049452658612199205, 0.005815861745595821, 0.023035134350985385)
2026-06-06 19:27:15,713 - optuna.study.study - INFO - Trial 243 finished with values: [0.049452658612199205, 0.005815861745595821, 0.023035134350985385] and parameters: {'n_layers': 2, 'embedding_dim': 256, 'lr': 0.0016310133844241697, 'lambda_val': 0.0008971608129751253, 'batch_size': 953, 'optimizer': 'RMSprop'}.
2026-06-06 19:28:18,747 - experiment_functions - INFO - Early stopping at epoch 1000. Best Metrics: (0.06558722207171187, 0.007840444771920424, 0.0330323890621542)
2026-06-06 19:28:19,900 - optuna.study.study - INFO - Trial 244 finished with values: [0.06558722207171187, 0.007840444771920424, 0.0330323890621542] and parameters: {'n_layers': 3, 'embedding_dim': 256, 'lr': 0.0007970006502074318, 'lambda_val': 3.3494997586996853e-06, 'batch_size': 3074, 'optimizer': 'RMSprop'}.
2026-06-06 19:31:23,374 - optuna.study.study - INFO - Trial 245 finished with values: [0.07907011247647867, 0.009804742447585236, 0.04223990531026786] and parameters: {'n_layers': 2, 'embedding_dim': 128, 'lr': 0.0005151812249168082, 'lambda_val': 3.4875481690343986e-06, 'batch_size': 2277, 'optimizer': 'Adam'}.
2026-06-06 19:34:34,790 - optuna.study.study - INFO - Trial 246 finished with values: [0.08933359434987902, 0.011261638421863488, 0.048594402981286235] and parameters: {'n_layers': 1, 'embedding_dim': 256, 'lr': 0.0007970006502074318, 'lambda_val': 7.199693710203336e-05, 'batch_size': 3591, 'optimizer': 'Adam'}.
2026-06-06 19:37:30,874 - optuna.study.study - INFO - Trial 247 finished with values: [0.07606527318661728, 0.009466474646660863, 0.042198922427100535] and parameters: {'n_layers': 2, 'embedding_dim': 96, 'lr': 0.0005151812249168082, 'lambda_val': 3.3494997586996853e-06, 'batch_size': 2277, 'optimizer': 'RMSprop'}.
2026-06-06 19:38:36,386 - experiment_functions - INFO - Early stopping at epoch 1450. Best Metrics: (0.03903200782994986, 0.004960144684841584, 0.018720697751327127)
2026-06-06 19:38:37,375 - optuna.study.study - INFO - Trial 248 finished with values: [0.03903200782994986, 0.004960144684841584, 0.018720697751327127] and parameters: {'n_layers': 2, 'embedding_dim': 64, 'lr': 0.0007970006502074318, 'lambda_val': 0.019489447581531975, 'batch_size': 1966, 'optimizer': 'RMSprop'}.
2026-06-06 19:39:21,033 - experiment_functions - INFO - Early stopping at epoch 850. Best Metrics: (0.05648901382025951, 0.0069043472436198005, 0.02718012956460615)
2026-06-06 19:39:21,937 - optuna.study.study - INFO - Trial 249 finished with values: [0.05648901382025951, 0.0069043472436198005, 0.02718012956460615] and parameters: {'n_layers': 2, 'embedding_dim': 96, 'lr': 0.0019878431480735456, 'lambda_val': 1.4798515828632866e-06, 'batch_size': 2277, 'optimizer': 'RMSprop'}.
2026-06-06 19:42:26,295 - optuna.study.study - INFO - Trial 250 finished with values: [0.08006674045926304, 0.010082724897849822, 0.04294340756505962] and parameters: {'n_layers': 2, 'embedding_dim': 128, 'lr': 0.0005151812249168082, 'lambda_val': 0.0002757363874074985, 'batch_size': 2797, 'optimizer': 'Adam'}.
2026-06-06 19:43:18,512 - experiment_functions - INFO - Early stopping at epoch 800. Best Metrics: (0.056788687929779334, 0.006718467412418783, 0.027746936886081736)
2026-06-06 19:43:20,134 - optuna.study.study - INFO - Trial 251 finished with values: [0.056788687929779334, 0.006718467412418783, 0.027746936886081736] and parameters: {'n_layers': 3, 'embedding_dim': 256, 'lr': 0.0019878431480735456, 'lambda_val': 7.650473592526119e-05, 'batch_size': 1717, 'optimizer': 'Adam'}.
2026-06-06 19:44:18,959 - experiment_functions - INFO - Early stopping at epoch 1100. Best Metrics: (0.06214203741077478, 0.00752562127403041, 0.03229797373154907)
2026-06-06 19:44:19,965 - optuna.study.study - INFO - Trial 252 finished with values: [0.06214203741077478, 0.00752562127403041, 0.03229797373154907] and parameters: {'n_layers': 3, 'embedding_dim': 128, 'lr': 0.0007970006502074318, 'lambda_val': 3.3494997586996853e-06, 'batch_size': 3074, 'optimizer': 'RMSprop'}.
2026-06-06 19:47:32,766 - optuna.study.study - INFO - Trial 253 finished with values: [0.07068937245662822, 0.008495210663808695, 0.03698896465962714] and parameters: {'n_layers': 3, 'embedding_dim': 128, 'lr': 0.0004543711173429324, 'lambda_val': 0.0002757363874074985, 'batch_size': 2440, 'optimizer': 'RMSprop'}.
2026-06-06 19:50:46,068 - optuna.study.study - INFO - Trial 254 finished with values: [0.09078431734479636, 0.011437470694621208, 0.048579581155599065] and parameters: {'n_layers': 1, 'embedding_dim': 256, 'lr': 0.0007970006502074318, 'lambda_val': 0.0002757363874074985, 'batch_size': 3591, 'optimizer': 'Adam'}.
2026-06-06 19:53:57,982 - optuna.study.study - INFO - Trial 255 finished with values: [0.08786281386688817, 0.011156139058208857, 0.04690090261801325] and parameters: {'n_layers': 1, 'embedding_dim': 256, 'lr': 0.0007970006502074318, 'lambda_val': 6.798162874116913e-05, 'batch_size': 3074, 'optimizer': 'Adam'}.
2026-06-06 19:54:46,088 - experiment_functions - INFO - Early stopping at epoch 1000. Best Metrics: (0.0004832723728751809, 6.698372295532187e-05, 0.00027764664854566204)
2026-06-06 19:54:47,075 - optuna.study.study - INFO - Trial 256 finished with values: [0.0004832723728751809, 6.698372295532187e-05, 0.00027764664854566204] and parameters: {'n_layers': 1, 'embedding_dim': 128, 'lr': 2.9642380204762925e-05, 'lambda_val': 4.196757217564647e-06, 'batch_size': 3591, 'optimizer': 'Adam'}.
2026-06-06 19:57:43,333 - optuna.study.study - INFO - Trial 257 finished with values: [0.07337293110155312, 0.009144952776475318, 0.038341372012413846] and parameters: {'n_layers': 2, 'embedding_dim': 96, 'lr': 0.0005151812249168082, 'lambda_val': 0.0014674492199833664, 'batch_size': 1985, 'optimizer': 'RMSprop'}.
2026-06-06 20:01:11,457 - optuna.study.study - INFO - Trial 258 finished with values: [0.08337542515690564, 0.010352334382744993, 0.0446908182442781] and parameters: {'n_layers': 2, 'embedding_dim': 256, 'lr': 0.0005151812249168082, 'lambda_val': 3.3494997586996853e-06, 'batch_size': 2277, 'optimizer': 'Adam'}.
2026-06-06 20:02:27,013 - experiment_functions - INFO - Early stopping at epoch 1450. Best Metrics: (0.06861882379852335, 0.00823397414428294, 0.03328983887452171)
2026-06-06 20:02:27,539 - optuna.study.study - INFO - Trial 259 finished with values: [0.06861882379852335, 0.00823397414428294, 0.03328983887452171] and parameters: {'n_layers': 3, 'embedding_dim': 128, 'lr': 0.0007970006502074318, 'lambda_val': 3.3494997586996853e-06, 'batch_size': 3010, 'optimizer': 'Adam'}.
2026-06-06 20:05:22,451 - optuna.study.study - INFO - Trial 260 finished with values: [0.09112439548309416, 0.0112013530712037, 0.04980297208787777] and parameters: {'n_layers': 1, 'embedding_dim': 128, 'lr': 0.0016310133844241697, 'lambda_val': 7.199693710203336e-05, 'batch_size': 1119, 'optimizer': 'Adam'}.
2026-06-06 20:07:34,337 - experiment_functions - INFO - Early stopping at epoch 2950. Best Metrics: (0.08596196368839931, 0.010456159153325742, 0.04631064560689124)
2026-06-06 20:07:34,837 - optuna.study.study - INFO - Trial 261 finished with values: [0.08596196368839931, 0.010456159153325742, 0.04631064560689124] and parameters: {'n_layers': 2, 'embedding_dim': 96, 'lr': 0.0007970006502074318, 'lambda_val': 3.3494997586996853e-06, 'batch_size': 3074, 'optimizer': 'Adam'}.
2026-06-06 20:08:40,181 - experiment_functions - INFO - Early stopping at epoch 1150. Best Metrics: (0.027098443558116123, 0.00346305847679014, 0.012644274680152381)
2026-06-06 20:08:40,649 - optuna.study.study - INFO - Trial 262 finished with values: [0.027098443558116123, 0.00346305847679014, 0.012644274680152381] and parameters: {'n_layers': 2, 'embedding_dim': 256, 'lr': 0.0007970006502074318, 'lambda_val': 0.04318105378983208, 'batch_size': 3591, 'optimizer': 'Adam'}.
2026-06-06 20:10:24,648 - experiment_functions - INFO - Early stopping at epoch 1900. Best Metrics: (0.0865468397082932, 0.01044946078103021, 0.04461498351773024)
2026-06-06 20:10:25,595 - optuna.study.study - INFO - Trial 263 finished with values: [0.0865468397082932, 0.01044946078103021, 0.04461498351773024] and parameters: {'n_layers': 2, 'embedding_dim': 256, 'lr': 0.0007970006502074318, 'lambda_val': 1.4780082520235353e-05, 'batch_size': 3591, 'optimizer': 'Adam'}.
2026-06-06 20:11:10,517 - experiment_functions - INFO - Early stopping at epoch 800. Best Metrics: (0.058323541307445013, 0.007143814053185076, 0.02901132018456878)
2026-06-06 20:11:11,486 - optuna.study.study - INFO - Trial 264 finished with values: [0.058323541307445013, 0.007143814053185076, 0.02901132018456878] and parameters: {'n_layers': 3, 'embedding_dim': 128, 'lr': 0.0016310133844241697, 'lambda_val': 7.199693710203336e-05, 'batch_size': 2953, 'optimizer': 'Adam'}.
2026-06-06 20:14:00,985 - optuna.study.study - INFO - Trial 265 finished with values: [0.08463742161056258, 0.010660459508339475, 0.04546883575106234] and parameters: {'n_layers': 1, 'embedding_dim': 96, 'lr': 0.0007970006502074318, 'lambda_val': 3.3494997586996853e-06, 'batch_size': 3622, 'optimizer': 'Adam'}.
2026-06-06 20:17:04,032 - optuna.study.study - INFO - Trial 266 finished with values: [0.03717805088417009, 0.005658449996650814, 0.02200624916640266] and parameters: {'n_layers': 1, 'embedding_dim': 256, 'lr': 0.00039823438048122364, 'lambda_val': 0.0014136244342906443, 'batch_size': 2302, 'optimizer': 'RMSprop'}.
2026-06-06 20:19:44,035 - experiment_functions - INFO - Early stopping at epoch 3600. Best Metrics: (0.04759335261694255, 0.005928059481545984, 0.023537593155381165)
2026-06-06 20:19:45,135 - optuna.study.study - INFO - Trial 267 finished with values: [0.04759335261694255, 0.005928059481545984, 0.023537593155381165] and parameters: {'n_layers': 4, 'embedding_dim': 64, 'lr': 0.0007970006502074318, 'lambda_val': 0.0006558556683258472, 'batch_size': 953, 'optimizer': 'Adam'}.
2026-06-06 20:20:15,050 - experiment_functions - INFO - Early stopping at epoch 500. Best Metrics: (0.0005220868741958043, 9.042802598968451e-05, 0.00025441005304581)
2026-06-06 20:20:15,717 - optuna.study.study - INFO - Trial 268 finished with values: [0.0005220868741958043, 9.042802598968451e-05, 0.00025441005304581] and parameters: {'n_layers': 2, 'embedding_dim': 128, 'lr': 0.00039823438048122364, 'lambda_val': 2.6092056130364808e-05, 'batch_size': 3074, 'optimizer': 'SGD'}.
2026-06-06 20:23:05,414 - optuna.study.study - INFO - Trial 269 finished with values: [0.08227742277264011, 0.01057003148234979, 0.044966681110105135] and parameters: {'n_layers': 1, 'embedding_dim': 96, 'lr': 0.0007970006502074318, 'lambda_val': 3.3494997586996853e-06, 'batch_size': 3074, 'optimizer': 'Adam'}.
2026-06-06 20:24:19,033 - experiment_functions - INFO - Early stopping at epoch 1600. Best Metrics: (0.07597626325415527, 0.009242079174760533, 0.03885188713130331)
2026-06-06 20:24:19,490 - optuna.study.study - INFO - Trial 270 finished with values: [0.07597626325415527, 0.009242079174760533, 0.03885188713130331] and parameters: {'n_layers': 2, 'embedding_dim': 64, 'lr': 0.0007970006502074318, 'lambda_val': 0.0005031918520424605, 'batch_size': 3591, 'optimizer': 'RMSprop'}.
2026-06-06 20:26:58,340 - optuna.study.study - INFO - Trial 271 finished with values: [0.0007983263399235995, 0.00012391988746734544, 0.0004105546118537319] and parameters: {'n_layers': 1, 'embedding_dim': 96, 'lr': 0.00015528627763490384, 'lambda_val': 3.3494997586996853e-06, 'batch_size': 3622, 'optimizer': 'RMSprop'}.
