2026-06-05 07:55:57,307 - optuna.study.study - INFO - Trial 93 finished with values: [0.00046297030112883833, 8.372965369415233e-05, 0.00019381775228025013] and parameters: {'n_layers': 4, 'embedding_dim': 256, 'lr': 0.0002935151629562318, 'lambda_val': 0.006784020914475507, 'batch_size': 1818, 'optimizer': 'SGD'}.
2026-06-05 07:56:23,369 - experiment_functions - INFO - Early stopping at epoch 550. Best Metrics: (0.006180401818799864, 0.0008758121776408334, 0.0034287814677548966)
2026-06-05 07:56:23,726 - optuna.study.study - INFO - Trial 94 finished with values: [0.006180401818799864, 0.0008758121776408334, 0.0034287814677548966] and parameters: {'n_layers': 1, 'embedding_dim': 256, 'lr': 0.019367051543267743, 'lambda_val': 0.078260362782082, 'batch_size': 1300, 'optimizer': 'RMSprop'}.
2026-06-05 07:56:54,409 - experiment_functions - INFO - Early stopping at epoch 500. Best Metrics: (0.0004927409948432625, 8.205506062026927e-05, 0.0002265405380486603)
2026-06-05 07:56:54,505 - optuna.study.study - INFO - Trial 95 finished with values: [0.0004927409948432625, 8.205506062026927e-05, 0.0002265405380486603] and parameters: {'n_layers': 4, 'embedding_dim': 256, 'lr': 9.19130053936316e-05, 'lambda_val': 0.00017486567415461547, 'batch_size': 1554, 'optimizer': 'SGD'}.
2026-06-05 07:57:17,963 - experiment_functions - INFO - Early stopping at epoch 550. Best Metrics: (0.027217668441643746, 0.0035032487105633335, 0.013861502566901687)
2026-06-05 07:57:18,054 - optuna.study.study - INFO - Trial 96 finished with values: [0.027217668441643746, 0.0035032487105633335, 0.013861502566901687] and parameters: {'n_layers': 2, 'embedding_dim': 64, 'lr': 0.024984519415047875, 'lambda_val': 7.059587443324882e-05, 'batch_size': 918, 'optimizer': 'RMSprop'}.
2026-06-05 07:57:39,466 - experiment_functions - INFO - Early stopping at epoch 500. Best Metrics: (0.0005849466401715054, 8.205506062026927e-05, 0.000255166828559663)
2026-06-05 07:57:40,179 - optuna.study.study - INFO - Trial 97 finished with values: [0.0005849466401715054, 8.205506062026927e-05, 0.000255166828559663] and parameters: {'n_layers': 3, 'embedding_dim': 64, 'lr': 7.423313766631676e-05, 'lambda_val': 0.0483097925295068, 'batch_size': 669, 'optimizer': 'RMSprop'}.
2026-06-05 08:00:19,259 - optuna.study.study - INFO - Trial 98 finished with values: [0.01500452148735349, 0.0022355817536338675, 0.0077326244364069] and parameters: {'n_layers': 3, 'embedding_dim': 64, 'lr': 0.00014892043552417684, 'lambda_val': 7.059587443324882e-05, 'batch_size': 3993, 'optimizer': 'RMSprop'}.
2026-06-05 08:00:41,930 - experiment_functions - INFO - Early stopping at epoch 500. Best Metrics: (0.0004156970431365371, 8.205506062026927e-05, 0.00019582584437882652)
2026-06-05 08:00:42,019 - optuna.study.study - INFO - Trial 99 finished with values: [0.0004156970431365371, 8.205506062026927e-05, 0.00019582584437882652] and parameters: {'n_layers': 2, 'embedding_dim': 128, 'lr': 0.0005440091810992007, 'lambda_val': 0.053935580802756795, 'batch_size': 1912, 'optimizer': 'SGD'}.
2026-06-05 08:01:13,757 - experiment_functions - INFO - Early stopping at epoch 650. Best Metrics: (0.05416501311093074, 0.0066531582825373435, 0.02635141170883514)
2026-06-05 08:01:13,846 - optuna.study.study - INFO - Trial 100 finished with values: [0.05416501311093074, 0.0066531582825373435, 0.02635141170883514] and parameters: {'n_layers': 3, 'embedding_dim': 128, 'lr': 0.00277162555113125, 'lambda_val': 0.0003344121448101528, 'batch_size': 2988, 'optimizer': 'Adam'}.
2026-06-05 08:01:37,780 - experiment_functions - INFO - Early stopping at epoch 550. Best Metrics: (0.014824662718458058, 0.0017449259829861344, 0.007406798282391845)
2026-06-05 08:01:38,326 - optuna.study.study - INFO - Trial 101 finished with values: [0.014824662718458058, 0.0017449259829861344, 0.007406798282391845] and parameters: {'n_layers': 3, 'embedding_dim': 64, 'lr': 0.05734698935223446, 'lambda_val': 7.059587443324882e-05, 'batch_size': 1146, 'optimizer': 'RMSprop'}.
2026-06-05 08:02:10,314 - experiment_functions - INFO - Early stopping at epoch 600. Best Metrics: (0.053056068515741496, 0.006393596356085472, 0.024887137889303117)
2026-06-05 08:02:10,404 - optuna.study.study - INFO - Trial 102 finished with values: [0.053056068515741496, 0.006393596356085472, 0.024887137889303117] and parameters: {'n_layers': 2, 'embedding_dim': 256, 'lr': 0.0051502087362069494, 'lambda_val': 0.00013726443089426057, 'batch_size': 1995, 'optimizer': 'Adam'}.
2026-06-05 08:02:41,317 - experiment_functions - INFO - Early stopping at epoch 500. Best Metrics: (0.00065764050673607, 8.038046754638622e-05, 0.0003092545988637676)
2026-06-05 08:02:41,407 - optuna.study.study - INFO - Trial 103 finished with values: [0.00065764050673607, 8.038046754638622e-05, 0.0003092545988637676] and parameters: {'n_layers': 4, 'embedding_dim': 256, 'lr': 1.7081887543550676e-05, 'lambda_val': 0.018222291262846232, 'batch_size': 3529, 'optimizer': 'RMSprop'}.
2026-06-05 08:06:18,486 - optuna.study.study - INFO - Trial 104 finished with values: [0.0440847362706889, 0.005648402438207515, 0.02192870286899031] and parameters: {'n_layers': 3, 'embedding_dim': 256, 'lr': 0.0002935151629562318, 'lambda_val': 0.006784020914475507, 'batch_size': 3358, 'optimizer': 'Adam'}.
2026-06-05 08:06:47,526 - experiment_functions - INFO - Early stopping at epoch 550. Best Metrics: (0.029469817804069855, 0.0035534865027798245, 0.014228528989706102)
2026-06-05 08:06:48,383 - optuna.study.study - INFO - Trial 105 finished with values: [0.029469817804069855, 0.0035534865027798245, 0.014228528989706102] and parameters: {'n_layers': 2, 'embedding_dim': 256, 'lr': 0.024984519415047875, 'lambda_val': 7.059587443324882e-05, 'batch_size': 918, 'optimizer': 'RMSprop'}.
2026-06-05 08:09:20,787 - optuna.study.study - INFO - Trial 106 finished with values: [0.0011584095617617352, 0.00017415767968383683, 0.0005220198064575878] and parameters: {'n_layers': 2, 'embedding_dim': 64, 'lr': 0.00017607299026557748, 'lambda_val': 0.00024098113360142309, 'batch_size': 918, 'optimizer': 'RMSprop'}.
2026-06-05 08:09:46,632 - experiment_functions - INFO - Early stopping at epoch 600. Best Metrics: (0.030880210686577193, 0.003766159823162972, 0.015140526069412437)
2026-06-05 08:09:47,599 - optuna.study.study - INFO - Trial 107 finished with values: [0.030880210686577193, 0.003766159823162972, 0.015140526069412437] and parameters: {'n_layers': 2, 'embedding_dim': 64, 'lr': 0.019367051543267743, 'lambda_val': 8.17902589782426e-05, 'batch_size': 2437, 'optimizer': 'RMSprop'}.
2026-06-05 08:10:13,022 - experiment_functions - INFO - Early stopping at epoch 500. Best Metrics: (0.012461601057322115, 0.0013832138790273963, 0.006187567609346382)
2026-06-05 08:10:13,304 - optuna.study.study - INFO - Trial 108 finished with values: [0.012461601057322115, 0.0013832138790273963, 0.006187567609346382] and parameters: {'n_layers': 4, 'embedding_dim': 128, 'lr': 0.019367051543267743, 'lambda_val': 0.09479180593722179, 'batch_size': 1302, 'optimizer': 'RMSprop'}.
2026-06-05 08:10:39,926 - experiment_functions - INFO - Early stopping at epoch 550. Best Metrics: (0.02864529072369736, 0.003593676736553018, 0.014012013983356992)
2026-06-05 08:10:40,029 - optuna.study.study - INFO - Trial 109 finished with values: [0.02864529072369736, 0.003593676736553018, 0.014012013983356992] and parameters: {'n_layers': 4, 'embedding_dim': 96, 'lr': 0.0041201733250423745, 'lambda_val': 0.0003344121448101528, 'batch_size': 816, 'optimizer': 'RMSprop'}.
2026-06-05 08:11:03,271 - experiment_functions - INFO - Early stopping at epoch 550. Best Metrics: (0.019115165112013957, 0.002344430303436265, 0.008966966068362246)
2026-06-05 08:11:03,402 - optuna.study.study - INFO - Trial 110 finished with values: [0.019115165112013957, 0.002344430303436265, 0.008966966068362246] and parameters: {'n_layers': 3, 'embedding_dim': 32, 'lr': 0.027845228823252365, 'lambda_val': 0.0028468440427530635, 'batch_size': 1275, 'optimizer': 'Adam'}.
2026-06-05 08:11:32,444 - experiment_functions - INFO - Early stopping at epoch 550. Best Metrics: (0.029156875741119238, 0.003439614173755778, 0.014099433019434839)
2026-06-05 08:11:33,028 - optuna.study.study - INFO - Trial 111 finished with values: [0.029156875741119238, 0.003439614173755778, 0.014099433019434839] and parameters: {'n_layers': 2, 'embedding_dim': 256, 'lr': 0.05734698935223446, 'lambda_val': 1.2393469425028176e-05, 'batch_size': 753, 'optimizer': 'Adam'}.
2026-06-05 08:14:31,088 - optuna.study.study - INFO - Trial 112 finished with values: [0.06005291804684092, 0.008300957867238262, 0.03452914743160799] and parameters: {'n_layers': 1, 'embedding_dim': 256, 'lr': 0.0006201349398045224, 'lambda_val': 0.0007536284412237263, 'batch_size': 1300, 'optimizer': 'RMSprop'}.
2026-06-05 08:15:20,140 - experiment_functions - INFO - Early stopping at epoch 1150. Best Metrics: (0.06957594430562389, 0.008635876482014871, 0.035414137119937905)
2026-06-05 08:15:20,227 - optuna.study.study - INFO - Trial 113 finished with values: [0.06957594430562389, 0.008635876482014871, 0.035414137119937905] and parameters: {'n_layers': 1, 'embedding_dim': 128, 'lr': 0.0023440150084551373, 'lambda_val': 0.0028468440427530635, 'batch_size': 1995, 'optimizer': 'Adam'}.
2026-06-05 08:17:54,796 - optuna.study.study - INFO - Trial 114 finished with values: [0.011466102496000663, 0.0018236318574586376, 0.006523804205419496] and parameters: {'n_layers': 2, 'embedding_dim': 64, 'lr': 0.000350216316785427, 'lambda_val': 0.0008919112975523749, 'batch_size': 816, 'optimizer': 'Adam'}.
2026-06-05 08:18:20,099 - experiment_functions - INFO - Early stopping at epoch 550. Best Metrics: (0.02692036557863275, 0.0031331636412351804, 0.012304163194468355)
2026-06-05 08:18:20,196 - optuna.study.study - INFO - Trial 115 finished with values: [0.02692036557863275, 0.0031331636412351804, 0.012304163194468355] and parameters: {'n_layers': 4, 'embedding_dim': 64, 'lr': 0.05734698935223446, 'lambda_val': 1.2393469425028176e-05, 'batch_size': 1146, 'optimizer': 'Adam'}.
2026-06-05 08:18:48,778 - experiment_functions - INFO - Early stopping at epoch 550. Best Metrics: (0.0005956077072121344, 8.205506062026927e-05, 0.00031614537023681206)
2026-06-05 08:18:48,888 - optuna.study.study - INFO - Trial 116 finished with values: [0.0005956077072121344, 8.205506062026927e-05, 0.00031614537023681206] and parameters: {'n_layers': 2, 'embedding_dim': 256, 'lr': 3.3650313149864754e-05, 'lambda_val': 0.078260362782082, 'batch_size': 1300, 'optimizer': 'RMSprop'}.
2026-06-05 08:19:16,089 - experiment_functions - INFO - Early stopping at epoch 550. Best Metrics: (0.029914616713233786, 0.0034865027798245025, 0.013795327309871153)
2026-06-05 08:19:16,174 - optuna.study.study - INFO - Trial 117 finished with values: [0.029914616713233786, 0.0034865027798245025, 0.013795327309871153] and parameters: {'n_layers': 3, 'embedding_dim': 128, 'lr': 0.027845228823252365, 'lambda_val': 0.00012250709547244776, 'batch_size': 2789, 'optimizer': 'Adam'}.
2026-06-05 08:20:05,560 - experiment_functions - INFO - Early stopping at epoch 1050. Best Metrics: (0.07409757882916743, 0.008994239399825842, 0.03835387289946129)
2026-06-05 08:20:05,815 - optuna.study.study - INFO - Trial 118 finished with values: [0.07409757882916743, 0.008994239399825842, 0.03835387289946129] and parameters: {'n_layers': 1, 'embedding_dim': 256, 'lr': 0.0023440150084551373, 'lambda_val': 0.0003344121448101528, 'batch_size': 1554, 'optimizer': 'RMSprop'}.
2026-06-05 08:21:06,445 - experiment_functions - INFO - Early stopping at epoch 1400. Best Metrics: (0.03165897235133953, 0.003665684238729989, 0.014163607701305937)
2026-06-05 08:21:07,300 - optuna.study.study - INFO - Trial 119 finished with values: [0.03165897235133953, 0.003665684238729989, 0.014163607701305937] and parameters: {'n_layers': 4, 'embedding_dim': 64, 'lr': 0.0041201733250423745, 'lambda_val': 7.059587443324882e-05, 'batch_size': 3082, 'optimizer': 'RMSprop'}.
2026-06-05 08:21:32,414 - experiment_functions - INFO - Early stopping at epoch 550. Best Metrics: (0.029075403850803067, 0.003583629178109719, 0.0141589054695556)
2026-06-05 08:21:32,507 - optuna.study.study - INFO - Trial 120 finished with values: [0.029075403850803067, 0.003583629178109719, 0.0141589054695556] and parameters: {'n_layers': 3, 'embedding_dim': 64, 'lr': 0.024984519415047875, 'lambda_val': 7.059587443324882e-05, 'batch_size': 674, 'optimizer': 'Adam'}.
2026-06-05 08:22:07,919 - experiment_functions - INFO - Early stopping at epoch 800. Best Metrics: (0.01914864183140945, 0.002408064840243821, 0.008999989191778222)
2026-06-05 08:22:08,188 - optuna.study.study - INFO - Trial 121 finished with values: [0.01914864183140945, 0.002408064840243821, 0.008999989191778222] and parameters: {'n_layers': 4, 'embedding_dim': 64, 'lr': 0.0015391297039669685, 'lambda_val': 0.007008209464067845, 'batch_size': 1877, 'optimizer': 'RMSprop'}.
2026-06-05 08:22:40,573 - experiment_functions - INFO - Early stopping at epoch 550. Best Metrics: (0.029577327418805036, 0.003647263714917275, 0.01422197732296638)
2026-06-05 08:22:40,666 - optuna.study.study - INFO - Trial 122 finished with values: [0.029577327418805036, 0.003647263714917275, 0.01422197732296638] and parameters: {'n_layers': 3, 'embedding_dim': 256, 'lr': 0.011575453890852001, 'lambda_val': 0.00017486567415461547, 'batch_size': 816, 'optimizer': 'Adam'}.
2026-06-05 08:23:20,316 - experiment_functions - INFO - Early stopping at epoch 750. Best Metrics: (0.05037334688590485, 0.005973273494540827, 0.023420638898713538)
2026-06-05 08:23:20,409 - optuna.study.study - INFO - Trial 123 finished with values: [0.05037334688590485, 0.005973273494540827, 0.023420638898713538] and parameters: {'n_layers': 2, 'embedding_dim': 256, 'lr': 0.002843500215424042, 'lambda_val': 0.0007536284412237263, 'batch_size': 1157, 'optimizer': 'Adam'}.
2026-06-05 08:24:01,717 - experiment_functions - INFO - Early stopping at epoch 1000. Best Metrics: (0.06579394220233754, 0.008093308326076765, 0.032552855139750925)
2026-06-05 08:24:02,094 - optuna.study.study - INFO - Trial 124 finished with values: [0.06579394220233754, 0.008093308326076765, 0.032552855139750925] and parameters: {'n_layers': 2, 'embedding_dim': 32, 'lr': 0.0023785608804078183, 'lambda_val': 1.8928189863403825e-06, 'batch_size': 2203, 'optimizer': 'Adam'}.
2026-06-05 08:24:26,397 - experiment_functions - INFO - Early stopping at epoch 550. Best Metrics: (0.011858392996803458, 0.0014619197534998993, 0.005841493567613782)
2026-06-05 08:24:26,604 - optuna.study.study - INFO - Trial 125 finished with values: [0.011858392996803458, 0.0014619197534998993, 0.005841493567613782] and parameters: {'n_layers': 3, 'embedding_dim': 64, 'lr': 0.05215573830648526, 'lambda_val': 0.00010844106835038753, 'batch_size': 2799, 'optimizer': 'RMSprop'}.
2026-06-05 08:24:48,471 - experiment_functions - INFO - Early stopping at epoch 500. Best Metrics: (0.0005545375002550977, 8.205506062026927e-05, 0.0002934931804647122)
2026-06-05 08:24:48,601 - optuna.study.study - INFO - Trial 126 finished with values: [0.0005545375002550977, 8.205506062026927e-05, 0.0002934931804647122] and parameters: {'n_layers': 3, 'embedding_dim': 64, 'lr': 2.6456958058330662e-05, 'lambda_val': 0.001468044891542341, 'batch_size': 1995, 'optimizer': 'Adam'}.
2026-06-05 08:27:32,357 - experiment_functions - INFO - Early stopping at epoch 3950. Best Metrics: (0.04406699622101411, 0.005266595217362182, 0.02086263246044539)
2026-06-05 08:27:32,444 - optuna.study.study - INFO - Trial 127 finished with values: [0.04406699622101411, 0.005266595217362182, 0.02086263246044539] and parameters: {'n_layers': 3, 'embedding_dim': 64, 'lr': 0.006542998749224963, 'lambda_val': 6.977831082453278e-06, 'batch_size': 617, 'optimizer': 'RMSprop'}.
2026-06-05 08:30:26,542 - optuna.study.study - INFO - Trial 128 finished with values: [0.006543776750320425, 0.0011738897447920156, 0.004034275989690966] and parameters: {'n_layers': 1, 'embedding_dim': 256, 'lr': 0.000350216316785427, 'lambda_val': 6.977831082453278e-06, 'batch_size': 1300, 'optimizer': 'RMSprop'}.
2026-06-05 08:33:11,970 - optuna.study.study - INFO - Trial 129 finished with values: [0.04210806166132892, 0.0049216290441422735, 0.01938957248606324] and parameters: {'n_layers': 2, 'embedding_dim': 96, 'lr': 0.0041201733250423745, 'lambda_val': 0.0003344121448101528, 'batch_size': 1248, 'optimizer': 'RMSprop'}.
2026-06-05 08:33:32,638 - experiment_functions - INFO - Early stopping at epoch 500. Best Metrics: (0.0006055521702640822, 9.042802598968451e-05, 0.0002540161615257159)
2026-06-05 08:33:32,740 - optuna.study.study - INFO - Trial 130 finished with values: [0.0006055521702640822, 9.042802598968451e-05, 0.0002540161615257159] and parameters: {'n_layers': 1, 'embedding_dim': 64, 'lr': 0.0023440150084551373, 'lambda_val': 0.001468044891542341, 'batch_size': 1554, 'optimizer': 'SGD'}.
2026-06-05 08:36:29,117 - optuna.study.study - INFO - Trial 131 finished with values: [0.027252433334519342, 0.0041479670440083055, 0.016593457698941463] and parameters: {'n_layers': 1, 'embedding_dim': 256, 'lr': 0.0006201349398045224, 'lambda_val': 6.977831082453278e-06, 'batch_size': 633, 'optimizer': 'RMSprop'}.
2026-06-05 08:37:05,732 - experiment_functions - INFO - Early stopping at epoch 750. Best Metrics: (0.07366433281716901, 0.009046151785116217, 0.03745486402928334)
2026-06-05 08:37:05,950 - optuna.study.study - INFO - Trial 132 finished with values: [0.07366433281716901, 0.009046151785116217, 0.03745486402928334] and parameters: {'n_layers': 2, 'embedding_dim': 128, 'lr': 0.0023440150084551373, 'lambda_val': 0.00012250709547244776, 'batch_size': 3735, 'optimizer': 'Adam'}.
2026-06-05 08:38:16,812 - experiment_functions - INFO - Early stopping at epoch 1200. Best Metrics: (0.00042000023405608784, 6.195994373367272e-05, 0.00017532927923197286)
2026-06-05 08:38:16,964 - optuna.study.study - INFO - Trial 133 finished with values: [0.00042000023405608784, 6.195994373367272e-05, 0.00017532927923197286] and parameters: {'n_layers': 4, 'embedding_dim': 256, 'lr': 2.8538766677603632e-05, 'lambda_val': 6.977831082453278e-06, 'batch_size': 2437, 'optimizer': 'RMSprop'}.
2026-06-05 08:40:44,077 - experiment_functions - INFO - Early stopping at epoch 3800. Best Metrics: (0.02888700172222967, 0.003342487775470561, 0.012840309895467916)
2026-06-05 08:40:44,788 - optuna.study.study - INFO - Trial 134 finished with values: [0.02888700172222967, 0.003342487775470561, 0.012840309895467916] and parameters: {'n_layers': 3, 'embedding_dim': 32, 'lr': 0.006542998749224963, 'lambda_val': 0.00017486567415461547, 'batch_size': 674, 'optimizer': 'Adam'}.
2026-06-05 08:41:10,461 - experiment_functions - INFO - Early stopping at epoch 500. Best Metrics: (0.0003624912601521381, 7.368209525085404e-05, 0.00017241108663212137)
2026-06-05 08:41:10,543 - optuna.study.study - INFO - Trial 135 finished with values: [0.0003624912601521381, 7.368209525085404e-05, 0.00017241108663212137] and parameters: {'n_layers': 2, 'embedding_dim': 256, 'lr': 0.0001808343553198497, 'lambda_val': 6.977831082453278e-06, 'batch_size': 4021, 'optimizer': 'SGD'}.
2026-06-05 08:41:36,505 - experiment_functions - INFO - Early stopping at epoch 500. Best Metrics: (0.000446672949314347, 7.703128139862015e-05, 0.0001785030159220114)
2026-06-05 08:41:37,601 - optuna.study.study - INFO - Trial 136 finished with values: [0.000446672949314347, 7.703128139862015e-05, 0.0001785030159220114] and parameters: {'n_layers': 2, 'embedding_dim': 256, 'lr': 2.2079206869092897e-05, 'lambda_val': 0.021119731556242218, 'batch_size': 2799, 'optimizer': 'RMSprop'}.
2026-06-05 08:42:03,983 - experiment_functions - INFO - Early stopping at epoch 550. Best Metrics: (0.009219611406302557, 0.0010951838703195124, 0.0044505153676661175)
2026-06-05 08:42:04,309 - optuna.study.study - INFO - Trial 137 finished with values: [0.009219611406302557, 0.0010951838703195124, 0.0044505153676661175] and parameters: {'n_layers': 3, 'embedding_dim': 128, 'lr': 0.027845228823252365, 'lambda_val': 0.03699301214407421, 'batch_size': 1995, 'optimizer': 'Adam'}.
2026-06-05 08:42:27,859 - experiment_functions - INFO - Early stopping at epoch 550. Best Metrics: (0.027925228608417146, 0.0033240672516578473, 0.013054677449596295)
2026-06-05 08:42:27,967 - optuna.study.study - INFO - Trial 138 finished with values: [0.027925228608417146, 0.0033240672516578473, 0.013054677449596295] and parameters: {'n_layers': 2, 'embedding_dim': 64, 'lr': 0.05734698935223446, 'lambda_val': 4.8101828784590604e-05, 'batch_size': 1146, 'optimizer': 'Adam'}.
2026-06-05 08:45:04,939 - optuna.study.study - INFO - Trial 139 finished with values: [0.00802505963110317, 0.0013513966106236182, 0.004169731295442421] and parameters: {'n_layers': 3, 'embedding_dim': 64, 'lr': 0.00020056257290353266, 'lambda_val': 0.0028468440427530635, 'batch_size': 918, 'optimizer': 'RMSprop'}.
2026-06-05 08:45:29,542 - experiment_functions - INFO - Early stopping at epoch 550. Best Metrics: (0.013176572611159907, 0.001507133766494742, 0.0063572502863032815)
2026-06-05 08:45:30,332 - optuna.study.study - INFO - Trial 140 finished with values: [0.013176572611159907, 0.001507133766494742, 0.0063572502863032815] and parameters: {'n_layers': 4, 'embedding_dim': 64, 'lr': 0.07890941858371371, 'lambda_val': 3.7976350043355404e-06, 'batch_size': 1660, 'optimizer': 'RMSprop'}.
2026-06-05 08:46:01,341 - experiment_functions - INFO - Early stopping at epoch 700. Best Metrics: (0.0005720156199682712, 7.53566883247371e-05, 0.0002568882003011199)
