2026-05-19 20:11:40,569 - optuna.study.study - INFO - Trial 87 finished with value: 0.02826738693273105 and parameters: {'n_layers': 1, 'embedding_dim': 96, 'lr': 0.0006456276516170239, 'lambda_val': 5.0730417154754466e-06, 'batch_size': 656, 'optimizer': 'Adam'}. Best is trial 38 with value: 0.03486654329558426.
2026-05-19 20:11:46,160 - optuna.study._optimize - INFO - Trial 88 pruned. 
2026-05-19 20:11:51,771 - experiment_functions - INFO - Early stopping at epoch 900. Best Recall: 0.0297
2026-05-19 20:11:51,924 - optuna.study.study - INFO - Trial 89 finished with value: 0.02974145077142398 and parameters: {'n_layers': 1, 'embedding_dim': 96, 'lr': 0.0007067760157938813, 'lambda_val': 2.8462918336775223e-06, 'batch_size': 675, 'optimizer': 'Adam'}. Best is trial 38 with value: 0.03486654329558426.
2026-05-19 20:11:55,147 - experiment_functions - INFO - Early stopping at epoch 500. Best Recall: 0.0038
2026-05-19 20:11:55,226 - optuna.study.study - INFO - Trial 90 finished with value: 0.003820108337467221 and parameters: {'n_layers': 2, 'embedding_dim': 96, 'lr': 0.0008578129361111855, 'lambda_val': 1.2584165480400367e-06, 'batch_size': 512, 'optimizer': 'SGD'}. Best is trial 38 with value: 0.03486654329558426.
2026-05-19 20:12:00,816 - optuna.study._optimize - INFO - Trial 91 pruned. 
2026-05-19 20:12:07,131 - experiment_functions - INFO - Early stopping at epoch 950. Best Recall: 0.0274
2026-05-19 20:12:07,221 - optuna.study.study - INFO - Trial 92 finished with value: 0.027387684426014344 and parameters: {'n_layers': 1, 'embedding_dim': 96, 'lr': 0.0007157150240113128, 'lambda_val': 6.1062883482357386e-06, 'batch_size': 664, 'optimizer': 'Adam'}. Best is trial 38 with value: 0.03486654329558426.
2026-05-19 20:12:15,251 - experiment_functions - INFO - Early stopping at epoch 950. Best Recall: 0.0255
2026-05-19 20:12:15,342 - optuna.study.study - INFO - Trial 93 finished with value: 0.025463991458259932 and parameters: {'n_layers': 1, 'embedding_dim': 96, 'lr': 0.0007714232065788523, 'lambda_val': 1.8135833155934866e-06, 'batch_size': 636, 'optimizer': 'Adam'}. Best is trial 38 with value: 0.03486654329558426.
2026-05-19 20:12:22,432 - optuna.study._optimize - INFO - Trial 94 pruned. 
2026-05-19 20:12:29,629 - optuna.study._optimize - INFO - Trial 95 pruned. 
2026-05-19 20:12:34,254 - experiment_functions - INFO - Early stopping at epoch 600. Best Recall: 0.0239
2026-05-19 20:12:34,335 - optuna.study.study - INFO - Trial 96 finished with value: 0.02385740580030866 and parameters: {'n_layers': 1, 'embedding_dim': 96, 'lr': 0.001990839279778917, 'lambda_val': 2.806878324989472e-06, 'batch_size': 741, 'optimizer': 'Adam'}. Best is trial 38 with value: 0.03486654329558426.
2026-05-19 20:12:41,033 - optuna.study._optimize - INFO - Trial 97 pruned. 
2026-05-19 20:12:46,984 - experiment_functions - INFO - Early stopping at epoch 700. Best Recall: 0.0278
2026-05-19 20:12:47,076 - optuna.study.study - INFO - Trial 98 finished with value: 0.02781576697772131 and parameters: {'n_layers': 1, 'embedding_dim': 96, 'lr': 0.0011031111143490536, 'lambda_val': 1.434846261059892e-06, 'batch_size': 1055, 'optimizer': 'Adam'}. Best is trial 38 with value: 0.03486654329558426.
2026-05-19 20:12:51,286 - experiment_functions - INFO - Early stopping at epoch 550. Best Recall: 0.0072
2026-05-19 20:12:51,389 - optuna.study.study - INFO - Trial 99 finished with value: 0.007187921036409316 and parameters: {'n_layers': 4, 'embedding_dim': 96, 'lr': 0.0011803584212961892, 'lambda_val': 1.5023379339305939e-06, 'batch_size': 1047, 'optimizer': 'RMSprop'}. Best is trial 38 with value: 0.03486654329558426.
2026-05-19 20:12:56,406 - experiment_functions - INFO - Early stopping at epoch 750. Best Recall: 0.0284
2026-05-19 20:12:56,547 - optuna.study.study - INFO - Trial 100 finished with value: 0.02841494341374408 and parameters: {'n_layers': 1, 'embedding_dim': 96, 'lr': 0.0009789612775081646, 'lambda_val': 4.0443457247377875e-06, 'batch_size': 870, 'optimizer': 'Adam'}. Best is trial 38 with value: 0.03486654329558426.
2026-05-19 20:13:01,961 - experiment_functions - INFO - Early stopping at epoch 750. Best Recall: 0.0296
2026-05-19 20:13:02,053 - optuna.study.study - INFO - Trial 101 finished with value: 0.029627224160439253 and parameters: {'n_layers': 1, 'embedding_dim': 96, 'lr': 0.0008866814605615782, 'lambda_val': 4.13113328497036e-06, 'batch_size': 855, 'optimizer': 'Adam'}. Best is trial 38 with value: 0.03486654329558426.
2026-05-19 20:13:06,991 - experiment_functions - INFO - Early stopping at epoch 750. Best Recall: 0.0217
2026-05-19 20:13:07,094 - optuna.study.study - INFO - Trial 102 finished with value: 0.02170155219647385 and parameters: {'n_layers': 1, 'embedding_dim': 96, 'lr': 0.0015324408088847256, 'lambda_val': 3.5873598540568346e-06, 'batch_size': 862, 'optimizer': 'Adam'}. Best is trial 38 with value: 0.03486654329558426.
2026-05-19 20:13:19,114 - experiment_functions - INFO - Early stopping at epoch 650. Best Recall: 0.0135
2026-05-19 20:13:19,888 - optuna.study.study - INFO - Trial 103 finished with value: 0.013496870042324244 and parameters: {'n_layers': 1, 'embedding_dim': 96, 'lr': 0.0006353935395154769, 'lambda_val': 2.143970068334794e-06, 'batch_size': 3913, 'optimizer': 'Adam'}. Best is trial 38 with value: 0.03486654329558426.
2026-05-19 20:13:29,991 - experiment_functions - INFO - Early stopping at epoch 800. Best Recall: 0.0304
2026-05-19 20:13:30,093 - optuna.study.study - INFO - Trial 104 finished with value: 0.030437358623290292 and parameters: {'n_layers': 1, 'embedding_dim': 96, 'lr': 0.0009041205383633241, 'lambda_val': 5.967741501234841e-06, 'batch_size': 939, 'optimizer': 'Adam'}. Best is trial 38 with value: 0.03486654329558426.
2026-05-19 20:13:34,735 - experiment_functions - INFO - Early stopping at epoch 650. Best Recall: 0.0191
2026-05-19 20:13:34,826 - optuna.study.study - INFO - Trial 105 finished with value: 0.01908485472493982 and parameters: {'n_layers': 1, 'embedding_dim': 96, 'lr': 0.0009726807657390329, 'lambda_val': 2.501562574548977e-06, 'batch_size': 1073, 'optimizer': 'Adam'}. Best is trial 38 with value: 0.03486654329558426.
2026-05-19 20:13:40,293 - experiment_functions - INFO - Early stopping at epoch 800. Best Recall: 0.0217
2026-05-19 20:13:40,393 - optuna.study.study - INFO - Trial 106 finished with value: 0.021653454623954446 and parameters: {'n_layers': 1, 'embedding_dim': 96, 'lr': 0.0008295175650262395, 'lambda_val': 1.4150632751445139e-06, 'batch_size': 942, 'optimizer': 'Adam'}. Best is trial 38 with value: 0.03486654329558426.
2026-05-19 20:13:45,114 - experiment_functions - INFO - Early stopping at epoch 600. Best Recall: 0.0251
2026-05-19 20:13:45,251 - optuna.study.study - INFO - Trial 107 finished with value: 0.02511410392852529 and parameters: {'n_layers': 1, 'embedding_dim': 96, 'lr': 0.0021686381342833853, 'lambda_val': 4.064123672201762e-06, 'batch_size': 990, 'optimizer': 'Adam'}. Best is trial 38 with value: 0.03486654329558426.
2026-05-19 20:13:50,022 - experiment_functions - INFO - Early stopping at epoch 700. Best Recall: 0.0283
2026-05-19 20:13:50,104 - optuna.study.study - INFO - Trial 108 finished with value: 0.028303236004025328 and parameters: {'n_layers': 1, 'embedding_dim': 96, 'lr': 0.0015019903024547224, 'lambda_val': 1.8291381330115918e-06, 'batch_size': 1151, 'optimizer': 'Adam'}. Best is trial 38 with value: 0.03486654329558426.
2026-05-19 20:13:59,609 - experiment_functions - INFO - Early stopping at epoch 600. Best Recall: 0.0223
2026-05-19 20:14:00,371 - optuna.study.study - INFO - Trial 109 finished with value: 0.022333178185923373 and parameters: {'n_layers': 1, 'embedding_dim': 96, 'lr': 0.0015822897900028077, 'lambda_val': 1.8185252944189058e-06, 'batch_size': 1272, 'optimizer': 'Adam'}. Best is trial 38 with value: 0.03486654329558426.
2026-05-19 20:14:07,968 - experiment_functions - INFO - Early stopping at epoch 600. Best Recall: 0.0177
2026-05-19 20:14:08,069 - optuna.study.study - INFO - Trial 110 finished with value: 0.01769375630351513 and parameters: {'n_layers': 1, 'embedding_dim': 96, 'lr': 0.0010547726995777224, 'lambda_val': 1.1224218100795486e-06, 'batch_size': 1145, 'optimizer': 'RMSprop'}. Best is trial 38 with value: 0.03486654329558426.
2026-05-19 20:14:15,648 - experiment_functions - INFO - Early stopping at epoch 1050. Best Recall: 0.0299
2026-05-19 20:14:15,746 - optuna.study.study - INFO - Trial 111 finished with value: 0.029901718795780664 and parameters: {'n_layers': 1, 'embedding_dim': 96, 'lr': 0.0006549767476564874, 'lambda_val': 1.8387419701491012e-06, 'batch_size': 826, 'optimizer': 'Adam'}. Best is trial 38 with value: 0.03486654329558426.
2026-05-19 20:14:22,920 - optuna.study._optimize - INFO - Trial 112 pruned. 
2026-05-19 20:14:27,420 - experiment_functions - INFO - Early stopping at epoch 650. Best Recall: 0.0226
2026-05-19 20:14:27,512 - optuna.study.study - INFO - Trial 113 finished with value: 0.022623422991379462 and parameters: {'n_layers': 1, 'embedding_dim': 96, 'lr': 0.0015137333677194276, 'lambda_val': 1.0045702373526635e-06, 'batch_size': 809, 'optimizer': 'Adam'}. Best is trial 38 with value: 0.03486654329558426.
2026-05-19 20:14:44,579 - experiment_functions - INFO - Early stopping at epoch 750. Best Recall: 0.0238
2026-05-19 20:14:44,680 - optuna.study.study - INFO - Trial 114 finished with value: 0.023794416812263495 and parameters: {'n_layers': 1, 'embedding_dim': 96, 'lr': 0.0008959491915722446, 'lambda_val': 3.491812306775817e-06, 'batch_size': 1030, 'optimizer': 'Adam'}. Best is trial 38 with value: 0.03486654329558426.
2026-05-19 20:14:51,470 - experiment_functions - INFO - Early stopping at epoch 850. Best Recall: 0.0189
2026-05-19 20:14:51,571 - optuna.study.study - INFO - Trial 115 finished with value: 0.018923770544081054 and parameters: {'n_layers': 1, 'embedding_dim': 96, 'lr': 0.0006227682716774303, 'lambda_val': 2.5791767252212513e-06, 'batch_size': 1180, 'optimizer': 'Adam'}. Best is trial 38 with value: 0.03486654329558426.
2026-05-19 20:14:55,292 - experiment_functions - INFO - Early stopping at epoch 500. Best Recall: 0.0018
2026-05-19 20:14:55,401 - optuna.study.study - INFO - Trial 116 finished with value: 0.0018008509960058966 and parameters: {'n_layers': 1, 'embedding_dim': 96, 'lr': 0.000460393060451714, 'lambda_val': 1.3894113615819892e-06, 'batch_size': 1090, 'optimizer': 'SGD'}. Best is trial 38 with value: 0.03486654329558426.
2026-05-19 20:15:01,333 - experiment_functions - INFO - Early stopping at epoch 550. Best Recall: 0.0190
2026-05-19 20:15:01,499 - optuna.study.study - INFO - Trial 117 finished with value: 0.01902240733581527 and parameters: {'n_layers': 1, 'embedding_dim': 64, 'lr': 0.003284975336801397, 'lambda_val': 1.7389347803570716e-06, 'batch_size': 1679, 'optimizer': 'Adam'}. Best is trial 38 with value: 0.03486654329558426.
2026-05-19 20:15:06,346 - experiment_functions - INFO - Early stopping at epoch 600. Best Recall: 0.0197
2026-05-19 20:15:06,458 - optuna.study.study - INFO - Trial 118 finished with value: 0.019662816046459395 and parameters: {'n_layers': 1, 'embedding_dim': 96, 'lr': 0.0010684827802467428, 'lambda_val': 4.77351830142867e-06, 'batch_size': 2717, 'optimizer': 'Adam'}. Best is trial 38 with value: 0.03486654329558426.
2026-05-19 20:15:11,522 - experiment_functions - INFO - Early stopping at epoch 650. Best Recall: 0.0031
2026-05-19 20:15:11,653 - optuna.study.study - INFO - Trial 119 finished with value: 0.0030682889478189264 and parameters: {'n_layers': 1, 'embedding_dim': 96, 'lr': 2.2147794604420636e-05, 'lambda_val': 2.3222806794692292e-06, 'batch_size': 869, 'optimizer': 'Adam'}. Best is trial 38 with value: 0.03486654329558426.
2026-05-19 20:15:16,730 - experiment_functions - INFO - Early stopping at epoch 600. Best Recall: 0.0086
2026-05-19 20:15:16,850 - optuna.study.study - INFO - Trial 120 finished with value: 0.008573733893976105 and parameters: {'n_layers': 3, 'embedding_dim': 96, 'lr': 0.0018958020085866028, 'lambda_val': 1.4187870401921504e-05, 'batch_size': 2155, 'optimizer': 'Adam'}. Best is trial 38 with value: 0.03486654329558426.
2026-05-19 20:15:24,052 - experiment_functions - INFO - Early stopping at epoch 850. Best Recall: 0.0292
2026-05-19 20:15:24,181 - optuna.study.study - INFO - Trial 121 finished with value: 0.029191514115081495 and parameters: {'n_layers': 1, 'embedding_dim': 96, 'lr': 0.0007238787597340583, 'lambda_val': 5.663655669157414e-06, 'batch_size': 712, 'optimizer': 'Adam'}. Best is trial 38 with value: 0.03486654329558426.
2026-05-19 20:15:31,850 - experiment_functions - INFO - Early stopping at epoch 750. Best Recall: 0.0290
2026-05-19 20:15:32,016 - optuna.study.study - INFO - Trial 122 finished with value: 0.02900455103647588 and parameters: {'n_layers': 1, 'embedding_dim': 96, 'lr': 0.0007845692600353517, 'lambda_val': 3.1565428806776533e-06, 'batch_size': 766, 'optimizer': 'Adam'}. Best is trial 38 with value: 0.03486654329558426.
2026-05-19 20:15:38,940 - experiment_functions - INFO - Early stopping at epoch 950. Best Recall: 0.0262
2026-05-19 20:15:39,042 - optuna.study.study - INFO - Trial 123 finished with value: 0.02615704455066326 and parameters: {'n_layers': 1, 'embedding_dim': 96, 'lr': 0.0008196992645548982, 'lambda_val': 3.176810631371356e-06, 'batch_size': 752, 'optimizer': 'Adam'}. Best is trial 38 with value: 0.03486654329558426.
2026-05-19 20:15:44,042 - experiment_functions - INFO - Early stopping at epoch 650. Best Recall: 0.0282
2026-05-19 20:15:45,041 - optuna.study.study - INFO - Trial 124 finished with value: 0.02820394200754139 and parameters: {'n_layers': 1, 'embedding_dim': 96, 'lr': 0.001394842931609435, 'lambda_val': 5.565274067775646e-06, 'batch_size': 822, 'optimizer': 'Adam'}. Best is trial 38 with value: 0.03486654329558426.
2026-05-19 20:15:50,533 - experiment_functions - INFO - Early stopping at epoch 750. Best Recall: 0.0282
2026-05-19 20:15:50,633 - optuna.study.study - INFO - Trial 125 finished with value: 0.02816997297989189 and parameters: {'n_layers': 1, 'embedding_dim': 96, 'lr': 0.0013219323759900896, 'lambda_val': 5.279094047631255e-06, 'batch_size': 722, 'optimizer': 'Adam'}. Best is trial 38 with value: 0.03486654329558426.
2026-05-19 20:15:57,448 - optuna.study._optimize - INFO - Trial 126 pruned. 
2026-05-19 20:16:03,413 - experiment_functions - INFO - Early stopping at epoch 800. Best Recall: 0.0249
2026-05-19 20:16:03,537 - optuna.study.study - INFO - Trial 127 finished with value: 0.024895554331151582 and parameters: {'n_layers': 1, 'embedding_dim': 96, 'lr': 0.0006799953513015786, 'lambda_val': 6.206853676843463e-06, 'batch_size': 813, 'optimizer': 'RMSprop'}. Best is trial 38 with value: 0.03486654329558426.
2026-05-19 20:16:08,154 - experiment_functions - INFO - Early stopping at epoch 700. Best Recall: 0.0179
2026-05-19 20:16:08,245 - optuna.study.study - INFO - Trial 128 finished with value: 0.017901350829550525 and parameters: {'n_layers': 1, 'embedding_dim': 64, 'lr': 0.0009645375502254001, 'lambda_val': 9.925578178246942e-06, 'batch_size': 1924, 'optimizer': 'Adam'}. Best is trial 38 with value: 0.03486654329558426.
2026-05-19 20:16:12,870 - experiment_functions - INFO - Early stopping at epoch 650. Best Recall: 0.0242
2026-05-19 20:16:13,017 - optuna.study.study - INFO - Trial 129 finished with value: 0.024247538982390897 and parameters: {'n_layers': 1, 'embedding_dim': 96, 'lr': 0.0016208462815318029, 'lambda_val': 7.066051075756647e-06, 'batch_size': 867, 'optimizer': 'Adam'}. Best is trial 38 with value: 0.03486654329558426.
2026-05-19 20:16:18,544 - experiment_functions - INFO - Early stopping at epoch 850. Best Recall: 0.0286
2026-05-19 20:16:18,634 - optuna.study.study - INFO - Trial 130 finished with value: 0.028632069780440816 and parameters: {'n_layers': 1, 'embedding_dim': 96, 'lr': 0.0008183263852774938, 'lambda_val': 4.396348087220129e-06, 'batch_size': 696, 'optimizer': 'Adam'}. Best is trial 38 with value: 0.03486654329558426.
2026-05-19 20:16:23,839 - experiment_functions - INFO - Early stopping at epoch 900. Best Recall: 0.0308
2026-05-19 20:16:23,929 - optuna.study.study - INFO - Trial 131 finished with value: 0.030802864728284734 and parameters: {'n_layers': 1, 'embedding_dim': 96, 'lr': 0.0007980748394942361, 'lambda_val': 4.23925612918443e-06, 'batch_size': 687, 'optimizer': 'Adam'}. Best is trial 38 with value: 0.03486654329558426.
2026-05-19 20:16:29,858 - experiment_functions - INFO - Early stopping at epoch 850. Best Recall: 0.0272
2026-05-19 20:16:29,959 - optuna.study.study - INFO - Trial 132 finished with value: 0.02721786631836844 and parameters: {'n_layers': 1, 'embedding_dim': 96, 'lr': 0.0007654704982105415, 'lambda_val': 4.098207601868622e-06, 'batch_size': 690, 'optimizer': 'Adam'}. Best is trial 38 with value: 0.03486654329558426.
2026-05-19 20:16:35,971 - experiment_functions - INFO - Early stopping at epoch 950. Best Recall: 0.0290
2026-05-19 20:16:36,063 - optuna.study.study - INFO - Trial 133 finished with value: 0.028956492086842214 and parameters: {'n_layers': 1, 'embedding_dim': 96, 'lr': 0.0006201524010812265, 'lambda_val': 2.9944797998216016e-06, 'batch_size': 594, 'optimizer': 'Adam'}. Best is trial 38 with value: 0.03486654329558426.
2026-05-19 20:16:45,721 - experiment_functions - INFO - Early stopping at epoch 1900. Best Recall: 0.0288
2026-05-19 20:16:45,813 - optuna.study.study - INFO - Trial 134 finished with value: 0.028839652604157363 and parameters: {'n_layers': 1, 'embedding_dim': 96, 'lr': 0.00044537104355873763, 'lambda_val': 2.9334313773815497e-06, 'batch_size': 609, 'optimizer': 'Adam'}. Best is trial 38 with value: 0.03486654329558426.
2026-05-19 20:16:54,625 - optuna.study._optimize - INFO - Trial 135 pruned. 
2026-05-19 20:17:01,901 - optuna.study._optimize - INFO - Trial 136 pruned. 
2026-05-19 20:17:06,316 - experiment_functions - INFO - Early stopping at epoch 500. Best Recall: 0.0019
2026-05-19 20:17:06,414 - optuna.study.study - INFO - Trial 137 finished with value: 0.0018984996278114668 and parameters: {'n_layers': 1, 'embedding_dim': 96, 'lr': 0.0003385481055974072, 'lambda_val': 3.624891866504129e-06, 'batch_size': 637, 'optimizer': 'SGD'}. Best is trial 38 with value: 0.03486654329558426.
2026-05-19 20:17:16,878 - experiment_functions - INFO - Early stopping at epoch 1750. Best Recall: 0.0319
2026-05-19 20:17:16,968 - optuna.study.study - INFO - Trial 138 finished with value: 0.03188326252795786 and parameters: {'n_layers': 1, 'embedding_dim': 96, 'lr': 0.0005338784856995353, 'lambda_val': 2.2947388963748276e-06, 'batch_size': 582, 'optimizer': 'Adam'}. Best is trial 38 with value: 0.03486654329558426.
2026-05-19 20:17:22,696 - optuna.study._optimize - INFO - Trial 139 pruned. 
2026-05-19 20:17:39,239 - optuna.study._optimize - INFO - Trial 140 pruned. 
2026-05-19 20:17:45,353 - optuna.study._optimize - INFO - Trial 141 pruned. 
2026-05-19 20:17:53,982 - experiment_functions - INFO - Early stopping at epoch 1600. Best Recall: 0.0326
2026-05-19 20:17:54,107 - optuna.study.study - INFO - Trial 142 finished with value: 0.03261753506499388 and parameters: {'n_layers': 1, 'embedding_dim': 96, 'lr': 0.0005298322296423807, 'lambda_val': 7.80244022331706e-06, 'batch_size': 539, 'optimizer': 'Adam'}. Best is trial 38 with value: 0.03486654329558426.
2026-05-19 20:18:00,463 - optuna.study._optimize - INFO - Trial 143 pruned. 
2026-05-19 20:18:11,190 - experiment_functions - INFO - Early stopping at epoch 2150. Best Recall: 0.0302
2026-05-19 20:18:11,292 - optuna.study.study - INFO - Trial 144 finished with value: 0.030201317156627248 and parameters: {'n_layers': 1, 'embedding_dim': 96, 'lr': 0.0002859203453117591, 'lambda_val': 1.0739290872773101e-05, 'batch_size': 632, 'optimizer': 'Adam'}. Best is trial 38 with value: 0.03486654329558426.
2026-05-19 20:18:16,844 - optuna.study._optimize - INFO - Trial 145 pruned. 
2026-05-19 20:18:25,383 - experiment_functions - INFO - Early stopping at epoch 1500. Best Recall: 0.0349
2026-05-19 20:18:25,476 - optuna.study.study - INFO - Trial 146 finished with value: 0.0349361693699917 and parameters: {'n_layers': 1, 'embedding_dim': 96, 'lr': 0.0003300685977993273, 'lambda_val': 8.711020775096468e-06, 'batch_size': 630, 'optimizer': 'Adam'}. Best is trial 146 with value: 0.0349361693699917.
2026-05-19 20:18:31,235 - optuna.study._optimize - INFO - Trial 147 pruned. 
2026-05-19 20:18:36,795 - optuna.study._optimize - INFO - Trial 148 pruned. 
2026-05-19 20:18:42,484 - optuna.study._optimize - INFO - Trial 149 pruned. 
2026-05-19 20:18:47,928 - optuna.study._optimize - INFO - Trial 150 pruned. 
2026-05-19 20:18:53,619 - optuna.study._optimize - INFO - Trial 151 pruned. 
2026-05-19 20:18:59,271 - experiment_functions - INFO - Early stopping at epoch 950. Best Recall: 0.0207
2026-05-19 20:18:59,382 - optuna.study.study - INFO - Trial 152 finished with value: 0.020728205764640566 and parameters: {'n_layers': 1, 'embedding_dim': 96, 'lr': 0.0005482930627094549, 'lambda_val': 7.675992748578073e-06, 'batch_size': 778, 'optimizer': 'Adam'}. Best is trial 146 with value: 0.0349361693699917.
2026-05-19 20:19:17,871 - experiment_functions - INFO - Early stopping at epoch 3750. Best Recall: 0.0328
2026-05-19 20:19:17,974 - optuna.study.study - INFO - Trial 153 finished with value: 0.032800522984075216 and parameters: {'n_layers': 1, 'embedding_dim': 96, 'lr': 0.00031563565266525787, 'lambda_val': 3.2817811651132253e-06, 'batch_size': 513, 'optimizer': 'Adam'}. Best is trial 146 with value: 0.0349361693699917.
2026-05-19 20:19:34,451 - optuna.study._optimize - INFO - Trial 154 pruned. 
2026-05-19 20:19:42,817 - experiment_functions - INFO - Early stopping at epoch 850. Best Recall: 0.0281
